A1: 序号 | B1: 转债代码 | C1: 转债名称 | D1: 股票代码 | E1: 股票名称 | F1: 行业 | G1: 子行业 | H1: 转债价格 | I1: 涨跌 | J1: 日内套利 | K1: 股价 | L1: 涨跌 | M1: 剩余本息 | N1: 转股价格 | O1: 转股溢价率 | P1: 转股价值 | Q1: 距离转股日 | R1: 剩余年限 | S1: 回售年限 | T1: 转债余额 | U1: 转债成交额 | V1: 转债换手率 | W1: 余额/市值 | X1: 余额/股本 | Y1: 股票市值 | Z1: P/B | AA1: 税前收益率 | AB1: 税后收益率 | AC1: 税前回售收益 | AD1: 税后回售收益 | AE1: 回售价值 | AF1: 纯债价值 | AG1: 弹性 | AH1: 信用 | AI1: 折现率 | AJ1: 双低 | AK1: 老式双低 | AL1: 老式排名 | AM1: 新式双低 | AN1: 新式排名 | AO1: MA20乖离 | AP1: 热门度 | AQ1: 转债名称
A2: 292 | B2: 128062 | C2: 亚药转债! | D2: 2370. | E2: 亚太药业 | F2: 医药 | G2: 化学制药 | H2: 95.32 | I2: 4.1999999999999997e-003 | J2: -4.1999999999999997e-003 | K2: 4.31 | L2: -2.0499999999999997e-002 | M2: 119.3 | N2: 16.25 | O2: 2.5899999999999999 | P2: 26.52 | Q2: 已到 | R2: 3.36年 | S2: 1.36年 | T2: 9.63 | U2: 21 | V2: 2.3e-002 | W2: 0.41600000000000004 | X2: 0.11 | Y2: 23 | Z2: 6.39 | AA2: 7.0499999999999993e-002 | AB2: 5.96e-002 | AC2: 5.1100000000000007e-002 | AD2: 4.7199999999999999e-002 | AE2: 80.77 | AF2: 70.73 | AG2: 0 | AH2: B | AI2: 0.1724 | AJ2: =H2+100*O2 -> 354.31999999999999 | AK2: 164.1 | AL2: 236 | AM2: 83.3 | AN2: 277 | AO2: 1.2e-002 | AP2: 90 | AQ2: 亚药转债!
A3: 113 | B3: 128138 | C3: 侨银转债! | D3: 2973. | E3: 侨银股份 | F3: 城市公用 | G3: 城市公用 | H3: 110.201 | I3: 6.8000000000000005e-003 | J3: -6.9999999999999993e-003 | K3: 14.8 | L3: -1.2999999999999999e-003 | M3: 136.5 | N3: 25.33 | O3: 0.8859999999999999 | P3: 58.43 | Q3: 已到 | R3: 4.99年 | S3: 2.99年 | T3: 4.2 | U3: 4.7 | V3: 1.e-002 | W3: 6.9000000000000006e-002 | X3: 4.0999999999999995e-002 | Y3: 60 | Z3: 3.77 | AA3: 4.4000000000000004e-002 | AB3: 3.2400000000000005e-002 | AC3: -1.8200000000000001e-002 | AD3: -2.06e-002 | AE3: 86.31 | AF3: 101.65 | AG3: 0.12 | AH3: AA- | AI3: 6.1399999999999996e-002 | AJ3: =H3+100*O3 -> 198.80099999999999 | AK3: 162 | AL3: 223 | AM3: 60.3 | AN3: 168 | AO3: -1.6e-002 | AP3: 21 | AQ3: 侨银转债!
A4: 147 | B4: 128127 | C4: 文科转债! | D4: 2775. | E4: 文科园林 | F4: 城市公用 | G4: 生态环境 | H4: 99.37 | I4: 7.1999999999999998e-003 | J4: 0. | K4: 3.66 | L4: 1.95e-002 | M4: 120.8 | N4: 4.88 | O4: 0.32500000000000001 | P4: 75 | Q4: 已到 | R4: 4.75年 | S4: 2.75年 | T4: 9.5 | U4: 14 | V4: 1.4999999999999999e-002 | W4: 0.50600000000000001 | X4: 0.38 | Y4: 19 | Z4: 0.88 | AA4: 4.2900000000000001e-002 | AB4: 3.5000000000000003e-002 | AC4: 1.4999999999999999e-002 | AD4: 1.24e-002 | AE4: 87.34 | AF4: 91.6 | AG4: 0.37 | AH4: AA- | AI4: 6.1399999999999996e-002 | AJ4: =H4+100*O4 -> 131.87 | AK4: 123.7 | AL4: 3 | AM4: 32.1 | AN4: 11 | AO4: 4.0999999999999995e-002 | AP4: 71 | AQ4: 文科转债!
A5: 305 | B5: 110052 | C5: 贵广转债! | D5: 600996 | E5: 贵广网络 | F5: 传媒娱乐 | G5: 影视娱乐 | H5: 104.13 | I5: 5.3e-003 | J5: -6.0999999999999995e-003 | K5: 4.68 | L5: -2.3e-002 | M5: 117.7 | N5: 7.94 | O5: 0.76700000000000002 | P5: 58.94 | Q5: 已到 | R5: 3.29年 | S5: 1.29年 | T5: 15.3 | U5: 47 | V5: 2.9999999999999999e-002 | W5: 0.31 | X5: 0.183 | Y5: 49 | Z5: 1.28 | AA5: 3.8900000000000004e-002 | AB5: 2.8900000000000002e-002 | AC5: -7.3000000000000001e-003 | AD5: -1.1399999999999999e-002 | AE5: 98 | AF5: 105.25 | AG5: 0.03 | AH5: AA+ | AI5: 3.5400000000000001e-002 | AJ5: =H5+100*O5 -> 180.82999999999998 | AK5: 149.3 | AL5: 139 | AM5: 44.1 | AN5: 62 | AO5: 4.9000000000000002e-002 | AP5: 22 | AQ5: 贵广转债!
A6: 158 | B6: 113596 | C6: 城地转债! | D6: 603887 | E6: 城地香江 | F6: 通信互联 | G6: 通信设备 | H6: 96.18 | I6: 1.38e-002 | J6: -1.38e-002 | K6: 7.61 | L6: 2.0099999999999996e-002 | M6: 113.1 | N6: 24.26 | O6: 2.0699999999999998 | P6: 31.37 | Q6: 已到 | R6: 4.69年 | S6: 2.69年 | T6: 12 | U6: 50 | V6: 4.4000000000000004e-002 | W6: 0.34999999999999998 | X6: 0.11 | Y6: 34 | Z6: 0.91 | AA6: 3.5900000000000001e-002 | AB6: 3.0499999999999999e-002 | AC6: 2.6099999999999998e-002 | AD6: 2.3599999999999999e-002 | AE6: 87.4 | AF6: 86.06 | AG6: 0 | AH6: AA- | AI6: 6.1399999999999996e-002 | AJ6: =H6+100*O6 -> 303.17999999999995 | AK6: 161 | AL6: 213 | AM6: 73.6 | AN6: 243 | AO6: 2.e-002 | AP6: 36 | AQ6: 城地转债!
A7: 224 | B7: 113569 | C7: 科达转债! | D7: 603660 | E7: 苏州科达 | F7: 通信互联 | G7: 物联网 | H7: 103.94 | I7: 1.11e-002 | J7: -1.09e-002 | K7: 6.29 | L7: 6.4000000000000003e-003 | M7: 120.3 | N7: 14.8 | O7: 1.45 | P7: 42.5 | Q7: 已到 | R7: 4.30年 | S7: 2.30年 | T7: 5.16 | U7: 7.3 | V7: 1.3999999999999999e-002 | W7: 0.16600000000000001 | X7: 7.0999999999999994e-002 | Y7: 31 | Z7: 1.84 | AA7: 3.5400000000000001e-002 | AB7: 2.69e-002 | AC7: -1.1999999999999999e-003 | AD7: -4.0999999999999995e-003 | AE7: 89.63 | AF7: 93.67 | AG7: 0.03 | AH7: AA- | AI7: 6.1399999999999996e-002 | AJ7: =H7+100*O7 -> 248.94 | AK7: 165.4 | AL7: 245 | AM7: 71.7 | AN7: 233 | AO7: 3.7999999999999999e-002 | AP7: 35 | AQ7: 科达转债!
A8: 149 | B8: 110072 | C8: 广汇转债! | D8: 600297 | E8: 广汇汽车 | F8: 汽车 | G8: 分销、售 | H8: 98.03 | I8: 1.7000000000000001e-003 | J8: -1.e-004 | K8: 2.59 | L8: 1.1699999999999999e-002 | M8: 114.3 | N8: 4.03 | O8: 0.52500000000000002 | P8: 64.27 | Q8: 已到 | R8: 4.74年 | S8: 2.74年 | T8: 33.7 | U8: 26 | V8: 8.0000000000000002e-003 | W8: 0.16 | X8: 0.10300000000000001 | Y8: 210 | Z8: 0.51 | AA8: 3.3399999999999999e-002 | AB8: 2.7799999999999998e-002 | AC8: 1.66e-002 | AD8: 1.46e-002 | AE8: 92.96 | AF8: 97.17 | AG8: 0.14 | AH8: AA+ | AI8: 3.5400000000000001e-002 | AJ8: =H8+100*O8 -> 150.53 | AK8: 131.8 | AL8: 12 | AM8: 34.6 | AN8: 17 | AO8: -2.7000000000000003e-002 | AP8: 78 | AQ8: 广汇转债!
A9: 166 | B9: 113595 | C9: 花王转债! | D9: 603007 | E9: ST花王 | F9: 城市公用 | G9: 生态环境 | H9: 107.44 | I9: 8.199999999999999e-003 | J9: -5.6000000000000008e-003 | K9: 3.3 | L9: 1.8500000000000003e-002 | M9: 124.8 | N9: 6.92 | O9: 1.25 | P9: 47.69 | Q9: 已到 | R9: 4.67年 | S9: 2.67年 | T9: 3.3 | U9: 504 | V9: 1.4099999999999999 | W9: 0.29799999999999999 | X9: 0.14199999999999999 | Y9: 11 | Z9: 1.03 | AA9: 3.3300000000000003e-002 | AB9: 2.41e-002 | AC9: -1.2500000000000001e-002 | AD9: -1.4999999999999999e-002 | AE9: 78.93 | AF9: 80.01 | AG9: 0.14 | AH9: BBB+ | AI9: 0.1024 | AJ9: =H9+100*O9 -> 232.44 | AK9: 167.2 | AL9: 253 | AM9: 87.2 | AN9: 285 | AO9: 5.5e-002 | AP9: 50 | AQ9: 花王转债!
A10: 183 | B10: 113589 | C10: 天创转债! | D10: 603608 | E10: 天创时尚 | F10: 服装纺织 | G10: 鞋服行业 | H10: 100.07 | I10: 6.4000000000000003e-003 | J10: -6.3e-003 | K10: 5.42 | L10: 7.4000000000000003e-003 | M10: 114.9 | N10: 12.29 | O10: 1.27 | P10: 44.1 | Q10: 已到 | R10: 4.59年 | S10: 2.59年 | T10: 6 | U10: 9.2 | V10: 1.4999999999999999e-002 | W10: 0.25800000000000001 | X10: 0.114 | Y10: 23 | Z10: 1.47 | AA10: 3.1200000000000002e-002 | AB10: 2.5099999999999997e-002 | AC10: 1.21e-002 | AD10: 9.5999999999999992e-003 | AE10: 92.79 | AF10: 96.15 | AG10: 0.02 | AH10: AA | AI10: 4.0399999999999998e-002 | AJ10: =H10+100*O10 -> 227.06999999999999 | AK10: 156 | AL10: 183 | AM10: 59.9 | AN10: 166 | AO10: -4.0000000000000001e-003 | AP10: 38 | AQ10: 天创转债!
A11: 77 | B11: 113042 | C11: 上银转债! | D11: 601229 | E11: 上海银行 | F11: 金融 | G11: 银行行业 | H11: 104.29 | I11: 1.e-003 | J11: 1.e-004 | K11: 7.25 | L11: 5.5000000000000005e-003 | M11: 120.9 | N11: 10.63 | O11: 0.52900000000000003 | P11: 68.2 | Q11: 已到 | R11: 5.18年 | S11: 无权 | T11: 200 | U11: 114 | V11: 5.0000000000000001e-003 | W11: 0.19399999999999998 | X11: 0.13200000000000001 | Y11: 1030. | Z11: 0.57 | AA11: 2.9900000000000003e-002 | AB11: 2.2499999999999999e-002 | AC11: 无权 | AD11: 无权 | AE11: 无权 | AF11: 101.71 | AG11: 0.19 | AH11: AAA | AI11: 3.5000000000000003e-002 | AJ11: =H11+100*O11 -> 157.19 | AK11: 140.4 | AL11: 44 | AM11: 38.7 | AN11: 28 | AO11: -8.0000000000000002e-003 | AP11: 13 | AQ11: 上银转债!
A12: 245 | B12: 110064 | C12: 建工转债! | D12: 600939 | E12: 重庆建工 | F12: 建筑 | G12: 建筑工程 | H12: 106.6 | I12: 5.8999999999999999e-003 | J12: -4.3e-003 | K12: 3.41 | L12: 8.8999999999999999e-003 | M12: 119.8 | N12: 4.53 | O12: 0.41600000000000004 | P12: 75.28 | Q12: 已到 | R12: 4年30天 | S12: 2年30天 | T12: 16.6 | U12: 3.4 | V12: 2.e-003 | W12: 0.26800000000000002 | X12: 0.20199999999999999 | Y12: 62 | Z12: 0.85 | AA12: 2.98e-002 | AB12: 2.1000000000000001e-002 | AC12: -1.0500000000000001e-002 | AD12: -1.3999999999999999e-002 | AE12: 96.39 | AF12: 104.33 | AG12: 0.19 | AH12: AA+ | AI12: 3.5400000000000001e-002 | AJ12: =H12+100*O12 -> 148.19999999999999 | AK12: 137.9 | AL12: 28 | AM12: 33.6 | AN12: 13 | AO12: 1.4999999999999999e-002 | AP12: 45 | AQ12: 建工转债!
A13: 321 | B13: 113519 | C13: 长久转债! | D13: 603569 | E13: 长久物流 | F13: 交通运输 | G13: 物流业 | H13: 108.6 | I13: 8.5000000000000006e-003 | J13: -8.0000000000000002e-003 | K13: 6.48 | L13: 1.09e-002 | M13: 118.3 | N13: 11.04 | O13: 0.84999999999999998 | P13: 58.7 | Q13: 已到 | R13: 2.96年 | S13: 0.96年 | T13: 6.97 | U13: 1.9 | V13: 3.0000000000000001e-003 | W13: 0.192 | X13: 0.113 | Y13: 36 | Z13: 1.71 | AA13: 2.9700000000000001e-002 | AB13: 1.8600000000000002e-002 | AC13: -5.57e-002 | AD13: -5.8600000000000006e-002 | AE13: 97.49 | AF13: 105.75 | AG13: 0.04 | AH13: AA | AI13: 3.9100000000000003e-002 | AJ13: =H13+100*O13 -> 193.59999999999999 | AK13: 158.5 | AL13: 198 | AM13: 52.8 | AN13: 119 | AO13: 2.e-002 | AP13: 22 | AQ13: 长久转债!
A14: 260 | B14: 110059 | C14: 浦发转债! | D14: 600000 | E14: 浦发银行 | F14: 金融 | G14: 银行行业 | H14: 104.4 | I14: 1.4000000000000002e-003 | J14: -5.9999999999999995e-004 | K14: 8.65 | L14: 1.0500000000000001e-002 | M14: 116.8 | N14: 13.97 | O14: 0.68599999999999994 | P14: 61.92 | Q14: 已到 | R14: 3.94年 | S14: 无权 | T14: 500 | U14: 191 | V14: 4.0000000000000001e-003 | W14: 0.19699999999999998 | X14: 0.122 | Y14: 2539. | Z14: 0.46 | AA14: 2.9700000000000001e-002 | AB14: 2.18e-002 | AC14: 无权 | AD14: 无权 | AE14: 无权 | AF14: 102.98 | AG14: 0.08 | AH14: AAA | AI14: 3.3399999999999999e-002 | AJ14: =H14+100*O14 -> 173. | AK14: 146.9 | AL14: 117 | AM14: 43.9 | AN14: 58 | AO14: -8.0000000000000002e-003 | AP14: 55 | AQ14: 浦发转债!
A15: 220 | B15: 128100 | C15: 搜特转债! | D15: 2503. | E15: 搜于特 | F15: 服装纺织 | G15: 服装行业 | H15: 103.397 | I15: 2.0999999999999999e-003 | J15: -2.0999999999999999e-003 | K15: 1.52 | L15: 0. | M15: 116.9 | N15: 1.62 | O15: 0.10199999999999999 | P15: 93.83 | Q15: 已到 | R15: 4.31年 | S15: 2.31年 | T15: 7.99 | U15: 31 | V15: 3.7000000000000005e-002 | W15: 0.17000000000000001 | X15: 0.16 | Y15: 47 | Z15: 3.11 | AA15: 2.9500000000000002e-002 | AB15: 2.23e-002 | AC15: 0. | AD15: -2.7000000000000001e-003 | AE15: 85.18 | AF15: 83.76 | AG15: 0.63 | AH15: A | AI15: 8.2400000000000001e-002 | AJ15: =H15+100*O15 -> 113.59700000000001 | AK15: 113 | AL15: 1 | AM15: 27.8 | AN15: 2 | AO15: 1.7000000000000001e-002 | AP15: 83 | AQ15: 搜特转债!
A16: 178 | B16: 128117 | C16: 道恩转债! | D16: 2838. | E16: 道恩股份 | F16: 化工 | G16: 橡胶塑料 | H16: 107.93 | I16: 8.199999999999999e-003 | J16: -5.8999999999999999e-003 | K16: 15.47 | L16: 2.18e-002 | M16: 123.1 | N16: 28.82 | O16: 1.01 | P16: 53.68 | Q16: 已到 | R16: 4.61年 | S16: 2.61年 | T16: 3.6 | U16: 5.2 | V16: 1.3999999999999999e-002 | W16: 5.7000000000000002e-002 | X16: 3.1e-002 | Y16: 63 | Z16: 3.32 | AA16: 2.9500000000000002e-002 | AB16: 2.07e-002 | AC16: -1.5300000000000001e-002 | AD16: -1.7600000000000001e-002 | AE16: 87.77 | AF16: 94.02 | AG16: 0.1 | AH16: AA- | AI16: 6.1399999999999996e-002 | AJ16: =H16+100*O16 -> 208.93000000000001 | AK16: 162.2 | AL16: 225 | AM16: 68.2 | AN16: 217 | AO16: 2.5000000000000001e-002 | AP16: 25 | AQ16: 道恩转债!
A17: 200 | B17: 113578 | C17: 全筑转债! | D17: 603030 | E17: 全筑股份 | F17: 建筑 | G17: 装饰工程 | H17: 104.39 | I17: 6.4000000000000003e-003 | J17: -5.5000000000000005e-003 | K17: 3.46 | L17: 5.7999999999999996e-003 | M17: 117.9 | N17: 5.25 | O17: 0.58399999999999996 | P17: 65.9 | Q17: 已到 | R17: 4.41年 | S17: 2.41年 | T17: 3.84 | U17: 11 | V17: 2.7999999999999997e-002 | W17: 0.191 | X17: 0.126 | Y17: 20 | Z17: 0.92 | AA17: 2.8500000000000001e-002 | AB17: 2.12e-002 | AC17: -3.7000000000000002e-003 | AD17: -6.3e-003 | AE17: 93.45 | AF17: 99.35 | AG17: 0.15 | AH17: AA | AI17: 4.0399999999999998e-002 | AJ17: =H17+100*O17 -> 162.78999999999999 | AK17: 142.9 | AL17: 64 | AM17: 43.5 | AN17: 53 | AO17: 2.8999999999999998e-002 | AP17: 29 | AQ17: 全筑转债!
A18: 306 | B18: 113021 | C18: 中信转债! | D18: 601998 | E18: 中信银行 | F18: 金融 | G18: 银行行业 | H18: 107.99 | I18: 8.0000000000000004e-004 | J18: -4.0000000000000002e-004 | K18: 4.52 | L18: 4.4000000000000003e-003 | M18: 118 | N18: 6.73 | O18: 0.60799999999999998 | P18: 67.16 | Q18: 已到 | R18: 3.29年 | S18: 无权 | T18: 400 | U18: 22 | V18: 1.e-003 | W18: 0.18100000000000002 | X18: 0.121 | Y18: 2212. | Z18: 0.45 | AA18: 2.8300000000000002e-002 | AB18: 1.8200000000000001e-002 | AC18: 无权 | AD18: 无权 | AE18: 无权 | AF18: 106.3 | AG18: 0.09 | AH18: AAA | AI18: 3.3399999999999999e-002 | AJ18: =H18+100*O18 -> 168.78999999999999 | AK18: 148.8 | AL18: 132 | AM18: 42.5 | AN18: 46 | AO18: -4.0000000000000001e-003 | AP18: 38 | AQ18: 中信转债!
A19: 184 | B19: 123056 | C19: 雪榕转债! | D19: 300511 | E19: 雪榕生物 | F19: 农业 | G19: 种植业 | H19: 107.1 | I19: 2.8000000000000004e-003 | J19: -1.1999999999999999e-003 | K19: 7.44 | L19: 8.1000000000000013e-003 | M19: 120.7 | N19: 11.77 | O19: 0.69400000000000006 | P19: 63.21 | Q19: 已到 | R19: 4.59年 | S19: 2.59年 | T19: 5.84 | U19: 10 | V19: 1.6e-002 | W19: 0.17800000000000002 | X19: 0.11199999999999999 | Y19: 33 | Z19: 1.84 | AA19: 2.69e-002 | AB19: 1.89e-002 | AC19: -1.2e-002 | AD19: -1.4499999999999999e-002 | AE19: 88.06 | AF19: 92.36 | AG19: 0.2 | AH19: AA- | AI19: 6.1399999999999996e-002 | AJ19: =H19+100*O19 -> 176.5 | AK19: 151 | AL19: 153 | AM19: 58.6 | AN19: 156 | AO19: -1.4999999999999999e-002 | AP19: 18 | AQ19: 雪榕转债!
A20: 276 | B20: 128069 | C20: 华森转债! | D20: 2907. | E20: 华森制药 | F20: 医药 | G20: 化学制药 | H20: 108.933 | I20: 8.6e-003 | J20: -7.1999999999999998e-003 | K20: 11.71 | L20: 9.4999999999999998e-003 | M20: 119.3 | N20: 18.01 | O20: 0.67500000000000004 | P20: 65.02 | Q20: 已到 | R20: 3.59年 | S20: 1.59年 | T20: 3 | U20: 4.9 | V20: 1.4999999999999999e-002 | W20: 6.4000000000000001e-002 | X20: 4.0999999999999995e-002 | Y20: 47 | Z20: 3.97 | AA20: 2.6099999999999998e-002 | AB20: 1.6500000000000001e-002 | AC20: -3.27e-002 | AD20: -3.56e-002 | AE20: 92.65 | AF20: 96.71 | AG20: 0.15 | AH20: AA- | AI20: 6.1399999999999996e-002 | AJ20: =H20+100*O20 -> 176.43299999999999 | AK20: 152.8 | AL20: 169 | AM20: 56.1 | AN20: 146 | AO20: 2.e-002 | AP20: 42 | AQ20: 华森转债!
A21: 334 | B21: 127007 | C21: 湖广转债! | D21: 665. | E21: 湖北广电 | F21: 传媒娱乐 | G21: 影视娱乐 | H21: 104.33 | I21: 7.0999999999999995e-003 | J21: -7.4999999999999997e-003 | K21: 3.62 | L21: -8.199999999999999e-003 | M21: 111.3 | N21: 5.58 | O21: 0.60799999999999998 | P21: 64.87 | Q21: 已到 | R21: 2.60年 | S21: 0.60年 | T21: 12.2 | U21: 48 | V21: 3.7999999999999999e-002 | W21: 0.34200000000000003 | X21: 0.222 | Y21: 36 | Z21: 0.63 | AA21: 2.5600000000000001e-002 | AB21: 1.7299999999999999e-002 | AC21: -3.15e-002 | AD21: -3.5900000000000001e-002 | AE21: 99.21 | AF21: 102.15 | AG21: 0.06 | AH21: AA+ | AI21: 3.4099999999999998e-002 | AJ21: =H21+100*O21 -> 165.13 | AK21: 143.8 | AL21: 76 | AM21: 41.6 | AN21: 40 | AO21: 6.6000000000000003e-002 | AP21: 22 | AQ21: 湖广转债!
A22: 363 | B22: 128015 | C22: 久其转债!! | D22: 2279. | E22: 久其软件 | F22: 计算机及 | G22: 软件开发 | H22: 105.404 | I22: 8.199999999999999e-003 | J22: -8.199999999999999e-003 | K22: 4.52 | L22: 1.1200000000000002e-002 | M22: 109.5 | N22: 6.97 | O22: 0.625 | P22: 64.85 | Q22: 已到 | R22: 1.55年 | S22: 回售内 | T22: 7.79 | U22: 18 | V22: 2.2000000000000002e-002 | W22: 0.24299999999999999 | X22: 0.157 | Y22: 32 | Z22: 4.01 | AA22: 2.52e-002 | AB22: 1.3500000000000002e-002 | AC22: 回售内 | AD22: 回售内 | AE22: 100.25 | AF22: 98.55 | AG22: 0 | AH22: A+ | AI22: 7.1099999999999997e-002 | AJ22: =H22+100*O22 -> 167.904 | AK22: 146 | AL22: 107 | AM22: 45.7 | AN22: 73 | AO22: 5.7000000000000002e-002 | AP22: 69 | AQ22: 久其转债!!
A23: 290 | B23: 128063 | C23: 未来转债! | D23: 2631. | E23: 德尔未来 | F23: 其他 | G23: 家居用品 | H23: 117.599 | I23: 8.6999999999999994e-003 | J23: -7.4999999999999997e-003 | K23: 7.42 | L23: 4.0999999999999995e-003 | M23: 127.5 | N23: 8.64 | O23: 0.36899999999999999 | P23: 85.88 | Q23: 已到 | R23: 3.37年 | S23: 2.37年 | T23: 6.29 | U23: 15 | V23: 2.e-002 | W23: 0.129 | X23: 0.111 | Y23: 49 | Z23: 2.85 | AA23: 2.5099999999999997e-002 | AB23: 1.1299999999999999e-002 | AC23: -3.32e-002 | AD23: -3.8900000000000004e-002 | AE23: 93.36 | AF23: 104.99 | AG23: 0.31 | AH23: AA- | AI23: 6.1399999999999996e-002 | AJ23: =H23+100*O23 -> 154.499 | AK23: 149.3 | AL23: 140 | AM23: 44.3 | AN23: 63 | AO23: 2.4e-002 | AP23: 36 | AQ23: 未来转债!
A24: 177 | B24: 128118 | C24: 瀛通转债! | D24: 2861. | E24: 瀛通通讯 | F24: 电子 | G24: 电子产品 | H24: 109 | I24: 1.3999999999999999e-002 | J24: -1.32e-002 | K24: 12.15 | L24: 5.7999999999999996e-003 | M24: 121.7 | N24: 21.24 | O24: 0.90500000000000003 | P24: 57.2 | Q24: 已到 | R24: 4.61年 | S24: 2.61年 | T24: 3 | U24: 7 | V24: 2.1000000000000001e-002 | W24: 0.157 | X24: 8.9999999999999997e-002 | Y24: 19 | Z24: 1.82 | AA24: 2.4799999999999999e-002 | AB24: 1.6500000000000001e-002 | AC24: -1.6200000000000003e-002 | AD24: -1.9099999999999999e-002 | AE24: 88.45 | AF24: 93.08 | AG24: 0.15 | AH24: AA- | AI24: 6.1399999999999996e-002 | AJ24: =H24+100*O24 -> 199.5 | AK24: 160.8 | AL24: 211 | AM24: 67.7 | AN24: 214 | AO24: 5.2999999999999999e-002 | AP24: 22 | AQ24: 瀛通转债!
A25: 193 | B25: 113584 | C25: 家悦转债! | D25: 603708 | E25: 家家悦 | F25: 商业零售 | G25: 超市 | H25: 103.27 | I25: 6.1999999999999998e-003 | J25: -6.3e-003 | K25: 14.78 | L25: -8.1000000000000013e-003 | M25: 114.9 | N25: 37.53 | O25: 1.6200000000000001 | P25: 39.38 | Q25: 已到 | R25: 4.54年 | S25: 2.54年 | T25: 6.45 | U25: 3.3 | V25: 5.0000000000000001e-003 | W25: 7.2000000000000008e-002 | X25: 2.7999999999999997e-002 | Y25: 90 | Z25: 3.5 | AA25: 2.4300000000000002e-002 | AB25: 1.8200000000000001e-002 | AC25: 5.0000000000000001e-004 | AD25: -2.e-003 | AE25: 92.98 | AF25: 96.35 | AG25: 0.01 | AH25: AA | AI25: 4.0399999999999998e-002 | AJ25: =H25+100*O25 -> 265.26999999999998 | AK25: 167.2 | AL25: 252 | AM25: 70.8 | AN25: 228 | AO25: -1.8000000000000002e-002 | AP25: 16 | AQ25: 家悦转债!
A26: 40 | B26: 127034 | C26: 绿茵转债! | D26: 2887. | E26: 绿茵生态 | F26: 城市公用 | G26: 生态环境 | H26: 105.054 | I26: 4.5999999999999999e-003 | J26: -2.7000000000000001e-003 | K26: 9.54 | L26: 4.1999999999999997e-003 | M26: 119 | N26: 12.38 | O26: 0.36299999999999999 | P26: 77.06 | Q26: 已到 | R26: 5.44年 | S26: 3.44年 | T26: 7.12 | U26: 5.1 | V26: 6.9999999999999993e-003 | W26: 0.23899999999999999 | X26: 0.184 | Y26: 30 | Z26: 1.46 | AA26: 2.3700000000000002e-002 | AB26: 1.7399999999999999e-002 | AC26: -3.0000000000000001e-003 | AD26: -5.1000000000000004e-003 | AE26: 83.56 | AF26: 85.96 | AG26: 0.45 | AH26: AA- | AI26: 6.3e-002 | AJ26: =H26+100*O26 -> 141.35399999999998 | AK26: 133 | AL26: 14 | AM26: 47.1 | AN26: 82 | AO26: 1.7000000000000001e-002 | AP26: 33 | AQ26: 绿茵转债!
A27: 154 | B27: 128125 | C27: 华阳转债! | D27: 2949. | E27: 华阳国际 | F27: 建筑 | G27: 建筑工程 | H27: 106.3 | I27: 1.03e-002 | J27: -7.7000000000000002e-003 | K27: 14.37 | L27: 1.7000000000000001e-002 | M27: 118.1 | N27: 25.39 | O27: 0.878 | P27: 56.6 | Q27: 已到 | R27: 4.69年 | S27: 2.69年 | T27: 4.5 | U27: 3.1 | V27: 6.0000000000000001e-003 | W27: 0.16 | X27: 8.9999999999999997e-002 | Y27: 28 | Z27: 2.09 | AA27: 2.3099999999999999e-002 | AB27: 1.6200000000000003e-002 | AC27: -9.5999999999999992e-003 | AD27: -1.1899999999999999e-002 | AE27: 87.37 | AF27: 89.81 | AG27: 0.15 | AH27: AA- | AI27: 6.1399999999999996e-002 | AJ27: =H27+100*O27 -> 194.09999999999999 | AK27: 156 | AL27: 182 | AM27: 66.2 | AN27: 207 | AO27: 3.9e-002 | AP27: 11 | AQ27: 华阳转债!
A28: 137 | B28: 128132 | C28: 交建转债! | D28: 2941. | E28: 新疆交建 | F28: 建筑 | G28: 建筑工程 | H28: 105.012 | I28: 8.3000000000000001e-003 | J28: -5.6000000000000008e-003 | K28: 11.47 | L28: 2.1400000000000002e-002 | M28: 116.9 | N28: 18.53 | O28: 0.69599999999999995 | P28: 61.9 | Q28: 已到 | R28: 4.82年 | S28: 2.82年 | T28: 8.49 | U28: 35 | V28: 3.9e-002 | W28: 0.115 | X28: 7.0999999999999994e-002 | Y28: 74 | Z28: 2.86 | AA28: 2.29e-002 | AB28: 1.6500000000000001e-002 | AC28: -5.1999999999999998e-003 | AD28: -7.4000000000000003e-003 | AE28: 91.96 | AF28: 96.94 | AG28: 0.13 | AH28: AA | AI28: 4.0399999999999998e-002 | AJ28: =H28+100*O28 -> 174.61199999999999 | AK28: 148.1 | AL28: 128 | AM28: 51.2 | AN28: 109 | AO28: 4.4999999999999998e-002 | AP28: 25 | AQ28: 交建转债!
A29: 163 | B29: 113037 | C29: 紫银转债! | D29: 601860 | E29: 紫金银行 | F29: 金融 | G29: 银行行业 | H29: 104.31 | I29: 1.8e-003 | J29: 1.e-003 | K29: 3.19 | L29: 9.4999999999999998e-003 | M29: 115.6 | N29: 4.05 | O29: 0.32400000000000001 | P29: 78.77 | Q29: 已到 | R29: 4.67年 | S29: 无权 | T29: 45 | U29: 172 | V29: 3.7000000000000005e-002 | W29: 0.38500000000000001 | X29: 0.30299999999999999 | Y29: 117 | Z29: 0.76 | AA29: 2.2799999999999997e-002 | AB29: 1.66e-002 | AC29: 无权 | AD29: 无权 | AE29: 无权 | AF29: 98.62 | AG29: 0.3 | AH29: AA+ | AI29: 3.5400000000000001e-002 | AJ29: =H29+100*O29 -> 136.71000000000001 | AK29: 129.9 | AL29: 10 | AM29: 31.2 | AN29: 6 | AO29: -6.0000000000000001e-003 | AP29: 27 | AQ29: 紫银转债!
A30: 132 | B30: 113604 | C30: 多伦转债! | D30: 603528 | E30: 多伦科技 | F30: 计算机及 | G30: 软件开发 | H30: 105.98 | I30: 6.0000000000000001e-003 | J30: -5.6000000000000008e-003 | K30: 6.61 | L30: 1.5e-003 | M30: 116.9 | N30: 10.4 | O30: 0.66700000000000004 | P30: 63.56 | Q30: 已到 | R30: 4.90年 | S30: 2.90年 | T30: 6.4 | U30: 3.1 | V30: 5.0000000000000001e-003 | W30: 0.155 | X30: 9.8000000000000004e-002 | Y30: 41 | Z30: 2.53 | AA30: 2.06e-002 | AB30: 1.44e-002 | AC30: -8.1000000000000013e-003 | AD30: -1.0200000000000001e-002 | AE30: 86.28 | AF30: 87.81 | AG30: 0.25 | AH30: AA- | AI30: 6.1399999999999996e-002 | AJ30: =H30+100*O30 -> 172.68000000000001 | AK30: 148.4 | AL30: 131 | AM30: 60.6 | AN30: 172 | AO30: 8.0000000000000002e-003 | AP30: 10 | AQ30: 多伦转债!
A31: 204 | B31: 123049 | C31: 维尔转债! | D31: 300190 | E31: 维尔利 | F31: 城市公用 | G31: 三废处理 | H31: 114 | I31: 4.4000000000000003e-003 | J31: -4.4000000000000003e-003 | K31: 5.98 | L31: 0. | M31: 124.3 | N31: 7.38 | O31: 0.40700000000000003 | P31: 81.03 | Q31: 已到 | R31: 4.39年 | S31: 2.39年 | T31: 9.17 | U31: 1.7 | V31: 2.e-003 | W31: 0.19600000000000001 | X31: 0.159 | Y31: 47 | Z31: 1.07 | AA31: 2.0400000000000001e-002 | AB31: 1.09e-002 | AC31: -3.4799999999999998e-002 | AD31: -3.78e-002 | AE31: 89.64 | AF31: 96.3 | AG31: 0.38 | AH31: AA- | AI31: 6.1399999999999996e-002 | AJ31: =H31+100*O31 -> 154.69999999999999 | AK31: 147 | AL31: 118 | AM31: 50.7 | AN31: 105 | AO31: 4.8000000000000001e-002 | AP31: 19 | AQ31: 维尔转债!
A32: 75 | B32: 123096 | C32: 思创转债! | D32: 300078 | E32: 思创医惠 | F32: 通信互联 | G32: 物联网 | H32: 111.98 | I32: 1.6299999999999999e-002 | J32: -1.43e-002 | K32: 6.65 | L32: 4.5000000000000005e-003 | M32: 124 | N32: 8.27 | O32: 0.39299999999999996 | P32: 80.41 | Q32: 已到 | R32: 5.18年 | S32: 3.18年 | T32: 8.17 | U32: 16 | V32: 1.7000000000000001e-002 | W32: 0.14199999999999999 | X32: 0.114 | Y32: 58 | Z32: 2.11 | AA32: 2.0299999999999999e-002 | AB32: 1.23e-002 | AC32: -2.23e-002 | AD32: -2.4399999999999998e-002 | AE32: 84.88 | AF32: 90.97 | AG32: 0.44 | AH32: AA- | AI32: 6.3e-002 | AJ32: =H32+100*O32 -> 151.28 | AK32: 143.5 | AL32: 73 | AM32: 52.6 | AN32: 117 | AO32: 4.8000000000000001e-002 | AP32: 13 | AQ32: 思创转债!
A33: 295 | B33: 113530 | C33: 大丰转债! | D33: 603081 | E33: 大丰实业 | F33: 建筑 | G33: 装饰工程 | H33: 113.36 | I33: 1.77e-002 | J33: -1.e-003 | K33: 12.71 | L33: 0.10000000000000001 | M33: 121 | N33: 16.49 | O33: 0.47100000000000003 | P33: 77.08 | Q33: 已到 | R33: 3.35年 | S33: 1.35年 | T33: 6.3 | U33: 540 | V33: 0.73299999999999998 | W33: 0.12300000000000001 | X33: 9.5000000000000001e-002 | Y33: 51 | Z33: 2.18 | AA33: 2.0099999999999996e-002 | AB33: 9.1000000000000004e-003 | AC33: -6.2300000000000001e-002 | AD33: -6.5799999999999997e-002 | AE33: 96.98 | AF33: 106.28 | AG33: 0.17 | AH33: AA | AI33: 4.0399999999999998e-002 | AJ33: =H33+100*O33 -> 160.46000000000001 | AK33: 149.6 | AL33: 142 | AM33: 43.4 | AN33: 51 | AO33: 0.185 | AP33: 29 | AQ33: 大丰转债!
A34: 201 | B34: 113573 | C34: 纵横转债! | D34: 603602 | E34: 纵横通信 | F34: 通信互联 | G34: 通信设备 | H34: 114.22 | I34: 4.6300000000000001e-002 | J34: -3.4099999999999998e-002 | K34: 10.25 | L34: 9.98e-002 | M34: 124.2 | N34: 18.78 | O34: 1.0900000000000001 | P34: 54.58 | Q34: 已到 | R34: 4.41年 | S34: 2.41年 | T34: 2.7 | U34: 678 | V34: 2.1200000000000001 | W34: 0.129 | X34: 7.0000000000000007e-002 | Y34: 21 | Z34: 2.94 | AA34: 1.9699999999999999e-002 | AB34: 1.0200000000000001e-002 | AC34: -3.5699999999999996e-002 | AD34: -3.8599999999999995e-002 | AE34: 87.17 | AF34: 91.98 | AG34: 0.12 | AH34: A+ | AI34: 7.2400000000000006e-002 | AJ34: =H34+100*O34 -> 223.22000000000003 | AK34: 173.9 | AL34: 269 | AM34: 81.9 | AN34: 271 | AO34: 0.129 | AP34: 27 | AQ34: 纵横转债!
A35: 41 | B35: 113624 | C35: 正川转债! | D35: 603976 | E35: 正川股份 | F35: 医药 | G35: 医药行业 | H35: 109.61 | I35: 1.0200000000000001e-002 | J35: -7.4000000000000003e-003 | K35: 33.08 | L35: 6.7000000000000002e-003 | M35: 121.6 | N35: 46.69 | O35: 0.54700000000000004 | P35: 70.85 | Q35: 已到 | R35: 5.44年 | S35: 3.44年 | T35: 4.05 | U35: 9.9 | V35: 2.2000000000000002e-002 | W35: 8.1000000000000003e-002 | X35: 5.7000000000000002e-002 | Y35: 50 | Z35: 4.53 | AA35: 1.9699999999999999e-002 | AB35: 1.2800000000000001e-002 | AC35: -1.3000000000000001e-002 | AD35: -1.55e-002 | AE35: 81.15 | AF35: 83.29 | AG35: 0.43 | AH35: A+ | AI35: 7.400000000000001e-002 | AJ35: =H35+100*O35 -> 164.31 | AK35: 148.4 | AL35: 130 | AM35: 65.1 | AN35: 197 | AO35: -1.e-002 | AP35: 20 | AQ35: 正川转债!
A36: 173 | B36: 127019 | C36: 国城转债! | D36: 688. | E36: 国城矿业 | F36: 有色金属 | G36: 锌铅镍锡 | H36: 105.079 | I36: 5.5000000000000005e-003 | J36: -2.0000000000000001e-004 | K36: 14.05 | L36: 2.86e-002 | M36: 114.8 | N36: 21.06 | O36: 0.57499999999999996 | P36: 66.71 | Q36: 已到 | R36: 4.65年 | S36: 2.65年 | T36: 8.5 | U36: 61 | V36: 6.8000000000000005e-002 | W36: 5.2999999999999999e-002 | X36: 3.5000000000000003e-002 | Y36: 160 | Z36: 6.61 | AA36: 1.9599999999999999e-002 | AB36: 1.37e-002 | AC36: -6.0999999999999995e-003 | AD36: -8.3000000000000001e-003 | AE36: 92.48 | AF36: 95.83 | AG36: 0.19 | AH36: AA | AI36: 4.0399999999999998e-002 | AJ36: =H36+100*O36 -> 162.57899999999998 | AK36: 143.4 | AL36: 70 | AM36: 47.6 | AN36: 86 | AO36: 0.317 | AP36: 49 | AQ36: 国城转债!
A37: 145 | B37: 113601 | C37: 塞力转债! | D37: 603716 | E37: 塞力医疗 | F37: 医药 | G37: 医药商业 | H37: 110.86 | I37: 7.0999999999999995e-003 | J37: -7.4000000000000003e-003 | K37: 14.24 | L37: -7.000000000000001e-004 | M37: 120.8 | N37: 16.98 | O37: 0.32200000000000001 | P37: 83.86 | Q37: 已到 | R37: 4.75年 | S37: 2.75年 | T37: 5.43 | U37: 5.9 | V37: 1.e-002 | W37: 0.18600000000000003 | X37: 0.156 | Y37: 29 | Z37: 1.92 | AA37: 1.8600000000000002e-002 | AB37: 1.09e-002 | AC37: -2.2799999999999997e-002 | AD37: -2.5099999999999997e-002 | AE37: 87.32 | AF37: 91.58 | AG37: 0.45 | AH37: AA- | AI37: 6.1399999999999996e-002 | AJ37: =H37+100*O37 -> 143.06 | AK37: 137.9 | AL37: 27 | AM37: 46.3 | AN37: 79 | AO37: 4.0999999999999995e-002 | AP37: 37 | AQ37: 塞力转债!
A38: 112 | B38: 123076 | C38: 强力转债! | D38: 300429 | E38: 强力新材 | F38: 化工 | G38: 化工 | H38: 107.868 | I38: 1.7600000000000001e-002 | J38: -1.1899999999999999e-002 | K38: 12.47 | L38: 2.0499999999999997e-002 | M38: 118.5 | N38: 18.94 | O38: 0.63800000000000001 | P38: 65.84 | Q38: 已到 | R38: 4.998年 | S38: 2.998年 | T38: 8.5 | U38: 9.8 | V38: 1.1000000000000001e-002 | W38: 0.13200000000000001 | X38: 8.6999999999999994e-002 | Y38: 64 | Z38: 3.55 | AA38: 1.8600000000000002e-002 | AB38: 1.2199999999999999e-002 | AC38: -1.3300000000000001e-002 | AD38: -1.5300000000000001e-002 | AE38: 85.39 | AF38: 87.53 | AG38: 0.28 | AH38: AA- | AI38: 6.3e-002 | AJ38: =H38+100*O38 -> 171.66800000000001 | AK38: 149.9 | AL38: 146 | AM38: 62.4 | AN38: 183 | AO38: 2.9999999999999999e-002 | AP38: 19 | AQ38: 强力转债!
A39: 182 | B39: 127018 | C39: 本钢转债! | D39: 761. | E39: 本钢板材 | F39: 钢铁 | G39: 炼钢 | H39: 117.92 | I39: 1.83e-002 | J39: -1.01e-002 | K39: 4.07 | L39: 2.52e-002 | M39: 128 | N39: 4.55 | O39: 0.318 | P39: 89.45 | Q39: 已到 | R39: 4.61年 | S39: 2.61年 | T39: 56.3 | U39: 82 | V39: 1.2e-002 | W39: 0.33700000000000002 | X39: 0.30099999999999999 | Y39: 167 | Z39: 0.73 | AA39: 1.8500000000000003e-002 | AB39: 8.3000000000000001e-003 | AC39: -3.8699999999999998e-002 | AD39: -4.2500000000000003e-002 | AE39: 96.74 | AF39: 110.53 | AG39: 0.33 | AH39: AAA | AI39: 3.3399999999999999e-002 | AJ39: =H39+100*O39 -> 149.72 | AK39: 146.4 | AL39: 112 | AM39: 35.9 | AN39: 20 | AO39: -5.5999999999999994e-002 | AP39: 63 | AQ39: 本钢转债!
A40: 216 | B40: 110068 | C40: 龙净转债! | D40: 600388 | E40: 龙净环保 | F40: 城市公用 | G40: 三废处理 | H40: 106.25 | I40: 3.4000000000000002e-003 | J40: -2.7000000000000001e-003 | K40: 8.3 | L40: 2.3999999999999998e-003 | M40: 114.8 | N40: 10.55 | O40: 0.35100000000000003 | P40: 78.67 | Q40: 已到 | R40: 4.34年 | S40: 2.34年 | T40: 20 | U40: 17 | V40: 8.0000000000000002e-003 | W40: 0.22500000000000001 | X40: 0.17699999999999999 | Y40: 89 | Z40: 1.38 | AA40: 1.84e-002 | AB40: 1.21e-002 | AC40: -1.1200000000000002e-002 | AD40: -1.38e-002 | AE40: 94.75 | AF40: 99.02 | AG40: 0.28 | AH40: AA+ | AI40: 3.5400000000000001e-002 | AJ40: =H40+100*O40 -> 141.34999999999999 | AK40: 133.8 | AL40: 17 | AM40: 34.8 | AN40: 18 | AO40: 1.4999999999999999e-002 | AP40: 38 | AQ40: 龙净转债!
A41: 212 | B41: 127016 | C41: 鲁泰转债! | D41: 726. | E41: 鲁 泰Ａ | F41: 服装纺织 | G41: 纺织行业 | H41: 107.158 | I41: 5.1999999999999998e-003 | J41: -4.4000000000000003e-003 | K41: 6.18 | L41: 4.8999999999999998e-003 | M41: 115.9 | N41: 8.71 | O41: 0.51000000000000001 | P41: 70.95 | Q41: 已到 | R41: 4.38年 | S41: 2.38年 | T41: 14 | U41: 1 | V41: 1.e-003 | W41: 0.25700000000000001 | X41: 0.182 | Y41: 55 | Z41: 0.69 | AA41: 1.84e-002 | AB41: 1.18e-002 | AC41: -1.3999999999999999e-002 | AD41: -1.6500000000000001e-002 | AE41: 94.71 | AF41: 99.83 | AG41: 0.17 | AH41: AA+ | AI41: 3.5400000000000001e-002 | AJ41: =H41+100*O41 -> 158.15800000000002 | AK41: 143.4 | AL41: 68 | AM41: 43.5 | AN41: 54 | AO41: 1.3000000000000001e-002 | AP41: 21 | AQ41: 鲁泰转债!
A42: 155 | B42: 113597 | C42: 佳力转债! | D42: 603912 | E42: 佳力图 | F42: 机械装备 | G42: 专用设备 | H42: 114.04 | I42: 2.3e-003 | J42: -7.000000000000001e-004 | K42: 14 | L42: 9.3999999999999986e-003 | M42: 124 | N42: 23.15 | O42: 0.8859999999999999 | P42: 60.48 | Q42: 已到 | R42: 4.69年 | S42: 2.69年 | T42: 3 | U42: 6.8 | V42: 2.e-002 | W42: 9.9000000000000005e-002 | X42: 5.9999999999999998e-002 | Y42: 30 | Z42: 3.17 | AA42: 1.84e-002 | AB42: 9.5999999999999992e-003 | AC42: -3.2300000000000002e-002 | AD42: -3.4799999999999998e-002 | AE42: 87.8 | AF42: 94.34 | AG42: 0.17 | AH42: AA- | AI42: 6.1399999999999996e-002 | AJ42: =H42+100*O42 -> 202.63999999999999 | AK42: 167.6 | AL42: 254 | AM42: 73.3 | AN42: 241 | AO42: 2.7999999999999997e-002 | AP42: 19 | AQ42: 佳力转债!
A43: 213 | B43: 113033 | C43: 利群转债! | D43: 601366 | E43: 利群股份 | F43: 商业零售 | G43: 商场 | H43: 106.32 | I43: 5.1000000000000004e-003 | J43: -4.5000000000000005e-003 | K43: 5.98 | L43: 1.7000000000000001e-003 | M43: 114.9 | N43: 7.01 | O43: 0.24600000000000002 | P43: 85.31 | Q43: 已到 | R43: 4.36年 | S43: 2.36年 | T43: 18 | U43: 25 | V43: 1.3000000000000001e-002 | W43: 0.34999999999999998 | X43: 0.29799999999999999 | Y43: 51 | Z43: 1.18 | AA43: 1.83e-002 | AB43: 1.2e-002 | AC43: -1.1000000000000001e-002 | AD43: -1.3600000000000001e-002 | AE43: 93.64 | AF43: 97.03 | AG43: 0.38 | AH43: AA | AI43: 4.0399999999999998e-002 | AJ43: =H43+100*O43 -> 130.91999999999999 | AK43: 127.3 | AL43: 5 | AM43: 30.3 | AN43: 5 | AO43: -5.0000000000000001e-003 | AP43: 70 | AQ43: 利群转债!
A44: 229 | B44: 113566 | C44: 翔港转债! | D44: 603499 | E44: 翔港科技 | F44: 造纸包装 | G44: 包装材料 | H44: 115.05 | I44: 6.8999999999999999e-003 | J44: -1.6000000000000001e-003 | K44: 7.95 | L44: 1.5300000000000001e-002 | M44: 124 | N44: 10.77 | O44: 0.55899999999999994 | P44: 73.82 | Q44: 已到 | R44: 4.27年 | S44: 2.27年 | T44: 1.61 | U44: 2.9 | V44: 1.6e-002 | W44: 0.10099999999999999 | X44: 7.400000000000001e-002 | Y44: 16 | Z44: 2.82 | AA44: 1.8100000000000002e-002 | AB44: 8.5000000000000006e-003 | AC44: -4.0399999999999998e-002 | AD44: -4.3499999999999997e-002 | AE44: 88.04 | AF44: 92.69 | AG44: 0.35 | AH44: A+ | AI44: 7.2400000000000006e-002 | AJ44: =H44+100*O44 -> 170.94999999999999 | AK44: 156.3 | AL44: 184 | AM44: 63.6 | AN44: 188 | AO44: 6.5000000000000002e-002 | AP44: 27 | AQ44: 翔港转债!
A45: 5 | B45: 123126 | C45: 瑞丰转债! | D45: 300243 | E45: 瑞丰高材 | F45: 化工 | G45: 橡胶塑料 | H45: 117.091 | I45: 1.11e-002 | J45: -4.1999999999999997e-003 | K45: 14.31 | L45: 1.3500000000000002e-002 | M45: 129.6 | N45: 17.8 | O45: 0.45600000000000002 | P45: 80.39 | Q45: 3月26天 | R45: 5.81年 | S45: 3.81年 | T45: 3.4 | U45: 7.9 | V45: 2.e-002 | W45: 0.10199999999999999 | X45: 8.199999999999999e-002 | Y45: 33 | Z45: 4.09 | AA45: 1.8100000000000002e-002 | AB45: 9.7000000000000003e-003 | AC45: -2.3399999999999997e-002 | AD45: -2.6499999999999999e-002 | AE45: 80.67 | AF45: 86.7 | AG45: 0.51 | AH45: A+ | AI45: 7.400000000000001e-002 | AJ45: =H45+100*O45 -> 162.691 | AK45: 153.8 | AL45: 171 | AM45: 67.1 | AN45: 210 | AO45: 5.7999999999999996e-002 | AP45: 5 | AQ45: 瑞丰转债!
A46: 176 | B46: 113036 | C46: 宁建转债! | D46: 601789 | E46: 宁波建工 | F46: 建筑 | G46: 建筑工程 | H46: 107.99 | I46: 1.29e-002 | J46: -1.0800000000000001e-002 | K46: 3.57 | L46: 8.5000000000000006e-003 | M46: 116.9 | N46: 4.76 | O46: 0.44 | P46: 75 | Q46: 已到 | R46: 4.62年 | S46: 2.62年 | T46: 5.4 | U46: 2.1 | V46: 4.0000000000000001e-003 | W46: 0.155 | X46: 0.11599999999999999 | Y46: 35 | Z46: 1.07 | AA46: 1.7600000000000001e-002 | AB46: 1.1000000000000001e-002 | AC46: -1.5600000000000001e-002 | AD46: -1.7899999999999999e-002 | AE46: 92.67 | AF46: 97.69 | AG46: 0.25 | AH46: AA | AI46: 4.0399999999999998e-002 | AJ46: =H46+100*O46 -> 151.99000000000001 | AK46: 141 | AL46: 49 | AM46: 43.3 | AN46: 50 | AO46: 1.2e-002 | AP46: 13 | AQ46: 宁建转债!
A47: 79 | B47: 123093 | C47: 金陵转债! | D47: 300651 | E47: 金陵体育 | F47: 其他 | G47: 文化教育 | H47: 118.586 | I47: 6.9999999999999993e-003 | J47: -2.2000000000000001e-003 | K47: 28.64 | L47: 2.29e-002 | M47: 129.3 | N47: 49.19 | O47: 1.04 | P47: 58.22 | Q47: 已到 | R47: 5.16年 | S47: 3.16年 | T47: 2.5 | U47: 17 | V47: 5.7000000000000002e-002 | W47: 6.8000000000000005e-002 | X47: 3.9e-002 | Y47: 37 | Z47: 5.29 | AA47: 1.7399999999999999e-002 | AB47: 8.0000000000000002e-003 | AC47: -3.2500000000000001e-002 | AD47: -3.6000000000000004e-002 | AE47: 84.19 | AF47: 90.5 | AG47: 0.21 | AH47: A+ | AI47: 7.400000000000001e-002 | AJ47: =H47+100*O47 -> 222.58600000000001 | AK47: 178.9 | AL47: 284 | AM47: 88.4 | AN47: 288 | AO47: 6.9000000000000006e-002 | AP47: 9 | AQ47: 金陵转债!
A48: 283 | B48: 128066 | C48: 亚泰转债! | D48: 2811. | E48: 郑中设计 | F48: 建筑 | G48: 装饰工程 | H48: 110.46 | I48: 1.3300000000000001e-002 | J48: -1.2199999999999999e-002 | K48: 8.55 | L48: 2.3e-003 | M48: 116.7 | N48: 9.27 | O48: 0.19800000000000001 | P48: 92.23 | Q48: 已到 | R48: 3.41年 | S48: 1.41年 | T48: 4.8 | U48: 11 | V48: 2.1000000000000001e-002 | W48: 0.20800000000000002 | X48: 0.192 | Y48: 23 | Z48: 1.66 | AA48: 1.66e-002 | AB48: 7.8000000000000005e-003 | AC48: -4.3700000000000003e-002 | AD48: -4.7300000000000002e-002 | AE48: 93.91 | AF48: 95.71 | AG48: 0.47 | AH48: AA- | AI48: 6.1399999999999996e-002 | AJ48: =H48+100*O48 -> 130.25999999999999 | AK48: 128.7 | AL48: 8 | AM48: 33 | AN48: 12 | AO48: 7.0000000000000007e-002 | AP48: 66 | AQ48: 亚泰转债!
A49: 30 | B49: 113625 | C49: 江山转债! | D49: 603208 | E49: 江山欧派 | F49: 其他 | G49: 家居用品 | H49: 113.94 | I49: 1.3999999999999999e-002 | J49: -7.8000000000000005e-003 | K49: 60.2 | L49: 2.3799999999999998e-002 | M49: 124 | N49: 96.33 | O49: 0.82299999999999995 | P49: 62.49 | Q49: 28天 | R49: 5.56年 | S49: 3.56年 | T49: 5.83 | U49: 18 | V49: 2.7000000000000003e-002 | W49: 9.1999999999999998e-002 | X49: 5.7999999999999996e-002 | Y49: 63 | Z49: 3.44 | AA49: 1.5600000000000001e-002 | AB49: 8.3000000000000001e-003 | AC49: -2.46e-002 | AD49: -2.6600000000000002e-002 | AE49: 82.97 | AF49: 88.92 | AG49: 0.26 | AH49: AA- | AI49: 6.3e-002 | AJ49: =H49+100*O49 -> 196.24000000000001 | AK49: 165.4 | AL49: 246 | AM49: 76.5 | AN49: 252 | AO49: 7.400000000000001e-002 | AP49: 5 | AQ49: 江山转债!
A50: 291 | B50: 113532 | C50: 海环转债! | D50: 603817 | E50: 海峡环保 | F50: 城市公用 | G50: 三废处理 | H50: 106.78 | I50: 3.0999999999999999e-003 | J50: -1.5e-003 | K50: 5.77 | L50: 6.9999999999999993e-003 | M50: 112.3 | N50: 7.63 | O50: 0.41200000000000003 | P50: 75.62 | Q50: 已到 | R50: 3.36年 | S50: 1.36年 | T50: 4.59 | U50: 3.7 | V50: 8.0000000000000002e-003 | W50: 0.17699999999999999 | X50: 0.13400000000000001 | Y50: 26 | Z50: 1.43 | AA50: 1.54e-002 | AB50: 8.6e-003 | AC50: -2.4700000000000003e-002 | AD50: -2.8199999999999999e-002 | AE50: 96.8 | AF50: 98.57 | AG50: 0.22 | AH50: AA | AI50: 4.0399999999999998e-002 | AJ50: =H50+100*O50 -> 147.98000000000002 | AK50: 137.9 | AL50: 29 | AM50: 39.4 | AN50: 30 | AO50: 3.5000000000000003e-002 | AP50: 30 | AQ50: 海环转债!
A51: 318 | B51: 128049 | C51: 华源转债! | D51: 2787. | E51: 华源控股 | F51: 造纸包装 | G51: 包装材料 | H51: 109.548 | I51: 6.4000000000000003e-003 | J51: -3.2000000000000002e-003 | K51: 5.82 | L51: 1.04e-002 | M51: 114.5 | N51: 7.37 | O51: 0.38700000000000001 | P51: 78.97 | Q51: 已到 | R51: 3年7天 | S51: 1年7天 | T51: 3.63 | U51: 2.3 | V51: 6.0000000000000001e-003 | W51: 0.19699999999999998 | X51: 0.156 | Y51: 18 | Z51: 1.2 | AA51: 1.5100000000000001e-002 | AB51: 6.3e-003 | AC51: -5.2499999999999998e-002 | AD51: -5.6799999999999996e-002 | AE51: 95.9 | AF51: 96.07 | AG51: 0.31 | AH51: AA- | AI51: 6.1399999999999996e-002 | AJ51: =H51+100*O51 -> 148.24799999999999 | AK51: 140.1 | AL51: 42 | AM51: 44.1 | AN51: 60 | AO51: 6.6000000000000003e-002 | AP51: 42 | AQ51: 华源转债!
A52: 234 | B52: 113563 | C52: 柳药转债! | D52: 603368 | E52: 柳药股份 | F52: 医药 | G52: 医药商业 | H52: 106.31 | I52: 3.4000000000000002e-003 | J52: -2.8000000000000004e-003 | K52: 15.75 | L52: 3.8e-003 | M52: 112.9 | N52: 23.87 | O52: 0.61099999999999999 | P52: 65.98 | Q52: 已到 | R52: 4年57天 | S52: 2年57天 | T52: 8.02 | U52: 5.7 | V52: 6.9999999999999993e-003 | W52: 0.14000000000000001 | X52: 9.3000000000000013e-002 | Y52: 57 | Z52: 1.09 | AA52: 1.49e-002 | AB52: 9.1000000000000004e-003 | AC52: -1.2e-002 | AD52: -1.4800000000000001e-002 | AE52: 94.41 | AF52: 96.12 | AG52: 0.15 | AH52: AA | AI52: 4.0399999999999998e-002 | AJ52: =H52+100*O52 -> 167.41 | AK52: 146.6 | AL52: 115 | AM52: 50.5 | AN52: 104 | AO52: 9.0000000000000011e-003 | AP52: 17 | AQ52: 柳药转债!
A53: 110 | B53: 123077 | C53: 汉得转债! | D53: 300170 | E53: 汉得信息 | F53: 计算机及 | G53: 软件开发 | H53: 116.786 | I53: -3.8e-003 | J53: -2.e-003 | K53: 8.11 | L53: -1.8200000000000001e-002 | M53: 125.5 | N53: 9.69 | O53: 0.39500000000000002 | P53: 83.69 | Q53: 已到 | R53: 5年3.1天 | S53: 3年3.1天 | T53: 9.37 | U53: 23 | V53: 2.1000000000000001e-002 | W53: 0.13100000000000001 | X53: 0.109 | Y53: 72 | Z53: 2.29 | AA53: 1.4800000000000001e-002 | AB53: 6.1999999999999998e-003 | AC53: -3.6699999999999997e-002 | AD53: -3.8900000000000004e-002 | AE53: 91.26 | AF53: 102.57 | AG53: 0.32 | AH53: AA | AI53: 4.2000000000000003e-002 | AJ53: =H53+100*O53 -> 156.286 | AK53: 149.9 | AL53: 145 | AM53: 47.3 | AN53: 83 | AO53: 8.9999999999999997e-002 | AP53: 16 | AQ53: 汉得转债!
A54: 210 | B54: 128105 | C54: 长集转债! | D54: 2616. | E54: 长青集团 | F54: 城市公用 | G54: 三废处理 | H54: 107.9 | I54: 6.8000000000000005e-003 | J54: -6.0000000000000001e-003 | K54: 5.72 | L54: 3.4999999999999996e-003 | M54: 114.9 | N54: 7.91 | O54: 0.49200000000000005 | P54: 72.31 | Q54: 已到 | R54: 4.38年 | S54: 2.38年 | T54: 8 | U54: 3.2 | V54: 4.0000000000000001e-003 | W54: 0.188 | X54: 0.13600000000000001 | Y54: 42 | Z54: 1.7 | AA54: 1.47e-002 | AB54: 8.5000000000000006e-003 | AC54: -1.67e-002 | AD54: -1.9199999999999998e-002 | AE54: 93.56 | AF54: 96.94 | AG54: 0.23 | AH54: AA | AI54: 4.0399999999999998e-002 | AJ54: =H54+100*O54 -> 157.10000000000002 | AK54: 143.5 | AL54: 72 | AM54: 46.5 | AN54: 81 | AO54: 4.0000000000000001e-003 | AP54: 18 | AQ54: 长集转债!
A55: 172 | B55: 123059 | C55: 银信转债! | D55: 300231 | E55: 银信科技 | F55: 计算机及 | G55: 软件开发 | H55: 115.74 | I55: 9.8999999999999991e-003 | J55: -4.4000000000000003e-003 | K55: 8.33 | L55: 1.2199999999999999e-002 | M55: 123.7 | N55: 9.72 | O55: 0.35100000000000003 | P55: 85.7 | Q55: 已到 | R55: 4.65年 | S55: 2.65年 | T55: 3.91 | U55: 3.1 | V55: 6.9999999999999993e-003 | W55: 0.106 | X55: 9.0999999999999998e-002 | Y55: 37 | Z55: 2.63 | AA55: 1.47e-002 | AB55: 6.0000000000000001e-003 | AC55: -3.8800000000000001e-002 | AD55: -4.1200000000000001e-002 | AE55: 87.76 | AF55: 94.32 | AG55: 0.45 | AH55: AA- | AI55: 6.1399999999999996e-002 | AJ55: =H55+100*O55 -> 150.84 | AK55: 145.8 | AL55: 103 | AM55: 51.5 | AN55: 111 | AO55: 5.0999999999999997e-002 | AP55: 18 | AQ55: 银信转债!
A56: 160 | B56: 128123 | C56: 国光转债! | D56: 2749. | E56: 国光股份 | F56: 化工 | G56: 农化 | H56: 108.211 | I56: 1.9e-003 | J56: -3.4000000000000002e-003 | K56: 8.7 | L56: -5.6999999999999993e-003 | M56: 115.7 | N56: 13.49 | O56: 0.67799999999999994 | P56: 64.49 | Q56: 已到 | R56: 4.68年 | S56: 2.68年 | T56: 3.2 | U56: 3.9 | V56: 1.1000000000000001e-002 | W56: 8.4000000000000005e-002 | X56: 5.4000000000000006e-002 | Y56: 38 | Z56: 2.89 | AA56: 1.47e-002 | AB56: 8.6e-003 | AC56: -1.52e-002 | AD56: -1.7600000000000001e-002 | AE56: 87.58 | AF56: 88.08 | AG56: 0.25 | AH56: AA- | AI56: 6.1399999999999996e-002 | AJ56: =H56+100*O56 -> 176.011 | AK56: 151.9 | AL56: 164 | AM56: 63.8 | AN56: 189 | AO56: 5.0000000000000003e-002 | AP56: 13 | AQ56: 国光转债!
A57: 94 | B57: 113044 | C57: 大秦转债! | D57: 601006 | E57: 大秦铁路 | F57: 铁路 | G57: 铁路运输 | H57: 106.21 | I57: 1.5e-003 | J57: -2.0000000000000001e-004 | K57: 6.22 | L57: 3.2000000000000002e-003 | M57: 114.1 | N57: 7.18 | O57: 0.22600000000000001 | P57: 86.63 | Q57: 已到 | R57: 5年24天 | S57: 3年24天 | T57: 320 | U57: 76 | V57: 2.e-003 | W57: 0.34600000000000003 | X57: 0.29999999999999999 | Y57: 925 | Z57: 0.77 | AA57: 1.46e-002 | AB57: 9.3999999999999986e-003 | AC57: -6.7000000000000002e-003 | AD57: -9.1000000000000004e-003 | AE57: 93.09 | AF57: 96.22 | AG57: 0.41 | AH57: AAA | AI57: 3.5000000000000003e-002 | AJ57: =H57+100*O57 -> 128.81 | AK57: 125.8 | AL57: 4 | AM57: 29.6 | AN57: 4 | AO57: -8.0000000000000002e-003 | AP57: 28 | AQ57: 大秦转债!
A58: 139 | B58: 123065 | C58: 宝莱转债! | D58: 300246 | E58: 宝莱特 | F58: 医药 | G58: 医疗器械 | H58: 113.228 | I58: 8.8999999999999999e-003 | J58: -8.199999999999999e-003 | K58: 17.33 | L58: 1.52e-002 | M58: 121 | N58: 40.14 | O58: 1.6200000000000001 | P58: 43.17 | Q58: 已到 | R58: 4.79年 | S58: 2.79年 | T58: 2.19 | U58: 8.3 | V58: 3.3000000000000002e-002 | W58: 8.5999999999999993e-002 | X58: 3.7000000000000005e-002 | Y58: 25 | Z58: 2.9 | AA58: 1.43e-002 | AB58: 6.6e-003 | AC58: -2.8799999999999999e-002 | AD58: -3.1300000000000001e-002 | AE58: 87.28 | AF58: 91.53 | AG58: 0.05 | AH58: AA- | AI58: 6.1399999999999996e-002 | AJ58: =H58+100*O58 -> 275.22800000000001 | AK58: 183.3 | AL58: 291 | AM58: 91.7 | AN58: 299 | AO58: 3.5000000000000003e-002 | AP58: 21 | AQ58: 宝莱转债!
A59: 151 | B59: 127021 | C59: 特发转2! | D59: 70. | E59: 特发信息 | F59: 通信互联 | G59: 通信设备 | H59: 107.35 | I59: 7.4000000000000003e-003 | J59: -7.1999999999999998e-003 | K59: 6.33 | L59: 8.0000000000000002e-003 | M59: 113 | N59: 12.33 | O59: 1.0900000000000001 | P59: 51.34 | Q59: 已到 | R59: 3.71年 | S59: 1.71年 | T59: 5.5 | U59: 2.3 | V59: 4.0000000000000001e-003 | W59: 0.105 | X59: 5.4000000000000006e-002 | Y59: 52 | Z59: 1.8 | AA59: 1.41e-002 | AB59: 7.7000000000000002e-003 | AC59: -2.8199999999999999e-002 | AD59: -2.9999999999999999e-002 | AE59: 94.48 | AF59: 97.73 | AG59: 0.03 | AH59: AA | AI59: 4.0399999999999998e-002 | AJ59: =H59+100*O59 -> 216.35000000000002 | AK59: 163.4 | AL59: 231 | AM59: 65.6 | AN59: 201 | AO59: 2.8999999999999998e-002 | AP59: 15 | AQ59: 特发转2!
A60: 249 | B60: 128083 | C60: 新北转债! | D60: 2376. | E60: 新北洋 | F60: 电子 | G60: 电子产品 | H60: 109.299 | I60: 1.1000000000000001e-002 | J60: -4.8999999999999998e-003 | K60: 8.8 | L60: 2.3300000000000001e-002 | M60: 114.9 | N60: 11.45 | O60: 0.42200000000000004 | P60: 76.86 | Q60: 已到 | R60: 4年22天 | S60: 2年22天 | T60: 8.77 | U60: 5.8 | V60: 6.0000000000000001e-003 | W60: 0.14999999999999999 | X60: 0.115 | Y60: 59 | Z60: 1.74 | AA60: 1.2699999999999999e-002 | AB60: 6.0000000000000001e-003 | AC60: -2.4900000000000002e-002 | AD60: -2.7699999999999999e-002 | AE60: 94.77 | AF60: 98.19 | AG60: 0.26 | AH60: AA | AI60: 4.0399999999999998e-002 | AJ60: =H60+100*O60 -> 151.49900000000002 | AK60: 141.7 | AL60: 52 | AM60: 43.5 | AN60: 55 | AO60: 7.400000000000001e-002 | AP60: 21 | AQ60: 新北转债!
A61: 221 | B61: 123044 | C61: 红相转债!! | D61: 300427 | E61: 红相股份 | F61: 能源电力 | G61: 电力设备 | H61: 118.752 | I61: 8.8999999999999999e-003 | J61: -3.4999999999999996e-003 | K61: 13.93 | L61: 1.83e-002 | M61: 125 | N61: 18.67 | O61: 0.59200000000000008 | P61: 74.61 | Q61: 已到 | R61: 4.31年 | S61: 2.31年 | T61: 5.5 | U61: 10 | V61: 1.6e-002 | W61: 0.11 | X61: 8.199999999999999e-002 | Y61: 50 | Z61: 2.13 | AA61: 1.23e-002 | AB61: 2.5000000000000001e-003 | AC61: -5.0999999999999997e-002 | AD61: -5.4199999999999998e-002 | AE61: 90.37 | AF61: 97.4 | AG61: 0.3 | AH61: AA- | AI61: 6.1399999999999996e-002 | AJ61: =H61+100*O61 -> 177.952 | AK61: 162.9 | AL61: 228 | AM61: 65.5 | AN61: 199 | AO61: 7.2999999999999995e-002 | AP61: 21 | AQ61: 红相转债!!
A62: 58 | B62: 123106 | C62: 正丹转债! | D62: 300641 | E62: 正丹股份 | F62: 化工 | G62: 化工 | H62: 117.9 | I62: 9.3999999999999986e-003 | J62: 9.7000000000000003e-003 | K62: 6.87 | L62: 3.6200000000000003e-002 | M62: 125.5 | N62: 7.5 | O62: 0.28699999999999998 | P62: 91.6 | Q62: 已到 | R62: 5.34年 | S62: 3.34年 | T62: 3.2 | U62: 8.6 | V62: 2.3e-002 | W62: 9.5000000000000001e-002 | X62: 8.6999999999999994e-002 | Y62: 34 | Z62: 2.35 | AA62: 1.2e-002 | AB62: 4.0000000000000001e-003 | AC62: -3.5900000000000001e-002 | AD62: -3.7900000000000003e-002 | AE62: 84.01 | AF62: 91.16 | AG62: 0.53 | AH62: AA- | AI62: 6.3e-002 | AJ62: =H62+100*O62 -> 146.59999999999999 | AK62: 144.2 | AL62: 86 | AM62: 53 | AN62: 122 | AO62: 5.0999999999999997e-002 | AP62: 17 | AQ62: 正丹转债!
A63: 351 | B63: 123004 | C63: 铁汉转债! | D63: 300197 | E63: 节能铁汉 | F63: 城市公用 | G63: 生态环境 | H63: 106.32 | I63: 8.3000000000000001e-003 | J63: -7.9000000000000008e-003 | K63: 2.81 | L63: 3.5999999999999999e-003 | M63: 108.8 | N63: 3.82 | O63: 0.44500000000000001 | P63: 73.56 | Q63: 已到 | R63: 2年28天 | S63: 28天 | T63: 8.03 | U63: 22 | V63: 2.5000000000000001e-002 | W63: 0.10099999999999999 | X63: 7.400000000000001e-002 | Y63: 79 | Z63: 1.24 | AA63: 1.1399999999999999e-002 | AB63: 3.3e-003 | AC63: -0.20300000000000001 | AD63: -0.21600000000000003 | AE63: 100.61 | AF63: 100.62 | AG63: 0.09 | AH63: AA | AI63: 3.9100000000000003e-002 | AJ63: =H63+100*O63 -> 150.81999999999999 | AK63: 139.1 | AL63: 37 | AM63: 38.5 | AN63: 27 | AO63: 8.0000000000000002e-003 | AP63: 47 | AQ63: 铁汉转债!
A64: 45 | B64: 110080 | C64: 东湖转债 | D64: 600133 | E64: 东湖高新 | F64: 建筑 | G64: 建筑工程 | H64: 108.94 | I64: 3.8e-003 | J64: -2.9999999999999997e-004 | K64: 5.27 | L64: 7.6e-003 | M64: 115.1 | N64: 6.05 | O64: 0.251 | P64: 87.11 | Q64: 已到 | R64: 5.39年 | S64: 3.39年 | T64: 15.5 | U64: 56 | V64: 3.3000000000000002e-002 | W64: 0.37 | X64: 0.32200000000000001 | Y64: 42 | Z64: 0.75 | AA64: 1.04e-002 | AB64: 5.4000000000000003e-003 | AC64: -1.41e-002 | AD64: -1.6e-002 | AE64: 89.61 | AF64: 92.6 | AG64: 0.46 | AH64: AA | AI64: 4.2000000000000003e-002 | AJ64: =H64+100*O64 -> 134.03999999999999 | AK64: 130.8 | AL64: 11 | AM64: 38.2 | AN64: 25 | AO64: -2.9999999999999999e-002 | AP64: 29 | AQ64: 东湖转债
A65: 186 | B65: 128114 | C65: 正邦转债! | D65: 2157. | E65: 正邦科技 | F65: 农业 | G65: 畜牧业 | H65: 109.8 | I65: 6.4000000000000003e-003 | J65: -1.18e-002 | K65: 10.68 | L65: -2.4700000000000003e-002 | M65: 114.9 | N65: 14.77 | O65: 0.51800000000000002 | P65: 72.31 | Q65: 已到 | R65: 4.57年 | S65: 2.57年 | T65: 16 | U65: 22 | V65: 1.2e-002 | W65: 4.8000000000000001e-002 | X65: 3.4000000000000002e-002 | Y65: 336 | Z65: 2.59 | AA65: 1.0200000000000001e-002 | AB65: 4.3e-003 | AC65: -2.18e-002 | AD65: -2.4199999999999999e-002 | AE65: 94.08 | AF65: 98.32 | AG65: 0.22 | AH65: AA+ | AI65: 3.5400000000000001e-002 | AJ65: =H65+100*O65 -> 161.59999999999999 | AK65: 147.3 | AL65: 121 | AM65: 49 | AN65: 99 | AO65: 2.3e-002 | AP65: 23 | AQ65: 正邦转债!
A66: 44 | B66: 127033 | C66: 中装转2! | D66: 2822. | E66: 中装建设 | F66: 建筑 | G66: 装饰工程 | H66: 110.99 | I66: 7.9000000000000008e-003 | J66: -5.5000000000000005e-003 | K66: 5.22 | L66: 5.7999999999999996e-003 | M66: 117.1 | N66: 6.28 | O66: 0.33500000000000002 | P66: 83.12 | Q66: 已到 | R66: 5.40年 | S66: 3.40年 | T66: 11.6 | U66: 10 | V66: 8.0000000000000002e-003 | W66: 0.308 | X66: 0.25600000000000001 | Y66: 38 | Z66: 1.08 | AA66: 1.0200000000000001e-002 | AB66: 4.5000000000000005e-003 | AC66: -1.9299999999999998e-002 | AD66: -2.12e-002 | AE66: 89.57 | AF66: 94.15 | AG66: 0.4 | AH66: AA | AI66: 4.2000000000000003e-002 | AJ66: =H66+100*O66 -> 144.49000000000001 | AK66: 138.9 | AL66: 35 | AM66: 44.7 | AN66: 66 | AO66: 2.2000000000000002e-002 | AP66: 27 | AQ66: 中装转2!
A67: 273 | B67: 113542 | C67: 好客转债! | D67: 603898 | E67: 好莱客 | F67: 其他 | G67: 家居用品 | H67: 110.38 | I67: 8.6999999999999994e-003 | J67: -7.1999999999999998e-003 | K67: 11.16 | L67: 9.0000000000000011e-003 | M67: 114.3 | N67: 16.14 | O67: 0.59599999999999997 | P67: 69.14 | Q67: 已到 | R67: 3.70年 | S67: 1.70年 | T67: 6.03 | U67: 4.7 | V67: 6.9999999999999993e-003 | W67: 0.17399999999999999 | X67: 0.12 | Y67: 35 | Z67: 1.28 | AA67: 9.7000000000000003e-003 | AB67: 2.5999999999999999e-003 | AC67: -3.7699999999999997e-002 | AD67: -4.0500000000000001e-002 | AE67: 95.54 | AF67: 99.01 | AG67: 0.16 | AH67: AA | AI67: 4.0399999999999998e-002 | AJ67: =H67+100*O67 -> 169.97999999999999 | AK67: 151.6 | AL67: 161 | AM67: 52.6 | AN67: 118 | AO67: 2.3e-002 | AP67: 16 | AQ67: 好客转债!
A68: 103 | B68: 123082 | C68: 北陆转债! | D68: 300016 | E68: 北陆药业 | F68: 医药 | G68: 化学制药 | H68: 116.249 | I68: 4.6999999999999993e-003 | J68: -2.5000000000000001e-003 | K68: 7.76 | L68: 3.9000000000000003e-003 | M68: 121.7 | N68: 8.81 | O68: 0.32000000000000001 | P68: 88.08 | Q68: 已到 | R68: 5年17天 | S68: 3年17天 | T68: 4.99 | U68: 15 | V68: 2.7000000000000003e-002 | W68: 0.13100000000000001 | X68: 0.115 | Y68: 38 | Z68: 2.23 | AA68: 9.3999999999999986e-003 | AB68: 1.9e-003 | AC68: -3.27e-002 | AD68: -3.5299999999999998e-002 | AE68: 83.45 | AF68: 85.71 | AG68: 0.57 | AH68: A+ | AI68: 7.400000000000001e-002 | AJ68: =H68+100*O68 -> 148.249 | AK68: 144.4 | AL68: 88 | AM68: 58.7 | AN68: 158 | AO68: 1.e-002 | AP68: 17 | AQ68: 北陆转债!
A69: 67 | B69: 113620 | C69: 傲农转债! | D69: 603363 | E69: 傲农生物 | F69: 农业 | G69: 畜牧业 | H69: 115.49 | I69: -1.7000000000000001e-003 | J69: -9.4999999999999998e-003 | K69: 11.37 | L69: -3.56e-002 | M69: 121.1 | N69: 14.51 | O69: 0.47399999999999998 | P69: 78.36 | Q69: 已到 | R69: 5.30年 | S69: 3.30年 | T69: 10 | U69: 7.1 | V69: 6.0000000000000001e-003 | W69: 0.128 | X69: 0.10099999999999999 | Y69: 78 | Z69: 3.58 | AA69: 9.1999999999999998e-003 | AB69: 2.3e-003 | AC69: -3.1099999999999999e-002 | AD69: -3.3000000000000002e-002 | AE69: 89.95 | AF69: 97.76 | AG69: 0.32 | AH69: AA | AI69: 4.2000000000000003e-002 | AJ69: =H69+100*O69 -> 162.88999999999999 | AK69: 152.6 | AL69: 167 | AM69: 54.9 | AN69: 135 | AO69: 2.2000000000000002e-002 | AP69: 10 | AQ69: 傲农转债!
A70: 157 | B70: 128124 | C70: 科华转债! | D70: 2022. | E70: 科华生物 | F70: 医药 | G70: 生物制药 | H70: 105.9 | I70: 7.4999999999999997e-003 | J70: -8.3000000000000001e-003 | K70: 13.95 | L70: -4.3e-003 | M70: 110 | N70: 21.3 | O70: 0.61699999999999999 | P70: 65.49 | Q70: 已到 | R70: 4.69年 | S70: 2.69年 | T70: 7.38 | U70: 6.8 | V70: 9.0000000000000011e-003 | W70: 0.10300000000000001 | X70: 6.7000000000000004e-002 | Y70: 72 | Z70: 1.99 | AA70: 8.3000000000000001e-003 | AB70: 4.3e-003 | AC70: -1.06e-002 | AD70: -1.24e-002 | AE70: 91.85 | AF70: 91.66 | AG70: 0.2 | AH70: AA | AI70: 4.0399999999999998e-002 | AJ70: =H70+100*O70 -> 167.60000000000002 | AK70: 146.3 | AL70: 110 | AM70: 54.5 | AN70: 132 | AO70: -1.e-003 | AP70: 24 | AQ70: 科华转债!
A71: 106 | B71: 113610 | C71: 灵康转债 | D71: 603669 | E71: 灵康药业 | F71: 医药 | G71: 化学制药 | H71: 116.3 | I71: 7.0999999999999995e-003 | J71: -7.0999999999999995e-003 | K71: 8.35 | L71: 0. | M71: 121.1 | N71: 8.61 | O71: 0.19899999999999998 | P71: 96.98 | Q71: 已到 | R71: 5年11天 | S71: 3年11天 | T71: 4.58 | U71: 3.9 | V71: 6.9999999999999993e-003 | W71: 7.5999999999999998e-002 | X71: 7.400000000000001e-002 | Y71: 60 | Z71: 4.37 | AA71: 8.3000000000000001e-003 | AB71: 1.e-003 | AC71: -3.4700000000000002e-002 | AD71: -3.7000000000000005e-002 | AE71: 85.78 | AF71: 89.71 | AG71: 0.6 | AH71: AA- | AI71: 6.3e-002 | AJ71: =H71+100*O71 -> 136.19999999999999 | AK71: 135.6 | AL71: 20 | AM71: 45.9 | AN71: 75 | AO71: 2.2000000000000002e-002 | AP71: 29 | AQ71: 灵康转债
A72: 242 | B72: 123039 | C72: 开润转债! | D72: 300577 | E72: 开润股份 | F72: 服装纺织 | G72: 纺织行业 | H72: 117.211 | I72: 4.0000000000000002e-004 | J72: -4.3e-003 | K72: 23.01 | L72: -1.03e-002 | M72: 121 | N72: 29.92 | O72: 0.52400000000000002 | P72: 76.91 | Q72: 已到 | R72: 4年36天 | S72: 2年36天 | T72: 2.22 | U72: 3.1 | V72: 1.2e-002 | W72: 4.0000000000000001e-002 | X72: 3.1e-002 | Y72: 55 | Z72: 3.43 | AA72: 8.0000000000000002e-003 | AB72: -8.9999999999999998e-004 | AC72: -5.1699999999999996e-002 | AD72: -5.4900000000000004e-002 | AE72: 89.04 | AF72: 91.56 | AG72: 0.37 | AH72: A+ | AI72: 7.2400000000000006e-002 | AJ72: =H72+100*O72 -> 169.61099999999999 | AK72: 157.5 | AL72: 193 | AM72: 66 | AN72: 206 | AO72: 4.0000000000000001e-002 | AP72: 23 | AQ72: 开润转债!
A73: 127 | B73: 123072 | C73: 乐歌转债! | D73: 300729 | E73: 乐歌股份 | F73: 其他 | G73: 家居用品 | H73: 124.638 | I73: 1.7000000000000001e-003 | J73: -3.8e-003 | K73: 32.49 | L73: -6.9999999999999993e-003 | M73: 129.1 | N73: 49.24 | O73: 0.88900000000000001 | P73: 65.98 | Q73: 已到 | R73: 4.92年 | S73: 2.92年 | T73: 1.42 | U73: 20 | V73: 0.111 | W73: 2.e-002 | X73: 1.3000000000000001e-002 | Y73: 72 | Z73: 3.96 | AA73: 7.4000000000000003e-003 | AB73: -2.3e-003 | AC73: -5.1200000000000002e-002 | AD73: -5.4699999999999999e-002 | AE73: 85.84 | AF73: 92.52 | AG73: 0.29 | AH73: A+ | AI73: 7.2400000000000006e-002 | AJ73: =H73+100*O73 -> 213.53800000000001 | AK73: 183.3 | AL73: 292 | AM73: 90.8 | AN73: 295 | AO73: 0.17100000000000001 | AP73: 10 | AQ73: 乐歌转债!
A74: 1 | B74: 123128 | C74: 首华转债! | D74: 300483 | E74: 首华燃气 | F74: 石油天然 | G74: 天然气 | H74: 110.26 | I74: 0. | J74: 7.8000000000000005e-003 | K74: 19.33 | L74: 2.0099999999999996e-002 | M74: 115.1 | N74: 25.02 | O74: 0.42700000000000005 | P74: 77.26 | Q74: 5月16天 | R74: 5.95年 | S74: 3.95年 | T74: 13.8 | U74: 472 | V74: 0.31 | W74: 0.26600000000000001 | X74: 0.20499999999999999 | Y74: 52 | Z74: 1.85 | AA74: 7.4000000000000003e-003 | AB74: 2.8000000000000004e-003 | AC74: -1.5100000000000001e-002 | AD74: -1.6799999999999999e-002 | AE74: 87.58 | AF74: 90.5 | AG74: 0.39 | AH74: AA | AI74: 4.2000000000000003e-002 | AJ74: =H74+100*O74 -> 152.96000000000001 | AK74: 143.3 | AL74: 67 | AM74: 52.8 | AN74: 120 | AO74: -2.7000000000000003e-002 | AP74: 2 | AQ74: 首华转债!
A75: 315 | B75: 113524 | C75: 奇精转债! | D75: 603677 | E75: 奇精机械 | F75: 家电 | G75: 零部件制 | H75: 114.86 | I75: 9.300000000000001e-003 | J75: 1.1999999999999999e-003 | K75: 12.03 | L75: 2.8199999999999999e-002 | M75: 117.3 | N75: 13.98 | O75: 0.33500000000000002 | P75: 86.05 | Q75: 已到 | R75: 3年24天 | S75: 1年24天 | T75: 3.3 | U75: 4.5 | V75: 1.2e-002 | W75: 0.14300000000000002 | X75: 0.12300000000000001 | Y75: 23 | Z75: 2.27 | AA75: 6.9999999999999993e-003 | AB75: -3.0000000000000001e-003 | AC75: -8.6899999999999991e-002 | AD75: -9.0800000000000006e-002 | AE75: 95.6 | AF75: 98.13 | AG75: 0.37 | AH75: AA- | AI75: 6.1399999999999996e-002 | AJ75: =H75+100*O75 -> 148.36000000000001 | AK75: 143.7 | AL75: 74 | AM75: 45.5 | AN75: 71 | AO75: 8.1000000000000003e-002 | AP75: 41 | AQ75: 奇精转债!
A76: 7 | B76: 113628 | C76: 晨丰转债 | D76: 603685 | E76: 晨丰科技 | F76: 能源电力 | G76: 电力设备 | H76: 117.21 | I76: 3.5999999999999999e-003 | J76: 1.34e-002 | K76: 12.17 | L76: 2.4399999999999998e-002 | M76: 121.7 | N76: 13.06 | O76: 0.25800000000000001 | P76: 93.19 | Q76: 3月9天 | R76: 5.76年 | S76: 3.76年 | T76: 4.15 | U76: 9.6 | V76: 2.e-002 | W76: 0.20199999999999999 | X76: 0.188 | Y76: 21 | Z76: 1.83 | AA76: 6.7000000000000002e-003 | AB76: 2.0000000000000001e-004 | AC76: -2.8799999999999999e-002 | AD76: -3.1e-002 | AE76: 76.52 | AF76: 77.34 | AG76: 0.7 | AH76: A | AI76: 8.4000000000000005e-002 | AJ76: =H76+100*O76 -> 143.00999999999999 | AK76: 141.2 | AL76: 51 | AM76: 63.9 | AN76: 190 | AO76: 6.4000000000000001e-002 | AP76: 8 | AQ76: 晨丰转债
A77: 142 | B77: 128129 | C77: 青农转债! | D77: 2958. | E77: 青农商行 | F77: 金融 | G77: 银行行业 | H77: 108.6 | I77: 4.7999999999999996e-003 | J77: -1.4000000000000002e-003 | K77: 3.85 | L77: 7.9000000000000008e-003 | M77: 112 | N77: 4.32 | O77: 0.21899999999999997 | P77: 89.12 | Q77: 已到 | R77: 4.76年 | S77: 无权 | T77: 50 | U77: 27 | V77: 5.0000000000000001e-003 | W77: 0.23399999999999999 | X77: 0.20800000000000002 | Y77: 214 | Z77: 0.75 | AA77: 6.6e-003 | AB77: 2.e-003 | AC77: 无权 | AD77: 无权 | AE77: 无权 | AF77: 96.01 | AG77: 0.44 | AH77: AAA | AI77: 3.3399999999999999e-002 | AJ77: =H77+100*O77 -> 130.5 | AK77: 128.1 | AL77: 7 | AM77: 32.1 | AN77: 9 | AO77: 4.0000000000000001e-003 | AP77: 24 | AQ77: 青农转债!
A78: 333 | B78: 123010 | C78: 博世转债! | D78: 300422 | E78: 博世科 | F78: 城市公用 | G78: 三废处理 | H78: 109.511 | I78: 3.8e-003 | J78: -2.e-003 | K78: 8.67 | L78: 6.9999999999999993e-003 | M78: 111.3 | N78: 11.26 | O78: 0.42200000000000004 | P78: 77 | Q78: 已到 | R78: 2.62年 | S78: 0.62年 | T78: 4.3 | U78: 3.7 | V78: 8.0000000000000002e-003 | W78: 9.8000000000000004e-002 | X78: 7.5999999999999998e-002 | Y78: 44 | Z78: 1.36 | AA78: 6.3e-003 | AB78: -1.7000000000000001e-003 | AC78: -8.8699999999999987e-002 | AD78: -9.2699999999999991e-002 | AE78: 97.23 | AF78: 95.76 | AG78: 0.25 | AH78: AA- | AI78: 6.0100000000000001e-002 | AJ78: =H78+100*O78 -> 151.71100000000001 | AK78: 142 | AL78: 55 | AM78: 44.8 | AN78: 68 | AO78: 2.8999999999999998e-002 | AP78: 31 | AQ78: 博世转债!
A79: 23 | B79: 123118 | C79: 惠城转债 | D79: 300779 | E79: 惠城环保 | F79: 化工 | G79: 其他 | H79: 117.562 | I79: 5.0000000000000001e-003 | J79: -8.1000000000000013e-003 | K79: 16.56 | L79: -4.7999999999999996e-003 | M79: 121.7 | N79: 17.11 | O79: 0.215 | P79: 96.79 | Q79: 54天 | R79: 5.63年 | S79: 3.63年 | T79: 3.2 | U79: 9.8 | V79: 2.6000000000000002e-002 | W79: 0.193 | X79: 0.187 | Y79: 17 | Z79: 2.48 | AA79: 6.3e-003 | AB79: -2.9999999999999997e-004 | AC79: -3.0600000000000002e-002 | AD79: -3.2799999999999996e-002 | AE79: 80.06 | AF79: 82.23 | AG79: 0.66 | AH79: A+ | AI79: 7.400000000000001e-002 | AJ79: =H79+100*O79 -> 139.06200000000001 | AK79: 138.3 | AL79: 34 | AM79: 56.1 | AN79: 144 | AO79: 4.4999999999999998e-002 | AP79: 9 | AQ79: 惠城转债
A80: 170 | B80: 128120 | C80: 联诚转债! | D80: 2921. | E80: 联诚精密 | F80: 汽车 | G80: 零部件制 | H80: 115.058 | I80: 5.8999999999999999e-003 | J80: 5.0000000000000001e-004 | K80: 15.78 | L80: 1.09e-002 | M80: 117.9 | N80: 18.44 | O80: 0.34499999999999997 | P80: 85.57 | Q80: 已到 | R80: 4.66年 | S80: 2.66年 | T80: 2.6 | U80: 1.8 | V80: 6.0000000000000001e-003 | W80: 0.155 | X80: 0.13300000000000001 | Y80: 17 | Z80: 2.1 | AA80: 5.4000000000000003e-003 | AB80: -1.4000000000000002e-003 | AC80: -3.5299999999999998e-002 | AD80: -3.7900000000000003e-002 | AE80: 83.43 | AF80: 82.29 | AG80: 0.58 | AH80: A | AI80: 8.2400000000000001e-002 | AJ80: =H80+100*O80 -> 149.55799999999999 | AK80: 144.5 | AL80: 93 | AM80: 61.1 | AN80: 174 | AO80: 6.6000000000000003e-002 | AP80: 22 | AQ80: 联诚转债!
A81: 246 | B81: 128087 | C81: 孚日转债! | D81: 2083. | E81: 孚日股份 | F81: 服装纺织 | G81: 家纺 | H81: 110.55 | I81: 9.5999999999999992e-003 | J81: -4.1999999999999997e-003 | K81: 4.2 | L81: 9.5999999999999992e-003 | M81: 112.9 | N81: 4.5 | O81: 0.184 | P81: 93.33 | Q81: 已到 | R81: 4年27天 | S81: 2年27天 | T81: 6.5 | U81: 9.1 | V81: 1.3000000000000001e-002 | W81: 0.17000000000000001 | X81: 0.159 | Y81: 38 | Z81: 1.01 | AA81: 5.3e-003 | AB81: -5.0000000000000001e-004 | AC81: -2.9700000000000001e-002 | AD81: -3.2500000000000001e-002 | AE81: 90.62 | AF81: 89.08 | AG81: 0.57 | AH81: AA- | AI81: 6.1399999999999996e-002 | AJ81: =H81+100*O81 -> 128.94999999999999 | AK81: 127.8 | AL81: 6 | AM81: 37.1 | AN81: 22 | AO81: 2.3e-002 | AP81: 75 | AQ81: 孚日转债!
A82: 114 | B82: 113608 | C82: 威派转债! | D82: 603956 | E82: 威派格 | F82: 机械装备 | G82: 专用设备 | H82: 118.05 | I82: 1.54e-002 | J82: 1.5e-003 | K82: 16.93 | L82: 2.98e-002 | M82: 121.1 | N82: 19.08 | O82: 0.33000000000000002 | P82: 88.73 | Q82: 已到 | R82: 4.97年 | S82: 2.97年 | T82: 4.2 | U82: 4.8 | V82: 1.e-002 | W82: 5.7999999999999996e-002 | X82: 5.2000000000000005e-002 | Y82: 72 | Z82: 6.09 | AA82: 5.3e-003 | AB82: -2.e-003 | AC82: -3.9599999999999996e-002 | AD82: -4.2000000000000003e-002 | AE82: 83.78 | AF82: 86.23 | AG82: 0.57 | AH82: A+ | AI82: 7.2400000000000006e-002 | AJ82: =H82+100*O82 -> 151.05000000000001 | AK82: 147.4 | AL82: 122 | AM82: 61.1 | AN82: 175 | AO82: 6.0999999999999999e-002 | AP82: 7 | AQ82: 威派转债!
A83: 46 | B83: 127032 | C83: 苏行转债 | D83: 2966. | E83: 苏州银行 | F83: 金融 | G83: 银行行业 | H83: 111.999 | I83: 4.5999999999999999e-003 | J83: -2.3e-003 | K83: 6.82 | L83: 5.8999999999999999e-003 | M83: 115.1 | N83: 8.1 | O83: 0.33000000000000002 | P83: 84.2 | Q83: 已到 | R83: 5.39年 | S83: 无权 | T83: 50 | U83: 19 | V83: 3.0000000000000001e-003 | W83: 0.22 | X83: 0.185 | Y83: 227 | Z83: 0.72 | AA83: 5.1999999999999998e-003 | AB83: 1.e-004 | AC83: 无权 | AD83: 无权 | AE83: 无权 | AF83: 95.93 | AG83: 0.39 | AH83: AAA | AI83: 3.5000000000000003e-002 | AJ83: =H83+100*O83 -> 144.999 | AK83: 139.8 | AL83: 40 | AM83: 43.9 | AN83: 57 | AO83: -5.0000000000000001e-003 | AP83: 9 | AQ83: 苏行转债
A84: 140 | B84: 123064 | C84: 万孚转债! | D84: 300482 | E84: 万孚生物 | F84: 医药 | G84: 医疗器械 | H84: 112.203 | I84: 9.1000000000000004e-003 | J84: -9.0000000000000011e-003 | K84: 35.38 | L84: 1.4000000000000002e-003 | M84: 114.8 | N84: 71.65 | O84: 1.27 | P84: 49.38 | Q84: 已到 | R84: 4.78年 | S84: 2.78年 | T84: 5.99 | U84: 3.1 | V84: 5.0000000000000001e-003 | W84: 3.7999999999999999e-002 | X84: 1.9e-002 | Y84: 157 | Z84: 4.91 | AA84: 4.8999999999999998e-003 | AB84: -7.000000000000001e-004 | AC84: -2.7799999999999998e-002 | AD84: -2.9900000000000003e-002 | AE84: 92 | AF84: 95.33 | AG84: 0.05 | AH84: AA | AI84: 4.0399999999999998e-002 | AJ84: =H84+100*O84 -> 239.203 | AK84: 175 | AL84: 274 | AM84: 79.7 | AN84: 263 | AO84: -8.0000000000000002e-003 | AP84: 11 | AQ84: 万孚转债!
A85: 107 | B85: 128139 | C85: 祥鑫转债! | D85: 2965. | E85: 祥鑫科技 | F85: 汽车 | G85: 零部件制 | H85: 118.61 | I85: 2.4300000000000002e-002 | J85: 1.9299999999999998e-002 | K85: 29.59 | L85: 0.10000000000000001 | M85: 121 | N85: 36.96 | O85: 0.48200000000000004 | P85: 80.06 | Q85: 已到 | R85: 5年11天 | S85: 3年11天 | T85: 6.47 | U85: 84 | V85: 0.11 | W85: 0.14499999999999999 | X85: 0.11599999999999999 | Y85: 45 | Z85: 2.56 | AA85: 4.0999999999999995e-003 | AB85: -3.0999999999999999e-003 | AC85: -4.0899999999999999e-002 | AD85: -4.3099999999999999e-002 | AE85: 85.68 | AF85: 89.62 | AG85: 0.44 | AH85: AA- | AI85: 6.3e-002 | AJ85: =H85+100*O85 -> 166.81 | AK85: 157.2 | AL85: 190 | AM85: 67.5 | AN85: 213 | AO85: 0.19500000000000001 | AP85: 13 | AQ85: 祥鑫转债!
A86: 214 | B86: 113574 | C86: 华体转债! | D86: 603679 | E86: 华体科技 | F86: 城市公用 | G86: 城市公用 | H86: 114.02 | I86: 8.0000000000000002e-003 | J86: -7.7000000000000002e-003 | K86: 13.93 | L86: 2.4300000000000002e-002 | M86: 115.9 | N86: 33.91 | O86: 1.78 | P86: 41.08 | Q86: 已到 | R86: 4.36年 | S86: 2.36年 | T86: 2.09 | U86: 11 | V86: 4.5999999999999999e-002 | W86: 0.106 | X86: 4.2999999999999997e-002 | Y86: 20 | Z86: 2.64 | AA86: 3.9000000000000003e-003 | AB86: -2.7000000000000001e-003 | AC86: -3.5900000000000001e-002 | AD86: -3.8800000000000001e-002 | AE86: 87.41 | AF86: 86.15 | AG86: 0.02 | AH86: A+ | AI86: 7.2400000000000006e-002 | AJ86: =H86+100*O86 -> 292.01999999999998 | AK86: 187 | AL86: 305 | AM86: 99.5 | AN86: 310 | AO86: 3.9e-002 | AP86: 20 | AQ86: 华体转债!
A87: 271 | B87: 128072 | C87: 翔鹭转债! | D87: 2842. | E87: 翔鹭钨业 | F87: 有色金属 | G87: 小金属 | H87: 112.922 | I87: 2.9999999999999997e-004 | J87: -7.000000000000001e-004 | K87: 9.41 | L87: -2.0999999999999999e-003 | M87: 114.5 | N87: 15.19 | O87: 0.82299999999999995 | P87: 61.95 | Q87: 已到 | R87: 3.75年 | S87: 1.75年 | T87: 3.02 | U87: 2.7 | V87: 8.0000000000000002e-003 | W87: 0.11699999999999999 | X87: 7.2999999999999995e-002 | Y87: 26 | Z87: 2.69 | AA87: 3.8e-003 | AB87: -3.2000000000000002e-003 | AC87: -4.8000000000000001e-002 | AD87: -5.0700000000000002e-002 | AE87: 91.82 | AF87: 91.99 | AG87: 0.18 | AH87: AA- | AI87: 6.1399999999999996e-002 | AJ87: =H87+100*O87 -> 195.22199999999998 | AK87: 163.9 | AL87: 235 | AM87: 71.9 | AN87: 234 | AO87: 2.5000000000000001e-002 | AP87: 28 | AQ87: 翔鹭转债!
A88: 156 | B88: 123063 | C88: 大禹转债 | D88: 300021 | E88: 大禹节水 | F88: 化工 | G88: 橡胶塑料 | H88: 124 | I88: -2.3999999999999998e-003 | J88: 3.5999999999999999e-003 | K88: 5.27 | L88: 1.9e-003 | M88: 126.1 | N88: 4.83 | O88: 0.13600000000000001 | P88: 109.11 | Q88: 已到 | R88: 4.69年 | S88: 3.69年 | T88: 6.35 | U88: 7.1 | V88: 9.0000000000000011e-003 | W88: 0.14999999999999999 | X88: 0.16399999999999998 | Y88: 42 | Z88: 2.84 | AA88: 3.7000000000000002e-003 | AB88: -5.5000000000000005e-003 | AC88: -3.9100000000000003e-002 | AD88: -4.2099999999999999e-002 | AE88: 85.08 | AF88: 95.97 | AG88: 0.62 | AH88: AA- | AI88: 6.1399999999999996e-002 | AJ88: =H88+100*O88 -> 137.59999999999999 | AK88: 138.9 | AL88: 36 | AM88: 42.9 | AN88: 47 | AO88: 2.9999999999999999e-002 | AP88: 20 | AQ88: 大禹转债
A89: 285 | B89: 127013 | C89: 创维转债! | D89: 810. | E89: 创维数字 | F89: 电子 | G89: 电子产品 | H89: 115.888 | I89: 4.3799999999999999e-002 | J89: -2.0400000000000001e-002 | K89: 9.12 | L89: 0.10000000000000001 | M89: 117.3 | N89: 11.29 | O89: 0.435 | P89: 80.78 | Q89: 已到 | R89: 3.40年 | S89: 1.40年 | T89: 9.78 | U89: 315 | V89: 0.27800000000000002 | W89: 0.10099999999999999 | X89: 8.1000000000000003e-002 | Y89: 97 | Z89: 2.29 | AA89: 3.5999999999999999e-003 | AB89: -5.3e-003 | AC89: -7.4200000000000002e-002 | AD89: -7.7399999999999997e-002 | AE89: 96.67 | AF89: 102.8 | AG89: 0.23 | AH89: AA | AI89: 4.0399999999999998e-002 | AJ89: =H89+100*O89 -> 159.38800000000001 | AK89: 151 | AL89: 154 | AM89: 48.2 | AN89: 92 | AO89: 0.17100000000000001 | AP89: 24 | AQ89: 创维转债!
A90: 298 | B90: 123023 | C90: 迪森转债! | D90: 300335 | E90: 迪森股份 | F90: 能源电力 | G90: 电力供应 | H90: 113 | I90: 4.3e-003 | J90: -1.e-004 | K90: 5.76 | L90: 1.0500000000000001e-002 | M90: 114.3 | N90: 6.89 | O90: 0.35200000000000004 | P90: 83.6 | Q90: 已到 | R90: 3.33年 | S90: 2.33年 | T90: 5.29 | U90: 30 | V90: 5.0000000000000003e-002 | W90: 0.24600000000000002 | X90: 0.20600000000000002 | Y90: 21 | Z90: 1.58 | AA90: 3.4999999999999996e-003 | AB90: -4.1999999999999997e-003 | AC90: -3.0800000000000001e-002 | AD90: -3.4200000000000001e-002 | AE90: 90.39 | AF90: 94.14 | AG90: 0.39 | AH90: AA- | AI90: 6.1399999999999996e-002 | AJ90: =H90+100*O90 -> 148.19999999999999 | AK90: 142.4 | AL90: 57 | AM90: 48.3 | AN90: 93 | AO90: 3.9e-002 | AP90: 50 | AQ90: 迪森转债!
A91: 272 | B91: 128071 | C91: 合兴转债! | D91: 2228. | E91: 合兴包装 | F91: 造纸包装 | G91: 包装材料 | H91: 112.9 | I91: 6.1999999999999998e-003 | J91: -4.3e-003 | K91: 3.47 | L91: 5.7999999999999996e-003 | M91: 114.3 | N91: 4.18 | O91: 0.35999999999999999 | P91: 83.01 | Q91: 已到 | R91: 3.74年 | S91: 1.74年 | T91: 3 | U91: 1.7 | V91: 5.0000000000000001e-003 | W91: 7.0000000000000007e-002 | X91: 5.7999999999999996e-002 | Y91: 43 | Z91: 1.28 | AA91: 3.4000000000000002e-003 | AB91: -3.4999999999999996e-003 | AC91: -4.8399999999999999e-002 | AD91: -5.0999999999999997e-002 | AE91: 95.39 | AF91: 98.85 | AG91: 0.33 | AH91: AA | AI91: 4.0399999999999998e-002 | AJ91: =H91+100*O91 -> 148.90000000000001 | AK91: 142.8 | AL91: 62 | AM91: 43.9 | AN91: 59 | AO91: 5.0000000000000001e-003 | AP91: 25 | AQ91: 合兴转债!
A92: 308 | B92: 128056 | C92: 今飞转债! | D92: 2863. | E92: 今飞凯达 | F92: 汽车 | G92: 零部件制 | H92: 119 | I92: 1.6799999999999999e-002 | J92: -4.8999999999999998e-003 | K92: 5.87 | L92: 2.7999999999999997e-002 | M92: 120.2 | N92: 6.69 | O92: 0.35600000000000004 | P92: 87.74 | Q92: 已到 | R92: 3.27年 | S92: 1.27年 | T92: 1.72 | U92: 11 | V92: 5.2000000000000005e-002 | W92: 5.9000000000000004e-002 | X92: 5.2000000000000005e-002 | Y92: 29 | Z92: 1.55 | AA92: 3.0999999999999999e-003 | AB92: -7.4999999999999997e-003 | AC92: -9.4100000000000003e-002 | AD92: -9.8000000000000004e-002 | AE92: 93.57 | AF92: 96.16 | AG92: 0.42 | AH92: A+ | AI92: 7.2400000000000006e-002 | AJ92: =H92+100*O92 -> 154.59999999999999 | AK92: 150.3 | AL92: 147 | AM92: 54.1 | AN92: 129 | AO92: 0.106 | AP92: 49 | AQ92: 今飞转债!
A93: 275 | B93: 128070 | C93: 智能转债! | D93: 2877. | E93: 智能自控 | F93: 机械装备 | G93: 通用设备 | H93: 115.669 | I93: 7.0999999999999995e-003 | J93: -1.4000000000000002e-003 | K93: 6.65 | L93: 1.9900000000000001e-002 | M93: 116.8 | N93: 9.47 | O93: 0.64700000000000002 | P93: 70.22 | Q93: 已到 | R93: 3.61年 | S93: 无权 | T93: 2.3 | U93: 19 | V93: 7.2000000000000008e-002 | W93: 0.10400000000000001 | X93: 7.2999999999999995e-002 | Y93: 22 | Z93: 2.92 | AA93: 2.8000000000000004e-003 | AB93: -5.5000000000000005e-003 | AC93: 无权 | AD93: 无权 | AE93: 无权 | AF93: 91.24 | AG93: 0.29 | AH93: A+ | AI93: 7.2400000000000006e-002 | AJ93: =H93+100*O93 -> 180.369 | AK93: 161.1 | AL93: 215 | AM93: 69.9 | AN93: 224 | AO93: 5.2999999999999999e-002 | AP93: 29 | AQ93: 智能转债!
A94: 119 | B94: 110076 | C94: 华海转债! | D94: 600521 | E94: 华海药业 | F94: 医药 | G94: 医药行业 | H94: 113.35 | I94: 8.9999999999999998e-004 | J94: -5.6000000000000008e-003 | K94: 20.82 | L94: -3.2500000000000001e-002 | M94: 114.8 | N94: 33.85 | O94: 0.84299999999999997 | P94: 61.51 | Q94: 已到 | R94: 4.95年 | S94: 2.95年 | T94: 18.4 | U94: 8 | V94: 4.0000000000000001e-003 | W94: 5.9000000000000004e-002 | X94: 3.6000000000000004e-002 | Y94: 311 | Z94: 4.74 | AA94: 2.5999999999999999e-003 | AB94: -2.7000000000000001e-003 | AC94: -2.9500000000000002e-002 | AD94: -3.15e-002 | AE94: 91.39 | AF94: 94.69 | AG94: 0.15 | AH94: AA | AI94: 4.0399999999999998e-002 | AJ94: =H94+100*O94 -> 197.64999999999998 | AK94: 165.2 | AL94: 244 | AM94: 70.5 | AN94: 227 | AO94: 2.7999999999999997e-002 | AP94: 8 | AQ94: 华海转债!
A95: 339 | B95: 128037 | C95: 岩土转债! | D95: 2542. | E95: 中化岩土 | F95: 建筑 | G95: 建筑工程 | H95: 110.707 | I95: 1.1899999999999999e-002 | J95: -9.7999999999999997e-003 | K95: 2.73 | L95: 7.4000000000000003e-003 | M95: 111.3 | N95: 3.1 | O95: 0.25700000000000001 | P95: 88.06 | Q95: 已到 | R95: 2.32年 | S95: 0.32年 | T95: 5.99 | U95: 4.8 | V95: 6.9999999999999993e-003 | W95: 0.122 | X95: 0.107 | Y95: 49 | Z95: 1.24 | AA95: 2.3999999999999998e-003 | AB95: -6.6e-003 | AC95: -0.17899999999999999 | AD95: -0.18600000000000003 | AE95: 99.94 | AF95: 102.02 | AG95: 0.29 | AH95: AA | AI95: 3.9100000000000003e-002 | AJ95: =H95+100*O95 -> 136.40699999999998 | AK95: 133.3 | AL95: 15 | AM95: 31.3 | AN95: 7 | AO95: 1.2e-002 | AP95: 52 | AQ95: 岩土转债!
A96: 348 | B96: 113017 | C96: 吉视转债! | D96: 601929 | E96: 吉视传媒 | F96: 传媒娱乐 | G96: 影视娱乐 | H96: 108.3 | I96: 3.1699999999999999e-002 | J96: -3.0800000000000001e-002 | K96: 1.97 | L96: 2.07e-002 | M96: 108.8 | N96: 2.95 | O96: 0.622 | P96: 66.78 | Q96: 已到 | R96: 2年37天 | S96: 37天 | T96: 15.6 | U96: 433 | V96: 0.25600000000000001 | W96: 0.254 | X96: 0.17000000000000001 | Y96: 61 | Z96: 0.92 | AA96: 2.2000000000000001e-003 | AB96: -5.6000000000000008e-003 | AC96: -0.254 | AD96: -0.26500000000000001 | AE96: 100.65 | AF96: 101.53 | AG96: 0.05 | AH96: AA+ | AI96: 3.4099999999999998e-002 | AJ96: =H96+100*O96 -> 170.5 | AK96: 149.8 | AL96: 144 | AM96: 48.3 | AN96: 94 | AO96: 5.0000000000000003e-002 | AP96: 67 | AQ96: 吉视转债!
A97: 66 | B97: 123101 | C97: 拓斯转债! | D97: 300607 | E97: 拓斯达 | F97: 机械装备 | G97: 机器人及 | H97: 113.878 | I97: 1.2500000000000001e-002 | J97: -9.7000000000000003e-003 | K97: 16.43 | L97: 1.55e-002 | M97: 115.1 | N97: 26.18 | O97: 0.81499999999999995 | P97: 62.76 | Q97: 已到 | R97: 5.30年 | S97: 3.30年 | T97: 6.7 | U97: 7 | V97: 9.0000000000000011e-003 | W97: 9.6000000000000002e-002 | X97: 5.9999999999999998e-002 | Y97: 70 | Z97: 3.17 | AA97: 2.0999999999999999e-003 | AB97: -3.0000000000000001e-003 | AC97: -2.7099999999999999e-002 | AD97: -2.8999999999999998e-002 | AE97: 89.95 | AF97: 92.94 | AG97: 0.18 | AH97: AA | AI97: 4.2000000000000003e-002 | AJ97: =H97+100*O97 -> 195.37799999999999 | AK97: 165 | AL97: 242 | AM97: 72.1 | AN97: 235 | AO97: 2.e-002 | AP97: 8 | AQ97: 拓斯转债!
A98: 125 | B98: 113605 | C98: 大参转债! | D98: 603233 | E98: 大参林 | F98: 医药 | G98: 医药商业 | H98: 113.79 | I98: -1.8e-003 | J98: 8.9999999999999998e-004 | K98: 36.1 | L98: -1.4999999999999999e-002 | M98: 114.9 | N98: 69.09 | O98: 1.1799999999999999 | P98: 52.25 | Q98: 已到 | R98: 4.92年 | S98: 2.92年 | T98: 14 | U98: 4.5 | V98: 3.0000000000000001e-003 | W98: 4.9000000000000002e-002 | X98: 2.6000000000000002e-002 | Y98: 285 | Z98: 5.37 | AA98: 2.e-003 | AB98: -3.4000000000000002e-003 | AC98: -3.0699999999999998e-002 | AD98: -3.2799999999999996e-002 | AE98: 91.59 | AF98: 94.9 | AG98: 0.06 | AH98: AA | AI98: 4.0399999999999998e-002 | AJ98: =H98+100*O98 -> 231.79000000000002 | AK98: 175.3 | AL98: 275 | AM98: 80.4 | AN98: 269 | AO98: -6.8000000000000005e-002 | AP98: 7 | AQ98: 大参转债!
A99: 239 | B99: 113561 | C99: 正裕转债! | D99: 603089 | E99: 正裕工业 | F99: 汽车 | G99: 零部件制 | H99: 117.13 | I99: 1.7100000000000001e-002 | J99: -1.4000000000000002e-003 | K99: 8.69 | L99: 3.0800000000000001e-002 | M99: 118 | N99: 10.08 | O99: 0.35899999999999999 | P99: 86.21 | Q99: 已到 | R99: 4年41天 | S99: 2年41天 | T99: 1.5 | U99: 6.2 | V99: 3.6000000000000004e-002 | W99: 7.8e-002 | X99: 6.7000000000000004e-002 | Y99: 19 | Z99: 1.86 | AA99: 1.8e-003 | AB99: -5.7999999999999996e-003 | AC99: -5.0799999999999998e-002 | AD99: -5.4100000000000002e-002 | AE99: 89.04 | AF99: 89.24 | AG99: 0.51 | AH99: A+ | AI99: 7.2400000000000006e-002 | AJ99: =H99+100*O99 -> 153.03 | AK99: 148 | AL99: 126 | AM99: 58.8 | AN99: 160 | AO99: 7.400000000000001e-002 | AP99: 35 | AQ99: 正裕转债!
A100: 153 | B100: 113598 | C100: 法兰转债 | D100: 603966 | E100: 法兰泰克 | F100: 机械装备 | G100: 工程机械 | H100: 119.95 | I100: -2.9999999999999997e-004 | J100: -6.8000000000000005e-003 | K100: 9.17 | L100: -1.29e-002 | M100: 120.8 | N100: 9.7 | O100: 0.26899999999999996 | P100: 94.54 | Q100: 已到 | R100: 4.69年 | S100: 2.69年 | T100: 2.75 | U100: 6.5 | V100: 2.e-002 | W100: 0.10000000000000001 | X100: 9.5000000000000001e-002 | Y100: 28 | Z100: 2.2 | AA100: 1.5e-003 | AB100: -6.0000000000000001e-003 | AC100: -5.0000000000000003e-002 | AD100: -5.2300000000000006e-002 | AE100: 87.62 | AF100: 91.9 | AG100: 0.55 | AH100: AA- | AI100: 6.1399999999999996e-002 | AJ100: =H100+100*O100 -> 146.84999999999999 | AK100: 145.4 | AL100: 99 | AM100: 53.5 | AN100: 125 | AO100: 7.8e-002 | AP100: 13 | AQ100: 法兰转债
A101: 262 | B101: 113546 | C101: 迪贝转债! | D101: 603320 | E101: 迪贝电气 | F101: 家电 | G101: 零部件制 | H101: 119.22 | I101: 5.1999999999999998e-003 | J101: 4.0000000000000001e-003 | K101: 13.24 | L101: 1.6899999999999998e-002 | M101: 119.8 | N101: 14 | O101: 0.26100000000000001 | P101: 94.57 | Q101: 已到 | R101: 3.92年 | S101: 1.92年 | T101: 2.3 | U101: 7.3 | V101: 2.7000000000000003e-002 | W101: 0.13400000000000001 | X101: 0.126 | Y101: 17 | Z101: 2.37 | AA101: 1.2999999999999999e-003 | AB101: -7.4000000000000003e-003 | AC101: -6.7500000000000004e-002 | AD101: -7.0099999999999996e-002 | AE101: 89.22 | AF101: 91.57 | AG101: 0.55 | AH101: A+ | AI101: 7.2400000000000006e-002 | AJ101: =H101+100*O101 -> 145.31999999999999 | AK101: 143.9 | AL101: 82 | AM101: 52.3 | AN101: 115 | AO101: 6.3e-002 | AP101: 38 | AQ101: 迪贝转债!
A102: 135 | B102: 128133 | C102: 奇正转债! | D102: 2287. | E102: 奇正藏药 | F102: 医药 | G102: 中药 | H102: 116.46 | I102: -2.9999999999999997e-004 | J102: -2.0000000000000001e-004 | K102: 26.9 | L102: -1.1000000000000001e-003 | M102: 116.9 | N102: 29.78 | O102: 0.28899999999999998 | P102: 90.33 | Q102: 已到 | R102: 4.84年 | S102: 2.84年 | T102: 8 | U102: 23 | V102: 2.5000000000000001e-002 | W102: 5.5999999999999994e-002 | X102: 5.0999999999999997e-002 | Y102: 143 | Z102: 4.82 | AA102: 8.0000000000000004e-004 | AB102: -5.3e-003 | AC102: -3.9100000000000003e-002 | AD102: -4.1100000000000005e-002 | AE102: 91.89 | AF102: 96.86 | AG102: 0.44 | AH102: AA | AI102: 4.0399999999999998e-002 | AJ102: =H102+100*O102 -> 145.35999999999999 | AK102: 142.6 | AL102: 59 | AM102: 45.7 | AN102: 74 | AO102: 5.0999999999999997e-002 | AP102: 19 | AQ102: 奇正转债!
A103: 43 | B103: 123113 | C103: 仙乐转债! | D103: 300791 | E103: 仙乐健康 | F103: 食品饮料 | G103: 食品饮料 | H103: 118.118 | I103: 4.7999999999999996e-003 | J103: -2.0999999999999999e-003 | K103: 46.69 | L103: 5.1999999999999998e-003 | M103: 118.5 | N103: 56.88 | O103: 0.439 | P103: 82.09 | Q103: 已到 | R103: 5.41年 | S103: 3.41年 | T103: 10.2 | U103: 14 | V103: 1.1000000000000001e-002 | W103: 0.122 | X103: 0.10000000000000001 | Y103: 84 | Z103: 3.63 | AA103: 5.9999999999999995e-004 | AB103: -5.3e-003 | AC103: -3.5699999999999996e-002 | AD103: -3.7599999999999995e-002 | AE103: 83.64 | AF103: 85.74 | AG103: 0.51 | AH103: AA- | AI103: 6.3e-002 | AJ103: =H103+100*O103 -> 162.018 | AK103: 154.2 | AL103: 173 | AM103: 68.4 | AN103: 219 | AO103: 5.9000000000000004e-002 | AP103: 4 | AQ103: 仙乐转债!
A104: 64 | B104: 123104 | C104: 卫宁转债! | D104: 300253 | E104: 卫宁健康 | F104: 计算机及 | G104: 软件开发 | H104: 124.741 | I104: 1.3999999999999999e-002 | J104: 7.6e-003 | K104: 14.96 | L104: 6.25e-002 | M104: 125.1 | N104: 17.74 | O104: 0.47899999999999998 | P104: 84.33 | Q104: 已到 | R104: 5.32年 | S104: 3.32年 | T104: 9.7 | U104: 55 | V104: 4.4999999999999998e-002 | W104: 2.9999999999999999e-002 | X104: 2.6000000000000002e-002 | Y104: 321 | Z104: 6.69 | AA104: 5.0000000000000001e-004 | AB104: -7.1999999999999998e-003 | AC104: -5.2300000000000006e-002 | AD104: -5.4100000000000002e-002 | AE104: 89.88 | AF104: 100.91 | AG104: 0.35 | AH104: AA | AI104: 4.2000000000000003e-002 | AJ104: =H104+100*O104 -> 172.64099999999999 | AK104: 165.2 | AL104: 243 | AM104: 64.2 | AN104: 195 | AO104: 0.12 | AP104: 5 | AQ104: 卫宁转债!
A105: 346 | B105: 128034 | C105: 江银转债! | D105: 2807. | E105: 江阴银行 | F105: 金融 | G105: 银行行业 | H105: 108.353 | I105: 5.1000000000000004e-003 | J105: -3.5999999999999999e-003 | K105: 3.77 | L105: 5.3e-003 | M105: 108.3 | N105: 4.32 | O105: 0.24199999999999999 | P105: 87.27 | Q105: 已到 | R105: 2.18年 | S105: 无权 | T105: 17.6 | U105: 11 | V105: 6.0000000000000001e-003 | W105: 0.215 | X105: 0.187 | Y105: 82 | Z105: 0.68 | AA105: -2.0000000000000001e-004 | AB105: -7.4000000000000003e-003 | AC105: 无权 | AD105: 无权 | AE105: 无权 | AF105: 100.76 | AG105: 0.29 | AH105: AA+ | AI105: 3.4099999999999998e-002 | AJ105: =H105+100*O105 -> 132.553 | AK105: 129.4 | AL105: 9 | AM105: 28.7 | AN105: 3 | AO105: -6.0000000000000001e-003 | AP105: 28 | AQ105: 江银转债!
A106: 196 | B106: 128108 | C106: 蓝帆转债!! | D106: 2382. | E106: 蓝帆医疗 | F106: 医药 | G106: 医疗器械 | H106: 112.98 | I106: 1.06e-002 | J106: -6.9999999999999993e-003 | K106: 15.05 | L106: 9.3999999999999986e-003 | M106: 112.9 | N106: 18.24 | O106: 0.36899999999999999 | P106: 82.51 | Q106: 已到 | R106: 4.52年 | S106: 3.52年 | T106: 15.2 | U106: 18 | V106: 1.e-002 | W106: 0.10000000000000001 | X106: 8.3000000000000004e-002 | Y106: 152 | Z106: 1.19 | AA106: -2.0000000000000001e-004 | AB106: -5.3e-003 | AC106: -1.9400000000000001e-002 | AD106: -2.2000000000000002e-002 | AE106: 91.16 | AF106: 94.76 | AG106: 0.38 | AH106: AA | AI106: 4.0399999999999998e-002 | AJ106: =H106+100*O106 -> 149.88 | AK106: 143.4 | AL106: 71 | AM106: 48.7 | AN106: 96 | AO106: 1.6e-002 | AP106: 29 | AQ106: 蓝帆转债!!
A107: 181 | B107: 128116 | C107: 瑞达转债! | D107: 2961. | E107: 瑞达期货 | F107: 金融 | G107: 期货行业 | H107: 115.058 | I107: 1.5e-003 | J107: 3.7000000000000002e-003 | K107: 23.13 | L107: 1.6299999999999999e-002 | M107: 114.9 | N107: 29.55 | O107: 0.46999999999999997 | P107: 78.27 | Q107: 已到 | R107: 4.61年 | S107: 2.61年 | T107: 6.49 | U107: 6.3 | V107: 9.0000000000000011e-003 | W107: 6.3e-002 | X107: 4.9000000000000002e-002 | Y107: 103 | Z107: 4.85 | AA107: -2.9999999999999997e-004 | AB107: -6.0999999999999995e-003 | AC107: -3.8300000000000001e-002 | AD107: -4.0500000000000001e-002 | AE107: 92.66 | AF107: 96.08 | AG107: 0.32 | AH107: AA | AI107: 4.0399999999999998e-002 | AJ107: =H107+100*O107 -> 162.05799999999999 | AK107: 151.8 | AL107: 162 | AM107: 55.8 | AN107: 142 | AO107: -5.7999999999999996e-002 | AP107: 18 | AQ107: 瑞达转债!
A108: 52 | B108: 123110 | C108: 九典转债 | D108: 300705 | E108: 九典制药 | F108: 医药 | G108: 化学制药 | H108: 121.8 | I108: 8.0000000000000004e-004 | J108: 1.15e-002 | K108: 24.53 | L108: 1.95e-002 | M108: 121.4 | N108: 26.44 | O108: 0.313 | P108: 92.78 | Q108: 已到 | R108: 5.36年 | S108: 3.36年 | T108: 2.7 | U108: 25 | V108: 7.4999999999999997e-002 | W108: 4.7e-002 | X108: 4.2999999999999997e-002 | Y108: 58 | Z108: 5.79 | AA108: -5.9999999999999995e-004 | AB108: -7.4000000000000003e-003 | AC108: -4.3200000000000002e-002 | AD108: -4.5400000000000003e-002 | AE108: 81.4 | AF108: 83.55 | AG108: 0.63 | AH108: A+ | AI108: 7.400000000000001e-002 | AJ108: =H108+100*O108 -> 153.09999999999999 | AK108: 150.8 | AL108: 151 | AM108: 67.3 | AN108: 212 | AO108: 4.7e-002 | AP108: 9 | AQ108: 九典转债
A109: 205 | B109: 110070 | C109: 凌钢转债! | D109: 600231 | E109: 凌钢股份 | F109: 钢铁 | G109: 炼钢 | H109: 117.83 | I109: 1.4800000000000001e-002 | J109: -3.4999999999999996e-003 | K109: 2.52 | L109: 2.4399999999999998e-002 | M109: 117.4 | N109: 2.69 | O109: 0.25800000000000001 | P109: 93.68 | Q109: 已到 | R109: 4.39年 | S109: 2.39年 | T109: 2.17 | U109: 26 | V109: 0.10099999999999999 | W109: 2.9999999999999999e-002 | X109: 2.7999999999999997e-002 | Y109: 72 | Z109: 0.77 | AA109: -8.9999999999999998e-004 | AB109: -7.8000000000000005e-003 | AC109: -4.9000000000000002e-002 | AD109: -5.16e-002 | AE109: 93.83 | AF109: 99.04 | AG109: 0.46 | AH109: AA | AI109: 4.0399999999999998e-002 | AJ109: =H109+100*O109 -> 143.63 | AK109: 142 | AL109: 54 | AM109: 42.9 | AN109: 48 | AO109: -3.7000000000000005e-002 | AP109: 23 | AQ109: 凌钢转债!
A110: 159 | B110: 123062 | C110: 三超转债 | D110: 300554 | E110: 三超新材 | F110: 机械装备 | G110: 通用设备 | H110: 120 | I110: 3.4999999999999996e-003 | J110: 1.0800000000000001e-002 | K110: 16.37 | L110: 2.18e-002 | M110: 119.2 | N110: 17.13 | O110: 0.25600000000000001 | P110: 95.56 | Q110: 已到 | R110: 4.68年 | S110: 2.68年 | T110: 1.95 | U110: 18 | V110: 7.5999999999999998e-002 | W110: 0.127 | X110: 0.121 | Y110: 15 | Z110: 2.92 | AA110: -1.5e-003 | AB110: -8.5000000000000006e-003 | AC110: -4.9000000000000002e-002 | AD110: -5.16e-002 | AE110: 83.28 | AF110: 83.02 | AG110: 0.66 | AH110: A | AI110: 8.2400000000000001e-002 | AJ110: =H110+100*O110 -> 145.59999999999999 | AK110: 144.4 | AL110: 90 | AM110: 61.2 | AN110: 176 | AO110: 6.0999999999999999e-002 | AP110: 27 | AQ110: 三超转债
A111: 116 | B111: 127024 | C111: 盈峰转债! | D111: 967. | E111: 盈峰环境 | F111: 机械装备 | G111: 专用设备 | H111: 117.46 | I111: 1.9699999999999999e-002 | J111: -2.35e-002 | K111: 7.19 | L111: -9.5999999999999992e-003 | M111: 116.6 | N111: 8.19 | O111: 0.33799999999999997 | P111: 87.79 | Q111: 已到 | R111: 4.96年 | S111: 2.96年 | T111: 14.8 | U111: 31 | V111: 1.8000000000000002e-002 | W111: 6.5000000000000002e-002 | X111: 5.7000000000000002e-002 | Y111: 227 | Z111: 1.39 | AA111: -1.5e-003 | AB111: -7.4000000000000003e-003 | AC111: -4.1100000000000005e-002 | AD111: -4.2900000000000001e-002 | AE111: 92.55 | AF111: 98.41 | AG111: 0.39 | AH111: AA+ | AI111: 3.5400000000000001e-002 | AJ111: =H111+100*O111 -> 151.25999999999999 | AK111: 147.1 | AL111: 120 | AM111: 48.7 | AN111: 97 | AO111: 8.6999999999999994e-002 | AP111: 6 | AQ111: 盈峰转债!
A112: 267 | B112: 128074 | C112: 游族转债!! | D112: 2174. | E112: 游族网络 | F112: 通信互联 | G112: 互联网 | H112: 120.1 | I112: 8.3999999999999995e-003 | J112: 8.199999999999999e-003 | K112: 15.5 | L112: 3.4000000000000002e-002 | M112: 119.3 | N112: 16.97 | O112: 0.315 | P112: 91.34 | Q112: 已到 | R112: 3.84年 | S112: 1.84年 | T112: 6.83 | U112: 69 | V112: 8.4000000000000005e-002 | W112: 4.8000000000000001e-002 | X112: 4.4000000000000004e-002 | Y112: 142 | Z112: 2.71 | AA112: -1.8e-003 | AB112: -1.04e-002 | AC112: -7.4999999999999997e-002 | AD112: -7.7399999999999997e-002 | AE112: 94.99 | AF112: 102.74 | AG112: 0.49 | AH112: AA | AI112: 4.0399999999999998e-002 | AJ112: =H112+100*O112 -> 151.59999999999999 | AK112: 148.9 | AL112: 134 | AM112: 46.1 | AN112: 77 | AO112: 0.12 | AP112: 30 | AQ112: 游族转债!!
A113: 109 | B113: 113609 | C113: 永安转债! | D113: 603776 | E113: 永安行 | F113: 城市公用 | G113: 其他 | H113: 121.59 | I113: 2.0400000000000001e-002 | J113: 1.41e-002 | K113: 17.98 | L113: 5.0199999999999995e-002 | M113: 120.5 | N113: 16.48 | O113: 0.114 | P113: 109.1 | Q113: 已到 | R113: 5年4.1天 | S113: 3年4.1天 | T113: 7.34 | U113: 138 | V113: 0.154 | W113: 0.17499999999999999 | X113: 0.191 | Y113: 42 | Z113: 1.29 | AA113: -1.8e-003 | AB113: -8.8000000000000005e-003 | AC113: -4.9000000000000002e-002 | AD113: -5.1100000000000007e-002 | AE113: 85.71 | AF113: 89.33 | AG113: 0.69 | AH113: AA- | AI113: 6.3e-002 | AJ113: =H113+100*O113 -> 132.99000000000001 | AK113: 134.1 | AL113: 19 | AM113: 44.7 | AN113: 67 | AO113: 0.10800000000000001 | AP113: 26 | AQ113: 永安转债!
A114: 352 | B114: 128026 | C114: 众兴转债! | D114: 2772. | E114: 众兴菌业 | F114: 农业 | G114: 种植业 | H114: 109.808 | I114: 8.3000000000000001e-003 | J114: -8.3000000000000001e-003 | K114: 8.01 | L114: 2.69e-002 | M114: 109.3 | N114: 11.36 | O114: 0.55700000000000005 | P114: 70.51 | Q114: 已到 | R114: 2年23天 | S114: 23天 | T114: 4.09 | U114: 82 | V114: 0.17999999999999999 | W114: 0.124 | X114: 8.6999999999999994e-002 | Y114: 33 | Z114: 1.09 | AA114: -2.3e-003 | AB114: -1.0700000000000001e-002 | AC114: -0.34799999999999998 | AD114: -0.36299999999999999 | AE114: 100.46 | AF114: 97.16 | AG114: 0 | AH114: AA- | AI114: 6.0100000000000001e-002 | AJ114: =H114+100*O114 -> 165.50800000000001 | AK114: 149.1 | AL114: 135 | AM114: 48.6 | AN114: 95 | AO114: 1.9e-002 | AP114: 57 | AQ114: 众兴转债!
A115: 164 | B115: 123061 | C115: 航新转债! | D115: 300424 | E115: 航新科技 | F115: 航空航天 | G115: 航空航天 | H115: 125.78 | I115: 3.0999999999999999e-003 | J115: -1.e-002 | K115: 14.95 | L115: -1.1200000000000002e-002 | M115: 124.3 | N115: 14.85 | O115: 0.249 | P115: 100.67 | Q115: 已到 | R115: 4.67年 | S115: 2.67年 | T115: 2.5 | U115: 44 | V115: 0.14099999999999999 | W115: 7.0000000000000007e-002 | X115: 7.0000000000000007e-002 | Y115: 36 | Z115: 5.31 | AA115: -2.5999999999999999e-003 | AB115: -1.1200000000000002e-002 | AC115: -6.480000000000001e-002 | AD115: -6.7400000000000002e-002 | AE115: 85.68 | AF115: 90.4 | AG115: 0.62 | AH115: A+ | AI115: 7.2400000000000006e-002 | AJ115: =H115+100*O115 -> 150.68000000000001 | AK115: 150.9 | AL115: 152 | AM115: 60.5 | AN115: 169 | AO115: 4.0000000000000001e-002 | AP115: 19 | AQ115: 航新转债!
A116: 199 | B116: 128107 | C116: 交科转债 | D116: 2061. | E116: 浙江交科 | F116: 建筑 | G116: 建筑工程 | H116: 116.4 | I116: 2.7000000000000001e-003 | J116: 2.3999999999999998e-003 | K116: 5.24 | L116: 9.5999999999999992e-003 | M116: 114.9 | N116: 5.24 | O116: 0.16399999999999998 | P116: 100 | Q116: 已到 | R116: 4.42年 | S116: 2.42年 | T116: 25 | U116: 7.2 | V116: 2.e-003 | W116: 0.34700000000000003 | X116: 0.34700000000000003 | Y116: 72 | Z116: 0.8 | AA116: -3.0000000000000001e-003 | AB116: -9.0000000000000011e-003 | AC116: -4.5100000000000001e-002 | AD116: -4.7500000000000001e-002 | AE116: 94.59 | AF116: 98.84 | AG116: 0.53 | AH116: AA+ | AI116: 3.5400000000000001e-002 | AJ116: =H116+100*O116 -> 132.80000000000001 | AK116: 132.8 | AL116: 13 | AM116: 34 | AN116: 15 | AO116: 1.2e-002 | AP116: 20 | AQ116: 交科转债
A117: 13 | B117: 123123 | C117: 江丰转债! | D117: 300666 | E117: 江丰电子 | F117: 电子 | G117: 电子行业 | H117: 123.841 | I117: -1.2999999999999999e-003 | J117: -1.4000000000000002e-003 | K117: 44.58 | L117: -4.5000000000000005e-003 | M117: 121.5 | N117: 51.93 | O117: 0.44299999999999995 | P117: 85.85 | Q117: 3月0天 | R117: 5.73年 | S117: 3.73年 | T117: 5.17 | U117: 14 | V117: 2.1000000000000001e-002 | W117: 5.0999999999999997e-002 | X117: 4.4000000000000004e-002 | Y117: 101 | Z117: 8.12 | AA117: -3.4000000000000002e-003 | AB117: -9.7000000000000003e-003 | AC117: -4.3299999999999998e-002 | AD117: -4.53e-002 | AE117: 79.32 | AF117: 81.47 | AG117: 0.6 | AH117: A+ | AI117: 7.400000000000001e-002 | AJ117: =H117+100*O117 -> 168.14099999999999 | AK117: 161.8 | AL117: 221 | AM117: 80.4 | AN117: 267 | AO117: 3.4000000000000002e-002 | AP117: 6 | AQ117: 江丰转债!
A118: 122 | B118: 113606 | C118: 荣泰转债 | D118: 603579 | E118: 荣泰健康 | F118: 机械装备 | G118: 专用设备 | H118: 122.76 | I118: 1.7299999999999999e-002 | J118: -2.1600000000000001e-002 | K118: 30.47 | L118: -7.8000000000000005e-003 | M118: 120.7 | N118: 32.83 | O118: 0.32299999999999995 | P118: 92.81 | Q118: 已到 | R118: 4.94年 | S118: 2.94年 | T118: 6 | U118: 6.1 | V118: 8.0000000000000002e-003 | W118: 0.14099999999999999 | X118: 0.13100000000000001 | Y118: 43 | Z118: 2.55 | AA118: -3.4999999999999996e-003 | AB118: -1.06e-002 | AC118: -5.3499999999999999e-002 | AD118: -5.5500000000000001e-002 | AE118: 86.24 | AF118: 90.45 | AG118: 0.55 | AH118: AA- | AI118: 6.1399999999999996e-002 | AJ118: =H118+100*O118 -> 155.06 | AK118: 152.7 | AL118: 168 | AM118: 62.3 | AN118: 182 | AO118: 4.4999999999999998e-002 | AP118: 11 | AQ118: 荣泰转债
A119: 27 | B119: 123117 | C119: 健帆转债! | D119: 300529 | E119: 健帆生物 | F119: 医药 | G119: 医疗器械 | H119: 117.499 | I119: 8.0000000000000004e-004 | J119: -2.e-003 | K119: 53.7 | L119: -7.4000000000000003e-003 | M119: 115.1 | N119: 90.57 | O119: 0.98199999999999998 | P119: 59.29 | Q119: 39天 | R119: 5.59年 | S119: 3.59年 | T119: 10 | U119: 3.5 | V119: 3.0000000000000001e-003 | W119: 2.3e-002 | X119: 1.3999999999999999e-002 | Y119: 433 | Z119: 14.18 | AA119: -3.7000000000000002e-003 | AB119: -8.5000000000000006e-003 | AC119: -3.32e-002 | AD119: -3.5000000000000003e-002 | AE119: 88.89 | AF119: 91.85 | AG119: 0.16 | AH119: AA | AI119: 4.2000000000000003e-002 | AJ119: =H119+100*O119 -> 215.69900000000001 | AK119: 175.7 | AL119: 279 | AM119: 83.9 | AN119: 280 | AO119: 2.7999999999999997e-002 | AP119: 6 | AQ119: 健帆转债!
A120: 319 | B120: 110047 | C120: 山鹰转债 | D120: 600567 | E120: 山鹰国际 | F120: 造纸包装 | G120: 包装用纸 | H120: 118.92 | I120: 2.5000000000000001e-003 | J120: -1.2999999999999999e-003 | K120: 3.23 | L120: 3.0999999999999999e-003 | M120: 117.5 | N120: 3.3 | O120: 0.215 | P120: 97.88 | Q120: 已到 | R120: 3年1.1天 | S120: 1年1.1天 | T120: 22.5 | U120: 9.6 | V120: 4.0000000000000001e-003 | W120: 0.151 | X120: 0.14699999999999999 | Y120: 149 | Z120: 0.93 | AA120: -4.0999999999999995e-003 | AB120: -1.4199999999999999e-002 | AC120: -0.114 | AD120: -0.11800000000000001 | AE120: 98.78 | AF120: 106.1 | AG120: 0.41 | AH120: AA+ | AI120: 3.5400000000000001e-002 | AJ120: =H120+100*O120 -> 140.42000000000002 | AK120: 140 | AL120: 41 | AM120: 33.9 | AN120: 14 | AO120: -9.0000000000000011e-003 | AP120: 27 | AQ120: 山鹰转债
A121: 152 | B121: 113599 | C121: 嘉友转债! | D121: 603871 | E121: 嘉友国际 | F121: 交通运输 | G121: 物流业 | H121: 128.26 | I121: 1.7899999999999999e-002 | J121: -1.6000000000000001e-003 | K121: 20.06 | L121: 2.6099999999999998e-002 | M121: 125.6 | N121: 18.32 | O121: 0.17100000000000001 | P121: 109.5 | Q121: 已到 | R121: 4.71年 | S121: 2.71年 | T121: 7.2 | U121: 13 | V121: 1.3999999999999999e-002 | W121: 0.126 | X121: 0.13800000000000001 | Y121: 57 | Z121: 2.74 | AA121: -4.5000000000000005e-003 | AB121: -1.34e-002 | AC121: -7.2400000000000006e-002 | AD121: -7.4499999999999997e-002 | AE121: 87.36 | AF121: 95.41 | AG121: 0.63 | AH121: AA- | AI121: 6.1399999999999996e-002 | AJ121: =H121+100*O121 -> 145.35999999999999 | AK121: 147 | AL121: 119 | AM121: 51.6 | AN121: 113 | AO121: 9.1999999999999998e-002 | AP121: 19 | AQ121: 嘉友转债!
A122: 105 | B122: 123080 | C122: 海波转债! | D122: 300517 | E122: 海波重科 | F122: 建筑 | G122: 建筑工程 | H122: 129.5 | I122: 1.32e-002 | J122: -4.0999999999999995e-003 | K122: 13.72 | L122: 1.2500000000000001e-002 | M122: 126.5 | N122: 11.58 | O122: 9.3000000000000013e-002 | P122: 118.48 | Q122: 已到 | R122: 5年12天 | S122: 3年12天 | T122: 2.44 | U122: 34 | V122: 0.107 | W122: 9.1999999999999998e-002 | X122: 0.11 | Y122: 26 | Z122: 3.07 | AA122: -4.7999999999999996e-003 | AB122: -1.3300000000000001e-002 | AC122: -6.5199999999999994e-002 | AD122: -6.7699999999999996e-002 | AE122: 83.59 | AF122: 89.16 | AG122: 0.73 | AH122: A+ | AI122: 7.400000000000001e-002 | AJ122: =H122+100*O122 -> 138.80000000000001 | AK122: 140.5 | AL122: 47 | AM122: 51.4 | AN122: 110 | AO122: 5.2999999999999999e-002 | AP122: 23 | AQ122: 海波转债!
A123: 56 | B123: 113622 | C123: 杭叉转债! | D123: 603298 | E123: 杭叉集团 | F123: 机械装备 | G123: 通用设备 | H123: 116.08 | I123: 1.e-004 | J123: 4.0000000000000001e-003 | K123: 17.37 | L123: 1.2800000000000001e-002 | M123: 112.5 | N123: 23.08 | O123: 0.54200000000000004 | P123: 75.26 | Q123: 已到 | R123: 5.34年 | S123: 3.34年 | T123: 11.5 | U123: 13 | V123: 1.e-002 | W123: 7.5999999999999998e-002 | X123: 5.7999999999999996e-002 | Y123: 150 | Z123: 2.85 | AA123: -5.8999999999999999e-003 | AB123: -1.01e-002 | AC123: -3.3700000000000001e-002 | AD123: -3.5200000000000002e-002 | AE123: 90.75 | AF123: 92.94 | AG123: 0.32 | AH123: AA+ | AI123: 3.7000000000000005e-002 | AJ123: =H123+100*O123 -> 170.28 | AK123: 156.9 | AL123: 189 | AM123: 64 | AN123: 191 | AO123: 2.4e-002 | AP123: 5 | AQ123: 杭叉转债!
A124: 302 | B124: 110053 | C124: 苏银转债! | D124: 600919 | E124: 江苏银行 | F124: 金融 | G124: 银行行业 | H124: 120.63 | I124: 1.0200000000000001e-002 | J124: -6.0000000000000001e-003 | K124: 6.18 | L124: 9.7999999999999997e-003 | M124: 118.3 | N124: 6.37 | O124: 0.24299999999999999 | P124: 97.02 | Q124: 已到 | R124: 3.31年 | S124: 无权 | T124: 200 | U124: 169 | V124: 6.9999999999999993e-003 | W124: 0.21899999999999997 | X124: 0.21299999999999999 | Y124: 913 | Z124: 0.62 | AA124: -6.0999999999999995e-003 | AB124: -1.5700000000000002e-002 | AC124: 无权 | AD124: 无权 | AE124: 无权 | AF124: 106.48 | AG124: 0.43 | AH124: AAA | AI124: 3.3399999999999999e-002 | AJ124: =H124+100*O124 -> 144.93000000000001 | AK124: 144.2 | AL124: 87 | AM124: 37.8 | AN124: 23 | AO124: -2.1000000000000001e-002 | AP124: 34 | AQ124: 苏银转债!
A125: 261 | B125: 127014 | C125: 北方转债! | D125: 65. | E125: 北方国际 | F125: 建筑 | G125: 建筑工程 | H125: 117.151 | I125: 9.8999999999999991e-003 | J125: -5.7999999999999996e-003 | K125: 7.81 | L125: 1.03e-002 | M125: 114.3 | N125: 8.65 | O125: 0.29799999999999999 | P125: 90.29 | Q125: 已到 | R125: 3.93年 | S125: 1.93年 | T125: 5.35 | U125: 4 | V125: 6.0000000000000001e-003 | W125: 8.8000000000000009e-002 | X125: 8.0000000000000002e-002 | Y125: 60 | Z125: 1.01 | AA125: -6.4000000000000003e-003 | AB125: -1.2800000000000001e-002 | AC125: -6.0899999999999996e-002 | AD125: -6.3299999999999995e-002 | AE125: 95.63 | AF125: 99.95 | AG125: 0.4 | AH125: AA+ | AI125: 3.5400000000000001e-002 | AJ125: =H125+100*O125 -> 146.95099999999999 | AK125: 144 | AL125: 83 | AM125: 44.1 | AN125: 61 | AO125: 2.7999999999999997e-002 | AP125: 17 | AQ125: 北方转债!
A126: 63 | B126: 123105 | C126: 拓尔转债! | D126: 300229 | E126: 拓尔思 | F126: 计算机及 | G126: 软件开发 | H126: 125.1 | I126: 1.1299999999999999e-002 | J126: -5.6000000000000008e-003 | K126: 9.46 | L126: 9.5999999999999992e-003 | M126: 121 | N126: 9.96 | O126: 0.317 | P126: 94.98 | Q126: 已到 | R126: 5.33年 | S126: 3.33年 | T126: 8 | U126: 11 | V126: 1.1000000000000001e-002 | W126: 0.11800000000000001 | X126: 0.11199999999999999 | Y126: 68 | Z126: 3.06 | AA126: -6.4000000000000003e-003 | AB126: -1.3000000000000001e-002 | AC126: -5.2199999999999996e-002 | AD126: -5.4199999999999998e-002 | AE126: 84.15 | AF126: 88.01 | AG126: 0.6 | AH126: AA- | AI126: 6.3e-002 | AJ126: =H126+100*O126 -> 156.79999999999998 | AK126: 155.2 | AL126: 178 | AM126: 67.2 | AN126: 211 | AO126: 4.4999999999999998e-002 | AP126: 8 | AQ126: 拓尔转债!
A127: 61 | B127: 113046 | C127: 金田转债! | D127: 601609 | E127: 金田铜业 | F127: 有色金属 | G127: 铜金属 | H127: 118.86 | I127: 2.3e-002 | J127: -1.6e-002 | K127: 9.31 | L127: 1.6399999999999998e-002 | M127: 114.9 | N127: 10.75 | O127: 0.37200000000000005 | P127: 86.6 | Q127: 已到 | R127: 5.33年 | S127: 3.33年 | T127: 15 | U127: 257 | V127: 0.14599999999999999 | W127: 0.109 | X127: 9.4e-002 | Y127: 138 | Z127: 1.96 | AA127: -6.4000000000000003e-003 | AB127: -1.1399999999999999e-002 | AC127: -3.9300000000000002e-002 | AD127: -4.1100000000000005e-002 | AE127: 91.15 | AF127: 94.99 | AG127: 0.43 | AH127: AA+ | AI127: 3.7000000000000005e-002 | AJ127: =H127+100*O127 -> 156.06 | AK127: 151.1 | AL127: 156 | AM127: 56.1 | AN127: 145 | AO127: 0.13699999999999998 | AP127: 13 | AQ127: 金田转债!
A128: 22 | B128: 127041 | C128: 弘亚转债! | D128: 2833. | E128: 弘亚数控 | F128: 机械装备 | G128: 专用设备 | H128: 122.3 | I128: 3.4999999999999996e-003 | J128: 7.3000000000000001e-003 | K128: 32.41 | L128: 2.3e-002 | M128: 118.75 | N128: 38.09 | O128: 0.43700000000000006 | P128: 85.09 | Q128: 58天 | R128: 4.64年 | S128: 2.64年 | T128: 6 | U128: 12 | V128: 1.6e-002 | W128: 6.0999999999999999e-002 | X128: 5.2000000000000005e-002 | Y128: 98 | Z128: 4.92 | AA128: -6.4000000000000003e-003 | AB128: -1.3300000000000001e-002 | AC128: -6.13e-002 | AD128: -6.2899999999999998e-002 | AE128: 86.81 | AF128: 90.44 | AG128: 0.47 | AH128: AA- | AI128: 6.1399999999999996e-002 | AJ128: =H128+100*O128 -> 166. | AK128: 159.5 | AL128: 204 | AM128: 69.1 | AN128: 222 | AO128: 5.2999999999999999e-002 | AP128: 5 | AQ128: 弘亚转债!
A129: 248 | B129: 110063 | C129: 鹰19转债 | D129: 600567 | E129: 山鹰国际 | F129: 造纸包装 | G129: 包装用纸 | H129: 119.14 | I129: 2.3999999999999998e-003 | J129: -8.9999999999999998e-004 | K129: 3.23 | L129: 3.0999999999999999e-003 | M129: 115.9 | N129: 3.26 | O129: 0.20199999999999999 | P129: 99.08 | Q129: 已到 | R129: 4年23天 | S129: 2年23天 | T129: 18.4 | U129: 5.8 | V129: 3.0000000000000001e-003 | W129: 0.124 | X129: 0.12300000000000001 | Y129: 149 | Z129: 0.93 | AA129: -6.8999999999999999e-003 | AB129: -1.38e-002 | AC129: -6.2800000000000009e-002 | AD129: -6.54e-002 | AE129: 95.61 | AF129: 100.93 | AG129: 0.5 | AH129: AA+ | AI129: 3.5400000000000001e-002 | AJ129: =H129+100*O129 -> 139.34 | AK129: 139.2 | AL129: 38 | AM129: 38.3 | AN129: 26 | AO129: -9.0000000000000011e-003 | AP129: 30 | AQ129: 鹰19转债
A130: 222 | B130: 110067 | C130: 华安转债! | D130: 600909 | E130: 华安证券 | F130: 金融 | G130: 证券行业 | H130: 113.6 | I130: 6.8999999999999999e-003 | J130: 2.0000000000000001e-004 | K130: 5.21 | L130: 1.9599999999999999e-002 | M130: 110.3 | N130: 6.22 | O130: 0.35600000000000004 | P130: 83.76 | Q130: 已到 | R130: 4.31年 | S130: 无权 | T130: 28 | U130: 26 | V130: 8.0000000000000002e-003 | W130: 0.114 | X130: 9.6000000000000002e-002 | Y130: 245 | Z130: 1.31 | AA130: -6.8999999999999999e-003 | AB130: -1.1299999999999999e-002 | AC130: 无权 | AD130: 无权 | AE130: 无权 | AF130: 95.94 | AG130: 0.36 | AH130: AAA | AI130: 3.3399999999999999e-002 | AJ130: =H130+100*O130 -> 149.19999999999999 | AK130: 143.4 | AL130: 69 | AM130: 47.5 | AN130: 85 | AO130: 1.7000000000000001e-002 | AP130: 27 | AQ130: 华安转债!
A131: 282 | B131: 113535 | C131: 大业转债! | D131: 603278 | E131: 大业股份 | F131: 汽车 | G131: 零部件制 | H131: 114.43 | I131: 1.24e-002 | J131: -8.9999999999999998e-004 | K131: 10.47 | L131: 4.2800000000000005e-002 | M131: 112.5 | N131: 12.29 | O131: 0.34299999999999997 | P131: 85.19 | Q131: 已到 | R131: 2.47年 | S131: 0.47年 | T131: 5 | U131: 21 | V131: 3.7000000000000005e-002 | W131: 0.16500000000000001 | X131: 0.14000000000000001 | Y131: 30 | Z131: 1.7 | AA131: -6.9999999999999993e-003 | AB131: -1.6e-002 | AC131: -0.191 | AD131: -0.19399999999999998 | AE131: 98.83 | AF131: 102.47 | AG131: 0.27 | AH131: AA | AI131: 3.9100000000000003e-002 | AJ131: =H131+100*O131 -> 148.73000000000002 | AK131: 143.7 | AL131: 75 | AM131: 41.2 | AN131: 35 | AO131: 0.187 | AP131: 47 | AQ131: 大业转债!
A132: 115 | B132: 127025 | C132: 冀东转债! | D132: 401. | E132: 冀东水泥 | F132: 建筑 | G132: 水泥 | H132: 113.75 | I132: 6.9999999999999993e-003 | J132: -6.4000000000000003e-003 | K132: 11.95 | L132: 1.7000000000000001e-003 | M132: 109.9 | N132: 15.28 | O132: 0.45399999999999996 | P132: 78.21 | Q132: 已到 | R132: 4.96年 | S132: 2.96年 | T132: 17.8 | U132: 25 | V132: 1.3000000000000001e-002 | W132: 0.105 | X132: 8.199999999999999e-002 | Y132: 169 | Z132: 1.04 | AA132: -6.9999999999999993e-003 | AB132: -1.0700000000000001e-002 | AC132: -3.2500000000000001e-002 | AD132: -3.4000000000000002e-002 | AE132: 92.69 | AF132: 93.61 | AG132: 0.34 | AH132: AAA | AI132: 3.3399999999999999e-002 | AJ132: =H132+100*O132 -> 159.15000000000001 | AK132: 149.3 | AL132: 138 | AM132: 55.7 | AN132: 140 | AO132: 2.5000000000000001e-002 | AP132: 9 | AQ132: 冀东转债!
A133: 327 | B133: 128042 | C133: 凯中转债! | D133: 2823. | E133: 凯中精密 | F133: 能源电力 | G133: 电力设备 | H133: 117.486 | I133: 3.4000000000000002e-003 | J133: -1.01e-002 | K133: 10.96 | L133: -2.6600000000000002e-002 | M133: 115.3 | N133: 12.86 | O133: 0.379 | P133: 85.23 | Q133: 已到 | R133: 2.69年 | S133: 0.69年 | T133: 4.16 | U133: 14 | V133: 2.8999999999999998e-002 | W133: 0.13200000000000001 | X133: 0.113 | Y133: 31 | Z133: 2.4 | AA133: -7.0999999999999995e-003 | AB133: -1.7000000000000001e-002 | AC133: -0.159 | AD133: -0.16200000000000001 | AE133: 98.52 | AF133: 104.17 | AG133: 0.25 | AH133: AA | AI133: 3.9100000000000003e-002 | AJ133: =H133+100*O133 -> 155.386 | AK133: 149.7 | AL133: 143 | AM133: 45.6 | AN133: 72 | AO133: 0.11800000000000001 | AP133: 25 | AQ133: 凯中转债!
A134: 98 | B134: 127027 | C134: 靖远转债! | D134: 552. | E134: 靖远煤电 | F134: 煤炭 | G134: 煤炭开采 | H134: 119.499 | I134: 1.61e-002 | J134: -5.8999999999999999e-003 | K134: 2.97 | L134: 2.06e-002 | M134: 115.3 | N134: 3.13 | O134: 0.25900000000000001 | P134: 94.89 | Q134: 已到 | R134: 5年20天 | S134: 3年20天 | T134: 24.3 | U134: 98 | V134: 3.4000000000000002e-002 | W134: 0.35799999999999998 | X134: 0.34000000000000002 | Y134: 68 | Z134: 0.84 | AA134: -7.1999999999999998e-003 | AB134: -1.2500000000000001e-002 | AC134: -4.3200000000000002e-002 | AD134: -4.53e-002 | AE134: 92.46 | AF134: 96.34 | AG134: 0.5 | AH134: AA+ | AI134: 3.7000000000000005e-002 | AJ134: =H134+100*O134 -> 145.399 | AK134: 144.1 | AL134: 84 | AM134: 47.8 | AN134: 87 | AO134: -4.0000000000000001e-002 | AP134: 41 | AQ134: 靖远转债!
A135: 259 | B135: 110060 | C135: 天路转债! | D135: 600326 | E135: 西藏天路 | F135: 建筑 | G135: 水泥 | H135: 117.89 | I135: 1.24e-002 | J135: -6.5000000000000006e-003 | K135: 6.35 | L135: 1.44e-002 | M135: 114.3 | N135: 7.08 | O135: 0.314 | P135: 89.69 | Q135: 已到 | R135: 3.94年 | S135: 1.94年 | T135: 7.06 | U135: 4.3 | V135: 5.0000000000000001e-003 | W135: 0.121 | X135: 0.109 | Y135: 58 | Z135: 1.37 | AA135: -8.0000000000000002e-003 | AB135: -1.44e-002 | AC135: -6.3399999999999998e-002 | AD135: -6.5799999999999997e-002 | AE135: 94.63 | AF135: 98.07 | AG135: 0.41 | AH135: AA | AI135: 4.0399999999999998e-002 | AJ135: =H135+100*O135 -> 149.28999999999999 | AK135: 146.1 | AL135: 108 | AM135: 48 | AN135: 88 | AO135: 3.0000000000000001e-003 | AP135: 12 | AQ135: 天路转债!
A136: 161 | B136: 110073 | C136: 国投转债 | D136: 600061 | E136: 国投资本 | F136: 金融 | G136: 证券行业 | H136: 114.54 | I136: 1.23e-002 | J136: -4.4000000000000003e-003 | K136: 8.26 | L136: 2.1000000000000001e-002 | M136: 110.3 | N136: 9.9 | O136: 0.373 | P136: 83.43 | Q136: 已到 | R136: 4.67年 | S136: 无权 | T136: 80 | U136: 52 | V136: 6.0000000000000001e-003 | W136: 0.151 | X136: 0.126 | Y136: 531 | Z136: 1.17 | AA136: -8.1000000000000013e-003 | AB136: -1.2199999999999999e-002 | AC136: 无权 | AD136: 无权 | AE136: 无权 | AF136: 94.79 | AG136: 0.37 | AH136: AAA | AI136: 3.3399999999999999e-002 | AJ136: =H136+100*O136 -> 151.84 | AK136: 145.6 | AL136: 100 | AM136: 50.9 | AN136: 108 | AO136: -6.9999999999999993e-003 | AP136: 24 | AQ136: 国投转债
A137: 251 | B137: 110062 | C137: 烽火转债! | D137: 600498 | E137: 烽火通信 | F137: 通信互联 | G137: 通信设备 | H137: 114.55 | I137: 3.0999999999999999e-003 | J137: -1.e-004 | K137: 17.89 | L137: 1.0700000000000001e-002 | M137: 110.8 | N137: 22.85 | O137: 0.46299999999999997 | P137: 78.29 | Q137: 已到 | R137: 4年12天 | S137: 2年12天 | T137: 30.9 | U137: 9.1 | V137: 3.0000000000000001e-003 | W137: 0.153 | X137: 0.11900000000000001 | Y137: 202 | Z137: 1.85 | AA137: -8.3999999999999995e-003 | AB137: -1.3300000000000001e-002 | AC137: -4.6399999999999997e-002 | AD137: -4.9100000000000005e-002 | AE137: 96.18 | AF137: 97.34 | AG137: 0.27 | AH137: AAA | AI137: 3.3399999999999999e-002 | AJ137: =H137+100*O137 -> 160.84999999999999 | AK137: 150.8 | AL137: 150 | AM137: 53.5 | AN137: 124 | AO137: 1.7000000000000001e-002 | AP137: 18 | AQ137: 烽火转债!
A138: 82 | B138: 127028 | C138: 英特转债! | D138: 411. | E138: 英特集团 | F138: 医药 | G138: 医药商业 | H138: 118 | I138: -3.2000000000000002e-003 | J138: 8.0000000000000002e-003 | K138: 13.4 | L138: 8.3000000000000001e-003 | M138: 113.1 | N138: 13.4 | O138: 0.17999999999999999 | P138: 100 | Q138: 已到 | R138: 5年46天 | S138: 3年46天 | T138: 6 | U138: 23 | V138: 3.3000000000000002e-002 | W138: 0.17999999999999999 | X138: 0.17999999999999999 | Y138: 33 | Z138: 1.88 | AA138: -8.3999999999999995e-003 | AB138: -1.3000000000000001e-002 | AC138: -3.9100000000000003e-002 | AD138: -4.1100000000000005e-002 | AE138: 92.03 | AF138: 94.24 | AG138: 0.58 | AH138: AA+ | AI138: 3.7000000000000005e-002 | AJ138: =H138+100*O138 -> 136. | AK138: 136 | AL138: 22 | AM138: 41.8 | AN138: 42 | AO138: 5.9000000000000004e-002 | AP138: 30 | AQ138: 英特转债!
A139: 99 | B139: 113043 | C139: 财通转债! | D139: 601108 | E139: 财通证券 | F139: 金融 | G139: 证券行业 | H139: 115.03 | I139: 8.8999999999999999e-003 | J139: -1.6000000000000001e-003 | K139: 10.33 | L139: 2.0799999999999999e-002 | M139: 110.2 | N139: 13.13 | O139: 0.46200000000000002 | P139: 78.67 | Q139: 已到 | R139: 5年20天 | S139: 无权 | T139: 38 | U139: 22 | V139: 5.0000000000000001e-003 | W139: 0.10199999999999999 | X139: 8.1000000000000003e-002 | Y139: 371 | Z139: 1.59 | AA139: -8.6e-003 | AB139: -1.23e-002 | AC139: 无权 | AD139: 无权 | AE139: 无权 | AF139: 92.86 | AG139: 0.36 | AH139: AAA | AI139: 3.5000000000000003e-002 | AJ139: =H139+100*O139 -> 161.23000000000002 | AK139: 151.4 | AL139: 158 | AM139: 58.5 | AN139: 155 | AO139: -6.9999999999999993e-003 | AP139: 11 | AQ139: 财通转债!
A140: 25 | B140: 127039 | C140: 北港转债 | D140: 582. | E140: 北部湾港 | F140: 机场高速 | G140: 港口 | H140: 118.52 | I140: 6.0999999999999995e-003 | J140: 6.8999999999999999e-003 | K140: 7.88 | L140: 2.4700000000000003e-002 | M140: 113 | N140: 8.35 | O140: 0.25600000000000001 | P140: 94.37 | Q140: 46天 | R140: 5.61年 | S140: 3.61年 | T140: 30 | U140: 3.6 | V140: 1.e-003 | W140: 0.23300000000000001 | X140: 0.22 | Y140: 129 | Z140: 1.2 | AA140: -8.6e-003 | AB140: -1.2800000000000001e-002 | AC140: -3.5499999999999997e-002 | AD140: -3.7200000000000004e-002 | AE140: 91 | AF140: 93.5 | AG140: 0.53 | AH140: AAA | AI140: 3.5000000000000003e-002 | AJ140: =H140+100*O140 -> 144.12 | AK140: 142.7 | AL140: 60 | AM140: 49.2 | AN140: 100 | AO140: 3.7000000000000005e-002 | AP140: 6 | AQ140: 北港转债
A141: 129 | B141: 128135 | C141: 洽洽转债! | D141: 2557. | E141: 洽洽食品 | F141: 食品饮料 | G141: 休闲食品 | H141: 125.197 | I141: 0. | J141: -1.1999999999999999e-003 | K141: 55.16 | L141: -2.7000000000000001e-003 | M141: 119.9 | N141: 60.03 | O141: 0.36299999999999999 | P141: 91.89 | Q141: 已到 | R141: 4.92年 | S141: 2.92年 | T141: 13.4 | U141: 6.4 | V141: 4.0000000000000001e-003 | W141: 4.8000000000000001e-002 | X141: 4.4000000000000004e-002 | Y141: 280 | Z141: 6.41 | AA141: -8.8999999999999999e-003 | AB141: -1.5800000000000002e-002 | AC141: -6.0599999999999994e-002 | AD141: -6.25e-002 | AE141: 91.61 | AF141: 99.04 | AG141: 0.43 | AH141: AA | AI141: 4.0399999999999998e-002 | AJ141: =H141+100*O141 -> 161.49700000000001 | AK141: 158.5 | AL141: 199 | AM141: 59.5 | AN141: 164 | AO141: 2.e-003 | AP141: 11 | AQ141: 洽洽转债!
A142: 185 | B142: 113588 | C142: 润达转债! | D142: 603108 | E142: 润达医疗 | F142: 医药 | G142: 医疗器械 | H142: 118.62 | I142: 3.4300000000000004e-002 | J142: 2.8000000000000004e-003 | K142: 12.12 | L142: 7.8299999999999995e-002 | M142: 113.9 | N142: 13.25 | O142: 0.29699999999999999 | P142: 91.47 | Q142: 已到 | R142: 4.57年 | S142: 2.57年 | T142: 5.5 | U142: 151 | V142: 0.23000000000000001 | W142: 7.8e-002 | X142: 7.2000000000000008e-002 | Y142: 70 | Z142: 2.13 | AA142: -9.0000000000000011e-003 | AB142: -1.44e-002 | AC142: -4.9299999999999997e-002 | AD142: -5.1500000000000004e-002 | AE142: 92.86 | AF142: 95.39 | AG142: 0.47 | AH142: AA | AI142: 4.0399999999999998e-002 | AJ142: =H142+100*O142 -> 148.31999999999999 | AK142: 145.8 | AL142: 102 | AM142: 50.4 | AN142: 103 | AO142: 0.16800000000000001 | AP142: 12 | AQ142: 润达转债!
A143: 20 | B143: 113627 | C143: 太平转债! | D143: 603877 | E143: 太平鸟 | F143: 服装纺织 | G143: 服装行业 | H143: 121.06 | I143: -5.3e-003 | J143: 2.7000000000000001e-003 | K143: 35.86 | L143: -8.8000000000000005e-003 | M143: 115.1 | N143: 50.32 | O143: 0.69900000000000007 | P143: 71.26 | Q143: 2月2天 | R143: 5.65年 | S143: 3.65年 | T143: 8 | U143: 3.5 | V143: 4.0000000000000001e-003 | W143: 4.7e-002 | X143: 3.3000000000000002e-002 | Y143: 171 | Z143: 4.2 | AA143: -9.1000000000000004e-003 | AB143: -1.37e-002 | AC143: -4.0300000000000002e-002 | AD143: -4.2000000000000003e-002 | AE143: 88.67 | AF143: 91.62 | AG143: 0.3 | AH143: AA | AI143: 4.2000000000000003e-002 | AJ143: =H143+100*O143 -> 190.96000000000001 | AK143: 170.9 | AL143: 263 | AM143: 79.2 | AN143: 259 | AO143: -2.1000000000000001e-002 | AP143: 3 | AQ143: 太平转债!
A144: 9 | B144: 127044 | C144: 蒙娜转债! | D144: 2918. | E144: 蒙娜丽莎 | F144: 建筑 | G144: 其他建材 | H144: 123.3 | I144: 2.2400000000000003e-002 | J144: -1.6000000000000001e-003 | K144: 22.1 | L144: 5.1399999999999994e-002 | M144: 117.1 | N144: 27.07 | O144: 0.51000000000000001 | P144: 81.64 | Q144: 3月3天 | R144: 5.74年 | S144: 3.74年 | T144: 11.7 | U144: 175 | V144: 0.11900000000000001 | W144: 0.128 | X144: 0.10400000000000001 | Y144: 92 | Z144: 2.46 | AA144: -9.1000000000000004e-003 | AB144: -1.43e-002 | AC144: -4.3899999999999995e-002 | AD144: -4.5599999999999995e-002 | AE144: 88.35 | AF144: 92.87 | AG144: 0.4 | AH144: AA | AI144: 4.2000000000000003e-002 | AJ144: =H144+100*O144 -> 174.30000000000001 | AK144: 165 | AL144: 241 | AM144: 72.1 | AN144: 237 | AO144: 7.5999999999999998e-002 | AP144: 2 | AQ144: 蒙娜转债!
A145: 33 | B145: 123116 | C145: 万兴转债 | D145: 300624 | E145: 万兴科技 | F145: 计算机及 | G145: 软件开发 | H145: 127.64 | I145: 1.9e-003 | J145: 3.0000000000000001e-003 | K145: 46.47 | L145: 7.6e-003 | M145: 121.4 | N145: 49.78 | O145: 0.36700000000000005 | P145: 93.35 | Q145: 26天 | R145: 5.55年 | S145: 3.55年 | T145: 3.79 | U145: 98 | V145: 0.20100000000000001 | W145: 6.3e-002 | X145: 5.9000000000000004e-002 | Y145: 60 | Z145: 7.26 | AA145: -9.1999999999999998e-003 | AB145: -1.5600000000000001e-002 | AC145: -5.33e-002 | AD145: -5.5300000000000002e-002 | AE145: 80.24 | AF145: 82.42 | AG145: 0.64 | AH145: A+ | AI145: 7.400000000000001e-002 | AJ145: =H145+100*O145 -> 164.34 | AK145: 161.9 | AL145: 222 | AM145: 79.5 | AN145: 260 | AO145: 1.9e-002 | AP145: 6 | AQ145: 万兴转债
A146: 68 | B146: 113045 | C146: 环旭转债! | D146: 601231 | E146: 环旭电子 | F146: 电子 | G146: 电子产品 | H146: 117.98 | I146: 1.23e-002 | J146: 2.0000000000000001e-004 | K146: 15 | L146: 4.1700000000000001e-002 | M146: 112 | N146: 19.75 | O146: 0.55299999999999994 | P146: 75.95 | Q146: 20天 | R146: 5.29年 | S146: 2.29年 | T146: 34.5 | U146: 5.2 | V146: 1.e-003 | W146: 0.10400000000000001 | X146: 7.9000000000000001e-002 | Y146: 331 | Z146: 2.78 | AA146: -9.8999999999999991e-003 | AB146: -1.3999999999999999e-002 | AC146: -5.4299999999999994e-002 | AD146: -5.6500000000000002e-002 | AE146: 94.14 | AF146: 92.67 | AG146: 0.3 | AH146: AA+ | AI146: 3.7000000000000005e-002 | AJ146: =H146+100*O146 -> 173.28 | AK146: 160 | AL146: 205 | AM146: 65.9 | AN146: 204 | AO146: 5.5e-002 | AP146: 6 | AQ146: 环旭转债!
A147: 2 | B147: 123127 | C147: N耐普转 | D147: 300818 | E147: 耐普矿机 | F147: 机械装备 | G147: 专用设备 | H147: 123.15 | I147: 0.23199999999999998 | J147: 0. | K147: 37.91 | L147: 5.7999999999999996e-003 | M147: 116.2 | N147: 37 | O147: 0.20199999999999999 | P147: 102.46 | Q147: 5月15天 | R147: 5.94年 | S147: 3.94年 | T147: 4 | U147: 707 | V147: 1.4299999999999999 | W147: 0.151 | X147: 0.154 | Y147: 27 | Z147: 2.82 | AA147: -9.8999999999999991e-003 | AB147: -1.47e-002 | AC147: -4.0000000000000001e-002 | AD147: -4.1900000000000007e-002 | AE147: 78.01 | AF147: 76.75 | AG147: 0.74 | AH147: A+ | AI147: 7.400000000000001e-002 | AJ147: =H147+100*O147 -> 143.34999999999999 | AK147: 143.8 | AL147: 80 | AM147: 65.8 | AN147: 202 | AO147: 5.2000000000000005e-002 | AP147: 1 | AQ147: N耐普转
A148: 330 | B148: 123011 | C148: 德尔转债! | D148: 300473 | E148: 德尔股份 | F148: 汽车 | G148: 零部件制 | H148: 118.411 | I148: 4.0000000000000001e-003 | J148: 8.9999999999999998e-004 | K148: 23.83 | L148: 2.3199999999999998e-002 | M148: 115.3 | N148: 31.38 | O148: 0.55899999999999994 | P148: 75.94 | Q148: 已到 | R148: 2.66年 | S148: 0.66年 | T148: 2.51 | U148: 36 | V148: 0.12300000000000001 | W148: 7.8e-002 | X148: 5.9000000000000004e-002 | Y148: 32 | Z148: 1.51 | AA148: -1.01e-002 | AB148: -2.0199999999999999e-002 | AC148: -0.17399999999999999 | AD148: -0.17800000000000002 | AE148: 97.03 | AF148: 98.98 | AG148: 0.21 | AH148: AA- | AI148: 6.0100000000000001e-002 | AJ148: =H148+100*O148 -> 174.31099999999998 | AK148: 160.9 | AL148: 212 | AM148: 61.9 | AN148: 179 | AO148: 0.13300000000000001 | AP148: 39 | AQ148: 德尔转债!
A149: 49 | B149: 113623 | C149: 凤21转债 | D149: 603225 | E149: 新凤鸣 | F149: 化工 | G149: 化纤 | H149: 123.58 | I149: -5.9999999999999995e-004 | J149: 7.9000000000000008e-003 | K149: 14 | L149: 1.7399999999999999e-002 | M149: 117.1 | N149: 16.47 | O149: 0.45399999999999996 | P149: 85 | Q149: 已到 | R149: 5.38年 | S149: 3.38年 | T149: 25 | U149: 19 | V149: 6.0000000000000001e-003 | W149: 0.11699999999999999 | X149: 9.9000000000000005e-002 | Y149: 214 | Z149: 1.35 | AA149: -1.01e-002 | AB149: -1.5600000000000001e-002 | AC149: -4.8899999999999999e-002 | AD149: -5.0700000000000002e-002 | AE149: 89.65 | AF149: 94.24 | AG149: 0.42 | AH149: AA | AI149: 4.2000000000000003e-002 | AJ149: =H149+100*O149 -> 168.97999999999999 | AK149: 162.2 | AL149: 224 | AM149: 67.9 | AN149: 215 | AO149: -2.3e-002 | AP149: 3 | AQ149: 凤21转债
A150: 296 | B150: 127012 | C150: 招路转债! | D150: 1965. | E150: 招商公路 | F150: 机场高速 | G150: 高速 | H150: 111.702 | I150: 0. | J150: 2.5000000000000001e-003 | K150: 7.14 | L150: 8.5000000000000006e-003 | M150: 107.9 | N150: 8.63 | O150: 0.34999999999999998 | P150: 82.73 | Q150: 已到 | R150: 3.33年 | S150: 1.33年 | T150: 50 | U150: 6.2 | V150: 1.e-003 | W150: 0.113 | X150: 9.4e-002 | Y150: 441 | Z150: 0.86 | AA150: -1.0500000000000001e-002 | AB150: -1.49e-002 | AC150: -6.1200000000000004e-002 | AD150: -6.3200000000000006e-002 | AE150: 96.78 | AF150: 96.85 | AG150: 0.3 | AH150: AAA | AI150: 3.3399999999999999e-002 | AJ150: =H150+100*O150 -> 146.702 | AK150: 140.7 | AL150: 48 | AM150: 43.8 | AN150: 56 | AO150: 2.6000000000000002e-002 | AP150: 27 | AQ150: 招路转债!
A151: 138 | B151: 128131 | C151: 崇达转2! | D151: 2815. | E151: 崇达技术 | F151: 电子 | G151: 元器件制 | H151: 121.061 | I151: 9.8999999999999991e-003 | J151: 3.0999999999999999e-003 | K151: 16.35 | L151: 3.3500000000000002e-002 | M151: 114.9 | N151: 19.38 | O151: 0.435 | P151: 84.37 | Q151: 已到 | R151: 4.80年 | S151: 2.80年 | T151: 14 | U151: 22 | V151: 1.3000000000000001e-002 | W151: 9.8000000000000004e-002 | X151: 8.199999999999999e-002 | Y151: 143 | Z151: 3.33 | AA151: -1.1000000000000001e-002 | AB151: -1.6500000000000001e-002 | AC151: -5.2199999999999996e-002 | AD151: -5.4199999999999998e-002 | AE151: 92.04 | AF151: 95.37 | AG151: 0.39 | AH151: AA | AI151: 4.0399999999999998e-002 | AJ151: =H151+100*O151 -> 164.56100000000001 | AK151: 157.8 | AL151: 194 | AM151: 62.4 | AN151: 184 | AO151: 8.5999999999999993e-002 | AP151: 11 | AQ151: 崇达转2!
A152: 354 | B152: 128023 | C152: 亚太转债! | D152: 2284. | E152: 亚太股份 | F152: 汽车 | G152: 零部件制 | H152: 113.81 | I152: 1.18e-002 | J152: -6.0000000000000001e-003 | K152: 8.27 | L152: 3.3799999999999997e-002 | M152: 111.3 | N152: 10.34 | O152: 0.42299999999999999 | P152: 79.98 | Q152: 已到 | R152: 2年14天 | S152: 14天 | T152: 9.99 | U152: 63 | V152: 5.5e-002 | W152: 0.16399999999999998 | X152: 0.13100000000000001 | Y152: 61 | Z152: 2.43 | AA152: -1.11e-002 | AB152: -2.1099999999999997e-002 | AC152: -0.56399999999999995 | AD152: -0.57999999999999996 | AE152: 101.01 | AF152: 103.1 | AG152: 0.17 | AH152: AA | AI152: 3.9100000000000003e-002 | AJ152: =H152+100*O152 -> 156.11000000000001 | AK152: 147.6 | AL152: 123 | AM152: 44.5 | AN152: 65 | AO152: 0.152 | AP152: 59 | AQ152: 亚太转债!
A153: 323 | B153: 128044 | C153: 岭南转债! | D153: 2717. | E153: 岭南股份 | F153: 城市公用 | G153: 生态环境 | H153: 113.72 | I153: -7.7000000000000002e-003 | J153: 5.7999999999999996e-003 | K153: 3.51 | L153: -5.9000000000000004e-002 | M153: 110.3 | N153: 5.59 | O153: 0.81099999999999994 | P153: 62.79 | Q153: 已到 | R153: 2.73年 | S153: 0.73年 | T153: 6.59 | U153: 546 | V153: 0.72199999999999998 | W153: 0.111 | X153: 7.0000000000000007e-002 | Y153: 59 | Z153: 1.25 | AA153: -1.1299999999999999e-002 | AB153: -1.8100000000000002e-002 | AC153: -0.11900000000000001 | AD153: -0.122 | AE153: 96.61 | AF153: 94.29 | AG153: 0.03 | AH153: AA- | AI153: 6.0100000000000001e-002 | AJ153: =H153+100*O153 -> 194.81999999999999 | AK153: 164.6 | AL153: 240 | AM153: 68 | AN153: 216 | AO153: 0.19699999999999998 | AP153: 55 | AQ153: 岭南转债!
A154: 89 | B154: 128142 | C154: 新乳转债! | D154: 2946. | E154: 新乳业 | F154: 食品饮料 | G154: 乳制品 | H154: 121.82 | I154: -5.6000000000000008e-003 | J154: -1.e-003 | K154: 14.91 | L154: -1.78e-002 | M154: 115.1 | N154: 18.47 | O154: 0.50900000000000001 | P154: 80.73 | Q154: 已到 | R154: 5年28天 | S154: 3年28天 | T154: 7.18 | U154: 11 | V154: 1.2e-002 | W154: 5.5999999999999994e-002 | X154: 4.4999999999999998e-002 | Y154: 129 | Z154: 5.08 | AA154: -1.1299999999999999e-002 | AB154: -1.6500000000000001e-002 | AC154: -4.9100000000000005e-002 | AD154: -5.1100000000000007e-002 | AE154: 90.78 | AF154: 93.8 | AG154: 0.37 | AH154: AA | AI154: 4.2000000000000003e-002 | AJ154: =H154+100*O154 -> 172.72 | AK154: 162.9 | AL154: 229 | AM154: 69.1 | AN154: 223 | AO154: -5.0999999999999997e-002 | AP154: 5 | AQ154: 新乳转债!
A155: 14 | B155: 127042 | C155: 嘉美转债 | D155: 2969. | E155: 嘉美包装 | F155: 造纸包装 | G155: 包装材料 | H155: 124.99 | I155: 3.9000000000000003e-003 | J155: -1.4800000000000001e-002 | K155: 5.54 | L155: -1.6e-002 | M155: 117.1 | N155: 4.87 | O155: 9.9000000000000005e-002 | P155: 113.76 | Q155: 2月26天 | R155: 5.72年 | S155: 3.72年 | T155: 7.5 | U155: 32 | V155: 3.4000000000000002e-002 | W155: 0.14099999999999999 | X155: 0.16 | Y155: 53 | Z155: 2.43 | AA155: -1.15e-002 | AB155: -1.67e-002 | AC155: -4.7500000000000001e-002 | AD155: -4.9100000000000005e-002 | AE155: 88.42 | AF155: 92.94 | AG155: 0.68 | AH155: AA | AI155: 4.2000000000000003e-002 | AJ155: =H155+100*O155 -> 134.88999999999999 | AK155: 136.2 | AL155: 23 | AM155: 43.3 | AN155: 49 | AO155: -5.2999999999999999e-002 | AP155: 10 | AQ155: 嘉美转债
A156: 88 | B156: 123090 | C156: 三诺转债! | D156: 300298 | E156: 三诺生物 | F156: 医药 | G156: 医疗器械 | H156: 124.105 | I156: 1.89e-002 | J156: 6.9999999999999993e-003 | K156: 29.49 | L156: 6.4600000000000005e-002 | M156: 117.1 | N156: 35.18 | O156: 0.48100000000000004 | P156: 83.83 | Q156: 已到 | R156: 5年31天 | S156: 3年31天 | T156: 5 | U156: 26 | V156: 4.2000000000000003e-002 | W156: 2.9999999999999999e-002 | X156: 2.5000000000000001e-002 | Y156: 167 | Z156: 6.16 | AA156: -1.1599999999999999e-002 | AB156: -1.7399999999999999e-002 | AC156: -5.45e-002 | AD156: -5.6399999999999999e-002 | AE156: 90.75 | AF156: 95.39 | AG156: 0.4 | AH156: AA | AI156: 4.2000000000000003e-002 | AJ156: =H156+100*O156 -> 172.20500000000001 | AK156: 164.4 | AL156: 239 | AM156: 69 | AN156: 221 | AO156: 0.16399999999999998 | AP156: 4 | AQ156: 三诺转债!
A157: 29 | B157: 113050 | C157: 南银转债 | D157: 601009 | E157: 南京银行 | F157: 金融 | G157: 银行行业 | H157: 118.55 | I157: 2.9999999999999997e-004 | J157: 1.9e-003 | K157: 9.42 | L157: 4.3e-003 | M157: 111.2 | N157: 10.1 | O157: 0.27100000000000002 | P157: 93.27 | Q157: 31天 | R157: 5.57年 | S157: 无权 | T157: 200 | U157: 141 | V157: 6.0000000000000001e-003 | W157: 0.21199999999999999 | X157: 0.19800000000000001 | Y157: 943 | Z157: 0.89 | AA157: -1.1599999999999999e-002 | AB157: -1.52e-002 | AC157: 无权 | AD157: 无权 | AE157: 无权 | AF157: 92.08 | AG157: 0.52 | AH157: AAA | AI157: 3.5000000000000003e-002 | AJ157: =H157+100*O157 -> 145.65000000000001 | AK157: 143.8 | AL157: 78 | AM157: 51.8 | AN157: 114 | AO157: -2.7000000000000003e-002 | AP157: 7 | AQ157: 南银转债
A158: 93 | B158: 123088 | C158: 威唐转债! | D158: 300707 | E158: 威唐工业 | F158: 汽车 | G158: 零部件制 | H158: 129 | I158: 3.3000000000000002e-002 | J158: -3.5799999999999998e-002 | K158: 21 | L158: -4.3e-003 | M158: 121.6 | N158: 20.72 | O158: 0.27300000000000002 | P158: 101.35 | Q158: 已到 | R158: 5年25天 | S158: 3年25天 | T158: 3.01 | U158: 186 | V158: 0.48700000000000004 | W158: 9.0999999999999998e-002 | X158: 9.3000000000000013e-002 | Y158: 33 | Z158: 4.69 | AA158: -1.1899999999999999e-002 | AB158: -1.9e-002 | AC158: -6.3500000000000001e-002 | AD158: -6.59e-002 | AE158: 83.31 | AF158: 85.51 | AG158: 0.66 | AH158: A+ | AI158: 7.400000000000001e-002 | AJ158: =H158+100*O158 -> 156.30000000000001 | AK158: 156.6 | AL158: 186 | AM158: 71.1 | AN158: 230 | AO158: 0.221 | AP158: 17 | AQ158: 威唐转债!
A159: 21 | B159: 123119 | C159: 康泰转2! | D159: 300601 | E159: 康泰生物 | F159: 医药 | G159: 生物制药 | H159: 125.198 | I159: 3.2000000000000002e-003 | J159: -5.9999999999999995e-004 | K159: 112.72 | L159: 7.1999999999999998e-003 | M159: 117.1 | N159: 145.33 | O159: 0.61399999999999999 | P159: 77.56 | Q159: 2月2天 | R159: 5.65年 | S159: 3.65年 | T159: 20 | U159: 16 | V159: 6.0000000000000001e-003 | W159: 2.6000000000000002e-002 | X159: 2.e-002 | Y159: 774 | Z159: 9.1 | AA159: -1.2e-002 | AB159: -1.72e-002 | AC159: -4.8799999999999996e-002 | AD159: -5.04e-002 | AE159: 88.67 | AF159: 93.2 | AG159: 0.36 | AH159: AA | AI159: 4.2000000000000003e-002 | AJ159: =H159+100*O159 -> 186.59799999999998 | AK159: 172.8 | AL159: 265 | AM159: 79.6 | AN159: 262 | AO159: 1.4999999999999999e-002 | AP159: 9 | AQ159: 康泰转2!
A160: 167 | B160: 113594 | C160: 淳中转债! | D160: 603516 | E160: 淳中科技 | F160: 电子 | G160: 电子产品 | H160: 127.79 | I160: 1.72e-002 | J160: -1.1599999999999999e-002 | K160: 17.7 | L160: 2.0799999999999999e-002 | M160: 120.9 | N160: 27.84 | O160: 1.01 | P160: 63.58 | Q160: 已到 | R160: 4.67年 | S160: 2.67年 | T160: 3 | U160: 28 | V160: 7.400000000000001e-002 | W160: 9.0999999999999998e-002 | X160: 5.7999999999999996e-002 | Y160: 33 | Z160: 3.4 | AA160: -1.21e-002 | AB160: -1.9599999999999999e-002 | AC160: -7.0499999999999993e-002 | AD160: -7.2999999999999995e-002 | AE160: 85.56 | AF160: 87.93 | AG160: 0.27 | AH160: A+ | AI160: 7.2400000000000006e-002 | AJ160: =H160+100*O160 -> 228.79000000000002 | AK160: 192 | AL160: 310 | AM160: 104.1 | AN160: 311 | AO160: 4.2000000000000003e-002 | AP160: 9 | AQ160: 淳中转债!
A161: 124 | B161: 123073 | C161: 同和转债! | D161: 300636 | E161: 同和药业 | F161: 医药 | G161: 原料药 | H161: 129.33 | I161: 1.3899999999999999e-002 | J161: -5.3e-003 | K161: 16.9 | L161: 1.2e-002 | M161: 121.9 | N161: 14.82 | O161: 0.13400000000000001 | P161: 114.04 | Q161: 已到 | R161: 4.93年 | S161: 2.93年 | T161: 3.59 | U161: 16 | V161: 3.6000000000000004e-002 | W161: 0.10300000000000001 | X161: 0.11800000000000001 | Y161: 35 | Z161: 4.23 | AA161: -1.2199999999999999e-002 | AB161: -1.95e-002 | AC161: -6.83e-002 | AD161: -7.0499999999999993e-002 | AE161: 83.98 | AF161: 87.02 | AG161: 0.72 | AH161: A+ | AI161: 7.2400000000000006e-002 | AJ161: =H161+100*O161 -> 142.73000000000002 | AK161: 144.6 | AL161: 94 | AM161: 57.6 | AN161: 149 | AO161: 5.2000000000000005e-002 | AP161: 12 | AQ161: 同和转债!
A162: 195 | B162: 127017 | C162: 万青转债 | D162: 789. | E162: 万年青 | F162: 建筑 | G162: 水泥 | H162: 124.78 | I162: 2.0299999999999999e-002 | J162: -1.5700000000000002e-002 | K162: 11.67 | L162: 1.3000000000000001e-002 | M162: 118 | N162: 13.46 | O162: 0.439 | P162: 86.7 | Q162: 已到 | R162: 4.53年 | S162: 2.53年 | T162: 10 | U162: 18 | V162: 1.4999999999999999e-002 | W162: 0.107 | X162: 9.3000000000000013e-002 | Y162: 93 | Z162: 1.36 | AA162: -1.2500000000000001e-002 | AB162: -1.9299999999999998e-002 | AC162: -6.7900000000000002e-002 | AD162: -7.0099999999999996e-002 | AE162: 94.15 | AF162: 101.09 | AG162: 0.35 | AH162: AA+ | AI162: 3.5400000000000001e-002 | AJ162: =H162+100*O162 -> 168.68000000000001 | AK162: 162.9 | AL162: 227 | AM162: 61.8 | AN162: 178 | AO162: 1.e-002 | AP162: 7 | AQ162: 万青转债
A163: 180 | B163: 113591 | C163: 胜达转债! | D163: 603687 | E163: 大胜达 | F163: 造纸包装 | G163: 包装用纸 | H163: 129.18 | I163: -5.4000000000000003e-003 | J163: -8.3999999999999995e-003 | K163: 10.93 | L163: -1.89e-002 | M163: 121.7 | N163: 8.76 | O163: 3.5000000000000003e-002 | P163: 124.77 | Q163: 已到 | R163: 4.61年 | S163: 2.61年 | T163: 5.19 | U163: 34 | V163: 5.0000000000000003e-002 | W163: 0.11599999999999999 | X163: 0.14400000000000002 | Y163: 45 | Z163: 2.59 | AA163: -1.3100000000000001e-002 | AB163: -2.0899999999999998e-002 | AC163: -7.690000000000001e-002 | AD163: -7.9100000000000004e-002 | AE163: 87.96 | AF163: 93.01 | AG163: 0.73 | AH163: AA- | AI163: 6.1399999999999996e-002 | AJ163: =H163+100*O163 -> 132.68000000000001 | AK163: 133.6 | AL163: 16 | AM163: 40.6 | AN163: 34 | AO163: 0. | AP163: 32 | AQ163: 胜达转债!
A164: 230 | B164: 113565 | C164: 宏辉转债 | D164: 603336 | E164: 宏辉果蔬 | F164: 农业 | G164: 农产品加 | H164: 124.61 | I164: 1.46e-002 | J164: 3.4999999999999996e-003 | K164: 7.97 | L164: 2.8399999999999998e-002 | M164: 117.8 | N164: 7.64 | O164: 0.19500000000000001 | P164: 104.32 | Q164: 已到 | R164: 4.27年 | S164: 2.27年 | T164: 2.25 | U164: 141 | V164: 0.504 | W164: 6.4000000000000001e-002 | X164: 6.7000000000000004e-002 | Y164: 35 | Z164: 3.36 | AA164: -1.34e-002 | AB164: -2.0499999999999997e-002 | AC164: -7.3399999999999993e-002 | AD164: -7.5999999999999998e-002 | AE164: 89.88 | AF164: 91.93 | AG164: 0.64 | AH164: AA- | AI164: 6.1399999999999996e-002 | AJ164: =H164+100*O164 -> 144.11000000000001 | AK164: 144.9 | AL164: 96 | AM164: 53 | AN164: 121 | AO164: -5.0999999999999997e-002 | AP164: 28 | AQ164: 宏辉转债
A165: 80 | B165: 113618 | C165: 美诺转债! | D165: 603538 | E165: 美诺华 | F165: 医药 | G165: 原料药 | H165: 123.41 | I165: 6.1999999999999998e-003 | J165: 5.8999999999999999e-003 | K165: 32.75 | L165: 2.1499999999999998e-002 | M165: 115.3 | N165: 37.47 | O165: 0.41200000000000003 | P165: 87.4 | Q165: 已到 | R165: 5年55天 | S165: 3年55天 | T165: 5.2 | U165: 13 | V165: 2.e-002 | W165: 0.106 | X165: 9.3000000000000013e-002 | Y165: 49 | Z165: 2.9 | AA165: -1.34e-002 | AB165: -1.8600000000000002e-002 | AC165: -5.1299999999999998e-002 | AD165: -5.33e-002 | AE165: 84.96 | AF165: 84.77 | AG165: 0.56 | AH165: AA- | AI165: 6.3e-002 | AJ165: =H165+100*O165 -> 164.61000000000001 | AK165: 159.4 | AL165: 203 | AM165: 74.5 | AN165: 247 | AO165: 8.3000000000000004e-002 | AP165: 5 | AQ165: 美诺转债!
A166: 90 | B166: 128141 | C166: 旺能转债 | D166: 2034. | E166: 旺能环境 | F166: 城市公用 | G166: 三废处理 | H166: 123.204 | I166: 0. | J166: 2.2000000000000001e-003 | K166: 16.38 | L166: 3.7000000000000002e-003 | M166: 115.1 | N166: 15.97 | O166: 0.20100000000000001 | P166: 102.57 | Q166: 已到 | R166: 5年27天 | S166: 3年27天 | T166: 12.7 | U166: 5.7 | V166: 4.0000000000000001e-003 | W166: 0.18100000000000002 | X166: 0.185 | Y166: 70 | Z166: 1.4 | AA166: -1.3600000000000001e-002 | AB166: -1.8799999999999997e-002 | AC166: -5.2499999999999998e-002 | AD166: -5.45e-002 | AE166: 90.79 | AF166: 93.81 | AG166: 0.6 | AH166: AA | AI166: 4.2000000000000003e-002 | AJ166: =H166+100*O166 -> 143.304 | AK166: 143.8 | AL166: 81 | AM166: 50 | AN166: 102 | AO166: 5.0000000000000001e-003 | AP166: 8 | AQ166: 旺能转债
A167: 69 | B167: 128144 | C167: 利民转债! | D167: 2734. | E167: 利民股份 | F167: 化工 | G167: 农化 | H167: 122.8 | I167: 0. | J167: 1.1000000000000001e-002 | K167: 11.63 | L167: 1.84e-002 | M167: 114.1 | N167: 11.5 | O167: 0.214 | P167: 101.13 | Q167: 已到 | R167: 5.28年 | S167: 3.28年 | T167: 9.8 | U167: 25 | V167: 2.e-002 | W167: 0.22600000000000001 | X167: 0.22899999999999998 | Y167: 43 | Z167: 1.72 | AA167: -1.3999999999999999e-002 | AB167: -1.8700000000000001e-002 | AC167: -5.0499999999999996e-002 | AD167: -5.2000000000000005e-002 | AE167: 89.37 | AF167: 92.16 | AG167: 0.6 | AH167: AA | AI167: 4.2000000000000003e-002 | AJ167: =H167+100*O167 -> 144.19999999999999 | AK167: 144.5 | AL167: 91 | AM167: 52.3 | AN167: 116 | AO167: 9.6000000000000002e-002 | AP167: 6 | AQ167: 利民转债!
A168: 53 | B168: 123108 | C168: 乐普转2! | D168: 300003 | E168: 乐普医疗 | F168: 医药 | G168: 医疗器械 | H168: 118.043 | I168: 6.7000000000000002e-003 | J168: -4.7999999999999996e-003 | K168: 22.33 | L168: 7.1999999999999998e-003 | M168: 111.1 | N168: 29.5 | O168: 0.55899999999999994 | P168: 75.69 | Q168: 已到 | R168: 4.36年 | S168: 2.36年 | T168: 16.4 | U168: 4.6 | V168: 2.e-003 | W168: 4.0999999999999995e-002 | X168: 3.1e-002 | Y168: 403 | Z168: 3.5 | AA168: -1.3999999999999999e-002 | AB168: -1.8600000000000002e-002 | AC168: -5.6299999999999996e-002 | AD168: -5.7699999999999994e-002 | AE168: 93.52 | AF168: 95.67 | AG168: 0.27 | AH168: AA+ | AI168: 3.5400000000000001e-002 | AJ168: =H168+100*O168 -> 173.94299999999998 | AK168: 160.4 | AL168: 208 | AM168: 64.7 | AN168: 196 | AO168: -1.6e-002 | AP168: 12 | AQ168: 乐普转2!
A169: 168 | B169: 127020 | C169: 中金转债 | D169: 60. | E169: 中金岭南 | F169: 有色金属 | G169: 有色行业 | H169: 121.3 | I169: 3.0000000000000001e-003 | J169: 4.3e-003 | K169: 4.83 | L169: 1.26e-002 | M169: 113.5 | N169: 4.63 | O169: 0.16300000000000001 | P169: 104.32 | Q169: 已到 | R169: 4.66年 | S169: 2.66年 | T169: 34.3 | U169: 45 | V169: 1.1000000000000001e-002 | W169: 0.19399999999999998 | X169: 0.20300000000000001 | Y169: 176 | Z169: 1.4 | AA169: -1.43e-002 | AB169: -1.9400000000000001e-002 | AC169: -5.8799999999999998e-002 | AD169: -6.0299999999999999e-002 | AE169: 92.71 | AF169: 96.72 | AG169: 0.58 | AH169: AA+ | AI169: 3.5400000000000001e-002 | AJ169: =H169+100*O169 -> 137.59999999999999 | AK169: 138.3 | AL169: 32 | AM169: 41.6 | AN169: 39 | AO169: -9.0000000000000011e-003 | AP169: 20 | AQ169: 中金转债
A170: 15 | B170: 123122 | C170: 富瀚转债 | D170: 300613 | E170: 富瀚微 | F170: 电子 | G170: 芯片制造 | H170: 130.51 | I170: 3.9000000000000003e-003 | J170: 6.1999999999999998e-003 | K170: 151.68 | L170: 1.66e-002 | M170: 120.3 | N170: 177.04 | O170: 0.52300000000000002 | P170: 85.68 | Q170: 2月24天 | R170: 5.71年 | S170: 3.71年 | T170: 5.81 | U170: 34 | V170: 4.4999999999999998e-002 | W170: 3.2000000000000001e-002 | X170: 2.7000000000000003e-002 | Y170: 182 | Z170: 11.14 | AA170: -1.44e-002 | AB170: -2.0299999999999999e-002 | AC170: -5.8200000000000002e-002 | AD170: -5.9800000000000006e-002 | AE170: 78.77 | AF170: 80.63 | AG170: 0.61 | AH170: A+ | AI170: 7.400000000000001e-002 | AJ170: =H170+100*O170 -> 182.81 | AK170: 175.3 | AL170: 276 | AM170: 94.7 | AN170: 304 | AO170: -2.6000000000000002e-002 | AP170: 5 | AQ170: 富瀚转债
A171: 325 | B171: 113516 | C171: 苏农转债! | D171: 603323 | E171: 苏农银行 | F171: 金融 | G171: 银行行业 | H171: 117.8 | I171: 5.0000000000000001e-003 | J171: 5.9999999999999995e-004 | K171: 4.86 | L171: 1.67e-002 | M171: 113.3 | N171: 5.37 | O171: 0.30199999999999999 | P171: 90.5 | Q171: 已到 | R171: 2.70年 | S171: 无权 | T171: 12.9 | U171: 7.8 | V171: 5.0000000000000001e-003 | W171: 0.14699999999999999 | X171: 0.13300000000000001 | Y171: 88 | Z171: 0.68 | AA171: -1.46e-002 | AB171: -2.3300000000000001e-002 | AC171: 无权 | AD171: 无权 | AE171: 无权 | AF171: 103.65 | AG171: 0.34 | AH171: AA+ | AI171: 3.4099999999999998e-002 | AJ171: =H171+100*O171 -> 148. | AK171: 145.1 | AL171: 98 | AM171: 41.4 | AN171: 36 | AO171: -5.7999999999999996e-002 | AP171: 25 | AQ171: 苏农转债!
A172: 57 | B172: 127031 | C172: 洋丰转债! | D172: 902. | E172: 新洋丰 | F172: 化工 | G172: 农化 | H172: 126.701 | I172: 2.07e-002 | J172: -1.41e-002 | K172: 16.5 | L172: 1.66e-002 | M172: 117.1 | N172: 19.94 | O172: 0.53100000000000003 | P172: 82.75 | Q172: 已到 | R172: 5.34年 | S172: 3.34年 | T172: 10 | U172: 14 | V172: 1.2e-002 | W172: 4.5999999999999999e-002 | X172: 3.7999999999999999e-002 | Y172: 215 | Z172: 2.86 | AA172: -1.49e-002 | AB172: -2.0400000000000001e-002 | AC172: -5.62e-002 | AD172: -5.7999999999999996e-002 | AE172: 89.79 | AF172: 94.39 | AG172: 0.4 | AH172: AA | AI172: 4.2000000000000003e-002 | AJ172: =H172+100*O172 -> 179.80099999999999 | AK172: 170.7 | AL172: 262 | AM172: 76.3 | AN172: 251 | AO172: -5.5e-002 | AP172: 4 | AQ172: 洋丰转债!
A173: 223 | B173: 113570 | C173: 百达转债! | D173: 603331 | E173: 百达精工 | F173: 机械装备 | G173: 机械装备 | H173: 122.49 | I173: 1.24e-002 | J173: -1.18e-002 | K173: 11.58 | L173: 8.9999999999999998e-004 | M173: 114.9 | N173: 11.34 | O173: 0.20000000000000001 | P173: 102.12 | Q173: 已到 | R173: 4.30年 | S173: 2.30年 | T173: 2.8 | U173: 5 | V173: 1.4999999999999999e-002 | W173: 0.13600000000000001 | X173: 0.13900000000000001 | Y173: 21 | Z173: 2.54 | AA173: -1.5100000000000001e-002 | AB173: -2.1099999999999997e-002 | AC173: -6.6799999999999998e-002 | AD173: -6.9199999999999998e-002 | AE173: 87.15 | AF173: 85.62 | AG173: 0.67 | AH173: A+ | AI173: 7.2400000000000006e-002 | AJ173: =H173+100*O173 -> 142.49000000000001 | AK173: 142.9 | AL173: 63 | AM173: 55.7 | AN173: 141 | AO173: 6.6000000000000003e-002 | AP173: 31 | AQ173: 百达转债!
A174: 293 | B174: 110057 | C174: 现代转债 | D174: 600420 | E174: 国药现代 | F174: 医药 | G174: 化学制药 | H174: 115.99 | I174: 2.3999999999999998e-003 | J174: -8.9999999999999998e-004 | K174: 9.43 | L174: 3.2000000000000002e-003 | M174: 110.3 | N174: 9.79 | O174: 0.20399999999999999 | P174: 96.32 | Q174: 已到 | R174: 3.36年 | S174: 1.36年 | T174: 16.2 | U174: 5.4 | V174: 3.0000000000000001e-003 | W174: 0.16699999999999998 | X174: 0.161 | Y174: 97 | Z174: 1.15 | AA174: -1.52e-002 | AB174: -2.07e-002 | AC174: -7.6600000000000001e-002 | AD174: -7.980000000000001e-002 | AE174: 97.81 | AF174: 99 | AG174: 0.49 | AH174: AAA | AI174: 3.3399999999999999e-002 | AJ174: =H174+100*O174 -> 136.38999999999999 | AK174: 135.7 | AL174: 21 | AM174: 36.7 | AN174: 21 | AO174: 3.0000000000000001e-003 | AP174: 23 | AQ174: 现代转债
A175: 227 | B175: 113567 | C175: 君禾转债! | D175: 603617 | E175: 君禾股份 | F175: 机械装备 | G175: 通用设备 | H175: 126.75 | I175: 1.0700000000000001e-002 | J175: 8.3000000000000001e-003 | K175: 12.43 | L175: 2.7300000000000001e-002 | M175: 118.8 | N175: 11.16 | O175: 0.13800000000000001 | P175: 111.38 | Q175: 已到 | R175: 4.29年 | S175: 2.29年 | T175: 2.1 | U175: 68 | V175: 0.25700000000000001 | W175: 8.5000000000000006e-002 | X175: 9.4e-002 | Y175: 25 | Z175: 3.53 | AA175: -1.54e-002 | AB175: -2.2799999999999997e-002 | AC175: -7.85e-002 | AD175: -8.1199999999999994e-002 | AE175: 87.79 | AF175: 88.74 | AG175: 0.7 | AH175: A+ | AI175: 7.2400000000000006e-002 | AJ175: =H175+100*O175 -> 140.55000000000001 | AK175: 142.1 | AL175: 56 | AM175: 53.4 | AN175: 123 | AO175: 0.14999999999999999 | AP175: 32 | AQ175: 君禾转债!
A176: 54 | B176: 123107 | C176: 温氏转债! | D176: 300498 | E176: 温氏股份 | F176: 农业 | G176: 畜牧业 | H176: 122.663 | I176: -2.9999999999999997e-004 | J176: -1.0700000000000001e-002 | K176: 17.15 | L176: -2.e-002 | M176: 113 | N176: 17.62 | O176: 0.26000000000000001 | P176: 97.33 | Q176: 已到 | R176: 5.35年 | S176: 3.35年 | T176: 93 | U176: 132 | V176: 1.2e-002 | W176: 8.5000000000000006e-002 | X176: 8.3000000000000004e-002 | Y176: 1089. | Z176: 3.1 | AA176: -1.55e-002 | AB176: -1.9799999999999998e-002 | AC176: -4.7400000000000005e-002 | AD176: -4.9200000000000001e-002 | AE176: 91.79 | AF176: 94.32 | AG176: 0.55 | AH176: AAA | AI176: 3.5000000000000003e-002 | AJ176: =H176+100*O176 -> 148.66300000000001 | AK176: 148 | AL176: 125 | AM176: 53.7 | AN176: 126 | AO176: 2.7000000000000003e-002 | AP176: 13 | AQ176: 温氏转债!
A177: 118 | B177: 128136 | C177: 立讯转债! | D177: 2475. | E177: 立讯精密 | F177: 电子 | G177: 元器件制 | H177: 120.95 | I177: 1.8200000000000001e-002 | J177: -3.0000000000000001e-003 | K177: 43.1 | L177: 5.5099999999999996e-002 | M177: 111.8 | N177: 58.16 | O177: 0.63200000000000001 | P177: 74.11 | Q177: 已到 | R177: 4.95年 | S177: 2.95年 | T177: 30 | U177: 173 | V177: 4.8000000000000001e-002 | W177: 1.e-002 | X177: 6.9999999999999993e-003 | Y177: 3039. | Z177: 9.43 | AA177: -1.5900000000000001e-002 | AB177: -2.0199999999999999e-002 | AC177: -5.2400000000000002e-002 | AD177: -5.3699999999999998e-002 | AE177: 91.81 | AF177: 94.3 | AG177: 0.27 | AH177: AA+ | AI177: 3.5400000000000001e-002 | AJ177: =H177+100*O177 -> 184.15000000000001 | AK177: 167.8 | AL177: 256 | AM177: 73.5 | AN177: 242 | AO177: 7.5999999999999998e-002 | AP177: 14 | AQ177: 立讯转债!
A178: 81 | B178: 128143 | C178: 锋龙转债! | D178: 2931. | E178: 锋龙股份 | F178: 机械装备 | G178: 专用设备 | H178: 132.05 | I178: 8.1000000000000013e-003 | J178: -1.e-002 | K178: 15.31 | L178: -2.5999999999999999e-003 | M178: 121.7 | N178: 12.73 | O178: 9.8000000000000004e-002 | P178: 120.27 | Q178: 已到 | R178: 5年49天 | S178: 3年49天 | T178: 2.44 | U178: 12 | V178: 3.9e-002 | W178: 8.0000000000000002e-002 | X178: 9.6000000000000002e-002 | Y178: 30 | Z178: 4.8 | AA178: -1.61e-002 | AB178: -2.3099999999999999e-002 | AC178: -6.8900000000000003e-002 | AD178: -7.1300000000000002e-002 | AE178: 82.93 | AF178: 85.18 | AG178: 0.76 | AH178: A+ | AI178: 7.400000000000001e-002 | AJ178: =H178+100*O178 -> 141.85000000000002 | AK178: 143.8 | AL178: 79 | AM178: 58.7 | AN178: 157 | AO178: 6.9000000000000006e-002 | AP178: 14 | AQ178: 锋龙转债!
A179: 72 | B179: 123099 | C179: 普利转债 | D179: 300630 | E179: 普利制药 | F179: 医药 | G179: 化学制药 | H179: 135.2 | I179: 1.8100000000000002e-002 | J179: 1.77e-002 | K179: 54.75 | L179: 4.9699999999999994e-002 | M179: 123.5 | N179: 46.03 | O179: 0.13699999999999998 | P179: 118.94 | Q179: 已到 | R179: 5.22年 | S179: 3.22年 | T179: 8.5 | U179: 22 | V179: 1.9e-002 | W179: 3.6000000000000004e-002 | X179: 4.2000000000000003e-002 | Y179: 239 | Z179: 10.06 | AA179: -1.7500000000000002e-002 | AB179: -2.4799999999999999e-002 | AC179: -7.5600000000000001e-002 | AD179: -7.7499999999999999e-002 | AE179: 84.62 | AF179: 90.37 | AG179: 0.72 | AH179: AA- | AI179: 6.3e-002 | AJ179: =H179+100*O179 -> 148.89999999999998 | AK179: 151.5 | AL179: 159 | AM179: 61.1 | AN179: 173 | AO179: 0.10000000000000001 | AP179: 5 | AQ179: 普利转债
A180: 141 | B180: 128130 | C180: 景兴转债 | D180: 2067. | E180: 景兴纸业 | F180: 造纸包装 | G180: 包装用纸 | H180: 125.169 | I180: 2.5999999999999999e-003 | J180: 2.5999999999999999e-003 | K180: 3.86 | L180: 7.8000000000000005e-003 | M180: 114.8 | N180: 3.4 | O180: 0.10300000000000001 | P180: 113.53 | Q180: 已到 | R180: 4.78年 | S180: 2.78年 | T180: 9.99 | U180: 13 | V180: 1.1000000000000001e-002 | W180: 0.217 | X180: 0.24600000000000002 | Y180: 46 | Z180: 0.88 | AA180: -1.8200000000000001e-002 | AB180: -2.3599999999999999e-002 | AC180: -6.3500000000000001e-002 | AD180: -6.5500000000000003e-002 | AE180: 92.01 | AF180: 95.34 | AG180: 0.67 | AH180: AA | AI180: 4.0399999999999998e-002 | AJ180: =H180+100*O180 -> 135.46899999999999 | AK180: 136.8 | AL180: 25 | AM180: 41.5 | AN180: 37 | AO180: 2.4e-002 | AP180: 18 | AQ180: 景兴转债
A181: 263 | B181: 128079 | C181: 英联转债! | D181: 2846. | E181: 英联股份 | F181: 造纸包装 | G181: 包装材料 | H181: 125.565 | I181: 1.11e-002 | J181: -5.0000000000000001e-003 | K181: 7.42 | L181: 1.09e-002 | M181: 116.9 | N181: 8.29 | O181: 0.40299999999999997 | P181: 89.51 | Q181: 已到 | R181: 3.92年 | S181: 1.92年 | T181: 1.52 | U181: 18 | V181: 9.3000000000000013e-002 | W181: 6.4000000000000001e-002 | X181: 5.7999999999999996e-002 | Y181: 24 | Z181: 2.92 | AA181: -1.84e-002 | AB181: -2.58e-002 | AC181: -9.0899999999999995e-002 | AD181: -9.3399999999999997e-002 | AE181: 89.18 | AF181: 89.39 | AG181: 0.56 | AH181: A+ | AI181: 7.2400000000000006e-002 | AJ181: =H181+100*O181 -> 165.86500000000001 | AK181: 161.6 | AL181: 217 | AM181: 72.2 | AN181: 238 | AO181: 2.7999999999999997e-002 | AP181: 16 | AQ181: 英联转债!
A182: 174 | B182: 128119 | C182: 龙大转债! | D182: 2726. | E182: 龙大肉食 | F182: 食品饮料 | G182: 肉制品 | H182: 130.6 | I182: 1.34e-002 | J182: 2.6800000000000001e-002 | K182: 10.69 | L182: 6.1600000000000002e-002 | M182: 119.9 | N182: 9.29 | O182: 0.13500000000000001 | P182: 115.07 | Q182: 已到 | R182: 4.64年 | S182: 2.64年 | T182: 9.46 | U182: 44 | V182: 3.5000000000000003e-002 | W182: 8.199999999999999e-002 | X182: 9.4e-002 | Y182: 115 | Z182: 2.85 | AA182: -1.8600000000000002e-002 | AB182: -2.5699999999999997e-002 | AC182: -8.0299999999999996e-002 | AD182: -8.2400000000000001e-002 | AE182: 92.6 | AF182: 100.11 | AG182: 0.65 | AH182: AA | AI182: 4.0399999999999998e-002 | AJ182: =H182+100*O182 -> 144.09999999999999 | AK182: 146.1 | AL182: 109 | AM182: 46 | AN182: 76 | AO182: 7.2999999999999995e-002 | AP182: 8 | AQ182: 龙大转债!
A183: 92 | B183: 123087 | C183: 明电转债! | D183: 300739 | E183: 明阳电路 | F183: 电子 | G183: 元器件制 | H183: 133.5 | I183: 7.000000000000001e-004 | J183: -9.300000000000001e-003 | K183: 19.24 | L183: -1.18e-002 | M183: 121.2 | N183: 16.32 | O183: 0.13200000000000001 | P183: 117.89 | Q183: 已到 | R183: 5年25天 | S183: 4年25天 | T183: 4.19 | U183: 136 | V183: 0.24399999999999999 | W183: 7.400000000000001e-002 | X183: 8.6999999999999994e-002 | Y183: 57 | Z183: 3.42 | AA183: -1.9299999999999998e-002 | AB183: -2.6200000000000001e-002 | AC183: -5.2400000000000002e-002 | AD183: -5.5099999999999996e-002 | AE183: 82.8 | AF183: 89.6 | AG183: 0.73 | AH183: AA- | AI183: 6.3e-002 | AJ183: =H183+100*O183 -> 146.69999999999999 | AK183: 149.1 | AL183: 136 | AM183: 59.5 | AN183: 165 | AO183: 4.2999999999999997e-002 | AP183: 19 | AQ183: 明电转债!
A184: 365 | B184: 128014 | C184: 永东转债! | D184: 2753. | E184: 永东股份 | F184: 化工 | G184: 化工 | H184: 113 | I184: 8.8999999999999999e-003 | J184: -6.7000000000000002e-003 | K184: 8.84 | L184: 3.39e-002 | M184: 109.8 | N184: 12.52 | O184: 0.59999999999999998 | P184: 70.61 | Q184: 已到 | R184: 1.41年 | S184: 回售内 | T184: 3.37 | U184: 13 | V184: 3.5000000000000003e-002 | W184: 0.10199999999999999 | X184: 7.2000000000000008e-002 | Y184: 33 | Z184: 1.59 | AA184: -2.0499999999999997e-002 | AB184: -3.3000000000000002e-002 | AC184: 回售内 | AD184: 回售内 | AE184: 100.3 | AF184: 101.25 | AG184: 0.07 | AH184: AA- | AI184: 6.0100000000000001e-002 | AJ184: =H184+100*O184 -> 173. | AK184: 155.4 | AL184: 179 | AM184: 54.1 | AN184: 130 | AO184: 5.4000000000000006e-002 | AP184: 37 | AQ184: 永东转债!
A185: 240 | B185: 128091 | C185: 新天转债 | D185: 2873. | E185: 新天药业 | F185: 医药 | G185: 中药 | H185: 129.825 | I185: 1.7000000000000001e-003 | J185: -3.9000000000000003e-003 | K185: 13.33 | L185: -3.0000000000000001e-003 | M185: 119.4 | N185: 11.62 | O185: 0.13200000000000001 | P185: 114.72 | Q185: 已到 | R185: 4年40天 | S185: 2年40天 | T185: 1.76 | U185: 39 | V185: 0.16899999999999998 | W185: 8.1000000000000003e-002 | X185: 9.1999999999999998e-002 | Y185: 22 | Z185: 1.8 | AA185: -2.07e-002 | AB185: -2.86e-002 | AC185: -9.2200000000000004e-002 | AD185: -9.5500000000000002e-002 | AE185: 89.34 | AF185: 90.36 | AG185: 0.72 | AH185: A+ | AI185: 7.2400000000000006e-002 | AJ185: =H185+100*O185 -> 143.02499999999998 | AK185: 144.9 | AL185: 97 | AM185: 54.6 | AN185: 133 | AO185: -0.20899999999999999 | AP185: 21 | AQ185: 新天转债
A186: 237 | B186: 127015 | C186: 希望转债!! | D186: 876. | E186: 新 希 望 | F186: 农业 | G186: 畜牧业 | H186: 119.75 | I186: 3.8e-003 | J186: -7.4000000000000003e-003 | K186: 15.37 | L186: -1.3500000000000002e-002 | M186: 110 | N186: 19.75 | O186: 0.53900000000000003 | P186: 77.82 | Q186: 已到 | R186: 4年44天 | S186: 2年44天 | T186: 9.5 | U186: 15 | V186: 1.3999999999999999e-002 | W186: 1.3999999999999999e-002 | X186: 1.1000000000000001e-002 | Y186: 692 | Z186: 2.27 | AA186: -2.0799999999999999e-002 | AB186: -2.5099999999999997e-002 | AC186: -6.5599999999999992e-002 | AD186: -6.7599999999999993e-002 | AE186: 95.3 | AF186: 96.31 | AG186: 0.27 | AH186: AAA | AI186: 3.3399999999999999e-002 | AJ186: =H186+100*O186 -> 173.65000000000001 | AK186: 161.7 | AL186: 218 | AM186: 65.4 | AN186: 198 | AO186: 1.2e-002 | AP186: 28 | AQ186: 希望转债!!
A187: 37 | B187: 127035 | C187: 濮耐转债 | D187: 2225. | E187: 濮耐股份 | F187: 钢铁 | G187: 钢铁行业 | H187: 126.149 | I187: 5.3e-003 | J187: 5.1000000000000004e-003 | K187: 4.48 | L187: 1.8200000000000001e-002 | M187: 114.7 | N187: 4.43 | O187: 0.247 | P187: 101.13 | Q187: 11天 | R187: 4.51年 | S187: 2.51年 | T187: 6.26 | U187: 26 | V187: 3.3000000000000002e-002 | W187: 0.13800000000000001 | X187: 0.14000000000000001 | Y187: 45 | Z187: 1.48 | AA187: -2.1299999999999999e-002 | AB187: -2.69e-002 | AC187: -7.2000000000000008e-002 | AD187: -7.4200000000000002e-002 | AE187: 93.08 | AF187: 96.3 | AG187: 0.57 | AH187: AA | AI187: 4.0399999999999998e-002 | AJ187: =H187+100*O187 -> 150.84899999999999 | AK187: 151.2 | AL187: 157 | AM187: 54.9 | AN187: 136 | AO187: 3.3000000000000002e-002 | AP187: 10 | AQ187: 濮耐转债
A188: 332 | B188: 110045 | C188: 海澜转债! | D188: 600398 | E188: 海澜之家 | F188: 服装纺织 | G188: 服装行业 | H188: 116.88 | I188: 8.0000000000000004e-004 | J188: -1.9e-003 | K188: 6.41 | L188: -3.0999999999999999e-003 | M188: 110.3 | N188: 7.04 | O188: 0.28399999999999997 | P188: 91.05 | Q188: 已到 | R188: 2.64年 | S188: 0.64年 | T188: 29.5 | U188: 7.4 | V188: 2.e-003 | W188: 0.107 | X188: 9.6999999999999989e-002 | Y188: 277 | Z188: 1.96 | AA188: -2.1899999999999999e-002 | AB188: -2.8900000000000002e-002 | AC188: -0.16899999999999998 | AD188: -0.17199999999999999 | AE188: 98.51 | AF188: 101.05 | AG188: 0.36 | AH188: AA+ | AI188: 3.4099999999999998e-002 | AJ188: =H188+100*O188 -> 145.28 | AK188: 142.7 | AL188: 61 | AM188: 41.7 | AN188: 41 | AO188: -2.4e-002 | AP188: 44 | AQ188: 海澜转债!
A189: 120 | B189: 123075 | C189: 贝斯转债! | D189: 300580 | E189: 贝斯特 | F189: 汽车 | G189: 零部件制 | H189: 128.5 | I189: 3.7999999999999999e-002 | J189: -7.9000000000000008e-003 | K189: 23.44 | L189: 4.7400000000000005e-002 | M189: 115.1 | N189: 23.74 | O189: 0.30099999999999999 | P189: 98.74 | Q189: 已到 | R189: 4.95年 | S189: 2.95年 | T189: 6 | U189: 36 | V189: 4.7e-002 | W189: 0.128 | X189: 0.126 | Y189: 47 | Z189: 2.65 | AA189: -2.2400000000000003e-002 | AB189: -2.76e-002 | AC189: -6.7699999999999996e-002 | AD189: -6.9599999999999995e-002 | AE189: 86.03 | AF189: 86.19 | AG189: 0.64 | AH189: AA- | AI189: 6.1399999999999996e-002 | AJ189: =H189+100*O189 -> 158.59999999999999 | AK189: 158.3 | AL189: 197 | AM189: 72.1 | AN189: 236 | AO189: 9.9000000000000005e-002 | AP189: 8 | AQ189: 贝斯转债!
A190: 55 | B190: 110079 | C190: 杭银转债! | D190: 600926 | E190: 杭州银行 | F190: 金融 | G190: 银行行业 | H190: 126.93 | I190: 1.4999999999999999e-002 | J190: 1.8e-003 | K190: 14.55 | L190: 2.46e-002 | M190: 112.4 | N190: 12.99 | O190: 0.13300000000000001 | P190: 112.01 | Q190: 已到 | R190: 5.35年 | S190: 无权 | T190: 150 | U190: 123 | V190: 6.0000000000000001e-003 | W190: 0.17399999999999999 | X190: 0.19500000000000001 | Y190: 863 | Z190: 1.24 | AA190: -2.2799999999999997e-002 | AB190: -2.6800000000000001e-002 | AC190: 无权 | AD190: 无权 | AE190: 无权 | AF190: 93.77 | AG190: 0.68 | AH190: AAA | AI190: 3.5000000000000003e-002 | AJ190: =H190+100*O190 -> 140.23000000000002 | AK190: 141.9 | AL190: 53 | AM190: 48.1 | AN190: 89 | AO190: -4.0000000000000001e-003 | AP190: 13 | AQ190: 杭银转债!
A191: 243 | B191: 123038 | C191: 联得转债! | D191: 300545 | E191: 联得装备 | F191: 机械装备 | G191: 专用设备 | H191: 130.195 | I191: 1.3999999999999999e-002 | J191: 1.1399999999999999e-002 | K191: 23.92 | L191: 4.1399999999999999e-002 | M191: 118.6 | N191: 24.07 | O191: 0.31 | P191: 99.38 | Q191: 已到 | R191: 4年35天 | S191: 2年35天 | T191: 1.47 | U191: 42 | V191: 0.221 | W191: 3.5000000000000003e-002 | X191: 3.4000000000000002e-002 | Y191: 43 | Z191: 3.07 | AA191: -2.3e-002 | AB191: -3.0699999999999998e-002 | AC191: -9.6199999999999994e-002 | AD191: -9.9000000000000005e-002 | AE191: 88.85 | AF191: 89.74 | AG191: 0.61 | AH191: A+ | AI191: 7.2400000000000006e-002 | AJ191: =H191+100*O191 -> 161.19499999999999 | AK191: 161 | AL191: 214 | AM191: 71.3 | AN191: 231 | AO191: 4.2999999999999997e-002 | AP191: 19 | AQ191: 联得转债!
A192: 340 | B192: 127006 | C192: 敖东转债! | D192: 623. | E192: 吉林敖东 | F192: 金融 | G192: 证券行业 | H192: 113.5 | I192: 1.43e-002 | J192: -1.06e-002 | K192: 16.62 | L192: 1.6500000000000001e-002 | M192: 107.4 | N192: 20.22 | O192: 0.38100000000000001 | P192: 82.2 | Q192: 已到 | R192: 2.31年 | S192: 0.31年 | T192: 24.1 | U192: 12 | V192: 4.0000000000000001e-003 | W192: 0.125 | X192: 0.10199999999999999 | Y192: 193 | Z192: 0.8 | AA192: -2.3900000000000001e-002 | AB192: -2.98e-002 | AC192: -0.245 | AD192: -0.249 | AE192: 99.47 | AF192: 99.5 | AG192: 0.22 | AH192: AA+ | AI192: 3.4099999999999998e-002 | AJ192: =H192+100*O192 -> 151.59999999999999 | AK192: 144.8 | AL192: 95 | AM192: 45.3 | AN192: 70 | AO192: 1.4999999999999999e-002 | AP192: 27 | AQ192: 敖东转债!
A193: 337 | B193: 128039 | C193: 三力转债! | D193: 2224. | E193: 三 力 士 | F193: 机械装备 | G193: 专用设备 | H193: 115.6 | I193: 2.3999999999999998e-003 | J193: 7.000000000000001e-004 | K193: 5.06 | L193: 8.0000000000000002e-003 | M193: 108.8 | N193: 5.79 | O193: 0.32299999999999995 | P193: 87.39 | Q193: 已到 | R193: 2.55年 | S193: 0.55年 | T193: 2.02 | U193: 5.8 | V193: 2.5000000000000001e-002 | W193: 5.5e-002 | X193: 4.8000000000000001e-002 | Y193: 37 | Z193: 1.54 | AA193: -2.3900000000000001e-002 | AB193: -3.0099999999999998e-002 | AC193: -0.17600000000000002 | AD193: -0.17999999999999999 | AE193: 97.41 | AF193: 93.98 | AG193: 0.39 | AH193: AA- | AI193: 6.0100000000000001e-002 | AJ193: =H193+100*O193 -> 147.89999999999998 | AK193: 143.8 | AL193: 77 | AM193: 46.4 | AN193: 80 | AO193: 3.7999999999999999e-002 | AP193: 29 | AQ193: 三力转债!
A194: 268 | B194: 128075 | C194: 远东转债! | D194: 2406. | E194: 远东传动 | F194: 汽车 | G194: 零部件制 | H194: 125.627 | I194: 8.6999999999999994e-003 | J194: -2.e-003 | K194: 5.99 | L194: 1.01e-002 | M194: 114.3 | N194: 5.29 | O194: 0.109 | P194: 113.23 | Q194: 已到 | R194: 3.84年 | S194: 1.84年 | T194: 5.44 | U194: 11 | V194: 1.7000000000000001e-002 | W194: 0.14499999999999999 | X194: 0.16500000000000001 | Y194: 37 | Z194: 1.14 | AA194: -2.4700000000000003e-002 | AB194: -3.1099999999999999e-002 | AC194: -9.5600000000000004e-002 | AD194: -9.8000000000000004e-002 | AE194: 94.99 | AF194: 98.45 | AG194: 0.66 | AH194: AA | AI194: 4.0399999999999998e-002 | AJ194: =H194+100*O194 -> 136.52699999999999 | AK194: 138 | AL194: 30 | AM194: 39.6 | AN194: 32 | AO194: 4.2000000000000003e-002 | AP194: 16 | AQ194: 远东转债!
A195: 8 | B195: 123124 | C195: 晶瑞转2! | D195: 300655 | E195: 晶瑞电材 | F195: 电子 | G195: 电子行业 | H195: 128.3 | I195: 7.9000000000000008e-003 | J195: -9.5999999999999992e-003 | K195: 42.67 | L195: -2.5999999999999999e-003 | M195: 111.2 | N195: 50.31 | O195: 0.51300000000000001 | P195: 84.81 | Q195: 3月2天 | R195: 5.74年 | S195: 3.74年 | T195: 5.23 | U195: 26 | V195: 3.9e-002 | W195: 3.6000000000000004e-002 | X195: 3.1e-002 | Y195: 145 | Z195: 10.02 | AA195: -2.4900000000000002e-002 | AB195: -2.8399999999999998e-002 | AC195: -5.5599999999999997e-002 | AD195: -5.6900000000000006e-002 | AE195: 77.82 | AF195: 74.26 | AG195: 0.63 | AH195: A+ | AI195: 7.400000000000001e-002 | AJ195: =H195+100*O195 -> 179.60000000000002 | AK195: 171.8 | AL195: 264 | AM195: 94 | AN195: 303 | AO195: 3.7000000000000005e-002 | AP195: 5 | AQ195: 晶瑞转2!
A196: 289 | B196: 113024 | C196: 核建转债! | D196: 601611 | E196: 中国核建 | F196: 建筑 | G196: 建筑工程 | H196: 118.91 | I196: 8.3999999999999995e-003 | J196: -3.3e-003 | K196: 8.63 | L196: 1.29e-002 | M196: 109.3 | N196: 9.7 | O196: 0.33700000000000002 | P196: 88.97 | Q196: 已到 | R196: 3.38年 | S196: 1.38年 | T196: 30 | U196: 18 | V196: 5.0000000000000001e-003 | W196: 0.13100000000000001 | X196: 0.11699999999999999 | Y196: 229 | Z196: 1.84 | AA196: -2.5099999999999997e-002 | AB196: -2.9999999999999999e-002 | AC196: -9.0500000000000011e-002 | AD196: -9.3599999999999989e-002 | AE196: 97.75 | AF196: 98.05 | AG196: 0.39 | AH196: AAA | AI196: 3.3399999999999999e-002 | AJ196: =H196+100*O196 -> 152.61000000000001 | AK196: 148.9 | AL196: 133 | AM196: 50.8 | AN196: 106 | AO196: -2.1000000000000001e-002 | AP196: 33 | AQ196: 核建转债!
A197: 192 | B197: 123052 | C197: 飞鹿转债! | D197: 300665 | E197: 飞鹿股份 | F197: 化工 | G197: 化工 | H197: 141.917 | I197: 1.01e-002 | J197: -2.7000000000000001e-003 | K197: 9.3 | L197: 9.7999999999999997e-003 | M197: 126.8 | N197: 7.05 | O197: 7.5999999999999998e-002 | P197: 131.91 | Q197: 已到 | R197: 4.54年 | S197: 2.54年 | T197: 1.5 | U197: 40 | V197: 0.188 | W197: 9.3000000000000013e-002 | X197: 0.12300000000000001 | Y197: 16 | Z197: 3.16 | AA197: -2.5099999999999997e-002 | AB197: -3.44e-002 | AC197: -0.106 | AD197: -0.109 | AE197: 86.89 | AF197: 93.11 | AG197: 0.75 | AH197: A+ | AI197: 7.2400000000000006e-002 | AJ197: =H197+100*O197 -> 149.517 | AK197: 151.9 | AL197: 163 | AM197: 58.8 | AN197: 161 | AO197: 2.4e-002 | AP197: 23 | AQ197: 飞鹿转债!
A198: 101 | B198: 127026 | C198: 超声转债! | D198: 823. | E198: 超声电子 | F198: 电子 | G198: 元器件制 | H198: 128.268 | I198: 9.0000000000000011e-003 | J198: 4.4000000000000003e-003 | K198: 14 | L198: 1.9699999999999999e-002 | M198: 113.1 | N198: 12.72 | O198: 0.16500000000000001 | P198: 110.06 | Q198: 已到 | R198: 5年18天 | S198: 3年18天 | T198: 7 | U198: 21 | V198: 2.4e-002 | W198: 9.3000000000000013e-002 | X198: 0.10199999999999999 | Y198: 75 | Z198: 1.89 | AA198: -2.5099999999999997e-002 | AB198: -2.9600000000000001e-002 | AC198: -6.480000000000001e-002 | AD198: -6.6699999999999995e-002 | AE198: 90.88 | AF198: 92.28 | AG198: 0.68 | AH198: AA | AI198: 4.2000000000000003e-002 | AJ198: =H198+100*O198 -> 144.768 | AK198: 146.5 | AL198: 114 | AM198: 54.2 | AN198: 131 | AO198: 0.12300000000000001 | AP198: 13 | AQ198: 超声转债!
A199: 78 | B199: 113619 | C199: 世运转债! | D199: 603920 | E199: 世运电路 | F199: 电子 | G199: 元器件制 | H199: 131.21 | I199: 1.7100000000000001e-002 | J199: 7.9000000000000008e-003 | K199: 21.3 | L199: 3.9e-002 | M199: 115.2 | N199: 19.92 | O199: 0.22699999999999998 | P199: 106.93 | Q199: 已到 | R199: 5.17年 | S199: 3.17年 | T199: 10 | U199: 54 | V199: 4.2000000000000003e-002 | W199: 8.8000000000000009e-002 | X199: 9.4e-002 | Y199: 113 | Z199: 4.35 | AA199: -2.53e-002 | AB199: -3.04e-002 | AC199: -6.8699999999999997e-002 | AD199: -7.0599999999999996e-002 | AE199: 90.54 | AF199: 93.55 | AG199: 0.64 | AH199: AA | AI199: 4.2000000000000003e-002 | AJ199: =H199+100*O199 -> 153.91 | AK199: 155.5 | AL199: 180 | AM199: 61.9 | AN199: 180 | AO199: 6.9000000000000006e-002 | AP199: 6 | AQ199: 世运转债!
A200: 74 | B200: 123097 | C200: 美力转债 | D200: 300611 | E200: 美力科技 | F200: 机械装备 | G200: 通用设备 | H200: 138.64 | I200: 9.3200000000000005e-002 | J200: 2.2799999999999997e-002 | K200: 11.99 | L200: 0.14699999999999999 | M200: 121.6 | N200: 9.28 | O200: 7.2999999999999995e-002 | P200: 129.2 | Q200: 已到 | R200: 5.19年 | S200: 3.19年 | T200: 3 | U200: 2094. | V200: 4.9400000000000004 | W200: 0.14000000000000001 | X200: 0.18100000000000002 | Y200: 21 | Z200: 3.05 | AA200: -2.5499999999999998e-002 | AB200: -3.2300000000000002e-002 | AC200: -8.1500000000000003e-002 | AD200: -8.3699999999999997e-002 | AE200: 82.61 | AF200: 84.79 | AG200: 0.79 | AH200: A+ | AI200: 7.400000000000001e-002 | AJ200: =H200+100*O200 -> 145.94 | AK200: 148.1 | AL200: 127 | AM200: 63.3 | AN200: 187 | AO200: 0.28399999999999997 | AP200: 21 | AQ200: 美力转债
A201: 143 | B201: 113602 | C201: 景20转债! | D201: 603228 | E201: 景旺电子 | F201: 电子 | G201: 元器件制 | H201: 127.53 | I201: 6.9999999999999993e-003 | J201: 1.1599999999999999e-002 | K201: 28.99 | L201: 2.9100000000000001e-002 | M201: 112.9 | N201: 27.4 | O201: 0.20499999999999999 | P201: 105.8 | Q201: 已到 | R201: 4.76年 | S201: 2.76年 | T201: 17.8 | U201: 67 | V201: 2.9999999999999999e-002 | W201: 7.2000000000000008e-002 | X201: 7.5999999999999998e-002 | Y201: 247 | Z201: 3.66 | AA201: -2.5699999999999997e-002 | AB201: -3.04e-002 | AC201: -6.9699999999999998e-002 | AD201: -7.17e-002 | AE201: 92.18 | AF201: 93.86 | AG201: 0.64 | AH201: AA | AI201: 4.0399999999999998e-002 | AJ201: =H201+100*O201 -> 148.03 | AK201: 149.3 | AL201: 137 | AM201: 55.4 | AN201: 138 | AO201: 4.9000000000000002e-002 | AP201: 9 | AQ201: 景20转债!
A202: 355 | B202: 128022 | C202: 众信转债! | D202: 2707. | E202: 众信旅游 | F202: 旅游餐饮 | G202: 旅游 | H202: 114.787 | I202: 1.5800000000000002e-002 | J202: -1.5800000000000002e-002 | K202: 5.98 | L202: 1.3600000000000001e-002 | M202: 108.8 | N202: 7.92 | O202: 0.52000000000000002 | P202: 75.51 | Q202: 已到 | R202: 2年11天 | S202: 11天 | T202: 4.56 | U202: 34 | V202: 6.6000000000000003e-002 | W202: 8.4000000000000005e-002 | X202: 6.3e-002 | Y202: 54 | Z202: 10.49 | AA202: -2.6499999999999999e-002 | AB202: -3.4300000000000004e-002 | AC202: -0.6409999999999999 | AD202: -0.65500000000000003 | AE202: 100.02 | AF202: 93.16 | AG202: 0 | AH202: A | AI202: 8.1099999999999992e-002 | AJ202: =H202+100*O202 -> 166.78700000000001 | AK202: 154.1 | AL202: 172 | AM202: 54.1 | AN202: 128 | AO202: 0.17199999999999999 | AP202: 36 | AQ202: 众信转债!
A203: 175 | B203: 110071 | C203: 湖盐转债! | D203: 600929 | E203: 雪天盐业 | F203: 食品饮料 | G203: 食品饮料 | H203: 129.97 | I203: 8.3999999999999995e-003 | J203: 2.5099999999999997e-002 | K203: 7.93 | L203: 4.4800000000000006e-002 | M203: 114.9 | N203: 6.52 | O203: 6.9000000000000006e-002 | P203: 121.63 | Q203: 已到 | R203: 4.64年 | S203: 2.64年 | T203: 7.2 | U203: 189 | V203: 0.20000000000000001 | W203: 9.6999999999999989e-002 | X203: 0.11800000000000001 | Y203: 74 | Z203: 2.84 | AA203: -2.6699999999999998e-002 | AB203: -3.2199999999999999e-002 | AC203: -7.8899999999999998e-002 | AD203: -8.1000000000000003e-002 | AE203: 92.63 | AF203: 95.98 | AG203: 0.75 | AH203: AA | AI203: 4.0399999999999998e-002 | AJ203: =H203+100*O203 -> 136.87 | AK203: 138.3 | AL203: 33 | AM203: 42.3 | AN203: 45 | AO203: 0.183 | AP203: 20 | AQ203: 湖盐转债!
A204: 6 | B204: 123125 | C204: 元力转债 | D204: 300174 | E204: 元力股份 | F204: 化工 | G204: 化工 | H204: 127.77 | I204: 2.0400000000000001e-002 | J204: -6.1999999999999998e-003 | K204: 17.19 | L204: 2.0199999999999999e-002 | M204: 109.3 | N204: 17.61 | O204: 0.309 | P204: 97.61 | Q204: 3月20天 | R204: 5.79年 | S204: 3.79年 | T204: 9 | U204: 62 | V204: 5.4000000000000006e-002 | W204: 0.16800000000000001 | X204: 0.16399999999999998 | Y204: 54 | Z204: 3.06 | AA204: -2.69e-002 | AB204: -2.98e-002 | AC204: -5.3600000000000002e-002 | AD204: -5.4900000000000004e-002 | AE204: 80.8 | AF204: 77.11 | AG204: 0.7 | AH204: AA- | AI204: 6.3e-002 | AJ204: =H204+100*O204 -> 158.66999999999999 | AK204: 157.9 | AL204: 195 | AM204: 77.1 | AN204: 253 | AO204: 5.2999999999999999e-002 | AP204: 3 | AQ204: 元力转债
A205: 320 | B205: 128048 | C205: 张行转债 | D205: 2839. | E205: 张家港行 | F205: 金融 | G205: 银行行业 | H205: 121.8 | I205: 1.09e-002 | J205: -5.5000000000000005e-003 | K205: 5.74 | L205: 1.06e-002 | M205: 112.3 | N205: 5.6 | O205: 0.188 | P205: 102.5 | Q205: 已到 | R205: 2.98年 | S205: 无权 | T205: 25 | U205: 22 | V205: 6.9999999999999993e-003 | W205: 0.24100000000000002 | X205: 0.247 | Y205: 104 | Z205: 0.9 | AA205: -2.7300000000000001e-002 | AB205: -3.4500000000000003e-002 | AC205: 无权 | AD205: 无权 | AE205: 无权 | AF205: 101.78 | AG205: 0.51 | AH205: AA+ | AI205: 3.4099999999999998e-002 | AJ205: =H205+100*O205 -> 140.59999999999999 | AK205: 141.1 | AL205: 50 | AM205: 39.3 | AN205: 29 | AO205: -2.8999999999999998e-002 | AP205: 12 | AQ205: 张行转债
A206: 73 | B206: 123098 | C206: 一品转债! | D206: 300723 | E206: 一品红 | F206: 医药 | G206: 医药行业 | H206: 142.899 | I206: -1.2999999999999999e-003 | J206: -8.0000000000000004e-004 | K206: 33.86 | L206: -2.7000000000000001e-003 | M206: 124 | N206: 25.48 | O206: 7.4999999999999997e-002 | P206: 132.89 | Q206: 已到 | R206: 5.19年 | S206: 3.19年 | T206: 4.25 | U206: 33 | V206: 5.4000000000000006e-002 | W206: 4.4000000000000004e-002 | X206: 5.7999999999999996e-002 | Y206: 98 | Z206: 5.83 | AA206: -2.75e-002 | AB206: -3.49e-002 | AC206: -9.1400000000000009e-002 | AD206: -9.3299999999999994e-002 | AE206: 84.86 | AF206: 90.94 | AG206: 0.78 | AH206: AA- | AI206: 6.3e-002 | AJ206: =H206+100*O206 -> 150.399 | AK206: 152.9 | AL206: 170 | AM206: 62 | AN206: 181 | AO206: 5.0000000000000003e-002 | AP206: 7 | AQ206: 一品转债!
A207: 357 | B207: 123002 | C207: 国祯转债!! | D207: 300388 | E207: 节能国祯 | F207: 城市公用 | G207: 三废处理 | H207: 115.1 | I207: 4.6999999999999993e-003 | J207: -4.6999999999999993e-003 | K207: 7.34 | L207: 0. | M207: 108.8 | N207: 8.36 | O207: 0.311 | P207: 87.8 | Q207: 已到 | R207: 2年4.1天 | S207: 4.1天 | T207: 2.52 | U207: 3.4 | V207: 1.2e-002 | W207: 4.9000000000000002e-002 | X207: 4.2999999999999997e-002 | Y207: 51 | Z207: 1.39 | AA207: -2.81e-002 | AB207: -3.6000000000000004e-002 | AC207: -0.72699999999999998 | AD207: -0.74199999999999999 | AE207: 100.87 | AF207: 100.87 | AG207: 0.32 | AH207: AA | AI207: 3.9100000000000003e-002 | AJ207: =H207+100*O207 -> 146.19999999999999 | AK207: 142.4 | AL207: 58 | AM207: 41.5 | AN207: 38 | AO207: 1.8000000000000002e-002 | AP207: 17 | AQ207: 国祯转债!!
A208: 130 | B208: 127022 | C208: 恒逸转债 | D208: 703. | E208: 恒逸石化 | F208: 化工 | G208: 化工 | H208: 124.8 | I208: -7.000000000000001e-004 | J208: -2.9999999999999997e-004 | K208: 10.45 | L208: -1.9e-003 | M208: 108.7 | N208: 11.2 | O208: 0.33799999999999997 | P208: 93.3 | Q208: 已到 | R208: 4.90年 | S208: 2.90年 | T208: 20 | U208: 23 | V208: 9.0000000000000011e-003 | W208: 5.2000000000000005e-002 | X208: 4.9000000000000002e-002 | Y208: 383 | Z208: 1.48 | AA208: -2.81e-002 | AB208: -3.1300000000000001e-002 | AC208: -6.25e-002 | AD208: -6.3899999999999998e-002 | AE208: 92.12 | AF208: 91.87 | AG208: 0.53 | AH208: AA+ | AI208: 3.5400000000000001e-002 | AJ208: =H208+100*O208 -> 158.59999999999999 | AK208: 156.3 | AL208: 185 | AM208: 64.2 | AN208: 194 | AO208: -2.3e-002 | AP208: 7 | AQ208: 恒逸转债
A209: 150 | B209: 113600 | C209: 新星转债!! | D209: 603978 | E209: 深圳新星 | F209: 有色金属 | G209: 有色行业 | H209: 143.45 | I209: 2.3300000000000001e-002 | J209: -1.4999999999999999e-002 | K209: 28.95 | L209: 1.1899999999999999e-002 | M209: 125.6 | N209: 23.85 | O209: 0.182 | P209: 121.38 | Q209: 已到 | R209: 4.73年 | S209: 2.73年 | T209: 4.53 | U209: 624 | V209: 0.96400000000000008 | W209: 9.6000000000000002e-002 | X209: 0.11599999999999999 | Y209: 47 | Z209: 3.05 | AA209: -2.8199999999999999e-002 | AB209: -3.6799999999999999e-002 | AC209: -0.106 | AD209: -0.10800000000000001 | AE209: 87.25 | AF209: 95.28 | AG209: 0.7 | AH209: AA- | AI209: 6.1399999999999996e-002 | AJ209: =H209+100*O209 -> 161.64999999999998 | AK209: 165.5 | AL209: 248 | AM209: 70.2 | AN209: 226 | AO209: -5.4000000000000006e-002 | AP209: 26 | AQ209: 新星转债!!
A210: 16 | B210: 123121 | C210: 帝尔转债! | D210: 300776 | E210: 帝尔激光 | F210: 机械装备 | G210: 专用设备 | H210: 142 | I210: 1.95e-002 | J210: 2.0400000000000001e-002 | K210: 205.63 | L210: 5.7500000000000002e-002 | M210: 121 | N210: 192.24 | O210: 0.32799999999999996 | P210: 106.97 | Q210: 2月23天 | R210: 5.71年 | S210: 3.71年 | T210: 8.4 | U210: 1334. | V210: 1.1200000000000001 | W210: 3.9e-002 | X210: 4.0999999999999995e-002 | Y210: 218 | Z210: 10.8 | AA210: -2.8199999999999999e-002 | AB210: -3.4099999999999998e-002 | AC210: -7.8100000000000003e-002 | AD210: -7.9699999999999993e-002 | AE210: 82.21 | AF210: 85.99 | AG210: 0.69 | AH210: AA- | AI210: 6.3e-002 | AJ210: =H210+100*O210 -> 174.80000000000001 | AK210: 177 | AL210: 281 | AM210: 91 | AN210: 298 | AO210: 0.32899999999999996 | AP210: 4 | AQ210: 帝尔转债!
A211: 206 | B211: 128106 | C211: 华统转债 | D211: 2840. | E211: 华统股份 | F211: 农业 | G211: 农产品加 | H211: 127.74 | I211: -1.2999999999999999e-003 | J211: -5.3e-003 | K211: 10.86 | L211: -9.1000000000000004e-003 | M211: 112.9 | N211: 9.37 | O211: 0.10199999999999999 | P211: 115.9 | Q211: 已到 | R211: 4.39年 | S211: 2.39年 | T211: 5.35 | U211: 10 | V211: 1.4999999999999999e-002 | W211: 0.11 | X211: 0.128 | Y211: 49 | Z211: 2.88 | AA211: -2.8300000000000002e-002 | AB211: -3.3399999999999999e-002 | AC211: -8.0100000000000005e-002 | AD211: -8.2299999999999998e-002 | AE211: 93.55 | AF211: 95.25 | AG211: 0.72 | AH211: AA | AI211: 4.0399999999999998e-002 | AJ211: =H211+100*O211 -> 137.94 | AK211: 139.6 | AL211: 39 | AM211: 44.3 | AN211: 64 | AO211: 3.3000000000000002e-002 | AP211: 11 | AQ211: 华统转债
A212: 171 | B212: 128121 | C212: 宏川转债! | D212: 2930. | E212: 宏川智慧 | F212: 交通运输 | G212: 物流业 | H212: 129.089 | I212: 8.5000000000000006e-003 | J212: 5.9999999999999995e-004 | K212: 22.25 | L212: 1.23e-002 | M212: 112.9 | N212: 19.89 | O212: 0.154 | P212: 111.87 | Q212: 已到 | R212: 4.66年 | S212: 2.66年 | T212: 6.7 | U212: 22 | V212: 2.6000000000000002e-002 | W212: 6.7000000000000004e-002 | X212: 7.4999999999999997e-002 | Y212: 99 | Z212: 4.69 | AA212: -2.8900000000000002e-002 | AB212: -3.3700000000000001e-002 | AC212: -7.6200000000000004e-002 | AD212: -7.8200000000000006e-002 | AE212: 87.53 | AF212: 86.05 | AG212: 0.74 | AH212: AA- | AI212: 6.1399999999999996e-002 | AJ212: =H212+100*O212 -> 144.489 | AK212: 146.3 | AL212: 111 | AM212: 58.8 | AN212: 159 | AO212: -4.4999999999999998e-002 | AP212: 5 | AQ212: 宏川转债!
A213: 254 | B213: 113549 | C213: 白电转债 | D213: 603861 | E213: 白云电器 | F213: 能源电力 | G213: 电力设备 | H213: 128.28 | I213: -3.3e-003 | J213: 1.11e-002 | K213: 9.86 | L213: 1.23e-002 | M213: 114.3 | N213: 9.06 | O213: 0.17899999999999999 | P213: 108.83 | Q213: 已到 | R213: 3.99年 | S213: 1.99年 | T213: 8.06 | U213: 18 | V213: 1.7000000000000001e-002 | W213: 0.188 | X213: 0.20399999999999999 | Y213: 43 | Z213: 1.66 | AA213: -2.8999999999999998e-002 | AB213: -3.5200000000000002e-002 | AC213: -9.8299999999999998e-002 | AD213: -0.10000000000000001 | AE213: 94.45 | AF213: 97.88 | AG213: 0.63 | AH213: AA | AI213: 4.0399999999999998e-002 | AJ213: =H213+100*O213 -> 146.18000000000001 | AK213: 147.7 | AL213: 124 | AM213: 49.8 | AN213: 101 | AO213: 2.3e-002 | AP213: 39 | AQ213: 白电转债
A214: 59 | B214: 128145 | C214: 日丰转债 | D214: 2953. | E214: 日丰股份 | F214: 家电 | G214: 零部件制 | H214: 135.5 | I214: 8.8999999999999999e-003 | J214: 5.7999999999999996e-003 | K214: 17.29 | L214: 1.83e-002 | M214: 115.4 | N214: 13.66 | O214: 7.0999999999999994e-002 | P214: 126.57 | Q214: 已到 | R214: 5.33年 | S214: 3.33年 | T214: 3.8 | U214: 111 | V214: 0.218 | W214: 8.9999999999999997e-002 | X214: 0.114 | Y214: 42 | Z214: 3.68 | AA214: -3.0200000000000001e-002 | AB214: -3.5099999999999999e-002 | AC214: -7.4099999999999999e-002 | AD214: -7.5899999999999995e-002 | AE214: 83.94 | AF214: 83.88 | AG214: 0.81 | AH214: AA- | AI214: 6.3e-002 | AJ214: =H214+100*O214 -> 142.59999999999999 | AK214: 144.4 | AL214: 89 | AM214: 60.5 | AN214: 170 | AO214: 2.8999999999999998e-002 | AP214: 10 | AQ214: 日丰转债
A215: 3 | B215: 127046 | C215: 百润转债 | D215: 2568. | E215: 百润股份 | F215: 食品饮料 | G215: 葡萄酒洋 | H215: 137.43 | I215: 3.0999999999999999e-003 | J215: -9.7999999999999997e-003 | K215: 60.72 | L215: -1.2699999999999999e-002 | M215: 115.1 | N215: 66.89 | O215: 0.51400000000000001 | P215: 90.78 | Q215: 4月23天 | R215: 5.86年 | S215: 3.86年 | T215: 11.3 | U215: 23 | V215: 1.4999999999999999e-002 | W215: 2.5000000000000001e-002 | X215: 2.2000000000000002e-002 | Y215: 455 | Z215: 12.96 | AA215: -3.0299999999999997e-002 | AB215: -3.4700000000000002e-002 | AC215: -6.83e-002 | AD215: -6.9800000000000001e-002 | AE215: 87.91 | AF215: 90.84 | AG215: 0.52 | AH215: AA | AI215: 4.2000000000000003e-002 | AJ215: =H215+100*O215 -> 188.83000000000001 | AK215: 184.1 | AL215: 296 | AM215: 93.2 | AN215: 301 | AO215: -5.2999999999999999e-002 | AP215: 3 | AQ215: 百润转债
A216: 211 | B216: 113575 | C216: 东时转债!! | D216: 603377 | E216: 东方时尚 | F216: 其他 | G216: 其他 | H216: 129.25 | I216: 3.5999999999999999e-003 | J216: -2.7000000000000001e-003 | K216: 8.49 | L216: 4.6999999999999993e-003 | M216: 113.1 | N216: 12.15 | O216: 0.84999999999999998 | P216: 69.88 | Q216: 已到 | R216: 4.38年 | S216: 2.38年 | T216: 0.98 | U216: 34 | V216: 0.26700000000000002 | W216: 1.6e-002 | X216: 1.1000000000000001e-002 | Y216: 62 | Z216: 2.85 | AA216: -3.0600000000000002e-002 | AB216: -3.5699999999999996e-002 | AC216: -8.43e-002 | AD216: -8.6599999999999996e-002 | AE216: 93.59 | AF216: 95.44 | AG216: 0.2 | AH216: AA | AI216: 4.0399999999999998e-002 | AJ216: =H216+100*O216 -> 214.25 | AK216: 188.6 | AL216: 307 | AM216: 93.2 | AN216: 300 | AO216: 5.0000000000000003e-002 | AP216: 14 | AQ216: 东时转债!!
A217: 51 | B217: 123109 | C217: 昌红转债 | D217: 300151 | E217: 昌红科技 | F217: 机械装备 | G217: 专用设备 | H217: 142.868 | I217: 1.9e-002 | J217: -4.5000000000000005e-003 | K217: 37.8 | L217: 1.8000000000000002e-002 | M217: 121 | N217: 28.06 | O217: 6.0999999999999999e-002 | P217: 134.71 | Q217: 已到 | R217: 5.36年 | S217: 3.36年 | T217: 4.6 | U217: 60 | V217: 9.1999999999999998e-002 | W217: 2.4e-002 | X217: 3.3000000000000002e-002 | Y217: 190 | Z217: 18.39 | AA217: -3.1099999999999999e-002 | AB217: -3.7400000000000003e-002 | AC217: -8.6999999999999994e-002 | AD217: -8.8800000000000004e-002 | AE217: 83.97 | AF217: 87.82 | AG217: 0.8 | AH217: AA- | AI217: 6.3e-002 | AJ217: =H217+100*O217 -> 148.96799999999999 | AK217: 151 | AL217: 155 | AM217: 63.2 | AN217: 186 | AO217: 4.0000000000000001e-002 | AP217: 5 | AQ217: 昌红转债
A218: 265 | B218: 128076 | C218: 金轮转债! | D218: 2722. | E218: 金轮股份 | F218: 机械装备 | G218: 专用设备 | H218: 129.385 | I218: 1.9599999999999999e-002 | J218: -2.0899999999999998e-002 | K218: 15.89 | L218: -1.9e-003 | M218: 114.3 | N218: 14.66 | O218: 0.19399999999999998 | P218: 108.39 | Q218: 已到 | R218: 3.90年 | S218: 1.90年 | T218: 2.14 | U218: 23 | V218: 8.3000000000000004e-002 | W218: 7.6999999999999999e-002 | X218: 8.3000000000000004e-002 | Y218: 28 | Z218: 1.42 | AA218: -3.1800000000000002e-002 | AB218: -3.8100000000000002e-002 | AC218: -0.106 | AD218: -0.10800000000000001 | AE218: 90.97 | AF218: 91 | AG218: 0.68 | AH218: AA- | AI218: 6.1399999999999996e-002 | AJ218: =H218+100*O218 -> 148.785 | AK218: 150.4 | AL218: 149 | AM218: 59.4 | AN218: 163 | AO218: 3.4000000000000002e-002 | AP218: 38 | AQ218: 金轮转债!
A219: 111 | B219: 110077 | C219: 洪城转债 | D219: 600461 | E219: 洪城环境 | F219: 城市公用 | G219: 城市公用 | H219: 133.14 | I219: 2.0899999999999998e-002 | J219: -4.8999999999999998e-003 | K219: 8.04 | L219: 2.1600000000000001e-002 | M219: 113.5 | N219: 6.71 | O219: 0.111 | P219: 119.82 | Q219: 已到 | R219: 5年0.1天 | S219: 3年0.1天 | T219: 17.7 | U219: 41 | V219: 1.7000000000000001e-002 | W219: 0.23100000000000001 | X219: 0.27699999999999997 | Y219: 77 | Z219: 1.41 | AA219: -3.1800000000000002e-002 | AB219: -3.6400000000000002e-002 | AC219: -8.0399999999999985e-002 | AD219: -8.1600000000000006e-002 | AE219: 91.21 | AF219: 94.88 | AG219: 0.74 | AH219: AA+ | AI219: 3.7000000000000005e-002 | AJ219: =H219+100*O219 -> 144.23999999999998 | AK219: 146.5 | AL219: 113 | AM219: 51.6 | AN219: 112 | AO219: -3.5000000000000003e-002 | AP219: 7 | AQ219: 洪城转债
A220: 203 | B220: 123050 | C220: 聚飞转债! | D220: 300303 | E220: 聚飞光电 | F220: 电子 | G220: LED制 | H220: 142.8 | I220: 1.95e-002 | J220: -5.4000000000000003e-003 | K220: 6.29 | L220: 1.9400000000000001e-002 | M220: 123.8 | N220: 5.08 | O220: 0.153 | P220: 123.82 | Q220: 已到 | R220: 4.40年 | S220: 2.40年 | T220: 3.75 | U220: 114 | V220: 0.214 | W220: 4.4000000000000004e-002 | X220: 5.5e-002 | Y220: 84 | Z220: 3.04 | AA220: -3.2599999999999997e-002 | AB220: -4.1200000000000001e-002 | AC220: -0.11699999999999999 | AD220: -0.12 | AE220: 89.18 | AF220: 95.84 | AG220: 0.72 | AH220: AA- | AI220: 6.1399999999999996e-002 | AJ220: =H220+100*O220 -> 158.10000000000002 | AK220: 161.8 | AL220: 220 | AM220: 65.9 | AN220: 205 | AO220: 3.7000000000000005e-002 | AP220: 13 | AQ220: 聚飞转债!
A221: 48 | B221: 123112 | C221: 万讯转债! | D221: 300112 | E221: 万讯自控 | F221: 机械装备 | G221: 专用设备 | H221: 148.201 | I221: 4.2599999999999999e-002 | J221: 1.43e-002 | K221: 12.3 | L221: 7.1399999999999991e-002 | M221: 124.4 | N221: 8.93 | O221: 7.5999999999999998e-002 | P221: 137.74 | Q221: 已到 | R221: 5.38年 | S221: 3.38年 | T221: 2.46 | U221: 439 | V221: 1.2 | W221: 7.0000000000000007e-002 | X221: 9.6000000000000002e-002 | Y221: 35 | Z221: 3.23 | AA221: -3.2599999999999997e-002 | AB221: -3.9800000000000002e-002 | AC221: -9.5100000000000004e-002 | AD221: -9.6999999999999989e-002 | AE221: 84.2 | AF221: 90.21 | AG221: 0.8 | AH221: AA- | AI221: 6.3e-002 | AJ221: =H221+100*O221 -> 155.80099999999999 | AK221: 158.7 | AL221: 200 | AM221: 68.5 | AN221: 220 | AO221: 7.2000000000000008e-002 | AP221: 14 | AQ221: 万讯转债!
A222: 169 | B222: 113593 | C222: 沪工转债! | D222: 603131 | E222: 上海沪工 | F222: 机械装备 | G222: 通用设备 | H222: 141.15 | I222: 6.4899999999999999e-002 | J222: 1.1000000000000001e-002 | K222: 25.99 | L222: 9.9900000000000003e-002 | M222: 121.2 | N222: 21.12 | O222: 0.14699999999999999 | P222: 123.06 | Q222: 已到 | R222: 4.66年 | S222: 2.66年 | T222: 4 | U222: 433 | V222: 0.77099999999999991 | W222: 4.8000000000000001e-002 | X222: 5.9999999999999998e-002 | Y222: 83 | Z222: 6.22 | AA222: -3.2799999999999996e-002 | AB222: -4.0199999999999993e-002 | AC222: -0.10099999999999999 | AD222: -0.10400000000000001 | AE222: 85.67 | AF222: 88.17 | AG222: 0.76 | AH222: A+ | AI222: 7.2400000000000006e-002 | AJ222: =H222+100*O222 -> 155.84999999999999 | AK222: 159.2 | AL222: 202 | AM222: 71.1 | AN222: 229 | AO222: 0.13200000000000001 | AP222: 10 | AQ222: 沪工转债!
A223: 310 | B223: 128053 | C223: 尚荣转债! | D223: 2551. | E223: 尚荣医疗 | F223: 医药 | G223: 医疗器械 | H223: 127.2 | I223: 8.0000000000000004e-004 | J223: -8.0000000000000004e-004 | K223: 4.77 | L223: 2.0999999999999999e-003 | M223: 114.3 | N223: 4.88 | O223: 0.30099999999999999 | P223: 97.75 | Q223: 已到 | R223: 3.24年 | S223: 1.24年 | T223: 1.91 | U223: 19 | V223: 7.8e-002 | W223: 4.7e-002 | X223: 4.5999999999999999e-002 | Y223: 40 | Z223: 1.27 | AA223: -3.3099999999999997e-002 | AB223: -4.07e-002 | AC223: -0.13100000000000001 | AD223: -0.13400000000000001 | AE223: 97.3 | AF223: 100.82 | AG223: 0 | AH223: AA | AI223: 4.0399999999999998e-002 | AJ223: =H223+100*O223 -> 157.30000000000001 | AK223: 156.7 | AL223: 187 | AM223: 55.8 | AN223: 143 | AO223: 2.2000000000000002e-002 | AP223: 22 | AQ223: 尚荣转债!
A224: 244 | B224: 113030 | C224: 东风转债! | D224: 601515 | E224: 东风股份 | F224: 造纸包装 | G224: 包装材料 | H224: 133.91 | I224: 9.1999999999999998e-003 | J224: -1.54e-002 | K224: 7.06 | L224: -9.7999999999999997e-003 | M224: 116.9 | N224: 6.4 | O224: 0.214 | P224: 110.31 | Q224: 已到 | R224: 4年34天 | S224: 2年34天 | T224: 2.95 | U224: 63 | V224: 0.159 | W224: 2.7000000000000003e-002 | X224: 2.9999999999999999e-002 | Y224: 108 | Z224: 2.08 | AA224: -3.3300000000000003e-002 | AB224: -4.0199999999999993e-002 | AC224: -0.109 | AD224: -0.111 | AE224: 94.65 | AF224: 99.77 | AG224: 0.63 | AH224: AA | AI224: 4.0399999999999998e-002 | AJ224: =H224+100*O224 -> 155.31 | AK224: 157.5 | AL224: 192 | AM224: 57.7 | AN224: 151 | AO224: 4.8000000000000001e-002 | AP224: 18 | AQ224: 东风转债!
A225: 133 | B225: 128134 | C225: 鸿路转债! | D225: 2541. | E225: 鸿路钢构 | F225: 建筑 | G225: 其他建材 | H225: 135.226 | I225: 1.9e-002 | J225: -1.8100000000000002e-002 | K225: 48.45 | L225: 1.4000000000000002e-003 | M225: 114.8 | N225: 43.51 | O225: 0.214 | P225: 111.35 | Q225: 已到 | R225: 4.89年 | S225: 2.89年 | T225: 15.7 | U225: 9.7 | V225: 5.0000000000000001e-003 | W225: 6.0999999999999999e-002 | X225: 6.8000000000000005e-002 | Y225: 257 | Z225: 3.87 | AA225: -3.3500000000000002e-002 | AB225: -3.8599999999999995e-002 | AC225: -8.5000000000000006e-002 | AD225: -8.6800000000000002e-002 | AE225: 91.62 | AF225: 94.94 | AG225: 0.67 | AH225: AA | AI225: 4.0399999999999998e-002 | AJ225: =H225+100*O225 -> 156.626 | AK225: 159.1 | AL225: 201 | AM225: 64.2 | AN225: 193 | AO225: 5.5999999999999994e-002 | AP225: 4 | AQ225: 鸿路转债!
A226: 86 | B226: 123091 | C226: 长海转债 | D226: 300196 | E226: 长海股份 | F226: 其他 | G226: 非金属矿 | H226: 138 | I226: 1.03e-002 | J226: -1.9e-003 | K226: 18.53 | L226: 1.2e-002 | M226: 116.2 | N226: 16.14 | O226: 0.20199999999999999 | P226: 114.81 | Q226: 已到 | R226: 5年33天 | S226: 3年33天 | T226: 5.5 | U226: 39 | V226: 5.0000000000000003e-002 | W226: 7.2999999999999995e-002 | X226: 8.3000000000000004e-002 | Y226: 76 | Z226: 2.34 | AA226: -3.3799999999999997e-002 | AB226: -3.9199999999999999e-002 | AC226: -8.4700000000000011e-002 | AD226: -8.6599999999999996e-002 | AE226: 90.83 | AF226: 94.66 | AG226: 0.7 | AH226: AA | AI226: 4.2000000000000003e-002 | AJ226: =H226+100*O226 -> 158.19999999999999 | AK226: 161.2 | AL226: 216 | AM226: 66.5 | AN226: 209 | AO226: 6.9000000000000006e-002 | AP226: 4 | AQ226: 长海转债
A227: 34 | B227: 123115 | C227: 捷捷转债 | D227: 300623 | E227: 捷捷微电 | F227: 电子 | G227: 元器件制 | H227: 143 | I227: 1.4199999999999999e-002 | J227: 1.6799999999999999e-002 | K227: 32.19 | L227: 4.3099999999999999e-002 | M227: 118.5 | N227: 29 | O227: 0.28800000000000003 | P227: 111 | Q227: 25天 | R227: 5.55年 | S227: 3.55年 | T227: 12 | U227: 61 | V227: 3.6000000000000004e-002 | W227: 5.0000000000000003e-002 | X227: 5.5999999999999994e-002 | Y227: 237 | Z227: 8.34 | AA227: -3.39e-002 | AB227: -3.9399999999999998e-002 | AC227: -8.3199999999999996e-002 | AD227: -8.4900000000000003e-002 | AE227: 82.95 | AF227: 85.02 | AG227: 0.72 | AH227: AA- | AI227: 6.3e-002 | AJ227: =H227+100*O227 -> 171.80000000000001 | AK227: 175 | AL227: 273 | AM227: 90 | AN227: 292 | AO227: 2.8999999999999998e-002 | AP227: 7 | AQ227: 捷捷转债
A228: 202 | B228: 113577 | C228: 春秋转债! | D228: 603890 | E228: 春秋电子 | F228: 电子 | G228: 电子产品 | H228: 137.03 | I228: 5.1399999999999994e-002 | J228: 1.11e-002 | K228: 13.5 | L228: 8.2599999999999993e-002 | M228: 117.7 | N228: 10.85 | O228: 0.10099999999999999 | P228: 124.42 | Q228: 已到 | R228: 4.40年 | S228: 2.40年 | T228: 1.78 | U228: 450 | V228: 1.79 | W228: 2.9999999999999999e-002 | X228: 3.7000000000000005e-002 | Y228: 59 | Z228: 2.39 | AA228: -3.4700000000000002e-002 | AB228: -4.1399999999999999e-002 | AC228: -0.10300000000000001 | AD228: -0.106 | AE228: 89.08 | AF228: 91.13 | AG228: 0.76 | AH228: AA- | AI228: 6.1399999999999996e-002 | AJ228: =H228+100*O228 -> 147.13 | AK228: 149.6 | AL228: 141 | AM228: 58.5 | AN228: 154 | AO228: 0.17199999999999999 | AP228: 16 | AQ228: 春秋转债!
A229: 36 | B229: 127036 | C229: 三花转债 | D229: 2050. | E229: 三花智控 | F229: 机械装备 | G229: 通用设备 | H229: 138.8 | I229: 3.7000000000000002e-003 | J229: 3.3e-003 | K229: 23.49 | L229: 1.0800000000000001e-002 | M229: 114.5 | N229: 21.55 | O229: 0.27300000000000002 | P229: 109 | Q229: 17天 | R229: 5.53年 | S229: 3.53年 | T229: 30 | U229: 17 | V229: 4.0000000000000001e-003 | W229: 3.6000000000000004e-002 | X229: 3.9e-002 | Y229: 844 | Z229: 8.17 | AA229: -3.4700000000000002e-002 | AB229: -3.9100000000000003e-002 | AC229: -7.7899999999999997e-002 | AD229: -7.9299999999999995e-002 | AE229: 90.13 | AF229: 93.95 | AG229: 0.65 | AH229: AA+ | AI229: 3.7000000000000005e-002 | AJ229: =H229+100*O229 -> 166.10000000000002 | AK229: 168.6 | AL229: 258 | AM229: 74.6 | AN229: 248 | AO229: -2.7000000000000003e-002 | AP229: 6 | AQ229: 三花转债
A230: 121 | B230: 113607 | C230: 伟20转债! | D230: 603568 | E230: 伟明环保 | F230: 城市公用 | G230: 三废处理 | H230: 136.77 | I230: 5.1000000000000004e-003 | J230: 1.8e-003 | K230: 29.41 | L230: 8.6e-003 | M230: 114.8 | N230: 21.71 | O230: 1.e-002 | P230: 135.47 | Q230: 已到 | R230: 4.95年 | S230: 2.95年 | T230: 10.8 | U230: 43 | V230: 2.8999999999999998e-002 | W230: 2.8999999999999998e-002 | X230: 4.0000000000000001e-002 | Y230: 370 | Z230: 5.97 | AA230: -3.5299999999999998e-002 | AB230: -4.0399999999999998e-002 | AC230: -8.6599999999999996e-002 | AD230: -8.8399999999999992e-002 | AE230: 91.39 | AF230: 94.69 | AG230: 0.81 | AH230: AA | AI230: 4.0399999999999998e-002 | AJ230: =H230+100*O230 -> 137.77000000000001 | AK230: 138.1 | AL230: 31 | AM230: 43.4 | AN230: 52 | AO230: 5.2999999999999999e-002 | AP230: 11 | AQ230: 伟20转债!
A231: 131 | B231: 110075 | C231: 南航转债 | D231: 600029 | E231: 南方航空 | F231: 交通运输 | G231: 航空运输 | H231: 131.03 | I231: 8.199999999999999e-003 | J231: 1.5e-003 | K231: 6.73 | L231: 1.5100000000000001e-002 | M231: 109.8 | N231: 6.24 | O231: 0.215 | P231: 107.85 | Q231: 已到 | R231: 4.90年 | S231: 2.90年 | T231: 59 | U231: 35 | V231: 4.0000000000000001e-003 | W231: 5.2000000000000005e-002 | X231: 5.5999999999999994e-002 | Y231: 1141. | Z231: 1.55 | AA231: -3.5799999999999998e-002 | AB231: -3.9300000000000002e-002 | AC231: -7.85e-002 | AD231: -7.9699999999999993e-002 | AE231: 92.31 | AF231: 93.66 | AG231: 0.65 | AH231: AAA | AI231: 3.3399999999999999e-002 | AJ231: =H231+100*O231 -> 152.53 | AK231: 154.2 | AL231: 174 | AM231: 60.5 | AN231: 171 | AO231: 3.4000000000000002e-002 | AP231: 8 | AQ231: 南航转债
A232: 297 | B232: 123024 | C232: 岱勒转债! | D232: 300700 | E232: 岱勒新材 | F232: 机械装备 | G232: 专用设备 | H232: 122.48 | I232: 3.5999999999999999e-003 | J232: 1.5e-003 | K232: 13.96 | L232: 9.3999999999999986e-003 | M232: 112.5 | N232: 14.1 | O232: 0.23699999999999999 | P232: 99.01 | Q232: 已到 | R232: 2.33年 | S232: 0.33年 | T232: 2.1 | U232: 11 | V232: 4.2999999999999997e-002 | W232: 0.14000000000000001 | X232: 0.13900000000000001 | Y232: 15 | Z232: 3.16 | AA232: -3.6299999999999999e-002 | AB232: -4.5499999999999999e-002 | AC232: -0.36799999999999999 | AD232: -0.37200000000000005 | AE232: 97.85 | AF232: 96.07 | AG232: 0.53 | AH232: A+ | AI232: 7.1099999999999997e-002 | AJ232: =H232+100*O232 -> 146.18000000000001 | AK232: 146 | AL232: 106 | AM232: 48.1 | AN232: 90 | AO232: 9.0999999999999998e-002 | AP232: 37 | AQ232: 岱勒转债!
A233: 247 | B233: 128085 | C233: 鸿达转债!! | D233: 2002. | E233: 鸿达兴业 | F233: 化工 | G233: 化工 | H233: 144.65 | I233: 5.8899999999999994e-002 | J233: 4.0000000000000001e-003 | K233: 5.57 | L233: 6.3e-002 | M233: 124.4 | N233: 3.91 | O233: 1.4999999999999999e-002 | P233: 142.46 | Q233: 已到 | R233: 4年26天 | S233: 2年26天 | T233: 3.43 | U233: 988 | V233: 2.0099999999999998 | W233: 2.e-002 | X233: 2.7999999999999997e-002 | Y233: 174 | Z233: 1.67 | AA233: -3.7200000000000004e-002 | AB233: -4.6600000000000003e-002 | AC233: -0.107 | AD233: -0.109 | AE233: 73.13 | AF233: 66.32 | AG233: 1 | AH233: B | AI233: 0.1724 | AJ233: =H233+100*O233 -> 146.15000000000001 | AK233: 146.8 | AL233: 116 | AM233: 73.7 | AN233: 245 | AO233: 5.4000000000000006e-002 | AP233: 90 | AQ233: 鸿达转债!!
A234: 117 | B234: 128137 | C234: 洁美转债 | D234: 2859. | E234: 洁美科技 | F234: 电子 | G234: 元器件制 | H234: 141.5 | I234: 1.29e-002 | J234: 1.6399999999999998e-002 | K234: 32.04 | L234: 3.9199999999999999e-002 | M234: 116.9 | N234: 27.63 | O234: 0.22 | P234: 115.96 | Q234: 已到 | R234: 4.96年 | S234: 2.96年 | T234: 5.99 | U234: 49 | V234: 5.7999999999999996e-002 | W234: 4.5999999999999999e-002 | X234: 5.2999999999999999e-002 | Y234: 131 | Z234: 6.67 | AA234: -3.8399999999999997e-002 | AB234: -4.41e-002 | AC234: -9.6199999999999994e-002 | AD234: -9.8000000000000004e-002 | AE234: 85.97 | AF234: 87.49 | AG234: 0.75 | AH234: AA- | AI234: 6.1399999999999996e-002 | AJ234: =H234+100*O234 -> 163.5 | AK234: 167 | AL234: 251 | AM234: 79.5 | AN234: 261 | AO234: 8.9999999999999997e-002 | AP234: 5 | AQ234: 洁美转债
A235: 252 | B235: 128081 | C235: 海亮转债! | D235: 2203. | E235: 海亮股份 | F235: 有色金属 | G235: 铜金属 | H235: 134.542 | I235: 1.9299999999999998e-002 | J235: 2.5999999999999999e-003 | K235: 12.46 | L235: 2.81e-002 | M235: 114.9 | N235: 9.69 | O235: 4.5999999999999999e-002 | P235: 128.59 | Q235: 已到 | R235: 4年1.1天 | S235: 2年1.1天 | T235: 30.1 | U235: 62 | V235: 1.4999999999999999e-002 | W235: 0.12300000000000001 | X235: 0.158 | Y235: 245 | Z235: 2.45 | AA235: -3.95e-002 | AB235: -4.5700000000000005e-002 | AC235: -0.115 | AD235: -0.11800000000000001 | AE235: 94.99 | AF235: 98.42 | AG235: 0.78 | AH235: AA | AI235: 4.0399999999999998e-002 | AJ235: =H235+100*O235 -> 139.142 | AK235: 140.5 | AL235: 46 | AM235: 42.1 | AN235: 43 | AO235: 8.6999999999999994e-002 | AP235: 47 | AQ235: 海亮转债!
A236: 39 | B236: 111000 | C236: 起帆转债 | D236: 605222 | E236: 起帆电缆 | F236: 能源电力 | G236: 电力设备 | H236: 150.27 | I236: -4.4800000000000006e-002 | J236: 0. | K236: 29.8 | L236: -5.2199999999999996e-002 | M236: 120.5 | N236: 20.1 | O236: 1.3999999999999999e-002 | P236: 148.26 | Q236: 9天 | R236: 5.51年 | S236: 3.51年 | T236: 10 | U236: 800 | V236: 0.52200000000000002 | W236: 8.0000000000000002e-002 | X236: 0.11900000000000001 | Y236: 125 | Z236: 3.59 | AA236: -4.0000000000000001e-002 | AB236: -4.5999999999999999e-002 | AC236: -9.6500000000000002e-002 | AD236: -9.820000000000001e-002 | AE236: 83.16 | AF236: 86.67 | AG236: 0.86 | AH236: AA- | AI236: 6.3e-002 | AJ236: =H236+100*O236 -> 151.67000000000002 | AK236: 152.3 | AL236: 166 | AM236: 65.6 | AN236: 200 | AO236: 0.23199999999999998 | AP236: 10 | AQ236: 起帆转债
A237: 336 | B237: 128040 | C237: 华通转债! | D237: 2758. | E237: 浙农股份 | F237: 医药 | G237: 医药商业 | H237: 123.671 | I237: 3.0000000000000001e-003 | J237: -2.e-003 | K237: 10.3 | L237: 1.9e-003 | M237: 111.3 | N237: 10.15 | O237: 0.21899999999999997 | P237: 101.48 | Q237: 已到 | R237: 2.56年 | S237: 0.56年 | T237: 2.22 | U237: 5.6 | V237: 2.e-002 | W237: 4.4000000000000004e-002 | X237: 4.4999999999999998e-002 | Y237: 50 | Z237: 1.54 | AA237: -4.0899999999999999e-002 | AB237: -4.8499999999999995e-002 | AC237: -0.25 | AD237: -0.254 | AE237: 98.99 | AF237: 101.04 | AG237: 0.51 | AH237: AA | AI237: 3.9100000000000003e-002 | AJ237: =H237+100*O237 -> 145.571 | AK237: 145.9 | AL237: 104 | AM237: 44.8 | AN237: 69 | AO237: 2.e-002 | AP237: 31 | AQ237: 华通转债!
A238: 71 | B238: 123100 | C238: 朗科转债 | D238: 300543 | E238: 朗科智能 | F238: 电子 | G238: 电子产品 | H238: 145.601 | I238: 7.000000000000001e-004 | J238: 2.0299999999999999e-002 | K238: 15.03 | L238: 2.5899999999999999e-002 | M238: 117.5 | N238: 11.61 | O238: 0.125 | P238: 129.46 | Q238: 已到 | R238: 5.22年 | S238: 3.22年 | T238: 3.8 | U238: 37 | V238: 6.6000000000000003e-002 | W238: 9.4e-002 | X238: 0.122 | Y238: 40 | Z238: 4.26 | AA238: -4.0999999999999995e-002 | AB238: -4.6500000000000007e-002 | AC238: -9.5799999999999996e-002 | AD238: -9.7599999999999992e-002 | AE238: 84.62 | AF238: 86.01 | AG238: 0.81 | AH238: AA- | AI238: 6.3e-002 | AJ238: =H238+100*O238 -> 158.101 | AK238: 161.7 | AL238: 219 | AM238: 75.7 | AN238: 249 | AO238: 6.5000000000000002e-002 | AP238: 9 | AQ238: 朗科转债
A239: 10 | B239: 127045 | C239: 牧原转债 | D239: 2714. | E239: 牧原股份 | F239: 农业 | G239: 畜牧业 | H239: 141.89 | I239: -3.4000000000000002e-003 | J239: -5.7999999999999996e-003 | K239: 57.57 | L239: -1.24e-002 | M239: 111.1 | N239: 47.91 | O239: 0.18100000000000002 | P239: 120.16 | Q239: 3月3天 | R239: 5.74年 | S239: 3.74年 | T239: 95.5 | U239: 69 | V239: 5.0000000000000001e-003 | W239: 3.2000000000000001e-002 | X239: 3.7999999999999999e-002 | Y239: 3030. | Z239: 5.75 | AA239: -4.2300000000000004e-002 | AB239: -4.5599999999999995e-002 | AC239: -7.9500000000000001e-002 | AD239: -8.0700000000000008e-002 | AE239: 89.33 | AF239: 90.47 | AG239: 0.75 | AH239: AA+ | AI239: 3.7000000000000005e-002 | AJ239: =H239+100*O239 -> 159.98999999999998 | AK239: 163.6 | AL239: 234 | AM239: 73.1 | AN239: 240 | AO239: 2.e-003 | AP239: 9 | AQ239: 牧原转债
A240: 207 | B240: 123048 | C240: 应急转债! | D240: 300527 | E240: 中船应急 | F240: 机械装备 | G240: 专用设备 | H240: 136.11 | I240: 4.4000000000000003e-003 | J240: 8.9999999999999998e-004 | K240: 9.7 | L240: 8.3000000000000001e-003 | M240: 112.8 | N240: 8.88 | O240: 0.24600000000000002 | P240: 109.23 | Q240: 已到 | R240: 4.39年 | S240: 2.39年 | T240: 3.79 | U240: 552 | V240: 1.05 | W240: 4.0999999999999995e-002 | X240: 4.4000000000000004e-002 | Y240: 93 | Z240: 3.55 | AA240: -4.2699999999999995e-002 | AB240: -4.7599999999999996e-002 | AC240: -0.10199999999999999 | AD240: -0.105 | AE240: 94.6 | AF240: 97.14 | AG240: 0.64 | AH240: AA+ | AI240: 3.5400000000000001e-002 | AJ240: =H240+100*O240 -> 160.71000000000001 | AK240: 163 | AL240: 230 | AM240: 65.8 | AN240: 203 | AO240: 3.2000000000000001e-002 | AP240: 16 | AQ240: 应急转债!
A241: 241 | B241: 128090 | C241: 汽模转2 | D241: 2510. | E241: 天汽模 | F241: 汽车 | G241: 零部件制 | H241: 137.3 | I241: -1.1399999999999999e-002 | J241: -5.6999999999999993e-003 | K241: 4.67 | L241: -2.5099999999999997e-002 | M241: 114.9 | N241: 4.23 | O241: 0.24399999999999999 | P241: 110.4 | Q241: 已到 | R241: 4年37天 | S241: 2年37天 | T241: 3.1 | U241: 446 | V241: 1.03 | W241: 7.0999999999999994e-002 | X241: 7.8e-002 | Y241: 44 | Z241: 2.15 | AA241: -4.3400000000000001e-002 | AB241: -4.9400000000000006e-002 | AC241: -0.11800000000000001 | AD241: -0.12 | AE241: 90.48 | AF241: 90.5 | AG241: 0.69 | AH241: AA- | AI241: 6.1399999999999996e-002 | AJ241: =H241+100*O241 -> 161.70000000000002 | AK241: 164.2 | AL241: 237 | AM241: 73.7 | AN241: 244 | AO241: 6.2e-002 | AP241: 29 | AQ241: 汽模转2
A242: 270 | B242: 128073 | C242: 哈尔转债! | D242: 2615. | E242: 哈尔斯 | F242: 其他 | G242: 家居用品 | H242: 129.33 | I242: 2.3700000000000002e-002 | J242: 7.000000000000001e-004 | K242: 6.44 | L242: 3.7000000000000005e-002 | M242: 114.5 | N242: 5.71 | O242: 0.14699999999999999 | P242: 112.78 | Q242: 已到 | R242: 2.75年 | S242: 0.75年 | T242: 2.99 | U242: 48 | V242: 0.124 | W242: 0.113 | X242: 0.127 | Y242: 27 | Z242: 3.1 | AA242: -4.3700000000000003e-002 | AB242: -5.2600000000000001e-002 | AC242: -0.23800000000000002 | AD242: -0.23999999999999999 | AE242: 95.96 | AF242: 97.68 | AG242: 0.66 | AH242: AA- | AI242: 6.0100000000000001e-002 | AJ242: =H242+100*O242 -> 144.03 | AK242: 145.9 | AL242: 105 | AM242: 48.2 | AN242: 91 | AO242: 0.11900000000000001 | AP242: 37 | AQ242: 哈尔转债!
A243: 24 | B243: 127040 | C243: 国泰转债 | D243: 2091. | E243: 江苏国泰 | F243: 商业零售 | G243: 商业零售 | H243: 144.6 | I243: 1.44e-002 | J243: -5.4000000000000003e-003 | K243: 11.63 | L243: 1.1299999999999999e-002 | M243: 112.5 | N243: 9.02 | O243: 0.121 | P243: 128.94 | Q243: 54天 | R243: 5.63年 | S243: 3.63年 | T243: 45.6 | U243: 97 | V243: 1.4999999999999999e-002 | W243: 0.251 | X243: 0.32299999999999995 | Y243: 182 | Z243: 1.9 | AA243: -4.4199999999999996e-002 | AB243: -4.8000000000000001e-002 | AC243: -8.5900000000000004e-002 | AD243: -8.7300000000000003e-002 | AE243: 89.81 | AF243: 91.98 | AG243: 0.8 | AH243: AA+ | AI243: 3.7000000000000005e-002 | AJ243: =H243+100*O243 -> 156.69999999999999 | AK243: 160.3 | AL243: 207 | AM243: 68.3 | AN243: 218 | AO243: -5.5e-002 | AP243: 11 | AQ243: 国泰转债
A244: 35 | B244: 127037 | C244: 银轮转债 | D244: 2126. | E244: 银轮股份 | F244: 汽车 | G244: 零部件制 | H244: 148 | I244: 6.8000000000000005e-003 | J244: -8.5000000000000006e-003 | K244: 13.07 | L244: -2.3e-003 | M244: 115.1 | N244: 10.77 | O244: 0.22 | P244: 121.36 | Q244: 21天 | R244: 5.55年 | S244: 3.55年 | T244: 7 | U244: 38 | V244: 3.6000000000000004e-002 | W244: 6.8000000000000005e-002 | X244: 8.199999999999999e-002 | Y244: 104 | Z244: 2.45 | AA244: -4.5100000000000001e-002 | AB244: -4.9599999999999998e-002 | AC244: -9.2300000000000007e-002 | AD244: -9.3800000000000008e-002 | AE244: 89.05 | AF244: 92.01 | AG244: 0.75 | AH244: AA | AI244: 4.2000000000000003e-002 | AJ244: =H244+100*O244 -> 170. | AK244: 174.6 | AL244: 272 | AM244: 82.6 | AN244: 274 | AO244: 6.2e-002 | AP244: 3 | AQ244: 银轮转债
A245: 284 | B245: 110058 | C245: 永鼎转债! | D245: 600105 | E245: 永鼎股份 | F245: 通信互联 | G245: 通信设备 | H245: 133.38 | I245: 3.5000000000000003e-002 | J245: 2.3599999999999999e-002 | K245: 6.16 | L245: 7.690000000000001e-002 | M245: 114.3 | N245: 5.04 | O245: 9.0999999999999998e-002 | P245: 122.22 | Q245: 已到 | R245: 3.40年 | S245: 1.40年 | T245: 2.61 | U245: 982 | V245: 2.7999999999999998 | W245: 3.1e-002 | X245: 3.7999999999999999e-002 | Y245: 85 | Z245: 3.03 | AA245: -4.5199999999999997e-002 | AB245: -5.2199999999999996e-002 | AC245: -0.13699999999999998 | AD245: -0.13900000000000001 | AE245: 93.7 | AF245: 93.73 | AG245: 0.76 | AH245: AA- | AI245: 6.1399999999999996e-002 | AJ245: =H245+100*O245 -> 142.47999999999999 | AK245: 144.5 | AL245: 92 | AM245: 50.8 | AN245: 107 | AO245: 0.376 | AP245: 45 | AQ245: 永鼎转债!
A246: 108 | B246: 123078 | C246: 飞凯转债!! | D246: 300398 | E246: 飞凯材料 | F246: 化工 | G246: 化工 | H246: 144.7 | I246: 1.6899999999999998e-002 | J246: -6.5000000000000006e-003 | K246: 19.29 | L246: 1.37e-002 | M246: 115.2 | N246: 15.56 | O246: 0.16699999999999998 | P246: 123.97 | Q246: 已到 | R246: 5年7天 | S246: 3年7天 | T246: 8.15 | U246: 9.2 | V246: 8.0000000000000002e-003 | W246: 8.199999999999999e-002 | X246: 0.10099999999999999 | Y246: 100 | Z246: 3.44 | AA246: -4.5199999999999997e-002 | AB246: -5.0199999999999995e-002 | AC246: -0.10000000000000001 | AD246: -0.10000000000000001 | AE246: 91.09 | AF246: 94.12 | AG246: 0.76 | AH246: AA | AI246: 4.2000000000000003e-002 | AJ246: =H246+100*O246 -> 161.39999999999998 | AK246: 165.4 | AL246: 247 | AM246: 71.3 | AN246: 232 | AO246: 4.4999999999999998e-002 | AP246: 8 | AQ246: 飞凯转债!!
A247: 356 | B247: 128021 | C247: 兄弟转债!! | D247: 2562. | E247: 兄弟科技 | F247: 医药 | G247: 原料药 | H247: 119.3 | I247: 7.6e-003 | J247: -8.3999999999999995e-003 | K247: 4.69 | L247: -2.0999999999999999e-003 | M247: 108.8 | N247: 5.19 | O247: 0.32000000000000001 | P247: 90.37 | Q247: 已到 | R247: 2年8天 | S247: 8天 | T247: 2.65 | U247: 9.2 | V247: 2.8999999999999998e-002 | W247: 5.2999999999999999e-002 | X247: 4.8000000000000001e-002 | Y247: 50 | Z247: 1.7 | AA247: -4.53e-002 | AB247: -5.2999999999999999e-002 | AC247: -0.86299999999999999 | AD247: -0.87599999999999989 | AE247: 100.83 | AF247: 100.83 | AG247: 0.36 | AH247: AA | AI247: 3.9100000000000003e-002 | AJ247: =H247+100*O247 -> 151.30000000000001 | AK247: 148.2 | AL247: 129 | AM247: 47.4 | AN247: 84 | AO247: 8.4000000000000005e-002 | AP247: 18 | AQ247: 兄弟转债!!
A248: 62 | B248: 127029 | C248: 中钢转债! | D248: 928. | E248: 中钢国际 | F248: 建筑 | G248: 建筑工程 | H248: 150.3 | I248: 3.0899999999999997e-002 | J248: 7.8000000000000005e-003 | K248: 7.94 | L248: 4.8899999999999999e-002 | M248: 117.5 | N248: 5.79 | O248: 9.6000000000000002e-002 | P248: 137.13 | Q248: 已到 | R248: 5.33年 | S248: 3.33年 | T248: 8.2 | U248: 649 | V248: 0.51500000000000001 | W248: 8.1000000000000003e-002 | X248: 0.111 | Y248: 102 | Z248: 1.7 | AA248: -4.58e-002 | AB248: -5.1100000000000007e-002 | AC248: -0.10099999999999999 | AD248: -0.10199999999999999 | AE248: 90.8 | AF248: 97.12 | AG248: 0.79 | AH248: AA+ | AI248: 3.7000000000000005e-002 | AJ248: =H248+100*O248 -> 159.90000000000001 | AK248: 163.5 | AL248: 232 | AM248: 66.4 | AN248: 208 | AO248: 0.10300000000000001 | AP248: 13 | AQ248: 中钢转债!
A249: 18 | B249: 110081 | C249: 闻泰转债 | D249: 600745 | E249: 闻泰科技 | F249: 电子 | G249: 电子行业 | H249: 145.94 | I249: -2.9999999999999997e-004 | J249: 5.1000000000000004e-003 | K249: 114.47 | L249: 6.5000000000000006e-003 | M249: 111.9 | N249: 96.67 | O249: 0.23199999999999998 | P249: 118.41 | Q249: 2月15天 | R249: 5.69年 | S249: 3.69年 | T249: 86 | U249: 156 | V249: 1.2e-002 | W249: 5.9999999999999998e-002 | X249: 7.0999999999999994e-002 | Y249: 1425. | Z249: 4.54 | AA249: -4.6100000000000002e-002 | AB249: -4.9699999999999994e-002 | AC249: -8.8100000000000012e-002 | AD249: -8.9099999999999999e-002 | AE249: 89.07 | AF249: 91.23 | AG249: 0.74 | AH249: AA+ | AI249: 3.7000000000000005e-002 | AJ249: =H249+100*O249 -> 169.13999999999999 | AK249: 173.5 | AL249: 267 | AM249: 82.2 | AN249: 272 | AO249: 1.3999999999999999e-002 | AP249: 10 | AQ249: 闻泰转债
A250: 311 | B250: 113527 | C250: 维格转债!! | D250: 603518 | E250: 锦泓集团 | F250: 服装纺织 | G250: 服装行业 | H250: 138.48 | I250: 4.0999999999999995e-003 | J250: -5.7999999999999996e-003 | K250: 11.8 | L250: -2.5000000000000001e-003 | M250: 119.5 | N250: 9.85 | O250: 0.156 | P250: 119.8 | Q250: 已到 | R250: 3.18年 | S250: 1.18年 | T250: 2.86 | U250: 36 | V250: 8.9999999999999997e-002 | W250: 8.199999999999999e-002 | X250: 9.8000000000000004e-002 | Y250: 35 | Z250: 1.44 | AA250: -4.6199999999999998e-002 | AB250: -5.6100000000000004e-002 | AC250: -0.185 | AD250: -0.188 | AE250: 96.32 | AF250: 102.55 | AG250: 0.67 | AH250: AA | AI250: 5.04e-002 | AJ250: =H250+100*O250 -> 154.07999999999998 | AK250: 157.2 | AL250: 191 | AM250: 54.6 | AN250: 134 | AO250: -5.4000000000000006e-002 | AP250: 71 | AQ250: 维格转债!!
A251: 189 | B251: 123054 | C251: 思特转债!! | D251: 300608 | E251: 思特奇 | F251: 通信互联 | G251: 通信设备 | H251: 149.625 | I251: -2.5000000000000001e-003 | J251: 1.5e-003 | K251: 13.89 | L251: -1.4000000000000002e-003 | M251: 121.2 | N251: 12.63 | O251: 0.36099999999999999 | P251: 109.98 | Q251: 已到 | R251: 4.55年 | S251: 2.55年 | T251: 2.07 | U251: 669 | V251: 2.1299999999999999 | W251: 7.0999999999999994e-002 | X251: 7.8e-002 | Y251: 29 | Z251: 3.5 | AA251: -4.6199999999999998e-002 | AB251: -5.3600000000000002e-002 | AC251: -0.125 | AD251: -0.127 | AE251: 88.7 | AF251: 93.01 | AG251: 0.66 | AH251: AA- | AI251: 6.1399999999999996e-002 | AJ251: =H251+100*O251 -> 185.72499999999999 | AK251: 189.3 | AL251: 308 | AM251: 96.3 | AN251: 306 | AO251: 0.114 | AP251: 18 | AQ251: 思特转债!!
A252: 368 | B252: 127003 | C252: 海印转债! | D252: 861. | E252: 海印股份 | F252: 商业零售 | G252: 商场 | H252: 112.99 | I252: 2.8399999999999998e-002 | J252: -2.7200000000000002e-002 | K252: 2.4 | L252: 0.10099999999999999 | M252: 110 | N252: 2.99 | O252: 0.40799999999999997 | P252: 80.27 | Q252: 已到 | R252: 0.55年 | S252: 回售内 | T252: 6.74 | U252: 196 | V252: 0.25900000000000001 | W252: 0.121 | X252: 9.6999999999999989e-002 | Y252: 56 | Z252: 1.52 | AA252: -4.7699999999999992e-002 | AB252: -7.9100000000000004e-002 | AC252: 回售内 | AD252: 回售内 | AE252: 100.33 | AF252: 107.91 | AG252: 0.01 | AH252: AA | AI252: 3.5699999999999996e-002 | AJ252: =H252+100*O252 -> 153.78999999999999 | AK252: 145.7 | AL252: 101 | AM252: 37.8 | AN252: 24 | AO252: 0.16600000000000001 | AP252: 71 | AQ252: 海印转债!
A253: 286 | B253: 113026 | C253: 核能转债! | D253: 601985 | E253: 中国核电 | F253: 能源电力 | G253: 核电 | H253: 128.87 | I253: 1.46e-002 | J253: 1.7600000000000001e-002 | K253: 6.51 | L253: 4.4900000000000002e-002 | M253: 109.3 | N253: 5.73 | O253: 0.13400000000000001 | P253: 113.61 | Q253: 已到 | R253: 3.40年 | S253: 1.40年 | T253: 76 | U253: 105 | V253: 1.1000000000000001e-002 | W253: 6.7000000000000004e-002 | X253: 7.5999999999999998e-002 | Y253: 1140. | Z253: 1.77 | AA253: -4.82e-002 | AB253: -5.2900000000000003e-002 | AC253: -0.12 | AD253: -0.12300000000000001 | AE253: 97.69 | AF253: 97.98 | AG253: 0.72 | AH253: AAA | AI253: 3.3399999999999999e-002 | AJ253: =H253+100*O253 -> 142.27000000000001 | AK253: 144.1 | AL253: 85 | AM253: 46.1 | AN253: 78 | AO253: -2.4e-002 | AP253: 39 | AQ253: 核能转债!
A254: 338 | B254: 128036 | C254: 金农转债!! | D254: 2548. | E254: 金新农 | F254: 农业 | G254: 畜牧业 | H254: 122.25 | I254: 2.0999999999999999e-003 | J254: -2.0000000000000001e-004 | K254: 5.81 | L254: 6.8999999999999999e-003 | M254: 109.3 | N254: 6.93 | O254: 0.45799999999999996 | P254: 83.84 | Q254: 已到 | R254: 2.30年 | S254: 0.30年 | T254: 1.46 | U254: 9.5 | V254: 5.4000000000000006e-002 | W254: 3.6000000000000004e-002 | X254: 2.9999999999999999e-002 | Y254: 40 | Z254: 1.72 | AA254: -4.8399999999999999e-002 | AB254: -5.5399999999999998e-002 | AC254: -0.38200000000000001 | AD254: -0.38900000000000001 | AE254: 99.09 | AF254: 95.83 | AG254: 0.27 | AH254: AA- | AI254: 6.0100000000000001e-002 | AJ254: =H254+100*O254 -> 168.05000000000001 | AK254: 160.7 | AL254: 209 | AM254: 61.6 | AN254: 177 | AO254: 4.0000000000000001e-003 | AP254: 16 | AQ254: 金农转债!!
A255: 12 | B255: 127043 | C255: 川恒转债 | D255: 2895. | E255: 川恒股份 | F255: 化工 | G255: 农化 | H255: 160 | I255: -1.03e-002 | J255: 6.3e-003 | K255: 28.66 | L255: -4.8999999999999998e-003 | M255: 121 | N255: 21.02 | O255: 0.17300000000000001 | P255: 136.35 | Q255: 3月0天 | R255: 5.73年 | S255: 3.73年 | T255: 11.6 | U255: 137 | V255: 7.2999999999999995e-002 | W255: 8.3000000000000004e-002 | X255: 0.113 | Y255: 140 | Z255: 4.42 | AA255: -4.8399999999999999e-002 | AB255: -5.4199999999999998e-002 | AC255: -0.10199999999999999 | AD255: -0.10400000000000001 | AE255: 82.12 | AF255: 85.89 | AG255: 0.82 | AH255: AA- | AI255: 6.3e-002 | AJ255: =H255+100*O255 -> 177.30000000000001 | AK255: 183.7 | AL255: 295 | AM255: 97.8 | AN255: 308 | AO255: -0.185 | AP255: 6 | AQ255: 川恒转债
A256: 19 | B256: 118001 | C256: 金博转债 | D256: 688598 | E256: 金博股份 | F256: 能源电力 | G256: 太阳能 | H256: 161.14 | I256: 1.0700000000000001e-002 | J256: 2.76e-002 | K256: 336.15 | L256: 4.8799999999999996e-002 | M256: 121.6 | N256: 271.12 | O256: 0.29999999999999999 | P256: 123.99 | Q256: 2月10天 | R256: 5.67年 | S256: 3.67年 | T256: 6 | U256: 61 | V256: 6.4000000000000001e-002 | W256: 2.2000000000000002e-002 | X256: 2.7999999999999997e-002 | Y256: 270 | Z256: 16.37 | AA256: -4.9400000000000006e-002 | AB256: -5.5399999999999998e-002 | AC256: -0.10400000000000001 | AD256: -0.106 | AE256: 79.8 | AF256: 81.9 | AG256: 0.78 | AH256: A+ | AI256: 7.400000000000001e-002 | AJ256: =H256+100*O256 -> 191.13999999999999 | AK256: 198.3 | AL256: 313 | AM256: 116.4 | AN256: 319 | AO256: -2.6000000000000002e-002 | AP256: 3 | AQ256: 金博转债
A257: 345 | B257: 110043 | C257: 无锡转债! | D257: 600908 | E257: 无锡银行 | F257: 金融 | G257: 银行行业 | H257: 121.07 | I257: 2.2000000000000001e-003 | J257: 3.4000000000000002e-003 | K257: 5.72 | L257: 1.06e-002 | M257: 108.3 | N257: 5.61 | O257: 0.187 | P257: 101.96 | Q257: 已到 | R257: 2.19年 | S257: 无权 | T257: 29.2 | U257: 41 | V257: 1.2e-002 | W257: 0.27399999999999997 | X257: 0.28000000000000003 | Y257: 106 | Z257: 0.83 | AA257: -5.0199999999999995e-002 | AB257: -5.6799999999999996e-002 | AC257: 无权 | AD257: 无权 | AE257: 无权 | AF257: 100.72 | AG257: 0.52 | AH257: AA+ | AI257: 3.4099999999999998e-002 | AJ257: =H257+100*O257 -> 139.76999999999998 | AK257: 140.2 | AL257: 43 | AM257: 39.5 | AN257: 31 | AO257: -2.1000000000000001e-002 | AP257: 22 | AQ257: 无锡转债!
A258: 366 | B258: 113011 | C258: 光大转债 | D258: 601818 | E258: 光大银行 | F258: 金融 | G258: 银行行业 | H258: 114.31 | I258: 4.0000000000000001e-003 | J258: -8.9999999999999998e-004 | K258: 3.36 | L258: 9.0000000000000011e-003 | M258: 106.8 | N258: 3.55 | O258: 0.20800000000000002 | P258: 94.65 | Q258: 已到 | R258: 1.32年 | S258: 无权 | T258: 242 | U258: 188 | V258: 6.9999999999999993e-003 | W258: 0.13300000000000001 | X258: 0.126 | Y258: 1815. | Z258: 0.5 | AA258: -5.0799999999999998e-002 | AB258: -5.9900000000000002e-002 | AC258: 无权 | AD258: 无权 | AE258: 无权 | AF258: 102.49 | AG258: 0.34 | AH258: AAA | AI258: 3.2099999999999997e-002 | AJ258: =H258+100*O258 -> 135.11000000000001 | AK258: 134 | AL258: 18 | AM258: 31.5 | AN258: 8 | AO258: -6.9999999999999993e-003 | AP258: 14 | AQ258: 光大转债
A259: 219 | B259: 123045 | C259: 雷迪转债 | D259: 300652 | E259: 雷迪克 | F259: 汽车 | G259: 零部件制 | H259: 148.3 | I259: 3.4000000000000002e-003 | J259: -8.6e-003 | K259: 25.03 | L259: -6.7000000000000002e-003 | M259: 118.9 | N259: 19.63 | O259: 0.16300000000000001 | P259: 127.51 | Q259: 已到 | R259: 4.31年 | S259: 2.31年 | T259: 1.66 | U259: 858 | V259: 3.4900000000000002 | W259: 7.0999999999999994e-002 | X259: 8.9999999999999997e-002 | Y259: 24 | Z259: 2.47 | AA259: -5.1100000000000007e-002 | AB259: -5.8099999999999999e-002 | AC259: -0.13400000000000001 | AD259: -0.10099999999999999 | AE259: 87.73 | AF259: 88.68 | AG259: 0.78 | AH259: A+ | AI259: 7.2400000000000006e-002 | AJ259: =H259+100*O259 -> 164.60000000000002 | AK259: 169.1 | AL259: 259 | AM259: 80.4 | AN259: 268 | AO259: 0.17999999999999999 | AP259: 34 | AQ259: 雷迪转债
A260: 231 | B260: 128097 | C260: 奥佳转债!! | D260: 2614. | E260: 奥佳华 | F260: 机械装备 | G260: 专用设备 | H260: 143.5 | I260: 3.2400000000000005e-002 | J260: 2.e-003 | K260: 12.4 | L260: 4.5499999999999999e-002 | M260: 114.9 | N260: 10.39 | O260: 0.20199999999999999 | P260: 119.35 | Q260: 已到 | R260: 4.27年 | S260: 2.27年 | T260: 4.59 | U260: 78 | V260: 0.11800000000000001 | W260: 5.9000000000000004e-002 | X260: 7.0000000000000007e-002 | Y260: 78 | Z260: 1.66 | AA260: -5.1799999999999999e-002 | AB260: -5.7500000000000002e-002 | AC260: -0.126 | AD260: -0.128 | AE260: 89.59 | AF260: 89.62 | AG260: 0.75 | AH260: AA- | AI260: 6.1399999999999996e-002 | AJ260: =H260+100*O260 -> 163.69999999999999 | AK260: 167.7 | AL260: 255 | AM260: 78 | AN260: 254 | AO260: 6.9000000000000006e-002 | AP260: 18 | AQ260: 奥佳转债!!
A261: 83 | B261: 113616 | C261: 韦尔转债! | D261: 603501 | E261: 韦尔股份 | F261: 电子 | G261: 元器件制 | H261: 149.86 | I261: 1.11e-002 | J261: 1.e-003 | K261: 269 | L261: 1.6500000000000001e-002 | M261: 114.5 | N261: 222.52 | O261: 0.23999999999999999 | P261: 120.89 | Q261: 已到 | R261: 5年38天 | S261: 3年38天 | T261: 24.3 | U261: 102 | V261: 2.7999999999999997e-002 | W261: 1.e-002 | X261: 1.3000000000000001e-002 | Y261: 2338. | Z261: 16.13 | AA261: -5.21e-002 | AB261: -5.6799999999999996e-002 | AC261: -0.107 | AD261: -0.10800000000000001 | AE261: 91.54 | AF261: 95.41 | AG261: 0.73 | AH261: AA+ | AI261: 3.7000000000000005e-002 | AJ261: =H261+100*O261 -> 173.86000000000001 | AK261: 178.8 | AL261: 283 | AM261: 83.4 | AN261: 278 | AO261: -1.e-003 | AP261: 9 | AQ261: 韦尔转债!
A262: 123 | B262: 123074 | C262: 隆利转债!! | D262: 300752 | E262: 隆利科技 | F262: 电子 | G262: 液晶显示 | H262: 161.5 | I262: -2.12e-002 | J262: 2.e-003 | K262: 25.57 | L262: -2.4e-002 | M262: 123.6 | N262: 18.34 | O262: 0.158 | P262: 139.42 | Q262: 已到 | R262: 4.94年 | S262: 2.94年 | T262: 1.48 | U262: 277 | V262: 1.1399999999999999 | W262: 2.8999999999999998e-002 | X262: 4.0000000000000001e-002 | Y262: 52 | Z262: 5.4 | AA262: -5.3600000000000002e-002 | AB262: -6.0999999999999999e-002 | AC262: -0.13200000000000001 | AD262: -0.13300000000000001 | AE262: 86.16 | AF262: 92.6 | AG262: 0.8 | AH262: AA- | AI262: 6.1399999999999996e-002 | AJ262: =H262+100*O262 -> 177.30000000000001 | AK262: 183.6 | AL262: 294 | AM262: 91 | AN262: 297 | AO262: 0. | AP262: 15 | AQ262: 隆利转债!!
A263: 341 | B263: 127005 | C263: 长证转债! | D263: 783. | E263: 长江证券 | F263: 金融 | G263: 证券行业 | H263: 122.755 | I263: 6.9999999999999993e-003 | J263: 5.9999999999999995e-004 | K263: 7.31 | L263: 1.3899999999999999e-002 | M263: 108.3 | N263: 7.13 | O263: 0.19699999999999998 | P263: 102.52 | Q263: 已到 | R263: 2.31年 | S263: 无权 | T263: 50 | U263: 122 | V263: 2.e-002 | W263: 0.124 | X263: 0.127 | Y263: 404 | Z263: 1.37 | AA263: -5.3800000000000001e-002 | AB263: -5.9999999999999998e-002 | AC263: 无权 | AD263: 无权 | AE263: 无权 | AF263: 100.83 | AG263: 0.55 | AH263: AAA | AI263: 3.2099999999999997e-002 | AJ263: =H263+100*O263 -> 142.45499999999998 | AK263: 143 | AL263: 65 | AM263: 42.2 | AN263: 44 | AO263: 8.0000000000000002e-003 | AP263: 12 | AQ263: 长证转债!
A264: 91 | B264: 113614 | C264: 健20转债!! | D264: 603707 | E264: 健友股份 | F264: 医药 | G264: 原料药 | H264: 152 | I264: 1.9e-002 | J264: 9.0000000000000011e-003 | K264: 44.38 | L264: 3.1400000000000004e-002 | M264: 114.2 | N264: 29.12 | O264: -3.0000000000000001e-003 | P264: 152.4 | Q264: 已到 | R264: 5年27天 | S264: 3年27天 | T264: 7.8 | U264: 200 | V264: 0.16899999999999998 | W264: 1.3999999999999999e-002 | X264: 2.2000000000000002e-002 | Y264: 540 | Z264: 12.58 | AA264: -5.5800000000000002e-002 | AB264: -6.0400000000000002e-002 | AC264: -0.11 | AD264: -0.11199999999999999 | AE264: 90.89 | AF264: 93.1 | AG264: 0.9 | AH264: AA | AI264: 4.2000000000000003e-002 | AJ264: =H264+100*O264 -> 151.69999999999999 | AK264: 151.6 | AL264: 160 | AM264: 58.5 | AN264: 153 | AO264: 0.13300000000000001 | AP264: 4 | AQ264: 健20转债!!
A265: 47 | B265: 113047 | C265: 旗滨转债 | D265: 601636 | E265: 旗滨集团 | F265: 建筑 | G265: 玻璃 | H265: 154.86 | I265: 5.9200000000000003e-002 | J265: -1.11e-002 | K265: 15.97 | L265: 6.4000000000000001e-002 | M265: 114 | N265: 12.8 | O265: 0.24100000000000002 | P265: 124.77 | Q265: 已到 | R265: 5.38年 | S265: 3.38年 | T265: 15 | U265: 395 | V265: 0.17300000000000001 | W265: 3.5000000000000003e-002 | X265: 4.4000000000000004e-002 | Y265: 429 | Z265: 3.49 | AA265: -5.5999999999999994e-002 | AB265: -6.0299999999999999e-002 | AC265: -0.107 | AD265: -0.10800000000000001 | AE265: 90.17 | AF265: 94 | AG265: 0.75 | AH265: AA+ | AI265: 3.7000000000000005e-002 | AJ265: =H265+100*O265 -> 178.96000000000001 | AK265: 185 | AL265: 301 | AM265: 91 | AN265: 296 | AO265: 1.4999999999999999e-002 | AP265: 7 | AQ265: 旗滨转债
A266: 198 | B266: 113579 | C266: 健友转债! | D266: 603707 | E266: 健友股份 | F266: 医药 | G266: 原料药 | H266: 146.5 | I266: 2.4799999999999999e-002 | J266: 1.7000000000000001e-003 | K266: 44.38 | L266: 3.1400000000000004e-002 | M266: 113.9 | N266: 32.2 | O266: 6.3e-002 | P266: 137.83 | Q266: 已到 | R266: 4.42年 | S266: 2.42年 | T266: 5.03 | U266: 75 | V266: 0.10199999999999999 | W266: 9.0000000000000011e-003 | X266: 1.3000000000000001e-002 | Y266: 540 | Z266: 12.58 | AA266: -5.6399999999999999e-002 | AB266: -6.1500000000000006e-002 | AC266: -0.126 | AD266: -0.128 | AE266: 93.42 | AF266: 95.96 | AG266: 0.84 | AH266: AA | AI266: 4.0399999999999998e-002 | AJ266: =H266+100*O266 -> 152.80000000000001 | AK266: 155.2 | AL266: 177 | AM266: 59.2 | AN266: 162 | AO266: 0.13300000000000001 | AP266: 8 | AQ266: 健友转债!
A267: 146 | B267: 128128 | C267: 齐翔转2! | D267: 2408. | E267: 齐翔腾达 | F267: 化工 | G267: 化工 | H267: 152 | I267: -0.13800000000000001 | J267: 5.0099999999999999e-002 | K267: 8.64 | L267: -0.10000000000000001 | M267: 115 | N267: 5.69 | O267: 1.e-003 | P267: 151.85 | Q267: 已到 | R267: 4.75年 | S267: 2.75年 | T267: 6.81 | U267: 810 | V267: 0.81099999999999994 | W267: 2.7999999999999997e-002 | X267: 4.2000000000000003e-002 | Y267: 246 | Z267: 1.97 | AA267: -5.7999999999999996e-002 | AB267: -6.3200000000000006e-002 | AC267: -0.12300000000000001 | AD267: -0.125 | AE267: 92.23 | AF267: 95.64 | AG267: 0.88 | AH267: AA | AI267: 4.0399999999999998e-002 | AJ267: =H267+100*O267 -> 152.09999999999999 | AK267: 152.2 | AL267: 165 | AM267: 56.5 | AN267: 147 | AO267: -0.183 | AP267: 28 | AQ267: 齐翔转2!
A268: 179 | B268: 123057 | C268: 美联转债! | D268: 300586 | E268: 美联新材 | F268: 化工 | G268: 橡胶塑料 | H268: 154.496 | I268: 6.480000000000001e-002 | J268: 1.1699999999999999e-002 | K268: 12.92 | L268: 9.3100000000000002e-002 | M268: 117.8 | N268: 9.5 | O268: 0.13600000000000001 | P268: 136 | Q268: 已到 | R268: 4.61年 | S268: 2.61年 | T268: 2.07 | U268: 3472. | V268: 10.640000000000001 | W268: 2.9999999999999999e-002 | X268: 4.0999999999999995e-002 | Y268: 68 | Z268: 5.67 | AA268: -5.8200000000000002e-002 | AB268: -6.4399999999999999e-002 | AC268: -0.13300000000000001 | AD268: -0.13500000000000001 | AE268: 88.05 | AF268: 90.07 | AG268: 0.82 | AH268: AA- | AI268: 6.1399999999999996e-002 | AJ268: =H268+100*O268 -> 168.096 | AK268: 173 | AL268: 266 | AM268: 82.9 | AN268: 275 | AO268: 0.158 | AP268: 20 | AQ268: 美联转债!
A269: 299 | B269: 110056 | C269: 亨通转债! | D269: 600487 | E269: 亨通光电 | F269: 通信互联 | G269: 通信设备 | H269: 139.21 | I269: -2.9999999999999997e-004 | J269: -9.3999999999999986e-003 | K269: 16.79 | L269: -1.52e-002 | M269: 114.3 | N269: 14.95 | O269: 0.23999999999999999 | P269: 112.31 | Q269: 已到 | R269: 3.33年 | S269: 1.33年 | T269: 17.1 | U269: 92 | V269: 3.7999999999999999e-002 | W269: 4.2999999999999997e-002 | X269: 4.8000000000000001e-002 | Y269: 397 | Z269: 1.92 | AA269: -5.8600000000000006e-002 | AB269: -6.5700000000000008e-002 | AC269: -0.16600000000000001 | AD269: -0.16800000000000001 | AE269: 97.64 | AF269: 102.06 | AG269: 0.64 | AH269: AA+ | AI269: 3.5400000000000001e-002 | AJ269: =H269+100*O269 -> 163.21000000000001 | AK269: 166.1 | AL269: 249 | AM269: 64.1 | AN269: 192 | AO269: 6.8000000000000005e-002 | AP269: 25 | AQ269: 亨通转债!
A270: 256 | B270: 110061 | C270: 川投转债! | D270: 600674 | E270: 川投能源 | F270: 能源电力 | G270: 水电 | H270: 139.93 | I270: -4.0000000000000002e-004 | J270: 6.0000000000000001e-003 | K270: 11.52 | L270: 6.9999999999999993e-003 | M270: 110.3 | N270: 9.2 | O270: 0.11699999999999999 | P270: 125.22 | Q270: 已到 | R270: 3.98年 | S270: 1.98年 | T270: 39.6 | U270: 50 | V270: 9.0000000000000011e-003 | W270: 7.8e-002 | X270: 9.8000000000000004e-002 | Y270: 508 | Z270: 1.66 | AA270: -5.91e-002 | AB270: -6.3399999999999998e-002 | AC270: -0.106 | AD270: -0.10800000000000001 | AE270: 95.86 | AF270: 97.03 | AG270: 0.79 | AH270: AAA | AI270: 3.3399999999999999e-002 | AJ270: =H270+100*O270 -> 151.63 | AK270: 154.6 | AL270: 176 | AM270: 57.6 | AN270: 150 | AO270: -6.9000000000000006e-002 | AP270: 13 | AQ270: 川投转债!
A271: 226 | B271: 123043 | C271: 正元转债! | D271: 300645 | E271: 正元智慧 | F271: 计算机及 | G271: 软件开发 | H271: 156.301 | I271: 3.7900000000000003e-002 | J271: 2.18e-002 | K271: 22.02 | L271: 7.0999999999999994e-002 | M271: 120.9 | N271: 15.38 | O271: 9.1999999999999998e-002 | P271: 143.17 | Q271: 已到 | R271: 4.29年 | S271: 2.29年 | T271: 1.66 | U271: 1775. | V271: 6.7300000000000004 | W271: 5.9000000000000004e-002 | X271: 8.4000000000000005e-002 | Y271: 28 | Z271: 4.24 | AA271: -5.9400000000000001e-002 | AB271: -6.7000000000000004e-002 | AC271: -0.113 | AD271: -0.114 | AE271: 87.85 | AF271: 90.28 | AG271: 0.84 | AH271: A+ | AI271: 7.2400000000000006e-002 | AJ271: =H271+100*O271 -> 165.50099999999998 | AK271: 169.4 | AL271: 260 | AM271: 79.1 | AN271: 258 | AO271: 8.6999999999999994e-002 | AP271: 17 | AQ271: 正元转债!
A272: 162 | B272: 128122 | C272: 兴森转债! | D272: 2436. | E272: 兴森科技 | F272: 电子 | G272: 元器件制 | H272: 141.2 | I272: 5.6299999999999996e-002 | J272: -2.7799999999999998e-002 | K272: 14.37 | L272: 5.2000000000000005e-002 | M272: 113 | N272: 14.1 | O272: 0.38500000000000001 | P272: 101.91 | Q272: 已到 | R272: 3.67年 | S272: 2.67年 | T272: 2.69 | U272: 160 | V272: 0.42299999999999999 | W272: 1.3000000000000001e-002 | X272: 1.3000000000000001e-002 | Y272: 214 | Z272: 5.97 | AA272: -5.9500000000000004e-002 | AB272: -6.54e-002 | AC272: -0.10400000000000001 | AD272: -0.106 | AE272: 92.43 | AF272: 97.89 | AG272: 0.55 | AH272: AA | AI272: 4.0399999999999998e-002 | AJ272: =H272+100*O272 -> 179.69999999999999 | AK272: 180.5 | AL272: 286 | AM272: 82.6 | AN272: 273 | AO272: 5.7999999999999996e-002 | AP272: 11 | AQ272: 兴森转债!
A273: 65 | B273: 123103 | C273: 震安转债! | D273: 300767 | E273: 震安科技 | F273: 化工 | G273: 橡胶塑料 | H273: 167.3 | I273: 1.3899999999999999e-002 | J273: -1.8700000000000001e-002 | K273: 86.8 | L273: -5.5000000000000005e-003 | M273: 121.4 | N273: 56.89 | O273: 9.6999999999999989e-002 | P273: 152.58 | Q273: 已到 | R273: 5.31年 | S273: 3.31年 | T273: 2.53 | U273: 60 | V273: 0.14400000000000002 | W273: 1.3999999999999999e-002 | X273: 2.2000000000000002e-002 | Y273: 175 | Z273: 14.96 | AA273: -5.9900000000000002e-002 | AB273: -6.6100000000000006e-002 | AC273: -0.124 | AD273: -0.126 | AE273: 81.88 | AF273: 83.92 | AG273: 0.87 | AH273: A+ | AI273: 7.400000000000001e-002 | AJ273: =H273+100*O273 -> 177. | AK273: 182 | AL273: 289 | AM273: 98.1 | AN273: 309 | AO273: -7.8e-002 | AP273: 5 | AQ273: 震安转债!
A274: 344 | B274: 128035 | C274: 大族转债! | D274: 2008. | E274: 大族激光 | F274: 机械装备 | G274: 专用设备 | H274: 123 | I274: 2.4199999999999999e-002 | J274: -1.1399999999999999e-002 | K274: 44.26 | L274: 5.4600000000000003e-002 | M274: 107.4 | N274: 51.9 | O274: 0.442 | P274: 85.28 | Q274: 已到 | R274: 2.21年 | S274: 0.21年 | T274: 23 | U274: 86 | V274: 2.9999999999999999e-002 | W274: 4.9000000000000002e-002 | X274: 4.2000000000000003e-002 | Y274: 472 | Z274: 4.45 | AA274: -6.0199999999999997e-002 | AB274: -6.6000000000000003e-002 | AC274: -0.439 | AD274: -0.45600000000000002 | AE274: 102.49 | AF274: 99.82 | AG274: 0.24 | AH274: AA+ | AI274: 3.4099999999999998e-002 | AJ274: =H274+100*O274 -> 167.19999999999999 | AK274: 160.7 | AL274: 210 | AM274: 58.2 | AN274: 152 | AO274: 3.2000000000000001e-002 | AP274: 18 | AQ274: 大族转债!
A275: 264 | B275: 128078 | C275: 太极转债! | D275: 2368. | E275: 太极股份 | F275: 计算机及 | G275: 软件开发 | H275: 148.1 | I275: 3.4000000000000002e-003 | J275: -1.77e-002 | K275: 29.69 | L275: -1.43e-002 | M275: 116.3 | N275: 22.21 | O275: 0.10800000000000001 | P275: 133.68 | Q275: 已到 | R275: 3.92年 | S275: 1.92年 | T275: 9.6 | U275: 41 | V275: 2.8999999999999998e-002 | W275: 5.5999999999999994e-002 | X275: 7.4999999999999997e-002 | Y275: 172 | Z275: 5.21 | AA275: -6.08e-002 | AB275: -6.7500000000000004e-002 | AC275: -0.128 | AD275: -0.129 | AE275: 94.71 | AF275: 99.86 | AG275: 1 | AH275: AA | AI275: 4.0399999999999998e-002 | AJ275: =H275+100*O275 -> 158.90000000000001 | AK275: 162.5 | AL275: 226 | AM275: 62.7 | AN275: 185 | AO275: 2.9999999999999999e-002 | AP275: 9 | AQ275: 太极转债!
A276: 11 | B276: 118002 | C276: 天合转债 | D276: 688599 | E276: 天合光能 | F276: 能源电力 | G276: 太阳能 | H276: 172.32 | I276: 5.8299999999999998e-002 | J276: 3.0099999999999998e-002 | K276: 81.8 | L276: 0.10000000000000001 | M276: 120.1 | N276: 50.51 | O276: 6.4000000000000001e-002 | P276: 161.95 | Q276: 3月3天 | R276: 5.73年 | S276: 3.73年 | T276: 52.5 | U276: 1118. | V276: 0.125 | W276: 3.1e-002 | X276: 5.0000000000000003e-002 | Y276: 1692. | Z276: 10.54 | AA276: -6.2e-002 | AB276: -6.7400000000000002e-002 | AC276: -0.11800000000000001 | AD276: -0.12 | AE276: 88.38 | AF276: 95.27 | AG276: 0.88 | AH276: AA | AI276: 4.2000000000000003e-002 | AJ276: =H276+100*O276 -> 178.72 | AK276: 182.7 | AL276: 290 | AM276: 87.4 | AN276: 286 | AO276: 0.158 | AP276: 7 | AQ276: 天合转债
A277: 4 | B277: 113629 | C277: 泉峰转债 | D277: 603982 | E277: 泉峰汽车 | F277: 汽车 | G277: 零部件制 | H277: 174.67 | I277: 2.1899999999999999e-002 | J277: -2.2200000000000001e-002 | K277: 35.58 | L277: -2.9999999999999997e-004 | M277: 121 | N277: 23.03 | O277: 0.13100000000000001 | P277: 154.49 | Q277: 4月2天 | R277: 5.82年 | S277: 3.82年 | T277: 6.2 | U277: 214 | V277: 0.19800000000000001 | W277: 8.6999999999999994e-002 | X277: 0.13400000000000001 | Y277: 72 | Z277: 4.31 | AA277: -6.2199999999999998e-002 | AB277: -6.7799999999999999e-002 | AC277: -0.11800000000000001 | AD277: -0.11900000000000001 | AE277: 81.66 | AF277: 85.41 | AG277: 0.87 | AH277: AA- | AI277: 6.3e-002 | AJ277: =H277+100*O277 -> 187.76999999999998 | AK277: 194.8 | AL277: 312 | AM277: 109.4 | AN277: 316 | AO277: 8.5999999999999993e-002 | AP277: 3 | AQ277: 泉峰转债
A278: 342 | B278: 113505 | C278: 杭电转债! | D278: 603618 | E278: 杭电股份 | F278: 能源电力 | G278: 电力设备 | H278: 128.7 | I278: -2.2000000000000001e-003 | J278: -9.1999999999999998e-003 | K278: 8.55 | L278: -1.4999999999999999e-002 | M278: 111.3 | N278: 7.08 | O278: 6.6000000000000003e-002 | P278: 120.76 | Q278: 已到 | R278: 2.29年 | S278: 0.29年 | T278: 7.5 | U278: 59 | V278: 6.2e-002 | W278: 0.127 | X278: 0.153 | Y278: 59 | Z278: 2.24 | AA278: -6.25e-002 | AB278: -7.0800000000000002e-002 | AC278: -0.48599999999999999 | AD278: -0.49200000000000005 | AE278: 100.04 | AF278: 102.11 | AG278: 0.76 | AH278: AA | AI278: 3.9100000000000003e-002 | AJ278: =H278+100*O278 -> 135.29999999999998 | AK278: 136.6 | AL278: 24 | AM278: 34.5 | AN278: 16 | AO278: 0.10000000000000001 | AP278: 44 | AQ278: 杭电转债!
A279: 95 | B279: 123085 | C279: 万顺转2!! | D279: 300057 | E279: 万顺新材 | F279: 有色金属 | G279: 铝金属 | H279: 156.3 | I279: -2.53e-002 | J279: -2.12e-002 | K279: 9.2 | L279: -5.2499999999999998e-002 | M279: 113.3 | N279: 6.2 | O279: 5.2999999999999999e-002 | P279: 148.39 | Q279: 已到 | R279: 5年21天 | S279: 3年21天 | T279: 8.65 | U279: 226 | V279: 0.16899999999999998 | W279: 0.13800000000000001 | X279: 0.20499999999999999 | Y279: 63 | Z279: 1.74 | AA279: -6.2800000000000009e-002 | AB279: -6.7099999999999993e-002 | AC279: -0.11800000000000001 | AD279: -0.12 | AE279: 85.44 | AF279: 83.78 | AG279: 0.89 | AH279: AA- | AI279: 6.3e-002 | AJ279: =H279+100*O279 -> 161.60000000000002 | AK279: 164.2 | AL279: 238 | AM279: 78.8 | AN279: 257 | AO279: 0.122 | AP279: 21 | AQ279: 万顺转2!!
A280: 208 | B280: 113576 | C280: 起步转债!! | D280: 603557 | E280: ST起步 | F280: 服装纺织 | G280: 鞋服行业 | H280: 160.46 | I280: -5.5000000000000005e-003 | J280: 5.5000000000000005e-003 | K280: 5.67 | L280: 0. | M280: 121.3 | N280: 10.55 | O280: 1.99 | P280: 53.74 | Q280: 已到 | R280: 4.39年 | S280: 2.39年 | T280: 2.66 | U280: 1104. | V280: 2.5499999999999998 | W280: 9.5000000000000001e-002 | X280: 5.0999999999999997e-002 | Y280: 28 | Z280: 1.87 | AA280: -6.3200000000000006e-002 | AB280: -7.0699999999999999e-002 | AC280: -0.11199999999999999 | AD280: -0.114 | AE280: 81.52 | AF280: 80.03 | AG280: 0.17 | AH280: BBB+ | AI280: 0.1024 | AJ280: =H280+100*O280 -> 359.46000000000004 | AK280: 267.2 | AL280: 342 | AM280: 185.7 | AN280: 348 | AO280: 4.7e-002 | AP280: 37 | AQ280: 起步转债!!
A281: 191 | B281: 123053 | C281: 宝通转债!! | D281: 300031 | E281: 宝通科技 | F281: 通信互联 | G281: 互联网 | H281: 162.2 | I281: -2.0499999999999997e-002 | J281: -2.4e-002 | K281: 28.32 | L281: -5.4699999999999999e-002 | M281: 120.8 | N281: 20.5 | O281: 0.17399999999999999 | P281: 138.15 | Q281: 已到 | R281: 4.54年 | S281: 2.54年 | T281: 4.99 | U281: 2229. | V281: 2.6899999999999999 | W281: 4.4000000000000004e-002 | X281: 6.0999999999999999e-002 | Y281: 112 | Z281: 3.56 | AA281: -6.4100000000000004e-002 | AB281: -7.1199999999999999e-002 | AC281: -0.106 | AD281: -0.107 | AE281: 88.43 | AF281: 92.74 | AG281: 0.81 | AH281: AA- | AI281: 6.1399999999999996e-002 | AJ281: =H281+100*O281 -> 179.59999999999999 | AK281: 186.3 | AL281: 303 | AM281: 93.5 | AN281: 302 | AO281: 0.11699999999999999 | AP281: 13 | AQ281: 宝通转债!!
A282: 50 | B282: 123111 | C282: 东财转3! | D282: 300059 | E282: 东方财富 | F282: 金融 | G282: 证券行业 | H282: 157.21 | I282: 1.7500000000000002e-002 | J282: -4.0999999999999995e-003 | K282: 35.22 | L282: 1.5300000000000001e-002 | M282: 110.5 | N282: 23.35 | O282: 4.2000000000000003e-002 | P282: 150.84 | Q282: 已到 | R282: 5.38年 | S282: 3.38年 | T282: 151 | U282: 960 | V282: 4.0999999999999995e-002 | W282: 4.0999999999999995e-002 | X282: 6.3e-002 | Y282: 3640. | Z282: 9.34 | AA282: -6.4100000000000004e-002 | AB282: -6.7299999999999999e-002 | AC282: -0.11199999999999999 | AD282: -0.113 | AE282: 89.73 | AF282: 91.1 | AG282: 0.88 | AH282: AA+ | AI282: 3.7000000000000005e-002 | AJ282: =H282+100*O282 -> 161.41 | AK282: 163.6 | AL282: 233 | AM282: 72.5 | AN282: 239 | AO282: 4.7e-002 | AP282: 26 | AQ282: 东财转3!
A283: 194 | B283: 128109 | C283: 楚江转债! | D283: 2171. | E283: 楚江新材 | F283: 有色金属 | G283: 铜金属 | H283: 156.084 | I283: 2.69e-002 | J283: -2.52e-002 | K283: 11.7 | L283: 1.7000000000000001e-003 | M283: 114.9 | N283: 8.63 | O283: 0.151 | P283: 135.57 | Q283: 已到 | R283: 4.54年 | S283: 2.54年 | T283: 18.2 | U283: 70 | V283: 2.5000000000000001e-002 | W283: 0.11699999999999999 | X283: 0.158 | Y283: 156 | Z283: 2.66 | AA283: -6.6400000000000001e-002 | AB283: -7.17e-002 | AC283: -0.14000000000000001 | AD283: -0.10000000000000001 | AE283: 92.99 | AF283: 96.36 | AG283: 1 | AH283: AA | AI283: 4.0399999999999998e-002 | AJ283: =H283+100*O283 -> 171.184 | AK283: 176.6 | AL283: 280 | AM283: 80.2 | AN283: 266 | AO283: 6.9000000000000006e-002 | AP283: 6 | AQ283: 楚江转债!
A284: 28 | B284: 113051 | C284: 节能转债 | D284: 601016 | E284: 节能风电 | F284: 能源电力 | G284: 风能 | H284: 167.35 | I284: 8.9999999999999998e-004 | J284: -9.1000000000000004e-003 | K284: 6.5 | L284: -9.1000000000000004e-003 | M284: 114.5 | N284: 4.05 | O284: 4.2999999999999997e-002 | P284: 160.49 | Q284: 35天 | R284: 5.58年 | S284: 3.58年 | T284: 30 | U284: 215 | V284: 4.2999999999999997e-002 | W284: 9.1999999999999998e-002 | X284: 0.14800000000000002 | Y284: 326 | Z284: 3.16 | AA284: -6.6600000000000006e-002 | AB284: -7.0699999999999999e-002 | AC284: -0.11800000000000001 | AD284: -0.11900000000000001 | AE284: 89.95 | AF284: 93.76 | AG284: 0.9 | AH284: AA+ | AI284: 3.7000000000000005e-002 | AJ284: =H284+100*O284 -> 171.65000000000001 | AK284: 174.2 | AL284: 270 | AM284: 80.4 | AN284: 270 | AO284: -4.5999999999999999e-002 | AP284: 9 | AQ284: 节能转债
A285: 190 | B285: 113585 | C285: 寿仙转债! | D285: 603896 | E285: 寿仙谷 | F285: 医药 | G285: 中药 | H285: 160.4 | I285: -1.7899999999999999e-002 | J285: -2.8000000000000004e-003 | K285: 43.25 | L285: -2.3300000000000001e-002 | M285: 117.3 | N285: 28.38 | O285: 5.2999999999999999e-002 | P285: 152.4 | Q285: 已到 | R285: 4.55年 | S285: 2.55年 | T285: 1.01 | U285: 35 | V285: 0.214 | W285: 1.4999999999999999e-002 | X285: 2.3e-002 | Y285: 66 | Z285: 4.44 | AA285: -6.7699999999999996e-002 | AB285: -7.3700000000000002e-002 | AC285: -0.10300000000000001 | AD285: -0.105 | AE285: 88.3 | AF285: 89.99 | AG285: 0.89 | AH285: AA- | AI285: 6.1399999999999996e-002 | AJ285: =H285+100*O285 -> 165.70000000000002 | AK285: 168.4 | AL285: 257 | AM285: 78.4 | AN285: 256 | AO285: 2.1000000000000001e-002 | AP285: 18 | AQ285: 寿仙转债!
A286: 102 | B286: 128140 | C286: 润建转债!! | D286: 2929. | E286: 润建股份 | F286: 通信互联 | G286: 通信设备 | H286: 165.7 | I286: 5.6100000000000004e-002 | J286: -2.18e-002 | K286: 39.06 | L286: 3.9699999999999999e-002 | M286: 115.2 | N286: 26.4 | O286: 0.12 | P286: 147.95 | Q286: 已到 | R286: 5年17天 | S286: 3年17天 | T286: 10.9 | U286: 195 | V286: 0.111 | W286: 0.124 | X286: 0.183 | Y286: 88 | Z286: 2.54 | AA286: -7.0699999999999999e-002 | AB286: -7.5499999999999998e-002 | AC286: -0.13400000000000001 | AD286: -0.13500000000000001 | AE286: 90.99 | AF286: 94.02 | AG286: 0.87 | AH286: AA | AI286: 4.2000000000000003e-002 | AJ286: =H286+100*O286 -> 177.69999999999999 | AK286: 183.4 | AL286: 293 | AM286: 89.4 | AN286: 289 | AO286: 0.16399999999999998 | AP286: 11 | AQ286: 润建转债!!
A287: 85 | B287: 113615 | C287: 金诚转债! | D287: 603979 | E287: 金诚信 | F287: 有色金属 | G287: 有色行业 | H287: 169.58 | I287: 2.64e-002 | J287: 5.3e-003 | K287: 19.92 | L287: 3.5299999999999998e-002 | M287: 117.3 | N287: 12.65 | O287: 7.6999999999999999e-002 | P287: 157.47 | Q287: 已到 | R287: 5年33天 | S287: 3年33天 | T287: 8.66 | U287: 151 | V287: 0.10300000000000001 | W287: 7.2999999999999995e-002 | X287: 0.115 | Y287: 118 | Z287: 2.39 | AA287: -7.1099999999999997e-002 | AB287: -7.6399999999999996e-002 | AC287: -0.13800000000000001 | AD287: -0.13900000000000001 | AE287: 90.92 | AF287: 95.57 | AG287: 0.9 | AH287: AA | AI287: 4.2000000000000003e-002 | AJ287: =H287+100*O287 -> 177.28 | AK287: 181.7 | AL287: 287 | AM287: 86.1 | AN287: 283 | AO287: -1.e-002 | AP287: 4 | AQ287: 金诚转债!
A288: 347 | B288: 128033 | C288: 迪龙转债! | D288: 2658. | E288: 雪迪龙 | F288: 城市公用 | G288: 三废处理 | H288: 126.8 | I288: -5.6000000000000008e-003 | J288: -1.8e-003 | K288: 8.5 | L288: -1.5100000000000001e-002 | M288: 108.8 | N288: 8.56 | O288: 0.27699999999999997 | P288: 99.3 | Q288: 已到 | R288: 2年37天 | S288: 37天 | T288: 2.98 | U288: 76 | V288: 0.20199999999999999 | W288: 5.5999999999999994e-002 | X288: 5.5e-002 | Y288: 54 | Z288: 2.19 | AA288: -7.1399999999999991e-002 | AB288: -7.85e-002 | AC288: -0.80400000000000005 | AD288: -0.81299999999999994 | AE288: 100.52 | AF288: 100.52 | AG288: 0.49 | AH288: AA | AI288: 3.9100000000000003e-002 | AJ288: =H288+100*O288 -> 154.5 | AK288: 154.3 | AL288: 175 | AM288: 53.8 | AN288: 127 | AO288: 4.2999999999999997e-002 | AP288: 33 | AQ288: 迪龙转债!
A289: 278 | B289: 113027 | C289: 华钰转债!! | D289: 601020 | E289: ST华钰 | F289: 有色金属 | G289: 锌铅镍锡 | H289: 148.23 | I289: -6.4000000000000003e-003 | J289: -8.1000000000000013e-003 | K289: 12.31 | L289: -1.83e-002 | M289: 114.3 | N289: 10.17 | O289: 0.22500000000000001 | P289: 121.04 | Q289: 已到 | R289: 3.56年 | S289: 1.56年 | T289: 3.11 | U289: 366 | V289: 0.79099999999999993 | W289: 4.4999999999999998e-002 | X289: 5.5e-002 | Y289: 68 | Z289: 2.63 | AA289: -7.1500000000000008e-002 | AB289: -7.8e-002 | AC289: -0.16300000000000001 | AD289: -0.16399999999999998 | AE289: 89.73 | AF289: 86.7 | AG289: 0.79 | AH289: A | AI289: 8.2400000000000001e-002 | AJ289: =H289+100*O289 -> 170.72999999999999 | AK289: 175.4 | AL289: 277 | AM289: 85.7 | AN289: 282 | AO289: -0.11599999999999999 | AP289: 43 | AQ289: 华钰转债!!
A290: 42 | B290: 113048 | C290: 晶科转债!! | D290: 601778 | E290: 晶科科技 | F290: 能源电力 | G290: 太阳能 | H290: 176.29 | I290: 5.1500000000000004e-002 | J290: -3.6400000000000002e-002 | K290: 9.19 | L290: 1.66e-002 | M290: 117.1 | N290: 5.46 | O290: 4.7e-002 | P290: 168.32 | Q290: 已到 | R290: 5.42年 | S290: 3.42年 | T290: 23 | U290: 1354. | V290: 0.34200000000000003 | W290: 8.5999999999999993e-002 | X290: 0.14499999999999999 | Y290: 266 | Z290: 2.24 | AA290: -7.3800000000000004e-002 | AB290: -7.8700000000000006e-002 | AC290: -0.13400000000000001 | AD290: -0.13500000000000001 | AE290: 89.5 | AF290: 94.08 | AG290: 0.91 | AH290: AA | AI290: 4.2000000000000003e-002 | AJ290: =H290+100*O290 -> 180.98999999999998 | AK290: 184.3 | AL290: 297 | AM290: 90.2 | AN290: 294 | AO290: 2.7000000000000003e-002 | AP290: 15 | AQ290: 晶科转债!!
A291: 144 | B291: 113039 | C291: 嘉泽转债!! | D291: 601619 | E291: 嘉泽新能 | F291: 能源电力 | G291: 风能 | H291: 162.46 | I291: -2.8000000000000004e-003 | J291: -5.9999999999999995e-004 | K291: 5.24 | L291: -3.8e-003 | M291: 112.8 | N291: 3.46 | O291: 7.2999999999999995e-002 | P291: 151.45 | Q291: 已到 | R291: 4.76年 | S291: 2.76年 | T291: 2.89 | U291: 94 | V291: 0.20100000000000001 | W291: 2.3e-002 | X291: 3.5000000000000003e-002 | Y291: 127 | Z291: 2.67 | AA291: -7.4999999999999997e-002 | AB291: -7.9299999999999995e-002 | AC291: -0.14199999999999999 | AD291: -0.14300000000000002 | AE291: 92.08 | AF291: 93.76 | AG291: 0.89 | AH291: AA | AI291: 4.0399999999999998e-002 | AJ291: =H291+100*O291 -> 169.76000000000002 | AK291: 173.5 | AL291: 268 | AM291: 79.7 | AN291: 264 | AO291: -5.0000000000000003e-002 | AP291: 35 | AQ291: 嘉泽转债!!
A292: 38 | B292: 123114 | C292: 三角转债 | D292: 300775 | E292: 三角防务 | F292: 航空航天 | G292: 航空航天 | H292: 185.2 | I292: -6.9999999999999993e-003 | J292: 1.e-004 | K292: 51.62 | L292: -7.7000000000000002e-003 | M292: 121 | N292: 31.82 | O292: 0.14199999999999999 | P292: 162.23 | Q292: 10天 | R292: 5.51年 | S292: 3.51年 | T292: 9.04 | U292: 232 | V292: 0.13600000000000001 | W292: 3.5000000000000003e-002 | X292: 5.7000000000000002e-002 | Y292: 256 | Z292: 11.84 | AA292: -7.5600000000000001e-002 | AB292: -8.14e-002 | AC292: -0.14099999999999999 | AD292: -0.14199999999999999 | AE292: 83.21 | AF292: 87.03 | AG292: 0.89 | AH292: AA- | AI292: 6.3e-002 | AJ292: =H292+100*O292 -> 199.39999999999998 | AK292: 208.2 | AL292: 318 | AM292: 121.1 | AN292: 322 | AO292: 2.4e-002 | AP292: 6 | AQ292: 三角转债
A293: 294 | B293: 123025 | C293: 精测转债!! | D293: 300567 | E293: 精测电子 | F293: 电子 | G293: 液晶显示 | H293: 151.021 | I293: 1.49e-002 | J293: 1.03e-002 | K293: 57.57 | L293: 3.6000000000000004e-002 | M293: 116.5 | N293: 49.37 | O293: 0.29499999999999998 | P293: 116.61 | Q293: 已到 | R293: 3.35年 | S293: 1.35年 | T293: 3.09 | U293: 60 | V293: 0.127 | W293: 1.9e-002 | X293: 2.2000000000000002e-002 | Y293: 160 | Z293: 4.95 | AA293: -7.5800000000000006e-002 | AB293: -8.3599999999999994e-002 | AC293: -0.19800000000000001 | AD293: -0.20100000000000001 | AE293: 94.01 | AF293: 95.81 | AG293: 0.7 | AH293: AA- | AI293: 6.1399999999999996e-002 | AJ293: =H293+100*O293 -> 180.52099999999999 | AK293: 185.4 | AL293: 302 | AM293: 89.6 | AN293: 290 | AO293: 4.2000000000000003e-002 | AP293: 15 | AQ293: 精测转债!!
A294: 253 | B294: 113550 | C294: 常汽转债! | D294: 603035 | E294: 常熟汽饰 | F294: 汽车 | G294: 零部件制 | H294: 164.51 | I294: 2.06e-002 | J294: -8.0000000000000002e-003 | K294: 13.72 | L294: 1.4800000000000001e-002 | M294: 121.3 | N294: 9.33 | O294: 0.11900000000000001 | P294: 147.05 | Q294: 已到 | R294: 3.99年 | S294: 1.99年 | T294: 2.14 | U294: 28 | V294: 8.1000000000000003e-002 | W294: 4.2999999999999997e-002 | X294: 6.4000000000000001e-002 | Y294: 49 | Z294: 1.26 | AA294: -7.6299999999999993e-002 | AB294: -8.4199999999999997e-002 | AC294: -0.14899999999999999 | AD294: -0.151 | AE294: 91.01 | AF294: 95.46 | AG294: 0.85 | AH294: AA- | AI294: 6.1399999999999996e-002 | AJ294: =H294+100*O294 -> 176.41 | AK294: 182 | AL294: 288 | AM294: 86.5 | AN294: 284 | AO294: 7.2000000000000008e-002 | AP294: 16 | AQ294: 常汽转债!
A295: 17 | B295: 123120 | C295: 隆华转债 | D295: 300263 | E295: 隆华科技 | F295: 机械装备 | G295: 通用设备 | H295: 190.153 | I295: 9.300000000000001e-003 | J295: -1.29e-002 | K295: 12.17 | L295: -4.0999999999999995e-003 | M295: 121.1 | N295: 7.76 | O295: 0.21199999999999999 | P295: 156.83 | Q295: 2月17天 | R295: 5.69年 | S295: 3.69年 | T295: 7.99 | U295: 152 | V295: 0.10000000000000001 | W295: 7.2000000000000008e-002 | X295: 0.113 | Y295: 111 | Z295: 3.86 | AA295: -7.7499999999999999e-002 | AB295: -8.3100000000000007e-002 | AC295: -0.13900000000000001 | AD295: -0.14000000000000001 | AE295: 82.45 | AF295: 86.17 | AG295: 0.88 | AH295: AA- | AI295: 6.3e-002 | AJ295: =H295+100*O295 -> 211.35299999999998 | AK295: 223.5 | AL295: 330 | AM295: 137.3 | AN295: 331 | AO295: 9.3000000000000013e-002 | AP295: 3 | AQ295: 隆华转债
A296: 353 | B296: 128025 | C296: 特一转债! | D296: 2728. | E296: 特一药业 | F296: 医药 | G296: 化学制药 | H296: 128.3 | I296: -2.0999999999999999e-003 | J296: -2.5899999999999999e-002 | K296: 14.19 | L296: -5.0799999999999998e-002 | M296: 108.8 | N296: 14.05 | O296: 0.27000000000000002 | P296: 101 | Q296: 已到 | R296: 2年16天 | S296: 16天 | T296: 2.98 | U296: 825 | V296: 2.1499999999999999 | W296: 0.10300000000000001 | X296: 0.10400000000000001 | Y296: 29 | Z296: 2.89 | AA296: -7.8799999999999995e-002 | AB296: -8.5999999999999993e-002 | AC296: <-100% | AD296: <-100% | AE296: 100.32 | AF296: 96.79 | AG296: 0.55 | AH296: AA- | AI296: 6.0100000000000001e-002 | AJ296: =H296+100*O296 -> 155.30000000000001 | AK296: 155.6 | AL296: 181 | AM296: 55.3 | AN296: 137 | AO296: 0.10199999999999999 | AP296: 48 | AQ296: 特一转债!
A297: 362 | B297: 113013 | C297: 国君转债! | D297: 601211 | E297: 国泰君安 | F297: 金融 | G297: 证券行业 | H297: 122 | I297: 1.2199999999999999e-002 | J297: -4.1999999999999997e-003 | K297: 17.29 | L297: 2.2499999999999999e-002 | M297: 106.8 | N297: 18.45 | O297: 0.30199999999999999 | P297: 93.71 | Q297: 已到 | R297: 1.63年 | S297: 无权 | T297: 69.9 | U297: 88 | V297: 1.e-002 | W297: 4.4999999999999998e-002 | X297: 4.2999999999999997e-002 | Y297: 1540. | Z297: 1.16 | AA297: -7.9299999999999995e-002 | AB297: -8.6400000000000005e-002 | AC297: 无权 | AD297: 无权 | AE297: 无权 | AF297: 101.5 | AG297: 0.36 | AH297: AAA | AI297: 3.2099999999999997e-002 | AJ297: =H297+100*O297 -> 152.19999999999999 | AK297: 150.3 | AL297: 148 | AM297: 48.8 | AN297: 98 | AO297: -4.0000000000000001e-003 | AP297: 12 | AQ297: 国君转债!
A298: 367 | B298: 128013 | C298: 洪涛转债! | D298: 2325. | E298: 洪涛股份 | F298: 建筑 | G298: 装饰工程 | H298: 114.368 | I298: 6.9999999999999993e-003 | J298: 8.9999999999999998e-004 | K298: 2.59 | L298: 1.1699999999999999e-002 | M298: 108 | N298: 2.32 | O298: 2.4e-002 | P298: 111.64 | Q298: 已到 | R298: 0.69年 | S298: 回售内 | T298: 11.4 | U298: 53 | V298: 4.0000000000000001e-002 | W298: 0.34600000000000003 | X298: 0.38700000000000001 | Y298: 33 | Z298: 1.17 | AA298: -7.9899999999999999e-002 | AB298: -9.9600000000000008e-002 | AC298: 回售内 | AD298: 回售内 | AE298: 100.33 | AF298: 101.93 | AG298: 0.68 | AH298: A- | AI298: 8.77e-002 | AJ298: =H298+100*O298 -> 116.768 | AK298: 117.1 | AL298: 2 | AM298: 15.2 | AN298: 1 | AO298: 5.7999999999999996e-002 | AP298: 100 | AQ298: 洪涛转债!
A299: 26 | B299: 113626 | C299: 伯特转债 | D299: 603596 | E299: 伯特利 | F299: 汽车 | G299: 零部件制 | H299: 193.92 | I299: -1.e-004 | J299: -1.37e-002 | K299: 64.08 | L299: -1.5100000000000001e-002 | M299: 121.1 | N299: 36.01 | O299: 8.9999999999999997e-002 | P299: 177.95 | Q299: 46天 | R299: 5.61年 | S299: 3.61年 | T299: 9.02 | U299: 193 | V299: 0.11 | W299: 3.4000000000000002e-002 | X299: 6.0999999999999999e-002 | Y299: 262 | Z299: 8.27 | AA299: -8.1699999999999995e-002 | AB299: -8.7400000000000005e-002 | AC299: -0.14699999999999999 | AD299: -0.14800000000000002 | AE299: 88.83 | AF299: 96.55 | AG299: 0.92 | AH299: AA | AI299: 4.2000000000000003e-002 | AJ299: =H299+100*O299 -> 202.91999999999999 | AK299: 209.9 | AL299: 320 | AM299: 113.3 | AN299: 317 | AO299: 7.0000000000000007e-002 | AP299: 3 | AQ299: 伯特转债
A300: 281 | B300: 113536 | C300: 三星转债 | D300: 603578 | E300: 三星新材 | F300: 家电 | G300: 零部件制 | H300: 153.74 | I300: 0.111 | J300: -3.2099999999999997e-002 | K300: 18.15 | L300: 0.10000000000000001 | M300: 114.3 | N300: 13.76 | O300: 0.16600000000000001 | P300: 131.9 | Q300: 已到 | R300: 3.53年 | S300: 1.53年 | T300: 1.49 | U300: 1556. | V300: 6.6799999999999997 | W300: 6.4000000000000001e-002 | X300: 8.4000000000000005e-002 | Y300: 23 | Z300: 3 | AA300: -8.199999999999999e-002 | AB300: -8.8399999999999992e-002 | AC300: -0.18100000000000002 | AD300: -0.183 | AE300: 96.19 | AF300: 99.68 | AG300: 0.79 | AH300: AA | AI300: 4.0399999999999998e-002 | AJ300: =H300+100*O300 -> 170.34 | AK300: 175.6 | AL300: 278 | AM300: 75.9 | AN300: 250 | AO300: 7.4999999999999997e-002 | AP300: 35 | AQ300: 三星转债
A301: 359 | B301: 113502 | C301: 嘉澳转债! | D301: 603822 | E301: 嘉澳环保 | F301: 化工 | G301: 化工 | H301: 130.26 | I301: 9.5999999999999992e-003 | J301: -4.3e-003 | K301: 44.76 | L301: 1.0200000000000001e-002 | M301: 109.8 | N301: 44.64 | O301: 0.29899999999999999 | P301: 100.27 | Q301: 已到 | R301: 1.97年 | S301: 回售内 | T301: 1.84 | U301: 29 | V301: 0.11900000000000001 | W301: 5.5999999999999994e-002 | X301: 5.5999999999999994e-002 | Y301: 33 | Z301: 3.95 | AA301: -8.3599999999999994e-002 | AB301: -9.1899999999999996e-002 | AC301: 回售内 | AD301: 回售内 | AE301: 100.3 | AF301: 97.95 | AG301: 0.52 | AH301: AA- | AI301: 6.0100000000000001e-002 | AJ301: =H301+100*O301 -> 160.16 | AK301: 160.3 | AL301: 206 | AM301: 60 | AN301: 167 | AO301: 1.e-002 | AP301: 35 | AQ301: 嘉澳转债!
A302: 235 | B302: 128094 | C302: 星帅转债! | D302: 2860. | E302: 星帅尔 | F302: 家电 | G302: 零部件制 | H302: 172.8 | I302: 1.77e-002 | J302: 1.23e-002 | K302: 23.63 | L302: 3.2799999999999996e-002 | M302: 121 | N302: 13.8 | O302: 9.0000000000000011e-003 | P302: 171.23 | Q302: 已到 | R302: 4年57天 | S302: 2年57天 | T302: 2.18 | U302: 246 | V302: 0.66200000000000003 | W302: 4.4999999999999998e-002 | X302: 7.8e-002 | Y302: 48 | Z302: 4.19 | AA302: -8.3900000000000002e-002 | AB302: -9.1499999999999998e-002 | AC302: -0.14599999999999999 | AD302: -0.14800000000000002 | AE302: 88.68 | AF302: 91.2 | AG302: 0.91 | AH302: A+ | AI302: 7.2400000000000006e-002 | AJ302: =H302+100*O302 -> 173.70000000000002 | AK302: 174.4 | AL302: 271 | AM302: 83.2 | AN302: 276 | AO302: 0.17000000000000001 | AP302: 30 | AQ302: 星帅转债!
A303: 31 | B303: 127038 | C303: 国微转债 | D303: 2049. | E303: 紫光国微 | F303: 电子 | G303: 芯片制造 | H303: 185.195 | I303: -6.5000000000000006e-003 | J303: -2.3e-003 | K303: 208.7 | L303: -1.01e-002 | M303: 114.5 | N303: 137.78 | O303: 0.223 | P303: 151.47 | Q303: 27天 | R303: 5.55年 | S303: 3.55年 | T303: 15 | U303: 152 | V303: 5.5e-002 | W303: 1.2e-002 | X303: 1.8000000000000002e-002 | Y303: 1266. | Z303: 19.27 | AA303: -8.4000000000000005e-002 | AB303: -8.8100000000000012e-002 | AC303: -0.14000000000000001 | AD303: -0.14099999999999999 | AE303: 90.05 | AF303: 93.87 | AG303: 0.88 | AH303: AA+ | AI303: 3.7000000000000005e-002 | AJ303: =H303+100*O303 -> 207.495 | AK303: 218.9 | AL303: 324 | AM303: 125.1 | AN303: 324 | AO303: -1.8000000000000002e-002 | AP303: 5 | AQ303: 国微转债
A304: 215 | B304: 128103 | C304: 同德转债! | D304: 2360. | E304: 同德化工 | F304: 化工 | G304: 化工 | H304: 176.52 | I304: 1.8e-003 | J304: -7.000000000000001e-004 | K304: 8.45 | L304: 1.1999999999999999e-003 | M304: 121.3 | N304: 5.08 | O304: 6.0999999999999999e-002 | P304: 166.34 | Q304: 已到 | R304: 4.35年 | S304: 2.35年 | T304: 0.88 | U304: 61 | V304: 0.39100000000000001 | W304: 2.6000000000000002e-002 | X304: 4.4000000000000004e-002 | Y304: 34 | Z304: 2.53 | AA304: -8.4399999999999989e-002 | AB304: -9.1799999999999993e-002 | AC304: -0.13500000000000001 | AD304: -0.13699999999999998 | AE304: 87.61 | AF304: 90.23 | AG304: 0.9 | AH304: A+ | AI304: 7.2400000000000006e-002 | AJ304: =H304+100*O304 -> 182.62 | AK304: 186.7 | AL304: 304 | AM304: 96.5 | AN304: 307 | AO304: -4.2999999999999997e-002 | AP304: 17 | AQ304: 同德转债!
A305: 274 | B305: 113541 | C305: 荣晟转债!! | D305: 603165 | E305: 荣晟环保 | F305: 造纸包装 | G305: 包装用纸 | H305: 159.58 | I305: 1.7899999999999999e-002 | J305: -1.9e-002 | K305: 16.59 | L305: -1.1999999999999999e-003 | M305: 114.3 | N305: 10.84 | O305: 4.2999999999999997e-002 | P305: 153.04 | Q305: 已到 | R305: 3.67年 | S305: 1.67年 | T305: 1.63 | U305: 202 | V305: 0.77400000000000002 | W305: 3.7000000000000005e-002 | X305: 5.7000000000000002e-002 | Y305: 44 | Z305: 2.52 | AA305: -8.8300000000000003e-002 | AB305: -9.4399999999999998e-002 | AC305: -0.17600000000000002 | AD305: -0.17699999999999999 | AE305: 92.21 | AF305: 92.24 | AG305: 0.89 | AH305: AA- | AI305: 6.1399999999999996e-002 | AJ305: =H305+100*O305 -> 163.88000000000002 | AK305: 166.1 | AL305: 250 | AM305: 73.9 | AN305: 246 | AO305: 0.115 | AP305: 40 | AQ305: 荣晟转债!!
A306: 255 | B306: 123035 | C306: 利德转债!! | D306: 300296 | E306: 利亚德 | F306: 电子 | G306: LED制 | H306: 167.1 | I306: 1.89e-002 | J306: -9.4999999999999998e-003 | K306: 10.4 | L306: 1.0700000000000001e-002 | M306: 114.3 | N306: 6.96 | O306: 0.11800000000000001 | P306: 149.43 | Q306: 已到 | R306: 3.98年 | S306: 1.98年 | T306: 7.99 | U306: 261 | V306: 0.19600000000000001 | W306: 2.9999999999999999e-002 | X306: 4.4999999999999998e-002 | Y306: 264 | Z306: 3.44 | AA306: -9.2300000000000007e-002 | AB306: -9.7899999999999987e-002 | AC306: -0.156 | AD306: -0.157 | AE306: 95.44 | AF306: 99.75 | AG306: 0.88 | AH306: AA+ | AI306: 3.5400000000000001e-002 | AJ306: =H306+100*O306 -> 178.90000000000001 | AK306: 184.8 | AL306: 299 | AM306: 85 | AN306: 281 | AO306: 6.3e-002 | AP306: 13 | AQ306: 利德转债!!
A307: 165 | B307: 123060 | C307: 苏试转债! | D307: 300416 | E307: 苏试试验 | F307: 机械装备 | G307: 专用设备 | H307: 182.8 | I307: 3.1600000000000003e-002 | J307: -1.84e-002 | K307: 28.8 | L307: 1.4800000000000001e-002 | M307: 117.2 | N307: 18.28 | O307: 0.16 | P307: 157.55 | Q307: 已到 | R307: 4.67年 | S307: 2.67年 | T307: 3.1 | U307: 338 | V307: 0.59899999999999998 | W307: 4.0999999999999995e-002 | X307: 6.4000000000000001e-002 | Y307: 76 | Z307: 7.49 | AA307: -9.2399999999999996e-002 | AB307: -9.8000000000000004e-002 | AC307: -0.121 | AD307: -0.122 | AE307: 87.6 | AF307: 89.28 | AG307: 0.89 | AH307: AA- | AI307: 6.1399999999999996e-002 | AJ307: =H307+100*O307 -> 198.80000000000001 | AK307: 208.1 | AL307: 317 | AM307: 118.8 | AN307: 320 | AO307: 0.115 | AP307: 8 | AQ307: 苏试转债!
A308: 70 | B308: 118000 | C308: 嘉元转债! | D308: 688388 | E308: 嘉元科技 | F308: 电子 | G308: 电子产品 | H308: 200.33 | I308: 4.1200000000000001e-002 | J308: 6.8000000000000005e-003 | K308: 146.21 | L308: 5.1900000000000002e-002 | M308: 121 | N308: 78.74 | O308: 7.9000000000000001e-002 | P308: 185.69 | Q308: 已到 | R308: 5.26年 | S308: 3.26年 | T308: 9.79 | U308: 596 | V308: 0.30399999999999999 | W308: 2.8999999999999998e-002 | X308: 5.2999999999999999e-002 | Y308: 342 | Z308: 11.42 | AA308: -9.3000000000000013e-002 | AB308: -9.8800000000000013e-002 | AC308: -0.10099999999999999 | AD308: -0.10199999999999999 | AE308: 84.49 | AF308: 88.37 | AG308: 0.92 | AH308: AA- | AI308: 6.3e-002 | AJ308: =H308+100*O308 -> 208.23000000000002 | AK308: 215 | AL308: 323 | AM308: 126.6 | AN308: 327 | AO308: -5.5e-002 | AP308: 6 | AQ308: 嘉元转债!
A309: 233 | B309: 128096 | C309: 奥瑞转债!! | D309: 2701. | E309: 奥瑞金 | F309: 造纸包装 | G309: 包装材料 | H309: 173.14 | I309: -2.98e-002 | J309: 1.1699999999999999e-002 | K309: 7.56 | L309: -1.95e-002 | M309: 115.5 | N309: 4.5 | O309: 3.1e-002 | P309: 168 | Q309: 已到 | R309: 4.23年 | S309: 2.23年 | T309: 5.66 | U309: 90 | V309: 9.0999999999999998e-002 | W309: 3.1e-002 | X309: 5.2000000000000005e-002 | Y309: 185 | Z309: 2.55 | AA309: -9.3200000000000005e-002 | AB309: -9.8800000000000013e-002 | AC309: -0.14099999999999999 | AD309: -0.14300000000000002 | AE309: 95.64 | AF309: 100.07 | AG309: 0.93 | AH309: AA+ | AI309: 3.5400000000000001e-002 | AJ309: =H309+100*O309 -> 176.23999999999998 | AK309: 178.3 | AL309: 282 | AM309: 78.2 | AN309: 255 | AO309: 6.3e-002 | AP309: 17 | AQ309: 奥瑞转债!!
A310: 32 | B310: 113049 | C310: 长汽转债 | D310: 601633 | E310: 长城汽车 | F310: 汽车 | G310: 乘用车 | H310: 189.62 | I310: 2.1700000000000001e-002 | J310: -1.95e-002 | K310: 59.21 | L310: 2.3999999999999998e-003 | M310: 110.5 | N310: 38.01 | O310: 0.217 | P310: 155.77 | Q310: 27天 | R310: 5.55年 | S310: 3.55年 | T310: 35 | U310: 109 | V310: 1.7000000000000001e-002 | W310: 6.0000000000000001e-003 | X310: 1.e-002 | Y310: 5468. | Z310: 9.32 | AA310: -9.3599999999999989e-002 | AB310: -9.6600000000000005e-002 | AC310: -0.14699999999999999 | AD310: -0.14699999999999999 | AE310: 90.03 | AF310: 91.51 | AG310: 0.89 | AH310: AAA | AI310: 3.5000000000000003e-002 | AJ310: =H310+100*O310 -> 211.31999999999999 | AK310: 223.5 | AL310: 329 | AM310: 132 | AN310: 330 | AO310: -6.0999999999999999e-002 | AP310: 5 | AQ310: 长汽转债
A311: 250 | B311: 128082 | C311: 华锋转债!! | D311: 2806. | E311: 华锋股份 | F311: 电子 | G311: 元器件制 | H311: 182 | I311: 9.4999999999999998e-003 | J311: 1.2999999999999999e-003 | K311: 16.39 | L311: 1.1699999999999999e-002 | M311: 121.4 | N311: 9.13 | O311: 1.3999999999999999e-002 | P311: 179.52 | Q311: 已到 | R311: 4年14天 | S311: 2年14天 | T311: 2.04 | U311: 246 | V311: 0.66400000000000003 | W311: 6.5000000000000002e-002 | X311: 0.11599999999999999 | Y311: 31 | Z311: 2.76 | AA311: -9.7699999999999995e-002 | AB311: -0.105 | AC311: -0.16800000000000001 | AD311: -0.17000000000000001 | AE311: 88 | AF311: 89.04 | AG311: 0.92 | AH311: A | AI311: 8.2400000000000001e-002 | AJ311: =H311+100*O311 -> 183.40000000000001 | AK311: 184.5 | AL311: 298 | AM311: 95.4 | AN311: 305 | AO311: 0.115 | AP311: 50 | AQ311: 华锋转债!!
A312: 126 | B312: 123071 | C312: 天能转债!! | D312: 300569 | E312: 天能重工 | F312: 能源电力 | G312: 风能 | H312: 198.571 | I312: 9.1999999999999998e-003 | J312: 1.8e-003 | K312: 15.65 | L312: 1.1599999999999999e-002 | M312: 120.7 | N312: 7.91 | O312: 4.0000000000000001e-003 | P312: 197.85 | Q312: 已到 | R312: 4.92年 | S312: 2.92年 | T312: 6.95 | U312: 2043. | V312: 1.5 | W312: 5.5999999999999994e-002 | X312: 0.111 | Y312: 124 | Z312: 3.55 | AA312: -9.7799999999999998e-002 | AB312: -0.10400000000000001 | AC312: -0.11800000000000001 | AD312: -0.11900000000000001 | AE312: 86.35 | AF312: 90.57 | AG312: 0.95 | AH312: AA- | AI312: 6.1399999999999996e-002 | AJ312: =H312+100*O312 -> 198.971 | AK312: 199.3 | AL312: 314 | AM312: 108.7 | AN312: 315 | AO312: 0.28399999999999997 | AP312: 13 | AQ312: 天能转债!!
A313: 60 | B313: 127030 | C313: 盛虹转债! | D313: 301. | E313: 东方盛虹 | F313: 化工 | G313: 化纤 | H313: 193.4 | I313: 5.3e-003 | J313: 2.6200000000000001e-002 | K313: 23.1 | L313: 3.4500000000000003e-002 | M313: 112.5 | N313: 14.1 | O313: 0.17999999999999999 | P313: 163.83 | Q313: 已到 | R313: 5.33年 | S313: 3.33年 | T313: 50 | U313: 508 | V313: 5.2999999999999999e-002 | W313: 4.4999999999999998e-002 | X313: 7.2999999999999995e-002 | Y313: 1117. | Z313: 9.85 | AA313: -9.7799999999999998e-002 | AB313: -0.10099999999999999 | AC313: -0.159 | AD313: -0.16 | AE313: 90.77 | AF313: 92.97 | AG313: 0.91 | AH313: AA+ | AI313: 3.7000000000000005e-002 | AJ313: =H313+100*O313 -> 211.40000000000001 | AK313: 223 | AL313: 328 | AM313: 130 | AN313: 329 | AO313: -5.5e-002 | AP313: 5 | AQ313: 盛虹转债!
A314: 87 | B314: 123089 | C314: 九洲转2!! | D314: 300040 | E314: 九洲集团 | F314: 能源电力 | G314: 电力设备 | H314: 202.721 | I314: 5.9999999999999995e-004 | J314: 1.3300000000000001e-002 | K314: 10.98 | L314: 1.4800000000000001e-002 | M314: 121 | N314: 5.68 | O314: 4.9000000000000002e-002 | P314: 193.31 | Q314: 已到 | R314: 5年31天 | S314: 3年31天 | T314: 3.06 | U314: 520 | V314: 0.84200000000000008 | W314: 4.7e-002 | X314: 9.1999999999999998e-002 | Y314: 65 | Z314: 2.52 | AA314: -9.820000000000001e-002 | AB314: -0.10400000000000001 | AC314: -0.11199999999999999 | AD314: -0.11199999999999999 | AE314: 85.4 | AF314: 89.32 | AG314: 0.94 | AH314: AA- | AI314: 6.3e-002 | AJ314: =H314+100*O314 -> 207.62100000000001 | AK314: 212.1 | AL314: 321 | AM314: 122.8 | AN314: 323 | AO314: 5.7000000000000002e-002 | AP314: 18 | AQ314: 九洲转2!!
A315: 266 | B315: 113545 | C315: 金能转债! | D315: 603113 | E315: 金能科技 | F315: 煤炭 | G315: 炼焦 | H315: 170.15 | I315: 3.6299999999999999e-002 | J315: -1.03e-002 | K315: 15.85 | L315: 2.92e-002 | M315: 114.3 | N315: 10.43 | O315: 0.12 | P315: 151.97 | Q315: 已到 | R315: 3.90年 | S315: 1.90年 | T315: 9.87 | U315: 894 | V315: 0.55000000000000004 | W315: 7.2999999999999995e-002 | X315: 0.111 | Y315: 136 | Z315: 1.55 | AA315: -9.849999999999999e-002 | AB315: -0.10400000000000001 | AC315: -0.16899999999999998 | AD315: -0.17000000000000001 | AE315: 94.78 | AF315: 98.22 | AG315: 0.89 | AH315: AA | AI315: 4.0399999999999998e-002 | AJ315: =H315+100*O315 -> 182.15000000000001 | AK315: 188.3 | AL315: 306 | AM315: 90.1 | AN315: 293 | AO315: 9.4e-002 | AP315: 13 | AQ315: 金能转债!
A316: 187 | B316: 128113 | C316: 比音转债! | D316: 2832. | E316: 比音勒芬 | F316: 服装纺织 | G316: 服装行业 | H316: 187.026 | I316: 1.e-004 | J316: -1.11e-002 | K316: 25.1 | L316: -1.18e-002 | M316: 116.9 | N316: 14.6 | O316: 8.8000000000000009e-002 | P316: 171.92 | Q316: 已到 | R316: 4.57年 | S316: 2.57年 | T316: 2.98 | U316: 15 | V316: 2.7000000000000003e-002 | W316: 2.2000000000000002e-002 | X316: 3.7000000000000005e-002 | Y316: 138 | Z316: 4.67 | AA316: -9.9399999999999988e-002 | AB316: -0.105 | AC316: -0.13100000000000001 | AD316: -0.13200000000000001 | AE316: 92.88 | AF316: 97.91 | AG316: 0.93 | AH316: AA | AI316: 4.0399999999999998e-002 | AJ316: =H316+100*O316 -> 195.82600000000002 | AK316: 202.1 | AL316: 316 | AM316: 104.2 | AN316: 312 | AO316: 6.0000000000000001e-003 | AP316: 8 | AQ316: 比音转债!
A317: 76 | B317: 113621 | C317: 彤程转债! | D317: 603650 | E317: 彤程新材 | F317: 化工 | G317: 橡胶塑料 | H317: 198.2 | I317: 1.47e-002 | J317: -2.4799999999999999e-002 | K317: 56.88 | L317: -1.0800000000000001e-002 | M317: 115.1 | N317: 32.62 | O317: 0.13699999999999998 | P317: 174.37 | Q317: 已到 | R317: 5.18年 | S317: 3.18年 | T317: 5.37 | U317: 125 | V317: 0.11900000000000001 | W317: 1.6e-002 | X317: 2.7999999999999997e-002 | Y317: 338 | Z317: 12.66 | AA317: -0.10099999999999999 | AB317: -0.105 | AC317: -0.10400000000000001 | AD317: -0.105 | AE317: 90.38 | AF317: 93.39 | AG317: 0.94 | AH317: AA | AI317: 4.2000000000000003e-002 | AJ317: =H317+100*O317 -> 211.89999999999998 | AK317: 222 | AL317: 326 | AM317: 128.6 | AN317: 328 | AO317: -3.3000000000000002e-002 | AP317: 8 | AQ317: 彤程转债!
A318: 358 | B318: 110038 | C318: 济川转债! | D318: 600566 | E318: 济川药业 | F318: 医药 | G318: 中药 | H318: 118.64 | I318: -8.0000000000000004e-004 | J318: 8.9999999999999998e-004 | K318: 18.53 | L318: 2.7000000000000001e-003 | M318: 106 | N318: 23.4 | O318: 0.498 | P318: 79.19 | Q318: 已到 | R318: 0.98年 | S318: 回售内 | T318: 6.27 | U318: 158 | V318: 0.21199999999999999 | W318: 3.7999999999999999e-002 | X318: 2.9999999999999999e-002 | Y318: 165 | Z318: 1.92 | AA318: -0.10800000000000001 | AB318: -0.11900000000000001 | AC318: 回售内 | AD318: 回售内 | AE318: 101 | AF318: 102.41 | AG318: 0.05 | AH318: AA | AI318: 3.5699999999999996e-002 | AJ318: =H318+100*O318 -> 168.44 | AK318: 158.1 | AL318: 196 | AM318: 55.7 | AN318: 139 | AO318: 3.5000000000000003e-002 | AP318: 22 | AQ318: 济川转债!
A319: 370 | B319: 110034 | C319: 九州转债! | D319: 600998 | E319: 九州通 | F319: 医药 | G319: 医药商业 | H319: 109.96 | I319: 8.0000000000000004e-004 | J319: -8.0000000000000004e-004 | K319: 13.68 | L319: 8.1000000000000013e-003 | M319: 108 | N319: 17.83 | O319: 0.433 | P319: 76.72 | Q319: 已到 | R319: 56天 | S319: 回售内 | T319: 15 | U319: 30 | V319: 1.8000000000000002e-002 | W319: 5.7999999999999996e-002 | X319: 4.4999999999999998e-002 | Y319: 256 | Z319: 1.22 | AA319: -0.11 | AB319: -0.193 | AC319: 回售内 | AD319: 回售内 | AE319: 103 | AF319: 107.5 | AG319: 0 | AH319: AA+ | AI319: 3.0899999999999997e-002 | AJ319: =H319+100*O319 -> 153.25999999999999 | AK319: 143.2 | AL319: 66 | AM319: 35.7 | AN319: 19 | AO319: -1.3999999999999999e-002 | AP319: 28 | AQ319: 九州转债!
A320: 218 | B320: 128101 | C320: 联创转债!! | D320: 2036. | E320: 联创电子 | F320: 电子 | G320: 液晶显示 | H320: 192.13 | I320: 7.22e-002 | J320: 2.0799999999999999e-002 | K320: 23.52 | L320: 0.10000000000000001 | M320: 114.8 | N320: 13.72 | O320: 0.121 | P320: 171.43 | Q320: 已到 | R320: 4.32年 | S320: 2.32年 | T320: 3 | U320: 1286. | V320: 2.27 | W320: 1.2e-002 | X320: 2.1000000000000001e-002 | Y320: 250 | Z320: 6.41 | AA320: -0.114 | AB320: -0.11900000000000001 | AC320: -0.155 | AD320: -0.156 | AE320: 93.71 | AF320: 97.1 | AG320: 0.93 | AH320: AA | AI320: 4.0399999999999998e-002 | AJ320: =H320+100*O320 -> 204.22999999999999 | AK320: 212.8 | AL320: 322 | AM320: 115.7 | AN320: 318 | AO320: 0.158 | AP320: 14 | AQ320: 联创转债!!
A321: 303 | B321: 127011 | C321: 中鼎转2!! | D321: 887. | E321: 中鼎股份 | F321: 汽车 | G321: 零部件制 | H321: 175.302 | I321: 4.2800000000000005e-002 | J321: 1.06e-002 | K321: 18.04 | L321: 5.8700000000000002e-002 | M321: 114.5 | N321: 11.39 | O321: 0.107 | P321: 158.38 | Q321: 已到 | R321: 3.30年 | S321: 1.30年 | T321: 12 | U321: 132 | V321: 6.4000000000000001e-002 | W321: 5.4000000000000006e-002 | X321: 8.5999999999999993e-002 | Y321: 220 | Z321: 2.39 | AA321: -0.12300000000000001 | AB321: -0.13 | AC321: -0.27000000000000002 | AD321: -0.27200000000000002 | AE321: 97.78 | AF321: 102.35 | AG321: 0.91 | AH321: AA+ | AI321: 3.5400000000000001e-002 | AJ321: =H321+100*O321 -> 186.00199999999998 | AK321: 192.2 | AL321: 311 | AM321: 89.9 | AN321: 291 | AO321: 4.2000000000000003e-002 | AP321: 19 | AQ321: 中鼎转2!!
A322: 209 | B322: 113034 | C322: 滨化转债! | D322: 601678 | E322: 滨化股份 | F322: 化工 | G322: 化工 | H322: 202.99 | I322: 0.10400000000000001 | J322: -1.4999999999999999e-002 | K322: 8.39 | L322: 9.3900000000000011e-002 | M322: 114.8 | N322: 4.58 | O322: 0.10800000000000001 | P322: 183.19 | Q322: 已到 | R322: 4.39年 | S322: 2.39年 | T322: 4.68 | U322: 2398. | V322: 2.5600000000000001 | W322: 2.8999999999999998e-002 | X322: 5.2000000000000005e-002 | Y322: 164 | Z322: 1.69 | AA322: -0.124 | AB322: -0.129 | AC322: -0.159 | AD322: -0.16 | AE322: 93.45 | AF322: 96.84 | AG322: 0.94 | AH322: AA | AI322: 4.0399999999999998e-002 | AJ322: =H322+100*O322 -> 213.79000000000002 | AK322: 222.8 | AL322: 327 | AM322: 126 | AN322: 326 | AO322: 5.0999999999999997e-002 | AP322: 21 | AQ322: 滨化转债!
A323: 322 | B323: 128046 | C323: 利尔转债!! | D323: 2258. | E323: 利尔化学 | F323: 化工 | G323: 农化 | H323: 164.005 | I323: 2.3999999999999998e-003 | J323: -5.7999999999999996e-003 | K323: 27.32 | L323: -3.5999999999999999e-003 | M323: 111.3 | N323: 18.42 | O323: 0.106 | P323: 148.32 | Q323: 已到 | R323: 2.91年 | S323: 0.91年 | T323: 8.08 | U323: 51 | V323: 3.7999999999999999e-002 | W323: 5.5999999999999994e-002 | X323: 8.3000000000000004e-002 | Y323: 144 | Z323: 3.33 | AA323: -0.126 | AB323: -0.13200000000000001 | AC323: -0.35100000000000003 | AD323: -0.35299999999999998 | AE323: 97.7 | AF323: 99.73 | AG323: 0.91 | AH323: AA | AI323: 3.9100000000000003e-002 | AJ323: =H323+100*O323 -> 174.60499999999999 | AK323: 179.7 | AL323: 285 | AM323: 80 | AN323: 265 | AO323: 9.8000000000000004e-002 | AP323: 8 | AQ323: 利尔转债!!
A324: 97 | B324: 123084 | C324: 高澜转债!! | D324: 300499 | E324: 高澜股份 | F324: 能源电力 | G324: 电力设备 | H324: 240 | I324: 4.24e-002 | J324: 7.3000000000000001e-003 | K324: 20.56 | L324: 5.1699999999999996e-002 | M324: 121.9 | N324: 9.01 | O324: 5.2000000000000005e-002 | P324: 228.19 | Q324: 已到 | R324: 5年20天 | S324: 3年20天 | T324: 2.54 | U324: 1931. | V324: 3.29 | W324: 4.4000000000000004e-002 | X324: 0.10099999999999999 | Y324: 57 | Z324: 6.7 | AA324: -0.128 | AB324: -0.13400000000000001 | AC324: -0.13200000000000001 | AD324: -0.13300000000000001 | AE324: 83.57 | AF324: 85.82 | AG324: 0.96 | AH324: A+ | AI324: 7.400000000000001e-002 | AJ324: =H324+100*O324 -> 245.19999999999999 | AK324: 251.8 | AL324: 335 | AM324: 166 | AN324: 338 | AO324: 0.111 | AP324: 14 | AQ324: 高澜转债!!
A325: 84 | B325: 123092 | C325: 天壕转债! | D325: 300332 | E325: 天壕环境 | F325: 石油天然 | G325: 天然气 | H325: 248.2 | I325: 6.0400000000000002e-002 | J325: -3.4999999999999996e-003 | K325: 12.4 | L325: 5.8899999999999994e-002 | M325: 121.6 | N325: 5.19 | O325: 3.9e-002 | P325: 238.92 | Q325: 已到 | R325: 5年34天 | S325: 3年34天 | T325: 4.23 | U325: 3087. | V325: 3.02 | W325: 3.9e-002 | X325: 9.3000000000000013e-002 | Y325: 109 | Z325: 3.21 | AA325: -0.13300000000000001 | AB325: -0.13900000000000001 | AC325: -0.13400000000000001 | AD325: -0.13500000000000001 | AE325: 83.16 | AF325: 85.36 | AG325: 0.97 | AH325: A+ | AI325: 7.400000000000001e-002 | AJ325: =H325+100*O325 -> 252.09999999999999 | AK325: 257.5 | AL325: 338 | AM325: 172.1 | AN325: 341 | AO325: 0.22899999999999998 | AP325: 9 | AQ325: 天壕转债!
A326: 225 | B326: 113568 | C326: 新春转债!! | D326: 603667 | E326: 五洲新春 | F326: 机械装备 | G326: 通用设备 | H326: 228.24 | I326: 6.2e-002 | J326: 3.32e-002 | K326: 17.88 | L326: 0.10000000000000001 | M326: 124.3 | N326: 8.75 | O326: 0.11699999999999999 | P326: 204.34 | Q326: 已到 | R326: 4.29年 | S326: 2.29年 | T326: 2.44 | U326: 1315. | V326: 2.3900000000000001 | W326: 4.4999999999999998e-002 | X326: 9.1999999999999998e-002 | Y326: 54 | Z326: 2.86 | AA326: -0.13500000000000001 | AB326: -0.14199999999999999 | AC326: -0.187 | AD326: -0.188 | AE326: 90.2 | AF326: 96.9 | AG326: 0.95 | AH326: AA- | AI326: 6.1399999999999996e-002 | AJ326: =H326+100*O326 -> 239.94 | AK326: 252.1 | AL326: 336 | AM326: 155.2 | AN326: 335 | AO326: 0.122 | AP326: 40 | AQ326: 新春转债!!
A327: 326 | B327: 123014 | C327: 凯发转债! | D327: 300407 | E327: 凯发电气 | F327: 能源电力 | G327: 电力设备 | H327: 137.3 | I327: 1.7000000000000001e-002 | J327: -2.0999999999999999e-003 | K327: 8.39 | L327: 2.4399999999999998e-002 | M327: 107.5 | N327: 8.05 | O327: 0.317 | P327: 104.22 | Q327: 已到 | R327: 1.68年 | S327: 回售内 | T327: 1.16 | U327: 40 | V327: 0.251 | W327: 4.4999999999999998e-002 | X327: 4.7e-002 | Y327: 26 | Z327: 1.85 | AA327: -0.13600000000000001 | AB327: -0.14300000000000002 | AC327: 回售内 | AD327: 回售内 | AE327: 100.25 | AF327: 95.86 | AG327: 0.61 | AH327: A+ | AI327: 7.1099999999999997e-002 | AJ327: =H327+100*O327 -> 169. | AK327: 170.4 | AL327: 261 | AM327: 70.1 | AN327: 225 | AO327: 7.4999999999999997e-002 | AP327: 15 | AQ327: 凯发转债!
A328: 301 | B328: 110055 | C328: 伊力转债!! | D328: 600197 | E328: 伊力特 | F328: 食品饮料 | G328: 白酒 | H328: 187.13 | I328: -9.3999999999999986e-003 | J328: 1.0500000000000001e-002 | K328: 25.37 | L328: 1.1999999999999999e-003 | M328: 114.3 | N328: 16.41 | O328: 0.20999999999999999 | P328: 154.6 | Q328: 已到 | R328: 3.32年 | S328: 1.32年 | T328: 2.44 | U328: 369 | V328: 0.79500000000000004 | W328: 2.e-002 | X328: 3.1e-002 | Y328: 120 | Z328: 3.32 | AA328: -0.14000000000000001 | AB328: -0.14699999999999999 | AC328: -0.28999999999999998 | AD328: -0.29100000000000004 | AE328: 96.99 | AF328: 100.52 | AG328: 0.91 | AH328: AA | AI328: 4.0399999999999998e-002 | AJ328: =H328+100*O328 -> 208.13 | AK328: 219.7 | AL328: 325 | AM328: 119.1 | AN328: 321 | AO328: 2.3e-002 | AP328: 21 | AQ328: 伊力转债!!
A329: 309 | B329: 110051 | C329: 中天转债!! | D329: 600522 | E329: 中天科技 | F329: 通信互联 | G329: 通信设备 | H329: 185.03 | I329: -5.6000000000000008e-003 | J329: 3.0000000000000001e-003 | K329: 18.5 | L329: -2.7000000000000001e-003 | M329: 113.3 | N329: 9.99 | O329: -1.e-003 | P329: 185.19 | Q329: 已到 | R329: 3.27年 | S329: 1.27年 | T329: 34.3 | U329: 1463. | V329: 0.23100000000000001 | W329: 5.9999999999999998e-002 | X329: 0.11199999999999999 | Y329: 567 | Z329: 2.46 | AA329: -0.14099999999999999 | AB329: -0.14699999999999999 | AC329: -0.29499999999999998 | AD329: -0.29699999999999999 | AE329: 97.82 | AF329: 101.34 | AG329: 0.96 | AH329: AA+ | AI329: 3.5400000000000001e-002 | AJ329: =H329+100*O329 -> 184.93000000000001 | AK329: 184.9 | AL329: 300 | AM329: 83.5 | AN329: 279 | AO329: 0.33100000000000002 | AP329: 26 | AQ329: 中天转债!!
A330: 96 | B330: 123086 | C330: 海兰转债!! | D330: 300065 | E330: 海兰信 | F330: 电子 | G330: 电子产品 | H330: 266.89 | I330: 0.121 | J330: -4.5999999999999999e-003 | K330: 19.47 | L330: 0.12 | M330: 123.5 | N330: 7.27 | O330: -3.0000000000000001e-003 | P330: 267.81 | Q330: 已到 | R330: 5年21天 | S330: 3年21天 | T330: 5.12 | U330: 11653. | V330: 8.4700000000000006 | W330: 4.2000000000000003e-002 | X330: 0.113 | Y330: 121 | Z330: 7.29 | AA330: -0.14300000000000002 | AB330: -0.14999999999999999 | AC330: -0.14400000000000002 | AD330: -0.14499999999999999 | AE330: 85.47 | AF330: 91.28 | AG330: 0.98 | AH330: AA- | AI330: 6.3e-002 | AJ330: =H330+100*O330 -> 266.58999999999997 | AK330: 266 | AL330: 341 | AM330: 174.7 | AN330: 343 | AO330: 0.55399999999999994 | AP330: 19 | AQ330: 海兰转债!!
A331: 100 | B331: 123083 | C331: 朗新转债! | D331: 300682 | E331: 朗新科技 | F331: 计算机及 | G331: 软件开发 | H331: 257.301 | I331: 5.45e-002 | J331: 2.18e-002 | K331: 38.49 | L331: 7.8200000000000006e-002 | M331: 115.1 | N331: 15.4 | O331: 2.8999999999999998e-002 | P331: 249.94 | Q331: 已到 | R331: 5年19天 | S331: 3年19天 | T331: 6.27 | U331: 984 | V331: 0.61299999999999999 | W331: 1.6e-002 | X331: 3.9e-002 | Y331: 400 | Z331: 7.32 | AA331: -0.14899999999999999 | AB331: -0.153 | AC331: -0.14099999999999999 | AD331: -0.14099999999999999 | AE331: 90.87 | AF331: 93.9 | AG331: 0.98 | AH331: AA | AI331: 4.2000000000000003e-002 | AJ331: =H331+100*O331 -> 260.20099999999996 | AK331: 264.7 | AL331: 340 | AM331: 170.8 | AN331: 340 | AO331: 0.17499999999999999 | AP331: 7 | AQ331: 朗新转债!
A332: 257 | B332: 123034 | C332: 通光转债! | D332: 300265 | E332: 通光线缆 | F332: 通信互联 | G332: 通信设备 | H332: 223 | I332: -1.e-004 | J332: 2.3999999999999998e-003 | K332: 11.37 | L332: 2.5999999999999999e-003 | M332: 117.3 | N332: 7.95 | O332: 0.55899999999999994 | P332: 143.02 | Q332: 已到 | R332: 3.96年 | S332: 1.96年 | T332: 0.78 | U332: 725 | V332: 4.04 | W332: 1.9e-002 | X332: 2.7000000000000003e-002 | Y332: 41 | Z332: 3.19 | AA332: -0.152 | AB332: -0.158 | AC332: -0.22399999999999998 | AD332: -0.22500000000000001 | AE332: 88.71 | AF332: 89.41 | AG332: 0.86 | AH332: A+ | AI332: 7.2400000000000006e-002 | AJ332: =H332+100*O332 -> 278.89999999999998 | AK332: 303 | AL332: 351 | AM332: 213.6 | AN332: 351 | AO332: 7.6999999999999999e-002 | AP332: 18 | AQ332: 通光转债!
A333: 128 | B333: 123070 | C333: 鹏辉转债! | D333: 300438 | E333: 鹏辉能源 | F333: 汽车 | G333: 零部件制 | H333: 262.38 | I333: -3.39e-002 | J333: -1.6799999999999999e-002 | K333: 53.11 | L333: -5.16e-002 | M333: 114.8 | N333: 20.08 | O333: -8.0000000000000002e-003 | P333: 264.49 | Q333: 已到 | R333: 4.92年 | S333: 2.92年 | T333: 6.14 | U333: 1854. | V333: 1.1399999999999999 | W333: 2.7000000000000003e-002 | X333: 7.2000000000000008e-002 | Y333: 226 | Z333: 8.81 | AA333: -0.157 | AB333: -0.161 | AC333: -0.152 | AD333: -0.153 | AE333: 91.51 | AF333: 94.83 | AG333: 0.98 | AH333: AA | AI333: 4.0399999999999998e-002 | AJ333: =H333+100*O333 -> 261.57999999999998 | AK333: 260.3 | AL333: 339 | AM333: 165.4 | AN333: 337 | AO333: 0.39799999999999996 | AP333: 8 | AQ333: 鹏辉转债!
A334: 313 | B334: 123018 | C334: 溢利转债! | D334: 300381 | E334: 溢多利 | F334: 医药 | G334: 原料药 | H334: 193.3 | I334: 6.8000000000000005e-003 | J334: 1.6000000000000001e-003 | K334: 11 | L334: 1.01e-002 | M334: 114.3 | N334: 8.25 | O334: 0.45000000000000001 | P334: 133.33 | Q334: 已到 | R334: 3年30天 | S334: 1年30天 | T334: 0.54 | U334: 39 | V334: 0.377 | W334: 1.e-002 | X334: 1.3000000000000001e-002 | Y334: 54 | Z334: 1.81 | AA334: -0.159 | AB334: -0.16600000000000001 | AC334: -0.36700000000000005 | AD334: -0.36899999999999999 | AE334: 95.51 | AF334: 95.53 | AG334: 0.83 | AH334: AA- | AI334: 6.1399999999999996e-002 | AJ334: =H334+100*O334 -> 238.30000000000001 | AK334: 253.3 | AL334: 337 | AM334: 157.7 | AN334: 336 | AO334: 6.7000000000000004e-002 | AP334: 10 | AQ334: 溢利转债!
A335: 228 | B335: 110066 | C335: 盛屯转债!! | D335: 600711 | E335: 盛屯矿业 | F335: 有色金属 | G335: 有色行业 | H335: 244.5 | I335: -1.5e-003 | J335: 1.8799999999999997e-002 | K335: 10.23 | L335: 1.7899999999999999e-002 | M335: 114.9 | N335: 4.87 | O335: 0.16399999999999998 | P335: 210.06 | Q335: 已到 | R335: 4.28年 | S335: 2.28年 | T335: 3.83 | U335: 432 | V335: 0.45399999999999996 | W335: 1.3999999999999999e-002 | X335: 2.8999999999999998e-002 | Y335: 281 | Z335: 2.27 | AA335: -0.16399999999999998 | AB335: -0.16899999999999998 | AC335: -0.20000000000000001 | AD335: -0.20000000000000001 | AE335: 93.95 | AF335: 97.34 | AG335: 0.97 | AH335: AA | AI335: 4.0399999999999998e-002 | AJ335: =H335+100*O335 -> 260.89999999999998 | AK335: 278.9 | AL335: 346 | AM335: 181.6 | AN335: 346 | AO335: 2.6000000000000002e-002 | AP335: 29 | AQ335: 盛屯转债!!
A336: 148 | B336: 110074 | C336: 精达转债!! | D336: 600577 | E336: 精达股份 | F336: 电子 | G336: 电子产品 | H336: 271.04 | I336: 6.1900000000000004e-002 | J336: -3.8900000000000004e-002 | K336: 9.11 | L336: 2.3599999999999999e-002 | M336: 116.9 | N336: 3.73 | O336: 0.11 | P336: 244.24 | Q336: 已到 | R336: 4.75年 | S336: 2.75年 | T336: 5.1 | U336: 334 | V336: 0.24299999999999999 | W336: 2.7999999999999997e-002 | X336: 6.9000000000000006e-002 | Y336: 181 | Z336: 4.21 | AA336: -0.16500000000000001 | AB336: -0.16899999999999998 | AC336: -0.16899999999999998 | AD336: -0.16899999999999998 | AE336: 92.23 | AF336: 97.22 | AG336: 0.98 | AH336: AA | AI336: 4.0399999999999998e-002 | AJ336: =H336+100*O336 -> 282.04000000000002 | AK336: 297.8 | AL336: 350 | AM336: 200.6 | AN336: 350 | AO336: 9.0999999999999998e-002 | AP336: 11 | AQ336: 精达转债!!
A337: 136 | B337: 123067 | C337: 斯莱转债! | D337: 300382 | E337: 斯莱克 | F337: 机械装备 | G337: 专用设备 | H337: 299.299 | I337: 1.3500000000000002e-002 | J337: -7.3000000000000001e-003 | K337: 27.1 | L337: 6.3e-003 | M337: 120.8 | N337: 9.36 | O337: 3.4000000000000002e-002 | P337: 289.53 | Q337: 已到 | R337: 4.82年 | S337: 2.82年 | T337: 2.4 | U337: 195 | V337: 0.27300000000000002 | W337: 1.4999999999999999e-002 | X337: 4.4999999999999998e-002 | Y337: 156 | Z337: 13.62 | AA337: -0.17399999999999999 | AB337: -0.17999999999999999 | AC337: -0.17199999999999999 | AD337: -0.17300000000000001 | AE337: 86.94 | AF337: 91.18 | AG337: 0.98 | AH337: AA- | AI337: 6.1399999999999996e-002 | AJ337: =H337+100*O337 -> 302.69899999999996 | AK337: 309.1 | AL337: 352 | AM337: 217.9 | AN337: 352 | AO337: -5.5999999999999994e-002 | AP337: 11 | AQ337: 斯莱转债!
A338: 317 | B338: 110048 | C338: 福能转债!! | D338: 600483 | E338: 福能股份 | F338: 能源电力 | G338: 电力供应 | H338: 207.63 | I338: 3.7599999999999995e-002 | J338: -7.0999999999999995e-003 | K338: 14.73 | L338: 3.15e-002 | M338: 113.3 | N338: 7.85 | O338: 0.107 | P338: 187.64 | Q338: 已到 | R338: 3年17天 | S338: 1年17天 | T338: 12.8 | U338: 209 | V338: 8.0000000000000002e-002 | W338: 4.4999999999999998e-002 | X338: 8.5000000000000006e-002 | Y338: 282 | Z338: 3.63 | AA338: -0.183 | AB338: -0.18899999999999997 | AC338: -0.40899999999999997 | AD338: -0.41100000000000003 | AE338: 98.6 | AF338: 102.16 | AG338: 0.97 | AH338: AA+ | AI338: 3.5400000000000001e-002 | AJ338: =H338+100*O338 -> 218.32999999999998 | AK338: 227.6 | AL338: 331 | AM338: 125.5 | AN338: 325 | AO338: -7.5999999999999998e-002 | AP338: 10 | AQ338: 福能转债!!
A339: 329 | B339: 123012 | C339: 万顺转债! | D339: 300057 | E339: 万顺新材 | F339: 有色金属 | G339: 铝金属 | H339: 187.999 | I339: -2.2099999999999998e-002 | J339: -2.8399999999999998e-002 | K339: 9.2 | L339: -5.2499999999999998e-002 | M339: 109.3 | N339: 5.27 | O339: 7.6999999999999999e-002 | P339: 174.57 | Q339: 已到 | R339: 2.66年 | S339: 0.66年 | T339: 1.23 | U339: 365 | V339: 1.5900000000000001 | W339: 2.e-002 | X339: 3.4000000000000002e-002 | Y339: 63 | Z339: 1.74 | AA339: -0.187 | AB339: -0.191 | AC339: -0.56299999999999994 | AD339: -0.56499999999999995 | AE339: 97 | AF339: 93.82 | AG339: 0.96 | AH339: AA- | AI339: 6.0100000000000001e-002 | AJ339: =H339+100*O339 -> 195.69899999999998 | AK339: 201.4 | AL339: 315 | AM339: 104.4 | AN339: 313 | AO339: 0.122 | AP339: 23 | AQ339: 万顺转债!
A340: 238 | B340: 128093 | C340: 百川转债!! | D340: 2455. | E340: 百川股份 | F340: 化工 | G340: 化工 | H340: 300.5 | I340: 5.1000000000000004e-003 | J340: 2.2000000000000001e-003 | K340: 16.13 | L340: 7.4999999999999997e-003 | M340: 129.8 | N340: 5.77 | O340: 7.4999999999999997e-002 | P340: 279.55 | Q340: 已到 | R340: 4年44天 | S340: 2年44天 | T340: 1.62 | U340: 313 | V340: 0.64500000000000002 | W340: 1.8000000000000002e-002 | X340: 4.9000000000000002e-002 | Y340: 91 | Z340: 5.16 | AA340: -0.18899999999999997 | AB340: -0.19800000000000001 | AC340: -0.245 | AD340: -0.24600000000000002 | AE340: 93.54 | AF340: 102.55 | AG340: 0.96 | AH340: AA- | AI340: 6.1399999999999996e-002 | AJ340: =H340+100*O340 -> 308. | AK340: 321.5 | AL340: 353 | AM340: 218.9 | AN340: 353 | AO340: -3.3000000000000002e-002 | AP340: 41 | AQ340: 百川转债!!
A341: 280 | B341: 113537 | C341: 文灿转债!! | D341: 603348 | E341: 文灿股份 | F341: 汽车 | G341: 零部件制 | H341: 254.42 | I341: 2.8500000000000001e-002 | J341: 2.2599999999999999e-002 | K341: 45.89 | L341: 5.2499999999999998e-002 | M341: 120.7 | N341: 19.28 | O341: 6.9000000000000006e-002 | P341: 238.02 | Q341: 已到 | R341: 3.55年 | S341: 1.55年 | T341: 1.41 | U341: 676 | V341: 1.8899999999999999 | W341: 1.2e-002 | X341: 2.7999999999999997e-002 | Y341: 120 | Z341: 4.59 | AA341: -0.193 | AB341: -0.20000000000000001 | AC341: -0.32000000000000001 | AD341: -0.32100000000000001 | AE341: 93.62 | AF341: 98.18 | AG341: 0.97 | AH341: AA- | AI341: 6.1399999999999996e-002 | AJ341: =H341+100*O341 -> 261.31999999999999 | AK341: 270.8 | AL341: 344 | AM341: 172.6 | AN341: 342 | AO341: 0.17000000000000001 | AP341: 23 | AQ341: 文灿转债!!
A342: 300 | B342: 123022 | C342: 长信转债!! | D342: 300088 | E342: 长信科技 | F342: 通信互联 | G342: 通信设备 | H342: 236.784 | I342: -2.6000000000000002e-002 | J342: 7.6e-003 | K342: 12.45 | L342: -1.89e-002 | M342: 114.3 | N342: 6.05 | O342: 0.151 | P342: 205.79 | Q342: 已到 | R342: 3.32年 | S342: 1.32年 | T342: 2.57 | U342: 892 | V342: 1.45 | W342: 8.0000000000000002e-003 | X342: 1.7000000000000001e-002 | Y342: 306 | Z342: 4.05 | AA342: -0.20000000000000001 | AB342: -0.20499999999999999 | AC342: -0.36099999999999999 | AD342: -0.36299999999999999 | AE342: 96.96 | AF342: 100.49 | AG342: 0.97 | AH342: AA | AI342: 4.0399999999999998e-002 | AJ342: =H342+100*O342 -> 251.88399999999999 | AK342: 267.8 | AL342: 343 | AM342: 167.3 | AN342: 339 | AO342: 0.115 | AP342: 11 | AQ342: 长信转债!!
A343: 307 | B343: 113528 | C343: 长城转债!! | D343: 603897 | E343: 长城科技 | F343: 机械装备 | G343: 专用设备 | H343: 240.87 | I343: -4.4000000000000003e-003 | J343: -8.1000000000000013e-003 | K343: 53.6 | L343: -1.2699999999999999e-002 | M343: 116.8 | N343: 22.35 | O343: 4.0000000000000001e-003 | P343: 239.82 | Q343: 已到 | R343: 3.28年 | S343: 1.28年 | T343: 4.49 | U343: 390 | V343: 0.36299999999999999 | W343: 4.4999999999999998e-002 | X343: 0.10800000000000001 | Y343: 100 | Z343: 4.68 | AA343: -0.20100000000000001 | AB343: -0.20800000000000002 | AC343: -0.379 | AD343: -0.38100000000000001 | AE343: 94.73 | AF343: 96.54 | AG343: 0.98 | AH343: AA- | AI343: 6.1399999999999996e-002 | AJ343: =H343+100*O343 -> 241.27000000000001 | AK343: 241.9 | AL343: 332 | AM343: 145.4 | AN343: 334 | AO343: 8.8000000000000009e-002 | AP343: 33 | AQ343: 长城转债!!
A344: 335 | B344: 110044 | C344: 广电转债!! | D344: 600831 | E344: 广电网络 | F344: 传媒娱乐 | G344: 影视娱乐 | H344: 212.1 | I344: 7.0999999999999995e-003 | J344: -5.6000000000000008e-003 | K344: 5.41 | L344: 7.4000000000000003e-003 | M344: 111.3 | N344: 6.87 | O344: 1.6899999999999999 | P344: 78.75 | Q344: 已到 | R344: 2.60年 | S344: 0.60年 | T344: 0.71 | U344: 78 | V344: 0.51800000000000002 | W344: 1.8000000000000002e-002 | X344: 1.4999999999999999e-002 | Y344: 38 | Z344: 1.02 | AA344: -0.222 | AB344: -0.22800000000000001 | AC344: -0.69499999999999995 | AD344: -0.69700000000000006 | AE344: 98.86 | AF344: 100.91 | AG344: 0.2 | AH344: AA | AI344: 3.9100000000000003e-002 | AJ344: =H344+100*O344 -> 381.10000000000002 | AK344: 345.5 | AL344: 354 | AM344: 244.5 | AN344: 354 | AO344: 2.9999999999999999e-002 | AP344: 9 | AQ344: 广电转债!!
A345: 188 | B345: 128111 | C345: 中矿转债! | D345: 2738. | E345: 中矿资源 | F345: 有色金属 | G345: 有色行业 | H345: 408.36 | I345: -1.8600000000000002e-002 | J345: -1.2800000000000001e-002 | K345: 58.89 | L345: -3.1899999999999998e-002 | M345: 124.2 | N345: 15.42 | O345: 6.9000000000000006e-002 | P345: 381.91 | Q345: 已到 | R345: 4.56年 | S345: 2.56年 | T345: 1.46 | U345: 523 | V345: 0.87 | W345: 8.0000000000000002e-003 | X345: 2.8999999999999998e-002 | Y345: 190 | Z345: 5.12 | AA345: -0.23300000000000001 | AB345: -0.23899999999999999 | AC345: -0.22500000000000001 | AD345: -0.22500000000000001 | AE345: 88.68 | AF345: 95.28 | AG345: 0.98 | AH345: AA- | AI345: 6.1399999999999996e-002 | AJ345: =H345+100*O345 -> 415.25999999999999 | AK345: 434.8 | AL345: 364 | AM345: 339.5 | AN345: 364 | AO345: 1.8000000000000002e-002 | AP345: 10 | AQ345: 中矿转债!
A346: 312 | B346: 113526 | C346: 联泰转债! | D346: 603797 | E346: 联泰环保 | F346: 城市公用 | G346: 三废处理 | H346: 253.24 | I346: 2.0999999999999999e-003 | J346: 5.1000000000000004e-003 | K346: 6.86 | L346: 1.03e-002 | M346: 110.3 | N346: 5.92 | O346: 1.1899999999999999 | P346: 115.88 | Q346: 已到 | R346: 3.18年 | S346: 1.18年 | T346: 1.93 | U346: 21 | V346: 4.4000000000000004e-002 | W346: 4.8000000000000001e-002 | X346: 5.5999999999999994e-002 | Y346: 40 | Z346: 1.58 | AA346: -0.23399999999999999 | AB346: -0.23800000000000002 | AC346: -0.42799999999999999 | AD346: -0.42999999999999999 | AE346: 98.16 | AF346: 99.01 | AG346: 0.7 | AH346: AA+ | AI346: 3.5400000000000001e-002 | AJ346: =H346+100*O346 -> 372.24000000000001 | AK346: 390.6 | AL346: 357 | AM346: 291.6 | AN346: 358 | AO346: 1.3000000000000001e-002 | AP346: 8 | AQ346: 联泰转债!
A347: 197 | B347: 113582 | C347: 火炬转债! | D347: 603678 | E347: 火炬电子 | F347: 电子 | G347: 元器件制 | H347: 379.72 | I347: 6.6e-003 | J347: -2.35e-002 | K347: 77 | L347: -1.7100000000000001e-002 | M347: 114.9 | N347: 24.99 | O347: 0.23199999999999998 | P347: 308.12 | Q347: 已到 | R347: 4.52年 | S347: 2.52年 | T347: 4.18 | U347: 72 | V347: 4.4999999999999998e-002 | W347: 1.2e-002 | X347: 3.6000000000000004e-002 | Y347: 354 | Z347: 7.98 | AA347: -0.23600000000000002 | AB347: -0.23899999999999999 | AC347: -0.22399999999999998 | AD347: -0.22399999999999998 | AE347: 93.07 | AF347: 96.44 | AG347: 0.98 | AH347: AA | AI347: 4.0399999999999998e-002 | AJ347: =H347+100*O347 -> 402.92000000000002 | AK347: 451.3 | AL347: 366 | AM347: 354.9 | AN347: 366 | AO347: 5.0000000000000001e-003 | AP347: 5 | AQ347: 火炬转债!
A348: 288 | B348: 113534 | C348: 鼎胜转债!! | D348: 603876 | E348: 鼎胜新材 | F348: 有色金属 | G348: 小金属 | H348: 280.98 | I348: 7.0099999999999996e-002 | J348: -1.7000000000000001e-003 | K348: 41.26 | L348: 6.9500000000000006e-002 | M348: 114.3 | N348: 15.18 | O348: 3.4000000000000002e-002 | P348: 271.81 | Q348: 已到 | R348: 3.38年 | S348: 1.38年 | T348: 4.05 | U348: 1300. | V348: 1.1599999999999999 | W348: 2.e-002 | X348: 5.5e-002 | Y348: 200 | Z348: 4.28 | AA348: -0.23699999999999999 | AB348: -0.24199999999999999 | AC348: -0.38700000000000001 | AD348: -0.38799999999999996 | AE348: 93.81 | AF348: 93.83 | AG348: 0.98 | AH348: AA- | AI348: 6.1399999999999996e-002 | AJ348: =H348+100*O348 -> 284.38 | AK348: 290.2 | AL348: 349 | AM348: 196.3 | AN348: 349 | AO348: 3.7000000000000005e-002 | AP348: 29 | AQ348: 鼎胜转债!!
A349: 217 | B349: 123046 | C349: 天铁转债! | D349: 300587 | E349: 天铁股份 | F349: 铁路 | G349: 铁路设备 | H349: 374 | I349: 8.2500000000000004e-002 | J349: -4.0599999999999997e-002 | K349: 20.09 | L349: 4.2599999999999999e-002 | M349: 117.7 | N349: 5.9 | O349: 9.8000000000000004e-002 | P349: 340.51 | Q349: 已到 | R349: 4.33年 | S349: 2.33年 | T349: 0.62 | U349: 641 | V349: 2.77 | W349: 5.0000000000000001e-003 | X349: 1.8000000000000002e-002 | Y349: 116 | Z349: 6.83 | AA349: -0.23800000000000002 | AB349: -0.24299999999999999 | AC349: -0.245 | AD349: -0.24600000000000002 | AE349: 89.46 | AF349: 91.51 | AG349: 0.98 | AH349: AA- | AI349: 6.1399999999999996e-002 | AJ349: =H349+100*O349 -> 383.80000000000001 | AK349: 407.5 | AL349: 361 | AM349: 316 | AN349: 361 | AO349: 2.7999999999999997e-002 | AP349: 13 | AQ349: 天铁转债!
A350: 324 | B350: 123015 | C350: 蓝盾转债!! | D350: 300297 | E350: 蓝盾股份 | F350: 计算机及 | G350: 软件开发 | H350: 235.5 | I350: -6.3e-003 | J350: 6.3e-003 | K350: 3.6 | L350: -1.1000000000000001e-002 | M350: 111.3 | N350: 5.79 | O350: 2.79 | P350: 62.18 | Q350: 已到 | R350: 2.73年 | S350: 0.73年 | T350: 1 | U350: 215 | V350: 0.90500000000000003 | W350: 2.2000000000000002e-002 | X350: 1.3999999999999999e-002 | Y350: 45 | Z350: 2.53 | AA350: -0.24299999999999999 | AB350: -0.248 | AC350: -0.6409999999999999 | AD350: -0.64300000000000002 | AE350: 91.92 | AF350: 81.91 | AG350: 0 | AH350: BBB- | AI350: 0.1211 | AJ350: =H350+100*O350 -> 514.5 | AK350: 408.8 | AL350: 362 | AM350: 316.9 | AN350: 362 | AO350: 2.5000000000000001e-002 | AP350: 14 | AQ350: 蓝盾转债!!
A351: 314 | B351: 113525 | C351: 台华转债!! | D351: 603055 | E351: 台华新材 | F351: 服装纺织 | G351: 纺织行业 | H351: 268.1 | I351: -1.8799999999999997e-002 | J351: -2.4500000000000001e-002 | K351: 19.72 | L351: -4.41e-002 | M351: 114.3 | N351: 7.78 | O351: 5.7999999999999996e-002 | P351: 253.47 | Q351: 已到 | R351: 3年27天 | S351: 1年27天 | T351: 1.83 | U351: 530 | V351: 1.0800000000000001 | W351: 1.1000000000000001e-002 | X351: 2.7000000000000003e-002 | Y351: 171 | Z351: 4.79 | AA351: -0.24600000000000002 | AB351: -0.251 | AC351: -0.48599999999999999 | AD351: -0.48799999999999999 | AE351: 97.92 | AF351: 101.48 | AG351: 0.98 | AH351: AA | AI351: 4.0399999999999998e-002 | AJ351: =H351+100*O351 -> 273.90000000000003 | AK351: 282.7 | AL351: 347 | AM351: 181.2 | AN351: 345 | AO351: 0.113 | AP351: 18 | AQ351: 台华转债!!
A352: 349 | B352: 128030 | C352: 天康转债!! | D352: 2100. | E352: 天康生物 | F352: 农业 | G352: 畜牧业 | H352: 201.555 | I352: 2.9999999999999997e-004 | J352: -6.7000000000000002e-003 | K352: 9.27 | L352: -6.4000000000000003e-003 | M352: 111.3 | N352: 7.39 | O352: 0.60699999999999998 | P352: 125.44 | Q352: 已到 | R352: 2年32天 | S352: 32天 | T352: 0.88 | U352: 8.9 | V352: 5.0000000000000003e-002 | W352: 9.0000000000000011e-003 | X352: 1.1000000000000001e-002 | Y352: 100 | Z352: 1.77 | AA352: -0.251 | AB352: -0.25800000000000001 | AC352: <-100% | AD352: <-100% | AE352: 100.82 | AF352: 102.91 | AG352: 1 | AH352: AA | AI352: 3.9100000000000003e-002 | AJ352: =H352+100*O352 -> 262.255 | AK352: 277.7 | AL352: 345 | AM352: 174.8 | AN352: 344 | AO352: -5.0000000000000001e-003 | AP352: 9 | AQ352: 天康转债!!
A353: 343 | B353: 113504 | C353: 艾华转债!! | D353: 603989 | E353: 艾华集团 | F353: 电子 | G353: 元器件制 | H353: 210.09 | I353: 2.07e-002 | J353: 6.8000000000000005e-003 | K353: 44.08 | L353: 2.7999999999999997e-002 | M353: 109.3 | N353: 20.81 | O353: -8.0000000000000002e-003 | P353: 211.82 | Q353: 已到 | R353: 2.28年 | S353: 0.28年 | T353: 4.7 | U353: 338 | V353: 0.34299999999999997 | W353: 2.7000000000000003e-002 | X353: 5.5999999999999994e-002 | Y353: 176 | Z353: 6.2 | AA353: -0.253 | AB353: -0.25800000000000001 | AC353: <-100% | AD353: <-100% | AE353: 100.08 | AF353: 100.32 | AG353: 0.98 | AH353: AA | AI353: 3.9100000000000003e-002 | AJ353: =H353+100*O353 -> 209.28999999999999 | AK353: 208.4 | AL353: 319 | AM353: 108 | AN353: 314 | AO353: 0.11800000000000001 | AP353: 10 | AQ353: 艾华转债!!
A354: 364 | B354: 127004 | C354: 模塑转债!! | D354: 700. | E354: 模塑科技 | F354: 汽车 | G354: 零部件制 | H354: 176.75 | I354: 1.4000000000000002e-003 | J354: -1.4000000000000002e-003 | K354: 5.09 | L354: 7.9000000000000008e-003 | M354: 111.8 | N354: 7.24 | O354: 1.51 | P354: 70.3 | Q354: 已到 | R354: 1.53年 | S354: 回售内 | T354: 1.31 | U354: 178 | V354: 0.76800000000000002 | W354: 2.7999999999999997e-002 | X354: 2.e-002 | Y354: 47 | Z354: 2.05 | AA354: -0.26000000000000001 | AB354: -0.27000000000000002 | AC354: 回售内 | AD354: 回售内 | AE354: 100.3 | AF354: 99.9 | AG354: 0 | AH354: AA- | AI354: 6.0100000000000001e-002 | AJ354: =H354+100*O354 -> 327.75 | AK354: 283.2 | AL354: 348 | AM354: 182.9 | AN354: 347 | AO354: 4.4999999999999998e-002 | AP354: 26 | AQ354: 模塑转债!!
A355: 258 | B355: 113548 | C355: 石英转债! | D355: 603688 | E355: 石英股份 | F355: 电子 | G355: 电子产品 | H355: 416.56 | I355: 2.8999999999999998e-003 | J355: -8.3000000000000001e-003 | K355: 59 | L355: -5.4000000000000003e-003 | M355: 123.7 | N355: 14.93 | O355: 5.4000000000000006e-002 | P355: 395.18 | Q355: 已到 | R355: 3.94年 | S355: 1.94年 | T355: 1.2 | U355: 510 | V355: 1.01 | W355: 6.0000000000000001e-003 | X355: 2.3e-002 | Y355: 208 | Z355: 10.15 | AA355: -0.26899999999999996 | AB355: -0.27600000000000002 | AC355: -0.317 | AD355: -0.318 | AE355: 91.5 | AF355: 98.34 | AG355: 0.99 | AH355: AA- | AI355: 6.1399999999999996e-002 | AJ355: =H355+100*O355 -> 421.95999999999998 | AK355: 437.9 | AL355: 365 | AM355: 339.6 | AN355: 365 | AO355: 2.9999999999999999e-002 | AP355: 13 | AQ355: 石英转债!
A356: 279 | B356: 123027 | C356: 蓝晓转债! | D356: 300487 | E356: 蓝晓科技 | F356: 化工 | G356: 化工 | H356: 355.701 | I356: 9.7000000000000003e-003 | J356: -2.5000000000000001e-002 | K356: 88.77 | L356: -1.5600000000000001e-002 | M356: 118.8 | N356: 29.02 | O356: 0.16300000000000001 | P356: 305.89 | Q356: 已到 | R356: 3.56年 | S356: 1.56年 | T356: 1.07 | U356: 1338. | V356: 3.4900000000000002 | W356: 5.0000000000000001e-003 | X356: 1.7000000000000001e-002 | Y356: 195 | Z356: 9.86 | AA356: -0.27000000000000002 | AB356: -0.27500000000000002 | AC356: -0.38100000000000001 | AD356: -0.38200000000000001 | AE356: 92.07 | AF356: 93.26 | AG356: 0.98 | AH356: A+ | AI356: 7.2400000000000006e-002 | AJ356: =H356+100*O356 -> 372.00100000000003 | AK356: 405.5 | AL356: 360 | AM356: 312.2 | AN356: 360 | AO356: 0.109 | AP356: 18 | AQ356: 蓝晓转债!
A357: 236 | B357: 123042 | C357: 银河转债!! | D357: 300619 | E357: 金银河 | F357: 机械装备 | G357: 专用设备 | H357: 420.33 | I357: 4.5599999999999995e-002 | J357: 1.1299999999999999e-002 | K357: 104.7 | L357: 5.7599999999999998e-002 | M357: 115.4 | N357: 24.38 | O357: -2.1000000000000001e-002 | P357: 429.45 | Q357: 已到 | R357: 4年55天 | S357: 2年55天 | T357: 1.31 | U357: 8361. | V357: 15.31 | W357: 1.7000000000000001e-002 | X357: 7.0999999999999994e-002 | Y357: 79 | Z357: 14.75 | AA357: -0.27100000000000002 | AB357: -0.27600000000000002 | AC357: -0.28199999999999997 | AD357: -0.28199999999999997 | AE357: 88.42 | AF357: 87 | AG357: 0.99 | AH357: A+ | AI357: 7.2400000000000006e-002 | AJ357: =H357+100*O357 -> 418.22999999999996 | AK357: 411.2 | AL357: 363 | AM357: 322.8 | AN357: 363 | AO357: 0.53900000000000003 | AP357: 21 | AQ357: 银河转债!!
A358: 287 | B358: 113025 | C358: 明泰转债!! | D358: 601677 | E358: 明泰铝业 | F358: 有色金属 | G358: 铝金属 | H358: 346.23 | I358: 7.3800000000000004e-002 | J358: -9.1000000000000004e-003 | K358: 34.61 | L358: 6.5599999999999992e-002 | M358: 114.5 | N358: 11 | O358: 0.10000000000000001 | P358: 314.64 | Q358: 已到 | R358: 3.39年 | S358: 1.39年 | T358: 11 | U358: 386 | V358: 0.105 | W358: 4.5999999999999999e-002 | X358: 0.14599999999999999 | Y358: 236 | Z358: 2.35 | AA358: -0.28199999999999997 | AB358: -0.28699999999999998 | AC358: -0.42799999999999999 | AD358: -0.42899999999999999 | AE358: 96.75 | AF358: 100.42 | AG358: 0.99 | AH358: AA | AI358: 4.0399999999999998e-002 | AJ358: =H358+100*O358 -> 356.23000000000002 | AK358: 377.8 | AL358: 356 | AM358: 277.4 | AN358: 356 | AO358: 7.9000000000000001e-002 | AP358: 20 | AQ358: 明泰转债!!
A359: 232 | B359: 128095 | C359: 恩捷转债!! | D359: 2812. | E359: 恩捷股份 | F359: 电子 | G359: 元器件制 | H359: 465.92 | I359: -7.7000000000000002e-003 | J359: -2.e-002 | K359: 259 | L359: -2.7999999999999997e-002 | M359: 114.9 | N359: 64.92 | O359: 0.16800000000000001 | P359: 398.95 | Q359: 已到 | R359: 4.23年 | S359: 2.23年 | T359: 4.54 | U359: 110 | V359: 5.2000000000000005e-002 | W359: 2.e-003 | X359: 8.0000000000000002e-003 | Y359: 2311. | Z359: 18.04 | AA359: -0.28499999999999998 | AB359: -0.28899999999999998 | AC359: -0.27899999999999997 | AD359: -0.27899999999999997 | AE359: 94.15 | AF359: 97.55 | AG359: 0.99 | AH359: AA | AI359: 4.0399999999999998e-002 | AJ359: =H359+100*O359 -> 482.72000000000003 | AK359: 532.9 | AL359: 368 | AM359: 435.3 | AN359: 368 | AO359: -7.4999999999999997e-002 | AP359: 13 | AQ359: 恩捷转债!!
A360: 331 | B360: 128041 | C360: 盛路转债!! | D360: 2446. | E360: 盛路通信 | F360: 通信互联 | G360: 通信设备 | H360: 299.2 | I360: 3.9199999999999999e-002 | J360: -3.9199999999999999e-002 | K360: 6.76 | L360: 7.6399999999999996e-002 | M360: 113.3 | N360: 6.82 | O360: 2.02 | P360: 99.12 | Q360: 已到 | R360: 2.66年 | S360: 0.66年 | T360: 0.53 | U360: 2548. | V360: 15.369999999999999 | W360: 9.0000000000000011e-003 | X360: 9.0000000000000011e-003 | Y360: 61 | Z360: 2.01 | AA360: -0.309 | AB360: -0.315 | AC360: -0.81799999999999995 | AD360: -0.81999999999999995 | AE360: 98.65 | AF360: 102.5 | AG360: 0 | AH360: AA | AI360: 3.9100000000000003e-002 | AJ360: =H360+100*O360 -> 501.19999999999999 | AK360: 499.3 | AL360: 367 | AM360: 396.8 | AN360: 367 | AO360: 0.23999999999999999 | AP360: 11 | AQ360: 盛路转债!!
A361: 316 | B361: 128050 | C361: 钧达转债!! | D361: 2865. | E361: 钧达股份 | F361: 汽车 | G361: 零部件制 | H361: 394.2 | I361: 3.1e-002 | J361: -1.e-003 | K361: 58.5 | L361: 2.9900000000000003e-002 | M361: 122.7 | N361: 14.8 | O361: -3.0000000000000001e-003 | P361: 395.27 | Q361: 已到 | R361: 3年20天 | S361: 1年20天 | T361: 0.72 | U361: 1691. | V361: 6.0300000000000002 | W361: 9.0000000000000011e-003 | X361: 3.6000000000000004e-002 | Y361: 80 | Z361: 7.68 | AA361: -0.32200000000000001 | AB361: -0.32899999999999996 | AC361: -0.59299999999999997 | AD361: -0.59399999999999997 | AE361: 95.89 | AF361: 102.73 | AG361: 1 | AH361: AA- | AI361: 6.1399999999999996e-002 | AJ361: =H361+100*O361 -> 393.89999999999998 | AK361: 393.1 | AL361: 358 | AM361: 290.4 | AN361: 357 | AO361: 0.37799999999999995 | AP361: 47 | AQ361: 钧达转债!!
A362: 328 | B362: 123013 | C362: 横河转债! | D362: 300539 | E362: 横河精密 | F362: 机械装备 | G362: 专用设备 | H362: 319.5 | I362: -2.9999999999999997e-004 | J362: 1.01e-002 | K362: 7.75 | L362: 2.5099999999999997e-002 | M362: 114 | N362: 9.04 | O362: 2.73 | P362: 85.73 | Q362: 已到 | R362: 2.68年 | S362: 0.68年 | T362: 0.38 | U362: 287 | V362: 2.3100000000000001 | W362: 2.2000000000000002e-002 | X362: 1.9e-002 | Y362: 17 | Z362: 3.49 | AA362: -0.32299999999999995 | AB362: -0.32899999999999996 | AC362: -0.81700000000000006 | AD362: -0.81900000000000006 | AE362: 96.42 | AF362: 95.19 | AG362: 0.39 | AH362: A+ | AI362: 7.1099999999999997e-002 | AJ362: =H362+100*O362 -> 592.5 | AK362: 553.3 | AL362: 369 | AM362: 456.9 | AN362: 369 | AO362: 9.3000000000000013e-002 | AP362: 12 | AQ362: 横河转债!
A363: 269 | B363: 123031 | C363: 晶瑞转债! | D363: 300655 | E363: 晶瑞电材 | F363: 电子 | G363: 电子行业 | H363: 494.976 | I363: -1.5e-003 | J363: -1.e-003 | K363: 42.67 | L363: -2.5999999999999999e-003 | M363: 115.3 | N363: 10.13 | O363: 0.17499999999999999 | P363: 421.22 | Q363: 已到 | R363: 3.77年 | S363: 1.77年 | T363: 0.53 | U363: 203 | V363: 0.76700000000000002 | W363: 4.0000000000000001e-003 | X363: 1.4999999999999999e-002 | Y363: 145 | Z363: 10.02 | AA363: -0.32400000000000001 | AB363: -0.32799999999999996 | AC363: -0.37 | AD363: -0.37 | AE363: 89.86 | AF363: 89.02 | AG363: 0.99 | AH363: A+ | AI363: 7.2400000000000006e-002 | AJ363: =H363+100*O363 -> 512.476 | AK363: 568.7 | AL363: 370 | AM363: 478.9 | AN363: 370 | AO363: 3.7000000000000005e-002 | AP363: 16 | AQ363: 晶瑞转债!
A364: 361 | B364: 128017 | C364: 金禾转债!! | D364: 2597. | E364: 金禾实业 | F364: 化工 | G364: 化工 | H364: 231.58 | I364: 2.0099999999999996e-002 | J364: 3.0600000000000002e-002 | K364: 48.17 | L364: 5.1100000000000007e-002 | M364: 107.5 | N364: 21.97 | O364: 5.5999999999999994e-002 | P364: 219.25 | Q364: 已到 | R364: 1.95年 | S364: 回售内 | T364: 5.52 | U364: 191 | V364: 0.14899999999999999 | W364: 2.e-002 | X364: 4.4999999999999998e-002 | Y364: 270 | Z364: 5.2 | AA364: -0.32700000000000001 | AB364: -0.33200000000000002 | AC364: 回售内 | AD364: 回售内 | AE364: 100.25 | AF364: 99.81 | AG364: 0.99 | AH364: AA | AI364: 3.9100000000000003e-002 | AJ364: =H364+100*O364 -> 237.18000000000001 | AK364: 243.9 | AL364: 333 | AM364: 143.7 | AN364: 332 | AO364: 4.4999999999999998e-002 | AP364: 9 | AQ364: 金禾转债!!
A365: 350 | B365: 128029 | C365: 太阳转债!! | D365: 2078. | E365: 太阳纸业 | F365: 造纸包装 | G365: 造纸行业 | H365: 166.37 | I365: 5.0000000000000001e-004 | J365: 6.3e-003 | K365: 11.95 | L365: 6.7000000000000002e-003 | M365: 107 | N365: 8.45 | O365: 0.17600000000000002 | P365: 141.42 | Q365: 已到 | R365: 1年32天 | S365: 回售内 | T365: 9.09 | U365: 15 | V365: 1.e-002 | W365: 2.7999999999999997e-002 | X365: 4.0000000000000001e-002 | Y365: 321 | Z365: 1.69 | AA365: -0.33500000000000002 | AB365: -0.34299999999999997 | AC365: 回售内 | AD365: 回售内 | AE365: 100.17 | AF365: 103.2 | AG365: 1 | AH365: AA+ | AI365: 3.4099999999999998e-002 | AJ365: =H365+100*O365 -> 183.97 | AK365: 191.3 | AL365: 309 | AM365: 88.1 | AN365: 287 | AO365: 1.7000000000000001e-002 | AP365: 7 | AQ365: 太阳转债!!
A366: 360 | B366: 113016 | C366: 小康转债!! | D366: 601127 | E366: 小康股份 | F366: 汽车 | G366: 零部件制 | H366: 383.87 | I366: 5.0000000000000001e-004 | J366: -3.4999999999999996e-003 | K366: 62.1 | L366: -3.0999999999999999e-003 | M366: 107.8 | N366: 16.96 | O366: 4.8000000000000001e-002 | P366: 366.16 | Q366: 已到 | R366: 1.96年 | S366: 回售内 | T366: 2.07 | U366: 472 | V366: 0.59200000000000008 | W366: 2.e-003 | X366: 9.0000000000000011e-003 | Y366: 845 | Z366: 11.75 | AA366: -0.46299999999999997 | AB366: -0.46600000000000003 | AC366: 回售内 | AD366: 回售内 | AE366: 100.3 | AF366: 96.23 | AG366: 0.99 | AH366: AA- | AI366: 6.0100000000000001e-002 | AJ366: =H366+100*O366 -> 388.67000000000002 | AK366: 401.6 | AL366: 359 | AM366: 301.3 | AN366: 359 | AO366: -6.4000000000000001e-002 | AP366: 35 | AQ366: 小康转债!!
A367: 369 | B367: 113009 | C367: 广汽转债! | D367: 601238 | E367: 广汽集团 | F367: 汽车 | G367: 乘用车 | H367: 127.87 | I367: 1.9e-002 | J367: -1.09e-002 | K367: 16.45 | L367: 8.6e-003 | M367: 106 | N367: 13.92 | O367: 8.199999999999999e-002 | P367: 118.18 | Q367: 已到 | R367: 0.17年 | S367: 回售内 | T367: 25.3 | U367: 295 | V367: 9.3000000000000013e-002 | W367: 1.4999999999999999e-002 | X367: 1.8000000000000002e-002 | Y367: 1704. | Z367: 1.95 | AA367: <-100% | AB367: <-100% | AC367: 回售内 | AD367: 回售内 | AE367: 100.27 | AF367: 105.48 | AG367: 0.95 | AH367: AAA | AI367: 2.8900000000000002e-002 | AJ367: =H367+100*O367 -> 136.06999999999999 | AK367: 137.6 | AL367: 26 | AM367: 32.1 | AN367: 10 | AO367: -5.2000000000000005e-002 | AP367: 22 | AQ367: 广汽转债!
A368: 304 | B368: 128057 | C368: 博彦转债!* | D368: 2649. | E368: 博彦科技 | F368: 计算机及 | G368: 软件开发 | H368: 140.888 | I368: 3.5999999999999999e-003 | J368: -2.e-003 | K368: 12.01 | L368: 1.7000000000000001e-003 | M368: 116.3 | N368: 8.5 | O368: -3.0000000000000001e-003 | P368: 141.29 | Q368: 已到 | R368: 10天 | S368: 无权 | T368: 1.08 | U368: 91 | V368: 0.59899999999999998 | W368: 1.7000000000000001e-002 | X368: 2.4e-002 | Y368: 64 | Z368: 2.02 | AA368: <-100% | AB368: <-100% | AC368: 无权 | AD368: 无权 | AE368: 无权 | AF368: 100.59 | AG368: 1 | AH368: AA- | AI368: 5.6900000000000006e-002 | AJ368: =H368+100*O368 -> 140.58799999999999 | AK368: 140.5 | AL368: 45 | AM368: 39.9 | AN368: 33 | AO368: 4.2000000000000003e-002 | AP368: 25 | AQ368: 博彦转债!*
A369: 277 | B369: 123028 | C369: 清水转债!!* | D369: 300437 | E369: 清水源 | F369: 城市公用 | G369: 三废处理 | H369: 339 | I369: 1.3999999999999999e-002 | J369: -1.11e-002 | K369: 38.38 | L369: 2.8999999999999998e-003 | M369: 121 | N369: 11.84 | O369: 4.5999999999999999e-002 | P369: 324.16 | Q369: 已到 | R369: 10天 | S369: 无权 | T369: 1.35 | U369: 6857. | V369: 14.470000000000001 | W369: 1.4999999999999999e-002 | X369: 4.7e-002 | Y369: 92 | Z369: 7.1 | AA369: <-100% | AB369: <-100% | AC369: 无权 | AD369: 无权 | AE369: 无权 | AF369: 100.49 | AG369: 1 | AH369: A+ | AI369: 6.7900000000000002e-002 | AJ369: =H369+100*O369 -> 343.60000000000002 | AK369: 353.8 | AL369: 355 | AM369: 253.4 | AN369: 355 | AO369: 4.2999999999999997e-002 | AP369: 45 | AQ369: 清水转债!!*
A370: 134 | B370: 113603 | C370: 东缆转债!!* | D370: 603606 | E370: 东方电缆 | F370: 能源电力 | G370: 电力设备 | H370: 247.01 | I370: -1.4999999999999999e-002 | J370: -6.0999999999999995e-003 | K370: 58.83 | L370: -2.1099999999999997e-002 | M370: 114.8 | N370: 23.65 | O370: -6.9999999999999993e-003 | P370: 248.75 | Q370: 已到 | R370: 10天 | S370: 无权 | T370: 2.42 | U370: 1062. | V370: 1.74 | W370: 6.0000000000000001e-003 | X370: 1.4999999999999999e-002 | Y370: 396 | Z370: 10.05 | AA370: <-100% | AB370: <-100% | AC370: 无权 | AD370: 无权 | AE370: 无权 | AF370: 99.99 | AG370: 1 | AH370: AA | AI370: 3.5900000000000001e-002 | AJ370: =H370+100*O370 -> 246.31 | AK370: 245.3 | AL370: 334 | AM370: 145.3 | AN370: 333 | AO370: 0.25700000000000001 | AP370: 7 | AQ370: 东缆转债!!*
A371: 104 | B371: 123081 | C371: 精研转债!!* | D371: 300709 | E371: 精研科技 | F371: 电子 | G371: 电子产品 | H371: 156.702 | I371: -3.56e-002 | J371: -9.0000000000000011e-003 | K371: 53.5 | L371: -4.4600000000000001e-002 | M371: 121.3 | N371: 34.15 | O371: 0. | P371: 156.66 | Q371: 已到 | R371: 30天 | S371: 无权 | T371: 4.16 | U371: 479 | V371: 0.72900000000000009 | W371: 5.5999999999999994e-002 | X371: 8.8000000000000009e-002 | Y371: 74 | Z371: 4.39 | AA371: <-100% | AB371: <-100% | AC371: 无权 | AD371: 无权 | AE371: 无权 | AF371: 99.97 | AG371: 1 | AH371: AA- | AI371: 5.6900000000000006e-002 | AJ371: =H371+100*O371 -> 156.702 | AK371: 156.7 | AL371: 188 | AM371: 56.8 | AN371: 148 | AO371: 5.9999999999999998e-002 | AP371: 11 | AQ371: 精研转债!!*
A373: 声明：本数据不构成任何投资建议，宁稳网不对数据的准确性及完整性做出保证，对使用者参考本数据造成的任何直接或间接损失概不负责。
A375: 来源：宁稳网，http://www.ninwin.cn，版权所有，本数据仅供【十七亩，8703】参考，请勿转发，2021-11-19 21:09:13