A1: 序号 | B1: 转债代码 | C1: 转债名称 | D1: 股票代码 | E1: 股票名称 | F1: 行业 | G1: 子行业 | H1: 转债价格 | I1: 涨跌 | J1: 日内套利 | K1: 股价 | L1: 涨跌 | M1: 剩余本息 | N1: 转股价格 | O1: 转股溢价率 | P1: 转股价值 | Q1: 距离转股日 | R1: 剩余年限 | S1: 回售年限 | T1: 转债余额 | U1: 转债成交额 | V1: 转债换手率 | W1: 余额/市值 | X1: 余额/股本 | Y1: 股票市值 | Z1: P/B | AA1: 税前收益率 | AB1: 税后收益率 | AC1: 税前回售收益 | AD1: 税后回售收益 | AE1: 回售价值 | AF1: 纯债价值 | AG1: 弹性 | AH1: 信用 | AI1: 折现率 | AJ1: 双低 | AK1: 老式双低 | AL1: 老式排名 | AM1: 新式双低 | AN1: 新式排名 | AO1: MA20乖离 | AP1: 热门度 | AQ1: 转债名称
A2: 1 | B2: 118004 | C2: 博瑞转债 | D2: 688166 | E2: 博瑞医药 | F2: 医药 | G2: 原料药 | H2: 124.63 | I2: -1.2e-002 | J2: -6.0999999999999995e-003 | K2: 28.41 | L2: -3.73e-002 | M2: 121 | N2: 35.68 | O2: 0.56499999999999995 | P2: 79.62 | Q2: 4月27天 | R2: 5.89年 | S2: 3.89年 | T2: 4.65 | U2: 22 | V2: 3.7000000000000005e-002 | W2: 4.0000000000000001e-002 | X2: 3.2000000000000001e-002 | Y2: 116 | Z2: 7.36 | AA2: -5.1000000000000004e-003 | AB2: -1.11e-002 | AC2: -4.4199999999999996e-002 | AD2: -4.5899999999999996e-002 | AE2: 81.73 | AF2: 85.68 | AG2: 0.49 | AH2: AA- | AI2: 6.1600000000000002e-002 | AJ2: =H2+100*O2 -> 181.13 | AK2: 169.6 | AL2: 228 | AM2: 84 | AN2: 274 | AO2: -0.14000000000000001 | AP2: 2 | AQ2: 博瑞转债
A3: 2 | B3: 113638 | C3: 台21转债 | D3: 603055 | E3: 台华新材 | F3: 服装纺织 | G3: 纺织行业 | H3: 131.22 | I3: 6.3e-003 | J3: 1.6e-002 | K3: 15.79 | L3: 4.2199999999999994e-002 | M3: 117.1 | N3: 16.87 | O3: 0.40200000000000002 | P3: 93.6 | Q3: 4月22天 | R3: 5.87年 | S3: 3.87年 | T3: 6 | U3: 35 | V3: 4.4999999999999998e-002 | W3: 4.4000000000000004e-002 | X3: 4.0999999999999995e-002 | Y3: 137 | Z3: 3.83 | AA3: -1.95e-002 | AB3: -2.4399999999999998e-002 | AC3: -5.7200000000000001e-002 | AD3: -5.8700000000000002e-002 | AE3: 88.33 | AF3: 93.07 | AG3: 0.53 | AH3: AA | AI3: 4.0599999999999997e-002 | AJ3: =H3+100*O3 -> 171.42000000000002 | AK3: 168.8 | AL3: 222 | AM3: 75.8 | AN3: 231 | AO3: -2.e-002 | AP3: 1 | AQ3: 台21转债
A4: 3 | B4: 123135 | C4: 泰林转债 | D4: 300813 | E4: 泰林生物 | F4: 医药 | G4: 医疗器械 | H4: 132.5 | I4: -2.29e-002 | J4: -6.3e-003 | K4: 69.85 | L4: -5.2499999999999998e-002 | M4: 121.5 | N4: 87.38 | O4: 0.65799999999999992 | P4: 79.94 | Q4: 4月21天 | R4: 5.87年 | S4: 3.87年 | T4: 2.1 | U4: 23 | V4: 8.3000000000000004e-002 | W4: 5.7999999999999996e-002 | X4: 4.5999999999999999e-002 | Y4: 36 | Z4: 7.48 | AA4: -1.4999999999999999e-002 | AB4: -2.1000000000000001e-002 | AC4: -5.7300000000000004e-002 | AD4: -5.9299999999999999e-002 | AE4: 79.14 | AF4: 81.3 | AG4: 0.56 | AH4: A+ | AI4: 7.2599999999999998e-002 | AJ4: =H4+100*O4 -> 198.30000000000001 | AK4: 185.1 | AL4: 305 | AM4: 103.8 | AN4: 327 | AO4: -0.14800000000000002 | AP4: 2 | AQ4: 泰林转债
A5: 4 | B5: 123134 | C5: 卡倍转债 | D5: 300863 | E5: 卡倍亿 | F5: 汽车 | G5: 零部件制 | H5: 130.9 | I5: -9.1000000000000004e-003 | J5: -1.3500000000000002e-002 | K5: 70.88 | L5: -4.3499999999999997e-002 | M5: 121 | N5: 92.5 | O5: 0.70799999999999996 | P5: 76.63 | Q5: 4月18天 | R5: 5.87年 | S5: 3.87年 | T5: 2.79 | U5: 9.8 | V5: 2.7000000000000003e-002 | W5: 7.0999999999999994e-002 | X5: 5.5e-002 | Y5: 39 | Z5: 6.18 | AA5: -1.3600000000000001e-002 | AB5: -1.95e-002 | AC5: -5.5999999999999994e-002 | AD5: -5.7699999999999994e-002 | AE5: 78.54 | AF5: 80.86 | AG5: 0.52 | AH5: A+ | AI5: 7.2599999999999998e-002 | AJ5: =H5+100*O5 -> 201.69999999999999 | AK5: 185.2 | AL5: 307 | AM5: 104.3 | AN5: 328 | AO5: -0.114 | AP5: 2 | AQ5: 卡倍转债
A6: 5 | B6: 110084 | C6: 贵燃转债 | D6: 600903 | E6: 贵州燃气 | F6: 石油天然 | G6: 天然气 | H6: 119.9 | I6: -8.8999999999999999e-003 | J6: 2.8000000000000004e-003 | K6: 9.29 | L6: -1.1699999999999999e-002 | M6: 115.1 | N6: 10.17 | O6: 0.313 | P6: 91.35 | Q6: 4月18天 | R6: 5.87年 | S6: 3.87年 | T6: 10 | U6: 23 | V6: 1.9e-002 | W6: 9.5000000000000001e-002 | X6: 8.5999999999999993e-002 | Y6: 106 | Z6: 3.74 | AA6: -7.0999999999999995e-003 | AB6: -1.1599999999999999e-002 | AC6: -3.5799999999999998e-002 | AD6: -3.7400000000000003e-002 | AE6: 88.35 | AF6: 91.5 | AG6: 0.52 | AH6: AA | AI6: 4.0599999999999997e-002 | AJ6: =H6+100*O6 -> 151.20000000000002 | AK6: 148.5 | AL6: 46 | AM6: 56.9 | AN6: 84 | AO6: -1.9e-002 | AP6: 4 | AQ6: 贵燃转债
A7: 6 | B7: 113052 | C7: 兴业转债 | D7: 601166 | E7: 兴业银行 | F7: 金融 | G7: 银行行业 | H7: 117.94 | I7: 5.3e-003 | J7: 1.9e-003 | K7: 22.99 | L7: 1.4999999999999999e-002 | M7: 114.4 | N7: 25.51 | O7: 0.309 | P7: 90.12 | Q7: 4月17天 | R7: 5.87年 | S7: 无权 | T7: 500 | U7: 1268. | V7: 2.1000000000000001e-002 | W7: 0.105 | X7: 9.4e-002 | Y7: 4776. | Z7: 0.83 | AA7: -5.3e-003 | AB7: -9.5999999999999992e-003 | AC7: 无权 | AD7: 无权 | AE7: 无权 | AF7: 94.54 | AG7: 0.48 | AH7: AAA | AI7: 3.3599999999999998e-002 | AJ7: =H7+100*O7 -> 148.84 | AK7: 145.8 | AL7: 30 | AM7: 51.2 | AN7: 50 | AO7: 7.0999999999999994e-002 | AP7: 9 | AQ7: 兴业转债
A8: 7 | B8: 127052 | C8: 杭锅转债 | D8: 2534 | E8: 杭锅股份 | F8: 机械装备 | G8: 通用设备 | H8: 133.136 | I8: -1.e-004 | J8: -2.6000000000000002e-002 | K8: 23.8 | L8: -5.8499999999999996e-002 | M8: 115.1 | N8: 28.08 | O8: 0.57100000000000006 | P8: 84.76 | Q8: 4月17天 | R8: 5.86年 | S8: 3.86年 | T8: 11.1 | U8: 39 | V8: 2.6000000000000002e-002 | W8: 6.3e-002 | X8: 5.2999999999999999e-002 | Y8: 176 | Z8: 5.09 | AA8: -2.4900000000000002e-002 | AB8: -2.9300000000000003e-002 | AC8: -6.08e-002 | AD8: -6.2300000000000001e-002 | AE8: 88.38 | AF8: 91.53 | AG8: 0.45 | AH8: AA | AI8: 4.0599999999999997e-002 | AJ8: =H8+100*O8 -> 190.23599999999999 | AK8: 181.5 | AL8: 298 | AM8: 90 | AN8: 298 | AO8: -0.17899999999999999 | AP8: 2 | AQ8: 杭锅转债
A9: 8 | B9: 113637 | C9: 华翔转债 | D9: 603112 | E9: 华翔股份 | F9: 机械装备 | G9: 专用设备 | H9: 138.52 | I9: -2.4199999999999999e-002 | J9: 1.e-003 | K9: 14.39 | L9: -3.2899999999999999e-002 | M9: 121 | N9: 12.99 | O9: 0.25 | P9: 110.78 | Q9: 4月15天 | R9: 5.85年 | S9: 3.85年 | T9: 8 | U9: 22 | V9: 2.e-002 | W9: 0.127 | X9: 0.14099999999999999 | Y9: 63 | Z9: 3.16 | AA9: -2.3199999999999998e-002 | AB9: -2.9100000000000001e-002 | AC9: -6.9500000000000006e-002 | AD9: -7.1199999999999999e-002 | AE9: 81.9 | AF9: 85.86 | AG9: 0.7 | AH9: AA- | AI9: 6.1600000000000002e-002 | AJ9: =H9+100*O9 -> 163.52000000000001 | AK9: 166.3 | AL9: 202 | AM9: 80.4 | AN9: 253 | AO9: 4.0000000000000001e-002 | AP9: 2 | AQ9: 华翔转债
A10: 9 | B10: 123133 | C10: 佩蒂转债 | D10: 300673 | E10: 佩蒂股份 | F10: 食品饮料 | G10: 食品加工 | H10: 127.952 | I10: -4.0000000000000001e-003 | J10: -1.3500000000000002e-002 | K10: 17.2 | L10: -3.2099999999999997e-002 | M10: 120.5 | N10: 19.92 | O10: 0.48200000000000004 | P10: 86.35 | Q10: 4月15天 | R10: 5.85年 | S10: 3.85年 | T10: 7.2 | U10: 5.4 | V10: 6.0000000000000001e-003 | W10: 0.16500000000000001 | X10: 0.14300000000000002 | Y10: 44 | Z10: 2.62 | AA10: -1.04e-002 | AB10: -1.6299999999999999e-002 | AC10: -5.0999999999999997e-002 | AD10: -5.2699999999999997e-002 | AE10: 81.84 | AF10: 85.49 | AG10: 0.55 | AH10: AA- | AI10: 6.1600000000000002e-002 | AJ10: =H10+100*O10 -> 176.15199999999999 | AK10: 169.6 | AL10: 227 | AM10: 84.1 | AN10: 278 | AO10: -6.0999999999999999e-002 | AP10: 2 | AQ10: 佩蒂转债
A11: 10 | B11: 123132 | C11: 回盛转债 | D11: 300871 | E11: 回盛生物 | F11: 医药 | G11: 医药行业 | H11: 129.9 | I11: -1.23e-002 | J11: 1.37e-002 | K11: 25.92 | L11: 2.3e-003 | M11: 121 | N11: 28.32 | O11: 0.41899999999999998 | P11: 91.53 | Q11: 4月10天 | R11: 5.84年 | S11: 3.84年 | T11: 7 | U11: 8 | V11: 9.0000000000000011e-003 | W11: 0.16200000000000001 | X11: 0.14899999999999999 | Y11: 43 | Z11: 2.96 | AA11: -1.23e-002 | AB11: -1.83e-002 | AC11: -5.4600000000000003e-002 | AD11: -5.6299999999999996e-002 | AE11: 81.97 | AF11: 85.93 | AG11: 0.59 | AH11: AA- | AI11: 6.1600000000000002e-002 | AJ11: =H11+100*O11 -> 171.80000000000001 | AK11: 168.3 | AL11: 218 | AM11: 82.3 | AN11: 264 | AO11: -5.5999999999999994e-002 | AP11: 2 | AQ11: 回盛转债
A12: 11 | B12: 113636 | C12: 甬金转债 | D12: 603995 | E12: 甬金股份 | F12: 钢铁 | G12: 钢铁行业 | H12: 148.39 | I12: 9.7000000000000003e-003 | J12: -1.9400000000000001e-002 | K12: 58.7 | L12: -1.38e-002 | M12: 120.6 | N12: 53.07 | O12: 0.34200000000000003 | P12: 110.61 | Q12: 4月4天 | R12: 5.83年 | S12: 3.83年 | T12: 10 | U12: 44 | V12: 2.9999999999999999e-002 | W12: 7.2999999999999995e-002 | X12: 8.1000000000000003e-002 | Y12: 137 | Z12: 3.98 | AA12: -3.5499999999999997e-002 | AB12: -4.1200000000000001e-002 | AC12: -8.6699999999999999e-002 | AD12: -8.8100000000000012e-002 | AE12: 81.67 | AF12: 85.63 | AG12: 0.7 | AH12: AA- | AI12: 6.1600000000000002e-002 | AJ12: =H12+100*O12 -> 182.58999999999997 | AK12: 186.2 | AL12: 309 | AM12: 100.5 | AN12: 321 | AO12: 9.0000000000000011e-003 | AP12: 2 | AQ12: 甬金转债
A13: 12 | B13: 113635 | C13: 升21转债 | D13: 603305 | E13: 旭升股份 | F13: 汽车 | G13: 零部件制 | H13: 133.33 | I13: -2.0400000000000001e-002 | J13: -1.7299999999999999e-002 | K13: 38.39 | L13: -7.2000000000000008e-002 | M13: 119.6 | N13: 46.37 | O13: 0.60999999999999999 | P13: 82.79 | Q13: 4月3天 | R13: 5.82年 | S13: 3.82年 | T13: 13.5 | U13: 16 | V13: 9.0000000000000011e-003 | W13: 7.9000000000000001e-002 | X13: 6.5000000000000002e-002 | Y13: 172 | Z13: 4.9 | AA13: -1.8799999999999997e-002 | AB13: -2.4399999999999998e-002 | AC13: -6.2300000000000001e-002 | AD13: -6.3700000000000007e-002 | AE13: 81.59 | AF13: 84.94 | AG13: 0.52 | AH13: AA- | AI13: 6.1600000000000002e-002 | AJ13: =H13+100*O13 -> 194.33000000000001 | AK13: 183.9 | AL13: 302 | AM13: 98.9 | AN13: 318 | AO13: -0.161 | AP13: 3 | AQ13: 升21转债
A14: 13 | B14: 111002 | C14: 特纸转债 | D14: 605007 | E14: 五洲特纸 | F14: 造纸包装 | G14: 包装用纸 | H14: 156.13 | I14: -3.9300000000000002e-002 | J14: 1.7000000000000001e-003 | K14: 21.14 | L14: -5.4600000000000003e-002 | M14: 117.1 | N14: 18.5 | O14: 0.36599999999999999 | P14: 114.27 | Q14: 4月1天 | R14: 5.82年 | S14: 3.82年 | T14: 6.7 | U14: 59 | V14: 5.5e-002 | W14: 7.9000000000000001e-002 | X14: 9.0999999999999998e-002 | Y14: 85 | Z14: 4.49 | AA14: -4.9000000000000002e-002 | AB14: -5.3800000000000001e-002 | AC14: -9.849999999999999e-002 | AD14: -9.9900000000000003e-002 | AE14: 88.53 | AF14: 93.28 | AG14: 0.69 | AH14: AA | AI14: 4.0599999999999997e-002 | AJ14: =H14+100*O14 -> 192.72999999999999 | AK14: 198 | AL14: 331 | AM14: 104.7 | AN14: 330 | AO14: -6.2e-002 | AP14: 2 | AQ14: 特纸转债
A15: 14 | B15: 113634 | C15: 珀莱转债 | D15: 603605 | E15: 珀莱雅 | F15: 化工 | G15: 日化 | H15: 129.58 | I15: 2.e-003 | J15: -1.6000000000000001e-003 | K15: 168.38 | L15: 1.e-003 | M15: 120.1 | N15: 195.98 | O15: 0.50800000000000001 | P15: 85.92 | Q15: 4月1天 | R15: 5.82年 | S15: 3.82年 | T15: 7.52 | U15: 22 | V15: 2.3e-002 | W15: 2.2000000000000002e-002 | X15: 1.9e-002 | Y15: 338 | Z15: 12.95 | AA15: -1.32e-002 | AB15: -1.9e-002 | AC15: -5.5e-002 | AD15: -5.6600000000000004e-002 | AE15: 88.53 | AF15: 95.66 | AG15: 0.42 | AH15: AA | AI15: 4.0599999999999997e-002 | AJ15: =H15+100*O15 -> 180.38 | AK15: 173.2 | AL15: 258 | AM15: 77.6 | AN15: 239 | AO15: -5.7999999999999996e-002 | AP15: 4 | AQ15: 珀莱转债
A16: 15 | B16: 123131 | C16: 奥飞转债 | D16: 300738 | E16: 奥飞数据 | F16: 通信互联 | G16: 通信设备 | H16: 143 | I16: -2.8500000000000001e-002 | J16: 9.1999999999999998e-003 | K16: 21.57 | L16: -2.8799999999999999e-002 | M16: 121.7 | N16: 22.02 | O16: 0.46000000000000002 | P16: 97.96 | Q16: 3月26天 | R16: 5.80年 | S16: 3.80年 | T16: 6.35 | U16: 14 | V16: 1.4999999999999999e-002 | W16: 7.6999999999999999e-002 | X16: 7.5999999999999998e-002 | Y16: 82 | Z16: 5.84 | AA16: -2.7999999999999997e-002 | AB16: -3.4000000000000002e-002 | AC16: -7.6399999999999996e-002 | AD16: -7.8399999999999997e-002 | AE16: 79.47 | AF16: 81.81 | AG16: 0.67 | AH16: A+ | AI16: 7.2599999999999998e-002 | AJ16: =H16+100*O16 -> 189. | AK16: 188 | AL16: 314 | AM16: 106.2 | AN16: 333 | AO16: -7.0999999999999994e-002 | AP16: 2 | AQ16: 奥飞转债
A17: 16 | B17: 113633 | C17: 科沃转债! | D17: 603486 | E17: 科沃斯 | F17: 机械装备 | G17: 机器人及 | H17: 124.9 | I17: -2.9999999999999997e-004 | J17: 1.1899999999999999e-002 | K17: 129.25 | L17: 3.7200000000000004e-002 | M17: 115.1 | N17: 178.13 | O17: 0.72099999999999997 | P17: 72.56 | Q17: 3月23天 | R17: 5.79年 | S17: 3.79年 | T17: 10.4 | U17: 68 | V17: 5.2999999999999999e-002 | W17: 1.3999999999999999e-002 | X17: 1.e-002 | Y17: 742 | Z17: 17.52 | AA17: -1.4199999999999999e-002 | AB17: -1.8799999999999997e-002 | AC17: -4.6399999999999997e-002 | AD17: -4.8000000000000001e-002 | AE17: 88.61 | AF17: 91.77 | AG17: 0.31 | AH17: AA | AI17: 4.0599999999999997e-002 | AJ17: =H17+100*O17 -> 197. | AK17: 177.2 | AL17: 274 | AM17: 85.5 | AN17: 285 | AO17: -6.2e-002 | AP17: 7 | AQ17: 科沃转债!
A18: 17 | B18: 118003 | C18: 华兴转债 | D18: 688001 | E18: 华兴源创 | F18: 机械装备 | G18: 专用设备 | H18: 128.48 | I18: -2.9999999999999997e-004 | J18: -5.0000000000000001e-003 | K18: 33.67 | L18: -1.1699999999999999e-002 | M18: 115.1 | N18: 39.33 | O18: 0.501 | P18: 85.61 | Q18: 3月20天 | R18: 5.79年 | S18: 3.79年 | T18: 8 | U18: 2.4 | V18: 2.e-003 | W18: 5.4000000000000006e-002 | X18: 4.5999999999999999e-002 | Y18: 148 | Z18: 4.35 | AA18: -1.9099999999999999e-002 | AB18: -2.3599999999999999e-002 | AC18: -5.33e-002 | AD18: -5.4900000000000004e-002 | AE18: 88.62 | AF18: 91.78 | AG18: 0.45 | AH18: AA | AI18: 4.0599999999999997e-002 | AJ18: =H18+100*O18 -> 178.57999999999998 | AK18: 171.4 | AL18: 244 | AM18: 79.6 | AN18: 249 | AO18: -5.2999999999999999e-002 | AP18: 3 | AQ18: 华兴转债
A19: 18 | B19: 127051 | C19: 博杰转债 | D19: 2975 | E19: 博杰股份 | F19: 机械装备 | G19: 机器人及 | H19: 130.461 | I19: -1.47e-002 | J19: -4.4000000000000003e-003 | K19: 54.92 | L19: -3.4300000000000004e-002 | M19: 121.1 | N19: 62.17 | O19: 0.47700000000000004 | P19: 88.34 | Q19: 3月9天 | R19: 5.76年 | S19: 4.76年 | T19: 5.26 | U19: 2.9 | V19: 4.0000000000000001e-003 | W19: 6.9000000000000006e-002 | X19: 6.0999999999999999e-002 | Y19: 77 | Z19: 5.18 | AA19: -1.3100000000000001e-002 | AB19: -1.9199999999999998e-002 | AC19: -4.07e-002 | AD19: -4.3099999999999999e-002 | AE19: 79.79 | AF19: 86.44 | AG19: 0.55 | AH19: AA- | AI19: 6.1600000000000002e-002 | AJ19: =H19+100*O19 -> 178.161 | AK19: 172.6 | AL19: 254 | AM19: 86.1 | AN19: 287 | AO19: -9.0999999999999998e-002 | AP19: 2 | AQ19: 博杰转债
A20: 19 | B20: 113632 | C20: 鹤21转债 | D20: 603733 | E20: 仙鹤股份 | F20: 造纸包装 | G20: 造纸行业 | H20: 127.81 | I20: -4.5999999999999999e-003 | J20: -4.5999999999999999e-003 | K20: 29.9 | L20: -2.7300000000000001e-002 | M20: 117.1 | N20: 39.09 | O20: 0.67099999999999993 | P20: 76.49 | Q20: 3月9天 | R20: 5.76年 | S20: 3.76年 | T20: 20.5 | U20: 6.9 | V20: 3.0000000000000001e-003 | W20: 9.6999999999999989e-002 | X20: 7.400000000000001e-002 | Y20: 211 | Z20: 3.5 | AA20: -1.5300000000000001e-002 | AB20: -2.0400000000000001e-002 | AC20: -5.2499999999999998e-002 | AD20: -5.4100000000000002e-002 | AE20: 88.73 | AF20: 93.49 | AG20: 0.34 | AH20: AA | AI20: 4.0599999999999997e-002 | AJ20: =H20+100*O20 -> 194.91 | AK20: 179.1 | AL20: 284 | AM20: 85.6 | AN20: 286 | AO20: -0.184 | AP20: 2 | AQ20: 鹤21转债
A21: 20 | B21: 127050 | C21: 麒麟转债 | D21: 2984 | E21: 森麒麟 | F21: 汽车 | G21: 零部件制 | H21: 139.256 | I21: 3.4000000000000002e-003 | J21: -2.0999999999999999e-003 | K21: 32.63 | L21: 2.5000000000000001e-003 | M21: 115.1 | N21: 34.85 | O21: 0.48700000000000004 | P21: 93.63 | Q21: 3月3天 | R21: 5.74年 | S21: 3.74年 | T21: 22 | U21: 9.9 | V21: 3.0000000000000001e-003 | W21: 0.10400000000000001 | X21: 9.6999999999999989e-002 | Y21: 212 | Z21: 3.47 | AA21: -3.32e-002 | AB21: -3.7599999999999995e-002 | AC21: -7.3399999999999993e-002 | AD21: -7.4900000000000008e-002 | AE21: 88.79 | AF21: 91.96 | AG21: 0.53 | AH21: AA | AI21: 4.0599999999999997e-002 | AJ21: =H21+100*O21 -> 187.95600000000002 | AK21: 184.9 | AL21: 304 | AM21: 92.9 | AN21: 304 | AO21: 3.6000000000000004e-002 | AP21: 3 | AQ21: 麒麟转债
A22: 21 | B22: 110083 | C22: 苏租转债 | D22: 600901 | E22: 江苏租赁 | F22: 金融 | G22: 其他 | H22: 122.22 | I22: 5.7999999999999996e-003 | J22: -5.7999999999999996e-003 | K22: 5.14 | L22: 0. | M22: 110.5 | N22: 5.42 | O22: 0.28899999999999998 | P22: 94.83 | Q22: 3月3天 | R22: 5.74年 | S22: 无权 | T22: 50 | U22: 22 | V22: 4.0000000000000001e-003 | W22: 0.32600000000000001 | X22: 0.309 | Y22: 154 | Z22: 1.12 | AA22: -1.7600000000000001e-002 | AB22: -2.0899999999999998e-002 | AC22: 无权 | AD22: 无权 | AE22: 无权 | AF22: 91.61 | AG22: 0.54 | AH22: AAA | AI22: 3.3599999999999998e-002 | AJ22: =H22+100*O22 -> 151.12 | AK22: 149.6 | AL22: 51 | AM22: 58 | AN22: 94 | AO22: 2.e-003 | AP22: 6 | AQ22: 苏租转债
A23: 22 | B23: 123130 | C23: 设研转债 | D23: 300732 | E23: 设研院 | F23: 建筑 | G23: 建筑工程 | H23: 185.94 | I23: -3.7599999999999995e-002 | J23: -3.3599999999999998e-002 | K23: 18.28 | L23: -7.9600000000000004e-002 | M23: 117.1 | N23: 11.24 | O23: 0.14300000000000002 | P23: 162.63 | Q23: 3月3天 | R23: 5.74年 | S23: 3.74年 | T23: 3.76 | U23: 2030. | V23: 2.8599999999999999 | W23: 7.4999999999999997e-002 | X23: 0.122 | Y23: 50 | Z23: 1.99 | AA23: -7.85e-002 | AB23: -8.3100000000000007e-002 | AC23: -0.13300000000000001 | AD23: -0.13400000000000001 | AE23: 88.79 | AF23: 93.56 | AG23: 0.89 | AH23: AA | AI23: 4.0599999999999997e-002 | AJ23: =H23+100*O23 -> 200.24000000000001 | AK23: 209.2 | AL23: 338 | AM23: 115.7 | AN23: 339 | AO23: 0.32600000000000001 | AP23: 3 | AQ23: 设研转债
A24: 23 | B24: 111001 | C24: 山玻转债 | D24: 605006 | E24: 山东玻纤 | F24: 其他 | G24: 非金属矿 | H24: 126.46 | I24: -1.8e-003 | J24: -9.7000000000000003e-003 | K24: 12.24 | L24: -2.0799999999999999e-002 | M24: 120.1 | N24: 13.91 | O24: 0.43700000000000006 | P24: 87.99 | Q24: 2月28天 | R24: 5.73年 | S24: 3.73年 | T24: 6 | U24: 2.4 | V24: 3.0000000000000001e-003 | W24: 9.8000000000000004e-002 | X24: 8.5999999999999993e-002 | Y24: 61 | Z24: 2.84 | AA24: -9.1000000000000004e-003 | AB24: -1.4999999999999999e-002 | AC24: -5.0199999999999995e-002 | AD24: -5.1799999999999999e-002 | AE24: 82.22 | AF24: 85.77 | AG24: 0.55 | AH24: AA- | AI24: 6.1600000000000002e-002 | AJ24: =H24+100*O24 -> 170.16 | AK24: 164.9 | AL24: 185 | AM24: 79.2 | AN24: 246 | AO24: -5.5e-002 | AP24: 3 | AQ24: 山玻转债
A25: 24 | B25: 113631 | C25: 皖天转债 | D25: 603689 | E25: 皖天然气 | F25: 石油天然 | G25: 天然气 | H25: 124.63 | I25: 2.3999999999999998e-003 | J25: -5.3e-003 | K25: 10.08 | L25: -5.8999999999999999e-003 | M25: 114.5 | N25: 11.12 | O25: 0.375 | P25: 90.65 | Q25: 2月28天 | R25: 5.73年 | S25: 3.73年 | T25: 9.3 | U25: 4.1 | V25: 4.0000000000000001e-003 | W25: 0.27500000000000002 | X25: 0.249 | Y25: 34 | Z25: 1.38 | AA25: -1.49e-002 | AB25: -1.9299999999999998e-002 | AC25: -4.7899999999999998e-002 | AD25: -4.9299999999999997e-002 | AE25: 89.93 | AF25: 93.97 | AG25: 0.48 | AH25: AA+ | AI25: 3.56e-002 | AJ25: =H25+100*O25 -> 162.13 | AK25: 158.6 | AL25: 124 | AM25: 64.6 | AN25: 144 | AO25: -1.7000000000000001e-002 | AP25: 3 | AQ25: 皖天转债
A26: 25 | B26: 123129 | C26: 锦鸡转债 | D26: 300798 | E26: 锦鸡股份 | F26: 化工 | G26: 其他 | H26: 122.631 | I26: -2.8000000000000004e-003 | J26: -6.7000000000000002e-003 | K26: 8.94 | L26: -1.54e-002 | M26: 117.8 | N26: 9.53 | O26: 0.307 | P26: 93.81 | Q26: 2月26天 | R26: 5.72年 | S26: 3.72年 | T26: 6 | U26: 3.6 | V26: 5.0000000000000001e-003 | W26: 0.161 | X26: 0.151 | Y26: 37 | Z26: 2.99 | AA26: -7.0999999999999995e-003 | AB26: -1.2500000000000001e-002 | AC26: -4.2099999999999999e-002 | AD26: -4.3899999999999995e-002 | AE26: 82.52 | AF26: 84.26 | AG26: 0.62 | AH26: AA- | AI26: 6.1600000000000002e-002 | AJ26: =H26+100*O26 -> 153.33099999999999 | AK26: 151.5 | AL26: 64 | AM26: 67.2 | AN26: 164 | AO26: -5.4000000000000006e-002 | AP26: 4 | AQ26: 锦鸡转债
A27: 26 | B27: 127049 | C27: 希望转2 | D27: 876 | E27: 新 希 望 | F27: 农业 | G27: 畜牧业 | H27: 147.392 | I27: -1.7399999999999999e-002 | J27: 3.5999999999999999e-003 | K27: 17.6 | L27: -1.84e-002 | M27: 111.2 | N27: 14.45 | O27: 0.20999999999999999 | P27: 121.8 | Q27: 2月24天 | R27: 5.72年 | S27: 3.72年 | T27: 81.5 | U27: 82 | V27: 6.9999999999999993e-003 | W27: 0.10300000000000001 | X27: 0.125 | Y27: 793 | Z27: 2.6 | AA27: -4.87e-002 | AB27: -5.2000000000000005e-002 | AC27: -8.8900000000000007e-002 | AD27: -9.01e-002 | AE27: 90.55 | AF27: 92.31 | AG27: 0.75 | AH27: AAA | AI27: 3.3599999999999998e-002 | AJ27: =H27+100*O27 -> 168.392 | AK27: 173 | AL27: 257 | AM27: 80.7 | AN27: 255 | AO27: 5.5e-002 | AP27: 9 | AQ27: 希望转2
A28: 27 | B28: 123128 | C28: 首华转债! | D28: 300483 | E28: 首华燃气 | F28: 石油天然 | G28: 天然气 | H28: 110.35 | I28: -2.e-003 | J28: -2.0000000000000001e-004 | K28: 14.93 | L28: -1.26e-002 | M28: 115.1 | N28: 25.02 | O28: 0.84900000000000009 | P28: 59.67 | Q28: 2月21天 | R28: 5.72年 | S28: 3.72年 | T28: 13.8 | U28: 19 | V28: 1.2e-002 | W28: 0.34399999999999997 | X28: 0.20499999999999999 | Y28: 40 | Z28: 1.43 | AA28: 7.4999999999999997e-003 | AB28: 2.8000000000000004e-003 | AC28: -1.6200000000000003e-002 | AD28: -1.8000000000000002e-002 | AE28: 88.89 | AF28: 92.06 | AG28: 0.18 | AH28: AA | AI28: 4.0599999999999997e-002 | AJ28: =H28+100*O28 -> 195.25 | AK28: 161 | AL28: 151 | AM28: 69 | AN28: 175 | AO28: -4.4000000000000004e-002 | AP28: 11 | AQ28: 首华转债!
A29: 28 | B29: 123127 | C29: 耐普转债 | D29: 300818 | E29: 耐普矿机 | F29: 机械装备 | G29: 专用设备 | H29: 134.7 | I29: -2.3599999999999999e-002 | J29: 5.4000000000000003e-003 | K29: 40.58 | L29: -2.4300000000000002e-002 | M29: 116.2 | N29: 37 | O29: 0.22800000000000001 | P29: 109.68 | Q29: 2月20天 | R29: 5.71年 | S29: 3.71年 | T29: 4 | U29: 74 | V29: 0.13600000000000001 | W29: 0.14099999999999999 | X29: 0.154 | Y29: 28 | Z29: 3.02 | AA29: -2.6099999999999998e-002 | AB29: -3.0899999999999997e-002 | AC29: -6.4500000000000002e-002 | AD29: -6.6400000000000001e-002 | AE29: 79.72 | AF29: 78.6 | AG29: 0.75 | AH29: A+ | AI29: 7.2599999999999998e-002 | AJ29: =H29+100*O29 -> 157.5 | AK29: 159.7 | AL29: 136 | AM29: 80 | AN29: 250 | AO29: -6.9000000000000006e-002 | AP29: 5 | AQ29: 耐普转债
A30: 29 | B30: 110082 | C30: 宏发转债 | D30: 600885 | E30: 宏发股份 | F30: 能源电力 | G30: 电力设备 | H30: 128.75 | I30: -1.01e-002 | J30: 4.8999999999999998e-003 | K30: 58 | L30: -1.3899999999999999e-002 | M30: 117.1 | N30: 72.28 | O30: 0.60399999999999998 | P30: 80.24 | Q30: 2月19天 | R30: 5.70年 | S30: 3.70年 | T30: 20 | U30: 15 | V30: 6.0000000000000001e-003 | W30: 4.5999999999999999e-002 | X30: 3.7000000000000005e-002 | Y30: 432 | Z30: 7.11 | AA30: -1.6799999999999999e-002 | AB30: -2.1899999999999999e-002 | AC30: -5.5e-002 | AD30: -5.6600000000000004e-002 | AE30: 88.93 | AF30: 93.7 | AG30: 0.38 | AH30: AA | AI30: 4.0599999999999997e-002 | AJ30: =H30+100*O30 -> 189.15000000000001 | AK30: 177.3 | AL30: 276 | AM30: 83.6 | AN30: 272 | AO30: -0.11199999999999999 | AP30: 5 | AQ30: 宏发转债
A31: 30 | B31: 113630 | C31: 赛伍转债! | D31: 603212 | E31: 赛伍技术 | F31: 能源电力 | G31: 太阳能 | H31: 128.18 | I31: -1.4999999999999999e-002 | J31: 1.5e-003 | K31: 24.71 | L31: -3.1e-002 | M31: 120.5 | N31: 32.9 | O31: 0.70700000000000007 | P31: 75.11 | Q31: 2月18天 | R31: 5.70年 | S31: 3.70年 | T31: 7 | U31: 12 | V31: 1.3000000000000001e-002 | W31: 7.0000000000000007e-002 | X31: 5.2999999999999999e-002 | Y31: 100 | Z31: 4.96 | AA31: -1.1000000000000001e-002 | AB31: -1.7000000000000001e-002 | AC31: -5.3399999999999996e-002 | AD31: -5.5199999999999999e-002 | AE31: 82.59 | AF31: 86.28 | AG31: 0.43 | AH31: AA- | AI31: 6.1600000000000002e-002 | AJ31: =H31+100*O31 -> 198.88 | AK31: 181.3 | AL31: 297 | AM31: 95 | AN31: 309 | AO31: -9.4e-002 | AP31: 4 | AQ31: 赛伍转债!
A32: 31 | B32: 127048 | C32: 中大转债 | D32: 2896 | E32: 中大力德 | F32: 机械装备 | G32: 通用设备 | H32: 130.444 | I32: -1.2500000000000001e-002 | J32: -8.5000000000000006e-003 | K32: 21.14 | L32: -3.2099999999999997e-002 | M32: 121.7 | N32: 22.1 | O32: 0.36399999999999999 | P32: 95.66 | Q32: 2月17天 | R32: 5.70年 | S32: 3.70年 | T32: 2.7 | U32: 4.2 | V32: 1.2e-002 | W32: 0.12300000000000001 | X32: 0.11699999999999999 | Y32: 22 | Z32: 3.01 | AA32: -1.24e-002 | AB32: -1.8700000000000001e-002 | AC32: -5.5999999999999994e-002 | AD32: -5.8099999999999999e-002 | AE32: 80.05 | AF32: 82.41 | AG32: 0.66 | AH32: A+ | AI32: 7.2599999999999998e-002 | AJ32: =H32+100*O32 -> 166.84399999999999 | AK32: 165.2 | AL32: 189 | AM32: 82.8 | AN32: 267 | AO32: -6.7000000000000004e-002 | AP32: 4 | AQ32: 中大转债
A33: 32 | B33: 127047 | C33: 帝欧转债 | D33: 2798 | E33: 帝欧家居 | F33: 其他 | G33: 家居用品 | H33: 128.3 | I33: -1.01e-002 | J33: -3.0000000000000001e-003 | K33: 13.05 | L33: -2.1000000000000001e-002 | M33: 120.4 | N33: 13.53 | O33: 0.33000000000000002 | P33: 96.45 | Q33: 2月15天 | R33: 5.70年 | S33: 3.70年 | T33: 15 | U33: 26 | V33: 1.3000000000000001e-002 | W33: 0.29699999999999999 | X33: 0.28699999999999998 | Y33: 50 | Z33: 1.1 | AA33: -1.1299999999999999e-002 | AB33: -1.7299999999999999e-002 | AC33: -5.3899999999999997e-002 | AD33: -5.5599999999999997e-002 | AE33: 82.51 | AF33: 86.2 | AG33: 0.62 | AH33: AA- | AI33: 6.1600000000000002e-002 | AJ33: =H33+100*O33 -> 161.30000000000001 | AK33: 160.1 | AL33: 142 | AM33: 73.9 | AN33: 214 | AO33: -7.6999999999999999e-002 | AP33: 5 | AQ33: 帝欧转债
A34: 33 | B34: 127046 | C34: 百润转债! | D34: 2568 | E34: 百润股份 | F34: 食品饮料 | G34: 葡萄酒洋 | H34: 126.703 | I34: 0. | J34: -7.4000000000000003e-003 | K34: 43.7 | L34: -3.3000000000000002e-002 | M34: 115.1 | N34: 66.83 | O34: 0.93799999999999994 | P34: 65.39 | Q34: 58天 | R34: 5.62年 | S34: 3.62年 | T34: 11.3 | U34: 6.5 | V34: 5.0000000000000001e-003 | W34: 3.4000000000000002e-002 | X34: 2.2000000000000002e-002 | Y34: 328 | Z34: 9.33 | AA34: -1.72e-002 | AB34: -2.1899999999999999e-002 | AC34: -5.21e-002 | AD34: -5.3800000000000001e-002 | AE34: 89.21 | AF34: 92.4 | AG34: 0.22 | AH34: AA | AI34: 4.0599999999999997e-002 | AJ34: =H34+100*O34 -> 220.50299999999999 | AK34: 188 | AL34: 313 | AM34: 95.6 | AN34: 312 | AO34: -8.3000000000000004e-002 | AP34: 5 | AQ34: 百润转债!
A35: 34 | B35: 113629 | C35: 泉峰转债 | D35: 603982 | E35: 泉峰汽车 | F35: 汽车 | G35: 零部件制 | H35: 156.37 | I35: -5.8499999999999996e-002 | J35: 8.0000000000000004e-004 | K35: 28.24 | L35: -7.7100000000000002e-002 | M35: 121 | N35: 23.03 | O35: 0.27500000000000002 | P35: 122.62 | Q35: 37天 | R35: 5.58年 | S35: 3.58年 | T35: 6.2 | U35: 137 | V35: 0.13699999999999998 | W35: 0.109 | X35: 0.13400000000000001 | Y35: 57 | Z35: 3.42 | AA35: -4.5700000000000005e-002 | AB35: -5.1699999999999996e-002 | AC35: -0.10099999999999999 | AD35: -0.10199999999999999 | AE35: 83.24 | AF35: 87.27 | AG35: 0.75 | AH35: AA- | AI35: 6.1600000000000002e-002 | AJ35: =H35+100*O35 -> 183.87 | AK35: 190.1 | AL35: 316 | AM35: 102.9 | AN35: 325 | AO35: -0.214 | AP35: 6 | AQ35: 泉峰转债
A36: 35 | B36: 123126 | C36: 瑞丰转债! | D36: 300243 | E36: 瑞丰高材 | F36: 化工 | G36: 橡胶塑料 | H36: 119.53 | I36: -5.0000000000000001e-004 | J36: -7.3000000000000001e-003 | K36: 12.24 | L36: -2.0799999999999999e-002 | M36: 129.6 | N36: 17.8 | O36: 0.73799999999999999 | P36: 68.76 | Q36: 31天 | R36: 5.57年 | S36: 3.57年 | T36: 3.4 | U36: 5.5 | V36: 1.3999999999999999e-002 | W36: 0.12 | X36: 8.199999999999999e-002 | Y36: 28 | Z36: 3.5 | AA36: 1.5100000000000001e-002 | AB36: 6.3e-003 | AC36: -3.0299999999999997e-002 | AD36: -3.3599999999999998e-002 | AE36: 82.42 | AF36: 88.78 | AG36: 0.37 | AH36: A+ | AI36: 7.2599999999999998e-002 | AJ36: =H36+100*O36 -> 193.32999999999998 | AK36: 170.3 | AL36: 233 | AM36: 81.5 | AN36: 259 | AO36: -4.9000000000000002e-002 | AP36: 9 | AQ36: 瑞丰转债!
A37: 36 | B37: 123125 | C37: 元力转债 | D37: 300174 | E37: 元力股份 | F37: 化工 | G37: 化工 | H37: 120 | I37: -1.8799999999999997e-002 | J37: 1.8e-003 | K37: 14.73 | L37: -3.0299999999999997e-002 | M37: 109.3 | N37: 17.61 | O37: 0.435 | P37: 83.65 | Q37: 25天 | R37: 5.56年 | S37: 3.56年 | T37: 9 | U37: 4.1 | V37: 4.0000000000000001e-003 | W37: 0.19600000000000001 | X37: 0.16399999999999998 | Y37: 46 | Z37: 2.62 | AA37: -1.6899999999999998e-002 | AB37: -1.9900000000000001e-002 | AC37: -4.0800000000000003e-002 | AD37: -4.2199999999999994e-002 | AE37: 82.36 | AF37: 78.78 | AG37: 0.56 | AH37: AA- | AI37: 6.1600000000000002e-002 | AJ37: =H37+100*O37 -> 163.5 | AK37: 156.4 | AL37: 104 | AM37: 74 | AN37: 215 | AO37: -6.3e-002 | AP37: 5 | AQ37: 元力转债
A38: 37 | B38: 113628 | C38: 晨丰转债 | D38: 603685 | E38: 晨丰科技 | F38: 能源电力 | G38: 电力设备 | H38: 121.03 | I38: -1.15e-002 | J38: -6.3e-003 | K38: 11.25 | L38: -2.8500000000000001e-002 | M38: 121.7 | N38: 13.06 | O38: 0.40500000000000003 | P38: 86.14 | Q38: 14天 | R38: 5.52年 | S38: 3.52年 | T38: 4.15 | U38: 1.2 | V38: 2.e-003 | W38: 0.218 | X38: 0.188 | Y38: 19 | Z38: 1.69 | AA38: 1.e-003 | AB38: -5.6999999999999993e-003 | AC38: -3.9100000000000003e-002 | AD38: -4.1399999999999999e-002 | AE38: 78.34 | AF38: 79.36 | AG38: 0.62 | AH38: A | AI38: 8.2599999999999993e-002 | AJ38: =H38+100*O38 -> 161.53 | AK38: 155.9 | AL38: 100 | AM38: 76.6 | AN38: 238 | AO38: -6.5000000000000002e-002 | AP38: 10 | AQ38: 晨丰转债
A39: 38 | B39: 123124 | C39: 晶瑞转2! | D39: 300655 | E39: 晶瑞电材 | F39: 电子 | G39: 电子行业 | H39: 123.358 | I39: -1.2800000000000001e-002 | J39: -4.0000000000000002e-004 | K39: 33.62 | L39: -3.39e-002 | M39: 111.2 | N39: 50.16 | O39: 0.83999999999999997 | P39: 67.03 | Q39: 7天 | R39: 5.50年 | S39: 3.50年 | T39: 5.23 | U39: 20 | V39: 3.1e-002 | W39: 4.4999999999999998e-002 | X39: 2.9999999999999999e-002 | Y39: 116 | Z39: 7.89 | AA39: -1.89e-002 | AB39: -2.2499999999999999e-002 | AC39: -4.8899999999999999e-002 | AD39: -5.0199999999999995e-002 | AE39: 79.51 | AF39: 76.04 | AG39: 0.39 | AH39: A+ | AI39: 7.2599999999999998e-002 | AJ39: =H39+100*O39 -> 207.358 | AK39: 179.7 | AL39: 287 | AM39: 100.2 | AN39: 320 | AO39: -8.0000000000000002e-002 | AP39: 7 | AQ39: 晶瑞转2!
A40: 39 | B40: 127044 | C40: 蒙娜转债! | D40: 2918 | E40: 蒙娜丽莎 | F40: 建筑 | G40: 其他建材 | H40: 142.597 | I40: 1.8600000000000002e-002 | J40: -2.4700000000000003e-002 | K40: 24.42 | L40: -1.29e-002 | M40: 117.1 | N40: 27.07 | O40: 0.58099999999999996 | P40: 90.21 | Q40: 8天 | R40: 5.50年 | S40: 3.50年 | T40: 11.7 | U40: 114 | V40: 6.8000000000000005e-002 | W40: 0.115 | X40: 0.10400000000000001 | Y40: 101 | Z40: 2.72 | AA40: -3.5699999999999996e-002 | AB40: -4.0899999999999999e-002 | AC40: -8.4000000000000005e-002 | AD40: -8.5600000000000009e-002 | AE40: 89.64 | AF40: 94.45 | AG40: 0.47 | AH40: AA | AI40: 4.0599999999999997e-002 | AJ40: =H40+100*O40 -> 200.697 | AK40: 195 | AL40: 327 | AM40: 100.5 | AN40: 322 | AO40: -3.2000000000000001e-002 | AP40: 4 | AQ40: 蒙娜转债!
A41: 40 | B41: 127045 | C41: 牧原转债 | D41: 2714 | E41: 牧原股份 | F41: 农业 | G41: 畜牧业 | H41: 149 | I41: -5.6000000000000008e-003 | J41: -6.0999999999999995e-003 | K41: 60.7 | L41: -1.49e-002 | M41: 111.1 | N41: 47.91 | O41: 0.17600000000000002 | P41: 126.7 | Q41: 8天 | R41: 5.50年 | S41: 3.50年 | T41: 95.5 | U41: 226 | V41: 1.6e-002 | W41: 2.9999999999999999e-002 | X41: 3.7999999999999999e-002 | Y41: 3194. | Z41: 6.06 | AA41: -5.2600000000000001e-002 | AB41: -5.5999999999999994e-002 | AC41: -9.6600000000000005e-002 | AD41: -9.7799999999999998e-002 | AE41: 90.53 | AF41: 91.91 | AG41: 0.78 | AH41: AA+ | AI41: 3.56e-002 | AJ41: =H41+100*O41 -> 166.59999999999999 | AK41: 171.3 | AL41: 242 | AM41: 79.4 | AN41: 247 | AO41: 8.5999999999999993e-002 | AP41: 10 | AQ41: 牧原转债
A42: 41 | B42: 118002 | C42: 天合转债 | D42: 688599 | E42: 天合光能 | F42: 能源电力 | G42: 太阳能 | H42: 148.51 | I42: -1.34e-002 | J42: 5.8999999999999999e-003 | K42: 56.5 | L42: -1.1699999999999999e-002 | M42: 120.1 | N42: 50.51 | O42: 0.32799999999999996 | P42: 111.86 | Q42: 8天 | R42: 5.50年 | S42: 3.50年 | T42: 52.5 | U42: 365 | V42: 4.7e-002 | W42: 4.4999999999999998e-002 | X42: 5.0000000000000003e-002 | Y42: 1172. | Z42: 7.28 | AA42: -3.85e-002 | AB42: -4.4400000000000002e-002 | AC42: -9.4299999999999995e-002 | AD42: -9.5899999999999999e-002 | AE42: 89.67 | AF42: 96.89 | AG42: 0.64 | AH42: AA | AI42: 4.0599999999999997e-002 | AJ42: =H42+100*O42 -> 181.31 | AK42: 185.2 | AL42: 306 | AM42: 88.3 | AN42: 293 | AO42: -0.14400000000000002 | AP42: 8 | AQ42: 天合转债
A43: 42 | B43: 127043 | C43: 川恒转债 | D43: 2895 | E43: 川恒股份 | F43: 化工 | G43: 农化 | H43: 144.87 | I43: -2.18e-002 | J43: 3.9000000000000003e-003 | K43: 22.39 | L43: -2.6499999999999999e-002 | M43: 121 | N43: 21.02 | O43: 0.35999999999999999 | P43: 106.52 | Q43: 5.4天 | R43: 5.49年 | S43: 3.49年 | T43: 11.6 | U43: 48 | V43: 2.7999999999999997e-002 | W43: 0.106 | X43: 0.113 | Y43: 109 | Z43: 3.46 | AA43: -3.2799999999999996e-002 | AB43: -3.9e-002 | AC43: -8.7499999999999994e-002 | AD43: -8.9200000000000002e-002 | AE43: 83.69 | AF43: 87.74 | AG43: 0.68 | AH43: AA- | AI43: 6.1600000000000002e-002 | AJ43: =H43+100*O43 -> 180.87 | AK43: 183.2 | AL43: 301 | AM43: 95.5 | AN43: 311 | AO43: -5.5999999999999994e-002 | AP43: 8 | AQ43: 川恒转债
A44: 43 | B44: 123123 | C44: 江丰转债! | D44: 300666 | E44: 江丰电子 | F44: 电子 | G44: 电子行业 | H44: 134.987 | I44: -1.6500000000000001e-002 | J44: -1.1000000000000001e-002 | K44: 50.96 | L44: -4.1700000000000001e-002 | M44: 121.5 | N44: 51.93 | O44: 0.376 | P44: 98.13 | Q44: 5.4天 | R44: 5.49年 | S44: 3.49年 | T44: 5.17 | U44: 8.5 | V44: 1.2e-002 | W44: 4.4999999999999998e-002 | X44: 4.4000000000000004e-002 | Y44: 116 | Z44: 9.29 | AA44: -1.9400000000000001e-002 | AB44: -2.58e-002 | AC44: -6.8400000000000002e-002 | AD44: -7.0400000000000004e-002 | AE44: 81.03 | AF44: 83.42 | AG44: 0.66 | AH44: A+ | AI44: 7.2599999999999998e-002 | AJ44: =H44+100*O44 -> 172.58699999999999 | AK44: 171.8 | AL44: 250 | AM44: 88.4 | AN44: 294 | AO44: -3.3000000000000002e-002 | AP44: 7 | AQ44: 江丰转债!
A45: 44 | B45: 127042 | C45: 嘉美转债 | D45: 2969 | E45: 嘉美包装 | F45: 造纸包装 | G45: 包装材料 | H45: 133.118 | I45: -3.5999999999999999e-003 | J45: -5.8999999999999999e-003 | K45: 5.95 | L45: -1.3300000000000001e-002 | M45: 117.1 | N45: 4.87 | O45: 8.9999999999999997e-002 | P45: 122.18 | Q45: 1.4天 | R45: 5.48年 | S45: 3.48年 | T45: 7.5 | U45: 56 | V45: 5.5999999999999994e-002 | W45: 0.13100000000000001 | X45: 0.16 | Y45: 57 | Z45: 2.61 | AA45: -2.35e-002 | AB45: -2.8799999999999999e-002 | AC45: -6.6799999999999998e-002 | AD45: -6.8499999999999991e-002 | AE45: 89.71 | AF45: 94.52 | AG45: 0.72 | AH45: AA | AI45: 4.0599999999999997e-002 | AJ45: =H45+100*O45 -> 142.11799999999999 | AK45: 144.1 | AL45: 26 | AM45: 49.5 | AN45: 44 | AO45: 5.2999999999999999e-002 | AP45: 15 | AQ45: 嘉美转债
A46: 45 | B46: 123122 | C46: 富瀚转债! | D46: 300613 | E46: 富瀚微 | F46: 电子 | G46: 芯片制造 | H46: 125.999 | I46: -4.4000000000000003e-003 | J46: -5.8999999999999999e-003 | K46: 114.22 | L46: -2.9500000000000002e-002 | M46: 120.3 | N46: 177.01 | O46: 0.95299999999999996 | P46: 64.53 | Q46: 已到 | R46: 5.48年 | S46: 3.48年 | T46: 5.81 | U46: 13 | V46: 1.7000000000000001e-002 | W46: 4.2000000000000003e-002 | X46: 2.7000000000000003e-002 | Y46: 137 | Z46: 8.39 | AA46: -8.6e-003 | AB46: -1.4800000000000001e-002 | AC46: -5.2600000000000001e-002 | AD46: -5.4400000000000004e-002 | AE46: 80.47 | AF46: 82.56 | AG46: 0.35 | AH46: A+ | AI46: 7.2599999999999998e-002 | AJ46: =H46+100*O46 -> 221.29899999999998 | AK46: 187.5 | AL46: 311 | AM46: 104.9 | AN46: 331 | AO46: -0.14599999999999999 | AP46: 7 | AQ46: 富瀚转债!
A47: 46 | B47: 123121 | C47: 帝尔转债! | D47: 300776 | E47: 帝尔激光 | F47: 机械装备 | G47: 专用设备 | H47: 145.3 | I47: -3.1300000000000001e-002 | J47: 2.1899999999999999e-002 | K47: 211.07 | L47: -1.37e-002 | M47: 121 | N47: 192.24 | O47: 0.32299999999999995 | P47: 109.8 | Q47: 已到 | R47: 5.47年 | S47: 3.47年 | T47: 8.4 | U47: 78 | V47: 6.3e-002 | W47: 3.7000000000000005e-002 | X47: 4.0999999999999995e-002 | Y47: 224 | Z47: 11.09 | AA47: -3.3500000000000002e-002 | AB47: -3.9699999999999999e-002 | AC47: -8.8699999999999987e-002 | AD47: -9.0399999999999994e-002 | AE47: 83.79 | AF47: 87.84 | AG47: 0.69 | AH47: AA- | AI47: 6.1600000000000002e-002 | AJ47: =H47+100*O47 -> 177.60000000000002 | AK47: 180.8 | AL47: 296 | AM47: 93 | AN47: 305 | AO47: -6.4000000000000001e-002 | AP47: 6 | AQ47: 帝尔转债!
A48: 47 | B48: 123120 | C48: 隆华转债 | D48: 300263 | E48: 隆华科技 | F48: 机械装备 | G48: 通用设备 | H48: 148.668 | I48: -2.3099999999999999e-002 | J48: 7.4000000000000003e-003 | K48: 8.89 | L48: -2.2000000000000002e-002 | M48: 121.1 | N48: 7.76 | O48: 0.29799999999999999 | P48: 114.56 | Q48: 已到 | R48: 5.46年 | S48: 3.46年 | T48: 7.99 | U48: 7.1 | V48: 6.0000000000000001e-003 | W48: 9.8000000000000004e-002 | X48: 0.113 | Y48: 81 | Z48: 2.82 | AA48: -3.7599999999999995e-002 | AB48: -4.3799999999999999e-002 | AC48: -9.4499999999999987e-002 | AD48: -9.6300000000000011e-002 | AE48: 84.03 | AF48: 88.02 | AG48: 0.71 | AH48: AA- | AI48: 6.1600000000000002e-002 | AJ48: =H48+100*O48 -> 178.46800000000002 | AK48: 182.8 | AL48: 300 | AM48: 94.8 | AN48: 307 | AO48: -5.4000000000000006e-002 | AP48: 4 | AQ48: 隆华转债
A49: 48 | B49: 110081 | C49: 闻泰转债 | D49: 600745 | E49: 闻泰科技 | F49: 电子 | G49: 电子行业 | H49: 146.16 | I49: -2.0199999999999999e-002 | J49: 7.0999999999999995e-003 | K49: 108.29 | L49: -1.9e-002 | M49: 111.9 | N49: 96.69 | O49: 0.30499999999999999 | P49: 112 | Q49: 已到 | R49: 5.45年 | S49: 3.45年 | T49: 86 | U49: 249 | V49: 2.e-002 | W49: 6.4000000000000001e-002 | X49: 7.0999999999999994e-002 | Y49: 1350. | Z49: 4.3 | AA49: -4.8300000000000003e-002 | AB49: -5.2000000000000005e-002 | AC49: -9.3900000000000011e-002 | AD49: -9.5000000000000001e-002 | AE49: 90.26 | AF49: 92.68 | AG49: 0.69 | AH49: AA+ | AI49: 3.56e-002 | AJ49: =H49+100*O49 -> 176.66 | AK49: 180.3 | AL49: 294 | AM49: 87.6 | AN49: 290 | AO49: -6.8000000000000005e-002 | AP49: 10 | AQ49: 闻泰转债
A50: 49 | B50: 118001 | C50: 金博转债 | D50: 688598 | E50: 金博股份 | F50: 能源电力 | G50: 太阳能 | H50: 141.44 | I50: -1.26e-002 | J50: -8.8999999999999999e-003 | K50: 244.48 | L50: -3.5499999999999997e-002 | M50: 121.6 | N50: 270.54 | O50: 0.56499999999999995 | P50: 90.37 | Q50: 已到 | R50: 5.44年 | S50: 3.44年 | T50: 6 | U50: 19 | V50: 2.2000000000000002e-002 | W50: 3.1e-002 | X50: 2.7999999999999997e-002 | Y50: 196 | Z50: 11.9 | AA50: -2.7999999999999997e-002 | AB50: -3.4500000000000003e-002 | AC50: -8.1099999999999992e-002 | AD50: -8.3199999999999996e-002 | AE50: 81.52 | AF50: 83.86 | AG50: 0.61 | AH50: A+ | AI50: 7.2599999999999998e-002 | AJ50: =H50+100*O50 -> 197.94 | AK50: 192.5 | AL50: 322 | AM50: 108.7 | AN50: 336 | AO50: -0.124 | AP50: 4 | AQ50: 金博转债
A51: 50 | B51: 113627 | C51: 太平转债! | D51: 603877 | E51: 太平鸟 | F51: 服装纺织 | G51: 服装行业 | H51: 113.08 | I51: -8.8999999999999999e-003 | J51: 7.4000000000000003e-003 | K51: 24.39 | L51: -2.4399999999999998e-002 | M51: 115.1 | N51: 50.32 | O51: 1.3300000000000001 | P51: 48.47 | Q51: 已到 | R51: 5.42年 | S51: 3.42年 | T51: 8 | U51: 33 | V51: 3.6000000000000004e-002 | W51: 6.9000000000000006e-002 | X51: 3.3000000000000002e-002 | Y51: 116 | Z51: 2.85 | AA51: 3.3e-003 | AB51: -1.7000000000000001e-003 | AC51: -2.4300000000000002e-002 | AD51: -2.6200000000000001e-002 | AE51: 89.95 | AF51: 93.16 | AG51: 0.06 | AH51: AA | AI51: 4.0599999999999997e-002 | AJ51: =H51+100*O51 -> 246.07999999999998 | AK51: 177.7 | AL51: 277 | AM51: 84.5 | AN51: 282 | AO51: -6.8000000000000005e-002 | AP51: 4 | AQ51: 太平转债!
A52: 51 | B52: 123119 | C52: 康泰转2! | D52: 300601 | E52: 康泰生物 | F52: 医药 | G52: 生物制药 | H52: 125.5 | I52: -8.6999999999999994e-003 | J52: -7.1999999999999998e-003 | K52: 78.74 | L52: -5.4400000000000004e-002 | M52: 117.1 | N52: 108.5 | O52: 0.72900000000000009 | P52: 72.57 | Q52: 已到 | R52: 5.42年 | S52: 3.42年 | T52: 20 | U52: 21 | V52: 9.0000000000000011e-003 | W52: 3.7000000000000005e-002 | X52: 2.7000000000000003e-002 | Y52: 541 | Z52: 6.36 | AA52: -1.29e-002 | AB52: -1.84e-002 | AC52: -5.2499999999999998e-002 | AD52: -5.4299999999999994e-002 | AE52: 89.95 | AF52: 94.78 | AG52: 0.29 | AH52: AA | AI52: 4.0599999999999997e-002 | AJ52: =H52+100*O52 -> 198.40000000000001 | AK52: 178.4 | AL52: 279 | AM52: 83.7 | AN52: 273 | AO52: -9.5000000000000001e-002 | AP52: 10 | AQ52: 康泰转2!
A53: 52 | B53: 127041 | C53: 弘亚转债! | D53: 2833 | E53: 弘亚数控 | F53: 机械装备 | G53: 专用设备 | H53: 119.4 | I53: -5.1000000000000004e-003 | J53: 1.4000000000000002e-003 | K53: 27.34 | L53: -1.26e-002 | M53: 118.75 | N53: 38.09 | O53: 0.66299999999999992 | P53: 71.78 | Q53: 已到 | R53: 4.41年 | S53: 2.41年 | T53: 6 | U53: 7.6 | V53: 1.1000000000000001e-002 | W53: 7.2000000000000008e-002 | X53: 5.2000000000000005e-002 | Y53: 83 | Z53: 4.15 | AA53: -1.2999999999999999e-003 | AB53: -8.6e-003 | AC53: -5.79e-002 | AD53: -5.96e-002 | AE53: 88.53 | AF53: 92.61 | AG53: 0.29 | AH53: AA- | AI53: 5.9000000000000004e-002 | AJ53: =H53+100*O53 -> 185.69999999999999 | AK53: 167 | AL53: 207 | AM53: 74.4 | AN53: 217 | AO53: -7.2999999999999995e-002 | AP53: 6 | AQ53: 弘亚转债!
A54: 53 | B54: 123118 | C54: 惠城转债 | D54: 300779 | E54: 惠城环保 | F54: 化工 | G54: 其他 | H54: 125.364 | I54: 2.8999999999999998e-003 | J54: -2.0799999999999999e-002 | K54: 15.63 | L54: -2.92e-002 | M54: 121.7 | N54: 17.11 | O54: 0.37200000000000005 | P54: 91.35 | Q54: 已到 | R54: 5.39年 | S54: 3.39年 | T54: 3.2 | U54: 7.2 | V54: 1.8000000000000002e-002 | W54: 0.20499999999999999 | X54: 0.187 | Y54: 16 | Z54: 2.35 | AA54: -5.6000000000000008e-003 | AB54: -1.24e-002 | AC54: -5.0099999999999999e-002 | AD54: -5.2300000000000006e-002 | AE54: 81.78 | AF54: 84.19 | AG54: 0.61 | AH54: A+ | AI54: 7.2599999999999998e-002 | AJ54: =H54+100*O54 -> 162.56400000000002 | AK54: 159.4 | AL54: 129 | AM54: 75.2 | AN54: 225 | AO54: -6.2e-002 | AP54: 10 | AQ54: 惠城转债
A55: 54 | B55: 127040 | C55: 国泰转债 | D55: 2091 | E55: 江苏国泰 | F55: 商业零售 | G55: 商业零售 | H55: 137.896 | I55: -5.4000000000000003e-003 | J55: -1.1299999999999999e-002 | K55: 11.25 | L55: -2.1700000000000001e-002 | M55: 112.5 | N55: 9.02 | O55: 0.106 | P55: 124.72 | Q55: 已到 | R55: 5.39年 | S55: 3.39年 | T55: 44.8 | U55: 130 | V55: 2.1000000000000001e-002 | W55: 0.255 | X55: 0.318 | Y55: 176 | Z55: 1.84 | AA55: -3.7599999999999995e-002 | AB55: -4.1500000000000002e-002 | AC55: -7.9100000000000004e-002 | AD55: -8.0500000000000002e-002 | AE55: 91.01 | AF55: 93.43 | AG55: 0.77 | AH55: AA+ | AI55: 3.56e-002 | AJ55: =H55+100*O55 -> 148.49599999999998 | AK55: 151.1 | AL55: 60 | AM55: 57.6 | AN55: 90 | AO55: -8.6999999999999994e-002 | AP55: 13 | AQ55: 国泰转债
A56: 55 | B56: 127039 | C56: 北港转债 | D56: 582 | E56: 北部湾港 | F56: 机场高速 | G56: 港口 | H56: 125.297 | I56: -7.9000000000000008e-003 | J56: 4.5000000000000005e-003 | K56: 8.32 | L56: -6.0000000000000001e-003 | M56: 113 | N56: 8.35 | O56: 0.25700000000000001 | P56: 99.64 | Q56: 已到 | R56: 5.37年 | S56: 3.37年 | T56: 30 | U56: 28 | V56: 6.9999999999999993e-003 | W56: 0.221 | X56: 0.22 | Y56: 136 | Z56: 1.27 | AA56: -1.9400000000000001e-002 | AB56: -2.3599999999999999e-002 | AC56: -5.2900000000000003e-002 | AD56: -5.4699999999999999e-002 | AE56: 92.17 | AF56: 94.93 | AG56: 0.57 | AH56: AAA | AI56: 3.3599999999999998e-002 | AJ56: =H56+100*O56 -> 150.99699999999999 | AK56: 151 | AL56: 59 | AM56: 56 | AN56: 78 | AO56: 4.2000000000000003e-002 | AP56: 7 | AQ56: 北港转债
A57: 56 | B57: 113626 | C57: 伯特转债! | D57: 603596 | E57: 伯特利 | F57: 汽车 | G57: 零部件制 | H57: 228.1 | I57: -5.0099999999999999e-002 | J57: -2.7300000000000001e-002 | K57: 67.72 | L57: -8.3000000000000004e-002 | M57: 121.1 | N57: 36.01 | O57: 0.21299999999999999 | P57: 188.06 | Q57: 已到 | R57: 5.37年 | S57: 3.37年 | T57: 9.02 | U57: 168 | V57: 8.1000000000000003e-002 | W57: 3.3000000000000002e-002 | X57: 6.0999999999999999e-002 | Y57: 277 | Z57: 8.74 | AA57: -0.113 | AB57: -0.11800000000000001 | AC57: -0.11 | AD57: -0.111 | AE57: 90.11 | AF57: 98.17 | AG57: 0.93 | AH57: AA | AI57: 4.0599999999999997e-002 | AJ57: =H57+100*O57 -> 249.40000000000001 | AK57: 268.1 | AL57: 363 | AM57: 170 | AN57: 362 | AO57: -0.106 | AP57: 4 | AQ57: 伯特转债!
A58: 57 | B58: 123117 | C58: 健帆转债! | D58: 300529 | E58: 健帆生物 | F58: 医药 | G58: 医疗器械 | H58: 117.7 | I58: -1.9e-003 | J58: 8.0000000000000004e-004 | K58: 46.45 | L58: -1.5300000000000001e-002 | M58: 115.1 | N58: 90.57 | O58: 1.29 | P58: 51.29 | Q58: 已到 | R58: 5.36年 | S58: 3.36年 | T58: 10 | U58: 5.6 | V58: 5.0000000000000001e-003 | W58: 2.7000000000000003e-002 | X58: 1.3999999999999999e-002 | Y58: 374 | Z58: 12.27 | AA58: -4.1999999999999997e-003 | AB58: -9.1999999999999998e-003 | AC58: -3.5900000000000001e-002 | AD58: -3.7699999999999997e-002 | AE58: 90.17 | AF58: 93.39 | AG58: 0.08 | AH58: AA | AI58: 4.0599999999999997e-002 | AJ58: =H58+100*O58 -> 246.69999999999999 | AK58: 184.1 | AL58: 303 | AM58: 90.7 | AN58: 301 | AO58: -9.0999999999999998e-002 | AP58: 9 | AQ58: 健帆转债!
A59: 58 | B59: 113051 | C59: 节能转债! | D59: 601016 | E59: 节能风电 | F59: 能源电力 | G59: 风能 | H59: 163.91 | I59: -2.8199999999999999e-002 | J59: 6.6e-003 | K59: 5.39 | L59: -2.7099999999999999e-002 | M59: 114.5 | N59: 4.05 | O59: 0.23199999999999998 | P59: 133.09 | Q59: 已到 | R59: 5.35年 | S59: 3.35年 | T59: 30 | U59: 105 | V59: 2.1000000000000001e-002 | W59: 0.111 | X59: 0.14800000000000002 | Y59: 270 | Z59: 2.62 | AA59: -6.5700000000000008e-002 | AB59: -7.0099999999999996e-002 | AC59: -0.121 | AD59: -0.122 | AE59: 91.15 | AF59: 95.23 | AG59: 0.8 | AH59: AA+ | AI59: 3.56e-002 | AJ59: =H59+100*O59 -> 187.10999999999999 | AK59: 194.7 | AL59: 326 | AM59: 99.5 | AN59: 319 | AO59: -6.0000000000000001e-003 | AP59: 9 | AQ59: 节能转债!
A60: 59 | B60: 113050 | C60: 南银转债 | D60: 601009 | E60: 南京银行 | F60: 金融 | G60: 银行行业 | H60: 124.95 | I60: 5.0000000000000001e-003 | J60: 9.7000000000000003e-003 | K60: 10.34 | L60: 2.4799999999999999e-002 | M60: 111.2 | N60: 10.1 | O60: 0.22 | P60: 102.38 | Q60: 已到 | R60: 5.33年 | S60: 无权 | T60: 200 | U60: 150 | V60: 6.0000000000000001e-003 | W60: 0.193 | X60: 0.19800000000000001 | Y60: 1035. | Z60: 0.98 | AA60: -2.1899999999999999e-002 | AB60: -2.5600000000000001e-002 | AC60: 无权 | AD60: 无权 | AE60: 无权 | AF60: 93.48 | AG60: 0.59 | AH60: AAA | AI60: 3.3599999999999998e-002 | AJ60: =H60+100*O60 -> 146.94999999999999 | AK60: 147.5 | AL60: 42 | AM60: 54 | AN60: 66 | AO60: 5.2999999999999999e-002 | AP60: 8 | AQ60: 南银转债
A61: 60 | B61: 113625 | C61: 江山转债! | D61: 603208 | E61: 江山欧派 | F61: 其他 | G61: 家居用品 | H61: 127.88 | I61: -8.8000000000000005e-003 | J61: -2.7000000000000001e-003 | K61: 77.91 | L61: -2.6099999999999998e-002 | M61: 124 | N61: 96.33 | O61: 0.58099999999999996 | P61: 80.88 | Q61: 已到 | R61: 5.32年 | S61: 3.32年 | T61: 5.83 | U61: 241 | V61: 0.309 | W61: 7.0999999999999994e-002 | X61: 5.7999999999999996e-002 | Y61: 82 | Z61: 4.46 | AA61: -5.8999999999999999e-003 | AB61: -1.3300000000000001e-002 | AC61: -5.8200000000000002e-002 | AD61: -6.0199999999999997e-002 | AE61: 84.55 | AF61: 90.82 | AG61: 0.44 | AH61: AA- | AI61: 6.1600000000000002e-002 | AJ61: =H61+100*O61 -> 185.97999999999999 | AK61: 174.9 | AL61: 266 | AM61: 84.1 | AN61: 277 | AO61: 1.e-002 | AP61: 8 | AQ61: 江山转债!
A62: 61 | B62: 127038 | C62: 国微转债! | D62: 2049 | E62: 紫光国微 | F62: 电子 | G62: 芯片制造 | H62: 180 | I62: -1.6399999999999998e-002 | J62: 1.23e-002 | K62: 195.68 | L62: -4.7999999999999996e-003 | M62: 114.5 | N62: 137.78 | O62: 0.26700000000000002 | P62: 142.02 | Q62: 已到 | R62: 5.32年 | S62: 3.32年 | T62: 14.9 | U62: 120 | V62: 4.4000000000000004e-002 | W62: 1.3000000000000001e-002 | X62: 1.8000000000000002e-002 | Y62: 1187. | Z62: 18.07 | AA62: -8.2599999999999993e-002 | AB62: -8.6800000000000002e-002 | AC62: -0.14300000000000002 | AD62: -0.14499999999999999 | AE62: 91.25 | AF62: 95.34 | AG62: 0.84 | AH62: AA+ | AI62: 3.56e-002 | AJ62: =H62+100*O62 -> 206.69999999999999 | AK62: 218 | AL62: 347 | AM62: 122.6 | AN62: 345 | AO62: -8.3000000000000004e-002 | AP62: 6 | AQ62: 国微转债!
A63: 62 | B63: 113049 | C63: 长汽转债 | D63: 601633 | E63: 长城汽车 | F63: 汽车 | G63: 乘用车 | H63: 138.49 | I63: -3.0699999999999998e-002 | J63: 7.4999999999999997e-003 | K63: 38.71 | L63: -3.95e-002 | M63: 110.5 | N63: 38.01 | O63: 0.35999999999999999 | P63: 101.84 | Q63: 已到 | R63: 5.32年 | S63: 3.32年 | T63: 35 | U63: 78 | V63: 1.6e-002 | W63: 1.e-002 | X63: 1.e-002 | Y63: 3575. | Z63: 6.1 | AA63: -4.2000000000000003e-002 | AB63: -4.5400000000000003e-002 | AC63: -8.3699999999999997e-002 | AD63: -8.48e-002 | AE63: 91.19 | AF63: 92.9 | AG63: 0.59 | AH63: AAA | AI63: 3.3599999999999998e-002 | AJ63: =H63+100*O63 -> 174.49000000000001 | AK63: 175.1 | AL63: 267 | AM63: 82.2 | AN63: 262 | AO63: -0.11 | AP63: 5 | AQ63: 长汽转债
A64: 63 | B64: 123116 | C64: 万兴转债 | D64: 300624 | E64: 万兴科技 | F64: 计算机及 | G64: 软件开发 | H64: 126.4 | I64: -1.06e-002 | J64: -9.1999999999999998e-003 | K64: 39.79 | L64: -3.8699999999999998e-002 | M64: 121.4 | N64: 49.78 | O64: 0.58099999999999996 | P64: 79.93 | Q64: 已到 | R64: 5.32年 | S64: 3.32年 | T64: 3.78 | U64: 17 | V64: 3.6000000000000004e-002 | W64: 7.2999999999999995e-002 | X64: 5.7999999999999996e-002 | Y64: 52 | Z64: 6.21 | AA64: -7.7000000000000002e-003 | AB64: -1.4499999999999999e-002 | AC64: -5.4100000000000002e-002 | AD64: -5.6299999999999996e-002 | AE64: 81.95 | AF64: 84.37 | AG64: 0.51 | AH64: A+ | AI64: 7.2599999999999998e-002 | AJ64: =H64+100*O64 -> 184.5 | AK64: 172.9 | AL64: 256 | AM64: 88.5 | AN64: 295 | AO64: -0.16800000000000001 | AP64: 8 | AQ64: 万兴转债
A65: 64 | B65: 123115 | C65: 捷捷转债 | D65: 300623 | E65: 捷捷微电 | F65: 电子 | G65: 元器件制 | H65: 133.67 | I65: -1.8500000000000003e-002 | J65: 3.7000000000000002e-003 | K65: 26.56 | L65: -2.5699999999999997e-002 | M65: 118.5 | N65: 29 | O65: 0.45899999999999996 | P65: 91.59 | Q65: 已到 | R65: 5.32年 | S65: 3.32年 | T65: 11.9 | U65: 18 | V65: 1.1000000000000001e-002 | W65: 6.0999999999999999e-002 | X65: 5.5999999999999994e-002 | Y65: 196 | Z65: 6.88 | AA65: -2.2799999999999997e-002 | AB65: -2.87e-002 | AC65: -7.0599999999999996e-002 | AD65: -7.2499999999999995e-002 | AE65: 84.52 | AF65: 86.84 | AG65: 0.58 | AH65: AA- | AI65: 6.1600000000000002e-002 | AJ65: =H65+100*O65 -> 179.56999999999999 | AK65: 175.8 | AL65: 269 | AM65: 88.9 | AN65: 296 | AO65: -5.7999999999999996e-002 | AP65: 8 | AQ65: 捷捷转债
A66: 65 | B66: 127037 | C66: 银轮转债 | D66: 2126 | E66: 银轮股份 | F66: 汽车 | G66: 零部件制 | H66: 136.9 | I66: -3.1099999999999999e-002 | J66: 2.35e-002 | K66: 10.22 | L66: -1.4499999999999999e-002 | M66: 115.1 | N66: 10.77 | O66: 0.44299999999999995 | P66: 94.89 | Q66: 已到 | R66: 5.31年 | S66: 3.31年 | T66: 7 | U66: 15 | V66: 1.4999999999999999e-002 | W66: 8.5999999999999993e-002 | X66: 8.199999999999999e-002 | Y66: 81 | Z66: 1.92 | AA66: -3.27e-002 | AB66: -3.7499999999999999e-002 | AC66: -7.7600000000000002e-002 | AD66: -7.9299999999999995e-002 | AE66: 90.32 | AF66: 93.55 | AG66: 0.53 | AH66: AA | AI66: 4.0599999999999997e-002 | AJ66: =H66+100*O66 -> 181.19999999999999 | AK66: 178.9 | AL66: 281 | AM66: 85.4 | AN66: 283 | AO66: -0.13 | AP66: 3 | AQ66: 银轮转债
A67: 66 | B67: 127036 | C67: 三花转债 | D67: 2050 | E67: 三花智控 | F67: 机械装备 | G67: 通用设备 | H67: 129.3 | I67: -6.0999999999999995e-003 | J67: -1.8e-003 | K67: 18.83 | L67: -1.8799999999999997e-002 | M67: 114.5 | N67: 21.55 | O67: 0.47999999999999998 | P67: 87.38 | Q67: 已到 | R67: 5.30年 | S67: 3.30年 | T67: 30 | U67: 20 | V67: 5.0000000000000001e-003 | W67: 4.4000000000000004e-002 | X67: 3.9e-002 | Y67: 676 | Z67: 6.55 | AA67: -2.3e-002 | AB67: -2.7699999999999999e-002 | AC67: -6.3899999999999998e-002 | AD67: -6.54e-002 | AE67: 91.32 | AF67: 95.42 | AG67: 0.43 | AH67: AA+ | AI67: 3.56e-002 | AJ67: =H67+100*O67 -> 177.30000000000001 | AK67: 171.2 | AL67: 240 | AM67: 75.8 | AN67: 233 | AO67: -0.159 | AP67: 7 | AQ67: 三花转债
A68: 67 | B68: 127035 | C68: 濮耐转债 | D68: 2225 | E68: 濮耐股份 | F68: 钢铁 | G68: 钢铁行业 | H68: 126.66 | I68: -8.6999999999999994e-003 | J68: -2.5999999999999999e-003 | K68: 4.2 | L68: -2.3300000000000001e-002 | M68: 114.7 | N68: 4.43 | O68: 0.33600000000000002 | P68: 94.81 | Q68: 已到 | R68: 4.28年 | S68: 2.28年 | T68: 6.26 | U68: 5.9 | V68: 6.9999999999999993e-003 | W68: 0.14800000000000002 | X68: 0.14000000000000001 | Y68: 42 | Z68: 1.39 | AA68: -2.3399999999999997e-002 | AB68: -2.9300000000000003e-002 | AC68: -8.0199999999999994e-002 | AD68: -8.2599999999999993e-002 | AE68: 94.47 | AF68: 98.14 | AG68: 0.48 | AH68: AA | AI68: 3.7999999999999999e-002 | AJ68: =H68+100*O68 -> 160.25999999999999 | AK68: 158.5 | AL68: 122 | AM68: 60.4 | AN68: 110 | AO68: -3.7000000000000005e-002 | AP68: 9 | AQ68: 濮耐转债
A69: 68 | B69: 123114 | C69: 三角转债! | D69: 300775 | E69: 三角防务 | F69: 航空航天 | G69: 航空航天 | H69: 172.69 | I69: -8.6999999999999994e-003 | J69: -1.4199999999999999e-002 | K69: 42.89 | L69: -2.8300000000000002e-002 | M69: 121 | N69: 31.82 | O69: 0.28100000000000003 | P69: 134.79 | Q69: 已到 | R69: 5.28年 | S69: 3.28年 | T69: 9.04 | U69: 69 | V69: 4.4000000000000004e-002 | W69: 4.2999999999999997e-002 | X69: 5.7000000000000002e-002 | Y69: 213 | Z69: 9.83 | AA69: -6.6400000000000001e-002 | AB69: -7.2499999999999995e-002 | AC69: -0.13400000000000001 | AD69: -0.13600000000000001 | AE69: 84.78 | AF69: 88.88 | AG69: 0.81 | AH69: AA- | AI69: 6.1600000000000002e-002 | AJ69: =H69+100*O69 -> 200.78999999999999 | AK69: 210.6 | AL69: 341 | AM69: 121.7 | AN69: 344 | AO69: -1.4999999999999999e-002 | AP69: 7 | AQ69: 三角转债!
A70: 69 | B70: 111000 | C70: 起帆转债 | D70: 605222 | E70: 起帆电缆 | F70: 能源电力 | G70: 电力设备 | H70: 139.2 | I70: -2.9700000000000001e-002 | J70: 4.5999999999999999e-003 | K70: 23.92 | L70: -3.39e-002 | M70: 120.5 | N70: 20.1 | O70: 0.17000000000000001 | P70: 119 | Q70: 已到 | R70: 5.27年 | S70: 3.27年 | T70: 10 | U70: 20 | V70: 1.4999999999999999e-002 | W70: 0.10000000000000001 | X70: 0.11900000000000001 | Y70: 100 | Z70: 2.88 | AA70: -2.75e-002 | AB70: -3.39e-002 | AC70: -8.2400000000000001e-002 | AD70: -8.4199999999999997e-002 | AE70: 84.73 | AF70: 88.51 | AG70: 0.74 | AH70: AA- | AI70: 6.1600000000000002e-002 | AJ70: =H70+100*O70 -> 156.19999999999999 | AK70: 159.4 | AL70: 130 | AM70: 70.9 | AN70: 190 | AO70: -4.2999999999999997e-002 | AP70: 10 | AQ70: 起帆转债
A71: 70 | B71: 127034 | C71: 绿茵转债! | D71: 2887 | E71: 绿茵生态 | F71: 城市公用 | G71: 生态环境 | H71: 110.931 | I71: -6.8999999999999999e-003 | J71: -2.3e-003 | K71: 9.89 | L71: -1.9799999999999998e-002 | M71: 119 | N71: 12.38 | O71: 0.38900000000000001 | P71: 79.89 | Q71: 已到 | R71: 5.21年 | S71: 3.21年 | T71: 7.12 | U71: 16 | V71: 2.e-002 | W71: 0.23100000000000001 | X71: 0.184 | Y71: 31 | Z71: 1.51 | AA71: 1.3899999999999999e-002 | AB71: 7.4000000000000003e-003 | AC71: -1.9299999999999998e-002 | AD71: -2.1499999999999998e-002 | AE71: 85.13 | AF71: 87.78 | AG71: 0.47 | AH71: AA- | AI71: 6.1600000000000002e-002 | AJ71: =H71+100*O71 -> 149.83099999999999 | AK71: 142 | AL71: 21 | AM71: 54.2 | AN71: 67 | AO71: 1.6e-002 | AP71: 44 | AQ71: 绿茵转债!
A72: 71 | B72: 113624 | C72: 正川转债! | D72: 603976 | E72: 正川股份 | F72: 医药 | G72: 医药行业 | H72: 115.95 | I72: -3.3e-003 | J72: -6.7000000000000002e-003 | K72: 29.59 | L72: -3.27e-002 | M72: 121.6 | N72: 46.69 | O72: 0.82999999999999996 | P72: 63.38 | Q72: 已到 | R72: 5.20年 | S72: 3.20年 | T72: 4.05 | U72: 4.7 | V72: 1.e-002 | W72: 9.0999999999999998e-002 | X72: 5.7000000000000002e-002 | Y72: 45 | Z72: 4.05 | AA72: 9.3999999999999986e-003 | AB72: 2.2000000000000001e-003 | AC72: -3.0499999999999999e-002 | AD72: -3.3000000000000002e-002 | AE72: 82.87 | AF72: 85.25 | AG72: 0.3 | AH72: A+ | AI72: 7.2599999999999998e-002 | AJ72: =H72+100*O72 -> 198.94999999999999 | AK72: 168.5 | AL72: 221 | AM72: 83.3 | AN72: 270 | AO72: -8.9999999999999997e-002 | AP72: 24 | AQ72: 正川转债!
A73: 72 | B73: 113048 | C73: 晶科转债!! | D73: 601778 | E73: 晶科科技 | F73: 能源电力 | G73: 太阳能 | H73: 157.31 | I73: -1.61e-002 | J73: -4.0999999999999995e-003 | K73: 6.72 | L73: -2.75e-002 | M73: 117.1 | N73: 5.46 | O73: 0.27800000000000002 | P73: 123.08 | Q73: 已到 | R73: 5.19年 | S73: 3.19年 | T73: 23 | U73: 78 | V73: 2.2000000000000002e-002 | W73: 0.11800000000000001 | X73: 0.14499999999999999 | Y73: 194 | Z73: 1.64 | AA73: -5.62e-002 | AB73: -6.1500000000000006e-002 | AC73: -0.115 | AD73: -0.11699999999999999 | AE73: 90.77 | AF73: 95.64 | AG73: 0.73 | AH73: AA | AI73: 4.0599999999999997e-002 | AJ73: =H73+100*O73 -> 185.11000000000001 | AK73: 191.5 | AL73: 319 | AM73: 95.9 | AN73: 314 | AO73: -5.9999999999999998e-002 | AP73: 14 | AQ73: 晶科转债!!
A74: 73 | B74: 123113 | C74: 仙乐转债! | D74: 300791 | E74: 仙乐健康 | F74: 食品饮料 | G74: 食品饮料 | H74: 116.801 | I74: -8.5000000000000006e-003 | J74: -1.5e-003 | K74: 35.3 | L74: -4.0800000000000003e-002 | M74: 118.5 | N74: 56.88 | O74: 0.88200000000000001 | P74: 62.06 | Q74: 已到 | R74: 5.18年 | S74: 3.18年 | T74: 10.2 | U74: 3.6 | V74: 3.0000000000000001e-003 | W74: 0.161 | X74: 0.10000000000000001 | Y74: 64 | Z74: 2.74 | AA74: 2.8999999999999998e-003 | AB74: -3.4000000000000002e-003 | AC74: -3.49e-002 | AD74: -3.7000000000000005e-002 | AE74: 85.21 | AF74: 87.55 | AG74: 0.25 | AH74: AA- | AI74: 6.1600000000000002e-002 | AJ74: =H74+100*O74 -> 205.001 | AK74: 171.5 | AL74: 247 | AM74: 84 | AN74: 275 | AO74: -0.14499999999999999 | AP74: 6 | AQ74: 仙乐转债!
A75: 74 | B75: 127033 | C75: 中装转2! | D75: 2822 | E75: 中装建设 | F75: 建筑 | G75: 装饰工程 | H75: 126.9 | I75: -6.3e-003 | J75: -8.199999999999999e-003 | K75: 6.21 | L75: -2.6600000000000002e-002 | M75: 117.1 | N75: 6.28 | O75: 0.28300000000000003 | P75: 98.89 | Q75: 已到 | R75: 5.17年 | S75: 3.17年 | T75: 11.6 | U75: 39 | V75: 2.6000000000000002e-002 | W75: 0.25900000000000001 | X75: 0.25600000000000001 | Y75: 45 | Z75: 1.28 | AA75: -1.5700000000000002e-002 | AB75: -2.1400000000000002e-002 | AC75: -5.9500000000000004e-002 | AD75: -6.13e-002 | AE75: 90.84 | AF75: 95.71 | AG75: 0.54 | AH75: AA | AI75: 4.0599999999999997e-002 | AJ75: =H75+100*O75 -> 155.20000000000002 | AK75: 154.9 | AL75: 89 | AM75: 59.2 | AN75: 100 | AO75: 4.0999999999999995e-002 | AP75: 28 | AQ75: 中装转2!
A76: 75 | B76: 110080 | C76: 东湖转债 | D76: 600133 | E76: 东湖高新 | F76: 建筑 | G76: 建筑工程 | H76: 117.18 | I76: -4.4000000000000003e-003 | J76: 2.7000000000000001e-003 | K76: 5.52 | L76: -3.5999999999999999e-003 | M76: 115.1 | N76: 6.05 | O76: 0.28399999999999997 | P76: 91.24 | Q76: 已到 | R76: 5年58天 | S76: 3年58天 | T76: 15.5 | U76: 34 | V76: 1.8000000000000002e-002 | W76: 0.35299999999999998 | X76: 0.32200000000000001 | Y76: 44 | Z76: 0.78 | AA76: -3.4999999999999996e-003 | AB76: -8.6999999999999994e-003 | AC76: -3.6699999999999997e-002 | AD76: -3.8599999999999995e-002 | AE76: 90.88 | AF76: 94.12 | AG76: 0.49 | AH76: AA | AI76: 4.0599999999999997e-002 | AJ76: =H76+100*O76 -> 145.58000000000001 | AK76: 143.1 | AL76: 22 | AM76: 49 | AN76: 41 | AO76: 2.2000000000000002e-002 | AP76: 33 | AQ76: 东湖转债
A77: 76 | B77: 127032 | C77: 苏行转债 | D77: 2966 | E77: 苏州银行 | F77: 金融 | G77: 银行行业 | H77: 119.3 | I77: 5.8999999999999999e-003 | J77: -2.8999999999999998e-003 | K77: 7.17 | L77: 6.9999999999999993e-003 | M77: 115.1 | N77: 8.1 | O77: 0.34799999999999998 | P77: 88.52 | Q77: 已到 | R77: 5年58天 | S77: 无权 | T77: 50 | U77: 83 | V77: 1.3999999999999999e-002 | W77: 0.20899999999999999 | X77: 0.185 | Y77: 239 | Z77: 0.76 | AA77: -6.9999999999999993e-003 | AB77: -1.2199999999999999e-002 | AC77: 无权 | AD77: 无权 | AE77: 无权 | AF77: 97.37 | AG77: 0.42 | AH77: AAA | AI77: 3.3599999999999998e-002 | AJ77: =H77+100*O77 -> 154.09999999999999 | AK77: 150.1 | AL77: 54 | AM77: 52.7 | AN77: 54 | AO77: 3.2000000000000001e-002 | AP77: 11 | AQ77: 苏行转债
A78: 77 | B78: 113047 | C78: 旗滨转债! | D78: 601636 | E78: 旗滨集团 | F78: 建筑 | G78: 玻璃 | H78: 177.69 | I78: 3.4000000000000002e-003 | J78: 1.6000000000000001e-003 | K78: 18.18 | L78: 6.0999999999999995e-003 | M78: 114 | N78: 12.8 | O78: 0.251 | P78: 142.03 | Q78: 已到 | R78: 5年55天 | S78: 3年55天 | T78: 15 | U78: 455 | V78: 0.16800000000000001 | W78: 3.1e-002 | X78: 4.4000000000000004e-002 | Y78: 488 | Z78: 3.98 | AA78: -8.3599999999999994e-002 | AB78: -8.7799999999999989e-002 | AC78: -0.14899999999999999 | AD78: -0.14999999999999999 | AE78: 91.34 | AF78: 95.46 | AG78: 0.83 | AH78: AA+ | AI78: 3.56e-002 | AJ78: =H78+100*O78 -> 202.78999999999999 | AK78: 213.3 | AL78: 342 | AM78: 117.9 | AN78: 343 | AO78: 5.9999999999999998e-002 | AP78: 7 | AQ78: 旗滨转债!
A79: 78 | B79: 123112 | C79: 万讯转债! | D79: 300112 | E79: 万讯自控 | F79: 机械装备 | G79: 专用设备 | H79: 139.977 | I79: -3.85e-002 | J79: 2.2000000000000001e-003 | K79: 10.66 | L79: -5.16e-002 | M79: 124.4 | N79: 8.93 | O79: 0.17300000000000001 | P79: 119.37 | Q79: 已到 | R79: 5年54天 | S79: 3年54天 | T79: 2.45 | U79: 42 | V79: 0.11900000000000001 | W79: 8.1000000000000003e-002 | X79: 9.6000000000000002e-002 | Y79: 30 | Z79: 2.8 | AA79: -2.3099999999999999e-002 | AB79: -3.0699999999999998e-002 | AC79: -8.5699999999999998e-002 | AD79: -8.7899999999999992e-002 | AE79: 85.78 | AF79: 92.11 | AG79: 0.7 | AH79: AA- | AI79: 6.1600000000000002e-002 | AJ79: =H79+100*O79 -> 157.27700000000002 | AK79: 160.6 | AL79: 147 | AM79: 68.5 | AN79: 174 | AO79: -0.11699999999999999 | AP79: 14 | AQ79: 万讯转债!
A80: 79 | B80: 113623 | C80: 凤21转债 | D80: 603225 | E80: 新凤鸣 | F80: 化工 | G80: 化纤 | H80: 128 | I80: -1.5e-003 | J80: -1.2999999999999999e-003 | K80: 14.91 | L80: -6.0000000000000001e-003 | M80: 117.1 | N80: 16.47 | O80: 0.41399999999999998 | P80: 90.53 | Q80: 已到 | R80: 5年54天 | S80: 3年54天 | T80: 25 | U80: 41 | V80: 1.3000000000000001e-002 | W80: 0.11 | X80: 9.9000000000000005e-002 | Y80: 228 | Z80: 1.44 | AA80: -1.7500000000000002e-002 | AB80: -2.3099999999999999e-002 | AC80: -6.2300000000000001e-002 | AD80: -6.4199999999999993e-002 | AE80: 90.92 | AF80: 95.8 | AG80: 0.46 | AH80: AA | AI80: 4.0599999999999997e-002 | AJ80: =H80+100*O80 -> 169.40000000000001 | AK80: 165.5 | AL80: 196 | AM80: 69.7 | AN80: 179 | AO80: 1.3999999999999999e-002 | AP80: 4 | AQ80: 凤21转债
A81: 80 | B81: 123111 | C81: 东财转3!* | D81: 300059 | E81: 东方财富 | F81: 金融 | G81: 证券行业 | H81: 135.656 | I81: -1.3100000000000001e-002 | J81: 2.9999999999999997e-004 | K81: 31.73 | L81: -1.2800000000000001e-002 | M81: 110.5 | N81: 23.35 | O81: -2.e-003 | P81: 135.89 | Q81: 已到 | R81: 16天 | S81: 无权 | T81: 122 | U81: 997 | V81: 5.9000000000000004e-002 | W81: 3.7000000000000005e-002 | X81: 5.0999999999999997e-002 | Y81: 3289. | Z81: 8.41 | AA81: <-100% | AB81: <-100% | AC81: 无权 | AD81: 无权 | AE81: 无权 | AF81: 100.08 | AG81: 1 | AH81: AA+ | AI81: 2.3900000000000001e-002 | AJ81: =H81+100*O81 -> 135.45600000000002 | AK81: 135.4 | AL81: 6 | AM81: 35.3 | AN81: 9 | AO81: -2.9999999999999999e-002 | AP81: 28 | AQ81: 东财转3!*
A82: 81 | B82: 123109 | C82: 昌红转债! | D82: 300151 | E82: 昌红科技 | F82: 机械装备 | G82: 专用设备 | H82: 138.681 | I82: -2.9500000000000002e-002 | J82: -1.e-003 | K82: 29.57 | L82: -4.7100000000000003e-002 | M82: 121 | N82: 28.06 | O82: 0.316 | P82: 105.38 | Q82: 已到 | R82: 5年47天 | S82: 3年47天 | T82: 4.6 | U82: 13 | V82: 2.1000000000000001e-002 | W82: 3.1e-002 | X82: 3.3000000000000002e-002 | Y82: 149 | Z82: 14.38 | AA82: -2.6800000000000001e-002 | AB82: -3.3500000000000002e-002 | AC82: -8.4600000000000009e-002 | AD82: -8.6599999999999996e-002 | AE82: 85.54 | AF82: 89.67 | AG82: 0.65 | AH82: AA- | AI82: 6.1600000000000002e-002 | AJ82: =H82+100*O82 -> 170.28100000000001 | AK82: 172 | AL82: 251 | AM82: 82.3 | AN82: 263 | AO82: -0.12 | AP82: 6 | AQ82: 昌红转债!
A83: 82 | B83: 123110 | C83: 九典转债 | D83: 300705 | E83: 九典制药 | F83: 医药 | G83: 化学制药 | H83: 131.599 | I83: -2.5099999999999997e-002 | J83: -1.8700000000000001e-002 | K83: 26.89 | L83: -6.6000000000000003e-002 | M83: 121.4 | N83: 26.44 | O83: 0.29399999999999998 | P83: 101.7 | Q83: 已到 | R83: 5年47天 | S83: 3年47天 | T83: 2.7 | U83: 30 | V83: 8.199999999999999e-002 | W83: 4.2999999999999997e-002 | X83: 4.2999999999999997e-002 | Y83: 63 | Z83: 6.34 | AA83: -1.6e-002 | AB83: -2.29e-002 | AC83: -6.8499999999999991e-002 | AD83: -7.0800000000000002e-002 | AE83: 83.11 | AF83: 85.5 | AG83: 0.66 | AH83: A+ | AI83: 7.2599999999999998e-002 | AJ83: =H83+100*O83 -> 160.999 | AK83: 161.5 | AL83: 155 | AM83: 76 | AN83: 234 | AO83: -0.129 | AP83: 11 | AQ83: 九典转债
A84: 83 | B84: 123108 | C84: 乐普转2! | D84: 300003 | E84: 乐普医疗 | F84: 医药 | G84: 医疗器械 | H84: 119.401 | I84: -6.1999999999999998e-003 | J84: 2.9999999999999997e-004 | K84: 20.85 | L84: -2.98e-002 | M84: 111.1 | N84: 29.5 | O84: 0.68900000000000006 | P84: 70.68 | Q84: 已到 | R84: 4年45天 | S84: 2年45天 | T84: 16.4 | U84: 13 | V84: 6.0000000000000001e-003 | W84: 4.4000000000000004e-002 | X84: 3.1e-002 | Y84: 376 | Z84: 3.27 | AA84: -1.7600000000000001e-002 | AB84: -2.2400000000000003e-002 | AC84: -6.6500000000000004e-002 | AD84: -6.8099999999999994e-002 | AE84: 94.78 | AF84: 97.36 | AG84: 0.2 | AH84: AA+ | AI84: 3.3000000000000002e-002 | AJ84: =H84+100*O84 -> 188.30099999999999 | AK84: 168.1 | AL84: 216 | AM84: 70.8 | AN84: 189 | AO84: -9.4e-002 | AP84: 13 | AQ84: 乐普转2!
A85: 84 | B85: 123107 | C85: 温氏转债! | D85: 300498 | E85: 温氏股份 | F85: 农业 | G85: 畜牧业 | H85: 141.754 | I85: -2.0799999999999999e-002 | J85: 7.9000000000000008e-003 | K85: 21.6 | L85: -1.7299999999999999e-002 | M85: 113 | N85: 17.62 | O85: 0.156 | P85: 122.59 | Q85: 已到 | R85: 5年44天 | S85: 3年44天 | T85: 93 | U85: 340 | V85: 2.6000000000000002e-002 | W85: 6.8000000000000005e-002 | X85: 8.3000000000000004e-002 | Y85: 1372. | Z85: 3.91 | AA85: -4.41e-002 | AB85: -4.8300000000000003e-002 | AC85: -9.1899999999999996e-002 | AD85: -9.3599999999999989e-002 | AE85: 92.94 | AF85: 95.72 | AG85: 0.75 | AH85: AAA | AI85: 3.3599999999999998e-002 | AJ85: =H85+100*O85 -> 157.35399999999998 | AK85: 160.9 | AL85: 150 | AM85: 65.2 | AN85: 153 | AO85: 7.5999999999999998e-002 | AP85: 12 | AQ85: 温氏转债!
A86: 85 | B86: 110079 | C86: 杭银转债! | D86: 600926 | E86: 杭州银行 | F86: 金融 | G86: 银行行业 | H86: 128.26 | I86: -7.1999999999999998e-003 | J86: 1.6500000000000001e-002 | K86: 15.09 | L86: 1.34e-002 | M86: 112.4 | N86: 12.99 | O86: 0.10400000000000001 | P86: 116.17 | Q86: 已到 | R86: 5年44天 | S86: 无权 | T86: 150 | U86: 495 | V86: 2.5000000000000001e-002 | W86: 0.16800000000000001 | X86: 0.19500000000000001 | Y86: 895 | Z86: 1.29 | AA86: -2.58e-002 | AB86: -3.0099999999999998e-002 | AC86: 无权 | AD86: 无权 | AE86: 无权 | AF86: 95.17 | AG86: 0.69 | AH86: AAA | AI86: 3.3599999999999998e-002 | AJ86: =H86+100*O86 -> 138.66 | AK86: 140.4 | AL86: 13 | AM86: 45.2 | AN86: 30 | AO86: 7.0000000000000007e-002 | AP86: 13 | AQ86: 杭银转债!
A87: 86 | B87: 113622 | C87: 杭叉转债! | D87: 603298 | E87: 杭叉集团 | F87: 机械装备 | G87: 通用设备 | H87: 120.67 | I87: 1.7000000000000001e-003 | J87: -6.9999999999999993e-003 | K87: 16.47 | L87: -2.0199999999999999e-002 | M87: 112.5 | N87: 23.08 | O87: 0.69099999999999995 | P87: 71.36 | Q87: 已到 | R87: 5年40天 | S87: 3年40天 | T87: 11.5 | U87: 28 | V87: 2.1000000000000001e-002 | W87: 8.1000000000000003e-002 | X87: 5.7999999999999996e-002 | Y87: 143 | Z87: 2.7 | AA87: -1.38e-002 | AB87: -1.8200000000000001e-002 | AC87: -4.7400000000000005e-002 | AD87: -4.9100000000000005e-002 | AE87: 91.92 | AF87: 94.37 | AG87: 0.26 | AH87: AA+ | AI87: 3.56e-002 | AJ87: =H87+100*O87 -> 189.76999999999998 | AK87: 170 | AL87: 229 | AM87: 75.6 | AN87: 230 | AO87: -4.0000000000000001e-002 | AP87: 5 | AQ87: 杭叉转债!
A88: 87 | B88: 127031 | C88: 洋丰转债! | D88: 902 | E88: 新洋丰 | F88: 化工 | G88: 农化 | H88: 127.61 | I88: -3.8e-003 | J88: -4.0999999999999995e-003 | K88: 17.01 | L88: -1.5600000000000001e-002 | M88: 117.1 | N88: 17.76 | O88: 0.33200000000000002 | P88: 95.78 | Q88: 已到 | R88: 5年40天 | S88: 3年40天 | T88: 10 | U88: 44 | V88: 3.4000000000000002e-002 | W88: 4.4999999999999998e-002 | X88: 4.2999999999999997e-002 | Y88: 222 | Z88: 2.95 | AA88: -1.7000000000000001e-002 | AB88: -2.2700000000000001e-002 | AC88: -6.2199999999999998e-002 | AD88: -6.4000000000000001e-002 | AE88: 91.06 | AF88: 95.94 | AG88: 0.51 | AH88: AA | AI88: 4.0599999999999997e-002 | AJ88: =H88+100*O88 -> 160.81 | AK88: 159.4 | AL88: 131 | AM88: 63.5 | AN88: 134 | AO88: 1.9e-002 | AP88: 7 | AQ88: 洋丰转债!
A89: 88 | B89: 123106 | C89: 正丹转债! | D89: 300641 | E89: 正丹股份 | F89: 化工 | G89: 化工 | H89: 120.069 | I89: -1.6200000000000003e-002 | J89: 4.7999999999999996e-003 | K89: 6.52 | L89: -2.4e-002 | M89: 125.5 | N89: 7.5 | O89: 0.38100000000000001 | P89: 86.93 | Q89: 已到 | R89: 5年39天 | S89: 3年39天 | T89: 3.2 | U89: 6 | V89: 1.4999999999999999e-002 | W89: 0.10000000000000001 | X89: 8.6999999999999994e-002 | Y89: 32 | Z89: 2.23 | AA89: 8.8999999999999999e-003 | AB89: 5.0000000000000001e-004 | AC89: -4.3799999999999999e-002 | AD89: -4.5899999999999996e-002 | AE89: 85.58 | AF89: 93.08 | AG89: 0.48 | AH89: AA- | AI89: 6.1600000000000002e-002 | AJ89: =H89+100*O89 -> 158.16900000000001 | AK89: 153.2 | AL89: 77 | AM89: 60.1 | AN89: 108 | AO89: -4.0000000000000001e-002 | AP89: 19 | AQ89: 正丹转债!
A90: 89 | B90: 128145 | C90: 日丰转债! | D90: 2953 | E90: 日丰股份 | F90: 家电 | G90: 零部件制 | H90: 135.15 | I90: -2.6200000000000001e-002 | J90: 7.6e-003 | K90: 15.53 | L90: -2.5099999999999997e-002 | M90: 115.4 | N90: 13.66 | O90: 0.18899999999999997 | P90: 113.69 | Q90: 已到 | R90: 5年37天 | S90: 3年37天 | T90: 3.8 | U90: 21 | V90: 4.2000000000000003e-002 | W90: 0.10000000000000001 | X90: 0.114 | Y90: 38 | Z90: 3.31 | AA90: -3.1099999999999999e-002 | AB90: -3.6200000000000003e-002 | AC90: -7.8399999999999997e-002 | AD90: -8.0299999999999996e-002 | AE90: 85.51 | AF90: 85.64 | AG90: 0.74 | AH90: AA- | AI90: 6.1600000000000002e-002 | AJ90: =H90+100*O90 -> 154.05000000000001 | AK90: 156.6 | AL90: 106 | AM90: 71 | AN90: 192 | AO90: -4.4999999999999998e-002 | AP90: 10 | AQ90: 日丰转债!
A91: 90 | B91: 127030 | C91: 盛虹转债! | D91: 301 | E91: 东方盛虹 | F91: 化工 | G91: 化纤 | H91: 166.2 | I91: -1.0700000000000001e-002 | J91: -7.4000000000000003e-003 | K91: 17.78 | L91: -2.2499999999999999e-002 | M91: 112.5 | N91: 13.53 | O91: 0.26500000000000001 | P91: 131.41 | Q91: 已到 | R91: 5年37天 | S91: 3年37天 | T91: 50 | U91: 105 | V91: 1.3000000000000001e-002 | W91: 4.7e-002 | X91: 6.2e-002 | Y91: 1057. | Z91: 7.58 | AA91: -7.4700000000000003e-002 | AB91: -7.8600000000000003e-002 | AC91: -0.13300000000000001 | AD91: -0.13500000000000001 | AE91: 91.95 | AF91: 94.4 | AG91: 0.8 | AH91: AA+ | AI91: 3.56e-002 | AJ91: =H91+100*O91 -> 192.69999999999999 | AK91: 201 | AL91: 334 | AM91: 106.6 | AN91: 334 | AO91: -3.9e-002 | AP91: 5 | AQ91: 盛虹转债!
A92: 91 | B92: 113046 | C92: 金田转债! | D92: 601609 | E92: 金田铜业 | F92: 有色金属 | G92: 铜金属 | H92: 118.93 | I92: -1.29e-002 | J92: 1.0200000000000001e-002 | K92: 8.42 | L92: -8.199999999999999e-003 | M92: 114.9 | N92: 10.75 | O92: 0.51800000000000002 | P92: 78.33 | Q92: 已到 | R92: 5年37天 | S92: 3年37天 | T92: 15 | U92: 8.9 | V92: 5.0000000000000001e-003 | W92: 0.12 | X92: 9.4e-002 | Y92: 125 | Z92: 1.77 | AA92: -6.8999999999999999e-003 | AB92: -1.2e-002 | AC92: -4.2199999999999994e-002 | AD92: -4.41e-002 | AE92: 92.33 | AF92: 96.45 | AG92: 0.32 | AH92: AA+ | AI92: 3.56e-002 | AJ92: =H92+100*O92 -> 170.73000000000002 | AK92: 159.5 | AL92: 133 | AM92: 63.1 | AN92: 131 | AO92: -1.e-003 | AP92: 13 | AQ92: 金田转债!
A93: 92 | B93: 127029 | C93: 中钢转债! | D93: 928 | E93: 中钢国际 | F93: 建筑 | G93: 建筑工程 | H93: 157.4 | I93: -2.2400000000000003e-002 | J93: 6.8000000000000005e-003 | K93: 8.13 | L93: -1.9299999999999998e-002 | M93: 117.5 | N93: 5.79 | O93: 0.121 | P93: 140.41 | Q93: 已到 | R93: 5年34天 | S93: 3年34天 | T93: 8.19 | U93: 126 | V93: 9.5000000000000001e-002 | W93: 7.9000000000000001e-002 | X93: 0.11 | Y93: 104 | Z93: 1.74 | AA93: -5.6600000000000004e-002 | AB93: -6.2100000000000002e-002 | AC93: -0.12 | AD93: -0.121 | AE93: 91.97 | AF93: 98.61 | AG93: 0.8 | AH93: AA+ | AI93: 3.56e-002 | AJ93: =H93+100*O93 -> 169.5 | AK93: 174.4 | AL93: 264 | AM93: 75.8 | AN93: 232 | AO93: 2.5000000000000001e-002 | AP93: 12 | AQ93: 中钢转债!
A94: 93 | B94: 123105 | C94: 拓尔转债! | D94: 300229 | E94: 拓尔思 | F94: 计算机及 | G94: 软件开发 | H94: 136.523 | I94: -2.23e-002 | J94: -5.6000000000000008e-003 | K94: 11.07 | L94: -4.07e-002 | M94: 121 | N94: 9.96 | O94: 0.22800000000000001 | P94: 111.14 | Q94: 已到 | R94: 5年34天 | S94: 3年34天 | T94: 8 | U94: 20 | V94: 1.9e-002 | W94: 0.10099999999999999 | X94: 0.11199999999999999 | Y94: 79 | Z94: 3.58 | AA94: -2.3900000000000001e-002 | AB94: -3.0699999999999998e-002 | AC94: -8.1099999999999992e-002 | AD94: -8.3100000000000007e-002 | AE94: 85.72 | AF94: 89.86 | AG94: 0.68 | AH94: AA- | AI94: 6.1600000000000002e-002 | AJ94: =H94+100*O94 -> 159.32300000000001 | AK94: 161.9 | AL94: 159 | AM94: 72 | AN94: 202 | AO94: -1.4999999999999999e-002 | AP94: 9 | AQ94: 拓尔转债!
A95: 94 | B95: 123104 | C95: 卫宁转债! | D95: 300253 | E95: 卫宁健康 | F95: 计算机及 | G95: 软件开发 | H95: 121.1 | I95: -1.2500000000000001e-002 | J95: 9.300000000000001e-003 | K95: 11.54 | L95: -2.2000000000000002e-002 | M95: 125.1 | N95: 17.74 | O95: 0.86199999999999999 | P95: 65.05 | Q95: 已到 | R95: 5年31天 | S95: 3年31天 | T95: 9.7 | U95: 6.4 | V95: 5.0000000000000001e-003 | W95: 3.9e-002 | X95: 2.5000000000000001e-002 | Y95: 248 | Z95: 5.16 | AA95: 6.5000000000000006e-003 | AB95: -1.7000000000000001e-003 | AC95: -4.7300000000000002e-002 | AD95: -4.9200000000000001e-002 | AE95: 91.14 | AF95: 102.57 | AG95: 0.14 | AH95: AA | AI95: 4.0599999999999997e-002 | AJ95: =H95+100*O95 -> 207.30000000000001 | AK95: 177.1 | AL95: 273 | AM95: 74.6 | AN95: 219 | AO95: -0.16300000000000001 | AP95: 6 | AQ95: 卫宁转债!
A96: 95 | B96: 123103 | C96: 震安转债! | D96: 300767 | E96: 震安科技 | F96: 化工 | G96: 橡胶塑料 | H96: 185.974 | I96: -1.5300000000000001e-002 | J96: -1.2800000000000001e-002 | K96: 92.5 | L96: -3.15e-002 | M96: 121.4 | N96: 56.89 | O96: 0.14400000000000002 | P96: 162.59 | Q96: 已到 | R96: 5年27天 | S96: 3年27天 | T96: 2.53 | U96: 17 | V96: 3.5000000000000003e-002 | W96: 1.3999999999999999e-002 | X96: 2.2000000000000002e-002 | Y96: 187 | Z96: 15.95 | AA96: -8.2299999999999998e-002 | AB96: -8.8599999999999998e-002 | AC96: -0.159 | AD96: -0.10099999999999999 | AE96: 83.6 | AF96: 85.87 | AG96: 0.89 | AH96: A+ | AI96: 7.2599999999999998e-002 | AJ96: =H96+100*O96 -> 200.374 | AK96: 209.4 | AL96: 339 | AM96: 123.5 | AN96: 346 | AO96: -1.e-003 | AP96: 5 | AQ96: 震安转债!
A97: 96 | B97: 123101 | C97: 拓斯转债! | D97: 300607 | E97: 拓斯达 | F97: 机械装备 | G97: 机器人及 | H97: 115.1 | I97: -2.2000000000000001e-003 | J97: 0. | K97: 13.17 | L97: -3.5200000000000002e-002 | M97: 115.1 | N97: 26.18 | O97: 1.29 | P97: 50.31 | Q97: 已到 | R97: 5年25天 | S97: 3年25天 | T97: 6.7 | U97: 6.4 | V97: 8.0000000000000002e-003 | W97: 0.11900000000000001 | X97: 5.9999999999999998e-002 | Y97: 56 | Z97: 2.54 | AA97: 0. | AB97: -5.3e-003 | AC97: -3.2300000000000002e-002 | AD97: -3.4300000000000004e-002 | AE97: 91.2 | AF97: 94.46 | AG97: 0.06 | AH97: AA | AI97: 4.0599999999999997e-002 | AJ97: =H97+100*O97 -> 244.09999999999999 | AK97: 179.9 | AL97: 291 | AM97: 85.4 | AN97: 284 | AO97: -0.13500000000000001 | AP97: 11 | AQ97: 拓斯转债!
A98: 97 | B98: 113620 | C98: 傲农转债! | D98: 603363 | E98: 傲农生物 | F98: 农业 | G98: 畜牧业 | H98: 160.5 | I98: -4.0399999999999998e-002 | J98: 7.6e-003 | K98: 20.47 | L98: -4.0800000000000003e-002 | M98: 121.1 | N98: 14.52 | O98: 0.13800000000000001 | P98: 140.98 | Q98: 已到 | R98: 5年25天 | S98: 3年25天 | T98: 10 | U98: 329 | V98: 0.20300000000000001 | W98: 7.0999999999999994e-002 | X98: 0.10099999999999999 | Y98: 140 | Z98: 6.44 | AA98: -5.5e-002 | AB98: -6.1500000000000006e-002 | AC98: -0.125 | AD98: -0.126 | AE98: 91.2 | AF98: 99.37 | AG98: 0.8 | AH98: AA | AI98: 4.0599999999999997e-002 | AJ98: =H98+100*O98 -> 174.30000000000001 | AK98: 180 | AL98: 292 | AM98: 80.7 | AN98: 254 | AO98: 0.21899999999999997 | AP98: 10 | AQ98: 傲农转债!
A99: 98 | B99: 113045 | C99: 环旭转债! | D99: 601231 | E99: 环旭电子 | F99: 电子 | G99: 电子产品 | H99: 118.93 | I99: -2.0999999999999999e-003 | J99: 8.9999999999999998e-004 | K99: 14.36 | L99: -4.8999999999999998e-003 | M99: 112 | N99: 19.75 | O99: 0.63600000000000001 | P99: 72.71 | Q99: 已到 | R99: 5年19天 | S99: 2年19天 | T99: 34.5 | U99: 4.4 | V99: 1.e-003 | W99: 0.109 | X99: 7.9000000000000001e-002 | Y99: 317 | Z99: 2.66 | AA99: -1.2e-002 | AB99: -1.6200000000000003e-002 | AC99: -6.3200000000000006e-002 | AD99: -6.5599999999999992e-002 | AE99: 95.22 | AF99: 94.09 | AG99: 0.25 | AH99: AA+ | AI99: 3.56e-002 | AJ99: =H99+100*O99 -> 182.53 | AK99: 165.2 | AL99: 187 | AM99: 69.9 | AN99: 181 | AO99: -2.1000000000000001e-002 | AP99: 6 | AQ99: 环旭转债!
A100: 99 | B100: 128144 | C100: 利民转债! | D100: 2734 | E100: 利民股份 | F100: 化工 | G100: 农化 | H100: 143.4 | I100: -7.000000000000001e-004 | J100: -1.9e-003 | K100: 13.43 | L100: -3.7000000000000002e-003 | M100: 114.1 | N100: 11.5 | O100: 0.22800000000000001 | P100: 116.78 | Q100: 已到 | R100: 5年16天 | S100: 3年16天 | T100: 9.79 | U100: 8.2 | V100: 6.0000000000000001e-003 | W100: 0.19600000000000001 | X100: 0.22899999999999998 | Y100: 50 | Z100: 1.99 | AA100: -4.4999999999999998e-002 | AB100: -4.9599999999999998e-002 | AC100: -9.9100000000000008e-002 | AD100: -0.10000000000000001 | AE100: 90.62 | AF100: 93.67 | AG100: 0.71 | AH100: AA | AI100: 4.0599999999999997e-002 | AJ100: =H100+100*O100 -> 166.20000000000002 | AK100: 170 | AL100: 231 | AM100: 76.3 | AN100: 235 | AO100: 6.0000000000000001e-003 | AP100: 5 | AQ100: 利民转债!
A101: 100 | B101: 118000 | C101: 嘉元转债! | D101: 688388 | E101: 嘉元科技 | F101: 电子 | G101: 电子产品 | H101: 178.87 | I101: -4.1999999999999997e-003 | J101: 4.5000000000000005e-003 | K101: 110.01 | L101: 5.0000000000000001e-004 | M101: 121 | N101: 78.74 | O101: 0.28000000000000003 | P101: 139.71 | Q101: 已到 | R101: 5年10天 | S101: 3年10天 | T101: 9.79 | U101: 137 | V101: 7.6999999999999999e-002 | W101: 3.7999999999999999e-002 | X101: 5.2999999999999999e-002 | Y101: 258 | Z101: 8.59 | AA101: -7.6200000000000004e-002 | AB101: -8.2500000000000004e-002 | AC101: -0.153 | AD101: -0.155 | AE101: 86.06 | AF101: 90.22 | AG101: 0.81 | AH101: AA- | AI101: 6.1600000000000002e-002 | AJ101: =H101+100*O101 -> 206.87 | AK101: 218 | AL101: 348 | AM101: 127.8 | AN101: 348 | AO101: -0.10800000000000001 | AP101: 6 | AQ101: 嘉元转债!
A102: 101 | B102: 123100 | C102: 朗科转债 | D102: 300543 | E102: 朗科智能 | F102: 电子 | G102: 电子产品 | H102: 132.11 | I102: -6.7000000000000002e-003 | J102: -1.32e-002 | K102: 12.52 | L102: -2.9500000000000002e-002 | M102: 117.1 | N102: 11.61 | O102: 0.22500000000000001 | P102: 107.84 | Q102: 已到 | R102: 4.99年 | S102: 2.99年 | T102: 3.8 | U102: 8.7 | V102: 1.7000000000000001e-002 | W102: 0.113 | X102: 0.122 | Y102: 34 | Z102: 3.55 | AA102: -2.4300000000000002e-002 | AB102: -3.0099999999999998e-002 | AC102: -7.51e-002 | AD102: -7.6999999999999999e-002 | AE102: 86.44 | AF102: 88.46 | AG102: 0.68 | AH102: AA- | AI102: 5.9000000000000004e-002 | AJ102: =H102+100*O102 -> 154.61000000000001 | AK102: 156.4 | AL102: 105 | AM102: 67.9 | AN102: 171 | AO102: -5.5999999999999994e-002 | AP102: 9 | AQ102: 朗科转债
A103: 102 | B103: 123099 | C103: 普利转债 | D103: 300630 | E103: 普利制药 | F103: 医药 | G103: 化学制药 | H103: 130.198 | I103: -1.7399999999999999e-002 | J103: 4.6999999999999993e-003 | K103: 43.79 | L103: -2.3399999999999997e-002 | M103: 123.1 | N103: 46.03 | O103: 0.36899999999999999 | P103: 95.13 | Q103: 已到 | R103: 4.99年 | S103: 2.99年 | T103: 8.5 | U103: 11 | V103: 1.e-002 | W103: 4.4000000000000004e-002 | X103: 4.2000000000000003e-002 | Y103: 191 | Z103: 8.04 | AA103: -1.1399999999999999e-002 | AB103: -1.9e-002 | AC103: -7.0800000000000002e-002 | AD103: -7.2700000000000001e-002 | AE103: 86.44 | AF103: 92.96 | AG103: 0.54 | AH103: AA- | AI103: 5.9000000000000004e-002 | AJ103: =H103+100*O103 -> 167.09800000000001 | AK103: 165.3 | AL103: 191 | AM103: 72.3 | AN103: 204 | AO103: -0.107 | AP103: 6 | AQ103: 普利转债
A104: 103 | B104: 123098 | C104: 一品转债! | D104: 300723 | E104: 一品红 | F104: 医药 | G104: 医药行业 | H104: 140.686 | I104: -1.7500000000000002e-002 | J104: -7.7000000000000002e-003 | K104: 27.98 | L104: -3.9100000000000003e-002 | M104: 123.6 | N104: 25.48 | O104: 0.28100000000000003 | P104: 109.81 | Q104: 已到 | R104: 4.96年 | S104: 2.96年 | T104: 4.24 | U104: 5.3 | V104: 9.0000000000000011e-003 | W104: 5.2999999999999999e-002 | X104: 5.7999999999999996e-002 | Y104: 81 | Z104: 4.82 | AA104: -2.6200000000000001e-002 | AB104: -3.39e-002 | AC104: -9.4200000000000006e-002 | AD104: -9.6000000000000002e-002 | AE104: 86.68 | AF104: 93.54 | AG104: 0.64 | AH104: AA- | AI104: 5.9000000000000004e-002 | AJ104: =H104+100*O104 -> 168.786 | AK104: 171.6 | AL104: 248 | AM104: 78 | AN104: 241 | AO104: -9.6999999999999989e-002 | AP104: 7 | AQ104: 一品转债!
A105: 104 | B105: 123097 | C105: 美力转债 | D105: 300611 | E105: 美力科技 | F105: 机械装备 | G105: 通用设备 | H105: 128.008 | I105: -1.9e-002 | J105: -5.4000000000000003e-003 | K105: 9.91 | L105: -3.6000000000000004e-002 | M105: 121.1 | N105: 9.28 | O105: 0.19899999999999998 | P105: 106.79 | Q105: 已到 | R105: 4.95年 | S105: 2.95年 | T105: 3 | U105: 25 | V105: 6.4000000000000001e-002 | W105: 0.16899999999999998 | X105: 0.18100000000000002 | Y105: 18 | Z105: 2.52 | AA105: -1.1399999999999999e-002 | AB105: -1.8500000000000003e-002 | AC105: -6.4600000000000005e-002 | AD105: -6.6900000000000001e-002 | AE105: 84.46 | AF105: 87.27 | AG105: 0.68 | AH105: A+ | AI105: 7.0000000000000007e-002 | AJ105: =H105+100*O105 -> 147.90800000000002 | AK105: 149.2 | AL105: 50 | AM105: 62 | AN105: 121 | AO105: -9.4e-002 | AP105: 22 | AQ105: 美力转债
A106: 105 | B106: 123096 | C106: 思创转债! | D106: 300078 | E106: 思创医惠 | F106: 通信互联 | G106: 物联网 | H106: 117.769 | I106: -8.0000000000000004e-004 | J106: -6.0999999999999995e-003 | K106: 6.09 | L106: -2.0899999999999998e-002 | M106: 123.6 | N106: 8.27 | O106: 0.59899999999999998 | P106: 73.64 | Q106: 已到 | R106: 4.95年 | S106: 2.95年 | T106: 8.17 | U106: 12 | V106: 1.3000000000000001e-002 | W106: 0.155 | X106: 0.114 | Y106: 53 | Z106: 1.93 | AA106: 1.e-002 | AB106: 1.9e-003 | AC106: -4.0800000000000003e-002 | AD106: -4.2900000000000001e-002 | AE106: 86.71 | AF106: 93.57 | AG106: 0.33 | AH106: AA- | AI106: 5.9000000000000004e-002 | AJ106: =H106+100*O106 -> 177.66900000000001 | AK106: 161.9 | AL106: 158 | AM106: 68.3 | AN106: 172 | AO106: -0.13400000000000001 | AP106: 14 | AQ106: 思创转债!
A107: 106 | B107: 113621 | C107: 彤程转债! | D107: 603650 | E107: 彤程新材 | F107: 化工 | G107: 橡胶塑料 | H107: 144.87 | I107: -1.4199999999999999e-002 | J107: -6.8000000000000005e-003 | K107: 33.8 | L107: -3.5400000000000001e-002 | M107: 114.8 | N107: 32.62 | O107: 0.39799999999999996 | P107: 103.62 | Q107: 已到 | R107: 4.95年 | S107: 2.95年 | T107: 5.37 | U107: 16 | V107: 2.1000000000000001e-002 | W107: 2.7000000000000003e-002 | X107: 2.7999999999999997e-002 | Y107: 202 | Z107: 7.52 | AA107: -4.6600000000000003e-002 | AB107: -5.16e-002 | AC107: -0.10199999999999999 | AD107: -0.10400000000000001 | AE107: 92.04 | AF107: 95.76 | AG107: 0.59 | AH107: AA | AI107: 3.7999999999999999e-002 | AJ107: =H107+100*O107 -> 184.67000000000002 | AK107: 186.1 | AL107: 308 | AM107: 90.4 | AN107: 299 | AO107: -0.10300000000000001 | AP107: 7 | AQ107: 彤程转债!
A108: 107 | B108: 113042 | C108: 上银转债! | D108: 601229 | E108: 上海银行 | F108: 金融 | G108: 银行行业 | H108: 107.82 | I108: -4.4000000000000003e-003 | J108: 4.8999999999999998e-003 | K108: 7.31 | L108: 2.7000000000000001e-003 | M108: 120.6 | N108: 10.63 | O108: 0.56799999999999995 | P108: 68.77 | Q108: 已到 | R108: 4.95年 | S108: 无权 | T108: 200 | U108: 467 | V108: 2.2000000000000002e-002 | W108: 0.193 | X108: 0.13200000000000001 | Y108: 1039. | Z108: 0.58 | AA108: 2.3599999999999999e-002 | AB108: 1.61e-002 | AC108: 无权 | AD108: 无权 | AE108: 无权 | AF108: 104.15 | AG108: 0.17 | AH108: AAA | AI108: 3.1e-002 | AJ108: =H108+100*O108 -> 164.62 | AK108: 146.9 | AL108: 35 | AM108: 42.7 | AN108: 22 | AO108: 1.2e-002 | AP108: 19 | AQ108: 上银转债!
A109: 108 | B109: 113619 | C109: 世运转债! | D109: 603920 | E109: 世运电路 | F109: 电子 | G109: 元器件制 | H109: 133 | I109: -5.3899999999999997e-002 | J109: 1.6799999999999999e-002 | K109: 19.85 | L109: -6.7199999999999996e-002 | M109: 114.9 | N109: 19.92 | O109: 0.33500000000000002 | P109: 99.65 | Q109: 已到 | R109: 4.93年 | S109: 2.93年 | T109: 10 | U109: 123 | V109: 9.1999999999999998e-002 | W109: 9.5000000000000001e-002 | X109: 9.4e-002 | Y109: 106 | Z109: 4.05 | AA109: -2.9700000000000001e-002 | AB109: -3.49e-002 | AC109: -7.85e-002 | AD109: -8.0299999999999996e-002 | AE109: 92.2 | AF109: 95.92 | AG109: 0.55 | AH109: AA | AI109: 3.7999999999999999e-002 | AJ109: =H109+100*O109 -> 166.5 | AK109: 166.4 | AL109: 204 | AM109: 70.4 | AN109: 187 | AO109: -0.12 | AP109: 6 | AQ109: 世运转债!
A110: 109 | B110: 123093 | C110: 金陵转债! | D110: 300651 | E110: 金陵体育 | F110: 其他 | G110: 文化教育 | H110: 119.85 | I110: -5.0000000000000001e-003 | J110: -8.199999999999999e-003 | K110: 29.23 | L110: -6.4600000000000005e-002 | M110: 128.8 | N110: 49.19 | O110: 1.02 | P110: 59.42 | Q110: 已到 | R110: 4.93年 | S110: 2.93年 | T110: 2.5 | U110: 17 | V110: 5.7999999999999996e-002 | W110: 6.6000000000000003e-002 | X110: 3.9e-002 | Y110: 38 | Z110: 5.4 | AA110: 1.5100000000000001e-002 | AB110: 5.5000000000000005e-003 | AC110: -3.9599999999999996e-002 | AD110: -4.2999999999999997e-002 | AE110: 86.08 | AF110: 93.17 | AG110: 0.2 | AH110: A+ | AI110: 7.0000000000000007e-002 | AJ110: =H110+100*O110 -> 221.84999999999999 | AK110: 180.3 | AL110: 293 | AM110: 87.1 | AN110: 288 | AO110: -6.6000000000000003e-002 | AP110: 13 | AQ110: 金陵转债!
A111: 110 | B111: 113618 | C111: 美诺转债! | D111: 603538 | E111: 美诺华 | F111: 医药 | G111: 原料药 | H111: 121.36 | I111: -1.3300000000000001e-002 | J111: -5.0000000000000001e-003 | K111: 28.77 | L111: -4.2900000000000001e-002 | M111: 114.9 | N111: 37.23 | O111: 0.56999999999999995 | P111: 77.28 | Q111: 已到 | R111: 4.92年 | S111: 2.92年 | T111: 5.2 | U111: 4 | V111: 6.0000000000000001e-003 | W111: 0.11900000000000001 | X111: 9.1999999999999998e-002 | Y111: 44 | Z111: 2.55 | AA111: -1.1299999999999999e-002 | AB111: -1.66e-002 | AC111: -5.0900000000000001e-002 | AD111: -5.2900000000000003e-002 | AE111: 86.77 | AF111: 87.15 | AG111: 0.43 | AH111: AA- | AI111: 5.9000000000000004e-002 | AJ111: =H111+100*O111 -> 178.35999999999999 | AK111: 165.4 | AL111: 194 | AM111: 78.3 | AN111: 242 | AO111: -0.13400000000000001 | AP111: 5 | AQ111: 美诺转债!
A112: 111 | B112: 128143 | C112: 锋龙转债! | D112: 2931 | E112: 锋龙股份 | F112: 机械装备 | G112: 专用设备 | H112: 130.2 | I112: 6.1999999999999998e-003 | J112: -1.7000000000000001e-003 | K112: 13.75 | L112: 6.6e-003 | M112: 121.2 | N112: 12.73 | O112: 0.20499999999999999 | P112: 108.01 | Q112: 已到 | R112: 4.90年 | S112: 2.90年 | T112: 2.44 | U112: 10 | V112: 3.3000000000000002e-002 | W112: 8.900000000000001e-002 | X112: 9.6000000000000002e-002 | Y112: 27 | Z112: 4.31 | AA112: -1.4800000000000001e-002 | AB112: -2.2000000000000002e-002 | AC112: -7.0800000000000002e-002 | AD112: -7.3099999999999998e-002 | AE112: 84.78 | AF112: 87.65 | AG112: 0.69 | AH112: A+ | AI112: 7.0000000000000007e-002 | AJ112: =H112+100*O112 -> 150.69999999999999 | AK112: 152.4 | AL112: 74 | AM112: 64.7 | AN112: 146 | AO112: -2.e-003 | AP112: 15 | AQ112: 锋龙转债!
A113: 112 | B113: 127028 | C113: 英特转债! | D113: 411 | E113: 英特集团 | F113: 医药 | G113: 医药商业 | H113: 122.988 | I113: -9.7999999999999997e-003 | J113: -1.e-002 | K113: 12.7 | L113: -3.8599999999999995e-002 | M113: 112.8 | N113: 13.22 | O113: 0.28000000000000003 | P113: 96.07 | Q113: 已到 | R113: 4.89年 | S113: 2.89年 | T113: 5.99 | U113: 34 | V113: 4.5999999999999999e-002 | W113: 0.185 | X113: 0.17699999999999999 | Y113: 32 | Z113: 1.78 | AA113: -1.78e-002 | AB113: -2.2400000000000003e-002 | AC113: -5.5800000000000002e-002 | AD113: -5.7699999999999994e-002 | AE113: 93.6 | AF113: 96.51 | AG113: 0.51 | AH113: AA+ | AI113: 3.3000000000000002e-002 | AJ113: =H113+100*O113 -> 150.988 | AK113: 149.9 | AL113: 52 | AM113: 53.4 | AN113: 59 | AO113: -8.6999999999999994e-002 | AP113: 31 | AQ113: 英特转债!
A114: 113 | B114: 113616 | C114: 韦尔转债! | D114: 603501 | E114: 韦尔股份 | F114: 电子 | G114: 元器件制 | H114: 147.51 | I114: -1.2199999999999999e-002 | J114: 1.6000000000000001e-003 | K114: 227.55 | L114: -1.9099999999999999e-002 | M114: 114.3 | N114: 222.52 | O114: 0.442 | P114: 102.26 | Q114: 已到 | R114: 4.87年 | S114: 2.87年 | T114: 24.3 | U114: 116 | V114: 3.2000000000000001e-002 | W114: 1.2e-002 | X114: 1.2e-002 | Y114: 1993. | Z114: 13.64 | AA114: -5.1699999999999996e-002 | AB114: -5.6600000000000004e-002 | AC114: -0.111 | AD114: -0.11199999999999999 | AE114: 93.2 | AF114: 97.82 | AG114: 0.56 | AH114: AA+ | AI114: 3.3000000000000002e-002 | AJ114: =H114+100*O114 -> 191.70999999999998 | AK114: 192.8 | AL114: 324 | AM114: 94.9 | AN114: 308 | AO114: -0.156 | AP114: 9 | AQ114: 韦尔转债!
A115: 114 | B115: 123092 | C115: 天壕转债! | D115: 300332 | E115: 天壕环境 | F115: 石油天然 | G115: 天然气 | H115: 215.529 | I115: -2.9999999999999999e-002 | J115: 1.3300000000000001e-002 | K115: 10.61 | L115: -1.7600000000000001e-002 | M115: 121.1 | N115: 5.19 | O115: 5.4000000000000006e-002 | P115: 204.43 | Q115: 已到 | R115: 4.86年 | S115: 2.86年 | T115: 4.17 | U115: 100 | V115: 0.111 | W115: 4.4999999999999998e-002 | X115: 9.0999999999999998e-002 | Y115: 94 | Z115: 2.74 | AA115: -0.114 | AB115: -0.12 | AC115: -0.13200000000000001 | AD115: -0.13300000000000001 | AE115: 85 | AF115: 87.82 | AG115: 0.95 | AH115: A+ | AI115: 7.0000000000000007e-002 | AJ115: =H115+100*O115 -> 220.929 | AK115: 226.6 | AL115: 349 | AM115: 138.8 | AN115: 351 | AO115: 4.2999999999999997e-002 | AP115: 10 | AQ115: 天壕转债!
A116: 115 | B116: 113615 | C116: 金诚转债! | D116: 603979 | E116: 金诚信 | F116: 有色金属 | G116: 有色行业 | H116: 212.8 | I116: -8.0000000000000004e-004 | J116: -2.0899999999999998e-002 | K116: 22.86 | L116: -2.3099999999999999e-002 | M116: 116.9 | N116: 12.65 | O116: 0.17800000000000002 | P116: 180.71 | Q116: 已到 | R116: 4.86年 | S116: 2.86年 | T116: 8.66 | U116: 109 | V116: 5.9000000000000004e-002 | W116: 6.4000000000000001e-002 | X116: 0.115 | Y116: 136 | Z116: 2.74 | AA116: -0.11800000000000001 | AB116: -0.12300000000000001 | AC116: -0.13200000000000001 | AD116: -0.13200000000000001 | AE116: 92.46 | AF116: 97.86 | AG116: 0.94 | AH116: AA | AI116: 3.7999999999999999e-002 | AJ116: =H116+100*O116 -> 230.60000000000002 | AK116: 244.9 | AL116: 355 | AM116: 147 | AN116: 355 | AO116: 6.6000000000000003e-002 | AP116: 3 | AQ116: 金诚转债!
A117: 116 | B117: 123091 | C117: 长海转债 | D117: 300196 | E117: 长海股份 | F117: 其他 | G117: 非金属矿 | H117: 139.15 | I117: 1.1000000000000001e-003 | J117: -7.000000000000001e-004 | K117: 17.48 | L117: 5.9999999999999995e-004 | M117: 115.9 | N117: 16.14 | O117: 0.28499999999999998 | P117: 108.3 | Q117: 已到 | R117: 4.86年 | S117: 2.86年 | T117: 5.5 | U117: 16 | V117: 2.1000000000000001e-002 | W117: 7.6999999999999999e-002 | X117: 8.3000000000000004e-002 | Y117: 71 | Z117: 2.2 | AA117: -3.7599999999999995e-002 | AB117: -4.2999999999999997e-002 | AC117: -9.4200000000000006e-002 | AD117: -9.6000000000000002e-002 | AE117: 92.46 | AF117: 97.03 | AG117: 0.62 | AH117: AA | AI117: 3.7999999999999999e-002 | AJ117: =H117+100*O117 -> 167.65000000000001 | AK117: 170 | AL117: 230 | AM117: 73 | AN117: 207 | AO117: 1.6e-002 | AP117: 4 | AQ117: 长海转债
A118: 117 | B118: 123089 | C118: 九洲转2!! | D118: 300040 | E118: 九洲集团 | F118: 能源电力 | G118: 电力设备 | H118: 162 | I118: -2.87e-002 | J118: 4.1999999999999997e-003 | K118: 8.39 | L118: -2.8900000000000002e-002 | M118: 120.6 | N118: 5.68 | O118: 9.6999999999999989e-002 | P118: 147.71 | Q118: 已到 | R118: 4.85年 | S118: 2.85年 | T118: 3.06 | U118: 64 | V118: 0.128 | W118: 6.2e-002 | X118: 9.1999999999999998e-002 | Y118: 49 | Z118: 1.92 | AA118: -5.9999999999999998e-002 | AB118: -6.6600000000000006e-002 | AC118: -0.13600000000000001 | AD118: -0.13800000000000001 | AE118: 87.2 | AF118: 91.83 | AG118: 0.85 | AH118: AA- | AI118: 5.9000000000000004e-002 | AJ118: =H118+100*O118 -> 171.69999999999999 | AK118: 176.3 | AL118: 272 | AM118: 84.5 | AN118: 280 | AO118: -3.5000000000000003e-002 | AP118: 18 | AQ118: 九洲转2!!
A119: 118 | B119: 123090 | C119: 三诺转债! | D119: 300298 | E119: 三诺生物 | F119: 医药 | G119: 医疗器械 | H119: 121.25 | I119: -9.5999999999999992e-003 | J119: 5.6000000000000008e-003 | K119: 24.02 | L119: -2.e-002 | M119: 116.8 | N119: 35.18 | O119: 0.77599999999999991 | P119: 68.28 | Q119: 已到 | R119: 4.85年 | S119: 2.85年 | T119: 5 | U119: 2 | V119: 3.0000000000000001e-003 | W119: 3.7000000000000005e-002 | X119: 2.5000000000000001e-002 | Y119: 136 | Z119: 5.01 | AA119: -7.8000000000000005e-003 | AB119: -1.38e-002 | AC119: -5.2000000000000005e-002 | AD119: -5.4000000000000006e-002 | AE119: 92.38 | AF119: 97.79 | AG119: 0.2 | AH119: AA | AI119: 3.7999999999999999e-002 | AJ119: =H119+100*O119 -> 198.84999999999999 | AK119: 174.2 | AL119: 263 | AM119: 76.4 | AN119: 236 | AO119: -0.11199999999999999 | AP119: 5 | AQ119: 三诺转债!
A120: 119 | B120: 128142 | C120: 新乳转债! | D120: 2946 | E120: 新乳业 | F120: 食品饮料 | G120: 乳制品 | H120: 124.66 | I120: -1.8e-003 | J120: -4.4000000000000003e-003 | K120: 14.37 | L120: -2.0400000000000001e-002 | M120: 114.8 | N120: 18.47 | O120: 0.60199999999999998 | P120: 77.8 | Q120: 已到 | R120: 4.84年 | S120: 2.84年 | T120: 7.18 | U120: 4.4 | V120: 5.0000000000000001e-003 | W120: 5.7999999999999996e-002 | X120: 4.4999999999999998e-002 | Y120: 125 | Z120: 4.9 | AA120: -1.72e-002 | AB120: -2.2499999999999999e-002 | AC120: -6.0899999999999996e-002 | AD120: -6.2800000000000009e-002 | AE120: 92.41 | AF120: 96.15 | AG120: 0.3 | AH120: AA | AI120: 3.7999999999999999e-002 | AJ120: =H120+100*O120 -> 184.85999999999999 | AK120: 171.5 | AL120: 246 | AM120: 75.4 | AN120: 228 | AO120: -3.3000000000000002e-002 | AP120: 5 | AQ120: 新乳转债!
A121: 120 | B121: 128141 | C121: 旺能转债 | D121: 2034 | E121: 旺能环境 | F121: 城市公用 | G121: 三废处理 | H121: 146.69 | I121: -1.8e-003 | J121: -1.3500000000000002e-002 | K121: 20 | L121: -2.06e-002 | M121: 114.8 | N121: 15.97 | O121: 0.17100000000000001 | P121: 125.23 | Q121: 已到 | R121: 4.84年 | S121: 2.84年 | T121: 12.7 | U121: 54 | V121: 2.8999999999999998e-002 | W121: 0.14800000000000002 | X121: 0.185 | Y121: 86 | Z121: 1.71 | AA121: -5.0199999999999995e-002 | AB121: -5.5199999999999999e-002 | AC121: -0.109 | AD121: -0.111 | AE121: 92.42 | AF121: 96.16 | AG121: 0.74 | AH121: AA | AI121: 3.7999999999999999e-002 | AJ121: =H121+100*O121 -> 163.78999999999999 | AK121: 168.1 | AL121: 217 | AM121: 72 | AN121: 201 | AO121: 2.7000000000000003e-002 | AP121: 8 | AQ121: 旺能转债
A122: 121 | B122: 123087 | C122: 明电转债! | D122: 300739 | E122: 明阳电路 | F122: 电子 | G122: 元器件制 | H122: 127.988 | I122: 3.7000000000000002e-003 | J122: -1.7000000000000001e-002 | K122: 15.66 | L122: -2.3700000000000002e-002 | M122: 120.8 | N122: 16.32 | O122: 0.33399999999999996 | P122: 95.96 | Q122: 已到 | R122: 4.84年 | S122: 3.84年 | T122: 4.19 | U122: 37 | V122: 6.9000000000000006e-002 | W122: 9.0999999999999998e-002 | X122: 8.6999999999999994e-002 | Y122: 46 | Z122: 2.78 | AA122: -1.21e-002 | AB122: -1.9299999999999998e-002 | AC122: -4.5999999999999999e-002 | AD122: -4.87e-002 | AE122: 84.83 | AF122: 92.1 | AG122: 0.56 | AH122: AA- | AI122: 5.9000000000000004e-002 | AJ122: =H122+100*O122 -> 161.38800000000001 | AK122: 160 | AL122: 139 | AM122: 67.9 | AN122: 170 | AO122: -6.3e-002 | AP122: 19 | AQ122: 明电转债!
A123: 122 | B123: 123088 | C123: 威唐转债! | D123: 300707 | E123: 威唐工业 | F123: 汽车 | G123: 零部件制 | H123: 123.618 | I123: -1.3000000000000001e-002 | J123: -7.000000000000001e-004 | K123: 16.7 | L123: -2.9100000000000001e-002 | M123: 121.1 | N123: 20.72 | O123: 0.53400000000000003 | P123: 80.6 | Q123: 已到 | R123: 4.84年 | S123: 2.84年 | T123: 3.01 | U123: 3.1 | V123: 8.0000000000000002e-003 | W123: 0.115 | X123: 9.3000000000000013e-002 | Y123: 26 | Z123: 3.73 | AA123: -4.3e-003 | AB123: -1.1699999999999999e-002 | AC123: -5.6100000000000004e-002 | AD123: -5.8499999999999996e-002 | AE123: 85.14 | AF123: 87.97 | AG123: 0.47 | AH123: A+ | AI123: 7.0000000000000007e-002 | AJ123: =H123+100*O123 -> 177.018 | AK123: 166.6 | AL123: 206 | AM123: 78.7 | AN123: 244 | AO123: -6.3e-002 | AP123: 18 | AQ123: 威唐转债!
A124: 123 | B124: 113044 | C124: 大秦转债! | D124: 601006 | E124: 大秦铁路 | F124: 铁路 | G124: 铁路运输 | H124: 114.81 | I124: -2.5999999999999999e-003 | J124: 4.0000000000000002e-004 | K124: 7.14 | L124: -4.1999999999999997e-003 | M124: 113.9 | N124: 7.18 | O124: 0.155 | P124: 99.44 | Q124: 已到 | R124: 4.83年 | S124: 2.83年 | T124: 320 | U124: 520 | V124: 1.3999999999999999e-002 | W124: 0.30099999999999999 | X124: 0.29999999999999999 | Y124: 1061. | Z124: 0.88 | AA124: -1.7000000000000001e-003 | AB124: -6.8000000000000005e-003 | AC124: -3.3500000000000002e-002 | AD124: -3.5799999999999998e-002 | AE124: 94.73 | AF124: 98.58 | AG124: 0.54 | AH124: AAA | AI124: 3.1e-002 | AJ124: =H124+100*O124 -> 130.31 | AK124: 130.2 | AL124: 3 | AM124: 31.6 | AN124: 5 | AO124: 7.5999999999999998e-002 | AP124: 38 | AQ124: 大秦转债!
A125: 124 | B125: 123085 | C125: 万顺转2!! | D125: 300057 | E125: 万顺新材 | F125: 有色金属 | G125: 铝金属 | H125: 144.79 | I125: -1.77e-002 | J125: -1.1699999999999999e-002 | K125: 8 | L125: -3.61e-002 | M125: 112.9 | N125: 6.2 | O125: 0.122 | P125: 129.03 | Q125: 已到 | R125: 4.82年 | S125: 2.82年 | T125: 8.51 | U125: 42 | V125: 3.3000000000000002e-002 | W125: 0.156 | X125: 0.20100000000000001 | Y125: 55 | Z125: 1.52 | AA125: -5.1100000000000007e-002 | AB125: -5.5599999999999997e-002 | AC125: -0.106 | AD125: -0.10800000000000001 | AE125: 87.23 | AF125: 86.1 | AG125: 0.81 | AH125: AA- | AI125: 5.9000000000000004e-002 | AJ125: =H125+100*O125 -> 156.98999999999998 | AK125: 160.5 | AL125: 146 | AM125: 73.3 | AN125: 210 | AO125: -7.2000000000000008e-002 | AP125: 19 | AQ125: 万顺转2!!
A126: 125 | B126: 123086 | C126: 海兰转债!! | D126: 300065 | E126: 海兰信 | F126: 电子 | G126: 电子产品 | H126: 213.864 | I126: -1.3999999999999999e-002 | J126: -2.5600000000000001e-002 | K126: 13.72 | L126: -4.2599999999999999e-002 | M126: 123.1 | N126: 7.27 | O126: 0.13300000000000001 | P126: 188.72 | Q126: 已到 | R126: 4.82年 | S126: 2.82年 | T126: 4.82 | U126: 389 | V126: 0.379 | W126: 5.5999999999999994e-002 | X126: 0.105 | Y126: 86 | Z126: 5.13 | AA126: -0.11 | AB126: -0.11699999999999999 | AC126: -0.13400000000000001 | AD126: -0.13500000000000001 | AE126: 87.26 | AF126: 93.84 | AG126: 0.93 | AH126: AA- | AI126: 5.9000000000000004e-002 | AJ126: =H126+100*O126 -> 227.16400000000002 | AK126: 239 | AL126: 353 | AM126: 145.2 | AN126: 353 | AO126: -3.0000000000000001e-003 | AP126: 19 | AQ126: 海兰转债!!
A127: 126 | B127: 123084 | C127: 高澜转债!! | D127: 300499 | E127: 高澜股份 | F127: 能源电力 | G127: 电力设备 | H127: 164.261 | I127: -5.8400000000000001e-002 | J127: 2.2099999999999998e-002 | K127: 11.94 | L127: -4.5599999999999995e-002 | M127: 121.4 | N127: 9.01 | O127: 0.23999999999999999 | P127: 132.52 | Q127: 已到 | R127: 4.82年 | S127: 2.82年 | T127: 2.54 | U127: 71 | V127: 0.16600000000000001 | W127: 7.5999999999999998e-002 | X127: 0.10099999999999999 | Y127: 34 | Z127: 3.89 | AA127: -6.2e-002 | AB127: -6.8900000000000003e-002 | AC127: -0.13900000000000001 | AD127: -0.14099999999999999 | AE127: 85.4 | AF127: 88.29 | AG127: 0.8 | AH127: A+ | AI127: 7.0000000000000007e-002 | AJ127: =H127+100*O127 -> 188.261 | AK127: 196 | AL127: 328 | AM127: 107.7 | AN127: 335 | AO127: -0.114 | AP127: 14 | AQ127: 高澜转债!!
A128: 127 | B128: 127027 | C128: 靖远转债! | D128: 552 | E128: 靖远煤电 | F128: 煤炭 | G128: 煤炭开采 | H128: 140.669 | I128: 1.8e-003 | J128: -7.3000000000000001e-003 | K128: 3.84 | L128: -7.8000000000000005e-003 | M128: 114.9 | N128: 3.13 | O128: 0.14699999999999999 | P128: 122.68 | Q128: 已到 | R128: 4.82年 | S128: 2.82年 | T128: 24.3 | U128: 244 | V128: 7.0999999999999994e-002 | W128: 0.26899999999999996 | X128: 0.33000000000000002 | Y128: 90 | Z128: 1.08 | AA128: -4.1799999999999997e-002 | AB128: -4.7e-002 | AC128: -9.849999999999999e-002 | AD128: -0.10000000000000001 | AE128: 93.92 | AF128: 98.54 | AG128: 0.71 | AH128: AA+ | AI128: 3.3000000000000002e-002 | AJ128: =H128+100*O128 -> 155.369 | AK128: 158.7 | AL128: 125 | AM128: 60.1 | AN128: 107 | AO128: 4.2000000000000003e-002 | AP128: 36 | AQ128: 靖远转债!
A129: 128 | B129: 113043 | C129: 财通转债! | D129: 601108 | E129: 财通证券 | F129: 金融 | G129: 证券行业 | H129: 118.52 | I129: -2.3999999999999998e-003 | J129: 7.000000000000001e-004 | K129: 9.95 | L129: -6.0000000000000001e-003 | M129: 110 | N129: 13.13 | O129: 0.56399999999999995 | P129: 75.78 | Q129: 已到 | R129: 4.82年 | S129: 无权 | T129: 38 | U129: 12 | V129: 3.0000000000000001e-003 | W129: 0.106 | X129: 8.1000000000000003e-002 | Y129: 357 | Z129: 1.53 | AA129: -1.5600000000000001e-002 | AB129: -1.9299999999999998e-002 | AC129: 无权 | AD129: 无权 | AE129: 无权 | AF129: 95.14 | AG129: 0.29 | AH129: AAA | AI129: 3.1e-002 | AJ129: =H129+100*O129 -> 174.91999999999999 | AK129: 161.3 | AL129: 153 | AM129: 66.1 | AN129: 161 | AO129: -3.5000000000000003e-002 | AP129: 11 | AQ129: 财通转债!
A130: 129 | B130: 123083 | C130: 朗新转债! | D130: 300682 | E130: 朗新科技 | F130: 计算机及 | G130: 软件开发 | H130: 221.36 | I130: -3.7000000000000002e-003 | J130: -2.8900000000000002e-002 | K130: 30.87 | L130: -3.4099999999999998e-002 | M130: 114.8 | N130: 15.39 | O130: 0.10400000000000001 | P130: 200.58 | Q130: 已到 | R130: 4.82年 | S130: 2.82年 | T130: 6.01 | U130: 96 | V130: 7.2000000000000008e-002 | W130: 1.9e-002 | X130: 3.7000000000000005e-002 | Y130: 323 | Z130: 5.87 | AA130: -0.129 | AB130: -0.13400000000000001 | AC130: -0.13900000000000001 | AD130: -0.14000000000000001 | AE130: 92.49 | AF130: 96.23 | AG130: 0.96 | AH130: AA | AI130: 3.7999999999999999e-002 | AJ130: =H130+100*O130 -> 231.76000000000002 | AK130: 242.1 | AL130: 354 | AM130: 145.9 | AN130: 354 | AO130: -0.107 | AP130: 7 | AQ130: 朗新转债!
A131: 130 | B131: 127026 | C131: 超声转债! | D131: 823 | E131: 超声电子 | F131: 电子 | G131: 元器件制 | H131: 128.2 | I131: -1.2699999999999999e-002 | J131: -1.9e-003 | K131: 11.77 | L131: -2.9700000000000001e-002 | M131: 112.8 | N131: 12.72 | O131: 0.38500000000000001 | P131: 92.53 | Q131: 已到 | R131: 4.82年 | S131: 2.82年 | T131: 7 | U131: 4 | V131: 5.0000000000000001e-003 | W131: 0.111 | X131: 0.10199999999999999 | Y131: 63 | Z131: 1.59 | AA131: -2.6699999999999998e-002 | AB131: -3.1300000000000001e-002 | AC131: -7.0300000000000001e-002 | AD131: -7.22e-002 | AE131: 92.5 | AF131: 94.57 | AG131: 0.49 | AH131: AA | AI131: 3.7999999999999999e-002 | AJ131: =H131+100*O131 -> 166.69999999999999 | AK131: 163.9 | AL131: 175 | AM131: 69.3 | AN131: 177 | AO131: -7.0999999999999994e-002 | AP131: 12 | AQ131: 超声转债!
A132: 131 | B132: 128140 | C132: 润建转债!! | D132: 2929 | E132: 润建股份 | F132: 通信互联 | G132: 通信设备 | H132: 159.555 | I132: -6.5000000000000006e-003 | J132: -1.84e-002 | K132: 33.55 | L132: -3.2599999999999997e-002 | M132: 114.9 | N132: 26.4 | O132: 0.25600000000000001 | P132: 127.08 | Q132: 已到 | R132: 4.81年 | S132: 2.81年 | T132: 10.9 | U132: 16 | V132: 9.0000000000000011e-003 | W132: 0.14199999999999999 | X132: 0.17999999999999999 | Y132: 77 | Z132: 2.18 | AA132: -6.7000000000000004e-002 | AB132: -7.2000000000000008e-002 | AC132: -0.13400000000000001 | AD132: -0.13600000000000001 | AE132: 92.61 | AF132: 96.35 | AG132: 0.76 | AH132: AA | AI132: 3.7999999999999999e-002 | AJ132: =H132+100*O132 -> 185.155 | AK132: 192 | AL132: 321 | AM132: 95.7 | AN132: 313 | AO132: -2.6000000000000002e-002 | AP132: 10 | AQ132: 润建转债!!
A133: 132 | B133: 123082 | C133: 北陆转债! | D133: 300016 | E133: 北陆药业 | F133: 医药 | G133: 化学制药 | H133: 123.05 | I133: -5.0000000000000001e-003 | J133: -1.e-002 | K133: 7.98 | L133: -2.6800000000000001e-002 | M133: 121.2 | N133: 8.81 | O133: 0.35799999999999998 | P133: 90.58 | Q133: 已到 | R133: 4.81年 | S133: 2.81年 | T133: 4.99 | U133: 8.5 | V133: 1.3999999999999999e-002 | W133: 0.127 | X133: 0.115 | Y133: 39 | Z133: 2.29 | AA133: -3.2000000000000002e-003 | AB133: -1.0700000000000001e-002 | AC133: -5.5e-002 | AD133: -5.74e-002 | AE133: 85.28 | AF133: 88.18 | AG133: 0.56 | AH133: A+ | AI133: 7.0000000000000007e-002 | AJ133: =H133+100*O133 -> 158.84999999999999 | AK133: 155.5 | AL133: 95 | AM133: 67.3 | AN133: 166 | AO133: -7.9000000000000001e-002 | AP133: 18 | AQ133: 北陆转债!
A134: 133 | B134: 123080 | C134: 海波转债! | D134: 300517 | E134: 海波重科 | F134: 建筑 | G134: 建筑工程 | H134: 131.7 | I134: 4.5999999999999999e-003 | J134: -1.6799999999999999e-002 | K134: 12.96 | L134: -1.8200000000000001e-002 | M134: 126 | N134: 11.58 | O134: 0.17699999999999999 | P134: 111.92 | Q134: 已到 | R134: 4.80年 | S134: 2.80年 | T134: 2.44 | U134: 14 | V134: 4.4000000000000004e-002 | W134: 9.8000000000000004e-002 | X134: 0.109 | Y134: 25 | Z134: 2.9 | AA134: -9.3999999999999986e-003 | AB134: -1.8100000000000002e-002 | AC134: -7.6700000000000004e-002 | AD134: -7.9100000000000004e-002 | AE134: 85.41 | AF134: 91.73 | AG134: 0.67 | AH134: A+ | AI134: 7.0000000000000007e-002 | AJ134: =H134+100*O134 -> 149.39999999999998 | AK134: 151.5 | AL134: 65 | AM134: 59.7 | AN134: 104 | AO134: -4.0000000000000001e-003 | AP134: 25 | AQ134: 海波转债!
A135: 134 | B135: 113610 | C135: 灵康转债 | D135: 603669 | E135: 灵康药业 | F135: 医药 | G135: 化学制药 | H135: 122.37 | I135: -7.8000000000000005e-003 | J135: -6.0000000000000001e-003 | K135: 8.16 | L135: -2.5099999999999997e-002 | M135: 120.7 | N135: 8.61 | O135: 0.29100000000000004 | P135: 94.77 | Q135: 已到 | R135: 4.80年 | S135: 2.80年 | T135: 4.58 | U135: 31 | V135: 5.5e-002 | W135: 7.8e-002 | X135: 7.400000000000001e-002 | Y135: 59 | Z135: 4.27 | AA135: -2.8999999999999998e-003 | AB135: -1.03e-002 | AC135: -5.5e-002 | AD135: -5.7200000000000001e-002 | AE135: 87.57 | AF135: 92.21 | AG135: 0.55 | AH135: AA- | AI135: 5.9000000000000004e-002 | AJ135: =H135+100*O135 -> 151.47 | AK135: 150 | AL135: 53 | AM135: 57.8 | AN135: 91 | AO135: -8.1000000000000003e-002 | AP135: 30 | AQ135: 灵康转债
A136: 135 | B136: 128139 | C136: 祥鑫转债! | D136: 2965 | E136: 祥鑫科技 | F136: 汽车 | G136: 零部件制 | H136: 123.99 | I136: -1.0500000000000001e-002 | J136: 3.7000000000000002e-003 | K136: 23.8 | L136: -1.3300000000000001e-002 | M136: 120.6 | N136: 26.38 | O136: 0.374 | P136: 90.22 | Q136: 已到 | R136: 4.80年 | S136: 2.80年 | T136: 6.47 | U136: 7.8 | V136: 1.e-002 | W136: 0.17699999999999999 | X136: 0.16 | Y136: 37 | Z136: 2.06 | AA136: -5.8999999999999999e-003 | AB136: -1.3100000000000001e-002 | AC136: -5.9500000000000004e-002 | AD136: -6.1600000000000002e-002 | AE136: 87.47 | AF136: 92.11 | AG136: 0.51 | AH136: AA- | AI136: 5.9000000000000004e-002 | AJ136: =H136+100*O136 -> 161.38999999999999 | AK136: 157.8 | AL136: 117 | AM136: 65.6 | AN136: 157 | AO136: -2.7000000000000003e-002 | AP136: 14 | AQ136: 祥鑫转债!
A137: 136 | B137: 123078 | C137: 飞凯转债!! | D137: 300398 | E137: 飞凯材料 | F137: 化工 | G137: 化工 | H137: 177.27 | I137: -4.6399999999999997e-002 | J137: 1.e-002 | K137: 24.27 | L137: -4.1100000000000005e-002 | M137: 114.9 | N137: 15.56 | O137: 0.13699999999999998 | P137: 155.98 | Q137: 已到 | R137: 4.79年 | S137: 2.79年 | T137: 7.2 | U137: 248 | V137: 0.191 | W137: 5.7000000000000002e-002 | X137: 8.900000000000001e-002 | Y137: 127 | Z137: 4.33 | AA137: -8.8000000000000009e-002 | AB137: -9.2799999999999994e-002 | AC137: -0.109 | AD137: -0.11 | AE137: 92.71 | AF137: 96.45 | AG137: 0.89 | AH137: AA | AI137: 3.7999999999999999e-002 | AJ137: =H137+100*O137 -> 190.97 | AK137: 198.6 | AL137: 332 | AM137: 102.1 | AN137: 323 | AO137: -0.11 | AP137: 9 | AQ137: 飞凯转债!!
A138: 137 | B138: 113609 | C138: 永安转债! | D138: 603776 | E138: 永安行 | F138: 城市公用 | G138: 其他 | H138: 121.9 | I138: -1.3999999999999999e-002 | J138: -2.7000000000000001e-003 | K138: 15.72 | L138: -3.0200000000000001e-002 | M138: 120.1 | N138: 16.48 | O138: 0.27800000000000002 | P138: 95.39 | Q138: 已到 | R138: 4.78年 | S138: 2.78年 | T138: 7.34 | U138: 54 | V138: 5.9999999999999998e-002 | W138: 0.20000000000000001 | X138: 0.191 | Y138: 37 | Z138: 1.12 | AA138: -3.2000000000000002e-003 | AB138: -1.03e-002 | AC138: -5.4600000000000003e-002 | AD138: -5.67e-002 | AE138: 87.5 | AF138: 91.81 | AG138: 0.55 | AH138: AA- | AI138: 5.9000000000000004e-002 | AJ138: =H138+100*O138 -> 149.70000000000002 | AK138: 148.4 | AL138: 45 | AM138: 56.6 | AN138: 80 | AO138: -0.126 | AP138: 26 | AQ138: 永安转债!
A139: 138 | B139: 123077 | C139: 汉得转债! | D139: 300170 | E139: 汉得信息 | F139: 计算机及 | G139: 软件开发 | H139: 127.3 | I139: 2.5000000000000001e-003 | J139: -1.0800000000000001e-002 | K139: 8.4 | L139: -2.5499999999999998e-002 | M139: 125.1 | N139: 9.69 | O139: 0.46799999999999997 | P139: 86.69 | Q139: 已到 | R139: 4.78年 | S139: 2.78年 | T139: 9.37 | U139: 27 | V139: 2.3e-002 | W139: 0.126 | X139: 0.109 | Y139: 74 | Z139: 2.37 | AA139: -3.7000000000000002e-003 | AB139: -1.23e-002 | AC139: -6.8600000000000008e-002 | AD139: -7.0599999999999996e-002 | AE139: 92.77 | AF139: 105.03 | AG139: 0.33 | AH139: AA | AI139: 3.7999999999999999e-002 | AJ139: =H139+100*O139 -> 174.09999999999999 | AK139: 167.9 | AL139: 213 | AM139: 62.9 | AN139: 130 | AO139: -2.1000000000000001e-002 | AP139: 17 | AQ139: 汉得转债!
A140: 139 | B140: 110077 | C140: 洪城转债 | D140: 600461 | E140: 洪城环境 | F140: 城市公用 | G140: 城市公用 | H140: 142.42 | I140: -1.34e-002 | J140: 8.0000000000000002e-003 | K140: 8.23 | L140: -7.1999999999999998e-003 | M140: 113.3 | N140: 6.71 | O140: 0.161 | P140: 122.65 | Q140: 已到 | R140: 4.77年 | S140: 2.77年 | T140: 17.7 | U140: 21 | V140: 8.0000000000000002e-003 | W140: 0.22500000000000001 | X140: 0.27600000000000002 | Y140: 78 | Z140: 1.45 | AA140: -4.7400000000000005e-002 | AB140: -5.21e-002 | AC140: -0.106 | AD140: -0.10800000000000001 | AE140: 92.83 | AF140: 97.24 | AG140: 0.74 | AH140: AA+ | AI140: 3.3000000000000002e-002 | AJ140: =H140+100*O140 -> 158.51999999999998 | AK140: 162.2 | AL140: 162 | AM140: 64.9 | AN140: 150 | AO140: 1.e-002 | AP140: 6 | AQ140: 洪城转债
A141: 140 | B141: 123076 | C141: 强力转债! | D141: 300429 | E141: 强力新材 | F141: 化工 | G141: 化工 | H141: 112.377 | I141: -2.5000000000000001e-003 | J141: -4.0000000000000002e-004 | K141: 11.17 | L141: -1.7600000000000001e-002 | M141: 118.1 | N141: 18.94 | O141: 0.90500000000000003 | P141: 58.98 | Q141: 已到 | R141: 4.76年 | S141: 2.76年 | T141: 8.5 | U141: 4.9 | V141: 5.0000000000000001e-003 | W141: 0.14800000000000002 | X141: 8.6999999999999994e-002 | Y141: 58 | Z141: 3.18 | AA141: 1.0700000000000001e-002 | AB141: 4.0000000000000001e-003 | AC141: -2.81e-002 | AD141: -3.0299999999999997e-002 | AE141: 87.56 | AF141: 90.36 | AG141: 0.17 | AH141: AA- | AI141: 5.9000000000000004e-002 | AJ141: =H141+100*O141 -> 202.87700000000001 | AK141: 165.8 | AL141: 198 | AM141: 75.4 | AN141: 229 | AO141: -4.9000000000000002e-002 | AP141: 24 | AQ141: 强力转债!
A142: 141 | B142: 128138 | C142: 侨银转债! | D142: 2973 | E142: 侨银股份 | F142: 城市公用 | G142: 城市公用 | H142: 119.97 | I142: 1.4000000000000002e-003 | J142: -3.0999999999999999e-003 | K142: 15.33 | L142: -1.3500000000000002e-002 | M142: 136.1 | N142: 25.33 | O142: 0.98199999999999998 | P142: 60.52 | Q142: 已到 | R142: 4.76年 | S142: 2.76年 | T142: 4.2 | U142: 4 | V142: 8.0000000000000002e-003 | W142: 6.7000000000000004e-002 | X142: 4.0999999999999995e-002 | Y142: 63 | Z142: 3.91 | AA142: 2.7400000000000001e-002 | AB142: 1.54e-002 | AC142: -4.8000000000000001e-002 | AD142: -5.04e-002 | AE142: 88.09 | AF142: 104.16 | AG142: 0.13 | AH142: AA- | AI142: 5.9000000000000004e-002 | AJ142: =H142+100*O142 -> 218.17000000000002 | AK142: 179.4 | AL142: 285 | AM142: 75.3 | AN142: 227 | AO142: -1.8000000000000002e-002 | AP142: 27 | AQ142: 侨银转债!
A143: 142 | B143: 113608 | C143: 威派转债! | D143: 603956 | E143: 威派格 | F143: 机械装备 | G143: 专用设备 | H143: 123.43 | I143: -2.9600000000000001e-002 | J143: -5.3e-003 | K143: 15.15 | L143: -7.7899999999999997e-002 | M143: 121.1 | N143: 19.08 | O143: 0.55399999999999994 | P143: 79.4 | Q143: 已到 | R143: 4.74年 | S143: 2.74年 | T143: 4.2 | U143: 27 | V143: 5.0000000000000003e-002 | W143: 6.5000000000000002e-002 | X143: 5.2000000000000005e-002 | Y143: 65 | Z143: 5.45 | AA143: -4.0999999999999995e-003 | AB143: -1.1599999999999999e-002 | AC143: -5.7500000000000002e-002 | AD143: -5.9900000000000002e-002 | AE143: 85.71 | AF143: 88.56 | AG143: 0.45 | AH143: A+ | AI143: 7.0000000000000007e-002 | AJ143: =H143+100*O143 -> 178.82999999999998 | AK143: 167.5 | AL143: 209 | AM143: 78.9 | AN143: 245 | AO143: -0.14699999999999999 | AP143: 9 | AQ143: 威派转债!
A144: 143 | B144: 127025 | C144: 冀东转债! | D144: 401 | E144: 冀东水泥 | F144: 建筑 | G144: 水泥 | H144: 122.392 | I144: -4.0999999999999995e-003 | J144: 5.9999999999999995e-004 | K144: 12.56 | L144: -7.9000000000000008e-003 | M144: 109.9 | N144: 14.01 | O144: 0.36499999999999999 | P144: 89.65 | Q144: 已到 | R144: 4.73年 | S144: 2.73年 | T144: 17.8 | U144: 50 | V144: 2.3e-002 | W144: 5.2999999999999999e-002 | X144: 4.8000000000000001e-002 | Y144: 334 | Z144: 1.09 | AA144: -2.29e-002 | AB144: -2.6600000000000002e-002 | AC144: -5.9299999999999999e-002 | AD144: -6.0899999999999996e-002 | AE144: 94.03 | AF144: 95.35 | AG144: 0.45 | AH144: AAA | AI144: 3.1e-002 | AJ144: =H144+100*O144 -> 158.892 | AK144: 155.1 | AL144: 93 | AM144: 59.8 | AN144: 105 | AO144: 3.4000000000000002e-002 | AP144: 8 | AQ144: 冀东转债!
A145: 144 | B145: 127024 | C145: 盈峰转债! | D145: 967 | E145: 盈峰环境 | F145: 机械装备 | G145: 专用设备 | H145: 119.11 | I145: -1.0500000000000001e-002 | J145: 6.8999999999999999e-003 | K145: 6.21 | L145: -1.5800000000000002e-002 | M145: 116.6 | N145: 8.19 | O145: 0.57100000000000006 | P145: 75.82 | Q145: 已到 | R145: 4.72年 | S145: 2.72年 | T145: 14.8 | U145: 10 | V145: 6.0000000000000001e-003 | W145: 7.4999999999999997e-002 | X145: 5.7000000000000002e-002 | Y145: 197 | Z145: 1.2 | AA145: -4.5999999999999999e-003 | AB145: -1.0700000000000001e-002 | AC145: -4.9000000000000002e-002 | AD145: -5.0900000000000001e-002 | AE145: 93.93 | AF145: 100.29 | AG145: 0.23 | AH145: AA+ | AI145: 3.3000000000000002e-002 | AJ145: =H145+100*O145 -> 176.21000000000001 | AK145: 162.4 | AL145: 165 | AM145: 62.1 | AN145: 122 | AO145: -4.2000000000000003e-002 | AP145: 5 | AQ145: 盈峰转债!
A146: 145 | B146: 128137 | C146: 洁美转债! | D146: 2859 | E146: 洁美科技 | F146: 电子 | G146: 元器件制 | H146: 141.3 | I146: -4.0599999999999997e-002 | J146: 2.6800000000000001e-002 | K146: 30.93 | L146: -1.9699999999999999e-002 | M146: 116.9 | N146: 27.63 | O146: 0.26200000000000001 | P146: 111.94 | Q146: 已到 | R146: 4.72年 | S146: 2.72年 | T146: 5.99 | U146: 15 | V146: 1.7000000000000001e-002 | W146: 4.7e-002 | X146: 5.2999999999999999e-002 | Y146: 127 | Z146: 6.44 | AA146: -4.0000000000000001e-002 | AB146: -4.5899999999999996e-002 | AC146: -0.10199999999999999 | AD146: -0.10400000000000001 | AE146: 87.74 | AF146: 89.65 | AG146: 0.7 | AH146: AA- | AI146: 5.9000000000000004e-002 | AJ146: =H146+100*O146 -> 167.5 | AK146: 170.7 | AL146: 237 | AM146: 81 | AN146: 256 | AO146: -8.199999999999999e-002 | AP146: 5 | AQ146: 洁美转债!
A147: 146 | B147: 128136 | C147: 立讯转债! | D147: 2475 | E147: 立讯精密 | F147: 电子 | G147: 元器件制 | H147: 123.5 | I147: -8.8000000000000005e-003 | J147: -4.3e-003 | K147: 41.05 | L147: -6.0899999999999996e-002 | M147: 111.8 | N147: 57.97 | O147: 0.74400000000000011 | P147: 70.81 | Q147: 已到 | R147: 4.72年 | S147: 2.72年 | T147: 30 | U147: 49 | V147: 1.3000000000000001e-002 | W147: 1.e-002 | X147: 6.9999999999999993e-003 | Y147: 2903. | Z147: 8.98 | AA147: -2.1099999999999997e-002 | AB147: -2.5499999999999998e-002 | AC147: -6.3299999999999995e-002 | AD147: -6.4699999999999994e-002 | AE147: 93.17 | AF147: 96.1 | AG147: 0.22 | AH147: AA+ | AI147: 3.3000000000000002e-002 | AJ147: =H147+100*O147 -> 197.90000000000001 | AK147: 176.2 | AL147: 271 | AM147: 80.1 | AN147: 251 | AO147: -0.122 | AP147: 14 | AQ147: 立讯转债!
A148: 147 | B148: 110076 | C148: 华海转债! | D148: 600521 | E148: 华海药业 | F148: 医药 | G148: 医药行业 | H148: 118.4 | I148: -1.3300000000000001e-002 | J148: 3.8e-003 | K148: 19.33 | L148: -0.10000000000000001 | M148: 114.8 | N148: 33.85 | O148: 1.0700000000000001 | P148: 57.1 | Q148: 已到 | R148: 4.72年 | S148: 2.72年 | T148: 18.4 | U148: 28 | V148: 1.3000000000000001e-002 | W148: 6.4000000000000001e-002 | X148: 3.6000000000000004e-002 | Y148: 288 | Z148: 4.4 | AA148: -6.6e-003 | AB148: -1.2199999999999999e-002 | AC148: -4.6500000000000007e-002 | AD148: -4.8600000000000004e-002 | AE148: 92.85 | AF148: 96.6 | AG148: 0.09 | AH148: AA | AI148: 3.7999999999999999e-002 | AJ148: =H148+100*O148 -> 225.40000000000001 | AK148: 179.7 | AL148: 288 | AM148: 83.1 | AN148: 269 | AO148: -0.13400000000000001 | AP148: 8 | AQ148: 华海转债!
A149: 148 | B149: 123075 | C149: 贝斯转债! | D149: 300580 | E149: 贝斯特 | F149: 汽车 | G149: 零部件制 | H149: 148.948 | I149: -4.2800000000000005e-002 | J149: 1.0700000000000001e-002 | K149: 28.9 | L149: -4.24e-002 | M149: 115.1 | N149: 23.74 | O149: 0.22399999999999998 | P149: 121.74 | Q149: 已到 | R149: 4.72年 | S149: 2.72年 | T149: 6 | U149: 47 | V149: 5.2000000000000005e-002 | W149: 0.10400000000000001 | X149: 0.126 | Y149: 58 | Z149: 3.26 | AA149: -5.4100000000000002e-002 | AB149: -5.9299999999999999e-002 | AC149: -0.11800000000000001 | AD149: -0.12 | AE149: 87.8 | AF149: 88.32 | AG149: 0.75 | AH149: AA- | AI149: 5.9000000000000004e-002 | AJ149: =H149+100*O149 -> 171.34800000000001 | AK149: 176.2 | AL149: 270 | AM149: 87.8 | AN149: 291 | AO149: -5.9999999999999998e-002 | AP149: 9 | AQ149: 贝斯转债!
A150: 149 | B150: 113606 | C150: 荣泰转债 | D150: 603579 | E150: 荣泰健康 | F150: 机械装备 | G150: 专用设备 | H150: 127.61 | I150: -5.3e-003 | J150: -1.e-003 | K150: 30.35 | L150: -1.2e-002 | M150: 120.7 | N150: 32.83 | O150: 0.38 | P150: 92.45 | Q150: 已到 | R150: 4.71年 | S150: 2.71年 | T150: 6 | U150: 34 | V150: 4.4000000000000004e-002 | W150: 0.14099999999999999 | X150: 0.13100000000000001 | Y150: 42 | Z150: 2.54 | AA150: -1.2e-002 | AB150: -1.9400000000000001e-002 | AC150: -7.0400000000000004e-002 | AD150: -7.2599999999999998e-002 | AE150: 88.01 | AF150: 92.67 | AG150: 0.52 | AH150: AA- | AI150: 5.9000000000000004e-002 | AJ150: =H150+100*O150 -> 165.61000000000001 | AK150: 162.8 | AL150: 169 | AM150: 70.1 | AN150: 185 | AO150: -4.0000000000000001e-002 | AP150: 11 | AQ150: 荣泰转债
A151: 150 | B151: 123073 | C151: 同和转债!! | D151: 300636 | E151: 同和药业 | F151: 医药 | G151: 原料药 | H151: 144.51 | I151: -3.73e-002 | J151: -1.41e-002 | K151: 19.26 | L151: -6.6000000000000003e-002 | M151: 121.9 | N151: 14.82 | O151: 0.11199999999999999 | P151: 129.96 | Q151: 已到 | R151: 4.70年 | S151: 2.70年 | T151: 3.58 | U151: 61 | V151: 0.11599999999999999 | W151: 8.9999999999999997e-002 | X151: 0.11699999999999999 | Y151: 40 | Z151: 4.82 | AA151: -3.6299999999999999e-002 | AB151: -4.3799999999999999e-002 | AC151: -0.10800000000000001 | AD151: -0.11 | AE151: 85.91 | AF151: 89.36 | AG151: 0.78 | AH151: A+ | AI151: 7.0000000000000007e-002 | AJ151: =H151+100*O151 -> 155.70999999999998 | AK151: 159.1 | AL151: 127 | AM151: 69.7 | AN151: 180 | AO151: -0.128 | AP151: 13 | AQ151: 同和转债!!
A152: 151 | B152: 113605 | C152: 大参转债! | D152: 603233 | E152: 大参林 | F152: 医药 | G152: 医药商业 | H152: 116.32 | I152: -4.0999999999999995e-003 | J152: 1.2999999999999999e-003 | K152: 36.44 | L152: -5.1799999999999999e-002 | M152: 114.9 | N152: 69.05 | O152: 1.2 | P152: 52.77 | Q152: 已到 | R152: 4.69年 | S152: 2.69年 | T152: 14 | U152: 2.5 | V152: 2.e-003 | W152: 4.9000000000000002e-002 | X152: 2.6000000000000002e-002 | Y152: 288 | Z152: 5.42 | AA152: -2.7000000000000001e-003 | AB152: -8.3000000000000001e-003 | AC152: -4.07e-002 | AD152: -4.2900000000000001e-002 | AE152: 93.05 | AF152: 96.81 | AG152: 0.05 | AH152: AA | AI152: 3.7999999999999999e-002 | AJ152: =H152+100*O152 -> 236.31999999999999 | AK152: 179.9 | AL152: 290 | AM152: 83.1 | AN152: 268 | AO152: -0.10300000000000001 | AP152: 8 | AQ152: 大参转债!
A153: 152 | B153: 123071 | C153: 天能转债!! | D153: 300569 | E153: 天能重工 | F153: 能源电力 | G153: 风能 | H153: 206 | I153: -1.43e-002 | J153: 1.3600000000000001e-002 | K153: 14.09 | L153: -7.000000000000001e-004 | M153: 120.7 | N153: 7.91 | O153: 0.156 | P153: 178.13 | Q153: 已到 | R153: 4.68年 | S153: 2.68年 | T153: 6.94 | U153: 333 | V153: 0.23000000000000001 | W153: 6.2e-002 | X153: 0.11 | Y153: 112 | Z153: 3.19 | AA153: -0.11 | AB153: -0.11599999999999999 | AC153: -0.13800000000000001 | AD153: -0.13900000000000001 | AE153: 88.12 | AF153: 92.8 | AG153: 0.92 | AH153: AA- | AI153: 5.9000000000000004e-002 | AJ153: =H153+100*O153 -> 221.59999999999999 | AK153: 233.9 | AL153: 351 | AM153: 141.1 | AN153: 352 | AO153: 7.0999999999999994e-002 | AP153: 12 | AQ153: 天能转债!!
A154: 153 | B154: 123072 | C154: 乐歌转债! | D154: 300729 | E154: 乐歌股份 | F154: 其他 | G154: 家居用品 | H154: 122.3 | I154: -3.2000000000000002e-003 | J154: 1.e-004 | K154: 23.11 | L154: -4.2300000000000004e-002 | M154: 129.1 | N154: 49.24 | O154: 1.6100000000000001 | P154: 46.93 | Q154: 已到 | R154: 4.68年 | S154: 2.68年 | T154: 1.42 | U154: 17 | V154: 9.6000000000000002e-002 | W154: 2.7999999999999997e-002 | X154: 1.3000000000000001e-002 | Y154: 51 | Z154: 2.82 | AA154: 1.2e-002 | AB154: 1.7000000000000001e-003 | AC154: -4.8899999999999999e-002 | AD154: -5.2699999999999997e-002 | AE154: 87.8 | AF154: 95 | AG154: 0.07 | AH154: A+ | AI154: 7.0000000000000007e-002 | AJ154: =H154+100*O154 -> 283.30000000000001 | AK154: 197.7 | AL154: 330 | AM154: 102.7 | AN154: 324 | AO154: -0.105 | AP154: 12 | AQ154: 乐歌转债!
A155: 154 | B155: 123070 | C155: 鹏辉转债! | D155: 300438 | E155: 鹏辉能源 | F155: 汽车 | G155: 零部件制 | H155: 223 | I155: 1.1299999999999999e-002 | J155: -1.9900000000000001e-002 | K155: 35.81 | L155: -9.1000000000000004e-003 | M155: 114.8 | N155: 20.08 | O155: 0.25 | P155: 178.34 | Q155: 已到 | R155: 4.68年 | S155: 2.68年 | T155: 5.99 | U155: 652 | V155: 0.48200000000000004 | W155: 3.9e-002 | X155: 6.9000000000000006e-002 | Y155: 155 | Z155: 5.94 | AA155: -0.13400000000000001 | AB155: -0.13900000000000001 | AC155: -0.14999999999999999 | AD155: -0.151 | AE155: 92.97 | AF155: 96.73 | AG155: 0.94 | AH155: AA | AI155: 3.7999999999999999e-002 | AJ155: =H155+100*O155 -> 248. | AK155: 267.7 | AL155: 362 | AM155: 170.9 | AN155: 364 | AO155: -0.128 | AP155: 8 | AQ155: 鹏辉转债!
A156: 155 | B156: 128135 | C156: 洽洽转债! | D156: 2557 | E156: 洽洽食品 | F156: 食品饮料 | G156: 休闲食品 | H156: 130.789 | I156: -1.6000000000000001e-003 | J156: 3.4000000000000002e-003 | K156: 58.03 | L156: 3.8e-003 | M156: 119.9 | N156: 60.03 | O156: 0.35299999999999998 | P156: 96.67 | Q156: 已到 | R156: 4.68年 | S156: 2.68年 | T156: 13.4 | U156: 22 | V156: 1.3000000000000001e-002 | W156: 4.5999999999999999e-002 | X156: 4.4000000000000004e-002 | Y156: 294 | Z156: 6.74 | AA156: -1.8700000000000001e-002 | AB156: -2.58e-002 | AC156: -7.9699999999999993e-002 | AD156: -8.1799999999999998e-002 | AE156: 93.07 | AF156: 101.02 | AG156: 0.46 | AH156: AA | AI156: 3.7999999999999999e-002 | AJ156: =H156+100*O156 -> 166.089 | AK156: 164.9 | AL156: 184 | AM156: 63.9 | AN156: 136 | AO156: 2.8999999999999998e-002 | AP156: 11 | AQ156: 洽洽转债!
A157: 156 | B157: 127022 | C157: 恒逸转债 | D157: 703 | E157: 恒逸石化 | F157: 化工 | G157: 化工 | H157: 126.278 | I157: -1.3500000000000002e-002 | J157: 1.06e-002 | K157: 10.36 | L157: -5.7999999999999996e-003 | M157: 108.7 | N157: 11.2 | O157: 0.36499999999999999 | P157: 92.5 | Q157: 已到 | R157: 4.67年 | S157: 2.67年 | T157: 20 | U157: 6.6 | V157: 3.0000000000000001e-003 | W157: 5.2999999999999999e-002 | X157: 4.9000000000000002e-002 | Y157: 380 | Z157: 1.47 | AA157: -3.2000000000000001e-002 | AB157: -3.5299999999999998e-002 | AC157: -7.1399999999999991e-002 | AD157: -7.2800000000000004e-002 | AE157: 93.48 | AF157: 93.62 | AG157: 0.5 | AH157: AA+ | AI157: 3.3000000000000002e-002 | AJ157: =H157+100*O157 -> 162.77800000000002 | AK157: 160.1 | AL157: 141 | AM157: 66.4 | AN157: 163 | AO157: -6.0000000000000001e-003 | AP157: 6 | AQ157: 恒逸转债
A158: 157 | B158: 110075 | C158: 南航转债 | D158: 600029 | E158: 南方航空 | F158: 交通运输 | G158: 航空运输 | H158: 144.98 | I158: -1.7000000000000001e-002 | J158: -1.e-004 | K158: 7.62 | L158: -2.3099999999999999e-002 | M158: 109.8 | N158: 6.24 | O158: 0.187 | P158: 122.12 | Q158: 已到 | R158: 4.67年 | S158: 2.67年 | T158: 59 | U158: 228 | V158: 2.6000000000000002e-002 | W158: 4.5999999999999999e-002 | X158: 5.5999999999999994e-002 | Y158: 1291. | Z158: 1.75 | AA158: -5.8499999999999996e-002 | AB158: -6.2e-002 | AC158: -0.11599999999999999 | AD158: -0.11699999999999999 | AE158: 93.63 | AF158: 95.39 | AG158: 0.74 | AH158: AAA | AI158: 3.1e-002 | AJ158: =H158+100*O158 -> 163.67999999999998 | AK158: 167.8 | AL158: 212 | AM158: 72.5 | AN158: 205 | AO158: 5.5e-002 | AP158: 8 | AQ158: 南航转债
A159: 158 | B159: 113604 | C159: 多伦转债! | D159: 603528 | E159: 多伦科技 | F159: 计算机及 | G159: 软件开发 | H159: 110.01 | I159: -2.3999999999999998e-003 | J159: -1.9e-003 | K159: 6.13 | L159: -2.3900000000000001e-002 | M159: 116.9 | N159: 10.4 | O159: 0.86599999999999999 | P159: 58.94 | Q159: 已到 | R159: 4.66年 | S159: 2.66年 | T159: 6.4 | U159: 2.1 | V159: 3.0000000000000001e-003 | W159: 0.16699999999999998 | X159: 9.8000000000000004e-002 | Y159: 38 | Z159: 2.35 | AA159: 1.34e-002 | AB159: 6.8999999999999999e-003 | AC159: -2.18e-002 | AD159: -2.41e-002 | AE159: 88.05 | AF159: 89.96 | AG159: 0.18 | AH159: AA- | AI159: 5.9000000000000004e-002 | AJ159: =H159+100*O159 -> 196.61000000000001 | AK159: 161.1 | AL159: 152 | AM159: 71.1 | AN159: 194 | AO159: -0.10199999999999999 | AP159: 16 | AQ159: 多伦转债!
A160: 159 | B160: 128134 | C160: 鸿路转债! | D160: 2541 | E160: 鸿路钢构 | F160: 建筑 | G160: 其他建材 | H160: 154.724 | I160: -1.1299999999999999e-002 | J160: -1.24e-002 | K160: 53.02 | L160: -3.2099999999999997e-002 | M160: 114.8 | N160: 43.51 | O160: 0.27000000000000002 | P160: 121.86 | Q160: 已到 | R160: 4.65年 | S160: 2.65年 | T160: 15.7 | U160: 94 | V160: 3.7999999999999999e-002 | W160: 5.5999999999999994e-002 | X160: 6.8000000000000005e-002 | Y160: 281 | Z160: 4.23 | AA160: -6.3200000000000006e-002 | AB160: -6.83e-002 | AC160: -0.13300000000000001 | AD160: -0.13400000000000001 | AE160: 93.07 | AF160: 96.84 | AG160: 0.74 | AH160: AA | AI160: 3.7999999999999999e-002 | AJ160: =H160+100*O160 -> 181.72399999999999 | AK160: 187.6 | AL160: 312 | AM160: 90.8 | AN160: 302 | AO160: 4.0000000000000001e-003 | AP160: 4 | AQ160: 鸿路转债!
A161: 160 | B161: 128133 | C161: 奇正转债! | D161: 2287 | E161: 奇正藏药 | F161: 医药 | G161: 中药 | H161: 121.45 | I161: -9.1999999999999998e-003 | J161: -2.2000000000000001e-003 | K161: 25.52 | L161: -3.0800000000000001e-002 | M161: 116.9 | N161: 29.79 | O161: 0.41799999999999998 | P161: 85.67 | Q161: 已到 | R161: 4.61年 | S161: 2.61年 | T161: 8 | U161: 8.8 | V161: 9.0000000000000011e-003 | W161: 5.9000000000000004e-002 | X161: 5.0999999999999997e-002 | Y161: 135 | Z161: 4.57 | AA161: -8.3999999999999995e-003 | AB161: -1.4800000000000001e-002 | AC161: -5.6799999999999996e-002 | AD161: -5.9000000000000004e-002 | AE161: 93.33 | AF161: 98.79 | AG161: 0.37 | AH161: AA | AI161: 3.7999999999999999e-002 | AJ161: =H161+100*O161 -> 163.25 | AK161: 157.2 | AL161: 111 | AM161: 58.4 | AN161: 95 | AO161: -7.2999999999999995e-002 | AP161: 20 | AQ161: 奇正转债!
A162: 161 | B162: 123067 | C162: 斯莱转债! | D162: 300382 | E162: 斯莱克 | F162: 机械装备 | G162: 专用设备 | H162: 224.538 | I162: -3.5400000000000001e-002 | J162: -3.6900000000000002e-002 | K162: 16.64 | L162: -7.8600000000000003e-002 | M162: 120.8 | N162: 9.36 | O162: 0.26300000000000001 | P162: 177.78 | Q162: 已到 | R162: 4.59年 | S162: 2.59年 | T162: 2.4 | U162: 46 | V162: 8.4000000000000005e-002 | W162: 2.5000000000000001e-002 | X162: 4.4000000000000004e-002 | Y162: 97 | Z162: 8.36 | AA162: -0.128 | AB162: -0.13500000000000001 | AC162: -0.158 | AD162: -0.159 | AE162: 88.7 | AF162: 93.4 | AG162: 0.92 | AH162: AA- | AI162: 5.9000000000000004e-002 | AJ162: =H162+100*O162 -> 250.83800000000002 | AK162: 271.3 | AL162: 365 | AM162: 177.9 | AN162: 366 | AO162: -0.215 | AP162: 11 | AQ162: 斯莱转债!
A163: 162 | B163: 128132 | C163: 交建转债! | D163: 2941 | E163: 新疆交建 | F163: 建筑 | G163: 建筑工程 | H163: 115.102 | I163: -1.03e-002 | J163: 9.0000000000000011e-003 | K163: 13.01 | L163: -6.8999999999999999e-003 | M163: 116.9 | N163: 18.53 | O163: 0.63900000000000001 | P163: 70.21 | Q163: 已到 | R163: 4.59年 | S163: 2.59年 | T163: 8.49 | U163: 16 | V163: 1.6e-002 | W163: 0.10099999999999999 | X163: 7.0999999999999994e-002 | Y163: 84 | Z163: 3.24 | AA163: 3.4999999999999996e-003 | AB163: -3.0999999999999999e-003 | AC163: -3.85e-002 | AD163: -4.07e-002 | AE163: 93.4 | AF163: 98.86 | AG163: 0.19 | AH163: AA | AI163: 3.7999999999999999e-002 | AJ163: =H163+100*O163 -> 179.00200000000001 | AK163: 160 | AL163: 138 | AM163: 61.1 | AN163: 114 | AO163: 5.0999999999999997e-002 | AP163: 29 | AQ163: 交建转债!
A164: 163 | B164: 128131 | C164: 崇达转2! | D164: 2815 | E164: 崇达技术 | F164: 电子 | G164: 元器件制 | H164: 122.638 | I164: -1.1000000000000001e-002 | J164: 1.8e-003 | K164: 14.37 | L164: -3.7499999999999999e-002 | M164: 114.9 | N164: 19.38 | O164: 0.65400000000000003 | P164: 74.15 | Q164: 已到 | R164: 4.56年 | S164: 2.56年 | T164: 14 | U164: 7.2 | V164: 4.0000000000000001e-003 | W164: 0.111 | X164: 8.199999999999999e-002 | Y164: 126 | Z164: 2.93 | AA164: -1.4499999999999999e-002 | AB164: -2.0099999999999996e-002 | AC164: -6.0999999999999999e-002 | AD164: -6.3200000000000006e-002 | AE164: 93.48 | AF164: 97.25 | AG164: 0.24 | AH164: AA | AI164: 3.7999999999999999e-002 | AJ164: =H164+100*O164 -> 188.03800000000001 | AK164: 171.1 | AL164: 239 | AM164: 73.9 | AN164: 213 | AO164: -7.5999999999999998e-002 | AP164: 11 | AQ164: 崇达转2!
A165: 164 | B165: 123065 | C165: 宝莱转债! | D165: 300246 | E165: 宝莱特 | F165: 医药 | G165: 医疗器械 | H165: 116.498 | I165: -2.5999999999999999e-003 | J165: 1.1000000000000001e-003 | K165: 18.43 | L165: -2.7999999999999997e-002 | M165: 121 | N165: 40.14 | O165: 1.54 | P165: 45.91 | Q165: 已到 | R165: 4.56年 | S165: 2.56年 | T165: 2.19 | U165: 11 | V165: 4.4000000000000004e-002 | W165: 8.1000000000000003e-002 | X165: 3.7000000000000005e-002 | Y165: 27 | Z165: 3.09 | AA165: 8.5000000000000006e-003 | AB165: 5.9999999999999995e-004 | AC165: -4.1500000000000002e-002 | AD165: -4.41e-002 | AE165: 89.04 | AF165: 93.75 | AG165: 0.05 | AH165: AA- | AI165: 5.9000000000000004e-002 | AJ165: =H165+100*O165 -> 270.49799999999999 | AK165: 187.1 | AL165: 310 | AM165: 93.3 | AN165: 306 | AO165: -7.2999999999999995e-002 | AP165: 24 | AQ165: 宝莱转债!
A166: 165 | B166: 123064 | C166: 万孚转债! | D166: 300482 | E166: 万孚生物 | F166: 医药 | G166: 医疗器械 | H166: 120.26 | I166: -4.7699999999999992e-002 | J166: 3.7400000000000003e-002 | K166: 34.76 | L166: -5.8799999999999998e-002 | M166: 114.8 | N166: 52 | O166: 0.79900000000000004 | P166: 66.85 | Q166: 已到 | R166: 4.55年 | S166: 2.55年 | T166: 5.99 | U166: 55 | V166: 7.6999999999999999e-002 | W166: 3.9e-002 | X166: 2.6000000000000002e-002 | Y166: 155 | Z166: 4.83 | AA166: -1.04e-002 | AB166: -1.61e-002 | AC166: -5.4800000000000001e-002 | AD166: -5.7000000000000002e-002 | AE166: 93.44 | AF166: 97.21 | AG166: 0.18 | AH166: AA | AI166: 3.7999999999999999e-002 | AJ166: =H166+100*O166 -> 200.16000000000003 | AK166: 173.7 | AL166: 261 | AM166: 76.5 | AN166: 237 | AO166: -0.19 | AP166: 14 | AQ166: 万孚转债!
A167: 166 | B167: 128130 | C167: 景兴转债 | D167: 2067 | E167: 景兴纸业 | F167: 造纸包装 | G167: 包装用纸 | H167: 128.2 | I167: -3.4000000000000002e-003 | J167: -1.7000000000000001e-003 | K167: 3.92 | L167: -7.6e-003 | M167: 114.8 | N167: 3.4 | O167: 0.11199999999999999 | P167: 115.29 | Q167: 已到 | R167: 4.55年 | S167: 2.55年 | T167: 9.99 | U167: 37 | V167: 2.8999999999999998e-002 | W167: 0.21299999999999999 | X167: 0.24600000000000002 | Y167: 47 | Z167: 0.89 | AA167: -2.4399999999999998e-002 | AB167: -2.9999999999999999e-002 | AC167: -7.7100000000000002e-002 | AD167: -7.9100000000000004e-002 | AE167: 93.44 | AF167: 97.22 | AG167: 0.67 | AH167: AA | AI167: 3.7999999999999999e-002 | AJ167: =H167+100*O167 -> 139.39999999999998 | AK167: 141.1 | AL167: 15 | AM167: 43.9 | AN167: 24 | AO167: -8.0000000000000002e-003 | AP167: 20 | AQ167: 景兴转债
A168: 167 | B168: 128129 | C168: 青农转债! | D168: 2958 | E168: 青农商行 | F168: 金融 | G168: 银行行业 | H168: 115.05 | I168: 1.4000000000000002e-003 | J168: -1.4000000000000002e-003 | K168: 3.89 | L168: 0. | M168: 112 | N168: 4.32 | O168: 0.27800000000000002 | P168: 90.05 | Q168: 已到 | R168: 4.53年 | S168: 无权 | T168: 50 | U168: 15 | V168: 3.0000000000000001e-003 | W168: 0.23100000000000001 | X168: 0.20800000000000002 | Y168: 216 | Z168: 0.76 | AA168: -6.0000000000000001e-003 | AB168: -1.0800000000000001e-002 | AC168: 无权 | AD168: 无权 | AE168: 无权 | AF168: 97.76 | AG168: 0.43 | AH168: AAA | AI168: 3.1e-002 | AJ168: =H168+100*O168 -> 142.84999999999999 | AK168: 140.1 | AL168: 12 | AM168: 42.3 | AN168: 19 | AO168: -1.e-003 | AP168: 29 | AQ168: 青农转债!
A169: 168 | B169: 113602 | C169: 景20转债! | D169: 603228 | E169: 景旺电子 | F169: 电子 | G169: 元器件制 | H169: 139.8 | I169: -3.0299999999999997e-002 | J169: -1.89e-002 | K169: 31.83 | L169: -6.9000000000000006e-002 | M169: 112.9 | N169: 27.4 | O169: 0.20300000000000001 | P169: 116.17 | Q169: 已到 | R169: 4.53年 | S169: 2.53年 | T169: 17.8 | U169: 111 | V169: 4.4000000000000004e-002 | W169: 6.6000000000000003e-002 | X169: 7.5999999999999998e-002 | Y169: 271 | Z169: 4.02 | AA169: -4.7e-002 | AB169: -5.1799999999999999e-002 | AC169: -0.106 | AD169: -0.10800000000000001 | AE169: 93.61 | AF169: 95.7 | AG169: 0.71 | AH169: AA | AI169: 3.7999999999999999e-002 | AJ169: =H169+100*O169 -> 160.10000000000002 | AK169: 163.4 | AL169: 174 | AM169: 67.7 | AN169: 168 | AO169: -4.9000000000000002e-002 | AP169: 8 | AQ169: 景20转债!
A170: 169 | B170: 113039 | C170: 嘉泽转债!! | D170: 601619 | E170: 嘉泽新能 | F170: 能源电力 | G170: 风能 | H170: 153.07 | I170: -1.e-002 | J170: -7.1999999999999998e-003 | K170: 4.69 | L170: -2.0899999999999998e-002 | M170: 112.8 | N170: 3.46 | O170: 0.129 | P170: 135.55 | Q170: 已到 | R170: 4.53年 | S170: 2.53年 | T170: 2.88 | U170: 54 | V170: 0.121 | W170: 2.5000000000000001e-002 | X170: 3.4000000000000002e-002 | Y170: 114 | Z170: 2.39 | AA170: -6.6400000000000001e-002 | AB170: -7.0900000000000005e-002 | AC170: -0.13500000000000001 | AD170: -0.13699999999999998 | AE170: 93.51 | AF170: 95.6 | AG170: 0.82 | AH170: AA | AI170: 3.7999999999999999e-002 | AJ170: =H170+100*O170 -> 165.97 | AK170: 170.6 | AL170: 236 | AM170: 75 | AN170: 223 | AO170: 1.2e-002 | AP170: 32 | AQ170: 嘉泽转债!!
A171: 170 | B171: 113601 | C171: 塞力转债! | D171: 603716 | E171: 塞力医疗 | F171: 医药 | G171: 医药商业 | H171: 120.25 | I171: -2.2799999999999997e-002 | J171: -4.4000000000000003e-003 | K171: 13.94 | L171: -6.6299999999999998e-002 | M171: 120.8 | N171: 16.98 | O171: 0.46500000000000002 | P171: 82.1 | Q171: 已到 | R171: 4.52年 | S171: 2.52年 | T171: 5.43 | U171: 139 | V171: 0.20999999999999999 | W171: 0.19 | X171: 0.156 | Y171: 29 | Z171: 1.87 | AA171: 1.e-003 | AB171: -6.8000000000000005e-003 | AC171: -5.4100000000000002e-002 | AD171: -5.6500000000000002e-002 | AE171: 89.08 | AF171: 93.8 | AG171: 0.41 | AH171: AA- | AI171: 5.9000000000000004e-002 | AJ171: =H171+100*O171 -> 166.75 | AK171: 158.4 | AL171: 121 | AM171: 64.6 | AN171: 143 | AO171: -0.20199999999999999 | AP171: 40 | AQ171: 塞力转债!
A172: 171 | B172: 128128 | C172: 齐翔转2! | D172: 2408 | E172: 齐翔腾达 | F172: 化工 | G172: 化工 | H172: 190 | I172: -3.2099999999999997e-002 | J172: -1.47e-002 | K172: 9.39 | L172: -5.1500000000000004e-002 | M172: 115 | N172: 5.69 | O172: 0.151 | P172: 165.03 | Q172: 已到 | R172: 4.52年 | S172: 2.52年 | T172: 6.81 | U172: 86 | V172: 6.6000000000000003e-002 | W172: 2.5000000000000001e-002 | X172: 4.2000000000000003e-002 | Y172: 267 | Z172: 2.14 | AA172: -0.107 | AB172: -0.11199999999999999 | AC172: -0.13800000000000001 | AD172: -0.13900000000000001 | AE172: 93.66 | AF172: 97.52 | AG172: 0.91 | AH172: AA | AI172: 3.7999999999999999e-002 | AJ172: =H172+100*O172 -> 205.09999999999999 | AK172: 215 | AL172: 344 | AM172: 117.5 | AN172: 342 | AO172: -6.9000000000000006e-002 | AP172: 25 | AQ172: 齐翔转2!
A173: 172 | B173: 128127 | C173: 文科转债! | D173: 2775 | E173: 文科园林 | F173: 城市公用 | G173: 生态环境 | H173: 113.4 | I173: -6.5000000000000006e-003 | J173: 8.6e-003 | K173: 4.03 | L173: 5.0000000000000001e-003 | M173: 120.8 | N173: 4.88 | O173: 0.373 | P173: 82.58 | Q173: 已到 | R173: 4.52年 | S173: 2.52年 | T173: 9.49 | U173: 12 | V173: 1.1000000000000001e-002 | W173: 0.45899999999999996 | X173: 0.379 | Y173: 21 | Z173: 0.97 | AA173: 1.44e-002 | AB173: 6.4000000000000003e-003 | AC173: -3.3000000000000002e-002 | AD173: -3.56e-002 | AE173: 89.09 | AF173: 93.81 | AG173: 0.42 | AH173: AA- | AI173: 5.9000000000000004e-002 | AJ173: =H173+100*O173 -> 150.69999999999999 | AK173: 144.2 | AL173: 27 | AM173: 50.4 | AN173: 49 | AO173: 1.8000000000000002e-002 | AP173: 79 | AQ173: 文科转债!
A174: 173 | B174: 110074 | C174: 精达转债!! | D174: 600577 | E174: 精达股份 | F174: 电子 | G174: 电子产品 | H174: 206.9 | I174: -2.0099999999999996e-002 | J174: -1.7899999999999999e-002 | K174: 6.13 | L174: -4.2199999999999994e-002 | M174: 116.9 | N174: 3.73 | O174: 0.25900000000000001 | P174: 164.34 | Q174: 已到 | R174: 4.51年 | S174: 2.51年 | T174: 5.1 | U174: 58 | V174: 5.5e-002 | W174: 4.2000000000000003e-002 | X174: 6.8000000000000005e-002 | Y174: 122 | Z174: 2.83 | AA174: -0.121 | AB174: -0.126 | AC174: -0.152 | AD174: -0.153 | AE174: 93.66 | AF174: 99.13 | AG174: 0.9 | AH174: AA | AI174: 3.7999999999999999e-002 | AJ174: =H174+100*O174 -> 232.80000000000001 | AK174: 249.5 | AL174: 356 | AM174: 150.3 | AN174: 356 | AO174: -0.12 | AP174: 10 | AQ174: 精达转债!!
A175: 174 | B175: 110072 | C175: 广汇转债! | D175: 600297 | E175: 广汇汽车 | F175: 汽车 | G175: 分销、售 | H175: 104.5 | I175: -7.4000000000000003e-003 | J175: 6.8999999999999999e-003 | K175: 2.64 | L175: -3.8e-003 | M175: 114.3 | N175: 4.03 | O175: 0.59499999999999997 | P175: 65.51 | Q175: 已到 | R175: 4.51年 | S175: 2.51年 | T175: 33.7 | U175: 79 | V175: 2.2000000000000002e-002 | W175: 0.157 | X175: 0.10300000000000001 | Y175: 214 | Z175: 0.52 | AA175: 2.0400000000000001e-002 | AB175: 1.46e-002 | AC175: -6.0999999999999995e-003 | AD175: -8.199999999999999e-003 | AE175: 94.3 | AF175: 98.97 | AG175: 0.14 | AH175: AA+ | AI175: 3.3000000000000002e-002 | AJ175: =H175+100*O175 -> 164. | AK175: 143.5 | AL175: 23 | AM175: 44.5 | AN175: 28 | AO175: -1.e-002 | AP175: 86 | AQ175: 广汇转债!
A176: 175 | B176: 113600 | C176: 新星转债!! | D176: 603978 | E176: 深圳新星 | F176: 有色金属 | G176: 有色行业 | H176: 130.86 | I176: -1.61e-002 | J176: 1.2999999999999999e-003 | K176: 22.83 | L176: -2.9700000000000001e-002 | M176: 125.6 | N176: 23.85 | O176: 0.36700000000000005 | P176: 95.72 | Q176: 已到 | R176: 4.50年 | S176: 2.50年 | T176: 4.53 | U176: 4 | V176: 6.9999999999999993e-003 | W176: 0.12 | X176: 0.115 | Y176: 38 | Z176: 2.4 | AA176: -9.300000000000001e-003 | AB176: -1.8500000000000003e-002 | AC176: -8.4900000000000003e-002 | AD176: -8.7100000000000011e-002 | AE176: 89 | AF176: 97.58 | AG176: 0.5 | AH176: AA- | AI176: 5.9000000000000004e-002 | AJ176: =H176+100*O176 -> 167.56 | AK176: 166 | AL176: 201 | AM176: 68.4 | AN176: 173 | AO176: -9.4e-002 | AP176: 23 | AQ176: 新星转债!!
A177: 176 | B177: 127021 | C177: 特发转2! | D177: 70 | E177: 特发信息 | F177: 通信互联 | G177: 通信设备 | H177: 121 | I177: -1.46e-002 | J177: 7.4000000000000003e-003 | K177: 5.85 | L177: -2.8199999999999999e-002 | M177: 113 | N177: 7.33 | O177: 0.51600000000000001 | P177: 79.81 | Q177: 已到 | R177: 3.48年 | S177: 1.48年 | T177: 4.16 | U177: 2.5 | V177: 5.0000000000000001e-003 | W177: 8.4000000000000005e-002 | X177: 6.7000000000000004e-002 | Y177: 49 | Z177: 1.67 | AA177: -1.9699999999999999e-002 | AB177: -2.63e-002 | AC177: -0.10000000000000001 | AD177: -0.10199999999999999 | AE177: 95.72 | AF177: 99.42 | AG177: 0.25 | AH177: AA | AI177: 3.7999999999999999e-002 | AJ177: =H177+100*O177 -> 172.59999999999999 | AK177: 162.2 | AL177: 163 | AM177: 62.8 | AN177: 128 | AO177: -7.9000000000000001e-002 | AP177: 16 | AQ177: 特发转2!
A178: 177 | B178: 113599 | C178: 嘉友转债! | D178: 603871 | E178: 嘉友国际 | F178: 交通运输 | G178: 物流业 | H178: 135.2 | I178: -3.6600000000000001e-002 | J178: 2.0799999999999999e-002 | K178: 20.07 | L178: -2.6200000000000001e-002 | M178: 125.6 | N178: 18.32 | O178: 0.23399999999999999 | P178: 109.55 | Q178: 已到 | R178: 4.47年 | S178: 2.47年 | T178: 7.2 | U178: 11 | V178: 1.1000000000000001e-002 | W178: 0.113 | X178: 0.124 | Y178: 64 | Z178: 2.74 | AA178: -1.66e-002 | AB178: -2.58e-002 | AC178: -9.69e-002 | AD178: -9.9100000000000008e-002 | AE178: 89.11 | AF178: 97.71 | AG178: 0.61 | AH178: AA- | AI178: 5.9000000000000004e-002 | AJ178: =H178+100*O178 -> 158.59999999999999 | AK178: 160.8 | AL178: 149 | AM178: 63.1 | AN178: 132 | AO178: -4.5999999999999999e-002 | AP178: 16 | AQ178: 嘉友转债!
A179: 178 | B179: 113598 | C179: 法兰转债 | D179: 603966 | E179: 法兰泰克 | F179: 机械装备 | G179: 工程机械 | H179: 123.85 | I179: -9.4999999999999998e-003 | J179: -5.4000000000000003e-003 | K179: 9.04 | L179: -2.8999999999999998e-002 | M179: 120.8 | N179: 9.7 | O179: 0.32899999999999996 | P179: 93.2 | Q179: 已到 | R179: 4.46年 | S179: 2.46年 | T179: 2.75 | U179: 4.9 | V179: 1.3999999999999999e-002 | W179: 0.10099999999999999 | X179: 9.4e-002 | Y179: 27 | Z179: 2.17 | AA179: -5.6999999999999993e-003 | AB179: -1.3600000000000001e-002 | AC179: -6.59e-002 | AD179: -6.8400000000000002e-002 | AE179: 89.37 | AF179: 94.11 | AG179: 0.51 | AH179: AA- | AI179: 5.9000000000000004e-002 | AJ179: =H179+100*O179 -> 156.75 | AK179: 154.5 | AL179: 86 | AM179: 60.4 | AN179: 111 | AO179: -5.5e-002 | AP179: 13 | AQ179: 法兰转债
A180: 179 | B180: 128125 | C180: 华阳转债! | D180: 2949 | E180: 华阳国际 | F180: 建筑 | G180: 建筑工程 | H180: 120.356 | I180: -9.7000000000000003e-003 | J180: -6.4000000000000003e-003 | K180: 18.66 | L180: -4.8899999999999999e-002 | M180: 118.1 | N180: 25.39 | O180: 0.63800000000000001 | P180: 73.49 | Q180: 已到 | R180: 4.46年 | S180: 2.46年 | T180: 4.5 | U180: 22 | V180: 4.0000000000000001e-002 | W180: 0.12300000000000001 | X180: 8.9999999999999997e-002 | Y180: 37 | Z180: 2.71 | AA180: -4.3e-003 | AB180: -1.1299999999999999e-002 | AC180: -5.6600000000000004e-002 | AD180: -5.8899999999999994e-002 | AE180: 89.12 | AF180: 91.97 | AG180: 0.33 | AH180: AA- | AI180: 5.9000000000000004e-002 | AJ180: =H180+100*O180 -> 184.15600000000001 | AK180: 167.2 | AL180: 208 | AM180: 75.3 | AN180: 226 | AO180: -3.5000000000000003e-002 | AP180: 14 | AQ180: 华阳转债!
A181: 180 | B181: 113597 | C181: 佳力转债! | D181: 603912 | E181: 佳力图 | F181: 机械装备 | G181: 专用设备 | H181: 124.74 | I181: -2.7699999999999999e-002 | J181: 1.0700000000000001e-002 | K181: 16.29 | L181: -6.54e-002 | M181: 124 | N181: 23.15 | O181: 0.77300000000000002 | P181: 70.37 | Q181: 已到 | R181: 4.46年 | S181: 2.46年 | T181: 3 | U181: 658 | V181: 1.74 | W181: 8.5000000000000006e-002 | X181: 5.9999999999999998e-002 | Y181: 35 | Z181: 3.69 | AA181: -1.4000000000000002e-003 | AB181: -1.03e-002 | AC181: -6.7799999999999999e-002 | AD181: -7.0400000000000004e-002 | AE181: 89.55 | AF181: 96.61 | AG181: 0.26 | AH181: AA- | AI181: 5.9000000000000004e-002 | AJ181: =H181+100*O181 -> 202.03999999999999 | AK181: 179.1 | AL181: 283 | AM181: 82.5 | AN181: 266 | AO181: 0.114 | AP181: 21 | AQ181: 佳力转债!
A182: 181 | B182: 123063 | C182: 大禹转债 | D182: 300021 | E182: 大禹节水 | F182: 化工 | G182: 橡胶塑料 | H182: 141.072 | I182: -1.52e-002 | J182: -1.1000000000000001e-002 | K182: 6.13 | L182: -3.6200000000000003e-002 | M182: 126.1 | N182: 4.83 | O182: 0.11199999999999999 | P182: 126.92 | Q182: 已到 | R182: 4.45年 | S182: 3.45年 | T182: 6.35 | U182: 84 | V182: 9.3000000000000013e-002 | W182: 0.129 | X182: 0.16399999999999998 | Y182: 49 | Z182: 3.3 | AA182: -2.5399999999999999e-002 | AB182: -3.4700000000000002e-002 | AC182: -7.5700000000000003e-002 | AD182: -7.8600000000000003e-002 | AE182: 86.97 | AF182: 98.27 | AG182: 0.73 | AH182: AA- | AI182: 5.9000000000000004e-002 | AJ182: =H182+100*O182 -> 152.27199999999999 | AK182: 155.2 | AL182: 94 | AM182: 57 | AN182: 85 | AO182: 3.1e-002 | AP182: 20 | AQ182: 大禹转债
A183: 182 | B183: 128124 | C183: 科华转债! | D183: 2022 | E183: 科华生物 | F183: 医药 | G183: 生物制药 | H183: 107.7 | I183: -7.1999999999999998e-003 | J183: 3.4999999999999996e-003 | K183: 12.96 | L183: -2.7799999999999998e-002 | M183: 110 | N183: 21.31 | O183: 0.77099999999999991 | P183: 60.82 | Q183: 已到 | R183: 4.45年 | S183: 2.45年 | T183: 7.38 | U183: 13 | V183: 1.6e-002 | W183: 0.111 | X183: 6.7000000000000004e-002 | Y183: 67 | Z183: 1.85 | AA183: 4.7999999999999996e-003 | AB183: 5.9999999999999995e-004 | AC183: -1.7899999999999999e-002 | AD183: -1.9900000000000001e-002 | AE183: 93.26 | AF183: 93.45 | AG183: 0.13 | AH183: AA | AI183: 3.7999999999999999e-002 | AJ183: =H183+100*O183 -> 184.80000000000001 | AK183: 154.6 | AL183: 88 | AM183: 61.1 | AN183: 115 | AO183: -0.127 | AP183: 30 | AQ183: 科华转债!
A184: 183 | B184: 113596 | C184: 城地转债! | D184: 603887 | E184: 城地香江 | F184: 通信互联 | G184: 通信设备 | H184: 102.11 | I184: -8.3999999999999995e-003 | J184: 8.3000000000000001e-003 | K184: 8.07 | L184: -3.9300000000000002e-002 | M184: 113.1 | N184: 24.26 | O184: 2.0699999999999998 | P184: 33.26 | Q184: 已到 | R184: 4.45年 | S184: 2.45年 | T184: 12 | U184: 48 | V184: 3.9e-002 | W184: 0.33000000000000002 | X184: 0.11 | Y184: 36 | Z184: 0.97 | AA184: 2.3700000000000002e-002 | AB184: 1.8200000000000001e-002 | AC184: 5.0000000000000001e-003 | AD184: 2.3999999999999998e-003 | AE184: 89.15 | AF184: 88.12 | AG184: 0 | AH184: AA- | AI184: 5.9000000000000004e-002 | AJ184: =H184+100*O184 -> 309.10999999999996 | AK184: 171 | AL184: 238 | AM184: 81.8 | AN184: 261 | AO184: -0.10400000000000001 | AP184: 46 | AQ184: 城地转债!
A185: 184 | B185: 123062 | C185: 三超转债 | D185: 300554 | E185: 三超新材 | F185: 机械装备 | G185: 通用设备 | H185: 127.59 | I185: -4.0999999999999995e-003 | J185: -1.5300000000000001e-002 | K185: 16.3 | L185: -3.0899999999999997e-002 | M185: 119.2 | N185: 17.13 | O185: 0.34100000000000003 | P185: 95.15 | Q185: 已到 | R185: 4.45年 | S185: 2.45年 | T185: 1.95 | U185: 14 | V185: 5.7000000000000002e-002 | W185: 0.128 | X185: 0.121 | Y185: 15 | Z185: 2.91 | AA185: -1.55e-002 | AB185: -2.2799999999999997e-002 | AC185: -7.5399999999999995e-002 | AD185: -7.8100000000000003e-002 | AE185: 85.32 | AF185: 85.38 | AG185: 0.63 | AH185: A | AI185: 8.0000000000000002e-002 | AJ185: =H185+100*O185 -> 161.69 | AK185: 160 | AL185: 140 | AM185: 74.6 | AN185: 220 | AO185: -3.3000000000000002e-002 | AP185: 28 | AQ185: 三超转债
A186: 185 | B186: 128123 | C186: 国光转债! | D186: 2749 | E186: 国光股份 | F186: 化工 | G186: 农化 | H186: 114.22 | I186: -3.2000000000000002e-003 | J186: 6.5000000000000006e-003 | K186: 9.21 | L186: 1.21e-002 | M186: 115.7 | N186: 13.49 | O186: 0.67299999999999993 | P186: 68.27 | Q186: 已到 | R186: 4.45年 | S186: 2.45年 | T186: 3.2 | U186: 1.7 | V186: 5.0000000000000001e-003 | W186: 8.0000000000000002e-002 | X186: 5.4000000000000006e-002 | Y186: 40 | Z186: 3.06 | AA186: 3.0000000000000001e-003 | AB186: -3.3e-003 | AC186: -3.6900000000000002e-002 | AD186: -3.9399999999999998e-002 | AE186: 89.33 | AF186: 90.19 | AG186: 0.27 | AH186: AA- | AI186: 5.9000000000000004e-002 | AJ186: =H186+100*O186 -> 181.51999999999998 | AK186: 160.2 | AL186: 143 | AM186: 70 | AN186: 182 | AO186: -1.6e-002 | AP186: 16 | AQ186: 国光转债!
A187: 186 | B187: 110073 | C187: 国投转债 | D187: 600061 | E187: 国投资本 | F187: 金融 | G187: 证券行业 | H187: 118.05 | I187: 3.4000000000000002e-003 | J187: -5.6999999999999993e-003 | K187: 7.81 | L187: -7.6e-003 | M187: 110.3 | N187: 9.9 | O187: 0.496 | P187: 78.89 | Q187: 已到 | R187: 4.44年 | S187: 无权 | T187: 80 | U187: 137 | V187: 1.3999999999999999e-002 | W187: 0.159 | X187: 0.126 | Y187: 502 | Z187: 1.11 | AA187: -1.54e-002 | AB187: -1.95e-002 | AC187: 无权 | AD187: 无权 | AE187: 无权 | AF187: 96.49 | AG187: 0.3 | AH187: AAA | AI187: 3.1e-002 | AJ187: =H187+100*O187 -> 167.65000000000001 | AK187: 157.2 | AL187: 110 | AM187: 60.7 | AN187: 113 | AO187: -1.3999999999999999e-002 | AP187: 24 | AQ187: 国投转债
A188: 187 | B188: 128122 | C188: 兴森转债! | D188: 2436 | E188: 兴森科技 | F188: 电子 | G188: 元器件制 | H188: 129.8 | I188: -2.7699999999999999e-002 | J188: 1.43e-002 | K188: 12.16 | L188: -4.0300000000000002e-002 | M188: 113 | N188: 14.1 | O188: 0.505 | P188: 86.24 | Q188: 已到 | R188: 3.44年 | S188: 2.44年 | T188: 2.69 | U188: 6 | V188: 1.7000000000000001e-002 | W188: 1.4999999999999999e-002 | X188: 1.3000000000000001e-002 | Y188: 181 | Z188: 5.05 | AA188: -4.0000000000000001e-002 | AB188: -4.6399999999999997e-002 | AC188: -8.4399999999999989e-002 | AD188: -8.6599999999999996e-002 | AE188: 93.85 | AF188: 99.57 | AG188: 0.33 | AH188: AA | AI188: 3.7999999999999999e-002 | AJ188: =H188+100*O188 -> 180.30000000000001 | AK188: 173.4 | AL188: 260 | AM188: 73.8 | AN188: 212 | AO188: -3.7000000000000005e-002 | AP188: 10 | AQ188: 兴森转债!
A189: 188 | B189: 113037 | C189: 紫银转债! | D189: 601860 | E189: 紫金银行 | F189: 金融 | G189: 银行行业 | H189: 111.78 | I189: 1.8e-003 | J189: -1.8e-003 | K189: 3.34 | L189: 0. | M189: 115.6 | N189: 4.05 | O189: 0.35499999999999998 | P189: 82.47 | Q189: 已到 | R189: 4.44年 | S189: 无权 | T189: 45 | U189: 65 | V189: 1.3000000000000001e-002 | W189: 0.36799999999999999 | X189: 0.30299999999999999 | Y189: 122 | Z189: 0.8 | AA189: 7.8000000000000005e-003 | AB189: 1.4000000000000002e-003 | AC189: 无权 | AD189: 无权 | AE189: 无权 | AF189: 100.43 | AG189: 0.32 | AH189: AA+ | AI189: 3.3000000000000002e-002 | AJ189: =H189+100*O189 -> 147.28 | AK189: 141.1 | AL189: 14 | AM189: 40.7 | AN189: 15 | AO189: 9.0000000000000011e-003 | AP189: 32 | AQ189: 紫银转债!
A190: 189 | B190: 123061 | C190: 航新转债! | D190: 300424 | E190: 航新科技 | F190: 航空航天 | G190: 航空航天 | H190: 125.248 | I190: 7.000000000000001e-004 | J190: -8.0000000000000002e-003 | K190: 14.1 | L190: -1.3300000000000001e-002 | M190: 124.3 | N190: 14.85 | O190: 0.31900000000000001 | P190: 94.95 | Q190: 已到 | R190: 4.44年 | S190: 2.44年 | T190: 2.5 | U190: 31 | V190: 9.9000000000000005e-002 | W190: 7.400000000000001e-002 | X190: 7.0000000000000007e-002 | Y190: 34 | Z190: 5 | AA190: -1.8e-003 | AB190: -1.09e-002 | AC190: -6.8900000000000003e-002 | AD190: -7.17e-002 | AE190: 87.59 | AF190: 92.78 | AG190: 0.55 | AH190: A+ | AI190: 7.0000000000000007e-002 | AJ190: =H190+100*O190 -> 157.148 | AK190: 155.5 | AL190: 96 | AM190: 62.8 | AN190: 127 | AO190: -6.9999999999999993e-003 | AP190: 20 | AQ190: 航新转债!
A191: 190 | B191: 123060 | C191: 苏试转债! | D191: 300416 | E191: 苏试试验 | F191: 机械装备 | G191: 专用设备 | H191: 171.4 | I191: -5.5599999999999997e-002 | J191: 3.5000000000000003e-002 | K191: 26.8 | L191: -2.4700000000000003e-002 | M191: 117.2 | N191: 19.05 | O191: 0.218 | P191: 140.68 | Q191: 已到 | R191: 4.43年 | S191: 2.43年 | T191: 3.1 | U191: 29 | V191: 5.4000000000000006e-002 | W191: 4.0999999999999995e-002 | X191: 5.7000000000000002e-002 | Y191: 76 | Z191: 6.97 | AA191: -8.3699999999999997e-002 | AB191: -8.9600000000000013e-002 | AC191: -0.124 | AD191: -0.125 | AE191: 89.34 | AF191: 91.42 | AG191: 0.84 | AH191: AA- | AI191: 5.9000000000000004e-002 | AJ191: =H191+100*O191 -> 193.20000000000002 | AK191: 202.1 | AL191: 336 | AM191: 110.7 | AN191: 337 | AO191: -0.11800000000000001 | AP191: 7 | AQ191: 苏试转债!
A192: 191 | B192: 113595 | C192: 花王转债! | D192: 603007 | E192: ST花王 | F192: 城市公用 | G192: 生态环境 | H192: 105.5 | I192: -3.4000000000000002e-003 | J192: 2.5000000000000001e-003 | K192: 3.2 | L192: -9.300000000000001e-003 | M192: 124.8 | N192: 6.92 | O192: 1.28 | P192: 46.24 | Q192: 已到 | R192: 4.43年 | S192: 2.43年 | T192: 3.3 | U192: 9.3 | V192: 2.7000000000000003e-002 | W192: 0.307 | X192: 0.14199999999999999 | Y192: 11 | Z192: 1 | AA192: 3.95e-002 | AB192: 2.9700000000000001e-002 | AC192: -6.6e-003 | AD192: -9.300000000000001e-003 | AE192: 77.52 | AF192: 76.45 | AG192: 0.09 | AH192: BBB- | AI192: 0.12 | AJ192: =H192+100*O192 -> 233.5 | AK192: 164.8 | AL192: 182 | AM192: 87.2 | AN192: 289 | AO192: -2.7000000000000003e-002 | AP192: 52 | AQ192: 花王转债!
A193: 192 | B193: 113594 | C193: 淳中转债! | D193: 603516 | E193: 淳中科技 | F193: 电子 | G193: 电子产品 | H193: 127.1 | I193: -1.4999999999999999e-002 | J193: -2.3999999999999998e-003 | K193: 16.22 | L193: -3.3399999999999999e-002 | M193: 120.9 | N193: 18.23 | O193: 0.42899999999999999 | P193: 88.97 | Q193: 已到 | R193: 4.43年 | S193: 2.43年 | T193: 3 | U193: 6.4 | V193: 1.7000000000000001e-002 | W193: 9.9000000000000005e-002 | X193: 8.8000000000000009e-002 | Y193: 30 | Z193: 3.12 | AA193: -1.15e-002 | AB193: -1.9400000000000001e-002 | AC193: -7.4700000000000003e-002 | AD193: -7.7399999999999997e-002 | AE193: 87.46 | AF193: 90.24 | AG193: 0.52 | AH193: A+ | AI193: 7.0000000000000007e-002 | AJ193: =H193+100*O193 -> 170. | AK193: 165.2 | AL193: 188 | AM193: 75 | AN193: 222 | AO193: -0.11199999999999999 | AP193: 9 | AQ193: 淳中转债!
A194: 193 | B194: 127020 | C194: 中金转债 | D194: 60 | E194: 中金岭南 | F194: 有色金属 | G194: 有色行业 | H194: 129.45 | I194: 1.2999999999999999e-003 | J194: -6.0000000000000001e-003 | K194: 4.94 | L194: -8.0000000000000002e-003 | M194: 113.5 | N194: 4.63 | O194: 0.21299999999999999 | P194: 106.7 | Q194: 已到 | R194: 4.43年 | S194: 2.43年 | T194: 34.3 | U194: 62 | V194: 1.3999999999999999e-002 | W194: 0.19 | X194: 0.20300000000000001 | Y194: 180 | Z194: 1.44 | AA194: -2.9600000000000001e-002 | AB194: -3.49e-002 | AC194: -8.72e-002 | AD194: -8.8699999999999987e-002 | AE194: 94.03 | AF194: 98.5 | AG194: 0.59 | AH194: AA+ | AI194: 3.3000000000000002e-002 | AJ194: =H194+100*O194 -> 150.75 | AK194: 152.2 | AL194: 72 | AM194: 53.7 | AN194: 63 | AO194: 1.7000000000000001e-002 | AP194: 19 | AQ194: 中金转债
A195: 194 | B195: 113593 | C195: 沪工转债! | D195: 603131 | E195: 上海沪工 | F195: 机械装备 | G195: 通用设备 | H195: 132.56 | I195: -5.0099999999999999e-002 | J195: 1.6799999999999999e-002 | K195: 19.09 | L195: -6.2400000000000004e-002 | M195: 121.2 | N195: 21.12 | O195: 0.46700000000000003 | P195: 90.39 | Q195: 已到 | R195: 4.43年 | S195: 2.43年 | T195: 4 | U195: 35 | V195: 6.6000000000000003e-002 | W195: 6.6000000000000003e-002 | X195: 5.9999999999999998e-002 | Y195: 61 | Z195: 4.57 | AA195: -2.0499999999999997e-002 | AB195: -2.8399999999999998e-002 | AC195: -8.929999999999999e-002 | AD195: -9.1999999999999998e-002 | AE195: 87.58 | AF195: 90.49 | AG195: 0.53 | AH195: A+ | AI195: 7.0000000000000007e-002 | AJ195: =H195+100*O195 -> 179.25999999999999 | AK195: 174.7 | AL195: 265 | AM195: 84.2 | AN195: 279 | AO195: -0.20199999999999999 | AP195: 9 | AQ195: 沪工转债!
A196: 195 | B196: 128120 | C196: 联诚转债! | D196: 2921 | E196: 联诚精密 | F196: 汽车 | G196: 零部件制 | H196: 124.383 | I196: -2.6600000000000002e-002 | J196: -1.e-002 | K196: 17.88 | L196: -5.7000000000000002e-002 | M196: 117.9 | N196: 18.44 | O196: 0.28300000000000003 | P196: 96.96 | Q196: 已到 | R196: 4.42年 | S196: 2.42年 | T196: 2.6 | U196: 12 | V196: 3.7000000000000005e-002 | W196: 0.13699999999999998 | X196: 0.13300000000000001 | Y196: 19 | Z196: 2.38 | AA196: -1.23e-002 | AB196: -1.9299999999999998e-002 | AC196: -6.7199999999999996e-002 | AD196: -6.9900000000000004e-002 | AE196: 85.47 | AF196: 84.63 | AG196: 0.64 | AH196: A | AI196: 8.0000000000000002e-002 | AJ196: =H196+100*O196 -> 152.68299999999999 | AK196: 151.8 | AL196: 70 | AM196: 66.3 | AN196: 162 | AO196: -4.0000000000000001e-002 | AP196: 24 | AQ196: 联诚转债!
A197: 196 | B197: 128121 | C197: 宏川转债! | D197: 2930 | E197: 宏川智慧 | F197: 交通运输 | G197: 物流业 | H197: 128.9 | I197: -7.000000000000001e-004 | J197: 1.23e-002 | K197: 21.7 | L197: 1.6399999999999998e-002 | M197: 112.9 | N197: 19.89 | O197: 0.18100000000000002 | P197: 109.1 | Q197: 已到 | R197: 4.42年 | S197: 2.42年 | T197: 6.7 | U197: 32 | V197: 3.7000000000000005e-002 | W197: 6.9000000000000006e-002 | X197: 7.4999999999999997e-002 | Y197: 97 | Z197: 4.57 | AA197: -3.0099999999999998e-002 | AB197: -3.5099999999999999e-002 | AC197: -8.2299999999999998e-002 | AD197: -8.4499999999999992e-002 | AE197: 89.27 | AF197: 88.11 | AG197: 0.71 | AH197: AA- | AI197: 5.9000000000000004e-002 | AJ197: =H197+100*O197 -> 147. | AK197: 148.7 | AL197: 48 | AM197: 59.4 | AN197: 103 | AO197: -2.9999999999999999e-002 | AP197: 7 | AQ197: 宏川转债!
A198: 197 | B198: 123059 | C198: 银信转债! | D198: 300231 | E198: 银信科技 | F198: 计算机及 | G198: 软件开发 | H198: 133.401 | I198: 1.46e-002 | J198: 4.0000000000000002e-004 | K198: 9.96 | L198: 2.6800000000000001e-002 | M198: 123.7 | N198: 9.72 | O198: 0.30199999999999999 | P198: 102.47 | Q198: 已到 | R198: 4.42年 | S198: 2.42年 | T198: 3.91 | U198: 142 | V198: 0.27000000000000002 | W198: 8.900000000000001e-002 | X198: 9.0999999999999998e-002 | Y198: 44 | Z198: 3.14 | AA198: -1.7299999999999999e-002 | AB198: -2.6000000000000002e-002 | AC198: -9.4e-002 | AD198: -9.6300000000000011e-002 | AE198: 89.5 | AF198: 96.57 | AG198: 0.56 | AH198: AA- | AI198: 5.9000000000000004e-002 | AJ198: =H198+100*O198 -> 163.601 | AK198: 164.3 | AL198: 180 | AM198: 67.8 | AN198: 169 | AO198: 6.8000000000000005e-002 | AP198: 19 | AQ198: 银信转债!
A199: 198 | B199: 127019 | C199: 国城转债! | D199: 688 | E199: 国城矿业 | F199: 有色金属 | G199: 锌铅镍锡 | H199: 111.432 | I199: 1.3100000000000001e-002 | J199: 5.1999999999999998e-003 | K199: 15.23 | L199: 8.09e-002 | M199: 114.8 | N199: 21.06 | O199: 0.54100000000000004 | P199: 72.32 | Q199: 已到 | R199: 4.42年 | S199: 2.42年 | T199: 8.5 | U199: 133 | V199: 0.13900000000000001 | W199: 4.9000000000000002e-002 | X199: 3.5000000000000003e-002 | Y199: 173 | Z199: 7.17 | AA199: 6.8999999999999999e-003 | AB199: 8.0000000000000004e-004 | AC199: -2.9100000000000001e-002 | AD199: -3.15e-002 | AE199: 93.89 | AF199: 97.69 | AG199: 0.23 | AH199: AA | AI199: 3.7999999999999999e-002 | AJ199: =H199+100*O199 -> 165.53200000000001 | AK199: 150.5 | AL199: 57 | AM199: 52.9 | AN199: 56 | AO199: 0.13200000000000001 | AP199: 53 | AQ199: 国城转债!
A200: 199 | B200: 128119 | C200: 龙大转债! | D200: 2726 | E200: 龙大美食 | F200: 食品饮料 | G200: 肉制品 | H200: 129.453 | I200: -1.3999999999999999e-002 | J200: 2.9999999999999997e-004 | K200: 8.6 | L200: -3.3700000000000001e-002 | M200: 119.9 | N200: 9.29 | O200: 0.39799999999999996 | P200: 92.57 | Q200: 已到 | R200: 4.41年 | S200: 2.41年 | T200: 9.46 | U200: 17 | V200: 1.3999999999999999e-002 | W200: 0.10199999999999999 | X200: 9.4e-002 | Y200: 93 | Z200: 2.3 | AA200: -1.7600000000000001e-002 | AB200: -2.5099999999999997e-002 | AC200: -8.4199999999999997e-002 | AD200: -8.6400000000000005e-002 | AE200: 94.01 | AF200: 102.05 | AG200: 0.41 | AH200: AA | AI200: 3.7999999999999999e-002 | AJ200: =H200+100*O200 -> 169.25299999999999 | AK200: 166.3 | AL200: 203 | AM200: 64.3 | AN200: 138 | AO200: -0.13500000000000001 | AP200: 9 | AQ200: 龙大转债!
A201: 200 | B201: 110071 | C201: 湖盐转债! | D201: 600929 | E201: 雪天盐业 | F201: 食品饮料 | G201: 食品饮料 | H201: 132.01 | I201: -7.8000000000000005e-003 | J201: -4.8999999999999998e-003 | K201: 6.62 | L201: -1.9299999999999998e-002 | M201: 114.9 | N201: 5.89 | O201: 0.17499999999999999 | P201: 112.39 | Q201: 已到 | R201: 4.40年 | S201: 2.40年 | T201: 7.2 | U201: 15 | V201: 1.4999999999999999e-002 | W201: 8.1000000000000003e-002 | X201: 9.0999999999999998e-002 | Y201: 89 | Z201: 2.37 | AA201: -3.1600000000000003e-002 | AB201: -3.7400000000000003e-002 | AC201: -9.1400000000000009e-002 | AD201: -9.3599999999999989e-002 | AE201: 94.04 | AF201: 97.84 | AG201: 0.66 | AH201: AA | AI201: 3.7999999999999999e-002 | AJ201: =H201+100*O201 -> 149.50999999999999 | AK201: 151.6 | AL201: 67 | AM201: 53.8 | AN201: 65 | AO201: -5.7000000000000002e-002 | AP201: 19 | AQ201: 湖盐转债!
A202: 201 | B202: 113036 | C202: 宁建转债! | D202: 601789 | E202: 宁波建工 | F202: 建筑 | G202: 建筑工程 | H202: 129.3 | I202: 1.5e-003 | J202: 1.5700000000000002e-002 | K202: 4.87 | L202: 3.1800000000000002e-002 | M202: 116.9 | N202: 4.76 | O202: 0.26400000000000001 | P202: 102.31 | Q202: 已到 | R202: 4.39年 | S202: 2.39年 | T202: 5.4 | U202: 180 | V202: 0.25700000000000001 | W202: 0.114 | X202: 0.11599999999999999 | Y202: 48 | Z202: 1.47 | AA202: -2.3099999999999999e-002 | AB202: -2.9700000000000001e-002 | AC202: -8.43e-002 | AD202: -8.6599999999999996e-002 | AE202: 94.08 | AF202: 99.58 | AG202: 0.54 | AH202: AA | AI202: 3.7999999999999999e-002 | AJ202: =H202+100*O202 -> 155.70000000000002 | AK202: 156.3 | AL202: 102 | AM202: 56.7 | AN202: 81 | AO202: 0.17100000000000001 | AP202: 15 | AQ202: 宁建转债!
A203: 202 | B203: 128118 | C203: 瀛通转债! | D203: 2861 | E203: 瀛通通讯 | F203: 电子 | G203: 电子产品 | H203: 112.999 | I203: -6.9999999999999993e-003 | J203: 2.7000000000000001e-003 | K203: 11.8 | L203: -3.8300000000000001e-002 | M203: 121.7 | N203: 21.24 | O203: 1.03 | P203: 55.56 | Q203: 已到 | R203: 4.38年 | S203: 2.38年 | T203: 3 | U203: 5.1 | V203: 1.4999999999999999e-002 | W203: 0.16200000000000001 | X203: 8.9999999999999997e-002 | Y203: 18 | Z203: 1.76 | AA203: 1.7500000000000002e-002 | AB203: 8.8999999999999999e-003 | AC203: -3.1600000000000003e-002 | AD203: -3.4700000000000002e-002 | AE203: 90.2 | AF203: 95.3 | AG203: 0.11 | AH203: AA- | AI203: 5.9000000000000004e-002 | AJ203: =H203+100*O203 -> 215.999 | AK203: 170.4 | AL203: 234 | AM203: 75.1 | AN203: 224 | AO203: -6.4000000000000001e-002 | AP203: 28 | AQ203: 瀛通转债!
A204: 203 | B204: 128117 | C204: 道恩转债! | D204: 2838 | E204: 道恩股份 | F204: 化工 | G204: 橡胶塑料 | H204: 114.19 | I204: -1.8e-003 | J204: 5.0000000000000001e-004 | K204: 14.02 | L204: -2.4399999999999998e-002 | M204: 123.1 | N204: 28.78 | O204: 1.3400000000000001 | P204: 48.71 | Q204: 已到 | R204: 4.38年 | S204: 2.38年 | T204: 3.6 | U204: 3.5 | V204: 8.0000000000000002e-003 | W204: 6.3e-002 | X204: 3.1e-002 | Y204: 57 | Z204: 3.01 | AA204: 1.7600000000000001e-002 | AB204: 8.6e-003 | AC204: -3.8399999999999997e-002 | AD204: -4.0899999999999999e-002 | AE204: 89.51 | AF204: 96.26 | AG204: 0.06 | AH204: AA- | AI204: 5.9000000000000004e-002 | AJ204: =H204+100*O204 -> 248.19 | AK204: 179.7 | AL204: 286 | AM204: 83.4 | AN204: 271 | AO204: -0.10300000000000001 | AP204: 28 | AQ204: 道恩转债!
A205: 204 | B205: 123057 | C205: 美联转债!! | D205: 300586 | E205: 美联新材 | F205: 化工 | G205: 橡胶塑料 | H205: 141.749 | I205: -1.3600000000000001e-002 | J205: 2.8999999999999998e-003 | K205: 11.17 | L205: -1.4999999999999999e-002 | M205: 117.8 | N205: 9.5 | O205: 0.20600000000000002 | P205: 117.58 | Q205: 已到 | R205: 4.38年 | S205: 2.38年 | T205: 2.07 | U205: 25 | V205: 8.5999999999999993e-002 | W205: 3.5000000000000003e-002 | X205: 4.0999999999999995e-002 | Y205: 59 | Z205: 4.9 | AA205: -4.2300000000000004e-002 | AB205: -4.8899999999999999e-002 | AC205: -0.11599999999999999 | AD205: -0.11800000000000001 | AE205: 89.79 | AF205: 92.22 | AG205: 0.72 | AH205: AA- | AI205: 5.9000000000000004e-002 | AJ205: =H205+100*O205 -> 162.34899999999999 | AK205: 165.9 | AL205: 200 | AM205: 73.7 | AN205: 211 | AO205: -9.0000000000000011e-003 | AP205: 19 | AQ205: 美联转债!!
A206: 205 | B206: 113591 | C206: 胜达转债!! | D206: 603687 | E206: 大胜达 | F206: 造纸包装 | G206: 包装用纸 | H206: 126.29 | I206: -1.47e-002 | J206: 7.6e-003 | K206: 10.01 | L206: -1.09e-002 | M206: 121.7 | N206: 8.76 | O206: 0.105 | P206: 114.27 | Q206: 已到 | R206: 4.38年 | S206: 2.38年 | T206: 4.78 | U206: 62 | V206: 0.10199999999999999 | W206: 0.115 | X206: 0.13200000000000001 | Y206: 41 | Z206: 2.37 | AA206: -8.6e-003 | AB206: -1.6899999999999998e-002 | AC206: -7.5499999999999998e-002 | AD206: -7.7899999999999997e-002 | AE206: 89.7 | AF206: 95.23 | AG206: 0.66 | AH206: AA- | AI206: 5.9000000000000004e-002 | AJ206: =H206+100*O206 -> 136.79000000000002 | AK206: 138.3 | AL206: 9 | AM206: 43.1 | AN206: 23 | AO206: -0.124 | AP206: 37 | AQ206: 胜达转债!!
A207: 206 | B207: 128116 | C207: 瑞达转债! | D207: 2961 | E207: 瑞达期货 | F207: 金融 | G207: 期货行业 | H207: 117.002 | I207: -2.3999999999999998e-003 | J207: -7.000000000000001e-004 | K207: 21.1 | L207: -1.3999999999999999e-002 | M207: 114.9 | N207: 29.55 | O207: 0.63900000000000001 | P207: 71.4 | Q207: 已到 | R207: 4.37年 | S207: 2.37年 | T207: 6.49 | U207: 4.5 | V207: 6.0000000000000001e-003 | W207: 6.9000000000000006e-002 | X207: 4.9000000000000002e-002 | Y207: 94 | Z207: 4.42 | AA207: -4.1999999999999997e-003 | AB207: -1.03e-002 | AC207: -4.82e-002 | AD207: -5.0499999999999996e-002 | AE207: 94.06 | AF207: 97.94 | AG207: 0.23 | AH207: AA | AI207: 3.7999999999999999e-002 | AJ207: =H207+100*O207 -> 180.90199999999999 | AK207: 162.6 | AL207: 167 | AM207: 64.7 | AN207: 145 | AO207: -5.0999999999999997e-002 | AP207: 17 | AQ207: 瑞达转债!
A208: 207 | B208: 127018 | C208: 本钢转债! | D208: 761 | E208: 本钢板材 | F208: 钢铁 | G208: 炼钢 | H208: 122.9 | I208: -6.8999999999999999e-003 | J208: 4.5999999999999999e-003 | K208: 4.16 | L208: -7.1999999999999998e-003 | M208: 128 | N208: 4.55 | O208: 0.34399999999999997 | P208: 91.43 | Q208: 已到 | R208: 4.37年 | S208: 2.37年 | T208: 56.3 | U208: 127 | V208: 1.8000000000000002e-002 | W208: 0.32899999999999996 | X208: 0.30099999999999999 | Y208: 171 | Z208: 0.75 | AA208: 9.5999999999999992e-003 | AB208: -1.e-003 | AC208: -5.79e-002 | AD208: -6.1900000000000004e-002 | AE208: 98.06 | AF208: 112.48 | AG208: 0.32 | AH208: AAA | AI208: 3.1e-002 | AJ208: =H208+100*O208 -> 157.30000000000001 | AK208: 154.4 | AL208: 85 | AM208: 41.9 | AN208: 17 | AO208: -3.6000000000000004e-002 | AP208: 59 | AQ208: 本钢转债!
A209: 208 | B209: 113589 | C209: 天创转债! | D209: 603608 | E209: 天创时尚 | F209: 服装纺织 | G209: 鞋服行业 | H209: 105.97 | I209: -3.9000000000000003e-003 | J209: 3.7000000000000002e-003 | K209: 6.07 | L209: -4.8999999999999998e-003 | M209: 114.9 | N209: 12.29 | O209: 1.1499999999999999 | P209: 49.39 | Q209: 已到 | R209: 4.36年 | S209: 2.36年 | T209: 6 | U209: 5 | V209: 8.0000000000000002e-003 | W209: 0.23000000000000001 | X209: 0.114 | Y209: 26 | Z209: 1.65 | AA209: 1.9099999999999999e-002 | AB209: 1.2800000000000001e-002 | AC209: -9.7000000000000003e-003 | AD209: -1.23e-002 | AE209: 94.19 | AF209: 98 | AG209: 0.04 | AH209: AA | AI209: 3.7999999999999999e-002 | AJ209: =H209+100*O209 -> 220.96999999999997 | AK209: 162.6 | AL209: 166 | AM209: 64.6 | AN209: 142 | AO209: -2.9999999999999999e-002 | AP209: 44 | AQ209: 天创转债!
A210: 209 | B210: 123056 | C210: 雪榕转债! | D210: 300511 | E210: 雪榕生物 | F210: 农业 | G210: 种植业 | H210: 113.233 | I210: -1.e-004 | J210: -5.0000000000000001e-003 | K210: 6.9 | L210: -3.7699999999999997e-002 | M210: 120.7 | N210: 11.77 | O210: 0.93200000000000005 | P210: 58.62 | Q210: 已到 | R210: 4.36年 | S210: 2.36年 | T210: 5.84 | U210: 6.9 | V210: 1.e-002 | W210: 0.192 | X210: 0.11199999999999999 | Y210: 30 | Z210: 1.71 | AA210: 1.5100000000000001e-002 | AB210: 6.8000000000000005e-003 | AC210: -3.4799999999999998e-002 | AD210: -3.7499999999999999e-002 | AE210: 89.79 | AF210: 94.56 | AG210: 0.13 | AH210: AA- | AI210: 5.9000000000000004e-002 | AJ210: =H210+100*O210 -> 206.43299999999999 | AK210: 167.8 | AL210: 211 | AM210: 73.3 | AN210: 209 | AO210: -0.10000000000000001 | AP210: 24 | AQ210: 雪榕转债!
A211: 210 | B211: 113588 | C211: 润达转债! | D211: 603108 | E211: 润达医疗 | F211: 医药 | G211: 医疗器械 | H211: 125.85 | I211: -1.83e-002 | J211: 7.0999999999999995e-003 | K211: 11.05 | L211: -3.1600000000000003e-002 | M211: 113.9 | N211: 13.25 | O211: 0.50900000000000001 | P211: 83.4 | Q211: 已到 | R211: 4.34年 | S211: 2.34年 | T211: 5.5 | U211: 8.7 | V211: 1.2e-002 | W211: 8.5999999999999993e-002 | X211: 7.2000000000000008e-002 | Y211: 64 | Z211: 1.94 | AA211: -2.3199999999999998e-002 | AB211: -2.87e-002 | AC211: -7.5999999999999998e-002 | AD211: -7.8299999999999995e-002 | AE211: 94.26 | AF211: 97.22 | AG211: 0.36 | AH211: AA | AI211: 3.7999999999999999e-002 | AJ211: =H211+100*O211 -> 176.75 | AK211: 168.3 | AL211: 219 | AM211: 71.1 | AN211: 193 | AO211: -0.14999999999999999 | AP211: 11 | AQ211: 润达转债!
A212: 211 | B212: 128114 | C212: 正邦转债! | D212: 2157 | E212: 正邦科技 | F212: 农业 | G212: 畜牧业 | H212: 106.799 | I212: -1.03e-002 | J212: 8.3000000000000001e-003 | K212: 7.5 | L212: -4.4600000000000001e-002 | M212: 114.9 | N212: 14.77 | O212: 1.1000000000000001 | P212: 50.78 | Q212: 已到 | R212: 4.34年 | S212: 2.34年 | T212: 16 | U212: 137 | V212: 8.0000000000000002e-002 | W212: 6.8000000000000005e-002 | X212: 3.4000000000000002e-002 | Y212: 236 | Z212: 1.82 | AA212: 1.7399999999999999e-002 | AB212: 1.1000000000000001e-002 | AC212: -1.29e-002 | AD212: -1.55e-002 | AE212: 94.26 | AF212: 98.07 | AG212: 0.04 | AH212: AA | AI212: 3.7999999999999999e-002 | AJ212: =H212+100*O212 -> 216.79900000000004 | AK212: 162.8 | AL212: 170 | AM212: 64.7 | AN212: 148 | AO212: -0.19399999999999998 | AP212: 28 | AQ212: 正邦转债!
A213: 212 | B213: 128113 | C213: 比音转债!* | D213: 2832 | E213: 比音勒芬 | F213: 服装纺织 | G213: 服装行业 | H213: 172.11 | I213: -2.6200000000000001e-002 | J213: -1.9e-003 | K213: 25.25 | L213: -2.81e-002 | M213: 116.9 | N213: 14.6 | O213: -5.0000000000000001e-003 | P213: 172.95 | Q213: 已到 | R213: 10天 | S213: 无权 | T213: 1.6 | U213: 37 | V213: 0.13300000000000001 | W213: 1.2e-002 | X213: 2.e-002 | Y213: 139 | Z213: 4.69 | AA213: <-100% | AB213: <-100% | AC213: 无权 | AD213: 无权 | AE213: 无权 | AF213: 100.34 | AG213: 1 | AH213: AA | AI213: 2.8900000000000002e-002 | AJ213: =H213+100*O213 -> 171.61000000000001 | AK213: 171.3 | AL213: 241 | AM213: 70.9 | AN213: 191 | AO213: 1.9e-002 | AP213: 8 | AQ213: 比音转债!*
A214: 213 | B214: 128111 | C214: 中矿转债! | D214: 2738 | E214: 中矿资源 | F214: 有色金属 | G214: 有色行业 | H214: 480 | I214: 4.2800000000000005e-002 | J214: 2.1600000000000001e-002 | K214: 70.29 | L214: 6.5299999999999997e-002 | M214: 124.2 | N214: 15.45 | O214: 5.5e-002 | P214: 454.95 | Q214: 已到 | R214: 4.32年 | S214: 2.32年 | T214: 1.45 | U214: 3147. | V214: 4.4100000000000001 | W214: 6.0000000000000001e-003 | X214: 2.8999999999999998e-002 | Y214: 229 | Z214: 6.11 | AA214: -0.27200000000000002 | AB214: -0.27800000000000002 | AC214: -0.26600000000000001 | AD214: -0.26700000000000002 | AE214: 90.43 | AF214: 97.54 | AG214: 0.99 | AH214: AA- | AI214: 5.9000000000000004e-002 | AJ214: =H214+100*O214 -> 485.5 | AK214: 505 | AL214: 384 | AM214: 407.5 | AN214: 384 | AO214: 0.17499999999999999 | AP214: 10 | AQ214: 中矿转债!
A215: 214 | B215: 123054 | C215: 思特转债!! | D215: 300608 | E215: 思特奇 | F215: 通信互联 | G215: 通信设备 | H215: 136.648 | I215: -1.5800000000000002e-002 | J215: 5.0000000000000001e-003 | K215: 13.5 | L215: -1.7500000000000002e-002 | M215: 121.2 | N215: 12.63 | O215: 0.27800000000000002 | P215: 106.89 | Q215: 已到 | R215: 4.32年 | S215: 2.32年 | T215: 2.07 | U215: 158 | V215: 0.55299999999999994 | W215: 7.2999999999999995e-002 | X215: 7.8e-002 | Y215: 28 | Z215: 3.4 | AA215: -2.7999999999999997e-002 | AB215: -3.6000000000000004e-002 | AC215: -0.10400000000000001 | AD215: -0.107 | AE215: 90.44 | AF215: 95.21 | AG215: 0.62 | AH215: AA- | AI215: 5.9000000000000004e-002 | AJ215: =H215+100*O215 -> 164.44800000000001 | AK215: 166.4 | AL215: 205 | AM215: 71.2 | AN215: 195 | AO215: -6.3e-002 | AP215: 18 | AQ215: 思特转债!!
A216: 215 | B216: 113585 | C216: 寿仙转债! | D216: 603896 | E216: 寿仙谷 | F216: 医药 | G216: 中药 | H216: 197.37 | I216: -5.4800000000000001e-002 | J216: 2.7000000000000001e-003 | K216: 52.55 | L216: -5.5e-002 | M216: 117.3 | N216: 28.38 | O216: 6.6000000000000003e-002 | P216: 185.17 | Q216: 已到 | R216: 4.32年 | S216: 2.32年 | T216: 1.01 | U216: 118 | V216: 0.58499999999999996 | W216: 1.3000000000000001e-002 | X216: 2.3e-002 | Y216: 80 | Z216: 5.39 | AA216: -0.11599999999999999 | AB216: -0.121 | AC216: -0.16 | AD216: -0.161 | AE216: 90.03 | AF216: 92.12 | AG216: 0.95 | AH216: AA- | AI216: 5.9000000000000004e-002 | AJ216: =H216+100*O216 -> 203.97 | AK216: 209.6 | AL216: 340 | AM216: 117.5 | AN216: 341 | AO216: -2.7999999999999997e-002 | AP216: 18 | AQ216: 寿仙转债!
A217: 216 | B217: 123052 | C217: 飞鹿转债! | D217: 300665 | E217: 飞鹿股份 | F217: 化工 | G217: 化工 | H217: 144.11 | I217: -1.3600000000000001e-002 | J217: -7.4000000000000003e-003 | K217: 8.99 | L217: -2.92e-002 | M217: 126.8 | N217: 7.05 | O217: 0.13 | P217: 127.52 | Q217: 已到 | R217: 4.31年 | S217: 2.31年 | T217: 1.5 | U217: 18 | V217: 8.3000000000000004e-002 | W217: 9.6000000000000002e-002 | X217: 0.12300000000000001 | Y217: 16 | Z217: 3.05 | AA217: -2.9999999999999999e-002 | AB217: -3.9800000000000002e-002 | AC217: -0.122 | AD217: -0.125 | AE217: 88.8 | AF217: 95.53 | AG217: 0.72 | AH217: A+ | AI217: 7.0000000000000007e-002 | AJ217: =H217+100*O217 -> 157.11000000000001 | AK217: 160.7 | AL217: 148 | AM217: 65.2 | AN217: 152 | AO217: -7.2999999999999995e-002 | AP217: 24 | AQ217: 飞鹿转债!
A218: 217 | B218: 113584 | C218: 家悦转债! | D218: 603708 | E218: 家家悦 | F218: 商业零售 | G218: 超市 | H218: 108.97 | I218: -5.7999999999999996e-003 | J218: 5.6999999999999993e-003 | K218: 14.02 | L218: -2.64e-002 | M218: 114.9 | N218: 37.53 | O218: 1.9199999999999999 | P218: 37.36 | Q218: 已到 | R218: 4.31年 | S218: 2.31年 | T218: 6.45 | U218: 3.7 | V218: 5.0000000000000001e-003 | W218: 7.5999999999999998e-002 | X218: 2.7999999999999997e-002 | Y218: 85 | Z218: 3.32 | AA218: 1.26e-002 | AB218: 6.3e-003 | AC218: -2.12e-002 | AD218: -2.3799999999999998e-002 | AE218: 94.38 | AF218: 98.19 | AG218: 0 | AH218: AA | AI218: 3.7999999999999999e-002 | AJ218: =H218+100*O218 -> 300.97000000000003 | AK218: 180.6 | AL218: 295 | AM218: 82.4 | AN218: 265 | AO218: -9.8000000000000004e-002 | AP218: 21 | AQ218: 家悦转债!
A219: 218 | B219: 128109 | C219: 楚江转债! | D219: 2171 | E219: 楚江新材 | F219: 有色金属 | G219: 铜金属 | H219: 153.7 | I219: -1.54e-002 | J219: -4.7999999999999996e-003 | K219: 10.76 | L219: -2.7099999999999999e-002 | M219: 114.9 | N219: 8.63 | O219: 0.23300000000000001 | P219: 124.68 | Q219: 已到 | R219: 4.30年 | S219: 2.30年 | T219: 18.2 | U219: 10 | V219: 4.0000000000000001e-003 | W219: 0.127 | X219: 0.158 | Y219: 144 | Z219: 2.45 | AA219: -6.6600000000000006e-002 | AB219: -7.2099999999999997e-002 | AC219: -0.109 | AD219: -0.111 | AE219: 94.39 | AF219: 98.2 | AG219: 0.74 | AH219: AA | AI219: 3.7999999999999999e-002 | AJ219: =H219+100*O219 -> 177. | AK219: 182.7 | AL219: 299 | AM219: 84.5 | AN219: 281 | AO219: -4.0000000000000001e-002 | AP219: 5 | AQ219: 楚江转债!
A220: 219 | B220: 127017 | C220: 万青转债 | D220: 789 | E220: 万年青 | F220: 建筑 | G220: 水泥 | H220: 133.528 | I220: 1.1399999999999999e-002 | J220: -1.2500000000000001e-002 | K220: 13.2 | L220: -2.3e-003 | M220: 118 | N220: 13.46 | O220: 0.36200000000000004 | P220: 98.07 | Q220: 已到 | R220: 4.30年 | S220: 2.30年 | T220: 10 | U220: 68 | V220: 5.0000000000000003e-002 | W220: 9.5000000000000001e-002 | X220: 9.3000000000000013e-002 | Y220: 105 | Z220: 1.54 | AA220: -2.8900000000000002e-002 | AB220: -3.5900000000000001e-002 | AC220: -9.9399999999999988e-002 | AD220: -0.10099999999999999 | AE220: 95.45 | AF220: 102.92 | AG220: 0.46 | AH220: AA+ | AI220: 3.3000000000000002e-002 | AJ220: =H220+100*O220 -> 169.72800000000001 | AK220: 169 | AL220: 224 | AM220: 66.1 | AN220: 159 | AO220: 4.7e-002 | AP220: 7 | AQ220: 万青转债
A221: 220 | B221: 128108 | C221: 蓝帆转债!! | D221: 2382 | E221: 蓝帆医疗 | F221: 医药 | G221: 医疗器械 | H221: 115.296 | I221: -6.0999999999999995e-003 | J221: -1.e-004 | K221: 13.66 | L221: -2.3599999999999999e-002 | M221: 112.9 | N221: 18.24 | O221: 0.54000000000000004 | P221: 74.89 | Q221: 已到 | R221: 4.28年 | S221: 3.28年 | T221: 15.2 | U221: 7.9 | V221: 4.0000000000000001e-003 | W221: 0.111 | X221: 8.3000000000000004e-002 | Y221: 138 | Z221: 1.08 | AA221: -5.0000000000000001e-003 | AB221: -1.04e-002 | AC221: -2.6499999999999999e-002 | AD221: -2.9300000000000003e-002 | AE221: 92.73 | AF221: 96.57 | AG221: 0.26 | AH221: AA | AI221: 3.7999999999999999e-002 | AJ221: =H221+100*O221 -> 169.29599999999999 | AK221: 155.7 | AL221: 97 | AM221: 59.1 | AN221: 99 | AO221: -0.14400000000000002 | AP221: 29 | AQ221: 蓝帆转债!!
A222: 221 | B222: 113582 | C222: 火炬转债! | D222: 603678 | E222: 火炬电子 | F222: 电子 | G222: 元器件制 | H222: 321.31 | I222: -1.43e-002 | J222: -1.83e-002 | K222: 62.21 | L222: -3.3300000000000003e-002 | M222: 114.9 | N222: 24.99 | O222: 0.29100000000000004 | P222: 248.94 | Q222: 已到 | R222: 4.28年 | S222: 2.28年 | T222: 4.18 | U222: 42 | V222: 3.1e-002 | W222: 1.4999999999999999e-002 | X222: 3.6000000000000004e-002 | Y222: 286 | Z222: 6.45 | AA222: -0.21600000000000003 | AB222: -0.221 | AC222: -0.23499999999999999 | AD222: -0.23600000000000002 | AE222: 94.46 | AF222: 98.28 | AG222: 0.98 | AH222: AA | AI222: 3.7999999999999999e-002 | AJ222: =H222+100*O222 -> 350.41000000000003 | AK222: 393.7 | AL222: 377 | AM222: 295.4 | AN222: 377 | AO222: -4.2000000000000003e-002 | AP222: 5 | AQ222: 火炬转债!
A223: 222 | B223: 113579 | C223: 健友转债! | D223: 603707 | E223: 健友股份 | F223: 医药 | G223: 原料药 | H223: 133.12 | I223: -1.26e-002 | J223: 3.4999999999999996e-003 | K223: 34.25 | L223: -1.4999999999999999e-002 | M223: 113.9 | N223: 32.2 | O223: 0.252 | P223: 106.37 | Q223: 已到 | R223: 4.19年 | S223: 2.19年 | T223: 5.03 | U223: 15 | V223: 2.2000000000000002e-002 | W223: 1.2e-002 | X223: 1.3000000000000001e-002 | Y223: 426 | Z223: 9.71 | AA223: -3.73e-002 | AB223: -4.2900000000000001e-002 | AC223: -0.10199999999999999 | AD223: -0.10400000000000001 | AE223: 94.79 | AF223: 97.77 | AG223: 0.61 | AH223: AA | AI223: 3.7999999999999999e-002 | AJ223: =H223+100*O223 -> 158.31999999999999 | AK223: 159.9 | AL223: 137 | AM223: 62.1 | AN223: 123 | AO223: -7.4999999999999997e-002 | AP223: 10 | AQ223: 健友转债!
A224: 223 | B224: 128107 | C224: 交科转债 | D224: 2061 | E224: 浙江交科 | F224: 建筑 | G224: 建筑工程 | H224: 136.335 | I224: 1.7000000000000001e-003 | J224: -7.3000000000000001e-003 | K224: 6.63 | L224: -7.4999999999999997e-003 | M224: 114.9 | N224: 5.24 | O224: 7.8e-002 | P224: 126.53 | Q224: 已到 | R224: 4.19年 | S224: 2.19年 | T224: 25 | U224: 340 | V224: 9.9000000000000005e-002 | W224: 0.27399999999999997 | X224: 0.34700000000000003 | Y224: 91 | Z224: 1.01 | AA224: -4.0800000000000003e-002 | AB224: -4.6799999999999994e-002 | AC224: -0.111 | AD224: -0.114 | AE224: 95.87 | AF224: 100.6 | AG224: 0.75 | AH224: AA+ | AI224: 3.3000000000000002e-002 | AJ224: =H224+100*O224 -> 144.13500000000002 | AK224: 146.1 | AL224: 32 | AM224: 45.5 | AN224: 31 | AO224: 0.121 | AP224: 21 | AQ224: 交科转债
A225: 224 | B225: 113578 | C225: 全筑转债! | D225: 603030 | E225: 全筑股份 | F225: 建筑 | G225: 装饰工程 | H225: 110.67 | I225: 1.8e-003 | J225: -8.8999999999999999e-003 | K225: 3.66 | L225: -4.1900000000000007e-002 | M225: 117.9 | N225: 5.25 | O225: 0.58700000000000008 | P225: 69.71 | Q225: 已到 | R225: 4.18年 | S225: 2.18年 | T225: 3.84 | U225: 44 | V225: 0.10400000000000001 | W225: 0.18100000000000002 | X225: 0.126 | Y225: 21 | Z225: 0.97 | AA225: 1.5600000000000001e-002 | AB225: 7.9000000000000008e-003 | AC225: -2.8799999999999999e-002 | AD225: -3.15e-002 | AE225: 94.82 | AF225: 101.22 | AG225: 0.17 | AH225: AA | AI225: 3.7999999999999999e-002 | AJ225: =H225+100*O225 -> 169.37 | AK225: 151.6 | AL225: 66 | AM225: 50.4 | AN225: 48 | AO225: 3.0000000000000001e-003 | AP225: 39 | AQ225: 全筑转债!
A226: 225 | B226: 113573 | C226: 纵横转债! | D226: 603602 | E226: 纵横通信 | F226: 通信互联 | G226: 通信设备 | H226: 118.4 | I226: 6.4000000000000003e-003 | J226: -1.1699999999999999e-002 | K226: 12.72 | L226: -2.1499999999999998e-002 | M226: 124.2 | N226: 18.78 | O226: 0.748 | P226: 67.73 | Q226: 已到 | R226: 4.17年 | S226: 2.17年 | T226: 2.7 | U226: 23 | V226: 7.2999999999999995e-002 | W226: 0.10400000000000001 | X226: 7.0000000000000007e-002 | Y226: 26 | Z226: 3.64 | AA226: 1.18e-002 | AB226: 2.e-003 | AC226: -5.4100000000000002e-002 | AD226: -5.7200000000000001e-002 | AE226: 89.06 | AF226: 94.35 | AG226: 0.25 | AH226: A+ | AI226: 7.0000000000000007e-002 | AJ226: =H226+100*O226 -> 193.19999999999999 | AK226: 169.1 | AL226: 225 | AM226: 74.7 | AN226: 221 | AO226: 6.0999999999999999e-002 | AP226: 32 | AQ226: 纵横转债!
A227: 226 | B227: 113577 | C227: 春秋转债! | D227: 603890 | E227: 春秋电子 | F227: 电子 | G227: 电子产品 | H227: 140.56 | I227: -2.5099999999999997e-002 | J227: -6.3e-003 | K227: 11.27 | L227: -5.1299999999999998e-002 | M227: 117.7 | N227: 10.85 | O227: 0.35299999999999998 | P227: 103.87 | Q227: 已到 | R227: 4.16年 | S227: 2.16年 | T227: 1.78 | U227: 28 | V227: 0.111 | W227: 3.6000000000000004e-002 | X227: 3.7000000000000005e-002 | Y227: 49 | Z227: 1.99 | AA227: -4.2599999999999999e-002 | AB227: -4.9599999999999998e-002 | AC227: -0.12300000000000001 | AD227: -0.125 | AE227: 90.8 | AF227: 93.25 | AG227: 0.61 | AH227: AA- | AI227: 5.9000000000000004e-002 | AJ227: =H227+100*O227 -> 175.86000000000001 | AK227: 177.2 | AL227: 275 | AM227: 84 | AN227: 276 | AO227: -0.14699999999999999 | AP227: 15 | AQ227: 春秋转债!
A228: 227 | B228: 123050 | C228: 聚飞转债! | D228: 300303 | E228: 聚飞光电 | F228: 电子 | G228: LED制 | H228: 139.499 | I228: -9.1999999999999998e-003 | J228: -1.0700000000000001e-002 | K228: 5.51 | L228: -3.3300000000000003e-002 | M228: 123.8 | N228: 5.08 | O228: 0.28600000000000003 | P228: 108.46 | Q228: 已到 | R228: 4.16年 | S228: 2.16年 | T228: 3.75 | U228: 14 | V228: 2.6000000000000002e-002 | W228: 5.0999999999999997e-002 | X228: 5.5e-002 | Y228: 74 | Z228: 2.66 | AA228: -2.8900000000000002e-002 | AB228: -3.7999999999999999e-002 | AC228: -0.12 | AD228: -0.122 | AE228: 90.9 | AF228: 98.08 | AG228: 0.6 | AH228: AA- | AI228: 5.9000000000000004e-002 | AJ228: =H228+100*O228 -> 168.09899999999999 | AK228: 170.5 | AL228: 235 | AM228: 72.5 | AN228: 206 | AO228: -6.8000000000000005e-002 | AP228: 12 | AQ228: 聚飞转债!
A229: 228 | B229: 123049 | C229: 维尔转债! | D229: 300190 | E229: 维尔利 | F229: 城市公用 | G229: 三废处理 | H229: 117.84 | I229: -8.9999999999999998e-004 | J229: 8.9999999999999998e-004 | K229: 5.8 | L229: 0. | M229: 124.3 | N229: 7.38 | O229: 0.499 | P229: 78.59 | Q229: 已到 | R229: 4年59天 | S229: 2年59天 | T229: 9.17 | U229: 2.6 | V229: 2.e-003 | W229: 0.20199999999999999 | X229: 0.159 | Y229: 45 | Z229: 1.04 | AA229: 1.32e-002 | AB229: 3.3e-003 | AC229: -5.2000000000000005e-002 | AD229: -5.5199999999999999e-002 | AE229: 91.37 | AF229: 98.55 | AG229: 0.32 | AH229: AA- | AI229: 5.9000000000000004e-002 | AJ229: =H229+100*O229 -> 167.74000000000001 | AK229: 157.1 | AL229: 108 | AM229: 58.5 | AN229: 96 | AO229: -9.0000000000000011e-003 | AP229: 21 | AQ229: 维尔转债!
A230: 229 | B230: 110070 | C230: 凌钢转债! | D230: 600231 | E230: 凌钢股份 | F230: 钢铁 | G230: 炼钢 | H230: 129.49 | I230: 5.9999999999999995e-004 | J230: -8.199999999999999e-003 | K230: 2.77 | L230: -1.4199999999999999e-002 | M230: 117.4 | N230: 2.69 | O230: 0.25800000000000001 | P230: 102.97 | Q230: 已到 | R230: 4年59天 | S230: 2年59天 | T230: 2.17 | U230: 20 | V230: 7.0999999999999994e-002 | W230: 2.7000000000000003e-002 | X230: 2.7999999999999997e-002 | Y230: 79 | Z230: 0.84 | AA230: -2.3799999999999998e-002 | AB230: -3.0899999999999997e-002 | AC230: -9.1799999999999993e-002 | AD230: -9.4399999999999998e-002 | AE230: 95.21 | AF230: 100.9 | AG230: 0.53 | AH230: AA | AI230: 3.7999999999999999e-002 | AJ230: =H230+100*O230 -> 155.29000000000002 | AK230: 156 | AL230: 101 | AM230: 55.1 | AN230: 73 | AO230: 2.1000000000000001e-002 | AP230: 22 | AQ230: 凌钢转债!
A231: 230 | B231: 128106 | C231: 华统转债! | D231: 2840 | E231: 华统股份 | F231: 农业 | G231: 农产品加 | H231: 167.907 | I231: -5.7099999999999998e-002 | J231: 1.24e-002 | K231: 14.71 | L231: -4.9100000000000005e-002 | M231: 112.9 | N231: 9.37 | O231: 7.0000000000000007e-002 | P231: 156.99 | Q231: 已到 | R231: 4年56天 | S231: 2年56天 | T231: 3.92 | U231: 281 | V231: 0.42200000000000004 | W231: 5.7999999999999996e-002 | X231: 9.1999999999999998e-002 | Y231: 67 | Z231: 3.9 | AA231: -9.2799999999999994e-002 | AB231: -9.7599999999999992e-002 | AC231: -0.14099999999999999 | AD231: -0.14199999999999999 | AE231: 94.92 | AF231: 97.04 | AG231: 0.91 | AH231: AA | AI231: 3.7999999999999999e-002 | AJ231: =H231+100*O231 -> 174.90700000000001 | AK231: 178.8 | AL231: 280 | AM231: 81.8 | AN231: 260 | AO231: -0.14899999999999999 | AP231: 13 | AQ231: 华统转债!
A232: 231 | B232: 123048 | C232: 应急转债! | D232: 300527 | E232: 中船应急 | F232: 机械装备 | G232: 专用设备 | H232: 131.45 | I232: -1.52e-002 | J232: 5.5000000000000005e-003 | K232: 8.7 | L232: -1.9199999999999998e-002 | M232: 112.8 | N232: 8.88 | O232: 0.34200000000000003 | P232: 97.97 | Q232: 已到 | R232: 4年56天 | S232: 2年56天 | T232: 3.79 | U232: 28 | V232: 5.5e-002 | W232: 4.4999999999999998e-002 | X232: 4.4000000000000004e-002 | Y232: 84 | Z232: 3.19 | AA232: -3.6900000000000002e-002 | AB232: -4.2199999999999994e-002 | AC232: -9.9399999999999988e-002 | AD232: -0.10099999999999999 | AE232: 95.88 | AF232: 98.86 | AG232: 0.51 | AH232: AA+ | AI232: 3.3000000000000002e-002 | AJ232: =H232+100*O232 -> 165.64999999999998 | AK232: 164.9 | AL232: 186 | AM232: 66.1 | AN232: 158 | AO232: -9.6000000000000002e-002 | AP232: 15 | AQ232: 应急转债!
A233: 232 | B233: 113576 | C233: 起步转债!! | D233: 603557 | E233: ST起步 | F233: 服装纺织 | G233: 鞋服行业 | H233: 117.08 | I233: -6.1999999999999998e-003 | J233: 5.6999999999999993e-003 | K233: 4.7 | L233: -1.26e-002 | M233: 121.3 | N233: 10.55 | O233: 1.6299999999999999 | P233: 44.55 | Q233: 已到 | R233: 4年56天 | S233: 2年56天 | T233: 2.66 | U233: 74 | V233: 0.23699999999999999 | W233: 0.114 | X233: 5.0999999999999997e-002 | Y233: 23 | Z233: 1.55 | AA233: 8.8000000000000005e-003 | AB233: -1.e-004 | AC233: -4.9500000000000002e-002 | AD233: -5.2699999999999997e-002 | AE233: 83.81 | AF233: 82.59 | AG233: 0.04 | AH233: BBB+ | AI233: 0.10000000000000001 | AJ233: =H233+100*O233 -> 280.07999999999998 | AK233: 189.6 | AL233: 315 | AM233: 105.8 | AN233: 332 | AO233: -3.7999999999999999e-002 | AP233: 34 | AQ233: 起步转债!!
A234: 233 | B234: 128105 | C234: 长集转债! | D234: 2616 | E234: 长青集团 | F234: 城市公用 | G234: 三废处理 | H234: 111.435 | I234: -5.0000000000000001e-003 | J234: 3.4999999999999996e-003 | K234: 5.36 | L234: -9.1999999999999998e-003 | M234: 114.9 | N234: 7.91 | O234: 0.64400000000000002 | P234: 67.76 | Q234: 已到 | R234: 4年55天 | S234: 2年55天 | T234: 8 | U234: 2.7 | V234: 3.0000000000000001e-003 | W234: 0.20100000000000001 | X234: 0.13600000000000001 | Y234: 40 | Z234: 1.59 | AA234: 7.6e-003 | AB234: 1.1000000000000001e-003 | AC234: -3.2099999999999997e-002 | AD234: -3.4799999999999998e-002 | AE234: 94.93 | AF234: 98.76 | AG234: 0.16 | AH234: AA | AI234: 3.7999999999999999e-002 | AJ234: =H234+100*O234 -> 175.83500000000001 | AK234: 155.1 | AL234: 91 | AM234: 56.3 | AN234: 79 | AO234: -3.2000000000000001e-002 | AP234: 23 | AQ234: 长集转债!
A235: 234 | B235: 113575 | C235: 东时转债!! | D235: 603377 | E235: 东方时尚 | F235: 其他 | G235: 其他 | H235: 128.61 | I235: 2.0000000000000001e-004 | J235: -1.1000000000000001e-003 | K235: 7.86 | L235: -7.6e-003 | M235: 113.1 | N235: 12.15 | O235: 0.98799999999999999 | P235: 64.69 | Q235: 已到 | R235: 4年55天 | S235: 2年55天 | T235: 0.98 | U235: 25 | V235: 0.19699999999999998 | W235: 1.7000000000000001e-002 | X235: 1.1000000000000001e-002 | Y235: 57 | Z235: 2.64 | AA235: -3.1099999999999999e-002 | AB235: -3.6600000000000001e-002 | AC235: -9.0500000000000011e-002 | AD235: -9.3000000000000013e-002 | AE235: 94.96 | AF235: 97.23 | AG235: 0.13 | AH235: AA | AI235: 3.7999999999999999e-002 | AJ235: =H235+100*O235 -> 227.41000000000003 | AK235: 192.5 | AL235: 323 | AM235: 95.3 | AN235: 310 | AO235: -5.9000000000000004e-002 | AP235: 14 | AQ235: 东时转债!!
A236: 235 | B236: 127016 | C236: 鲁泰转债! | D236: 726 | E236: 鲁 泰Ａ | F236: 服装纺织 | G236: 纺织行业 | H236: 120.1 | I236: 0. | J236: 5.6999999999999993e-003 | K236: 7.21 | L236: 1.9799999999999998e-002 | M236: 115.9 | N236: 8.71 | O236: 0.45100000000000001 | P236: 82.78 | Q236: 已到 | R236: 4年55天 | S236: 2年55天 | T236: 14 | U236: 28 | V236: 1.7000000000000001e-002 | W236: 0.22 | X236: 0.182 | Y236: 64 | Z236: 0.8 | AA236: -8.6999999999999994e-003 | AB236: -1.54e-002 | AC236: -6.3099999999999989e-002 | AD236: -6.5700000000000008e-002 | AE236: 95.99 | AF236: 101.59 | AG236: 0.29 | AH236: AA+ | AI236: 3.3000000000000002e-002 | AJ236: =H236+100*O236 -> 165.19999999999999 | AK236: 157.4 | AL236: 114 | AM236: 55.8 | AN236: 77 | AO236: 6.4000000000000001e-002 | AP236: 23 | AQ236: 鲁泰转债!
A237: 236 | B237: 113033 | C237: 利群转债! | D237: 601366 | E237: 利群股份 | F237: 商业零售 | G237: 商场 | H237: 118.75 | I237: -5.1999999999999998e-003 | J237: -5.0000000000000001e-004 | K237: 6.75 | L237: -1.1699999999999999e-002 | M237: 114.9 | N237: 7.01 | O237: 0.23300000000000001 | P237: 96.29 | Q237: 已到 | R237: 4年47天 | S237: 2年47天 | T237: 18 | U237: 33 | V237: 1.6e-002 | W237: 0.31 | X237: 0.29799999999999999 | Y237: 58 | Z237: 1.33 | AA237: -8.1000000000000013e-003 | AB237: -1.4499999999999999e-002 | AC237: -5.91e-002 | AD237: -6.1699999999999998e-002 | AE237: 95.01 | AF237: 98.84 | AG237: 0.49 | AH237: AA | AI237: 3.7999999999999999e-002 | AJ237: =H237+100*O237 -> 142.05000000000001 | AK237: 141.2 | AL237: 16 | AM237: 42.4 | AN237: 20 | AO237: 4.7e-002 | AP237: 72 | AQ237: 利群转债!
A238: 237 | B238: 113574 | C238: 华体转债! | D238: 603679 | E238: 华体科技 | F238: 城市公用 | G238: 城市公用 | H238: 115.33 | I238: -1.1000000000000001e-003 | J238: 1.e-003 | K238: 12.8 | L238: -2.29e-002 | M238: 115.9 | N238: 33.91 | O238: 2.0600000000000001 | P238: 37.75 | Q238: 已到 | R238: 4年46天 | S238: 2年46天 | T238: 2.09 | U238: 2.7 | V238: 1.1000000000000001e-002 | W238: 0.115 | X238: 4.2999999999999997e-002 | Y238: 18 | Z238: 2.42 | AA238: 1.1999999999999999e-003 | AB238: -5.6000000000000008e-003 | AC238: -4.4299999999999999e-002 | AD238: -4.7500000000000001e-002 | AE238: 89.3 | AF238: 88.35 | AG238: 0.01 | AH238: A+ | AI238: 7.0000000000000007e-002 | AJ238: =H238+100*O238 -> 321.32999999999998 | AK238: 192.9 | AL238: 325 | AM238: 103.6 | AN238: 326 | AO238: -7.8e-002 | AP238: 22 | AQ238: 华体转债!
A239: 238 | B239: 128103 | C239: 同德转债!* | D239: 2360 | E239: 同德化工 | F239: 化工 | G239: 化工 | H239: 187.5 | I239: -4.36e-002 | J239: -6.1999999999999998e-003 | K239: 8.96 | L239: -4.9800000000000004e-002 | M239: 121.3 | N239: 5.08 | O239: 6.3e-002 | P239: 176.38 | Q239: 已到 | R239: 17天 | S239: 无权 | T239: 0.75 | U239: 327 | V239: 2.27 | W239: 2.1000000000000001e-002 | X239: 3.7000000000000005e-002 | Y239: 36 | Z239: 2.68 | AA239: <-100% | AB239: <-100% | AC239: 无权 | AD239: 无权 | AE239: 无权 | AF239: 100.28 | AG239: 1 | AH239: A+ | AI239: 6.0899999999999996e-002 | AJ239: =H239+100*O239 -> 193.80000000000001 | AK239: 198.6 | AL239: 333 | AM239: 98.3 | AN239: 317 | AO239: -1.e-003 | AP239: 17 | AQ239: 同德转债!*
A240: 239 | B240: 110068 | C240: 龙净转债! | D240: 600388 | E240: 龙净环保 | F240: 城市公用 | G240: 三废处理 | H240: 113.59 | I240: -1.2500000000000001e-002 | J240: 1.03e-002 | K240: 8.38 | L240: -8.3000000000000001e-003 | M240: 114.8 | N240: 10.55 | O240: 0.42999999999999999 | P240: 79.43 | Q240: 已到 | R240: 4年39天 | S240: 2年39天 | T240: 20 | U240: 55 | V240: 2.4e-002 | W240: 0.223 | X240: 0.17699999999999999 | Y240: 90 | Z240: 1.39 | AA240: 2.5999999999999999e-003 | AB240: -3.8e-003 | AC240: -4.1299999999999996e-002 | AD240: -4.3899999999999995e-002 | AE240: 96.02 | AF240: 100.76 | AG240: 0.26 | AH240: AA+ | AI240: 3.3000000000000002e-002 | AJ240: =H240+100*O240 -> 156.59 | AK240: 147.7 | AL240: 43 | AM240: 47 | AN240: 36 | AO240: -5.0000000000000001e-003 | AP240: 41 | AQ240: 龙净转债!
A241: 240 | B241: 123046 | C241: 天铁转债! | D241: 300587 | E241: 天铁股份 | F241: 铁路 | G241: 铁路设备 | H241: 330.6 | I241: -1.6e-002 | J241: 3.4999999999999996e-003 | K241: 19.37 | L241: -1.2699999999999999e-002 | M241: 117.7 | N241: 6.73 | O241: 0.14899999999999999 | P241: 287.82 | Q241: 已到 | R241: 4年34天 | S241: 2年34天 | T241: 0.59 | U241: 161 | V241: 0.82499999999999996 | W241: 5.0000000000000001e-003 | X241: 1.3999999999999999e-002 | Y241: 122 | Z241: 6.59 | AA241: -0.22600000000000001 | AB241: -0.23199999999999998 | AC241: -0.26400000000000001 | AD241: -0.26500000000000001 | AE241: 91.17 | AF241: 93.64 | AG241: 0.98 | AH241: AA- | AI241: 5.9000000000000004e-002 | AJ241: =H241+100*O241 -> 345.5 | AK241: 373.4 | AL241: 375 | AM241: 279.7 | AN241: 376 | AO241: 3.3000000000000002e-002 | AP241: 12 | AQ241: 天铁转债!
A242: 241 | B242: 128101 | C242: 联创转债!! | D242: 2036 | E242: 联创电子 | F242: 电子 | G242: 液晶显示 | H242: 164 | I242: -5.4699999999999999e-002 | J242: 2.1099999999999997e-002 | K242: 17.09 | L242: -4.53e-002 | M242: 114.8 | N242: 13.72 | O242: 0.317 | P242: 124.56 | Q242: 已到 | R242: 4年31天 | S242: 2年31天 | T242: 3 | U242: 70 | V242: 0.13900000000000001 | W242: 1.6e-002 | X242: 2.1000000000000001e-002 | Y242: 182 | Z242: 4.66 | AA242: -8.5099999999999995e-002 | AB242: -9.0800000000000006e-002 | AC242: -0.14099999999999999 | AD242: -0.14199999999999999 | AE242: 95.06 | AF242: 98.91 | AG242: 0.74 | AH242: AA | AI242: 3.7999999999999999e-002 | AJ242: =H242+100*O242 -> 195.69999999999999 | AK242: 203.4 | AL242: 337 | AM242: 104.5 | AN242: 329 | AO242: -0.188 | AP242: 13 | AQ242: 联创转债!!
A243: 242 | B243: 123045 | C243: 雷迪转债 | D243: 300652 | E243: 雷迪克 | F243: 汽车 | G243: 零部件制 | H243: 131.499 | I243: -8.3000000000000001e-003 | J243: -8.0000000000000002e-003 | K243: 20.18 | L243: -2.6099999999999998e-002 | M243: 118.9 | N243: 19.63 | O243: 0.27899999999999997 | P243: 102.8 | Q243: 已到 | R243: 4年27天 | S243: 2年27天 | T243: 1.66 | U243: 13 | V243: 5.9999999999999998e-002 | W243: 8.6999999999999994e-002 | X243: 8.9999999999999997e-002 | Y243: 19 | Z243: 1.99 | AA243: -2.5000000000000001e-002 | AB243: -3.2799999999999996e-002 | AC243: -0.10000000000000001 | AD243: -0.10300000000000001 | AE243: 89.61 | AF243: 90.94 | AG243: 0.62 | AH243: A+ | AI243: 7.0000000000000007e-002 | AJ243: =H243+100*O243 -> 159.399 | AK243: 160.2 | AL243: 144 | AM243: 69.3 | AN243: 176 | AO243: -5.7000000000000002e-002 | AP243: 33 | AQ243: 雷迪转债
A244: 243 | B244: 128100 | C244: 搜特转债! | D244: 2503 | E244: 搜于特 | F244: 服装纺织 | G244: 服装行业 | H244: 104.461 | I244: -9.300000000000001e-003 | J244: 1.5e-003 | K244: 1.46 | L244: -1.3500000000000002e-002 | M244: 116.9 | N244: 1.62 | O244: 0.159 | P244: 90.12 | Q244: 已到 | R244: 4年27天 | S244: 2年27天 | T244: 7.99 | U244: 58 | V244: 6.9000000000000006e-002 | W244: 0.17699999999999999 | X244: 0.159 | Y244: 45 | Z244: 2.99 | AA244: 2.86e-002 | AB244: 2.1000000000000001e-002 | AC244: -4.5999999999999999e-003 | AD244: -7.4999999999999997e-003 | AE244: 87.2 | AF244: 86.07 | AG244: 0.58 | AH244: A | AI244: 8.0000000000000002e-002 | AJ244: =H244+100*O244 -> 120.361 | AK244: 118.8 | AL244: 1 | AM244: 31.6 | AN244: 6 | AO244: -7.6999999999999999e-002 | AP244: 96 | AQ244: 搜特转债!
A245: 244 | B245: 123044 | C245: 红相转债!! | D245: 300427 | E245: 红相股份 | F245: 能源电力 | G245: 电力设备 | H245: 117.542 | I245: -4.6999999999999993e-003 | J245: 1.6000000000000001e-003 | K245: 13.26 | L245: -1.34e-002 | M245: 125 | N245: 18.67 | O245: 0.65500000000000003 | P245: 71.02 | Q245: 已到 | R245: 4年27天 | S245: 2年27天 | T245: 5.5 | U245: 4.4 | V245: 6.9999999999999993e-003 | W245: 0.115 | X245: 8.199999999999999e-002 | Y245: 48 | Z245: 2.03 | AA245: 1.5700000000000002e-002 | AB245: 5.1999999999999998e-003 | AC245: -5.1799999999999999e-002 | AD245: -5.5399999999999998e-002 | AE245: 92.09 | AF245: 99.65 | AG245: 0.24 | AH245: AA- | AI245: 5.9000000000000004e-002 | AJ245: =H245+100*O245 -> 183.042 | AK245: 164.1 | AL245: 177 | AM245: 64.4 | AN245: 139 | AO245: 3.1e-002 | AP245: 23 | AQ245: 红相转债!!
A246: 245 | B246: 110067 | C246: 华安转债! | D246: 600909 | E246: 华安证券 | F246: 金融 | G246: 证券行业 | H246: 117.23 | I246: -4.7999999999999996e-003 | J246: 3.5999999999999999e-003 | K246: 5.17 | L246: -3.9000000000000003e-003 | M246: 110.3 | N246: 6.22 | O246: 0.40999999999999998 | P246: 83.12 | Q246: 已到 | R246: 4年27天 | S246: 无权 | T246: 28 | U246: 44 | V246: 1.3000000000000001e-002 | W246: 0.115 | X246: 9.6000000000000002e-002 | Y246: 243 | Z246: 1.3 | AA246: -1.5100000000000001e-002 | AB246: -1.9599999999999999e-002 | AC246: 无权 | AD246: 无权 | AE246: 无权 | AF246: 97.58 | AG246: 0.33 | AH246: AAA | AI246: 3.1e-002 | AJ246: =H246+100*O246 -> 158.23000000000002 | AK246: 151.3 | AL246: 62 | AM246: 53.8 | AN246: 64 | AO246: -6.9999999999999993e-003 | AP246: 25 | AQ246: 华安转债!
A247: 246 | B247: 113570 | C247: 百达转债! | D247: 603331 | E247: 百达精工 | F247: 机械装备 | G247: 机械装备 | H247: 131.77 | I247: 3.0000000000000001e-003 | J247: -8.0000000000000002e-003 | K247: 12.67 | L247: -7.0999999999999995e-003 | M247: 114.9 | N247: 11.34 | O247: 0.17899999999999999 | P247: 111.73 | Q247: 已到 | R247: 4年26天 | S247: 2年26天 | T247: 2.8 | U247: 20 | V247: 5.4000000000000006e-002 | W247: 0.124 | X247: 0.13900000000000001 | Y247: 23 | Z247: 2.78 | AA247: -3.3799999999999997e-002 | AB247: -4.0000000000000001e-002 | AC247: -0.10300000000000001 | AD247: -0.106 | AE247: 89.03 | AF247: 87.81 | AG247: 0.72 | AH247: A+ | AI247: 7.0000000000000007e-002 | AJ247: =H247+100*O247 -> 149.67000000000002 | AK247: 151.8 | AL247: 71 | AM247: 62.8 | AN247: 129 | AO247: 1.3000000000000001e-002 | AP247: 31 | AQ247: 百达转债!
A248: 247 | B248: 113569 | C248: 科达转债! | D248: 603660 | E248: 苏州科达 | F248: 通信互联 | G248: 物联网 | H248: 109.08 | I248: -2.8999999999999998e-003 | J248: 2.3e-003 | K248: 6.57 | L248: -2.0899999999999998e-002 | M248: 120.3 | N248: 14.8 | O248: 1.46 | P248: 44.39 | Q248: 已到 | R248: 4年24天 | S248: 2年24天 | T248: 5.16 | U248: 3.1 | V248: 5.0000000000000001e-003 | W248: 0.159 | X248: 7.0999999999999994e-002 | Y248: 32 | Z248: 1.92 | AA248: 2.5000000000000001e-002 | AB248: 1.61e-002 | AC248: -2.29e-002 | AD248: -2.6000000000000002e-002 | AE248: 91.34 | AF248: 95.84 | AG248: 0.03 | AH248: AA- | AI248: 5.9000000000000004e-002 | AJ248: =H248+100*O248 -> 255.07999999999998 | AK248: 173.8 | AL248: 262 | AM248: 77.9 | AN248: 240 | AO248: -5.0999999999999997e-002 | AP248: 42 | AQ248: 科达转债!
A249: 248 | B249: 113568 | C249: 新春转债!! | D249: 603667 | E249: 五洲新春 | F249: 机械装备 | G249: 通用设备 | H249: 173.41 | I249: -4.41e-002 | J249: 5.1000000000000004e-003 | K249: 13.6 | L249: -4.5599999999999995e-002 | M249: 124.3 | N249: 8.75 | O249: 0.11599999999999999 | P249: 155.43 | Q249: 已到 | R249: 4年21天 | S249: 2年21天 | T249: 2.44 | U249: 134 | V249: 0.314 | W249: 5.9000000000000004e-002 | X249: 9.1999999999999998e-002 | Y249: 41 | Z249: 2.18 | AA249: -8.0600000000000005e-002 | AB249: -8.9399999999999993e-002 | AC249: -0.155 | AD249: -0.157 | AE249: 91.91 | AF249: 99.14 | AG249: 0.85 | AH249: AA- | AI249: 5.9000000000000004e-002 | AJ249: =H249+100*O249 -> 185.00999999999999 | AK249: 191.4 | AL249: 318 | AM249: 92.3 | AN249: 303 | AO249: -7.5999999999999998e-002 | AP249: 34 | AQ249: 新春转债!!
A250: 249 | B250: 123043 | C250: 正元转债!* | D250: 300645 | E250: 正元智慧 | F250: 计算机及 | G250: 软件开发 | H250: 164 | I250: 1.9900000000000001e-002 | J250: 1.5300000000000001e-002 | K250: 25 | L250: 3.5200000000000002e-002 | M250: 120.9 | N250: 15.38 | O250: 9.0000000000000011e-003 | P250: 162.55 | Q250: 已到 | R250: 5.0天 | S250: 无权 | T250: 1.64 | U250: 3728. | V250: 13.33 | W250: 5.0999999999999997e-002 | X250: 8.3000000000000004e-002 | Y250: 32 | Z250: 4.82 | AA250: <-100% | AB250: <-100% | AC250: 无权 | AD250: 无权 | AE250: 无权 | AF250: 100.59 | AG250: 1 | AH250: A+ | AI250: 6.0899999999999996e-002 | AJ250: =H250+100*O250 -> 164.90000000000001 | AK250: 165.5 | AL250: 195 | AM250: 64.9 | AN250: 149 | AO250: 5.9999999999999998e-002 | AP250: 16 | AQ250: 正元转债!*
A251: 250 | B251: 113567 | C251: 君禾转债! | D251: 603617 | E251: 君禾股份 | F251: 机械装备 | G251: 通用设备 | H251: 130.91 | I251: -1.1599999999999999e-002 | J251: 1.5600000000000001e-002 | K251: 12.5 | L251: 5.6000000000000008e-003 | M251: 118.8 | N251: 10.58 | O251: 0.10800000000000001 | P251: 118.15 | Q251: 已到 | R251: 4年19天 | S251: 2年19天 | T251: 2.1 | U251: 30 | V251: 0.109 | W251: 6.5000000000000002e-002 | X251: 7.6999999999999999e-002 | Y251: 32 | Z251: 3.55 | AA251: -2.4300000000000002e-002 | AB251: -3.2000000000000001e-002 | AC251: -9.98e-002 | AD251: -0.10199999999999999 | AE251: 89.67 | AF251: 91 | AG251: 0.72 | AH251: A+ | AI251: 7.0000000000000007e-002 | AJ251: =H251+100*O251 -> 141.71000000000001 | AK251: 143.7 | AL251: 24 | AM251: 52.7 | AN251: 53 | AO251: -3.1e-002 | AP251: 34 | AQ251: 君禾转债!
A252: 251 | B252: 110066 | C252: 盛屯转债!! | D252: 600711 | E252: 盛屯矿业 | F252: 有色金属 | G252: 有色行业 | H252: 234.62 | I252: 1.9699999999999999e-002 | J252: -3.5299999999999998e-002 | K252: 9.72 | L252: -1.6200000000000003e-002 | M252: 114.9 | N252: 4.87 | O252: 0.17600000000000002 | P252: 199.59 | Q252: 已到 | R252: 4年17天 | S252: 2年17天 | T252: 3.83 | U252: 433 | V252: 0.48299999999999998 | W252: 1.3999999999999999e-002 | X252: 2.8999999999999998e-002 | Y252: 267 | Z252: 2.16 | AA252: -0.16399999999999998 | AB252: -0.16899999999999998 | AC252: -0.22 | AD252: -0.221 | AE252: 95.3 | AF252: 99.15 | AG252: 0.96 | AH252: AA | AI252: 3.7999999999999999e-002 | AJ252: =H252+100*O252 -> 252.22 | AK252: 269.7 | AL252: 364 | AM252: 170.5 | AN252: 363 | AO252: -2.9999999999999999e-002 | AP252: 26 | AQ252: 盛屯转债!!
A253: 252 | B253: 113566 | C253: 翔港转债! | D253: 603499 | E253: 翔港科技 | F253: 造纸包装 | G253: 包装材料 | H253: 119.45 | I253: -2.3999999999999998e-003 | J253: -1.1000000000000001e-002 | K253: 7.63 | L253: -4.6300000000000001e-002 | M253: 124 | N253: 10.77 | O253: 0.68599999999999994 | P253: 70.84 | Q253: 已到 | R253: 4年15天 | S253: 2年15天 | T253: 1.61 | U253: 3.6 | V253: 1.9e-002 | W253: 0.105 | X253: 7.400000000000001e-002 | Y253: 15 | Z253: 2.7 | AA253: 9.4999999999999998e-003 | AB253: -5.0000000000000001e-004 | AC253: -6.0999999999999999e-002 | AD253: -6.4299999999999996e-002 | AE253: 89.92 | AF253: 95.05 | AG253: 0.29 | AH253: A+ | AI253: 7.0000000000000007e-002 | AJ253: =H253+100*O253 -> 188.05000000000001 | AK253: 168.1 | AL253: 215 | AM253: 73 | AN253: 208 | AO253: -0.13 | AP253: 31 | AQ253: 翔港转债!
A254: 253 | B254: 113565 | C254: 宏辉转债 | D254: 603336 | E254: 宏辉果蔬 | F254: 农业 | G254: 农产品加 | H254: 124.12 | I254: -9.7000000000000003e-003 | J254: -5.1000000000000004e-003 | K254: 7.16 | L254: -2.8500000000000001e-002 | M254: 117.8 | N254: 7.64 | O254: 0.32400000000000001 | P254: 93.72 | Q254: 已到 | R254: 4年13天 | S254: 2年13天 | T254: 2.25 | U254: 32 | V254: 0.115 | W254: 7.2000000000000008e-002 | X254: 6.7000000000000004e-002 | Y254: 31 | Z254: 3.02 | AA254: -1.32e-002 | AB254: -2.07e-002 | AC254: -7.9299999999999995e-002 | AD254: -8.2100000000000006e-002 | AE254: 91.58 | AF254: 94.04 | AG254: 0.52 | AH254: AA- | AI254: 5.9000000000000004e-002 | AJ254: =H254+100*O254 -> 156.52000000000001 | AK254: 154.5 | AL254: 87 | AM254: 60.5 | AN254: 112 | AO254: -8.199999999999999e-002 | AP254: 28 | AQ254: 宏辉转债
A255: 254 | B255: 128097 | C255: 奥佳转债!! | D255: 2614 | E255: 奥佳华 | F255: 机械装备 | G255: 专用设备 | H255: 135.78 | I255: -1.7500000000000002e-002 | J255: -1.5e-003 | K255: 11.4 | L255: -2.81e-002 | M255: 114.9 | N255: 10.39 | O255: 0.23800000000000002 | P255: 109.72 | Q255: 已到 | R255: 4年12天 | S255: 2年12天 | T255: 4.59 | U255: 8 | V255: 1.3000000000000001e-002 | W255: 6.4000000000000001e-002 | X255: 7.0000000000000007e-002 | Y255: 72 | Z255: 1.53 | AA255: -4.1399999999999999e-002 | AB255: -4.7599999999999996e-002 | AC255: -0.11699999999999999 | AD255: -0.12 | AE255: 91.29 | AF255: 91.68 | AG255: 0.68 | AH255: AA- | AI255: 5.9000000000000004e-002 | AJ255: =H255+100*O255 -> 159.58000000000001 | AK255: 161.8 | AL255: 157 | AM255: 70.2 | AN255: 186 | AO255: -8.0000000000000002e-002 | AP255: 16 | AQ255: 奥佳转债!!
A256: 255 | B256: 128095 | C256: 恩捷转债!! | D256: 2812 | E256: 恩捷股份 | F256: 电子 | G256: 元器件制 | H256: 423 | I256: -8.0000000000000002e-003 | J256: 1.2999999999999999e-003 | K256: 224.98 | L256: -6.7000000000000002e-003 | M256: 114.9 | N256: 64.92 | O256: 0.221 | P256: 346.55 | Q256: 已到 | R256: 3.99年 | S256: 1.99年 | T256: 4.54 | U256: 199 | V256: 0.10199999999999999 | W256: 2.e-003 | X256: 8.0000000000000002e-003 | Y256: 2008. | Z256: 15.66 | AA256: -0.28199999999999997 | AB256: -0.28600000000000003 | AC256: -0.309 | AD256: -0.309 | AE256: 94.89 | AF256: 98.74 | AG256: 0.99 | AH256: AA | AI256: 3.7999999999999999e-002 | AJ256: =H256+100*O256 -> 445.10000000000002 | AK256: 499.5 | AL256: 383 | AM256: 400.7 | AN256: 383 | AO256: -0.114 | AP256: 12 | AQ256: 恩捷转债!!
A257: 256 | B257: 128096 | C257: 奥瑞转债!!* | D257: 2701 | E257: 奥瑞金 | F257: 造纸包装 | G257: 包装材料 | H257: 139 | I257: -3.27e-002 | J257: 1.55e-002 | K257: 6.28 | L257: -1.72e-002 | M257: 115.5 | N257: 4.5 | O257: -4.0000000000000001e-003 | P257: 139.56 | Q257: 已到 | R257: 16天 | S257: 无权 | T257: 4.56 | U257: 43 | V257: 6.7000000000000004e-002 | W257: 2.9999999999999999e-002 | X257: 4.0999999999999995e-002 | Y257: 154 | Z257: 2.12 | AA257: <-100% | AB257: <-100% | AC257: 无权 | AD257: 无权 | AE257: 无权 | AF257: 99.95 | AG257: 1 | AH257: AA+ | AI257: 2.3900000000000001e-002 | AJ257: =H257+100*O257 -> 138.59999999999999 | AK257: 138.4 | AL257: 10 | AM257: 38.5 | AN257: 11 | AO257: -1.9e-002 | AP257: 15 | AQ257: 奥瑞转债!!*
A258: 257 | B258: 113563 | C258: 柳药转债! | D258: 603368 | E258: 柳药股份 | F258: 医药 | G258: 医药商业 | H258: 115.87 | I258: -1.21e-002 | J258: 5.7999999999999996e-003 | K258: 16.44 | L258: -3.8599999999999995e-002 | M258: 112.3 | N258: 23.87 | O258: 0.68200000000000005 | P258: 68.87 | Q258: 已到 | R258: 3.92年 | S258: 1.92年 | T258: 8.02 | U258: 7.2 | V258: 8.0000000000000002e-003 | W258: 0.13500000000000001 | X258: 9.3000000000000013e-002 | Y258: 60 | Z258: 1.14 | AA258: -8.1000000000000013e-003 | AB258: -1.37e-002 | AC258: -5.5999999999999994e-002 | AD258: -5.8400000000000001e-002 | AE258: 95.14 | AF258: 97.28 | AG258: 0.16 | AH258: AA | AI258: 3.7999999999999999e-002 | AJ258: =H258+100*O258 -> 184.06999999999999 | AK258: 162.9 | AL258: 171 | AM258: 65.6 | AN258: 156 | AO258: -0.13900000000000001 | AP258: 19 | AQ258: 柳药转债!
A259: 258 | B259: 128094 | C259: 星帅转债!* | D259: 2860 | E259: 星帅尔 | F259: 家电 | G259: 零部件制 | H259: 138.3 | I259: -3.27e-002 | J259: 3.3e-003 | K259: 19.15 | L259: -2.9399999999999999e-002 | M259: 120.3 | N259: 13.8 | O259: -3.0000000000000001e-003 | P259: 138.77 | Q259: 已到 | R259: 12天 | S259: 无权 | T259: 1.49 | U259: 59 | V259: 0.28100000000000003 | W259: 3.7999999999999999e-002 | X259: 5.2999999999999999e-002 | Y259: 39 | Z259: 3.39 | AA259: <-100% | AB259: <-100% | AC259: 无权 | AD259: 无权 | AE259: 无权 | AF259: 99.94 | AG259: 1 | AH259: A+ | AI259: 6.0899999999999996e-002 | AJ259: =H259+100*O259 -> 138. | AK259: 137.8 | AL259: 8 | AM259: 37.9 | AN259: 10 | AO259: -0.127 | AP259: 28 | AQ259: 星帅转债!*
A260: 259 | B260: 123042 | C260: 银河转债!!* | D260: 300619 | E260: 金银河 | F260: 机械装备 | G260: 专用设备 | H260: 279.098 | I260: -2.0899999999999998e-002 | J260: -1.3999999999999999e-002 | K260: 59.1 | L260: -3.49e-002 | M260: 114.6 | N260: 23.59 | O260: 0.114 | P260: 250.53 | Q260: 已到 | R260: 12天 | S260: 无权 | T260: 0.97 | U260: 371 | V260: 1.3400000000000001 | W260: 1.9e-002 | X260: 4.8000000000000001e-002 | Y260: 50 | Z260: 8.32 | AA260: <-100% | AB260: <-100% | AC260: 无权 | AD260: 无权 | AE260: 无权 | AF260: 99.94 | AG260: 1 | AH260: A+ | AI260: 6.0899999999999996e-002 | AJ260: =H260+100*O260 -> 290.49799999999999 | AK260: 307.7 | AL260: 370 | AM260: 207.7 | AN260: 370 | AO260: -0.126 | AP260: 20 | AQ260: 银河转债!!*
A261: 260 | B261: 127015 | C261: 希望转债!! | D261: 876 | E261: 新 希 望 | F261: 农业 | G261: 畜牧业 | H261: 129 | I261: -2.3e-003 | J261: -5.6999999999999993e-003 | K261: 17.6 | L261: -1.84e-002 | M261: 109.6 | N261: 19.75 | O261: 0.44799999999999995 | P261: 89.11 | Q261: 已到 | R261: 3.89年 | S261: 1.89年 | T261: 9.5 | U261: 13 | V261: 1.1000000000000001e-002 | W261: 1.2e-002 | X261: 1.1000000000000001e-002 | Y261: 793 | Z261: 2.6 | AA261: -4.1599999999999998e-002 | AB261: -4.5899999999999996e-002 | AC261: -0.107 | AD261: -0.109 | AE261: 96.08 | AF261: 97.51 | AG261: 0.43 | AH261: AAA | AI261: 3.1e-002 | AJ261: =H261+100*O261 -> 173.80000000000001 | AK261: 168.9 | AL261: 223 | AM261: 71.4 | AN261: 197 | AO261: 5.5e-002 | AP261: 26 | AQ261: 希望转债!!
A262: 261 | B262: 128093 | C262: 百川转债!!* | D262: 2455 | E262: 百川股份 | F262: 化工 | G262: 化工 | H262: 214 | I262: -1.29e-002 | J262: -7.000000000000001e-004 | K262: 12.33 | L262: -1.3600000000000001e-002 | M262: 129 | N262: 5.77 | O262: 1.e-003 | P262: 213.69 | Q262: 已到 | R262: 17天 | S262: 无权 | T262: 1.38 | U262: 176 | V262: 0.58700000000000008 | W262: 2.e-002 | X262: 4.2000000000000003e-002 | Y262: 70 | Z262: 3.94 | AA262: <-100% | AB262: <-100% | AC262: 无权 | AD262: 无权 | AE262: 无权 | AF262: 100.17 | AG262: 1 | AH262: AA- | AI262: 4.99e-002 | AJ262: =H262+100*O262 -> 214.09999999999999 | AK262: 214.3 | AL262: 343 | AM262: 114.1 | AN262: 338 | AO262: -2.7000000000000003e-002 | AP262: 36 | AQ262: 百川转债!!*
A263: 262 | B263: 113561 | C263: 正裕转债! | D263: 603089 | E263: 正裕工业 | F263: 汽车 | G263: 零部件制 | H263: 121.68 | I263: -5.4000000000000003e-003 | J263: -8.0000000000000002e-003 | K263: 8.57 | L263: -2.8300000000000002e-002 | M263: 117.2 | N263: 10.08 | O263: 0.43099999999999999 | P263: 85.02 | Q263: 已到 | R263: 3.88年 | S263: 1.88年 | T263: 1.5 | U263: 2.7 | V263: 1.4999999999999999e-002 | W263: 7.9000000000000001e-002 | X263: 6.7000000000000004e-002 | Y263: 19 | Z263: 1.84 | AA263: -9.7999999999999997e-003 | AB263: -1.7500000000000002e-002 | AC263: -7.7199999999999991e-002 | AD263: -8.0000000000000002e-002 | AE263: 90.11 | AF263: 90.67 | AG263: 0.47 | AH263: A+ | AI263: 7.0000000000000007e-002 | AJ263: =H263+100*O263 -> 164.78 | AK263: 158.3 | AL263: 120 | AM263: 67.7 | AN263: 167 | AO263: -4.8000000000000001e-002 | AP263: 35 | AQ263: 正裕转债!
A264: 263 | B264: 128091 | C264: 新天转债! | D264: 2873 | E264: 新天药业 | F264: 医药 | G264: 中药 | H264: 188.941 | I264: -5.2199999999999996e-002 | J264: -3.0499999999999999e-002 | K264: 18.71 | L264: -9.0899999999999995e-002 | M264: 118.6 | N264: 11.62 | O264: 0.17300000000000001 | P264: 161.02 | Q264: 已到 | R264: 3.88年 | S264: 1.88年 | T264: 1.55 | U264: 474 | V264: 1.5900000000000001 | W264: 5.0000000000000003e-002 | X264: 8.1000000000000003e-002 | Y264: 31 | Z264: 2.52 | AA264: -0.115 | AB264: -0.122 | AC264: -0.19600000000000001 | AD264: -0.19800000000000001 | AE264: 90.41 | AF264: 91.81 | AG264: 0.91 | AH264: A+ | AI264: 7.0000000000000007e-002 | AJ264: =H264+100*O264 -> 206.24100000000001 | AK264: 216.9 | AL264: 345 | AM264: 125.1 | AN264: 347 | AO264: -0.14199999999999999 | AP264: 22 | AQ264: 新天转债!
A265: 264 | B265: 128090 | C265: 汽模转2 | D265: 2510 | E265: 天汽模 | F265: 汽车 | G265: 零部件制 | H265: 124 | I265: -1.66e-002 | J265: 5.9999999999999995e-004 | K265: 4.07 | L265: -2.86e-002 | M265: 114.3 | N265: 4.23 | O265: 0.28899999999999998 | P265: 96.22 | Q265: 已到 | R265: 3.87年 | S265: 1.87年 | T265: 3.1 | U265: 11 | V265: 2.7000000000000003e-002 | W265: 8.1000000000000003e-002 | X265: 7.8e-002 | Y265: 38 | Z265: 1.88 | AA265: -2.12e-002 | AB265: -2.76e-002 | AC265: -8.8599999999999998e-002 | AD265: -9.0899999999999995e-002 | AE265: 91.55 | AF265: 91.95 | AG265: 0.56 | AH265: AA- | AI265: 5.9000000000000004e-002 | AJ265: =H265+100*O265 -> 152.90000000000001 | AK265: 151.8 | AL265: 69 | AM265: 59.8 | AN265: 106 | AO265: -6.6000000000000003e-002 | AP265: 29 | AQ265: 汽模转2
A266: 265 | B266: 123039 | C266: 开润转债! | D266: 300577 | E266: 开润股份 | F266: 服装纺织 | G266: 纺织行业 | H266: 117.81 | I266: -3.3e-003 | J266: -3.3e-003 | K266: 19.11 | L266: -3.4799999999999998e-002 | M266: 120.3 | N266: 29.92 | O266: 0.84499999999999997 | P266: 63.87 | Q266: 已到 | R266: 3.87年 | S266: 1.87年 | T266: 2.22 | U266: 2 | V266: 8.0000000000000002e-003 | W266: 4.8000000000000001e-002 | X266: 3.1e-002 | Y266: 46 | Z266: 2.85 | AA266: 5.5000000000000005e-003 | AB266: -3.4999999999999996e-003 | AC266: -6.2699999999999992e-002 | AD266: -6.5700000000000008e-002 | AE266: 90.2 | AF266: 93.15 | AG266: 0.19 | AH266: A+ | AI266: 7.0000000000000007e-002 | AJ266: =H266+100*O266 -> 202.31 | AK266: 171.7 | AL266: 249 | AM266: 78.6 | AN266: 243 | AO266: -9.8000000000000004e-002 | AP266: 23 | AQ266: 开润转债!
A267: 266 | B267: 123038 | C267: 联得转债! | D267: 300545 | E267: 联得装备 | F267: 机械装备 | G267: 专用设备 | H267: 127.901 | I267: -4.6999999999999993e-003 | J267: -2.0000000000000001e-004 | K267: 20.29 | L267: -1.0700000000000001e-002 | M267: 117.9 | N267: 24.07 | O267: 0.51700000000000002 | P267: 84.3 | Q267: 已到 | R267: 3.86年 | S267: 1.86年 | T267: 1.47 | U267: 7.9 | V267: 4.2000000000000003e-002 | W267: 4.0999999999999995e-002 | X267: 3.4000000000000002e-002 | Y267: 36 | Z267: 2.6 | AA267: -2.1299999999999999e-002 | AB267: -2.9100000000000001e-002 | AC267: -0.10099999999999999 | AD267: -0.10400000000000001 | AE267: 90.01 | AF267: 91.28 | AG267: 0.45 | AH267: A+ | AI267: 7.0000000000000007e-002 | AJ267: =H267+100*O267 -> 179.601 | AK267: 171.5 | AL267: 245 | AM267: 80.2 | AN267: 252 | AO267: -6.5000000000000002e-002 | AP267: 18 | AQ267: 联得转债!
A268: 267 | B268: 113030 | C268: 东风转债! | D268: 601515 | E268: 东风股份 | F268: 造纸包装 | G268: 包装材料 | H268: 137.98 | I268: -7.3000000000000001e-003 | J268: -1.1200000000000002e-002 | K268: 7.07 | L268: -3.0200000000000001e-002 | M268: 116.3 | N268: 6.4 | O268: 0.249 | P268: 110.47 | Q268: 已到 | R268: 3.86年 | S268: 1.86年 | T268: 2.95 | U268: 56 | V268: 0.13699999999999998 | W268: 2.7000000000000003e-002 | X268: 2.9999999999999999e-002 | Y268: 109 | Z268: 2.09 | AA268: -4.4000000000000004e-002 | AB268: -5.0999999999999997e-002 | AC268: -0.11 | AD268: -0.11199999999999999 | AE268: 95.36 | AF268: 100.97 | AG268: 0.62 | AH268: AA | AI268: 3.7999999999999999e-002 | AJ268: =H268+100*O268 -> 162.88 | AK268: 165.5 | AL268: 197 | AM268: 64.5 | AN268: 141 | AO268: -7.400000000000001e-002 | AP268: 17 | AQ268: 东风转债!
A269: 268 | B269: 110064 | C269: 建工转债! | D269: 600939 | E269: 重庆建工 | F269: 建筑 | G269: 建筑工程 | H269: 138.25 | I269: -8.6999999999999994e-003 | J269: 6.6500000000000004e-002 | K269: 6.38 | L269: 7.0499999999999993e-002 | M269: 119.2 | N269: 4.53 | O269: -1.8000000000000002e-002 | P269: 140.84 | Q269: 已到 | R269: 3.85年 | S269: 1.85年 | T269: 16.6 | U269: 2393. | V269: 1.03 | W269: 0.14300000000000002 | X269: 0.20199999999999999 | Y269: 116 | Z269: 1.59 | AA269: -3.8599999999999995e-002 | AB269: -4.6699999999999998e-002 | AC269: -0.109 | AD269: -0.111 | AE269: 97.02 | AF269: 105.5 | AG269: 0.82 | AH269: AA+ | AI269: 3.3000000000000002e-002 | AJ269: =H269+100*O269 -> 136.44999999999999 | AK269: 135.7 | AL269: 7 | AM269: 30.2 | AN269: 4 | AO269: 0.42499999999999999 | AP269: 47 | AQ269: 建工转债!
A270: 269 | B270: 128087 | C270: 孚日转债! | D270: 2083 | E270: 孚日股份 | F270: 服装纺织 | G270: 家纺 | H270: 126.604 | I270: -7.9000000000000008e-003 | J270: -1.26e-002 | K270: 4.79 | L270: -3.04e-002 | M270: 112.3 | N270: 4.5 | O270: 0.18899999999999997 | P270: 106.44 | Q270: 已到 | R270: 3.84年 | S270: 1.84年 | T270: 6.5 | U270: 34 | V270: 4.2000000000000003e-002 | W270: 0.14899999999999999 | X270: 0.159 | Y270: 43 | Z270: 1.16 | AA270: -3.1300000000000001e-002 | AB270: -3.6799999999999999e-002 | AC270: -9.9100000000000008e-002 | AD270: -0.10099999999999999 | AE270: 91.7 | AF270: 90.49 | AG270: 0.68 | AH270: AA- | AI270: 5.9000000000000004e-002 | AJ270: =H270+100*O270 -> 145.50399999999999 | AK270: 146.8 | AL270: 34 | AM270: 55.1 | AN270: 72 | AO270: -1.3999999999999999e-002 | AP270: 73 | AQ270: 孚日转债!
A271: 270 | B271: 128085 | C271: 鸿达转债!! | D271: 2002 | E271: 鸿达兴业 | F271: 化工 | G271: 化工 | H271: 140.35 | I271: -1.9599999999999999e-002 | J271: 1.7000000000000001e-003 | K271: 5.3 | L271: -2.0299999999999999e-002 | M271: 123.8 | N271: 3.91 | O271: 3.5000000000000003e-002 | P271: 135.55 | Q271: 已到 | R271: 3.84年 | S271: 1.84年 | T271: 3.39 | U271: 55 | V271: 0.114 | W271: 2.1000000000000001e-002 | X271: 2.7999999999999997e-002 | Y271: 165 | Z271: 1.59 | AA271: -3.2799999999999996e-002 | AB271: -4.2699999999999995e-002 | AC271: -0.11599999999999999 | AD271: -0.11800000000000001 | AE271: 75.58 | AF271: 68.74 | AG271: 0.88 | AH271: B | AI271: 0.17000000000000001 | AJ271: =H271+100*O271 -> 143.84999999999999 | AK271: 145.2 | AL271: 29 | AM271: 69.6 | AN271: 178 | AO271: -4.7e-002 | AP271: 84 | AQ271: 鸿达转债!!
A272: 271 | B272: 110063 | C272: 鹰19转债 | D272: 600567 | E272: 山鹰国际 | F272: 造纸包装 | G272: 包装用纸 | H272: 122.89 | I272: -4.6999999999999993e-003 | J272: 2.9999999999999997e-004 | K272: 3.22 | L272: -9.1999999999999998e-003 | M272: 115.4 | N272: 3.26 | O272: 0.24399999999999999 | P272: 98.77 | Q272: 已到 | R272: 3.83年 | S272: 1.83年 | T272: 18.4 | U272: 4.4 | V272: 2.e-003 | W272: 0.124 | X272: 0.12300000000000001 | Y272: 149 | Z272: 0.92 | AA272: -1.66e-002 | AB272: -2.35e-002 | AC272: -8.6300000000000002e-002 | AD272: -8.8699999999999987e-002 | AE272: 96.32 | AF272: 102.13 | AG272: 0.47 | AH272: AA+ | AI272: 3.3000000000000002e-002 | AJ272: =H272+100*O272 -> 147.28999999999999 | AK272: 147 | AL272: 39 | AM272: 44.9 | AN272: 29 | AO272: -1.1000000000000001e-002 | AP272: 29 | AQ272: 鹰19转债
A273: 272 | B273: 128083 | C273: 新北转债! | D273: 2376 | E273: 新北洋 | F273: 电子 | G273: 电子产品 | H273: 117.233 | I273: -2.2200000000000001e-002 | J273: 1.4499999999999999e-002 | K273: 8.69 | L273: -3.3399999999999999e-002 | M273: 114.3 | N273: 11.45 | O273: 0.54500000000000004 | P273: 75.9 | Q273: 已到 | R273: 3.83年 | S273: 1.83年 | T273: 8.77 | U273: 4.5 | V273: 4.0000000000000001e-003 | W273: 0.152 | X273: 0.115 | Y273: 58 | Z273: 1.72 | AA273: -6.7000000000000002e-003 | AB273: -1.3300000000000001e-002 | AC273: -6.4199999999999993e-002 | AD273: -6.6699999999999995e-002 | AE273: 95.48 | AF273: 99.36 | AG273: 0.23 | AH273: AA | AI273: 3.7999999999999999e-002 | AJ273: =H273+100*O273 -> 171.733 | AK273: 158.6 | AL273: 123 | AM273: 59.2 | AN273: 101 | AO273: -3.5000000000000003e-002 | AP273: 22 | AQ273: 新北转债!
A274: 273 | B274: 128082 | C274: 华锋转债!! | D274: 2806 | E274: 华锋股份 | F274: 电子 | G274: 元器件制 | H274: 154 | I274: -3.6900000000000002e-002 | J274: 7.0999999999999995e-003 | K274: 12.59 | L274: -3.6699999999999997e-002 | M274: 120.6 | N274: 9.13 | O274: 0.11699999999999999 | P274: 137.9 | Q274: 已到 | R274: 3.81年 | S274: 1.81年 | T274: 2.04 | U274: 30 | V274: 9.1999999999999998e-002 | W274: 8.4000000000000005e-002 | X274: 0.11599999999999999 | Y274: 24 | Z274: 2.12 | AA274: -6.3500000000000001e-002 | AB274: -7.1900000000000006e-002 | AC274: -0.14699999999999999 | AD274: -0.14899999999999999 | AE274: 89.22 | AF274: 90.63 | AG274: 0.81 | AH274: A | AI274: 8.0000000000000002e-002 | AJ274: =H274+100*O274 -> 165.69999999999999 | AK274: 170.1 | AL274: 232 | AM274: 79.5 | AN274: 248 | AO274: -6.5000000000000002e-002 | AP274: 45 | AQ274: 华锋转债!!
A275: 274 | B275: 110062 | C275: 烽火转债! | D275: 600498 | E275: 烽火通信 | F275: 通信互联 | G275: 通信设备 | H275: 117.03 | I275: -6.9999999999999993e-003 | J275: 6.0000000000000001e-003 | K275: 16.99 | L275: -4.6999999999999993e-003 | M275: 110.3 | N275: 22.85 | O275: 0.57399999999999995 | P275: 74.35 | Q275: 已到 | R275: 3.80年 | S275: 1.80年 | T275: 30.9 | U275: 27 | V275: 6.9999999999999993e-003 | W275: 0.153 | X275: 0.114 | Y275: 202 | Z275: 1.75 | AA275: -1.5800000000000002e-002 | AB275: -2.06e-002 | AC275: -6.4199999999999993e-002 | AD275: -6.6699999999999995e-002 | AE275: 96.85 | AF275: 98.44 | AG275: 0.2 | AH275: AAA | AI275: 3.1e-002 | AJ275: =H275+100*O275 -> 174.43000000000001 | AK275: 159.7 | AL275: 135 | AM275: 61.3 | AN275: 118 | AO275: -3.4000000000000002e-002 | AP275: 18 | AQ275: 烽火转债!
A276: 275 | B276: 128081 | C276: 海亮转债! | D276: 2203 | E276: 海亮股份 | F276: 有色金属 | G276: 铜金属 | H276: 135.191 | I276: -3.5999999999999999e-003 | J276: 1.1999999999999999e-003 | K276: 11.8 | L276: -3.4000000000000002e-003 | M276: 114.3 | N276: 9.69 | O276: 0.11 | P276: 121.78 | Q276: 已到 | R276: 3.77年 | S276: 1.77年 | T276: 30.1 | U276: 42 | V276: 1.e-002 | W276: 0.13 | X276: 0.158 | Y276: 232 | Z276: 2.32 | AA276: -4.4299999999999999e-002 | AB276: -5.0700000000000002e-002 | AC276: -0.109 | AD276: -0.111 | AE276: 95.69 | AF276: 99.57 | AG276: 0.72 | AH276: AA | AI276: 3.7999999999999999e-002 | AJ276: =H276+100*O276 -> 146.191 | AK276: 148.6 | AL276: 47 | AM276: 49 | AN276: 42 | AO276: -1.2e-002 | AP276: 43 | AQ276: 海亮转债!
A277: 276 | B277: 113550 | C277: 常汽转债! | D277: 603035 | E277: 常熟汽饰 | F277: 汽车 | G277: 零部件制 | H277: 244.19 | I277: -4.24e-002 | J277: 5.5000000000000005e-003 | K277: 18.05 | L277: -3.8900000000000004e-002 | M277: 120.5 | N277: 9.33 | O277: 0.26200000000000001 | P277: 193.46 | Q277: 已到 | R277: 3.76年 | S277: 1.76年 | T277: 2.14 | U277: 244 | V277: 0.45200000000000001 | W277: 3.3000000000000002e-002 | X277: 6.4000000000000001e-002 | Y277: 65 | Z277: 1.66 | AA277: -0.17399999999999999 | AB277: -0.18100000000000002 | AC277: -0.27000000000000002 | AD277: -0.27100000000000002 | AE277: 92.68 | AF277: 97.6 | AG277: 0.95 | AH277: AA- | AI277: 5.9000000000000004e-002 | AJ277: =H277+100*O277 -> 270.38999999999999 | AK277: 294.9 | AL277: 369 | AM277: 197.3 | AN277: 369 | AO277: -7.5999999999999998e-002 | AP277: 14 | AQ277: 常汽转债!
A278: 277 | B278: 113549 | C278: 白电转债 | D278: 603861 | E278: 白云电器 | F278: 能源电力 | G278: 电力设备 | H278: 132.72 | I278: -2.8500000000000001e-002 | J278: 1.8e-003 | K278: 10.08 | L278: -4.1799999999999997e-002 | M278: 114.3 | N278: 9.06 | O278: 0.193 | P278: 111.26 | Q278: 已到 | R278: 3.75年 | S278: 1.75年 | T278: 8.05 | U278: 52 | V278: 4.8000000000000001e-002 | W278: 0.183 | X278: 0.20399999999999999 | Y278: 44 | Z278: 1.7 | AA278: -3.9699999999999999e-002 | AB278: -4.6100000000000002e-002 | AC278: -0.10400000000000001 | AD278: -0.106 | AE278: 95.75 | AF278: 99.63 | AG278: 0.64 | AH278: AA | AI278: 3.7999999999999999e-002 | AJ278: =H278+100*O278 -> 152.02000000000001 | AK278: 154.2 | AL278: 82 | AM278: 54.5 | AN278: 70 | AO278: -0.10400000000000001 | AP278: 35 | AQ278: 白电转债
A279: 278 | B279: 123035 | C279: 利德转债!! | D279: 300296 | E279: 利亚德 | F279: 电子 | G279: LED制 | H279: 150.831 | I279: -1.4499999999999999e-002 | J279: 1.e-004 | K279: 8.93 | L279: -1.8700000000000001e-002 | M279: 114.3 | N279: 6.96 | O279: 0.17600000000000002 | P279: 128.3 | Q279: 已到 | R279: 3.75年 | S279: 1.75年 | T279: 7.99 | U279: 31 | V279: 2.6000000000000002e-002 | W279: 3.5000000000000003e-002 | X279: 4.4999999999999998e-002 | Y279: 227 | Z279: 2.96 | AA279: -7.2400000000000006e-002 | AB279: -7.8600000000000003e-002 | AC279: -0.14899999999999999 | AD279: -0.14999999999999999 | AE279: 96.64 | AF279: 101.43 | AG279: 0.77 | AH279: AA+ | AI279: 3.3000000000000002e-002 | AJ279: =H279+100*O279 -> 168.43099999999998 | AK279: 173.4 | AL279: 259 | AM279: 71.9 | AN279: 200 | AO279: -0.10099999999999999 | AP279: 13 | AQ279: 利德转债!!
A280: 279 | B280: 110061 | C280: 川投转债! | D280: 600674 | E280: 川投能源 | F280: 能源电力 | G280: 水电 | H280: 152.27 | I280: -3.3e-003 | J280: -7.000000000000001e-004 | K280: 12.13 | L280: -4.8999999999999998e-003 | M280: 110.3 | N280: 9.2 | O280: 0.155 | P280: 131.85 | Q280: 已到 | R280: 3.74年 | S280: 1.74年 | T280: 39.6 | U280: 41 | V280: 6.9999999999999993e-003 | W280: 7.400000000000001e-002 | X280: 9.8000000000000004e-002 | Y280: 534 | Z280: 1.74 | AA280: -8.3900000000000002e-002 | AB280: -8.8300000000000003e-002 | AC280: -0.153 | AD280: -0.154 | AE280: 97.02 | AF280: 98.61 | AG280: 0.83 | AH280: AAA | AI280: 3.1e-002 | AJ280: =H280+100*O280 -> 167.77000000000001 | AK280: 172.7 | AL280: 255 | AM280: 74.1 | AN280: 216 | AO280: 4.5999999999999999e-002 | AP280: 12 | AQ280: 川投转债!
A281: 280 | B281: 123034 | C281: 通光转债! | D281: 300265 | E281: 通光线缆 | F281: 通信互联 | G281: 通信设备 | H281: 198.699 | I281: -1.5e-003 | J281: -2.2499999999999999e-002 | K281: 9.86 | L281: -3.1400000000000004e-002 | M281: 117.3 | N281: 7.95 | O281: 0.60199999999999998 | P281: 124.03 | Q281: 已到 | R281: 3.72年 | S281: 1.72年 | T281: 0.78 | U281: 36 | V281: 0.23399999999999999 | W281: 2.2000000000000002e-002 | X281: 2.7000000000000003e-002 | Y281: 36 | Z281: 2.77 | AA281: -0.13400000000000001 | AB281: -0.14099999999999999 | AC281: -0.23100000000000001 | AD281: -0.23300000000000001 | AE281: 90.55 | AF281: 91.62 | AG281: 0.76 | AH281: A+ | AI281: 7.0000000000000007e-002 | AJ281: =H281+100*O281 -> 258.899 | AK281: 273.4 | AL281: 366 | AM281: 181.8 | AN281: 367 | AO281: -4.9000000000000002e-002 | AP281: 16 | AQ281: 通光转债!
A282: 281 | B282: 113548 | C282: 石英转债! | D282: 603688 | E282: 石英股份 | F282: 电子 | G282: 电子产品 | H282: 376.57 | I282: -1.6399999999999998e-002 | J282: -1.95e-002 | K282: 48.22 | L282: -3.6600000000000001e-002 | M282: 123.7 | N282: 14.93 | O282: 0.16600000000000001 | P282: 322.97 | Q282: 已到 | R282: 3.70年 | S282: 1.70年 | T282: 1.2 | U282: 107 | V282: 0.23499999999999999 | W282: 6.9999999999999993e-003 | X282: 2.3e-002 | Y282: 170 | Z282: 8.29 | AA282: -0.26300000000000001 | AB282: -0.27000000000000002 | AC282: -0.35299999999999998 | AD282: -0.35399999999999998 | AE282: 93.17 | AF282: 100.53 | AG282: 0.98 | AH282: AA- | AI282: 5.9000000000000004e-002 | AJ282: =H282+100*O282 -> 393.17000000000002 | AK282: 430.2 | AL282: 380 | AM282: 329.6 | AN282: 380 | AO282: -0.124 | AP282: 12 | AQ282: 石英转债!
A283: 282 | B283: 110060 | C283: 天路转债! | D283: 600326 | E283: 西藏天路 | F283: 建筑 | G283: 水泥 | H283: 125.68 | I283: -1.03e-002 | J283: 5.1999999999999998e-003 | K283: 6.56 | L283: -1.2e-002 | M283: 114.3 | N283: 7.08 | O283: 0.35600000000000004 | P283: 92.66 | Q283: 已到 | R283: 3.70年 | S283: 1.70年 | T283: 7.06 | U283: 10 | V283: 1.1000000000000001e-002 | W283: 0.11699999999999999 | X283: 0.109 | Y283: 60 | Z283: 1.41 | AA283: -2.58e-002 | AB283: -3.2400000000000005e-002 | AC283: -0.10199999999999999 | AD283: -0.105 | AE283: 95.92 | AF283: 99.82 | AG283: 0.42 | AH283: AA | AI283: 3.7999999999999999e-002 | AJ283: =H283+100*O283 -> 161.28 | AK283: 158.7 | AL283: 126 | AM283: 58.9 | AN283: 98 | AO283: 1.e-002 | AP283: 12 | AQ283: 天路转债!
A284: 283 | B284: 110059 | C284: 浦发转债! | D284: 600000 | E284: 浦发银行 | F284: 金融 | G284: 银行行业 | H284: 106.98 | I284: -3.2000000000000002e-003 | J284: 3.5999999999999999e-003 | K284: 8.74 | L284: 5.7999999999999996e-003 | M284: 116.8 | N284: 13.97 | O284: 0.70999999999999996 | P284: 62.56 | Q284: 已到 | R284: 3.70年 | S284: 无权 | T284: 500 | U284: 402 | V284: 6.9999999999999993e-003 | W284: 0.19500000000000001 | X284: 0.122 | Y284: 2565. | Z284: 0.47 | AA284: 2.4700000000000003e-002 | AB284: 1.6299999999999999e-002 | AC284: 无权 | AD284: 无权 | AE284: 无权 | AF284: 104.65 | AG284: 0.07 | AH284: AAA | AI284: 3.1e-002 | AJ284: =H284+100*O284 -> 177.98000000000002 | AK284: 151.4 | AL284: 63 | AM284: 46.8 | AN284: 35 | AO284: 1.2e-002 | AP284: 55 | AQ284: 浦发转债!
A285: 284 | B285: 127014 | C285: 北方转债! | D285: 65 | E285: 北方国际 | F285: 建筑 | G285: 建筑工程 | H285: 126.795 | I285: 4.6999999999999993e-003 | J285: -1.1299999999999999e-002 | K285: 8.45 | L285: -1.3999999999999999e-002 | M285: 114.3 | N285: 8.65 | O285: 0.29799999999999999 | P285: 97.69 | Q285: 已到 | R285: 3.69年 | S285: 1.69年 | T285: 5.35 | U285: 25 | V285: 3.7999999999999999e-002 | W285: 8.199999999999999e-002 | X285: 8.0000000000000002e-002 | Y285: 65 | Z285: 1.09 | AA285: -2.8199999999999999e-002 | AB285: -3.4799999999999998e-002 | AC285: -0.107 | AD285: -0.11 | AE285: 96.82 | AF285: 101.62 | AG285: 0.47 | AH285: AA+ | AI285: 3.3000000000000002e-002 | AJ285: =H285+100*O285 -> 156.595 | AK285: 155.9 | AL285: 99 | AM285: 54.3 | AN285: 69 | AO285: 2.4e-002 | AP285: 17 | AQ285: 北方转债!
A286: 285 | B286: 113546 | C286: 迪贝转债! | D286: 603320 | E286: 迪贝电气 | F286: 家电 | G286: 零部件制 | H286: 123.64 | I286: -6.7000000000000002e-003 | J286: 7.000000000000001e-004 | K286: 12.73 | L286: -1.24e-002 | M286: 119.8 | N286: 14 | O286: 0.35999999999999999 | P286: 90.93 | Q286: 已到 | R286: 3.69年 | S286: 1.69年 | T286: 2.3 | U286: 4 | V286: 1.3999999999999999e-002 | W286: 0.13900000000000001 | X286: 0.126 | Y286: 17 | Z286: 2.28 | AA286: -8.6999999999999994e-003 | AB286: -1.78e-002 | AC286: -9.3800000000000008e-002 | AD286: -9.6600000000000005e-002 | AE286: 91.06 | AF286: 93.83 | AG286: 0.49 | AH286: A+ | AI286: 7.0000000000000007e-002 | AJ286: =H286+100*O286 -> 159.63999999999999 | AK286: 156.4 | AL286: 103 | AM286: 62.5 | AN286: 125 | AO286: -3.1e-002 | AP286: 37 | AQ286: 迪贝转债!
A287: 286 | B287: 128079 | C287: 英联转债! | D287: 2846 | E287: 英联股份 | F287: 造纸包装 | G287: 包装材料 | H287: 124.1 | I287: -7.4000000000000003e-003 | J287: -7.000000000000001e-004 | K287: 7.18 | L287: -1.6399999999999998e-002 | M287: 116.9 | N287: 8.29 | O287: 0.433 | P287: 86.61 | Q287: 已到 | R287: 3.68年 | S287: 1.68年 | T287: 1.52 | U287: 5.8 | V287: 2.9999999999999999e-002 | W287: 6.6000000000000003e-002 | X287: 5.7999999999999996e-002 | Y287: 23 | Z287: 2.83 | AA287: -1.6399999999999998e-002 | AB287: -2.4300000000000002e-002 | AC287: -9.6099999999999991e-002 | AD287: -9.8900000000000002e-002 | AE287: 91.02 | AF287: 91.59 | AG287: 0.5 | AH287: A+ | AI287: 7.0000000000000007e-002 | AJ287: =H287+100*O287 -> 167.39999999999998 | AK287: 161.6 | AL287: 156 | AM287: 70 | AN287: 183 | AO287: -5.0999999999999997e-002 | AP287: 15 | AQ287: 英联转债!
A288: 287 | B288: 128078 | C288: 太极转债! | D288: 2368 | E288: 太极股份 | F288: 计算机及 | G288: 软件开发 | H288: 151.5 | I288: -1.43e-002 | J288: 8.6e-003 | K288: 24.92 | L288: -9.1000000000000004e-003 | M288: 116.3 | N288: 22.21 | O288: 0.34999999999999998 | P288: 112.2 | Q288: 已到 | R288: 3.68年 | S288: 1.68年 | T288: 9.6 | U288: 16 | V288: 1.1000000000000001e-002 | W288: 6.6000000000000003e-002 | X288: 7.4999999999999997e-002 | Y288: 144 | Z288: 4.37 | AA288: -7.0400000000000004e-002 | AB288: -7.7399999999999997e-002 | AC288: -0.157 | AD288: -0.159 | AE288: 95.99 | AF288: 101.63 | AG288: 0.63 | AH288: AA | AI288: 3.7999999999999999e-002 | AJ288: =H288+100*O288 -> 186.5 | AK288: 190.8 | AL288: 317 | AM288: 89.2 | AN288: 297 | AO288: -5.9999999999999998e-002 | AP288: 9 | AQ288: 太极转债!
A289: 288 | B289: 128076 | C289: 金轮转债! | D289: 2722 | E289: 金轮股份 | F289: 机械装备 | G289: 专用设备 | H289: 130.629 | I289: -4.5999999999999999e-003 | J289: -4.0000000000000002e-004 | K289: 15.7 | L289: -7.6e-003 | M289: 114.3 | N289: 14.66 | O289: 0.22 | P289: 107.09 | Q289: 已到 | R289: 3.67年 | S289: 1.67年 | T289: 2.14 | U289: 7.2 | V289: 2.6000000000000002e-002 | W289: 7.8e-002 | X289: 8.3000000000000004e-002 | Y289: 28 | Z289: 1.41 | AA289: -3.6400000000000002e-002 | AB289: -4.2999999999999997e-002 | AC289: -0.10400000000000001 | AD289: -0.106 | AE289: 92.62 | AF289: 93.02 | AG289: 0.65 | AH289: AA- | AI289: 5.9000000000000004e-002 | AJ289: =H289+100*O289 -> 152.62899999999999 | AK289: 154.2 | AL289: 81 | AM289: 61.1 | AN289: 116 | AO289: -1.e-002 | AP289: 37 | AQ289: 金轮转债!
A290: 289 | B290: 113545 | C290: 金能转债! | D290: 603113 | E290: 金能科技 | F290: 煤炭 | G290: 炼焦 | H290: 169.38 | I290: -3.2000000000000002e-003 | J290: -8.0000000000000004e-004 | K290: 14.85 | L290: -4.6999999999999993e-003 | M290: 114.3 | N290: 10.43 | O290: 0.19 | P290: 142.38 | Q290: 已到 | R290: 3.67年 | S290: 1.67年 | T290: 9.87 | U290: 38 | V290: 2.2000000000000002e-002 | W290: 7.8e-002 | X290: 0.111 | Y290: 127 | Z290: 1.45 | AA290: -0.10300000000000001 | AB290: -0.109 | AC290: -0.19500000000000001 | AD290: -0.19699999999999998 | AE290: 96.06 | AF290: 99.96 | AG290: 0.85 | AH290: AA | AI290: 3.7999999999999999e-002 | AJ290: =H290+100*O290 -> 188.38 | AK290: 196.4 | AL290: 329 | AM290: 96.4 | AN290: 315 | AO290: -1.1000000000000001e-002 | AP290: 12 | AQ290: 金能转债!
A291: 290 | B291: 128074 | C291: 游族转债!! | D291: 2174 | E291: 游族网络 | F291: 通信互联 | G291: 互联网 | H291: 118.2 | I291: -4.5999999999999999e-003 | J291: 1.e-003 | K291: 12.45 | L291: -1.9699999999999999e-002 | M291: 119.3 | N291: 16.97 | O291: 0.61099999999999999 | P291: 73.36 | Q291: 已到 | R291: 3.61年 | S291: 1.61年 | T291: 6.83 | U291: 6.7 | V291: 8.0000000000000002e-003 | W291: 5.9999999999999998e-002 | X291: 4.4000000000000004e-002 | Y291: 114 | Z291: 2.18 | AA291: 2.5999999999999999e-003 | AB291: -6.6e-003 | AC291: -7.6200000000000004e-002 | AD291: -7.8899999999999998e-002 | AE291: 96.27 | AF291: 99.26 | AG291: 0.18 | AH291: AA | AI291: 3.7999999999999999e-002 | AJ291: =H291+100*O291 -> 179.30000000000001 | AK291: 163 | AL291: 172 | AM291: 63.8 | AN291: 135 | AO291: -6.7000000000000004e-002 | AP291: 30 | AQ291: 游族转债!!
A292: 291 | B292: 128075 | C292: 远东转债! | D292: 2406 | E292: 远东传动 | F292: 汽车 | G292: 零部件制 | H292: 128.012 | I292: -5.1000000000000004e-003 | J292: -4.3e-003 | K292: 5.74 | L292: -1.54e-002 | M292: 114.3 | N292: 5.29 | O292: 0.17999999999999999 | P292: 108.51 | Q292: 已到 | R292: 3.61年 | S292: 1.61年 | T292: 5.44 | U292: 9.9 | V292: 1.3999999999999999e-002 | W292: 0.152 | X292: 0.16500000000000001 | Y292: 36 | Z292: 1.1 | AA292: -3.15e-002 | AB292: -3.8300000000000001e-002 | AC292: -0.10000000000000001 | AD292: -0.10199999999999999 | AE292: 96.27 | AF292: 100.17 | AG292: 0.6 | AH292: AA | AI292: 3.7999999999999999e-002 | AJ292: =H292+100*O292 -> 146.012 | AK292: 147.5 | AL292: 41 | AM292: 47.3 | AN292: 38 | AO292: -3.5000000000000003e-002 | AP292: 17 | AQ292: 远东转债!
A293: 292 | B293: 123031 | C293: 晶瑞转债! | D293: 300655 | E293: 晶瑞电材 | F293: 电子 | G293: 电子行业 | H293: 387.594 | I293: -1.1399999999999999e-002 | J293: -2.2000000000000002e-002 | K293: 33.62 | L293: -3.39e-002 | M293: 115.3 | N293: 10.66 | O293: 0.22899999999999998 | P293: 315.38 | Q293: 已到 | R293: 3.54年 | S293: 1.54年 | T293: 0.53 | U293: 42 | V293: 0.20199999999999999 | W293: 5.0000000000000001e-003 | X293: 1.3999999999999999e-002 | Y293: 116 | Z293: 7.89 | AA293: -0.29299999999999998 | AB293: -0.29799999999999999 | AC293: -0.40000000000000002 | AD293: -0.40100000000000002 | AE293: 91.68 | AF293: 91.19 | AG293: 0.99 | AH293: A+ | AI293: 7.0000000000000007e-002 | AJ293: =H293+100*O293 -> 410.49399999999997 | AK293: 459.8 | AL293: 381 | AM293: 368.1 | AN293: 381 | AO293: -8.0000000000000002e-002 | AP293: 15 | AQ293: 晶瑞转债!
A294: 293 | B294: 128073 | C294: 哈尔转债! | D294: 2615 | E294: 哈尔斯 | F294: 其他 | G294: 家居用品 | H294: 125.7 | I294: -1.6000000000000001e-003 | J294: -2.5000000000000001e-003 | K294: 5.6 | L294: -8.8000000000000005e-003 | M294: 114.5 | N294: 5.7 | O294: 0.27899999999999997 | P294: 98.25 | Q294: 已到 | R294: 2.52年 | S294: 0.52年 | T294: 2.99 | U294: 9.9 | V294: 2.6000000000000002e-002 | W294: 0.129 | X294: 0.127 | Y294: 23 | Z294: 2.69 | AA294: -3.6799999999999999e-002 | AB294: -4.6500000000000007e-002 | AC294: -0.29399999999999998 | AD294: -0.29600000000000004 | AE294: 97.44 | AF294: 99.63 | AG294: 0.46 | AH294: AA- | AI294: 5.7500000000000002e-002 | AJ294: =H294+100*O294 -> 153.59999999999999 | AK294: 153.2 | AL294: 76 | AM294: 53.5 | AN294: 62 | AO294: -5.0000000000000001e-003 | AP294: 36 | AQ294: 哈尔转债!
A295: 294 | B295: 128072 | C295: 翔鹭转债! | D295: 2842 | E295: 翔鹭钨业 | F295: 有色金属 | G295: 小金属 | H295: 113.397 | I295: 1.7000000000000001e-003 | J295: -4.3e-003 | K295: 9.34 | L295: -1.6799999999999999e-002 | M295: 114.5 | N295: 15.19 | O295: 0.84400000000000008 | P295: 61.49 | Q295: 已到 | R295: 3.52年 | S295: 1.52年 | T295: 3.02 | U295: 5.7 | V295: 1.7000000000000001e-002 | W295: 0.11599999999999999 | X295: 7.2000000000000008e-002 | Y295: 26 | Z295: 2.67 | AA295: 2.8000000000000004e-003 | AB295: -4.5999999999999999e-003 | AC295: -5.6900000000000006e-002 | AD295: -5.9999999999999998e-002 | AE295: 93.46 | AF295: 94 | AG295: 0.15 | AH295: AA- | AI295: 5.9000000000000004e-002 | AJ295: =H295+100*O295 -> 197.79700000000003 | AK295: 165.3 | AL295: 192 | AM295: 71.3 | AN295: 196 | AO295: -5.0000000000000001e-003 | AP295: 29 | AQ295: 翔鹭转债!
A296: 295 | B296: 128071 | C296: 合兴转债! | D296: 2228 | E296: 合兴包装 | F296: 造纸包装 | G296: 包装材料 | H296: 118.06 | I296: -1.3100000000000001e-002 | J296: 8.5000000000000006e-003 | K296: 3.59 | L296: -1.37e-002 | M296: 114.3 | N296: 4.18 | O296: 0.375 | P296: 85.89 | Q296: 已到 | R296: 3.50年 | S296: 1.50年 | T296: 3 | U296: 2.6 | V296: 6.9999999999999993e-003 | W296: 6.7000000000000004e-002 | X296: 5.7999999999999996e-002 | Y296: 44 | Z296: 1.32 | AA296: -9.3999999999999986e-003 | AB296: -1.66e-002 | AC296: -8.0100000000000005e-002 | AD296: -8.3000000000000004e-002 | AE296: 96.64 | AF296: 100.56 | AG296: 0.34 | AH296: AA | AI296: 3.7999999999999999e-002 | AJ296: =H296+100*O296 -> 155.56 | AK296: 150.2 | AL296: 55 | AM296: 49.7 | AN296: 45 | AO296: -1.4999999999999999e-002 | AP296: 25 | AQ296: 合兴转债!
A297: 296 | B297: 113542 | C297: 好客转债! | D297: 603898 | E297: 好莱客 | F297: 其他 | G297: 家居用品 | H297: 115.58 | I297: -5.1999999999999998e-003 | J297: 3.8e-003 | K297: 11.12 | L297: -9.7999999999999997e-003 | M297: 114.3 | N297: 16.14 | O297: 0.67799999999999994 | P297: 68.9 | Q297: 已到 | R297: 3.46年 | S297: 1.46年 | T297: 6.03 | U297: 14 | V297: 2.e-002 | W297: 0.17399999999999999 | X297: 0.12 | Y297: 35 | Z297: 1.28 | AA297: -3.3e-003 | AB297: -1.06e-002 | AC297: -6.9900000000000004e-002 | AD297: -7.2999999999999995e-002 | AE297: 96.79 | AF297: 100.72 | AG297: 0.14 | AH297: AA | AI297: 3.7999999999999999e-002 | AJ297: =H297+100*O297 -> 183.38 | AK297: 162.3 | AL297: 164 | AM297: 61.5 | AN297: 120 | AO297: -6.4000000000000001e-002 | AP297: 17 | AQ297: 好客转债!
A298: 297 | B298: 113541 | C298: 荣晟转债!! | D298: 603165 | E298: 荣晟环保 | F298: 造纸包装 | G298: 包装用纸 | H298: 155.31 | I298: -2.3999999999999998e-003 | J298: 3.4999999999999996e-003 | K298: 15.86 | L298: 1.2999999999999999e-003 | M298: 114.3 | N298: 10.84 | O298: 6.2e-002 | P298: 146.31 | Q298: 已到 | R298: 3.44年 | S298: 1.44年 | T298: 1.63 | U298: 24 | V298: 9.5000000000000001e-002 | W298: 3.9e-002 | X298: 5.7000000000000002e-002 | Y298: 42 | Z298: 2.41 | AA298: -8.6800000000000002e-002 | AB298: -9.3299999999999994e-002 | AC298: -0.19699999999999998 | AD298: -0.19899999999999998 | AE298: 93.84 | AF298: 94.24 | AG298: 0.87 | AH298: AA- | AI298: 5.9000000000000004e-002 | AJ298: =H298+100*O298 -> 161.50999999999999 | AK298: 164.3 | AL298: 179 | AM298: 70.1 | AN298: 184 | AO298: -5.9000000000000004e-002 | AP298: 39 | AQ298: 荣晟转债!!
A299: 298 | B299: 128070 | C299: 智能转债! | D299: 2877 | E299: 智能自控 | F299: 机械装备 | G299: 通用设备 | H299: 116.948 | I299: 1.e-003 | J299: -4.5000000000000005e-003 | K299: 6.62 | L299: -1.34e-002 | M299: 116.8 | N299: 9.47 | O299: 0.67299999999999993 | P299: 69.9 | Q299: 已到 | R299: 3.38年 | S299: 无权 | T299: 2.3 | U299: 15 | V299: 5.5e-002 | W299: 0.10400000000000001 | X299: 7.2999999999999995e-002 | Y299: 22 | Z299: 2.9 | AA299: -4.0000000000000002e-004 | AB299: -9.1000000000000004e-003 | AC299: 无权 | AD299: 无权 | AE299: 无权 | AF299: 93.43 | AG299: 0.26 | AH299: A+ | AI299: 7.0000000000000007e-002 | AJ299: =H299+100*O299 -> 184.24799999999999 | AK299: 164 | AL299: 176 | AM299: 70.6 | AN299: 188 | AO299: -3.2000000000000001e-002 | AP299: 28 | AQ299: 智能转债!
A300: 299 | B300: 128069 | C300: 华森转债! | D300: 2907 | E300: 华森制药 | F300: 医药 | G300: 化学制药 | H300: 118.81 | I300: -2.1099999999999997e-002 | J300: 1.8e-003 | K300: 13.61 | L300: -8.1000000000000003e-002 | M300: 119.3 | N300: 18.01 | O300: 0.57200000000000006 | P300: 75.57 | Q300: 已到 | R300: 3.36年 | S300: 1.36年 | T300: 3 | U300: 18 | V300: 5.0000000000000003e-002 | W300: 5.5e-002 | X300: 4.0999999999999995e-002 | Y300: 55 | Z300: 4.61 | AA300: 1.2999999999999999e-003 | AB300: -8.6999999999999994e-003 | AC300: -9.1300000000000006e-002 | AD300: -9.4399999999999998e-002 | AE300: 94.27 | AF300: 98.8 | AG300: 0.24 | AH300: AA- | AI300: 5.9000000000000004e-002 | AJ300: =H300+100*O300 -> 176.00999999999999 | AK300: 162.1 | AL300: 160 | AM300: 63.3 | AN300: 133 | AO300: -0.159 | AP300: 43 | AQ300: 华森转债!
A301: 300 | B301: 113027 | C301: 华钰转债!! | D301: 601020 | E301: ST华钰 | F301: 有色金属 | G301: 锌铅镍锡 | H301: 141.63 | I301: 1.2e-002 | J301: 4.6999999999999993e-003 | K301: 12.97 | L301: 2.0499999999999997e-002 | M301: 114.3 | N301: 10.17 | O301: 0.111 | P301: 127.53 | Q301: 已到 | R301: 3.33年 | S301: 1.33年 | T301: 3.1 | U301: 443 | V301: 1.01 | W301: 4.2999999999999997e-002 | X301: 5.5e-002 | Y301: 72 | Z301: 2.77 | AA301: -6.3500000000000001e-002 | AB301: -7.0499999999999993e-002 | AC301: -0.17300000000000001 | AD301: -0.17600000000000002 | AE301: 91.71 | AF301: 88.95 | AG301: 0.81 | AH301: A | AI301: 8.0000000000000002e-002 | AJ301: =H301+100*O301 -> 152.72999999999999 | AK301: 155.7 | AL301: 98 | AM301: 64 | AN301: 137 | AO301: 7.8e-002 | AP301: 41 | AQ301: 华钰转债!!
A302: 301 | B302: 123027 | C302: 蓝晓转债! | D302: 300487 | E302: 蓝晓科技 | F302: 化工 | G302: 化工 | H302: 360.49 | I302: 1.5600000000000001e-002 | J302: -2.1400000000000002e-002 | K302: 90.4 | L302: -5.7999999999999996e-003 | M302: 118.8 | N302: 29.02 | O302: 0.157 | P302: 311.51 | Q302: 已到 | R302: 3.32年 | S302: 1.32年 | T302: 1.07 | U302: 607 | V302: 1.5600000000000001 | W302: 5.0000000000000001e-003 | X302: 1.7000000000000001e-002 | Y302: 199 | Z302: 10.04 | AA302: -0.28899999999999998 | AB302: -0.29499999999999998 | AC302: -0.45500000000000002 | AD302: -0.45600000000000002 | AE302: 93.89 | AF302: 95.48 | AG302: 0.98 | AH302: A+ | AI302: 7.0000000000000007e-002 | AJ302: =H302+100*O302 -> 376.19 | AK302: 409.5 | AL302: 378 | AM302: 314 | AN302: 378 | AO302: -8.1000000000000003e-002 | AP302: 16 | AQ302: 蓝晓转债!
A303: 302 | B303: 113537 | C303: 文灿转债!! | D303: 603348 | E303: 文灿股份 | F303: 汽车 | G303: 零部件制 | H303: 274.36 | I303: -5.7999999999999996e-003 | J303: -6.0000000000000001e-003 | K303: 44.16 | L303: -1.21e-002 | M303: 120.7 | N303: 19.28 | O303: 0.19800000000000001 | P303: 229.05 | Q303: 已到 | R303: 3.32年 | S303: 1.32年 | T303: 1.41 | U303: 239 | V303: 0.61499999999999999 | W303: 1.2e-002 | X303: 2.7999999999999997e-002 | Y303: 116 | Z303: 4.41 | AA303: -0.223 | AB303: -0.23100000000000001 | AC303: -0.39899999999999997 | AD303: -0.40000000000000002 | AE303: 95.24 | AF303: 100.29 | AG303: 0.97 | AH303: AA- | AI303: 5.9000000000000004e-002 | AJ303: =H303+100*O303 -> 294.16000000000003 | AK303: 319.7 | AL303: 372 | AM303: 219.4 | AN303: 372 | AO303: -0.185 | AP303: 22 | AQ303: 文灿转债!!
A304: 303 | B304: 113535 | C304: 大业转债! | D304: 603278 | E304: 大业股份 | F304: 汽车 | G304: 零部件制 | H304: 119 | I304: -1.21e-002 | J304: 6.1999999999999998e-003 | K304: 9.98 | L304: -3.1099999999999999e-002 | M304: 112.5 | N304: 12.29 | O304: 0.46500000000000002 | P304: 81.2 | Q304: 已到 | R304: 2.23年 | S304: 0.23年 | T304: 5 | U304: 7.4 | V304: 1.2e-002 | W304: 0.17300000000000001 | X304: 0.14000000000000001 | Y304: 29 | Z304: 1.62 | AA304: -2.52e-002 | AB304: -3.5000000000000003e-002 | AC304: -0.39899999999999997 | AD304: -0.40500000000000003 | AE304: 99.82 | AF304: 103.96 | AG304: 0.19 | AH304: AA | AI304: 3.6499999999999998e-002 | AJ304: =H304+100*O304 -> 165.5 | AK304: 156.8 | AL304: 107 | AM304: 52.8 | AN304: 55 | AO304: -0.122 | AP304: 46 | AQ304: 大业转债!
A305: 304 | B305: 128066 | C305: 亚泰转债! | D305: 2811 | E305: 郑中设计 | F305: 建筑 | G305: 装饰工程 | H305: 119.693 | I305: -5.8999999999999999e-003 | J305: -5.0000000000000001e-004 | K305: 8.82 | L305: -1.34e-002 | M305: 116.7 | N305: 9.27 | O305: 0.25800000000000001 | P305: 95.15 | Q305: 已到 | R305: 3.17年 | S305: 1.17年 | T305: 4.8 | U305: 13 | V305: 2.2000000000000002e-002 | W305: 0.20100000000000001 | X305: 0.192 | Y305: 24 | Z305: 1.71 | AA305: -8.1000000000000013e-003 | AB305: -1.7299999999999999e-002 | AC305: -0.10000000000000001 | AD305: -0.10400000000000001 | AE305: 95.51 | AF305: 97.73 | AG305: 0.48 | AH305: AA- | AI305: 5.9000000000000004e-002 | AJ305: =H305+100*O305 -> 145.49299999999999 | AK305: 144.2 | AL305: 28 | AM305: 46.5 | AN305: 34 | AO305: 1.e-003 | AP305: 67 | AQ305: 亚泰转债!
A306: 305 | B306: 110058 | C306: 永鼎转债! | D306: 600105 | E306: 永鼎股份 | F306: 通信互联 | G306: 通信设备 | H306: 121.68 | I306: -1.1899999999999999e-002 | J306: -2.e-003 | K306: 4.3 | L306: -3.5900000000000001e-002 | M306: 114.3 | N306: 5.04 | O306: 0.42599999999999999 | P306: 85.32 | Q306: 已到 | R306: 3.17年 | S306: 1.17年 | T306: 2.61 | U306: 13 | V306: 4.0000000000000001e-002 | W306: 4.2999999999999997e-002 | X306: 3.7000000000000005e-002 | Y306: 61 | Z306: 2.12 | AA306: -2.e-002 | AB306: -2.7799999999999998e-002 | AC306: -0.11199999999999999 | AD306: -0.115 | AE306: 95.3 | AF306: 95.7 | AG306: 0.39 | AH306: AA- | AI306: 5.9000000000000004e-002 | AJ306: =H306+100*O306 -> 164.28 | AK306: 158 | AL306: 119 | AM306: 62.3 | AN306: 124 | AO306: -9.4e-002 | AP306: 44 | AQ306: 永鼎转债!
A307: 306 | B307: 127013 | C307: 创维转债! | D307: 810 | E307: 创维数字 | F307: 电子 | G307: 电子产品 | H307: 132.5 | I307: -3.61e-002 | J307: 1.21e-002 | K307: 12.18 | L307: -4.4000000000000004e-002 | M307: 117.3 | N307: 11.29 | O307: 0.22800000000000001 | P307: 107.88 | Q307: 已到 | R307: 3.17年 | S307: 1.17年 | T307: 9.78 | U307: 154 | V307: 0.11699999999999999 | W307: 7.4999999999999997e-002 | X307: 8.1000000000000003e-002 | Y307: 130 | Z307: 3.06 | AA307: -3.85e-002 | AB307: -4.7599999999999996e-002 | AC307: -0.16200000000000001 | AD307: -0.16500000000000001 | AE307: 97.86 | AF307: 104.5 | AG307: 0.55 | AH307: AA | AI307: 3.7999999999999999e-002 | AJ307: =H307+100*O307 -> 155.30000000000001 | AK307: 157.1 | AL307: 109 | AM307: 52.6 | AN307: 52 | AO307: -4.5999999999999999e-002 | AP307: 25 | AQ307: 创维转债!
A308: 307 | B308: 113026 | C308: 核能转债!!* | D308: 601985 | E308: 中国核电 | F308: 能源电力 | G308: 核电 | H308: 133.97 | I308: -7.4999999999999997e-003 | J308: -2.9999999999999997e-004 | K308: 7.69 | L308: -7.7000000000000002e-003 | M308: 109.3 | N308: 5.73 | O308: -2.e-003 | P308: 134.21 | Q308: 已到 | R308: 24天 | S308: 无权 | T308: 50 | U308: 294 | V308: 4.4000000000000004e-002 | W308: 3.7000000000000005e-002 | X308: 5.0000000000000003e-002 | Y308: 1347. | Z308: 2.09 | AA308: <-100% | AB308: <-100% | AC308: 无权 | AD308: 无权 | AE308: 无权 | AF308: 100.76 | AG308: 1 | AH308: AAA | AI308: 2.1899999999999999e-002 | AJ308: =H308+100*O308 -> 133.77000000000001 | AK308: 133.7 | AL308: 5 | AM308: 33 | AN308: 7 | AO308: 4.2000000000000003e-002 | AP308: 37 | AQ308: 核能转债!!*
A309: 308 | B309: 113025 | C309: 明泰转债!! | D309: 601677 | E309: 明泰铝业 | F309: 有色金属 | G309: 铝金属 | H309: 455.98 | I309: 3.0899999999999997e-002 | J309: 3.44e-002 | K309: 45.71 | L309: 6.6000000000000003e-002 | M309: 114.5 | N309: 11 | O309: 9.6999999999999989e-002 | P309: 415.55 | Q309: 已到 | R309: 3年56天 | S309: 1年56天 | T309: 11 | U309: 879 | V309: 0.17199999999999999 | W309: 3.5000000000000003e-002 | X309: 0.14599999999999999 | Y309: 312 | Z309: 3.1 | AA309: -0.35899999999999999 | AB309: -0.36299999999999999 | AC309: -0.56899999999999995 | AD309: -0.56899999999999995 | AE309: 97.94 | AF309: 102.07 | AG309: 0.99 | AH309: AA | AI309: 3.7999999999999999e-002 | AJ309: =H309+100*O309 -> 465.68000000000001 | AK309: 496.4 | AL309: 382 | AM309: 394.3 | AN309: 382 | AO309: 0.10000000000000001 | AP309: 17 | AQ309: 明泰转债!!
A310: 309 | B310: 113534 | C310: 鼎胜转债!! | D310: 603876 | E310: 鼎胜新材 | F310: 有色金属 | G310: 小金属 | H310: 252.81 | I310: -1.4499999999999999e-002 | J310: -9.5999999999999992e-003 | K310: 33.65 | L310: -2.46e-002 | M310: 114.3 | N310: 15.18 | O310: 0.14000000000000001 | P310: 221.67 | Q310: 已到 | R310: 3年55天 | S310: 1年55天 | T310: 4.04 | U310: 137 | V310: 0.13300000000000001 | W310: 2.5000000000000001e-002 | X310: 5.5e-002 | Y310: 164 | Z310: 3.49 | AA310: -0.22600000000000001 | AB310: -0.23199999999999998 | AC310: -0.43700000000000006 | AD310: -0.439 | AE310: 95.4 | AF310: 95.81 | AG310: 0.98 | AH310: AA- | AI310: 5.9000000000000004e-002 | AJ310: =H310+100*O310 -> 266.81 | AK310: 283.9 | AL310: 368 | AM310: 188.1 | AN310: 368 | AO310: -6.7000000000000004e-002 | AP310: 27 | AQ310: 鼎胜转债!!
A311: 310 | B311: 113024 | C311: 核建转债! | D311: 601611 | E311: 中国核建 | F311: 建筑 | G311: 建筑工程 | H311: 128.52 | I311: -1.38e-002 | J311: 3.4999999999999996e-003 | K311: 9.21 | L311: -2.23e-002 | M311: 109.3 | N311: 9.7 | O311: 0.35399999999999998 | P311: 94.95 | Q311: 已到 | R311: 3年54天 | S311: 1年54天 | T311: 30 | U311: 55 | V311: 1.3999999999999999e-002 | W311: 0.12300000000000001 | X311: 0.11699999999999999 | Y311: 244 | Z311: 1.96 | AA311: -5.1200000000000002e-002 | AB311: -5.6299999999999996e-002 | AC311: -0.14699999999999999 | AD311: -0.14999999999999999 | AE311: 98.8 | AF311: 99.51 | AG311: 0.46 | AH311: AAA | AI311: 3.1e-002 | AJ311: =H311+100*O311 -> 163.92000000000002 | AK311: 162.1 | AL311: 161 | AM311: 62.6 | AN311: 126 | AO311: 1.2e-002 | AP311: 30 | AQ311: 核建转债!
A312: 311 | B312: 128063 | C312: 未来转债! | D312: 2631 | E312: 德尔未来 | F312: 其他 | G312: 家居用品 | H312: 120.688 | I312: 8.0000000000000004e-004 | J312: -5.1000000000000004e-003 | K312: 6.64 | L312: -2.2099999999999998e-002 | M312: 127.5 | N312: 8.64 | O312: 0.56999999999999995 | P312: 76.85 | Q312: 已到 | R312: 3年49天 | S312: 2年49天 | T312: 6.29 | U312: 3.5 | V312: 5.0000000000000001e-003 | W312: 0.14400000000000002 | X312: 0.111 | Y312: 44 | Z312: 2.55 | AA312: 1.83e-002 | AB312: 3.5999999999999999e-003 | AC312: -4.7599999999999996e-002 | AD312: -5.3800000000000001e-002 | AE312: 95.15 | AF312: 107.19 | AG312: 0.19 | AH312: AA- | AI312: 5.9000000000000004e-002 | AJ312: =H312+100*O312 -> 177.68799999999999 | AK312: 164.5 | AL312: 181 | AM312: 57.3 | AN312: 89 | AO312: -4.2999999999999997e-002 | AP312: 35 | AQ312: 未来转债!
A313: 312 | B313: 113532 | C313: 海环转债! | D313: 603817 | E313: 海峡环保 | F313: 城市公用 | G313: 三废处理 | H313: 120.16 | I313: -5.62e-002 | J313: 6.6799999999999998e-002 | K313: 6.97 | L313: 2.6499999999999999e-002 | M313: 112.3 | N313: 7.63 | O313: 0.315 | P313: 91.35 | Q313: 已到 | R313: 3年48天 | S313: 1年48天 | T313: 4.59 | U313: 883 | V313: 1.53 | W313: 0.14599999999999999 | X313: 0.13400000000000001 | Y313: 31 | Z313: 1.73 | AA313: -2.18e-002 | AB313: -2.8799999999999999e-002 | AC313: -0.10800000000000001 | AD313: -0.111 | AE313: 97.99 | AF313: 100.19 | AG313: 0.4 | AH313: AA | AI313: 3.7999999999999999e-002 | AJ313: =H313+100*O313 -> 151.66 | AK313: 149 | AL313: 49 | AM313: 48.8 | AN313: 39 | AO313: 0.124 | AP313: 34 | AQ313: 海环转债!
A314: 313 | B314: 128062 | C314: 亚药转债! | D314: 2370 | E314: 亚太药业 | F314: 医药 | G314: 化学制药 | H314: 102.049 | I314: -1.2999999999999999e-003 | J314: 1.1000000000000001e-003 | K314: 5.2 | L314: -5.45e-002 | M314: 119.3 | N314: 16.25 | O314: 2.1899999999999999 | P314: 32 | Q314: 已到 | R314: 3年48天 | S314: 1年48天 | T314: 9.62 | U314: 37 | V314: 3.7999999999999999e-002 | W314: 0.34499999999999997 | X314: 0.11 | Y314: 28 | Z314: 7.72 | AA314: 5.2300000000000006e-002 | AB314: 4.0899999999999999e-002 | AC314: 5.6999999999999993e-003 | AD314: 1.5e-003 | AE314: 84.04 | AF314: 73.86 | AG314: 0 | AH314: B | AI314: 0.17000000000000001 | AJ314: =H314+100*O314 -> 321.04899999999998 | AK314: 172.1 | AL314: 252 | AM314: 88.1 | AN314: 292 | AO314: -0.247 | AP314: 96 | AQ314: 亚药转债!
A315: 314 | B315: 110057 | C315: 现代转债 | D315: 600420 | E315: 国药现代 | F315: 医药 | G315: 化学制药 | H315: 119.58 | I315: -1.0800000000000001e-002 | J315: 6.0000000000000001e-003 | K315: 9.03 | L315: -1.2e-002 | M315: 110.3 | N315: 9.79 | O315: 0.29600000000000004 | P315: 92.24 | Q315: 已到 | R315: 3年47天 | S315: 1年47天 | T315: 16.2 | U315: 9.7 | V315: 5.0000000000000001e-003 | W315: 0.17399999999999999 | X315: 0.161 | Y315: 93 | Z315: 1.1 | AA315: -2.6099999999999998e-002 | AB315: -3.1899999999999998e-002 | AC315: -0.105 | AD315: -0.10800000000000001 | AE315: 98.86 | AF315: 100.48 | AG315: 0.4 | AH315: AAA | AI315: 3.1e-002 | AJ315: =H315+100*O315 -> 149.18000000000001 | AK315: 146.9 | AL315: 37 | AM315: 46.4 | AN315: 33 | AO315: -5.9999999999999998e-002 | AP315: 23 | AQ315: 现代转债
A316: 315 | B316: 123025 | C316: 精测转债!! | D316: 300567 | E316: 精测电子 | F316: 电子 | G316: 液晶显示 | H316: 141 | I316: -3.95e-002 | J316: 2.2400000000000003e-002 | K316: 50.85 | L316: -3.0299999999999997e-002 | M316: 116.5 | N316: 49.37 | O316: 0.36899999999999999 | P316: 103 | Q316: 已到 | R316: 3年44天 | S316: 1年44天 | T316: 3.09 | U316: 10 | V316: 2.3e-002 | W316: 2.2000000000000002e-002 | X316: 2.2000000000000002e-002 | Y316: 141 | Z316: 4.38 | AA316: -6.0499999999999998e-002 | AB316: -6.9099999999999995e-002 | AC316: -0.20499999999999999 | AD316: -0.20800000000000002 | AE316: 95.6 | AF316: 97.83 | AG316: 0.56 | AH316: AA- | AI316: 5.9000000000000004e-002 | AJ316: =H316+100*O316 -> 177.90000000000001 | AK316: 179 | AL316: 282 | AM316: 81.2 | AN316: 257 | AO316: -0.122 | AP316: 14 | AQ316: 精测转债!!
A317: 316 | B317: 113530 | C317: 大丰转债! | D317: 603081 | E317: 大丰实业 | F317: 建筑 | G317: 装饰工程 | H317: 119.96 | I317: -2.5000000000000001e-003 | J317: -2.8000000000000004e-003 | K317: 12.23 | L317: -4.1500000000000002e-002 | M317: 121 | N317: 16.3 | O317: 0.59899999999999998 | P317: 75.03 | Q317: 已到 | R317: 3年42天 | S317: 1年42天 | T317: 6.3 | U317: 12 | V317: 1.4999999999999999e-002 | W317: 0.126 | X317: 9.4e-002 | Y317: 50 | Z317: 2.1 | AA317: 2.8000000000000004e-003 | AB317: -8.6999999999999994e-003 | AC317: -0.10800000000000001 | AD317: -0.111 | AE317: 98.16 | AF317: 108.02 | AG317: 0.13 | AH317: AA | AI317: 3.7999999999999999e-002 | AJ317: =H317+100*O317 -> 179.85999999999999 | AK317: 164.9 | AL317: 183 | AM317: 56.9 | AN317: 82 | AO317: -5.2999999999999999e-002 | AP317: 30 | AQ317: 大丰转债!
A318: 317 | B318: 127012 | C318: 招路转债! | D318: 1965 | E318: 招商公路 | F318: 机场高速 | G318: 高速 | H318: 123.34 | I318: -2.1099999999999997e-002 | J318: 1.8500000000000003e-002 | K318: 8.86 | L318: -4.5000000000000005e-003 | M318: 107.9 | N318: 8.63 | O318: 0.20100000000000001 | P318: 102.67 | Q318: 已到 | R318: 3年37天 | S318: 1年37天 | T318: 50 | U318: 96 | V318: 1.4999999999999999e-002 | W318: 9.0999999999999998e-002 | X318: 9.4e-002 | Y318: 547 | Z318: 1.06 | AA318: -4.2800000000000005e-002 | AB318: -4.7300000000000002e-002 | AC318: -0.13500000000000001 | AD318: -0.13699999999999998 | AE318: 97.81 | AF318: 98.29 | AG318: 0.58 | AH318: AAA | AI318: 3.1e-002 | AJ318: =H318+100*O318 -> 143.44 | AK318: 144 | AL318: 25 | AM318: 45.7 | AN318: 32 | AO318: 8.8000000000000009e-002 | AP318: 26 | AQ318: 招路转债!
A319: 318 | B319: 123024 | C319: 岱勒转债!! | D319: 300700 | E319: 岱勒新材 | F319: 机械装备 | G319: 专用设备 | H319: 163.932 | I319: -4.6900000000000004e-002 | J319: 2.5000000000000001e-003 | K319: 22.07 | L319: -4.7500000000000001e-002 | M319: 112.5 | N319: 14.1 | O319: 4.7e-002 | P319: 156.52 | Q319: 已到 | R319: 2年36天 | S319: 36天 | T319: 2.1 | U319: 436 | V319: 1.25 | W319: 8.900000000000001e-002 | X319: 0.13900000000000001 | Y319: 24 | Z319: 4.99 | AA319: -0.16600000000000001 | AB319: -0.17499999999999999 | AC319: <-100% | AD319: <-100% | AE319: 99.5 | AF319: 98.11 | AG319: 0.94 | AH319: A+ | AI319: 6.8499999999999991e-002 | AJ319: =H319+100*O319 -> 168.63199999999998 | AK319: 171.3 | AL319: 243 | AM319: 71.8 | AN319: 199 | AO319: 0.16399999999999998 | AP319: 36 | AQ319: 岱勒转债!!
A320: 319 | B320: 123023 | C320: 迪森转债! | D320: 300335 | E320: 迪森股份 | F320: 能源电力 | G320: 电力供应 | H320: 114.133 | I320: -6.9999999999999993e-003 | J320: 5.0000000000000001e-003 | K320: 5.12 | L320: -7.8000000000000005e-003 | M320: 114.3 | N320: 6.89 | O320: 0.53600000000000003 | P320: 74.31 | Q320: 已到 | R320: 3年35天 | S320: 2年35天 | T320: 5.29 | U320: 21 | V320: 3.5000000000000003e-002 | W320: 0.27699999999999997 | X320: 0.20600000000000002 | Y320: 19 | Z320: 1.41 | AA320: 5.0000000000000001e-004 | AB320: -7.8000000000000005e-003 | AC320: -3.8300000000000001e-002 | AD320: -4.2000000000000003e-002 | AE320: 92.12 | AF320: 96.11 | AG320: 0.26 | AH320: AA- | AI320: 5.9000000000000004e-002 | AJ320: =H320+100*O320 -> 167.733 | AK320: 154 | AL320: 79 | AM320: 57.8 | AN320: 93 | AO320: -6.4000000000000001e-002 | AP320: 52 | AQ320: 迪森转债!
A321: 320 | B321: 110056 | C321: 亨通转债! | D321: 600487 | E321: 亨通光电 | F321: 通信互联 | G321: 通信设备 | H321: 133.85 | I321: 7.000000000000001e-004 | J321: -1.1599999999999999e-002 | K321: 13.75 | L321: -3.0299999999999997e-002 | M321: 114.3 | N321: 14.95 | O321: 0.45500000000000002 | P321: 91.97 | Q321: 已到 | R321: 3年34天 | S321: 1年34天 | T321: 17.1 | U321: 11 | V321: 5.0000000000000001e-003 | W321: 5.2999999999999999e-002 | X321: 4.8000000000000001e-002 | Y321: 325 | Z321: 1.58 | AA321: -5.0799999999999998e-002 | AB321: -5.8499999999999996e-002 | AC321: -0.17999999999999999 | AD321: -0.183 | AE321: 98.72 | AF321: 103.62 | AG321: 0.36 | AH321: AA+ | AI321: 3.3000000000000002e-002 | AJ321: =H321+100*O321 -> 179.34999999999999 | AK321: 175.7 | AL321: 268 | AM321: 72.1 | AN321: 203 | AO321: -5.9000000000000004e-002 | AP321: 23 | AQ321: 亨通转债!
A322: 321 | B322: 123022 | C322: 长信转债!! | D322: 300088 | E322: 长信科技 | F322: 通信互联 | G322: 通信设备 | H322: 207 | I322: -2.5899999999999999e-002 | J322: -2.8999999999999998e-002 | K322: 9.4 | L322: -5.9999999999999998e-002 | M322: 114.3 | N322: 6.05 | O322: 0.33200000000000002 | P322: 155.37 | Q322: 已到 | R322: 3年33天 | S322: 1年33天 | T322: 2.56 | U322: 137 | V322: 0.253 | W322: 1.1000000000000001e-002 | X322: 1.7000000000000001e-002 | Y322: 231 | Z322: 3.06 | AA322: -0.17800000000000002 | AB322: -0.184 | AC322: -0.39200000000000002 | AD322: -0.39299999999999996 | AE322: 98.14 | AF322: 102.13 | AG322: 0.91 | AH322: AA | AI322: 3.7999999999999999e-002 | AJ322: =H322+100*O322 -> 240.19999999999999 | AK322: 258.6 | AL322: 358 | AM322: 156.5 | AN322: 358 | AO322: -0.154 | AP322: 11 | AQ322: 长信转债!!
A323: 322 | B323: 110055 | C323: 伊力转债!! | D323: 600197 | E323: 伊力特 | F323: 食品饮料 | G323: 白酒 | H323: 189.96 | I323: 3.95e-002 | J323: -2.1299999999999999e-002 | K323: 23.44 | L323: 2.0899999999999998e-002 | M323: 114.3 | N323: 16.41 | O323: 0.33000000000000002 | P323: 142.84 | Q323: 已到 | R323: 3年30天 | S323: 1年30天 | T323: 2.44 | U323: 541 | V323: 1.1799999999999999 | W323: 2.2000000000000002e-002 | X323: 3.1e-002 | Y323: 111 | Z323: 3.07 | AA323: -0.155 | AB323: -0.161 | AC323: -0.35999999999999999 | AD323: -0.36200000000000004 | AE323: 98.17 | AF323: 102.16 | AG323: 0.87 | AH323: AA | AI323: 3.7999999999999999e-002 | AJ323: =H323+100*O323 -> 222.96000000000001 | AK323: 237.1 | AL323: 352 | AM323: 134.9 | AN323: 350 | AO323: -2.9999999999999999e-002 | AP323: 20 | AQ323: 伊力转债!!
A324: 323 | B324: 110053 | C324: 苏银转债! | D324: 600919 | E324: 江苏银行 | F324: 金融 | G324: 银行行业 | H324: 126.11 | I324: 5.1000000000000004e-003 | J324: 6.4000000000000003e-003 | K324: 7.05 | L324: 2.0299999999999999e-002 | M324: 118.3 | N324: 6.37 | O324: 0.13900000000000001 | P324: 110.68 | Q324: 已到 | R324: 3年29天 | S324: 无权 | T324: 200 | U324: 337 | V324: 1.3000000000000001e-002 | W324: 0.192 | X324: 0.21299999999999999 | Y324: 1041. | Z324: 0.71 | AA324: -2.1299999999999999e-002 | AB324: -3.1300000000000001e-002 | AC324: 无权 | AD324: 无权 | AE324: 无权 | AF324: 108.05 | AG324: 0.57 | AH324: AAA | AI324: 3.1e-002 | AJ324: =H324+100*O324 -> 140.00999999999999 | AK324: 141.5 | AL324: 17 | AM324: 33.5 | AN324: 8 | AO324: 5.7999999999999996e-002 | AP324: 33 | AQ324: 苏银转债!
A325: 324 | B325: 127011 | C325: 中鼎转2!!* | D325: 887 | E325: 中鼎股份 | F325: 汽车 | G325: 零部件制 | H325: 159.263 | I325: -5.7599999999999998e-002 | J325: 6.7000000000000002e-003 | K325: 18.28 | L325: -5.0900000000000001e-002 | M325: 114.5 | N325: 11.39 | O325: -8.0000000000000002e-003 | P325: 160.49 | Q325: 已到 | R325: 11天 | S325: 无权 | T325: 8.07 | U325: 266 | V325: 0.20100000000000001 | W325: 3.6000000000000004e-002 | X325: 5.9000000000000004e-002 | Y325: 221 | Z325: 2.42 | AA325: <-100% | AB325: <-100% | AC325: 无权 | AD325: 无权 | AE325: 无权 | AF325: 100.9 | AG325: 1 | AH325: AA+ | AI325: 2.3900000000000001e-002 | AJ325: =H325+100*O325 -> 158.46299999999999 | AK325: 158 | AL325: 118 | AM325: 57.1 | AN325: 87 | AO325: -0.16800000000000001 | AP325: 17 | AQ325: 中鼎转2!!*
A326: 325 | B326: 110052 | C326: 贵广转债! | D326: 600996 | E326: 贵广网络 | F326: 传媒娱乐 | G326: 影视娱乐 | H326: 125.5 | I326: 2.7900000000000001e-002 | J326: 1.0500000000000001e-002 | K326: 7.69 | L326: 0.10000000000000001 | M326: 117.7 | N326: 7.94 | O326: 0.29600000000000004 | P326: 96.85 | Q326: 已到 | R326: 3年20天 | S326: 1年20天 | T326: 15.3 | U326: 1136. | V326: 0.59599999999999997 | W326: 0.18899999999999997 | X326: 0.183 | Y326: 81 | Z326: 2.11 | AA326: -2.1299999999999999e-002 | AB326: -3.1099999999999999e-002 | AC326: -0.14400000000000002 | AD326: -0.14699999999999999 | AE326: 99.07 | AF326: 106.84 | AG326: 0.38 | AH326: AA+ | AI326: 3.3000000000000002e-002 | AJ326: =H326+100*O326 -> 155.09999999999999 | AK326: 154.1 | AL326: 80 | AM326: 47.3 | AN326: 37 | AO326: 0.16 | AP326: 33 | AQ326: 贵广转债!
A327: 326 | B327: 113021 | C327: 中信转债! | D327: 601998 | E327: 中信银行 | F327: 金融 | G327: 银行行业 | H327: 111.32 | I327: -4.3e-003 | J327: 4.7999999999999996e-003 | K327: 4.86 | L327: 4.0999999999999995e-003 | M327: 118 | N327: 6.73 | O327: 0.54200000000000004 | P327: 72.21 | Q327: 已到 | R327: 3年19天 | S327: 无权 | T327: 400 | U327: 173 | V327: 4.0000000000000001e-003 | W327: 0.16800000000000001 | X327: 0.121 | Y327: 2378. | Z327: 0.48 | AA327: 2.e-002 | AB327: 9.1999999999999998e-003 | AC327: 无权 | AD327: 无权 | AE327: 无权 | AF327: 107.85 | AG327: 0.11 | AH327: AAA | AI327: 3.1e-002 | AJ327: =H327+100*O327 -> 165.51999999999998 | AK327: 150.4 | AL327: 56 | AM327: 42.6 | AN327: 21 | AO327: 2.7000000000000003e-002 | AP327: 39 | AQ327: 中信转债!
A328: 327 | B328: 128056 | C328: 今飞转债! | D328: 2863 | E328: 今飞凯达 | F328: 汽车 | G328: 零部件制 | H328: 121.999 | I328: 0. | J328: -1.1299999999999999e-002 | K328: 5.41 | L328: -3.5699999999999996e-002 | M328: 120.2 | N328: 6.69 | O328: 0.50900000000000001 | P328: 80.87 | Q328: 已到 | R328: 3年15天 | S328: 1年15天 | T328: 1.72 | U328: 3.4 | V328: 1.6e-002 | W328: 6.4000000000000001e-002 | X328: 5.2000000000000005e-002 | Y328: 27 | Z328: 1.43 | AA328: -5.0000000000000001e-003 | AB328: -1.6299999999999999e-002 | AC328: -0.124 | AD328: -0.129 | AE328: 95.37 | AF328: 98.39 | AG328: 0.32 | AH328: A+ | AI328: 7.0000000000000007e-002 | AJ328: =H328+100*O328 -> 172.899 | AK328: 163.1 | AL328: 173 | AM328: 64.7 | AN328: 147 | AO328: -5.0999999999999997e-002 | AP328: 46 | AQ328: 今飞转债!
A329: 328 | B329: 128053 | C329: 尚荣转债! | D329: 2551 | E329: 尚荣医疗 | F329: 医药 | G329: 医疗器械 | H329: 131.316 | I329: -1.38e-002 | J329: 1.38e-002 | K329: 4.88 | L329: -3.7499999999999999e-002 | M329: 114.3 | N329: 4.88 | O329: 0.313 | P329: 100 | Q329: 已到 | R329: 3年1.0天 | S329: 1年1.0天 | T329: 1.9 | U329: 24 | V329: 9.6000000000000002e-002 | W329: 4.5999999999999999e-002 | X329: 4.5999999999999999e-002 | Y329: 41 | Z329: 1.3 | AA329: -4.6100000000000002e-002 | AB329: -5.4100000000000002e-002 | AC329: -0.184 | AD329: -0.187 | AE329: 98.46 | AF329: 102.45 | AG329: 0 | AH329: AA | AI329: 3.7999999999999999e-002 | AJ329: =H329+100*O329 -> 162.61600000000001 | AK329: 162.6 | AL329: 168 | AM329: 60.2 | AN329: 109 | AO329: -9.1999999999999998e-002 | AP329: 21 | AQ329: 尚荣转债!
A330: 329 | B330: 113527 | C330: 维格转债!! | D330: 603518 | E330: 锦泓集团 | F330: 服装纺织 | G330: 服装行业 | H330: 133.57 | I330: -1.26e-002 | J330: -5.8999999999999999e-003 | K330: 10.6 | L330: -3.4599999999999999e-002 | M330: 118.5 | N330: 9.85 | O330: 0.24100000000000002 | P330: 107.61 | Q330: 已到 | R330: 2.95年 | S330: 0.95年 | T330: 2.86 | U330: 56 | V330: 0.14699999999999999 | W330: 9.0999999999999998e-002 | X330: 9.8000000000000004e-002 | Y330: 31 | Z330: 1.29 | AA330: -4.0300000000000002e-002 | AB330: -5.0599999999999999e-002 | AC330: -0.21100000000000002 | AD330: -0.214 | AE330: 96.83 | AF330: 103.85 | AG330: 0.53 | AH330: AA | AI330: 4.6500000000000007e-002 | AJ330: =H330+100*O330 -> 157.66999999999999 | AK330: 159.5 | AL330: 132 | AM330: 55.7 | AN330: 75 | AO330: -5.9999999999999998e-002 | AP330: 64 | AQ330: 维格转债!!
A331: 330 | B331: 113526 | C331: 联泰转债! | D331: 603797 | E331: 联泰环保 | F331: 城市公用 | G331: 三废处理 | H331: 227.93 | I331: -1.4999999999999999e-002 | J331: 1.1200000000000002e-002 | K331: 6.45 | L331: -6.1999999999999998e-003 | M331: 109.3 | N331: 5.92 | O331: 1.0900000000000001 | P331: 108.95 | Q331: 已到 | R331: 2.94年 | S331: 0.94年 | T331: 1.93 | U331: 133 | V331: 0.30199999999999999 | W331: 5.0999999999999997e-002 | X331: 5.5999999999999994e-002 | Y331: 38 | Z331: 1.49 | AA331: -0.223 | AB331: -0.22699999999999998 | AC331: -0.49399999999999999 | AD331: -0.495 | AE331: 98.37 | AF331: 99.9 | AG331: 0.61 | AH331: AA+ | AI331: 3.15e-002 | AJ331: =H331+100*O331 -> 336.93000000000001 | AK331: 346.9 | AL331: 373 | AM331: 247 | AN331: 373 | AO331: -2.2000000000000002e-002 | AP331: 7 | AQ331: 联泰转债!
A332: 331 | B332: 123018 | C332: 溢利转债! | D332: 300381 | E332: 溢多利 | F332: 医药 | G332: 原料药 | H332: 180.31 | I332: -2.7000000000000001e-003 | J332: -1.4199999999999999e-002 | K332: 10.63 | L332: -2.12e-002 | M332: 113.3 | N332: 8.25 | O332: 0.39899999999999997 | P332: 128.85 | Q332: 已到 | R332: 2.85年 | S332: 0.85年 | T332: 0.54 | U332: 60 | V332: 0.61099999999999999 | W332: 1.e-002 | X332: 1.3000000000000001e-002 | Y332: 52 | Z332: 1.75 | AA332: -0.152 | AB332: -0.159 | AC332: -0.42799999999999999 | AD332: -0.42999999999999999 | AE332: 96.19 | AF332: 96.85 | AG332: 0.8 | AH332: AA- | AI332: 5.7500000000000002e-002 | AJ332: =H332+100*O332 -> 220.21000000000001 | AK332: 231.8 | AL332: 350 | AM332: 134.9 | AN332: 349 | AO332: -3.6000000000000004e-002 | AP332: 9 | AQ332: 溢利转债!
A333: 332 | B333: 113525 | C333: 台华转债!! | D333: 603055 | E333: 台华新材 | F333: 服装纺织 | G333: 纺织行业 | H333: 228.44 | I333: 3.0699999999999998e-002 | J333: 1.0500000000000001e-002 | K333: 15.79 | L333: 4.2199999999999994e-002 | M333: 113.3 | N333: 7.78 | O333: 0.126 | P333: 202.96 | Q333: 已到 | R333: 2.84年 | S333: 0.84年 | T333: 1.82 | U333: 360 | V333: 0.86599999999999999 | W333: 1.3000000000000001e-002 | X333: 2.7000000000000003e-002 | Y333: 137 | Z333: 3.83 | AA333: -0.221 | AB333: -0.22699999999999998 | AC333: -0.55000000000000004 | AD333: -0.55200000000000005 | AE333: 98.2 | AF333: 102.49 | AG333: 0.98 | AH333: AA | AI333: 3.6499999999999998e-002 | AJ333: =H333+100*O333 -> 241.03999999999999 | AK333: 253.9 | AL333: 357 | AM333: 151.4 | AN333: 357 | AO333: -2.e-002 | AP333: 17 | AQ333: 台华转债!!
A334: 333 | B334: 113524 | C334: 奇精转债! | D334: 603677 | E334: 奇精机械 | F334: 家电 | G334: 零部件制 | H334: 120.05 | I334: -6.3e-003 | J334: 2.0000000000000001e-004 | K334: 12 | L334: -1.8000000000000002e-002 | M334: 116.3 | N334: 13.98 | O334: 0.39899999999999997 | P334: 85.84 | Q334: 已到 | R334: 2.83年 | S334: 0.83年 | T334: 3.3 | U334: 2.2 | V334: 5.0000000000000001e-003 | W334: 0.14300000000000002 | X334: 0.12300000000000001 | Y334: 23 | Z334: 2.27 | AA334: -1.1299999999999999e-002 | AB334: -2.1299999999999999e-002 | AC334: -0.152 | AD334: -0.155 | AE334: 96.28 | AF334: 99.5 | AG334: 0.34 | AH334: AA- | AI334: 5.7500000000000002e-002 | AJ334: =H334+100*O334 -> 159.94999999999999 | AK334: 154.3 | AL334: 84 | AM334: 54.8 | AN334: 71 | AO334: -3.2000000000000001e-002 | AP334: 40 | AQ334: 奇精转债!
A335: 334 | B335: 110048 | C335: 福能转债!! | D335: 600483 | E335: 福能股份 | F335: 能源电力 | G335: 电力供应 | H335: 215.7 | I335: -2.4500000000000001e-002 | J335: -4.0899999999999999e-002 | K335: 12.96 | L335: -6.9000000000000006e-002 | M335: 112.3 | N335: 7.85 | O335: 0.307 | P335: 165.1 | Q335: 已到 | R335: 2.81年 | S335: 0.81年 | T335: 12.8 | U335: 78 | V335: 2.7999999999999997e-002 | W335: 5.0000000000000003e-002 | X335: 8.3000000000000004e-002 | Y335: 253 | Z335: 3.19 | AA335: -0.20899999999999999 | AB335: -0.215 | AC335: -0.54000000000000004 | AD335: -0.54200000000000004 | AE335: 98.76 | AF335: 103.06 | AG335: 0.95 | AH335: AA+ | AI335: 3.15e-002 | AJ335: =H335+100*O335 -> 246.39999999999998 | AK335: 266.3 | AL335: 361 | AM335: 163.2 | AN335: 361 | AO335: -4.2999999999999997e-002 | AP335: 9 | AQ335: 福能转债!!
A336: 335 | B336: 128049 | C336: 华源转债! | D336: 2787 | E336: 华源控股 | F336: 造纸包装 | G336: 包装材料 | H336: 114.535 | I336: -8.1000000000000013e-003 | J336: 1.1999999999999999e-003 | K336: 5.77 | L336: -2.53e-002 | M336: 113.5 | N336: 7.37 | O336: 0.46299999999999997 | P336: 78.29 | Q336: 已到 | R336: 2.79年 | S336: 0.79年 | T336: 3.63 | U336: 1.7 | V336: 4.0000000000000001e-003 | W336: 0.19899999999999998 | X336: 0.156 | Y336: 18 | Z336: 1.19 | AA336: -3.3e-003 | AB336: -1.2e-002 | AC336: -0.11699999999999999 | AD336: -0.121 | AE336: 96.56 | AF336: 97.38 | AG336: 0.27 | AH336: AA- | AI336: 5.7500000000000002e-002 | AJ336: =H336+100*O336 -> 160.83499999999998 | AK336: 150.8 | AL336: 58 | AM336: 53.4 | AN336: 60 | AO336: -4.5999999999999999e-002 | AP336: 44 | AQ336: 华源转债!
A337: 336 | B337: 110047 | C337: 山鹰转债 | D337: 600567 | E337: 山鹰国际 | F337: 造纸包装 | G337: 包装用纸 | H337: 122.28 | I337: -4.4000000000000003e-003 | J337: 8.9999999999999998e-004 | K337: 3.22 | L337: -9.1999999999999998e-003 | M337: 116.5 | N337: 3.3 | O337: 0.253 | P337: 97.58 | Q337: 已到 | R337: 2.77年 | S337: 0.77年 | T337: 22.5 | U337: 18 | V337: 6.9999999999999993e-003 | W337: 0.151 | X337: 0.14699999999999999 | Y337: 149 | Z337: 0.92 | AA337: -1.7600000000000001e-002 | AB337: -2.7799999999999998e-002 | AC337: -0.17999999999999999 | AD337: -0.183 | AE337: 98.93 | AF337: 107.06 | AG337: 0.38 | AH337: AA+ | AI337: 3.15e-002 | AJ337: =H337+100*O337 -> 147.58000000000001 | AK337: 147 | AL337: 38 | AM337: 39.9 | AN337: 13 | AO337: -1.1000000000000001e-002 | AP337: 28 | AQ337: 山鹰转债
A338: 337 | B338: 128048 | C338: 张行转债 | D338: 2839 | E338: 张家港行 | F338: 金融 | G338: 银行行业 | H338: 129.911 | I338: -2.2000000000000001e-003 | J338: 6.4000000000000003e-003 | K338: 6.61 | L338: 6.0999999999999995e-003 | M338: 112.3 | N338: 5.6 | O338: 0.10099999999999999 | P338: 118.04 | Q338: 已到 | R338: 2.75年 | S338: 无权 | T338: 25 | U338: 75 | V338: 2.3e-002 | W338: 0.20899999999999999 | X338: 0.247 | Y338: 120 | Z338: 1.03 | AA338: -5.2400000000000002e-002 | AB338: -5.9999999999999998e-002 | AC338: 无权 | AD338: 无权 | AE338: 无权 | AF338: 103.27 | AG338: 0.68 | AH338: AA+ | AI338: 3.15e-002 | AJ338: =H338+100*O338 -> 140.011 | AK338: 141.8 | AL338: 19 | AM338: 38.5 | AN338: 12 | AO338: 4.2999999999999997e-002 | AP338: 12 | AQ338: 张行转债
A339: 338 | B339: 113519 | C339: 长久转债! | D339: 603569 | E339: 长久物流 | F339: 交通运输 | G339: 物流业 | H339: 116.46 | I339: 5.1000000000000004e-003 | J339: -5.8999999999999999e-003 | K339: 7.47 | L339: -1.1899999999999999e-002 | M339: 118.3 | N339: 11.04 | O339: 0.72099999999999997 | P339: 67.66 | Q339: 已到 | R339: 2.73年 | S339: 0.73年 | T339: 6.97 | U339: 12 | V339: 1.4999999999999999e-002 | W339: 0.16699999999999998 | X339: 0.113 | Y339: 42 | Z339: 1.97 | AA339: 5.7999999999999996e-003 | AB339: -5.7999999999999996e-003 | AC339: -0.14199999999999999 | AD339: -0.14599999999999999 | AE339: 98.58 | AF339: 107.43 | AG339: 0.07 | AH339: AA | AI339: 3.6499999999999998e-002 | AJ339: =H339+100*O339 -> 188.56 | AK339: 165.3 | AL339: 190 | AM339: 57.8 | AN339: 92 | AO339: 2.8999999999999998e-002 | AP339: 28 | AQ339: 长久转债!
A340: 339 | B340: 128046 | C340: 利尔转债!! | D340: 2258 | E340: 利尔化学 | F340: 化工 | G340: 农化 | H340: 176.932 | I340: 1.4000000000000002e-003 | J340: -1.3600000000000001e-002 | K340: 29.85 | L340: -1.29e-002 | M340: 111.3 | N340: 18.42 | O340: 9.1999999999999998e-002 | P340: 162.05 | Q340: 已到 | R340: 2.67年 | S340: 0.67年 | T340: 8.08 | U340: 64 | V340: 4.4999999999999998e-002 | W340: 5.0999999999999997e-002 | X340: 8.3000000000000004e-002 | Y340: 157 | Z340: 3.63 | AA340: -0.161 | AB340: -0.16699999999999998 | AC340: -0.51400000000000001 | AD340: -0.51700000000000002 | AE340: 98.79 | AF340: 101.29 | AG340: 0.95 | AH340: AA | AI340: 3.6499999999999998e-002 | AJ340: =H340+100*O340 -> 186.13199999999998 | AK340: 191.8 | AL340: 320 | AM340: 90.5 | AN340: 300 | AO340: -2.9999999999999999e-002 | AP340: 9 | AQ340: 利尔转债!!
A341: 340 | B341: 128044 | C341: 岭南转债! | D341: 2717 | E341: 岭南股份 | F341: 城市公用 | G341: 生态环境 | H341: 134.082 | I341: -2.5399999999999999e-002 | J341: 2.35e-002 | K341: 4.16 | L341: -2.3999999999999998e-003 | M341: 110.3 | N341: 3.43 | O341: 0.106 | P341: 121.28 | Q341: 已到 | R341: 2.50年 | S341: 0.50年 | T341: 6.58 | U341: 787 | V341: 0.873 | W341: 9.4e-002 | X341: 0.114 | Y341: 70 | Z341: 1.48 | AA341: -7.6399999999999996e-002 | AB341: -8.3199999999999996e-002 | AC341: -0.376 | AD341: -0.38 | AE341: 98.1 | AF341: 96.16 | AG341: 0.79 | AH341: AA- | AI341: 5.7500000000000002e-002 | AJ341: =H341+100*O341 -> 144.68199999999999 | AK341: 146.9 | AL341: 36 | AM341: 48.8 | AN341: 40 | AO341: 6.9000000000000006e-002 | AP341: 55 | AQ341: 岭南转债!
A342: 341 | B342: 123015 | C342: 蓝盾转债!! | D342: 300297 | E342: 蓝盾股份 | F342: 计算机及 | G342: 软件开发 | H342: 213.401 | I342: 4.0000000000000002e-004 | J342: -4.0000000000000002e-004 | K342: 3.11 | L342: -3.1200000000000002e-002 | M342: 111.3 | N342: 5.79 | O342: 2.9700000000000002 | P342: 53.71 | Q342: 已到 | R342: 2.50年 | S342: 0.50年 | T342: 1 | U342: 234 | V342: 1.0900000000000001 | W342: 2.6000000000000002e-002 | X342: 1.3999999999999999e-002 | Y342: 39 | Z342: 2.19 | AA342: -0.23199999999999998 | AB342: -0.23800000000000002 | AC342: -0.81799999999999995 | AD342: -0.81999999999999995 | AE342: 94.55 | AF342: 84.61 | AG342: 0 | AH342: BBB- | AI342: 0.11849999999999999 | AJ342: =H342+100*O342 -> 510.40100000000001 | AK342: 373.1 | AL342: 374 | AM342: 278.5 | AN342: 374 | AO342: -8.1000000000000003e-002 | AP342: 14 | AQ342: 蓝盾转债!!
A343: 342 | B343: 113516 | C343: 苏农转债! | D343: 603323 | E343: 苏农银行 | F343: 金融 | G343: 银行行业 | H343: 126.59 | I343: -1.e-003 | J343: 1.9e-003 | K343: 5.7 | L343: 1.8e-003 | M343: 113.3 | N343: 5.37 | O343: 0.193 | P343: 106.15 | Q343: 已到 | R343: 2.47年 | S343: 无权 | T343: 12.9 | U343: 39 | V343: 2.4e-002 | W343: 0.125 | X343: 0.13300000000000001 | Y343: 103 | Z343: 0.8 | AA343: -4.4699999999999997e-002 | AB343: -5.3899999999999997e-002 | AC343: 无权 | AD343: 无权 | AE343: 无权 | AF343: 105.1 | AG343: 0.53 | AH343: AA+ | AI343: 3.15e-002 | AJ343: =H343+100*O343 -> 145.89000000000001 | AK343: 147 | AL343: 40 | AM343: 41.9 | AN343: 18 | AO343: 5.7999999999999996e-002 | AP343: 24 | AQ343: 苏农转债!
A344: 343 | B344: 123014 | C344: 凯发转债! | D344: 300407 | E344: 凯发电气 | F344: 能源电力 | G344: 电力设备 | H344: 133.598 | I344: -5.8999999999999999e-003 | J344: -9.300000000000001e-003 | K344: 8.16 | L344: -2.86e-002 | M344: 107.5 | N344: 8.05 | O344: 0.318 | P344: 101.37 | Q344: 已到 | R344: 1.45年 | S344: 回售内 | T344: 1.16 | U344: 11 | V344: 6.9000000000000006e-002 | W344: 4.7e-002 | X344: 4.7e-002 | Y344: 25 | Z344: 1.8 | AA344: -0.14000000000000001 | AB344: -0.14899999999999999 | AC344: 回售内 | AD344: 回售内 | AE344: 100.25 | AF344: 97.75 | AG344: 0.53 | AH344: A+ | AI344: 6.8499999999999991e-002 | AJ344: =H344+100*O344 -> 165.39800000000002 | AK344: 165.8 | AL344: 199 | AM344: 65.6 | AN344: 155 | AO344: -5.4000000000000006e-002 | AP344: 16 | AQ344: 凯发转债!
A345: 344 | B345: 128042 | C345: 凯中转债! | D345: 2823 | E345: 凯中精密 | F345: 能源电力 | G345: 电力设备 | H345: 119 | I345: 0. | J345: -4.3e-003 | K345: 9.84 | L345: -3.2400000000000005e-002 | M345: 115.3 | N345: 12.86 | O345: 0.55500000000000005 | P345: 76.52 | Q345: 已到 | R345: 2.46年 | S345: 0.46年 | T345: 4.16 | U345: 2.6 | V345: 5.0000000000000001e-003 | W345: 0.14699999999999999 | X345: 0.113 | Y345: 28 | Z345: 2.15 | AA345: -1.3000000000000001e-002 | AB345: -2.3799999999999998e-002 | AC345: -0.24299999999999999 | AD345: -0.247 | AE345: 99.56 | AF345: 105.74 | AG345: 0.13 | AH345: AA | AI345: 3.6499999999999998e-002 | AJ345: =H345+100*O345 -> 174.5 | AK345: 161.5 | AL345: 154 | AM345: 55.7 | AN345: 76 | AO345: -6.0999999999999999e-002 | AP345: 25 | AQ345: 凯中转债!
A346: 345 | B346: 123013 | C346: 横河转债! | D346: 300539 | E346: 横河精密 | F346: 机械装备 | G346: 专用设备 | H346: 356.7 | I346: 8.43e-002 | J346: -8.8200000000000001e-002 | K346: 8.12 | L346: -9.7999999999999997e-003 | M346: 114 | N346: 9.04 | O346: 2.9700000000000002 | P346: 89.82 | Q346: 已到 | R346: 2.45年 | S346: 0.45年 | T346: 0.38 | U346: 2793. | V346: 21.129999999999999 | W346: 2.1000000000000001e-002 | X346: 1.9e-002 | Y346: 18 | Z346: 3.66 | AA346: -0.377 | AB346: -0.38299999999999995 | AC346: <-100% | AD346: <-100% | AE346: 98.12 | AF346: 97.29 | AG346: 0.4 | AH346: A+ | AI346: 6.8499999999999991e-002 | AJ346: =H346+100*O346 -> 653.70000000000005 | AK346: 623.6 | AL346: 385 | AM346: 525.5 | AN346: 385 | AO346: 1.e-003 | AP346: 11 | AQ346: 横河转债!
A347: 346 | B347: 123012 | C347: 万顺转债! | D347: 300057 | E347: 万顺新材 | F347: 有色金属 | G347: 铝金属 | H347: 165.8 | I347: -2.18e-002 | J347: -1.15e-002 | K347: 8 | L347: -3.61e-002 | M347: 109.3 | N347: 5.27 | O347: 9.1999999999999998e-002 | P347: 151.8 | Q347: 已到 | R347: 2.43年 | S347: 0.43年 | T347: 1.22 | U347: 38 | V347: 0.187 | W347: 2.2000000000000002e-002 | X347: 3.4000000000000002e-002 | Y347: 55 | Z347: 1.52 | AA347: -0.16 | AB347: -0.16500000000000001 | AC347: -0.67599999999999993 | AD347: -0.67900000000000005 | AE347: 98.47 | AF347: 95.66 | AG347: 0.92 | AH347: AA- | AI347: 5.7500000000000002e-002 | AJ347: =H347+100*O347 -> 175. | AK347: 179.8 | AL347: 289 | AM347: 81.3 | AN347: 258 | AO347: -7.2000000000000008e-002 | AP347: 23 | AQ347: 万顺转债!
A348: 347 | B348: 123011 | C348: 德尔转债! | D348: 300473 | E348: 德尔股份 | F348: 汽车 | G348: 零部件制 | H348: 119.887 | I348: -1.0800000000000001e-002 | J348: 7.1999999999999998e-003 | K348: 21.17 | L348: -3.4700000000000002e-002 | M348: 115.3 | N348: 31.38 | O348: 0.77700000000000002 | P348: 67.46 | Q348: 已到 | R348: 2.42年 | S348: 0.42年 | T348: 2.51 | U348: 10 | V348: 3.3000000000000002e-002 | W348: 8.8000000000000009e-002 | X348: 5.9000000000000004e-002 | Y348: 29 | Z348: 1.34 | AA348: -1.6200000000000003e-002 | AB348: -2.7200000000000002e-002 | AC348: -0.26800000000000002 | AD348: -0.27300000000000002 | AE348: 98.5 | AF348: 100.93 | AG348: 0.11 | AH348: AA- | AI348: 5.7500000000000002e-002 | AJ348: =H348+100*O348 -> 197.58699999999999 | AK348: 172.3 | AL348: 253 | AM348: 71.4 | AN348: 198 | AO348: -7.2000000000000008e-002 | AP348: 37 | AQ348: 德尔转债!
A349: 348 | B349: 128041 | C349: 盛路转债!! | D349: 2446 | E349: 盛路通信 | F349: 通信互联 | G349: 通信设备 | H349: 258.53 | I349: 1.6799999999999999e-002 | J349: -3.44e-002 | K349: 6.24 | L349: -4.1500000000000002e-002 | M349: 113.3 | N349: 6.82 | O349: 1.8300000000000001 | P349: 91.5 | Q349: 已到 | R349: 2.42年 | S349: 0.42年 | T349: 0.53 | U349: 432 | V349: 3.1800000000000002 | W349: 9.0000000000000011e-003 | X349: 9.0000000000000011e-003 | Y349: 57 | Z349: 1.85 | AA349: -0.29199999999999998 | AB349: -0.29799999999999999 | AC349: <-100% | AD349: <-100% | AE349: 99.68 | AF349: 104.04 | AG349: 0.42 | AH349: AA | AI349: 3.6499999999999998e-002 | AJ349: =H349+100*O349 -> 441.52999999999997 | AK349: 425.6 | AL349: 379 | AM349: 321.5 | AN349: 379 | AO349: 1.8000000000000002e-002 | AP349: 10 | AQ349: 盛路转债!!
A350: 349 | B350: 110045 | C350: 海澜转债! | D350: 600398 | E350: 海澜之家 | F350: 服装纺织 | G350: 服装行业 | H350: 117.81 | I350: -9.1000000000000004e-003 | J350: 8.199999999999999e-003 | K350: 6.28 | L350: -3.2000000000000002e-003 | M350: 110.3 | N350: 7.04 | O350: 0.32100000000000001 | P350: 89.2 | Q350: 已到 | R350: 2.41年 | S350: 0.41年 | T350: 29.5 | U350: 46 | V350: 1.3000000000000001e-002 | W350: 0.109 | X350: 9.6999999999999989e-002 | Y350: 271 | Z350: 1.92 | AA350: -2.7300000000000001e-002 | AB350: -3.49e-002 | AC350: -0.25600000000000001 | AD350: -0.26000000000000001 | AE350: 99.42 | AF350: 102.45 | AG350: 0.29 | AH350: AA+ | AI350: 3.15e-002 | AJ350: =H350+100*O350 -> 149.91 | AK350: 146.4 | AL350: 33 | AM350: 44 | AN350: 25 | AO350: -9.0000000000000011e-003 | AP350: 42 | AQ350: 海澜转债!
A351: 350 | B351: 123010 | C351: 博世转债! | D351: 300422 | E351: 博世科 | F351: 城市公用 | G351: 三废处理 | H351: 114.294 | I351: -4.4000000000000003e-003 | J351: 1.7000000000000001e-003 | K351: 7.7 | L351: -2.2799999999999997e-002 | M351: 111.3 | N351: 11.26 | O351: 0.67099999999999993 | P351: 68.38 | Q351: 已到 | R351: 2.39年 | S351: 0.39年 | T351: 4.3 | U351: 2.6 | V351: 5.0000000000000001e-003 | W351: 0.111 | X351: 7.5999999999999998e-002 | Y351: 39 | Z351: 1.21 | AA351: -1.1200000000000002e-002 | AB351: -1.9799999999999998e-002 | AC351: -0.20800000000000002 | AD351: -0.214 | AE351: 98.7 | AF351: 97.63 | AG351: 0.12 | AH351: AA- | AI351: 5.7500000000000002e-002 | AJ351: =H351+100*O351 -> 181.39400000000001 | AK351: 160.2 | AL351: 145 | AM351: 61.5 | AN351: 119 | AO351: -8.3000000000000004e-002 | AP351: 34 | AQ351: 博世转债!
A352: 351 | B352: 127007 | C352: 湖广转债!! | D352: 665 | E352: 湖北广电 | F352: 传媒娱乐 | G352: 影视娱乐 | H352: 170.5 | I352: -3.6699999999999997e-002 | J352: 2.2400000000000003e-002 | K352: 9.09 | L352: -1.52e-002 | M352: 111.3 | N352: 5.58 | O352: 4.7e-002 | P352: 162.9 | Q352: 已到 | R352: 2.37年 | S352: 0.37年 | T352: 4.15 | U352: 5791. | V352: 7.7699999999999996 | W352: 4.4999999999999998e-002 | X352: 7.2999999999999995e-002 | Y352: 92 | Z352: 1.57 | AA352: -0.16699999999999998 | AB352: -0.17399999999999999 | AC352: -0.78900000000000003 | AD352: -0.79299999999999993 | AE352: 100.13 | AF352: 103.55 | AG352: 0.95 | AH352: AA+ | AI352: 3.15e-002 | AJ352: =H352+100*O352 -> 175.19999999999999 | AK352: 178.1 | AL352: 278 | AM352: 74.5 | AN352: 218 | AO352: -2.5000000000000001e-002 | AP352: 31 | AQ352: 湖广转债!!
A353: 352 | B353: 110044 | C353: 广电转债!! | D353: 600831 | E353: 广电网络 | F353: 传媒娱乐 | G353: 影视娱乐 | H353: 202.94 | I353: 1.4000000000000002e-003 | J353: -1.1399999999999999e-002 | K353: 6.22 | L353: -2.9600000000000001e-002 | M353: 111.3 | N353: 6.87 | O353: 1.24 | P353: 90.54 | Q353: 已到 | R353: 2.37年 | S353: 0.37年 | T353: 0.71 | U353: 85 | V353: 0.59499999999999997 | W353: 1.6e-002 | X353: 1.4999999999999999e-002 | Y353: 44 | Z353: 1.18 | AA353: -0.22699999999999998 | AB353: -0.23300000000000001 | AC353: -0.97999999999999998 | AD353: -0.98299999999999998 | AE353: 99.88 | AF353: 102.41 | AG353: 0.34 | AH353: AA | AI353: 3.6499999999999998e-002 | AJ353: =H353+100*O353 -> 326.94 | AK353: 315.3 | AL353: 371 | AM353: 212.9 | AN353: 371 | AO353: 1.e-003 | AP353: 9 | AQ353: 广电转债!!
A354: 353 | B354: 128040 | C354: 华通转债! | D354: 2758 | E354: 浙农股份 | F354: 医药 | G354: 医药商业 | H354: 134.546 | I354: -1.4199999999999999e-002 | J354: 2.0999999999999999e-003 | K354: 11.78 | L354: -1.7500000000000002e-002 | M354: 111.3 | N354: 10.03 | O354: 0.14599999999999999 | P354: 117.45 | Q354: 已到 | R354: 2.33年 | S354: 0.33年 | T354: 2.22 | U354: 24 | V354: 8.0000000000000002e-002 | W354: 3.7999999999999999e-002 | X354: 4.4000000000000004e-002 | Y354: 59 | Z354: 1.76 | AA354: -7.9500000000000001e-002 | AB354: -8.7400000000000005e-002 | AC354: -0.51700000000000002 | AD354: -0.52200000000000002 | AE354: 100.01 | AF354: 102.54 | AG354: 0.69 | AH354: AA | AI354: 3.6499999999999998e-002 | AJ354: =H354+100*O354 -> 149.14599999999999 | AK354: 151.6 | AL354: 68 | AM354: 49.1 | AN354: 43 | AO354: 2.4e-002 | AP354: 32 | AQ354: 华通转债!
A355: 354 | B355: 128039 | C355: 三力转债! | D355: 2224 | E355: 三 力 士 | F355: 机械装备 | G355: 专用设备 | H355: 121.859 | I355: -1.3100000000000001e-002 | J355: 4.0000000000000002e-004 | K355: 5.29 | L355: -2.9399999999999999e-002 | M355: 108.8 | N355: 5.79 | O355: 0.33399999999999996 | P355: 91.36 | Q355: 已到 | R355: 2.32年 | S355: 0.32年 | T355: 2.02 | U355: 10 | V355: 4.0999999999999995e-002 | W355: 5.2000000000000005e-002 | X355: 4.8000000000000001e-002 | Y355: 39 | Z355: 1.61 | AA355: -4.8499999999999995e-002 | AB355: -5.5099999999999996e-002 | AC355: -0.36700000000000005 | AD355: -0.373 | AE355: 98.86 | AF355: 95.8 | AG355: 0.43 | AH355: AA- | AI355: 5.7500000000000002e-002 | AJ355: =H355+100*O355 -> 155.25899999999999 | AK355: 152.4 | AL355: 73 | AM355: 53.5 | AN355: 61 | AO355: -1.7000000000000001e-002 | AP355: 30 | AQ355: 三力转债!
A356: 355 | B356: 128036 | C356: 金农转债!! | D356: 2548 | E356: 金新农 | F356: 农业 | G356: 畜牧业 | H356: 138.7 | I356: -3.1400000000000004e-002 | J356: 4.24e-002 | K356: 7.6 | L356: 1.2e-002 | M356: 109.3 | N356: 6.93 | O356: 0.26500000000000001 | P356: 109.67 | Q356: 已到 | R356: 2年24天 | S356: 24天 | T356: 1.46 | U356: 610 | V356: 2.9500000000000002 | W356: 2.7999999999999997e-002 | X356: 2.9999999999999999e-002 | Y356: 52 | Z356: 2.25 | AA356: -0.111 | AB356: -0.11800000000000001 | AC356: <-100% | AD356: <-100% | AE356: 100.5 | AF356: 97.63 | AG356: 0.92 | AH356: AA- | AI356: 5.7500000000000002e-002 | AJ356: =H356+100*O356 -> 165.19999999999999 | AK356: 167.7 | AL356: 210 | AM356: 67.2 | AN356: 165 | AO356: 0.17600000000000002 | AP356: 16 | AQ356: 金农转债!!
A357: 356 | B357: 128037 | C357: 岩土转债! | D357: 2542 | E357: 中化岩土 | F357: 建筑 | G357: 建筑工程 | H357: 121.54 | I357: -6.9999999999999993e-003 | J357: 6.9999999999999993e-003 | K357: 2.95 | L357: 0. | M357: 111.3 | N357: 3.1 | O357: 0.27699999999999997 | P357: 95.16 | Q357: 已到 | R357: 2年30天 | S357: 30天 | T357: 5.99 | U357: 13 | V357: 1.8000000000000002e-002 | W357: 0.113 | X357: 0.107 | Y357: 53 | Z357: 1.34 | AA357: -4.2199999999999994e-002 | AB357: -5.16e-002 | AC357: -0.70999999999999996 | AD357: -0.72199999999999998 | AE357: 100.9 | AF357: 103.46 | AG357: 0.37 | AH357: AA | AI357: 3.6499999999999998e-002 | AJ357: =H357+100*O357 -> 149.24000000000001 | AK357: 147.9 | AL357: 44 | AM357: 44.5 | AN357: 27 | AO357: 1.e-002 | AP357: 54 | AQ357: 岩土转债!
A358: 357 | B358: 127006 | C358: 敖东转债! | D358: 623 | E358: 吉林敖东 | F358: 金融 | G358: 证券行业 | H358: 119.8 | I358: -3.3e-003 | J358: 7.000000000000001e-004 | K358: 17.1 | L358: -1.1000000000000001e-002 | M358: 107.4 | N358: 20.22 | O358: 0.41700000000000004 | P358: 84.57 | Q358: 已到 | R358: 2年28天 | S358: 28天 | T358: 24.1 | U358: 8.9 | V358: 3.0000000000000001e-003 | W358: 0.121 | X358: 0.10199999999999999 | Y358: 199 | Z358: 0.82 | AA358: -5.2000000000000005e-002 | AB358: -5.8200000000000002e-002 | AC358: -0.69700000000000006 | AD358: -0.70400000000000007 | AE358: 100.31 | AF358: 100.8 | AG358: 0.24 | AH358: AA+ | AI358: 3.15e-002 | AJ358: =H358+100*O358 -> 161.5 | AK358: 155 | AL358: 90 | AM358: 54.2 | AN358: 68 | AO358: -1.9e-002 | AP358: 25 | AQ358: 敖东转债!
A359: 358 | B359: 127005 | C359: 长证转债! | D359: 783 | E359: 长江证券 | F359: 金融 | G359: 证券行业 | H359: 127.985 | I359: -5.6000000000000008e-003 | J359: 4.8999999999999998e-003 | K359: 7.19 | L359: -1.4000000000000002e-003 | M359: 108.3 | N359: 7.13 | O359: 0.26899999999999996 | P359: 100.84 | Q359: 已到 | R359: 2年27天 | S359: 无权 | T359: 50 | U359: 24 | V359: 4.0000000000000001e-003 | W359: 0.126 | X359: 0.127 | Y359: 398 | Z359: 1.35 | AA359: -7.8899999999999998e-002 | AB359: -8.5500000000000007e-002 | AC359: 无权 | AD359: 无权 | AE359: 无权 | AF359: 102.1 | AG359: 0.49 | AH359: AAA | AI359: 2.9500000000000002e-002 | AJ359: =H359+100*O359 -> 154.88499999999999 | AK359: 155.1 | AL359: 92 | AM359: 53 | AN359: 57 | AO359: -1.3999999999999999e-002 | AP359: 12 | AQ359: 长证转债!
A360: 359 | B360: 113505 | C360: 杭电转债! | D360: 603618 | E360: 杭电股份 | F360: 能源电力 | G360: 电力设备 | H360: 121.7 | I360: -1.0200000000000001e-002 | J360: 2.5000000000000001e-003 | K360: 6.34 | L360: -2.76e-002 | M360: 111.3 | N360: 7.08 | O360: 0.35899999999999999 | P360: 89.55 | Q360: 已到 | R360: 2年21天 | S360: 21天 | T360: 7.5 | U360: 6.8 | V360: 6.9999999999999993e-003 | W360: 0.17100000000000001 | X360: 0.153 | Y360: 44 | Z360: 1.66 | AA360: -4.3299999999999998e-002 | AB360: -5.28e-002 | AC360: -0.79599999999999993 | AD360: -0.80900000000000005 | AE360: 100.99 | AF360: 103.55 | AG360: 0.28 | AH360: AA | AI360: 3.6499999999999998e-002 | AJ360: =H360+100*O360 -> 157.59999999999999 | AK360: 153.9 | AL360: 78 | AM360: 50.3 | AN360: 47 | AO360: -5.9999999999999998e-002 | AP360: 42 | AQ360: 杭电转债!
A361: 360 | B361: 113504 | C361: 艾华转债!! | D361: 603989 | E361: 艾华集团 | F361: 电子 | G361: 元器件制 | H361: 189.89 | I361: -1.5800000000000002e-002 | J361: -2.7300000000000001e-002 | K361: 33.77 | L361: -4.4699999999999997e-002 | M361: 109.3 | N361: 20.81 | O361: 0.17000000000000001 | P361: 162.28 | Q361: 已到 | R361: 2年17天 | S361: 17天 | T361: 4.63 | U361: 13 | V361: 1.4999999999999999e-002 | W361: 3.4000000000000002e-002 | X361: 5.5e-002 | Y361: 135 | Z361: 4.75 | AA361: -0.23999999999999999 | AB361: -0.24600000000000002 | AC361: <-100% | AD361: <-100% | AE361: 101.03 | AF361: 101.73 | AG361: 0.96 | AH361: AA | AI361: 3.6499999999999998e-002 | AJ361: =H361+100*O361 -> 206.88999999999999 | AK361: 217.5 | AL361: 346 | AM361: 115.8 | AN361: 340 | AO361: -5.2000000000000005e-002 | AP361: 10 | AQ361: 艾华转债!!
A362: 361 | B362: 128035 | C362: 大族转债! | D362: 2008 | E362: 大族激光 | F362: 机械装备 | G362: 专用设备 | H362: 127.6 | I362: -4.3e-003 | J362: 2.5999999999999999e-003 | K362: 44.68 | L362: -7.0999999999999995e-003 | M362: 106.6 | N362: 51.9 | O362: 0.48200000000000004 | P362: 86.09 | Q362: 已到 | R362: 1.98年 | S362: 回售内 | T362: 23 | U362: 38 | V362: 1.3000000000000001e-002 | W362: 4.8000000000000001e-002 | X362: 4.2000000000000003e-002 | Y362: 477 | Z362: 4.49 | AA362: -8.7400000000000005e-002 | AB362: -9.3000000000000013e-002 | AC362: 回售内 | AD362: 回售内 | AE362: 103 | AF362: 100.3 | AG362: 0.24 | AH362: AA+ | AI362: 3.15e-002 | AJ362: =H362+100*O362 -> 175.80000000000001 | AK362: 169.1 | AL362: 226 | AM362: 66.1 | AN362: 160 | AO362: -5.9999999999999998e-002 | AP362: 17 | AQ362: 大族转债!
A363: 362 | B363: 110043 | C363: 无锡转债! | D363: 600908 | E363: 无锡银行 | F363: 金融 | G363: 银行行业 | H363: 126.14 | I363: -1.1999999999999999e-003 | J363: 2.0000000000000001e-004 | K363: 6.19 | L363: -1.6000000000000001e-003 | M363: 107.3 | N363: 5.61 | O363: 0.14300000000000002 | P363: 110.34 | Q363: 已到 | R363: 1.96年 | S363: 无权 | T363: 29.2 | U363: 87 | V363: 2.4e-002 | W363: 0.254 | X363: 0.28000000000000003 | Y363: 115 | Z363: 0.89 | AA363: -7.9600000000000004e-002 | AB363: -8.5999999999999993e-002 | AC363: 无权 | AD363: 无权 | AE363: 无权 | AF363: 101 | AG363: 0.63 | AH363: AA+ | AI363: 3.15e-002 | AJ363: =H363+100*O363 -> 140.44 | AK363: 141.9 | AL363: 20 | AM363: 40.9 | AN363: 16 | AO363: 3.2000000000000001e-002 | AP363: 22 | AQ363: 无锡转债!
A364: 363 | B364: 128034 | C364: 江银转债! | D364: 2807 | E364: 江阴银行 | F364: 金融 | G364: 银行行业 | H364: 118.5 | I364: 1.2999999999999999e-003 | J364: -1.2999999999999999e-003 | K364: 4.12 | L364: 0. | M364: 107.3 | N364: 4.32 | O364: 0.24299999999999999 | P364: 95.37 | Q364: 已到 | R364: 1.95年 | S364: 无权 | T364: 17.6 | U364: 24 | V364: 1.2e-002 | W364: 0.19600000000000001 | X364: 0.187 | Y364: 89 | Z364: 0.74 | AA364: -4.99e-002 | AB364: -5.6500000000000002e-002 | AC364: 无权 | AD364: 无权 | AE364: 无权 | AF364: 101.04 | AG364: 0.4 | AH364: AA+ | AI364: 3.15e-002 | AJ364: =H364+100*O364 -> 142.80000000000001 | AK364: 141.6 | AL364: 18 | AM364: 40.6 | AN364: 14 | AO364: 3.2000000000000001e-002 | AP364: 31 | AQ364: 江银转债!
A365: 364 | B365: 128033 | C365: 迪龙转债! | D365: 2658 | E365: 雪迪龙 | F365: 城市公用 | G365: 三废处理 | H365: 126.624 | I365: -4.5999999999999999e-003 | J365: -2.7000000000000001e-003 | K365: 8.05 | L365: -1.95e-002 | M365: 107.5 | N365: 8.56 | O365: 0.34600000000000003 | P365: 94.04 | Q365: 已到 | R365: 1.87年 | S365: 回售内 | T365: 2.98 | U365: 34 | V365: 8.900000000000001e-002 | W365: 5.9000000000000004e-002 | X365: 5.5e-002 | Y365: 51 | Z365: 2.07 | AA365: -8.4499999999999992e-002 | AB365: -9.1300000000000006e-002 | AC365: 回售内 | AD365: 回售内 | AE365: 100.25 | AF365: 100.59 | AG365: 0.38 | AH365: AA | AI365: 3.6499999999999998e-002 | AJ365: =H365+100*O365 -> 161.22399999999999 | AK365: 159.2 | AL365: 128 | AM365: 58.6 | AN365: 97 | AO365: -6.7000000000000004e-002 | AP365: 33 | AQ365: 迪龙转债!
A366: 365 | B366: 113017 | C366: 吉视转债! | D366: 601929 | E366: 吉视传媒 | F366: 传媒娱乐 | G366: 影视娱乐 | H366: 130.3 | I366: -3.0899999999999997e-002 | J366: -3.0999999999999999e-003 | K366: 2.56 | L366: -4.8300000000000003e-002 | M366: 107.5 | N366: 2.23 | O366: 0.13500000000000001 | P366: 114.8 | Q366: 已到 | R366: 1.87年 | S366: 回售内 | T366: 11.4 | U366: 567 | V366: 0.377 | W366: 0.14300000000000002 | X366: 0.16399999999999998 | Y366: 80 | Z366: 1.19 | AA366: -9.849999999999999e-002 | AB366: -0.105 | AC366: 回售内 | AD366: 回售内 | AE366: 100.25 | AF366: 101.49 | AG366: 0.71 | AH366: AA+ | AI366: 3.15e-002 | AJ366: =H366+100*O366 -> 143.80000000000001 | AK366: 145.8 | AL366: 31 | AM366: 44.3 | AN366: 26 | AO366: -3.4000000000000002e-002 | AP366: 70 | AQ366: 吉视转债!
A367: 366 | B367: 128030 | C367: 天康转债!! | D367: 2100 | E367: 天康生物 | F367: 农业 | G367: 畜牧业 | H367: 214.478 | I367: 1.1699999999999999e-002 | J367: -4.4600000000000001e-002 | K367: 12.32 | L367: -3.3700000000000001e-002 | M367: 109.8 | N367: 7.4 | O367: 0.28800000000000003 | P367: 166.49 | Q367: 已到 | R367: 1.85年 | S367: 回售内 | T367: 0.87 | U367: 84 | V367: 0.45100000000000001 | W367: 5.0000000000000001e-003 | X367: 9.0000000000000011e-003 | Y367: 167 | Z367: 2.36 | AA367: -0.30499999999999999 | AB367: -0.311 | AC367: 回售内 | AD367: 回售内 | AE367: 100.3 | AF367: 102.8 | AG367: 0.98 | AH367: AA | AI367: 3.6499999999999998e-002 | AJ367: =H367+100*O367 -> 243.27800000000002 | AK367: 262.5 | AL367: 360 | AM367: 159.7 | AN367: 360 | AO367: 0.10199999999999999 | AP367: 9 | AQ367: 天康转债!!
A368: 367 | B368: 128029 | C368: 太阳转债!! | D368: 2078 | E368: 太阳纸业 | F368: 造纸包装 | G368: 造纸行业 | H368: 169.7 | I368: 1.77e-002 | J368: -1.01e-002 | K368: 11.67 | L368: 7.8000000000000005e-003 | M368: 106 | N368: 8.45 | O368: 0.22899999999999998 | P368: 138.11 | Q368: 已到 | R368: 0.85年 | S368: 回售内 | T368: 9.09 | U368: 97 | V368: 6.3e-002 | W368: 2.8999999999999998e-002 | X368: 4.0000000000000001e-002 | Y368: 314 | Z368: 1.65 | AA368: -0.44600000000000001 | AB368: -0.45399999999999996 | AC368: 回售内 | AD368: 回售内 | AE368: 100.25 | AF368: 103.6 | AG368: 0.97 | AH368: AA+ | AI368: 2.7200000000000002e-002 | AJ368: =H368+100*O368 -> 192.59999999999999 | AK368: 201.3 | AL368: 335 | AM368: 97.7 | AN368: 316 | AO368: 5.0000000000000001e-003 | AP368: 7 | AQ368: 太阳转债!!
A369: 368 | B369: 123004 | C369: 铁汉转债! | D369: 300197 | E369: 节能铁汉 | F369: 城市公用 | G369: 生态环境 | H369: 112.8 | I369: -4.0000000000000002e-004 | J369: -2.9999999999999997e-004 | K369: 2.79 | L369: -1.06e-002 | M369: 107.5 | N369: 3.82 | O369: 0.54400000000000004 | P369: 73.04 | Q369: 已到 | R369: 1.84年 | S369: 回售内 | T369: 8.03 | U369: 17 | V369: 1.9e-002 | W369: 0.10199999999999999 | X369: 7.400000000000001e-002 | Y369: 79 | Z369: 1.23 | AA369: -2.6000000000000002e-002 | AB369: -3.3399999999999999e-002 | AC369: 回售内 | AD369: 回售内 | AE369: 100.25 | AF369: 100.67 | AG369: 0.07 | AH369: AA | AI369: 3.6499999999999998e-002 | AJ369: =H369+100*O369 -> 167.19999999999999 | AK369: 152.6 | AL369: 75 | AM369: 51.9 | AN369: 51 | AO369: -2.3e-002 | AP369: 52 | AQ369: 铁汉转债!
A370: 369 | B370: 128026 | C370: 众兴转债! | D370: 2772 | E370: 众兴菌业 | F370: 农业 | G370: 种植业 | H370: 113.794 | I370: -4.8999999999999998e-003 | J370: 4.8999999999999998e-003 | K370: 7.72 | L370: -2.6499999999999999e-002 | M370: 107.8 | N370: 11.36 | O370: 0.67400000000000004 | P370: 67.96 | Q370: 已到 | R370: 1.83年 | S370: 回售内 | T370: 4.09 | U370: 6.3 | V370: 1.3999999999999999e-002 | W370: 0.13 | X370: 8.8000000000000009e-002 | Y370: 31 | Z370: 1.05 | AA370: -2.9399999999999999e-002 | AB370: -3.7100000000000001e-002 | AC370: 回售内 | AD370: 回售内 | AE370: 100.3 | AF370: 97.41 | AG370: 0 | AH370: AA- | AI370: 5.7500000000000002e-002 | AJ370: =H370+100*O370 -> 181.19400000000002 | AK370: 159.6 | AL370: 134 | AM370: 59.3 | AN370: 102 | AO370: -4.7e-002 | AP370: 59 | AQ370: 众兴转债!
A371: 370 | B371: 128025 | C371: 特一转债! | D371: 2728 | E371: 特一药业 | F371: 医药 | G371: 化学制药 | H371: 131.3 | I371: -5.1100000000000007e-002 | J371: 8.5000000000000006e-003 | K371: 14.52 | L371: -6.9800000000000001e-002 | M371: 107.5 | N371: 13.8 | O371: 0.248 | P371: 105.22 | Q371: 已到 | R371: 1.81年 | S371: 回售内 | T371: 2.98 | U371: 139 | V371: 0.34999999999999998 | W371: 9.3000000000000013e-002 | X371: 9.6999999999999989e-002 | Y371: 32 | Z371: 2.96 | AA371: -0.105 | AB371: -0.11199999999999999 | AC371: 回售内 | AD371: 回售内 | AE371: 100.25 | AF371: 97.23 | AG371: 0.61 | AH371: AA- | AI371: 5.7500000000000002e-002 | AJ371: =H371+100*O371 -> 156.10000000000002 | AK371: 157.4 | AL371: 113 | AM371: 57.1 | AN371: 86 | AO371: -0.114 | AP371: 46 | AQ371: 特一转债!
A372: 371 | B372: 128023 | C372: 亚太转债! | D372: 2284 | E372: 亚太股份 | F372: 汽车 | G372: 零部件制 | H372: 125.98 | I372: -2.7200000000000002e-002 | J372: 1.49e-002 | K372: 8.64 | L372: -6.59e-002 | M372: 109.8 | N372: 10.34 | O372: 0.50800000000000001 | P372: 83.56 | Q372: 已到 | R372: 1.81年 | S372: 回售内 | T372: 9.99 | U372: 50 | V372: 4.0000000000000001e-002 | W372: 0.157 | X372: 0.13100000000000001 | Y372: 64 | Z372: 2.54 | AA372: -7.3899999999999993e-002 | AB372: -8.3100000000000007e-002 | AC372: 回售内 | AD372: 回售内 | AE372: 100.3 | AF372: 102.98 | AG372: 0.19 | AH372: AA | AI372: 3.6499999999999998e-002 | AJ372: =H372+100*O372 -> 176.78 | AK372: 168.4 | AL372: 220 | AM372: 65.4 | AN372: 154 | AO372: -0.13699999999999998 | AP372: 52 | AQ372: 亚太转债!
A373: 372 | B373: 128022 | C373: 众信转债! | D373: 2707 | E373: 众信旅游 | F373: 旅游餐饮 | G373: 旅游 | H373: 129.3 | I373: 2.3e-003 | J373: 2.8000000000000004e-003 | K373: 8.01 | L373: 8.8000000000000005e-003 | M373: 107.5 | N373: 7.92 | O373: 0.27800000000000002 | P373: 101.14 | Q373: 已到 | R373: 1.80年 | S373: 回售内 | T373: 4.55 | U373: 1117. | V373: 1.8600000000000001 | W373: 6.3e-002 | X373: 6.3e-002 | Y373: 73 | Z373: 14.05 | AA373: -9.8299999999999998e-002 | AB373: -0.105 | AC373: 回售内 | AD373: 回售内 | AE373: 100.25 | AF373: 93.95 | AG373: 0.58 | AH373: A | AI373: 7.85e-002 | AJ373: =H373+100*O373 -> 157.10000000000002 | AK373: 157.5 | AL373: 115 | AM373: 57.2 | AN373: 88 | AO373: 0.218 | AP373: 40 | AQ373: 众信转债!
A374: 373 | B374: 128021 | C374: 兄弟转债!! | D374: 2562 | E374: 兄弟科技 | F374: 医药 | G374: 原料药 | H374: 130 | I374: 2.7000000000000001e-003 | J374: 7.3000000000000001e-003 | K374: 5.65 | L374: 1.0700000000000001e-002 | M374: 107.5 | N374: 5.19 | O374: 0.19399999999999998 | P374: 108.86 | Q374: 已到 | R374: 1.79年 | S374: 回售内 | T374: 2.65 | U374: 84 | V374: 0.24100000000000002 | W374: 4.4000000000000004e-002 | X374: 4.8000000000000001e-002 | Y374: 60 | Z374: 2.04 | AA374: -0.10099999999999999 | AB374: -0.10800000000000001 | AC374: 回售内 | AD374: 回售内 | AE374: 100.25 | AF374: 100.87 | AG374: 0.93 | AH374: AA | AI374: 3.6499999999999998e-002 | AJ374: =H374+100*O374 -> 149.40000000000001 | AK374: 151.1 | AL374: 61 | AM374: 50.3 | AN374: 46 | AO374: 6.8000000000000005e-002 | AP374: 19 | AQ374: 兄弟转债!!
A375: 374 | B375: 123002 | C375: 国祯转债!! | D375: 300388 | E375: 节能国祯 | F375: 城市公用 | G375: 三废处理 | H375: 122.102 | I375: -7.4999999999999997e-003 | J375: 4.7999999999999996e-003 | K375: 7.52 | L375: -7.9000000000000008e-003 | M375: 107.5 | N375: 8.36 | O375: 0.35700000000000004 | P375: 89.95 | Q375: 已到 | R375: 1.78年 | S375: 回售内 | T375: 2.52 | U375: 4.3 | V375: 1.3999999999999999e-002 | W375: 4.8000000000000001e-002 | X375: 4.2999999999999997e-002 | Y375: 53 | Z375: 1.43 | AA375: -6.9599999999999995e-002 | AB375: -7.690000000000001e-002 | AC375: 回售内 | AD375: 回售内 | AE375: 100.25 | AF375: 100.91 | AG375: 0.34 | AH375: AA | AI375: 3.6499999999999998e-002 | AJ375: =H375+100*O375 -> 157.80200000000002 | AK375: 154.3 | AL375: 83 | AM375: 53.3 | AN375: 58 | AO375: -6.9999999999999993e-003 | AP375: 20 | AQ375: 国祯转债!!
A376: 375 | B376: 110038 | C376: 济川转债! | D376: 600566 | E376: 济川药业 | F376: 医药 | G376: 中药 | H376: 134.95 | I376: -4.1399999999999999e-002 | J376: 4.0000000000000001e-003 | K376: 23.86 | L376: -8.7899999999999992e-002 | M376: 106 | N376: 23.4 | O376: 0.32299999999999995 | P376: 101.97 | Q376: 已到 | R376: 0.75年 | S376: 回售内 | T376: 6.27 | U376: 121 | V376: 0.14199999999999999 | W376: 2.9999999999999999e-002 | X376: 2.9999999999999999e-002 | Y376: 212 | Z376: 2.47 | AA376: -0.27600000000000002 | AB376: -0.28699999999999998 | AC376: 回售内 | AD376: 回售内 | AE376: 101 | AF376: 103.52 | AG376: 0.43 | AH376: AA | AI376: 3.2199999999999999e-002 | AJ376: =H376+100*O376 -> 167.25 | AK376: 167.9 | AL376: 214 | AM376: 64.4 | AN376: 140 | AO376: -9.1999999999999998e-002 | AP376: 24 | AQ376: 济川转债!
A377: 376 | B377: 113502 | C377: 嘉澳转债! | D377: 603822 | E377: 嘉澳环保 | F377: 化工 | G377: 化工 | H377: 138.46 | I377: -4.4000000000000004e-002 | J377: 1.2199999999999999e-002 | K377: 49.78 | L377: -4.8399999999999999e-002 | M377: 109.8 | N377: 44.64 | O377: 0.24199999999999999 | P377: 111.51 | Q377: 已到 | R377: 1.74年 | S377: 回售内 | T377: 1.84 | U377: 92 | V377: 0.35600000000000004 | W377: 5.0000000000000003e-002 | X377: 5.5999999999999994e-002 | Y377: 37 | Z377: 4.4 | AA377: -0.126 | AB377: -0.13500000000000001 | AC377: 回售内 | AD377: 回售内 | AE377: 100.3 | AF377: 99.72 | AG377: 0.66 | AH377: AA- | AI377: 5.7500000000000002e-002 | AJ377: =H377+100*O377 -> 162.66 | AK377: 165.4 | AL377: 193 | AM377: 65.1 | AN377: 151 | AO377: 4.0000000000000001e-003 | AP377: 32 | AQ377: 嘉澳转债!
A378: 377 | B378: 113016 | C378: 小康转债!! | D378: 601127 | E378: 小康股份 | F378: 汽车 | G378: 零部件制 | H378: 313.97 | I378: -1.9900000000000001e-002 | J378: -2.1600000000000001e-002 | K378: 42.15 | L378: -4.1799999999999997e-002 | M378: 107.8 | N378: 16.96 | O378: 0.26300000000000001 | P378: 248.53 | Q378: 已到 | R378: 1.73年 | S378: 回售内 | T378: 2.07 | U378: 188 | V378: 0.28499999999999998 | W378: 4.0000000000000001e-003 | X378: 9.0000000000000011e-003 | Y378: 573 | Z378: 7.97 | AA378: -0.45600000000000002 | AB378: -0.46000000000000002 | AC378: 回售内 | AD378: 回售内 | AE378: 100.3 | AF378: 97.96 | AG378: 0.99 | AH378: AA- | AI378: 5.7500000000000002e-002 | AJ378: =H378+100*O378 -> 340.27000000000004 | AK378: 379.4 | AL378: 376 | AM378: 279.1 | AN378: 375 | AO378: -0.13200000000000001 | AP378: 32 | AQ378: 小康转债!!
A379: 378 | B379: 128017 | C379: 金禾转债!! | D379: 2597 | E379: 金禾实业 | F379: 化工 | G379: 化工 | H379: 231.88 | I379: -1.1200000000000002e-002 | J379: -2.53e-002 | K379: 40.95 | L379: -3.6900000000000002e-002 | M379: 107.5 | N379: 21.97 | O379: 0.24399999999999999 | P379: 186.39 | Q379: 已到 | R379: 1.72年 | S379: 回售内 | T379: 5.52 | U379: 14 | V379: 1.1000000000000001e-002 | W379: 2.4e-002 | X379: 4.4999999999999998e-002 | Y379: 230 | Z379: 4.42 | AA379: -0.36299999999999999 | AB379: -0.36799999999999999 | AC379: 回售内 | AD379: 回售内 | AE379: 100.25 | AF379: 101.14 | AG379: 0.99 | AH379: AA | AI379: 3.6499999999999998e-002 | AJ379: =H379+100*O379 -> 256.27999999999997 | AK379: 277.4 | AL379: 367 | AM379: 176.2 | AN379: 365 | AO379: -3.2000000000000001e-002 | AP379: 8 | AQ379: 金禾转债!!
A380: 379 | B380: 113013 | C380: 国君转债! | D380: 601211 | E380: 国泰君安 | F380: 金融 | G380: 证券行业 | H380: 128.59 | I380: -3.3e-003 | J380: 2.8000000000000004e-003 | K380: 18.35 | L380: -1.1000000000000001e-003 | M380: 106.8 | N380: 18.45 | O380: 0.29299999999999998 | P380: 99.46 | Q380: 已到 | R380: 1.39年 | S380: 无权 | T380: 69.9 | U380: 93 | V380: 1.e-002 | W380: 4.2999999999999997e-002 | X380: 4.2999999999999997e-002 | Y380: 1634. | Z380: 1.23 | AA380: -0.126 | AB380: -0.13400000000000001 | AC380: 无权 | AD380: 无权 | AE380: 无权 | AF380: 102.61 | AG380: 0.44 | AH380: AAA | AI380: 2.9500000000000002e-002 | AJ380: =H380+100*O380 -> 157.88999999999999 | AK380: 157.7 | AL380: 116 | AM380: 55.1 | AN380: 74 | AO380: 2.1000000000000001e-002 | AP380: 12 | AQ380: 国君转债!
A381: 380 | B381: 128015 | C381: 久其转债!! | D381: 2279 | E381: 久其软件 | F381: 计算机及 | G381: 软件开发 | H381: 114.76 | I381: -1.4000000000000002e-003 | J381: 1.e-004 | K381: 5.03 | L381: -1.5700000000000002e-002 | M381: 109.5 | N381: 6.97 | O381: 0.58999999999999997 | P381: 72.17 | Q381: 已到 | R381: 1.32年 | S381: 回售内 | T381: 7.79 | U381: 12 | V381: 1.3999999999999999e-002 | W381: 0.218 | X381: 0.157 | Y381: 36 | Z381: 4.46 | AA381: -3.5400000000000001e-002 | AB381: -4.82e-002 | AC381: 回售内 | AD381: 回售内 | AE381: 100.25 | AF381: 100.46 | AG381: 0.08 | AH381: A+ | AI381: 6.8499999999999991e-002 | AJ381: =H381+100*O381 -> 173.75999999999999 | AK381: 157.4 | AL381: 112 | AM381: 56.9 | AN381: 83 | AO381: 6.0000000000000001e-003 | AP381: 73 | AQ381: 久其转债!!
A382: 381 | B382: 127004 | C382: 模塑转债!! | D382: 700 | E382: 模塑科技 | F382: 汽车 | G382: 零部件制 | H382: 163.6 | I382: 6.8000000000000005e-003 | J382: -6.8000000000000005e-003 | K382: 4.81 | L382: -1.84e-002 | M382: 111.8 | N382: 7.24 | O382: 1.46 | P382: 66.44 | Q382: 已到 | R382: 1.30年 | S382: 回售内 | T382: 1.31 | U382: 79 | V382: 0.371 | W382: 2.9999999999999999e-002 | X382: 2.e-002 | Y382: 44 | Z382: 1.94 | AA382: -0.25600000000000001 | AB382: -0.26800000000000002 | AC382: 回售内 | AD382: 回售内 | AE382: 100.3 | AF382: 101.26 | AG382: 0 | AH382: AA- | AI382: 5.7500000000000002e-002 | AJ382: =H382+100*O382 -> 309.60000000000002 | AK382: 260.8 | AL382: 359 | AM382: 159.5 | AN382: 359 | AO382: -1.7000000000000001e-002 | AP382: 24 | AQ382: 模塑转债!!
A383: 382 | B383: 128014 | C383: 永东转债! | D383: 2753 | E383: 永东股份 | F383: 化工 | G383: 化工 | H383: 117.888 | I383: -3.0000000000000001e-003 | J383: 1.8e-003 | K383: 8.97 | L383: -2.3900000000000001e-002 | M383: 109.8 | N383: 12.52 | O383: 0.64500000000000002 | P383: 71.65 | Q383: 已到 | R383: 1.17年 | S383: 回售内 | T383: 3.37 | U383: 2.7 | V383: 6.9999999999999993e-003 | W383: 0.10000000000000001 | X383: 7.2000000000000008e-002 | Y383: 34 | Z383: 1.61 | AA383: -5.96e-002 | AB383: -7.3899999999999993e-002 | AC383: 回售内 | AD383: 回售内 | AE383: 100.3 | AF383: 102.93 | AG383: 0.05 | AH383: AA- | AI383: 5.7500000000000002e-002 | AJ383: =H383+100*O383 -> 182.38800000000001 | AK383: 164.1 | AL383: 178 | AM383: 61.2 | AN383: 117 | AO383: -4.5999999999999999e-002 | AP383: 39 | AQ383: 永东转债!
A384: 383 | B384: 113011 | C384: 光大转债 | D384: 601818 | E384: 光大银行 | F384: 金融 | G384: 银行行业 | H384: 114.61 | I384: -5.7999999999999996e-003 | J384: 5.7999999999999996e-003 | K384: 3.48 | L384: 0. | M384: 106.8 | N384: 3.55 | O384: 0.16899999999999998 | P384: 98.03 | Q384: 已到 | R384: 1年32天 | S384: 无权 | T384: 242 | U384: 450 | V384: 1.6e-002 | W384: 0.129 | X384: 0.126 | Y384: 1880. | Z384: 0.52 | AA384: -6.3799999999999996e-002 | AB384: -7.4700000000000003e-002 | AC384: 无权 | AD384: 无权 | AE384: 无权 | AF384: 103.53 | AG384: 0.39 | AH384: AAA | AI384: 2.9500000000000002e-002 | AJ384: =H384+100*O384 -> 131.50999999999999 | AK384: 131.2 | AL384: 4 | AM384: 27.7 | AN384: 2 | AO384: 2.1000000000000001e-002 | AP384: 20 | AQ384: 光大转债
A385: 384 | B385: 128013 | C385: 洪涛转债! | D385: 2325 | E385: 洪涛股份 | F385: 建筑 | G385: 装饰工程 | H385: 122.88 | I385: -9.7999999999999997e-003 | J385: -4.5000000000000005e-003 | K385: 2.68 | L385: -1.83e-002 | M385: 108 | N385: 2.31 | O385: 5.9000000000000004e-002 | P385: 116.02 | Q385: 已到 | R385: 0.45年 | S385: 回售内 | T385: 10.5 | U385: 46 | V385: 3.6000000000000004e-002 | W385: 0.29499999999999998 | X385: 0.34200000000000003 | Y385: 36 | Z385: 1.21 | AA385: -0.247 | AB385: -0.27100000000000002 | AC385: 回售内 | AD385: 回售内 | AE385: 100.33 | AF385: 104.15 | AG385: 0.78 | AH385: A- | AI385: 8.3000000000000004e-002 | AJ385: =H385+100*O385 -> 128.78 | AK385: 129.7 | AL385: 2 | AM385: 25.6 | AN385: 1 | AO385: -1.8000000000000002e-002 | AP385: 100 | AQ385: 洪涛转债!
A386: 385 | B386: 127003 | C386: 海印转债! | D386: 861 | E386: 海印股份 | F386: 商业零售 | G386: 商场 | H386: 117.91 | I386: -5.1000000000000004e-003 | J386: 3.8e-003 | K386: 2.9 | L386: -1.3600000000000001e-002 | M386: 110 | N386: 2.99 | O386: 0.21600000000000003 | P386: 96.99 | Q386: 已到 | R386: 0.32年 | S386: 回售内 | T386: 6.74 | U386: 43 | V386: 5.2999999999999999e-002 | W386: 0.10000000000000001 | X386: 9.6999999999999989e-002 | Y386: 67 | Z386: 1.84 | AA386: -0.19800000000000001 | AB386: -0.24299999999999999 | AC386: 回售内 | AD386: 回售内 | AE386: 100.33 | AF386: 108.95 | AG386: 0.1 | AH386: AA | AI386: 3.1e-002 | AJ386: =H386+100*O386 -> 139.50999999999999 | AK386: 138.8 | AL386: 11 | AM386: 29.9 | AN386: 3 | AO386: -3.0000000000000001e-003 | AP386: 76 | AQ386: 海印转债!