A1: 序号 | B1: 转债代码 | C1: 转债名称 | D1: 股票代码 | E1: 股票名称 | F1: 行业 | G1: 子行业 | H1: 转债价格 | I1: 涨跌 | J1: 日内套利 | K1: 股价 | L1: 涨跌 | M1: 剩余本息 | N1: 转股价格 | O1: 转股溢价率 | P1: 转股价值 | Q1: 距离转股日 | R1: 剩余年限 | S1: 回售年限 | T1: 转债余额 | U1: 转债成交额 | V1: 转债换手率 | W1: 余额/市值 | X1: 余额/股本 | Y1: 股票市值 | Z1: P/B | AA1: 税前收益率 | AB1: 税后收益率 | AC1: 税前回售收益 | AD1: 税后回售收益 | AE1: 回售价值 | AF1: 纯债价值 | AG1: 弹性 | AH1: 信用 | AI1: 折现率 | AJ1: 双低 | AK1: 老式双低 | AL1: 老式排名 | AM1: 新式双低 | AN1: 新式排名 | AO1: MA20乖离 | AP1: 热门度 | AQ1: 转债名称
A2: 1 | B2: 123136 | C2: 城市转债 | D2: 300778 | E2: 新城市 | F2: 建筑 | G2: 建筑工程 | H2: 130.112 | I2: 5.9699999999999996e-002 | J2: -4.1200000000000001e-002 | K2: 21.6 | L2: 2.81e-002 | M2: 120.7 | N2: 21.18 | O2: 0.27600000000000002 | P2: 101.98 | Q2: 5月8天 | R2: 5.92年 | S2: 3.92年 | T2: 4.6 | U2: 176 | V2: 0.29699999999999999 | W2: 0.17000000000000001 | X2: 0.17399999999999999 | Y2: 27 | Z2: 2.71 | AA2: -1.2800000000000001e-002 | AB2: -1.8600000000000002e-002 | AC2: -5.45e-002 | AD2: -5.6100000000000004e-002 | AE2: 81.34 | AF2: 85.3 | AG2: 0.66 | AH2: AA- | AI2: 6.1500000000000006e-002 | AJ2: =H2+100*O2 -> 157.71199999999999 | AK2: 158.2 | AL2: 222 | AM2: 72.9 | AN2: 279 | AO2: 8.5999999999999993e-002 | AP2: 1 | AQ2: 城市转债
A3: 2 | B3: 113053 | C3: 隆22转债 | D3: 601012 | E3: 隆基股份 | F3: 能源电力 | G3: 太阳能 | H3: 124.94 | I3: -3.4999999999999996e-003 | J3: -2.0999999999999999e-003 | K3: 68.55 | L3: -1.37e-002 | M3: 111.2 | N3: 82.65 | O3: 0.50600000000000001 | P3: 82.94 | Q3: 4月22天 | R3: 5.88年 | S3: 3.88年 | T3: 70 | U3: 1693. | V3: 0.19399999999999998 | W3: 1.9e-002 | X3: 1.6e-002 | Y3: 3711. | Z3: 8.06 | AA3: -1.9900000000000001e-002 | AB3: -2.3300000000000001e-002 | AC3: -4.7199999999999999e-002 | AD3: -4.8399999999999999e-002 | AE3: 90.11 | AF3: 91.88 | AG3: 0.41 | AH3: AAA | AI3: 3.3500000000000002e-002 | AJ3: =H3+100*O3 -> 175.53999999999999 | AK3: 166.9 | AL3: 290 | AM3: 75.1 | AN3: 289 | AO3: -6.5000000000000002e-002 | AP3: 5 | AQ3: 隆22转债
A4: 3 | B4: 118004 | C4: 博瑞转债 | D4: 688166 | E4: 博瑞医药 | F4: 医药 | G4: 原料药 | H4: 120.15 | I4: 1.1999999999999999e-003 | J4: 1.6299999999999999e-002 | K4: 29.92 | L4: 3.2799999999999996e-002 | M4: 121 | N4: 35.68 | O4: 0.433 | P4: 83.86 | Q4: 4月21天 | R4: 5.87年 | S4: 3.87年 | T4: 4.65 | U4: 16 | V4: 2.7999999999999997e-002 | W4: 3.7999999999999999e-002 | X4: 3.2000000000000001e-002 | Y4: 123 | Z4: 7.75 | AA4: 1.1999999999999999e-003 | AB4: -4.8999999999999998e-003 | AC4: -3.56e-002 | AD4: -3.73e-002 | AE4: 81.84 | AF4: 85.81 | AG4: 0.53 | AH4: AA- | AI4: 6.1500000000000006e-002 | AJ4: =H4+100*O4 -> 163.44999999999999 | AK4: 156.4 | AL4: 205 | AM4: 70.6 | AN4: 271 | AO4: -5.9999999999999998e-002 | AP4: 2 | AQ4: 博瑞转债
A5: 4 | B5: 113638 | C5: 台21转债 | D5: 603055 | E5: 台华新材 | F5: 服装纺织 | G5: 纺织行业 | H5: 125.12 | I5: 1.1299999999999999e-002 | J5: -1.72e-002 | K5: 14.8 | L5: -1.2699999999999999e-002 | M5: 117.1 | N5: 16.87 | O5: 0.42599999999999999 | P5: 87.73 | Q5: 4月16天 | R5: 5.86年 | S5: 3.86年 | T5: 6 | U5: 9.8 | V5: 1.3000000000000001e-002 | W5: 4.7e-002 | X5: 4.0999999999999995e-002 | Y5: 129 | Z5: 3.59 | AA5: -1.1399999999999999e-002 | AB5: -1.6500000000000001e-002 | AC5: -4.6100000000000002e-002 | AD5: -4.7699999999999992e-002 | AE5: 88.42 | AF5: 93.18 | AG5: 0.46 | AH5: AA | AI5: 4.0500000000000001e-002 | AJ5: =H5+100*O5 -> 167.72 | AK5: 162.5 | AL5: 260 | AM5: 69.3 | AN5: 260 | AO5: -6.6000000000000003e-002 | AP5: 1 | AQ5: 台21转债
A6: 5 | B6: 123135 | C6: 泰林转债 | D6: 300813 | E6: 泰林生物 | F6: 医药 | G6: 医疗器械 | H6: 128.2 | I6: 1.4800000000000001e-002 | J6: -1.7500000000000002e-002 | K6: 72.02 | L6: -4.6999999999999993e-003 | M6: 121.5 | N6: 87.38 | O6: 0.55500000000000005 | P6: 82.42 | Q6: 4月15天 | R6: 5.86年 | S6: 3.86年 | T6: 2.1 | U6: 6.3 | V6: 2.4e-002 | W6: 5.5999999999999994e-002 | X6: 4.5999999999999999e-002 | Y6: 37 | Z6: 7.72 | AA6: -9.300000000000001e-003 | AB6: -1.55e-002 | AC6: -4.9699999999999994e-002 | AD6: -5.1699999999999996e-002 | AE6: 79.26 | AF6: 81.43 | AG6: 0.58 | AH6: A+ | AI6: 7.2499999999999995e-002 | AJ6: =H6+100*O6 -> 183.69999999999999 | AK6: 174 | AL6: 313 | AM6: 92.5 | AN6: 334 | AO6: -5.0000000000000003e-002 | AP6: 2 | AQ6: 泰林转债
A7: 6 | B7: 123134 | C7: 卡倍转债! | D7: 300863 | E7: 卡倍亿 | F7: 汽车 | G7: 零部件制 | H7: 129 | I7: 1.7299999999999999e-002 | J7: -2.0899999999999998e-002 | K7: 72.96 | L7: -6.7000000000000002e-003 | M7: 121 | N7: 92.5 | O7: 0.63500000000000001 | P7: 78.88 | Q7: 4月12天 | R7: 5.85年 | S7: 3.85年 | T7: 2.79 | U7: 13 | V7: 3.7000000000000005e-002 | W7: 6.9000000000000006e-002 | X7: 5.5e-002 | Y7: 40 | Z7: 6.37 | AA7: -1.11e-002 | AB7: -1.7100000000000001e-002 | AC7: -5.28e-002 | AD7: -5.45e-002 | AE7: 78.65 | AF7: 81 | AG7: 0.54 | AH7: A+ | AI7: 7.2499999999999995e-002 | AJ7: =H7+100*O7 -> 192.5 | AK7: 179.1 | AL7: 325 | AM7: 98.1 | AN7: 340 | AO7: -5.0999999999999997e-002 | AP7: 2 | AQ7: 卡倍转债!
A8: 7 | B8: 110084 | C8: 贵燃转债 | D8: 600903 | E8: 贵州燃气 | F8: 石油天然 | G8: 天然气 | H8: 115.74 | I8: 4.8999999999999998e-003 | J8: -4.4000000000000003e-003 | K8: 9.22 | L8: 1.1000000000000001e-003 | M8: 115.1 | N8: 10.17 | O8: 0.27699999999999997 | P8: 90.66 | Q8: 4月12天 | R8: 5.85年 | S8: 3.85年 | T8: 10 | U8: 10 | V8: 9.0000000000000011e-003 | W8: 9.5000000000000001e-002 | X8: 8.5999999999999993e-002 | Y8: 105 | Z8: 3.71 | AA8: -1.e-003 | AB8: -5.6000000000000008e-003 | AC8: -2.7400000000000001e-002 | AD8: -2.8999999999999998e-002 | AE8: 88.44 | AF8: 91.61 | AG8: 0.51 | AH8: AA | AI8: 4.0500000000000001e-002 | AJ8: =H8+100*O8 -> 143.44 | AK8: 140.8 | AL8: 44 | AM8: 49.2 | AN8: 95 | AO8: -1.3000000000000001e-002 | AP8: 4 | AQ8: 贵燃转债
A9: 8 | B9: 113052 | C9: 兴业转债 | D9: 601166 | E9: 兴业银行 | F9: 金融 | G9: 银行行业 | H9: 115.39 | I9: 1.0800000000000001e-002 | J9: 1.8e-003 | K9: 22.89 | L9: 2.6499999999999999e-002 | M9: 114.4 | N9: 25.51 | O9: 0.28600000000000003 | P9: 89.73 | Q9: 4月11天 | R9: 5.85年 | S9: 无权 | T9: 500 | U9: 700 | V9: 1.2e-002 | W9: 0.105 | X9: 9.4e-002 | Y9: 4755. | Z9: 0.82 | AA9: -1.5e-003 | AB9: -5.8999999999999999e-003 | AC9: 无权 | AD9: 无权 | AE9: 无权 | AF9: 94.65 | AG9: 0.47 | AH9: AAA | AI9: 3.3500000000000002e-002 | AJ9: =H9+100*O9 -> 143.99000000000001 | AK9: 141.1 | AL9: 47 | AM9: 46.4 | AN9: 75 | AO9: 5.0000000000000003e-002 | AP9: 10 | AQ9: 兴业转债
A10: 9 | B10: 127052 | C10: 西子转债 | D10: 2534 | E10: 西子洁能 | F10: 机械装备 | G10: 通用设备 | H10: 125.45 | I10: 0. | J10: -9.1999999999999998e-003 | K10: 23.89 | L10: -2.0499999999999997e-002 | M10: 115.1 | N10: 28.08 | O10: 0.47499999999999998 | P10: 85.08 | Q10: 4月11天 | R10: 5.84年 | S10: 3.84年 | T10: 11.1 | U10: 11 | V10: 8.0000000000000002e-003 | W10: 6.3e-002 | X10: 5.2999999999999999e-002 | Y10: 177 | Z10: 5.11 | AA10: -1.49e-002 | AB10: -1.9400000000000001e-002 | AC10: -4.6900000000000004e-002 | AD10: -4.8499999999999995e-002 | AE10: 88.47 | AF10: 91.64 | AG10: 0.45 | AH10: AA | AI10: 4.0500000000000001e-002 | AJ10: =H10+100*O10 -> 172.94999999999999 | AK10: 165.8 | AL10: 286 | AM10: 74.2 | AN10: 286 | AO10: -0.11699999999999999 | AP10: 2 | AQ10: 西子转债
A11: 10 | B11: 113637 | C11: 华翔转债 | D11: 603112 | E11: 华翔股份 | F11: 机械装备 | G11: 专用设备 | H11: 134.75 | I11: 1.06e-002 | J11: -1.78e-002 | K11: 14.83 | L11: -1.e-002 | M11: 121 | N11: 12.99 | O11: 0.17999999999999999 | P11: 114.16 | Q11: 4月9天 | R11: 5.84年 | S11: 3.84年 | T11: 8 | U11: 37 | V11: 3.5000000000000003e-002 | W11: 0.12300000000000001 | X11: 0.14099999999999999 | Y11: 65 | Z11: 3.26 | AA11: -1.8600000000000002e-002 | AB11: -2.4500000000000001e-002 | AC11: -6.3299999999999995e-002 | AD11: -6.5000000000000002e-002 | AE11: 82.01 | AF11: 85.99 | AG11: 0.72 | AH11: AA- | AI11: 6.1500000000000006e-002 | AJ11: =H11+100*O11 -> 152.75 | AK11: 155.3 | AL11: 193 | AM11: 69.3 | AN11: 261 | AO11: 5.2000000000000005e-002 | AP11: 2 | AQ11: 华翔转债
A12: 11 | B12: 123133 | C12: 佩蒂转债 | D12: 300673 | E12: 佩蒂股份 | F12: 食品饮料 | G12: 食品加工 | H12: 123.781 | I12: 0. | J12: 8.5000000000000006e-003 | K12: 17.79 | L12: 1.4800000000000001e-002 | M12: 120.5 | N12: 19.92 | O12: 0.38600000000000001 | P12: 89.31 | Q12: 4月9天 | R12: 5.84年 | S12: 3.84年 | T12: 7.2 | U12: 2.8 | V12: 3.0000000000000001e-003 | W12: 0.16 | X12: 0.14300000000000002 | Y12: 45 | Z12: 2.71 | AA12: -4.6999999999999993e-003 | AB12: -1.06e-002 | AC12: -4.3299999999999998e-002 | AD12: -4.4999999999999998e-002 | AE12: 81.95 | AF12: 85.62 | AG12: 0.57 | AH12: AA- | AI12: 6.1500000000000006e-002 | AJ12: =H12+100*O12 -> 162.381 | AK12: 158.3 | AL12: 223 | AM12: 72.6 | AN12: 278 | AO12: 6.0000000000000001e-003 | AP12: 2 | AQ12: 佩蒂转债
A13: 12 | B13: 123132 | C13: 回盛转债 | D13: 300871 | E13: 回盛生物 | F13: 医药 | G13: 医药行业 | H13: 120.7 | I13: 1.8e-003 | J13: 2.3e-003 | K13: 25.63 | L13: 7.0999999999999995e-003 | M13: 121 | N13: 28.32 | O13: 0.33399999999999996 | P13: 90.5 | Q13: 4月4天 | R13: 5.82年 | S13: 3.82年 | T13: 7 | U13: 6.9 | V13: 8.0000000000000002e-003 | W13: 0.16399999999999998 | X13: 0.14899999999999999 | Y13: 43 | Z13: 2.93 | AA13: 4.0000000000000002e-004 | AB13: -5.6999999999999993e-003 | AC13: -3.7100000000000001e-002 | AD13: -3.8900000000000004e-002 | AE13: 82.08 | AF13: 86.06 | AG13: 0.58 | AH13: AA- | AI13: 6.1500000000000006e-002 | AJ13: =H13+100*O13 -> 154.09999999999999 | AK13: 150.9 | AL13: 148 | AM13: 64.8 | AN13: 227 | AO13: -2.8999999999999998e-002 | AP13: 2 | AQ13: 回盛转债
A14: 13 | B14: 113636 | C14: 甬金转债 | D14: 603995 | E14: 甬金股份 | F14: 钢铁 | G14: 钢铁行业 | H14: 140.03 | I14: 1.6799999999999999e-002 | J14: -8.0000000000000002e-003 | K14: 59.43 | L14: 1.24e-002 | M14: 120.6 | N14: 53.07 | O14: 0.25 | P14: 111.98 | Q14: 3月28天 | R14: 5.81年 | S14: 3.81年 | T14: 10 | U14: 20 | V14: 1.3999999999999999e-002 | W14: 7.2000000000000008e-002 | X14: 8.1000000000000003e-002 | Y14: 139 | Z14: 4.03 | AA14: -2.58e-002 | AB14: -3.1600000000000003e-002 | AC14: -7.3499999999999996e-002 | AD14: -7.4999999999999997e-002 | AE14: 81.78 | AF14: 85.76 | AG14: 0.71 | AH14: AA- | AI14: 6.1500000000000006e-002 | AJ14: =H14+100*O14 -> 165.03 | AK14: 168.1 | AL14: 296 | AM14: 82.3 | AN14: 317 | AO14: 2.7000000000000003e-002 | AP14: 2 | AQ14: 甬金转债
A15: 14 | B15: 113635 | C15: 升21转债 | D15: 603305 | E15: 旭升股份 | F15: 汽车 | G15: 零部件制 | H15: 127.19 | I15: 1.2699999999999999e-002 | J15: -9.8999999999999991e-003 | K15: 41.33 | L15: 4.8999999999999998e-003 | M15: 119.6 | N15: 46.37 | O15: 0.42700000000000005 | P15: 89.13 | Q15: 3月27天 | R15: 5.81年 | S15: 3.81年 | T15: 13.5 | U15: 12 | V15: 6.9999999999999993e-003 | W15: 7.2999999999999995e-002 | X15: 6.5000000000000002e-002 | Y15: 185 | Z15: 5.27 | AA15: -1.0700000000000001e-002 | AB15: -1.6399999999999998e-002 | AC15: -5.1299999999999998e-002 | AD15: -5.2699999999999997e-002 | AE15: 81.7 | AF15: 85.07 | AG15: 0.57 | AH15: AA- | AI15: 6.1500000000000006e-002 | AJ15: =H15+100*O15 -> 169.88999999999999 | AK15: 165.2 | AL15: 281 | AM15: 80.2 | AN15: 312 | AO15: -6.9000000000000006e-002 | AP15: 3 | AQ15: 升21转债
A16: 15 | B16: 111002 | C16: 特纸转债 | D16: 605007 | E16: 五洲特纸 | F16: 造纸包装 | G16: 包装用纸 | H16: 151.23 | I16: 0. | J16: -1.8000000000000002e-002 | K16: 22.21 | L16: -2.5000000000000001e-002 | M16: 117.1 | N16: 18.5 | O16: 0.26000000000000001 | P16: 120.05 | Q16: 3月25天 | R16: 5.80年 | S16: 3.80年 | T16: 6.7 | U16: 19 | V16: 1.9e-002 | W16: 7.4999999999999997e-002 | X16: 9.0999999999999998e-002 | Y16: 89 | Z16: 4.72 | AA16: -4.3799999999999999e-002 | AB16: -4.8600000000000004e-002 | AC16: -9.1499999999999998e-002 | AD16: -9.3000000000000013e-002 | AE16: 88.62 | AF16: 93.39 | AG16: 0.72 | AH16: AA | AI16: 4.0500000000000001e-002 | AJ16: =H16+100*O16 -> 177.22999999999999 | AK16: 182.4 | AL16: 330 | AM16: 89 | AN16: 331 | AO16: 9.0000000000000011e-003 | AP16: 2 | AQ16: 特纸转债
A17: 16 | B17: 113634 | C17: 珀莱转债 | D17: 603605 | E17: 珀莱雅 | F17: 化工 | G17: 日化 | H17: 126.5 | I17: 2.5000000000000001e-003 | J17: 2.5999999999999999e-003 | K17: 188.7 | L17: 9.5999999999999992e-003 | M17: 120.1 | N17: 195.98 | O17: 0.314 | P17: 96.29 | Q17: 3月25天 | R17: 5.80年 | S17: 3.80年 | T17: 7.52 | U17: 12 | V17: 1.3000000000000001e-002 | W17: 2.e-002 | X17: 1.9e-002 | Y17: 379 | Z17: 14.51 | AA17: -9.1000000000000004e-003 | AB17: -1.49e-002 | AC17: -4.9400000000000006e-002 | AD17: -5.0999999999999997e-002 | AE17: 88.62 | AF17: 95.77 | AG17: 0.52 | AH17: AA | AI17: 4.0500000000000001e-002 | AJ17: =H17+100*O17 -> 157.90000000000001 | AK17: 156.7 | AL17: 208 | AM17: 60.9 | AN17: 194 | AO17: 7.2999999999999995e-002 | AP17: 5 | AQ17: 珀莱转债
A18: 17 | B18: 123131 | C18: 奥飞转债 | D18: 300738 | E18: 奥飞数据 | F18: 通信互联 | G18: 通信设备 | H18: 136.52 | I18: 6.5599999999999992e-002 | J18: 6.08e-002 | K18: 24.27 | L18: 0.17399999999999999 | M18: 121.7 | N18: 22.02 | O18: 0.23899999999999999 | P18: 110.22 | Q18: 3月20天 | R18: 5.79年 | S18: 3.79年 | T18: 6.35 | U18: 2533. | V18: 2.8799999999999999 | W18: 6.9000000000000006e-002 | X18: 7.5999999999999998e-002 | Y18: 93 | Z18: 6.58 | AA18: -2.0099999999999996e-002 | AB18: -2.6200000000000001e-002 | AC18: -6.5700000000000008e-002 | AD18: -6.7699999999999996e-002 | AE18: 79.59 | AF18: 81.95 | AG18: 0.73 | AH18: A+ | AI18: 7.2499999999999995e-002 | AJ18: =H18+100*O18 -> 160.42000000000002 | AK18: 162.8 | AL18: 263 | AM18: 80.9 | AN18: 314 | AO18: 6.3e-002 | AP18: 3 | AQ18: 奥飞转债
A19: 18 | B19: 113633 | C19: 科沃转债! | D19: 603486 | E19: 科沃斯 | F19: 机械装备 | G19: 机器人及 | H19: 119.58 | I19: -3.5999999999999999e-003 | J19: 2.0000000000000001e-004 | K19: 131.14 | L19: -1.0500000000000001e-002 | M19: 115.1 | N19: 178.13 | O19: 0.624 | P19: 73.62 | Q19: 3月17天 | R19: 5.78年 | S19: 3.78年 | T19: 10.4 | U19: 27 | V19: 2.2000000000000002e-002 | W19: 1.3999999999999999e-002 | X19: 1.e-002 | Y19: 753 | Z19: 17.77 | AA19: -6.7000000000000002e-003 | AB19: -1.1299999999999999e-002 | AC19: -3.6000000000000004e-002 | AD19: -3.7599999999999995e-002 | AE19: 88.7 | AF19: 91.88 | AG19: 0.33 | AH19: AA | AI19: 4.0500000000000001e-002 | AJ19: =H19+100*O19 -> 181.97999999999999 | AK19: 165.5 | AL19: 285 | AM19: 73.7 | AN19: 284 | AO19: -1.7000000000000001e-002 | AP19: 7 | AQ19: 科沃转债!
A20: 19 | B20: 118003 | C20: 华兴转债 | D20: 688001 | E20: 华兴源创 | F20: 机械装备 | G20: 专用设备 | H20: 121.45 | I20: 2.0000000000000001e-004 | J20: -1.e-003 | K20: 33.48 | L20: -1.8e-003 | M20: 115.1 | N20: 39.33 | O20: 0.42700000000000005 | P20: 85.13 | Q20: 3月14天 | R20: 5.78年 | S20: 3.78年 | T20: 8 | U20: 2.1 | V20: 2.e-003 | W20: 5.4000000000000006e-002 | X20: 4.5999999999999999e-002 | Y20: 147 | Z20: 4.33 | AA20: -9.3999999999999986e-003 | AB20: -1.3999999999999999e-002 | AC20: -3.9800000000000002e-002 | AD20: -4.1399999999999999e-002 | AE20: 88.71 | AF20: 91.89 | AG20: 0.45 | AH20: AA | AI20: 4.0500000000000001e-002 | AJ20: =H20+100*O20 -> 164.15000000000001 | AK20: 157.8 | AL20: 217 | AM20: 65.9 | AN20: 236 | AO20: -3.9e-002 | AP20: 3 | AQ20: 华兴转债
A21: 20 | B21: 127051 | C21: 博杰转债 | D21: 2975 | E21: 博杰股份 | F21: 机械装备 | G21: 机器人及 | H21: 119.9 | I21: 0. | J21: 7.000000000000001e-004 | K21: 54.77 | L21: 1.2999999999999999e-003 | M21: 121.1 | N21: 62.17 | O21: 0.36099999999999999 | P21: 88.1 | Q21: 3月3天 | R21: 5.74年 | S21: 4.74年 | T21: 5.26 | U21: 26 | V21: 4.0999999999999995e-002 | W21: 6.9000000000000006e-002 | X21: 6.0999999999999999e-002 | Y21: 77 | Z21: 5.16 | AA21: 1.8e-003 | AB21: -4.5000000000000005e-003 | AC21: -2.4e-002 | AD21: -2.64e-002 | AE21: 79.9 | AF21: 86.57 | AG21: 0.55 | AH21: AA- | AI21: 6.1500000000000006e-002 | AJ21: =H21+100*O21 -> 156. | AK21: 151.7 | AL21: 162 | AM21: 65.1 | AN21: 229 | AO21: -5.7000000000000002e-002 | AP21: 3 | AQ21: 博杰转债
A22: 21 | B22: 113632 | C22: 鹤21转债 | D22: 603733 | E22: 仙鹤股份 | F22: 造纸包装 | G22: 造纸行业 | H22: 120.66 | I22: 6.0999999999999995e-003 | J22: -6.4000000000000003e-003 | K22: 30.2 | L22: -1.e-003 | M22: 117.1 | N22: 39.09 | O22: 0.56200000000000006 | P22: 77.26 | Q22: 3月3天 | R22: 5.74年 | S22: 3.74年 | T22: 20.5 | U22: 4.4 | V22: 2.e-003 | W22: 9.6000000000000002e-002 | X22: 7.400000000000001e-002 | Y22: 213 | Z22: 3.53 | AA22: -5.3e-003 | AB22: -1.0500000000000001e-002 | AC22: -3.85e-002 | AD22: -4.0199999999999993e-002 | AE22: 88.82 | AF22: 93.61 | AG22: 0.34 | AH22: AA | AI22: 4.0500000000000001e-002 | AJ22: =H22+100*O22 -> 176.86000000000001 | AK22: 164.1 | AL22: 271 | AM22: 70.5 | AN22: 267 | AO22: -0.12300000000000001 | AP22: 2 | AQ22: 鹤21转债
A23: 22 | B23: 127050 | C23: 麒麟转债 | D23: 2984 | E23: 森麒麟 | F23: 汽车 | G23: 零部件制 | H23: 131.5 | I23: -5.1000000000000004e-003 | J23: -1.3999999999999999e-002 | K23: 33.4 | L23: -3.4700000000000002e-002 | M23: 115.1 | N23: 34.85 | O23: 0.37200000000000005 | P23: 95.84 | Q23: 2月27天 | R23: 5.73年 | S23: 3.73年 | T23: 22 | U23: 12 | V23: 4.0000000000000001e-003 | W23: 0.10099999999999999 | X23: 9.6999999999999989e-002 | Y23: 217 | Z23: 3.47 | AA23: -2.3399999999999997e-002 | AB23: -2.7900000000000001e-002 | AC23: -5.9800000000000006e-002 | AD23: -6.1399999999999996e-002 | AE23: 88.88 | AF23: 92.07 | AG23: 0.55 | AH23: AA | AI23: 4.0500000000000001e-002 | AJ23: =H23+100*O23 -> 168.69999999999999 | AK23: 167.2 | AL23: 293 | AM23: 75.1 | AN23: 290 | AO23: 4.8000000000000001e-002 | AP23: 3 | AQ23: 麒麟转债
A24: 23 | B24: 110083 | C24: 苏租转债 | D24: 600901 | E24: 江苏租赁 | F24: 金融 | G24: 其他 | H24: 118.31 | I24: 1.09e-002 | J24: -8.6999999999999994e-003 | K24: 5.15 | L24: 3.9000000000000003e-003 | M24: 110.5 | N24: 5.42 | O24: 0.245 | P24: 95.02 | Q24: 2月27天 | R24: 5.73年 | S24: 无权 | T24: 50 | U24: 15 | V24: 3.0000000000000001e-003 | W24: 0.32500000000000001 | X24: 0.309 | Y24: 154 | Z24: 1.12 | AA24: -1.2e-002 | AB24: -1.5300000000000001e-002 | AC24: 无权 | AD24: 无权 | AE24: 无权 | AF24: 91.71 | AG24: 0.54 | AH24: AAA | AI24: 3.3500000000000002e-002 | AJ24: =H24+100*O24 -> 142.81 | AK24: 141.6 | AL24: 51 | AM24: 49.9 | AN24: 101 | AO24: 9.0000000000000011e-003 | AP24: 6 | AQ24: 苏租转债
A25: 24 | B25: 123130 | C25: 设研转债 | D25: 300732 | E25: 设研院 | F25: 建筑 | G25: 建筑工程 | H25: 165.234 | I25: 1.4000000000000002e-003 | J25: -9.8999999999999991e-003 | K25: 16.92 | L25: -9.8999999999999991e-003 | M25: 117.1 | N25: 11.22 | O25: 9.6000000000000002e-002 | P25: 150.8 | Q25: 2月27天 | R25: 5.73年 | S25: 3.73年 | T25: 3.76 | U25: 1044. | V25: 1.6899999999999999 | W25: 8.1000000000000003e-002 | X25: 0.122 | Y25: 46 | Z25: 1.84 | AA25: -5.9299999999999999e-002 | AB25: -6.4000000000000001e-002 | AC25: -0.11 | AD25: -0.111 | AE25: 88.88 | AF25: 93.67 | AG25: 0.86 | AH25: AA | AI25: 4.0500000000000001e-002 | AJ25: =H25+100*O25 -> 174.834 | AK25: 179.7 | AL25: 326 | AM25: 86 | AN25: 326 | AO25: 0.114 | AP25: 3 | AQ25: 设研转债
A26: 25 | B26: 111001 | C26: 山玻转债 | D26: 605006 | E26: 山东玻纤 | F26: 其他 | G26: 非金属矿 | H26: 120.33 | I26: 1.1999999999999999e-003 | J26: 3.0000000000000001e-003 | K26: 12.62 | L26: 7.1999999999999998e-003 | M26: 120.1 | N26: 13.91 | O26: 0.32600000000000001 | P26: 90.73 | Q26: 2月22天 | R26: 5.72年 | S26: 3.72年 | T26: 6 | U26: 1.6 | V26: 2.e-003 | W26: 9.5000000000000001e-002 | X26: 8.5999999999999993e-002 | Y26: 63 | Z26: 2.93 | AA26: -2.9999999999999997e-004 | AB26: -6.4000000000000003e-003 | AC26: -3.8100000000000002e-002 | AD26: -3.9800000000000002e-002 | AE26: 82.33 | AF26: 85.9 | AG26: 0.58 | AH26: AA- | AI26: 6.1500000000000006e-002 | AJ26: =H26+100*O26 -> 152.93000000000001 | AK26: 149.9 | AL26: 138 | AM26: 64 | AN26: 218 | AO26: 6.9999999999999993e-003 | AP26: 3 | AQ26: 山玻转债
A27: 26 | B27: 113631 | C27: 皖天转债 | D27: 603689 | E27: 皖天然气 | F27: 石油天然 | G27: 天然气 | H27: 119.82 | I27: -5.9999999999999995e-004 | J27: 3.0000000000000001e-003 | K27: 10.16 | L27: 4.8999999999999998e-003 | M27: 114.5 | N27: 11.12 | O27: 0.311 | P27: 91.37 | Q27: 2月22天 | R27: 5.72年 | S27: 3.72年 | T27: 9.3 | U27: 1.4 | V27: 1.e-003 | W27: 0.27200000000000002 | X27: 0.249 | Y27: 34 | Z27: 1.39 | AA27: -8.0000000000000002e-003 | AB27: -1.2500000000000001e-002 | AC27: -3.8399999999999997e-002 | AD27: -3.9800000000000002e-002 | AE27: 90.02 | AF27: 94.07 | AG27: 0.49 | AH27: AA+ | AI27: 3.5499999999999997e-002 | AJ27: =H27+100*O27 -> 150.91999999999999 | AK27: 148.3 | AL27: 119 | AM27: 54.2 | AN27: 137 | AO27: 6.0000000000000001e-003 | AP27: 3 | AQ27: 皖天转债
A28: 27 | B28: 123129 | C28: 锦鸡转债 | D28: 300798 | E28: 锦鸡股份 | F28: 化工 | G28: 其他 | H28: 119.7 | I28: 4.5000000000000005e-003 | J28: -4.5000000000000005e-003 | K28: 9.05 | L28: 0. | M28: 117.8 | N28: 9.53 | O28: 0.26000000000000001 | P28: 94.96 | Q28: 2月20天 | R28: 5.71年 | S28: 3.71年 | T28: 6 | U28: 1.6 | V28: 2.e-003 | W28: 0.159 | X28: 0.151 | Y28: 38 | Z28: 3.02 | AA28: -2.8999999999999998e-003 | AB28: -8.3000000000000001e-003 | AC28: -3.6200000000000003e-002 | AD28: -3.7999999999999999e-002 | AE28: 82.63 | AF28: 84.38 | AG28: 0.62 | AH28: AA- | AI28: 6.1500000000000006e-002 | AJ28: =H28+100*O28 -> 145.69999999999999 | AK28: 144.4 | AL28: 75 | AM28: 60.1 | AN28: 186 | AO28: -1.3000000000000001e-002 | AP28: 4 | AQ28: 锦鸡转债
A29: 28 | B29: 127049 | C29: 希望转2 | D29: 876 | E29: 新 希 望 | F29: 农业 | G29: 畜牧业 | H29: 135.939 | I29: 1.5800000000000002e-002 | J29: -1.5800000000000002e-002 | K29: 16.38 | L29: 0. | M29: 111.2 | N29: 14.45 | O29: 0.19899999999999998 | P29: 113.36 | Q29: 2月18天 | R29: 5.70年 | S29: 3.70年 | T29: 81.5 | U29: 141 | V29: 1.3000000000000001e-002 | W29: 0.11 | X29: 0.125 | Y29: 738 | Z29: 2.42 | AA29: -3.5099999999999999e-002 | AB29: -3.85e-002 | AC29: -6.9900000000000004e-002 | AD29: -7.1199999999999999e-002 | AE29: 90.63 | AF29: 92.41 | AG29: 0.69 | AH29: AAA | AI29: 3.3500000000000002e-002 | AJ29: =H29+100*O29 -> 155.839 | AK29: 158.5 | AL29: 227 | AM29: 66.1 | AN29: 237 | AO29: -2.e-003 | AP29: 9 | AQ29: 希望转2
A30: 29 | B30: 123128 | C30: 首华转债! | D30: 300483 | E30: 首华燃气 | F30: 石油天然 | G30: 天然气 | H30: 108.1 | I30: 1.0200000000000001e-002 | J30: -8.8999999999999999e-003 | K30: 15.15 | L30: 6.6e-003 | M30: 115.1 | N30: 25.02 | O30: 0.78500000000000003 | P30: 60.55 | Q30: 2月15天 | R30: 5.70年 | S30: 3.70年 | T30: 13.8 | U30: 15 | V30: 1.e-002 | W30: 0.33899999999999997 | X30: 0.20499999999999999 | Y30: 41 | Z30: 1.45 | AA30: 1.1299999999999999e-002 | AB30: 6.5000000000000006e-003 | AC30: -1.1000000000000001e-002 | AD30: -1.2800000000000001e-002 | AE30: 88.98 | AF30: 92.17 | AG30: 0.19 | AH30: AA | AI30: 4.0500000000000001e-002 | AJ30: =H30+100*O30 -> 186.59999999999999 | AK30: 155.6 | AL30: 198 | AM30: 63.5 | AN30: 212 | AO30: 3.0000000000000001e-003 | AP30: 12 | AQ30: 首华转债!
A31: 30 | B31: 123127 | C31: 耐普转债 | D31: 300818 | E31: 耐普矿机 | F31: 机械装备 | G31: 专用设备 | H31: 132.3 | I31: 8.5000000000000006e-003 | J31: -8.0000000000000004e-004 | K31: 43.01 | L31: 9.8999999999999991e-003 | M31: 116.2 | N31: 37 | O31: 0.13800000000000001 | P31: 116.24 | Q31: 2月14天 | R31: 5.69年 | S31: 3.69年 | T31: 4 | U31: 33 | V31: 6.3e-002 | W31: 0.13300000000000001 | X31: 0.154 | Y31: 30 | Z31: 3.2 | AA31: -2.3e-002 | AB31: -2.7799999999999998e-002 | AC31: -6.0299999999999999e-002 | AD31: -6.2300000000000001e-002 | AE31: 79.84 | AF31: 78.73 | AG31: 0.78 | AH31: A+ | AI31: 7.2499999999999995e-002 | AJ31: =H31+100*O31 -> 146.10000000000002 | AK31: 148.4 | AL31: 120 | AM31: 68.5 | AN31: 253 | AO31: 1.3999999999999999e-002 | AP31: 5 | AQ31: 耐普转债
A32: 31 | B32: 110082 | C32: 宏发转债 | D32: 600885 | E32: 宏发股份 | F32: 能源电力 | G32: 电力设备 | H32: 125.06 | I32: 4.0000000000000002e-004 | J32: -7.000000000000001e-004 | K32: 63.6 | L32: -5.9999999999999995e-004 | M32: 117.1 | N32: 72.28 | O32: 0.42100000000000004 | P32: 87.99 | Q32: 2月13天 | R32: 5.69年 | S32: 3.69年 | T32: 20 | U32: 12 | V32: 5.0000000000000001e-003 | W32: 4.2000000000000003e-002 | X32: 3.7000000000000005e-002 | Y32: 474 | Z32: 7.79 | AA32: -1.1699999999999999e-002 | AB32: -1.6899999999999998e-002 | AC32: -4.8000000000000001e-002 | AD32: -4.9699999999999994e-002 | AE32: 89.02 | AF32: 93.81 | AG32: 0.46 | AH32: AA | AI32: 4.0500000000000001e-002 | AJ32: =H32+100*O32 -> 167.16 | AK32: 162.1 | AL32: 256 | AM32: 68.3 | AN32: 251 | AO32: -1.3000000000000001e-002 | AP32: 5 | AQ32: 宏发转债
A33: 32 | B33: 113630 | C33: 赛伍转债! | D33: 603212 | E33: 赛伍技术 | F33: 能源电力 | G33: 太阳能 | H33: 121.68 | I33: -8.0000000000000004e-004 | J33: -7.9000000000000008e-003 | K33: 25.69 | L33: -1.9099999999999999e-002 | M33: 120.5 | N33: 32.9 | O33: 0.55799999999999994 | P33: 78.09 | Q33: 2月12天 | R33: 5.69年 | S33: 3.69年 | T33: 7 | U33: 12 | V33: 1.3999999999999999e-002 | W33: 6.7000000000000004e-002 | X33: 5.2999999999999999e-002 | Y33: 104 | Z33: 5.16 | AA33: -1.7000000000000001e-003 | AB33: -7.9000000000000008e-003 | AC33: -4.07e-002 | AD33: -4.2500000000000003e-002 | AE33: 82.7 | AF33: 86.4 | AG33: 0.46 | AH33: AA- | AI33: 6.1500000000000006e-002 | AJ33: =H33+100*O33 -> 177.48000000000002 | AK33: 165.3 | AL33: 282 | AM33: 78.9 | AN33: 308 | AO33: -2.7000000000000003e-002 | AP33: 4 | AQ33: 赛伍转债!
A34: 33 | B34: 127048 | C34: 中大转债 | D34: 2896 | E34: 中大力德 | F34: 机械装备 | G34: 通用设备 | H34: 124.88 | I34: 8.1000000000000013e-003 | J34: -8.1000000000000013e-003 | K34: 21.8 | L34: 0. | M34: 121.7 | N34: 22.1 | O34: 0.26600000000000001 | P34: 98.64 | Q34: 2月11天 | R34: 5.68年 | S34: 3.68年 | T34: 2.7 | U34: 4.7 | V34: 1.3999999999999999e-002 | W34: 0.11900000000000001 | X34: 0.11699999999999999 | Y34: 23 | Z34: 3.11 | AA34: -4.5999999999999999e-003 | AB34: -1.11e-002 | AC34: -4.5400000000000003e-002 | AD34: -4.7500000000000001e-002 | AE34: 80.17 | AF34: 82.54 | AG34: 0.66 | AH34: A+ | AI34: 7.2499999999999995e-002 | AJ34: =H34+100*O34 -> 151.47999999999999 | AK34: 151.1 | AL34: 152 | AM34: 68.6 | AN34: 254 | AO34: -1.9e-002 | AP34: 4 | AQ34: 中大转债
A35: 34 | B35: 127047 | C35: 帝欧转债 | D35: 2798 | E35: 帝欧家居 | F35: 其他 | G35: 家居用品 | H35: 121.8 | I35: 1.04e-002 | J35: -8.8999999999999999e-003 | K35: 13.14 | L35: 2.3e-003 | M35: 120.4 | N35: 13.53 | O35: 0.254 | P35: 97.12 | Q35: 2月9天 | R35: 5.68年 | S35: 3.68年 | T35: 15 | U35: 6.8 | V35: 4.0000000000000001e-003 | W35: 0.29499999999999998 | X35: 0.28699999999999998 | Y35: 51 | Z35: 1.11 | AA35: -2.0999999999999999e-003 | AB35: -8.199999999999999e-003 | AC35: -4.1200000000000001e-002 | AD35: -4.2900000000000001e-002 | AE35: 82.62 | AF35: 86.33 | AG35: 0.62 | AH35: AA- | AI35: 6.1500000000000006e-002 | AJ35: =H35+100*O35 -> 147.19999999999999 | AK35: 146.5 | AL35: 100 | AM35: 60.2 | AN35: 188 | AO35: -3.6000000000000004e-002 | AP35: 5 | AQ35: 帝欧转债
A36: 35 | B36: 127046 | C36: 百润转债! | D36: 2568 | E36: 百润股份 | F36: 食品饮料 | G36: 葡萄酒洋 | H36: 119.602 | I36: 2.9999999999999997e-004 | J36: -3.2000000000000002e-003 | K36: 45.72 | L36: -1.15e-002 | M36: 115.1 | N36: 66.83 | O36: 0.748 | P36: 68.41 | Q36: 52天 | R36: 5.61年 | S36: 3.61年 | T36: 11.3 | U36: 3.3 | V36: 2.e-003 | W36: 3.3000000000000002e-002 | X36: 2.2000000000000002e-002 | Y36: 343 | Z36: 9.76 | AA36: -6.8999999999999999e-003 | AB36: -1.1699999999999999e-002 | AC36: -3.7599999999999995e-002 | AD36: -3.9300000000000002e-002 | AE36: 89.3 | AF36: 92.5 | AG36: 0.25 | AH36: AA | AI36: 4.0500000000000001e-002 | AJ36: =H36+100*O36 -> 194.40199999999999 | AK36: 170.8 | AL36: 305 | AM36: 78.3 | AN36: 305 | AO36: -4.0000000000000001e-003 | AP36: 5 | AQ36: 百润转债!
A37: 36 | B37: 113629 | C37: 泉峰转债 | D37: 603982 | E37: 泉峰汽车 | F37: 汽车 | G37: 零部件制 | H37: 149.87 | I37: 1.0500000000000001e-002 | J37: -1.66e-002 | K37: 30.13 | L37: -7.9000000000000008e-003 | M37: 121 | N37: 23.03 | O37: 0.14599999999999999 | P37: 130.83 | Q37: 31天 | R37: 5.57年 | S37: 3.57年 | T37: 6.2 | U37: 136 | V37: 0.14599999999999999 | W37: 0.10199999999999999 | X37: 0.13400000000000001 | Y37: 61 | Z37: 3.65 | AA37: -3.8399999999999997e-002 | AB37: -4.4400000000000002e-002 | AC37: -9.4200000000000006e-002 | AD37: -9.5799999999999996e-002 | AE37: 83.35 | AF37: 87.39 | AG37: 0.78 | AH37: AA- | AI37: 6.1500000000000006e-002 | AJ37: =H37+100*O37 -> 164.47 | AK37: 168.9 | AL37: 300 | AM37: 81.5 | AN37: 316 | AO37: -9.4e-002 | AP37: 6 | AQ37: 泉峰转债
A38: 37 | B38: 123126 | C38: 瑞丰转债! | D38: 300243 | E38: 瑞丰高材 | F38: 化工 | G38: 橡胶塑料 | H38: 115.099 | I38: -2.7000000000000001e-003 | J38: 5.7999999999999996e-003 | K38: 12.38 | L38: 8.1000000000000013e-003 | M38: 129.6 | N38: 17.8 | O38: 0.65500000000000003 | P38: 69.55 | Q38: 25天 | R38: 5.56年 | S38: 3.56年 | T38: 3.4 | U38: 6.2 | V38: 1.6e-002 | W38: 0.11800000000000001 | X38: 8.199999999999999e-002 | Y38: 29 | Z38: 3.54 | AA38: 2.2200000000000001e-002 | AB38: 1.34e-002 | AC38: -2.0400000000000001e-002 | AD38: -2.3700000000000002e-002 | AE38: 82.54 | AF38: 88.92 | AG38: 0.38 | AH38: A+ | AI38: 7.2499999999999995e-002 | AJ38: =H38+100*O38 -> 180.59899999999999 | AK38: 160.6 | AL38: 241 | AM38: 71.7 | AN38: 276 | AO38: -1.3000000000000001e-002 | AP38: 9 | AQ38: 瑞丰转债!
A39: 38 | B39: 123125 | C39: 元力转债 | D39: 300174 | E39: 元力股份 | F39: 化工 | G39: 化工 | H39: 116 | I39: 8.6999999999999994e-003 | J39: -7.9000000000000008e-003 | K39: 14.94 | L39: 1.2999999999999999e-003 | M39: 109.3 | N39: 17.61 | O39: 0.36700000000000005 | P39: 84.84 | Q39: 19天 | R39: 5.55年 | S39: 3.55年 | T39: 9 | U39: 5.9 | V39: 6.0000000000000001e-003 | W39: 0.193 | X39: 0.16399999999999998 | Y39: 47 | Z39: 2.66 | AA39: -1.0800000000000001e-002 | AB39: -1.3899999999999999e-002 | AC39: -3.2199999999999999e-002 | AD39: -3.3599999999999998e-002 | AE39: 82.47 | AF39: 78.9 | AG39: 0.57 | AH39: AA- | AI39: 6.1500000000000006e-002 | AJ39: =H39+100*O39 -> 152.69999999999999 | AK39: 147.2 | AL39: 106 | AM39: 64.7 | AN39: 225 | AO39: -2.2000000000000002e-002 | AP39: 5 | AQ39: 元力转债
A40: 39 | B40: 113628 | C40: 晨丰转债 | D40: 603685 | E40: 晨丰科技 | F40: 能源电力 | G40: 电力设备 | H40: 115.66 | I40: 2.8000000000000004e-003 | J40: 5.9999999999999995e-004 | K40: 11.54 | L40: 5.1999999999999998e-003 | M40: 121.7 | N40: 13.06 | O40: 0.309 | P40: 88.36 | Q40: 8天 | R40: 5.51年 | S40: 3.51年 | T40: 4.15 | U40: 3.6 | V40: 6.9999999999999993e-003 | W40: 0.21299999999999999 | X40: 0.188 | Y40: 20 | Z40: 1.73 | AA40: 9.4999999999999998e-003 | AB40: 2.7000000000000001e-003 | AC40: -2.7200000000000002e-002 | AD40: -2.9500000000000002e-002 | AE40: 78.47 | AF40: 79.5 | AG40: 0.64 | AH40: A | AI40: 8.2500000000000004e-002 | AJ40: =H40+100*O40 -> 146.56 | AK40: 143 | AL40: 65 | AM40: 63.5 | AN40: 211 | AO40: -1.7000000000000001e-002 | AP40: 10 | AQ40: 晨丰转债
A41: 40 | B41: 123124 | C41: 晶瑞转2! | D41: 300655 | E41: 晶瑞电材 | F41: 电子 | G41: 电子行业 | H41: 117.09 | I41: 1.1000000000000001e-003 | J41: -8.5000000000000006e-003 | K41: 34.72 | L41: -1.7500000000000002e-002 | M41: 111.2 | N41: 50.16 | O41: 0.69200000000000006 | P41: 69.22 | Q41: 1.5天 | R41: 5.49年 | S41: 3.49年 | T41: 5.23 | U41: 6.5 | V41: 1.1000000000000001e-002 | W41: 4.2999999999999997e-002 | X41: 2.9999999999999999e-002 | Y41: 120 | Z41: 8.15 | AA41: -9.4999999999999998e-003 | AB41: -1.32e-002 | AC41: -3.5400000000000001e-002 | AD41: -3.6699999999999997e-002 | AE41: 79.63 | AF41: 76.16 | AG41: 0.42 | AH41: A+ | AI41: 7.2499999999999995e-002 | AJ41: =H41+100*O41 -> 186.29000000000002 | AK41: 165 | AL41: 277 | AM41: 85.3 | AN41: 325 | AO41: -1.7000000000000001e-002 | AP41: 7 | AQ41: 晶瑞转2!
A42: 41 | B42: 127044 | C42: 蒙娜转债! | D42: 2918 | E42: 蒙娜丽莎 | F42: 建筑 | G42: 其他建材 | H42: 125.81 | I42: 2.2099999999999998e-002 | J42: -2.1499999999999998e-002 | K42: 23.09 | L42: 1.2999999999999999e-003 | M42: 117.1 | N42: 26.92 | O42: 0.46700000000000003 | P42: 85.77 | Q42: 2.5天 | R42: 5.49年 | S42: 3.49年 | T42: 11.7 | U42: 37 | V42: 2.5000000000000001e-002 | W42: 0.121 | X42: 0.10400000000000001 | Y42: 97 | Z42: 2.57 | AA42: -1.32e-002 | AB42: -1.8600000000000002e-002 | AC42: -5.2199999999999996e-002 | AD42: -5.3899999999999997e-002 | AE42: 89.73 | AF42: 94.56 | AG42: 0.42 | AH42: AA | AI42: 4.0500000000000001e-002 | AJ42: =H42+100*O42 -> 172.50999999999999 | AK42: 165.8 | AL42: 287 | AM42: 71.3 | AN42: 273 | AO42: -5.9000000000000004e-002 | AP42: 3 | AQ42: 蒙娜转债!
A43: 42 | B43: 127045 | C43: 牧原转债 | D43: 2714 | E43: 牧原股份 | F43: 农业 | G43: 畜牧业 | H43: 141 | I43: 6.8000000000000005e-003 | J43: -1.7000000000000001e-003 | K43: 59.99 | L43: 6.5000000000000006e-003 | M43: 111.1 | N43: 47.91 | O43: 0.126 | P43: 125.21 | Q43: 2.5天 | R43: 5.49年 | S43: 3.49年 | T43: 95.5 | U43: 334 | V43: 2.5000000000000001e-002 | W43: 2.9999999999999999e-002 | X43: 3.7999999999999999e-002 | Y43: 3157. | Z43: 5.99 | AA43: -4.3099999999999999e-002 | AB43: -4.6500000000000007e-002 | AC43: -8.3199999999999996e-002 | AD43: -8.4499999999999992e-002 | AE43: 90.62 | AF43: 92.01 | AG43: 0.77 | AH43: AA+ | AI43: 3.5499999999999997e-002 | AJ43: =H43+100*O43 -> 153.59999999999999 | AK43: 156.8 | AL43: 209 | AM43: 64.8 | AN43: 226 | AO43: 6.2e-002 | AP43: 10 | AQ43: 牧原转债
A44: 43 | B44: 118002 | C44: 天合转债 | D44: 688599 | E44: 天合光能 | F44: 能源电力 | G44: 太阳能 | H44: 142.56 | I44: -8.0000000000000002e-003 | J44: -7.0999999999999995e-003 | K44: 60.41 | L44: -2.1700000000000001e-002 | M44: 120.1 | N44: 50.51 | O44: 0.192 | P44: 119.6 | Q44: 2.5天 | R44: 5.48年 | S44: 3.48年 | T44: 52.5 | U44: 170 | V44: 2.3e-002 | W44: 4.2000000000000003e-002 | X44: 5.0000000000000003e-002 | Y44: 1253. | Z44: 7.78 | AA44: -3.1300000000000001e-002 | AB44: -3.73e-002 | AC44: -8.4399999999999989e-002 | AD44: -8.6099999999999996e-002 | AE44: 89.76 | AF44: 97 | AG44: 0.7 | AH44: AA | AI44: 4.0500000000000001e-002 | AJ44: =H44+100*O44 -> 161.75999999999999 | AK44: 165.5 | AL44: 283 | AM44: 68.5 | AN44: 252 | AO44: -6.3e-002 | AP44: 9 | AQ44: 天合转债
A45: 44 | B45: 127043 | C45: 川恒转债 | D45: 2895 | E45: 川恒股份 | F45: 化工 | G45: 农化 | H45: 144.8 | I45: -1.7000000000000001e-002 | J45: -1.4999999999999999e-002 | K45: 24.24 | L45: -4.4500000000000005e-002 | M45: 121 | N45: 21.02 | O45: 0.25600000000000001 | P45: 115.32 | Q45: 已到 | R45: 5.48年 | S45: 3.48年 | T45: 11.6 | U45: 55 | V45: 3.3000000000000002e-002 | W45: 9.8000000000000004e-002 | X45: 0.113 | Y45: 118 | Z45: 3.74 | AA45: -3.2899999999999999e-002 | AB45: -3.9100000000000003e-002 | AC45: -8.7799999999999989e-002 | AD45: -8.9499999999999996e-002 | AE45: 83.8 | AF45: 87.87 | AG45: 0.72 | AH45: AA- | AI45: 6.1500000000000006e-002 | AJ45: =H45+100*O45 -> 170.40000000000001 | AK45: 174.3 | AL45: 315 | AM45: 86.4 | AN45: 327 | AO45: 2.2000000000000002e-002 | AP45: 8 | AQ45: 川恒转债
A46: 45 | B46: 123123 | C46: 江丰转债! | D46: 300666 | E46: 江丰电子 | F46: 电子 | G46: 电子行业 | H46: 129.99 | I46: -1.5100000000000001e-002 | J46: 3.7000000000000002e-003 | K46: 52 | L46: -1.7000000000000001e-002 | M46: 121.5 | N46: 51.8 | O46: 0.29499999999999998 | P46: 100.39 | Q46: 已到 | R46: 5.48年 | S46: 3.48年 | T46: 5.17 | U46: 10 | V46: 1.4999999999999999e-002 | W46: 4.4000000000000004e-002 | X46: 4.4000000000000004e-002 | Y46: 119 | Z46: 9.48 | AA46: -1.2500000000000001e-002 | AB46: -1.9099999999999999e-002 | AC46: -5.8899999999999994e-002 | AD46: -6.0999999999999999e-002 | AE46: 81.15 | AF46: 83.56 | AG46: 0.67 | AH46: A+ | AI46: 7.2499999999999995e-002 | AJ46: =H46+100*O46 -> 159.49000000000001 | AK46: 159.6 | AL46: 236 | AM46: 76 | AN46: 296 | AO46: -8.0000000000000002e-003 | AP46: 7 | AQ46: 江丰转债!
A47: 46 | B47: 127042 | C47: 嘉美转债 | D47: 2969 | E47: 嘉美包装 | F47: 造纸包装 | G47: 包装材料 | H47: 130.694 | I47: 1.3100000000000001e-002 | J47: -1.1899999999999999e-002 | K47: 6.15 | L47: 1.6000000000000001e-003 | M47: 117.1 | N47: 4.87 | O47: 3.5000000000000003e-002 | P47: 126.28 | Q47: 已到 | R47: 5.47年 | S47: 3.47年 | T47: 7.5 | U47: 69 | V47: 7.0999999999999994e-002 | W47: 0.127 | X47: 0.16 | Y47: 59 | Z47: 2.7 | AA47: -2.0199999999999999e-002 | AB47: -2.5499999999999998e-002 | AC47: -6.2400000000000004e-002 | AD47: -6.4100000000000004e-002 | AE47: 89.79 | AF47: 94.63 | AG47: 0.74 | AH47: AA | AI47: 4.0500000000000001e-002 | AJ47: =H47+100*O47 -> 134.19399999999999 | AK47: 135.1 | AL47: 16 | AM47: 40.5 | AN47: 37 | AO47: 6.3e-002 | AP47: 16 | AQ47: 嘉美转债
A48: 47 | B48: 123122 | C48: 富瀚转债! | D48: 300613 | E48: 富瀚微 | F48: 电子 | G48: 芯片制造 | H48: 119.167 | I48: 5.0000000000000001e-004 | J48: 1.6000000000000001e-003 | K48: 122.29 | L48: 5.1000000000000004e-003 | M48: 120.3 | N48: 177.01 | O48: 0.72499999999999998 | P48: 69.09 | Q48: 已到 | R48: 5.46年 | S48: 3.46年 | T48: 5.81 | U48: 14 | V48: 2.e-002 | W48: 4.0000000000000001e-002 | X48: 2.7000000000000003e-002 | Y48: 147 | Z48: 8.98 | AA48: 1.8e-003 | AB48: -4.5999999999999999e-003 | AC48: -3.8100000000000002e-002 | AD48: -3.9900000000000005e-002 | AE48: 80.59 | AF48: 82.7 | AG48: 0.41 | AH48: A+ | AI48: 7.2499999999999995e-002 | AJ48: =H48+100*O48 -> 191.667 | AK48: 169.2 | AL48: 302 | AM48: 86.6 | AN48: 329 | AO48: -3.7999999999999999e-002 | AP48: 7 | AQ48: 富瀚转债!
A49: 48 | B49: 123121 | C49: 帝尔转债! | D49: 300776 | E49: 帝尔激光 | F49: 机械装备 | G49: 专用设备 | H49: 139.24 | I49: 5.3e-003 | J49: -1.8000000000000002e-002 | K49: 214.04 | L49: -1.8200000000000001e-002 | M49: 121 | N49: 192.24 | O49: 0.251 | P49: 111.34 | Q49: 已到 | R49: 5.46年 | S49: 3.46年 | T49: 8.4 | U49: 34 | V49: 2.9999999999999999e-002 | W49: 3.7000000000000005e-002 | X49: 4.0999999999999995e-002 | Y49: 227 | Z49: 11.24 | AA49: -2.5899999999999999e-002 | AB49: -3.2199999999999999e-002 | AC49: -7.8200000000000006e-002 | AD49: -8.0000000000000002e-002 | AE49: 83.9 | AF49: 87.97 | AG49: 0.69 | AH49: AA- | AI49: 6.1500000000000006e-002 | AJ49: =H49+100*O49 -> 164.34 | AK49: 167.1 | AL49: 292 | AM49: 79.2 | AN49: 310 | AO49: -4.2999999999999997e-002 | AP49: 6 | AQ49: 帝尔转债!
A50: 49 | B50: 123120 | C50: 隆华转债 | D50: 300263 | E50: 隆华科技 | F50: 机械装备 | G50: 通用设备 | H50: 137.798 | I50: -8.6e-003 | J50: -3.2000000000000002e-003 | K50: 8.83 | L50: -1.67e-002 | M50: 121.1 | N50: 7.76 | O50: 0.21100000000000002 | P50: 113.79 | Q50: 已到 | R50: 5.44年 | S50: 3.44年 | T50: 7.99 | U50: 37 | V50: 3.4000000000000002e-002 | W50: 9.9000000000000005e-002 | X50: 0.113 | Y50: 81 | Z50: 2.8 | AA50: -2.3900000000000001e-002 | AB50: -3.0299999999999997e-002 | AC50: -7.5499999999999998e-002 | AD50: -7.7399999999999997e-002 | AE50: 84.14 | AF50: 88.15 | AG50: 0.71 | AH50: AA- | AI50: 6.1500000000000006e-002 | AJ50: =H50+100*O50 -> 158.898 | AK50: 161.8 | AL50: 251 | AM50: 73.7 | AN50: 283 | AO50: -4.0999999999999995e-002 | AP50: 4 | AQ50: 隆华转债
A51: 50 | B51: 110081 | C51: 闻泰转债 | D51: 600745 | E51: 闻泰科技 | F51: 电子 | G51: 电子行业 | H51: 138.7 | I51: -4.3e-003 | J51: -7.4000000000000003e-003 | K51: 111.75 | L51: -1.6500000000000001e-002 | M51: 111.9 | N51: 96.69 | O51: 0.20000000000000001 | P51: 115.58 | Q51: 已到 | R51: 5.44年 | S51: 3.44年 | T51: 86 | U51: 258 | V51: 2.2000000000000002e-002 | W51: 6.2e-002 | X51: 7.0999999999999994e-002 | Y51: 1393. | Z51: 4.43 | AA51: -3.9199999999999999e-002 | AB51: -4.2900000000000001e-002 | AC51: -8.1000000000000003e-002 | AD51: -8.2100000000000006e-002 | AE51: 90.35 | AF51: 92.78 | AG51: 0.71 | AH51: AA+ | AI51: 3.5499999999999997e-002 | AJ51: =H51+100*O51 -> 158.69999999999999 | AK51: 161.8 | AL51: 252 | AM51: 69 | AN51: 257 | AO51: -1.8000000000000002e-002 | AP51: 10 | AQ51: 闻泰转债
A52: 51 | B52: 118001 | C52: 金博转债 | D52: 688598 | E52: 金博股份 | F52: 能源电力 | G52: 太阳能 | H52: 130.69 | I52: 6.3e-003 | J52: -1.0200000000000001e-002 | K52: 262.51 | L52: -6.0000000000000001e-003 | M52: 121.6 | N52: 270.54 | O52: 0.34700000000000003 | P52: 97.03 | Q52: 已到 | R52: 5.42年 | S52: 3.42年 | T52: 6 | U52: 14 | V52: 1.9e-002 | W52: 2.7999999999999997e-002 | X52: 2.7999999999999997e-002 | Y52: 211 | Z52: 12.78 | AA52: -1.3500000000000002e-002 | AB52: -2.0099999999999996e-002 | AC52: -6.08e-002 | AD52: -6.3e-002 | AE52: 81.64 | AF52: 83.99 | AG52: 0.65 | AH52: A+ | AI52: 7.2499999999999995e-002 | AJ52: =H52+100*O52 -> 165.38999999999999 | AK52: 164.3 | AL52: 272 | AM52: 80.4 | AN52: 313 | AO52: -2.5000000000000001e-002 | AP52: 4 | AQ52: 金博转债
A53: 52 | B53: 113627 | C53: 太平转债! | D53: 603877 | E53: 太平鸟 | F53: 服装纺织 | G53: 服装行业 | H53: 106.22 | I53: 7.3000000000000001e-003 | J53: -8.3999999999999995e-003 | K53: 24.43 | L53: -1.9299999999999998e-002 | M53: 115.1 | N53: 50.32 | O53: 1.1899999999999999 | P53: 48.55 | Q53: 已到 | R53: 5.40年 | S53: 3.40年 | T53: 8 | U53: 52 | V53: 6.2e-002 | W53: 6.9000000000000006e-002 | X53: 3.3000000000000002e-002 | Y53: 116 | Z53: 2.86 | AA53: 1.5300000000000001e-002 | AB53: 1.01e-002 | AC53: -6.9999999999999993e-003 | AD53: -9.0000000000000011e-003 | AE53: 90.04 | AF53: 93.27 | AG53: 0.06 | AH53: AA | AI53: 4.0500000000000001e-002 | AJ53: =H53+100*O53 -> 225.22 | AK53: 163.9 | AL53: 269 | AM53: 70.6 | AN53: 270 | AO53: -2.9999999999999999e-002 | AP53: 5 | AQ53: 太平转债!
A54: 53 | B54: 123119 | C54: 康泰转2! | D54: 300601 | E54: 康泰生物 | F54: 医药 | G54: 生物制药 | H54: 119.712 | I54: -2.3999999999999998e-003 | J54: 3.8e-003 | K54: 81.08 | L54: 4.5999999999999999e-003 | M54: 117.1 | N54: 108.5 | O54: 0.60199999999999998 | P54: 74.73 | Q54: 已到 | R54: 5.40年 | S54: 3.40年 | T54: 20 | U54: 15 | V54: 6.0000000000000001e-003 | W54: 3.6000000000000004e-002 | X54: 2.7000000000000003e-002 | Y54: 557 | Z54: 6.55 | AA54: -4.1999999999999997e-003 | AB54: -9.7000000000000003e-003 | AC54: -4.0000000000000001e-002 | AD54: -4.1799999999999997e-002 | AE54: 90.04 | AF54: 94.89 | AG54: 0.3 | AH54: AA | AI54: 4.0500000000000001e-002 | AJ54: =H54+100*O54 -> 179.91200000000001 | AK54: 164.7 | AL54: 274 | AM54: 69.8 | AN54: 264 | AO54: -3.4000000000000002e-002 | AP54: 11 | AQ54: 康泰转2!
A55: 54 | B55: 127041 | C55: 弘亚转债! | D55: 2833 | E55: 弘亚数控 | F55: 机械装备 | G55: 专用设备 | H55: 115.265 | I55: -3.0999999999999999e-003 | J55: 1.5e-003 | K55: 27.7 | L55: -5.4000000000000003e-003 | M55: 118.75 | N55: 38.09 | O55: 0.58499999999999996 | P55: 72.72 | Q55: 已到 | R55: 4.39年 | S55: 2.39年 | T55: 6 | U55: 4.6 | V55: 6.9999999999999993e-003 | W55: 7.0999999999999994e-002 | X55: 5.2000000000000005e-002 | Y55: 84 | Z55: 4.2 | AA55: 6.8999999999999999e-003 | AB55: -5.0000000000000001e-004 | AC55: -4.5100000000000001e-002 | AD55: -4.6900000000000004e-002 | AE55: 88.66 | AF55: 92.77 | AG55: 0.3 | AH55: AA- | AI55: 5.8799999999999998e-002 | AJ55: =H55+100*O55 -> 173.76499999999999 | AK55: 157.8 | AL55: 218 | AM55: 65 | AN55: 228 | AO55: -2.3e-002 | AP55: 6 | AQ55: 弘亚转债!
A56: 55 | B56: 123118 | C56: 惠城转债 | D56: 300779 | E56: 惠城环保 | F56: 化工 | G56: 其他 | H56: 124.684 | I56: 1.5100000000000001e-002 | J56: -1.e-004 | K56: 16.89 | L56: 2.3e-002 | M56: 121.7 | N56: 17.11 | O56: 0.26300000000000001 | P56: 98.71 | Q56: 已到 | R56: 5.38年 | S56: 3.38年 | T56: 3.2 | U56: 16 | V56: 4.0999999999999995e-002 | W56: 0.18899999999999997 | X56: 0.187 | Y56: 17 | Z56: 2.53 | AA56: -4.5999999999999999e-003 | AB56: -1.1399999999999999e-002 | AC56: -4.8799999999999996e-002 | AD56: -5.1100000000000007e-002 | AE56: 81.9 | AF56: 84.32 | AG56: 0.65 | AH56: A+ | AI56: 7.2499999999999995e-002 | AJ56: =H56+100*O56 -> 150.98400000000001 | AK56: 150.7 | AL56: 147 | AM56: 66.3 | AN56: 239 | AO56: 3.6000000000000004e-002 | AP56: 10 | AQ56: 惠城转债
A57: 56 | B57: 127040 | C57: 国泰转债 | D57: 2091 | E57: 江苏国泰 | F57: 商业零售 | G57: 商业零售 | H57: 133.812 | I57: -7.9000000000000008e-003 | J57: 3.9000000000000003e-003 | K57: 11.64 | L57: -5.1000000000000004e-003 | M57: 112.5 | N57: 9.02 | O57: 3.7000000000000005e-002 | P57: 129.05 | Q57: 已到 | R57: 5.38年 | S57: 3.38年 | T57: 44.8 | U57: 143 | V57: 2.4e-002 | W57: 0.24600000000000002 | X57: 0.318 | Y57: 182 | Z57: 1.9 | AA57: -3.2199999999999999e-002 | AB57: -3.6200000000000003e-002 | AC57: -7.1500000000000008e-002 | AD57: -7.2999999999999995e-002 | AE57: 91.09 | AF57: 93.53 | AG57: 0.79 | AH57: AA+ | AI57: 3.5499999999999997e-002 | AJ57: =H57+100*O57 -> 137.512 | AK57: 138.6 | AL57: 36 | AM57: 45 | AN57: 61 | AO57: -1.7000000000000001e-002 | AP57: 13 | AQ57: 国泰转债
A58: 57 | B58: 127039 | C58: 北港转债 | D58: 582 | E58: 北部湾港 | F58: 机场高速 | G58: 港口 | H58: 119.02 | I58: 5.3e-003 | J58: 2.8000000000000004e-003 | K58: 8.09 | L58: 1.5100000000000001e-002 | M58: 113 | N58: 8.35 | O58: 0.22800000000000001 | P58: 96.89 | Q58: 已到 | R58: 5.36年 | S58: 3.36年 | T58: 30 | U58: 9.2 | V58: 3.0000000000000001e-003 | W58: 0.22699999999999998 | X58: 0.22 | Y58: 132 | Z58: 1.23 | AA58: -9.7999999999999997e-003 | AB58: -1.41e-002 | AC58: -3.9199999999999999e-002 | AD58: -4.0999999999999995e-002 | AE58: 92.25 | AF58: 95.03 | AG58: 0.54 | AH58: AAA | AI58: 3.3500000000000002e-002 | AJ58: =H58+100*O58 -> 141.81999999999999 | AK58: 141.2 | AL58: 49 | AM58: 46.1 | AN58: 72 | AO58: 1.7000000000000001e-002 | AP58: 7 | AQ58: 北港转债
A59: 58 | B59: 113626 | C59: 伯特转债! | D59: 603596 | E59: 伯特利 | F59: 汽车 | G59: 零部件制 | H59: 226.76 | I59: -1.5800000000000002e-002 | J59: -1.95e-002 | K59: 78 | L59: -3.6799999999999999e-002 | M59: 121.1 | N59: 36.01 | O59: 4.7e-002 | P59: 216.61 | Q59: 已到 | R59: 5.36年 | S59: 3.36年 | T59: 9.02 | U59: 178 | V59: 8.5999999999999993e-002 | W59: 2.7999999999999997e-002 | X59: 6.0999999999999999e-002 | Y59: 319 | Z59: 10.07 | AA59: -0.11199999999999999 | AB59: -0.11800000000000001 | AC59: -0.111 | AD59: -0.111 | AE59: 90.2 | AF59: 98.29 | AG59: 0.96 | AH59: AA | AI59: 4.0500000000000001e-002 | AJ59: =H59+100*O59 -> 231.45999999999998 | AK59: 236.9 | AL59: 361 | AM59: 138.6 | AN59: 361 | AO59: 1.6e-002 | AP59: 4 | AQ59: 伯特转债!
A60: 59 | B60: 123117 | C60: 健帆转债! | D60: 300529 | E60: 健帆生物 | F60: 医药 | G60: 医疗器械 | H60: 114.6 | I60: 4.4000000000000003e-003 | J60: -4.4000000000000003e-003 | K60: 46.88 | L60: -4.0000000000000002e-004 | M60: 115.1 | N60: 90.57 | O60: 1.21 | P60: 51.76 | Q60: 已到 | R60: 5.34年 | S60: 3.34年 | T60: 10 | U60: 8.8 | V60: 8.0000000000000002e-003 | W60: 2.6000000000000002e-002 | X60: 1.3999999999999999e-002 | Y60: 378 | Z60: 12.38 | AA60: 8.0000000000000004e-004 | AB60: -4.1999999999999997e-003 | AC60: -2.86e-002 | AD60: -3.0499999999999999e-002 | AE60: 90.25 | AF60: 93.5 | AG60: 0.08 | AH60: AA | AI60: 4.0500000000000001e-002 | AJ60: =H60+100*O60 -> 235.59999999999999 | AK60: 177.4 | AL60: 322 | AM60: 83.9 | AN60: 323 | AO60: -5.0000000000000003e-002 | AP60: 9 | AQ60: 健帆转债!
A61: 60 | B61: 113051 | C61: 节能转债! | D61: 601016 | E61: 节能风电 | F61: 能源电力 | G61: 风能 | H61: 156.52 | I61: 5.1000000000000004e-003 | J61: -5.1000000000000004e-003 | K61: 5.47 | L61: 0. | M61: 114.5 | N61: 4.05 | O61: 0.159 | P61: 135.06 | Q61: 已到 | R61: 5.33年 | S61: 3.33年 | T61: 30 | U61: 108 | V61: 2.3e-002 | W61: 0.109 | X61: 0.14800000000000002 | Y61: 274 | Z61: 2.66 | AA61: -5.7699999999999994e-002 | AB61: -6.2100000000000002e-002 | AC61: -0.11 | AD61: -0.11199999999999999 | AE61: 91.23 | AF61: 95.34 | AG61: 0.81 | AH61: AA+ | AI61: 3.5499999999999997e-002 | AJ61: =H61+100*O61 -> 172.42000000000002 | AK61: 178 | AL61: 324 | AM61: 82.6 | AN61: 319 | AO61: 2.1000000000000001e-002 | AP61: 9 | AQ61: 节能转债!
A62: 61 | B62: 113050 | C62: 南银转债 | D62: 601009 | E62: 南京银行 | F62: 金融 | G62: 银行行业 | H62: 121.98 | I62: 1.2699999999999999e-002 | J62: -4.5999999999999999e-003 | K62: 10.3 | L62: 1.38e-002 | M62: 111.2 | N62: 10.1 | O62: 0.19600000000000001 | P62: 101.98 | Q62: 已到 | R62: 5.32年 | S62: 无权 | T62: 200 | U62: 180 | V62: 6.9999999999999993e-003 | W62: 0.19399999999999998 | X62: 0.19800000000000001 | Y62: 1031. | Z62: 0.97 | AA62: -1.7500000000000002e-002 | AB62: -2.12e-002 | AC62: 无权 | AD62: 无权 | AE62: 无权 | AF62: 93.58 | AG62: 0.59 | AH62: AAA | AI62: 3.3500000000000002e-002 | AJ62: =H62+100*O62 -> 141.58000000000001 | AK62: 142 | AL62: 55 | AM62: 48.4 | AN62: 87 | AO62: 3.5000000000000003e-002 | AP62: 8 | AQ62: 南银转债
A63: 62 | B63: 113625 | C63: 江山转债! | D63: 603208 | E63: 江山欧派 | F63: 其他 | G63: 家居用品 | H63: 120.65 | I63: 3.15e-002 | J63: -2.5600000000000001e-002 | K63: 70.05 | L63: 1.6500000000000001e-002 | M63: 124 | N63: 96.33 | O63: 0.65900000000000003 | P63: 72.72 | Q63: 已到 | R63: 5.31年 | S63: 3.31年 | T63: 5.83 | U63: 36 | V63: 5.2000000000000005e-002 | W63: 7.9000000000000001e-002 | X63: 5.7999999999999996e-002 | Y63: 74 | Z63: 4.01 | AA63: 5.3e-003 | AB63: -2.3e-003 | AC63: -4.2500000000000003e-002 | AD63: -4.4500000000000005e-002 | AE63: 84.66 | AF63: 90.95 | AG63: 0.35 | AH63: AA- | AI63: 6.1500000000000006e-002 | AJ63: =H63+100*O63 -> 186.55000000000001 | AK63: 168.6 | AL63: 299 | AM63: 77.6 | AN63: 301 | AO63: -9.4e-002 | AP63: 8 | AQ63: 江山转债!
A64: 63 | B64: 127038 | C64: 国微转债! | D64: 2049 | E64: 紫光国微 | F64: 电子 | G64: 芯片制造 | H64: 167.8 | I64: -1.7600000000000001e-002 | J64: 1.7399999999999999e-002 | K64: 196.01 | L64: -2.0000000000000001e-004 | M64: 114.5 | N64: 137.78 | O64: 0.17999999999999999 | P64: 142.26 | Q64: 已到 | R64: 5.30年 | S64: 3.30年 | T64: 14.9 | U64: 63 | V64: 2.5000000000000001e-002 | W64: 1.3000000000000001e-002 | X64: 1.8000000000000002e-002 | Y64: 1189. | Z64: 18.1 | AA64: -7.0499999999999993e-002 | AB64: -7.4800000000000005e-002 | AC64: -0.128 | AD64: -0.129 | AE64: 91.33 | AF64: 95.44 | AG64: 0.84 | AH64: AA+ | AI64: 3.5499999999999997e-002 | AJ64: =H64+100*O64 -> 185.80000000000001 | AK64: 193.3 | AL64: 343 | AM64: 97.9 | AN64: 339 | AO64: -6.6000000000000003e-002 | AP64: 6 | AQ64: 国微转债!
A65: 64 | B65: 113049 | C65: 长汽转债 | D65: 601633 | E65: 长城汽车 | F65: 汽车 | G65: 乘用车 | H65: 132.61 | I65: 1.1000000000000001e-003 | J65: -1.06e-002 | K65: 38.25 | L65: -1.6200000000000003e-002 | M65: 110.5 | N65: 38.01 | O65: 0.318 | P65: 100.63 | Q65: 已到 | R65: 5.30年 | S65: 3.30年 | T65: 35 | U65: 90 | V65: 2.e-002 | W65: 1.e-002 | X65: 1.e-002 | Y65: 3533. | Z65: 6.02 | AA65: -3.4200000000000001e-002 | AB65: -3.7699999999999997e-002 | AC65: -7.2499999999999995e-002 | AD65: -7.3599999999999999e-002 | AE65: 91.27 | AF65: 93 | AG65: 0.59 | AH65: AAA | AI65: 3.3500000000000002e-002 | AJ65: =H65+100*O65 -> 164.41000000000003 | AK65: 164.6 | AL65: 273 | AM65: 71.6 | AN65: 274 | AO65: -8.4000000000000005e-002 | AP65: 5 | AQ65: 长汽转债
A66: 65 | B66: 123116 | C66: 万兴转债 | D66: 300624 | E66: 万兴科技 | F66: 计算机及 | G66: 软件开发 | H66: 120.689 | I66: 6.6e-003 | J66: -1.4000000000000002e-003 | K66: 40.18 | L66: 1.01e-002 | M66: 121.4 | N66: 49.78 | O66: 0.495 | P66: 80.72 | Q66: 已到 | R66: 5.30年 | S66: 3.30年 | T66: 3.78 | U66: 16 | V66: 3.4000000000000002e-002 | W66: 7.2000000000000008e-002 | X66: 5.7999999999999996e-002 | Y66: 52 | Z66: 6.28 | AA66: 1.1000000000000001e-003 | AB66: -5.6999999999999993e-003 | AC66: -4.1599999999999998e-002 | AD66: -4.3799999999999999e-002 | AE66: 82.07 | AF66: 84.51 | AG66: 0.52 | AH66: A+ | AI66: 7.2499999999999995e-002 | AJ66: =H66+100*O66 -> 170.18899999999999 | AK66: 160.7 | AL66: 242 | AM66: 76.2 | AN66: 297 | AO66: -0.10099999999999999 | AP66: 8 | AQ66: 万兴转债
A67: 66 | B67: 123115 | C67: 捷捷转债 | D67: 300623 | E67: 捷捷微电 | F67: 电子 | G67: 元器件制 | H67: 127.07 | I67: 4.5000000000000005e-003 | J67: -8.0000000000000002e-003 | K67: 26.73 | L67: -6.0000000000000001e-003 | M67: 118.5 | N67: 29 | O67: 0.379 | P67: 92.17 | Q67: 已到 | R67: 5.30年 | S67: 3.30年 | T67: 11.9 | U67: 8.2 | V67: 5.0000000000000001e-003 | W67: 6.0999999999999999e-002 | X67: 5.5999999999999994e-002 | Y67: 197 | Z67: 6.93 | AA67: -1.3300000000000001e-002 | AB67: -1.9299999999999998e-002 | AC67: -5.7099999999999998e-002 | AD67: -5.9000000000000004e-002 | AE67: 84.63 | AF67: 86.96 | AG67: 0.58 | AH67: AA- | AI67: 6.1500000000000006e-002 | AJ67: =H67+100*O67 -> 164.97 | AK67: 162 | AL67: 254 | AM67: 75 | AN67: 288 | AO67: -3.2000000000000001e-002 | AP67: 8 | AQ67: 捷捷转债
A68: 67 | B68: 127037 | C68: 银轮转债 | D68: 2126 | E68: 银轮股份 | F68: 汽车 | G68: 零部件制 | H68: 129.25 | I68: -1.9e-003 | J68: 8.6999999999999994e-003 | K68: 10.28 | L68: 1.2800000000000001e-002 | M68: 115.1 | N68: 10.77 | O68: 0.35399999999999998 | P68: 95.45 | Q68: 已到 | R68: 5.30年 | S68: 3.30年 | T68: 7 | U68: 19 | V68: 2.1000000000000001e-002 | W68: 8.5999999999999993e-002 | X68: 8.199999999999999e-002 | Y68: 81 | Z68: 1.93 | AA68: -2.2000000000000002e-002 | AB68: -2.69e-002 | AC68: -6.2400000000000004e-002 | AD68: -6.4199999999999993e-002 | AE68: 90.41 | AF68: 93.66 | AG68: 0.53 | AH68: AA | AI68: 4.0500000000000001e-002 | AJ68: =H68+100*O68 -> 164.65000000000001 | AK68: 163 | AL68: 264 | AM68: 69.4 | AN68: 262 | AO68: -7.8e-002 | AP68: 3 | AQ68: 银轮转债
A69: 68 | B69: 127036 | C69: 三花转债 | D69: 2050 | E69: 三花智控 | F69: 机械装备 | G69: 通用设备 | H69: 124.95 | I69: -4.0000000000000002e-004 | J69: 1.6000000000000001e-003 | K69: 19.23 | L69: 2.5999999999999999e-003 | M69: 114.5 | N69: 21.55 | O69: 0.40000000000000002 | P69: 89.23 | Q69: 已到 | R69: 5.28年 | S69: 3.28年 | T69: 30 | U69: 11 | V69: 3.0000000000000001e-003 | W69: 4.2999999999999997e-002 | X69: 3.9e-002 | Y69: 691 | Z69: 6.69 | AA69: -1.67e-002 | AB69: -2.1400000000000002e-002 | AC69: -5.4800000000000001e-002 | AD69: -5.6299999999999996e-002 | AE69: 91.41 | AF69: 95.52 | AG69: 0.45 | AH69: AA+ | AI69: 3.5499999999999997e-002 | AJ69: =H69+100*O69 -> 164.94999999999999 | AK69: 160.7 | AL69: 243 | AM69: 65.1 | AN69: 231 | AO69: -8.0000000000000002e-002 | AP69: 7 | AQ69: 三花转债
A70: 69 | B70: 127035 | C70: 濮耐转债 | D70: 2225 | E70: 濮耐股份 | F70: 钢铁 | G70: 钢铁行业 | H70: 120.399 | I70: 5.0000000000000001e-003 | J70: 4.5000000000000005e-003 | K70: 4.24 | L70: 1.9199999999999998e-002 | M70: 114.7 | N70: 4.43 | O70: 0.25800000000000001 | P70: 95.71 | Q70: 已到 | R70: 4.26年 | S70: 2.26年 | T70: 6.26 | U70: 1.5 | V70: 2.e-003 | W70: 0.14599999999999999 | X70: 0.14000000000000001 | Y70: 43 | Z70: 1.4 | AA70: -1.1599999999999999e-002 | AB70: -1.7600000000000001e-002 | AC70: -6.1200000000000004e-002 | AD70: -6.3600000000000004e-002 | AE70: 94.57 | AF70: 98.28 | AG70: 0.49 | AH70: AA | AI70: 3.78e-002 | AJ70: =H70+100*O70 -> 146.19900000000001 | AK70: 145.1 | AL70: 82 | AM70: 46.8 | AN70: 81 | AO70: -4.0000000000000001e-003 | AP70: 9 | AQ70: 濮耐转债
A71: 70 | B71: 123114 | C71: 三角转债! | D71: 300775 | E71: 三角防务 | F71: 航空航天 | G71: 航空航天 | H71: 160.888 | I71: -8.1000000000000013e-003 | J71: -9.5999999999999992e-003 | K71: 44.3 | L71: -2.1600000000000001e-002 | M71: 121 | N71: 31.82 | O71: 0.156 | P71: 139.22 | Q71: 已到 | R71: 5.26年 | S71: 3.26年 | T71: 9.04 | U71: 92 | V71: 6.3e-002 | W71: 4.0999999999999995e-002 | X71: 5.7000000000000002e-002 | Y71: 220 | Z71: 10.16 | AA71: -5.3699999999999998e-002 | AB71: -5.9999999999999998e-002 | AC71: -0.11800000000000001 | AD71: -0.11900000000000001 | AE71: 84.89 | AF71: 89.01 | AG71: 0.82 | AH71: AA- | AI71: 6.1500000000000006e-002 | AJ71: =H71+100*O71 -> 176.488 | AK71: 182.6 | AL71: 331 | AM71: 93.5 | AN71: 336 | AO71: 9.0000000000000011e-003 | AP71: 7 | AQ71: 三角转债!
A72: 71 | B72: 111000 | C72: 起帆转债 | D72: 605222 | E72: 起帆电缆 | F72: 能源电力 | G72: 电力设备 | H72: 133.8 | I72: 5.1999999999999998e-003 | J72: -8.6e-003 | K72: 23.72 | L72: -4.5999999999999999e-003 | M72: 120.5 | N72: 20.1 | O72: 0.13400000000000001 | P72: 118.01 | Q72: 已到 | R72: 5.26年 | S72: 3.26年 | T72: 10 | U72: 24 | V72: 1.8000000000000002e-002 | W72: 0.10099999999999999 | X72: 0.11900000000000001 | Y72: 99 | Z72: 2.86 | AA72: -2.0099999999999996e-002 | AB72: -2.6600000000000002e-002 | AC72: -7.2000000000000008e-002 | AD72: -7.3899999999999993e-002 | AE72: 84.84 | AF72: 88.64 | AG72: 0.73 | AH72: AA- | AI72: 6.1500000000000006e-002 | AJ72: =H72+100*O72 -> 147.20000000000002 | AK72: 149.6 | AL72: 134 | AM72: 61 | AN72: 195 | AO72: -4.0000000000000001e-002 | AP72: 10 | AQ72: 起帆转债
A73: 72 | B73: 127034 | C73: 绿茵转债! | D73: 2887 | E73: 绿茵生态 | F73: 城市公用 | G73: 生态环境 | H73: 111.5 | I73: -5.0000000000000001e-004 | J73: -1.6500000000000001e-002 | K73: 10.81 | L73: -3.2199999999999999e-002 | M73: 119 | N73: 12.38 | O73: 0.27699999999999997 | P73: 87.32 | Q73: 已到 | R73: 5.19年 | S73: 3.19年 | T73: 7.12 | U73: 87 | V73: 0.11 | W73: 0.21100000000000002 | X73: 0.184 | Y73: 34 | Z73: 1.65 | AA73: 1.29e-002 | AB73: 6.4000000000000003e-003 | AC73: -2.0899999999999998e-002 | AD73: -2.3099999999999999e-002 | AE73: 85.24 | AF73: 87.91 | AG73: 0.53 | AH73: AA- | AI73: 6.1500000000000006e-002 | AJ73: =H73+100*O73 -> 139.19999999999999 | AK73: 135.7 | AL73: 19 | AM73: 47.8 | AN73: 84 | AO73: 0.106 | AP73: 45 | AQ73: 绿茵转债!
A74: 73 | B74: 113624 | C74: 正川转债! | D74: 603976 | E74: 正川股份 | F74: 医药 | G74: 医药行业 | H74: 113 | I74: 3.2000000000000002e-003 | J74: -2.0000000000000001e-004 | K74: 30.33 | L74: 9.300000000000001e-003 | M74: 121.6 | N74: 46.69 | O74: 0.73999999999999999 | P74: 64.96 | Q74: 已到 | R74: 5.19年 | S74: 3.19年 | T74: 4.05 | U74: 3.5 | V74: 8.0000000000000002e-003 | W74: 8.8000000000000009e-002 | X74: 5.7000000000000002e-002 | Y74: 46 | Z74: 4.15 | AA74: 1.46e-002 | AB74: 7.3000000000000001e-003 | AC74: -2.3e-002 | AD74: -2.5600000000000001e-002 | AE74: 82.99 | AF74: 85.39 | AG74: 0.33 | AH74: A+ | AI74: 7.2499999999999995e-002 | AJ74: =H74+100*O74 -> 187. | AK74: 161 | AL74: 246 | AM74: 75.7 | AN74: 294 | AO74: -2.8999999999999998e-002 | AP74: 24 | AQ74: 正川转债!
A75: 74 | B75: 113048 | C75: 晶科转债!! | D75: 601778 | E75: 晶科科技 | F75: 能源电力 | G75: 太阳能 | H75: 145.35 | I75: 2.2099999999999998e-002 | J75: 8.6999999999999994e-003 | K75: 6.95 | L75: 4.0399999999999998e-002 | M75: 117.1 | N75: 5.46 | O75: 0.14199999999999999 | P75: 127.29 | Q75: 已到 | R75: 5.17年 | S75: 3.17年 | T75: 23 | U75: 289 | V75: 8.6999999999999994e-002 | W75: 0.114 | X75: 0.14499999999999999 | Y75: 201 | Z75: 1.7 | AA75: -4.1599999999999998e-002 | AB75: -4.7100000000000003e-002 | AC75: -9.7200000000000009e-002 | AD75: -9.8900000000000002e-002 | AE75: 90.86 | AF75: 95.75 | AG75: 0.76 | AH75: AA | AI75: 4.0500000000000001e-002 | AJ75: =H75+100*O75 -> 159.54999999999998 | AK75: 163.4 | AL75: 266 | AM75: 67.7 | AN75: 248 | AO75: 2.e-003 | AP75: 14 | AQ75: 晶科转债!!
A76: 75 | B76: 123113 | C76: 仙乐转债! | D76: 300791 | E76: 仙乐健康 | F76: 食品饮料 | G76: 食品饮料 | H76: 112.999 | I76: 5.3e-003 | J76: -5.6999999999999993e-003 | K76: 36.6 | L76: -1.4000000000000002e-003 | M76: 118.5 | N76: 56.88 | O76: 0.75599999999999989 | P76: 64.35 | Q76: 已到 | R76: 5年59天 | S76: 3年59天 | T76: 10.2 | U76: 2.6 | V76: 2.e-003 | W76: 0.155 | X76: 0.10000000000000001 | Y76: 66 | Z76: 2.84 | AA76: 9.3999999999999986e-003 | AB76: 3.0999999999999999e-003 | AC76: -2.53e-002 | AD76: -2.75e-002 | AE76: 85.32 | AF76: 87.68 | AG76: 0.28 | AH76: AA- | AI76: 6.1500000000000006e-002 | AJ76: =H76+100*O76 -> 188.59899999999999 | AK76: 161.7 | AL76: 249 | AM76: 74 | AN76: 285 | AO76: -6.2e-002 | AP76: 7 | AQ76: 仙乐转债!
A77: 76 | B77: 127033 | C77: 中装转2! | D77: 2822 | E77: 中装建设 | F77: 建筑 | G77: 装饰工程 | H77: 126.2 | I77: 2.1000000000000001e-002 | J77: 6.6e-003 | K77: 6.7 | L77: 4.5199999999999997e-002 | M77: 117.1 | N77: 6.28 | O77: 0.183 | P77: 106.69 | Q77: 已到 | R77: 5年56天 | S77: 3年56天 | T77: 11.6 | U77: 203 | V77: 0.13800000000000001 | W77: 0.23999999999999999 | X77: 0.25600000000000001 | Y77: 48 | Z77: 1.38 | AA77: -1.47e-002 | AB77: -2.0400000000000001e-002 | AC77: -5.8200000000000002e-002 | AD77: -6.0100000000000001e-002 | AE77: 90.92 | AF77: 95.82 | AG77: 0.61 | AH77: AA | AI77: 4.0500000000000001e-002 | AJ77: =H77+100*O77 -> 144.5 | AK77: 145.7 | AL77: 90 | AM77: 49.9 | AN77: 102 | AO77: 0.10800000000000001 | AP77: 28 | AQ77: 中装转2!
A78: 77 | B78: 110080 | C78: 东湖转债 | D78: 600133 | E78: 东湖高新 | F78: 建筑 | G78: 建筑工程 | H78: 115.5 | I78: 1.26e-002 | J78: 5.0000000000000001e-004 | K78: 5.8 | L78: 2.4700000000000003e-002 | M78: 115.1 | N78: 6.05 | O78: 0.20499999999999999 | P78: 95.87 | Q78: 已到 | R78: 5年52天 | S78: 3年52天 | T78: 15.5 | U78: 31 | V78: 1.8000000000000002e-002 | W78: 0.33600000000000002 | X78: 0.32200000000000001 | Y78: 46 | Z78: 0.82 | AA78: -7.000000000000001e-004 | AB78: -5.8999999999999999e-003 | AC78: -3.2599999999999997e-002 | AD78: -3.4599999999999999e-002 | AE78: 90.96 | AF78: 94.23 | AG78: 0.53 | AH78: AA | AI78: 4.0500000000000001e-002 | AJ78: =H78+100*O78 -> 136. | AK78: 135.1 | AL78: 17 | AM78: 40.9 | AN78: 39 | AO78: 7.0999999999999994e-002 | AP78: 34 | AQ78: 东湖转债
A79: 78 | B79: 127032 | C79: 苏行转债 | D79: 2966 | E79: 苏州银行 | F79: 金融 | G79: 银行行业 | H79: 114.9 | I79: 1.43e-002 | J79: -8.3999999999999995e-003 | K79: 7.12 | L79: 1.4199999999999999e-002 | M79: 115.1 | N79: 8.1 | O79: 0.307 | P79: 87.9 | Q79: 已到 | R79: 5年52天 | S79: 无权 | T79: 50 | U79: 56 | V79: 1.e-002 | W79: 0.21100000000000002 | X79: 0.185 | Y79: 237 | Z79: 0.75 | AA79: 2.9999999999999997e-004 | AB79: -4.8999999999999998e-003 | AC79: 无权 | AD79: 无权 | AE79: 无权 | AF79: 97.47 | AG79: 0.42 | AH79: AAA | AI79: 3.3500000000000002e-002 | AJ79: =H79+100*O79 -> 145.59999999999999 | AK79: 141.9 | AL79: 53 | AM79: 44.4 | AN79: 55 | AO79: 1.9e-002 | AP79: 11 | AQ79: 苏行转债
A80: 79 | B80: 113047 | C80: 旗滨转债! | D80: 601636 | E80: 旗滨集团 | F80: 建筑 | G80: 玻璃 | H80: 154.3 | I80: 3.0299999999999997e-002 | J80: 6.4000000000000003e-003 | K80: 17.16 | L80: 4.6300000000000001e-002 | M80: 114 | N80: 12.8 | O80: 0.151 | P80: 134.06 | Q80: 已到 | R80: 5年49天 | S80: 3年49天 | T80: 15 | U80: 237 | V80: 0.10300000000000001 | W80: 3.3000000000000002e-002 | X80: 4.4000000000000004e-002 | Y80: 461 | Z80: 3.75 | AA80: -5.7999999999999996e-002 | AB80: -6.2400000000000004e-002 | AC80: -0.115 | AD80: -0.11599999999999999 | AE80: 91.42 | AF80: 95.56 | AG80: 0.79 | AH80: AA+ | AI80: 3.5499999999999997e-002 | AJ80: =H80+100*O80 -> 169.40000000000001 | AK80: 174.5 | AL80: 316 | AM80: 79 | AN80: 309 | AO80: 3.0000000000000001e-003 | AP80: 7 | AQ80: 旗滨转债!
A81: 80 | B81: 123112 | C81: 万讯转债! | D81: 300112 | E81: 万讯自控 | F81: 机械装备 | G81: 专用设备 | H81: 137.281 | I81: -1.6000000000000001e-003 | J81: -6.1999999999999998e-003 | K81: 10.9 | L81: -1.09e-002 | M81: 124.4 | N81: 8.93 | O81: 0.125 | P81: 122.06 | Q81: 已到 | R81: 5年48天 | S81: 3年48天 | T81: 2.45 | U81: 36 | V81: 0.106 | W81: 7.9000000000000001e-002 | X81: 9.6000000000000002e-002 | Y81: 31 | Z81: 2.87 | AA81: -1.9400000000000001e-002 | AB81: -2.7099999999999999e-002 | AC81: -8.0700000000000008e-002 | AD81: -8.2799999999999999e-002 | AE81: 85.89 | AF81: 92.25 | AG81: 0.72 | AH81: AA- | AI81: 6.1500000000000006e-002 | AJ81: =H81+100*O81 -> 149.78100000000001 | AK81: 152.5 | AL81: 168 | AM81: 60.3 | AN81: 190 | AO81: -3.6000000000000004e-002 | AP81: 14 | AQ81: 万讯转债!
A82: 81 | B82: 113623 | C82: 凤21转债 | D82: 603225 | E82: 新凤鸣 | F82: 化工 | G82: 化纤 | H82: 121.41 | I82: 5.0000000000000001e-003 | J82: -2.5999999999999999e-003 | K82: 14.41 | L82: 5.6000000000000008e-003 | M82: 117.1 | N82: 16.47 | O82: 0.38799999999999996 | P82: 87.49 | Q82: 已到 | R82: 5年48天 | S82: 3年48天 | T82: 25 | U82: 7.1 | V82: 2.e-003 | W82: 0.113 | X82: 9.9000000000000005e-002 | Y82: 220 | Z82: 1.39 | AA82: -7.1999999999999998e-003 | AB82: -1.29e-002 | AC82: -4.7400000000000005e-002 | AD82: -4.9299999999999997e-002 | AE82: 91 | AF82: 95.9 | AG82: 0.43 | AH82: AA | AI82: 4.0500000000000001e-002 | AJ82: =H82+100*O82 -> 160.20999999999998 | AK82: 155.3 | AL82: 192 | AM82: 59.4 | AN82: 183 | AO82: -6.9999999999999993e-003 | AP82: 4 | AQ82: 凤21转债
A83: 82 | B83: 123111 | C83: 东财转3!* | D83: 300059 | E83: 东方财富 | F83: 金融 | G83: 证券行业 | H83: 115.75 | I83: -1.67e-002 | J83: 2.9999999999999997e-004 | K83: 27.08 | L83: -1.6299999999999999e-002 | M83: 110.5 | N83: 23.35 | O83: -2.e-003 | P83: 115.97 | Q83: 已到 | R83: 10天 | S83: 无权 | T83: 90.5 | U83: 1009. | V83: 9.6000000000000002e-002 | W83: 3.2000000000000001e-002 | X83: 3.7000000000000005e-002 | Y83: 2807. | Z83: 7.18 | AA83: <-100% | AB83: <-100% | AC83: 无权 | AD83: 无权 | AE83: 无权 | AF83: 100.11 | AG83: 1 | AH83: AA+ | AI83: 2.5499999999999998e-002 | AJ83: =H83+100*O83 -> 115.55 | AK83: 115.5 | AL83: 2 | AM83: 15.4 | AN83: 1 | AO83: -0.13900000000000001 | AP83: 28 | AQ83: 东财转3!*
A84: 83 | B84: 123109 | C84: 昌红转债! | D84: 300151 | E84: 昌红科技 | F84: 机械装备 | G84: 专用设备 | H84: 129 | I84: -3.0999999999999999e-003 | J84: -9.1000000000000004e-003 | K84: 28.74 | L84: -1.9400000000000001e-002 | M84: 121 | N84: 28.06 | O84: 0.25900000000000001 | P84: 102.42 | Q84: 已到 | R84: 5年41天 | S84: 3年41天 | T84: 4.6 | U84: 6.4 | V84: 1.1000000000000001e-002 | W84: 3.2000000000000001e-002 | X84: 3.3000000000000002e-002 | Y84: 144 | Z84: 13.98 | AA84: -1.2699999999999999e-002 | AB84: -1.9599999999999999e-002 | AC84: -6.4399999999999999e-002 | AD84: -6.6500000000000004e-002 | AE84: 85.65 | AF84: 89.8 | AG84: 0.63 | AH84: AA- | AI84: 6.1500000000000006e-002 | AJ84: =H84+100*O84 -> 154.90000000000001 | AK84: 155.6 | AL84: 196 | AM84: 65.8 | AN84: 234 | AO84: -9.9000000000000005e-002 | AP84: 6 | AQ84: 昌红转债!
A85: 84 | B85: 123110 | C85: 九典转债 | D85: 300705 | E85: 九典制药 | F85: 医药 | G85: 化学制药 | H85: 127.949 | I85: 2.2400000000000003e-002 | J85: -5.9999999999999995e-004 | K85: 28.2 | L85: 3.15e-002 | M85: 121.4 | N85: 26.44 | O85: 0.20000000000000001 | P85: 106.66 | Q85: 已到 | R85: 5年41天 | S85: 3年41天 | T85: 2.7 | U85: 20 | V85: 5.9000000000000004e-002 | W85: 4.0999999999999995e-002 | X85: 4.2999999999999997e-002 | Y85: 66 | Z85: 6.65 | AA85: -1.0500000000000001e-002 | AB85: -1.7500000000000002e-002 | AC85: -6.08e-002 | AD85: -6.3099999999999989e-002 | AE85: 83.23 | AF85: 85.64 | AG85: 0.69 | AH85: A+ | AI85: 7.2499999999999995e-002 | AJ85: =H85+100*O85 -> 147.94900000000001 | AK85: 149.2 | AL85: 126 | AM85: 63.6 | AN85: 214 | AO85: -3.6000000000000004e-002 | AP85: 11 | AQ85: 九典转债
A86: 85 | B86: 123108 | C86: 乐普转2! | D86: 300003 | E86: 乐普医疗 | F86: 医药 | G86: 医疗器械 | H86: 115.865 | I86: 1.5e-003 | J86: -1.e-004 | K86: 21.27 | L86: 6.6e-003 | M86: 111.1 | N86: 29.5 | O86: 0.60699999999999998 | P86: 72.1 | Q86: 已到 | R86: 4年39天 | S86: 2年39天 | T86: 16.4 | U86: 9.9 | V86: 5.0000000000000001e-003 | W86: 4.2999999999999997e-002 | X86: 3.1e-002 | Y86: 384 | Z86: 3.34 | AA86: -1.03e-002 | AB86: -1.52e-002 | AC86: -5.45e-002 | AD86: -5.62e-002 | AE86: 94.87 | AF86: 97.49 | AG86: 0.21 | AH86: AA+ | AI86: 3.2799999999999996e-002 | AJ86: =H86+100*O86 -> 176.565 | AK86: 159.6 | AL86: 237 | AM86: 62.1 | AN86: 202 | AO86: -4.8000000000000001e-002 | AP86: 13 | AQ86: 乐普转2!
A87: 86 | B87: 123107 | C87: 温氏转债! | D87: 300498 | E87: 温氏股份 | F87: 农业 | G87: 畜牧业 | H87: 134.7 | I87: 2.5899999999999999e-002 | J87: -1.7000000000000001e-003 | K87: 21.08 | L87: 3.3300000000000003e-002 | M87: 113 | N87: 17.62 | O87: 0.126 | P87: 119.64 | Q87: 已到 | R87: 5年38天 | S87: 3年38天 | T87: 93 | U87: 364 | V87: 2.8999999999999998e-002 | W87: 6.9000000000000006e-002 | X87: 8.3000000000000004e-002 | Y87: 1339. | Z87: 3.81 | AA87: -3.44e-002 | AB87: -3.8800000000000001e-002 | AC87: -7.8e-002 | AD87: -7.980000000000001e-002 | AE87: 93.02 | AF87: 95.82 | AG87: 0.73 | AH87: AAA | AI87: 3.3500000000000002e-002 | AJ87: =H87+100*O87 -> 147.29999999999998 | AK87: 149.8 | AL87: 137 | AM87: 53.9 | AN87: 134 | AO87: 4.5999999999999999e-002 | AP87: 12 | AQ87: 温氏转债!
A88: 87 | B88: 110079 | C88: 杭银转债! | D88: 600926 | E88: 杭州银行 | F88: 金融 | G88: 银行行业 | H88: 127 | I88: 1.34e-002 | J88: 6.8999999999999999e-003 | K88: 15.17 | L88: 2.92e-002 | M88: 112.4 | N88: 12.99 | O88: 8.6999999999999994e-002 | P88: 116.78 | Q88: 已到 | R88: 5年38天 | S88: 无权 | T88: 150 | U88: 350 | V88: 1.8000000000000002e-002 | W88: 0.16699999999999998 | X88: 0.19500000000000001 | Y88: 900 | Z88: 1.3 | AA88: -2.4e-002 | AB88: -2.8300000000000002e-002 | AC88: 无权 | AD88: 无权 | AE88: 无权 | AF88: 95.27 | AG88: 0.7 | AH88: AAA | AI88: 3.3500000000000002e-002 | AJ88: =H88+100*O88 -> 135.69999999999999 | AK88: 137.2 | AL88: 25 | AM88: 42 | AN88: 44 | AO88: 5.4000000000000006e-002 | AP88: 14 | AQ88: 杭银转债!
A89: 88 | B89: 113622 | C89: 杭叉转债! | D89: 603298 | E89: 杭叉集团 | F89: 机械装备 | G89: 通用设备 | H89: 117.81 | I89: 2.5999999999999999e-003 | J89: -1.5e-003 | K89: 16.95 | L89: 4.0999999999999995e-003 | M89: 112.5 | N89: 23.08 | O89: 0.60399999999999998 | P89: 73.44 | Q89: 已到 | R89: 5年34天 | S89: 3年34天 | T89: 11.5 | U89: 8.4 | V89: 6.0000000000000001e-003 | W89: 7.8e-002 | X89: 5.7999999999999996e-002 | Y89: 147 | Z89: 2.78 | AA89: -9.1999999999999998e-003 | AB89: -1.3600000000000001e-002 | AC89: -4.0599999999999997e-002 | AD89: -4.2300000000000004e-002 | AE89: 92 | AF89: 94.47 | AG89: 0.28 | AH89: AA+ | AI89: 3.5499999999999997e-002 | AJ89: =H89+100*O89 -> 178.21000000000001 | AK89: 162.2 | AL89: 257 | AM89: 67.7 | AN89: 250 | AO89: 1.1000000000000001e-002 | AP89: 5 | AQ89: 杭叉转债!
A90: 89 | B90: 127031 | C90: 洋丰转债! | D90: 902 | E90: 新洋丰 | F90: 化工 | G90: 农化 | H90: 127.75 | I90: -5.0000000000000001e-003 | J90: -1.9e-003 | K90: 17.45 | L90: -1.3000000000000001e-002 | M90: 117.1 | N90: 17.76 | O90: 0.29999999999999999 | P90: 98.25 | Q90: 已到 | R90: 5年34天 | S90: 3年34天 | T90: 10 | U90: 43 | V90: 3.3000000000000002e-002 | W90: 4.4000000000000004e-002 | X90: 4.2999999999999997e-002 | Y90: 228 | Z90: 3.02 | AA90: -1.7299999999999999e-002 | AB90: -2.3e-002 | AC90: -6.2800000000000009e-002 | AD90: -6.4699999999999994e-002 | AE90: 91.14 | AF90: 96.05 | AG90: 0.53 | AH90: AA | AI90: 4.0500000000000001e-002 | AJ90: =H90+100*O90 -> 157.75 | AK90: 157.2 | AL90: 213 | AM90: 61.2 | AN90: 196 | AO90: 4.5999999999999999e-002 | AP90: 7 | AQ90: 洋丰转债!
A91: 90 | B91: 123106 | C91: 正丹转债! | D91: 300641 | E91: 正丹股份 | F91: 化工 | G91: 化工 | H91: 116.756 | I91: 4.7999999999999996e-003 | J91: -2.5000000000000001e-003 | K91: 6.64 | L91: 4.5000000000000005e-003 | M91: 125.5 | N91: 7.5 | O91: 0.31900000000000001 | P91: 88.53 | Q91: 已到 | R91: 5年33天 | S91: 3年33天 | T91: 3.2 | U91: 2.6 | V91: 6.9999999999999993e-003 | W91: 9.8000000000000004e-002 | X91: 8.6999999999999994e-002 | Y91: 33 | Z91: 2.27 | AA91: 1.46e-002 | AB91: 6.1999999999999998e-003 | AC91: -3.5699999999999996e-002 | AD91: -3.7900000000000003e-002 | AE91: 85.69 | AF91: 93.22 | AG91: 0.49 | AH91: AA- | AI91: 6.1500000000000006e-002 | AJ91: =H91+100*O91 -> 148.65600000000001 | AK91: 145 | AL91: 80 | AM91: 51.8 | AN91: 119 | AO91: 1.e-003 | AP91: 20 | AQ91: 正丹转债!
A92: 91 | B92: 128145 | C92: 日丰转债! | D92: 2953 | E92: 日丰股份 | F92: 家电 | G92: 零部件制 | H92: 130.6 | I92: 3.5999999999999999e-003 | J92: 1.1999999999999999e-003 | K92: 15.77 | L92: 6.4000000000000003e-003 | M92: 115.4 | N92: 13.66 | O92: 0.13100000000000001 | P92: 115.45 | Q92: 已到 | R92: 5年31天 | S92: 3年31天 | T92: 3.8 | U92: 8.7 | V92: 1.8000000000000002e-002 | W92: 9.9000000000000005e-002 | X92: 0.114 | Y92: 38 | Z92: 3.36 | AA92: -2.4500000000000001e-002 | AB92: -2.9700000000000001e-002 | AC92: -6.9000000000000006e-002 | AD92: -7.0900000000000005e-002 | AE92: 85.62 | AF92: 85.76 | AG92: 0.75 | AH92: AA- | AI92: 6.1500000000000006e-002 | AJ92: =H92+100*O92 -> 143.69999999999999 | AK92: 145.8 | AL92: 91 | AM92: 60 | AN92: 185 | AO92: -8.0000000000000002e-003 | AP92: 10 | AQ92: 日丰转债!
A93: 92 | B93: 127030 | C93: 盛虹转债! | D93: 301 | E93: 东方盛虹 | F93: 化工 | G93: 化纤 | H93: 155.998 | I93: -2.e-003 | J93: -7.8000000000000005e-003 | K93: 18.19 | L93: -1.2e-002 | M93: 112.5 | N93: 13.53 | O93: 0.16 | P93: 134.44 | Q93: 已到 | R93: 5年31天 | S93: 3年31天 | T93: 50 | U93: 48 | V93: 6.0000000000000001e-003 | W93: 4.5999999999999999e-002 | X93: 6.2e-002 | Y93: 1082. | Z93: 7.75 | AA93: -6.3200000000000006e-002 | AB93: -6.7199999999999996e-002 | AC93: -0.11800000000000001 | AD93: -0.11900000000000001 | AE93: 92.03 | AF93: 94.49 | AG93: 0.82 | AH93: AA+ | AI93: 3.5499999999999997e-002 | AJ93: =H93+100*O93 -> 171.99799999999999 | AK93: 177.6 | AL93: 323 | AM93: 83.1 | AN93: 320 | AO93: 1.e-002 | AP93: 5 | AQ93: 盛虹转债!
A94: 93 | B94: 113046 | C94: 金田转债! | D94: 601609 | E94: 金田铜业 | F94: 有色金属 | G94: 铜金属 | H94: 116.03 | I94: 5.0000000000000001e-004 | J94: 1.5e-003 | K94: 8.64 | L94: 5.7999999999999996e-003 | M94: 114.9 | N94: 10.75 | O94: 0.44400000000000001 | P94: 80.37 | Q94: 已到 | R94: 5年31天 | S94: 3年31天 | T94: 15 | U94: 6 | V94: 3.0000000000000001e-003 | W94: 0.11699999999999999 | X94: 9.4e-002 | Y94: 128 | Z94: 1.82 | AA94: -2.e-003 | AB94: -7.1999999999999998e-003 | AC94: -3.5099999999999999e-002 | AD94: -3.7000000000000005e-002 | AE94: 92.41 | AF94: 96.55 | AG94: 0.34 | AH94: AA+ | AI94: 3.5499999999999997e-002 | AJ94: =H94+100*O94 -> 160.43000000000001 | AK94: 151.7 | AL94: 161 | AM94: 55.1 | AN94: 145 | AO94: 3.3000000000000002e-002 | AP94: 13 | AQ94: 金田转债!
A95: 94 | B95: 127029 | C95: 中钢转债! | D95: 928 | E95: 中钢国际 | F95: 建筑 | G95: 建筑工程 | H95: 149.432 | I95: 1.5800000000000002e-002 | J95: -5.7999999999999996e-003 | K95: 8.16 | L95: 1.24e-002 | M95: 117.5 | N95: 5.79 | O95: 5.9999999999999998e-002 | P95: 140.93 | Q95: 已到 | R95: 5年28天 | S95: 3年28天 | T95: 8.19 | U95: 82 | V95: 6.7000000000000004e-002 | W95: 7.8e-002 | X95: 0.11 | Y95: 105 | Z95: 1.75 | AA95: -4.6900000000000004e-002 | AB95: -5.2499999999999998e-002 | AC95: -0.107 | AD95: -0.10800000000000001 | AE95: 92.06 | AF95: 98.71 | AG95: 0.81 | AH95: AA+ | AI95: 3.5499999999999997e-002 | AJ95: =H95+100*O95 -> 155.43199999999999 | AK95: 157.9 | AL95: 220 | AM95: 59.2 | AN95: 182 | AO95: 3.2000000000000001e-002 | AP95: 12 | AQ95: 中钢转债!
A96: 95 | B96: 123105 | C96: 拓尔转债! | D96: 300229 | E96: 拓尔思 | F96: 计算机及 | G96: 软件开发 | H96: 130.913 | I96: 3.5299999999999998e-002 | J96: 3.8e-003 | K96: 11.38 | L96: 5.57e-002 | M96: 121 | N96: 9.96 | O96: 0.14599999999999999 | P96: 114.26 | Q96: 已到 | R96: 5年28天 | S96: 3年28天 | T96: 8 | U96: 108 | V96: 0.10400000000000001 | W96: 9.8000000000000004e-002 | X96: 0.11199999999999999 | Y96: 81 | Z96: 3.68 | AA96: -1.5700000000000002e-002 | AB96: -2.2599999999999999e-002 | AC96: -6.9400000000000003e-002 | AD96: -7.1399999999999991e-002 | AE96: 85.83 | AF96: 89.99 | AG96: 0.7 | AH96: AA- | AI96: 6.1500000000000006e-002 | AJ96: =H96+100*O96 -> 145.51300000000001 | AK96: 147.6 | AL96: 112 | AM96: 57.6 | AN96: 167 | AO96: 9.0000000000000011e-003 | AP96: 9 | AQ96: 拓尔转债!
A97: 96 | B97: 123104 | C97: 卫宁转债! | D97: 300253 | E97: 卫宁健康 | F97: 计算机及 | G97: 软件开发 | H97: 118.9 | I97: 7.6e-003 | J97: -6.3e-003 | K97: 11.49 | L97: 9.7000000000000003e-003 | M97: 125.1 | N97: 17.74 | O97: 0.83599999999999997 | P97: 64.77 | Q97: 已到 | R97: 5年25天 | S97: 3年25天 | T97: 9.7 | U97: 3.8 | V97: 3.0000000000000001e-003 | W97: 3.9e-002 | X97: 2.5000000000000001e-002 | Y97: 247 | Z97: 5.14 | AA97: 1.03e-002 | AB97: 2.e-003 | AC97: -4.2000000000000003e-002 | AD97: -4.4000000000000004e-002 | AE97: 91.23 | AF97: 102.69 | AG97: 0.14 | AH97: AA | AI97: 4.0500000000000001e-002 | AJ97: =H97+100*O97 -> 202.5 | AK97: 173 | AL97: 310 | AM97: 70.3 | AN97: 266 | AO97: -0.10400000000000001 | AP97: 6 | AQ97: 卫宁转债!
A98: 97 | B98: 123103 | C98: 震安转债! | D98: 300767 | E98: 震安科技 | F98: 化工 | G98: 橡胶塑料 | H98: 172.471 | I98: 1.04e-002 | J98: -2.0499999999999997e-002 | K98: 89.06 | L98: -1.1399999999999999e-002 | M98: 121.4 | N98: 56.89 | O98: 0.10199999999999999 | P98: 156.55 | Q98: 已到 | R98: 5年21天 | S98: 3年21天 | T98: 2.53 | U98: 15 | V98: 3.5000000000000003e-002 | W98: 1.3999999999999999e-002 | X98: 2.2000000000000002e-002 | Y98: 180 | Z98: 15.35 | AA98: -6.8499999999999991e-002 | AB98: -7.4999999999999997e-002 | AC98: -0.14199999999999999 | AD98: -0.14300000000000002 | AE98: 83.72 | AF98: 86.01 | AG98: 0.88 | AH98: A+ | AI98: 7.2499999999999995e-002 | AJ98: =H98+100*O98 -> 182.67099999999999 | AK98: 188.4 | AL98: 339 | AM98: 102.4 | AN98: 343 | AO98: -2.5000000000000001e-002 | AP98: 5 | AQ98: 震安转债!
A99: 98 | B99: 123101 | C99: 拓斯转债! | D99: 300607 | E99: 拓斯达 | F99: 机械装备 | G99: 机器人及 | H99: 111.998 | I99: 0. | J99: -2.0000000000000001e-004 | K99: 13.47 | L99: -3.0000000000000001e-003 | M99: 115.1 | N99: 26.18 | O99: 1.1799999999999999 | P99: 51.45 | Q99: 已到 | R99: 5年19天 | S99: 3年19天 | T99: 6.7 | U99: 2.6 | V99: 3.0000000000000001e-003 | W99: 0.11699999999999999 | X99: 5.9999999999999998e-002 | Y99: 57 | Z99: 2.6 | AA99: 5.5000000000000005e-003 | AB99: 1.e-004 | AC99: -2.41e-002 | AD99: -2.6200000000000001e-002 | AE99: 91.29 | AF99: 94.57 | AG99: 0.07 | AH99: AA | AI99: 4.0500000000000001e-002 | AJ99: =H99+100*O99 -> 229.99799999999999 | AK99: 172.5 | AL99: 309 | AM99: 78 | AN99: 304 | AO99: -6.3e-002 | AP99: 11 | AQ99: 拓斯转债!
A100: 99 | B100: 113620 | C100: 傲农转债! | D100: 603363 | E100: 傲农生物 | F100: 农业 | G100: 畜牧业 | H100: 155.9 | I100: 7.8899999999999998e-002 | J100: -4.0099999999999997e-002 | K100: 20.14 | L100: 4.9000000000000002e-002 | M100: 121.1 | N100: 14.52 | O100: 0.124 | P100: 138.71 | Q100: 已到 | R100: 5年19天 | S100: 3年19天 | T100: 10 | U100: 703 | V100: 0.47399999999999998 | W100: 7.2999999999999995e-002 | X100: 0.10099999999999999 | Y100: 138 | Z100: 6.34 | AA100: -4.9599999999999998e-002 | AB100: -5.62e-002 | AC100: -0.11800000000000001 | AD100: -0.11900000000000001 | AE100: 91.29 | AF100: 99.48 | AG100: 0.79 | AH100: AA | AI100: 4.0500000000000001e-002 | AJ100: =H100+100*O100 -> 168.30000000000001 | AK100: 173.1 | AL100: 311 | AM100: 73.6 | AN100: 282 | AO100: 0.13800000000000001 | AP100: 10 | AQ100: 傲农转债!
A101: 100 | B101: 113045 | C101: 环旭转债! | D101: 601231 | E101: 环旭电子 | F101: 电子 | G101: 电子产品 | H101: 114.97 | I101: 7.8000000000000005e-003 | J101: -5.5000000000000005e-003 | K101: 14.5 | L101: 9.0000000000000011e-003 | M101: 112 | N101: 19.75 | O101: 0.56600000000000006 | P101: 73.42 | Q101: 已到 | R101: 5年13天 | S101: 2年13天 | T101: 34.5 | U101: 1.7 | V101: 0. | W101: 0.10800000000000001 | X101: 7.9000000000000001e-002 | Y101: 320 | Z101: 2.69 | AA101: -5.3e-003 | AB101: -9.5999999999999992e-003 | AC101: -4.9200000000000001e-002 | AD101: -5.16e-002 | AE101: 95.3 | AF101: 94.18 | AG101: 0.26 | AH101: AA+ | AI101: 3.5499999999999997e-002 | AJ101: =H101+100*O101 -> 171.56999999999999 | AK101: 156.5 | AL101: 207 | AM101: 61.2 | AN101: 197 | AO101: 4.0000000000000001e-003 | AP101: 6 | AQ101: 环旭转债!
A102: 101 | B102: 128144 | C102: 利民转债! | D102: 2734 | E102: 利民股份 | F102: 化工 | G102: 农化 | H102: 133.66 | I102: -2.9999999999999997e-004 | J102: 1.2999999999999999e-003 | K102: 13.01 | L102: 1.5e-003 | M102: 114.1 | N102: 11.5 | O102: 0.18100000000000002 | P102: 113.13 | Q102: 已到 | R102: 5年10天 | S102: 3年10天 | T102: 9.79 | U102: 4.8 | V102: 4.0000000000000001e-003 | W102: 0.20199999999999999 | X102: 0.22899999999999998 | Y102: 48 | Z102: 1.93 | AA102: -3.15e-002 | AB102: -3.6200000000000003e-002 | AC102: -7.9299999999999995e-002 | AD102: -8.0799999999999997e-002 | AE102: 90.71 | AF102: 93.78 | AG102: 0.69 | AH102: AA | AI102: 4.0500000000000001e-002 | AJ102: =H102+100*O102 -> 151.75999999999999 | AK102: 154.2 | AL102: 182 | AM102: 60.4 | AN102: 192 | AO102: -2.e-002 | AP102: 5 | AQ102: 利民转债!
A103: 102 | B103: 118000 | C103: 嘉元转债! | D103: 688388 | E103: 嘉元科技 | F103: 电子 | G103: 电子产品 | H103: 172.59 | I103: -1.34e-002 | J103: -1.2699999999999999e-002 | K103: 114 | L103: -3.1600000000000003e-002 | M103: 121 | N103: 78.74 | O103: 0.192 | P103: 144.78 | Q103: 已到 | R103: 5年4.1天 | S103: 3年4.1天 | T103: 9.79 | U103: 90 | V103: 5.2999999999999999e-002 | W103: 3.7000000000000005e-002 | X103: 5.2999999999999999e-002 | Y103: 267 | Z103: 8.91 | AA103: -6.9699999999999998e-002 | AB103: -7.6100000000000001e-002 | AC103: -0.14499999999999999 | AD103: -0.14699999999999999 | AE103: 86.16 | AF103: 90.34 | AG103: 0.83 | AH103: AA- | AI103: 6.1500000000000006e-002 | AJ103: =H103+100*O103 -> 191.78999999999999 | AK103: 200.4 | AL103: 345 | AM103: 110.1 | AN103: 347 | AO103: -6.0999999999999999e-002 | AP103: 6 | AQ103: 嘉元转债!
A104: 103 | B104: 123100 | C104: 朗科转债 | D104: 300543 | E104: 朗科智能 | F104: 电子 | G104: 电子产品 | H104: 126.498 | I104: 1.7000000000000001e-003 | J104: -5.9999999999999995e-004 | K104: 12.66 | L104: 1.6000000000000001e-003 | M104: 117.1 | N104: 11.61 | O104: 0.16 | P104: 109.04 | Q104: 已到 | R104: 4.97年 | S104: 2.97年 | T104: 3.8 | U104: 26 | V104: 5.5e-002 | W104: 0.11199999999999999 | X104: 0.122 | Y104: 34 | Z104: 3.59 | AA104: -1.5700000000000002e-002 | AB104: -2.1600000000000001e-002 | AC104: -6.25e-002 | AD104: -6.4399999999999999e-002 | AE104: 86.58 | AF104: 88.62 | AG104: 0.68 | AH104: AA- | AI104: 5.8799999999999998e-002 | AJ104: =H104+100*O104 -> 142.49799999999999 | AK104: 144 | AL104: 72 | AM104: 55.3 | AN104: 148 | AO104: -2.4e-002 | AP104: 9 | AQ104: 朗科转债
A105: 104 | B105: 123099 | C105: 普利转债 | D105: 300630 | E105: 普利制药 | F105: 医药 | G105: 化学制药 | H105: 126.498 | I105: 9.1999999999999998e-003 | J105: 2.9999999999999997e-004 | K105: 45.85 | L105: 1.6399999999999998e-002 | M105: 123.1 | N105: 46.03 | O105: 0.27000000000000002 | P105: 99.61 | Q105: 已到 | R105: 4.97年 | S105: 2.97年 | T105: 8.5 | U105: 10 | V105: 9.0000000000000011e-003 | W105: 4.2000000000000003e-002 | X105: 4.2000000000000003e-002 | Y105: 200 | Z105: 8.42 | AA105: -5.6000000000000008e-003 | AB105: -1.3300000000000001e-002 | AC105: -6.25e-002 | AD105: -6.4399999999999999e-002 | AE105: 86.58 | AF105: 93.14 | AG105: 0.58 | AH105: AA- | AI105: 5.8799999999999998e-002 | AJ105: =H105+100*O105 -> 153.49799999999999 | AK105: 153.4 | AL105: 178 | AM105: 60.3 | AN105: 189 | AO105: -3.4000000000000002e-002 | AP105: 6 | AQ105: 普利转债
A106: 105 | B106: 123098 | C106: 一品转债! | D106: 300723 | E106: 一品红 | F106: 医药 | G106: 医药行业 | H106: 130.5 | I106: -3.8e-003 | J106: 3.8e-003 | K106: 28.18 | L106: 0. | M106: 123.6 | N106: 25.48 | O106: 0.17999999999999999 | P106: 110.6 | Q106: 已到 | R106: 4.94年 | S106: 2.94年 | T106: 4.24 | U106: 7 | V106: 1.3000000000000001e-002 | W106: 5.2000000000000005e-002 | X106: 5.7999999999999996e-002 | Y106: 81 | Z106: 4.85 | AA106: -1.11e-002 | AB106: -1.9e-002 | AC106: -7.2300000000000003e-002 | AD106: -7.4299999999999991e-002 | AE106: 86.81 | AF106: 93.71 | AG106: 0.65 | AH106: AA- | AI106: 5.8799999999999998e-002 | AJ106: =H106+100*O106 -> 148.5 | AK106: 150.4 | AL106: 142 | AM106: 56.7 | AN106: 162 | AO106: -4.4999999999999998e-002 | AP106: 7 | AQ106: 一品转债!
A107: 106 | B107: 123097 | C107: 美力转债 | D107: 300611 | E107: 美力科技 | F107: 机械装备 | G107: 通用设备 | H107: 126.5 | I107: 8.0000000000000002e-003 | J107: -4.6999999999999993e-003 | K107: 10.32 | L107: 4.8999999999999998e-003 | M107: 121.1 | N107: 9.28 | O107: 0.13800000000000001 | P107: 111.21 | Q107: 已到 | R107: 4.94年 | S107: 2.94年 | T107: 3 | U107: 13 | V107: 3.4000000000000002e-002 | W107: 0.16200000000000001 | X107: 0.18100000000000002 | Y107: 18 | Z107: 2.62 | AA107: -9.0000000000000011e-003 | AB107: -1.6200000000000003e-002 | AC107: -6.1399999999999996e-002 | AD107: -6.3700000000000007e-002 | AE107: 84.61 | AF107: 87.44 | AG107: 0.69 | AH107: A+ | AI107: 6.9800000000000001e-002 | AJ107: =H107+100*O107 -> 140.30000000000001 | AK107: 141.8 | AL107: 52 | AM107: 54.3 | AN107: 141 | AO107: -2.8999999999999998e-002 | AP107: 22 | AQ107: 美力转债
A108: 107 | B108: 123096 | C108: 思创转债! | D108: 300078 | E108: 思创医惠 | F108: 通信互联 | G108: 物联网 | H108: 112.656 | I108: 7.7000000000000002e-003 | J108: -2.5000000000000001e-003 | K108: 6.31 | L108: 1.4499999999999999e-002 | M108: 123.6 | N108: 8.27 | O108: 0.47600000000000003 | P108: 76.3 | Q108: 已到 | R108: 4.93年 | S108: 2.93年 | T108: 8.17 | U108: 3.9 | V108: 4.0000000000000001e-003 | W108: 0.14899999999999999 | X108: 0.114 | Y108: 55 | Z108: 2 | AA108: 1.9299999999999998e-002 | AB108: 1.11e-002 | AC108: -2.7099999999999999e-002 | AD108: -2.92e-002 | AE108: 86.84 | AF108: 93.74 | AG108: 0.36 | AH108: AA- | AI108: 5.8799999999999998e-002 | AJ108: =H108+100*O108 -> 160.256 | AK108: 149 | AL108: 123 | AM108: 55.3 | AN108: 147 | AO108: -6.3e-002 | AP108: 14 | AQ108: 思创转债!
A109: 108 | B109: 113621 | C109: 彤程转债! | D109: 603650 | E109: 彤程新材 | F109: 化工 | G109: 橡胶塑料 | H109: 137.93 | I109: 1.37e-002 | J109: -9.1999999999999998e-003 | K109: 36.15 | L109: 6.9999999999999993e-003 | M109: 114.8 | N109: 32.62 | O109: 0.245 | P109: 110.82 | Q109: 已到 | R109: 4.93年 | S109: 2.93年 | T109: 5.37 | U109: 25 | V109: 3.4000000000000002e-002 | W109: 2.5000000000000001e-002 | X109: 2.7999999999999997e-002 | Y109: 216 | Z109: 8.05 | AA109: -3.7100000000000001e-002 | AB109: -4.2199999999999994e-002 | AC109: -8.9499999999999996e-002 | AD109: -9.1300000000000006e-002 | AE109: 92.15 | AF109: 95.91 | AG109: 0.66 | AH109: AA | AI109: 3.78e-002 | AJ109: =H109+100*O109 -> 162.43000000000001 | AK109: 165 | AL109: 279 | AM109: 69.1 | AN109: 259 | AO109: -2.e-003 | AP109: 7 | AQ109: 彤程转债!
A110: 109 | B110: 113042 | C110: 上银转债! | D110: 601229 | E110: 上海银行 | F110: 金融 | G110: 银行行业 | H110: 106.67 | I110: -1.1000000000000001e-003 | J110: 2.e-003 | K110: 7.2 | L110: 5.6000000000000008e-003 | M110: 120.6 | N110: 10.63 | O110: 0.57499999999999996 | P110: 67.73 | Q110: 已到 | R110: 4.93年 | S110: 无权 | T110: 200 | U110: 147 | V110: 6.9999999999999993e-003 | W110: 0.19600000000000001 | X110: 0.13200000000000001 | Y110: 1023. | Z110: 0.57 | AA110: 2.6000000000000002e-002 | AB110: 1.84e-002 | AC110: 无权 | AD110: 无权 | AE110: 无权 | AF110: 104.3 | AG110: 0.16 | AH110: AAA | AI110: 3.0800000000000001e-002 | AJ110: =H110+100*O110 -> 164.16999999999999 | AK110: 145.6 | AL110: 88 | AM110: 41.3 | AN110: 40 | AO110: 0. | AP110: 20 | AQ110: 上银转债!
A111: 110 | B111: 113619 | C111: 世运转债! | D111: 603920 | E111: 世运电路 | F111: 电子 | G111: 元器件制 | H111: 129 | I111: 3.7000000000000002e-003 | J111: 1.8e-003 | K111: 20.49 | L111: 9.3999999999999986e-003 | M111: 114.9 | N111: 19.92 | O111: 0.254 | P111: 102.86 | Q111: 已到 | R111: 4.92年 | S111: 2.92年 | T111: 10 | U111: 29 | V111: 2.2000000000000002e-002 | W111: 9.1999999999999998e-002 | X111: 9.4e-002 | Y111: 109 | Z111: 4.18 | AA111: -2.3700000000000002e-002 | AB111: -2.8900000000000002e-002 | AC111: -6.9699999999999998e-002 | AD111: -7.1599999999999997e-002 | AE111: 92.31 | AF111: 96.07 | AG111: 0.58 | AH111: AA | AI111: 3.78e-002 | AJ111: =H111+100*O111 -> 154.40000000000001 | AK111: 155.1 | AL111: 191 | AM111: 59.1 | AN111: 180 | AO111: -8.4000000000000005e-002 | AP111: 6 | AQ111: 世运转债!
A112: 111 | B112: 123093 | C112: 金陵转债! | D112: 300651 | E112: 金陵体育 | F112: 其他 | G112: 文化教育 | H112: 116.555 | I112: 2.5999999999999999e-003 | J112: -8.1000000000000013e-003 | K112: 30.42 | L112: -2.3700000000000002e-002 | M112: 128.8 | N112: 49.19 | O112: 0.88500000000000001 | P112: 61.84 | Q112: 已到 | R112: 4.92年 | S112: 2.92年 | T112: 2.5 | U112: 15 | V112: 5.0999999999999997e-002 | W112: 6.4000000000000001e-002 | X112: 3.9e-002 | Y112: 39 | Z112: 5.62 | AA112: 2.1099999999999997e-002 | AB112: 1.1299999999999999e-002 | AC112: -3.1e-002 | AD112: -3.4500000000000003e-002 | AE112: 86.23 | AF112: 93.35 | AG112: 0.23 | AH112: A+ | AI112: 6.9800000000000001e-002 | AJ112: =H112+100*O112 -> 205.05500000000001 | AK112: 171.3 | AL112: 307 | AM112: 77.9 | AN112: 303 | AO112: -3.3000000000000002e-002 | AP112: 14 | AQ112: 金陵转债!
A113: 112 | B113: 113618 | C113: 美诺转债! | D113: 603538 | E113: 美诺华 | F113: 医药 | G113: 原料药 | H113: 115.4 | I113: -1.1699999999999999e-002 | J113: 1.4999999999999999e-002 | K113: 29.71 | L113: 7.0999999999999995e-003 | M113: 114.9 | N113: 37.23 | O113: 0.44600000000000001 | P113: 79.8 | Q113: 已到 | R113: 4.90年 | S113: 2.90年 | T113: 5.2 | U113: 28 | V113: 4.7e-002 | W113: 0.11599999999999999 | X113: 9.1999999999999998e-002 | Y113: 45 | Z113: 2.63 | AA113: -8.9999999999999998e-004 | AB113: -6.3e-003 | AC113: -3.5400000000000001e-002 | AD113: -3.7400000000000003e-002 | AE113: 86.9 | AF113: 87.31 | AG113: 0.45 | AH113: AA- | AI113: 5.8799999999999998e-002 | AJ113: =H113+100*O113 -> 160. | AK113: 151 | AL113: 150 | AM113: 63.7 | AN113: 215 | AO113: -6.6000000000000003e-002 | AP113: 5 | AQ113: 美诺转债!
A114: 113 | B114: 128143 | C114: 锋龙转债! | D114: 2931 | E114: 锋龙股份 | F114: 机械装备 | G114: 专用设备 | H114: 126.442 | I114: -5.6999999999999993e-003 | J114: 5.1999999999999998e-003 | K114: 13.9 | L114: -7.000000000000001e-004 | M114: 121.2 | N114: 12.73 | O114: 0.158 | P114: 109.19 | Q114: 已到 | R114: 4.89年 | S114: 2.89年 | T114: 2.44 | U114: 9.9 | V114: 3.2000000000000001e-002 | W114: 8.8000000000000009e-002 | X114: 9.6000000000000002e-002 | Y114: 28 | Z114: 4.36 | AA114: -8.8000000000000005e-003 | AB114: -1.61e-002 | AC114: -6.2199999999999998e-002 | AD114: -6.4500000000000002e-002 | AE114: 84.92 | AF114: 87.83 | AG114: 0.69 | AH114: A+ | AI114: 6.9800000000000001e-002 | AJ114: =H114+100*O114 -> 142.24199999999999 | AK114: 143.7 | AL114: 71 | AM114: 55.9 | AN114: 153 | AO114: 1.4999999999999999e-002 | AP114: 16 | AQ114: 锋龙转债!
A115: 114 | B115: 127028 | C115: 英特转债! | D115: 411 | E115: 英特集团 | F115: 医药 | G115: 医药商业 | H115: 118.398 | I115: 6.4000000000000003e-003 | J115: -1.4000000000000002e-003 | K115: 12.95 | L115: 9.3999999999999986e-003 | M115: 112.8 | N115: 13.22 | O115: 0.20899999999999999 | P115: 97.96 | Q115: 已到 | R115: 4.88年 | S115: 2.88年 | T115: 5.99 | U115: 9.8 | V115: 1.3999999999999999e-002 | W115: 0.18100000000000002 | X115: 0.17699999999999999 | Y115: 33 | Z115: 1.82 | AA115: -1.01e-002 | AB115: -1.47e-002 | AC115: -4.41e-002 | AD115: -4.6100000000000002e-002 | AE115: 93.71 | AF115: 96.65 | AG115: 0.53 | AH115: AA+ | AI115: 3.2799999999999996e-002 | AJ115: =H115+100*O115 -> 139.298 | AK115: 138.8 | AL115: 40 | AM115: 42.2 | AN115: 46 | AO115: -3.2000000000000001e-002 | AP115: 31 | AQ115: 英特转债!
A116: 115 | B116: 113616 | C116: 韦尔转债! | D116: 603501 | E116: 韦尔股份 | F116: 电子 | G116: 元器件制 | H116: 141.68 | I116: 2.e-003 | J116: -1.0700000000000001e-002 | K116: 239.4 | L116: -1.44e-002 | M116: 114.3 | N116: 222.52 | O116: 0.317 | P116: 107.59 | Q116: 已到 | R116: 4.86年 | S116: 2.86年 | T116: 24.3 | U116: 49 | V116: 1.3999999999999999e-002 | W116: 1.2e-002 | X116: 1.2e-002 | Y116: 2096. | Z116: 14.35 | AA116: -4.3899999999999995e-002 | AB116: -4.8799999999999996e-002 | AC116: -0.10099999999999999 | AD116: -0.10099999999999999 | AE116: 93.3 | AF116: 97.96 | AG116: 0.6 | AH116: AA+ | AI116: 3.2799999999999996e-002 | AJ116: =H116+100*O116 -> 173.38 | AK116: 175.8 | AL116: 318 | AM116: 77.8 | AN116: 302 | AO116: -8.3000000000000004e-002 | AP116: 9 | AQ116: 韦尔转债!
A117: 116 | B117: 123092 | C117: 天壕转债! | D117: 300332 | E117: 天壕环境 | F117: 石油天然 | G117: 天然气 | H117: 206.771 | I117: -2.2400000000000003e-002 | J117: -5.6999999999999993e-003 | K117: 10.5 | L117: -2.9600000000000001e-002 | M117: 121.1 | N117: 5.19 | O117: 2.2000000000000002e-002 | P117: 202.31 | Q117: 已到 | R117: 4.84年 | S117: 2.84年 | T117: 4.17 | U117: 63 | V117: 7.2999999999999995e-002 | W117: 4.4999999999999998e-002 | X117: 9.0999999999999998e-002 | Y117: 93 | Z117: 2.72 | AA117: -0.106 | AB117: -0.113 | AC117: -0.128 | AD117: -0.129 | AE117: 85.14 | AF117: 88 | AG117: 0.95 | AH117: A+ | AI117: 6.9800000000000001e-002 | AJ117: =H117+100*O117 -> 208.97099999999998 | AK117: 211.2 | AL117: 348 | AM117: 123.2 | AN117: 353 | AO117: 1.9e-002 | AP117: 10 | AQ117: 天壕转债!
A118: 117 | B118: 113615 | C118: 金诚转债! | D118: 603979 | E118: 金诚信 | F118: 有色金属 | G118: 有色行业 | H118: 207.46 | I118: 1.6e-002 | J118: 2.5099999999999997e-002 | K118: 24.42 | L118: 4.3099999999999999e-002 | M118: 116.9 | N118: 12.65 | O118: 7.4999999999999997e-002 | P118: 193.04 | Q118: 已到 | R118: 4.84年 | S118: 2.84年 | T118: 8.66 | U118: 350 | V118: 0.193 | W118: 5.9999999999999998e-002 | X118: 0.115 | Y118: 145 | Z118: 2.93 | AA118: -0.113 | AB118: -0.11900000000000001 | AC118: -0.129 | AD118: -0.13 | AE118: 92.57 | AF118: 98.01 | AG118: 0.95 | AH118: AA | AI118: 3.78e-002 | AJ118: =H118+100*O118 -> 214.96000000000001 | AK118: 221.9 | AL118: 354 | AM118: 123.9 | AN118: 354 | AO118: 0.115 | AP118: 3 | AQ118: 金诚转债!
A119: 118 | B119: 123091 | C119: 长海转债 | D119: 300196 | E119: 长海股份 | F119: 其他 | G119: 非金属矿 | H119: 133.44 | I119: 2.2799999999999997e-002 | J119: -1.95e-002 | K119: 17.92 | L119: 5.0000000000000001e-003 | M119: 115.9 | N119: 16.14 | O119: 0.20199999999999999 | P119: 111.03 | Q119: 已到 | R119: 4.84年 | S119: 2.84年 | T119: 5.5 | U119: 10 | V119: 1.3999999999999999e-002 | W119: 7.4999999999999997e-002 | X119: 8.3000000000000004e-002 | Y119: 73 | Z119: 2.26 | AA119: -2.92e-002 | AB119: -3.4700000000000002e-002 | AC119: -8.1900000000000001e-002 | AD119: -8.3800000000000013e-002 | AE119: 92.57 | AF119: 97.18 | AG119: 0.65 | AH119: AA | AI119: 3.78e-002 | AJ119: =H119+100*O119 -> 153.63999999999999 | AK119: 155.9 | AL119: 200 | AM119: 58.7 | AN119: 178 | AO119: 4.0999999999999995e-002 | AP119: 4 | AQ119: 长海转债
A120: 119 | B120: 123089 | C120: 九洲转2!! | D120: 300040 | E120: 九洲集团 | F120: 能源电力 | G120: 电力设备 | H120: 158.38 | I120: 1.1000000000000001e-003 | J120: -1.1000000000000001e-003 | K120: 8.5 | L120: 0. | M120: 120.6 | N120: 5.68 | O120: 5.7999999999999996e-002 | P120: 149.65 | Q120: 已到 | R120: 4.84年 | S120: 2.84年 | T120: 3.06 | U120: 53 | V120: 0.11 | W120: 6.0999999999999999e-002 | X120: 9.1999999999999998e-002 | Y120: 50 | Z120: 1.95 | AA120: -5.57e-002 | AB120: -6.2400000000000004e-002 | AC120: -0.13100000000000001 | AD120: -0.13200000000000001 | AE120: 87.33 | AF120: 91.99 | AG120: 0.85 | AH120: AA- | AI120: 5.8799999999999998e-002 | AJ120: =H120+100*O120 -> 164.18000000000001 | AK120: 167.1 | AL120: 291 | AM120: 75.1 | AN120: 291 | AO120: -8.0000000000000002e-003 | AP120: 18 | AQ120: 九洲转2!!
A121: 120 | B121: 123090 | C121: 三诺转债! | D121: 300298 | E121: 三诺生物 | F121: 医药 | G121: 医疗器械 | H121: 115.13 | I121: -1.e-003 | J121: 2.7000000000000001e-003 | K121: 23.48 | L121: 8.6e-003 | M121: 116.8 | N121: 35.18 | O121: 0.72499999999999998 | P121: 66.74 | Q121: 已到 | R121: 4.84年 | S121: 2.84年 | T121: 5 | U121: 5.6 | V121: 1.e-002 | W121: 3.7999999999999999e-002 | X121: 2.5000000000000001e-002 | Y121: 133 | Z121: 4.9 | AA121: 3.0000000000000001e-003 | AB121: -3.0999999999999999e-003 | AC121: -3.5699999999999996e-002 | AD121: -3.7699999999999997e-002 | AE121: 92.49 | AF121: 97.93 | AG121: 0.19 | AH121: AA | AI121: 3.78e-002 | AJ121: =H121+100*O121 -> 187.63 | AK121: 163.5 | AL121: 268 | AM121: 65.6 | AN121: 233 | AO121: -8.0000000000000002e-002 | AP121: 6 | AQ121: 三诺转债!
A122: 121 | B122: 128142 | C122: 新乳转债! | D122: 2946 | E122: 新乳业 | F122: 食品饮料 | G122: 乳制品 | H122: 118.4 | I122: -1.6000000000000001e-003 | J122: -5.0000000000000001e-003 | K122: 14.32 | L122: -2.2499999999999999e-002 | M122: 114.8 | N122: 18.47 | O122: 0.52700000000000002 | P122: 77.53 | Q122: 已到 | R122: 4.83年 | S122: 2.83年 | T122: 7.18 | U122: 1.4 | V122: 2.e-003 | W122: 5.7999999999999996e-002 | X122: 4.4999999999999998e-002 | Y122: 124 | Z122: 4.88 | AA122: -6.5000000000000006e-003 | AB122: -1.1899999999999999e-002 | AC122: -4.4800000000000006e-002 | AD122: -4.6799999999999994e-002 | AE122: 92.52 | AF122: 96.29 | AG122: 0.3 | AH122: AA | AI122: 3.78e-002 | AJ122: =H122+100*O122 -> 171.10000000000002 | AK122: 159.3 | AL122: 231 | AM122: 63 | AN122: 206 | AO122: -1.9e-002 | AP122: 5 | AQ122: 新乳转债!
A123: 122 | B123: 128141 | C123: 旺能转债 | D123: 2034 | E123: 旺能环境 | F123: 城市公用 | G123: 三废处理 | H123: 141.351 | I123: 3.0299999999999997e-002 | J123: -2.9100000000000001e-002 | K123: 20.4 | L123: 1.5e-003 | M123: 114.8 | N123: 15.97 | O123: 0.107 | P123: 127.74 | Q123: 已到 | R123: 4.82年 | S123: 2.82年 | T123: 12.7 | U123: 67 | V123: 3.7999999999999999e-002 | W123: 0.14499999999999999 | X123: 0.185 | Y123: 88 | Z123: 1.74 | AA123: -4.2900000000000001e-002 | AB123: -4.8000000000000001e-002 | AC123: -0.10000000000000001 | AD123: -0.10099999999999999 | AE123: 92.53 | AF123: 96.3 | AG123: 0.76 | AH123: AA | AI123: 3.78e-002 | AJ123: =H123+100*O123 -> 152.05099999999999 | AK123: 155 | AL123: 189 | AM123: 58.7 | AN123: 176 | AO123: 4.5999999999999999e-002 | AP123: 8 | AQ123: 旺能转债
A124: 123 | B124: 123087 | C124: 明电转债! | D124: 300739 | E124: 明阳电路 | F124: 电子 | G124: 元器件制 | H124: 122.3 | I124: 2.5000000000000001e-003 | J124: 4.0000000000000002e-004 | K124: 15.9 | L124: 5.1000000000000004e-003 | M124: 120.8 | N124: 16.32 | O124: 0.255 | P124: 97.43 | Q124: 已到 | R124: 4.82年 | S124: 3.82年 | T124: 4.19 | U124: 5.4 | V124: 1.1000000000000001e-002 | W124: 8.900000000000001e-002 | X124: 8.6999999999999994e-002 | Y124: 47 | Z124: 2.83 | AA124: -2.5999999999999999e-003 | AB124: -9.8999999999999991e-003 | AC124: -3.5099999999999999e-002 | AD124: -3.7900000000000003e-002 | AE124: 84.98 | AF124: 92.27 | AG124: 0.57 | AH124: AA- | AI124: 5.8799999999999998e-002 | AJ124: =H124+100*O124 -> 147.80000000000001 | AK124: 147.2 | AL124: 107 | AM124: 54.9 | AN124: 143 | AO124: -2.4e-002 | AP124: 19 | AQ124: 明电转债!
A125: 124 | B125: 123088 | C125: 威唐转债! | D125: 300707 | E125: 威唐工业 | F125: 汽车 | G125: 零部件制 | H125: 117.001 | I125: 3.0999999999999999e-003 | J125: -3.0999999999999999e-003 | K125: 16.85 | L125: 0. | M125: 121.1 | N125: 20.72 | O125: 0.439 | P125: 81.32 | Q125: 已到 | R125: 4.82年 | S125: 2.82年 | T125: 3.01 | U125: 4.6 | V125: 1.3000000000000001e-002 | W125: 0.114 | X125: 9.3000000000000013e-002 | Y125: 26 | Z125: 3.76 | AA125: 7.3000000000000001e-003 | AB125: -2.0000000000000001e-004 | AC125: -3.8699999999999998e-002 | AD125: -4.1200000000000001e-002 | AE125: 85.28 | AF125: 88.14 | AG125: 0.48 | AH125: A+ | AI125: 6.9800000000000001e-002 | AJ125: =H125+100*O125 -> 160.90100000000001 | AK125: 152.7 | AL125: 170 | AM125: 64.5 | AN125: 223 | AO125: -3.4000000000000002e-002 | AP125: 18 | AQ125: 威唐转债!
A126: 125 | B126: 113044 | C126: 大秦转债! | D126: 601006 | E126: 大秦铁路 | F126: 铁路 | G126: 铁路运输 | H126: 112.49 | I126: 9.7999999999999997e-003 | J126: 8.0000000000000004e-004 | K126: 7.05 | L126: 2.0299999999999999e-002 | M126: 113.9 | N126: 7.18 | O126: 0.14599999999999999 | P126: 98.19 | Q126: 已到 | R126: 4.82年 | S126: 2.82年 | T126: 320 | U126: 353 | V126: 1.e-002 | W126: 0.30499999999999999 | X126: 0.29999999999999999 | Y126: 1048. | Z126: 0.87 | AA126: 2.5999999999999999e-003 | AB126: -2.5999999999999999e-003 | AC126: -2.7000000000000003e-002 | AD126: -2.9300000000000003e-002 | AE126: 94.83 | AF126: 98.72 | AG126: 0.52 | AH126: AAA | AI126: 3.0800000000000001e-002 | AJ126: =H126+100*O126 -> 127.08999999999999 | AK126: 126.8 | AL126: 5 | AM126: 28.1 | AN126: 7 | AO126: 4.2999999999999997e-002 | AP126: 38 | AQ126: 大秦转债!
A127: 126 | B127: 123085 | C127: 万顺转2!! | D127: 300057 | E127: 万顺新材 | F127: 有色金属 | G127: 铝金属 | H127: 141.1 | I127: 1.1299999999999999e-002 | J127: 1.1599999999999999e-002 | K127: 8.13 | L127: 2.7799999999999998e-002 | M127: 112.9 | N127: 6.2 | O127: 7.5999999999999998e-002 | P127: 131.13 | Q127: 已到 | R127: 4.81年 | S127: 2.81年 | T127: 8.51 | U127: 63 | V127: 5.0999999999999997e-002 | W127: 0.153 | X127: 0.20100000000000001 | Y127: 56 | Z127: 1.54 | AA127: -4.6100000000000002e-002 | AB127: -5.0599999999999999e-002 | AC127: -9.9900000000000003e-002 | AD127: -0.10000000000000001 | AE127: 87.36 | AF127: 86.26 | AG127: 0.82 | AH127: AA- | AI127: 5.8799999999999998e-002 | AJ127: =H127+100*O127 -> 148.69999999999999 | AK127: 151.1 | AL127: 151 | AM127: 63.7 | AN127: 216 | AO127: -3.4000000000000002e-002 | AP127: 19 | AQ127: 万顺转2!!
A128: 127 | B128: 123086 | C128: 海兰转债!! | D128: 300065 | E128: 海兰信 | F128: 电子 | G128: 电子产品 | H128: 218.5 | I128: 1.3500000000000002e-002 | J128: 4.4000000000000003e-003 | K128: 15.28 | L128: 1.8700000000000001e-002 | M128: 123.1 | N128: 7.27 | O128: 4.0000000000000001e-002 | P128: 210.18 | Q128: 已到 | R128: 4.81年 | S128: 2.81年 | T128: 4.81 | U128: 1070. | V128: 0.98699999999999999 | W128: 5.0000000000000003e-002 | X128: 0.105 | Y128: 96 | Z128: 5.72 | AA128: -0.114 | AB128: -0.121 | AC128: -0.13800000000000001 | AD128: -0.13900000000000001 | AE128: 87.39 | AF128: 94.01 | AG128: 0.95 | AH128: AA- | AI128: 5.8799999999999998e-002 | AJ128: =H128+100*O128 -> 222.5 | AK128: 226.8 | AL128: 357 | AM128: 132.8 | AN128: 359 | AO128: 0.105 | AP128: 19 | AQ128: 海兰转债!!
A129: 128 | B129: 123084 | C129: 高澜转债!! | D129: 300499 | E129: 高澜股份 | F129: 能源电力 | G129: 电力设备 | H129: 167.5 | I129: 3.8100000000000002e-002 | J129: 1.84e-002 | K129: 13.84 | L129: 6.54e-002 | M129: 121.4 | N129: 9.01 | O129: 8.9999999999999997e-002 | P129: 153.61 | Q129: 已到 | R129: 4.81年 | S129: 2.81年 | T129: 2.54 | U129: 514 | V129: 1.21 | W129: 6.5000000000000002e-002 | X129: 0.10099999999999999 | Y129: 39 | Z129: 4.51 | AA129: -6.6100000000000006e-002 | AB129: -7.2900000000000006e-002 | AC129: -0.14599999999999999 | AD129: -0.14800000000000002 | AE129: 85.54 | AF129: 88.47 | AG129: 0.86 | AH129: A+ | AI129: 6.9800000000000001e-002 | AJ129: =H129+100*O129 -> 176.5 | AK129: 181.4 | AL129: 329 | AM129: 92.9 | AN129: 335 | AO129: 5.9000000000000004e-002 | AP129: 14 | AQ129: 高澜转债!!
A130: 129 | B130: 127027 | C130: 靖远转债! | D130: 552 | E130: 靖远煤电 | F130: 煤炭 | G130: 煤炭开采 | H130: 134.6 | I130: 3.4300000000000004e-002 | J130: 7.0999999999999995e-003 | K130: 3.93 | L130: 5.6500000000000002e-002 | M130: 114.9 | N130: 3.13 | O130: 7.2000000000000008e-002 | P130: 125.56 | Q130: 已到 | R130: 4.81年 | S130: 2.81年 | T130: 24.3 | U130: 441 | V130: 0.13500000000000001 | W130: 0.26300000000000001 | X130: 0.33000000000000002 | Y130: 92 | Z130: 1.11 | AA130: -3.3000000000000002e-002 | AB130: -3.8199999999999998e-002 | AC130: -8.5500000000000007e-002 | AD130: -8.7400000000000005e-002 | AE130: 94.02 | AF130: 98.69 | AG130: 0.73 | AH130: AA+ | AI130: 3.2799999999999996e-002 | AJ130: =H130+100*O130 -> 141.79999999999998 | AK130: 143.6 | AL130: 70 | AM130: 45 | AN130: 60 | AO130: 6.0999999999999999e-002 | AP130: 36 | AQ130: 靖远转债!
A131: 130 | B131: 113043 | C131: 财通转债! | D131: 601108 | E131: 财通证券 | F131: 金融 | G131: 证券行业 | H131: 112.33 | I131: 3.0000000000000001e-003 | J131: -1.6000000000000001e-003 | K131: 9.86 | L131: 5.1000000000000004e-003 | M131: 110 | N131: 13.13 | O131: 0.496 | P131: 75.1 | Q131: 已到 | R131: 4.81年 | S131: 无权 | T131: 38 | U131: 20 | V131: 5.0000000000000001e-003 | W131: 0.107 | X131: 8.1000000000000003e-002 | Y131: 354 | Z131: 1.52 | AA131: -4.4000000000000003e-003 | AB131: -8.199999999999999e-003 | AC131: 无权 | AD131: 无权 | AE131: 无权 | AF131: 95.28 | AG131: 0.28 | AH131: AAA | AI131: 3.0800000000000001e-002 | AJ131: =H131+100*O131 -> 161.93000000000001 | AK131: 149.6 | AL131: 133 | AM131: 54.3 | AN131: 140 | AO131: -2.e-002 | AP131: 11 | AQ131: 财通转债!
A132: 131 | B132: 123083 | C132: 朗新转债! | D132: 300682 | E132: 朗新科技 | F132: 计算机及 | G132: 软件开发 | H132: 230.11 | I132: 4.0000000000000001e-003 | J132: 1.5800000000000002e-002 | K132: 33.48 | L132: 2.0400000000000001e-002 | M132: 114.8 | N132: 15.39 | O132: 5.7999999999999996e-002 | P132: 217.54 | Q132: 已到 | R132: 4.80年 | S132: 2.80年 | T132: 6.01 | U132: 107 | V132: 7.6999999999999999e-002 | W132: 1.7000000000000001e-002 | X132: 3.7000000000000005e-002 | Y132: 350 | Z132: 6.37 | AA132: -0.13699999999999998 | AB132: -0.14099999999999999 | AC132: -0.14499999999999999 | AD132: -0.14599999999999999 | AE132: 92.6 | AF132: 96.38 | AG132: 0.97 | AH132: AA | AI132: 3.78e-002 | AJ132: =H132+100*O132 -> 235.91000000000003 | AK132: 242.7 | AL132: 362 | AM132: 146.3 | AN132: 363 | AO132: -1.2e-002 | AP132: 7 | AQ132: 朗新转债!
A133: 132 | B133: 127026 | C133: 超声转债! | D133: 823 | E133: 超声电子 | F133: 电子 | G133: 元器件制 | H133: 127.2 | I133: 3.2000000000000002e-003 | J133: -1.5100000000000001e-002 | K133: 12.85 | L133: -2.06e-002 | M133: 112.8 | N133: 12.72 | O133: 0.25900000000000001 | P133: 101.02 | Q133: 已到 | R133: 4.80年 | S133: 2.80年 | T133: 7 | U133: 24 | V133: 2.7000000000000003e-002 | W133: 0.10099999999999999 | X133: 0.10199999999999999 | Y133: 69 | Z133: 1.73 | AA133: -2.52e-002 | AB133: -2.98e-002 | AC133: -6.8199999999999997e-002 | AD133: -7.0099999999999996e-002 | AE133: 92.61 | AF133: 94.72 | AG133: 0.58 | AH133: AA | AI133: 3.78e-002 | AJ133: =H133+100*O133 -> 153.09999999999999 | AK133: 153.4 | AL133: 176 | AM133: 58.7 | AN133: 177 | AO133: 3.1e-002 | AP133: 12 | AQ133: 超声转债!
A134: 133 | B134: 128140 | C134: 润建转债!! | D134: 2929 | E134: 润建股份 | F134: 通信互联 | G134: 通信设备 | H134: 152.9 | I134: 6.0700000000000004e-002 | J134: 5.5000000000000005e-003 | K134: 36.12 | L134: 8.14e-002 | M134: 114.9 | N134: 26.4 | O134: 0.11800000000000001 | P134: 136.82 | Q134: 已到 | R134: 4.80年 | S134: 2.80年 | T134: 10.9 | U134: 389 | V134: 0.23399999999999999 | W134: 0.13200000000000001 | X134: 0.17999999999999999 | Y134: 83 | Z134: 2.35 | AA134: -5.8799999999999998e-002 | AB134: -6.3799999999999996e-002 | AC134: -0.12300000000000001 | AD134: -0.124 | AE134: 92.72 | AF134: 96.5 | AG134: 0.81 | AH134: AA | AI134: 3.78e-002 | AJ134: =H134+100*O134 -> 164.70000000000002 | AK134: 169 | AL134: 301 | AM134: 72.5 | AN134: 277 | AO134: 5.4000000000000006e-002 | AP134: 10 | AQ134: 润建转债!!
A135: 134 | B135: 123082 | C135: 北陆转债! | D135: 300016 | E135: 北陆药业 | F135: 医药 | G135: 化学制药 | H135: 118.37 | I135: 6.5000000000000006e-003 | J135: -1.6000000000000001e-003 | K135: 8.05 | L135: 8.8000000000000005e-003 | M135: 121.2 | N135: 8.81 | O135: 0.29499999999999998 | P135: 91.37 | Q135: 已到 | R135: 4.80年 | S135: 2.80年 | T135: 4.99 | U135: 1.6 | V135: 3.0000000000000001e-003 | W135: 0.126 | X135: 0.115 | Y135: 40 | Z135: 2.31 | AA135: 5.0000000000000001e-003 | AB135: -2.5000000000000001e-003 | AC135: -4.2699999999999995e-002 | AD135: -4.5199999999999997e-002 | AE135: 85.42 | AF135: 88.35 | AG135: 0.57 | AH135: A+ | AI135: 6.9800000000000001e-002 | AJ135: =H135+100*O135 -> 147.87 | AK135: 145.4 | AL135: 84 | AM135: 57 | AN135: 164 | AO135: -3.7000000000000005e-002 | AP135: 18 | AQ135: 北陆转债!
A136: 135 | B136: 123080 | C136: 海波转债! | D136: 300517 | E136: 海波重科 | F136: 建筑 | G136: 建筑工程 | H136: 135.5 | I136: 3.5699999999999996e-002 | J136: -3.0999999999999999e-003 | K136: 14.58 | L136: 4.3700000000000003e-002 | M136: 126 | N136: 11.58 | O136: 7.5999999999999998e-002 | P136: 125.91 | Q136: 已到 | R136: 4.78年 | S136: 2.78年 | T136: 2.44 | U136: 163 | V136: 0.505 | W136: 8.6999999999999994e-002 | X136: 0.109 | Y136: 28 | Z136: 3.26 | AA136: -1.54e-002 | AB136: -2.41e-002 | AC136: -8.5999999999999993e-002 | AD136: -8.8399999999999992e-002 | AE136: 85.55 | AF136: 91.92 | AG136: 0.75 | AH136: A+ | AI136: 6.9800000000000001e-002 | AJ136: =H136+100*O136 -> 143.09999999999999 | AK136: 145.1 | AL136: 83 | AM136: 53.2 | AN136: 131 | AO136: 0.121 | AP136: 25 | AQ136: 海波转债!
A137: 136 | B137: 113610 | C137: 灵康转债 | D137: 603669 | E137: 灵康药业 | F137: 医药 | G137: 化学制药 | H137: 116.99 | I137: 9.300000000000001e-003 | J137: -8.0000000000000002e-003 | K137: 8.22 | L137: 2.3999999999999998e-003 | M137: 120.7 | N137: 8.61 | O137: 0.22500000000000001 | P137: 95.47 | Q137: 已到 | R137: 4.78年 | S137: 2.78年 | T137: 4.58 | U137: 4.7 | V137: 9.0000000000000011e-003 | W137: 7.6999999999999999e-002 | X137: 7.400000000000001e-002 | Y137: 59 | Z137: 4.3 | AA137: 6.7000000000000002e-003 | AB137: -8.0000000000000004e-004 | AC137: -4.07e-002 | AD137: -4.2900000000000001e-002 | AE137: 87.7 | AF137: 92.38 | AG137: 0.55 | AH137: AA- | AI137: 5.8799999999999998e-002 | AJ137: =H137+100*O137 -> 139.49000000000001 | AK137: 138.5 | AL137: 35 | AM137: 46.1 | AN137: 73 | AO137: -3.5000000000000003e-002 | AP137: 30 | AQ137: 灵康转债
A138: 137 | B138: 128139 | C138: 祥鑫转债! | D138: 2965 | E138: 祥鑫科技 | F138: 汽车 | G138: 零部件制 | H138: 123 | I138: 1.8e-003 | J138: -1.0200000000000001e-002 | K138: 26.7 | L138: -1.3999999999999999e-002 | M138: 120.6 | N138: 26.38 | O138: 0.215 | P138: 101.21 | Q138: 已到 | R138: 4.78年 | S138: 2.78年 | T138: 6.47 | U138: 20 | V138: 2.5000000000000001e-002 | W138: 0.158 | X138: 0.16 | Y138: 41 | Z138: 2.31 | AA138: -4.1999999999999997e-003 | AB138: -1.15e-002 | AC138: -5.7200000000000001e-002 | AD138: -5.9299999999999999e-002 | AE138: 87.6 | AF138: 92.28 | AG138: 0.6 | AH138: AA- | AI138: 5.8799999999999998e-002 | AJ138: =H138+100*O138 -> 144.5 | AK138: 144.8 | AL138: 79 | AM138: 52.5 | AN138: 124 | AO138: 9.8000000000000004e-002 | AP138: 15 | AQ138: 祥鑫转债!
A139: 138 | B139: 123078 | C139: 飞凯转债!! | D139: 300398 | E139: 飞凯材料 | F139: 化工 | G139: 化工 | H139: 172.259 | I139: -3.0000000000000001e-003 | J139: -2.0000000000000001e-004 | K139: 24.47 | L139: -3.7000000000000002e-003 | M139: 114.9 | N139: 15.56 | O139: 9.5000000000000001e-002 | P139: 157.26 | Q139: 已到 | R139: 4.77年 | S139: 2.77年 | T139: 7.2 | U139: 297 | V139: 0.23800000000000002 | W139: 5.5999999999999994e-002 | X139: 8.900000000000001e-002 | Y139: 128 | Z139: 4.37 | AA139: -8.2699999999999996e-002 | AB139: -8.7599999999999997e-002 | AC139: -0.105 | AD139: -0.106 | AE139: 92.81 | AF139: 96.6 | AG139: 0.89 | AH139: AA | AI139: 3.78e-002 | AJ139: =H139+100*O139 -> 181.75899999999999 | AK139: 187.3 | AL139: 337 | AM139: 90.7 | AN139: 333 | AO139: -7.0999999999999994e-002 | AP139: 9 | AQ139: 飞凯转债!!
A140: 139 | B140: 113609 | C140: 永安转债! | D140: 603776 | E140: 永安行 | F140: 城市公用 | G140: 其他 | H140: 116.84 | I140: 2.0999999999999999e-003 | J140: -1.8e-003 | K140: 15.83 | L140: 5.9999999999999995e-004 | M140: 120.1 | N140: 16.48 | O140: 0.21600000000000003 | P140: 96.06 | Q140: 已到 | R140: 4.76年 | S140: 2.76年 | T140: 7.34 | U140: 13 | V140: 1.4999999999999999e-002 | W140: 0.19899999999999998 | X140: 0.191 | Y140: 37 | Z140: 1.13 | AA140: 5.8999999999999999e-003 | AB140: -1.4000000000000002e-003 | AC140: -4.1100000000000005e-002 | AD140: -4.3200000000000002e-002 | AE140: 87.63 | AF140: 91.98 | AG140: 0.56 | AH140: AA- | AI140: 5.8799999999999998e-002 | AJ140: =H140+100*O140 -> 138.44 | AK140: 137.6 | AL140: 28 | AM140: 45.6 | AN140: 69 | AO140: -6.8000000000000005e-002 | AP140: 26 | AQ140: 永安转债!
A141: 140 | B141: 123077 | C141: 汉得转债! | D141: 300170 | E141: 汉得信息 | F141: 计算机及 | G141: 软件开发 | H141: 119.965 | I141: 1.9199999999999998e-002 | J141: -7.7000000000000002e-003 | K141: 8.4 | L141: 3.5799999999999998e-002 | M141: 125.1 | N141: 9.69 | O141: 0.38400000000000001 | P141: 86.69 | Q141: 已到 | R141: 4.76年 | S141: 2.76年 | T141: 9.37 | U141: 17 | V141: 1.4999999999999999e-002 | W141: 0.126 | X141: 0.109 | Y141: 74 | Z141: 2.37 | AA141: 9.0000000000000011e-003 | AB141: 2.0000000000000001e-004 | AC141: -4.9800000000000004e-002 | AD141: -5.1900000000000002e-002 | AE141: 92.88 | AF141: 105.19 | AG141: 0.32 | AH141: AA | AI141: 3.78e-002 | AJ141: =H141+100*O141 -> 158.36500000000001 | AK141: 153.2 | AL141: 175 | AM141: 48.1 | AN141: 86 | AO141: -1.8000000000000002e-002 | AP141: 17 | AQ141: 汉得转债!
A142: 141 | B142: 110077 | C142: 洪城转债 | D142: 600461 | E142: 洪城环境 | F142: 城市公用 | G142: 城市公用 | H142: 135.3 | I142: 7.0999999999999995e-003 | J142: 2.0000000000000001e-004 | K142: 8.28 | L142: 9.7999999999999997e-003 | M142: 113.3 | N142: 6.71 | O142: 9.6000000000000002e-002 | P142: 123.4 | Q142: 已到 | R142: 4.75年 | S142: 2.75年 | T142: 17.7 | U142: 38 | V142: 1.6e-002 | W142: 0.22399999999999998 | X142: 0.27600000000000002 | Y142: 79 | Z142: 1.46 | AA142: -3.7100000000000001e-002 | AB142: -4.1900000000000007e-002 | AC142: -9.2499999999999999e-002 | AD142: -9.3699999999999992e-002 | AE142: 92.93 | AF142: 97.38 | AG142: 0.75 | AH142: AA+ | AI142: 3.2799999999999996e-002 | AJ142: =H142+100*O142 -> 144.90000000000001 | AK142: 147.2 | AL142: 108 | AM142: 49.8 | AN142: 99 | AO142: 3.1e-002 | AP142: 6 | AQ142: 洪城转债
A143: 142 | B143: 123076 | C143: 强力转债! | D143: 300429 | E143: 强力新材 | F143: 化工 | G143: 化工 | H143: 109.59 | I143: 2.2000000000000001e-003 | J143: -5.0000000000000001e-004 | K143: 11.3 | L143: 9.7999999999999997e-003 | M143: 118.1 | N143: 18.94 | O143: 0.83700000000000008 | P143: 59.66 | Q143: 已到 | R143: 4.75年 | S143: 2.75年 | T143: 8.5 | U143: 3.1 | V143: 3.0000000000000001e-003 | W143: 0.14599999999999999 | X143: 8.6999999999999994e-002 | Y143: 58 | Z143: 3.22 | AA143: 1.6200000000000003e-002 | AB143: 9.3999999999999986e-003 | AC143: -1.9799999999999998e-002 | AD143: -2.2000000000000002e-002 | AE143: 87.69 | AF143: 90.53 | AG143: 0.17 | AH143: AA- | AI143: 5.8799999999999998e-002 | AJ143: =H143+100*O143 -> 193.29000000000002 | AK143: 159.5 | AL143: 234 | AM143: 69 | AN143: 256 | AO143: -1.9e-002 | AP143: 24 | AQ143: 强力转债!
A144: 143 | B144: 128138 | C144: 侨银转债! | D144: 2973 | E144: 侨银股份 | F144: 城市公用 | G144: 城市公用 | H144: 118.49 | I144: 7.6e-003 | J144: -8.8000000000000005e-003 | K144: 16 | L144: -8.1000000000000013e-003 | M144: 136.1 | N144: 25.33 | O144: 0.87599999999999989 | P144: 63.17 | Q144: 已到 | R144: 4.74年 | S144: 2.74年 | T144: 4.2 | U144: 6.4 | V144: 1.3000000000000001e-002 | W144: 6.4000000000000001e-002 | X144: 4.0999999999999995e-002 | Y144: 65 | Z144: 4.08 | AA144: 3.0200000000000001e-002 | AB144: 1.8200000000000001e-002 | AC144: -4.41e-002 | AD144: -4.6600000000000003e-002 | AE144: 88.22 | AF144: 104.35 | AG144: 0.15 | AH144: AA- | AI144: 5.8799999999999998e-002 | AJ144: =H144+100*O144 -> 206.08999999999997 | AK144: 173.8 | AL144: 312 | AM144: 69.5 | AN144: 263 | AO144: 2.9999999999999999e-002 | AP144: 27 | AQ144: 侨银转债!
A145: 144 | B145: 113608 | C145: 威派转债! | D145: 603956 | E145: 威派格 | F145: 机械装备 | G145: 专用设备 | H145: 117.24 | I145: 1.1000000000000001e-003 | J145: 6.6e-003 | K145: 15.78 | L145: 1.61e-002 | M145: 121.1 | N145: 19.08 | O145: 0.41799999999999998 | P145: 82.7 | Q145: 已到 | R145: 4.72年 | S145: 2.72年 | T145: 4.2 | U145: 2 | V145: 4.0000000000000001e-003 | W145: 6.2e-002 | X145: 5.2000000000000005e-002 | Y145: 67 | Z145: 5.68 | AA145: 6.9999999999999993e-003 | AB145: -7.000000000000001e-004 | AC145: -4.07e-002 | AD145: -4.3299999999999998e-002 | AE145: 85.85 | AF145: 88.73 | AG145: 0.48 | AH145: A+ | AI145: 6.9800000000000001e-002 | AJ145: =H145+100*O145 -> 159.03999999999999 | AK145: 151.8 | AL145: 164 | AM145: 63 | AN145: 208 | AO145: -7.2999999999999995e-002 | AP145: 9 | AQ145: 威派转债!
A146: 145 | B146: 127025 | C146: 冀东转债! | D146: 401 | E146: 冀东水泥 | F146: 建筑 | G146: 水泥 | H146: 117.251 | I146: 4.7999999999999996e-003 | J146: 3.0999999999999999e-003 | K146: 12.64 | L146: 1.77e-002 | M146: 109.9 | N146: 14.01 | O146: 0.29999999999999999 | P146: 90.22 | Q146: 已到 | R146: 4.71年 | S146: 2.71年 | T146: 17.8 | U146: 58 | V146: 2.7999999999999997e-002 | W146: 5.2999999999999999e-002 | X146: 4.8000000000000001e-002 | Y146: 336 | Z146: 1.1 | AA146: -1.3899999999999999e-002 | AB146: -1.77e-002 | AC146: -4.5400000000000003e-002 | AD146: -4.7100000000000003e-002 | AE146: 94.13 | AF146: 95.48 | AG146: 0.45 | AH146: AAA | AI146: 3.0800000000000001e-002 | AJ146: =H146+100*O146 -> 147.251 | AK146: 144.3 | AL146: 73 | AM146: 48.8 | AN146: 89 | AO146: 4.0000000000000001e-002 | AP146: 8 | AQ146: 冀东转债!
A147: 146 | B147: 127024 | C147: 盈峰转债! | D147: 967 | E147: 盈峰环境 | F147: 机械装备 | G147: 专用设备 | H147: 114.3 | I147: 1.04e-002 | J147: -1.15e-002 | K147: 6.16 | L147: -4.7999999999999996e-003 | M147: 116.6 | N147: 8.19 | O147: 0.52000000000000002 | P147: 75.21 | Q147: 已到 | R147: 4.71年 | S147: 2.71年 | T147: 14.8 | U147: 18 | V147: 1.1000000000000001e-002 | W147: 7.4999999999999997e-002 | X147: 5.7000000000000002e-002 | Y147: 196 | Z147: 1.19 | AA147: 4.3e-003 | AB147: -1.9e-003 | AC147: -3.5499999999999997e-002 | AD147: -3.7400000000000003e-002 | AE147: 94.03 | AF147: 100.43 | AG147: 0.22 | AH147: AA+ | AI147: 3.2799999999999996e-002 | AJ147: =H147+100*O147 -> 166.30000000000001 | AK147: 153.4 | AL147: 177 | AM147: 53 | AN147: 129 | AO147: -2.8999999999999998e-002 | AP147: 5 | AQ147: 盈峰转债!
A148: 147 | B148: 128137 | C148: 洁美转债! | D148: 2859 | E148: 洁美科技 | F148: 电子 | G148: 元器件制 | H148: 140.875 | I148: 6.1999999999999998e-003 | J148: -1.6299999999999999e-002 | K148: 32.11 | L148: -1.38e-002 | M148: 116.9 | N148: 27.63 | O148: 0.21199999999999999 | P148: 116.21 | Q148: 已到 | R148: 4.71年 | S148: 2.71年 | T148: 5.99 | U148: 41 | V148: 4.9000000000000002e-002 | W148: 4.5999999999999999e-002 | X148: 5.2999999999999999e-002 | Y148: 132 | Z148: 6.69 | AA148: -3.95e-002 | AB148: -4.5499999999999999e-002 | AC148: -0.10199999999999999 | AD148: -0.10400000000000001 | AE148: 87.87 | AF148: 89.81 | AG148: 0.73 | AH148: AA- | AI148: 5.8799999999999998e-002 | AJ148: =H148+100*O148 -> 162.07499999999999 | AK148: 165.5 | AL148: 284 | AM148: 75.7 | AN148: 295 | AO148: -2.6000000000000002e-002 | AP148: 5 | AQ148: 洁美转债!
A149: 148 | B149: 128136 | C149: 立讯转债! | D149: 2475 | E149: 立讯精密 | F149: 电子 | G149: 元器件制 | H149: 119.994 | I149: 8.0000000000000004e-004 | J149: -5.1000000000000004e-003 | K149: 43.55 | L149: -1.67e-002 | M149: 111.8 | N149: 57.97 | O149: 0.59699999999999998 | P149: 75.13 | Q149: 已到 | R149: 4.70年 | S149: 2.70年 | T149: 30 | U149: 27 | V149: 6.9999999999999993e-003 | W149: 1.e-002 | X149: 6.9999999999999993e-003 | Y149: 3080. | Z149: 9.53 | AA149: -1.5100000000000001e-002 | AB149: -1.9599999999999999e-002 | AC149: -5.4199999999999998e-002 | AD149: -5.5599999999999997e-002 | AE149: 93.27 | AF149: 96.24 | AG149: 0.26 | AH149: AA+ | AI149: 3.2799999999999996e-002 | AJ149: =H149+100*O149 -> 179.69399999999999 | AK149: 164.9 | AL149: 276 | AM149: 68.6 | AN149: 255 | AO149: -5.0999999999999997e-002 | AP149: 14 | AQ149: 立讯转债!
A150: 149 | B150: 110076 | C150: 华海转债! | D150: 600521 | E150: 华海药业 | F150: 医药 | G150: 医药行业 | H150: 115.55 | I150: 1.8200000000000001e-002 | J150: -2.8999999999999998e-003 | K150: 21.62 | L150: 0.10000000000000001 | M150: 114.8 | N150: 33.85 | O150: 0.80900000000000005 | P150: 63.87 | Q150: 已到 | R150: 4.70年 | S150: 2.70年 | T150: 18.4 | U150: 67 | V150: 3.1e-002 | W150: 5.7000000000000002e-002 | X150: 3.6000000000000004e-002 | Y150: 323 | Z150: 4.92 | AA150: -1.4000000000000002e-003 | AB150: -6.9999999999999993e-003 | AC150: -3.8599999999999995e-002 | AD150: -4.07e-002 | AE150: 92.95 | AF150: 96.74 | AG150: 0.15 | AH150: AA | AI150: 3.78e-002 | AJ150: =H150+100*O150 -> 196.44999999999999 | AK150: 167.2 | AL150: 294 | AM150: 70.5 | AN150: 268 | AO150: 6.0000000000000001e-003 | AP150: 8 | AQ150: 华海转债!
A151: 150 | B151: 123075 | C151: 贝斯转债!! | D151: 300580 | E151: 贝斯特 | F151: 汽车 | G151: 零部件制 | H151: 143.978 | I151: -9.1999999999999998e-003 | J151: -9.3999999999999986e-003 | K151: 29.45 | L151: -2.4199999999999999e-002 | M151: 115.1 | N151: 23.74 | O151: 0.161 | P151: 124.05 | Q151: 已到 | R151: 4.70年 | S151: 2.70年 | T151: 6 | U151: 22 | V151: 2.6000000000000002e-002 | W151: 0.10199999999999999 | X151: 0.126 | Y151: 59 | Z151: 3.33 | AA151: -4.7300000000000002e-002 | AB151: -5.2600000000000001e-002 | AC151: -0.10800000000000001 | AD151: -0.11 | AE151: 87.93 | AF151: 88.47 | AG151: 0.77 | AH151: AA- | AI151: 5.8799999999999998e-002 | AJ151: =H151+100*O151 -> 160.078 | AK151: 163.9 | AL151: 270 | AM151: 75.4 | AN151: 293 | AO151: -3.6000000000000004e-002 | AP151: 9 | AQ151: 贝斯转债!!
A152: 151 | B152: 113606 | C152: 荣泰转债 | D152: 603579 | E152: 荣泰健康 | F152: 机械装备 | G152: 专用设备 | H152: 121.37 | I152: 1.6399999999999998e-002 | J152: -1.38e-002 | K152: 30.75 | L152: 4.8999999999999998e-003 | M152: 120.7 | N152: 32.83 | O152: 0.29600000000000004 | P152: 93.66 | Q152: 已到 | R152: 4.69年 | S152: 2.69年 | T152: 6 | U152: 3.5 | V152: 5.0000000000000001e-003 | W152: 0.13900000000000001 | X152: 0.13100000000000001 | Y152: 43 | Z152: 2.57 | AA152: -1.1999999999999999e-003 | AB152: -8.6999999999999994e-003 | AC152: -5.4199999999999998e-002 | AD152: -5.6500000000000002e-002 | AE152: 88.14 | AF152: 92.84 | AG152: 0.53 | AH152: AA- | AI152: 5.8799999999999998e-002 | AJ152: =H152+100*O152 -> 150.97 | AK152: 149.1 | AL152: 124 | AM152: 56.2 | AN152: 157 | AO152: -5.0000000000000001e-003 | AP152: 11 | AQ152: 荣泰转债
A153: 152 | B153: 123073 | C153: 同和转债!! | D153: 300636 | E153: 同和药业 | F153: 医药 | G153: 原料药 | H153: 144.7 | I153: 2.9500000000000002e-002 | J153: -2.75e-002 | K153: 20.43 | L153: 2.5000000000000001e-003 | M153: 121.9 | N153: 14.82 | O153: 5.0000000000000003e-002 | P153: 137.85 | Q153: 已到 | R153: 4.68年 | S153: 2.68年 | T153: 3.58 | U153: 113 | V153: 0.218 | W153: 8.5000000000000006e-002 | X153: 0.11699999999999999 | Y153: 42 | Z153: 5.12 | AA153: -3.6699999999999997e-002 | AB153: -4.4199999999999996e-002 | AC153: -0.109 | AD153: -0.111 | AE153: 86.05 | AF153: 89.53 | AG153: 0.81 | AH153: A+ | AI153: 6.9800000000000001e-002 | AJ153: =H153+100*O153 -> 149.69999999999999 | AK153: 151.5 | AL153: 159 | AM153: 62 | AN153: 201 | AO153: -3.7999999999999999e-002 | AP153: 13 | AQ153: 同和转债!!
A154: 153 | B154: 113605 | C154: 大参转债! | D154: 603233 | E154: 大参林 | F154: 医药 | G154: 医药商业 | H154: 113.76 | I154: 1.8e-003 | J154: -2.2000000000000001e-003 | K154: 36.96 | L154: -6.9999999999999993e-003 | M154: 114.9 | N154: 69.05 | O154: 1.1299999999999999 | P154: 53.53 | Q154: 已到 | R154: 4.67年 | S154: 2.67年 | T154: 14 | U154: 0.8 | V154: 0. | W154: 4.8000000000000001e-002 | X154: 2.6000000000000002e-002 | Y154: 292 | Z154: 5.49 | AA154: 2.2000000000000001e-003 | AB154: -3.4999999999999996e-003 | AC154: -3.3300000000000003e-002 | AD154: -3.5499999999999997e-002 | AE154: 93.15 | AF154: 96.95 | AG154: 0.06 | AH154: AA | AI154: 3.78e-002 | AJ154: =H154+100*O154 -> 226.75999999999999 | AK154: 174 | AL154: 314 | AM154: 77 | AN154: 299 | AO154: -5.7999999999999996e-002 | AP154: 8 | AQ154: 大参转债!
A155: 154 | B155: 123071 | C155: 天能转债!! | D155: 300569 | E155: 天能重工 | F155: 能源电力 | G155: 风能 | H155: 209.5 | I155: -6.6e-003 | J155: -2.7000000000000001e-003 | K155: 15.03 | L155: -9.8999999999999991e-003 | M155: 120.7 | N155: 7.91 | O155: 0.10300000000000001 | P155: 190.01 | Q155: 已到 | R155: 4.67年 | S155: 2.67年 | T155: 6.94 | U155: 287 | V155: 0.19600000000000001 | W155: 5.7999999999999996e-002 | X155: 0.11 | Y155: 120 | Z155: 3.41 | AA155: -0.113 | AB155: -0.12 | AC155: -0.14199999999999999 | AD155: -0.14300000000000002 | AE155: 88.25 | AF155: 92.96 | AG155: 0.94 | AH155: AA- | AI155: 5.8799999999999998e-002 | AJ155: =H155+100*O155 -> 219.80000000000001 | AK155: 229 | AL155: 359 | AM155: 136 | AN155: 360 | AO155: 0.107 | AP155: 12 | AQ155: 天能转债!!
A156: 155 | B156: 123072 | C156: 乐歌转债! | D156: 300729 | E156: 乐歌股份 | F156: 其他 | G156: 家居用品 | H156: 120.1 | I156: 1.1000000000000001e-003 | J156: 0. | K156: 24.7 | L156: 1.06e-002 | M156: 129.1 | N156: 49.24 | O156: 1.3899999999999999 | P156: 50.16 | Q156: 已到 | R156: 4.67年 | S156: 2.67年 | T156: 1.42 | U156: 7.4 | V156: 4.2999999999999997e-002 | W156: 2.6000000000000002e-002 | X156: 1.3000000000000001e-002 | Y156: 55 | Z156: 3.01 | AA156: 1.61e-002 | AB156: 5.7999999999999996e-003 | AC156: -4.2999999999999997e-002 | AD156: -4.6900000000000004e-002 | AE156: 87.94 | AF156: 95.19 | AG156: 0.1 | AH156: A+ | AI156: 6.9800000000000001e-002 | AJ156: =H156+100*O156 -> 259.10000000000002 | AK156: 190 | AL156: 340 | AM156: 94.9 | AN156: 338 | AO156: 1.e-003 | AP156: 12 | AQ156: 乐歌转债!
A157: 156 | B157: 123070 | C157: 鹏辉转债! | D157: 300438 | E157: 鹏辉能源 | F157: 汽车 | G157: 零部件制 | H157: 227.457 | I157: 4.4000000000000003e-003 | J157: -2.9700000000000001e-002 | K157: 41.77 | L157: -2.6099999999999998e-002 | M157: 114.8 | N157: 20.08 | O157: 9.3000000000000013e-002 | P157: 208.02 | Q157: 已到 | R157: 4.67年 | S157: 2.67年 | T157: 5.99 | U157: 721 | V157: 0.53299999999999992 | W157: 3.3000000000000002e-002 | X157: 6.9000000000000006e-002 | Y157: 181 | Z157: 6.93 | AA157: -0.13800000000000001 | AB157: -0.14300000000000002 | AC157: -0.154 | AD157: -0.155 | AE157: 93.08 | AF157: 96.87 | AG157: 0.97 | AH157: AA | AI157: 3.78e-002 | AJ157: =H157+100*O157 -> 236.75700000000001 | AK157: 246.9 | AL157: 364 | AM157: 150 | AN157: 364 | AO157: 3.1e-002 | AP157: 8 | AQ157: 鹏辉转债!
A158: 157 | B158: 128135 | C158: 洽洽转债! | D158: 2557 | E158: 洽洽食品 | F158: 食品饮料 | G158: 休闲食品 | H158: 125 | I158: 1.54e-002 | J158: -2.2799999999999997e-002 | K158: 55.09 | L158: -1.8000000000000002e-002 | M158: 119.9 | N158: 60.03 | O158: 0.36200000000000004 | P158: 91.77 | Q158: 已到 | R158: 4.67年 | S158: 2.67年 | T158: 13.4 | U158: 29 | V158: 1.7000000000000001e-002 | W158: 4.8000000000000001e-002 | X158: 4.4000000000000004e-002 | Y158: 279 | Z158: 6.4 | AA158: -9.1000000000000004e-003 | AB158: -1.6299999999999999e-002 | AC158: -6.5299999999999997e-002 | AD158: -6.7299999999999999e-002 | AE158: 93.17 | AF158: 101.17 | AG158: 0.41 | AH158: AA | AI158: 3.78e-002 | AJ158: =H158+100*O158 -> 161.19999999999999 | AK158: 158.2 | AL158: 221 | AM158: 57.1 | AN158: 165 | AO158: -2.2000000000000002e-002 | AP158: 11 | AQ158: 洽洽转债!
A159: 158 | B159: 127022 | C159: 恒逸转债 | D159: 703 | E159: 恒逸石化 | F159: 化工 | G159: 化工 | H159: 121.99 | I159: 9.8999999999999991e-003 | J159: -1.6000000000000001e-003 | K159: 10.33 | L159: 1.67e-002 | M159: 108.7 | N159: 11.2 | O159: 0.32299999999999995 | P159: 92.23 | Q159: 已到 | R159: 4.66年 | S159: 2.66年 | T159: 20 | U159: 3.1 | V159: 1.e-003 | W159: 5.2999999999999999e-002 | X159: 4.9000000000000002e-002 | Y159: 379 | Z159: 1.46 | AA159: -2.4799999999999999e-002 | AB159: -2.8199999999999999e-002 | AC159: -6.0299999999999999e-002 | AD159: -6.1799999999999994e-002 | AE159: 93.58 | AF159: 93.75 | AG159: 0.49 | AH159: AA+ | AI159: 3.2799999999999996e-002 | AJ159: =H159+100*O159 -> 154.28999999999999 | AK159: 151.7 | AL159: 163 | AM159: 58 | AN159: 171 | AO159: 4.0000000000000001e-003 | AP159: 6 | AQ159: 恒逸转债
A160: 159 | B160: 110075 | C160: 南航转债 | D160: 600029 | E160: 南方航空 | F160: 交通运输 | G160: 航空运输 | H160: 135.84 | I160: 1.41e-002 | J160: -2.9999999999999997e-004 | K160: 7.35 | L160: 1.9400000000000001e-002 | M160: 109.8 | N160: 6.24 | O160: 0.153 | P160: 117.79 | Q160: 已到 | R160: 4.65年 | S160: 2.65年 | T160: 59 | U160: 141 | V160: 1.8000000000000002e-002 | W160: 4.7e-002 | X160: 5.5999999999999994e-002 | Y160: 1246. | Z160: 1.69 | AA160: -4.5199999999999997e-002 | AB160: -4.8899999999999999e-002 | AC160: -9.69e-002 | AD160: -9.8100000000000007e-002 | AE160: 93.73 | AF160: 95.53 | AG160: 0.71 | AH160: AAA | AI160: 3.0800000000000001e-002 | AJ160: =H160+100*O160 -> 151.14000000000001 | AK160: 153.9 | AL160: 181 | AM160: 58.4 | AN160: 174 | AO160: 6.9999999999999993e-003 | AP160: 8 | AQ160: 南航转债
A161: 160 | B161: 113604 | C161: 多伦转债! | D161: 603528 | E161: 多伦科技 | F161: 计算机及 | G161: 软件开发 | H161: 107.99 | I161: 6.5000000000000006e-003 | J161: -4.4000000000000003e-003 | K161: 6.24 | L161: 1.1299999999999999e-002 | M161: 116.9 | N161: 10.4 | O161: 0.80000000000000004 | P161: 60 | Q161: 已到 | R161: 4.65年 | S161: 2.65年 | T161: 6.4 | U161: 1.6 | V161: 2.e-003 | W161: 0.16399999999999998 | X161: 9.8000000000000004e-002 | Y161: 39 | Z161: 2.39 | AA161: 1.7500000000000002e-002 | AB161: 1.1000000000000001e-002 | AC161: -1.54e-002 | AD161: -1.77e-002 | AE161: 88.17 | AF161: 90.12 | AG161: 0.19 | AH161: AA- | AI161: 5.8799999999999998e-002 | AJ161: =H161+100*O161 -> 187.99000000000001 | AK161: 156 | AL161: 201 | AM161: 65.9 | AN161: 235 | AO161: -5.5999999999999994e-002 | AP161: 17 | AQ161: 多伦转债!
A162: 161 | B162: 128134 | C162: 鸿路转债! | D162: 2541 | E162: 鸿路钢构 | F162: 建筑 | G162: 其他建材 | H162: 139.4 | I162: 1.1599999999999999e-002 | J162: -8.3999999999999995e-003 | K162: 51.68 | L162: 4.5000000000000005e-003 | M162: 114.8 | N162: 43.51 | O162: 0.17399999999999999 | P162: 118.78 | Q162: 已到 | R162: 4.64年 | S162: 2.64年 | T162: 15.7 | U162: 46 | V162: 2.1000000000000001e-002 | W162: 5.7000000000000002e-002 | X162: 6.8000000000000005e-002 | Y162: 274 | Z162: 4.13 | AA162: -4.1700000000000001e-002 | AB162: -4.7100000000000003e-002 | AC162: -0.10099999999999999 | AD162: -0.10300000000000001 | AE162: 93.18 | AF162: 96.98 | AG162: 0.72 | AH162: AA | AI162: 3.78e-002 | AJ162: =H162+100*O162 -> 156.80000000000001 | AK162: 160 | AL162: 239 | AM162: 63 | AN162: 207 | AO162: -1.3000000000000001e-002 | AP162: 4 | AQ162: 鸿路转债!
A163: 162 | B163: 128133 | C163: 奇正转债! | D163: 2287 | E163: 奇正藏药 | F163: 医药 | G163: 中药 | H163: 117.118 | I163: 1.1399999999999999e-002 | J163: -1.6000000000000001e-003 | K163: 26.43 | L163: 2.4399999999999998e-002 | M163: 116.9 | N163: 29.79 | O163: 0.32000000000000001 | P163: 88.72 | Q163: 已到 | R163: 4.59年 | S163: 2.59年 | T163: 8 | U163: 15 | V163: 1.6e-002 | W163: 5.7000000000000002e-002 | X163: 5.0999999999999997e-002 | Y163: 140 | Z163: 4.74 | AA163: -4.0000000000000002e-004 | AB163: -6.8999999999999999e-003 | AC163: -4.4500000000000005e-002 | AD163: -4.6799999999999994e-002 | AE163: 93.44 | AF163: 98.93 | AG163: 0.4 | AH163: AA | AI163: 3.78e-002 | AJ163: =H163+100*O163 -> 149.11799999999999 | AK163: 145.5 | AL163: 86 | AM163: 46.6 | AN163: 79 | AO163: 0. | AP163: 20 | AQ163: 奇正转债!
A164: 163 | B164: 123067 | C164: 斯莱转债! | D164: 300382 | E164: 斯莱克 | F164: 机械装备 | G164: 专用设备 | H164: 206 | I164: -2.6000000000000002e-002 | J164: 2.5999999999999999e-003 | K164: 18.02 | L164: -2.4900000000000002e-002 | M164: 120.8 | N164: 9.36 | O164: 7.0000000000000007e-002 | P164: 192.52 | Q164: 已到 | R164: 4.58年 | S164: 2.58年 | T164: 2.4 | U164: 78 | V164: 0.157 | W164: 2.3e-002 | X164: 4.4000000000000004e-002 | Y164: 105 | Z164: 9.06 | AA164: -0.11199999999999999 | AB164: -0.11900000000000001 | AC164: -0.14599999999999999 | AD164: -0.14699999999999999 | AE164: 88.83 | AF164: 93.56 | AG164: 0.94 | AH164: AA- | AI164: 5.8799999999999998e-002 | AJ164: =H164+100*O164 -> 213. | AK164: 219.5 | AL164: 352 | AM164: 125.9 | AN164: 356 | AO164: -0.109 | AP164: 11 | AQ164: 斯莱转债!
A165: 164 | B165: 128132 | C165: 交建转债! | D165: 2941 | E165: 新疆交建 | F165: 建筑 | G165: 建筑工程 | H165: 112.417 | I165: 1.9400000000000001e-002 | J165: -1.66e-002 | K165: 13.86 | L165: 1.1699999999999999e-002 | M165: 116.9 | N165: 18.53 | O165: 0.503 | P165: 74.8 | Q165: 已到 | R165: 4.57年 | S165: 2.57年 | T165: 8.49 | U165: 70 | V165: 7.400000000000001e-002 | W165: 9.5000000000000001e-002 | X165: 7.0999999999999994e-002 | Y165: 89 | Z165: 3.45 | AA165: 8.8000000000000005e-003 | AB165: 2.2000000000000001e-003 | AC165: -3.0299999999999997e-002 | AD165: -3.2599999999999997e-002 | AE165: 93.5 | AF165: 99 | AG165: 0.24 | AH165: AA | AI165: 3.78e-002 | AJ165: =H165+100*O165 -> 162.71699999999998 | AK165: 150 | AL165: 140 | AM165: 51 | AN165: 111 | AO165: 0.10300000000000001 | AP165: 29 | AQ165: 交建转债!
A166: 165 | B166: 128131 | C166: 崇达转2! | D166: 2815 | E166: 崇达技术 | F166: 电子 | G166: 元器件制 | H166: 116.3 | I166: -4.8999999999999998e-003 | J166: 5.8999999999999999e-003 | K166: 14.56 | L166: 4.0999999999999995e-003 | M166: 114.9 | N166: 19.38 | O166: 0.54799999999999993 | P166: 75.13 | Q166: 已到 | R166: 4.55年 | S166: 2.55年 | T166: 14 | U166: 11 | V166: 6.9999999999999993e-003 | W166: 0.11 | X166: 8.199999999999999e-002 | Y166: 127 | Z166: 2.96 | AA166: -2.7000000000000001e-003 | AB166: -8.5000000000000006e-003 | AC166: -4.2699999999999995e-002 | AD166: -4.4999999999999998e-002 | AE166: 93.58 | AF166: 97.39 | AG166: 0.25 | AH166: AA | AI166: 3.78e-002 | AJ166: =H166+100*O166 -> 171.09999999999999 | AK166: 157.5 | AL166: 215 | AM166: 60.1 | AN166: 187 | AO166: -4.0999999999999995e-002 | AP166: 11 | AQ166: 崇达转2!
A167: 166 | B167: 123065 | C167: 宝莱转债! | D167: 300246 | E167: 宝莱特 | F167: 医药 | G167: 医疗器械 | H167: 114.392 | I167: 5.7999999999999996e-003 | J167: -4.6999999999999993e-003 | K167: 18.83 | L167: 1.18e-002 | M167: 121 | N167: 36.63 | O167: 1.23 | P167: 51.41 | Q167: 已到 | R167: 4.54年 | S167: 2.54年 | T167: 2.19 | U167: 10 | V167: 4.0000000000000001e-002 | W167: 6.6000000000000003e-002 | X167: 3.4000000000000002e-002 | Y167: 33 | Z167: 3.15 | AA167: 1.2699999999999999e-002 | AB167: 4.6999999999999993e-003 | AC167: -3.5200000000000002e-002 | AD167: -3.78e-002 | AE167: 89.17 | AF167: 93.92 | AG167: 0.09 | AH167: AA- | AI167: 5.8799999999999998e-002 | AJ167: =H167+100*O167 -> 237.392 | AK167: 177.4 | AL167: 321 | AM167: 83.5 | AN167: 322 | AO167: -3.1e-002 | AP167: 24 | AQ167: 宝莱转债!
A168: 167 | B168: 123064 | C168: 万孚转债! | D168: 300482 | E168: 万孚生物 | F168: 医药 | G168: 医疗器械 | H168: 116.313 | I168: 1.32e-002 | J168: 1.e-003 | K168: 38 | L168: 5.8799999999999998e-002 | M168: 114.8 | N168: 52 | O168: 0.59200000000000008 | P168: 73.08 | Q168: 已到 | R168: 4.53年 | S168: 2.53年 | T168: 5.99 | U168: 56 | V168: 8.1000000000000003e-002 | W168: 3.5000000000000003e-002 | X168: 2.6000000000000002e-002 | Y168: 169 | Z168: 5.27 | AA168: -2.8999999999999998e-003 | AB168: -8.6999999999999994e-003 | AC168: -4.3299999999999998e-002 | AD168: -4.5499999999999999e-002 | AE168: 93.54 | AF168: 97.36 | AG168: 0.24 | AH168: AA | AI168: 3.78e-002 | AJ168: =H168+100*O168 -> 175.51300000000001 | AK168: 159.5 | AL168: 235 | AM168: 62.2 | AN168: 203 | AO168: -4.8000000000000001e-002 | AP168: 14 | AQ168: 万孚转债!
A169: 168 | B169: 128130 | C169: 景兴转债 | D169: 2067 | E169: 景兴纸业 | F169: 造纸包装 | G169: 包装用纸 | H169: 126.78 | I169: 8.6e-003 | J169: -5.1000000000000004e-003 | K169: 4.04 | L169: 5.0000000000000001e-003 | M169: 114.8 | N169: 3.4 | O169: 6.7000000000000004e-002 | P169: 118.82 | Q169: 已到 | R169: 4.53年 | S169: 2.53年 | T169: 9.99 | U169: 21 | V169: 1.7000000000000001e-002 | W169: 0.20699999999999999 | X169: 0.24600000000000002 | Y169: 48 | Z169: 0.92 | AA169: -2.2099999999999998e-002 | AB169: -2.7699999999999999e-002 | AC169: -7.3700000000000002e-002 | AD169: -7.5800000000000006e-002 | AE169: 93.55 | AF169: 97.36 | AG169: 0.69 | AH169: AA | AI169: 3.78e-002 | AJ169: =H169+100*O169 -> 133.47999999999999 | AK169: 134.7 | AL169: 14 | AM169: 37.4 | AN169: 26 | AO169: 3.4000000000000002e-002 | AP169: 21 | AQ169: 景兴转债
A170: 169 | B170: 128129 | C170: 青农转债! | D170: 2958 | E170: 青农商行 | F170: 金融 | G170: 银行行业 | H170: 110.099 | I170: 1.18e-002 | J170: -9.5999999999999992e-003 | K170: 3.83 | L170: 5.1999999999999998e-003 | M170: 112 | N170: 4.32 | O170: 0.24199999999999999 | P170: 88.66 | Q170: 已到 | R170: 4.51年 | S170: 无权 | T170: 50 | U170: 67 | V170: 1.2e-002 | W170: 0.23499999999999999 | X170: 0.20800000000000002 | Y170: 213 | Z170: 0.75 | AA170: 3.9000000000000003e-003 | AB170: -1.e-003 | AC170: 无权 | AD170: 无权 | AE170: 无权 | AF170: 97.89 | AG170: 0.41 | AH170: AAA | AI170: 3.0800000000000001e-002 | AJ170: =H170+100*O170 -> 134.29900000000001 | AK170: 131.5 | AL170: 7 | AM170: 33.6 | AN170: 13 | AO170: -1.e-002 | AP170: 30 | AQ170: 青农转债!
A171: 170 | B171: 113602 | C171: 景20转债! | D171: 603228 | E171: 景旺电子 | F171: 电子 | G171: 元器件制 | H171: 134.01 | I171: 1.4199999999999999e-002 | J171: 5.3e-003 | K171: 31.83 | L171: 2.7400000000000001e-002 | M171: 112.9 | N171: 27.4 | O171: 0.154 | P171: 116.17 | Q171: 已到 | R171: 4.51年 | S171: 2.51年 | T171: 17.8 | U171: 57 | V171: 2.4e-002 | W171: 6.6000000000000003e-002 | X171: 7.5999999999999998e-002 | Y171: 271 | Z171: 4.02 | AA171: -3.7999999999999999e-002 | AB171: -4.2900000000000001e-002 | AC171: -9.3000000000000013e-002 | AD171: -9.5100000000000004e-002 | AE171: 93.71 | AF171: 95.84 | AG171: 0.71 | AH171: AA | AI171: 3.78e-002 | AJ171: =H171+100*O171 -> 149.41 | AK171: 151.9 | AL171: 165 | AM171: 56 | AN171: 156 | AO171: -4.0000000000000001e-002 | AP171: 8 | AQ171: 景20转债!
A172: 171 | B172: 113039 | C172: 嘉泽转债!! | D172: 601619 | E172: 嘉泽新能 | F172: 能源电力 | G172: 风能 | H172: 149.99 | I172: 2.1700000000000001e-002 | J172: -1.3000000000000001e-002 | K172: 4.86 | L172: 1.04e-002 | M172: 112.8 | N172: 3.46 | O172: 6.8000000000000005e-002 | P172: 140.46 | Q172: 已到 | R172: 4.51年 | S172: 2.51年 | T172: 2.88 | U172: 52 | V172: 0.121 | W172: 2.4e-002 | X172: 3.4000000000000002e-002 | Y172: 118 | Z172: 2.48 | AA172: -6.2300000000000001e-002 | AB172: -6.6900000000000001e-002 | AC172: -0.13 | AD172: -0.13100000000000001 | AE172: 93.62 | AF172: 95.74 | AG172: 0.84 | AH172: AA | AI172: 3.78e-002 | AJ172: =H172+100*O172 -> 156.79000000000002 | AK172: 159.5 | AL172: 233 | AM172: 63.8 | AN172: 217 | AO172: 5.0000000000000003e-002 | AP172: 32 | AQ172: 嘉泽转债!!
A173: 172 | B173: 113601 | C173: 塞力转债! | D173: 603716 | E173: 塞力医疗 | F173: 医药 | G173: 医药商业 | H173: 117.16 | I173: 1.9e-002 | J173: -9.300000000000001e-003 | K173: 14.45 | L173: 2.1899999999999999e-002 | M173: 120.8 | N173: 16.98 | O173: 0.377 | P173: 85.1 | Q173: 已到 | R173: 4.50年 | S173: 2.50年 | T173: 5.43 | U173: 90 | V173: 0.14199999999999999 | W173: 0.183 | X173: 0.156 | Y173: 30 | Z173: 1.94 | AA173: 6.9999999999999993e-003 | AB173: -1.e-003 | AC173: -4.5100000000000001e-002 | AD173: -4.7599999999999996e-002 | AE173: 89.21 | AF173: 93.96 | AG173: 0.44 | AH173: AA- | AI173: 5.8799999999999998e-002 | AJ173: =H173+100*O173 -> 154.86000000000001 | AK173: 149.2 | AL173: 125 | AM173: 55.3 | AN173: 146 | AO173: -0.13300000000000001 | AP173: 40 | AQ173: 塞力转债!
A174: 173 | B174: 128128 | C174: 齐翔转2! | D174: 2408 | E174: 齐翔腾达 | F174: 化工 | G174: 化工 | H174: 175.221 | I174: 5.8700000000000002e-002 | J174: -3.2599999999999997e-002 | K174: 9.26 | L174: 2.8900000000000002e-002 | M174: 115 | N174: 5.69 | O174: 7.6999999999999999e-002 | P174: 162.74 | Q174: 已到 | R174: 4.50年 | S174: 2.50年 | T174: 6.81 | U174: 183 | V174: 0.157 | W174: 2.6000000000000002e-002 | X174: 4.2000000000000003e-002 | Y174: 263 | Z174: 2.11 | AA174: -9.0899999999999995e-002 | AB174: -9.6000000000000002e-002 | AC174: -0.124 | AD174: -0.125 | AE174: 93.77 | AF174: 97.66 | AG174: 0.9 | AH174: AA | AI174: 3.78e-002 | AJ174: =H174+100*O174 -> 182.92099999999999 | AK174: 187.7 | AL174: 338 | AM174: 90 | AN174: 332 | AO174: -4.2000000000000003e-002 | AP174: 25 | AQ174: 齐翔转2!
A175: 174 | B175: 128127 | C175: 文科转债! | D175: 2775 | E175: 文科园林 | F175: 城市公用 | G175: 生态环境 | H175: 112.2 | I175: 1.8e-003 | J175: 3.0999999999999999e-003 | K175: 4.3 | L175: 9.3999999999999986e-003 | M175: 120.8 | N175: 4.88 | O175: 0.27300000000000002 | P175: 88.11 | Q175: 已到 | R175: 4.50年 | S175: 2.50年 | T175: 9.49 | U175: 18 | V175: 1.7000000000000001e-002 | W175: 0.43099999999999999 | X175: 0.379 | Y175: 22 | Z175: 1.03 | AA175: 1.6899999999999998e-002 | AB175: 8.8000000000000005e-003 | AC175: -2.9300000000000003e-002 | AD175: -3.1899999999999998e-002 | AE175: 86.82 | AF175: 89.81 | AG175: 0.52 | AH175: A+ | AI175: 6.9800000000000001e-002 | AJ175: =H175+100*O175 -> 139.5 | AK175: 136.3 | AL175: 21 | AM175: 46.5 | AN175: 77 | AO175: 9.4e-002 | AP175: 79 | AQ175: 文科转债!
A176: 175 | B176: 110074 | C176: 精达转债!! | D176: 600577 | E176: 精达股份 | F176: 电子 | G176: 电子产品 | H176: 199.26 | I176: 1.3899999999999999e-002 | J176: -3.2300000000000002e-002 | K176: 6.29 | L176: -2.0199999999999999e-002 | M176: 116.9 | N176: 3.73 | O176: 0.182 | P176: 168.63 | Q176: 已到 | R176: 4.50年 | S176: 2.50年 | T176: 5.1 | U176: 110 | V176: 0.11 | W176: 4.0999999999999995e-002 | X176: 6.8000000000000005e-002 | Y176: 126 | Z176: 2.9 | AA176: -0.114 | AB176: -0.11900000000000001 | AC176: -0.14699999999999999 | AD176: -0.14800000000000002 | AE176: 93.76 | AF176: 99.27 | AG176: 0.91 | AH176: AA | AI176: 3.78e-002 | AJ176: =H176+100*O176 -> 217.45999999999998 | AK176: 229.9 | AL176: 360 | AM176: 130.6 | AN176: 357 | AO176: -6.6000000000000003e-002 | AP176: 10 | AQ176: 精达转债!!
A177: 176 | B177: 110072 | C177: 广汇转债! | D177: 600297 | E177: 广汇汽车 | F177: 汽车 | G177: 分销、售 | H177: 102.43 | I177: 6.6e-003 | J177: -6.0000000000000001e-003 | K177: 2.67 | L177: 3.8e-003 | M177: 114.3 | N177: 4.03 | O177: 0.54600000000000004 | P177: 66.25 | Q177: 已到 | R177: 4.49年 | S177: 2.49年 | T177: 33.7 | U177: 23 | V177: 6.9999999999999993e-003 | W177: 0.155 | X177: 0.10300000000000001 | Y177: 217 | Z177: 0.53 | AA177: 2.5099999999999997e-002 | AB177: 1.9199999999999998e-002 | AC177: 1.4000000000000002e-003 | AD177: -7.000000000000001e-004 | AE177: 94.39 | AF177: 99.11 | AG177: 0.15 | AH177: AA+ | AI177: 3.2799999999999996e-002 | AJ177: =H177+100*O177 -> 157.03 | AK177: 138.6 | AL177: 37 | AM177: 39.5 | AN177: 32 | AO177: 1.3999999999999999e-002 | AP177: 87 | AQ177: 广汇转债!
A178: 177 | B178: 113600 | C178: 新星转债!! | D178: 603978 | E178: 深圳新星 | F178: 有色金属 | G178: 有色行业 | H178: 127.3 | I178: 1.1000000000000001e-003 | J178: -1.3000000000000001e-002 | K178: 23.6 | L178: -2.2799999999999997e-002 | M178: 125.6 | N178: 23.85 | O178: 0.28600000000000003 | P178: 98.95 | Q178: 已到 | R178: 4.48年 | S178: 2.48年 | T178: 4.53 | U178: 22 | V178: 3.7999999999999999e-002 | W178: 0.11599999999999999 | X178: 0.115 | Y178: 39 | Z178: 2.49 | AA178: -3.0999999999999999e-003 | AB178: -1.24e-002 | AC178: -7.5800000000000006e-002 | AD178: -7.8e-002 | AE178: 89.12 | AF178: 97.76 | AG178: 0.52 | AH178: AA- | AI178: 5.8799999999999998e-002 | AJ178: =H178+100*O178 -> 155.90000000000001 | AK178: 155.6 | AL178: 197 | AM178: 57.9 | AN178: 170 | AO178: -2.8999999999999998e-002 | AP178: 23 | AQ178: 新星转债!!
A179: 178 | B179: 127021 | C179: 特发转2! | D179: 70 | E179: 特发信息 | F179: 通信互联 | G179: 通信设备 | H179: 117.366 | I179: 2.6699999999999998e-002 | J179: -1.54e-002 | K179: 6.01 | L179: 3.9800000000000002e-002 | M179: 113 | N179: 7.33 | O179: 0.43099999999999999 | P179: 81.99 | Q179: 已到 | R179: 3.46年 | S179: 1.46年 | T179: 4.16 | U179: 9.1 | V179: 1.9e-002 | W179: 8.199999999999999e-002 | X179: 6.7000000000000004e-002 | Y179: 51 | Z179: 1.71 | AA179: -1.1000000000000001e-002 | AB179: -1.77e-002 | AC179: -8.4199999999999997e-002 | AD179: -8.6099999999999996e-002 | AE179: 95.81 | AF179: 99.54 | AG179: 0.29 | AH179: AA | AI179: 3.78e-002 | AJ179: =H179+100*O179 -> 160.46600000000001 | AK179: 152.7 | AL179: 171 | AM179: 53.2 | AN179: 132 | AO179: -2.7000000000000003e-002 | AP179: 16 | AQ179: 特发转2!
A180: 179 | B180: 113599 | C180: 嘉友转债! | D180: 603871 | E180: 嘉友国际 | F180: 交通运输 | G180: 物流业 | H180: 132.29 | I180: 1.9199999999999998e-002 | J180: -2.07e-002 | K180: 20.46 | L180: -2.3999999999999998e-003 | M180: 125.6 | N180: 18.32 | O180: 0.185 | P180: 111.68 | Q180: 已到 | R180: 4.46年 | S180: 2.46年 | T180: 7.2 | U180: 22 | V180: 2.3e-002 | W180: 0.111 | X180: 0.124 | Y180: 65 | Z180: 2.79 | AA180: -1.18e-002 | AB180: -2.1099999999999997e-002 | AC180: -8.9900000000000008e-002 | AD180: -9.2100000000000015e-002 | AE180: 89.23 | AF180: 97.88 | AG180: 0.62 | AH180: AA- | AI180: 5.8799999999999998e-002 | AJ180: =H180+100*O180 -> 150.78999999999999 | AK180: 152.9 | AL180: 172 | AM180: 55 | AN180: 144 | AO180: -2.e-003 | AP180: 16 | AQ180: 嘉友转债!
A181: 180 | B181: 113598 | C181: 法兰转债 | D181: 603966 | E181: 法兰泰克 | F181: 机械装备 | G181: 工程机械 | H181: 120.74 | I181: 1.3100000000000001e-002 | J181: -6.6e-003 | K181: 9.38 | L181: 1.1899999999999999e-002 | M181: 120.8 | N181: 9.7 | O181: 0.249 | P181: 96.7 | Q181: 已到 | R181: 4.44年 | S181: 2.44年 | T181: 2.75 | U181: 4.7 | V181: 1.3999999999999999e-002 | W181: 9.8000000000000004e-002 | X181: 9.4e-002 | Y181: 28 | Z181: 2.25 | AA181: 1.e-004 | AB181: -7.9000000000000008e-003 | AC181: -5.7099999999999998e-002 | AD181: -5.96e-002 | AE181: 89.5 | AF181: 94.27 | AG181: 0.54 | AH181: AA- | AI181: 5.8799999999999998e-002 | AJ181: =H181+100*O181 -> 145.63999999999999 | AK181: 144.8 | AL181: 78 | AM181: 50.5 | AN181: 107 | AO181: 6.9999999999999993e-003 | AP181: 14 | AQ181: 法兰转债
A182: 181 | B182: 128125 | C182: 华阳转债! | D182: 2949 | E182: 华阳国际 | F182: 建筑 | G182: 建筑工程 | H182: 119.212 | I182: 4.5700000000000005e-002 | J182: -6.7000000000000002e-003 | K182: 20.08 | L182: 0.10000000000000001 | M182: 118.1 | N182: 25.39 | O182: 0.50700000000000001 | P182: 79.09 | Q182: 已到 | R182: 4.44年 | S182: 2.44年 | T182: 4.5 | U182: 242 | V182: 0.45500000000000002 | W182: 0.114 | X182: 8.9999999999999997e-002 | Y182: 39 | Z182: 2.92 | AA182: -2.2000000000000001e-003 | AB182: -9.1999999999999998e-003 | AC182: -5.3399999999999996e-002 | AD182: -5.57e-002 | AE182: 89.24 | AF182: 92.13 | AG182: 0.39 | AH182: AA- | AI182: 5.8799999999999998e-002 | AJ182: =H182+100*O182 -> 169.91200000000001 | AK182: 159.3 | AL182: 232 | AM182: 67.2 | AN182: 245 | AO182: 5.9000000000000004e-002 | AP182: 14 | AQ182: 华阳转债!
A183: 182 | B183: 113597 | C183: 佳力转债! | D183: 603912 | E183: 佳力图 | F183: 机械装备 | G183: 专用设备 | H183: 132.55 | I183: 0.121 | J183: -9.0899999999999995e-002 | K183: 17.27 | L183: 0.10000000000000001 | M183: 124 | N183: 23.15 | O183: 0.77700000000000002 | P183: 74.6 | Q183: 已到 | R183: 4.44年 | S183: 2.44年 | T183: 3 | U183: 1962. | V183: 5.0300000000000002 | W183: 8.0000000000000002e-002 | X183: 5.9999999999999998e-002 | Y183: 37 | Z183: 3.91 | AA183: -1.52e-002 | AB183: -2.4e-002 | AC183: -8.9900000000000008e-002 | AD183: -9.2300000000000007e-002 | AE183: 89.68 | AF183: 96.78 | AG183: 0.3 | AH183: AA- | AI183: 5.8799999999999998e-002 | AJ183: =H183+100*O183 -> 210.25 | AK183: 190.5 | AL183: 341 | AM183: 93.7 | AN183: 337 | AO183: 0.14300000000000002 | AP183: 22 | AQ183: 佳力转债!
A184: 183 | B184: 123063 | C184: 大禹转债 | D184: 300021 | E184: 大禹节水 | F184: 化工 | G184: 橡胶塑料 | H184: 139 | I184: 2.3599999999999999e-002 | J184: -1.6399999999999998e-002 | K184: 6.36 | L184: 9.4999999999999998e-003 | M184: 126.1 | N184: 4.83 | O184: 5.5999999999999994e-002 | P184: 131.68 | Q184: 已到 | R184: 4.44年 | S184: 3.44年 | T184: 6.35 | U184: 111 | V184: 0.126 | W184: 0.125 | X184: 0.16399999999999998 | Y184: 51 | Z184: 3.42 | AA184: -2.2200000000000001e-002 | AB184: -3.15e-002 | AC184: -7.2099999999999997e-002 | AD184: -7.5199999999999989e-002 | AE184: 87.11 | AF184: 98.45 | AG184: 0.75 | AH184: AA- | AI184: 5.8799999999999998e-002 | AJ184: =H184+100*O184 -> 144.59999999999999 | AK184: 146.3 | AL184: 98 | AM184: 47.9 | AN184: 85 | AO184: 6.6000000000000003e-002 | AP184: 20 | AQ184: 大禹转债
A185: 184 | B185: 128124 | C185: 科华转债! | D185: 2022 | E185: 科华生物 | F185: 医药 | G185: 生物制药 | H185: 106.029 | I185: 4.1999999999999997e-003 | J185: -2.3e-003 | K185: 13.33 | L185: 1.29e-002 | M185: 110 | N185: 21.31 | O185: 0.69499999999999995 | P185: 62.55 | Q185: 已到 | R185: 4.44年 | S185: 2.44年 | T185: 7.38 | U185: 7.4 | V185: 9.0000000000000011e-003 | W185: 0.10800000000000001 | X185: 6.7000000000000004e-002 | Y185: 69 | Z185: 1.9 | AA185: 8.5000000000000006e-003 | AB185: 4.1999999999999997e-003 | AC185: -1.21e-002 | AD185: -1.41e-002 | AE185: 93.36 | AF185: 93.58 | AG185: 0.15 | AH185: AA | AI185: 3.78e-002 | AJ185: =H185+100*O185 -> 175.529 | AK185: 149.5 | AL185: 132 | AM185: 55.9 | AN185: 155 | AO185: -5.2000000000000005e-002 | AP185: 31 | AQ185: 科华转债!
A186: 185 | B186: 113596 | C186: 城地转债! | D186: 603887 | E186: 城地香江 | F186: 通信互联 | G186: 通信设备 | H186: 100.39 | I186: 3.7000000000000002e-003 | J186: -3.2000000000000002e-003 | K186: 9.34 | L186: 5.4199999999999998e-002 | M186: 113.1 | N186: 24.26 | O186: 1.6100000000000001 | P186: 38.5 | Q186: 已到 | R186: 4.44年 | S186: 2.44年 | T186: 12 | U186: 111 | V186: 9.1999999999999998e-002 | W186: 0.28499999999999998 | X186: 0.11 | Y186: 42 | Z186: 1.12 | AA186: 2.7799999999999998e-002 | AB186: 2.2200000000000001e-002 | AC186: 1.1699999999999999e-002 | AD186: 9.0000000000000011e-003 | AE186: 89.27 | AF186: 88.28 | AG186: 0.01 | AH186: AA- | AI186: 5.8799999999999998e-002 | AJ186: =H186+100*O186 -> 261.38999999999999 | AK186: 162.3 | AL186: 259 | AM186: 73 | AN186: 280 | AO186: 2.6000000000000002e-002 | AP186: 47 | AQ186: 城地转债!
A187: 186 | B187: 123062 | C187: 三超转债 | D187: 300554 | E187: 三超新材 | F187: 机械装备 | G187: 通用设备 | H187: 124.22 | I187: 5.9999999999999995e-004 | J187: -2.0000000000000001e-004 | K187: 16.85 | L187: 5.9999999999999995e-004 | M187: 119.2 | N187: 17.13 | O187: 0.26300000000000001 | P187: 98.37 | Q187: 已到 | R187: 4.43年 | S187: 2.43年 | T187: 1.95 | U187: 5 | V187: 2.1000000000000001e-002 | W187: 0.12300000000000001 | X187: 0.121 | Y187: 16 | Z187: 3 | AA187: -9.4999999999999998e-003 | AB187: -1.6899999999999998e-002 | AC187: -6.6199999999999995e-002 | AD187: -6.9000000000000006e-002 | AE187: 85.47 | AF187: 85.55 | AG187: 0.65 | AH187: A | AI187: 7.980000000000001e-002 | AJ187: =H187+100*O187 -> 150.52000000000001 | AK187: 150.1 | AL187: 141 | AM187: 64.5 | AN187: 222 | AO187: 5.0000000000000001e-003 | AP187: 28 | AQ187: 三超转债
A188: 187 | B188: 128123 | C188: 国光转债! | D188: 2749 | E188: 国光股份 | F188: 化工 | G188: 农化 | H188: 113.8 | I188: 3.04e-002 | J188: 9.5999999999999992e-003 | K188: 10.63 | L188: 0.10000000000000001 | M188: 115.7 | N188: 13.49 | O188: 0.44400000000000001 | P188: 78.8 | Q188: 已到 | R188: 4.43年 | S188: 2.43年 | T188: 3.2 | U188: 73 | V188: 0.20100000000000001 | W188: 6.9000000000000006e-002 | X188: 5.4000000000000006e-002 | Y188: 46 | Z188: 3.53 | AA188: 3.8e-003 | AB188: -2.5000000000000001e-003 | AC188: -3.5699999999999996e-002 | AD188: -3.8300000000000001e-002 | AE188: 89.46 | AF188: 90.35 | AG188: 0.4 | AH188: AA- | AI188: 5.8799999999999998e-002 | AJ188: =H188+100*O188 -> 158.19999999999999 | AK188: 148.8 | AL188: 121 | AM188: 58.5 | AN188: 175 | AO188: 0.157 | AP188: 16 | AQ188: 国光转债!
A189: 188 | B189: 110073 | C189: 国投转债! | D189: 600061 | E189: 国投资本 | F189: 金融 | G189: 证券行业 | H189: 112.24 | I189: 1.8e-003 | J189: 1.e-004 | K189: 7.69 | L189: 6.5000000000000006e-003 | M189: 110.3 | N189: 9.9 | O189: 0.44500000000000001 | P189: 77.68 | Q189: 已到 | R189: 4.42年 | S189: 无权 | T189: 80 | U189: 33 | V189: 4.0000000000000001e-003 | W189: 0.16200000000000001 | X189: 0.126 | Y189: 494 | Z189: 1.09 | AA189: -4.0000000000000001e-003 | AB189: -8.3000000000000001e-003 | AC189: 无权 | AD189: 无权 | AE189: 无权 | AF189: 96.62 | AG189: 0.29 | AH189: AAA | AI189: 3.0800000000000001e-002 | AJ189: =H189+100*O189 -> 156.74000000000001 | AK189: 146.8 | AL189: 102 | AM189: 50.2 | AN189: 104 | AO189: -1.2e-002 | AP189: 24 | AQ189: 国投转债!
A190: 189 | B190: 128122 | C190: 兴森转债! | D190: 2436 | E190: 兴森科技 | F190: 电子 | G190: 元器件制 | H190: 123.46 | I190: 8.199999999999999e-003 | J190: -6.6e-003 | K190: 12.02 | L190: 5.0000000000000001e-003 | M190: 113 | N190: 14.1 | O190: 0.44799999999999995 | P190: 85.25 | Q190: 已到 | R190: 3.42年 | S190: 2.42年 | T190: 2.69 | U190: 4.1 | V190: 1.2e-002 | W190: 1.4999999999999999e-002 | X190: 1.3000000000000001e-002 | Y190: 179 | Z190: 4.99 | AA190: -2.5899999999999999e-002 | AB190: -3.2500000000000001e-002 | AC190: -6.6900000000000001e-002 | AD190: -6.9199999999999998e-002 | AE190: 93.95 | AF190: 99.7 | AG190: 0.32 | AH190: AA | AI190: 3.78e-002 | AJ190: =H190+100*O190 -> 168.25999999999999 | AK190: 161.7 | AL190: 250 | AM190: 62 | AN190: 200 | AO190: -3.1e-002 | AP190: 10 | AQ190: 兴森转债!
A191: 190 | B191: 113037 | C191: 紫银转债! | D191: 601860 | E191: 紫金银行 | F191: 金融 | G191: 银行行业 | H191: 108.52 | I191: 9.7000000000000003e-003 | J191: -6.8000000000000005e-003 | K191: 3.31 | L191: 9.1000000000000004e-003 | M191: 115.6 | N191: 4.05 | O191: 0.32799999999999996 | P191: 81.73 | Q191: 已到 | R191: 4.42年 | S191: 无权 | T191: 45 | U191: 60 | V191: 1.2e-002 | W191: 0.371 | X191: 0.30299999999999999 | Y191: 121 | Z191: 0.79 | AA191: 1.47e-002 | AB191: 8.3000000000000001e-003 | AC191: 无权 | AD191: 无权 | AE191: 无权 | AF191: 100.56 | AG191: 0.31 | AH191: AA+ | AI191: 3.2799999999999996e-002 | AJ191: =H191+100*O191 -> 141.31999999999999 | AK191: 135.3 | AL191: 18 | AM191: 34.7 | AN191: 17 | AO191: 6.9999999999999993e-003 | AP191: 33 | AQ191: 紫银转债!
A192: 191 | B192: 123061 | C192: 航新转债! | D192: 300424 | E192: 航新科技 | F192: 航空航天 | G192: 航空航天 | H192: 122 | I192: -2.e-003 | J192: 4.6999999999999993e-003 | K192: 14.58 | L192: 4.7999999999999996e-003 | M192: 124.3 | N192: 14.85 | O192: 0.24299999999999999 | P192: 98.18 | Q192: 已到 | R192: 4.42年 | S192: 2.42年 | T192: 2.5 | U192: 14 | V192: 4.4999999999999998e-002 | W192: 7.0999999999999994e-002 | X192: 7.0000000000000007e-002 | Y192: 35 | Z192: 5.17 | AA192: 4.3e-003 | AB192: -4.8999999999999998e-003 | AC192: -5.9699999999999996e-002 | AD192: -6.2600000000000003e-002 | AE192: 87.73 | AF192: 92.96 | AG192: 0.57 | AH192: A+ | AI192: 6.9800000000000001e-002 | AJ192: =H192+100*O192 -> 146.30000000000001 | AK192: 145.8 | AL192: 92 | AM192: 52.9 | AN192: 127 | AO192: 3.2000000000000001e-002 | AP192: 20 | AQ192: 航新转债!
A193: 192 | B193: 123060 | C193: 苏试转债! | D193: 300416 | E193: 苏试试验 | F193: 机械装备 | G193: 专用设备 | H193: 171.999 | I193: -9.8999999999999991e-003 | J193: 2.0000000000000001e-004 | K193: 28.11 | L193: -1.1299999999999999e-002 | M193: 117.2 | N193: 19.05 | O193: 0.16600000000000001 | P193: 147.56 | Q193: 已到 | R193: 4.42年 | S193: 2.42年 | T193: 3.1 | U193: 11 | V193: 2.1000000000000001e-002 | W193: 3.9e-002 | X193: 5.7000000000000002e-002 | Y193: 80 | Z193: 7.31 | AA193: -8.4700000000000011e-002 | AB193: -9.0700000000000003e-002 | AC193: -0.126 | AD193: -0.127 | AE193: 89.47 | AF193: 91.58 | AG193: 0.86 | AH193: AA- | AI193: 5.8799999999999998e-002 | AJ193: =H193+100*O193 -> 188.59899999999999 | AK193: 196.4 | AL193: 344 | AM193: 104.9 | AN193: 345 | AO193: -4.9000000000000002e-002 | AP193: 7 | AQ193: 苏试转债!
A194: 193 | B194: 113595 | C194: 花王转债! | D194: 603007 | E194: ST花王 | F194: 城市公用 | G194: 生态环境 | H194: 101.97 | I194: 2.3999999999999998e-003 | J194: -5.9999999999999995e-004 | K194: 3.3 | L194: 1.54e-002 | M194: 124.8 | N194: 6.92 | O194: 1.1399999999999999 | P194: 47.69 | Q194: 已到 | R194: 4.42年 | S194: 2.42年 | T194: 3.3 | U194: 10 | V194: 2.9999999999999999e-002 | W194: 0.29799999999999999 | X194: 0.14199999999999999 | Y194: 11 | Z194: 1.03 | AA194: 4.7899999999999998e-002 | AB194: 3.7999999999999999e-002 | AC194: 6.7000000000000002e-003 | AD194: 3.9000000000000003e-003 | AE194: 77.7 | AF194: 76.65 | AG194: 0.11 | AH194: BBB- | AI194: 0.1198 | AJ194: =H194+100*O194 -> 215.96999999999997 | AK194: 156.3 | AL194: 203 | AM194: 78.5 | AN194: 307 | AO194: 2.4e-002 | AP194: 52 | AQ194: 花王转债!
A195: 194 | B195: 113594 | C195: 淳中转债! | D195: 603516 | E195: 淳中科技 | F195: 电子 | G195: 电子产品 | H195: 122.96 | I195: -6.8999999999999999e-003 | J195: 1.1200000000000002e-002 | K195: 16.22 | L195: 8.1000000000000013e-003 | M195: 120.9 | N195: 18.23 | O195: 0.38200000000000001 | P195: 88.97 | Q195: 已到 | R195: 4.42年 | S195: 2.42年 | T195: 3 | U195: 7.5 | V195: 2.e-002 | W195: 9.9000000000000005e-002 | X195: 8.8000000000000009e-002 | Y195: 30 | Z195: 3.12 | AA195: -3.9000000000000003e-003 | AB195: -1.1899999999999999e-002 | AC195: -6.3099999999999989e-002 | AD195: -6.59e-002 | AE195: 87.6 | AF195: 90.41 | AG195: 0.52 | AH195: A+ | AI195: 6.9800000000000001e-002 | AJ195: =H195+100*O195 -> 161.16 | AK195: 156.9 | AL195: 211 | AM195: 66.5 | AN195: 240 | AO195: -7.0000000000000007e-002 | AP195: 10 | AQ195: 淳中转债!
A196: 195 | B196: 127020 | C196: 中金转债 | D196: 60 | E196: 中金岭南 | F196: 有色金属 | G196: 有色行业 | H196: 125.415 | I196: 1.29e-002 | J196: -5.6999999999999993e-003 | K196: 5.01 | L196: 1.21e-002 | M196: 113.5 | N196: 4.63 | O196: 0.159 | P196: 108.21 | Q196: 已到 | R196: 4.41年 | S196: 2.41年 | T196: 34.3 | U196: 36 | V196: 8.0000000000000002e-003 | W196: 0.187 | X196: 0.20300000000000001 | Y196: 183 | Z196: 1.46 | AA196: -2.2700000000000001e-002 | AB196: -2.7999999999999997e-002 | AC196: -7.6399999999999996e-002 | AD196: -7.7899999999999997e-002 | AE196: 94.13 | AF196: 98.63 | AG196: 0.6 | AH196: AA+ | AI196: 3.2799999999999996e-002 | AJ196: =H196+100*O196 -> 141.315 | AK196: 142.6 | AL196: 62 | AM196: 44 | AN196: 54 | AO196: 3.6000000000000004e-002 | AP196: 19 | AQ196: 中金转债
A197: 196 | B197: 113593 | C197: 沪工转债! | D197: 603131 | E197: 上海沪工 | F197: 机械装备 | G197: 通用设备 | H197: 121.32 | I197: 2.0999999999999999e-003 | J197: -1.e-003 | K197: 18.52 | L197: 2.2000000000000001e-003 | M197: 121.2 | N197: 21.12 | O197: 0.38400000000000001 | P197: 87.69 | Q197: 已到 | R197: 4.41年 | S197: 2.41年 | T197: 4 | U197: 16 | V197: 3.3000000000000002e-002 | W197: 6.8000000000000005e-002 | X197: 5.9999999999999998e-002 | Y197: 59 | Z197: 4.43 | AA197: -2.0000000000000001e-004 | AB197: -8.3999999999999995e-003 | AC197: -5.7800000000000004e-002 | AD197: -6.0599999999999994e-002 | AE197: 87.72 | AF197: 90.66 | AG197: 0.51 | AH197: A+ | AI197: 6.9800000000000001e-002 | AJ197: =H197+100*O197 -> 159.72 | AK197: 155 | AL197: 188 | AM197: 64.3 | AN197: 219 | AO197: -0.16800000000000001 | AP197: 9 | AQ197: 沪工转债!
A198: 197 | B198: 128120 | C198: 联诚转债! | D198: 2921 | E198: 联诚精密 | F198: 汽车 | G198: 零部件制 | H198: 123.78 | I198: 9.7000000000000003e-003 | J198: -5.4000000000000003e-003 | K198: 19.43 | L198: 6.1999999999999998e-003 | M198: 117.9 | N198: 18.44 | O198: 0.17499999999999999 | P198: 105.37 | Q198: 已到 | R198: 4.41年 | S198: 2.41年 | T198: 2.6 | U198: 22 | V198: 6.9000000000000006e-002 | W198: 0.126 | X198: 0.13300000000000001 | Y198: 21 | Z198: 2.58 | AA198: -1.1200000000000002e-002 | AB198: -1.8200000000000001e-002 | AC198: -6.59e-002 | AD198: -6.8600000000000008e-002 | AE198: 85.62 | AF198: 84.8 | AG198: 0.69 | AH198: A | AI198: 7.980000000000001e-002 | AJ198: =H198+100*O198 -> 141.28 | AK198: 142.2 | AL198: 56 | AM198: 56.6 | AN198: 159 | AO198: 3.3000000000000002e-002 | AP198: 24 | AQ198: 联诚转债!
A199: 198 | B199: 128121 | C199: 宏川转债! | D199: 2930 | E199: 宏川智慧 | F199: 交通运输 | G199: 物流业 | H199: 127.583 | I199: 1.1000000000000001e-002 | J199: -8.3999999999999995e-003 | K199: 21.7 | L199: 3.7000000000000002e-003 | M199: 112.9 | N199: 19.89 | O199: 0.16899999999999998 | P199: 109.1 | Q199: 已到 | R199: 4.41年 | S199: 2.41年 | T199: 6.7 | U199: 16 | V199: 1.9e-002 | W199: 6.9000000000000006e-002 | X199: 7.4999999999999997e-002 | Y199: 97 | Z199: 4.57 | AA199: -2.7900000000000001e-002 | AB199: -3.3000000000000002e-002 | AC199: -7.9100000000000004e-002 | AD199: -8.1300000000000011e-002 | AE199: 89.4 | AF199: 88.26 | AG199: 0.71 | AH199: AA- | AI199: 5.8799999999999998e-002 | AJ199: =H199+100*O199 -> 144.483 | AK199: 146.1 | AL199: 94 | AM199: 56.7 | AN199: 161 | AO199: -9.0000000000000011e-003 | AP199: 7 | AQ199: 宏川转债!
A200: 199 | B200: 123059 | C200: 银信转债! | D200: 300231 | E200: 银信科技 | F200: 计算机及 | G200: 软件开发 | H200: 129 | I200: 4.0300000000000002e-002 | J200: -7.9000000000000008e-003 | K200: 10.24 | L200: 5.57e-002 | M200: 123.7 | N200: 9.72 | O200: 0.22399999999999998 | P200: 105.35 | Q200: 已到 | R200: 4.40年 | S200: 2.40年 | T200: 3.91 | U200: 211 | V200: 0.42100000000000004 | W200: 8.5999999999999993e-002 | X200: 9.0999999999999998e-002 | Y200: 45 | Z200: 3.23 | AA200: -9.7000000000000003e-003 | AB200: -1.8600000000000002e-002 | AC200: -8.2500000000000004e-002 | AD200: -8.4900000000000003e-002 | AE200: 89.63 | AF200: 96.74 | AG200: 0.58 | AH200: AA- | AI200: 5.8799999999999998e-002 | AJ200: =H200+100*O200 -> 151.40000000000001 | AK200: 152.7 | AL200: 169 | AM200: 55.9 | AN200: 154 | AO200: 7.0999999999999994e-002 | AP200: 19 | AQ200: 银信转债!
A201: 200 | B201: 127019 | C201: 国城转债! | D201: 688 | E201: 国城矿业 | F201: 有色金属 | G201: 锌铅镍锡 | H201: 111.2 | I201: 1.8500000000000003e-002 | J201: -9.300000000000001e-003 | K201: 16.73 | L201: 3.0200000000000001e-002 | M201: 114.8 | N201: 21.06 | O201: 0.40000000000000002 | P201: 79.44 | Q201: 已到 | R201: 4.40年 | S201: 2.40年 | T201: 8.5 | U201: 71 | V201: 7.4999999999999997e-002 | W201: 4.4999999999999998e-002 | X201: 3.5000000000000003e-002 | Y201: 190 | Z201: 7.87 | AA201: 7.4000000000000003e-003 | AB201: 1.2999999999999999e-003 | AC201: -2.8500000000000001e-002 | AD201: -3.0899999999999997e-002 | AE201: 94 | AF201: 97.83 | AG201: 0.31 | AH201: AA | AI201: 3.78e-002 | AJ201: =H201+100*O201 -> 151.19999999999999 | AK201: 143 | AL201: 66 | AM201: 45.1 | AN201: 65 | AO201: 0.20199999999999999 | AP201: 53 | AQ201: 国城转债!
A202: 201 | B202: 128119 | C202: 龙大转债! | D202: 2726 | E202: 龙大美食 | F202: 食品饮料 | G202: 肉制品 | H202: 121.602 | I202: 8.0000000000000002e-003 | J202: 2.e-003 | K202: 8.84 | L202: 2.3099999999999999e-002 | M202: 119.9 | N202: 9.29 | O202: 0.27800000000000002 | P202: 95.16 | Q202: 已到 | R202: 4.39年 | S202: 2.39年 | T202: 9.46 | U202: 26 | V202: 2.3e-002 | W202: 9.9000000000000005e-002 | X202: 9.4e-002 | Y202: 95 | Z202: 2.36 | AA202: -3.3e-003 | AB202: -1.1000000000000001e-002 | AC202: -6.1799999999999994e-002 | AD202: -6.4199999999999993e-002 | AE202: 94.12 | AF202: 102.2 | AG202: 0.43 | AH202: AA | AI202: 3.78e-002 | AJ202: =H202+100*O202 -> 149.40200000000002 | AK202: 148 | AL202: 117 | AM202: 45.9 | AN202: 70 | AO202: -5.5e-002 | AP202: 9 | AQ202: 龙大转债!
A203: 202 | B203: 110071 | C203: 湖盐转债! | D203: 600929 | E203: 雪天盐业 | F203: 食品饮料 | G203: 食品饮料 | H203: 128.27 | I203: 7.0999999999999995e-003 | J203: -4.1999999999999997e-003 | K203: 6.6 | L203: 4.5999999999999999e-003 | M203: 114.9 | N203: 5.89 | O203: 0.14499999999999999 | P203: 112.05 | Q203: 已到 | R203: 4.39年 | S203: 2.39年 | T203: 7.2 | U203: 16 | V203: 1.8000000000000002e-002 | W203: 8.1000000000000003e-002 | X203: 9.0999999999999998e-002 | Y203: 89 | Z203: 2.36 | AA203: -2.53e-002 | AB203: -3.1099999999999999e-002 | AC203: -8.1600000000000006e-002 | AD203: -8.3800000000000013e-002 | AE203: 94.14 | AF203: 97.98 | AG203: 0.66 | AH203: AA | AI203: 3.78e-002 | AJ203: =H203+100*O203 -> 142.77000000000001 | AK203: 144.5 | AL203: 76 | AM203: 46.5 | AN203: 78 | AO203: -2.8999999999999998e-002 | AP203: 19 | AQ203: 湖盐转债!
A204: 203 | B204: 113036 | C204: 宁建转债! | D204: 601789 | E204: 宁波建工 | F204: 建筑 | G204: 建筑工程 | H204: 173.31 | I204: 0.249 | J204: -0.17000000000000001 | K204: 6.26 | L204: 0.10000000000000001 | M204: 116.9 | N204: 4.76 | O204: 0.318 | P204: 131.51 | Q204: 已到 | R204: 4.38年 | S204: 2.38年 | T204: 5.39 | U204: 11299. | V204: 12.92 | W204: 8.8000000000000009e-002 | X204: 0.11599999999999999 | Y204: 61 | Z204: 1.88 | AA204: -8.7599999999999997e-002 | AB204: -9.35e-002 | AC204: -0.13100000000000001 | AD204: -0.13200000000000001 | AE204: 94.18 | AF204: 99.72 | AG204: 0.79 | AH204: AA | AI204: 3.78e-002 | AJ204: =H204+100*O204 -> 205.11000000000001 | AK204: 215.1 | AL204: 350 | AM204: 115.4 | AN204: 349 | AO204: 0.41299999999999998 | AP204: 15 | AQ204: 宁建转债!
A205: 204 | B205: 128118 | C205: 瀛通转债! | D205: 2861 | E205: 瀛通通讯 | F205: 电子 | G205: 电子产品 | H205: 110.211 | I205: 3.9000000000000003e-003 | J205: -1.1999999999999999e-003 | K205: 12.27 | L205: 2.e-002 | M205: 121.7 | N205: 21.24 | O205: 0.90799999999999992 | P205: 57.77 | Q205: 已到 | R205: 4.36年 | S205: 2.36年 | T205: 3 | U205: 3 | V205: 9.0000000000000011e-003 | W205: 0.156 | X205: 8.9999999999999997e-002 | Y205: 19 | Z205: 1.83 | AA205: 2.3599999999999999e-002 | AB205: 1.4800000000000001e-002 | AC205: -2.2099999999999998e-002 | AD205: -2.52e-002 | AE205: 90.33 | AF205: 95.46 | AG205: 0.13 | AH205: AA- | AI205: 5.8799999999999998e-002 | AJ205: =H205+100*O205 -> 201.011 | AK205: 162.7 | AL205: 261 | AM205: 67.2 | AN205: 244 | AO205: -5.0000000000000001e-003 | AP205: 28 | AQ205: 瀛通转债!
A206: 205 | B206: 128117 | C206: 道恩转债! | D206: 2838 | E206: 道恩股份 | F206: 化工 | G206: 橡胶塑料 | H206: 112.074 | I206: 5.6000000000000008e-003 | J206: -2.7000000000000001e-003 | K206: 15.31 | L206: 3.3099999999999997e-002 | M206: 123.1 | N206: 28.78 | O206: 1.1100000000000001 | P206: 53.2 | Q206: 已到 | R206: 4.36年 | S206: 2.36年 | T206: 3.6 | U206: 3.5 | V206: 9.0000000000000011e-003 | W206: 5.7000000000000002e-002 | X206: 3.1e-002 | Y206: 63 | Z206: 3.29 | AA206: 2.2200000000000001e-002 | AB206: 1.3000000000000001e-002 | AC206: -3.15e-002 | AD206: -3.4000000000000002e-002 | AE206: 89.64 | AF206: 96.43 | AG206: 0.09 | AH206: AA- | AI206: 5.8799999999999998e-002 | AJ206: =H206+100*O206 -> 223.07400000000001 | AK206: 171 | AL206: 306 | AM206: 74.5 | AN206: 287 | AO206: 2.e-002 | AP206: 29 | AQ206: 道恩转债!
A207: 206 | B207: 123057 | C207: 美联转债!! | D207: 300586 | E207: 美联新材 | F207: 化工 | G207: 橡胶塑料 | H207: 138.778 | I207: 2.7000000000000001e-003 | J207: 5.0000000000000001e-004 | K207: 11.59 | L207: 4.3e-003 | M207: 117.8 | N207: 9.5 | O207: 0.13800000000000001 | P207: 122 | Q207: 已到 | R207: 4.36年 | S207: 2.36年 | T207: 2.07 | U207: 15 | V207: 5.2999999999999999e-002 | W207: 3.4000000000000002e-002 | X207: 4.0999999999999995e-002 | Y207: 61 | Z207: 5.08 | AA207: -3.7699999999999997e-002 | AB207: -4.4400000000000002e-002 | AC207: -0.109 | AD207: -0.111 | AE207: 89.92 | AF207: 92.38 | AG207: 0.74 | AH207: AA- | AI207: 5.8799999999999998e-002 | AJ207: =H207+100*O207 -> 152.578 | AK207: 155.6 | AL207: 195 | AM207: 63.2 | AN207: 210 | AO207: 4.2000000000000003e-002 | AP207: 19 | AQ207: 美联转债!!
A208: 207 | B208: 113591 | C208: 胜达转债!! | D208: 603687 | E208: 大胜达 | F208: 造纸包装 | G208: 包装用纸 | H208: 124.31 | I208: 9.1000000000000004e-003 | J208: -4.5000000000000005e-003 | K208: 10.13 | L208: 6.9999999999999993e-003 | M208: 121.7 | N208: 8.76 | O208: 7.4999999999999997e-002 | P208: 115.64 | Q208: 已到 | R208: 4.36年 | S208: 2.36年 | T208: 4.78 | U208: 29 | V208: 5.0000000000000003e-002 | W208: 0.114 | X208: 0.13200000000000001 | Y208: 42 | Z208: 2.4 | AA208: -5.0000000000000001e-003 | AB208: -1.3300000000000001e-002 | AC208: -7.0099999999999996e-002 | AD208: -7.2599999999999998e-002 | AE208: 89.82 | AF208: 95.4 | AG208: 0.67 | AH208: AA- | AI208: 5.8799999999999998e-002 | AJ208: =H208+100*O208 -> 131.81 | AK208: 133 | AL208: 8 | AM208: 37.6 | AN208: 28 | AO208: -7.2000000000000008e-002 | AP208: 37 | AQ208: 胜达转债!!
A209: 208 | B209: 128116 | C209: 瑞达转债! | D209: 2961 | E209: 瑞达期货 | F209: 金融 | G209: 期货行业 | H209: 111.83 | I209: 6.7000000000000002e-003 | J209: -4.8999999999999998e-003 | K209: 21.07 | L209: 8.1000000000000013e-003 | M209: 114.9 | N209: 29.55 | O209: 0.56799999999999995 | P209: 71.3 | Q209: 已到 | R209: 4.36年 | S209: 2.36年 | T209: 6.49 | U209: 7.1 | V209: 1.e-002 | W209: 6.9000000000000006e-002 | X209: 4.9000000000000002e-002 | Y209: 94 | Z209: 4.42 | AA209: 6.4000000000000003e-003 | AB209: 2.0000000000000001e-004 | AC209: -3.1099999999999999e-002 | AD209: -3.3599999999999998e-002 | AE209: 94.17 | AF209: 98.08 | AG209: 0.22 | AH209: AA | AI209: 3.78e-002 | AJ209: =H209+100*O209 -> 168.63 | AK209: 152.4 | AL209: 166 | AM209: 54.3 | AN209: 139 | AO209: -2.6000000000000002e-002 | AP209: 18 | AQ209: 瑞达转债!
A210: 209 | B210: 127018 | C210: 本钢转债! | D210: 761 | E210: 本钢板材 | F210: 钢铁 | G210: 炼钢 | H210: 118.51 | I210: 1.4499999999999999e-002 | J210: -1.e-003 | K210: 4.29 | L210: 3.8699999999999998e-002 | M210: 128 | N210: 4.55 | O210: 0.25700000000000001 | P210: 94.29 | Q210: 已到 | R210: 4.36年 | S210: 2.36年 | T210: 56.3 | U210: 59 | V210: 9.0000000000000011e-003 | W210: 0.32000000000000001 | X210: 0.30099999999999999 | Y210: 176 | Z210: 0.77 | AA210: 1.84e-002 | AB210: 7.6e-003 | AC210: -4.4400000000000002e-002 | AD210: -4.8499999999999995e-002 | AE210: 98.15 | AF210: 112.63 | AG210: 0.35 | AH210: AAA | AI210: 3.0800000000000001e-002 | AJ210: =H210+100*O210 -> 144.21000000000001 | AK210: 142.7 | AL210: 64 | AM210: 30.1 | AN210: 8 | AO210: 2.e-002 | AP210: 60 | AQ210: 本钢转债!
A211: 210 | B211: 113589 | C211: 天创转债! | D211: 603608 | E211: 天创时尚 | F211: 服装纺织 | G211: 鞋服行业 | H211: 104.25 | I211: 2.0000000000000001e-004 | J211: -5.9999999999999995e-004 | K211: 6.26 | L211: -9.4999999999999998e-003 | M211: 114.9 | N211: 12.29 | O211: 1.05 | P211: 50.94 | Q211: 已到 | R211: 4.34年 | S211: 2.34年 | T211: 6 | U211: 4.8 | V211: 8.0000000000000002e-003 | W211: 0.223 | X211: 0.114 | Y211: 27 | Z211: 1.7 | AA211: 2.3099999999999999e-002 | AB211: 1.6799999999999999e-002 | AC211: -3.3e-003 | AD211: -5.8999999999999999e-003 | AE211: 94.3 | AF211: 98.14 | AG211: 0.04 | AH211: AA | AI211: 3.78e-002 | AJ211: =H211+100*O211 -> 209.25 | AK211: 157.6 | AL211: 216 | AM211: 59.4 | AN211: 184 | AO211: 2.e-002 | AP211: 45 | AQ211: 天创转债!
A212: 211 | B212: 123056 | C212: 雪榕转债! | D212: 300511 | E212: 雪榕生物 | F212: 农业 | G212: 种植业 | H212: 109.164 | I212: 4.1999999999999997e-003 | J212: -2.2000000000000001e-003 | K212: 6.97 | L212: 1.46e-002 | M212: 120.7 | N212: 11.77 | O212: 0.84299999999999997 | P212: 59.22 | Q212: 已到 | R212: 4.34年 | S212: 2.34年 | T212: 5.84 | U212: 5.5 | V212: 9.0000000000000011e-003 | W212: 0.19 | X212: 0.11199999999999999 | Y212: 31 | Z212: 1.72 | AA212: 2.3900000000000001e-002 | AB212: 1.55e-002 | AC212: -2.07e-002 | AD212: -2.35e-002 | AE212: 89.92 | AF212: 94.72 | AG212: 0.14 | AH212: AA- | AI212: 5.8799999999999998e-002 | AJ212: =H212+100*O212 -> 193.464 | AK212: 159.1 | AL212: 228 | AM212: 64.4 | AN212: 220 | AO212: -4.8000000000000001e-002 | AP212: 25 | AQ212: 雪榕转债!
A213: 212 | B213: 113588 | C213: 润达转债! | D213: 603108 | E213: 润达医疗 | F213: 医药 | G213: 医疗器械 | H213: 119.46 | I213: 1.1899999999999999e-002 | J213: -7.8000000000000005e-003 | K213: 11.3 | L213: 1.0700000000000001e-002 | M213: 113.9 | N213: 13.25 | O213: 0.40100000000000002 | P213: 85.28 | Q213: 已到 | R213: 4.32年 | S213: 2.32年 | T213: 5.5 | U213: 20 | V213: 3.1e-002 | W213: 8.4000000000000005e-002 | X213: 7.2000000000000008e-002 | Y213: 65 | Z213: 1.99 | AA213: -1.1200000000000002e-002 | AB213: -1.6899999999999998e-002 | AC213: -5.6799999999999996e-002 | AD213: -5.9200000000000003e-002 | AE213: 94.36 | AF213: 97.36 | AG213: 0.38 | AH213: AA | AI213: 3.78e-002 | AJ213: =H213+100*O213 -> 159.56 | AK213: 153.6 | AL213: 179 | AM213: 56.3 | AN213: 158 | AO213: -7.9000000000000001e-002 | AP213: 11 | AQ213: 润达转债!
A214: 213 | B214: 128114 | C214: 正邦转债! | D214: 2157 | E214: 正邦科技 | F214: 农业 | G214: 畜牧业 | H214: 104.9 | I214: 5.0000000000000001e-003 | J214: -4.8999999999999998e-003 | K214: 7.23 | L214: 4.1999999999999997e-003 | M214: 114.9 | N214: 14.77 | O214: 1.1399999999999999 | P214: 48.95 | Q214: 已到 | R214: 4.32年 | S214: 2.32年 | T214: 16 | U214: 21 | V214: 1.3000000000000001e-002 | W214: 7.0000000000000007e-002 | X214: 3.4000000000000002e-002 | Y214: 227 | Z214: 1.75 | AA214: 2.1700000000000001e-002 | AB214: 1.54e-002 | AC214: -5.7999999999999996e-003 | AD214: -8.3999999999999995e-003 | AE214: 94.36 | AF214: 98.21 | AG214: 0.04 | AH214: AA | AI214: 3.78e-002 | AJ214: =H214+100*O214 -> 218.89999999999998 | AK214: 160.8 | AL214: 245 | AM214: 62.6 | AN214: 205 | AO214: -0.14800000000000002 | AP214: 30 | AQ214: 正邦转债!
A215: 214 | B215: 128113 | C215: 比音转债!* | D215: 2832 | E215: 比音勒芬 | F215: 服装纺织 | G215: 服装行业 | H215: 165.2 | I215: -7.3000000000000001e-003 | J215: 1.1000000000000001e-003 | K215: 24.15 | L215: -6.1999999999999998e-003 | M215: 116.9 | N215: 14.6 | O215: -1.e-003 | P215: 165.41 | Q215: 已到 | R215: 4.1天 | S215: 无权 | T215: 1.11 | U215: 54 | V215: 0.29499999999999998 | W215: 8.0000000000000002e-003 | X215: 1.3999999999999999e-002 | Y215: 135 | Z215: 4.49 | AA215: <-100% | AB215: <-100% | AC215: 无权 | AD215: 无权 | AE215: 无权 | AF215: 100.39 | AG215: 1 | AH215: AA | AI215: 3.0499999999999999e-002 | AJ215: =H215+100*O215 -> 165.09999999999999 | AK215: 165 | AL215: 278 | AM215: 64.6 | AN215: 224 | AO215: -1.4999999999999999e-002 | AP215: 8 | AQ215: 比音转债!*
A216: 215 | B216: 128111 | C216: 中矿转债! | D216: 2738 | E216: 中矿资源 | F216: 有色金属 | G216: 有色行业 | H216: 568.61 | I216: 2.9600000000000001e-002 | J216: 5.4400000000000004e-002 | K216: 88.3 | L216: 8.4900000000000003e-002 | M216: 124.2 | N216: 15.45 | O216: -5.0000000000000001e-003 | P216: 571.52 | Q216: 已到 | R216: 4.31年 | S216: 2.31年 | T216: 1.45 | U216: 4182. | V216: 5.1200000000000001 | W216: 5.0000000000000001e-003 | X216: 2.8999999999999998e-002 | Y216: 287 | Z216: 7.68 | AA216: -0.30199999999999999 | AB216: -0.307 | AC216: -0.28100000000000003 | AD216: -0.28100000000000003 | AE216: 90.55 | AF216: 97.71 | AG216: 0.99 | AH216: AA- | AI216: 5.8799999999999998e-002 | AJ216: =H216+100*O216 -> 568.11000000000001 | AK216: 565.7 | AL216: 386 | AM216: 468 | AN216: 386 | AO216: 0.39200000000000002 | AP216: 11 | AQ216: 中矿转债!
A217: 216 | B217: 123054 | C217: 思特转债!! | D217: 300608 | E217: 思特奇 | F217: 通信互联 | G217: 通信设备 | H217: 133.77 | I217: 2.2499999999999999e-002 | J217: 2.29e-002 | K217: 13.85 | L217: 7.1199999999999999e-002 | M217: 121.2 | N217: 12.63 | O217: 0.22 | P217: 109.66 | Q217: 已到 | R217: 4.30年 | S217: 2.30年 | T217: 2.07 | U217: 333 | V217: 1.2 | W217: 7.0999999999999994e-002 | X217: 7.8e-002 | Y217: 29 | Z217: 3.49 | AA217: -2.3199999999999998e-002 | AB217: -3.1300000000000001e-002 | AC217: -9.74e-002 | AD217: -0.10000000000000001 | AE217: 90.57 | AF217: 95.38 | AG217: 0.64 | AH217: AA- | AI217: 5.8799999999999998e-002 | AJ217: =H217+100*O217 -> 155.77000000000001 | AK217: 157.9 | AL217: 219 | AM217: 62.5 | AN217: 204 | AO217: -2.e-002 | AP217: 18 | AQ217: 思特转债!!
A218: 217 | B218: 113585 | C218: 寿仙转债! | D218: 603896 | E218: 寿仙谷 | F218: 医药 | G218: 中药 | H218: 195.96 | I218: 4.1799999999999997e-002 | J218: -1.72e-002 | K218: 53.94 | L218: 2.5899999999999999e-002 | M218: 117.3 | N218: 28.38 | O218: 3.1e-002 | P218: 190.06 | Q218: 已到 | R218: 4.30年 | S218: 2.30年 | T218: 1.01 | U218: 205 | V218: 1.05 | W218: 1.2e-002 | X218: 2.3e-002 | Y218: 82 | Z218: 5.54 | AA218: -0.115 | AB218: -0.12 | AC218: -0.16 | AD218: -0.161 | AE218: 90.16 | AF218: 92.28 | AG218: 0.95 | AH218: AA- | AI218: 5.8799999999999998e-002 | AJ218: =H218+100*O218 -> 199.06 | AK218: 201.9 | AL218: 346 | AM218: 109.6 | AN218: 346 | AO218: 1.7000000000000001e-002 | AP218: 17 | AQ218: 寿仙转债!
A219: 218 | B219: 123052 | C219: 飞鹿转债! | D219: 300665 | E219: 飞鹿股份 | F219: 化工 | G219: 化工 | H219: 141.63 | I219: -9.5999999999999992e-003 | J219: 4.0999999999999995e-003 | K219: 9.53 | L219: -7.3000000000000001e-003 | M219: 126.8 | N219: 7.05 | O219: 4.8000000000000001e-002 | P219: 135.18 | Q219: 已到 | R219: 4.29年 | S219: 2.29年 | T219: 1.5 | U219: 71 | V219: 0.33700000000000002 | W219: 9.0999999999999998e-002 | X219: 0.12300000000000001 | Y219: 17 | Z219: 3.24 | AA219: -2.6099999999999998e-002 | AB219: -3.5900000000000001e-002 | AC219: -0.11599999999999999 | AD219: -0.11900000000000001 | AE219: 88.94 | AF219: 95.71 | AG219: 0.76 | AH219: A+ | AI219: 6.9800000000000001e-002 | AJ219: =H219+100*O219 -> 146.43000000000001 | AK219: 148.1 | AL219: 118 | AM219: 52.4 | AN219: 123 | AO219: -4.0000000000000001e-003 | AP219: 23 | AQ219: 飞鹿转债!
A220: 219 | B220: 113584 | C220: 家悦转债! | D220: 603708 | E220: 家家悦 | F220: 商业零售 | G220: 超市 | H220: 106.38 | I220: 4.1999999999999997e-003 | J220: -4.1999999999999997e-003 | K220: 13.51 | L220: 2.2000000000000001e-003 | M220: 114.9 | N220: 37.53 | O220: 1.96 | P220: 36 | Q220: 已到 | R220: 4.29年 | S220: 2.29年 | T220: 6.45 | U220: 2.7 | V220: 4.0000000000000001e-003 | W220: 7.8e-002 | X220: 2.7999999999999997e-002 | Y220: 82 | Z220: 3.2 | AA220: 1.8500000000000003e-002 | AB220: 1.21e-002 | AC220: -1.1599999999999999e-002 | AD220: -1.4199999999999999e-002 | AE220: 94.48 | AF220: 98.33 | AG220: 0 | AH220: AA | AI220: 3.78e-002 | AJ220: =H220+100*O220 -> 302.38 | AK220: 176.8 | AL220: 320 | AM220: 78.4 | AN220: 306 | AO220: -8.8000000000000009e-002 | AP220: 22 | AQ220: 家悦转债!
A221: 220 | B221: 128109 | C221: 楚江转债! | D221: 2171 | E221: 楚江新材 | F221: 有色金属 | G221: 铜金属 | H221: 146.05 | I221: 1.1699999999999999e-002 | J221: -4.5999999999999999e-003 | K221: 11.1 | L221: 9.1000000000000004e-003 | M221: 114.9 | N221: 8.63 | O221: 0.13600000000000001 | P221: 128.62 | Q221: 已到 | R221: 4.29年 | S221: 2.29年 | T221: 18.2 | U221: 61 | V221: 2.3e-002 | W221: 0.12300000000000001 | X221: 0.158 | Y221: 148 | Z221: 2.53 | AA221: -5.5399999999999998e-002 | AB221: -6.1100000000000002e-002 | AC221: -0.13100000000000001 | AD221: -0.13300000000000001 | AE221: 94.49 | AF221: 98.34 | AG221: 0.77 | AH221: AA | AI221: 3.78e-002 | AJ221: =H221+100*O221 -> 159.65000000000001 | AK221: 163.5 | AL221: 267 | AM221: 65.1 | AN221: 230 | AO221: 6.9999999999999993e-003 | AP221: 5 | AQ221: 楚江转债!
A222: 221 | B222: 127017 | C222: 万青转债 | D222: 789 | E222: 万年青 | F222: 建筑 | G222: 水泥 | H222: 128.996 | I222: 2.2200000000000001e-002 | J222: -6.0000000000000001e-003 | K222: 13.96 | L222: 3.1e-002 | M222: 118 | N222: 13.46 | O222: 0.24399999999999999 | P222: 103.71 | Q222: 已到 | R222: 4.29年 | S222: 2.29年 | T222: 10 | U222: 39 | V222: 2.9999999999999999e-002 | W222: 8.9999999999999997e-002 | X222: 9.3000000000000013e-002 | Y222: 111 | Z222: 1.63 | AA222: -2.1000000000000001e-002 | AB222: -2.81e-002 | AC222: -8.72e-002 | AD222: -8.9499999999999996e-002 | AE222: 95.55 | AF222: 103.05 | AG222: 0.52 | AH222: AA+ | AI222: 3.2799999999999996e-002 | AJ222: =H222+100*O222 -> 153.39600000000002 | AK222: 154.3 | AL222: 183 | AM222: 51.2 | AN222: 114 | AO222: 9.8000000000000004e-002 | AP222: 7 | AQ222: 万青转债
A223: 222 | B223: 128108 | C223: 蓝帆转债!! | D223: 2382 | E223: 蓝帆医疗 | F223: 医药 | G223: 医疗器械 | H223: 111.523 | I223: 1.5e-003 | J223: 1.9e-003 | K223: 13.88 | L223: 1.24e-002 | M223: 112.9 | N223: 18.24 | O223: 0.46600000000000003 | P223: 76.1 | Q223: 已到 | R223: 4.27年 | S223: 3.27年 | T223: 15.2 | U223: 14 | V223: 8.0000000000000002e-003 | W223: 0.109 | X223: 8.3000000000000004e-002 | Y223: 140 | Z223: 1.1 | AA223: 2.8999999999999998e-003 | AB223: -2.5999999999999999e-003 | AC223: -1.7000000000000001e-002 | AD223: -1.9799999999999998e-002 | AE223: 92.84 | AF223: 96.7 | AG223: 0.27 | AH223: AA | AI223: 3.78e-002 | AJ223: =H223+100*O223 -> 158.12299999999999 | AK223: 146.9 | AL223: 104 | AM223: 50.2 | AN223: 106 | AO223: -8.5000000000000006e-002 | AP223: 29 | AQ223: 蓝帆转债!!
A224: 223 | B224: 113582 | C224: 火炬转债! | D224: 603678 | E224: 火炬电子 | F224: 电子 | G224: 元器件制 | H224: 277.64 | I224: -2.9500000000000002e-002 | J224: -3.4999999999999996e-003 | K224: 61.04 | L224: -3.3700000000000001e-002 | M224: 114.9 | N224: 24.99 | O224: 0.13699999999999998 | P224: 244.26 | Q224: 已到 | R224: 4.27年 | S224: 2.27年 | T224: 4.18 | U224: 85 | V224: 7.2999999999999995e-002 | W224: 1.4999999999999999e-002 | X224: 3.6000000000000004e-002 | Y224: 281 | Z224: 6.33 | AA224: -0.19 | AB224: -0.19399999999999998 | AC224: -0.21899999999999997 | AD224: -0.22 | AE224: 94.57 | AF224: 98.42 | AG224: 0.98 | AH224: AA | AI224: 3.78e-002 | AJ224: =H224+100*O224 -> 291.33999999999997 | AK224: 311 | AL224: 374 | AM224: 212.6 | AN224: 374 | AO224: -3.9e-002 | AP224: 5 | AQ224: 火炬转债!
A225: 224 | B225: 113579 | C225: 健友转债! | D225: 603707 | E225: 健友股份 | F225: 医药 | G225: 原料药 | H225: 130.54 | I225: 5.8999999999999999e-003 | J225: -9.300000000000001e-003 | K225: 35.27 | L225: -5.4000000000000003e-003 | M225: 113.9 | N225: 32.2 | O225: 0.192 | P225: 109.53 | Q225: 已到 | R225: 4.17年 | S225: 2.17年 | T225: 5.03 | U225: 16 | V225: 2.4e-002 | W225: 1.1000000000000001e-002 | X225: 1.3000000000000001e-002 | Y225: 439 | Z225: 9.99 | AA225: -3.2799999999999996e-002 | AB225: -3.85e-002 | AC225: -9.5600000000000004e-002 | AD225: -9.8000000000000004e-002 | AE225: 94.89 | AF225: 97.9 | AG225: 0.64 | AH225: AA | AI225: 3.78e-002 | AJ225: =H225+100*O225 -> 149.73999999999998 | AK225: 151.5 | AL225: 160 | AM225: 53.6 | AN225: 133 | AO225: -3.2000000000000001e-002 | AP225: 10 | AQ225: 健友转债!
A226: 225 | B226: 128107 | C226: 交科转债 | D226: 2061 | E226: 浙江交科 | F226: 建筑 | G226: 建筑工程 | H226: 135.39 | I226: 2.5000000000000001e-002 | J226: -4.0999999999999995e-003 | K226: 7.11 | L226: 2.6000000000000002e-002 | M226: 114.9 | N226: 5.24 | O226: -2.e-003 | P226: 135.69 | Q226: 已到 | R226: 4.17年 | S226: 2.17年 | T226: 22.6 | U226: 996 | V226: 0.32600000000000001 | W226: 0.23199999999999998 | X226: 0.314 | Y226: 98 | Z226: 1.09 | AA226: -3.9399999999999998e-002 | AB226: -4.5400000000000003e-002 | AC226: -0.109 | AD226: -0.11199999999999999 | AE226: 95.97 | AF226: 100.73 | AG226: 0.8 | AH226: AA+ | AI226: 3.2799999999999996e-002 | AJ226: =H226+100*O226 -> 135.19 | AK226: 135.1 | AL226: 15 | AM226: 34.4 | AN226: 15 | AO226: 0.155 | AP226: 22 | AQ226: 交科转债
A227: 226 | B227: 113578 | C227: 全筑转债! | D227: 603030 | E227: 全筑股份 | F227: 建筑 | G227: 装饰工程 | H227: 109.44 | I227: -6.4000000000000003e-003 | J227: -1.01e-002 | K227: 4.07 | L227: -6.6500000000000004e-002 | M227: 117.9 | N227: 5.25 | O227: 0.41200000000000003 | P227: 77.52 | Q227: 已到 | R227: 4.16年 | S227: 2.16年 | T227: 3.84 | U227: 176 | V227: 0.42299999999999999 | W227: 0.16300000000000001 | X227: 0.126 | Y227: 24 | Z227: 1.08 | AA227: 1.84e-002 | AB227: 1.0700000000000001e-002 | AC227: -2.4300000000000002e-002 | AD227: -2.7000000000000003e-002 | AE227: 94.92 | AF227: 101.36 | AG227: 0.25 | AH227: AA | AI227: 3.78e-002 | AJ227: =H227+100*O227 -> 150.63999999999999 | AK227: 141.4 | AL227: 50 | AM227: 40 | AN227: 35 | AO227: 0.10000000000000001 | AP227: 39 | AQ227: 全筑转债!
A228: 227 | B228: 113573 | C228: 纵横转债! | D228: 603602 | E228: 纵横通信 | F228: 通信互联 | G228: 通信设备 | H228: 114.74 | I228: 1.4000000000000002e-003 | J228: -7.6e-003 | K228: 12.63 | L228: -2.6200000000000001e-002 | M228: 124.2 | N228: 18.78 | O228: 0.70599999999999996 | P228: 67.25 | Q228: 已到 | R228: 4年57天 | S228: 2年57天 | T228: 2.7 | U228: 9.4 | V228: 2.9999999999999999e-002 | W228: 0.105 | X228: 7.0000000000000007e-002 | Y228: 26 | Z228: 3.62 | AA228: 1.9699999999999999e-002 | AB228: 9.7000000000000003e-003 | AC228: -4.1399999999999999e-002 | AD228: -4.4600000000000001e-002 | AE228: 89.2 | AF228: 94.52 | AG228: 0.24 | AH228: A+ | AI228: 6.9800000000000001e-002 | AJ228: =H228+100*O228 -> 185.33999999999997 | AK228: 162.2 | AL228: 258 | AM228: 67.7 | AN228: 249 | AO228: 2.1000000000000001e-002 | AP228: 32 | AQ228: 纵横转债!
A229: 228 | B229: 113577 | C229: 春秋转债! | D229: 603890 | E229: 春秋电子 | F229: 电子 | G229: 电子产品 | H229: 133.11 | I229: 6.4000000000000003e-003 | J229: -4.0000000000000002e-004 | K229: 11.47 | L229: 9.7000000000000003e-003 | M229: 117.7 | N229: 10.85 | O229: 0.25900000000000001 | P229: 105.71 | Q229: 已到 | R229: 4年54天 | S229: 2年54天 | T229: 1.78 | U229: 6.7 | V229: 2.8999999999999998e-002 | W229: 3.5000000000000003e-002 | X229: 3.7000000000000005e-002 | Y229: 50 | Z229: 2.03 | AA229: -2.9900000000000003e-002 | AB229: -3.7000000000000005e-002 | AC229: -0.10300000000000001 | AD229: -0.106 | AE229: 90.93 | AF229: 93.41 | AG229: 0.63 | AH229: AA- | AI229: 5.8799999999999998e-002 | AJ229: =H229+100*O229 -> 159.01000000000002 | AK229: 160.5 | AL229: 240 | AM229: 67.1 | AN229: 243 | AO229: -9.8000000000000004e-002 | AP229: 14 | AQ229: 春秋转债!
A230: 229 | B230: 123050 | C230: 聚飞转债! | D230: 300303 | E230: 聚飞光电 | F230: 电子 | G230: LED制 | H230: 131.5 | I230: 6.8999999999999999e-003 | J230: 5.4000000000000003e-003 | K230: 5.71 | L230: 1.9599999999999999e-002 | M230: 123.8 | N230: 5.08 | O230: 0.17000000000000001 | P230: 112.4 | Q230: 已到 | R230: 4年54天 | S230: 2年54天 | T230: 3.75 | U230: 17 | V230: 3.4000000000000002e-002 | W230: 4.9000000000000002e-002 | X230: 5.5e-002 | Y230: 77 | Z230: 2.76 | AA230: -1.4800000000000001e-002 | AB230: -2.4199999999999999e-002 | AC230: -9.8400000000000001e-002 | AD230: -0.10099999999999999 | AE230: 91.02 | AF230: 98.24 | AG230: 0.63 | AH230: AA- | AI230: 5.8799999999999998e-002 | AJ230: =H230+100*O230 -> 148.5 | AK230: 150.6 | AL230: 145 | AM230: 52.4 | AN230: 122 | AO230: 0. | AP230: 12 | AQ230: 聚飞转债!
A231: 230 | B231: 123049 | C231: 维尔转债! | D231: 300190 | E231: 维尔利 | F231: 城市公用 | G231: 三废处理 | H231: 115.736 | I231: 1.21e-002 | J231: -8.0000000000000002e-003 | K231: 6.04 | L231: 1.1699999999999999e-002 | M231: 124.3 | N231: 7.38 | O231: 0.41399999999999998 | P231: 81.84 | Q231: 已到 | R231: 4年53天 | S231: 2年53天 | T231: 9.17 | U231: 2.9 | V231: 3.0000000000000001e-003 | W231: 0.19399999999999998 | X231: 0.159 | Y231: 47 | Z231: 1.08 | AA231: 1.78e-002 | AB231: 7.8000000000000005e-003 | AC231: -4.4900000000000002e-002 | AD231: -4.8099999999999997e-002 | AE231: 91.49 | AF231: 98.71 | AG231: 0.35 | AH231: AA- | AI231: 5.8799999999999998e-002 | AJ231: =H231+100*O231 -> 157.136 | AK231: 149.6 | AL231: 136 | AM231: 50.9 | AN231: 109 | AO231: 4.5999999999999999e-002 | AP231: 21 | AQ231: 维尔转债!
A232: 231 | B232: 110070 | C232: 凌钢转债! | D232: 600231 | E232: 凌钢股份 | F232: 钢铁 | G232: 炼钢 | H232: 125.16 | I232: 2.0299999999999999e-002 | J232: -4.3e-003 | K232: 2.8 | L232: 2.9399999999999999e-002 | M232: 117.4 | N232: 2.69 | O232: 0.20199999999999999 | P232: 104.09 | Q232: 已到 | R232: 4年53天 | S232: 2年53天 | T232: 2.17 | U232: 40 | V232: 0.14899999999999999 | W232: 2.7000000000000003e-002 | X232: 2.7999999999999997e-002 | Y232: 80 | Z232: 0.85 | AA232: -1.5700000000000002e-002 | AB232: -2.29e-002 | AC232: -7.8799999999999995e-002 | AD232: -8.1500000000000003e-002 | AE232: 95.31 | AF232: 101.04 | AG232: 0.54 | AH232: AA | AI232: 3.78e-002 | AJ232: =H232+100*O232 -> 145.35999999999999 | AK232: 146.2 | AL232: 97 | AM232: 45.2 | AN232: 66 | AO232: 4.0000000000000001e-002 | AP232: 22 | AQ232: 凌钢转债!
A233: 232 | B233: 128106 | C233: 华统转债! | D233: 2840 | E233: 华统股份 | F233: 农业 | G233: 农产品加 | H233: 159.3 | I233: 1.6799999999999999e-002 | J233: -1.18e-002 | K233: 14.42 | L233: 5.6000000000000008e-003 | M233: 112.9 | N233: 9.37 | O233: 3.5000000000000003e-002 | P233: 153.9 | Q233: 已到 | R233: 4年50天 | S233: 2年50天 | T233: 3.9 | U233: 128 | V233: 0.20800000000000002 | W233: 5.9000000000000004e-002 | X233: 9.0999999999999998e-002 | Y233: 66 | Z233: 3.82 | AA233: -8.14e-002 | AB233: -8.6300000000000002e-002 | AC233: -0.129 | AD233: -0.13100000000000001 | AE233: 95.02 | AF233: 97.17 | AG233: 0.9 | AH233: AA | AI233: 3.78e-002 | AJ233: =H233+100*O233 -> 162.80000000000001 | AK233: 164.7 | AL233: 275 | AM233: 67.5 | AN233: 247 | AO233: -0.124 | AP233: 13 | AQ233: 华统转债!
A234: 233 | B234: 123048 | C234: 应急转债! | D234: 300527 | E234: 中船应急 | F234: 机械装备 | G234: 专用设备 | H234: 125.44 | I234: -5.1999999999999998e-003 | J234: 5.0000000000000001e-004 | K234: 8.96 | L234: -8.8000000000000005e-003 | M234: 112.8 | N234: 8.88 | O234: 0.24299999999999999 | P234: 100.9 | Q234: 已到 | R234: 4年50天 | S234: 2年50天 | T234: 3.79 | U234: 44 | V234: 9.1999999999999998e-002 | W234: 4.4000000000000004e-002 | X234: 4.4000000000000004e-002 | Y234: 86 | Z234: 3.28 | AA234: -2.5899999999999999e-002 | AB234: -3.1200000000000002e-002 | AC234: -8.1500000000000003e-002 | AD234: -8.3900000000000002e-002 | AE234: 95.97 | AF234: 98.99 | AG234: 0.54 | AH234: AA+ | AI234: 3.2799999999999996e-002 | AJ234: =H234+100*O234 -> 149.74000000000001 | AK234: 150 | AL234: 139 | AM234: 51 | AN234: 110 | AO234: -2.7999999999999997e-002 | AP234: 15 | AQ234: 应急转债!
A235: 234 | B235: 113576 | C235: 起步转债!! | D235: 603557 | E235: ST起步 | F235: 服装纺织 | G235: 鞋服行业 | H235: 115.31 | I235: 2.5000000000000001e-003 | J235: -2.3e-003 | K235: 4.85 | L235: 4.0999999999999995e-003 | M235: 121.3 | N235: 10.55 | O235: 1.51 | P235: 45.97 | Q235: 已到 | R235: 4年50天 | S235: 2年50天 | T235: 2.66 | U235: 66 | V235: 0.214 | W235: 0.111 | X235: 5.0999999999999997e-002 | Y235: 24 | Z235: 1.6 | AA235: 1.26e-002 | AB235: 3.7000000000000002e-003 | AC235: -4.3499999999999997e-002 | AD235: -4.6799999999999994e-002 | AE235: 83.97 | AF235: 82.77 | AG235: 0.05 | AH235: BBB+ | AI235: 9.98e-002 | AJ235: =H235+100*O235 -> 266.31 | AK235: 184.6 | AL235: 332 | AM235: 100.7 | AN235: 341 | AO235: 2.e-002 | AP235: 34 | AQ235: 起步转债!!
A236: 235 | B236: 128105 | C236: 长集转债! | D236: 2616 | E236: 长青集团 | F236: 城市公用 | G236: 三废处理 | H236: 108.616 | I236: 4.7999999999999996e-003 | J236: -4.4000000000000003e-003 | K236: 5.5 | L236: 1.8e-003 | M236: 114.9 | N236: 7.91 | O236: 0.56200000000000006 | P236: 69.53 | Q236: 已到 | R236: 4年49天 | S236: 2年49天 | T236: 8 | U236: 3.7 | V236: 4.0000000000000001e-003 | W236: 0.19600000000000001 | X236: 0.13600000000000001 | Y236: 41 | Z236: 1.63 | AA236: 1.3999999999999999e-002 | AB236: 7.4000000000000003e-003 | AC236: -2.1400000000000002e-002 | AD236: -2.41e-002 | AE236: 95.03 | AF236: 98.9 | AG236: 0.18 | AH236: AA | AI236: 3.78e-002 | AJ236: =H236+100*O236 -> 164.816 | AK236: 147.7 | AL236: 114 | AM236: 48.8 | AN236: 90 | AO236: 1.7000000000000001e-002 | AP236: 23 | AQ236: 长集转债!
A237: 236 | B237: 113575 | C237: 东时转债!! | D237: 603377 | E237: 东方时尚 | F237: 其他 | G237: 其他 | H237: 125.07 | I237: -1.1999999999999999e-003 | J237: 2.e-003 | K237: 7.87 | L237: 6.4000000000000003e-003 | M237: 113.1 | N237: 12.15 | O237: 0.93099999999999994 | P237: 64.77 | Q237: 已到 | R237: 4年49天 | S237: 2年49天 | T237: 0.98 | U237: 7.9 | V237: 6.5000000000000002e-002 | W237: 1.7000000000000001e-002 | X237: 1.1000000000000001e-002 | Y237: 57 | Z237: 2.64 | AA237: -2.46e-002 | AB237: -3.0099999999999998e-002 | AC237: -7.9899999999999999e-002 | AD237: -8.2500000000000004e-002 | AE237: 95.06 | AF237: 97.36 | AG237: 0.13 | AH237: AA | AI237: 3.78e-002 | AJ237: =H237+100*O237 -> 218.16999999999999 | AK237: 185.4 | AL237: 334 | AM237: 88 | AN237: 330 | AO237: -2.3e-002 | AP237: 14 | AQ237: 东时转债!!
A238: 237 | B238: 127016 | C238: 鲁泰转债! | D238: 726 | E238: 鲁 泰Ａ | F238: 服装纺织 | G238: 纺织行业 | H238: 116.448 | I238: 1.1599999999999999e-002 | J238: -5.7999999999999996e-003 | K238: 7.09 | L238: 2.1600000000000001e-002 | M238: 115.9 | N238: 8.71 | O238: 0.43099999999999999 | P238: 81.4 | Q238: 已到 | R238: 4年49天 | S238: 2年49天 | T238: 14 | U238: 5.7 | V238: 4.0000000000000001e-003 | W238: 0.22399999999999998 | X238: 0.182 | Y238: 63 | Z238: 0.79 | AA238: -1.1999999999999999e-003 | AB238: -8.0000000000000002e-003 | AC238: -5.0799999999999998e-002 | AD238: -5.3399999999999996e-002 | AE238: 96.08 | AF238: 101.72 | AG238: 0.27 | AH238: AA+ | AI238: 3.2799999999999996e-002 | AJ238: =H238+100*O238 -> 159.548 | AK238: 151.5 | AL238: 157 | AM238: 49.8 | AN238: 98 | AO238: 3.9e-002 | AP238: 23 | AQ238: 鲁泰转债!
A239: 238 | B239: 113033 | C239: 利群转债! | D239: 601366 | E239: 利群股份 | F239: 商业零售 | G239: 商场 | H239: 114.86 | I239: 1.5600000000000001e-002 | J239: -1.4800000000000001e-002 | K239: 6.74 | L239: 1.5e-003 | M239: 114.9 | N239: 7.01 | O239: 0.19500000000000001 | P239: 96.15 | Q239: 已到 | R239: 4年41天 | S239: 2年41天 | T239: 18 | U239: 24 | V239: 1.2e-002 | W239: 0.31 | X239: 0.29799999999999999 | Y239: 58 | Z239: 1.33 | AA239: 1.e-004 | AB239: -6.4000000000000003e-003 | AC239: -4.5499999999999999e-002 | AD239: -4.82e-002 | AE239: 95.11 | AF239: 98.98 | AG239: 0.48 | AH239: AA | AI239: 3.78e-002 | AJ239: =H239+100*O239 -> 134.36000000000001 | AK239: 133.6 | AL239: 11 | AM239: 34.6 | AN239: 16 | AO239: 2.6000000000000002e-002 | AP239: 72 | AQ239: 利群转债!
A240: 239 | B240: 113574 | C240: 华体转债! | D240: 603679 | E240: 华体科技 | F240: 城市公用 | G240: 城市公用 | H240: 120.24 | I240: 5.2000000000000005e-002 | J240: -4.8300000000000003e-002 | K240: 16.2 | L240: 9.98e-002 | M240: 115.9 | N240: 33.91 | O240: 1.52 | P240: 47.77 | Q240: 已到 | R240: 4年40天 | S240: 2年40天 | T240: 2.09 | U240: 306 | V240: 1.23 | W240: 9.0999999999999998e-002 | X240: 4.2999999999999997e-002 | Y240: 23 | Z240: 3.07 | AA240: -9.1000000000000004e-003 | AB240: -1.5900000000000001e-002 | AC240: -6.2199999999999998e-002 | AD240: -6.5299999999999997e-002 | AE240: 89.43 | AF240: 88.51 | AG240: 0.04 | AH240: A+ | AI240: 6.9800000000000001e-002 | AJ240: =H240+100*O240 -> 272.24000000000001 | AK240: 192.7 | AL240: 342 | AM240: 103.3 | AN240: 344 | AO240: 0.19800000000000001 | AP240: 22 | AQ240: 华体转债!
A241: 240 | B241: 128103 | C241: 同德转债!* | D241: 2360 | E241: 同德化工 | F241: 化工 | G241: 化工 | H241: 174.125 | I241: -3.1600000000000003e-002 | J241: 1.8100000000000002e-002 | K241: 8.72 | L241: -1.3600000000000001e-002 | M241: 121.3 | N241: 5.08 | O241: 1.3999999999999999e-002 | P241: 171.65 | Q241: 已到 | R241: 11天 | S241: 无权 | T241: 0.75 | U241: 94 | V241: 0.70900000000000007 | W241: 2.1000000000000001e-002 | X241: 3.7000000000000005e-002 | Y241: 35 | Z241: 2.61 | AA241: <-100% | AB241: <-100% | AC241: 无权 | AD241: 无权 | AE241: 无权 | AF241: 100.37 | AG241: 1 | AH241: A+ | AI241: 6.25e-002 | AJ241: =H241+100*O241 -> 175.52500000000001 | AK241: 176.6 | AL241: 319 | AM241: 76.2 | AN241: 298 | AO241: -1.9e-002 | AP241: 17 | AQ241: 同德转债!*
A242: 241 | B242: 110068 | C242: 龙净转债! | D242: 600388 | E242: 龙净环保 | F242: 城市公用 | G242: 三废处理 | H242: 109.63 | I242: 5.0000000000000001e-003 | J242: -3.3e-003 | K242: 8.64 | L242: 5.7999999999999996e-003 | M242: 114.8 | N242: 10.55 | O242: 0.33899999999999997 | P242: 81.9 | Q242: 已到 | R242: 4年33天 | S242: 2年33天 | T242: 20 | U242: 39 | V242: 1.8000000000000002e-002 | W242: 0.217 | X242: 0.17699999999999999 | Y242: 92 | Z242: 1.43 | AA242: 1.1599999999999999e-002 | AB242: 5.0000000000000001e-003 | AC242: -2.6200000000000001e-002 | AD242: -2.8999999999999998e-002 | AE242: 96.12 | AF242: 100.89 | AG242: 0.29 | AH242: AA+ | AI242: 3.2799999999999996e-002 | AJ242: =H242+100*O242 -> 143.53 | AK242: 137.4 | AL242: 27 | AM242: 36.5 | AN242: 22 | AO242: 3.4000000000000002e-002 | AP242: 42 | AQ242: 龙净转债!
A243: 242 | B243: 123046 | C243: 天铁转债! | D243: 300587 | E243: 天铁股份 | F243: 铁路 | G243: 铁路设备 | H243: 318 | I243: -1.1399999999999999e-002 | J243: 2.9500000000000002e-002 | K243: 19.85 | L243: 1.8500000000000003e-002 | M243: 117.7 | N243: 6.73 | O243: 7.8e-002 | P243: 294.95 | Q243: 已到 | R243: 4年28天 | S243: 2年28天 | T243: 0.59 | U243: 151 | V243: 0.79000000000000004 | W243: 5.0000000000000001e-003 | X243: 1.3999999999999999e-002 | Y243: 125 | Z243: 6.75 | AA243: -0.22 | AB243: -0.22500000000000001 | AC243: -0.26200000000000001 | AD243: -0.26300000000000001 | AE243: 91.3 | AF243: 93.79 | AG243: 0.98 | AH243: AA- | AI243: 5.8799999999999998e-002 | AJ243: =H243+100*O243 -> 325.80000000000001 | AK243: 341.1 | AL243: 376 | AM243: 247.3 | AN243: 377 | AO243: 4.7e-002 | AP243: 12 | AQ243: 天铁转债!
A244: 243 | B244: 128101 | C244: 联创转债!! | D244: 2036 | E244: 联创电子 | F244: 电子 | G244: 液晶显示 | H244: 159.4 | I244: 2.5000000000000001e-003 | J244: -2.5000000000000001e-003 | K244: 18.28 | L244: 0. | M244: 114.8 | N244: 13.72 | O244: 0.19600000000000001 | P244: 133.24 | Q244: 已到 | R244: 4年25天 | S244: 2年25天 | T244: 3 | U244: 57 | V244: 0.11800000000000001 | W244: 1.4999999999999999e-002 | X244: 2.1000000000000001e-002 | Y244: 194 | Z244: 4.98 | AA244: -7.8899999999999998e-002 | AB244: -8.4700000000000011e-002 | AC244: -0.13500000000000001 | AD244: -0.13699999999999998 | AE244: 95.16 | AF244: 99.04 | AG244: 0.8 | AH244: AA | AI244: 3.78e-002 | AJ244: =H244+100*O244 -> 179. | AK244: 185.6 | AL244: 335 | AM244: 86.5 | AN244: 328 | AO244: -9.1999999999999998e-002 | AP244: 13 | AQ244: 联创转债!!
A245: 244 | B245: 123045 | C245: 雷迪转债 | D245: 300652 | E245: 雷迪克 | F245: 汽车 | G245: 零部件制 | H245: 127.71 | I245: -5.0000000000000001e-004 | J245: 1.1999999999999999e-003 | K245: 20.8 | L245: 1.e-003 | M245: 118.9 | N245: 19.63 | O245: 0.20499999999999999 | P245: 105.96 | Q245: 已到 | R245: 4年21天 | S245: 2年21天 | T245: 1.66 | U245: 13 | V245: 6.2e-002 | W245: 8.5000000000000006e-002 | X245: 8.9999999999999997e-002 | Y245: 20 | Z245: 2.05 | AA245: -1.7899999999999999e-002 | AB245: -2.58e-002 | AC245: -8.8900000000000007e-002 | AD245: -9.1899999999999996e-002 | AE245: 89.75 | AF245: 91.11 | AG245: 0.65 | AH245: A+ | AI245: 6.9800000000000001e-002 | AJ245: =H245+100*O245 -> 148.20999999999998 | AK245: 149.5 | AL245: 130 | AM245: 58.4 | AN245: 173 | AO245: 1.e-003 | AP245: 33 | AQ245: 雷迪转债
A246: 245 | B246: 128100 | C246: 搜特转债! | D246: 2503 | E246: 搜于特 | F246: 服装纺织 | G246: 服装行业 | H246: 101.45 | I246: 7.8000000000000005e-003 | J246: 2.5000000000000001e-003 | K246: 1.44 | L246: 1.41e-002 | M246: 116.9 | N246: 1.62 | O246: 0.14099999999999999 | P246: 88.89 | Q246: 已到 | R246: 4年21天 | S246: 2年21天 | T246: 7.99 | U246: 24 | V246: 2.9999999999999999e-002 | W246: 0.17899999999999999 | X246: 0.159 | Y246: 45 | Z246: 2.95 | AA246: 3.6400000000000002e-002 | AB246: 2.86e-002 | AC246: 8.6999999999999994e-003 | AD246: 5.6999999999999993e-003 | AE246: 77.56 | AF246: 69.68 | AG246: 0.73 | AH246: BB | AI246: 0.13980000000000001 | AJ246: =H246+100*O246 -> 115.55 | AK246: 114 | AL246: 1 | AM246: 36.5 | AN246: 21 | AO246: -5.5e-002 | AP246: 95 | AQ246: 搜特转债!
A247: 246 | B247: 123044 | C247: 红相转债!! | D247: 300427 | E247: 红相股份 | F247: 能源电力 | G247: 电力设备 | H247: 114.595 | I247: 5.1999999999999998e-003 | J247: 4.5999999999999999e-003 | K247: 13.58 | L247: 3.9e-002 | M247: 125 | N247: 18.67 | O247: 0.57499999999999996 | P247: 72.74 | Q247: 已到 | R247: 4年21天 | S247: 2年21天 | T247: 5.5 | U247: 16 | V247: 2.5000000000000001e-002 | W247: 0.11199999999999999 | X247: 8.199999999999999e-002 | Y247: 49 | Z247: 2.08 | AA247: 2.23e-002 | AB247: 1.1699999999999999e-002 | AC247: -4.1100000000000005e-002 | AD247: -4.4800000000000006e-002 | AE247: 92.21 | AF247: 99.82 | AG247: 0.25 | AH247: AA- | AI247: 5.8799999999999998e-002 | AJ247: =H247+100*O247 -> 172.095 | AK247: 156.5 | AL247: 206 | AM247: 56.6 | AN247: 160 | AO247: 5.2999999999999999e-002 | AP247: 24 | AQ247: 红相转债!!
A248: 247 | B248: 110067 | C248: 华安转债! | D248: 600909 | E248: 华安证券 | F248: 金融 | G248: 证券行业 | H248: 112.48 | I248: 4.3e-003 | J248: -3.7000000000000002e-003 | K248: 5.09 | L248: 2.e-003 | M248: 110.3 | N248: 6.22 | O248: 0.375 | P248: 81.83 | Q248: 已到 | R248: 4年21天 | S248: 无权 | T248: 28 | U248: 7.4 | V248: 2.e-003 | W248: 0.11699999999999999 | X248: 9.6000000000000002e-002 | Y248: 239 | Z248: 1.28 | AA248: -4.8999999999999998e-003 | AB248: -9.4999999999999998e-003 | AC248: 无权 | AD248: 无权 | AE248: 无权 | AF248: 97.71 | AG248: 0.32 | AH248: AAA | AI248: 3.0800000000000001e-002 | AJ248: =H248+100*O248 -> 149.98000000000002 | AK248: 143.1 | AL248: 67 | AM248: 45.4 | AN248: 67 | AO248: -1.2e-002 | AP248: 25 | AQ248: 华安转债!
A249: 248 | B249: 113570 | C249: 百达转债! | D249: 603331 | E249: 百达精工 | F249: 机械装备 | G249: 机械装备 | H249: 125.91 | I249: -2.5000000000000001e-003 | J249: -1.47e-002 | K249: 12.32 | L249: -2.4500000000000001e-002 | M249: 114.9 | N249: 11.34 | O249: 0.159 | P249: 108.64 | Q249: 已到 | R249: 4年20天 | S249: 2年20天 | T249: 2.8 | U249: 16 | V249: 4.4999999999999998e-002 | W249: 0.128 | X249: 0.13900000000000001 | Y249: 22 | Z249: 2.7 | AA249: -2.2799999999999997e-002 | AB249: -2.9100000000000001e-002 | AC249: -8.5600000000000009e-002 | AD249: -8.8200000000000001e-002 | AE249: 89.16 | AF249: 87.97 | AG249: 0.7 | AH249: A+ | AI249: 6.9800000000000001e-002 | AJ249: =H249+100*O249 -> 141.81 | AK249: 143.2 | AL249: 68 | AM249: 54 | AN249: 135 | AO249: -1.3000000000000001e-002 | AP249: 31 | AQ249: 百达转债!
A250: 249 | B250: 113569 | C250: 科达转债! | D250: 603660 | E250: 苏州科达 | F250: 通信互联 | G250: 物联网 | H250: 107.9 | I250: 5.8999999999999999e-003 | J250: -5.4000000000000003e-003 | K250: 6.58 | L250: 1.54e-002 | M250: 120.3 | N250: 14.8 | O250: 1.4299999999999999 | P250: 44.46 | Q250: 已到 | R250: 4年18天 | S250: 2年18天 | T250: 5.16 | U250: 2.9 | V250: 5.0000000000000001e-003 | W250: 0.159 | X250: 7.0999999999999994e-002 | Y250: 33 | Z250: 1.92 | AA250: 2.7900000000000001e-002 | AB250: 1.89e-002 | AC250: -1.8200000000000001e-002 | AD250: -2.1299999999999999e-002 | AE250: 91.46 | AF250: 96 | AG250: 0.03 | AH250: AA- | AI250: 5.8799999999999998e-002 | AJ250: =H250+100*O250 -> 250.90000000000001 | AK250: 171.3 | AL250: 308 | AM250: 75.3 | AN250: 292 | AO250: -2.7999999999999997e-002 | AP250: 43 | AQ250: 科达转债!
A251: 250 | B251: 113568 | C251: 新春转债!! | D251: 603667 | E251: 五洲新春 | F251: 机械装备 | G251: 通用设备 | H251: 171.47 | I251: -3.2000000000000002e-003 | J251: -2.8999999999999998e-003 | K251: 14.23 | L251: -6.9999999999999993e-003 | M251: 124.3 | N251: 8.75 | O251: 5.4000000000000006e-002 | P251: 162.63 | Q251: 已到 | R251: 4年15天 | S251: 2年15天 | T251: 2.44 | U251: 153 | V251: 0.36599999999999999 | W251: 5.7000000000000002e-002 | X251: 9.1999999999999998e-002 | Y251: 43 | Z251: 2.28 | AA251: -7.8299999999999995e-002 | AB251: -8.72e-002 | AC251: -0.154 | AD251: -0.156 | AE251: 92.04 | AF251: 99.3 | AG251: 0.88 | AH251: AA- | AI251: 5.8799999999999998e-002 | AJ251: =H251+100*O251 -> 176.87 | AK251: 180.3 | AL251: 328 | AM251: 81 | AN251: 315 | AO251: -4.0000000000000001e-003 | AP251: 34 | AQ251: 新春转债!!
A252: 251 | B252: 113567 | C252: 君禾转债! | D252: 603617 | E252: 君禾股份 | F252: 机械装备 | G252: 通用设备 | H252: 127.62 | I252: 1.03e-002 | J252: -8.6e-003 | K252: 12.59 | L252: 2.3999999999999998e-003 | M252: 118.8 | N252: 10.58 | O252: 7.2000000000000008e-002 | P252: 119 | Q252: 已到 | R252: 4年13天 | S252: 2年13天 | T252: 2.1 | U252: 25 | V252: 9.5000000000000001e-002 | W252: 6.4000000000000001e-002 | X252: 7.6999999999999999e-002 | Y252: 33 | Z252: 3.58 | AA252: -1.8000000000000002e-002 | AB252: -2.5899999999999999e-002 | AC252: -8.9900000000000008e-002 | AD252: -9.2899999999999996e-002 | AE252: 89.81 | AF252: 91.17 | AG252: 0.73 | AH252: A+ | AI252: 6.9800000000000001e-002 | AJ252: =H252+100*O252 -> 134.81999999999999 | AK252: 136.2 | AL252: 20 | AM252: 45.1 | AN252: 63 | AO252: -1.8000000000000002e-002 | AP252: 34 | AQ252: 君禾转债!
A253: 252 | B253: 110066 | C253: 盛屯转债!! | D253: 600711 | E253: 盛屯矿业 | F253: 有色金属 | G253: 有色行业 | H253: 235.69 | I253: -5.0000000000000001e-004 | J253: 1.5800000000000002e-002 | K253: 10.26 | L253: 1.5800000000000002e-002 | M253: 114.9 | N253: 4.87 | O253: 0.11900000000000001 | P253: 210.68 | Q253: 已到 | R253: 4年11天 | S253: 2年11天 | T253: 3.83 | U253: 426 | V253: 0.46600000000000003 | W253: 1.3999999999999999e-002 | X253: 2.8999999999999998e-002 | Y253: 282 | Z253: 2.28 | AA253: -0.16600000000000001 | AB253: -0.17100000000000001 | AC253: -0.223 | AD253: -0.22399999999999998 | AE253: 95.4 | AF253: 99.28 | AG253: 0.97 | AH253: AA | AI253: 3.78e-002 | AJ253: =H253+100*O253 -> 247.59 | AK253: 260.7 | AL253: 367 | AM253: 161.4 | AN253: 367 | AO253: 3.7999999999999999e-002 | AP253: 26 | AQ253: 盛屯转债!!
A254: 253 | B254: 113566 | C254: 翔港转债! | D254: 603499 | E254: 翔港科技 | F254: 造纸包装 | G254: 包装材料 | H254: 117.72 | I254: 8.9999999999999998e-004 | J254: 4.4000000000000003e-003 | K254: 7.97 | L254: 1.66e-002 | M254: 124 | N254: 10.77 | O254: 0.59099999999999997 | P254: 74 | Q254: 已到 | R254: 4年9天 | S254: 2年9天 | T254: 1.61 | U254: 3.1 | V254: 1.6e-002 | W254: 0.10099999999999999 | X254: 7.400000000000001e-002 | Y254: 16 | Z254: 2.82 | AA254: 1.3300000000000001e-002 | AB254: 3.2000000000000002e-003 | AC254: -5.5099999999999996e-002 | AD254: -5.8400000000000001e-002 | AE254: 90.06 | AF254: 95.22 | AG254: 0.32 | AH254: A+ | AI254: 6.9800000000000001e-002 | AJ254: =H254+100*O254 -> 176.81999999999999 | AK254: 161.4 | AL254: 248 | AM254: 66.2 | AN254: 238 | AO254: -3.9e-002 | AP254: 30 | AQ254: 翔港转债!
A255: 254 | B255: 113565 | C255: 宏辉转债 | D255: 603336 | E255: 宏辉果蔬 | F255: 农业 | G255: 农产品加 | H255: 119.62 | I255: -2.9999999999999997e-004 | J255: -6.1999999999999998e-003 | K255: 7.2 | L255: -1.23e-002 | M255: 117.8 | N255: 7.64 | O255: 0.26899999999999996 | P255: 94.24 | Q255: 已到 | R255: 4年7天 | S255: 2年7天 | T255: 2.25 | U255: 15 | V255: 5.7000000000000002e-002 | W255: 7.0999999999999994e-002 | X255: 6.7000000000000004e-002 | Y255: 32 | Z255: 3.04 | AA255: -3.9000000000000003e-003 | AB255: -1.1599999999999999e-002 | AC255: -6.4000000000000001e-002 | AD255: -6.6900000000000001e-002 | AE255: 91.7 | AF255: 94.2 | AG255: 0.52 | AH255: AA- | AI255: 5.8799999999999998e-002 | AJ255: =H255+100*O255 -> 146.52000000000001 | AK255: 145 | AL255: 81 | AM255: 50.8 | AN255: 108 | AO255: -3.6000000000000004e-002 | AP255: 29 | AQ255: 宏辉转债
A256: 255 | B256: 128097 | C256: 奥佳转债!! | D256: 2614 | E256: 奥佳华 | F256: 机械装备 | G256: 专用设备 | H256: 127.631 | I256: -5.1999999999999998e-003 | J256: -5.1999999999999998e-003 | K256: 11.19 | L256: -1.5800000000000002e-002 | M256: 114.9 | N256: 10.39 | O256: 0.185 | P256: 107.7 | Q256: 已到 | R256: 4年6.1天 | S256: 2年6.1天 | T256: 4.59 | U256: 7.4 | V256: 1.3000000000000001e-002 | W256: 6.5000000000000002e-002 | X256: 7.0000000000000007e-002 | Y256: 71 | Z256: 1.5 | AA256: -2.64e-002 | AB256: -3.27e-002 | AC256: -9.2899999999999996e-002 | AD256: -9.5500000000000002e-002 | AE256: 91.42 | AF256: 91.84 | AG256: 0.66 | AH256: AA- | AI256: 5.8799999999999998e-002 | AJ256: =H256+100*O256 -> 146.131 | AK256: 147.6 | AL256: 111 | AM256: 55.7 | AN256: 151 | AO256: -5.9999999999999998e-002 | AP256: 16 | AQ256: 奥佳转债!!
A257: 256 | B257: 128095 | C257: 恩捷转债!! | D257: 2812 | E257: 恩捷股份 | F257: 电子 | G257: 元器件制 | H257: 434.012 | I257: -4.0999999999999995e-003 | J257: 9.300000000000001e-003 | K257: 250.19 | L257: 5.3e-003 | M257: 114.3 | N257: 64.92 | O257: 0.126 | P257: 385.38 | Q257: 已到 | R257: 3.98年 | S257: 1.98年 | T257: 4.54 | U257: 152 | V257: 7.6999999999999999e-002 | W257: 2.e-003 | X257: 8.0000000000000002e-003 | Y257: 2233. | Z257: 17.42 | AA257: -0.28800000000000003 | AB257: -0.29199999999999998 | AC257: -0.314 | AD257: -0.315 | AE257: 94.99 | AF257: 98.87 | AG257: 0.99 | AH257: AA | AI257: 3.78e-002 | AJ257: =H257+100*O257 -> 446.61200000000002 | AK257: 482.6 | AL257: 383 | AM257: 383.8 | AN257: 384 | AO257: -1.3000000000000001e-002 | AP257: 12 | AQ257: 恩捷转债!!
A258: 257 | B258: 128096 | C258: 奥瑞转债!!* | D258: 2701 | E258: 奥瑞金 | F258: 造纸包装 | G258: 包装材料 | H258: 134.697 | I258: 1.3300000000000001e-002 | J258: -1.7000000000000001e-003 | K258: 6.08 | L258: 1.1599999999999999e-002 | M258: 114.7 | N258: 4.5 | O258: -3.0000000000000001e-003 | P258: 135.11 | Q258: 已到 | R258: 10天 | S258: 无权 | T258: 3.48 | U258: 31 | V258: 6.6000000000000003e-002 | W258: 2.3e-002 | X258: 3.2000000000000001e-002 | Y258: 149 | Z258: 2.05 | AA258: <-100% | AB258: <-100% | AC258: 无权 | AD258: 无权 | AE258: 无权 | AF258: 99.98 | AG258: 1 | AH258: AA+ | AI258: 2.5499999999999998e-002 | AJ258: =H258+100*O258 -> 134.39699999999999 | AK258: 134.3 | AL258: 13 | AM258: 34.3 | AN258: 14 | AO258: -3.3000000000000002e-002 | AP258: 15 | AQ258: 奥瑞转债!!*
A259: 258 | B259: 113563 | C259: 柳药转债! | D259: 603368 | E259: 柳药股份 | F259: 医药 | G259: 医药商业 | H259: 109.56 | I259: 3.4000000000000002e-003 | J259: -1.5e-003 | K259: 16.62 | L259: 1.09e-002 | M259: 112.3 | N259: 23.87 | O259: 0.57399999999999995 | P259: 69.63 | Q259: 已到 | R259: 3.91年 | S259: 1.91年 | T259: 8.02 | U259: 42 | V259: 4.9000000000000002e-002 | W259: 0.13300000000000001 | X259: 9.3000000000000013e-002 | Y259: 60 | Z259: 1.15 | AA259: 6.5000000000000006e-003 | AB259: 7.000000000000001e-004 | AC259: -3.04e-002 | AD259: -3.3000000000000002e-002 | AE259: 95.24 | AF259: 97.41 | AG259: 0.17 | AH259: AA | AI259: 3.78e-002 | AJ259: =H259+100*O259 -> 166.96000000000001 | AK259: 149.5 | AL259: 131 | AM259: 52.1 | AN259: 121 | AO259: -6.9000000000000006e-002 | AP259: 20 | AQ259: 柳药转债!
A260: 259 | B260: 128094 | C260: 星帅转债!* | D260: 2860 | E260: 星帅尔 | F260: 家电 | G260: 零部件制 | H260: 138.48 | I260: -3.7200000000000004e-002 | J260: 2.3999999999999998e-003 | K260: 19.17 | L260: -3.4700000000000002e-002 | M260: 120.3 | N260: 13.8 | O260: -3.0000000000000001e-003 | P260: 138.91 | Q260: 已到 | R260: 6.1天 | S260: 无权 | T260: 0.81 | U260: 151 | V260: 1.3400000000000001 | W260: 2.e-002 | X260: 2.7999999999999997e-002 | Y260: 41 | Z260: 3.4 | AA260: <-100% | AB260: <-100% | AC260: 无权 | AD260: 无权 | AE260: 无权 | AF260: 100.03 | AG260: 1 | AH260: A+ | AI260: 6.25e-002 | AJ260: =H260+100*O260 -> 138.17999999999998 | AK260: 138 | AL260: 30 | AM260: 38 | AN260: 29 | AO260: -7.5999999999999998e-002 | AP260: 28 | AQ260: 星帅转债!*
A261: 260 | B261: 123042 | C261: 银河转债!!* | D261: 300619 | E261: 金银河 | F261: 机械装备 | G261: 专用设备 | H261: 263.99 | I261: -4.0899999999999999e-002 | J261: 2.0000000000000001e-004 | K261: 62.5 | L261: -4.07e-002 | M261: 114.6 | N261: 23.59 | O261: -4.0000000000000001e-003 | P261: 264.94 | Q261: 已到 | R261: 6.1天 | S261: 无权 | T261: 0.87 | U261: 313 | V261: 1.3500000000000001 | W261: 1.6e-002 | X261: 4.2999999999999997e-002 | Y261: 53 | Z261: 8.8 | AA261: <-100% | AB261: <-100% | AC261: 无权 | AD261: 无权 | AE261: 无权 | AF261: 100.03 | AG261: 1 | AH261: A+ | AI261: 6.25e-002 | AJ261: =H261+100*O261 -> 263.59000000000003 | AK261: 263 | AL261: 370 | AM261: 163 | AN261: 368 | AO261: -2.9999999999999999e-002 | AP261: 20 | AQ261: 银河转债!!*
A262: 261 | B262: 127015 | C262: 希望转债!! | D262: 876 | E262: 新 希 望 | F262: 农业 | G262: 畜牧业 | H262: 125.745 | I262: 6.9999999999999993e-003 | J262: -6.9999999999999993e-003 | K262: 16.38 | L262: 0. | M262: 109.6 | N262: 19.75 | O262: 0.51600000000000001 | P262: 82.94 | Q262: 已到 | R262: 3.87年 | S262: 1.87年 | T262: 9.5 | U262: 14 | V262: 1.2e-002 | W262: 1.3000000000000001e-002 | X262: 1.1000000000000001e-002 | Y262: 738 | Z262: 2.42 | AA262: -3.5400000000000001e-002 | AB262: -3.9699999999999999e-002 | AC262: -9.69e-002 | AD262: -9.8800000000000013e-002 | AE262: 96.17 | AF262: 97.63 | AG262: 0.33 | AH262: AAA | AI262: 3.0800000000000001e-002 | AJ262: =H262+100*O262 -> 177.345 | AK262: 168.6 | AL262: 298 | AM262: 70.9 | AN262: 272 | AO262: -2.e-003 | AP262: 26 | AQ262: 希望转债!!
A263: 262 | B263: 128093 | C263: 百川转债!!* | D263: 2455 | E263: 百川股份 | F263: 化工 | G263: 化工 | H263: 226.154 | I263: -9.5999999999999992e-003 | J263: -1.7000000000000001e-003 | K263: 13.15 | L263: -1.1299999999999999e-002 | M263: 129 | N263: 5.77 | O263: -8.0000000000000002e-003 | P263: 227.9 | Q263: 已到 | R263: 11天 | S263: 无权 | T263: 0.73 | U263: 143 | V263: 0.86499999999999999 | W263: 1.e-002 | X263: 2.2000000000000002e-002 | Y263: 74 | Z263: 4.21 | AA263: <-100% | AB263: <-100% | AC263: 无权 | AD263: 无权 | AE263: 无权 | AF263: 100.24 | AG263: 1 | AH263: AA- | AI263: 5.1500000000000004e-002 | AJ263: =H263+100*O263 -> 225.35399999999998 | AK263: 224.4 | AL263: 356 | AM263: 124.2 | AN263: 355 | AO263: 5.5e-002 | AP263: 36 | AQ263: 百川转债!!*
A264: 263 | B264: 113561 | C264: 正裕转债! | D264: 603089 | E264: 正裕工业 | F264: 汽车 | G264: 零部件制 | H264: 119.38 | I264: 5.5000000000000005e-003 | J264: -1.e-003 | K264: 8.81 | L264: 9.1999999999999998e-003 | M264: 117.2 | N264: 10.08 | O264: 0.36599999999999999 | P264: 87.4 | Q264: 已到 | R264: 3.86年 | S264: 1.86年 | T264: 1.5 | U264: 2.2 | V264: 1.2e-002 | W264: 7.5999999999999998e-002 | X264: 6.7000000000000004e-002 | Y264: 20 | Z264: 1.89 | AA264: -4.8999999999999998e-003 | AB264: -1.26e-002 | AC264: -6.9000000000000006e-002 | AD264: -7.1900000000000006e-002 | AE264: 90.24 | AF264: 90.83 | AG264: 0.49 | AH264: A+ | AI264: 6.9800000000000001e-002 | AJ264: =H264+100*O264 -> 155.97999999999999 | AK264: 151.4 | AL264: 154 | AM264: 60.5 | AN264: 193 | AO264: -2.e-003 | AP264: 35 | AQ264: 正裕转债!
A265: 264 | B265: 128091 | C265: 新天转债! | D265: 2873 | E265: 新天药业 | F265: 医药 | G265: 中药 | H265: 194.492 | I265: -7.9000000000000008e-003 | J265: 2.8999999999999998e-003 | K265: 20.22 | L265: -5.4000000000000003e-003 | M265: 118.6 | N265: 11.62 | O265: 0.11800000000000001 | P265: 174.01 | Q265: 已到 | R265: 3.86年 | S265: 1.86年 | T265: 1.55 | U265: 918 | V265: 3.02 | W265: 4.7e-002 | X265: 8.1000000000000003e-002 | Y265: 33 | Z265: 2.73 | AA265: -0.12300000000000001 | AB265: -0.129 | AC265: -0.20499999999999999 | AD265: -0.20699999999999999 | AE265: 90.55 | AF265: 91.98 | AG265: 0.93 | AH265: A+ | AI265: 6.9800000000000001e-002 | AJ265: =H265+100*O265 -> 206.292 | AK265: 215 | AL265: 349 | AM265: 123 | AN265: 352 | AO265: -2.3e-002 | AP265: 22 | AQ265: 新天转债!
A266: 265 | B266: 128090 | C266: 汽模转2 | D266: 2510 | E266: 天汽模 | F266: 汽车 | G266: 零部件制 | H266: 119.63 | I266: 3.0999999999999999e-003 | J266: 1.e-003 | K266: 4.1 | L266: 7.4000000000000003e-003 | M266: 114.3 | N266: 4.23 | O266: 0.23399999999999999 | P266: 96.93 | Q266: 已到 | R266: 3.85年 | S266: 1.85年 | T266: 3.1 | U266: 12 | V266: 3.3000000000000002e-002 | W266: 8.0000000000000002e-002 | X266: 7.8e-002 | Y266: 39 | Z266: 1.89 | AA266: -1.2e-002 | AB266: -1.8500000000000003e-002 | AC266: -7.2800000000000004e-002 | AD266: -7.5199999999999989e-002 | AE266: 91.67 | AF266: 92.1 | AG266: 0.56 | AH266: AA- | AI266: 5.8799999999999998e-002 | AJ266: =H266+100*O266 -> 143.03 | AK266: 142.3 | AL266: 60 | AM266: 50.2 | AN266: 105 | AO266: -3.1e-002 | AP266: 29 | AQ266: 汽模转2
A267: 266 | B267: 123039 | C267: 开润转债! | D267: 300577 | E267: 开润股份 | F267: 服装纺织 | G267: 纺织行业 | H267: 113.958 | I267: 2.e-003 | J267: -4.7999999999999996e-003 | K267: 18.4 | L267: -1.66e-002 | M267: 120.3 | N267: 29.92 | O267: 0.85299999999999998 | P267: 61.5 | Q267: 已到 | R267: 3.85年 | S267: 1.85年 | T267: 2.22 | U267: 3.8 | V267: 1.4999999999999999e-002 | W267: 5.0000000000000003e-002 | X267: 3.1e-002 | Y267: 44 | Z267: 2.74 | AA267: 1.4499999999999999e-002 | AB267: 5.3e-003 | AC267: -4.7500000000000001e-002 | AD267: -5.0599999999999999e-002 | AE267: 90.34 | AF267: 93.31 | AG267: 0.17 | AH267: A+ | AI267: 6.9800000000000001e-002 | AJ267: =H267+100*O267 -> 199.25799999999998 | AK267: 166.4 | AL267: 288 | AM267: 73.1 | AN267: 281 | AO267: -9.0999999999999998e-002 | AP267: 23 | AQ267: 开润转债!
A268: 267 | B268: 123038 | C268: 联得转债! | D268: 300545 | E268: 联得装备 | F268: 机械装备 | G268: 专用设备 | H268: 123.891 | I268: 3.4000000000000002e-003 | J268: -3.9000000000000003e-003 | K268: 20.38 | L268: -1.e-003 | M268: 117.9 | N268: 24.07 | O268: 0.46299999999999997 | P268: 84.67 | Q268: 已到 | R268: 3.85年 | S268: 1.85年 | T268: 1.47 | U268: 3.5 | V268: 1.9e-002 | W268: 4.0999999999999995e-002 | X268: 3.4000000000000002e-002 | Y268: 36 | Z268: 2.62 | AA268: -1.3100000000000001e-002 | AB268: -2.1000000000000001e-002 | AC268: -8.7599999999999997e-002 | AD268: -9.0200000000000002e-002 | AE268: 90.14 | AF268: 91.44 | AG268: 0.45 | AH268: A+ | AI268: 6.9800000000000001e-002 | AJ268: =H268+100*O268 -> 170.191 | AK268: 163.1 | AL268: 265 | AM268: 71.7 | AN268: 275 | AO268: -2.8999999999999998e-002 | AP268: 18 | AQ268: 联得转债!
A269: 268 | B269: 113030 | C269: 东风转债! | D269: 601515 | E269: 东风股份 | F269: 造纸包装 | G269: 包装材料 | H269: 131.27 | I269: -4.5000000000000005e-003 | J269: 3.5999999999999999e-003 | K269: 7.17 | L269: -1.4000000000000002e-003 | M269: 116.3 | N269: 6.4 | O269: 0.17199999999999999 | P269: 112.03 | Q269: 已到 | R269: 3.84年 | S269: 1.84年 | T269: 2.95 | U269: 11 | V269: 2.7000000000000003e-002 | W269: 2.7000000000000003e-002 | X269: 2.9999999999999999e-002 | Y269: 110 | Z269: 2.12 | AA269: -3.15e-002 | AB269: -3.8699999999999998e-002 | AC269: -0.115 | AD269: -0.11699999999999999 | AE269: 95.46 | AF269: 101.1 | AG269: 0.63 | AH269: AA | AI269: 3.78e-002 | AJ269: =H269+100*O269 -> 148.47 | AK269: 150.5 | AL269: 144 | AM269: 49.4 | AN269: 97 | AO269: -1.6e-002 | AP269: 17 | AQ269: 东风转债!
A270: 269 | B270: 110064 | C270: 建工转债! | D270: 600939 | E270: 重庆建工 | F270: 建筑 | G270: 建筑工程 | H270: 131.28 | I270: 2.8399999999999998e-002 | J270: -7.4000000000000003e-003 | K270: 5.85 | L270: 2.81e-002 | M270: 119.2 | N270: 4.53 | O270: 1.7000000000000001e-002 | P270: 129.14 | Q270: 已到 | R270: 3.83年 | S270: 1.83年 | T270: 14 | U270: 1033. | V270: 0.57200000000000006 | W270: 0.13200000000000001 | X270: 0.17000000000000001 | Y270: 106 | Z270: 1.46 | AA270: -2.5399999999999999e-002 | AB270: -3.3799999999999997e-002 | AC270: -0.11199999999999999 | AD270: -0.115 | AE270: 97.11 | AF270: 105.63 | AG270: 0.75 | AH270: AA+ | AI270: 3.2799999999999996e-002 | AJ270: =H270+100*O270 -> 132.97999999999999 | AK270: 133.4 | AL270: 10 | AM270: 27.8 | AN270: 6 | AO270: 0.191 | AP270: 49 | AQ270: 建工转债!
A271: 270 | B271: 128087 | C271: 孚日转债! | D271: 2083 | E271: 孚日股份 | F271: 服装纺织 | G271: 家纺 | H271: 122.3 | I271: 4.3e-003 | J271: -2.8999999999999998e-003 | K271: 4.83 | L271: 2.0999999999999999e-003 | M271: 112.3 | N271: 4.5 | O271: 0.13900000000000001 | P271: 107.33 | Q271: 已到 | R271: 3.82年 | S271: 1.82年 | T271: 6.5 | U271: 29 | V271: 3.7000000000000005e-002 | W271: 0.14800000000000002 | X271: 0.159 | Y271: 44 | Z271: 1.17 | AA271: -2.2400000000000003e-002 | AB271: -2.81e-002 | AC271: -8.4100000000000008e-002 | AD271: -8.6500000000000007e-002 | AE271: 91.82 | AF271: 90.64 | AG271: 0.68 | AH271: AA- | AI271: 5.8799999999999998e-002 | AJ271: =H271+100*O271 -> 136.19999999999999 | AK271: 137.3 | AL271: 26 | AM271: 45.4 | AN271: 68 | AO271: -4.0000000000000001e-003 | AP271: 72 | AQ271: 孚日转债!
A272: 271 | B272: 128085 | C272: 鸿达转债!! | D272: 2002 | E272: 鸿达兴业 | F272: 化工 | G272: 化工 | H272: 140.688 | I272: 6.3e-003 | J272: -3.0000000000000001e-003 | K272: 5.49 | L272: 3.7000000000000002e-003 | M272: 123.8 | N272: 3.91 | O272: 2.e-003 | P272: 140.41 | Q272: 已到 | R272: 3.82年 | S272: 1.82年 | T272: 3.38 | U272: 69 | V272: 0.14599999999999999 | W272: 2.e-002 | X272: 2.7999999999999997e-002 | Y272: 171 | Z272: 1.65 | AA272: -3.3599999999999998e-002 | AB272: -4.3499999999999997e-002 | AC272: -0.11800000000000001 | AD272: -0.12 | AE272: 75.8 | AF272: 68.95 | AG272: 0.88 | AH272: B | AI272: 0.16980000000000001 | AJ272: =H272+100*O272 -> 140.88799999999998 | AK272: 141 | AL272: 46 | AM272: 65.2 | AN272: 232 | AO272: 1.7000000000000001e-002 | AP272: 84 | AQ272: 鸿达转债!!
A273: 272 | B273: 110063 | C273: 鹰19转债 | D273: 600567 | E273: 山鹰国际 | F273: 造纸包装 | G273: 包装用纸 | H273: 118.54 | I273: 8.8000000000000005e-003 | J273: -4.3e-003 | K273: 3.21 | L273: 9.3999999999999986e-003 | M273: 115.4 | N273: 3.26 | O273: 0.20399999999999999 | P273: 98.47 | Q273: 已到 | R273: 3.81年 | S273: 1.81年 | T273: 18.4 | U273: 21 | V273: 1.e-002 | W273: 0.124 | X273: 0.12300000000000001 | Y273: 148 | Z273: 0.92 | AA273: -7.0999999999999995e-003 | AB273: -1.4199999999999999e-002 | AC273: -7.0099999999999996e-002 | AD273: -7.2599999999999998e-002 | AE273: 96.41 | AF273: 102.26 | AG273: 0.47 | AH273: AA+ | AI273: 3.2799999999999996e-002 | AJ273: =H273+100*O273 -> 138.94 | AK273: 138.6 | AL273: 38 | AM273: 36.4 | AN273: 20 | AO273: -1.e-003 | AP273: 29 | AQ273: 鹰19转债
A274: 273 | B274: 128083 | C274: 新北转债! | D274: 2376 | E274: 新北洋 | F274: 电子 | G274: 电子产品 | H274: 112 | I274: 8.1000000000000013e-003 | J274: -7.9000000000000008e-003 | K274: 8.4 | L274: 1.1999999999999999e-003 | M274: 114.3 | N274: 11.45 | O274: 0.52700000000000002 | P274: 73.36 | Q274: 已到 | R274: 3.81年 | S274: 1.81年 | T274: 8.77 | U274: 15 | V274: 1.6e-002 | W274: 0.157 | X274: 0.115 | Y274: 56 | Z274: 1.66 | AA274: 5.4000000000000003e-003 | AB274: -1.2999999999999999e-003 | AC274: -4.2699999999999995e-002 | AD274: -4.53e-002 | AE274: 95.58 | AF274: 99.49 | AG274: 0.2 | AH274: AA | AI274: 3.78e-002 | AJ274: =H274+100*O274 -> 164.69999999999999 | AK274: 150.6 | AL274: 146 | AM274: 51.1 | AN274: 113 | AO274: -4.9000000000000002e-002 | AP274: 22 | AQ274: 新北转债!
A275: 274 | B275: 128082 | C275: 华锋转债!! | D275: 2806 | E275: 华锋股份 | F275: 电子 | G275: 元器件制 | H275: 149.6 | I275: -3.4999999999999996e-003 | J275: -4.1999999999999997e-003 | K275: 12.72 | L275: -9.300000000000001e-003 | M275: 120.6 | N275: 9.13 | O275: 7.400000000000001e-002 | P275: 139.32 | Q275: 已到 | R275: 3.79年 | S275: 1.79年 | T275: 2.04 | U275: 18 | V275: 6.0999999999999999e-002 | W275: 8.3000000000000004e-002 | X275: 0.11599999999999999 | Y275: 24 | Z275: 2.14 | AA275: -5.6399999999999999e-002 | AB275: -6.5000000000000002e-002 | AC275: -0.14000000000000001 | AD275: -0.14199999999999999 | AE275: 89.36 | AF275: 90.8 | AG275: 0.82 | AH275: A | AI275: 7.980000000000001e-002 | AJ275: =H275+100*O275 -> 157. | AK275: 159.9 | AL275: 238 | AM275: 69.1 | AN275: 258 | AO275: -2.8999999999999998e-002 | AP275: 45 | AQ275: 华锋转债!!
A276: 275 | B276: 110062 | C276: 烽火转债! | D276: 600498 | E276: 烽火通信 | F276: 通信互联 | G276: 通信设备 | H276: 113.22 | I276: 6.3e-003 | J276: -2.8000000000000004e-003 | K276: 17.12 | L276: 1.72e-002 | M276: 110.3 | N276: 22.85 | O276: 0.51100000000000001 | P276: 74.92 | Q276: 已到 | R276: 3.78年 | S276: 1.78年 | T276: 30.9 | U276: 12 | V276: 3.0000000000000001e-003 | W276: 0.152 | X276: 0.114 | Y276: 203 | Z276: 1.77 | AA276: -6.9999999999999993e-003 | AB276: -1.2e-002 | AC276: -4.8600000000000004e-002 | AD276: -5.1200000000000002e-002 | AE276: 96.94 | AF276: 98.56 | AG276: 0.21 | AH276: AAA | AI276: 3.0800000000000001e-002 | AJ276: =H276+100*O276 -> 164.31999999999999 | AK276: 151.5 | AL276: 158 | AM276: 53 | AN276: 130 | AO276: -1.1000000000000001e-002 | AP276: 18 | AQ276: 烽火转债!
A277: 276 | B277: 128081 | C277: 海亮转债! | D277: 2203 | E277: 海亮股份 | F277: 有色金属 | G277: 铜金属 | H277: 130.822 | I277: 1.1899999999999999e-002 | J277: 1.9e-003 | K277: 12.07 | L277: 1.8600000000000002e-002 | M277: 114.3 | N277: 9.69 | O277: 5.0000000000000003e-002 | P277: 124.56 | Q277: 已到 | R277: 3.75年 | S277: 1.75年 | T277: 30.1 | U277: 70 | V277: 1.8000000000000002e-002 | W277: 0.127 | X277: 0.158 | Y277: 237 | Z277: 2.38 | AA277: -3.5900000000000001e-002 | AB277: -4.24e-002 | AC277: -0.11900000000000001 | AD277: -0.10000000000000001 | AE277: 95.78 | AF277: 99.7 | AG277: 0.74 | AH277: AA | AI277: 3.78e-002 | AJ277: =H277+100*O277 -> 135.822 | AK277: 137.1 | AL277: 24 | AM277: 37.4 | AN277: 27 | AO277: 1.7000000000000001e-002 | AP277: 43 | AQ277: 海亮转债!
A278: 277 | B278: 113550 | C278: 常汽转债! | D278: 603035 | E278: 常熟汽饰 | F278: 汽车 | G278: 零部件制 | H278: 239.15 | I278: -1.2800000000000001e-002 | J278: -5.6000000000000008e-003 | K278: 20.08 | L278: -1.9099999999999999e-002 | M278: 120.5 | N278: 9.33 | O278: 0.111 | P278: 215.22 | Q278: 已到 | R278: 3.75年 | S278: 1.75年 | T278: 2.14 | U278: 140 | V278: 0.27300000000000002 | W278: 2.9999999999999999e-002 | X278: 6.4000000000000001e-002 | Y278: 72 | Z278: 1.85 | AA278: -0.17000000000000001 | AB278: -0.17699999999999999 | AC278: -0.26899999999999996 | AD278: -0.27000000000000002 | AE278: 92.8 | AF278: 97.76 | AG278: 0.96 | AH278: AA- | AI278: 5.8799999999999998e-002 | AJ278: =H278+100*O278 -> 250.25 | AK278: 263.1 | AL278: 371 | AM278: 165.3 | AN278: 369 | AO278: 1.8000000000000002e-002 | AP278: 14 | AQ278: 常汽转债!
A279: 278 | B279: 113549 | C279: 白电转债 | D279: 603861 | E279: 白云电器 | F279: 能源电力 | G279: 电力设备 | H279: 125.36 | I279: 7.4999999999999997e-003 | J279: -9.300000000000001e-003 | K279: 9.82 | L279: -3.0000000000000001e-003 | M279: 114.3 | N279: 9.06 | O279: 0.157 | P279: 108.39 | Q279: 已到 | R279: 3.74年 | S279: 1.74年 | T279: 8.05 | U279: 40 | V279: 4.0000000000000001e-002 | W279: 0.188 | X279: 0.20399999999999999 | Y279: 43 | Z279: 1.65 | AA279: -2.4799999999999999e-002 | AB279: -3.15e-002 | AC279: -9.9600000000000008e-002 | AD279: -0.10199999999999999 | AE279: 95.84 | AF279: 99.76 | AG279: 0.61 | AH279: AA | AI279: 3.78e-002 | AJ279: =H279+100*O279 -> 141.06 | AK279: 142.3 | AL279: 59 | AM279: 42.6 | AN279: 48 | AO279: -0.10099999999999999 | AP279: 35 | AQ279: 白电转债
A280: 279 | B280: 123035 | C280: 利德转债!! | D280: 300296 | E280: 利亚德 | F280: 电子 | G280: LED制 | H280: 144.498 | I280: 2.3099999999999999e-002 | J280: -1.61e-002 | K280: 9.03 | L280: 8.8999999999999999e-003 | M280: 114.3 | N280: 6.96 | O280: 0.114 | P280: 129.74 | Q280: 已到 | R280: 3.73年 | S280: 1.73年 | T280: 7.99 | U280: 31 | V280: 2.7000000000000003e-002 | W280: 3.5000000000000003e-002 | X280: 4.4999999999999998e-002 | Y280: 230 | Z280: 2.99 | AA280: -6.1900000000000004e-002 | AB280: -6.8099999999999994e-002 | AC280: -0.13600000000000001 | AD280: -0.13800000000000001 | AE280: 96.73 | AF280: 101.55 | AG280: 0.77 | AH280: AA+ | AI280: 3.2799999999999996e-002 | AJ280: =H280+100*O280 -> 155.898 | AK280: 159.3 | AL280: 230 | AM280: 57.7 | AN280: 169 | AO280: -5.7000000000000002e-002 | AP280: 12 | AQ280: 利德转债!!
A281: 280 | B281: 110061 | C281: 川投转债! | D281: 600674 | E281: 川投能源 | F281: 能源电力 | G281: 水电 | H281: 146.57 | I281: 5.6000000000000008e-003 | J281: -4.8999999999999998e-003 | K281: 12.08 | L281: 8.0000000000000004e-004 | M281: 110.3 | N281: 9.2 | O281: 0.11599999999999999 | P281: 131.3 | Q281: 已到 | R281: 3.73年 | S281: 1.73年 | T281: 39.6 | U281: 19 | V281: 3.0000000000000001e-003 | W281: 7.400000000000001e-002 | X281: 9.8000000000000004e-002 | Y281: 532 | Z281: 1.74 | AA281: -7.4700000000000003e-002 | AB281: -7.9199999999999993e-002 | AC281: -0.14099999999999999 | AD281: -0.14300000000000002 | AE281: 97.1 | AF281: 98.73 | AG281: 0.82 | AH281: AAA | AI281: 3.0800000000000001e-002 | AJ281: =H281+100*O281 -> 158.16999999999999 | AK281: 161.8 | AL281: 253 | AM281: 63.1 | AN281: 209 | AO281: 3.4000000000000002e-002 | AP281: 11 | AQ281: 川投转债!
A282: 281 | B282: 123034 | C282: 通光转债! | D282: 300265 | E282: 通光线缆 | F282: 通信互联 | G282: 通信设备 | H282: 193.373 | I282: -1.e-003 | J282: 2.5999999999999999e-003 | K282: 9.94 | L282: 2.e-003 | M282: 117.3 | N282: 7.95 | O282: 0.54700000000000004 | P282: 125.03 | Q282: 已到 | R282: 3.71年 | S282: 1.71年 | T282: 0.78 | U282: 21 | V282: 0.14300000000000002 | W282: 2.1000000000000001e-002 | X282: 2.7000000000000003e-002 | Y282: 36 | Z282: 2.79 | AA282: -0.128 | AB282: -0.13500000000000001 | AC282: -0.22699999999999998 | AD282: -0.22800000000000001 | AE282: 90.68 | AF282: 91.78 | AG282: 0.77 | AH282: A+ | AI282: 6.9800000000000001e-002 | AJ282: =H282+100*O282 -> 248.07299999999998 | AK282: 261.7 | AL282: 369 | AM282: 169.9 | AN282: 371 | AO282: -2.7000000000000003e-002 | AP282: 16 | AQ282: 通光转债!
A283: 282 | B283: 113548 | C283: 石英转债! | D283: 603688 | E283: 石英股份 | F283: 电子 | G283: 电子产品 | H283: 397.54 | I283: 1.e-003 | J283: -1.03e-002 | K283: 55.07 | L283: -9.4999999999999998e-003 | M283: 123.7 | N283: 14.93 | O283: 7.8e-002 | P283: 368.85 | Q283: 已到 | R283: 3.69年 | S283: 1.69年 | T283: 1.2 | U283: 152 | V283: 0.318 | W283: 6.0000000000000001e-003 | X283: 2.3e-002 | Y283: 194 | Z283: 9.47 | AA283: -0.27500000000000002 | AB283: -0.28199999999999997 | AC283: -0.36399999999999999 | AD283: -0.36499999999999999 | AE283: 93.29 | AF283: 100.69 | AG283: 0.98 | AH283: AA- | AI283: 5.8799999999999998e-002 | AJ283: =H283+100*O283 -> 405.34000000000003 | AK283: 426.2 | AL283: 382 | AM283: 325.5 | AN283: 382 | AO283: 1.7000000000000001e-002 | AP283: 12 | AQ283: 石英转债!
A284: 283 | B284: 110060 | C284: 天路转债! | D284: 600326 | E284: 西藏天路 | F284: 建筑 | G284: 水泥 | H284: 121 | I284: 2.58e-002 | J284: -1.7600000000000001e-002 | K284: 6.74 | L284: 1.8100000000000002e-002 | M284: 114.3 | N284: 7.08 | O284: 0.27100000000000002 | P284: 95.2 | Q284: 已到 | R284: 3.69年 | S284: 1.69年 | T284: 7.06 | U284: 15 | V284: 1.7000000000000001e-002 | W284: 0.114 | X284: 0.109 | Y284: 62 | Z284: 1.45 | AA284: -1.5600000000000001e-002 | AB284: -2.2400000000000003e-002 | AC284: -8.4700000000000011e-002 | AD284: -8.7300000000000003e-002 | AE284: 96.01 | AF284: 99.95 | AG284: 0.45 | AH284: AA | AI284: 3.78e-002 | AJ284: =H284+100*O284 -> 148.09999999999999 | AK284: 146.8 | AL284: 101 | AM284: 46.9 | AN284: 82 | AO284: 4.0999999999999995e-002 | AP284: 12 | AQ284: 天路转债!
A285: 284 | B285: 110059 | C285: 浦发转债! | D285: 600000 | E285: 浦发银行 | F285: 金融 | G285: 银行行业 | H285: 106.53 | I285: 2.2000000000000001e-003 | J285: -1.2999999999999999e-003 | K285: 8.67 | L285: 1.29e-002 | M285: 116.8 | N285: 13.97 | O285: 0.71700000000000008 | P285: 62.06 | Q285: 已到 | R285: 3.69年 | S285: 无权 | T285: 500 | U285: 172 | V285: 3.0000000000000001e-003 | W285: 0.19600000000000001 | X285: 0.122 | Y285: 2545. | Z285: 0.46 | AA285: 2.6000000000000002e-002 | AB285: 1.7600000000000001e-002 | AC285: 无权 | AD285: 无权 | AE285: 无权 | AF285: 104.77 | AG285: 0.07 | AH285: AAA | AI285: 3.0800000000000001e-002 | AJ285: =H285+100*O285 -> 178.23000000000002 | AK285: 151 | AL285: 149 | AM285: 46.2 | AN285: 74 | AO285: 6.9999999999999993e-003 | AP285: 55 | AQ285: 浦发转债!
A286: 285 | B286: 127014 | C286: 北方转债! | D286: 65 | E286: 北方国际 | F286: 建筑 | G286: 建筑工程 | H286: 122.759 | I286: 2.4700000000000003e-002 | J286: -1.26e-002 | K286: 8.93 | L286: 2.29e-002 | M286: 114.3 | N286: 8.65 | O286: 0.18899999999999997 | P286: 103.24 | Q286: 已到 | R286: 3.68年 | S286: 1.68年 | T286: 5.35 | U286: 39 | V286: 6.0999999999999999e-002 | W286: 7.6999999999999999e-002 | X286: 8.0000000000000002e-002 | Y286: 69 | Z286: 1.16 | AA286: -1.9599999999999999e-002 | AB286: -2.64e-002 | AC286: -9.2399999999999996e-002 | AD286: -9.5000000000000001e-002 | AE286: 96.91 | AF286: 101.74 | AG286: 0.53 | AH286: AA+ | AI286: 3.2799999999999996e-002 | AJ286: =H286+100*O286 -> 141.65899999999999 | AK286: 142.3 | AL286: 58 | AM286: 40.5 | AN286: 38 | AO286: 7.8e-002 | AP286: 17 | AQ286: 北方转债!
A287: 286 | B287: 113546 | C287: 迪贝转债! | D287: 603320 | E287: 迪贝电气 | F287: 家电 | G287: 零部件制 | H287: 122.58 | I287: 5.7999999999999996e-003 | J287: -5.0000000000000001e-003 | K287: 13.94 | L287: 1.4000000000000002e-003 | M287: 119.8 | N287: 14 | O287: 0.23100000000000001 | P287: 99.57 | Q287: 已到 | R287: 3.67年 | S287: 1.67年 | T287: 2.3 | U287: 5.9 | V287: 2.1000000000000001e-002 | W287: 0.127 | X287: 0.126 | Y287: 18 | Z287: 2.49 | AA287: -6.3e-003 | AB287: -1.55e-002 | AC287: -9.0299999999999991e-002 | AD287: -9.3200000000000005e-002 | AE287: 91.19 | AF287: 94 | AG287: 0.56 | AH287: A+ | AI287: 6.9800000000000001e-002 | AJ287: =H287+100*O287 -> 145.68000000000001 | AK287: 145.6 | AL287: 87 | AM287: 51.6 | AN287: 116 | AO287: 6.9000000000000006e-002 | AP287: 37 | AQ287: 迪贝转债!
A288: 287 | B288: 128079 | C288: 英联转债! | D288: 2846 | E288: 英联股份 | F288: 造纸包装 | G288: 包装材料 | H288: 121.7 | I288: 2.5999999999999999e-003 | J288: -1.9e-003 | K288: 7.23 | L288: 1.4000000000000002e-003 | M288: 116.9 | N288: 8.29 | O288: 0.39500000000000002 | P288: 87.21 | Q288: 已到 | R288: 3.67年 | S288: 1.67年 | T288: 1.52 | U288: 4.4 | V288: 2.4e-002 | W288: 6.6000000000000003e-002 | X288: 5.7999999999999996e-002 | Y288: 23 | Z288: 2.85 | AA288: -1.11e-002 | AB288: -1.9099999999999999e-002 | AC288: -8.72e-002 | AD288: -8.9999999999999997e-002 | AE288: 91.15 | AF288: 91.75 | AG288: 0.5 | AH288: A+ | AI288: 6.9800000000000001e-002 | AJ288: =H288+100*O288 -> 161.19999999999999 | AK288: 156.2 | AL288: 202 | AM288: 64.4 | AN288: 221 | AO288: -2.2000000000000002e-002 | AP288: 16 | AQ288: 英联转债!
A289: 288 | B289: 128078 | C289: 太极转债! | D289: 2368 | E289: 太极股份 | F289: 计算机及 | G289: 软件开发 | H289: 137.2 | I289: 2.8999999999999998e-003 | J289: 1.3600000000000001e-002 | K289: 24.95 | L289: 2.63e-002 | M289: 116.3 | N289: 22.21 | O289: 0.221 | P289: 112.34 | Q289: 已到 | R289: 3.67年 | S289: 1.67年 | T289: 9.6 | U289: 29 | V289: 2.2000000000000002e-002 | W289: 6.6000000000000003e-002 | X289: 7.4999999999999997e-002 | Y289: 145 | Z289: 4.38 | AA289: -4.4800000000000006e-002 | AB289: -5.21e-002 | AC289: -0.12300000000000001 | AD289: -0.125 | AE289: 96.08 | AF289: 101.76 | AG289: 0.63 | AH289: AA | AI289: 3.78e-002 | AJ289: =H289+100*O289 -> 159.29999999999998 | AK289: 162.1 | AL289: 255 | AM289: 60.3 | AN289: 191 | AO289: -4.4999999999999998e-002 | AP289: 9 | AQ289: 太极转债!
A290: 289 | B290: 128076 | C290: 金轮转债! | D290: 2722 | E290: 金轮股份 | F290: 机械装备 | G290: 专用设备 | H290: 125.9 | I290: 1.8600000000000002e-002 | J290: -1.3600000000000001e-002 | K290: 15.5 | L290: 7.8000000000000005e-003 | M290: 114.3 | N290: 14.66 | O290: 0.191 | P290: 105.73 | Q290: 已到 | R290: 3.65年 | S290: 1.65年 | T290: 2.14 | U290: 8.1 | V290: 2.9999999999999999e-002 | W290: 7.9000000000000001e-002 | X290: 8.3000000000000004e-002 | Y290: 27 | Z290: 1.39 | AA290: -2.6600000000000002e-002 | AB290: -3.3399999999999999e-002 | AC290: -0.106 | AD290: -0.109 | AE290: 92.74 | AF290: 93.17 | AG290: 0.64 | AH290: AA- | AI290: 5.8799999999999998e-002 | AJ290: =H290+100*O290 -> 145. | AK290: 146.1 | AL290: 95 | AM290: 52.9 | AN290: 128 | AO290: -8.0000000000000002e-003 | AP290: 37 | AQ290: 金轮转债!
A291: 290 | B291: 113545 | C291: 金能转债! | D291: 603113 | E291: 金能科技 | F291: 煤炭 | G291: 炼焦 | H291: 161.96 | I291: 1.8000000000000002e-002 | J291: -6.4000000000000003e-003 | K291: 15.01 | L291: 1.3500000000000002e-002 | M291: 114.3 | N291: 10.43 | O291: 0.125 | P291: 143.91 | Q291: 已到 | R291: 3.65年 | S291: 1.65年 | T291: 9.87 | U291: 40 | V291: 2.5000000000000001e-002 | W291: 7.6999999999999999e-002 | X291: 0.111 | Y291: 128 | Z291: 1.47 | AA291: -9.2600000000000002e-002 | AB291: -9.8699999999999996e-002 | AC291: -0.183 | AD291: -0.185 | AE291: 96.15 | AF291: 100.09 | AG291: 0.86 | AH291: AA | AI291: 3.78e-002 | AJ291: =H291+100*O291 -> 174.46000000000001 | AK291: 180 | AL291: 327 | AM291: 79.9 | AN291: 311 | AO291: 2.e-002 | AP291: 12 | AQ291: 金能转债!
A292: 291 | B292: 128074 | C292: 游族转债!! | D292: 2174 | E292: 游族网络 | F292: 通信互联 | G292: 互联网 | H292: 116 | I292: 3.2000000000000002e-003 | J292: -1.7000000000000001e-003 | K292: 12.48 | L292: 8.1000000000000013e-003 | M292: 119.3 | N292: 16.97 | O292: 0.57700000000000007 | P292: 73.54 | Q292: 已到 | R292: 3.59年 | S292: 1.59年 | T292: 6.83 | U292: 4.5 | V292: 6.0000000000000001e-003 | W292: 5.9999999999999998e-002 | X292: 4.4000000000000004e-002 | Y292: 114 | Z292: 2.18 | AA292: 8.0000000000000002e-003 | AB292: -1.4000000000000002e-003 | AC292: -6.6900000000000001e-002 | AD292: -6.9699999999999998e-002 | AE292: 96.36 | AF292: 99.38 | AG292: 0.18 | AH292: AA | AI292: 3.78e-002 | AJ292: =H292+100*O292 -> 173.70000000000002 | AK292: 158.5 | AL292: 225 | AM292: 59.1 | AN292: 181 | AO292: -2.9999999999999999e-002 | AP292: 30 | AQ292: 游族转债!!
A293: 292 | B293: 128075 | C293: 远东转债! | D293: 2406 | E293: 远东传动 | F293: 汽车 | G293: 零部件制 | H293: 125.577 | I293: 1.2e-002 | J293: -5.5000000000000005e-003 | K293: 5.87 | L293: 1.03e-002 | M293: 114.3 | N293: 5.29 | O293: 0.13200000000000001 | P293: 110.96 | Q293: 已到 | R293: 3.59年 | S293: 1.59年 | T293: 5.44 | U293: 5.1 | V293: 6.9999999999999993e-003 | W293: 0.14800000000000002 | X293: 0.16500000000000001 | Y293: 37 | Z293: 1.12 | AA293: -2.63e-002 | AB293: -3.32e-002 | AC293: -0.10800000000000001 | AD293: -0.111 | AE293: 96.36 | AF293: 100.3 | AG293: 0.62 | AH293: AA | AI293: 3.78e-002 | AJ293: =H293+100*O293 -> 138.77699999999999 | AK293: 140.2 | AL293: 42 | AM293: 39.9 | AN293: 34 | AO293: 5.0000000000000001e-003 | AP293: 17 | AQ293: 远东转债!
A294: 293 | B294: 123031 | C294: 晶瑞转债! | D294: 300655 | E294: 晶瑞电材 | F294: 电子 | G294: 电子行业 | H294: 366.68 | I294: -1.2699999999999999e-002 | J294: -4.5999999999999999e-003 | K294: 34.72 | L294: -1.7500000000000002e-002 | M294: 115.3 | N294: 10.66 | O294: 0.126 | P294: 325.7 | Q294: 已到 | R294: 3.52年 | S294: 1.52年 | T294: 0.53 | U294: 47 | V294: 0.24100000000000002 | W294: 4.0000000000000001e-003 | X294: 1.3999999999999999e-002 | Y294: 120 | Z294: 8.15 | AA294: -0.28300000000000003 | AB294: -0.28800000000000003 | AC294: -0.39600000000000002 | AD294: -0.39700000000000002 | AE294: 91.81 | AF294: 91.35 | AG294: 0.99 | AH294: A+ | AI294: 6.9800000000000001e-002 | AJ294: =H294+100*O294 -> 379.28000000000003 | AK294: 407.7 | AL294: 380 | AM294: 315.8 | AN294: 380 | AO294: -1.7000000000000001e-002 | AP294: 15 | AQ294: 晶瑞转债!
A295: 294 | B295: 128073 | C295: 哈尔转债! | D295: 2615 | E295: 哈尔斯 | F295: 其他 | G295: 家居用品 | H295: 123.66 | I295: 1.2800000000000001e-002 | J295: -1.1000000000000001e-002 | K295: 5.75 | L295: 3.4999999999999996e-003 | M295: 114.5 | N295: 5.7 | O295: 0.22600000000000001 | P295: 100.88 | Q295: 已到 | R295: 2.50年 | S295: 0.50年 | T295: 2.99 | U295: 22 | V295: 5.9000000000000004e-002 | W295: 0.125 | X295: 0.127 | Y295: 24 | Z295: 2.76 | AA295: -3.0600000000000002e-002 | AB295: -4.0500000000000001e-002 | AC295: -0.28100000000000003 | AD295: -0.28399999999999997 | AE295: 97.56 | AF295: 99.83 | AG295: 0.5 | AH295: AA- | AI295: 5.7000000000000002e-002 | AJ295: =H295+100*O295 -> 146.25999999999999 | AK295: 146.4 | AL295: 99 | AM295: 46.6 | AN295: 80 | AO295: 3.2000000000000001e-002 | AP295: 36 | AQ295: 哈尔转债!
A296: 295 | B296: 128072 | C296: 翔鹭转债! | D296: 2842 | E296: 翔鹭钨业 | F296: 有色金属 | G296: 小金属 | H296: 111.8 | I296: 9.1999999999999998e-003 | J296: -8.199999999999999e-003 | K296: 9.54 | L296: 6.3e-003 | M296: 114.5 | N296: 15.19 | O296: 0.78000000000000003 | P296: 62.8 | Q296: 已到 | R296: 3.50年 | S296: 1.50年 | T296: 3.02 | U296: 1.8 | V296: 5.0000000000000001e-003 | W296: 0.114 | X296: 7.2000000000000008e-002 | Y296: 26 | Z296: 2.72 | AA296: 6.9999999999999993e-003 | AB296: -5.0000000000000001e-004 | AC296: -4.9299999999999997e-002 | AD296: -5.2400000000000002e-002 | AE296: 93.57 | AF296: 94.15 | AG296: 0.16 | AH296: AA- | AI296: 5.8799999999999998e-002 | AJ296: =H296+100*O296 -> 189.80000000000001 | AK296: 160.8 | AL296: 244 | AM296: 66.6 | AN296: 241 | AO296: 2.3e-002 | AP296: 30 | AQ296: 翔鹭转债!
A297: 296 | B297: 128071 | C297: 合兴转债! | D297: 2228 | E297: 合兴包装 | F297: 造纸包装 | G297: 包装材料 | H297: 115.84 | I297: 2.0999999999999999e-003 | J297: 1.8e-003 | K297: 3.64 | L297: 1.11e-002 | M297: 114.3 | N297: 4.18 | O297: 0.33000000000000002 | P297: 87.08 | Q297: 已到 | R297: 3.49年 | S297: 1.49年 | T297: 3 | U297: 2 | V297: 6.0000000000000001e-003 | W297: 6.7000000000000004e-002 | X297: 5.7999999999999996e-002 | Y297: 45 | Z297: 1.34 | AA297: -3.9000000000000003e-003 | AB297: -1.1200000000000002e-002 | AC297: -7.0199999999999999e-002 | AD297: -7.3200000000000001e-002 | AE297: 96.73 | AF297: 100.69 | AG297: 0.35 | AH297: AA | AI297: 3.78e-002 | AJ297: =H297+100*O297 -> 148.84 | AK297: 144.6 | AL297: 77 | AM297: 43.9 | AN297: 53 | AO297: 9.0000000000000011e-003 | AP297: 26 | AQ297: 合兴转债!
A298: 297 | B298: 113542 | C298: 好客转债! | D298: 603898 | E298: 好莱客 | F298: 其他 | G298: 家居用品 | H298: 112.26 | I298: 1.1200000000000002e-002 | J298: -9.5999999999999992e-003 | K298: 11.01 | L298: 1.1899999999999999e-002 | M298: 114.3 | N298: 16.14 | O298: 0.64599999999999991 | P298: 68.22 | Q298: 已到 | R298: 3.45年 | S298: 1.45年 | T298: 6.03 | U298: 2.2 | V298: 3.0000000000000001e-003 | W298: 0.17600000000000002 | X298: 0.12 | Y298: 34 | Z298: 1.26 | AA298: 5.3e-003 | AB298: -2.2000000000000001e-003 | AC298: -5.3499999999999999e-002 | AD298: -5.67e-002 | AE298: 96.88 | AF298: 100.84 | AG298: 0.13 | AH298: AA | AI298: 3.78e-002 | AJ298: =H298+100*O298 -> 176.86000000000001 | AK298: 156.3 | AL298: 204 | AM298: 55.5 | AN298: 149 | AO298: -4.2000000000000003e-002 | AP298: 17 | AQ298: 好客转债!
A299: 298 | B299: 113541 | C299: 荣晟转债!! | D299: 603165 | E299: 荣晟环保 | F299: 造纸包装 | G299: 包装用纸 | H299: 147.92 | I299: -2.2000000000000001e-003 | J299: -1.1000000000000001e-003 | K299: 15.54 | L299: -3.8e-003 | M299: 114.3 | N299: 10.84 | O299: 3.2000000000000001e-002 | P299: 143.36 | Q299: 已到 | R299: 3.42年 | S299: 1.42年 | T299: 1.63 | U299: 24 | V299: 0.10099999999999999 | W299: 4.0000000000000001e-002 | X299: 5.7000000000000002e-002 | Y299: 41 | Z299: 2.36 | AA299: -7.3899999999999993e-002 | AB299: -8.0600000000000005e-002 | AC299: -0.17999999999999999 | AD299: -0.182 | AE299: 93.95 | AF299: 94.39 | AG299: 0.86 | AH299: AA- | AI299: 5.8799999999999998e-002 | AJ299: =H299+100*O299 -> 151.11999999999998 | AK299: 152.5 | AL299: 167 | AM299: 58.1 | AN299: 172 | AO299: -5.4000000000000006e-002 | AP299: 39 | AQ299: 荣晟转债!!
A300: 299 | B300: 128070 | C300: 智能转债! | D300: 2877 | E300: 智能自控 | F300: 机械装备 | G300: 通用设备 | H300: 114.49 | I300: 3.2000000000000002e-003 | J300: 1.e-004 | K300: 6.81 | L300: 1.1899999999999999e-002 | M300: 116.8 | N300: 9.47 | O300: 0.59200000000000008 | P300: 71.91 | Q300: 已到 | R300: 3.36年 | S300: 无权 | T300: 2.3 | U300: 4.6 | V300: 1.8000000000000002e-002 | W300: 0.10099999999999999 | X300: 7.2999999999999995e-002 | Y300: 23 | Z300: 2.99 | AA300: 6.0999999999999995e-003 | AB300: -2.8000000000000004e-003 | AC300: 无权 | AD300: 无权 | AE300: 无权 | AF300: 93.59 | AG300: 0.28 | AH300: A+ | AI300: 6.9800000000000001e-002 | AJ300: =H300+100*O300 -> 173.69 | AK300: 157.1 | AL300: 212 | AM300: 63.5 | AN300: 213 | AO300: 5.0000000000000001e-003 | AP300: 29 | AQ300: 智能转债!
A301: 300 | B301: 128069 | C301: 华森转债! | D301: 2907 | E301: 华森制药 | F301: 医药 | G301: 化学制药 | H301: 114.989 | I301: 2.7000000000000001e-003 | J301: 4.0000000000000002e-004 | K301: 13.54 | L301: 1.3500000000000002e-002 | M301: 119.3 | N301: 18.01 | O301: 0.53000000000000003 | P301: 75.18 | Q301: 已到 | R301: 3.34年 | S301: 1.34年 | T301: 3 | U301: 7.9 | V301: 2.3e-002 | W301: 5.5e-002 | X301: 4.0999999999999995e-002 | Y301: 54 | Z301: 4.59 | AA301: 1.1299999999999999e-002 | AB301: 1.1999999999999999e-003 | AC301: -7.22e-002 | AD301: -7.5399999999999995e-002 | AE301: 94.38 | AF301: 98.95 | AG301: 0.23 | AH301: AA- | AI301: 5.8799999999999998e-002 | AJ301: =H301+100*O301 -> 167.989 | AK301: 154.8 | AL301: 187 | AM301: 55.8 | AN301: 152 | AO301: -0.105 | AP301: 43 | AQ301: 华森转债!
A302: 301 | B302: 113027 | C302: 华钰转债!! | D302: 601020 | E302: ST华钰 | F302: 有色金属 | G302: 锌铅镍锡 | H302: 139.31 | I302: -2.8999999999999998e-003 | J302: 4.6999999999999993e-003 | K302: 13.14 | L302: 2.3e-003 | M302: 114.3 | N302: 10.17 | O302: 7.8e-002 | P302: 129.2 | Q302: 已到 | R302: 3.32年 | S302: 1.32年 | T302: 3.1 | U302: 147 | V302: 0.34100000000000003 | W302: 4.2000000000000003e-002 | X302: 5.5e-002 | Y302: 73 | Z302: 2.81 | AA302: -5.9000000000000004e-002 | AB302: -6.6100000000000006e-002 | AC302: -0.16800000000000001 | AD302: -0.17000000000000001 | AE302: 91.84 | AF302: 89.12 | AG302: 0.82 | AH302: A | AI302: 7.980000000000001e-002 | AJ302: =H302+100*O302 -> 147.11000000000001 | AK302: 149.4 | AL302: 129 | AM302: 57.6 | AN302: 166 | AO302: 7.4999999999999997e-002 | AP302: 41 | AQ302: 华钰转债!!
A303: 302 | B303: 123027 | C303: 蓝晓转债! | D303: 300487 | E303: 蓝晓科技 | F303: 化工 | G303: 化工 | H303: 362.8 | I303: -2.2099999999999998e-002 | J303: 8.1000000000000013e-003 | K303: 95.34 | L303: -1.43e-002 | M303: 118.8 | N303: 29.02 | O303: 0.10400000000000001 | P303: 328.53 | Q303: 已到 | R303: 3.31年 | S303: 1.31年 | T303: 1.07 | U303: 220 | V303: 0.56499999999999995 | W303: 5.0000000000000001e-003 | X303: 1.7000000000000001e-002 | Y303: 210 | Z303: 10.59 | AA303: -0.29100000000000004 | AB303: -0.29699999999999999 | AC303: -0.46200000000000002 | AD303: -0.46399999999999997 | AE303: 94.02 | AF303: 95.64 | AG303: 0.98 | AH303: A+ | AI303: 6.9800000000000001e-002 | AJ303: =H303+100*O303 -> 373.19999999999999 | AK303: 397.1 | AL303: 379 | AM303: 301.4 | AN303: 379 | AO303: -2.1000000000000001e-002 | AP303: 16 | AQ303: 蓝晓转债!
A304: 303 | B304: 113537 | C304: 文灿转债!! | D304: 603348 | E304: 文灿股份 | F304: 汽车 | G304: 零部件制 | H304: 264.07 | I304: -1.3600000000000001e-002 | J304: -2.1400000000000002e-002 | K304: 45.9 | L304: -3.5900000000000001e-002 | M304: 120.7 | N304: 19.28 | O304: 0.109 | P304: 238.07 | Q304: 已到 | R304: 3.30年 | S304: 1.30年 | T304: 1.41 | U304: 217 | V304: 0.58499999999999996 | W304: 1.2e-002 | X304: 2.7999999999999997e-002 | Y304: 120 | Z304: 4.59 | AA304: -0.215 | AB304: -0.222 | AC304: -0.39399999999999996 | AD304: -0.39600000000000002 | AE304: 95.36 | AF304: 100.44 | AG304: 0.97 | AH304: AA- | AI304: 5.8799999999999998e-002 | AJ304: =H304+100*O304 -> 274.96999999999997 | AK304: 290.1 | AL304: 372 | AM304: 189.6 | AN304: 372 | AO304: -0.111 | AP304: 22 | AQ304: 文灿转债!!
A305: 304 | B305: 113535 | C305: 大业转债! | D305: 603278 | E305: 大业股份 | F305: 汽车 | G305: 零部件制 | H305: 114.75 | I305: 1.26e-002 | J305: -1.1299999999999999e-002 | K305: 10.03 | L305: 6.9999999999999993e-003 | M305: 112.5 | N305: 12.29 | O305: 0.40600000000000003 | P305: 81.61 | Q305: 已到 | R305: 2.22年 | S305: 0.22年 | T305: 5 | U305: 9.5 | V305: 1.7000000000000001e-002 | W305: 0.17199999999999999 | X305: 0.14000000000000001 | Y305: 29 | Z305: 1.63 | AA305: -9.0000000000000011e-003 | AB305: -1.9099999999999999e-002 | AC305: -0.33000000000000002 | AD305: -0.33500000000000002 | AE305: 99.89 | AF305: 104.13 | AG305: 0.19 | AH305: AA | AI305: 3.6000000000000004e-002 | AJ305: =H305+100*O305 -> 155.34999999999999 | AK305: 147.9 | AL305: 116 | AM305: 43.8 | AN305: 52 | AO305: -8.3000000000000004e-002 | AP305: 45 | AQ305: 大业转债!
A306: 305 | B306: 128066 | C306: 亚泰转债! | D306: 2811 | E306: 郑中设计 | F306: 建筑 | G306: 装饰工程 | H306: 118.943 | I306: 1.3600000000000001e-002 | J306: -7.0999999999999995e-003 | K306: 9.39 | L306: 1.1899999999999999e-002 | M306: 116.7 | N306: 9.27 | O306: 0.17399999999999999 | P306: 101.29 | Q306: 已到 | R306: 3年57天 | S306: 1年57天 | T306: 4.8 | U306: 8.5 | V306: 1.4999999999999999e-002 | W306: 0.18899999999999997 | X306: 0.192 | Y306: 25 | Z306: 1.82 | AA306: -6.1999999999999998e-003 | AB306: -1.54e-002 | AC306: -0.10400000000000001 | AD306: -0.10099999999999999 | AE306: 95.62 | AF306: 97.88 | AG306: 0.55 | AH306: AA- | AI306: 5.8799999999999998e-002 | AJ306: =H306+100*O306 -> 136.34299999999999 | AK306: 136.6 | AL306: 22 | AM306: 38.7 | AN306: 31 | AO306: 6.4000000000000001e-002 | AP306: 68 | AQ306: 亚泰转债!
A307: 306 | B307: 110058 | C307: 永鼎转债! | D307: 600105 | E307: 永鼎股份 | F307: 通信互联 | G307: 通信设备 | H307: 116.21 | I307: 7.7000000000000002e-003 | J307: -5.0000000000000001e-004 | K307: 4.28 | L307: 1.9e-002 | M307: 114.3 | N307: 5.04 | O307: 0.36799999999999999 | P307: 84.92 | Q307: 已到 | R307: 3年56天 | S307: 1年56天 | T307: 2.61 | U307: 13 | V307: 4.2999999999999997e-002 | W307: 4.2999999999999997e-002 | X307: 3.7000000000000005e-002 | Y307: 60 | Z307: 2.11 | AA307: -5.4000000000000003e-003 | AB307: -1.34e-002 | AC307: -8.9499999999999996e-002 | AD307: -9.3200000000000005e-002 | AE307: 95.41 | AF307: 95.85 | AG307: 0.38 | AH307: AA- | AI307: 5.8799999999999998e-002 | AJ307: =H307+100*O307 -> 153.00999999999999 | AK307: 147.5 | AL307: 110 | AM307: 51.6 | AN307: 118 | AO307: -5.0000000000000003e-002 | AP307: 44 | AQ307: 永鼎转债!
A308: 307 | B308: 127013 | C308: 创维转债! | D308: 810 | E308: 创维数字 | F308: 电子 | G308: 电子产品 | H308: 127.173 | I308: 1.4000000000000002e-003 | J308: -7.1999999999999998e-003 | K308: 11.25 | L308: -1.32e-002 | M308: 117.3 | N308: 11.29 | O308: 0.27600000000000002 | P308: 99.65 | Q308: 已到 | R308: 3年55天 | S308: 1年55天 | T308: 9.78 | U308: 31 | V308: 2.5000000000000001e-002 | W308: 8.199999999999999e-002 | X308: 8.1000000000000003e-002 | Y308: 120 | Z308: 2.82 | AA308: -2.58e-002 | AB308: -3.5099999999999999e-002 | AC308: -0.14099999999999999 | AD308: -0.14400000000000002 | AE308: 97.95 | AF308: 104.63 | AG308: 0.44 | AH308: AA | AI308: 3.78e-002 | AJ308: =H308+100*O308 -> 154.773 | AK308: 154.7 | AL308: 185 | AM308: 50.1 | AN308: 103 | AO308: -0.105 | AP308: 25 | AQ308: 创维转债!
A309: 308 | B309: 113026 | C309: 核能转债!!* | D309: 601985 | E309: 中国核电 | F309: 能源电力 | G309: 核电 | H309: 124.96 | I309: 1.03e-002 | J309: 8.9999999999999998e-004 | K309: 7.17 | L309: 1.1299999999999999e-002 | M309: 109.3 | N309: 5.73 | O309: -1.e-003 | P309: 125.13 | Q309: 已到 | R309: 18天 | S309: 无权 | T309: 39.9 | U309: 315 | V309: 6.3e-002 | W309: 3.1e-002 | X309: 3.9e-002 | Y309: 1289. | Z309: 1.94 | AA309: <-100% | AB309: <-100% | AC309: 无权 | AD309: 无权 | AE309: 无权 | AF309: 100.78 | AG309: 1 | AH309: AAA | AI309: 2.35e-002 | AJ309: =H309+100*O309 -> 124.86 | AK309: 124.8 | AL309: 4 | AM309: 24 | AN309: 3 | AO309: -2.6000000000000002e-002 | AP309: 37 | AQ309: 核能转债!!*
A310: 309 | B310: 113025 | C310: 明泰转债!! | D310: 601677 | E310: 明泰铝业 | F310: 有色金属 | G310: 铝金属 | H310: 445.33 | I310: -3.0000000000000001e-003 | J310: 3.9000000000000003e-003 | K310: 44.7 | L310: 8.9999999999999998e-004 | M310: 114.5 | N310: 11 | O310: 9.6000000000000002e-002 | P310: 406.36 | Q310: 已到 | R310: 3年50天 | S310: 1年50天 | T310: 11 | U310: 114 | V310: 2.3e-002 | W310: 3.6000000000000004e-002 | X310: 0.14599999999999999 | Y310: 305 | Z310: 3.03 | AA310: -0.35600000000000004 | AB310: -0.35999999999999999 | AC310: -0.57299999999999995 | AD310: -0.57399999999999995 | AE310: 98.03 | AF310: 102.19 | AG310: 0.99 | AH310: AA | AI310: 3.78e-002 | AJ310: =H310+100*O310 -> 454.93000000000001 | AK310: 484.3 | AL310: 384 | AM310: 382.1 | AN310: 383 | AO310: 5.5e-002 | AP310: 17 | AQ310: 明泰转债!!
A311: 310 | B311: 113534 | C311: 鼎胜转债!! | D311: 603876 | E311: 鼎胜新材 | F311: 有色金属 | G311: 小金属 | H311: 249.1 | I311: -2.4199999999999999e-002 | J311: -3.4000000000000002e-003 | K311: 35.92 | L311: -2.81e-002 | M311: 114.3 | N311: 15.18 | O311: 5.2999999999999999e-002 | P311: 236.63 | Q311: 已到 | R311: 3年49天 | S311: 1年49天 | T311: 4.04 | U311: 153 | V311: 0.14999999999999999 | W311: 2.3e-002 | X311: 5.5e-002 | Y311: 175 | Z311: 3.73 | AA311: -0.223 | AB311: -0.22899999999999998 | AC311: -0.439 | AD311: -0.44 | AE311: 95.51 | AF311: 95.95 | AG311: 0.98 | AH311: AA- | AI311: 5.8799999999999998e-002 | AJ311: =H311+100*O311 -> 254.40000000000001 | AK311: 261.6 | AL311: 368 | AM311: 165.6 | AN311: 370 | AO311: 0. | AP311: 26 | AQ311: 鼎胜转债!!
A312: 311 | B312: 113024 | C312: 核建转债! | D312: 601611 | E312: 中国核建 | F312: 建筑 | G312: 建筑工程 | H312: 122.5 | I312: 1.4800000000000001e-002 | J312: -7.6e-003 | K312: 9.33 | L312: 1.52e-002 | M312: 109.3 | N312: 9.7 | O312: 0.27399999999999997 | P312: 96.19 | Q312: 已到 | R312: 3年48天 | S312: 1年48天 | T312: 30 | U312: 79 | V312: 2.2000000000000002e-002 | W312: 0.121 | X312: 0.11699999999999999 | Y312: 247 | Z312: 1.99 | AA312: -3.6499999999999998e-002 | AB312: -4.1700000000000001e-002 | AC312: -0.12 | AD312: -0.12300000000000001 | AE312: 98.87 | AF312: 99.62 | AG312: 0.48 | AH312: AAA | AI312: 3.0800000000000001e-002 | AJ312: =H312+100*O312 -> 149.90000000000001 | AK312: 148.8 | AL312: 122 | AM312: 49.2 | AN312: 93 | AO312: 3.3000000000000002e-002 | AP312: 30 | AQ312: 核建转债!
A313: 312 | B313: 128063 | C313: 未来转债! | D313: 2631 | E313: 德尔未来 | F313: 其他 | G313: 家居用品 | H313: 117.26 | I313: 2.2000000000000001e-003 | J313: -2.8000000000000004e-003 | K313: 6.8 | L313: -2.8999999999999998e-003 | M313: 127.5 | N313: 8.64 | O313: 0.48999999999999999 | P313: 78.7 | Q313: 已到 | R313: 3年43天 | S313: 2年43天 | T313: 6.29 | U313: 2.6 | V313: 4.0000000000000001e-003 | W313: 0.14099999999999999 | X313: 0.111 | Y313: 45 | Z313: 2.62 | AA313: 2.8199999999999999e-002 | AB313: 1.32e-002 | AC313: -3.56e-002 | AD313: -4.1900000000000007e-002 | AE313: 95.28 | AF313: 107.35 | AG313: 0.21 | AH313: AA- | AI313: 5.8799999999999998e-002 | AJ313: =H313+100*O313 -> 166.25999999999999 | AK313: 155.8 | AL313: 199 | AM313: 48.5 | AN313: 88 | AO313: 2.e-003 | AP313: 35 | AQ313: 未来转债!
A314: 313 | B314: 113532 | C314: 海环转债! | D314: 603817 | E314: 海峡环保 | F314: 城市公用 | G314: 三废处理 | H314: 116.56 | I314: 1.32e-002 | J314: -7.3000000000000001e-003 | K314: 7.05 | L314: 1.44e-002 | M314: 112.3 | N314: 7.63 | O314: 0.26100000000000001 | P314: 92.4 | Q314: 已到 | R314: 3年42天 | S314: 1年42天 | T314: 4.59 | U314: 119 | V314: 0.223 | W314: 0.14499999999999999 | X314: 0.13400000000000001 | Y314: 32 | Z314: 1.75 | AA314: -1.21e-002 | AB314: -1.9199999999999998e-002 | AC314: -9.4299999999999995e-002 | AD314: -9.8000000000000004e-002 | AE314: 98.08 | AF314: 100.31 | AG314: 0.41 | AH314: AA | AI314: 3.78e-002 | AJ314: =H314+100*O314 -> 142.66 | AK314: 140.7 | AL314: 43 | AM314: 40.4 | AN314: 36 | AO314: 0.11599999999999999 | AP314: 35 | AQ314: 海环转债!
A315: 314 | B315: 128062 | C315: 亚药转债! | D315: 2370 | E315: 亚太药业 | F315: 医药 | G315: 化学制药 | H315: 100.55 | I315: 4.4000000000000003e-003 | J315: -4.3e-003 | K315: 5.58 | L315: 2.9500000000000002e-002 | M315: 119.3 | N315: 16.25 | O315: 1.9299999999999999 | P315: 34.34 | Q315: 已到 | R315: 3年42天 | S315: 1年42天 | T315: 9.62 | U315: 36 | V315: 3.7999999999999999e-002 | W315: 0.32100000000000001 | X315: 0.11 | Y315: 30 | Z315: 8.28 | AA315: 5.7699999999999994e-002 | AB315: 4.6199999999999998e-002 | AC315: 1.7600000000000001e-002 | AD315: 1.32e-002 | AE315: 84.27 | AF315: 74.08 | AG315: 0 | AH315: B | AI315: 0.16980000000000001 | AJ315: =H315+100*O315 -> 293.55000000000001 | AK315: 166.8 | AL315: 289 | AM315: 82.5 | AN315: 318 | AO315: -0.14499999999999999 | AP315: 96 | AQ315: 亚药转债!
A316: 315 | B316: 110057 | C316: 现代转债 | D316: 600420 | E316: 国药现代 | F316: 医药 | G316: 化学制药 | H316: 117.58 | I316: 3.9000000000000003e-003 | J316: -2.0999999999999999e-003 | K316: 9.13 | L316: 4.4000000000000003e-003 | M316: 110.3 | N316: 9.79 | O316: 0.26100000000000001 | P316: 93.26 | Q316: 已到 | R316: 3年41天 | S316: 1年41天 | T316: 16.2 | U316: 8.2 | V316: 4.0000000000000001e-003 | W316: 0.17199999999999999 | X316: 0.161 | Y316: 94 | Z316: 1.12 | AA316: -2.0799999999999999e-002 | AB316: -2.6699999999999998e-002 | AC316: -0.10099999999999999 | AD316: -0.10400000000000001 | AE316: 98.93 | AF316: 100.58 | AG316: 0.41 | AH316: AAA | AI316: 3.0800000000000001e-002 | AJ316: =H316+100*O316 -> 143.68000000000001 | AK316: 141.9 | AL316: 54 | AM316: 41.3 | AN316: 41 | AO316: -1.7000000000000001e-002 | AP316: 23 | AQ316: 现代转债
A317: 316 | B317: 123025 | C317: 精测转债!! | D317: 300567 | E317: 精测电子 | F317: 电子 | G317: 液晶显示 | H317: 138.445 | I317: 1.3999999999999999e-002 | J317: -9.300000000000001e-003 | K317: 53.79 | L317: 7.4999999999999997e-003 | M317: 116.5 | N317: 49.37 | O317: 0.27100000000000002 | P317: 108.95 | Q317: 已到 | R317: 3年38天 | S317: 1年38天 | T317: 3.09 | U317: 11 | V317: 2.5000000000000001e-002 | W317: 2.1000000000000001e-002 | X317: 2.2000000000000002e-002 | Y317: 150 | Z317: 4.63 | AA317: -5.5199999999999999e-002 | AB317: -6.3799999999999996e-002 | AC317: -0.19800000000000001 | AD317: -0.20000000000000001 | AE317: 95.71 | AF317: 97.97 | AG317: 0.62 | AH317: AA- | AI317: 5.8799999999999998e-002 | AJ317: =H317+100*O317 -> 165.54499999999999 | AK317: 167.9 | AL317: 295 | AM317: 70 | AN317: 265 | AO317: -2.9999999999999999e-002 | AP317: 14 | AQ317: 精测转债!!
A318: 317 | B318: 113530 | C318: 大丰转债! | D318: 603081 | E318: 大丰实业 | F318: 建筑 | G318: 装饰工程 | H318: 117.8 | I318: 1.18e-002 | J318: -8.3999999999999995e-003 | K318: 13.72 | L318: 1.55e-002 | M318: 121 | N318: 16.3 | O318: 0.40000000000000002 | P318: 84.17 | Q318: 已到 | R318: 3年36天 | S318: 1年36天 | T318: 6.3 | U318: 15 | V318: 2.e-002 | W318: 0.11199999999999999 | X318: 9.4e-002 | Y318: 56 | Z318: 2.35 | AA318: 8.8999999999999999e-003 | AB318: -2.8000000000000004e-003 | AC318: -0.10199999999999999 | AD318: -0.10099999999999999 | AE318: 98.25 | AF318: 108.15 | AG318: 0.22 | AH318: AA | AI318: 3.78e-002 | AJ318: =H318+100*O318 -> 157.80000000000001 | AK318: 151.4 | AL318: 155 | AM318: 43.3 | AN318: 51 | AO318: 7.8e-002 | AP318: 30 | AQ318: 大丰转债!
A319: 318 | B319: 127012 | C319: 招路转债! | D319: 1965 | E319: 招商公路 | F319: 机场高速 | G319: 高速 | H319: 120.52 | I319: 1.5100000000000001e-002 | J319: -7.6e-003 | K319: 8.64 | L319: 1.41e-002 | M319: 107.9 | N319: 8.63 | O319: 0.20399999999999999 | P319: 100.12 | Q319: 已到 | R319: 3年31天 | S319: 1年31天 | T319: 50 | U319: 36 | V319: 6.0000000000000001e-003 | W319: 9.4e-002 | X319: 9.4e-002 | Y319: 534 | Z319: 1.04 | AA319: -3.5699999999999996e-002 | AB319: -4.0300000000000002e-002 | AC319: -0.122 | AD319: -0.124 | AE319: 97.89 | AF319: 98.4 | AG319: 0.53 | AH319: AAA | AI319: 3.0800000000000001e-002 | AJ319: =H319+100*O319 -> 140.91999999999999 | AK319: 140.9 | AL319: 45 | AM319: 42.5 | AN319: 47 | AO319: 3.6000000000000004e-002 | AP319: 26 | AQ319: 招路转债!
A320: 319 | B320: 123024 | C320: 岱勒转债!! | D320: 300700 | E320: 岱勒新材 | F320: 机械装备 | G320: 专用设备 | H320: 165.6 | I320: -4.6999999999999993e-003 | J320: -3.0999999999999999e-003 | K320: 22.7 | L320: -8.3000000000000001e-003 | M320: 112.5 | N320: 14.1 | O320: 2.8999999999999998e-002 | P320: 160.99 | Q320: 已到 | R320: 2年30天 | S320: 30天 | T320: 2.1 | U320: 508 | V320: 1.46 | W320: 8.5999999999999993e-002 | X320: 0.13900000000000001 | Y320: 24 | Z320: 5.13 | AA320: -0.17100000000000001 | AB320: -0.17999999999999999 | AC320: <-100% | AD320: <-100% | AE320: 99.61 | AF320: 98.31 | AG320: 0.94 | AH320: A+ | AI320: 6.8000000000000005e-002 | AJ320: =H320+100*O320 -> 168.5 | AK320: 170.2 | AL320: 303 | AM320: 70.6 | AN320: 269 | AO320: 8.900000000000001e-002 | AP320: 36 | AQ320: 岱勒转债!!
A321: 320 | B321: 123023 | C321: 迪森转债! | D321: 300335 | E321: 迪森股份 | F321: 能源电力 | G321: 电力供应 | H321: 110.901 | I321: 7.1999999999999998e-003 | J321: -6.1999999999999998e-003 | K321: 5.1 | L321: 3.9000000000000003e-003 | M321: 114.3 | N321: 6.89 | O321: 0.498 | P321: 74.02 | Q321: 已到 | R321: 3年29天 | S321: 2年29天 | T321: 5.29 | U321: 4.4 | V321: 8.0000000000000002e-003 | W321: 0.27800000000000002 | X321: 0.20600000000000002 | Y321: 19 | Z321: 1.4 | AA321: 1.01e-002 | AB321: 1.6000000000000001e-003 | AC321: -2.6000000000000002e-002 | AD321: -2.98e-002 | AE321: 92.24 | AF321: 96.26 | AG321: 0.25 | AH321: AA- | AI321: 5.8799999999999998e-002 | AJ321: =H321+100*O321 -> 160.70099999999999 | AK321: 147.8 | AL321: 115 | AM321: 51.5 | AN321: 115 | AO321: -2.8999999999999998e-002 | AP321: 52 | AQ321: 迪森转债!
A322: 321 | B322: 110056 | C322: 亨通转债! | D322: 600487 | E322: 亨通光电 | F322: 通信互联 | G322: 通信设备 | H322: 128.28 | I322: 1.61e-002 | J322: -6.8000000000000005e-003 | K322: 14.66 | L322: 2.0899999999999998e-002 | M322: 114.3 | N322: 14.95 | O322: 0.308 | P322: 98.06 | Q322: 已到 | R322: 3年28天 | S322: 1年28天 | T322: 17.1 | U322: 32 | V322: 1.4999999999999999e-002 | W322: 4.9000000000000002e-002 | X322: 4.8000000000000001e-002 | Y322: 346 | Z322: 1.68 | AA322: -3.7599999999999995e-002 | AB322: -4.5499999999999999e-002 | AC322: -0.156 | AD322: -0.159 | AE322: 98.8 | AF322: 103.73 | AG322: 0.44 | AH322: AA+ | AI322: 3.2799999999999996e-002 | AJ322: =H322+100*O322 -> 159.08000000000001 | AK322: 158.5 | AL322: 226 | AM322: 54.8 | AN322: 142 | AO322: 2.2000000000000002e-002 | AP322: 23 | AQ322: 亨通转债!
A323: 322 | B323: 123022 | C323: 长信转债!! | D323: 300088 | E323: 长信科技 | F323: 通信互联 | G323: 通信设备 | H323: 191.462 | I323: 2.3999999999999998e-003 | J323: -1.5e-003 | K323: 9.87 | L323: 1.e-003 | M323: 114.3 | N323: 6.05 | O323: 0.17399999999999999 | P323: 163.14 | Q323: 已到 | R323: 3年27天 | S323: 1年27天 | T323: 2.56 | U323: 111 | V323: 0.22699999999999998 | W323: 1.1000000000000001e-002 | X323: 1.7000000000000001e-002 | Y323: 242 | Z323: 3.21 | AA323: -0.157 | AB323: -0.16399999999999998 | AC323: -0.36599999999999999 | AD323: -0.36799999999999999 | AE323: 98.23 | AF323: 102.25 | AG323: 0.93 | AH323: AA | AI323: 3.78e-002 | AJ323: =H323+100*O323 -> 208.86199999999999 | AK323: 219.8 | AL323: 353 | AM323: 117.5 | AN323: 350 | AO323: -7.2000000000000008e-002 | AP323: 11 | AQ323: 长信转债!!
A324: 323 | B324: 110055 | C324: 伊力转债!! | D324: 600197 | E324: 伊力特 | F324: 食品饮料 | G324: 白酒 | H324: 176.59 | I324: -6.1999999999999998e-003 | J324: 1.9900000000000001e-002 | K324: 24.56 | L324: 1.5300000000000001e-002 | M324: 114.3 | N324: 16.41 | O324: 0.17999999999999999 | P324: 149.66 | Q324: 已到 | R324: 3年24天 | S324: 1年24天 | T324: 2.44 | U324: 147 | V324: 0.34000000000000002 | W324: 2.1000000000000001e-002 | X324: 3.1e-002 | Y324: 116 | Z324: 3.22 | AA324: -0.13500000000000001 | AB324: -0.14099999999999999 | AC324: -0.33299999999999996 | AD324: -0.33500000000000002 | AE324: 98.26 | AF324: 102.28 | AG324: 0.9 | AH324: AA | AI324: 3.78e-002 | AJ324: =H324+100*O324 -> 194.59 | AK324: 203.5 | AL324: 347 | AM324: 101.2 | AN324: 342 | AO324: 3.4000000000000002e-002 | AP324: 20 | AQ324: 伊力转债!!
A325: 324 | B325: 110053 | C325: 苏银转债! | D325: 600919 | E325: 江苏银行 | F325: 金融 | G325: 银行行业 | H325: 123.5 | I325: 1.3899999999999999e-002 | J325: -1.e-003 | K325: 6.92 | L325: 2.3700000000000002e-002 | M325: 118.3 | N325: 6.37 | O325: 0.13699999999999998 | P325: 108.63 | Q325: 已到 | R325: 3年23天 | S325: 无权 | T325: 200 | U325: 378 | V325: 1.4999999999999999e-002 | W325: 0.19600000000000001 | X325: 0.21299999999999999 | Y325: 1022. | Z325: 0.7 | AA325: -1.44e-002 | AB325: -2.4700000000000003e-002 | AC325: 无权 | AD325: 无权 | AE325: 无权 | AF325: 108.16 | AG325: 0.54 | AH325: AAA | AI325: 3.0800000000000001e-002 | AJ325: =H325+100*O325 -> 137.19999999999999 | AK325: 138.4 | AL325: 34 | AM325: 30.2 | AN325: 9 | AO325: 2.5000000000000001e-002 | AP325: 33 | AQ325: 苏银转债!
A326: 325 | B326: 127011 | C326: 中鼎转2!!* | D326: 887 | E326: 中鼎股份 | F326: 汽车 | G326: 零部件制 | H326: 168.7 | I326: -2.2599999999999999e-002 | J326: 8.0000000000000004e-004 | K326: 19.26 | L326: -2.18e-002 | M326: 114.5 | N326: 11.39 | O326: -2.e-003 | P326: 169.1 | Q326: 已到 | R326: 5.1天 | S326: 无权 | T326: 3.19 | U326: 184 | V326: 0.34100000000000003 | W326: 1.3999999999999999e-002 | X326: 2.3e-002 | Y326: 233 | Z326: 2.55 | AA326: <-100% | AB326: <-100% | AC326: 无权 | AD326: 无权 | AE326: 无权 | AF326: 100.93 | AG326: 1 | AH326: AA+ | AI326: 2.5499999999999998e-002 | AJ326: =H326+100*O326 -> 168.5 | AK326: 168.3 | AL326: 297 | AM326: 67.4 | AN326: 246 | AO326: -9.6000000000000002e-002 | AP326: 17 | AQ326: 中鼎转2!!*
A327: 326 | B327: 110052 | C327: 贵广转债! | D327: 600996 | E327: 贵广网络 | F327: 传媒娱乐 | G327: 影视娱乐 | H327: 123.23 | I327: 7.2499999999999995e-002 | J327: -3.4200000000000001e-002 | K327: 7.69 | L327: 0.10000000000000001 | M327: 117.7 | N327: 7.94 | O327: 0.27200000000000002 | P327: 96.85 | Q327: 已到 | R327: 3年14天 | S327: 1年14天 | T327: 15.3 | U327: 976 | V327: 0.52800000000000002 | W327: 0.18899999999999997 | X327: 0.183 | Y327: 81 | Z327: 2.11 | AA327: -1.5300000000000001e-002 | AB327: -2.53e-002 | AC327: -0.13400000000000001 | AD327: -0.13699999999999998 | AE327: 99.15 | AF327: 106.96 | AG327: 0.38 | AH327: AA+ | AI327: 3.2799999999999996e-002 | AJ327: =H327+100*O327 -> 150.43000000000001 | AK327: 149.6 | AL327: 135 | AM327: 42.6 | AN327: 49 | AO327: 0.109 | AP327: 33 | AQ327: 贵广转债!
A328: 327 | B328: 113021 | C328: 中信转债! | D328: 601998 | E328: 中信银行 | F328: 金融 | G328: 银行行业 | H328: 110.29 | I328: 1.5e-003 | J328: -2.9999999999999997e-004 | K328: 4.79 | L328: 1.0500000000000001e-002 | M328: 118 | N328: 6.73 | O328: 0.55000000000000004 | P328: 71.17 | Q328: 已到 | R328: 3年13天 | S328: 无权 | T328: 400 | U328: 18 | V328: 0. | W328: 0.17100000000000001 | X328: 0.121 | Y328: 2344. | Z328: 0.47 | AA328: 2.3300000000000001e-002 | AB328: 1.2500000000000001e-002 | AC328: 无权 | AD328: 无权 | AE328: 无权 | AF328: 107.97 | AG328: 0.1 | AH328: AAA | AI328: 3.0800000000000001e-002 | AJ328: =H328+100*O328 -> 165.29000000000002 | AK328: 149.4 | AL328: 128 | AM328: 41.4 | AN328: 42 | AO328: 9.0000000000000011e-003 | AP328: 39 | AQ328: 中信转债!
A329: 328 | B329: 128056 | C329: 今飞转债! | D329: 2863 | E329: 今飞凯达 | F329: 汽车 | G329: 零部件制 | H329: 118.699 | I329: 3.4000000000000002e-003 | J329: -1.e-003 | K329: 5.48 | L329: 7.4000000000000003e-003 | M329: 120.2 | N329: 6.69 | O329: 0.44900000000000001 | P329: 81.91 | Q329: 已到 | R329: 3年9天 | S329: 1年9天 | T329: 1.72 | U329: 1.6 | V329: 8.0000000000000002e-003 | W329: 6.3e-002 | X329: 5.2000000000000005e-002 | Y329: 27 | Z329: 1.45 | AA329: 4.3e-003 | AB329: -7.3000000000000001e-003 | AC329: -0.107 | AD329: -0.111 | AE329: 95.49 | AF329: 98.55 | AG329: 0.33 | AH329: A+ | AI329: 6.9800000000000001e-002 | AJ329: =H329+100*O329 -> 163.59899999999999 | AK329: 155.5 | AL329: 194 | AM329: 56.9 | AN329: 163 | AO329: -1.7000000000000001e-002 | AP329: 46 | AQ329: 今飞转债!
A330: 329 | B330: 128053 | C330: 尚荣转债! | D330: 2551 | E330: 尚荣医疗 | F330: 医药 | G330: 医疗器械 | H330: 127.8 | I330: 1.95e-002 | J330: -1.95e-002 | K330: 5.09 | L330: 4.2999999999999997e-002 | M330: 113.3 | N330: 4.88 | O330: 0.22500000000000001 | P330: 104.3 | Q330: 已到 | R330: 2.99年 | S330: 0.99年 | T330: 1.9 | U330: 75 | V330: 0.31 | W330: 4.4000000000000004e-002 | X330: 4.5999999999999999e-002 | Y330: 43 | Z330: 1.36 | AA330: -4.0000000000000001e-002 | AB330: -4.7599999999999996e-002 | AC330: -0.17300000000000001 | AD330: -0.17600000000000002 | AE330: 97.74 | AF330: 102.09 | AG330: 0 | AH330: AA | AI330: 3.6000000000000004e-002 | AJ330: =H330+100*O330 -> 150.30000000000001 | AK330: 151.3 | AL330: 153 | AM330: 49.2 | AN330: 94 | AO330: -1.6e-002 | AP330: 21 | AQ330: 尚荣转债!
A331: 330 | B331: 113527 | C331: 维格转债!! | D331: 603518 | E331: 锦泓集团 | F331: 服装纺织 | G331: 服装行业 | H331: 126.92 | I331: 3.4999999999999996e-003 | J331: -5.5000000000000005e-003 | K331: 10.54 | L331: -3.8e-003 | M331: 118.5 | N331: 9.85 | O331: 0.18600000000000003 | P331: 107.01 | Q331: 已到 | R331: 2.93年 | S331: 0.93年 | T331: 2.86 | U331: 34 | V331: 9.5000000000000001e-002 | W331: 9.1999999999999998e-002 | X331: 9.8000000000000004e-002 | Y331: 31 | Z331: 1.28 | AA331: -2.35e-002 | AB331: -3.4000000000000002e-002 | AC331: -0.17899999999999999 | AD331: -0.18100000000000002 | AE331: 96.95 | AF331: 104.07 | AG331: 0.53 | AH331: AA | AI331: 4.5999999999999999e-002 | AJ331: =H331+100*O331 -> 145.52000000000001 | AK331: 146.8 | AL331: 103 | AM331: 42.8 | AN331: 50 | AO331: -2.7000000000000003e-002 | AP331: 64 | AQ331: 维格转债!!
A332: 331 | B332: 113526 | C332: 联泰转债! | D332: 603797 | E332: 联泰环保 | F332: 城市公用 | G332: 三废处理 | H332: 224.99 | I332: -1.0200000000000001e-002 | J332: 1.32e-002 | K332: 6.59 | L332: 4.5999999999999999e-003 | M332: 109.3 | N332: 5.92 | O332: 1.02 | P332: 111.32 | Q332: 已到 | R332: 2.93年 | S332: 0.93年 | T332: 1.93 | U332: 40 | V332: 9.0999999999999998e-002 | W332: 5.0000000000000003e-002 | X332: 5.5999999999999994e-002 | Y332: 38 | Z332: 1.52 | AA332: -0.221 | AB332: -0.22500000000000001 | AC332: -0.49700000000000005 | AD332: -0.498 | AE332: 98.47 | AF332: 100.09 | AG332: 0.65 | AH332: AA+ | AI332: 3.1e-002 | AJ332: =H332+100*O332 -> 326.99000000000001 | AK332: 338.7 | AL332: 375 | AM332: 238.6 | AN332: 375 | AO332: 1.4999999999999999e-002 | AP332: 7 | AQ332: 联泰转债!
A333: 332 | B333: 123018 | C333: 溢利转债! | D333: 300381 | E333: 溢多利 | F333: 医药 | G333: 原料药 | H333: 177.8 | I333: 1.1000000000000001e-003 | J333: 1.4199999999999999e-002 | K333: 10.51 | L333: 1.9400000000000001e-002 | M333: 113.3 | N333: 8.25 | O333: 0.39600000000000002 | P333: 127.39 | Q333: 已到 | R333: 2.83年 | S333: 0.83年 | T333: 0.54 | U333: 45 | V333: 0.46999999999999997 | W333: 1.1000000000000001e-002 | X333: 1.3000000000000001e-002 | Y333: 52 | Z333: 1.73 | AA333: -0.14899999999999999 | AB333: -0.156 | AC333: -0.42799999999999999 | AD333: -0.42999999999999999 | AE333: 96.32 | AF333: 97.07 | AG333: 0.79 | AH333: AA- | AI333: 5.7000000000000002e-002 | AJ333: =H333+100*O333 -> 217.40000000000001 | AK333: 228.2 | AL333: 358 | AM333: 131.1 | AN333: 358 | AO333: -2.4e-002 | AP333: 9 | AQ333: 溢利转债!
A334: 333 | B334: 113525 | C334: 台华转债!! | D334: 603055 | E334: 台华新材 | F334: 服装纺织 | G334: 纺织行业 | H334: 204.15 | I334: -7.000000000000001e-004 | J334: -1.1599999999999999e-002 | K334: 14.8 | L334: -1.2699999999999999e-002 | M334: 113.3 | N334: 7.78 | O334: 7.2999999999999995e-002 | P334: 190.23 | Q334: 已到 | R334: 2.82年 | S334: 0.82年 | T334: 1.82 | U334: 61 | V334: 0.16300000000000001 | W334: 1.3999999999999999e-002 | X334: 2.7000000000000003e-002 | Y334: 129 | Z334: 3.59 | AA334: -0.19 | AB334: -0.19699999999999998 | AC334: -0.50700000000000001 | AD334: -0.50800000000000001 | AE334: 98.3 | AF334: 102.69 | AG334: 0.97 | AH334: AA | AI334: 3.6000000000000004e-002 | AJ334: =H334+100*O334 -> 211.45000000000002 | AK334: 218.1 | AL334: 351 | AM334: 115.4 | AN334: 348 | AO334: -6.6000000000000003e-002 | AP334: 16 | AQ334: 台华转债!!
A335: 334 | B335: 113524 | C335: 奇精转债! | D335: 603677 | E335: 奇精机械 | F335: 家电 | G335: 零部件制 | H335: 119.14 | I335: 1.77e-002 | J335: -1.3500000000000002e-002 | K335: 12.88 | L335: 1.0200000000000001e-002 | M335: 116.3 | N335: 13.98 | O335: 0.29299999999999998 | P335: 92.13 | Q335: 已到 | R335: 2.82年 | S335: 0.82年 | T335: 3.3 | U335: 7.3 | V335: 1.9e-002 | W335: 0.13300000000000001 | X335: 0.12300000000000001 | Y335: 25 | Z335: 2.43 | AA335: -8.6999999999999994e-003 | AB335: -1.8700000000000001e-002 | AC335: -0.14899999999999999 | AD335: -0.152 | AE335: 96.41 | AF335: 99.73 | AG335: 0.41 | AH335: AA- | AI335: 5.7000000000000002e-002 | AJ335: =H335+100*O335 -> 148.44 | AK335: 146.1 | AL335: 96 | AM335: 46.4 | AN335: 76 | AO335: 5.5999999999999994e-002 | AP335: 39 | AQ335: 奇精转债!
A336: 335 | B336: 110048 | C336: 福能转债!! | D336: 600483 | E336: 福能股份 | F336: 能源电力 | G336: 电力供应 | H336: 195.53 | I336: -8.0000000000000002e-003 | J336: -2.e-003 | K336: 13.24 | L336: -1.0500000000000001e-002 | M336: 112.3 | N336: 7.85 | O336: 0.159 | P336: 168.66 | Q336: 已到 | R336: 2.80年 | S336: 0.80年 | T336: 12.8 | U336: 102 | V336: 4.0999999999999995e-002 | W336: 4.9000000000000002e-002 | X336: 8.3000000000000004e-002 | Y336: 259 | Z336: 3.26 | AA336: -0.182 | AB336: -0.188 | AC336: -0.5 | AD336: -0.501 | AE336: 98.85 | AF336: 103.24 | AG336: 0.96 | AH336: AA+ | AI336: 3.1e-002 | AJ336: =H336+100*O336 -> 211.43000000000001 | AK336: 222.4 | AL336: 355 | AM336: 119.2 | AN336: 351 | AO336: -9.0000000000000011e-003 | AP336: 9 | AQ336: 福能转债!!
A337: 336 | B337: 128049 | C337: 华源转债! | D337: 2787 | E337: 华源控股 | F337: 造纸包装 | G337: 包装材料 | H337: 112.58 | I337: 5.7999999999999996e-003 | J337: -2.5000000000000001e-003 | K337: 6.08 | L337: 1.e-002 | M337: 113.5 | N337: 7.37 | O337: 0.36499999999999999 | P337: 82.5 | Q337: 已到 | R337: 2.77年 | S337: 0.77年 | T337: 3.63 | U337: 1.6 | V337: 4.0000000000000001e-003 | W337: 0.18899999999999997 | X337: 0.156 | Y337: 19 | Z337: 1.25 | AA337: 3.0000000000000001e-003 | AB337: -5.7999999999999996e-003 | AC337: -0.10300000000000001 | AD337: -0.106 | AE337: 96.69 | AF337: 97.59 | AG337: 0.32 | AH337: AA- | AI337: 5.7000000000000002e-002 | AJ337: =H337+100*O337 -> 149.07999999999998 | AK337: 142.7 | AL337: 63 | AM337: 45.1 | AN337: 62 | AO337: 2.1000000000000001e-002 | AP337: 44 | AQ337: 华源转债!
A338: 337 | B338: 110047 | C338: 山鹰转债 | D338: 600567 | E338: 山鹰国际 | F338: 造纸包装 | G338: 包装用纸 | H338: 117.77 | I338: 7.4000000000000003e-003 | J338: -3.9000000000000003e-003 | K338: 3.21 | L338: 9.3999999999999986e-003 | M338: 116.5 | N338: 3.3 | O338: 0.21100000000000002 | P338: 97.27 | Q338: 已到 | R338: 2.75年 | S338: 0.75年 | T338: 22.5 | U338: 13 | V338: 5.0000000000000001e-003 | W338: 0.152 | X338: 0.14699999999999999 | Y338: 148 | Z338: 0.92 | AA338: -4.0000000000000001e-003 | AB338: -1.4499999999999999e-002 | AC338: -0.14899999999999999 | AD338: -0.152 | AE338: 99.02 | AF338: 107.25 | AG338: 0.37 | AH338: AA+ | AI338: 3.1e-002 | AJ338: =H338+100*O338 -> 138.87 | AK338: 138.3 | AL338: 33 | AM338: 31 | AN338: 10 | AO338: -1.e-003 | AP338: 28 | AQ338: 山鹰转债
A339: 338 | B339: 128048 | C339: 张行转债 | D339: 2839 | E339: 张家港行 | F339: 金融 | G339: 银行行业 | H339: 127.7 | I339: 8.6999999999999994e-003 | J339: 6.9999999999999993e-003 | K339: 6.56 | L339: 2.3399999999999997e-002 | M339: 112.3 | N339: 5.6 | O339: 8.9999999999999997e-002 | P339: 117.14 | Q339: 已到 | R339: 2.73年 | S339: 无权 | T339: 25 | U339: 47 | V339: 1.4999999999999999e-002 | W339: 0.21100000000000002 | X339: 0.247 | Y339: 119 | Z339: 1.02 | AA339: -4.6699999999999998e-002 | AB339: -5.4400000000000004e-002 | AC339: 无权 | AD339: 无权 | AE339: 无权 | AF339: 103.46 | AG339: 0.67 | AH339: AA+ | AI339: 3.1e-002 | AJ339: =H339+100*O339 -> 136.69999999999999 | AK339: 138.3 | AL339: 32 | AM339: 34.8 | AN339: 18 | AO339: 2.3e-002 | AP339: 12 | AQ339: 张行转债
A340: 339 | B340: 113519 | C340: 长久转债! | D340: 603569 | E340: 长久物流 | F340: 交通运输 | G340: 物流业 | H340: 113.69 | I340: 1.2999999999999999e-003 | J340: -1.1000000000000001e-003 | K340: 7.79 | L340: 2.5999999999999999e-003 | M340: 118.3 | N340: 11.04 | O340: 0.61099999999999999 | P340: 70.56 | Q340: 已到 | R340: 2.72年 | S340: 0.72年 | T340: 6.97 | U340: 7 | V340: 9.0000000000000011e-003 | W340: 0.16 | X340: 0.113 | Y340: 44 | Z340: 2.06 | AA340: 1.4999999999999999e-002 | AB340: 3.0999999999999999e-003 | AC340: -0.121 | AD340: -0.124 | AE340: 98.68 | AF340: 107.63 | AG340: 0.09 | AH340: AA | AI340: 3.6000000000000004e-002 | AJ340: =H340+100*O340 -> 174.78999999999999 | AK340: 156.8 | AL340: 210 | AM340: 49.2 | AN340: 92 | AO340: 7.0000000000000007e-002 | AP340: 29 | AQ340: 长久转债!
A341: 340 | B341: 128046 | C341: 利尔转债!! | D341: 2258 | E341: 利尔化学 | F341: 化工 | G341: 农化 | H341: 180.35 | I341: 1.44e-002 | J341: 1.4000000000000002e-003 | K341: 32.39 | L341: 1.6299999999999999e-002 | M341: 111.3 | N341: 18.42 | O341: 2.6000000000000002e-002 | P341: 175.84 | Q341: 已到 | R341: 2.66年 | S341: 0.66年 | T341: 8.08 | U341: 56 | V341: 3.7999999999999999e-002 | W341: 4.7e-002 | X341: 8.3000000000000004e-002 | Y341: 171 | Z341: 3.94 | AA341: -0.16800000000000001 | AB341: -0.17399999999999999 | AC341: -0.53900000000000003 | AD341: -0.54100000000000004 | AE341: 98.88 | AF341: 101.47 | AG341: 0.97 | AH341: AA | AI341: 3.6000000000000004e-002 | AJ341: =H341+100*O341 -> 182.94999999999999 | AK341: 184.9 | AL341: 333 | AM341: 83.4 | AN341: 321 | AO341: 6.8000000000000005e-002 | AP341: 9 | AQ341: 利尔转债!!
A342: 341 | B342: 128044 | C342: 岭南转债! | D342: 2717 | E342: 岭南股份 | F342: 城市公用 | G342: 生态环境 | H342: 132.9 | I342: 1.4499999999999999e-002 | J342: -1.0700000000000001e-002 | K342: 4.39 | L342: 4.5999999999999999e-003 | M342: 110.3 | N342: 3.43 | O342: 3.7999999999999999e-002 | P342: 127.99 | Q342: 已到 | R342: 2.48年 | S342: 0.48年 | T342: 6.58 | U342: 1615. | V342: 1.8600000000000001 | W342: 8.900000000000001e-002 | X342: 0.114 | Y342: 74 | Z342: 1.56 | AA342: -7.3499999999999996e-002 | AB342: -8.0399999999999985e-002 | AC342: -0.375 | AD342: -0.38 | AE342: 98.22 | AF342: 96.36 | AG342: 0.83 | AH342: AA- | AI342: 5.7000000000000002e-002 | AJ342: =H342+100*O342 -> 136.70000000000002 | AK342: 137.8 | AL342: 29 | AM342: 39.6 | AN342: 33 | AO342: 8.900000000000001e-002 | AP342: 55 | AQ342: 岭南转债!
A343: 342 | B343: 123015 | C343: 蓝盾转债!! | D343: 300297 | E343: 蓝盾股份 | F343: 计算机及 | G343: 软件开发 | H343: 209.669 | I343: 3.5999999999999999e-003 | J343: -3.5999999999999999e-003 | K343: 3.1 | L343: 1.6399999999999998e-002 | M343: 111.3 | N343: 5.79 | O343: 2.9199999999999999 | P343: 53.54 | Q343: 已到 | R343: 2.48年 | S343: 0.48年 | T343: 1 | U343: 139 | V343: 0.66099999999999992 | W343: 2.6000000000000002e-002 | X343: 1.3999999999999999e-002 | Y343: 39 | Z343: 2.18 | AA343: -0.22800000000000001 | AB343: -0.23399999999999999 | AC343: -0.82599999999999996 | AD343: -0.82900000000000007 | AE343: 94.74 | AF343: 84.85 | AG343: 0 | AH343: BBB- | AI343: 0.11800000000000001 | AJ343: =H343+100*O343 -> 501.66899999999998 | AK343: 365.8 | AL343: 378 | AM343: 271.1 | AN343: 378 | AO343: -6.2e-002 | AP343: 14 | AQ343: 蓝盾转债!!
A344: 343 | B344: 113516 | C344: 苏农转债! | D344: 603323 | E344: 苏农银行 | F344: 金融 | G344: 银行行业 | H344: 123.71 | I344: 2.8300000000000002e-002 | J344: -1.46e-002 | K344: 5.65 | L344: 2.7300000000000001e-002 | M344: 113.3 | N344: 5.37 | O344: 0.17600000000000002 | P344: 105.21 | Q344: 已到 | R344: 2.45年 | S344: 无权 | T344: 12.9 | U344: 49 | V344: 3.1e-002 | W344: 0.126 | X344: 0.13300000000000001 | Y344: 102 | Z344: 0.79 | AA344: -3.5799999999999998e-002 | AB344: -4.5199999999999997e-002 | AC344: 无权 | AD344: 无权 | AE344: 无权 | AF344: 105.28 | AG344: 0.5 | AH344: AA+ | AI344: 3.1e-002 | AJ344: =H344+100*O344 -> 141.31 | AK344: 142.2 | AL344: 57 | AM344: 36.9 | AN344: 23 | AO344: 3.7000000000000005e-002 | AP344: 24 | AQ344: 苏农转债!
A345: 344 | B345: 123014 | C345: 凯发转债! | D345: 300407 | E345: 凯发电气 | F345: 能源电力 | G345: 电力设备 | H345: 132.6 | I345: 2.87e-002 | J345: -1.1000000000000001e-003 | K345: 8.54 | L345: 4.53e-002 | M345: 107.5 | N345: 8.05 | O345: 0.25 | P345: 106.09 | Q345: 已到 | R345: 1.43年 | S345: 回售内 | T345: 1.16 | U345: 128 | V345: 0.82599999999999996 | W345: 4.4999999999999998e-002 | X345: 4.7e-002 | Y345: 26 | Z345: 1.88 | AA345: -0.13699999999999998 | AB345: -0.14599999999999999 | AC345: 回售内 | AD345: 回售内 | AE345: 100.25 | AF345: 97.92 | AG345: 0.61 | AH345: A+ | AI345: 6.8000000000000005e-002 | AJ345: =H345+100*O345 -> 157.59999999999999 | AK345: 159.1 | AL345: 229 | AM345: 58.9 | AN345: 179 | AO345: 1.3000000000000001e-002 | AP345: 16 | AQ345: 凯发转债!
A346: 345 | B346: 128042 | C346: 凯中转债! | D346: 2823 | E346: 凯中精密 | F346: 能源电力 | G346: 电力设备 | H346: 119.621 | I346: 1.e-004 | J346: 5.9999999999999995e-004 | K346: 10.01 | L346: 5.0000000000000001e-003 | M346: 115.3 | N346: 12.86 | O346: 0.53700000000000003 | P346: 77.84 | Q346: 已到 | R346: 2.44年 | S346: 0.44年 | T346: 4.16 | U346: 14 | V346: 2.7999999999999997e-002 | W346: 0.14499999999999999 | X346: 0.113 | Y346: 29 | Z346: 2.19 | AA346: -1.52e-002 | AB346: -2.6099999999999998e-002 | AC346: -0.25700000000000001 | AD346: -0.26200000000000001 | AE346: 99.64 | AF346: 105.92 | AG346: 0.14 | AH346: AA | AI346: 3.6000000000000004e-002 | AJ346: =H346+100*O346 -> 173.321 | AK346: 161.4 | AL346: 247 | AM346: 55.5 | AN346: 150 | AO346: -1.3000000000000001e-002 | AP346: 25 | AQ346: 凯中转债!
A347: 346 | B347: 123013 | C347: 横河转债! | D347: 300539 | E347: 横河精密 | F347: 机械装备 | G347: 专用设备 | H347: 319 | I347: -2.46e-002 | J347: 2.9999999999999999e-002 | K347: 8.4 | L347: 1.2e-002 | M347: 114 | N347: 9.04 | O347: 2.4300000000000002 | P347: 92.92 | Q347: 已到 | R347: 2.43年 | S347: 0.43年 | T347: 0.38 | U347: 515 | V347: 4.1399999999999997 | W347: 2.e-002 | X347: 1.9e-002 | Y347: 19 | Z347: 3.78 | AA347: -0.34899999999999998 | AB347: -0.35499999999999998 | AC347: <-100% | AD347: <-100% | AE347: 98.25 | AF347: 97.5 | AG347: 0.45 | AH347: A+ | AI347: 6.8000000000000005e-002 | AJ347: =H347+100*O347 -> 562. | AK347: 545.1 | AL347: 385 | AM347: 446.8 | AN347: 385 | AO347: 3.9e-002 | AP347: 11 | AQ347: 横河转债!
A348: 347 | B348: 123012 | C348: 万顺转债! | D348: 300057 | E348: 万顺新材 | F348: 有色金属 | G348: 铝金属 | H348: 165 | I348: 2.9300000000000003e-002 | J348: -3.4999999999999996e-003 | K348: 8.13 | L348: 2.7799999999999998e-002 | M348: 109.3 | N348: 5.27 | O348: 7.0000000000000007e-002 | P348: 154.27 | Q348: 已到 | R348: 2.41年 | S348: 0.41年 | T348: 1.22 | U348: 101 | V348: 0.50700000000000001 | W348: 2.2000000000000002e-002 | X348: 3.4000000000000002e-002 | Y348: 56 | Z348: 1.54 | AA348: -0.159 | AB348: -0.16500000000000001 | AC348: -0.68999999999999995 | AD348: -0.69400000000000006 | AE348: 98.59 | AF348: 95.85 | AG348: 0.93 | AH348: AA- | AI348: 5.7000000000000002e-002 | AJ348: =H348+100*O348 -> 172. | AK348: 175.7 | AL348: 317 | AM348: 77.1 | AN348: 300 | AO348: -3.4000000000000002e-002 | AP348: 23 | AQ348: 万顺转债!
A349: 348 | B349: 123011 | C349: 德尔转债! | D349: 300473 | E349: 德尔股份 | F349: 汽车 | G349: 零部件制 | H349: 115.92 | I349: 4.5000000000000005e-003 | J349: -4.4000000000000003e-003 | K349: 21.7 | L349: 8.9999999999999998e-004 | M349: 115.3 | N349: 31.38 | O349: 0.67599999999999993 | P349: 69.15 | Q349: 已到 | R349: 2.41年 | S349: 0.41年 | T349: 2.51 | U349: 5.9 | V349: 2.e-002 | W349: 8.5999999999999993e-002 | X349: 5.9000000000000004e-002 | Y349: 29 | Z349: 1.38 | AA349: -2.3e-003 | AB349: -1.3500000000000002e-002 | AC349: -0.223 | AD349: -0.22899999999999998 | AE349: 98.62 | AF349: 101.13 | AG349: 0.12 | AH349: AA- | AI349: 5.7000000000000002e-002 | AJ349: =H349+100*O349 -> 183.51999999999998 | AK349: 162.7 | AL349: 262 | AM349: 61.6 | AN349: 199 | AO349: -2.3e-002 | AP349: 37 | AQ349: 德尔转债!
A350: 349 | B350: 128041 | C350: 盛路转债!! | D350: 2446 | E350: 盛路通信 | F350: 通信互联 | G350: 通信设备 | H350: 256.5 | I350: -3.5699999999999996e-002 | J350: 3.9100000000000003e-002 | K350: 6.24 | L350: 8.1000000000000013e-003 | M350: 113.3 | N350: 6.82 | O350: 1.8 | P350: 91.5 | Q350: 已到 | R350: 2.41年 | S350: 0.41年 | T350: 0.53 | U350: 371 | V350: 2.7000000000000002 | W350: 9.0000000000000011e-003 | X350: 9.0000000000000011e-003 | Y350: 57 | Z350: 1.85 | AA350: -0.29100000000000004 | AB350: -0.29799999999999999 | AC350: <-100% | AD350: <-100% | AE350: 99.77 | AF350: 104.22 | AG350: 0.41 | AH350: AA | AI350: 3.6000000000000004e-002 | AJ350: =H350+100*O350 -> 436.5 | AK350: 421.5 | AL350: 381 | AM350: 317.3 | AN350: 381 | AO350: 4.0000000000000001e-003 | AP350: 10 | AQ350: 盛路转债!!
A351: 350 | B351: 110045 | C351: 海澜转债! | D351: 600398 | E351: 海澜之家 | F351: 服装纺织 | G351: 服装行业 | H351: 114.44 | I351: 2.e-002 | J351: -1.95e-002 | K351: 6.18 | L351: 1.6000000000000001e-003 | M351: 110.3 | N351: 7.04 | O351: 0.30399999999999999 | P351: 87.78 | Q351: 已到 | R351: 2.39年 | S351: 0.39年 | T351: 29.5 | U351: 18 | V351: 5.0000000000000001e-003 | W351: 0.11 | X351: 9.6999999999999989e-002 | Y351: 267 | Z351: 1.89 | AA351: -1.55e-002 | AB351: -2.3199999999999998e-002 | AC351: -0.217 | AD351: -0.221 | AE351: 99.5 | AF351: 102.62 | AG351: 0.27 | AH351: AA+ | AI351: 3.1e-002 | AJ351: =H351+100*O351 -> 144.84 | AK351: 141.1 | AL351: 48 | AM351: 38.5 | AN351: 30 | AO351: -1.1000000000000001e-002 | AP351: 43 | AQ351: 海澜转债!
A352: 351 | B352: 123010 | C352: 博世转债! | D352: 300422 | E352: 博世科 | F352: 城市公用 | G352: 三废处理 | H352: 112.022 | I352: 3.4000000000000002e-003 | J352: -3.2000000000000002e-003 | K352: 8.17 | L352: 1.1999999999999999e-003 | M352: 111.3 | N352: 11.26 | O352: 0.54400000000000004 | P352: 72.56 | Q352: 已到 | R352: 2.37年 | S352: 0.37年 | T352: 4.3 | U352: 15 | V352: 3.2000000000000001e-002 | W352: 0.10400000000000001 | X352: 7.5999999999999998e-002 | Y352: 41 | Z352: 1.28 | AA352: -2.8000000000000004e-003 | AB352: -1.15e-002 | AC352: -0.17999999999999999 | AD352: -0.18600000000000003 | AE352: 98.81 | AF352: 97.83 | AG352: 0.17 | AH352: AA- | AI352: 5.7000000000000002e-002 | AJ352: =H352+100*O352 -> 166.42200000000003 | AK352: 151.5 | AL352: 156 | AM352: 52.7 | AN352: 125 | AO352: 6.0000000000000001e-003 | AP352: 35 | AQ352: 博世转债!
A353: 352 | B353: 127007 | C353: 湖广转债!! | D353: 665 | E353: 湖北广电 | F353: 传媒娱乐 | G353: 影视娱乐 | H353: 155.3 | I353: 5.0000000000000001e-003 | J353: -1.6000000000000001e-003 | K353: 8.12 | L353: 3.7000000000000002e-003 | M353: 111.3 | N353: 5.58 | O353: 6.7000000000000004e-002 | P353: 145.52 | Q353: 已到 | R353: 2.35年 | S353: 0.35年 | T353: 4.15 | U353: 1086. | V353: 1.6899999999999999 | W353: 5.0000000000000003e-002 | X353: 7.2999999999999995e-002 | Y353: 82 | Z353: 1.41 | AA353: -0.13400000000000001 | AB353: -0.14099999999999999 | AC353: -0.69700000000000006 | AD353: -0.70200000000000007 | AE353: 100.2 | AF353: 103.72 | AG353: 0.9 | AH353: AA+ | AI353: 3.1e-002 | AJ353: =H353+100*O353 -> 162. | AK353: 165.1 | AL353: 280 | AM353: 61.4 | AN353: 198 | AO353: -0.11800000000000001 | AP353: 31 | AQ353: 湖广转债!!
A354: 353 | B354: 110044 | C354: 广电转债!! | D354: 600831 | E354: 广电网络 | F354: 传媒娱乐 | G354: 影视娱乐 | H354: 200.55 | I354: 9.5999999999999992e-003 | J354: 9.1000000000000004e-003 | K354: 6.37 | L354: 5.1200000000000002e-002 | M354: 111.3 | N354: 6.87 | O354: 1.1599999999999999 | P354: 92.72 | Q354: 已到 | R354: 2.35年 | S354: 0.35年 | T354: 0.71 | U354: 249 | V354: 1.74 | W354: 1.6e-002 | X354: 1.4999999999999999e-002 | Y354: 45 | Z354: 1.2 | AA354: -0.22500000000000001 | AB354: -0.23100000000000001 | AC354: <-100% | AD354: <-100% | AE354: 99.96 | AF354: 102.58 | AG354: 0.37 | AH354: AA | AI354: 3.6000000000000004e-002 | AJ354: =H354+100*O354 -> 316.55000000000001 | AK354: 308.4 | AL354: 373 | AM354: 205.8 | AN354: 373 | AO354: 2.6000000000000002e-002 | AP354: 9 | AQ354: 广电转债!!
A355: 354 | B355: 128040 | C355: 华通转债! | D355: 2758 | E355: 浙农股份 | F355: 医药 | G355: 医药商业 | H355: 146.493 | I355: 9.3200000000000005e-002 | J355: -7.6e-003 | K355: 13.96 | L355: 0.10000000000000001 | M355: 111.3 | N355: 10.03 | O355: 5.2999999999999999e-002 | P355: 139.18 | Q355: 已到 | R355: 2.32年 | S355: 0.32年 | T355: 2.22 | U355: 963 | V355: 3.04 | W355: 3.2000000000000001e-002 | X355: 4.4000000000000004e-002 | Y355: 70 | Z355: 2.08 | AA355: -0.114 | AB355: -0.121 | AC355: -0.67000000000000004 | AD355: -0.67500000000000004 | AE355: 100.09 | AF355: 102.71 | AG355: 0.86 | AH355: AA | AI355: 3.6000000000000004e-002 | AJ355: =H355+100*O355 -> 151.79300000000001 | AK355: 153.8 | AL355: 180 | AM355: 51.1 | AN355: 112 | AO355: 0.20499999999999999 | AP355: 32 | AQ355: 华通转债!
A356: 355 | B356: 128039 | C356: 三力转债! | D356: 2224 | E356: 三 力 士 | F356: 机械装备 | G356: 专用设备 | H356: 119.14 | I356: 4.6999999999999993e-003 | J356: -2.8999999999999998e-003 | K356: 5.48 | L356: 3.7000000000000002e-003 | M356: 108.8 | N356: 5.79 | O356: 0.25900000000000001 | P356: 94.65 | Q356: 已到 | R356: 2.30年 | S356: 0.30年 | T356: 2.02 | U356: 6.2 | V356: 2.6000000000000002e-002 | W356: 5.0999999999999997e-002 | X356: 4.8000000000000001e-002 | Y356: 40 | Z356: 1.67 | AA356: -3.9300000000000002e-002 | AB356: -4.6100000000000002e-002 | AC356: -0.33799999999999997 | AD356: -0.34299999999999997 | AE356: 98.97 | AF356: 95.99 | AG356: 0.47 | AH356: AA- | AI356: 5.7000000000000002e-002 | AJ356: =H356+100*O356 -> 145.03999999999999 | AK356: 143.6 | AL356: 69 | AM356: 44.7 | AN356: 59 | AO356: 2.e-002 | AP356: 31 | AQ356: 三力转债!
A357: 356 | B357: 128036 | C357: 金农转债!! | D357: 2548 | E357: 金新农 | F357: 农业 | G357: 畜牧业 | H357: 129.936 | I357: -1.4000000000000002e-003 | J357: 1.4000000000000002e-003 | K357: 7.04 | L357: -1.3999999999999999e-002 | M357: 109.3 | N357: 6.93 | O357: 0.27899999999999997 | P357: 101.59 | Q357: 已到 | R357: 2年18天 | S357: 18天 | T357: 1.46 | U357: 96 | V357: 0.504 | W357: 2.9999999999999999e-002 | X357: 2.9999999999999999e-002 | Y357: 49 | Z357: 2.08 | AA357: -8.2500000000000004e-002 | AB357: -8.9999999999999997e-002 | AC357: <-100% | AD357: <-100% | AE357: 100.6 | AF357: 97.81 | AG357: 0 | AH357: AA- | AI357: 5.7000000000000002e-002 | AJ357: =H357+100*O357 -> 157.83600000000001 | AK357: 158.3 | AL357: 224 | AM357: 57.7 | AN357: 168 | AO357: 6.0999999999999999e-002 | AP357: 16 | AQ357: 金农转债!!
A358: 357 | B358: 128037 | C358: 岩土转债! | D358: 2542 | E358: 中化岩土 | F358: 建筑 | G358: 建筑工程 | H358: 121.6 | I358: 1.4199999999999999e-002 | J358: -1.7500000000000002e-002 | K358: 3.29 | L358: -6.0000000000000001e-003 | M358: 111.3 | N358: 3.1 | O358: 0.14599999999999999 | P358: 106.13 | Q358: 已到 | R358: 2年24天 | S358: 24天 | T358: 6.02 | U358: 369 | V358: 0.50600000000000001 | W358: 0.10099999999999999 | X358: 0.10800000000000001 | Y358: 59 | Z358: 1.5 | AA358: -4.2800000000000005e-002 | AB358: -5.2199999999999996e-002 | AC358: -0.76300000000000001 | AD358: -0.77599999999999991 | AE358: 100.97 | AF358: 103.62 | AG358: 0.56 | AH358: AA | AI358: 3.6000000000000004e-002 | AJ358: =H358+100*O358 -> 136.19999999999999 | AK358: 137.1 | AL358: 23 | AM358: 33.5 | AN358: 12 | AO358: 9.6000000000000002e-002 | AP358: 53 | AQ358: 岩土转债!
A359: 358 | B359: 127006 | C359: 敖东转债! | D359: 623 | E359: 吉林敖东 | F359: 金融 | G359: 证券行业 | H359: 112.195 | I359: 8.5000000000000006e-003 | J359: -6.9999999999999993e-003 | K359: 16.57 | L359: 7.9000000000000008e-003 | M359: 107.4 | N359: 20.22 | O359: 0.36899999999999999 | P359: 81.95 | Q359: 已到 | R359: 2年22天 | S359: 22天 | T359: 24.1 | U359: 34 | V359: 1.3000000000000001e-002 | W359: 0.125 | X359: 0.10199999999999999 | Y359: 193 | Z359: 0.8 | AA359: -2.1299999999999999e-002 | AB359: -2.7900000000000001e-002 | AC359: -0.47600000000000003 | AD359: -0.48499999999999999 | AE359: 100.37 | AF359: 100.95 | AG359: 0.19 | AH359: AA+ | AI359: 3.1e-002 | AJ359: =H359+100*O359 -> 149.095 | AK359: 142.4 | AL359: 61 | AM359: 41.5 | AN359: 43 | AO359: -3.2000000000000001e-002 | AP359: 25 | AQ359: 敖东转债!
A360: 359 | B360: 127005 | C360: 长证转债! | D360: 783 | E360: 长江证券 | F360: 金融 | G360: 证券行业 | H360: 121.799 | I360: 3.2000000000000002e-003 | J360: -1.2999999999999999e-003 | K360: 7.08 | L360: 4.3e-003 | M360: 108.3 | N360: 7.13 | O360: 0.22699999999999998 | P360: 99.3 | Q360: 已到 | R360: 2年21天 | S360: 无权 | T360: 50 | U360: 38 | V360: 6.0000000000000001e-003 | W360: 0.128 | X360: 0.127 | Y360: 392 | Z360: 1.33 | AA360: -5.6600000000000004e-002 | AB360: -6.3600000000000004e-002 | AC360: 无权 | AD360: 无权 | AE360: 无权 | AF360: 102.25 | AG360: 0.47 | AH360: AAA | AI360: 2.8999999999999998e-002 | AJ360: =H360+100*O360 -> 144.499 | AK360: 144.3 | AL360: 74 | AM360: 42.1 | AN360: 45 | AO360: -1.3999999999999999e-002 | AP360: 12 | AQ360: 长证转债!
A361: 360 | B361: 113505 | C361: 杭电转债! | D361: 603618 | E361: 杭电股份 | F361: 能源电力 | G361: 电力设备 | H361: 115.8 | I361: 1.e-002 | J361: -9.4999999999999998e-003 | K361: 6.49 | L361: 1.5e-003 | M361: 111.3 | N361: 7.08 | O361: 0.26300000000000001 | P361: 91.67 | Q361: 已到 | R361: 2年15天 | S361: 15天 | T361: 7.5 | U361: 8.3 | V361: 1.e-002 | W361: 0.16699999999999998 | X361: 0.153 | Y361: 45 | Z361: 1.7 | AA361: -1.9599999999999999e-002 | AB361: -2.9500000000000002e-002 | AC361: -0.63700000000000001 | AD361: -0.65200000000000002 | AE361: 101.06 | AF361: 103.71 | AG361: 0.31 | AH361: AA | AI361: 3.6000000000000004e-002 | AJ361: =H361+100*O361 -> 142.09999999999999 | AK361: 139.9 | AL361: 41 | AM361: 36.2 | AN361: 19 | AO361: -1.3999999999999999e-002 | AP361: 42 | AQ361: 杭电转债!
A362: 361 | B362: 113504 | C362: 艾华转债!! | D362: 603989 | E362: 艾华集团 | F362: 电子 | G362: 元器件制 | H362: 175.39 | I362: 2.3e-003 | J362: -7.3000000000000001e-003 | K362: 34.2 | L362: -5.1999999999999998e-003 | M362: 109.3 | N362: 20.81 | O362: 6.7000000000000004e-002 | P362: 164.34 | Q362: 已到 | R362: 2年11天 | S362: 11天 | T362: 4.63 | U362: 16 | V362: 1.9e-002 | W362: 3.4000000000000002e-002 | X362: 5.5e-002 | Y362: 137 | Z362: 4.81 | AA362: -0.21100000000000002 | AB362: -0.217 | AC362: <-100% | AD362: <-100% | AE362: 101.1 | AF362: 101.89 | AG362: 0.97 | AH362: AA | AI362: 3.6000000000000004e-002 | AJ362: =H362+100*O362 -> 182.08999999999997 | AK362: 186.4 | AL362: 336 | AM362: 84.5 | AN362: 324 | AO362: -2.e-002 | AP362: 10 | AQ362: 艾华转债!!
A363: 362 | B363: 128035 | C363: 大族转债! | D363: 2008 | E363: 大族激光 | F363: 机械装备 | G363: 专用设备 | H363: 123.769 | I363: 5.9999999999999995e-004 | J363: -2.3e-003 | K363: 46.86 | L363: -5.5000000000000005e-003 | M363: 106.6 | N363: 51.9 | O363: 0.371 | P363: 90.29 | Q363: 已到 | R363: 1.96年 | S363: 回售内 | T363: 23 | U363: 35 | V363: 1.2e-002 | W363: 4.5999999999999999e-002 | X363: 4.2000000000000003e-002 | Y363: 500 | Z363: 4.71 | AA363: -7.3700000000000002e-002 | AB363: -7.9500000000000001e-002 | AC363: 回售内 | AD363: 回售内 | AE363: 103 | AF363: 100.44 | AG363: 0.31 | AH363: AA+ | AI363: 3.1e-002 | AJ363: =H363+100*O363 -> 160.869 | AK363: 157.2 | AL363: 214 | AM363: 54.2 | AN363: 138 | AO363: -5.0000000000000001e-003 | AP363: 17 | AQ363: 大族转债!
A364: 363 | B364: 110043 | C364: 无锡转债! | D364: 600908 | E364: 无锡银行 | F364: 金融 | G364: 银行行业 | H364: 125.01 | I364: 1.5900000000000001e-002 | J364: 4.5999999999999999e-003 | K364: 6.27 | L364: 3.1300000000000001e-002 | M364: 107.3 | N364: 5.61 | O364: 0.11900000000000001 | P364: 111.76 | Q364: 已到 | R364: 1.95年 | S364: 无权 | T364: 29.2 | U364: 64 | V364: 1.8000000000000002e-002 | W364: 0.25 | X364: 0.28000000000000003 | Y364: 117 | Z364: 0.91 | AA364: -7.5999999999999998e-002 | AB364: -8.2400000000000001e-002 | AC364: 无权 | AD364: 无权 | AE364: 无权 | AF364: 101.15 | AG364: 0.66 | AH364: AA+ | AI364: 3.1e-002 | AJ364: =H364+100*O364 -> 136.91 | AK364: 138.3 | AL364: 31 | AM364: 37.1 | AN364: 25 | AO364: 3.7000000000000005e-002 | AP364: 22 | AQ364: 无锡转债!
A365: 364 | B365: 128034 | C365: 江银转债! | D365: 2807 | E365: 江阴银行 | F365: 金融 | G365: 银行行业 | H365: 114.499 | I365: 1.6899999999999998e-002 | J365: -1.11e-002 | K365: 4.1 | L365: 1.49e-002 | M365: 107.3 | N365: 4.32 | O365: 0.20600000000000002 | P365: 94.91 | Q365: 已到 | R365: 1.93年 | S365: 无权 | T365: 17.6 | U365: 24 | V365: 1.2e-002 | W365: 0.19699999999999998 | X365: 0.187 | Y365: 89 | Z365: 0.74 | AA365: -3.32e-002 | AB365: -4.0000000000000001e-002 | AC365: 无权 | AD365: 无权 | AE365: 无权 | AF365: 101.18 | AG365: 0.39 | AH365: AA+ | AI365: 3.1e-002 | AJ365: =H365+100*O365 -> 135.09899999999999 | AK365: 134.1 | AL365: 12 | AM365: 32.9 | AN365: 11 | AO365: 1.8000000000000002e-002 | AP365: 31 | AQ365: 江银转债!
A366: 365 | B366: 128033 | C366: 迪龙转债! | D366: 2658 | E366: 雪迪龙 | F366: 城市公用 | G366: 三废处理 | H366: 124.79 | I366: -1.9299999999999998e-002 | J366: 1.5700000000000002e-002 | K366: 8.88 | L366: -6.7000000000000002e-003 | M366: 107.5 | N366: 8.56 | O366: 0.20300000000000001 | P366: 103.74 | Q366: 已到 | R366: 1.85年 | S366: 回售内 | T366: 2.98 | U366: 320 | V366: 0.8590000000000001 | W366: 5.2999999999999999e-002 | X366: 5.5e-002 | Y366: 56 | Z366: 2.29 | AA366: -7.7899999999999997e-002 | AB366: -8.48e-002 | AC366: 回售内 | AD366: 回售内 | AE366: 100.25 | AF366: 100.73 | AG366: 0.55 | AH366: AA | AI366: 3.6000000000000004e-002 | AJ366: =H366+100*O366 -> 145.09 | AK366: 145.8 | AL366: 93 | AM366: 45.1 | AN366: 64 | AO366: 5.2000000000000005e-002 | AP366: 33 | AQ366: 迪龙转债!
A367: 366 | B367: 113017 | C367: 吉视转债! | D367: 601929 | E367: 吉视传媒 | F367: 传媒娱乐 | G367: 影视娱乐 | H367: 124.93 | I367: 1.15e-002 | J367: -8.8000000000000005e-003 | K367: 2.48 | L367: 4.0000000000000001e-003 | M367: 107.5 | N367: 2.23 | O367: 0.12300000000000001 | P367: 111.21 | Q367: 已到 | R367: 1.85年 | S367: 回售内 | T367: 11.4 | U367: 267 | V367: 0.188 | W367: 0.14699999999999999 | X367: 0.16399999999999998 | Y367: 77 | Z367: 1.16 | AA367: -7.85e-002 | AB367: -8.539999999999999e-002 | AC367: 回售内 | AD367: 回售内 | AE367: 100.25 | AF367: 101.63 | AG367: 0.66 | AH367: AA+ | AI367: 3.1e-002 | AJ367: =H367+100*O367 -> 137.23000000000002 | AK367: 138.6 | AL367: 39 | AM367: 37 | AN367: 24 | AO367: -7.400000000000001e-002 | AP367: 70 | AQ367: 吉视转债!
A368: 367 | B368: 128030 | C368: 天康转债!! | D368: 2100 | E368: 天康生物 | F368: 农业 | G368: 畜牧业 | H368: 208.39 | I368: 1.9e-003 | J368: 8.8000000000000005e-003 | K368: 11.93 | L368: 1.1000000000000001e-002 | M368: 109.8 | N368: 7.4 | O368: 0.29299999999999998 | P368: 161.22 | Q368: 已到 | R368: 1.84年 | S368: 回售内 | T368: 0.87 | U368: 19 | V368: 0.106 | W368: 5.0000000000000001e-003 | X368: 9.0000000000000011e-003 | Y368: 162 | Z368: 2.28 | AA368: -0.29600000000000004 | AB368: -0.30299999999999999 | AC368: 回售内 | AD368: 回售内 | AE368: 100.3 | AF368: 102.95 | AG368: 0.97 | AH368: AA | AI368: 3.6000000000000004e-002 | AJ368: =H368+100*O368 -> 237.69 | AK368: 255.6 | AL368: 366 | AM368: 152.6 | AN368: 365 | AO368: 6.7000000000000004e-002 | AP368: 9 | AQ368: 天康转债!!
A369: 368 | B369: 128029 | C369: 太阳转债!! | D369: 2078 | E369: 太阳纸业 | F369: 造纸包装 | G369: 造纸行业 | H369: 153.944 | I369: 4.8999999999999998e-003 | J369: 2.7000000000000001e-003 | K369: 11.6 | L369: 7.8000000000000005e-003 | M369: 106 | N369: 8.45 | O369: 0.121 | P369: 137.28 | Q369: 已到 | R369: 0.84年 | S369: 回售内 | T369: 9.09 | U369: 25 | V369: 1.8000000000000002e-002 | W369: 2.8999999999999998e-002 | X369: 4.0000000000000001e-002 | Y369: 312 | Z369: 1.64 | AA369: -0.35899999999999999 | AB369: -0.36799999999999999 | AC369: 回售内 | AD369: 回售内 | AE369: 100.25 | AF369: 103.65 | AG369: 0.97 | AH369: AA+ | AI369: 2.7099999999999999e-002 | AJ369: =H369+100*O369 -> 166.04399999999998 | AK369: 170.6 | AL369: 304 | AM369: 67 | AN369: 242 | AO369: 5.0000000000000001e-003 | AP369: 7 | AQ369: 太阳转债!!
A370: 369 | B370: 123004 | C370: 铁汉转债! | D370: 300197 | E370: 节能铁汉 | F370: 城市公用 | G370: 生态环境 | H370: 111.729 | I370: 6.8999999999999999e-003 | J370: -6.1999999999999998e-003 | K370: 2.98 | L370: 6.8000000000000005e-003 | M370: 107.5 | N370: 3.82 | O370: 0.43200000000000005 | P370: 78.01 | Q370: 已到 | R370: 1.83年 | S370: 回售内 | T370: 8.03 | U370: 8 | V370: 9.0000000000000011e-003 | W370: 9.5000000000000001e-002 | X370: 7.400000000000001e-002 | Y370: 84 | Z370: 1.31 | AA370: -2.1000000000000001e-002 | AB370: -2.86e-002 | AC370: 回售内 | AD370: 回售内 | AE370: 100.25 | AF370: 100.82 | AG370: 0.12 | AH370: AA | AI370: 3.6000000000000004e-002 | AJ370: =H370+100*O370 -> 154.929 | AK370: 145.4 | AL370: 85 | AM370: 44.6 | AN370: 58 | AO370: 5.2999999999999999e-002 | AP370: 52 | AQ370: 铁汉转债!
A371: 370 | B371: 128026 | C371: 众兴转债! | D371: 2772 | E371: 众兴菌业 | F371: 农业 | G371: 种植业 | H371: 110.403 | I371: 3.7000000000000002e-003 | J371: -3.7000000000000002e-003 | K371: 7.69 | L371: 9.1999999999999998e-003 | M371: 107.8 | N371: 11.36 | O371: 0.63100000000000001 | P371: 67.69 | Q371: 已到 | R371: 1.81年 | S371: 回售内 | T371: 4.09 | U371: 7.4 | V371: 1.6e-002 | W371: 0.13100000000000001 | X371: 8.8000000000000009e-002 | Y371: 31 | Z371: 1.04 | AA371: -1.32e-002 | AB371: -2.1099999999999997e-002 | AC371: 回售内 | AD371: 回售内 | AE371: 100.3 | AF371: 97.58 | AG371: 0 | AH371: AA- | AI371: 5.7000000000000002e-002 | AJ371: =H371+100*O371 -> 173.50300000000001 | AK371: 153.1 | AL371: 174 | AM371: 52.8 | AN371: 126 | AO371: -2.6000000000000002e-002 | AP371: 60 | AQ371: 众兴转债!
A372: 371 | B372: 128025 | C372: 特一转债! | D372: 2728 | E372: 特一药业 | F372: 医药 | G372: 化学制药 | H372: 126.3 | I372: 1.6e-002 | J372: -1.2199999999999999e-002 | K372: 14.48 | L372: 6.3e-003 | M372: 107.5 | N372: 13.8 | O372: 0.20399999999999999 | P372: 104.93 | Q372: 已到 | R372: 1.79年 | S372: 回售内 | T372: 2.98 | U372: 69 | V372: 0.185 | W372: 9.3000000000000013e-002 | X372: 9.6999999999999989e-002 | Y372: 32 | Z372: 2.95 | AA372: -8.6500000000000007e-002 | AB372: -9.35e-002 | AC372: 回售内 | AD372: 回售内 | AE372: 100.25 | AF372: 97.4 | AG372: 0.6 | AH372: AA- | AI372: 5.7000000000000002e-002 | AJ372: =H372+100*O372 -> 146.69999999999999 | AK372: 147.7 | AL372: 113 | AM372: 47.4 | AN372: 83 | AO372: -7.6999999999999999e-002 | AP372: 46 | AQ372: 特一转债!
A373: 372 | B373: 128023 | C373: 亚太转债! | D373: 2284 | E373: 亚太股份 | F373: 汽车 | G373: 零部件制 | H373: 119.35 | I373: -1.4000000000000002e-003 | J373: 1.6000000000000001e-003 | K373: 8.68 | L373: 1.1999999999999999e-003 | M373: 109.8 | N373: 10.34 | O373: 0.42200000000000004 | P373: 83.95 | Q373: 已到 | R373: 1.79年 | S373: 回售内 | T373: 9.99 | U373: 10 | V373: 9.0000000000000011e-003 | W373: 0.156 | X373: 0.13100000000000001 | Y373: 64 | Z373: 2.55 | AA373: -4.5899999999999996e-002 | AB373: -5.5500000000000001e-002 | AC373: 回售内 | AD373: 回售内 | AE373: 100.3 | AF373: 103.13 | AG373: 0.19 | AH373: AA | AI373: 3.6000000000000004e-002 | AJ373: =H373+100*O373 -> 161.55000000000001 | AK373: 154.8 | AL373: 186 | AM373: 51.6 | AN373: 117 | AO373: -9.3000000000000013e-002 | AP373: 52 | AQ373: 亚太转债!
A374: 373 | B374: 128022 | C374: 众信转债! | D374: 2707 | E374: 众信旅游 | F374: 旅游餐饮 | G374: 旅游 | H374: 120.363 | I374: 1.5900000000000001e-002 | J374: -1.3500000000000002e-002 | K374: 7.24 | L374: 5.6000000000000008e-003 | M374: 107.5 | N374: 7.92 | O374: 0.317 | P374: 91.41 | Q374: 已到 | R374: 1.78年 | S374: 回售内 | T374: 4.55 | U374: 86 | V374: 0.157 | W374: 6.9000000000000006e-002 | X374: 6.3e-002 | Y374: 66 | Z374: 12.7 | AA374: -6.1900000000000004e-002 | AB374: -6.93e-002 | AC374: 回售内 | AD374: 回售内 | AE374: 100.25 | AF374: 94.14 | AG374: 0.43 | AH374: A | AI374: 7.8e-002 | AJ374: =H374+100*O374 -> 152.06299999999999 | AK374: 149.3 | AL374: 127 | AM374: 49.1 | AN374: 91 | AO374: 3.9e-002 | AP374: 40 | AQ374: 众信转债!
A375: 374 | B375: 128021 | C375: 兄弟转债!! | D375: 2562 | E375: 兄弟科技 | F375: 医药 | G375: 原料药 | H375: 126.984 | I375: 3.8300000000000001e-002 | J375: -5.5000000000000005e-003 | K375: 5.55 | L375: 3.7400000000000003e-002 | M375: 107.5 | N375: 5.19 | O375: 0.187 | P375: 106.94 | Q375: 已到 | R375: 1.77年 | S375: 回售内 | T375: 2.65 | U375: 89 | V375: 0.27000000000000002 | W375: 4.4999999999999998e-002 | X375: 4.8000000000000001e-002 | Y375: 59 | Z375: 2.01 | AA375: -9.0299999999999991e-002 | AB375: -9.74e-002 | AC375: 回售内 | AD375: 回售内 | AE375: 100.25 | AF375: 101.02 | AG375: 0.88 | AH375: AA | AI375: 3.6000000000000004e-002 | AJ375: =H375+100*O375 -> 145.684 | AK375: 147 | AL375: 105 | AM375: 46 | AN375: 71 | AO375: 4.2999999999999997e-002 | AP375: 20 | AQ375: 兄弟转债!!
A376: 375 | B376: 123002 | C376: 国祯转债!! | D376: 300388 | E376: 节能国祯 | F376: 城市公用 | G376: 三废处理 | H376: 119.997 | I376: 1.9900000000000001e-002 | J376: -1.29e-002 | K376: 7.89 | L376: 1.54e-002 | M376: 107.5 | N376: 8.36 | O376: 0.27100000000000002 | P376: 94.38 | Q376: 已到 | R376: 1.76年 | S376: 回售内 | T376: 2.52 | U376: 8.6 | V376: 2.8999999999999998e-002 | W376: 4.5999999999999999e-002 | X376: 4.2999999999999997e-002 | Y376: 55 | Z376: 1.5 | AA376: -6.0999999999999999e-002 | AB376: -6.8400000000000002e-002 | AC376: 回售内 | AD376: 回售内 | AE376: 100.25 | AF376: 101.06 | AG376: 0.45 | AH376: AA | AI376: 3.6000000000000004e-002 | AJ376: =H376+100*O376 -> 147.09700000000001 | AK376: 145.6 | AL376: 89 | AM376: 44.6 | AN376: 56 | AO376: 5.2999999999999999e-002 | AP376: 20 | AQ376: 国祯转债!!
A377: 376 | B377: 110038 | C377: 济川转债! | D377: 600566 | E377: 济川药业 | F377: 医药 | G377: 中药 | H377: 127.19 | I377: 1.9199999999999998e-002 | J377: -1.9900000000000001e-002 | K377: 23.73 | L377: -1.7000000000000001e-003 | M377: 106 | N377: 23.4 | O377: 0.254 | P377: 101.41 | Q377: 已到 | R377: 0.73年 | S377: 回售内 | T377: 6.27 | U377: 55 | V377: 7.0000000000000007e-002 | W377: 2.9999999999999999e-002 | X377: 2.9999999999999999e-002 | Y377: 211 | Z377: 2.46 | AA377: -0.22 | AB377: -0.23199999999999998 | AC377: 回售内 | AD377: 回售内 | AE377: 101 | AF377: 103.58 | AG377: 0.41 | AH377: AA | AI377: 3.2099999999999997e-002 | AJ377: =H377+100*O377 -> 152.59 | AK377: 153 | AL377: 173 | AM377: 49.4 | AN377: 96 | AO377: -6.0999999999999999e-002 | AP377: 24 | AQ377: 济川转债!
A378: 377 | B378: 113502 | C378: 嘉澳转债! | D378: 603822 | E378: 嘉澳环保 | F378: 化工 | G378: 化工 | H378: 130.08 | I378: 2.8999999999999998e-003 | J378: -1.5e-003 | K378: 47.19 | L378: 2.5000000000000001e-003 | M378: 109.8 | N378: 44.64 | O378: 0.23100000000000001 | P378: 105.71 | Q378: 已到 | R378: 1.72年 | S378: 回售内 | T378: 1.84 | U378: 42 | V378: 0.17499999999999999 | W378: 5.2999999999999999e-002 | X378: 5.5999999999999994e-002 | Y378: 35 | Z378: 4.17 | AA378: -9.4499999999999987e-002 | AB378: -0.10400000000000001 | AC378: 回售内 | AD378: 回售内 | AE378: 100.3 | AF378: 99.89 | AG378: 0.58 | AH378: AA- | AI378: 5.7000000000000002e-002 | AJ378: =H378+100*O378 -> 153.18000000000001 | AK378: 154.4 | AL378: 184 | AM378: 54.1 | AN378: 136 | AO378: -5.7999999999999996e-002 | AP378: 32 | AQ378: 嘉澳转债!
A379: 378 | B379: 113016 | C379: 小康转债!! | D379: 601127 | E379: 小康股份 | F379: 汽车 | G379: 零部件制 | H379: 306.89 | I379: 2.0499999999999997e-002 | J379: 1.1399999999999999e-002 | K379: 45.9 | L379: 3.2199999999999999e-002 | M379: 107.8 | N379: 16.96 | O379: 0.13400000000000001 | P379: 270.64 | Q379: 已到 | R379: 1.71年 | S379: 回售内 | T379: 2.07 | U379: 616 | V379: 0.96799999999999997 | W379: 3.0000000000000001e-003 | X379: 9.0000000000000011e-003 | Y379: 624 | Z379: 8.68 | AA379: -0.45299999999999996 | AB379: -0.45700000000000002 | AC379: 回售内 | AD379: 回售内 | AE379: 100.3 | AF379: 98.13 | AG379: 0.99 | AH379: AA- | AI379: 5.7000000000000002e-002 | AJ379: =H379+100*O379 -> 320.28999999999996 | AK379: 343.1 | AL379: 377 | AM379: 242.8 | AN379: 376 | AO379: -2.e-002 | AP379: 32 | AQ379: 小康转债!!
A380: 379 | B380: 128017 | C380: 金禾转债!! | D380: 2597 | E380: 金禾实业 | F380: 化工 | G380: 化工 | H380: 217.1 | I380: -6.4000000000000003e-003 | J380: -5.1999999999999998e-003 | K380: 41.18 | L380: -1.18e-002 | M380: 107.5 | N380: 21.97 | O380: 0.158 | P380: 187.44 | Q380: 已到 | R380: 1.70年 | S380: 回售内 | T380: 5.52 | U380: 11 | V380: 9.0000000000000011e-003 | W380: 2.4e-002 | X380: 4.4999999999999998e-002 | Y380: 231 | Z380: 4.44 | AA380: -0.34100000000000003 | AB380: -0.34600000000000003 | AC380: 回售内 | AD380: 回售内 | AE380: 100.25 | AF380: 101.28 | AG380: 0.99 | AH380: AA | AI380: 3.6000000000000004e-002 | AJ380: =H380+100*O380 -> 232.90000000000001 | AK380: 246.8 | AL380: 363 | AM380: 145.5 | AN380: 362 | AO380: -1.9e-002 | AP380: 9 | AQ380: 金禾转债!!
A381: 380 | B381: 113013 | C381: 国君转债! | D381: 601211 | E381: 国泰君安 | F381: 金融 | G381: 证券行业 | H381: 121.33 | I381: 1.2500000000000001e-002 | J381: -8.8000000000000005e-003 | K381: 17.59 | L381: 1.03e-002 | M381: 106.8 | N381: 18.45 | O381: 0.27300000000000002 | P381: 95.34 | Q381: 已到 | R381: 1.38年 | S381: 无权 | T381: 69.9 | U381: 57 | V381: 6.9999999999999993e-003 | W381: 4.4999999999999998e-002 | X381: 4.2999999999999997e-002 | Y381: 1567. | Z381: 1.18 | AA381: -8.9399999999999993e-002 | AB381: -9.7699999999999995e-002 | AC381: 无权 | AD381: 无权 | AE381: 无权 | AF381: 102.72 | AG381: 0.36 | AH381: AAA | AI381: 2.8999999999999998e-002 | AJ381: =H381+100*O381 -> 148.63 | AK381: 147.3 | AL381: 109 | AM381: 44.6 | AN381: 57 | AO381: -2.1000000000000001e-002 | AP381: 12 | AQ381: 国君转债!
A382: 381 | B382: 128015 | C382: 久其转债!! | D382: 2279 | E382: 久其软件 | F382: 计算机及 | G382: 软件开发 | H382: 112.4 | I382: 4.3e-003 | J382: -2.0999999999999999e-003 | K382: 5.18 | L382: 2.3700000000000002e-002 | M382: 109.5 | N382: 6.97 | O382: 0.51200000000000001 | P382: 74.32 | Q382: 已到 | R382: 1.30年 | S382: 回售内 | T382: 7.79 | U382: 13 | V382: 1.3999999999999999e-002 | W382: 0.21199999999999999 | X382: 0.157 | Y382: 37 | Z382: 4.6 | AA382: -2.0099999999999996e-002 | AB382: -3.3300000000000003e-002 | AC382: 回售内 | AD382: 回售内 | AE382: 100.25 | AF382: 100.63 | AG382: 0.09 | AH382: A+ | AI382: 6.8000000000000005e-002 | AJ382: =H382+100*O382 -> 163.60000000000002 | AK382: 150.5 | AL382: 143 | AM382: 49.9 | AN382: 100 | AO382: 2.3e-002 | AP382: 73 | AQ382: 久其转债!!
A383: 382 | B383: 127004 | C383: 模塑转债!! | D383: 700 | E383: 模塑科技 | F383: 汽车 | G383: 零部件制 | H383: 160.902 | I383: -3.7000000000000002e-003 | J383: 3.7000000000000002e-003 | K383: 4.8 | L383: 4.1999999999999997e-003 | M383: 111.8 | N383: 7.24 | O383: 1.4299999999999999 | P383: 66.3 | Q383: 已到 | R383: 1.28年 | S383: 回售内 | T383: 1.31 | U383: 26 | V383: 0.12300000000000001 | W383: 2.9999999999999999e-002 | X383: 2.e-002 | Y383: 44 | Z383: 1.94 | AA383: -0.25 | AB383: -0.26200000000000001 | AC383: 回售内 | AD383: 回售内 | AE383: 100.3 | AF383: 101.29 | AG383: 0 | AH383: AA- | AI383: 5.7000000000000002e-002 | AJ383: =H383+100*O383 -> 303.90199999999999 | AK383: 255.5 | AL383: 365 | AM383: 154.2 | AN383: 366 | AO383: -6.0000000000000001e-003 | AP383: 24 | AQ383: 模塑转债!!
A384: 383 | B384: 128014 | C384: 永东转债! | D384: 2753 | E384: 永东股份 | F384: 化工 | G384: 化工 | H384: 114.549 | I384: 1.29e-002 | J384: -1.2199999999999999e-002 | K384: 9.28 | L384: 1.2e-002 | M384: 109.8 | N384: 12.52 | O384: 0.54500000000000004 | P384: 74.12 | Q384: 已到 | R384: 1年57天 | S384: 回售内 | T384: 3.37 | U384: 3.9 | V384: 1.e-002 | W384: 9.6999999999999989e-002 | X384: 7.2000000000000008e-002 | Y384: 35 | Z384: 1.67 | AA384: -3.6499999999999998e-002 | AB384: -5.1399999999999994e-002 | AC384: 回售内 | AD384: 回售内 | AE384: 100.3 | AF384: 103.08 | AG384: 0.06 | AH384: AA- | AI384: 5.7000000000000002e-002 | AJ384: =H384+100*O384 -> 169.04900000000001 | AK384: 155 | AL384: 190 | AM384: 51.9 | AN384: 120 | AO384: 1.3999999999999999e-002 | AP384: 39 | AQ384: 永东转债!
A385: 384 | B385: 113011 | C385: 光大转债 | D385: 601818 | E385: 光大银行 | F385: 金融 | G385: 银行行业 | H385: 112.7 | I385: 2.e-003 | J385: -2.e-003 | K385: 3.44 | L385: 0. | M385: 106.8 | N385: 3.55 | O385: 0.16300000000000001 | P385: 96.9 | Q385: 已到 | R385: 1年26天 | S385: 无权 | T385: 242 | U385: 228 | V385: 8.0000000000000002e-003 | W385: 0.13 | X385: 0.126 | Y385: 1859. | Z385: 0.51 | AA385: -4.9699999999999994e-002 | AB385: -6.0999999999999999e-002 | AC385: 无权 | AD385: 无权 | AE385: 无权 | AF385: 103.63 | AG385: 0.36 | AH385: AAA | AI385: 2.8999999999999998e-002 | AJ385: =H385+100*O385 -> 129. | AK385: 128.5 | AL385: 6 | AM385: 24.9 | AN385: 5 | AO385: 6.9999999999999993e-003 | AP385: 21 | AQ385: 光大转债
A386: 385 | B386: 128013 | C386: 洪涛转债! | D386: 2325 | E386: 洪涛股份 | F386: 建筑 | G386: 装饰工程 | H386: 120.94 | I386: 1.2e-002 | J386: 4.0000000000000001e-003 | K386: 2.76 | L386: 1.8500000000000003e-002 | M386: 108 | N386: 2.31 | O386: 1.2e-002 | P386: 119.48 | Q386: 已到 | R386: 0.44年 | S386: 回售内 | T386: 10.1 | U386: 104 | V386: 8.5999999999999993e-002 | W386: 0.27600000000000002 | X386: 0.32899999999999996 | Y386: 37 | Z386: 1.24 | AA386: -0.22699999999999998 | AB386: -0.253 | AC386: 回售内 | AD386: 回售内 | AE386: 100.33 | AF386: 102.2 | AG386: 0.87 | AH386: BB | AI386: 0.13419999999999999 | AJ386: =H386+100*O386 -> 122.14 | AK386: 122.4 | AL386: 3 | AM386: 20.2 | AN386: 2 | AO386: 2.7000000000000003e-002 | AP386: 100 | AQ386: 洪涛转债!
A387: 386 | B387: 127003 | C387: 海印转债! | D387: 861 | E387: 海印股份 | F387: 商业零售 | G387: 商场 | H387: 119.301 | I387: 1.5300000000000001e-002 | J387: -6.7000000000000002e-003 | K387: 3.15 | L387: 2.6099999999999998e-002 | M387: 110 | N387: 2.99 | O387: 0.13200000000000001 | P387: 105.35 | Q387: 已到 | R387: 0.30年 | S387: 回售内 | T387: 6.74 | U387: 62 | V387: 7.6999999999999999e-002 | W387: 9.1999999999999998e-002 | X387: 9.6999999999999989e-002 | Y387: 73 | Z387: 2 | AA387: -0.23800000000000002 | AB387: -0.28300000000000003 | AC387: 回售内 | AD387: 回售内 | AE387: 100.33 | AF387: 108.96 | AG387: 0.33 | AH387: AA | AI387: 3.2199999999999999e-002 | AJ387: =H387+100*O387 -> 132.501 | AK387: 133.3 | AL387: 9 | AM387: 24.3 | AN387: 4 | AO387: 0.105 | AP387: 76 | AQ387: 海印转债!