A1: 序号 | B1: 转债代码 | C1: 转债名称 | D1: 股票代码 | E1: 股票名称 | F1: 行业 | G1: 子行业 | H1: 转债价格 | I1: 涨跌 | J1: 日内套利 | K1: 股价 | L1: 涨跌 | M1: 剩余本息 | N1: 转股价格 | O1: 转股溢价率 | P1: 转股价值 | Q1: 距离转股日 | R1: 剩余年限 | S1: 回售年限 | T1: 转债余额 | U1: 转债成交额 | V1: 转债换手率 | W1: 余额/市值 | X1: 余额/股本 | Y1: 股票市值 | Z1: P/B | AA1: 税前收益率 | AB1: 税后收益率 | AC1: 税前回售收益 | AD1: 税后回售收益 | AE1: 回售价值 | AF1: 纯债价值 | AG1: 弹性 | AH1: 信用 | AI1: 折现率 | AJ1: 双低 | AK1: 老式双低 | AL1: 老式排名 | AM1: 新式双低 | AN1: 新式排名 | AO1: MA20乖离 | AP1: 热门度 | AQ1: 转债名称
A2: 221 | B2: 128062 | C2: 亚药转债! | D2: 2370 | E2: 亚太药业 | F2: 医药 | G2: 化学制药 | H2: 72.72 | I2: -4.0000000000000001e-003 | J2: 4.0000000000000001e-003 | K2: 4.48 | L2: 6.7000000000000002e-003 | M2: 119.8 | N2: 16.25 | O2: 1.6399999999999999 | P2: 27.57 | Q2: 转股中 | R2: 4.35年 | S2: 2.35年 | T2: 9.64 | U2: 8 | V2: 1.1000000000000001e-002 | W2: 0.40100000000000002 | X2: 0.111 | Y2: 24 | Z2: 7.47 | AA2: 0.125 | AB2: 0.115 | AC2: 0.152 | AD2: 0.14800000000000002 | AE2: 82.18 | AF2: 80.97 | AG2: 0 | AH2: A- | AI2: 9.64e-002 | AJ2: =H2+100*O2 -> 236.72 | AK2: 117.9 | AL2: 6 | AM2: 35.7 | AN2: 71 | AO2: -5.0000000000000001e-003 | AP2: 86 | AQ2: 亚药转债!
A3: 75 | B3: 127018 | C3: 本钢转债! | D3: 761 | E3: 本钢板材 | F3: 钢铁 | G3: 炼钢 | H3: 84.336 | I3: -1.2999999999999999e-003 | J3: 3.2000000000000002e-003 | K3: 3.38 | L3: 9.0000000000000011e-003 | M3: 128.6 | N3: 5.03 | O3: 0.255 | P3: 67.2 | Q3: 38天 | R3: 5.59年 | S3: 3.59年 | T3: 68 | U3: 91 | V3: 1.6e-002 | W3: 0.51900000000000002 | X3: 0.34899999999999998 | Y3: 131 | Z3: 0.66 | AA3: 8.1099999999999992e-002 | AB3: 7.1599999999999997e-002 | AC3: 6.5000000000000002e-002 | AD3: 6.13e-002 | AE3: 88.52 | AF3: 98.16 | AG3: 0.2 | AH3: AAA | AI3: 5.1100000000000007e-002 | AJ3: =H3+100*O3 -> 109.836 | AK3: 101.5 | AL3: 1 | AM3: 3.3 | AN3: 1 | AO3: 2.3e-002 | AP3: 38 | AQ3: 本钢转债!
A4: 240 | B4: 113527 | C4: 维格转债! | D4: 603518 | E4: 锦泓集团 | F4: 服装纺织 | G4: 服装行业 | H4: 91.3 | I4: -1.7600000000000001e-002 | J4: 1.6899999999999998e-002 | K4: 6.24 | L4: -6.4000000000000003e-003 | M4: 120.2 | N4: 9.85 | O4: 0.441 | P4: 63.35 | Q4: 转股中 | R4: 4年58天 | S4: 2年58天 | T4: 7.46 | U4: 52 | V4: 7.5999999999999998e-002 | W4: 0.47399999999999998 | X4: 0.29999999999999999 | Y4: 16 | Z4: 1 | AA4: 7.0000000000000007e-002 | AB4: 6.08e-002 | AC4: 5.6299999999999996e-002 | AD4: 5.2999999999999999e-002 | AE4: 91.68 | AF4: 96.91 | AG4: 0.12 | AH4: AA | AI4: 5.4400000000000004e-002 | AJ4: =H4+100*O4 -> 135.40000000000001 | AK4: 119.2 | AL4: 12 | AM4: 22.3 | AN4: 9 | AO4: 5.5999999999999994e-002 | AP4: 100 | AQ4: 维格转债!
A5: 294 | B5: 128023 | C5: 亚太转债! | D5: 2284 | E5: 亚太股份 | F5: 汽车 | G5: 零部件制 | H5: 97.613 | I5: 3.2000000000000002e-003 | J5: 5.0000000000000001e-004 | K5: 6.45 | L5: 6.2600000000000003e-002 | M5: 112.3 | N5: 10.34 | O5: 0.56499999999999995 | P5: 62.38 | Q5: 转股中 | R5: 3年7天 | S5: 1年7天 | T5: 9.99 | U5: 54 | V5: 5.5e-002 | W5: 0.20999999999999999 | X5: 0.13100000000000001 | Y5: 48 | Z5: 1.96 | AA5: 4.87e-002 | AB5: 4.07e-002 | AC5: 4.5199999999999997e-002 | AD5: 4.0199999999999993e-002 | AE5: 97.7 | AF5: 98.81 | AG5: 0.06 | AH5: AA | AI5: 4.4400000000000002e-002 | AJ5: =H5+100*O5 -> 154.113 | AK5: 132.8 | AL5: 138 | AM5: 34 | AN5: 54 | AO5: 0.14099999999999999 | AP5: 65 | AQ5: 亚太转债!
A6: 64 | B6: 127019 | C6: 国城转债! | D6: 688 | E6: 国城矿业 | F6: 有色金属 | G6: 锌铅镍锡 | H6: 90.618 | I6: -5.0000000000000001e-003 | J6: 5.4000000000000003e-003 | K6: 10.75 | L6: 5.6000000000000008e-003 | M6: 115.1 | N6: 21.07 | O6: 0.77599999999999991 | P6: 51.02 | Q6: 55天 | R6: 5.63年 | S6: 3.63年 | T6: 8.5 | U6: 7.6 | V6: 1.e-002 | W6: 7.0000000000000007e-002 | X6: 3.5000000000000003e-002 | Y6: 122 | Z6: 5.53 | AA6: 4.4199999999999996e-002 | AB6: 3.9100000000000003e-002 | AC6: 3.6200000000000003e-002 | AD6: 3.4200000000000001e-002 | AE6: 87.43 | AF6: 89.72 | AG6: 0.08 | AH6: AA | AI6: 4.6100000000000002e-002 | AJ6: =H6+100*O6 -> 168.21799999999999 | AK6: 130.2 | AL6: 105 | AM6: 40.5 | AN6: 122 | AO6: -1.1000000000000001e-002 | AP6: 27 | AQ6: 国城转债!
A7: 275 | B7: 128037 | C7: 岩土转债! | D7: 2542 | E7: 中化岩土 | F7: 建筑 | G7: 建筑工程 | H7: 97.914 | I7: -8.9999999999999998e-004 | J7: 8.9999999999999998e-004 | K7: 3.45 | L7: 5.7999999999999996e-003 | M7: 112.3 | N7: 7.99 | O7: 1.27 | P7: 43.18 | Q7: 转股中 | R7: 3.30年 | S7: 1.30年 | T7: 5.99 | U7: 1.7 | V7: 3.0000000000000001e-003 | W7: 9.6000000000000002e-002 | X7: 4.2000000000000003e-002 | Y7: 62 | Z7: 1.53 | AA7: 4.3400000000000001e-002 | AB7: 3.61e-002 | AC7: 3.4200000000000001e-002 | AD7: 3.0200000000000001e-002 | AE7: 96.53 | AF7: 97.61 | AG7: 0 | AH7: AA | AI7: 4.4400000000000002e-002 | AJ7: =H7+100*O7 -> 224.91399999999999 | AK7: 152.6 | AL7: 267 | AM7: 55 | AN7: 232 | AO7: 8.0000000000000002e-003 | AP7: 48 | AQ7: 岩土转债!
A8: 306 | B8: 128015 | C8: 久其转债! | D8: 2279 | E8: 久其软件 | F8: 计算机及 | G8: 软件开发 | H8: 100.187 | I8: 8.0000000000000004e-004 | J8: -8.0000000000000004e-004 | K8: 5.33 | L8: -1.9e-003 | M8: 110.8 | N8: 9.48 | O8: 0.78200000000000003 | P8: 56.22 | Q8: 转股中 | R8: 2.53年 | S8: 0.53年 | T8: 7.8 | U8: 3 | V8: 4.0000000000000001e-003 | W8: 0.20600000000000002 | X8: 0.11599999999999999 | Y8: 38 | Z8: 5.37 | AA8: 4.1299999999999996e-002 | AB8: 3.3000000000000002e-002 | AC8: 1.9699999999999999e-002 | AD8: 1.52e-002 | AE8: 96.53 | AF8: 92.37 | AG8: 0 | AH8: A+ | AI8: 7.5800000000000006e-002 | AJ8: =H8+100*O8 -> 178.387 | AK8: 144.2 | AL8: 234 | AM8: 47.6 | AN8: 188 | AO8: -1.e-002 | AP8: 55 | AQ8: 久其转债!
A9: 219 | B9: 128063 | C9: 未来转债 | D9: 2631 | E9: 德尔未来 | F9: 其他 | G9: 家居用品 | H9: 108.5 | I9: 8.0000000000000004e-004 | J9: -2.7000000000000001e-003 | K9: 7.13 | L9: -5.6000000000000008e-003 | M9: 128.2 | N9: 8.63 | O9: 0.313 | P9: 82.62 | Q9: 转股中 | R9: 4.35年 | S9: 3.35年 | T9: 6.3 | U9: 1.4 | V9: 2.e-003 | W9: 0.13300000000000001 | X9: 0.11 | Y9: 47 | Z9: 2.71 | AA9: 4.0300000000000002e-002 | AB9: 2.9100000000000001e-002 | AC9: 1.e-003 | AD9: -3.8e-003 | AE9: 87.61 | AF9: 98.14 | AG9: 0.34 | AH9: AA- | AI9: 6.54e-002 | AJ9: =H9+100*O9 -> 139.80000000000001 | AK9: 134.4 | AL9: 151 | AM9: 36.2 | AN9: 80 | AO9: 1.9e-002 | AP9: 34 | AQ9: 未来转债
A10: 285 | B10: 113017 | C10: 吉视转债! | D10: 601929 | E10: 吉视传媒 | F10: 传媒娱乐 | G10: 影视娱乐 | H10: 97.75 | I10: 1.7000000000000001e-003 | J10: -1.7000000000000001e-003 | K10: 2.07 | L10: 0. | M10: 109.8 | N10: 2.95 | O10: 0.39299999999999996 | P10: 70.17 | Q10: 转股中 | R10: 3年30天 | S10: 1年30天 | T10: 15.6 | U10: 6.2 | V10: 4.0000000000000001e-003 | W10: 0.24199999999999999 | X10: 0.17000000000000001 | Y10: 64 | Z10: 0.97 | AA10: 3.9300000000000002e-002 | AB10: 3.3000000000000002e-002 | AC10: 3.9599999999999996e-002 | AD10: 3.5299999999999998e-002 | AE10: 97.42 | AF10: 96.88 | AG10: 0.11 | AH10: AA+ | AI10: 4.24e-002 | AJ10: =H10+100*O10 -> 137.05000000000001 | AK10: 125.3 | AL10: 32 | AM10: 27.9 | AN10: 17 | AO10: -8.0000000000000002e-003 | AP10: 53 | AQ10: 吉视转债!
A11: 224 | B11: 113530 | C11: 大丰转债! | D11: 603081 | E11: 大丰实业 | F11: 建筑 | G11: 装饰工程 | H11: 103.49 | I11: -4.7999999999999996e-003 | J11: 6.5000000000000006e-003 | K11: 11.79 | L11: 1.11e-002 | M11: 121.6 | N11: 16.64 | O11: 0.46100000000000002 | P11: 70.85 | Q11: 转股中 | R11: 4.33年 | S11: 2.33年 | T11: 6.3 | U11: 5.6 | V11: 9.0000000000000011e-003 | W11: 0.13300000000000001 | X11: 9.4e-002 | Y11: 47 | Z11: 2.31 | AA11: 3.8800000000000001e-002 | AB11: 2.98e-002 | AC11: 1.e-004 | AD11: -2.5999999999999999e-003 | AE11: 92.99 | AF11: 101.16 | AG11: 0.15 | AH11: AA | AI11: 4.4400000000000002e-002 | AJ11: =H11+100*O11 -> 149.59 | AK11: 136.1 | AL11: 171 | AM11: 35 | AN11: 61 | AO11: 2.1000000000000001e-002 | AP11: 34 | AQ11: 大丰转债!
A12: 106 | B12: 113573 | C12: 纵横转债! | D12: 603602 | E12: 纵横通信 | F12: 通信互联 | G12: 通信设备 | H12: 102.7 | I12: -7.4999999999999997e-003 | J12: 7.0999999999999995e-003 | K12: 12.95 | L12: -1.5e-003 | M12: 124.7 | N12: 18.81 | O12: 0.49200000000000005 | P12: 68.85 | Q12: 转股中 | R12: 5.39年 | S12: 3.39年 | T12: 2.7 | U12: 53 | V12: 0.191 | W12: 0.10199999999999999 | X12: 7.0000000000000007e-002 | Y12: 26 | Z12: 3.91 | AA12: 3.7599999999999995e-002 | AB12: 2.9500000000000002e-002 | AC12: 5.3e-003 | AD12: 2.7000000000000001e-003 | AE12: 80.37 | AF12: 83.99 | AG12: 0.32 | AH12: A+ | AI12: 7.8100000000000003e-002 | AJ12: =H12+100*O12 -> 151.90000000000001 | AK12: 136.6 | AL12: 174 | AM12: 52.6 | AN12: 220 | AO12: 9.1999999999999998e-002 | AP12: 17 | AQ12: 纵横转债!
A13: 266 | B13: 110045 | C13: 海澜转债! | D13: 600398 | E13: 海澜之家 | F13: 服装纺织 | G13: 服装行业 | H13: 97.53 | I13: -2.9999999999999997e-004 | J13: 0. | K13: 6.75 | L13: -5.8999999999999999e-003 | M13: 111.1 | N13: 11.75 | O13: 0.69799999999999995 | P13: 57.45 | Q13: 转股中 | R13: 3.62年 | S13: 1.62年 | T13: 29.5 | U13: 7.8 | V13: 3.0000000000000001e-003 | W13: 0.10099999999999999 | X13: 5.7999999999999996e-002 | Y13: 292 | Z13: 2.3 | AA13: 3.7100000000000001e-002 | AB13: 3.1200000000000002e-002 | AC13: 2.5600000000000001e-002 | AD13: 2.3300000000000001e-002 | AE13: 94.75 | AF13: 95.78 | AG13: 0.04 | AH13: AA+ | AI13: 4.24e-002 | AJ13: =H13+100*O13 -> 167.32999999999998 | AK13: 137.6 | AL13: 181 | AM13: 41.8 | AN13: 133 | AO13: -1.e-002 | AP13: 60 | AQ13: 海澜转债!
A14: 134 | B14: 113569 | C14: 科达转债! | D14: 603660 | E14: 苏州科达 | F14: 通信互联 | G14: 物联网 | H14: 100.71 | I14: 4.0000000000000002e-004 | J14: -5.9999999999999995e-004 | K14: 8.31 | L14: -1.1999999999999999e-003 | M14: 120.7 | N14: 14.84 | O14: 0.79799999999999993 | P14: 56 | Q14: 转股中 | R14: 5.28年 | S14: 3.28年 | T14: 5.16 | U14: 1.4 | V14: 3.0000000000000001e-003 | W14: 0.124 | X14: 7.0000000000000007e-002 | Y14: 41 | Z14: 2.43 | AA14: 3.5699999999999996e-002 | AB14: 2.86e-002 | AC14: 9.5999999999999992e-003 | AD14: 7.3000000000000001e-003 | AE14: 83.4 | AF14: 86.32 | AG14: 0.13 | AH14: AA- | AI14: 6.7099999999999993e-002 | AJ14: =H14+100*O14 -> 180.50999999999999 | AK14: 145.4 | AL14: 237 | AM14: 59.1 | AN14: 250 | AO14: -1.6e-002 | AP14: 23 | AQ14: 科达转债!
A15: 77 | B15: 113589 | C15: 天创转债! | D15: 603608 | E15: 天创时尚 | F15: 服装纺织 | G15: 鞋服行业 | H15: 95.94 | I15: -8.0000000000000004e-004 | J15: -7.000000000000001e-004 | K15: 7.32 | L15: -1.0800000000000001e-002 | M15: 115.3 | N15: 12.44 | O15: 0.63 | P15: 58.84 | Q15: 36天 | R15: 5.57年 | S15: 3.57年 | T15: 6 | U15: 4.8 | V15: 8.0000000000000002e-003 | W15: 0.191 | X15: 0.11199999999999999 | Y15: 31 | Z15: 1.48 | AA15: 3.4200000000000001e-002 | AB15: 2.8999999999999998e-002 | AC15: 2.1499999999999998e-002 | AD15: 1.9400000000000001e-002 | AE15: 87.85 | AF15: 90.14 | AG15: 0.14 | AH15: AA | AI15: 4.6100000000000002e-002 | AJ15: =H15+100*O15 -> 158.94 | AK15: 133 | AL15: 140 | AM15: 42.9 | AN15: 139 | AO15: -6.3e-002 | AP15: 11 | AQ15: 天创转债!
A16: 73 | B16: 113591 | C16: 胜达转债! | D16: 603687 | E16: 大胜达 | F16: 造纸包装 | G16: 包装用纸 | H16: 101.8 | I16: 1.e-003 | J16: -1.6000000000000001e-003 | K16: 10.28 | L16: -1.9e-003 | M16: 122.2 | N16: 14.73 | O16: 0.45899999999999996 | P16: 69.79 | Q16: 42天 | R16: 5.59年 | S16: 3.59年 | T16: 5.5 | U16: 0.8 | V16: 1.e-003 | W16: 0.13 | X16: 9.0999999999999998e-002 | Y16: 42 | Z16: 2.72 | AA16: 3.39e-002 | AB16: 2.6800000000000001e-002 | AC16: 6.0999999999999995e-003 | AD16: 3.9000000000000003e-003 | AE16: 81.8 | AF16: 85.66 | AG16: 0.32 | AH16: AA- | AI16: 6.7099999999999993e-002 | AJ16: =H16+100*O16 -> 147.69999999999999 | AK16: 133.8 | AL16: 145 | AM16: 48.1 | AN16: 193 | AO16: -3.7999999999999999e-002 | AP16: 19 | AQ16: 胜达转债!
A17: 234 | B17: 110052 | C17: 贵广转债! | D17: 600996 | E17: 贵广网络 | F17: 传媒娱乐 | G17: 影视娱乐 | H17: 103.7 | I17: 6.6e-003 | J17: -6.6e-003 | K17: 6.28 | L17: 0. | M17: 118.5 | N17: 7.94 | O17: 0.311 | P17: 79.09 | Q17: 转股中 | R17: 4.27年 | S17: 2.27年 | T17: 15.3 | U17: 29 | V17: 1.9e-002 | W17: 0.23100000000000001 | X17: 0.183 | Y17: 66 | Z17: 1.46 | AA17: 3.2500000000000001e-002 | AB17: 2.46e-002 | AC17: 5.0000000000000001e-004 | AD17: -2.5000000000000001e-003 | AE17: 93.97 | AF17: 99.67 | AG17: 0.26 | AH17: AA+ | AI17: 4.24e-002 | AJ17: =H17+100*O17 -> 134.80000000000001 | AK17: 128.3 | AL17: 83 | AM17: 28.6 | AN17: 20 | AO17: -5.0000000000000001e-003 | AP17: 19 | AQ17: 贵广转债!
A18: 209 | B18: 113535 | C18: 大业转债! | D18: 603278 | E18: 大业股份 | F18: 汽车 | G18: 零部件制 | H18: 101.52 | I18: -1.1999999999999999e-003 | J18: 1.7000000000000001e-003 | K18: 8.51 | L18: 3.4999999999999996e-003 | M18: 113.1 | N18: 12.4 | O18: 0.47899999999999998 | P18: 68.63 | Q18: 转股中 | R18: 3.45年 | S18: 1.45年 | T18: 5 | U18: 1.4 | V18: 3.0000000000000001e-003 | W18: 0.20300000000000001 | X18: 0.13900000000000001 | Y18: 25 | Z18: 1.51 | AA18: 3.2300000000000002e-002 | AB18: 2.5099999999999997e-002 | AC18: 2.e-003 | AD18: -2.0000000000000001e-004 | AE18: 94.99 | AF18: 97.57 | AG18: 0.14 | AH18: AA | AI18: 4.4400000000000002e-002 | AJ18: =H18+100*O18 -> 149.41999999999999 | AK18: 134.4 | AL18: 152 | AM18: 36.8 | AN18: 90 | AO18: 1.7000000000000001e-002 | AP18: 48 | AQ18: 大业转债!
A19: 26 | B19: 128132 | C19: 交建转债! | D19: 2941 | E19: 新疆交建 | F19: 建筑 | G19: 建筑工程 | H19: 98.601 | I19: -1.e-004 | J19: -2.8999999999999998e-003 | K19: 13.18 | L19: -1.1299999999999999e-002 | M19: 117.3 | N19: 18.57 | O19: 0.38900000000000001 | P19: 70.97 | Q19: 3月25天 | R19: 5.80年 | S19: 3.80年 | T19: 8.5 | U19: 5.8 | V19: 6.9999999999999993e-003 | W19: 0.10000000000000001 | X19: 7.0999999999999994e-002 | Y19: 85 | Z19: 3.51 | AA19: 3.1e-002 | AB19: 2.5499999999999998e-002 | AC19: 1.32e-002 | AD19: 1.1200000000000002e-002 | AE19: 86.95 | AF19: 90.76 | AG19: 0.27 | AH19: AA | AI19: 4.6100000000000002e-002 | AJ19: =H19+100*O19 -> 137.501 | AK19: 126.2 | AL19: 45 | AM19: 35.5 | AN19: 68 | AO19: -2.1000000000000001e-002 | AP19: 9 | AQ19: 交建转债!
A20: 39 | B20: 113600 | C20: 新星转债! | D20: 603978 | E20: 深圳新星 | F20: 有色金属 | G20: 有色行业 | H20: 106.46 | I20: -2.2000000000000001e-003 | J20: -4.0999999999999995e-003 | K20: 19.42 | L20: -1.4199999999999999e-002 | M20: 126 | N20: 23.85 | O20: 0.307 | P20: 81.43 | Q20: 2月24天 | R20: 5.71年 | S20: 3.71年 | T20: 5.95 | U20: 0.9 | V20: 1.e-003 | W20: 0.191 | X20: 0.156 | Y20: 31 | Z20: 2.04 | AA20: 3.0499999999999999e-002 | AB20: 2.2700000000000001e-002 | AC20: -6.3e-003 | AD20: -8.199999999999999e-003 | AE20: 80.99 | AF20: 87.58 | AG20: 0.44 | AH20: AA- | AI20: 6.7099999999999993e-002 | AJ20: =H20+100*O20 -> 137.16 | AK20: 131.5 | AL20: 122 | AM20: 43.9 | AN20: 147 | AO20: -3.0000000000000001e-003 | AP20: 11 | AQ20: 新星转债!
A21: 255 | B21: 113519 | C21: 长久转债! | D21: 603569 | E21: 长久物流 | F21: 交通运输 | G21: 物流业 | H21: 106.2 | I21: -1.0200000000000001e-002 | J21: 8.3999999999999995e-003 | K21: 8.65 | L21: -8.0000000000000002e-003 | M21: 119.3 | N21: 11.15 | O21: 0.36899999999999999 | P21: 77.58 | Q21: 转股中 | R21: 3.95年 | S21: 1.95年 | T21: 6.97 | U21: 3.3 | V21: 4.0000000000000001e-003 | W21: 0.14400000000000002 | X21: 0.11199999999999999 | Y21: 48 | Z21: 2.28 | AA21: 3.04e-002 | AB21: 2.1700000000000001e-002 | AC21: -1.54e-002 | AD21: -1.7899999999999999e-002 | AE21: 93.85 | AF21: 100.8 | AG21: 0.22 | AH21: AA | AI21: 4.4400000000000002e-002 | AJ21: =H21+100*O21 -> 143.09999999999999 | AK21: 134.8 | AL21: 157 | AM21: 34 | AN21: 53 | AO21: -1.7000000000000001e-002 | AP21: 16 | AQ21: 长久转债!
A22: 71 | B22: 128117 | C22: 道恩转债 | D22: 2838 | E22: 道恩股份 | F22: 化工 | G22: 橡胶塑料 | H22: 105.3 | I22: -2.0000000000000001e-004 | J22: -1.2199999999999999e-002 | K22: 22.8 | L22: -2.9399999999999999e-002 | M22: 123.5 | N22: 29.07 | O22: 0.34299999999999997 | P22: 78.43 | Q22: 42天 | R22: 5.59年 | S22: 3.59年 | T22: 3.6 | U22: 17 | V22: 4.4000000000000004e-002 | W22: 3.9e-002 | X22: 2.9999999999999999e-002 | Y22: 93 | Z22: 5.39 | AA22: 2.9500000000000002e-002 | AB22: 2.2099999999999998e-002 | AC22: -3.8e-003 | AD22: -5.6999999999999993e-003 | AE22: 81.53 | AF22: 86.48 | AG22: 0.42 | AH22: AA- | AI22: 6.7099999999999993e-002 | AJ22: =H22+100*O22 -> 139.59999999999999 | AK22: 132.2 | AL22: 133 | AM22: 45.7 | AN22: 165 | AO22: -0.13900000000000001 | AP22: 16 | AQ22: 道恩转债
A23: 182 | B23: 110059 | C23: 浦发转债! | D23: 600000 | E23: 浦发银行 | F23: 金融 | G23: 银行行业 | H23: 102.36 | I23: 3.5999999999999999e-003 | J23: 1.e-003 | K23: 10.2 | L23: 2.2000000000000002e-002 | M23: 117.6 | N23: 14.45 | O23: 0.45000000000000001 | P23: 70.59 | Q23: 转股中 | R23: 4.92年 | S23: 无权 | T23: 500 | U23: 131 | V23: 3.0000000000000001e-003 | W23: 0.16699999999999998 | X23: 0.11800000000000001 | Y23: 2994. | Z23: 0.59 | AA23: 2.9399999999999999e-002 | AB23: 2.2799999999999997e-002 | AC23: 无权 | AD23: 无权 | AE23: 无权 | AF23: 97.74 | AG23: 0.21 | AH23: AAA | AI23: 3.9399999999999998e-002 | AJ23: =H23+100*O23 -> 147.36000000000001 | AK23: 134.1 | AL23: 147 | AM23: 36.4 | AN23: 83 | AO23: 6.9000000000000006e-002 | AP23: 76 | AQ23: 浦发转债!
A24: 257 | B24: 128044 | C24: 岭南转债! | D24: 2717 | E24: 岭南股份 | F24: 城市公用 | G24: 生态环境 | H24: 100.2 | I24: 1.9e-003 | J24: 0. | K24: 4.08 | L24: 1.24e-002 | M24: 111.3 | N24: 5.91 | O24: 0.45100000000000001 | P24: 69.04 | Q24: 转股中 | R24: 3.71年 | S24: 1.71年 | T24: 6.59 | U24: 1.8 | V24: 3.0000000000000001e-003 | W24: 0.106 | X24: 7.2999999999999995e-002 | Y24: 62 | Z24: 1.27 | AA24: 2.9300000000000003e-002 | AB24: 2.3399999999999997e-002 | AC24: 1.38e-002 | AD24: 1.0800000000000001e-002 | AE24: 94.8 | AF24: 95.01 | AG24: 0.16 | AH24: AA | AI24: 4.4400000000000002e-002 | AJ24: =H24+100*O24 -> 145.30000000000001 | AK24: 131.4 | AL24: 119 | AM24: 36.4 | AN24: 82 | AO24: 1.7000000000000001e-002 | AP24: 32 | AQ24: 岭南转债!
A25: 160 | B25: 110064 | C25: 建工转债! | D25: 600939 | E25: 重庆建工 | F25: 建筑 | G25: 建筑工程 | H25: 104.32 | I25: 3.0999999999999999e-003 | J25: 5.1999999999999998e-003 | K25: 3.94 | L25: 2.07e-002 | M25: 120.2 | N25: 4.57 | O25: 0.20999999999999999 | P25: 86.21 | Q25: 转股中 | R25: 5年23天 | S25: 3年23天 | T25: 16.6 | U25: 96 | V25: 5.5999999999999994e-002 | W25: 0.23199999999999998 | X25: 0.20000000000000001 | Y25: 71 | Z25: 1.04 | AA25: 2.9100000000000001e-002 | AB25: 2.1899999999999999e-002 | AC25: 5.9999999999999995e-004 | AD25: -2.0999999999999999e-003 | AE25: 91.09 | AF25: 97.13 | AG25: 0.4 | AH25: AA+ | AI25: 4.41e-002 | AJ25: =H25+100*O25 -> 125.31999999999999 | AK25: 122.4 | AL25: 18 | AM25: 25.3 | AN25: 12 | AO25: 2.6000000000000002e-002 | AP25: 48 | AQ25: 建工转债!
A26: 150 | B26: 128093 | C26: 百川转债! | D26: 2455 | E26: 百川股份 | F26: 化工 | G26: 化工 | H26: 113.19 | I26: 6.0000000000000001e-003 | J26: 1.e-003 | K26: 5.65 | L26: 1.2500000000000001e-002 | M26: 130.3 | N26: 5.87 | O26: 0.17600000000000002 | P26: 96.25 | Q26: 转股中 | R26: 5年37天 | S26: 3年37天 | T26: 5.2 | U26: 11 | V26: 1.9e-002 | W26: 0.17800000000000002 | X26: 0.17100000000000001 | Y26: 29 | Z26: 2.26 | AA26: 2.8999999999999998e-002 | AB26: 1.9e-002 | AC26: -1.6299999999999999e-002 | AD26: -2.0499999999999997e-002 | AE26: 87.22 | AF26: 94.7 | AG26: 0.56 | AH26: AA- | AI26: 6.7099999999999993e-002 | AJ26: =H26+100*O26 -> 130.78999999999999 | AK26: 130.1 | AL26: 103 | AM26: 35.4 | AN26: 67 | AO26: 5.5e-002 | AP26: 46 | AQ26: 百川转债!
A27: 17 | B27: 123069 | C27: 金诺转债 | D27: 300505 | E27: 川金诺 | F27: 化工 | G27: 农化 | H27: 106.824 | I27: -2.e-003 | J27: -1.e-004 | K27: 16.23 | L27: -4.3e-003 | M27: 126 | N27: 19.15 | O27: 0.26000000000000001 | P27: 84.75 | Q27: 4月26天 | R27: 5.89年 | S27: 3.89年 | T27: 3.68 | U27: 7.3 | V27: 1.8000000000000002e-002 | W27: 0.17399999999999999 | X27: 0.14699999999999999 | Y27: 21 | Z27: 2.21 | AA27: 2.8999999999999998e-002 | AB27: 2.1400000000000002e-002 | AC27: -6.8000000000000005e-003 | AD27: -8.6999999999999994e-003 | AE27: 80.07 | AF27: 86.59 | AG27: 0.5 | AH27: AA- | AI27: 6.7099999999999993e-002 | AJ27: =H27+100*O27 -> 132.82400000000001 | AK27: 128.9 | AL27: 89 | AM27: 42.3 | AN27: 137 | AO27: -0.13 | AP27: 7 | AQ27: 金诺转债
A28: 264 | B28: 123011 | C28: 德尔转债! | D28: 300473 | E28: 德尔股份 | F28: 汽车 | G28: 零部件制 | H28: 105.08 | I28: 1.e-003 | J28: -4.5999999999999999e-003 | K28: 24.35 | L28: -1.7399999999999999e-002 | M28: 116.3 | N28: 34.54 | O28: 0.49099999999999999 | P28: 70.5 | Q28: 转股中 | R28: 3.64年 | S28: 1.64年 | T28: 2.51 | U28: 3.7 | V28: 1.3999999999999999e-002 | W28: 8.9999999999999997e-002 | X28: 6.4000000000000001e-002 | Y28: 28 | Z28: 1.24 | AA28: 2.8799999999999999e-002 | AB28: 2.06e-002 | AC28: -1.2199999999999999e-002 | AD28: -1.52e-002 | AE28: 91.77 | AF28: 92.76 | AG28: 0.2 | AH28: AA- | AI28: 6.54e-002 | AJ28: =H28+100*O28 -> 154.18000000000001 | AK28: 139.7 | AL28: 199 | AM28: 46.9 | AN28: 180 | AO28: -8.6999999999999994e-002 | AP28: 39 | AQ28: 德尔转债!
A29: 129 | B29: 128100 | C29: 搜特转债! | D29: 2503 | E29: 搜于特 | F29: 服装纺织 | G29: 服装行业 | H29: 101.799 | I29: -2.8999999999999998e-003 | J29: 1.4000000000000002e-003 | K29: 2.3 | L29: -4.3e-003 | M29: 117.3 | N29: 2.9 | O29: 0.28399999999999997 | P29: 79.31 | Q29: 转股中 | R29: 5.29年 | S29: 3.29年 | T29: 8 | U29: 3.1 | V29: 4.0000000000000001e-003 | W29: 0.11199999999999999 | X29: 8.900000000000001e-002 | Y29: 71 | Z29: 1.29 | AA29: 2.7699999999999999e-002 | AB29: 2.1700000000000001e-002 | AC29: 5.6999999999999993e-003 | AD29: 3.4999999999999996e-003 | AE29: 88.99 | AF29: 92.88 | AG29: 0.35 | AH29: AA | AI29: 4.6100000000000002e-002 | AJ29: =H29+100*O29 -> 130.19900000000001 | AK29: 124.3 | AL29: 26 | AM29: 31.4 | AN29: 33 | AO29: -1.e-002 | AP29: 42 | AQ29: 搜特转债!
A30: 8 | B30: 123073 | C30: 同和转债! | D30: 300636 | E30: 同和药业 | F30: 医药 | G30: 原料药 | H30: 104.58 | I30: 4.5999999999999999e-003 | J30: 5.1999999999999998e-003 | K30: 26.93 | L30: 2.12e-002 | M30: 122.4 | N30: 36.34 | O30: 0.41100000000000003 | P30: 74.11 | Q30: 5月7天 | R30: 5.91年 | S30: 3.91年 | T30: 3.6 | U30: 30 | V30: 7.9000000000000001e-002 | W30: 0.10400000000000001 | X30: 7.6999999999999999e-002 | Y30: 35 | Z30: 4.58 | AA30: 2.75e-002 | AB30: 2.0899999999999998e-002 | AC30: 0. | AD30: -2.2000000000000001e-003 | AE30: 77.22 | AF30: 79.25 | AG30: 0.46 | AH30: A+ | AI30: 7.8100000000000003e-002 | AJ30: =H30+100*O30 -> 145.68000000000001 | AK30: 135.1 | AL30: 158 | AM30: 55.8 | AN30: 234 | AO30: -8.6999999999999994e-002 | AP30: 3 | AQ30: 同和转债!
A31: 57 | B31: 113595 | C31: 花王转债 | D31: 603007 | E31: 花王股份 | F31: 城市公用 | G31: 生态环境 | H31: 108.22 | I31: 8.6e-003 | J31: 1.84e-002 | K31: 6.59 | L31: 4.4400000000000002e-002 | M31: 125.3 | N31: 6.94 | O31: 0.14000000000000001 | P31: 94.96 | Q31: 2月1天 | R31: 5.65年 | S31: 3.65年 | T31: 3.3 | U31: 137 | V31: 0.377 | W31: 0.14899999999999999 | X31: 0.14199999999999999 | Y31: 22 | Z31: 1.99 | AA31: 2.6800000000000001e-002 | AB31: 1.9199999999999998e-002 | AC31: -9.8999999999999991e-003 | AD31: -1.2e-002 | AE31: 81.6 | AF31: 87.53 | AG31: 0.61 | AH31: AA- | AI31: 6.7099999999999993e-002 | AJ31: =H31+100*O31 -> 122.22 | AK31: 121.5 | AL31: 14 | AM31: 34 | AN31: 52 | AO31: -3.4000000000000002e-002 | AP31: 28 | AQ31: 花王转债
A32: 284 | B32: 128033 | C32: 迪龙转债! | D32: 2658 | E32: 雪迪龙 | F32: 城市公用 | G32: 三废处理 | H32: 101.549 | I32: -5.0000000000000001e-004 | J32: 0. | K32: 6.39 | L32: -3.0999999999999999e-003 | M32: 109.8 | N32: 8.83 | O32: 0.40299999999999997 | P32: 72.37 | Q32: 转股中 | R32: 3年30天 | S32: 1年30天 | T32: 5.2 | U32: 1.3 | V32: 3.0000000000000001e-003 | W32: 0.13500000000000001 | X32: 9.6999999999999989e-002 | Y32: 39 | Z32: 1.91 | AA32: 2.6200000000000001e-002 | AB32: 2.e-002 | AC32: 8.0000000000000002e-003 | AD32: 3.9000000000000003e-003 | AE32: 97.19 | AF32: 96.32 | AG32: 0.15 | AH32: AA | AI32: 4.4400000000000002e-002 | AJ32: =H32+100*O32 -> 141.84899999999999 | AK32: 130.7 | AL32: 112 | AM32: 33.5 | AN32: 48 | AO32: 3.6000000000000004e-002 | AP32: 37 | AQ32: 迪龙转债!
A33: 235 | B33: 113021 | C33: 中信转债! | D33: 601998 | E33: 中信银行 | F33: 金融 | G33: 银行行业 | H33: 106.79 | I33: 3.2000000000000002e-003 | J33: 6.5000000000000006e-003 | K33: 5.46 | L33: 3.7999999999999999e-002 | M33: 118.8 | N33: 6.98 | O33: 0.36499999999999999 | P33: 78.22 | Q33: 转股中 | R33: 4.27年 | S33: 无权 | T33: 400 | U33: 41 | V33: 1.e-003 | W33: 0.14999999999999999 | X33: 0.11699999999999999 | Y33: 2672. | Z33: 0.59 | AA33: 2.6099999999999998e-002 | AB33: 1.8100000000000002e-002 | AC33: 无权 | AD33: 无权 | AE33: 无权 | AF33: 101.27 | AG33: 0.25 | AH33: AAA | AI33: 3.9399999999999998e-002 | AJ33: =H33+100*O33 -> 143.29000000000002 | AK33: 135.4 | AL33: 161 | AM33: 34.1 | AN33: 56 | AO33: 6.3e-002 | AP33: 53 | AQ33: 中信转债!
A34: 46 | B34: 113597 | C34: 佳力转债! | D34: 603912 | E34: 佳力图 | F34: 机械装备 | G34: 专用设备 | H34: 108.75 | I34: 1.e-004 | J34: -2.9999999999999997e-004 | K34: 17.25 | L34: -5.9999999999999995e-004 | M34: 124.5 | N34: 23.4 | O34: 0.47499999999999998 | P34: 73.72 | Q34: 2月10天 | R34: 5.67年 | S34: 3.67年 | T34: 3 | U34: 0.7 | V34: 2.e-003 | W34: 8.0000000000000002e-002 | X34: 5.9000000000000004e-002 | Y34: 37 | Z34: 4.31 | AA34: 2.4700000000000003e-002 | AB34: 1.72e-002 | AC34: -1.0700000000000001e-002 | AD34: -1.2800000000000001e-002 | AE34: 81.61 | AF34: 86.84 | AG34: 0.36 | AH34: AA- | AI34: 6.7099999999999993e-002 | AJ34: =H34+100*O34 -> 156.25 | AK34: 143.8 | AL34: 233 | AM34: 56.9 | AN34: 238 | AO34: -4.2000000000000003e-002 | AP34: 8 | AQ34: 佳力转债!
A35: 213 | B35: 127013 | C35: 创维转债! | D35: 810 | E35: 创维数字 | F35: 电子 | G35: 电子产品 | H35: 106.402 | I35: 8.0000000000000004e-004 | J35: -1.6000000000000001e-003 | K35: 8.81 | L35: -3.4000000000000002e-003 | M35: 117.9 | N35: 11.39 | O35: 0.376 | P35: 77.35 | Q35: 转股中 | R35: 4.38年 | S35: 2.38年 | T35: 9.78 | U35: 2.4 | V35: 2.e-003 | W35: 0.10400000000000001 | X35: 8.1000000000000003e-002 | Y35: 94 | Z35: 2.41 | AA35: 2.4199999999999999e-002 | AB35: 1.6799999999999999e-002 | AC35: -1.1299999999999999e-002 | AD35: -1.38e-002 | AE35: 92.68 | AF35: 97.84 | AG35: 0.25 | AH35: AA | AI35: 4.4400000000000002e-002 | AJ35: =H35+100*O35 -> 144.00200000000001 | AK35: 135.5 | AL35: 163 | AM35: 37.6 | AN35: 96 | AO35: -1.4999999999999999e-002 | AP35: 24 | AQ35: 创维转债!
A36: 308 | B36: 128014 | C36: 永东转债! | D36: 2753 | E36: 永东股份 | F36: 化工 | G36: 化工 | H36: 105.299 | I36: 4.5999999999999999e-003 | J36: -4.5999999999999999e-003 | K36: 8.51 | L36: 1.1999999999999999e-003 | M36: 111.3 | N36: 12.6 | O36: 0.55899999999999994 | P36: 67.54 | Q36: 转股中 | R36: 2.39年 | S36: 0.39年 | T36: 3.37 | U36: 2.3 | V36: 6.9999999999999993e-003 | W36: 0.105 | X36: 7.0999999999999994e-002 | Y36: 32 | Z36: 1.81 | AA36: 2.3900000000000001e-002 | AB36: 1.4999999999999999e-002 | AC36: -5.9500000000000004e-002 | AD36: -6.5500000000000003e-002 | AE36: 98.34 | AF36: 96.09 | AG36: 0.02 | AH36: AA- | AI36: 6.480000000000001e-002 | AJ36: =H36+100*O36 -> 161.19900000000001 | AK36: 143.1 | AL36: 227 | AM36: 44.7 | AN36: 154 | AO36: 1.3000000000000001e-002 | AP36: 39 | AQ36: 永东转债!
A37: 202 | B37: 128069 | C37: 华森转债! | D37: 2907 | E37: 华森制药 | F37: 医药 | G37: 化学制药 | H37: 108.002 | I37: -5.9999999999999995e-004 | J37: 3.0999999999999999e-003 | K37: 15.62 | L37: 5.1000000000000004e-003 | M37: 120 | N37: 18.04 | O37: 0.247 | P37: 86.59 | Q37: 转股中 | R37: 4.57年 | S37: 2.57年 | T37: 3 | U37: 6.3 | V37: 2.e-002 | W37: 4.8000000000000001e-002 | X37: 4.0999999999999995e-002 | Y37: 63 | Z37: 5.84 | AA37: 2.3799999999999998e-002 | AB37: 1.6e-002 | AC37: -1.5600000000000001e-002 | AD37: -1.8000000000000002e-002 | AE37: 87.18 | AF37: 90.35 | AG37: 0.47 | AH37: AA- | AI37: 6.54e-002 | AJ37: =H37+100*O37 -> 132.702 | AK37: 129.4 | AL37: 97 | AM37: 39.1 | AN37: 111 | AO37: -1.9e-002 | AP37: 43 | AQ37: 华森转债!
A38: 165 | B38: 128085 | C38: 鸿达转债 | D38: 2002 | E38: 鸿达兴业 | F38: 化工 | G38: 化工 | H38: 111.12 | I38: 2.e-003 | J38: -6.1999999999999998e-003 | K38: 4.08 | L38: -7.3000000000000001e-003 | M38: 124.8 | N38: 3.92 | O38: 6.8000000000000005e-002 | P38: 104.08 | Q38: 转股中 | R38: 5年19天 | S38: 3年19天 | T38: 24.3 | U38: 23 | V38: 8.0000000000000002e-003 | W38: 0.23000000000000001 | X38: 0.23899999999999999 | Y38: 106 | Z38: 1.48 | AA38: 2.3799999999999998e-002 | AB38: 1.5300000000000001e-002 | AC38: -1.9699999999999999e-002 | AD38: -2.2200000000000001e-002 | AE38: 90.38 | AF38: 99.91 | AG38: 0.58 | AH38: AA | AI38: 4.6100000000000002e-002 | AJ38: =H38+100*O38 -> 117.92 | AK38: 118.2 | AL38: 7 | AM38: 18.2 | AN38: 4 | AO38: 5.5e-002 | AP38: 87 | AQ38: 鸿达转债
A39: 245 | B39: 113524 | C39: 奇精转债! | D39: 603677 | E39: 奇精机械 | F39: 家电 | G39: 零部件制 | H39: 107.52 | I39: -1.37e-002 | J39: 1.61e-002 | K39: 12.27 | L39: 6.6e-003 | M39: 117.9 | N39: 14.08 | O39: 0.23399999999999999 | P39: 87.14 | Q39: 转股中 | R39: 4年17天 | S39: 2年17天 | T39: 3.3 | U39: 17 | V39: 4.7e-002 | W39: 0.14000000000000001 | X39: 0.122 | Y39: 24 | Z39: 2.47 | AA39: 2.35e-002 | AB39: 1.55e-002 | AC39: -1.77e-002 | AD39: -2.06e-002 | AE39: 94.03 | AF39: 99.28 | AG39: 0.37 | AH39: AA | AI39: 4.4400000000000002e-002 | AJ39: =H39+100*O39 -> 130.91999999999999 | AK39: 127.9 | AL39: 74 | AM39: 28.6 | AN39: 19 | AO39: -8.0000000000000002e-003 | AP39: 45 | AQ39: 奇精转债!
A40: 236 | B40: 113528 | C40: 长城转债! | D40: 603897 | E40: 长城科技 | F40: 机械装备 | G40: 专用设备 | H40: 106.88 | I40: -1.5900000000000001e-002 | J40: -7.1999999999999998e-003 | K40: 20.43 | L40: -4.7599999999999996e-002 | M40: 117.6 | N40: 23.45 | O40: 0.22699999999999998 | P40: 87.12 | Q40: 转股中 | R40: 4.26年 | S40: 2.26年 | T40: 6.34 | U40: 5.8 | V40: 8.0000000000000002e-003 | W40: 0.17399999999999999 | X40: 0.152 | Y40: 36 | Z40: 1.99 | AA40: 2.3300000000000001e-002 | AB40: 1.5700000000000002e-002 | AC40: -1.1599999999999999e-002 | AD40: -1.47e-002 | AE40: 89.33 | AF40: 90.42 | AG40: 0.49 | AH40: AA- | AI40: 6.54e-002 | AJ40: =H40+100*O40 -> 129.57999999999998 | AK40: 126.6 | AL40: 53 | AM40: 36.2 | AN40: 78 | AO40: -9.0000000000000011e-003 | AP40: 45 | AQ40: 长城转债!
A41: 164 | B41: 128087 | C41: 孚日转债! | D41: 2083 | E41: 孚日股份 | F41: 服装纺织 | G41: 家纺 | H41: 101.156 | I41: 4.0000000000000002e-004 | J41: 1.7000000000000001e-003 | K41: 4.92 | L41: 6.0999999999999995e-003 | M41: 113.3 | N41: 6.3 | O41: 0.29499999999999998 | P41: 78.1 | Q41: 转股中 | R41: 5年20天 | S41: 3年20天 | T41: 6.5 | U41: 1.6 | V41: 2.e-003 | W41: 0.14499999999999999 | X41: 0.114 | Y41: 45 | Z41: 1.19 | AA41: 2.3199999999999998e-002 | AB41: 1.8200000000000001e-002 | AC41: 8.1000000000000013e-003 | AD41: 5.7999999999999996e-003 | AE41: 89.94 | AF41: 90.68 | AG41: 0.36 | AH41: AA | AI41: 4.6100000000000002e-002 | AJ41: =H41+100*O41 -> 130.65600000000001 | AK41: 124.2 | AL41: 25 | AM41: 33.5 | AN41: 49 | AO41: -1.2e-002 | AP41: 51 | AQ41: 孚日转债!
A42: 12 | B42: 123071 | C42: 天能转债! | D42: 300569 | E42: 天能重工 | F42: 能源电力 | G42: 风能 | H42: 106.51 | I42: -4.5999999999999999e-003 | J42: 2.0400000000000001e-002 | K42: 17.79 | L42: 2.7099999999999999e-002 | M42: 121.1 | N42: 20.05 | O42: 0.20000000000000001 | P42: 88.73 | Q42: 5月1天 | R42: 5.90年 | S42: 3.90年 | T42: 7 | U42: 339 | V42: 0.44799999999999995 | W42: 0.10000000000000001 | X42: 8.900000000000001e-002 | Y42: 70 | Z42: 3.16 | AA42: 2.2400000000000003e-002 | AB42: 1.61e-002 | AC42: -5.8999999999999999e-003 | AD42: -7.8000000000000005e-003 | AE42: 80.08 | AF42: 83.18 | AG42: 0.58 | AH42: AA- | AI42: 6.7099999999999993e-002 | AJ42: =H42+100*O42 -> 126.51000000000001 | AK42: 124.3 | AL42: 27 | AM42: 41.1 | AN42: 126 | AO42: -1.3999999999999999e-002 | AP42: 2 | AQ42: 天能转债!
A43: 291 | B43: 123004 | C43: 铁汉转债! | D43: 300197 | E43: 铁汉生态 | F43: 城市公用 | G43: 生态环境 | H43: 103.039 | I43: -2.5999999999999999e-003 | J43: 4.5000000000000005e-003 | K43: 3.32 | L43: 6.0999999999999995e-003 | M43: 109.8 | N43: 3.98 | O43: 0.23499999999999999 | P43: 83.42 | Q43: 转股中 | R43: 3年21天 | S43: 1年21天 | T43: 8.03 | U43: 7.7 | V43: 9.0000000000000011e-003 | W43: 0.10300000000000001 | X43: 8.5999999999999993e-002 | Y43: 78 | Z43: 1.51 | AA43: 2.1499999999999998e-002 | AB43: 1.5300000000000001e-002 | AC43: -3.9000000000000003e-003 | AD43: -8.0000000000000002e-003 | AE43: 97.3 | AF43: 96.43 | AG43: 0.3 | AH43: AA | AI43: 4.4400000000000002e-002 | AJ43: =H43+100*O43 -> 126.539 | AK43: 122.7 | AL43: 19 | AM43: 25.4 | AN43: 13 | AO43: -5.7999999999999996e-002 | AP43: 40 | AQ43: 铁汉转债!
A44: 70 | B44: 128118 | C44: 瀛通转债! | D44: 2861 | E44: 瀛通通讯 | F44: 电子 | G44: 电子产品 | H44: 108.71 | I44: -8.9999999999999998e-004 | J44: 3.0999999999999999e-003 | K44: 23.13 | L44: 4.3e-003 | M44: 122.1 | N44: 27.53 | O44: 0.29399999999999998 | P44: 84.02 | Q44: 42天 | R44: 5.59年 | S44: 3.59年 | T44: 3 | U44: 2.1 | V44: 6.9999999999999993e-003 | W44: 0.106 | X44: 8.900000000000001e-002 | Y44: 28 | Z44: 2.65 | AA44: 2.1499999999999998e-002 | AB44: 1.4499999999999999e-002 | AC44: -1.03e-002 | AD44: -1.26e-002 | AE44: 82.16 | AF44: 85.63 | AG44: 0.51 | AH44: AA- | AI44: 6.7099999999999993e-002 | AJ44: =H44+100*O44 -> 138.10999999999999 | AK44: 133.4 | AL44: 144 | AM44: 47.8 | AN44: 189 | AO44: -1.e-002 | AP44: 7 | AQ44: 瀛通转债!
A45: 110 | B45: 110070 | C45: 凌钢转债! | D45: 600231 | E45: 凌钢股份 | F45: 钢铁 | G45: 炼钢 | H45: 105.37 | I45: 4.0999999999999995e-003 | J45: 1.6000000000000001e-003 | K45: 2.39 | L45: 1.2699999999999999e-002 | M45: 117.8 | N45: 2.75 | O45: 0.21199999999999999 | P45: 86.91 | Q45: 转股中 | R45: 5.38年 | S45: 3.38年 | T45: 4.4 | U45: 6 | V45: 1.3000000000000001e-002 | W45: 6.6000000000000003e-002 | X45: 5.7999999999999996e-002 | Y45: 66 | Z45: 0.82 | AA45: 2.1400000000000002e-002 | AB45: 1.54e-002 | AC45: -3.4000000000000002e-003 | AD45: -5.6000000000000008e-003 | AE45: 88.93 | AF45: 92.95 | AG45: 0.45 | AH45: AA | AI45: 4.6100000000000002e-002 | AJ45: =H45+100*O45 -> 126.57000000000001 | AK45: 123.8 | AL45: 21 | AM45: 30.9 | AN45: 30 | AO45: 4.0999999999999995e-002 | AP45: 17 | AQ45: 凌钢转债!
A46: 184 | B46: 113546 | C46: 迪贝转债! | D46: 603320 | E46: 迪贝电气 | F46: 家电 | G46: 零部件制 | H46: 109.03 | I46: -2.5000000000000001e-003 | J46: 2.0000000000000001e-004 | K46: 12.66 | L46: -3.9000000000000003e-003 | M46: 120.6 | N46: 14.1 | O46: 0.214 | P46: 89.79 | Q46: 转股中 | R46: 4.90年 | S46: 2.90年 | T46: 2.3 | U46: 2.3 | V46: 9.0000000000000011e-003 | W46: 0.14000000000000001 | X46: 0.125 | Y46: 16 | Z46: 2.47 | AA46: 2.12e-002 | AB46: 1.38e-002 | AC46: -1.5600000000000001e-002 | AD46: -1.8100000000000002e-002 | AE46: 83.12 | AF46: 84.72 | AG46: 0.58 | AH46: A+ | AI46: 7.6399999999999996e-002 | AJ46: =H46+100*O46 -> 130.43000000000001 | AK46: 128.3 | AL46: 82 | AM46: 43.6 | AN46: 144 | AO46: -5.0000000000000001e-003 | AP46: 44 | AQ46: 迪贝转债!
A47: 140 | B47: 113566 | C47: 翔港转债 | D47: 603499 | E47: 翔港科技 | F47: 造纸包装 | G47: 包装材料 | H47: 111.77 | I47: -3.5999999999999999e-003 | J47: 5.9999999999999995e-004 | K47: 9.43 | L47: -5.3e-003 | M47: 124.5 | N47: 10.77 | O47: 0.27699999999999997 | P47: 87.56 | Q47: 转股中 | R47: 5.26年 | S47: 3.26年 | T47: 1.61 | U47: 2.6 | V47: 1.3999999999999999e-002 | W47: 8.4000000000000005e-002 | X47: 7.400000000000001e-002 | Y47: 19 | Z47: 3.32 | AA47: 2.12e-002 | AB47: 1.32e-002 | AC47: -1.9299999999999998e-002 | AD47: -2.18e-002 | AE47: 81.24 | AF47: 84.7 | AG47: 0.57 | AH47: A+ | AI47: 7.8100000000000003e-002 | AJ47: =H47+100*O47 -> 139.47 | AK47: 136 | AL47: 170 | AM47: 51.3 | AN47: 208 | AO47: -2.4e-002 | AP47: 27 | AQ47: 翔港转债
A48: 135 | B48: 113568 | C48: 新春转债 | D48: 603667 | E48: 五洲新春 | F48: 机械装备 | G48: 通用设备 | H48: 112.01 | I48: 5.0000000000000001e-004 | J48: -1.2999999999999999e-003 | K48: 8.87 | L48: -1.1000000000000001e-003 | M48: 124.8 | N48: 8.91 | O48: 0.125 | P48: 99.55 | Q48: 转股中 | R48: 5.27年 | S48: 3.27年 | T48: 3.3 | U48: 4.7 | V48: 1.3000000000000001e-002 | W48: 0.127 | X48: 0.127 | Y48: 26 | Z48: 1.5 | AA48: 2.12e-002 | AB48: 1.32e-002 | AC48: -1.9599999999999999e-002 | AD48: -2.2200000000000001e-002 | AE48: 84.03 | AF48: 89.39 | AG48: 0.64 | AH48: AA- | AI48: 6.7099999999999993e-002 | AJ48: =H48+100*O48 -> 124.51000000000001 | AK48: 124.5 | AL48: 30 | AM48: 35.1 | AN48: 63 | AO48: 2.5000000000000001e-002 | AP48: 47 | AQ48: 新春转债
A49: 7 | B49: 123074 | C49: 隆利转债 | D49: 300752 | E49: 隆利科技 | F49: 电子 | G49: 液晶显示 | H49: 109.765 | I49: -8.5000000000000006e-003 | J49: -3.9000000000000003e-003 | K49: 27.51 | L49: -2.0299999999999999e-002 | M49: 124 | N49: 29.53 | O49: 0.17800000000000002 | P49: 93.16 | Q49: 5月8天 | R49: 5.92年 | S49: 3.92年 | T49: 3.25 | U49: 52 | V49: 0.14599999999999999 | W49: 9.9000000000000005e-002 | X49: 9.1999999999999998e-002 | Y49: 33 | Z49: 3.81 | AA49: 2.12e-002 | AB49: 1.4199999999999999e-002 | AC49: -1.34e-002 | AD49: -1.52e-002 | AE49: 79.89 | AF49: 85.03 | AG49: 0.61 | AH49: AA- | AI49: 6.7099999999999993e-002 | AJ49: =H49+100*O49 -> 127.565 | AK49: 126.4 | AL49: 48 | AM49: 41.3 | AN49: 129 | AO49: -0.10800000000000001 | AP49: 5 | AQ49: 隆利转债
A50: 42 | B50: 113599 | C50: 嘉友转债 | D50: 603871 | E50: 嘉友国际 | F50: 交通运输 | G50: 物流业 | H50: 112.22 | I50: 1.e-004 | J50: -6.4000000000000003e-003 | K50: 23.64 | L50: -1.0500000000000001e-002 | M50: 126 | N50: 24.82 | O50: 0.17800000000000002 | P50: 95.25 | Q50: 2月23天 | R50: 5.69年 | S50: 3.69年 | T50: 7.2 | U50: 2 | V50: 3.0000000000000001e-003 | W50: 0.13900000000000001 | X50: 0.13200000000000001 | Y50: 52 | Z50: 2.61 | AA50: 2.1000000000000001e-002 | AB50: 1.32e-002 | AC50: -1.9900000000000001e-002 | AD50: -2.18e-002 | AE50: 81.11 | AF50: 87.71 | AG50: 0.61 | AH50: AA- | AI50: 6.7099999999999993e-002 | AJ50: =H50+100*O50 -> 130.02000000000001 | AK50: 129.2 | AL50: 93 | AM50: 41.5 | AN50: 130 | AO50: -4.4999999999999998e-002 | AP50: 14 | AQ50: 嘉友转债
A51: 36 | B51: 128127 | C51: 文科转债 | D51: 2775 | E51: 文科园林 | F51: 城市公用 | G51: 生态环境 | H51: 108 | I51: -3.7000000000000002e-003 | J51: -7.4000000000000003e-003 | K51: 5.34 | L51: -1.66e-002 | M51: 121.3 | N51: 5.37 | O51: 8.5999999999999993e-002 | P51: 99.44 | Q51: 3月4天 | R51: 5.73年 | S51: 3.73年 | T51: 9.5 | U51: 4.5 | V51: 4.0000000000000001e-003 | W51: 0.34700000000000003 | X51: 0.34499999999999997 | Y51: 27 | Z51: 1.03 | AA51: 2.0899999999999998e-002 | AB51: 1.44e-002 | AC51: -9.1999999999999998e-003 | AD51: -1.1299999999999999e-002 | AE51: 81.16 | AF51: 84.3 | AG51: 0.67 | AH51: AA- | AI51: 6.7099999999999993e-002 | AJ51: =H51+100*O51 -> 116.59999999999999 | AK51: 116.6 | AL51: 5 | AM51: 32.3 | AN51: 40 | AO51: -1.3999999999999999e-002 | AP51: 23 | AQ51: 文科转债
A52: 287 | B52: 128032 | C52: 双环转债! | D52: 2472 | E52: 双环传动 | F52: 机械装备 | G52: 通用设备 | H52: 103.811 | I52: -6.6e-003 | J52: 7.4000000000000003e-003 | K52: 7.48 | L52: 4.0000000000000001e-003 | M52: 110.3 | N52: 9.89 | O52: 0.373 | P52: 75.63 | Q52: 转股中 | R52: 3年28天 | S52: 1年28天 | T52: 10 | U52: 7.6 | V52: 6.9999999999999993e-003 | W52: 0.19500000000000001 | X52: 0.14699999999999999 | Y52: 51 | Z52: 1.54 | AA52: 2.0400000000000001e-002 | AB52: 1.3899999999999999e-002 | AC52: -7.9000000000000008e-003 | AD52: -1.23e-002 | AE52: 97.45 | AF52: 96.81 | AG52: 0.19 | AH52: AA | AI52: 4.4400000000000002e-002 | AJ52: =H52+100*O52 -> 141.11099999999999 | AK52: 132 | AL52: 129 | AM52: 34.5 | AN52: 58 | AO52: 8.4000000000000005e-002 | AP52: 46 | AQ52: 双环转债!
A53: 299 | B53: 113502 | C53: 嘉澳转债! | D53: 603822 | E53: 嘉澳环保 | F53: 化工 | G53: 化工 | H53: 105.02 | I53: 4.0000000000000002e-004 | J53: -4.0000000000000002e-004 | K53: 25 | L53: 0. | M53: 111.3 | N53: 44.79 | O53: 0.88200000000000001 | P53: 55.82 | Q53: 转股中 | R53: 2.95年 | S53: 0.95年 | T53: 1.85 | U53: 4.5 | V53: 2.3e-002 | W53: 0.10099999999999999 | X53: 5.5999999999999994e-002 | Y53: 18 | Z53: 2.44 | AA53: 2.0199999999999999e-002 | AB53: 1.3000000000000001e-002 | AC53: -2.75e-002 | AD53: -3.0499999999999999e-002 | AE53: 94.9 | AF53: 92.73 | AG53: 0.01 | AH53: AA- | AI53: 6.480000000000001e-002 | AJ53: =H53+100*O53 -> 193.22 | AK53: 154.2 | AL53: 271 | AM53: 59.3 | AN53: 252 | AO53: 2.8999999999999998e-002 | AP53: 30 | AQ53: 嘉澳转债!
A54: 203 | B54: 123028 | C54: 清水转债 | D54: 300437 | E54: 清水源 | F54: 城市公用 | G54: 三废处理 | H54: 111.45 | I54: -3.4999999999999996e-003 | J54: -1.1200000000000002e-002 | K54: 11.28 | L54: -2.5899999999999999e-002 | M54: 121.8 | N54: 11.84 | O54: 0.17000000000000001 | P54: 95.27 | Q54: 转股中 | R54: 4.56年 | S54: 2.56年 | T54: 4.56 | U54: 6.3 | V54: 1.2e-002 | W54: 0.185 | X54: 0.17600000000000002 | Y54: 25 | Z54: 1.6 | AA54: 2.0199999999999999e-002 | AB54: 1.18e-002 | AC54: -2.29e-002 | AD54: -2.6099999999999998e-002 | AE54: 88.32 | AF54: 91.96 | AG54: 0.57 | AH54: AA- | AI54: 6.54e-002 | AJ54: =H54+100*O54 -> 128.44999999999999 | AK54: 127.6 | AL54: 71 | AM54: 35.7 | AN54: 70 | AO54: -0.13500000000000001 | AP54: 51 | AQ54: 清水转债
A55: 195 | B55: 128072 | C55: 翔鹭转债! | D55: 2842 | E55: 翔鹭钨业 | F55: 有色金属 | G55: 小金属 | H55: 105.071 | I55: 6.1999999999999998e-003 | J55: -1.0700000000000001e-002 | K55: 10.58 | L55: -1.5800000000000002e-002 | M55: 115.1 | N55: 15.34 | O55: 0.52300000000000002 | P55: 68.97 | Q55: 转股中 | R55: 4.73年 | S55: 2.73年 | T55: 3.02 | U55: 1.7 | V55: 5.0000000000000001e-003 | W55: 0.10400000000000001 | X55: 7.2000000000000008e-002 | Y55: 29 | Z55: 3.19 | AA55: 1.9799999999999998e-002 | AB55: 1.3999999999999999e-002 | AC55: -5.5000000000000005e-003 | AD55: -7.8000000000000005e-003 | AE55: 86.25 | AF55: 85.82 | AG55: 0.28 | AH55: AA- | AI55: 6.54e-002 | AJ55: =H55+100*O55 -> 157.37100000000001 | AK55: 141.2 | AL55: 214 | AM55: 54.9 | AN55: 231 | AO55: 1.2e-002 | AP55: 27 | AQ55: 翔鹭转债!
A56: 278 | B56: 113505 | C56: 杭电转债! | D56: 603618 | E56: 杭电股份 | F56: 能源电力 | G56: 电力设备 | H56: 105.6 | I56: -3.2000000000000002e-003 | J56: 3.2000000000000002e-003 | K56: 6.09 | L56: 0. | M56: 112.3 | N56: 7.14 | O56: 0.23800000000000002 | P56: 85.29 | Q56: 转股中 | R56: 3.27年 | S56: 1.27年 | T56: 7.5 | U56: 6.3 | V56: 8.0000000000000002e-003 | W56: 0.17800000000000002 | X56: 0.152 | Y56: 42 | Z56: 1.66 | AA56: 1.9400000000000001e-002 | AB56: 1.23e-002 | AC56: -1.8700000000000001e-002 | AD56: -2.2400000000000003e-002 | AE56: 96.63 | AF56: 97.72 | AG56: 0.34 | AH56: AA | AI56: 4.4400000000000002e-002 | AJ56: =H56+100*O56 -> 129.40000000000001 | AK56: 125.9 | AL56: 40 | AM56: 28.2 | AN56: 18 | AO56: 5.2000000000000005e-002 | AP56: 38 | AQ56: 杭电转债!
A57: 292 | B57: 128026 | C57: 众兴转债! | D57: 2772 | E57: 众兴菌业 | F57: 农业 | G57: 种植业 | H57: 104.252 | I57: 2.3e-003 | J57: 5.9999999999999995e-004 | K57: 9.2 | L57: 9.8999999999999991e-003 | M57: 110.3 | N57: 11.45 | O57: 0.29699999999999999 | P57: 80.35 | Q57: 转股中 | R57: 3年16天 | S57: 1年16天 | T57: 9.19 | U57: 2.3 | V57: 2.e-003 | W57: 0.27200000000000002 | X57: 0.218 | Y57: 34 | Z57: 1.38 | AA57: 1.9199999999999998e-002 | AB57: 1.2699999999999999e-002 | AC57: -1.1699999999999999e-002 | AD57: -1.61e-002 | AE57: 95.3 | AF57: 91.39 | AG57: 0.29 | AH57: AA- | AI57: 6.54e-002 | AJ57: =H57+100*O57 -> 133.952 | AK57: 128.2 | AL57: 80 | AM57: 32.9 | AN57: 45 | AO57: 6.9999999999999993e-003 | AP57: 58 | AQ57: 众兴转债!
A58: 163 | B58: 113557 | C58: 森特转债 | D58: 603098 | E58: 森特股份 | F58: 建筑 | G58: 建筑工程 | H58: 109.93 | I58: 5.6000000000000008e-003 | J58: -4.0000000000000002e-004 | K58: 9.67 | L58: 8.3000000000000001e-003 | M58: 120.7 | N58: 10.11 | O58: 0.14899999999999999 | P58: 95.65 | Q58: 转股中 | R58: 5年22天 | S58: 3年22天 | T58: 6 | U58: 1.7 | V58: 3.0000000000000001e-003 | W58: 0.129 | X58: 0.124 | Y58: 46 | Z58: 2.24 | AA58: 1.9099999999999999e-002 | AB58: 1.1899999999999999e-002 | AC58: -1.72e-002 | AD58: -1.95e-002 | AE58: 84.61 | AF58: 87.56 | AG58: 0.62 | AH58: AA- | AI58: 6.7099999999999993e-002 | AJ58: =H58+100*O58 -> 124.83000000000001 | AK58: 124.2 | AL58: 24 | AM58: 36.7 | AN58: 88 | AO58: 1.8000000000000002e-002 | AP58: 36 | AQ58: 森特转债
A59: 227 | B59: 123023 | C59: 迪森转债! | D59: 300335 | E59: 迪森股份 | F59: 能源电力 | G59: 电力供应 | H59: 106.112 | I59: -6.0999999999999995e-003 | J59: -2.5000000000000001e-003 | K59: 6.1 | L59: -2.0899999999999998e-002 | M59: 114.9 | N59: 7.04 | O59: 0.22500000000000001 | P59: 86.65 | Q59: 转股中 | R59: 4.31年 | S59: 3.31年 | T59: 5.3 | U59: 17 | V59: 2.9999999999999999e-002 | W59: 0.23899999999999999 | X59: 0.20699999999999999 | Y59: 22 | Z59: 1.64 | AA59: 1.9e-002 | AB59: 1.2699999999999999e-002 | AC59: -2.3999999999999998e-003 | AD59: -5.3e-003 | AE59: 90.71 | AF59: 95.66 | AG59: 0.41 | AH59: AA | AI59: 4.4400000000000002e-002 | AJ59: =H59+100*O59 -> 128.61199999999999 | AK59: 125.6 | AL59: 36 | AM59: 29.9 | AN59: 23 | AO59: -0.114 | AP59: 56 | AQ59: 迪森转债!
A60: 121 | B60: 113574 | C60: 华体转债! | D60: 603679 | E60: 华体科技 | F60: 城市公用 | G60: 城市公用 | H60: 105.98 | I60: -3.2000000000000002e-003 | J60: 9.0000000000000011e-003 | K60: 25.12 | L60: 1.29e-002 | M60: 116.4 | N60: 33.99 | O60: 0.434 | P60: 73.9 | Q60: 转股中 | R60: 5.34年 | S60: 3.34年 | T60: 2.09 | U60: 15 | V60: 6.8000000000000005e-002 | W60: 5.7999999999999996e-002 | X60: 4.2999999999999997e-002 | Y60: 36 | Z60: 4.9 | AA60: 1.8200000000000001e-002 | AB60: 1.2500000000000001e-002 | AC60: -3.9000000000000003e-003 | AD60: -6.4000000000000003e-003 | AE60: 80.61 | AF60: 78.72 | AG60: 0.45 | AH60: A+ | AI60: 7.8100000000000003e-002 | AJ60: =H60+100*O60 -> 149.38 | AK60: 138.1 | AL60: 185 | AM60: 57.4 | AN60: 240 | AO60: 0.125 | AP60: 14 | AQ60: 华体转债!
A61: 1 | B61: 113608 | C61: N威派转 | D61: 603956 | E61: 威派格 | F61: 机械装备 | G61: 专用设备 | H61: 109.89 | I61: 9.8900000000000002e-002 | J61: 0. | K61: 18.11 | L61: 5.6000000000000008e-003 | M61: 121.6 | N61: 19.24 | O61: 0.16699999999999998 | P61: 94.13 | Q61: 5月17天 | R61: 5.95年 | S61: 3.95年 | T61: 4.2 | U61: 477 | V61: 1. | W61: 5.4000000000000006e-002 | X61: 5.0999999999999997e-002 | Y61: 77 | Z61: 6.76 | AA61: 1.7500000000000002e-002 | AB61: 1.1200000000000002e-002 | AC61: -1.2e-002 | AD61: -1.41e-002 | AE61: 77.02 | AF61: 78.52 | AG61: 0.71 | AH61: A+ | AI61: 7.8100000000000003e-002 | AJ61: =H61+100*O61 -> 126.59 | AK61: 125.7 | AL61: 37 | AM61: 47.1 | AN61: 185 | AO61: -2.2000000000000002e-002 | AP61: 1 | AQ61: N威派转
A62: 34 | B62: 113601 | C62: 塞力转债 | D62: 603716 | E62: 塞力斯 | F62: 医药 | G62: 医药商业 | H62: 110.22 | I62: 1.0200000000000001e-002 | J62: 1.7299999999999999e-002 | K62: 17.24 | L62: 3.9199999999999999e-002 | M62: 121.3 | N62: 16.98 | O62: 8.5999999999999993e-002 | P62: 101.53 | Q62: 3月2天 | R62: 5.73年 | S62: 3.73年 | T62: 5.43 | U62: 30 | V62: 5.0999999999999997e-002 | W62: 0.154 | X62: 0.156 | Y62: 35 | Z62: 2.32 | AA62: 1.72e-002 | AB62: 1.0700000000000001e-002 | AC62: -1.44e-002 | AD62: -1.6500000000000001e-002 | AE62: 81.15 | AF62: 84.29 | AG62: 0.7 | AH62: AA- | AI62: 6.7099999999999993e-002 | AJ62: =H62+100*O62 -> 118.81999999999999 | AK62: 118.9 | AL62: 11 | AM62: 34.6 | AN62: 59 | AO62: 9.1999999999999998e-002 | AP62: 19 | AQ62: 塞力转债
A63: 220 | B63: 113532 | C63: 海环转债! | D63: 603817 | E63: 海峡环保 | F63: 城市公用 | G63: 三废处理 | H63: 105.1 | I63: -2.8000000000000004e-003 | J63: -4.7999999999999996e-003 | K63: 6.16 | L63: -2.2200000000000001e-002 | M63: 112.9 | N63: 7.69 | O63: 0.312 | P63: 80.1 | Q63: 转股中 | R63: 4.35年 | S63: 2.35年 | T63: 4.6 | U63: 1.3 | V63: 3.0000000000000001e-003 | W63: 0.16600000000000001 | X63: 0.13300000000000001 | Y63: 28 | Z63: 1.62 | AA63: 1.7000000000000001e-002 | AB63: 1.1399999999999999e-002 | AC63: -6.5000000000000006e-003 | AD63: -9.1999999999999998e-003 | AE63: 92.82 | AF63: 93.86 | AG63: 0.34 | AH63: AA | AI63: 4.4400000000000002e-002 | AJ63: =H63+100*O63 -> 136.29999999999998 | AK63: 130.1 | AL63: 102 | AM63: 36.2 | AN63: 79 | AO63: -2.4e-002 | AP63: 26 | AQ63: 海环转债!
A64: 69 | B64: 113036 | C64: 宁建转债! | D64: 601789 | E64: 宁波建工 | F64: 建筑 | G64: 建筑工程 | H64: 107.01 | I64: -4.8999999999999998e-003 | J64: 3.8e-003 | K64: 4.25 | L64: -2.3e-003 | M64: 117.3 | N64: 4.86 | O64: 0.22399999999999998 | P64: 87.45 | Q64: 45天 | R64: 5.61年 | S64: 3.61年 | T64: 5.4 | U64: 0.6 | V64: 1.e-003 | W64: 0.13 | X64: 0.114 | Y64: 41 | Z64: 1.39 | AA64: 1.6799999999999999e-002 | AB64: 1.1299999999999999e-002 | AC64: -8.1000000000000013e-003 | AD64: -1.e-002 | AE64: 87.72 | AF64: 91.56 | AG64: 0.47 | AH64: AA | AI64: 4.6100000000000002e-002 | AJ64: =H64+100*O64 -> 129.41 | AK64: 126.6 | AL64: 50 | AM64: 35 | AN64: 62 | AO64: -6.9999999999999993e-003 | AP64: 7 | AQ64: 宁建转债!
A65: 173 | B65: 128081 | C65: 海亮转债! | D65: 2203 | E65: 海亮股份 | F65: 有色金属 | G65: 铜金属 | H65: 105.949 | I65: -3.4000000000000002e-003 | J65: 2.9999999999999997e-004 | K65: 8.34 | L65: -7.0999999999999995e-003 | M65: 114.9 | N65: 9.76 | O65: 0.23999999999999999 | P65: 85.45 | Q65: 转股中 | R65: 4.98年 | S65: 2.98年 | T65: 31.5 | U65: 7.7 | V65: 2.e-003 | W65: 0.193 | X65: 0.16500000000000001 | Y65: 163 | Z65: 1.81 | AA65: 1.67e-002 | AB65: 1.1200000000000002e-002 | AC65: -7.8000000000000005e-003 | AD65: -9.7999999999999997e-003 | AE65: 90.28 | AF65: 92.9 | AG65: 0.43 | AH65: AA | AI65: 4.4400000000000002e-002 | AJ65: =H65+100*O65 -> 129.94900000000001 | AK65: 126.4 | AL65: 49 | AM65: 33.5 | AN65: 50 | AO65: 2.6000000000000002e-002 | AP65: 50 | AQ65: 海亮转债!
A66: 117 | B66: 127016 | C66: 鲁泰转债! | D66: 726 | E66: 鲁 泰Ａ | F66: 服装纺织 | G66: 纺织行业 | H66: 106.53 | I66: 5.1000000000000004e-003 | J66: -4.5999999999999999e-003 | K66: 6.89 | L66: 1.5e-003 | M66: 116.2 | N66: 8.91 | O66: 0.37799999999999995 | P66: 77.33 | Q66: 转股中 | R66: 5.36年 | S66: 3.36年 | T66: 14 | U66: 1.6 | V66: 1.e-003 | W66: 0.23699999999999999 | X66: 0.183 | Y66: 59 | Z66: 0.77 | AA66: 1.66e-002 | AB66: 1.1200000000000002e-002 | AC66: -7.7000000000000002e-003 | AD66: -9.7000000000000003e-003 | AE66: 89.17 | AF66: 92.6 | AG66: 0.32 | AH66: AA+ | AI66: 4.41e-002 | AJ66: =H66+100*O66 -> 144.32999999999998 | AK66: 135.7 | AL66: 167 | AM66: 43.1 | AN66: 142 | AO66: 6.0000000000000001e-003 | AP66: 21 | AQ66: 鲁泰转债!
A67: 24 | B67: 123067 | C67: 斯莱转债 | D67: 300382 | E67: 斯莱克 | F67: 机械装备 | G67: 专用设备 | H67: 110.468 | I67: 2.3e-003 | J67: -8.0000000000000004e-004 | K67: 8.46 | L67: 2.3999999999999998e-003 | M67: 121.2 | N67: 9.38 | O67: 0.22500000000000001 | P67: 90.19 | Q67: 3月26天 | R67: 5.81年 | S67: 3.81年 | T67: 3.88 | U67: 13 | V67: 2.9999999999999999e-002 | W67: 8.1000000000000003e-002 | X67: 7.2999999999999995e-002 | Y67: 48 | Z67: 4.68 | AA67: 1.6399999999999998e-002 | AB67: 1.e-002 | AC67: -1.49e-002 | AD67: -1.6899999999999998e-002 | AE67: 80.67 | AF67: 83.79 | AG67: 0.6 | AH67: AA- | AI67: 6.7099999999999993e-002 | AJ67: =H67+100*O67 -> 132.96800000000002 | AK67: 130.7 | AL67: 113 | AM67: 47 | AN67: 181 | AO67: -0.10199999999999999 | AP67: 11 | AQ67: 斯莱转债
A68: 214 | B68: 113026 | C68: 核能转债! | D68: 601985 | E68: 中国核电 | F68: 能源电力 | G68: 核电 | H68: 102.65 | I68: -1.8e-003 | J68: 5.8999999999999999e-003 | K68: 4.85 | L68: 1.2500000000000001e-002 | M68: 109.8 | N68: 6.08 | O68: 0.28699999999999998 | P68: 79.77 | Q68: 转股中 | R68: 4.38年 | S68: 2.38年 | T68: 78 | U68: 60 | V68: 6.9999999999999993e-003 | W68: 0.10300000000000001 | X68: 8.199999999999999e-002 | Y68: 755 | Z68: 1.45 | AA68: 1.5800000000000002e-002 | AB68: 1.15e-002 | AC68: 2.5000000000000001e-003 | AD68: 0. | AE68: 93.71 | AF68: 93.03 | AG68: 0.32 | AH68: AAA | AI68: 3.9399999999999998e-002 | AJ68: =H68+100*O68 -> 131.34999999999999 | AK68: 125.5 | AL68: 34 | AM68: 31.8 | AN68: 36 | AO68: 4.0999999999999995e-002 | AP68: 51 | AQ68: 核能转债!
A69: 231 | B69: 110053 | C69: 苏银转债! | D69: 600919 | E69: 江苏银行 | F69: 金融 | G69: 银行行业 | H69: 111.66 | I69: 5.3e-003 | J69: 3.4000000000000002e-003 | K69: 6.22 | L69: 2.4700000000000003e-002 | M69: 119.1 | N69: 7.28 | O69: 0.307 | P69: 85.44 | Q69: 转股中 | R69: 4.29年 | S69: 无权 | T69: 200 | U69: 34 | V69: 2.e-003 | W69: 0.27899999999999997 | X69: 0.23800000000000002 | Y69: 718 | Z69: 0.61 | AA69: 1.5600000000000001e-002 | AB69: 7.7000000000000002e-003 | AC69: 无权 | AD69: 无权 | AE69: 无权 | AF69: 101.42 | AG69: 0.35 | AH69: AAA | AI69: 3.9399999999999998e-002 | AJ69: =H69+100*O69 -> 142.35999999999999 | AK69: 137.9 | AL69: 182 | AM69: 36.5 | AN69: 85 | AO69: 2.7999999999999997e-002 | AP69: 46 | AQ69: 苏银转债!
A70: 268 | B70: 127007 | C70: 湖广转债! | D70: 665 | E70: 湖北广电 | F70: 传媒娱乐 | G70: 影视娱乐 | H70: 106.384 | I70: -2.0000000000000001e-004 | J70: 2.0000000000000001e-004 | K70: 5 | L70: 0. | M70: 112.3 | N70: 5.58 | O70: 0.187 | P70: 89.61 | Q70: 转股中 | R70: 3.58年 | S70: 1.58年 | T70: 12.2 | U70: 5.3 | V70: 4.0000000000000001e-003 | W70: 0.248 | X70: 0.222 | Y70: 49 | Z70: 0.76 | AA70: 1.55e-002 | AB70: 9.1000000000000004e-003 | AC70: -1.95e-002 | AD70: -2.2599999999999999e-002 | AE70: 95.65 | AF70: 97.05 | AG70: 0.42 | AH70: AA+ | AI70: 4.24e-002 | AJ70: =H70+100*O70 -> 125.084 | AK70: 123.2 | AL70: 20 | AM70: 26.1 | AN70: 14 | AO70: -9.0000000000000011e-003 | AP70: 18 | AQ70: 湖广转债!
A71: 187 | B71: 128076 | C71: 金轮转债! | D71: 2722 | E71: 金轮股份 | F71: 机械装备 | G71: 专用设备 | H71: 106.842 | I71: -4.7999999999999996e-003 | J71: 4.4000000000000003e-003 | K71: 12.57 | L71: -8.0000000000000004e-004 | M71: 114.9 | N71: 14.76 | O71: 0.255 | P71: 85.16 | Q71: 转股中 | R71: 4.88年 | S71: 2.88年 | T71: 2.14 | U71: 9.5 | V71: 4.2000000000000003e-002 | W71: 9.6999999999999989e-002 | X71: 8.3000000000000004e-002 | Y71: 22 | Z71: 1.2 | AA71: 1.5300000000000001e-002 | AB71: 9.7000000000000003e-003 | AC71: -1.0800000000000001e-002 | AD71: -1.29e-002 | AE71: 85.4 | AF71: 84.85 | AG71: 0.52 | AH71: AA- | AI71: 6.54e-002 | AJ71: =H71+100*O71 -> 132.34199999999998 | AK71: 128.5 | AL71: 85 | AM71: 43.1 | AN71: 141 | AO71: -5.0000000000000001e-003 | AP71: 43 | AQ71: 金轮转债!
A72: 33 | B72: 113039 | C72: 嘉泽转债! | D72: 601619 | E72: 嘉泽新能 | F72: 能源电力 | G72: 风能 | H72: 104.04 | I72: 1.5e-003 | J72: -8.3000000000000001e-003 | K72: 3.19 | L72: -1.24e-002 | M72: 113.1 | N72: 3.57 | O72: 0.16399999999999998 | P72: 89.36 | Q72: 3月4天 | R72: 5.74年 | S72: 3.74年 | T72: 13 | U72: 19 | V72: 1.3999999999999999e-002 | W72: 0.19600000000000001 | X72: 0.17600000000000002 | Y72: 66 | Z72: 1.93 | AA72: 1.49e-002 | AB72: 1.0700000000000001e-002 | AC72: -1.1000000000000001e-003 | AD72: -2.8999999999999998e-003 | AE72: 87 | AF72: 87.73 | AG72: 0.54 | AH72: AA | AI72: 4.6100000000000002e-002 | AJ72: =H72+100*O72 -> 120.44 | AK72: 118.7 | AL72: 9 | AM72: 31 | AN72: 31 | AO72: 1.7000000000000001e-002 | AP72: 14 | AQ72: 嘉泽转债!
A73: 93 | B73: 113584 | C73: 家悦转债! | D73: 603708 | E73: 家家悦 | F73: 商业零售 | G73: 超市 | H73: 106.46 | I73: 1.4800000000000001e-002 | J73: -1.4499999999999999e-002 | K73: 22.8 | L73: 1.8e-003 | M73: 115.3 | N73: 37.97 | O73: 0.77300000000000002 | P73: 60.05 | Q73: 15天 | R73: 5.52年 | S73: 3.52年 | T73: 6.45 | U73: 22 | V73: 3.3000000000000002e-002 | W73: 4.5999999999999999e-002 | X73: 2.7999999999999997e-002 | Y73: 139 | Z73: 4.62 | AA73: 1.4800000000000001e-002 | AB73: 9.7999999999999997e-003 | AC73: -6.8999999999999999e-003 | AD73: -8.8999999999999999e-003 | AE73: 88.06 | AF73: 90.35 | AG73: 0.14 | AH73: AA | AI73: 4.6100000000000002e-002 | AJ73: =H73+100*O73 -> 183.75999999999999 | AK73: 152.9 | AL73: 269 | AM73: 62.5 | AN73: 264 | AO73: -0.106 | AP73: 5 | AQ73: 家悦转债!
A74: 58 | B74: 113594 | C74: 淳中转债 | D74: 603516 | E74: 淳中科技 | F74: 电子 | G74: 电子产品 | H74: 111.99 | I74: -5.0000000000000001e-004 | J74: -4.5999999999999999e-003 | K74: 32.82 | L74: -9.1000000000000004e-003 | M74: 121.4 | N74: 39.37 | O74: 0.34299999999999997 | P74: 83.36 | Q74: 2月1天 | R74: 5.65年 | S74: 3.65年 | T74: 3 | U74: 1.3 | V74: 4.0000000000000001e-003 | W74: 6.9000000000000006e-002 | X74: 5.7000000000000002e-002 | Y74: 44 | Z74: 4.86 | AA74: 1.47e-002 | AB74: 8.1000000000000013e-003 | AC74: -1.8000000000000002e-002 | AD74: -2.0299999999999999e-002 | AE74: 78.77 | AF74: 80.19 | AG74: 0.57 | AH74: A+ | AI74: 7.8100000000000003e-002 | AJ74: =H74+100*O74 -> 146.28999999999999 | AK74: 140.6 | AL74: 207 | AM74: 60.4 | AN74: 257 | AO74: -6.9000000000000006e-002 | AP74: 5 | AQ74: 淳中转债
A75: 23 | B75: 128133 | C75: 奇正转债! | D75: 2287 | E75: 奇正藏药 | F75: 医药 | G75: 中药 | H75: 107.92 | I75: 8.0000000000000004e-004 | J75: 3.5999999999999999e-003 | K75: 24.31 | L75: 1.0800000000000001e-002 | M75: 117.3 | N75: 30.12 | O75: 0.33700000000000002 | P75: 80.71 | Q75: 4月1天 | R75: 5.82年 | S75: 3.82年 | T75: 8 | U75: 22 | V75: 2.6000000000000002e-002 | W75: 6.2e-002 | X75: 5.0000000000000003e-002 | Y75: 129 | Z75: 5.37 | AA75: 1.47e-002 | AB75: 9.3999999999999986e-003 | AC75: -9.7999999999999997e-003 | AD75: -1.1599999999999999e-002 | AE75: 86.88 | AF75: 90.68 | AG75: 0.4 | AH75: AA | AI75: 4.6100000000000002e-002 | AJ75: =H75+100*O75 -> 141.62 | AK75: 135.1 | AL75: 159 | AM75: 44.4 | AN75: 152 | AO75: -2.9999999999999999e-002 | AP75: 6 | AQ75: 奇正转债!
A76: 87 | B76: 123054 | C76: 思特转债 | D76: 300608 | E76: 思特奇 | F76: 通信互联 | G76: 通信设备 | H76: 112.63 | I76: -9.3999999999999986e-003 | J76: -6.6e-003 | K76: 16.36 | L76: -2.3900000000000001e-002 | M76: 121.7 | N76: 16.49 | O76: 0.13500000000000001 | P76: 99.21 | Q76: 19天 | R76: 5.53年 | S76: 3.53年 | T76: 2.71 | U76: 6.8 | V76: 2.2000000000000002e-002 | W76: 0.105 | X76: 0.10400000000000001 | Y76: 26 | Z76: 3.4 | AA76: 1.44e-002 | AB76: 7.6e-003 | AC76: -2.e-002 | AD76: -2.23e-002 | AE76: 82.51 | AF76: 85.69 | AG76: 0.67 | AH76: AA- | AI76: 6.7099999999999993e-002 | AJ76: =H76+100*O76 -> 126.13 | AK76: 126 | AL76: 42 | AM76: 40.4 | AN76: 119 | AO76: -5.5999999999999994e-002 | AP76: 15 | AQ76: 思特转债
A77: 312 | B77: 127003 | C77: 海印转债! | D77: 861 | E77: 海印股份 | F77: 商业零售 | G77: 商场 | H77: 109.441 | I77: -5.0000000000000001e-004 | J77: 5.0000000000000001e-004 | K77: 2.54 | L77: 0. | M77: 111.8 | N77: 3 | O77: 0.29299999999999998 | P77: 84.67 | Q77: 转股中 | R77: 1.53年 | S77: 回售中 | T77: 6.74 | U77: 2.6 | V77: 4.0000000000000001e-003 | W77: 0.114 | X77: 9.6999999999999989e-002 | Y77: 59 | Z77: 1.5 | AA77: 1.4199999999999999e-002 | AB77: 0. | AC77: 回售中 | AD77: 回售中 | AE77: 100.3 | AF77: 104.78 | AG77: 0.14 | AH77: AA | AI77: 4.3799999999999999e-002 | AJ77: =H77+100*O77 -> 138.74099999999999 | AK77: 134.2 | AL77: 148 | AM77: 29.4 | AN77: 21 | AO77: -1.8000000000000002e-002 | AP77: 74 | AQ77: 海印转债!
A78: 38 | B78: 110072 | C78: 广汇转债! | D78: 600297 | E78: 广汇汽车 | F78: 汽车 | G78: 分销、售 | H78: 105.96 | I78: 2.5999999999999999e-003 | J78: 1.5e-003 | K78: 3.48 | L78: 8.6999999999999994e-003 | M78: 114.5 | N78: 4.03 | O78: 0.22699999999999998 | P78: 86.35 | Q78: 2月29天 | R78: 5.72年 | S78: 3.72年 | T78: 33.7 | U78: 18 | V78: 5.0000000000000001e-003 | W78: 0.11900000000000001 | X78: 0.10300000000000001 | Y78: 282 | Z78: 0.72 | AA78: 1.38e-002 | AB78: 9.1999999999999998e-003 | AC78: -7.3000000000000001e-003 | AD78: -8.8000000000000005e-003 | AE78: 87.17 | AF78: 89.76 | AG78: 0.47 | AH78: AA+ | AI78: 4.41e-002 | AJ78: =H78+100*O78 -> 128.66 | AK78: 125.6 | AL78: 35 | AM78: 35.8 | AN78: 73 | AO78: -2.6000000000000002e-002 | AP78: 17 | AQ78: 广汇转债!
A79: 63 | B79: 123059 | C79: 银信转债 | D79: 300231 | E79: 银信科技 | F79: 计算机及 | G79: 软件开发 | H79: 115.1 | I79: -1.2e-002 | J79: 1.3999999999999999e-002 | K79: 9.72 | L79: 3.0999999999999999e-003 | M79: 124.1 | N79: 9.91 | O79: 0.17300000000000001 | P79: 98.08 | Q79: 55天 | R79: 5.63年 | S79: 3.63年 | T79: 3.91 | U79: 9 | V79: 2.e-002 | W79: 9.0999999999999998e-002 | X79: 8.900000000000001e-002 | Y79: 43 | Z79: 3.27 | AA79: 1.37e-002 | AB79: 6.5000000000000006e-003 | AC79: -2.6600000000000002e-002 | AD79: -2.8500000000000001e-002 | AE79: 81.5 | AF79: 86.74 | AG79: 0.64 | AH79: AA- | AI79: 6.7099999999999993e-002 | AJ79: =H79+100*O79 -> 132.40000000000001 | AK79: 132.1 | AL79: 132 | AM79: 45.4 | AN79: 162 | AO79: -8.0000000000000002e-002 | AP79: 11 | AQ79: 银信转债
A80: 61 | B80: 128120 | C80: 联诚转债 | D80: 2921 | E80: 联诚精密 | F80: 汽车 | G80: 零部件制 | H80: 109.92 | I80: -1.01e-002 | J80: -6.7000000000000002e-003 | K80: 22.6 | L80: -2.3300000000000001e-002 | M80: 118.4 | N80: 24.37 | O80: 0.185 | P80: 92.74 | Q80: 59天 | R80: 5.64年 | S80: 3.64年 | T80: 2.6 | U80: 8.3 | V80: 2.8999999999999998e-002 | W80: 0.14099999999999999 | X80: 0.13100000000000001 | Y80: 18 | Z80: 2.47 | AA80: 1.3600000000000001e-002 | AB80: 7.8000000000000005e-003 | AC80: -1.32e-002 | AD80: -1.55e-002 | AE80: 76.16 | AF80: 74.43 | AG80: 0.72 | AH80: A | AI80: 8.8100000000000012e-002 | AJ80: =H80+100*O80 -> 128.42000000000002 | AK80: 127.1 | AL80: 60 | AM80: 50.9 | AN80: 206 | AO80: -5.0000000000000003e-002 | AP80: 15 | AQ80: 联诚转债
A81: 226 | B81: 123024 | C81: 岱勒转债! | D81: 300700 | E81: 岱勒新材 | F81: 机械装备 | G81: 专用设备 | H81: 108.305 | I81: -1.54e-002 | J81: 1.1299999999999999e-002 | K81: 21.06 | L81: -9.8999999999999991e-003 | M81: 113 | N81: 24.9 | O81: 0.28100000000000003 | P81: 84.58 | Q81: 转股中 | R81: 3.31年 | S81: 1.31年 | T81: 2.1 | U81: 11 | V81: 4.9000000000000002e-002 | W81: 0.121 | X81: 0.10199999999999999 | Y81: 17 | Z81: 3.52 | AA81: 1.3100000000000001e-002 | AB81: 5.8999999999999999e-003 | AC81: -4.1500000000000002e-002 | AD81: -4.3700000000000003e-002 | AE81: 91.3 | AF81: 88.84 | AG81: 0.41 | AH81: A+ | AI81: 7.6399999999999996e-002 | AJ81: =H81+100*O81 -> 136.405 | AK81: 132 | AL81: 131 | AM81: 40.7 | AN81: 124 | AO81: -0.11800000000000001 | AP81: 36 | AQ81: 岱勒转债!
A82: 169 | B82: 128083 | C82: 新北转债! | D82: 2376 | E82: 新北洋 | F82: 电子 | G82: 电子产品 | H82: 108 | I82: 1.e-003 | J82: -5.9999999999999995e-004 | K82: 9.2 | L82: 1.1000000000000001e-003 | M82: 115.2 | N82: 11.7 | O82: 0.373 | P82: 78.63 | Q82: 转股中 | R82: 5年15天 | S82: 3年15天 | T82: 8.77 | U82: 1.8 | V82: 2.e-003 | W82: 0.14300000000000002 | X82: 0.113 | Y82: 61 | Z82: 1.81 | AA82: 1.3100000000000001e-002 | AB82: 7.6e-003 | AC82: -1.2699999999999999e-002 | AD82: -1.49e-002 | AE82: 89.89 | AF82: 92.22 | AG82: 0.35 | AH82: AA | AI82: 4.6100000000000002e-002 | AJ82: =H82+100*O82 -> 145.30000000000001 | AK82: 137.4 | AL82: 180 | AM82: 45.1 | AN82: 160 | AO82: -9.0000000000000011e-003 | AP82: 18 | AQ82: 新北转债!
A83: 261 | B83: 128042 | C83: 凯中转债! | D83: 2823 | E83: 凯中精密 | F83: 能源电力 | G83: 电力设备 | H83: 111.001 | I83: 4.0999999999999995e-003 | J83: -3.3e-003 | K83: 12.35 | L83: 1.6000000000000001e-003 | M83: 116.3 | N83: 12.96 | O83: 0.16500000000000001 | P83: 95.29 | Q83: 转股中 | R83: 3.67年 | S83: 1.67年 | T83: 4.16 | U83: 9.8 | V83: 2.1000000000000001e-002 | W83: 0.11699999999999999 | X83: 0.11199999999999999 | Y83: 35 | Z83: 2.63 | AA83: 1.3000000000000001e-002 | AB83: 5.0000000000000001e-003 | AC83: -4.1200000000000001e-002 | AD83: -4.4000000000000004e-002 | AE83: 94.97 | AF83: 99.45 | AG83: 0.47 | AH83: AA | AI83: 4.4400000000000002e-002 | AJ83: =H83+100*O83 -> 127.501 | AK83: 126.7 | AL83: 55 | AM83: 27.3 | AN83: 15 | AO83: 1.4999999999999999e-002 | AP83: 29 | AQ83: 凯中转债!
A84: 157 | B84: 113030 | C84: 东风转债 | D84: 601515 | E84: 东风股份 | F84: 造纸包装 | G84: 包装材料 | H84: 110.14 | I84: -6.9999999999999993e-003 | J84: 1.0200000000000001e-002 | K84: 6.1 | L84: 6.6e-003 | M84: 117.3 | N84: 6.75 | O84: 0.21899999999999997 | P84: 90.37 | Q84: 转股中 | R84: 5年27天 | S84: 3年27天 | T84: 2.95 | U84: 3.5 | V84: 1.1000000000000001e-002 | W84: 3.6000000000000004e-002 | X84: 3.3000000000000002e-002 | Y84: 81 | Z84: 1.95 | AA84: 1.2800000000000001e-002 | AB84: 6.6e-003 | AC84: -1.83e-002 | AD84: -2.0499999999999997e-002 | AE84: 89.86 | AF84: 93.78 | AG84: 0.48 | AH84: AA | AI84: 4.6100000000000002e-002 | AJ84: =H84+100*O84 -> 132.03999999999999 | AK84: 129.9 | AL84: 101 | AM84: 36.1 | AN84: 77 | AO84: -2.e-003 | AP84: 15 | AQ84: 东风转债
A85: 49 | B85: 113596 | C85: 城地转债! | D85: 603887 | E85: 城地香江 | F85: 通信互联 | G85: 通信设备 | H85: 105.75 | I85: -2.3999999999999998e-003 | J85: -2.5999999999999999e-003 | K85: 20.11 | L85: -1.4199999999999999e-002 | M85: 113.5 | N85: 29.21 | O85: 0.53600000000000003 | P85: 68.85 | Q85: 2月9天 | R85: 5.67年 | S85: 3.67年 | T85: 12 | U85: 3.7 | V85: 3.0000000000000001e-003 | W85: 0.159 | X85: 0.109 | Y85: 76 | Z85: 2.09 | AA85: 1.2800000000000001e-002 | AB85: 8.3999999999999995e-003 | AC85: -4.7999999999999996e-003 | AD85: -6.7000000000000002e-003 | AE85: 81.16 | AF85: 79.16 | AG85: 0.35 | AH85: AA- | AI85: 6.7099999999999993e-002 | AJ85: =H85+100*O85 -> 159.34999999999999 | AK85: 142.7 | AL85: 225 | AM85: 61.5 | AN85: 261 | AO85: -5.9000000000000004e-002 | AP85: 9 | AQ85: 城地转债!
A86: 147 | B86: 128094 | C86: 星帅转债 | D86: 2860 | E86: 星帅尔 | F86: 家电 | G86: 零部件制 | H86: 114.11 | I86: -2.e-003 | J86: -2.5000000000000001e-003 | K86: 13.96 | L86: -6.4000000000000003e-003 | M86: 121.5 | N86: 13.95 | O86: 0.14000000000000001 | P86: 100.07 | Q86: 转股中 | R86: 5年50天 | S86: 3年50天 | T86: 2.8 | U86: 15 | V86: 4.8000000000000001e-002 | W86: 0.10099999999999999 | X86: 0.10099999999999999 | Y86: 28 | Z86: 2.98 | AA86: 1.26e-002 | AB86: 5.3e-003 | AC86: -2.64e-002 | AD86: -2.8900000000000002e-002 | AE86: 81.88 | AF86: 83.4 | AG86: 0.71 | AH86: A+ | AI86: 7.8100000000000003e-002 | AJ86: =H86+100*O86 -> 128.11000000000001 | AK86: 128.1 | AL86: 79 | AM86: 44.7 | AN86: 155 | AO86: 2.1000000000000001e-002 | AP86: 32 | AQ86: 星帅转债
A87: 45 | B87: 128125 | C87: 华阳转债 | D87: 2949 | E87: 华阳国际 | F87: 建筑 | G87: 建筑工程 | H87: 110.6 | I87: -7.3000000000000001e-003 | J87: 5.0000000000000001e-004 | K87: 21.73 | L87: -1.23e-002 | M87: 118.5 | N87: 25.79 | O87: 0.313 | P87: 84.26 | Q87: 2月10天 | R87: 5.67年 | S87: 3.67年 | T87: 4.5 | U87: 5.2 | V87: 1.e-002 | W87: 0.106 | X87: 8.900000000000001e-002 | Y87: 43 | Z87: 3.5 | AA87: 1.2500000000000001e-002 | AB87: 6.7000000000000002e-003 | AC87: -1.6500000000000001e-002 | AD87: -1.83e-002 | AE87: 81.13 | AF87: 82.59 | AG87: 0.55 | AH87: AA- | AI87: 6.7099999999999993e-002 | AJ87: =H87+100*O87 -> 141.90000000000001 | AK87: 136.9 | AL87: 178 | AM87: 54.4 | AN87: 228 | AO87: -9.0999999999999998e-002 | AP87: 3 | AQ87: 华阳转债
A88: 216 | B88: 113534 | C88: 鼎胜转债! | D88: 603876 | E88: 鼎胜新材 | F88: 有色金属 | G88: 小金属 | H88: 109 | I88: -9.1999999999999998e-003 | J88: 8.199999999999999e-003 | K88: 13.68 | L88: -2.2000000000000001e-003 | M88: 114.9 | N88: 15.18 | O88: 0.20999999999999999 | P88: 90.12 | Q88: 转股中 | R88: 4.36年 | S88: 2.36年 | T88: 12 | U88: 5.7 | V88: 4.0000000000000001e-003 | W88: 0.20199999999999999 | X88: 0.182 | Y88: 59 | Z88: 1.65 | AA88: 1.24e-002 | AB88: 6.1999999999999998e-003 | AC88: -2.0799999999999999e-002 | AD88: -2.3399999999999997e-002 | AE88: 92.74 | AF88: 95.43 | AG88: 0.46 | AH88: AA | AI88: 4.4400000000000002e-002 | AJ88: =H88+100*O88 -> 130. | AK88: 127.9 | AL88: 73 | AM88: 32.4 | AN88: 41 | AO88: 2.6000000000000002e-002 | AP88: 31 | AQ88: 鼎胜转债!
A89: 54 | B89: 113037 | C89: 紫银转债 | D89: 601860 | E89: 紫金银行 | F89: 金融 | G89: 银行行业 | H89: 108.29 | I89: 1.3000000000000001e-002 | J89: 2.0400000000000001e-002 | K89: 4.3 | L89: 6.4399999999999999e-002 | M89: 115.8 | N89: 4.75 | O89: 0.19600000000000001 | P89: 90.53 | Q89: 2月3天 | R89: 5.65年 | S89: 无权 | T89: 45 | U89: 68 | V89: 1.3999999999999999e-002 | W89: 0.28600000000000003 | X89: 0.25900000000000001 | Y89: 157 | Z89: 1.11 | AA89: 1.2199999999999999e-002 | AB89: 7.0999999999999995e-003 | AC89: 无权 | AD89: 无权 | AE89: 无权 | AF89: 91.18 | AG89: 0.52 | AH89: AA+ | AI89: 4.41e-002 | AJ89: =H89+100*O89 -> 127.89000000000001 | AK89: 126.1 | AL89: 43 | AM89: 34.9 | AN89: 60 | AO89: 7.2000000000000008e-002 | AP89: 16 | AQ89: 紫银转债
A90: 91 | B90: 123053 | C90: 宝通转债 | D90: 300031 | E90: 宝通科技 | F90: 通信互联 | G90: 互联网 | H90: 113.963 | I90: -4.0000000000000002e-004 | J90: 4.0000000000000002e-004 | K90: 19.96 | L90: 0. | M90: 121.3 | N90: 20.8 | O90: 0.188 | P90: 95.96 | Q90: 14天 | R90: 5.52年 | S90: 3.52年 | T90: 5 | U90: 5.7 | V90: 1.e-002 | W90: 6.3e-002 | X90: 6.0999999999999999e-002 | Y90: 79 | Z90: 2.76 | AA90: 1.1599999999999999e-002 | AB90: 4.8999999999999998e-003 | AC90: -2.4199999999999999e-002 | AD90: -2.63e-002 | AE90: 82.27 | AF90: 85.45 | AG90: 0.65 | AH90: AA- | AI90: 6.7099999999999993e-002 | AJ90: =H90+100*O90 -> 132.76300000000001 | AK90: 132 | AL90: 127 | AM90: 46.5 | AN90: 175 | AO90: -4.5999999999999999e-002 | AP90: 6 | AQ90: 宝通转债
A91: 6 | B91: 113606 | C91: 荣泰转债 | D91: 603579 | E91: 荣泰健康 | F91: 机械装备 | G91: 专用设备 | H91: 113.34 | I91: -1.38e-002 | J91: 2.5899999999999999e-002 | K91: 33.27 | L91: 1.7399999999999999e-002 | M91: 121.2 | N91: 33.32 | O91: 0.13500000000000001 | P91: 99.85 | Q91: 5月9天 | R91: 5.92年 | S91: 3.92年 | T91: 6 | U91: 94 | V91: 0.13800000000000001 | W91: 0.129 | X91: 0.129 | Y91: 47 | Z91: 2.94 | AA91: 1.1599999999999999e-002 | AB91: 5.4000000000000003e-003 | AC91: -2.07e-002 | AD91: -2.2599999999999999e-002 | AE91: 80.06 | AF91: 83.16 | AG91: 0.69 | AH91: AA- | AI91: 6.7099999999999993e-002 | AJ91: =H91+100*O91 -> 126.84 | AK91: 126.8 | AL91: 56 | AM91: 43.7 | AN91: 146 | AO91: -2.e-003 | AP91: 2 | AQ91: 荣泰转债
A92: 211 | B92: 110058 | C92: 永鼎转债! | D92: 600105 | E92: 永鼎股份 | F92: 通信互联 | G92: 通信设备 | H92: 109.42 | I92: -8.3299999999999999e-002 | J92: 1.46e-002 | K92: 5.59 | L92: -9.98e-002 | M92: 114.9 | N92: 5.04 | O92: -1.3000000000000001e-002 | P92: 110.91 | Q92: 转股中 | R92: 4.38年 | S92: 2.38年 | T92: 2.67 | U92: 94 | V92: 0.315 | W92: 3.5000000000000003e-002 | X92: 3.9e-002 | Y92: 76 | Z92: 2.74 | AA92: 1.1399999999999999e-002 | AB92: 5.3e-003 | AC92: -2.2200000000000001e-002 | AD92: -2.4700000000000003e-002 | AE92: 92.67 | AF92: 95.35 | AG92: 0.69 | AH92: AA | AI92: 4.4400000000000002e-002 | AJ92: =H92+100*O92 -> 108.12 | AK92: 107.9 | AL92: 2 | AM92: 12.6 | AN92: 3 | AO92: -0.14699999999999999 | AP92: 51 | AQ92: 永鼎转债!
A93: 133 | B93: 113570 | C93: 百达转债 | D93: 603331 | E93: 百达精工 | F93: 机械装备 | G93: 机械装备 | H93: 108.7 | I93: -2.9999999999999997e-004 | J93: 5.4000000000000003e-003 | K93: 10.51 | L93: 7.7000000000000002e-003 | M93: 115.3 | N93: 11.54 | O93: 0.19399999999999998 | P93: 91.07 | Q93: 转股中 | R93: 5.29年 | S93: 3.29年 | T93: 2.8 | U93: 1.1 | V93: 4.0000000000000001e-003 | W93: 0.14899999999999999 | X93: 0.13600000000000001 | Y93: 19 | Z93: 2.43 | AA93: 1.1399999999999999e-002 | AB93: 6.1999999999999998e-003 | AC93: -1.34e-002 | AD93: -1.55e-002 | AE93: 80.3 | AF93: 78.16 | AG93: 0.67 | AH93: A+ | AI93: 7.8100000000000003e-002 | AJ93: =H93+100*O93 -> 128.09999999999999 | AK93: 126.3 | AL93: 47 | AM93: 46 | AN93: 168 | AO93: -2.2000000000000002e-002 | AP93: 33 | AQ93: 百达转债
A94: 217 | B94: 113024 | C94: 核建转债! | D94: 601611 | E94: 中国核建 | F94: 建筑 | G94: 建筑工程 | H94: 104.67 | I94: 5.5000000000000005e-003 | J94: 4.1999999999999997e-003 | K94: 7.8 | L94: 2.8999999999999998e-002 | M94: 109.7 | N94: 9.76 | O94: 0.31 | P94: 79.92 | Q94: 转股中 | R94: 4.36年 | S94: 2.36年 | T94: 30 | U94: 5 | V94: 2.e-003 | W94: 0.14499999999999999 | X94: 0.11599999999999999 | Y94: 207 | Z94: 1.92 | AA94: 1.1000000000000001e-002 | AB94: 6.8000000000000005e-003 | AC94: -5.6000000000000008e-003 | AD94: -8.1000000000000013e-003 | AE94: 93.68 | AF94: 93 | AG94: 0.33 | AH94: AAA | AI94: 3.9399999999999998e-002 | AJ94: =H94+100*O94 -> 135.67000000000002 | AK94: 129.4 | AL94: 98 | AM94: 35.7 | AN94: 72 | AO94: 5.2999999999999999e-002 | AP94: 44 | AQ94: 核建转债!
A95: 244 | B95: 113525 | C95: 台华转债! | D95: 603055 | E95: 台华新材 | F95: 服装纺织 | G95: 纺织行业 | H95: 110.07 | I95: -2.3e-003 | J95: -4.7999999999999996e-003 | K95: 6.89 | L95: -1.8500000000000003e-002 | M95: 114.9 | N95: 8.03 | O95: 0.28300000000000003 | P95: 85.8 | Q95: 转股中 | R95: 4年20天 | S95: 2年20天 | T95: 4.69 | U95: 0.8 | V95: 2.e-003 | W95: 8.8000000000000009e-002 | X95: 7.4999999999999997e-002 | Y95: 53 | Z95: 2.01 | AA95: 1.09e-002 | AB95: 4.1999999999999997e-003 | AC95: -2.81e-002 | AD95: -3.0899999999999997e-002 | AE95: 94 | AF95: 96.72 | AG95: 0.38 | AH95: AA | AI95: 4.4400000000000002e-002 | AJ95: =H95+100*O95 -> 138.37 | AK95: 134.3 | AL95: 149 | AM95: 37.6 | AN95: 97 | AO95: -7.2999999999999995e-002 | AP95: 22 | AQ95: 台华转债!
A96: 109 | B96: 123049 | C96: 维尔转债 | D96: 300190 | E96: 维尔利 | F96: 城市公用 | G96: 三废处理 | H96: 117.996 | I96: 0. | J96: -1.8e-003 | K96: 8.13 | L96: -2.5000000000000001e-003 | M96: 124.8 | N96: 7.48 | O96: 8.5999999999999993e-002 | P96: 108.69 | Q96: 转股中 | R96: 5.38年 | S96: 3.38年 | T96: 9.17 | U96: 2.8 | V96: 3.0000000000000001e-003 | W96: 0.14400000000000002 | X96: 0.157 | Y96: 64 | Z96: 1.51 | AA96: 1.0700000000000001e-002 | AB96: 2.8999999999999998e-003 | AC96: -3.3599999999999998e-002 | AD96: -3.6000000000000004e-002 | AE96: 83.46 | AF96: 88.79 | AG96: 0.73 | AH96: AA- | AI96: 6.7099999999999993e-002 | AJ96: =H96+100*O96 -> 126.59599999999999 | AK96: 127.3 | AL96: 67 | AM96: 38.5 | AN96: 104 | AO96: -2.3e-002 | AP96: 13 | AQ96: 维尔转债
A97: 120 | B97: 113033 | C97: 利群转债! | D97: 601366 | E97: 利群股份 | F97: 商业零售 | G97: 商场 | H97: 109.45 | I97: 1.2e-002 | J97: 4.8999999999999998e-003 | K97: 6.83 | L97: 2.86e-002 | M97: 115.3 | N97: 7.01 | O97: 0.12300000000000001 | P97: 97.43 | Q97: 转股中 | R97: 5.34年 | S97: 3.34年 | T97: 18 | U97: 25 | V97: 1.3000000000000001e-002 | W97: 0.30599999999999999 | X97: 0.29799999999999999 | Y97: 59 | Z97: 1.32 | AA97: 1.e-002 | AB97: 4.7999999999999996e-003 | AC97: -1.5100000000000001e-002 | AD97: -1.72e-002 | AE97: 88.77 | AF97: 91.08 | AG97: 0.59 | AH97: AA | AI97: 4.6100000000000002e-002 | AJ97: =H97+100*O97 -> 121.75 | AK97: 121.5 | AL97: 13 | AM97: 30.4 | AN97: 25 | AO97: 4.0000000000000001e-002 | AP97: 37 | AQ97: 利群转债!
A98: 259 | B98: 113516 | C98: 苏农转债! | D98: 603323 | E98: 苏农银行 | F98: 金融 | G98: 银行行业 | H98: 110.33 | I98: 1.4199999999999999e-002 | J98: -1.e-003 | K98: 5.07 | L98: 3.0499999999999999e-002 | M98: 114.3 | N98: 5.52 | O98: 0.20100000000000001 | P98: 91.85 | Q98: 转股中 | R98: 3.68年 | S98: 无权 | T98: 12.9 | U98: 41 | V98: 2.8999999999999998e-002 | W98: 0.14099999999999999 | X98: 0.13 | Y98: 91 | Z98: 0.77 | AA98: 9.7999999999999997e-003 | AB98: 2.8000000000000004e-003 | AC98: 无权 | AD98: 无权 | AE98: 无权 | AF98: 98.38 | AG98: 0.44 | AH98: AA+ | AI98: 4.24e-002 | AJ98: =H98+100*O98 -> 130.43000000000001 | AK98: 128.8 | AL98: 88 | AM98: 30.4 | AN98: 27 | AO98: 4.5999999999999999e-002 | AP98: 36 | AQ98: 苏农转债!
A99: 113 | B99: 113576 | C99: 起步转债!! | D99: 603557 | E99: 起步股份 | F99: 服装纺织 | G99: 鞋服行业 | H99: 115.76 | I99: -1.7600000000000001e-002 | J99: 5.7999999999999996e-003 | K99: 10.41 | L99: -1.7899999999999999e-002 | M99: 121.8 | N99: 10.55 | O99: 0.17300000000000001 | P99: 98.67 | Q99: 转股中 | R99: 5.37年 | S99: 3.37年 | T99: 2.67 | U99: 23 | V99: 7.2999999999999995e-002 | W99: 5.2000000000000005e-002 | X99: 5.0999999999999997e-002 | Y99: 52 | Z99: 3.07 | AA99: 9.7999999999999997e-003 | AB99: 2.7000000000000001e-003 | AC99: -2.8300000000000002e-002 | AD99: -3.0800000000000001e-002 | AE99: 83.51 | AF99: 86.72 | AG99: 0.66 | AH99: AA- | AI99: 6.7099999999999993e-002 | AJ99: =H99+100*O99 -> 133.06 | AK99: 132.8 | AL99: 139 | AM99: 46.1 | AN99: 170 | AO99: -0.23399999999999999 | AP99: 28 | AQ99: 起步转债!!
A100: 183 | B100: 127014 | C100: 北方转债 | D100: 65 | E100: 北方国际 | F100: 建筑 | G100: 建筑工程 | H100: 109.862 | I100: -2.3999999999999998e-003 | J100: 1.8e-003 | K100: 7.79 | L100: -1.2999999999999999e-003 | M100: 115.1 | N100: 8.75 | O100: 0.23399999999999999 | P100: 89.03 | Q100: 转股中 | R100: 4.91年 | S100: 2.91年 | T100: 5.78 | U100: 12 | V100: 1.8000000000000002e-002 | W100: 9.6000000000000002e-002 | X100: 8.5999999999999993e-002 | Y100: 60 | Z100: 1.13 | AA100: 9.7000000000000003e-003 | AB100: 4.0999999999999995e-003 | AC100: -1.9099999999999999e-002 | AD100: -2.1299999999999999e-002 | AE100: 91.31 | AF100: 94.27 | AG100: 0.46 | AH100: AA+ | AI100: 4.24e-002 | AJ100: =H100+100*O100 -> 133.262 | AK100: 130.7 | AL100: 110 | AM100: 36.4 | AN100: 84 | AO100: 1.3000000000000001e-002 | AP100: 17 | AQ100: 北方转债
A101: 171 | B101: 128082 | C101: 华锋转债! | D101: 2806 | E101: 华锋股份 | F101: 电子 | G101: 元器件制 | H101: 116.501 | I101: -3.2199999999999999e-002 | J101: -3.1099999999999999e-002 | K101: 13.02 | L101: -8.1799999999999998e-002 | M101: 122 | N101: 11.71 | O101: 4.8000000000000001e-002 | P101: 111.19 | Q101: 转股中 | R101: 5年7天 | S101: 3年7天 | T101: 3.45 | U101: 268 | V101: 0.66599999999999993 | W101: 0.151 | X101: 0.16699999999999998 | Y101: 23 | Z101: 1.84 | AA101: 9.4999999999999998e-003 | AB101: 1.9e-003 | AC101: -3.2400000000000005e-002 | AD101: -3.5299999999999998e-002 | AE101: 83.05 | AF101: 84.58 | AG101: 0.77 | AH101: A+ | AI101: 7.8100000000000003e-002 | AJ101: =H101+100*O101 -> 121.301 | AK101: 121.8 | AL101: 15 | AM101: 37.2 | AN101: 91 | AO101: 6.0999999999999999e-002 | AP101: 58 | AQ101: 华锋转债!
A102: 47 | B102: 123063 | C102: 大禹转债 | D102: 300021 | E102: 大禹节水 | F102: 化工 | G102: 橡胶塑料 | H102: 120.065 | I102: -1.e-003 | J102: -5.7999999999999996e-003 | K102: 5.58 | L102: -8.8999999999999999e-003 | M102: 126.5 | N102: 4.94 | O102: 6.3e-002 | P102: 112.96 | Q102: 2月8天 | R102: 5.67年 | S102: 4.67年 | T102: 6.38 | U102: 7.2 | V102: 9.0000000000000011e-003 | W102: 0.14300000000000002 | X102: 0.16200000000000001 | Y102: 44 | Z102: 3.08 | AA102: 9.3999999999999986e-003 | AB102: 1.7000000000000001e-003 | AC102: -2.3900000000000001e-002 | AD102: -2.6499999999999999e-002 | AE102: 78.61 | AF102: 88.24 | AG102: 0.77 | AH102: AA- | AI102: 6.7099999999999993e-002 | AJ102: =H102+100*O102 -> 126.36499999999999 | AK102: 127.2 | AL102: 63 | AM102: 38.9 | AN102: 108 | AO102: -1.e-002 | AP102: 15 | AQ102: 大禹转债
A103: 37 | B103: 110074 | C103: 精达转债 | D103: 600577 | E103: 精达股份 | F103: 电子 | G103: 电子产品 | H103: 111.31 | I103: -8.9999999999999998e-004 | J103: -8.0000000000000002e-003 | K103: 3.37 | L103: -1.7500000000000002e-002 | M103: 117.3 | N103: 3.75 | O103: 0.23899999999999999 | P103: 89.87 | Q103: 3月0天 | R103: 5.73年 | S103: 3.73年 | T103: 7.87 | U103: 1.8 | V103: 2.e-003 | W103: 0.122 | X103: 0.109 | Y103: 65 | Z103: 1.83 | AA103: 9.3999999999999986e-003 | AB103: 4.0000000000000001e-003 | AC103: -1.7899999999999999e-002 | AD103: -1.9799999999999998e-002 | AE103: 87.24 | AF103: 91.06 | AG103: 0.51 | AH103: AA | AI103: 4.6100000000000002e-002 | AJ103: =H103+100*O103 -> 135.21000000000001 | AK103: 132.8 | AL103: 137 | AM103: 41.7 | AN103: 132 | AO103: 5.0000000000000001e-003 | AP103: 8 | AQ103: 精达转债
A104: 311 | B104: 128013 | C104: 洪涛转债! | D104: 2325 | E104: 洪涛股份 | F104: 建筑 | G104: 装饰工程 | H104: 108.154 | I104: 3.7000000000000002e-003 | J104: 4.4000000000000003e-003 | K104: 3.03 | L104: 1.6799999999999999e-002 | M104: 109.8 | N104: 3.1 | O104: 0.107 | P104: 97.74 | Q104: 转股中 | R104: 1.67年 | S104: 回售中 | T104: 12 | U104: 7.8 | V104: 6.0000000000000001e-003 | W104: 0.317 | X104: 0.309 | Y104: 38 | Z104: 1.27 | AA104: 9.1999999999999998e-003 | AB104: -1.8e-003 | AC104: 回售中 | AD104: 回售中 | AE104: 100.3 | AF104: 98.98 | AG104: 0.48 | AH104: AA- | AI104: 6.480000000000001e-002 | AJ104: =H104+100*O104 -> 118.854 | AK104: 118.6 | AL104: 8 | AM104: 18.3 | AN104: 5 | AO104: 2.5000000000000001e-002 | AP104: 93 | AQ104: 洪涛转债!
A105: 155 | B105: 123039 | C105: 开润转债! | D105: 300577 | E105: 开润股份 | F105: 服装纺织 | G105: 纺织行业 | H105: 116.35 | I105: -6.0000000000000001e-003 | J105: 1.1200000000000002e-002 | K105: 31.37 | L105: 7.7000000000000002e-003 | M105: 121.5 | N105: 32.87 | O105: 0.21899999999999997 | P105: 95.44 | Q105: 转股中 | R105: 5年29天 | S105: 3年29天 | T105: 2.22 | U105: 4.6 | V105: 1.8000000000000002e-002 | W105: 2.8999999999999998e-002 | X105: 2.7999999999999997e-002 | Y105: 75 | Z105: 8.17 | AA105: 8.8000000000000005e-003 | AB105: 1.5e-003 | AC105: -3.2799999999999996e-002 | AD105: -3.5299999999999998e-002 | AE105: 82.24 | AF105: 83.76 | AG105: 0.68 | AH105: A+ | AI105: 7.8100000000000003e-002 | AJ105: =H105+100*O105 -> 138.25 | AK105: 137.3 | AL105: 179 | AM105: 53.5 | AN105: 224 | AO105: -3.7000000000000005e-002 | AP105: 25 | AQ105: 开润转债!
A106: 67 | B106: 110071 | C106: 湖盐转债 | D106: 600929 | E106: 雪天盐业 | F106: 食品饮料 | G106: 食品饮料 | H106: 109.81 | I106: 3.8e-003 | J106: 7.4999999999999997e-003 | K106: 6.29 | L106: 1.9400000000000001e-002 | M106: 115.2 | N106: 6.6 | O106: 0.152 | P106: 95.3 | Q106: 52天 | R106: 5.62年 | S106: 3.62年 | T106: 7.2 | U106: 5.3 | V106: 6.9999999999999993e-003 | W106: 0.125 | X106: 0.11900000000000001 | Y106: 58 | Z106: 2.27 | AA106: 8.6999999999999994e-003 | AB106: 3.8e-003 | AC106: -1.5100000000000001e-002 | AD106: -1.7000000000000001e-002 | AE106: 87.58 | AF106: 89.86 | AG106: 0.58 | AH106: AA | AI106: 4.6100000000000002e-002 | AJ106: =H106+100*O106 -> 125.01000000000001 | AK106: 124.3 | AL106: 28 | AM106: 34.5 | AN106: 57 | AO106: 1.4999999999999999e-002 | AP106: 12 | AQ106: 湖盐转债
A107: 228 | B107: 110056 | C107: 亨通转债! | D107: 600487 | E107: 亨通光电 | F107: 通信互联 | G107: 通信设备 | H107: 110.7 | I107: -9.7999999999999997e-003 | J107: 6.4000000000000003e-003 | K107: 14.77 | L107: -6.7000000000000002e-003 | M107: 114.8 | N107: 15.58 | O107: 0.16800000000000001 | P107: 94.8 | Q107: 转股中 | R107: 4.31年 | S107: 2.31年 | T107: 17.1 | U107: 14 | V107: 6.9999999999999993e-003 | W107: 5.9000000000000004e-002 | X107: 5.5999999999999994e-002 | Y107: 288 | Z107: 1.91 | AA107: 8.6e-003 | AB107: 2.3999999999999998e-003 | AC107: -2.7799999999999998e-002 | AD107: -3.0299999999999997e-002 | AE107: 93.31 | AF107: 96.35 | AG107: 0.5 | AH107: AA+ | AI107: 4.24e-002 | AJ107: =H107+100*O107 -> 127.5 | AK107: 126.6 | AL107: 51 | AM107: 30.3 | AN107: 24 | AO107: -1.9e-002 | AP107: 29 | AQ107: 亨通转债!
A108: 105 | B108: 113578 | C108: 全筑转债 | D108: 603030 | E108: 全筑股份 | F108: 建筑 | G108: 装饰工程 | H108: 113.09 | I108: -4.7999999999999996e-003 | J108: 2.7000000000000001e-003 | K108: 5.37 | L108: -3.7000000000000002e-003 | M108: 118.3 | N108: 5.43 | O108: 0.14400000000000002 | P108: 98.9 | Q108: 转股中 | R108: 5.39年 | S108: 3.39年 | T108: 3.84 | U108: 3.3 | V108: 8.0000000000000002e-003 | W108: 0.13300000000000001 | X108: 0.13100000000000001 | Y108: 29 | Z108: 1.3 | AA108: 8.5000000000000006e-003 | AB108: 2.5999999999999999e-003 | AC108: -2.4e-002 | AD108: -2.6000000000000002e-002 | AE108: 88.56 | AF108: 93.22 | AG108: 0.58 | AH108: AA | AI108: 4.6100000000000002e-002 | AJ108: =H108+100*O108 -> 127.49000000000001 | AK108: 127.3 | AL108: 66 | AM108: 34.1 | AN108: 55 | AO108: -1.3000000000000001e-002 | AP108: 12 | AQ108: 全筑转债
A109: 74 | B109: 128116 | C109: 瑞达转债 | D109: 2961 | E109: 瑞达期货 | F109: 金融 | G109: 期货行业 | H109: 110.079 | I109: 5.3e-003 | J109: -2.3e-003 | K109: 27.67 | L109: 5.5000000000000005e-003 | M109: 115.3 | N109: 29.82 | O109: 0.18600000000000003 | P109: 92.79 | Q109: 38天 | R109: 5.59年 | S109: 3.59年 | T109: 6.5 | U109: 6.1 | V109: 9.0000000000000011e-003 | W109: 5.2999999999999999e-002 | X109: 4.9000000000000002e-002 | Y109: 123 | Z109: 7 | AA109: 8.5000000000000006e-003 | AB109: 3.4999999999999996e-003 | AC109: -1.5900000000000001e-002 | AD109: -1.77e-002 | AE109: 87.72 | AF109: 90.07 | AG109: 0.54 | AH109: AA | AI109: 4.6100000000000002e-002 | AJ109: =H109+100*O109 -> 128.679 | AK109: 127.4 | AL109: 69 | AM109: 37.3 | AN109: 92 | AO109: -6.9999999999999993e-003 | AP109: 11 | AQ109: 瑞达转债
A110: 293 | B110: 128025 | C110: 特一转债! | D110: 2728 | E110: 特一药业 | F110: 医药 | G110: 化学制药 | H110: 107.285 | I110: -1.4000000000000002e-003 | J110: -1.e-003 | K110: 13.07 | L110: -5.3e-003 | M110: 109.8 | N110: 14.7 | O110: 0.20699999999999999 | P110: 88.91 | Q110: 转股中 | R110: 3年9天 | S110: 1年9天 | T110: 2.99 | U110: 5.6 | V110: 1.7000000000000001e-002 | W110: 0.11199999999999999 | X110: 0.10000000000000001 | Y110: 27 | Z110: 2.63 | AA110: 7.9000000000000008e-003 | AB110: 1.7000000000000001e-003 | AC110: -3.7599999999999995e-002 | AD110: -4.1599999999999998e-002 | AE110: 95.18 | AF110: 91.05 | AG110: 0.45 | AH110: AA- | AI110: 6.54e-002 | AJ110: =H110+100*O110 -> 127.985 | AK110: 125.7 | AL110: 38 | AM110: 30.5 | AN110: 28 | AO110: -1.4999999999999999e-002 | AP110: 48 | AQ110: 特一转债!
A111: 210 | B111: 128066 | C111: 亚泰转债! | D111: 2811 | E111: 郑中设计 | F111: 建筑 | G111: 装饰工程 | H111: 113.66 | I111: -3.0000000000000001e-003 | J111: -5.0000000000000001e-004 | K111: 10.15 | L111: -4.8999999999999998e-003 | M111: 117.5 | N111: 9.67 | O111: 8.3000000000000004e-002 | P111: 104.96 | Q111: 转股中 | R111: 4.39年 | S111: 2.39年 | T111: 4.8 | U111: 3.4 | V111: 6.0000000000000001e-003 | W111: 0.17499999999999999 | X111: 0.184 | Y111: 27 | Z111: 1.86 | AA111: 7.8000000000000005e-003 | AB111: 7.000000000000001e-004 | AC111: -3.5200000000000002e-002 | AD111: -3.7999999999999999e-002 | AE111: 88.52 | AF111: 89.6 | AG111: 0.71 | AH111: AA- | AI111: 6.54e-002 | AJ111: =H111+100*O111 -> 121.95999999999999 | AK111: 122.4 | AL111: 17 | AM111: 32.8 | AN111: 43 | AO111: -2.7000000000000003e-002 | AP111: 59 | AQ111: 亚泰转债!
A112: 249 | B112: 128049 | C112: 华源转债! | D112: 2787 | E112: 华源控股 | F112: 造纸包装 | G112: 包装材料 | H112: 111.901 | I112: -1.e-004 | J112: 1.7000000000000001e-003 | K112: 7.06 | L112: 2.8000000000000004e-003 | M112: 115.2 | N112: 7.42 | O112: 0.17600000000000002 | P112: 95.15 | Q112: 转股中 | R112: 4年0.1天 | S112: 2年0.1天 | T112: 3.63 | U112: 2.3 | V112: 6.0000000000000001e-003 | W112: 0.16300000000000001 | X112: 0.155 | Y112: 22 | Z112: 1.49 | AA112: 7.4999999999999997e-003 | AB112: 5.9999999999999995e-004 | AC112: -3.5699999999999996e-002 | AD112: -3.8699999999999998e-002 | AE112: 89.73 | AF112: 89.98 | AG112: 0.59 | AH112: AA- | AI112: 6.54e-002 | AJ112: =H112+100*O112 -> 129.501 | AK112: 128.7 | AL112: 86 | AM112: 38.7 | AN112: 106 | AO112: -8.0000000000000002e-003 | AP112: 52 | AQ112: 华源转债!
A113: 29 | B113: 123064 | C113: 万孚转债! | D113: 300482 | E113: 万孚生物 | F113: 医药 | G113: 医疗器械 | H113: 110.3 | I113: 1.1000000000000001e-003 | J113: 3.4999999999999996e-003 | K113: 66 | L113: 1.5900000000000001e-002 | M113: 115.1 | N113: 93.55 | O113: 0.56299999999999994 | P113: 70.55 | Q113: 3月11天 | R113: 5.76年 | S113: 3.76年 | T113: 6 | U113: 5.9 | V113: 9.0000000000000011e-003 | W113: 2.7000000000000003e-002 | X113: 1.9e-002 | Y113: 226 | Z113: 8.35 | AA113: 7.4999999999999997e-003 | AB113: 2.8000000000000004e-003 | AC113: -1.5900000000000001e-002 | AD113: -1.77e-002 | AE113: 86.92 | AF113: 89.19 | AG113: 0.29 | AH113: AA | AI113: 4.6100000000000002e-002 | AJ113: =H113+100*O113 -> 166.59999999999999 | AK113: 150 | AL113: 262 | AM113: 60.9 | AN113: 259 | AO113: -6.5000000000000002e-002 | AP113: 7 | AQ113: 万孚转债!
A114: 301 | B114: 128018 | C114: 时达转债! | D114: 2527 | E114: 新时达 | F114: 机械装备 | G114: 机器人及 | H114: 107 | I114: -6.3e-003 | J114: -1.5e-003 | K114: 6.24 | L114: -2.5000000000000001e-002 | M114: 109.3 | N114: 7.42 | O114: 0.27200000000000002 | P114: 84.1 | Q114: 转股中 | R114: 2.94年 | S114: 0.94年 | T114: 8.8 | U114: 2 | V114: 2.e-003 | W114: 0.22699999999999998 | X114: 0.191 | Y114: 39 | Z114: 1.52 | AA114: 7.4000000000000003e-003 | AB114: 1.4000000000000002e-003 | AC114: -4.4000000000000004e-002 | AD114: -4.7100000000000003e-002 | AE114: 97.08 | AF114: 96.54 | AG114: 0.31 | AH114: AA | AI114: 4.3799999999999999e-002 | AJ114: =H114+100*O114 -> 134.19999999999999 | AK114: 129.9 | AL114: 100 | AM114: 32.8 | AN114: 44 | AO114: -1.1000000000000001e-002 | AP114: 41 | AQ114: 时达转债!
A115: 18 | B115: 123068 | C115: 弘信转债 | D115: 300657 | E115: 弘信电子 | F115: 电子 | G115: 元器件制 | H115: 116.298 | I115: 3.0000000000000001e-003 | J115: -6.0000000000000001e-003 | K115: 18.65 | L115: -4.3e-003 | M115: 121.2 | N115: 18.45 | O115: 0.151 | P115: 101.08 | Q115: 4月25天 | R115: 5.88年 | S115: 3.88年 | T115: 5.7 | U115: 5.2 | V115: 8.0000000000000002e-003 | W115: 8.900000000000001e-002 | X115: 8.9999999999999997e-002 | Y115: 64 | Z115: 4.36 | AA115: 7.1999999999999998e-003 | AB115: 1.e-003 | AC115: -2.7200000000000002e-002 | AD115: -2.9100000000000001e-002 | AE115: 80.26 | AF115: 83.37 | AG115: 0.7 | AH115: AA- | AI115: 6.7099999999999993e-002 | AJ115: =H115+100*O115 -> 131.398 | AK115: 131.5 | AL115: 123 | AM115: 48.1 | AN115: 192 | AO115: 2.8999999999999998e-002 | AP115: 4 | AQ115: 弘信转债
A116: 175 | B116: 113549 | C116: 白电转债 | D116: 603861 | E116: 白云电器 | F116: 能源电力 | G116: 电力设备 | H116: 110.92 | I116: 4.0000000000000002e-004 | J116: -2.3999999999999998e-003 | K116: 8.66 | L116: -3.4999999999999996e-003 | M116: 114.8 | N116: 8.88 | O116: 0.13699999999999998 | P116: 97.52 | Q116: 转股中 | R116: 4.97年 | S116: 2.97年 | T116: 8.8 | U116: 2.3 | V116: 2.e-003 | W116: 0.23000000000000001 | X116: 0.22399999999999998 | Y116: 38 | Z116: 1.63 | AA116: 7.0999999999999995e-003 | AB116: 1.7000000000000001e-003 | AC116: -2.2599999999999999e-002 | AD116: -2.46e-002 | AE116: 90.25 | AF116: 92.87 | AG116: 0.58 | AH116: AA | AI116: 4.4400000000000002e-002 | AJ116: =H116+100*O116 -> 124.62 | AK116: 124.3 | AL116: 29 | AM116: 31.4 | AN116: 34 | AO116: 1.4999999999999999e-002 | AP116: 32 | AQ116: 白电转债
A117: 190 | B117: 128074 | C117: 游族转债!! | D117: 2174 | E117: 游族网络 | F117: 通信互联 | G117: 互联网 | H117: 116 | I117: -4.7999999999999996e-003 | J117: 4.7999999999999996e-003 | K117: 16.33 | L117: -9.1000000000000004e-003 | M117: 119.9 | N117: 16.97 | O117: 0.20499999999999999 | P117: 96.23 | Q117: 转股中 | R117: 4.82年 | S117: 2.82年 | T117: 6.83 | U117: 8.2 | V117: 1.e-002 | W117: 4.5999999999999999e-002 | X117: 4.4000000000000004e-002 | Y117: 150 | Z117: 2.64 | AA117: 6.9999999999999993e-003 | AB117: -1.e-004 | AC117: -3.8100000000000002e-002 | AD117: -4.0099999999999997e-002 | AE117: 90.92 | AF117: 97.61 | AG117: 0 | AH117: AA | AI117: 4.4400000000000002e-002 | AJ117: =H117+100*O117 -> 136.5 | AK117: 135.8 | AL117: 168 | AM117: 38.2 | AN117: 102 | AO117: -1.2e-002 | AP117: 21 | AQ117: 游族转债!!
A118: 273 | B118: 113508 | C118: 新凤转债! | D118: 603225 | E118: 新凤鸣 | F118: 服装纺织 | G118: 纺织行业 | H118: 109.75 | I118: -2.2000000000000001e-003 | J118: 3.5999999999999999e-003 | K118: 12.82 | L118: 4.6999999999999993e-003 | M118: 112.3 | N118: 15.78 | O118: 0.35100000000000003 | P118: 81.24 | Q118: 转股中 | R118: 3.41年 | S118: 1.41年 | T118: 21.5 | U118: 9.2 | V118: 4.0000000000000001e-003 | W118: 0.12 | X118: 9.8000000000000004e-002 | Y118: 179 | Z118: 1.59 | AA118: 6.8999999999999999e-003 | AB118: 2.0000000000000001e-004 | AC118: -4.0999999999999995e-002 | AD118: -4.4199999999999996e-002 | AE118: 96.05 | AF118: 97.13 | AG118: 0.29 | AH118: AA | AI118: 4.4400000000000002e-002 | AJ118: =H118+100*O118 -> 144.84999999999999 | AK118: 138.3 | AL118: 187 | AM118: 41.1 | AN118: 127 | AO118: 0.107 | AP118: 25 | AQ118: 新凤转债!
A119: 53 | B119: 128122 | C119: 兴森转债 | D119: 2436 | E119: 兴森科技 | F119: 电子 | G119: 元器件制 | H119: 109.84 | I119: 4.0000000000000001e-003 | J119: -4.0000000000000001e-003 | K119: 10.62 | L119: 0. | M119: 113.3 | N119: 14.18 | O119: 0.46700000000000003 | P119: 74.89 | Q119: 2月3天 | R119: 4.65年 | S119: 3.65年 | T119: 2.69 | U119: 2.4 | V119: 8.0000000000000002e-003 | W119: 1.7000000000000001e-002 | X119: 1.3000000000000001e-002 | Y119: 158 | Z119: 5 | AA119: 6.8000000000000005e-003 | AB119: 1.6000000000000001e-003 | AC119: -1.52e-002 | AD119: -1.7000000000000001e-002 | AE119: 87.91 | AF119: 92.79 | AG119: 0.28 | AH119: AA | AI119: 4.4400000000000002e-002 | AJ119: =H119+100*O119 -> 156.54000000000002 | AK119: 144.8 | AL119: 236 | AM119: 52 | AN119: 213 | AO119: -2.1000000000000001e-002 | AP119: 8 | AQ119: 兴森转债
A120: 189 | B120: 123032 | C120: 万里转债!! | D120: 300591 | E120: 万里马 | F120: 服装纺织 | G120: 服装纺织 | H120: 128.29 | I120: -0.156 | J120: 0.13600000000000001 | K120: 8.35 | L120: -2.e-002 | M120: 132 | N120: 6.89 | O120: 5.9000000000000004e-002 | P120: 121.19 | Q120: 转股中 | R120: 4.87年 | S120: 2.87年 | T120: 0.62 | U120: 479 | V120: 5.5099999999999998 | W120: 2.3e-002 | X120: 2.7000000000000003e-002 | Y120: 27 | Z120: 5.5 | AA120: 6.0999999999999995e-003 | AB120: -4.5000000000000005e-003 | AC120: -5.8799999999999998e-002 | AD120: -6.2699999999999992e-002 | AE120: 86 | AF120: 93.42 | AG120: 1 | AH120: A+ | AI120: 7.6399999999999996e-002 | AJ120: =H120+100*O120 -> 134.19 | AK120: 135.4 | AL120: 162 | AM120: 42 | AN120: 135 | AO120: -0.11 | AP120: 41 | AQ120: 万里转债!!
A121: 27 | B121: 128131 | C121: 崇达转2! | D121: 2815 | E121: 崇达技术 | F121: 电子 | G121: 元器件制 | H121: 111.39 | I121: -4.0999999999999995e-003 | J121: 2.3999999999999998e-003 | K121: 16.27 | L121: -3.7000000000000002e-003 | M121: 115.2 | N121: 19.54 | O121: 0.33799999999999997 | P121: 83.27 | Q121: 3月14天 | R121: 5.78年 | S121: 3.78年 | T121: 14 | U121: 1.2 | V121: 1.e-003 | W121: 9.6999999999999989e-002 | X121: 8.1000000000000003e-002 | Y121: 144 | Z121: 3.59 | AA121: 5.8999999999999999e-003 | AB121: 1.1999999999999999e-003 | AC121: -1.8100000000000002e-002 | AD121: -1.9900000000000001e-002 | AE121: 86.94 | AF121: 89.21 | AG121: 0.45 | AH121: AA | AI121: 4.6100000000000002e-002 | AJ121: =H121+100*O121 -> 145.19 | AK121: 139.5 | AL121: 197 | AM121: 50.3 | AN121: 201 | AO121: -8.0000000000000002e-003 | AP121: 4 | AQ121: 崇达转2!
A122: 250 | B122: 110047 | C122: 山鹰转债 | D122: 600567 | E122: 山鹰国际 | F122: 造纸包装 | G122: 包装用纸 | H122: 115 | I122: 3.0999999999999999e-003 | J122: -6.0999999999999995e-003 | K122: 3.3 | L122: -6.0000000000000001e-003 | M122: 117.5 | N122: 3.34 | O122: 0.16399999999999998 | P122: 98.8 | Q122: 转股中 | R122: 3.98年 | S122: 1.98年 | T122: 23 | U122: 9.2 | V122: 3.0000000000000001e-003 | W122: 0.152 | X122: 0.14999999999999999 | Y122: 152 | Z122: 1.03 | AA122: 5.5000000000000005e-003 | AB122: -2.2000000000000001e-003 | AC122: -5.0999999999999997e-002 | AD122: -5.3399999999999996e-002 | AE122: 94.1 | AF122: 99.87 | AG122: 0.51 | AH122: AA+ | AI122: 4.24e-002 | AJ122: =H122+100*O122 -> 131.40000000000001 | AK122: 131.2 | AL122: 115 | AM122: 31.3 | AN122: 32 | AO122: 1.2e-002 | AP122: 34 | AQ122: 山鹰转债
A123: 225 | B123: 127012 | C123: 招路转债! | D123: 1965 | E123: 招商公路 | F123: 机场高速 | G123: 高速 | H123: 105.85 | I123: 2.3999999999999998e-003 | J123: 5.0000000000000001e-004 | K123: 7.18 | L123: 8.3999999999999995e-003 | M123: 108.2 | N123: 8.81 | O123: 0.29899999999999999 | P123: 81.5 | Q123: 转股中 | R123: 4.32年 | S123: 2.32年 | T123: 50 | U123: 7.4 | V123: 1.e-003 | W123: 0.113 | X123: 9.1999999999999998e-002 | Y123: 444 | Z123: 0.91 | AA123: 5.1999999999999998e-003 | AB123: 1.6000000000000001e-003 | AC123: -1.5100000000000001e-002 | AD123: -1.66e-002 | AE123: 92.68 | AF123: 91.78 | AG123: 0.35 | AH123: AAA | AI123: 3.9399999999999998e-002 | AJ123: =H123+100*O123 -> 135.75 | AK123: 130.2 | AL123: 104 | AM123: 37.5 | AN123: 94 | AO123: 1.3000000000000001e-002 | AP123: 37 | AQ123: 招路转债!
A124: 124 | B124: 123047 | C124: 久吾转债 | D124: 300631 | E124: 久吾高科 | F124: 机械装备 | G124: 专用设备 | H124: 126.661 | I124: -1.9400000000000001e-002 | J124: -4.7999999999999996e-003 | K124: 19.44 | L124: -3.2799999999999996e-002 | M124: 130.1 | N124: 17.61 | O124: 0.14699999999999999 | P124: 110.39 | Q124: 转股中 | R124: 5.31年 | S124: 3.31年 | T124: 1.99 | U124: 30 | V124: 0.11699999999999999 | W124: 9.6999999999999989e-002 | X124: 0.107 | Y124: 21 | Z124: 2.9 | AA124: 5.1999999999999998e-003 | AB124: -4.0000000000000001e-003 | AC124: -5.0300000000000004e-002 | AD124: -5.3399999999999996e-002 | AE124: 82 | AF124: 88.31 | AG124: 0.74 | AH124: A+ | AI124: 7.8100000000000003e-002 | AJ124: =H124+100*O124 -> 141.36099999999999 | AK124: 142.9 | AL124: 226 | AM124: 54.6 | AN124: 229 | AO124: -0.13600000000000001 | AP124: 22 | AQ124: 久吾转债
A125: 218 | B125: 128064 | C125: 司尔转债! | D125: 2538 | E125: 司尔特 | F125: 化工 | G125: 农化 | H125: 112.827 | I125: -5.9999999999999995e-004 | J125: 3.4999999999999996e-003 | K125: 5.96 | L125: 5.1000000000000004e-003 | M125: 114.9 | N125: 6.07 | O125: 0.14899999999999999 | P125: 98.19 | Q125: 转股中 | R125: 4.36年 | S125: 2.36年 | T125: 8 | U125: 1.5 | V125: 2.e-003 | W125: 0.187 | X125: 0.184 | Y125: 43 | Z125: 1.12 | AA125: 4.3e-003 | AB125: -1.9e-003 | AC125: -3.4300000000000004e-002 | AD125: -3.6699999999999997e-002 | AE125: 92.75 | AF125: 95.44 | AG125: 0.56 | AH125: AA | AI125: 4.4400000000000002e-002 | AJ125: =H125+100*O125 -> 127.727 | AK125: 127.5 | AL125: 70 | AM125: 32 | AN125: 38 | AO125: 0. | AP125: 56 | AQ125: 司尔转债!
A126: 51 | B126: 128123 | C126: 国光转债 | D126: 2749 | E126: 国光股份 | F126: 化工 | G126: 农化 | H126: 113.5 | I126: -2.9999999999999997e-004 | J126: -1.2999999999999999e-003 | K126: 12.09 | L126: -2.5000000000000001e-003 | M126: 116.2 | N126: 13.7 | O126: 0.28600000000000003 | P126: 88.25 | Q126: 2月6天 | R126: 5.66年 | S126: 3.66年 | T126: 3.2 | U126: 0.9 | V126: 3.0000000000000001e-003 | W126: 6.0999999999999999e-002 | X126: 5.4000000000000006e-002 | Y126: 52 | Z126: 4.24 | AA126: 4.1999999999999997e-003 | AB126: -8.9999999999999998e-004 | AC126: -2.2499999999999999e-002 | AD126: -2.4500000000000001e-002 | AE126: 81.42 | AF126: 81.11 | AG126: 0.62 | AH126: AA- | AI126: 6.7099999999999993e-002 | AJ126: =H126+100*O126 -> 142.09999999999999 | AK126: 138.8 | AL126: 192 | AM126: 57.3 | AN126: 239 | AO126: -3.1e-002 | AP126: 7 | AQ126: 国光转债
A127: 31 | B127: 128129 | C127: 青农转债 | D127: 2958 | E127: 青农商行 | F127: 金融 | G127: 银行行业 | H127: 109.8 | I127: 7.3000000000000001e-003 | J127: 1.6500000000000001e-002 | K127: 5.03 | L127: 4.7899999999999998e-002 | M127: 112.2 | N127: 5.74 | O127: 0.253 | P127: 87.63 | Q127: 3月4天 | R127: 5.74年 | S127: 无权 | T127: 50 | U127: 63 | V127: 1.1000000000000001e-002 | W127: 0.17899999999999999 | X127: 0.157 | Y127: 279 | Z127: 1.08 | AA127: 3.8e-003 | AB127: -1.e-004 | AC127: 无权 | AD127: 无权 | AE127: 无权 | AF127: 89.33 | AG127: 0.5 | AH127: AAA | AI127: 4.1100000000000005e-002 | AJ127: =H127+100*O127 -> 135.09999999999999 | AK127: 132 | AL127: 128 | AM127: 42.6 | AN127: 138 | AO127: 4.9000000000000002e-002 | AP127: 11 | AQ127: 青农转债
A128: 137 | B128: 113567 | C128: 君禾转债 | D128: 603617 | E128: 君禾股份 | F128: 机械装备 | G128: 通用设备 | H128: 117.16 | I128: 2.0999999999999999e-003 | J128: -2.8000000000000004e-003 | K128: 12.26 | L128: -8.0000000000000004e-004 | M128: 119.3 | N128: 11.46 | O128: 9.5000000000000001e-002 | P128: 106.98 | Q128: 转股中 | R128: 5.27年 | S128: 3.27年 | T128: 2.1 | U128: 2.7 | V128: 1.1000000000000001e-002 | W128: 8.5999999999999993e-002 | X128: 9.1999999999999998e-002 | Y128: 24 | Z128: 3.8 | AA128: 3.4999999999999996e-003 | AB128: -2.8999999999999998e-003 | AC128: -3.3300000000000003e-002 | AD128: -3.56e-002 | AE128: 81 | AF128: 81.11 | AG128: 0.77 | AH128: A+ | AI128: 7.8100000000000003e-002 | AJ128: =H128+100*O128 -> 126.66 | AK128: 127.3 | AL128: 68 | AM128: 46.2 | AN128: 172 | AO128: -1.4999999999999999e-002 | AP128: 33 | AQ128: 君禾转债
A129: 127 | B129: 128101 | C129: 联创转债! | D129: 2036 | E129: 联创电子 | F129: 电子 | G129: 液晶显示 | H129: 113.1 | I129: -2.e-003 | J129: -6.7000000000000002e-003 | K129: 11.67 | L129: -2.0199999999999999e-002 | M129: 115.1 | N129: 13.86 | O129: 0.34299999999999997 | P129: 84.2 | Q129: 转股中 | R129: 5.30年 | S129: 3.30年 | T129: 3 | U129: 3.6 | V129: 1.1000000000000001e-002 | W129: 2.5000000000000001e-002 | X129: 2.1000000000000001e-002 | Y129: 122 | Z129: 4.15 | AA129: 3.4000000000000002e-003 | AB129: -1.7000000000000001e-003 | AC129: -2.52e-002 | AD129: -2.7099999999999999e-002 | AE129: 88.75 | AF129: 91.07 | AG129: 0.43 | AH129: AA | AI129: 4.6100000000000002e-002 | AJ129: =H129+100*O129 -> 147.39999999999998 | AK129: 142 | AL129: 221 | AM129: 50.9 | AN129: 205 | AO129: -4.0000000000000001e-003 | AP129: 15 | AQ129: 联创转债!
A130: 48 | B130: 128124 | C130: 科华转债! | D130: 2022 | E130: 科华生物 | F130: 医药 | G130: 生物制药 | H130: 108.201 | I130: -2.8000000000000004e-003 | J130: -3.0000000000000001e-003 | K130: 18 | L130: -1.21e-002 | M130: 110.3 | N130: 21.5 | O130: 0.29199999999999998 | P130: 83.72 | Q130: 2月8天 | R130: 5.67年 | S130: 3.67年 | T130: 7.38 | U130: 1.8 | V130: 2.e-003 | W130: 8.0000000000000002e-002 | X130: 6.7000000000000004e-002 | Y130: 93 | Z130: 3.22 | AA130: 3.4000000000000002e-003 | AB130: 1.e-004 | AC130: -1.2699999999999999e-002 | AD130: -1.43e-002 | AE130: 86.82 | AF130: 85.8 | AG130: 0.48 | AH130: AA | AI130: 4.6100000000000002e-002 | AJ130: =H130+100*O130 -> 137.40099999999998 | AK130: 132.7 | AL130: 136 | AM130: 45.9 | AN130: 166 | AO130: -5.0000000000000003e-002 | AP130: 11 | AQ130: 科华转债!
A131: 123 | B131: 110068 | C131: 龙净转债! | D131: 600388 | E131: 龙净环保 | F131: 城市公用 | G131: 三废处理 | H131: 113.07 | I131: -1.1000000000000001e-003 | J131: 8.3000000000000001e-003 | K131: 10.25 | L131: 1.2800000000000001e-002 | M131: 115 | N131: 10.73 | O131: 0.184 | P131: 95.53 | Q131: 转股中 | R131: 5.32年 | S131: 3.32年 | T131: 20 | U131: 3.2 | V131: 1.e-003 | W131: 0.183 | X131: 0.17399999999999999 | Y131: 110 | Z131: 1.9 | AA131: 3.2000000000000002e-003 | AB131: -1.8e-003 | AC131: -2.52e-002 | AD131: -2.7099999999999999e-002 | AE131: 89.15 | AF131: 91.79 | AG131: 0.56 | AH131: AA+ | AI131: 4.41e-002 | AJ131: =H131+100*O131 -> 131.47 | AK131: 130.6 | AL131: 109 | AM131: 38.8 | AN131: 107 | AO131: -6.9999999999999993e-003 | AP131: 29 | AQ131: 龙净转债!
A132: 40 | B132: 127021 | C132: 特发转2! | D132: 70 | E132: 特发信息 | F132: 通信互联 | G132: 通信设备 | H132: 111.92 | I132: -2.5000000000000001e-003 | J132: -2.2000000000000001e-003 | K132: 10.55 | L132: -1.1200000000000002e-002 | M132: 113.3 | N132: 12.33 | O132: 0.308 | P132: 85.56 | Q132: 2月18天 | R132: 4.69年 | S132: 2.69年 | T132: 5.5 | U132: 2.5 | V132: 4.0000000000000001e-003 | W132: 6.4000000000000001e-002 | X132: 5.5e-002 | Y132: 86 | Z132: 3.04 | AA132: 2.5999999999999999e-003 | AB132: -2.5000000000000001e-003 | AC132: -3.1899999999999998e-002 | AD132: -3.3300000000000003e-002 | AE132: 90.18 | AF132: 92.62 | AG132: 0.42 | AH132: AA | AI132: 4.4400000000000002e-002 | AJ132: =H132+100*O132 -> 142.72 | AK132: 138.3 | AL132: 188 | AM132: 45.7 | AN132: 164 | AO132: 2.9999999999999999e-002 | AP132: 7 | AQ132: 特发转2!
A133: 21 | B133: 128134 | C133: 鸿路转债 | D133: 2541 | E133: 鸿路钢构 | F133: 建筑 | G133: 其他 | H133: 113.356 | I133: 2.0000000000000001e-004 | J133: -3.8e-003 | K133: 34.04 | L133: -9.300000000000001e-003 | M133: 115.1 | N133: 43.74 | O133: 0.45700000000000002 | P133: 77.82 | Q133: 4月19天 | R133: 5.87年 | S133: 3.87年 | T133: 18.8 | U133: 5.1 | V133: 2.e-003 | W133: 0.105 | X133: 8.199999999999999e-002 | Y133: 178 | Z133: 3.33 | AA133: 2.5999999999999999e-003 | AB133: -2.e-003 | AC133: -2.2200000000000001e-002 | AD133: -2.3900000000000001e-002 | AE133: 86.51 | AF133: 88.77 | AG133: 0.38 | AH133: AA | AI133: 4.6100000000000002e-002 | AJ133: =H133+100*O133 -> 159.05599999999998 | AK133: 148.9 | AL133: 257 | AM133: 60.1 | AN133: 256 | AO133: -0.10000000000000001 | AP133: 2 | AQ133: 鸿路转债
A134: 179 | B134: 123033 | C134: 金力转债! | D134: 300748 | E134: 金力永磁 | F134: 电子 | G134: 元器件制 | H134: 120.207 | I134: -1.41e-002 | J134: -5.0000000000000001e-003 | K134: 42.8 | L134: -2.7300000000000001e-002 | M134: 121.5 | N134: 40.97 | O134: 0.151 | P134: 104.47 | Q134: 转股中 | R134: 4.93年 | S134: 2.93年 | T134: 4.35 | U134: 62 | V134: 0.11699999999999999 | W134: 2.4e-002 | X134: 2.6000000000000002e-002 | Y134: 178 | Z134: 13.25 | AA134: 2.2000000000000001e-003 | AB134: -5.1999999999999998e-003 | AC134: -4.3299999999999998e-002 | AD134: -4.6199999999999998e-002 | AE134: 86.54 | AF134: 89.68 | AG134: 0.7 | AH134: AA- | AI134: 6.54e-002 | AJ134: =H134+100*O134 -> 135.30699999999999 | AK134: 135.9 | AL134: 169 | AM134: 46.3 | AN134: 173 | AO134: 5.0000000000000003e-002 | AP134: 28 | AQ134: 金力转债!
A135: 159 | B135: 113559 | C135: 永创转债! | D135: 603901 | E135: 永创智能 | F135: 机械装备 | G135: 专用设备 | H135: 117.72 | I135: 1.7000000000000001e-003 | J135: -9.3999999999999986e-003 | K135: 9.83 | L135: -1.21e-002 | M135: 118.9 | N135: 10.32 | O135: 0.23600000000000002 | P135: 95.25 | Q135: 转股中 | R135: 5年26天 | S135: 3年26天 | T135: 5.1 | U135: 4.8 | V135: 8.0000000000000002e-003 | W135: 0.11800000000000001 | X135: 0.11199999999999999 | Y135: 43 | Z135: 3.12 | AA135: 2.e-003 | AB135: -4.5000000000000005e-003 | AC135: -3.5299999999999998e-002 | AD135: -3.8100000000000002e-002 | AE135: 85.39 | AF135: 86.36 | AG135: 0.64 | AH135: AA- | AI135: 6.7099999999999993e-002 | AJ135: =H135+100*O135 -> 141.31999999999999 | AK135: 140.2 | AL135: 202 | AM135: 53.8 | AN135: 225 | AO135: -4.4999999999999998e-002 | AP135: 22 | AQ135: 永创转债!
A136: 168 | B136: 110063 | C136: 鹰19转债 | D136: 600567 | E136: 山鹰国际 | F136: 造纸包装 | G136: 包装用纸 | H136: 115.17 | I136: 3.2000000000000002e-003 | J136: -6.8000000000000005e-003 | K136: 3.3 | L136: -6.0000000000000001e-003 | M136: 116.2 | N136: 3.3 | O136: 0.152 | P136: 100 | Q136: 转股中 | R136: 5年16天 | S136: 3年16天 | T136: 18.6 | U136: 13 | V136: 6.0000000000000001e-003 | W136: 0.12300000000000001 | X136: 0.12300000000000001 | Y136: 152 | Z136: 1.03 | AA136: 1.8e-003 | AB136: -3.9000000000000003e-003 | AC136: -3.2899999999999999e-002 | AD136: -3.5000000000000003e-002 | AE136: 90.27 | AF136: 93.87 | AG136: 0.59 | AH136: AA+ | AI136: 4.41e-002 | AJ136: =H136+100*O136 -> 130.37 | AK136: 130.3 | AL136: 106 | AM136: 36.5 | AN136: 87 | AO136: 1.2e-002 | AP136: 40 | AQ136: 鹰19转债
A137: 35 | B137: 128128 | C137: 齐翔转2 | D137: 2408 | E137: 齐翔腾达 | F137: 化工 | G137: 化工 | H137: 114.2 | I137: 4.8999999999999998e-003 | J137: -1.44e-002 | K137: 9.45 | L137: -1.2500000000000001e-002 | M137: 115.3 | N137: 8.22 | O137: -6.9999999999999993e-003 | P137: 114.96 | Q137: 3月1天 | R137: 5.73年 | S137: 3.73年 | T137: 29.9 | U137: 111 | V137: 3.2000000000000001e-002 | W137: 0.17800000000000002 | X137: 0.20499999999999999 | Y137: 168 | Z137: 2.05 | AA137: 1.7000000000000001e-003 | AB137: -3.0999999999999999e-003 | AC137: -2.46e-002 | AD137: -2.64e-002 | AE137: 87.15 | AF137: 89.49 | AG137: 0.76 | AH137: AA | AI137: 4.6100000000000002e-002 | AJ137: =H137+100*O137 -> 113.5 | AK137: 113.4 | AL137: 4 | AM137: 23.9 | AN137: 10 | AO137: 6.6000000000000003e-002 | AP137: 30 | AQ137: 齐翔转2
A138: 246 | B138: 128051 | C138: 光华转债! | D138: 2741 | E138: 光华科技 | F138: 电子 | G138: 元器件制 | H138: 115 | I138: 5.1999999999999998e-003 | J138: 6.4000000000000003e-003 | K138: 13.19 | L138: 1.7000000000000001e-002 | M138: 115.5 | N138: 12.72 | O138: 0.109 | P138: 103.69 | Q138: 转股中 | R138: 4年17天 | S138: 2年17天 | T138: 2.5 | U138: 8.6 | V138: 2.9999999999999999e-002 | W138: 5.0999999999999997e-002 | X138: 5.2999999999999999e-002 | Y138: 49 | Z138: 4.08 | AA138: 1.1000000000000001e-003 | AB138: -5.6999999999999993e-003 | AC138: -4.5700000000000005e-002 | AD138: -4.8799999999999996e-002 | AE138: 90.42 | AF138: 89.97 | AG138: 0.69 | AH138: AA- | AI138: 6.54e-002 | AJ138: =H138+100*O138 -> 125.90000000000001 | AK138: 126.3 | AL138: 46 | AM138: 35.9 | AN138: 74 | AO138: -2.9999999999999999e-002 | AP138: 24 | AQ138: 光华转债!
A139: 25 | B139: 123066 | C139: 赛意转债 | D139: 300687 | E139: 赛意信息 | F139: 计算机及 | G139: 软件开发 | H139: 120.88 | I139: -1.09e-002 | J139: 2.0999999999999999e-003 | K139: 24.86 | L139: -1.11e-002 | M139: 121.4 | N139: 22.58 | O139: 9.8000000000000004e-002 | P139: 110.1 | Q139: 3月25天 | R139: 5.80年 | S139: 3.80年 | T139: 3.2 | U139: 8.5 | V139: 2.2000000000000002e-002 | W139: 5.9000000000000004e-002 | X139: 6.5000000000000002e-002 | Y139: 54 | Z139: 5.7 | AA139: 8.0000000000000004e-004 | AB139: -5.5000000000000005e-003 | AC139: -3.6799999999999999e-002 | AD139: -3.8699999999999998e-002 | AE139: 77.64 | AF139: 79.21 | AG139: 0.79 | AH139: A+ | AI139: 7.8100000000000003e-002 | AJ139: =H139+100*O139 -> 130.68000000000001 | AK139: 131.7 | AL139: 125 | AM139: 52.5 | AN139: 218 | AO139: -6.6000000000000003e-002 | AP139: 4 | AQ139: 赛意转债
A140: 60 | B140: 113593 | C140: 沪工转债 | D140: 603131 | E140: 上海沪工 | F140: 机械装备 | G140: 通用设备 | H140: 121.44 | I140: 2.8000000000000004e-003 | J140: -5.1999999999999998e-003 | K140: 24.66 | L140: -2.8000000000000004e-003 | M140: 121.6 | N140: 21.32 | O140: 5.0000000000000003e-002 | P140: 115.67 | Q140: 59天 | R140: 5.64年 | S140: 3.64年 | T140: 4 | U140: 15 | V140: 3.1e-002 | W140: 5.0999999999999997e-002 | X140: 5.9000000000000004e-002 | Y140: 78 | Z140: 6.36 | AA140: 2.0000000000000001e-004 | AB140: -6.3e-003 | AC140: -3.8800000000000001e-002 | AD140: -4.0999999999999995e-002 | AE140: 78.78 | AF140: 80.32 | AG140: 0.83 | AH140: A+ | AI140: 7.8100000000000003e-002 | AJ140: =H140+100*O140 -> 126.44 | AK140: 127.2 | AL140: 64 | AM140: 46.9 | AN140: 179 | AO140: 8.5999999999999993e-002 | AP140: 6 | AQ140: 沪工转债
A141: 104 | B141: 128107 | C141: 交科转债 | D141: 2061 | E141: 浙江交科 | F141: 建筑 | G141: 建筑工程 | H141: 115.301 | I141: -5.1999999999999998e-003 | J141: 6.3e-003 | K141: 5.56 | L141: 1.8e-003 | M141: 115.3 | N141: 5.36 | O141: 0.11199999999999999 | P141: 103.73 | Q141: 转股中 | R141: 5.40年 | S141: 3.40年 | T141: 25 | U141: 3.4 | V141: 1.e-003 | W141: 0.32700000000000001 | X141: 0.33899999999999997 | Y141: 76 | Z141: 0.96 | AA141: 0. | AB141: -5.0000000000000001e-003 | AC141: -2.9300000000000003e-002 | AD141: -3.1300000000000001e-002 | AE141: 89.14 | AF141: 91.77 | AG141: 0.65 | AH141: AA+ | AI141: 4.41e-002 | AJ141: =H141+100*O141 -> 126.501 | AK141: 126.9 | AL141: 57 | AM141: 35.1 | AN141: 64 | AO141: 9.0000000000000011e-003 | AP141: 15 | AQ141: 交科转债
A142: 115 | B142: 128105 | C142: 长集转债 | D142: 2616 | E142: 长青集团 | F142: 城市公用 | G142: 三废处理 | H142: 115.368 | I142: 1.5e-003 | J142: -3.0000000000000001e-003 | K142: 8.24 | L142: -2.3999999999999998e-003 | M142: 115.3 | N142: 8.11 | O142: 0.13500000000000001 | P142: 101.6 | Q142: 转股中 | R142: 5.36年 | S142: 3.36年 | T142: 8 | U142: 9.1 | V142: 1.e-002 | W142: 0.13100000000000001 | X142: 0.13300000000000001 | Y142: 61 | Z142: 2.43 | AA142: -1.e-004 | AB142: -5.1999999999999998e-003 | AC142: -2.98e-002 | AD142: -3.1699999999999999e-002 | AE142: 88.68 | AF142: 90.99 | AG142: 0.64 | AH142: AA | AI142: 4.6100000000000002e-002 | AJ142: =H142+100*O142 -> 128.86799999999999 | AK142: 129.1 | AL142: 92 | AM142: 38.1 | AN142: 101 | AO142: -5.4000000000000006e-002 | AP142: 7 | AQ142: 长集转债
A143: 15 | B143: 128135 | C143: 洽洽转债 | D143: 2557 | E143: 洽洽食品 | F143: 食品饮料 | G143: 休闲食品 | H143: 120.399 | I143: 4.1999999999999997e-003 | J143: -1.4000000000000002e-003 | K143: 56.36 | L143: 5.4000000000000003e-003 | M143: 120.2 | N143: 60.83 | O143: 0.29899999999999999 | P143: 92.65 | Q143: 5月0天 | R143: 5.90年 | S143: 3.90年 | T143: 13.4 | U143: 57 | V143: 3.5000000000000003e-002 | W143: 4.7e-002 | X143: 4.2999999999999997e-002 | Y143: 286 | Z143: 7.45 | AA143: -2.9999999999999997e-004 | AB143: -6.0999999999999995e-003 | AC143: -3.6400000000000002e-002 | AD143: -3.7999999999999999e-002 | AE143: 86.48 | AF143: 92.57 | AG143: 0.52 | AH143: AA | AI143: 4.6100000000000002e-002 | AJ143: =H143+100*O143 -> 150.29900000000001 | AK143: 148.1 | AL143: 253 | AM143: 55.6 | AN143: 233 | AO143: 1.6e-002 | AP143: 4 | AQ143: 洽洽转债
A144: 95 | B144: 123051 | C144: 今天转债 | D144: 300532 | E144: 今天国际 | F144: 计算机及 | G144: 软件开发 | H144: 123.041 | I144: -1.41e-002 | J144: -9.1000000000000004e-003 | K144: 10.38 | L144: -2.81e-002 | M144: 122.8 | N144: 8.8 | O144: 4.2999999999999997e-002 | P144: 117.95 | Q144: 13天 | R144: 5.52年 | S144: 3.52年 | T144: 2.8 | U144: 30 | V144: 8.6999999999999994e-002 | W144: 9.9000000000000005e-002 | X144: 0.11599999999999999 | Y144: 28 | Z144: 3.56 | AA144: -4.0000000000000002e-004 | AB144: -7.3000000000000001e-003 | AC144: -4.3299999999999998e-002 | AD144: -4.5599999999999995e-002 | AE144: 79.67 | AF144: 81.94 | AG144: 0.82 | AH144: A+ | AI144: 7.8100000000000003e-002 | AJ144: =H144+100*O144 -> 127.34099999999999 | AK144: 128.1 | AL144: 78 | AM144: 46.2 | AN144: 171 | AO144: -0.106 | AP144: 11 | AQ144: 今天转债
A145: 22 | B145: 113603 | C145: 东缆转债 | D145: 603606 | E145: 东方电缆 | F145: 能源电力 | G145: 电力设备 | H145: 115.41 | I145: -1.8e-003 | J145: -2.0999999999999999e-003 | K145: 21.39 | L145: -7.4000000000000003e-003 | M145: 115.1 | N145: 23.88 | O145: 0.28800000000000003 | P145: 89.57 | Q145: 4月3天 | R145: 5.82年 | S145: 3.82年 | T145: 8 | U145: 3.7 | V145: 4.0000000000000001e-003 | W145: 5.7000000000000002e-002 | X145: 5.0999999999999997e-002 | Y145: 140 | Z145: 5.17 | AA145: -5.0000000000000001e-004 | AB145: -5.1000000000000004e-003 | AC145: -2.69e-002 | AD145: -2.8500000000000001e-002 | AE145: 86.67 | AF145: 88.93 | AG145: 0.53 | AH145: AA | AI145: 4.6100000000000002e-002 | AJ145: =H145+100*O145 -> 144.21000000000001 | AK145: 141.2 | AL145: 215 | AM145: 52.3 | AN145: 215 | AO145: -1.e-003 | AP145: 4 | AQ145: 东缆转债
A146: 276 | B146: 127006 | C146: 敖东转债! | D146: 623 | E146: 吉林敖东 | F146: 金融 | G146: 证券行业 | H146: 108.228 | I146: 5.4000000000000003e-003 | J146: -3.5999999999999999e-003 | K146: 17.43 | L146: 5.1999999999999998e-003 | M146: 108 | N146: 20.42 | O146: 0.26800000000000002 | P146: 85.36 | Q146: 转股中 | R146: 3.29年 | S146: 1.29年 | T146: 24.1 | U146: 11 | V146: 4.0000000000000001e-003 | W146: 0.11900000000000001 | X146: 0.10099999999999999 | Y146: 203 | Z146: 0.89 | AA146: -5.9999999999999995e-004 | AB146: -5.1999999999999998e-003 | AC146: -4.2199999999999994e-002 | AD146: -4.4400000000000002e-002 | AE146: 95.73 | AF146: 94.39 | AG146: 0.35 | AH146: AA+ | AI146: 4.24e-002 | AJ146: =H146+100*O146 -> 135.02799999999999 | AK146: 131.1 | AL146: 114 | AM146: 35.4 | AN146: 66 | AO146: 5.0000000000000001e-003 | AP146: 27 | AQ146: 敖东转债!
A147: 78 | B147: 123056 | C147: 雪榕转债 | D147: 300511 | E147: 雪榕生物 | F147: 农业 | G147: 种植业 | H147: 122.047 | I147: 5.4000000000000003e-003 | J147: 2.0799999999999999e-002 | K147: 13.8 | L147: 3.2199999999999999e-002 | M147: 121.1 | N147: 11.89 | O147: 5.2000000000000005e-002 | P147: 116.06 | Q147: 38天 | R147: 5.57年 | S147: 3.57年 | T147: 5.85 | U147: 39 | V147: 5.4000000000000006e-002 | W147: 9.6000000000000002e-002 | X147: 0.111 | Y147: 61 | Z147: 3.18 | AA147: -1.4000000000000002e-003 | AB147: -7.9000000000000008e-003 | AC147: -4.2199999999999994e-002 | AD147: -4.4199999999999996e-002 | AE147: 81.8 | AF147: 84.98 | AG147: 0.81 | AH147: AA- | AI147: 6.7099999999999993e-002 | AJ147: =H147+100*O147 -> 127.247 | AK147: 128 | AL147: 75 | AM147: 43.1 | AN147: 140 | AO147: -4.9000000000000002e-002 | AP147: 11 | AQ147: 雪榕转债
A148: 108 | B148: 123050 | C148: 聚飞转债 | D148: 300303 | E148: 聚飞光电 | F148: 电子 | G148: LED制 | H148: 125.201 | I148: -1.3300000000000001e-002 | J148: 1.72e-002 | K148: 5.96 | L148: 5.1000000000000004e-003 | M148: 124.2 | N148: 5.18 | O148: 8.8000000000000009e-002 | P148: 115.06 | Q148: 转股中 | R148: 5.38年 | S148: 3.38年 | T148: 7.05 | U148: 3.1 | V148: 3.0000000000000001e-003 | W148: 9.3000000000000013e-002 | X148: 0.106 | Y148: 76 | Z148: 3.28 | AA148: -1.5e-003 | AB148: -9.0000000000000011e-003 | AC148: -5.1200000000000002e-002 | AD148: -5.33e-002 | AE148: 82.94 | AF148: 88.26 | AG148: 0.77 | AH148: AA- | AI148: 6.7099999999999993e-002 | AJ148: =H148+100*O148 -> 134.001 | AK148: 135.3 | AL148: 160 | AM148: 47.1 | AN148: 184 | AO148: -2.7000000000000003e-002 | AP148: 12 | AQ148: 聚飞转债
A149: 267 | B149: 123010 | C149: 博世转债! | D149: 300422 | E149: 博世科 | F149: 城市公用 | G149: 三废处理 | H149: 112.962 | I149: 9.0000000000000011e-003 | J149: 9.7000000000000003e-003 | K149: 12.35 | L149: 2.8300000000000002e-002 | M149: 112.3 | N149: 12.2 | O149: 0.11599999999999999 | P149: 101.23 | Q149: 转股中 | R149: 3.60年 | S149: 1.60年 | T149: 4.3 | U149: 4 | V149: 8.0000000000000002e-003 | W149: 8.5999999999999993e-002 | X149: 8.6999999999999994e-002 | Y149: 50 | Z149: 2.12 | AA149: -1.7000000000000001e-003 | AB149: -7.9000000000000008e-003 | AC149: -5.2300000000000006e-002 | AD149: -5.5099999999999996e-002 | AE149: 91.98 | AF149: 89.79 | AG149: 0.66 | AH149: AA- | AI149: 6.54e-002 | AJ149: =H149+100*O149 -> 124.562 | AK149: 124.7 | AL149: 31 | AM149: 32.7 | AN149: 42 | AO149: 5.9000000000000004e-002 | AP149: 28 | AQ149: 博世转债!
A150: 233 | B150: 128057 | C150: 博彦转债 | D150: 2649 | E150: 博彦科技 | F150: 计算机及 | G150: 软件开发 | H150: 117.997 | I150: 1.9e-003 | J150: 3.5999999999999999e-003 | K150: 9.59 | L150: 7.4000000000000003e-003 | M150: 117.1 | N150: 8.72 | O150: 7.2999999999999995e-002 | P150: 109.98 | Q150: 转股中 | R150: 4.27年 | S150: 2.27年 | T150: 5.29 | U150: 3.2 | V150: 5.0000000000000001e-003 | W150: 0.10400000000000001 | X150: 0.114 | Y150: 51 | Z150: 1.79 | AA150: -1.8e-003 | AB150: -8.8000000000000005e-003 | AC150: -5.2600000000000001e-002 | AD150: -5.5300000000000002e-002 | AE150: 88.97 | AF150: 89.92 | AG150: 0.75 | AH150: AA- | AI150: 6.54e-002 | AJ150: =H150+100*O150 -> 125.297 | AK150: 126 | AL150: 41 | AM150: 36.1 | AN150: 76 | AO150: -4.9000000000000002e-002 | AP150: 28 | AQ150: 博彦转债
A151: 248 | B151: 110048 | C151: 福能转债! | D151: 600483 | E151: 福能股份 | F151: 能源电力 | G151: 电力供应 | H151: 114.81 | I151: -1.7000000000000001e-003 | J151: 1.e-003 | K151: 7.83 | L151: -1.2999999999999999e-003 | M151: 113.9 | N151: 8.12 | O151: 0.191 | P151: 96.43 | Q151: 转股中 | R151: 4年10天 | S151: 2年10天 | T151: 28.3 | U151: 7.4 | V151: 2.e-003 | W151: 0.20499999999999999 | X151: 0.19800000000000001 | Y151: 138 | Z151: 0.98 | AA151: -2.e-003 | AB151: -8.199999999999999e-003 | AC151: -4.7100000000000003e-002 | AD151: -4.99e-002 | AE151: 94.5 | AF151: 96.73 | AG151: 0.53 | AH151: AA+ | AI151: 4.24e-002 | AJ151: =H151+100*O151 -> 133.91 | AK151: 133.2 | AL151: 142 | AM151: 36.5 | AN151: 86 | AO151: 1.2e-002 | AP151: 9 | AQ151: 福能转债!
A152: 223 | B152: 123025 | C152: 精测转债!! | D152: 300567 | E152: 精测电子 | F152: 电子 | G152: 液晶显示 | H152: 118.37 | I152: -3.4000000000000002e-003 | J152: 2.9999999999999997e-004 | K152: 47.28 | L152: -5.3e-003 | M152: 117.3 | N152: 49.95 | O152: 0.251 | P152: 94.65 | Q152: 转股中 | R152: 4.33年 | S152: 2.33年 | T152: 3.09 | U152: 7.2 | V152: 2.e-002 | W152: 2.6000000000000002e-002 | X152: 2.5000000000000001e-002 | Y152: 117 | Z152: 7.51 | AA152: -2.0999999999999999e-003 | AB152: -9.1000000000000004e-003 | AC152: -5.2400000000000002e-002 | AD152: -5.4900000000000004e-002 | AE152: 88.63 | AF152: 89.71 | AG152: 0.59 | AH152: AA- | AI152: 6.54e-002 | AJ152: =H152+100*O152 -> 143.47 | AK152: 142.1 | AL152: 222 | AM152: 52.4 | AN152: 216 | AO152: -6.7000000000000004e-002 | AP152: 18 | AQ152: 精测转债!!
A153: 72 | B153: 123057 | C153: 美联转债 | D153: 300586 | E153: 美联新材 | F153: 化工 | G153: 橡胶塑料 | H153: 119.6 | I153: -1.5600000000000001e-002 | J153: 1.9199999999999998e-002 | K153: 10.38 | L153: 4.7999999999999996e-003 | M153: 118.2 | N153: 9.91 | O153: 0.14199999999999999 | P153: 104.74 | Q153: 41天 | R153: 5.59年 | S153: 3.59年 | T153: 2.07 | U153: 499 | V153: 1.98 | W153: 4.4000000000000004e-002 | X153: 4.5999999999999999e-002 | Y153: 47 | Z153: 6.36 | AA153: -2.0999999999999999e-003 | AB153: -7.8000000000000005e-003 | AC153: -3.6600000000000001e-002 | AD153: -3.8599999999999995e-002 | AE153: 81.79 | AF153: 82.87 | AG153: 0.75 | AH153: AA- | AI153: 6.7099999999999993e-002 | AJ153: =H153+100*O153 -> 133.79999999999998 | AK153: 134.5 | AL153: 153 | AM153: 51.6 | AN153: 210 | AO153: -6.2e-002 | AP153: 10 | AQ153: 美联转债
A154: 59 | B154: 127020 | C154: 中金转债 | D154: 60 | E154: 中金岭南 | F154: 有色金属 | G154: 有色行业 | H154: 115.332 | I154: -7.9000000000000008e-003 | J154: 1.2999999999999999e-003 | K154: 4.88 | L154: -1.01e-002 | M154: 113.7 | N154: 4.71 | O154: 0.113 | P154: 103.61 | Q154: 59天 | R154: 5.64年 | S154: 3.64年 | T154: 38 | U154: 43 | V154: 1.e-002 | W154: 0.218 | X154: 0.22600000000000001 | Y154: 174 | Z154: 1.55 | AA154: -2.5999999999999999e-003 | AB154: -6.8999999999999999e-003 | AC154: -3.0800000000000001e-002 | AD154: -3.1899999999999998e-002 | AE154: 87 | AF154: 89.4 | AG154: 0.65 | AH154: AA+ | AI154: 4.41e-002 | AJ154: =H154+100*O154 -> 126.63199999999999 | AK154: 127.1 | AL154: 58 | AM154: 37.7 | AN154: 98 | AO154: 6.6000000000000003e-002 | AP154: 13 | AQ154: 中金转债
A155: 30 | B155: 128130 | C155: 景兴转债 | D155: 2067 | E155: 景兴纸业 | F155: 造纸包装 | G155: 包装用纸 | H155: 116.9 | I155: 1.21e-002 | J155: -1.21e-002 | K155: 3.59 | L155: 0. | M155: 115.1 | N155: 3.4 | O155: 0.107 | P155: 105.59 | Q155: 3月7天 | R155: 5.76年 | S155: 3.76年 | T155: 12.8 | U155: 8.9 | V155: 6.0000000000000001e-003 | W155: 0.32100000000000001 | X155: 0.33899999999999997 | Y155: 40 | Z155: 0.88 | AA155: -2.7000000000000001e-003 | AB155: -7.4000000000000003e-003 | AC155: -3.0499999999999999e-002 | AD155: -3.2199999999999999e-002 | AE155: 86.93 | AF155: 89.2 | AG155: 0.67 | AH155: AA | AI155: 4.6100000000000002e-002 | AJ155: =H155+100*O155 -> 127.60000000000001 | AK155: 128.2 | AL155: 81 | AM155: 39 | AN155: 109 | AO155: 2.7999999999999997e-002 | AP155: 10 | AQ155: 景兴转债
A156: 4 | B156: 123075 | C156: 贝斯转债 | D156: 300580 | E156: 贝斯特 | F156: 汽车 | G156: 零部件制 | H156: 117.31 | I156: -1.e-003 | J156: 6.1999999999999998e-003 | K156: 23.98 | L156: 7.0999999999999995e-003 | M156: 115.5 | N156: 23.99 | O156: 0.17399999999999999 | P156: 99.96 | Q156: 5月10天 | R156: 5.93年 | S156: 3.93年 | T156: 6 | U156: 86 | V156: 0.12300000000000001 | W156: 0.125 | X156: 0.125 | Y156: 48 | Z156: 2.98 | AA156: -2.7000000000000001e-003 | AB156: -7.3000000000000001e-003 | AC156: -2.9600000000000001e-002 | AD156: -3.1300000000000001e-002 | AE156: 79.77 | AF156: 79.17 | AG156: 0.73 | AH156: AA- | AI156: 6.7099999999999993e-002 | AJ156: =H156+100*O156 -> 134.71000000000001 | AK156: 134.7 | AL156: 156 | AM156: 54.9 | AN156: 230 | AO156: -9.6000000000000002e-002 | AP156: 1 | AQ156: 贝斯转债
A157: 80 | B157: 113588 | C157: 润达转债 | D157: 603108 | E157: 润达医疗 | F157: 医药 | G157: 医疗器械 | H157: 116.21 | I157: 1.8e-003 | J157: 2.8000000000000004e-003 | K157: 12.8 | L157: 7.9000000000000008e-003 | M157: 114.2 | N157: 13.36 | O157: 0.21299999999999999 | P157: 95.81 | Q157: 26天 | R157: 5.55年 | S157: 3.55年 | T157: 5.5 | U157: 1.1 | V157: 2.e-003 | W157: 7.400000000000001e-002 | X157: 7.0999999999999994e-002 | Y157: 74 | Z157: 2.47 | AA157: -3.2000000000000002e-003 | AB157: -7.8000000000000005e-003 | AC157: -3.04e-002 | AD157: -3.2199999999999999e-002 | AE157: 87.83 | AF157: 89.34 | AG157: 0.59 | AH157: AA | AI157: 4.6100000000000002e-002 | AJ157: =H157+100*O157 -> 137.50999999999999 | AK157: 136.6 | AL157: 175 | AM157: 47.3 | AN157: 187 | AO157: -6.0999999999999999e-002 | AP157: 7 | AQ157: 润达转债
A158: 20 | B158: 113604 | C158: 多伦转债 | D158: 603528 | E158: 多伦科技 | F158: 计算机及 | G158: 软件开发 | H158: 119.7 | I158: -8.5000000000000006e-003 | J158: 9.1999999999999998e-003 | K158: 11.27 | L158: 8.9999999999999998e-004 | M158: 117.3 | N158: 10.44 | O158: 0.109 | P158: 107.95 | Q158: 4月23天 | R158: 5.88年 | S158: 3.88年 | T158: 6.4 | U158: 25 | V158: 3.3000000000000002e-002 | W158: 9.0999999999999998e-002 | X158: 9.8000000000000004e-002 | Y158: 71 | Z158: 4.37 | AA158: -3.4999999999999996e-003 | AB158: -8.6e-003 | AC158: -3.49e-002 | AD158: -3.6600000000000001e-002 | AE158: 80.03 | AF158: 80.67 | AG158: 0.78 | AH158: AA- | AI158: 6.7099999999999993e-002 | AJ158: =H158+100*O158 -> 130.59999999999999 | AK158: 131.4 | AL158: 120 | AM158: 50.8 | AN158: 204 | AO158: -6.7000000000000004e-002 | AP158: 2 | AQ158: 多伦转债
A159: 3 | B159: 110076 | C159: 华海转债 | D159: 600521 | E159: 华海药业 | F159: 医药 | G159: 医药行业 | H159: 117.84 | I159: 2.5999999999999999e-003 | J159: -5.9999999999999995e-004 | K159: 29.99 | L159: 4.0000000000000001e-003 | M159: 115.1 | N159: 34.66 | O159: 0.36200000000000004 | P159: 86.53 | Q159: 5月10天 | R159: 5.93年 | S159: 3.93年 | T159: 18.4 | U159: 97 | V159: 4.4999999999999998e-002 | W159: 4.2000000000000003e-002 | X159: 3.7000000000000005e-002 | Y159: 436 | Z159: 7.06 | AA159: -4.0000000000000001e-003 | AB159: -8.5000000000000006e-003 | AC159: -3.1200000000000002e-002 | AD159: -3.2799999999999996e-002 | AE159: 86.25 | AF159: 88.51 | AG159: 0.49 | AH159: AA | AI159: 4.6100000000000002e-002 | AJ159: =H159+100*O159 -> 154.04000000000002 | AK159: 149.2 | AL159: 259 | AM159: 60.6 | AN159: 258 | AO159: -8.0000000000000002e-002 | AP159: 2 | AQ159: 华海转债
A160: 167 | B160: 113553 | C160: 金牌转债! | D160: 603180 | E160: 金牌厨柜 | F160: 其他 | G160: 家居用品 | H160: 127.28 | I160: -1.6299999999999999e-002 | J160: 1.1999999999999999e-003 | K160: 56.19 | L160: -1.5100000000000001e-002 | M160: 124.6 | N160: 44.14 | O160: 0. | P160: 127.3 | Q160: 转股中 | R160: 5年16天 | S160: 3年16天 | T160: 0.95 | U160: 5.6 | V160: 4.5999999999999999e-002 | W160: 1.7000000000000001e-002 | X160: 2.2000000000000002e-002 | Y160: 55 | Z160: 4.01 | AA160: -4.3e-003 | AB160: -1.23e-002 | AC160: -6.1399999999999996e-002 | AD160: -6.3600000000000004e-002 | AE160: 84.75 | AF160: 90.49 | AG160: 1 | AH160: AA- | AI160: 6.7099999999999993e-002 | AJ160: =H160+100*O160 -> 127.28 | AK160: 127.3 | AL160: 65 | AM160: 36.8 | AN160: 89 | AO160: -4.2000000000000003e-002 | AP160: 15 | AQ160: 金牌转债!
A161: 142 | B161: 113565 | C161: 宏辉转债 | D161: 603336 | E161: 宏辉果蔬 | F161: 农业 | G161: 农产品加 | H161: 120.94 | I161: 5.8200000000000002e-002 | J161: 2.2499999999999999e-002 | K161: 11.29 | L161: 0.10000000000000001 | M161: 118.2 | N161: 10 | O161: 7.0999999999999994e-002 | P161: 112.9 | Q161: 转股中 | R161: 5.25年 | S161: 3.25年 | T161: 3.09 | U161: 660 | V161: 1.76 | W161: 8.3000000000000004e-002 | X161: 9.4e-002 | Y161: 37 | Z161: 4.01 | AA161: -4.5000000000000005e-003 | AB161: -1.0500000000000001e-002 | AC161: -4.3400000000000001e-002 | AD161: -4.5499999999999999e-002 | AE161: 83.65 | AF161: 84.74 | AG161: 0.8 | AH161: AA- | AI161: 6.7099999999999993e-002 | AJ161: =H161+100*O161 -> 128.03999999999999 | AK161: 129 | AL161: 90 | AM161: 44.2 | AN161: 149 | AO161: 9.8000000000000004e-002 | AP161: 20 | AQ161: 宏辉转债
A162: 102 | B162: 113579 | C162: 健友转债 | D162: 603707 | E162: 健友股份 | F162: 医药 | G162: 原料药 | H162: 117.13 | I162: -4.0000000000000002e-004 | J162: -1.6000000000000001e-003 | K162: 36.07 | L162: -4.4000000000000003e-003 | M162: 114.2 | N162: 42.05 | O162: 0.36499999999999999 | P162: 85.78 | Q162: 转股中 | R162: 5.40年 | S162: 3.40年 | T162: 5.03 | U162: 2.9 | V162: 5.0000000000000001e-003 | W162: 1.4999999999999999e-002 | X162: 1.3000000000000001e-002 | Y162: 337 | Z162: 9.83 | AA162: -4.7999999999999996e-003 | AB162: -9.3999999999999986e-003 | AC162: -3.3799999999999997e-002 | AD162: -3.5699999999999996e-002 | AE162: 88.43 | AF162: 89.95 | AG162: 0.47 | AH162: AA | AI162: 4.6100000000000002e-002 | AJ162: =H162+100*O162 -> 153.63 | AK162: 148.5 | AL162: 256 | AM162: 58.5 | AN162: 247 | AO162: -7.0999999999999994e-002 | AP162: 7 | AQ162: 健友转债
A163: 141 | B163: 113564 | C163: 天目转债 | D163: 603136 | E163: 天目湖 | F163: 旅游餐饮 | G163: 旅游 | H163: 129.91 | I163: -1.46e-002 | J163: 2.0999999999999999e-003 | K163: 30.61 | L163: -1.4800000000000001e-002 | M163: 126.7 | N163: 23.8 | O163: 1.e-002 | P163: 128.61 | Q163: 转股中 | R163: 5.26年 | S163: 3.26年 | T163: 2.87 | U163: 11 | V163: 2.8999999999999998e-002 | W163: 8.0000000000000002e-002 | X163: 0.10300000000000001 | Y163: 36 | Z163: 3.81 | AA163: -4.8999999999999998e-003 | AB163: -1.3100000000000001e-002 | AC163: -6.2100000000000002e-002 | AD163: -6.4399999999999999e-002 | AE163: 84.04 | AF163: 90.81 | AG163: 0.84 | AH163: AA- | AI163: 6.7099999999999993e-002 | AJ163: =H163+100*O163 -> 130.91 | AK163: 131.2 | AL163: 116 | AM163: 40.4 | AN163: 120 | AO163: 3.7000000000000005e-002 | AP163: 13 | AQ163: 天目转债
A164: 5 | B164: 113607 | C164: N伟20转 | D164: 603568 | E164: 伟明环保 | F164: 城市公用 | G164: 三废处理 | H164: 118.51 | I164: 0.185 | J164: 0. | K164: 21.14 | L164: 0. | M164: 115.1 | N164: 22.01 | O164: 0.23399999999999999 | P164: 96.05 | Q164: 5月10天 | R164: 5.93年 | S164: 3.93年 | T164: 12 | U164: 618 | V164: 0.42799999999999999 | W164: 4.4999999999999998e-002 | X164: 4.2999999999999997e-002 | Y164: 266 | Z164: 5.29 | AA164: -5.0000000000000001e-003 | AB164: -9.4999999999999998e-003 | AC164: -3.2500000000000001e-002 | AD164: -3.4099999999999998e-002 | AE164: 86.25 | AF164: 88.51 | AG164: 0.6 | AH164: AA | AI164: 4.6100000000000002e-002 | AJ164: =H164+100*O164 -> 141.91 | AK164: 141 | AL164: 211 | AM164: 52.5 | AN164: 219 | AO164: -3.7999999999999999e-002 | AP164: 1 | AQ164: N伟20转
A165: 56 | B165: 123060 | C165: 苏试转债 | D165: 300416 | E165: 苏试试验 | F165: 机械装备 | G165: 专用设备 | H165: 121 | I165: -4.4000000000000003e-003 | J165: 4.4000000000000003e-003 | K165: 22.51 | L165: 0. | M165: 117.6 | N165: 23.86 | O165: 0.28300000000000003 | P165: 94.34 | Q165: 2月1天 | R165: 5.65年 | S165: 3.65年 | T165: 3.1 | U165: 13 | V165: 3.6000000000000004e-002 | W165: 6.8000000000000005e-002 | X165: 6.4000000000000001e-002 | Y165: 46 | Z165: 4.61 | AA165: -5.1000000000000004e-003 | AB165: -1.0500000000000001e-002 | AC165: -3.95e-002 | AD165: -4.1299999999999996e-002 | AE165: 81.35 | AF165: 82.12 | AG165: 0.66 | AH165: AA- | AI165: 6.7099999999999993e-002 | AJ165: =H165+100*O165 -> 149.30000000000001 | AK165: 147.7 | AL165: 251 | AM165: 65.5 | AN165: 273 | AO165: -4.2999999999999997e-002 | AP165: 7 | AQ165: 苏试转债
A166: 282 | B166: 128034 | C166: 江银转债! | D166: 2807 | E166: 江阴银行 | F166: 金融 | G166: 银行行业 | H166: 111.05 | I166: 8.199999999999999e-003 | J166: 3.7000000000000002e-003 | K166: 4.23 | L166: 2.4199999999999999e-002 | M166: 109.1 | N166: 4.5 | O166: 0.18100000000000002 | P166: 94 | Q166: 转股中 | R166: 3.16年 | S166: 无权 | T166: 17.6 | U166: 7.8 | V166: 4.0000000000000001e-003 | W166: 0.191 | X166: 0.17999999999999999 | Y166: 92 | Z166: 0.81 | AA166: -5.6999999999999993e-003 | AB166: -1.1000000000000001e-002 | AC166: 无权 | AD166: 无权 | AE166: 无权 | AF166: 95.88 | AG166: 0.49 | AH166: AA+ | AI166: 4.24e-002 | AJ166: =H166+100*O166 -> 129.15000000000001 | AK166: 128.1 | AL166: 77 | AM166: 32.2 | AN166: 39 | AO166: 3.1e-002 | AP166: 27 | AQ166: 江银转债!
A167: 161 | B167: 113556 | C167: 至纯转债! | D167: 603690 | E167: 至纯科技 | F167: 机械装备 | G167: 专用设备 | H167: 130.62 | I167: 4.7999999999999996e-003 | J167: 6.4000000000000003e-003 | K167: 35.58 | L167: 1.34e-002 | M167: 126.8 | N167: 29.37 | O167: 7.8e-002 | P167: 121.14 | Q167: 转股中 | R167: 5年23天 | S167: 3年23天 | T167: 2.96 | U167: 12 | V167: 3.1e-002 | W167: 3.2000000000000001e-002 | X167: 3.9e-002 | Y167: 93 | Z167: 6.03 | AA167: -6.0000000000000001e-003 | AB167: -1.46e-002 | AC167: -6.7000000000000004e-002 | AD167: -6.9500000000000006e-002 | AE167: 82.43 | AF167: 87.49 | AG167: 0.83 | AH167: A+ | AI167: 7.8100000000000003e-002 | AJ167: =H167+100*O167 -> 138.42000000000002 | AK167: 140.1 | AL167: 200 | AM167: 52.6 | AN167: 221 | AO167: 2.7000000000000003e-002 | AP167: 13 | AQ167: 至纯转债!
A168: 28 | B168: 123065 | C168: 宝莱转债! | D168: 300246 | E168: 宝莱特 | F168: 医药 | G168: 医疗器械 | H168: 125.761 | I168: -2.1299999999999999e-002 | J168: 1.9e-002 | K168: 27.82 | L168: -7.0999999999999995e-003 | M168: 121.4 | N168: 40.54 | O168: 0.83299999999999996 | P168: 68.62 | Q168: 3月14天 | R168: 5.77年 | S168: 3.77年 | T168: 2.19 | U168: 430 | V168: 1.54 | W168: 5.4000000000000006e-002 | X168: 3.7000000000000005e-002 | Y168: 41 | Z168: 4.88 | AA168: -6.1999999999999998e-003 | AB168: -1.2500000000000001e-002 | AC168: -4.6799999999999994e-002 | AD168: -4.87e-002 | AE168: 81 | AF168: 84.13 | AG168: 0.32 | AH168: AA- | AI168: 6.7099999999999993e-002 | AJ168: =H168+100*O168 -> 209.06099999999998 | AK168: 182.9 | AL168: 292 | AM168: 98.8 | AN168: 295 | AO168: -5.9999999999999998e-002 | AP168: 9 | AQ168: 宝莱转债!
A169: 44 | B169: 113598 | C169: 法兰转债 | D169: 603966 | E169: 法兰泰克 | F169: 机械装备 | G169: 工程机械 | H169: 125.6 | I169: 4.6999999999999993e-003 | J169: -9.1999999999999998e-003 | K169: 15.07 | L169: -5.8999999999999999e-003 | M169: 121.2 | N169: 13.88 | O169: 0.157 | P169: 108.57 | Q169: 2月11天 | R169: 5.67年 | S169: 3.67年 | T169: 3.3 | U169: 1.3 | V169: 3.0000000000000001e-003 | W169: 0.10400000000000001 | X169: 0.113 | Y169: 32 | Z169: 2.85 | AA169: -6.4000000000000003e-003 | AB169: -1.2699999999999999e-002 | AC169: -4.8099999999999997e-002 | AD169: -5.0000000000000003e-002 | AE169: 81.36 | AF169: 84.51 | AG169: 0.76 | AH169: AA- | AI169: 6.7099999999999993e-002 | AJ169: =H169+100*O169 -> 141.29999999999998 | AK169: 142.6 | AL169: 224 | AM169: 58.1 | AN169: 244 | AO169: 1.7000000000000001e-002 | AP169: 6 | AQ169: 法兰转债
A170: 107 | B170: 113577 | C170: 春秋转债 | D170: 603890 | E170: 春秋电子 | F170: 电子 | G170: 电子产品 | H170: 122.48 | I170: 7.000000000000001e-004 | J170: 2.5000000000000001e-003 | K170: 12.88 | L170: 3.9000000000000003e-003 | M170: 118.2 | N170: 11.06 | O170: 5.2000000000000005e-002 | P170: 116.46 | Q170: 转股中 | R170: 5.38年 | S170: 3.38年 | T170: 2.32 | U170: 3.5 | V170: 1.2e-002 | W170: 4.7e-002 | X170: 5.5e-002 | Y170: 50 | Z170: 2.94 | AA170: -6.7000000000000002e-003 | AB170: -1.26e-002 | AC170: -4.53e-002 | AD170: -4.7300000000000002e-002 | AE170: 82.94 | AF170: 84.04 | AG170: 0.81 | AH170: AA- | AI170: 6.7099999999999993e-002 | AJ170: =H170+100*O170 -> 127.68000000000001 | AK170: 128.5 | AL170: 84 | AM170: 44.5 | AN170: 153 | AO170: -5.2000000000000005e-002 | AP170: 10 | AQ170: 春秋转债
A171: 222 | B171: 110057 | C171: 现代转债 | D171: 600420 | E171: 现代制药 | F171: 医药 | G171: 化学制药 | H171: 114.06 | I171: -2.3999999999999998e-003 | J171: 3.5999999999999999e-003 | K171: 10.31 | L171: 1.9e-003 | M171: 110.8 | N171: 9.89 | O171: 9.4e-002 | P171: 104.25 | Q171: 转股中 | R171: 4.34年 | S171: 2.34年 | T171: 16.2 | U171: 5.1 | V171: 3.0000000000000001e-003 | W171: 0.153 | X171: 0.159 | Y171: 106 | Z171: 1.35 | AA171: -6.8000000000000005e-003 | AB171: -1.1299999999999999e-002 | AC171: -3.9100000000000003e-002 | AD171: -4.1500000000000002e-002 | AE171: 93.84 | AF171: 94.01 | AG171: 0.65 | AH171: AAA | AI171: 3.9399999999999998e-002 | AJ171: =H171+100*O171 -> 123.46000000000001 | AK171: 123.9 | AL171: 22 | AM171: 29.9 | AN171: 22 | AO171: -2.e-003 | AP171: 22 | AQ171: 现代转债
A172: 204 | B172: 113027 | C172: 华钰转债!! | D172: 601020 | E172: 华钰矿业 | F172: 有色金属 | G172: 锌铅镍锡 | H172: 118.46 | I172: -2.3999999999999998e-003 | J172: 1.7000000000000001e-003 | K172: 10.71 | L172: -8.9999999999999998e-004 | M172: 114.9 | N172: 10.17 | O172: 0.125 | P172: 105.31 | Q172: 转股中 | R172: 4.55年 | S172: 2.55年 | T172: 3.25 | U172: 10 | V172: 2.6000000000000002e-002 | W172: 5.5e-002 | X172: 5.7999999999999996e-002 | Y172: 59 | Z172: 2.44 | AA172: -6.8000000000000005e-003 | AB172: -1.26e-002 | AC172: -4.9400000000000006e-002 | AD172: -5.16e-002 | AE172: 87.23 | AF172: 86.66 | AG172: 0.73 | AH172: AA- | AI172: 6.54e-002 | AJ172: =H172+100*O172 -> 130.95999999999998 | AK172: 131.6 | AL172: 124 | AM172: 44.4 | AN172: 151 | AO172: -4.8000000000000001e-002 | AP172: 46 | AQ172: 华钰转债!!
A173: 247 | B173: 128050 | C173: 钧达转债! | D173: 2865 | E173: 钧达股份 | F173: 汽车 | G173: 零部件制 | H173: 127 | I173: -7.9000000000000008e-003 | J173: -6.7000000000000002e-003 | K173: 18.53 | L173: -1.8500000000000003e-002 | M173: 123.5 | N173: 14.85 | O173: 1.8000000000000002e-002 | P173: 124.78 | Q173: 转股中 | R173: 4年13天 | S173: 2年13天 | T173: 2.51 | U173: 186 | V173: 0.57999999999999996 | W173: 0.11199999999999999 | X173: 0.14000000000000001 | Y173: 22 | Z173: 2.59 | AA173: -7.0999999999999995e-003 | AB173: -1.67e-002 | AC173: -8.8599999999999998e-002 | AD173: -9.1400000000000009e-002 | AE173: 90.51 | AF173: 96.25 | AG173: 0.79 | AH173: AA- | AI173: 6.54e-002 | AJ173: =H173+100*O173 -> 128.80000000000001 | AK173: 129.2 | AL173: 94 | AM173: 33 | AN173: 46 | AO173: 5.2999999999999999e-002 | AP173: 62 | AQ173: 钧达转债!
A174: 283 | B174: 123007 | C174: 道氏转债!! | D174: 300409 | E174: 道氏技术 | F174: 建筑 | G174: 建筑行业 | H174: 113.744 | I174: 1.0200000000000001e-002 | J174: -1.55e-002 | K174: 14.52 | L174: -8.8999999999999999e-003 | M174: 111.3 | N174: 14.95 | O174: 0.17100000000000001 | P174: 97.12 | Q174: 转股中 | R174: 3年31天 | S174: 1年31天 | T174: 3.04 | U174: 37 | V174: 0.10800000000000001 | W174: 4.5999999999999999e-002 | X174: 4.4000000000000004e-002 | Y174: 67 | Z174: 2.76 | AA174: -7.1999999999999998e-003 | AB174: -1.38e-002 | AC174: -7.8200000000000006e-002 | AD174: -8.2100000000000006e-002 | AE174: 95.09 | AF174: 91.98 | AG174: 0.6 | AH174: AA- | AI174: 6.54e-002 | AJ174: =H174+100*O174 -> 130.84399999999999 | AK174: 130.4 | AL174: 107 | AM174: 35.3 | AN174: 65 | AO174: -1.e-003 | AP174: 20 | AQ174: 道氏转债!!
A175: 98 | B175: 128108 | C175: 蓝帆转债 | D175: 2382 | E175: 蓝帆医疗 | F175: 医药 | G175: 医疗器械 | H175: 118 | I175: -5.1000000000000004e-003 | J175: -4.8999999999999998e-003 | K175: 20.26 | L175: -1.32e-002 | M175: 113.3 | N175: 17.79 | O175: 3.6000000000000004e-002 | P175: 113.88 | Q175: 6.1天 | R175: 5.50年 | S175: 4.50年 | T175: 31.4 | U175: 105 | V175: 2.7999999999999997e-002 | W175: 0.161 | X175: 0.183 | Y175: 195 | Z175: 2.04 | AA175: -7.4999999999999997e-003 | AB175: -1.18e-002 | AC175: -2.3799999999999998e-002 | AD175: -2.6000000000000002e-002 | AE175: 85.89 | AF175: 88.88 | AG175: 0.76 | AH175: AA | AI175: 4.6100000000000002e-002 | AJ175: =H175+100*O175 -> 121.59999999999999 | AK175: 122.1 | AL175: 16 | AM175: 33.2 | AN175: 47 | AO175: -5.0999999999999997e-002 | AP175: 23 | AQ175: 蓝帆转债
A176: 32 | B176: 113602 | C176: 景20转债 | D176: 603228 | E176: 景旺电子 | F176: 电子 | G176: 元器件制 | H176: 118.31 | I176: -1.5e-003 | J176: 6.0000000000000001e-003 | K176: 31.44 | L176: 8.3000000000000001e-003 | M176: 113.3 | N176: 35.28 | O176: 0.32799999999999996 | P176: 89.12 | Q176: 3月4天 | R176: 5.74年 | S176: 3.74年 | T176: 17.8 | U176: 2 | V176: 1.e-003 | W176: 6.6000000000000003e-002 | X176: 5.9000000000000004e-002 | Y176: 268 | Z176: 4.47 | AA176: -7.6e-003 | AB176: -1.18e-002 | AC176: -3.32e-002 | AD176: -3.5000000000000003e-002 | AE176: 87.19 | AF176: 87.92 | AG176: 0.54 | AH176: AA | AI176: 4.6100000000000002e-002 | AJ176: =H176+100*O176 -> 151.11000000000001 | AK176: 147.5 | AL176: 250 | AM176: 59.6 | AN176: 253 | AO176: -1.e-002 | AP176: 6 | AQ176: 景20转债
A177: 193 | B177: 128073 | C177: 哈尔转债! | D177: 2615 | E177: 哈尔斯 | F177: 其他 | G177: 家居用品 | H177: 118.95 | I177: -2.1400000000000002e-002 | J177: 2.69e-002 | K177: 5.71 | L177: 8.8000000000000005e-003 | M177: 115.3 | N177: 5.72 | O177: 0.192 | P177: 99.83 | Q177: 转股中 | R177: 3.73年 | S177: 1.73年 | T177: 2.99 | U177: 397 | V177: 1.0900000000000001 | W177: 0.128 | X177: 0.127 | Y177: 23 | Z177: 2.94 | AA177: -8.3999999999999995e-003 | AB177: -1.5600000000000001e-002 | AC177: -7.7899999999999997e-002 | AD177: -7.9699999999999993e-002 | AE177: 90.54 | AF177: 91.31 | AG177: 0.63 | AH177: AA- | AI177: 6.54e-002 | AJ177: =H177+100*O177 -> 138.15000000000001 | AK177: 138.1 | AL177: 186 | AM177: 46.8 | AN177: 178 | AO177: 2.7999999999999997e-002 | AP177: 40 | AQ177: 哈尔转债!
A178: 83 | B178: 128113 | C178: 比音转债 | D178: 2832 | E178: 比音勒芬 | F178: 服装纺织 | G178: 服装行业 | H178: 123.1 | I178: 6.6e-003 | J178: -5.0000000000000001e-004 | K178: 17.13 | L178: 8.199999999999999e-003 | M178: 117.3 | N178: 14.9 | O178: 7.0999999999999994e-002 | P178: 114.97 | Q178: 24天 | R178: 5.55年 | S178: 3.55年 | T178: 6.89 | U178: 8.4 | V178: 1.e-002 | W178: 7.6999999999999999e-002 | X178: 8.8000000000000009e-002 | Y178: 90 | Z178: 4.17 | AA178: -8.8000000000000005e-003 | AB178: -1.4199999999999999e-002 | AC178: -4.53e-002 | AD178: -4.7100000000000003e-002 | AE178: 87.95 | AF178: 91.8 | AG178: 0.75 | AH178: AA | AI178: 4.6100000000000002e-002 | AJ178: =H178+100*O178 -> 130.19999999999999 | AK178: 131.2 | AL178: 117 | AM178: 39.4 | AN178: 117 | AO178: -2.9999999999999999e-002 | AP178: 5 | AQ178: 比音转债
A179: 200 | B179: 113541 | C179: 荣晟转债! | D179: 603165 | E179: 荣晟环保 | F179: 造纸包装 | G179: 包装用纸 | H179: 119.82 | I179: 0. | J179: 3.5999999999999999e-003 | K179: 13.14 | L179: 4.5999999999999999e-003 | M179: 115 | N179: 11.54 | O179: 5.2000000000000005e-002 | P179: 113.86 | Q179: 转股中 | R179: 4.65年 | S179: 2.65年 | T179: 2.75 | U179: 2.2 | V179: 6.9999999999999993e-003 | W179: 8.4000000000000005e-002 | X179: 9.5000000000000001e-002 | Y179: 33 | Z179: 2.17 | AA179: -9.0000000000000011e-003 | AB179: -1.46e-002 | AC179: -5.1100000000000007e-002 | AD179: -5.33e-002 | AE179: 86.74 | AF179: 86.18 | AG179: 0.78 | AH179: AA- | AI179: 6.54e-002 | AJ179: =H179+100*O179 -> 125.02 | AK179: 125.8 | AL179: 39 | AM179: 39 | AN179: 110 | AO179: -1.2e-002 | AP179: 49 | AQ179: 荣晟转债!
A180: 304 | B180: 113014 | C180: 林洋转债! | D180: 601222 | E180: 林洋能源 | F180: 能源电力 | G180: 电力设备 | H180: 112.21 | I180: 1.e-003 | J180: 4.0000000000000002e-004 | K180: 7.39 | L180: 4.0999999999999995e-003 | M180: 109.3 | N180: 8.54 | O180: 0.29699999999999999 | P180: 86.53 | Q180: 转股中 | R180: 2.92年 | S180: 0.92年 | T180: 30 | U180: 2 | V180: 1.e-003 | W180: 0.23199999999999998 | X180: 0.20100000000000001 | Y180: 129 | Z180: 1.24 | AA180: -9.1000000000000004e-003 | AB180: -1.4999999999999999e-002 | AC180: -8.6300000000000002e-002 | AD180: -8.9200000000000002e-002 | AE180: 97.2 | AF180: 96.65 | AG180: 0.35 | AH180: AA | AI180: 4.3799999999999999e-002 | AJ180: =H180+100*O180 -> 141.91 | AK180: 137.9 | AL180: 183 | AM180: 40.7 | AN180: 123 | AO180: -4.4000000000000004e-002 | AP180: 22 | AQ180: 林洋转债!
A181: 286 | B181: 110041 | C181: 蒙电转债! | D181: 600863 | E181: 内蒙华电 | F181: 能源电力 | G181: 电力供应 | H181: 113.4 | I181: -5.4000000000000003e-003 | J181: -2.3999999999999998e-003 | K181: 2.64 | L181: -1.49e-002 | M181: 110.3 | N181: 2.69 | O181: 0.155 | P181: 98.14 | Q181: 转股中 | R181: 3年25天 | S181: 1年25天 | T181: 18.7 | U181: 1.2 | V181: 1.e-003 | W181: 0.122 | X181: 0.12 | Y181: 153 | Z181: 1.3 | AA181: -9.1999999999999998e-003 | AB181: -1.5300000000000001e-002 | AC181: -7.7199999999999991e-002 | AD181: -8.1099999999999992e-002 | AE181: 98.06 | AF181: 98.25 | AG181: 0.53 | AH181: AAA | AI181: 3.9399999999999998e-002 | AJ181: =H181+100*O181 -> 128.90000000000001 | AK181: 128.7 | AL181: 87 | AM181: 30.4 | AN181: 26 | AO181: 6.9999999999999993e-003 | AP181: 8 | AQ181: 蒙电转债!
A182: 9 | B182: 127023 | C182: 华菱转2 | D182: 932 | E182: 华菱钢铁 | F182: 钢铁 | G182: 炼钢 | H182: 116.2 | I182: 1.1999999999999999e-003 | J182: 1.e-004 | K182: 5.5 | L182: 1.8e-003 | M182: 110.1 | N182: 5.18 | O182: 9.4e-002 | P182: 106.18 | Q182: 5月3天 | R182: 5.90年 | S182: 4.90年 | T182: 40 | U182: 89 | V182: 1.9e-002 | W182: 0.11900000000000001 | X182: 0.126 | Y182: 337 | Z182: 1.07 | AA182: -9.1999999999999998e-003 | AB182: -1.23e-002 | AC182: -2.1000000000000001e-002 | AD182: -2.2599999999999999e-002 | AE182: 85.32 | AF182: 87.09 | AG182: 0.69 | AH182: AAA | AI182: 4.1100000000000005e-002 | AJ182: =H182+100*O182 -> 125.60000000000001 | AK182: 126.2 | AL182: 44 | AM182: 39.1 | AN182: 113 | AO182: -1.1000000000000001e-002 | AP182: 5 | AQ182: 华菱转2
A183: 146 | B183: 113563 | C183: 柳药转债 | D183: 603368 | E183: 柳药股份 | F183: 医药 | G183: 医药商业 | H183: 118.75 | I183: -1.2999999999999999e-003 | J183: -8.0000000000000002e-003 | K183: 23.7 | L183: -1.54e-002 | M183: 113.2 | N183: 24.47 | O183: 0.22600000000000001 | P183: 96.85 | Q183: 转股中 | R183: 5年50天 | S183: 3年50天 | T183: 8.02 | U183: 0.7 | V183: 1.e-003 | W183: 9.3000000000000013e-002 | X183: 8.9999999999999997e-002 | Y183: 86 | Z183: 1.79 | AA183: -9.4999999999999998e-003 | AB183: -1.3999999999999999e-002 | AC183: -4.0599999999999997e-002 | AD183: -4.2599999999999999e-002 | AE183: 89.5 | AF183: 90.24 | AG183: 0.6 | AH183: AA | AI183: 4.6100000000000002e-002 | AJ183: =H183+100*O183 -> 141.34999999999999 | AK183: 140.6 | AL183: 208 | AM183: 50.4 | AN183: 202 | AO183: -3.7000000000000005e-002 | AP183: 15 | AQ183: 柳药转债
A184: 280 | B184: 128035 | C184: 大族转债! | D184: 2008 | E184: 大族激光 | F184: 机械装备 | G184: 专用设备 | H184: 111.454 | I184: 8.9999999999999998e-004 | J184: -1.7000000000000001e-003 | K184: 39.73 | L184: -6.5000000000000006e-003 | M184: 108 | N184: 52.1 | O184: 0.46200000000000002 | P184: 76.26 | Q184: 转股中 | R184: 3.19年 | S184: 1.19年 | T184: 23 | U184: 2.7 | V184: 1.e-003 | W184: 5.4000000000000006e-002 | X184: 4.0999999999999995e-002 | Y184: 424 | Z184: 4.62 | AA184: -9.8999999999999991e-003 | AB184: -1.46e-002 | AC184: -4.7199999999999999e-002 | AD184: -5.2999999999999999e-002 | AE184: 98.7 | AF184: 94.77 | AG184: 0.12 | AH184: AA+ | AI184: 4.24e-002 | AJ184: =H184+100*O184 -> 157.654 | AK184: 146.7 | AL184: 246 | AM184: 48 | AN184: 191 | AO184: -5.0000000000000003e-002 | AP184: 20 | AQ184: 大族转债!
A185: 81 | B185: 123055 | C185: 晨光转债 | D185: 300138 | E185: 晨光生物 | F185: 食品饮料 | G185: 食品加工 | H185: 131.19 | I185: -6.0999999999999995e-003 | J185: -4.0000000000000001e-003 | K185: 16.3 | L185: -1.15e-002 | M185: 124.3 | N185: 12.25 | O185: -1.3999999999999999e-002 | P185: 133.06 | Q185: 26天 | R185: 5.55年 | S185: 3.55年 | T185: 6.3 | U185: 33 | V185: 4.0000000000000001e-002 | W185: 7.5999999999999998e-002 | X185: 0.10000000000000001 | Y185: 83 | Z185: 4.34 | AA185: -9.8999999999999991e-003 | AB185: -1.7000000000000001e-002 | AC185: -6.0599999999999994e-002 | AD185: -6.2600000000000003e-002 | AE185: 82.09 | AF185: 87.36 | AG185: 0.88 | AH185: AA- | AI185: 6.7099999999999993e-002 | AJ185: =H185+100*O185 -> 129.78999999999999 | AK185: 129.3 | AL185: 96 | AM185: 42 | AN185: 134 | AO185: -7.0999999999999994e-002 | AP185: 8 | AQ185: 晨光转债
A186: 295 | B186: 128022 | C186: 众信转债! | D186: 2707 | E186: 众信旅游 | F186: 旅游餐饮 | G186: 旅游 | H186: 113.201 | I186: -9.5999999999999992e-003 | J186: -8.0000000000000004e-004 | K186: 6.7 | L186: -3.1800000000000002e-002 | M186: 109.8 | N186: 7.92 | O186: 0.33799999999999997 | P186: 84.6 | Q186: 转股中 | R186: 3年4.1天 | S186: 1年4.1天 | T186: 4.56 | U186: 13 | V186: 2.5000000000000001e-002 | W186: 7.4999999999999997e-002 | X186: 6.4000000000000001e-002 | Y186: 61 | Z186: 2.86 | AA186: -1.03e-002 | AB186: -1.6299999999999999e-002 | AC186: -8.1300000000000011e-002 | AD186: -8.5099999999999995e-002 | AE186: 97.49 | AF186: 96.62 | AG186: 0.33 | AH186: AA | AI186: 4.4400000000000002e-002 | AJ186: =H186+100*O186 -> 147.00099999999998 | AK186: 141.8 | AL186: 220 | AM186: 44.3 | AN186: 150 | AO186: 4.4999999999999998e-002 | AP186: 23 | AQ186: 众信转债!
A187: 181 | B187: 110060 | C187: 天路转债! | D187: 600326 | E187: 西藏天路 | F187: 建筑 | G187: 水泥 | H187: 120.8 | I187: 1.5e-003 | J187: -3.3e-003 | K187: 7.68 | L187: -2.5999999999999999e-003 | M187: 114.9 | N187: 7.16 | O187: 0.126 | P187: 107.26 | Q187: 转股中 | R187: 4.92年 | S187: 2.92年 | T187: 7.06 | U187: 0.9 | V187: 1.e-003 | W187: 0.10000000000000001 | X187: 0.107 | Y187: 71 | Z187: 1.89 | AA187: -1.03e-002 | AB187: -1.5600000000000001e-002 | AC187: -4.9599999999999998e-002 | AD187: -5.1500000000000004e-002 | AE187: 90.54 | AF187: 93.17 | AG187: 0.68 | AH187: AA | AI187: 4.4400000000000002e-002 | AJ187: =H187+100*O187 -> 133.40000000000001 | AK187: 134.3 | AL187: 150 | AM187: 41.2 | AN187: 128 | AO187: -2.8999999999999998e-002 | AP187: 12 | AQ187: 天路转债!
A188: 197 | B188: 128071 | C188: 合兴转债! | D188: 2228 | E188: 合兴包装 | F188: 造纸包装 | G188: 包装材料 | H188: 120.568 | I188: 1.e-004 | J188: -6.9999999999999993e-003 | K188: 4.32 | L188: -1.1399999999999999e-002 | M188: 114.8 | N188: 4.28 | O188: 0.19500000000000001 | P188: 100.93 | Q188: 转股中 | R188: 4.72年 | S188: 2.72年 | T188: 3 | U188: 5.3 | V188: 1.4999999999999999e-002 | W188: 5.5999999999999994e-002 | X188: 5.7000000000000002e-002 | Y188: 54 | Z188: 1.6 | AA188: -1.0500000000000001e-002 | AB188: -1.6e-002 | AC188: -5.2600000000000001e-002 | AD188: -5.4600000000000003e-002 | AE188: 91.23 | AF188: 93.88 | AG188: 0.6 | AH188: AA | AI188: 4.4400000000000002e-002 | AJ188: =H188+100*O188 -> 140.06799999999998 | AK188: 140.2 | AL188: 203 | AM188: 46.3 | AN188: 174 | AO188: -3.9e-002 | AP188: 25 | AQ188: 合兴转债!
A189: 96 | B189: 127017 | C189: 万青转债 | D189: 789 | E189: 万年青 | F189: 建筑 | G189: 水泥 | H189: 125.599 | I189: -2.3099999999999999e-002 | J189: 1.55e-002 | K189: 14.97 | L189: -1.1899999999999999e-002 | M189: 118.4 | N189: 14.16 | O189: 0.188 | P189: 105.72 | Q189: 12天 | R189: 5.52年 | S189: 3.52年 | T189: 10 | U189: 38 | V189: 2.9999999999999999e-002 | W189: 8.4000000000000005e-002 | X189: 8.900000000000001e-002 | Y189: 119 | Z189: 2.15 | AA189: -1.0800000000000001e-002 | AB189: -1.6500000000000001e-002 | AC189: -5.1100000000000007e-002 | AD189: -5.28e-002 | AE189: 88.63 | AF189: 93.75 | AG189: 0.65 | AH189: AA+ | AI189: 4.41e-002 | AJ189: =H189+100*O189 -> 144.399 | AK189: 145.5 | AL189: 238 | AM189: 51.7 | AN189: 211 | AO189: -2.2000000000000002e-002 | AP189: 7 | AQ189: 万青转债
A190: 82 | B190: 128114 | C190: 正邦转债 | D190: 2157 | E190: 正邦科技 | F190: 农业 | G190: 畜牧业 | H190: 122.349 | I190: 1.44e-002 | J190: 5.7999999999999996e-003 | K190: 18.37 | L190: 2.7400000000000001e-002 | M190: 115.3 | N190: 16.09 | O190: 7.2000000000000008e-002 | P190: 114.17 | Q190: 26天 | R190: 5.55年 | S190: 3.55年 | T190: 16 | U190: 141 | V190: 7.0999999999999994e-002 | W190: 3.5000000000000003e-002 | X190: 3.9e-002 | Y190: 464 | Z190: 3.08 | AA190: -1.0800000000000001e-002 | AB190: -1.5600000000000001e-002 | AC190: -4.36e-002 | AD190: -4.5400000000000003e-002 | AE190: 88.55 | AF190: 91.16 | AG190: 0.74 | AH190: AA+ | AI190: 4.41e-002 | AJ190: =H190+100*O190 -> 129.54900000000001 | AK190: 130.5 | AL190: 108 | AM190: 39.4 | AN190: 115 | AO190: 5.0000000000000003e-002 | AP190: 10 | AQ190: 正邦转债
A191: 14 | B191: 123070 | C191: 鹏辉转债 | D191: 300438 | E191: 鹏辉能源 | F191: 汽车 | G191: 零部件制 | H191: 123.3 | I191: 1.6000000000000001e-003 | J191: -1.5600000000000001e-002 | K191: 22.37 | L191: -1.89e-002 | M191: 115.1 | N191: 20.16 | O191: 0.111 | P191: 110.96 | Q191: 5月0天 | R191: 5.90年 | S191: 3.90年 | T191: 8.9 | U191: 90 | V191: 8.1000000000000003e-002 | W191: 9.5000000000000001e-002 | X191: 0.105 | Y191: 94 | Z191: 3.8 | AA191: -1.18e-002 | AB191: -1.6299999999999999e-002 | AC191: -4.2199999999999994e-002 | AD191: -4.3799999999999999e-002 | AE191: 86.39 | AF191: 88.65 | AG191: 0.74 | AH191: AA | AI191: 4.6100000000000002e-002 | AJ191: =H191+100*O191 -> 134.40000000000001 | AK191: 135.6 | AL191: 165 | AM191: 47 | AN191: 183 | AO191: 6.3e-002 | AP191: 3 | AQ191: 鹏辉转债
A192: 298 | B192: 110038 | C192: 济川转债! | D192: 600566 | E192: 济川药业 | F192: 医药 | G192: 中药 | H192: 110.09 | I192: -2.3999999999999998e-003 | J192: 1.7000000000000001e-003 | K192: 22.05 | L192: -1.8e-003 | M192: 107.5 | N192: 23.85 | O192: 0.191 | P192: 92.45 | Q192: 转股中 | R192: 1.96年 | S192: 回售中 | T192: 6.28 | U192: 1.8 | V192: 3.0000000000000001e-003 | W192: 3.2000000000000001e-002 | X192: 2.9999999999999999e-002 | Y192: 196 | Z192: 2.67 | AA192: -1.21e-002 | AB192: -1.9199999999999998e-002 | AC192: 回售中 | AD192: 回售中 | AE192: 100.25 | AF192: 98.89 | AG192: 0.38 | AH192: AA | AI192: 4.3799999999999999e-002 | AJ192: =H192+100*O192 -> 129.19 | AK192: 127.7 | AL192: 72 | AM192: 27.5 | AN192: 16 | AO192: -1.2e-002 | AP192: 20 | AQ192: 济川转债!
A193: 199 | B193: 113542 | C193: 好客转债 | D193: 603898 | E193: 好莱客 | F193: 其他 | G193: 家居用品 | H193: 121.5 | I193: -3.9000000000000003e-003 | J193: 1.e-002 | K193: 17.38 | L193: 9.300000000000001e-003 | M193: 114.9 | N193: 16.27 | O193: 0.13699999999999998 | P193: 106.82 | Q193: 转股中 | R193: 4.68年 | S193: 2.68年 | T193: 6.03 | U193: 1.7 | V193: 2.e-003 | W193: 0.111 | X193: 0.11900000000000001 | Y193: 54 | Z193: 2.21 | AA193: -1.21e-002 | AB193: -1.77e-002 | AC193: -5.5599999999999997e-002 | AD193: -5.7699999999999994e-002 | AE193: 91.49 | AF193: 94.15 | AG193: 0.66 | AH193: AA | AI193: 4.4400000000000002e-002 | AJ193: =H193+100*O193 -> 135.19999999999999 | AK193: 136.2 | AL193: 172 | AM193: 42 | AN193: 136 | AO193: 5.0999999999999997e-002 | AP193: 18 | AQ193: 好客转债
A194: 176 | B194: 123035 | C194: 利德转债! | D194: 300296 | E194: 利亚德 | F194: 电子 | G194: LED制 | H194: 122.402 | I194: -7.7000000000000002e-003 | J194: 3.4000000000000002e-003 | K194: 7.35 | L194: -6.8000000000000005e-003 | M194: 115.1 | N194: 6.98 | O194: 0.16200000000000001 | P194: 105.3 | Q194: 转股中 | R194: 4.96年 | S194: 2.96年 | T194: 8 | U194: 8.4 | V194: 9.0000000000000011e-003 | W194: 4.2999999999999997e-002 | X194: 4.4999999999999998e-002 | Y194: 187 | Z194: 2.19 | AA194: -1.2500000000000001e-002 | AB194: -1.7899999999999999e-002 | AC194: -5.2300000000000006e-002 | AD194: -5.4400000000000004e-002 | AE194: 91.09 | AF194: 94.04 | AG194: 0.64 | AH194: AA+ | AI194: 4.24e-002 | AJ194: =H194+100*O194 -> 138.602 | AK194: 139.5 | AL194: 196 | AM194: 45.5 | AN194: 163 | AO194: -1.3999999999999999e-002 | AP194: 16 | AQ194: 利德转债!
A195: 317 | B195: 110031 | C195: 航信转债!! | D195: 600271 | E195: 航天信息 | F195: 计算机及 | G195: 软件开发 | H195: 107.74 | I195: 5.0000000000000001e-004 | J195: -5.0000000000000001e-004 | K195: 13.9 | L195: 7.000000000000001e-004 | M195: 107 | N195: 21.56 | O195: 0.67099999999999993 | P195: 64.47 | Q195: 转股中 | R195: 0.54年 | S195: 回售中 | T195: 24 | U195: 21 | V195: 8.0000000000000002e-003 | W195: 9.3000000000000013e-002 | X195: 5.9999999999999998e-002 | Y195: 258 | Z195: 2.24 | AA195: -1.2699999999999999e-002 | AB195: -3.6499999999999998e-002 | AC195: 回售中 | AD195: 回售中 | AE195: 100.27 | AF195: 104.9 | AG195: 0 | AH195: AAA | AI195: 3.7400000000000003e-002 | AJ195: =H195+100*O195 -> 174.83999999999997 | AK195: 151 | AL195: 264 | AM195: 46.1 | AN195: 169 | AO195: -8.0000000000000002e-003 | AP195: 14 | AQ195: 航信转债!!
A196: 52 | B196: 110073 | C196: 国投转债 | D196: 600061 | E196: 国投资本 | F196: 金融 | G196: 证券行业 | H196: 119.01 | I196: 8.1000000000000013e-003 | J196: 8.9999999999999998e-004 | K196: 14.61 | L196: 1.5300000000000001e-002 | M196: 110.5 | N196: 15.25 | O196: 0.24199999999999999 | P196: 95.8 | Q196: 2月6天 | R196: 5.66年 | S196: 无权 | T196: 80 | U196: 38 | V196: 4.0000000000000001e-003 | W196: 0.13 | X196: 0.124 | Y196: 618 | Z196: 1.48 | AA196: -1.32e-002 | AB196: -1.6500000000000001e-002 | AC196: 无权 | AD196: 无权 | AE196: 无权 | AF196: 88.24 | AG196: 0.59 | AH196: AAA | AI196: 4.1100000000000005e-002 | AJ196: =H196+100*O196 -> 143.21000000000001 | AK196: 142.2 | AL196: 223 | AM196: 54 | AN196: 226 | AO196: 1.e-002 | AP196: 22 | AQ196: 国投转债
A197: 114 | B197: 113034 | C197: 滨化转债 | D197: 601678 | E197: 滨化股份 | F197: 化工 | G197: 化工 | H197: 123.73 | I197: -6.0999999999999995e-003 | J197: -3.4999999999999996e-003 | K197: 5.53 | L197: -1.2500000000000001e-002 | M197: 115.1 | N197: 4.68 | O197: 4.7e-002 | P197: 118.16 | Q197: 转股中 | R197: 5.37年 | S197: 3.37年 | T197: 19.3 | U197: 25 | V197: 1.e-002 | W197: 0.22600000000000001 | X197: 0.26700000000000002 | Y197: 85 | Z197: 1.36 | AA197: -1.3600000000000001e-002 | AB197: -1.8500000000000003e-002 | AC197: -4.9400000000000006e-002 | AD197: -5.1200000000000002e-002 | AE197: 88.47 | AF197: 90.79 | AG197: 0.77 | AH197: AA | AI197: 4.6100000000000002e-002 | AJ197: =H197+100*O197 -> 128.43000000000001 | AK197: 129.3 | AL197: 95 | AM197: 38.5 | AN197: 103 | AO197: -3.9e-002 | AP197: 28 | AQ197: 滨化转债
A198: 128 | B198: 123045 | C198: 雷迪转债 | D198: 300652 | E198: 雷迪克 | F198: 汽车 | G198: 零部件制 | H198: 128.5 | I198: -3.2400000000000005e-002 | J198: 6.0000000000000001e-003 | K198: 23.48 | L198: -3.1800000000000002e-002 | M198: 119.4 | N198: 20.13 | O198: 0.10199999999999999 | P198: 116.64 | Q198: 转股中 | R198: 5.29年 | S198: 3.29年 | T198: 1.66 | U198: 191 | V198: 0.8859999999999999 | W198: 7.4999999999999997e-002 | X198: 8.8000000000000009e-002 | Y198: 22 | Z198: 2.59 | AA198: -1.41e-002 | AB198: -2.0299999999999999e-002 | AC198: -5.8600000000000006e-002 | AD198: -6.0899999999999996e-002 | AE198: 80.93 | AF198: 81.04 | AG198: 0.83 | AH198: A+ | AI198: 7.8100000000000003e-002 | AJ198: =H198+100*O198 -> 138.69999999999999 | AK198: 140.4 | AL198: 205 | AM198: 59.3 | AN198: 251 | AO198: -9.3000000000000013e-002 | AP198: 36 | AQ198: 雷迪转债
A199: 172 | B199: 110062 | C199: 烽火转债 | D199: 600498 | E199: 烽火通信 | F199: 通信互联 | G199: 通信设备 | H199: 119.2 | I199: -6.7000000000000002e-003 | J199: -4.0000000000000002e-004 | K199: 24.95 | L199: -1.1899999999999999e-002 | M199: 111 | N199: 25.65 | O199: 0.22500000000000001 | P199: 97.27 | Q199: 转股中 | R199: 5年5.1天 | S199: 3年5.1天 | T199: 30.9 | U199: 6.4 | V199: 2.e-003 | W199: 0.106 | X199: 0.10300000000000001 | Y199: 292 | Z199: 2.75 | AA199: -1.44e-002 | AB199: -1.83e-002 | AC199: -4.3799999999999999e-002 | AD199: -4.58e-002 | AE199: 91.17 | AF199: 91.07 | AG199: 0.6 | AH199: AAA | AI199: 4.1100000000000005e-002 | AJ199: =H199+100*O199 -> 141.69999999999999 | AK199: 141.1 | AL199: 213 | AM199: 50 | AN199: 199 | AO199: -4.0000000000000001e-003 | AP199: 19 | AQ199: 烽火转债
A200: 152 | B200: 113561 | C200: 正裕转债! | D200: 603089 | E200: 正裕工业 | F200: 汽车 | G200: 零部件制 | H200: 127.46 | I200: 2.0000000000000001e-004 | J200: 5.1000000000000004e-003 | K200: 13.08 | L200: 6.1999999999999998e-003 | M200: 118.5 | N200: 10.23 | O200: -3.0000000000000001e-003 | P200: 127.86 | Q200: 转股中 | R200: 5年34天 | S200: 3年34天 | T200: 1.59 | U200: 30 | V200: 0.14599999999999999 | W200: 5.5e-002 | X200: 7.0000000000000007e-002 | Y200: 29 | Z200: 3.13 | AA200: -1.46e-002 | AB200: -2.07e-002 | AC200: -5.9400000000000001e-002 | AD200: -6.1900000000000004e-002 | AE200: 82.23 | AF200: 81.65 | AG200: 0.87 | AH200: A+ | AI200: 7.8100000000000003e-002 | AJ200: =H200+100*O200 -> 127.16 | AK200: 127.1 | AL200: 59 | AM200: 44.8 | AN200: 156 | AO200: 0.10800000000000001 | AP200: 33 | AQ200: 正裕转债!
A201: 92 | B201: 123052 | C201: 飞鹿转债 | D201: 300665 | E201: 飞鹿股份 | F201: 化工 | G201: 化工 | H201: 137.8 | I201: -1.6399999999999998e-002 | J201: 1.1899999999999999e-002 | K201: 13.26 | L201: -5.3e-003 | M201: 127.3 | N201: 9.9 | O201: 2.8999999999999998e-002 | P201: 133.94 | Q201: 14天 | R201: 5.52年 | S201: 3.52年 | T201: 1.77 | U201: 107 | V201: 0.43700000000000006 | W201: 0.11 | X201: 0.14699999999999999 | Y201: 16 | Z201: 3.42 | AA201: -1.46e-002 | AB201: -2.2499999999999999e-002 | AC201: -7.1399999999999991e-002 | AD201: -7.3800000000000004e-002 | AE201: 80.05 | AF201: 84.96 | AG201: 0.87 | AH201: A+ | AI201: 7.8100000000000003e-002 | AJ201: =H201+100*O201 -> 140.70000000000002 | AK201: 141.7 | AL201: 217 | AM201: 56.7 | AN201: 237 | AO201: -5.7000000000000002e-002 | AP201: 12 | AQ201: 飞鹿转债
A202: 238 | B202: 110051 | C202: 中天转债! | D202: 600522 | E202: 中天科技 | F202: 通信互联 | G202: 通信设备 | H202: 121.3 | I202: -4.4000000000000003e-003 | J202: -2.8999999999999998e-003 | K202: 10.91 | L202: -1.09e-002 | M202: 113.9 | N202: 10.09 | O202: 0.122 | P202: 108.13 | Q202: 转股中 | R202: 4.26年 | S202: 2.26年 | T202: 39.6 | U202: 21 | V202: 4.0000000000000001e-003 | W202: 0.11800000000000001 | X202: 0.128 | Y202: 335 | Z202: 1.53 | AA202: -1.4999999999999999e-002 | AB202: -2.07e-002 | AC202: -6.4500000000000002e-002 | AD202: -6.6900000000000001e-002 | AE202: 93.61 | AF202: 95.82 | AG202: 0.67 | AH202: AA+ | AI202: 4.24e-002 | AJ202: =H202+100*O202 -> 133.5 | AK202: 134.5 | AL202: 154 | AM202: 38.7 | AN202: 105 | AO202: -1.e-003 | AP202: 27 | AQ202: 中天转债!
A203: 309 | B203: 113012 | C203: 骆驼转债! | D203: 601311 | E203: 骆驼股份 | F203: 汽车 | G203: 零部件制 | H203: 111.7 | I203: 8.5000000000000006e-003 | J203: -7.4999999999999997e-003 | K203: 8.7 | L203: 3.4999999999999996e-003 | M203: 107.8 | N203: 10.06 | O203: 0.29199999999999998 | P203: 86.48 | Q203: 转股中 | R203: 2.32年 | S203: 0.32年 | T203: 5.1 | U203: 3.8 | V203: 6.9999999999999993e-003 | W203: 5.2000000000000005e-002 | X203: 4.4999999999999998e-002 | Y203: 98 | Z203: 1.46 | AA203: -1.54e-002 | AB203: -2.1600000000000001e-002 | AC203: -0.19899999999999998 | AD203: -0.20499999999999999 | AE203: 99.46 | AF203: 97.76 | AG203: 0.3 | AH203: AA | AI203: 4.3799999999999999e-002 | AJ203: =H203+100*O203 -> 140.90000000000001 | AK203: 136.9 | AL203: 177 | AM203: 37.5 | AN203: 93 | AO203: 2.e-002 | AP203: 17 | AQ203: 骆驼转债!
A204: 10 | B204: 113605 | C204: 大参转债 | D204: 603233 | E204: 大参林 | F204: 医药 | G204: 医药商业 | H204: 126.06 | I204: 2.8999999999999998e-003 | J204: -3.5999999999999999e-003 | K204: 88.22 | L204: -8.9999999999999998e-004 | M204: 115.2 | N204: 83.85 | O204: 0.19800000000000001 | P204: 105.21 | Q204: 5月2天 | R204: 5.90年 | S204: 3.90年 | T204: 14.1 | U204: 62 | V204: 3.5000000000000003e-002 | W204: 2.4e-002 | X204: 2.6000000000000002e-002 | Y204: 579 | Z204: 11.6 | AA204: -1.54e-002 | AB204: -1.9900000000000001e-002 | AC204: -4.7199999999999999e-002 | AD204: -4.8799999999999996e-002 | AE204: 86.46 | AF204: 88.72 | AG204: 0.69 | AH204: AA | AI204: 4.6100000000000002e-002 | AJ204: =H204+100*O204 -> 145.86000000000001 | AK204: 146.9 | AL204: 247 | AM204: 58.2 | AN204: 246 | AO204: -4.4999999999999998e-002 | AP204: 3 | AQ204: 大参转债
A205: 131 | B205: 123044 | C205: 红相转债! | D205: 300427 | E205: 红相股份 | F205: 能源电力 | G205: 电力设备 | H205: 136.32 | I205: 1.8799999999999997e-002 | J205: -1.32e-002 | K205: 23.79 | L205: 6.8000000000000005e-003 | M205: 125.5 | N205: 18.8 | O205: 7.6999999999999999e-002 | P205: 126.54 | Q205: 转股中 | R205: 5.29年 | S205: 3.29年 | T205: 5.5 | U205: 198 | V205: 0.26400000000000001 | W205: 6.4000000000000001e-002 | X205: 8.1000000000000003e-002 | Y205: 86 | Z205: 3.75 | AA205: -1.5900000000000001e-002 | AB205: -2.3700000000000002e-002 | AC205: -7.3700000000000002e-002 | AD205: -7.6100000000000001e-002 | AE205: 84.18 | AF205: 89.85 | AG205: 0.83 | AH205: AA- | AI205: 6.7099999999999993e-002 | AJ205: =H205+100*O205 -> 144.01999999999998 | AK205: 146.1 | AL205: 241 | AM205: 56.3 | AN205: 235 | AO205: -1.3000000000000001e-002 | AP205: 16 | AQ205: 红相转债!
A206: 132 | B206: 110067 | C206: 华安转债! | D206: 600909 | E206: 华安证券 | F206: 金融 | G206: 证券行业 | H206: 120.61 | I206: 1.26e-002 | J206: -7.0999999999999995e-003 | K206: 8.16 | L206: 9.8999999999999991e-003 | M206: 110.5 | N206: 8.67 | O206: 0.28100000000000003 | P206: 94.12 | Q206: 转股中 | R206: 5.29年 | S206: 无权 | T206: 28 | U206: 20 | V206: 6.0000000000000001e-003 | W206: 9.5000000000000001e-002 | X206: 8.900000000000001e-002 | Y206: 295 | Z206: 2.13 | AA206: -1.66e-002 | AB206: -2.0199999999999999e-002 | AC206: 无权 | AD206: 无权 | AE206: 无权 | AF206: 89.55 | AG206: 0.56 | AH206: AAA | AI206: 4.1100000000000005e-002 | AJ206: =H206+100*O206 -> 148.71000000000001 | AK206: 147.1 | AL206: 248 | AM206: 57.5 | AN206: 241 | AO206: 2.e-003 | AP206: 26 | AQ206: 华安转债!
A207: 94 | B207: 128109 | C207: 楚江转债 | D207: 2171 | E207: 楚江新材 | F207: 有色金属 | G207: 铜金属 | H207: 126.39 | I207: 6.3e-003 | J207: -1.0700000000000001e-002 | K207: 9.83 | L207: -6.0999999999999995e-003 | M207: 115.3 | N207: 8.73 | O207: 0.122 | P207: 112.6 | Q207: 13天 | R207: 5.52年 | S207: 3.52年 | T207: 18.3 | U207: 2.6 | V207: 1.e-003 | W207: 0.14000000000000001 | X207: 0.157 | Y207: 131 | Z207: 2.38 | AA207: -1.6799999999999999e-002 | AB207: -2.1600000000000001e-002 | AC207: -5.2499999999999998e-002 | AD207: -5.4299999999999994e-002 | AE207: 88.07 | AF207: 90.36 | AG207: 0.73 | AH207: AA | AI207: 4.6100000000000002e-002 | AJ207: =H207+100*O207 -> 138.59 | AK207: 140.2 | AL207: 201 | AM207: 49.8 | AN207: 198 | AO207: 2.4e-002 | AP207: 6 | AQ207: 楚江转债
A208: 201 | B208: 128070 | C208: 智能转债! | D208: 2877 | E208: 智能自控 | F208: 机械装备 | G208: 通用设备 | H208: 126.998 | I208: -1.7899999999999999e-002 | J208: 2.3199999999999998e-002 | K208: 8.19 | L208: 9.8999999999999991e-003 | M208: 117.6 | N208: 9.51 | O208: 0.47499999999999998 | P208: 86.12 | Q208: 转股中 | R208: 4.59年 | S208: 无权 | T208: 2.3 | U208: 339 | V208: 1.1499999999999999 | W208: 8.4000000000000005e-002 | X208: 7.2999999999999995e-002 | Y208: 27 | Z208: 3.82 | AA208: -1.6899999999999998e-002 | AB208: -2.35e-002 | AC208: 无权 | AD208: 无权 | AE208: 无权 | AF208: 84.53 | AG208: 0.54 | AH208: A+ | AI208: 7.6399999999999996e-002 | AJ208: =H208+100*O208 -> 174.49799999999999 | AK208: 167.9 | AL208: 283 | AM208: 83.3 | AN208: 286 | AO208: 5.2999999999999999e-002 | AP208: 32 | AQ208: 智能转债!
A209: 86 | B209: 128111 | C209: 中矿转债 | D209: 2738 | E209: 中矿资源 | F209: 有色金属 | G209: 有色行业 | H209: 137 | I209: 1.0500000000000001e-002 | J209: -1.01e-002 | K209: 22.1 | L209: 5.0000000000000001e-004 | M209: 124.7 | N209: 15.53 | O209: -3.7000000000000005e-002 | P209: 142.31 | Q209: 20天 | R209: 5.54年 | S209: 3.54年 | T209: 8 | U209: 34 | V209: 3.1e-002 | W209: 0.13 | X209: 0.185 | Y209: 61 | Z209: 2.28 | AA209: -1.72e-002 | AB209: -2.4399999999999998e-002 | AC209: -7.0999999999999994e-002 | AD209: -7.2999999999999995e-002 | AE209: 82.5 | AF209: 87.77 | AG209: 0.9 | AH209: AA- | AI209: 6.7099999999999993e-002 | AJ209: =H209+100*O209 -> 133.30000000000001 | AK209: 131.7 | AL209: 126 | AM209: 43.9 | AN209: 148 | AO209: 3.5000000000000003e-002 | AP209: 8 | AQ209: 中矿转债
A210: 316 | B210: 110033 | C210: 国贸转债! | D210: 600755 | E210: 厦门国贸 | F210: 交通运输 | G210: 交通运输 | H210: 111.84 | I210: 5.9999999999999995e-004 | J210: -5.9999999999999995e-004 | K210: 7.17 | L210: 0. | M210: 109.7 | N210: 7.19 | O210: 0.122 | P210: 99.72 | Q210: 转股中 | R210: 1年39天 | S210: 回售中 | T210: 12.1 | U210: 6 | V210: 4.0000000000000001e-003 | W210: 8.9999999999999997e-002 | X210: 8.9999999999999997e-002 | Y210: 134 | Z210: 0.92 | AA210: -1.7500000000000002e-002 | AB210: -3.3399999999999999e-002 | AC210: 回售中 | AD210: 回售中 | AE210: 100.28 | AF210: 105.24 | AG210: 0.39 | AH210: AAA | AI210: 3.8800000000000001e-002 | AJ210: =H210+100*O210 -> 124.04000000000001 | AK210: 124 | AL210: 23 | AM210: 18.7 | AN210: 6 | AO210: 2.5000000000000001e-002 | AP210: 19 | AQ210: 国贸转债!
A211: 62 | B211: 128121 | C211: 宏川转债 | D211: 2930 | E211: 宏川智慧 | F211: 交通运输 | G211: 物流业 | H211: 125.065 | I211: 5.0000000000000001e-004 | J211: -6.4000000000000003e-003 | K211: 21.04 | L211: -7.4999999999999997e-003 | M211: 113.3 | N211: 20.25 | O211: 0.20399999999999999 | P211: 103.9 | Q211: 59天 | R211: 5.64年 | S211: 3.64年 | T211: 6.7 | U211: 2.1 | V211: 3.0000000000000001e-003 | W211: 7.2000000000000008e-002 | X211: 7.4999999999999997e-002 | Y211: 93 | Z211: 4.86 | AA211: -1.77e-002 | AB211: -2.18e-002 | AC211: -4.8300000000000003e-002 | AD211: -5.0000000000000003e-002 | AE211: 81.29 | AF211: 79.17 | AG211: 0.78 | AH211: AA- | AI211: 6.7099999999999993e-002 | AJ211: =H211+100*O211 -> 145.465 | AK211: 146.2 | AL211: 242 | AM211: 64.9 | AN211: 270 | AO211: 4.0000000000000001e-003 | AP211: 4 | AQ211: 宏川转债
A212: 208 | B212: 113536 | C212: 三星转债 | D212: 603578 | E212: 三星新材 | F212: 家电 | G212: 零部件制 | H212: 124.37 | I212: -1.2999999999999999e-003 | J212: 1.2999999999999999e-003 | K212: 23.85 | L212: 0. | M212: 114.8 | N212: 19.54 | O212: 1.9e-002 | P212: 122.06 | Q212: 转股中 | R212: 4.51年 | S212: 2.51年 | T212: 1.49 | U212: 7.7 | V212: 4.2000000000000003e-002 | W212: 6.8000000000000005e-002 | X212: 8.3000000000000004e-002 | Y212: 22 | Z212: 3.14 | AA212: -1.7899999999999999e-002 | AB212: -2.3599999999999999e-002 | AC212: -6.7599999999999993e-002 | AD212: -6.9800000000000001e-002 | AE212: 92.07 | AF212: 94.75 | AG212: 0.77 | AH212: AA | AI212: 4.4400000000000002e-002 | AJ212: =H212+100*O212 -> 126.27000000000001 | AK212: 126.7 | AL212: 54 | AM212: 31.9 | AN212: 37 | AO212: -1.3000000000000001e-002 | AP212: 38 | AQ212: 三星转债
A213: 156 | B213: 123038 | C213: 联得转债! | D213: 300545 | E213: 联得装备 | F213: 机械装备 | G213: 专用设备 | H213: 130.687 | I213: -2.3999999999999998e-003 | J213: 1.24e-002 | K213: 29.79 | L213: 1.1899999999999999e-002 | M213: 119.1 | N213: 25.29 | O213: 0.109 | P213: 117.79 | Q213: 转股中 | R213: 5年28天 | S213: 3年28天 | T213: 1.47 | U213: 71 | V213: 0.37 | W213: 3.4000000000000002e-002 | X213: 4.0000000000000001e-002 | Y213: 44 | Z213: 5.68 | AA213: -1.8500000000000003e-002 | AB213: -2.4799999999999999e-002 | AC213: -6.7900000000000002e-002 | AD213: -7.0099999999999996e-002 | AE213: 82.06 | AF213: 82.1 | AG213: 0.84 | AH213: A+ | AI213: 7.8100000000000003e-002 | AJ213: =H213+100*O213 -> 141.58700000000002 | AK213: 143.6 | AL213: 231 | AM213: 61.5 | AN213: 260 | AO213: 2.2000000000000002e-002 | AP213: 16 | AQ213: 联得转债!
A214: 177 | B214: 110061 | C214: 川投转债 | D214: 600674 | E214: 川投能源 | F214: 能源电力 | G214: 水电 | H214: 121.59 | I214: 7.000000000000001e-004 | J214: 1.4000000000000002e-003 | K214: 10.52 | L214: 2.8999999999999998e-003 | M214: 110.8 | N214: 9.58 | O214: 0.107 | P214: 109.81 | Q214: 转股中 | R214: 4.96年 | S214: 2.96年 | T214: 40 | U214: 3.7 | V214: 1.e-003 | W214: 8.5999999999999993e-002 | X214: 9.5000000000000001e-002 | Y214: 463 | Z214: 1.67 | AA214: -1.89e-002 | AB214: -2.2799999999999997e-002 | AC214: -5.1200000000000002e-002 | AD214: -5.3099999999999994e-002 | AE214: 91.65 | AF214: 91.81 | AG214: 0.72 | AH214: AAA | AI214: 3.9399999999999998e-002 | AJ214: =H214+100*O214 -> 132.28999999999999 | AK214: 133.4 | AL214: 143 | AM214: 41.6 | AN214: 131 | AO214: 2.6000000000000002e-002 | AP214: 16 | AQ214: 川投转债
A215: 185 | B215: 128079 | C215: 英联转债! | D215: 2846 | E215: 英联股份 | F215: 造纸包装 | G215: 包装材料 | H215: 129.019 | I215: -1.89e-002 | J215: 1.3899999999999999e-002 | K215: 14.48 | L215: -5.5000000000000005e-003 | M215: 117.5 | N215: 13.41 | O215: 0.19500000000000001 | P215: 107.98 | Q215: 转股中 | R215: 4.90年 | S215: 2.90年 | T215: 1.53 | U215: 60 | V215: 0.30099999999999999 | W215: 5.2999999999999999e-002 | X215: 5.7000000000000002e-002 | Y215: 29 | Z215: 3.76 | AA215: -1.9299999999999998e-002 | AB215: -2.53e-002 | AC215: -6.9400000000000003e-002 | AD215: -7.1500000000000008e-002 | AE215: 82.89 | AF215: 82.53 | AG215: 0.91 | AH215: A+ | AI215: 7.6399999999999996e-002 | AJ215: =H215+100*O215 -> 148.51900000000001 | AK215: 150.1 | AL215: 263 | AM215: 67.2 | AN215: 276 | AO215: -2.6000000000000002e-002 | AP215: 18 | AQ215: 英联转债!
A216: 130 | B216: 113572 | C216: 三祥转债! | D216: 603663 | E216: 三祥新材 | F216: 其他 | G216: 其他 | H216: 125.3 | I216: 8.8999999999999999e-003 | J216: 6.0999999999999995e-003 | K216: 17.39 | L216: 1.7000000000000001e-002 | M216: 113.2 | N216: 14.19 | O216: 2.2000000000000002e-002 | P216: 122.55 | Q216: 转股中 | R216: 5.29年 | S216: 3.29年 | T216: 1.7 | U216: 30 | V216: 0.14000000000000001 | W216: 5.0999999999999997e-002 | X216: 6.2e-002 | Y216: 33 | Z216: 5.62 | AA216: -1.9400000000000001e-002 | AB216: -2.3700000000000002e-002 | AC216: -5.3800000000000001e-002 | AD216: -5.57e-002 | AE216: 80.2 | AF216: 76.71 | AG216: 0.89 | AH216: A+ | AI216: 7.8100000000000003e-002 | AJ216: =H216+100*O216 -> 127.5 | AK216: 128 | AL216: 76 | AM216: 47.9 | AN216: 190 | AO216: 0.11 | AP216: 17 | AQ216: 三祥转债!
A217: 215 | B217: 113025 | C217: 明泰转债! | D217: 601677 | E217: 明泰铝业 | F217: 有色金属 | G217: 铝金属 | H217: 126.07 | I217: -7.4000000000000003e-003 | J217: -1.55e-002 | K217: 13.33 | L217: -2.98e-002 | M217: 115.1 | N217: 11.2 | O217: 5.9000000000000004e-002 | P217: 119.02 | Q217: 转股中 | R217: 4.37年 | S217: 2.37年 | T217: 13.6 | U217: 30 | V217: 1.8000000000000002e-002 | W217: 0.16500000000000001 | X217: 0.19600000000000001 | Y217: 82 | Z217: 1.09 | AA217: -2.1000000000000001e-002 | AB217: -2.7000000000000003e-002 | AC217: -7.5800000000000006e-002 | AD217: -7.8200000000000006e-002 | AE217: 92.76 | AF217: 95.59 | AG217: 0.77 | AH217: AA | AI217: 4.4400000000000002e-002 | AJ217: =H217+100*O217 -> 131.97 | AK217: 133.1 | AL217: 141 | AM217: 37.5 | AN217: 95 | AO217: -4.2999999999999997e-002 | AP217: 31 | AQ217: 明泰转债!
A218: 180 | B218: 113548 | C218: 石英转债! | D218: 603688 | E218: 石英股份 | F218: 电子 | G218: 电子产品 | H218: 138.09 | I218: 3.04e-002 | J218: -1.1200000000000002e-002 | K218: 19.69 | L218: 2.29e-002 | M218: 124.4 | N218: 15.1 | O218: 5.9000000000000004e-002 | P218: 130.4 | Q218: 转股中 | R218: 4.92年 | S218: 2.92年 | T218: 1.23 | U218: 138 | V218: 0.80700000000000005 | W218: 1.8000000000000002e-002 | X218: 2.3e-002 | Y218: 69 | Z218: 3.69 | AA218: -2.1400000000000002e-002 | AB218: -2.9399999999999999e-002 | AC218: -8.77e-002 | AD218: -8.9999999999999997e-002 | AE218: 85.98 | AF218: 91.73 | AG218: 0.84 | AH218: AA- | AI218: 6.54e-002 | AJ218: =H218+100*O218 -> 143.99000000000001 | AK218: 145.8 | AL218: 239 | AM218: 54 | AN218: 227 | AO218: 3.1e-002 | AP218: 11 | AQ218: 石英转债!
A219: 111 | B219: 128106 | C219: 华统转债 | D219: 2840 | E219: 华统股份 | F219: 农业 | G219: 农产品加 | H219: 127 | I219: -5.5000000000000005e-003 | J219: -5.0000000000000001e-003 | K219: 11.91 | L219: -1.24e-002 | M219: 113.2 | N219: 9.39 | O219: 1.e-003 | P219: 126.84 | Q219: 转股中 | R219: 5.37年 | S219: 3.37年 | T219: 5.48 | U219: 27 | V219: 3.7999999999999999e-002 | W219: 0.10300000000000001 | X219: 0.13100000000000001 | Y219: 53 | Z219: 3.18 | AA219: -2.1600000000000001e-002 | AB219: -2.5899999999999999e-002 | AC219: -5.62e-002 | AD219: -5.7999999999999996e-002 | AE219: 88.57 | AF219: 89.31 | AG219: 0.84 | AH219: AA | AI219: 4.6100000000000002e-002 | AJ219: =H219+100*O219 -> 127.09999999999999 | AK219: 127.2 | AL219: 62 | AM219: 37.9 | AN219: 99 | AO219: 0.11599999999999999 | AP219: 7 | AQ219: 华统转债
A220: 151 | B220: 113562 | C220: 璞泰转债!! | D220: 603659 | E220: 璞泰来 | F220: 电子 | G220: 元器件制 | H220: 123.82 | I220: 7.8000000000000005e-003 | J220: -3.3e-003 | K220: 100.11 | L220: 4.5000000000000005e-003 | M220: 113.3 | N220: 82.73 | O220: 2.3e-002 | P220: 121.01 | Q220: 转股中 | R220: 4年36天 | S220: 2年36天 | T220: 5.32 | U220: 30 | V220: 4.4999999999999998e-002 | W220: 1.2e-002 | X220: 1.4999999999999999e-002 | Y220: 438 | Z220: 11.96 | AA220: -2.1700000000000001e-002 | AB220: -2.7400000000000001e-002 | AC220: -8.2299999999999998e-002 | AD220: -8.3800000000000013e-002 | AE220: 92.54 | AF220: 95.05 | AG220: 1 | AH220: AA | AI220: 4.4400000000000002e-002 | AJ220: =H220+100*O220 -> 126.11999999999999 | AK220: 126.6 | AL220: 52 | AM220: 31.6 | AN220: 35 | AO220: -8.3000000000000004e-002 | AP220: 16 | AQ220: 璞泰转债!!
A221: 153 | B221: 128091 | C221: 新天转债 | D221: 2873 | E221: 新天药业 | F221: 医药 | G221: 中药 | H221: 134 | I221: -2.58e-002 | J221: 1.6899999999999998e-002 | K221: 17.79 | L221: -1.11e-002 | M221: 120 | N221: 16.39 | O221: 0.23499999999999999 | P221: 108.54 | Q221: 转股中 | R221: 5年33天 | S221: 3年33天 | T221: 1.76 | U221: 56 | V221: 0.23499999999999999 | W221: 8.4000000000000005e-002 | X221: 9.1999999999999998e-002 | Y221: 21 | Z221: 2.76 | AA221: -2.2000000000000002e-002 | AB221: -2.8500000000000001e-002 | AC221: -7.2999999999999995e-002 | AD221: -7.5600000000000001e-002 | AE221: 82.61 | AF221: 82.77 | AG221: 0.8 | AH221: A+ | AI221: 7.8100000000000003e-002 | AJ221: =H221+100*O221 -> 157.5 | AK221: 159.5 | AL221: 278 | AM221: 76.7 | AN221: 282 | AO221: -2.7999999999999997e-002 | AP221: 16 | AQ221: 新天转债
A222: 19 | B222: 110075 | C222: 南航转债 | D222: 600029 | E222: 南方航空 | F222: 交通运输 | G222: 航空运输 | H222: 125.2 | I222: -5.1999999999999998e-003 | J222: 1.1000000000000001e-003 | K222: 6.32 | L222: -6.3e-003 | M222: 110 | N222: 6.24 | O222: 0.23600000000000002 | P222: 101.28 | Q222: 4月25天 | R222: 5.88年 | S222: 3.88年 | T222: 160 | U222: 113 | V222: 6.0000000000000001e-003 | W222: 0.16500000000000001 | X222: 0.16699999999999998 | Y222: 969 | Z222: 1.34 | AA222: -2.2000000000000002e-002 | AB222: -2.5000000000000001e-002 | AC222: -4.9000000000000002e-002 | AD222: -5.0000000000000003e-002 | AE222: 86.94 | AF222: 87.04 | AG222: 0.64 | AH222: AAA | AI222: 4.1100000000000005e-002 | AJ222: =H222+100*O222 -> 148.80000000000001 | AK222: 149.1 | AL222: 258 | AM222: 62.1 | AN222: 263 | AO222: 5.9000000000000004e-002 | AP222: 7 | AQ222: 南航转债
A223: 84 | B223: 113587 | C223: 泛微转债 | D223: 603039 | E223: 泛微网络 | F223: 计算机及 | G223: 软件开发 | H223: 140.34 | I223: -3.9399999999999998e-002 | J223: 1.1000000000000001e-002 | K223: 93.94 | L223: -3.15e-002 | M223: 124.3 | N223: 64.33 | O223: -3.9e-002 | P223: 146.03 | Q223: 24天 | R223: 5.55年 | S223: 3.55年 | T223: 3.16 | U223: 20 | V223: 4.5999999999999999e-002 | W223: 1.6e-002 | X223: 2.3e-002 | Y223: 199 | Z223: 20.69 | AA223: -2.2099999999999998e-002 | AB223: -2.9100000000000001e-002 | AC223: -7.7800000000000008e-002 | AD223: -7.9600000000000004e-002 | AE223: 82.12 | AF223: 87.39 | AG223: 0.9 | AH223: AA- | AI223: 6.7099999999999993e-002 | AJ223: =H223+100*O223 -> 136.44 | AK223: 134.7 | AL223: 155 | AM223: 47.3 | AN223: 186 | AO223: -4.9000000000000002e-002 | AP223: 5 | AQ223: 泛微转债
A224: 50 | B224: 123062 | C224: 三超转债 | D224: 300554 | E224: 三超新材 | F224: 机械装备 | G224: 通用设备 | H224: 135.749 | I224: -1.38e-002 | J224: -1.61e-002 | K224: 22 | L224: -3.3000000000000002e-002 | M224: 119.7 | N224: 17.17 | O224: 5.9000000000000004e-002 | P224: 128.13 | Q224: 2月6天 | R224: 5.66年 | S224: 3.66年 | T224: 1.95 | U224: 150 | V224: 0.56899999999999995 | W224: 9.5000000000000001e-002 | X224: 0.121 | Y224: 21 | Z224: 3.94 | AA224: -2.2400000000000003e-002 | AB224: -2.8199999999999999e-002 | AC224: -6.6400000000000001e-002 | AD224: -6.8400000000000002e-002 | AE224: 76 | AF224: 75.07 | AG224: 0.91 | AH224: A | AI224: 8.8100000000000012e-002 | AJ224: =H224+100*O224 -> 141.649 | AK224: 143.4 | AL224: 230 | AM224: 67.4 | AN224: 277 | AO224: -0.13900000000000001 | AP224: 12 | AQ224: 三超转债
A225: 302 | B225: 113016 | C225: 小康转债! | D225: 601127 | E225: 小康股份 | F225: 汽车 | G225: 零部件制 | H225: 116.75 | I225: -4.5400000000000003e-002 | J225: -2.3099999999999999e-002 | K225: 18 | L225: -9.0899999999999995e-002 | M225: 109.3 | N225: 15.7 | O225: 1.8000000000000002e-002 | P225: 114.65 | Q225: 转股中 | R225: 2.94年 | S225: 0.94年 | T225: 7.99 | U225: 2559. | V225: 2.5699999999999998 | W225: 3.5000000000000003e-002 | X225: 4.0000000000000001e-002 | Y225: 227 | Z225: 3.92 | AA225: -2.2499999999999999e-002 | AB225: -2.8199999999999999e-002 | AC225: -0.114 | AD225: -0.11699999999999999 | AE225: 97.08 | AF225: 96.54 | AG225: 0.75 | AH225: AA | AI225: 4.3799999999999999e-002 | AJ225: =H225+100*O225 -> 118.55 | AK225: 118.9 | AL225: 10 | AM225: 21.8 | AN225: 8 | AO225: 0.48599999999999999 | AP225: 46 | AQ225: 小康转债!
A226: 186 | B226: 128078 | C226: 太极转债! | D226: 2368 | E226: 太极股份 | F226: 计算机及 | G226: 软件开发 | H226: 130.504 | I226: 1.6000000000000001e-003 | J226: 1.1599999999999999e-002 | K226: 26.94 | L226: 1.32e-002 | M226: 116.9 | N226: 22.4 | O226: 8.5000000000000006e-002 | P226: 120.27 | Q226: 转股中 | R226: 4.90年 | S226: 2.90年 | T226: 9.6 | U226: 2.8 | V226: 2.e-003 | W226: 6.0999999999999999e-002 | X226: 7.400000000000001e-002 | Y226: 156 | Z226: 5.08 | AA226: -2.2599999999999999e-002 | AB226: -2.8399999999999998e-002 | AC226: -7.3700000000000002e-002 | AD226: -7.5600000000000001e-002 | AE226: 90.62 | AF226: 94.86 | AG226: 1 | AH226: AA | AI226: 4.4400000000000002e-002 | AJ226: =H226+100*O226 -> 139.00399999999999 | AK226: 140.7 | AL226: 210 | AM226: 45.9 | AN226: 167 | AO226: -5.0000000000000001e-003 | AP226: 12 | AQ226: 太极转债!
A227: 271 | B227: 128039 | C227: 三力转债! | D227: 2224 | E227: 三 力 士 | F227: 机械装备 | G227: 专用设备 | H227: 119 | I227: 9.3999999999999986e-003 | J227: -8.199999999999999e-003 | K227: 6.2 | L227: 1.6000000000000001e-003 | M227: 109.8 | N227: 5.81 | O227: 0.115 | P227: 106.71 | Q227: 转股中 | R227: 3.53年 | S227: 1.53年 | T227: 2.03 | U227: 38 | V227: 0.158 | W227: 4.4999999999999998e-002 | X227: 4.8000000000000001e-002 | Y227: 45 | Z227: 1.93 | AA227: -2.29e-002 | AB227: -2.7900000000000001e-002 | AC227: -8.4600000000000009e-002 | AD227: -8.72e-002 | AE227: 92.19 | AF227: 88.18 | AG227: 0.74 | AH227: AA- | AI227: 6.54e-002 | AJ227: =H227+100*O227 -> 130.5 | AK227: 131.3 | AL227: 118 | AM227: 39.1 | AN227: 112 | AO227: -1.3999999999999999e-002 | AP227: 21 | AQ227: 三力转债!
A228: 232 | B228: 127011 | C228: 中鼎转2! | D228: 887 | E228: 中鼎股份 | F228: 汽车 | G228: 零部件制 | H228: 127.2 | I228: 5.3e-003 | J228: -1.1599999999999999e-002 | K228: 13.06 | L228: -9.1000000000000004e-003 | M228: 115.2 | N228: 11.59 | O228: 0.129 | P228: 112.68 | Q228: 转股中 | R228: 4.28年 | S228: 2.28年 | T228: 12 | U228: 8 | V228: 5.0000000000000001e-003 | W228: 7.4999999999999997e-002 | X228: 8.5000000000000006e-002 | Y228: 159 | Z228: 1.82 | AA228: -2.3399999999999997e-002 | AB228: -2.9500000000000002e-002 | AC228: -8.1699999999999995e-002 | AD228: -8.4100000000000008e-002 | AE228: 93.66 | AF228: 96.84 | AG228: 0.69 | AH228: AA+ | AI228: 4.24e-002 | AJ228: =H228+100*O228 -> 140.09999999999999 | AK228: 141.7 | AL228: 218 | AM228: 44.9 | AN228: 157 | AO228: 5.0000000000000003e-002 | AP228: 26 | AQ228: 中鼎转2!
A229: 55 | B229: 123061 | C229: 航新转债 | D229: 300424 | E229: 航新科技 | F229: 航空航天 | G229: 航空航天 | H229: 142.277 | I229: -7.4000000000000003e-003 | J229: 1.23e-002 | K229: 22.62 | L229: 5.3e-003 | M229: 124.8 | N229: 14.86 | O229: -6.5000000000000002e-002 | P229: 152.22 | Q229: 2月2天 | R229: 5.65年 | S229: 3.65年 | T229: 2.5 | U229: 3792. | V229: 10.18 | W229: 4.5999999999999999e-002 | X229: 7.0000000000000007e-002 | Y229: 54 | Z229: 4.97 | AA229: -2.3399999999999997e-002 | AB229: -3.04e-002 | AC229: -7.8e-002 | AD229: -8.0000000000000002e-002 | AE229: 81.99 | AF229: 87.22 | AG229: 0.91 | AH229: AA- | AI229: 6.7099999999999993e-002 | AJ229: =H229+100*O229 -> 135.77699999999999 | AK229: 132.3 | AL229: 134 | AM229: 45.1 | AN229: 159 | AO229: 0.14400000000000002 | AP229: 10 | AQ229: 航新转债
A230: 270 | B230: 128040 | C230: 华通转债! | D230: 2758 | E230: 华通医药 | F230: 医药 | G230: 医药商业 | H230: 122.001 | I230: -9.7000000000000003e-003 | J230: -7.3000000000000001e-003 | K230: 11.82 | L230: -2.4799999999999999e-002 | M230: 112.3 | N230: 11.29 | O230: 0.16500000000000001 | P230: 104.69 | Q230: 转股中 | R230: 3.55年 | S230: 1.55年 | T230: 2.22 | U230: 28 | V230: 0.10099999999999999 | W230: 8.900000000000001e-002 | X230: 9.4e-002 | Y230: 25 | Z230: 3.91 | AA230: -2.35e-002 | AB230: -2.9600000000000001e-002 | AC230: -9.5899999999999999e-002 | AD230: -9.8699999999999996e-002 | AE230: 92.32 | AF230: 90.12 | AG230: 0.69 | AH230: AA- | AI230: 6.54e-002 | AJ230: =H230+100*O230 -> 138.501 | AK230: 139.3 | AL230: 194 | AM230: 47 | AN230: 182 | AO230: 1.4999999999999999e-002 | AP230: 29 | AQ230: 华通转债!
A231: 118 | B231: 128104 | C231: 裕同转债! | D231: 2831 | E231: 裕同科技 | F231: 造纸包装 | G231: 包装材料 | H231: 131 | I231: 2.8999999999999998e-003 | J231: -6.6e-003 | K231: 29.09 | L231: -3.8e-003 | M231: 115.3 | N231: 23.24 | O231: 4.7e-002 | P231: 125.17 | Q231: 转股中 | R231: 5.36年 | S231: 3.36年 | T231: 13.7 | U231: 31 | V231: 1.7000000000000001e-002 | W231: 5.4000000000000006e-002 | X231: 6.7000000000000004e-002 | Y231: 255 | Z231: 3.8 | AA231: -2.4e-002 | AB231: -2.8900000000000002e-002 | AC231: -6.4500000000000002e-002 | AD231: -6.6299999999999998e-002 | AE231: 89.29 | AF231: 91.93 | AG231: 1 | AH231: AA+ | AI231: 4.41e-002 | AJ231: =H231+100*O231 -> 135.69999999999999 | AK231: 136.8 | AL231: 176 | AM231: 44.9 | AN231: 158 | AO231: -4.0999999999999995e-002 | AP231: 7 | AQ231: 裕同转债!
A232: 119 | B232: 110069 | C232: 瀚蓝转债 | D232: 600323 | E232: 瀚蓝环境 | F232: 城市公用 | G232: 三废处理 | H232: 129.59 | I232: -4.0000000000000002e-004 | J232: -5.9999999999999995e-004 | K232: 24.34 | L232: -1.1999999999999999e-003 | M232: 113.5 | N232: 20.2 | O232: 7.4999999999999997e-002 | P232: 120.5 | Q232: 转股中 | R232: 5.36年 | S232: 3.36年 | T232: 9.83 | U232: 2.3 | V232: 2.e-003 | W232: 5.2999999999999999e-002 | X232: 6.4000000000000001e-002 | Y232: 187 | Z232: 2.6 | AA232: -2.4700000000000003e-002 | AB232: -2.9100000000000001e-002 | AC232: -6.5299999999999997e-002 | AD232: -6.6400000000000001e-002 | AE232: 87.9 | AF232: 90.33 | AG232: 0.8 | AH232: AA+ | AI232: 4.41e-002 | AJ232: =H232+100*O232 -> 137.09 | AK232: 138.7 | AL232: 190 | AM232: 48.4 | AN232: 195 | AO232: -1.8000000000000002e-002 | AP232: 7 | AQ232: 瀚蓝转债
A233: 281 | B233: 110043 | C233: 无锡转债! | D233: 600908 | E233: 无锡银行 | F233: 金融 | G233: 银行行业 | H233: 117.99 | I233: 1.3899999999999999e-002 | J233: 1.7500000000000002e-002 | K233: 6.05 | L233: 5.0300000000000004e-002 | M233: 109.1 | N233: 5.79 | O233: 0.129 | P233: 104.49 | Q233: 转股中 | R233: 3.18年 | S233: 无权 | T233: 30 | U233: 45 | V233: 1.3000000000000001e-002 | W233: 0.26800000000000002 | X233: 0.28000000000000003 | Y233: 112 | Z233: 0.98 | AA233: -2.4799999999999999e-002 | AB233: -2.9900000000000003e-002 | AC233: 无权 | AD233: 无权 | AE233: 无权 | AF233: 95.84 | AG233: 0.62 | AH233: AA+ | AI233: 4.24e-002 | AJ233: =H233+100*O233 -> 130.88999999999999 | AK233: 131.5 | AL233: 121 | AM233: 35.6 | AN233: 69 | AO233: 6.8000000000000005e-002 | AP233: 31 | AQ233: 无锡转债!
A234: 66 | B234: 128119 | C234: 龙大转债 | D234: 2726 | E234: 龙大肉食 | F234: 食品饮料 | G234: 肉制品 | H234: 138.4 | I234: -4.3e-003 | J234: 2.0899999999999998e-002 | K234: 13.05 | L234: 1.95e-002 | M234: 120.2 | N234: 9.56 | O234: 1.3999999999999999e-002 | P234: 136.51 | Q234: 51天 | R234: 5.62年 | S234: 3.62年 | T234: 9.5 | U234: 140 | V234: 0.10400000000000001 | W234: 7.2999999999999995e-002 | X234: 0.10000000000000001 | Y234: 130 | Z234: 4.22 | AA234: -2.52e-002 | AB234: -3.1099999999999999e-002 | AC234: -7.3899999999999993e-002 | AD234: -7.5499999999999998e-002 | AE234: 87.55 | AF234: 93.71 | AG234: 0.85 | AH234: AA | AI234: 4.6100000000000002e-002 | AJ234: =H234+100*O234 -> 139.80000000000001 | AK234: 140.3 | AL234: 204 | AM234: 46.6 | AN234: 177 | AO234: 8.6999999999999994e-002 | AP234: 6 | AQ234: 龙大转债
A235: 315 | B235: 110034 | C235: 九州转债! | D235: 600998 | E235: 九州通 | F235: 医药 | G235: 医药商业 | H235: 112.83 | I235: -5.0000000000000001e-004 | J235: 7.000000000000001e-004 | K235: 17.69 | L235: 5.9999999999999995e-004 | M235: 109.6 | N235: 18.32 | O235: 0.16800000000000001 | P235: 96.56 | Q235: 转股中 | R235: 1年49天 | S235: 回售中 | T235: 15 | U235: 3 | V235: 2.e-003 | W235: 4.4999999999999998e-002 | X235: 4.4000000000000004e-002 | Y235: 331 | Z235: 1.77 | AA235: -2.5600000000000001e-002 | AB235: -4.0800000000000003e-002 | AC235: 回售中 | AD235: 回售中 | AE235: 103 | AF235: 104.69 | AG235: 0.32 | AH235: AA+ | AI235: 4.1799999999999997e-002 | AJ235: =H235+100*O235 -> 129.63 | AK235: 129.1 | AL235: 91 | AM235: 24.4 | AN235: 11 | AO235: -2.2000000000000002e-002 | AP235: 26 | AQ235: 九州转债!
A236: 145 | B236: 128096 | C236: 奥瑞转债!! | D236: 2701 | E236: 奥瑞金 | F236: 造纸包装 | G236: 包装材料 | H236: 132.607 | I236: -7.000000000000001e-004 | J236: 7.000000000000001e-004 | K236: 6 | L236: 0. | M236: 116 | N236: 4.52 | O236: -1.e-003 | P236: 132.74 | Q236: 转股中 | R236: 5.21年 | S236: 3.21年 | T236: 7.14 | U236: 12 | V236: 1.3000000000000001e-002 | W236: 5.0000000000000003e-002 | X236: 6.6000000000000003e-002 | Y236: 143 | Z236: 2.43 | AA236: -2.5899999999999999e-002 | AB236: -3.1099999999999999e-002 | AC236: -6.9400000000000003e-002 | AD236: -7.1599999999999997e-002 | AE236: 90.38 | AF236: 93.16 | AG236: 0.85 | AH236: AA+ | AI236: 4.41e-002 | AJ236: =H236+100*O236 -> 132.50700000000001 | AK236: 132.5 | AL236: 135 | AM236: 39.3 | AN236: 114 | AO236: 4.0000000000000001e-003 | AP236: 21 | AQ236: 奥瑞转债!!
A237: 158 | B237: 110065 | C237: 淮矿转债! | D237: 600985 | E237: 淮北矿业 | F237: 煤炭 | G237: 煤炭开采 | H237: 127 | I237: 1.1399999999999999e-002 | J237: -5.6000000000000008e-003 | K237: 11.38 | L237: 7.0999999999999995e-003 | M237: 111 | N237: 9.33 | O237: 4.0999999999999995e-002 | P237: 121.97 | Q237: 转股中 | R237: 5年26天 | S237: 3年26天 | T237: 27.6 | U237: 55 | V237: 1.6e-002 | W237: 0.11199999999999999 | X237: 0.13600000000000001 | Y237: 247 | Z237: 1.2 | AA237: -2.6699999999999998e-002 | AB237: -3.0499999999999999e-002 | AC237: -6.1799999999999994e-002 | AD237: -6.3600000000000004e-002 | AE237: 90.96 | AF237: 90.86 | AG237: 0.81 | AH237: AAA | AI237: 4.1100000000000005e-002 | AJ237: =H237+100*O237 -> 131.09999999999999 | AK237: 132 | AL237: 130 | AM237: 41.1 | AN237: 125 | AO237: 3.5000000000000003e-002 | AP237: 21 | AQ237: 淮矿转债!
A238: 253 | B238: 128048 | C238: 张行转债 | D238: 2839 | E238: 张家港行 | F238: 金融 | G238: 银行行业 | H238: 126.2 | I238: 2.6000000000000002e-002 | J238: 1.6000000000000001e-003 | K238: 6.5 | L238: 4.0000000000000001e-002 | M238: 113.3 | N238: 5.76 | O238: 0.11800000000000001 | P238: 112.85 | Q238: 转股中 | R238: 3.96年 | S238: 无权 | T238: 25 | U238: 116 | V238: 3.7000000000000005e-002 | W238: 0.21299999999999999 | X238: 0.23999999999999999 | Y238: 118 | Z238: 1.12 | AA238: -2.7300000000000001e-002 | AB238: -3.3099999999999997e-002 | AC238: 无权 | AD238: 无权 | AE238: 无权 | AF238: 96.4 | AG238: 0.69 | AH238: AA+ | AI238: 4.24e-002 | AJ238: =H238+100*O238 -> 138. | AK238: 139.6 | AL238: 198 | AM238: 43.2 | AN238: 143 | AO238: 8.4000000000000005e-002 | AP238: 14 | AQ238: 张行转债
A239: 138 | B239: 110066 | C239: 盛屯转债!! | D239: 600711 | E239: 盛屯矿业 | F239: 有色金属 | G239: 有色行业 | H239: 134.03 | I239: 8.9999999999999998e-004 | J239: -1.2500000000000001e-002 | K239: 6.35 | L239: -1.3999999999999999e-002 | M239: 115.3 | N239: 4.88 | O239: 2.9999999999999999e-002 | P239: 130.12 | Q239: 转股中 | R239: 5.26年 | S239: 3.26年 | T239: 16.8 | U239: 62 | V239: 2.7999999999999997e-002 | W239: 0.115 | X239: 0.14899999999999999 | Y239: 147 | Z239: 1.59 | AA239: -2.87e-002 | AB239: -3.3700000000000001e-002 | AC239: -7.2499999999999995e-002 | AD239: -7.4400000000000008e-002 | AE239: 89.1 | AF239: 91.42 | AG239: 0.83 | AH239: AA | AI239: 4.6100000000000002e-002 | AJ239: =H239+100*O239 -> 137.03 | AK239: 137.9 | AL239: 184 | AM239: 46.5 | AN239: 176 | AO239: -2.7999999999999997e-002 | AP239: 42 | AQ239: 盛屯转债!!
A240: 13 | B240: 123072 | C240: 乐歌转债! | D240: 300729 | E240: 乐歌股份 | F240: 其他 | G240: 家居用品 | H240: 154.42 | I240: -3.7900000000000003e-002 | J240: 3.5099999999999999e-002 | K240: 46.66 | L240: -1.e-002 | M240: 129.6 | N240: 73.13 | O240: 1.4199999999999999 | P240: 63.8 | Q240: 5月1天 | R240: 5.90年 | S240: 3.90年 | T240: 1.42 | U240: 799 | V240: 3.5299999999999998 | W240: 2.2000000000000002e-002 | X240: 1.3999999999999999e-002 | Y240: 65 | Z240: 6.8 | AA240: -2.9999999999999999e-002 | AB240: -3.7699999999999997e-002 | AC240: -8.8000000000000009e-002 | AD240: -9.06e-002 | AE240: 78.92 | AF240: 84.26 | AG240: 0.28 | AH240: A+ | AI240: 7.8100000000000003e-002 | AJ240: =H240+100*O240 -> 296.41999999999996 | AK240: 245 | AL240: 305 | AM240: 160.8 | AN240: 306 | AO240: -0.14599999999999999 | AP240: 3 | AQ240: 乐歌转债!
A241: 16 | B241: 127022 | C241: 恒逸转债 | D241: 703 | E241: 恒逸石化 | F241: 化工 | G241: 化工 | H241: 130.8 | I241: -9.300000000000001e-003 | J241: -2.e-003 | K241: 12.91 | L241: -1.4499999999999999e-002 | M241: 108.9 | N241: 11.5 | O241: 0.16500000000000001 | P241: 112.26 | Q241: 4月26天 | R241: 5.89年 | S241: 3.89年 | T241: 20 | U241: 67 | V241: 2.6000000000000002e-002 | W241: 4.2000000000000003e-002 | X241: 4.7e-002 | Y241: 475 | Z241: 1.89 | AA241: -3.1e-002 | AB241: -3.3700000000000001e-002 | AC241: -5.8299999999999998e-002 | AD241: -5.9500000000000004e-002 | AE241: 86.26 | AF241: 84.76 | AG241: 0.78 | AH241: AA+ | AI241: 4.41e-002 | AJ241: =H241+100*O241 -> 147.30000000000001 | AK241: 149.3 | AL241: 261 | AM241: 63.1 | AN241: 266 | AO241: -9.0000000000000011e-003 | AP241: 3 | AQ241: 恒逸转债
A242: 297 | B242: 123002 | C242: 国祯转债!! | D242: 300388 | E242: 国祯环保 | F242: 城市公用 | G242: 三废处理 | H242: 119.825 | I242: -1.4000000000000002e-003 | J242: 6.6e-003 | K242: 9.54 | L242: 5.3e-003 | M242: 108.8 | N242: 8.48 | O242: 6.5000000000000002e-002 | P242: 112.5 | Q242: 转股中 | R242: 2.99年 | S242: 0.99年 | T242: 2.52 | U242: 3.5 | V242: 1.2e-002 | W242: 3.7999999999999999e-002 | X242: 4.2999999999999997e-002 | Y242: 67 | Z242: 1.76 | AA242: -3.2099999999999997e-002 | AB242: -3.7400000000000003e-002 | AC242: -0.129 | AD242: -0.13100000000000001 | AE242: 96.64 | AF242: 95.86 | AG242: 0.99 | AH242: AA | AI242: 4.3799999999999999e-002 | AJ242: =H242+100*O242 -> 126.325 | AK242: 127.2 | AL242: 61 | AM242: 30.5 | AN242: 29 | AO242: -1.e-003 | AP242: 13 | AQ242: 国祯转债!!
A243: 112 | B243: 123048 | C243: 应急转债! | D243: 300527 | E243: 中船应急 | F243: 机械装备 | G243: 专用设备 | H243: 134.38 | I243: -4.1999999999999997e-003 | J243: -1.1399999999999999e-002 | K243: 11.59 | L243: -1.8600000000000002e-002 | M243: 113.1 | N243: 8.9 | O243: 3.2000000000000001e-002 | P243: 130.22 | Q243: 转股中 | R243: 5.37年 | S243: 3.37年 | T243: 3.8 | U243: 983 | V243: 1.8899999999999999 | W243: 3.6000000000000004e-002 | X243: 4.7e-002 | Y243: 106 | Z243: 4.48 | AA243: -3.2199999999999999e-002 | AB243: -3.6299999999999999e-002 | AC243: -7.1500000000000008e-002 | AD243: -7.3200000000000001e-002 | AE243: 89.07 | AF243: 90.12 | AG243: 0.84 | AH243: AA+ | AI243: 4.41e-002 | AJ243: =H243+100*O243 -> 137.57999999999998 | AK243: 138.5 | AL243: 189 | AM243: 48.4 | AN243: 196 | AO243: 1.6e-002 | AP243: 16 | AQ243: 应急转债!
A244: 191 | B244: 128075 | C244: 远东转债! | D244: 2406 | E244: 远东传动 | F244: 汽车 | G244: 零部件制 | H244: 134.53 | I244: -1.1399999999999999e-002 | J244: 2.3999999999999998e-003 | K244: 7.48 | L244: -1.06e-002 | M244: 114.9 | N244: 5.54 | O244: -4.0000000000000001e-003 | P244: 135.02 | Q244: 转股中 | R244: 4.82年 | S244: 2.82年 | T244: 5.77 | U244: 15 | V244: 1.9e-002 | W244: 0.126 | X244: 0.17000000000000001 | Y244: 46 | Z244: 1.49 | AA244: -3.27e-002 | AB244: -3.7999999999999999e-002 | AC244: -8.5000000000000006e-002 | AD244: -8.6899999999999991e-002 | AE244: 90.92 | AF244: 93.55 | AG244: 0.85 | AH244: AA | AI244: 4.4400000000000002e-002 | AJ244: =H244+100*O244 -> 134.13 | AK244: 134 | AL244: 146 | AM244: 40.5 | AN244: 121 | AO244: 1.e-003 | AP244: 15 | AQ244: 远东转债!
A245: 149 | B245: 127015 | C245: 希望转债! | D245: 876 | E245: 新 希 望 | F245: 农业 | G245: 畜牧业 | H245: 130.4 | I245: 3.0699999999999998e-002 | J245: 1.0200000000000001e-002 | K245: 25.9 | L245: 4.0999999999999995e-002 | M245: 110.2 | N245: 19.75 | O245: -6.0000000000000001e-003 | P245: 131.14 | Q245: 转股中 | R245: 5年37天 | S245: 3年37天 | T245: 11.1 | U245: 350 | V245: 0.23999999999999999 | W245: 1.e-002 | X245: 1.3000000000000001e-002 | Y245: 1167. | Z245: 3.22 | AA245: -3.2899999999999999e-002 | AB245: -3.6400000000000002e-002 | AC245: -7.0499999999999993e-002 | AD245: -7.2000000000000008e-002 | AE245: 90.28 | AF245: 90.03 | AG245: 1 | AH245: AAA | AI245: 4.1100000000000005e-002 | AJ245: =H245+100*O245 -> 129.80000000000001 | AK245: 129.7 | AL245: 99 | AM245: 39.4 | AN245: 116 | AO245: -1.6e-002 | AP245: 28 | AQ245: 希望转债!
A246: 143 | B246: 128097 | C246: 奥佳转债! | D246: 2614 | E246: 奥佳华 | F246: 机械装备 | G246: 专用设备 | H246: 137.002 | I246: -8.3000000000000001e-003 | J246: 8.8999999999999999e-003 | K246: 14.21 | L246: 7.000000000000001e-004 | M246: 115.3 | N246: 10.69 | O246: 3.1e-002 | P246: 132.93 | Q246: 转股中 | R246: 5.25年 | S246: 3.25年 | T246: 5.85 | U246: 5 | V246: 6.0000000000000001e-003 | W246: 6.7000000000000004e-002 | X246: 8.900000000000001e-002 | Y246: 88 | Z246: 2.08 | AA246: -3.2899999999999999e-002 | AB246: -3.78e-002 | AC246: -7.8899999999999998e-002 | AD246: -8.0700000000000008e-002 | AE246: 89.16 | AF246: 91.47 | AG246: 0.84 | AH246: AA | AI246: 4.6100000000000002e-002 | AJ246: =H246+100*O246 -> 140.102 | AK246: 141.1 | AL246: 212 | AM246: 49.6 | AN246: 197 | AO246: -3.5000000000000003e-002 | AP246: 25 | AQ246: 奥佳转债!
A247: 125 | B247: 123046 | C247: 天铁转债! | D247: 300587 | E247: 天铁股份 | F247: 铁路 | G247: 铁路设备 | H247: 141.099 | I247: -3.2199999999999999e-002 | J247: 1.2199999999999999e-002 | K247: 14.07 | L247: -2.2200000000000001e-002 | M247: 118.2 | N247: 10.12 | O247: 1.4999999999999999e-002 | P247: 139.03 | Q247: 转股中 | R247: 5.31年 | S247: 3.31年 | T247: 1.17 | U247: 35 | V247: 0.215 | W247: 2.5000000000000001e-002 | X247: 3.4000000000000002e-002 | Y247: 47 | Z247: 3.45 | AA247: -3.3500000000000002e-002 | AB247: -3.9100000000000003e-002 | AC247: -8.4600000000000009e-002 | AD247: -8.6599999999999996e-002 | AE247: 83.33 | AF247: 84.43 | AG247: 0.9 | AH247: AA- | AI247: 6.7099999999999993e-002 | AJ247: =H247+100*O247 -> 142.59899999999999 | AK247: 143.2 | AL247: 228 | AM247: 58.7 | AN247: 249 | AO247: -8.3000000000000004e-002 | AP247: 10 | AQ247: 天铁转债!
A248: 11 | B248: 113040 | C248: 星宇转债 | D248: 601799 | E248: 星宇股份 | F248: 汽车 | G248: 零部件制 | H248: 136.97 | I248: -2.0000000000000001e-004 | J248: 8.199999999999999e-003 | K248: 192.88 | L248: 9.7999999999999997e-003 | M248: 111.5 | N248: 158 | O248: 0.122 | P248: 122.08 | Q248: 5月2天 | R248: 5.90年 | S248: 3.90年 | T248: 15 | U248: 91 | V248: 4.4000000000000004e-002 | W248: 2.7999999999999997e-002 | X248: 3.4000000000000002e-002 | Y248: 533 | Z248: 10.02 | AA248: -3.4599999999999999e-002 | AB248: -3.7999999999999999e-002 | AC248: -6.9599999999999995e-002 | AD248: -7.0599999999999996e-002 | AE248: 85.86 | AF248: 86.69 | AG248: 0.81 | AH248: AA+ | AI248: 4.41e-002 | AJ248: =H248+100*O248 -> 149.16999999999999 | AK248: 151.9 | AL248: 266 | AM248: 65.2 | AN248: 271 | AO248: 5.0000000000000001e-003 | AP248: 2 | AQ248: 星宇转债
A249: 136 | B249: 123043 | C249: 正元转债 | D249: 300645 | E249: 正元智慧 | F249: 计算机及 | G249: 软件开发 | H249: 146.2 | I249: -2.2000000000000002e-002 | J249: 1.01e-002 | K249: 15.46 | L249: -1.6500000000000001e-002 | M249: 121.4 | N249: 15.41 | O249: 0.45700000000000002 | P249: 100.32 | Q249: 转股中 | R249: 5.27年 | S249: 3.27年 | T249: 1.66 | U249: 386 | V249: 1.5900000000000001 | W249: 8.5000000000000006e-002 | X249: 8.5000000000000006e-002 | Y249: 20 | Z249: 3.19 | AA249: -3.5400000000000001e-002 | AB249: -4.1900000000000007e-002 | AC249: -9.4e-002 | AD249: -9.6099999999999991e-002 | AE249: 81.05 | AF249: 82.51 | AG249: 0.72 | AH249: A+ | AI249: 7.8100000000000003e-002 | AJ249: =H249+100*O249 -> 191.89999999999998 | AK249: 192.1 | AL249: 297 | AM249: 109.6 | AN249: 297 | AO249: -7.9000000000000001e-002 | AP249: 18 | AQ249: 正元转债
A250: 97 | B250: 113583 | C250: 益丰转债 | D250: 603939 | E250: 益丰药房 | F250: 医药 | G250: 医药商业 | H250: 141.17 | I250: 2.5000000000000001e-003 | J250: 1.09e-002 | K250: 101.74 | L250: 1.4999999999999999e-002 | M250: 115.3 | N250: 71.82 | O250: -3.0000000000000001e-003 | P250: 141.66 | Q250: 10天 | R250: 5.51年 | S250: 3.51年 | T250: 15.8 | U250: 39 | V250: 1.7000000000000001e-002 | W250: 2.8999999999999998e-002 | X250: 4.0999999999999995e-002 | Y250: 540 | Z250: 10.74 | AA250: -3.6699999999999997e-002 | AB250: -4.1399999999999999e-002 | AC250: -8.09e-002 | AD250: -8.2599999999999993e-002 | AE250: 88.1 | AF250: 90.4 | AG250: 0.89 | AH250: AA | AI250: 4.6100000000000002e-002 | AJ250: =H250+100*O250 -> 140.86999999999998 | AK250: 140.7 | AL250: 209 | AM250: 50.3 | AN250: 200 | AO250: -6.9999999999999993e-003 | AP250: 9 | AQ250: 益丰转债
A251: 65 | B251: 123058 | C251: 欣旺转债 | D251: 300207 | E251: 欣旺达 | F251: 电子 | G251: 电子产品 | H251: 143.14 | I251: -4.0000000000000002e-004 | J251: 6.9999999999999993e-003 | K251: 28.38 | L251: 7.8000000000000005e-003 | M251: 116.3 | N251: 21.24 | O251: 7.0999999999999994e-002 | P251: 133.62 | Q251: 54天 | R251: 5.63年 | S251: 3.63年 | T251: 11.2 | U251: 15 | V251: 9.0000000000000011e-003 | W251: 2.5000000000000001e-002 | X251: 3.3000000000000002e-002 | Y251: 447 | Z251: 7.06 | AA251: -3.6799999999999999e-002 | AB251: -4.1700000000000001e-002 | AC251: -8.1900000000000001e-002 | AD251: -8.3499999999999991e-002 | AE251: 87.63 | AF251: 90.69 | AG251: 0.84 | AH251: AA | AI251: 4.6100000000000002e-002 | AJ251: =H251+100*O251 -> 150.23999999999998 | AK251: 152.7 | AL251: 268 | AM251: 62 | AN251: 262 | AO251: -2.6000000000000002e-002 | AP251: 6 | AQ251: 欣旺转债
A252: 41 | B252: 128126 | C252: 赣锋转2 | D252: 2460 | E252: 赣锋锂业 | F252: 有色金属 | G252: 小金属 | H252: 137.3 | I252: -1.2199999999999999e-002 | J252: -1.41e-002 | K252: 77.25 | L252: -3.1300000000000001e-002 | M252: 111.1 | N252: 60.27 | O252: 7.0999999999999994e-002 | P252: 128.17 | Q252: 2月17天 | R252: 5.69年 | S252: 3.69年 | T252: 21.1 | U252: 50 | V252: 1.7000000000000001e-002 | W252: 2.e-002 | X252: 2.6000000000000002e-002 | Y252: 1030. | Z252: 11.09 | AA252: -3.7000000000000005e-002 | AB252: -4.0399999999999998e-002 | AC252: -7.2599999999999998e-002 | AD252: -7.3899999999999993e-002 | AE252: 86.55 | AF252: 86.31 | AG252: 0.84 | AH252: AA | AI252: 4.6100000000000002e-002 | AJ252: =H252+100*O252 -> 144.40000000000001 | AK252: 146.4 | AL252: 243 | AM252: 59.9 | AN252: 255 | AO252: 4.9000000000000002e-002 | AP252: 8 | AQ252: 赣锋转2
A253: 76 | B253: 113590 | C253: 海容转债 | D253: 603187 | E253: 海容冷链 | F253: 机械装备 | G253: 通用设备 | H253: 142.56 | I253: -6.6e-003 | J253: 6.6e-003 | K253: 52.3 | L253: 0. | M253: 115.6 | N253: 36.39 | O253: -8.0000000000000002e-003 | P253: 143.72 | Q253: 38天 | R253: 5.59年 | S253: 3.59年 | T253: 5 | U253: 24 | V253: 3.4000000000000002e-002 | W253: 5.9999999999999998e-002 | X253: 8.6999999999999994e-002 | Y253: 83 | Z253: 5.1 | AA253: -3.7499999999999999e-002 | AB253: -4.2099999999999999e-002 | AC253: -8.1500000000000003e-002 | AD253: -8.3199999999999996e-002 | AE253: 81.67 | AF253: 81.05 | AG253: 0.93 | AH253: AA- | AI253: 6.7099999999999993e-002 | AJ253: =H253+100*O253 -> 141.75999999999999 | AK253: 141.4 | AL253: 216 | AM253: 59.7 | AN253: 254 | AO253: -2.e-002 | AP253: 6 | AQ253: 海容转债
A254: 296 | B254: 128021 | C254: 兄弟转债!! | D254: 2562 | E254: 兄弟科技 | F254: 医药 | G254: 原料药 | H254: 123.28 | I254: 2.3e-003 | J254: -5.6000000000000008e-003 | K254: 5.83 | L254: -3.4000000000000002e-003 | M254: 109.8 | N254: 5.25 | O254: 0.11 | P254: 111.05 | Q254: 转股中 | R254: 3年1.1天 | S254: 1年1.1天 | T254: 2.66 | U254: 4.9 | V254: 1.4999999999999999e-002 | W254: 4.8000000000000001e-002 | X254: 5.2999999999999999e-002 | Y254: 55 | Z254: 2.27 | AA254: -3.8599999999999995e-002 | AB254: -4.4299999999999999e-002 | AC254: -0.14199999999999999 | AD254: -0.14499999999999999 | AE254: 97.53 | AF254: 96.66 | AG254: 0.96 | AH254: AA | AI254: 4.4400000000000002e-002 | AJ254: =H254+100*O254 -> 134.28 | AK254: 135.5 | AL254: 164 | AM254: 38 | AN254: 100 | AO254: -5.0000000000000001e-003 | AP254: 13 | AQ254: 兄弟转债!!
A255: 68 | B255: 113592 | C255: 安20转债 | D255: 603345 | E255: 安井食品 | F255: 食品饮料 | G255: 食品饮料 | H255: 140.6 | I255: -1.44e-002 | J255: 1.3600000000000001e-002 | K255: 165.15 | L255: -8.9999999999999998e-004 | M255: 113.1 | N255: 115.9 | O255: -1.3000000000000001e-002 | P255: 142.49 | Q255: 48天 | R255: 5.61年 | S255: 3.61年 | T255: 9 | U255: 25 | V255: 2.e-002 | W255: 2.3e-002 | X255: 3.3000000000000002e-002 | Y255: 391 | Z255: 12.17 | AA255: -3.8699999999999998e-002 | AB255: -4.2599999999999999e-002 | AC255: -7.8200000000000006e-002 | AD255: -7.980000000000001e-002 | AE255: 87.51 | AF255: 88.24 | AG255: 0.9 | AH255: AA | AI255: 4.6100000000000002e-002 | AJ255: =H255+100*O255 -> 139.29999999999998 | AK255: 138.7 | AL255: 191 | AM255: 50.5 | AN255: 203 | AO255: -4.4000000000000004e-002 | AP255: 6 | AQ255: 安20转债
A256: 166 | B256: 113029 | C256: 明阳转债!! | D256: 601615 | E256: 明阳智能 | F256: 能源电力 | G256: 风能 | H256: 138.61 | I256: -6.0000000000000001e-003 | J256: -1.1599999999999999e-002 | K256: 17.09 | L256: -2.06e-002 | M256: 113.3 | N256: 12.8 | O256: 3.7999999999999999e-002 | P256: 133.52 | Q256: 转股中 | R256: 5年19天 | S256: 3年19天 | T256: 9.8 | U256: 50 | V256: 3.7000000000000005e-002 | W256: 3.1e-002 | X256: 4.0999999999999995e-002 | Y256: 320 | Z256: 3.17 | AA256: -3.9900000000000005e-002 | AB256: -4.4299999999999999e-002 | AC256: -8.6800000000000002e-002 | AD256: -8.8800000000000004e-002 | AE256: 89.95 | AF256: 90.69 | AG256: 0.86 | AH256: AA | AI256: 4.6100000000000002e-002 | AJ256: =H256+100*O256 -> 142.41000000000003 | AK256: 143.7 | AL256: 232 | AM256: 53 | AN256: 222 | AO256: 3.6000000000000004e-002 | AP256: 22 | AQ256: 明阳转债!!
A257: 122 | B257: 128103 | C257: 同德转债 | D257: 2360 | E257: 同德化工 | F257: 化工 | G257: 化工 | H257: 151.003 | I257: -2.58e-002 | J257: 1.2699999999999999e-002 | K257: 6.53 | L257: -1.5100000000000001e-002 | M257: 121.8 | N257: 5.18 | O257: 0.19800000000000001 | P257: 126.06 | Q257: 转股中 | R257: 5.33年 | S257: 3.33年 | T257: 1.44 | U257: 1134. | V257: 5.0300000000000002 | W257: 5.5999999999999994e-002 | X257: 7.0999999999999994e-002 | Y257: 26 | Z257: 2.13 | AA257: -4.0399999999999998e-002 | AB257: -4.6900000000000004e-002 | AC257: -0.10099999999999999 | AD257: -0.10000000000000001 | AE257: 80.8 | AF257: 82.43 | AG257: 0.87 | AH257: A+ | AI257: 7.8100000000000003e-002 | AJ257: =H257+100*O257 -> 170.803 | AK257: 175.9 | AL257: 288 | AM257: 93.5 | AN257: 293 | AO257: 2.6000000000000002e-002 | AP257: 12 | AQ257: 同德转债
A258: 116 | B258: 113575 | C258: 东时转债! | D258: 603377 | E258: 东方时尚 | F258: 其他 | G258: 其他 | H258: 140.99 | I258: -4.0999999999999995e-003 | J258: -2.0000000000000001e-004 | K258: 20.59 | L258: -4.7999999999999996e-003 | M258: 113.5 | N258: 14.56 | O258: -3.0000000000000001e-003 | P258: 141.41 | Q258: 转股中 | R258: 5.36年 | S258: 3.36年 | T258: 1.38 | U258: 8 | V258: 4.0999999999999995e-002 | W258: 1.1000000000000001e-002 | X258: 1.6e-002 | Y258: 121 | Z258: 6.45 | AA258: -4.0399999999999998e-002 | AB258: -4.4600000000000001e-002 | AC258: -8.3699999999999997e-002 | AD258: -8.5500000000000007e-002 | AE258: 88.71 | AF258: 89.58 | AG258: 0.9 | AH258: AA | AI258: 4.6100000000000002e-002 | AJ258: =H258+100*O258 -> 140.69 | AK258: 140.6 | AL258: 206 | AM258: 51 | AN258: 207 | AO258: 3.2000000000000001e-002 | AP258: 15 | AQ258: 东时转债!
A259: 207 | B259: 123026 | C259: 中环转债! | D259: 300692 | E259: 中环环保 | F259: 城市公用 | G259: 三废处理 | H259: 128 | I259: -4.1200000000000001e-002 | J259: 3.78e-002 | K259: 13.97 | L259: -3.5999999999999999e-003 | M259: 110.6 | N259: 12.51 | O259: 0.14599999999999999 | P259: 111.67 | Q259: 转股中 | R259: 3.53年 | S259: 1.53年 | T259: 0.59 | U259: 365 | V259: 4.7000000000000002 | W259: 1.9e-002 | X259: 2.2000000000000002e-002 | Y259: 31 | Z259: 2.26 | AA259: -4.1200000000000001e-002 | AB259: -4.6399999999999997e-002 | AC259: -0.106 | AD259: -0.10800000000000001 | AE259: 92.34 | AF259: 88.82 | AG259: 0.97 | AH259: AA- | AI259: 6.54e-002 | AJ259: =H259+100*O259 -> 142.59999999999999 | AK259: 144.3 | AL259: 235 | AM259: 52 | AN259: 212 | AO259: -7.8e-002 | AP259: 27 | AQ259: 中环转债!
A260: 230 | B260: 110055 | C260: 伊力转债!! | D260: 600197 | E260: 伊力特 | F260: 食品饮料 | G260: 白酒 | H260: 139.34 | I260: -5.8099999999999999e-002 | J260: -3.4000000000000002e-003 | K260: 23.4 | L260: -7.0000000000000007e-002 | M260: 115 | N260: 16.81 | O260: 1.e-003 | P260: 139.2 | Q260: 转股中 | R260: 4.30年 | S260: 2.30年 | T260: 4 | U260: 257 | V260: 0.45299999999999996 | W260: 3.9e-002 | X260: 5.5e-002 | Y260: 102 | Z260: 3.8 | AA260: -4.4600000000000001e-002 | AB260: -5.04e-002 | AC260: -0.114 | AD260: -0.11599999999999999 | AE260: 93.12 | AF260: 95.82 | AG260: 0.88 | AH260: AA | AI260: 4.4400000000000002e-002 | AJ260: =H260+100*O260 -> 139.44 | AK260: 139.5 | AL260: 195 | AM260: 43.7 | AN260: 145 | AO260: 1.7000000000000001e-002 | AP260: 25 | AQ260: 伊力转债!!
A261: 256 | B261: 128046 | C261: 利尔转债! | D261: 2258 | E261: 利尔化学 | F261: 化工 | G261: 农化 | H261: 133.94 | I261: 1.67e-002 | J261: -2.6800000000000001e-002 | K261: 22.6 | L261: -1.2699999999999999e-002 | M261: 112.3 | N261: 18.62 | O261: 0.10400000000000001 | P261: 121.37 | Q261: 转股中 | R261: 3.89年 | S261: 1.89年 | T261: 8.52 | U261: 5.6 | V261: 5.0000000000000001e-003 | W261: 7.2000000000000008e-002 | X261: 8.6999999999999994e-002 | Y261: 119 | Z261: 3.32 | AA261: -4.4999999999999998e-002 | AB261: -5.04e-002 | AC261: -0.121 | AD261: -0.12300000000000001 | AE261: 94.08 | AF261: 95.14 | AG261: 0.8 | AH261: AA | AI261: 4.4400000000000002e-002 | AJ261: =H261+100*O261 -> 144.34 | AK261: 146.5 | AL261: 244 | AM261: 51.4 | AN261: 209 | AO261: 3.2000000000000001e-002 | AP261: 10 | AQ261: 利尔转债!
A262: 251 | B262: 123017 | C262: 寒锐转债!! | D262: 300618 | E262: 寒锐钴业 | F262: 有色金属 | G262: 小金属 | H262: 132.245 | I262: 4.0000000000000002e-004 | J262: 1.1200000000000002e-002 | K262: 69.58 | L262: 1.34e-002 | M262: 110.3 | N262: 57.4 | O262: 9.0999999999999998e-002 | P262: 121.22 | Q262: 转股中 | R262: 3.98年 | S262: 1.98年 | T262: 4.03 | U262: 50 | V262: 9.5000000000000001e-002 | W262: 1.9e-002 | X262: 2.3e-002 | Y262: 211 | Z262: 5.74 | AA262: -4.53e-002 | AB262: -4.9699999999999994e-002 | AC262: -0.111 | AD262: -0.113 | AE262: 89.81 | AF262: 86.11 | AG262: 0.87 | AH262: AA- | AI262: 6.54e-002 | AJ262: =H262+100*O262 -> 141.345 | AK262: 143.3 | AL262: 229 | AM262: 53.5 | AN262: 223 | AO262: -1.7000000000000001e-002 | AP262: 14 | AQ262: 寒锐转债!!
A263: 43 | B263: 113038 | C263: 隆20转债 | D263: 601012 | E263: 隆基股份 | F263: 能源电力 | G263: 太阳能 | H263: 144.84 | I263: 1.41e-002 | J263: 1.1399999999999999e-002 | K263: 69.5 | L263: 3.0099999999999998e-002 | M263: 111.8 | N263: 52.59 | O263: 9.6000000000000002e-002 | P263: 132.15 | Q263: 2月11天 | R263: 5.67年 | S263: 3.67年 | T263: 50 | U263: 212 | V263: 2.8999999999999998e-002 | W263: 1.9e-002 | X263: 2.5000000000000001e-002 | Y263: 2621. | Z263: 8.08 | AA263: -4.53e-002 | AB263: -4.8799999999999996e-002 | AC263: -8.4700000000000011e-002 | AD263: -8.6199999999999999e-002 | AE263: 88.59 | AF263: 89.3 | AG263: 0.85 | AH263: AAA | AI263: 4.1100000000000005e-002 | AJ263: =H263+100*O263 -> 154.44 | AK263: 157.5 | AL263: 275 | AM263: 68.2 | AN263: 278 | AO263: 2.e-003 | AP263: 12 | AQ263: 隆20转债
A264: 144 | B264: 128095 | C264: 恩捷转债!! | D264: 2812 | E264: 恩捷股份 | F264: 电子 | G264: 元器件制 | H264: 148.29 | I264: -4.0999999999999995e-003 | J264: -3.0999999999999999e-003 | K264: 96.6 | L264: -8.1000000000000013e-003 | M264: 115.3 | N264: 65.09 | O264: -1.e-003 | P264: 148.41 | Q264: 转股中 | R264: 5.21年 | S264: 3.21年 | T264: 12.1 | U264: 67 | V264: 3.7000000000000005e-002 | W264: 1.3999999999999999e-002 | X264: 2.1000000000000001e-002 | Y264: 849 | Z264: 8.6 | AA264: -4.8000000000000001e-002 | AB264: -5.28e-002 | AC264: -0.10099999999999999 | AD264: -0.10099999999999999 | AE264: 89.32 | AF264: 91.63 | AG264: 0.9 | AH264: AA | AI264: 4.6100000000000002e-002 | AJ264: =H264+100*O264 -> 148.19 | AK264: 148.2 | AL264: 254 | AM264: 56.5 | AN264: 236 | AO264: -5.7000000000000002e-002 | AP264: 17 | AQ264: 恩捷转债!!
A265: 139 | B265: 113032 | C265: 桐20转债! | D265: 601233 | E265: 桐昆股份 | F265: 服装纺织 | G265: 纺织行业 | H265: 146.3 | I265: -2.e-003 | J265: -1.11e-002 | K265: 20 | L265: -1.4800000000000001e-002 | M265: 113.1 | N265: 14.35 | O265: 5.0000000000000003e-002 | P265: 139.37 | Q265: 转股中 | R265: 5.26年 | S265: 3.26年 | T265: 22.1 | U265: 102 | V265: 3.2000000000000001e-002 | W265: 5.5e-002 | X265: 7.5999999999999998e-002 | Y265: 403 | Z265: 1.88 | AA265: -4.8600000000000004e-002 | AB265: -5.2699999999999997e-002 | AC265: -9.6500000000000002e-002 | AD265: -9.820000000000001e-002 | AE265: 89.48 | AF265: 90.53 | AG265: 0.89 | AH265: AA+ | AI265: 4.41e-002 | AJ265: =H265+100*O265 -> 151.30000000000001 | AK265: 153.2 | AL265: 270 | AM265: 62.7 | AN265: 265 | AO265: 7.0000000000000007e-002 | AP265: 19 | AQ265: 桐20转债!
A266: 2 | B266: 113041 | C266: N紫金转 | D266: 601899 | E266: 紫金矿业 | F266: 有色金属 | G266: 贵金属 | H266: 137.89 | I266: 0.379 | J266: 0. | K266: 8.95 | L266: 1.0200000000000001e-002 | M266: 108 | N266: 7.01 | O266: 8.0000000000000002e-002 | P266: 127.67 | Q266: 5月14天 | R266: 4.93年 | S266: 2.93年 | T266: 60 | U266: 854 | V266: 0.10400000000000001 | W266: 2.6000000000000002e-002 | X266: 3.4000000000000002e-002 | Y266: 2271. | Z266: 4.74 | AA266: -4.8600000000000004e-002 | AB266: -5.1399999999999994e-002 | AC266: -9.4800000000000009e-002 | AD266: -9.5500000000000002e-002 | AE266: 89.93 | AF266: 89.38 | AG266: 0.82 | AH266: AAA | AI266: 3.9399999999999998e-002 | AJ266: =H266+100*O266 -> 145.88999999999999 | AK266: 148.1 | AL266: 252 | AM266: 58.2 | AN266: 245 | AO266: 0.107 | AP266: 5 | AQ266: N紫金转
A267: 305 | B267: 113013 | C267: 国君转债! | D267: 601211 | E267: 国泰君安 | F267: 金融 | G267: 证券行业 | H267: 123.1 | I267: 1.6799999999999999e-002 | J267: -8.6999999999999994e-003 | K267: 18.94 | L267: 1.4999999999999999e-002 | M267: 108.3 | N267: 19.01 | O267: 0.23600000000000002 | P267: 99.63 | Q267: 转股中 | R267: 2.61年 | S267: 无权 | T267: 69.9 | U267: 51 | V267: 6.0000000000000001e-003 | W267: 4.0999999999999995e-002 | X267: 4.0999999999999995e-002 | Y267: 1687. | Z267: 1.36 | AA267: -4.87e-002 | AB267: -5.4199999999999998e-002 | AC267: 无权 | AD267: 无权 | AE267: 无权 | AF267: 98.23 | AG267: 0.54 | AH267: AAA | AI267: 3.8800000000000001e-002 | AJ267: =H267+100*O267 -> 146.69999999999999 | AK267: 146.6 | AL267: 245 | AM267: 48.3 | AN267: 194 | AO267: 2.5000000000000001e-002 | AP267: 14 | AQ267: 国君转债!
A268: 239 | B268: 128053 | C268: 尚荣转债! | D268: 2551 | E268: 尚荣医疗 | F268: 医药 | G268: 医疗器械 | H268: 141.3 | I268: -2.6200000000000001e-002 | J268: 1.1200000000000002e-002 | K268: 6.56 | L268: -1.4999999999999999e-002 | M268: 114.9 | N268: 4.89 | O268: 5.2999999999999999e-002 | P268: 134.15 | Q268: 转股中 | R268: 4.22年 | S268: 2.22年 | T268: 1.91 | U268: 39 | V268: 0.14099999999999999 | W268: 3.5000000000000003e-002 | X268: 4.8000000000000001e-002 | Y268: 54 | Z268: 1.82 | AA268: -4.8799999999999996e-002 | AB268: -5.4600000000000003e-002 | AC268: -0.12300000000000001 | AD268: -0.125 | AE268: 93.34 | AF268: 96.05 | AG268: 1 | AH268: AA | AI268: 4.4400000000000002e-002 | AJ268: =H268+100*O268 -> 146.60000000000002 | AK268: 148.4 | AL268: 255 | AM268: 52.4 | AN268: 217 | AO268: -5.2000000000000005e-002 | AP268: 27 | AQ268: 尚荣转债!
A269: 89 | B269: 113585 | C269: 寿仙转债 | D269: 603896 | E269: 寿仙谷 | F269: 医药 | G269: 中药 | H269: 155.01 | I269: 1.9e-003 | J269: 1.4000000000000002e-003 | K269: 46.11 | L269: 3.4999999999999996e-003 | M269: 117.8 | N269: 28.68 | O269: -3.6000000000000004e-002 | P269: 160.77 | Q269: 18天 | R269: 5.53年 | S269: 3.53年 | T269: 3.6 | U269: 15 | V269: 2.7000000000000003e-002 | W269: 5.4000000000000006e-002 | X269: 8.6999999999999994e-002 | Y269: 66 | Z269: 5.37 | AA269: -4.9299999999999997e-002 | AB269: -5.45e-002 | AC269: -0.10000000000000001 | AD269: -0.10199999999999999 | AE269: 82.14 | AF269: 82.92 | AG269: 0.95 | AH269: AA- | AI269: 6.7099999999999993e-002 | AJ269: =H269+100*O269 -> 151.41 | AK269: 149.2 | AL269: 260 | AM269: 66.3 | AN269: 274 | AO269: -6.9999999999999993e-003 | AP269: 9 | AQ269: 寿仙转债
A270: 263 | B270: 123012 | C270: 万顺转债! | D270: 300057 | E270: 万顺新材 | F270: 造纸包装 | G270: 包装材料 | H270: 133.001 | I270: -1.11e-002 | J270: 7.3000000000000001e-003 | K270: 5.88 | L270: -5.1000000000000004e-003 | M270: 110.3 | N270: 5.31 | O270: 0.20100000000000001 | P270: 110.73 | Q270: 转股中 | R270: 3.64年 | S270: 1.64年 | T270: 1.29 | U270: 47 | V270: 0.27500000000000002 | W270: 3.3000000000000002e-002 | X270: 3.6000000000000004e-002 | Y270: 40 | Z270: 1.16 | AA270: -5.0900000000000001e-002 | AB270: -5.57e-002 | AC270: -0.113 | AD270: -0.115 | AE270: 91.74 | AF270: 87.97 | AG270: 0.76 | AH270: AA- | AI270: 6.54e-002 | AJ270: =H270+100*O270 -> 153.101 | AK270: 155.3 | AL270: 273 | AM270: 63.5 | AN270: 267 | AO270: -0.106 | AP270: 18 | AQ270: 万顺转债!
A271: 279 | B271: 113504 | C271: 艾华转债!! | D271: 603989 | E271: 艾华集团 | F271: 电子 | G271: 元器件制 | H271: 131.2 | I271: 2.2000000000000001e-003 | J271: 6.9999999999999993e-003 | K271: 26.66 | L271: 1.1000000000000001e-002 | M271: 110.3 | N271: 21.13 | O271: 4.0000000000000001e-002 | P271: 126.17 | Q271: 转股中 | R271: 3.26年 | S271: 1.26年 | T271: 5.61 | U271: 3.9 | V271: 5.0000000000000001e-003 | W271: 5.2999999999999999e-002 | X271: 6.7000000000000004e-002 | Y271: 106 | Z271: 4.38 | AA271: -5.28e-002 | AB271: -5.8200000000000002e-002 | AC271: -0.14499999999999999 | AD271: -0.14699999999999999 | AE271: 96.68 | AF271: 96.03 | AG271: 0.84 | AH271: AA | AI271: 4.4400000000000002e-002 | AJ271: =H271+100*O271 -> 135.19999999999999 | AK271: 136.2 | AL271: 173 | AM271: 39.5 | AN271: 118 | AO271: -1.3999999999999999e-002 | AP271: 9 | AQ271: 艾华转债!!
A272: 188 | B272: 113545 | C272: 金能转债 | D272: 603113 | E272: 金能科技 | F272: 煤炭 | G272: 炼焦 | H272: 151.39 | I272: 1.2e-002 | J272: -3.0000000000000001e-003 | K272: 16.35 | L272: 9.8999999999999991e-003 | M272: 114.9 | N272: 10.78 | O272: -2.e-003 | P272: 151.67 | Q272: 转股中 | R272: 4.88年 | S272: 2.88年 | T272: 12.2 | U272: 186 | V272: 0.10099999999999999 | W272: 9.3000000000000013e-002 | X272: 0.14000000000000001 | Y272: 132 | Z272: 1.81 | AA272: -5.5800000000000002e-002 | AB272: -6.08e-002 | AC272: -0.11699999999999999 | AD272: -0.11800000000000001 | AE272: 90.69 | AF272: 93.32 | AG272: 0.9 | AH272: AA | AI272: 4.4400000000000002e-002 | AJ272: =H272+100*O272 -> 151.19 | AK272: 151.1 | AL272: 265 | AM272: 57.8 | AN272: 242 | AO272: 0.16500000000000001 | AP272: 21 | AQ272: 金能转债
A273: 194 | B273: 123030 | C273: 九洲转债! | D273: 300040 | E273: 九洲集团 | F273: 能源电力 | G273: 电力设备 | H273: 157 | I273: -5.4199999999999998e-002 | J273: 3.6799999999999999e-002 | K273: 7.88 | L273: -1.7500000000000002e-002 | M273: 120 | N273: 5.65 | O273: 0.126 | P273: 139.47 | Q273: 转股中 | R273: 4.73年 | S273: 2.73年 | T273: 0.97 | U273: 137 | V273: 0.88200000000000001 | W273: 3.3000000000000002e-002 | X273: 4.5999999999999999e-002 | Y273: 30 | Z273: 1.37 | AA273: -5.62e-002 | AB273: -6.2800000000000009e-002 | AC273: -0.13300000000000001 | AD273: -0.13500000000000001 | AE273: 86.32 | AF273: 89.46 | AG273: 1 | AH273: AA- | AI273: 6.54e-002 | AJ273: =H273+100*O273 -> 169.59999999999999 | AK273: 174.5 | AL273: 286 | AM273: 85.1 | AN273: 289 | AO273: -0.122 | AP273: 28 | AQ273: 九洲转债!
A274: 241 | B274: 113526 | C274: 联泰转债! | D274: 603797 | E274: 联泰环保 | F274: 城市公用 | G274: 三废处理 | H274: 140.44 | I274: -2.2200000000000001e-002 | J274: 2.0099999999999996e-002 | K274: 8.24 | L274: -2.3999999999999998e-003 | M274: 110.8 | N274: 6.11 | O274: 4.0999999999999995e-002 | P274: 134.86 | Q274: 转股中 | R274: 4年57天 | S274: 2年57天 | T274: 1.93 | U274: 16 | V274: 5.7999999999999996e-002 | W274: 5.2000000000000005e-002 | X274: 7.0000000000000007e-002 | Y274: 37 | Z274: 2.4 | AA274: -5.6500000000000002e-002 | AB274: -6.08e-002 | AC274: -0.124 | AD274: -0.126 | AE274: 93.9 | AF274: 93.59 | AG274: 0.85 | AH274: AA+ | AI274: 4.24e-002 | AJ274: =H274+100*O274 -> 144.53999999999999 | AK274: 146 | AL274: 240 | AM274: 52.1 | AN274: 214 | AO274: -1.3999999999999999e-002 | AP274: 8 | AQ274: 联泰转债!
A275: 174 | B275: 113550 | C275: 常汽转债! | D275: 603035 | E275: 常熟汽饰 | F275: 汽车 | G275: 零部件制 | H275: 162.07 | I275: -1.3500000000000002e-002 | J275: -4.5999999999999999e-003 | K275: 14.98 | L275: -1.9599999999999999e-002 | M275: 121.3 | N275: 9.65 | O275: 4.4000000000000004e-002 | P275: 155.23 | Q275: 转股中 | R275: 4.98年 | S275: 2.98年 | T275: 3.84 | U275: 48 | V275: 7.6999999999999999e-002 | W275: 7.5999999999999998e-002 | X275: 0.11800000000000001 | Y275: 51 | Z275: 1.5 | AA275: -5.7699999999999994e-002 | AB275: -6.4299999999999996e-002 | AC275: -0.13 | AD275: -0.13100000000000001 | AE275: 85.59 | AF275: 89.14 | AG275: 0.92 | AH275: AA- | AI275: 6.54e-002 | AJ275: =H275+100*O275 -> 166.47 | AK275: 168.9 | AL275: 284 | AM275: 79.8 | AN275: 283 | AO275: -7.400000000000001e-002 | AP275: 16 | AQ275: 常汽转债!
A276: 85 | B276: 128112 | C276: 歌尔转2 | D276: 2241 | E276: 歌尔股份 | F276: 电子 | G276: 电子产品 | H276: 159.2 | I276: 2.7799999999999998e-002 | J276: -7.4999999999999997e-003 | K276: 37.48 | L276: 2.18e-002 | M276: 114.5 | N276: 23.27 | O276: -1.2e-002 | P276: 161.07 | Q276: 21天 | R276: 5.54年 | S276: 3.54年 | T276: 40 | U276: 561 | V276: 8.900000000000001e-002 | W276: 3.3000000000000002e-002 | X276: 5.2999999999999999e-002 | Y276: 1216. | Z276: 6.96 | AA276: -5.8499999999999996e-002 | AB276: -6.2699999999999992e-002 | AC276: -0.10800000000000001 | AD276: -0.109 | AE276: 87.86 | AF276: 90.47 | AG276: 0.93 | AH276: AA+ | AI276: 4.41e-002 | AJ276: =H276+100*O276 -> 158. | AK276: 157.3 | AL276: 274 | AM276: 66.9 | AN276: 275 | AO276: -0.12 | AP276: 16 | AQ276: 歌尔转2
A277: 277 | B277: 127005 | C277: 长证转债! | D277: 783 | E277: 长江证券 | F277: 金融 | G277: 证券行业 | H277: 132.9 | I277: 2.0099999999999996e-002 | J277: 2.86e-002 | K277: 9.03 | L277: 6.1100000000000002e-002 | M277: 109.3 | N277: 7.28 | O277: 7.0999999999999994e-002 | P277: 124.04 | Q277: 转股中 | R277: 3.29年 | S277: 无权 | T277: 50 | U277: 111 | V277: 1.7000000000000001e-002 | W277: 0.10000000000000001 | X277: 0.124 | Y277: 499 | Z277: 1.78 | AA277: -5.8799999999999998e-002 | AB277: -6.3600000000000004e-002 | AC277: 无权 | AD277: 无权 | AE277: 无权 | AF277: 96.53 | AG277: 0.8 | AH277: AAA | AI277: 3.9399999999999998e-002 | AJ277: =H277+100*O277 -> 140. | AK277: 141.8 | AL277: 219 | AM277: 45.2 | AN277: 161 | AO277: 7.4999999999999997e-002 | AP277: 15 | AQ277: 长证转债!
A278: 148 | B278: 123042 | C278: 银河转债! | D278: 300619 | E278: 金银河 | F278: 机械装备 | G278: 专用设备 | H278: 157.664 | I278: -8.0299999999999996e-002 | J278: 9.8999999999999991e-003 | K278: 27.05 | L278: -8.7100000000000011e-002 | M278: 115.9 | N278: 24.4 | O278: 0.42200000000000004 | P278: 110.86 | Q278: 转股中 | R278: 5年48天 | S278: 3年48天 | T278: 1.67 | U278: 796 | V278: 2.96 | W278: 8.3000000000000004e-002 | X278: 9.1999999999999998e-002 | Y278: 20 | Z278: 4.13 | AA278: -5.9400000000000001e-002 | AB278: -6.4399999999999999e-002 | AC278: -0.11699999999999999 | AD278: -0.11900000000000001 | AE278: 81.65 | AF278: 79.58 | AG278: 0.81 | AH278: A+ | AI278: 7.8100000000000003e-002 | AJ278: =H278+100*O278 -> 199.86399999999998 | AK278: 204.5 | AL278: 298 | AM278: 122.8 | AN278: 299 | AO278: -6.8000000000000005e-002 | AP278: 25 | AQ278: 银河转债!
A279: 88 | B279: 128110 | C279: 永兴转债 | D279: 2756 | E279: 永兴材料 | F279: 钢铁 | G279: 炼钢 | H279: 157.999 | I279: 8.8999999999999999e-003 | J279: -1.7299999999999999e-002 | K279: 28.79 | L279: -9.0000000000000011e-003 | M279: 113.2 | N279: 17.06 | O279: -6.4000000000000001e-002 | P279: 168.76 | Q279: 18天 | R279: 5.53年 | S279: 3.53年 | T279: 7 | U279: 222 | V279: 0.20000000000000001 | W279: 6.7000000000000004e-002 | X279: 0.11199999999999999 | Y279: 105 | Z279: 3.01 | AA279: -5.9500000000000004e-002 | AB279: -6.3299999999999995e-002 | AC279: -0.105 | AD279: -0.107 | AE279: 87.92 | AF279: 88.65 | AG279: 0.94 | AH279: AA | AI279: 4.6100000000000002e-002 | AJ279: =H279+100*O279 -> 151.59899999999999 | AK279: 147.2 | AL279: 249 | AM279: 58.6 | AN279: 248 | AO279: 0.27600000000000002 | AP279: 5 | AQ279: 永兴转债
A280: 274 | B280: 128036 | C280: 金农转债!! | D280: 2548 | E280: 金新农 | F280: 农业 | G280: 畜牧业 | H280: 135.1 | I280: -1.3000000000000001e-002 | J280: 2.7300000000000001e-002 | K280: 8.25 | L280: 1.4800000000000001e-002 | M280: 110.3 | N280: 7.39 | O280: 0.20999999999999999 | P280: 111.64 | Q280: 转股中 | R280: 3.28年 | S280: 1.28年 | T280: 1.46 | U280: 414 | V280: 2.02 | W280: 3.1e-002 | X280: 3.5000000000000003e-002 | Y280: 46 | Z280: 2.18 | AA280: -6.1100000000000002e-002 | AB280: -6.6400000000000001e-002 | AC280: -0.157 | AD280: -0.16 | AE280: 93.89 | AF280: 90.02 | AG280: 0.97 | AH280: AA- | AI280: 6.54e-002 | AJ280: =H280+100*O280 -> 156.09999999999999 | AK280: 158.6 | AL280: 277 | AM280: 64.7 | AN280: 269 | AO280: 1.1000000000000001e-002 | AP280: 15 | AQ280: 金农转债!!
A281: 237 | B281: 128056 | C281: 今飞转债! | D281: 2863 | E281: 今飞凯达 | F281: 汽车 | G281: 零部件制 | H281: 157.8 | I281: 7.3499999999999996e-002 | J281: 2.0299999999999999e-002 | K281: 10.67 | L281: 0.10000000000000001 | M281: 121 | N281: 6.76 | O281: 0. | P281: 157.84 | Q281: 转股中 | R281: 4.26年 | S281: 2.26年 | T281: 2.34 | U281: 2803. | V281: 7.7300000000000004 | W281: 5.5999999999999994e-002 | X281: 8.8000000000000009e-002 | Y281: 42 | Z281: 3.61 | AA281: -6.1799999999999994e-002 | AB281: -6.9500000000000006e-002 | AC281: -0.11699999999999999 | AD281: -0.11900000000000001 | AE281: 87.38 | AF281: 89.19 | AG281: 0.94 | AH281: A+ | AI281: 7.6399999999999996e-002 | AJ281: =H281+100*O281 -> 157.80000000000001 | AK281: 157.8 | AL281: 276 | AM281: 68.6 | AN281: 279 | AO281: 0.29199999999999998 | AP281: 59 | AQ281: 今飞转债!
A282: 300 | B282: 128019 | C282: 久立转2!! | D282: 2318 | E282: 久立特材 | F282: 石油天然 | G282: 石油天然 | H282: 131.301 | I282: -1.21e-002 | J282: 4.1999999999999997e-003 | K282: 10.05 | L282: -7.9000000000000008e-003 | M282: 108.8 | N282: 7.62 | O282: -4.0000000000000001e-003 | P282: 131.89 | Q282: 转股中 | R282: 2.95年 | S282: 0.95年 | T282: 5.65 | U282: 90 | V282: 0.12 | W282: 6.7000000000000004e-002 | X282: 8.8000000000000009e-002 | Y282: 85 | Z282: 2.41 | AA282: -6.25e-002 | AB282: -6.7599999999999993e-002 | AC282: -0.20100000000000001 | AD282: -0.20300000000000001 | AE282: 96.82 | AF282: 96.04 | AG282: 1 | AH282: AA | AI282: 4.3799999999999999e-002 | AJ282: =H282+100*O282 -> 130.90099999999998 | AK282: 130.7 | AL282: 111 | AM282: 33.9 | AN282: 51 | AO282: -5.0999999999999997e-002 | AP282: 13 | AQ282: 久立转2!!
A283: 103 | B283: 113580 | C283: 康隆转债! | D283: 603665 | E283: 康隆达 | F283: 服装纺织 | G283: 服装行业 | H283: 172.03 | I283: -1.26e-002 | J283: 1.84e-002 | K283: 26.56 | L283: 6.0999999999999995e-003 | M283: 121.2 | N283: 15.51 | O283: 5.0000000000000001e-003 | P283: 171.24 | Q283: 转股中 | R283: 5.40年 | S283: 3.40年 | T283: 0.96 | U283: 25 | V283: 0.151 | W283: 2.4e-002 | X283: 4.0999999999999995e-002 | Y283: 40 | Z283: 4.12 | AA283: -6.3899999999999998e-002 | AB283: -6.9900000000000004e-002 | AC283: -0.128 | AD283: -0.13 | AE283: 82.8 | AF283: 86.01 | AG283: 0.95 | AH283: AA- | AI283: 6.7099999999999993e-002 | AJ283: =H283+100*O283 -> 172.53 | AK283: 172.8 | AL283: 285 | AM283: 86.8 | AN283: 290 | AO283: 6.0000000000000001e-003 | AP283: 9 | AQ283: 康隆转债!
A284: 170 | B284: 123036 | C284: 先导转债! | D284: 300450 | E284: 先导智能 | F284: 机械装备 | G284: 专用设备 | H284: 162.247 | I284: 5.0000000000000001e-003 | J284: -8.9999999999999998e-004 | K284: 63.26 | L284: 4.0999999999999995e-003 | M284: 115.1 | N284: 38.97 | O284: -1.e-003 | P284: 162.33 | Q284: 转股中 | R284: 5年14天 | S284: 3年14天 | T284: 3.33 | U284: 24 | V284: 4.4000000000000004e-002 | W284: 6.0000000000000001e-003 | X284: 1.e-002 | Y284: 568 | Z284: 12.49 | AA284: -6.7000000000000004e-002 | AB284: -7.1800000000000003e-002 | AC284: -0.129 | AD284: -0.13 | AE284: 89.81 | AF284: 92.14 | AG284: 1 | AH284: AA | AI284: 4.6100000000000002e-002 | AJ284: =H284+100*O284 -> 162.14700000000002 | AK284: 162.2 | AL284: 281 | AM284: 70 | AN284: 280 | AO284: -4.0999999999999995e-002 | AP284: 17 | AQ284: 先导转债!
A285: 126 | B285: 128102 | C285: 海大转债! | D285: 2311 | E285: 海大集团 | F285: 农业 | G285: 畜牧业 | H285: 165.919 | I285: 2.98e-002 | J285: -1.2999999999999999e-003 | K285: 57.68 | L285: 2.8500000000000001e-002 | M285: 114.1 | N285: 34.74 | O285: -1.e-003 | P285: 166.03 | Q285: 转股中 | R285: 5.31年 | S285: 4.31年 | T285: 6.72 | U285: 135 | V285: 0.122 | W285: 6.9999999999999993e-003 | X285: 1.2e-002 | Y285: 943 | Z285: 8.01 | AA285: -6.9000000000000006e-002 | AB285: -7.3200000000000001e-002 | AC285: -9.9199999999999997e-002 | AD285: -0.10099999999999999 | AE285: 86.29 | AF285: 91.06 | AG285: 1 | AH285: AA+ | AI285: 4.41e-002 | AJ285: =H285+100*O285 -> 165.81900000000002 | AK285: 165.8 | AL285: 282 | AM285: 74.7 | AN285: 281 | AO285: -3.2000000000000001e-002 | AP285: 12 | AQ285: 海大转债!
A286: 313 | B286: 128010 | C286: 顺昌转债!! | D286: 2245 | E286: 澳洋顺昌 | F286: 交通运输 | G286: 物流业 | H286: 119 | I286: 3.4000000000000002e-003 | J286: -2.7699999999999999e-002 | K286: 10.41 | L286: -3.61e-002 | M286: 109.6 | N286: 9.25 | O286: 5.7000000000000002e-002 | P286: 112.54 | Q286: 转股中 | R286: 1年56天 | S286: 回售中 | T286: 5.09 | U286: 364 | V286: 0.59699999999999998 | W286: 5.0000000000000003e-002 | X286: 5.5999999999999994e-002 | Y286: 102 | Z286: 4.49 | AA286: -6.9699999999999998e-002 | AB286: -8.3800000000000013e-002 | AC286: 回售中 | AD286: 回售中 | AE286: 100.27 | AF286: 104.38 | AG286: 0.67 | AH286: AA | AI286: 4.3799999999999999e-002 | AJ286: =H286+100*O286 -> 124.7 | AK286: 125.5 | AL286: 33 | AM286: 21.1 | AN286: 7 | AO286: 0.29899999999999999 | AP286: 40 | AQ286: 顺昌转债!!
A287: 310 | B287: 113011 | C287: 光大转债 | D287: 601818 | E287: 光大银行 | F287: 金融 | G287: 银行行业 | H287: 127.69 | I287: 8.6999999999999994e-003 | J287: 2.9999999999999997e-004 | K287: 4.5 | L287: 1.1200000000000002e-002 | M287: 108.3 | N287: 3.76 | O287: 6.7000000000000004e-002 | P287: 119.68 | Q287: 转股中 | R287: 2.30年 | S287: 无权 | T287: 242 | U287: 435 | V287: 1.3999999999999999e-002 | W287: 0.10199999999999999 | X287: 0.12300000000000001 | Y287: 2362. | Z287: 0.72 | AA287: -7.0300000000000001e-002 | AB287: -7.6399999999999996e-002 | AC287: 无权 | AD287: 无权 | AE287: 无权 | AF287: 99.39 | AG287: 0.8 | AH287: AAA | AI287: 3.8800000000000001e-002 | AJ287: =H287+100*O287 -> 134.38999999999999 | AK287: 135.7 | AL287: 166 | AM287: 36.3 | AN287: 81 | AO287: 8.6999999999999994e-002 | AP287: 15 | AQ287: 光大转债
A288: 206 | B288: 113537 | C288: 文灿转债!! | D288: 603348 | E288: 文灿股份 | F288: 汽车 | G288: 零部件制 | H288: 169.85 | I288: -1.8100000000000002e-002 | J288: -1.6500000000000001e-002 | K288: 31 | L288: -3.73e-002 | M288: 121.5 | N288: 19.43 | O288: 6.5000000000000002e-002 | P288: 159.55 | Q288: 转股中 | R288: 4.53年 | S288: 2.53年 | T288: 1.95 | U288: 141 | V288: 0.434 | W288: 2.5000000000000001e-002 | X288: 4.0000000000000001e-002 | Y288: 78 | Z288: 3.18 | AA288: -7.2700000000000001e-002 | AB288: -7.9899999999999999e-002 | AC288: -0.115 | AD288: -0.11599999999999999 | AE288: 88.19 | AF288: 91.84 | AG288: 0.93 | AH288: AA- | AI288: 6.54e-002 | AJ288: =H288+100*O288 -> 176.34999999999999 | AK288: 180.2 | AL288: 289 | AM288: 88.3 | AN288: 291 | AO288: -2.e-002 | AP288: 26 | AQ288: 文灿转债!!
A289: 229 | B289: 123022 | C289: 长信转债!! | D289: 300088 | E289: 长信科技 | F289: 通信互联 | G289: 通信设备 | H289: 160 | I289: 5.8999999999999999e-003 | J289: -2.0999999999999999e-003 | K289: 9.82 | L289: 4.0999999999999995e-003 | M289: 114.9 | N289: 6.15 | O289: 2.e-003 | P289: 159.67 | Q289: 转股中 | R289: 4.30年 | S289: 2.30年 | T289: 2.72 | U289: 18 | V289: 4.2000000000000003e-002 | W289: 1.1000000000000001e-002 | X289: 1.8000000000000002e-002 | Y289: 240 | Z289: 3.48 | AA289: -7.5399999999999995e-002 | AB289: -8.0799999999999997e-002 | AC289: -0.11900000000000001 | AD289: -0.12 | AE289: 92.99 | AF289: 95.68 | AG289: 0.93 | AH289: AA | AI289: 4.4400000000000002e-002 | AJ289: =H289+100*O289 -> 160.19999999999999 | AK289: 160.3 | AL289: 279 | AM289: 64.6 | AN289: 268 | AO289: -1.3999999999999999e-002 | AP289: 12 | AQ289: 长信转债!!
A290: 260 | B290: 123014 | C290: 凯发转债! | D290: 300407 | E290: 凯发电气 | F290: 能源电力 | G290: 电力设备 | H290: 134 | I290: -1.3300000000000001e-002 | J290: -7.3000000000000001e-003 | K290: 8.73 | L290: -2.7799999999999998e-002 | M290: 108.5 | N290: 8.12 | O290: 0.24600000000000002 | P290: 107.51 | Q290: 转股中 | R290: 2.66年 | S290: 0.66年 | T290: 1.16 | U290: 42 | V290: 0.26800000000000002 | W290: 4.4000000000000004e-002 | X290: 4.7e-002 | Y290: 27 | Z290: 1.97 | AA290: -7.7100000000000002e-002 | AB290: -8.2400000000000001e-002 | AC290: -0.30099999999999999 | AD290: -0.30299999999999999 | AE290: 95.31 | AF290: 89.54 | AG290: 0.74 | AH290: A+ | AI290: 7.5800000000000006e-002 | AJ290: =H290+100*O290 -> 158.59999999999999 | AK290: 160.5 | AL290: 280 | AM290: 65.2 | AN290: 272 | AO290: -0.10300000000000001 | AP290: 16 | AQ290: 凯发转债!
A291: 318 | B291: 113008 | C291: 电气转债! | D291: 601727 | E291: 上海电气 | F291: 能源电力 | G291: 电力设备 | H291: 108.19 | I291: -3.5999999999999999e-003 | J291: 2.8999999999999998e-003 | K291: 5.32 | L291: -1.9e-003 | M291: 106.6 | N291: 5.13 | O291: 4.2999999999999997e-002 | P291: 103.7 | Q291: 转股中 | R291: 0.18年 | S291: 回售中 | T291: 44.1 | U291: 95 | V291: 2.e-002 | W291: 5.5e-002 | X291: 5.7000000000000002e-002 | Y291: 806 | Z291: 1.24 | AA291: -7.7499999999999999e-002 | AB291: -0.13800000000000001 | AC291: 回售中 | AD291: 回售中 | AE291: 103 | AF291: 105.89 | AG291: 0.37 | AH291: AAA | AI291: 3.73e-002 | AJ291: =H291+100*O291 -> 112.48999999999999 | AK291: 112.7 | AL291: 3 | AM291: 6.8 | AN291: 2 | AO291: 2.9999999999999999e-002 | AP291: 32 | AQ291: 电气转债!
A292: 154 | B292: 128090 | C292: 汽模转2 | D292: 2510 | E292: 天汽模 | F292: 汽车 | G292: 零部件制 | H292: 173.98 | I292: 0.16 | J292: -8.199999999999999e-002 | K292: 5.21 | L292: 9.9199999999999997e-002 | M292: 115.2 | N292: 4.21 | O292: 0.40600000000000003 | P292: 123.75 | Q292: 转股中 | R292: 5年30天 | S292: 3年30天 | T292: 4.67 | U292: 6327. | V292: 7.9400000000000004 | W292: 9.8000000000000004e-002 | X292: 0.121 | Y292: 48 | Z292: 1.8 | AA292: -7.9199999999999993e-002 | AB292: -8.3900000000000002e-002 | AC292: -0.14499999999999999 | AD292: -0.14599999999999999 | AE292: 89.72 | AF292: 92.05 | AG292: 0.79 | AH292: AA | AI292: 4.6100000000000002e-002 | AJ292: =H292+100*O292 -> 214.57999999999998 | AK292: 224.2 | AL292: 302 | AM292: 132.2 | AN292: 303 | AO292: 0.26000000000000001 | AP292: 26 | AQ292: 汽模转2
A293: 314 | B293: 113009 | C293: 广汽转债!! | D293: 601238 | E293: 广汽集团 | F293: 汽车 | G293: 乘用车 | H293: 118.23 | I293: -2.5999999999999999e-003 | J293: 5.4000000000000003e-003 | K293: 13.87 | L293: 7.3000000000000001e-003 | M293: 107.5 | N293: 14.23 | O293: 0.21299999999999999 | P293: 97.47 | Q293: 转股中 | R293: 1年56天 | S293: 回售中 | T293: 25.5 | U293: 66 | V293: 2.2000000000000002e-002 | W293: 1.8000000000000002e-002 | X293: 1.7000000000000001e-002 | Y293: 1420. | Z293: 1.71 | AA293: -8.0100000000000005e-002 | AB293: -9.11e-002 | AC293: 回售中 | AD293: 回售中 | AE293: 100.25 | AF293: 102.94 | AG293: 0.38 | AH293: AAA | AI293: 3.8800000000000001e-002 | AJ293: =H293+100*O293 -> 139.53 | AK293: 139 | AL293: 193 | AM293: 36.1 | AN293: 75 | AO293: 3.2000000000000001e-002 | AP293: 15 | AQ293: 广汽转债!!
A294: 205 | B294: 123027 | C294: 蓝晓转债! | D294: 300487 | E294: 蓝晓科技 | F294: 化工 | G294: 化工 | H294: 173.288 | I294: -6.83e-002 | J294: 1.29e-002 | K294: 46.44 | L294: -5.9000000000000004e-002 | M294: 119.5 | N294: 29.33 | O294: 9.4e-002 | P294: 158.34 | Q294: 转股中 | R294: 4.54年 | S294: 2.54年 | T294: 1.08 | U294: 221 | V294: 1.1499999999999999 | W294: 1.1000000000000001e-002 | X294: 1.7000000000000001e-002 | Y294: 100 | Z294: 6.27 | AA294: -8.0299999999999996e-002 | AB294: -8.6800000000000002e-002 | AC294: -0.11800000000000001 | AD294: -0.12 | AE294: 85.79 | AF294: 86.31 | AG294: 0.94 | AH294: A+ | AI294: 7.6399999999999996e-002 | AJ294: =H294+100*O294 -> 182.68800000000002 | AK294: 188.2 | AL294: 296 | AM294: 101.9 | AN294: 296 | AO294: -1.1000000000000001e-002 | AP294: 21 | AQ294: 蓝晓转债!
A295: 100 | B295: 113582 | C295: 火炬转债 | D295: 603678 | E295: 火炬电子 | F295: 电子 | G295: 元器件制 | H295: 190.36 | I295: 4.6900000000000004e-002 | J295: 1.e-003 | K295: 49.22 | L295: 4.9699999999999994e-002 | M295: 115.3 | N295: 25.33 | O295: -2.e-002 | P295: 194.32 | Q295: 5.1天 | R295: 5.50年 | S295: 3.50年 | T295: 6 | U295: 373 | V295: 0.32500000000000001 | W295: 2.7000000000000003e-002 | X295: 5.2000000000000005e-002 | Y295: 223 | Z295: 6.42 | AA295: -8.8599999999999998e-002 | AB295: -9.2799999999999994e-002 | AC295: -0.14699999999999999 | AD295: -0.14800000000000002 | AE295: 88.15 | AF295: 90.45 | AG295: 0.97 | AH295: AA | AI295: 4.6100000000000002e-002 | AJ295: =H295+100*O295 -> 188.36000000000001 | AK295: 186.4 | AL295: 294 | AM295: 96 | AN295: 294 | AO295: 1.7000000000000001e-002 | AP295: 5 | AQ295: 火炬转债
A296: 198 | B296: 113543 | C296: 欧派转债! | D296: 603833 | E296: 欧派家居 | F296: 其他 | G296: 家居用品 | H296: 184.46 | I296: 4.6999999999999993e-003 | J296: -1.0500000000000001e-002 | K296: 130.47 | L296: -6.0000000000000001e-003 | M296: 114.9 | N296: 71.69 | O296: 1.3999999999999999e-002 | P296: 181.99 | Q296: 转股中 | R296: 4.72年 | S296: 3.72年 | T296: 5.74 | U296: 47 | V296: 4.4999999999999998e-002 | W296: 6.9999999999999993e-003 | X296: 1.3000000000000001e-002 | Y296: 778 | Z296: 7.19 | AA296: -9.69e-002 | AB296: -0.10199999999999999 | AC296: -0.13 | AD296: -0.13200000000000001 | AE296: 89.12 | AF296: 93.98 | AG296: 0.96 | AH296: AA | AI296: 4.4400000000000002e-002 | AJ296: =H296+100*O296 -> 185.86000000000001 | AK296: 186.9 | AL296: 295 | AM296: 92.9 | AN296: 292 | AO296: -4.0000000000000001e-003 | AP296: 14 | AQ296: 欧派转债!
A297: 178 | B297: 123034 | C297: 通光转债! | D297: 300265 | E297: 通光线缆 | F297: 通信互联 | G297: 通信设备 | H297: 196 | I297: -4.0999999999999995e-003 | J297: 3.7400000000000003e-002 | K297: 12.68 | L297: 3.5099999999999999e-002 | M297: 118 | N297: 7.97 | O297: 0.23199999999999998 | P297: 159.1 | Q297: 转股中 | R297: 4.94年 | S297: 2.94年 | T297: 0.78 | U297: 533 | V297: 3.4399999999999999 | W297: 1.7000000000000001e-002 | X297: 2.7000000000000003e-002 | Y297: 46 | Z297: 3.68 | AA297: -9.9100000000000008e-002 | AB297: -0.105 | AC297: -0.11599999999999999 | AD297: -0.11699999999999999 | AE297: 82.54 | AF297: 82.62 | AG297: 0.95 | AH297: A+ | AI297: 7.6399999999999996e-002 | AJ297: =H297+100*O297 -> 219.19999999999999 | AK297: 232.9 | AL297: 304 | AM297: 150.3 | AN297: 304 | AO297: 3.0000000000000001e-003 | AP297: 25 | AQ297: 通光转债!
A298: 303 | B298: 128017 | C298: 金禾转债!! | D298: 2597 | E298: 金禾实业 | F298: 化工 | G298: 化工 | H298: 148.081 | I298: -3.9599999999999996e-002 | J298: -1.1000000000000001e-003 | K298: 31.69 | L298: -4.4600000000000001e-002 | M298: 108.8 | N298: 22.42 | O298: 4.8000000000000001e-002 | P298: 141.35 | Q298: 转股中 | R298: 2.93年 | S298: 0.93年 | T298: 5.52 | U298: 27 | V298: 3.2000000000000001e-002 | W298: 3.1e-002 | X298: 4.4000000000000004e-002 | Y298: 178 | Z298: 3.86 | AA298: -0.10099999999999999 | AB298: -0.106 | AC298: -0.28399999999999997 | AD298: -0.28600000000000003 | AE298: 96.9 | AF298: 96.12 | AG298: 0.91 | AH298: AA | AI298: 4.3799999999999999e-002 | AJ298: =H298+100*O298 -> 152.881 | AK298: 154.8 | AL298: 272 | AM298: 57.9 | AN298: 243 | AO298: -2.5000000000000001e-002 | AP298: 11 | AQ298: 金禾转债!!
A299: 212 | B299: 128065 | C299: 雅化转债!! | D299: 2497 | E299: 雅化集团 | F299: 化工 | G299: 化工 | H299: 176 | I299: -2.92e-002 | J299: 1.06e-002 | K299: 15.8 | L299: -1.8600000000000002e-002 | M299: 110.9 | N299: 8.95 | O299: -3.0000000000000001e-003 | P299: 176.54 | Q299: 转股中 | R299: 4.38年 | S299: 2.38年 | T299: 2.82 | U299: 204 | V299: 0.40799999999999997 | W299: 1.9e-002 | X299: 3.3000000000000002e-002 | Y299: 151 | Z299: 5.22 | AA299: -0.10199999999999999 | AB299: -0.105 | AC299: -0.13300000000000001 | AD299: -0.13500000000000001 | AE299: 92.67 | AF299: 92.05 | AG299: 1 | AH299: AA | AI299: 4.4400000000000002e-002 | AJ299: =H299+100*O299 -> 175.69999999999999 | AK299: 175.5 | AL299: 287 | AM299: 82.8 | AN299: 285 | AO299: 9.4e-002 | AP299: 22 | AQ299: 雅化转债!!
A300: 90 | B300: 113586 | C300: 上机转债 | D300: 603185 | E300: 上机数控 | F300: 机械装备 | G300: 专用设备 | H300: 227.21 | I300: 1.46e-002 | J300: -5.6000000000000008e-003 | K300: 79.83 | L300: 9.1999999999999998e-003 | M300: 120.8 | N300: 33.3 | O300: -5.2000000000000005e-002 | P300: 239.73 | Q300: 18天 | R300: 5.53年 | S300: 3.53年 | T300: 6.65 | U300: 212 | V300: 0.14099999999999999 | W300: 3.6000000000000004e-002 | X300: 8.5999999999999993e-002 | Y300: 186 | Z300: 9.23 | AA300: -0.11 | AB300: -0.115 | AC300: -0.10199999999999999 | AD300: -0.10300000000000001 | AE300: 82.14 | AF300: 85.02 | AG300: 0.98 | AH300: AA- | AI300: 6.7099999999999993e-002 | AJ300: =H300+100*O300 -> 222.01000000000002 | AK300: 214.7 | AL300: 300 | AM300: 129.7 | AN300: 301 | AO300: 3.6000000000000004e-002 | AP300: 7 | AQ300: 上机转债
A301: 79 | B301: 128115 | C301: 巨星转债 | D301: 2444 | E301: 巨星科技 | F301: 机械装备 | G301: 通用设备 | H301: 218 | I301: 3.32e-002 | J301: 8.3000000000000001e-003 | K301: 27.99 | L301: 4.2500000000000003e-002 | M301: 115.3 | N301: 12.28 | O301: -4.4000000000000004e-002 | P301: 227.93 | Q301: 38天 | R301: 5.57年 | S301: 3.57年 | T301: 9.73 | U301: 291 | V301: 0.13800000000000001 | W301: 3.2000000000000001e-002 | X301: 7.400000000000001e-002 | Y301: 301 | Z301: 3.55 | AA301: -0.11 | AB301: -0.114 | AC301: -0.16600000000000001 | AD301: -0.16800000000000001 | AE301: 90.13 | AF301: 90.14 | AG301: 0.98 | AH301: AA | AI301: 4.6100000000000002e-002 | AJ301: =H301+100*O301 -> 213.59999999999999 | AK301: 208.1 | AL301: 299 | AM301: 117.9 | AN301: 298 | AO301: 2.6000000000000002e-002 | AP301: 4 | AQ301: 巨星转债
A302: 99 | B302: 113035 | C302: 福莱转债 | D302: 601865 | E302: 福莱特 | F302: 能源电力 | G302: 太阳能 | H302: 242.66 | I302: 1.3000000000000001e-002 | J302: -1.9599999999999999e-002 | K302: 35.16 | L302: -6.8000000000000005e-003 | M302: 120.3 | N302: 13.48 | O302: -7.0000000000000007e-002 | P302: 260.83 | Q302: 6.1天 | R302: 5.50年 | S302: 3.50年 | T302: 14.5 | U302: 289 | V302: 8.3000000000000004e-002 | W302: 2.1000000000000001e-002 | X302: 5.5e-002 | Y302: 687 | Z302: 12.91 | AA302: -0.122 | AB302: -0.127 | AC302: -0.11 | AD302: -0.111 | AE302: 88.15 | AF302: 94.35 | AG302: 0.98 | AH302: AA | AI302: 4.6100000000000002e-002 | AJ302: =H302+100*O302 -> 235.66 | AK302: 224.5 | AL302: 303 | AM302: 130.1 | AN302: 302 | AO302: -7.0000000000000007e-002 | AP302: 8 | AQ302: 福莱转债
A303: 288 | B303: 128030 | C303: 天康转债!! | D303: 2100 | E303: 天康生物 | F303: 农业 | G303: 畜牧业 | H303: 174.8 | I303: 2.4e-002 | J303: 0. | K303: 13.22 | L303: 2.4e-002 | M303: 112.3 | N303: 7.85 | O303: 3.7999999999999999e-002 | P303: 168.41 | Q303: 转股中 | R303: 3年25天 | S303: 1年25天 | T303: 0.98 | U303: 340 | V303: 1.9399999999999999 | W303: 6.9999999999999993e-003 | X303: 1.2e-002 | Y303: 142 | Z303: 2.38 | AA303: -0.13699999999999998 | AB303: -0.14300000000000002 | AC303: -0.32700000000000001 | AD303: -0.32899999999999996 | AE303: 97.49 | AF303: 98.6 | AG303: 1 | AH303: AA | AI303: 4.4400000000000002e-002 | AJ303: =H303+100*O303 -> 178.60000000000002 | AK303: 181.2 | AL303: 291 | AM303: 82.6 | AN303: 284 | AO303: -1.3999999999999999e-002 | AP303: 11 | AQ303: 天康转债!!
A304: 192 | B304: 123031 | C304: 晶瑞转债! | D304: 300655 | E304: 晶瑞股份 | F304: 化工 | G304: 化工 | H304: 246.68 | I304: -2.e-002 | J304: 3.7000000000000002e-003 | K304: 38.3 | L304: -1.67e-002 | M304: 115.8 | N304: 18.43 | O304: 0.187 | P304: 207.81 | Q304: 转股中 | R304: 4.75年 | S304: 2.75年 | T304: 0.63 | U304: 217 | V304: 1.3899999999999999 | W304: 9.0000000000000011e-003 | X304: 1.8000000000000002e-002 | Y304: 72 | Z304: 5.63 | AA304: -0.14899999999999999 | AB304: -0.154 | AC304: -0.158 | AD304: -0.158 | AE304: 83.47 | AF304: 82.15 | AG304: 0.98 | AH304: A+ | AI304: 7.6399999999999996e-002 | AJ304: =H304+100*O304 -> 265.38 | AK304: 285.5 | AL304: 308 | AM304: 202.1 | AN304: 308 | AO304: -1.2e-002 | AP304: 15 | AQ304: 晶瑞转债!
A305: 101 | B305: 113581 | C305: 龙蟠转债! | D305: 603906 | E305: 龙蟠科技 | F305: 化工 | G305: 化工 | H305: 308.18 | I305: 6.3e-003 | J305: -1.0800000000000001e-002 | K305: 28.93 | L305: -4.5000000000000005e-003 | M305: 129.6 | N305: 9.48 | O305: 1.e-002 | P305: 305.17 | Q305: 转股中 | R305: 5.40年 | S305: 3.40年 | T305: 0.23 | U305: 367 | V305: 5.1399999999999997 | W305: 2.e-003 | X305: 6.9999999999999993e-003 | Y305: 97 | Z305: 5.97 | AA305: -0.151 | AB305: -0.158 | AC305: -0.13300000000000001 | AD305: -0.13400000000000001 | AE305: 81.92 | AF305: 87.46 | AG305: 1 | AH305: A+ | AI305: 7.8100000000000003e-002 | AJ305: =H305+100*O305 -> 309.18000000000001 | AK305: 311.2 | AL305: 310 | AM305: 223.7 | AN305: 310 | AO305: 0.13 | AP305: 14 | AQ305: 龙蟠转债!
A306: 290 | B306: 128028 | C306: 赣锋转债!! | D306: 2460 | E306: 赣锋锂业 | F306: 有色金属 | G306: 小金属 | H306: 183 | I306: -4.2099999999999999e-002 | J306: 1.0800000000000001e-002 | K306: 77.25 | L306: -3.1300000000000001e-002 | M306: 109.3 | N306: 41.68 | O306: -1.3000000000000001e-002 | P306: 185.34 | Q306: 转股中 | R306: 3年24天 | S306: 1年24天 | T306: 8.22 | U306: 433 | V306: 0.28600000000000003 | W306: 8.0000000000000002e-003 | X306: 1.4999999999999999e-002 | Y306: 1030. | Z306: 11.09 | AA306: -0.157 | AB306: -0.161 | AC306: -0.35200000000000004 | AD306: -0.35299999999999998 | AE306: 96.78 | AF306: 95.91 | AG306: 1 | AH306: AA | AI306: 4.4400000000000002e-002 | AJ306: =H306+100*O306 -> 181.69999999999999 | AK306: 180.7 | AL306: 290 | AM306: 83.9 | AN306: 287 | AO306: 4.9000000000000002e-002 | AP306: 14 | AQ306: 赣锋转债!!
A307: 243 | B307: 123018 | C307: 溢利转债! | D307: 300381 | E307: 溢多利 | F307: 医药 | G307: 原料药 | H307: 235.5 | I307: 2.0999999999999999e-003 | J307: -1.72e-002 | K307: 12.85 | L307: -1.61e-002 | M307: 114.9 | N307: 8.32 | O307: 0.52500000000000002 | P307: 154.45 | Q307: 转股中 | R307: 4年23天 | S307: 2年23天 | T307: 0.54 | U307: 21 | V307: 0.16200000000000001 | W307: 9.0000000000000011e-003 | X307: 1.3000000000000001e-002 | Y307: 63 | Z307: 2.17 | AA307: -0.16399999999999998 | AB307: -0.16899999999999998 | AC307: -0.21899999999999997 | AD307: -0.22 | AE307: 89.94 | AF307: 89.35 | AG307: 0.94 | AH307: AA- | AI307: 6.54e-002 | AJ307: =H307+100*O307 -> 288. | AK307: 316.6 | AL307: 311 | AM307: 226.6 | AN307: 312 | AO307: -1.9e-002 | AP307: 13 | AQ307: 溢利转债!
A308: 265 | B308: 128041 | C308: 盛路转债!! | D308: 2446 | E308: 盛路通信 | F308: 通信互联 | G308: 通信设备 | H308: 219.8 | I308: -3.5099999999999999e-002 | J308: 1.6299999999999999e-002 | K308: 7.68 | L308: -1.9199999999999998e-002 | M308: 114.3 | N308: 6.82 | O308: 0.95200000000000007 | P308: 112.61 | Q308: 转股中 | R308: 3.64年 | S308: 1.64年 | T308: 0.53 | U308: 136 | V308: 1.1499999999999999 | W308: 8.0000000000000002e-003 | X308: 9.0000000000000011e-003 | Y308: 70 | Z308: 2.31 | AA308: -0.16699999999999998 | AB308: -0.17199999999999999 | AC308: -0.27100000000000002 | AD308: -0.27200000000000002 | AE308: 95.12 | AF308: 97.89 | AG308: 0.99 | AH308: AA | AI308: 4.4400000000000002e-002 | AJ308: =H308+100*O308 -> 315. | AK308: 327 | AL308: 313 | AM308: 229.1 | AN308: 313 | AO308: -1.e-003 | AP308: 12 | AQ308: 盛路转债!!
A309: 307 | B309: 127004 | C309: 模塑转债!! | D309: 700 | E309: 模塑科技 | F309: 汽车 | G309: 零部件制 | H309: 180.53 | I309: -0.128 | J309: 0.122 | K309: 6.79 | L309: -1.4499999999999999e-002 | M309: 113.3 | N309: 7.46 | O309: 0.98299999999999998 | P309: 91.02 | Q309: 转股中 | R309: 2.51年 | S309: 0.51年 | T309: 1.33 | U309: 1854. | V309: 7.0700000000000003 | W309: 2.1000000000000001e-002 | X309: 1.9e-002 | Y309: 62 | Z309: 2.4 | AA309: -0.17199999999999999 | AB309: -0.17899999999999999 | AC309: -0.66500000000000004 | AD309: -0.66799999999999993 | AE309: 98.89 | AF309: 101.92 | AG309: 0.42 | AH309: AA | AI309: 4.3799999999999999e-002 | AJ309: =H309+100*O309 -> 278.82999999999998 | AK309: 270 | AL309: 307 | AM309: 168.1 | AN309: 307 | AO309: 0.10199999999999999 | AP309: 37 | AQ309: 模塑转债!!
A310: 254 | B310: 113520 | C310: 百合转债! | D310: 603313 | E310: 梦百合 | F310: 其他 | G310: 家居用品 | H310: 240.95 | I310: -4.7999999999999996e-003 | J310: 5.6000000000000008e-003 | K310: 33.15 | L310: 8.9999999999999998e-004 | M310: 114.5 | N310: 14.28 | O310: 3.7999999999999999e-002 | P310: 232.14 | Q310: 转股中 | R310: 3.95年 | S310: 1.95年 | T310: 0.55 | U310: 52 | V310: 0.39200000000000002 | W310: 5.0000000000000001e-003 | X310: 1.1000000000000001e-002 | Y310: 115 | Z310: 4.1 | AA310: -0.17399999999999999 | AB310: -0.17899999999999999 | AC310: -0.23899999999999999 | AD310: -0.23999999999999999 | AE310: 90.02 | AF310: 89.57 | AG310: 0.98 | AH310: AA- | AI310: 6.54e-002 | AJ310: =H310+100*O310 -> 244.75 | AK310: 249.8 | AL310: 306 | AM310: 159.7 | AN310: 305 | AO310: -5.9000000000000004e-002 | AP310: 12 | AQ310: 百合转债!
A311: 272 | B311: 113509 | C311: 新泉转债!! | D311: 603179 | E311: 新泉股份 | F311: 汽车 | G311: 零部件制 | H311: 221.15 | I311: 2.4799999999999999e-002 | J311: 8.8999999999999999e-003 | K311: 31.22 | L311: 3.4500000000000003e-002 | M311: 110.3 | N311: 14.22 | O311: 6.9999999999999993e-003 | P311: 219.55 | Q311: 转股中 | R311: 3.52年 | S311: 1.52年 | T311: 1.21 | U311: 409 | V311: 1.5 | W311: 1.2e-002 | X311: 2.7000000000000003e-002 | Y311: 99 | Z311: 4.68 | AA311: -0.182 | AB311: -0.18600000000000003 | AC311: -0.29600000000000004 | AD311: -0.29699999999999999 | AE311: 95.6 | AF311: 94.96 | AG311: 0.98 | AH311: AA | AI311: 4.4400000000000002e-002 | AJ311: =H311+100*O311 -> 221.84999999999999 | AK311: 222.8 | AL311: 301 | AM311: 127.1 | AN311: 300 | AO311: 4.0000000000000001e-003 | AP311: 10 | AQ311: 新泉转债!!
A312: 242 | B312: 128052 | C312: 凯龙转债! | D312: 2783 | E312: 凯龙股份 | F312: 化工 | G312: 化工 | H312: 261.88 | I312: -3.5400000000000001e-002 | J312: 3.1e-002 | K312: 13.42 | L312: -4.5000000000000005e-003 | M312: 115 | N312: 6.67 | O312: 0.30199999999999999 | P312: 201.2 | Q312: 转股中 | R312: 4年24天 | S312: 2年24天 | T312: 0.32 | U312: 75 | V312: 0.89200000000000002 | W312: 6.0000000000000001e-003 | X312: 1.3000000000000001e-002 | Y312: 51 | Z312: 2.94 | AA312: -0.18600000000000003 | AB312: -0.191 | AC312: -0.23600000000000002 | AD312: -0.23699999999999999 | AE312: 94.05 | AF312: 96.78 | AG312: 1 | AH312: AA | AI312: 4.4400000000000002e-002 | AJ312: =H312+100*O312 -> 292.07999999999998 | AK312: 322.6 | AL312: 312 | AM312: 225.8 | AN312: 311 | AO312: 1.7000000000000001e-002 | AP312: 12 | AQ312: 凯龙转债!
A313: 258 | B313: 123015 | C313: 蓝盾转债!! | D313: 300297 | E313: 蓝盾股份 | F313: 计算机及 | G313: 软件开发 | H313: 247.8 | I313: -3.2000000000000001e-002 | J313: 7.9000000000000008e-003 | K313: 6.22 | L313: -2.6600000000000002e-002 | M313: 112.3 | N313: 5.79 | O313: 1.3100000000000001 | P313: 107.43 | Q313: 转股中 | R313: 3.71年 | S313: 1.71年 | T313: 1 | U313: 319 | V313: 1.26 | W313: 1.3000000000000001e-002 | X313: 1.3999999999999999e-002 | Y313: 78 | Z313: 2.02 | AA313: -0.19500000000000001 | AB313: -0.19899999999999998 | AC313: -0.28399999999999997 | AD313: -0.28499999999999998 | AE313: 91.36 | AF313: 89.18 | AG313: 0.9 | AH313: AA- | AI313: 6.54e-002 | AJ313: =H313+100*O313 -> 378.80000000000001 | AK313: 388.2 | AL313: 314 | AM313: 296.8 | AN313: 315 | AO313: -6.2e-002 | AP313: 18 | AQ313: 蓝盾转债!!
A314: 269 | B314: 110044 | C314: 广电转债!! | D314: 600831 | E314: 广电网络 | F314: 传媒娱乐 | G314: 影视娱乐 | H314: 249.32 | I314: -2.2700000000000001e-002 | J314: 3.7100000000000001e-002 | K314: 7.39 | L314: 2.2099999999999998e-002 | M314: 112.3 | N314: 6.9 | O314: 1.3300000000000001 | P314: 107.1 | Q314: 转股中 | R314: 3.58年 | S314: 1.58年 | T314: 0.71 | U314: 672 | V314: 3.6600000000000001 | W314: 1.3999999999999999e-002 | X314: 1.3999999999999999e-002 | Y314: 53 | Z314: 1.42 | AA314: -0.20199999999999999 | AB314: -0.20699999999999999 | AC314: -0.311 | AD314: -0.312 | AE314: 95.34 | AF314: 96.41 | AG314: 0.65 | AH314: AA | AI314: 4.4400000000000002e-002 | AJ314: =H314+100*O314 -> 382.31999999999999 | AK314: 391.5 | AL314: 315 | AM314: 295.1 | AN314: 314 | AO314: 3.6000000000000004e-002 | AP314: 10 | AQ314: 广电转债!!
A315: 162 | B315: 113555 | C315: 振德转债! | D315: 603301 | E315: 振德医疗 | F315: 医药 | G315: 医疗器械 | H315: 399.57 | I315: -8.0000000000000002e-003 | J315: -2.e-003 | K315: 56.13 | L315: -1.01e-002 | M315: 124.8 | N315: 14.01 | O315: -3.0000000000000001e-003 | P315: 400.64 | Q315: 转股中 | R315: 5年22天 | S315: 3年22天 | T315: 0.44 | U315: 42 | V315: 0.24100000000000002 | W315: 4.0000000000000001e-003 | X315: 1.4999999999999999e-002 | Y315: 121 | Z315: 3.39 | AA315: -0.20899999999999999 | AB315: -0.214 | AC315: -0.17600000000000002 | AD315: -0.17600000000000002 | AE315: 85.2 | AF315: 90.62 | AG315: 1 | AH315: AA- | AI315: 6.7099999999999993e-002 | AJ315: =H315+100*O315 -> 399.26999999999998 | AK315: 398.5 | AL315: 316 | AM315: 307.9 | AN315: 316 | AO315: -0.127 | AP315: 15 | AQ315: 振德转债!
A316: 289 | B316: 128029 | C316: 太阳转债!! | D316: 2078 | E316: 太阳纸业 | F316: 造纸包装 | G316: 造纸行业 | H316: 179.62 | I316: 1.55e-002 | J316: -1.4800000000000001e-002 | K316: 14.97 | L316: 7.000000000000001e-004 | M316: 107.8 | N316: 8.55 | O316: 2.6000000000000002e-002 | P316: 175.09 | Q316: 转股中 | R316: 2年25天 | S316: 25天 | T316: 9.51 | U316: 34 | V316: 2.e-002 | W316: 2.4e-002 | X316: 4.2999999999999997e-002 | Y316: 390 | Z316: 2.53 | AA316: -0.221 | AB316: -0.22600000000000001 | AC316: -2.0129999999999999 | AD316: -2.0169999999999999 | AE316: 100 | AF316: 99.15 | AG316: 1 | AH316: AA+ | AI316: 4.1799999999999997e-002 | AJ316: =H316+100*O316 -> 182.22 | AK316: 184.2 | AL316: 293 | AM316: 84.1 | AN316: 288 | AO316: 2.e-003 | AP316: 8 | AQ316: 太阳转债!!
A317: 252 | B317: 127008 | C317: 特发转债! | D317: 70 | E317: 特发信息 | F317: 通信互联 | G317: 通信设备 | H317: 245.9 | I317: -2.5399999999999999e-002 | J317: 1.4199999999999999e-002 | K317: 10.55 | L317: -1.1200000000000002e-002 | M317: 110.5 | N317: 5.54 | O317: 0.29100000000000004 | P317: 190.43 | Q317: 转股中 | R317: 2.97年 | S317: 0.97年 | T317: 0.59 | U317: 141 | V317: 0.95999999999999996 | W317: 6.9999999999999993e-003 | X317: 1.3000000000000001e-002 | Y317: 86 | Z317: 3.04 | AA317: -0.23800000000000002 | AB317: -0.24299999999999999 | AC317: -0.51100000000000001 | AD317: -0.51100000000000001 | AE317: 96.44 | AF317: 97.43 | AG317: 1 | AH317: AA | AI317: 4.3799999999999999e-002 | AJ317: =H317+100*O317 -> 275. | AK317: 301.4 | AL317: 309 | AM317: 203.9 | AN317: 309 | AO317: 2.9999999999999999e-002 | AP317: 15 | AQ317: 特发转债!
A318: 262 | B318: 123013 | C318: 横河转债! | D318: 300539 | E318: 横河模具 | F318: 机械装备 | G318: 专用设备 | H318: 341 | I318: -2.4300000000000002e-002 | J318: 2.86e-002 | K318: 8.83 | L318: 6.8000000000000005e-003 | M318: 115.2 | N318: 9.13 | O318: 2.5299999999999998 | P318: 96.71 | Q318: 转股中 | R318: 3.66年 | S318: 1.66年 | T318: 0.38 | U318: 110 | V318: 0.83999999999999997 | W318: 1.9e-002 | X318: 1.9e-002 | Y318: 20 | Z318: 4.05 | AA318: -0.26000000000000001 | AB318: -0.26500000000000001 | AC318: -0.34999999999999998 | AD318: -0.34999999999999998 | AE318: 90.47 | AF318: 88.54 | AG318: 0.63 | AH318: A+ | AI318: 7.6399999999999996e-002 | AJ318: =H318+100*O318 -> 594. | AK318: 585.3 | AL318: 317 | AM318: 494.8 | AN318: 317 | AO318: -0.10300000000000001 | AP318: 16 | AQ318: 横河转债!
A319: 196 | B319: 123029 | C319: 英科转债! | D319: 300677 | E319: 英科医疗 | F319: 医药 | G319: 医疗器械 | H319: 1253.35 | I319: 2.8000000000000004e-003 | J319: 2.9999999999999997e-004 | K319: 128.7 | L319: 3.0999999999999999e-003 | M319: 138.2 | N319: 10.41 | O319: 1.3999999999999999e-002 | P319: 1236.31 | Q319: 转股中 | R319: 4.72年 | S319: 2.72年 | T319: 1.27 | U319: 539 | V319: 0.33700000000000002 | W319: 3.0000000000000001e-003 | X319: 3.7000000000000005e-002 | Y319: 429 | Z319: 4.74 | AA319: -0.379 | AB319: -0.38600000000000001 | AC319: -0.25700000000000001 | AD319: -0.25700000000000001 | AE319: 89.66 | AF319: 103.55 | AG319: 0.99 | AH319: AA- | AI319: 6.54e-002 | AJ319: =H319+100*O319 -> 1254.75 | AK319: 1270.4000000000001 | AL319: 318 | AM319: 1166.8 | AN319: 318 | AO319: 8.3000000000000004e-002 | AP319: 16 | AQ319: 英科转债!