A1: 序号 | B1: 转债代码 | C1: 转债名称 | D1: 股票代码 | E1: 股票名称 | F1: 行业 | G1: 子行业 | H1: 转债价格 | I1: 涨跌 | J1: 日内套利 | K1: 股价 | L1: 涨跌 | M1: 剩余本息 | N1: 转股价格 | O1: 转股溢价率 | P1: 转股价值 | Q1: 距离转股日 | R1: 剩余年限 | S1: 回售年限 | T1: 转债余额 | U1: 转债成交额 | V1: 转债换手率 | W1: 余额/市值 | X1: 余额/股本 | Y1: 股票市值 | Z1: P/B | AA1: 税前收益率 | AB1: 税后收益率 | AC1: 税前回售收益 | AD1: 税后回售收益 | AE1: 回售价值 | AF1: 纯债价值 | AG1: 弹性 | AH1: 信用 | AI1: 折现率 | AJ1: 双低 | AK1: 老式双低 | AL1: 老式排名 | AM1: 新式双低 | AN1: 新式排名 | AO1: MA20乖离 | AP1: 热门度 | AQ1: 转债名称
A2: 259 | B2: 128062 | C2: 亚药转债! | D2: 2370 | E2: 亚太药业 | F2: 医药 | G2: 化学制药 | H2: 76.158 | I2: 1.2699999999999999e-002 | J2: -1.2699999999999999e-002 | K2: 4.07 | L2: 4.9000000000000002e-002 | M2: 119.3 | N2: 16.25 | O2: 2.04 | P2: 25.05 | Q2: 转股中 | R2: 3.96年 | S2: 1.96年 | T2: 9.63 | U2: 25 | V2: 3.4000000000000002e-002 | W2: 0.441 | X2: 0.11 | Y2: 22 | Z2: 4.79 | AA2: 0.122 | AB2: 0.113 | AC2: 0.152 | AD2: 0.14899999999999999 | AE2: 83.27 | AF2: 80.97 | AG2: 0 | AH2: BBB | AI2: 0.1048 | AJ2: =H2+100*O2 -> 280.15800000000002 | AK2: 127.3 | AL2: 180 | AM2: 44 | AN2: 248 | AO2: 5.0000000000000003e-002 | AP2: 85 | AQ2: 亚药转债!
A3: 278 | B3: 113527 | C3: 维格转债! | D3: 603518 | E3: 锦泓集团 | F3: 服装纺织 | G3: 服装行业 | H3: 88.16 | I3: 1.37e-002 | J3: -8.6999999999999994e-003 | K3: 5.97 | L3: 4.3700000000000003e-002 | M3: 119.5 | N3: 9.85 | O3: 0.45500000000000002 | P3: 60.61 | Q3: 转股中 | R3: 3.78年 | S3: 1.78年 | T3: 7.46 | U3: 13 | V3: 2.e-002 | W3: 0.495 | X3: 0.29999999999999999 | Y3: 15 | Z3: 0.95 | AA3: 8.5600000000000009e-002 | AB3: 7.5600000000000001e-002 | AC3: 8.3100000000000007e-002 | AD3: 7.9899999999999999e-002 | AE3: 93.12 | AF3: 98.75 | AG3: 0.11 | AH3: AA | AI3: 5.28e-002 | AJ3: =H3+100*O3 -> 133.66 | AK3: 115.7 | AL3: 62 | AM3: 17 | AN3: 16 | AO3: 6.9000000000000006e-002 | AP3: 100 | AQ3: 维格转债!
A4: 177 | B4: 128100 | C4: 搜特转债! | D4: 2503 | E4: 搜于特 | F4: 服装纺织 | G4: 服装行业 | H4: 84.122 | I4: 1.23e-002 | J4: -5.0000000000000001e-003 | K4: 1.84 | L4: 4.5499999999999999e-002 | M4: 116.9 | N4: 2.9 | O4: 0.32600000000000001 | P4: 63.45 | Q4: 转股中 | R4: 4.90年 | S4: 2.90年 | T4: 7.99 | U4: 57 | V4: 8.5000000000000006e-002 | W4: 0.14000000000000001 | X4: 8.900000000000001e-002 | Y4: 57 | Z4: 1.03 | AA4: 7.0800000000000002e-002 | AB4: 6.4100000000000004e-002 | AC4: 7.0099999999999996e-002 | AD4: 6.7699999999999996e-002 | AE4: 91.01 | AF4: 95.55 | AG4: 0.16 | AH4: AA | AI4: 4.2800000000000005e-002 | AJ4: =H4+100*O4 -> 116.72200000000001 | AK4: 104.8 | AL4: 7 | AM4: 9.2 | AN4: 3 | AO4: -7.2999999999999995e-002 | AP4: 58 | AQ4: 搜特转债!
A5: 118 | B5: 113595 | C5: 花王转债! | D5: 603007 | E5: 花王股份 | F5: 城市公用 | G5: 生态环境 | H5: 90.3 | I5: 1.1000000000000001e-002 | J5: -1.e-003 | K5: 4.89 | L5: 2.9500000000000002e-002 | M5: 125.3 | N5: 6.93 | O5: 0.28000000000000003 | P5: 70.56 | Q5: 转股中 | R5: 5.26年 | S5: 3.26年 | T5: 3.3 | U5: 7.3 | V5: 2.4e-002 | W5: 0.20100000000000001 | X5: 0.14199999999999999 | Y5: 16 | Z5: 1.48 | AA5: 6.5799999999999997e-002 | AB5: 5.7099999999999998e-002 | AC5: 4.3299999999999998e-002 | AD5: 4.07e-002 | AE5: 84.14 | AF5: 90.53 | AG5: 0.34 | AH5: AA- | AI5: 6.5299999999999997e-002 | AJ5: =H5+100*O5 -> 118.3 | AK5: 110 | AL5: 28 | AM5: 19.5 | AN5: 34 | AO5: -4.4999999999999998e-002 | AP5: 39 | AQ5: 花王转债!
A6: 257 | B6: 128063 | C6: 未来转债! | D6: 2631 | E6: 德尔未来 | F6: 其他 | G6: 家居用品 | H6: 101.2 | I6: 2.8999999999999998e-003 | J6: -5.0000000000000001e-004 | K6: 6.01 | L6: 1.18e-002 | M6: 127.5 | N6: 8.63 | O6: 0.45299999999999996 | P6: 69.64 | Q6: 转股中 | R6: 3.96年 | S6: 2.96年 | T6: 6.3 | U6: 1 | V6: 2.e-003 | W6: 0.157 | X6: 0.11 | Y6: 40 | Z6: 2.28 | AA6: 6.1699999999999998e-002 | AB6: 4.9400000000000006e-002 | AC6: 2.2000000000000002e-002 | AD6: 1.6799999999999999e-002 | AE6: 89.48 | AF6: 100.45 | AG6: 0.2 | AH6: AA- | AI6: 6.3799999999999996e-002 | AJ6: =H6+100*O6 -> 146.5 | AK6: 132.8 | AL6: 231 | AM6: 32.3 | AN6: 159 | AO6: 1.7000000000000001e-002 | AP6: 32 | AQ6: 未来转债!
A7: 135 | B7: 127018 | C7: 本钢转债! | D7: 761 | E7: 本钢板材 | F7: 钢铁 | G7: 炼钢 | H7: 96.24 | I7: 1.7299999999999999e-002 | J7: -1.54e-002 | K7: 4.46 | L7: 4.5000000000000005e-003 | M7: 128.6 | N7: 5.03 | O7: 8.5000000000000006e-002 | P7: 88.67 | Q7: 转股中 | R7: 5.20年 | S7: 3.20年 | T7: 68 | U7: 666 | V7: 0.10199999999999999 | W7: 0.39299999999999996 | X7: 0.34899999999999998 | Y7: 173 | Z7: 0.87 | AA7: 5.9299999999999999e-002 | AB7: 4.9500000000000002e-002 | AC7: 3.0899999999999997e-002 | AD7: 2.7000000000000003e-002 | AE7: 90.75 | AF7: 100.93 | AG7: 0.43 | AH7: AAA | AI7: 4.9299999999999997e-002 | AJ7: =H7+100*O7 -> 104.73999999999999 | AK7: 103.8 | AL7: 5 | AM7: 2.9 | AN7: 1 | AO7: 0.248 | AP7: 57 | AQ7: 本钢转债!
A8: 291 | B8: 128044 | C8: 岭南转债! | D8: 2717 | E8: 岭南股份 | F8: 城市公用 | G8: 生态环境 | H8: 92.49 | I8: 4.4000000000000003e-003 | J8: -4.0999999999999995e-003 | K8: 3.08 | L8: 1.32e-002 | M8: 111.3 | N8: 5.91 | O8: 0.77500000000000002 | P8: 52.12 | Q8: 转股中 | R8: 3.33年 | S8: 1.33年 | T8: 6.59 | U8: 5.9 | V8: 1.e-002 | W8: 0.14000000000000001 | X8: 7.2999999999999995e-002 | Y8: 47 | Z8: 0.96 | AA8: 5.8499999999999996e-002 | AB8: 5.1699999999999996e-002 | AC8: 7.400000000000001e-002 | AD8: 6.9900000000000004e-002 | AE8: 96.61 | AF8: 97.1 | AG8: 0.03 | AH8: AA | AI8: 4.2800000000000005e-002 | AJ8: =H8+100*O8 -> 169.99000000000001 | AK8: 132.9 | AL8: 232 | AM8: 35.8 | AN8: 189 | AO8: -3.3000000000000002e-002 | AP8: 42 | AQ8: 岭南转债!
A9: 298 | B9: 123011 | C9: 德尔转债! | D9: 300473 | E9: 德尔股份 | F9: 汽车 | G9: 零部件制 | H9: 97.098 | I9: 2.0999999999999999e-003 | J9: -1.1000000000000001e-003 | K9: 18.37 | L9: 1.6e-002 | M9: 116.3 | N9: 34.54 | O9: 0.82599999999999996 | P9: 53.18 | Q9: 转股中 | R9: 3.25年 | S9: 1.26年 | T9: 2.51 | U9: 1.1 | V9: 5.0000000000000001e-003 | W9: 0.12 | X9: 6.4000000000000001e-002 | Y9: 21 | Z9: 0.93 | AA9: 5.8299999999999998e-002 | AB9: 4.87e-002 | AC9: 4.1399999999999999e-002 | AD9: 3.73e-002 | AE9: 94.23 | AF9: 95.52 | AG9: 0.06 | AH9: AA- | AI9: 6.3799999999999996e-002 | AJ9: =H9+100*O9 -> 179.69799999999998 | AK9: 141 | AL9: 279 | AM9: 45.5 | AN9: 256 | AO9: 4.0999999999999995e-002 | AP9: 41 | AQ9: 德尔转债!
A10: 243 | B10: 123028 | C10: 清水转债! | D10: 300437 | E10: 清水源 | F10: 城市公用 | G10: 三废处理 | H10: 97.202 | I10: 1.04e-002 | J10: -1.29e-002 | K10: 9.67 | L10: -6.1999999999999998e-003 | M10: 121.8 | N10: 11.84 | O10: 0.19 | P10: 81.67 | Q10: 转股中 | R10: 4.17年 | S10: 2.18年 | T10: 4.55 | U10: 198 | V10: 0.44500000000000001 | W10: 0.21299999999999999 | X10: 0.17399999999999999 | Y10: 21 | Z10: 1.37 | AA10: 5.7300000000000004e-002 | AB10: 4.7500000000000001e-002 | AC10: 3.2799999999999996e-002 | AD10: 2.87e-002 | AE10: 90.81 | AF10: 94.82 | AG10: 0.4 | AH10: AA- | AI10: 6.3799999999999996e-002 | AJ10: =H10+100*O10 -> 116.202 | AK10: 112.7 | AL10: 41 | AM10: 17.9 | AN10: 21 | AO10: 0.154 | AP10: 51 | AQ10: 清水转债!
A11: 136 | B11: 113589 | C11: 天创转债! | D11: 603608 | E11: 天创时尚 | F11: 服装纺织 | G11: 鞋服行业 | H11: 87.61 | I11: 9.1999999999999998e-003 | J11: -8.3000000000000001e-003 | K11: 6.3 | L11: 1.29e-002 | M11: 115.3 | N11: 12.44 | O11: 0.72999999999999998 | P11: 50.64 | Q11: 转股中 | R11: 5.19年 | S11: 3.19年 | T11: 6 | U11: 7.3 | V11: 1.3999999999999999e-002 | W11: 0.222 | X11: 0.11199999999999999 | Y11: 27 | Z11: 1.27 | AA11: 5.5599999999999997e-002 | AB11: 4.9800000000000004e-002 | AC11: 5.2499999999999998e-002 | AD11: 5.0000000000000003e-002 | AE11: 89.9 | AF11: 92.53 | AG11: 0.07 | AH11: AA | AI11: 4.4299999999999999e-002 | AJ11: =H11+100*O11 -> 160.61000000000001 | AK11: 124.6 | AL11: 153 | AM11: 32.1 | AN11: 157 | AO11: 2.1000000000000001e-002 | AP11: 25 | AQ11: 天创转债!
A12: 125 | B12: 127019 | C12: 国城转债! | D12: 688 | E12: 国城矿业 | F12: 有色金属 | G12: 锌铅镍锡 | H12: 87.632 | I12: 9.5999999999999992e-003 | J12: -9.3999999999999986e-003 | K12: 9.1 | L12: 5.5000000000000005e-003 | M12: 115.1 | N12: 21.07 | O12: 1.03 | P12: 43.19 | Q12: 转股中 | R12: 5.24年 | S12: 3.25年 | T12: 8.5 | U12: 8.5 | V12: 1.1000000000000001e-002 | W12: 8.199999999999999e-002 | X12: 3.5000000000000003e-002 | Y12: 103 | Z12: 4.68 | AA12: 5.45e-002 | AB12: 4.8799999999999996e-002 | AC12: 5.0799999999999998e-002 | AD12: 4.8499999999999995e-002 | AE12: 89.48 | AF12: 92.1 | AG12: 0.03 | AH12: AA | AI12: 4.4299999999999999e-002 | AJ12: =H12+100*O12 -> 190.63200000000001 | AK12: 132.1 | AL12: 224 | AM12: 40 | AN12: 223 | AO12: -1.1000000000000001e-002 | AP12: 39 | AQ12: 国城转债!
A13: 182 | B13: 113569 | C13: 科达转债! | D13: 603660 | E13: 苏州科达 | F13: 通信互联 | G13: 物联网 | H13: 93.53 | I13: 1.6000000000000001e-003 | J13: -4.4000000000000003e-003 | K13: 7.57 | L13: -2.7000000000000003e-002 | M13: 120.3 | N13: 14.84 | O13: 0.83400000000000007 | P13: 51.01 | Q13: 转股中 | R13: 4.89年 | S13: 2.90年 | T13: 5.16 | U13: 3.6 | V13: 6.9999999999999993e-003 | W13: 0.13699999999999998 | X13: 7.0000000000000007e-002 | Y13: 38 | Z13: 2.02 | AA13: 5.3899999999999997e-002 | AB13: 4.6199999999999998e-002 | AC13: 3.44e-002 | AD13: 3.1899999999999998e-002 | AE13: 85.91 | AF13: 89.43 | AG13: 0.1 | AH13: AA- | AI13: 6.3799999999999996e-002 | AJ13: =H13+100*O13 -> 176.93000000000001 | AK13: 136 | AL13: 256 | AM13: 46.6 | AN13: 265 | AO13: -3.9e-002 | AP13: 27 | AQ13: 科达转债!
A14: 289 | B14: 113519 | C14: 长久转债! | D14: 603569 | E14: 长久物流 | F14: 交通运输 | G14: 物流业 | H14: 99.36 | I14: 5.0000000000000001e-004 | J14: 1.7000000000000001e-003 | K14: 7.4 | L14: 2.07e-002 | M14: 119.3 | N14: 11.15 | O14: 0.49700000000000005 | P14: 66.37 | Q14: 转股中 | R14: 3.56年 | S14: 1.56年 | T14: 6.97 | U14: 2.7 | V14: 4.0000000000000001e-003 | W14: 0.16800000000000001 | X14: 0.11199999999999999 | Y14: 41 | Z14: 1.95 | AA14: 5.3800000000000001e-002 | AB14: 4.3700000000000003e-002 | AC14: 2.0099999999999996e-002 | AD14: 1.6799999999999999e-002 | AE14: 95.67 | AF14: 103.05 | AG14: 0.11 | AH14: AA | AI14: 4.2800000000000005e-002 | AJ14: =H14+100*O14 -> 149.06 | AK14: 132.4 | AL14: 228 | AM14: 29.3 | AN14: 129 | AO14: 1.1000000000000001e-002 | AP14: 20 | AQ14: 长久转债!
A15: 58 | B15: 128138 | C15: 侨银转债! | D15: 2973 | E15: 侨银股份 | F15: 城市公用 | G15: 城市公用 | H15: 102.552 | I15: 0. | J15: 5.0000000000000001e-004 | K15: 18.79 | L15: 1.6000000000000001e-003 | M15: 136.5 | N15: 25.43 | O15: 0.38799999999999996 | P15: 73.89 | Q15: 38天 | R15: 5.59年 | S15: 3.59年 | T15: 4.2 | U15: 3.4 | V15: 8.0000000000000002e-003 | W15: 5.5e-002 | X15: 4.0000000000000001e-002 | Y15: 77 | Z15: 5.41 | AA15: 5.3600000000000002e-002 | AB15: 4.2900000000000001e-002 | AC15: 4.8999999999999998e-003 | AD15: 2.5999999999999999e-003 | AE15: 82.54 | AF15: 96.53 | AG15: 0.32 | AH15: AA- | AI15: 6.5299999999999997e-002 | AJ15: =H15+100*O15 -> 141.352 | AK15: 131.2 | AL15: 218 | AM15: 34.7 | AN15: 177 | AO15: -5.9000000000000004e-002 | AP15: 8 | AQ15: 侨银转债!
A16: 101 | B16: 113600 | C16: 新星转债! | D16: 603978 | E16: 深圳新星 | F16: 有色金属 | G16: 有色行业 | H16: 96.7 | I16: 7.4999999999999997e-003 | J16: -2.0000000000000001e-004 | K16: 19.06 | L16: 1.6500000000000001e-002 | M16: 126 | N16: 23.85 | O16: 0.20999999999999999 | P16: 79.92 | Q16: 转股中 | R16: 5.32年 | S16: 3.33年 | T16: 5.95 | U16: 7.7 | V16: 1.3000000000000001e-002 | W16: 0.19500000000000001 | X16: 0.156 | Y16: 30 | Z16: 2 | AA16: 5.21e-002 | AB16: 4.3400000000000001e-002 | AC16: 2.1099999999999997e-002 | AD16: 1.8799999999999997e-002 | AE16: 83.52 | AF16: 90.6 | AG16: 0.44 | AH16: AA- | AI16: 6.5299999999999997e-002 | AJ16: =H16+100*O16 -> 117.7 | AK16: 113.5 | AL16: 47 | AM16: 22.9 | AN16: 61 | AO16: 2.5000000000000001e-002 | AP16: 18 | AQ16: 新星转债!
A17: 197 | B17: 128093 | C17: 百川转债! | D17: 2455 | E17: 百川股份 | F17: 化工 | G17: 化工 | H17: 103.12 | I17: 6.0000000000000001e-003 | J17: -5.0000000000000001e-004 | K17: 5.46 | L17: 1.11e-002 | M17: 129.8 | N17: 5.87 | O17: 0.109 | P17: 93.02 | Q17: 转股中 | R17: 4.72年 | S17: 2.72年 | T17: 5.19 | U17: 2.9 | V17: 5.0000000000000001e-003 | W17: 0.184 | X17: 0.17100000000000001 | Y17: 28 | Z17: 2.18 | AA17: 5.1799999999999999e-002 | AB17: 4.0800000000000003e-002 | AC17: 1.2699999999999999e-002 | AD17: 8.1000000000000013e-003 | AE17: 89.7 | AF17: 97.96 | AG17: 0.49 | AH17: AA- | AI17: 6.3799999999999996e-002 | AJ17: =H17+100*O17 -> 114.02000000000001 | AK17: 113.2 | AL17: 46 | AM17: 15.3 | AN17: 11 | AO17: 5.0000000000000001e-003 | AP17: 50 | AQ17: 百川转债!
A18: 262 | B18: 113530 | C18: 大丰转债! | D18: 603081 | E18: 大丰实业 | F18: 建筑 | G18: 装饰工程 | H18: 99.73 | I18: 3.3e-003 | J18: -2.e-003 | K18: 11.65 | L18: 9.4999999999999998e-003 | M18: 121 | N18: 16.64 | O18: 0.42399999999999999 | P18: 70.01 | Q18: 转股中 | R18: 3.94年 | S18: 1.95年 | T18: 6.3 | U18: 3 | V18: 5.0000000000000001e-003 | W18: 0.13500000000000001 | X18: 9.4e-002 | Y18: 47 | Z18: 2.28 | AA18: 5.1200000000000002e-002 | AB18: 4.1500000000000002e-002 | AC18: 1.5100000000000001e-002 | AD18: 1.23e-002 | AE18: 94.25 | AF18: 102.88 | AG18: 0.14 | AH18: AA | AI18: 4.2800000000000005e-002 | AJ18: =H18+100*O18 -> 142.13 | AK18: 129.4 | AL18: 202 | AM18: 26.6 | AN18: 100 | AO18: 3.0000000000000001e-003 | AP18: 34 | AQ18: 大丰转债!
A19: 156 | B19: 113573 | C19: 纵横转债! | D19: 603602 | E19: 纵横通信 | F19: 通信互联 | G19: 通信设备 | H19: 97.75 | I19: 4.4000000000000003e-003 | J19: 1.e-003 | K19: 11.03 | L19: 2.5099999999999997e-002 | M19: 124.7 | N19: 18.81 | O19: 0.66700000000000004 | P19: 58.64 | Q19: 转股中 | R19: 5年0.1天 | S19: 3年1.1天 | T19: 2.7 | U19: 4.3 | V19: 1.6e-002 | W19: 0.12 | X19: 7.0000000000000007e-002 | Y19: 22 | Z19: 3.15 | AA19: 5.1200000000000002e-002 | AB19: 4.2300000000000004e-002 | AC19: 2.2000000000000002e-002 | AD19: 1.9e-002 | AE19: 83.16 | AF19: 87.17 | AG19: 0.21 | AH19: A+ | AI19: 7.6299999999999993e-002 | AJ19: =H19+100*O19 -> 164.44999999999999 | AK19: 136.9 | AL19: 263 | AM19: 49.7 | AN19: 281 | AO19: -2.6000000000000002e-002 | AP19: 23 | AQ19: 纵横转债!
A20: 248 | B20: 113535 | C20: 大业转债! | D20: 603278 | E20: 大业股份 | F20: 汽车 | G20: 零部件制 | H20: 97.34 | I20: 2.e-003 | J20: -1.1000000000000001e-003 | K20: 8.7 | L20: 5.7999999999999996e-003 | M20: 113.1 | N20: 12.4 | O20: 0.38700000000000001 | P20: 70.16 | Q20: 转股中 | R20: 3年22天 | S20: 1年23天 | T20: 5 | U20: 3.7 | V20: 8.0000000000000002e-003 | W20: 0.19800000000000001 | X20: 0.13900000000000001 | Y20: 25 | Z20: 1.52 | AA20: 5.1100000000000007e-002 | AB20: 4.2800000000000005e-002 | AC20: 3.78e-002 | AD20: 3.4700000000000002e-002 | AE20: 96.77 | AF20: 99.68 | AG20: 0.15 | AH20: AA | AI20: 4.2800000000000005e-002 | AJ20: =H20+100*O20 -> 136.04000000000002 | AK20: 124.5 | AL20: 152 | AM20: 24.8 | AN20: 78 | AO20: 5.0999999999999997e-002 | AP20: 49 | AQ20: 大业转债!
A21: 274 | B21: 113528 | C21: 长城转债! | D21: 603897 | E21: 长城科技 | F21: 机械装备 | G21: 专用设备 | H21: 96.86 | I21: 1.7000000000000001e-003 | J21: 1.4000000000000002e-003 | K21: 16.92 | L21: 1.0800000000000001e-002 | M21: 116.8 | N21: 23.45 | O21: 0.34200000000000003 | P21: 72.15 | Q21: 转股中 | R21: 3.87年 | S21: 1.87年 | T21: 6.34 | U21: 1.5 | V21: 2.e-003 | W21: 0.20999999999999999 | X21: 0.152 | Y21: 30 | Z21: 1.6 | AA21: 5.0599999999999999e-002 | AB21: 4.24e-002 | AC21: 3.15e-002 | AD21: 2.8300000000000002e-002 | AE21: 91 | AF21: 92.37 | AG21: 0.29 | AH21: AA- | AI21: 6.3799999999999996e-002 | AJ21: =H21+100*O21 -> 131.06 | AK21: 121.6 | AL21: 123 | AM21: 29.2 | AN21: 127 | AO21: -6.9999999999999993e-003 | AP21: 41 | AQ21: 长城转债!
A22: 209 | B22: 128085 | C22: 鸿达转债! | D22: 2002 | E22: 鸿达兴业 | F22: 化工 | G22: 化工 | H22: 99.4 | I22: 4.0000000000000001e-003 | J22: 6.0999999999999995e-003 | K22: 3.9 | L22: 1.3000000000000001e-002 | M22: 124.4 | N22: 3.92 | O22: -1.e-003 | P22: 99.49 | Q22: 转股中 | R22: 4.67年 | S22: 2.67年 | T22: 12.4 | U22: 197 | V22: 0.161 | W22: 0.11 | X22: 0.11 | Y22: 112 | Z22: 1.47 | AA22: 5.04e-002 | AB22: 4.0999999999999995e-002 | AC22: 1.5900000000000001e-002 | AD22: 1.3100000000000001e-002 | AE22: 74.7 | AF22: 72.79 | AG22: 0.78 | AH22: BB | AI22: 0.12480000000000001 | AJ22: =H22+100*O22 -> 99.300000000000011 | AK22: 99.3 | AL22: 1 | AM22: 24.6 | AN22: 75 | AO22: 2.8999999999999998e-002 | AP22: 97 | AQ22: 鸿达转债!
A23: 338 | B23: 128015 | C23: 久其转债! | D23: 2279 | E23: 久其软件 | F23: 计算机及 | G23: 软件开发 | H23: 99.986 | I23: 1.4000000000000002e-003 | J23: -1.4000000000000002e-003 | K23: 4.92 | L23: 0. | M23: 110.8 | N23: 9.48 | O23: 0.92700000000000005 | P23: 51.9 | Q23: 转股中 | R23: 2年53天 | S23: 53天 | T23: 7.8 | U23: 12 | V23: 1.4999999999999999e-002 | W23: 0.223 | X23: 0.11599999999999999 | Y23: 35 | Z23: 4.96 | AA23: 5.0000000000000003e-002 | AB23: 4.0000000000000001e-002 | AC23: 5.1399999999999994e-002 | AD23: 4.0999999999999995e-002 | AE23: 99.35 | AF23: 95.46 | AG23: 0 | AH23: A+ | AI23: 7.3300000000000004e-002 | AJ23: =H23+100*O23 -> 192.68600000000001 | AK23: 148.1 | AL23: 299 | AM23: 48.7 | AN23: 277 | AO23: 1.9e-002 | AP23: 67 | AQ23: 久其转债!
A24: 309 | B24: 128037 | C24: 岩土转债! | D24: 2542 | E24: 中化岩土 | F24: 建筑 | G24: 建筑工程 | H24: 96.8 | I24: 3.8e-003 | J24: -3.7000000000000002e-003 | K24: 3.26 | L24: 2.52e-002 | M24: 111.3 | N24: 7.99 | O24: 1.3700000000000001 | P24: 40.8 | Q24: 转股中 | R24: 2.91年 | S24: 0.91年 | T24: 5.99 | U24: 15 | V24: 2.6000000000000002e-002 | W24: 0.10199999999999999 | X24: 4.2000000000000003e-002 | Y24: 59 | Z24: 1.45 | AA24: 4.99e-002 | AB24: 4.2300000000000004e-002 | AC24: 4.7899999999999998e-002 | AD24: 4.4400000000000002e-002 | AE24: 97.46 | AF24: 99.1 | AG24: 0 | AH24: AA | AI24: 4.1299999999999996e-002 | AJ24: =H24+100*O24 -> 233.80000000000001 | AK24: 152.8 | AL24: 308 | AM24: 53.7 | AN24: 290 | AO24: 2.4e-002 | AP24: 49 | AQ24: 岩土转债!
A25: 55 | B25: 123077 | C25: 汉得转债! | D25: 300170 | E25: 汉得信息 | F25: 计算机及 | G25: 软件开发 | H25: 96 | I25: 8.3999999999999995e-003 | J25: -1.6000000000000001e-003 | K25: 6.92 | L25: 2.8199999999999999e-002 | M25: 125.5 | N25: 9.72 | O25: 0.34799999999999998 | P25: 71.19 | Q25: 41天 | R25: 5.60年 | S25: 3.61年 | T25: 9.37 | U25: 3.7 | V25: 4.0000000000000001e-003 | W25: 0.153 | X25: 0.109 | Y25: 61 | Z25: 1.92 | AA25: 4.99e-002 | AB25: 4.1900000000000007e-002 | AC25: 2.12e-002 | AD25: 1.9199999999999998e-002 | AE25: 88.32 | AF25: 98.88 | AG25: 0.24 | AH25: AA | AI25: 4.4299999999999999e-002 | AJ25: =H25+100*O25 -> 130.80000000000001 | AK25: 120.8 | AL25: 114 | AM25: 21.9 | AN25: 53 | AO25: -1.1000000000000001e-002 | AP25: 12 | AQ25: 汉得转债!
A26: 265 | B26: 123023 | C26: 迪森转债! | D26: 300335 | E26: 迪森股份 | F26: 能源电力 | G26: 电力供应 | H26: 94.809 | I26: 8.5000000000000006e-003 | J26: -3.0999999999999999e-003 | K26: 4.94 | L26: 2.7000000000000003e-002 | M26: 114.3 | N26: 7.04 | O26: 0.35100000000000003 | P26: 70.17 | Q26: 转股中 | R26: 3.92年 | S26: 2.93年 | T26: 5.29 | U26: 7.8 | V26: 1.4999999999999999e-002 | W26: 0.28699999999999998 | X26: 0.20100000000000001 | Y26: 18 | Z26: 1.33 | AA26: 4.9699999999999994e-002 | AB26: 4.2699999999999995e-002 | AC26: 3.2799999999999996e-002 | AD26: 2.9700000000000001e-002 | AE26: 92.07 | AF26: 97.25 | AG26: 0.2 | AH26: AA | AI26: 4.2800000000000005e-002 | AJ26: =H26+100*O26 -> 129.90899999999999 | AK26: 119.4 | AL26: 99 | AM26: 22.2 | AN26: 54 | AO26: -3.6000000000000004e-002 | AP26: 51 | AQ26: 迪森转债!
A27: 130 | B27: 128118 | C27: 瀛通转债! | D27: 2861 | E27: 瀛通通讯 | F27: 电子 | G27: 电子产品 | H27: 95.531 | I27: 2.2000000000000001e-003 | J27: 5.1000000000000004e-003 | K27: 18.24 | L27: 2.41e-002 | M27: 122.1 | N27: 27.53 | O27: 0.442 | P27: 66.25 | Q27: 转股中 | R27: 5.21年 | S27: 3.21年 | T27: 3 | U27: 2.9 | V27: 1.e-002 | W27: 0.13500000000000001 | X27: 8.900000000000001e-002 | Y27: 22 | Z27: 2.09 | AA27: 4.9500000000000002e-002 | AB27: 4.1700000000000001e-002 | AC27: 2.76e-002 | AD27: 2.4799999999999999e-002 | AE27: 84.71 | AF27: 88.56 | AG27: 0.3 | AH27: AA- | AI27: 6.5299999999999997e-002 | AJ27: =H27+100*O27 -> 139.73099999999999 | AK27: 124.8 | AL27: 157 | AM27: 36.2 | AN27: 195 | AO27: 3.6000000000000004e-002 | AP27: 13 | AQ27: 瀛通转债!
A28: 242 | B28: 128069 | C28: 华森转债! | D28: 2907 | E28: 华森制药 | F28: 医药 | G28: 化学制药 | H28: 98.496 | I28: 1.e-003 | J28: -4.0000000000000001e-003 | K28: 12.34 | L28: -1.2800000000000001e-002 | M28: 120 | N28: 18.04 | O28: 0.44 | P28: 68.4 | Q28: 转股中 | R28: 4.19年 | S28: 2.19年 | T28: 3 | U28: 3.1 | V28: 1.1000000000000001e-002 | W28: 6.0999999999999999e-002 | X28: 4.0999999999999995e-002 | Y28: 50 | Z28: 4.61 | AA28: 4.9400000000000006e-002 | AB28: 4.0599999999999997e-002 | AC28: 2.1499999999999998e-002 | AD28: 1.8500000000000003e-002 | AE28: 89.63 | AF28: 93.16 | AG28: 0.24 | AH28: AA- | AI28: 6.3799999999999996e-002 | AJ28: =H28+100*O28 -> 142.49599999999998 | AK28: 128.6 | AL28: 196 | AM28: 35.4 | AN28: 186 | AO28: -9.0000000000000011e-003 | AP28: 44 | AQ28: 华森转债!
A29: 327 | B29: 128023 | C29: 亚太转债! | D29: 2284 | E29: 亚太股份 | F29: 汽车 | G29: 零部件制 | H29: 98.298 | I29: 1.1299999999999999e-002 | J29: -6.6e-003 | K29: 6.22 | L29: 0.10099999999999999 | M29: 111.3 | N29: 10.34 | O29: 0.63400000000000001 | P29: 60.15 | Q29: 转股中 | R29: 2.64年 | S29: 0.64年 | T29: 9.99 | U29: 60 | V29: 6.0999999999999999e-002 | W29: 0.218 | X29: 0.13100000000000001 | Y29: 46 | Z29: 1.89 | AA29: 4.9100000000000005e-002 | AB29: 4.07e-002 | AC29: 4.4699999999999997e-002 | AD29: 4.0099999999999997e-002 | AE29: 98.56 | AF29: 100.22 | AG29: 0.05 | AH29: AA | AI29: 4.1299999999999996e-002 | AJ29: =H29+100*O29 -> 161.69800000000001 | AK29: 136.4 | AL29: 258 | AM29: 36.2 | AN29: 194 | AO29: 0.18899999999999997 | AP29: 69 | AQ29: 亚太转债!
A30: 272 | B30: 110052 | C30: 贵广转债! | D30: 600996 | E30: 贵广网络 | F30: 传媒娱乐 | G30: 影视娱乐 | H30: 98.04 | I30: 7.000000000000001e-004 | J30: 2.5999999999999999e-003 | K30: 5.07 | L30: 3.4700000000000002e-002 | M30: 117.7 | N30: 7.94 | O30: 0.53500000000000003 | P30: 63.85 | Q30: 转股中 | R30: 3.88年 | S30: 1.89年 | T30: 15.3 | U30: 3.2 | V30: 2.e-003 | W30: 0.28600000000000003 | X30: 0.183 | Y30: 53 | Z30: 1.18 | AA30: 4.9100000000000005e-002 | AB30: 4.0599999999999997e-002 | AC30: 2.4700000000000003e-002 | AD30: 2.1700000000000001e-002 | AE30: 94.97 | AF30: 101.06 | AG30: 0.09 | AH30: AA+ | AI30: 4.0800000000000003e-002 | AJ30: =H30+100*O30 -> 151.54000000000002 | AK30: 132.2 | AL30: 225 | AM30: 31.2 | AN30: 147 | AO30: 1.7000000000000001e-002 | AP30: 18 | AQ30: 贵广转债!
A31: 249 | B31: 128066 | C31: 亚泰转债! | D31: 2811 | E31: 郑中设计 | F31: 建筑 | G31: 装饰工程 | H31: 97.581 | I31: 8.3000000000000001e-003 | J31: -2.8999999999999998e-003 | K31: 8.17 | L31: 1.24e-002 | M31: 117.5 | N31: 9.67 | O31: 0.155 | P31: 84.49 | Q31: 转股中 | R31: 4年0.1天 | S31: 2年1.1天 | T31: 4.8 | U31: 2.3 | V31: 5.0000000000000001e-003 | W31: 0.218 | X31: 0.184 | Y31: 22 | Z31: 1.5 | AA31: 4.8799999999999996e-002 | AB31: 4.0500000000000001e-002 | AC31: 2.9500000000000002e-002 | AD31: 2.5899999999999999e-002 | AE31: 90.99 | AF31: 92.35 | AG31: 0.44 | AH31: AA- | AI31: 6.3799999999999996e-002 | AJ31: =H31+100*O31 -> 113.081 | AK31: 110.7 | AL31: 31 | AM31: 18.3 | AN31: 25 | AO31: 2.e-003 | AP31: 61 | AQ31: 亚泰转债!
A32: 251 | B32: 127013 | C32: 创维转债! | D32: 810 | E32: 创维数字 | F32: 电子 | G32: 电子产品 | H32: 97.361 | I32: 5.9999999999999995e-004 | J32: 4.0000000000000002e-004 | K32: 7.95 | L32: 6.3e-003 | M32: 117.3 | N32: 11.39 | O32: 0.39500000000000002 | P32: 69.8 | Q32: 转股中 | R32: 3.99年 | S32: 1.998年 | T32: 9.78 | U32: 10 | V32: 1.1000000000000001e-002 | W32: 0.11599999999999999 | X32: 8.1000000000000003e-002 | Y32: 85 | Z32: 2.08 | AA32: 4.8600000000000004e-002 | AB32: 4.0500000000000001e-002 | AC32: 2.5600000000000001e-002 | AD32: 2.3e-002 | AE32: 93.94 | AF32: 99.5 | AG32: 0.16 | AH32: AA | AI32: 4.2800000000000005e-002 | AJ32: =H32+100*O32 -> 136.86099999999999 | AK32: 124.9 | AL32: 160 | AM32: 25.4 | AN32: 83 | AO32: 3.2000000000000001e-002 | AP32: 24 | AQ32: 创维转债!
A33: 110 | B33: 113596 | C33: 城地转债! | D33: 603887 | E33: 城地香江 | F33: 通信互联 | G33: 通信设备 | H33: 88.84 | I33: 8.199999999999999e-003 | J33: -4.1999999999999997e-003 | K33: 15.13 | L33: 3.2099999999999997e-002 | M33: 113.5 | N33: 29.21 | O33: 0.71499999999999997 | P33: 51.8 | Q33: 转股中 | R33: 5.28年 | S33: 3.28年 | T33: 12 | U33: 7.7 | V33: 6.9999999999999993e-003 | W33: 0.21100000000000002 | X33: 0.109 | Y33: 57 | Z33: 1.52 | AA33: 4.8600000000000004e-002 | AB33: 4.3499999999999997e-002 | AC33: 4.6799999999999994e-002 | AD33: 4.4400000000000002e-002 | AE33: 83.69 | AF33: 81.88 | AG33: 0.12 | AH33: AA- | AI33: 6.5299999999999997e-002 | AJ33: =H33+100*O33 -> 160.34 | AK33: 125.9 | AL33: 164 | AM33: 42.2 | AN33: 236 | AO33: 1.e-002 | AP33: 18 | AQ33: 城地转债!
A34: 319 | B34: 113017 | C34: 吉视转债! | D34: 601929 | E34: 吉视传媒 | F34: 传媒娱乐 | G34: 影视娱乐 | H34: 95.98 | I34: 2.3e-003 | J34: -1.2999999999999999e-003 | K34: 1.91 | L34: 1.6e-002 | M34: 108.8 | N34: 2.95 | O34: 0.48200000000000004 | P34: 64.75 | Q34: 转股中 | R34: 2.70年 | S34: 0.70年 | T34: 15.6 | U34: 8.1 | V34: 5.0000000000000001e-003 | W34: 0.26200000000000001 | X34: 0.17000000000000001 | Y34: 59 | Z34: 0.9 | AA34: 4.8300000000000003e-002 | AB34: 4.1700000000000001e-002 | AC34: 6.7500000000000004e-002 | AD34: 6.3700000000000007e-002 | AE34: 98.23 | AF34: 98.2 | AG34: 0.06 | AH34: AA+ | AI34: 3.9300000000000002e-002 | AJ34: =H34+100*O34 -> 144.18000000000001 | AK34: 127.2 | AL34: 179 | AM34: 29 | AN34: 122 | AO34: 4.0000000000000001e-002 | AP34: 63 | AQ34: 吉视转债!
A35: 131 | B35: 128117 | C35: 道恩转债! | D35: 2838 | E35: 道恩股份 | F35: 化工 | G35: 橡胶塑料 | H35: 97.301 | I35: 1.5e-003 | J35: 1.2999999999999999e-003 | K35: 19.15 | L35: 1.e-002 | M35: 123.5 | N35: 29.03 | O35: 0.47499999999999998 | P35: 65.97 | Q35: 转股中 | R35: 5.21年 | S35: 3.21年 | T35: 3.6 | U35: 2.6 | V35: 6.9999999999999993e-003 | W35: 4.5999999999999999e-002 | X35: 2.9999999999999999e-002 | Y35: 78 | Z35: 4.27 | AA35: 4.7800000000000002e-002 | AB35: 3.9699999999999999e-002 | AC35: 1.9699999999999999e-002 | AD35: 1.7399999999999999e-002 | AE35: 84.07 | AF35: 89.44 | AG35: 0.28 | AH35: AA- | AI35: 6.5299999999999997e-002 | AJ35: =H35+100*O35 -> 144.80099999999999 | AK35: 128.6 | AL35: 198 | AM35: 39.2 | AN35: 222 | AO35: -6.4000000000000001e-002 | AP35: 21 | AQ35: 道恩转债!
A36: 107 | B36: 113597 | C36: 佳力转债! | D36: 603912 | E36: 佳力图 | F36: 机械装备 | G36: 专用设备 | H36: 97.88 | I36: 2.7000000000000001e-003 | J36: -2.7000000000000001e-003 | K36: 13.88 | L36: 0. | M36: 124.5 | N36: 23.4 | O36: 0.65000000000000002 | P36: 59.32 | Q36: 转股中 | R36: 5.29年 | S36: 3.29年 | T36: 3 | U36: 1.3 | V36: 4.0000000000000001e-003 | W36: 0.10000000000000001 | X36: 5.9000000000000004e-002 | Y36: 30 | Z36: 3.47 | AA36: 4.7699999999999992e-002 | AB36: 3.9399999999999998e-002 | AC36: 1.9099999999999999e-002 | AD36: 1.66e-002 | AE36: 84.16 | AF36: 89.82 | AG36: 0.21 | AH36: AA- | AI36: 6.5299999999999997e-002 | AJ36: =H36+100*O36 -> 162.88 | AK36: 136.4 | AL36: 259 | AM36: 46.6 | AN36: 264 | AO36: -1.e-003 | AP36: 12 | AQ36: 佳力转债!
A37: 282 | B37: 113524 | C37: 奇精转债! | D37: 603677 | E37: 奇精机械 | F37: 家电 | G37: 零部件制 | H37: 99.55 | I37: 1.1999999999999999e-003 | J37: 2.e-003 | K37: 10.95 | L37: 1.3000000000000001e-002 | M37: 117.3 | N37: 14.08 | O37: 0.28000000000000003 | P37: 77.77 | Q37: 转股中 | R37: 3.66年 | S37: 1.66年 | T37: 3.3 | U37: 3.7 | V37: 1.1000000000000001e-002 | W37: 0.157 | X37: 0.122 | Y37: 21 | Z37: 2.19 | AA37: 4.6699999999999998e-002 | AB37: 3.7900000000000003e-002 | AC37: 1.78e-002 | AD37: 1.4800000000000001e-002 | AE37: 95.27 | AF37: 100.9 | AG37: 0.25 | AH37: AA | AI37: 4.2800000000000005e-002 | AJ37: =H37+100*O37 -> 127.55 | AK37: 121.3 | AL37: 120 | AM37: 20.4 | AN37: 42 | AO37: -2.e-003 | AP37: 46 | AQ37: 奇精转债!
A38: 35 | B38: 123088 | C38: 威唐转债! | D38: 300707 | E38: 威唐工业 | F38: 汽车 | G38: 零部件制 | H38: 94.43 | I38: -7.000000000000001e-004 | J38: -1.4499999999999999e-002 | K38: 15.24 | L38: -3.1200000000000002e-002 | M38: 121.6 | N38: 20.75 | O38: 0.28600000000000003 | P38: 73.45 | Q38: 2月6天 | R38: 5.66年 | S38: 3.67年 | T38: 3.01 | U38: 6.1 | V38: 2.1000000000000001e-002 | W38: 0.126 | X38: 9.1999999999999998e-002 | Y38: 24 | Z38: 3.52 | AA38: 4.6699999999999998e-002 | AB38: 3.9800000000000002e-002 | AC38: 2.7400000000000001e-002 | AD38: 2.4900000000000002e-002 | AE38: 79.19 | AF38: 80.98 | AG38: 0.49 | AH38: A+ | AI38: 7.6299999999999993e-002 | AJ38: =H38+100*O38 -> 123.03 | AK38: 115.4 | AL38: 58 | AM38: 34.4 | AN38: 176 | AO38: 3.4000000000000002e-002 | AP38: 9 | AQ38: 威唐转债!
A39: 206 | B39: 110064 | C39: 建工转债! | D39: 600939 | E39: 重庆建工 | F39: 建筑 | G39: 建筑工程 | H39: 97.82 | I39: 5.0000000000000001e-003 | J39: -1.9e-003 | K39: 3.58 | L39: 1.1299999999999999e-002 | M39: 119.8 | N39: 4.57 | O39: 0.249 | P39: 78.34 | Q39: 转股中 | R39: 4.68年 | S39: 2.68年 | T39: 16.6 | U39: 11 | V39: 6.9999999999999993e-003 | W39: 0.25600000000000001 | X39: 0.20000000000000001 | Y39: 65 | Z39: 0.94 | AA39: 4.5400000000000003e-002 | AB39: 3.7499999999999999e-002 | AC39: 2.2400000000000003e-002 | AD39: 1.95e-002 | AE39: 93.03 | AF39: 99.79 | AG39: 0.28 | AH39: AA+ | AI39: 4.0800000000000003e-002 | AJ39: =H39+100*O39 -> 122.72 | AK39: 117.3 | AL39: 77 | AM39: 17.5 | AN39: 18 | AO39: -6.0000000000000001e-003 | AP39: 45 | AQ39: 建工转债!
A40: 57 | B40: 123076 | C40: 强力转债! | D40: 300429 | E40: 强力新材 | F40: 化工 | G40: 化工 | H40: 92.885 | I40: 3.5999999999999999e-003 | J40: 1.5e-003 | K40: 10.96 | L40: 2.3300000000000001e-002 | M40: 118.5 | N40: 18.98 | O40: 0.60899999999999999 | P40: 57.74 | Q40: 39天 | R40: 5.59年 | S40: 3.59年 | T40: 8.5 | U40: 6.4 | V40: 8.0000000000000002e-003 | W40: 0.151 | X40: 8.6999999999999994e-002 | Y40: 56 | Z40: 3.26 | AA40: 4.5400000000000003e-002 | AB40: 3.9199999999999999e-002 | AC40: 3.04e-002 | AD40: 2.8300000000000002e-002 | AE40: 82.05 | AF40: 83.79 | AG40: 0.22 | AH40: AA- | AI40: 6.5299999999999997e-002 | AJ40: =H40+100*O40 -> 153.785 | AK40: 128 | AL40: 190 | AM40: 44.2 | AN40: 250 | AO40: -2.e-002 | AP40: 13 | AQ40: 强力转债!
A41: 100 | B41: 110072 | C41: 广汇转债! | D41: 600297 | E41: 广汇汽车 | F41: 汽车 | G41: 分销、售 | H41: 90.73 | I41: 2.7300000000000001e-002 | J41: -9.1000000000000004e-003 | K41: 3.17 | L41: 4.9699999999999994e-002 | M41: 114.5 | N41: 4.03 | O41: 0.153 | P41: 78.66 | Q41: 转股中 | R41: 5.34年 | S41: 3.34年 | T41: 33.7 | U41: 193 | V41: 6.4000000000000001e-002 | W41: 0.13100000000000001 | X41: 0.10300000000000001 | Y41: 257 | Z41: 0.65 | AA41: 4.53e-002 | AB41: 4.0099999999999997e-002 | AC41: 3.7100000000000001e-002 | AD41: 3.5299999999999998e-002 | AE41: 89.16 | AF41: 92.1 | AG41: 0.37 | AH41: AA+ | AI41: 4.2300000000000004e-002 | AJ41: =H41+100*O41 -> 106.03 | AK41: 102.8 | AL41: 3 | AM41: 10.7 | AN41: 4 | AO41: 0.14599999999999999 | AP41: 48 | AQ41: 广汇转债!
A42: 250 | B42: 110058 | C42: XD永鼎转! | D42: 600105 | E42: 永鼎股份 | F42: 通信互联 | G42: 通信设备 | H42: 96.22 | I42: 1.1000000000000001e-003 | J42: 1.7000000000000001e-003 | K42: 3.19 | L42: 2.2400000000000003e-002 | M42: 114.9 | N42: 5.04 | O42: 0.52000000000000002 | P42: 63.29 | Q42: 转股中 | R42: 3.998年 | S42: 2年0.1天 | T42: 2.61 | U42: 5.4 | V42: 2.1000000000000001e-002 | W42: 5.9000000000000004e-002 | X42: 3.7999999999999999e-002 | Y42: 44 | Z42: 1.57 | AA42: 4.4800000000000006e-002 | AB42: 3.7999999999999999e-002 | AC42: 3.1200000000000002e-002 | AD42: 2.86e-002 | AE42: 93.93 | AF42: 96.95 | AG42: 0.13 | AH42: AA | AI42: 4.2800000000000005e-002 | AJ42: =H42+100*O42 -> 148.22 | AK42: 129.1 | AL42: 200 | AM42: 32.2 | AN42: 158 | AO42: 8.0000000000000002e-003 | AP42: 49 | AQ42: XD永鼎转!
A43: 301 | B43: 123010 | C43: 博世转债! | D43: 300422 | E43: 博世科 | F43: 城市公用 | G43: 三废处理 | H43: 97.902 | I43: 4.8999999999999998e-003 | J43: -3.0000000000000001e-003 | K43: 8.99 | L43: 7.8000000000000005e-003 | M43: 112.3 | N43: 12.2 | O43: 0.32899999999999996 | P43: 73.69 | Q43: 转股中 | R43: 3.22年 | S43: 1.22年 | T43: 4.3 | U43: 1.6 | V43: 4.0000000000000001e-003 | W43: 0.11800000000000001 | X43: 8.6999999999999994e-002 | Y43: 36 | Z43: 1.54 | AA43: 4.4600000000000001e-002 | AB43: 3.7100000000000001e-002 | AC43: 3.6200000000000003e-002 | AD43: 3.2000000000000001e-002 | AE43: 94.44 | AF43: 92.45 | AG43: 0.25 | AH43: AA- | AI43: 6.3799999999999996e-002 | AJ43: =H43+100*O43 -> 130.80199999999999 | AK43: 122.1 | AL43: 130 | AM43: 27.7 | AN43: 114 | AO43: -3.5000000000000003e-002 | AP43: 31 | AQ43: 博世转债!
A44: 344 | B44: 127003 | C44: 海印转债! | D44: 861 | E44: 海印股份 | F44: 商业零售 | G44: 商场 | H44: 106.49 | I44: 4.4000000000000003e-003 | J44: -2.2000000000000001e-003 | K44: 2.36 | L44: 4.4199999999999996e-002 | M44: 111.8 | N44: 3 | O44: 0.35399999999999998 | P44: 78.67 | Q44: 转股中 | R44: 1年53天 | S44: 回售内 | T44: 6.74 | U44: 28 | V44: 3.7999999999999999e-002 | W44: 0.12300000000000001 | X44: 9.6999999999999989e-002 | Y44: 55 | Z44: 1.39 | AA44: 4.41e-002 | AB44: 2.4399999999999998e-002 | AC44: 回售内 | AD44: 回售内 | AE44: 100.3 | AF44: 106.81 | AG44: 0.05 | AH44: AA | AI44: 4.1299999999999996e-002 | AJ44: =H44+100*O44 -> 141.88999999999999 | AK44: 134.3 | AL44: 246 | AM44: 27.5 | AN44: 112 | AO44: 8.199999999999999e-002 | AP44: 74 | AQ44: 海印转债!
A45: 142 | B45: 123054 | C45: 思特转债! | D45: 300608 | E45: 思特奇 | F45: 通信互联 | G45: 通信设备 | H45: 97.998 | I45: 1.2800000000000001e-002 | J45: 1.1599999999999999e-002 | K45: 12.8 | L45: 5.6100000000000004e-002 | M45: 121.7 | N45: 16.49 | O45: 0.26200000000000001 | P45: 77.62 | Q45: 转股中 | R45: 5年54天 | S45: 3年55天 | T45: 2.71 | U45: 8.6 | V45: 3.3000000000000002e-002 | W45: 0.13400000000000001 | X45: 0.10400000000000001 | Y45: 20 | Z45: 2.51 | AA45: 4.41e-002 | AB45: 3.6400000000000002e-002 | AC45: 2.0199999999999999e-002 | AD45: 1.7399999999999999e-002 | AE45: 85.07 | AF45: 88.61 | AG45: 0.43 | AH45: AA- | AI45: 6.5299999999999997e-002 | AJ45: =H45+100*O45 -> 124.19800000000001 | AK45: 118.4 | AL45: 89 | AM45: 29.8 | AN45: 133 | AO45: 0.13100000000000001 | AP45: 20 | AQ45: 思特转债!
A46: 254 | B46: 113534 | C46: 鼎胜转债! | D46: 603876 | E46: 鼎胜新材 | F46: 有色金属 | G46: 小金属 | H46: 96.59 | I46: 8.0000000000000002e-003 | J46: 2.3999999999999998e-003 | K46: 12.37 | L46: 3.2599999999999997e-002 | M46: 114.3 | N46: 15.18 | O46: 0.185 | P46: 81.49 | Q46: 转股中 | R46: 3.98年 | S46: 1.98年 | T46: 12 | U46: 7.6 | V46: 6.9999999999999993e-003 | W46: 0.22399999999999998 | X46: 0.182 | Y46: 54 | Z46: 1.49 | AA46: 4.4000000000000004e-002 | AB46: 3.7100000000000001e-002 | AC46: 2.9600000000000001e-002 | AD46: 2.7000000000000003e-002 | AE46: 94.01 | AF46: 97.03 | AG46: 0.32 | AH46: AA | AI46: 4.2800000000000005e-002 | AJ46: =H46+100*O46 -> 115.09 | AK46: 111.7 | AL46: 34 | AM46: 14.7 | AN46: 9 | AO46: 5.9000000000000004e-002 | AP46: 35 | AQ46: 鼎胜转债!
A47: 225 | B47: 113546 | C47: 迪贝转债! | D47: 603320 | E47: 迪贝电气 | F47: 家电 | G47: 零部件制 | H47: 99.78 | I47: 5.5000000000000005e-003 | J47: 1.5900000000000001e-002 | K47: 11.55 | L47: 4.4299999999999999e-002 | M47: 120.6 | N47: 14.1 | O47: 0.218 | P47: 81.91 | Q47: 转股中 | R47: 4.52年 | S47: 2.52年 | T47: 2.3 | U47: 3 | V47: 1.3000000000000001e-002 | W47: 0.153 | X47: 0.125 | Y47: 15 | Z47: 2.22 | AA47: 4.3899999999999995e-002 | AB47: 3.5499999999999997e-002 | AC47: 1.55e-002 | AD47: 1.26e-002 | AE47: 85.83 | AF47: 87.73 | AG47: 0.48 | AH47: A+ | AI47: 7.4800000000000005e-002 | AJ47: =H47+100*O47 -> 121.58 | AK47: 117.6 | AL47: 82 | AM47: 29.9 | AN47: 134 | AO47: 9.0999999999999998e-002 | AP47: 41 | AQ47: 迪贝转债!
A48: 98 | B48: 128127 | C48: 文科转债! | D48: 2775 | E48: 文科园林 | F48: 城市公用 | G48: 生态环境 | H48: 97.021 | I48: 2.4e-002 | J48: 1.8000000000000002e-002 | K48: 5.05 | L48: 6.9900000000000004e-002 | M48: 121.3 | N48: 5.37 | O48: 3.2000000000000001e-002 | P48: 94.04 | Q48: 转股中 | R48: 5.34年 | S48: 3.35年 | T48: 9.5 | U48: 78 | V48: 8.4000000000000005e-002 | W48: 0.36700000000000005 | X48: 0.34499999999999997 | Y48: 26 | Z48: 0.98 | AA48: 4.3700000000000003e-002 | AB48: 3.6400000000000002e-002 | AC48: 2.0899999999999998e-002 | AD48: 1.84e-002 | AE48: 83.7 | AF48: 87.21 | AG48: 0.6 | AH48: AA- | AI48: 6.5299999999999997e-002 | AJ48: =H48+100*O48 -> 100.221 | AK48: 100 | AL48: 2 | AM48: 12.8 | AN48: 7 | AO48: 3.7000000000000005e-002 | AP48: 36 | AQ48: 文科转债!
A49: 88 | B49: 128132 | C49: 交建转债! | D49: 2941 | E49: 新疆交建 | F49: 建筑 | G49: 建筑工程 | H49: 93.568 | I49: 5.6000000000000008e-003 | J49: -4.5999999999999999e-003 | K49: 11.87 | L49: 5.1000000000000004e-003 | M49: 117.3 | N49: 18.57 | O49: 0.46399999999999997 | P49: 63.92 | Q49: 转股中 | R49: 5.41年 | S49: 3.42年 | T49: 8.5 | U49: 11 | V49: 1.3000000000000001e-002 | W49: 0.111 | X49: 7.0999999999999994e-002 | Y49: 77 | Z49: 3.16 | AA49: 4.3499999999999997e-002 | AB49: 3.7499999999999999e-002 | AC49: 2.9700000000000001e-002 | AD49: 2.75e-002 | AE49: 89.02 | AF49: 93.2 | AG49: 0.18 | AH49: AA | AI49: 4.4299999999999999e-002 | AJ49: =H49+100*O49 -> 139.96799999999999 | AK49: 123.2 | AL49: 141 | AM49: 30 | AN49: 135 | AO49: -5.2999999999999999e-002 | AP49: 16 | AQ49: 交建转债!
A50: 179 | B50: 123044 | C50: 红相转债!! | D50: 300427 | E50: 红相股份 | F50: 能源电力 | G50: 电力设备 | H50: 102 | I50: 0. | J50: 6.0000000000000001e-003 | K50: 12.6 | L50: 2.2700000000000001e-002 | M50: 125 | N50: 18.8 | O50: 0.52200000000000002 | P50: 67.02 | Q50: 转股中 | R50: 4.90年 | S50: 2.90年 | T50: 5.5 | U50: 3.8 | V50: 6.9999999999999993e-003 | W50: 0.121 | X50: 8.1000000000000003e-002 | Y50: 45 | Z50: 1.99 | AA50: 4.3400000000000001e-002 | AB50: 3.44e-002 | AC50: 8.0000000000000002e-003 | AD50: 5.1000000000000004e-003 | AE50: 86.61 | AF50: 92.99 | AG50: 0.27 | AH50: AA- | AI50: 6.3799999999999996e-002 | AJ50: =H50+100*O50 -> 154.19999999999999 | AK50: 137 | AL50: 265 | AM50: 44 | AN50: 247 | AO50: -8.9999999999999997e-002 | AP50: 20 | AQ50: 红相转债!!
A51: 96 | B51: 113601 | C51: 塞力转债! | D51: 603716 | E51: 塞力医疗 | F51: 医药 | G51: 医药商业 | H51: 97.45 | I51: 9.4999999999999998e-003 | J51: -1.4000000000000002e-003 | K51: 14.4 | L51: 1.55e-002 | M51: 121.3 | N51: 16.98 | O51: 0.14899999999999999 | P51: 84.81 | Q51: 转股中 | R51: 5.35年 | S51: 3.35年 | T51: 5.43 | U51: 5.2 | V51: 1.e-002 | W51: 0.184 | X51: 0.156 | Y51: 30 | Z51: 1.94 | AA51: 4.2800000000000005e-002 | AB51: 3.5499999999999997e-002 | AC51: 1.95e-002 | AD51: 1.7100000000000001e-002 | AE51: 83.69 | AF51: 87.19 | AG51: 0.52 | AH51: AA- | AI51: 6.5299999999999997e-002 | AJ51: =H51+100*O51 -> 112.34999999999999 | AK51: 110.1 | AL51: 29 | AM51: 22.9 | AN51: 62 | AO51: 1.9e-002 | AP51: 35 | AQ51: 塞力转债!
A52: 133 | B52: 113591 | C52: 胜达转债! | D52: 603687 | E52: 大胜达 | F52: 造纸包装 | G52: 包装用纸 | H52: 98.82 | I52: 8.199999999999999e-003 | J52: 4.1999999999999997e-003 | K52: 8.87 | L52: 2.4199999999999999e-002 | M52: 122.2 | N52: 10.46 | O52: 0.16500000000000001 | P52: 84.8 | Q52: 转股中 | R52: 5.21年 | S52: 3.21年 | T52: 5.5 | U52: 1.8 | V52: 3.0000000000000001e-003 | W52: 0.151 | X52: 0.128 | Y52: 36 | Z52: 2.35 | AA52: 4.2599999999999999e-002 | AB52: 3.49e-002 | AC52: 1.5800000000000002e-002 | AD52: 1.34e-002 | AE52: 84.34 | AF52: 88.59 | AG52: 0.51 | AH52: AA- | AI52: 6.5299999999999997e-002 | AJ52: =H52+100*O52 -> 115.31999999999999 | AK52: 112.8 | AL52: 43 | AM52: 24.2 | AN52: 70 | AO52: -4.0000000000000001e-003 | AP52: 23 | AQ52: 胜达转债!
A53: 79 | B53: 123069 | C53: 金诺转债! | D53: 300505 | E53: 川金诺 | F53: 化工 | G53: 农化 | H53: 100.6 | I53: 4.7999999999999996e-003 | J53: 1.e-004 | K53: 16.42 | L53: 9.7999999999999997e-003 | M53: 126 | N53: 19.15 | O53: 0.17300000000000001 | P53: 85.74 | Q53: 6.1天 | R53: 5.50年 | S53: 3.50年 | T53: 3.68 | U53: 2.6 | V53: 6.9999999999999993e-003 | W53: 0.17100000000000001 | X53: 0.14699999999999999 | Y53: 21 | Z53: 2.23 | AA53: 4.2599999999999999e-002 | AB53: 3.44e-002 | AC53: 9.0000000000000011e-003 | AD53: 6.8999999999999999e-003 | AE53: 82.6 | AF53: 89.6 | AG53: 0.5 | AH53: AA- | AI53: 6.5299999999999997e-002 | AJ53: =H53+100*O53 -> 117.89999999999999 | AK53: 115.5 | AL53: 59 | AM53: 25.9 | AN53: 90 | AO53: 1.9e-002 | AP53: 17 | AQ53: 金诺转债!
A54: 295 | B54: 128042 | C54: 凯中转债! | D54: 2823 | E54: 凯中精密 | F54: 能源电力 | G54: 电力设备 | H54: 101.8 | I54: 9.8999999999999991e-003 | J54: -6.6e-003 | K54: 10.4 | L54: 1.3600000000000001e-002 | M54: 116.3 | N54: 12.96 | O54: 0.26899999999999996 | P54: 80.25 | Q54: 转股中 | R54: 3.29年 | S54: 1.29年 | T54: 4.16 | U54: 1.1 | V54: 3.0000000000000001e-003 | W54: 0.13900000000000001 | X54: 0.11199999999999999 | Y54: 30 | Z54: 2.21 | AA54: 4.2300000000000004e-002 | AB54: 3.3000000000000002e-002 | AC54: 6.8000000000000005e-003 | AD54: 3.0000000000000001e-003 | AE54: 96.78 | AF54: 101.63 | AG54: 0.24 | AH54: AA | AI54: 4.2800000000000005e-002 | AJ54: =H54+100*O54 -> 128.69999999999999 | AK54: 123.4 | AL54: 142 | AM54: 21.7 | AN54: 52 | AO54: -1.1000000000000001e-002 | AP54: 28 | AQ54: 凯中转债!
A55: 39 | B55: 123084 | C55: 高澜转债! | D55: 300499 | E55: 高澜股份 | F55: 能源电力 | G55: 电力设备 | H55: 97 | I55: 2.9999999999999997e-004 | J55: 1.1299999999999999e-002 | K55: 8.84 | L55: 2.2000000000000002e-002 | M55: 121.9 | N55: 11.36 | O55: 0.247 | P55: 77.82 | Q55: 2月1天 | R55: 5.65年 | S55: 3.65年 | T55: 2.8 | U55: 2.5 | V55: 9.0000000000000011e-003 | W55: 0.114 | X55: 8.900000000000001e-002 | Y55: 25 | Z55: 2.95 | AA55: 4.2300000000000004e-002 | AB55: 3.5200000000000002e-002 | AC55: 2.0799999999999999e-002 | AD55: 1.8200000000000001e-002 | AE55: 79.44 | AF55: 81.28 | AG55: 0.53 | AH55: A+ | AI55: 7.6299999999999993e-002 | AJ55: =H55+100*O55 -> 121.7 | AK55: 116.2 | AL55: 66 | AM55: 34.9 | AN55: 181 | AO55: -1.3000000000000001e-002 | AP55: 8 | AQ55: 高澜转债!
A56: 183 | B56: 113568 | C56: 新春转债! | D56: 603667 | E56: 五洲新春 | F56: 机械装备 | G56: 通用设备 | H56: 102.03 | I56: 4.0000000000000002e-004 | J56: 2.8000000000000004e-003 | K56: 8.27 | L56: 6.0999999999999995e-003 | M56: 124.3 | N56: 8.91 | O56: 9.9000000000000005e-002 | P56: 92.82 | Q56: 转股中 | R56: 4.89年 | S56: 2.89年 | T56: 3.3 | U56: 2 | V56: 6.0000000000000001e-003 | W56: 0.13600000000000001 | X56: 0.127 | Y56: 24 | Z56: 1.4 | AA56: 4.2199999999999994e-002 | AB56: 3.3399999999999999e-002 | AC56: 7.0999999999999995e-003 | AD56: 4.3e-003 | AE56: 86.45 | AF56: 92.51 | AG56: 0.53 | AH56: AA- | AI56: 6.3799999999999996e-002 | AJ56: =H56+100*O56 -> 111.93000000000001 | AK56: 111.2 | AL56: 32 | AM56: 18.7 | AN56: 28 | AO56: 6.2e-002 | AP56: 48 | AQ56: 新春转债!
A57: 116 | B57: 123061 | C57: 航新转债! | D57: 300424 | E57: 航新科技 | F57: 航空航天 | G57: 航空航天 | H57: 101.01 | I57: 5.1000000000000004e-003 | J57: 7.4000000000000003e-003 | K57: 12.57 | L57: 2.2799999999999997e-002 | M57: 124.8 | N57: 14.86 | O57: 0.19399999999999998 | P57: 84.59 | Q57: 转股中 | R57: 5.26年 | S57: 3.27年 | T57: 2.5 | U57: 34 | V57: 0.13300000000000001 | W57: 8.3000000000000004e-002 | X57: 7.0000000000000007e-002 | Y57: 30 | Z57: 2.76 | AA57: 4.2000000000000003e-002 | AB57: 3.3700000000000001e-002 | AC57: 1.0700000000000001e-002 | AD57: 8.0000000000000002e-003 | AE57: 81.66 | AF57: 85.6 | AG57: 0.55 | AH57: A+ | AI57: 7.6299999999999993e-002 | AJ57: =H57+100*O57 -> 120.41 | AK57: 117.4 | AL57: 79 | AM57: 31.8 | AN57: 153 | AO57: -2.e-003 | AP57: 14 | AQ57: 航新转债!
A58: 228 | B58: 128076 | C58: 金轮转债! | D58: 2722 | E58: 金轮股份 | F58: 机械装备 | G58: 专用设备 | H58: 96.04 | I58: -8.9999999999999998e-004 | J58: 1.1999999999999999e-003 | K58: 10.84 | L58: 8.9999999999999998e-004 | M58: 114.9 | N58: 14.76 | O58: 0.308 | P58: 73.44 | Q58: 转股中 | R58: 4.49年 | S58: 2.50年 | T58: 2.14 | U58: 2.3 | V58: 1.1000000000000001e-002 | W58: 0.113 | X58: 8.3000000000000004e-002 | Y58: 19 | Z58: 1.03 | AA58: 4.1599999999999998e-002 | AB58: 3.5200000000000002e-002 | AC58: 2.8399999999999998e-002 | AD58: 2.58e-002 | AE58: 87.85 | AF58: 87.53 | AG58: 0.37 | AH58: AA- | AI58: 6.3799999999999996e-002 | AJ58: =H58+100*O58 -> 126.84 | AK58: 118.6 | AL58: 91 | AM58: 30.8 | AN58: 143 | AO58: 5.7000000000000002e-002 | AP58: 42 | AQ58: 金轮转债!
A59: 312 | B59: 113505 | C59: 杭电转债! | D59: 603618 | E59: 杭电股份 | F59: 能源电力 | G59: 电力设备 | H59: 99.23 | I59: 2.3e-003 | J59: -4.0000000000000002e-004 | K59: 5.94 | L59: 6.8000000000000005e-003 | M59: 111.3 | N59: 7.14 | O59: 0.193 | P59: 83.19 | Q59: 转股中 | R59: 2.89年 | S59: 0.89年 | T59: 7.5 | U59: 4.6 | V59: 6.0000000000000001e-003 | W59: 0.183 | X59: 0.152 | Y59: 41 | Z59: 1.62 | AA59: 4.1200000000000001e-002 | AB59: 3.3599999999999998e-002 | AC59: 2.46e-002 | AD59: 2.12e-002 | AE59: 97.56 | AF59: 99.2 | AG59: 0.28 | AH59: AA | AI59: 4.1299999999999996e-002 | AJ59: =H59+100*O59 -> 118.53 | AK59: 115.3 | AL59: 57 | AM59: 16.1 | AN59: 13 | AO59: -3.7000000000000005e-002 | AP59: 42 | AQ59: 杭电转债!
A60: 47 | B60: 123081 | C60: 精研转债! | D60: 300709 | E60: 精研科技 | F60: 电子 | G60: 电子产品 | H60: 97.13 | I60: 1.4000000000000002e-003 | J60: 3.0000000000000001e-003 | K60: 40.21 | L60: 1.54e-002 | M60: 121.3 | N60: 64.28 | O60: 0.55299999999999994 | P60: 62.55 | Q60: 54天 | R60: 5.63年 | S60: 3.63年 | T60: 5.7 | U60: 2.1 | V60: 4.0000000000000001e-003 | W60: 0.12300000000000001 | X60: 7.6999999999999999e-002 | Y60: 46 | Z60: 3.09 | AA60: 4.1100000000000005e-002 | AB60: 3.4300000000000004e-002 | AC60: 1.89e-002 | AD60: 1.67e-002 | AE60: 82.16 | AF60: 85.6 | AG60: 0.28 | AH60: AA- | AI60: 6.5299999999999997e-002 | AJ60: =H60+100*O60 -> 152.43000000000001 | AK60: 131.7 | AL60: 220 | AM60: 46.1 | AN60: 260 | AO60: -3.0000000000000001e-003 | AP60: 6 | AQ60: 精研转债!
A61: 325 | B61: 128026 | C61: 众兴转债! | D61: 2772 | E61: 众兴菌业 | F61: 农业 | G61: 种植业 | H61: 98.542 | I61: 4.0000000000000002e-004 | J61: 1.e-003 | K61: 9.13 | L61: 5.5000000000000005e-003 | M61: 109.3 | N61: 11.45 | O61: 0.23600000000000002 | P61: 79.74 | Q61: 转股中 | R61: 2.66年 | S61: 0.66年 | T61: 9.19 | U61: 3.9 | V61: 4.0000000000000001e-003 | W61: 0.27399999999999997 | X61: 0.218 | Y61: 34 | Z61: 1.33 | AA61: 4.0399999999999998e-002 | AB61: 3.3500000000000002e-002 | AC61: 4.0199999999999993e-002 | AD61: 3.5799999999999998e-002 | AE61: 96.85 | AF61: 93.33 | AG61: 0.26 | AH61: AA- | AI61: 6.2300000000000001e-002 | AJ61: =H61+100*O61 -> 122.142 | AK61: 117.3 | AL61: 78 | AM61: 20.5 | AN61: 44 | AO61: 8.0000000000000002e-003 | AP61: 62 | AQ61: 众兴转债!
A62: 155 | B62: 113578 | C62: 全筑转债! | D62: 603030 | E62: 全筑股份 | F62: 建筑 | G62: 装饰工程 | H62: 97.42 | I62: 5.7999999999999996e-003 | J62: 1.9e-003 | K62: 4.46 | L62: 2.06e-002 | M62: 118.3 | N62: 5.43 | O62: 0.18600000000000003 | P62: 82.14 | Q62: 转股中 | R62: 5年3.1天 | S62: 3年4.1天 | T62: 3.84 | U62: 3.1 | V62: 8.0000000000000002e-003 | W62: 0.16 | X62: 0.13100000000000001 | Y62: 24 | Z62: 1.08 | AA62: 4.0399999999999998e-002 | AB62: 3.3599999999999998e-002 | AC62: 2.0400000000000001e-002 | AD62: 1.8000000000000002e-002 | AE62: 90.59 | AF62: 95.66 | AG62: 0.37 | AH62: AA | AI62: 4.4299999999999999e-002 | AJ62: =H62+100*O62 -> 116.02000000000001 | AK62: 112.7 | AL62: 40 | AM62: 17 | AN62: 17 | AO62: 1.1000000000000001e-002 | AP62: 19 | AQ62: 全筑转债!
A63: 104 | B63: 113599 | C63: 嘉友转债! | D63: 603871 | E63: 嘉友国际 | F63: 交通运输 | G63: 物流业 | H63: 102.6 | I63: 1.1000000000000001e-003 | J63: 3.2000000000000002e-003 | K63: 21.63 | L63: 8.3999999999999995e-003 | M63: 126 | N63: 24.82 | O63: 0.17699999999999999 | P63: 87.15 | Q63: 转股中 | R63: 5.30年 | S63: 3.30年 | T63: 7.2 | U63: 2.1 | V63: 3.0000000000000001e-003 | W63: 0.152 | X63: 0.13200000000000001 | Y63: 47 | Z63: 2.38 | AA63: 4.0300000000000002e-002 | AB63: 3.1800000000000002e-002 | AC63: 3.7000000000000002e-003 | AD63: 1.5e-003 | AE63: 83.64 | AF63: 90.73 | AG63: 0.5 | AH63: AA- | AI63: 6.5299999999999997e-002 | AJ63: =H63+100*O63 -> 120.3 | AK63: 118.1 | AL63: 85 | AM63: 27.3 | AN63: 111 | AO63: 9.0000000000000011e-003 | AP63: 19 | AQ63: 嘉友转债!
A64: 5 | B64: 123102 | C64: 华自转债 | D64: 300490 | E64: 华自科技 | F64: 机械装备 | G64: 机器人及 | H64: 101.095 | I64: 5.1000000000000004e-003 | J64: -2.9999999999999997e-004 | K64: 9.07 | L64: 7.8000000000000005e-003 | M64: 126.9 | N64: 9.28 | O64: 3.4000000000000002e-002 | P64: 97.74 | Q64: 5月5天 | R64: 5.90年 | S64: 3.90年 | T64: 6.7 | U64: 29 | V64: 4.2999999999999997e-002 | W64: 0.28800000000000003 | X64: 0.28199999999999997 | Y64: 23 | Z64: 1.33 | AA64: 4.0199999999999993e-002 | AB64: 3.2300000000000002e-002 | AC64: 9.3999999999999986e-003 | AD64: 6.9999999999999993e-003 | AE64: 81.37 | AF64: 88.11 | AG64: 0.62 | AH64: AA- | AI64: 6.5299999999999997e-002 | AJ64: =H64+100*O64 -> 104.495 | AK64: 104.5 | AL64: 6 | AM64: 16.3 | AN64: 14 | AO64: -7.5999999999999998e-002 | AP64: 9 | AQ64: 华自转债
A65: 52 | B65: 128139 | C65: 祥鑫转债! | D65: 2965 | E65: 祥鑫科技 | F65: 汽车 | G65: 零部件制 | H65: 97.4 | I65: 1.e-003 | J65: 1.7000000000000001e-003 | K65: 30.76 | L65: 5.1999999999999998e-003 | M65: 121 | N65: 37.28 | O65: 0.17999999999999999 | P65: 82.51 | Q65: 52天 | R65: 5.62年 | S65: 3.63年 | T65: 6.47 | U65: 15 | V65: 2.4e-002 | W65: 0.14000000000000001 | X65: 0.115 | Y65: 46 | Z65: 2.73 | AA65: 4.0099999999999997e-002 | AB65: 3.3399999999999999e-002 | AC65: 1.7399999999999999e-002 | AD65: 1.5300000000000001e-002 | AE65: 81.95 | AF65: 85.39 | AG65: 0.51 | AH65: AA- | AI65: 6.5299999999999997e-002 | AJ65: =H65+100*O65 -> 115.40000000000001 | AK65: 112.3 | AL65: 39 | AM65: 26.9 | AN65: 104 | AO65: -0.13200000000000001 | AP65: 11 | AQ65: 祥鑫转债!
A66: 281 | B66: 113525 | C66: 台华转债! | D66: 603055 | E66: 台华新材 | F66: 服装纺织 | G66: 纺织行业 | H66: 99.31 | I66: 0. | J66: 2.5000000000000001e-003 | K66: 5.97 | L66: 1.0200000000000001e-002 | M66: 114.3 | N66: 7.83 | O66: 0.30299999999999999 | P66: 76.25 | Q66: 转股中 | R66: 3.67年 | S66: 1.67年 | T66: 4.69 | U66: 1.4 | V66: 3.0000000000000001e-003 | W66: 9.4e-002 | X66: 7.2000000000000008e-002 | Y66: 50 | Z66: 1.69 | AA66: 3.9800000000000002e-002 | AB66: 3.2400000000000005e-002 | AC66: 1.9099999999999999e-002 | AD66: 1.6e-002 | AE66: 95.24 | AF66: 98.29 | AG66: 0.24 | AH66: AA | AI66: 4.2800000000000005e-002 | AJ66: =H66+100*O66 -> 129.61000000000001 | AK66: 122.4 | AL66: 134 | AM66: 24.1 | AN66: 67 | AO66: -1.2e-002 | AP66: 21 | AQ66: 台华转债!
A67: 235 | B67: 128072 | C67: 翔鹭转债! | D67: 2842 | E67: 翔鹭钨业 | F67: 有色金属 | G67: 小金属 | H67: 97.518 | I67: -1.9e-003 | J67: 3.9000000000000003e-003 | K67: 9.5 | L67: 9.5999999999999992e-003 | M67: 115.1 | N67: 15.34 | O67: 0.57499999999999996 | P67: 61.93 | Q67: 转股中 | R67: 4.34年 | S67: 2.35年 | T67: 3.02 | U67: 4.4 | V67: 1.4999999999999999e-002 | W67: 0.11599999999999999 | X67: 7.2000000000000008e-002 | Y67: 26 | Z67: 2.86 | AA67: 3.9800000000000002e-002 | AB67: 3.3099999999999997e-002 | AC67: 2.4e-002 | AD67: 2.12e-002 | AE67: 88.7 | AF67: 88.51 | AG67: 0.22 | AH67: AA- | AI67: 6.3799999999999996e-002 | AJ67: =H67+100*O67 -> 155.018 | AK67: 133.1 | AL67: 235 | AM67: 44.4 | AN67: 251 | AO67: -2.4e-002 | AP67: 27 | AQ67: 翔鹭转债!
A68: 233 | B68: 128073 | C68: 哈尔转债! | D68: 2615 | E68: 哈尔斯 | F68: 其他 | G68: 家居用品 | H68: 101.43 | I68: 6.3e-003 | J68: 6.5000000000000006e-003 | K68: 4.28 | L68: 4.6500000000000007e-002 | M68: 115.3 | N68: 5.7 | O68: 0.35100000000000003 | P68: 75.09 | Q68: 转股中 | R68: 3.35年 | S68: 1.35年 | T68: 2.99 | U68: 104 | V68: 0.34000000000000002 | W68: 0.16899999999999998 | X68: 0.127 | Y68: 18 | Z68: 2.21 | AA68: 3.9599999999999996e-002 | AB68: 3.1099999999999999e-002 | AC68: 4.0999999999999995e-003 | AD68: 1.4000000000000002e-003 | AE68: 92.97 | AF68: 94.04 | AG68: 0.27 | AH68: AA- | AI68: 6.3799999999999996e-002 | AJ68: =H68+100*O68 -> 136.53 | AK68: 127.8 | AL68: 188 | AM68: 33.7 | AN68: 170 | AO68: 5.4000000000000006e-002 | AP68: 40 | AQ68: 哈尔转债!
A69: 187 | B69: 113566 | C69: 翔港转债! | D69: 603499 | E69: 翔港科技 | F69: 造纸包装 | G69: 包装材料 | H69: 103.26 | I69: -1.9e-003 | J69: -2.0000000000000001e-004 | K69: 8.63 | L69: -4.5999999999999999e-003 | M69: 124 | N69: 10.77 | O69: 0.28899999999999998 | P69: 80.13 | Q69: 转股中 | R69: 4.87年 | S69: 2.87年 | T69: 1.61 | U69: 7.6 | V69: 4.5999999999999999e-002 | W69: 9.3000000000000013e-002 | X69: 7.400000000000001e-002 | Y69: 17 | Z69: 3.04 | AA69: 3.9199999999999999e-002 | AB69: 3.0499999999999999e-002 | AC69: 2.8999999999999998e-003 | AD69: 2.0000000000000001e-004 | AE69: 83.88 | AF69: 87.97 | AG69: 0.47 | AH69: A+ | AI69: 7.4800000000000005e-002 | AJ69: =H69+100*O69 -> 132.16 | AK69: 126.4 | AL69: 173 | AM69: 38.4 | AN69: 214 | AO69: 3.7999999999999999e-002 | AP69: 28 | AQ69: 翔港转债!
A70: 302 | B70: 127007 | C70: 湖广转债! | D70: 665 | E70: 湖北广电 | F70: 传媒娱乐 | G70: 影视娱乐 | H70: 99.599 | I70: 4.0000000000000001e-003 | J70: 1.e-004 | K70: 4.09 | L70: 2.2499999999999999e-002 | M70: 112.3 | N70: 5.58 | O70: 0.35899999999999999 | P70: 73.3 | Q70: 转股中 | R70: 3.20年 | S70: 1.20年 | T70: 12.2 | U70: 2.9 | V70: 2.e-003 | W70: 0.30299999999999999 | X70: 0.222 | Y70: 40 | Z70: 0.62 | AA70: 3.9100000000000003e-002 | AB70: 3.1600000000000003e-002 | AC70: 2.3700000000000002e-002 | AD70: 1.95e-002 | AE70: 97.39 | AF70: 99.1 | AG70: 0.18 | AH70: AA+ | AI70: 4.0800000000000003e-002 | AJ70: =H70+100*O70 -> 135.499 | AK70: 125.9 | AL70: 165 | AM70: 26.8 | AN70: 103 | AO70: 4.5999999999999999e-002 | AP70: 17 | AQ70: 湖广转债!
A71: 37 | B71: 123085 | C71: 万顺转2! | D71: 300057 | E71: 万顺新材 | F71: 有色金属 | G71: 铝金属 | H71: 91.599 | I71: 1.21e-002 | J71: 6.0999999999999995e-003 | K71: 4.79 | L71: 3.6799999999999999e-002 | M71: 113.3 | N71: 6.24 | O71: 0.193 | P71: 76.76 | Q71: 2月2天 | R71: 5.65年 | S71: 3.66年 | T71: 9 | U71: 112 | V71: 0.13600000000000001 | W71: 0.27899999999999997 | X71: 0.214 | Y71: 32 | Z71: 0.89 | AA71: 3.9100000000000003e-002 | AB71: 3.4500000000000003e-002 | AC71: 3.3599999999999998e-002 | AD71: 3.15e-002 | AE71: 81.71 | AF71: 79.82 | AG71: 0.5 | AH71: AA- | AI71: 6.5299999999999997e-002 | AJ71: =H71+100*O71 -> 110.899 | AK71: 106.4 | AL71: 12 | AM71: 24.7 | AN71: 77 | AO71: 1.8000000000000002e-002 | AP71: 16 | AQ71: 万顺转2!
A72: 275 | B72: 128056 | C72: 今飞转债! | D72: 2863 | E72: 今飞凯达 | F72: 汽车 | G72: 零部件制 | H72: 104.2 | I72: 3.4000000000000002e-003 | J72: 5.1999999999999998e-003 | K72: 5.41 | L72: 2.0799999999999999e-002 | M72: 120.2 | N72: 6.7 | O72: 0.28999999999999998 | P72: 80.75 | Q72: 转股中 | R72: 3.87年 | S72: 1.87年 | T72: 1.72 | U72: 12 | V72: 6.6000000000000003e-002 | W72: 6.4000000000000001e-002 | X72: 5.0999999999999997e-002 | Y72: 27 | Z72: 1.83 | AA72: 3.8399999999999997e-002 | AB72: 2.8999999999999998e-002 | AC72: -4.0000000000000001e-003 | AD72: -7.1999999999999998e-003 | AE72: 89.35 | AF72: 91.45 | AG72: 0.41 | AH72: A+ | AI72: 7.4800000000000005e-002 | AJ72: =H72+100*O72 -> 133.19999999999999 | AK72: 127.7 | AL72: 183 | AM72: 36.2 | AN72: 192 | AO72: 1.2e-002 | AP72: 55 | AQ72: 今飞转债!
A73: 124 | B73: 123059 | C73: 银信转债! | D73: 300231 | E73: 银信科技 | F73: 计算机及 | G73: 软件开发 | H73: 102.255 | I73: 2.3e-003 | J73: 7.0999999999999995e-003 | K73: 7.83 | L73: 2.0899999999999998e-002 | M73: 124.1 | N73: 9.72 | O73: 0.26899999999999996 | P73: 80.56 | Q73: 转股中 | R73: 5.24年 | S73: 3.25年 | T73: 3.91 | U73: 1 | V73: 3.0000000000000001e-003 | W73: 0.113 | X73: 9.0999999999999998e-002 | Y73: 35 | Z73: 2.58 | AA73: 3.8399999999999997e-002 | AB73: 3.0299999999999997e-002 | AC73: 5.1000000000000004e-003 | AD73: 2.8000000000000004e-003 | AE73: 84.04 | AF73: 89.71 | AG73: 0.45 | AH73: AA- | AI73: 6.5299999999999997e-002 | AJ73: =H73+100*O73 -> 129.155 | AK73: 124 | AL73: 147 | AM73: 34.2 | AN73: 175 | AO73: -2.4e-002 | AP73: 14 | AQ73: 银信转债!
A74: 108 | B74: 123063 | C74: 大禹转债 | D74: 300021 | E74: 大禹节水 | F74: 化工 | G74: 橡胶塑料 | H74: 105.235 | I74: 1.1200000000000002e-002 | J74: -5.1000000000000004e-003 | K74: 4.9 | L74: 1.03e-002 | M74: 126.5 | N74: 4.94 | O74: 6.0999999999999999e-002 | P74: 99.19 | Q74: 转股中 | R74: 5.28年 | S74: 4.28年 | T74: 6.38 | U74: 3.7 | V74: 6.0000000000000001e-003 | W74: 0.16300000000000001 | X74: 0.16200000000000001 | Y74: 39 | Z74: 2.71 | AA74: 3.6299999999999999e-002 | AB74: 2.76e-002 | AC74: 3.8e-003 | AD74: 8.0000000000000004e-004 | AE74: 81.2 | AF74: 91.27 | AG74: 0.6 | AH74: AA- | AI74: 6.5299999999999997e-002 | AJ74: =H74+100*O74 -> 111.33499999999999 | AK74: 111.3 | AL74: 33 | AM74: 20 | AN74: 40 | AO74: -4.0999999999999995e-002 | AP74: 16 | AQ74: 大禹转债
A75: 336 | B75: 113014 | C75: 林洋转债! | D75: 601222 | E75: 林洋能源 | F75: 能源电力 | G75: 电力设备 | H75: 100.05 | I75: 1.e-003 | J75: 3.0999999999999999e-003 | K75: 6.89 | L75: 1.77e-002 | M75: 109.3 | N75: 8.54 | O75: 0.23999999999999999 | P75: 80.68 | Q75: 转股中 | R75: 2.53年 | S75: 0.53年 | T75: 30 | U75: 14 | V75: 5.0000000000000001e-003 | W75: 0.249 | X75: 0.20100000000000001 | Y75: 120 | Z75: 1.16 | AA75: 3.6200000000000003e-002 | AB75: 2.8999999999999998e-002 | AC75: 2.52e-002 | AD75: 2.e-002 | AE75: 98.97 | AF75: 98.84 | AG75: 0.23 | AH75: AA | AI75: 4.1299999999999996e-002 | AJ75: =H75+100*O75 -> 124.05 | AK75: 119.4 | AL75: 98 | AM75: 20.4 | AN75: 43 | AO75: -3.3000000000000002e-002 | AP75: 29 | AQ75: 林洋转债!
A76: 134 | B76: 128116 | C76: 瑞达转债! | D76: 2961 | E76: 瑞达期货 | F76: 金融 | G76: 期货行业 | H76: 96.265 | I76: 4.3e-003 | J76: 6.9999999999999993e-003 | K76: 22.16 | L76: 3.5499999999999997e-002 | M76: 115.3 | N76: 29.82 | O76: 0.29499999999999998 | P76: 74.31 | Q76: 转股中 | R76: 5.20年 | S76: 3.20年 | T76: 6.5 | U76: 5.6 | V76: 9.0000000000000011e-003 | W76: 6.6000000000000003e-002 | X76: 4.9000000000000002e-002 | Y76: 99 | Z76: 5.27 | AA76: 3.61e-002 | AB76: 3.0499999999999999e-002 | AC76: 2.2599999999999999e-002 | AD76: 2.0400000000000001e-002 | AE76: 89.76 | AF76: 92.46 | AG76: 0.32 | AH76: AA | AI76: 4.4299999999999999e-002 | AJ76: =H76+100*O76 -> 125.765 | AK76: 118.2 | AL76: 88 | AM76: 25.8 | AN76: 87 | AO76: 3.7999999999999999e-002 | AP76: 17 | AQ76: 瑞达转债!
A77: 326 | B77: 128025 | C77: 特一转债! | D77: 2728 | E77: 特一药业 | F77: 医药 | G77: 化学制药 | H77: 99.287 | I77: 8.9999999999999998e-004 | J77: -1.1999999999999999e-003 | K77: 11.23 | L77: -1.8e-003 | M77: 108.8 | N77: 14.7 | O77: 0.29999999999999999 | P77: 76.39 | Q77: 转股中 | R77: 2.64年 | S77: 0.64年 | T77: 2.99 | U77: 2.5 | V77: 8.0000000000000002e-003 | W77: 0.13100000000000001 | X77: 0.10000000000000001 | Y77: 23 | Z77: 2.26 | AA77: 3.5799999999999998e-002 | AB77: 2.92e-002 | AC77: 2.8399999999999998e-002 | AD77: 2.4500000000000001e-002 | AE77: 96.72 | AF77: 92.97 | AG77: 0.2 | AH77: AA- | AI77: 6.2300000000000001e-002 | AJ77: =H77+100*O77 -> 129.28700000000001 | AK77: 122.2 | AL77: 133 | AM77: 25.5 | AN77: 84 | AO77: 9.0000000000000011e-003 | AP77: 54 | AQ77: 特一转债!
A78: 144 | B78: 123053 | C78: 宝通转债! | D78: 300031 | E78: 宝通科技 | F78: 通信互联 | G78: 互联网 | H78: 101.852 | I78: -1.5e-003 | J78: 4.5000000000000005e-003 | K78: 15.16 | L78: 8.0000000000000002e-003 | M78: 121.3 | N78: 20.8 | O78: 0.39700000000000002 | P78: 72.88 | Q78: 转股中 | R78: 5年49天 | S78: 3年50天 | T78: 5 | U78: 0.8 | V78: 2.e-003 | W78: 8.3000000000000004e-002 | X78: 6.0999999999999999e-002 | Y78: 60 | Z78: 2.09 | AA78: 3.5499999999999997e-002 | AB78: 2.7999999999999997e-002 | AC78: 7.0999999999999995e-003 | AD78: 4.5999999999999999e-003 | AE78: 84.81 | AF78: 88.36 | AG78: 0.38 | AH78: AA- | AI78: 6.5299999999999997e-002 | AJ78: =H78+100*O78 -> 141.55200000000002 | AK78: 130.8 | AL78: 214 | AM78: 42.5 | AN78: 237 | AO78: -4.5999999999999999e-002 | AP78: 10 | AQ78: 宝通转债!
A79: 74 | B79: 123071 | C79: 天能转债! | D79: 300569 | E79: 天能重工 | F79: 能源电力 | G79: 风能 | H79: 100.279 | I79: 6.1999999999999998e-003 | J79: -7.000000000000001e-004 | K79: 13.23 | L79: 1.6899999999999998e-002 | M79: 121.1 | N79: 20.05 | O79: 0.52000000000000002 | P79: 65.99 | Q79: 11天 | R79: 5.51年 | S79: 3.52年 | T79: 7 | U79: 1.7 | V79: 2.e-003 | W79: 0.13500000000000001 | X79: 8.900000000000001e-002 | Y79: 52 | Z79: 2.35 | AA79: 3.5499999999999997e-002 | AB79: 2.87e-002 | AC79: 1.01e-002 | AD79: 7.9000000000000008e-003 | AE79: 82.61 | AF79: 86.08 | AG79: 0.32 | AH79: AA- | AI79: 6.5299999999999997e-002 | AJ79: =H79+100*O79 -> 152.279 | AK79: 134.6 | AL79: 248 | AM79: 48.5 | AN79: 275 | AO79: -7.400000000000001e-002 | AP79: 11 | AQ79: 天能转债!
A80: 286 | B80: 128049 | C80: 华源转债! | D80: 2787 | E80: 华源控股 | F80: 造纸包装 | G80: 包装材料 | H80: 101.267 | I80: 2.7000000000000001e-003 | J80: -1.2999999999999999e-003 | K80: 6.2 | L80: 3.2000000000000002e-003 | M80: 114.5 | N80: 7.42 | O80: 0.21199999999999999 | P80: 83.56 | Q80: 转股中 | R80: 3.61年 | S80: 1.62年 | T80: 3.63 | U80: 0.9 | V80: 3.0000000000000001e-003 | W80: 0.185 | X80: 0.155 | Y80: 20 | Z80: 1.31 | AA80: 3.5299999999999998e-002 | AB80: 2.7699999999999999e-002 | AC80: 8.6999999999999994e-003 | AD80: 5.6000000000000008e-003 | AE80: 92.18 | AF80: 91.97 | AG80: 0.42 | AH80: AA- | AI80: 6.3799999999999996e-002 | AJ80: =H80+100*O80 -> 122.467 | AK80: 119 | AL80: 93 | AM80: 26.8 | AN80: 102 | AO80: 2.8999999999999998e-002 | AP80: 47 | AQ80: 华源转债!
A81: 29 | B81: 123089 | C81: 九洲转2! | D81: 300040 | E81: 九洲集团 | F81: 能源电力 | G81: 电力设备 | H81: 99.807 | I81: 7.0999999999999995e-003 | J81: -2.0999999999999999e-003 | K81: 7.36 | L81: 8.199999999999999e-003 | M81: 121 | N81: 8 | O81: 8.5000000000000006e-002 | P81: 92 | Q81: 2月10天 | R81: 5.68年 | S81: 3.68年 | T81: 5 | U81: 7.3 | V81: 1.4999999999999999e-002 | W81: 0.17899999999999999 | X81: 0.16399999999999998 | Y81: 28 | Z81: 1.28 | AA81: 3.5200000000000002e-002 | AB81: 2.8500000000000001e-002 | AC81: 1.0700000000000001e-002 | AD81: 8.6e-003 | AE81: 81.66 | AF81: 85.09 | AG81: 0.6 | AH81: AA- | AI81: 6.5299999999999997e-002 | AJ81: =H81+100*O81 -> 108.307 | AK81: 107.6 | AL81: 15 | AM81: 22.5 | AN81: 58 | AO81: -5.0999999999999997e-002 | AP81: 15 | AQ81: 九洲转2!
A82: 264 | B82: 123024 | C82: 岱勒转债! | D82: 300700 | E82: 岱勒新材 | F82: 机械装备 | G82: 专用设备 | H82: 101.836 | I82: 1.37e-002 | J82: 0. | K82: 15.9 | L82: 3.1099999999999999e-002 | M82: 112.5 | N82: 18.33 | O82: 0.17399999999999999 | P82: 86.74 | Q82: 转股中 | R82: 2.93年 | S82: 0.93年 | T82: 2.1 | U82: 5.3 | V82: 2.5000000000000001e-002 | W82: 0.16 | X82: 0.13900000000000001 | Y82: 13 | Z82: 2.65 | AA82: 3.5000000000000003e-002 | AB82: 2.69e-002 | AC82: -5.3e-003 | AD82: -7.4999999999999997e-003 | AE82: 93.71 | AF82: 91.66 | AG82: 0.44 | AH82: A+ | AI82: 7.3300000000000004e-002 | AJ82: =H82+100*O82 -> 119.23599999999999 | AK82: 116.9 | AL82: 72 | AM82: 23.2 | AN82: 64 | AO82: 0. | AP82: 35 | AQ82: 岱勒转债!
A83: 340 | B83: 128014 | C83: 永东转债! | D83: 2753 | E83: 永东股份 | F83: 化工 | G83: 化工 | H83: 104.08 | I83: -1.7000000000000001e-003 | J83: 1.7000000000000001e-003 | K83: 8.18 | L83: 7.4000000000000003e-003 | M83: 111.3 | N83: 12.6 | O83: 0.60299999999999998 | P83: 64.92 | Q83: 转股中 | R83: 2年1.1天 | S83: 1.1天 | T83: 3.37 | U83: 2.3 | V83: 6.9999999999999993e-003 | W83: 0.11 | X83: 7.0999999999999994e-002 | Y83: 31 | Z83: 1.74 | AA83: 3.4799999999999998e-002 | AB83: 2.4e-002 | AC83: -0.14599999999999999 | AD83: -0.16800000000000001 | AE83: 100.78 | AF83: 98.88 | AG83: 0 | AH83: AA- | AI83: 6.2300000000000001e-002 | AJ83: =H83+100*O83 -> 164.38 | AK83: 143.2 | AL83: 282 | AM83: 42.5 | AN83: 238 | AO83: 3.5000000000000003e-002 | AP83: 39 | AQ83: 永东转债!
A84: 122 | B84: 128120 | C84: 联诚转债! | D84: 2921 | E84: 联诚精密 | F84: 汽车 | G84: 零部件制 | H84: 99.498 | I84: 9.1000000000000004e-003 | J84: 5.6000000000000008e-003 | K84: 21.19 | L84: 2.2700000000000001e-002 | M84: 118.4 | N84: 24.37 | O84: 0.14400000000000002 | P84: 86.95 | Q84: 转股中 | R84: 5.25年 | S84: 3.25年 | T84: 2.6 | U84: 3.2 | V84: 1.2e-002 | W84: 0.14999999999999999 | X84: 0.13100000000000001 | Y84: 17 | Z84: 2.27 | AA84: 3.4500000000000003e-002 | AB84: 2.81e-002 | AC84: 1.4800000000000001e-002 | AD84: 1.2199999999999999e-002 | AE84: 79.11 | AF84: 77.55 | AG84: 0.65 | AH84: A | AI84: 8.6300000000000002e-002 | AJ84: =H84+100*O84 -> 113.89800000000001 | AK84: 112 | AL84: 38 | AM84: 32.9 | AN84: 162 | AO84: 4.4000000000000004e-002 | AP84: 18 | AQ84: 联诚转债!
A85: 163 | B85: 113576 | C85: 起步转债!! | D85: 603557 | E85: 起步股份 | F85: 服装纺织 | G85: 鞋服行业 | H85: 102.95 | I85: 1.1599999999999999e-002 | J85: 7.0999999999999995e-003 | K85: 9.5 | L85: 3.49e-002 | M85: 121.3 | N85: 10.55 | O85: 0.14300000000000002 | P85: 90.05 | Q85: 转股中 | R85: 4.98年 | S85: 2.98年 | T85: 2.66 | U85: 112 | V85: 0.40799999999999997 | W85: 5.5999999999999994e-002 | X85: 5.0999999999999997e-002 | Y85: 47 | Z85: 2.8 | AA85: 3.4200000000000001e-002 | AB85: 2.6600000000000002e-002 | AC85: 3.9000000000000003e-003 | AD85: 1.2999999999999999e-003 | AE85: 85.94 | AF85: 89.76 | AG85: 0.53 | AH85: AA- | AI85: 6.3799999999999996e-002 | AJ85: =H85+100*O85 -> 117.25 | AK85: 115.9 | AL85: 63 | AM85: 26.1 | AN85: 95 | AO85: -6.9999999999999993e-003 | AP85: 27 | AQ85: 起步转债!!
A86: 90 | B86: 123065 | C86: 宝莱转债! | D86: 300246 | E86: 宝莱特 | F86: 医药 | G86: 医疗器械 | H86: 101.805 | I86: -1.e-004 | J86: 2.2000000000000001e-003 | K86: 22.58 | L86: 1.0700000000000001e-002 | M86: 121.4 | N86: 40.54 | O86: 0.82799999999999996 | P86: 55.7 | Q86: 转股中 | R86: 5.38年 | S86: 3.39年 | T86: 2.19 | U86: 9.3 | V86: 4.2000000000000003e-002 | W86: 6.6000000000000003e-002 | X86: 3.7000000000000005e-002 | Y86: 33 | Z86: 3.82 | AA86: 3.4000000000000002e-002 | AB86: 2.69e-002 | AC86: 6.9999999999999993e-003 | AD86: 4.5999999999999999e-003 | AE86: 83.54 | AF86: 87.03 | AG86: 0.19 | AH86: AA- | AI86: 6.5299999999999997e-002 | AJ86: =H86+100*O86 -> 184.60500000000002 | AK86: 147.9 | AL86: 298 | AM86: 60.9 | AN86: 307 | AO86: -5.5999999999999994e-002 | AP86: 15 | AQ86: 宝莱转债!
A87: 132 | B87: 123057 | C87: 美联转债! | D87: 300586 | E87: 美联新材 | F87: 化工 | G87: 橡胶塑料 | H87: 99.96 | I87: 5.5000000000000005e-003 | J87: 6.5000000000000006e-003 | K87: 8.01 | L87: 2.4300000000000002e-002 | M87: 118.2 | N87: 9.91 | O87: 0.23699999999999999 | P87: 80.83 | Q87: 转股中 | R87: 5.21年 | S87: 3.21年 | T87: 2.07 | U87: 4 | V87: 2.e-002 | W87: 5.7000000000000002e-002 | X87: 4.5999999999999999e-002 | Y87: 37 | Z87: 4.91 | AA87: 3.3500000000000002e-002 | AB87: 2.7000000000000003e-002 | AC87: 1.23e-002 | AD87: 9.8999999999999991e-003 | AE87: 84.33 | AF87: 85.71 | AG87: 0.49 | AH87: AA- | AI87: 6.5299999999999997e-002 | AJ87: =H87+100*O87 -> 123.66 | AK87: 119.1 | AL87: 95 | AM87: 33.4 | AN87: 167 | AO87: 1.1000000000000001e-002 | AP87: 15 | AQ87: 美联转债!
A88: 208 | B88: 128087 | C88: 孚日转债! | D88: 2083 | E88: 孚日股份 | F88: 服装纺织 | G88: 家纺 | H88: 97.139 | I88: 5.6000000000000008e-003 | J88: -3.3e-003 | K88: 4.18 | L88: 1.21e-002 | M88: 112.9 | N88: 6.3 | O88: 0.46399999999999997 | P88: 66.35 | Q88: 转股中 | R88: 4.67年 | S88: 2.67年 | T88: 6.5 | U88: 13 | V88: 2.1000000000000001e-002 | W88: 0.17100000000000001 | X88: 0.114 | Y88: 38 | Z88: 1.01 | AA88: 3.3399999999999999e-002 | AB88: 2.81e-002 | AC88: 2.2499999999999999e-002 | AD88: 2.e-002 | AE88: 91.91 | AF88: 93.2 | AG88: 0.19 | AH88: AA | AI88: 4.2800000000000005e-002 | AJ88: =H88+100*O88 -> 143.53899999999999 | AK88: 127.9 | AL88: 189 | AM88: 34.7 | AN88: 178 | AO88: 0. | AP88: 54 | AQ88: 孚日转债!
A89: 129 | B89: 113036 | C89: 宁建转债! | D89: 601789 | E89: 宁波建工 | F89: 建筑 | G89: 建筑工程 | H89: 99.26 | I89: 3.4000000000000002e-003 | J89: 4.0000000000000001e-003 | K89: 3.84 | L89: 2.1299999999999999e-002 | M89: 117.3 | N89: 4.86 | O89: 0.25600000000000001 | P89: 79.01 | Q89: 转股中 | R89: 5.22年 | S89: 3.22年 | T89: 5.4 | U89: 0.5 | V89: 1.e-003 | W89: 0.14400000000000002 | X89: 0.114 | Y89: 37 | Z89: 1.26 | AA89: 3.32e-002 | AB89: 2.7099999999999999e-002 | AC89: 1.34e-002 | AD89: 1.1200000000000002e-002 | AE89: 89.77 | AF89: 93.99 | AG89: 0.35 | AH89: AA | AI89: 4.4299999999999999e-002 | AJ89: =H89+100*O89 -> 124.86000000000001 | AK89: 119.5 | AL89: 100 | AM89: 25.5 | AN89: 85 | AO89: -6.0000000000000001e-003 | AP89: 8 | AQ89: 宁建转债!
A90: 266 | B90: 110056 | C90: 亨通转债! | D90: 600487 | E90: 亨通光电 | F90: 通信互联 | G90: 通信设备 | H90: 100.86 | I90: 3.4999999999999996e-003 | J90: -5.0000000000000001e-004 | K90: 12.17 | L90: 1.e-002 | M90: 114.3 | N90: 15.01 | O90: 0.24399999999999999 | P90: 81.08 | Q90: 转股中 | R90: 3.92年 | S90: 1.92年 | T90: 17.1 | U90: 5 | V90: 3.0000000000000001e-003 | W90: 5.9000000000000004e-002 | X90: 4.8000000000000001e-002 | Y90: 287 | Z90: 1.57 | AA90: 3.3000000000000002e-002 | AB90: 2.6099999999999998e-002 | AC90: 9.1999999999999998e-003 | AD90: 6.6e-003 | AE90: 94.61 | AF90: 97.98 | AG90: 0.3 | AH90: AA+ | AI90: 4.0800000000000003e-002 | AJ90: =H90+100*O90 -> 125.25999999999999 | AK90: 120.6 | AL90: 109 | AM90: 22.7 | AN90: 60 | AO90: -6.9999999999999993e-003 | AP90: 30 | AQ90: 亨通转债!
A91: 82 | B91: 113604 | C91: 多伦转债! | D91: 603528 | E91: 多伦科技 | F91: 计算机及 | G91: 软件开发 | H91: 98.6 | I91: 1.3500000000000002e-002 | J91: 1.83e-002 | K91: 7.99 | L91: 6.8199999999999997e-002 | M91: 117.3 | N91: 10.44 | O91: 0.28800000000000003 | P91: 76.53 | Q91: 3.1天 | R91: 5.49年 | S91: 3.49年 | T91: 6.4 | U91: 4.1 | V91: 6.9999999999999993e-003 | W91: 0.128 | X91: 9.8000000000000004e-002 | Y91: 50 | Z91: 3.1 | AA91: 3.2799999999999996e-002 | AB91: 2.7000000000000003e-002 | AC91: 1.43e-002 | AD91: 1.2199999999999999e-002 | AE91: 82.55 | AF91: 83.47 | AG91: 0.47 | AH91: AA- | AI91: 6.5299999999999997e-002 | AJ91: =H91+100*O91 -> 127.40000000000001 | AK91: 120.7 | AL91: 110 | AM91: 37.2 | AN91: 204 | AO91: 2.4e-002 | AP91: 6 | AQ91: 多伦转债!
A92: 216 | B92: 113549 | C92: 白电转债 | D92: 603861 | E92: 白云电器 | F92: 能源电力 | G92: 电力设备 | H92: 99.34 | I92: -5.8999999999999999e-003 | J92: -9.7999999999999997e-003 | K92: 7.89 | L92: -3.5499999999999997e-002 | M92: 114.8 | N92: 8.88 | O92: 0.11800000000000001 | P92: 88.85 | Q92: 转股中 | R92: 4.58年 | S92: 2.58年 | T92: 8.8 | U92: 11 | V92: 1.3000000000000001e-002 | W92: 0.252 | X92: 0.22399999999999998 | Y92: 35 | Z92: 1.49 | AA92: 3.27e-002 | AB92: 2.6600000000000002e-002 | AC92: 1.44e-002 | AD92: 1.2e-002 | AE92: 92.15 | AF92: 95.09 | AG92: 0.44 | AH92: AA | AI92: 4.2800000000000005e-002 | AJ92: =H92+100*O92 -> 111.14 | AK92: 109.8 | AL92: 25 | AM92: 14.7 | AN92: 10 | AO92: 4.0000000000000001e-003 | AP92: 36 | AQ92: 白电转债
A93: 170 | B93: 113574 | C93: 华体转债! | D93: 603679 | E93: 华体科技 | F93: 城市公用 | G93: 城市公用 | H93: 99.29 | I93: 5.0000000000000001e-003 | J93: -3.3e-003 | K93: 18.61 | L93: 1.09e-002 | M93: 115.9 | N93: 33.99 | O93: 0.81299999999999994 | P93: 54.75 | Q93: 转股中 | R93: 4.95年 | S93: 2.96年 | T93: 2.09 | U93: 3.6 | V93: 1.7000000000000001e-002 | W93: 7.9000000000000001e-002 | X93: 4.2999999999999997e-002 | Y93: 27 | Z93: 3.63 | AA93: 3.2400000000000005e-002 | AB93: 2.64e-002 | AC93: 1.5300000000000001e-002 | AD93: 1.2699999999999999e-002 | AE93: 83.26 | AF93: 81.74 | AG93: 0.15 | AH93: A+ | AI93: 7.4800000000000005e-002 | AJ93: =H93+100*O93 -> 180.59 | AK93: 143.8 | AL93: 284 | AM93: 60.6 | AN93: 306 | AO93: 2.e-002 | AP93: 17 | AQ93: 华体转债!
A94: 167 | B94: 127016 | C94: 鲁泰转债! | D94: 726 | E94: 鲁 泰Ａ | F94: 服装纺织 | G94: 纺织行业 | H94: 99.351 | I94: 2.e-003 | J94: 3.0999999999999999e-003 | K94: 6.26 | L94: 2.29e-002 | M94: 115.9 | N94: 8.91 | O94: 0.41399999999999998 | P94: 70.26 | Q94: 转股中 | R94: 4.98年 | S94: 2.98年 | T94: 14 | U94: 0.4 | V94: 0. | W94: 0.26100000000000001 | X94: 0.183 | Y94: 54 | Z94: 0.71 | AA94: 3.2000000000000001e-002 | AB94: 2.6099999999999998e-002 | AC94: 1.29e-002 | AD94: 1.0700000000000001e-002 | AE94: 91.26 | AF94: 95.32 | AG94: 0.22 | AH94: AA+ | AI94: 4.0800000000000003e-002 | AJ94: =H94+100*O94 -> 140.751 | AK94: 128.4 | AL94: 194 | AM94: 33.1 | AN94: 164 | AO94: -5.5999999999999994e-002 | AP94: 22 | AQ94: 鲁泰转债!
A95: 40 | B95: 127027 | C95: 靖远转债! | D95: 552 | E95: 靖远煤电 | F95: 煤炭 | G95: 煤炭开采 | H95: 97 | I95: 1.32e-002 | J95: -8.0000000000000002e-003 | K95: 3.02 | L95: 1.e-002 | M95: 115.3 | N95: 3.33 | O95: 7.0000000000000007e-002 | P95: 90.69 | Q95: 2月1天 | R95: 5.65年 | S95: 3.65年 | T95: 28 | U95: 91 | V95: 3.4000000000000002e-002 | W95: 0.40500000000000003 | X95: 0.36799999999999999 | Y95: 69 | Z95: 0.87 | AA95: 3.1699999999999999e-002 | AB95: 2.6600000000000002e-002 | AC95: 1.8100000000000002e-002 | AD95: 1.61e-002 | AE95: 88.75 | AF95: 91.65 | AG95: 0.52 | AH95: AA+ | AI95: 4.2300000000000004e-002 | AJ95: =H95+100*O95 -> 104. | AK95: 103.3 | AL95: 4 | AM95: 11.7 | AN95: 6 | AO95: 3.6000000000000004e-002 | AP95: 25 | AQ95: 靖远转债!
A96: 8 | B96: 113620 | C96: 傲农转债 | D96: 603363 | E96: 傲农生物 | F96: 农业 | G96: 畜牧业 | H96: 101.06 | I96: 5.1000000000000004e-003 | J96: -2.5999999999999999e-003 | K96: 13.1 | L96: 5.4000000000000003e-003 | M96: 121.1 | N96: 14.8 | O96: 0.14199999999999999 | P96: 88.51 | Q96: 5月3天 | R96: 5.90年 | S96: 3.90年 | T96: 10 | U96: 14 | V96: 1.3999999999999999e-002 | W96: 0.113 | X96: 0.10000000000000001 | Y96: 88 | Z96: 3.22 | AA96: 3.1699999999999999e-002 | AB96: 2.53e-002 | AC96: 6.1999999999999998e-003 | AD96: 4.4000000000000003e-003 | AE96: 86.99 | AF96: 94.18 | AG96: 0.46 | AH96: AA | AI96: 4.4299999999999999e-002 | AJ96: =H96+100*O96 -> 115.26000000000001 | AK96: 113.6 | AL96: 48 | AM96: 19.4 | AN96: 33 | AO96: -4.4999999999999998e-002 | AP96: 4 | AQ96: 傲农转债
A97: 241 | B97: 128070 | C97: 智能转债! | D97: 2877 | E97: 智能自控 | F97: 机械装备 | G97: 通用设备 | H97: 103.5 | I97: -8.1000000000000013e-003 | J97: -4.0000000000000002e-004 | K97: 7.21 | L97: -2.0400000000000001e-002 | M97: 117.6 | N97: 9.51 | O97: 0.36499999999999999 | P97: 75.81 | Q97: 转股中 | R97: 4.21年 | S97: 无权 | T97: 2.3 | U97: 15 | V97: 6.3e-002 | W97: 9.6000000000000002e-002 | X97: 7.2999999999999995e-002 | Y97: 24 | Z97: 3.36 | AA97: 3.1600000000000003e-002 | AB97: 2.3900000000000001e-002 | AC97: 无权 | AD97: 无权 | AE97: 无权 | AF97: 87.5 | AG97: 0.42 | AH97: A+ | AI97: 7.4800000000000005e-002 | AJ97: =H97+100*O97 -> 140. | AK97: 131.2 | AL97: 217 | AM97: 43.7 | AN97: 245 | AO97: 2.7000000000000003e-002 | AP97: 30 | AQ97: 智能转债!
A98: 102 | B98: 127021 | C98: 特发转2! | D98: 70 | E98: 特发信息 | F98: 通信互联 | G98: 通信设备 | H98: 99.256 | I98: 1.1000000000000001e-003 | J98: 1.7000000000000001e-003 | K98: 7.17 | L98: 2.87e-002 | M98: 113.3 | N98: 12.33 | O98: 0.70700000000000007 | P98: 58.15 | Q98: 转股中 | R98: 4.31年 | S98: 2.31年 | T98: 5.5 | U98: 3.1 | V98: 6.0000000000000001e-003 | W98: 9.3000000000000013e-002 | X98: 5.4000000000000006e-002 | Y98: 59 | Z98: 2.06 | AA98: 3.1600000000000003e-002 | AB98: 2.58e-002 | AC98: 1.1299999999999999e-002 | AD98: 9.7000000000000003e-003 | AE98: 92.05 | AF98: 94.81 | AG98: 0.1 | AH98: AA | AI98: 4.2800000000000005e-002 | AJ98: =H98+100*O98 -> 169.95600000000002 | AK98: 140.4 | AL98: 277 | AM98: 45.6 | AN98: 257 | AO98: 2.4e-002 | AP98: 10 | AQ98: 特发转2!
A99: 18 | B99: 113042 | C99: 上银转债! | D99: 601229 | E99: 上海银行 | F99: 金融 | G99: 银行行业 | H99: 101.5 | I99: 4.0000000000000002e-004 | J99: 0. | K99: 8.3 | L99: 1.1999999999999999e-003 | M99: 120.9 | N99: 11.03 | O99: 0.34899999999999998 | P99: 75.25 | Q99: 3月14天 | R99: 5.78年 | S99: 无权 | T99: 200 | U99: 167 | V99: 8.0000000000000002e-003 | W99: 0.17000000000000001 | X99: 0.128 | Y99: 1179. | Z99: 0.71 | AA99: 3.1600000000000003e-002 | AB99: 2.5000000000000001e-002 | AC99: 无权 | AD99: 无权 | AE99: 无权 | AF99: 97.35 | AG99: 0.31 | AH99: AAA | AI99: 3.9300000000000002e-002 | AJ99: =H99+100*O99 -> 136.40000000000001 | AK99: 127.8 | AL99: 186 | AM99: 30.4 | AN99: 139 | AO99: -3.7999999999999999e-002 | AP99: 11 | AQ99: 上银转债!
A100: 23 | B100: 128143 | C100: 锋龙转债! | D100: 2931 | E100: 锋龙股份 | F100: 机械装备 | G100: 专用设备 | H100: 102.32 | I100: 1.4999999999999999e-002 | J100: 0. | K100: 17.07 | L100: 2.2200000000000001e-002 | M100: 121.7 | N100: 17.97 | O100: 7.6999999999999999e-002 | P100: 94.99 | Q100: 2月29天 | R100: 5.73年 | S100: 3.73年 | T100: 2.45 | U100: 17 | V100: 6.7000000000000004e-002 | W100: 0.10099999999999999 | X100: 9.6000000000000002e-002 | Y100: 24 | Z100: 4.21 | AA100: 3.1400000000000004e-002 | AB100: 2.4700000000000003e-002 | AC100: 5.7999999999999996e-003 | AD100: 3.4999999999999996e-003 | AE100: 78.82 | AF100: 80.66 | AG100: 0.68 | AH100: A+ | AI100: 7.6299999999999993e-002 | AJ100: =H100+100*O100 -> 110.02 | AK100: 109.6 | AL100: 23 | AM100: 29 | AN100: 123 | AO100: 9.1999999999999998e-002 | AP100: 10 | AQ100: 锋龙转债!
A101: 159 | B101: 123049 | C101: 维尔转债 | D101: 300190 | E101: 维尔利 | F101: 城市公用 | G101: 三废处理 | H101: 107 | I101: 1.2800000000000001e-002 | J101: -3.9000000000000003e-003 | K101: 7.3 | L101: 1.5300000000000001e-002 | M101: 124.3 | N101: 7.48 | O101: 9.6000000000000002e-002 | P101: 97.59 | Q101: 转股中 | R101: 4.99年 | S101: 2.99年 | T101: 9.17 | U101: 6.3 | V101: 6.0000000000000001e-003 | W101: 0.161 | X101: 0.157 | Y101: 57 | Z101: 1.33 | AA101: 3.1200000000000002e-002 | AB101: 2.2700000000000001e-002 | AC101: -8.3999999999999995e-003 | AD101: -1.09e-002 | AE101: 85.9 | AF101: 91.92 | AG101: 0.58 | AH101: AA- | AI101: 6.3799999999999996e-002 | AJ101: =H101+100*O101 -> 116.59999999999999 | AK101: 116.4 | AL101: 70 | AM101: 24.5 | AN101: 72 | AO101: -7.5999999999999998e-002 | AP101: 15 | AQ101: 维尔转债
A102: 244 | B102: 113027 | C102: 华钰转债!! | D102: 601020 | E102: 华钰矿业 | F102: 有色金属 | G102: 锌铅镍锡 | H102: 101.43 | I102: 1.e-003 | J102: -1.5e-003 | K102: 8.61 | L102: -1.1999999999999999e-003 | M102: 114.9 | N102: 10.17 | O102: 0.19800000000000001 | P102: 84.66 | Q102: 转股中 | R102: 4年58天 | S102: 2年59天 | T102: 3.25 | U102: 7.4 | V102: 2.2000000000000002e-002 | W102: 6.8000000000000005e-002 | X102: 5.7999999999999996e-002 | Y102: 48 | Z102: 1.97 | AA102: 3.1099999999999999e-002 | AB102: 2.4399999999999998e-002 | AC102: 8.3999999999999995e-003 | AD102: 5.5000000000000005e-003 | AE102: 89.69 | AF102: 89.35 | AG102: 0.47 | AH102: AA- | AI102: 6.3799999999999996e-002 | AJ102: =H102+100*O102 -> 121.23 | AK102: 118.2 | AL102: 87 | AM102: 28.5 | AN102: 119 | AO102: 8.0000000000000002e-003 | AP102: 44 | AQ102: 华钰转债!!
A103: 15 | B103: 123097 | C103: 美力转债 | D103: 300611 | E103: 美力科技 | F103: 机械装备 | G103: 通用设备 | H103: 102.265 | I103: 9.300000000000001e-003 | J103: 1.29e-002 | K103: 9.16 | L103: 3.27e-002 | M103: 121.6 | N103: 9.34 | O103: 4.2999999999999997e-002 | P103: 98.07 | Q103: 3月18天 | R103: 5.78年 | S103: 3.78年 | T103: 3 | U103: 10 | V103: 3.3000000000000002e-002 | W103: 0.183 | X103: 0.17899999999999999 | Y103: 16 | Z103: 2.54 | AA103: 3.1099999999999999e-002 | AB103: 2.4399999999999998e-002 | AC103: 5.7999999999999996e-003 | AD103: 3.4999999999999996e-003 | AE103: 78.51 | AF103: 80.28 | AG103: 0.68 | AH103: A+ | AI103: 7.6299999999999993e-002 | AJ103: =H103+100*O103 -> 106.565 | AK103: 106.5 | AL103: 13 | AM103: 26.2 | AN103: 96 | AO103: 3.1e-002 | AP103: 9 | AQ103: 美力转债
A104: 198 | B104: 113561 | C104: 正裕转债! | D104: 603089 | E104: 正裕工业 | F104: 汽车 | G104: 零部件制 | H104: 102.78 | I104: 6.8999999999999999e-003 | J104: 1.34e-002 | K104: 8.47 | L104: 3.7999999999999999e-002 | M104: 118 | N104: 10.23 | O104: 0.24100000000000002 | P104: 82.8 | Q104: 转股中 | R104: 4.71年 | S104: 2.71年 | T104: 1.5 | U104: 2.6 | V104: 1.7000000000000001e-002 | W104: 8.0000000000000002e-002 | X104: 6.6000000000000003e-002 | Y104: 19 | Z104: 2.03 | AA104: 3.0499999999999999e-002 | AB104: 2.35e-002 | AC104: 4.6999999999999993e-003 | AD104: 1.9e-003 | AE104: 84.86 | AF104: 84.73 | AG104: 0.53 | AH104: A+ | AI104: 7.4800000000000005e-002 | AJ104: =H104+100*O104 -> 126.88 | AK104: 122.8 | AL104: 138 | AM104: 37.9 | AN104: 208 | AO104: -0.11199999999999999 | AP104: 34 | AQ104: 正裕转债!
A105: 317 | B105: 123007 | C105: 道氏转债! | D105: 300409 | E105: 道氏技术 | F105: 建筑 | G105: 建筑行业 | H105: 101.901 | I105: 1.e-003 | J105: 1.9e-003 | K105: 12.25 | L105: 8.199999999999999e-003 | M105: 110.3 | N105: 14.55 | O105: 0.20999999999999999 | P105: 84.19 | Q105: 转股中 | R105: 2.70年 | S105: 0.70年 | T105: 3.04 | U105: 3.6 | V105: 1.1000000000000001e-002 | W105: 4.4999999999999998e-002 | X105: 3.7999999999999999e-002 | Y105: 68 | Z105: 2.33 | AA105: 3.0299999999999997e-002 | AB105: 2.29e-002 | AC105: -1.1000000000000001e-003 | AD105: -5.1999999999999998e-003 | AE105: 96.61 | AF105: 93.94 | AG105: 0.35 | AH105: AA- | AI105: 6.2300000000000001e-002 | AJ105: =H105+100*O105 -> 122.901 | AK105: 119.6 | AL105: 101 | AM105: 23 | AN105: 63 | AO105: -5.4000000000000006e-002 | AP105: 23 | AQ105: 道氏转债!
A106: 223 | B106: 110059 | C106: 浦发转债! | D106: 600000 | E106: 浦发银行 | F106: 金融 | G106: 银行行业 | H106: 103.11 | I106: 4.0000000000000002e-004 | J106: 2.e-003 | K106: 10.54 | L106: 1.0500000000000001e-002 | M106: 117.6 | N106: 14.45 | O106: 0.41399999999999998 | P106: 72.94 | Q106: 转股中 | R106: 4.53年 | S106: 无权 | T106: 500 | U106: 115 | V106: 2.e-003 | W106: 0.16200000000000001 | X106: 0.11800000000000001 | Y106: 3094. | Z106: 0.59 | AA106: 3.0299999999999997e-002 | AB106: 2.3099999999999999e-002 | AC106: 无权 | AD106: 无权 | AE106: 无权 | AF106: 99.89 | AG106: 0.23 | AH106: AAA | AI106: 3.78e-002 | AJ106: =H106+100*O106 -> 144.50999999999999 | AK106: 133.3 | AL106: 237 | AM106: 33.4 | AN106: 168 | AO106: -1.7000000000000001e-002 | AP106: 68 | AQ106: 浦发转债!
A107: 50 | B107: 113610 | C107: 灵康转债 | D107: 603669 | E107: 灵康药业 | F107: 医药 | G107: 化学制药 | H107: 102.75 | I107: -4.4000000000000003e-003 | J107: -1.3600000000000001e-002 | K107: 8.67 | L107: -2.7999999999999997e-002 | M107: 121.1 | N107: 8.81 | O107: 4.4000000000000004e-002 | P107: 98.41 | Q107: 52天 | R107: 5.62年 | S107: 3.63年 | T107: 5.25 | U107: 11 | V107: 2.1000000000000001e-002 | W107: 8.5000000000000006e-002 | X107: 8.4000000000000005e-002 | Y107: 62 | Z107: 4.53 | AA107: 3.0299999999999997e-002 | AB107: 2.3599999999999999e-002 | AC107: 3.3e-003 | AD107: 1.1999999999999999e-003 | AE107: 82.04 | AF107: 85.48 | AG107: 0.64 | AH107: AA- | AI107: 6.5299999999999997e-002 | AJ107: =H107+100*O107 -> 107.15000000000001 | AK107: 107.1 | AL107: 14 | AM107: 21.6 | AN107: 50 | AO107: 6.9999999999999993e-003 | AP107: 18 | AQ107: 灵康转债
A108: 34 | B108: 123087 | C108: 明电转债! | D108: 300739 | E108: 明阳电路 | F108: 电子 | G108: 元器件制 | H108: 102.71 | I108: -1.e-004 | J108: -1.5e-003 | K108: 15.9 | L108: -2.5000000000000001e-003 | M108: 121.2 | N108: 16.62 | O108: 7.400000000000001e-002 | P108: 95.67 | Q108: 2月6天 | R108: 5.66年 | S108: 4.67年 | T108: 6.73 | U108: 16 | V108: 2.3e-002 | W108: 0.152 | X108: 0.14499999999999999 | Y108: 44 | Z108: 3.23 | AA108: 3.0299999999999997e-002 | AB108: 2.3599999999999999e-002 | AC108: 8.1000000000000013e-003 | AD108: 5.4000000000000003e-003 | AE108: 79.02 | AF108: 85.36 | AG108: 0.63 | AH108: AA- | AI108: 6.5299999999999997e-002 | AJ108: =H108+100*O108 -> 110.11 | AK108: 109.8 | AL108: 24 | AM108: 24.4 | AN108: 71 | AO108: 5.0999999999999997e-002 | AP108: 7 | AQ108: 明电转债!
A109: 211 | B109: 128083 | C109: 新北转债! | D109: 2376 | E109: 新北洋 | F109: 电子 | G109: 电子产品 | H109: 100.302 | I109: 1.5e-003 | J109: 3.8e-003 | K109: 9.43 | L109: 1.5100000000000001e-002 | M109: 114.9 | N109: 11.7 | O109: 0.24399999999999999 | P109: 80.6 | Q109: 转股中 | R109: 4.66年 | S109: 2.66年 | T109: 8.77 | U109: 6 | V109: 6.9999999999999993e-003 | W109: 0.14000000000000001 | X109: 0.113 | Y109: 63 | Z109: 1.86 | AA109: 3.0200000000000001e-002 | AB109: 2.4199999999999999e-002 | AC109: 1.09e-002 | AD109: 8.5000000000000006e-003 | AE109: 91.96 | AF109: 94.9 | AG109: 0.35 | AH109: AA | AI109: 4.2800000000000005e-002 | AJ109: =H109+100*O109 -> 124.702 | AK109: 120 | AL109: 106 | AM109: 25.1 | AN109: 80 | AO109: 1.e-003 | AP109: 18 | AQ109: 新北转债!
A110: 273 | B110: 113021 | C110: 中信转债! | D110: 601998 | E110: 中信银行 | F110: 金融 | G110: 银行行业 | H110: 105.5 | I110: 8.0000000000000004e-004 | J110: 1.8e-003 | K110: 5.4 | L110: 1.1200000000000002e-002 | M110: 118 | N110: 6.98 | O110: 0.36399999999999999 | P110: 77.36 | Q110: 转股中 | R110: 3.88年 | S110: 无权 | T110: 400 | U110: 16 | V110: 0. | W110: 0.151 | X110: 0.11699999999999999 | Y110: 2642. | Z110: 0.57 | AA110: 3.0099999999999998e-002 | AB110: 2.1600000000000001e-002 | AC110: 无权 | AD110: 无权 | AE110: 无权 | AF110: 102.58 | AG110: 0.23 | AH110: AAA | AI110: 3.78e-002 | AJ110: =H110+100*O110 -> 141.90000000000001 | AK110: 133.6 | AL110: 241 | AM110: 31.1 | AN110: 146 | AO110: 6.0000000000000001e-003 | AP110: 47 | AQ110: 中信转债!
A111: 181 | B111: 113570 | C111: 百达转债! | D111: 603331 | E111: 百达精工 | F111: 机械装备 | G111: 机械装备 | H111: 99.64 | I111: 7.0999999999999995e-003 | J111: -3.4000000000000002e-003 | K111: 10.31 | L111: 5.8999999999999999e-003 | M111: 114.9 | N111: 11.54 | O111: 0.115 | P111: 89.34 | Q111: 转股中 | R111: 4.90年 | S111: 2.90年 | T111: 2.8 | U111: 1.3 | V111: 5.0000000000000001e-003 | W111: 0.152 | X111: 0.13600000000000001 | Y111: 18 | Z111: 2.27 | AA111: 3.0099999999999998e-002 | AB111: 2.4399999999999998e-002 | AC111: 1.23e-002 | AD111: 1.e-002 | AE111: 83.03 | AF111: 81.25 | AG111: 0.62 | AH111: A+ | AI111: 7.4800000000000005e-002 | AJ111: =H111+100*O111 -> 111.14 | AK111: 109.9 | AL111: 26 | AM111: 26.9 | AN111: 105 | AO111: 8.1000000000000003e-002 | AP111: 35 | AQ111: 百达转债!
A112: 38 | B112: 123086 | C112: 海兰转债! | D112: 300065 | E112: 海兰信 | F112: 电子 | G112: 电子产品 | H112: 104.82 | I112: 4.6999999999999993e-003 | J112: -5.9999999999999995e-004 | K112: 11.34 | L112: 6.1999999999999998e-003 | M112: 123.5 | N112: 10.88 | O112: 6.0000000000000001e-003 | P112: 104.23 | Q112: 2月2天 | R112: 5.65年 | S112: 3.66年 | T112: 7.3 | U112: 21 | V112: 2.7000000000000003e-002 | W112: 0.16200000000000001 | X112: 0.16899999999999998 | Y112: 45 | Z112: 3.02 | AA112: 2.9999999999999999e-002 | AB112: 2.2700000000000001e-002 | AC112: -2.5000000000000001e-003 | AD112: -4.4000000000000003e-003 | AE112: 81.74 | AF112: 86.97 | AG112: 0.66 | AH112: AA- | AI112: 6.5299999999999997e-002 | AJ112: =H112+100*O112 -> 105.41999999999999 | AK112: 105.4 | AL112: 10 | AM112: 18.4 | AN112: 26 | AO112: 4.8000000000000001e-002 | AP112: 11 | AQ112: 海兰转债!
A113: 137 | B113: 123056 | C113: 雪榕转债! | D113: 300511 | E113: 雪榕生物 | F113: 农业 | G113: 种植业 | H113: 104.3 | I113: 6.8000000000000005e-003 | J113: -3.7000000000000002e-003 | K113: 9.95 | L113: 6.0999999999999995e-003 | M113: 121.1 | N113: 11.89 | O113: 0.24600000000000002 | P113: 83.68 | Q113: 转股中 | R113: 5.19年 | S113: 3.19年 | T113: 5.84 | U113: 2.9 | V113: 5.0000000000000001e-003 | W113: 0.13300000000000001 | X113: 0.111 | Y113: 44 | Z113: 2.24 | AA113: 2.9900000000000003e-002 | AB113: 2.2599999999999999e-002 | AC113: -8.0000000000000004e-004 | AD113: -3.0999999999999999e-003 | AE113: 84.34 | AF113: 87.88 | AG113: 0.5 | AH113: AA- | AI113: 6.5299999999999997e-002 | AJ113: =H113+100*O113 -> 128.90000000000001 | AK113: 124.9 | AL113: 159 | AM113: 37 | AN113: 202 | AO113: -4.0000000000000001e-003 | AP113: 16 | AQ113: 雪榕转债!
A114: 172 | B114: 110068 | C114: 龙净转债! | D114: 600388 | E114: 龙净环保 | F114: 城市公用 | G114: 三废处理 | H114: 99.6 | I114: 1.3899999999999999e-002 | J114: -4.0999999999999995e-003 | K114: 8.9 | L114: 2.53e-002 | M114: 114.8 | N114: 10.73 | O114: 0.20100000000000001 | P114: 82.95 | Q114: 转股中 | R114: 4.93年 | S114: 2.94年 | T114: 20 | U114: 4.1 | V114: 2.e-003 | W114: 0.20999999999999999 | X114: 0.17399999999999999 | Y114: 95 | Z114: 1.65 | AA114: 2.9700000000000001e-002 | AB114: 2.41e-002 | AC114: 1.1899999999999999e-002 | AD114: 9.7999999999999997e-003 | AE114: 91.33 | AF114: 94.57 | AG114: 0.39 | AH114: AA+ | AI114: 4.0800000000000003e-002 | AJ114: =H114+100*O114 -> 119.69999999999999 | AK114: 116.3 | AL114: 67 | AM114: 21.7 | AN114: 51 | AO114: -5.2999999999999999e-002 | AP114: 31 | AQ114: 龙净转债!
A115: 169 | B115: 113033 | C115: 利群转债! | D115: 601366 | E115: 利群股份 | F115: 商业零售 | G115: 商场 | H115: 99.71 | I115: 9.5999999999999992e-003 | J115: -2.5000000000000001e-003 | K115: 6.6 | L115: 1.38e-002 | M115: 114.9 | N115: 7.01 | O115: 5.9000000000000004e-002 | P115: 94.15 | Q115: 转股中 | R115: 4.96年 | S115: 2.96年 | T115: 18 | U115: 3.4 | V115: 2.e-003 | W115: 0.317 | X115: 0.29799999999999999 | Y115: 57 | Z115: 1.27 | AA115: 2.9600000000000001e-002 | AB115: 2.3900000000000001e-002 | AC115: 1.18e-002 | AD115: 9.5999999999999992e-003 | AE115: 90.8 | AF115: 93.71 | AG115: 0.52 | AH115: AA | AI115: 4.2800000000000005e-002 | AJ115: =H115+100*O115 -> 105.61 | AK115: 105.3 | AL115: 9 | AM115: 11.6 | AN115: 5 | AO115: 5.0000000000000001e-003 | AP115: 45 | AQ115: 利群转债!
A116: 114 | B116: 128122 | C116: 兴森转债! | D116: 2436 | E116: 兴森科技 | F116: 电子 | G116: 元器件制 | H116: 100.2 | I116: 5.5000000000000005e-003 | J116: -5.1000000000000004e-003 | K116: 9.54 | L116: 2.0999999999999999e-003 | M116: 113.3 | N116: 14.18 | O116: 0.48899999999999999 | P116: 67.28 | Q116: 转股中 | R116: 4.27年 | S116: 3.27年 | T116: 2.69 | U116: 3.2 | V116: 1.2e-002 | W116: 1.9e-002 | X116: 1.3000000000000001e-002 | Y116: 142 | Z116: 4.36 | AA116: 2.9600000000000001e-002 | AB116: 2.3799999999999998e-002 | AC116: 1.e-002 | AD116: 7.9000000000000008e-003 | AE116: 89.86 | AF116: 94.97 | AG116: 0.18 | AH116: AA | AI116: 4.2800000000000005e-002 | AJ116: =H116+100*O116 -> 149.09999999999999 | AK116: 133.1 | AL116: 236 | AM116: 38.2 | AN116: 211 | AO116: 1.7000000000000001e-002 | AP116: 11 | AQ116: 兴森转债!
A117: 21 | B117: 123093 | C117: 金陵转债 | D117: 300651 | E117: 金陵体育 | F117: 其他 | G117: 文化教育 | H117: 109.99 | I117: 7.000000000000001e-004 | J117: 1.8200000000000001e-002 | K117: 48.95 | L117: 2.86e-002 | M117: 129.3 | N117: 49.29 | O117: 0.10800000000000001 | P117: 99.31 | Q117: 3月11天 | R117: 5.76年 | S117: 3.76年 | T117: 2.5 | U117: 22 | V117: 8.0000000000000002e-002 | W117: 4.0000000000000001e-002 | X117: 3.9e-002 | Y117: 63 | Z117: 9.19 | AA117: 2.9300000000000003e-002 | AB117: 2.07e-002 | AC117: -8.5000000000000006e-003 | AD117: -1.1599999999999999e-002 | AE117: 80.02 | AF117: 85.7 | AG117: 0.66 | AH117: A+ | AI117: 7.6299999999999993e-002 | AJ117: =H117+100*O117 -> 120.78999999999999 | AK117: 120.7 | AL117: 111 | AM117: 35 | AN117: 183 | AO117: 0.11199999999999999 | AP117: 4 | AQ117: 金陵转债
A118: 146 | B118: 113584 | C118: 家悦转债! | D118: 603708 | E118: 家家悦 | F118: 商业零售 | G118: 超市 | H118: 99.76 | I118: 4.1999999999999997e-003 | J118: -3.9000000000000003e-003 | K118: 19.86 | L118: 4.0000000000000001e-003 | M118: 115.3 | N118: 37.97 | O118: 0.90700000000000003 | P118: 52.3 | Q118: 转股中 | R118: 5年49天 | S118: 3年50天 | T118: 6.45 | U118: 1.8 | V118: 3.0000000000000001e-003 | W118: 5.2999999999999999e-002 | X118: 2.7999999999999997e-002 | Y118: 121 | Z118: 4.03 | AA118: 2.92e-002 | AB118: 2.3599999999999999e-002 | AC118: 1.2199999999999999e-002 | AD118: 9.8999999999999991e-003 | AE118: 90.1 | AF118: 92.74 | AG118: 0.07 | AH118: AA | AI118: 4.4299999999999999e-002 | AJ118: =H118+100*O118 -> 190.46000000000001 | AK118: 147.2 | AL118: 296 | AM118: 54.5 | AN118: 294 | AO118: -5.9999999999999998e-002 | AP118: 10 | AQ118: 家悦转债!
A119: 106 | B119: 128125 | C119: 华阳转债! | D119: 2949 | E119: 华阳国际 | F119: 建筑 | G119: 建筑工程 | H119: 102.08 | I119: 2.9999999999999997e-004 | J119: 1.09e-002 | K119: 19.56 | L119: 2.52e-002 | M119: 118.5 | N119: 25.79 | O119: 0.34600000000000003 | P119: 75.84 | Q119: 转股中 | R119: 5.29年 | S119: 3.29年 | T119: 4.5 | U119: 2.1 | V119: 4.0000000000000001e-003 | W119: 0.11699999999999999 | X119: 8.900000000000001e-002 | Y119: 38 | Z119: 3.15 | AA119: 2.92e-002 | AB119: 2.2799999999999997e-002 | AC119: 5.0000000000000001e-003 | AD119: 2.8000000000000004e-003 | AE119: 83.66 | AF119: 85.43 | AG119: 0.44 | AH119: AA- | AI119: 6.5299999999999997e-002 | AJ119: =H119+100*O119 -> 136.68000000000001 | AK119: 128.3 | AL119: 192 | AM119: 42.9 | AN119: 242 | AO119: -4.0999999999999995e-002 | AP119: 6 | AQ119: 华阳转债!
A120: 48 | B120: 123080 | C120: 海波转债! | D120: 300517 | E120: 海波重科 | F120: 建筑 | G120: 建筑工程 | H120: 108.23 | I120: 5.1000000000000004e-003 | J120: -4.0999999999999995e-003 | K120: 22.75 | L120: 1.2999999999999999e-003 | M120: 126.5 | N120: 20.91 | O120: -5.0000000000000001e-003 | P120: 108.8 | Q120: 53天 | R120: 5.63年 | S120: 3.63年 | T120: 2.45 | U120: 11 | V120: 4.0000000000000001e-002 | W120: 0.10099999999999999 | X120: 0.11 | Y120: 24 | Z120: 3.18 | AA120: 2.87e-002 | AB120: 2.07e-002 | AC120: -8.8999999999999999e-003 | AD120: -1.1200000000000002e-002 | AE120: 79.46 | AF120: 84.44 | AG120: 0.71 | AH120: A+ | AI120: 7.6299999999999993e-002 | AJ120: =H120+100*O120 -> 107.73 | AK120: 107.7 | AL120: 16 | AM120: 23.2 | AN120: 65 | AO120: 9.8000000000000004e-002 | AP120: 12 | AQ120: 海波转债!
A121: 332 | B121: 113502 | C121: 嘉澳转债! | D121: 603822 | E121: 嘉澳环保 | F121: 化工 | G121: 化工 | H121: 103.74 | I121: 1.41e-002 | J121: -1.3999999999999999e-002 | K121: 20.03 | L121: 2.7200000000000002e-002 | M121: 111.3 | N121: 44.79 | O121: 1.3200000000000001 | P121: 44.72 | Q121: 转股中 | R121: 2.57年 | S121: 0.57年 | T121: 1.85 | U121: 294 | V121: 1.5 | W121: 0.126 | X121: 5.5999999999999994e-002 | Y121: 15 | Z121: 1.95 | AA121: 2.8199999999999999e-002 | AB121: 1.9900000000000001e-002 | AC121: -2.5399999999999999e-002 | AD121: -3.0099999999999998e-002 | AE121: 97.38 | AF121: 95.55 | AG121: 0 | AH121: AA- | AI121: 6.2300000000000001e-002 | AJ121: =H121+100*O121 -> 235.74000000000001 | AK121: 162.8 | AL121: 320 | AM121: 65.4 | AN121: 315 | AO121: 2.e-003 | AP121: 36 | AQ121: 嘉澳转债!
A122: 201 | B122: 123039 | C122: 开润转债! | D122: 300577 | E122: 开润股份 | F122: 服装纺织 | G122: 纺织行业 | H122: 106.54 | I122: 1.3600000000000001e-002 | J122: -7.1999999999999998e-003 | K122: 25.01 | L122: 1.26e-002 | M122: 121 | N122: 30 | O122: 0.27800000000000002 | P122: 83.37 | Q122: 转股中 | R122: 4.69年 | S122: 2.70年 | T122: 2.22 | U122: 2.4 | V122: 1.e-002 | W122: 3.7000000000000005e-002 | X122: 3.1e-002 | Y122: 60 | Z122: 3.96 | AA122: 2.81e-002 | AB122: 2.0099999999999996e-002 | AC122: -8.199999999999999e-003 | AD122: -1.09e-002 | AE122: 84.86 | AF122: 86.93 | AG122: 0.51 | AH122: A+ | AI122: 7.4800000000000005e-002 | AJ122: =H122+100*O122 -> 134.34 | AK122: 129.7 | AL122: 205 | AM122: 42.8 | AN122: 240 | AO122: -2.5000000000000001e-002 | AP122: 23 | AQ122: 开润转债!
A123: 230 | B123: 128074 | C123: 游族转债!! | D123: 2174 | E123: 游族网络 | F123: 通信互联 | G123: 互联网 | H123: 106.35 | I123: 1.3500000000000002e-002 | J123: -4.8999999999999998e-003 | K123: 14.51 | L123: 1.9699999999999999e-002 | M123: 119.9 | N123: 16.97 | O123: 0.24399999999999999 | P123: 85.5 | Q123: 转股中 | R123: 4.44年 | S123: 2.44年 | T123: 6.83 | U123: 83 | V123: 0.115 | W123: 5.0999999999999997e-002 | X123: 4.4000000000000004e-002 | Y123: 133 | Z123: 2.35 | AA123: 2.7999999999999997e-002 | AB123: 1.9900000000000001e-002 | AC123: -1.0800000000000001e-002 | AD123: -1.3300000000000001e-002 | AE123: 92.81 | AF123: 99.92 | AG123: 0.44 | AH123: AA | AI123: 4.2800000000000005e-002 | AJ123: =H123+100*O123 -> 130.75 | AK123: 127.2 | AL123: 178 | AM123: 27.3 | AN123: 110 | AO123: 0.128 | AP123: 26 | AQ123: 游族转债!!
A124: 69 | B124: 123074 | C124: 隆利转债 | D124: 300752 | E124: 隆利科技 | F124: 电子 | G124: 液晶显示 | H124: 106.872 | I124: -6.0599999999999994e-002 | J124: -7.000000000000001e-004 | K124: 28.6 | L124: -9.98e-002 | M124: 124 | N124: 29.41 | O124: 9.9000000000000005e-002 | P124: 97.25 | Q124: 18天 | R124: 5.53年 | S124: 3.54年 | T124: 3.25 | U124: 127 | V124: 0.36899999999999999 | W124: 9.4e-002 | X124: 9.1999999999999998e-002 | Y124: 34 | Z124: 3.96 | AA124: 2.7799999999999998e-002 | AB124: 2.0199999999999999e-002 | AC124: -7.6e-003 | AD124: -9.5999999999999992e-003 | AE124: 82.42 | AF124: 87.99 | AG124: 0.61 | AH124: AA- | AI124: 6.5299999999999997e-002 | AJ124: =H124+100*O124 -> 116.77200000000001 | AK124: 116.5 | AL124: 71 | AM124: 28.5 | AN124: 118 | AO124: -0.13600000000000001 | AP124: 13 | AQ124: 隆利转债
A125: 59 | B125: 113608 | C125: 威派转债! | D125: 603956 | E125: 威派格 | F125: 机械装备 | G125: 专用设备 | H125: 104.85 | I125: 2.2000000000000002e-002 | J125: 2.2799999999999997e-002 | K125: 17.21 | L125: 7.1599999999999997e-002 | M125: 121.6 | N125: 19.24 | O125: 0.17199999999999999 | P125: 89.45 | Q125: 27天 | R125: 5.56年 | S125: 3.57年 | T125: 4.2 | U125: 4.7 | V125: 1.1000000000000001e-002 | W125: 5.7000000000000002e-002 | X125: 5.0999999999999997e-002 | Y125: 73 | Z125: 6.43 | AA125: 2.76e-002 | AB125: 2.07e-002 | AC125: -5.9999999999999995e-004 | AD125: -3.0000000000000001e-003 | AE125: 79.77 | AF125: 81.57 | AG125: 0.63 | AH125: A+ | AI125: 7.6299999999999993e-002 | AJ125: =H125+100*O125 -> 122.05 | AK125: 120.3 | AL125: 107 | AM125: 38.7 | AN125: 219 | AO125: 6.6000000000000003e-002 | AP125: 7 | AQ125: 威派转债!
A126: 111 | B126: 123062 | C126: 三超转债 | D126: 300554 | E126: 三超新材 | F126: 机械装备 | G126: 通用设备 | H126: 104.088 | I126: 7.3000000000000001e-003 | J126: 1.3999999999999999e-002 | K126: 15.88 | L126: 3.1200000000000002e-002 | M126: 119.7 | N126: 17.17 | O126: 0.125 | P126: 92.49 | Q126: 转股中 | R126: 5.28年 | S126: 3.28年 | T126: 1.95 | U126: 6.2 | V126: 2.9999999999999999e-002 | W126: 0.13100000000000001 | X126: 0.121 | Y126: 15 | Z126: 2.85 | AA126: 2.75e-002 | AB126: 2.0799999999999999e-002 | AC126: 1.5e-003 | AD126: -1.1000000000000001e-003 | AE126: 78.95 | AF126: 78.22 | AG126: 0.69 | AH126: A | AI126: 8.6300000000000002e-002 | AJ126: =H126+100*O126 -> 116.58799999999999 | AK126: 115.7 | AL126: 61 | AM126: 36.7 | AN126: 201 | AO126: 9.0000000000000011e-003 | AP126: 18 | AQ126: 三超转债
A127: 89 | B127: 128131 | C127: 崇达转2! | D127: 2815 | E127: 崇达技术 | F127: 电子 | G127: 元器件制 | H127: 99.879 | I127: 1.1000000000000001e-003 | J127: 1.6000000000000001e-003 | K127: 12.11 | L127: 1.5900000000000001e-002 | M127: 115.2 | N127: 19.54 | O127: 0.61199999999999999 | P127: 61.98 | Q127: 转股中 | R127: 5.39年 | S127: 3.39年 | T127: 14 | U127: 0.2 | V127: 0. | W127: 0.13100000000000001 | X127: 8.1000000000000003e-002 | Y127: 107 | Z127: 2.64 | AA127: 2.7300000000000001e-002 | AB127: 2.2099999999999998e-002 | AC127: 1.0700000000000001e-002 | AD127: 8.6e-003 | AE127: 89 | AF127: 91.61 | AG127: 0.17 | AH127: AA | AI127: 4.4299999999999999e-002 | AJ127: =H127+100*O127 -> 161.07900000000001 | AK127: 137.8 | AL127: 267 | AM127: 46.2 | AN127: 261 | AO127: -3.0000000000000001e-003 | AP127: 8 | AQ127: 崇达转2!
A128: 176 | B128: 123045 | C128: 雷迪转债 | D128: 300652 | E128: 雷迪克 | F128: 汽车 | G128: 零部件制 | H128: 104.55 | I128: 7.4000000000000003e-003 | J128: 1.8100000000000002e-002 | K128: 18.37 | L128: 4.2000000000000003e-002 | M128: 118.9 | N128: 20.13 | O128: 0.14599999999999999 | P128: 91.26 | Q128: 转股中 | R128: 4.90年 | S128: 2.90年 | T128: 1.66 | U128: 6.7 | V128: 3.9e-002 | W128: 9.6000000000000002e-002 | X128: 8.8000000000000009e-002 | Y128: 17 | Z128: 2.02 | AA128: 2.7200000000000002e-002 | AB128: 2.0199999999999999e-002 | AC128: -1.5e-003 | AD128: -4.0999999999999995e-003 | AE128: 83.58 | AF128: 84.15 | AG128: 0.61 | AH128: A+ | AI128: 7.4800000000000005e-002 | AJ128: =H128+100*O128 -> 119.14999999999999 | AK128: 117.8 | AL128: 83 | AM128: 33.7 | AN128: 169 | AO128: -1.1000000000000001e-002 | AP128: 34 | AQ128: 雷迪转债
A129: 258 | B129: 113532 | C129: 海环转债! | D129: 603817 | E129: 海峡环保 | F129: 城市公用 | G129: 三废处理 | H129: 101.25 | I129: -2.5999999999999999e-003 | J129: -3.4700000000000002e-002 | K129: 6.76 | L129: -8.77e-002 | M129: 112.3 | N129: 7.69 | O129: 0.152 | P129: 87.91 | Q129: 转股中 | R129: 3.96年 | S129: 1.96年 | T129: 4.59 | U129: 108 | V129: 0.23300000000000001 | W129: 0.151 | X129: 0.13300000000000001 | Y129: 30 | Z129: 1.75 | AA129: 2.7000000000000003e-002 | AB129: 2.1099999999999997e-002 | AC129: 7.1999999999999998e-003 | AD129: 4.5999999999999999e-003 | AE129: 94.08 | AF129: 95.41 | AG129: 0.42 | AH129: AA | AI129: 4.2800000000000005e-002 | AJ129: =H129+100*O129 -> 116.45 | AK129: 114.6 | AL129: 54 | AM129: 19.2 | AN129: 31 | AO129: 6.3e-002 | AP129: 26 | AQ129: 海环转债!
A130: 54 | B130: 113609 | C130: 永安转债! | D130: 603776 | E130: 永安行 | F130: 城市公用 | G130: 其他 | H130: 104.36 | I130: 3.5400000000000001e-002 | J130: -1.e-003 | K130: 21.06 | L130: 5.04e-002 | M130: 120.5 | N130: 20.34 | O130: 8.0000000000000002e-003 | P130: 103.54 | Q130: 45天 | R130: 5.61年 | S130: 3.61年 | T130: 8.86 | U130: 107 | V130: 0.11599999999999999 | W130: 0.22399999999999998 | X130: 0.23199999999999998 | Y130: 40 | Z130: 1.25 | AA130: 2.6499999999999999e-002 | AB130: 2.e-002 | AC130: -1.2999999999999999e-003 | AD130: -3.3e-003 | AE130: 81.98 | AF130: 85.12 | AG130: 0.68 | AH130: AA- | AI130: 6.5299999999999997e-002 | AJ130: =H130+100*O130 -> 105.16 | AK130: 105.2 | AL130: 8 | AM130: 20.1 | AN130: 41 | AO130: 4.4999999999999998e-002 | AP130: 18 | AQ130: 永安转债!
A131: 324 | B131: 123004 | C131: 铁汉转债! | D131: 300197 | E131: 铁汉生态 | F131: 城市公用 | G131: 生态环境 | H131: 101.599 | I131: 5.7999999999999996e-003 | J131: -8.9999999999999998e-004 | K131: 3.32 | L131: 1.5300000000000001e-002 | M131: 108.8 | N131: 3.82 | O131: 0.16899999999999998 | P131: 86.91 | Q131: 转股中 | R131: 2.67年 | S131: 0.67年 | T131: 8.03 | U131: 2.1 | V131: 3.0000000000000001e-003 | W131: 8.5999999999999993e-002 | X131: 7.400000000000001e-002 | Y131: 94 | Z131: 1.51 | AA131: 2.63e-002 | AB131: 1.9900000000000001e-002 | AC131: -5.9999999999999995e-004 | AD131: -4.1999999999999997e-003 | AE131: 98.16 | AF131: 97.79 | AG131: 0.33 | AH131: AA | AI131: 4.1299999999999996e-002 | AJ131: =H131+100*O131 -> 118.499 | AK131: 116.3 | AL131: 68 | AM131: 18.1 | AN131: 24 | AO131: -1.7000000000000001e-002 | AP131: 47 | AQ131: 铁汉转债!
A132: 45 | B132: 128140 | C132: 润建转债! | D132: 2929 | E132: 润建股份 | F132: 通信互联 | G132: 通信设备 | H132: 99.78 | I132: 1.03e-002 | J132: 1.e-004 | K132: 23.97 | L132: 2.e-002 | M132: 115.2 | N132: 26.55 | O132: 0.105 | P132: 90.28 | Q132: 56天 | R132: 5.64年 | S132: 3.64年 | T132: 10.9 | U132: 4.6 | V132: 4.0000000000000001e-003 | W132: 0.20600000000000002 | X132: 0.18600000000000003 | Y132: 53 | Z132: 1.78 | AA132: 2.63e-002 | AB132: 2.1299999999999999e-002 | AC132: 1.03e-002 | AD132: 8.3000000000000001e-003 | AE132: 88.05 | AF132: 90.62 | AG132: 0.52 | AH132: AA | AI132: 4.4299999999999999e-002 | AJ132: =H132+100*O132 -> 110.28 | AK132: 109.3 | AL132: 19 | AM132: 18.7 | AN132: 27 | AO132: 6.9999999999999993e-003 | AP132: 12 | AQ132: 润建转债!
A133: 148 | B133: 123051 | C133: 今天转债 | D133: 300532 | E133: 今天国际 | F133: 计算机及 | G133: 软件开发 | H133: 107.867 | I133: 6.9999999999999993e-003 | J133: 1.2999999999999999e-003 | K133: 8.95 | L133: 1.24e-002 | M133: 122.8 | N133: 8.8 | O133: 6.0999999999999999e-002 | P133: 101.7 | Q133: 转股中 | R133: 5年48天 | S133: 3年49天 | T133: 2.79 | U133: 2.8 | V133: 9.0000000000000011e-003 | W133: 0.114 | X133: 0.11599999999999999 | Y133: 24 | Z133: 3 | AA133: 2.6200000000000001e-002 | AB133: 1.84e-002 | AC133: -9.0000000000000011e-003 | AD133: -1.18e-002 | AE133: 82.45 | AF133: 85.06 | AG133: 0.67 | AH133: A+ | AI133: 7.6299999999999993e-002 | AJ133: =H133+100*O133 -> 113.967 | AK133: 114 | AL133: 52 | AM133: 29 | AN133: 121 | AO133: 1.6e-002 | AP133: 15 | AQ133: 今天转债
A134: 203 | B134: 113030 | C134: 东风转债! | D134: 601515 | E134: 东风股份 | F134: 造纸包装 | G134: 包装材料 | H134: 103.95 | I134: 1.23e-002 | J134: -1.1999999999999999e-003 | K134: 6.02 | L134: 2.5600000000000001e-002 | M134: 116.9 | N134: 6.75 | O134: 0.16600000000000001 | P134: 89.19 | Q134: 转股中 | R134: 4.69年 | S134: 2.69年 | T134: 2.95 | U134: 12 | V134: 3.9e-002 | W134: 3.7000000000000005e-002 | X134: 3.3000000000000002e-002 | Y134: 80 | Z134: 1.84 | AA134: 2.5899999999999999e-002 | AB134: 1.9299999999999998e-002 | AC134: -1.9e-003 | AD134: -4.1999999999999997e-003 | AE134: 91.84 | AF134: 96.41 | AG134: 0.43 | AH134: AA | AI134: 4.2800000000000005e-002 | AJ134: =H134+100*O134 -> 120.55000000000001 | AK134: 118.7 | AL134: 92 | AM134: 22.3 | AN134: 55 | AO134: 4.0999999999999995e-002 | AP134: 17 | AQ134: 东风转债!
A135: 16 | B135: 123096 | C135: 思创转债 | D135: 300078 | E135: 思创医惠 | F135: 通信互联 | G135: 物联网 | H135: 107.26 | I135: 6.1999999999999998e-003 | J135: 1.89e-002 | K135: 7.97 | L135: 4.0500000000000001e-002 | M135: 124 | N135: 8.27 | O135: 0.113 | P135: 96.37 | Q135: 3月18天 | R135: 5.78年 | S135: 3.78年 | T135: 8.17 | U135: 11 | V135: 1.2e-002 | W135: 0.11800000000000001 | X135: 0.114 | Y135: 69 | Z135: 2.28 | AA135: 2.5899999999999999e-002 | AB135: 1.8700000000000001e-002 | AC135: -8.0000000000000002e-003 | AD135: -9.8999999999999991e-003 | AE135: 81.16 | AF135: 86.64 | AG135: 0.62 | AH135: AA- | AI135: 6.5299999999999997e-002 | AJ135: =H135+100*O135 -> 118.56 | AK135: 118.1 | AL135: 86 | AM135: 31.5 | AN135: 150 | AO135: -4.0000000000000001e-003 | AP135: 3 | AQ135: 思创转债
A136: 185 | B136: 113567 | C136: 君禾转债! | D136: 603617 | E136: 君禾股份 | F136: 机械装备 | G136: 通用设备 | H136: 105.28 | I136: 2.7000000000000001e-003 | J136: 1.4000000000000002e-003 | K136: 10.95 | L136: 6.4000000000000003e-003 | M136: 118.8 | N136: 11.46 | O136: 0.10199999999999999 | P136: 95.55 | Q136: 转股中 | R136: 4.88年 | S136: 2.88年 | T136: 2.1 | U136: 0.9 | V136: 4.0000000000000001e-003 | W136: 9.6000000000000002e-002 | X136: 9.1999999999999998e-002 | Y136: 22 | Z136: 3.39 | AA136: 2.5600000000000001e-002 | AB136: 1.8700000000000001e-002 | AC136: -4.0999999999999995e-003 | AD136: -6.6e-003 | AE136: 83.64 | AF136: 84.22 | AG136: 0.64 | AH136: A+ | AI136: 7.4800000000000005e-002 | AJ136: =H136+100*O136 -> 115.48 | AK136: 115 | AL136: 55 | AM136: 30.8 | AN136: 144 | AO136: 2.6000000000000002e-002 | AP136: 35 | AQ136: 君禾转债!
A137: 165 | B137: 128105 | C137: 长集转债 | D137: 2616 | E137: 长青集团 | F137: 城市公用 | G137: 三废处理 | H137: 101.661 | I137: -1.2999999999999999e-003 | J137: 5.7999999999999996e-003 | K137: 7.16 | L137: 9.8999999999999991e-003 | M137: 114.9 | N137: 8.11 | O137: 0.151 | P137: 88.29 | Q137: 转股中 | R137: 4.98年 | S137: 2.98年 | T137: 8 | U137: 7.1 | V137: 9.0000000000000011e-003 | W137: 0.151 | X137: 0.13300000000000001 | Y137: 53 | Z137: 2.04 | AA137: 2.5399999999999999e-002 | AB137: 1.9799999999999998e-002 | AC137: 5.5000000000000005e-003 | AD137: 3.3e-003 | AE137: 90.72 | AF137: 93.62 | AG137: 0.46 | AH137: AA | AI137: 4.2800000000000005e-002 | AJ137: =H137+100*O137 -> 116.761 | AK137: 115 | AL137: 56 | AM137: 21.4 | AN137: 48 | AO137: -5.4000000000000006e-002 | AP137: 13 | AQ137: 长集转债
A138: 80 | B138: 123068 | C138: 弘信转债 | D138: 300657 | E138: 弘信电子 | F138: 电子 | G138: 元器件制 | H138: 106 | I138: 1.15e-002 | J138: 7.6e-003 | K138: 17.1 | L138: 3.2000000000000001e-002 | M138: 121.2 | N138: 18.45 | O138: 0.14400000000000002 | P138: 92.68 | Q138: 5.1天 | R138: 5.50年 | S138: 3.50年 | T138: 5.7 | U138: 1.2 | V138: 2.e-003 | W138: 9.8000000000000004e-002 | X138: 8.9999999999999997e-002 | Y138: 58 | Z138: 4 | AA138: 2.52e-002 | AB138: 1.84e-002 | AC138: -4.8999999999999998e-003 | AD138: -7.0999999999999995e-003 | AE138: 82.8 | AF138: 86.27 | AG138: 0.6 | AH138: AA- | AI138: 6.5299999999999997e-002 | AJ138: =H138+100*O138 -> 120.40000000000001 | AK138: 119.3 | AL138: 97 | AM138: 33 | AN138: 163 | AO138: 4.0999999999999995e-002 | AP138: 7 | AQ138: 弘信转债
A139: 348 | B139: 110031 | C139: 航信转债!! | D139: 600271 | E139: 航天信息 | F139: 计算机及 | G139: 软件开发 | H139: 106.59 | I139: 0. | J139: 0. | K139: 12.62 | L139: 1.8600000000000002e-002 | M139: 107 | N139: 21.56 | O139: 0.82099999999999995 | P139: 58.53 | Q139: 转股中 | R139: 57天 | S139: 回售内 | T139: 24 | U139: 3.5 | V139: 1.e-003 | W139: 0.10300000000000001 | X139: 5.9999999999999998e-002 | Y139: 234 | Z139: 1.92 | AA139: 2.4900000000000002e-002 | AB139: -5.7999999999999996e-002 | AC139: 回售内 | AD139: 回售内 | AE139: 100.27 | AF139: 106.53 | AG139: 0 | AH139: AAA | AI139: 2.87e-002 | AJ139: =H139+100*O139 -> 188.69 | AK139: 154.6 | AL139: 310 | AM139: 48.1 | AN139: 273 | AO139: 4.2000000000000003e-002 | AP139: 15 | AQ139: 航信转债!!
A140: 115 | B140: 113037 | C140: 紫银转债 | D140: 601860 | E140: 紫金银行 | F140: 金融 | G140: 银行行业 | H140: 102.02 | I140: 2.9999999999999997e-004 | J140: 5.0000000000000001e-003 | K140: 3.89 | L140: 1.3000000000000001e-002 | M140: 115.8 | N140: 4.75 | O140: 0.24600000000000002 | P140: 81.89 | Q140: 转股中 | R140: 5.27年 | S140: 无权 | T140: 45 | U140: 19 | V140: 4.0000000000000001e-003 | W140: 0.316 | X140: 0.25900000000000001 | Y140: 142 | Z140: 1.01 | AA140: 2.4900000000000002e-002 | AB140: 1.9299999999999998e-002 | AC140: 无权 | AD140: 无权 | AE140: 无权 | AF140: 93.54 | AG140: 0.4 | AH140: AA+ | AI140: 4.2300000000000004e-002 | AJ140: =H140+100*O140 -> 126.62 | AK140: 122.1 | AL140: 131 | AM140: 28.6 | AN140: 120 | AO140: 1.1000000000000001e-002 | AP140: 18 | AQ140: 紫银转债
A141: 85 | B141: 128133 | C141: 奇正转债! | D141: 2287 | E141: 奇正藏药 | F141: 医药 | G141: 中药 | H141: 103.01 | I141: 2.0000000000000001e-004 | J141: 2.9999999999999997e-004 | K141: 24.48 | L141: 1.1999999999999999e-003 | M141: 117.3 | N141: 30.12 | O141: 0.26700000000000002 | P141: 81.27 | Q141: 转股中 | R141: 5.43年 | S141: 3.44年 | T141: 8 | U141: 4.3 | V141: 5.0000000000000001e-003 | W141: 6.2e-002 | X141: 5.0000000000000003e-002 | Y141: 130 | Z141: 5.4 | AA141: 2.4700000000000003e-002 | AB141: 1.89e-002 | AC141: 2.2000000000000001e-003 | AD141: 1.e-004 | AE141: 88.94 | AF141: 93.12 | AG141: 0.4 | AH141: AA | AI141: 4.4299999999999999e-002 | AJ141: =H141+100*O141 -> 129.71000000000001 | AK141: 124.7 | AL141: 156 | AM141: 31.6 | AN141: 151 | AO141: 2.2000000000000002e-002 | AP141: 14 | AQ141: 奇正转债!
A142: 173 | B142: 123047 | C142: 久吾转债 | D142: 300631 | E142: 久吾高科 | F142: 机械装备 | G142: 专用设备 | H142: 115.35 | I142: 5.0000000000000001e-003 | J142: -3.3e-003 | K142: 19.35 | L142: 2.5999999999999999e-003 | M142: 129.6 | N142: 17.61 | O142: 5.0000000000000003e-002 | P142: 109.88 | Q142: 转股中 | R142: 4.92年 | S142: 2.93年 | T142: 1.99 | U142: 33 | V142: 0.14499999999999999 | W142: 9.5000000000000001e-002 | X142: 0.10400000000000001 | Y142: 21 | Z142: 2.57 | AA142: 2.46e-002 | AB142: 1.46e-002 | AC142: -2.8399999999999998e-002 | AD142: -3.1699999999999999e-002 | AE142: 84.7 | AF142: 91.75 | AG142: 0.66 | AH142: A+ | AI142: 7.4800000000000005e-002 | AJ142: =H142+100*O142 -> 120.34999999999999 | AK142: 120.8 | AL142: 115 | AM142: 29.1 | AN142: 125 | AO142: 0.107 | AP142: 23 | AQ142: 久吾转债
A143: 310 | B143: 127006 | C143: 敖东转债! | D143: 623 | E143: 吉林敖东 | F143: 金融 | G143: 证券行业 | H143: 100.254 | I143: -5.0000000000000001e-004 | J143: 4.5000000000000005e-003 | K143: 15.88 | L143: 1.8600000000000002e-002 | M143: 107.4 | N143: 20.42 | O143: 0.28899999999999998 | P143: 77.77 | Q143: 转股中 | R143: 2.90年 | S143: 0.91年 | T143: 24.1 | U143: 4.9 | V143: 2.e-003 | W143: 0.13 | X143: 0.10099999999999999 | Y143: 185 | Z143: 0.81 | AA143: 2.4199999999999999e-002 | AB143: 1.9299999999999998e-002 | AC143: 7.6e-003 | AD143: 5.6000000000000008e-003 | AE143: 96.97 | AF143: 96.13 | AG143: 0.22 | AH143: AA+ | AI143: 3.9300000000000002e-002 | AJ143: =H143+100*O143 -> 129.154 | AK143: 122.7 | AL143: 137 | AM143: 25.8 | AN143: 88 | AO143: 6.0000000000000001e-003 | AP143: 27 | AQ143: 敖东转债!
A144: 46 | B144: 123082 | C144: 北陆转债! | D144: 300016 | E144: 北陆药业 | F144: 医药 | G144: 化学制药 | H144: 106.661 | I144: 1.5e-003 | J144: -2.3e-003 | K144: 9 | L144: -1.1000000000000001e-003 | M144: 121.7 | N144: 8.86 | O144: 5.0000000000000003e-002 | P144: 101.58 | Q144: 56天 | R144: 5.64年 | S144: 3.64年 | T144: 5 | U144: 3.1 | V144: 6.0000000000000001e-003 | W144: 0.11199999999999999 | X144: 0.114 | Y144: 45 | Z144: 2.77 | AA144: 2.4199999999999999e-002 | AB144: 1.7399999999999999e-002 | AC144: -5.1000000000000004e-003 | AD144: -7.4000000000000003e-003 | AE144: 79.33 | AF144: 81.18 | AG144: 0.7 | AH144: A+ | AI144: 7.6299999999999993e-002 | AJ144: =H144+100*O144 -> 111.661 | AK144: 111.7 | AL144: 35 | AM144: 30.6 | AN144: 140 | AO144: -6.0000000000000001e-003 | AP144: 9 | AQ144: 北陆转债!
A145: 293 | B145: 113516 | C145: 苏农转债! | D145: 603323 | E145: 苏农银行 | F145: 金融 | G145: 银行行业 | H145: 105.87 | I145: -8.0000000000000004e-004 | J145: 2.8000000000000004e-003 | K145: 4.67 | L145: 6.5000000000000006e-003 | M145: 114.3 | N145: 5.52 | O145: 0.251 | P145: 84.6 | Q145: 转股中 | R145: 3.29年 | S145: 无权 | T145: 12.9 | U145: 9.2 | V145: 6.9999999999999993e-003 | W145: 0.153 | X145: 0.13 | Y145: 84 | Z145: 0.71 | AA145: 2.4e-002 | AB145: 1.6e-002 | AC145: 无权 | AD145: 无权 | AE145: 无权 | AF145: 100.47 | AG145: 0.32 | AH145: AA+ | AI145: 4.0800000000000003e-002 | AJ145: =H145+100*O145 -> 130.97 | AK145: 127.1 | AL145: 177 | AM145: 26.7 | AN145: 101 | AO145: -2.e-002 | AP145: 31 | AQ145: 苏农转债!
A146: 333 | B146: 128018 | C146: 时达转债! | D146: 2527 | E146: 新时达 | F146: 机械装备 | G146: 机器人及 | H146: 103.003 | I146: -2.0999999999999999e-003 | J146: 2.8999999999999998e-003 | K146: 6.05 | L146: 3.3e-003 | M146: 109.3 | N146: 7.42 | O146: 0.26300000000000001 | P146: 81.54 | Q146: 转股中 | R146: 2.56年 | S146: 0.56年 | T146: 4.04 | U146: 0.7 | V146: 2.e-003 | W146: 0.10800000000000001 | X146: 8.8000000000000009e-002 | Y146: 38 | Z146: 1.47 | AA146: 2.3900000000000001e-002 | AB146: 1.6899999999999998e-002 | AC146: -1.61e-002 | AD146: -2.0899999999999998e-002 | AE146: 98.86 | AF146: 98.73 | AG146: 0.24 | AH146: AA | AI146: 4.1299999999999996e-002 | AJ146: =H146+100*O146 -> 129.303 | AK146: 124.5 | AL146: 151 | AM146: 25.6 | AN146: 86 | AO146: 6.0000000000000001e-003 | AP146: 37 | AQ146: 时达转债!
A147: 128 | B147: 110071 | C147: 湖盐转债! | D147: 600929 | E147: 雪天盐业 | F147: 食品饮料 | G147: 食品饮料 | H147: 102.05 | I147: 4.4000000000000003e-003 | J147: -9.5999999999999992e-003 | K147: 6.2 | L147: -9.5999999999999992e-003 | M147: 115.2 | N147: 6.6 | O147: 8.5999999999999993e-002 | P147: 93.94 | Q147: 转股中 | R147: 5.23年 | S147: 3.23年 | T147: 7.2 | U147: 23 | V147: 3.2000000000000001e-002 | W147: 0.127 | X147: 0.11900000000000001 | Y147: 57 | Z147: 2.24 | AA147: 2.3900000000000001e-002 | AB147: 1.8500000000000003e-002 | AC147: 4.7999999999999996e-003 | AD147: 2.5999999999999999e-003 | AE147: 89.63 | AF147: 92.25 | AG147: 0.54 | AH147: AA | AI147: 4.4299999999999999e-002 | AJ147: =H147+100*O147 -> 110.64999999999999 | AK147: 110.2 | AL147: 30 | AM147: 17.9 | AN147: 20 | AO147: 0.105 | AP147: 16 | AQ147: 湖盐转债!
A148: 20 | B148: 113619 | C148: 世运转债! | D148: 603920 | E148: 世运电路 | F148: 电子 | G148: 元器件制 | H148: 100.96 | I148: 2.8999999999999998e-003 | J148: 5.1999999999999998e-003 | K148: 17.29 | L148: 3.3500000000000002e-002 | M148: 115.2 | N148: 26.5 | O148: 0.54700000000000004 | P148: 65.25 | Q148: 3月11天 | R148: 5.76年 | S148: 3.76年 | T148: 10 | U148: 15 | V148: 1.3999999999999999e-002 | W148: 0.14099999999999999 | X148: 9.1999999999999998e-002 | Y148: 71 | Z148: 2.62 | AA148: 2.3599999999999999e-002 | AB148: 1.8700000000000001e-002 | AC148: 6.8999999999999999e-003 | AD148: 5.0000000000000001e-003 | AE148: 87.59 | AF148: 90.15 | AG148: 0.24 | AH148: AA | AI148: 4.4299999999999999e-002 | AJ148: =H148+100*O148 -> 155.66 | AK148: 136.7 | AL148: 261 | AM148: 46.5 | AN148: 263 | AO148: 3.7000000000000005e-002 | AP148: 4 | AQ148: 世运转债!
A149: 43 | B149: 127026 | C149: 超声转债! | D149: 823 | E149: 超声电子 | F149: 电子 | G149: 元器件制 | H149: 99.55 | I149: 1.5e-003 | J149: 1.5e-003 | K149: 10.68 | L149: 6.6e-003 | M149: 113.1 | N149: 12.85 | O149: 0.19800000000000001 | P149: 83.11 | Q149: 59天 | R149: 5.64年 | S149: 3.65年 | T149: 7 | U149: 2.8 | V149: 4.0000000000000001e-003 | W149: 0.122 | X149: 0.10099999999999999 | Y149: 57 | Z149: 1.56 | AA149: 2.3300000000000001e-002 | AB149: 1.89e-002 | AC149: 1.06e-002 | AD149: 8.6999999999999994e-003 | AE149: 87.94 | AF149: 88.95 | AG149: 0.46 | AH149: AA | AI149: 4.4299999999999999e-002 | AJ149: =H149+100*O149 -> 119.34999999999999 | AK149: 116 | AL149: 65 | AM149: 27 | AN149: 107 | AO149: 5.9999999999999998e-002 | AP149: 8 | AQ149: 超声转债!
A150: 112 | B150: 128123 | C150: 国光转债! | D150: 2749 | E150: 国光股份 | F150: 化工 | G150: 农化 | H150: 103.249 | I150: -3.0999999999999999e-003 | J150: 5.0000000000000001e-004 | K150: 10.49 | L150: -5.6999999999999993e-003 | M150: 116.2 | N150: 13.7 | O150: 0.34799999999999998 | P150: 76.57 | Q150: 转股中 | R150: 5.28年 | S150: 3.28年 | T150: 3.2 | U150: 12 | V150: 3.7999999999999999e-002 | W150: 7.0000000000000007e-002 | X150: 5.4000000000000006e-002 | Y150: 46 | Z150: 3.68 | AA150: 2.3199999999999998e-002 | AB150: 1.7500000000000002e-002 | AC150: 2.5000000000000001e-003 | AD150: 1.e-004 | AE150: 83.96 | AF150: 83.9 | AG150: 0.46 | AH150: AA- | AI150: 6.5299999999999997e-002 | AJ150: =H150+100*O150 -> 138.04899999999998 | AK150: 129.9 | AL150: 208 | AM150: 46 | AN150: 259 | AO150: -5.7000000000000002e-002 | AP150: 10 | AQ150: 国光转债!
A151: 66 | B151: 123075 | C151: 贝斯转债! | D151: 300580 | E151: 贝斯特 | F151: 汽车 | G151: 零部件制 | H151: 102 | I151: 2.2000000000000002e-002 | J151: -1.9e-002 | K151: 18.29 | L151: 6.0999999999999995e-003 | M151: 115.5 | N151: 23.99 | O151: 0.33799999999999997 | P151: 76.24 | Q151: 20天 | R151: 5.55年 | S151: 3.55年 | T151: 6 | U151: 4.2 | V151: 6.9999999999999993e-003 | W151: 0.16399999999999998 | X151: 0.125 | Y151: 37 | Z151: 2.27 | AA151: 2.3099999999999999e-002 | AB151: 1.7899999999999999e-002 | AC151: 4.8999999999999998e-003 | AD151: 2.8000000000000004e-003 | AE151: 82.29 | AF151: 81.92 | AG151: 0.49 | AH151: AA- | AI151: 6.5299999999999997e-002 | AJ151: =H151+100*O151 -> 135.80000000000001 | AK151: 127.8 | AL151: 187 | AM151: 45.5 | AN151: 255 | AO151: 4.4000000000000004e-002 | AP151: 8 | AQ151: 贝斯转债!
A152: 189 | B152: 113565 | C152: 宏辉转债 | D152: 603336 | E152: 宏辉果蔬 | F152: 农业 | G152: 农产品加 | H152: 105.82 | I152: 5.7999999999999996e-003 | J152: -5.1999999999999998e-003 | K152: 9.79 | L152: 1.e-003 | M152: 117.8 | N152: 10 | O152: 8.1000000000000003e-002 | P152: 97.9 | Q152: 转股中 | R152: 4.86年 | S152: 2.87年 | T152: 2.25 | U152: 30 | V152: 0.127 | W152: 6.8000000000000005e-002 | X152: 6.7000000000000004e-002 | Y152: 33 | Z152: 3.21 | AA152: 2.2799999999999997e-002 | AB152: 1.61e-002 | AC152: -6.7000000000000002e-003 | AD152: -9.0000000000000011e-003 | AE152: 86.15 | AF152: 87.77 | AG152: 0.62 | AH152: AA- | AI152: 6.3799999999999996e-002 | AJ152: =H152+100*O152 -> 113.91999999999999 | AK152: 113.7 | AL152: 49 | AM152: 26 | AN152: 94 | AO152: 2.7999999999999997e-002 | AP152: 23 | AQ152: 宏辉转债
A153: 3 | B153: 113046 | C153: 金田转债 | D153: 601609 | E153: 金田铜业 | F153: 有色金属 | G153: 铜金属 | H153: 100.81 | I153: -3.3e-003 | J153: -7.4999999999999997e-003 | K153: 10.1 | L153: -2.0400000000000001e-002 | M153: 114.9 | N153: 10.95 | O153: 9.3000000000000013e-002 | P153: 92.24 | Q153: 5月14天 | R153: 5.93年 | S153: 3.93年 | T153: 15 | U153: 78 | V153: 5.2000000000000005e-002 | W153: 0.10199999999999999 | X153: 9.4e-002 | Y153: 147 | Z153: 2.24 | AA153: 2.2700000000000001e-002 | AB153: 1.8000000000000002e-002 | AC153: 6.3e-003 | AD153: 4.5999999999999999e-003 | AE153: 87.37 | AF153: 90.23 | AG153: 0.53 | AH153: AA+ | AI153: 4.2300000000000004e-002 | AJ153: =H153+100*O153 -> 110.11 | AK153: 109.4 | AL153: 20 | AM153: 19.1 | AN153: 30 | AO153: -1.e-003 | AP153: 5 | AQ153: 金田转债
A154: 328 | B154: 128022 | C154: 众信转债! | D154: 2707 | E154: 众信旅游 | F154: 旅游餐饮 | G154: 旅游 | H154: 102.8 | I154: 2.0999999999999999e-003 | J154: 1.6000000000000001e-003 | K154: 6.7 | L154: 1.06e-002 | M154: 108.8 | N154: 7.92 | O154: 0.215 | P154: 84.6 | Q154: 转股中 | R154: 2.63年 | S154: 0.63年 | T154: 4.56 | U154: 4.6 | V154: 1.e-002 | W154: 7.4999999999999997e-002 | X154: 6.4000000000000001e-002 | Y154: 61 | Z154: 2.86 | AA154: 2.2200000000000001e-002 | AB154: 1.5700000000000002e-002 | AC154: -1.5300000000000001e-002 | AD154: -1.9099999999999999e-002 | AE154: 96.8 | AF154: 93.05 | AG154: 0.35 | AH154: AA- | AI154: 6.2300000000000001e-002 | AJ154: =H154+100*O154 -> 124.3 | AK154: 121 | AL154: 117 | AM154: 24.2 | AN154: 69 | AO154: -1.3999999999999999e-002 | AP154: 31 | AQ154: 众信转债!
A155: 212 | B155: 128082 | C155: 华锋转债! | D155: 2806 | E155: 华锋股份 | F155: 电子 | G155: 元器件制 | H155: 110.59 | I155: 2.92e-002 | J155: 3.2000000000000002e-003 | K155: 10.15 | L155: 4.6399999999999997e-002 | M155: 121.4 | N155: 9.13 | O155: -5.0000000000000001e-003 | P155: 111.17 | Q155: 转股中 | R155: 4.63年 | S155: 2.64年 | T155: 3.34 | U155: 677 | V155: 1.8200000000000001 | W155: 0.18600000000000003 | X155: 0.20699999999999999 | Y155: 18 | Z155: 1.43 | AA155: 2.0799999999999999e-002 | AB155: 1.2699999999999999e-002 | AC155: -2.0299999999999999e-002 | AD155: -2.3300000000000001e-002 | AE155: 85.59 | AF155: 87.66 | AG155: 0.7 | AH155: A+ | AI155: 7.4800000000000005e-002 | AJ155: =H155+100*O155 -> 110.09 | AK155: 110 | AL155: 27 | AM155: 22.3 | AN155: 56 | AO155: 0.125 | AP155: 56 | AQ155: 华锋转债!
A156: 175 | B156: 128101 | C156: 联创转债! | D156: 2036 | E156: 联创电子 | F156: 电子 | G156: 液晶显示 | H156: 104 | I156: 6.9999999999999993e-003 | J156: 1.66e-002 | K156: 10.45 | L156: 7.6200000000000004e-002 | M156: 114.8 | N156: 13.86 | O156: 0.379 | P156: 75.4 | Q156: 转股中 | R156: 4.91年 | S156: 2.92年 | T156: 3 | U156: 302 | V156: 0.92299999999999993 | W156: 2.7000000000000003e-002 | X156: 2.1000000000000001e-002 | Y156: 110 | Z156: 3.71 | AA156: 2.07e-002 | AB156: 1.5100000000000001e-002 | AC156: -2.2000000000000001e-003 | AD156: -4.3e-003 | AE156: 90.87 | AF156: 93.78 | AG156: 0.31 | AH156: AA | AI156: 4.2800000000000005e-002 | AJ156: =H156+100*O156 -> 141.90000000000001 | AK156: 132.6 | AL156: 229 | AM156: 38.8 | AN156: 220 | AO156: 5.0000000000000003e-002 | AP156: 16 | AQ156: 联创转债!
A157: 300 | B157: 110045 | C157: 海澜转债! | D157: 600398 | E157: 海澜之家 | F157: 服装纺织 | G157: 服装行业 | H157: 104.09 | I157: 8.9999999999999998e-004 | J157: -7.000000000000001e-004 | K157: 6.64 | L157: 4.5000000000000005e-003 | M157: 111.1 | N157: 11.75 | O157: 0.84200000000000008 | P157: 56.51 | Q157: 转股中 | R157: 3.24年 | S157: 1.24年 | T157: 29.5 | U157: 27 | V157: 9.0000000000000011e-003 | W157: 0.10300000000000001 | X157: 5.7999999999999996e-002 | Y157: 287 | Z157: 2.26 | AA157: 2.06e-002 | AB157: 1.4199999999999999e-002 | AC157: -1.43e-002 | AD157: -1.7100000000000001e-002 | AE157: 96.47 | AF157: 97.8 | AG157: 0.04 | AH157: AA+ | AI157: 4.0800000000000003e-002 | AJ157: =H157+100*O157 -> 188.29000000000002 | AK157: 151.7 | AL157: 306 | AM157: 53.9 | AN157: 291 | AO157: -7.0999999999999994e-002 | AP157: 55 | AQ157: 海澜转债!
A158: 121 | B158: 113593 | C158: 沪工转债 | D158: 603131 | E158: 上海沪工 | F158: 机械装备 | G158: 通用设备 | H158: 109.48 | I158: 1.4499999999999999e-002 | J158: -2.0199999999999999e-002 | K158: 20.78 | L158: -8.6e-003 | M158: 121.6 | N158: 21.32 | O158: 0.12300000000000001 | P158: 97.47 | Q158: 转股中 | R158: 5.26年 | S158: 3.26年 | T158: 4 | U158: 9.3 | V158: 2.1000000000000001e-002 | W158: 6.0999999999999999e-002 | X158: 5.9000000000000004e-002 | Y158: 66 | Z158: 5.36 | AA158: 2.06e-002 | AB158: 1.34e-002 | AC158: -1.3300000000000001e-002 | AD158: -1.5900000000000001e-002 | AE158: 81.56 | AF158: 83.4 | AG158: 0.66 | AH158: A+ | AI158: 7.6299999999999993e-002 | AJ158: =H158+100*O158 -> 121.78 | AK158: 121.5 | AL158: 121 | AM158: 38.1 | AN158: 210 | AO158: 6.5000000000000002e-002 | AP158: 9 | AQ158: 沪工转债
A159: 109 | B159: 128124 | C159: 科华转债! | D159: 2022 | E159: 科华生物 | F159: 医药 | G159: 生物制药 | H159: 99.35 | I159: 6.3e-003 | J159: 5.7999999999999996e-003 | K159: 17.14 | L159: 2.8799999999999999e-002 | M159: 110.3 | N159: 21.51 | O159: 0.247 | P159: 79.68 | Q159: 转股中 | R159: 5.28年 | S159: 3.28年 | T159: 7.38 | U159: 7 | V159: 1.e-002 | W159: 8.4000000000000005e-002 | X159: 6.7000000000000004e-002 | Y159: 88 | Z159: 3.07 | AA159: 2.0299999999999999e-002 | AB159: 1.66e-002 | AC159: 1.0800000000000001e-002 | AD159: 9.0000000000000011e-003 | AE159: 88.86 | AF159: 88.09 | AG159: 0.42 | AH159: AA | AI159: 4.4299999999999999e-002 | AJ159: =H159+100*O159 -> 124.05 | AK159: 119 | AL159: 94 | AM159: 30.2 | AN159: 137 | AO159: 0.10199999999999999 | AP159: 18 | AQ159: 科华转债!
A160: 237 | B160: 128071 | C160: 合兴转债! | D160: 2228 | E160: 合兴包装 | F160: 造纸包装 | G160: 包装材料 | H160: 105.6 | I160: 8.8999999999999999e-003 | J160: -3.0000000000000001e-003 | K160: 3.85 | L160: 1.32e-002 | M160: 114.8 | N160: 4.28 | O160: 0.17399999999999999 | P160: 89.95 | Q160: 转股中 | R160: 4.33年 | S160: 2.33年 | T160: 3 | U160: 1 | V160: 3.0000000000000001e-003 | W160: 6.3e-002 | X160: 5.7000000000000002e-002 | Y160: 48 | Z160: 1.43 | AA160: 1.9900000000000001e-002 | AB160: 1.3600000000000001e-002 | AC160: -8.8999999999999999e-003 | AD160: -1.1399999999999999e-002 | AE160: 93.12 | AF160: 96.09 | AG160: 0.45 | AH160: AA | AI160: 4.2800000000000005e-002 | AJ160: =H160+100*O160 -> 123. | AK160: 121.2 | AL160: 119 | AM160: 25.2 | AN160: 81 | AO160: -6.9999999999999993e-003 | AP160: 25 | AQ160: 合兴转债!
A161: 99 | B161: 110074 | C161: 精达转债! | D161: 600577 | E161: 精达股份 | F161: 电子 | G161: 电子产品 | H161: 105.98 | I161: 1.9e-002 | J161: -3.4000000000000002e-003 | K161: 3.66 | L161: 2.81e-002 | M161: 117.3 | N161: 3.75 | O161: 8.5999999999999993e-002 | P161: 97.6 | Q161: 转股中 | R161: 5.34年 | S161: 3.34年 | T161: 7.87 | U161: 7.8 | V161: 9.0000000000000011e-003 | W161: 0.11199999999999999 | X161: 0.109 | Y161: 70 | Z161: 1.91 | AA161: 1.9599999999999999e-002 | AB161: 1.37e-002 | AC161: -6.0000000000000001e-003 | AD161: -8.0000000000000002e-003 | AE161: 89.3 | AF161: 93.5 | AG161: 0.56 | AH161: AA | AI161: 4.4299999999999999e-002 | AJ161: =H161+100*O161 -> 114.58 | AK161: 114.4 | AL161: 53 | AM161: 20.9 | AN161: 45 | AO161: 1.3000000000000001e-002 | AP161: 12 | AQ161: 精达转债!
A162: 305 | B162: 128039 | C162: 三力转债! | D162: 2224 | E162: 三 力 士 | F162: 机械装备 | G162: 专用设备 | H162: 103.458 | I162: 7.4000000000000003e-003 | J162: 5.0000000000000001e-004 | K162: 5.4 | L162: 1.4999999999999999e-002 | M162: 109.8 | N162: 5.81 | O162: 0.113 | P162: 92.94 | Q162: 转股中 | R162: 3年52天 | S162: 1年53天 | T162: 2.03 | U162: 1.4 | V162: 6.9999999999999993e-003 | W162: 5.2000000000000005e-002 | X162: 4.8000000000000001e-002 | Y162: 39 | Z162: 1.68 | AA162: 1.95e-002 | AB162: 1.3500000000000002e-002 | AC162: -6.8000000000000005e-003 | AD162: -1.06e-002 | AE162: 94.64 | AF162: 90.78 | AG162: 0.52 | AH162: AA- | AI162: 6.3799999999999996e-002 | AJ162: =H162+100*O162 -> 114.758 | AK162: 114 | AL162: 51 | AM162: 19.3 | AN162: 32 | AO162: -4.0000000000000001e-003 | AP162: 26 | AQ162: 三力转债!
A163: 26 | B163: 123092 | C163: 天壕转债 | D163: 300332 | E163: 天壕环境 | F163: 石油天然 | G163: 天然气 | H163: 109.19 | I163: 0. | J163: 2.7000000000000001e-003 | K163: 4.92 | L163: 4.0999999999999995e-003 | M163: 121.6 | N163: 5.2 | O163: 0.154 | P163: 94.62 | Q163: 2月15天 | R163: 5.69年 | S163: 3.69年 | T163: 4.23 | U163: 5.7 | V163: 1.2e-002 | W163: 9.8000000000000004e-002 | X163: 9.1999999999999998e-002 | Y163: 43 | Z163: 1.26 | AA163: 1.95e-002 | AB163: 1.29e-002 | AC163: -1.1200000000000002e-002 | AD163: -1.34e-002 | AE163: 79.05 | AF163: 80.83 | AG163: 0.67 | AH163: A+ | AI163: 7.6299999999999993e-002 | AJ163: =H163+100*O163 -> 124.59 | AK163: 123.8 | AL163: 146 | AM163: 42.9 | AN163: 243 | AO163: -3.3000000000000002e-002 | AP163: 6 | AQ163: 天壕转债
A164: 200 | B164: 128090 | C164: 汽模转2 | D164: 2510 | E164: 天汽模 | F164: 汽车 | G164: 零部件制 | H164: 105.555 | I164: 6.1999999999999998e-003 | J164: 7.4000000000000003e-003 | K164: 4.14 | L164: 2.4799999999999999e-002 | M164: 114.9 | N164: 4.21 | O164: 7.2999999999999995e-002 | P164: 98.34 | Q164: 转股中 | R164: 4.70年 | S164: 2.70年 | T164: 3.1 | U164: 54 | V164: 0.16399999999999998 | W164: 7.9000000000000001e-002 | X164: 7.6999999999999999e-002 | Y164: 39 | Z164: 1.43 | AA164: 1.8600000000000002e-002 | AB164: 1.2699999999999999e-002 | AC164: -7.1999999999999998e-003 | AD164: -9.4999999999999998e-003 | AE164: 91.8 | AF164: 94.73 | AG164: 0.55 | AH164: AA | AI164: 4.2800000000000005e-002 | AJ164: =H164+100*O164 -> 112.855 | AK164: 112.8 | AL164: 42 | AM164: 18 | AN164: 22 | AO164: 9.0000000000000011e-003 | AP164: 27 | AQ164: 汽模转2
A165: 139 | B165: 128114 | C165: 正邦转债 | D165: 2157 | E165: 正邦科技 | F165: 农业 | G165: 畜牧业 | H165: 105.15 | I165: 5.5000000000000005e-003 | J165: -5.1000000000000004e-003 | K165: 13.54 | L165: 7.000000000000001e-004 | M165: 115.3 | N165: 15.45 | O165: 0.20000000000000001 | P165: 87.64 | Q165: 转股中 | R165: 5.17年 | S165: 3.17年 | T165: 16 | U165: 7.7 | V165: 5.0000000000000001e-003 | W165: 3.7000000000000005e-002 | X165: 3.3000000000000002e-002 | Y165: 426 | Z165: 2.27 | AA165: 1.84e-002 | AB165: 1.29e-002 | AC165: -3.9000000000000003e-003 | AD165: -6.0999999999999995e-003 | AE165: 90.54 | AF165: 93.5 | AG165: 0.46 | AH165: AA+ | AI165: 4.2300000000000004e-002 | AJ165: =H165+100*O165 -> 125.15000000000001 | AK165: 122.7 | AL165: 136 | AM165: 29.2 | AN165: 126 | AO165: -0.109 | AP165: 17 | AQ165: 正邦转债
A166: 36 | B166: 113044 | C166: 大秦转债! | D166: 601006 | E166: 大秦铁路 | F166: 铁路 | G166: 铁路运输 | H166: 103.09 | I166: 2.8999999999999998e-003 | J166: 1.5e-003 | K166: 6.91 | L166: 8.8000000000000005e-003 | M166: 114.1 | N166: 7.66 | O166: 0.14300000000000002 | P166: 90.21 | Q166: 2月3天 | R166: 5.66年 | S166: 3.66年 | T166: 320 | U166: 271 | V166: 8.0000000000000002e-003 | W166: 0.311 | X166: 0.28100000000000003 | Y166: 1027. | Z166: 0.88 | AA166: 1.84e-002 | AB166: 1.38e-002 | AC166: 2.2000000000000001e-003 | AD166: 2.0000000000000001e-004 | AE166: 89.78 | AF166: 92.12 | AG166: 0.51 | AH166: AAA | AI166: 3.9300000000000002e-002 | AJ166: =H166+100*O166 -> 117.39 | AK166: 116 | AL166: 64 | AM166: 23.8 | AN166: 66 | AO166: 2.e-003 | AP166: 13 | AQ166: 大秦转债!
A167: 24 | B167: 127028 | C167: 英特转债! | D167: 411 | E167: 英特集团 | F167: 医药 | G167: 医药商业 | H167: 102.07 | I167: 8.9999999999999998e-004 | J167: 1.24e-002 | K167: 13.26 | L167: 2.1600000000000001e-002 | M167: 113.1 | N167: 13.46 | O167: 3.6000000000000004e-002 | P167: 98.51 | Q167: 2月26天 | R167: 5.72年 | S167: 3.72年 | T167: 6 | U167: 51 | V167: 8.4000000000000005e-002 | W167: 0.182 | X167: 0.17899999999999999 | Y167: 33 | Z167: 2.04 | AA167: 1.84e-002 | AB167: 1.41e-002 | AC167: 3.9000000000000003e-003 | AD167: 2.0999999999999999e-003 | AE167: 88.3 | AF167: 89.62 | AG167: 0.61 | AH167: AA+ | AI167: 4.2300000000000004e-002 | AJ167: =H167+100*O167 -> 105.66999999999999 | AK167: 105.6 | AL167: 11 | AM167: 16 | AN167: 12 | AO167: -4.0000000000000001e-003 | AP167: 7 | AQ167: 英特转债!
A168: 224 | B168: 127014 | C168: 北方转债! | D168: 65 | E168: 北方国际 | F168: 建筑 | G168: 建筑工程 | H168: 106.3 | I168: 9.1999999999999998e-003 | J168: -8.0000000000000002e-003 | K168: 8.42 | L168: 2.3999999999999998e-003 | M168: 115.1 | N168: 8.75 | O168: 0.105 | P168: 96.23 | Q168: 转股中 | R168: 4.52年 | S168: 2.52年 | T168: 5.35 | U168: 185 | V168: 0.32299999999999995 | W168: 8.3000000000000004e-002 | X168: 7.9000000000000001e-002 | Y168: 65 | Z168: 1.18 | AA168: 1.8100000000000002e-002 | AB168: 1.2e-002 | AC168: -9.5999999999999992e-003 | AD168: -1.2199999999999999e-002 | AE168: 93.15 | AF168: 96.44 | AG168: 0.51 | AH168: AA+ | AI168: 4.0800000000000003e-002 | AJ168: =H168+100*O168 -> 116.8 | AK168: 116.4 | AL168: 69 | AM168: 19.9 | AN168: 39 | AO168: -2.7999999999999997e-002 | AP168: 17 | AQ168: 北方转债!
A169: 158 | B169: 123050 | C169: 聚飞转债 | D169: 300303 | E169: 聚飞光电 | F169: 电子 | G169: LED制 | H169: 114.042 | I169: 5.6000000000000008e-003 | J169: 2.5000000000000001e-003 | K169: 4.91 | L169: 1.4499999999999999e-002 | M169: 123.8 | N169: 5.18 | O169: 0.20300000000000001 | P169: 94.79 | Q169: 转股中 | R169: 4.99年 | S169: 2.99年 | T169: 7.05 | U169: 2.2 | V169: 3.0000000000000001e-003 | W169: 0.11199999999999999 | X169: 0.106 | Y169: 63 | Z169: 2.7 | AA169: 1.6899999999999998e-002 | AB169: 8.8000000000000005e-003 | AC169: -2.98e-002 | AD169: -3.2000000000000001e-002 | AE169: 85.46 | AF169: 91.48 | AG169: 0.56 | AH169: AA- | AI169: 6.3799999999999996e-002 | AJ169: =H169+100*O169 -> 134.34200000000001 | AK169: 133.3 | AL169: 238 | AM169: 41.8 | AN169: 234 | AO169: -6.0000000000000001e-003 | AP169: 12 | AQ169: 聚飞转债
A170: 119 | B170: 113594 | C170: 淳中转债! | D170: 603516 | E170: DR淳中科 | F170: 电子 | G170: 电子产品 | H170: 111.84 | I170: -1.4000000000000002e-003 | J170: 7.0999999999999995e-003 | K170: 26.82 | L170: 8.6e-003 | M170: 121.4 | N170: 27.84 | O170: 0.161 | P170: 96.34 | Q170: 转股中 | R170: 5.26年 | S170: 3.26年 | T170: 3 | U170: 1.8 | V170: 5.0000000000000001e-003 | W170: 8.4000000000000005e-002 | X170: 8.1000000000000003e-002 | Y170: 36 | Z170: 3.76 | AA170: 1.61e-002 | AB170: 9.0000000000000011e-003 | AC170: -1.9599999999999999e-002 | AD170: -2.2099999999999998e-002 | AE170: 81.54 | AF170: 83.27 | AG170: 0.66 | AH170: A+ | AI170: 7.6299999999999993e-002 | AJ170: =H170+100*O170 -> 127.94 | AK170: 127.3 | AL170: 182 | AM170: 44.1 | AN170: 249 | AO170: -0.28100000000000003 | AP170: 8 | AQ170: 淳中转债!
A171: 12 | B171: 123100 | C171: 朗科转债 | D171: 300543 | E171: 朗科智能 | F171: 电子 | G171: 电子产品 | H171: 107.5 | I171: 4.4699999999999997e-002 | J171: -2.5899999999999999e-002 | K171: 15.81 | L171: 2.6600000000000002e-002 | M171: 117.5 | N171: 15.34 | O171: 4.2999999999999997e-002 | P171: 103.06 | Q171: 4月8天 | R171: 5.82年 | S171: 3.82年 | T171: 3.8 | U171: 281 | V171: 0.69499999999999995 | W171: 0.11699999999999999 | X171: 0.12 | Y171: 33 | Z171: 3.97 | AA171: 1.5700000000000002e-002 | AB171: 1.03e-002 | AC171: -8.6999999999999994e-003 | AD171: -1.06e-002 | AE171: 80.89 | AF171: 81.91 | AG171: 0.71 | AH171: AA- | AI171: 6.5299999999999997e-002 | AJ171: =H171+100*O171 -> 111.8 | AK171: 111.9 | AL171: 36 | AM171: 30 | AN171: 136 | AO171: 0.13600000000000001 | AP171: 7 | AQ171: 朗科转债
A172: 65 | B172: 110076 | C172: 华海转债! | D172: 600521 | E172: 华海药业 | F172: 医药 | G172: 医药行业 | H172: 105.8 | I172: 2.5999999999999999e-003 | J172: -2.5000000000000001e-003 | K172: 18.82 | L172: 5.0000000000000001e-004 | M172: 115.1 | N172: 34.66 | O172: 0.94799999999999995 | P172: 54.3 | Q172: 20天 | R172: 5.55年 | S172: 3.55年 | T172: 18.4 | U172: 4.4 | V172: 2.e-003 | W172: 6.7000000000000004e-002 | X172: 3.7000000000000005e-002 | Y172: 274 | Z172: 4.43 | AA172: 1.5600000000000001e-002 | AB172: 1.06e-002 | AC172: -5.6999999999999993e-003 | AD172: -7.4999999999999997e-003 | AE172: 88.32 | AF172: 90.91 | AG172: 0.11 | AH172: AA | AI172: 4.4299999999999999e-002 | AJ172: =H172+100*O172 -> 200.59999999999999 | AK172: 157.3 | AL172: 314 | AM172: 66.4 | AN172: 316 | AO172: -0.191 | AP172: 7 | AQ172: 华海转债!
A173: 95 | B173: 113039 | C173: 嘉泽转债! | D173: 601619 | E173: 嘉泽新能 | F173: 能源电力 | G173: 风能 | H173: 104.33 | I173: 6.8999999999999999e-003 | J173: -1.7000000000000001e-003 | K173: 3.6 | L173: 8.3999999999999995e-003 | M173: 113.1 | N173: 3.57 | O173: 3.5000000000000003e-002 | P173: 100.84 | Q173: 转股中 | R173: 5.35年 | S173: 3.36年 | T173: 11.8 | U173: 20 | V173: 1.6e-002 | W173: 0.158 | X173: 0.159 | Y173: 75 | Z173: 2.18 | AA173: 1.55e-002 | AB173: 1.09e-002 | AC173: -2.e-003 | AD173: -4.0000000000000001e-003 | AE173: 89.06 | AF173: 90.08 | AG173: 0.63 | AH173: AA | AI173: 4.4299999999999999e-002 | AJ173: =H173+100*O173 -> 107.83 | AK173: 107.8 | AL173: 18 | AM173: 17.7 | AN173: 19 | AO173: -3.5000000000000003e-002 | AP173: 28 | AQ173: 嘉泽转债!
A174: 331 | B174: 110038 | C174: 济川转债! | D174: 600566 | E174: 济川药业 | F174: 医药 | G174: 中药 | H174: 105.04 | I174: 4.4000000000000003e-003 | J174: -2.0000000000000001e-004 | K174: 19.74 | L174: 2.7099999999999999e-002 | M174: 107.5 | N174: 23.85 | O174: 0.26899999999999996 | P174: 82.77 | Q174: 转股中 | R174: 1.58年 | S174: 回售内 | T174: 6.28 | U174: 4.8 | V174: 6.9999999999999993e-003 | W174: 3.6000000000000004e-002 | X174: 2.9999999999999999e-002 | Y174: 175 | Z174: 2.39 | AA174: 1.49e-002 | AB174: 5.7999999999999996e-003 | AC174: 回售内 | AD174: 回售内 | AE174: 100.25 | AF174: 100.91 | AG174: 0.16 | AH174: AA | AI174: 4.1299999999999996e-002 | AJ174: =H174+100*O174 -> 131.94 | AK174: 127.3 | AL174: 181 | AM174: 26.4 | AN174: 98 | AO174: -1.3000000000000001e-002 | AP174: 23 | AQ174: 济川转债!
A175: 68 | B175: 113606 | C175: 荣泰转债 | D175: 603579 | E175: 荣泰健康 | F175: 机械装备 | G175: 专用设备 | H175: 111.88 | I175: 1.1699999999999999e-002 | J175: -9.8999999999999991e-003 | K175: 33.09 | L175: 2.7000000000000001e-003 | M175: 121.2 | N175: 33.32 | O175: 0.127 | P175: 99.31 | Q175: 19天 | R175: 5.54年 | S175: 3.54年 | T175: 6 | U175: 3.3 | V175: 5.0000000000000001e-003 | W175: 0.13 | X175: 0.129 | Y175: 46 | Z175: 2.93 | AA175: 1.49e-002 | AB175: 8.199999999999999e-003 | AC175: -1.9400000000000001e-002 | AD175: -2.1499999999999998e-002 | AE175: 82.59 | AF175: 86.05 | AG175: 0.64 | AH175: AA- | AI175: 6.5299999999999997e-002 | AJ175: =H175+100*O175 -> 124.58 | AK175: 124.5 | AL175: 150 | AM175: 38.4 | AN175: 213 | AO175: 4.0999999999999995e-002 | AP175: 9 | AQ175: 荣泰转债
A176: 6 | B176: 123103 | C176: 震安转债 | D176: 300767 | E176: 震安科技 | F176: 化工 | G176: 橡胶塑料 | H176: 111.62 | I176: 0. | J176: 4.0000000000000002e-004 | K176: 77.3 | L176: 5.0000000000000001e-004 | M176: 121.4 | N176: 79.87 | O176: 0.153 | P176: 96.78 | Q176: 5月7天 | R176: 5.90年 | S176: 3.90年 | T176: 2.85 | U176: 3.8 | V176: 1.2e-002 | W176: 2.6000000000000002e-002 | X176: 2.5000000000000001e-002 | Y176: 111 | Z176: 10.21 | AA176: 1.46e-002 | AB176: 8.3000000000000001e-003 | AC176: -1.61e-002 | AD176: -1.8200000000000001e-002 | AE176: 77.79 | AF176: 79.43 | AG176: 0.69 | AH176: A+ | AI176: 7.6299999999999993e-002 | AJ176: =H176+100*O176 -> 126.92 | AK176: 126.5 | AL176: 174 | AM176: 47 | AN176: 266 | AO176: -1.1000000000000001e-002 | AP176: 2 | AQ176: 震安转债
A177: 304 | B177: 128040 | C177: 华通转债! | D177: 2758 | E177: 浙农股份 | F177: 医药 | G177: 医药商业 | H177: 107.633 | I177: -1.6000000000000001e-003 | J177: -6.8999999999999999e-003 | K177: 10.58 | L177: -1.3999999999999999e-002 | M177: 112.3 | N177: 10.33 | O177: 5.0999999999999997e-002 | P177: 102.42 | Q177: 转股中 | R177: 3年58天 | S177: 1年59天 | T177: 2.22 | U177: 3.7 | V177: 1.4999999999999999e-002 | W177: 4.2999999999999997e-002 | X177: 4.4000000000000004e-002 | Y177: 52 | Z177: 3.5 | AA177: 1.38e-002 | AB177: 6.6e-003 | AC177: -3.4300000000000004e-002 | AD177: -3.8300000000000001e-002 | AE177: 94.78 | AF177: 92.78 | AG177: 0.61 | AH177: AA- | AI177: 6.3799999999999996e-002 | AJ177: =H177+100*O177 -> 112.73299999999999 | AK177: 112.8 | AL177: 44 | AM177: 18.1 | AN177: 23 | AO177: 1.2e-002 | AP177: 30 | AQ177: 华通转债!
A178: 44 | B178: 113612 | C178: 永冠转债 | D178: 603681 | E178: 永冠新材 | F178: 化工 | G178: 其他 | H178: 112.87 | I178: 2.8900000000000002e-002 | J178: 2.1400000000000002e-002 | K178: 22.32 | L178: 7.0999999999999994e-002 | M178: 121.2 | N178: 20.79 | O178: 5.0999999999999997e-002 | P178: 107.36 | Q178: 59天 | R178: 5.64年 | S178: 3.65年 | T178: 5.2 | U178: 66 | V178: 0.11199999999999999 | W178: 0.14000000000000001 | X178: 0.14999999999999999 | Y178: 37 | Z178: 2.52 | AA178: 1.3000000000000001e-002 | AB178: 6.4000000000000003e-003 | AC178: -2.1099999999999997e-002 | AD178: -2.3199999999999998e-002 | AE178: 82.03 | AF178: 85.47 | AG178: 0.71 | AH178: AA- | AI178: 6.5299999999999997e-002 | AJ178: =H178+100*O178 -> 117.97 | AK178: 118.4 | AL178: 90 | AM178: 32.9 | AN178: 161 | AO178: 5.5999999999999994e-002 | AP178: 5 | AQ178: 永冠转债
A179: 86 | B179: 123067 | C179: 斯莱转债 | D179: 300382 | E179: 斯莱克 | F179: 机械装备 | G179: 专用设备 | H179: 113.502 | I179: 7.6e-003 | J179: -7.000000000000001e-004 | K179: 9.26 | L179: 1.09e-002 | M179: 121.2 | N179: 9.38 | O179: 0.14999999999999999 | P179: 98.72 | Q179: 转股中 | R179: 5.42年 | S179: 3.42年 | T179: 3.88 | U179: 10 | V179: 2.4e-002 | W179: 7.400000000000001e-002 | X179: 7.2999999999999995e-002 | Y179: 52 | Z179: 5.12 | AA179: 1.24e-002 | AB179: 5.6000000000000008e-003 | AC179: -2.4e-002 | AD179: -2.6099999999999998e-002 | AE179: 83.2 | AF179: 86.69 | AG179: 0.63 | AH179: AA- | AI179: 6.5299999999999997e-002 | AJ179: =H179+100*O179 -> 128.50200000000001 | AK179: 128.3 | AL179: 191 | AM179: 41.6 | AN179: 232 | AO179: 3.2000000000000001e-002 | AP179: 14 | AQ179: 斯莱转债
A180: 199 | B180: 128091 | C180: 新天转债 | D180: 2873 | E180: 新天药业 | F180: 医药 | G180: 中药 | H180: 112.899 | I180: 6.0000000000000001e-003 | J180: 3.4999999999999996e-003 | K180: 16.32 | L180: 1.43e-002 | M180: 119.4 | N180: 16.39 | O180: 0.13400000000000001 | P180: 99.57 | Q180: 转股中 | R180: 4.70年 | S180: 2.71年 | T180: 1.76 | U180: 27 | V180: 0.13400000000000001 | W180: 9.1999999999999998e-002 | X180: 9.1999999999999998e-002 | Y180: 19 | Z180: 2.53 | AA180: 1.23e-002 | AB180: 5.0000000000000001e-003 | AC180: -2.69e-002 | AD180: -2.98e-002 | AE180: 85.15 | AF180: 85.79 | AG180: 0.66 | AH180: A+ | AI180: 7.4800000000000005e-002 | AJ180: =H180+100*O180 -> 126.29900000000001 | AK180: 126.2 | AL180: 170 | AM180: 40.4 | AN180: 226 | AO180: 8.0000000000000002e-003 | AP180: 18 | AQ180: 新天转债
A181: 147 | B181: 128109 | C181: 楚江转债 | D181: 2171 | E181: 楚江新材 | F181: 有色金属 | G181: 铜金属 | H181: 108.449 | I181: 4.1999999999999997e-003 | J181: 1.e-004 | K181: 7.56 | L181: 9.300000000000001e-003 | M181: 115.3 | N181: 8.73 | O181: 0.252 | P181: 86.6 | Q181: 转股中 | R181: 5年48天 | S181: 3年49天 | T181: 18.3 | U181: 18 | V181: 9.0000000000000011e-003 | W181: 0.182 | X181: 0.157 | Y181: 101 | Z181: 1.83 | AA181: 1.23e-002 | AB181: 6.8000000000000005e-003 | AC181: -1.3300000000000001e-002 | AD181: -1.55e-002 | AE181: 90.11 | AF181: 92.75 | AG181: 0.45 | AH181: AA | AI181: 4.4299999999999999e-002 | AJ181: =H181+100*O181 -> 133.649 | AK181: 130.3 | AL181: 212 | AM181: 37.6 | AN181: 205 | AO181: 2.6000000000000002e-002 | AP181: 6 | AQ181: 楚江转债
A182: 269 | B182: 110053 | C182: 苏银转债! | D182: 600919 | E182: 江苏银行 | F182: 金融 | G182: 银行行业 | H182: 112.95 | I182: 5.7999999999999996e-003 | J182: -3.0999999999999999e-003 | K182: 6.19 | L182: 6.5000000000000006e-003 | M182: 118.3 | N182: 6.69 | O182: 0.221 | P182: 92.53 | Q182: 转股中 | R182: 3.91年 | S182: 无权 | T182: 200 | U182: 36 | V182: 2.e-003 | W182: 0.21899999999999997 | X182: 0.20199999999999999 | Y182: 914 | Z182: 0.6 | AA182: 1.2199999999999999e-002 | AB182: 3.9000000000000003e-003 | AC182: 无权 | AD182: 无权 | AE182: 无权 | AF182: 102.75 | AG182: 0.42 | AH182: AAA | AI182: 3.78e-002 | AJ182: =H182+100*O182 -> 135.05000000000001 | AK182: 133.4 | AL182: 239 | AM182: 30.6 | AN182: 141 | AO182: -2.3e-002 | AP182: 41 | AQ182: 苏银转债!
A183: 214 | B183: 128081 | C183: 海亮转债! | D183: 2203 | E183: 海亮股份 | F183: 有色金属 | G183: 铜金属 | H183: 108.8 | I183: -9.1000000000000004e-003 | J183: -1.49e-002 | K183: 10.54 | L183: -3.7400000000000003e-002 | M183: 114.9 | N183: 9.76 | O183: 6.9999999999999993e-003 | P183: 107.99 | Q183: 转股中 | R183: 4.60年 | S183: 2.60年 | T183: 31.1 | U183: 83 | V183: 2.5000000000000001e-002 | W183: 0.151 | X183: 0.16300000000000001 | Y183: 206 | Z183: 2.28 | AA183: 1.2199999999999999e-002 | AB183: 6.3e-003 | AC183: -1.84e-002 | AD183: -2.07e-002 | AE183: 92.18 | AF183: 95.13 | AG183: 0.64 | AH183: AA | AI183: 4.2800000000000005e-002 | AJ183: =H183+100*O183 -> 109.5 | AK183: 109.6 | AL183: 21 | AM183: 14.5 | AN183: 8 | AO183: 0.13400000000000001 | AP183: 50 | AQ183: 海亮转债!
A184: 138 | B184: 113588 | C184: 润达转债! | D184: 603108 | E184: 润达医疗 | F184: 医药 | G184: 医疗器械 | H184: 107.4 | I184: 0. | J184: -3.3e-003 | K184: 11.88 | L184: -6.7000000000000002e-003 | M184: 114.2 | N184: 13.36 | O184: 0.20800000000000002 | P184: 88.92 | Q184: 转股中 | R184: 5.17年 | S184: 3.17年 | T184: 5.5 | U184: 1.8 | V184: 3.0000000000000001e-003 | W184: 8.0000000000000002e-002 | X184: 7.0999999999999994e-002 | Y184: 69 | Z184: 2.3 | AA184: 1.2199999999999999e-002 | AB184: 7.0999999999999995e-003 | AC184: -1.0500000000000001e-002 | AD184: -1.2699999999999999e-002 | AE184: 89.87 | AF184: 91.71 | AG184: 0.49 | AH184: AA | AI184: 4.4299999999999999e-002 | AJ184: =H184+100*O184 -> 128.20000000000002 | AK184: 125.9 | AL184: 163 | AM184: 34.2 | AN184: 172 | AO184: 3.4000000000000002e-002 | AP184: 10 | AQ184: 润达转债!
A185: 53 | B185: 123078 | C185: 飞凯转债! | D185: 300398 | E185: 飞凯材料 | F185: 化工 | G185: 化工 | H185: 107.8 | I185: 7.4999999999999997e-003 | J185: -5.1999999999999998e-003 | K185: 15.36 | L185: 3.9000000000000003e-003 | M185: 115.2 | N185: 15.62 | O185: 9.6000000000000002e-002 | P185: 98.34 | Q185: 48天 | R185: 5.61年 | S185: 3.62年 | T185: 8.2 | U185: 3.8 | V185: 4.0000000000000001e-003 | W185: 0.10400000000000001 | X185: 0.10199999999999999 | Y185: 79 | Z185: 3 | AA185: 1.21e-002 | AB185: 7.1999999999999998e-003 | AC185: -1.03e-002 | AD185: -1.21e-002 | AE185: 88.15 | AF185: 90.73 | AG185: 0.59 | AH185: AA | AI185: 4.4299999999999999e-002 | AJ185: =H185+100*O185 -> 117.39999999999999 | AK185: 117.3 | AL185: 76 | AM185: 26.5 | AN185: 99 | AO185: -1.7000000000000001e-002 | AP185: 8 | AQ185: 飞凯转债!
A186: 10 | B186: 128144 | C186: 利民转债 | D186: 2734 | E186: 利民股份 | F186: 化工 | G186: 农化 | H186: 106.51 | I186: 2.8000000000000004e-003 | J186: 2.7000000000000001e-003 | K186: 13.14 | L186: 1.e-002 | M186: 114.1 | N186: 14.23 | O186: 0.153 | P186: 92.34 | Q186: 4月22天 | R186: 5.87年 | S186: 3.87年 | T186: 9.8 | U186: 5.6 | V186: 5.0000000000000001e-003 | W186: 0.20000000000000001 | X186: 0.185 | Y186: 49 | Z186: 2.1 | AA186: 1.2e-002 | AB186: 7.6e-003 | AC186: -8.6999999999999994e-003 | AD186: -1.e-002 | AE186: 86.44 | AF186: 88.79 | AG186: 0.55 | AH186: AA | AI186: 4.4299999999999999e-002 | AJ186: =H186+100*O186 -> 121.81 | AK186: 120.7 | AL186: 112 | AM186: 31.9 | AN186: 155 | AO186: -1.3999999999999999e-002 | AP186: 4 | AQ186: 利民转债
A187: 220 | B187: 123033 | C187: 金力转债! | D187: 300748 | E187: 金力永磁 | F187: 电子 | G187: 元器件制 | H187: 115.32 | I187: 1.7000000000000001e-003 | J187: -3.0000000000000001e-003 | K187: 37.01 | L187: -2.3999999999999998e-003 | M187: 121.5 | N187: 40.68 | O187: 0.26800000000000002 | P187: 90.98 | Q187: 转股中 | R187: 4.54年 | S187: 2.55年 | T187: 4.34 | U187: 12 | V187: 2.4e-002 | W187: 2.7000000000000003e-002 | X187: 2.5000000000000001e-002 | Y187: 160 | Z187: 10.54 | AA187: 1.1899999999999999e-002 | AB187: 3.5999999999999999e-003 | AC187: -3.4500000000000003e-002 | AD187: -3.78e-002 | AE187: 89.02 | AF187: 92.51 | AG187: 0.52 | AH187: AA- | AI187: 6.3799999999999996e-002 | AJ187: =H187+100*O187 -> 142.12 | AK187: 139.7 | AL187: 275 | AM187: 47.1 | AN187: 269 | AO187: -1.e-003 | AP187: 27 | AQ187: 金力转债!
A188: 2 | B188: 128145 | C188: N日丰转 | D188: 2953 | E188: 日丰股份 | F188: 家电 | G188: 零部件制 | H188: 107.7 | I188: 7.6999999999999999e-002 | J188: 0. | K188: 20.35 | L188: 6.8999999999999999e-003 | M188: 115.4 | N188: 19.24 | O188: 1.8000000000000002e-002 | P188: 105.77 | Q188: 5月14天 | R188: 5.93年 | S188: 3.93年 | T188: 3.8 | U188: 362 | V188: 0.86499999999999999 | W188: 0.107 | X188: 0.114 | Y188: 35 | Z188: 3.45 | AA188: 1.1899999999999999e-002 | AB188: 7.1999999999999998e-003 | AC188: -9.1999999999999998e-003 | AD188: -1.09e-002 | AE188: 80.23 | AF188: 79.86 | AG188: 0.73 | AH188: AA- | AI188: 6.5299999999999997e-002 | AJ188: =H188+100*O188 -> 109.5 | AK188: 109.6 | AL188: 22 | AM188: 29.4 | AN188: 131 | AO188: 2.5000000000000001e-002 | AP188: 1 | AQ188: N日丰转
A189: 22 | B189: 113618 | C189: 美诺转债! | D189: 603538 | E189: 美诺华 | F189: 医药 | G189: 原料药 | H189: 107.91 | I189: 6.9999999999999993e-003 | J189: 6.6e-003 | K189: 31.03 | L189: 2.41e-002 | M189: 115.3 | N189: 37.47 | O189: 0.30299999999999999 | P189: 82.81 | Q189: 3月5天 | R189: 5.75年 | S189: 3.75年 | T189: 5.2 | U189: 5.9 | V189: 1.1000000000000001e-002 | W189: 0.11199999999999999 | X189: 9.3000000000000013e-002 | Y189: 46 | Z189: 3.05 | AA189: 1.18e-002 | AB189: 6.9999999999999993e-003 | AC189: -9.8999999999999991e-003 | AD189: -1.18e-002 | AE189: 81.23 | AF189: 80.74 | AG189: 0.56 | AH189: AA- | AI189: 6.5299999999999997e-002 | AJ189: =H189+100*O189 -> 138.21000000000001 | AK189: 133 | AL189: 234 | AM189: 51.8 | AN189: 284 | AO189: -2.1000000000000001e-002 | AP189: 3 | AQ189: 美诺转债!
A190: 7 | B190: 123101 | C190: 拓斯转债 | D190: 300607 | E190: 拓斯达 | F190: 机械装备 | G190: 机器人及 | H190: 107.9 | I190: 7.1999999999999998e-003 | J190: 1.4000000000000002e-003 | K190: 35.27 | L190: 1.9099999999999999e-002 | M190: 115.1 | N190: 42.25 | O190: 0.29299999999999998 | P190: 83.48 | Q190: 5月3天 | R190: 5.90年 | S190: 3.90年 | T190: 6.7 | U190: 7.6 | V190: 1.1000000000000001e-002 | W190: 7.0999999999999994e-002 | X190: 5.9999999999999998e-002 | Y190: 94 | Z190: 4.34 | AA190: 1.1200000000000002e-002 | AB190: 6.6e-003 | AC190: -1.e-002 | AD190: -1.1699999999999999e-002 | AE190: 86.99 | AF190: 89.54 | AG190: 0.45 | AH190: AA | AI190: 4.4299999999999999e-002 | AJ190: =H190+100*O190 -> 137.19999999999999 | AK190: 132.3 | AL190: 227 | AM190: 42.8 | AN190: 241 | AO190: -1.7000000000000001e-002 | AP190: 3 | AQ190: 拓斯转债
A191: 255 | B191: 113024 | C191: 核建转债! | D191: 601611 | E191: 中国核建 | F191: 建筑 | G191: 建筑工程 | H191: 104.75 | I191: 7.1999999999999998e-003 | J191: 3.0999999999999999e-003 | K191: 8.34 | L191: 2.58e-002 | M191: 109.3 | N191: 9.76 | O191: 0.22600000000000001 | P191: 85.45 | Q191: 转股中 | R191: 3.98年 | S191: 1.98年 | T191: 30 | U191: 17 | V191: 6.0000000000000001e-003 | W191: 0.13600000000000001 | X191: 0.11599999999999999 | Y191: 221 | Z191: 2.05 | AA191: 1.09e-002 | AB191: 6.5000000000000006e-003 | AC191: -8.8000000000000005e-003 | AD191: -1.1299999999999999e-002 | AE191: 94.99 | AF191: 94.56 | AG191: 0.4 | AH191: AAA | AI191: 3.78e-002 | AJ191: =H191+100*O191 -> 127.34999999999999 | AK191: 124 | AL191: 148 | AM191: 29.1 | AN191: 124 | AO191: 3.1e-002 | AP191: 39 | AQ191: 核建转债!
A192: 202 | B192: 123038 | C192: 联得转债! | D192: 300545 | E192: 联得装备 | F192: 机械装备 | G192: 专用设备 | H192: 112.999 | I192: -2.2000000000000001e-003 | J192: 4.7999999999999996e-003 | K192: 24.05 | L192: 4.1999999999999997e-003 | M192: 118.6 | N192: 25.29 | O192: 0.188 | P192: 95.1 | Q192: 转股中 | R192: 4.69年 | S192: 2.69年 | T192: 1.47 | U192: 6.4 | V192: 3.7999999999999999e-002 | W192: 4.2000000000000003e-002 | X192: 4.0000000000000001e-002 | Y192: 35 | Z192: 4.59 | AA192: 1.06e-002 | AB192: 3.5999999999999999e-003 | AC192: -2.9399999999999999e-002 | AD192: -3.1899999999999998e-002 | AE192: 84.68 | AF192: 85.2 | AG192: 0.63 | AH192: A+ | AI192: 7.4800000000000005e-002 | AJ192: =H192+100*O192 -> 131.79900000000001 | AK192: 130.9 | AL192: 215 | AM192: 45.7 | AN192: 258 | AO192: 3.7000000000000005e-002 | AP192: 18 | AQ192: 联得转债!
A193: 316 | B193: 128034 | C193: 江银转债! | D193: 2807 | E193: 江阴银行 | F193: 金融 | G193: 银行行业 | H193: 105.26 | I193: 0. | J193: 4.3e-003 | K193: 4.21 | L193: 9.5999999999999992e-003 | M193: 108.3 | N193: 4.5 | O193: 0.125 | P193: 93.56 | Q193: 转股中 | R193: 2.78年 | S193: 无权 | T193: 17.6 | U193: 11 | V193: 6.0000000000000001e-003 | W193: 0.192 | X193: 0.17999999999999999 | Y193: 91 | Z193: 0.78 | AA193: 1.04e-002 | AB193: 4.6999999999999993e-003 | AC193: 无权 | AD193: 无权 | AE193: 无权 | AF193: 97.41 | AG193: 0.45 | AH193: AA+ | AI193: 3.9300000000000002e-002 | AJ193: =H193+100*O193 -> 117.76000000000001 | AK193: 117 | AL193: 73 | AM193: 19.6 | AN193: 35 | AO193: -5.0000000000000001e-003 | AP193: 25 | AQ193: 江银转债!
A194: 154 | B194: 128107 | C194: 交科转债 | D194: 2061 | E194: 浙江交科 | F194: 建筑 | G194: 建筑工程 | H194: 109.592 | I194: 7.0999999999999995e-003 | J194: 1.9e-003 | K194: 5.65 | L194: 1.44e-002 | M194: 115.3 | N194: 5.36 | O194: 4.0000000000000001e-002 | P194: 105.41 | Q194: 转股中 | R194: 5年5.1天 | S194: 3年6.1天 | T194: 25 | U194: 4.8 | V194: 2.e-003 | W194: 0.32200000000000001 | X194: 0.33899999999999997 | Y194: 78 | Z194: 0.97 | AA194: 1.04e-002 | AB194: 4.8999999999999998e-003 | AC194: -1.7100000000000001e-002 | AD194: -1.9299999999999998e-002 | AE194: 91.12 | AF194: 94.1 | AG194: 0.63 | AH194: AA+ | AI194: 4.2300000000000004e-002 | AJ194: =H194+100*O194 -> 113.592 | AK194: 113.8 | AL194: 50 | AM194: 19.7 | AN194: 36 | AO194: 0. | AP194: 16 | AQ194: 交科转债
A195: 56 | B195: 110077 | C195: 洪城转债 | D195: 600461 | E195: 洪城水业 | F195: 城市公用 | G195: 城市公用 | H195: 107.45 | I195: 1.4000000000000002e-003 | J195: 2.8000000000000004e-003 | K195: 6.77 | L195: 7.4000000000000003e-003 | M195: 113.5 | N195: 7.13 | O195: 0.13200000000000001 | P195: 94.95 | Q195: 40天 | R195: 5.59年 | S195: 3.60年 | T195: 18 | U195: 2.6 | V195: 1.e-003 | W195: 0.28000000000000003 | X195: 0.26600000000000001 | Y195: 64 | Z195: 1.27 | AA195: 1.e-002 | AB195: 5.6000000000000008e-003 | AC195: -1.32e-002 | AD195: -1.43e-002 | AE195: 87.57 | AF195: 90.27 | AG195: 0.56 | AH195: AA+ | AI195: 4.2300000000000004e-002 | AJ195: =H195+100*O195 -> 120.65000000000001 | AK195: 119.9 | AL195: 104 | AM195: 29.7 | AN195: 132 | AO195: 0. | AP195: 6 | AQ195: 洪城转债
A196: 213 | B196: 110062 | C196: 烽火转债! | D196: 600498 | E196: 烽火通信 | F196: 通信互联 | G196: 通信设备 | H196: 106.06 | I196: -4.0000000000000002e-004 | J196: 5.3e-003 | K196: 18.51 | L196: 1.3100000000000001e-002 | M196: 110.8 | N196: 22.6 | O196: 0.29499999999999998 | P196: 81.9 | Q196: 转股中 | R196: 4.63年 | S196: 2.63年 | T196: 30.9 | U196: 3.4 | V196: 1.e-003 | W196: 0.14300000000000002 | X196: 0.11699999999999999 | Y196: 217 | Z196: 2.04 | AA196: 9.7000000000000003e-003 | AB196: 5.3e-003 | AC196: -9.4999999999999998e-003 | AD196: -1.1699999999999999e-002 | AE196: 93.2 | AF196: 93.63 | AG196: 0.37 | AH196: AAA | AI196: 3.78e-002 | AJ196: =H196+100*O196 -> 135.56 | AK196: 130.2 | AL196: 211 | AM196: 36.6 | AN196: 198 | AO196: -3.0000000000000001e-003 | AP196: 20 | AQ196: 烽火转债!
A197: 288 | B197: 128048 | C197: 张行转债 | D197: 2839 | E197: 张家港行 | F197: 金融 | G197: 银行行业 | H197: 109.702 | I197: 8.3000000000000001e-003 | J197: -2.e-003 | K197: 5.55 | L197: 1.2800000000000001e-002 | M197: 113.3 | N197: 5.76 | O197: 0.13900000000000001 | P197: 96.35 | Q197: 转股中 | R197: 3.57年 | S197: 无权 | T197: 25 | U197: 13 | V197: 5.0000000000000001e-003 | W197: 0.249 | X197: 0.23999999999999999 | Y197: 100 | Z197: 0.96 | AA197: 9.1999999999999998e-003 | AB197: 2.3999999999999998e-003 | AC197: 无权 | AD197: 无权 | AE197: 无权 | AF197: 98.49 | AG197: 0.49 | AH197: AA+ | AI197: 4.0800000000000003e-002 | AJ197: =H197+100*O197 -> 123.602 | AK197: 123 | AL197: 140 | AM197: 24.6 | AN197: 73 | AO197: -1.e-002 | AP197: 13 | AQ197: 张行转债
A198: 188 | B198: 113564 | C198: 天目转债!* | D198: 603136 | E198: 天目湖 | F198: 旅游餐饮 | G198: 旅游 | H198: 121.1 | I198: 1.6500000000000001e-002 | J198: 3.4000000000000002e-003 | K198: 28.25 | L198: 1.9900000000000001e-002 | M198: 126.2 | N198: 23.1 | O198: -1.e-002 | P198: 122.29 | Q198: 转股中 | R198: 4.87年 | S198: 2.87年 | T198: 1.79 | U198: 89 | V198: 0.41100000000000003 | W198: 5.2999999999999999e-002 | X198: 6.5000000000000002e-002 | Y198: 34 | Z198: 3.52 | AA198: 8.6999999999999994e-003 | AB198: -2.0000000000000001e-004 | AC198: -4.9000000000000002e-002 | AD198: -5.1399999999999994e-002 | AE198: 86.46 | AF198: 93.99 | AG198: 1 | AH198: AA- | AI198: 6.3799999999999996e-002 | AJ198: =H198+100*O198 -> 120.09999999999999 | AK198: 119.9 | AL198: 102 | AM198: 25.9 | AN198: 92 | AO198: -5.2999999999999999e-002 | AP198: 14 | AQ198: 天目转债!*
A199: 256 | B199: 128064 | C199: 司尔转债! | D199: 2538 | E199: 司尔特 | F199: 化工 | G199: 农化 | H199: 110.56 | I199: -4.1999999999999997e-003 | J199: -1.1999999999999999e-003 | K199: 6.07 | L199: -9.7999999999999997e-003 | M199: 114.3 | N199: 6.07 | O199: 0.106 | P199: 100 | Q199: 转股中 | R199: 3.98年 | S199: 1.98年 | T199: 8 | U199: 1.4 | V199: 2.e-003 | W199: 0.184 | X199: 0.184 | Y199: 44 | Z199: 1.14 | AA199: 8.5000000000000006e-003 | AB199: 2.e-003 | AC199: -3.3599999999999998e-002 | AD199: -3.6000000000000004e-002 | AE199: 94.02 | AF199: 97.04 | AG199: 0.55 | AH199: AA | AI199: 4.2800000000000005e-002 | AJ199: =H199+100*O199 -> 121.16 | AK199: 121.1 | AL199: 118 | AM199: 24.1 | AN199: 68 | AO199: 2.7000000000000003e-002 | AP199: 49 | AQ199: 司尔转债!
A200: 283 | B200: 128051 | C200: 光华转债! | D200: 2741 | E200: 光华科技 | F200: 电子 | G200: 元器件制 | H200: 111.44 | I200: 1.3100000000000001e-002 | J200: 5.6000000000000008e-003 | K200: 14.1 | L200: 2.69e-002 | M200: 114.8 | N200: 12.72 | O200: 5.0000000000000001e-003 | P200: 110.85 | Q200: 转股中 | R200: 3.66年 | S200: 1.66年 | T200: 2.47 | U200: 4.1 | V200: 1.4999999999999999e-002 | W200: 4.7e-002 | X200: 5.2000000000000005e-002 | Y200: 53 | Z200: 4.36 | AA200: 8.3000000000000001e-003 | AB200: 1.e-003 | AC200: -4.1799999999999997e-002 | AD200: -4.4900000000000002e-002 | AE200: 92.18 | AF200: 91.98 | AG200: 0.69 | AH200: AA- | AI200: 6.3799999999999996e-002 | AJ200: =H200+100*O200 -> 111.94 | AK200: 112 | AL200: 37 | AM200: 19.8 | AN200: 38 | AO200: 6.9999999999999993e-003 | AP200: 26 | AQ200: 光华转债!
A201: 222 | B201: 110060 | C201: 天路转债! | D201: 600326 | E201: 西藏天路 | F201: 建筑 | G201: 水泥 | H201: 110.76 | I201: 6.1999999999999998e-003 | J201: -3.0000000000000001e-003 | K201: 7.27 | L201: 5.5000000000000005e-003 | M201: 114.9 | N201: 7.16 | O201: 9.0999999999999998e-002 | P201: 101.54 | Q201: 转股中 | R201: 4.53年 | S201: 2.53年 | T201: 7.06 | U201: 5.1 | V201: 6.9999999999999993e-003 | W201: 0.106 | X201: 0.107 | Y201: 67 | Z201: 1.79 | AA201: 8.3000000000000001e-003 | AB201: 2.3e-003 | AC201: -2.5399999999999999e-002 | AD201: -2.7699999999999999e-002 | AE201: 92.44 | AF201: 95.39 | AG201: 0.58 | AH201: AA | AI201: 4.2800000000000005e-002 | AJ201: =H201+100*O201 -> 119.86 | AK201: 120 | AL201: 105 | AM201: 24.6 | AN201: 74 | AO201: 4.0000000000000001e-003 | AP201: 13 | AQ201: 天路转债!
A202: 320 | B202: 110041 | C202: 蒙电转债! | D202: 600863 | E202: 内蒙华电 | F202: 能源电力 | G202: 电力供应 | H202: 107 | I202: 1.1399999999999999e-002 | J202: -1.2999999999999999e-003 | K202: 2.51 | L202: 2.4500000000000001e-002 | M202: 109.3 | N202: 2.69 | O202: 0.14699999999999999 | P202: 93.31 | Q202: 转股中 | R202: 2.69年 | S202: 0.69年 | T202: 18.7 | U202: 6.7 | V202: 3.0000000000000001e-003 | W202: 0.128 | X202: 0.12 | Y202: 146 | Z202: 1.23 | AA202: 8.1000000000000013e-003 | AB202: 1.6000000000000001e-003 | AC202: -5.7000000000000002e-002 | AD202: -6.0899999999999996e-002 | AE202: 98.76 | AF202: 99.48 | AG202: 0.41 | AH202: AAA | AI202: 3.6299999999999999e-002 | AJ202: =H202+100*O202 -> 121.7 | AK202: 120.7 | AL202: 113 | AM202: 21.2 | AN202: 47 | AO202: -2.6000000000000002e-002 | AP202: 11 | AQ202: 蒙电转债!
A203: 70 | B203: 123073 | C203: 同和转债! | D203: 300636 | E203: 同和药业 | F203: 医药 | G203: 原料药 | H203: 117.22 | I203: 1.3600000000000001e-002 | J203: 4.4000000000000003e-003 | K203: 27.73 | L203: 2.3599999999999999e-002 | M203: 122.4 | N203: 23.8 | O203: 6.0000000000000001e-003 | P203: 116.51 | Q203: 17天 | R203: 5.53年 | S203: 3.53年 | T203: 3.6 | U203: 10 | V203: 2.4e-002 | W203: 0.10099999999999999 | X203: 0.11800000000000001 | Y203: 36 | Z203: 4.66 | AA203: 8.0000000000000002e-003 | AB203: 1.1000000000000001e-003 | AC203: -3.0800000000000001e-002 | AD203: -3.3000000000000002e-002 | AE203: 79.97 | AF203: 82.32 | AG203: 0.76 | AH203: A+ | AI203: 7.6299999999999993e-002 | AJ203: =H203+100*O203 -> 117.81999999999999 | AK203: 117.9 | AL203: 84 | AM203: 35.6 | AN203: 187 | AO203: 1.9e-002 | AP203: 10 | AQ203: 同和转债!
A204: 270 | B204: 127011 | C204: 中鼎转2! | D204: 887 | E204: 中鼎股份 | F204: 汽车 | G204: 零部件制 | H204: 111.1 | I204: 1.7399999999999999e-002 | J204: 8.8999999999999999e-003 | K204: 10.22 | L204: 6.6799999999999998e-002 | M204: 114.5 | N204: 11.59 | O204: 0.26000000000000001 | P204: 88.18 | Q204: 转股中 | R204: 3.89年 | S204: 1.89年 | T204: 12 | U204: 38 | V204: 2.7999999999999997e-002 | W204: 9.6000000000000002e-002 | X204: 8.5000000000000006e-002 | Y204: 125 | Z204: 1.43 | AA204: 7.9000000000000008e-003 | AB204: 1.1999999999999999e-003 | AC204: -3.7100000000000001e-002 | AD204: -3.9599999999999996e-002 | AE204: 94.76 | AF204: 98.28 | AG204: 0.39 | AH204: AA+ | AI204: 4.0800000000000003e-002 | AJ204: =H204+100*O204 -> 137.09999999999999 | AK204: 134 | AL204: 244 | AM204: 35.7 | AN204: 188 | AO204: 6.0000000000000001e-003 | AP204: 24 | AQ204: 中鼎转2!
A205: 76 | B205: 123070 | C205: 鹏辉转债 | D205: 300438 | E205: 鹏辉能源 | F205: 汽车 | G205: 零部件制 | H205: 110.295 | I205: 2.8199999999999999e-002 | J205: 8.8000000000000005e-003 | K205: 18.26 | L205: 7.1599999999999997e-002 | M205: 115.1 | N205: 20.16 | O205: 0.218 | P205: 90.58 | Q205: 10天 | R205: 5.51年 | S205: 3.51年 | T205: 8.9 | U205: 30 | V205: 3.1e-002 | W205: 0.11599999999999999 | X205: 0.105 | Y205: 77 | Z205: 3.1 | AA205: 7.9000000000000008e-003 | AB205: 3.0000000000000001e-003 | AC205: -1.7000000000000001e-002 | AD205: -1.8799999999999997e-002 | AE205: 88.46 | AF205: 91.05 | AG205: 0.52 | AH205: AA | AI205: 4.4299999999999999e-002 | AJ205: =H205+100*O205 -> 132.095 | AK205: 130 | AL205: 209 | AM205: 39 | AN205: 221 | AO205: 0.113 | AP205: 4 | AQ205: 鹏辉转债
A206: 343 | B206: 128013 | C206: 洪涛转债! | D206: 2325 | E206: 洪涛股份 | F206: 建筑 | G206: 装饰工程 | H206: 108.8 | I206: 8.8999999999999999e-003 | J206: 1.2999999999999999e-003 | K206: 2.55 | L206: 1.5900000000000001e-002 | M206: 109.8 | N206: 2.32 | O206: -1.e-002 | P206: 109.91 | Q206: 转股中 | R206: 1.29年 | S206: 回售内 | T206: 11.7 | U206: 31 | V206: 2.4e-002 | W206: 0.36499999999999999 | X206: 0.40200000000000002 | Y206: 32 | Z206: 1.07 | AA206: 7.1999999999999998e-003 | AB206: -6.8999999999999999e-003 | AC206: 回售内 | AD206: 回售内 | AE206: 100.3 | AF206: 101.7 | AG206: 0.64 | AH206: AA- | AI206: 6.2300000000000001e-002 | AJ206: =H206+100*O206 -> 107.8 | AK206: 107.7 | AL206: 17 | AM206: 6 | AN206: 2 | AO206: 5.4000000000000006e-002 | AP206: 93 | AQ206: 洪涛转债!
A207: 93 | B207: 128129 | C207: 青农转债! | D207: 2958 | E207: 青农商行 | F207: 金融 | G207: 银行行业 | H207: 108.13 | I207: -5.9999999999999995e-004 | J207: 3.3e-003 | K207: 4.34 | L207: 4.5999999999999999e-003 | M207: 112.2 | N207: 4.47 | O207: 0.114 | P207: 97.09 | Q207: 转股中 | R207: 5.36年 | S207: 无权 | T207: 50 | U207: 87 | V207: 1.6e-002 | W207: 0.20699999999999999 | X207: 0.20100000000000001 | Y207: 241 | Z207: 0.93 | AA207: 6.9999999999999993e-003 | AB207: 2.8000000000000004e-003 | AC207: 无权 | AD207: 无权 | AE207: 无权 | AF207: 91.56 | AG207: 0.57 | AH207: AAA | AI207: 3.9300000000000002e-002 | AJ207: =H207+100*O207 -> 119.53 | AK207: 119.2 | AL207: 96 | AM207: 27.6 | AN207: 113 | AO207: -2.3e-002 | AP207: 14 | AQ207: 青农转债!
A208: 260 | B208: 110057 | C208: 现代转债 | D208: 600420 | E208: 国药现代 | F208: 医药 | G208: 化学制药 | H208: 107.48 | I208: 8.0000000000000004e-004 | J208: -6.9999999999999993e-003 | K208: 9.69 | L208: -1.1200000000000002e-002 | M208: 110.3 | N208: 9.89 | O208: 9.6999999999999989e-002 | P208: 97.98 | Q208: 转股中 | R208: 3.96年 | S208: 1.96年 | T208: 16.2 | U208: 10 | V208: 6.0000000000000001e-003 | W208: 0.16200000000000001 | X208: 0.159 | Y208: 100 | Z208: 1.26 | AA208: 6.7000000000000002e-003 | AB208: 1.8e-003 | AC208: -2.0899999999999998e-002 | AD208: -2.3399999999999997e-002 | AE208: 95.05 | AF208: 95.49 | AG208: 0.55 | AH208: AAA | AI208: 3.78e-002 | AJ208: =H208+100*O208 -> 117.18000000000001 | AK208: 117 | AL208: 74 | AM208: 21.5 | AN208: 49 | AO208: 4.9000000000000002e-002 | AP208: 23 | AQ208: 现代转债
A209: 252 | B209: 113026 | C209: 核能转债! | D209: 601985 | E209: 中国核电 | F209: 能源电力 | G209: 核电 | H209: 106.46 | I209: 4.8999999999999998e-003 | J209: 1.2999999999999999e-003 | K209: 5.33 | L209: 1.3300000000000001e-002 | M209: 109.3 | N209: 5.86 | O209: 0.17000000000000001 | P209: 90.96 | Q209: 转股中 | R209: 3.99年 | S209: 1.998年 | T209: 78 | U209: 18 | V209: 2.e-003 | W209: 8.4000000000000005e-002 | X209: 7.5999999999999998e-002 | Y209: 930 | Z209: 1.59 | AA209: 6.7000000000000002e-003 | AB209: 2.3e-003 | AC209: -1.61e-002 | AD209: -1.8600000000000002e-002 | AE209: 94.92 | AF209: 94.49 | AG209: 0.47 | AH209: AAA | AI209: 3.78e-002 | AJ209: =H209+100*O209 -> 123.45999999999999 | AK209: 122 | AL209: 129 | AM209: 27 | AN209: 108 | AO209: -1.7000000000000001e-002 | AP209: 47 | AQ209: 核能转债!
A210: 180 | B210: 110067 | C210: 华安转债! | D210: 600909 | E210: 华安证券 | F210: 金融 | G210: 证券行业 | H210: 106.85 | I210: 3.8e-003 | J210: 1.5e-003 | K210: 6.22 | L210: 1.1399999999999999e-002 | M210: 110.3 | N210: 7.1 | O210: 0.22 | P210: 87.61 | Q210: 转股中 | R210: 4.90年 | S210: 无权 | T210: 28 | U210: 9.5 | V210: 3.0000000000000001e-003 | W210: 0.124 | X210: 0.109 | Y210: 225 | Z210: 1.59 | AA210: 6.6e-003 | AB210: 2.7000000000000001e-003 | AC210: 无权 | AD210: 无权 | AE210: 无权 | AF210: 92.16 | AG210: 0.46 | AH210: AAA | AI210: 3.78e-002 | AJ210: =H210+100*O210 -> 128.84999999999999 | AK210: 126.1 | AL210: 168 | AM210: 33.9 | AN210: 171 | AO210: -2.9999999999999999e-002 | AP210: 27 | AQ210: 华安转债!
A211: 113 | B211: 110073 | C211: 国投转债 | D211: 600061 | E211: 国投资本 | F211: 金融 | G211: 证券行业 | H211: 106.81 | I211: 8.5000000000000006e-003 | J211: 2.9999999999999997e-004 | K211: 12.89 | L211: 1.9799999999999998e-002 | M211: 110.5 | N211: 15.25 | O211: 0.26400000000000001 | P211: 84.52 | Q211: 转股中 | R211: 5.27年 | S211: 无权 | T211: 80 | U211: 39 | V211: 5.0000000000000001e-003 | W211: 0.14699999999999999 | X211: 0.124 | Y211: 545 | Z211: 1.29 | AA211: 6.5000000000000006e-003 | AB211: 2.8000000000000004e-003 | AC211: 无权 | AD211: 无权 | AE211: 无权 | AF211: 90.43 | AG211: 0.45 | AH211: AAA | AI211: 3.9300000000000002e-002 | AJ211: =H211+100*O211 -> 133.21000000000001 | AK211: 129.1 | AL211: 199 | AM211: 38.7 | AN211: 218 | AO211: 3.1e-002 | AP211: 22 | AQ211: 国投转债
A212: 123 | B212: 128121 | C212: 宏川转债! | D212: 2930 | E212: 宏川智慧 | F212: 交通运输 | G212: 物流业 | H212: 109.7 | I212: 2.7000000000000001e-003 | J212: -3.0999999999999999e-003 | K212: 16.92 | L212: -5.9999999999999995e-004 | M212: 113.3 | N212: 20.25 | O212: 0.313 | P212: 83.56 | Q212: 转股中 | R212: 5.25年 | S212: 3.25年 | T212: 6.7 | U212: 1.9 | V212: 3.0000000000000001e-003 | W212: 8.900000000000001e-002 | X212: 7.4999999999999997e-002 | Y212: 75 | Z212: 3.91 | AA212: 6.3e-003 | AB212: 1.7000000000000001e-003 | AC212: -1.6200000000000003e-002 | AD212: -1.83e-002 | AE212: 83.82 | AF212: 81.88 | AG212: 0.55 | AH212: AA- | AI212: 6.5299999999999997e-002 | AJ212: =H212+100*O212 -> 141. | AK212: 135.8 | AL212: 253 | AM212: 52 | AN212: 285 | AO212: -3.0000000000000001e-003 | AP212: 5 | AQ212: 宏川转债!
A213: 13 | B213: 123099 | C213: 普利转债 | D213: 300630 | E213: 普利制药 | F213: 医药 | G213: 化学制药 | H213: 119.445 | I213: 1.3100000000000001e-002 | J213: 9.4999999999999998e-003 | K213: 47.91 | L213: 3.4099999999999998e-002 | M213: 123.5 | N213: 46.22 | O213: 0.152 | P213: 103.66 | Q213: 4月9天 | R213: 5.82年 | S213: 3.82年 | T213: 8.5 | U213: 3.7 | V213: 4.0000000000000001e-003 | W213: 4.0999999999999995e-002 | X213: 4.2000000000000003e-002 | Y213: 209 | Z213: 10.7 | AA213: 5.8999999999999999e-003 | AB213: -8.9999999999999998e-004 | AC213: -3.4799999999999998e-002 | AD213: -3.6600000000000001e-002 | AE213: 80.89 | AF213: 86.07 | AG213: 0.66 | AH213: AA- | AI213: 6.5299999999999997e-002 | AJ213: =H213+100*O213 -> 134.64499999999998 | AK213: 135.2 | AL213: 249 | AM213: 49.2 | AN213: 279 | AO213: 8.5000000000000006e-002 | AP213: 4 | AQ213: 普利转债
A214: 120 | B214: 127020 | C214: 中金转债 | D214: 60 | E214: 中金岭南 | F214: 有色金属 | G214: 有色行业 | H214: 110.5 | I214: 3.5999999999999999e-003 | J214: -4.8999999999999998e-003 | K214: 4.76 | L214: -2.0999999999999999e-003 | M214: 113.7 | N214: 4.71 | O214: 9.3000000000000013e-002 | P214: 101.06 | Q214: 转股中 | R214: 5.26年 | S214: 3.26年 | T214: 38 | U214: 39 | V214: 9.0000000000000011e-003 | W214: 0.22399999999999998 | X214: 0.22600000000000001 | Y214: 170 | Z214: 1.47 | AA214: 5.5000000000000005e-003 | AB214: 8.0000000000000004e-004 | AC214: -2.1899999999999999e-002 | AD214: -2.3300000000000001e-002 | AE214: 88.97 | AF214: 91.71 | AG214: 0.6 | AH214: AA+ | AI214: 4.2300000000000004e-002 | AJ214: =H214+100*O214 -> 119.8 | AK214: 119.9 | AL214: 103 | AM214: 28.2 | AN214: 116 | AO214: 3.6000000000000004e-002 | AP214: 14 | AQ214: 中金转债
A215: 145 | B215: 123052 | C215: 飞鹿转债 | D215: 300665 | E215: 飞鹿股份 | F215: 化工 | G215: 化工 | H215: 123.91 | I215: -4.6999999999999993e-003 | J215: -1.e-004 | K215: 12.3 | L215: -6.5000000000000006e-003 | M215: 127.3 | N215: 9.9 | O215: -3.0000000000000001e-003 | P215: 124.24 | Q215: 转股中 | R215: 5年49天 | S215: 3年50天 | T215: 1.63 | U215: 43 | V215: 0.20899999999999999 | W215: 0.109 | X215: 0.13500000000000001 | Y215: 15 | Z215: 3.1 | AA215: 5.4000000000000003e-003 | AB215: -3.3e-003 | AC215: -4.8899999999999999e-002 | AD215: -5.1699999999999996e-002 | AE215: 82.85 | AF215: 88.2 | AG215: 0.75 | AH215: A+ | AI215: 7.6299999999999993e-002 | AJ215: =H215+100*O215 -> 123.61 | AK215: 123.6 | AL215: 144 | AM215: 35.4 | AN215: 185 | AO215: 6.2e-002 | AP215: 16 | AQ215: 飞鹿转债
A216: 4 | B216: 123104 | C216: 卫宁转债 | D216: 300253 | E216: 卫宁健康 | F216: 计算机及 | G216: 软件开发 | H216: 121.3 | I216: 2.5000000000000001e-003 | J216: -3.0999999999999999e-003 | K216: 17.22 | L216: -1.1999999999999999e-003 | M216: 125.1 | N216: 17.76 | O216: 0.251 | P216: 96.96 | Q216: 5月9天 | R216: 5.91年 | S216: 3.92年 | T216: 9.7 | U216: 13 | V216: 1.1000000000000001e-002 | W216: 2.6000000000000002e-002 | X216: 2.6000000000000002e-002 | Y216: 369 | Z216: 9.1 | AA216: 5.3e-003 | AB216: -1.7000000000000001e-003 | AC216: -3.8199999999999998e-002 | AD216: -3.9800000000000002e-002 | AE216: 86.92 | AF216: 97.21 | AG216: 0.51 | AH216: AA | AI216: 4.4299999999999999e-002 | AJ216: =H216+100*O216 -> 146.40000000000001 | AK216: 145.6 | AL216: 291 | AM216: 48.4 | AN216: 274 | AO216: 3.7000000000000005e-002 | AP216: 3 | AQ216: 卫宁转债
A217: 239 | B217: 113542 | C217: 好客转债 | D217: 603898 | E217: 好莱客 | F217: 其他 | G217: 家居用品 | H217: 112.41 | I217: 2.0400000000000001e-002 | J217: 2.1000000000000001e-002 | K217: 16.7 | L217: 7.1199999999999999e-002 | M217: 114.9 | N217: 16.27 | O217: 9.5000000000000001e-002 | P217: 102.64 | Q217: 转股中 | R217: 4.29年 | S217: 2.29年 | T217: 6.03 | U217: 15 | V217: 2.2000000000000002e-002 | W217: 0.11599999999999999 | X217: 0.11900000000000001 | Y217: 52 | Z217: 2.02 | AA217: 5.1999999999999998e-003 | AB217: -1.e-003 | AC217: -3.3700000000000001e-002 | AD217: -3.6299999999999999e-002 | AE217: 93.38 | AF217: 96.36 | AG217: 0.58 | AH217: AA | AI217: 4.2800000000000005e-002 | AJ217: =H217+100*O217 -> 121.91 | AK217: 122.2 | AL217: 132 | AM217: 25.8 | AN217: 89 | AO217: -3.2000000000000001e-002 | AP217: 18 | AQ217: 好客转债
A218: 77 | B218: 128135 | C218: 洽洽转债! | D218: 2557 | E218: 洽洽食品 | F218: 食品饮料 | G218: 休闲食品 | H218: 117 | I218: 5.4000000000000003e-003 | J218: -3.2000000000000002e-003 | K218: 51.72 | L218: 5.4000000000000003e-003 | M218: 120.2 | N218: 60.83 | O218: 0.376 | P218: 85.02 | Q218: 10天 | R218: 5.51年 | S218: 3.51年 | T218: 13.4 | U218: 16 | V218: 1.e-002 | W218: 5.0999999999999997e-002 | X218: 4.2999999999999997e-002 | Y218: 262 | Z218: 6.84 | AA218: 5.0000000000000001e-003 | AB218: -1.2999999999999999e-003 | AC218: -3.2500000000000001e-002 | AD218: -3.44e-002 | AE218: 88.55 | AF218: 95.08 | AG218: 0.41 | AH218: AA | AI218: 4.4299999999999999e-002 | AJ218: =H218+100*O218 -> 154.59999999999999 | AK218: 149 | AL218: 300 | AM218: 53.9 | AN218: 292 | AO218: 3.3000000000000002e-002 | AP218: 10 | AQ218: 洽洽转债!
A219: 75 | B219: 123072 | C219: 乐歌转债! | D219: 300729 | E219: 乐歌股份 | F219: 其他 | G219: 家居用品 | H219: 126.155 | I219: -1.1299999999999999e-002 | J219: 1.6799999999999999e-002 | K219: 35.72 | L219: 4.1100000000000005e-002 | M219: 129.6 | N219: 73.13 | O219: 1.5800000000000001 | P219: 48.84 | Q219: 11天 | R219: 5.51年 | S219: 3.52年 | T219: 1.42 | U219: 62 | V219: 0.34600000000000003 | W219: 2.8999999999999998e-002 | X219: 1.3999999999999999e-002 | Y219: 50 | Z219: 5.21 | AA219: 5.0000000000000001e-003 | AB219: -3.7000000000000002e-003 | AC219: -4.5100000000000001e-002 | AD219: -4.8300000000000003e-002 | AE219: 81.73 | AF219: 87.52 | AG219: 0.13 | AH219: A+ | AI219: 7.6299999999999993e-002 | AJ219: =H219+100*O219 -> 284.15499999999997 | AK219: 203.5 | AL219: 333 | AM219: 115.9 | AN219: 334 | AO219: 3.4000000000000002e-002 | AP219: 8 | AQ219: 乐歌转债!
A220: 330 | B220: 123002 | C220: 国祯转债!! | D220: 300388 | E220: 节能国祯 | F220: 城市公用 | G220: 三废处理 | H220: 107.43 | I220: -2.8999999999999998e-003 | J220: 7.7000000000000002e-003 | K220: 7.97 | L220: 1.01e-002 | M220: 108.8 | N220: 8.48 | O220: 0.14300000000000002 | P220: 93.99 | Q220: 转股中 | R220: 2.61年 | S220: 0.61年 | T220: 2.52 | U220: 2.8 | V220: 1.e-002 | W220: 4.4999999999999998e-002 | X220: 4.2999999999999997e-002 | Y220: 56 | Z220: 1.47 | AA220: 4.8999999999999998e-003 | AB220: -1.4000000000000002e-003 | AC220: -7.0300000000000001e-002 | AD220: -7.3899999999999993e-002 | AE220: 98.42 | AF220: 98.06 | AG220: 0.48 | AH220: AA | AI220: 4.1299999999999996e-002 | AJ220: =H220+100*O220 -> 121.73 | AK220: 120.9 | AL220: 116 | AM220: 22.5 | AN220: 57 | AO220: -3.7000000000000005e-002 | AP220: 15 | AQ220: 国祯转债!!
A221: 329 | B221: 128021 | C221: 兄弟转债!! | D221: 2562 | E221: 兄弟科技 | F221: 医药 | G221: 原料药 | H221: 107.5 | I221: 1.5100000000000001e-002 | J221: -1.5100000000000001e-002 | K221: 5.08 | L221: 2.4199999999999999e-002 | M221: 108.8 | N221: 5.19 | O221: 9.8000000000000004e-002 | P221: 97.88 | Q221: 转股中 | R221: 2.62年 | S221: 0.62年 | T221: 2.65 | U221: 4 | V221: 1.3999999999999999e-002 | W221: 4.9000000000000002e-002 | X221: 4.8000000000000001e-002 | Y221: 54 | Z221: 1.98 | AA221: 4.6999999999999993e-003 | AB221: -1.7000000000000001e-003 | AC221: -7.0099999999999996e-002 | AD221: -7.3700000000000002e-002 | AE221: 98.38 | AF221: 98.01 | AG221: 0 | AH221: AA | AI221: 4.1299999999999996e-002 | AJ221: =H221+100*O221 -> 117.3 | AK221: 117.1 | AL221: 75 | AM221: 18.7 | AN221: 29 | AO221: 1.3999999999999999e-002 | AP221: 14 | AQ221: 兄弟转债!!
A222: 287 | B222: 110047 | C222: 山鹰转债 | D222: 600567 | E222: 山鹰国际 | F222: 造纸包装 | G222: 包装用纸 | H222: 115.77 | I222: 1.0700000000000001e-002 | J222: -5.8999999999999999e-003 | K222: 3.57 | L222: 8.5000000000000006e-003 | M222: 117.5 | N222: 3.34 | O222: 8.3000000000000004e-002 | P222: 106.89 | Q222: 转股中 | R222: 3.60年 | S222: 1.60年 | T222: 22.5 | U222: 15 | V222: 6.0000000000000001e-003 | W222: 0.13600000000000001 | X222: 0.14599999999999999 | Y222: 165 | Z222: 1.12 | AA222: 4.1999999999999997e-003 | AB222: -4.3e-003 | AC222: -6.54e-002 | AD222: -6.8199999999999997e-002 | AE222: 95.87 | AF222: 102.03 | AG222: 0.56 | AH222: AA+ | AI222: 4.0800000000000003e-002 | AJ222: =H222+100*O222 -> 124.06999999999999 | AK222: 124.7 | AL222: 154 | AM222: 22.6 | AN222: 59 | AO222: -1.7000000000000001e-002 | AP222: 34 | AQ222: 山鹰转债
A223: 194 | B223: 128094 | C223: 星帅转债 | D223: 2860 | E223: 星帅尔 | F223: 家电 | G223: 零部件制 | H223: 118.7 | I223: 2.2700000000000001e-002 | J223: -2.0000000000000001e-004 | K223: 16.15 | L223: 3.0600000000000002e-002 | M223: 121 | N223: 13.95 | O223: 2.5000000000000001e-002 | P223: 115.77 | Q223: 转股中 | R223: 4.75年 | S223: 2.75年 | T223: 2.72 | U223: 9.2 | V223: 2.8999999999999998e-002 | W223: 8.4000000000000005e-002 | X223: 9.8000000000000004e-002 | Y223: 32 | Z223: 3.45 | AA223: 4.0999999999999995e-003 | AB223: -3.4000000000000002e-003 | AC223: -4.4400000000000002e-002 | AD223: -4.7e-002 | AE223: 84.51 | AF223: 86.57 | AG223: 0.74 | AH223: A+ | AI223: 7.4800000000000005e-002 | AJ223: =H223+100*O223 -> 121.2 | AK223: 121.6 | AL223: 126 | AM223: 35.1 | AN223: 184 | AO223: 4.2000000000000003e-002 | AP223: 30 | AQ223: 星帅转债
A224: 162 | B224: 123048 | C224: 应急转债! | D224: 300527 | E224: 中船应急 | F224: 机械装备 | G224: 专用设备 | H224: 110.705 | I224: 7.4000000000000003e-003 | J224: -2.0000000000000001e-004 | K224: 8.61 | L224: 1.29e-002 | M224: 112.8 | N224: 8.9 | O224: 0.14400000000000002 | P224: 96.74 | Q224: 转股中 | R224: 4.98年 | S224: 2.98年 | T224: 3.8 | U224: 57 | V224: 0.13500000000000001 | W224: 4.5999999999999999e-002 | X224: 4.4000000000000004e-002 | Y224: 83 | Z224: 3.33 | AA224: 3.8e-003 | AB224: -8.9999999999999998e-004 | AC224: -2.1899999999999999e-002 | AD224: -2.3799999999999998e-002 | AE224: 91.16 | AF224: 92.76 | AG224: 0.56 | AH224: AA+ | AI224: 4.0800000000000003e-002 | AJ224: =H224+100*O224 -> 125.105 | AK224: 124.7 | AL224: 155 | AM224: 31.9 | AN224: 156 | AO224: 3.6000000000000004e-002 | AP224: 17 | AQ224: 应急转债!
A225: 41 | B225: 113043 | C225: 财通转债 | D225: 601108 | E225: 财通证券 | F225: 金融 | G225: 证券行业 | H225: 107.88 | I225: 3.3e-003 | J225: -2.2000000000000001e-003 | K225: 10.63 | L225: 2.8000000000000004e-003 | M225: 110.2 | N225: 13.33 | O225: 0.35299999999999998 | P225: 79.74 | Q225: 2月1天 | R225: 5.65年 | S225: 无权 | T225: 38 | U225: 16 | V225: 4.0000000000000001e-003 | W225: 0.10000000000000001 | X225: 7.9000000000000001e-002 | Y225: 382 | Z225: 1.75 | AA225: 3.8e-003 | AB225: 5.0000000000000001e-004 | AC225: 无权 | AD225: 无权 | AE225: 无权 | AF225: 88.9 | AG225: 0.41 | AH225: AAA | AI225: 3.9300000000000002e-002 | AJ225: =H225+100*O225 -> 143.18000000000001 | AK225: 136 | AL225: 255 | AM225: 47.1 | AN225: 268 | AO225: -5.2000000000000005e-002 | AP225: 9 | AQ225: 财通转债
A226: 97 | B226: 128128 | C226: 齐翔转2 | D226: 2408 | E226: 齐翔腾达 | F226: 化工 | G226: 化工 | H226: 113.099 | I226: -5.0000000000000001e-004 | J226: 1.1999999999999999e-003 | K226: 9.3 | L226: 1.1000000000000001e-003 | M226: 115.3 | N226: 8.22 | O226: 0. | P226: 113.14 | Q226: 转股中 | R226: 5.34年 | S226: 3.35年 | T226: 16.2 | U226: 50 | V226: 2.7000000000000003e-002 | W226: 9.0999999999999998e-002 | X226: 0.10400000000000001 | Y226: 177 | Z226: 2.01 | AA226: 3.7000000000000002e-003 | AB226: -1.4000000000000002e-003 | AC226: -2.46e-002 | AD226: -2.6499999999999999e-002 | AE226: 89.21 | AF226: 91.89 | AG226: 0.7 | AH226: AA | AI226: 4.4299999999999999e-002 | AJ226: =H226+100*O226 -> 113.099 | AK226: 113.1 | AL226: 45 | AM226: 21.2 | AN226: 46 | AO226: 8.0000000000000002e-003 | AP226: 40 | AQ226: 齐翔转2
A227: 227 | B227: 128078 | C227: 太极转债! | D227: 2368 | E227: 太极股份 | F227: 计算机及 | G227: 软件开发 | H227: 115.311 | I227: 1.9e-003 | J227: -1.9e-003 | K227: 22.1 | L227: 2.6000000000000002e-002 | M227: 116.9 | N227: 22.4 | O227: 0.16899999999999998 | P227: 98.66 | Q227: 转股中 | R227: 4.51年 | S227: 2.52年 | T227: 9.6 | U227: 1 | V227: 1.e-003 | W227: 7.4999999999999997e-002 | X227: 7.400000000000001e-002 | Y227: 128 | Z227: 3.84 | AA227: 3.0999999999999999e-003 | AB227: -3.4999999999999996e-003 | AC227: -4.0199999999999993e-002 | AD227: -4.2500000000000003e-002 | AE227: 92.51 | AF227: 97.12 | AG227: 0 | AH227: AA | AI227: 4.2800000000000005e-002 | AJ227: =H227+100*O227 -> 132.21100000000001 | AK227: 132 | AL227: 222 | AM227: 34.8 | AN227: 180 | AO227: 3.7999999999999999e-002 | AP227: 11 | AQ227: 太极转债!
A228: 193 | B228: 113563 | C228: 柳药转债 | D228: 603368 | E228: 柳药股份 | F228: 医药 | G228: 医药商业 | H228: 111.3 | I228: 1.18e-002 | J228: -9.7999999999999997e-003 | K228: 22.77 | L228: 4.0000000000000001e-003 | M228: 112.9 | N228: 24.47 | O228: 0.19600000000000001 | P228: 93.05 | Q228: 转股中 | R228: 4.75年 | S228: 2.75年 | T228: 8.02 | U228: 7 | V228: 8.0000000000000002e-003 | W228: 9.6999999999999989e-002 | X228: 8.9999999999999997e-002 | Y228: 83 | Z228: 1.67 | AA228: 3.0999999999999999e-003 | AB228: -1.9e-003 | AC228: -2.5099999999999997e-002 | AD228: -2.7300000000000001e-002 | AE228: 91.59 | AF228: 92.88 | AG228: 0.52 | AH228: AA | AI228: 4.2800000000000005e-002 | AJ228: =H228+100*O228 -> 130.90000000000001 | AK228: 129.5 | AL228: 204 | AM228: 36.7 | AN228: 200 | AO228: 2.4e-002 | AP228: 17 | AQ228: 柳药转债
A229: 178 | B229: 113572 | C229: 三祥转债! | D229: 603663 | E229: 三祥新材 | F229: 其他 | G229: 其他 | H229: 111.22 | I229: 3.9000000000000003e-003 | J229: -8.9999999999999998e-004 | K229: 14.32 | L229: 4.1999999999999997e-003 | M229: 112.8 | N229: 14.19 | O229: 0.10199999999999999 | P229: 100.92 | Q229: 转股中 | R229: 4.90年 | S229: 2.90年 | T229: 1.69 | U229: 1.2 | V229: 6.0000000000000001e-003 | W229: 6.0999999999999999e-002 | X229: 6.2e-002 | Y229: 28 | Z229: 4.48 | AA229: 2.8999999999999998e-003 | AB229: -1.8e-003 | AC229: -2.3900000000000001e-002 | AD229: -2.5899999999999999e-002 | AE229: 82.92 | AF229: 79.74 | AG229: 0.72 | AH229: A+ | AI229: 7.4800000000000005e-002 | AJ229: =H229+100*O229 -> 121.42 | AK229: 121.5 | AL229: 122 | AM229: 38.6 | AN229: 216 | AO229: -5.0999999999999997e-002 | AP229: 18 | AQ229: 三祥转债!
A230: 19 | B230: 123094 | C230: 星源转2! | D230: 300568 | E230: 星源材质 | F230: 电子 | G230: 电子行业 | H230: 115.8 | I230: 1.5800000000000002e-002 | J230: -1.3000000000000001e-002 | K230: 29.99 | L230: 5.0000000000000001e-003 | M230: 117.3 | N230: 31.54 | O230: 0.218 | P230: 95.09 | Q230: 3月11天 | R230: 5.76年 | S230: 3.76年 | T230: 10 | U230: 31 | V230: 2.7000000000000003e-002 | W230: 7.400000000000001e-002 | X230: 7.0999999999999994e-002 | Y230: 135 | Z230: 4.62 | AA230: 2.3e-003 | AB230: -3.0000000000000001e-003 | AC230: -2.7699999999999999e-002 | AD230: -2.9500000000000002e-002 | AE230: 87.68 | AF230: 91.81 | AG230: 0.55 | AH230: AA | AI230: 4.4299999999999999e-002 | AJ230: =H230+100*O230 -> 137.59999999999999 | AK230: 136.5 | AL230: 260 | AM230: 44.7 | AN230: 253 | AO230: 0.105 | AP230: 3 | AQ230: 星源转2!
A231: 160 | B231: 110070 | C231: 凌钢转债! | D231: 600231 | E231: 凌钢股份 | F231: 钢铁 | G231: 炼钢 | H231: 116.27 | I231: 2.0000000000000001e-004 | J231: -1.6799999999999999e-002 | K231: 3.08 | L231: -2.53e-002 | M231: 117.4 | N231: 2.75 | O231: 3.7999999999999999e-002 | P231: 112 | Q231: 转股中 | R231: 4.99年 | S231: 2.99年 | T231: 2.31 | U231: 329 | V231: 1.21 | W231: 2.7000000000000003e-002 | X231: 2.9999999999999999e-002 | Y231: 87 | Z231: 1.06 | AA231: 2.e-003 | AB231: -4.0999999999999995e-003 | AC231: -3.5799999999999998e-002 | AD231: -3.7900000000000003e-002 | AE231: 90.98 | AF231: 95.64 | AG231: 0.66 | AH231: AA | AI231: 4.2800000000000005e-002 | AJ231: =H231+100*O231 -> 120.06999999999999 | AK231: 120.5 | AL231: 108 | AM231: 24.9 | AN231: 79 | AO231: 0.10099999999999999 | AP231: 20 | AQ231: 凌钢转债!
A232: 247 | B232: 113536 | C232: 三星转债 | D232: 603578 | E232: 三星新材 | F232: 家电 | G232: 零部件制 | H232: 113.92 | I232: 8.5000000000000006e-003 | J232: 3.4000000000000002e-003 | K232: 20.76 | L232: 1.9599999999999999e-002 | M232: 114.8 | N232: 19.54 | O232: 7.2000000000000008e-002 | P232: 106.24 | Q232: 转股中 | R232: 4年44天 | S232: 2年45天 | T232: 1.49 | U232: 9.2 | V232: 5.4000000000000006e-002 | W232: 7.8e-002 | X232: 8.3000000000000004e-002 | Y232: 19 | Z232: 2.64 | AA232: 1.9e-003 | AB232: -4.5000000000000005e-003 | AC232: -4.2300000000000004e-002 | AD232: -4.4900000000000002e-002 | AE232: 93.95 | AF232: 96.95 | AG232: 0.61 | AH232: AA | AI232: 4.2800000000000005e-002 | AJ232: =H232+100*O232 -> 121.12 | AK232: 121.6 | AL232: 124 | AM232: 24.7 | AN232: 76 | AO232: 3.3000000000000002e-002 | AP232: 37 | AQ232: 三星转债
A233: 51 | B233: 123079 | C233: 运达转债 | D233: 300772 | E233: 运达股份 | F233: 能源电力 | G233: 风能 | H233: 114.011 | I233: 1.2800000000000001e-002 | J233: 4.3e-003 | K233: 15.22 | L233: 2.8399999999999998e-002 | M233: 115.1 | N233: 15.31 | O233: 0.14699999999999999 | P233: 99.41 | Q233: 52天 | R233: 5.62年 | S233: 3.63年 | T233: 5.77 | U233: 17 | V233: 2.5000000000000001e-002 | W233: 0.129 | X233: 0.128 | Y233: 45 | Z233: 2.91 | AA233: 1.7000000000000001e-003 | AB233: -3.0999999999999999e-003 | AC233: -2.5099999999999997e-002 | AD233: -2.69e-002 | AE233: 88.02 | AF233: 90.59 | AG233: 0.6 | AH233: AA | AI233: 4.4299999999999999e-002 | AJ233: =H233+100*O233 -> 128.71099999999998 | AK233: 128.6 | AL233: 197 | AM233: 38 | AN233: 209 | AO233: 8.0000000000000002e-003 | AP233: 4 | AQ233: 运达转债
A234: 30 | B234: 123090 | C234: 三诺转债 | D234: 300298 | E234: 三诺生物 | F234: 医药 | G234: 医疗器械 | H234: 116 | I234: 3.7000000000000002e-003 | J234: 7.8000000000000005e-003 | K234: 30.1 | L234: 2.5600000000000001e-002 | M234: 117.1 | N234: 35.35 | O234: 0.36200000000000004 | P234: 85.15 | Q234: 2月10天 | R234: 5.68年 | S234: 3.68年 | T234: 5 | U234: 2.9 | V234: 5.0000000000000001e-003 | W234: 2.8999999999999998e-002 | X234: 2.5000000000000001e-002 | Y234: 170 | Z234: 6.29 | AA234: 1.7000000000000001e-003 | AB234: -3.5999999999999999e-003 | AC234: -2.92e-002 | AD234: -3.0899999999999997e-002 | AE234: 87.81 | AF234: 91.94 | AG234: 0.45 | AH234: AA | AI234: 4.4299999999999999e-002 | AJ234: =H234+100*O234 -> 152.19999999999999 | AK234: 146.9 | AL234: 294 | AM234: 54.9 | AN234: 298 | AO234: -5.0000000000000001e-003 | AP234: 3 | AQ234: 三诺转债
A235: 149 | B235: 127017 | C235: 万青转债 | D235: 789 | E235: 万年青 | F235: 建筑 | G235: 水泥 | H235: 117.717 | I235: 1.1000000000000001e-003 | J235: 1.04e-002 | K235: 13.96 | L235: 2.12e-002 | M235: 118.4 | N235: 14.16 | O235: 0.19399999999999998 | P235: 98.59 | Q235: 转股中 | R235: 5年47天 | S235: 3年48天 | T235: 10 | U235: 9.2 | V235: 8.0000000000000002e-003 | W235: 8.9999999999999997e-002 | X235: 8.900000000000001e-002 | Y235: 111 | Z235: 1.78 | AA235: 1.1999999999999999e-003 | AB235: -5.1000000000000004e-003 | AC235: -3.7999999999999999e-002 | AD235: -4.0000000000000001e-002 | AE235: 90.63 | AF235: 96.16 | AG235: 0.54 | AH235: AA+ | AI235: 4.2300000000000004e-002 | AJ235: =H235+100*O235 -> 137.11699999999999 | AK235: 136.8 | AL235: 262 | AM235: 40.7 | AN235: 228 | AO235: 1.3999999999999999e-002 | AP235: 9 | AQ235: 万青转债
A236: 196 | B236: 127015 | C236: 希望转债! | D236: 876 | E236: 新 希 望 | F236: 农业 | G236: 畜牧业 | H236: 109.896 | I236: 1.1000000000000001e-002 | J236: -6.0999999999999995e-003 | K236: 17.7 | L236: 1.03e-002 | M236: 110 | N236: 19.75 | O236: 0.22600000000000001 | P236: 89.62 | Q236: 转股中 | R236: 4.72年 | S236: 2.72年 | T236: 9.5 | U236: 20 | V236: 1.9e-002 | W236: 1.2e-002 | X236: 1.1000000000000001e-002 | Y236: 798 | Z236: 2.2 | AA236: 2.0000000000000001e-004 | AB236: -3.7000000000000002e-003 | AC236: -2.35e-002 | AD236: -2.52e-002 | AE236: 92.32 | AF236: 92.6 | AG236: 0.48 | AH236: AAA | AI236: 3.78e-002 | AJ236: =H236+100*O236 -> 132.49600000000001 | AK236: 130.2 | AL236: 210 | AM236: 37.6 | AN236: 206 | AO236: -9.6999999999999989e-002 | AP236: 28 | AQ236: 希望转债!
A237: 240 | B237: 113541 | C237: 荣晟转债! | D237: 603165 | E237: 荣晟环保 | F237: 造纸包装 | G237: 包装用纸 | H237: 114.97 | I237: 4.5000000000000005e-003 | J237: -1.e-004 | K237: 13.2 | L237: 6.0999999999999995e-003 | M237: 115 | N237: 11.54 | O237: 5.0000000000000001e-003 | P237: 114.38 | Q237: 转股中 | R237: 4.27年 | S237: 2.27年 | T237: 2.5 | U237: 5.2 | V237: 1.8000000000000002e-002 | W237: 7.4999999999999997e-002 | X237: 8.5000000000000006e-002 | Y237: 34 | Z237: 2.07 | AA237: 1.e-004 | AB237: -6.1999999999999998e-003 | AC237: -4.2699999999999995e-002 | AD237: -4.53e-002 | AE237: 89.19 | AF237: 88.86 | AG237: 0.73 | AH237: AA- | AI237: 6.3799999999999996e-002 | AJ237: =H237+100*O237 -> 115.47 | AK237: 115.6 | AL237: 60 | AM237: 26.4 | AN237: 97 | AO237: -1.2e-002 | AP237: 44 | AQ237: 荣晟转债!
A238: 210 | B238: 110063 | C238: 鹰19转债 | D238: 600567 | E238: 山鹰国际 | F238: 造纸包装 | G238: 包装用纸 | H238: 115.84 | I238: 8.8000000000000005e-003 | J238: -3.4999999999999996e-003 | K238: 3.57 | L238: 8.5000000000000006e-003 | M238: 115.9 | N238: 3.3 | O238: 7.0999999999999994e-002 | P238: 108.18 | Q238: 转股中 | R238: 4.66年 | S238: 2.66年 | T238: 18.5 | U238: 24 | V238: 1.1000000000000001e-002 | W238: 0.11199999999999999 | X238: 0.121 | Y238: 165 | Z238: 1.12 | AA238: 1.e-004 | AB238: -5.8999999999999999e-003 | AC238: -4.0300000000000002e-002 | AD238: -4.2300000000000004e-002 | AE238: 92.29 | AF238: 96.53 | AG238: 0.63 | AH238: AA+ | AI238: 4.0800000000000003e-002 | AJ238: =H238+100*O238 -> 122.94 | AK238: 123.5 | AL238: 143 | AM238: 27 | AN238: 106 | AO238: -1.7000000000000001e-002 | AP238: 38 | AQ238: 鹰19转债
A239: 127 | B239: 128119 | C239: 龙大转债! | D239: 2726 | E239: 龙大肉食 | F239: 食品饮料 | G239: 肉制品 | H239: 120.259 | I239: 2.3e-003 | J239: -9.0000000000000011e-003 | K239: 10.8 | L239: -1.01e-002 | M239: 120.2 | N239: 9.57 | O239: 6.6000000000000003e-002 | P239: 112.85 | Q239: 转股中 | R239: 5.24年 | S239: 3.24年 | T239: 9.49 | U239: 9.8 | V239: 9.0000000000000011e-003 | W239: 8.8000000000000009e-002 | X239: 9.9000000000000005e-002 | Y239: 108 | Z239: 3.35 | AA239: -1.e-004 | AB239: -6.7000000000000002e-003 | AC239: -4.2900000000000001e-002 | AD239: -4.4900000000000002e-002 | AE239: 89.6 | AF239: 96.2 | AG239: 0.67 | AH239: AA | AI239: 4.4299999999999999e-002 | AJ239: =H239+100*O239 -> 126.85899999999999 | AK239: 127.7 | AL239: 185 | AM239: 31.5 | AN239: 149 | AO239: 3.1e-002 | AP239: 8 | AQ239: 龙大转债!
A240: 32 | B240: 128141 | C240: 旺能转债 | D240: 2034 | E240: 旺能环境 | F240: 城市公用 | G240: 三废处理 | H240: 115.3 | I240: 6.9999999999999993e-003 | J240: -3.2000000000000002e-003 | K240: 18.63 | L240: 5.4000000000000003e-003 | M240: 115.1 | N240: 16.47 | O240: 1.9e-002 | P240: 113.11 | Q240: 2月8天 | R240: 5.67年 | S240: 3.67年 | T240: 14 | U240: 6.8 | V240: 4.0000000000000001e-003 | W240: 0.17800000000000002 | X240: 0.20199999999999999 | Y240: 79 | Z240: 1.77 | AA240: -2.9999999999999997e-004 | AB240: -5.1000000000000004e-003 | AC240: -2.7699999999999999e-002 | AD240: -2.9399999999999999e-002 | AE240: 87.85 | AF240: 90.42 | AG240: 0.7 | AH240: AA | AI240: 4.4299999999999999e-002 | AJ240: =H240+100*O240 -> 117.2 | AK240: 117.5 | AL240: 80 | AM240: 27.1 | AN240: 109 | AO240: 1.e-003 | AP240: 4 | AQ240: 旺能转债
A241: 42 | B241: 123083 | C241: 朗新转债 | D241: 300682 | E241: 朗新科技 | F241: 计算机及 | G241: 软件开发 | H241: 115.586 | I241: 1.1200000000000002e-002 | J241: -5.6000000000000008e-003 | K241: 16.33 | L241: 8.6e-003 | M241: 115.1 | N241: 15.57 | O241: 0.10199999999999999 | P241: 104.88 | Q241: 2月0天 | R241: 5.65年 | S241: 3.65年 | T241: 8 | U241: 7.8 | V241: 8.0000000000000002e-003 | W241: 4.8000000000000001e-002 | X241: 5.0000000000000003e-002 | Y241: 167 | Z241: 3.08 | AA241: -8.0000000000000004e-004 | AB241: -5.5000000000000005e-003 | AC241: -2.8500000000000001e-002 | AD241: -3.0200000000000001e-002 | AE241: 87.93 | AF241: 90.51 | AG241: 0.64 | AH241: AA | AI241: 4.4299999999999999e-002 | AJ241: =H241+100*O241 -> 125.786 | AK241: 126.3 | AL241: 171 | AM241: 35.8 | AN241: 190 | AO241: 4.4000000000000004e-002 | AP241: 5 | AQ241: 朗新转债
A242: 63 | B242: 128136 | C242: 立讯转债! | D242: 2475 | E242: 立讯精密 | F242: 电子 | G242: 元器件制 | H242: 112.5 | I242: 0. | J242: -8.0000000000000004e-004 | K242: 33.28 | L242: -5.6999999999999993e-003 | M242: 111.9 | N242: 58.36 | O242: 0.97299999999999998 | P242: 57.03 | Q242: 23天 | R242: 5.55年 | S242: 3.55年 | T242: 30 | U242: 10 | V242: 3.0000000000000001e-003 | W242: 1.3000000000000001e-002 | X242: 6.9999999999999993e-003 | Y242: 2341. | Z242: 9.34 | AA242: -1.e-003 | AB242: -4.8999999999999998e-003 | AC242: -2.5000000000000001e-002 | AD242: -2.63e-002 | AE242: 87.83 | AF242: 89.15 | AG242: 0.14 | AH242: AA+ | AI242: 4.2300000000000004e-002 | AJ242: =H242+100*O242 -> 209.80000000000001 | AK242: 168 | AL242: 325 | AM242: 78.8 | AN242: 325 | AO242: -3.3000000000000002e-002 | AP242: 12 | AQ242: 立讯转债!
A243: 92 | B243: 128130 | C243: 景兴转债 | D243: 2067 | E243: 景兴纸业 | F243: 造纸包装 | G243: 包装用纸 | H243: 116.126 | I243: 1.06e-002 | J243: 5.0000000000000001e-004 | K243: 3.9 | L243: 1.5600000000000001e-002 | M243: 115.1 | N243: 3.4 | O243: 1.2e-002 | P243: 114.71 | Q243: 转股中 | R243: 5.37年 | S243: 3.38年 | T243: 10.8 | U243: 18 | V243: 1.4999999999999999e-002 | W243: 0.23899999999999999 | X243: 0.27399999999999997 | Y243: 45 | Z243: 0.96 | AA243: -1.7000000000000001e-003 | AB243: -6.7000000000000002e-003 | AC243: -3.2000000000000001e-002 | AD243: -3.3799999999999997e-002 | AE243: 88.98 | AF243: 91.59 | AG243: 0.71 | AH243: AA | AI243: 4.4299999999999999e-002 | AJ243: =H243+100*O243 -> 117.32600000000001 | AK243: 117.5 | AL243: 81 | AM243: 26 | AN243: 93 | AO243: -2.e-002 | AP243: 13 | AQ243: 景兴转债
A244: 263 | B244: 127012 | C244: 招路转债! | D244: 1965 | E244: 招商公路 | F244: 机场高速 | G244: 高速 | H244: 108.7 | I244: 7.4000000000000003e-003 | J244: 1.54e-002 | K244: 8.06 | L244: 4.8099999999999997e-002 | M244: 107.9 | N244: 8.81 | O244: 0.188 | P244: 91.49 | Q244: 转股中 | R244: 3.93年 | S244: 1.93年 | T244: 50 | U244: 27 | V244: 5.0000000000000001e-003 | W244: 0.10000000000000001 | X244: 9.1999999999999998e-002 | Y244: 498 | Z244: 1.02 | AA244: -1.9e-003 | AB244: -5.6999999999999993e-003 | AC244: -3.1600000000000003e-002 | AD244: -3.3099999999999997e-002 | AE244: 94.07 | AF244: 93.42 | AG244: 0.47 | AH244: AAA | AI244: 3.78e-002 | AJ244: =H244+100*O244 -> 127.5 | AK244: 125.9 | AL244: 166 | AM244: 31.8 | AN244: 154 | AO244: 5.9000000000000004e-002 | AP244: 33 | AQ244: 招路转债!
A245: 11 | B245: 118000 | C245: 嘉元转债 | D245: 688388 | E245: 嘉元科技 | F245: 电子 | G245: 电子产品 | H245: 122.31 | I245: 3.6799999999999999e-002 | J245: -5.9999999999999995e-004 | K245: 83.23 | L245: 5.21e-002 | M245: 121 | N245: 78.99 | O245: 0.161 | P245: 105.37 | Q245: 4月18天 | R245: 5.86年 | S245: 3.86年 | T245: 12.4 | U245: 77 | V245: 5.0999999999999997e-002 | W245: 6.5000000000000002e-002 | X245: 6.8000000000000005e-002 | Y245: 192 | Z245: 7.36 | AA245: -1.9e-003 | AB245: -8.0000000000000002e-003 | AC245: -4.0000000000000001e-002 | AD245: -4.1799999999999997e-002 | AE245: 80.76 | AF245: 84.15 | AG245: 0.69 | AH245: AA- | AI245: 6.5299999999999997e-002 | AJ245: =H245+100*O245 -> 138.41 | AK245: 139.3 | AL245: 271 | AM245: 55.1 | AN245: 299 | AO245: 0.10099999999999999 | AP245: 3 | AQ245: 嘉元转债
A246: 117 | B246: 123060 | C246: 苏试转债 | D246: 300416 | E246: 苏试试验 | F246: 机械装备 | G246: 专用设备 | H246: 119 | I246: 1.3600000000000001e-002 | J246: -1.3100000000000001e-002 | K246: 24.03 | L246: 8.0000000000000004e-004 | M246: 117.6 | N246: 23.86 | O246: 0.182 | P246: 100.71 | Q246: 转股中 | R246: 5.26年 | S246: 3.26年 | T246: 3.1 | U246: 5.2 | V246: 1.3999999999999999e-002 | W246: 6.3e-002 | X246: 6.4000000000000001e-002 | Y246: 49 | Z246: 5.06 | AA246: -2.3e-003 | AB246: -8.1000000000000013e-003 | AC246: -3.9100000000000003e-002 | AD246: -4.1200000000000001e-002 | AE246: 83.88 | AF246: 84.94 | AG246: 0.67 | AH246: AA- | AI246: 6.5299999999999997e-002 | AJ246: =H246+100*O246 -> 137.19999999999999 | AK246: 137.3 | AL246: 266 | AM246: 52.3 | AN246: 288 | AO246: 3.2000000000000001e-002 | AP246: 9 | AQ246: 苏试转债
A247: 94 | B247: 113602 | C247: 景20转债! | D247: 603228 | E247: 景旺电子 | F247: 电子 | G247: 元器件制 | H247: 114.68 | I247: -2.9999999999999997e-004 | J247: 8.6999999999999994e-003 | K247: 27.18 | L247: 1.38e-002 | M247: 113.3 | N247: 27.7 | O247: 0.16899999999999998 | P247: 98.12 | Q247: 转股中 | R247: 5.35年 | S247: 3.36年 | T247: 17.8 | U247: 2.1 | V247: 1.e-003 | W247: 7.6999999999999999e-002 | X247: 7.4999999999999997e-002 | Y247: 232 | Z247: 3.72 | AA247: -2.3e-003 | AB247: -6.8000000000000005e-003 | AC247: -2.8199999999999999e-002 | AD247: -3.0099999999999998e-002 | AE247: 89.25 | AF247: 90.27 | AG247: 0.6 | AH247: AA | AI247: 4.4299999999999999e-002 | AJ247: =H247+100*O247 -> 131.58000000000001 | AK247: 131.2 | AL247: 219 | AM247: 41 | AN247: 229 | AO247: 1.2e-002 | AP247: 9 | AQ247: 景20转债!
A248: 61 | B248: 127024 | C248: 盈峰转债 | D248: 967 | E248: 盈峰环境 | F248: 机械装备 | G248: 专用设备 | H248: 118.9 | I248: 3.0000000000000001e-003 | J248: 7.9000000000000008e-003 | K248: 8.38 | L248: 1.8200000000000001e-002 | M248: 116.8 | N248: 8.31 | O248: 0.17899999999999999 | P248: 100.84 | Q248: 24天 | R248: 5.55年 | S248: 3.55年 | T248: 14.8 | U248: 1.5 | V248: 1.e-003 | W248: 5.5999999999999994e-002 | X248: 5.5999999999999994e-002 | Y248: 265 | Z248: 1.64 | AA248: -3.3e-003 | AB248: -8.5000000000000006e-003 | AC248: -3.73e-002 | AD248: -3.8900000000000004e-002 | AE248: 88.65 | AF248: 93.15 | AG248: 0.59 | AH248: AA+ | AI248: 4.2300000000000004e-002 | AJ248: =H248+100*O248 -> 136.80000000000001 | AK248: 137 | AL248: 264 | AM248: 43.8 | AN248: 246 | AO248: 1.1000000000000001e-002 | AP248: 5 | AQ248: 盈峰转债
A249: 105 | B249: 113598 | C249: 法兰转债 | D249: 603966 | E249: 法兰泰克 | F249: 机械装备 | G249: 工程机械 | H249: 123.84 | I249: 2.98e-002 | J249: 1.0700000000000001e-002 | K249: 17.22 | L249: 5.2600000000000001e-002 | M249: 121.2 | N249: 13.88 | O249: -2.e-003 | P249: 124.06 | Q249: 转股中 | R249: 5.29年 | S249: 3.29年 | T249: 2.98 | U249: 90 | V249: 0.24199999999999999 | W249: 8.1000000000000003e-002 | X249: 0.10099999999999999 | Y249: 37 | Z249: 3.26 | AA249: -4.1999999999999997e-003 | AB249: -1.09e-002 | AC249: -4.9400000000000006e-002 | AD249: -5.1500000000000004e-002 | AE249: 83.9 | AF249: 87.41 | AG249: 0.77 | AH249: AA- | AI249: 6.5299999999999997e-002 | AJ249: =H249+100*O249 -> 123.64 | AK249: 123.6 | AL249: 145 | AM249: 36.2 | AN249: 193 | AO249: 8.4000000000000005e-002 | AP249: 9 | AQ249: 法兰转债
A250: 60 | B250: 127025 | C250: 冀东转债 | D250: 401 | E250: 冀东水泥 | F250: 建筑 | G250: 水泥 | H250: 112.8 | I250: 0. | J250: 5.6999999999999993e-003 | K250: 14.8 | L250: 1.0200000000000001e-002 | M250: 110.1 | N250: 15.78 | O250: 0.20300000000000001 | P250: 93.79 | Q250: 25天 | R250: 5.55年 | S250: 3.56年 | T250: 28.2 | U250: 6 | V250: 2.e-003 | W250: 0.14099999999999999 | X250: 0.13300000000000001 | Y250: 199 | Z250: 1.4 | AA250: -4.4000000000000003e-003 | AB250: -7.8000000000000005e-003 | AC250: -2.46e-002 | AD250: -2.6099999999999998e-002 | AE250: 89.19 | AF250: 89.17 | AG250: 0.56 | AH250: AAA | AI250: 3.9300000000000002e-002 | AJ250: =H250+100*O250 -> 133.09999999999999 | AK250: 131.8 | AL250: 221 | AM250: 42.6 | AN250: 239 | AO250: -2.9999999999999999e-002 | AP250: 9 | AQ250: 冀东转债
A251: 17 | B251: 113621 | C251: 彤程转债 | D251: 603650 | E251: 彤程新材 | F251: 化工 | G251: 橡胶塑料 | H251: 118 | I251: 1.29e-002 | J251: 2.0799999999999999e-002 | K251: 33.77 | L251: 5.2400000000000002e-002 | M251: 115.1 | N251: 32.96 | O251: 0.152 | P251: 102.46 | Q251: 3月18天 | R251: 5.78年 | S251: 3.78年 | T251: 8 | U251: 16 | V251: 1.7000000000000001e-002 | W251: 4.0000000000000001e-002 | X251: 4.0999999999999995e-002 | Y251: 198 | Z251: 8.4 | AA251: -4.4000000000000003e-003 | AB251: -9.0000000000000011e-003 | AC251: -3.27e-002 | AD251: -3.4300000000000004e-002 | AE251: 87.43 | AF251: 89.99 | AG251: 0.64 | AH251: AA | AI251: 4.4299999999999999e-002 | AJ251: =H251+100*O251 -> 133.19999999999999 | AK251: 133.5 | AL251: 240 | AM251: 43.5 | AN251: 244 | AO251: -4.0000000000000001e-003 | AP251: 3 | AQ251: 彤程转债
A252: 152 | B252: 113579 | C252: 健友转债! | D252: 603707 | E252: 健友股份 | F252: 医药 | G252: 原料药 | H252: 116.82 | I252: 1.2500000000000001e-002 | J252: 1.5700000000000002e-002 | K252: 39.28 | L252: 5.28e-002 | M252: 114.2 | N252: 42.05 | O252: 0.251 | P252: 93.41 | Q252: 转股中 | R252: 5年6.1天 | S252: 3年7天 | T252: 5.03 | U252: 17 | V252: 2.7999999999999997e-002 | W252: 1.3999999999999999e-002 | X252: 1.3000000000000001e-002 | Y252: 367 | Z252: 10.71 | AA252: -4.5999999999999999e-003 | AB252: -9.5999999999999992e-003 | AC252: -3.7000000000000005e-002 | AD252: -3.9199999999999999e-002 | AE252: 90.46 | AF252: 92.31 | AG252: 0.53 | AH252: AA | AI252: 4.4299999999999999e-002 | AJ252: =H252+100*O252 -> 141.91999999999999 | AK252: 140.2 | AL252: 276 | AM252: 47.9 | AN252: 272 | AO252: 5.0000000000000001e-003 | AP252: 10 | AQ252: 健友转债!
A253: 84 | B253: 113603 | C253: 东缆转债 | D253: 603606 | E253: 东方电缆 | F253: 能源电力 | G253: 电力设备 | H253: 118 | I253: 2.3999999999999998e-003 | J253: -5.0000000000000001e-003 | K253: 21.98 | L253: -5.0000000000000001e-003 | M253: 115.1 | N253: 23.88 | O253: 0.28199999999999997 | P253: 92.04 | Q253: 转股中 | R253: 5.44年 | S253: 3.44年 | T253: 8 | U253: 2.3 | V253: 2.e-003 | W253: 5.5999999999999994e-002 | X253: 5.0999999999999997e-002 | Y253: 144 | Z253: 4.76 | AA253: -4.5999999999999999e-003 | AB253: -9.5999999999999992e-003 | AC253: -3.5699999999999996e-002 | AD253: -3.7499999999999999e-002 | AE253: 88.73 | AF253: 91.33 | AG253: 0.53 | AH253: AA | AI253: 4.4299999999999999e-002 | AJ253: =H253+100*O253 -> 146.19999999999999 | AK253: 144 | AL253: 287 | AM253: 52.6 | AN253: 289 | AO253: -3.2000000000000001e-002 | AP253: 7 | AQ253: 东缆转债
A254: 91 | B254: 123064 | C254: 万孚转债! | D254: 300482 | E254: 万孚生物 | F254: 医药 | G254: 医疗器械 | H254: 118.01 | I254: 1.8e-003 | J254: -3.0999999999999999e-003 | K254: 86.18 | L254: -2.3999999999999998e-003 | M254: 115.1 | N254: 93.57 | O254: 0.28100000000000003 | P254: 92.1 | Q254: 转股中 | R254: 5.38年 | S254: 3.38年 | T254: 6 | U254: 2 | V254: 3.0000000000000001e-003 | W254: 2.e-002 | X254: 1.9e-002 | Y254: 295 | Z254: 10.8 | AA254: -4.6999999999999993e-003 | AB254: -9.7000000000000003e-003 | AC254: -3.6400000000000002e-002 | AD254: -3.8199999999999998e-002 | AE254: 88.97 | AF254: 91.58 | AG254: 0.53 | AH254: AA | AI254: 4.4299999999999999e-002 | AJ254: =H254+100*O254 -> 146.11000000000001 | AK254: 143.9 | AL254: 285 | AM254: 52.3 | AN254: 287 | AO254: 7.9000000000000001e-002 | AP254: 10 | AQ254: 万孚转债!
A255: 161 | B255: 128106 | C255: 华统转债 | D255: 2840 | E255: 华统股份 | F255: 农业 | G255: 农产品加 | H255: 115.638 | I255: -3.0000000000000001e-003 | J255: -2.3e-003 | K255: 10.21 | L255: -7.8000000000000005e-003 | M255: 112.9 | N255: 9.4 | O255: 6.5000000000000002e-002 | P255: 108.62 | Q255: 转股中 | R255: 4.98年 | S255: 2.98年 | T255: 5.35 | U255: 2 | V255: 3.0000000000000001e-003 | W255: 0.11699999999999999 | X255: 0.127 | Y255: 46 | Z255: 2.73 | AA255: -4.8999999999999998e-003 | AB255: -9.4999999999999998e-003 | AC255: -3.5099999999999999e-002 | AD255: -3.7100000000000001e-002 | AE255: 90.71 | AF255: 91.99 | AG255: 0.68 | AH255: AA | AI255: 4.2800000000000005e-002 | AJ255: =H255+100*O255 -> 122.13800000000001 | AK255: 122.7 | AL255: 135 | AM255: 30.7 | AN255: 142 | AO255: -6.5000000000000002e-002 | AP255: 8 | AQ255: 华统转债
A256: 347 | B256: 110033 | C256: 国贸转债! | D256: 600755 | E256: 厦门国贸 | F256: 交通运输 | G256: 交通运输 | H256: 108.42 | I256: -1.e-003 | J256: 2.5000000000000001e-003 | K256: 6.82 | L256: 7.4000000000000003e-003 | M256: 108 | N256: 7.18 | O256: 0.14099999999999999 | P256: 94.99 | Q256: 转股中 | R256: 0.72年 | S256: 回售内 | T256: 12.1 | U256: 8.6 | V256: 6.9999999999999993e-003 | W256: 9.0999999999999998e-002 | X256: 8.6999999999999994e-002 | Y256: 133 | Z256: 0.88 | AA256: -5.4000000000000003e-003 | AB256: -2.5699999999999997e-002 | AC256: 回售内 | AD256: 回售内 | AE256: 100.33 | AF256: 105.47 | AG256: 0.2 | AH256: AAA | AI256: 3.3300000000000003e-002 | AJ256: =H256+100*O256 -> 122.52 | AK256: 121.9 | AL256: 128 | AM256: 16.4 | AN256: 15 | AO256: 2.9999999999999999e-002 | AP256: 18 | AQ256: 国贸转债!
A257: 67 | B257: 113607 | C257: 伟20转债! | D257: 603568 | E257: 伟明环保 | F257: 城市公用 | G257: 三废处理 | H257: 118.59 | I257: 2.0499999999999997e-002 | J257: 2.2000000000000002e-002 | K257: 23 | L257: 6.6299999999999998e-002 | M257: 115.1 | N257: 22.01 | O257: 0.13500000000000001 | P257: 104.5 | Q257: 20天 | R257: 5.55年 | S257: 3.55年 | T257: 12 | U257: 7.9 | V257: 6.0000000000000001e-003 | W257: 4.2000000000000003e-002 | X257: 4.2999999999999997e-002 | Y257: 289 | Z257: 5.76 | AA257: -5.5000000000000005e-003 | AB257: -1.03e-002 | AC257: -3.6000000000000004e-002 | AD257: -3.78e-002 | AE257: 88.32 | AF257: 90.91 | AG257: 0.64 | AH257: AA | AI257: 4.4299999999999999e-002 | AJ257: =H257+100*O257 -> 132.09 | AK257: 132.7 | AL257: 230 | AM257: 41.8 | AN257: 233 | AO257: 5.9000000000000004e-002 | AP257: 5 | AQ257: 伟20转债!
A258: 14 | B258: 123098 | C258: 一品转债 | D258: 300723 | E258: 一品红 | F258: 医药 | G258: 医药行业 | H258: 128.1 | I258: 2.3e-003 | J258: 8.6999999999999994e-003 | K258: 48.15 | L258: 1.6500000000000001e-002 | M258: 124 | N258: 45.79 | O258: 0.218 | P258: 105.15 | Q258: 3月19天 | R258: 5.78年 | S258: 3.79年 | T258: 4.8 | U258: 15 | V258: 2.5000000000000001e-002 | W258: 6.2e-002 | X258: 6.5000000000000002e-002 | Y258: 77 | Z258: 4.99 | AA258: -5.6999999999999993e-003 | AB258: -1.26e-002 | AC258: -5.2000000000000005e-002 | AD258: -5.3699999999999998e-002 | AE258: 81.13 | AF258: 86.61 | AG258: 0.67 | AH258: AA- | AI258: 6.5299999999999997e-002 | AJ258: =H258+100*O258 -> 149.90000000000001 | AK258: 151 | AL258: 305 | AM258: 64.4 | AN258: 313 | AO258: -2.7000000000000003e-002 | AP258: 3 | AQ258: 一品转债
A259: 9 | B259: 113045 | C259: 环旭转债 | D259: 601231 | E259: 环旭电子 | F259: 电子 | G259: 电子产品 | H259: 115.89 | I259: 2.9999999999999997e-004 | J259: 2.3e-003 | K259: 18.7 | L259: 4.7999999999999996e-003 | M259: 112 | N259: 20.25 | O259: 0.255 | P259: 92.35 | Q259: 7月28天 | R259: 5.88年 | S259: 2.88年 | T259: 34.5 | U259: 15 | V259: 4.0000000000000001e-003 | W259: 8.3000000000000004e-002 | X259: 7.6999999999999999e-002 | Y259: 413 | Z259: 3.43 | AA259: -5.8999999999999999e-003 | AB259: -9.4999999999999998e-003 | AC259: -3.8300000000000001e-002 | AD259: -4.0000000000000001e-002 | AE259: 90.7 | AF259: 88.03 | AG259: 0.54 | AH259: AA+ | AI259: 4.2300000000000004e-002 | AJ259: =H259+100*O259 -> 141.38999999999999 | AK259: 139.4 | AL259: 273 | AM259: 48.7 | AN259: 278 | AO259: 0. | AP259: 2 | AQ259: 环旭转债
A260: 31 | B260: 128142 | C260: 新乳转债 | D260: 2946 | E260: 新乳业 | F260: 食品饮料 | G260: 乳制品 | H260: 119.008 | I260: 4.3e-003 | J260: -7.4000000000000003e-003 | K260: 17.39 | L260: -5.6999999999999993e-003 | M260: 115.1 | N260: 18.69 | O260: 0.27899999999999997 | P260: 93.04 | Q260: 2月9天 | R260: 5.67年 | S260: 3.67年 | T260: 7.18 | U260: 28 | V260: 3.3000000000000002e-002 | W260: 4.8000000000000001e-002 | X260: 4.4999999999999998e-002 | Y260: 148 | Z260: 5.8 | AA260: -6.0000000000000001e-003 | AB260: -1.0700000000000001e-002 | AC260: -3.5699999999999996e-002 | AD260: -3.7400000000000003e-002 | AE260: 87.84 | AF260: 90.41 | AG260: 0.55 | AH260: AA | AI260: 4.4299999999999999e-002 | AJ260: =H260+100*O260 -> 146.90799999999999 | AK260: 145 | AL260: 289 | AM260: 54.6 | AN260: 295 | AO260: 4.4999999999999998e-002 | AP260: 4 | AQ260: 新乳转债
A261: 284 | B261: 128050 | C261: 钧达转债!! | D261: 2865 | E261: 钧达股份 | F261: 汽车 | G261: 零部件制 | H261: 125.461 | I261: 1.38e-002 | J261: 2.5999999999999999e-003 | K261: 18.53 | L261: 1.6500000000000001e-002 | M261: 122.7 | N261: 14.85 | O261: 5.0000000000000001e-003 | P261: 124.78 | Q261: 转股中 | R261: 3.65年 | S261: 1.65年 | T261: 1.54 | U261: 43 | V261: 0.223 | W261: 6.3e-002 | X261: 7.9000000000000001e-002 | Y261: 24 | Z261: 2.35 | AA261: -6.1999999999999998e-003 | AB261: -1.6500000000000001e-002 | AC261: -0.10300000000000001 | AD261: -0.106 | AE261: 92.17 | AF261: 98.35 | AG261: 1 | AH261: AA- | AI261: 6.3799999999999996e-002 | AJ261: =H261+100*O261 -> 125.961 | AK261: 126.1 | AL261: 169 | AM261: 27.8 | AN261: 115 | AO261: -1.2e-002 | AP261: 53 | AQ261: 钧达转债!!
A262: 72 | B262: 113605 | C262: 大参转债 | D262: 603233 | E262: 大参林 | F262: 医药 | G262: 医药商业 | H262: 119.21 | I262: -6.7000000000000002e-003 | J262: -1.4499999999999999e-002 | K262: 71.75 | L262: -4.6100000000000002e-002 | M262: 115.2 | N262: 83.71 | O262: 0.39100000000000001 | P262: 85.71 | Q262: 12天 | R262: 5.52年 | S262: 3.52年 | T262: 14.1 | U262: 28 | V262: 1.7000000000000001e-002 | W262: 2.9999999999999999e-002 | X262: 2.5000000000000001e-002 | Y262: 473 | Z262: 9.43 | AA262: -6.3e-003 | AB262: -1.1200000000000002e-002 | AC262: -3.7400000000000003e-002 | AD262: -3.9199999999999999e-002 | AE262: 88.53 | AF262: 91.12 | AG262: 0.46 | AH262: AA | AI262: 4.4299999999999999e-002 | AJ262: =H262+100*O262 -> 158.31 | AK262: 152.7 | AL262: 307 | AM262: 61.6 | AN262: 308 | AO262: -0.13100000000000001 | AP262: 6 | AQ262: 大参转债
A263: 184 | B263: 123043 | C263: 正元转债 | D263: 300645 | E263: 正元智慧 | F263: 计算机及 | G263: 软件开发 | H263: 125.158 | I263: -2.2000000000000001e-003 | J263: 1.2500000000000001e-002 | K263: 16.72 | L263: 1.46e-002 | M263: 120.9 | N263: 15.41 | O263: 0.154 | P263: 108.5 | Q263: 转股中 | R263: 4.88年 | S263: 2.89年 | T263: 1.66 | U263: 239 | V263: 1.1399999999999999 | W263: 7.8e-002 | X263: 8.5000000000000006e-002 | Y263: 21 | Z263: 3.45 | AA263: -7.1999999999999998e-003 | AB263: -1.44e-002 | AC263: -5.9200000000000003e-002 | AD263: -6.1500000000000006e-002 | AE263: 83.69 | AF263: 85.68 | AG263: 0.71 | AH263: A+ | AI263: 7.4800000000000005e-002 | AJ263: =H263+100*O263 -> 140.55799999999999 | AK263: 141.8 | AL263: 281 | AM263: 56.1 | AN263: 300 | AO263: 4.4999999999999998e-002 | AP263: 18 | AQ263: 正元转债
A264: 297 | B264: 123012 | C264: 万顺转债! | D264: 300057 | E264: 万顺新材 | F264: 有色金属 | G264: 铝金属 | H264: 113.2 | I264: 2.e-003 | J264: 1.6200000000000003e-002 | K264: 4.79 | L264: 3.6799999999999999e-002 | M264: 110.3 | N264: 5.31 | O264: 0.255 | P264: 90.21 | Q264: 转股中 | R264: 3.26年 | S264: 1.26年 | T264: 1.29 | U264: 9.4 | V264: 6.4000000000000001e-002 | W264: 4.0000000000000001e-002 | X264: 3.6000000000000004e-002 | Y264: 32 | Z264: 0.89 | AA264: -8.1000000000000013e-003 | AB264: -1.3899999999999999e-002 | AC264: -6.59e-002 | AD264: -6.9400000000000003e-002 | AE264: 94.2 | AF264: 90.58 | AG264: 0.49 | AH264: AA- | AI264: 6.3799999999999996e-002 | AJ264: =H264+100*O264 -> 138.69999999999999 | AK264: 136.2 | AL264: 257 | AM264: 42 | AN264: 235 | AO264: 1.8000000000000002e-002 | AP264: 20 | AQ264: 万顺转债!
A265: 192 | B265: 128096 | C265: 奥瑞转债!! | D265: 2701 | E265: 奥瑞金 | F265: 造纸包装 | G265: 包装材料 | H265: 120.3 | I265: 1.0800000000000001e-002 | J265: 1.6000000000000001e-003 | K265: 5.29 | L265: 1.7299999999999999e-002 | M265: 115.5 | N265: 4.54 | O265: 3.2000000000000001e-002 | P265: 116.52 | Q265: 转股中 | R265: 4.82年 | S265: 2.82年 | T265: 6.89 | U265: 5 | V265: 6.0000000000000001e-003 | W265: 5.4000000000000006e-002 | X265: 6.3e-002 | Y265: 128 | Z265: 2.14 | AA265: -8.6e-003 | AB265: -1.4199999999999999e-002 | AC265: -4.8499999999999995e-002 | AD265: -5.0799999999999998e-002 | AE265: 92.24 | AF265: 95.64 | AG265: 0.72 | AH265: AA+ | AI265: 4.0800000000000003e-002 | AJ265: =H265+100*O265 -> 123.5 | AK265: 124.1 | AL265: 149 | AM265: 28.4 | AN265: 117 | AO265: -2.3e-002 | AP265: 19 | AQ265: 奥瑞转债!!
A266: 87 | B266: 123066 | C266: 赛意转债 | D266: 300687 | E266: 赛意信息 | F266: 计算机及 | G266: 软件开发 | H266: 127.1 | I266: -3.9000000000000003e-003 | J266: -1.6000000000000001e-003 | K266: 28.74 | L266: -6.8999999999999999e-003 | M266: 121.4 | N266: 22.58 | O266: -1.e-003 | P266: 127.28 | Q266: 转股中 | R266: 5.42年 | S266: 3.42年 | T266: 3.14 | U266: 8.8 | V266: 2.2000000000000002e-002 | W266: 5.0000000000000003e-002 | X266: 6.4000000000000001e-002 | Y266: 62 | Z266: 6.59 | AA266: -8.6e-003 | AB266: -1.52e-002 | AC266: -5.4100000000000002e-002 | AD266: -5.62e-002 | AE266: 80.39 | AF266: 82.27 | AG266: 0.79 | AH266: A+ | AI266: 7.6299999999999993e-002 | AJ266: =H266+100*O266 -> 127. | AK266: 126.9 | AL266: 175 | AM266: 44.7 | AN266: 252 | AO266: 1.3999999999999999e-002 | AP266: 7 | AQ266: 赛意转债
A267: 27 | B267: 113615 | C267: 金诚转债 | D267: 603979 | E267: 金诚信 | F267: 有色金属 | G267: 有色行业 | H267: 123.1 | I267: -8.3999999999999995e-003 | J267: 7.9000000000000008e-003 | K267: 14.89 | L267: -7.000000000000001e-004 | M267: 117.3 | N267: 12.73 | O267: 5.2000000000000005e-002 | P267: 116.97 | Q267: 2月14天 | R267: 5.69年 | S267: 3.69年 | T267: 10 | U267: 44 | V267: 3.5000000000000003e-002 | W267: 0.115 | X267: 0.13500000000000001 | Y267: 87 | Z267: 1.94 | AA267: -8.6e-003 | AB267: -1.3899999999999999e-002 | AC267: -4.36e-002 | AD267: -4.5400000000000003e-002 | AE267: 87.98 | AF267: 92.11 | AG267: 0.73 | AH267: AA | AI267: 4.4299999999999999e-002 | AJ267: =H267+100*O267 -> 128.29999999999998 | AK267: 129.2 | AL267: 201 | AM267: 37.1 | AN267: 203 | AO267: 3.0000000000000001e-003 | AP267: 3 | AQ267: 金诚转债
A268: 150 | B268: 128108 | C268: 蓝帆转债! | D268: 2382 | E268: 蓝帆医疗 | F268: 医药 | G268: 医疗器械 | H268: 118.646 | I268: -2.1499999999999998e-002 | J268: 3.3000000000000002e-002 | K268: 20.58 | L268: 1.5800000000000002e-002 | M268: 113.3 | N268: 17.79 | O268: 2.6000000000000002e-002 | P268: 115.68 | Q268: 转股中 | R268: 5年41天 | S268: 4年42天 | T268: 16.6 | U268: 465 | V268: 0.23600000000000002 | W268: 7.6999999999999999e-002 | X268: 8.900000000000001e-002 | Y268: 216 | Z268: 2.07 | AA268: -9.1999999999999998e-003 | AB268: -1.38e-002 | AC268: -2.7200000000000002e-002 | AD268: -2.9600000000000001e-002 | AE268: 88.03 | AF268: 91.22 | AG268: 0.73 | AH268: AA | AI268: 4.4299999999999999e-002 | AJ268: =H268+100*O268 -> 121.246 | AK268: 121.6 | AL268: 125 | AM268: 30.4 | AN268: 138 | AO268: 8.199999999999999e-002 | AP268: 25 | AQ268: 蓝帆转债!
A269: 1 | B269: 113622 | C269: 杭叉转债 | D269: 603298 | E269: 杭叉集团 | F269: 机械装备 | G269: 通用设备 | H269: 118.8 | I269: -5.8999999999999999e-003 | J269: -7.000000000000001e-004 | K269: 23.05 | L269: -1.0700000000000001e-002 | M269: 112.5 | N269: 23.48 | O269: 0.20999999999999999 | P269: 98.17 | Q269: 5月25天 | R269: 5.94年 | S269: 3.94年 | T269: 11.5 | U269: 50 | V269: 3.6000000000000004e-002 | W269: 5.7999999999999996e-002 | X269: 5.7000000000000002e-002 | Y269: 200 | Z269: 4.06 | AA269: -9.300000000000001e-003 | AB269: -1.3000000000000001e-002 | AC269: -3.4300000000000004e-002 | AD269: -3.5699999999999996e-002 | AE269: 86.97 | AF269: 88.27 | AG269: 0.61 | AH269: AA+ | AI269: 4.2300000000000004e-002 | AJ269: =H269+100*O269 -> 139.80000000000001 | AK269: 139.4 | AL269: 272 | AM269: 51.2 | AN269: 282 | AO269: -1.9e-002 | AP269: 1 | AQ269: 杭叉转债
A270: 345 | B270: 113009 | C270: 广汽转债! | D270: 601238 | E270: 广汽集团 | F270: 汽车 | G270: 乘用车 | H270: 106.78 | I270: 7.4000000000000003e-003 | J270: -5.6999999999999993e-003 | K270: 11.19 | L270: 6.5700000000000008e-002 | M270: 106 | N270: 14.12 | O270: 0.34700000000000003 | P270: 79.25 | Q270: 转股中 | R270: 0.77年 | S270: 回售内 | T270: 25.5 | U270: 68 | V270: 2.5000000000000001e-002 | W270: 2.2000000000000002e-002 | X270: 1.7000000000000001e-002 | Y270: 1158. | Z270: 1.38 | AA270: -9.4999999999999998e-003 | AB270: -2.4e-002 | AC270: 回售内 | AD270: 回售内 | AE270: 100.27 | AF270: 103.36 | AG270: 0.03 | AH270: AAA | AI270: 3.3300000000000003e-002 | AJ270: =H270+100*O270 -> 141.48000000000002 | AK270: 134.3 | AL270: 245 | AM270: 31 | AN270: 145 | AO270: 7.0999999999999994e-002 | AP270: 16 | AQ270: 广汽转债!
A271: 33 | B271: 113614 | C271: 健20转债! | D271: 603707 | E271: 健友股份 | F271: 医药 | G271: 原料药 | H271: 120.77 | I271: 7.3000000000000001e-003 | J271: 2.7300000000000001e-002 | K271: 39.28 | L271: 5.28e-002 | M271: 114.2 | N271: 38.04 | O271: 0.17000000000000001 | P271: 103.26 | Q271: 2月8天 | R271: 5.67年 | S271: 3.67年 | T271: 7.8 | U271: 12 | V271: 1.3000000000000001e-002 | W271: 2.1000000000000001e-002 | X271: 2.2000000000000002e-002 | Y271: 367 | Z271: 10.71 | AA271: -1.e-002 | AB271: -1.44e-002 | AC271: -3.9199999999999999e-002 | AD271: -4.0999999999999995e-002 | AE271: 87.94 | AF271: 89.73 | AG271: 0.65 | AH271: AA | AI271: 4.4299999999999999e-002 | AJ271: =H271+100*O271 -> 137.76999999999998 | AK271: 138.3 | AL271: 269 | AM271: 48.5 | AN271: 276 | AO271: 5.0000000000000001e-003 | AP271: 3 | AQ271: 健20转债!
A272: 221 | B272: 113548 | C272: 石英转债! | D272: 603688 | E272: 石英股份 | F272: 电子 | G272: 电子产品 | H272: 130.22 | I272: 3.2000000000000002e-003 | J272: 6.1999999999999998e-003 | K272: 17.57 | L272: 1.38e-002 | M272: 124.4 | N272: 15.1 | O272: 0.11900000000000001 | P272: 116.36 | Q272: 转股中 | R272: 4.53年 | S272: 2.53年 | T272: 1.23 | U272: 13 | V272: 8.4000000000000005e-002 | W272: 2.e-002 | X272: 2.3e-002 | Y272: 62 | Z272: 3.22 | AA272: -1.03e-002 | AB272: -1.9099999999999999e-002 | AC272: -7.9699999999999993e-002 | AD272: -8.2400000000000001e-002 | AE272: 88.45 | AF272: 94.63 | AG272: 0.68 | AH272: AA- | AI272: 6.3799999999999996e-002 | AJ272: =H272+100*O272 -> 142.12 | AK272: 144.1 | AL272: 288 | AM272: 49.5 | AN272: 280 | AO272: -1.6e-002 | AP272: 12 | AQ272: 石英转债!
A273: 231 | B273: 128075 | C273: 远东转债! | D273: 2406 | E273: 远东传动 | F273: 汽车 | G273: 零部件制 | H273: 120.3 | I273: 2.1499999999999998e-002 | J273: -6.8999999999999999e-003 | K273: 6.59 | L273: 2.0099999999999996e-002 | M273: 114.9 | N273: 5.54 | O273: 1.1000000000000001e-002 | P273: 118.95 | Q273: 转股中 | R273: 4.44年 | S273: 2.44年 | T273: 5.44 | U273: 13 | V273: 2.e-002 | W273: 0.13200000000000001 | X273: 0.157 | Y273: 41 | Z273: 1.31 | AA273: -1.0500000000000001e-002 | AB273: -1.6399999999999998e-002 | AC273: -5.7000000000000002e-002 | AD273: -5.9299999999999999e-002 | AE273: 92.81 | AF273: 95.77 | AG273: 0.72 | AH273: AA | AI273: 4.2800000000000005e-002 | AJ273: =H273+100*O273 -> 121.39999999999999 | AK273: 121.6 | AL273: 127 | AM273: 25.9 | AN273: 91 | AO273: 3.6000000000000004e-002 | AP273: 15 | AQ273: 远东转债!
A274: 28 | B274: 123091 | C274: 长海转债 | D274: 300196 | E274: 长海股份 | F274: 其他 | G274: 非金属矿 | H274: 124.605 | I274: 3.9000000000000003e-003 | J274: -1.3300000000000001e-002 | K274: 16.78 | L274: -1.47e-002 | M274: 116.2 | N274: 16.24 | O274: 0.20600000000000002 | P274: 103.33 | Q274: 2月14天 | R274: 5.69年 | S274: 3.69年 | T274: 5.5 | U274: 7.9 | V274: 1.1000000000000001e-002 | W274: 8.0000000000000002e-002 | X274: 8.3000000000000004e-002 | Y274: 69 | Z274: 2.4 | AA274: -1.24e-002 | AB274: -1.7299999999999999e-002 | AC274: -4.6900000000000004e-002 | AD274: -4.8600000000000004e-002 | AE274: 87.88 | AF274: 91.23 | AG274: 0.64 | AH274: AA | AI274: 4.4299999999999999e-002 | AJ274: =H274+100*O274 -> 145.20500000000001 | AK274: 145.9 | AL274: 292 | AM274: 54.7 | AN274: 297 | AO274: 5.2000000000000005e-002 | AP274: 3 | AQ274: 长海转债
A275: 277 | B275: 128053 | C275: 尚荣转债! | D275: 2551 | E275: 尚荣医疗 | F275: 医药 | G275: 医疗器械 | H275: 120 | I275: 5.8999999999999999e-003 | J275: -5.9999999999999995e-004 | K275: 5.73 | L275: 5.3e-003 | M275: 114.3 | N275: 4.89 | O275: 2.4e-002 | P275: 117.18 | Q275: 转股中 | R275: 3.83年 | S275: 1.83年 | T275: 1.91 | U275: 49 | V275: 0.215 | W275: 4.0999999999999995e-002 | X275: 4.8000000000000001e-002 | Y275: 47 | Z275: 1.59 | AA275: -1.2800000000000001e-002 | AB275: -1.9400000000000001e-002 | AC275: -7.4900000000000008e-002 | AD275: -7.7399999999999997e-002 | AE275: 94.59 | AF275: 97.62 | AG275: 1 | AH275: AA | AI275: 4.2800000000000005e-002 | AJ275: =H275+100*O275 -> 122.40000000000001 | AK275: 122.8 | AL275: 139 | AM275: 25.2 | AN275: 82 | AO275: 5.0000000000000003e-002 | AP275: 26 | AQ275: 尚荣转债!
A276: 62 | B276: 128137 | C276: 洁美转债 | D276: 2859 | E276: 洁美科技 | F276: 电子 | G276: 元器件制 | H276: 126.005 | I276: 4.0000000000000001e-003 | J276: -7.1999999999999998e-003 | K276: 30.67 | L276: -4.1999999999999997e-003 | M276: 117.3 | N276: 27.77 | O276: 0.14099999999999999 | P276: 110.44 | Q276: 24天 | R276: 5.55年 | S276: 3.55年 | T276: 6 | U276: 6.1 | V276: 8.0000000000000002e-003 | W276: 4.8000000000000001e-002 | X276: 5.2999999999999999e-002 | Y276: 126 | Z276: 7.07 | AA276: -1.3000000000000001e-002 | AB276: -1.84e-002 | AC276: -5.1200000000000002e-002 | AD276: -5.2999999999999999e-002 | AE276: 82.24 | AF276: 83.15 | AG276: 0.74 | AH276: AA- | AI276: 6.5299999999999997e-002 | AJ276: =H276+100*O276 -> 140.10499999999999 | AK276: 141.6 | AL276: 280 | AM276: 58.4 | AN276: 303 | AO276: -2.6000000000000002e-002 | AP276: 4 | AQ276: 洁美转债
A277: 126 | B277: 123058 | C277: 欣旺转债 | D277: 300207 | E277: 欣旺达 | F277: 电子 | G277: 电子产品 | H277: 124.5 | I277: -1.11e-002 | J277: -8.9999999999999998e-004 | K277: 21.56 | L277: -2.e-002 | M277: 116.3 | N277: 21.24 | O277: 0.22699999999999998 | P277: 101.51 | Q277: 转股中 | R277: 5.24年 | S277: 3.24年 | T277: 11.2 | U277: 15 | V277: 1.1000000000000001e-002 | W277: 3.3000000000000002e-002 | X277: 3.3000000000000002e-002 | Y277: 339 | Z277: 5.03 | AA277: -1.32e-002 | AB277: -1.8500000000000003e-002 | AC277: -5.2400000000000002e-002 | AD277: -5.4400000000000004e-002 | AE277: 89.68 | AF277: 93.1 | AG277: 0.6 | AH277: AA | AI277: 4.4299999999999999e-002 | AJ277: =H277+100*O277 -> 147.19999999999999 | AK277: 147.5 | AL277: 297 | AM277: 54.4 | AN277: 293 | AO277: 7.9000000000000001e-002 | AP277: 6 | AQ277: 欣旺转债
A278: 143 | B278: 113585 | C278: 寿仙转债! | D278: 603896 | E278: 寿仙谷 | F278: 医药 | G278: 中药 | H278: 126.23 | I278: 1.2500000000000001e-002 | J278: -2.0999999999999999e-003 | K278: 36.29 | L278: 1.2800000000000001e-002 | M278: 117.8 | N278: 28.68 | O278: -2.e-003 | P278: 126.53 | Q278: 转股中 | R278: 5年53天 | S278: 3年54天 | T278: 1.87 | U278: 9.3 | V278: 3.9e-002 | W278: 3.4000000000000002e-002 | X278: 4.4000000000000004e-002 | Y278: 54 | Z278: 4.23 | AA278: -1.3600000000000001e-002 | AB278: -1.9599999999999999e-002 | AC278: -5.7099999999999998e-002 | AD278: -5.9200000000000003e-002 | AE278: 84.69 | AF278: 85.75 | AG278: 0.81 | AH278: AA- | AI278: 6.5299999999999997e-002 | AJ278: =H278+100*O278 -> 126.03 | AK278: 125.9 | AL278: 167 | AM278: 40.2 | AN278: 224 | AO278: 1.3000000000000001e-002 | AP278: 9 | AQ278: 寿仙转债!
A279: 276 | B279: 110051 | C279: 中天转债! | D279: 600522 | E279: 中天科技 | F279: 通信互联 | G279: 通信设备 | H279: 119.49 | I279: 1.2699999999999999e-002 | J279: -1.5e-003 | K279: 10.77 | L279: 1.8000000000000002e-002 | M279: 113.3 | N279: 10.09 | O279: 0.11900000000000001 | P279: 106.74 | Q279: 转股中 | R279: 3.87年 | S279: 1.87年 | T279: 39.6 | U279: 20 | V279: 4.0000000000000001e-003 | W279: 0.12 | X279: 0.128 | Y279: 330 | Z279: 1.45 | AA279: -1.3899999999999999e-002 | AB279: -1.9900000000000001e-002 | AC279: -7.1599999999999997e-002 | AD279: -7.400000000000001e-002 | AE279: 94.81 | AF279: 97.32 | AG279: 0.63 | AH279: AA+ | AI279: 4.0800000000000003e-002 | AJ279: =H279+100*O279 -> 131.38999999999999 | AK279: 132.2 | AL279: 226 | AM279: 34.9 | AN279: 182 | AO279: -4.2999999999999997e-002 | AP279: 25 | AQ279: 中天转债!
A280: 321 | B280: 128032 | C280: 双环转债! | D280: 2472 | E280: 双环传动 | F280: 机械装备 | G280: 通用设备 | H280: 113.68 | I280: 2.1600000000000001e-002 | J280: -1.18e-002 | K280: 9.86 | L280: 1.8600000000000002e-002 | M280: 109.3 | N280: 9.89 | O280: 0.14000000000000001 | P280: 99.7 | Q280: 转股中 | R280: 2.69年 | S280: 0.69年 | T280: 10 | U280: 9.6 | V280: 8.0000000000000002e-003 | W280: 0.14800000000000002 | X280: 0.14699999999999999 | Y280: 68 | Z280: 2 | AA280: -1.47e-002 | AB280: -2.1000000000000001e-002 | AC280: -0.124 | AD280: -0.128 | AE280: 98.33 | AF280: 98.19 | AG280: 0.53 | AH280: AA | AI280: 4.1299999999999996e-002 | AJ280: =H280+100*O280 -> 127.68000000000001 | AK280: 127.7 | AL280: 184 | AM280: 29.3 | AN280: 130 | AO280: 0.10000000000000001 | AP280: 41 | AQ280: 双环转债!
A281: 195 | B281: 123042 | C281: 银河转债! | D281: 300619 | E281: 金银河 | F281: 机械装备 | G281: 专用设备 | H281: 124.4 | I281: -6.0999999999999995e-003 | J281: 1.38e-002 | K281: 19.2 | L281: 1.5300000000000001e-002 | M281: 115.4 | N281: 24.4 | O281: 0.58099999999999996 | P281: 78.69 | Q281: 转股中 | R281: 4.75年 | S281: 2.75年 | T281: 1.67 | U281: 65 | V281: 0.309 | W281: 0.11599999999999999 | X281: 9.1999999999999998e-002 | Y281: 14 | Z281: 2.93 | AA281: -1.6e-002 | AB281: -2.1600000000000001e-002 | AC281: -6.0999999999999999e-002 | AD281: -6.3299999999999995e-002 | AE281: 84.27 | AF281: 82.58 | AG281: 0.5 | AH281: A+ | AI281: 7.4800000000000005e-002 | AJ281: =H281+100*O281 -> 182.5 | AK281: 170.1 | AL281: 327 | AM281: 85.8 | AN281: 329 | AO281: -3.5000000000000003e-002 | AP281: 24 | AQ281: 银河转债!
A282: 314 | B282: 128035 | C282: 大族转债! | D282: 2008 | E282: 大族激光 | F282: 机械装备 | G282: 专用设备 | H282: 112.51 | I282: 3.2000000000000002e-003 | J282: -3.0000000000000001e-003 | K282: 41.53 | L282: 1.e-003 | M282: 107.4 | N282: 52.1 | O282: 0.41100000000000003 | P282: 79.71 | Q282: 转股中 | R282: 2.81年 | S282: 0.81年 | T282: 23 | U282: 11 | V282: 4.0000000000000001e-003 | W282: 5.2000000000000005e-002 | X282: 4.0999999999999995e-002 | Y282: 443 | Z282: 4.82 | AA282: -1.66e-002 | AB282: -2.1400000000000002e-002 | AC282: -7.9199999999999993e-002 | AD282: -8.6099999999999996e-002 | AE282: 99.97 | AF282: 96.48 | AG282: 0.19 | AH282: AA+ | AI282: 3.9300000000000002e-002 | AJ282: =H282+100*O282 -> 153.61000000000001 | AK282: 145.3 | AL282: 290 | AM282: 45.3 | AN282: 254 | AO282: 1.4999999999999999e-002 | AP282: 20 | AQ282: 大族转债!
A283: 307 | B283: 113508 | C283: 新凤转债! | D283: 603225 | E283: 新凤鸣 | F283: 服装纺织 | G283: 纺织行业 | H283: 118.03 | I283: 6.4000000000000003e-003 | J283: -7.4000000000000003e-003 | K283: 16.11 | L283: -1.9e-003 | M283: 112.3 | N283: 15.78 | O283: 0.156 | P283: 102.09 | Q283: 转股中 | R283: 3年9天 | S283: 1年10天 | T283: 20.6 | U283: 17 | V283: 6.9999999999999993e-003 | W283: 9.0999999999999998e-002 | X283: 9.3000000000000013e-002 | Y283: 226 | Z283: 1.99 | AA283: -1.67e-002 | AB283: -2.3900000000000001e-002 | AC283: -0.106 | AD283: -0.11 | AE283: 97.84 | AF283: 99.22 | AG283: 0.55 | AH283: AA | AI283: 4.2800000000000005e-002 | AJ283: =H283+100*O283 -> 133.63 | AK283: 134 | AL283: 243 | AM283: 34.7 | AN283: 179 | AO283: -9.0000000000000011e-003 | AP283: 23 | AQ283: 新凤转债!
A284: 157 | B284: 113577 | C284: 春秋转债! | D284: 603890 | E284: 春秋电子 | F284: 电子 | G284: 电子产品 | H284: 128.15 | I284: 1.06e-002 | J284: -2.0999999999999999e-003 | K284: 14.14 | L284: 1.0700000000000001e-002 | M284: 117.7 | N284: 11.06 | O284: 2.e-003 | P284: 127.85 | Q284: 转股中 | R284: 4.99年 | S284: 2.99年 | T284: 1.78 | U284: 26 | V284: 0.11199999999999999 | W284: 3.2000000000000001e-002 | X284: 4.0999999999999995e-002 | Y284: 55 | Z284: 3.11 | AA284: -1.72e-002 | AB284: -2.3199999999999998e-002 | AC284: -6.5500000000000003e-002 | AD284: -6.7500000000000004e-002 | AE284: 85.36 | AF284: 86.98 | AG284: 0.79 | AH284: AA- | AI284: 6.3799999999999996e-002 | AJ284: =H284+100*O284 -> 128.34999999999999 | AK284: 128.5 | AL284: 195 | AM284: 41.5 | AN284: 230 | AO284: 6.9999999999999993e-003 | AP284: 14 | AQ284: 春秋转债!
A285: 337 | B285: 113013 | C285: 国君转债! | D285: 601211 | E285: 国泰君安 | F285: 金融 | G285: 证券行业 | H285: 112.5 | I285: -1.9e-003 | J285: 3.2000000000000002e-003 | K285: 16.01 | L285: 5.0000000000000001e-003 | M285: 108.3 | N285: 19.01 | O285: 0.33600000000000002 | P285: 84.22 | Q285: 转股中 | R285: 2.22年 | S285: 无权 | T285: 69.9 | U285: 7.8 | V285: 1.e-003 | W285: 4.9000000000000002e-002 | X285: 4.0999999999999995e-002 | Y285: 1426. | Z285: 1.13 | AA285: -1.7299999999999999e-002 | AB285: -2.41e-002 | AC285: 无权 | AD285: 无权 | AE285: 无权 | AF285: 100.2 | AG285: 0.27 | AH285: AAA | AI285: 3.6299999999999999e-002 | AJ285: =H285+100*O285 -> 146.09999999999999 | AK285: 140.8 | AL285: 278 | AM285: 40.6 | AN285: 227 | AO285: -1.7000000000000001e-002 | AP285: 14 | AQ285: 国君转债!
A286: 140 | B286: 128113 | C286: 比音转债 | D286: 2832 | E286: 比音勒芬 | F286: 服装纺织 | G286: 服装行业 | H286: 128.195 | I286: 7.9000000000000008e-003 | J286: -1.6000000000000001e-003 | K286: 19.07 | L286: 7.9000000000000008e-003 | M286: 117.3 | N286: 14.9 | O286: 2.e-003 | P286: 127.99 | Q286: 转股中 | R286: 5年59天 | S286: 3.16年 | T286: 4.94 | U286: 5.9 | V286: 9.0000000000000011e-003 | W286: 4.8000000000000001e-002 | X286: 6.2e-002 | Y286: 102 | Z286: 4.64 | AA286: -1.7399999999999999e-002 | AB286: -2.3099999999999999e-002 | AC286: -6.2e-002 | AD286: -6.3899999999999998e-002 | AE286: 89.99 | AF286: 94.22 | AG286: 0.79 | AH286: AA | AI286: 4.4299999999999999e-002 | AJ286: =H286+100*O286 -> 128.39499999999998 | AK286: 128.4 | AL286: 193 | AM286: 34.2 | AN286: 173 | AO286: -1.9e-002 | AP286: 8 | AQ286: 比音转债
A287: 205 | B287: 113559 | C287: 永创转债! | D287: 603901 | E287: 永创智能 | F287: 机械装备 | G287: 专用设备 | H287: 128.5 | I287: 3.5999999999999999e-003 | J287: 6.7000000000000002e-003 | K287: 13.41 | L287: 1.2800000000000001e-002 | M287: 118.3 | N287: 10.32 | O287: -1.1000000000000001e-002 | P287: 129.94 | Q287: 转股中 | R287: 4.69年 | S287: 2.69年 | T287: 5.1 | U287: 37 | V287: 5.7000000000000002e-002 | W287: 8.6999999999999994e-002 | X287: 0.11199999999999999 | Y287: 59 | Z287: 4.26 | AA287: -1.7899999999999999e-002 | AB287: -2.4500000000000001e-002 | AC287: -7.0999999999999994e-002 | AD287: -7.3599999999999999e-002 | AE287: 87.69 | AF287: 89.2 | AG287: 0.8 | AH287: AA- | AI287: 6.3799999999999996e-002 | AJ287: =H287+100*O287 -> 127.40000000000001 | AK287: 127.1 | AL287: 176 | AM287: 37.9 | AN287: 207 | AO287: 0.128 | AP287: 19 | AQ287: 永创转债!
A288: 271 | B288: 128057 | C288: 博彦转债 | D288: 2649 | E288: 博彦科技 | F288: 计算机及 | G288: 软件开发 | H288: 124.74 | I288: 1.66e-002 | J288: 2.e-003 | K288: 10.85 | L288: 2.3599999999999999e-002 | M288: 116.3 | N288: 8.72 | O288: 3.0000000000000001e-003 | P288: 124.43 | Q288: 转股中 | R288: 3.88年 | S288: 1.89年 | T288: 5.07 | U288: 17 | V288: 2.7999999999999997e-002 | W288: 8.8000000000000009e-002 | X288: 0.109 | Y288: 58 | Z288: 1.95 | AA288: -1.8200000000000001e-002 | AB288: -2.5399999999999999e-002 | AC288: -9.0500000000000011e-002 | AD288: -9.2899999999999996e-002 | AE288: 90.63 | AF288: 91.87 | AG288: 0.79 | AH288: AA- | AI288: 6.3799999999999996e-002 | AJ288: =H288+100*O288 -> 125.03999999999999 | AK288: 125.1 | AL288: 162 | AM288: 33.2 | AN288: 165 | AO288: 5.0000000000000003e-002 | AP288: 27 | AQ288: 博彦转债
A289: 217 | B289: 123035 | C289: 利德转债! | D289: 300296 | E289: 利亚德 | F289: 电子 | G289: LED制 | H289: 126.296 | I289: 9.5999999999999992e-003 | J289: -1.7899999999999999e-002 | K289: 7.62 | L289: -1.3000000000000001e-002 | M289: 115.1 | N289: 6.98 | O289: 0.157 | P289: 109.17 | Q289: 转股中 | R289: 4.58年 | S289: 2.58年 | T289: 8 | U289: 15 | V289: 1.4999999999999999e-002 | W289: 4.0999999999999995e-002 | X289: 4.4999999999999998e-002 | Y289: 194 | Z289: 2.68 | AA289: -2.0499999999999997e-002 | AB289: -2.6200000000000001e-002 | AC289: -7.0300000000000001e-002 | AD289: -7.2499999999999995e-002 | AE289: 92.94 | AF289: 96.22 | AG289: 0.64 | AH289: AA+ | AI289: 4.0800000000000003e-002 | AJ289: =H289+100*O289 -> 141.99600000000001 | AK289: 143.4 | AL289: 283 | AM289: 47.2 | AN289: 270 | AO289: 2.8999999999999998e-002 | AP289: 16 | AQ289: 利德转债!
A290: 83 | B290: 128134 | C290: 鸿路转债! | D290: 2541 | E290: 鸿路钢构 | F290: 建筑 | G290: 其他 | H290: 129.02 | I290: -7.4999999999999997e-003 | J290: 1.83e-002 | K290: 52.41 | L290: 1.41e-002 | M290: 115.1 | N290: 43.74 | O290: 7.6999999999999999e-002 | P290: 119.82 | Q290: 转股中 | R290: 5.48年 | S290: 3.48年 | T290: 18.8 | U290: 19 | V290: 8.0000000000000002e-003 | W290: 6.8000000000000005e-002 | X290: 8.199999999999999e-002 | Y290: 274 | Z290: 4.87 | AA290: -2.1000000000000001e-002 | AB290: -2.5699999999999997e-002 | AC290: -5.8799999999999998e-002 | AD290: -6.0499999999999998e-002 | AE290: 88.57 | AF290: 91.17 | AG290: 0.76 | AH290: AA | AI290: 4.4299999999999999e-002 | AJ290: =H290+100*O290 -> 136.72 | AK290: 138.2 | AL290: 268 | AM290: 47.1 | AN290: 267 | AO290: 1.1000000000000001e-002 | AP290: 4 | AQ290: 鸿路转债!
A291: 204 | B291: 110065 | C291: 淮矿转债! | D291: 600985 | E291: 淮北矿业 | F291: 煤炭 | G291: 煤炭开采 | H291: 122.3 | I291: 2.7300000000000001e-002 | J291: -2.5000000000000001e-003 | K291: 11.17 | L291: 3.2300000000000002e-002 | M291: 110.8 | N291: 9.33 | O291: 2.2000000000000002e-002 | P291: 119.72 | Q291: 转股中 | R291: 4.69年 | S291: 2.69年 | T291: 22.7 | U291: 117 | V291: 4.2000000000000003e-002 | W291: 9.0999999999999998e-002 | X291: 0.109 | Y291: 249 | Z291: 1.16 | AA291: -2.12e-002 | AB291: -2.53e-002 | AC291: -5.79e-002 | AD291: -5.9900000000000002e-002 | AE291: 93.01 | AF291: 93.43 | AG291: 0.77 | AH291: AAA | AI291: 3.78e-002 | AJ291: =H291+100*O291 -> 124.5 | AK291: 124.9 | AL291: 158 | AM291: 31.4 | AN291: 148 | AO291: -3.0000000000000001e-003 | AP291: 21 | AQ291: 淮矿转债!
A292: 346 | B292: 110034 | C292: 九州转债! | D292: 600998 | E292: 九州通 | F292: 医药 | G292: 医药商业 | H292: 109.79 | I292: 3.0999999999999999e-003 | J292: -3.8e-003 | K292: 17.33 | L292: -3.4999999999999996e-003 | M292: 108 | N292: 18.32 | O292: 0.161 | P292: 94.6 | Q292: 转股中 | R292: 0.75年 | S292: 回售内 | T292: 15 | U292: 14 | V292: 9.0000000000000011e-003 | W292: 4.5999999999999999e-002 | X292: 4.4000000000000004e-002 | Y292: 325 | Z292: 1.73 | AA292: -2.1700000000000001e-002 | AB292: -4.0899999999999999e-002 | AC292: 回售内 | AD292: 回售内 | AE292: 103 | AF292: 105.15 | AG292: 0.2 | AH292: AA+ | AI292: 3.6299999999999999e-002 | AJ292: =H292+100*O292 -> 125.89000000000001 | AK292: 125 | AL292: 161 | AM292: 19.8 | AN292: 37 | AO292: -2.6000000000000002e-002 | AP292: 25 | AQ292: 九州转债!
A293: 168 | B293: 110069 | C293: 瀚蓝转债!* | D293: 600323 | E293: 瀚蓝环境 | F293: 城市公用 | G293: 三废处理 | H293: 126.49 | I293: 1.1399999999999999e-002 | J293: -1.1000000000000001e-003 | K293: 25.59 | L293: 1.03e-002 | M293: 113.3 | N293: 20.2 | O293: -2.e-003 | P293: 126.68 | Q293: 转股中 | R293: 4.97年 | S293: 2.98年 | T293: 2.22 | U293: 25 | V293: 9.0999999999999998e-002 | W293: 1.1000000000000001e-002 | X293: 1.3999999999999999e-002 | Y293: 199 | Z293: 2.63 | AA293: -2.2099999999999998e-002 | AB293: -2.6800000000000001e-002 | AC293: -6.6299999999999998e-002 | AD293: -6.7400000000000002e-002 | AE293: 90.06 | AF293: 93.08 | AG293: 1 | AH293: AA+ | AI293: 4.0800000000000003e-002 | AJ293: =H293+100*O293 -> 126.28999999999999 | AK293: 126.3 | AL293: 172 | AM293: 33.2 | AN293: 166 | AO293: -3.2000000000000001e-002 | AP293: 9 | AQ293: 瀚蓝转债!*
A294: 246 | B294: 113537 | C294: 文灿转债!! | D294: 603348 | E294: 文灿股份 | F294: 汽车 | G294: 零部件制 | H294: 133.04 | I294: 3.0899999999999997e-002 | J294: 1.2999999999999999e-003 | K294: 25.87 | L294: 4.0599999999999997e-002 | M294: 121.5 | N294: 19.43 | O294: -1.e-003 | P294: 133.14 | Q294: 转股中 | R294: 4年54天 | S294: 2年55天 | T294: 1.77 | U294: 263 | V294: 1.1100000000000001 | W294: 2.6000000000000002e-002 | X294: 3.5000000000000003e-002 | Y294: 67 | Z294: 2.66 | AA294: -2.2200000000000001e-002 | AB294: -3.0699999999999998e-002 | AC294: -0.10000000000000001 | AD294: -0.10300000000000001 | AE294: 90.67 | AF294: 94.68 | AG294: 0.79 | AH294: AA- | AI294: 6.3799999999999996e-002 | AJ294: =H294+100*O294 -> 132.94 | AK294: 132.9 | AL294: 233 | AM294: 38.3 | AN294: 212 | AO294: 0.157 | AP294: 25 | AQ294: 文灿转债!!
A295: 226 | B295: 128079 | C295: 英联转债! | D295: 2846 | E295: 英联股份 | F295: 造纸包装 | G295: 包装材料 | H295: 130.16 | I295: -2.7000000000000001e-003 | J295: 2.6099999999999998e-002 | K295: 9.15 | L295: 2.46e-002 | M295: 117.5 | N295: 8.29 | O295: 0.17899999999999999 | P295: 110.37 | Q295: 转股中 | R295: 4.51年 | S295: 2.52年 | T295: 1.52 | U295: 277 | V295: 1.3899999999999999 | W295: 5.2000000000000005e-002 | X295: 5.7999999999999996e-002 | Y295: 29 | Z295: 2.34 | AA295: -2.29e-002 | AB295: -2.9399999999999999e-002 | AC295: -8.2100000000000006e-002 | AD295: -8.4399999999999989e-002 | AE295: 85.61 | AF295: 85.47 | AG295: 0.95 | AH295: A+ | AI295: 7.4800000000000005e-002 | AJ295: =H295+100*O295 -> 148.06 | AK295: 149.9 | AL295: 302 | AM295: 64.3 | AN295: 311 | AO295: -0.28000000000000003 | AP295: 19 | AQ295: 英联转债!
A296: 311 | B296: 127005 | C296: 长证转债! | D296: 783 | E296: 长江证券 | F296: 金融 | G296: 证券行业 | H296: 115.8 | I296: 2.7000000000000001e-003 | J296: -5.0000000000000001e-004 | K296: 7.25 | L296: 4.1999999999999997e-003 | M296: 108.3 | N296: 7.28 | O296: 0.16300000000000001 | P296: 99.59 | Q296: 转股中 | R296: 2.90年 | S296: 无权 | T296: 50 | U296: 17 | V296: 3.0000000000000001e-003 | W296: 0.125 | X296: 0.124 | Y296: 401 | Z296: 1.43 | AA296: -2.3099999999999999e-002 | AB296: -2.8300000000000002e-002 | AC296: 无权 | AD296: 无权 | AE296: 无权 | AF296: 97.81 | AG296: 0.53 | AH296: AAA | AI296: 3.6299999999999999e-002 | AJ296: =H296+100*O296 -> 132.09999999999999 | AK296: 132 | AL296: 223 | AM296: 34.2 | AN296: 174 | AO296: 1.6e-002 | AP296: 14 | AQ296: 长证转债!
A297: 285 | B297: 110048 | C297: 福能转债! | D297: 600483 | E297: 福能股份 | F297: 能源电力 | G297: 电力供应 | H297: 123.87 | I297: 3.4999999999999996e-003 | J297: 7.3000000000000001e-003 | K297: 9.48 | L297: 1.4999999999999999e-002 | M297: 113.3 | N297: 8.12 | O297: 6.0999999999999999e-002 | P297: 116.75 | Q297: 转股中 | R297: 3.64年 | S297: 1.64年 | T297: 23.1 | U297: 56 | V297: 2.e-002 | W297: 0.13699999999999998 | X297: 0.16 | Y297: 169 | Z297: 1.18 | AA297: -2.46e-002 | AB297: -3.1e-002 | AC297: -9.849999999999999e-002 | AD297: -0.10099999999999999 | AE297: 95.67 | AF297: 98.22 | AG297: 0.72 | AH297: AA+ | AI297: 4.0800000000000003e-002 | AJ297: =H297+100*O297 -> 129.97 | AK297: 131 | AL297: 216 | AM297: 32.8 | AN297: 160 | AO297: -4.5999999999999999e-002 | AP297: 9 | AQ297: 福能转债!
A298: 164 | B298: 113034 | C298: 滨化转债 | D298: 601678 | E298: 滨化股份 | F298: 化工 | G298: 化工 | H298: 129.87 | I298: 3.4300000000000004e-002 | J298: -1.e-002 | K298: 6.08 | L298: 3.0499999999999999e-002 | M298: 114.8 | N298: 4.68 | O298: 0. | P298: 129.91 | Q298: 转股中 | R298: 4.98年 | S298: 2.98年 | T298: 12.8 | U298: 268 | V298: 0.161 | W298: 0.11900000000000001 | X298: 0.155 | Y298: 107 | Z298: 1.5 | AA298: -2.4900000000000002e-002 | AB298: -2.9900000000000003e-002 | AC298: -7.0499999999999993e-002 | AD298: -7.2300000000000003e-002 | AE298: 90.61 | AF298: 93.51 | AG298: 0.8 | AH298: AA | AI298: 4.2800000000000005e-002 | AJ298: =H298+100*O298 -> 129.87 | AK298: 129.8 | AL298: 207 | AM298: 36.3 | AN298: 196 | AO298: 6.8000000000000005e-002 | AP298: 26 | AQ298: 滨化转债
A299: 49 | B299: 113611 | C299: 福20转债 | D299: 603806 | E299: 福斯特 | F299: 能源电力 | G299: 太阳能 | H299: 128.64 | I299: 0. | J299: -1.41e-002 | K299: 78.8 | L299: -2.0899999999999998e-002 | M299: 111.85 | N299: 73.69 | O299: 0.20300000000000001 | P299: 106.93 | Q299: 52天 | R299: 5.62年 | S299: 3.63年 | T299: 17 | U299: 16 | V299: 6.9999999999999993e-003 | W299: 2.7999999999999997e-002 | X299: 2.9999999999999999e-002 | Y299: 606 | Z299: 6.99 | AA299: -2.4900000000000002e-002 | AB299: -2.86e-002 | AC299: -5.8099999999999999e-002 | AD299: -5.9299999999999999e-002 | AE299: 87.18 | AF299: 87.95 | AG299: 0.68 | AH299: AA | AI299: 4.4299999999999999e-002 | AJ299: =H299+100*O299 -> 148.94 | AK299: 150.3 | AL299: 304 | AM299: 62.4 | AN299: 309 | AO299: -3.2000000000000001e-002 | AP299: 5 | AQ299: 福20转债
A300: 261 | B300: 123025 | C300: 精测转债!! | D300: 300567 | E300: 精测电子 | F300: 电子 | G300: 液晶显示 | H300: 129.3 | I300: 8.6e-003 | J300: -3.2000000000000002e-003 | K300: 57.28 | L300: 7.6e-003 | M300: 116.5 | N300: 49.95 | O300: 0.128 | P300: 114.67 | Q300: 转股中 | R300: 3.95年 | S300: 1.95年 | T300: 3.09 | U300: 4.8 | V300: 1.2e-002 | W300: 2.2000000000000002e-002 | X300: 2.5000000000000001e-002 | Y300: 141 | Z300: 9.1 | AA300: -2.6499999999999999e-002 | AB300: -3.3599999999999998e-002 | AC300: -0.10300000000000001 | AD300: -0.105 | AE300: 90.29 | AF300: 91.66 | AG300: 0.71 | AH300: AA- | AI300: 6.3799999999999996e-002 | AJ300: =H300+100*O300 -> 142.10000000000002 | AK300: 143.9 | AL300: 286 | AM300: 52.3 | AN300: 286 | AO300: 1.9e-002 | AP300: 17 | AQ300: 精测转债!!
A301: 78 | B301: 127022 | C301: 恒逸转债 | D301: 703 | E301: 恒逸石化 | F301: 化工 | G301: 化工 | H301: 126.3 | I301: 0. | J301: -1.8700000000000001e-002 | K301: 13.01 | L301: -2.4700000000000003e-002 | M301: 108.9 | N301: 11.5 | O301: 0.11599999999999999 | P301: 113.13 | Q301: 6.1天 | R301: 5.50年 | S301: 3.50年 | T301: 20 | U301: 78 | V301: 3.1e-002 | W301: 4.2000000000000003e-002 | X301: 4.7e-002 | Y301: 479 | Z301: 1.91 | AA301: -2.69e-002 | AB301: -2.98e-002 | AC301: -5.5199999999999999e-002 | AD301: -5.6500000000000002e-002 | AE301: 88.26 | AF301: 87 | AG301: 0.75 | AH301: AA+ | AI301: 4.2300000000000004e-002 | AJ301: =H301+100*O301 -> 137.90000000000001 | AK301: 139.5 | AL301: 274 | AM301: 51.2 | AN301: 283 | AO301: -0.11 | AP301: 6 | AQ301: 恒逸转债
A302: 267 | B302: 123022 | C302: 长信转债!! | D302: 300088 | E302: 长信科技 | F302: 通信互联 | G302: 通信设备 | H302: 127.51 | I302: 1.1200000000000002e-002 | J302: -1.e-003 | K302: 7.33 | L302: 1.38e-002 | M302: 114.3 | N302: 6.15 | O302: 7.0000000000000007e-002 | P302: 119.19 | Q302: 转股中 | R302: 3.92年 | S302: 1.92年 | T302: 2.57 | U302: 6.2 | V302: 1.9e-002 | W302: 1.3999999999999999e-002 | X302: 1.7000000000000001e-002 | Y302: 180 | Z302: 2.6 | AA302: -2.7999999999999997e-002 | AB302: -3.4200000000000001e-002 | AC302: -9.8599999999999993e-002 | AD302: -0.10099999999999999 | AE302: 94.25 | AF302: 97.27 | AG302: 0.74 | AH302: AA | AI302: 4.2800000000000005e-002 | AJ302: =H302+100*O302 -> 134.51000000000002 | AK302: 135.8 | AL302: 252 | AM302: 38.6 | AN302: 215 | AO302: -2.6000000000000002e-002 | AP302: 12 | AQ302: 长信转债!!
A303: 166 | B303: 113575 | C303: 东时转债! | D303: 603377 | E303: 东方时尚 | F303: 其他 | G303: 其他 | H303: 130.42 | I303: -7.1999999999999998e-003 | J303: 1.41e-002 | K303: 15.27 | L303: 1.06e-002 | M303: 113.1 | N303: 14.56 | O303: 0.24399999999999999 | P303: 104.88 | Q303: 转股中 | R303: 4.98年 | S303: 2.98年 | T303: 0.98 | U303: 71 | V303: 0.55100000000000005 | W303: 1.1000000000000001e-002 | X303: 1.1000000000000001e-002 | Y303: 93 | Z303: 4.1 | AA303: -2.87e-002 | AB303: -3.32e-002 | AC303: -7.1500000000000008e-002 | AD303: -7.3300000000000004e-002 | AE303: 90.75 | AF303: 92.17 | AG303: 0.65 | AH303: AA | AI303: 4.2800000000000005e-002 | AJ303: =H303+100*O303 -> 154.81999999999999 | AK303: 156 | AL303: 312 | AM303: 63.8 | AN303: 310 | AO303: 5.4000000000000006e-002 | AP303: 15 | AQ303: 东时转债!
A304: 81 | B304: 110075 | C304: 南航转债 | D304: 600029 | E304: 南方航空 | F304: 交通运输 | G304: 航空运输 | H304: 129.36 | I304: -1.1000000000000001e-003 | J304: 1.46e-002 | K304: 6.83 | L304: 1.9400000000000001e-002 | M304: 110 | N304: 6.24 | O304: 0.182 | P304: 109.46 | Q304: 5.1天 | R304: 5.50年 | S304: 3.50年 | T304: 160 | U304: 174 | V304: 8.0000000000000002e-003 | W304: 0.153 | X304: 0.16699999999999998 | Y304: 1047. | Z304: 1.51 | AA304: -2.9399999999999999e-002 | AB304: -3.2599999999999997e-002 | AC304: -6.2400000000000004e-002 | AD304: -6.3500000000000001e-002 | AE304: 88.85 | AF304: 89.24 | AG304: 0.69 | AH304: AAA | AI304: 3.9300000000000002e-002 | AJ304: =H304+100*O304 -> 147.56 | AK304: 149.3 | AL304: 301 | AM304: 60 | AN304: 305 | AO304: -4.0000000000000001e-003 | AP304: 8 | AQ304: 南航转债
A305: 318 | B305: 128033 | C305: 迪龙转债! | D305: 2658 | E305: 雪迪龙 | F305: 城市公用 | G305: 三废处理 | H305: 117.89 | I305: -1.0700000000000001e-002 | J305: 1.1299999999999999e-002 | K305: 9.36 | L305: 1.1000000000000001e-003 | M305: 108.8 | N305: 8.83 | O305: 0.11199999999999999 | P305: 106 | Q305: 转股中 | R305: 2.70年 | S305: 0.70年 | T305: 2.98 | U305: 177 | V305: 0.498 | W305: 5.0999999999999997e-002 | X305: 5.4000000000000006e-002 | Y305: 59 | Z305: 2.68 | AA305: -2.9700000000000001e-002 | AB305: -3.5499999999999997e-002 | AC305: -0.16300000000000001 | AD305: -0.16600000000000001 | AE305: 98.06 | AF305: 97.7 | AG305: 0.62 | AH305: AA | AI305: 4.1299999999999996e-002 | AJ305: =H305+100*O305 -> 129.09 | AK305: 129.8 | AL305: 206 | AM305: 31.7 | AN305: 152 | AO305: -7.8e-002 | AP305: 38 | AQ305: 迪龙转债!
A306: 73 | B306: 113040 | C306: 星宇转债 | D306: 601799 | E306: 星宇股份 | F306: 汽车 | G306: 零部件制 | H306: 132.82 | I306: 1.7500000000000002e-002 | J306: 1.7000000000000001e-003 | K306: 187.4 | L306: 2.5399999999999999e-002 | M306: 111.5 | N306: 158 | O306: 0.12 | P306: 118.61 | Q306: 12天 | R306: 5.52年 | S306: 3.52年 | T306: 15 | U306: 17 | V306: 9.0000000000000011e-003 | W306: 2.8999999999999998e-002 | X306: 3.4000000000000002e-002 | Y306: 518 | Z306: 9.73 | AA306: -3.1600000000000003e-002 | AB306: -3.5200000000000002e-002 | AC306: -6.8900000000000003e-002 | AD306: -6.9900000000000004e-002 | AE306: 87.86 | AF306: 88.98 | AG306: 0.76 | AH306: AA+ | AI306: 4.2300000000000004e-002 | AJ306: =H306+100*O306 -> 144.81999999999999 | AK306: 147 | AL306: 295 | AM306: 58.1 | AN306: 302 | AO306: 1.e-003 | AP306: 4 | AQ306: 星宇转债
A307: 186 | B307: 110066 | C307: 盛屯转债!! | D307: 600711 | E307: 盛屯矿业 | F307: 有色金属 | G307: 有色行业 | H307: 134.48 | I307: 9.3999999999999986e-003 | J307: -3.0999999999999999e-003 | K307: 6.57 | L307: 7.7000000000000002e-003 | M307: 114.9 | N307: 4.88 | O307: -1.e-003 | P307: 134.63 | Q307: 转股中 | R307: 4.87年 | S307: 2.88年 | T307: 5.35 | U307: 152 | V307: 0.21100000000000002 | W307: 2.9999999999999999e-002 | X307: 4.0999999999999995e-002 | Y307: 176 | Z307: 1.65 | AA307: -3.2300000000000002e-002 | AB307: -3.7499999999999999e-002 | AC307: -8.3299999999999999e-002 | AD307: -8.5199999999999998e-002 | AE307: 91.12 | AF307: 94.03 | AG307: 0.82 | AH307: AA | AI307: 4.2800000000000005e-002 | AJ307: =H307+100*O307 -> 134.38 | AK307: 134.3 | AL307: 247 | AM307: 40.3 | AN307: 225 | AO307: -1.4999999999999999e-002 | AP307: 36 | AQ307: 盛屯转债!!
A308: 218 | B308: 110061 | C308: 川投转债 | D308: 600674 | E308: 川投能源 | F308: 能源电力 | G308: 水电 | H308: 128.73 | I308: 7.4999999999999997e-003 | J308: 1.5100000000000001e-002 | K308: 12.17 | L308: 2.7900000000000001e-002 | M308: 110.8 | N308: 9.58 | O308: 1.3000000000000001e-002 | P308: 127.04 | Q308: 转股中 | R308: 4.57年 | S308: 2.57年 | T308: 39.6 | U308: 20 | V308: 4.0000000000000001e-003 | W308: 7.400000000000001e-002 | X308: 9.4e-002 | Y308: 536 | Z308: 1.94 | AA308: -3.2899999999999999e-002 | AB308: -3.7000000000000005e-002 | AC308: -7.7800000000000008e-002 | AD308: -7.9899999999999999e-002 | AE308: 93.4 | AF308: 93.83 | AG308: 0.81 | AH308: AAA | AI308: 3.78e-002 | AJ308: =H308+100*O308 -> 130.03 | AK308: 130.4 | AL308: 213 | AM308: 36.6 | AN308: 199 | AO308: 0. | AP308: 16 | AQ308: 川投转债
A309: 315 | B309: 110043 | C309: 无锡转债! | D309: 600908 | E309: 无锡银行 | F309: 金融 | G309: 银行行业 | H309: 119 | I309: 6.8999999999999999e-003 | J309: 3.0000000000000001e-003 | K309: 6.03 | L309: 1.6899999999999998e-002 | M309: 108.3 | N309: 5.79 | O309: 0.14300000000000002 | P309: 104.15 | Q309: 转股中 | R309: 2.79年 | S309: 无权 | T309: 29.2 | U309: 33 | V309: 1.e-002 | W309: 0.26000000000000001 | X309: 0.27100000000000002 | Y309: 112 | Z309: 0.94 | AA309: -3.3500000000000002e-002 | AB309: -3.8800000000000001e-002 | AC309: 无权 | AD309: 无权 | AE309: 无权 | AF309: 97.37 | AG309: 0.59 | AH309: AA+ | AI309: 3.9300000000000002e-002 | AJ309: =H309+100*O309 -> 133.30000000000001 | AK309: 133.9 | AL309: 242 | AM309: 36.5 | AN309: 197 | AO309: -4.4000000000000004e-002 | AP309: 26 | AQ309: 无锡转债!
A310: 294 | B310: 123014 | C310: 凯发转债! | D310: 300407 | E310: 凯发电气 | F310: 能源电力 | G310: 电力设备 | H310: 117.502 | I310: -1.2999999999999999e-003 | J310: 6.6e-003 | K310: 7.23 | L310: 1.26e-002 | M310: 108.5 | N310: 8.12 | O310: 0.32000000000000001 | P310: 89.04 | Q310: 转股中 | R310: 2.28年 | S310: 0.28年 | T310: 1.16 | U310: 15 | V310: 0.11 | W310: 5.2999999999999999e-002 | X310: 4.7e-002 | Y310: 22 | Z310: 1.63 | AA310: -3.4799999999999998e-002 | AB310: -4.1500000000000002e-002 | AC310: -0.33000000000000002 | AD310: -0.33500000000000002 | AE310: 98.12 | AF310: 92.57 | AG310: 0.42 | AH310: A+ | AI310: 7.3300000000000004e-002 | AJ310: =H310+100*O310 -> 149.50200000000001 | AK310: 146 | AL310: 293 | AM310: 47.8 | AN310: 271 | AO310: -6.9999999999999993e-003 | AP310: 16 | AQ310: 凯发转债!
A311: 290 | B311: 128046 | C311: 利尔转债!! | D311: 2258 | E311: 利尔化学 | F311: 化工 | G311: 农化 | H311: 129.4 | I311: 2.29e-002 | J311: 1.18e-002 | K311: 22.64 | L311: 3.4700000000000002e-002 | M311: 112.3 | N311: 18.42 | O311: 5.2999999999999999e-002 | P311: 122.91 | Q311: 转股中 | R311: 3.50年 | S311: 1.50年 | T311: 8.47 | U311: 18 | V311: 1.6e-002 | W311: 7.0999999999999994e-002 | X311: 8.8000000000000009e-002 | Y311: 119 | Z311: 3.15 | AA311: -4.0399999999999998e-002 | AB311: -4.6399999999999997e-002 | AC311: -0.113 | AD311: -0.115 | AE311: 95.9 | AF311: 97.26 | AG311: 1 | AH311: AA | AI311: 4.2800000000000005e-002 | AJ311: =H311+100*O311 -> 134.70000000000002 | AK311: 135.9 | AL311: 254 | AM311: 38.6 | AN311: 217 | AO311: -4.7e-002 | AP311: 9 | AQ311: 利尔转债!!
A312: 245 | B312: 123027 | C312: 蓝晓转债! | D312: 300487 | E312: 蓝晓科技 | F312: 化工 | G312: 化工 | H312: 141.99 | I312: -3.2000000000000002e-003 | J312: 4.3e-003 | K312: 38.05 | L312: 1.2999999999999999e-003 | M312: 119.5 | N312: 29.22 | O312: 8.9999999999999997e-002 | P312: 130.22 | Q312: 转股中 | R312: 4年55天 | S312: 2年56天 | T312: 1.08 | U312: 48 | V312: 0.314 | W312: 1.3000000000000001e-002 | X312: 1.7000000000000001e-002 | Y312: 84 | Z312: 5.14 | AA312: -4.1700000000000001e-002 | AB312: -4.9299999999999997e-002 | AC312: -0.125 | AD312: -0.128 | AE312: 88.54 | AF312: 89.34 | AG312: 0.8 | AH312: A+ | AI312: 7.4800000000000005e-002 | AJ312: =H312+100*O312 -> 150.99000000000001 | AK312: 153.8 | AL312: 309 | AM312: 64.4 | AN312: 312 | AO312: -5.0999999999999997e-002 | AP312: 20 | AQ312: 蓝晓转债!
A313: 25 | B313: 113616 | C313: 韦尔转债 | D313: 603501 | E313: 韦尔股份 | F313: 电子 | G313: 元器件制 | H313: 146.76 | I313: 1.2199999999999999e-002 | J313: -7.000000000000001e-004 | K313: 279.79 | L313: 1.47e-002 | M313: 114.5 | N313: 222.83 | O313: 0.16899999999999998 | P313: 125.56 | Q313: 2月20天 | R313: 5.70年 | S313: 3.70年 | T313: 24.4 | U313: 83 | V313: 2.3e-002 | W313: 1.e-002 | X313: 1.3000000000000001e-002 | Y313: 2429. | Z313: 23.96 | AA313: -4.3200000000000002e-002 | AB313: -4.7400000000000005e-002 | AC313: -8.7899999999999992e-002 | AD313: -8.9200000000000002e-002 | AE313: 87.83 | AF313: 90.73 | AG313: 0.78 | AH313: AA+ | AI313: 4.2300000000000004e-002 | AJ313: =H313+100*O313 -> 163.66 | AK313: 168 | AL313: 324 | AM313: 77.2 | AN313: 324 | AO313: 3.1e-002 | AP313: 8 | AQ313: 韦尔转债
A314: 215 | B314: 113550 | C314: 常汽转债! | D314: 603035 | E314: 常熟汽饰 | F314: 汽车 | G314: 零部件制 | H314: 149.27 | I314: 0.14400000000000002 | J314: -6.3399999999999998e-002 | K314: 13.12 | L314: 9.9700000000000011e-002 | M314: 121.3 | N314: 9.65 | O314: 9.8000000000000004e-002 | P314: 135.96 | Q314: 转股中 | R314: 4.59年 | S314: 2.59年 | T314: 3.78 | U314: 1611. | V314: 2.8399999999999999 | W314: 8.4000000000000005e-002 | X314: 0.114 | Y314: 45 | Z314: 1.32 | AA314: -4.5100000000000001e-002 | AB314: -5.2499999999999998e-002 | AC314: -0.122 | AD314: -0.124 | AE314: 88.06 | AF314: 91.96 | AG314: 0.81 | AH314: AA- | AI314: 6.3799999999999996e-002 | AJ314: =H314+100*O314 -> 159.07000000000002 | AK314: 162.6 | AL314: 319 | AM314: 70.6 | AN314: 320 | AO314: 0.16 | AP314: 15 | AQ314: 常汽转债!
A315: 71 | B315: 127023 | C315: 华菱转2 | D315: 932 | E315: 华菱钢铁 | F315: 钢铁 | G315: 炼钢 | H315: 142.4 | I315: -4.0000000000000002e-004 | J315: -1.9599999999999999e-002 | K315: 7.73 | L315: -2.2799999999999997e-002 | M315: 110.1 | N315: 5.18 | O315: -4.5999999999999999e-002 | P315: 149.23 | Q315: 13天 | R315: 5.52年 | S315: 4.52年 | T315: 40 | U315: 338 | V315: 5.9000000000000004e-002 | W315: 8.4000000000000005e-002 | X315: 0.126 | Y315: 474 | Z315: 1.43 | AA315: -4.6100000000000002e-002 | AB315: -4.9299999999999997e-002 | AC315: -6.4600000000000005e-002 | AD315: -6.6199999999999995e-002 | AE315: 87.35 | AF315: 89.29 | AG315: 0.88 | AH315: AAA | AI315: 3.9300000000000002e-002 | AJ315: =H315+100*O315 -> 137.80000000000001 | AK315: 135.6 | AL315: 250 | AM315: 46.3 | AN315: 262 | AO315: 2.e-002 | AP315: 12 | AQ315: 华菱转2
A316: 234 | B316: 123030 | C316: 九洲转债! | D316: 300040 | E316: 九洲集团 | F316: 能源电力 | G316: 电力设备 | H316: 147.078 | I316: -6.1999999999999998e-003 | J316: 1.26e-002 | K316: 7.36 | L316: 8.199999999999999e-003 | M316: 120 | N316: 5.65 | O316: 0.129 | P316: 130.27 | Q316: 转股中 | R316: 4.34年 | S316: 2.35年 | T316: 0.97 | U316: 43 | V316: 0.29899999999999999 | W316: 3.5000000000000003e-002 | X316: 4.4999999999999998e-002 | Y316: 28 | Z316: 1.28 | AA316: -4.6600000000000003e-002 | AB316: -5.4000000000000006e-002 | AC316: -0.13100000000000001 | AD316: -0.13300000000000001 | AE316: 88.77 | AF316: 92.27 | AG316: 0.78 | AH316: AA- | AI316: 6.3799999999999996e-002 | AJ316: =H316+100*O316 -> 159.97800000000001 | AK316: 163.9 | AL316: 321 | AM316: 71.6 | AN316: 321 | AO316: -5.0999999999999997e-002 | AP316: 26 | AQ316: 九洲转债!
A317: 308 | B317: 128036 | C317: 金农转债!! | D317: 2548 | E317: 金新农 | F317: 农业 | G317: 畜牧业 | H317: 125.817 | I317: -3.0999999999999999e-003 | J317: 3.0999999999999999e-003 | K317: 7.07 | L317: 5.6999999999999993e-003 | M317: 109.3 | N317: 6.96 | O317: 0.23899999999999999 | P317: 101.58 | Q317: 转股中 | R317: 2.89年 | S317: 0.90年 | T317: 1.46 | U317: 11 | V317: 5.7999999999999996e-002 | W317: 2.9999999999999999e-002 | X317: 2.9999999999999999e-002 | Y317: 49 | Z317: 1.87 | AA317: -4.8099999999999997e-002 | AB317: -5.3699999999999998e-002 | AC317: -0.17899999999999999 | AD317: -0.18100000000000002 | AE317: 95.48 | AF317: 92.01 | AG317: 0 | AH317: AA- | AI317: 6.2300000000000001e-002 | AJ317: =H317+100*O317 -> 149.71699999999998 | AK317: 150.1 | AL317: 303 | AM317: 54.6 | AN317: 296 | AO317: -1.4999999999999999e-002 | AP317: 16 | AQ317: 金农转债!!
A318: 171 | B318: 128103 | C318: 同德转债! | D318: 2360 | E318: 同德化工 | F318: 化工 | G318: 化工 | H318: 157 | I318: -7.6e-003 | J318: 6.3e-003 | K318: 8.02 | L318: -1.1999999999999999e-003 | M318: 121.3 | N318: 5.18 | O318: 1.3999999999999999e-002 | P318: 154.83 | Q318: 转股中 | R318: 4.94年 | S318: 2.94年 | T318: 1.09 | U318: 88 | V318: 0.51600000000000001 | W318: 3.4000000000000002e-002 | X318: 5.2999999999999999e-002 | Y318: 32 | Z318: 2.53 | AA318: -5.1799999999999999e-002 | AB318: -5.8600000000000006e-002 | AC318: -0.122 | AD318: -0.124 | AE318: 83.45 | AF318: 85.61 | AG318: 1 | AH318: A+ | AI318: 7.4800000000000005e-002 | AJ318: =H318+100*O318 -> 158.40000000000001 | AK318: 159.2 | AL318: 316 | AM318: 73.6 | AN318: 322 | AO318: 5.0999999999999997e-002 | AP318: 13 | AQ318: 同德转债!
A319: 141 | B319: 128111 | C319: 中矿转债! | D319: 2738 | E319: 中矿资源 | F319: 有色金属 | G319: 有色行业 | H319: 167 | I319: 1.52e-002 | J319: 1.e-002 | K319: 25.88 | L319: 2.7799999999999998e-002 | M319: 124.7 | N319: 15.47 | O319: -2.e-003 | P319: 167.29 | Q319: 转股中 | R319: 5年55天 | S319: 3年56天 | T319: 2.2 | U319: 758 | V319: 2.0800000000000001 | W319: 2.7000000000000003e-002 | X319: 4.4999999999999998e-002 | Y319: 82 | Z319: 2.67 | AA319: -5.6299999999999996e-002 | AB319: -6.3600000000000004e-002 | AC319: -0.129 | AD319: -0.13100000000000001 | AE319: 85.05 | AF319: 90.76 | AG319: 0.9 | AH319: AA- | AI319: 6.5299999999999997e-002 | AJ319: =H319+100*O319 -> 166.80000000000001 | AK319: 166.7 | AL319: 323 | AM319: 75.9 | AN319: 323 | AO319: 0.13200000000000001 | AP319: 8 | AQ319: 中矿转债!
A320: 341 | B320: 113012 | C320: 骆驼转债! | D320: 601311 | E320: 骆驼股份 | F320: 汽车 | G320: 零部件制 | H320: 119.37 | I320: 9.0000000000000011e-003 | J320: -4.6999999999999993e-003 | K320: 10.99 | L320: 6.4000000000000003e-003 | M320: 106.5 | N320: 10.06 | O320: 9.3000000000000013e-002 | P320: 109.24 | Q320: 转股中 | R320: 1.94年 | S320: 回售内 | T320: 5.1 | U320: 22 | V320: 3.6000000000000004e-002 | W320: 4.0999999999999995e-002 | X320: 4.4999999999999998e-002 | Y320: 123 | Z320: 1.84 | AA320: -5.7599999999999998e-002 | AB320: -6.3500000000000001e-002 | AC320: 回售内 | AD320: 回售内 | AE320: 100.25 | AF320: 98.53 | AG320: 0.67 | AH320: AA | AI320: 4.1299999999999996e-002 | AJ320: =H320+100*O320 -> 128.67000000000002 | AK320: 129.5 | AL320: 203 | AM320: 29.2 | AN320: 128 | AO320: -1.e-003 | AP320: 16 | AQ320: 骆驼转债!
A321: 342 | B321: 113011 | C321: 光大转债 | D321: 601818 | E321: 光大银行 | F321: 金融 | G321: 银行行业 | H321: 119.91 | I321: -7.000000000000001e-004 | J321: 3.7000000000000002e-003 | K321: 3.91 | L321: 5.1000000000000004e-003 | M321: 106.8 | N321: 3.76 | O321: 0.153 | P321: 103.99 | Q321: 转股中 | R321: 1.92年 | S321: 无权 | T321: 242 | U321: 95 | V321: 3.0000000000000001e-003 | W321: 0.115 | X321: 0.11900000000000001 | Y321: 2113. | Z321: 0.61 | AA321: -5.91e-002 | AB321: -6.5299999999999997e-002 | AC321: 无权 | AD321: 无权 | AE321: 无权 | AF321: 99.8 | AG321: 0.58 | AH321: AAA | AI321: 3.6299999999999999e-002 | AJ321: =H321+100*O321 -> 135.21000000000001 | AK321: 135.8 | AL321: 251 | AM321: 36 | AN321: 191 | AO321: -3.2000000000000001e-002 | AP321: 14 | AQ321: 光大转债
A322: 103 | B322: 128126 | C322: 赣锋转2!* | D322: 2460 | E322: 赣锋锂业 | F322: 有色金属 | G322: 小金属 | H322: 158 | I322: -2.5899999999999999e-002 | J322: -2.8999999999999998e-003 | K322: 95.18 | L322: -2.8799999999999999e-002 | M322: 111.1 | N322: 60.27 | O322: 0. | P322: 157.92 | Q322: 转股中 | R322: 5.30年 | S322: 3.31年 | T322: 14.2 | U322: 574 | V322: 0.25600000000000001 | W322: 1.1000000000000001e-002 | X322: 1.7000000000000001e-002 | Y322: 1291. | Z322: 12.6 | AA322: -6.5099999999999991e-002 | AB322: -6.8499999999999991e-002 | AC322: -0.114 | AD322: -0.115 | AE322: 88.59 | AF322: 88.62 | AG322: 1 | AH322: AA | AI322: 4.4299999999999999e-002 | AJ322: =H322+100*O322 -> 158. | AK322: 158.1 | AL322: 315 | AM322: 69.5 | AN322: 319 | AO322: -8.0000000000000002e-003 | AP322: 9 | AQ322: 赣锋转2!*
A323: 229 | B323: 113545 | C323: 金能转债! | D323: 603113 | E323: 金能科技 | F323: 煤炭 | G323: 炼焦 | H323: 154.8 | I323: 1.67e-002 | J323: -2.8500000000000001e-002 | K323: 16.07 | L323: -1.3500000000000002e-002 | M323: 114.9 | N323: 10.78 | O323: 3.7999999999999999e-002 | P323: 149.07 | Q323: 转股中 | R323: 4.49年 | S323: 2.50年 | T323: 10.2 | U323: 828 | V323: 0.51700000000000002 | W323: 7.4999999999999997e-002 | X323: 0.11199999999999999 | Y323: 137 | Z323: 1.78 | AA323: -6.5299999999999997e-002 | AB323: -7.0599999999999996e-002 | AC323: -0.14000000000000001 | AD323: -0.10099999999999999 | AE323: 92.59 | AF323: 95.54 | AG323: 0.88 | AH323: AA | AI323: 4.2800000000000005e-002 | AJ323: =H323+100*O323 -> 158.60000000000002 | AK323: 160.5 | AL323: 317 | AM323: 65 | AN323: 314 | AO323: -0.156 | AP323: 18 | AQ323: 金能转债!
A324: 190 | B324: 128097 | C324: 奥佳转债! | D324: 2614 | E324: 奥佳华 | F324: 机械装备 | G324: 专用设备 | H324: 160.4 | I324: -9.0000000000000011e-003 | J324: -1.5e-003 | K324: 17.1 | L324: -1.1599999999999999e-002 | M324: 114.9 | N324: 10.69 | O324: 3.0000000000000001e-003 | P324: 159.96 | Q324: 转股中 | R324: 4.86年 | S324: 2.86年 | T324: 5.15 | U324: 50 | V324: 6.0999999999999999e-002 | W324: 4.8000000000000001e-002 | X324: 7.6999999999999999e-002 | Y324: 107 | Z324: 2.38 | AA324: -6.7400000000000002e-002 | AB324: -7.2300000000000003e-002 | AC324: -0.13300000000000001 | AD324: -0.13500000000000001 | AE324: 91.17 | AF324: 94.08 | AG324: 0.9 | AH324: AA | AI324: 4.2800000000000005e-002 | AJ324: =H324+100*O324 -> 160.70000000000002 | AK324: 160.8 | AL324: 318 | AM324: 66.8 | AN324: 317 | AO324: 2.4e-002 | AP324: 22 | AQ324: 奥佳转债!
A325: 174 | B325: 123046 | C325: 天铁转债! | D325: 300587 | E325: 天铁股份 | F325: 铁路 | G325: 铁路设备 | H325: 169 | I325: -2.75e-002 | J325: 1.32e-002 | K325: 17.06 | L325: -1.5600000000000001e-002 | M325: 117.7 | N325: 10.12 | O325: 3.0000000000000001e-003 | P325: 168.58 | Q325: 转股中 | R325: 4.92年 | S325: 2.92年 | T325: 0.77 | U325: 90 | V325: 0.68299999999999994 | W325: 1.3000000000000001e-002 | X325: 2.2000000000000002e-002 | Y325: 58 | Z325: 4.19 | AA325: -7.2099999999999997e-002 | AB325: -7.7699999999999991e-002 | AC325: -0.14400000000000002 | AD325: -0.14599999999999999 | AE325: 85.74 | AF325: 87.36 | AG325: 0.92 | AH325: AA- | AI325: 6.3799999999999996e-002 | AJ325: =H325+100*O325 -> 169.30000000000001 | AK325: 169.4 | AL325: 326 | AM325: 82.1 | AN325: 328 | AO325: 3.2000000000000001e-002 | AP325: 12 | AQ325: 天铁转债!
A326: 268 | B326: 110055 | C326: 伊力转债!! | D326: 600197 | E326: 伊力特 | F326: 食品饮料 | G326: 白酒 | H326: 152.52 | I326: 0.11599999999999999 | J326: -2.7300000000000001e-002 | K326: 24.84 | L326: 0.10000000000000001 | M326: 114.3 | N326: 16.81 | O326: 3.2000000000000001e-002 | P326: 147.77 | Q326: 转股中 | R326: 3.91年 | S326: 1.91年 | T326: 2.85 | U326: 1597. | V326: 3.79 | W326: 2.4e-002 | X326: 3.6000000000000004e-002 | Y326: 117 | Z326: 4.04 | AA326: -7.22e-002 | AB326: -7.8100000000000003e-002 | AC326: -0.13699999999999998 | AD326: -0.13900000000000001 | AE326: 94.28 | AF326: 97.31 | AG326: 0.89 | AH326: AA | AI326: 4.2800000000000005e-002 | AJ326: =H326+100*O326 -> 155.72 | AK326: 157.3 | AL326: 313 | AM326: 60 | AN326: 304 | AO326: 0.23499999999999999 | AP326: 24 | AQ326: 伊力转债!!
A327: 219 | B327: 123034 | C327: 通光转债! | D327: 300265 | E327: 通光线缆 | F327: 通信互联 | G327: 通信设备 | H327: 168.616 | I327: -8.1000000000000013e-003 | J327: 2.2400000000000003e-002 | K327: 8.69 | L327: 2.e-002 | M327: 118 | N327: 7.97 | O327: 0.54600000000000004 | P327: 109.03 | Q327: 转股中 | R327: 4.55年 | S327: 2.55年 | T327: 0.78 | U327: 38 | V327: 0.28800000000000003 | W327: 2.5000000000000001e-002 | X327: 2.7000000000000003e-002 | Y327: 32 | Z327: 2.46 | AA327: -7.6700000000000004e-002 | AB327: -8.2799999999999999e-002 | AC327: -0.114 | AD327: -0.115 | AE327: 85.24 | AF327: 85.57 | AG327: 0.71 | AH327: A+ | AI327: 7.4800000000000005e-002 | AJ327: =H327+100*O327 -> 223.21600000000001 | AK327: 228.2 | AL327: 336 | AM327: 142.6 | AN327: 336 | AO327: -5.7000000000000002e-002 | AP327: 23 | AQ327: 通光转债!
A328: 313 | B328: 113504 | C328: 艾华转债!! | D328: 603989 | E328: 艾华集团 | F328: 电子 | G328: 元器件制 | H328: 139.57 | I328: -7.6e-003 | J328: -1.7000000000000001e-003 | K328: 29.59 | L328: -1.04e-002 | M328: 109.3 | N328: 21.13 | O328: -3.0000000000000001e-003 | P328: 140.04 | Q328: 转股中 | R328: 2.87年 | S328: 0.88年 | T328: 5.06 | U328: 15 | V328: 2.1000000000000001e-002 | W328: 4.2999999999999997e-002 | X328: 5.9999999999999998e-002 | Y328: 118 | Z328: 4.64 | AA328: -8.2599999999999993e-002 | AB328: -8.7899999999999992e-002 | AC328: -0.25800000000000001 | AD328: -0.26100000000000001 | AE328: 97.6 | AF328: 97.47 | AG328: 0.9 | AH328: AA | AI328: 4.1299999999999996e-002 | AJ328: =H328+100*O328 -> 139.26999999999998 | AK328: 139.1 | AL328: 270 | AM328: 41.5 | AN328: 231 | AO328: 2.7000000000000003e-002 | AP328: 9 | AQ328: 艾华转债!!
A329: 64 | B329: 113041 | C329: 紫金转债 | D329: 601899 | E329: 紫金矿业 | F329: 有色金属 | G329: 贵金属 | H329: 159.54 | I329: 1.5900000000000001e-002 | J329: -1.4199999999999999e-002 | K329: 10.23 | L329: 2.e-003 | M329: 108 | N329: 7 | O329: 9.1999999999999998e-002 | P329: 146.14 | Q329: 24天 | R329: 4.55年 | S329: 2.55年 | T329: 60 | U329: 607 | V329: 6.2e-002 | W329: 2.3e-002 | X329: 3.4000000000000002e-002 | Y329: 2606. | Z329: 5.07 | AA329: -8.2699999999999996e-002 | AB329: -8.5699999999999998e-002 | AC329: -0.107 | AD329: -0.107 | AE329: 91.65 | AF329: 91.35 | AG329: 0.89 | AH329: AAA | AI329: 3.78e-002 | AJ329: =H329+100*O329 -> 168.73999999999998 | AK329: 172.9 | AL329: 328 | AM329: 81.3 | AN329: 327 | AO329: 1.3999999999999999e-002 | AP329: 8 | AQ329: 紫金转债
A330: 207 | B330: 113557 | C330: 森特转债!* | D330: 603098 | E330: 森特股份 | F330: 建筑 | G330: 建筑工程 | H330: 179.05 | I330: 1.5e-003 | J330: 2.0000000000000001e-004 | K330: 18.23 | L330: 1.6000000000000001e-003 | M330: 120.3 | N330: 10.11 | O330: -6.9999999999999993e-003 | P330: 180.32 | Q330: 转股中 | R330: 4.67年 | S330: 2.68年 | T330: 1.08 | U330: 348 | V330: 1.8200000000000001 | W330: 1.1000000000000001e-002 | X330: 2.e-002 | Y330: 95 | Z330: 4.22 | AA330: -8.2899999999999988e-002 | AB330: -8.9499999999999996e-002 | AC330: -0.11699999999999999 | AD330: -0.11800000000000001 | AE330: 87.09 | AF330: 90.65 | AG330: 1 | AH330: AA- | AI330: 6.3799999999999996e-002 | AJ330: =H330+100*O330 -> 178.35000000000002 | AK330: 177.8 | AL330: 330 | AM330: 87.1 | AN330: 330 | AO330: 3.6000000000000004e-002 | AP330: 34 | AQ330: 森特转债!*
A331: 191 | B331: 128095 | C331: 恩捷转债!! | D331: 2812 | E331: 恩捷股份 | F331: 电子 | G331: 元器件制 | H331: 174.81 | I331: -2.6699999999999998e-002 | J331: 2.3e-003 | K331: 113.38 | L331: -2.6200000000000001e-002 | M331: 114.9 | N331: 65.09 | O331: 4.0000000000000001e-003 | P331: 174.19 | Q331: 转股中 | R331: 4.82年 | S331: 2.82年 | T331: 7.38 | U331: 87 | V331: 6.7000000000000004e-002 | W331: 6.9999999999999993e-003 | X331: 1.3000000000000001e-002 | Y331: 1006. | Z331: 9.13 | AA331: -8.4600000000000009e-002 | AB331: -8.9399999999999993e-002 | AC331: -0.105 | AD331: -0.106 | AE331: 91.32 | AF331: 94.23 | AG331: 0.93 | AH331: AA | AI331: 4.2800000000000005e-002 | AJ331: =H331+100*O331 -> 175.21000000000001 | AK331: 175.4 | AL331: 329 | AM331: 81.2 | AN331: 326 | AO331: -1.3000000000000001e-002 | AP331: 15 | AQ331: 恩捷转债!!
A332: 253 | B332: 113025 | C332: 明泰转债!! | D332: 601677 | E332: 明泰铝业 | F332: 有色金属 | G332: 铝金属 | H332: 166.29 | I332: -1.29e-002 | J332: -1.4000000000000002e-003 | K332: 18.73 | L332: -1.52e-002 | M332: 114.5 | N332: 11.2 | O332: -6.0000000000000001e-003 | P332: 167.23 | Q332: 转股中 | R332: 3.98年 | S332: 1.98年 | T332: 11.3 | U332: 154 | V332: 8.1000000000000003e-002 | W332: 8.900000000000001e-002 | X332: 0.14899999999999999 | Y332: 127 | Z332: 1.47 | AA332: -9.0800000000000006e-002 | AB332: -9.6500000000000002e-002 | AC332: -0.154 | AD332: -0.156 | AE332: 94.03 | AF332: 97.19 | AG332: 0.94 | AH332: AA | AI332: 4.2800000000000005e-002 | AJ332: =H332+100*O332 -> 165.69 | AK332: 165.3 | AL332: 322 | AM332: 68.2 | AN332: 318 | AO332: -1.8000000000000002e-002 | AP332: 26 | AQ332: 明泰转债!!
A333: 335 | B333: 128017 | C333: 金禾转债!! | D333: 2597 | E333: 金禾实业 | F333: 化工 | G333: 化工 | H333: 147.9 | I333: 1.1899999999999999e-002 | J333: -6.7000000000000002e-003 | K333: 31.57 | L333: 5.6999999999999993e-003 | M333: 108.8 | N333: 22.42 | O333: 5.0000000000000003e-002 | P333: 140.81 | Q333: 转股中 | R333: 2.55年 | S333: 0.55年 | T333: 5.52 | U333: 70 | V333: 8.6999999999999994e-002 | W333: 3.1e-002 | X333: 4.4000000000000004e-002 | Y333: 177 | Z333: 3.69 | AA333: -0.115 | AB333: -0.121 | AC333: -0.45500000000000002 | AD333: -0.45799999999999996 | AE333: 98.67 | AF333: 98.31 | AG333: 0.9 | AH333: AA | AI333: 4.1299999999999996e-002 | AJ333: =H333+100*O333 -> 152.90000000000001 | AK333: 155 | AL333: 311 | AM333: 56.3 | AN333: 301 | AO333: -0.151 | AP333: 10 | AQ333: 金禾转债!!
A334: 232 | B334: 123031 | C334: 晶瑞转债! | D334: 300655 | E334: 晶瑞股份 | F334: 化工 | G334: 化工 | H334: 210.946 | I334: -9.8999999999999991e-003 | J334: 2.0400000000000001e-002 | K334: 33.33 | L334: 1.1200000000000002e-002 | M334: 115.8 | N334: 18.43 | O334: 0.16600000000000001 | P334: 180.85 | Q334: 转股中 | R334: 4.37年 | S334: 2.37年 | T334: 0.63 | U334: 45 | V334: 0.33700000000000002 | W334: 1.e-002 | X334: 1.8000000000000002e-002 | Y334: 63 | Z334: 4.84 | AA334: -0.13 | AB334: -0.13500000000000001 | AC334: -0.16800000000000001 | AD334: -0.16899999999999998 | AE334: 86.19 | AF334: 85.06 | AG334: 0.94 | AH334: A+ | AI334: 7.4800000000000005e-002 | AJ334: =H334+100*O334 -> 227.54599999999999 | AK334: 241 | AL334: 337 | AM334: 154.9 | AN334: 338 | AO334: -9.0000000000000011e-003 | AP334: 16 | AQ334: 晶瑞转债!
A335: 151 | B335: 113582 | C335: 火炬转债! | D335: 603678 | E335: 火炬电子 | F335: 电子 | G335: 元器件制 | H335: 232.19 | I335: -1.2800000000000001e-002 | J335: -1.4199999999999999e-002 | K335: 55.53 | L335: -2.7799999999999998e-002 | M335: 115.3 | N335: 25.33 | O335: 5.9000000000000004e-002 | P335: 219.23 | Q335: 转股中 | R335: 5年40天 | S335: 3年41天 | T335: 4.18 | U335: 89 | V335: 9.1999999999999998e-002 | W335: 1.6e-002 | X335: 3.6000000000000004e-002 | Y335: 255 | Z335: 7.24 | AA335: -0.13 | AB335: -0.13400000000000001 | AC335: -0.126 | AD335: -0.127 | AE335: 90.2 | AF335: 92.83 | AG335: 0.97 | AH335: AA | AI335: 4.4299999999999999e-002 | AJ335: =H335+100*O335 -> 238.09 | AK335: 245.2 | AL335: 338 | AM335: 152.3 | AN335: 337 | AO335: -3.7999999999999999e-002 | AP335: 5 | AQ335: 火炬转债!
A336: 238 | B336: 113543 | C336: 欧派转债! | D336: 603833 | E336: 欧派家居 | F336: 其他 | G336: 家居用品 | H336: 216.1 | I336: 2.4500000000000001e-002 | J336: -6.6e-003 | K336: 155.01 | L336: 1.84e-002 | M336: 114.9 | N336: 71.69 | O336: -1.e-003 | P336: 216.22 | Q336: 转股中 | R336: 4.33年 | S336: 3.33年 | T336: 4 | U336: 123 | V336: 0.14400000000000002 | W336: 4.0000000000000001e-003 | X336: 9.0000000000000011e-003 | Y336: 934 | Z336: 8.55 | AA336: -0.13800000000000001 | AB336: -0.14300000000000002 | AC336: -0.105 | AD336: -0.106 | AE336: 91.1 | AF336: 96.19 | AG336: 0.97 | AH336: AA | AI336: 4.2800000000000005e-002 | AJ336: =H336+100*O336 -> 216. | AK336: 216 | AL336: 335 | AM336: 119.8 | AN336: 335 | AO336: -2.9999999999999999e-002 | AP336: 14 | AQ336: 欧派转债!
A337: 280 | B337: 123018 | C337: 溢利转债! | D337: 300381 | E337: 溢多利 | F337: 医药 | G337: 原料药 | H337: 208 | I337: -2.1099999999999997e-002 | J337: 5.2600000000000001e-002 | K337: 9.14 | L337: 4.58e-002 | M337: 114.3 | N337: 8.32 | O337: 0.89300000000000002 | P337: 109.86 | Q337: 转股中 | R337: 3.68年 | S337: 1.68年 | T337: 0.54 | U337: 75 | V337: 0.66000000000000003 | W337: 1.2e-002 | X337: 1.3000000000000001e-002 | Y337: 45 | Z337: 1.54 | AA337: -0.152 | AB337: -0.158 | AC337: -0.25 | AD337: -0.251 | AE337: 91.79 | AF337: 91.45 | AG337: 0.69 | AH337: AA- | AI337: 6.3799999999999996e-002 | AJ337: =H337+100*O337 -> 297.30000000000001 | AK337: 306.1 | AL337: 340 | AM337: 214.4 | AN337: 340 | AO337: 4.0000000000000001e-003 | AP337: 12 | AQ337: 溢利转债!
A338: 153 | B338: 113580 | C338: 康隆转债! | D338: 603665 | E338: 康隆达 | F338: 服装纺织 | G338: 服装行业 | H338: 273.81 | I338: -1.89e-002 | J338: 3.5900000000000001e-002 | K338: 15.9 | L338: 2.6499999999999999e-002 | M338: 121.2 | N338: 15.51 | O338: 1.6699999999999999 | P338: 102.51 | Q338: 转股中 | R338: 5年6.1天 | S338: 3年7天 | T338: 0.41 | U338: 215 | V338: 1.9099999999999999 | W338: 1.6e-002 | X338: 1.7000000000000001e-002 | Y338: 25 | Z338: 2.47 | AA338: -0.152 | AB338: -0.158 | AC338: -0.14899999999999999 | AD338: -0.14999999999999999 | AE338: 85.35 | AF338: 88.92 | AG338: 0.64 | AH338: AA- | AI338: 6.5299999999999997e-002 | AJ338: =H338+100*O338 -> 440.81 | AK338: 445.1 | AL338: 344 | AM338: 356.2 | AN338: 344 | AO338: -3.1e-002 | AP338: 9 | AQ338: 康隆转债!
A339: 339 | B339: 127004 | C339: 模塑转债!! | D339: 700 | E339: 模塑科技 | F339: 汽车 | G339: 零部件制 | H339: 163.3 | I339: -5.7999999999999996e-003 | J339: 6.0000000000000001e-003 | K339: 5.13 | L339: 3.85e-002 | M339: 113.3 | N339: 7.46 | O339: 1.3700000000000001 | P339: 68.77 | Q339: 转股中 | R339: 2年47天 | S339: 47天 | T339: 1.32 | U339: 480 | V339: 2.1800000000000002 | W339: 2.7999999999999997e-002 | X339: 1.9e-002 | Y339: 47 | Z339: 1.81 | AA339: -0.16 | AB339: -0.16899999999999998 | AC339: -1.3740000000000001 | AD339: -1.3799999999999999 | AE339: 100.6 | AF339: 100.77 | AG339: 0.01 | AH339: AA | AI339: 4.1299999999999996e-002 | AJ339: =H339+100*O339 -> 300.30000000000001 | AK339: 257.8 | AL339: 339 | AM339: 157.1 | AN339: 339 | AO339: 5.7000000000000002e-002 | AP339: 33 | AQ339: 模塑转债!!
A340: 306 | B340: 113509 | C340: 新泉转债!! | D340: 603179 | E340: 新泉股份 | F340: 汽车 | G340: 零部件制 | H340: 196.45 | I340: 2.12e-002 | J340: 6.0999999999999995e-003 | K340: 30.76 | L340: 2.81e-002 | M340: 110.3 | N340: 15.55 | O340: -6.9999999999999993e-003 | P340: 197.81 | Q340: 转股中 | R340: 3年48天 | S340: 1年49天 | T340: 0.88 | U340: 123 | V340: 0.71400000000000008 | W340: 8.0000000000000002e-003 | X340: 1.4999999999999999e-002 | Y340: 114 | Z340: 3.31 | AA340: -0.17100000000000001 | AB340: -0.17600000000000002 | AC340: -0.35700000000000004 | AD340: -0.35799999999999998 | AE340: 97.4 | AF340: 97.02 | AG340: 0.97 | AH340: AA | AI340: 4.2800000000000005e-002 | AJ340: =H340+100*O340 -> 195.75 | AK340: 195.1 | AL340: 331 | AM340: 97.7 | AN340: 331 | AO340: 8.0000000000000002e-003 | AP340: 11 | AQ340: 新泉转债!!
A341: 292 | B341: 123015 | C341: 蓝盾转债!! | D341: 300297 | E341: 蓝盾股份 | F341: 计算机及 | G341: 软件开发 | H341: 212.83 | I341: -7.8000000000000005e-003 | J341: 9.1999999999999998e-003 | K341: 3.87 | L341: 3.2000000000000001e-002 | M341: 112.3 | N341: 5.79 | O341: 2.1800000000000002 | P341: 66.84 | Q341: 转股中 | R341: 3.32年 | S341: 1.33年 | T341: 1 | U341: 212 | V341: 0.98599999999999999 | W341: 2.1000000000000001e-002 | X341: 1.3999999999999999e-002 | Y341: 48 | Z341: 1.26 | AA341: -0.17800000000000002 | AB341: -0.183 | AC341: -0.33000000000000002 | AD341: -0.33100000000000002 | AE341: 93.82 | AF341: 91.84 | AG341: 0.04 | AH341: AA- | AI341: 6.3799999999999996e-002 | AJ341: =H341+100*O341 -> 430.83000000000004 | AK341: 358.8 | AL341: 341 | AM341: 265 | AN341: 341 | AO341: -4.2000000000000003e-002 | AP341: 18 | AQ341: 蓝盾转债!!
A342: 334 | B342: 113016 | C342: 小康转债!! | D342: 601127 | E342: 小康股份 | F342: 汽车 | G342: 零部件制 | H342: 193.74 | I342: -7.6e-003 | J342: -1.9199999999999998e-002 | K342: 29 | L342: -2.75e-002 | M342: 109.3 | N342: 15.7 | O342: 4.9000000000000002e-002 | P342: 184.71 | Q342: 转股中 | R342: 2.56年 | S342: 0.56年 | T342: 3.69 | U342: 2633. | V342: 3.5600000000000001 | W342: 1.e-002 | X342: 1.8000000000000002e-002 | Y342: 374 | Z342: 6.32 | AA342: -0.20300000000000001 | AB342: -0.20800000000000002 | AC342: -0.67400000000000004 | AD342: -0.67599999999999993 | AE342: 98.86 | AF342: 98.73 | AG342: 0.98 | AH342: AA | AI342: 4.1299999999999996e-002 | AJ342: =H342+100*O342 -> 198.64000000000001 | AK342: 202.8 | AL342: 332 | AM342: 103.9 | AN342: 332 | AO342: 0.158 | AP342: 46 | AQ342: 小康转债!!
A343: 303 | B343: 110044 | C343: 广电转债!! | D343: 600831 | E343: 广电网络 | F343: 传媒娱乐 | G343: 影视娱乐 | H343: 246.12 | I343: -6.8999999999999999e-003 | J343: 1.5900000000000001e-002 | K343: 5.94 | L343: 2.5899999999999999e-002 | M343: 112.3 | N343: 6.9 | O343: 1.8600000000000001 | P343: 86.09 | Q343: 转股中 | R343: 3.19年 | S343: 1.20年 | T343: 0.71 | U343: 526 | V343: 2.98 | W343: 1.7000000000000001e-002 | X343: 1.3999999999999999e-002 | Y343: 42 | Z343: 1.14 | AA343: -0.221 | AB343: -0.22600000000000001 | AC343: -0.41200000000000003 | AD343: -0.41399999999999998 | AE343: 97.15 | AF343: 98.52 | AG343: 0.35 | AH343: AA | AI343: 4.2800000000000005e-002 | AJ343: =H343+100*O343 -> 432.12 | AK343: 406.2 | AL343: 342 | AM343: 307.6 | AN343: 342 | AO343: 3.1e-002 | AP343: 11 | AQ343: 广电转债!!
A344: 279 | B344: 113526 | C344: 联泰转债! | D344: 603797 | E344: 联泰环保 | F344: 城市公用 | G344: 三废处理 | H344: 331.82 | I344: -1.37e-002 | J344: 1.1699999999999999e-002 | K344: 7.95 | L344: -2.5000000000000001e-003 | M344: 110.3 | N344: 6.11 | O344: 1.55 | P344: 130.11 | Q344: 转股中 | R344: 3.77年 | S344: 1.77年 | T344: 1.93 | U344: 466 | V344: 0.71499999999999997 | W344: 5.4000000000000006e-002 | X344: 7.0000000000000007e-002 | Y344: 36 | Z344: 2.31 | AA344: -0.25600000000000001 | AB344: -0.25900000000000001 | AC344: -0.32200000000000001 | AD344: -0.32200000000000001 | AE344: 95.18 | AF344: 95.12 | AG344: 0.81 | AH344: AA+ | AI344: 4.0800000000000003e-002 | AJ344: =H344+100*O344 -> 486.81999999999999 | AK344: 533.5 | AL344: 346 | AM344: 438.3 | AN344: 346 | AO344: -6.0000000000000001e-003 | AP344: 9 | AQ344: 联泰转债!
A345: 299 | B345: 128041 | C345: 盛路转债!! | D345: 2446 | E345: 盛路通信 | F345: 通信互联 | G345: 通信设备 | H345: 298 | I345: -2.5699999999999997e-002 | J345: 3.6000000000000004e-002 | K345: 6.15 | L345: 2.3300000000000001e-002 | M345: 114.3 | N345: 6.82 | O345: 2.2999999999999998 | P345: 90.18 | Q345: 转股中 | R345: 3.25年 | S345: 1.25年 | T345: 0.53 | U345: 406 | V345: 2.5299999999999998 | W345: 9.0000000000000011e-003 | X345: 9.0000000000000011e-003 | Y345: 56 | Z345: 1.84 | AA345: -0.25900000000000001 | AB345: -0.26400000000000001 | AC345: -0.44299999999999995 | AD345: -0.44400000000000001 | AE345: 96.92 | AF345: 100.04 | AG345: 0.44 | AH345: AA | AI345: 4.2800000000000005e-002 | AJ345: =H345+100*O345 -> 528. | AK345: 505.8 | AL345: 345 | AM345: 405.8 | AN345: 345 | AO345: 7.6999999999999999e-002 | AP345: 13 | AQ345: 盛路转债!!
A346: 323 | B346: 128029 | C346: 太阳转债!! | D346: 2078 | E346: 太阳纸业 | F346: 造纸包装 | G346: 造纸行业 | H346: 190.9 | I346: 2.0999999999999999e-003 | J346: -1.4000000000000002e-003 | K346: 14.8 | L346: 7.000000000000001e-004 | M346: 107 | N346: 8.55 | O346: 0.10300000000000001 | P346: 173.1 | Q346: 转股中 | R346: 1.69年 | S346: 回售内 | T346: 9.09 | U346: 57 | V346: 3.3000000000000002e-002 | W346: 2.3e-002 | X346: 4.0999999999999995e-002 | Y346: 388 | Z346: 2.5 | AA346: -0.29199999999999998 | AB346: -0.29699999999999999 | AC346: 回售内 | AD346: 回售内 | AE346: 100.17 | AF346: 100.31 | AG346: 1 | AH346: AA+ | AI346: 3.9300000000000002e-002 | AJ346: =H346+100*O346 -> 201.20000000000002 | AK346: 208.7 | AL346: 334 | AM346: 108.4 | AN346: 333 | AO346: -6.5000000000000002e-002 | AP346: 7 | AQ346: 太阳转债!!
A347: 322 | B347: 128030 | C347: 天康转债!! | D347: 2100 | E347: 天康生物 | F347: 农业 | G347: 畜牧业 | H347: 278.229 | I347: 0. | J347: 0. | K347: 10.23 | L347: 0. | M347: 111.3 | N347: 7.85 | O347: 1.1299999999999999 | P347: 130.32 | Q347: 转股中 | R347: 2.69年 | S347: 0.69年 | T347: 0.96 | U347: 10 | V347: 3.7999999999999999e-002 | W347: 9.0000000000000011e-003 | X347: 1.1000000000000001e-002 | Y347: 110 | Z347: 1.84 | AA347: -0.29199999999999998 | AB347: -0.29699999999999999 | AC347: -0.75700000000000001 | AD347: -0.75800000000000001 | AE347: 98.36 | AF347: 100.02 | AG347: 1 | AH347: AA | AI347: 4.1299999999999996e-002 | AJ347: =H347+100*O347 -> 391.22899999999998 | AK347: 426.1 | AL347: 343 | AM347: 326.1 | AN347: 343 | AO347: -5.7999999999999996e-002 | AP347: 12 | AQ347: 天康转债!!
A348: 296 | B348: 123013 | C348: 横河转债! | D348: 300539 | E348: 横河模具 | F348: 机械装备 | G348: 专用设备 | H348: 387.6 | I348: -1.8700000000000001e-002 | J348: 2.58e-002 | K348: 7.05 | L348: 2.0299999999999999e-002 | M348: 115.2 | N348: 9.13 | O348: 4.0199999999999996 | P348: 77.22 | Q348: 转股中 | R348: 3.27年 | S348: 1.28年 | T348: 0.38 | U348: 157 | V348: 1.0600000000000001 | W348: 2.4e-002 | X348: 1.9e-002 | Y348: 16 | Z348: 3.19 | AA348: -0.314 | AB348: -0.31900000000000001 | AC348: -0.48599999999999999 | AD348: -0.48700000000000004 | AE348: 93.26 | AF348: 91.53 | AG348: 0.35 | AH348: A+ | AI348: 7.4800000000000005e-002 | AJ348: =H348+100*O348 -> 789.59999999999991 | AK348: 698 | AL348: 347 | AM348: 604.7 | AN348: 347 | AO348: 1.9e-002 | AP348: 15 | AQ348: 横河转债!
A349: 236 | B349: 123029 | C349: 英科转债! | D349: 300677 | E349: 英科医疗 | F349: 医药 | G349: 医疗器械 | H349: 1737 | I349: -1.8600000000000002e-002 | J349: 1.06e-002 | K349: 148.84 | L349: -8.1000000000000013e-003 | M349: 138.2 | N349: 11.32 | O349: 0.32100000000000001 | P349: 1314.84 | Q349: 转股中 | R349: 4.33年 | S349: 2.33年 | T349: 1.23 | U349: 656 | V349: 0.31 | W349: 2.e-003 | X349: 3.1e-002 | Y349: 524 | Z349: 5.62 | AA349: -0.40899999999999997 | AB349: -0.41299999999999998 | AC349: -0.31900000000000001 | AD349: -0.31900000000000001 | AE349: 92.2 | AF349: 106.78 | AG349: 0.99 | AH349: AA- | AI349: 6.3799999999999996e-002 | AJ349: =H349+100*O349 -> 1769.0999999999999 | AK349: 2159.1999999999998 | AL349: 348 | AM349: 2052.4000000000001 | AN349: 348 | AO349: -9.1999999999999998e-002 | AP349: 16 | AQ349: 英科转债!