A1: 序号 | B1: 转债代码 | C1: 转债名称 | D1: 股票代码 | E1: 股票名称 | F1: 行业 | G1: 子行业 | H1: 转债价格 | I1: 涨跌 | J1: 日内套利 | K1: 股价 | L1: 涨跌 | M1: 剩余本息 | N1: 转股价格 | O1: 转股溢价率 | P1: 转股价值 | Q1: 距离转股日 | R1: 剩余年限 | S1: 回售年限 | T1: 转债余额 | U1: 转债成交额 | V1: 转债换手率 | W1: 余额/市值 | X1: 余额/股本 | Y1: 股票市值 | Z1: P/B | AA1: 税前收益率 | AB1: 税后收益率 | AC1: 税前回售收益 | AD1: 税后回售收益 | AE1: 回售价值 | AF1: 纯债价值 | AG1: 弹性 | AH1: 信用 | AI1: 折现率 | AJ1: 双低 | AK1: 老式双低 | AL1: 老式排名 | AM1: 新式双低 | AN1: 新式排名 | AO1: MA20乖离 | AP1: 热门度 | AQ1: 转债名称
A2: 248 | B2: 128062 | C2: 亚药转债! | D2: 2370 | E2: 亚太药业 | F2: 医药 | G2: 化学制药 | H2: 70.86 | I2: 1.e-003 | J2: -1.e-003 | K2: 3.7 | L2: 1.9299999999999998e-002 | M2: 119.8 | N2: 16.25 | O2: 2.1099999999999999 | P2: 22.77 | Q2: 转股中 | R2: 4年27天 | S2: 2年28天 | T2: 9.63 | U2: 16 | V2: 2.4e-002 | W2: 0.48499999999999999 | X2: 0.11 | Y2: 20 | Z2: 6.17 | AA2: 0.14099999999999999 | AB2: 0.13100000000000001 | AC2: 0.185 | AD2: 0.182 | AE2: 82.64 | AF2: 80.22 | AG2: 0 | AH2: BBB | AI2: 0.10589999999999999 | AJ2: =H2+100*O2 -> 281.86000000000001 | AK2: 119 | AL2: 118 | AM2: 36.3 | AN2: 205 | AO2: 4.8000000000000001e-002 | AP2: 87 | AQ2: 亚药转债!
A3: 267 | B3: 113527 | C3: 维格转债! | D3: 603518 | E3: 锦泓集团 | F3: 服装纺织 | G3: 服装行业 | H3: 80.45 | I3: 1.7000000000000001e-003 | J3: -1.1999999999999999e-003 | K3: 5.24 | L3: 7.7000000000000002e-003 | M3: 119.5 | N3: 9.85 | O3: 0.51200000000000001 | P3: 53.2 | Q3: 转股中 | R3: 3.89年 | S3: 1.89年 | T3: 7.46 | U3: 6.5 | V3: 1.1000000000000001e-002 | W3: 0.56399999999999995 | X3: 0.29999999999999999 | Y3: 13 | Z3: 0.84 | AA3: 0.109 | AB3: 9.9199999999999997e-002 | AC3: 0.128 | AD3: 0.124 | AE3: 92.38 | AF3: 97.77 | AG3: 0.07 | AH3: AA | AI3: 5.3899999999999997e-002 | AJ3: =H3+100*O3 -> 131.65000000000001 | AK3: 107.7 | AL3: 22 | AM3: 9.9 | AN3: 6 | AO3: 0.11800000000000001 | AP3: 100 | AQ3: 维格转债!
A4: 122 | B4: 127018 | C4: 本钢转债! | D4: 761 | E4: 本钢板材 | F4: 钢铁 | G4: 炼钢 | H4: 79.585 | I4: -3.9000000000000003e-003 | J4: -1.2999999999999999e-003 | K4: 3.08 | L4: -3.1400000000000004e-002 | M4: 128.6 | N4: 5.03 | O4: 0.29999999999999999 | P4: 61.23 | Q4: 转股中 | R4: 5.32年 | S4: 3.32年 | T4: 68 | U4: 53 | V4: 1.e-002 | W4: 0.56899999999999995 | X4: 0.34899999999999998 | Y4: 119 | Z4: 0.6 | AA4: 9.7899999999999987e-002 | AB4: 8.77e-002 | AC4: 8.8599999999999998e-002 | AD4: 8.4399999999999989e-002 | AE4: 89.99 | AF4: 99.93 | AG4: 0.17 | AH4: AAA | AI4: 5.0199999999999995e-002 | AJ4: =H4+100*O4 -> 109.58499999999999 | AK4: 97.9 | AL4: 5 | AM4: -2 | AN4: 1 | AO4: 3.7999999999999999e-002 | AP4: 51 | AQ4: 本钢转债!
A5: 165 | B5: 128100 | C5: 搜特转债! | D5: 2503 | E5: 搜于特 | F5: 服装纺织 | G5: 服装行业 | H5: 80.4 | I5: 4.5000000000000005e-003 | J5: -4.0000000000000002e-004 | K5: 1.88 | L5: 2.1700000000000001e-002 | M5: 117.3 | N5: 2.9 | O5: 0.23999999999999999 | P5: 64.83 | Q5: 转股中 | R5: 5年6.0天 | S5: 3年7天 | T5: 8 | U5: 34 | V5: 5.2999999999999999e-002 | W5: 0.13800000000000001 | X5: 8.900000000000001e-002 | Y5: 58 | Z5: 1.05 | AA5: 8.0100000000000005e-002 | AB5: 7.3200000000000001e-002 | AC5: 8.4600000000000009e-002 | AD5: 8.1799999999999998e-002 | AE5: 90.32 | AF5: 94.42 | AG5: 0.19 | AH5: AA | AI5: 4.5199999999999997e-002 | AJ5: =H5+100*O5 -> 104.40000000000001 | AK5: 96 | AL5: 3 | AM5: 1.6 | AN5: 2 | AO5: 8.4000000000000005e-002 | AP5: 52 | AQ5: 搜特转债!
A6: 281 | B6: 128044 | C6: 岭南转债! | D6: 2717 | E6: 岭南股份 | F6: 城市公用 | G6: 生态环境 | H6: 86 | I6: 5.9999999999999995e-004 | J6: -5.9999999999999995e-004 | K6: 3.13 | L6: 0. | M6: 111.3 | N6: 5.91 | O6: 0.624 | P6: 52.96 | Q6: 转股中 | R6: 3.44年 | S6: 1.44年 | T6: 6.59 | U6: 7.3 | V6: 1.3000000000000001e-002 | W6: 0.13800000000000001 | X6: 7.2999999999999995e-002 | Y6: 48 | Z6: 0.97 | AA6: 7.9600000000000004e-002 | AB6: 7.2700000000000001e-002 | AC6: 0.11800000000000001 | AD6: 0.114 | AE6: 95.99 | AF6: 96.3 | AG6: 0.04 | AH6: AA | AI6: 4.3899999999999995e-002 | AJ6: =H6+100*O6 -> 148.40000000000001 | AK6: 119 | AL6: 121 | AM6: 22.7 | AN6: 75 | AO6: 5.7000000000000002e-002 | AP6: 39 | AQ6: 岭南转债!
A7: 335 | B7: 127003 | C7: 海印转债! | D7: 861 | E7: 海印股份 | F7: 商业零售 | G7: 商场 | H7: 102.7 | I7: 3.0000000000000001e-003 | J7: -2.3999999999999998e-003 | K7: 2.26 | L7: 1.3500000000000002e-002 | M7: 111.8 | N7: 3 | O7: 0.36299999999999999 | P7: 75.33 | Q7: 转股中 | R7: 1.26年 | S7: 回售内 | T7: 6.74 | U7: 7 | V7: 1.e-002 | W7: 0.128 | X7: 9.6999999999999989e-002 | Y7: 53 | Z7: 1.33 | AA7: 7.0699999999999999e-002 | AB7: 5.2300000000000006e-002 | AC7: 回售内 | AD7: 回售内 | AE7: 100.3 | AF7: 106.2 | AG7: 0.04 | AH7: AA | AI7: 4.2199999999999994e-002 | AJ7: =H7+100*O7 -> 139. | AK7: 130.1 | AL7: 217 | AM7: 23.9 | AN7: 85 | AO7: 3.9e-002 | AP7: 76 | AQ7: 海印转债!
A8: 85 | B8: 110072 | C8: 广汇转债! | D8: 600297 | E8: 广汇汽车 | F8: 汽车 | G8: 分销、售 | H8: 80.41 | I8: 6.8000000000000005e-003 | J8: -1.5e-003 | K8: 2.67 | L8: 2.3e-002 | M8: 114.5 | N8: 4.03 | O8: 0.214 | P8: 66.25 | Q8: 转股中 | R8: 5.45年 | S8: 3.45年 | T8: 33.7 | U8: 48 | V8: 1.8000000000000002e-002 | W8: 0.156 | X8: 0.10300000000000001 | Y8: 217 | Z8: 0.55 | AA8: 6.8099999999999994e-002 | AB8: 6.2800000000000009e-002 | AC8: 7.1199999999999999e-002 | AD8: 6.9400000000000003e-002 | AE8: 88.46 | AF8: 91.24 | AG8: 0.23 | AH8: AA+ | AI8: 4.3200000000000002e-002 | AJ8: =H8+100*O8 -> 101.81 | AK8: 94.6 | AL8: 1 | AM8: 3.3 | AN8: 3 | AO8: 5.7000000000000002e-002 | AP8: 41 | AQ8: 广汇转债!
A9: 124 | B9: 113589 | C9: 天创转债! | D9: 603608 | E9: 天创时尚 | F9: 服装纺织 | G9: 鞋服行业 | H9: 81.99 | I9: 1.23e-002 | J9: -1.1899999999999999e-002 | K9: 5.95 | L9: 8.5000000000000006e-003 | M9: 115.3 | N9: 12.44 | O9: 0.71400000000000008 | P9: 47.83 | Q9: 转股中 | R9: 5.30年 | S9: 3.30年 | T9: 6 | U9: 4.1 | V9: 8.0000000000000002e-003 | W9: 0.23499999999999999 | X9: 0.11199999999999999 | Y9: 26 | Z9: 1.2 | AA9: 6.7900000000000002e-002 | AB9: 6.2100000000000002e-002 | AC9: 7.1199999999999999e-002 | AD9: 6.8699999999999997e-002 | AE9: 89.19 | AF9: 91.66 | AG9: 0.06 | AH9: AA | AI9: 4.5199999999999997e-002 | AJ9: =H9+100*O9 -> 153.38999999999999 | AK9: 116.2 | AL9: 94 | AM9: 24.5 | AN9: 91 | AO9: 7.0999999999999994e-002 | AP9: 22 | AQ9: 天创转债!
A10: 246 | B10: 128063 | C10: 未来转债! | D10: 2631 | E10: 德尔未来 | F10: 其他 | G10: 家居用品 | H10: 99.12 | I10: 6.3e-003 | J10: -2.9999999999999997e-004 | K10: 6.46 | L10: 2.2200000000000001e-002 | M10: 128.2 | N10: 8.63 | O10: 0.32400000000000001 | P10: 74.86 | Q10: 转股中 | R10: 4年28天 | S10: 3年29天 | T10: 6.3 | U10: 2.6 | V10: 4.0000000000000001e-003 | W10: 0.14699999999999999 | X10: 0.11 | Y10: 43 | Z10: 2.45 | AA10: 6.7400000000000002e-002 | AB10: 5.4900000000000004e-002 | AC10: 3.0099999999999998e-002 | AD10: 2.4700000000000003e-002 | AE10: 89.25 | AF10: 100.02 | AG10: 0.27 | AH10: AA- | AI10: 6.4899999999999999e-002 | AJ10: =H10+100*O10 -> 131.52000000000001 | AK10: 123.4 | AL10: 177 | AM10: 23.4 | AN10: 81 | AO10: 9.1999999999999998e-002 | AP10: 34 | AQ10: 未来转债!
A11: 111 | B11: 127019 | C11: 国城转债! | D11: 688 | E11: 国城矿业 | F11: 有色金属 | G11: 锌铅镍锡 | H11: 81.81 | I11: 1.24e-002 | J11: -1.1399999999999999e-002 | K11: 9.6 | L11: 2.1299999999999999e-002 | M11: 115.1 | N11: 21.07 | O11: 0.79599999999999993 | P11: 45.56 | Q11: 转股中 | R11: 5.36年 | S11: 3.36年 | T11: 8.5 | U11: 15 | V11: 2.2000000000000002e-002 | W11: 7.8e-002 | X11: 3.5000000000000003e-002 | Y11: 109 | Z11: 4.94 | AA11: 6.7099999999999993e-002 | AB11: 6.1500000000000006e-002 | AC11: 6.9900000000000004e-002 | AD11: 6.7599999999999993e-002 | AE11: 88.77 | AF11: 91.23 | AG11: 0.05 | AH11: AA | AI11: 4.5199999999999997e-002 | AJ11: =H11+100*O11 -> 161.41 | AK11: 118.1 | AL11: 105 | AM11: 26.8 | AN11: 113 | AO11: 7.9000000000000001e-002 | AP11: 36 | AQ11: 国城转债!
A12: 288 | B12: 123011 | C12: 德尔转债! | D12: 300473 | E12: 德尔股份 | F12: 汽车 | G12: 零部件制 | H12: 94 | I12: 2.2000000000000001e-003 | J12: 2.0999999999999999e-003 | K12: 20.49 | L12: 3.7499999999999999e-002 | M12: 116.3 | N12: 34.54 | O12: 0.58499999999999996 | P12: 59.32 | Q12: 转股中 | R12: 3.37年 | S12: 1.37年 | T12: 2.51 | U12: 1.4 | V12: 6.0000000000000001e-003 | W12: 0.10800000000000001 | X12: 6.4000000000000001e-002 | Y12: 23 | Z12: 1.04 | AA12: 6.6699999999999995e-002 | AB12: 5.7300000000000004e-002 | AC12: 6.0499999999999998e-002 | AD12: 5.6600000000000004e-002 | AE12: 93.42 | AF12: 94.52 | AG12: 0.11 | AH12: AA- | AI12: 6.4899999999999999e-002 | AJ12: =H12+100*O12 -> 152.5 | AK12: 128.7 | AL12: 209 | AM12: 34.2 | AN12: 184 | AO12: 0.16 | AP12: 42 | AQ12: 德尔转债!
A13: 232 | B13: 123028 | C13: 清水转债! | D13: 300437 | E13: 清水源 | F13: 城市公用 | G13: 三废处理 | H13: 93.32 | I13: 1.7000000000000001e-003 | J13: 1.9e-003 | K13: 8.52 | L13: 1.1899999999999999e-002 | M13: 121.8 | N13: 11.84 | O13: 0.29699999999999999 | P13: 71.96 | Q13: 转股中 | R13: 4.29年 | S13: 2.29年 | T13: 4.56 | U13: 3.5 | V13: 8.0000000000000002e-003 | W13: 0.24199999999999999 | X13: 0.17399999999999999 | Y13: 19 | Z13: 1.21 | AA13: 6.6100000000000006e-002 | AB13: 5.6399999999999999e-002 | AC13: 4.8799999999999996e-002 | AD13: 4.4699999999999997e-002 | AE13: 89.94 | AF13: 93.74 | AG13: 0.3 | AH13: AA- | AI13: 6.4899999999999999e-002 | AJ13: =H13+100*O13 -> 123.02 | AK13: 114.7 | AL13: 79 | AM13: 20.9 | AN13: 54 | AO13: 0.11699999999999999 | AP13: 53 | AQ13: 清水转债!
A14: 170 | B14: 113569 | C14: 科达转债! | D14: 603660 | E14: 苏州科达 | F14: 通信互联 | G14: 物联网 | H14: 88.5 | I14: 1.2500000000000001e-002 | J14: -1.04e-002 | K14: 7.23 | L14: 2.2599999999999999e-002 | M14: 120.7 | N14: 14.84 | O14: 0.81700000000000006 | P14: 48.72 | Q14: 转股中 | R14: 5年3.0天 | S14: 3年4.0天 | T14: 5.16 | U14: 6.3 | V14: 1.3999999999999999e-002 | W14: 0.14300000000000002 | X14: 7.0000000000000007e-002 | Y14: 36 | Z14: 2.11 | AA14: 6.5500000000000003e-002 | AB14: 5.7699999999999994e-002 | AC14: 5.2900000000000003e-002 | AD14: 5.0199999999999995e-002 | AE14: 85.1 | AF14: 88.22 | AG14: 0.09 | AH14: AA- | AI14: 6.6199999999999995e-002 | AJ14: =H14+100*O14 -> 170.19999999999999 | AK14: 128.3 | AL14: 207 | AM14: 40.1 | AN14: 230 | AO14: 6.3e-002 | AP14: 26 | AQ14: 科达转债!
A15: 251 | B15: 113530 | C15: 大丰转债! | D15: 603081 | E15: 大丰实业 | F15: 建筑 | G15: 装饰工程 | H15: 94.94 | I15: 1.4000000000000002e-003 | J15: 1.1000000000000001e-003 | K15: 11.24 | L15: 1.9e-002 | M15: 121.6 | N15: 16.64 | O15: 0.40600000000000003 | P15: 67.55 | Q15: 转股中 | R15: 4年21天 | S15: 2年22天 | T15: 6.3 | U15: 1.9 | V15: 3.0000000000000001e-003 | W15: 0.13900000000000001 | X15: 9.4e-002 | Y15: 45 | Z15: 2.2 | AA15: 6.4399999999999999e-002 | AB15: 5.45e-002 | AC15: 4.0099999999999997e-002 | AD15: 3.6799999999999999e-002 | AE15: 94.18 | AF15: 102.55 | AG15: 0.13 | AH15: AA | AI15: 4.3899999999999995e-002 | AJ15: =H15+100*O15 -> 135.53999999999999 | AK15: 122.3 | AL15: 164 | AM15: 19.8 | AN15: 46 | AO15: 3.4000000000000002e-002 | AP15: 34 | AQ15: 大丰转债!
A16: 104 | B16: 113595 | C16: 花王转债! | D16: 603007 | E16: 花王股份 | F16: 城市公用 | G16: 生态环境 | H16: 90.76 | I16: 2.3999999999999998e-003 | J16: -1.5100000000000001e-002 | K16: 5.24 | L16: -3.1400000000000004e-002 | M16: 125.3 | N16: 6.93 | O16: 0.20000000000000001 | P16: 75.61 | Q16: 转股中 | R16: 5.38年 | S16: 3.38年 | T16: 3.3 | U16: 4.2 | V16: 1.3999999999999999e-002 | W16: 0.188 | X16: 0.14199999999999999 | Y16: 18 | Z16: 1.58 | AA16: 6.3299999999999995e-002 | AB16: 5.4800000000000001e-002 | AC16: 4.0300000000000002e-002 | AD16: 3.78e-002 | AE16: 83.28 | AF16: 89.48 | AG16: 0.4 | AH16: AA- | AI16: 6.6199999999999995e-002 | AJ16: =H16+100*O16 -> 110.76000000000001 | AK16: 105.9 | AL16: 16 | AM16: 16.4 | AN16: 22 | AO16: 2.8999999999999998e-002 | AP16: 37 | AQ16: 花王转债!
A17: 197 | B17: 128085 | C17: 鸿达转债! | D17: 2002 | E17: 鸿达兴业 | F17: 化工 | G17: 化工 | H17: 93.749 | I17: -6.7000000000000002e-003 | J17: -1.7000000000000001e-003 | K17: 3.61 | L17: -1.1000000000000001e-002 | M17: 124.4 | N17: 3.92 | O17: 1.8000000000000002e-002 | P17: 92.09 | Q17: 转股中 | R17: 4.78年 | S17: 2.78年 | T17: 14.3 | U17: 155 | V17: 0.11599999999999999 | W17: 0.14400000000000002 | X17: 0.13300000000000001 | Y17: 99 | Z17: 1.31 | AA17: 6.2300000000000001e-002 | AB17: 5.3099999999999994e-002 | AC17: 3.5799999999999998e-002 | AD17: 3.3099999999999997e-002 | AE17: 73.48 | AF17: 71.48 | AG17: 0.76 | AH17: BB | AI17: 0.12590000000000001 | AJ17: =H17+100*O17 -> 95.548999999999992 | AK17: 95.4 | AL17: 2 | AM17: 21.9 | AN17: 66 | AO17: 5.4000000000000006e-002 | AP17: 98 | AQ17: 鸿达转债!
A18: 237 | B18: 113535 | C18: 大业转债! | D18: 603278 | E18: 大业股份 | F18: 汽车 | G18: 零部件制 | H18: 93.65 | I18: 3.4000000000000002e-003 | J18: -2.2000000000000001e-003 | K18: 8.06 | L18: 1.1299999999999999e-002 | M18: 113.1 | N18: 12.4 | O18: 0.441 | P18: 65 | Q18: 转股中 | R18: 3.18年 | S18: 1.18年 | T18: 5 | U18: 1 | V18: 2.e-003 | W18: 0.214 | X18: 0.13900000000000001 | Y18: 23 | Z18: 1.43 | AA18: 6.2199999999999998e-002 | AB18: 5.4100000000000002e-002 | AC18: 6.480000000000001e-002 | AD18: 6.1900000000000004e-002 | AE18: 96.17 | AF18: 98.87 | AG18: 0.11 | AH18: AA | AI18: 4.3899999999999995e-002 | AJ18: =H18+100*O18 -> 137.75 | AK18: 122.3 | AL18: 163 | AM18: 23.4 | AN18: 82 | AO18: 6.0999999999999999e-002 | AP18: 50 | AQ18: 大业转债!
A19: 299 | B19: 128037 | C19: 岩土转债! | D19: 2542 | E19: 中化岩土 | F19: 建筑 | G19: 建筑工程 | H19: 94.191 | I19: 4.8999999999999998e-003 | J19: -4.7999999999999996e-003 | K19: 2.86 | L19: 2.8799999999999999e-002 | M19: 112.3 | N19: 7.99 | O19: 1.6299999999999999 | P19: 35.79 | Q19: 转股中 | R19: 3年9天 | S19: 1年10天 | T19: 5.99 | U19: 1.8 | V19: 3.0000000000000001e-003 | W19: 0.11599999999999999 | X19: 4.2000000000000003e-002 | Y19: 52 | Z19: 1.27 | AA19: 6.13e-002 | AB19: 5.3200000000000004e-002 | AC19: 7.6999999999999999e-002 | AD19: 7.1800000000000003e-002 | AE19: 97.72 | AF19: 98.91 | AG19: 0 | AH19: AA | AI19: 4.3899999999999995e-002 | AJ19: =H19+100*O19 -> 257.19100000000003 | AK19: 152.6 | AL19: 293 | AM19: 53.7 | AN19: 280 | AO19: 7.0000000000000007e-002 | AP19: 49 | AQ19: 岩土转债!
A20: 96 | B20: 113596 | C20: 城地转债! | D20: 603887 | E20: 城地香江 | F20: 通信互联 | G20: 通信设备 | H20: 83.01 | I20: 4.5000000000000005e-003 | J20: -4.6999999999999993e-003 | K20: 15.97 | L20: -1.2999999999999999e-003 | M20: 113.5 | N20: 29.21 | O20: 0.51800000000000002 | P20: 54.67 | Q20: 转股中 | R20: 5.39年 | S20: 3.40年 | T20: 12 | U20: 17 | V20: 1.7000000000000001e-002 | W20: 0.20000000000000001 | X20: 0.109 | Y20: 60 | Z20: 1.66 | AA20: 6.1100000000000002e-002 | AB20: 5.5999999999999994e-002 | AC20: 6.5599999999999992e-002 | AD20: 6.3200000000000006e-002 | AE20: 82.83 | AF20: 80.93 | AG20: 0.16 | AH20: AA- | AI20: 6.6199999999999995e-002 | AJ20: =H20+100*O20 -> 134.81 | AK20: 111.3 | AL20: 45 | AM20: 28.5 | AN20: 133 | AO20: 4.9000000000000002e-002 | AP20: 16 | AQ20: 城地转债!
A21: 318 | B21: 128023 | C21: 亚太转债! | D21: 2284 | E21: 亚太股份 | F21: 汽车 | G21: 零部件制 | H21: 94.929 | I21: 1.6000000000000001e-003 | J21: -1.2999999999999999e-003 | K21: 5.33 | L21: 1.52e-002 | M21: 111.3 | N21: 10.34 | O21: 0.84200000000000008 | P21: 51.55 | Q21: 转股中 | R21: 2.75年 | S21: 0.75年 | T21: 9.99 | U21: 3.2 | V21: 3.0000000000000001e-003 | W21: 0.254 | X21: 0.13100000000000001 | Y21: 39 | Z21: 1.62 | AA21: 6.0599999999999994e-002 | AB21: 5.2400000000000002e-002 | AC21: 7.9399999999999998e-002 | AD21: 7.5199999999999989e-002 | AE21: 98.02 | AF21: 99.52 | AG21: 0.02 | AH21: AA | AI21: 4.2199999999999994e-002 | AJ21: =H21+100*O21 -> 179.12900000000002 | AK21: 138.3 | AL21: 263 | AM21: 38.8 | AN21: 221 | AO21: 2.2000000000000002e-002 | AP21: 69 | AQ21: 亚太转债!
A22: 263 | B22: 113528 | C22: 长城转债! | D22: 603897 | E22: 长城科技 | F22: 机械装备 | G22: 专用设备 | H22: 93.73 | I22: 5.1000000000000004e-003 | J22: -3.4000000000000002e-003 | K22: 16.83 | L22: 6.0000000000000001e-003 | M22: 116.8 | N22: 23.45 | O22: 0.30599999999999999 | P22: 71.77 | Q22: 转股中 | R22: 3.99年 | S22: 1.99年 | T22: 6.34 | U22: 2 | V22: 3.0000000000000001e-003 | W22: 0.21100000000000002 | X22: 0.152 | Y22: 30 | Z22: 1.64 | AA22: 5.79e-002 | AB22: 4.9800000000000004e-002 | AC22: 4.5700000000000005e-002 | AD22: 4.2699999999999995e-002 | AE22: 90.15 | AF22: 91.35 | AG22: 0.29 | AH22: AA- | AI22: 6.4899999999999999e-002 | AJ22: =H22+100*O22 -> 124.33 | AK22: 115.7 | AL22: 88 | AM22: 24.3 | AN22: 88 | AO22: 2.4e-002 | AP22: 43 | AQ22: 长城转债!
A23: 86 | B23: 113600 | C23: 新星转债! | D23: 603978 | E23: 深圳新星 | F23: 有色金属 | G23: 有色行业 | H23: 93.77 | I23: 1.29e-002 | J23: 5.9999999999999995e-004 | K23: 19.21 | L23: 2.9500000000000002e-002 | M23: 126 | N23: 23.85 | O23: 0.16399999999999998 | P23: 80.55 | Q23: 转股中 | R23: 5.44年 | S23: 3.44年 | T23: 5.95 | U23: 12 | V23: 2.1000000000000001e-002 | W23: 0.19399999999999998 | X23: 0.156 | Y23: 31 | Z23: 2.02 | AA23: 5.7000000000000002e-002 | AB23: 4.8499999999999995e-002 | AC23: 2.92e-002 | AD23: 2.7000000000000003e-002 | AE23: 82.67 | AF23: 89.54 | AG23: 0.46 | AH23: AA- | AI23: 6.6199999999999995e-002 | AJ23: =H23+100*O23 -> 110.16999999999999 | AK23: 107 | AL23: 21 | AM23: 17.5 | AN23: 31 | AO23: 0.122 | AP23: 17 | AQ23: 新星转债!
A24: 329 | B24: 128015 | C24: 久其转债! | D24: 2279 | E24: 久其软件 | F24: 计算机及 | G24: 软件开发 | H24: 97.99 | I24: 5.0000000000000001e-003 | J24: -4.8999999999999998e-003 | K24: 4.78 | L24: 3.6900000000000002e-002 | M24: 110.8 | N24: 9.48 | O24: 0.94299999999999995 | P24: 50.42 | Q24: 转股中 | R24: 2.26年 | S24: 0.26年 | T24: 7.8 | U24: 9.5 | V24: 1.3000000000000001e-002 | W24: 0.22899999999999998 | X24: 0.11599999999999999 | Y24: 34 | Z24: 4.82 | AA24: 5.6900000000000006e-002 | AB24: 4.7400000000000005e-002 | AC24: 8.7599999999999997e-002 | AD24: 7.980000000000001e-002 | AE24: 98.51 | AF24: 94.51 | AG24: 0 | AH24: A+ | AI24: 7.4200000000000002e-002 | AJ24: =H24+100*O24 -> 192.28999999999999 | AK24: 145.6 | AL24: 275 | AM24: 47 | AN24: 260 | AO24: 8.8000000000000009e-002 | AP24: 67 | AQ24: 久其转债!
A25: 309 | B25: 113017 | C25: 吉视转债! | D25: 601929 | E25: 吉视传媒 | F25: 传媒娱乐 | G25: 影视娱乐 | H25: 93.35 | I25: 4.6999999999999993e-003 | J25: -4.0999999999999995e-003 | K25: 1.87 | L25: 1.0800000000000001e-002 | M25: 108.8 | N25: 2.95 | O25: 0.47299999999999998 | P25: 63.39 | Q25: 转股中 | R25: 2.81年 | S25: 0.81年 | T25: 15.6 | U25: 11 | V25: 6.9999999999999993e-003 | W25: 0.26800000000000002 | X25: 0.17000000000000001 | Y25: 58 | Z25: 0.88 | AA25: 5.6799999999999996e-002 | AB25: 5.04e-002 | AC25: 8.9900000000000008e-002 | AD25: 8.6400000000000005e-002 | AE25: 97.71 | AF25: 97.53 | AG25: 0.06 | AH25: AA+ | AI25: 4.0199999999999993e-002 | AJ25: =H25+100*O25 -> 140.64999999999998 | AK25: 123.3 | AL25: 176 | AM25: 25.6 | AN25: 102 | AO25: 6.8000000000000005e-002 | AP25: 61 | AQ25: 吉视转债!
A26: 231 | B26: 128069 | C26: 华森转债! | D26: 2907 | E26: 华森制药 | F26: 医药 | G26: 化学制药 | H26: 95.381 | I26: 2.8000000000000004e-003 | J26: -1.7000000000000001e-003 | K26: 11.34 | L26: 6.1999999999999998e-003 | M26: 120 | N26: 18.04 | O26: 0.51700000000000002 | P26: 62.86 | Q26: 转股中 | R26: 4.30年 | S26: 2.30年 | T26: 3 | U26: 0.8 | V26: 3.0000000000000001e-003 | W26: 6.6000000000000003e-002 | X26: 4.0999999999999995e-002 | Y26: 46 | Z26: 4.24 | AA26: 5.6100000000000004e-002 | AB26: 4.7400000000000005e-002 | AC26: 3.4000000000000002e-002 | AD26: 3.1099999999999999e-002 | AE26: 88.77 | AF26: 92.1 | AG26: 0.19 | AH26: AA- | AI26: 6.4899999999999999e-002 | AJ26: =H26+100*O26 -> 147.08100000000002 | AK26: 127.9 | AL26: 204 | AM26: 35.8 | AN26: 201 | AO26: 6.9999999999999993e-003 | AP26: 45 | AQ26: 华森转债!
A27: 222 | B27: 128073 | C27: 哈尔转债! | D27: 2615 | E27: 哈尔斯 | F27: 其他 | G27: 家居用品 | H27: 95.7 | I27: 7.8000000000000005e-003 | J27: -3.9000000000000003e-003 | K27: 4.16 | L27: 1.46e-002 | M27: 115.3 | N27: 5.7 | O27: 0.311 | P27: 72.98 | Q27: 转股中 | R27: 3.46年 | S27: 1.47年 | T27: 2.99 | U27: 11 | V27: 3.9e-002 | W27: 0.17399999999999999 | X27: 0.127 | Y27: 17 | Z27: 2.14 | AA27: 5.6100000000000004e-002 | AB27: 4.7699999999999992e-002 | AC27: 4.0399999999999998e-002 | AD27: 3.78e-002 | AE27: 92.16 | AF27: 93.04 | AG27: 0.27 | AH27: AA- | AI27: 6.4899999999999999e-002 | AJ27: =H27+100*O27 -> 126.80000000000001 | AK27: 118.4 | AL27: 111 | AM27: 25.4 | AN27: 98 | AO27: 6.6000000000000003e-002 | AP27: 41 | AQ27: 哈尔转债!
A28: 219 | B28: 128074 | C28: 游族转债!! | D28: 2174 | E28: 游族网络 | F28: 通信互联 | G28: 互联网 | H28: 94 | I28: 7.4999999999999997e-003 | J28: -2.2000000000000001e-003 | K28: 11.21 | L28: 3.0299999999999997e-002 | M28: 119.9 | N28: 16.97 | O28: 0.42299999999999999 | P28: 66.06 | Q28: 转股中 | R28: 4.55年 | S28: 2.55年 | T28: 6.83 | U28: 36 | V28: 5.5e-002 | W28: 6.7000000000000004e-002 | X28: 4.4000000000000004e-002 | Y28: 103 | Z28: 1.81 | AA28: 5.6100000000000004e-002 | AB28: 4.7899999999999998e-002 | AC28: 3.6000000000000004e-002 | AD28: 3.3399999999999999e-002 | AE28: 92.1 | AF28: 94.98 | AG28: 0.17 | AH28: AA | AI28: 4.3899999999999995e-002 | AJ28: =H28+100*O28 -> 136.30000000000001 | AK28: 121.9 | AL28: 157 | AM28: 27 | AN28: 114 | AO28: 4.0000000000000001e-002 | AP28: 26 | AQ28: 游族转债!!
A29: 171 | B29: 113568 | C29: 新春转债! | D29: 603667 | E29: 五洲新春 | F29: 机械装备 | G29: 通用设备 | H29: 95.79 | I29: 1.09e-002 | J29: -6.0000000000000001e-003 | K29: 7.25 | L29: 1.1200000000000002e-002 | M29: 124.8 | N29: 8.91 | O29: 0.17699999999999999 | P29: 81.37 | Q29: 转股中 | R29: 5年0.0天 | S29: 3年1.0天 | T29: 3.3 | U29: 1.9 | V29: 6.0000000000000001e-003 | W29: 0.156 | X29: 0.127 | Y29: 21 | Z29: 1.23 | AA29: 5.5800000000000002e-002 | AB29: 4.6799999999999994e-002 | AC29: 2.8999999999999998e-002 | AD29: 2.5899999999999999e-002 | AE29: 85.74 | AF29: 91.35 | AG29: 0.44 | AH29: AA- | AI29: 6.6199999999999995e-002 | AJ29: =H29+100*O29 -> 113.49000000000001 | AK29: 110.2 | AL29: 32 | AM29: 18.9 | AN29: 40 | AO29: 4.2999999999999997e-002 | AP29: 50 | AQ29: 新春转债!
A30: 93 | B30: 113597 | C30: 佳力转债! | D30: 603912 | E30: 佳力图 | F30: 机械装备 | G30: 专用设备 | H30: 93.46 | I30: 6.1999999999999998e-003 | J30: -5.6000000000000008e-003 | K30: 12.69 | L30: 4.0000000000000001e-003 | M30: 124.5 | N30: 23.4 | O30: 0.72299999999999998 | P30: 54.23 | Q30: 转股中 | R30: 5.40年 | S30: 3.40年 | T30: 3 | U30: 4.3 | V30: 1.4999999999999999e-002 | W30: 0.109 | X30: 5.9000000000000004e-002 | Y30: 28 | Z30: 3.17 | AA30: 5.5800000000000002e-002 | AB30: 4.7599999999999996e-002 | AC30: 3.2000000000000001e-002 | AD30: 2.9399999999999999e-002 | AE30: 83.3 | AF30: 88.78 | AG30: 0.16 | AH30: AA- | AI30: 6.6199999999999995e-002 | AJ30: =H30+100*O30 -> 165.75999999999999 | AK30: 132.7 | AL30: 234 | AM30: 43.9 | AN30: 250 | AO30: 8.0000000000000002e-003 | AP30: 11 | AQ30: 佳力转债!
A31: 240 | B31: 127013 | C31: 创维转债! | D31: 810 | E31: 创维数字 | F31: 电子 | G31: 电子产品 | H31: 95.2 | I31: 2.9999999999999997e-004 | J31: 1.9e-003 | K31: 7.78 | L31: 1.43e-002 | M31: 117.9 | N31: 11.39 | O31: 0.39399999999999996 | P31: 68.31 | Q31: 转股中 | R31: 4年40天 | S31: 2年41天 | T31: 9.78 | U31: 7.3 | V31: 8.0000000000000002e-003 | W31: 0.11800000000000001 | X31: 8.1000000000000003e-002 | Y31: 83 | Z31: 2.13 | AA31: 5.4600000000000003e-002 | AB31: 4.6399999999999997e-002 | AC31: 3.7400000000000003e-002 | AD31: 3.4300000000000004e-002 | AE31: 93.87 | AF31: 99.19 | AG31: 0.15 | AH31: AA | AI31: 4.3899999999999995e-002 | AJ31: =H31+100*O31 -> 134.59999999999999 | AK31: 122.1 | AL31: 159 | AM31: 22.9 | AN31: 76 | AO31: 6.7000000000000004e-002 | AP31: 24 | AQ31: 创维转债!
A32: 20 | B32: 123088 | C32: 威唐转债! | D32: 300707 | E32: 威唐工业 | F32: 汽车 | G32: 零部件制 | H32: 90.105 | I32: 5.8999999999999999e-003 | J32: 6.0000000000000001e-003 | K32: 14.53 | L32: 2.6099999999999998e-002 | M32: 121.6 | N32: 20.75 | O32: 0.28699999999999998 | P32: 70.02 | Q32: 3月18天 | R32: 5.78年 | S32: 3.78年 | T32: 3.01 | U32: 4.8 | V32: 1.8000000000000002e-002 | W32: 0.13200000000000001 | X32: 9.1999999999999998e-002 | Y32: 23 | Z32: 3.36 | AA32: 5.45e-002 | AB32: 4.7599999999999996e-002 | AC32: 3.9e-002 | AD32: 3.6499999999999998e-002 | AE32: 78.27 | AF32: 79.92 | AG32: 0.45 | AH32: A+ | AI32: 7.7199999999999991e-002 | AJ32: =H32+100*O32 -> 118.80500000000001 | AK32: 110.2 | AL32: 31 | AM32: 30.3 | AN32: 156 | AO32: 8.4000000000000005e-002 | AP32: 7 | AQ32: 威唐转债!
A33: 117 | B33: 128118 | C33: 瀛通转债! | D33: 2861 | E33: 瀛通通讯 | F33: 电子 | G33: 电子产品 | H33: 92.793 | I33: 1.e-004 | J33: 2.5999999999999999e-003 | K33: 17.53 | L33: 9.7999999999999997e-003 | M33: 122.1 | N33: 27.53 | O33: 0.45700000000000002 | P33: 63.68 | Q33: 转股中 | R33: 5.32年 | S33: 3.33年 | T33: 3 | U33: 1.7 | V33: 6.0000000000000001e-003 | W33: 0.14000000000000001 | X33: 8.900000000000001e-002 | Y33: 21 | Z33: 2.01 | AA33: 5.4299999999999994e-002 | AB33: 4.6600000000000003e-002 | AC33: 3.5299999999999998e-002 | AD33: 3.2599999999999997e-002 | AE33: 83.86 | AF33: 87.54 | AG33: 0.28 | AH33: AA- | AI33: 6.6199999999999995e-002 | AJ33: =H33+100*O33 -> 138.49299999999999 | AK33: 121.9 | AL33: 156 | AM33: 34.4 | AN33: 185 | AO33: 2.7000000000000003e-002 | AP33: 12 | AQ33: 瀛通转债!
A34: 130 | B34: 123054 | C34: 思特转债! | D34: 300608 | E34: 思特奇 | F34: 通信互联 | G34: 通信设备 | H34: 92.878 | I34: 9.1999999999999998e-003 | J34: -1.2999999999999999e-003 | K34: 11.74 | L34: 2.18e-002 | M34: 121.7 | N34: 16.49 | O34: 0.30499999999999999 | P34: 71.19 | Q34: 转股中 | R34: 5.26年 | S34: 3.27年 | T34: 2.71 | U34: 1.6 | V34: 6.0000000000000001e-003 | W34: 0.14599999999999999 | X34: 0.10400000000000001 | Y34: 19 | Z34: 2.44 | AA34: 5.4100000000000002e-002 | AB34: 4.6399999999999997e-002 | AC34: 3.5799999999999998e-002 | AD34: 3.3000000000000002e-002 | AE34: 84.21 | AF34: 87.59 | AG34: 0.37 | AH34: AA- | AI34: 6.6199999999999995e-002 | AJ34: =H34+100*O34 -> 123.378 | AK34: 114.6 | AL34: 78 | AM34: 27 | AN34: 115 | AO34: 5.9999999999999998e-002 | AP34: 20 | AQ34: 思特转债!
A35: 196 | B35: 128087 | C35: 孚日转债! | D35: 2083 | E35: 孚日股份 | F35: 服装纺织 | G35: 家纺 | H35: 88.302 | I35: 2.0799999999999999e-002 | J35: -1.8799999999999997e-002 | K35: 4.25 | L35: 9.4999999999999998e-003 | M35: 112.9 | N35: 6.3 | O35: 0.309 | P35: 67.46 | Q35: 转股中 | R35: 4.78年 | S35: 2.79年 | T35: 6.5 | U35: 13 | V35: 2.4e-002 | W35: 0.16800000000000001 | X35: 0.114 | Y35: 39 | Z35: 1.03 | AA35: 5.3800000000000001e-002 | AB35: 4.8399999999999999e-002 | AC35: 5.5399999999999998e-002 | AD35: 5.2999999999999999e-002 | AE35: 91.19 | AF35: 92.29 | AG35: 0.21 | AH35: AA | AI35: 4.3899999999999995e-002 | AJ35: =H35+100*O35 -> 119.202 | AK35: 109.1 | AL35: 27 | AM35: 16.9 | AN35: 26 | AO35: 3.5000000000000003e-002 | AP35: 55 | AQ35: 孚日转债!
A36: 238 | B36: 128066 | C36: 亚泰转债! | D36: 2811 | E36: 郑中设计 | F36: 建筑 | G36: 装饰工程 | H36: 95.43 | I36: 8.6999999999999994e-003 | J36: 1.6000000000000001e-003 | K36: 8.3 | L36: 2.2200000000000001e-002 | M36: 117.5 | N36: 9.67 | O36: 0.11199999999999999 | P36: 85.83 | Q36: 转股中 | R36: 4年42天 | S36: 2年43天 | T36: 4.8 | U36: 16 | V36: 3.4000000000000002e-002 | W36: 0.214 | X36: 0.184 | Y36: 22 | Z36: 1.52 | AA36: 5.3200000000000004e-002 | AB36: 4.5100000000000001e-002 | AC36: 3.8199999999999998e-002 | AD36: 3.4700000000000002e-002 | AE36: 90.13 | AF36: 91.32 | AG36: 0.46 | AH36: AA- | AI36: 6.4899999999999999e-002 | AJ36: =H36+100*O36 -> 106.63000000000001 | AK36: 105 | AL36: 13 | AM36: 13.7 | AN36: 13 | AO36: 7.400000000000001e-002 | AP36: 62 | AQ36: 亚泰转债!
A37: 144 | B37: 113573 | C37: 纵横转债! | D37: 603602 | E37: 纵横通信 | F37: 通信互联 | G37: 通信设备 | H37: 96.27 | I37: 3.3e-003 | J37: -2.9999999999999997e-004 | K37: 10.88 | L37: 1.3999999999999999e-002 | M37: 124.7 | N37: 18.81 | O37: 0.66400000000000003 | P37: 57.84 | Q37: 转股中 | R37: 5年42天 | S37: 3年43天 | T37: 2.7 | U37: 2.8 | V37: 1.1000000000000001e-002 | W37: 0.122 | X37: 7.0000000000000007e-002 | Y37: 22 | Z37: 3.29 | AA37: 5.3200000000000004e-002 | AB37: 4.4500000000000005e-002 | AC37: 2.6000000000000002e-002 | AD37: 2.3099999999999999e-002 | AE37: 82.24 | AF37: 86.08 | AG37: 0.21 | AH37: A+ | AI37: 7.7199999999999991e-002 | AJ37: =H37+100*O37 -> 162.67000000000002 | AK37: 134.7 | AL37: 247 | AM37: 48.6 | AN37: 264 | AO37: 3.4000000000000002e-002 | AP37: 22 | AQ37: 纵横转债!
A38: 239 | B38: 110058 | C38: 永鼎转债! | D38: 600105 | E38: 永鼎股份 | F38: 通信互联 | G38: 通信设备 | H38: 93.41 | I38: 8.0000000000000002e-003 | J38: -3.4999999999999996e-003 | K38: 3.47 | L38: 2.3599999999999999e-002 | M38: 114.9 | N38: 5.04 | O38: 0.35700000000000004 | P38: 68.85 | Q38: 转股中 | R38: 4年41天 | S38: 2年42天 | T38: 2.61 | U38: 43 | V38: 0.17300000000000001 | W38: 5.4000000000000006e-002 | X38: 3.7999999999999999e-002 | Y38: 48 | Z38: 1.7 | AA38: 5.2900000000000003e-002 | AB38: 4.58e-002 | AC38: 4.6100000000000002e-002 | AD38: 4.2900000000000001e-002 | AE38: 93.85 | AF38: 96.67 | AG38: 0.19 | AH38: AA | AI38: 4.3899999999999995e-002 | AJ38: =H38+100*O38 -> 129.11000000000001 | AK38: 118 | AL38: 104 | AM38: 21.3 | AN38: 59 | AO38: 0.126 | AP38: 51 | AQ38: 永鼎转债!
A39: 175 | B39: 113566 | C39: 翔港转债! | D39: 603499 | E39: 翔港科技 | F39: 造纸包装 | G39: 包装材料 | H39: 96.46 | I39: 7.4000000000000003e-003 | J39: -4.0000000000000002e-004 | K39: 7.93 | L39: 1.67e-002 | M39: 124 | N39: 10.77 | O39: 0.31 | P39: 73.63 | Q39: 转股中 | R39: 4.98年 | S39: 2.99年 | T39: 1.61 | U39: 5.9 | V39: 3.7999999999999999e-002 | W39: 0.10000000000000001 | X39: 7.400000000000001e-002 | Y39: 16 | Z39: 2.79 | AA39: 5.28e-002 | AB39: 4.4199999999999996e-002 | AC39: 2.4900000000000002e-002 | AD39: 2.23e-002 | AE39: 82.92 | AF39: 86.81 | AG39: 0.42 | AH39: A+ | AI39: 7.5899999999999995e-002 | AJ39: =H39+100*O39 -> 127.45999999999999 | AK39: 119.3 | AL39: 127 | AM39: 32.5 | AN39: 173 | AO39: 5.9000000000000004e-002 | AP39: 28 | AQ39: 翔港转债!
A40: 254 | B40: 123023 | C40: 迪森转债! | D40: 300335 | E40: 迪森股份 | F40: 能源电力 | G40: 电力供应 | H40: 94.06 | I40: 9.1999999999999998e-003 | J40: 1.e-004 | K40: 5.14 | L40: 3.8399999999999997e-002 | M40: 114.9 | N40: 7.04 | O40: 0.28800000000000003 | P40: 73.01 | Q40: 转股中 | R40: 4年14天 | S40: 3年15天 | T40: 5.29 | U40: 68 | V40: 0.13500000000000001 | W40: 0.27600000000000002 | X40: 0.20100000000000001 | Y40: 19 | Z40: 1.38 | AA40: 5.2000000000000005e-002 | AB40: 4.4800000000000006e-002 | AC40: 3.6299999999999999e-002 | AD40: 3.2899999999999999e-002 | AE40: 91.92 | AF40: 96.98 | AG40: 0.24 | AH40: AA | AI40: 4.3899999999999995e-002 | AJ40: =H40+100*O40 -> 122.86000000000001 | AK40: 115.1 | AL40: 81 | AM40: 18.1 | AN40: 35 | AO40: 0.14300000000000002 | AP40: 54 | AQ40: 迪森转债!
A41: 40 | B41: 123077 | C41: 汉得转债! | D41: 300170 | E41: 汉得信息 | F41: 计算机及 | G41: 软件开发 | H41: 94.484 | I41: 7.3000000000000001e-003 | J41: -4.3e-003 | K41: 7.53 | L41: 9.3999999999999986e-003 | M41: 125.5 | N41: 9.72 | O41: 0.22 | P41: 77.47 | Q41: 2月23天 | R41: 5.72年 | S41: 3.72年 | T41: 9.37 | U41: 4.8 | V41: 5.0000000000000001e-003 | W41: 0.14099999999999999 | X41: 0.109 | Y41: 67 | Z41: 2.09 | AA41: 5.1900000000000002e-002 | AB41: 4.4000000000000004e-002 | AC41: 2.4799999999999999e-002 | AD41: 2.2799999999999997e-002 | AE41: 87.59 | AF41: 97.91 | AG41: 0.31 | AH41: AA | AI41: 4.5199999999999997e-002 | AJ41: =H41+100*O41 -> 116.48399999999999 | AK41: 111.5 | AL41: 46 | AM41: 13.6 | AN41: 12 | AO41: 6.6000000000000003e-002 | AP41: 11 | AQ41: 汉得转债!
A42: 316 | B42: 128026 | C42: 众兴转债! | D42: 2772 | E42: 众兴菌业 | F42: 农业 | G42: 种植业 | H42: 95.224 | I42: 4.7999999999999996e-003 | J42: -2.8000000000000004e-003 | K42: 8.8 | L42: 9.1999999999999998e-003 | M42: 109.3 | N42: 11.45 | O42: 0.23899999999999999 | P42: 76.86 | Q42: 转股中 | R42: 2.78年 | S42: 0.78年 | T42: 9.19 | U42: 8 | V42: 9.0000000000000011e-003 | W42: 0.28399999999999997 | X42: 0.218 | Y42: 32 | Z42: 1.32 | AA42: 5.1799999999999999e-002 | AB42: 4.5100000000000001e-002 | AC42: 7.3700000000000002e-002 | AD42: 6.9599999999999995e-002 | AE42: 96.1 | AF42: 92.47 | AG42: 0.23 | AH42: AA- | AI42: 6.3200000000000006e-002 | AJ42: =H42+100*O42 -> 119.124 | AK42: 113.6 | AL42: 71 | AM42: 17.5 | AN42: 32 | AO42: 3.6000000000000004e-002 | AP42: 62 | AQ42: 众兴转债!
A43: 83 | B43: 128127 | C43: 文科转债! | D43: 2775 | E43: 文科园林 | F43: 城市公用 | G43: 生态环境 | H43: 92.83 | I43: -1.e-004 | J43: 1.e-004 | K43: 4.7 | L43: 0. | M43: 121.3 | N43: 5.37 | O43: 6.0999999999999999e-002 | P43: 87.52 | Q43: 转股中 | R43: 5.46年 | S43: 3.46年 | T43: 9.5 | U43: 9.2 | V43: 1.e-002 | W43: 0.39399999999999996 | X43: 0.34499999999999997 | Y43: 24 | Z43: 0.91 | AA43: 5.1399999999999994e-002 | AB43: 4.4199999999999996e-002 | AC43: 3.2799999999999996e-002 | AD43: 3.04e-002 | AE43: 82.85 | AF43: 86.19 | AG43: 0.55 | AH43: AA- | AI43: 6.6199999999999995e-002 | AJ43: =H43+100*O43 -> 98.929999999999993 | AK43: 98.1 | AL43: 6 | AM43: 12 | AN43: 10 | AO43: 7.0999999999999994e-002 | AP43: 32 | AQ43: 文科转债!
A44: 201 | B44: 128082 | C44: 华锋转债! | D44: 2806 | E44: 华锋股份 | F44: 电子 | G44: 元器件制 | H44: 96.34 | I44: 1.03e-002 | J44: -8.6999999999999994e-003 | K44: 9.29 | L44: 3.2000000000000002e-003 | M44: 121.4 | N44: 11.71 | O44: 0.214 | P44: 79.33 | Q44: 转股中 | R44: 4.75年 | S44: 2.75年 | T44: 3.45 | U44: 2.4 | V44: 6.9999999999999993e-003 | W44: 0.20999999999999999 | X44: 0.16699999999999998 | Y44: 16 | Z44: 1.31 | AA44: 5.1200000000000002e-002 | AB44: 4.2900000000000001e-002 | AC44: 2.86e-002 | AD44: 2.5399999999999999e-002 | AE44: 84.63 | AF44: 86.53 | AG44: 0.48 | AH44: A+ | AI44: 7.5899999999999995e-002 | AJ44: =H44+100*O44 -> 117.74000000000001 | AK44: 113.3 | AL44: 67 | AM44: 26.8 | AN44: 111 | AO44: 5.5e-002 | AP44: 57 | AQ44: 华锋转债!
A45: 279 | B45: 113519 | C45: 长久转债! | D45: 603569 | E45: 长久物流 | F45: 交通运输 | G45: 物流业 | H45: 99.88 | I45: 6.0000000000000001e-003 | J45: -4.4000000000000003e-003 | K45: 7.27 | L45: 1.54e-002 | M45: 119.3 | N45: 11.15 | O45: 0.53200000000000003 | P45: 65.2 | Q45: 转股中 | R45: 3.67年 | S45: 1.68年 | T45: 6.97 | U45: 16 | V45: 2.4e-002 | W45: 0.17100000000000001 | X45: 0.11199999999999999 | Y45: 41 | Z45: 1.91 | AA45: 5.0499999999999996e-002 | AB45: 4.0800000000000003e-002 | AC45: 1.5900000000000001e-002 | AD45: 1.2800000000000001e-002 | AE45: 95.03 | AF45: 102.17 | AG45: 0.11 | AH45: AA | AI45: 4.3899999999999995e-002 | AJ45: =H45+100*O45 -> 153.07999999999998 | AK45: 134.6 | AL45: 246 | AM45: 32.4 | AN45: 171 | AO45: 7.2999999999999995e-002 | AP45: 20 | AQ45: 长久转债!
A46: 285 | B46: 128042 | C46: 凯中转债! | D46: 2823 | E46: 凯中精密 | F46: 能源电力 | G46: 电力设备 | H46: 98.71 | I46: 5.7999999999999996e-003 | J46: -5.6000000000000008e-003 | K46: 9.95 | L46: 1.e-003 | M46: 116.3 | N46: 12.96 | O46: 0.28600000000000003 | P46: 76.77 | Q46: 转股中 | R46: 3.40年 | S46: 1.40年 | T46: 4.16 | U46: 0.7 | V46: 2.e-003 | W46: 0.14599999999999999 | X46: 0.11199999999999999 | Y46: 29 | Z46: 2.12 | AA46: 5.04e-002 | AB46: 4.1399999999999999e-002 | AC46: 2.64e-002 | AD46: 2.2799999999999997e-002 | AE46: 96.16 | AF46: 100.79 | AG46: 0.22 | AH46: AA | AI46: 4.3899999999999995e-002 | AJ46: =H46+100*O46 -> 127.31 | AK46: 120.6 | AL46: 142 | AM46: 19.9 | AN46: 47 | AO46: 2.5000000000000001e-002 | AP46: 29 | AQ46: 凯中转债!
A47: 214 | B47: 113546 | C47: 迪贝转债! | D47: 603320 | E47: 迪贝电气 | F47: 家电 | G47: 零部件制 | H47: 96.68 | I47: 8.0000000000000002e-003 | J47: -4.5000000000000005e-003 | K47: 10.27 | L47: 8.8000000000000005e-003 | M47: 120.6 | N47: 14.1 | O47: 0.32700000000000001 | P47: 72.84 | Q47: 转股中 | R47: 4.63年 | S47: 2.64年 | T47: 2.3 | U47: 0.9 | V47: 4.0000000000000001e-003 | W47: 0.17199999999999999 | X47: 0.125 | Y47: 13 | Z47: 2 | AA47: 5.0000000000000003e-002 | AB47: 4.1799999999999997e-002 | AC47: 2.6499999999999999e-002 | AD47: 2.3599999999999999e-002 | AE47: 84.88 | AF47: 86.61 | AG47: 0.4 | AH47: A+ | AI47: 7.5899999999999995e-002 | AJ47: =H47+100*O47 -> 129.38 | AK47: 120.5 | AL47: 139 | AM47: 33.9 | AN47: 181 | AO47: 6.4000000000000001e-002 | AP47: 42 | AQ47: 迪贝转债!
A48: 261 | B48: 110052 | C48: XD贵广转! | D48: 600996 | E48: 贵广网络 | F48: 传媒娱乐 | G48: 影视娱乐 | H48: 97.31 | I48: -4.0000000000000002e-004 | J48: 2.5000000000000001e-003 | K48: 5.12 | L48: 1.9900000000000001e-002 | M48: 118.5 | N48: 7.94 | O48: 0.50900000000000001 | P48: 64.48 | Q48: 转股中 | R48: 3.997年 | S48: 2年0.0天 | T48: 15.3 | U48: 3.6 | V48: 2.e-003 | W48: 0.28399999999999997 | X48: 0.183 | Y48: 54 | Z48: 1.19 | AA48: 4.9699999999999994e-002 | AB48: 4.1399999999999999e-002 | AC48: 2.69e-002 | AD48: 2.41e-002 | AE48: 94.32 | AF48: 100.18 | AG48: 0.11 | AH48: AA+ | AI48: 4.1900000000000007e-002 | AJ48: =H48+100*O48 -> 148.21000000000001 | AK48: 130.1 | AL48: 218 | AM48: 30 | AN48: 150 | AO48: 6.0999999999999999e-002 | AP48: 18 | AQ48: XD贵广转!
A49: 43 | B49: 128138 | C49: 侨银转债! | D49: 2973 | E49: 侨银股份 | F49: 城市公用 | G49: 城市公用 | H49: 104.218 | I49: -2.3999999999999998e-003 | J49: 3.0000000000000001e-003 | K49: 22.83 | L49: 1.2999999999999999e-003 | M49: 136.5 | N49: 25.43 | O49: 0.161 | P49: 89.78 | Q49: 2月20天 | R49: 5.70年 | S49: 3.70年 | T49: 4.2 | U49: 2.8 | V49: 6.0000000000000001e-003 | W49: 4.4999999999999998e-002 | X49: 4.0000000000000001e-002 | Y49: 93 | Z49: 6.99 | AA49: 4.9400000000000006e-002 | AB49: 3.9e-002 | AC49: 5.0000000000000001e-004 | AD49: -1.7000000000000001e-003 | AE49: 81.68 | AF49: 95.38 | AG49: 0.48 | AH49: AA- | AI49: 6.6199999999999995e-002 | AJ49: =H49+100*O49 -> 120.31800000000001 | AK49: 118.7 | AL49: 114 | AM49: 23.3 | AN49: 78 | AO49: 3.7999999999999999e-002 | AP49: 7 | AQ49: 侨银转债!
A50: 42 | B50: 123076 | C50: 强力转债! | D50: 300429 | E50: 强力新材 | F50: 化工 | G50: 化工 | H50: 90.5 | I50: 1.1699999999999999e-002 | J50: -6.0000000000000001e-003 | K50: 11.39 | L50: 2.1499999999999998e-002 | M50: 118.5 | N50: 18.98 | O50: 0.50800000000000001 | P50: 60.01 | Q50: 2月21天 | R50: 5.71年 | S50: 3.71年 | T50: 8.5 | U50: 5.7 | V50: 6.9999999999999993e-003 | W50: 0.14499999999999999 | X50: 8.6999999999999994e-002 | Y50: 59 | Z50: 3.39 | AA50: 4.9299999999999997e-002 | AB50: 4.3200000000000002e-002 | AC50: 3.6499999999999998e-002 | AD50: 3.44e-002 | AE50: 81.19 | AF50: 82.79 | AG50: 0.26 | AH50: AA- | AI50: 6.6199999999999995e-002 | AJ50: =H50+100*O50 -> 141.30000000000001 | AK50: 121 | AL50: 146 | AM50: 38.2 | AN50: 217 | AO50: -1.3000000000000001e-002 | AP50: 11 | AQ50: 强力转债!
A51: 33 | B51: 123080 | C51: 海波转债! | D51: 300517 | E51: 海波重科 | F51: 建筑 | G51: 建筑工程 | H51: 96.599 | I51: 3.0999999999999999e-003 | J51: -1.2800000000000001e-002 | K51: 17.33 | L51: -1.7600000000000001e-002 | M51: 126.5 | N51: 20.91 | O51: 0.16600000000000001 | P51: 82.88 | Q51: 3月5天 | R51: 5.74年 | S51: 3.75年 | T51: 2.45 | U51: 4.3 | V51: 1.8000000000000002e-002 | W51: 0.13200000000000001 | X51: 0.11 | Y51: 18 | Z51: 2.42 | AA51: 4.9200000000000001e-002 | AB51: 4.1100000000000005e-002 | AC51: 2.1000000000000001e-002 | AD51: 1.8600000000000002e-002 | AE51: 78.54 | AF51: 83.34 | AG51: 0.55 | AH51: A+ | AI51: 7.7199999999999991e-002 | AJ51: =H51+100*O51 -> 113.19900000000001 | AK51: 110.3 | AL51: 33 | AM51: 27 | AN51: 116 | AO51: 1.3000000000000001e-002 | AP51: 9 | AQ51: 海波转债!
A52: 73 | B52: 128132 | C52: 交建转债! | D52: 2941 | E52: 新疆交建 | F52: 建筑 | G52: 建筑工程 | H52: 90.626 | I52: 1.4000000000000002e-003 | J52: 6.0000000000000001e-003 | K52: 11.54 | L52: 4.2500000000000003e-002 | M52: 117.3 | N52: 18.57 | O52: 0.45799999999999996 | P52: 62.14 | Q52: 17天 | R52: 5.53年 | S52: 3.53年 | T52: 8.5 | U52: 14 | V52: 1.8000000000000002e-002 | W52: 0.114 | X52: 7.0999999999999994e-002 | Y52: 74 | Z52: 3.07 | AA52: 4.8799999999999996e-002 | AB52: 4.2800000000000005e-002 | AC52: 3.78e-002 | AD52: 3.56e-002 | AE52: 88.29 | AF52: 92.31 | AG52: 0.17 | AH52: AA | AI52: 4.5199999999999997e-002 | AJ52: =H52+100*O52 -> 136.42599999999999 | AK52: 119.1 | AL52: 124 | AM52: 26.8 | AN52: 110 | AO52: 0.12300000000000001 | AP52: 14 | AQ52: 交建转债!
A53: 291 | B53: 123010 | C53: 博世转债! | D53: 300422 | E53: 博世科 | F53: 城市公用 | G53: 三废处理 | H53: 96.201 | I53: 3.2000000000000002e-003 | J53: -4.1999999999999997e-003 | K53: 9.6 | L53: -3.0999999999999999e-003 | M53: 112.3 | N53: 12.2 | O53: 0.223 | P53: 78.69 | Q53: 转股中 | R53: 3.33年 | S53: 1.33年 | T53: 4.3 | U53: 3.5 | V53: 8.0000000000000002e-003 | W53: 0.11 | X53: 8.6999999999999994e-002 | Y53: 39 | Z53: 1.64 | AA53: 4.8600000000000004e-002 | AB53: 4.1299999999999996e-002 | AC53: 4.5599999999999995e-002 | AD53: 4.1700000000000001e-002 | AE53: 93.63 | AF53: 91.49 | AG53: 0.33 | AH53: AA- | AI53: 6.4899999999999999e-002 | AJ53: =H53+100*O53 -> 118.50099999999999 | AK53: 113.7 | AL53: 72 | AM53: 20.1 | AN53: 48 | AO53: 4.9000000000000002e-002 | AP53: 32 | AQ53: 博世转债!
A54: 272 | B54: 113524 | C54: 奇精转债! | D54: 603677 | E54: 奇精机械 | F54: 家电 | G54: 零部件制 | H54: 98.54 | I54: 4.8999999999999998e-003 | J54: 2.e-003 | K54: 11.66 | L54: 2.1899999999999999e-002 | M54: 117.3 | N54: 14.08 | O54: 0.19 | P54: 82.81 | Q54: 转股中 | R54: 3.78年 | S54: 1.78年 | T54: 3.3 | U54: 22 | V54: 6.7000000000000004e-002 | W54: 0.14699999999999999 | X54: 0.122 | Y54: 22 | Z54: 2.34 | AA54: 4.8099999999999997e-002 | AB54: 3.9599999999999996e-002 | AC54: 2.2200000000000001e-002 | AD54: 1.9199999999999998e-002 | AE54: 94.62 | AF54: 100.02 | AG54: 0.31 | AH54: AA | AI54: 4.3899999999999995e-002 | AJ54: =H54+100*O54 -> 117.54000000000001 | AK54: 114.3 | AL54: 74 | AM54: 14.2 | AN54: 17 | AO54: 3.9e-002 | AP54: 49 | AQ54: 奇精转债!
A55: 217 | B55: 128076 | C55: 金轮转债! | D55: 2722 | E55: 金轮股份 | F55: 机械装备 | G55: 专用设备 | H55: 92.955 | I55: 7.4000000000000003e-003 | J55: -4.1999999999999997e-003 | K55: 10.14 | L55: 1.e-002 | M55: 114.9 | N55: 14.76 | O55: 0.35299999999999998 | P55: 68.7 | Q55: 转股中 | R55: 4.61年 | S55: 2.61年 | T55: 2.14 | U55: 1.7 | V55: 9.0000000000000011e-003 | W55: 0.12 | X55: 8.3000000000000004e-002 | Y55: 18 | Z55: 0.97 | AA55: 4.8000000000000001e-002 | AB55: 4.1799999999999997e-002 | AC55: 3.95e-002 | AD55: 3.6900000000000002e-002 | AE55: 86.98 | AF55: 86.5 | AG55: 0.32 | AH55: AA- | AI55: 6.4899999999999999e-002 | AJ55: =H55+100*O55 -> 128.255 | AK55: 117.2 | AL55: 102 | AM55: 30.2 | AN55: 154 | AO55: 5.0000000000000003e-002 | AP55: 43 | AQ55: 金轮转债!
A56: 185 | B56: 128093 | C56: 百川转债! | D56: 2455 | E56: 百川股份 | F56: 化工 | G56: 化工 | H56: 104.71 | I56: -4.0000000000000002e-004 | J56: 1.2999999999999999e-003 | K56: 5.95 | L56: 1.7000000000000001e-003 | M56: 129.8 | N56: 5.87 | O56: 3.3000000000000002e-002 | P56: 101.36 | Q56: 转股中 | R56: 4.83年 | S56: 2.83年 | T56: 5.2 | U56: 53 | V56: 9.6000000000000002e-002 | W56: 0.16899999999999998 | X56: 0.17100000000000001 | Y56: 31 | Z56: 2.38 | AA56: 4.7100000000000003e-002 | AB56: 3.6400000000000002e-002 | AC56: 6.9999999999999993e-003 | AD56: 2.5999999999999999e-003 | AE56: 88.79 | AF56: 96.8 | AG56: 0.57 | AH56: AA- | AI56: 6.4899999999999999e-002 | AJ56: =H56+100*O56 -> 108.00999999999999 | AK56: 108.1 | AL56: 25 | AM56: 11.3 | AN56: 7 | AO56: 4.8000000000000001e-002 | AP56: 50 | AQ56: 百川转债!
A57: 151 | B57: 113576 | C57: 起步转债!! | D57: 603557 | E57: 起步股份 | F57: 服装纺织 | G57: 鞋服行业 | H57: 96.94 | I57: 6.5000000000000006e-003 | J57: -2.e-003 | K57: 8.77 | L57: 9.1999999999999998e-003 | M57: 121.8 | N57: 10.55 | O57: 0.16600000000000001 | P57: 83.13 | Q57: 转股中 | R57: 5年35天 | S57: 3年36天 | T57: 2.66 | U57: 11 | V57: 4.2000000000000003e-002 | W57: 6.0999999999999999e-002 | X57: 5.0999999999999997e-002 | Y57: 43 | Z57: 2.58 | AA57: 4.7100000000000003e-002 | AB57: 3.9199999999999999e-002 | AC57: 2.4300000000000002e-002 | AD57: 2.1299999999999999e-002 | AE57: 85.21 | AF57: 88.63 | AG57: 0.49 | AH57: AA- | AI57: 6.6199999999999995e-002 | AJ57: =H57+100*O57 -> 113.53999999999999 | AK57: 110.8 | AL57: 41 | AM57: 22.1 | AN57: 69 | AO57: 0.153 | AP57: 27 | AQ57: 起步转债!!
A58: 194 | B58: 110064 | C58: 建工转债! | D58: 600939 | E58: 重庆建工 | F58: 建筑 | G58: 建筑工程 | H58: 96.74 | I58: 1.4000000000000002e-003 | J58: 1.8e-003 | K58: 3.54 | L58: 1.1399999999999999e-002 | M58: 119.8 | N58: 4.57 | O58: 0.249 | P58: 77.46 | Q58: 转股中 | R58: 4.79年 | S58: 2.79年 | T58: 16.6 | U58: 8.4 | V58: 5.0000000000000001e-003 | W58: 0.25800000000000001 | X58: 0.20000000000000001 | Y58: 64 | Z58: 0.93 | AA58: 4.6699999999999998e-002 | AB58: 3.9100000000000003e-002 | AC58: 2.5399999999999999e-002 | AD58: 2.2599999999999999e-002 | AE58: 92.32 | AF58: 98.84 | AG58: 0.28 | AH58: AA+ | AI58: 4.1900000000000007e-002 | AJ58: =H58+100*O58 -> 121.63999999999999 | AK58: 116 | AL58: 91 | AM58: 17.2 | AN58: 29 | AO58: 4.2999999999999997e-002 | AP58: 47 | AQ58: 建工转债!
A59: 64 | B59: 123069 | C59: 金诺转债! | D59: 300505 | E59: 川金诺 | F59: 化工 | G59: 农化 | H59: 98.22 | I59: 1.9e-003 | J59: 1.6000000000000001e-003 | K59: 16.63 | L59: 6.7000000000000002e-003 | M59: 126 | N59: 19.15 | O59: 0.13100000000000001 | P59: 86.84 | Q59: 48天 | R59: 5.61年 | S59: 3.62年 | T59: 3.68 | U59: 3.3 | V59: 9.0000000000000011e-003 | W59: 0.16899999999999998 | X59: 0.14699999999999999 | Y59: 22 | Z59: 2.26 | AA59: 4.6300000000000001e-002 | AB59: 3.8199999999999998e-002 | AC59: 1.52e-002 | AD59: 1.3100000000000001e-002 | AE59: 81.75 | AF59: 88.54 | AG59: 0.53 | AH59: AA- | AI59: 6.6199999999999995e-002 | AJ59: =H59+100*O59 -> 111.31999999999999 | AK59: 109.6 | AL59: 30 | AM59: 21.1 | AN59: 56 | AO59: -4.0000000000000001e-003 | AP59: 16 | AQ59: 金诺转债!
A60: 317 | B60: 128025 | C60: 特一转债! | D60: 2728 | E60: 特一药业 | F60: 医药 | G60: 化学制药 | H60: 96.312 | I60: -8.9999999999999998e-004 | J60: 2.5000000000000001e-003 | K60: 10.8 | L60: 1.1200000000000002e-002 | M60: 108.8 | N60: 14.7 | O60: 0.311 | P60: 73.47 | Q60: 转股中 | R60: 2.76年 | S60: 0.76年 | T60: 2.99 | U60: 1.6 | V60: 6.0000000000000001e-003 | W60: 0.13600000000000001 | X60: 0.10000000000000001 | Y60: 22 | Z60: 2.17 | AA60: 4.5899999999999996e-002 | AB60: 3.95e-002 | AC60: 5.9200000000000003e-002 | AD60: 5.57e-002 | AE60: 95.98 | AF60: 92.11 | AG60: 0.15 | AH60: AA- | AI60: 6.3200000000000006e-002 | AJ60: =H60+100*O60 -> 127.41200000000001 | AK60: 119.2 | AL60: 126 | AM60: 23.2 | AN60: 77 | AO60: 3.7000000000000005e-002 | AP60: 54 | AQ60: 特一转债!
A61: 243 | B61: 113534 | C61: 鼎胜转债! | D61: 603876 | E61: 鼎胜新材 | F61: 有色金属 | G61: 小金属 | H61: 96.1 | I61: 2.7000000000000001e-003 | J61: -4.3e-003 | K61: 12.34 | L61: -4.7999999999999996e-003 | M61: 114.9 | N61: 15.18 | O61: 0.182 | P61: 81.29 | Q61: 转股中 | R61: 4年34天 | S61: 2年35天 | T61: 12 | U61: 6.2 | V61: 5.0000000000000001e-003 | W61: 0.22399999999999998 | X61: 0.182 | Y61: 54 | Z61: 1.49 | AA61: 4.5700000000000005e-002 | AB61: 3.8599999999999995e-002 | AC61: 3.3300000000000003e-002 | AD61: 3.0200000000000001e-002 | AE61: 93.93 | AF61: 96.75 | AG61: 0.33 | AH61: AA | AI61: 4.3899999999999995e-002 | AJ61: =H61+100*O61 -> 114.3 | AK61: 110.9 | AL61: 42 | AM61: 14.2 | AN61: 16 | AO61: 3.5000000000000003e-002 | AP61: 36 | AQ61: 鼎胜转债!
A62: 59 | B62: 123071 | C62: 天能转债! | D62: 300569 | E62: 天能重工 | F62: 能源电力 | G62: 风能 | H62: 95.001 | I62: 9.300000000000001e-003 | J62: -3.7000000000000002e-003 | K62: 13.93 | L62: 1.5300000000000001e-002 | M62: 121.1 | N62: 20.05 | O62: 0.36700000000000005 | P62: 69.48 | Q62: 53天 | R62: 5.63年 | S62: 3.63年 | T62: 7 | U62: 4 | V62: 6.0000000000000001e-003 | W62: 0.128 | X62: 8.900000000000001e-002 | Y62: 55 | Z62: 2.47 | AA62: 4.4999999999999998e-002 | AB62: 3.8199999999999998e-002 | AC62: 2.4399999999999998e-002 | AD62: 2.23e-002 | AE62: 81.75 | AF62: 85.06 | AG62: 0.37 | AH62: AA- | AI62: 6.6199999999999995e-002 | AJ62: =H62+100*O62 -> 131.70100000000002 | AK62: 120.5 | AL62: 140 | AM62: 35.5 | AN62: 198 | AO62: 4.5999999999999999e-002 | AP62: 10 | AQ62: 天能转债!
A63: 81 | B63: 113601 | C63: 塞力转债 | D63: 603716 | E63: 塞力医疗 | F63: 医药 | G63: 医药商业 | H63: 96.26 | I63: 1.6000000000000001e-003 | J63: 1.4000000000000002e-003 | K63: 14.93 | L63: 5.4000000000000003e-003 | M63: 121.3 | N63: 16.98 | O63: 9.5000000000000001e-002 | P63: 87.93 | Q63: 转股中 | R63: 5.46年 | S63: 3.46年 | T63: 5.43 | U63: 6 | V63: 1.2e-002 | W63: 0.17699999999999999 | X63: 0.156 | Y63: 31 | Z63: 2.01 | AA63: 4.4299999999999999e-002 | AB63: 3.7100000000000001e-002 | AC63: 2.2400000000000003e-002 | AD63: 2.e-002 | AE63: 82.83 | AF63: 86.17 | AG63: 0.55 | AH63: AA- | AI63: 6.6199999999999995e-002 | AJ63: =H63+100*O63 -> 105.76000000000001 | AK63: 104.6 | AL63: 12 | AM63: 18.4 | AN63: 38 | AO63: 2.e-002 | AP63: 33 | AQ63: 塞力转债
A64: 118 | B64: 128117 | C64: 道恩转债 | D64: 2838 | E64: 道恩股份 | F64: 化工 | G64: 橡胶塑料 | H64: 98.999 | I64: 6.3e-003 | J64: -8.9999999999999998e-004 | K64: 22.93 | L64: 1.1899999999999999e-002 | M64: 123.5 | N64: 29.03 | O64: 0.253 | P64: 78.99 | Q64: 转股中 | R64: 5.32年 | S64: 3.33年 | T64: 3.6 | U64: 4.2 | V64: 1.2e-002 | W64: 3.7999999999999999e-002 | X64: 2.9999999999999999e-002 | Y64: 94 | Z64: 5.42 | AA64: 4.3299999999999998e-002 | AB64: 3.5400000000000001e-002 | AC64: 1.3899999999999999e-002 | AD64: 1.1699999999999999e-002 | AE64: 83.21 | AF64: 88.4 | AG64: 0.45 | AH64: AA- | AI64: 6.6199999999999995e-002 | AJ64: =H64+100*O64 -> 124.29899999999999 | AK64: 119 | AL64: 119 | AM64: 30.6 | AN64: 158 | AO64: -1.3999999999999999e-002 | AP64: 20 | AQ64: 道恩转债
A65: 276 | B65: 128049 | C65: 华源转债! | D65: 2787 | E65: 华源控股 | F65: 造纸包装 | G65: 包装材料 | H65: 98.101 | I65: 2.1899999999999999e-002 | J65: -1.84e-002 | K65: 6.16 | L65: 8.199999999999999e-003 | M65: 114.5 | N65: 7.42 | O65: 0.182 | P65: 83.02 | Q65: 转股中 | R65: 3.73年 | S65: 1.73年 | T65: 3.63 | U65: 1.4 | V65: 4.0000000000000001e-003 | W65: 0.18600000000000003 | X65: 0.155 | Y65: 19 | Z65: 1.3 | AA65: 4.3200000000000002e-002 | AB65: 3.5699999999999996e-002 | AC65: 2.53e-002 | AD65: 2.23e-002 | AE65: 91.35 | AF65: 90.98 | AG65: 0.43 | AH65: AA- | AI65: 6.4899999999999999e-002 | AJ65: =H65+100*O65 -> 116.301 | AK65: 113.2 | AL65: 65 | AM65: 21.8 | AN65: 64 | AO65: 3.9e-002 | AP65: 50 | AQ65: 华源转债!
A66: 292 | B66: 127007 | C66: 湖广转债! | D66: 665 | E66: 湖北广电 | F66: 传媒娱乐 | G66: 影视娱乐 | H66: 98.01 | I66: -3.0000000000000001e-003 | J66: 5.0000000000000001e-003 | K66: 3.94 | L66: 1.29e-002 | M66: 112.3 | N66: 5.58 | O66: 0.38799999999999996 | P66: 70.61 | Q66: 转股中 | R66: 3.31年 | S66: 1.32年 | T66: 12.2 | U66: 1.4 | V66: 1.e-003 | W66: 0.314 | X66: 0.222 | Y66: 39 | Z66: 0.6 | AA66: 4.2900000000000001e-002 | AB66: 3.56e-002 | AC66: 3.3000000000000002e-002 | AD66: 2.92e-002 | AE66: 96.79 | AF66: 98.31 | AG66: 0.16 | AH66: AA+ | AI66: 4.1900000000000007e-002 | AJ66: =H66+100*O66 -> 136.81 | AK66: 125.4 | AL66: 191 | AM66: 27.1 | AN66: 118 | AO66: 4.0000000000000001e-002 | AP66: 18 | AQ66: 湖广转债!
A67: 32 | B67: 123081 | C67: 精研转债! | D67: 300709 | E67: 精研科技 | F67: 电子 | G67: 电子产品 | H67: 95.8 | I67: 1.1599999999999999e-002 | J67: 3.0999999999999999e-003 | K67: 43.59 | L67: 3.9800000000000002e-002 | M67: 121.3 | N67: 64.28 | O67: 0.41299999999999998 | P67: 67.81 | Q67: 3月6天 | R67: 5.75年 | S67: 3.75年 | T67: 5.7 | U67: 9.2 | V67: 1.7000000000000001e-002 | W67: 0.113 | X67: 7.6999999999999999e-002 | Y67: 50 | Z67: 3.35 | AA67: 4.2800000000000005e-002 | AB67: 3.61e-002 | AC67: 2.2000000000000002e-002 | AD67: 1.9799999999999998e-002 | AE67: 81.3 | AF67: 84.57 | AG67: 0.37 | AH67: AA- | AI67: 6.6199999999999995e-002 | AJ67: =H67+100*O67 -> 137.09999999999999 | AK67: 123.8 | AL67: 180 | AM67: 39.2 | AN67: 223 | AO67: 1.1000000000000001e-002 | AP67: 5 | AQ67: 精研转债!
A68: 39 | B68: 113609 | C68: 永安转债! | D68: 603776 | E68: 永安行 | F68: 城市公用 | G68: 其他 | H68: 95.48 | I68: 1.2e-002 | J68: 3.3e-003 | K68: 18.19 | L68: 2.5899999999999999e-002 | M68: 120.5 | N68: 20.34 | O68: 6.8000000000000005e-002 | P68: 89.43 | Q68: 2月27天 | R68: 5.72年 | S68: 3.72年 | T68: 8.86 | U68: 27 | V68: 3.2000000000000001e-002 | W68: 0.26000000000000001 | X68: 0.23199999999999998 | Y68: 34 | Z68: 1.23 | AA68: 4.2300000000000004e-002 | AB68: 3.5799999999999998e-002 | AC68: 2.2000000000000002e-002 | AD68: 2.e-002 | AE68: 81.12 | AF68: 84.1 | AG68: 0.59 | AH68: AA- | AI68: 6.6199999999999995e-002 | AJ68: =H68+100*O68 -> 102.28 | AK68: 101.5 | AL68: 8 | AM68: 17.4 | AN68: 30 | AO68: 0.11599999999999999 | AP68: 12 | AQ68: 永安转债!
A69: 331 | B69: 128014 | C69: 永东转债! | D69: 2753 | E69: 永东股份 | F69: 化工 | G69: 化工 | H69: 102.15 | I69: 5.0000000000000001e-004 | J69: -5.0000000000000001e-004 | K69: 7.88 | L69: -6.8600000000000008e-002 | M69: 111.3 | N69: 12.6 | O69: 0.63300000000000001 | P69: 62.54 | Q69: 转股中 | R69: 2年43天 | S69: 43天 | T69: 3.37 | U69: 5.4 | V69: 1.6e-002 | W69: 0.114 | X69: 7.0999999999999994e-002 | Y69: 30 | Z69: 1.68 | AA69: 4.2199999999999994e-002 | AB69: 3.1899999999999998e-002 | AC69: -1.21e-002 | AD69: -2.4399999999999998e-002 | AE69: 100.06 | AF69: 98.02 | AG69: 0 | AH69: AA- | AI69: 6.3200000000000006e-002 | AJ69: =H69+100*O69 -> 165.44999999999999 | AK69: 141.8 | AL69: 270 | AM69: 41.7 | AN69: 241 | AO69: 4.0000000000000001e-003 | AP69: 40 | AQ69: 永东转债!
A70: 224 | B70: 128072 | C70: 翔鹭转债! | D70: 2842 | E70: 翔鹭钨业 | F70: 有色金属 | G70: 小金属 | H70: 96.087 | I70: -1.9599999999999999e-002 | J70: 1.8e-003 | K70: 10.36 | L70: -5.8200000000000002e-002 | M70: 115.1 | N70: 15.34 | O70: 0.42299999999999999 | P70: 67.54 | Q70: 转股中 | R70: 4.46年 | S70: 2.46年 | T70: 3.02 | U70: 21 | V70: 7.2000000000000008e-002 | W70: 0.107 | X70: 7.2000000000000008e-002 | Y70: 28 | Z70: 3.12 | AA70: 4.2199999999999994e-002 | AB70: 3.5799999999999998e-002 | AC70: 2.87e-002 | AD70: 2.6099999999999998e-002 | AE70: 87.84 | AF70: 87.49 | AG70: 0.31 | AH70: AA- | AI70: 6.4899999999999999e-002 | AJ70: =H70+100*O70 -> 138.387 | AK70: 124.6 | AL70: 186 | AM70: 36.8 | AN70: 207 | AO70: 7.4999999999999997e-002 | AP70: 28 | AQ70: 翔鹭转债!
A71: 24 | B71: 123084 | C71: 高澜转债! | D71: 300499 | E71: 高澜股份 | F71: 能源电力 | G71: 电力设备 | H71: 96.598 | I71: 9.3999999999999986e-003 | J71: 4.0000000000000001e-003 | K71: 9.15 | L71: 2.35e-002 | M71: 121.9 | N71: 11.36 | O71: 0.19899999999999998 | P71: 80.55 | Q71: 3月13天 | R71: 5.76年 | S71: 3.77年 | T71: 2.8 | U71: 4.6 | V71: 1.7000000000000001e-002 | W71: 0.11 | X71: 8.900000000000001e-002 | Y71: 25 | Z71: 3.26 | AA71: 4.2199999999999994e-002 | AB71: 3.5299999999999998e-002 | AC71: 2.12e-002 | AD71: 1.8799999999999997e-002 | AE71: 78.51 | AF71: 80.22 | AG71: 0.57 | AH71: A+ | AI71: 7.7199999999999991e-002 | AJ71: =H71+100*O71 -> 116.49799999999999 | AK71: 112.7 | AL71: 57 | AM71: 32.4 | AN71: 172 | AO71: 3.1e-002 | AP71: 7 | AQ71: 高澜转债!
A72: 167 | B72: 123044 | C72: 红相转债! | D72: 300427 | E72: 红相股份 | F72: 能源电力 | G72: 电力设备 | H72: 102.701 | I72: 1.4199999999999999e-002 | J72: -1.04e-002 | K72: 15.83 | L72: 8.3000000000000001e-003 | M72: 125.5 | N72: 18.8 | O72: 0.22 | P72: 84.2 | Q72: 转股中 | R72: 5年6.0天 | S72: 3年7天 | T72: 5.5 | U72: 23 | V72: 4.0000000000000001e-002 | W72: 9.6000000000000002e-002 | X72: 8.1000000000000003e-002 | Y72: 57 | Z72: 2.5 | AA72: 4.1900000000000007e-002 | AB72: 3.3000000000000002e-002 | AC72: 7.0999999999999995e-003 | AD72: 4.0000000000000001e-003 | AE72: 85.89 | AF72: 91.82 | AG72: 0.47 | AH72: AA- | AI72: 6.6199999999999995e-002 | AJ72: =H72+100*O72 -> 124.70099999999999 | AK72: 121.2 | AL72: 150 | AM72: 29.4 | AN72: 143 | AO72: -5.0000000000000003e-002 | AP72: 21 | AQ72: 红相转债!
A73: 25 | B73: 127027 | C73: 靖远转债! | D73: 552 | E73: 靖远煤电 | F73: 煤炭 | G73: 煤炭开采 | H73: 91.503 | I73: -7.1999999999999998e-003 | J73: 2.3999999999999998e-003 | K73: 2.84 | L73: -1.0500000000000001e-002 | M73: 115.3 | N73: 3.33 | O73: 7.2999999999999995e-002 | P73: 85.29 | Q73: 3月13天 | R73: 5.76年 | S73: 3.77年 | T73: 28 | U73: 95 | V73: 3.7000000000000005e-002 | W73: 0.43099999999999999 | X73: 0.36799999999999999 | Y73: 65 | Z73: 0.82 | AA73: 4.1700000000000001e-002 | AB73: 3.6600000000000001e-002 | AC73: 3.2899999999999999e-002 | AD73: 3.0899999999999997e-002 | AE73: 88.03 | AF73: 90.78 | AG73: 0.46 | AH73: AA+ | AI73: 4.3200000000000002e-002 | AJ73: =H73+100*O73 -> 98.802999999999997 | AK73: 97.7 | AL73: 4 | AM73: 6.9 | AN73: 5 | AO73: 5.0999999999999997e-002 | AP73: 17 | AQ73: 靖远转债!
A74: 323 | B74: 113502 | C74: 嘉澳转债! | D74: 603822 | E74: 嘉澳环保 | F74: 化工 | G74: 化工 | H74: 100.07 | I74: 1.6000000000000001e-003 | J74: -1.6000000000000001e-003 | K74: 20.81 | L74: -4.3e-003 | M74: 111.3 | N74: 44.79 | O74: 1.1499999999999999 | P74: 46.46 | Q74: 转股中 | R74: 2.69年 | S74: 0.69年 | T74: 1.85 | U74: 1.2 | V74: 6.0000000000000001e-003 | W74: 0.121 | X74: 5.5999999999999994e-002 | Y74: 15 | Z74: 2.03 | AA74: 4.1100000000000005e-002 | AB74: 3.2899999999999999e-002 | AC74: 2.0400000000000001e-002 | AD74: 1.61e-002 | AE74: 96.64 | AF74: 94.68 | AG74: 0 | AH74: AA- | AI74: 6.3200000000000006e-002 | AJ74: =H74+100*O74 -> 215.06999999999999 | AK74: 153.7 | AL74: 297 | AM74: 57 | AN74: 288 | AO74: 0.13400000000000001 | AP74: 36 | AQ74: 嘉澳转债!
A75: 334 | B75: 128013 | C75: 洪涛转债! | D75: 2325 | E75: 洪涛股份 | F75: 建筑 | G75: 装饰工程 | H75: 103.934 | I75: -1.4000000000000002e-003 | J75: 3.5999999999999999e-003 | K75: 2.4 | L75: 4.1999999999999997e-003 | M75: 109.8 | N75: 2.32 | O75: 5.0000000000000001e-003 | P75: 103.45 | Q75: 转股中 | R75: 1.40年 | S75: 回售内 | T75: 12 | U75: 43 | V75: 3.5000000000000003e-002 | W75: 0.39899999999999997 | X75: 0.41299999999999998 | Y75: 30 | Z75: 1.01 | AA75: 4.0500000000000001e-002 | AB75: 2.7000000000000003e-002 | AC75: 回售内 | AD75: 回售内 | AE75: 100.3 | AF75: 100.88 | AG75: 0.53 | AH75: AA- | AI75: 6.3200000000000006e-002 | AJ75: =H75+100*O75 -> 104.434 | AK75: 104.4 | AL75: 11 | AM75: 3.5 | AN75: 4 | AO75: 7.5999999999999998e-002 | AP75: 93 | AQ75: 洪涛转债!
A76: 67 | B76: 113604 | C76: 多伦转债! | D76: 603528 | E76: 多伦科技 | F76: 计算机及 | G76: 软件开发 | H76: 94.28 | I76: 9.0000000000000011e-003 | J76: 3.8e-003 | K76: 7.91 | L76: 2.7300000000000001e-002 | M76: 117.3 | N76: 10.44 | O76: 0.24399999999999999 | P76: 75.77 | Q76: 45天 | R76: 5.61年 | S76: 3.61年 | T76: 6.4 | U76: 3.2 | V76: 5.0000000000000001e-003 | W76: 0.129 | X76: 9.8000000000000004e-002 | Y76: 50 | Z76: 3.07 | AA76: 4.0500000000000001e-002 | AB76: 3.4799999999999998e-002 | AC76: 2.6099999999999998e-002 | AD76: 2.4e-002 | AE76: 81.7 | AF76: 82.48 | AG76: 0.47 | AH76: AA- | AI76: 6.6199999999999995e-002 | AJ76: =H76+100*O76 -> 118.68000000000001 | AK76: 112.8 | AL76: 62 | AM76: 30.3 | AN76: 157 | AO76: 6.4000000000000001e-002 | AP76: 5 | AQ76: 多伦转债!
A77: 169 | B77: 113570 | C77: 百达转债! | D77: 603331 | E77: 百达精工 | F77: 机械装备 | G77: 机械装备 | H77: 95.09 | I77: 4.5999999999999999e-003 | J77: 1.1999999999999999e-003 | K77: 9.07 | L77: 1.11e-002 | M77: 115.3 | N77: 11.54 | O77: 0.20999999999999999 | P77: 78.6 | Q77: 转股中 | R77: 5年5.0天 | S77: 3年6.0天 | T77: 2.8 | U77: 1.7 | V77: 6.0000000000000001e-003 | W77: 0.17300000000000001 | X77: 0.13600000000000001 | Y77: 16 | Z77: 2.1 | AA77: 4.0099999999999997e-002 | AB77: 3.4200000000000001e-002 | AC77: 2.8300000000000002e-002 | AD77: 2.58e-002 | AE77: 82.16 | AF77: 80.1 | AG77: 0.52 | AH77: A+ | AI77: 7.7199999999999991e-002 | AJ77: =H77+100*O77 -> 116.09 | AK77: 111.6 | AL77: 47 | AM77: 29.4 | AN77: 144 | AO77: 3.2000000000000001e-002 | AP77: 36 | AQ77: 百达转债!
A78: 327 | B78: 113014 | C78: 林洋转债! | D78: 601222 | E78: 林洋能源 | F78: 能源电力 | G78: 电力设备 | H78: 98.7 | I78: -3.4000000000000002e-003 | J78: -7.000000000000001e-004 | K78: 6.89 | L78: -1.7100000000000001e-002 | M78: 109.3 | N78: 8.54 | O78: 0.223 | P78: 80.68 | Q78: 转股中 | R78: 2.65年 | S78: 0.65年 | T78: 30 | U78: 18 | V78: 6.0000000000000001e-003 | W78: 0.249 | X78: 0.20100000000000001 | Y78: 120 | Z78: 1.16 | AA78: 4.0000000000000001e-002 | AB78: 3.3000000000000002e-002 | AC78: 3.8900000000000004e-002 | AD78: 3.4300000000000004e-002 | AE78: 98.44 | AF78: 98.16 | AG78: 0.24 | AH78: AA | AI78: 4.2199999999999994e-002 | AJ78: =H78+100*O78 -> 121. | AK78: 116.7 | AL78: 97 | AM78: 18.3 | AN78: 37 | AO78: -1.6e-002 | AP78: 29 | AQ78: 林洋转债!
A79: 302 | B79: 113505 | C79: 杭电转债! | D79: 603618 | E79: 杭电股份 | F79: 能源电力 | G79: 电力设备 | H79: 100.1 | I79: 7.0999999999999995e-003 | J79: -3.4999999999999996e-003 | K79: 6.39 | L79: 9.4999999999999998e-003 | M79: 112.3 | N79: 7.14 | O79: 0.11800000000000001 | P79: 89.5 | Q79: 转股中 | R79: 3年0.0天 | S79: 1年1.0天 | T79: 7.5 | U79: 12 | V79: 1.7000000000000001e-002 | W79: 0.17000000000000001 | X79: 0.152 | Y79: 44 | Z79: 1.74 | AA79: 4.0000000000000001e-002 | AB79: 3.2000000000000001e-002 | AC79: 2.3300000000000001e-002 | AD79: 1.84e-002 | AE79: 97.82 | AF79: 99.02 | AG79: 0.39 | AH79: AA | AI79: 4.3899999999999995e-002 | AJ79: =H79+100*O79 -> 111.89999999999999 | AK79: 110.7 | AL79: 40 | AM79: 11.7 | AN79: 9 | AO79: 3.2000000000000001e-002 | AP79: 42 | AQ79: 杭电转债!
A80: 110 | B80: 123059 | C80: 银信转债! | D80: 300231 | E80: 银信科技 | F80: 计算机及 | G80: 软件开发 | H80: 101.117 | I80: 1.1699999999999999e-002 | J80: 4.1999999999999997e-003 | K80: 8.18 | L80: 3.2799999999999996e-002 | M80: 124.1 | N80: 9.91 | O80: 0.22500000000000001 | P80: 82.54 | Q80: 转股中 | R80: 5.36年 | S80: 3.36年 | T80: 3.91 | U80: 4.1 | V80: 1.1000000000000001e-002 | W80: 0.10800000000000001 | X80: 8.900000000000001e-002 | Y80: 36 | Z80: 2.75 | AA80: 3.9800000000000002e-002 | AB80: 3.1899999999999998e-002 | AC80: 8.199999999999999e-003 | AD80: 5.8999999999999999e-003 | AE80: 83.18 | AF80: 88.67 | AG80: 0.48 | AH80: AA- | AI80: 6.6199999999999995e-002 | AJ80: =H80+100*O80 -> 123.617 | AK80: 119.7 | AL80: 130 | AM80: 31 | AN80: 164 | AO80: 4.8000000000000001e-002 | AP80: 15 | AQ80: 银信转债!
A81: 35 | B81: 113610 | C81: 灵康转债 | D81: 603669 | E81: 灵康药业 | F81: 医药 | G81: 化学制药 | H81: 97.22 | I81: 2.e-003 | J81: -2.7000000000000001e-003 | K81: 7.71 | L81: -1.2999999999999999e-003 | M81: 121.1 | N81: 8.81 | O81: 0.111 | P81: 87.51 | Q81: 3月4天 | R81: 5.74年 | S81: 3.74年 | T81: 5.25 | U81: 3.4 | V81: 6.9999999999999993e-003 | W81: 9.5000000000000001e-002 | X81: 8.4000000000000005e-002 | Y81: 55 | Z81: 4.03 | AA81: 3.9800000000000002e-002 | AB81: 3.32e-002 | AC81: 1.7600000000000001e-002 | AD81: 1.5600000000000001e-002 | AE81: 81.18 | AF81: 84.46 | AG81: 0.57 | AH81: AA- | AI81: 6.6199999999999995e-002 | AJ81: =H81+100*O81 -> 108.31999999999999 | AK81: 106.9 | AL81: 20 | AM81: 22.5 | AN81: 74 | AO81: -8.0000000000000002e-003 | AP81: 14 | AQ81: 灵康转债
A82: 89 | B82: 113599 | C82: 嘉友转债! | D82: 603871 | E82: 嘉友国际 | F82: 交通运输 | G82: 物流业 | H82: 102.48 | I82: -1.9e-003 | J82: -5.9999999999999995e-004 | K82: 22.3 | L82: -4.5000000000000005e-003 | M82: 126 | N82: 24.82 | O82: 0.14099999999999999 | P82: 89.85 | Q82: 转股中 | R82: 5.42年 | S82: 3.42年 | T82: 7.2 | U82: 3.9 | V82: 5.0000000000000001e-003 | W82: 0.14699999999999999 | X82: 0.13200000000000001 | Y82: 49 | Z82: 2.46 | AA82: 3.9699999999999999e-002 | AB82: 3.1300000000000001e-002 | AC82: 3.9000000000000003e-003 | AD82: 1.8e-003 | AE82: 82.79 | AF82: 89.67 | AG82: 0.54 | AH82: AA- | AI82: 6.6199999999999995e-002 | AJ82: =H82+100*O82 -> 116.58 | AK82: 115.1 | AL82: 82 | AM82: 25.4 | AN82: 101 | AO82: 6.9000000000000006e-002 | AP82: 19 | AQ82: 嘉友转债!
A83: 120 | B83: 113591 | C83: 胜达转债! | D83: 603687 | E83: 大胜达 | F83: 造纸包装 | G83: 包装用纸 | H83: 100.1 | I83: 8.6e-003 | J83: 7.4000000000000003e-003 | K83: 9.65 | L83: 2.7699999999999999e-002 | M83: 122.2 | N83: 10.46 | O83: 8.5000000000000006e-002 | P83: 92.26 | Q83: 转股中 | R83: 5.32年 | S83: 3.32年 | T83: 5.5 | U83: 4.3 | V83: 8.0000000000000002e-003 | W83: 0.13900000000000001 | X83: 0.128 | Y83: 40 | Z83: 2.55 | AA83: 3.9100000000000003e-002 | AB83: 3.1600000000000003e-002 | AC83: 1.15e-002 | AD83: 9.1000000000000004e-003 | AE83: 83.49 | AF83: 87.57 | AG83: 0.58 | AH83: AA- | AI83: 6.6199999999999995e-002 | AJ83: =H83+100*O83 -> 108.59999999999999 | AK83: 107.9 | AL83: 23 | AM83: 20.4 | AN83: 50 | AO83: 6.7000000000000004e-002 | AP83: 23 | AQ83: 胜达转债!
A84: 108 | B84: 128120 | C84: 联诚转债! | D84: 2921 | E84: 联诚精密 | F84: 汽车 | G84: 零部件制 | H84: 96.85 | I84: 1.7399999999999999e-002 | J84: -9.1000000000000004e-003 | K84: 19.73 | L84: 1.34e-002 | M84: 118.4 | N84: 24.37 | O84: 0.19600000000000001 | P84: 80.96 | Q84: 转股中 | R84: 5.36年 | S84: 3.37年 | T84: 2.6 | U84: 2.3 | V84: 9.0000000000000011e-003 | W84: 0.161 | X84: 0.13100000000000001 | Y84: 16 | Z84: 2.15 | AA84: 3.9100000000000003e-002 | AB84: 3.27e-002 | AC84: 2.2200000000000001e-002 | AD84: 1.9599999999999999e-002 | AE84: 78.13 | AF84: 76.48 | AG84: 0.62 | AH84: A | AI84: 8.72e-002 | AJ84: =H84+100*O84 -> 116.44999999999999 | AK84: 112.7 | AL84: 58 | AM84: 34.6 | AN84: 189 | AO84: 8.900000000000001e-002 | AP84: 18 | AQ84: 联诚转债!
A85: 102 | B85: 123061 | C85: 航新转债! | D85: 300424 | E85: 航新科技 | F85: 航空航天 | G85: 航空航天 | H85: 102.217 | I85: 1.5e-003 | J85: 7.4999999999999997e-003 | K85: 13.39 | L85: 1.52e-002 | M85: 124.8 | N85: 14.86 | O85: 0.13400000000000001 | P85: 90.11 | Q85: 转股中 | R85: 5.38年 | S85: 3.38年 | T85: 2.5 | U85: 34 | V85: 0.13400000000000001 | W85: 7.8e-002 | X85: 7.0000000000000007e-002 | Y85: 32 | Z85: 2.94 | AA85: 3.8800000000000001e-002 | AB85: 3.0600000000000002e-002 | AC85: 6.8999999999999999e-003 | AD85: 4.3e-003 | AE85: 80.73 | AF85: 84.5 | AG85: 0.6 | AH85: A+ | AI85: 7.7199999999999991e-002 | AJ85: =H85+100*O85 -> 115.617 | AK85: 114.3 | AL85: 76 | AM85: 29.8 | AN85: 148 | AO85: 5.2999999999999999e-002 | AP85: 12 | AQ85: 航新转债!
A86: 7 | B86: 123093 | C86: 金陵转债 | D86: 300651 | E86: 金陵体育 | F86: 其他 | G86: 文化教育 | H86: 104 | I86: -2.3199999999999998e-002 | J86: 8.3999999999999995e-003 | K86: 44.98 | L86: -2.41e-002 | M86: 129.3 | N86: 49.29 | O86: 0.14000000000000001 | P86: 91.26 | Q86: 4月23天 | R86: 5.87年 | S86: 3.88年 | T86: 2.5 | U86: 25 | V86: 9.6000000000000002e-002 | W86: 4.2999999999999997e-002 | X86: 3.9e-002 | Y86: 58 | Z86: 8.44 | AA86: 3.8800000000000001e-002 | AB86: 3.0299999999999997e-002 | AC86: 5.6999999999999993e-003 | AD86: 2.7000000000000001e-003 | AE86: 79.08 | AF86: 84.57 | AG86: 0.61 | AH86: A+ | AI86: 7.7199999999999991e-002 | AJ86: =H86+100*O86 -> 118. | AK86: 116.7 | AL86: 98 | AM86: 32.2 | AN86: 168 | AO86: -1.3999999999999999e-002 | AP86: 2 | AQ86: 金陵转债
A87: 75 | B87: 123065 | C87: 宝莱转债! | D87: 300246 | E87: 宝莱特 | F87: 医药 | G87: 医疗器械 | H87: 99.013 | I87: 2.9999999999999997e-004 | J87: 3.9000000000000003e-003 | K87: 24.47 | L87: 1.66e-002 | M87: 121.4 | N87: 40.54 | O87: 0.64000000000000001 | P87: 60.36 | Q87: 6.0天 | R87: 5.50年 | S87: 3.50年 | T87: 2.19 | U87: 16 | V87: 7.2000000000000008e-002 | W87: 6.0999999999999999e-002 | X87: 3.7000000000000005e-002 | Y87: 36 | Z87: 4.29 | AA87: 3.8599999999999995e-002 | AB87: 3.1600000000000003e-002 | AC87: 1.4499999999999999e-002 | AD87: 1.21e-002 | AE87: 82.68 | AF87: 86.01 | AG87: 0.25 | AH87: AA- | AI87: 6.6199999999999995e-002 | AJ87: =H87+100*O87 -> 163.01300000000001 | AK87: 137.7 | AL87: 260 | AM87: 51.7 | AN87: 273 | AO87: 8.0000000000000002e-003 | AP87: 13 | AQ87: 宝莱转债!
A88: 290 | B88: 110045 | C88: 海澜转债! | D88: 600398 | E88: 海澜之家 | F88: 服装纺织 | G88: 服装行业 | H88: 98.08 | I88: 2.3999999999999998e-003 | J88: -2.7000000000000001e-003 | K88: 6.96 | L88: -5.6999999999999993e-003 | M88: 111.1 | N88: 11.75 | O88: 0.65599999999999992 | P88: 59.23 | Q88: 转股中 | R88: 3.35年 | S88: 1.36年 | T88: 29.5 | U88: 32 | V88: 1.1000000000000001e-002 | W88: 9.8000000000000004e-002 | X88: 5.7999999999999996e-002 | Y88: 301 | Z88: 2.37 | AA88: 3.85e-002 | AB88: 3.2000000000000001e-002 | AC88: 2.64e-002 | AD88: 2.3700000000000002e-002 | AE88: 95.88 | AF88: 97.02 | AG88: 0.06 | AH88: AA+ | AI88: 4.1900000000000007e-002 | AJ88: =H88+100*O88 -> 163.68000000000001 | AK88: 136.9 | AL88: 258 | AM88: 39.9 | AN88: 229 | AO88: 2.1000000000000001e-002 | AP88: 58 | AQ88: 海澜转债!
A89: 143 | B89: 113578 | C89: 全筑转债! | D89: 603030 | E89: 全筑股份 | F89: 建筑 | G89: 装饰工程 | H89: 97.88 | I89: 1.6000000000000001e-003 | J89: 8.3999999999999995e-003 | K89: 4.57 | L89: 2.4700000000000003e-002 | M89: 118.3 | N89: 5.43 | O89: 0.16300000000000001 | P89: 84.16 | Q89: 转股中 | R89: 5年45天 | S89: 3年46天 | T89: 3.84 | U89: 7.6 | V89: 2.e-002 | W89: 0.156 | X89: 0.13100000000000001 | Y89: 25 | Z89: 1.11 | AA89: 3.85e-002 | AB89: 3.1899999999999998e-002 | AC89: 1.8200000000000001e-002 | AD89: 1.5900000000000001e-002 | AE89: 89.89 | AF89: 94.77 | AG89: 0.41 | AH89: AA | AI89: 4.5199999999999997e-002 | AJ89: =H89+100*O89 -> 114.17999999999999 | AK89: 111.6 | AL89: 49 | AM89: 16.8 | AN89: 25 | AO89: 7.0000000000000007e-002 | AP89: 18 | AQ89: 全筑转债!
A90: 23 | B90: 123086 | C90: 海兰转债! | D90: 300065 | E90: 海兰信 | F90: 电子 | G90: 电子产品 | H90: 99.699 | I90: 9.3999999999999986e-003 | J90: -3.0999999999999999e-003 | K90: 10.98 | L90: 1.5700000000000002e-002 | M90: 123.5 | N90: 15.16 | O90: 0.377 | P90: 72.43 | Q90: 3月14天 | R90: 5.77年 | S90: 3.77年 | T90: 7.3 | U90: 15 | V90: 2.1000000000000001e-002 | W90: 0.16699999999999998 | X90: 0.121 | Y90: 44 | Z90: 2.92 | AA90: 3.85e-002 | AB90: 3.1300000000000001e-002 | AC90: 1.0500000000000001e-002 | AD90: 8.5000000000000006e-003 | AE90: 80.88 | AF90: 85.92 | AG90: 0.4 | AH90: AA- | AI90: 6.6199999999999995e-002 | AJ90: =H90+100*O90 -> 137.399 | AK90: 127 | AL90: 199 | AM90: 41 | AN90: 236 | AO90: 4.0999999999999995e-002 | AP90: 5 | AQ90: 海兰转债!
A91: 264 | B91: 128056 | C91: 今飞转债! | D91: 2863 | E91: 今飞凯达 | F91: 汽车 | G91: 零部件制 | H91: 104 | I91: 5.4699999999999999e-002 | J91: -5.5000000000000005e-003 | K91: 5.82 | L91: 0.10000000000000001 | M91: 120.2 | N91: 6.7 | O91: 0.19699999999999998 | P91: 86.87 | Q91: 转股中 | R91: 3.99年 | S91: 1.99年 | T91: 1.72 | U91: 433 | V91: 2.3999999999999999 | W91: 5.9000000000000004e-002 | X91: 5.0999999999999997e-002 | Y91: 29 | Z91: 1.97 | AA91: 3.7699999999999997e-002 | AB91: 2.86e-002 | AC91: -2.8999999999999998e-003 | AD91: -5.8999999999999999e-003 | AE91: 88.41 | AF91: 90.33 | AG91: 0.49 | AH91: A+ | AI91: 7.5899999999999995e-002 | AJ91: =H91+100*O91 -> 123.7 | AK91: 121.1 | AL91: 148 | AM91: 30.8 | AN91: 160 | AO91: 0.14300000000000002 | AP91: 56 | AQ91: 今飞转债!
A92: 14 | B92: 123089 | C92: 九洲转2! | D92: 300040 | E92: 九洲集团 | F92: 能源电力 | G92: 电力设备 | H92: 98.15 | I92: -1.66e-002 | J92: -6.0000000000000001e-003 | K92: 7.63 | L92: -3.5400000000000001e-002 | M92: 121 | N92: 8 | O92: 2.8999999999999998e-002 | P92: 95.38 | Q92: 3月22天 | R92: 5.79年 | S92: 3.80年 | T92: 5 | U92: 63 | V92: 0.128 | W92: 0.17199999999999999 | X92: 0.16399999999999998 | Y92: 29 | Z92: 1.33 | AA92: 3.7499999999999999e-002 | AB92: 3.1e-002 | AC92: 1.47e-002 | AD92: 1.2699999999999999e-002 | AE92: 80.8 | AF92: 84.07 | AG92: 0.64 | AH92: AA- | AI92: 6.6199999999999995e-002 | AJ92: =H92+100*O92 -> 101.05000000000001 | AK92: 100.9 | AL92: 7 | AM92: 16.9 | AN92: 27 | AO92: 0.20000000000000001 | AP92: 9 | AQ92: 九洲转2!
A93: 9 | B93: 128143 | C93: 锋龙转债! | D93: 2931 | E93: 锋龙股份 | F93: 机械装备 | G93: 专用设备 | H93: 98.6 | I93: 1.3600000000000001e-002 | J93: -1.04e-002 | K93: 15.6 | L93: 5.1999999999999998e-003 | M93: 121.7 | N93: 17.97 | O93: 0.13600000000000001 | P93: 86.81 | Q93: 4月11天 | R93: 5.84年 | S93: 3.85年 | T93: 2.45 | U93: 7.6 | V93: 3.2000000000000001e-002 | W93: 0.11 | X93: 9.6000000000000002e-002 | Y93: 22 | Z93: 3.85 | AA93: 3.7499999999999999e-002 | AB93: 3.0800000000000001e-002 | AC93: 1.5100000000000001e-002 | AD93: 1.2800000000000001e-002 | AE93: 77.9 | AF93: 79.6 | AG93: 0.62 | AH93: A+ | AI93: 7.7199999999999991e-002 | AJ93: =H93+100*O93 -> 112.19999999999999 | AK93: 110.4 | AL93: 34 | AM93: 30.8 | AN93: 159 | AO93: 7.2000000000000008e-002 | AP93: 7 | AQ93: 锋龙转债!
A94: 247 | B94: 113532 | C94: 海环转债! | D94: 603817 | E94: 海峡环保 | F94: 城市公用 | G94: 三废处理 | H94: 97.82 | I94: 4.0000000000000001e-003 | J94: -2.2000000000000001e-003 | K94: 5.62 | L94: 7.1999999999999998e-003 | M94: 112.9 | N94: 7.69 | O94: 0.33799999999999997 | P94: 73.08 | Q94: 转股中 | R94: 4年27天 | S94: 2年28天 | T94: 4.6 | U94: 1.3 | V94: 3.0000000000000001e-003 | W94: 0.182 | X94: 0.13300000000000001 | Y94: 25 | Z94: 1.48 | AA94: 3.6699999999999997e-002 | AB94: 3.0499999999999999e-002 | AC94: 2.53e-002 | AD94: 2.2200000000000001e-002 | AE94: 94.01 | AF94: 95.15 | AG94: 0.25 | AH94: AA | AI94: 4.3899999999999995e-002 | AJ94: =H94+100*O94 -> 131.62 | AK94: 122.6 | AL94: 167 | AM94: 27.4 | AN94: 122 | AO94: 4.2000000000000003e-002 | AP94: 26 | AQ94: 海环转债!
A95: 116 | B95: 113036 | C95: 宁建转债! | D95: 601789 | E95: 宁波建工 | F95: 建筑 | G95: 建筑工程 | H95: 97.5 | I95: 5.9999999999999995e-004 | J95: 4.4000000000000003e-003 | K95: 3.97 | L95: 1.2800000000000001e-002 | M95: 117.3 | N95: 4.86 | O95: 0.19399999999999998 | P95: 81.69 | Q95: 转股中 | R95: 5.33年 | S95: 3.34年 | T95: 5.4 | U95: 2 | V95: 4.0000000000000001e-003 | W95: 0.13900000000000001 | X95: 0.114 | Y95: 39 | Z95: 1.3 | AA95: 3.6000000000000004e-002 | AB95: 2.9999999999999999e-002 | AC95: 1.8200000000000001e-002 | AD95: 1.6e-002 | AE95: 89.06 | AF95: 93.1 | AG95: 0.39 | AH95: AA | AI95: 4.5199999999999997e-002 | AJ95: =H95+100*O95 -> 116.90000000000001 | AK95: 113.3 | AL95: 66 | AM95: 20.2 | AN95: 49 | AO95: 7.2000000000000008e-002 | AP95: 8 | AQ95: 宁建转债!
A96: 271 | B96: 113525 | C96: 台华转债! | D96: 603055 | E96: 台华新材 | F96: 服装纺织 | G96: 纺织行业 | H96: 100.25 | I96: 6.0999999999999995e-003 | J96: -2.8999999999999998e-003 | K96: 6.17 | L96: 1.15e-002 | M96: 114.3 | N96: 7.83 | O96: 0.27200000000000002 | P96: 78.8 | Q96: 转股中 | R96: 3.78年 | S96: 1.79年 | T96: 4.69 | U96: 1.4 | V96: 3.0000000000000001e-003 | W96: 9.0999999999999998e-002 | X96: 7.2000000000000008e-002 | Y96: 51 | Z96: 1.8 | AA96: 3.5900000000000001e-002 | AB96: 2.8799999999999999e-002 | AC96: 1.3000000000000001e-002 | AD96: 1.0200000000000001e-002 | AE96: 94.58 | AF96: 97.44 | AG96: 0.28 | AH96: AA | AI96: 4.3899999999999995e-002 | AJ96: =H96+100*O96 -> 127.45 | AK96: 121.7 | AL96: 154 | AM96: 24.3 | AN96: 87 | AO96: 0.128 | AP96: 22 | AQ96: 台华转债!
A97: 44 | B97: 113608 | C97: 威派转债! | D97: 603956 | E97: 威派格 | F97: 机械装备 | G97: 专用设备 | H97: 100.24 | I97: 2.5000000000000001e-003 | J97: 1.1899999999999999e-002 | K97: 16.25 | L97: 2.3900000000000001e-002 | M97: 121.6 | N97: 19.24 | O97: 0.187 | P97: 84.46 | Q97: 2月9天 | R97: 5.68年 | S97: 3.68年 | T97: 4.2 | U97: 2.4 | V97: 6.0000000000000001e-003 | W97: 6.0999999999999999e-002 | X97: 5.0999999999999997e-002 | Y97: 69 | Z97: 6.07 | AA97: 3.5400000000000001e-002 | AB97: 2.86e-002 | AC97: 1.1299999999999999e-002 | AD97: 8.8999999999999999e-003 | AE97: 78.84 | AF97: 80.51 | AG97: 0.6 | AH97: A+ | AI97: 7.7199999999999991e-002 | AJ97: =H97+100*O97 -> 118.94 | AK97: 116 | AL97: 93 | AM97: 35.5 | AN97: 199 | AO97: 9.8000000000000004e-002 | AP97: 6 | AQ97: 威派转债!
A98: 87 | B98: 127021 | C98: 特发转2! | D98: 70 | E98: 特发信息 | F98: 通信互联 | G98: 通信设备 | H98: 97.6 | I98: 1.9599999999999999e-002 | J98: -1.8799999999999997e-002 | K98: 7.49 | L98: 6.7000000000000002e-003 | M98: 113.3 | N98: 12.33 | O98: 0.60699999999999998 | P98: 60.75 | Q98: 转股中 | R98: 4.42年 | S98: 2.42年 | T98: 5.5 | U98: 24 | V98: 4.4999999999999998e-002 | W98: 8.9999999999999997e-002 | X98: 5.5e-002 | Y98: 61 | Z98: 2.16 | AA98: 3.4700000000000002e-002 | AB98: 2.9100000000000001e-002 | AC98: 1.7399999999999999e-002 | AD98: 1.5800000000000002e-002 | AE98: 91.35 | AF98: 93.92 | AG98: 0.13 | AH98: AA | AI98: 4.3899999999999995e-002 | AJ98: =H98+100*O98 -> 158.29999999999998 | AK98: 134.5 | AL98: 243 | AM98: 40.5 | AN98: 232 | AO98: 1.9e-002 | AP98: 9 | AQ98: 特发转2!
A99: 324 | B99: 128018 | C99: 时达转债! | D99: 2527 | E99: 新时达 | F99: 机械装备 | G99: 机器人及 | H99: 100 | I99: 2.0999999999999999e-003 | J99: 1.1000000000000001e-003 | K99: 5.88 | L99: 1.38e-002 | M99: 109.3 | N99: 7.42 | O99: 0.26200000000000001 | P99: 79.25 | Q99: 转股中 | R99: 2.67年 | S99: 0.67年 | T99: 4.04 | U99: 1.8 | V99: 4.0000000000000001e-003 | W99: 0.111 | X99: 8.8000000000000009e-002 | Y99: 36 | Z99: 1.43 | AA99: 3.44e-002 | AB99: 2.76e-002 | AC99: 2.1499999999999998e-002 | AD99: 1.72e-002 | AE99: 98.33 | AF99: 98.05 | AG99: 0.23 | AH99: AA | AI99: 4.2199999999999994e-002 | AJ99: =H99+100*O99 -> 126.2 | AK99: 120.8 | AL99: 144 | AM99: 22.4 | AN99: 73 | AO99: 6.6000000000000003e-002 | AP99: 40 | AQ99: 时达转债!
A100: 205 | B100: 113549 | C100: 白电转债 | D100: 603861 | E100: 白云电器 | F100: 能源电力 | G100: 电力设备 | H100: 98.28 | I100: 6.0000000000000001e-003 | J100: -6.0000000000000001e-003 | K100: 7.75 | L100: 0. | M100: 114.8 | N100: 8.88 | O100: 0.126 | P100: 87.27 | Q100: 转股中 | R100: 4.70年 | S100: 2.70年 | T100: 8.8 | U100: 3 | V100: 3.0000000000000001e-003 | W100: 0.25700000000000001 | X100: 0.22399999999999998 | Y100: 34 | Z100: 1.46 | AA100: 3.4300000000000004e-002 | AB100: 2.8300000000000002e-002 | AC100: 1.77e-002 | AD100: 1.54e-002 | AE100: 91.43 | AF100: 94.18 | AG100: 0.44 | AH100: AA | AI100: 4.3899999999999995e-002 | AJ100: =H100+100*O100 -> 110.88 | AK100: 109.3 | AL100: 28 | AM100: 15.1 | AN100: 20 | AO100: 2.e-002 | AP100: 35 | AQ100: 白电转债
A101: 189 | B101: 123039 | C101: 开润转债! | D101: 300577 | E101: 开润股份 | F101: 服装纺织 | G101: 纺织行业 | H101: 103.29 | I101: 2.2499999999999999e-002 | J101: 3.8e-003 | K101: 24.5 | L101: 5.2400000000000002e-002 | M101: 121 | N101: 30 | O101: 0.26500000000000001 | P101: 81.67 | Q101: 转股中 | R101: 4.81年 | S101: 2.81年 | T101: 2.22 | U101: 21 | V101: 8.900000000000001e-002 | W101: 3.7999999999999999e-002 | X101: 3.1e-002 | Y101: 59 | Z101: 6.38 | AA101: 3.4200000000000001e-002 | AB101: 2.64e-002 | AC101: 2.5999999999999999e-003 | AD101: -1.e-004 | AE101: 83.91 | AF101: 85.8 | AG101: 0.5 | AH101: A+ | AI101: 7.5899999999999995e-002 | AJ101: =H101+100*O101 -> 129.79000000000002 | AK101: 124.9 | AL101: 189 | AM101: 39.1 | AN101: 222 | AO101: 6.4000000000000001e-002 | AP101: 25 | AQ101: 开润转债!
A102: 158 | B102: 113574 | C102: 华体转债! | D102: 603679 | E102: 华体科技 | F102: 城市公用 | G102: 城市公用 | H102: 98.57 | I102: 7.000000000000001e-004 | J102: -7.7000000000000002e-003 | K102: 19.61 | L102: -3.4000000000000002e-002 | M102: 116.4 | N102: 33.99 | O102: 0.70900000000000007 | P102: 57.69 | Q102: 转股中 | R102: 5年25天 | S102: 3年26天 | T102: 2.09 | U102: 1.7 | V102: 8.0000000000000002e-003 | W102: 7.4999999999999997e-002 | X102: 4.2999999999999997e-002 | Y102: 28 | Z102: 3.83 | AA102: 3.4200000000000001e-002 | AB102: 2.81e-002 | AC102: 1.8700000000000001e-002 | AD102: 1.5800000000000002e-002 | AE102: 82.48 | AF102: 80.67 | AG102: 0.21 | AH102: A+ | AI102: 7.7199999999999991e-002 | AJ102: =H102+100*O102 -> 169.47 | AK102: 139.4 | AL102: 265 | AM102: 57 | AN102: 287 | AO102: 5.5999999999999994e-002 | AP102: 16 | AQ102: 华体转债!
A103: 132 | B103: 123053 | C103: 宝通转债! | D103: 300031 | E103: 宝通科技 | F103: 通信互联 | G103: 互联网 | H103: 102.089 | I103: 2.0999999999999999e-003 | J103: 1.6000000000000001e-003 | K103: 16.99 | L103: 7.7000000000000002e-003 | M103: 121.3 | N103: 20.8 | O103: 0.25 | P103: 81.68 | Q103: 转股中 | R103: 5.25年 | S103: 3.25年 | T103: 5 | U103: 2.3 | V103: 4.0000000000000001e-003 | W103: 7.400000000000001e-002 | X103: 6.0999999999999999e-002 | Y103: 67 | Z103: 2.35 | AA103: 3.4200000000000001e-002 | AB103: 2.69e-002 | AC103: 6.0999999999999995e-003 | AD103: 3.7000000000000002e-003 | AE103: 83.96 | AF103: 87.34 | AG103: 0.48 | AH103: AA- | AI103: 6.6199999999999995e-002 | AJ103: =H103+100*O103 -> 127.089 | AK103: 122.5 | AL103: 166 | AM103: 35.2 | AN103: 191 | AO103: 5.2000000000000005e-002 | AP103: 9 | AQ103: 宝通转债!
A104: 148 | B104: 110070 | C104: 凌钢转债! | D104: 600231 | E104: 凌钢股份 | F104: 钢铁 | G104: 炼钢 | H104: 99.77 | I104: -1.7500000000000002e-002 | J104: 2.5999999999999999e-003 | K104: 2.48 | L104: -3.1300000000000001e-002 | M104: 117.8 | N104: 2.75 | O104: 0.106 | P104: 90.18 | Q104: 转股中 | R104: 5年38天 | S104: 3年39天 | T104: 2.89 | U104: 28 | V104: 9.6999999999999989e-002 | W104: 4.2000000000000003e-002 | X104: 3.7999999999999999e-002 | Y104: 69 | Z104: 0.85 | AA104: 3.39e-002 | AB104: 2.7400000000000001e-002 | AC104: 1.3300000000000001e-002 | AD104: 1.0800000000000001e-002 | AE104: 90.27 | AF104: 94.49 | AG104: 0.48 | AH104: AA | AI104: 4.5199999999999997e-002 | AJ104: =H104+100*O104 -> 110.36999999999999 | AK104: 109.4 | AL104: 29 | AM104: 14.9 | AN104: 19 | AO104: 6.4000000000000001e-002 | AP104: 20 | AQ104: 凌钢转债!
A105: 22 | B105: 123085 | C105: 万顺转2! | D105: 300057 | E105: 万顺新材 | F105: 有色金属 | G105: 铝金属 | H105: 93.822 | I105: 9.3999999999999986e-003 | J105: 4.0999999999999995e-003 | K105: 5.14 | L105: 2.3900000000000001e-002 | M105: 113.3 | N105: 6.24 | O105: 0.13900000000000001 | P105: 82.37 | Q105: 3月14天 | R105: 5.77年 | S105: 3.77年 | T105: 9 | U105: 12 | V105: 1.3999999999999999e-002 | W105: 0.26000000000000001 | X105: 0.214 | Y105: 35 | Z105: 1.02 | AA105: 3.39e-002 | AB105: 2.9500000000000002e-002 | AC105: 2.63e-002 | AD105: 2.4300000000000002e-002 | AE105: 80.85 | AF105: 78.87 | AG105: 0.56 | AH105: AA- | AI105: 6.6199999999999995e-002 | AJ105: =H105+100*O105 -> 107.72200000000001 | AK105: 105.3 | AL105: 15 | AM105: 24.4 | AN105: 90 | AO105: 0.126 | AP105: 8 | AQ105: 万顺转2!
A106: 230 | B106: 128070 | C106: 智能转债! | D106: 2877 | E106: 智能自控 | F106: 机械装备 | G106: 通用设备 | H106: 102.3 | I106: 2.6000000000000002e-002 | J106: -1.67e-002 | K106: 6.9 | L106: 2.3700000000000002e-002 | M106: 117.6 | N106: 9.51 | O106: 0.40999999999999998 | P106: 72.56 | Q106: 转股中 | R106: 4.32年 | S106: 无权 | T106: 2.3 | U106: 96 | V106: 0.40500000000000003 | W106: 0.10000000000000001 | X106: 7.2999999999999995e-002 | Y106: 23 | Z106: 3.22 | AA106: 3.3599999999999998e-002 | AB106: 2.6000000000000002e-002 | AC106: 无权 | AD106: 无权 | AE106: 无权 | AF106: 86.4 | AG106: 0.39 | AH106: A+ | AI106: 7.5899999999999995e-002 | AJ106: =H106+100*O106 -> 143.30000000000001 | AK106: 132 | AL106: 228 | AM106: 45.6 | AN106: 253 | AO106: 6.2e-002 | AP106: 31 | AQ106: 智能转债!
A107: 315 | B107: 123004 | C107: 铁汉转债! | D107: 300197 | E107: 铁汉生态 | F107: 城市公用 | G107: 生态环境 | H107: 99.38 | I107: 1.6000000000000001e-003 | J107: -5.9999999999999995e-004 | K107: 3.33 | L107: 3.0000000000000001e-003 | M107: 108.8 | N107: 3.82 | O107: 0.14000000000000001 | P107: 87.17 | Q107: 转股中 | R107: 2.79年 | S107: 0.79年 | T107: 8.03 | U107: 4.1 | V107: 5.0000000000000001e-003 | W107: 8.5000000000000006e-002 | X107: 7.400000000000001e-002 | Y107: 94 | Z107: 1.52 | AA107: 3.3500000000000002e-002 | AB107: 2.7300000000000001e-002 | AC107: 2.29e-002 | AD107: 1.9599999999999999e-002 | AE107: 97.63 | AF107: 97.11 | AG107: 0.34 | AH107: AA | AI107: 4.2199999999999994e-002 | AJ107: =H107+100*O107 -> 113.38 | AK107: 111.6 | AL107: 48 | AM107: 14 | AN107: 14 | AO107: 7.2000000000000008e-002 | AP107: 47 | AQ107: 铁汉转债!
A108: 121 | B108: 128116 | C108: 瑞达转债! | D108: 2961 | E108: 瑞达期货 | F108: 金融 | G108: 期货行业 | H108: 97.1 | I108: 1.5e-003 | J108: 3.8e-003 | K108: 22.6 | L108: 1.5300000000000001e-002 | M108: 115.3 | N108: 29.82 | O108: 0.28100000000000003 | P108: 75.79 | Q108: 转股中 | R108: 5.32年 | S108: 3.32年 | T108: 6.5 | U108: 6.2 | V108: 1.e-002 | W108: 6.5000000000000002e-002 | X108: 4.9000000000000002e-002 | Y108: 101 | Z108: 5.72 | AA108: 3.3500000000000002e-002 | AB108: 2.81e-002 | AC108: 1.9299999999999998e-002 | AD108: 1.7100000000000001e-002 | AE108: 89.05 | AF108: 91.59 | AG108: 0.35 | AH108: AA | AI108: 4.5199999999999997e-002 | AJ108: =H108+100*O108 -> 125.19999999999999 | AK108: 118.4 | AL108: 110 | AM108: 26.8 | AN108: 112 | AO108: 3.5000000000000003e-002 | AP108: 17 | AQ108: 瑞达转债!
A109: 253 | B109: 123024 | C109: 岱勒转债! | D109: 300700 | E109: 岱勒新材 | F109: 机械装备 | G109: 专用设备 | H109: 102.4 | I109: 5.6999999999999993e-003 | J109: 7.3000000000000001e-003 | K109: 16.95 | L109: 2.4799999999999999e-002 | M109: 113 | N109: 18.33 | O109: 0.107 | P109: 92.47 | Q109: 转股中 | R109: 3年15天 | S109: 1年16天 | T109: 2.1 | U109: 3.6 | V109: 1.7000000000000001e-002 | W109: 0.14999999999999999 | X109: 0.13900000000000001 | Y109: 14 | Z109: 2.83 | AA109: 3.3399999999999999e-002 | AB109: 2.53e-002 | AC109: -5.3e-003 | AD109: -8.1000000000000013e-003 | AE109: 93.18 | AF109: 90.76 | AG109: 0.52 | AH109: A+ | AI109: 7.5899999999999995e-002 | AJ109: =H109+100*O109 -> 113.10000000000001 | AK109: 112.3 | AL109: 56 | AM109: 19.1 | AN109: 41 | AO109: 6.6000000000000003e-002 | AP109: 35 | AQ109: 岱勒转债!
A110: 119 | B110: 123057 | C110: 美联转债! | D110: 300586 | E110: 美联新材 | F110: 化工 | G110: 橡胶塑料 | H110: 99.67 | I110: 1.e-002 | J110: 8.8999999999999999e-003 | K110: 7.95 | L110: 3.7900000000000003e-002 | M110: 118.2 | N110: 9.91 | O110: 0.24199999999999999 | P110: 80.22 | Q110: 转股中 | R110: 5.32年 | S110: 3.32年 | T110: 2.07 | U110: 11 | V110: 5.4000000000000006e-002 | W110: 5.7000000000000002e-002 | X110: 4.5999999999999999e-002 | Y110: 36 | Z110: 4.87 | AA110: 3.3300000000000003e-002 | AB110: 2.7000000000000003e-002 | AC110: 1.2800000000000001e-002 | AD110: 1.04e-002 | AE110: 83.48 | AF110: 84.72 | AG110: 0.5 | AH110: AA- | AI110: 6.6199999999999995e-002 | AJ110: =H110+100*O110 -> 123.87 | AK110: 119.1 | AL110: 125 | AM110: 34.4 | AN110: 187 | AO110: 4.0999999999999995e-002 | AP110: 14 | AQ110: 美联转债!
A111: 155 | B111: 127016 | C111: 鲁泰转债! | D111: 726 | E111: 鲁 泰Ａ | F111: 服装纺织 | G111: 纺织行业 | H111: 99.015 | I111: 5.7999999999999996e-003 | J111: -4.8999999999999998e-003 | K111: 6.85 | L111: 2.8999999999999998e-003 | M111: 116.2 | N111: 8.91 | O111: 0.28800000000000003 | P111: 76.88 | Q111: 转股中 | R111: 5年34天 | S111: 3年35天 | T111: 14 | U111: 1.3 | V111: 1.e-003 | W111: 0.23800000000000002 | X111: 0.183 | Y111: 59 | Z111: 0.77 | AA111: 3.2599999999999997e-002 | AB111: 2.6600000000000002e-002 | AC111: 1.44e-002 | AD111: 1.2199999999999999e-002 | AE111: 90.47 | AF111: 94.1 | AG111: 0.32 | AH111: AA+ | AI111: 4.3200000000000002e-002 | AJ111: =H111+100*O111 -> 127.815 | AK111: 121.2 | AL111: 149 | AM111: 27.1 | AN111: 117 | AO111: 6.9000000000000006e-002 | AP111: 23 | AQ111: 鲁泰转债!
A112: 3 | B112: 123096 | C112: 思创转债 | D112: 300078 | E112: 思创医惠 | F112: 通信互联 | G112: 物联网 | H112: 103 | I112: 1.5300000000000001e-002 | J112: 1.6000000000000001e-003 | K112: 7.71 | L112: 2.7999999999999997e-002 | M112: 124 | N112: 8.27 | O112: 0.105 | P112: 93.23 | Q112: 5月0天 | R112: 5.89年 | S112: 3.90年 | T112: 8.17 | U112: 46 | V112: 5.5e-002 | W112: 0.122 | X112: 0.114 | Y112: 67 | Z112: 2.2 | AA112: 3.2599999999999997e-002 | AB112: 2.5499999999999998e-002 | AC112: 2.2000000000000001e-003 | AD112: 2.9999999999999997e-004 | AE112: 80.29 | AF112: 85.6 | AG112: 0.6 | AH112: AA- | AI112: 6.6199999999999995e-002 | AJ112: =H112+100*O112 -> 113.5 | AK112: 112.8 | AL112: 59 | AM112: 27.2 | AN112: 120 | AO112: 4.2999999999999997e-002 | AP112: 3 | AQ112: 思创转债
A113: 161 | B113: 123047 | C113: 久吾转债 | D113: 300631 | E113: 久吾高科 | F113: 机械装备 | G113: 专用设备 | H113: 111.278 | I113: -6.3e-003 | J113: 3.0999999999999999e-003 | K113: 17.2 | L113: -5.1999999999999998e-003 | M113: 130.1 | N113: 17.61 | O113: 0.13900000000000001 | P113: 97.67 | Q113: 转股中 | R113: 5年14天 | S113: 3年15天 | T113: 1.99 | U113: 20 | V113: 8.9999999999999997e-002 | W113: 0.107 | X113: 0.10400000000000001 | Y113: 19 | Z113: 2.57 | AA113: 3.2500000000000001e-002 | AB113: 2.2400000000000003e-002 | AC113: -1.49e-002 | AD113: -1.8500000000000003e-002 | AE113: 83.9 | AF113: 90.5 | AG113: 0.6 | AH113: A+ | AI113: 7.7199999999999991e-002 | AJ113: =H113+100*O113 -> 125.17800000000001 | AK113: 124.9 | AL113: 188 | AM113: 34.4 | AN113: 186 | AO113: 7.0999999999999994e-002 | AP113: 23 | AQ113: 久吾转债
A114: 5 | B114: 113042 | C114: 上银转债! | D114: 601229 | E114: 上海银行 | F114: 金融 | G114: 银行行业 | H114: 100.61 | I114: 8.9999999999999998e-004 | J114: -8.9999999999999998e-004 | K114: 8.41 | L114: 0. | M114: 120.9 | N114: 11.03 | O114: 0.32000000000000001 | P114: 76.25 | Q114: 4月26天 | R114: 5.89年 | S114: 无权 | T114: 200 | U114: 229 | V114: 1.1000000000000001e-002 | W114: 0.16699999999999998 | X114: 0.128 | Y114: 1195. | Z114: 0.72 | AA114: 3.2500000000000001e-002 | AB114: 2.6099999999999998e-002 | AC114: 无权 | AD114: 无权 | AE114: 无权 | AF114: 96.44 | AG114: 0.33 | AH114: AAA | AI114: 4.0199999999999993e-002 | AJ114: =H114+100*O114 -> 132.61000000000001 | AK114: 125 | AL114: 190 | AM114: 28.5 | AN114: 134 | AO114: -6.0000000000000001e-003 | AP114: 9 | AQ114: 上银转债!
A115: 212 | B115: 110059 | C115: 浦发转债! | D115: 600000 | E115: 浦发银行 | F115: 金融 | G115: 银行行业 | H115: 102.03 | I115: 2.9999999999999997e-004 | J115: -8.0000000000000004e-004 | K115: 10.86 | L115: -1.8e-003 | M115: 117.6 | N115: 14.45 | O115: 0.35799999999999998 | P115: 75.16 | Q115: 转股中 | R115: 4.65年 | S115: 无权 | T115: 500 | U115: 359 | V115: 6.9999999999999993e-003 | W115: 0.157 | X115: 0.11800000000000001 | Y115: 3188. | Z115: 0.62 | AA115: 3.1899999999999998e-002 | AB115: 2.4900000000000002e-002 | AC115: 无权 | AD115: 无权 | AE115: 无权 | AF115: 98.99 | AG115: 0.26 | AH115: AAA | AI115: 3.8900000000000004e-002 | AJ115: =H115+100*O115 -> 137.82999999999998 | AK115: 128.9 | AL115: 211 | AM115: 29.9 | AN115: 149 | AO115: 2.4e-002 | AP115: 73 | AQ115: 浦发转债!
A116: 157 | B116: 113033 | C116: 利群转债! | D116: 601366 | E116: 利群股份 | F116: 商业零售 | G116: 商场 | H116: 98.89 | I116: 0. | J116: -1.6000000000000001e-003 | K116: 6.58 | L116: -3.0000000000000001e-003 | M116: 115.3 | N116: 7.01 | O116: 5.4000000000000006e-002 | P116: 93.87 | Q116: 转股中 | R116: 5年26天 | S116: 3年27天 | T116: 18 | U116: 15 | V116: 9.0000000000000011e-003 | W116: 0.318 | X116: 0.29799999999999999 | Y116: 57 | Z116: 1.27 | AA116: 3.1400000000000004e-002 | AB116: 2.5699999999999997e-002 | AC116: 1.5300000000000001e-002 | AD116: 1.29e-002 | AE116: 90.1 | AF116: 92.59 | AG116: 0.53 | AH116: AA | AI116: 4.5199999999999997e-002 | AJ116: =H116+100*O116 -> 104.29000000000001 | AK116: 103.9 | AL116: 10 | AM116: 11.3 | AN116: 8 | AO116: -4.0000000000000001e-003 | AP116: 43 | AQ116: 利群转债!
A117: 173 | B117: 113567 | C117: 君禾转债! | D117: 603617 | E117: 君禾股份 | F117: 机械装备 | G117: 通用设备 | H117: 102.2 | I117: 3.5999999999999999e-003 | J117: -1.9e-003 | K117: 10.27 | L117: 2.8999999999999998e-003 | M117: 118.8 | N117: 11.46 | O117: 0.14000000000000001 | P117: 89.62 | Q117: 转股中 | R117: 4.99年 | S117: 2.997年 | T117: 2.1 | U117: 1.1 | V117: 5.0000000000000001e-003 | W117: 0.10300000000000001 | X117: 9.1999999999999998e-002 | Y117: 20 | Z117: 3.18 | AA117: 3.1300000000000001e-002 | AB117: 2.4399999999999998e-002 | AC117: 5.5000000000000005e-003 | AD117: 3.0000000000000001e-003 | AE117: 82.68 | AF117: 83.11 | AG117: 0.6 | AH117: A+ | AI117: 7.5899999999999995e-002 | AJ117: =H117+100*O117 -> 116.2 | AK117: 114.8 | AL117: 80 | AM117: 31.7 | AN117: 167 | AO117: 4.9000000000000002e-002 | AP117: 36 | AQ117: 君禾转债!
A118: 319 | B118: 128022 | C118: 众信转债! | D118: 2707 | E118: 众信旅游 | F118: 旅游餐饮 | G118: 旅游 | H118: 100.166 | I118: 2.0000000000000001e-004 | J118: -7.000000000000001e-004 | K118: 6.62 | L118: -1.5e-003 | M118: 108.8 | N118: 7.92 | O118: 0.19800000000000001 | P118: 83.59 | Q118: 转股中 | R118: 2.74年 | S118: 0.74年 | T118: 4.56 | U118: 14 | V118: 3.1e-002 | W118: 7.5999999999999998e-002 | X118: 6.4000000000000001e-002 | Y118: 60 | Z118: 2.82 | AA118: 3.1099999999999999e-002 | AB118: 2.4799999999999999e-002 | AC118: 1.52e-002 | AD118: 1.18e-002 | AE118: 96.06 | AF118: 92.19 | AG118: 0.35 | AH118: AA- | AI118: 6.3200000000000006e-002 | AJ118: =H118+100*O118 -> 119.96599999999999 | AK118: 116.7 | AL118: 99 | AM118: 20.7 | AN118: 51 | AO118: 0.13400000000000001 | AP118: 32 | AQ118: 众信转债!
A119: 262 | B119: 113021 | C119: 中信转债! | D119: 601998 | E119: 中信银行 | F119: 金融 | G119: 银行行业 | H119: 104.8 | I119: 1.1000000000000001e-003 | J119: 2.0000000000000001e-004 | K119: 5.25 | L119: 5.6999999999999993e-003 | M119: 118 | N119: 6.98 | O119: 0.39299999999999996 | P119: 75.21 | Q119: 转股中 | R119: 3.99年 | S119: 无权 | T119: 400 | U119: 45 | V119: 1.e-003 | W119: 0.156 | X119: 0.11699999999999999 | Y119: 2569. | Z119: 0.56 | AA119: 3.1e-002 | AB119: 2.2700000000000001e-002 | AC119: 无权 | AD119: 无权 | AE119: 无权 | AF119: 101.73 | AG119: 0.22 | AH119: AAA | AI119: 3.8900000000000004e-002 | AJ119: =H119+100*O119 -> 144.09999999999999 | AK119: 134.4 | AL119: 242 | AM119: 32.7 | AN119: 175 | AO119: -4.0000000000000001e-003 | AP119: 50 | AQ119: 中信转债!
A120: 65 | B120: 123068 | C120: 弘信转债 | D120: 300657 | E120: 弘信电子 | F120: 电子 | G120: 元器件制 | H120: 102.6 | I120: 8.3999999999999995e-003 | J120: 3.2000000000000002e-003 | K120: 17.05 | L120: 1.9099999999999999e-002 | M120: 121.2 | N120: 18.45 | O120: 0.11 | P120: 92.41 | Q120: 47天 | R120: 5.61年 | S120: 3.61年 | T120: 5.7 | U120: 3.6 | V120: 6.0000000000000001e-003 | W120: 9.8000000000000004e-002 | X120: 8.9999999999999997e-002 | Y120: 58 | Z120: 3.98 | AA120: 3.0800000000000001e-002 | AB120: 2.4e-002 | AC120: 3.9000000000000003e-003 | AD120: 1.8e-003 | AE120: 81.94 | AF120: 85.25 | AG120: 0.6 | AH120: AA- | AI120: 6.6199999999999995e-002 | AJ120: =H120+100*O120 -> 113.59999999999999 | AK120: 112.8 | AL120: 61 | AM120: 27.5 | AN120: 127 | AO120: 5.2999999999999999e-002 | AP120: 7 | AQ120: 弘信转债
A121: 37 | B121: 128139 | C121: 祥鑫转债! | D121: 2965 | E121: 祥鑫科技 | F121: 汽车 | G121: 零部件制 | H121: 102 | I121: 1.9199999999999998e-002 | J121: -1.06e-002 | K121: 36.35 | L121: 1.3100000000000001e-002 | M121: 121 | N121: 37.28 | O121: 4.5999999999999999e-002 | P121: 97.51 | Q121: 3月4天 | R121: 5.74年 | S121: 3.74年 | T121: 6.47 | U121: 33 | V121: 5.0999999999999997e-002 | W121: 0.11800000000000001 | X121: 0.115 | Y121: 55 | Z121: 3.23 | AA121: 3.0800000000000001e-002 | AB121: 2.4300000000000002e-002 | AC121: 4.7999999999999996e-003 | AD121: 2.8999999999999998e-003 | AE121: 81.09 | AF121: 84.37 | AG121: 0.65 | AH121: AA- | AI121: 6.6199999999999995e-002 | AJ121: =H121+100*O121 -> 106.59999999999999 | AK121: 106.5 | AL121: 19 | AM121: 22.1 | AN121: 70 | AO121: 0.152 | AP121: 9 | AQ121: 祥鑫转债!
A122: 203 | B122: 128081 | C122: 海亮转债! | D122: 2203 | E122: 海亮股份 | F122: 有色金属 | G122: 铜金属 | H122: 99.9 | I122: -6.8000000000000005e-003 | J122: 4.0000000000000001e-003 | K122: 9.12 | L122: -5.5000000000000005e-003 | M122: 114.9 | N122: 9.76 | O122: 6.9000000000000006e-002 | P122: 93.44 | Q122: 转股中 | R122: 4.71年 | S122: 2.72年 | T122: 31.5 | U122: 13 | V122: 4.0000000000000001e-003 | W122: 0.17699999999999999 | X122: 0.16500000000000001 | Y122: 178 | Z122: 1.98 | AA122: 3.0699999999999998e-002 | AB122: 2.4799999999999999e-002 | AC122: 1.21e-002 | AD122: 9.7999999999999997e-003 | AE122: 91.47 | AF122: 94.21 | AG122: 0.51 | AH122: AA | AI122: 4.3899999999999995e-002 | AJ122: =H122+100*O122 -> 106.80000000000001 | AK122: 106.4 | AL122: 18 | AM122: 12.1 | AN122: 11 | AO122: 5.9999999999999998e-002 | AP122: 51 | AQ122: 海亮转债!
A123: 213 | B123: 127014 | C123: 北方转债! | D123: 65 | E123: 北方国际 | F123: 建筑 | G123: 建筑工程 | H123: 100.4 | I123: 9.1000000000000004e-003 | J123: -6.6e-003 | K123: 7.08 | L123: 7.0999999999999995e-003 | M123: 115.1 | N123: 8.75 | O123: 0.24100000000000002 | P123: 80.91 | Q123: 转股中 | R123: 4.64年 | S123: 2.64年 | T123: 5.78 | U123: 11 | V123: 1.9e-002 | W123: 0.106 | X123: 8.5999999999999993e-002 | Y123: 54 | Z123: 1.03 | AA123: 3.0600000000000002e-002 | AB123: 2.4399999999999998e-002 | AC123: 1.1399999999999999e-002 | AD123: 8.8000000000000005e-003 | AE123: 92.45 | AF123: 95.54 | AG123: 0.35 | AH123: AA+ | AI123: 4.1900000000000007e-002 | AJ123: =H123+100*O123 -> 124.5 | AK123: 119.9 | AL123: 131 | AM123: 24.3 | AN123: 89 | AO123: 5.0000000000000003e-002 | AP123: 17 | AQ123: 北方转债!
A124: 28 | B124: 127026 | C124: 超声转债! | D124: 823 | E124: 超声电子 | F124: 电子 | G124: 元器件制 | H124: 95.705 | I124: 4.0000000000000001e-003 | J124: -7.000000000000001e-004 | K124: 10.09 | L124: 8.0000000000000002e-003 | M124: 113.1 | N124: 12.85 | O124: 0.21899999999999997 | P124: 78.52 | Q124: 3月11天 | R124: 5.76年 | S124: 3.76年 | T124: 7 | U124: 9 | V124: 1.3000000000000001e-002 | W124: 0.129 | X124: 0.10099999999999999 | Y124: 54 | Z124: 1.47 | AA124: 2.9999999999999999e-002 | AB124: 2.5600000000000001e-002 | AC124: 2.06e-002 | AD124: 1.8700000000000001e-002 | AE124: 87.21 | AF124: 88.08 | AG124: 0.42 | AH124: AA | AI124: 4.5199999999999997e-002 | AJ124: =H124+100*O124 -> 117.60499999999999 | AK124: 112.9 | AL124: 63 | AM124: 24.8 | AN124: 93 | AO124: 3.7000000000000005e-002 | AP124: 7 | AQ124: 超声转债!
A125: 114 | B125: 110071 | C125: 湖盐转债! | D125: 600929 | E125: 雪天盐业 | F125: 食品饮料 | G125: 食品饮料 | H125: 98.81 | I125: -8.6e-003 | J125: 1.18e-002 | K125: 5.6 | L125: 7.1999999999999998e-003 | M125: 115.2 | N125: 6.6 | O125: 0.16500000000000001 | P125: 84.85 | Q125: 转股中 | R125: 5.35年 | S125: 3.35年 | T125: 7.2 | U125: 28 | V125: 3.9e-002 | W125: 0.14000000000000001 | X125: 0.11900000000000001 | Y125: 51 | Z125: 2.02 | AA125: 2.9700000000000001e-002 | AB125: 2.4399999999999998e-002 | AC125: 1.3999999999999999e-002 | AD125: 1.1899999999999999e-002 | AE125: 88.92 | AF125: 91.38 | AG125: 0.45 | AH125: AA | AI125: 4.5199999999999997e-002 | AJ125: =H125+100*O125 -> 115.31 | AK125: 112.8 | AL125: 60 | AM125: 21.4 | AN125: 60 | AO125: 8.5999999999999993e-002 | AP125: 15 | AQ125: 湖盐转债!
A126: 126 | B126: 113588 | C126: 润达转债! | D126: 603108 | E126: 润达医疗 | F126: 医药 | G126: 医疗器械 | H126: 98.37 | I126: -5.1999999999999998e-003 | J126: 1.1999999999999999e-003 | K126: 10.47 | L126: -1.04e-002 | M126: 114.2 | N126: 13.36 | O126: 0.255 | P126: 78.37 | Q126: 转股中 | R126: 5.28年 | S126: 3.29年 | T126: 5.5 | U126: 7 | V126: 1.3000000000000001e-002 | W126: 9.0999999999999998e-002 | X126: 7.0999999999999994e-002 | Y126: 61 | Z126: 2.02 | AA126: 2.92e-002 | AB126: 2.41e-002 | AC126: 1.5600000000000001e-002 | AD126: 1.34e-002 | AE126: 89.16 | AF126: 90.84 | AG126: 0.38 | AH126: AA | AI126: 4.5199999999999997e-002 | AJ126: =H126+100*O126 -> 123.87 | AK126: 118.4 | AL126: 109 | AM126: 27.5 | AN126: 126 | AO126: -2.3e-002 | AP126: 10 | AQ126: 润达转债!
A127: 2 | B127: 123097 | C127: 美力转债 | D127: 300611 | E127: 美力科技 | F127: 机械装备 | G127: 通用设备 | H127: 103.02 | I127: 8.6e-003 | J127: 2.8999999999999998e-003 | K127: 9.42 | L127: 1.6200000000000003e-002 | M127: 121.6 | N127: 9.34 | O127: 2.1000000000000001e-002 | P127: 100.86 | Q127: 5月0天 | R127: 5.90年 | S127: 3.90年 | T127: 3 | U127: 44 | V127: 0.14300000000000002 | W127: 0.17800000000000002 | X127: 0.17899999999999999 | Y127: 17 | Z127: 2.62 | AA127: 2.9100000000000001e-002 | AB127: 2.2599999999999999e-002 | AC127: 3.8e-003 | AD127: 1.6000000000000001e-003 | AE127: 77.59 | AF127: 79.22 | AG127: 0.71 | AH127: A+ | AI127: 7.7199999999999991e-002 | AJ127: =H127+100*O127 -> 105.11999999999999 | AK127: 105.2 | AL127: 14 | AM127: 26 | AN127: 106 | AO127: 7.6999999999999999e-002 | AP127: 4 | AQ127: 美力转债
A128: 160 | B128: 110068 | C128: 龙净转债! | D128: 600388 | E128: 龙净环保 | F128: 城市公用 | G128: 三废处理 | H128: 99.87 | I128: -3.8e-003 | J128: -3.0999999999999999e-003 | K128: 9.15 | L128: -1.61e-002 | M128: 115 | N128: 10.73 | O128: 0.17100000000000001 | P128: 85.27 | Q128: 转股中 | R128: 5年18天 | S128: 3年19天 | T128: 20 | U128: 7.8 | V128: 4.0000000000000001e-003 | W128: 0.20399999999999999 | X128: 0.17399999999999999 | Y128: 98 | Z128: 1.7 | AA128: 2.8900000000000002e-002 | AB128: 2.3300000000000001e-002 | AC128: 1.1299999999999999e-002 | AD128: 9.1000000000000004e-003 | AE128: 90.44 | AF128: 93.27 | AG128: 0.43 | AH128: AA+ | AI128: 4.3200000000000002e-002 | AJ128: =H128+100*O128 -> 116.97 | AK128: 114.5 | AL128: 77 | AM128: 21.2 | AN128: 57 | AO128: 5.5999999999999994e-002 | AP128: 31 | AQ128: 龙净转债!
A129: 31 | B129: 123082 | C129: 北陆转债! | D129: 300016 | E129: 北陆药业 | F129: 医药 | G129: 化学制药 | H129: 103.743 | I129: 5.3e-003 | J129: 5.1999999999999998e-003 | K129: 8.81 | L129: 1.4999999999999999e-002 | M129: 121.7 | N129: 8.86 | O129: 4.2999999999999997e-002 | P129: 99.44 | Q129: 3月8天 | R129: 5.76年 | S129: 3.76年 | T129: 5 | U129: 27 | V129: 5.2000000000000005e-002 | W129: 0.115 | X129: 0.114 | Y129: 44 | Z129: 2.75 | AA129: 2.8799999999999999e-002 | AB129: 2.2099999999999998e-002 | AC129: 2.2000000000000001e-003 | AD129: -1.e-004 | AE129: 78.41 | AF129: 80.12 | AG129: 0.7 | AH129: A+ | AI129: 7.7199999999999991e-002 | AJ129: =H129+100*O129 -> 108.04299999999999 | AK129: 108.1 | AL129: 24 | AM129: 27.9 | AN129: 131 | AO129: 4.2000000000000003e-002 | AP129: 8 | AQ129: 北陆转债!
A130: 147 | B130: 123049 | C130: 维尔转债 | D130: 300190 | E130: 维尔利 | F130: 城市公用 | G130: 三废处理 | H130: 108.49 | I130: -9.0000000000000011e-003 | J130: 1.9799999999999998e-002 | K130: 7.97 | L130: 1.66e-002 | M130: 124.8 | N130: 7.48 | O130: 1.8000000000000002e-002 | P130: 106.55 | Q130: 转股中 | R130: 5年38天 | S130: 3年39天 | T130: 9.17 | U130: 231 | V130: 0.223 | W130: 0.14699999999999999 | X130: 0.157 | Y130: 62 | Z130: 1.48 | AA130: 2.8500000000000001e-002 | AB130: 2.0099999999999996e-002 | AC130: -1.09e-002 | AD130: -1.3600000000000001e-002 | AE130: 85.17 | AF130: 90.74 | AG130: 0.65 | AH130: AA- | AI130: 6.6199999999999995e-002 | AJ130: =H130+100*O130 -> 110.28999999999999 | AK130: 110.4 | AL130: 35 | AM130: 19.7 | AN130: 45 | AO130: 0.14899999999999999 | AP130: 15 | AQ130: 维尔转债
A131: 19 | B131: 123087 | C131: 明电转债! | D131: 300739 | E131: 明阳电路 | F131: 电子 | G131: 元器件制 | H131: 103.644 | I131: 7.3000000000000001e-003 | J131: 1.1000000000000001e-003 | K131: 16.43 | L131: 1.29e-002 | M131: 121.2 | N131: 16.62 | O131: 4.8000000000000001e-002 | P131: 98.86 | Q131: 3月18天 | R131: 5.78年 | S131: 4.78年 | T131: 6.73 | U131: 18 | V131: 2.5000000000000001e-002 | W131: 0.14699999999999999 | X131: 0.14499999999999999 | Y131: 46 | Z131: 3.34 | AA131: 2.7999999999999997e-002 | AB131: 2.1499999999999998e-002 | AC131: 6.0000000000000001e-003 | AD131: 3.4000000000000002e-003 | AE131: 78.13 | AF131: 84.34 | AG131: 0.65 | AH131: AA- | AI131: 6.6199999999999995e-002 | AJ131: =H131+100*O131 -> 108.444 | AK131: 108.4 | AL131: 26 | AM131: 24.1 | AN131: 86 | AO131: 4.2000000000000003e-002 | AP131: 5 | AQ131: 明电转债!
A132: 94 | B132: 123063 | C132: 大禹转债 | D132: 300021 | E132: 大禹节水 | F132: 化工 | G132: 橡胶塑料 | H132: 109.4 | I132: -2.7000000000000001e-003 | J132: -2.2000000000000001e-003 | K132: 5.29 | L132: -7.4999999999999997e-003 | M132: 126.5 | N132: 4.94 | O132: 2.2000000000000002e-002 | P132: 107.09 | Q132: 转股中 | R132: 5.39年 | S132: 4.40年 | T132: 6.38 | U132: 19 | V132: 2.7000000000000003e-002 | W132: 0.151 | X132: 0.16200000000000001 | Y132: 42 | Z132: 2.92 | AA132: 2.7900000000000001e-002 | AB132: 1.95e-002 | AC132: -4.8999999999999998e-003 | AD132: -7.8000000000000005e-003 | AE132: 80.3 | AF132: 90.21 | AG132: 0.66 | AH132: AA- | AI132: 6.6199999999999995e-002 | AJ132: =H132+100*O132 -> 111.60000000000001 | AK132: 111.7 | AL132: 50 | AM132: 21.5 | AN132: 62 | AO132: 9.0999999999999998e-002 | AP132: 16 | AQ132: 大禹转债
A133: 200 | B133: 128083 | C133: 新北转债! | D133: 2376 | E133: 新北洋 | F133: 电子 | G133: 电子产品 | H133: 101.3 | I133: -6.9999999999999993e-003 | J133: 9.1999999999999998e-003 | K133: 10.13 | L133: 5.0000000000000001e-003 | M133: 114.9 | N133: 11.7 | O133: 0.17000000000000001 | P133: 86.58 | Q133: 转股中 | R133: 4.77年 | S133: 2.77年 | T133: 8.77 | U133: 4.6 | V133: 5.0000000000000001e-003 | W133: 0.13 | X133: 0.113 | Y133: 67 | Z133: 2 | AA133: 2.7300000000000001e-002 | AB133: 2.1400000000000002e-002 | AC133: 7.0999999999999995e-003 | AD133: 4.7999999999999996e-003 | AE133: 91.24 | AF133: 93.98 | AG133: 0.43 | AH133: AA | AI133: 4.3899999999999995e-002 | AJ133: =H133+100*O133 -> 118.3 | AK133: 116 | AL133: 92 | AM133: 22 | AN133: 67 | AO133: 6.9999999999999993e-003 | AP133: 19 | AQ133: 新北转债!
A134: 255 | B134: 110056 | C134: 亨通转债! | D134: 600487 | E134: 亨通光电 | F134: 通信互联 | G134: 通信设备 | H134: 103.29 | I134: 6.8999999999999999e-003 | J134: -1.5e-003 | K134: 13.14 | L134: 1.3899999999999999e-002 | M134: 114.8 | N134: 15.01 | O134: 0.17999999999999999 | P134: 87.54 | Q134: 转股中 | R134: 4年13天 | S134: 2年14天 | T134: 17.1 | U134: 6.5 | V134: 4.0000000000000001e-003 | W134: 5.5e-002 | X134: 4.8000000000000001e-002 | Y134: 310 | Z134: 1.7 | AA134: 2.7099999999999999e-002 | AB134: 2.0299999999999999e-002 | AC134: 0. | AD134: -2.8999999999999998e-003 | AE134: 94.46 | AF134: 97.62 | AG134: 0.39 | AH134: AA+ | AI134: 4.1900000000000007e-002 | AJ134: =H134+100*O134 -> 121.29000000000001 | AK134: 119 | AL134: 120 | AM134: 21.4 | AN134: 61 | AO134: 5.0999999999999997e-002 | AP134: 31 | AQ134: 亨通转债!
A135: 125 | B135: 123056 | C135: 雪榕转债 | D135: 300511 | E135: 雪榕生物 | F135: 农业 | G135: 种植业 | H135: 105.4 | I135: 1.6200000000000003e-002 | J135: -8.0000000000000002e-003 | K135: 11.27 | L135: 1.3500000000000002e-002 | M135: 121.1 | N135: 11.89 | O135: 0.11199999999999999 | P135: 94.79 | Q135: 转股中 | R135: 5.30年 | S135: 3.30年 | T135: 5.85 | U135: 16 | V135: 2.6000000000000002e-002 | W135: 0.11699999999999999 | X135: 0.111 | Y135: 50 | Z135: 2.6 | AA135: 2.7099999999999999e-002 | AB135: 2.e-002 | AC135: -3.8e-003 | AD135: -6.0999999999999995e-003 | AE135: 83.49 | AF135: 86.86 | AG135: 0.61 | AH135: AA- | AI135: 6.6199999999999995e-002 | AJ135: =H135+100*O135 -> 116.60000000000001 | AK135: 116 | AL135: 90 | AM135: 29.2 | AN135: 138 | AO135: 6.7000000000000004e-002 | AP135: 15 | AQ135: 雪榕转债
A136: 51 | B136: 123075 | C136: 贝斯转债! | D136: 300580 | E136: 贝斯特 | F136: 汽车 | G136: 零部件制 | H136: 99.62 | I136: 2.2000000000000001e-003 | J136: -2.9999999999999997e-004 | K136: 18.48 | L136: 3.8e-003 | M136: 115.5 | N136: 23.99 | O136: 0.29299999999999998 | P136: 77.03 | Q136: 2月2天 | R136: 5.66年 | S136: 3.66年 | T136: 6 | U136: 4.6 | V136: 8.0000000000000002e-003 | W136: 0.16200000000000001 | X136: 0.125 | Y136: 37 | Z136: 2.3 | AA136: 2.7000000000000003e-002 | AB136: 2.1899999999999999e-002 | AC136: 1.1000000000000001e-002 | AD136: 9.0000000000000011e-003 | AE136: 81.44 | AF136: 80.95 | AG136: 0.51 | AH136: AA- | AI136: 6.6199999999999995e-002 | AJ136: =H136+100*O136 -> 128.92000000000002 | AK136: 122.2 | AL136: 162 | AM136: 40.8 | AN136: 235 | AO136: 2.5000000000000001e-002 | AP136: 7 | AQ136: 贝斯转债!
A137: 74 | B137: 128131 | C137: 崇达转2! | D137: 2815 | E137: 崇达技术 | F137: 电子 | G137: 元器件制 | H137: 99.99 | I137: 2.0299999999999999e-002 | J137: -1.8200000000000001e-002 | K137: 12.87 | L137: 9.3999999999999986e-003 | M137: 115.2 | N137: 19.54 | O137: 0.51800000000000002 | P137: 65.86 | Q137: 6.0天 | R137: 5.51年 | S137: 3.51年 | T137: 14 | U137: 11 | V137: 8.0000000000000002e-003 | W137: 0.12300000000000001 | X137: 8.1000000000000003e-002 | Y137: 114 | Z137: 2.84 | AA137: 2.6499999999999999e-002 | AB137: 2.1400000000000002e-002 | AC137: 1.01e-002 | AD137: 8.1000000000000013e-003 | AE137: 88.28 | AF137: 90.73 | AG137: 0.23 | AH137: AA | AI137: 4.5199999999999997e-002 | AJ137: =H137+100*O137 -> 151.78999999999999 | AK137: 134.1 | AL137: 239 | AM137: 43.4 | AN137: 249 | AO137: 2.9999999999999999e-002 | AP137: 6 | AQ137: 崇达转2!
A138: 101 | B138: 113037 | C138: 紫银转债 | D138: 601860 | E138: 紫金银行 | F138: 金融 | G138: 银行行业 | H138: 101 | I138: 3.4000000000000002e-003 | J138: -2.3e-003 | K138: 3.95 | L138: 2.5000000000000001e-003 | M138: 115.8 | N138: 4.75 | O138: 0.215 | P138: 83.16 | Q138: 转股中 | R138: 5.38年 | S138: 无权 | T138: 45 | U138: 15 | V138: 3.0000000000000001e-003 | W138: 0.311 | X138: 0.25900000000000001 | Y138: 145 | Z138: 1.02 | AA138: 2.63e-002 | AB138: 2.0799999999999999e-002 | AC138: 无权 | AD138: 无权 | AE138: 无权 | AF138: 92.67 | AG138: 0.42 | AH138: AA+ | AI138: 4.3200000000000002e-002 | AJ138: =H138+100*O138 -> 122.5 | AK138: 118.8 | AL138: 117 | AM138: 26.2 | AN138: 109 | AO138: 1.7000000000000001e-002 | AP138: 18 | AQ138: 紫银转债
A139: 100 | B139: 128122 | C139: 兴森转债! | D139: 2436 | E139: 兴森科技 | F139: 电子 | G139: 元器件制 | H139: 101.455 | I139: -5.1000000000000004e-003 | J139: 5.8999999999999999e-003 | K139: 9.39 | L139: 4.3e-003 | M139: 113.3 | N139: 14.18 | O139: 0.53200000000000003 | P139: 66.22 | Q139: 转股中 | R139: 4.38年 | S139: 3.38年 | T139: 2.69 | U139: 1.8 | V139: 6.9999999999999993e-003 | W139: 1.9e-002 | X139: 1.3000000000000001e-002 | Y139: 140 | Z139: 4.42 | AA139: 2.58e-002 | AB139: 2.0199999999999999e-002 | AC139: 6.0999999999999995e-003 | AD139: 4.0000000000000001e-003 | AE139: 89.1 | AF139: 94.08 | AG139: 0.18 | AH139: AA | AI139: 4.3899999999999995e-002 | AJ139: =H139+100*O139 -> 154.655 | AK139: 136.7 | AL139: 256 | AM139: 42.6 | AN139: 244 | AO139: 6.5000000000000002e-002 | AP139: 11 | AQ139: 兴森转债!
A140: 30 | B140: 128140 | C140: 润建转债! | D140: 2929 | E140: 润建股份 | F140: 通信互联 | G140: 通信设备 | H140: 100 | I140: 9.1999999999999998e-003 | J140: 2.9999999999999997e-004 | K140: 25.56 | L140: 1.6299999999999999e-002 | M140: 115.2 | N140: 26.55 | O140: 3.9e-002 | P140: 96.27 | Q140: 3月8天 | R140: 5.76年 | S140: 3.76年 | T140: 10.9 | U140: 13 | V140: 1.2e-002 | W140: 0.193 | X140: 0.18600000000000003 | Y140: 56 | Z140: 1.9 | AA140: 2.53e-002 | AB140: 2.0400000000000001e-002 | AC140: 9.3999999999999986e-003 | AD140: 7.4999999999999997e-003 | AE140: 87.31 | AF140: 89.73 | AG140: 0.58 | AH140: AA | AI140: 4.5199999999999997e-002 | AJ140: =H140+100*O140 -> 103.90000000000001 | AK140: 103.7 | AL140: 9 | AM140: 14 | AN140: 15 | AO140: 8.8000000000000009e-002 | AP140: 9 | AQ140: 润建转债!
A141: 70 | B141: 128133 | C141: 奇正转债! | D141: 2287 | E141: 奇正藏药 | F141: 医药 | G141: 中药 | H141: 102.45 | I141: 5.0000000000000001e-004 | J141: 2.2000000000000001e-003 | K141: 24.44 | L141: 6.6e-003 | M141: 117.3 | N141: 30.12 | O141: 0.26300000000000001 | P141: 81.14 | Q141: 23天 | R141: 5.55年 | S141: 3.55年 | T141: 8 | U141: 8.2 | V141: 1.e-002 | W141: 6.2e-002 | X141: 5.0000000000000003e-002 | Y141: 130 | Z141: 5.39 | AA141: 2.52e-002 | AB141: 1.95e-002 | AC141: 3.5999999999999999e-003 | AD141: 1.6000000000000001e-003 | AE141: 88.22 | AF141: 92.23 | AG141: 0.4 | AH141: AA | AI141: 4.5199999999999997e-002 | AJ141: =H141+100*O141 -> 128.75 | AK141: 123.8 | AL141: 179 | AM141: 31.5 | AN141: 166 | AO141: -1.6e-002 | AP141: 13 | AQ141: 奇正转债!
A142: 191 | B142: 113030 | C142: 东风转债! | D142: 601515 | E142: 东风股份 | F142: 造纸包装 | G142: 包装材料 | H142: 104.04 | I142: 8.8999999999999999e-003 | J142: -1.4000000000000002e-003 | K142: 6.01 | L142: 1.6899999999999998e-002 | M142: 116.9 | N142: 6.75 | O142: 0.16899999999999998 | P142: 89.04 | Q142: 转股中 | R142: 4.80年 | S142: 2.81年 | T142: 2.95 | U142: 12 | V142: 3.7999999999999999e-002 | W142: 3.7000000000000005e-002 | X142: 3.3000000000000002e-002 | Y142: 80 | Z142: 1.93 | AA142: 2.5000000000000001e-002 | AB142: 1.8600000000000002e-002 | AC142: -2.0999999999999999e-003 | AD142: -4.3e-003 | AE142: 91.11 | AF142: 95.47 | AG142: 0.44 | AH142: AA | AI142: 4.3899999999999995e-002 | AJ142: =H142+100*O142 -> 120.94 | AK142: 119 | AL142: 122 | AM142: 23.6 | AN142: 83 | AO142: 4.4999999999999998e-002 | AP142: 17 | AQ142: 东风转债!
A143: 105 | B143: 113594 | C143: 淳中转债! | D143: 603516 | E143: 淳中科技 | F143: 电子 | G143: 电子产品 | H143: 106.62 | I143: -1.34e-002 | J143: 1.2e-002 | K143: 36.02 | L143: -2.2000000000000001e-003 | M143: 121.4 | N143: 39.37 | O143: 0.16500000000000001 | P143: 91.49 | Q143: 转股中 | R143: 5.38年 | S143: 3.38年 | T143: 3 | U143: 10 | V143: 3.1e-002 | W143: 6.2e-002 | X143: 5.7000000000000002e-002 | Y143: 48 | Z143: 5.34 | AA143: 2.5000000000000001e-002 | AB143: 1.8000000000000002e-002 | AC143: -5.5000000000000005e-003 | AD143: -8.0000000000000002e-003 | AE143: 80.62 | AF143: 82.2 | AG143: 0.63 | AH143: A+ | AI143: 7.7199999999999991e-002 | AJ143: =H143+100*O143 -> 123.12 | AK143: 121.7 | AL143: 155 | AM143: 39.5 | AN143: 228 | AO143: 0.151 | AP143: 8 | AQ143: 淳中转债!
A144: 300 | B144: 127006 | C144: 敖东转债! | D144: 623 | E144: 吉林敖东 | F144: 金融 | G144: 证券行业 | H144: 100.395 | I144: -4.0000000000000002e-004 | J144: 3.0999999999999999e-003 | K144: 15.95 | L144: 1.21e-002 | M144: 108 | N144: 20.42 | O144: 0.28499999999999998 | P144: 78.11 | Q144: 转股中 | R144: 3年7天 | S144: 1年8天 | T144: 24.1 | U144: 37 | V144: 1.4999999999999999e-002 | W144: 0.13 | X144: 0.10099999999999999 | Y144: 186 | Z144: 0.82 | AA144: 2.4900000000000002e-002 | AB144: 1.9699999999999999e-002 | AC144: 1.0700000000000001e-002 | AD144: 7.9000000000000008e-003 | AE144: 96.86 | AF144: 95.59 | AG144: 0.23 | AH144: AA+ | AI144: 4.1900000000000007e-002 | AJ144: =H144+100*O144 -> 128.89499999999998 | AK144: 122.7 | AL144: 168 | AM144: 25.8 | AN144: 104 | AO144: 2.5000000000000001e-002 | AP144: 27 | AQ144: 敖东转债!
A145: 84 | B145: 110074 | C145: 精达转债! | D145: 600577 | E145: 精达股份 | F145: 电子 | G145: 电子产品 | H145: 102.85 | I145: -1.0200000000000001e-002 | J145: -1.5800000000000002e-002 | K145: 3.55 | L145: -4.8300000000000003e-002 | M145: 117.3 | N145: 3.75 | O145: 8.5999999999999993e-002 | P145: 94.67 | Q145: 转股中 | R145: 5.45年 | S145: 3.46年 | T145: 7.87 | U145: 18 | V145: 2.3e-002 | W145: 0.115 | X145: 0.109 | Y145: 68 | Z145: 1.93 | AA145: 2.4900000000000002e-002 | AB145: 1.9099999999999999e-002 | AC145: 2.5999999999999999e-003 | AD145: 5.0000000000000001e-004 | AE145: 88.58 | AF145: 92.61 | AG145: 0.54 | AH145: AA | AI145: 4.5199999999999997e-002 | AJ145: =H145+100*O145 -> 111.44999999999999 | AK145: 111 | AL145: 43 | AM145: 18.4 | AN145: 39 | AO145: 0.13500000000000001 | AP145: 13 | AQ145: 精达转债!
A146: 164 | B146: 123045 | C146: 雷迪转债 | D146: 300652 | E146: 雷迪克 | F146: 汽车 | G146: 零部件制 | H146: 106 | I146: 2.1299999999999999e-002 | J146: -7.3000000000000001e-003 | K146: 19.9 | L146: 2.1000000000000001e-002 | M146: 119.4 | N146: 20.13 | O146: 7.2000000000000008e-002 | P146: 98.86 | Q146: 转股中 | R146: 5年6.0天 | S146: 3年7天 | T146: 1.66 | U146: 30 | V146: 0.17399999999999999 | W146: 8.900000000000001e-002 | X146: 8.8000000000000009e-002 | Y146: 19 | Z146: 2.19 | AA146: 2.46e-002 | AB146: 1.77e-002 | AC146: -4.3e-003 | AD146: -7.0999999999999995e-003 | AE146: 82.8 | AF146: 83.05 | AG146: 0.67 | AH146: A+ | AI146: 7.7199999999999991e-002 | AJ146: =H146+100*O146 -> 113.2 | AK146: 113.1 | AL146: 64 | AM146: 30.1 | AN146: 152 | AO146: 0.17300000000000001 | AP146: 35 | AQ146: 雷迪转债
A147: 177 | B147: 113565 | C147: 宏辉转债 | D147: 603336 | E147: 宏辉果蔬 | F147: 农业 | G147: 农产品加 | H147: 104.75 | I147: 6.3e-003 | J147: -1.0200000000000001e-002 | K147: 9.77 | L147: -6.0999999999999995e-003 | M147: 117.8 | N147: 10 | O147: 7.2000000000000008e-002 | P147: 97.7 | Q147: 转股中 | R147: 4.98年 | S147: 2.98年 | T147: 2.25 | U147: 45 | V147: 0.192 | W147: 6.8000000000000005e-002 | X147: 6.7000000000000004e-002 | Y147: 33 | Z147: 3.47 | AA147: 2.4399999999999998e-002 | AB147: 1.7899999999999999e-002 | AC147: -3.2000000000000002e-003 | AD147: -5.5000000000000005e-003 | AE147: 85.26 | AF147: 86.71 | AG147: 0.63 | AH147: AA- | AI147: 6.4899999999999999e-002 | AJ147: =H147+100*O147 -> 111.95 | AK147: 111.8 | AL147: 51 | AM147: 25.1 | AN147: 95 | AO147: 3.9e-002 | AP147: 24 | AQ147: 宏辉转债
A148: 136 | B148: 123051 | C148: 今天转债 | D148: 300532 | E148: 今天国际 | F148: 计算机及 | G148: 软件开发 | H148: 108.562 | I148: 8.8999999999999999e-003 | J148: 2.0000000000000001e-004 | K148: 9.26 | L148: 1.3100000000000001e-002 | M148: 122.8 | N148: 8.8 | O148: 3.2000000000000001e-002 | P148: 105.23 | Q148: 转股中 | R148: 5.25年 | S148: 3.25年 | T148: 2.8 | U148: 3 | V148: 1.e-002 | W148: 0.111 | X148: 0.11599999999999999 | Y148: 25 | Z148: 3.18 | AA148: 2.4399999999999998e-002 | AB148: 1.67e-002 | AC148: -1.06e-002 | AD148: -1.32e-002 | AE148: 81.53 | AF148: 83.98 | AG148: 0.7 | AH148: A+ | AI148: 7.7199999999999991e-002 | AJ148: =H148+100*O148 -> 111.762 | AK148: 111.9 | AL148: 53 | AM148: 27.9 | AN148: 130 | AO148: 5.2999999999999999e-002 | AP148: 15 | AQ148: 今天转债
A149: 95 | B149: 128124 | C149: 科华转债! | D149: 2022 | E149: 科华生物 | F149: 医药 | G149: 生物制药 | H149: 97.121 | I149: 3.8e-003 | J149: -2.0999999999999999e-003 | K149: 15.75 | L149: 5.1000000000000004e-003 | M149: 110.3 | N149: 21.51 | O149: 0.32600000000000001 | P149: 73.22 | Q149: 转股中 | R149: 5.39年 | S149: 3.40年 | T149: 7.38 | U149: 2.9 | V149: 4.0000000000000001e-003 | W149: 9.0999999999999998e-002 | X149: 6.7000000000000004e-002 | Y149: 81 | Z149: 2.82 | AA149: 2.4300000000000002e-002 | AB149: 2.06e-002 | AC149: 1.6899999999999998e-002 | AD149: 1.52e-002 | AE149: 88.15 | AF149: 87.25 | AG149: 0.34 | AH149: AA | AI149: 4.5199999999999997e-002 | AJ149: =H149+100*O149 -> 129.721 | AK149: 121 | AL149: 147 | AM149: 32.9 | AN149: 176 | AO149: 4.0000000000000001e-003 | AP149: 17 | AQ149: 科华转债!
A150: 97 | B150: 123062 | C150: 三超转债 | D150: 300554 | E150: 三超新材 | F150: 机械装备 | G150: 通用设备 | H150: 105.942 | I150: 5.7999999999999996e-003 | J150: 1.1299999999999999e-002 | K150: 16.91 | L150: 2.3599999999999999e-002 | M150: 119.7 | N150: 17.17 | O150: 7.5999999999999998e-002 | P150: 98.49 | Q150: 转股中 | R150: 5.39年 | S150: 3.39年 | T150: 1.95 | U150: 15 | V150: 7.0999999999999994e-002 | W150: 0.12300000000000001 | X150: 0.121 | Y150: 16 | Z150: 3.03 | AA150: 2.35e-002 | AB150: 1.6899999999999998e-002 | AC150: -3.5999999999999999e-003 | AD150: -6.0000000000000001e-003 | AE150: 77.98 | AF150: 77.14 | AG150: 0.72 | AH150: A | AI150: 8.72e-002 | AJ150: =H150+100*O150 -> 113.54199999999999 | AK150: 113.4 | AL150: 68 | AM150: 35.4 | AN150: 195 | AO150: -9.0000000000000011e-003 | AP150: 16 | AQ150: 三超转债
A151: 29 | B151: 113612 | C151: 永冠转债 | D151: 603681 | E151: 永冠新材 | F151: 化工 | G151: 其他 | H151: 106.32 | I151: 9.7000000000000003e-003 | J151: -1.1299999999999999e-002 | K151: 21.23 | L151: -2.3e-003 | M151: 121.2 | N151: 20.79 | O151: 4.0999999999999995e-002 | P151: 102.12 | Q151: 3月11天 | R151: 5.76年 | S151: 3.76年 | T151: 5.2 | U151: 15 | V151: 2.7999999999999997e-002 | W151: 0.14699999999999999 | X151: 0.14999999999999999 | Y151: 35 | Z151: 2.39 | AA151: 2.35e-002 | AB151: 1.7000000000000001e-002 | AC151: -5.4000000000000003e-003 | AD151: -7.4000000000000003e-003 | AE151: 81.17 | AF151: 84.45 | AG151: 0.68 | AH151: AA- | AI151: 6.6199999999999995e-002 | AJ151: =H151+100*O151 -> 110.41999999999999 | AK151: 110.5 | AL151: 38 | AM151: 26.1 | AN151: 107 | AO151: 4.4000000000000004e-002 | AP151: 4 | AQ151: 永冠转债
A152: 339 | B152: 110031 | C152: 航信转债!! | D152: 600271 | E152: 航天信息 | F152: 计算机及 | G152: 软件开发 | H152: 106.33 | I152: 5.0000000000000001e-004 | J152: -5.0000000000000001e-004 | K152: 11.57 | L152: 8.6999999999999994e-003 | M152: 107 | N152: 21.56 | O152: 0.98099999999999998 | P152: 53.66 | Q152: 转股中 | R152: 0.27年 | S152: 回售内 | T152: 24 | U152: 10 | V152: 4.0000000000000001e-003 | W152: 0.11199999999999999 | X152: 5.9999999999999998e-002 | Y152: 214 | Z152: 1.86 | AA152: 2.3399999999999997e-002 | AB152: -2.5099999999999997e-002 | AC152: 回售内 | AD152: 回售内 | AE152: 100.27 | AF152: 106.15 | AG152: 0 | AH152: AAA | AI152: 2.9900000000000003e-002 | AJ152: =H152+100*O152 -> 204.43000000000001 | AK152: 159 | AL152: 303 | AM152: 52.8 | AN152: 278 | AO152: 4.0999999999999995e-002 | AP152: 15 | AQ152: 航信转债!!
A153: 133 | B153: 123052 | C153: 飞鹿转债 | D153: 300665 | E153: 飞鹿股份 | F153: 化工 | G153: 化工 | H153: 113.549 | I153: -1.1999999999999999e-003 | J153: 4.4000000000000003e-003 | K153: 10.96 | L153: 4.5999999999999999e-003 | M153: 127.3 | N153: 9.9 | O153: 2.6000000000000002e-002 | P153: 110.71 | Q153: 转股中 | R153: 5.25年 | S153: 3.25年 | T153: 1.77 | U153: 17 | V153: 8.5999999999999993e-002 | W153: 0.13300000000000001 | X153: 0.14699999999999999 | Y153: 13 | Z153: 2.83 | AA153: 2.2599999999999999e-002 | AB153: 1.38e-002 | AC153: -2.23e-002 | AD153: -2.52e-002 | AE153: 81.92 | AF153: 87.08 | AG153: 0.7 | AH153: A+ | AI153: 7.7199999999999991e-002 | AJ153: =H153+100*O153 -> 116.149 | AK153: 116.4 | AL153: 95 | AM153: 29.3 | AN153: 141 | AO153: 0.10099999999999999 | AP153: 15 | AQ153: 飞鹿转债
A154: 60 | B154: 123072 | C154: 乐歌转债! | D154: 300729 | E154: 乐歌股份 | F154: 其他 | G154: 家居用品 | H154: 114.85 | I154: -2.3e-003 | J154: 1.2199999999999999e-002 | K154: 39.86 | L154: 4.6199999999999998e-002 | M154: 129.6 | N154: 73.13 | O154: 1.1100000000000001 | P154: 54.51 | Q154: 53天 | R154: 5.63年 | S154: 3.63年 | T154: 1.42 | U154: 80 | V154: 0.48599999999999999 | W154: 2.6000000000000002e-002 | X154: 1.3999999999999999e-002 | Y154: 55 | Z154: 5.81 | AA154: 2.23e-002 | AB154: 1.3600000000000001e-002 | AC154: -1.95e-002 | AD154: -2.2700000000000001e-002 | AE154: 80.79 | AF154: 86.39 | AG154: 0.21 | AH154: A+ | AI154: 7.7199999999999991e-002 | AJ154: =H154+100*O154 -> 225.85000000000002 | AK154: 175.2 | AL154: 315 | AM154: 88.8 | AN154: 315 | AO154: 7.5999999999999998e-002 | AP154: 7 | AQ154: 乐歌转债!
A155: 186 | B155: 113561 | C155: 正裕转债! | D155: 603089 | E155: 正裕工业 | F155: 汽车 | G155: 零部件制 | H155: 106.65 | I155: 8.2899999999999988e-002 | J155: -1.5700000000000002e-002 | K155: 10.21 | L155: 0.10000000000000001 | M155: 118 | N155: 10.23 | O155: 6.9000000000000006e-002 | P155: 99.8 | Q155: 转股中 | R155: 4.82年 | S155: 2.82年 | T155: 1.5 | U155: 248 | V155: 1.55 | W155: 6.6000000000000003e-002 | X155: 6.6000000000000003e-002 | Y155: 23 | Z155: 2.44 | AA155: 2.1700000000000001e-002 | AB155: 1.49e-002 | AC155: -7.9000000000000008e-003 | AD155: -1.06e-002 | AE155: 83.91 | AF155: 83.62 | AG155: 0.67 | AH155: A+ | AI155: 7.5899999999999995e-002 | AJ155: =H155+100*O155 -> 113.55000000000001 | AK155: 113.5 | AL155: 69 | AM155: 29.6 | AN155: 145 | AO155: 0.27899999999999997 | AP155: 33 | AQ155: 正裕转债!
A156: 71 | B156: 123067 | C156: 斯莱转债 | D156: 300382 | E156: 斯莱克 | F156: 机械装备 | G156: 专用设备 | H156: 108 | I156: 4.0500000000000001e-002 | J156: 1.6500000000000001e-002 | K156: 8.8 | L156: 9.3200000000000005e-002 | M156: 121.2 | N156: 9.38 | O156: 0.151 | P156: 93.82 | Q156: 18天 | R156: 5.53年 | S156: 3.54年 | T156: 3.88 | U156: 23 | V156: 5.5999999999999994e-002 | W156: 7.8e-002 | X156: 7.2999999999999995e-002 | Y156: 50 | Z156: 4.87 | AA156: 2.1499999999999998e-002 | AB156: 1.4800000000000001e-002 | AC156: -9.8999999999999991e-003 | AD156: -1.2e-002 | AE156: 82.34 | AF156: 85.67 | AG156: 0.61 | AH156: AA- | AI156: 6.6199999999999995e-002 | AJ156: =H156+100*O156 -> 123.09999999999999 | AK156: 122.2 | AL156: 160 | AM156: 36.5 | AN156: 206 | AO156: 5.0999999999999997e-002 | AP156: 14 | AQ156: 斯莱转债
A157: 308 | B157: 128033 | C157: 迪龙转债! | D157: 2658 | E157: 雪迪龙 | F157: 城市公用 | G157: 三废处理 | H157: 102.6 | I157: -2.0099999999999996e-002 | J157: 3.56e-002 | K157: 8.21 | L157: 3.5299999999999998e-002 | M157: 108.8 | N157: 8.83 | O157: 0.10300000000000001 | P157: 92.98 | Q157: 转股中 | R157: 2.81年 | S157: 0.81年 | T157: 5.2 | U157: 587 | V157: 1.0900000000000001 | W157: 0.105 | X157: 9.6999999999999989e-002 | Y157: 50 | Z157: 2.45 | AA157: 2.1400000000000002e-002 | AB157: 1.5300000000000001e-002 | AC157: -1.0500000000000001e-002 | AD157: -1.3500000000000002e-002 | AE157: 97.53 | AF157: 97.01 | AG157: 0.44 | AH157: AA | AI157: 4.2199999999999994e-002 | AJ157: =H157+100*O157 -> 112.89999999999999 | AK157: 112.2 | AL157: 54 | AM157: 14.7 | AN157: 18 | AO157: 0.5 | AP157: 39 | AQ157: 迪龙转债!
A158: 187 | B158: 128091 | C158: 新天转债 | D158: 2873 | E158: 新天药业 | F158: 医药 | G158: 中药 | H158: 108.13 | I158: 2.0000000000000001e-004 | J158: 4.6999999999999993e-003 | K158: 15.98 | L158: 7.6e-003 | M158: 119.4 | N158: 16.39 | O158: 0.109 | P158: 97.5 | Q158: 转股中 | R158: 4.82年 | S158: 2.82年 | T158: 1.76 | U158: 7.7 | V158: 4.0000000000000001e-002 | W158: 9.4e-002 | X158: 9.1999999999999998e-002 | Y158: 19 | Z158: 2.48 | AA158: 2.1299999999999999e-002 | AB158: 1.41e-002 | AC158: -1.15e-002 | AD158: -1.44e-002 | AE158: 84.19 | AF158: 84.67 | AG158: 0.66 | AH158: A+ | AI158: 7.5899999999999995e-002 | AJ158: =H158+100*O158 -> 119.03 | AK158: 118.8 | AL158: 115 | AM158: 34.1 | AN158: 183 | AO158: 2.2000000000000002e-002 | AP158: 18 | AQ158: 新天转债
A159: 11 | B159: 123092 | C159: 天壕转债 | D159: 300332 | E159: 天壕环境 | F159: 石油天然 | G159: 天然气 | H159: 108.1 | I159: -1.49e-002 | J159: 6.8000000000000005e-003 | K159: 5.14 | L159: -1.15e-002 | M159: 121.6 | N159: 5.2 | O159: 9.4e-002 | P159: 98.85 | Q159: 3月27天 | R159: 5.80年 | S159: 3.81年 | T159: 4.23 | U159: 481 | V159: 1.02 | W159: 9.3000000000000013e-002 | X159: 9.1999999999999998e-002 | Y159: 45 | Z159: 1.31 | AA159: 2.0899999999999998e-002 | AB159: 1.44e-002 | AC159: -8.3000000000000001e-003 | AD159: -1.0500000000000001e-002 | AE159: 78.12 | AF159: 79.77 | AG159: 0.69 | AH159: A+ | AI159: 7.7199999999999991e-002 | AJ159: =H159+100*O159 -> 117.5 | AK159: 117.4 | AL159: 103 | AM159: 37.6 | AN159: 214 | AO159: 0.13800000000000001 | AP159: 5 | AQ159: 天壕转债
A160: 283 | B160: 113516 | C160: 苏农转债! | D160: 603323 | E160: 苏农银行 | F160: 金融 | G160: 银行行业 | H160: 106.7 | I160: -6.5000000000000006e-003 | J160: 8.1000000000000013e-003 | K160: 4.92 | L160: 4.0999999999999995e-003 | M160: 114.3 | N160: 5.52 | O160: 0.19699999999999998 | P160: 89.13 | Q160: 转股中 | R160: 3.41年 | S160: 无权 | T160: 12.9 | U160: 5.6 | V160: 4.0000000000000001e-003 | W160: 0.14499999999999999 | X160: 0.13 | Y160: 89 | Z160: 0.75 | AA160: 2.0799999999999999e-002 | AB160: 1.3000000000000001e-002 | AC160: 无权 | AD160: 无权 | AE160: 无权 | AF160: 99.66 | AG160: 0.39 | AH160: AA+ | AI160: 4.1900000000000007e-002 | AJ160: =H160+100*O160 -> 126.40000000000001 | AK160: 124.3 | AL160: 183 | AM160: 24.6 | AN160: 92 | AO160: 2.9999999999999999e-002 | AP160: 33 | AQ160: 苏农转债!
A161: 226 | B161: 128071 | C161: 合兴转债! | D161: 2228 | E161: 合兴包装 | F161: 造纸包装 | G161: 包装材料 | H161: 104.99 | I161: 8.5000000000000006e-003 | J161: -3.4999999999999996e-003 | K161: 3.98 | L161: 1.0200000000000001e-002 | M161: 114.8 | N161: 4.28 | O161: 0.129 | P161: 92.99 | Q161: 转股中 | R161: 4.45年 | S161: 2.45年 | T161: 3 | U161: 7.2 | V161: 2.3e-002 | W161: 6.0999999999999999e-002 | X161: 5.7000000000000002e-002 | Y161: 49 | Z161: 1.48 | AA161: 2.07e-002 | AB161: 1.4499999999999999e-002 | AC161: -6.1999999999999998e-003 | AD161: -8.6999999999999994e-003 | AE161: 92.42 | AF161: 95.19 | AG161: 0.49 | AH161: AA | AI161: 4.3899999999999995e-002 | AJ161: =H161+100*O161 -> 117.89 | AK161: 117 | AL161: 100 | AM161: 21.8 | AN161: 63 | AO161: 2.7000000000000003e-002 | AP161: 26 | AQ161: 合兴转债!
A162: 258 | B162: 110053 | C162: 苏银转债! | D162: 600919 | E162: 江苏银行 | F162: 金融 | G162: 银行行业 | H162: 110.08 | I162: 1.6000000000000001e-003 | J162: -1.e-003 | K162: 6.01 | L162: 1.7000000000000001e-003 | M162: 119.1 | N162: 6.69 | O162: 0.22500000000000001 | P162: 89.84 | Q162: 转股中 | R162: 4年8天 | S162: 无权 | T162: 200 | U162: 105 | V162: 5.0000000000000001e-003 | W162: 0.22500000000000001 | X162: 0.20199999999999999 | Y162: 888 | Z162: 0.59 | AA162: 2.0499999999999997e-002 | AB162: 1.1899999999999999e-002 | AC162: 无权 | AD162: 无权 | AE162: 无权 | AF162: 102.69 | AG162: 0.39 | AH162: AAA | AI162: 3.8900000000000004e-002 | AJ162: =H162+100*O162 -> 132.57999999999998 | AK162: 130.3 | AL162: 219 | AM162: 27.6 | AN162: 128 | AO162: 4.4999999999999998e-002 | AP162: 44 | AQ162: 苏银转债!
A163: 134 | B163: 113584 | C163: 家悦转债! | D163: 603708 | E163: 家家悦 | F163: 商业零售 | G163: 超市 | H163: 104.01 | I163: 3.0000000000000001e-003 | J163: 4.0999999999999995e-003 | K163: 24.83 | L163: 3.4200000000000001e-002 | M163: 115.3 | N163: 37.97 | O163: 0.59099999999999997 | P163: 65.39 | Q163: 转股中 | R163: 5.25年 | S163: 3.25年 | T163: 6.45 | U163: 19 | V163: 2.7999999999999997e-002 | W163: 4.2999999999999997e-002 | X163: 2.7999999999999997e-002 | Y163: 151 | Z163: 5.03 | AA163: 2.0199999999999999e-002 | AB163: 1.49e-002 | AC163: -5.9999999999999995e-004 | AD163: -2.7000000000000001e-003 | AE163: 89.39 | AF163: 91.87 | AG163: 0.21 | AH163: AA | AI163: 4.5199999999999997e-002 | AJ163: =H163+100*O163 -> 163.11000000000001 | AK163: 142.6 | AL163: 273 | AM163: 50.8 | AN163: 270 | AO163: 0.158 | AP163: 9 | AQ163: 家悦转债!
A164: 107 | B164: 113593 | C164: 沪工转债 | D164: 603131 | E164: 上海沪工 | F164: 机械装备 | G164: 通用设备 | H164: 109.51 | I164: 3.4999999999999996e-003 | J164: -7.3000000000000001e-003 | K164: 21.48 | L164: -5.6000000000000008e-003 | M164: 121.6 | N164: 21.32 | O164: 8.6999999999999994e-002 | P164: 100.75 | Q164: 转股中 | R164: 5.37年 | S164: 3.38年 | T164: 4 | U164: 17 | V164: 4.0000000000000001e-002 | W164: 5.9000000000000004e-002 | X164: 5.9000000000000004e-002 | Y164: 68 | Z164: 5.54 | AA164: 2.0099999999999996e-002 | AB164: 1.3100000000000001e-002 | AC164: -1.3000000000000001e-002 | AD164: -1.54e-002 | AE164: 80.63 | AF164: 82.33 | AG164: 0.69 | AH164: A+ | AI164: 7.7199999999999991e-002 | AJ164: =H164+100*O164 -> 118.21000000000001 | AK164: 118.3 | AL164: 107 | AM164: 35.9 | AN164: 203 | AO164: 5.5e-002 | AP164: 9 | AQ164: 沪工转债
A165: 80 | B165: 113039 | C165: 嘉泽转债! | D165: 601619 | E165: 嘉泽新能 | F165: 能源电力 | G165: 风能 | H165: 101.89 | I165: 1.1299999999999999e-002 | J165: -7.8000000000000005e-003 | K165: 3.48 | L165: 5.7999999999999996e-003 | M165: 113.1 | N165: 3.57 | O165: 4.4999999999999998e-002 | P165: 97.48 | Q165: 转股中 | R165: 5.47年 | S165: 3.47年 | T165: 13 | U165: 35 | V165: 2.7000000000000003e-002 | W165: 0.17999999999999999 | X165: 0.17600000000000002 | Y165: 72 | Z165: 2.11 | AA165: 1.9599999999999999e-002 | AB165: 1.5100000000000001e-002 | AC165: 4.5999999999999999e-003 | AD165: 2.7000000000000001e-003 | AE165: 88.34 | AF165: 89.22 | AG165: 0.6 | AH165: AA | AI165: 4.5199999999999997e-002 | AJ165: =H165+100*O165 -> 106.39 | AK165: 106.3 | AL165: 17 | AM165: 17.1 | AN165: 28 | AO165: 5.2000000000000005e-002 | AP165: 22 | AQ165: 嘉泽转债!
A166: 21 | B166: 113044 | C166: 大秦转债! | D166: 601006 | E166: 大秦铁路 | F166: 铁路 | G166: 铁路运输 | H166: 102.33 | I166: 2.3999999999999998e-003 | J166: 4.1999999999999997e-003 | K166: 6.76 | L166: 1.3500000000000002e-002 | M166: 114.1 | N166: 7.66 | O166: 0.16 | P166: 88.25 | Q166: 3月15天 | R166: 5.78年 | S166: 3.78年 | T166: 320 | U166: 235 | V166: 6.9999999999999993e-003 | W166: 0.318 | X166: 0.28100000000000003 | Y166: 1005. | Z166: 0.86 | AA166: 1.9400000000000001e-002 | AB166: 1.4800000000000001e-002 | AC166: 4.0000000000000001e-003 | AD166: 2.e-003 | AE166: 89.08 | AF166: 91.27 | AG166: 0.49 | AH166: AAA | AI166: 4.0199999999999993e-002 | AJ166: =H166+100*O166 -> 118.33 | AK166: 116.4 | AL166: 96 | AM166: 25.1 | AN166: 96 | AO166: 3.9e-002 | AP166: 12 | AQ166: 大秦转债!
A167: 78 | B167: 128129 | C167: 青农转债 | D167: 2958 | E167: 青农商行 | F167: 金融 | G167: 银行行业 | H167: 101.205 | I167: 0. | J167: 8.0000000000000004e-004 | K167: 4.64 | L167: 2.2000000000000001e-003 | M167: 112.2 | N167: 5.74 | O167: 0.252 | P167: 80.84 | Q167: 转股中 | R167: 5.47年 | S167: 无权 | T167: 50 | U167: 28 | V167: 6.0000000000000001e-003 | W167: 0.19399999999999998 | X167: 0.157 | Y167: 258 | Z167: 1 | AA167: 1.9299999999999998e-002 | AB167: 1.5100000000000001e-002 | AC167: 无权 | AD167: 无权 | AE167: 无权 | AF167: 90.73 | AG167: 0.4 | AH167: AAA | AI167: 4.0199999999999993e-002 | AJ167: =H167+100*O167 -> 126.405 | AK167: 121.6 | AL167: 153 | AM167: 30.8 | AN167: 161 | AO167: 1.1000000000000001e-002 | AP167: 13 | AQ167: 青农转债
A168: 53 | B168: 113606 | C168: 荣泰转债 | D168: 603579 | E168: 荣泰健康 | F168: 机械装备 | G168: 专用设备 | H168: 109.01 | I168: -1.e-002 | J168: 8.6e-003 | K168: 30.15 | L168: -2.3e-003 | M168: 121.2 | N168: 33.32 | O168: 0.20499999999999999 | P168: 90.49 | Q168: 2月1天 | R168: 5.65年 | S168: 3.65年 | T168: 6 | U168: 1.8 | V168: 3.0000000000000001e-003 | W168: 0.14199999999999999 | X168: 0.129 | Y168: 42 | Z168: 2.67 | AA168: 1.9299999999999998e-002 | AB168: 1.2699999999999999e-002 | AC168: -1.21e-002 | AD168: -1.41e-002 | AE168: 81.73 | AF168: 85.03 | AG168: 0.59 | AH168: AA- | AI168: 6.6199999999999995e-002 | AJ168: =H168+100*O168 -> 129.50999999999999 | AK168: 127.5 | AL168: 200 | AM168: 42.5 | AN168: 243 | AO168: 4.4999999999999998e-002 | AP168: 8 | AQ168: 荣泰转债
A169: 55 | B169: 123073 | C169: 同和转债! | D169: 300636 | E169: 同和药业 | F169: 医药 | G169: 原料药 | H169: 110.21 | I169: 1.3000000000000001e-002 | J169: 6.0999999999999995e-003 | K169: 25.74 | L169: 2.5899999999999999e-002 | M169: 122.4 | N169: 23.8 | O169: 1.9e-002 | P169: 108.15 | Q169: 59天 | R169: 5.64年 | S169: 3.64年 | T169: 3.6 | U169: 70 | V169: 0.17100000000000001 | W169: 0.109 | X169: 0.11800000000000001 | Y169: 33 | Z169: 4.38 | AA169: 1.9199999999999998e-002 | AB169: 1.23e-002 | AC169: -1.38e-002 | AD169: -1.61e-002 | AE169: 79.04 | AF169: 81.25 | AG169: 0.74 | AH169: A+ | AI169: 7.7199999999999991e-002 | AJ169: =H169+100*O169 -> 112.11 | AK169: 112.3 | AL169: 55 | AM169: 31 | AN169: 163 | AO169: 0.105 | AP169: 9 | AQ169: 同和转债!
A170: 6 | B170: 113619 | C170: 世运转债! | D170: 603920 | E170: 世运电路 | F170: 电子 | G170: 元器件制 | H170: 103.2 | I170: 1.7000000000000001e-003 | J170: 6.3e-003 | K170: 19.62 | L170: 2.29e-002 | M170: 115.2 | N170: 26.5 | O170: 0.39399999999999996 | P170: 74.04 | Q170: 4月23天 | R170: 5.88年 | S170: 3.88年 | T170: 10 | U170: 3.5 | V170: 3.0000000000000001e-003 | W170: 0.124 | X170: 9.1999999999999998e-002 | Y170: 80 | Z170: 3.09 | AA170: 1.9199999999999998e-002 | AB170: 1.4499999999999999e-002 | AC170: 1.1999999999999999e-003 | AD170: -5.9999999999999995e-004 | AE170: 86.85 | AF170: 89.26 | AG170: 0.35 | AH170: AA | AI170: 4.5199999999999997e-002 | AJ170: =H170+100*O170 -> 142.59999999999999 | AK170: 132.4 | AL170: 232 | AM170: 43.1 | AN170: 246 | AO170: -4.0999999999999995e-002 | AP170: 2 | AQ170: 世运转债!
A171: 153 | B171: 128105 | C171: 长集转债 | D171: 2616 | E171: 长青集团 | F171: 城市公用 | G171: 三废处理 | H171: 105.09 | I171: 6.6e-003 | J171: -2.3e-003 | K171: 7.84 | L171: 7.7000000000000002e-003 | M171: 115.3 | N171: 8.11 | O171: 8.6999999999999994e-002 | P171: 96.67 | Q171: 转股中 | R171: 5年34天 | S171: 3年35天 | T171: 8 | U171: 17 | V171: 2.e-002 | W171: 0.13800000000000001 | X171: 0.13300000000000001 | Y171: 58 | Z171: 2.31 | AA171: 1.8799999999999997e-002 | AB171: 1.32e-002 | AC171: -3.8e-003 | AD171: -6.0999999999999995e-003 | AE171: 90.01 | AF171: 92.5 | AG171: 0.56 | AH171: AA | AI171: 4.5199999999999997e-002 | AJ171: =H171+100*O171 -> 113.79000000000001 | AK171: 113.5 | AL171: 70 | AM171: 21 | AN171: 55 | AO171: 0.11900000000000001 | AP171: 14 | AQ171: 长集转债
A172: 244 | B172: 113024 | C172: 核建转债! | D172: 601611 | E172: 中国核建 | F172: 建筑 | G172: 建筑工程 | H172: 102.01 | I172: 2.2000000000000001e-003 | J172: 5.0000000000000001e-004 | K172: 7.22 | L172: 1.1200000000000002e-002 | M172: 109.7 | N172: 9.76 | O172: 0.379 | P172: 73.98 | Q172: 转股中 | R172: 4年33天 | S172: 2年34天 | T172: 30 | U172: 3.1 | V172: 1.e-003 | W172: 0.157 | X172: 0.11599999999999999 | Y172: 191 | Z172: 1.77 | AA172: 1.83e-002 | AB172: 1.37e-002 | AC172: 5.1999999999999998e-003 | AD172: 2.3999999999999998e-003 | AE172: 94.76 | AF172: 94.16 | AG172: 0.24 | AH172: AAA | AI172: 3.8900000000000004e-002 | AJ172: =H172+100*O172 -> 139.91 | AK172: 130 | AL172: 216 | AM172: 35.3 | AN172: 194 | AO172: -3.0000000000000001e-003 | AP172: 42 | AQ172: 核建转债!
A173: 98 | B173: 128123 | C173: 国光转债! | D173: 2749 | E173: 国光股份 | F173: 化工 | G173: 农化 | H173: 105.58 | I173: 1.1000000000000001e-003 | J173: 8.6999999999999994e-003 | K173: 11.19 | L173: 1.8200000000000001e-002 | M173: 116.2 | N173: 13.7 | O173: 0.29299999999999998 | P173: 81.68 | Q173: 转股中 | R173: 5.39年 | S173: 3.39年 | T173: 3.2 | U173: 0.7 | V173: 2.e-003 | W173: 6.6000000000000003e-002 | X173: 5.4000000000000006e-002 | Y173: 48 | Z173: 3.92 | AA173: 1.83e-002 | AB173: 1.2800000000000001e-002 | AC173: -3.9000000000000003e-003 | AD173: -6.1999999999999998e-003 | AE173: 83.11 | AF173: 82.92 | AG173: 0.53 | AH173: AA- | AI173: 6.6199999999999995e-002 | AJ173: =H173+100*O173 -> 134.88 | AK173: 129.5 | AL173: 214 | AM173: 46.4 | AN173: 257 | AO173: 5.2000000000000005e-002 | AP173: 10 | AQ173: 国光转债!
A174: 92 | B174: 128125 | C174: 华阳转债! | D174: 2949 | E174: 华阳国际 | F174: 建筑 | G174: 建筑工程 | H174: 108.03 | I174: -5.0000000000000001e-004 | J174: -1.2e-002 | K174: 23.2 | L174: -2.1099999999999997e-002 | M174: 118.5 | N174: 25.79 | O174: 0.20100000000000001 | P174: 89.96 | Q174: 转股中 | R174: 5.40年 | S174: 3.40年 | T174: 4.5 | U174: 4.1 | V174: 8.0000000000000002e-003 | W174: 9.9000000000000005e-002 | X174: 8.900000000000001e-002 | Y174: 45 | Z174: 3.73 | AA174: 1.7600000000000001e-002 | AB174: 1.15e-002 | AC174: -1.11e-002 | AD174: -1.32e-002 | AE174: 82.81 | AF174: 84.43 | AG174: 0.59 | AH174: AA- | AI174: 6.6199999999999995e-002 | AJ174: =H174+100*O174 -> 128.13 | AK174: 126.1 | AL174: 195 | AM174: 41.7 | AN174: 240 | AO174: 0.13300000000000001 | AP174: 6 | AQ174: 华阳转债!
A175: 295 | B175: 128039 | C175: 三力转债! | D175: 2224 | E175: 三 力 士 | F175: 机械装备 | G175: 专用设备 | H175: 103.964 | I175: 6.4000000000000003e-003 | J175: 1.e-003 | K175: 5.66 | L175: 1.2500000000000001e-002 | M175: 109.8 | N175: 5.81 | O175: 6.7000000000000004e-002 | P175: 97.42 | Q175: 转股中 | R175: 3.26年 | S175: 1.26年 | T175: 2.03 | U175: 4.5 | V175: 2.1000000000000001e-002 | W175: 4.9000000000000002e-002 | X175: 4.8000000000000001e-002 | Y175: 41 | Z175: 1.76 | AA175: 1.72e-002 | AB175: 1.15e-002 | AC175: -9.5999999999999992e-003 | AD175: -1.3100000000000001e-002 | AE175: 93.83 | AF175: 89.84 | AG175: 0.59 | AH175: AA- | AI175: 6.4899999999999999e-002 | AJ175: =H175+100*O175 -> 110.664 | AK175: 110.5 | AL175: 37 | AM175: 16.7 | AN175: 24 | AO175: 3.1e-002 | AP175: 26 | AQ175: 三力转债!
A176: 163 | B176: 128101 | C176: 联创转债! | D176: 2036 | E176: 联创电子 | F176: 电子 | G176: 液晶显示 | H176: 105.867 | I176: 3.3e-003 | J176: 8.9999999999999998e-004 | K176: 11.18 | L176: 1.0800000000000001e-002 | M176: 115.1 | N176: 13.86 | O176: 0.312 | P176: 80.66 | Q176: 转股中 | R176: 5年10天 | S176: 3年11天 | T176: 3 | U176: 6.5 | V176: 2.e-002 | W176: 2.6000000000000002e-002 | X176: 2.1000000000000001e-002 | Y176: 117 | Z176: 3.97 | AA176: 1.7100000000000001e-002 | AB176: 1.1599999999999999e-002 | AC176: -6.8000000000000005e-003 | AD176: -9.0000000000000011e-003 | AE176: 90.08 | AF176: 92.58 | AG176: 0.39 | AH176: AA | AI176: 4.5199999999999997e-002 | AJ176: =H176+100*O176 -> 137.06700000000001 | AK176: 131.1 | AL176: 223 | AM176: 38.5 | AN176: 220 | AO176: 6.3e-002 | AP176: 17 | AQ176: 联创转债!
A177: 310 | B177: 110041 | C177: 蒙电转债! | D177: 600863 | E177: 内蒙华电 | F177: 能源电力 | G177: 电力供应 | H177: 104.39 | I177: 7.0999999999999995e-003 | J177: -5.6000000000000008e-003 | K177: 2.4 | L177: 4.1999999999999997e-003 | M177: 109.3 | N177: 2.69 | O177: 0.17000000000000001 | P177: 89.22 | Q177: 转股中 | R177: 2.80年 | S177: 0.80年 | T177: 18.7 | U177: 11 | V177: 6.0000000000000001e-003 | W177: 0.13400000000000001 | X177: 0.12 | Y177: 139 | Z177: 1.18 | AA177: 1.6799999999999999e-002 | AB177: 1.0500000000000001e-002 | AC177: -2.5699999999999997e-002 | AD177: -2.9300000000000003e-002 | AE177: 98.28 | AF177: 98.84 | AG177: 0.37 | AH177: AAA | AI177: 3.7200000000000004e-002 | AJ177: =H177+100*O177 -> 121.39 | AK177: 119.6 | AL177: 129 | AM177: 20.7 | AN177: 52 | AO177: 5.0999999999999997e-002 | AP177: 10 | AQ177: 蒙电转债!
A178: 38 | B178: 123078 | C178: 飞凯转债!! | D178: 300398 | E178: 飞凯材料 | F178: 化工 | G178: 化工 | H178: 104.98 | I178: 4.9000000000000002e-002 | J178: -3.9699999999999999e-002 | K178: 15.88 | L178: 2.4500000000000001e-002 | M178: 115.2 | N178: 19.34 | O178: 0.27899999999999997 | P178: 82.11 | Q178: 3月0天 | R178: 5.73年 | S178: 回售内 | T178: 8.25 | U178: 110 | V178: 0.13 | W178: 0.10099999999999999 | X178: 8.3000000000000004e-002 | Y178: 82 | Z178: 3.17 | AA178: 1.66e-002 | AB178: 1.18e-002 | AC178: 回售内 | AD178: 回售内 | AE178: 100.08 | AF178: 89.84 | AG178: 0.38 | AH178: AA | AI178: 4.5199999999999997e-002 | AJ178: =H178+100*O178 -> 132.88 | AK178: 127.9 | AL178: 203 | AM178: 27.8 | AN178: 129 | AO178: 6.2e-002 | AP178: 7 | AQ178: 飞凯转债!!
A179: 322 | B179: 110038 | C179: 济川转债! | D179: 600566 | E179: 济川药业 | F179: 医药 | G179: 中药 | H179: 104.58 | I179: 4.8999999999999998e-003 | J179: 1.e-004 | K179: 20.9 | L179: 2.e-002 | M179: 107.5 | N179: 23.85 | O179: 0.193 | P179: 87.63 | Q179: 转股中 | R179: 1.69年 | S179: 回售内 | T179: 6.28 | U179: 18 | V179: 2.7999999999999997e-002 | W179: 3.4000000000000002e-002 | X179: 2.9999999999999999e-002 | Y179: 186 | Z179: 2.53 | AA179: 1.6500000000000001e-002 | AB179: 8.1000000000000013e-003 | AC179: 回售内 | AD179: 回售内 | AE179: 100.25 | AF179: 100.29 | AG179: 0.25 | AH179: AA | AI179: 4.2199999999999994e-002 | AJ179: =H179+100*O179 -> 123.88 | AK179: 121.5 | AL179: 152 | AM179: 21.2 | AN179: 58 | AO179: 5.9000000000000004e-002 | AP179: 23 | AQ179: 济川转债!
A180: 181 | B180: 113563 | C180: 柳药转债 | D180: 603368 | E180: 柳药股份 | F180: 医药 | G180: 医药商业 | H180: 104.4 | I180: 3.7000000000000002e-003 | J180: -2.8000000000000004e-003 | K180: 21.4 | L180: 1.9e-003 | M180: 112.9 | N180: 24.47 | O180: 0.19399999999999998 | P180: 87.45 | Q180: 转股中 | R180: 4.87年 | S180: 2.87年 | T180: 8.02 | U180: 3 | V180: 4.0000000000000001e-003 | W180: 0.10300000000000001 | X180: 8.9999999999999997e-002 | Y180: 78 | Z180: 1.62 | AA180: 1.6500000000000001e-002 | AB180: 1.1599999999999999e-002 | AC180: -3.2000000000000002e-003 | AD180: -5.4000000000000003e-003 | AE180: 90.86 | AF180: 91.97 | AG180: 0.47 | AH180: AA | AI180: 4.3899999999999995e-002 | AJ180: =H180+100*O180 -> 123.80000000000001 | AK180: 121.3 | AL180: 151 | AM180: 29.4 | AN180: 142 | AO180: 1.9e-002 | AP180: 17 | AQ180: 柳药转债
A181: 146 | B181: 123050 | C181: 聚飞转债 | D181: 300303 | E181: 聚飞光电 | F181: 电子 | G181: LED制 | H181: 114.71 | I181: 8.0000000000000002e-003 | J181: 1.15e-002 | K181: 5.34 | L181: 3.0899999999999997e-002 | M181: 124.2 | N181: 5.18 | O181: 0.113 | P181: 103.09 | Q181: 转股中 | R181: 5年39天 | S181: 3年40天 | T181: 7.05 | U181: 11 | V181: 1.3999999999999999e-002 | W181: 0.10300000000000001 | X181: 0.106 | Y181: 68 | Z181: 2.94 | AA181: 1.6e-002 | AB181: 8.0000000000000002e-003 | AC181: -2.9500000000000002e-002 | AD181: -3.1800000000000002e-002 | AE181: 84.63 | AF181: 90.21 | AG181: 0.63 | AH181: AA- | AI181: 6.6199999999999995e-002 | AJ181: =H181+100*O181 -> 126.00999999999999 | AK181: 126.3 | AL181: 197 | AM181: 36.1 | AN181: 204 | AO181: 5.2999999999999999e-002 | AP181: 12 | AQ181: 聚飞转债
A182: 190 | B182: 123038 | C182: 联得转债! | D182: 300545 | E182: 联得装备 | F182: 机械装备 | G182: 专用设备 | H182: 110.167 | I182: 5.6000000000000008e-003 | J182: 8.1000000000000013e-003 | K182: 23.32 | L182: 2.2400000000000003e-002 | M182: 118.6 | N182: 25.29 | O182: 0.19500000000000001 | P182: 92.21 | Q182: 转股中 | R182: 4.81年 | S182: 2.81年 | T182: 1.47 | U182: 20 | V182: 0.126 | W182: 4.2999999999999997e-002 | X182: 4.0000000000000001e-002 | Y182: 34 | Z182: 4.45 | AA182: 1.5800000000000002e-002 | AB182: 8.8999999999999999e-003 | AC182: -1.9799999999999998e-002 | AD182: -2.23e-002 | AE182: 83.73 | AF182: 84.09 | AG182: 0.62 | AH182: A+ | AI182: 7.5899999999999995e-002 | AJ182: =H182+100*O182 -> 129.667 | AK182: 128.1 | AL182: 206 | AM182: 44 | AN182: 252 | AO182: 3.2000000000000001e-002 | AP182: 18 | AQ182: 联得转债!
A183: 249 | B183: 110057 | C183: 现代转债 | D183: 600420 | E183: 现代制药 | F183: 医药 | G183: 化学制药 | H183: 104.24 | I183: 3.5999999999999999e-003 | J183: 4.1999999999999997e-003 | K183: 8.9 | L183: 1.7100000000000001e-002 | M183: 110.8 | N183: 9.89 | O183: 0.158 | P183: 89.99 | Q183: 转股中 | R183: 4年26天 | S183: 2年27天 | T183: 16.2 | U183: 7.4 | V183: 4.0000000000000001e-003 | W183: 0.17699999999999999 | X183: 0.159 | Y183: 91 | Z183: 1.16 | AA183: 1.54e-002 | AB183: 1.04e-002 | AC183: -4.0999999999999995e-003 | AD183: -6.8999999999999999e-003 | AE183: 94.92 | AF183: 95.18 | AG183: 0.45 | AH183: AAA | AI183: 3.8900000000000004e-002 | AJ183: =H183+100*O183 -> 120.03999999999999 | AK183: 118.5 | AL183: 112 | AM183: 23.3 | AN183: 79 | AO183: 2.7000000000000003e-002 | AP183: 23 | AQ183: 现代转债
A184: 202 | B184: 110062 | C184: 烽火转债! | D184: 600498 | E184: 烽火通信 | F184: 通信互联 | G184: 通信设备 | H184: 103.21 | I184: 4.6999999999999993e-003 | J184: -5.0000000000000001e-004 | K184: 19.34 | L184: 1.4199999999999999e-002 | M184: 110.8 | N184: 25.65 | O184: 0.36899999999999999 | P184: 75.4 | Q184: 转股中 | R184: 4.74年 | S184: 2.75年 | T184: 30.9 | U184: 12 | V184: 4.0000000000000001e-003 | W184: 0.13600000000000001 | X184: 0.10300000000000001 | Y184: 226 | Z184: 2.13 | AA184: 1.54e-002 | AB184: 1.1000000000000001e-002 | AC184: 2.9999999999999997e-004 | AD184: -1.9e-003 | AE184: 92.52 | AF184: 92.77 | AG184: 0.3 | AH184: AAA | AI184: 3.8900000000000004e-002 | AJ184: =H184+100*O184 -> 140.10999999999999 | AK184: 131 | AL184: 222 | AM184: 38.2 | AN184: 218 | AO184: 1.e-002 | AP184: 21 | AQ184: 烽火转债!
A185: 8 | B185: 113618 | C185: 美诺转债! | D185: 603538 | E185: 美诺华 | F185: 医药 | G185: 原料药 | H185: 106 | I185: 2.7000000000000001e-003 | J185: -2.9999999999999997e-004 | K185: 31.33 | L185: 4.1999999999999997e-003 | M185: 115.3 | N185: 37.47 | O185: 0.26800000000000002 | P185: 83.61 | Q185: 4月17天 | R185: 5.86年 | S185: 3.86年 | T185: 5.2 | U185: 10 | V185: 1.9e-002 | W185: 0.111 | X185: 9.3000000000000013e-002 | Y185: 47 | Z185: 3.08 | AA185: 1.47e-002 | AB185: 1.e-002 | AC185: -5.1999999999999998e-003 | AD185: -6.9999999999999993e-003 | AE185: 80.37 | AF185: 79.77 | AG185: 0.58 | AH185: AA- | AI185: 6.6199999999999995e-002 | AJ185: =H185+100*O185 -> 132.80000000000001 | AK185: 128.4 | AL185: 208 | AM185: 48 | AN185: 261 | AO185: -1.1000000000000001e-002 | AP185: 3 | AQ185: 美诺转债!
A186: 294 | B186: 128040 | C186: 华通转债! | D186: 2758 | E186: 浙农股份 | F186: 医药 | G186: 医药商业 | H186: 107.3 | I186: 2.8000000000000004e-003 | J186: -1.6000000000000001e-003 | K186: 10.74 | L186: 1.9e-003 | M186: 112.3 | N186: 10.33 | O186: 3.2000000000000001e-002 | P186: 103.97 | Q186: 转股中 | R186: 3.27年 | S186: 1.28年 | T186: 2.22 | U186: 5.3 | V186: 2.2000000000000002e-002 | W186: 4.2000000000000003e-002 | X186: 4.4000000000000004e-002 | Y186: 52 | Z186: 3.55 | AA186: 1.43e-002 | AB186: 7.3000000000000001e-003 | AC186: -2.9500000000000002e-002 | AD186: -3.32e-002 | AE186: 93.96 | AF186: 91.82 | AG186: 0.64 | AH186: AA- | AI186: 6.4899999999999999e-002 | AJ186: =H186+100*O186 -> 110.5 | AK186: 110.6 | AL186: 39 | AM186: 16.7 | AN186: 23 | AO186: 8.0000000000000002e-003 | AP186: 31 | AQ186: 华通转债!
A187: 233 | B187: 113027 | C187: 华钰转债!! | D187: 601020 | E187: 华钰矿业 | F187: 有色金属 | G187: 锌铅镍锡 | H187: 108.38 | I187: -5.0000000000000001e-003 | J187: 1.2999999999999999e-003 | K187: 10.75 | L187: -5.6000000000000008e-003 | M187: 114.9 | N187: 10.17 | O187: 2.5000000000000001e-002 | P187: 105.7 | Q187: 转股中 | R187: 4.27年 | S187: 2.28年 | T187: 3.25 | U187: 165 | V187: 0.46600000000000003 | W187: 5.4000000000000006e-002 | X187: 5.7999999999999996e-002 | Y187: 60 | Z187: 2.45 | AA187: 1.41e-002 | AB187: 7.7000000000000002e-003 | AC187: -1.9299999999999998e-002 | AD187: -2.1899999999999999e-002 | AE187: 88.83 | AF187: 88.34 | AG187: 0.68 | AH187: AA- | AI187: 6.4899999999999999e-002 | AJ187: =H187+100*O187 -> 110.88 | AK187: 111.1 | AL187: 44 | AM187: 22.2 | AN187: 71 | AO187: 0.18600000000000003 | AP187: 45 | AQ187: 华钰转债!!
A188: 41 | B188: 110077 | C188: 洪城转债 | D188: 600461 | E188: 洪城水业 | F188: 城市公用 | G188: 城市公用 | H188: 105.02 | I188: -7.000000000000001e-004 | J188: -1.e-004 | K188: 6.36 | L188: -1.6000000000000001e-003 | M188: 113.5 | N188: 7.13 | O188: 0.17699999999999999 | P188: 89.2 | Q188: 2月22天 | R188: 5.71年 | S188: 3.71年 | T188: 18 | U188: 2.3 | V188: 1.e-003 | W188: 0.29899999999999999 | X188: 0.26600000000000001 | Y188: 60 | Z188: 1.2 | AA188: 1.3899999999999999e-002 | AB188: 9.4999999999999998e-003 | AC188: -6.8999999999999999e-003 | AD188: -8.0000000000000002e-003 | AE188: 86.86 | AF188: 89.41 | AG188: 0.51 | AH188: AA+ | AI188: 4.3200000000000002e-002 | AJ188: =H188+100*O188 -> 122.72 | AK188: 120.8 | AL188: 145 | AM188: 31.4 | AN188: 165 | AO188: 4.8000000000000001e-002 | AP188: 5 | AQ188: 洪城转债
A189: 61 | B189: 123070 | C189: 鹏辉转债 | D189: 300438 | E189: 鹏辉能源 | F189: 汽车 | G189: 零部件制 | H189: 106.999 | I189: 4.6999999999999993e-003 | J189: 5.8999999999999999e-003 | K189: 17.73 | L189: 2.1299999999999999e-002 | M189: 115.1 | N189: 20.16 | O189: 0.217 | P189: 87.95 | Q189: 52天 | R189: 5.62年 | S189: 3.63年 | T189: 8.9 | U189: 7.8 | V189: 8.0000000000000002e-003 | W189: 0.12 | X189: 0.105 | Y189: 74 | Z189: 3.01 | AA189: 1.3300000000000001e-002 | AB189: 8.3999999999999995e-003 | AC189: -8.5000000000000006e-003 | AD189: -1.03e-002 | AE189: 87.73 | AF189: 90.17 | AG189: 0.5 | AH189: AA | AI189: 4.5199999999999997e-002 | AJ189: =H189+100*O189 -> 128.69899999999998 | AK189: 126.1 | AL189: 194 | AM189: 35.9 | AN189: 202 | AO189: -6.6000000000000003e-002 | AP189: 4 | AQ189: 鹏辉转债
A190: 168 | B190: 110067 | C190: 华安转债! | D190: 600909 | E190: 华安证券 | F190: 金融 | G190: 证券行业 | H190: 103.59 | I190: 6.9999999999999993e-003 | J190: -2.9999999999999997e-004 | K190: 6.86 | L190: 1.78e-002 | M190: 110.5 | N190: 8.67 | O190: 0.309 | P190: 79.12 | Q190: 转股中 | R190: 5年6.0天 | S190: 无权 | T190: 28 | U190: 69 | V190: 2.4e-002 | W190: 0.113 | X190: 8.900000000000001e-002 | Y190: 248 | Z190: 1.79 | AA190: 1.3100000000000001e-002 | AB190: 9.1999999999999998e-003 | AC190: 无权 | AD190: 无权 | AE190: 无权 | AF190: 90.92 | AG190: 0.38 | AH190: AAA | AI190: 4.0199999999999993e-002 | AJ190: =H190+100*O190 -> 134.49000000000001 | AK190: 128.1 | AL190: 205 | AM190: 37.1 | AN190: 209 | AO190: 2.7000000000000003e-002 | AP190: 27 | AQ190: 华安转债!
A191: 135 | B191: 128109 | C191: 楚江转债 | D191: 2171 | E191: 楚江新材 | F191: 有色金属 | G191: 铜金属 | H191: 108.203 | I191: 3.7000000000000002e-003 | J191: 8.9999999999999998e-004 | K191: 8.05 | L191: 8.8000000000000005e-003 | M191: 115.3 | N191: 8.73 | O191: 0.17300000000000001 | P191: 92.21 | Q191: 转股中 | R191: 5.25年 | S191: 3.25年 | T191: 18.3 | U191: 7.8 | V191: 4.0000000000000001e-003 | W191: 0.17000000000000001 | X191: 0.157 | Y191: 107 | Z191: 1.95 | AA191: 1.24e-002 | AB191: 7.0999999999999995e-003 | AC191: -1.2199999999999999e-002 | AD191: -1.43e-002 | AE191: 89.4 | AF191: 91.88 | AG191: 0.53 | AH191: AA | AI191: 4.5199999999999997e-002 | AJ191: =H191+100*O191 -> 125.503 | AK191: 124.2 | AL191: 182 | AM191: 32.3 | AN191: 170 | AO191: 5.0999999999999997e-002 | AP191: 6 | AQ191: 楚江转债
A192: 236 | B192: 113536 | C192: 三星转债 | D192: 603578 | E192: 三星新材 | F192: 家电 | G192: 零部件制 | H192: 109.18 | I192: 4.5000000000000005e-003 | J192: -1.e-004 | K192: 20.08 | L192: 7.4999999999999997e-003 | M192: 114.8 | N192: 19.54 | O192: 6.2e-002 | P192: 102.76 | Q192: 转股中 | R192: 4.24年 | S192: 2.24年 | T192: 1.49 | U192: 2.2 | V192: 1.3999999999999999e-002 | W192: 8.1000000000000003e-002 | X192: 8.3000000000000004e-002 | Y192: 18 | Z192: 2.64 | AA192: 1.2199999999999999e-002 | AB192: 5.7999999999999996e-003 | AC192: -2.3e-002 | AD192: -2.5600000000000001e-002 | AE192: 93.26 | AF192: 96.06 | AG192: 0.58 | AH192: AA | AI192: 4.3899999999999995e-002 | AJ192: =H192+100*O192 -> 115.38000000000001 | AK192: 115.6 | AL192: 85 | AM192: 19.5 | AN192: 44 | AO192: 4.0999999999999995e-002 | AP192: 38 | AQ192: 三星转债
A193: 241 | B193: 113026 | C193: 核能转债! | D193: 601985 | E193: 中国核电 | F193: 能源电力 | G193: 核电 | H193: 104.62 | I193: -1.1000000000000001e-003 | J193: 2.0000000000000001e-004 | K193: 5.22 | L193: -1.9e-003 | M193: 109.8 | N193: 5.86 | O193: 0.17399999999999999 | P193: 89.08 | Q193: 转股中 | R193: 4年40天 | S193: 2年41天 | T193: 78 | U193: 26 | V193: 3.0000000000000001e-003 | W193: 8.5999999999999993e-002 | X193: 7.5999999999999998e-002 | Y193: 911 | Z193: 1.56 | AA193: 1.21e-002 | AB193: 7.4999999999999997e-003 | AC193: -5.6000000000000008e-003 | AD193: -8.3999999999999995e-003 | AE193: 94.79 | AF193: 94.19 | AG193: 0.45 | AH193: AAA | AI193: 3.8900000000000004e-002 | AJ193: =H193+100*O193 -> 122.02000000000001 | AK193: 120.2 | AL193: 135 | AM193: 25.4 | AN193: 99 | AO193: 3.5000000000000003e-002 | AP193: 49 | AQ193: 核能转债!
A194: 150 | B194: 123048 | C194: 应急转债! | D194: 300527 | E194: 中船应急 | F194: 机械装备 | G194: 专用设备 | H194: 106.9 | I194: 6.6e-003 | J194: 2.7000000000000001e-003 | K194: 8.43 | L194: 1.6899999999999998e-002 | M194: 113.1 | N194: 8.9 | O194: 0.129 | P194: 94.72 | Q194: 转股中 | R194: 5年35天 | S194: 3年36天 | T194: 3.8 | U194: 31 | V194: 7.5999999999999998e-002 | W194: 4.7e-002 | X194: 4.4000000000000004e-002 | Y194: 81 | Z194: 3.26 | AA194: 1.1299999999999999e-002 | AB194: 6.6e-003 | AC194: -9.5999999999999992e-003 | AD194: -1.1699999999999999e-002 | AE194: 90.36 | AF194: 91.57 | AG194: 0.55 | AH194: AA+ | AI194: 4.3200000000000002e-002 | AJ194: =H194+100*O194 -> 119.80000000000001 | AK194: 119.1 | AL194: 123 | AM194: 27.5 | AN194: 125 | AO194: 4.0000000000000001e-002 | AP194: 16 | AQ194: 应急转债!
A195: 211 | B195: 110060 | C195: 天路转债! | D195: 600326 | E195: 西藏天路 | F195: 建筑 | G195: 水泥 | H195: 109.36 | I195: -2.e-003 | J195: -1.1999999999999999e-003 | K195: 7.11 | L195: -5.6000000000000008e-003 | M195: 114.9 | N195: 7.16 | O195: 0.10099999999999999 | P195: 99.3 | Q195: 转股中 | R195: 4.65年 | S195: 2.65年 | T195: 7.06 | U195: 5.4 | V195: 6.9999999999999993e-003 | W195: 0.10800000000000001 | X195: 0.107 | Y195: 65 | Z195: 1.75 | AA195: 1.09e-002 | AB195: 5.1000000000000004e-003 | AC195: -1.9900000000000001e-002 | AD195: -2.2200000000000001e-002 | AE195: 91.72 | AF195: 94.48 | AG195: 0.57 | AH195: AA | AI195: 4.3899999999999995e-002 | AJ195: =H195+100*O195 -> 119.45999999999999 | AK195: 119.4 | AL195: 128 | AM195: 24.9 | AN195: 94 | AO195: 4.5999999999999999e-002 | AP195: 13 | AQ195: 天路转债!
A196: 27 | B196: 123083 | C196: 朗新转债 | D196: 300682 | E196: 朗新科技 | F196: 计算机及 | G196: 软件开发 | H196: 108.349 | I196: 4.3799999999999999e-002 | J196: 3.5400000000000001e-002 | K196: 15.32 | L196: 0.13200000000000001 | M196: 115.1 | N196: 15.57 | O196: 0.10099999999999999 | P196: 98.39 | Q196: 3月12天 | R196: 5.76年 | S196: 3.76年 | T196: 8 | U196: 259 | V196: 0.29600000000000004 | W196: 5.0999999999999997e-002 | X196: 5.0000000000000003e-002 | Y196: 156 | Z196: 3.28 | AA196: 1.0700000000000001e-002 | AB196: 6.0000000000000001e-003 | AC196: -1.1399999999999999e-002 | AD196: -1.32e-002 | AE196: 87.2 | AF196: 89.62 | AG196: 0.6 | AH196: AA | AI196: 4.5199999999999997e-002 | AJ196: =H196+100*O196 -> 118.449 | AK196: 118.3 | AL196: 108 | AM196: 28.7 | AN196: 135 | AO196: 0.17399999999999999 | AP196: 3 | AQ196: 朗新转债
A197: 99 | B197: 110073 | C197: 国投转债 | D197: 600061 | E197: 国投资本 | F197: 金融 | G197: 证券行业 | H197: 104.58 | I197: 1.1299999999999999e-002 | J197: -5.1999999999999998e-003 | K197: 12.41 | L197: 1.47e-002 | M197: 110.5 | N197: 15.25 | O197: 0.28499999999999998 | P197: 81.38 | Q197: 转股中 | R197: 5.38年 | S197: 无权 | T197: 80 | U197: 149 | V197: 1.8000000000000002e-002 | W197: 0.153 | X197: 0.124 | Y197: 525 | Z197: 1.26 | AA197: 1.04e-002 | AB197: 6.8000000000000005e-003 | AC197: 无权 | AD197: 无权 | AE197: 无权 | AF197: 89.62 | AG197: 0.41 | AH197: AAA | AI197: 4.0199999999999993e-002 | AJ197: =H197+100*O197 -> 133.07999999999998 | AK197: 127.8 | AL197: 202 | AM197: 38.2 | AN197: 216 | AO197: -8.0000000000000002e-003 | AP197: 22 | AQ197: 国投转债
A198: 307 | B198: 123007 | C198: 道氏转债! | D198: 300409 | E198: 道氏技术 | F198: 建筑 | G198: 建筑行业 | H198: 107.209 | I198: 3.0000000000000001e-003 | J198: -3.4000000000000002e-003 | K198: 14.92 | L198: -7.000000000000001e-004 | M198: 110.3 | N198: 14.55 | O198: 4.5999999999999999e-002 | P198: 102.54 | Q198: 转股中 | R198: 2.82年 | S198: 0.82年 | T198: 3.04 | U198: 9 | V198: 2.7999999999999997e-002 | W198: 4.4000000000000004e-002 | X198: 4.4999999999999998e-002 | Y198: 69 | Z198: 2.84 | AA198: 1.03e-002 | AB198: 3.4000000000000002e-003 | AC198: -5.1399999999999994e-002 | AD198: -5.4800000000000001e-002 | AE198: 95.86 | AF198: 93.07 | AG198: 0.62 | AH198: AA- | AI198: 6.3200000000000006e-002 | AJ198: =H198+100*O198 -> 111.809 | AK198: 111.9 | AL198: 52 | AM198: 16 | AN198: 21 | AO198: -3.3000000000000002e-002 | AP198: 22 | AQ198: 道氏转债!
A199: 172 | B199: 123043 | C199: 正元转债 | D199: 300645 | E199: 正元智慧 | F199: 计算机及 | G199: 软件开发 | H199: 115.124 | I199: -5.3e-003 | J199: 1.8500000000000003e-002 | K199: 14.39 | L199: 2.1299999999999999e-002 | M199: 121.4 | N199: 15.41 | O199: 0.23300000000000001 | P199: 93.38 | Q199: 转股中 | R199: 4.997年 | S199: 3年0.0天 | T199: 1.66 | U199: 97 | V199: 0.504 | W199: 9.0999999999999998e-002 | X199: 8.5000000000000006e-002 | Y199: 18 | Z199: 2.97 | AA199: 1.e-002 | AB199: 2.8000000000000004e-003 | AC199: -3.1600000000000003e-002 | AD199: -3.4000000000000002e-002 | AE199: 82.73 | AF199: 84.54 | AG199: 0.62 | AH199: A+ | AI199: 7.5899999999999995e-002 | AJ199: =H199+100*O199 -> 138.42400000000001 | AK199: 136.9 | AL199: 257 | AM199: 52.3 | AN199: 276 | AO199: 3.1e-002 | AP199: 18 | AQ199: 正元转债
A200: 252 | B200: 127012 | C200: 招路转债! | D200: 1965 | E200: 招商公路 | F200: 机场高速 | G200: 高速 | H200: 104.14 | I200: 8.3999999999999995e-003 | J200: -1.e-004 | K200: 7.25 | L200: 2.4e-002 | M200: 108.2 | N200: 8.81 | O200: 0.26500000000000001 | P200: 82.29 | Q200: 转股中 | R200: 4年16天 | S200: 2年17天 | T200: 50 | U200: 51 | V200: 1.e-002 | W200: 0.11199999999999999 | X200: 9.1999999999999998e-002 | Y200: 448 | Z200: 0.92 | AA200: 9.5999999999999992e-003 | AB200: 5.7999999999999996e-003 | AC200: -9.5999999999999992e-003 | AD200: -1.1299999999999999e-002 | AE200: 93.75 | AF200: 92.93 | AG200: 0.35 | AH200: AAA | AI200: 3.8900000000000004e-002 | AJ200: =H200+100*O200 -> 130.63999999999999 | AK200: 126 | AL200: 193 | AM200: 32.2 | AN200: 169 | AO200: 6.4000000000000001e-002 | AP200: 35 | AQ200: 招路转债!
A201: 273 | B201: 128051 | C201: 光华转债! | D201: 2741 | E201: 光华科技 | F201: 电子 | G201: 元器件制 | H201: 110.87 | I201: 1.44e-002 | J201: 3.4000000000000002e-003 | K201: 14.15 | L201: 2.5399999999999999e-002 | M201: 114.8 | N201: 12.72 | O201: -3.0000000000000001e-003 | P201: 111.24 | Q201: 转股中 | R201: 3.78年 | S201: 1.78年 | T201: 2.48 | U201: 8 | V201: 2.8999999999999998e-002 | W201: 4.7e-002 | X201: 5.2000000000000005e-002 | Y201: 53 | Z201: 4.38 | AA201: 9.4999999999999998e-003 | AB201: 2.3e-003 | AC201: -3.6799999999999999e-002 | AD201: -3.9800000000000002e-002 | AE201: 91.35 | AF201: 90.98 | AG201: 0.7 | AH201: AA- | AI201: 6.4899999999999999e-002 | AJ201: =H201+100*O201 -> 110.57000000000001 | AK201: 110.5 | AL201: 36 | AM201: 19.2 | AN201: 42 | AO201: 8.0000000000000002e-002 | AP201: 26 | AQ201: 光华转债!
A202: 245 | B202: 128064 | C202: 司尔转债! | D202: 2538 | E202: 司尔特 | F202: 化工 | G202: 农化 | H202: 111.187 | I202: -4.5999999999999999e-003 | J202: -2.7000000000000001e-003 | K202: 6.19 | L202: -1.2800000000000001e-002 | M202: 114.9 | N202: 6.07 | O202: 8.9999999999999997e-002 | P202: 101.98 | Q202: 转股中 | R202: 4年33天 | S202: 2年34天 | T202: 8 | U202: 2.3 | V202: 3.0000000000000001e-003 | W202: 0.17999999999999999 | X202: 0.184 | Y202: 44 | Z202: 1.16 | AA202: 8.199999999999999e-003 | AB202: 1.6000000000000001e-003 | AC202: -3.2000000000000001e-002 | AD202: -3.4799999999999998e-002 | AE202: 93.94 | AF202: 96.76 | AG202: 0.58 | AH202: AA | AI202: 4.3899999999999995e-002 | AJ202: =H202+100*O202 -> 120.187 | AK202: 120.4 | AL202: 137 | AM202: 23.6 | AN202: 84 | AO202: 6.5000000000000002e-002 | AP202: 52 | AQ202: 司尔转债!
A203: 259 | B203: 127011 | C203: 中鼎转2! | D203: 887 | E203: 中鼎股份 | F203: 汽车 | G203: 零部件制 | H203: 112 | I203: 1.2e-002 | J203: -1.1999999999999999e-003 | K203: 10.45 | L203: 2.5499999999999998e-002 | M203: 115.2 | N203: 11.59 | O203: 0.24199999999999999 | P203: 90.16 | Q203: 转股中 | R203: 4年2.0天 | S203: 2年3.0天 | T203: 12 | U203: 9.3 | V203: 6.9999999999999993e-003 | W203: 9.4e-002 | X203: 8.5000000000000006e-002 | Y203: 128 | Z203: 1.46 | AA203: 7.1999999999999998e-003 | AB203: 4.0000000000000002e-004 | AC203: -3.5900000000000001e-002 | AD203: -3.8900000000000004e-002 | AE203: 94.81 | AF203: 98.12 | AG203: 0.43 | AH203: AA+ | AI203: 4.1900000000000007e-002 | AJ203: =H203+100*O203 -> 136.19999999999999 | AK203: 133.8 | AL203: 238 | AM203: 35.7 | AN203: 200 | AO203: 3.6000000000000004e-002 | AP203: 25 | AQ203: 中鼎转2!
A204: 106 | B204: 127020 | C204: 中金转债 | D204: 60 | E204: 中金岭南 | F204: 有色金属 | G204: 有色行业 | H204: 109.807 | I204: -6.3e-003 | J204: 0. | K204: 4.66 | L204: -1.06e-002 | M204: 113.7 | N204: 4.71 | O204: 0.11 | P204: 98.94 | Q204: 转股中 | R204: 5.37年 | S204: 3.38年 | T204: 38 | U204: 11 | V204: 3.0000000000000001e-003 | W204: 0.22800000000000001 | X204: 0.22600000000000001 | Y204: 166 | Z204: 1.48 | AA204: 6.6e-003 | AB204: 2.e-003 | AC204: -1.95e-002 | AD204: -2.0799999999999999e-002 | AE204: 88.28 | AF204: 90.86 | AG204: 0.59 | AH204: AA+ | AI204: 4.3200000000000002e-002 | AJ204: =H204+100*O204 -> 120.807 | AK204: 120.7 | AL204: 143 | AM204: 29.8 | AN204: 147 | AO204: 2.1000000000000001e-002 | AP204: 14 | AQ204: 中金转债
A205: 142 | B205: 128107 | C205: 交科转债 | D205: 2061 | E205: 浙江交科 | F205: 建筑 | G205: 建筑工程 | H205: 111.614 | I205: 3.5999999999999999e-003 | J205: -8.1000000000000013e-003 | K205: 5.77 | L205: -6.8999999999999999e-003 | M205: 115.3 | N205: 5.36 | O205: 3.7000000000000005e-002 | P205: 107.65 | Q205: 转股中 | R205: 5年47天 | S205: 3年48天 | T205: 25 | U205: 17 | V205: 6.0000000000000001e-003 | W205: 0.315 | X205: 0.33899999999999997 | Y205: 79 | Z205: 0.99 | AA205: 6.5000000000000006e-003 | AB205: 1.1000000000000001e-003 | AC205: -2.2000000000000002e-002 | AD205: -2.41e-002 | AE205: 90.43 | AF205: 93.25 | AG205: 0.65 | AH205: AA+ | AI205: 4.3200000000000002e-002 | AJ205: =H205+100*O205 -> 115.31400000000001 | AK205: 115.6 | AL205: 84 | AM205: 22.3 | AN205: 72 | AO205: 8.5999999999999993e-002 | AP205: 16 | AQ205: 交科转债
A206: 54 | B206: 123074 | C206: 隆利转债 | D206: 300752 | E206: 隆利科技 | F206: 电子 | G206: 液晶显示 | H206: 119.732 | I206: -7.1999999999999998e-003 | J206: 1.72e-002 | K206: 36.33 | L206: 1.3100000000000001e-002 | M206: 124 | N206: 29.41 | O206: -3.1e-002 | P206: 123.53 | Q206: 2月0天 | R206: 5.65年 | S206: 3.65年 | T206: 3.25 | U206: 435 | V206: 1.1100000000000001 | W206: 7.400000000000001e-002 | X206: 9.1999999999999998e-002 | Y206: 44 | Z206: 5.03 | AA206: 6.3e-003 | AB206: -8.0000000000000004e-004 | AC206: -3.6699999999999997e-002 | AD206: -3.8599999999999995e-002 | AE206: 81.56 | AF206: 86.95 | AG206: 0.76 | AH206: AA- | AI206: 6.6199999999999995e-002 | AJ206: =H206+100*O206 -> 116.63200000000001 | AK206: 115.9 | AL206: 89 | AM206: 29 | AN206: 136 | AO206: 2.e-002 | AP206: 12 | AQ206: 隆利转债
A207: 188 | B207: 128090 | C207: 汽模转2 | D207: 2510 | E207: 天汽模 | F207: 汽车 | G207: 零部件制 | H207: 111.63 | I207: 3.0699999999999998e-002 | J207: 6.5000000000000006e-003 | K207: 4.53 | L207: 5.8400000000000001e-002 | M207: 114.9 | N207: 4.21 | O207: 3.7000000000000005e-002 | P207: 107.6 | Q207: 转股中 | R207: 4.81年 | S207: 2.81年 | T207: 3.1 | U207: 183 | V207: 0.52200000000000002 | W207: 7.2000000000000008e-002 | X207: 7.6999999999999999e-002 | Y207: 43 | Z207: 1.56 | AA207: 6.0999999999999995e-003 | AB207: 5.0000000000000001e-004 | AC207: -2.5600000000000001e-002 | AD207: -2.7699999999999999e-002 | AE207: 91.08 | AF207: 93.81 | AG207: 0.64 | AH207: AA | AI207: 4.3899999999999995e-002 | AJ207: =H207+100*O207 -> 115.33 | AK207: 115.7 | AL207: 86 | AM207: 21.8 | AN207: 65 | AO207: 9.9000000000000005e-002 | AP207: 28 | AQ207: 汽模转2
A208: 103 | B208: 123060 | C208: 苏试转债 | D208: 300416 | E208: 苏试试验 | F208: 机械装备 | G208: 专用设备 | H208: 114.581 | I208: -6.3e-003 | J208: 7.1999999999999998e-003 | K208: 22.59 | L208: 1.2999999999999999e-003 | M208: 117.6 | N208: 23.86 | O208: 0.20999999999999999 | P208: 94.68 | Q208: 转股中 | R208: 5.38年 | S208: 3.38年 | T208: 3.1 | U208: 1.2 | V208: 3.0000000000000001e-003 | W208: 6.7000000000000004e-002 | X208: 6.4000000000000001e-002 | Y208: 46 | Z208: 4.63 | AA208: 4.8999999999999998e-003 | AB208: -8.0000000000000004e-004 | AC208: -2.7400000000000001e-002 | AD208: -2.9399999999999999e-002 | AE208: 83.03 | AF208: 83.95 | AG208: 0.63 | AH208: AA- | AI208: 6.6199999999999995e-002 | AJ208: =H208+100*O208 -> 135.58100000000002 | AK208: 134.5 | AL208: 244 | AM208: 50.5 | AN208: 267 | AO208: -3.3000000000000002e-002 | AP208: 9 | AQ208: 苏试转债
A209: 109 | B209: 128121 | C209: 宏川转债 | D209: 2930 | E209: 宏川智慧 | F209: 交通运输 | G209: 物流业 | H209: 110.55 | I209: -4.0999999999999995e-003 | J209: 9.1999999999999998e-003 | K209: 17.77 | L209: 8.5000000000000006e-003 | M209: 113.3 | N209: 20.25 | O209: 0.26000000000000001 | P209: 87.75 | Q209: 转股中 | R209: 5.36年 | S209: 3.37年 | T209: 6.7 | U209: 21 | V209: 2.7999999999999997e-002 | W209: 8.5000000000000006e-002 | X209: 7.4999999999999997e-002 | Y209: 79 | Z209: 4.1 | AA209: 4.6999999999999993e-003 | AB209: 2.0000000000000001e-004 | AC209: -1.78e-002 | AD209: -1.9900000000000001e-002 | AE209: 82.97 | AF209: 80.93 | AG209: 0.6 | AH209: AA- | AI209: 6.6199999999999995e-002 | AJ209: =H209+100*O209 -> 136.55000000000001 | AK209: 133.3 | AL209: 237 | AM209: 50.4 | AN209: 266 | AO209: -4.5999999999999999e-002 | AP209: 4 | AQ209: 宏川转债
A210: 137 | B210: 127017 | C210: 万青转债 | D210: 789 | E210: 万年青 | F210: 建筑 | G210: 水泥 | H210: 115.801 | I210: -2.4399999999999998e-002 | J210: 9.3999999999999986e-003 | K210: 13.24 | L210: -2.9999999999999999e-002 | M210: 118.4 | N210: 14.16 | O210: 0.23800000000000002 | P210: 93.5 | Q210: 转股中 | R210: 5.24年 | S210: 3.25年 | T210: 10 | U210: 4.3 | V210: 4.0000000000000001e-003 | W210: 9.5000000000000001e-002 | X210: 8.900000000000001e-002 | Y210: 106 | Z210: 1.9 | AA210: 4.3e-003 | AB210: -1.8e-003 | AC210: -3.2000000000000001e-002 | AD210: -3.4000000000000002e-002 | AE210: 89.93 | AF210: 95.28 | AG210: 0.5 | AH210: AA+ | AI210: 4.3200000000000002e-002 | AJ210: =H210+100*O210 -> 139.601 | AK210: 138.1 | AL210: 262 | AM210: 42.8 | AN210: 245 | AO210: 3.7999999999999999e-002 | AP210: 9 | AQ210: 万青转债
A211: 149 | B211: 128106 | C211: 华统转债 | D211: 2840 | E211: 华统股份 | F211: 农业 | G211: 农产品加 | H211: 110.834 | I211: 6.7000000000000002e-003 | J211: -1.e-002 | K211: 9.56 | L211: -5.1999999999999998e-003 | M211: 113.2 | N211: 9.4 | O211: 8.9999999999999997e-002 | P211: 101.7 | Q211: 转股中 | R211: 5年35天 | S211: 3年36天 | T211: 5.37 | U211: 2.2 | V211: 4.0000000000000001e-003 | W211: 0.125 | X211: 0.127 | Y211: 43 | Z211: 2.55 | AA211: 4.1999999999999997e-003 | AB211: -5.0000000000000001e-004 | AC211: -2.0400000000000001e-002 | AD211: -2.2499999999999999e-002 | AE211: 89.9 | AF211: 90.8 | AG211: 0.63 | AH211: AA | AI211: 4.5199999999999997e-002 | AJ211: =H211+100*O211 -> 119.834 | AK211: 120 | AL211: 132 | AM211: 29.2 | AN211: 139 | AO211: 4.0000000000000001e-002 | AP211: 8 | AQ211: 华统转债
A212: 306 | B212: 128034 | C212: 江银转债! | D212: 2807 | E212: 江阴银行 | F212: 金融 | G212: 银行行业 | H212: 107.182 | I212: -6.7000000000000002e-003 | J212: 4.4000000000000003e-003 | K212: 4.3 | L212: -4.5999999999999999e-003 | M212: 108.3 | N212: 4.5 | O212: 0.122 | P212: 95.56 | Q212: 转股中 | R212: 2.90年 | S212: 无权 | T212: 17.6 | U212: 6 | V212: 3.0000000000000001e-003 | W212: 0.188 | X212: 0.17999999999999999 | Y212: 93 | Z212: 0.82 | AA212: 3.5999999999999999e-003 | AB212: -1.8e-003 | AC212: 无权 | AD212: 无权 | AE212: 无权 | AF212: 96.74 | AG212: 0.49 | AH212: AA+ | AI212: 4.0199999999999993e-002 | AJ212: =H212+100*O212 -> 119.38200000000001 | AK212: 118.8 | AL212: 116 | AM212: 22.1 | AN212: 68 | AO212: 4.2000000000000003e-002 | AP212: 26 | AQ212: 江银转债!
A213: 277 | B213: 110047 | C213: 山鹰转债 | D213: 600567 | E213: 山鹰国际 | F213: 造纸包装 | G213: 包装用纸 | H213: 116.01 | I213: -1.1699999999999999e-002 | J213: 6.8999999999999999e-003 | K213: 3.59 | L213: -8.3000000000000001e-003 | M213: 117.5 | N213: 3.34 | O213: 7.9000000000000001e-002 | P213: 107.49 | Q213: 转股中 | R213: 3.71年 | S213: 1.72年 | T213: 22.5 | U213: 41 | V213: 1.6e-002 | W213: 0.13600000000000001 | X213: 0.14599999999999999 | Y213: 165 | Z213: 1.12 | AA213: 3.4999999999999996e-003 | AB213: -4.7999999999999996e-003 | AC213: -6.25e-002 | AD213: -6.5199999999999994e-002 | AE213: 95.24 | AF213: 101.18 | AG213: 0.58 | AH213: AA+ | AI213: 4.1900000000000007e-002 | AJ213: =H213+100*O213 -> 123.91000000000001 | AK213: 124.5 | AL213: 184 | AM213: 23.4 | AN213: 80 | AO213: 4.7e-002 | AP213: 35 | AQ213: 山鹰转债
A214: 229 | B214: 113541 | C214: 荣晟转债! | D214: 603165 | E214: 荣晟环保 | F214: 造纸包装 | G214: 包装用纸 | H214: 113.46 | I214: 9.7000000000000003e-003 | J214: -1.8e-003 | K214: 13 | L214: 1.09e-002 | M214: 115 | N214: 11.54 | O214: 6.9999999999999993e-003 | P214: 112.65 | Q214: 转股中 | R214: 4.38年 | S214: 2.38年 | T214: 2.7 | U214: 4.7 | V214: 1.6e-002 | W214: 8.199999999999999e-002 | X214: 9.1999999999999998e-002 | Y214: 33 | Z214: 2.14 | AA214: 3.0999999999999999e-003 | AB214: -3.0000000000000001e-003 | AC214: -3.5799999999999998e-002 | AD214: -3.8300000000000001e-002 | AE214: 88.33 | AF214: 87.85 | AG214: 0.72 | AH214: AA- | AI214: 6.4899999999999999e-002 | AJ214: =H214+100*O214 -> 114.16 | AK214: 114.3 | AL214: 75 | AM214: 25.9 | AN214: 105 | AO214: 3.7000000000000005e-002 | AP214: 46 | AQ214: 荣晟转债!
A215: 193 | B215: 113559 | C215: 永创转债! | D215: 603901 | E215: 永创智能 | F215: 机械装备 | G215: 专用设备 | H215: 116.6 | I215: 6.6e-003 | J215: -2.8799999999999999e-002 | K215: 10.77 | L215: -3.32e-002 | M215: 118.3 | N215: 10.32 | O215: 0.11699999999999999 | P215: 104.36 | Q215: 转股中 | R215: 4.80年 | S215: 2.80年 | T215: 5.1 | U215: 13 | V215: 2.2000000000000002e-002 | W215: 0.10800000000000001 | X215: 0.11199999999999999 | Y215: 47 | Z215: 3.42 | AA215: 3.0999999999999999e-003 | AB215: -3.5999999999999999e-003 | AC215: -3.7000000000000005e-002 | AD215: -3.9699999999999999e-002 | AE215: 86.81 | AF215: 88.14 | AG215: 0.67 | AH215: AA- | AI215: 6.4899999999999999e-002 | AJ215: =H215+100*O215 -> 128.29999999999998 | AK215: 128.8 | AL215: 210 | AM215: 40.7 | AN215: 234 | AO215: 6.9000000000000006e-002 | AP215: 21 | AQ215: 永创转债!
A216: 209 | B216: 123033 | C216: 金力转债! | D216: 300748 | E216: 金力永磁 | F216: 电子 | G216: 元器件制 | H216: 120.003 | I216: -1.6399999999999998e-002 | J216: 1.8e-003 | K216: 42.9 | L216: -2.23e-002 | M216: 121.5 | N216: 40.68 | O216: 0.13800000000000001 | P216: 105.46 | Q216: 转股中 | R216: 4.66年 | S216: 2.66年 | T216: 4.34 | U216: 404 | V216: 0.7609999999999999 | W216: 2.3e-002 | X216: 2.5000000000000001e-002 | Y216: 185 | Z216: 13.28 | AA216: 2.7000000000000001e-003 | AB216: -5.1999999999999998e-003 | AC216: -4.6799999999999994e-002 | AD216: -4.99e-002 | AE216: 88.14 | AF216: 91.43 | AG216: 0.65 | AH216: AA- | AI216: 6.4899999999999999e-002 | AJ216: =H216+100*O216 -> 133.803 | AK216: 134.5 | AL216: 245 | AM216: 43.1 | AN216: 247 | AO216: 0.16399999999999998 | AP216: 28 | AQ216: 金力转债!
A217: 62 | B217: 128135 | C217: 洽洽转债 | D217: 2557 | E217: 洽洽食品 | F217: 食品饮料 | G217: 休闲食品 | H217: 118.5 | I217: -1.8000000000000002e-002 | J217: 2.2000000000000002e-002 | K217: 52.04 | L217: 9.4999999999999998e-003 | M217: 120.2 | N217: 60.83 | O217: 0.38500000000000001 | P217: 85.55 | Q217: 52天 | R217: 5.62年 | S217: 3.63年 | T217: 13.4 | U217: 50 | V217: 3.2000000000000001e-002 | W217: 5.0999999999999997e-002 | X217: 4.2999999999999997e-002 | Y217: 264 | Z217: 6.88 | AA217: 2.5999999999999999e-003 | AB217: -3.5999999999999999e-003 | AC217: -3.4799999999999998e-002 | AD217: -3.6600000000000001e-002 | AE217: 87.82 | AF217: 94.16 | AG217: 0.43 | AH217: AA | AI217: 4.5199999999999997e-002 | AJ217: =H217+100*O217 -> 157. | AK217: 151.5 | AL217: 290 | AM217: 57.3 | AN217: 289 | AO217: -0.14000000000000001 | AP217: 8 | AQ217: 洽洽转债
A218: 17 | B218: 128141 | C218: 旺能转债 | D218: 2034 | E218: 旺能环境 | F218: 城市公用 | G218: 三废处理 | H218: 113.398 | I218: -1.11e-002 | J218: -1.0200000000000001e-002 | K218: 18.3 | L218: -3.0699999999999998e-002 | M218: 115.1 | N218: 16.47 | O218: 2.1000000000000001e-002 | P218: 111.11 | Q218: 3月20天 | R218: 5.78年 | S218: 3.79年 | T218: 14 | U218: 97 | V218: 6.2e-002 | W218: 0.182 | X218: 0.20199999999999999 | Y218: 77 | Z218: 1.74 | AA218: 2.5999999999999999e-003 | AB218: -2.e-003 | AC218: -2.2799999999999997e-002 | AD218: -2.4500000000000001e-002 | AE218: 87.12 | AF218: 89.53 | AG218: 0.69 | AH218: AA | AI218: 4.5199999999999997e-002 | AJ218: =H218+100*O218 -> 115.49799999999999 | AK218: 115.7 | AL218: 87 | AM218: 26.2 | AN218: 108 | AO218: 0.11 | AP218: 3 | AQ218: 旺能转债
A219: 336 | B219: 113009 | C219: 广汽转债! | D219: 601238 | E219: 广汽集团 | F219: 汽车 | G219: 乘用车 | H219: 105.81 | I219: -8.6e-003 | J219: 8.8999999999999999e-003 | K219: 10.68 | L219: 1.52e-002 | M219: 106 | N219: 14.12 | O219: 0.39899999999999997 | P219: 75.64 | Q219: 转股中 | R219: 0.89年 | S219: 回售内 | T219: 25.5 | U219: 106 | V219: 4.0000000000000001e-002 | W219: 2.3e-002 | X219: 1.7000000000000001e-002 | Y219: 1105. | Z219: 1.32 | AA219: 2.e-003 | AB219: -1.0800000000000001e-002 | AC219: 回售内 | AD219: 回售内 | AE219: 100.27 | AF219: 102.87 | AG219: 0.02 | AH219: AAA | AI219: 3.44e-002 | AJ219: =H219+100*O219 -> 145.71000000000001 | AK219: 136 | AL219: 254 | AM219: 33.1 | AN219: 177 | AO219: -6.9999999999999993e-003 | AP219: 16 | AQ219: 广汽转债!
A220: 338 | B220: 110033 | C220: 国贸转债! | D220: 600755 | E220: 厦门国贸 | F220: 交通运输 | G220: 交通运输 | H220: 107.86 | I220: 1.5e-003 | J220: 1.2999999999999999e-003 | K220: 6.64 | L220: 1.6799999999999999e-002 | M220: 108 | N220: 7.18 | O220: 0.16600000000000001 | P220: 92.48 | Q220: 转股中 | R220: 0.84年 | S220: 回售内 | T220: 12.1 | U220: 5.3 | V220: 4.0000000000000001e-003 | W220: 9.4e-002 | X220: 8.6999999999999994e-002 | Y220: 129 | Z220: 0.86 | AA220: 1.5e-003 | AB220: -1.61e-002 | AC220: 回售内 | AD220: 回售内 | AE220: 100.33 | AF220: 104.98 | AG220: 0.17 | AH220: AAA | AI220: 3.44e-002 | AJ220: =H220+100*O220 -> 124.46000000000001 | AK220: 123.2 | AL220: 175 | AM220: 18.3 | AN220: 36 | AO220: 4.2000000000000003e-002 | AP220: 19 | AQ220: 国贸转债!
A221: 321 | B221: 123002 | C221: 国祯转债!! | D221: 300388 | E221: 节能国祯 | F221: 城市公用 | G221: 三废处理 | H221: 108.351 | I221: 2.2000000000000001e-003 | J221: -2.2000000000000001e-003 | K221: 8.44 | L221: 1.32e-002 | M221: 108.8 | N221: 8.48 | O221: 8.900000000000001e-002 | P221: 99.53 | Q221: 转股中 | R221: 2.72年 | S221: 0.72年 | T221: 2.52 | U221: 2.2 | V221: 8.0000000000000002e-003 | W221: 4.2999999999999997e-002 | X221: 4.2999999999999997e-002 | Y221: 59 | Z221: 1.56 | AA221: 1.5e-003 | AB221: -4.5000000000000005e-003 | AC221: -7.0400000000000004e-002 | AD221: -7.3599999999999999e-002 | AE221: 97.89 | AF221: 97.37 | AG221: 0 | AH221: AA | AI221: 4.2199999999999994e-002 | AJ221: =H221+100*O221 -> 117.251 | AK221: 117.2 | AL221: 101 | AM221: 19.3 | AN221: 43 | AO221: 5.7000000000000002e-002 | AP221: 15 | AQ221: 国祯转债!!
A222: 127 | B222: 128114 | C222: 正邦转债 | D222: 2157 | E222: 正邦科技 | F222: 农业 | G222: 畜牧业 | H222: 114.39 | I222: -5.3e-003 | J222: 2.9999999999999997e-004 | K222: 16.36 | L222: -7.9000000000000008e-003 | M222: 115.3 | N222: 15.55 | O222: 8.6999999999999994e-002 | P222: 105.21 | Q222: 转股中 | R222: 5.28年 | S222: 3.29年 | T222: 16 | U222: 37 | V222: 2.e-002 | W222: 3.2000000000000001e-002 | X222: 3.3000000000000002e-002 | Y222: 507 | Z222: 2.75 | AA222: 1.5e-003 | AB222: -3.5999999999999999e-003 | AC222: -2.7999999999999997e-002 | AD222: -2.9999999999999999e-002 | AE222: 89.85 | AF222: 92.65 | AG222: 0.63 | AH222: AA+ | AI222: 4.3200000000000002e-002 | AJ222: =H222+100*O222 -> 123.09 | AK222: 123.6 | AL222: 178 | AM222: 30.9 | AN222: 162 | AO222: -2.e-002 | AP222: 15 | AQ222: 正邦转债
A223: 26 | B223: 113043 | C223: 财通转债 | D223: 601108 | E223: 财通证券 | F223: 金融 | G223: 证券行业 | H223: 109.24 | I223: 1.15e-002 | J223: 6.6e-003 | K223: 11.88 | L223: 3.4799999999999998e-002 | M223: 110.2 | N223: 13.33 | O223: 0.22600000000000001 | P223: 89.12 | Q223: 3月13天 | R223: 5.76年 | S223: 无权 | T223: 38 | U223: 110 | V223: 2.6000000000000002e-002 | W223: 8.900000000000001e-002 | X223: 7.9000000000000001e-002 | Y223: 426 | Z223: 1.96 | AA223: 1.5e-003 | AB223: -1.7000000000000001e-003 | AC223: 无权 | AD223: 无权 | AE223: 无权 | AF223: 88.07 | AG223: 0.52 | AH223: AAA | AI223: 4.0199999999999993e-002 | AJ223: =H223+100*O223 -> 131.84 | AK223: 129.4 | AL223: 213 | AM223: 41.3 | AN223: 238 | AO223: 6.7000000000000004e-002 | AP223: 7 | AQ223: 财通转债
A224: 176 | B224: 113564 | C224: 天目转债 | D224: 603136 | E224: 天目湖 | F224: 旅游餐饮 | G224: 旅游 | H224: 125.56 | I224: -1.5100000000000001e-002 | J224: 2.3e-003 | K224: 28.83 | L224: -1.7000000000000001e-002 | M224: 126.2 | N224: 23.1 | O224: 6.0000000000000001e-003 | P224: 124.81 | Q224: 转股中 | R224: 4.98年 | S224: 2.99年 | T224: 2.87 | U224: 15 | V224: 4.0999999999999995e-002 | W224: 8.5000000000000006e-002 | X224: 0.107 | Y224: 34 | Z224: 3.59 | AA224: 1.e-003 | AB224: -7.6e-003 | AC224: -5.8200000000000002e-002 | AD224: -6.0499999999999998e-002 | AE224: 85.57 | AF224: 92.86 | AG224: 0.75 | AH224: AA- | AI224: 6.4899999999999999e-002 | AJ224: =H224+100*O224 -> 126.16 | AK224: 126.3 | AL224: 196 | AM224: 33.5 | AN224: 179 | AO224: 8.900000000000001e-002 | AP224: 14 | AQ224: 天目转债
A225: 182 | B225: 128094 | C225: 星帅转债 | D225: 2860 | E225: 星帅尔 | F225: 家电 | G225: 零部件制 | H225: 120.5 | I225: 1.7000000000000001e-002 | J225: -3.0999999999999999e-003 | K225: 16.79 | L225: 1.8200000000000001e-002 | M225: 121 | N225: 13.95 | O225: 1.e-003 | P225: 120.36 | Q225: 转股中 | R225: 4.87年 | S225: 2.87年 | T225: 2.74 | U225: 18 | V225: 5.7000000000000002e-002 | W225: 8.199999999999999e-002 | X225: 9.9000000000000005e-002 | Y225: 33 | Z225: 3.59 | AA225: 8.9999999999999998e-004 | AB225: -6.5000000000000006e-003 | AC225: -4.7599999999999996e-002 | AD225: -5.0000000000000003e-002 | AE225: 83.56 | AF225: 85.44 | AG225: 0.77 | AH225: A+ | AI225: 7.5899999999999995e-002 | AJ225: =H225+100*O225 -> 120.59999999999999 | AK225: 120.6 | AL225: 141 | AM225: 35.2 | AN225: 193 | AO225: 6.4000000000000001e-002 | AP225: 31 | AQ225: 星帅转债
A226: 140 | B226: 113579 | C226: 健友转债! | D226: 603707 | E226: 健友股份 | F226: 医药 | G226: 原料药 | H226: 113.99 | I226: -2.8999999999999998e-003 | J226: -1.2199999999999999e-002 | K226: 37.1 | L226: -3.1099999999999999e-002 | M226: 114.2 | N226: 42.05 | O226: 0.29199999999999998 | P226: 88.23 | Q226: 转股中 | R226: 5年48天 | S226: 3年49天 | T226: 5.03 | U226: 3.9 | V226: 6.9999999999999993e-003 | W226: 1.4999999999999999e-002 | X226: 1.3000000000000001e-002 | Y226: 347 | Z226: 10.11 | AA226: 4.0000000000000002e-004 | AB226: -4.5999999999999999e-003 | AC226: -2.8500000000000001e-002 | AD226: -3.0600000000000002e-002 | AE226: 89.76 | AF226: 91.45 | AG226: 0.48 | AH226: AA | AI226: 4.5199999999999997e-002 | AJ226: =H226+100*O226 -> 143.19 | AK226: 139.8 | AL226: 267 | AM226: 48.3 | AN226: 262 | AO226: 2.7000000000000003e-002 | AP226: 9 | AQ226: 健友转债!
A227: 50 | B227: 110076 | C227: 华海转债! | D227: 600521 | E227: 华海药业 | F227: 医药 | G227: 医药行业 | H227: 115 | I227: 6.5000000000000006e-003 | J227: -9.5999999999999992e-003 | K227: 27.7 | L227: -7.4999999999999997e-003 | M227: 115.1 | N227: 34.66 | O227: 0.439 | P227: 79.92 | Q227: 2月2天 | R227: 5.66年 | S227: 3.66年 | T227: 18.4 | U227: 12 | V227: 6.0000000000000001e-003 | W227: 4.5999999999999999e-002 | X227: 3.7000000000000005e-002 | Y227: 403 | Z227: 6.52 | AA227: 2.0000000000000001e-004 | AB227: -4.5999999999999999e-003 | AC227: -2.7099999999999999e-002 | AD227: -2.8799999999999999e-002 | AE227: 87.59 | AF227: 90.02 | AG227: 0.41 | AH227: AA | AI227: 4.5199999999999997e-002 | AJ227: =H227+100*O227 -> 158.90000000000001 | AK227: 150.1 | AL227: 288 | AM227: 60.1 | AN227: 293 | AO227: 4.0000000000000001e-003 | AP227: 6 | AQ227: 华海转债!
A228: 199 | B228: 110063 | C228: 鹰19转债 | D228: 600567 | E228: 山鹰国际 | F228: 造纸包装 | G228: 包装用纸 | H228: 115.95 | I228: -1.23e-002 | J228: 6.9999999999999993e-003 | K228: 3.59 | L228: -8.3000000000000001e-003 | M228: 115.9 | N228: 3.3 | O228: 6.6000000000000003e-002 | P228: 108.79 | Q228: 转股中 | R228: 4.77年 | S228: 2.78年 | T228: 18.5 | U228: 51 | V228: 2.4e-002 | W228: 0.11199999999999999 | X228: 0.122 | Y228: 165 | Z228: 1.12 | AA228: -1.e-004 | AB228: -6.0000000000000001e-003 | AC228: -3.9e-002 | AD228: -4.0999999999999995e-002 | AE228: 91.58 | AF228: 95.62 | AG228: 0.64 | AH228: AA+ | AI228: 4.1900000000000007e-002 | AJ228: =H228+100*O228 -> 122.55 | AK228: 123.1 | AL228: 174 | AM228: 27.5 | AN228: 124 | AO228: 4.7e-002 | AP228: 40 | AQ228: 鹰19转债
A229: 216 | B229: 128078 | C229: 太极转债! | D229: 2368 | E229: 太极股份 | F229: 计算机及 | G229: 软件开发 | H229: 116.99 | I229: 7.7000000000000002e-003 | J229: -7.7000000000000002e-003 | K229: 22.92 | L229: 6.6e-003 | M229: 116.9 | N229: 22.4 | O229: 0.14300000000000002 | P229: 102.32 | Q229: 转股中 | R229: 4.63年 | S229: 2.63年 | T229: 9.6 | U229: 2.2 | V229: 2.e-003 | W229: 7.2000000000000008e-002 | X229: 7.400000000000001e-002 | Y229: 133 | Z229: 4.32 | AA229: -2.0000000000000001e-004 | AB229: -6.6e-003 | AC229: -4.36e-002 | AD229: -4.58e-002 | AE229: 91.8 | AF229: 96.19 | AG229: 0 | AH229: AA | AI229: 4.3899999999999995e-002 | AJ229: =H229+100*O229 -> 131.28999999999999 | AK229: 131.7 | AL229: 226 | AM229: 35.5 | AN229: 197 | AO229: 2.2000000000000002e-002 | AP229: 12 | AQ229: 太极转债!
A230: 36 | B230: 123079 | C230: 运达转债 | D230: 300772 | E230: 运达股份 | F230: 能源电力 | G230: 风能 | H230: 115.5 | I230: 2.5999999999999999e-003 | J230: -1.0200000000000001e-002 | K230: 15.58 | L230: -1.2e-002 | M230: 115.1 | N230: 15.31 | O230: 0.13500000000000001 | P230: 101.76 | Q230: 3月4天 | R230: 5.74年 | S230: 3.74年 | T230: 5.77 | U230: 16 | V230: 2.4e-002 | W230: 0.126 | X230: 0.128 | Y230: 46 | Z230: 2.98 | AA230: -5.9999999999999995e-004 | AB230: -5.3e-003 | AC230: -2.76e-002 | AD230: -2.9300000000000003e-002 | AE230: 87.29 | AF230: 89.71 | AG230: 0.63 | AH230: AA | AI230: 4.5199999999999997e-002 | AJ230: =H230+100*O230 -> 129. | AK230: 129.2 | AL230: 212 | AM230: 39.5 | AN230: 227 | AO230: -5.9000000000000004e-002 | AP230: 4 | AQ230: 运达转债
A231: 311 | B231: 128032 | C231: 双环转债! | D231: 2472 | E231: 双环传动 | F231: 机械装备 | G231: 通用设备 | H231: 109.524 | I231: -2.7099999999999999e-002 | J231: 1.1399999999999999e-002 | K231: 9.49 | L231: -3.1600000000000003e-002 | M231: 109.3 | N231: 9.89 | O231: 0.14099999999999999 | P231: 95.96 | Q231: 转股中 | R231: 2.81年 | S231: 0.81年 | T231: 10 | U231: 17 | V231: 1.6e-002 | W231: 0.154 | X231: 0.14699999999999999 | Y231: 65 | Z231: 1.95 | AA231: -7.000000000000001e-004 | AB231: -6.8999999999999999e-003 | AC231: -7.2400000000000006e-002 | AD231: -7.5800000000000006e-002 | AE231: 97.79 | AF231: 97.5 | AG231: 0.49 | AH231: AA | AI231: 4.2199999999999994e-002 | AJ231: =H231+100*O231 -> 123.624 | AK231: 123.1 | AL231: 173 | AM231: 25.3 | AN231: 97 | AO231: 1.4999999999999999e-002 | AP231: 44 | AQ231: 双环转债!
A232: 228 | B232: 113542 | C232: 好客转债 | D232: 603898 | E232: 好莱客 | F232: 其他 | G232: 家居用品 | H232: 115.24 | I232: 7.1999999999999998e-003 | J232: 9.5999999999999992e-003 | K232: 17.51 | L232: 2.64e-002 | M232: 114.9 | N232: 16.27 | O232: 7.0999999999999994e-002 | P232: 107.62 | Q232: 转股中 | R232: 4.41年 | S232: 2.41年 | T232: 6.03 | U232: 3.3 | V232: 5.0000000000000001e-003 | W232: 0.111 | X232: 0.11900000000000001 | Y232: 55 | Z232: 2.22 | AA232: -7.000000000000001e-004 | AB232: -6.7000000000000002e-003 | AC232: -4.1599999999999998e-002 | AD232: -4.4000000000000004e-002 | AE232: 92.68 | AF232: 95.46 | AG232: 0.64 | AH232: AA | AI232: 4.3899999999999995e-002 | AJ232: =H232+100*O232 -> 122.33999999999999 | AK232: 122.9 | AL232: 170 | AM232: 27.4 | AN232: 121 | AO232: 2.4e-002 | AP232: 19 | AQ232: 好客转债
A233: 79 | B233: 113602 | C233: 景20转债! | D233: 603228 | E233: 景旺电子 | F233: 电子 | G233: 元器件制 | H233: 113.95 | I233: 3.0999999999999999e-003 | J233: 2.e-003 | K233: 29.04 | L233: 1.15e-002 | M233: 113.3 | N233: 35.28 | O233: 0.38400000000000001 | P233: 82.31 | Q233: 转股中 | R233: 5.47年 | S233: 3.47年 | T233: 17.8 | U233: 20 | V233: 1.e-002 | W233: 7.2000000000000008e-002 | X233: 5.9000000000000004e-002 | Y233: 248 | Z233: 4.13 | AA233: -1.1000000000000001e-003 | AB233: -5.5000000000000005e-003 | AC233: -2.5499999999999998e-002 | AD233: -2.75e-002 | AE233: 88.53 | AF233: 89.41 | AG233: 0.44 | AH233: AA | AI233: 4.5199999999999997e-002 | AJ233: =H233+100*O233 -> 152.34999999999999 | AK233: 145.6 | AL233: 276 | AM233: 56.2 | AN233: 286 | AO233: 7.2999999999999995e-002 | AP233: 9 | AQ233: 景20转债!
A234: 52 | B234: 113607 | C234: 伟20转债! | D234: 603568 | E234: 伟明环保 | F234: 城市公用 | G234: 三废处理 | H234: 115.96 | I234: -1.5800000000000002e-002 | J234: 7.1999999999999998e-003 | K234: 21.05 | L234: -1.4999999999999999e-002 | M234: 115.1 | N234: 22.01 | O234: 0.21199999999999999 | P234: 95.64 | Q234: 2月2天 | R234: 5.66年 | S234: 3.66年 | T234: 12 | U234: 3 | V234: 2.e-003 | W234: 4.4999999999999998e-002 | X234: 4.2999999999999997e-002 | Y234: 265 | Z234: 5.27 | AA234: -1.2999999999999999e-003 | AB234: -6.0999999999999995e-003 | AC234: -2.92e-002 | AD234: -3.0899999999999997e-002 | AE234: 87.59 | AF234: 90.02 | AG234: 0.57 | AH234: AA | AI234: 4.5199999999999997e-002 | AJ234: =H234+100*O234 -> 137.16 | AK234: 136.3 | AL234: 255 | AM234: 46.3 | AN234: 256 | AO234: 8.0000000000000002e-002 | AP234: 4 | AQ234: 伟20转债!
A235: 320 | B235: 128021 | C235: 兄弟转债!! | D235: 2562 | E235: 兄弟科技 | F235: 医药 | G235: 原料药 | H235: 109.298 | I235: 8.3000000000000001e-003 | J235: -8.3000000000000001e-003 | K235: 5.19 | L235: 1.7600000000000001e-002 | M235: 108.8 | N235: 5.19 | O235: 9.3000000000000013e-002 | P235: 100 | Q235: 转股中 | R235: 2.73年 | S235: 0.73年 | T235: 2.65 | U235: 2.6 | V235: 9.0000000000000011e-003 | W235: 4.8000000000000001e-002 | X235: 4.8000000000000001e-002 | Y235: 55 | Z235: 2.02 | AA235: -1.7000000000000001e-003 | AB235: -7.7000000000000002e-003 | AC235: -7.85e-002 | AD235: -8.1600000000000006e-002 | AE235: 97.85 | AF235: 97.33 | AG235: 0 | AH235: AA | AI235: 4.2199999999999994e-002 | AJ235: =H235+100*O235 -> 118.598 | AK235: 118.6 | AL235: 113 | AM235: 20.7 | AN235: 53 | AO235: 2.7000000000000003e-002 | AP235: 14 | AQ235: 兄弟转债!!
A236: 260 | B236: 128057 | C236: 博彦转债 | D236: 2649 | E236: 博彦科技 | F236: 计算机及 | G236: 软件开发 | H236: 117.258 | I236: 8.3999999999999995e-003 | J236: -9.7999999999999997e-003 | K236: 9.98 | L236: -2.e-003 | M236: 117.1 | N236: 8.72 | O236: 2.5000000000000001e-002 | P236: 114.45 | Q236: 转股中 | R236: 3.997年 | S236: 2年0.0天 | T236: 5.1 | U236: 5.6 | V236: 9.0000000000000011e-003 | W236: 9.6000000000000002e-002 | X236: 0.11 | Y236: 53 | Z236: 1.87 | AA236: -2.0999999999999999e-003 | AB236: -9.1999999999999998e-003 | AC236: -5.9299999999999999e-002 | AD236: -6.1600000000000002e-002 | AE236: 89.79 | AF236: 90.85 | AG236: 0.73 | AH236: AA- | AI236: 6.4899999999999999e-002 | AJ236: =H236+100*O236 -> 119.758 | AK236: 120.1 | AL236: 133 | AM236: 29.2 | AN236: 140 | AO236: 6.8000000000000005e-002 | AP236: 28 | AQ236: 博彦转债
A237: 46 | B237: 127024 | C237: 盈峰转债 | D237: 967 | E237: 盈峰环境 | F237: 机械装备 | G237: 专用设备 | H237: 118.65 | I237: -2.0199999999999999e-002 | J237: -6.6e-003 | K237: 8.77 | L237: -4.1500000000000002e-002 | M237: 116.8 | N237: 8.31 | O237: 0.124 | P237: 105.54 | Q237: 2月6天 | R237: 5.67年 | S237: 3.67年 | T237: 14.8 | U237: 40 | V237: 2.3e-002 | W237: 5.2999999999999999e-002 | X237: 5.5999999999999994e-002 | Y237: 277 | Z237: 1.72 | AA237: -2.8000000000000004e-003 | AB237: -8.0000000000000002e-003 | AC237: -3.5699999999999996e-002 | AD237: -3.73e-002 | AE237: 87.94 | AF237: 92.26 | AG237: 0.65 | AH237: AA+ | AI237: 4.3200000000000002e-002 | AJ237: =H237+100*O237 -> 131.05000000000001 | AK237: 131.8 | AL237: 227 | AM237: 39.5 | AN237: 226 | AO237: 4.4999999999999998e-002 | AP237: 5 | AQ237: 盈峰转债
A238: 113 | B238: 128119 | C238: 龙大转债! | D238: 2726 | E238: 龙大肉食 | F238: 食品饮料 | G238: 肉制品 | H238: 122.164 | I238: 1.2999999999999999e-003 | J238: 3.0999999999999999e-003 | K238: 10.87 | L238: 6.5000000000000006e-003 | M238: 120.2 | N238: 9.57 | O238: 7.5999999999999998e-002 | P238: 113.58 | Q238: 转股中 | R238: 5.35年 | S238: 3.36年 | T238: 9.5 | U238: 8.5 | V238: 6.9999999999999993e-003 | W238: 8.6999999999999994e-002 | X238: 9.9000000000000005e-002 | Y238: 109 | Z238: 3.51 | AA238: -3.0999999999999999e-003 | AB238: -9.4999999999999998e-003 | AC238: -4.58e-002 | AD238: -4.7699999999999992e-002 | AE238: 88.88 | AF238: 95.29 | AG238: 0.68 | AH238: AA | AI238: 4.5199999999999997e-002 | AJ238: =H238+100*O238 -> 129.76400000000001 | AK238: 130.7 | AL238: 221 | AM238: 35.5 | AN238: 196 | AO238: -6.4000000000000001e-002 | AP238: 8 | AQ238: 龙大转债!
A239: 278 | B239: 128048 | C239: 张行转债 | D239: 2839 | E239: 张家港行 | F239: 金融 | G239: 银行行业 | H239: 114.7 | I239: -2.7000000000000001e-003 | J239: 1.7000000000000001e-003 | K239: 5.86 | L239: -1.7000000000000001e-003 | M239: 113.3 | N239: 5.76 | O239: 0.127 | P239: 101.74 | Q239: 转股中 | R239: 3.69年 | S239: 无权 | T239: 25 | U239: 15 | V239: 5.0000000000000001e-003 | W239: 0.23600000000000002 | X239: 0.23999999999999999 | Y239: 106 | Z239: 1.01 | AA239: -3.4000000000000002e-003 | AB239: -9.8999999999999991e-003 | AC239: 无权 | AD239: 无权 | AE239: 无权 | AF239: 97.66 | AG239: 0.56 | AH239: AA+ | AI239: 4.1900000000000007e-002 | AJ239: =H239+100*O239 -> 127.40000000000001 | AK239: 127.7 | AL239: 201 | AM239: 30 | AN239: 151 | AO239: 3.1e-002 | AP239: 14 | AQ239: 张行转债
A240: 76 | B240: 123064 | C240: 万孚转债! | D240: 300482 | E240: 万孚生物 | F240: 医药 | G240: 医疗器械 | H240: 117.22 | I240: -6.6e-003 | J240: 1.89e-002 | K240: 82 | L240: 2.53e-002 | M240: 115.1 | N240: 93.57 | O240: 0.33799999999999997 | P240: 87.63 | Q240: 3.0天 | R240: 5.49年 | S240: 3.49年 | T240: 6 | U240: 6.4 | V240: 9.0000000000000011e-003 | W240: 2.1000000000000001e-002 | X240: 1.9e-002 | Y240: 281 | Z240: 10.38 | AA240: -3.4000000000000002e-003 | AB240: -8.199999999999999e-003 | AC240: -3.3399999999999999e-002 | AD240: -3.5200000000000002e-002 | AE240: 88.25 | AF240: 90.7 | AG240: 0.49 | AH240: AA | AI240: 4.5199999999999997e-002 | AJ240: =H240+100*O240 -> 151.01999999999998 | AK240: 146.8 | AL240: 279 | AM240: 56.1 | AN240: 285 | AO240: -6.9999999999999993e-003 | AP240: 10 | AQ240: 万孚转债!
A241: 206 | B241: 123035 | C241: 利德转债! | D241: 300296 | E241: 利亚德 | F241: 电子 | G241: LED制 | H241: 117 | I241: -4.8999999999999998e-003 | J241: 3.2000000000000002e-003 | K241: 7.57 | L241: -2.5999999999999999e-003 | M241: 115.1 | N241: 6.98 | O241: 7.9000000000000001e-002 | P241: 108.45 | Q241: 转股中 | R241: 4.69年 | S241: 2.70年 | T241: 8 | U241: 32 | V241: 3.4000000000000002e-002 | W241: 4.2000000000000003e-002 | X241: 4.4999999999999998e-002 | Y241: 192 | Z241: 2.25 | AA241: -3.5999999999999999e-003 | AB241: -9.300000000000001e-003 | AC241: -4.2000000000000003e-002 | AD241: -4.4299999999999999e-002 | AE241: 92.23 | AF241: 95.32 | AG241: 0.64 | AH241: AA+ | AI241: 4.1900000000000007e-002 | AJ241: =H241+100*O241 -> 124.90000000000001 | AK241: 125.5 | AL241: 192 | AM241: 30.2 | AN241: 155 | AO241: 0.122 | AP241: 16 | AQ241: 利德转债!
A242: 204 | B242: 113550 | C242: 常汽转债! | D242: 603035 | E242: 常熟汽饰 | F242: 汽车 | G242: 零部件制 | H242: 123.39 | I242: 1.8e-003 | J242: 1.e-004 | K242: 11.79 | L242: 2.5999999999999999e-003 | M242: 121.3 | N242: 9.65 | O242: 1.e-002 | P242: 122.18 | Q242: 转股中 | R242: 4.70年 | S242: 2.71年 | T242: 3.78 | U242: 11 | V242: 2.4e-002 | W242: 9.3000000000000013e-002 | X242: 0.114 | Y242: 40 | Z242: 1.18 | AA242: -3.7000000000000002e-003 | AB242: -1.1399999999999999e-002 | AC242: -5.7699999999999994e-002 | AD242: -6.0299999999999999e-002 | AE242: 87.18 | AF242: 90.88 | AG242: 0.75 | AH242: AA- | AI242: 6.4899999999999999e-002 | AJ242: =H242+100*O242 -> 124.39 | AK242: 124.6 | AL242: 185 | AM242: 33.7 | AN242: 180 | AO242: 3.6000000000000004e-002 | AP242: 15 | AQ242: 常汽转债!
A243: 69 | B243: 113603 | C243: 东缆转债 | D243: 603606 | E243: 东方电缆 | F243: 能源电力 | G243: 电力设备 | H243: 118.29 | I243: -6.0999999999999995e-003 | J243: 8.3999999999999995e-003 | K243: 22.49 | L243: 4.0000000000000001e-003 | M243: 115.1 | N243: 23.88 | O243: 0.25600000000000001 | P243: 94.18 | Q243: 25天 | R243: 5.55年 | S243: 3.56年 | T243: 8 | U243: 7.4 | V243: 8.0000000000000002e-003 | W243: 5.4000000000000006e-002 | X243: 5.0999999999999997e-002 | Y243: 147 | Z243: 5.43 | AA243: -5.0000000000000001e-003 | AB243: -9.7999999999999997e-003 | AC243: -3.5299999999999998e-002 | AD243: -3.7000000000000005e-002 | AE243: 88.01 | AF243: 90.45 | AG243: 0.55 | AH243: AA | AI243: 4.5199999999999997e-002 | AJ243: =H243+100*O243 -> 143.89000000000001 | AK243: 142.4 | AL243: 272 | AM243: 52 | AN243: 274 | AO243: -6.6000000000000003e-002 | AP243: 6 | AQ243: 东缆转债
A244: 77 | B244: 128130 | C244: 景兴转债 | D244: 2067 | E244: 景兴纸业 | F244: 造纸包装 | G244: 包装用纸 | H244: 118.516 | I244: -2.3999999999999998e-003 | J244: -3.0000000000000001e-003 | K244: 4.04 | L244: -7.4000000000000003e-003 | M244: 115.1 | N244: 3.4 | O244: -3.0000000000000001e-003 | P244: 118.82 | Q244: 转股中 | R244: 5.49年 | S244: 3.49年 | T244: 12.5 | U244: 35 | V244: 2.3e-002 | W244: 0.27899999999999997 | X244: 0.33100000000000002 | Y244: 45 | Z244: 0.99 | AA244: -5.4000000000000003e-003 | AB244: -1.03e-002 | AC244: -3.6400000000000002e-002 | AD244: -3.8199999999999998e-002 | AE244: 88.26 | AF244: 90.71 | AG244: 0.73 | AH244: AA | AI244: 4.5199999999999997e-002 | AJ244: =H244+100*O244 -> 118.21600000000001 | AK244: 118.2 | AL244: 106 | AM244: 27.5 | AN244: 123 | AO244: 2.8999999999999998e-002 | AP244: 13 | AQ244: 景兴转债
A245: 18 | B245: 113614 | C245: 健20转债! | D245: 603707 | E245: 健友股份 | F245: 医药 | G245: 原料药 | H245: 118.52 | I245: -1.7899999999999999e-002 | J245: -1.e-003 | K245: 37.1 | L245: -3.1099999999999999e-002 | M245: 114.2 | N245: 38.04 | O245: 0.215 | P245: 97.53 | Q245: 3月20天 | R245: 5.78年 | S245: 3.79年 | T245: 7.8 | U245: 12 | V245: 1.3000000000000001e-002 | W245: 2.3e-002 | X245: 2.2000000000000002e-002 | Y245: 347 | Z245: 10.11 | AA245: -6.5000000000000006e-003 | AB245: -1.09e-002 | AC245: -3.3500000000000002e-002 | AD245: -3.5200000000000002e-002 | AE245: 87.21 | AF245: 88.85 | AG245: 0.61 | AH245: AA | AI245: 4.5199999999999997e-002 | AJ245: =H245+100*O245 -> 140.01999999999998 | AK245: 139.5 | AL245: 266 | AM245: 50.7 | AN245: 269 | AO245: 2.7000000000000003e-002 | AP245: 3 | AQ245: 健20转债!
A246: 220 | B246: 128075 | C246: 远东转债! | D246: 2406 | E246: 远东传动 | F246: 汽车 | G246: 零部件制 | H246: 118.35 | I246: 1.0800000000000001e-002 | J246: -6.3e-003 | K246: 6.45 | L246: 6.1999999999999998e-003 | M246: 114.9 | N246: 5.54 | O246: 1.7000000000000001e-002 | P246: 116.43 | Q246: 转股中 | R246: 4.55年 | S246: 2.55年 | T246: 5.44 | U246: 8.9 | V246: 1.3999999999999999e-002 | W246: 0.13500000000000001 | X246: 0.157 | Y246: 40 | Z246: 1.29 | AA246: -6.6e-003 | AB246: -1.24e-002 | AC246: -4.8899999999999999e-002 | AD246: -5.1100000000000007e-002 | AE246: 92.1 | AF246: 94.87 | AG246: 0.71 | AH246: AA | AI246: 4.3899999999999995e-002 | AJ246: =H246+100*O246 -> 120.05 | AK246: 120.3 | AL246: 136 | AM246: 25.4 | AN246: 100 | AO246: 3.7000000000000005e-002 | AP246: 15 | AQ246: 远东转债!
A247: 180 | B247: 128096 | C247: 奥瑞转债!! | D247: 2701 | E247: 奥瑞金 | F247: 造纸包装 | G247: 包装材料 | H247: 119.692 | I247: -1.e-004 | J247: 6.9999999999999993e-003 | K247: 5.29 | L247: 9.4999999999999998e-003 | M247: 115.5 | N247: 4.54 | O247: 2.7000000000000003e-002 | P247: 116.52 | Q247: 转股中 | R247: 4.94年 | S247: 2.94年 | T247: 7.08 | U247: 13 | V247: 1.6e-002 | W247: 5.5e-002 | X247: 6.5000000000000002e-002 | Y247: 128 | Z247: 2.14 | AA247: -7.3000000000000001e-003 | AB247: -1.29e-002 | AC247: -4.5100000000000001e-002 | AD247: -4.7400000000000005e-002 | AE247: 91.52 | AF247: 94.71 | AG247: 0.72 | AH247: AA+ | AI247: 4.1900000000000007e-002 | AJ247: =H247+100*O247 -> 122.392 | AK247: 122.9 | AL247: 171 | AM247: 28.2 | AN247: 132 | AO247: 6.5000000000000002e-002 | AP247: 20 | AQ247: 奥瑞转债!!
A248: 131 | B248: 113585 | C248: 寿仙转债! | D248: 603896 | E248: 寿仙谷 | F248: 医药 | G248: 中药 | H248: 122.71 | I248: -5.5000000000000005e-003 | J248: 7.8000000000000005e-003 | K248: 35.3 | L248: 2.8000000000000004e-003 | M248: 117.8 | N248: 28.68 | O248: -3.0000000000000001e-003 | P248: 123.08 | Q248: 转股中 | R248: 5.26年 | S248: 3.26年 | T248: 1.92 | U248: 15 | V248: 6.4000000000000001e-002 | W248: 3.7000000000000005e-002 | X248: 4.4999999999999998e-002 | Y248: 52 | Z248: 4.11 | AA248: -7.9000000000000008e-003 | AB248: -1.37e-002 | AC248: -4.7300000000000002e-002 | AD248: -4.9400000000000006e-002 | AE248: 83.83 | AF248: 84.76 | AG248: 0.8 | AH248: AA- | AI248: 6.6199999999999995e-002 | AJ248: =H248+100*O248 -> 122.41 | AK248: 122.3 | AL248: 165 | AM248: 37.6 | AN248: 213 | AO248: -6.4000000000000001e-002 | AP248: 8 | AQ248: 寿仙转债!
A249: 215 | B249: 128079 | C249: 英联转债! | D249: 2846 | E249: 英联股份 | F249: 造纸包装 | G249: 包装材料 | H249: 122 | I249: 2.5000000000000001e-002 | J249: -2.5999999999999999e-003 | K249: 15.99 | L249: 2.2400000000000003e-002 | M249: 117.5 | N249: 13.41 | O249: 2.3e-002 | P249: 119.24 | Q249: 转股中 | R249: 4.63年 | S249: 2.63年 | T249: 1.52 | U249: 188 | V249: 1.01 | W249: 4.8000000000000001e-002 | X249: 5.7000000000000002e-002 | Y249: 32 | Z249: 4.1 | AA249: -8.199999999999999e-003 | AB249: -1.4800000000000001e-002 | AC249: -5.7099999999999998e-002 | AD249: -5.9400000000000001e-002 | AE249: 84.66 | AF249: 84.37 | AG249: 1 | AH249: A+ | AI249: 7.5899999999999995e-002 | AJ249: =H249+100*O249 -> 124.3 | AK249: 124.8 | AL249: 187 | AM249: 40.1 | AN249: 231 | AO249: 3.7000000000000005e-002 | AP249: 20 | AQ249: 英联转债!
A250: 82 | B250: 128128 | C250: 齐翔转2 | D250: 2408 | E250: 齐翔腾达 | F250: 化工 | G250: 化工 | H250: 120.66 | I250: 9.8999999999999991e-003 | J250: 1.e-004 | K250: 9.96 | L250: 1.32e-002 | M250: 115.3 | N250: 8.22 | O250: -4.0000000000000001e-003 | P250: 121.17 | Q250: 转股中 | R250: 5.46年 | S250: 3.46年 | T250: 22.6 | U250: 494 | V250: 0.18100000000000002 | W250: 0.128 | X250: 0.155 | Y250: 177 | Z250: 2.16 | AA250: -8.3999999999999995e-003 | AB250: -1.34e-002 | AC250: -4.1200000000000001e-002 | AD250: -4.2999999999999997e-002 | AE250: 88.49 | AF250: 91.01 | AG250: 0.76 | AH250: AA | AI250: 4.5199999999999997e-002 | AJ250: =H250+100*O250 -> 120.25999999999999 | AK250: 120.2 | AL250: 134 | AM250: 29.1 | AN250: 137 | AO250: 0.121 | AP250: 41 | AQ250: 齐翔转2
A251: 45 | B251: 127025 | C251: 冀东转债 | D251: 401 | E251: 冀东水泥 | F251: 建筑 | G251: 水泥 | H251: 115.599 | I251: -2.23e-002 | J251: 6.9999999999999993e-003 | K251: 15.29 | L251: -2.5499999999999998e-002 | M251: 110.1 | N251: 15.78 | O251: 0.193 | P251: 96.89 | Q251: 2月7天 | R251: 5.67年 | S251: 3.67年 | T251: 28.2 | U251: 5.8 | V251: 2.e-003 | W251: 0.13699999999999998 | X251: 0.13300000000000001 | Y251: 206 | Z251: 1.52 | AA251: -8.6999999999999994e-003 | AB251: -1.1899999999999999e-002 | AC251: -3.0200000000000001e-002 | AD251: -3.15e-002 | AE251: 88.5 | AF251: 88.34 | AG251: 0.6 | AH251: AAA | AI251: 4.0199999999999993e-002 | AJ251: =H251+100*O251 -> 134.899 | AK251: 134.3 | AL251: 241 | AM251: 45.8 | AN251: 254 | AO251: 4.0999999999999995e-002 | AP251: 9 | AQ251: 冀东转债
A252: 275 | B252: 110048 | C252: 福能转债! | D252: 600483 | E252: 福能股份 | F252: 能源电力 | G252: 电力供应 | H252: 117.07 | I252: 1.3899999999999999e-002 | J252: 2.1499999999999998e-002 | K252: 9.65 | L252: 4.7800000000000002e-002 | M252: 113.3 | N252: 8.12 | O252: -1.4999999999999999e-002 | P252: 118.84 | Q252: 转股中 | R252: 3.76年 | S252: 1.76年 | T252: 28.3 | U252: 298 | V252: 9.0999999999999998e-002 | W252: 0.16699999999999998 | X252: 0.19800000000000001 | Y252: 170 | Z252: 1.21 | AA252: -8.8000000000000005e-003 | AB252: -1.5100000000000001e-002 | AC252: -6.5700000000000008e-002 | AD252: -6.83e-002 | AE252: 95.04 | AF252: 97.39 | AG252: 0.74 | AH252: AA+ | AI252: 4.1900000000000007e-002 | AJ252: =H252+100*O252 -> 115.56999999999999 | AK252: 115.3 | AL252: 83 | AM252: 17.9 | AN252: 34 | AO252: 0.20100000000000001 | AP252: 9 | AQ252: 福能转债!
A253: 210 | B253: 113548 | C253: 石英转债! | D253: 603688 | E253: 石英股份 | F253: 电子 | G253: 电子产品 | H253: 129.72 | I253: 2.0000000000000001e-004 | J253: 2.0000000000000001e-004 | K253: 18.68 | L253: 5.0000000000000001e-004 | M253: 124.4 | N253: 15.1 | O253: 4.9000000000000002e-002 | P253: 123.71 | Q253: 转股中 | R253: 4.65年 | S253: 2.65年 | T253: 1.23 | U253: 10 | V253: 6.3e-002 | W253: 1.9e-002 | X253: 2.3e-002 | Y253: 66 | Z253: 3.5 | AA253: -9.1999999999999998e-003 | AB253: -1.78e-002 | AC253: -7.5199999999999989e-002 | AD253: -7.7800000000000008e-002 | AE253: 87.57 | AF253: 93.52 | AG253: 0.74 | AH253: AA- | AI253: 6.4899999999999999e-002 | AJ253: =H253+100*O253 -> 134.62 | AK253: 135.7 | AL253: 252 | AM253: 42.2 | AN253: 242 | AO253: 1.7000000000000001e-002 | AP253: 12 | AQ253: 石英转债!
A254: 16 | B254: 128142 | C254: 新乳转债 | D254: 2946 | E254: 新乳业 | F254: 食品饮料 | G254: 乳制品 | H254: 121.399 | I254: 3.3e-003 | J254: 1.9799999999999998e-002 | K254: 19.18 | L254: 3.56e-002 | M254: 115.1 | N254: 18.69 | O254: 0.183 | P254: 102.62 | Q254: 3月21天 | R254: 5.79年 | S254: 3.79年 | T254: 7.18 | U254: 8 | V254: 9.0000000000000011e-003 | W254: 4.4000000000000004e-002 | X254: 4.4999999999999998e-002 | Y254: 164 | Z254: 8.01 | AA254: -9.300000000000001e-003 | AB254: -1.3899999999999999e-002 | AC254: -3.9599999999999996e-002 | AD254: -4.1200000000000001e-002 | AE254: 87.11 | AF254: 89.52 | AG254: 0.65 | AH254: AA | AI254: 4.5199999999999997e-002 | AJ254: =H254+100*O254 -> 139.69900000000001 | AK254: 140.2 | AL254: 268 | AM254: 50.7 | AN254: 268 | AO254: 2.9999999999999999e-002 | AP254: 3 | AQ254: 新乳转债
A255: 1 | B255: 123098 | C255: 一品转债 | D255: 300723 | E255: 一品红 | F255: 医药 | G255: 医药行业 | H255: 131.199 | I255: 6.8999999999999999e-003 | J255: 1.34e-002 | K255: 50.24 | L255: 2.87e-002 | M255: 124 | N255: 45.78 | O255: 0.19600000000000001 | P255: 109.74 | Q255: 5月1天 | R255: 5.90年 | S255: 3.90年 | T255: 4.8 | U255: 25 | V255: 4.0000000000000001e-002 | W255: 5.9000000000000004e-002 | X255: 6.5000000000000002e-002 | Y255: 81 | Z255: 5.52 | AA255: -9.7000000000000003e-003 | AB255: -1.6399999999999998e-002 | AC255: -5.6100000000000004e-002 | AD255: -5.7800000000000004e-002 | AE255: 80.27 | AF255: 85.57 | AG255: 0.71 | AH255: AA- | AI255: 6.6199999999999995e-002 | AJ255: =H255+100*O255 -> 150.79900000000001 | AK255: 152.7 | AL255: 294 | AM255: 67.1 | AN255: 301 | AO255: 8.5000000000000006e-002 | AP255: 2 | AQ255: 一品转债
A256: 128 | B256: 128113 | C256: 比音转债 | D256: 2832 | E256: 比音勒芬 | F256: 服装纺织 | G256: 服装行业 | H256: 123.438 | I256: -4.5999999999999999e-003 | J256: 1.2999999999999999e-003 | K256: 17.92 | L256: -4.4000000000000003e-003 | M256: 117.3 | N256: 14.9 | O256: 2.6000000000000002e-002 | P256: 120.27 | Q256: 转股中 | R256: 5.28年 | S256: 3.28年 | T256: 6.89 | U256: 6.9 | V256: 8.0000000000000002e-003 | W256: 7.2999999999999995e-002 | X256: 8.8000000000000009e-002 | Y256: 94 | Z256: 4.36 | AA256: -9.7999999999999997e-003 | AB256: -1.55e-002 | AC256: -4.9500000000000002e-002 | AD256: -5.1399999999999994e-002 | AE256: 89.28 | AF256: 93.34 | AG256: 0.75 | AH256: AA | AI256: 4.5199999999999997e-002 | AJ256: =H256+100*O256 -> 126.038 | AK256: 126.6 | AL256: 198 | AM256: 33.3 | AN256: 178 | AO256: 7.4999999999999997e-002 | AP256: 7 | AQ256: 比音转债
A257: 166 | B257: 113572 | C257: 三祥转债! | D257: 603663 | E257: 三祥新材 | F257: 其他 | G257: 其他 | H257: 119.13 | I257: 9.1000000000000004e-003 | J257: 5.6999999999999993e-003 | K257: 16.71 | L257: 1.83e-002 | M257: 113.2 | N257: 14.19 | O257: 1.2e-002 | P257: 117.76 | Q257: 转股中 | R257: 5年6.0天 | S257: 3年7天 | T257: 1.69 | U257: 9.3 | V257: 4.5999999999999999e-002 | W257: 5.2999999999999999e-002 | X257: 6.2e-002 | Y257: 32 | Z257: 5.4 | AA257: -1.03e-002 | AB257: -1.4999999999999999e-002 | AC257: -4.2999999999999997e-002 | AD257: -4.5100000000000001e-002 | AE257: 82.05 | AF257: 78.61 | AG257: 0.81 | AH257: A+ | AI257: 7.7199999999999991e-002 | AJ257: =H257+100*O257 -> 120.33 | AK257: 120.5 | AL257: 138 | AM257: 38.4 | AN257: 219 | AO257: 8.0000000000000002e-002 | AP257: 18 | AQ257: 三祥转债!
A258: 4 | B258: 113621 | C258: 彤程转债 | D258: 603650 | E258: 彤程新材 | F258: 化工 | G258: 橡胶塑料 | H258: 122.5 | I258: -2.e-003 | J258: -8.5000000000000006e-003 | K258: 38 | L258: -1.3999999999999999e-002 | M258: 115.1 | N258: 32.96 | O258: 6.3e-002 | P258: 115.29 | Q258: 5月0天 | R258: 5.89年 | S258: 3.90年 | T258: 8 | U258: 51 | V258: 5.2000000000000005e-002 | W258: 3.6000000000000004e-002 | X258: 4.0999999999999995e-002 | Y258: 223 | Z258: 9.45 | AA258: -1.0700000000000001e-002 | AB258: -1.52e-002 | AC258: -4.07e-002 | AD258: -4.2300000000000004e-002 | AE258: 86.7 | AF258: 89.1 | AG258: 0.75 | AH258: AA | AI258: 4.5199999999999997e-002 | AJ258: =H258+100*O258 -> 128.80000000000001 | AK258: 129.7 | AL258: 215 | AM258: 40.6 | AN258: 233 | AO258: 6.3e-002 | AP258: 1 | AQ258: 彤程转债
A259: 266 | B259: 128053 | C259: 尚荣转债! | D259: 2551 | E259: 尚荣医疗 | F259: 医药 | G259: 医疗器械 | H259: 119.2 | I259: 1.7000000000000001e-003 | J259: 2.0099999999999996e-002 | K259: 5.6 | L259: 2.1899999999999999e-002 | M259: 114.3 | N259: 4.89 | O259: 4.0999999999999995e-002 | P259: 114.52 | Q259: 转股中 | R259: 3.95年 | S259: 1.95年 | T259: 1.91 | U259: 36 | V259: 0.158 | W259: 4.2000000000000003e-002 | X259: 4.8000000000000001e-002 | Y259: 46 | Z259: 1.55 | AA259: -1.0800000000000001e-002 | AB259: -1.7100000000000001e-002 | AC259: -6.8000000000000005e-002 | AD259: -7.0400000000000004e-002 | AE259: 93.93 | AF259: 96.75 | AG259: 0.99 | AH259: AA | AI259: 4.3899999999999995e-002 | AJ259: =H259+100*O259 -> 123.3 | AK259: 123.9 | AL259: 181 | AM259: 27.1 | AN259: 119 | AO259: 4.0999999999999995e-002 | AP259: 27 | AQ259: 尚荣转债!
A260: 48 | B260: 128136 | C260: 立讯转债 | D260: 2475 | E260: 立讯精密 | F260: 电子 | G260: 元器件制 | H260: 119 | I260: 1.7000000000000001e-003 | J260: 1.1699999999999999e-002 | K260: 47.63 | L260: 3.0699999999999998e-002 | M260: 111.9 | N260: 58.38 | O260: 0.45899999999999996 | P260: 81.59 | Q260: 2月5天 | R260: 5.66年 | S260: 3.67年 | T260: 30 | U260: 59 | V260: 1.7000000000000001e-002 | W260: 9.0000000000000011e-003 | X260: 6.9999999999999993e-003 | Y260: 3349. | Z260: 13.36 | AA260: -1.09e-002 | AB260: -1.47e-002 | AC260: -3.85e-002 | AD260: -3.9699999999999999e-002 | AE260: 87.12 | AF260: 88.3 | AG260: 0.44 | AH260: AA+ | AI260: 4.3200000000000002e-002 | AJ260: =H260+100*O260 -> 164.90000000000001 | AK260: 156.4 | AL260: 302 | AM260: 68.1 | AN260: 303 | AO260: -3.9e-002 | AP260: 11 | AQ260: 立讯转债
A261: 91 | B261: 113598 | C261: 法兰转债 | D261: 603966 | E261: 法兰泰克 | F261: 机械装备 | G261: 工程机械 | H261: 128.71 | I261: 2.7300000000000001e-002 | J261: -1.09e-002 | K261: 17.63 | L261: 2.0799999999999999e-002 | M261: 121.2 | N261: 13.88 | O261: 1.3000000000000001e-002 | P261: 127.02 | Q261: 转股中 | R261: 5.40年 | S261: 3.41年 | T261: 3.3 | U261: 46 | V261: 0.11 | W261: 8.900000000000001e-002 | X261: 0.113 | Y261: 37 | Z261: 3.34 | AA261: -1.1299999999999999e-002 | AB261: -1.7899999999999999e-002 | AC261: -5.8200000000000002e-002 | AD261: -6.0199999999999997e-002 | AE261: 83.04 | AF261: 86.39 | AG261: 0.79 | AH261: AA- | AI261: 6.6199999999999995e-002 | AJ261: =H261+100*O261 -> 130.01000000000002 | AK261: 130.4 | AL261: 220 | AM261: 44 | AN261: 251 | AO261: 6.5000000000000002e-002 | AP261: 8 | AQ261: 法兰转债
A262: 152 | B262: 113034 | C262: 滨化转债 | D262: 601678 | E262: 滨化股份 | F262: 化工 | G262: 化工 | H262: 121.9 | I262: -1.6500000000000001e-002 | J262: 1.1299999999999999e-002 | K262: 5.7 | L262: -6.9999999999999993e-003 | M262: 115.1 | N262: 4.68 | O262: 1.e-003 | P262: 121.79 | Q262: 转股中 | R262: 5年35天 | S262: 3年36天 | T262: 17.3 | U262: 18 | V262: 9.0000000000000011e-003 | W262: 0.185 | X262: 0.22500000000000001 | Y262: 94 | Z262: 1.41 | AA262: -1.1399999999999999e-002 | AB262: -1.66e-002 | AC262: -4.9000000000000002e-002 | AD262: -5.0999999999999997e-002 | AE262: 89.81 | AF262: 92.3 | AG262: 0.76 | AH262: AA | AI262: 4.5199999999999997e-002 | AJ262: =H262+100*O262 -> 122. | AK262: 122 | AL262: 158 | AM262: 29.7 | AN262: 146 | AO262: 5.2999999999999999e-002 | AP262: 27 | AQ262: 滨化转债
A263: 287 | B263: 123012 | C263: 万顺转债! | D263: 300057 | E263: 万顺新材 | F263: 有色金属 | G263: 铝金属 | H263: 114.72 | I263: 3.0000000000000001e-003 | J263: 1.1000000000000001e-002 | K263: 5.14 | L263: 2.3900000000000001e-002 | M263: 110.3 | N263: 5.31 | O263: 0.185 | P263: 96.8 | Q263: 转股中 | R263: 3.37年 | S263: 1.38年 | T263: 1.29 | U263: 14 | V263: 9.8000000000000004e-002 | W263: 3.7000000000000005e-002 | X263: 3.6000000000000004e-002 | Y263: 35 | Z263: 1.02 | AA263: -1.18e-002 | AB263: -1.7399999999999999e-002 | AC263: -6.93e-002 | AD263: -7.2499999999999995e-002 | AE263: 93.38 | AF263: 89.63 | AG263: 0.59 | AH263: AA- | AI263: 6.4899999999999999e-002 | AJ263: =H263+100*O263 -> 133.22 | AK263: 132.6 | AL263: 233 | AM263: 39.3 | AN263: 224 | AO263: 0.126 | AP263: 19 | AQ263: 万顺转债!
A264: 47 | B264: 128137 | C264: 洁美转债 | D264: 2859 | E264: 洁美科技 | F264: 电子 | G264: 元器件制 | H264: 125.4 | I264: 2.3700000000000002e-002 | J264: 5.0000000000000001e-003 | K264: 30.54 | L264: 3.8399999999999997e-002 | M264: 117.3 | N264: 27.77 | O264: 0.14000000000000001 | P264: 109.97 | Q264: 2月6天 | R264: 5.67年 | S264: 3.67年 | T264: 6 | U264: 32 | V264: 4.2999999999999997e-002 | W264: 4.8000000000000001e-002 | X264: 5.2999999999999999e-002 | Y264: 126 | Z264: 7.18 | AA264: -1.1899999999999999e-002 | AB264: -1.72e-002 | AC264: -4.8499999999999995e-002 | AD264: -5.0300000000000004e-002 | AE264: 81.38 | AF264: 82.16 | AG264: 0.75 | AH264: AA- | AI264: 6.6199999999999995e-002 | AJ264: =H264+100*O264 -> 139.40000000000001 | AK264: 140.8 | AL264: 269 | AM264: 58.7 | AN264: 292 | AO264: 8.199999999999999e-002 | AP264: 4 | AQ264: 洁美转债
A265: 56 | B265: 127023 | C265: 华菱转2 | D265: 932 | E265: 华菱钢铁 | F265: 钢铁 | G265: 炼钢 | H265: 118.08 | I265: -6.4899999999999999e-002 | J265: -4.5999999999999999e-003 | K265: 6.32 | L265: -8.929999999999999e-002 | M265: 110.1 | N265: 5.18 | O265: -3.2000000000000001e-002 | P265: 122.01 | Q265: 55天 | R265: 5.63年 | S265: 4.64年 | T265: 40 | U265: 677 | V265: 0.14400000000000002 | W265: 0.10300000000000001 | X265: 0.126 | Y265: 387 | Z265: 1.23 | AA265: -1.2500000000000001e-002 | AB265: -1.5800000000000002e-002 | AC265: -2.5499999999999998e-002 | AD265: -2.7200000000000002e-002 | AE265: 86.61 | AF265: 88.47 | AG265: 0.78 | AH265: AAA | AI265: 4.0199999999999993e-002 | AJ265: =H265+100*O265 -> 114.88 | AK265: 114.2 | AL265: 73 | AM265: 25.7 | AN265: 103 | AO265: 0.14999999999999999 | AP265: 10 | AQ265: 华菱转2
A266: 337 | B266: 110034 | C266: 九州转债! | D266: 600998 | E266: 九州通 | F266: 医药 | G266: 医药商业 | H266: 109.21 | I266: 2.8000000000000004e-003 | J266: 2.2000000000000001e-003 | K266: 17.63 | L266: 1.9699999999999999e-002 | M266: 108 | N266: 18.32 | O266: 0.13500000000000001 | P266: 96.23 | Q266: 转股中 | R266: 0.87年 | S266: 回售内 | T266: 15 | U266: 12 | V266: 6.9999999999999993e-003 | W266: 4.4999999999999998e-002 | X266: 4.4000000000000004e-002 | Y266: 330 | Z266: 1.76 | AA266: -1.2800000000000001e-002 | AB266: -2.9700000000000001e-002 | AC266: 回售内 | AD266: 回售内 | AE266: 103 | AF266: 104.62 | AG266: 0.26 | AH266: AA+ | AI266: 3.7400000000000003e-002 | AJ266: =H266+100*O266 -> 122.70999999999999 | AK266: 122.2 | AL266: 161 | AM266: 17.6 | AN266: 33 | AO266: 1.3999999999999999e-002 | AP266: 26 | AQ266: 九州转债!
A267: 12 | B267: 113615 | C267: 金诚转债 | D267: 603979 | E267: 金诚信 | F267: 有色金属 | G267: 有色行业 | H267: 126.61 | I267: -1.0700000000000001e-002 | J267: -1.4000000000000002e-003 | K267: 15.33 | L267: -1.6e-002 | M267: 117.3 | N267: 12.73 | O267: 5.0999999999999997e-002 | P267: 120.42 | Q267: 3月26天 | R267: 5.80年 | S267: 3.80年 | T267: 10 | U267: 24 | V267: 1.9e-002 | W267: 0.11199999999999999 | X267: 0.13500000000000001 | Y267: 89 | Z267: 2 | AA267: -1.3300000000000001e-002 | AB267: -1.84e-002 | AC267: -4.9200000000000001e-002 | AD267: -5.0900000000000001e-002 | AE267: 87.24 | AF267: 91.21 | AG267: 0.75 | AH267: AA | AI267: 4.5199999999999997e-002 | AJ267: =H267+100*O267 -> 131.71000000000001 | AK267: 132.8 | AL267: 235 | AM267: 41.6 | AN267: 239 | AO267: 9.6000000000000002e-002 | AP267: 3 | AQ267: 金诚转债
A268: 328 | B268: 113013 | C268: 国君转债! | D268: 601211 | E268: 国泰君安 | F268: 金融 | G268: 证券行业 | H268: 111.79 | I268: 3.0999999999999999e-003 | J268: -1.1000000000000001e-003 | K268: 16.47 | L268: 6.7000000000000002e-003 | M268: 108.3 | N268: 19.01 | O268: 0.28999999999999998 | P268: 86.64 | Q268: 转股中 | R268: 2.34年 | S268: 无权 | T268: 69.9 | U268: 75 | V268: 1.e-002 | W268: 4.8000000000000001e-002 | X268: 4.0999999999999995e-002 | Y268: 1467. | Z268: 1.18 | AA268: -1.37e-002 | AB268: -2.0299999999999999e-002 | AC268: 无权 | AD268: 无权 | AE268: 无权 | AF268: 99.6 | AG268: 0.31 | AH268: AAA | AI268: 3.7200000000000004e-002 | AJ268: =H268+100*O268 -> 140.78999999999999 | AK268: 136.9 | AL268: 259 | AM268: 37.3 | AN268: 211 | AO268: -2.e-003 | AP268: 14 | AQ268: 国君转债!
A269: 72 | B269: 123066 | C269: 赛意转债 | D269: 300687 | E269: 赛意信息 | F269: 计算机及 | G269: 软件开发 | H269: 131.15 | I269: -1.54e-002 | J269: 6.0999999999999995e-003 | K269: 29.16 | L269: -1.15e-002 | M269: 121.4 | N269: 22.58 | O269: 1.6e-002 | P269: 129.14 | Q269: 17天 | R269: 5.53年 | S269: 3.53年 | T269: 3.2 | U269: 30 | V269: 7.0000000000000007e-002 | W269: 5.0999999999999997e-002 | X269: 6.5000000000000002e-002 | Y269: 63 | Z269: 6.68 | AA269: -1.41e-002 | AB269: -2.06e-002 | AC269: -6.0499999999999998e-002 | AD269: -6.25e-002 | AE269: 79.47 | AF269: 81.21 | AG269: 0.8 | AH269: A+ | AI269: 7.7199999999999991e-002 | AJ269: =H269+100*O269 -> 132.75 | AK269: 133.2 | AL269: 236 | AM269: 52 | AN269: 275 | AO269: 4.8000000000000001e-002 | AP269: 7 | AQ269: 赛意转债
A270: 138 | B270: 128108 | C270: 蓝帆转债! | D270: 2382 | E270: 蓝帆医疗 | F270: 医药 | G270: 医疗器械 | H270: 122.15 | I270: -1.1999999999999999e-003 | J270: 3.7000000000000002e-003 | K270: 21.6 | L270: 3.3e-003 | M270: 113.3 | N270: 17.79 | O270: 6.0000000000000001e-003 | P270: 121.42 | Q270: 转股中 | R270: 5.23年 | S270: 4.23年 | T270: 16.6 | U270: 148 | V270: 7.2999999999999995e-002 | W270: 7.400000000000001e-002 | X270: 8.9999999999999997e-002 | Y270: 223 | Z270: 2.18 | AA270: -1.46e-002 | AB270: -1.9099999999999999e-002 | AC270: -3.3000000000000002e-002 | AD270: -3.5299999999999998e-002 | AE270: 87.27 | AF270: 90.37 | AG270: 0.77 | AH270: AA | AI270: 4.5199999999999997e-002 | AJ270: =H270+100*O270 -> 122.75 | AK270: 122.9 | AL270: 172 | AM270: 32.5 | AN270: 174 | AO270: -8.4000000000000005e-002 | AP270: 25 | AQ270: 蓝帆转债!
A271: 183 | B271: 123042 | C271: 银河转债! | D271: 300619 | E271: 金银河 | F271: 机械装备 | G271: 专用设备 | H271: 124 | I271: -1.9900000000000001e-002 | J271: 2.7200000000000002e-002 | K271: 20.48 | L271: 1.29e-002 | M271: 115.4 | N271: 24.4 | O271: 0.47700000000000004 | P271: 83.93 | Q271: 转股中 | R271: 4.86年 | S271: 2.86年 | T271: 1.67 | U271: 207 | V271: 0.98799999999999999 | W271: 0.109 | X271: 9.1999999999999998e-002 | Y271: 15 | Z271: 3.13 | AA271: -1.4999999999999999e-002 | AB271: -2.0499999999999997e-002 | AC271: -5.7800000000000004e-002 | AD271: -5.9900000000000002e-002 | AE271: 83.31 | AF271: 81.51 | AG271: 0.57 | AH271: A+ | AI271: 7.5899999999999995e-002 | AJ271: =H271+100*O271 -> 171.69999999999999 | AK271: 164.1 | AL271: 308 | AM271: 80.8 | AN271: 312 | AO271: 0.105 | AP271: 24 | AQ271: 银河转债!
A272: 15 | B272: 123090 | C272: 三诺转债 | D272: 300298 | E272: 三诺生物 | F272: 医药 | G272: 医疗器械 | H272: 129.115 | I272: 1.5600000000000001e-002 | J272: 1.54e-002 | K272: 38.43 | L272: 4.7100000000000003e-002 | M272: 117.1 | N272: 35.35 | O272: 0.188 | P272: 108.71 | Q272: 3月22天 | R272: 5.79年 | S272: 3.80年 | T272: 5 | U272: 32 | V272: 5.0000000000000003e-002 | W272: 2.3e-002 | X272: 2.5000000000000001e-002 | Y272: 217 | Z272: 8.03 | AA272: -1.7000000000000001e-002 | AB272: -2.2000000000000002e-002 | AC272: -5.4400000000000004e-002 | AD272: -5.5999999999999994e-002 | AE272: 87.07 | AF272: 91.04 | AG272: 0.66 | AH272: AA | AI272: 4.5199999999999997e-002 | AJ272: =H272+100*O272 -> 147.91500000000002 | AK272: 149.5 | AL272: 287 | AM272: 58.5 | AN272: 291 | AO272: -1.8000000000000002e-002 | AP272: 3 | AQ272: 三诺转债
A273: 154 | B273: 113575 | C273: 东时转债! | D273: 603377 | E273: 东方时尚 | F273: 其他 | G273: 其他 | H273: 123.83 | I273: 1.38e-002 | J273: -3.8e-003 | K273: 13.86 | L273: 1.7600000000000001e-002 | M273: 113.5 | N273: 14.56 | O273: 0.30099999999999999 | P273: 95.19 | Q273: 转股中 | R273: 5年34天 | S273: 3年35天 | T273: 0.99 | U273: 100 | V273: 0.82799999999999996 | W273: 1.2e-002 | X273: 1.1000000000000001e-002 | Y273: 85 | Z273: 4.34 | AA273: -1.7299999999999999e-002 | AB273: -2.2000000000000002e-002 | AC273: -5.3099999999999994e-002 | AD273: -5.5099999999999996e-002 | AE273: 90.04 | AF273: 91.07 | AG273: 0.57 | AH273: AA | AI273: 4.5199999999999997e-002 | AJ273: =H273+100*O273 -> 153.93000000000001 | AK273: 152.5 | AL273: 292 | AM273: 61.4 | AN273: 295 | AO273: 8.9999999999999997e-002 | AP273: 15 | AQ273: 东时转债!
A274: 57 | B274: 113605 | C274: 大参转债 | D274: 603233 | E274: 大参林 | F274: 医药 | G274: 医药商业 | H274: 127 | I274: 1.3000000000000001e-002 | J274: -1.7899999999999999e-002 | K274: 82.5 | L274: -8.199999999999999e-003 | M274: 115.2 | N274: 83.85 | O274: 0.29100000000000004 | P274: 98.39 | Q274: 54天 | R274: 5.63年 | S274: 3.63年 | T274: 14.1 | U274: 9.2 | V274: 5.0000000000000001e-003 | W274: 2.6000000000000002e-002 | X274: 2.5000000000000001e-002 | Y274: 543 | Z274: 10.85 | AA274: -1.7500000000000002e-002 | AB274: -2.2099999999999998e-002 | AC274: -5.2300000000000006e-002 | AD274: -5.4100000000000002e-002 | AE274: 87.8 | AF274: 90.24 | AG274: 0.6 | AH274: AA | AI274: 4.5199999999999997e-002 | AJ274: =H274+100*O274 -> 156.09999999999999 | AK274: 155.6 | AL274: 299 | AM274: 65.4 | AN274: 300 | AO274: -0.107 | AP274: 6 | AQ274: 大参转债
A275: 265 | B275: 110051 | C275: 中天转债! | D275: 600522 | E275: 中天科技 | F275: 通信互联 | G275: 通信设备 | H275: 121.77 | I275: 8.3999999999999995e-003 | J275: -1.8500000000000003e-002 | K275: 11.29 | L275: -1.4800000000000001e-002 | M275: 113.3 | N275: 10.09 | O275: 8.8000000000000009e-002 | P275: 111.89 | Q275: 转股中 | R275: 3.99年 | S275: 1.99年 | T275: 39.6 | U275: 92 | V275: 1.9e-002 | W275: 0.115 | X275: 0.128 | Y275: 346 | Z275: 1.58 | AA275: -1.8200000000000001e-002 | AB275: -2.41e-002 | AC275: -7.6100000000000001e-002 | AD275: -7.8399999999999997e-002 | AE275: 94.16 | AF275: 96.47 | AG275: 0.68 | AH275: AA+ | AI275: 4.1900000000000007e-002 | AJ275: =H275+100*O275 -> 130.56999999999999 | AK275: 131.6 | AL275: 225 | AM275: 35.2 | AN275: 192 | AO275: 9.6000000000000002e-002 | AP275: 26 | AQ275: 中天转债!
A276: 235 | B276: 113537 | C276: 文灿转债!! | D276: 603348 | E276: 文灿股份 | F276: 汽车 | G276: 零部件制 | H276: 132.11 | I276: 2.69e-002 | J276: -9.7999999999999997e-003 | K276: 25.15 | L276: 2.1899999999999999e-002 | M276: 121.5 | N276: 19.43 | O276: 2.1000000000000001e-002 | P276: 129.44 | Q276: 转股中 | R276: 4.26年 | S276: 2.27年 | T276: 1.77 | U276: 99 | V276: 0.42799999999999999 | W276: 2.7000000000000003e-002 | X276: 3.5000000000000003e-002 | Y276: 65 | Z276: 2.58 | AA276: -1.9900000000000001e-002 | AB276: -2.8300000000000002e-002 | AC276: -9.3299999999999994e-002 | AD276: -9.6300000000000011e-002 | AE276: 89.8 | AF276: 93.61 | AG276: 0.78 | AH276: AA- | AI276: 6.4899999999999999e-002 | AJ276: =H276+100*O276 -> 134.21000000000001 | AK276: 134.8 | AL276: 250 | AM276: 41.2 | AN276: 237 | AO276: 3.2000000000000001e-002 | AP276: 25 | AQ276: 文灿转债!!
A277: 68 | B277: 128134 | C277: 鸿路转债! | D277: 2541 | E277: 鸿路钢构 | F277: 建筑 | G277: 其他 | H277: 128.6 | I277: -1.3000000000000001e-002 | J277: 1.0200000000000001e-002 | K277: 49.85 | L277: -3.8e-003 | M277: 115.1 | N277: 43.74 | O277: 0.128 | P277: 113.97 | Q277: 41天 | R277: 5.59年 | S277: 3.60年 | T277: 18.8 | U277: 55 | V277: 2.3e-002 | W277: 7.2000000000000008e-002 | X277: 8.199999999999999e-002 | Y277: 261 | Z277: 4.87 | AA277: -2.e-002 | AB277: -2.46e-002 | AC277: -5.62e-002 | AD277: -5.79e-002 | AE277: 87.85 | AF277: 90.29 | AG277: 0.73 | AH277: AA | AI277: 4.5199999999999997e-002 | AJ277: =H277+100*O277 -> 141.40000000000001 | AK277: 143.2 | AL277: 274 | AM277: 52.9 | AN277: 279 | AO277: -1.7000000000000001e-002 | AP277: 4 | AQ277: 鸿路转债!
A278: 301 | B278: 127005 | C278: 长证转债! | D278: 783 | E278: 长江证券 | F278: 金融 | G278: 证券行业 | H278: 116.5 | I278: 1.21e-002 | J278: -4.4000000000000003e-003 | K278: 7.33 | L278: 1.38e-002 | M278: 109.3 | N278: 7.28 | O278: 0.157 | P278: 100.69 | Q278: 转股中 | R278: 3年6.0天 | S278: 无权 | T278: 50 | U278: 51 | V278: 9.0000000000000011e-003 | W278: 0.12300000000000001 | X278: 0.124 | Y278: 405 | Z278: 1.45 | AA278: -2.1400000000000002e-002 | AB278: -2.7000000000000003e-002 | AC278: 无权 | AD278: 无权 | AE278: 无权 | AF278: 97.68 | AG278: 0.56 | AH278: AAA | AI278: 3.8900000000000004e-002 | AJ278: =H278+100*O278 -> 132.19999999999999 | AK278: 132.3 | AL278: 229 | AM278: 34.6 | AN278: 190 | AO278: 5.0000000000000001e-003 | AP278: 15 | AQ278: 长证转债!
A279: 192 | B279: 110065 | C279: 淮矿转债! | D279: 600985 | E279: 淮北矿业 | F279: 煤炭 | G279: 煤炭开采 | H279: 123.35 | I279: -1.7000000000000001e-002 | J279: -1.9e-003 | K279: 11.56 | L279: -2.3599999999999999e-002 | M279: 110.8 | N279: 9.33 | O279: -4.0000000000000001e-003 | P279: 123.9 | Q279: 转股中 | R279: 4.80年 | S279: 2.80年 | T279: 26.3 | U279: 140 | V279: 4.2999999999999997e-002 | W279: 0.105 | X279: 0.13 | Y279: 251 | Z279: 1.22 | AA279: -2.2499999999999999e-002 | AB279: -2.6499999999999999e-002 | AC279: -5.8400000000000001e-002 | AD279: -6.0400000000000002e-002 | AE279: 92.32 | AF279: 92.57 | AG279: 0.8 | AH279: AAA | AI279: 3.8900000000000004e-002 | AJ279: =H279+100*O279 -> 122.94999999999999 | AK279: 122.8 | AL279: 169 | AM279: 30.2 | AN279: 153 | AO279: 7.0999999999999994e-002 | AP279: 21 | AQ279: 淮矿转债!
A280: 195 | B280: 113557 | C280: 森特转债 | D280: 603098 | E280: 森特股份 | F280: 建筑 | G280: 建筑工程 | H280: 134.22 | I280: 0.33200000000000002 | J280: -0.26800000000000002 | K280: 10.52 | L280: 0.10000000000000001 | M280: 120.3 | N280: 10.11 | O280: 0.28999999999999998 | P280: 104.06 | Q280: 转股中 | R280: 4.79年 | S280: 2.79年 | T280: 6 | U280: 872 | V280: 1.1299999999999999 | W280: 0.11900000000000001 | X280: 0.124 | Y280: 50 | Z280: 2.44 | AA280: -2.3e-002 | AB280: -2.9999999999999999e-002 | AC280: -8.4499999999999992e-002 | AD280: -8.6500000000000007e-002 | AE280: 86.21 | AF280: 89.57 | AG280: 0.65 | AH280: AA- | AI280: 6.4899999999999999e-002 | AJ280: =H280+100*O280 -> 163.22 | AK280: 164.4 | AL280: 310 | AM280: 74.8 | AN280: 306 | AO280: 0.22399999999999998 | AP280: 39 | AQ280: 森特转债
A281: 145 | B281: 113577 | C281: 春秋转债 | D281: 603890 | E281: 春秋电子 | F281: 电子 | G281: 电子产品 | H281: 133.07 | I281: 2.2400000000000003e-002 | J281: -8.0000000000000004e-004 | K281: 14.8 | L281: 2.64e-002 | M281: 118.2 | N281: 11.06 | O281: -6.0000000000000001e-003 | P281: 133.82 | Q281: 转股中 | R281: 5年39天 | S281: 3年40天 | T281: 1.86 | U281: 53 | V281: 0.21600000000000003 | W281: 3.3000000000000002e-002 | X281: 4.4000000000000004e-002 | Y281: 57 | Z281: 3.38 | AA281: -2.3399999999999997e-002 | AB281: -2.9399999999999999e-002 | AC281: -7.2900000000000006e-002 | AD281: -7.4999999999999997e-002 | AE281: 84.64 | AF281: 85.89 | AG281: 0.82 | AH281: AA- | AI281: 6.6199999999999995e-002 | AJ281: =H281+100*O281 -> 132.47 | AK281: 132.3 | AL281: 230 | AM281: 46.4 | AN281: 258 | AO281: 4.2999999999999997e-002 | AP281: 13 | AQ281: 春秋转债
A282: 207 | B282: 110061 | C282: 川投转债 | D282: 600674 | E282: 川投能源 | F282: 能源电力 | G282: 水电 | H282: 123.59 | I282: -8.9999999999999998e-004 | J282: -5.6999999999999993e-003 | K282: 11 | L282: -9.0000000000000011e-003 | M282: 110.8 | N282: 9.58 | O282: 7.5999999999999998e-002 | P282: 114.82 | Q282: 转股中 | R282: 4.69年 | S282: 2.69年 | T282: 40 | U282: 13 | V282: 3.0000000000000001e-003 | W282: 8.3000000000000004e-002 | X282: 9.5000000000000001e-002 | Y282: 484 | Z282: 1.75 | AA282: -2.35e-002 | AB282: -2.75e-002 | AC282: -6.1399999999999996e-002 | AD282: -6.3399999999999998e-002 | AE282: 92.73 | AF282: 92.98 | AG282: 0.74 | AH282: AAA | AI282: 3.8900000000000004e-002 | AJ282: =H282+100*O282 -> 131.19 | AK282: 132.4 | AL282: 231 | AM282: 39.4 | AN282: 225 | AO282: 1.3000000000000001e-002 | AP282: 16 | AQ282: 川投转债
A283: 304 | B283: 128035 | C283: 大族转债! | D283: 2008 | E283: 大族激光 | F283: 机械装备 | G283: 专用设备 | H283: 115.459 | I283: 5.6999999999999993e-003 | J283: -1.1000000000000001e-003 | K283: 43.29 | L283: 1.7899999999999999e-002 | M283: 107.4 | N283: 52.1 | O283: 0.39000000000000001 | P283: 83.09 | Q283: 转股中 | R283: 2.93年 | S283: 0.93年 | T283: 23 | U283: 17 | V283: 6.9999999999999993e-003 | W283: 5.0000000000000003e-002 | X283: 4.0999999999999995e-002 | Y283: 462 | Z283: 5.03 | AA283: -2.4700000000000003e-002 | AB283: -2.9300000000000003e-002 | AC283: -9.2899999999999996e-002 | AD283: -9.9000000000000005e-002 | AE283: 99.43 | AF283: 95.82 | AG283: 0.26 | AH283: AA+ | AI283: 4.0199999999999993e-002 | AJ283: =H283+100*O283 -> 154.459 | AK283: 147.8 | AL283: 281 | AM283: 48.4 | AN283: 263 | AO283: -5.2999999999999999e-002 | AP283: 21 | AQ283: 大族转债!
A284: 274 | B284: 128050 | C284: 钧达转债! | D284: 2865 | E284: 钧达股份 | F284: 汽车 | G284: 零部件制 | H284: 134.9 | I284: 1.e-002 | J284: -1.e-004 | K284: 20.13 | L284: 1.26e-002 | M284: 122.7 | N284: 14.85 | O284: -5.0000000000000001e-003 | P284: 135.56 | Q284: 转股中 | R284: 3.76年 | S284: 1.77年 | T284: 1.58 | U284: 46 | V284: 0.217 | W284: 6.0999999999999999e-002 | X284: 8.3000000000000004e-002 | Y284: 26 | Z284: 2.82 | AA284: -2.53e-002 | AB284: -3.5099999999999999e-002 | AC284: -0.10800000000000001 | AD284: -0.11 | AE284: 91.33 | AF284: 97.28 | AG284: 0.78 | AH284: AA- | AI284: 6.4899999999999999e-002 | AJ284: =H284+100*O284 -> 134.40000000000001 | AK284: 134.2 | AL284: 240 | AM284: 37 | AN284: 208 | AO284: 5.7999999999999996e-002 | AP284: 57 | AQ284: 钧达转债!
A285: 184 | B285: 127015 | C285: 希望转债! | D285: 876 | E285: 新 希 望 | F285: 农业 | G285: 畜牧业 | H285: 124.499 | I285: -3.2000000000000001e-002 | J285: -1.3899999999999999e-002 | K285: 22.49 | L285: -4.6199999999999998e-002 | M285: 110 | N285: 19.75 | O285: 9.3000000000000013e-002 | P285: 113.87 | Q285: 转股中 | R285: 4.83年 | S285: 2.83年 | T285: 9.5 | U285: 112 | V285: 9.6000000000000002e-002 | W285: 9.0000000000000011e-003 | X285: 1.1000000000000001e-002 | Y285: 1013. | Z285: 2.8 | AA285: -2.5699999999999997e-002 | AB285: -2.9300000000000003e-002 | AC285: -6.2600000000000003e-002 | AD285: -6.4199999999999993e-002 | AE285: 91.63 | AF285: 91.74 | AG285: 0.99 | AH285: AAA | AI285: 3.8900000000000004e-002 | AJ285: =H285+100*O285 -> 133.79900000000001 | AK285: 135.1 | AL285: 251 | AM285: 43.4 | AN285: 248 | AO285: -6.7000000000000004e-002 | AP285: 28 | AQ285: 希望转债!
A286: 66 | B286: 110075 | C286: 南航转债 | D286: 600029 | E286: 南方航空 | F286: 交通运输 | G286: 航空运输 | H286: 127.07 | I286: 8.0000000000000004e-004 | J286: -1.3500000000000002e-002 | K286: 6.14 | L286: -2.07e-002 | M286: 110 | N286: 6.24 | O286: 0.29100000000000004 | P286: 98.4 | Q286: 47天 | R286: 5.61年 | S286: 3.61年 | T286: 160 | U286: 155 | V286: 8.0000000000000002e-003 | W286: 0.17000000000000001 | X286: 0.16699999999999998 | Y286: 941 | Z286: 1.31 | AA286: -2.5699999999999997e-002 | AB286: -2.8799999999999999e-002 | AC286: -5.6100000000000004e-002 | AD286: -5.7200000000000001e-002 | AE286: 88.17 | AF286: 88.42 | AG286: 0.61 | AH286: AAA | AI286: 4.0199999999999993e-002 | AJ286: =H286+100*O286 -> 156.16999999999999 | AK286: 155.7 | AL286: 300 | AM286: 67.3 | AN286: 302 | AO286: 3.0000000000000001e-003 | AP286: 8 | AQ286: 南航转债
A287: 112 | B287: 123058 | C287: 欣旺转债 | D287: 300207 | E287: 欣旺达 | F287: 电子 | G287: 电子产品 | H287: 133.99 | I287: 1.9699999999999999e-002 | J287: -2.1400000000000002e-002 | K287: 23.77 | L287: -2.5000000000000001e-003 | M287: 116.3 | N287: 21.24 | O287: 0.19699999999999998 | P287: 111.91 | Q287: 转股中 | R287: 5.36年 | S287: 3.36年 | T287: 11.2 | U287: 28 | V287: 1.9e-002 | W287: 2.9999999999999999e-002 | X287: 3.3000000000000002e-002 | Y287: 374 | Z287: 5.91 | AA287: -2.6600000000000002e-002 | AB287: -3.1699999999999999e-002 | AC287: -7.0499999999999993e-002 | AD287: -7.2300000000000003e-002 | AE287: 88.97 | AF287: 92.22 | AG287: 0.69 | AH287: AA | AI287: 4.5199999999999997e-002 | AJ287: =H287+100*O287 -> 153.69 | AK287: 156.1 | AL287: 301 | AM287: 63.8 | AN287: 297 | AO287: -0.11 | AP287: 6 | AQ287: 欣旺转债
A288: 13 | B288: 123091 | C288: 长海转债 | D288: 300196 | E288: 长海股份 | F288: 其他 | G288: 非金属矿 | H288: 135.5 | I288: -8.0000000000000002e-003 | J288: -1.32e-002 | K288: 17.15 | L288: -3.2199999999999999e-002 | M288: 116.2 | N288: 16.24 | O288: 0.28300000000000003 | P288: 105.6 | Q288: 3月26天 | R288: 5.80年 | S288: 3.80年 | T288: 5.5 | U288: 24 | V288: 3.2000000000000001e-002 | W288: 7.8e-002 | X288: 8.3000000000000004e-002 | Y288: 70 | Z288: 2.51 | AA288: -2.6600000000000002e-002 | AB288: -3.1300000000000001e-002 | AC288: -6.5599999999999992e-002 | AD288: -6.7199999999999996e-002 | AE288: 87.15 | AF288: 90.33 | AG288: 0.66 | AH288: AA | AI288: 4.5199999999999997e-002 | AJ288: =H288+100*O288 -> 163.80000000000001 | AK288: 165.4 | AL288: 311 | AM288: 75.1 | AN288: 307 | AO288: -0.12 | AP288: 3 | AQ288: 长海转债
A289: 250 | B289: 123025 | C289: 精测转债!! | D289: 300567 | E289: 精测电子 | F289: 电子 | G289: 液晶显示 | H289: 130.7 | I289: 2.75e-002 | J289: -1.3300000000000001e-002 | K289: 57.02 | L289: 2.e-002 | M289: 117.3 | N289: 49.95 | O289: 0.14499999999999999 | P289: 114.15 | Q289: 转股中 | R289: 4年23天 | S289: 2年24天 | T289: 3.09 | U289: 67 | V289: 0.16699999999999998 | W289: 2.2000000000000002e-002 | X289: 2.5000000000000001e-002 | Y289: 141 | Z289: 9.06 | AA289: -2.69e-002 | AB289: -3.4000000000000002e-002 | AC289: -9.9900000000000003e-002 | AD289: -0.10199999999999999 | AE289: 90.24 | AF289: 91.43 | AG289: 0.71 | AH289: AA- | AI289: 6.4899999999999999e-002 | AJ289: =H289+100*O289 -> 145.19999999999999 | AK289: 147.2 | AL289: 280 | AM289: 55.8 | AN289: 284 | AO289: 5.5999999999999994e-002 | AP289: 18 | AQ289: 精测转债!!
A290: 156 | B290: 110069 | C290: 瀚蓝转债 | D290: 600323 | E290: 瀚蓝环境 | F290: 城市公用 | G290: 三废处理 | H290: 134.02 | I290: -1.8200000000000001e-002 | J290: -2.0000000000000001e-004 | K290: 26.1 | L290: -2.2499999999999999e-002 | M290: 113.5 | N290: 20.2 | O290: 3.7000000000000005e-002 | P290: 129.21 | Q290: 转股中 | R290: 5年32天 | S290: 3年33天 | T290: 9.83 | U290: 47 | V290: 3.6000000000000004e-002 | W290: 4.9000000000000002e-002 | X290: 6.3e-002 | Y290: 200 | Z290: 2.79 | AA290: -3.2500000000000001e-002 | AB290: -3.7100000000000001e-002 | AC290: -8.0100000000000005e-002 | AD290: -8.1300000000000011e-002 | AE290: 89.18 | AF290: 91.79 | AG290: 0.82 | AH290: AA+ | AI290: 4.3200000000000002e-002 | AJ290: =H290+100*O290 -> 137.72 | AK290: 138.8 | AL290: 264 | AM290: 47 | AN290: 259 | AO290: 0.115 | AP290: 9 | AQ290: 瀚蓝转债
A291: 58 | B291: 113040 | C291: 星宇转债 | D291: 601799 | E291: 星宇股份 | F291: 汽车 | G291: 零部件制 | H291: 136 | I291: 1.2999999999999999e-003 | J291: 2.1600000000000001e-002 | K291: 188.24 | L291: 2.98e-002 | M291: 111.5 | N291: 158 | O291: 0.14199999999999999 | P291: 119.14 | Q291: 54天 | R291: 5.63年 | S291: 3.63年 | T291: 15 | U291: 55 | V291: 2.7000000000000003e-002 | W291: 2.8999999999999998e-002 | X291: 3.4000000000000002e-002 | Y291: 520 | Z291: 9.78 | AA291: -3.5000000000000003e-002 | AB291: -3.8599999999999995e-002 | AC291: -7.2700000000000001e-002 | AD291: -7.3700000000000002e-002 | AE291: 87.15 | AF291: 88.13 | AG291: 0.77 | AH291: AA+ | AI291: 4.3200000000000002e-002 | AJ291: =H291+100*O291 -> 150.19999999999999 | AK291: 152.9 | AL291: 295 | AM291: 64.7 | AN291: 298 | AO291: -7.0999999999999994e-002 | AP291: 4 | AQ291: 星宇转债
A292: 297 | B292: 113508 | C292: 新凤转债! | D292: 603225 | E292: 新凤鸣 | F292: 服装纺织 | G292: 纺织行业 | H292: 125.44 | I292: 1.15e-002 | J292: -2.0499999999999997e-002 | K292: 18.15 | L292: -1.2500000000000001e-002 | M292: 112.3 | N292: 15.78 | O292: 9.0999999999999998e-002 | P292: 115.02 | Q292: 转股中 | R292: 3年51天 | S292: 1年52天 | T292: 20.7 | U292: 72 | V292: 2.7999999999999997e-002 | W292: 8.1000000000000003e-002 | X292: 9.4e-002 | Y292: 253 | Z292: 2.25 | AA292: -3.5299999999999998e-002 | AB292: -4.2099999999999999e-002 | AC292: -0.13400000000000001 | AD292: -0.13699999999999998 | AE292: 97.24 | AF292: 98.42 | AG292: 0.71 | AH292: AA | AI292: 4.3899999999999995e-002 | AJ292: =H292+100*O292 -> 134.53999999999999 | AK292: 135.9 | AL292: 253 | AM292: 37.4 | AN292: 212 | AO292: -0.11800000000000001 | AP292: 25 | AQ292: 新凤转债!
A293: 223 | B293: 123030 | C293: 九洲转债! | D293: 300040 | E293: 九洲集团 | F293: 能源电力 | G293: 电力设备 | H293: 140.489 | I293: -3.5799999999999998e-002 | J293: 7.3000000000000001e-003 | K293: 7.63 | L293: -3.5400000000000001e-002 | M293: 120 | N293: 5.65 | O293: 4.0000000000000001e-002 | P293: 135.04 | Q293: 转股中 | R293: 4.46年 | S293: 2.46年 | T293: 0.97 | U293: 342 | V293: 2.48 | W293: 3.3000000000000002e-002 | X293: 4.4999999999999998e-002 | Y293: 29 | Z293: 1.33 | AA293: -3.5400000000000001e-002 | AB293: -4.2699999999999995e-002 | AC293: -0.11 | AD293: -0.11199999999999999 | AE293: 87.91 | AF293: 91.2 | AG293: 0.81 | AH293: AA- | AI293: 6.4899999999999999e-002 | AJ293: =H293+100*O293 -> 144.489 | AK293: 145.9 | AL293: 277 | AM293: 54.7 | AN293: 282 | AO293: 0.20000000000000001 | AP293: 28 | AQ293: 九洲转债!
A294: 34 | B294: 113611 | C294: 福20转债 | D294: 603806 | E294: 福斯特 | F294: 能源电力 | G294: 太阳能 | H294: 138.73 | I294: -1.4000000000000002e-003 | J294: -1.3100000000000001e-002 | K294: 83.7 | L294: -1.9699999999999999e-002 | M294: 111.85 | N294: 73.69 | O294: 0.221 | P294: 113.58 | Q294: 3月4天 | R294: 5.74年 | S294: 3.74年 | T294: 17 | U294: 73 | V294: 3.1e-002 | W294: 2.6000000000000002e-002 | X294: 2.9999999999999999e-002 | Y294: 644 | Z294: 8.07 | AA294: -3.73e-002 | AB294: -4.0800000000000003e-002 | AC294: -7.46e-002 | AD294: -7.5700000000000003e-002 | AE294: 86.45 | AF294: 87.09 | AG294: 0.74 | AH294: AA | AI294: 4.5199999999999997e-002 | AJ294: =H294+100*O294 -> 160.82999999999998 | AK294: 163.9 | AL294: 307 | AM294: 76.8 | AN294: 308 | AO294: -0.14199999999999999 | AP294: 4 | AQ294: 福20转债
A295: 257 | B295: 110055 | C295: 伊力转债!! | D295: 600197 | E295: 伊力特 | F295: 食品饮料 | G295: 白酒 | H295: 134.27 | I295: 1.3100000000000001e-002 | J295: -2.e-003 | K295: 19.68 | L295: 1.55e-002 | M295: 115 | N295: 16.81 | O295: 0.14699999999999999 | P295: 117.07 | Q295: 转股中 | R295: 4年9天 | S295: 2年10天 | T295: 2.85 | U295: 172 | V295: 0.45100000000000001 | W295: 3.1e-002 | X295: 3.6000000000000004e-002 | Y295: 92 | Z295: 3.2 | AA295: -3.8599999999999995e-002 | AB295: -4.4800000000000006e-002 | AC295: -0.113 | AD295: -0.115 | AE295: 94.31 | AF295: 97.13 | AG295: 0.72 | AH295: AA | AI295: 4.3899999999999995e-002 | AJ295: =H295+100*O295 -> 148.97 | AK295: 151.5 | AL295: 291 | AM295: 54.3 | AN295: 281 | AO295: -6.9000000000000006e-002 | AP295: 24 | AQ295: 伊力转债!!
A296: 162 | B296: 123046 | C296: 天铁转债! | D296: 300587 | E296: 天铁股份 | F296: 铁路 | G296: 铁路设备 | H296: 143.531 | I296: -1.5600000000000001e-002 | J296: 1.6200000000000003e-002 | K296: 13.96 | L296: 7.000000000000001e-004 | M296: 118.2 | N296: 10.12 | O296: 4.0000000000000001e-002 | P296: 137.94 | Q296: 转股中 | R296: 5年13天 | S296: 3年14天 | T296: 0.99 | U296: 47 | V296: 0.32899999999999996 | W296: 2.1000000000000001e-002 | X296: 2.8999999999999998e-002 | Y296: 47 | Z296: 3.43 | AA296: -3.8599999999999995e-002 | AB296: -4.4500000000000005e-002 | AC296: -9.6300000000000011e-002 | AD296: -9.8400000000000001e-002 | AE296: 85.02 | AF296: 86.28 | AG296: 0.84 | AH296: AA- | AI296: 6.6199999999999995e-002 | AJ296: =H296+100*O296 -> 147.53100000000001 | AK296: 149.1 | AL296: 285 | AM296: 62.8 | AN296: 296 | AO296: 4.2999999999999997e-002 | AP296: 12 | AQ296: 天铁转债!
A297: 284 | B297: 123014 | C297: 凯发转债! | D297: 300407 | E297: 凯发电气 | F297: 能源电力 | G297: 电力设备 | H297: 119.41 | I297: -8.199999999999999e-003 | J297: 1.2e-002 | K297: 7.32 | L297: 8.3000000000000001e-003 | M297: 108.5 | N297: 8.12 | O297: 0.32500000000000001 | P297: 90.15 | Q297: 转股中 | R297: 2.39年 | S297: 0.39年 | T297: 1.16 | U297: 32 | V297: 0.23100000000000001 | W297: 5.2000000000000005e-002 | X297: 4.7e-002 | Y297: 22 | Z297: 1.65 | AA297: -3.9699999999999999e-002 | AB297: -4.5999999999999999e-002 | AC297: -0.28499999999999998 | AD297: -0.28899999999999998 | AE297: 97.28 | AF297: 91.63 | AG297: 0.46 | AH297: A+ | AI297: 7.4200000000000002e-002 | AJ297: =H297+100*O297 -> 151.91 | AK297: 148.7 | AL297: 284 | AM297: 51.4 | AN297: 272 | AO297: 0.10800000000000001 | AP297: 16 | AQ297: 凯发转债!
A298: 10 | B298: 113616 | C298: 韦尔转债 | D298: 603501 | E298: 韦尔股份 | F298: 电子 | G298: 元器件制 | H298: 150.08 | I298: -2.46e-002 | J298: -5.3e-003 | K298: 264.9 | L298: -4.0099999999999997e-002 | M298: 114.5 | N298: 222.83 | O298: 0.26200000000000001 | P298: 118.88 | Q298: 4月2天 | R298: 5.81年 | S298: 3.82年 | T298: 24.4 | U298: 234 | V298: 6.4000000000000001e-002 | W298: 1.1000000000000001e-002 | X298: 1.3000000000000001e-002 | Y298: 2298. | Z298: 22.68 | AA298: -4.5999999999999999e-002 | AB298: -5.0199999999999995e-002 | AC298: -9.06e-002 | AD298: -9.1799999999999993e-002 | AE298: 87.12 | AF298: 89.85 | AG298: 0.75 | AH298: AA+ | AI298: 4.3200000000000002e-002 | AJ298: =H298+100*O298 -> 176.28000000000003 | AK298: 181.3 | AL298: 316 | AM298: 91.4 | AN298: 317 | AO298: -9.5000000000000001e-002 | AP298: 6 | AQ298: 韦尔转债
A299: 178 | B299: 128097 | C299: 奥佳转债! | D299: 2614 | E299: 奥佳华 | F299: 机械装备 | G299: 专用设备 | H299: 144.903 | I299: -2.7000000000000001e-003 | J299: 4.4000000000000003e-003 | K299: 14.84 | L299: 2.e-003 | M299: 114.9 | N299: 10.69 | O299: 4.4000000000000004e-002 | P299: 138.82 | Q299: 转股中 | R299: 4.98年 | S299: 2.98年 | T299: 5.85 | U299: 3.3 | V299: 4.0000000000000001e-003 | W299: 6.4000000000000001e-002 | X299: 8.8000000000000009e-002 | Y299: 92 | Z299: 2.17 | AA299: -4.6300000000000001e-002 | AB299: -5.1200000000000002e-002 | AC299: -0.10099999999999999 | AD299: -0.10300000000000001 | AE299: 90.44 | AF299: 93.15 | AG299: 0.84 | AH299: AA | AI299: 4.3899999999999995e-002 | AJ299: =H299+100*O299 -> 149.303 | AK299: 151 | AL299: 289 | AM299: 57.8 | AN299: 290 | AO299: 6.0999999999999999e-002 | AP299: 24 | AQ299: 奥佳转债!
A300: 298 | B300: 128036 | C300: 金农转债!! | D300: 2548 | E300: 金新农 | F300: 农业 | G300: 畜牧业 | H300: 129.36 | I300: 3.5999999999999999e-003 | J300: 5.1999999999999998e-003 | K300: 7.79 | L300: 9.1000000000000004e-003 | M300: 110.3 | N300: 6.96 | O300: 0.156 | P300: 111.93 | Q300: 转股中 | R300: 3年3.0天 | S300: 1年4.0天 | T300: 1.46 | U300: 75 | V300: 0.39899999999999997 | W300: 2.7000000000000003e-002 | X300: 2.9999999999999999e-002 | Y300: 54 | Z300: 2.06 | AA300: -5.2699999999999997e-002 | AB300: -5.8499999999999996e-002 | AC300: -0.17199999999999999 | AD300: -0.17499999999999999 | AE300: 95.55 | AF300: 91.71 | AG300: 0.97 | AH300: AA- | AI300: 6.4899999999999999e-002 | AJ300: =H300+100*O300 -> 144.96000000000001 | AK300: 146.8 | AL300: 278 | AM300: 51.2 | AN300: 271 | AO300: 2.4e-002 | AP300: 17 | AQ300: 金农转债!!
A301: 256 | B301: 123022 | C301: 长信转债!! | D301: 300088 | E301: 长信科技 | F301: 通信互联 | G301: 通信设备 | H301: 142.547 | I301: 5.3600000000000002e-002 | J301: -3.4000000000000002e-002 | K301: 8.34 | L301: 2.3300000000000001e-002 | M301: 114.9 | N301: 6.15 | O301: 5.0999999999999997e-002 | P301: 135.61 | Q301: 转股中 | R301: 4年12天 | S301: 2年13天 | T301: 2.57 | U301: 66 | V301: 0.183 | W301: 1.3000000000000001e-002 | X301: 1.7000000000000001e-002 | Y301: 205 | Z301: 2.96 | AA301: -5.3099999999999994e-002 | AB301: -5.91e-002 | AC301: -0.107 | AD301: -0.10800000000000001 | AE301: 94.17 | AF301: 97 | AG301: 0.84 | AH301: AA | AI301: 4.3899999999999995e-002 | AJ301: =H301+100*O301 -> 147.64699999999999 | AK301: 149.5 | AL301: 286 | AM301: 52.5 | AN301: 277 | AO301: 4.5999999999999999e-002 | AP301: 12 | AQ301: 长信转债!!
A302: 159 | B302: 128103 | C302: 同德转债! | D302: 2360 | E302: 同德化工 | F302: 化工 | G302: 化工 | H302: 159.88 | I302: -2.3199999999999998e-002 | J302: 1.11e-002 | K302: 8.16 | L302: -1.21e-002 | M302: 121.8 | N302: 5.18 | O302: 1.4999999999999999e-002 | P302: 157.53 | Q302: 转股中 | R302: 5年20天 | S302: 3年21天 | T302: 1.09 | U302: 111 | V302: 0.63100000000000001 | W302: 3.4000000000000002e-002 | X302: 5.2999999999999999e-002 | Y302: 32 | Z302: 2.66 | AA302: -5.3499999999999999e-002 | AB302: -6.0299999999999999e-002 | AC302: -0.122 | AD302: -0.124 | AE302: 82.67 | AF302: 84.48 | AG302: 1 | AH302: A+ | AI302: 7.7199999999999991e-002 | AJ302: =H302+100*O302 -> 161.38 | AK302: 162.2 | AL302: 306 | AM302: 77.8 | AN302: 310 | AO302: -0.11199999999999999 | AP302: 13 | AQ302: 同德转债!
A303: 305 | B303: 110043 | C303: 无锡转债! | D303: 600908 | E303: 无锡银行 | F303: 金融 | G303: 银行行业 | H303: 127.01 | I303: -1.9e-002 | J303: 1.03e-002 | K303: 7.11 | L303: -1.11e-002 | M303: 108.3 | N303: 5.79 | O303: 3.4000000000000002e-002 | P303: 122.8 | Q303: 转股中 | R303: 2.91年 | S303: 无权 | T303: 29.2 | U303: 87 | V303: 2.4e-002 | W303: 0.222 | X303: 0.27300000000000002 | Y303: 131 | Z303: 1.15 | AA303: -5.3899999999999997e-002 | AB303: -5.8799999999999998e-002 | AC303: 无权 | AD303: 无权 | AE303: 无权 | AF303: 96.7 | AG303: 0.78 | AH303: AA+ | AI303: 4.0199999999999993e-002 | AJ303: =H303+100*O303 -> 130.41 | AK303: 131.2 | AL303: 224 | AM303: 34.5 | AN303: 188 | AO303: 1.e-003 | AP303: 28 | AQ303: 无锡转债!
A304: 332 | B304: 113012 | C304: 骆驼转债! | D304: 601311 | E304: 骆驼股份 | F304: 汽车 | G304: 零部件制 | H304: 121.04 | I304: 1.89e-002 | J304: 2.18e-002 | K304: 10.8 | L304: 6.4000000000000001e-002 | M304: 107.8 | N304: 10.06 | O304: 0.127 | P304: 107.36 | Q304: 转股中 | R304: 2年19天 | S304: 19天 | T304: 5.1 | U304: 61 | V304: 9.8000000000000004e-002 | W304: 4.2000000000000003e-002 | X304: 4.4999999999999998e-002 | Y304: 121 | Z304: 1.81 | AA304: -5.5899999999999998e-002 | AB304: -6.2400000000000004e-002 | AC304: -0.80299999999999994 | AD304: -0.81499999999999995 | AE304: 100.64 | AF304: 99.19 | AG304: 0.63 | AH304: AA | AI304: 4.2199999999999994e-002 | AJ304: =H304+100*O304 -> 133.74000000000001 | AK304: 134.7 | AL304: 248 | AM304: 34.1 | AN304: 182 | AO304: 8.0000000000000002e-002 | AP304: 17 | AQ304: 骆驼转债!
A305: 174 | B305: 110066 | C305: 盛屯转债!! | D305: 600711 | E305: 盛屯矿业 | F305: 有色金属 | G305: 有色行业 | H305: 152.56 | I305: -1.9199999999999998e-002 | J305: -6.3e-003 | K305: 7.4 | L305: -2.8900000000000002e-002 | M305: 114.9 | N305: 4.88 | O305: 6.0000000000000001e-003 | P305: 151.64 | Q305: 转股中 | R305: 4.99年 | S305: 2.99年 | T305: 6.03 | U305: 379 | V305: 0.41499999999999998 | W305: 3.1e-002 | X305: 4.7e-002 | Y305: 195 | Z305: 1.86 | AA305: -5.6100000000000004e-002 | AB305: -6.0999999999999999e-002 | AC305: -0.114 | AD305: -0.11599999999999999 | AE305: 90.38 | AF305: 93.1 | AG305: 0.88 | AH305: AA | AI305: 4.3899999999999995e-002 | AJ305: =H305+100*O305 -> 153.16 | AK305: 153.5 | AL305: 296 | AM305: 60.4 | AN305: 294 | AO305: -8.8000000000000009e-002 | AP305: 39 | AQ305: 盛屯转债!!
A306: 123 | B306: 113590 | C306: 海容转债!* | D306: 603187 | E306: 海容冷链 | F306: 机械装备 | G306: 通用设备 | H306: 156.19 | I306: 2.8999999999999998e-003 | J306: 2.3999999999999998e-003 | K306: 57.15 | L306: 5.3e-003 | M306: 115.6 | N306: 36.39 | O306: -5.0000000000000001e-003 | P306: 157.05 | Q306: 转股中 | R306: 5.32年 | S306: 3.32年 | T306: 0.14 | U306: 78 | V306: 3.4300000000000002 | W306: 1.e-003 | X306: 2.e-003 | Y306: 95 | Z306: 5.57 | AA306: -5.6100000000000004e-002 | AB306: -6.08e-002 | AC306: -0.109 | AD306: -0.11 | AE306: 83.35 | AF306: 82.85 | AG306: 1 | AH306: AA- | AI306: 6.6199999999999995e-002 | AJ306: =H306+100*O306 -> 155.69 | AK306: 155.3 | AL306: 298 | AM306: 72 | AN306: 304 | AO306: -5.9999999999999998e-002 | AP306: 7 | AQ306: 海容转债!*
A307: 198 | B307: 113029 | C307: 明阳转债!!* | D307: 601615 | E307: 明阳智能 | F307: 能源电力 | G307: 风能 | H307: 148.46 | I307: -7.17e-002 | J307: 6.5000000000000006e-003 | K307: 19.07 | L307: -6.5199999999999994e-002 | M307: 112.9 | N307: 12.8 | O307: -4.0000000000000001e-003 | P307: 148.98 | Q307: 转股中 | R307: 4.78年 | S307: 2.78年 | T307: 5.77 | U307: 301 | V307: 0.34700000000000003 | W307: 1.6e-002 | X307: 2.4e-002 | Y307: 362 | Z307: 3.54 | AA307: -5.6600000000000004e-002 | AB307: -6.0999999999999999e-002 | AC307: -0.115 | AD307: -0.11599999999999999 | AE307: 91.2 | AF307: 92.3 | AG307: 1 | AH307: AA | AI307: 4.3899999999999995e-002 | AJ307: =H307+100*O307 -> 148.06 | AK307: 147.9 | AL307: 282 | AM307: 55.6 | AN307: 283 | AO307: -0.10099999999999999 | AP307: 21 | AQ307: 明阳转债!!*
A308: 234 | B308: 123027 | C308: 蓝晓转债! | D308: 300487 | E308: 蓝晓科技 | F308: 化工 | G308: 化工 | H308: 153 | I308: -4.1399999999999999e-002 | J308: 3.2000000000000002e-003 | K308: 42.55 | L308: -4.4199999999999996e-002 | M308: 119.5 | N308: 29.33 | O308: 5.5e-002 | P308: 145.07 | Q308: 转股中 | R308: 4.27年 | S308: 2.27年 | T308: 1.08 | U308: 205 | V308: 1.24 | W308: 1.2e-002 | X308: 1.7000000000000001e-002 | Y308: 91 | Z308: 5.75 | AA308: -5.7599999999999998e-002 | AB308: -6.480000000000001e-002 | AC308: -0.10800000000000001 | AD308: -0.11 | AE308: 87.6 | AF308: 88.23 | AG308: 0.86 | AH308: A+ | AI308: 7.5899999999999995e-002 | AJ308: =H308+100*O308 -> 158.5 | AK308: 160.9 | AL308: 304 | AM308: 72.7 | AN308: 305 | AO308: 2.5000000000000001e-002 | AP308: 21 | AQ308: 蓝晓转债!
A309: 280 | B309: 128046 | C309: 利尔转债!! | D309: 2258 | E309: 利尔化学 | F309: 化工 | G309: 农化 | H309: 139.11 | I309: 8.0000000000000004e-004 | J309: 1.3999999999999999e-002 | K309: 25.3 | L309: 1.4800000000000001e-002 | M309: 112.3 | N309: 18.62 | O309: 2.4e-002 | P309: 135.88 | Q309: 转股中 | R309: 3.62年 | S309: 1.62年 | T309: 8.47 | U309: 75 | V309: 6.4000000000000001e-002 | W309: 6.4000000000000001e-002 | X309: 8.6999999999999994e-002 | Y309: 133 | Z309: 3.71 | AA309: -5.8499999999999996e-002 | AB309: -6.4100000000000004e-002 | AC309: -0.13300000000000001 | AD309: -0.13500000000000001 | AE309: 95.27 | AF309: 96.43 | AG309: 1 | AH309: AA | AI309: 4.3899999999999995e-002 | AJ309: =H309+100*O309 -> 141.51000000000002 | AK309: 142.3 | AL309: 271 | AM309: 45.9 | AN309: 255 | AO309: -7.8e-002 | AP309: 10 | AQ309: 利尔转债!!
A310: 129 | B310: 128111 | C310: 中矿转债! | D310: 2738 | E310: 中矿资源 | F310: 有色金属 | G310: 有色行业 | H310: 170.478 | I310: 9.8999999999999991e-003 | J310: -7.8000000000000005e-003 | K310: 25.83 | L310: 2.3e-003 | M310: 124.7 | N310: 15.47 | O310: 2.1000000000000001e-002 | P310: 166.97 | Q310: 转股中 | R310: 5.27年 | S310: 3.27年 | T310: 2.4 | U310: 268 | V310: 0.65700000000000003 | W310: 2.8999999999999998e-002 | X310: 4.9000000000000002e-002 | Y310: 82 | Z310: 2.67 | AA310: -5.8799999999999998e-002 | AB310: -6.59e-002 | AC310: -0.13 | AD310: -0.13200000000000001 | AE310: 84.2 | AF310: 89.72 | AG310: 0.9 | AH310: AA- | AI310: 6.6199999999999995e-002 | AJ310: =H310+100*O310 -> 172.578 | AK310: 174 | AL310: 313 | AM310: 84.3 | AN310: 313 | AO310: -9.5000000000000001e-002 | AP310: 9 | AQ310: 中矿转债!
A311: 63 | B311: 127022 | C311: 恒逸转债 | D311: 703 | E311: 恒逸石化 | F311: 化工 | G311: 化工 | H311: 156.48 | I311: -1.5800000000000002e-002 | J311: 3.5400000000000001e-002 | K311: 17.09 | L311: 2.1499999999999998e-002 | M311: 108.9 | N311: 11.5 | O311: 5.2999999999999999e-002 | P311: 148.61 | Q311: 48天 | R311: 5.61年 | S311: 3.62年 | T311: 20 | U311: 232 | V311: 7.4999999999999997e-002 | W311: 3.2000000000000001e-002 | X311: 4.7e-002 | Y311: 629 | Z311: 2.51 | AA311: -6.3299999999999995e-002 | AB311: -6.59e-002 | AC311: -0.10300000000000001 | AD311: -0.10400000000000001 | AE311: 87.56 | AF311: 86.17 | AG311: 0.91 | AH311: AA+ | AI311: 4.3200000000000002e-002 | AJ311: =H311+100*O311 -> 161.78 | AK311: 164.4 | AL311: 309 | AM311: 76.8 | AN311: 309 | AO311: 2.4e-002 | AP311: 5 | AQ311: 恒逸转债
A312: 303 | B312: 113504 | C312: 艾华转债!! | D312: 603989 | E312: 艾华集团 | F312: 电子 | G312: 元器件制 | H312: 132.87 | I312: 6.6e-003 | J312: 8.5000000000000006e-003 | K312: 27.68 | L312: 1.7600000000000001e-002 | M312: 109.3 | N312: 21.13 | O312: 1.3999999999999999e-002 | P312: 131 | Q312: 转股中 | R312: 2.99年 | S312: 0.99年 | T312: 5.59 | U312: 7.4 | V312: 1.e-002 | W312: 5.0999999999999997e-002 | X312: 6.7000000000000004e-002 | Y312: 110 | Z312: 4.55 | AA312: -6.4000000000000001e-002 | AB312: -6.93e-002 | AC312: -0.19800000000000001 | AD312: -0.20100000000000001 | AE312: 97.05 | AF312: 96.77 | AG312: 0.86 | AH312: AA | AI312: 4.2199999999999994e-002 | AJ312: =H312+100*O312 -> 134.27000000000001 | AK312: 134.7 | AL312: 249 | AM312: 37.7 | AN312: 215 | AO312: 8.5000000000000006e-002 | AP312: 9 | AQ312: 艾华转债!!
A313: 333 | B313: 113011 | C313: 光大转债 | D313: 601818 | E313: 光大银行 | F313: 金融 | G313: 银行行业 | H313: 124 | I313: -3.4000000000000002e-003 | J313: 1.8e-003 | K313: 4.14 | L313: -2.3999999999999998e-003 | M313: 108.3 | N313: 3.76 | O313: 0.126 | P313: 110.11 | Q313: 转股中 | R313: 2年12天 | S313: 无权 | T313: 242 | U313: 216 | V313: 6.9999999999999993e-003 | W313: 0.10800000000000001 | X313: 0.11900000000000001 | Y313: 2237. | Z313: 0.66 | AA313: -6.5700000000000008e-002 | AB313: -7.2700000000000001e-002 | AC313: 无权 | AD313: 无权 | AE313: 无权 | AF313: 100.72 | AG313: 0.67 | AH313: AAA | AI313: 3.7200000000000004e-002 | AJ313: =H313+100*O313 -> 136.59999999999999 | AK313: 137.9 | AL313: 261 | AM313: 37.2 | AN313: 210 | AO313: 0. | AP313: 15 | AQ313: 光大转债
A314: 242 | B314: 113025 | C314: 明泰转债!! | D314: 601677 | E314: 明泰铝业 | F314: 有色金属 | G314: 铝金属 | H314: 157.67 | I314: -1.9299999999999998e-002 | J314: 7.000000000000001e-004 | K314: 17.2 | L314: -2.0499999999999997e-002 | M314: 115.1 | N314: 11.2 | O314: 2.7000000000000003e-002 | P314: 153.57 | Q314: 转股中 | R314: 4年35天 | S314: 2年36天 | T314: 12.5 | U314: 129 | V314: 6.5000000000000002e-002 | W314: 0.11 | X314: 0.16899999999999998 | Y314: 114 | Z314: 1.41 | AA314: -7.5399999999999995e-002 | AB314: -8.1199999999999994e-002 | AC314: -0.13 | AD314: -0.13100000000000001 | AE314: 93.95 | AF314: 96.91 | AG314: 0.91 | AH314: AA | AI314: 4.3899999999999995e-002 | AJ314: =H314+100*O314 -> 160.36999999999998 | AK314: 161.8 | AL314: 305 | AM314: 64.9 | AN314: 299 | AO314: 6.9000000000000006e-002 | AP314: 28 | AQ314: 明泰转债!!
A315: 179 | B315: 128095 | C315: 恩捷转债!! | D315: 2812 | E315: 恩捷股份 | F315: 电子 | G315: 元器件制 | H315: 169.399 | I315: -1.5e-003 | J315: 3.4000000000000002e-003 | K315: 108.12 | L315: 2.e-003 | M315: 114.9 | N315: 65.09 | O315: 2.e-002 | P315: 166.11 | Q315: 转股中 | R315: 4.94年 | S315: 2.94年 | T315: 8 | U315: 226 | V315: 0.17000000000000001 | W315: 8.0000000000000002e-003 | X315: 1.3999999999999999e-002 | Y315: 959 | Z315: 9.63 | AA315: -7.6799999999999993e-002 | AB315: -8.1500000000000003e-002 | AC315: -0.14499999999999999 | AD315: -0.14599999999999999 | AE315: 90.59 | AF315: 93.3 | AG315: 0.92 | AH315: AA | AI315: 4.3899999999999995e-002 | AJ315: =H315+100*O315 -> 171.399 | AK315: 172.7 | AL315: 312 | AM315: 79.4 | AN315: 311 | AO315: -0.129 | AP315: 16 | AQ315: 恩捷转债!!
A316: 88 | B316: 128126 | C316: 赣锋转2 | D316: 2460 | E316: 赣锋锂业 | F316: 有色金属 | G316: 小金属 | H316: 173.855 | I316: 3.1800000000000002e-002 | J316: -2.12e-002 | K316: 98.5 | L316: 1.1599999999999999e-002 | M316: 111.1 | N316: 60.27 | O316: 6.4000000000000001e-002 | P316: 163.43 | Q316: 转股中 | R316: 5.42年 | S316: 3.42年 | T316: 20.4 | U316: 786 | V316: 0.223 | W316: 1.4999999999999999e-002 | X316: 2.5000000000000001e-002 | Y316: 1331. | Z316: 14.14 | AA316: -8.0299999999999996e-002 | AB316: -8.3599999999999994e-002 | AC316: -0.13200000000000001 | AD316: -0.13300000000000001 | AE316: 87.88 | AF316: 87.77 | AG316: 0.92 | AH316: AA | AI316: 4.5199999999999997e-002 | AJ316: =H316+100*O316 -> 180.255 | AK316: 184.3 | AL316: 317 | AM316: 96.4 | AN316: 319 | AO316: -0.16899999999999998 | AP316: 9 | AQ316: 赣锋转2
A317: 115 | B317: 113592 | C317: 安20转债!* | D317: 603345 | E317: 安井食品 | F317: 食品饮料 | G317: 食品饮料 | H317: 176.53 | I317: -1.6200000000000003e-002 | J317: 7.4999999999999997e-003 | K317: 206.6 | L317: -8.6999999999999994e-003 | M317: 113.1 | N317: 115.9 | O317: -1.e-002 | P317: 178.26 | Q317: 转股中 | R317: 5.34年 | S317: 3.34年 | T317: 0.24 | U317: 49 | V317: 1.1599999999999999 | W317: 0. | X317: 1.e-003 | Y317: 502 | Z317: 15.23 | AA317: -8.1300000000000011e-002 | AB317: -8.5099999999999995e-002 | AC317: -0.13699999999999998 | AD317: -0.13900000000000001 | AE317: 88.84 | AF317: 89.73 | AG317: 1 | AH317: AA | AI317: 4.5199999999999997e-002 | AJ317: =H317+100*O317 -> 175.53 | AK317: 174.8 | AL317: 314 | AM317: 85.1 | AN317: 314 | AO317: -0.17899999999999999 | AP317: 9 | AQ317: 安20转债!*
A318: 208 | B318: 123034 | C318: 通光转债! | D318: 300265 | E318: 通光线缆 | F318: 通信互联 | G318: 通信设备 | H318: 175.45 | I318: -7.6e-003 | J318: 1.01e-002 | K318: 9.29 | L318: 3.2000000000000002e-003 | M318: 118 | N318: 7.97 | O318: 0.505 | P318: 116.56 | Q318: 转股中 | R318: 4.67年 | S318: 2.67年 | T318: 0.78 | U318: 88 | V318: 0.63900000000000001 | W318: 2.3e-002 | X318: 2.7000000000000003e-002 | Y318: 34 | Z318: 2.7 | AA318: -8.2799999999999999e-002 | AB318: -8.8699999999999987e-002 | AC318: -0.114 | AD318: -0.115 | AE318: 84.3 | AF318: 84.47 | AG318: 0.76 | AH318: A+ | AI318: 7.5899999999999995e-002 | AJ318: =H318+100*O318 -> 225.94999999999999 | AK318: 234.3 | AL318: 326 | AM318: 149.9 | AN318: 328 | AO318: 5.7000000000000002e-002 | AP318: 24 | AQ318: 通光转债!
A319: 90 | B319: 113038 | C319: 隆20转债! | D319: 601012 | E319: 隆基股份 | F319: 能源电力 | G319: 太阳能 | H319: 189.04 | I319: 7.6e-003 | J319: 5.4000000000000003e-003 | K319: 99.44 | L319: 1.37e-002 | M319: 111.8 | N319: 52.59 | O319: 0. | P319: 189.09 | Q319: 转股中 | R319: 5.40年 | S319: 3.41年 | T319: 29.4 | U319: 2575. | V319: 0.46899999999999997 | W319: 8.0000000000000002e-003 | X319: 1.4999999999999999e-002 | Y319: 3751. | Z319: 11.56 | AA319: -9.3900000000000011e-002 | AB319: -9.7299999999999998e-002 | AC319: -0.14999999999999999 | AD319: -0.151 | AE319: 89.84 | AF319: 90.69 | AG319: 0.95 | AH319: AAA | AI319: 4.0199999999999993e-002 | AJ319: =H319+100*O319 -> 189.03999999999999 | AK319: 189 | AL319: 320 | AM319: 98.3 | AN319: 320 | AO319: -9.9000000000000005e-002 | AP319: 14 | AQ319: 隆20转债!
A320: 49 | B320: 113041 | C320: 紫金转债 | D320: 601899 | E320: 紫金矿业 | F320: 有色金属 | G320: 贵金属 | H320: 170.77 | I320: -4.41e-002 | J320: 8.0000000000000002e-003 | K320: 11 | L320: -3.9300000000000002e-002 | M320: 108 | N320: 7 | O320: 8.6999999999999994e-002 | P320: 157.14 | Q320: 2月6天 | R320: 4.66年 | S320: 2.67年 | T320: 60 | U320: 910 | V320: 8.900000000000001e-002 | W320: 2.1000000000000001e-002 | X320: 3.4000000000000002e-002 | Y320: 2802. | Z320: 5.82 | AA320: -9.4200000000000006e-002 | AB320: -9.6999999999999989e-002 | AC320: -0.113 | AD320: -0.113 | AE320: 90.99 | AF320: 90.52 | AG320: 0.92 | AH320: AAA | AI320: 3.8900000000000004e-002 | AJ320: =H320+100*O320 -> 179.47 | AK320: 184.4 | AL320: 318 | AM320: 93.4 | AN320: 318 | AO320: -7.0999999999999994e-002 | AP320: 8 | AQ320: 紫金转债
A321: 325 | B321: 113016 | C321: 小康转债! | D321: 601127 | E321: 小康股份 | F321: 汽车 | G321: 零部件制 | H321: 148.2 | I321: 5.8400000000000001e-002 | J321: -2.1899999999999999e-002 | K321: 23.25 | L321: 3.9300000000000002e-002 | M321: 109.3 | N321: 15.7 | O321: 1.e-003 | P321: 148.09 | Q321: 转股中 | R321: 2.67年 | S321: 0.67年 | T321: 4.55 | U321: 2219. | V321: 3.3199999999999998 | W321: 1.4999999999999999e-002 | X321: 2.3e-002 | Y321: 297 | Z321: 5.06 | AA321: -0.109 | AB321: -0.115 | AC321: -0.38 | AD321: -0.38200000000000001 | AE321: 98.33 | AF321: 98.05 | AG321: 0.93 | AH321: AA | AI321: 4.2199999999999994e-002 | AJ321: =H321+100*O321 -> 148.29999999999998 | AK321: 148.3 | AL321: 283 | AM321: 50 | AN321: 265 | AO321: 0.40899999999999997 | AP321: 49 | AQ321: 小康转债!
A322: 221 | B322: 123031 | C322: 晶瑞转债! | D322: 300655 | E322: 晶瑞股份 | F322: 化工 | G322: 化工 | H322: 197.998 | I322: -2.46e-002 | J322: 3.4000000000000002e-002 | K322: 30.8 | L322: 1.0200000000000001e-002 | M322: 115.8 | N322: 18.43 | O322: 0.185 | P322: 167.12 | Q322: 转股中 | R322: 4.48年 | S322: 2.49年 | T322: 0.63 | U322: 128 | V322: 1.02 | W322: 1.1000000000000001e-002 | X322: 1.8000000000000002e-002 | Y322: 58 | Z322: 4.53 | AA322: -0.114 | AB322: -0.12 | AC322: -0.14699999999999999 | AD322: -0.14800000000000002 | AE322: 85.24 | AF322: 83.98 | AG322: 0.92 | AH322: A+ | AI322: 7.5899999999999995e-002 | AJ322: =H322+100*O322 -> 216.49799999999999 | AK322: 228.9 | AL322: 325 | AM322: 143.6 | AN322: 326 | AO322: 5.0999999999999997e-002 | AP322: 17 | AQ322: 晶瑞转债!
A323: 141 | B323: 113580 | C323: 康隆转债! | D323: 603665 | E323: 康隆达 | F323: 服装纺织 | G323: 服装行业 | H323: 230.97 | I323: -6.7000000000000002e-003 | J323: 5.9699999999999996e-002 | K323: 18.58 | L323: 7.0300000000000001e-002 | M323: 121.2 | N323: 15.51 | O323: 0.92799999999999994 | P323: 119.79 | Q323: 转股中 | R323: 5年48天 | S323: 3年49天 | T323: 0.41 | U323: 203 | V323: 2.1400000000000001 | W323: 1.3999999999999999e-002 | X323: 1.7000000000000001e-002 | Y323: 29 | Z323: 2.88 | AA323: -0.12 | AB323: -0.126 | AC323: -0.124 | AD323: -0.125 | AE323: 84.5 | AF323: 87.91 | AG323: 0.75 | AH323: AA- | AI323: 6.6199999999999995e-002 | AJ323: =H323+100*O323 -> 323.76999999999998 | AK323: 342.1 | AL323: 333 | AM323: 254.2 | AN323: 334 | AO323: 0.23800000000000002 | AP323: 9 | AQ323: 康隆转债!
A324: 218 | B324: 113545 | C324: 金能转债! | D324: 603113 | E324: 金能科技 | F324: 煤炭 | G324: 炼焦 | H324: 208.69 | I324: -2.2499999999999999e-002 | J324: -9.4999999999999998e-003 | K324: 21.5 | L324: -3.3300000000000003e-002 | M324: 114.9 | N324: 10.78 | O324: 4.5999999999999999e-002 | P324: 199.44 | Q324: 转股中 | R324: 4.61年 | S324: 2.61年 | T324: 10.2 | U324: 211 | V324: 9.9000000000000005e-002 | W324: 5.5999999999999994e-002 | X324: 0.11199999999999999 | Y324: 182 | Z324: 2.38 | AA324: -0.12300000000000001 | AB324: -0.128 | AC324: -0.14599999999999999 | AD324: -0.14699999999999999 | AE324: 91.88 | AF324: 94.63 | AG324: 0.96 | AH324: AA | AI324: 4.3899999999999995e-002 | AJ324: =H324+100*O324 -> 213.28999999999999 | AK324: 217.9 | AL324: 322 | AM324: 123.3 | AN324: 323 | AO324: -1.3999999999999999e-002 | AP324: 19 | AQ324: 金能转债!
A325: 270 | B325: 123018 | C325: 溢利转债! | D325: 300381 | E325: 溢多利 | F325: 医药 | G325: 原料药 | H325: 192.209 | I325: -4.3e-003 | J325: 1.3600000000000001e-002 | K325: 9.77 | L325: 1.24e-002 | M325: 114.3 | N325: 8.32 | O325: 0.63700000000000001 | P325: 117.43 | Q325: 转股中 | R325: 3.79年 | S325: 1.79年 | T325: 0.54 | U325: 52 | V325: 0.503 | W325: 1.1000000000000001e-002 | X325: 1.3000000000000001e-002 | Y325: 48 | Z325: 1.65 | AA325: -0.13 | AB325: -0.13500000000000001 | AC325: -0.21299999999999999 | AD325: -0.214 | AE325: 90.95 | AF325: 90.45 | AG325: 0.75 | AH325: AA- | AI325: 6.4899999999999999e-002 | AJ325: =H325+100*O325 -> 255.90899999999999 | AK325: 267 | AL325: 330 | AM325: 176 | AN325: 330 | AO325: 5.0000000000000001e-003 | AP325: 13 | AQ325: 溢利转债!
A326: 227 | B326: 113543 | C326: 欧派转债! | D326: 603833 | E326: 欧派家居 | F326: 其他 | G326: 家居用品 | H326: 214.16 | I326: 5.0000000000000001e-003 | J326: 1.8500000000000003e-002 | K326: 152.4 | L326: 2.4199999999999999e-002 | M326: 114.9 | N326: 71.69 | O326: 6.9999999999999993e-003 | P326: 212.58 | Q326: 转股中 | R326: 4.45年 | S326: 3.45年 | T326: 5.42 | U326: 53 | V326: 4.5999999999999999e-002 | W326: 6.0000000000000001e-003 | X326: 1.3000000000000001e-002 | Y326: 917 | Z326: 8.4 | AA326: -0.13300000000000001 | AB326: -0.13699999999999998 | AC326: -0.17100000000000001 | AD326: -0.17300000000000001 | AE326: 90.32 | AF326: 95.29 | AG326: 0.97 | AH326: AA | AI326: 4.3899999999999995e-002 | AJ326: =H326+100*O326 -> 214.85999999999999 | AK326: 215.7 | AL326: 321 | AM326: 120.4 | AN326: 321 | AO326: -2.8999999999999998e-002 | AP326: 14 | AQ326: 欧派转债!
A327: 139 | B327: 113582 | C327: 火炬转债! | D327: 603678 | E327: 火炬电子 | F327: 电子 | G327: 元器件制 | H327: 244.53 | I327: -4.0899999999999999e-002 | J327: 4.7699999999999992e-002 | K327: 58.9 | L327: 6.9999999999999993e-003 | M327: 115.3 | N327: 25.33 | O327: 5.2000000000000005e-002 | P327: 232.53 | Q327: 转股中 | R327: 5.22年 | S327: 3.23年 | T327: 4.18 | U327: 204 | V327: 0.19500000000000001 | W327: 1.4999999999999999e-002 | X327: 3.6000000000000004e-002 | Y327: 271 | Z327: 7.68 | AA327: -0.13600000000000001 | AB327: -0.14000000000000001 | AC327: -0.125 | AD327: -0.126 | AE327: 89.49 | AF327: 91.97 | AG327: 0.97 | AH327: AA | AI327: 4.5199999999999997e-002 | AJ327: =H327+100*O327 -> 249.72999999999999 | AK327: 256.5 | AL327: 329 | AM327: 164.6 | AN327: 329 | AO327: -7.400000000000001e-002 | AP327: 5 | AQ327: 火炬转债!
A328: 269 | B328: 128052 | C328: 凯龙转债!* | D328: 2783 | E328: 凯龙股份 | F328: 化工 | G328: 化工 | H328: 199 | I328: -3.8699999999999998e-002 | J328: 4.8600000000000004e-002 | K328: 10.14 | L328: 1.e-002 | M328: 114.3 | N328: 6.67 | O328: 0.309 | P328: 152.02 | Q328: 转股中 | R328: 3.79年 | S328: 1.80年 | T328: 0.32 | U328: 594 | V328: 8.9900000000000002 | W328: 8.0000000000000002e-003 | X328: 1.3000000000000001e-002 | Y328: 38 | Z328: 2.22 | AA328: -0.13800000000000001 | AB328: -0.14300000000000002 | AC328: -0.221 | AD328: -0.222 | AE328: 94.54 | AF328: 97.39 | AG328: 1 | AH328: AA | AI328: 4.3899999999999995e-002 | AJ328: =H328+100*O328 -> 229.90000000000001 | AK328: 246 | AL328: 328 | AM328: 148.6 | AN328: 327 | AO328: -1.8000000000000002e-002 | AP328: 12 | AQ328: 凯龙转债!*
A329: 268 | B329: 113526 | C329: 联泰转债! | D329: 603797 | E329: 联泰环保 | F329: 城市公用 | G329: 三废处理 | H329: 201.48 | I329: 0.154 | J329: -0.16 | K329: 7.91 | L329: -7.4999999999999997e-003 | M329: 110.3 | N329: 6.11 | O329: 0.55600000000000005 | P329: 129.46 | Q329: 转股中 | R329: 3.89年 | S329: 1.89年 | T329: 1.93 | U329: 1964. | V329: 5.2599999999999998 | W329: 5.4000000000000006e-002 | X329: 7.0000000000000007e-002 | Y329: 36 | Z329: 2.3 | AA329: -0.14599999999999999 | AB329: -0.14899999999999999 | AC329: -0.21100000000000002 | AD329: -0.21299999999999999 | AE329: 94.54 | AF329: 94.31 | AG329: 0.81 | AH329: AA+ | AI329: 4.1900000000000007e-002 | AJ329: =H329+100*O329 -> 257.07999999999998 | AK329: 273.5 | AL329: 331 | AM329: 179 | AN329: 332 | AO329: 7.2000000000000008e-002 | AP329: 9 | AQ329: 联泰转债!
A330: 326 | B330: 128017 | C330: 金禾转债!! | D330: 2597 | E330: 金禾实业 | F330: 化工 | G330: 化工 | H330: 177.115 | I330: -4.3799999999999999e-002 | J330: 3.8399999999999997e-002 | K330: 37.2 | L330: -5.6000000000000008e-003 | M330: 108.8 | N330: 22.42 | O330: 6.7000000000000004e-002 | P330: 165.92 | Q330: 转股中 | R330: 2.66年 | S330: 0.66年 | T330: 5.52 | U330: 169 | V330: 0.17199999999999999 | W330: 2.6000000000000002e-002 | X330: 4.4000000000000004e-002 | Y330: 209 | Z330: 4.53 | AA330: -0.16899999999999998 | AB330: -0.17399999999999999 | AC330: -0.52600000000000002 | AD330: -0.52800000000000002 | AE330: 98.15 | AF330: 97.63 | AG330: 0.96 | AH330: AA | AI330: 4.2199999999999994e-002 | AJ330: =H330+100*O330 -> 183.815 | AK330: 188.3 | AL330: 319 | AM330: 90.2 | AN330: 316 | AO330: -0.19699999999999998 | AP330: 10 | AQ330: 金禾转债!!
A331: 330 | B331: 127004 | C331: 模塑转债!! | D331: 700 | E331: 模塑科技 | F331: 汽车 | G331: 零部件制 | H331: 174.15 | I331: -4.0000000000000002e-004 | J331: 1.2999999999999999e-003 | K331: 5.32 | L331: 2.5000000000000001e-002 | M331: 113.3 | N331: 7.46 | O331: 1.4399999999999999 | P331: 71.31 | Q331: 转股中 | R331: 2.24年 | S331: 0.24年 | T331: 1.32 | U331: 172 | V331: 0.74900000000000011 | W331: 2.7000000000000003e-002 | X331: 1.9e-002 | Y331: 49 | Z331: 1.88 | AA331: -0.17699999999999999 | AB331: -0.185 | AC331: -1.077 | AD331: -1.0820000000000001 | AE331: 100.1 | AF331: 100.32 | AG331: 0.04 | AH331: AA | AI331: 4.2199999999999994e-002 | AJ331: =H331+100*O331 -> 318.14999999999998 | AK331: 277 | AL331: 332 | AM331: 176.7 | AN331: 331 | AO331: 4.7e-002 | AP331: 36 | AQ331: 模塑转债!!
A332: 296 | B332: 113509 | C332: 新泉转债!! | D332: 603179 | E332: 新泉股份 | F332: 汽车 | G332: 零部件制 | H332: 210.74 | I332: 0.10099999999999999 | J332: -3.2000000000000002e-003 | K332: 31.11 | L332: 0.10000000000000001 | M332: 110.3 | N332: 15.55 | O332: 5.2999999999999999e-002 | P332: 200.06 | Q332: 转股中 | R332: 3.25年 | S332: 1.25年 | T332: 1.04 | U332: 569 | V332: 2.5800000000000001 | W332: 9.0000000000000011e-003 | X332: 1.8000000000000002e-002 | Y332: 114 | Z332: 4.67 | AA332: -0.184 | AB332: -0.188 | AC332: -0.34700000000000003 | AD332: -0.34899999999999998 | AE332: 96.79 | AF332: 96.23 | AG332: 0.97 | AH332: AA | AI332: 4.3899999999999995e-002 | AJ332: =H332+100*O332 -> 216.04000000000002 | AK332: 221.4 | AL332: 323 | AM332: 124.6 | AN332: 324 | AO332: -1.8000000000000002e-002 | AP332: 11 | AQ332: 新泉转债!!
A333: 293 | B333: 110044 | C333: 广电转债!! | D333: 600831 | E333: 广电网络 | F333: 传媒娱乐 | G333: 影视娱乐 | H333: 223.82 | I333: -4.0000000000000002e-004 | J333: 1.5e-003 | K333: 5.83 | L333: 3.4000000000000002e-003 | M333: 112.3 | N333: 6.9 | O333: 1.6499999999999999 | P333: 84.49 | Q333: 转股中 | R333: 3.31年 | S333: 1.31年 | T333: 0.71 | U333: 1127. | V333: 6.79 | W333: 1.7000000000000001e-002 | X333: 1.3999999999999999e-002 | Y333: 41 | Z333: 1.12 | AA333: -0.191 | AB333: -0.19600000000000001 | AC333: -0.34799999999999998 | AD333: -0.34999999999999998 | AE333: 96.53 | AF333: 97.71 | AG333: 0.34 | AH333: AA | AI333: 4.3899999999999995e-002 | AJ333: =H333+100*O333 -> 388.81999999999999 | AK333: 363.1 | AL333: 335 | AM333: 265.4 | AN333: 335 | AO333: 3.2000000000000001e-002 | AP333: 11 | AQ333: 广电转债!!
A334: 282 | B334: 123015 | C334: 蓝盾转债!! | D334: 300297 | E334: 蓝盾股份 | F334: 计算机及 | G334: 软件开发 | H334: 247.3 | I334: -6.1999999999999998e-003 | J334: 2.64e-002 | K334: 4.86 | L334: 4.7400000000000005e-002 | M334: 112.3 | N334: 5.79 | O334: 1.95 | P334: 83.94 | Q334: 转股中 | R334: 3.44年 | S334: 1.44年 | T334: 1 | U334: 476 | V334: 1.8999999999999999 | W334: 1.6e-002 | X334: 1.3999999999999999e-002 | Y334: 61 | Z334: 1.58 | AA334: -0.20800000000000002 | AB334: -0.21299999999999999 | AC334: -0.34100000000000003 | AD334: -0.34200000000000003 | AE334: 93 | AF334: 90.87 | AG334: 0.43 | AH334: AA- | AI334: 6.4899999999999999e-002 | AJ334: =H334+100*O334 -> 442.30000000000001 | AK334: 410.7 | AL334: 336 | AM334: 317.7 | AN334: 336 | AO334: 7.0000000000000007e-002 | AP334: 19 | AQ334: 蓝盾转债!!
A335: 314 | B335: 128028 | C335: 赣锋转债!!* | D335: 2460 | E335: 赣锋锂业 | F335: 有色金属 | G335: 小金属 | H335: 235.977 | I335: 2.1600000000000001e-002 | J335: -1.e-002 | K335: 98.5 | L335: 1.1599999999999999e-002 | M335: 108.5 | N335: 41.68 | O335: -1.e-003 | P335: 236.32 | Q335: 转股中 | R335: 2.80年 | S335: 0.80年 | T335: 0.54 | U335: 627 | V335: 4.9400000000000004 | W335: 0. | X335: 1.e-003 | Y335: 1331. | Z335: 14.14 | AA335: -0.245 | AB335: -0.248 | AC335: -0.59499999999999997 | AD335: -0.59599999999999997 | AE335: 97.3 | AF335: 96.79 | AG335: 1 | AH335: AA | AI335: 4.2199999999999994e-002 | AJ335: =H335+100*O335 -> 235.87700000000001 | AK335: 235.6 | AL335: 327 | AM335: 138.3 | AN335: 325 | AO335: -0.16899999999999998 | AP335: 12 | AQ335: 赣锋转债!!*
A336: 312 | B336: 128030 | C336: 天康转债!! | D336: 2100 | E336: 天康生物 | F336: 农业 | G336: 畜牧业 | H336: 252 | I336: 8.0000000000000002e-003 | J336: -1.0500000000000001e-002 | K336: 12.08 | L336: -2.5000000000000001e-003 | M336: 111.3 | N336: 7.85 | O336: 0.63800000000000001 | P336: 153.89 | Q336: 转股中 | R336: 2.80年 | S336: 0.80年 | T336: 0.96 | U336: 43 | V336: 0.18100000000000002 | W336: 6.9999999999999993e-003 | X336: 1.1000000000000001e-002 | Y336: 130 | Z336: 2.17 | AA336: -0.25600000000000001 | AB336: -0.26100000000000001 | AC336: -0.61899999999999999 | AD336: -0.621 | AE336: 97.82 | AF336: 99.32 | AG336: 1 | AH336: AA | AI336: 4.2199999999999994e-002 | AJ336: =H336+100*O336 -> 315.80000000000001 | AK336: 350.1 | AL336: 334 | AM336: 250.8 | AN336: 333 | AO336: 1.1000000000000001e-002 | AP336: 12 | AQ336: 天康转债!!
A337: 289 | B337: 128041 | C337: 盛路转债!! | D337: 2446 | E337: 盛路通信 | F337: 通信互联 | G337: 通信设备 | H337: 312 | I337: -3.3099999999999997e-002 | J337: 3.6600000000000001e-002 | K337: 5.96 | L337: 8.5000000000000006e-003 | M337: 114.3 | N337: 6.82 | O337: 2.5699999999999998 | P337: 87.39 | Q337: 转股中 | R337: 3.36年 | S337: 1.37年 | T337: 0.53 | U337: 397 | V337: 2.3700000000000001 | W337: 1.e-002 | X337: 9.0000000000000011e-003 | Y337: 54 | Z337: 1.8 | AA337: -0.26100000000000001 | AB337: -0.26600000000000001 | AC337: -0.41399999999999998 | AD337: -0.41499999999999998 | AE337: 96.3 | AF337: 99.21 | AG337: 0.41 | AH337: AA | AI337: 4.3899999999999995e-002 | AJ337: =H337+100*O337 -> 569. | AK337: 536.6 | AL337: 337 | AM337: 437.4 | AN337: 337 | AO337: 5.5999999999999994e-002 | AP337: 14 | AQ337: 盛路转债!!
A338: 313 | B338: 128029 | C338: 太阳转债!! | D338: 2078 | E338: 太阳纸业 | F338: 造纸包装 | G338: 造纸行业 | H338: 211.5 | I338: -5.7500000000000002e-002 | J338: 3.9699999999999999e-002 | K338: 17.15 | L338: -1.78e-002 | M338: 107 | N338: 8.55 | O338: 5.4000000000000006e-002 | P338: 200.58 | Q338: 转股中 | R338: 1.80年 | S338: 回售内 | T338: 9.09 | U338: 305 | V338: 0.158 | W338: 2.e-002 | X338: 4.0999999999999995e-002 | Y338: 450 | Z338: 2.9 | AA338: -0.316 | AB338: -0.32100000000000001 | AC338: 回售内 | AD338: 回售内 | AE338: 100.17 | AF338: 99.71 | AG338: 1 | AH338: AA+ | AI338: 4.0199999999999993e-002 | AJ338: =H338+100*O338 -> 216.90000000000001 | AK338: 222.4 | AL338: 324 | AM338: 122.2 | AN338: 322 | AO338: -8.1000000000000003e-002 | AP338: 7 | AQ338: 太阳转债!!
A339: 286 | B339: 123013 | C339: 横河转债! | D339: 300539 | E339: 横河模具 | F339: 机械装备 | G339: 专用设备 | H339: 415.224 | I339: -2.9100000000000001e-002 | J339: 2.7999999999999997e-002 | K339: 7.45 | L339: -2.7000000000000001e-003 | M339: 115.2 | N339: 9.13 | O339: 4.0899999999999999 | P339: 81.6 | Q339: 转股中 | R339: 3.39年 | S339: 1.39年 | T339: 0.38 | U339: 303 | V339: 1.8999999999999999 | W339: 2.3e-002 | X339: 1.9e-002 | Y339: 17 | Z339: 3.41 | AA339: -0.31900000000000001 | AB339: -0.32400000000000001 | AC339: -0.45600000000000002 | AD339: -0.45600000000000002 | AE339: 92.34 | AF339: 90.47 | AG339: 0.42 | AH339: A+ | AI339: 7.5899999999999995e-002 | AJ339: =H339+100*O339 -> 824.22399999999993 | AK339: 748.8 | AL339: 338 | AM339: 656.5 | AN339: 338 | AO339: 0.107 | AP339: 16 | AQ339: 横河转债!
A340: 225 | B340: 123029 | C340: 英科转债! | D340: 300677 | E340: 英科医疗 | F340: 医药 | G340: 医疗器械 | H340: 2645 | I340: 4.0000000000000002e-004 | J340: 3.7000000000000002e-003 | K340: 217 | L340: 4.0999999999999995e-003 | M340: 138.2 | N340: 11.32 | O340: 0.38 | P340: 1916.96 | Q340: 转股中 | R340: 4.45年 | S340: 2.45年 | T340: 1.23 | U340: 1151. | V340: 0.35299999999999998 | W340: 2.e-003 | X340: 3.1e-002 | Y340: 764 | Z340: 7.99 | AA340: -0.42700000000000005 | AB340: -0.42999999999999999 | AC340: -0.307 | AD340: -0.308 | AE340: 91.31 | AF340: 105.56 | AG340: 0.99 | AH340: AA- | AI340: 6.4899999999999999e-002 | AJ340: =H340+100*O340 -> 2683. | AK340: 3373. | AL340: 339 | AM340: 3267.5 | AN340: 339 | AO340: -1.3999999999999999e-002 | AP340: 17 | AQ340: 英科转债!