A1: 序号 | B1: 转债代码 | C1: 转债名称 | D1: 股票代码 | E1: 股票名称 | F1: 行业 | G1: 子行业 | H1: 转债价格 | I1: 涨跌 | J1: 日内套利 | K1: 股价 | L1: 涨跌 | M1: 剩余本息 | N1: 转股价格 | O1: 转股溢价率 | P1: 转股价值 | Q1: 距离转股日 | R1: 剩余年限 | S1: 回售年限 | T1: 转债余额 | U1: 转债成交额 | V1: 转债换手率 | W1: 余额/市值 | X1: 余额/股本 | Y1: 股票市值 | Z1: P/B | AA1: 税前收益率 | AB1: 税后收益率 | AC1: 税前回售收益 | AD1: 税后回售收益 | AE1: 回售价值 | AF1: 纯债价值 | AG1: 弹性 | AH1: 信用 | AI1: 折现率 | AJ1: 双低 | AK1: 老式双低 | AL1: 老式排名 | AM1: 新式双低 | AN1: 新式排名 | AO1: MA20乖离 | AP1: 热门度 | AQ1: 转债名称
A2: 247 | B2: 128062 | C2: 亚药转债! | D2: 2370. | E2: 亚太药业 | F2: 医药 | G2: 化学制药 | H2: 70.007 | I2: -6.6799999999999998e-002 | J2: 6.6799999999999998e-002 | K2: 4.91 | L2: -9.9100000000000008e-002 | M2: 119.8 | N2: 16.25 | O2: 1.3200000000000001 | P2: 30.22 | Q2: 转股中 | R2: 4.19年 | S2: 2.19年 | T2: 9.63 | U2: 280 | V2: 0.40299999999999997 | W2: 0.36599999999999999 | X2: 0.11 | Y2: 26 | Z2: 8.18 | AA2: 0.14000000000000001 | AB2: 0.13 | AC2: 0.182 | AD2: 0.17800000000000002 | AE2: 83.7 | AF2: 82.74 | AG2: 0 | AH2: A- | AI2: 9.4399999999999998e-002 | AJ2: =H2+100*O2 -> 202.00700000000001 | AK2: 109.8 | AL2: 23 | AM2: 26.1 | AN2: 75 | AO2: 0.309 | AP2: 87 | AQ2: 亚药转债!
A3: 266 | B3: 113527 | C3: 维格转债! | D3: 603518 | E3: 锦泓集团 | F3: 服装纺织 | G3: 服装行业 | H3: 82.2 | I3: -6.1999999999999998e-003 | J3: 5.6000000000000008e-003 | K3: 4.82 | L3: -2.4300000000000002e-002 | M3: 120.2 | N3: 9.85 | O3: 0.68000000000000005 | P3: 48.93 | Q3: 转股中 | R3: 4年2.1天 | S3: 2年2.1天 | T3: 7.46 | U3: 3.7 | V3: 6.0000000000000001e-003 | W3: 0.61299999999999999 | X3: 0.29999999999999999 | Y3: 12 | Z3: 0.77 | AA3: 0.10199999999999999 | AB3: 9.2100000000000015e-002 | AC3: 0.114 | AD3: 0.11 | AE3: 92.8 | AF3: 98.43 | AG3: 0.02 | AH3: AA | AI3: 5.2400000000000002e-002 | AJ3: =H3+100*O3 -> 150.19999999999999 | AK3: 115.5 | AL3: 50 | AM3: 17 | AN3: 16 | AO3: -2.4e-002 | AP3: 100 | AQ3: 维格转债!
A4: 112 | B4: 127018 | C4: 本钢转债! | D4: 761. | E4: 本钢板材 | F4: 钢铁 | G4: 炼钢 | H4: 78.05 | I4: -2.29e-002 | J4: 2.1299999999999999e-002 | K4: 3.05 | L4: -1.29e-002 | M4: 128.6 | N4: 5.03 | O4: 0.28699999999999998 | P4: 60.64 | Q4: 转股中 | R4: 5.43年 | S4: 3.43年 | T4: 68 | U4: 64 | V4: 1.2e-002 | W4: 0.57499999999999996 | X4: 0.34899999999999998 | Y4: 118 | Z4: 0.6 | AA4: 9.9700000000000011e-002 | AB4: 8.9600000000000013e-002 | AC4: 9.1499999999999998e-002 | AD4: 8.7499999999999994e-002 | AE4: 89.8 | AF4: 99.91 | AG4: 0.13 | AH4: AAA | AI4: 4.9100000000000005e-002 | AJ4: =H4+100*O4 -> 106.75 | AK4: 95.5 | AL4: 3 | AM4: -4.4 | AN4: 2 | AO4: -2.6000000000000002e-002 | AP4: 44 | AQ4: 本钢转债!
A5: 195 | B5: 128085 | C5: 鸿达转债! | D5: 2002. | E5: 鸿达兴业 | F5: 化工 | G5: 化工 | H5: 83.34 | I5: 2.1299999999999999e-002 | J5: -1.15e-002 | K5: 3.24 | L5: 2.86e-002 | M5: 124.4 | N5: 3.92 | O5: 8.0000000000000002e-003 | P5: 82.65 | Q5: 转股中 | R5: 4.90年 | S5: 2.90年 | T5: 24.2 | U5: 259 | V5: 0.129 | W5: 0.28800000000000003 | X5: 0.23800000000000002 | Y5: 84 | Z5: 1.18 | AA5: 8.7100000000000011e-002 | AB5: 7.7800000000000008e-002 | AC5: 7.5300000000000006e-002 | AD5: 7.2499999999999995e-002 | AE5: 88.97 | AF5: 97.36 | AG5: 0.34 | AH5: AA | AI5: 5.2400000000000002e-002 | AJ5: =H5+100*O5 -> 84.140000000000001 | AK5: 84 | AL5: 1 | AM5: -13.3 | AN5: 1 | AO5: 8.1000000000000003e-002 | AP5: 98 | AQ5: 鸿达转债!
A6: 335 | B6: 128013 | C6: 洪涛转债! | D6: 2325. | E6: 洪涛股份 | F6: 建筑 | G6: 装饰工程 | H6: 98.153 | I6: -4.7999999999999996e-003 | J6: 3.9000000000000003e-003 | K6: 2.27 | L6: -2.9900000000000003e-002 | M6: 109.8 | N6: 3.1 | O6: 0.34000000000000002 | P6: 73.23 | Q6: 转股中 | R6: 1.52年 | S6: 回售中 | T6: 12 | U6: 8.1 | V6: 6.9999999999999993e-003 | W6: 0.42299999999999999 | X6: 0.309 | Y6: 28 | Z6: 0.95 | AA6: 7.7699999999999991e-002 | AB6: 6.4699999999999994e-002 | AC6: 回售中 | AD6: 回售中 | AE6: 100.3 | AF6: 100.39 | AG6: 0.03 | AH6: AA- | AI6: 6.1600000000000002e-002 | AJ6: =H6+100*O6 -> 132.15300000000002 | AK6: 123.1 | AL6: 108 | AM6: 22.7 | AN6: 47 | AO6: -5.2000000000000005e-002 | AP6: 94 | AQ6: 洪涛转债!
A7: 75 | B7: 110072 | C7: 广汇转债! | D7: 600297 | E7: 广汇汽车 | F7: 汽车 | G7: 分销、售 | H7: 77.47 | I7: -2.3199999999999998e-002 | J7: 2.0199999999999999e-002 | K7: 2.66 | L7: -1.4800000000000001e-002 | M7: 114.5 | N7: 4.03 | O7: 0.17399999999999999 | P7: 66 | Q7: 33天 | R7: 5.57年 | S7: 3.57年 | T7: 33.7 | U7: 67 | V7: 2.6000000000000002e-002 | W7: 0.156 | X7: 0.10300000000000001 | Y7: 216 | Z7: 0.55 | AA7: 7.3800000000000004e-002 | AB7: 6.8600000000000008e-002 | AC7: 7.9699999999999993e-002 | AD7: 7.7899999999999997e-002 | AE7: 88.37 | AF7: 91.31 | AG7: 0.2 | AH7: AA+ | AI7: 4.2099999999999999e-002 | AJ7: =H7+100*O7 -> 94.870000000000005 | AK7: 88.9 | AL7: 2 | AM7: -2.4 | AN7: 3 | AO7: -3.7000000000000005e-002 | AP7: 30 | AQ7: 广汇转债!
A8: 336 | B8: 127003 | C8: 海印转债! | D8: 861. | E8: 海印股份 | F8: 商业零售 | G8: 商场 | H8: 101.998 | I8: -7.6e-003 | J8: 6.0999999999999995e-003 | K8: 2.22 | L8: -5.1299999999999998e-002 | M8: 111.8 | N8: 3 | O8: 0.37799999999999995 | P8: 74 | Q8: 转股中 | R8: 1.38年 | S8: 回售中 | T8: 6.74 | U8: 17 | V8: 2.4e-002 | W8: 0.13100000000000001 | X8: 9.6999999999999989e-002 | Y8: 52 | Z8: 1.31 | AA8: 6.9900000000000004e-002 | AB8: 5.3099999999999994e-002 | AC8: 回售中 | AD8: 回售中 | AE8: 100.3 | AF8: 105.91 | AG8: 0.03 | AH8: AA | AI8: 4.0599999999999997e-002 | AJ8: =H8+100*O8 -> 139.798 | AK8: 130 | AL8: 168 | AM8: 24.1 | AN8: 56 | AO8: -0.17399999999999999 | AP8: 76 | AQ8: 海印转债!
A9: 101 | B9: 127019 | C9: 国城转债! | D9: 688. | E9: 国城矿业 | F9: 有色金属 | G9: 锌铅镍锡 | H9: 80.15 | I9: -2.0299999999999999e-002 | J9: 1.9900000000000001e-002 | K9: 8.95 | L9: -1.7600000000000001e-002 | M9: 115.1 | N9: 21.07 | O9: 0.88700000000000001 | P9: 42.48 | Q9: 转股中 | R9: 5.48年 | S9: 3.48年 | T9: 8.5 | U9: 7.1 | V9: 1.e-002 | W9: 8.4000000000000005e-002 | X9: 3.5000000000000003e-002 | Y9: 102 | Z9: 4.6 | AA9: 6.9699999999999998e-002 | AB9: 6.4199999999999993e-002 | AC9: 7.3700000000000002e-002 | AD9: 7.1500000000000008e-002 | AE9: 88.65 | AF9: 91.27 | AG9: 0.02 | AH9: AA | AI9: 4.41e-002 | AJ9: =H9+100*O9 -> 168.85000000000002 | AK9: 117.8 | AL9: 59 | AM9: 26.6 | AN9: 81 | AO9: -3.1e-002 | AP9: 32 | AQ9: 国城转债!
A10: 282 | B10: 128044 | C10: 岭南转债! | D10: 2717. | E10: 岭南股份 | F10: 城市公用 | G10: 生态环境 | H10: 88.88 | I10: -1.34e-002 | J10: 1.29e-002 | K10: 3.1 | L10: -2.52e-002 | M10: 111.3 | N10: 5.91 | O10: 0.69400000000000006 | P10: 52.45 | Q10: 转股中 | R10: 3.56年 | S10: 1.56年 | T10: 6.59 | U10: 1.4 | V10: 2.e-003 | W10: 0.13900000000000001 | X10: 7.2999999999999995e-002 | Y10: 47 | Z10: 0.96 | AA10: 6.6600000000000006e-002 | AB10: 6.0100000000000001e-002 | AC10: 8.8699999999999987e-002 | AD10: 8.5099999999999995e-002 | AE10: 95.75 | AF10: 96.29 | AG10: 0.02 | AH10: AA | AI10: 4.24e-002 | AJ10: =H10+100*O10 -> 158.28 | AK10: 125.3 | AL10: 127 | AM10: 29 | AN10: 97 | AO10: -8.1000000000000003e-002 | AP10: 36 | AQ10: 岭南转债!
A11: 76 | B11: 113600 | C11: 新星转债! | D11: 603978 | E11: 深圳新星 | F11: 有色金属 | G11: 有色行业 | H11: 88.87 | I11: -9.7999999999999997e-003 | J11: 2.5000000000000001e-003 | K11: 16.25 | L11: -2.87e-002 | M11: 126 | N11: 23.85 | O11: 0.30399999999999999 | P11: 68.13 | Q11: 28天 | R11: 5.56年 | S11: 3.56年 | T11: 5.95 | U11: 4.2 | V11: 8.0000000000000002e-003 | W11: 0.22899999999999998 | X11: 0.156 | Y11: 26 | Z11: 1.7 | AA11: 6.6199999999999995e-002 | AB11: 5.7800000000000004e-002 | AC11: 4.3400000000000001e-002 | AD11: 4.1100000000000005e-002 | AE11: 82.37 | AF11: 89.37 | AG11: 0.25 | AH11: AA- | AI11: 6.5099999999999991e-002 | AJ11: =H11+100*O11 -> 119.27000000000001 | AK11: 109.6 | AL11: 22 | AM11: 20.2 | AN11: 26 | AO11: -1.8000000000000002e-002 | AP11: 13 | AQ11: 新星转债!
A12: 330 | B12: 128015 | C12: 久其转债! | D12: 2279. | E12: 久其软件 | F12: 计算机及 | G12: 软件开发 | H12: 95.6 | I12: -4.0999999999999995e-003 | J12: 4.0999999999999995e-003 | K12: 4.28 | L12: -2.06e-002 | M12: 110.8 | N12: 9.48 | O12: 1.1200000000000001 | P12: 45.15 | Q12: 转股中 | R12: 2.38年 | S12: 0.38年 | T12: 7.8 | U12: 5.5 | V12: 6.9999999999999993e-003 | W12: 0.25600000000000001 | X12: 0.11599999999999999 | Y12: 30 | Z12: 4.31 | AA12: 6.5199999999999994e-002 | AB12: 5.6100000000000004e-002 | AC12: 0.11800000000000001 | AD12: 0.11199999999999999 | AE12: 97.78 | AF12: 94.07 | AG12: 0 | AH12: A+ | AI12: 7.2599999999999998e-002 | AJ12: =H12+100*O12 -> 207.60000000000002 | AK12: 146.1 | AL12: 241 | AM12: 48.3 | AN12: 214 | AO12: -2.3e-002 | AP12: 61 | AQ12: 久其转债!
A13: 245 | B13: 128063 | C13: 未来转债 | D13: 2631. | E13: 德尔未来 | F13: 其他 | G13: 家居用品 | H13: 99.697 | I13: -3.4999999999999996e-003 | J13: -4.0999999999999995e-003 | K13: 6.71 | L13: -3.0299999999999997e-002 | M13: 128.2 | N13: 8.63 | O13: 0.28199999999999997 | P13: 77.75 | Q13: 转股中 | R13: 4.19年 | S13: 3.19年 | T13: 6.3 | U13: 3.1 | V13: 5.0000000000000001e-003 | W13: 0.14099999999999999 | X13: 0.11 | Y13: 45 | Z13: 2.55 | AA13: 6.3799999999999996e-002 | AB13: 5.1799999999999999e-002 | AC13: 2.7200000000000002e-002 | AD13: 2.2000000000000002e-002 | AE13: 89.01 | AF13: 99.86 | AG13: 0.25 | AH13: AA- | AI13: 6.3399999999999998e-002 | AJ13: =H13+100*O13 -> 127.89699999999999 | AK13: 121.6 | AL13: 92 | AM13: 21.8 | AN13: 39 | AO13: -0.111 | AP13: 35 | AQ13: 未来转债
A14: 167 | B14: 113569 | C14: 科达转债! | D14: 603660 | E14: 苏州科达 | F14: 通信互联 | G14: 物联网 | H14: 89.26 | I14: -1.78e-002 | J14: 1.7899999999999999e-002 | K14: 7.3 | L14: 1.4000000000000002e-003 | M14: 120.7 | N14: 14.84 | O14: 0.81499999999999995 | P14: 49.19 | Q14: 转股中 | R14: 5年46天 | S14: 3年46天 | T14: 5.16 | U14: 2.8 | V14: 6.0000000000000001e-003 | W14: 0.14199999999999999 | X14: 7.0000000000000007e-002 | Y14: 36 | Z14: 2.14 | AA14: 6.2100000000000002e-002 | AB14: 5.45e-002 | AC14: 4.82e-002 | AD14: 4.5599999999999995e-002 | AE14: 84.75 | AF14: 88.01 | AG14: 0.06 | AH14: AA- | AI14: 6.5099999999999991e-002 | AJ14: =H14+100*O14 -> 170.75999999999999 | AK14: 129.3 | AL14: 163 | AM14: 41.3 | AN14: 185 | AO14: 1.8000000000000002e-002 | AP14: 24 | AQ14: 科达转债!
A15: 94 | B15: 113595 | C15: 花王转债! | D15: 603007 | E15: 花王股份 | F15: 城市公用 | G15: 生态环境 | H15: 90.79 | I15: -2.46e-002 | J15: -2.0999999999999999e-003 | K15: 5.23 | L15: -7.5999999999999998e-002 | M15: 125.3 | N15: 6.93 | O15: 0.20300000000000001 | P15: 75.47 | Q15: 5.1天 | R15: 5.49年 | S15: 3.49年 | T15: 3.3 | U15: 12 | V15: 4.0000000000000001e-002 | W15: 0.188 | X15: 0.14199999999999999 | Y15: 18 | Z15: 1.58 | AA15: 6.1799999999999994e-002 | AB15: 5.3499999999999999e-002 | AC15: 3.8900000000000004e-002 | AD15: 3.6499999999999998e-002 | AE15: 82.98 | AF15: 89.29 | AG15: 0.35 | AH15: AA- | AI15: 6.5099999999999991e-002 | AJ15: =H15+100*O15 -> 111.09 | AK15: 106.1 | AL15: 11 | AM15: 16.8 | AN15: 14 | AO15: 1.9e-002 | AP15: 33 | AQ15: 花王转债!
A16: 289 | B16: 123011 | C16: 德尔转债! | D16: 300473 | E16: 德尔股份 | F16: 汽车 | G16: 零部件制 | H16: 94.801 | I16: -6.3e-003 | J16: 4.7999999999999996e-003 | K16: 18.93 | L16: -3.5200000000000002e-002 | M16: 116.3 | N16: 34.54 | O16: 0.72999999999999998 | P16: 54.81 | Q16: 转股中 | R16: 3.49年 | S16: 1.49年 | T16: 2.51 | U16: 1.8 | V16: 8.0000000000000002e-003 | W16: 0.11599999999999999 | X16: 6.4000000000000001e-002 | Y16: 22 | Z16: 0.96 | AA16: 6.1699999999999998e-002 | AB16: 5.2600000000000001e-002 | AC16: 5.0700000000000002e-002 | AD16: 4.7100000000000003e-002 | AE16: 92.96 | AF16: 94.27 | AG16: 0.04 | AH16: AA- | AI16: 6.3399999999999998e-002 | AJ16: =H16+100*O16 -> 167.80099999999999 | AK16: 134.8 | AL16: 192 | AM16: 40.5 | AN16: 178 | AO16: -0.11199999999999999 | AP16: 42 | AQ16: 德尔转债!
A17: 194 | B17: 128087 | C17: 孚日转债! | D17: 2083. | E17: 孚日股份 | F17: 服装纺织 | G17: 家纺 | H17: 85.45 | I17: -3.0000000000000001e-003 | J17: 6.0999999999999995e-003 | K17: 4.05 | L17: 2.0199999999999999e-002 | M17: 112.9 | N17: 6.3 | O17: 0.32899999999999996 | P17: 64.29 | Q17: 转股中 | R17: 4.90年 | S17: 2.90年 | T17: 6.5 | U17: 24 | V17: 4.4000000000000004e-002 | W17: 0.17699999999999999 | X17: 0.114 | Y17: 37 | Z17: 0.98 | AA17: 5.9699999999999996e-002 | AB17: 5.4400000000000004e-002 | AC17: 6.4699999999999994e-002 | AD17: 6.2300000000000001e-002 | AE17: 91.13 | AF17: 92.46 | AG17: 0.15 | AH17: AA | AI17: 4.24e-002 | AJ17: =H17+100*O17 -> 118.34999999999999 | AK17: 106.6 | AL17: 14 | AM17: 14.2 | AN17: 10 | AO17: -6.9000000000000006e-002 | AP17: 52 | AQ17: 孚日转债!
A18: 230 | B18: 123028 | C18: 清水转债 | D18: 300437 | E18: 清水源 | F18: 城市公用 | G18: 三废处理 | H18: 95.3 | I18: -1.04e-002 | J18: 1.2999999999999999e-003 | K18: 9.01 | L18: -2.9100000000000001e-002 | M18: 121.8 | N18: 11.84 | O18: 0.252 | P18: 76.1 | Q18: 转股中 | R18: 4.41年 | S18: 2.41年 | T18: 4.56 | U18: 1.9 | V18: 4.0000000000000001e-003 | W18: 0.22899999999999998 | X18: 0.17399999999999999 | Y18: 20 | Z18: 1.28 | AA18: 5.9000000000000004e-002 | AB18: 4.9699999999999994e-002 | AC18: 3.7900000000000003e-002 | AD18: 3.4099999999999998e-002 | AE18: 89.61 | AF18: 93.61 | AG18: 0.31 | AH18: AA- | AI18: 6.3399999999999998e-002 | AJ18: =H18+100*O18 -> 120.5 | AK18: 114.5 | AL18: 47 | AM18: 20.9 | AN18: 31 | AO18: -5.2999999999999999e-002 | AP18: 54 | AQ18: 清水转债
A19: 310 | B19: 113017 | C19: 吉视转债! | D19: 601929 | E19: 吉视传媒 | F19: 传媒娱乐 | G19: 影视娱乐 | H19: 92.28 | I19: -6.8999999999999999e-003 | J19: 5.7999999999999996e-003 | K19: 1.84 | L19: -2.6499999999999999e-002 | M19: 108.8 | N19: 2.95 | O19: 0.47899999999999998 | P19: 62.37 | Q19: 转股中 | R19: 2.93年 | S19: 0.93年 | T19: 15.6 | U19: 12 | V19: 8.0000000000000002e-003 | W19: 0.27200000000000002 | X19: 0.17000000000000001 | Y19: 57 | Z19: 0.86 | AA19: 5.8700000000000002e-002 | AB19: 5.2600000000000001e-002 | AC19: 9.1499999999999998e-002 | AD19: 8.8399999999999992e-002 | AE19: 97.43 | AF19: 97.52 | AG19: 0.04 | AH19: AA+ | AI19: 3.8599999999999995e-002 | AJ19: =H19+100*O19 -> 140.18000000000001 | AK19: 122.2 | AL19: 100 | AM19: 24.7 | AN19: 59 | AO19: -5.0999999999999997e-002 | AP19: 58 | AQ19: 吉视转债!
A20: 235 | B20: 113535 | C20: 大业转债! | D20: 603278 | E20: 大业股份 | F20: 汽车 | G20: 零部件制 | H20: 94.02 | I20: 1.e-004 | J20: 4.1999999999999997e-003 | K20: 7.91 | L20: 5.0499999999999996e-002 | M20: 113.1 | N20: 12.4 | O20: 0.47399999999999998 | P20: 63.79 | Q20: 转股中 | R20: 3.29年 | S20: 1.29年 | T20: 5 | U20: 20 | V20: 4.2000000000000003e-002 | W20: 0.218 | X20: 0.13900000000000001 | Y20: 23 | Z20: 1.4 | AA20: 5.8600000000000006e-002 | AB20: 5.0799999999999998e-002 | AC20: 5.67e-002 | AD20: 5.4000000000000006e-002 | AE20: 95.89 | AF20: 98.83 | AG20: 0.08 | AH20: AA | AI20: 4.24e-002 | AJ20: =H20+100*O20 -> 141.41999999999999 | AK20: 124.2 | AL20: 115 | AM20: 25.4 | AN20: 69 | AO20: 1.7000000000000001e-002 | AP20: 50 | AQ20: 大业转债!
A21: 280 | B21: 113519 | C21: 长久转债! | D21: 603569 | E21: 长久物流 | F21: 交通运输 | G21: 物流业 | H21: 96.8 | I21: -1.5e-003 | J21: 0. | K21: 7.07 | L21: -2.0799999999999999e-002 | M21: 119.3 | N21: 11.15 | O21: 0.52700000000000002 | P21: 63.41 | Q21: 转股中 | R21: 3.79年 | S21: 1.79年 | T21: 6.97 | U21: 1 | V21: 1.e-003 | W21: 0.17600000000000002 | X21: 0.11199999999999999 | Y21: 40 | Z21: 1.86 | AA21: 5.7699999999999994e-002 | AB21: 4.82e-002 | AC21: 3.1400000000000004e-002 | AD21: 2.8500000000000001e-002 | AE21: 94.83 | AF21: 102.2 | AG21: 0.07 | AH21: AA | AI21: 4.24e-002 | AJ21: =H21+100*O21 -> 149.5 | AK21: 130.2 | AL21: 169 | AM21: 28 | AN21: 93 | AO21: -5.0999999999999997e-002 | AP21: 18 | AQ21: 长久转债!
A22: 114 | B22: 113589 | C22: 天创转债! | D22: 603608 | E22: 天创时尚 | F22: 服装纺织 | G22: 鞋服行业 | H22: 85.61 | I22: -1.2500000000000001e-002 | J22: 1.1299999999999999e-002 | K22: 6 | L22: -2.6000000000000002e-002 | M22: 115.3 | N22: 12.44 | O22: 0.77500000000000002 | P22: 48.23 | Q22: 转股中 | R22: 5.42年 | S22: 3.42年 | T22: 6 | U22: 1.8 | V22: 3.0000000000000001e-003 | W22: 0.23300000000000001 | X22: 0.11199999999999999 | Y22: 26 | Z22: 1.21 | AA22: 5.7699999999999994e-002 | AB22: 5.21e-002 | AC22: 5.5800000000000002e-002 | AD22: 5.3499999999999999e-002 | AE22: 89.06 | AF22: 91.69 | AG22: 0.05 | AH22: AA | AI22: 4.41e-002 | AJ22: =H22+100*O22 -> 163.11000000000001 | AK22: 123 | AL22: 106 | AM22: 31.3 | AN22: 112 | AO22: -3.9e-002 | AP22: 17 | AQ22: 天创转债!
A23: 300 | B23: 128037 | C23: 岩土转债! | D23: 2542. | E23: 中化岩土 | F23: 建筑 | G23: 建筑工程 | H23: 94.8 | I23: -1.2699999999999999e-002 | J23: 1.2699999999999999e-002 | K23: 2.92 | L23: -3.6299999999999999e-002 | M23: 112.3 | N23: 7.99 | O23: 1.5900000000000001 | P23: 36.55 | Q23: 转股中 | R23: 3年52天 | S23: 1年52天 | T23: 5.99 | U23: 3.4 | V23: 6.0000000000000001e-003 | W23: 0.114 | X23: 4.2000000000000003e-002 | Y23: 53 | Z23: 1.3 | AA23: 5.67e-002 | AB23: 4.8899999999999999e-002 | AC23: 6.4600000000000005e-002 | AD23: 5.9900000000000002e-002 | AE23: 97.42 | AF23: 98.85 | AG23: 0 | AH23: AA | AI23: 4.24e-002 | AJ23: =H23+100*O23 -> 253.80000000000001 | AK23: 153.1 | AL23: 263 | AM23: 54.2 | AN23: 242 | AO23: -3.5000000000000003e-002 | AP23: 49 | AQ23: 岩土转债!
A24: 250 | B24: 113530 | C24: 大丰转债! | D24: 603081 | E24: 大丰实业 | F24: 建筑 | G24: 装饰工程 | H24: 97.2 | I24: 2.0999999999999999e-003 | J24: 1.1999999999999999e-003 | K24: 11.16 | L24: 3.2400000000000005e-002 | M24: 121.6 | N24: 16.64 | O24: 0.44900000000000001 | P24: 67.07 | Q24: 转股中 | R24: 4.18年 | S24: 2.18年 | T24: 6.3 | U24: 7.1 | V24: 1.1000000000000001e-002 | W24: 0.14000000000000001 | X24: 9.4e-002 | Y24: 45 | Z24: 2.18 | AA24: 5.6399999999999999e-002 | AB24: 4.6900000000000004e-002 | AC24: 2.76e-002 | AD24: 2.4500000000000001e-002 | AE24: 94.03 | AF24: 102.63 | AG24: 0.1 | AH24: AA | AI24: 4.24e-002 | AJ24: =H24+100*O24 -> 142.09999999999999 | AK24: 127.3 | AL24: 143 | AM24: 24.7 | AN24: 61 | AO24: 4.9000000000000002e-002 | AP24: 34 | AQ24: 大丰转债!
A25: 237 | B25: 110058 | C25: 永鼎转债! | D25: 600105 | E25: 永鼎股份 | F25: 通信互联 | G25: 通信设备 | H25: 91.82 | I25: -7.7000000000000002e-003 | J25: 5.5000000000000005e-003 | K25: 3.11 | L25: -2.2000000000000002e-002 | M25: 114.9 | N25: 5.04 | O25: 0.48799999999999999 | P25: 61.71 | Q25: 转股中 | R25: 4.23年 | S25: 2.23年 | T25: 2.61 | U25: 9.5 | V25: 4.0000000000000001e-002 | W25: 6.0999999999999999e-002 | X25: 3.7999999999999999e-002 | Y25: 43 | Z25: 1.53 | AA25: 5.57e-002 | AB25: 4.8799999999999996e-002 | AC25: 5.1399999999999994e-002 | AD25: 4.8399999999999999e-002 | AE25: 93.71 | AF25: 96.75 | AG25: 0.1 | AH25: AA | AI25: 4.24e-002 | AJ25: =H25+100*O25 -> 140.62 | AK25: 121.9 | AL25: 96 | AM25: 25.2 | AN25: 65 | AO25: -5.0999999999999997e-002 | AP25: 51 | AQ25: 永鼎转债!
A26: 319 | B26: 128023 | C26: 亚太转债! | D26: 2284. | E26: 亚太股份 | F26: 汽车 | G26: 零部件制 | H26: 95.587 | I26: -6.5000000000000006e-003 | J26: 6.0999999999999995e-003 | K26: 5.69 | L26: -1.9e-002 | M26: 111.3 | N26: 10.34 | O26: 0.73699999999999999 | P26: 55.03 | Q26: 转股中 | R26: 2.87年 | S26: 0.87年 | T26: 9.99 | U26: 3.1 | V26: 3.0000000000000001e-003 | W26: 0.23800000000000002 | X26: 0.13100000000000001 | Y26: 42 | Z26: 1.73 | AA26: 5.5399999999999998e-002 | AB26: 4.7599999999999996e-002 | AC26: 6.3e-002 | AD26: 5.9400000000000001e-002 | AE26: 97.71 | AF26: 99.48 | AG26: 0.02 | AH26: AA | AI26: 4.0599999999999997e-002 | AJ26: =H26+100*O26 -> 169.28700000000001 | AK26: 136.1 | AL26: 201 | AM26: 36.7 | AN26: 152 | AO26: -7.400000000000001e-002 | AP26: 67 | AQ26: 亚太转债!
A27: 229 | B27: 128069 | C27: 华森转债! | D27: 2907. | E27: 华森制药 | F27: 医药 | G27: 化学制药 | H27: 95.211 | I27: -4.5999999999999999e-003 | J27: -2.0000000000000001e-004 | K27: 11.76 | L27: -3.0499999999999999e-002 | M27: 120 | N27: 18.04 | O27: 0.46100000000000002 | P27: 65.19 | Q27: 转股中 | R27: 4.42年 | S27: 2.42年 | T27: 3 | U27: 3.3 | V27: 1.1000000000000001e-002 | W27: 6.4000000000000001e-002 | X27: 4.0999999999999995e-002 | Y27: 47 | Z27: 4.4 | AA27: 5.4900000000000004e-002 | AB27: 4.6500000000000007e-002 | AC27: 3.32e-002 | AD27: 3.04e-002 | AE27: 88.45 | AF27: 91.98 | AG27: 0.16 | AH27: AA- | AI27: 6.3399999999999998e-002 | AJ27: =H27+100*O27 -> 141.31100000000001 | AK27: 125.2 | AL27: 126 | AM27: 33.3 | AN27: 134 | AO27: -8.3000000000000004e-002 | AP27: 46 | AQ27: 华森转债!
A28: 168 | B28: 113568 | C28: 新春转债! | D28: 603667 | E28: 五洲新春 | F28: 机械装备 | G28: 通用设备 | H28: 95.66 | I28: -1.9e-003 | J28: -2.8999999999999998e-003 | K28: 7.05 | L28: -1.26e-002 | M28: 124.8 | N28: 8.91 | O28: 0.20899999999999999 | P28: 79.12 | Q28: 转股中 | R28: 5年43天 | S28: 3年43天 | T28: 3.3 | U28: 2.7 | V28: 9.0000000000000011e-003 | W28: 0.16 | X28: 0.127 | Y28: 21 | Z28: 1.19 | AA28: 5.4800000000000001e-002 | AB28: 4.5999999999999999e-002 | AC28: 2.8300000000000002e-002 | AD28: 2.5399999999999999e-002 | AE28: 85.38 | AF28: 91.13 | AG28: 0.38 | AH28: AA- | AI28: 6.5099999999999991e-002 | AJ28: =H28+100*O28 -> 116.56 | AK28: 112.2 | AL28: 35 | AM28: 21.1 | AN28: 33 | AO28: -2.7999999999999997e-002 | AP28: 49 | AQ28: 新春转债!
A29: 182 | B29: 128093 | C29: 百川转债! | D29: 2455. | E29: 百川股份 | F29: 化工 | G29: 化工 | H29: 100.8 | I29: -4.5000000000000005e-003 | J29: 6.9999999999999993e-003 | K29: 5.04 | L29: 6.0000000000000001e-003 | M29: 129.8 | N29: 5.87 | O29: 0.17399999999999999 | P29: 85.86 | Q29: 转股中 | R29: 4.95年 | S29: 2.95年 | T29: 5.2 | U29: 5.7 | V29: 1.1000000000000001e-002 | W29: 0.20000000000000001 | X29: 0.17100000000000001 | Y29: 26 | Z29: 2.02 | AA29: 5.4299999999999994e-002 | AB29: 4.3700000000000003e-002 | AC29: 1.9299999999999998e-002 | AD29: 1.4999999999999999e-002 | AE29: 88.53 | AF29: 96.73 | AG29: 0.42 | AH29: AA- | AI29: 6.3399999999999998e-002 | AJ29: =H29+100*O29 -> 118.19999999999999 | AK29: 115.7 | AL29: 51 | AM29: 19 | AN29: 23 | AO29: -8.0000000000000002e-002 | AP29: 48 | AQ29: 百川转债!
A30: 107 | B30: 128118 | C30: 瀛通转债! | D30: 2861. | E30: 瀛通通讯 | F30: 电子 | G30: 电子产品 | H30: 92.489 | I30: -1.0500000000000001e-002 | J30: 5.1999999999999998e-003 | K30: 18.3 | L30: -2.0299999999999999e-002 | M30: 122.1 | N30: 27.53 | O30: 0.39100000000000001 | P30: 66.47 | Q30: 转股中 | R30: 5.44年 | S30: 3.44年 | T30: 3 | U30: 2.8 | V30: 1.e-002 | W30: 0.13500000000000001 | X30: 8.900000000000001e-002 | Y30: 22 | Z30: 2.1 | AA30: 5.3699999999999998e-002 | AB30: 4.6199999999999998e-002 | AC30: 3.5099999999999999e-002 | AD30: 3.2500000000000001e-002 | AE30: 83.54 | AF30: 87.35 | AG30: 0.26 | AH30: AA- | AI30: 6.5099999999999991e-002 | AJ30: =H30+100*O30 -> 131.589 | AK30: 118.5 | AL30: 68 | AM30: 31.2 | AN30: 110 | AO30: -3.2000000000000001e-002 | AP30: 10 | AQ30: 瀛通转债!
A31: 324 | B31: 113502 | C31: 嘉澳转债! | D31: 603822 | E31: 嘉澳环保 | F31: 化工 | G31: 化工 | H31: 96.39 | I31: -1.46e-002 | J31: 1.46e-002 | K31: 18.58 | L31: 1.03e-002 | M31: 111.3 | N31: 44.79 | O31: 1.3200000000000001 | P31: 41.48 | Q31: 转股中 | R31: 2.80年 | S31: 0.80年 | T31: 1.85 | U31: 3.4 | V31: 1.9e-002 | W31: 0.13600000000000001 | X31: 5.5999999999999994e-002 | Y31: 14 | Z31: 1.81 | AA31: 5.3600000000000002e-002 | AB31: 4.5599999999999995e-002 | AC31: 5.8299999999999998e-002 | AD31: 5.4400000000000004e-002 | AE31: 96.1 | AF31: 94.4 | AG31: 0 | AH31: AA- | AI31: 6.1600000000000002e-002 | AJ31: =H31+100*O31 -> 228.38999999999999 | AK31: 151.3 | AL31: 256 | AM31: 55.2 | AN31: 247 | AO31: 4.2999999999999997e-002 | AP31: 32 | AQ31: 嘉澳转债!
A32: 320 | B32: 128022 | C32: 众信转债! | D32: 2707. | E32: 众信旅游 | F32: 旅游餐饮 | G32: 旅游 | H32: 93.97 | I32: -7.000000000000001e-004 | J32: -1.e-004 | K32: 4.71 | L32: -2.8900000000000002e-002 | M32: 108.8 | N32: 7.92 | O32: 0.57999999999999996 | P32: 59.47 | Q32: 转股中 | R32: 2.86年 | S32: 0.86年 | T32: 4.56 | U32: 8.7 | V32: 2.e-002 | W32: 0.107 | X32: 6.4000000000000001e-002 | Y32: 43 | Z32: 2.01 | AA32: 5.3399999999999996e-002 | AB32: 4.7199999999999999e-002 | AC32: 7.8899999999999998e-002 | AD32: 7.5600000000000001e-002 | AE32: 97.5 | AF32: 97.26 | AG32: 0.03 | AH32: AA | AI32: 4.0599999999999997e-002 | AJ32: =H32+100*O32 -> 151.97 | AK32: 128.5 | AL32: 151 | AM32: 31 | AN32: 109 | AO32: -2.e-002 | AP32: 27 | AQ32: 众信转债!
A33: 193 | B33: 113557 | C33: 森特转债 | D33: 603098 | E33: 森特股份 | F33: 建筑 | G33: 建筑工程 | H33: 93.86 | I33: -9.7999999999999997e-003 | J33: 7.8000000000000005e-003 | K33: 8.16 | L33: -4.8999999999999998e-003 | M33: 120.3 | N33: 10.11 | O33: 0.16300000000000001 | P33: 80.71 | Q33: 转股中 | R33: 4.91年 | S33: 2.91年 | T33: 6 | U33: 2.5 | V33: 4.0000000000000001e-003 | W33: 0.153 | X33: 0.124 | Y33: 39 | Z33: 1.89 | AA33: 5.2999999999999999e-002 | AB33: 4.53e-002 | AC33: 3.3099999999999997e-002 | AD33: 3.0600000000000002e-002 | AE33: 85.96 | AF33: 89.51 | AG33: 0.41 | AH33: AA- | AI33: 6.3399999999999998e-002 | AJ33: =H33+100*O33 -> 110.16 | AK33: 107 | AL33: 16 | AM33: 17.5 | AN33: 18 | AO33: -4.0000000000000001e-003 | AP33: 39 | AQ33: 森特转债
A34: 262 | B34: 113528 | C34: 长城转债! | D34: 603897 | E34: 长城科技 | F34: 机械装备 | G34: 专用设备 | H34: 95.69 | I34: -9.1999999999999998e-003 | J34: 5.5000000000000005e-003 | K34: 16.3 | L34: -1.6899999999999998e-002 | M34: 117.6 | N34: 23.45 | O34: 0.377 | P34: 69.51 | Q34: 转股中 | R34: 4年38天 | S34: 2年38天 | T34: 6.34 | U34: 3.1 | V34: 5.0000000000000001e-003 | W34: 0.218 | X34: 0.152 | Y34: 29 | Z34: 1.59 | AA34: 5.2900000000000003e-002 | AB34: 4.4699999999999997e-002 | AC34: 3.7599999999999995e-002 | AD34: 3.4000000000000002e-002 | AE34: 90.58 | AF34: 91.99 | AG34: 0.22 | AH34: AA- | AI34: 6.3399999999999998e-002 | AJ34: =H34+100*O34 -> 133.38999999999999 | AK34: 121.9 | AL34: 94 | AM34: 29.9 | AN34: 102 | AO34: -3.3000000000000002e-002 | AP34: 45 | AQ34: 长城转债!
A35: 83 | B35: 113597 | C35: 佳力转债! | D35: 603912 | E35: 佳力图 | F35: 机械装备 | G35: 专用设备 | H35: 94.46 | I35: -1.04e-002 | J35: 7.8000000000000005e-003 | K35: 13.14 | L35: -2.0099999999999996e-002 | M35: 124.5 | N35: 23.4 | O35: 0.68200000000000005 | P35: 56.15 | Q35: 14天 | R35: 5.52年 | S35: 3.52年 | T35: 3 | U35: 1.5 | V35: 5.0000000000000001e-003 | W35: 0.105 | X35: 5.9000000000000004e-002 | Y35: 29 | Z35: 3.28 | AA35: 5.2499999999999998e-002 | AB35: 4.4500000000000005e-002 | AC35: 2.7900000000000001e-002 | AD35: 2.5399999999999999e-002 | AE35: 83 | AF35: 88.6 | AG35: 0.13 | AH35: AA- | AI35: 6.5099999999999991e-002 | AJ35: =H35+100*O35 -> 162.66 | AK35: 132.8 | AL35: 183 | AM35: 44.2 | AN35: 194 | AO35: -4.4999999999999998e-002 | AP35: 9 | AQ35: 佳力转债!
A36: 212 | B36: 113546 | C36: 迪贝转债! | D36: 603320 | E36: 迪贝电气 | F36: 家电 | G36: 零部件制 | H36: 95.26 | I36: -1.1000000000000001e-002 | J36: 9.0000000000000011e-003 | K36: 10.23 | L36: -5.7999999999999996e-003 | M36: 120.6 | N36: 14.1 | O36: 0.313 | P36: 72.55 | Q36: 转股中 | R36: 4.75年 | S36: 2.75年 | T36: 2.3 | U36: 2.1 | V36: 1.e-002 | W36: 0.17300000000000001 | X36: 0.125 | Y36: 13 | Z36: 2 | AA36: 5.21e-002 | AB36: 4.4000000000000004e-002 | AC36: 3.0699999999999998e-002 | AD36: 2.7900000000000001e-002 | AE36: 84.51 | AF36: 86.42 | AG36: 0.34 | AH36: A+ | AI36: 7.4400000000000008e-002 | AJ36: =H36+100*O36 -> 126.56 | AK36: 118 | AL36: 60 | AM36: 31.5 | AN36: 118 | AO36: -4.5999999999999999e-002 | AP36: 44 | AQ36: 迪贝转债!
A37: 23 | B37: 123080 | C37: 海波转债! | D37: 300517 | E37: 海波重科 | F37: 建筑 | G37: 建筑工程 | H37: 94.586 | I37: -5.8999999999999999e-003 | J37: 7.7000000000000002e-003 | K37: 17.3 | L37: 3.4999999999999996e-003 | M37: 126.5 | N37: 20.91 | O37: 0.14300000000000002 | P37: 82.74 | Q37: 4月17天 | R37: 5.86年 | S37: 3.86年 | T37: 2.45 | U37: 5.8 | V37: 2.5000000000000001e-002 | W37: 0.13300000000000001 | X37: 0.11 | Y37: 18 | Z37: 2.42 | AA37: 5.2000000000000005e-002 | AB37: 4.4000000000000004e-002 | AC37: 2.58e-002 | AD37: 2.3399999999999997e-002 | AE37: 78.18 | AF37: 83.1 | AG37: 0.52 | AH37: A+ | AI37: 7.6100000000000001e-002 | AJ37: =H37+100*O37 -> 108.886 | AK37: 106.4 | AL37: 13 | AM37: 23.3 | AN37: 49 | AO37: 0.107 | AP37: 5 | AQ37: 海波转债!
A38: 236 | B38: 128066 | C38: 亚泰转债! | D38: 2811. | E38: 郑中设计 | F38: 建筑 | G38: 装饰工程 | H38: 95.333 | I38: -1.7299999999999999e-002 | J38: 5.1999999999999998e-003 | K38: 8.02 | L38: -2.9100000000000001e-002 | M38: 117.5 | N38: 9.67 | O38: 0.14899999999999999 | P38: 82.94 | Q38: 转股中 | R38: 4.23年 | S38: 2.23年 | T38: 4.8 | U38: 3.3 | V38: 6.9999999999999993e-003 | W38: 0.222 | X38: 0.184 | Y38: 22 | Z38: 1.47 | AA38: 5.1900000000000002e-002 | AB38: 4.41e-002 | AC38: 3.6799999999999999e-002 | AD38: 3.3399999999999999e-002 | AE38: 89.78 | AF38: 91.17 | AG38: 0.42 | AH38: AA- | AI38: 6.3399999999999998e-002 | AJ38: =H38+100*O38 -> 110.233 | AK38: 107.7 | AL38: 18 | AM38: 16.6 | AN38: 13 | AO38: -3.4000000000000002e-002 | AP38: 61 | AQ38: 亚泰转债!
A39: 253 | B39: 123023 | C39: 迪森转债! | D39: 300335 | E39: 迪森股份 | F39: 能源电力 | G39: 电力供应 | H39: 93.6 | I39: -8.3999999999999995e-003 | J39: 3.7000000000000002e-003 | K39: 4.92 | L39: -2.5699999999999997e-002 | M39: 114.9 | N39: 7.04 | O39: 0.33899999999999997 | P39: 69.89 | Q39: 转股中 | R39: 4年57天 | S39: 3年57天 | T39: 5.29 | U39: 5.2 | V39: 1.e-002 | W39: 0.28800000000000003 | X39: 0.20100000000000001 | Y39: 18 | Z39: 1.32 | AA39: 5.1699999999999996e-002 | AB39: 4.4800000000000006e-002 | AC39: 3.6499999999999998e-002 | AD39: 3.32e-002 | AE39: 91.89 | AF39: 97.05 | AG39: 0.19 | AH39: AA | AI39: 4.24e-002 | AJ39: =H39+100*O39 -> 127.5 | AK39: 117.3 | AL39: 58 | AM39: 20.3 | AN39: 27 | AO39: -8.4000000000000005e-002 | AP39: 58 | AQ39: 迪森转债!
A40: 73 | B40: 128127 | C40: 文科转债! | D40: 2775. | E40: 文科园林 | F40: 城市公用 | G40: 生态环境 | H40: 92.298 | I40: -7.0999999999999995e-003 | J40: -7.000000000000001e-004 | K40: 4.53 | L40: -1.52e-002 | M40: 121.3 | N40: 5.37 | O40: 9.4e-002 | P40: 84.36 | Q40: 38天 | R40: 5.58年 | S40: 3.58年 | T40: 9.5 | U40: 5.4 | V40: 6.0000000000000001e-003 | W40: 0.40899999999999997 | X40: 0.34499999999999997 | Y40: 23 | Z40: 0.88 | AA40: 5.1399999999999994e-002 | AB40: 4.4299999999999999e-002 | AC40: 3.3399999999999999e-002 | AD40: 3.1e-002 | AE40: 82.55 | AF40: 86.02 | AG40: 0.51 | AH40: AA- | AI40: 6.5099999999999991e-002 | AJ40: =H40+100*O40 -> 101.69800000000001 | AK40: 100.2 | AL40: 4 | AM40: 14.2 | AN40: 11 | AO40: -3.4000000000000002e-002 | AP40: 29 | AQ40: 文科转债!
A41: 29 | B41: 113609 | C41: 永安转债! | D41: 603776 | E41: 永安行 | F41: 城市公用 | G41: 其他 | H41: 90.45 | I41: -1.55e-002 | J41: 6.8999999999999999e-003 | K41: 15.92 | L41: -1.9099999999999999e-002 | M41: 120.5 | N41: 20.34 | O41: 0.156 | P41: 78.27 | Q41: 4月9天 | R41: 5.84年 | S41: 3.84年 | T41: 8.86 | U41: 17 | V41: 2.1000000000000001e-002 | W41: 0.29699999999999999 | X41: 0.23199999999999998 | Y41: 30 | Z41: 1.07 | AA41: 5.1299999999999998e-002 | AB41: 4.4800000000000006e-002 | AC41: 3.5400000000000001e-002 | AD41: 3.3399999999999999e-002 | AE41: 80.85 | AF41: 83.96 | AG41: 0.45 | AH41: AA- | AI41: 6.5099999999999991e-002 | AJ41: =H41+100*O41 -> 106.05 | AK41: 102.6 | AL41: 7 | AM41: 18.7 | AN41: 22 | AO41: -1.3999999999999999e-002 | AP41: 6 | AQ41: 永安转债!
A42: 162 | B42: 128100 | C42: 搜特转债! | D42: 2503. | E42: 搜于特 | F42: 服装纺织 | G42: 服装行业 | H42: 91.413 | I42: -7.1999999999999998e-003 | J42: -2.9999999999999997e-004 | K42: 2.36 | L42: -2.07e-002 | M42: 117.3 | N42: 2.9 | O42: 0.12300000000000001 | P42: 81.38 | Q42: 转股中 | R42: 5年49天 | S42: 3年49天 | T42: 8 | U42: 80 | V42: 0.109 | W42: 0.11 | X42: 8.900000000000001e-002 | Y42: 73 | Z42: 1.32 | AA42: 5.0900000000000001e-002 | AB42: 4.4400000000000002e-002 | AC42: 3.9699999999999999e-002 | AD42: 3.73e-002 | AE42: 90.16 | AF42: 94.43 | AG42: 0.36 | AH42: AA | AI42: 4.41e-002 | AJ42: =H42+100*O42 -> 103.71299999999999 | AK42: 101.4 | AL42: 5 | AM42: 7 | AN42: 4 | AO42: 6.0000000000000001e-003 | AP42: 48 | AQ42: 搜特转债!
A43: 54 | B43: 123069 | C43: 金诺转债! | D43: 300505 | E43: 川金诺 | F43: 化工 | G43: 农化 | H43: 95.545 | I43: -1.2500000000000001e-002 | J43: -3.4000000000000002e-003 | K43: 15.38 | L43: -3.7499999999999999e-002 | M43: 126 | N43: 19.15 | O43: 0.19 | P43: 80.31 | Q43: 3月0天 | R43: 5.73年 | S43: 3.73年 | T43: 3.68 | U43: 5 | V43: 1.3999999999999999e-002 | W43: 0.183 | X43: 0.14699999999999999 | Y43: 20 | Z43: 2.09 | AA43: 5.04e-002 | AB43: 4.24e-002 | AC43: 2.2000000000000002e-002 | AD43: 1.9900000000000001e-002 | AE43: 81.46 | AF43: 88.38 | AG43: 0.42 | AH43: AA- | AI43: 6.5099999999999991e-002 | AJ43: =H43+100*O43 -> 114.545 | AK43: 110.8 | AL43: 27 | AM43: 22.4 | AN43: 45 | AO43: -2.1000000000000001e-002 | AP43: 12 | AQ43: 金诺转债!
A44: 11 | B44: 123088 | C44: 威唐转债! | D44: 300707 | E44: 威唐工业 | F44: 汽车 | G44: 零部件制 | H44: 91.58 | I44: -8.8999999999999999e-003 | J44: 2.9999999999999997e-004 | K44: 14.87 | L44: -2.0400000000000001e-002 | M44: 121.6 | N44: 20.75 | O44: 0.27800000000000002 | P44: 71.66 | Q44: 5月0天 | R44: 5.90年 | S44: 3.90年 | T44: 3.01 | U44: 8.9 | V44: 3.2000000000000001e-002 | W44: 0.129 | X44: 9.1999999999999998e-002 | Y44: 23 | Z44: 3.44 | AA44: 5.04e-002 | AB44: 4.36e-002 | AC44: 3.3599999999999998e-002 | AD44: 3.1300000000000001e-002 | AE44: 77.91 | AF44: 79.69 | AG44: 0.42 | AH44: A+ | AI44: 7.6100000000000001e-002 | AJ44: =H44+100*O44 -> 119.38 | AK44: 111.5 | AL44: 34 | AM44: 31.8 | AN44: 121 | AO44: -7.2999999999999995e-002 | AP44: 4 | AQ44: 威唐转债!
A45: 217 | B45: 128074 | C45: 游族转债!! | D45: 2174. | E45: 游族网络 | F45: 通信互联 | G45: 互联网 | H45: 96.1 | I45: -2.0199999999999999e-002 | J45: 6.7000000000000002e-003 | K45: 12.43 | L45: -5.2600000000000001e-002 | M45: 119.9 | N45: 16.97 | O45: 0.312 | P45: 73.25 | Q45: 转股中 | R45: 4.67年 | S45: 2.67年 | T45: 6.83 | U45: 12 | V45: 1.9e-002 | W45: 5.9999999999999998e-002 | X45: 4.4000000000000004e-002 | Y45: 114 | Z45: 2.01 | AA45: 4.9500000000000002e-002 | AB45: 4.1599999999999998e-002 | AC45: 2.64e-002 | AD45: 2.4e-002 | AE45: 92.02 | AF45: 97.39 | AG45: 0.26 | AH45: AA | AI45: 4.24e-002 | AJ45: =H45+100*O45 -> 127.3 | AK45: 119 | AL45: 73 | AM45: 21.6 | AN45: 38 | AO45: -5.9999999999999998e-002 | AP45: 24 | AQ45: 游族转债!!
A46: 33 | B46: 128138 | C46: 侨银转债! | D46: 2973. | E46: 侨银股份 | F46: 城市公用 | G46: 城市公用 | H46: 103.699 | I46: -5.9999999999999995e-004 | J46: 1.2999999999999999e-003 | K46: 21.58 | L46: 1.9e-003 | M46: 136.5 | N46: 25.43 | O46: 0.222 | P46: 84.86 | Q46: 4月2天 | R46: 5.82年 | S46: 3.82年 | T46: 4.2 | U46: 4.3 | V46: 1.e-002 | W46: 4.8000000000000001e-002 | X46: 4.0000000000000001e-002 | Y46: 88 | Z46: 6.61 | AA46: 4.9299999999999997e-002 | AB46: 3.9100000000000003e-002 | AC46: 1.7000000000000001e-003 | AD46: -4.0000000000000002e-004 | AE46: 81.41 | AF46: 95.22 | AG46: 0.4 | AH46: AA- | AI46: 6.5099999999999991e-002 | AJ46: =H46+100*O46 -> 125.899 | AK46: 122.5 | AL46: 102 | AM46: 27.3 | AN46: 87 | AO46: 3.1e-002 | AP46: 4 | AQ46: 侨银转债!
A47: 141 | B47: 113573 | C47: 纵横转债! | D47: 603602 | E47: 纵横通信 | F47: 通信互联 | G47: 通信设备 | H47: 98.39 | I47: 1.1000000000000001e-003 | J47: -8.199999999999999e-003 | K47: 11.23 | L47: -4.1799999999999997e-002 | M47: 124.7 | N47: 18.81 | O47: 0.64800000000000002 | P47: 59.7 | Q47: 转股中 | R47: 5.23年 | S47: 3.23年 | T47: 2.7 | U47: 10 | V47: 3.7000000000000005e-002 | W47: 0.11800000000000001 | X47: 7.0000000000000007e-002 | Y47: 23 | Z47: 3.39 | AA47: 4.7500000000000001e-002 | AB47: 3.9100000000000003e-002 | AC47: 1.8500000000000003e-002 | AD47: 1.5700000000000002e-002 | AE47: 81.81 | AF47: 85.78 | AG47: 0.17 | AH47: A+ | AI47: 7.6100000000000001e-002 | AJ47: =H47+100*O47 -> 163.19 | AK47: 137.1 | AL47: 205 | AM47: 51.3 | AN47: 222 | AO47: -4.9000000000000002e-002 | AP47: 21 | AQ47: 纵横转债!
A48: 86 | B48: 113596 | C48: 城地转债! | D48: 603887 | E48: 城地香江 | F48: 通信互联 | G48: 通信设备 | H48: 88.47 | I48: -1.3500000000000002e-002 | J48: 1.03e-002 | K48: 15.74 | L48: -2.7200000000000002e-002 | M48: 113.5 | N48: 29.21 | O48: 0.64200000000000002 | P48: 53.89 | Q48: 13天 | R48: 5.51年 | S48: 3.51年 | T48: 12 | U48: 2.7 | V48: 3.0000000000000001e-003 | W48: 0.20300000000000001 | X48: 0.109 | Y48: 59 | Z48: 1.63 | AA48: 4.7199999999999999e-002 | AB48: 4.24e-002 | AC48: 4.4999999999999998e-002 | AD48: 4.2699999999999995e-002 | AE48: 82.53 | AF48: 80.76 | AG48: 0.12 | AH48: AA- | AI48: 6.5099999999999991e-002 | AJ48: =H48+100*O48 -> 152.67000000000002 | AK48: 123.1 | AL48: 107 | AM48: 40.5 | AN48: 177 | AO48: -5.4000000000000006e-002 | AP48: 14 | AQ48: 城地转债!
A49: 286 | B49: 128042 | C49: 凯中转债! | D49: 2823. | E49: 凯中精密 | F49: 能源电力 | G49: 电力设备 | H49: 99.211 | I49: -8.9999999999999998e-004 | J49: -1.1999999999999999e-003 | K49: 9.83 | L49: -1.11e-002 | M49: 116.3 | N49: 12.96 | O49: 0.308 | P49: 75.85 | Q49: 转股中 | R49: 3.52年 | S49: 1.52年 | T49: 4.16 | U49: 1.6 | V49: 4.0000000000000001e-003 | W49: 0.14699999999999999 | X49: 0.11199999999999999 | Y49: 28 | Z49: 2.09 | AA49: 4.7100000000000003e-002 | AB49: 3.8399999999999997e-002 | AC49: 2.1499999999999998e-002 | AD49: 1.8100000000000002e-002 | AE49: 95.91 | AF49: 100.78 | AG49: 0.19 | AH49: AA | AI49: 4.24e-002 | AJ49: =H49+100*O49 -> 130.011 | AK49: 122.6 | AL49: 103 | AM49: 21.8 | AN49: 40 | AO49: -2.9999999999999999e-002 | AP49: 29 | AQ49: 凯中转债!
A50: 271 | B50: 113524 | C50: 奇精转债! | D50: 603677 | E50: 奇精机械 | F50: 家电 | G50: 零部件制 | H50: 98.51 | I50: -1.1200000000000002e-002 | J50: 9.0000000000000011e-003 | K50: 11.13 | L50: -8.8999999999999999e-003 | M50: 117.3 | N50: 14.08 | O50: 0.24600000000000002 | P50: 79.05 | Q50: 转股中 | R50: 3.89年 | S50: 1.89年 | T50: 3.3 | U50: 2.3 | V50: 6.9999999999999993e-003 | W50: 0.154 | X50: 0.122 | Y50: 21 | Z50: 2.24 | AA50: 4.6699999999999998e-002 | AB50: 3.8399999999999997e-002 | AC50: 2.1099999999999997e-002 | AD50: 1.83e-002 | AE50: 94.43 | AF50: 100.07 | AG50: 0.26 | AH50: AA | AI50: 4.24e-002 | AJ50: =H50+100*O50 -> 123.11000000000001 | AK50: 118 | AL50: 61 | AM50: 17.9 | AN50: 20 | AO50: 1.2e-002 | AP50: 48 | AQ50: 奇精转债!
A51: 222 | B51: 128072 | C51: 翔鹭转债! | D51: 2842. | E51: 翔鹭钨业 | F51: 有色金属 | G51: 小金属 | H51: 93.902 | I51: -1.0800000000000001e-002 | J51: 5.6000000000000008e-003 | K51: 9.21 | L51: -3.2599999999999997e-002 | M51: 115.1 | N51: 15.34 | O51: 0.56399999999999995 | P51: 60.04 | Q51: 转股中 | R51: 4.58年 | S51: 2.58年 | T51: 3.02 | U51: 2.8 | V51: 1.e-002 | W51: 0.12 | X51: 7.2000000000000008e-002 | Y51: 25 | Z51: 2.77 | AA51: 4.6500000000000007e-002 | AB51: 4.0099999999999997e-002 | AC51: 3.6200000000000003e-002 | AD51: 3.3599999999999998e-002 | AE51: 87.54 | AF51: 87.39 | AG51: 0.16 | AH51: AA- | AI51: 6.3399999999999998e-002 | AJ51: =H51+100*O51 -> 150.30199999999999 | AK51: 127.8 | AL51: 145 | AM51: 40.2 | AN51: 174 | AO51: -4.2000000000000003e-002 | AP51: 29 | AQ51: 翔鹭转债!
A52: 172 | B52: 113566 | C52: 翔港转债! | D52: 603499 | E52: 翔港科技 | F52: 造纸包装 | G52: 包装材料 | H52: 99.66 | I52: -9.4299999999999995e-002 | J52: 4.5499999999999999e-002 | K52: 8.96 | L52: -0.10000000000000001 | M52: 124.5 | N52: 10.77 | O52: 0.19800000000000001 | P52: 83.19 | Q52: 转股中 | R52: 5年37天 | S52: 3年37天 | T52: 1.61 | U52: 230 | V52: 1.3799999999999999 | W52: 8.900000000000001e-002 | X52: 7.400000000000001e-002 | Y52: 18 | Z52: 3.15 | AA52: 4.58e-002 | AB52: 3.7200000000000004e-002 | AC52: 1.5300000000000001e-002 | AD52: 1.2500000000000001e-002 | AE52: 82.67 | AF52: 86.48 | AG52: 0.49 | AH52: A+ | AI52: 7.6100000000000001e-002 | AJ52: =H52+100*O52 -> 119.45999999999999 | AK52: 116.1 | AL52: 54 | AM52: 29.6 | AN52: 101 | AO52: 0.126 | AP52: 28 | AQ52: 翔港转债!
A53: 124 | B53: 123054 | C53: 思特转债! | D53: 300608 | E53: 思特奇 | F53: 通信互联 | G53: 通信设备 | H53: 96.6 | I53: -1.43e-002 | J53: 3.9000000000000003e-003 | K53: 11.64 | L53: -3.4000000000000002e-002 | M53: 121.7 | N53: 16.49 | O53: 0.36799999999999999 | P53: 70.59 | Q53: 转股中 | R53: 5.38年 | S53: 3.38年 | T53: 2.71 | U53: 1.4 | V53: 5.0000000000000001e-003 | W53: 0.14800000000000002 | X53: 0.10400000000000001 | Y53: 18 | Z53: 2.42 | AA53: 4.4999999999999998e-002 | AB53: 3.7599999999999995e-002 | AC53: 2.3e-002 | AD53: 2.0400000000000001e-002 | AE53: 83.89 | AF53: 87.4 | AG53: 0.31 | AH53: AA- | AI53: 6.5099999999999991e-002 | AJ53: =H53+100*O53 -> 133.39999999999998 | AK53: 122.6 | AL53: 104 | AM53: 35.2 | AN53: 143 | AO53: -7.8e-002 | AP53: 19 | AQ53: 思特转债!
A54: 63 | B54: 128132 | C54: 交建转债! | D54: 2941. | E54: 新疆交建 | F54: 建筑 | G54: 建筑工程 | H54: 92.008 | I54: -4.7999999999999996e-003 | J54: 2.3e-003 | K54: 10.81 | L54: -2.2599999999999999e-002 | M54: 117.3 | N54: 18.57 | O54: 0.58099999999999996 | P54: 58.21 | Q54: 59天 | R54: 5.65年 | S54: 3.65年 | T54: 8.5 | U54: 4.3 | V54: 5.0000000000000001e-003 | W54: 0.122 | X54: 7.0999999999999994e-002 | Y54: 70 | Z54: 2.88 | AA54: 4.4800000000000006e-002 | AB54: 3.9e-002 | AC54: 3.2400000000000005e-002 | AD54: 3.04e-002 | AE54: 88.19 | AF54: 92.36 | AG54: 0.11 | AH54: AA | AI54: 4.41e-002 | AJ54: =H54+100*O54 -> 150.108 | AK54: 125.8 | AL54: 132 | AM54: 33.4 | AN54: 136 | AO54: -1.9e-002 | AP54: 13 | AQ54: 交建转债!
A55: 140 | B55: 113578 | C55: 全筑转债! | D55: 603030 | E55: 全筑股份 | F55: 建筑 | G55: 装饰工程 | H55: 94.65 | I55: -1.37e-002 | J55: 6.6e-003 | K55: 4.38 | L55: -2.0099999999999996e-002 | M55: 118.3 | N55: 5.43 | O55: 0.17300000000000001 | P55: 80.66 | Q55: 转股中 | R55: 5.24年 | S55: 3.24年 | T55: 3.84 | U55: 4.6 | V55: 1.3000000000000001e-002 | W55: 0.16300000000000001 | X55: 0.13100000000000001 | Y55: 24 | Z55: 1.06 | AA55: 4.4400000000000002e-002 | AB55: 3.7900000000000003e-002 | AC55: 2.7799999999999998e-002 | AD55: 2.5499999999999998e-002 | AE55: 89.75 | AF55: 94.79 | AG55: 0.35 | AH55: AA | AI55: 4.41e-002 | AJ55: =H55+100*O55 -> 111.95 | AK55: 108.6 | AL55: 21 | AM55: 13.8 | AN55: 9 | AO55: -5.5999999999999994e-002 | AP55: 15 | AQ55: 全筑转债!
A56: 270 | B56: 113525 | C56: 台华转债! | D56: 603055 | E56: 台华新材 | F56: 服装纺织 | G56: 纺织行业 | H56: 97.03 | I56: -1.2199999999999999e-002 | J56: 1.0500000000000001e-002 | K56: 5.43 | L56: -1.09e-002 | M56: 114.3 | N56: 7.83 | O56: 0.39899999999999997 | P56: 69.35 | Q56: 转股中 | R56: 3.90年 | S56: 1.90年 | T56: 4.69 | U56: 1 | V56: 2.e-003 | W56: 0.10400000000000001 | X56: 7.2000000000000008e-002 | Y56: 45 | Z56: 1.59 | AA56: 4.3700000000000003e-002 | AB56: 3.6699999999999997e-002 | AC56: 2.8500000000000001e-002 | AD56: 2.58e-002 | AE56: 94.4 | AF56: 97.48 | AG56: 0.16 | AH56: AA | AI56: 4.24e-002 | AJ56: =H56+100*O56 -> 136.93000000000001 | AK56: 124.7 | AL56: 124 | AM56: 27.2 | AN56: 85 | AO56: -4.7e-002 | AP56: 22 | AQ56: 台华转债!
A57: 309 | B57: 128033 | C57: 迪龙转债! | D57: 2658. | E57: 雪迪龙 | F57: 城市公用 | G57: 三废处理 | H57: 96.19 | I57: -3.3e-003 | J57: 2.2000000000000001e-003 | K57: 5.57 | L57: -2.1099999999999997e-002 | M57: 108.8 | N57: 8.83 | O57: 0.52500000000000002 | P57: 63.08 | Q57: 转股中 | R57: 2.93年 | S57: 0.93年 | T57: 5.2 | U57: 1.5 | V57: 3.0000000000000001e-003 | W57: 0.154 | X57: 9.6999999999999989e-002 | Y57: 34 | Z57: 1.67 | AA57: 4.3499999999999997e-002 | AB57: 3.7599999999999995e-002 | AC57: 5.0799999999999998e-002 | AD57: 4.7899999999999998e-002 | AE57: 97.23 | AF57: 96.98 | AG57: 0.05 | AH57: AA | AI57: 4.0599999999999997e-002 | AJ57: =H57+100*O57 -> 148.69 | AK57: 129.3 | AL57: 162 | AM57: 32.1 | AN57: 123 | AO57: -4.0000000000000001e-002 | AP57: 37 | AQ57: 迪龙转债!
A58: 260 | B58: 110052 | C58: 贵广转债! | D58: 600996 | E58: 贵广网络 | F58: 传媒娱乐 | G58: 影视娱乐 | H58: 100.05 | I58: -1.e-004 | J58: -1.e-003 | K58: 5.09 | L58: -1.3600000000000001e-002 | M58: 118.5 | N58: 7.94 | O58: 0.56100000000000005 | P58: 64.11 | Q58: 转股中 | R58: 4年42天 | S58: 2年42天 | T58: 15.3 | U58: 5.1 | V58: 3.0000000000000001e-003 | W58: 0.28499999999999998 | X58: 0.183 | Y58: 54 | Z58: 1.18 | AA58: 4.3099999999999999e-002 | AB58: 3.4700000000000002e-002 | AC58: 1.66e-002 | AD58: 1.3300000000000001e-002 | AE58: 94.98 | AF58: 101.08 | AG58: 0.08 | AH58: AA+ | AI58: 4.0399999999999998e-002 | AJ58: =H58+100*O58 -> 156.15000000000001 | AK58: 136 | AL58: 198 | AM58: 34.9 | AN58: 141 | AO58: -3.1e-002 | AP58: 19 | AQ58: 贵广转债!
A59: 316 | B59: 123004 | C59: 铁汉转债! | D59: 300197 | E59: 铁汉生态 | F59: 城市公用 | G59: 生态环境 | H59: 96.515 | I59: 2.9999999999999997e-004 | J59: 2.5000000000000001e-003 | K59: 3.03 | L59: 1.6799999999999999e-002 | M59: 108.8 | N59: 3.98 | O59: 0.26800000000000002 | P59: 76.13 | Q59: 转股中 | R59: 2.90年 | S59: 0.90年 | T59: 8.03 | U59: 8.6 | V59: 1.1000000000000001e-002 | W59: 0.113 | X59: 8.5999999999999993e-002 | Y59: 71 | Z59: 1.38 | AA59: 4.2699999999999995e-002 | AB59: 3.6699999999999997e-002 | AC59: 4.87e-002 | AD59: 4.5700000000000005e-002 | AE59: 97.32 | AF59: 97.08 | AG59: 0.16 | AH59: AA | AI59: 4.0599999999999997e-002 | AJ59: =H59+100*O59 -> 123.315 | AK59: 116.9 | AL59: 56 | AM59: 19.6 | AN59: 25 | AO59: 4.0000000000000001e-003 | AP59: 44 | AQ59: 铁汉转债!
A60: 215 | B60: 128076 | C60: 金轮转债! | D60: 2722. | E60: 金轮股份 | F60: 机械装备 | G60: 专用设备 | H60: 94.857 | I60: -4.7999999999999996e-003 | J60: -1.8e-003 | K60: 10.57 | L60: -2.1299999999999999e-002 | M60: 114.9 | N60: 14.76 | O60: 0.32500000000000001 | P60: 71.61 | Q60: 转股中 | R60: 4.73年 | S60: 2.73年 | T60: 2.14 | U60: 1.6 | V60: 8.0000000000000002e-003 | W60: 0.115 | X60: 8.3000000000000004e-002 | Y60: 19 | Z60: 1.01 | AA60: 4.2199999999999994e-002 | AB60: 3.6200000000000003e-002 | AC60: 3.0499999999999999e-002 | AD60: 2.81e-002 | AE60: 86.7 | AF60: 86.43 | AG60: 0.31 | AH60: AA- | AI60: 6.3399999999999998e-002 | AJ60: =H60+100*O60 -> 127.357 | AK60: 118.1 | AL60: 63 | AM60: 31.4 | AN60: 114 | AO60: -6.0999999999999999e-002 | AP60: 44 | AQ60: 金轮转债!
A61: 5 | B61: 123089 | C61: 九洲转2 | D61: 300040 | E61: 九洲集团 | F61: 能源电力 | G61: 电力设备 | H61: 95.404 | I61: -1.1000000000000001e-003 | J61: 1.3300000000000001e-002 | K61: 6.91 | L61: 2.2200000000000001e-002 | M61: 121 | N61: 8 | O61: 0.105 | P61: 86.38 | Q61: 5月4天 | R61: 5.91年 | S61: 3.91年 | T61: 5 | U61: 11 | V61: 2.4e-002 | W61: 0.19 | X61: 0.16399999999999998 | Y61: 26 | Z61: 1.2 | AA61: 4.1799999999999997e-002 | AB61: 3.5400000000000001e-002 | AC61: 2.1400000000000002e-002 | AD61: 1.9400000000000001e-002 | AE61: 80.54 | AF61: 83.94 | AG61: 0.55 | AH61: AA- | AI61: 6.5099999999999991e-002 | AJ61: =H61+100*O61 -> 105.904 | AK61: 104.4 | AL61: 8 | AM61: 20.5 | AN61: 28 | AO61: -4.8000000000000001e-002 | AP61: 3 | AQ61: 九洲转2
A62: 199 | B62: 128082 | C62: 华锋转债! | D62: 2806. | E62: 华锋股份 | F62: 电子 | G62: 元器件制 | H62: 99.987 | I62: -9.1999999999999998e-003 | J62: -7.000000000000001e-004 | K62: 10.4 | L62: -1.7899999999999999e-002 | M62: 121.4 | N62: 11.71 | O62: 0.126 | P62: 88.81 | Q62: 转股中 | R62: 4.87年 | S62: 2.87年 | T62: 3.45 | U62: 2.4 | V62: 6.9999999999999993e-003 | W62: 0.188 | X62: 0.16699999999999998 | Y62: 18 | Z62: 1.47 | AA62: 4.1700000000000001e-002 | AB62: 3.3700000000000001e-002 | AC62: 1.4800000000000001e-002 | AD62: 1.18e-002 | AE62: 84.28 | AF62: 86.35 | AG62: 0.55 | AH62: A+ | AI62: 7.4400000000000008e-002 | AJ62: =H62+100*O62 -> 112.58699999999999 | AK62: 111.2 | AL62: 31 | AM62: 24.8 | AN62: 62 | AO62: -2.1000000000000001e-002 | AP62: 59 | AQ62: 华锋转债!
A63: 27 | B63: 128139 | C63: 祥鑫转债 | D63: 2965. | E63: 祥鑫科技 | F63: 汽车 | G63: 零部件制 | H63: 95.71 | I63: -2.0400000000000001e-002 | J63: -6.6e-003 | K63: 27.64 | L63: -6.9400000000000003e-002 | M63: 121 | N63: 37.28 | O63: 0.29100000000000004 | P63: 74.14 | Q63: 4月16天 | R63: 5.86年 | S63: 3.86年 | T63: 6.47 | U63: 6.5 | V63: 1.e-002 | W63: 0.155 | X63: 0.115 | Y63: 42 | Z63: 2.46 | AA63: 4.1599999999999998e-002 | AB63: 3.5099999999999999e-002 | AC63: 2.0799999999999999e-002 | AD63: 1.89e-002 | AE63: 80.82 | AF63: 84.23 | AG63: 0.39 | AH63: AA- | AI63: 6.5099999999999991e-002 | AJ63: =H63+100*O63 -> 124.81 | AK63: 117.3 | AL63: 57 | AM63: 33 | AN63: 131 | AO63: -0.113 | AP63: 5 | AQ63: 祥鑫转债
A64: 239 | B64: 127013 | C64: 创维转债! | D64: 810. | E64: 创维数字 | F64: 电子 | G64: 电子产品 | H64: 99.683 | I64: -1.6e-002 | J64: 1.0800000000000001e-002 | K64: 7.82 | L64: -3.8100000000000002e-002 | M64: 117.9 | N64: 11.39 | O64: 0.45200000000000001 | P64: 68.66 | Q64: 转股中 | R64: 4.23年 | S64: 2.23年 | T64: 9.78 | U64: 6.6 | V64: 6.9999999999999993e-003 | W64: 0.11800000000000001 | X64: 8.1000000000000003e-002 | Y64: 83 | Z64: 2.14 | AA64: 4.1399999999999999e-002 | AB64: 3.3500000000000002e-002 | AC64: 1.5600000000000001e-002 | AD64: 1.2699999999999999e-002 | AE64: 93.72 | AF64: 99.28 | AG64: 0.14 | AH64: AA | AI64: 4.24e-002 | AJ64: =H64+100*O64 -> 144.88300000000001 | AK64: 130.7 | AL64: 173 | AM64: 31.4 | AN64: 115 | AO64: -1.4999999999999999e-002 | AP64: 24 | AQ64: 创维转债!
A65: 148 | B65: 113576 | C65: 起步转债!! | D65: 603557 | E65: 起步股份 | F65: 服装纺织 | G65: 鞋服行业 | H65: 99.12 | I65: -1.72e-002 | J65: 6.1999999999999998e-003 | K65: 7.77 | L65: -3.2400000000000005e-002 | M65: 121.8 | N65: 10.55 | O65: 0.34600000000000003 | P65: 73.65 | Q65: 转股中 | R65: 5.21年 | S65: 3.21年 | T65: 2.66 | U65: 19 | V65: 7.2000000000000008e-002 | W65: 6.9000000000000006e-002 | X65: 5.0999999999999997e-002 | Y65: 39 | Z65: 2.29 | AA65: 4.1399999999999999e-002 | AB65: 3.3799999999999997e-002 | AC65: 1.66e-002 | AD65: 1.38e-002 | AE65: 84.87 | AF65: 88.42 | AG65: 0.34 | AH65: AA- | AI65: 6.5099999999999991e-002 | AJ65: =H65+100*O65 -> 133.72 | AK65: 124.6 | AL65: 122 | AM65: 36.2 | AN65: 149 | AO65: -8.0000000000000002e-002 | AP65: 28 | AQ65: 起步转债!!
A66: 14 | B66: 123084 | C66: 高澜转债! | D66: 300499 | E66: 高澜股份 | F66: 能源电力 | G66: 电力设备 | H66: 96.687 | I66: -7.4000000000000003e-003 | J66: 8.0000000000000002e-003 | K66: 9.43 | L66: 1.1000000000000001e-003 | M66: 121.9 | N66: 11.36 | O66: 0.16500000000000001 | P66: 83.01 | Q66: 4月25天 | R66: 5.88年 | S66: 3.88年 | T66: 2.8 | U66: 11 | V66: 4.0999999999999995e-002 | W66: 0.107 | X66: 8.900000000000001e-002 | Y66: 26 | Z66: 3.36 | AA66: 4.1100000000000005e-002 | AB66: 3.44e-002 | AC66: 2.0400000000000001e-002 | AD66: 1.8000000000000002e-002 | AE66: 78.16 | AF66: 79.99 | AG66: 0.57 | AH66: A+ | AI66: 7.6100000000000001e-002 | AJ66: =H66+100*O66 -> 113.187 | AK66: 110.4 | AL66: 25 | AM66: 30.4 | AN66: 108 | AO66: -2.8999999999999998e-002 | AP66: 3 | AQ66: 高澜转债!
A67: 32 | B67: 123076 | C67: 强力转债! | D67: 300429 | E67: 强力新材 | F67: 化工 | G67: 化工 | H67: 94.23 | I67: -3.7200000000000004e-002 | J67: 1.5900000000000001e-002 | K67: 12.29 | L67: -7.8700000000000006e-002 | M67: 118.5 | N67: 18.98 | O67: 0.45500000000000002 | P67: 64.75 | Q67: 4月3天 | R67: 5.82年 | S67: 3.82年 | T67: 8.5 | U67: 12 | V67: 1.3999999999999999e-002 | W67: 0.13400000000000001 | X67: 8.6999999999999994e-002 | Y67: 63 | Z67: 3.66 | AA67: 4.0899999999999999e-002 | AB67: 3.5000000000000003e-002 | AC67: 2.4799999999999999e-002 | AD67: 2.29e-002 | AE67: 80.92 | AF67: 82.65 | AG67: 0.27 | AH67: AA- | AI67: 6.5099999999999991e-002 | AJ67: =H67+100*O67 -> 139.73000000000002 | AK67: 123.7 | AL67: 114 | AM67: 41.1 | AN67: 183 | AO67: -0.10000000000000001 | AP67: 9 | AQ67: 强力转债!
A68: 332 | B68: 128014 | C68: 永东转债! | D68: 2753. | E68: 永东股份 | F68: 化工 | G68: 化工 | H68: 101.972 | I68: -2.0000000000000001e-004 | J68: 4.0000000000000002e-004 | K68: 8.75 | L68: 9.1999999999999998e-003 | M68: 111.3 | N68: 12.6 | O68: 0.46799999999999997 | P68: 69.44 | Q68: 转股中 | R68: 2.23年 | S68: 0.23年 | T68: 3.37 | U68: 1.9 | V68: 6.0000000000000001e-003 | W68: 0.10300000000000001 | X68: 7.0999999999999994e-002 | Y68: 33 | Z68: 1.86 | AA68: 4.0800000000000003e-002 | AB68: 3.1e-002 | AC68: -4.1999999999999997e-003 | AD68: -1.3100000000000001e-002 | AE68: 99.41 | AF68: 97.66 | AG68: 0.02 | AH68: AA- | AI68: 6.1600000000000002e-002 | AJ68: =H68+100*O68 -> 148.77199999999999 | AK68: 134.5 | AL68: 191 | AM68: 35.1 | AN68: 142 | AO68: 3.9e-002 | AP68: 39 | AQ68: 永东转债!
A69: 242 | B69: 113534 | C69: 鼎胜转债! | D69: 603876 | E69: 鼎胜新材 | F69: 有色金属 | G69: 小金属 | H69: 97.52 | I69: -1.2800000000000001e-002 | J69: 8.3999999999999995e-003 | K69: 13.2 | L69: -1.1200000000000002e-002 | M69: 114.9 | N69: 15.18 | O69: 0.121 | P69: 86.96 | Q69: 转股中 | R69: 4.21年 | S69: 2.21年 | T69: 12 | U69: 6.9 | V69: 6.0000000000000001e-003 | W69: 0.20899999999999999 | X69: 0.182 | Y69: 57 | Z69: 1.59 | AA69: 4.0599999999999997e-002 | AB69: 3.3799999999999997e-002 | AC69: 2.52e-002 | AD69: 2.23e-002 | AE69: 93.78 | AF69: 96.83 | AG69: 0.39 | AH69: AA | AI69: 4.24e-002 | AJ69: =H69+100*O69 -> 109.61999999999999 | AK69: 108.1 | AL69: 20 | AM69: 11.3 | AN69: 6 | AO69: -5.9999999999999998e-002 | AP69: 32 | AQ69: 鼎胜转债!
A70: 98 | B70: 128120 | C70: 联诚转债! | D70: 2921. | E70: 联诚精密 | F70: 汽车 | G70: 零部件制 | H70: 95.709 | I70: -6.3e-003 | J70: 4.0000000000000001e-003 | K70: 19.08 | L70: -4.1999999999999997e-003 | M70: 118.4 | N70: 24.37 | O70: 0.222 | P70: 78.29 | Q70: 3.1天 | R70: 5.48年 | S70: 3.48年 | T70: 2.6 | U70: 2.3 | V70: 9.0000000000000011e-003 | W70: 0.16699999999999998 | X70: 0.13100000000000001 | Y70: 16 | Z70: 2.08 | AA70: 4.0500000000000001e-002 | AB70: 3.4300000000000004e-002 | AC70: 2.4900000000000002e-002 | AD70: 2.23e-002 | AE70: 77.66 | AF70: 76.14 | AG70: 0.54 | AH70: A | AI70: 8.6099999999999996e-002 | AJ70: =H70+100*O70 -> 117.90900000000001 | AK70: 113.1 | AL70: 39 | AM70: 35.5 | AN70: 147 | AO70: 6.9999999999999993e-003 | AP70: 18 | AQ70: 联诚转债!
A71: 30 | B71: 123077 | C71: 汉得转债! | D71: 300170 | E71: 汉得信息 | F71: 计算机及 | G71: 软件开发 | H71: 100.048 | I71: -8.0000000000000004e-004 | J71: -7.0999999999999995e-003 | K71: 7.43 | L71: -2.8799999999999999e-002 | M71: 125.5 | N71: 9.72 | O71: 0.309 | P71: 76.44 | Q71: 4月5天 | R71: 5.84年 | S71: 3.84年 | T71: 9.37 | U71: 6.3 | V71: 6.9999999999999993e-003 | W71: 0.14300000000000002 | X71: 0.109 | Y71: 66 | Z71: 2.07 | AA71: 4.0300000000000002e-002 | AB71: 3.27e-002 | AC71: 9.3999999999999986e-003 | AD71: 7.4999999999999997e-003 | AE71: 87.5 | AF71: 97.99 | AG71: 0.28 | AH71: AA | AI71: 4.41e-002 | AJ71: =H71+100*O71 -> 130.94800000000001 | AK71: 123.7 | AL71: 113 | AM71: 25.7 | AN71: 73 | AO71: -1.8000000000000002e-002 | AP71: 7 | AQ71: 汉得转债!
A72: 145 | B72: 110070 | C72: 凌钢转债! | D72: 600231 | E72: 凌钢股份 | F72: 钢铁 | G72: 炼钢 | H72: 96.34 | I72: -1.0500000000000001e-002 | J72: 5.0000000000000001e-004 | K72: 2.26 | L72: -2.5899999999999999e-002 | M72: 117.8 | N72: 2.75 | O72: 0.17199999999999999 | P72: 82.18 | Q72: 转股中 | R72: 5.22年 | S72: 3.22年 | T72: 3.96 | U72: 3.2 | V72: 8.0000000000000002e-003 | W72: 6.3e-002 | X72: 5.2000000000000005e-002 | Y72: 63 | Z72: 0.78 | AA72: 4.0199999999999993e-002 | AB72: 3.3799999999999997e-002 | AC72: 2.35e-002 | AD72: 2.1000000000000001e-002 | AE72: 90.12 | AF72: 94.51 | AG72: 0.38 | AH72: AA | AI72: 4.41e-002 | AJ72: =H72+100*O72 -> 113.54000000000001 | AK72: 110.5 | AL72: 26 | AM72: 16 | AN72: 12 | AO72: -7.0999999999999994e-002 | AP72: 18 | AQ72: 凌钢转债!
A73: 263 | B73: 128056 | C73: 今飞转债! | D73: 2863. | E73: 今飞凯达 | F73: 汽车 | G73: 零部件制 | H73: 103.55 | I73: -7.1999999999999998e-003 | J73: 6.5000000000000006e-003 | K73: 5.14 | L73: -1.9e-003 | M73: 121 | N73: 6.7 | O73: 0.34999999999999998 | P73: 76.72 | Q73: 转股中 | R73: 4年37天 | S73: 2年37天 | T73: 1.72 | U73: 4.2 | V73: 2.3e-002 | W73: 6.7000000000000004e-002 | X73: 5.0999999999999997e-002 | Y73: 26 | Z73: 1.74 | AA73: 3.9800000000000002e-002 | AB73: 3.04e-002 | AC73: 2.7000000000000001e-003 | AD73: -8.9999999999999998e-004 | AE73: 88.74 | AF73: 90.87 | AG73: 0.33 | AH73: A+ | AI73: 7.4400000000000008e-002 | AJ73: =H73+100*O73 -> 138.55000000000001 | AK73: 130.4 | AL73: 170 | AM73: 39.5 | AN73: 172 | AO73: -2.7000000000000003e-002 | AP73: 58 | AQ73: 今飞转债!
A74: 191 | B74: 110064 | C74: 建工转债! | D74: 600939 | E74: 重庆建工 | F74: 建筑 | G74: 建筑工程 | H74: 99.31 | I74: -8.8999999999999999e-003 | J74: 4.5000000000000005e-003 | K74: 3.53 | L74: -1.67e-002 | M74: 119.8 | N74: 4.57 | O74: 0.28600000000000003 | P74: 77.24 | Q74: 转股中 | R74: 4.91年 | S74: 2.91年 | T74: 16.6 | U74: 2.6 | V74: 2.e-003 | W74: 0.25900000000000001 | X74: 0.20000000000000001 | Y74: 64 | Z74: 0.93 | AA74: 3.9800000000000002e-002 | AB74: 3.2400000000000005e-002 | AC74: 1.5700000000000002e-002 | AD74: 1.3000000000000001e-002 | AE74: 92.29 | AF74: 99.05 | AG74: 0.26 | AH74: AA+ | AI74: 4.0399999999999998e-002 | AJ74: =H74+100*O74 -> 127.91 | AK74: 121.4 | AL74: 89 | AM74: 22.3 | AN74: 44 | AO74: -2.4e-002 | AP74: 48 | AQ74: 建工转债!
A75: 293 | B75: 127007 | C75: 湖广转债! | D75: 665. | E75: 湖北广电 | F75: 传媒娱乐 | G75: 影视娱乐 | H75: 98.6 | I75: -1.6899999999999998e-002 | J75: 1.0200000000000001e-002 | K75: 4.32 | L75: -2.92e-002 | M75: 112.3 | N75: 5.58 | O75: 0.27399999999999997 | P75: 77.42 | Q75: 转股中 | R75: 3.43年 | S75: 1.43年 | T75: 12.2 | U75: 3.8 | V75: 3.0000000000000001e-003 | W75: 0.28699999999999998 | X75: 0.222 | Y75: 42 | Z75: 0.65 | AA75: 3.95e-002 | AB75: 3.2500000000000001e-002 | AC75: 2.6699999999999998e-002 | AD75: 2.3099999999999999e-002 | AE75: 96.55 | AF75: 98.31 | AG75: 0.23 | AH75: AA+ | AI75: 4.0399999999999998e-002 | AJ75: =H75+100*O75 -> 125.99999999999999 | AK75: 119.8 | AL75: 77 | AM75: 21.5 | AN75: 36 | AO75: -2.8999999999999998e-002 | AP75: 19 | AQ75: 湖广转债!
A76: 220 | B76: 128073 | C76: 哈尔转债! | D76: 2615. | E76: 哈尔斯 | F76: 其他 | G76: 家居用品 | H76: 100.603 | I76: -9.1000000000000004e-003 | J76: 8.1000000000000013e-003 | K76: 4.1 | L76: -4.8999999999999998e-003 | M76: 115.3 | N76: 5.7 | O76: 0.39899999999999997 | P76: 71.93 | Q76: 转股中 | R76: 3.58年 | S76: 1.58年 | T76: 2.99 | U76: 11 | V76: 3.7000000000000005e-002 | W76: 0.17699999999999999 | X76: 0.127 | Y76: 17 | Z76: 2.11 | AA76: 3.9399999999999998e-002 | AB76: 3.1400000000000004e-002 | AC76: 8.3000000000000001e-003 | AD76: 5.8999999999999999e-003 | AE76: 91.72 | AF76: 92.82 | AG76: 0.21 | AH76: AA- | AI76: 6.3399999999999998e-002 | AJ76: =H76+100*O76 -> 140.50299999999999 | AK76: 129.3 | AL76: 161 | AM76: 36.5 | AN76: 150 | AO76: -3.7000000000000005e-002 | AP76: 40 | AQ76: 哈尔转债!
A77: 79 | B77: 113599 | C77: 嘉友转债! | D77: 603871 | E77: 嘉友国际 | F77: 交通运输 | G77: 物流业 | H77: 102.21 | I77: -2.3e-003 | J77: -2.0999999999999999e-003 | K77: 20.48 | L77: -1.01e-002 | M77: 126 | N77: 24.82 | O77: 0.23899999999999999 | P77: 82.51 | Q77: 27天 | R77: 5.53年 | S77: 3.53年 | T77: 7.2 | U77: 5.6 | V77: 8.0000000000000002e-003 | W77: 0.16 | X77: 0.13200000000000001 | Y77: 45 | Z77: 2.26 | AA77: 3.9300000000000002e-002 | AB77: 3.1099999999999999e-002 | AC77: 4.5000000000000005e-003 | AD77: 2.5000000000000001e-003 | AE77: 82.48 | AF77: 89.49 | AG77: 0.43 | AH77: AA- | AI77: 6.5099999999999991e-002 | AJ77: =H77+100*O77 -> 126.10999999999999 | AK77: 121.9 | AL77: 95 | AM77: 32.4 | AN77: 126 | AO77: 4.0000000000000001e-003 | AP77: 16 | AQ77: 嘉友转债!
A78: 246 | B78: 113532 | C78: 海环转债! | D78: 603817 | E78: 海峡环保 | F78: 城市公用 | G78: 三废处理 | H78: 96.56 | I78: -6.3e-003 | J78: 3.8e-003 | K78: 5.63 | L78: -1.0500000000000001e-002 | M78: 112.9 | N78: 7.69 | O78: 0.31900000000000001 | P78: 73.21 | Q78: 转股中 | R78: 4.19年 | S78: 2.19年 | T78: 4.6 | U78: 0.9 | V78: 2.e-003 | W78: 0.182 | X78: 0.13300000000000001 | Y78: 25 | Z78: 1.48 | AA78: 3.8900000000000004e-002 | AB78: 3.2899999999999999e-002 | AC78: 2.98e-002 | AD78: 2.6800000000000001e-002 | AE78: 93.86 | AF78: 95.23 | AG78: 0.23 | AH78: AA | AI78: 4.24e-002 | AJ78: =H78+100*O78 -> 128.46000000000001 | AK78: 119.9 | AL78: 78 | AM78: 24.7 | AN78: 60 | AO78: -2.7999999999999997e-002 | AP78: 26 | AQ78: 海环转债!
A79: 71 | B79: 113601 | C79: 塞力转债 | D79: 603716 | E79: 塞力医疗 | F79: 医药 | G79: 医药商业 | H79: 98.5 | I79: 3.0999999999999999e-003 | J79: 1.3100000000000001e-002 | K79: 15.31 | L79: 2.8199999999999999e-002 | M79: 121.3 | N79: 16.98 | O79: 9.1999999999999998e-002 | P79: 90.16 | Q79: 36天 | R79: 5.58年 | S79: 3.58年 | T79: 5.43 | U79: 6 | V79: 1.1000000000000001e-002 | W79: 0.17300000000000001 | X79: 0.156 | Y79: 31 | Z79: 2.06 | AA79: 3.8900000000000004e-002 | AB79: 3.2000000000000001e-002 | AC79: 1.54e-002 | AD79: 1.3100000000000001e-002 | AE79: 82.53 | AF79: 86 | AG79: 0.57 | AH79: AA- | AI79: 6.5099999999999991e-002 | AJ79: =H79+100*O79 -> 107.7 | AK79: 106.8 | AL79: 15 | AM79: 20.8 | AN79: 30 | AO79: -1.3000000000000001e-002 | AP79: 29 | AQ79: 塞力转债
A80: 10 | B80: 123087 | C80: 明电转债! | D80: 300739 | E80: 明阳电路 | F80: 电子 | G80: 元器件制 | H80: 97.2 | I80: -7.6e-003 | J80: -2.3999999999999998e-003 | K80: 17.48 | L80: -2.7300000000000001e-002 | M80: 121.2 | N80: 24.23 | O80: 0.34700000000000003 | P80: 72.14 | Q80: 5月0天 | R80: 5.90年 | S80: 4.90年 | T80: 6.73 | U80: 8.9 | V80: 1.3999999999999999e-002 | W80: 0.13800000000000001 | X80: 9.9000000000000005e-002 | Y80: 49 | Z80: 3.55 | AA80: 3.8900000000000004e-002 | AB80: 3.2400000000000005e-002 | AC80: 1.89e-002 | AD80: 1.6299999999999999e-002 | AE80: 77.95 | AF80: 84.2 | AG80: 0.37 | AH80: AA- | AI80: 6.5099999999999991e-002 | AJ80: =H80+100*O80 -> 131.90000000000001 | AK80: 122.3 | AL80: 101 | AM80: 38.1 | AN80: 159 | AO80: -5.2999999999999999e-002 | AP80: 3 | AQ80: 明电转债!
A81: 15 | B81: 127027 | C81: N靖远转 | D81: 552. | E81: 靖远煤电 | F81: 煤炭 | G81: 煤炭开采 | H81: 93.15 | I81: -6.8499999999999991e-002 | J81: 0. | K81: 2.82 | L81: -4.0800000000000003e-002 | M81: 115.3 | N81: 3.33 | O81: 0.10000000000000001 | P81: 84.68 | Q81: 4月25天 | R81: 5.88年 | S81: 3.88年 | T81: 28 | U81: 2129. | V81: 0.80200000000000005 | W81: 0.434 | X81: 0.36799999999999999 | Y81: 64 | Z81: 0.81 | AA81: 3.7599999999999995e-002 | AB81: 3.27e-002 | AC81: 2.7300000000000001e-002 | AD81: 2.5399999999999999e-002 | AE81: 87.97 | AF81: 90.88 | AG81: 0.44 | AH81: AA+ | AI81: 4.2099999999999999e-002 | AJ81: =H81+100*O81 -> 103.15000000000001 | AK81: 101.6 | AL81: 6 | AM81: 10.7 | AN81: 5 | AO81: -6.6000000000000003e-002 | AP81: 5 | AQ81: N靖远转
A82: 318 | B82: 128025 | C82: 特一转债! | D82: 2728. | E82: 特一药业 | F82: 医药 | G82: 化学制药 | H82: 98.155 | I82: 1.1999999999999999e-003 | J82: -1.e-003 | K82: 11.22 | L82: 8.9999999999999998e-004 | M82: 108.8 | N82: 14.7 | O82: 0.28600000000000003 | P82: 76.33 | Q82: 转股中 | R82: 2.87年 | S82: 0.87年 | T82: 2.99 | U82: 2.4 | V82: 8.0000000000000002e-003 | W82: 0.13100000000000001 | X82: 0.10000000000000001 | Y82: 23 | Z82: 2.26 | AA82: 3.7000000000000005e-002 | AB82: 3.1e-002 | AC82: 3.3399999999999999e-002 | AD82: 3.0299999999999997e-002 | AE82: 95.45 | AF82: 91.86 | AG82: 0.18 | AH82: AA- | AI82: 6.1600000000000002e-002 | AJ82: =H82+100*O82 -> 126.755 | AK82: 120 | AL82: 79 | AM82: 24.5 | AN82: 58 | AO82: -1.4999999999999999e-002 | AP82: 51 | AQ82: 特一转债!
A83: 291 | B83: 110045 | C83: 海澜转债! | D83: 600398 | E83: 海澜之家 | F83: 服装纺织 | G83: 服装行业 | H83: 98.15 | I83: -6.6e-003 | J83: 6.4000000000000003e-003 | K83: 6.87 | L83: -4.3e-003 | M83: 111.1 | N83: 11.75 | O83: 0.67900000000000005 | P83: 58.47 | Q83: 转股中 | R83: 3.47年 | S83: 1.47年 | T83: 29.5 | U83: 6 | V83: 2.e-003 | W83: 9.9000000000000005e-002 | X83: 5.7999999999999996e-002 | Y83: 297 | Z83: 2.34 | AA83: 3.6900000000000002e-002 | AB83: 3.0699999999999998e-002 | AC83: 2.4e-002 | AD83: 2.1499999999999998e-002 | AE83: 95.65 | AF83: 97.02 | AG83: 0.04 | AH83: AA+ | AI83: 4.0399999999999998e-002 | AJ83: =H83+100*O83 -> 166.05000000000001 | AK83: 137.8 | AL83: 209 | AM83: 40.8 | AN83: 181 | AO83: 7.0999999999999994e-002 | AP83: 60 | AQ83: 海澜转债!
A84: 34 | B84: 113608 | C84: 威派转债! | D84: 603956 | E84: 威派格 | F84: 机械装备 | G84: 专用设备 | H84: 99 | I84: -1.54e-002 | J84: 9.1999999999999998e-003 | K84: 14.84 | L84: -1.26e-002 | M84: 121.6 | N84: 19.24 | O84: 0.28399999999999997 | P84: 77.13 | Q84: 3月21天 | R84: 5.80年 | S84: 3.80年 | T84: 4.2 | U84: 2.3 | V84: 5.0000000000000001e-003 | W84: 6.6000000000000003e-002 | X84: 5.0999999999999997e-002 | Y84: 63 | Z84: 5.54 | AA84: 3.6900000000000002e-002 | AB84: 3.0200000000000001e-002 | AC84: 1.41e-002 | AD84: 1.18e-002 | AE84: 78.48 | AF84: 80.27 | AG84: 0.49 | AH84: A+ | AI84: 7.6100000000000001e-002 | AJ84: =H84+100*O84 -> 127.40000000000001 | AK84: 120.9 | AL84: 84 | AM84: 40.6 | AN84: 179 | AO84: 2.3e-002 | AP84: 6 | AQ84: 威派转债!
A85: 275 | B85: 128049 | C85: 华源转债! | D85: 2787. | E85: 华源控股 | F85: 造纸包装 | G85: 包装材料 | H85: 100.05 | I85: -8.3000000000000001e-003 | J85: 1.34e-002 | K85: 6.46 | L85: 1.1000000000000001e-002 | M85: 114.5 | N85: 7.42 | O85: 0.14899999999999999 | P85: 87.06 | Q85: 转股中 | R85: 3.85年 | S85: 1.85年 | T85: 3.63 | U85: 5.2 | V85: 1.3999999999999999e-002 | W85: 0.17800000000000002 | X85: 0.155 | Y85: 20 | Z85: 1.36 | AA85: 3.6400000000000002e-002 | AB85: 2.92e-002 | AC85: 1.38e-002 | AD85: 1.1000000000000001e-002 | AE85: 90.94 | AF85: 90.79 | AG85: 0.47 | AH85: AA- | AI85: 6.3399999999999998e-002 | AJ85: =H85+100*O85 -> 114.94999999999999 | AK85: 113 | AL85: 37 | AM85: 22.1 | AN85: 41 | AO85: 4.9000000000000002e-002 | AP85: 51 | AQ85: 华源转债!
A86: 317 | B86: 128026 | C86: 众兴转债! | D86: 2772. | E86: 众兴菌业 | F86: 农业 | G86: 种植业 | H86: 98.751 | I86: -3.7000000000000002e-003 | J86: -2.e-003 | K86: 9.03 | L86: -2.69e-002 | M86: 109.3 | N86: 11.45 | O86: 0.252 | P86: 78.86 | Q86: 转股中 | R86: 2.89年 | S86: 0.89年 | T86: 9.19 | U86: 4 | V86: 4.0000000000000001e-003 | W86: 0.27699999999999997 | X86: 0.218 | Y86: 33 | Z86: 1.35 | AA86: 3.6299999999999999e-002 | AB86: 2.9999999999999999e-002 | AC86: 2.9300000000000003e-002 | AD86: 2.58e-002 | AE86: 95.58 | AF86: 92.21 | AG86: 0.21 | AH86: AA- | AI86: 6.1600000000000002e-002 | AJ86: =H86+100*O86 -> 123.95100000000001 | AK86: 118.6 | AL86: 69 | AM86: 23.1 | AN86: 48 | AO86: -9.8000000000000004e-002 | AP86: 59 | AQ86: 众兴转债!
A87: 110 | B87: 113591 | C87: 胜达转债! | D87: 603687 | E87: 大胜达 | F87: 造纸包装 | G87: 包装用纸 | H87: 101.7 | I87: 3.2500000000000001e-002 | J87: 2.6699999999999998e-002 | K87: 9.77 | L87: 0.10000000000000001 | M87: 122.2 | N87: 10.46 | O87: 8.900000000000001e-002 | P87: 93.4 | Q87: 转股中 | R87: 5.44年 | S87: 3.44年 | T87: 5.5 | U87: 53 | V87: 9.5000000000000001e-002 | W87: 0.13699999999999998 | X87: 0.128 | Y87: 40 | Z87: 2.58 | AA87: 3.5099999999999999e-002 | AB87: 2.7799999999999998e-002 | AC87: 6.6e-003 | AD87: 4.4000000000000003e-003 | AE87: 83.17 | AF87: 87.38 | AG87: 0.59 | AH87: AA- | AI87: 6.5099999999999991e-002 | AJ87: =H87+100*O87 -> 110.60000000000001 | AK87: 110 | AL87: 24 | AM87: 22.6 | AN87: 46 | AO87: 9.1999999999999998e-002 | AP87: 21 | AQ87: 胜达转债!
A88: 292 | B88: 123010 | C88: 博世转债! | D88: 300422 | E88: 博世科 | F88: 城市公用 | G88: 三废处理 | H88: 100.099 | I88: -6.9999999999999993e-003 | J88: -1.9e-003 | K88: 9.4 | L88: -3.39e-002 | M88: 112.3 | N88: 12.2 | O88: 0.29899999999999999 | P88: 77.05 | Q88: 转股中 | R88: 3.45年 | S88: 1.45年 | T88: 4.3 | U88: 5.1 | V88: 1.2e-002 | W88: 0.113 | X88: 8.6999999999999994e-002 | Y88: 38 | Z88: 1.61 | AA88: 3.4599999999999999e-002 | AB88: 2.7699999999999999e-002 | AC88: 1.6799999999999999e-002 | AD88: 1.3300000000000001e-002 | AE88: 93.16 | AF88: 91.24 | AG88: 0.26 | AH88: AA- | AI88: 6.3399999999999998e-002 | AJ88: =H88+100*O88 -> 129.999 | AK88: 123.1 | AL88: 110 | AM88: 30 | AN88: 104 | AO88: -0.11699999999999999 | AP88: 32 | AQ88: 博世转债!
A89: 111 | B89: 128116 | C89: 瑞达转债! | D89: 2961. | E89: 瑞达期货 | F89: 金融 | G89: 期货行业 | H89: 96.19 | I89: -1.03e-002 | J89: -1.6000000000000001e-003 | K89: 22.17 | L89: -3.8599999999999995e-002 | M89: 115.3 | N89: 29.82 | O89: 0.29399999999999998 | P89: 74.35 | Q89: 转股中 | R89: 5.43年 | S89: 3.43年 | T89: 6.5 | U89: 6.9 | V89: 1.1000000000000001e-002 | W89: 6.6000000000000003e-002 | X89: 4.9000000000000002e-002 | Y89: 99 | Z89: 5.61 | AA89: 3.4599999999999999e-002 | AB89: 2.9300000000000003e-002 | AC89: 2.1400000000000002e-002 | AD89: 1.9299999999999998e-002 | AE89: 88.93 | AF89: 91.62 | AG89: 0.31 | AH89: AA | AI89: 4.41e-002 | AJ89: =H89+100*O89 -> 125.59 | AK89: 118 | AL89: 62 | AM89: 26.4 | AN89: 79 | AO89: -4.0000000000000001e-002 | AP89: 15 | AQ89: 瑞达转债!
A90: 152 | B90: 127016 | C90: 鲁泰转债! | D90: 726. | E90: 鲁 泰Ａ | F90: 服装纺织 | G90: 纺织行业 | H90: 97.696 | I90: -1.9e-003 | J90: -1.2999999999999999e-003 | K90: 6.12 | L90: -1.61e-002 | M90: 116.2 | N90: 8.91 | O90: 0.42200000000000004 | P90: 68.69 | Q90: 转股中 | R90: 5.21年 | S90: 3.21年 | T90: 14 | U90: 1.6 | V90: 1.e-003 | W90: 0.26700000000000002 | X90: 0.183 | Y90: 53 | Z90: 0.68 | AA90: 3.4500000000000003e-002 | AB90: 2.87e-002 | AC90: 1.8000000000000002e-002 | AD90: 1.5800000000000002e-002 | AE90: 90.34 | AF90: 94.13 | AG90: 0.2 | AH90: AA+ | AI90: 4.2099999999999999e-002 | AJ90: =H90+100*O90 -> 139.89600000000002 | AK90: 126.7 | AL90: 139 | AM90: 32.6 | AN90: 129 | AO90: -4.9000000000000002e-002 | AP90: 22 | AQ90: 鲁泰转债!
A91: 325 | B91: 128018 | C91: 时达转债! | D91: 2527. | E91: 新时达 | F91: 机械装备 | G91: 机器人及 | H91: 99.68 | I91: -5.1999999999999998e-003 | J91: 3.0999999999999999e-003 | K91: 5.48 | L91: -1.44e-002 | M91: 109.3 | N91: 7.42 | O91: 0.34999999999999998 | P91: 73.85 | Q91: 转股中 | R91: 2.79年 | S91: 0.79年 | T91: 8.8 | U91: 2.5 | V91: 3.0000000000000001e-003 | W91: 0.25900000000000001 | X91: 0.191 | Y91: 34 | Z91: 1.33 | AA91: 3.4099999999999998e-002 | AB91: 2.76e-002 | AC91: 2.23e-002 | AD91: 1.8500000000000003e-002 | AE91: 98.01 | AF91: 97.99 | AG91: 0.14 | AH91: AA | AI91: 4.0599999999999997e-002 | AJ91: =H91+100*O91 -> 134.68000000000001 | AK91: 125.5 | AL91: 130 | AM91: 27.5 | AN91: 90 | AO91: -4.4999999999999998e-002 | AP91: 41 | AQ91: 时达转债!
A92: 25 | B92: 113610 | C92: 灵康转债 | D92: 603669 | E92: 灵康药业 | F92: 医药 | G92: 化学制药 | H92: 99.88 | I92: -1.2199999999999999e-002 | J92: 6.8000000000000005e-003 | K92: 8.34 | L92: -8.3000000000000001e-003 | M92: 121.1 | N92: 8.81 | O92: 5.5e-002 | P92: 94.67 | Q92: 4月16天 | R92: 5.86年 | S92: 3.86年 | T92: 5.25 | U92: 12 | V92: 2.3e-002 | W92: 8.8000000000000009e-002 | X92: 8.4000000000000005e-002 | Y92: 60 | Z92: 4.36 | AA92: 3.4099999999999998e-002 | AB92: 2.76e-002 | AC92: 1.0200000000000001e-002 | AD92: 8.3000000000000001e-003 | AE92: 80.91 | AF92: 84.32 | AG92: 0.64 | AH92: AA- | AI92: 6.5099999999999991e-002 | AJ92: =H92+100*O92 -> 105.38 | AK92: 105.1 | AL92: 10 | AM92: 20.8 | AN92: 29 | AO92: -2.e-003 | AP92: 7 | AQ92: 灵康转债
A93: 74 | B93: 110074 | C93: 精达转债! | D93: 600577 | E93: 精达股份 | F93: 电子 | G93: 电子产品 | H93: 97.79 | I93: -3.8e-003 | J93: 5.0000000000000001e-003 | K93: 3.06 | L93: 3.3e-003 | M93: 117.3 | N93: 3.75 | O93: 0.19800000000000001 | P93: 81.6 | Q93: 34天 | R93: 5.57年 | S93: 3.57年 | T93: 7.87 | U93: 8.5 | V93: 1.1000000000000001e-002 | W93: 0.13400000000000001 | X93: 0.109 | Y93: 59 | Z93: 1.66 | AA93: 3.3799999999999997e-002 | AB93: 2.81e-002 | AC93: 1.6200000000000003e-002 | AD93: 1.4199999999999999e-002 | AE93: 88.47 | AF93: 92.66 | AG93: 0.39 | AH93: AA | AI93: 4.41e-002 | AJ93: =H93+100*O93 -> 117.59 | AK93: 114 | AL93: 44 | AM93: 21.3 | AN93: 34 | AO93: -1.3999999999999999e-002 | AP93: 9 | AQ93: 精达转债!
A94: 2 | B94: 123092 | C94: 天壕转债 | D94: 300332 | E94: 天壕环境 | F94: 石油天然 | G94: 天然气 | H94: 100.332 | I94: 1.8e-003 | J94: 1.5700000000000002e-002 | K94: 4.99 | L94: 2.46e-002 | M94: 121.6 | N94: 5.2 | O94: 4.5999999999999999e-002 | P94: 95.96 | Q94: 5月9天 | R94: 5.92年 | S94: 3.92年 | T94: 4.23 | U94: 28 | V94: 6.5000000000000002e-002 | W94: 9.6000000000000002e-002 | X94: 9.1999999999999998e-002 | Y94: 44 | Z94: 1.27 | AA94: 3.3700000000000001e-002 | AB94: 2.7200000000000002e-002 | AC94: 1.04e-002 | AD94: 8.1000000000000013e-003 | AE94: 77.77 | AF94: 79.54 | AG94: 0.71 | AH94: A+ | AI94: 7.6100000000000001e-002 | AJ94: =H94+100*O94 -> 104.93199999999999 | AK94: 104.7 | AL94: 9 | AM94: 25.2 | AN94: 64 | AO94: 2.6000000000000002e-002 | AP94: 3 | AQ94: 天壕转债
A95: 104 | B95: 110071 | C95: 湖盐转债! | D95: 600929 | E95: 雪天盐业 | F95: 食品饮料 | G95: 食品饮料 | H95: 96.87 | I95: -4.3e-003 | J95: -1.8e-003 | K95: 5.2 | L95: -1.7000000000000001e-002 | M95: 115.2 | N95: 6.6 | O95: 0.23000000000000001 | P95: 78.79 | Q95: 转股中 | R95: 5.46年 | S95: 3.46年 | T95: 7.2 | U95: 2.6 | V95: 4.0000000000000001e-003 | W95: 0.151 | X95: 0.11900000000000001 | Y95: 48 | Z95: 1.88 | AA95: 3.2899999999999999e-002 | AB95: 2.76e-002 | AC95: 1.9099999999999999e-002 | AD95: 1.7100000000000001e-002 | AE95: 88.8 | AF95: 91.42 | AG95: 0.36 | AH95: AA | AI95: 4.41e-002 | AJ95: =H95+100*O95 -> 119.87 | AK95: 115 | AL95: 49 | AM95: 23.5 | AN95: 53 | AO95: -4.2000000000000003e-002 | AP95: 14 | AQ95: 湖盐转债!
A96: 100 | B96: 123059 | C96: 银信转债! | D96: 300231 | E96: 银信科技 | F96: 计算机及 | G96: 软件开发 | H96: 104.31 | I96: -6.7000000000000002e-003 | J96: -3.2000000000000002e-003 | K96: 8.58 | L96: -1.9400000000000001e-002 | M96: 124.1 | N96: 9.91 | O96: 0.20499999999999999 | P96: 86.58 | Q96: 转股中 | R96: 5.48年 | S96: 3.48年 | T96: 3.91 | U96: 4.8 | V96: 1.2e-002 | W96: 0.10300000000000001 | X96: 8.900000000000001e-002 | Y96: 38 | Z96: 2.88 | AA96: 3.2899999999999999e-002 | AB96: 2.52e-002 | AC96: -8.0000000000000004e-004 | AD96: -2.8999999999999998e-003 | AE96: 82.87 | AF96: 88.49 | AG96: 0.51 | AH96: AA- | AI96: 6.5099999999999991e-002 | AJ96: =H96+100*O96 -> 124.81 | AK96: 122 | AL96: 97 | AM96: 33.5 | AN96: 137 | AO96: 1.e-002 | AP96: 13 | AQ96: 银信转债!
A97: 49 | B97: 123071 | C97: 天能转债! | D97: 300569 | E97: 天能重工 | F97: 能源电力 | G97: 风能 | H97: 100.97 | I97: -6.6e-003 | J97: -5.3e-003 | K97: 14.72 | L97: -3.1600000000000003e-002 | M97: 121.1 | N97: 20.05 | O97: 0.375 | P97: 73.42 | Q97: 3月5天 | R97: 5.75年 | S97: 3.75年 | T97: 7 | U97: 13 | V97: 1.8000000000000002e-002 | W97: 0.121 | X97: 8.900000000000001e-002 | Y97: 58 | Z97: 2.61 | AA97: 3.2799999999999996e-002 | AB97: 2.6200000000000001e-002 | AC97: 7.7000000000000002e-003 | AD97: 5.6999999999999993e-003 | AE97: 81.47 | AF97: 84.91 | AG97: 0.38 | AH97: AA- | AI97: 6.5099999999999991e-002 | AJ97: =H97+100*O97 -> 138.47 | AK97: 128.5 | AL97: 153 | AM97: 43.6 | AN97: 191 | AO97: -3.4000000000000002e-002 | AP97: 8 | AQ97: 天能转债!
A98: 166 | B98: 113570 | C98: 百达转债 | D98: 603331 | E98: 百达精工 | F98: 机械装备 | G98: 机械装备 | H98: 98.1 | I98: -1.5100000000000001e-002 | J98: -1.e-004 | K98: 9.59 | L98: -2.7400000000000001e-002 | M98: 115.3 | N98: 11.54 | O98: 0.17999999999999999 | P98: 83.1 | Q98: 转股中 | R98: 5年48天 | S98: 3年48天 | T98: 2.8 | U98: 2.1 | V98: 8.0000000000000002e-003 | W98: 0.16300000000000001 | X98: 0.13600000000000001 | Y98: 17 | Z98: 2.22 | AA98: 3.27e-002 | AB98: 2.7099999999999999e-002 | AC98: 1.7500000000000002e-002 | AD98: 1.5100000000000001e-002 | AE98: 81.73 | AF98: 79.81 | AG98: 0.55 | AH98: A+ | AI98: 7.6100000000000001e-002 | AJ98: =H98+100*O98 -> 116.09999999999999 | AK98: 113.1 | AL98: 38 | AM98: 31.4 | AN98: 113 | AO98: -7.8e-002 | AP98: 35 | AQ98: 百达转债
A99: 21 | B99: 123082 | C99: 北陆转债! | D99: 300016 | E99: 北陆药业 | F99: 医药 | G99: 化学制药 | H99: 101.15 | I99: -2.7000000000000001e-003 | J99: 3.73e-002 | K99: 9.54 | L99: 5.9999999999999998e-002 | M99: 121.7 | N99: 11.41 | O99: 0.20999999999999999 | P99: 83.61 | Q99: 4月20天 | R99: 5.87年 | S99: 3.87年 | T99: 5 | U99: 37 | V99: 7.2000000000000008e-002 | W99: 0.106 | X99: 8.900000000000001e-002 | Y99: 47 | Z99: 2.97 | AA99: 3.27e-002 | AB99: 2.6099999999999998e-002 | AC99: 8.5000000000000006e-003 | AD99: 6.1999999999999998e-003 | AE99: 78.05 | AF99: 79.89 | AG99: 0.58 | AH99: A+ | AI99: 7.6100000000000001e-002 | AJ99: =H99+100*O99 -> 122.15000000000001 | AK99: 118.7 | AL99: 70 | AM99: 38.8 | AN99: 165 | AO99: 3.7999999999999999e-002 | AP99: 5 | AQ99: 北陆转债!
A100: 203 | B100: 113549 | C100: 白电转债 | D100: 603861 | E100: 白云电器 | F100: 能源电力 | G100: 电力设备 | H100: 98.88 | I100: -1.44e-002 | J100: 5.1000000000000004e-003 | K100: 7.53 | L100: -2.3300000000000001e-002 | M100: 114.8 | N100: 8.88 | O100: 0.16600000000000001 | P100: 84.8 | Q100: 转股中 | R100: 4.81年 | S100: 2.81年 | T100: 8.8 | U100: 1.9 | V100: 2.e-003 | W100: 0.26500000000000001 | X100: 0.22399999999999998 | Y100: 33 | Z100: 1.42 | AA100: 3.2099999999999997e-002 | AB100: 2.63e-002 | AC100: 1.49e-002 | AD100: 1.2699999999999999e-002 | AE100: 91.37 | AF100: 94.34 | AG100: 0.4 | AH100: AA | AI100: 4.24e-002 | AJ100: =H100+100*O100 -> 115.47999999999999 | AK100: 113 | AL100: 36 | AM100: 18.6 | AN100: 21 | AO100: -5.5999999999999994e-002 | AP100: 33 | AQ100: 白电转债
A101: 13 | B101: 123085 | C101: 万顺转2 | D101: 300057 | E101: 万顺新材 | F101: 有色金属 | G101: 铝金属 | H101: 94.4 | I101: 3.0000000000000001e-003 | J101: -1.41e-002 | K101: 4.72 | L101: -2.4799999999999999e-002 | M101: 113.3 | N101: 6.24 | O101: 0.248 | P101: 75.64 | Q101: 4月26天 | R101: 5.89年 | S101: 3.89年 | T101: 9 | U101: 23 | V101: 2.7000000000000003e-002 | W101: 0.28300000000000003 | X101: 0.214 | Y101: 32 | Z101: 0.94 | AA101: 3.2099999999999997e-002 | AB101: 2.7799999999999998e-002 | AC101: 2.3900000000000001e-002 | AD101: 2.2000000000000002e-002 | AE101: 80.59 | AF101: 78.74 | AG101: 0.45 | AH101: AA- | AI101: 6.5099999999999991e-002 | AJ101: =H101+100*O101 -> 119.2 | AK101: 113.2 | AL101: 40 | AM101: 32.6 | AN101: 128 | AO101: -2.8999999999999998e-002 | AP101: 5 | AQ101: 万顺转2
A102: 170 | B102: 113567 | C102: 君禾转债 | D102: 603617 | E102: 君禾股份 | F102: 机械装备 | G102: 通用设备 | H102: 101.98 | I102: -1.e-003 | J102: 1.e-003 | K102: 9.83 | L102: 0. | M102: 119.3 | N102: 11.46 | O102: 0.18899999999999997 | P102: 85.78 | Q102: 转股中 | R102: 5年41天 | S102: 3年41天 | T102: 2.1 | U102: 3.3 | V102: 1.4999999999999999e-002 | W102: 0.107 | X102: 9.1999999999999998e-002 | Y102: 20 | Z102: 3.04 | AA102: 3.2000000000000001e-002 | AB102: 2.5099999999999997e-002 | AC102: 7.4999999999999997e-003 | AD102: 4.7999999999999996e-003 | AE102: 82.43 | AF102: 82.81 | AG102: 0.56 | AH102: A+ | AI102: 7.6100000000000001e-002 | AJ102: =H102+100*O102 -> 120.88 | AK102: 118.2 | AL102: 64 | AM102: 35.4 | AN102: 146 | AO102: -4.2000000000000003e-002 | AP102: 37 | AQ102: 君禾转债
A103: 183 | B103: 113561 | C103: 正裕转债! | D103: 603089 | E103: 正裕工业 | F103: 汽车 | G103: 零部件制 | H103: 101.49 | I103: -6.5000000000000006e-003 | J103: 2.3e-003 | K103: 8.28 | L103: -8.3999999999999995e-003 | M103: 118 | N103: 10.23 | O103: 0.254 | P103: 80.94 | Q103: 转股中 | R103: 4.94年 | S103: 2.94年 | T103: 1.5 | U103: 1.3 | V103: 9.0000000000000011e-003 | W103: 8.1000000000000003e-002 | X103: 6.6000000000000003e-002 | Y103: 18 | Z103: 1.98 | AA103: 3.1699999999999999e-002 | AB103: 2.5000000000000001e-002 | AC103: 8.5000000000000006e-003 | AD103: 5.8999999999999999e-003 | AE103: 83.56 | AF103: 83.46 | AG103: 0.49 | AH103: A+ | AI103: 7.4400000000000008e-002 | AJ103: =H103+100*O103 -> 126.88999999999999 | AK103: 122 | AL103: 98 | AM103: 38.5 | AN103: 161 | AO103: -0.13699999999999998 | AP103: 34 | AQ103: 正裕转债!
A104: 210 | B104: 110059 | C104: 浦发转债! | D104: 600000 | E104: 浦发银行 | F104: 金融 | G104: 银行行业 | H104: 101.92 | I104: -2.5000000000000001e-003 | J104: -4.0000000000000002e-004 | K104: 9.79 | L104: -1.8100000000000002e-002 | M104: 117.6 | N104: 14.45 | O104: 0.504 | P104: 67.75 | Q104: 转股中 | R104: 4.76年 | S104: 无权 | T104: 500 | U104: 225 | V104: 4.0000000000000001e-003 | W104: 0.17399999999999999 | X104: 0.11800000000000001 | Y104: 2874. | Z104: 0.56 | AA104: 3.1400000000000004e-002 | AB104: 2.4500000000000001e-002 | AC104: 无权 | AD104: 无权 | AE104: 无权 | AF104: 99.2 | AG104: 0.16 | AH104: AAA | AI104: 3.7400000000000003e-002 | AJ104: =H104+100*O104 -> 152.31999999999999 | AK104: 136.1 | AL104: 200 | AM104: 36.9 | AN104: 156 | AO104: 1.e-003 | AP104: 76 | AQ104: 浦发转债!
A105: 106 | B105: 113036 | C105: 宁建转债! | D105: 601789 | E105: 宁波建工 | F105: 建筑 | G105: 建筑工程 | H105: 99.66 | I105: -4.5000000000000005e-003 | J105: -7.000000000000001e-004 | K105: 3.83 | L105: -1.54e-002 | M105: 117.3 | N105: 4.86 | O105: 0.26500000000000001 | P105: 78.81 | Q105: 转股中 | R105: 5.45年 | S105: 3.45年 | T105: 5.4 | U105: 1.6 | V105: 3.0000000000000001e-003 | W105: 0.14400000000000002 | X105: 0.114 | Y105: 37 | Z105: 1.26 | AA105: 3.1e-002 | AB105: 2.5099999999999997e-002 | AC105: 1.1399999999999999e-002 | AD105: 9.300000000000001e-003 | AE105: 88.94 | AF105: 93.14 | AG105: 0.34 | AH105: AA | AI105: 4.41e-002 | AJ105: =H105+100*O105 -> 126.16 | AK105: 120.5 | AL105: 82 | AM105: 27.4 | AN105: 88 | AO105: -1.9e-002 | AP105: 8 | AQ105: 宁建转债!
A106: 252 | B106: 123024 | C106: 岱勒转债! | D106: 300700 | E106: 岱勒新材 | F106: 机械装备 | G106: 专用设备 | H106: 102.827 | I106: -1.03e-002 | J106: 5.6999999999999993e-003 | K106: 17.55 | L106: -2.7699999999999999e-002 | M106: 113 | N106: 24.9 | O106: 0.45899999999999996 | P106: 70.48 | Q106: 转股中 | R106: 3年58天 | S106: 1年58天 | T106: 2.1 | U106: 6.1 | V106: 2.7999999999999997e-002 | W106: 0.14499999999999999 | X106: 0.10199999999999999 | Y106: 14 | Z106: 2.93 | AA106: 3.0699999999999998e-002 | AB106: 2.3e-002 | AC106: -8.0000000000000002e-003 | AD106: -1.0500000000000001e-002 | AE106: 92.57 | AF106: 90.37 | AG106: 0.17 | AH106: A+ | AI106: 7.4400000000000008e-002 | AJ106: =H106+100*O106 -> 148.727 | AK106: 135.2 | AL106: 194 | AM106: 42.6 | AN106: 188 | AO106: -4.4999999999999998e-002 | AP106: 36 | AQ106: 岱勒转债!
A107: 261 | B107: 113021 | C107: 中信转债! | D107: 601998 | E107: 中信银行 | F107: 金融 | G107: 银行行业 | H107: 105.36 | I107: -3.8e-003 | J107: 1.7000000000000001e-003 | K107: 5.08 | L107: -1.1699999999999999e-002 | M107: 118.8 | N107: 6.98 | O107: 0.44799999999999995 | P107: 72.78 | Q107: 转股中 | R107: 4年41天 | S107: 无权 | T107: 400 | U107: 84 | V107: 2.e-003 | W107: 0.161 | X107: 0.11699999999999999 | Y107: 2486. | Z107: 0.55 | AA107: 3.0600000000000002e-002 | AB107: 2.2200000000000001e-002 | AC107: 无权 | AD107: 无权 | AE107: 无权 | AF107: 102.65 | AG107: 0.18 | AH107: AAA | AI107: 3.7400000000000003e-002 | AJ107: =H107+100*O107 -> 150.16 | AK107: 137.9 | AL107: 211 | AM107: 35.3 | AN107: 145 | AO107: -6.0000000000000001e-003 | AP107: 52 | AQ107: 中信转债!
A108: 186 | B108: 123039 | C108: 开润转债! | D108: 300577 | E108: 开润股份 | F108: 服装纺织 | G108: 纺织行业 | H108: 104.698 | I108: 2.7000000000000001e-003 | J108: -1.5e-003 | K108: 25.35 | L108: 2.8000000000000004e-003 | M108: 121 | N108: 32.87 | O108: 0.35799999999999998 | P108: 77.12 | Q108: 转股中 | R108: 4.93年 | S108: 2.93年 | T108: 2.22 | U108: 2.1 | V108: 9.0000000000000011e-003 | W108: 3.6000000000000004e-002 | X108: 2.7999999999999997e-002 | Y108: 61 | Z108: 6.61 | AA108: 3.0499999999999999e-002 | AB108: 2.2799999999999997e-002 | AC108: -1.9e-003 | AD108: -4.5000000000000005e-003 | AE108: 83.56 | AF108: 85.63 | AG108: 0.41 | AH108: A+ | AI108: 7.4400000000000008e-002 | AJ108: =H108+100*O108 -> 140.49799999999999 | AK108: 132.3 | AL108: 179 | AM108: 46.6 | AN108: 207 | AO108: 4.0000000000000001e-003 | AP108: 25 | AQ108: 开润转债!
A109: 155 | B109: 113574 | C109: 华体转债! | D109: 603679 | E109: 华体科技 | F109: 城市公用 | G109: 城市公用 | H109: 100.7 | I109: 2.0000000000000001e-004 | J109: -5.0000000000000001e-004 | K109: 21.6 | L109: -1.4000000000000002e-003 | M109: 116.4 | N109: 33.99 | O109: 0.58499999999999996 | P109: 63.55 | Q109: 转股中 | R109: 5.19年 | S109: 3.19年 | T109: 2.09 | U109: 10 | V109: 4.9000000000000002e-002 | W109: 6.8000000000000005e-002 | X109: 4.2999999999999997e-002 | Y109: 31 | Z109: 4.22 | AA109: 2.9100000000000001e-002 | AB109: 2.3199999999999998e-002 | AC109: 1.15e-002 | AD109: 8.6999999999999994e-003 | AE109: 82.05 | AF109: 80.38 | AG109: 0.24 | AH109: A+ | AI109: 7.6100000000000001e-002 | AJ109: =H109+100*O109 -> 159.19999999999999 | AK109: 137.9 | AL109: 210 | AM109: 55.8 | AN109: 249 | AO109: -1.3000000000000001e-002 | AP109: 15 | AQ109: 华体转债!
A110: 20 | B110: 128140 | C110: 润建转债 | D110: 2929. | E110: 润建股份 | F110: 通信互联 | G110: 通信设备 | H110: 97.699 | I110: -1.11e-002 | J110: -1.2999999999999999e-003 | K110: 23.34 | L110: -2.5099999999999997e-002 | M110: 115.2 | N110: 26.55 | O110: 0.111 | P110: 87.91 | Q110: 4月20天 | R110: 5.87年 | S110: 3.87年 | T110: 10.9 | U110: 6.2 | V110: 6.0000000000000001e-003 | W110: 0.21199999999999999 | X110: 0.18600000000000003 | Y110: 52 | Z110: 1.73 | AA110: 2.8999999999999998e-002 | AB110: 2.41e-002 | AC110: 1.4999999999999999e-002 | AD110: 1.32e-002 | AE110: 87.23 | AF110: 89.81 | AG110: 0.5 | AH110: AA | AI110: 4.41e-002 | AJ110: =H110+100*O110 -> 108.79899999999999 | AK110: 107.5 | AL110: 17 | AM110: 17.7 | AN110: 19 | AO110: -9.0000000000000011e-003 | AP110: 6 | AQ110: 润建转债
A111: 303 | B111: 113505 | C111: 杭电转债! | D111: 603618 | E111: 杭电股份 | F111: 能源电力 | G111: 电力设备 | H111: 103.1 | I111: 4.0500000000000001e-002 | J111: 6.0999999999999995e-003 | K111: 6.78 | L111: 0.10099999999999999 | M111: 112.3 | N111: 7.14 | O111: 8.5999999999999993e-002 | P111: 94.96 | Q111: 转股中 | R111: 3年43天 | S111: 1年43天 | T111: 7.5 | U111: 121 | V111: 0.157 | W111: 0.16 | X111: 0.152 | Y111: 47 | Z111: 1.85 | AA111: 2.8399999999999998e-002 | AB111: 2.0899999999999998e-002 | AC111: -2.3e-003 | AD111: -6.6e-003 | AE111: 97.52 | AF111: 98.95 | AG111: 0.46 | AH111: AA | AI111: 4.24e-002 | AJ111: =H111+100*O111 -> 111.69999999999999 | AK111: 111.2 | AL111: 33 | AM111: 12.3 | AN111: 7 | AO111: 9.1999999999999998e-002 | AP111: 40 | AQ111: 杭电转债!
A112: 19 | B112: 113612 | C112: 永冠转债 | D112: 603681 | E112: 永冠新材 | F112: 化工 | G112: 其他 | H112: 103.42 | I112: -1.24e-002 | J112: 3.9000000000000003e-003 | K112: 19.9 | L112: -1.29e-002 | M112: 121.2 | N112: 20.79 | O112: 8.0000000000000002e-002 | P112: 95.72 | Q112: 4月23天 | R112: 5.88年 | S112: 3.88年 | T112: 5.2 | U112: 20 | V112: 3.7000000000000005e-002 | W112: 0.157 | X112: 0.14999999999999999 | Y112: 33 | Z112: 2.24 | AA112: 2.7900000000000001e-002 | AB112: 2.1499999999999998e-002 | AC112: 1.7000000000000001e-003 | AD112: -2.9999999999999997e-004 | AE112: 80.9 | AF112: 84.31 | AG112: 0.66 | AH112: AA- | AI112: 6.5099999999999991e-002 | AJ112: =H112+100*O112 -> 111.42 | AK112: 111.1 | AL112: 30 | AM112: 26.8 | AN112: 83 | AO112: 1.1000000000000001e-002 | AP112: 3 | AQ112: 永冠转债
A113: 144 | B113: 123049 | C113: 维尔转债 | D113: 300190 | E113: 维尔利 | F113: 城市公用 | G113: 三废处理 | H113: 108.598 | I113: -8.199999999999999e-003 | J113: -9.4999999999999998e-003 | K113: 6.95 | L113: -3.2000000000000001e-002 | M113: 124.8 | N113: 7.48 | O113: 0.16899999999999998 | P113: 92.91 | Q113: 转股中 | R113: 5.22年 | S113: 3.22年 | T113: 9.17 | U113: 9 | V113: 9.0000000000000011e-003 | W113: 0.16899999999999998 | X113: 0.157 | Y113: 54 | Z113: 1.29 | AA113: 2.7699999999999999e-002 | AB113: 1.9400000000000001e-002 | AC113: -1.0800000000000001e-002 | AD113: -1.3500000000000002e-002 | AE113: 84.83 | AF113: 90.53 | AG113: 0.56 | AH113: AA- | AI113: 6.5099999999999991e-002 | AJ113: =H113+100*O113 -> 125.49799999999999 | AK113: 124.3 | AL113: 117 | AM113: 33.7 | AN113: 139 | AO113: -4.7e-002 | AP113: 14 | AQ113: 维尔转债
A114: 158 | B114: 123047 | C114: 久吾转债 | D114: 300631 | E114: 久吾高科 | F114: 机械装备 | G114: 专用设备 | H114: 113.72 | I114: 9.8999999999999991e-003 | J114: 1.52e-002 | K114: 17.75 | L114: 3.8599999999999995e-002 | M114: 130.1 | N114: 17.61 | O114: 0.128 | P114: 100.8 | Q114: 转股中 | R114: 5年57天 | S114: 3年57天 | T114: 1.99 | U114: 171 | V114: 0.752 | W114: 0.10300000000000001 | X114: 0.10400000000000001 | Y114: 19 | Z114: 2.65 | AA114: 2.7200000000000002e-002 | AB114: 1.7500000000000002e-002 | AC114: -2.0899999999999998e-002 | AD114: -2.4300000000000002e-002 | AE114: 83.46 | AF114: 90.17 | AG114: 0.65 | AH114: A+ | AI114: 7.6100000000000001e-002 | AJ114: =H114+100*O114 -> 126.52 | AK114: 126.6 | AL114: 138 | AM114: 36.5 | AN114: 151 | AO114: 8.6999999999999994e-002 | AP114: 22 | AQ114: 久吾转债
A115: 61 | B115: 123067 | C115: 斯莱转债 | D115: 300382 | E115: 斯莱克 | F115: 机械装备 | G115: 专用设备 | H115: 104.668 | I115: -1.3999999999999999e-002 | J115: 1.11e-002 | K115: 8.97 | L115: -4.4000000000000003e-003 | M115: 121.2 | N115: 9.38 | O115: 9.5000000000000001e-002 | P115: 95.63 | Q115: 2月0天 | R115: 5.65年 | S115: 3.65年 | T115: 3.88 | U115: 43 | V115: 0.10400000000000001 | W115: 7.6999999999999999e-002 | X115: 7.2999999999999995e-002 | Y115: 51 | Z115: 4.96 | AA115: 2.6800000000000001e-002 | AB115: 2.0199999999999999e-002 | AC115: -1.4000000000000002e-003 | AD115: -3.4999999999999996e-003 | AE115: 82.05 | AF115: 85.51 | AG115: 0.64 | AH115: AA- | AI115: 6.5099999999999991e-002 | AJ115: =H115+100*O115 -> 114.16800000000001 | AK115: 113.7 | AL115: 42 | AM115: 28.2 | AN115: 94 | AO115: 0.14800000000000002 | AP115: 14 | AQ115: 斯莱转债
A116: 211 | B116: 127014 | C116: 北方转债 | D116: 65. | E116: 北方国际 | F116: 建筑 | G116: 建筑工程 | H116: 101.821 | I116: -7.7000000000000002e-003 | J116: 2.0999999999999999e-003 | K116: 7.08 | L116: -1.67e-002 | M116: 115.1 | N116: 8.75 | O116: 0.25800000000000001 | P116: 80.91 | Q116: 转股中 | R116: 4.75年 | S116: 2.75年 | T116: 5.78 | U116: 1.2 | V116: 2.e-003 | W116: 0.106 | X116: 8.5999999999999993e-002 | Y116: 54 | Z116: 1.03 | AA116: 2.6699999999999998e-002 | AB116: 2.07e-002 | AC116: 6.0000000000000001e-003 | AD116: 3.5999999999999999e-003 | AE116: 92.4 | AF116: 95.72 | AG116: 0.34 | AH116: AA+ | AI116: 4.0399999999999998e-002 | AJ116: =H116+100*O116 -> 127.621 | AK116: 122.7 | AL116: 105 | AM116: 27 | AN116: 84 | AO116: -3.9e-002 | AP116: 17 | AQ116: 北方转债
A117: 70 | B117: 113039 | C117: 嘉泽转债! | D117: 601619 | E117: 嘉泽新能 | F117: 能源电力 | G117: 风能 | H117: 98.13 | I117: -1.67e-002 | J117: 7.6e-003 | K117: 3.05 | L117: -1.9299999999999998e-002 | M117: 113.1 | N117: 3.57 | O117: 0.14899999999999999 | P117: 85.43 | Q117: 38天 | R117: 5.59年 | S117: 3.59年 | T117: 13 | U117: 7.1 | V117: 6.0000000000000001e-003 | W117: 0.20600000000000002 | X117: 0.17600000000000002 | Y117: 63 | Z117: 1.85 | AA117: 2.6200000000000001e-002 | AB117: 2.18e-002 | AC117: 1.47e-002 | AD117: 1.2800000000000001e-002 | AE117: 88.23 | AF117: 89.27 | AG117: 0.47 | AH117: AA | AI117: 4.41e-002 | AJ117: =H117+100*O117 -> 113.03 | AK117: 110.8 | AL117: 28 | AM117: 21.6 | AN117: 37 | AO117: -9.3000000000000013e-002 | AP117: 18 | AQ117: 嘉泽转债!
A118: 150 | B118: 128105 | C118: 长集转债 | D118: 2616. | E118: 长青集团 | F118: 城市公用 | G118: 三废处理 | H118: 101.108 | I118: -8.6999999999999994e-003 | J118: -5.9999999999999995e-004 | K118: 7 | L118: -2.1000000000000001e-002 | M118: 115.3 | N118: 8.11 | O118: 0.17100000000000001 | P118: 86.31 | Q118: 转股中 | R118: 5.21年 | S118: 3.21年 | T118: 8 | U118: 2.7 | V118: 3.0000000000000001e-003 | W118: 0.154 | X118: 0.13300000000000001 | Y118: 52 | Z118: 2.06 | AA118: 2.6099999999999998e-002 | AB118: 2.06e-002 | AC118: 7.9000000000000008e-003 | AD118: 5.6999999999999993e-003 | AE118: 89.87 | AF118: 92.52 | AG118: 0.44 | AH118: AA | AI118: 4.41e-002 | AJ118: =H118+100*O118 -> 118.208 | AK118: 115.9 | AL118: 53 | AM118: 23.4 | AN118: 51 | AO118: -4.7e-002 | AP118: 9 | AQ118: 长集转债
A119: 276 | B119: 110047 | C119: 山鹰转债 | D119: 600567 | E119: 山鹰国际 | F119: 造纸包装 | G119: 包装用纸 | H119: 106.8 | I119: -1.8799999999999997e-002 | J119: 1.2199999999999999e-002 | K119: 3.11 | L119: -1.5800000000000002e-002 | M119: 117.5 | N119: 3.34 | O119: 0.14699999999999999 | P119: 93.11 | Q119: 转股中 | R119: 3.83年 | S119: 1.83年 | T119: 23 | U119: 26 | V119: 1.e-002 | W119: 0.161 | X119: 0.14999999999999999 | Y119: 143 | Z119: 0.97 | AA119: 2.5699999999999997e-002 | AB119: 1.7399999999999999e-002 | AC119: -1.89e-002 | AD119: -2.1600000000000001e-002 | AE119: 95.07 | AF119: 101.23 | AG119: 0.42 | AH119: AA+ | AI119: 4.0399999999999998e-002 | AJ119: =H119+100*O119 -> 121.5 | AK119: 120.5 | AL119: 81 | AM119: 19.3 | AN119: 24 | AO119: -6.9999999999999993e-003 | AP119: 35 | AQ119: 山鹰转债
A120: 201 | B120: 128081 | C120: 海亮转债! | D120: 2203. | E120: 海亮股份 | F120: 有色金属 | G120: 铜金属 | H120: 101.88 | I120: -1.23e-002 | J120: 1.6200000000000003e-002 | K120: 8.34 | L120: 9.7000000000000003e-003 | M120: 114.9 | N120: 9.76 | O120: 0.192 | P120: 85.45 | Q120: 转股中 | R120: 4.83年 | S120: 2.83年 | T120: 31.5 | U120: 30 | V120: 9.0000000000000011e-003 | W120: 0.193 | X120: 0.16500000000000001 | Y120: 163 | Z120: 1.81 | AA120: 2.5699999999999997e-002 | AB120: 1.9900000000000001e-002 | AC120: 5.0000000000000001e-003 | AD120: 2.8000000000000004e-003 | AE120: 91.4 | AF120: 94.37 | AG120: 0.41 | AH120: AA | AI120: 4.24e-002 | AJ120: =H120+100*O120 -> 121.08 | AK120: 118.3 | AL120: 65 | AM120: 23.9 | AN120: 55 | AO120: 0.10400000000000001 | AP120: 50 | AQ120: 海亮转债!
A121: 45 | B121: 123073 | C121: 同和转债! | D121: 300636 | E121: 同和药业 | F121: 医药 | G121: 原料药 | H121: 106.5 | I121: 1.04e-002 | J121: 3.8e-003 | K121: 24.22 | L121: 1.9400000000000001e-002 | M121: 122.4 | N121: 23.8 | O121: 4.7e-002 | P121: 101.76 | Q121: 3月11天 | R121: 5.76年 | S121: 3.76年 | T121: 3.6 | U121: 50 | V121: 0.13100000000000001 | W121: 0.11599999999999999 | X121: 0.11800000000000001 | Y121: 31 | Z121: 4.12 | AA121: 2.5000000000000001e-002 | AB121: 1.8200000000000001e-002 | AC121: -4.6999999999999993e-003 | AD121: -6.8999999999999999e-003 | AE121: 78.68 | AF121: 81.01 | AG121: 0.74 | AH121: A+ | AI121: 7.6100000000000001e-002 | AJ121: =H121+100*O121 -> 111.2 | AK121: 111.2 | AL121: 32 | AM121: 30.2 | AN121: 106 | AO121: 0.113 | AP121: 8 | AQ121: 同和转债!
A122: 154 | B122: 113033 | C122: 利群转债! | D122: 601366 | E122: 利群股份 | F122: 商业零售 | G122: 商场 | H122: 101.9 | I122: -6.7000000000000002e-003 | J122: 5.8999999999999999e-003 | K122: 6.83 | L122: -1.5e-003 | M122: 115.3 | N122: 7.01 | O122: 4.5999999999999999e-002 | P122: 97.43 | Q122: 转股中 | R122: 5.19年 | S122: 3.19年 | T122: 18 | U122: 8.9 | V122: 5.0000000000000001e-003 | W122: 0.30599999999999999 | X122: 0.29799999999999999 | Y122: 59 | Z122: 1.32 | AA122: 2.46e-002 | AB122: 1.9099999999999999e-002 | AC122: 5.6000000000000008e-003 | AD122: 3.3e-003 | AE122: 89.95 | AF122: 92.61 | AG122: 0.57 | AH122: AA | AI122: 4.41e-002 | AJ122: =H122+100*O122 -> 106.5 | AK122: 106.4 | AL122: 12 | AM122: 13.8 | AN122: 8 | AO122: -2.e-003 | AP122: 41 | AQ122: 利群转债!
A123: 95 | B123: 113594 | C123: 淳中转债! | D123: 603516 | E123: 淳中科技 | F123: 电子 | G123: 电子产品 | H123: 106.52 | I123: -7.0999999999999995e-003 | J123: -2.5000000000000001e-003 | K123: 30.01 | L123: -2.0899999999999998e-002 | M123: 121.4 | N123: 39.37 | O123: 0.39700000000000002 | P123: 76.23 | Q123: 5.1天 | R123: 5.49年 | S123: 3.49年 | T123: 3 | U123: 1.3 | V123: 4.0000000000000001e-003 | W123: 7.4999999999999997e-002 | X123: 5.7000000000000002e-002 | Y123: 40 | Z123: 4.45 | AA123: 2.46e-002 | AB123: 1.77e-002 | AC123: -5.1000000000000004e-003 | AD123: -7.4999999999999997e-003 | AE123: 80.22 | AF123: 81.93 | AG123: 0.46 | AH123: A+ | AI123: 7.6100000000000001e-002 | AJ123: =H123+100*O123 -> 146.22 | AK123: 136.8 | AL123: 204 | AM123: 54.9 | AN123: 246 | AO123: -3.7999999999999999e-002 | AP123: 7 | AQ123: 淳中转债!
A124: 173 | B124: 113564 | C124: 天目转债 | D124: 603136 | E124: 天目湖 | F124: 旅游餐饮 | G124: 旅游 | H124: 112.39 | I124: -9.1999999999999998e-003 | J124: 9.8999999999999991e-003 | K124: 21.18 | L124: 1.4000000000000002e-003 | M124: 126.7 | N124: 23.1 | O124: 0.22600000000000001 | P124: 91.69 | Q124: 转股中 | R124: 5年37天 | S124: 3年37天 | T124: 2.87 | U124: 7.9 | V124: 2.4e-002 | W124: 0.11599999999999999 | X124: 0.107 | Y124: 25 | Z124: 2.64 | AA124: 2.4300000000000002e-002 | AB124: 1.55e-002 | AC124: -2.2000000000000002e-002 | AD124: -2.46e-002 | AE124: 85.39 | AF124: 92.58 | AG124: 0.52 | AH124: AA- | AI124: 6.5099999999999991e-002 | AJ124: =H124+100*O124 -> 134.99000000000001 | AK124: 133.1 | AL124: 185 | AM124: 40.5 | AN124: 176 | AO124: -9.6999999999999989e-002 | AP124: 13 | AQ124: 天目转债
A125: 109 | B125: 123057 | C125: 美联转债 | D125: 300586 | E125: 美联新材 | F125: 化工 | G125: 橡胶塑料 | H125: 104.373 | I125: -5.4000000000000003e-003 | J125: 4.0000000000000002e-004 | K125: 8.35 | L125: -9.4999999999999998e-003 | M125: 118.2 | N125: 9.91 | O125: 0.23899999999999999 | P125: 84.26 | Q125: 转股中 | R125: 5.44年 | S125: 3.44年 | T125: 2.07 | U125: 37 | V125: 0.16800000000000001 | W125: 5.4000000000000006e-002 | X125: 4.5999999999999999e-002 | Y125: 38 | Z125: 5.12 | AA125: 2.3700000000000002e-002 | AB125: 1.7600000000000001e-002 | AC125: -7.000000000000001e-004 | AD125: -2.8999999999999998e-003 | AE125: 83.17 | AF125: 84.54 | AG125: 0.53 | AH125: AA- | AI125: 6.5099999999999991e-002 | AJ125: =H125+100*O125 -> 128.273 | AK125: 124.5 | AL125: 119 | AM125: 39.9 | AN125: 173 | AO125: -4.2999999999999997e-002 | AP125: 13 | AQ125: 美联转债
A126: 198 | B126: 128083 | C126: 新北转债! | D126: 2376. | E126: 新北洋 | F126: 电子 | G126: 电子产品 | H126: 102.799 | I126: -5.7999999999999996e-003 | J126: -3.0999999999999999e-003 | K126: 9.38 | L126: -2.6000000000000002e-002 | M126: 114.9 | N126: 11.7 | O126: 0.28199999999999997 | P126: 80.17 | Q126: 转股中 | R126: 4.89年 | S126: 2.89年 | T126: 8.77 | U126: 7 | V126: 8.0000000000000002e-003 | W126: 0.14000000000000001 | X126: 0.113 | Y126: 62 | Z126: 1.85 | AA126: 2.35e-002 | AB126: 1.78e-002 | AC126: 1.9e-003 | AD126: -2.9999999999999997e-004 | AE126: 91.19 | AF126: 94.15 | AG126: 0.34 | AH126: AA | AI126: 4.24e-002 | AJ126: =H126+100*O126 -> 130.999 | AK126: 125.4 | AL126: 128 | AM126: 31.3 | AN126: 111 | AO126: 1.e-002 | AP126: 19 | AQ126: 新北转债!
A127: 228 | B127: 128070 | C127: 智能转债! | D127: 2877. | E127: 智能自控 | F127: 机械装备 | G127: 通用设备 | H127: 106.8 | I127: -1.3999999999999999e-002 | J127: 5.6000000000000008e-003 | K127: 6.98 | L127: -2.3799999999999998e-002 | M127: 117.6 | N127: 9.51 | O127: 0.45500000000000002 | P127: 73.4 | Q127: 转股中 | R127: 4.44年 | S127: 无权 | T127: 2.3 | U127: 69 | V127: 0.27800000000000002 | W127: 9.9000000000000005e-002 | X127: 7.2999999999999995e-002 | Y127: 23 | Z127: 3.25 | AA127: 2.2499999999999999e-002 | AB127: 1.52e-002 | AC127: 无权 | AD127: 无权 | AE127: 无权 | AF127: 86.18 | AG127: 0.35 | AH127: A+ | AI127: 7.4400000000000008e-002 | AJ127: =H127+100*O127 -> 152.30000000000001 | AK127: 140.2 | AL127: 221 | AM127: 54 | AN127: 241 | AO127: -1.1000000000000001e-002 | AP127: 31 | AQ127: 智能转债!
A128: 127 | B128: 123053 | C128: 宝通转债! | D128: 300031 | E128: 宝通科技 | F128: 通信互联 | G128: 互联网 | H128: 108 | I128: -9.1999999999999998e-003 | J128: 6.0999999999999995e-003 | K128: 17.38 | L128: -6.3e-003 | M128: 121.3 | N128: 20.8 | O128: 0.29299999999999998 | P128: 83.56 | Q128: 转股中 | R128: 5.37年 | S128: 3.37年 | T128: 5 | U128: 2.8 | V128: 5.0000000000000001e-003 | W128: 7.2999999999999995e-002 | X128: 6.0999999999999999e-002 | Y128: 69 | Z128: 2.4 | AA128: 2.2400000000000003e-002 | AB128: 1.54e-002 | AC128: -1.0200000000000001e-002 | AD128: -1.24e-002 | AE128: 83.64 | AF128: 87.16 | AG128: 0.48 | AH128: AA- | AI128: 6.5099999999999991e-002 | AJ128: =H128+100*O128 -> 137.30000000000001 | AK128: 132.4 | AL128: 180 | AM128: 45.3 | AN128: 200 | AO128: -1.9e-002 | AP128: 8 | AQ128: 宝通转债!
A129: 257 | B129: 110053 | C129: 苏银转债! | D129: 600919 | E129: 江苏银行 | F129: 金融 | G129: 银行行业 | H129: 109.02 | I129: -8.8999999999999999e-003 | J129: 4.1999999999999997e-003 | K129: 5.44 | L129: -1.6299999999999999e-002 | M129: 119.1 | N129: 6.69 | O129: 0.34100000000000003 | P129: 81.32 | Q129: 转股中 | R129: 4年51天 | S129: 无权 | T129: 200 | U129: 72 | V129: 3.0000000000000001e-003 | W129: 0.249 | X129: 0.20199999999999999 | Y129: 803 | Z129: 0.53 | AA129: 2.23e-002 | AB129: 1.3899999999999999e-002 | AC129: 无权 | AD129: 无权 | AE129: 无权 | AF129: 102.82 | AG129: 0.29 | AH129: AAA | AI129: 3.7400000000000003e-002 | AJ129: =H129+100*O129 -> 143.12 | AK129: 136.7 | AL129: 203 | AM129: 33.9 | AN129: 140 | AO129: 1.e-003 | AP129: 46 | AQ129: 苏银转债!
A130: 77 | B130: 127021 | C130: 特发转2! | D130: 70. | E130: 特发信息 | F130: 通信互联 | G130: 通信设备 | H130: 102.679 | I130: 8.9999999999999998e-004 | J130: -7.0999999999999995e-003 | K130: 8.33 | L130: -3.5900000000000001e-002 | M130: 113.3 | N130: 12.33 | O130: 0.52000000000000002 | P130: 67.56 | Q130: 22天 | R130: 4.54年 | S130: 2.54年 | T130: 5.5 | U130: 2.2 | V130: 4.0000000000000001e-003 | W130: 8.1000000000000003e-002 | X130: 5.5e-002 | Y130: 68 | Z130: 2.4 | AA130: 2.2200000000000001e-002 | AB130: 1.67e-002 | AC130: -2.3e-003 | AD130: -3.8e-003 | AE130: 91.26 | AF130: 94.05 | AG130: 0.17 | AH130: AA | AI130: 4.24e-002 | AJ130: =H130+100*O130 -> 154.679 | AK130: 137.8 | AL130: 208 | AM130: 43.8 | AN130: 193 | AO130: -7.2999999999999995e-002 | AP130: 8 | AQ130: 特发转2!
A131: 131 | B131: 123051 | C131: 今天转债 | D131: 300532 | E131: 今天国际 | F131: 计算机及 | G131: 软件开发 | H131: 109.5 | I131: -1.01e-002 | J131: -3.2000000000000002e-003 | K131: 9.26 | L131: -1.8000000000000002e-002 | M131: 122.8 | N131: 8.8 | O131: 4.0999999999999995e-002 | P131: 105.23 | Q131: 转股中 | R131: 5.36年 | S131: 3.36年 | T131: 2.8 | U131: 10 | V131: 3.4000000000000002e-002 | W131: 0.111 | X131: 0.11599999999999999 | Y131: 25 | Z131: 3.18 | AA131: 2.2099999999999998e-002 | AB131: 1.47e-002 | AC131: -1.2699999999999999e-002 | AD131: -1.52e-002 | AE131: 81.12 | AF131: 83.69 | AG131: 0.74 | AH131: A+ | AI131: 7.6100000000000001e-002 | AJ131: =H131+100*O131 -> 113.59999999999999 | AK131: 113.8 | AL131: 43 | AM131: 30.1 | AN131: 105 | AO131: -6.9999999999999993e-003 | AP131: 14 | AQ131: 今天转债
A132: 157 | B132: 110068 | C132: 龙净转债! | D132: 600388 | E132: 龙净环保 | F132: 城市公用 | G132: 三废处理 | H132: 103.23 | I132: -6.4000000000000003e-003 | J132: -2.2000000000000001e-003 | K132: 8.59 | L132: -2.3900000000000001e-002 | M132: 115 | N132: 10.73 | O132: 0.28899999999999998 | P132: 80.06 | Q132: 转股中 | R132: 5.17年 | S132: 3.17年 | T132: 20 | U132: 9.3 | V132: 4.0000000000000001e-003 | W132: 0.218 | X132: 0.17399999999999999 | Y132: 92 | Z132: 1.59 | AA132: 2.1499999999999998e-002 | AB132: 1.61e-002 | AC132: 8.0000000000000004e-004 | AD132: -1.2999999999999999e-003 | AE132: 90.31 | AF132: 93.3 | AG132: 0.36 | AH132: AA+ | AI132: 4.2099999999999999e-002 | AJ132: =H132+100*O132 -> 132.13 | AK132: 126.4 | AL132: 135 | AM132: 33.1 | AN132: 132 | AO132: -2.4e-002 | AP132: 30 | AQ132: 龙净转债!
A133: 43 | B133: 113606 | C133: 荣泰转债 | D133: 603579 | E133: 荣泰健康 | F133: 机械装备 | G133: 专用设备 | H133: 107.6 | I133: -5.1000000000000004e-003 | J133: -3.9000000000000003e-003 | K133: 28.24 | L133: -1.7100000000000001e-002 | M133: 121.2 | N133: 33.32 | O133: 0.27000000000000002 | P133: 84.75 | Q133: 3月13天 | R133: 5.77年 | S133: 3.77年 | T133: 6 | U133: 2.9 | V133: 4.0000000000000001e-003 | W133: 0.152 | X133: 0.129 | Y133: 40 | Z133: 2.5 | AA133: 2.1299999999999999e-002 | AB133: 1.4800000000000001e-002 | AC133: -8.3999999999999995e-003 | AD133: -1.04e-002 | AE133: 81.45 | AF133: 84.88 | AG133: 0.53 | AH133: AA- | AI133: 6.5099999999999991e-002 | AJ133: =H133+100*O133 -> 134.59999999999999 | AK133: 130.4 | AL133: 171 | AM133: 45.6 | AN133: 201 | AO133: -4.4999999999999998e-002 | AP133: 7 | AQ133: 荣泰转债
A134: 174 | B134: 113565 | C134: 宏辉转债 | D134: 603336 | E134: 宏辉果蔬 | F134: 农业 | G134: 农产品加 | H134: 106.46 | I134: -1.3600000000000001e-002 | J134: -7.0999999999999995e-003 | K134: 9.46 | L134: -3.27e-002 | M134: 118.2 | N134: 10 | O134: 0.125 | P134: 94.6 | Q134: 转股中 | R134: 5年35天 | S134: 3年35天 | T134: 2.26 | U134: 14 | V134: 5.7999999999999996e-002 | W134: 7.0999999999999994e-002 | X134: 6.7000000000000004e-002 | Y134: 32 | Z134: 3.36 | AA134: 2.12e-002 | AB134: 1.4800000000000001e-002 | AC134: -6.8999999999999999e-003 | AD134: -9.300000000000001e-003 | AE134: 85 | AF134: 86.39 | AG134: 0.63 | AH134: AA- | AI134: 6.5099999999999991e-002 | AJ134: =H134+100*O134 -> 118.95999999999999 | AK134: 118.3 | AL134: 66 | AM134: 31.9 | AN134: 122 | AO134: -8.199999999999999e-002 | AP134: 23 | AQ134: 宏辉转债
A135: 179 | B135: 128094 | C135: 星帅转债 | D135: 2860. | E135: 星帅尔 | F135: 家电 | G135: 零部件制 | H135: 109.3 | I135: -1.e-003 | J135: 1.5e-003 | K135: 14.55 | L135: 7.000000000000001e-004 | M135: 121 | N135: 13.95 | O135: 4.8000000000000001e-002 | P135: 104.3 | Q135: 转股中 | R135: 4.98年 | S135: 2.98年 | T135: 2.8 | U135: 5.4 | V135: 1.8000000000000002e-002 | W135: 9.6999999999999989e-002 | X135: 0.10099999999999999 | Y135: 29 | Z135: 3.11 | AA135: 2.1000000000000001e-002 | AB135: 1.3600000000000001e-002 | AC135: -1.5600000000000001e-002 | AD135: -1.8000000000000002e-002 | AE135: 83.22 | AF135: 85.28 | AG135: 0.73 | AH135: A+ | AI135: 7.4400000000000008e-002 | AJ135: =H135+100*O135 -> 114.09999999999999 | AK135: 114.3 | AL135: 45 | AM135: 29 | AN135: 98 | AO135: -2.5000000000000001e-002 | AP135: 34 | AQ135: 星帅转债
A136: 18 | B136: 127026 | C136: 超声转债 | D136: 823. | E136: 超声电子 | F136: 电子 | G136: 元器件制 | H136: 100.5 | I136: -1.78e-002 | J136: 1.6000000000000001e-003 | K136: 10.95 | L136: -3.3500000000000002e-002 | M136: 113.1 | N136: 12.85 | O136: 0.17899999999999999 | P136: 85.21 | Q136: 4月23天 | R136: 5.88年 | S136: 3.88年 | T136: 7 | U136: 35 | V136: 5.0000000000000003e-002 | W136: 0.11900000000000001 | X136: 0.10099999999999999 | Y136: 59 | Z136: 1.6 | AA136: 2.07e-002 | AB136: 1.6500000000000001e-002 | AC136: 7.6e-003 | AD136: 5.7999999999999996e-003 | AE136: 87.13 | AF136: 88.16 | AG136: 0.48 | AH136: AA | AI136: 4.41e-002 | AJ136: =H136+100*O136 -> 118.40000000000001 | AK136: 115.8 | AL136: 52 | AM136: 27.6 | AN136: 92 | AO136: -3.1e-002 | AP136: 3 | AQ136: 超声转债
A137: 90 | B137: 128122 | C137: 兴森转债 | D137: 2436. | E137: 兴森科技 | F137: 电子 | G137: 元器件制 | H137: 103.555 | I137: -1.09e-002 | J137: 5.6999999999999993e-003 | K137: 9.67 | L137: -2.9100000000000001e-002 | M137: 113.3 | N137: 14.18 | O137: 0.51900000000000002 | P137: 68.19 | Q137: 7天 | R137: 4.50年 | S137: 3.50年 | T137: 2.69 | U137: 3 | V137: 1.1000000000000001e-002 | W137: 1.9e-002 | X137: 1.3000000000000001e-002 | Y137: 144 | Z137: 4.55 | AA137: 2.0400000000000001e-002 | AB137: 1.4999999999999999e-002 | AC137: 2.0000000000000001e-004 | AD137: -1.7000000000000001e-003 | AE137: 89.12 | AF137: 94.21 | AG137: 0.18 | AH137: AA | AI137: 4.24e-002 | AJ137: =H137+100*O137 -> 155.45500000000001 | AK137: 138.9 | AL137: 217 | AM137: 44.7 | AN137: 197 | AO137: 1.e-003 | AP137: 10 | AQ137: 兴森转债
A138: 12 | B138: 113044 | C138: 大秦转债! | D138: 601006 | E138: 大秦铁路 | F138: 铁路 | G138: 铁路运输 | H138: 101.72 | I138: -4.1999999999999997e-003 | J138: -1.1999999999999999e-003 | K138: 6.48 | L138: -1.2199999999999999e-002 | M138: 114.1 | N138: 7.66 | O138: 0.20199999999999999 | P138: 84.6 | Q138: 4月27天 | R138: 5.89年 | S138: 3.89年 | T138: 320 | U138: 539 | V138: 1.7000000000000001e-002 | W138: 0.33200000000000002 | X138: 0.28100000000000003 | Y138: 963 | Z138: 0.83 | AA138: 2.e-002 | AB138: 1.5600000000000001e-002 | AC138: 5.4000000000000003e-003 | AD138: 3.4999999999999996e-003 | AE138: 89.05 | AF138: 91.4 | AG138: 0.44 | AH138: AAA | AI138: 3.9100000000000003e-002 | AJ138: =H138+100*O138 -> 121.92 | AK138: 118.8 | AL138: 72 | AM138: 27.4 | AN138: 89 | AO138: -6.0000000000000001e-003 | AP138: 7 | AQ138: 大秦转债!
A139: 128 | B139: 123052 | C139: 飞鹿转债 | D139: 300665 | E139: 飞鹿股份 | F139: 化工 | G139: 化工 | H139: 115.01 | I139: -1.9900000000000001e-002 | J139: -4.0000000000000002e-004 | K139: 10.35 | L139: -2.9100000000000001e-002 | M139: 127.3 | N139: 9.9 | O139: 0.10000000000000001 | P139: 104.55 | Q139: 转股中 | R139: 5.37年 | S139: 3.37年 | T139: 1.77 | U139: 25 | V139: 0.122 | W139: 0.14099999999999999 | X139: 0.14699999999999999 | Y139: 13 | Z139: 2.67 | AA139: 1.9599999999999999e-002 | AB139: 1.1000000000000001e-002 | AC139: -2.52e-002 | AD139: -2.7900000000000001e-002 | AE139: 81.51 | AF139: 86.78 | AG139: 0.7 | AH139: A+ | AI139: 7.6100000000000001e-002 | AJ139: =H139+100*O139 -> 125.01000000000001 | AK139: 125.5 | AL139: 129 | AM139: 38.7 | AN139: 163 | AO139: -2.2000000000000002e-002 | AP139: 13 | AQ139: 飞鹿转债
A140: 41 | B140: 123075 | C140: 贝斯转债! | D140: 300580 | E140: 贝斯特 | F140: 汽车 | G140: 零部件制 | H140: 103.8 | I140: -2.5399999999999999e-002 | J140: 1.9e-002 | K140: 18.66 | L140: -1.32e-002 | M140: 115.5 | N140: 23.99 | O140: 0.33399999999999996 | P140: 77.78 | Q140: 3月14天 | R140: 5.78年 | S140: 3.78年 | T140: 6 | U140: 7.9 | V140: 1.3000000000000001e-002 | W140: 0.161 | X140: 0.125 | Y140: 37 | Z140: 2.32 | AA140: 1.9e-002 | AB140: 1.41e-002 | AC140: 1.e-004 | AD140: -1.8e-003 | AE140: 81.16 | AF140: 80.81 | AG140: 0.48 | AH140: AA- | AI140: 6.5099999999999991e-002 | AJ140: =H140+100*O140 -> 137.19999999999999 | AK140: 129.8 | AL140: 166 | AM140: 48.7 | AN140: 216 | AO140: -3.6000000000000004e-002 | AP140: 3 | AQ140: 贝斯转债!
A141: 55 | B141: 123068 | C141: 弘信转债 | D141: 300657 | E141: 弘信电子 | F141: 电子 | G141: 元器件制 | H141: 109.353 | I141: -1.7500000000000002e-002 | J141: 1.4000000000000002e-003 | K141: 17.12 | L141: -2.6200000000000001e-002 | M141: 121.2 | N141: 18.45 | O141: 0.17800000000000002 | P141: 92.79 | Q141: 2月29天 | R141: 5.73年 | S141: 3.73年 | T141: 5.7 | U141: 11 | V141: 1.8000000000000002e-002 | W141: 9.6999999999999989e-002 | X141: 8.9999999999999997e-002 | Y141: 59 | Z141: 4 | AA141: 1.8500000000000003e-002 | AB141: 1.2e-002 | AC141: -1.26e-002 | AD141: -1.46e-002 | AE141: 81.66 | AF141: 85.1 | AG141: 0.61 | AH141: AA- | AI141: 6.5099999999999991e-002 | AJ141: =H141+100*O141 -> 127.15299999999999 | AK141: 125.9 | AL141: 133 | AM141: 40.8 | AN141: 182 | AO141: 5.7000000000000002e-002 | AP141: 5 | AQ141: 弘信转债
A142: 64 | B142: 128131 | C142: 崇达转2! | D142: 2815. | E142: 崇达技术 | F142: 电子 | G142: 元器件制 | H142: 104.38 | I142: -1.2500000000000001e-002 | J142: 5.5000000000000005e-003 | K142: 13.45 | L142: -2.9600000000000001e-002 | M142: 115.2 | N142: 19.54 | O142: 0.51600000000000001 | P142: 68.83 | Q142: 48天 | R142: 5.62年 | S142: 3.62年 | T142: 14 | U142: 6.5 | V142: 4.0000000000000001e-003 | W142: 0.11800000000000001 | X142: 8.1000000000000003e-002 | Y142: 119 | Z142: 2.97 | AA142: 1.8000000000000002e-002 | AB142: 1.3100000000000001e-002 | AC142: -1.7000000000000001e-003 | AD142: -3.5999999999999999e-003 | AE142: 88.18 | AF142: 90.78 | AG142: 0.23 | AH142: AA | AI142: 4.41e-002 | AJ142: =H142+100*O142 -> 155.97999999999999 | AK142: 139.9 | AL142: 218 | AM142: 49.1 | AN142: 218 | AO142: -4.0000000000000001e-002 | AP142: 5 | AQ142: 崇达转2!
A143: 254 | B143: 110056 | C143: 亨通转债! | D143: 600487 | E143: 亨通光电 | F143: 通信互联 | G143: 通信设备 | H143: 106.8 | I143: -1.4800000000000001e-002 | J143: 6.8999999999999999e-003 | K143: 13.41 | L143: -1.9e-002 | M143: 114.8 | N143: 15.01 | O143: 0.19500000000000001 | P143: 89.34 | Q143: 转股中 | R143: 4年56天 | S143: 2年56天 | T143: 17.1 | U143: 2.6 | V143: 1.e-003 | W143: 5.4000000000000006e-002 | X143: 4.8000000000000001e-002 | Y143: 317 | Z143: 1.74 | AA143: 1.7899999999999999e-002 | AB143: 1.1399999999999999e-002 | AC143: -1.44e-002 | AD143: -1.7100000000000001e-002 | AE143: 94.32 | AF143: 97.72 | AG143: 0.41 | AH143: AA+ | AI143: 4.0399999999999998e-002 | AJ143: =H143+100*O143 -> 126.3 | AK143: 124.3 | AL143: 116 | AM143: 26.5 | AN143: 80 | AO143: -3.4000000000000002e-002 | AP143: 31 | AQ143: 亨通转债!
A144: 108 | B144: 128117 | C144: 道恩转债 | D144: 2838. | E144: 道恩股份 | F144: 化工 | G144: 橡胶塑料 | H144: 112.37 | I144: 8.0000000000000004e-004 | J144: 1.1999999999999999e-003 | K144: 28.36 | L144: 3.2000000000000002e-003 | M144: 123.5 | N144: 29.03 | O144: 0.14999999999999999 | P144: 97.69 | Q144: 转股中 | R144: 5.44年 | S144: 3.44年 | T144: 3.6 | U144: 69 | V144: 0.17000000000000001 | W144: 3.1e-002 | X144: 2.9999999999999999e-002 | Y144: 116 | Z144: 6.71 | AA144: 1.78e-002 | AB144: 1.04e-002 | AC144: -2.1899999999999999e-002 | AD144: -2.3799999999999998e-002 | AE144: 82.9 | AF144: 88.22 | AG144: 0.63 | AH144: AA- | AI144: 6.5099999999999991e-002 | AJ144: =H144+100*O144 -> 127.37 | AK144: 127 | AL144: 141 | AM144: 38.8 | AN144: 166 | AO144: 6.0999999999999999e-002 | AP144: 18 | AQ144: 道恩转债
A145: 190 | B145: 113559 | C145: 永创转债! | D145: 603901 | E145: 永创智能 | F145: 机械装备 | G145: 专用设备 | H145: 108.78 | I145: 1.6500000000000001e-002 | J145: 5.6999999999999993e-003 | K145: 9.29 | L145: 4.0300000000000002e-002 | M145: 118.3 | N145: 10.32 | O145: 0.20800000000000002 | P145: 90.02 | Q145: 转股中 | R145: 4.92年 | S145: 2.92年 | T145: 5.1 | U145: 4.9 | V145: 9.0000000000000011e-003 | W145: 0.125 | X145: 0.11199999999999999 | Y145: 41 | Z145: 2.95 | AA145: 1.7600000000000001e-002 | AB145: 1.09e-002 | AC145: -1.34e-002 | AD145: -1.61e-002 | AE145: 86.55 | AF145: 88.08 | AG145: 0.55 | AH145: AA- | AI145: 6.3399999999999998e-002 | AJ145: =H145+100*O145 -> 129.58000000000001 | AK145: 127.5 | AL145: 144 | AM145: 39.5 | AN145: 171 | AO145: 7.2999999999999995e-002 | AP145: 22 | AQ145: 永创转债!
A146: 197 | B146: 110063 | C146: 鹰19转债 | D146: 600567 | E146: 山鹰国际 | F146: 造纸包装 | G146: 包装用纸 | H146: 106.8 | I146: -1.8799999999999997e-002 | J146: 1.09e-002 | K146: 3.11 | L146: -1.5800000000000002e-002 | M146: 115.9 | N146: 3.3 | O146: 0.13300000000000001 | P146: 94.24 | Q146: 转股中 | R146: 4.89年 | S146: 2.89年 | T146: 18.6 | U146: 22 | V146: 1.1000000000000001e-002 | W146: 0.13 | X146: 0.12300000000000001 | Y146: 143 | Z146: 0.97 | AA146: 1.72e-002 | AB146: 1.1200000000000002e-002 | AC146: -1.11e-002 | AD146: -1.32e-002 | AE146: 91.55 | AF146: 95.81 | AG146: 0.5 | AH146: AA+ | AI146: 4.0399999999999998e-002 | AJ146: =H146+100*O146 -> 120.09999999999999 | AK146: 119.4 | AL146: 75 | AM146: 23.5 | AN146: 54 | AO146: -6.9999999999999993e-003 | AP146: 41 | AQ146: 鹰19转债
A147: 244 | B147: 128064 | C147: 司尔转债! | D147: 2538. | E147: 司尔特 | F147: 化工 | G147: 农化 | H147: 107.2 | I147: -1.6500000000000001e-002 | J147: 9.300000000000001e-003 | K147: 5.54 | L147: -1.6e-002 | M147: 114.9 | N147: 6.07 | O147: 0.17499999999999999 | P147: 91.27 | Q147: 转股中 | R147: 4.21年 | S147: 2.21年 | T147: 8 | U147: 2.3 | V147: 3.0000000000000001e-003 | W147: 0.20100000000000001 | X147: 0.184 | Y147: 40 | Z147: 1.04 | AA147: 1.7000000000000001e-002 | AB147: 1.0500000000000001e-002 | AC147: -1.52e-002 | AD147: -1.8000000000000002e-002 | AE147: 93.8 | AF147: 96.84 | AG147: 0.45 | AH147: AA | AI147: 4.24e-002 | AJ147: =H147+100*O147 -> 124.7 | AK147: 123.1 | AL147: 109 | AM147: 26.3 | AN147: 76 | AO147: -3.9e-002 | AP147: 55 | AQ147: 司尔转债!
A148: 84 | B148: 123063 | C148: 大禹转债 | D148: 300021 | E148: 大禹节水 | F148: 化工 | G148: 橡胶塑料 | H148: 115.6 | I148: -2.5999999999999999e-003 | J148: 6.6e-003 | K148: 5.05 | L148: 6.0000000000000001e-003 | M148: 126.5 | N148: 4.94 | O148: 0.13100000000000001 | P148: 102.23 | Q148: 12天 | R148: 5.51年 | S148: 4.51年 | T148: 6.38 | U148: 9.6 | V148: 1.3000000000000001e-002 | W148: 0.158 | X148: 0.16200000000000001 | Y148: 40 | Z148: 2.79 | AA148: 1.6799999999999999e-002 | AB148: 8.8000000000000005e-003 | AC148: -1.67e-002 | AD148: -1.9400000000000001e-002 | AE148: 80.08 | AF148: 90.03 | AG148: 0.67 | AH148: AA- | AI148: 6.5099999999999991e-002 | AJ148: =H148+100*O148 -> 128.69999999999999 | AK148: 129 | AL148: 159 | AM148: 38.9 | AN148: 168 | AO148: -1.6e-002 | AP148: 15 | AQ148: 大禹转债
A149: 22 | B149: 123081 | C149: 精研转债! | D149: 300709 | E149: 精研科技 | F149: 电子 | G149: 电子产品 | H149: 110.2 | I149: -2.3900000000000001e-002 | J149: -1.8200000000000001e-002 | K149: 48.35 | L149: -0.10199999999999999 | M149: 121.3 | N149: 64.28 | O149: 0.46500000000000002 | P149: 75.22 | Q149: 4月18天 | R149: 5.86年 | S149: 3.86年 | T149: 5.7 | U149: 10 | V149: 1.6e-002 | W149: 0.10199999999999999 | X149: 7.6999999999999999e-002 | Y149: 56 | Z149: 3.71 | AA149: 1.6799999999999999e-002 | AB149: 1.0500000000000001e-002 | AC149: -1.3899999999999999e-002 | AD149: -1.5900000000000001e-002 | AE149: 81.02 | AF149: 84.44 | AG149: 0.41 | AH149: AA- | AI149: 6.5099999999999991e-002 | AJ149: =H149+100*O149 -> 156.69999999999999 | AK149: 145.2 | AL149: 237 | AM149: 60.7 | AN149: 260 | AO149: -7.9000000000000001e-002 | AP149: 3 | AQ149: 精研转债!
A150: 188 | B150: 113030 | C150: 东风转债! | D150: 601515 | E150: 东风股份 | F150: 造纸包装 | G150: 包装材料 | H150: 108.06 | I150: 2.5399999999999999e-002 | J150: 2.5099999999999997e-002 | K150: 6.35 | L150: 0.10099999999999999 | M150: 116.9 | N150: 6.75 | O150: 0.14899999999999999 | P150: 94.07 | Q150: 转股中 | R150: 4.92年 | S150: 2.92年 | T150: 2.95 | U150: 212 | V150: 0.64700000000000002 | W150: 3.5000000000000003e-002 | X150: 3.3000000000000002e-002 | Y150: 85 | Z150: 2.03 | AA150: 1.6399999999999998e-002 | AB150: 1.0200000000000001e-002 | AC150: -1.43e-002 | AD150: -1.6399999999999998e-002 | AE150: 91.06 | AF150: 95.65 | AG150: 0.5 | AH150: AA | AI150: 4.24e-002 | AJ150: =H150+100*O150 -> 122.96000000000001 | AK150: 122 | AL150: 99 | AM150: 26.4 | AN150: 78 | AO150: 0.14000000000000001 | AP150: 17 | AQ150: 东风转债!
A151: 139 | B151: 128107 | C151: 交科转债 | D151: 2061. | E151: 浙江交科 | F151: 建筑 | G151: 建筑工程 | H151: 106.225 | I151: -1.e-002 | J151: 4.8999999999999998e-003 | K151: 5.04 | L151: -9.7999999999999997e-003 | M151: 115.3 | N151: 5.36 | O151: 0.13 | P151: 94.03 | Q151: 转股中 | R151: 5.25年 | S151: 3.25年 | T151: 25 | U151: 8.2 | V151: 3.0000000000000001e-003 | W151: 0.36099999999999999 | X151: 0.33899999999999997 | Y151: 69 | Z151: 0.87 | AA151: 1.61e-002 | AB151: 1.0700000000000001e-002 | AC151: -6.8000000000000005e-003 | AD151: -9.0000000000000011e-003 | AE151: 90.31 | AF151: 93.29 | AG151: 0.53 | AH151: AA+ | AI151: 4.2099999999999999e-002 | AJ151: =H151+100*O151 -> 119.22499999999999 | AK151: 118.4 | AL151: 67 | AM151: 25.1 | AN151: 63 | AO151: -1.7000000000000001e-002 | AP151: 16 | AQ151: 交科转债
A152: 88 | B152: 128123 | C152: 国光转债! | D152: 2749. | E152: 国光股份 | F152: 化工 | G152: 农化 | H152: 106.8 | I152: -1.1999999999999999e-003 | J152: 8.3999999999999995e-003 | K152: 10.88 | L152: 1.49e-002 | M152: 116.2 | N152: 13.7 | O152: 0.34499999999999997 | P152: 79.42 | Q152: 10天 | R152: 5.51年 | S152: 3.51年 | T152: 3.2 | U152: 3 | V152: 9.0000000000000011e-003 | W152: 6.8000000000000005e-002 | X152: 5.4000000000000006e-002 | Y152: 47 | Z152: 3.81 | AA152: 1.5800000000000002e-002 | AB152: 1.04e-002 | AC152: -6.9999999999999993e-003 | AD152: -9.1000000000000004e-003 | AE152: 82.8 | AF152: 82.75 | AG152: 0.48 | AH152: AA- | AI152: 6.5099999999999991e-002 | AJ152: =H152+100*O152 -> 141.30000000000001 | AK152: 134.2 | AL152: 189 | AM152: 51.4 | AN152: 223 | AO152: 3.5000000000000003e-002 | AP152: 9 | AQ152: 国光转债!
A153: 129 | B153: 113584 | C153: 家悦转债! | D153: 603708 | E153: 家家悦 | F153: 商业零售 | G153: 超市 | H153: 106.26 | I153: -3.8e-003 | J153: 1.7000000000000001e-003 | K153: 22.13 | L153: -1.8600000000000002e-002 | M153: 115.3 | N153: 37.97 | O153: 0.82299999999999995 | P153: 58.28 | Q153: 转股中 | R153: 5.37年 | S153: 3.37年 | T153: 6.45 | U153: 1.6 | V153: 2.e-003 | W153: 4.8000000000000001e-002 | X153: 2.7999999999999997e-002 | Y153: 135 | Z153: 4.49 | AA153: 1.5600000000000001e-002 | AB153: 1.04e-002 | AC153: -6.7000000000000002e-003 | AD153: -8.6999999999999994e-003 | AE153: 89.26 | AF153: 91.9 | AG153: 0.11 | AH153: AA | AI153: 4.41e-002 | AJ153: =H153+100*O153 -> 188.56 | AK153: 154.2 | AL153: 266 | AM153: 62.3 | AN153: 264 | AO153: 1.2e-002 | AP153: 7 | AQ153: 家悦转债!
A154: 296 | B154: 128039 | C154: 三力转债! | D154: 2224. | E154: 三 力 士 | F154: 机械装备 | G154: 专用设备 | H154: 104.391 | I154: -1.3300000000000001e-002 | J154: 5.1999999999999998e-003 | K154: 5.46 | L154: -1.44e-002 | M154: 109.8 | N154: 5.81 | O154: 0.111 | P154: 93.98 | Q154: 转股中 | R154: 3.38年 | S154: 1.38年 | T154: 2.03 | U154: 6.6 | V154: 3.1e-002 | W154: 5.0999999999999997e-002 | X154: 4.8000000000000001e-002 | Y154: 40 | Z154: 1.7 | AA154: 1.54e-002 | AB154: 9.7999999999999997e-003 | AC154: -1.1599999999999999e-002 | AD154: -1.4800000000000001e-002 | AE154: 93.36 | AF154: 89.59 | AG154: 0.56 | AH154: AA- | AI154: 6.3399999999999998e-002 | AJ154: =H154+100*O154 -> 115.491 | AK154: 114.8 | AL154: 48 | AM154: 21.5 | AN154: 35 | AO154: -2.7999999999999997e-002 | AP154: 24 | AQ154: 三力转债!
A155: 224 | B155: 128071 | C155: 合兴转债! | D155: 2228. | E155: 合兴包装 | F155: 造纸包装 | G155: 包装材料 | H155: 107.42 | I155: -1.1000000000000001e-002 | J155: 9.7999999999999997e-003 | K155: 3.99 | L155: -2.5000000000000001e-003 | M155: 114.8 | N155: 4.28 | O155: 0.152 | P155: 93.22 | Q155: 转股中 | R155: 4.56年 | S155: 2.56年 | T155: 3 | U155: 10 | V155: 3.2000000000000001e-002 | W155: 6.0999999999999999e-002 | X155: 5.7000000000000002e-002 | Y155: 49 | Z155: 1.48 | AA155: 1.49e-002 | AB155: 9.0000000000000011e-003 | AC155: -1.43e-002 | AD155: -1.66e-002 | AE155: 92.32 | AF155: 95.32 | AG155: 0.5 | AH155: AA | AI155: 4.24e-002 | AJ155: =H155+100*O155 -> 122.62 | AK155: 121.6 | AL155: 90 | AM155: 26.3 | AN155: 77 | AO155: -1.2e-002 | AP155: 26 | AQ155: 合兴转债!
A156: 91 | B156: 113037 | C156: 紫银转债 | D156: 601860 | E156: 紫金银行 | F156: 金融 | G156: 银行行业 | H156: 106.95 | I156: -1.e-002 | J156: 2.5999999999999999e-003 | K156: 4.05 | L156: -1.7000000000000001e-002 | M156: 115.8 | N156: 4.75 | O156: 0.254 | P156: 85.26 | Q156: 7天 | R156: 5.50年 | S156: 无权 | T156: 45 | U156: 19 | V156: 4.0000000000000001e-003 | W156: 0.30399999999999999 | X156: 0.25900000000000001 | Y156: 148 | Z156: 1.05 | AA156: 1.49e-002 | AB156: 9.5999999999999992e-003 | AC156: 无权 | AD156: 无权 | AE156: 无权 | AF156: 92.73 | AG156: 0.43 | AH156: AA+ | AI156: 4.2099999999999999e-002 | AJ156: =H156+100*O156 -> 132.34999999999999 | AK156: 128.6 | AL156: 155 | AM156: 35.9 | AN156: 148 | AO156: -1.6e-002 | AP156: 18 | AQ156: 紫银转债
A157: 323 | B157: 110038 | C157: 济川转债! | D157: 600566 | E157: 济川药业 | F157: 医药 | G157: 中药 | H157: 104.7 | I157: -8.6e-003 | J157: 9.1999999999999998e-003 | K157: 19.97 | L157: 3.0000000000000001e-003 | M157: 107.5 | N157: 23.85 | O157: 0.25 | P157: 83.73 | Q157: 转股中 | R157: 1.81年 | S157: 回售中 | T157: 6.28 | U157: 2.3 | V157: 3.0000000000000001e-003 | W157: 3.5000000000000003e-002 | X157: 2.9999999999999999e-002 | Y157: 177 | Z157: 2.42 | AA157: 1.4800000000000001e-002 | AB157: 6.8999999999999999e-003 | AC157: 回售中 | AD157: 回售中 | AE157: 100.25 | AF157: 100.09 | AG157: 0.19 | AH157: AA | AI157: 4.0599999999999997e-002 | AJ157: =H157+100*O157 -> 129.69999999999999 | AK157: 125.7 | AL157: 131 | AM157: 25.4 | AN157: 70 | AO157: -1.e-002 | AP157: 22 | AQ157: 济川转债!
A158: 301 | B158: 127006 | C158: 敖东转债! | D158: 623. | E158: 吉林敖东 | F158: 金融 | G158: 证券行业 | H158: 103.388 | I158: -7.7000000000000002e-003 | J158: 3.0000000000000001e-003 | K158: 16.06 | L158: -2.07e-002 | M158: 108 | N158: 20.42 | O158: 0.315 | P158: 78.65 | Q158: 转股中 | R158: 3年50天 | S158: 1年50天 | T158: 24.1 | U158: 5.2 | V158: 2.e-003 | W158: 0.129 | X158: 0.10099999999999999 | Y158: 187 | Z158: 0.82 | AA158: 1.4199999999999999e-002 | AB158: 9.300000000000001e-003 | AC158: -1.29e-002 | AD158: -1.54e-002 | AE158: 96.58 | AF158: 95.55 | AG158: 0.23 | AH158: AA+ | AI158: 4.0399999999999998e-002 | AJ158: =H158+100*O158 -> 134.88800000000001 | AK158: 128.1 | AL158: 150 | AM158: 31.5 | AN158: 117 | AO158: -1.4999999999999999e-002 | AP158: 27 | AQ158: 敖东转债!
A159: 295 | B159: 128040 | C159: 华通转债! | D159: 2758. | E159: 浙农股份 | F159: 医药 | G159: 医药商业 | H159: 107.378 | I159: -9.7999999999999997e-003 | J159: 4.7999999999999996e-003 | K159: 10.72 | L159: -7.4000000000000003e-003 | M159: 112.3 | N159: 10.33 | O159: 3.5000000000000003e-002 | P159: 103.78 | Q159: 转股中 | R159: 3.39年 | S159: 1.39年 | T159: 2.22 | U159: 5 | V159: 2.1000000000000001e-002 | W159: 4.2000000000000003e-002 | X159: 4.4000000000000004e-002 | Y159: 52 | Z159: 3.55 | AA159: 1.3600000000000001e-002 | AB159: 6.8000000000000005e-003 | AC159: -2.7799999999999998e-002 | AD159: -3.1200000000000002e-002 | AE159: 93.49 | AF159: 91.57 | AG159: 0.67 | AH159: AA- | AI159: 6.3399999999999998e-002 | AJ159: =H159+100*O159 -> 110.878 | AK159: 111 | AL159: 29 | AM159: 17.5 | AN159: 17 | AO159: -5.4000000000000006e-002 | AP159: 31 | AQ159: 华通转债!
A160: 284 | B160: 113516 | C160: 苏农转债! | D160: 603323 | E160: 苏农银行 | F160: 金融 | G160: 银行行业 | H160: 109.12 | I160: -1.2e-002 | J160: 3.5999999999999999e-003 | K160: 4.75 | L160: -2.46e-002 | M160: 114.3 | N160: 5.52 | O160: 0.26800000000000002 | P160: 86.05 | Q160: 转股中 | R160: 3.53年 | S160: 无权 | T160: 12.9 | U160: 0.8 | V160: 1.e-003 | W160: 0.151 | X160: 0.13 | Y160: 86 | Z160: 0.72 | AA160: 1.3500000000000002e-002 | AB160: 6.0999999999999995e-003 | AC160: 无权 | AD160: 无权 | AE160: 无权 | AF160: 99.67 | AG160: 0.34 | AH160: AA+ | AI160: 4.0399999999999998e-002 | AJ160: =H160+100*O160 -> 135.92000000000002 | AK160: 132.2 | AL160: 178 | AM160: 32.5 | AN160: 127 | AO160: -1.7000000000000001e-002 | AP160: 34 | AQ160: 苏农转债!
A161: 82 | B161: 128125 | C161: 华阳转债! | D161: 2949. | E161: 华阳国际 | F161: 建筑 | G161: 建筑工程 | H161: 110.37 | I161: -7.9000000000000008e-003 | J161: 2.0999999999999999e-003 | K161: 22.29 | L161: -1.0700000000000001e-002 | M161: 118.5 | N161: 25.79 | O161: 0.27699999999999997 | P161: 86.43 | Q161: 14天 | R161: 5.52年 | S161: 3.52年 | T161: 4.5 | U161: 16 | V161: 3.3000000000000002e-002 | W161: 0.10300000000000001 | X161: 8.900000000000001e-002 | Y161: 44 | Z161: 3.59 | AA161: 1.32e-002 | AB161: 7.3000000000000001e-003 | AC161: -1.66e-002 | AD161: -1.8500000000000003e-002 | AE161: 82.5 | AF161: 84.27 | AG161: 0.54 | AH161: AA- | AI161: 6.5099999999999991e-002 | AJ161: =H161+100*O161 -> 138.06999999999999 | AK161: 134.3 | AL161: 190 | AM161: 50 | AN161: 220 | AO161: 0.14499999999999999 | AP161: 5 | AQ161: 华阳转债!
A162: 57 | B162: 113604 | C162: 多伦转债! | D162: 603528 | E162: 多伦科技 | F162: 计算机及 | G162: 软件开发 | H162: 109.03 | I162: -1.55e-002 | J162: -8.0000000000000004e-004 | K162: 8.3 | L162: -3.3799999999999997e-002 | M162: 117.3 | N162: 10.44 | O162: 0.371 | P162: 79.5 | Q162: 2月27天 | R162: 5.72年 | S162: 3.72年 | T162: 6.4 | U162: 0.6 | V162: 1.e-003 | W162: 0.12300000000000001 | X162: 9.8000000000000004e-002 | Y162: 52 | Z162: 3.22 | AA162: 1.3100000000000001e-002 | AB162: 7.7000000000000002e-003 | AC162: -1.2699999999999999e-002 | AD162: -1.4499999999999999e-002 | AE162: 81.41 | AF162: 82.34 | AG162: 0.48 | AH162: AA- | AI162: 6.5099999999999991e-002 | AJ162: =H162+100*O162 -> 146.13 | AK162: 138.6 | AL162: 213 | AM162: 56.2 | AN162: 251 | AO162: -5.4000000000000006e-002 | AP162: 3 | AQ162: 多伦转债!
A163: 243 | B163: 113024 | C163: 核建转债! | D163: 601611 | E163: 中国核建 | F163: 建筑 | G163: 建筑工程 | H163: 104.09 | I163: -6.3e-003 | J163: -2.5000000000000001e-003 | K163: 7.83 | L163: -2.7300000000000001e-002 | M163: 109.7 | N163: 9.76 | O163: 0.29699999999999999 | P163: 80.23 | Q163: 转股中 | R163: 4.21年 | S163: 2.21年 | T163: 30 | U163: 11 | V163: 4.0000000000000001e-003 | W163: 0.14400000000000002 | X163: 0.11599999999999999 | Y163: 207 | Z163: 1.92 | AA163: 1.2800000000000001e-002 | AB163: 8.3999999999999995e-003 | AC163: -3.5999999999999999e-003 | AD163: -6.3e-003 | AE163: 94.66 | AF163: 94.29 | AG163: 0.32 | AH163: AAA | AI163: 3.7400000000000003e-002 | AJ163: =H163+100*O163 -> 133.78999999999999 | AK163: 128 | AL163: 148 | AM163: 33.3 | AN163: 135 | AO163: 2.1000000000000001e-002 | AP163: 44 | AQ163: 核建转债!
A164: 240 | B164: 113026 | C164: 核能转债! | D164: 601985 | E164: 中国核电 | F164: 能源电力 | G164: 核电 | H164: 104.3 | I164: -1.0700000000000001e-002 | J164: -7.000000000000001e-004 | K164: 4.98 | L164: -2.92e-002 | M164: 109.8 | N164: 5.86 | O164: 0.22699999999999998 | P164: 84.98 | Q164: 转股中 | R164: 4.23年 | S164: 2.23年 | T164: 78 | U164: 24 | V164: 3.0000000000000001e-003 | W164: 8.9999999999999997e-002 | X164: 7.5999999999999998e-002 | Y164: 869 | Z164: 1.49 | AA164: 1.2500000000000001e-002 | AB164: 8.1000000000000013e-003 | AC164: -4.0999999999999995e-003 | AD164: -6.7000000000000002e-003 | AE164: 94.69 | AF164: 94.33 | AG164: 0.39 | AH164: AAA | AI164: 3.7400000000000003e-002 | AJ164: =H164+100*O164 -> 127. | AK164: 123.6 | AL164: 111 | AM164: 28.9 | AN164: 96 | AO164: -1.1000000000000001e-002 | AP164: 50 | AQ164: 核能转债!
A165: 8 | B165: 128141 | C165: 旺能转债 | D165: 2034. | E165: 旺能环境 | F165: 城市公用 | G165: 三废处理 | H165: 107.25 | I165: -2.0099999999999996e-002 | J165: -8.5000000000000006e-003 | K165: 15.34 | L165: -5.2499999999999998e-002 | M165: 115.1 | N165: 16.47 | O165: 0.152 | P165: 93.14 | Q165: 5月2天 | R165: 5.90年 | S165: 3.90年 | T165: 14 | U165: 60 | V165: 4.0000000000000001e-002 | W165: 0.217 | X165: 0.20199999999999999 | Y165: 65 | Z165: 1.46 | AA165: 1.2199999999999999e-002 | AB165: 7.6e-003 | AC165: -8.5000000000000006e-003 | AD165: -1.0200000000000001e-002 | AE165: 87.04 | AF165: 89.61 | AG165: 0.55 | AH165: AA | AI165: 4.41e-002 | AJ165: =H165+100*O165 -> 122.45 | AK165: 121.4 | AL165: 87 | AM165: 31.7 | AN165: 120 | AO165: -2.7999999999999997e-002 | AP165: 2 | AQ165: 旺能转债
A166: 115 | B166: 123056 | C166: 雪榕转债 | D166: 300511 | E166: 雪榕生物 | F166: 农业 | G166: 种植业 | H166: 113.606 | I166: -7.9000000000000008e-003 | J166: -2.5000000000000001e-003 | K166: 11.22 | L166: -1.67e-002 | M166: 121.1 | N166: 11.89 | O166: 0.20399999999999999 | P166: 94.37 | Q166: 转股中 | R166: 5.42年 | S166: 3.42年 | T166: 5.85 | U166: 5 | V166: 8.0000000000000002e-003 | W166: 0.11800000000000001 | X166: 0.111 | Y166: 50 | Z166: 2.59 | AA166: 1.21e-002 | AB166: 5.3e-003 | AC166: -2.4500000000000001e-002 | AD166: -2.6600000000000002e-002 | AE166: 83.17 | AF166: 86.68 | AG166: 0.62 | AH166: AA- | AI166: 6.5099999999999991e-002 | AJ166: =H166+100*O166 -> 134.006 | AK166: 132.8 | AL166: 184 | AM166: 46.2 | AN166: 204 | AO166: -7.0000000000000007e-002 | AP166: 12 | AQ166: 雪榕转债
A167: 161 | B167: 123045 | C167: 雷迪转债 | D167: 300652 | E167: 雷迪克 | F167: 汽车 | G167: 零部件制 | H167: 112.721 | I167: -1.7000000000000001e-002 | J167: 1.1999999999999999e-003 | K167: 17.75 | L167: -2.69e-002 | M167: 119.4 | N167: 20.13 | O167: 0.27800000000000002 | P167: 88.18 | Q167: 转股中 | R167: 5年49天 | S167: 3年49天 | T167: 1.66 | U167: 37 | V167: 0.19399999999999998 | W167: 9.9000000000000005e-002 | X167: 8.8000000000000009e-002 | Y167: 17 | Z167: 1.96 | AA167: 1.1599999999999999e-002 | AB167: 4.8999999999999998e-003 | AC167: -2.2799999999999997e-002 | AD167: -2.53e-002 | AE167: 82.36 | AF167: 82.75 | AG167: 0.59 | AH167: A+ | AI167: 7.6100000000000001e-002 | AJ167: =H167+100*O167 -> 140.52100000000002 | AK167: 137.3 | AL167: 206 | AM167: 54.5 | AN167: 244 | AO167: -5.7000000000000002e-002 | AP167: 35 | AQ167: 雷迪转债
A168: 231 | B168: 113027 | C168: 华钰转债!! | D168: 601020 | E168: 华钰矿业 | F168: 有色金属 | G168: 锌铅镍锡 | H168: 110.14 | I168: -8.3000000000000001e-003 | J168: -9.0000000000000011e-003 | K168: 8.57 | L168: -3.7100000000000001e-002 | M168: 114.9 | N168: 10.17 | O168: 0.307 | P168: 84.27 | Q168: 转股中 | R168: 4.39年 | S168: 2.39年 | T168: 3.25 | U168: 11 | V168: 2.8999999999999998e-002 | W168: 6.8000000000000005e-002 | X168: 5.7999999999999996e-002 | Y168: 48 | Z168: 1.96 | AA168: 9.8999999999999991e-003 | AB168: 3.7000000000000002e-003 | AC168: -2.46e-002 | AD168: -2.7099999999999999e-002 | AE168: 88.5 | AF168: 88.22 | AG168: 0.47 | AH168: AA- | AI168: 6.3399999999999998e-002 | AJ168: =H168+100*O168 -> 140.84 | AK168: 136 | AL168: 199 | AM168: 47.5 | AN168: 211 | AO168: -0.11800000000000001 | AP168: 46 | AQ168: 华钰转债!!
A169: 85 | B169: 128124 | C169: 科华转债! | D169: 2022. | E169: 科华生物 | F169: 医药 | G169: 生物制药 | H169: 104.588 | I169: 1.43e-002 | J169: 1.03e-002 | K169: 18.83 | L169: 4.7899999999999998e-002 | M169: 110.3 | N169: 21.51 | O169: 0.19500000000000001 | P169: 87.54 | Q169: 12天 | R169: 5.51年 | S169: 3.51年 | T169: 7.38 | U169: 50 | V169: 6.5000000000000002e-002 | W169: 7.5999999999999998e-002 | X169: 6.7000000000000004e-002 | Y169: 97 | Z169: 3.37 | AA169: 9.8999999999999991e-003 | AB169: 6.3e-003 | AC169: -4.0000000000000001e-003 | AD169: -5.6999999999999993e-003 | AE169: 88.03 | AF169: 87.29 | AG169: 0.51 | AH169: AA | AI169: 4.41e-002 | AJ169: =H169+100*O169 -> 124.08799999999999 | AK169: 121.6 | AL169: 91 | AM169: 33.6 | AN169: 138 | AO169: 0.129 | AP169: 15 | AQ169: 科华转债!
A170: 248 | B170: 110057 | C170: 现代转债 | D170: 600420 | E170: 现代制药 | F170: 医药 | G170: 化学制药 | H170: 106.49 | I170: -1.6000000000000001e-003 | J170: 4.7999999999999996e-003 | K170: 9.14 | L170: 6.6e-003 | M170: 110.8 | N170: 9.89 | O170: 0.152 | P170: 92.42 | Q170: 转股中 | R170: 4.19年 | S170: 2.19年 | T170: 16.2 | U170: 7.6 | V170: 4.0000000000000001e-003 | W170: 0.17199999999999999 | X170: 0.159 | Y170: 94 | Z170: 1.19 | AA170: 9.7000000000000003e-003 | AB170: 4.8999999999999998e-003 | AC170: -1.3000000000000001e-002 | AD170: -1.5600000000000001e-002 | AE170: 94.83 | AF170: 95.32 | AG170: 0.49 | AH170: AAA | AI170: 3.7400000000000003e-002 | AJ170: =H170+100*O170 -> 121.69 | AK170: 120.6 | AL170: 83 | AM170: 25.2 | AN170: 67 | AO170: -1.3999999999999999e-002 | AP170: 23 | AQ170: 现代转债
A171: 209 | B171: 110060 | C171: 天路转债! | D171: 600326 | E171: 西藏天路 | F171: 建筑 | G171: 水泥 | H171: 110.26 | I171: -1.3899999999999999e-002 | J171: 3.0999999999999999e-003 | K171: 6.87 | L171: -2.e-002 | M171: 114.9 | N171: 7.16 | O171: 0.14899999999999999 | P171: 95.95 | Q171: 转股中 | R171: 4.76年 | S171: 2.76年 | T171: 7.06 | U171: 2.2 | V171: 3.0000000000000001e-003 | W171: 0.11199999999999999 | X171: 0.107 | Y171: 63 | Z171: 1.69 | AA171: 8.8999999999999999e-003 | AB171: 3.2000000000000002e-003 | AC171: -2.1899999999999999e-002 | AD171: -2.4e-002 | AE171: 91.65 | AF171: 94.63 | AG171: 0.54 | AH171: AA | AI171: 4.24e-002 | AJ171: =H171+100*O171 -> 125.16 | AK171: 124.6 | AL171: 121 | AM171: 29.9 | AN171: 103 | AO171: -2.3e-002 | AP171: 12 | AQ171: 天路转债!
A172: 60 | B172: 128133 | C172: 奇正转债! | D172: 2287. | E172: 奇正藏药 | F172: 医药 | G172: 中药 | H172: 111.65 | I172: 1.2699999999999999e-002 | J172: 1.55e-002 | K172: 30.85 | L172: 4.5100000000000001e-002 | M172: 117.3 | N172: 30.12 | O172: 8.9999999999999997e-002 | P172: 102.42 | Q172: 2月5天 | R172: 5.67年 | S172: 3.67年 | T172: 8 | U172: 34 | V172: 3.7999999999999999e-002 | W172: 4.9000000000000002e-002 | X172: 5.0000000000000003e-002 | Y172: 164 | Z172: 6.81 | AA172: 8.8999999999999999e-003 | AB172: 3.4999999999999996e-003 | AC172: -1.9e-002 | AD172: -2.0899999999999998e-002 | AE172: 88.12 | AF172: 92.29 | AG172: 0.63 | AH172: AA | AI172: 4.41e-002 | AJ172: =H172+100*O172 -> 120.65000000000001 | AK172: 120.9 | AL172: 85 | AM172: 28.6 | AN172: 95 | AO172: 8.900000000000001e-002 | AP172: 12 | AQ172: 奇正转债!
A173: 341 | B173: 110031 | C173: 航信转债!! | D173: 600271 | E173: 航天信息 | F173: 计算机及 | G173: 软件开发 | H173: 106.65 | I173: 1.2999999999999999e-003 | J173: -1.2999999999999999e-003 | K173: 12.41 | L173: -2.5899999999999999e-002 | M173: 107 | N173: 21.56 | O173: 0.85299999999999998 | P173: 57.56 | Q173: 转股中 | R173: 0.39年 | S173: 回售中 | T173: 24 | U173: 8 | V173: 3.0000000000000001e-003 | W173: 0.10400000000000001 | X173: 5.9999999999999998e-002 | Y173: 230 | Z173: 2 | AA173: 8.5000000000000006e-003 | AB173: -2.53e-002 | AC173: 回售中 | AD173: 回售中 | AE173: 100.27 | AF173: 105.81 | AG173: 0 | AH173: AAA | AI173: 2.9399999999999999e-002 | AJ173: =H173+100*O173 -> 191.94999999999999 | AK173: 155.7 | AL173: 272 | AM173: 49.9 | AN173: 219 | AO173: -3.1e-002 | AP173: 15 | AQ173: 航信转债!!
A174: 65 | B174: 123065 | C174: 宝莱转债! | D174: 300246 | E174: 宝莱特 | F174: 医药 | G174: 医疗器械 | H174: 115.9 | I174: 2.5000000000000001e-003 | J174: 6.5000000000000006e-003 | K174: 29.78 | L174: 2.41e-002 | M174: 121.4 | N174: 40.54 | O174: 0.57799999999999996 | P174: 73.46 | Q174: 48天 | R174: 5.62年 | S174: 3.62年 | T174: 2.19 | U174: 123 | V174: 0.48899999999999999 | W174: 5.0000000000000003e-002 | X174: 3.7000000000000005e-002 | Y174: 44 | Z174: 5.22 | AA174: 8.5000000000000006e-003 | AB174: 1.9e-003 | AC174: -2.7699999999999999e-002 | AD174: -2.98e-002 | AE174: 82.39 | AF174: 85.85 | AG174: 0.38 | AH174: AA- | AI174: 6.5099999999999991e-002 | AJ174: =H174+100*O174 -> 173.69999999999999 | AK174: 158.3 | AL174: 278 | AM174: 72.5 | AN174: 284 | AO174: 0.11900000000000001 | AP174: 11 | AQ174: 宝莱转债!
A175: 274 | B175: 110048 | C175: 福能转债! | D175: 600483 | E175: 福能股份 | F175: 能源电力 | G175: 电力供应 | H175: 110.06 | I175: 4.0000000000000002e-004 | J175: 2.7000000000000001e-003 | K175: 7.57 | L175: 6.6e-003 | M175: 113.3 | N175: 8.12 | O175: 0.18100000000000002 | P175: 93.23 | Q175: 转股中 | R175: 3.87年 | S175: 1.87年 | T175: 28.3 | U175: 9.4 | V175: 3.0000000000000001e-003 | W175: 0.21199999999999999 | X175: 0.19800000000000001 | Y175: 133 | Z175: 0.95 | AA175: 7.6e-003 | AB175: 1.4000000000000002e-003 | AC175: -3.3099999999999997e-002 | AD175: -3.5699999999999996e-002 | AE175: 94.87 | AF175: 97.45 | AG175: 0.46 | AH175: AA+ | AI175: 4.0399999999999998e-002 | AJ175: =H175+100*O175 -> 128.16 | AK175: 126.9 | AL175: 140 | AM175: 29.4 | AN175: 99 | AO175: -2.5000000000000001e-002 | AP175: 9 | AQ175: 福能转债!
A176: 227 | B176: 113541 | C176: 荣晟转债! | D176: 603165 | E176: 荣晟环保 | F176: 造纸包装 | G176: 包装用纸 | H176: 111.28 | I176: -1.15e-002 | J176: 5.6999999999999993e-003 | K176: 12.59 | L176: -7.9000000000000008e-003 | M176: 115 | N176: 11.54 | O176: 2.e-002 | P176: 109.1 | Q176: 转股中 | R176: 4.50年 | S176: 2.50年 | T176: 2.75 | U176: 5.8 | V176: 1.9e-002 | W176: 8.5999999999999993e-002 | X176: 9.4e-002 | Y176: 32 | Z176: 2.08 | AA176: 7.4999999999999997e-003 | AB176: 1.5e-003 | AC176: -2.7099999999999999e-002 | AD176: -2.9500000000000002e-002 | AE176: 88.02 | AF176: 87.74 | AG176: 0.74 | AH176: AA- | AI176: 6.3399999999999998e-002 | AJ176: =H176+100*O176 -> 113.28 | AK176: 113.5 | AL176: 41 | AM176: 25.4 | AN176: 71 | AO176: 1.8000000000000002e-002 | AP176: 48 | AQ176: 荣晟转债!
A177: 272 | B177: 128051 | C177: 光华转债! | D177: 2741. | E177: 光华科技 | F177: 电子 | G177: 元器件制 | H177: 111.65 | I177: -3.2000000000000002e-003 | J177: 8.0000000000000002e-003 | K177: 13.85 | L177: 6.5000000000000006e-003 | M177: 114.8 | N177: 12.72 | O177: 2.5000000000000001e-002 | P177: 108.88 | Q177: 转股中 | R177: 3.89年 | S177: 1.89年 | T177: 2.5 | U177: 10 | V177: 3.6000000000000004e-002 | W177: 4.8000000000000001e-002 | X177: 5.2999999999999999e-002 | Y177: 52 | Z177: 4.28 | AA177: 7.3000000000000001e-003 | AB177: 4.0000000000000002e-004 | AC177: -3.7999999999999999e-002 | AD177: -4.0800000000000003e-002 | AE177: 90.95 | AF177: 90.8 | AG177: 0.73 | AH177: AA- | AI177: 6.3399999999999998e-002 | AJ177: =H177+100*O177 -> 114.15000000000001 | AK177: 114.4 | AL177: 46 | AM177: 23.5 | AN177: 52 | AO177: 9.5000000000000001e-002 | AP177: 26 | AQ177: 光华转债!
A178: 259 | B178: 128057 | C178: 博彦转债 | D178: 2649. | E178: 博彦科技 | F178: 计算机及 | G178: 软件开发 | H178: 113.8 | I178: -2.5000000000000001e-003 | J178: 1.7000000000000001e-003 | K178: 9.49 | L178: -1.1000000000000001e-003 | M178: 117.1 | N178: 8.72 | O178: 4.5999999999999999e-002 | P178: 108.83 | Q178: 转股中 | R178: 4年42天 | S178: 2年42天 | T178: 5.1 | U178: 3.4 | V178: 6.0000000000000001e-003 | W178: 0.10099999999999999 | X178: 0.11 | Y178: 51 | Z178: 1.78 | AA178: 7.0999999999999995e-003 | AB178: -2.9999999999999997e-004 | AC178: -4.0800000000000003e-002 | AD178: -4.3700000000000003e-002 | AE178: 90.22 | AF178: 91.48 | AG178: 0.73 | AH178: AA- | AI178: 6.3399999999999998e-002 | AJ178: =H178+100*O178 -> 118.39999999999999 | AK178: 118.8 | AL178: 71 | AM178: 27.3 | AN178: 86 | AO178: 7.0000000000000007e-002 | AP178: 29 | AQ178: 博彦转债
A179: 251 | B179: 127012 | C179: 招路转债! | D179: 1965. | E179: 招商公路 | F179: 机场高速 | G179: 高速 | H179: 105.4 | I179: -5.7999999999999996e-003 | J179: 2.e-003 | K179: 7 | L179: -1.2699999999999999e-002 | M179: 108.2 | N179: 8.81 | O179: 0.32700000000000001 | P179: 79.46 | Q179: 转股中 | R179: 4年59天 | S179: 2年59天 | T179: 50 | U179: 24 | V179: 4.0000000000000001e-003 | W179: 0.11599999999999999 | X179: 9.1999999999999998e-002 | Y179: 432 | Z179: 0.89 | AA179: 6.4000000000000003e-003 | AB179: 2.7000000000000001e-003 | AC179: -1.43e-002 | AD179: -1.5900000000000001e-002 | AE179: 93.65 | AF179: 93.06 | AG179: 0.3 | AH179: AAA | AI179: 3.7400000000000003e-002 | AJ179: =H179+100*O179 -> 138.10000000000002 | AK179: 131.3 | AL179: 175 | AM179: 37.7 | AN179: 158 | AO179: -4.0000000000000001e-003 | AP179: 37 | AQ179: 招路转债!
A180: 3 | B180: 113615 | C180: 金诚转债 | D180: 603979 | E180: 金诚信 | F180: 有色金属 | G180: 有色行业 | H180: 113.23 | I180: -2.1899999999999999e-002 | J180: -1.1999999999999999e-003 | K180: 11.94 | L180: -4.1700000000000001e-002 | M180: 117.3 | N180: 12.73 | O180: 0.20699999999999999 | P180: 93.79 | Q180: 5月8天 | R180: 5.92年 | S180: 3.92年 | T180: 10 | U180: 81 | V180: 7.2000000000000008e-002 | W180: 0.14400000000000002 | X180: 0.13500000000000001 | Y180: 70 | Z180: 1.56 | AA180: 6.0999999999999995e-003 | AB180: 8.9999999999999998e-004 | AC180: -2.12e-002 | AD180: -2.3e-002 | AE180: 87.17 | AF180: 91.29 | AG180: 0.55 | AH180: AA | AI180: 4.41e-002 | AJ180: =H180+100*O180 -> 133.93000000000001 | AK180: 132.7 | AL180: 182 | AM180: 41.4 | AN180: 186 | AO180: -5.9999999999999998e-002 | AP180: 2 | AQ180: 金诚转债
A181: 31 | B181: 110077 | C181: 洪城转债 | D181: 600461 | E181: 洪城水业 | F181: 城市公用 | G181: 城市公用 | H181: 109.66 | I181: -3.0999999999999999e-003 | J181: 3.0999999999999999e-003 | K181: 6.47 | L181: 0. | M181: 113.5 | N181: 7.13 | O181: 0.20800000000000002 | P181: 90.74 | Q181: 4月4天 | R181: 5.83年 | S181: 3.83年 | T181: 18 | U181: 4.5 | V181: 2.e-003 | W181: 0.29299999999999998 | X181: 0.26600000000000001 | Y181: 61 | Z181: 1.22 | AA181: 6.0000000000000001e-003 | AB181: 1.8e-003 | AC181: -1.7399999999999999e-002 | AD181: -1.8500000000000003e-002 | AE181: 86.8 | AF181: 89.5 | AG181: 0.53 | AH181: AA+ | AI181: 4.2099999999999999e-002 | AJ181: =H181+100*O181 -> 130.46000000000001 | AK181: 128.6 | AL181: 154 | AM181: 39.1 | AN181: 169 | AO181: -1.e-002 | AP181: 5 | AQ181: 洪城转债
A182: 68 | B182: 128129 | C182: 青农转债 | D182: 2958. | E182: 青农商行 | F182: 金融 | G182: 银行行业 | H182: 108.86 | I182: -1.2199999999999999e-002 | J182: 2.8999999999999998e-003 | K182: 4.71 | L182: -2.2799999999999997e-002 | M182: 112.2 | N182: 5.74 | O182: 0.32700000000000001 | P182: 82.06 | Q182: 38天 | R182: 5.59年 | S182: 无权 | T182: 50 | U182: 11 | V182: 2.e-003 | W182: 0.191 | X182: 0.157 | Y182: 262 | Z182: 1.01 | AA182: 5.5000000000000005e-003 | AB182: 1.5e-003 | AC182: 无权 | AD182: 无权 | AE182: 无权 | AF182: 90.84 | AG182: 0.4 | AH182: AAA | AI182: 3.9100000000000003e-002 | AJ182: =H182+100*O182 -> 141.56 | AK182: 135.7 | AL182: 197 | AM182: 44.8 | AN182: 198 | AO182: -4.8000000000000001e-002 | AP182: 12 | AQ182: 青农转债
A183: 226 | B183: 113542 | C183: 好客转债 | D183: 603898 | E183: 好莱客 | F183: 其他 | G183: 家居用品 | H183: 112.27 | I183: 6.0000000000000001e-003 | J183: 1.1299999999999999e-002 | K183: 16.17 | L183: 3.0600000000000002e-002 | M183: 114.9 | N183: 16.27 | O183: 0.13 | P183: 99.39 | Q183: 转股中 | R183: 4.52年 | S183: 2.52年 | T183: 6.03 | U183: 7 | V183: 1.e-002 | W183: 0.12 | X183: 0.11900000000000001 | Y183: 50 | Z183: 2.05 | AA183: 5.1999999999999998e-003 | AB183: -7.000000000000001e-004 | AC183: -3.04e-002 | AD183: -3.2799999999999996e-002 | AE183: 92.58 | AF183: 95.58 | AG183: 0.57 | AH183: AA | AI183: 4.24e-002 | AJ183: =H183+100*O183 -> 125.27 | AK183: 125.2 | AL183: 125 | AM183: 29.6 | AN183: 100 | AO183: 5.2000000000000005e-002 | AP183: 19 | AQ183: 好客转债
A184: 17 | B184: 123083 | C184: 朗新转债 | D184: 300682 | E184: 朗新科技 | F184: 计算机及 | G184: 软件开发 | H184: 111.699 | I184: 0. | J184: -9.300000000000001e-003 | K184: 13.72 | L184: -1.8600000000000002e-002 | M184: 115.1 | N184: 15.57 | O184: 0.26800000000000002 | P184: 88.12 | Q184: 4月24天 | R184: 5.88年 | S184: 3.88年 | T184: 8 | U184: 8.5 | V184: 1.e-002 | W184: 5.7000000000000002e-002 | X184: 5.0000000000000003e-002 | Y184: 140 | Z184: 2.94 | AA184: 5.1999999999999998e-003 | AB184: 5.9999999999999995e-004 | AC184: -1.8600000000000002e-002 | AD184: -2.0199999999999999e-002 | AE184: 87.12 | AF184: 89.7 | AG184: 0.5 | AH184: AA | AI184: 4.41e-002 | AJ184: =H184+100*O184 -> 138.499 | AK184: 135.3 | AL184: 195 | AM184: 45.6 | AN184: 202 | AO184: -3.4000000000000002e-002 | AP184: 2 | AQ184: 朗新转债
A185: 87 | B185: 123062 | C185: 三超转债 | D185: 300554 | E185: 三超新材 | F185: 机械装备 | G185: 通用设备 | H185: 116.498 | I185: -2.3300000000000001e-002 | J185: -2.3e-003 | K185: 17.87 | L185: -3.2000000000000001e-002 | M185: 119.7 | N185: 17.17 | O185: 0.11900000000000001 | P185: 104.08 | Q185: 10天 | R185: 5.51年 | S185: 3.51年 | T185: 1.95 | U185: 74 | V185: 0.32100000000000001 | W185: 0.11699999999999999 | X185: 0.121 | Y185: 17 | Z185: 3.2 | AA185: 5.0000000000000001e-003 | AB185: -1.1999999999999999e-003 | AC185: -2.9100000000000001e-002 | AD185: -3.1400000000000004e-002 | AE185: 77.51 | AF185: 76.8 | AG185: 0.8 | AH185: A | AI185: 8.6099999999999996e-002 | AJ185: =H185+100*O185 -> 128.398 | AK185: 128.9 | AL185: 157 | AM185: 51.4 | AN185: 224 | AO185: -0.152 | AP185: 14 | AQ185: 三超转债
A186: 178 | B186: 113563 | C186: 柳药转债 | D186: 603368 | E186: 柳药股份 | F186: 医药 | G186: 医药商业 | H186: 110.22 | I186: 0. | J186: 1.4000000000000002e-003 | K186: 22.02 | L186: 2.7000000000000001e-003 | M186: 112.9 | N186: 24.47 | O186: 0.22500000000000001 | P186: 89.99 | Q186: 转股中 | R186: 4.98年 | S186: 2.98年 | T186: 8.02 | U186: 2.7 | V186: 3.0000000000000001e-003 | W186: 0.10000000000000001 | X186: 8.9999999999999997e-002 | Y186: 80 | Z186: 1.66 | AA186: 4.8999999999999998e-003 | AB186: 2.0000000000000001e-004 | AC186: -2.0199999999999999e-002 | AD186: -2.23e-002 | AE186: 90.82 | AF186: 92.15 | AG186: 0.5 | AH186: AA | AI186: 4.24e-002 | AJ186: =H186+100*O186 -> 132.72 | AK186: 130.5 | AL186: 172 | AM186: 38.3 | AN186: 160 | AO186: 3.6000000000000004e-002 | AP186: 17 | AQ186: 柳药转债
A187: 99 | B187: 128121 | C187: 宏川转债 | D187: 2930. | E187: 宏川智慧 | F187: 交通运输 | G187: 物流业 | H187: 110.4 | I187: -1.8700000000000001e-002 | J187: -4.0999999999999995e-003 | K187: 18.13 | L187: -3.6699999999999997e-002 | M187: 113.3 | N187: 20.25 | O187: 0.23300000000000001 | P187: 89.53 | Q187: 3.1天 | R187: 5.48年 | S187: 3.48年 | T187: 6.7 | U187: 40 | V187: 5.4000000000000006e-002 | W187: 8.3000000000000004e-002 | X187: 7.4999999999999997e-002 | Y187: 80 | Z187: 4.19 | AA187: 4.7999999999999996e-003 | AB187: 4.0000000000000002e-004 | AC187: -1.6899999999999998e-002 | AD187: -1.89e-002 | AE187: 82.66 | AF187: 80.77 | AG187: 0.62 | AH187: AA- | AI187: 6.5099999999999991e-002 | AJ187: =H187+100*O187 -> 133.70000000000002 | AK187: 131.3 | AL187: 174 | AM187: 48.6 | AN187: 215 | AO187: -6.8000000000000005e-002 | AP187: 4 | AQ187: 宏川转债
A188: 28 | B188: 123078 | C188: 飞凯转债 | D188: 300398 | E188: 飞凯材料 | F188: 化工 | G188: 化工 | H188: 112.247 | I188: -1.54e-002 | J188: -9.8999999999999991e-003 | K188: 17.04 | L188: -5.0700000000000002e-002 | M188: 115.2 | N188: 19.34 | O188: 0.27399999999999997 | P188: 88.11 | Q188: 4月12天 | R188: 5.85年 | S188: 3.85年 | T188: 8.25 | U188: 17 | V188: 1.9e-002 | W188: 9.4e-002 | X188: 8.3000000000000004e-002 | Y188: 88 | Z188: 3.4 | AA188: 4.5000000000000005e-003 | AB188: -1.e-004 | AC188: -1.9699999999999999e-002 | AD188: -2.1400000000000002e-002 | AE188: 87.34 | AF188: 89.92 | AG188: 0.5 | AH188: AA | AI188: 4.41e-002 | AJ188: =H188+100*O188 -> 139.64699999999999 | AK188: 136.4 | AL188: 202 | AM188: 46.5 | AN188: 205 | AO188: -2.8999999999999998e-002 | AP188: 5 | AQ188: 飞凯转债
A189: 307 | B189: 128034 | C189: 江银转债! | D189: 2807. | E189: 江阴银行 | F189: 金融 | G189: 银行行业 | H189: 107.7 | I189: -9.7999999999999997e-003 | J189: -1.5e-003 | K189: 4.13 | L189: -2.5899999999999999e-002 | M189: 109.1 | N189: 4.5 | O189: 0.17300000000000001 | P189: 91.78 | Q189: 转股中 | R189: 3年4.1天 | S189: 无权 | T189: 17.6 | U189: 6 | V189: 3.0000000000000001e-003 | W189: 0.19600000000000001 | X189: 0.17999999999999999 | Y189: 90 | Z189: 0.79 | AA189: 4.4000000000000003e-003 | AB189: -1.2999999999999999e-003 | AC189: 无权 | AD189: 无权 | AE189: 无权 | AF189: 97.05 | AG189: 0.44 | AH189: AA+ | AI189: 4.0399999999999998e-002 | AJ189: =H189+100*O189 -> 125. | AK189: 123.6 | AL189: 112 | AM189: 26.6 | AN189: 82 | AO189: -6.0000000000000001e-003 | AP189: 27 | AQ189: 江银转债!
A190: 311 | B190: 110041 | C190: 蒙电转债! | D190: 600863 | E190: 内蒙华电 | F190: 能源电力 | G190: 电力供应 | H190: 108 | I190: -4.4000000000000003e-003 | J190: -2.0000000000000001e-004 | K190: 2.41 | L190: -1.23e-002 | M190: 109.3 | N190: 2.69 | O190: 0.20499999999999999 | P190: 89.59 | Q190: 转股中 | R190: 2.92年 | S190: 0.92年 | T190: 18.7 | U190: 1.3 | V190: 1.e-003 | W190: 0.13300000000000001 | X190: 0.12 | Y190: 140 | Z190: 1.18 | AA190: 4.1999999999999997e-003 | AB190: -1.8e-003 | AC190: -5.33e-002 | AD190: -5.6399999999999999e-002 | AE190: 98.03 | AF190: 98.86 | AG190: 0.38 | AH190: AAA | AI190: 3.56e-002 | AJ190: =H190+100*O190 -> 128.5 | AK190: 126.4 | AL190: 136 | AM190: 27.5 | AN190: 91 | AO190: -4.5999999999999999e-002 | AP190: 9 | AQ190: 蒙电转债!
A191: 117 | B191: 113588 | C191: 润达转债! | D191: 603108 | E191: 润达医疗 | F191: 医药 | G191: 医疗器械 | H191: 111.75 | I191: -1.8600000000000002e-002 | J191: -6.0000000000000001e-003 | K191: 12.69 | L191: -4.3700000000000003e-002 | M191: 114.2 | N191: 13.36 | O191: 0.17699999999999999 | P191: 94.99 | Q191: 转股中 | R191: 5.40年 | S191: 3.40年 | T191: 5.5 | U191: 22 | V191: 3.5000000000000003e-002 | W191: 7.4999999999999997e-002 | X191: 7.0999999999999994e-002 | Y191: 74 | Z191: 2.45 | AA191: 4.0999999999999995e-003 | AB191: -7.000000000000001e-004 | AC191: -2.0899999999999998e-002 | AD191: -2.29e-002 | AE191: 89.04 | AF191: 90.88 | AG191: 0.56 | AH191: AA | AI191: 4.41e-002 | AJ191: =H191+100*O191 -> 129.44999999999999 | AK191: 128.5 | AL191: 152 | AM191: 37.6 | AN191: 157 | AO191: 8.8000000000000009e-002 | AP191: 9 | AQ191: 润达转债!
A192: 160 | B192: 128101 | C192: 联创转债! | D192: 2036. | E192: 联创电子 | F192: 电子 | G192: 液晶显示 | H192: 113 | I192: -8.8000000000000005e-003 | J192: 4.0000000000000002e-004 | K192: 10.72 | L192: -2.5499999999999998e-002 | M192: 115.1 | N192: 13.86 | O192: 0.46100000000000002 | P192: 77.34 | Q192: 转股中 | R192: 5年53天 | S192: 3年53天 | T192: 3 | U192: 4.2 | V192: 1.2e-002 | W192: 2.7000000000000003e-002 | X192: 2.1000000000000001e-002 | Y192: 112 | Z192: 3.81 | AA192: 3.7000000000000002e-003 | AB192: -1.6000000000000001e-003 | AC192: -2.6099999999999998e-002 | AD192: -2.81e-002 | AE192: 89.93 | AF192: 92.59 | AG192: 0.33 | AH192: AA | AI192: 4.41e-002 | AJ192: =H192+100*O192 -> 159.09999999999999 | AK192: 148.7 | AL192: 247 | AM192: 56.1 | AN192: 250 | AO192: -1.2e-002 | AP192: 16 | AQ192: 联创转债!
A193: 326 | B193: 113016 | C193: 小康转债! | D193: 601127 | E193: 小康股份 | F193: 汽车 | G193: 零部件制 | H193: 108.3 | I193: 8.2699999999999996e-002 | J193: -3.1e-002 | K193: 15.32 | L193: 9.98e-002 | M193: 109.3 | N193: 15.7 | O193: 0.11 | P193: 97.58 | Q193: 转股中 | R193: 2.79年 | S193: 0.79年 | T193: 6.04 | U193: 877 | V193: 1.3799999999999999 | W193: 3.1e-002 | X193: 2.9999999999999999e-002 | Y193: 196 | Z193: 3.34 | AA193: 3.4000000000000002e-003 | AB193: -2.8999999999999998e-003 | AC193: -6.2899999999999998e-002 | AD193: -6.6299999999999998e-002 | AE193: 98.01 | AF193: 97.99 | AG193: 0.52 | AH193: AA | AI193: 4.0599999999999997e-002 | AJ193: =H193+100*O193 -> 119.3 | AK193: 119 | AL193: 74 | AM193: 21 | AN193: 32 | AO193: 9.0000000000000011e-003 | AP193: 49 | AQ193: 小康转债!
A194: 163 | B194: 113572 | C194: 三祥转债! | D194: 603663 | E194: 三祥新材 | F194: 其他 | G194: 其他 | H194: 111.5 | I194: -9.8999999999999991e-003 | J194: -4.5999999999999999e-003 | K194: 14.57 | L194: -1.89e-002 | M194: 113.2 | N194: 14.19 | O194: 8.5999999999999993e-002 | P194: 102.68 | Q194: 转股中 | R194: 5年49天 | S194: 3年49天 | T194: 1.7 | U194: 2.5 | V194: 1.3000000000000001e-002 | W194: 6.0999999999999999e-002 | X194: 6.2e-002 | Y194: 28 | Z194: 4.71 | AA194: 3.0000000000000001e-003 | AB194: -1.7000000000000001e-003 | AC194: -2.1899999999999999e-002 | AD194: -2.4e-002 | AE194: 81.62 | AF194: 78.33 | AG194: 0.77 | AH194: A+ | AI194: 7.6100000000000001e-002 | AJ194: =H194+100*O194 -> 120.09999999999999 | AK194: 120.3 | AL194: 80 | AM194: 38.7 | AN194: 164 | AO194: -1.6e-002 | AP194: 18 | AQ194: 三祥转债!
A195: 143 | B195: 123050 | C195: 聚飞转债 | D195: 300303 | E195: 聚飞光电 | F195: 电子 | G195: LED制 | H195: 122.6 | I195: -1.21e-002 | J195: -1.2800000000000001e-002 | K195: 5.27 | L195: -3.8300000000000001e-002 | M195: 124.2 | N195: 5.18 | O195: 0.20499999999999999 | P195: 101.74 | Q195: 转股中 | R195: 5.22年 | S195: 3.22年 | T195: 7.05 | U195: 4 | V195: 5.0000000000000001e-003 | W195: 0.105 | X195: 0.106 | Y195: 67 | Z195: 2.9 | AA195: 2.5000000000000001e-003 | AB195: -5.1999999999999998e-003 | AC195: -4.7599999999999996e-002 | AD195: -4.9699999999999994e-002 | AE195: 84.29 | AF195: 90 | AG195: 0.65 | AH195: AA- | AI195: 6.5099999999999991e-002 | AJ195: =H195+100*O195 -> 143.09999999999999 | AK195: 143.5 | AL195: 232 | AM195: 53.5 | AN195: 237 | AO195: -2.2000000000000002e-002 | AP195: 12 | AQ195: 聚飞转债
A196: 207 | B196: 123033 | C196: 金力转债! | D196: 300748 | E196: 金力永磁 | F196: 电子 | G196: 元器件制 | H196: 120.39 | I196: -1.e-004 | J196: -1.7600000000000001e-002 | K196: 40.1 | L196: -2.86e-002 | M196: 121.5 | N196: 40.97 | O196: 0.23000000000000001 | P196: 97.88 | Q196: 转股中 | R196: 4.78年 | S196: 2.78年 | T196: 4.35 | U196: 160 | V196: 0.30399999999999999 | W196: 2.6000000000000002e-002 | X196: 2.6000000000000002e-002 | Y196: 167 | Z196: 12.41 | AA196: 2.e-003 | AB196: -5.6999999999999993e-003 | AC196: -4.5999999999999999e-002 | AD196: -4.9000000000000002e-002 | AE196: 87.86 | AF196: 91.35 | AG196: 0.62 | AH196: AA- | AI196: 6.3399999999999998e-002 | AJ196: =H196+100*O196 -> 143.38999999999999 | AK196: 142.9 | AL196: 231 | AM196: 51.6 | AN196: 226 | AO196: 7.0000000000000007e-002 | AP196: 28 | AQ196: 金力转债!
A197: 67 | B197: 128130 | C197: 景兴转债 | D197: 2067. | E197: 景兴纸业 | F197: 造纸包装 | G197: 包装用纸 | H197: 113.81 | I197: -1.1200000000000002e-002 | J197: -8.6999999999999994e-003 | K197: 3.79 | L197: -2.8199999999999999e-002 | M197: 115.1 | N197: 3.4 | O197: 2.1000000000000001e-002 | P197: 111.47 | Q197: 41天 | R197: 5.61年 | S197: 3.61年 | T197: 12.8 | U197: 52 | V197: 3.6000000000000004e-002 | W197: 0.30399999999999999 | X197: 0.33899999999999997 | Y197: 42 | Z197: 0.93 | AA197: 2.e-003 | AB197: -2.8000000000000004e-003 | AC197: -2.4799999999999999e-002 | AD197: -2.6600000000000002e-002 | AE197: 88.16 | AF197: 90.77 | AG197: 0.71 | AH197: AA | AI197: 4.41e-002 | AJ197: =H197+100*O197 -> 115.91 | AK197: 116.1 | AL197: 55 | AM197: 25.4 | AN197: 68 | AO197: 3.2000000000000001e-002 | AP197: 11 | AQ197: 景兴转债
A198: 234 | B198: 113536 | C198: 三星转债 | D198: 603578 | E198: 三星新材 | F198: 家电 | G198: 零部件制 | H198: 114.06 | I198: -3.3e-003 | J198: -2.0999999999999999e-003 | K198: 20.86 | L198: -8.6e-003 | M198: 114.8 | N198: 19.54 | O198: 6.8000000000000005e-002 | P198: 106.76 | Q198: 转股中 | R198: 4.35年 | S198: 2.35年 | T198: 1.49 | U198: 5.3 | V198: 3.1e-002 | W198: 7.8e-002 | X198: 8.3000000000000004e-002 | Y198: 19 | Z198: 2.74 | AA198: 1.5e-003 | AB198: -4.5999999999999999e-003 | AC198: -3.8900000000000004e-002 | AD198: -4.1299999999999996e-002 | AE198: 93.13 | AF198: 96.16 | AG198: 0.63 | AH198: AA | AI198: 4.24e-002 | AJ198: =H198+100*O198 -> 120.86 | AK198: 121.4 | AL198: 88 | AM198: 25.2 | AN198: 66 | AO198: -1.4999999999999999e-002 | AP198: 38 | AQ198: 三星转债
A199: 46 | B199: 127023 | C199: 华菱转2 | D199: 932. | E199: 华菱钢铁 | F199: 钢铁 | G199: 炼钢 | H199: 109.2 | I199: -7.3000000000000001e-003 | J199: -1.5e-003 | K199: 4.69 | L199: -1.6799999999999999e-002 | M199: 110.1 | N199: 5.18 | O199: 0.20600000000000002 | P199: 90.54 | Q199: 3月7天 | R199: 5.75年 | S199: 4.75年 | T199: 40 | U199: 9.7 | V199: 2.e-003 | W199: 0.13900000000000001 | X199: 0.126 | Y199: 287 | Z199: 0.91 | AA199: 1.4000000000000002e-003 | AB199: -1.8e-003 | AC199: -9.1000000000000004e-003 | AD199: -1.0800000000000001e-002 | AE199: 86.66 | AF199: 88.59 | AG199: 0.53 | AH199: AAA | AI199: 3.9100000000000003e-002 | AJ199: =H199+100*O199 -> 129.80000000000001 | AK199: 127.9 | AL199: 146 | AM199: 39.3 | AN199: 170 | AO199: -1.7000000000000001e-002 | AP199: 8 | AQ199: 华菱转2
A200: 177 | B200: 128096 | C200: 奥瑞转债!! | D200: 2701. | E200: 奥瑞金 | F200: 造纸包装 | G200: 包装材料 | H200: 115.5 | I200: -8.199999999999999e-003 | J200: -1.09e-002 | K200: 4.59 | L200: -3.1600000000000003e-002 | M200: 116 | N200: 4.54 | O200: 0.14199999999999999 | P200: 101.1 | Q200: 转股中 | R200: 5年20天 | S200: 3年20天 | T200: 7.08 | U200: 25 | V200: 3.1e-002 | W200: 6.4000000000000001e-002 | X200: 6.5000000000000002e-002 | Y200: 111 | Z200: 1.86 | AA200: 8.9999999999999998e-004 | AB200: -4.7999999999999996e-003 | AC200: -3.15e-002 | AD200: -3.39e-002 | AE200: 91.53 | AF200: 94.67 | AG200: 0.6 | AH200: AA+ | AI200: 4.2099999999999999e-002 | AJ200: =H200+100*O200 -> 129.69999999999999 | AK200: 129.9 | AL200: 167 | AM200: 35.2 | AN200: 144 | AO200: -6.3e-002 | AP200: 21 | AQ200: 奥瑞转债!!
A201: 96 | B201: 127020 | C201: 中金转债 | D201: 60. | E201: 中金岭南 | F201: 有色金属 | G201: 有色行业 | H201: 113.4 | I201: -1.3100000000000001e-002 | J201: -6.5000000000000006e-003 | K201: 4.38 | L201: -3.7400000000000003e-002 | M201: 113.7 | N201: 4.71 | O201: 0.21899999999999997 | P201: 92.99 | Q201: 3.1天 | R201: 5.49年 | S201: 3.49年 | T201: 38 | U201: 25 | V201: 6.0000000000000001e-003 | W201: 0.24299999999999999 | X201: 0.22600000000000001 | Y201: 156 | Z201: 1.39 | AA201: 5.0000000000000001e-004 | AB201: -4.0000000000000001e-003 | AC201: -2.75e-002 | AD201: -2.8799999999999999e-002 | AE201: 88.19 | AF201: 90.93 | AG201: 0.52 | AH201: AA+ | AI201: 4.2099999999999999e-002 | AJ201: =H201+100*O201 -> 135.30000000000001 | AK201: 133.8 | AL201: 187 | AM201: 42.9 | AN201: 189 | AO201: -5.7999999999999996e-002 | AP201: 14 | AQ201: 中金转债
A202: 72 | B202: 128128 | C202: 齐翔转2 | D202: 2408. | E202: 齐翔腾达 | F202: 化工 | G202: 化工 | H202: 115.03 | I202: 1.3600000000000001e-002 | J202: 1.6500000000000001e-002 | K202: 10.03 | L202: 3.8300000000000001e-002 | M202: 115.3 | N202: 8.22 | O202: -5.7000000000000002e-002 | P202: 122.02 | Q202: 35天 | R202: 5.58年 | S202: 3.58年 | T202: 29.9 | U202: 161 | V202: 4.7e-002 | W202: 0.16800000000000001 | X202: 0.20499999999999999 | Y202: 178 | Z202: 2.17 | AA202: 4.0000000000000002e-004 | AB202: -4.5000000000000005e-003 | AC202: -2.75e-002 | AD202: -2.9300000000000003e-002 | AE202: 88.38 | AF202: 91.06 | AG202: 0.79 | AH202: AA | AI202: 4.41e-002 | AJ202: =H202+100*O202 -> 109.33 | AK202: 108 | AL202: 19 | AM202: 17 | AN202: 15 | AO202: 0.154 | AP202: 38 | AQ202: 齐翔转2
A203: 312 | B203: 128032 | C203: 双环转债! | D203: 2472. | E203: 双环传动 | F203: 机械装备 | G203: 通用设备 | H203: 109.323 | I203: 5.9999999999999995e-004 | J203: -5.8999999999999999e-003 | K203: 8.87 | L203: -1.3300000000000001e-002 | M203: 109.3 | N203: 9.89 | O203: 0.21899999999999997 | P203: 89.69 | Q203: 转股中 | R203: 2.92年 | S203: 0.92年 | T203: 10 | U203: 5.1 | V203: 5.0000000000000001e-003 | W203: 0.16399999999999998 | X203: 0.14699999999999999 | Y203: 61 | Z203: 1.82 | AA203: -1.e-004 | AB203: -6.0000000000000001e-003 | AC203: -6.3500000000000001e-002 | AD203: -6.6500000000000004e-002 | AE203: 97.49 | AF203: 97.47 | AG203: 0.4 | AH203: AA | AI203: 4.0599999999999997e-002 | AJ203: =H203+100*O203 -> 131.22299999999998 | AK203: 129 | AL203: 158 | AM203: 31.5 | AN203: 116 | AO203: 0.13300000000000001 | AP203: 46 | AQ203: 双环转债!
A204: 42 | B204: 113607 | C204: 伟20转债! | D204: 603568 | E204: 伟明环保 | F204: 城市公用 | G204: 三废处理 | H204: 115.44 | I204: -3.9000000000000003e-003 | J204: -3.8e-003 | K204: 18.08 | L204: -1.7899999999999999e-002 | M204: 115.1 | N204: 22.01 | O204: 0.40500000000000003 | P204: 82.14 | Q204: 3月14天 | R204: 5.78年 | S204: 3.78年 | T204: 12 | U204: 0.9 | V204: 1.e-003 | W204: 5.2999999999999999e-002 | X204: 4.2999999999999997e-002 | Y204: 227 | Z204: 4.53 | AA204: -5.0000000000000001e-004 | AB204: -5.1999999999999998e-003 | AC204: -2.7300000000000001e-002 | AD204: -2.8900000000000002e-002 | AE204: 87.5 | AF204: 90.09 | AG204: 0.43 | AH204: AA | AI204: 4.41e-002 | AJ204: =H204+100*O204 -> 155.94 | AK204: 148.7 | AL204: 249 | AM204: 58.6 | AN204: 258 | AO204: -3.5000000000000003e-002 | AP204: 3 | AQ204: 伟20转债!
A205: 132 | B205: 127017 | C205: 万青转债 | D205: 789. | E205: 万年青 | F205: 建筑 | G205: 水泥 | H205: 119.19 | I205: -2.5999999999999999e-003 | J205: -8.1000000000000013e-003 | K205: 12.87 | L205: -2.2799999999999997e-002 | M205: 118.4 | N205: 14.16 | O205: 0.311 | P205: 90.89 | Q205: 转股中 | R205: 5.36年 | S205: 3.36年 | T205: 10 | U205: 6.8 | V205: 6.0000000000000001e-003 | W205: 9.6999999999999989e-002 | X205: 8.900000000000001e-002 | Y205: 103 | Z205: 1.85 | AA205: -1.2999999999999999e-003 | AB205: -7.1999999999999998e-003 | AC205: -3.9e-002 | AD205: -4.0899999999999999e-002 | AE205: 89.82 | AF205: 95.33 | AG205: 0.47 | AH205: AA+ | AI205: 4.2099999999999999e-002 | AJ205: =H205+100*O205 -> 150.28999999999999 | AK205: 147.5 | AL205: 244 | AM205: 52.2 | AN205: 229 | AO205: -3.6000000000000004e-002 | AP205: 8 | AQ205: 万青转债
A206: 120 | B206: 128113 | C206: 比音转债 | D206: 2832. | E206: 比音勒芬 | F206: 服装纺织 | G206: 服装行业 | H206: 118.553 | I206: -3.9000000000000003e-003 | J206: -6.6e-003 | K206: 15.34 | L206: -1.67e-002 | M206: 117.3 | N206: 14.9 | O206: 0.152 | P206: 102.95 | Q206: 转股中 | R206: 5.39年 | S206: 3.39年 | T206: 6.89 | U206: 5.4 | V206: 6.9999999999999993e-003 | W206: 8.5999999999999993e-002 | X206: 8.8000000000000009e-002 | Y206: 80 | Z206: 3.74 | AA206: -2.e-003 | AB206: -7.6e-003 | AC206: -3.7000000000000005e-002 | AD206: -3.8900000000000004e-002 | AE206: 89.16 | AF206: 93.37 | AG206: 0.63 | AH206: AA | AI206: 4.41e-002 | AJ206: =H206+100*O206 -> 133.75299999999999 | AK206: 134.2 | AL206: 188 | AM206: 40.8 | AN206: 180 | AO206: -8.0000000000000002e-003 | AP206: 7 | AQ206: 比音转债
A207: 118 | B207: 123055 | C207: 晨光转债! | D207: 300138 | E207: 晨光生物 | F207: 食品饮料 | G207: 食品加工 | H207: 125.88 | I207: 3.7599999999999995e-002 | J207: 1.0700000000000001e-002 | K207: 15.41 | L207: 4.8300000000000003e-002 | M207: 124.3 | N207: 12.25 | O207: 1.e-003 | P207: 125.8 | Q207: 转股中 | R207: 5.40年* | S207: 3.40年 | T207: 4.35 | U207: 216 | V207: 0.39600000000000002 | W207: 5.4000000000000006e-002 | X207: 6.8000000000000005e-002 | Y207: 80 | Z207: 4.1 | AA207: -2.3999999999999998e-003 | AB207: -9.7999999999999997e-003 | AC207: -5.21e-002 | AD207: -5.4199999999999998e-002 | AE207: 83.46 | AF207: 89.11 | AG207: 1 | AH207: AA- | AI207: 6.5099999999999991e-002 | AJ207: =H207+100*O207 -> 125.97999999999999 | AK207: 126 | AL207: 134 | AM207: 36.9 | AN207: 155 | AO207: -0.106 | AP207: 9 | AQ207: 晨光转债!
A208: 81 | B208: 113598 | C208: 法兰转债 | D208: 603966 | E208: 法兰泰克 | F208: 机械装备 | G208: 工程机械 | H208: 122.82 | I208: 1.15e-002 | J208: 1.9199999999999998e-002 | K208: 15.8 | L208: 3.95e-002 | M208: 121.2 | N208: 13.88 | O208: 7.9000000000000001e-002 | P208: 113.83 | Q208: 15天 | R208: 5.52年 | S208: 3.52年 | T208: 3.3 | U208: 11 | V208: 2.7999999999999997e-002 | W208: 9.9000000000000005e-002 | X208: 0.113 | Y208: 33 | Z208: 2.99 | AA208: -2.5000000000000001e-003 | AB208: -9.0000000000000011e-003 | AC208: -4.4299999999999999e-002 | AD208: -4.6199999999999998e-002 | AE208: 82.74 | AF208: 86.22 | AG208: 0.78 | AH208: AA- | AI208: 6.5099999999999991e-002 | AJ208: =H208+100*O208 -> 130.72 | AK208: 131.8 | AL208: 177 | AM208: 45.6 | AN208: 203 | AO208: 9.4e-002 | AP208: 7 | AQ208: 法兰转债
A209: 119 | B209: 128114 | C209: 正邦转债 | D209: 2157. | E209: 正邦科技 | F209: 农业 | G209: 畜牧业 | H209: 117 | I209: -7.4999999999999997e-003 | J209: -4.0000000000000002e-004 | K209: 16.82 | L209: -1.23e-002 | M209: 115.3 | N209: 16.09 | O209: 0.11900000000000001 | P209: 104.54 | Q209: 转股中 | R209: 5.40年 | S209: 3.40年 | T209: 16 | U209: 22 | V209: 1.2e-002 | W209: 3.7999999999999999e-002 | X209: 3.9e-002 | Y209: 425 | Z209: 2.82 | AA209: -2.8000000000000004e-003 | AB209: -7.8000000000000005e-003 | AC209: -3.3300000000000003e-002 | AD209: -3.5299999999999998e-002 | AE209: 89.74 | AF209: 92.7 | AG209: 0.64 | AH209: AA+ | AI209: 4.2099999999999999e-002 | AJ209: =H209+100*O209 -> 128.90000000000001 | AK209: 129.5 | AL209: 164 | AM209: 36.8 | AN209: 154 | AO209: -4.0999999999999995e-002 | AP209: 13 | AQ209: 正邦转债
A210: 146 | B210: 128106 | C210: 华统转债 | D210: 2840. | E210: 华统股份 | F210: 农业 | G210: 农产品加 | H210: 114.9 | I210: 2.e-003 | J210: -1.04e-002 | K210: 9.13 | L210: -1.3999999999999999e-002 | M210: 113.2 | N210: 9.39 | O210: 0.182 | P210: 97.23 | Q210: 转股中 | R210: 5.21年 | S210: 3.21年 | T210: 5.37 | U210: 1.8 | V210: 3.0000000000000001e-003 | W210: 0.13100000000000001 | X210: 0.128 | Y210: 41 | Z210: 2.44 | AA210: -2.8999999999999998e-003 | AB210: -7.4999999999999997e-003 | AC210: -3.0200000000000001e-002 | AD210: -3.2199999999999999e-002 | AE210: 89.76 | AF210: 90.81 | AG210: 0.6 | AH210: AA | AI210: 4.41e-002 | AJ210: =H210+100*O210 -> 133.09999999999999 | AK210: 132.6 | AL210: 181 | AM210: 41.8 | AN210: 187 | AO210: -7.2999999999999995e-002 | AP210: 8 | AQ210: 华统转债
A211: 92 | B211: 123061 | C211: 航新转债 | D211: 300424 | E211: 航新科技 | F211: 航空航天 | G211: 航空航天 | H211: 126.91 | I211: -2.76e-002 | J211: -2.0899999999999998e-002 | K211: 15.15 | L211: -7.3399999999999993e-002 | M211: 124.8 | N211: 14.86 | O211: 0.245 | P211: 101.95 | Q211: 6.1天 | R211: 5.50年 | S211: 3.50年 | T211: 2.5 | U211: 94 | V211: 0.29399999999999998 | W211: 6.9000000000000006e-002 | X211: 7.0000000000000007e-002 | Y211: 36 | Z211: 3.33 | AA211: -3.0999999999999999e-003 | AB211: -1.06e-002 | AC211: -5.1699999999999996e-002 | AD211: -5.4000000000000006e-002 | AE211: 83.37 | AF211: 88.98 | AG211: 0.66 | AH211: AA- | AI211: 6.5099999999999991e-002 | AJ211: =H211+100*O211 -> 151.41 | AK211: 151.9 | AL211: 261 | AM211: 62.9 | AN211: 266 | AO211: -0.14599999999999999 | AP211: 11 | AQ211: 航新转债
A212: 185 | B212: 128090 | C212: 汽模转2 | D212: 2510. | E212: 天汽模 | F212: 汽车 | G212: 零部件制 | H212: 116.8 | I212: -1.2699999999999999e-002 | J212: -8.3999999999999995e-003 | K212: 4.6 | L212: -3.1600000000000003e-002 | M212: 114.9 | N212: 4.21 | O212: 6.9000000000000006e-002 | P212: 109.26 | Q212: 转股中 | R212: 4.93年 | S212: 2.93年 | T212: 3.11 | U212: 208 | V212: 0.56999999999999995 | W212: 7.0999999999999994e-002 | X212: 7.8e-002 | Y212: 44 | Z212: 1.59 | AA212: -3.4000000000000002e-003 | AB212: -8.6999999999999994e-003 | AC212: -3.8900000000000004e-002 | AD212: -4.0899999999999999e-002 | AE212: 91.03 | AF212: 93.99 | AG212: 0.67 | AH212: AA | AI212: 4.24e-002 | AJ212: =H212+100*O212 -> 123.7 | AK212: 124.3 | AL212: 118 | AM212: 30.3 | AN212: 107 | AO212: -3.1e-002 | AP212: 26 | AQ212: 汽模转2
A213: 149 | B213: 113034 | C213: 滨化转债 | D213: 601678 | E213: 滨化股份 | F213: 化工 | G213: 化工 | H213: 117.3 | I213: -1.1000000000000001e-002 | J213: -7.4999999999999997e-003 | K213: 5.15 | L213: -2.6499999999999999e-002 | M213: 115.1 | N213: 4.68 | O213: 6.6000000000000003e-002 | P213: 110.04 | Q213: 转股中 | R213: 5.21年 | S213: 3.21年 | T213: 19.3 | U213: 8.1 | V213: 4.0000000000000001e-003 | W213: 0.22800000000000001 | X213: 0.251 | Y213: 85 | Z213: 1.27 | AA213: -3.7000000000000002e-003 | AB213: -8.8000000000000005e-003 | AC213: -3.6400000000000002e-002 | AD213: -3.8300000000000001e-002 | AE213: 89.66 | AF213: 92.31 | AG213: 0.7 | AH213: AA | AI213: 4.41e-002 | AJ213: =H213+100*O213 -> 123.89999999999999 | AK213: 124.6 | AL213: 120 | AM213: 32.2 | AN213: 125 | AO213: -2.8999999999999998e-002 | AP213: 28 | AQ213: 滨化转债
A214: 340 | B214: 110033 | C214: 国贸转债! | D214: 600755 | E214: 厦门国贸 | F214: 交通运输 | G214: 交通运输 | H214: 108.41 | I214: -1.6000000000000001e-003 | J214: -1.e-003 | K214: 6.37 | L214: -2.1499999999999998e-002 | M214: 108 | N214: 7.18 | O214: 0.222 | P214: 88.72 | Q214: 转股中 | R214: 0.95年 | S214: 回售中 | T214: 12.1 | U214: 8.3 | V214: 6.0000000000000001e-003 | W214: 9.8000000000000004e-002 | X214: 8.6999999999999994e-002 | Y214: 124 | Z214: 0.82 | AA214: -4.0000000000000001e-003 | AB214: -1.9400000000000001e-002 | AC214: 回售中 | AD214: 回售中 | AE214: 100.33 | AF214: 104.76 | AG214: 0.12 | AH214: AAA | AI214: 3.2500000000000001e-002 | AJ214: =H214+100*O214 -> 130.60999999999999 | AK214: 128.1 | AL214: 149 | AM214: 23.3 | AN214: 50 | AO214: -2.5000000000000001e-002 | AP214: 19 | AQ214: 国贸转债!
A215: 213 | B215: 128079 | C215: 英联转债! | D215: 2846. | E215: 英联股份 | F215: 造纸包装 | G215: 包装材料 | H215: 119.7 | I215: 1.7000000000000001e-003 | J215: -8.0000000000000004e-004 | K215: 13.49 | L215: 1.5800000000000002e-002 | M215: 117.5 | N215: 13.41 | O215: 0.19 | P215: 100.6 | Q215: 转股中 | R215: 4.75年 | S215: 2.75年 | T215: 1.53 | U215: 26 | V215: 0.14099999999999999 | W215: 5.7000000000000002e-002 | X215: 5.7000000000000002e-002 | Y215: 27 | Z215: 3.5 | AA215: -4.0000000000000001e-003 | AB215: -1.04e-002 | AC215: -4.8600000000000004e-002 | AD215: -5.0900000000000001e-002 | AE215: 84.29 | AF215: 84.19 | AG215: 0.06 | AH215: A+ | AI215: 7.4400000000000008e-002 | AJ215: =H215+100*O215 -> 138.69999999999999 | AK215: 138.8 | AL215: 216 | AM215: 54.5 | AN215: 243 | AO215: 2.9999999999999999e-002 | AP215: 19 | AQ215: 英联转债!
A216: 187 | B216: 123038 | C216: 联得转债! | D216: 300545 | E216: 联得装备 | F216: 机械装备 | G216: 专用设备 | H216: 120.99 | I216: 1.7000000000000001e-003 | J216: -1.47e-002 | K216: 23.4 | L216: -2.0499999999999997e-002 | M216: 118.6 | N216: 25.29 | O216: 0.308 | P216: 92.53 | Q216: 转股中 | R216: 4.92年 | S216: 2.92年 | T216: 1.47 | U216: 18 | V216: 0.10300000000000001 | W216: 4.2999999999999997e-002 | X216: 4.0000000000000001e-002 | Y216: 34 | Z216: 4.46 | AA216: -4.0999999999999995e-003 | AB216: -1.06e-002 | AC216: -4.87e-002 | AD216: -5.0900000000000001e-002 | AE216: 83.38 | AF216: 83.93 | AG216: 0.63 | AH216: A+ | AI216: 7.4400000000000008e-002 | AJ216: =H216+100*O216 -> 151.78999999999999 | AK216: 149.5 | AL216: 251 | AM216: 65.5 | AN216: 272 | AO216: -7.5999999999999998e-002 | AP216: 18 | AQ216: 联得转债!
A217: 308 | B217: 123007 | C217: 道氏转债! | D217: 300409 | E217: 道氏技术 | F217: 建筑 | G217: 建筑行业 | H217: 111.68 | I217: -1.1999999999999999e-003 | J217: 4.5999999999999999e-003 | K217: 15.28 | L217: 5.3e-003 | M217: 110.3 | N217: 14.95 | O217: 9.3000000000000013e-002 | P217: 102.21 | Q217: 转股中 | R217: 2.93年 | S217: 0.93年 | T217: 3.04 | U217: 19 | V217: 5.7000000000000002e-002 | W217: 4.2999999999999997e-002 | X217: 4.4000000000000004e-002 | Y217: 70 | Z217: 2.9 | AA217: -4.3e-003 | AB217: -1.0700000000000001e-002 | AC217: -8.1099999999999992e-002 | AD217: -8.4000000000000005e-002 | AE217: 95.35 | AF217: 92.82 | AG217: 0.65 | AH217: AA- | AI217: 6.1600000000000002e-002 | AJ217: =H217+100*O217 -> 120.98 | AK217: 121.2 | AL217: 86 | AM217: 25.8 | AN217: 74 | AO217: 4.4000000000000004e-002 | AP217: 22 | AQ217: 道氏转债!
A218: 69 | B218: 113602 | C218: 景20转债 | D218: 603228 | E218: 景旺电子 | F218: 电子 | G218: 元器件制 | H218: 116 | I218: 8.0000000000000004e-004 | J218: -1.3999999999999999e-002 | K218: 28.42 | L218: -3.2300000000000002e-002 | M218: 113.3 | N218: 35.28 | O218: 0.44 | P218: 80.56 | Q218: 38天 | R218: 5.59年 | S218: 3.59年 | T218: 17.8 | U218: 20 | V218: 1.e-002 | W218: 7.2999999999999995e-002 | X218: 5.9000000000000004e-002 | Y218: 243 | Z218: 4.04 | AA218: -4.3e-003 | AB218: -8.6e-003 | AC218: -2.9399999999999999e-002 | AD218: -3.1300000000000001e-002 | AE218: 88.42 | AF218: 89.46 | AG218: 0.41 | AH218: AA | AI218: 4.41e-002 | AJ218: =H218+100*O218 -> 160. | AK218: 151.4 | AL218: 258 | AM218: 62 | AN218: 263 | AO218: -4.7e-002 | AP218: 7 | AQ218: 景20转债
A219: 40 | B219: 110076 | C219: 华海转债 | D219: 600521 | E219: 华海药业 | F219: 医药 | G219: 医药行业 | H219: 118 | I219: -3.8e-003 | J219: 5.0000000000000001e-004 | K219: 27.65 | L219: -8.199999999999999e-003 | M219: 115.1 | N219: 34.66 | O219: 0.47899999999999998 | P219: 79.77 | Q219: 3月14天 | R219: 5.78年 | S219: 3.78年 | T219: 18.4 | U219: 31 | V219: 1.3999999999999999e-002 | W219: 4.5999999999999999e-002 | X219: 3.7000000000000005e-002 | Y219: 402 | Z219: 6.51 | AA219: -4.4000000000000003e-003 | AB219: -9.0000000000000011e-003 | AC219: -3.27e-002 | AD219: -3.44e-002 | AE219: 87.5 | AF219: 90.09 | AG219: 0.4 | AH219: AA | AI219: 4.41e-002 | AJ219: =H219+100*O219 -> 165.90000000000001 | AK219: 156.2 | AL219: 274 | AM219: 66.1 | AN219: 274 | AO219: -9.8000000000000004e-002 | AP219: 5 | AQ219: 华海转债
A220: 165 | B220: 110067 | C220: 华安转债! | D220: 600909 | E220: 华安证券 | F220: 金融 | G220: 证券行业 | H220: 113.3 | I220: -8.3999999999999995e-003 | J220: -7.1999999999999998e-003 | K220: 7.12 | L220: -3.9100000000000003e-002 | M220: 110.5 | N220: 8.67 | O220: 0.38 | P220: 82.12 | Q220: 转股中 | R220: 5年49天 | S220: 无权 | T220: 28 | U220: 6.2 | V220: 2.e-003 | W220: 0.109 | X220: 8.900000000000001e-002 | Y220: 258 | Z220: 1.86 | AA220: -4.8999999999999998e-003 | AB220: -8.6999999999999994e-003 | AC220: 无权 | AD220: 无权 | AE220: 无权 | AF220: 90.99 | AG220: 0.4 | AH220: AAA | AI220: 3.9100000000000003e-002 | AJ220: =H220+100*O220 -> 151.30000000000001 | AK220: 144.5 | AL220: 234 | AM220: 53.5 | AN220: 238 | AO220: -7.400000000000001e-002 | AP220: 27 | AQ220: 华安转债!
A221: 204 | B221: 123035 | C221: 利德转债! | D221: 300296 | E221: 利亚德 | F221: 电子 | G221: LED制 | H221: 118 | I221: -4.0999999999999995e-003 | J221: -4.0999999999999995e-003 | K221: 6.13 | L221: -1.9199999999999998e-002 | M221: 115.1 | N221: 6.98 | O221: 0.34399999999999997 | P221: 87.82 | Q221: 转股中 | R221: 4.81年 | S221: 2.81年 | T221: 8 | U221: 1.9 | V221: 2.e-003 | W221: 5.0999999999999997e-002 | X221: 4.4999999999999998e-002 | Y221: 156 | Z221: 1.82 | AA221: -5.3e-003 | AB221: -1.0800000000000001e-002 | AC221: -4.3200000000000002e-002 | AD221: -4.5400000000000003e-002 | AE221: 92.19 | AF221: 95.5 | AG221: 0.43 | AH221: AA+ | AI221: 4.0399999999999998e-002 | AJ221: =H221+100*O221 -> 152.40000000000001 | AK221: 148.2 | AL221: 246 | AM221: 52.7 | AN221: 232 | AO221: -2.3e-002 | AP221: 16 | AQ221: 利德转债!
A222: 321 | B222: 128021 | C222: 兄弟转债!! | D222: 2562. | E222: 兄弟科技 | F222: 医药 | G222: 原料药 | H222: 110.501 | I222: -1.34e-002 | J222: 1.3300000000000001e-002 | K222: 5.26 | L222: -5.6999999999999993e-003 | M222: 108.8 | N222: 5.19 | O222: 8.9999999999999997e-002 | P222: 101.35 | Q222: 转股中 | R222: 2.85年 | S222: 0.85年 | T222: 2.65 | U222: 16 | V222: 5.5e-002 | W222: 4.7e-002 | X222: 4.8000000000000001e-002 | Y222: 56 | Z222: 2.05 | AA222: -5.5000000000000005e-003 | AB222: -1.1200000000000002e-002 | AC222: -7.9899999999999999e-002 | AD222: -8.2699999999999996e-002 | AE222: 97.53 | AF222: 97.29 | AG222: 0.02 | AH222: AA | AI222: 4.0599999999999997e-002 | AJ222: =H222+100*O222 -> 119.501 | AK222: 119.7 | AL222: 76 | AM222: 22.1 | AN222: 42 | AO222: 2.3e-002 | AP222: 13 | AQ222: 兄弟转债!!
A223: 130 | B223: 128109 | C223: 楚江转债 | D223: 2171. | E223: 楚江新材 | F223: 有色金属 | G223: 铜金属 | H223: 118.874 | I223: -8.0000000000000004e-004 | J223: -1.3300000000000001e-002 | K223: 8.12 | L223: -2.64e-002 | M223: 115.3 | N223: 8.73 | O223: 0.27800000000000002 | P223: 93.01 | Q223: 转股中 | R223: 5.36年 | S223: 3.36年 | T223: 18.3 | U223: 5.3 | V223: 2.e-003 | W223: 0.16899999999999998 | X223: 0.157 | Y223: 108 | Z223: 1.97 | AA223: -5.7999999999999996e-003 | AB223: -1.0800000000000001e-002 | AC223: -3.7999999999999999e-002 | AD223: -4.0000000000000001e-002 | AE223: 89.27 | AF223: 91.91 | AG223: 0.54 | AH223: AA | AI223: 4.41e-002 | AJ223: =H223+100*O223 -> 146.67400000000001 | AK223: 144.7 | AL223: 235 | AM223: 52.8 | AN223: 234 | AO223: -5.2000000000000005e-002 | AP223: 6 | AQ223: 楚江转债
A224: 218 | B224: 128075 | C224: 远东转债! | D224: 2406. | E224: 远东传动 | F224: 汽车 | G224: 零部件制 | H224: 118.33 | I224: -1.6200000000000003e-002 | J224: 3.2000000000000002e-003 | K224: 6.07 | L224: -1.9400000000000001e-002 | M224: 114.9 | N224: 5.54 | O224: 8.0000000000000002e-002 | P224: 109.57 | Q224: 转股中 | R224: 4.67年 | S224: 2.67年 | T224: 5.45 | U224: 7.1 | V224: 1.1000000000000001e-002 | W224: 0.14400000000000002 | X224: 0.158 | Y224: 38 | Z224: 1.21 | AA224: -6.4000000000000003e-003 | AB224: -1.2e-002 | AC224: -4.6900000000000004e-002 | AD224: -4.9000000000000002e-002 | AE224: 92.02 | AF224: 95.01 | AG224: 0.67 | AH224: AA | AI224: 4.24e-002 | AJ224: =H224+100*O224 -> 126.33 | AK224: 127.1 | AL224: 142 | AM224: 32.1 | AN224: 124 | AO224: -4.4999999999999998e-002 | AP224: 16 | AQ224: 远东转债!
A225: 142 | B225: 113577 | C225: 春秋转债 | D225: 603890 | E225: 春秋电子 | F225: 电子 | G225: 电子产品 | H225: 122.4 | I225: -3.61e-002 | J225: -3.4000000000000002e-003 | K225: 13.29 | L225: -4.87e-002 | M225: 118.2 | N225: 11.06 | O225: 1.9e-002 | P225: 120.16 | Q225: 转股中 | R225: 5.22年 | S225: 3.22年 | T225: 2.32 | U225: 39 | V225: 0.13699999999999998 | W225: 4.4999999999999998e-002 | X225: 5.4000000000000006e-002 | Y225: 51 | Z225: 3.04 | AA225: -6.8000000000000005e-003 | AB225: -1.2800000000000001e-002 | AC225: -4.7100000000000003e-002 | AD225: -4.9200000000000001e-002 | AE225: 84.3 | AF225: 85.69 | AG225: 0.81 | AH225: AA- | AI225: 6.5099999999999991e-002 | AJ225: =H225+100*O225 -> 124.30000000000001 | AK225: 124.6 | AL225: 123 | AM225: 38.9 | AN225: 167 | AO225: 6.5000000000000002e-002 | AP225: 12 | AQ225: 春秋转债
A226: 137 | B226: 113579 | C226: 健友转债! | D226: 603707 | E226: 健友股份 | F226: 医药 | G226: 原料药 | H226: 118.3 | I226: 4.8999999999999998e-003 | J226: -8.3000000000000001e-003 | K226: 34.25 | L226: -8.6999999999999994e-003 | M226: 114.2 | N226: 42.05 | O226: 0.45200000000000001 | P226: 81.45 | Q226: 转股中 | R226: 5.25年 | S226: 3.25年 | T226: 5.03 | U226: 11 | V226: 1.9e-002 | W226: 1.6e-002 | X226: 1.3000000000000001e-002 | Y226: 320 | Z226: 9.33 | AA226: -6.8000000000000005e-003 | AB226: -1.1599999999999999e-002 | AC226: -3.8199999999999998e-002 | AD226: -4.0099999999999997e-002 | AE226: 89.62 | AF226: 91.47 | AG226: 0.39 | AH226: AA | AI226: 4.41e-002 | AJ226: =H226+100*O226 -> 163.5 | AK226: 155.1 | AL226: 269 | AM226: 63.7 | AN226: 268 | AO226: 4.0000000000000001e-003 | AP226: 8 | AQ226: 健友转债!
A227: 36 | B227: 127024 | C227: 盈峰转债 | D227: 967. | E227: 盈峰环境 | F227: 机械装备 | G227: 专用设备 | H227: 121.785 | I227: 2.3e-003 | J227: 2.e-003 | K227: 8.15 | L227: 7.4000000000000003e-003 | M227: 116.8 | N227: 8.31 | O227: 0.24199999999999999 | P227: 98.07 | Q227: 3月18天 | R227: 5.78年 | S227: 3.78年 | T227: 14.8 | U227: 3 | V227: 2.e-003 | W227: 5.7000000000000002e-002 | X227: 5.5999999999999994e-002 | Y227: 258 | Z227: 1.6 | AA227: -7.3000000000000001e-003 | AB227: -1.23e-002 | AC227: -4.1100000000000005e-002 | AD227: -4.2599999999999999e-002 | AE227: 87.87 | AF227: 92.36 | AG227: 0.58 | AH227: AA+ | AI227: 4.2099999999999999e-002 | AJ227: =H227+100*O227 -> 145.98499999999999 | AK227: 145.5 | AL227: 239 | AM227: 53.1 | AN227: 235 | AO227: -3.0000000000000001e-003 | AP227: 5 | AQ227: 盈峰转债
A228: 200 | B228: 110062 | C228: 烽火转债 | D228: 600498 | E228: 烽火通信 | F228: 通信互联 | G228: 通信设备 | H228: 114.95 | I228: -1.7399999999999999e-002 | J228: -4.1999999999999997e-003 | K228: 22.79 | L228: -4.5999999999999999e-002 | M228: 110.8 | N228: 25.65 | O228: 0.29399999999999998 | P228: 88.85 | Q228: 转股中 | R228: 4.86年 | S228: 2.86年 | T228: 30.9 | U228: 15 | V228: 4.0000000000000001e-003 | W228: 0.11599999999999999 | X228: 0.10300000000000001 | Y228: 267 | Z228: 2.51 | AA228: -7.7000000000000002e-003 | AB228: -1.1699999999999999e-002 | AC228: -3.5000000000000003e-002 | AD228: -3.7000000000000005e-002 | AE228: 92.52 | AF228: 93 | AG228: 0.47 | AH228: AAA | AI228: 3.7400000000000003e-002 | AJ228: =H228+100*O228 -> 144.34999999999999 | AK228: 141.1 | AL228: 224 | AM228: 48.1 | AN228: 213 | AO228: -5.0999999999999997e-002 | AP228: 20 | AQ228: 烽火转债
A229: 273 | B229: 128050 | C229: 钧达转债! | D229: 2865. | E229: 钧达股份 | F229: 汽车 | G229: 零部件制 | H229: 126.61 | I229: -8.5000000000000006e-003 | J229: -3.9000000000000003e-003 | K229: 18.5 | L229: -1.6e-002 | M229: 122.7 | N229: 14.85 | O229: 1.6e-002 | P229: 124.58 | Q229: 转股中 | R229: 3.88年 | S229: 1.88年 | T229: 1.96 | U229: 52 | V229: 0.21100000000000002 | W229: 8.199999999999999e-002 | X229: 0.10199999999999999 | Y229: 24 | Z229: 2.59 | AA229: -8.199999999999999e-003 | AB229: -1.7899999999999999e-002 | AC229: -9.64e-002 | AD229: -9.8800000000000013e-002 | AE229: 90.93 | AF229: 97.08 | AG229: 0.78 | AH229: AA- | AI229: 6.3399999999999998e-002 | AJ229: =H229+100*O229 -> 128.21000000000001 | AK229: 128.6 | AL229: 156 | AM229: 31.6 | AN229: 119 | AO229: 8.0000000000000002e-003 | AP229: 60 | AQ229: 钧达转债!
A230: 9 | B230: 113614 | C230: 健20转债 | D230: 603707 | E230: 健友股份 | F230: 医药 | G230: 原料药 | H230: 120 | I230: -1.2500000000000001e-002 | J230: 7.8000000000000005e-003 | K230: 34.25 | L230: -8.6999999999999994e-003 | M230: 114.2 | N230: 38.04 | O230: 0.33299999999999996 | P230: 90.04 | Q230: 5月2天 | R230: 5.90年 | S230: 3.90年 | T230: 7.8 | U230: 20 | V230: 2.1000000000000001e-002 | W230: 2.4e-002 | X230: 2.2000000000000002e-002 | Y230: 320 | Z230: 9.33 | AA230: -8.5000000000000006e-003 | AB230: -1.2800000000000001e-002 | AC230: -3.5499999999999997e-002 | AD230: -3.7200000000000004e-002 | AE230: 87.13 | AF230: 88.93 | AG230: 0.54 | AH230: AA | AI230: 4.41e-002 | AJ230: =H230+100*O230 -> 153.30000000000001 | AK230: 150 | AL230: 253 | AM230: 61 | AN230: 261 | AO230: 4.0000000000000001e-003 | AP230: 1 | AQ230: 健20转债
A231: 35 | B231: 127025 | C231: 冀东转债 | D231: 401. | E231: 冀东水泥 | F231: 建筑 | G231: 水泥 | H231: 116.1 | I231: -8.5000000000000006e-003 | J231: 2.9999999999999997e-004 | K231: 14.19 | L231: -1.6e-002 | M231: 110.1 | N231: 15.78 | O231: 0.29100000000000004 | P231: 89.92 | Q231: 3月19天 | R231: 5.79年 | S231: 3.79年 | T231: 28.2 | U231: 6.1 | V231: 2.e-003 | W231: 0.14699999999999999 | X231: 0.13300000000000001 | Y231: 191 | Z231: 1.41 | AA231: -9.300000000000001e-003 | AB231: -1.24e-002 | AC231: -3.04e-002 | AD231: -3.1699999999999999e-002 | AE231: 88.46 | AF231: 88.47 | AG231: 0.52 | AH231: AAA | AI231: 3.9100000000000003e-002 | AJ231: =H231+100*O231 -> 145.19999999999999 | AK231: 142.3 | AL231: 230 | AM231: 53.8 | AN231: 239 | AO231: -2.e-003 | AP231: 7 | AQ231: 冀东转债
A232: 322 | B232: 123002 | C232: 国祯转债!! | D232: 300388 | E232: 节能国祯 | F232: 城市公用 | G232: 三废处理 | H232: 111.719 | I232: -6.8000000000000005e-003 | J232: 6.4000000000000003e-003 | K232: 8.62 | L232: -1.37e-002 | M232: 108.8 | N232: 8.48 | O232: 9.9000000000000005e-002 | P232: 101.65 | Q232: 转股中 | R232: 2.84年 | S232: 0.84年 | T232: 2.52 | U232: 1 | V232: 4.0000000000000001e-003 | W232: 4.2000000000000003e-002 | X232: 4.2999999999999997e-002 | Y232: 60 | Z232: 1.59 | AA232: -9.3999999999999986e-003 | AB232: -1.5100000000000001e-002 | AC232: -9.0800000000000006e-002 | AD232: -9.35e-002 | AE232: 97.58 | AF232: 97.33 | AG232: 0.03 | AH232: AA | AI232: 4.0599999999999997e-002 | AJ232: =H232+100*O232 -> 121.619 | AK232: 121.8 | AL232: 93 | AM232: 24.2 | AN232: 57 | AO232: -2.9999999999999999e-002 | AP232: 13 | AQ232: 国祯转债!!
A233: 37 | B233: 128137 | C233: 洁美转债 | D233: 2859. | E233: 洁美科技 | F233: 电子 | G233: 元器件制 | H233: 124.048 | I233: -3.7000000000000002e-003 | J233: -7.4000000000000003e-003 | K233: 26.88 | L233: -1.61e-002 | M233: 117.3 | N233: 27.77 | O233: 0.28199999999999997 | P233: 96.8 | Q233: 3月18天 | R233: 5.78年 | S233: 3.78年 | T233: 6 | U233: 2.8 | V233: 4.0000000000000001e-003 | W233: 5.4000000000000006e-002 | X233: 5.2999999999999999e-002 | Y233: 111 | Z233: 6.32 | AA233: -9.7999999999999997e-003 | AB233: -1.49e-002 | AC233: -4.4500000000000005e-002 | AD233: -4.6199999999999998e-002 | AE233: 81.1 | AF233: 82.02 | AG233: 0.69 | AH233: AA- | AI233: 6.5099999999999991e-002 | AJ233: =H233+100*O233 -> 152.24799999999999 | AK233: 151.3 | AL233: 257 | AM233: 69.3 | AN233: 281 | AO233: 2.1000000000000001e-002 | AP233: 4 | AQ233: 洁美转债
A234: 89 | B234: 110073 | C234: 国投转债 | D234: 600061 | E234: 国投资本 | F234: 金融 | G234: 证券行业 | H234: 117.2 | I234: -5.1000000000000004e-003 | J234: -1.1399999999999999e-002 | K234: 13.6 | L234: -3.27e-002 | M234: 110.5 | N234: 15.25 | O234: 0.314 | P234: 89.18 | Q234: 10天 | R234: 5.50年 | S234: 无权 | T234: 80 | U234: 27 | V234: 3.0000000000000001e-003 | W234: 0.13900000000000001 | X234: 0.124 | Y234: 575 | Z234: 1.38 | AA234: -1.0800000000000001e-002 | AB234: -1.4199999999999999e-002 | AC234: 无权 | AD234: 无权 | AE234: 无权 | AF234: 89.72 | AG234: 0.51 | AH234: AAA | AI234: 3.9100000000000003e-002 | AJ234: =H234+100*O234 -> 148.59999999999999 | AK234: 145.2 | AL234: 238 | AM234: 55.5 | AN234: 248 | AO234: -6.0000000000000001e-003 | AP234: 22 | AQ234: 国投转债
A235: 97 | B235: 113593 | C235: 沪工转债 | D235: 603131 | E235: 上海沪工 | F235: 机械装备 | G235: 通用设备 | H235: 128.98 | I235: 1.18e-002 | J235: -4.0000000000000001e-003 | K235: 25.06 | L235: 9.300000000000001e-003 | M235: 121.6 | N235: 21.32 | O235: 9.6999999999999989e-002 | P235: 117.54 | Q235: 3.1天 | R235: 5.49年 | S235: 3.49年 | T235: 4 | U235: 15 | V235: 2.7999999999999997e-002 | W235: 5.0000000000000003e-002 | X235: 5.9000000000000004e-002 | Y235: 80 | Z235: 6.46 | AA235: -1.09e-002 | AB235: -1.7500000000000002e-002 | AC235: -5.62e-002 | AD235: -5.8400000000000001e-002 | AE235: 80.24 | AF235: 82.06 | AG235: 0.83 | AH235: A+ | AI235: 7.6100000000000001e-002 | AJ235: =H235+100*O235 -> 138.67999999999998 | AK235: 140.4 | AL235: 222 | AM235: 58.4 | AN235: 257 | AO235: -7.5999999999999998e-002 | AP235: 9 | AQ235: 沪工转债
A236: 16 | B236: 113043 | C236: 财通转债 | D236: 601108 | E236: 财通证券 | F236: 金融 | G236: 证券行业 | H236: 118.01 | I236: -5.1999999999999998e-003 | J236: -5.1999999999999998e-003 | K236: 11.39 | L236: -2.1499999999999998e-002 | M236: 110.2 | N236: 13.33 | O236: 0.38100000000000001 | P236: 85.45 | Q236: 4月25天 | R236: 5.88年 | S236: 无权 | T236: 38 | U236: 64 | V236: 1.3999999999999999e-002 | W236: 9.3000000000000013e-002 | X236: 7.9000000000000001e-002 | Y236: 409 | Z236: 1.88 | AA236: -1.1699999999999999e-002 | AB236: -1.49e-002 | AC236: 无权 | AD236: 无权 | AE236: 无权 | AF236: 88.2 | AG236: 0.48 | AH236: AAA | AI236: 3.9100000000000003e-002 | AJ236: =H236+100*O236 -> 156.11000000000001 | AK236: 150.6 | AL236: 254 | AM236: 62.4 | AN236: 265 | AO236: -5.5999999999999994e-002 | AP236: 5 | AQ236: 财通转债
A237: 93 | B237: 123060 | C237: 苏试转债 | D237: 300416 | E237: 苏试试验 | F237: 机械装备 | G237: 专用设备 | H237: 126.3 | I237: -1.9400000000000001e-002 | J237: -1.7100000000000001e-002 | K237: 22.8 | L237: -5.5899999999999998e-002 | M237: 117.6 | N237: 23.86 | O237: 0.32200000000000001 | P237: 95.56 | Q237: 5.1天 | R237: 5.49年 | S237: 3.49年 | T237: 3.1 | U237: 4 | V237: 1.e-002 | W237: 6.7000000000000004e-002 | X237: 6.4000000000000001e-002 | Y237: 46 | Z237: 4.67 | AA237: -1.32e-002 | AB237: -1.8600000000000002e-002 | AC237: -5.2400000000000002e-002 | AD237: -5.4199999999999998e-002 | AE237: 82.72 | AF237: 83.78 | AG237: 0.65 | AH237: AA- | AI237: 6.5099999999999991e-002 | AJ237: =H237+100*O237 -> 158.5 | AK237: 157 | AL237: 275 | AM237: 73.3 | AN237: 286 | AO237: -3.2000000000000001e-002 | AP237: 8 | AQ237: 苏试转债
A238: 164 | B238: 123044 | C238: 红相转债! | D238: 300427 | E238: 红相股份 | F238: 能源电力 | G238: 电力设备 | H238: 135.5 | I238: 6.6e-003 | J238: 7.1999999999999998e-003 | K238: 22.76 | L238: 1.7399999999999999e-002 | M238: 125.5 | N238: 18.8 | O238: 0.11900000000000001 | P238: 121.06 | Q238: 转股中 | R238: 5年49天 | S238: 3年49天 | T238: 5.5 | U238: 30 | V238: 4.0999999999999995e-002 | W238: 6.7000000000000004e-002 | X238: 8.1000000000000003e-002 | Y238: 82 | Z238: 3.59 | AA238: -1.52e-002 | AB238: -2.3199999999999998e-002 | AC238: -7.5300000000000006e-002 | AD238: -7.7800000000000008e-002 | AE238: 85.54 | AF238: 91.6 | AG238: 0.79 | AH238: AA- | AI238: 6.5099999999999991e-002 | AJ238: =H238+100*O238 -> 147.40000000000001 | AK238: 149.9 | AL238: 252 | AM238: 58.3 | AN238: 256 | AO238: -1.3999999999999999e-002 | AP238: 15 | AQ238: 红相转债!
A239: 258 | B239: 127011 | C239: 中鼎转2! | D239: 887. | E239: 中鼎股份 | F239: 汽车 | G239: 零部件制 | H239: 122.598 | I239: -2.5000000000000001e-003 | J239: -6.7000000000000002e-003 | K239: 10.78 | L239: -2.e-002 | M239: 115.2 | N239: 11.59 | O239: 0.318 | P239: 93.01 | Q239: 转股中 | R239: 4年45天 | S239: 2年45天 | T239: 12 | U239: 1.3 | V239: 1.e-003 | W239: 9.0999999999999998e-002 | X239: 8.5000000000000006e-002 | Y239: 132 | Z239: 1.51 | AA239: -1.5300000000000001e-002 | AB239: -2.1700000000000001e-002 | AC239: -7.2000000000000008e-002 | AD239: -7.46e-002 | AE239: 94.67 | AF239: 98.22 | AG239: 0.46 | AH239: AA+ | AI239: 4.0399999999999998e-002 | AJ239: =H239+100*O239 -> 154.398 | AK239: 152.2 | AL239: 262 | AM239: 54 | AN239: 240 | AO239: -6.3e-002 | AP239: 26 | AQ239: 中鼎转2!
A240: 184 | B240: 128091 | C240: 新天转债 | D240: 2873. | E240: 新天药业 | F240: 医药 | G240: 中药 | H240: 128.71 | I240: -6.8000000000000005e-003 | J240: 9.8999999999999991e-003 | K240: 15.9 | L240: 4.4000000000000003e-003 | M240: 119.4 | N240: 16.39 | O240: 0.32700000000000001 | P240: 97.01 | Q240: 转股中 | R240: 4.94年 | S240: 2.94年 | T240: 1.76 | U240: 42 | V240: 0.18600000000000003 | W240: 9.4e-002 | X240: 9.1999999999999998e-002 | Y240: 19 | Z240: 2.47 | AA240: -1.54e-002 | AB240: -2.2099999999999998e-002 | AC240: -6.5700000000000008e-002 | AD240: -6.8099999999999994e-002 | AE240: 83.85 | AF240: 84.51 | AG240: 0.69 | AH240: A+ | AI240: 7.4400000000000008e-002 | AJ240: =H240+100*O240 -> 161.41000000000003 | AK240: 160.4 | AL240: 284 | AM240: 75.9 | AN240: 287 | AO240: -2.e-003 | AP240: 17 | AQ240: 新天转债
A241: 279 | B241: 128048 | C241: 张行转债 | D241: 2839. | E241: 张家港行 | F241: 金融 | G241: 银行行业 | H241: 120.3 | I241: -6.6e-003 | J241: -6.9999999999999993e-003 | K241: 5.67 | L241: -2.58e-002 | M241: 113.3 | N241: 5.76 | O241: 0.222 | P241: 98.44 | Q241: 转股中 | R241: 3.81年 | S241: 无权 | T241: 25 | U241: 4.9 | V241: 2.e-003 | W241: 0.24399999999999999 | X241: 0.23999999999999999 | Y241: 103 | Z241: 0.98 | AA241: -1.5900000000000001e-002 | AB241: -2.2099999999999998e-002 | AC241: 无权 | AD241: 无权 | AE241: 无权 | AF241: 97.72 | AG241: 0.53 | AH241: AA+ | AI241: 4.0399999999999998e-002 | AJ241: =H241+100*O241 -> 142.5 | AK241: 142.2 | AL241: 229 | AM241: 44.4 | AN241: 195 | AO241: -3.9e-002 | AP241: 14 | AQ241: 张行转债
A242: 147 | B242: 123048 | C242: 应急转债! | D242: 300527 | E242: 中船应急 | F242: 机械装备 | G242: 专用设备 | H242: 123.003 | I242: -1.4800000000000001e-002 | J242: -2.2000000000000001e-003 | K242: 9.01 | L242: -2.7000000000000003e-002 | M242: 113.1 | N242: 8.9 | O242: 0.215 | P242: 101.24 | Q242: 转股中 | R242: 5.21年 | S242: 3.21年 | T242: 3.8 | U242: 21 | V242: 4.4000000000000004e-002 | W242: 4.4000000000000004e-002 | X242: 4.4000000000000004e-002 | Y242: 87 | Z242: 3.48 | AA242: -1.6299999999999999e-002 | AB242: -2.07e-002 | AC242: -4.99e-002 | AD242: -5.1799999999999999e-002 | AE242: 90.24 | AF242: 91.61 | AG242: 0.63 | AH242: AA+ | AI242: 4.2099999999999999e-002 | AJ242: =H242+100*O242 -> 144.50299999999999 | AK242: 144.8 | AL242: 236 | AM242: 53.2 | AN242: 236 | AO242: -7.0000000000000007e-002 | AP242: 16 | AQ242: 应急转债!
A243: 26 | B243: 123079 | C243: 运达转债 | D243: 300772 | E243: 运达股份 | F243: 能源电力 | G243: 风能 | H243: 126.672 | I243: -2.1899999999999999e-002 | J243: 4.4000000000000003e-003 | K243: 17.57 | L243: -2.3300000000000001e-002 | M243: 115.1 | N243: 15.31 | O243: 0.10400000000000001 | P243: 114.76 | Q243: 4月16天 | R243: 5.86年 | S243: 3.86年 | T243: 5.77 | U243: 35 | V243: 4.7e-002 | W243: 0.11199999999999999 | X243: 0.128 | Y243: 52 | Z243: 3.36 | AA243: -1.6500000000000001e-002 | AB243: -2.0899999999999998e-002 | AC243: -4.9100000000000005e-002 | AD243: -5.0700000000000002e-002 | AE243: 87.2 | AF243: 89.78 | AG243: 0.75 | AH243: AA | AI243: 4.41e-002 | AJ243: =H243+100*O243 -> 137.072 | AK243: 138.6 | AL243: 214 | AM243: 48.8 | AN243: 217 | AO243: 1.e-002 | AP243: 3 | AQ243: 运达转债
A244: 52 | B244: 128135 | C244: 洽洽转债 | D244: 2557. | E244: 洽洽食品 | F244: 食品饮料 | G244: 休闲食品 | H244: 132.9 | I244: 1.8e-003 | J244: -1.21e-002 | K244: 63.81 | L244: -1.6200000000000003e-002 | M244: 120.2 | N244: 60.83 | O244: 0.26700000000000002 | P244: 104.9 | Q244: 3月4天 | R244: 5.74年 | S244: 3.74年 | T244: 13.4 | U244: 18 | V244: 1.e-002 | W244: 4.0999999999999995e-002 | X244: 4.2999999999999997e-002 | Y244: 324 | Z244: 8.44 | AA244: -1.7600000000000001e-002 | AB244: -2.35e-002 | AC244: -6.2e-002 | AD244: -6.3600000000000004e-002 | AE244: 87.73 | AF244: 94.23 | AG244: 0.63 | AH244: AA | AI244: 4.41e-002 | AJ244: =H244+100*O244 -> 159.60000000000002 | AK244: 160.9 | AL244: 285 | AM244: 66.7 | AN244: 276 | AO244: 9.3000000000000013e-002 | AP244: 8 | AQ244: 洽洽转债
A245: 126 | B245: 113585 | C245: 寿仙转债 | D245: 603896 | E245: 寿仙谷 | F245: 医药 | G245: 中药 | H245: 130.03 | I245: -2.07e-002 | J245: 1.11e-002 | K245: 37.57 | L245: -1.0800000000000001e-002 | M245: 117.8 | N245: 28.68 | O245: -6.9999999999999993e-003 | P245: 131 | Q245: 转股中 | R245: 5.38年 | S245: 3.38年 | T245: 2.3 | U245: 12 | V245: 4.0000000000000001e-002 | W245: 4.0999999999999995e-002 | X245: 5.4000000000000006e-002 | Y245: 56 | Z245: 4.38 | AA245: -1.8600000000000002e-002 | AB245: -2.4199999999999999e-002 | AC245: -6.1399999999999996e-002 | AD245: -6.3399999999999998e-002 | AE245: 83.51 | AF245: 84.58 | AG245: 0.89 | AH245: AA- | AI245: 6.5099999999999991e-002 | AJ245: =H245+100*O245 -> 129.33000000000001 | AK245: 129.1 | AL245: 160 | AM245: 44.5 | AN245: 196 | AO245: 4.5999999999999999e-002 | AP245: 9 | AQ245: 寿仙转债
A246: 66 | B246: 123064 | C246: 万孚转债! | D246: 300482 | E246: 万孚生物 | F246: 医药 | G246: 医疗器械 | H246: 127.88 | I246: 3.1200000000000002e-002 | J246: -3.4999999999999996e-003 | K246: 95.02 | L246: 4.36e-002 | M246: 115.1 | N246: 93.55 | O246: 0.25900000000000001 | P246: 101.57 | Q246: 45天 | R246: 5.61年 | S246: 3.61年 | T246: 6 | U246: 57 | V246: 7.4999999999999997e-002 | W246: 1.8000000000000002e-002 | X246: 1.9e-002 | Y246: 326 | Z246: 12.02 | AA246: -1.89e-002 | AB246: -2.3599999999999999e-002 | AC246: -5.4699999999999999e-002 | AD246: -5.6299999999999996e-002 | AE246: 88.15 | AF246: 90.75 | AG246: 0.64 | AH246: AA | AI246: 4.41e-002 | AJ246: =H246+100*O246 -> 153.78 | AK246: 154.2 | AL246: 265 | AM246: 63.4 | AN246: 267 | AO246: 4.8000000000000001e-002 | AP246: 9 | AQ246: 万孚转债!
A247: 328 | B247: 113014 | C247: 林洋转债! | D247: 601222 | E247: 林洋能源 | F247: 能源电力 | G247: 电力设备 | H247: 115.5 | I247: 2.e-003 | J247: -5.0000000000000001e-003 | K247: 8.21 | L247: -6.0999999999999995e-003 | M247: 109.3 | N247: 8.54 | O247: 0.20100000000000001 | P247: 96.14 | Q247: 转股中 | R247: 2.76年 | S247: 0.76年 | T247: 30 | U247: 52 | V247: 1.4999999999999999e-002 | W247: 0.20899999999999999 | X247: 0.20100000000000001 | Y247: 144 | Z247: 1.38 | AA247: -2.0099999999999996e-002 | AB247: -2.6200000000000001e-002 | AC247: -0.129 | AD247: -0.13300000000000001 | AE247: 98.12 | AF247: 98.1 | AG247: 0.5 | AH247: AA | AI247: 4.0599999999999997e-002 | AJ247: =H247+100*O247 -> 135.59999999999999 | AK247: 134.9 | AL247: 193 | AM247: 36.7 | AN247: 153 | AO247: -1.3999999999999999e-002 | AP247: 23 | AQ247: 林洋转债!
A248: 264 | B248: 110051 | C248: 中天转债! | D248: 600522 | E248: 中天科技 | F248: 通信互联 | G248: 通信设备 | H248: 123.91 | I248: -5.5000000000000005e-003 | J248: -6.8000000000000005e-003 | K248: 10.87 | L248: -1.9e-002 | M248: 113.9 | N248: 10.09 | O248: 0.14999999999999999 | P248: 107.73 | Q248: 转股中 | R248: 4年37天 | S248: 2年37天 | T248: 39.6 | U248: 45 | V248: 9.0000000000000011e-003 | W248: 0.11900000000000001 | X248: 0.128 | Y248: 333 | Z248: 1.52 | AA248: -2.0799999999999999e-002 | AB248: -2.6699999999999998e-002 | AC248: -7.7499999999999999e-002 | AD248: -8.0000000000000002e-002 | AE248: 94.62 | AF248: 97.17 | AG248: 0.65 | AH248: AA+ | AI248: 4.0399999999999998e-002 | AJ248: =H248+100*O248 -> 138.91 | AK248: 140.1 | AL248: 220 | AM248: 42.9 | AN248: 190 | AO248: -2.e-002 | AP248: 27 | AQ248: 中天转债!
A249: 169 | B249: 123043 | C249: 正元转债 | D249: 300645 | E249: 正元智慧 | F249: 计算机及 | G249: 软件开发 | H249: 135.2 | I249: -1.01e-002 | J249: 2.6699999999999998e-002 | K249: 14.77 | L249: 2.5000000000000001e-002 | M249: 121.4 | N249: 15.41 | O249: 0.41100000000000003 | P249: 95.85 | Q249: 转股中 | R249: 5年42天 | S249: 3年42天 | T249: 1.66 | U249: 767 | V249: 3.3399999999999999 | W249: 8.8000000000000009e-002 | X249: 8.5000000000000006e-002 | Y249: 19 | Z249: 3.05 | AA249: -2.1299999999999999e-002 | AB249: -2.8199999999999999e-002 | AC249: -7.6200000000000004e-002 | AD249: -7.85e-002 | AE249: 82.48 | AF249: 84.24 | AG249: 0.67 | AH249: A+ | AI249: 7.6100000000000001e-002 | AJ249: =H249+100*O249 -> 176.29999999999998 | AK249: 174.6 | AL249: 295 | AM249: 90.3 | AN249: 301 | AO249: -1.3000000000000001e-002 | AP249: 17 | AQ249: 正元转债
A250: 202 | B250: 113550 | C250: 常汽转债! | D250: 603035 | E250: 常熟汽饰 | F250: 汽车 | G250: 零部件制 | H250: 134.44 | I250: 3.0999999999999999e-003 | J250: 1.41e-002 | K250: 12.67 | L250: 2.0099999999999996e-002 | M250: 121.3 | N250: 9.65 | O250: 2.4e-002 | P250: 131.3 | Q250: 转股中 | R250: 4.82年 | S250: 2.82年 | T250: 3.82 | U250: 24 | V250: 4.5999999999999999e-002 | W250: 8.8000000000000009e-002 | X250: 0.115 | Y250: 43 | Z250: 1.27 | AA250: -2.1499999999999998e-002 | AB250: -2.8799999999999999e-002 | AC250: -8.2500000000000004e-002 | AD250: -8.48e-002 | AE250: 86.91 | AF250: 90.81 | AG250: 0.85 | AH250: AA- | AI250: 6.3399999999999998e-002 | AJ250: =H250+100*O250 -> 136.84 | AK250: 137.6 | AL250: 207 | AM250: 46.8 | AN250: 209 | AO250: -1.8000000000000002e-002 | AP250: 15 | AQ250: 常汽转债!
A251: 62 | B251: 123066 | C251: 赛意转债 | D251: 300687 | E251: 赛意信息 | F251: 计算机及 | G251: 软件开发 | H251: 137 | I251: -1.1599999999999999e-002 | J251: 5.7999999999999996e-003 | K251: 30.62 | L251: -6.5000000000000006e-003 | M251: 121.4 | N251: 22.58 | O251: 1.e-002 | P251: 135.61 | Q251: 59天 | R251: 5.65年 | S251: 3.65年 | T251: 3.2 | U251: 37 | V251: 8.4000000000000005e-002 | W251: 4.8000000000000001e-002 | X251: 6.5000000000000002e-002 | Y251: 66 | Z251: 7.02 | AA251: -2.1600000000000001e-002 | AB251: -2.7799999999999998e-002 | AC251: -6.9599999999999995e-002 | AD251: -7.1500000000000008e-002 | AE251: 79.09 | AF251: 80.95 | AG251: 0.89 | AH251: A+ | AI251: 7.6100000000000001e-002 | AJ251: =H251+100*O251 -> 138. | AK251: 138.4 | AL251: 212 | AM251: 57.4 | AN251: 254 | AO251: 0.17699999999999999 | AP251: 6 | AQ251: 赛意转债
A252: 56 | B252: 110075 | C252: 南航转债 | D252: 600029 | E252: 南方航空 | F252: 交通运输 | G252: 航空运输 | H252: 124.57 | I252: -5.9999999999999995e-004 | J252: -7.4999999999999997e-003 | K252: 5.59 | L252: -1.5800000000000002e-002 | M252: 110 | N252: 6.24 | O252: 0.39100000000000001 | P252: 89.58 | Q252: 2月29天 | R252: 5.73年 | S252: 3.73年 | T252: 160 | U252: 120 | V252: 6.0000000000000001e-003 | W252: 0.187 | X252: 0.16699999999999998 | Y252: 857 | Z252: 1.19 | AA252: -2.1700000000000001e-002 | AB252: -2.4799999999999999e-002 | AC252: -4.9699999999999994e-002 | AD252: -5.0700000000000002e-002 | AE252: 88.13 | AF252: 88.54 | AG252: 0.51 | AH252: AAA | AI252: 3.9100000000000003e-002 | AJ252: =H252+100*O252 -> 163.66999999999999 | AK252: 159.6 | AL252: 282 | AM252: 71 | AN252: 283 | AO252: -2.9999999999999999e-002 | AP252: 8 | AQ252: 南航转债
A253: 51 | B253: 123070 | C253: 鹏辉转债 | D253: 300438 | E253: 鹏辉能源 | F253: 汽车 | G253: 零部件制 | H253: 130.5 | I253: 3.8e-003 | J253: 1.4999999999999999e-002 | K253: 23 | L253: 2.5000000000000001e-002 | M253: 115.1 | N253: 20.16 | O253: 0.14400000000000002 | P253: 114.09 | Q253: 3月4天 | R253: 5.74年 | S253: 3.74年 | T253: 8.9 | U253: 94 | V253: 8.1000000000000003e-002 | W253: 9.1999999999999998e-002 | X253: 0.105 | Y253: 96 | Z253: 3.9 | AA253: -2.2000000000000002e-002 | AB253: -2.6499999999999999e-002 | AC253: -5.7800000000000004e-002 | AD253: -5.9400000000000001e-002 | AE253: 87.64 | AF253: 90.23 | AG253: 0.75 | AH253: AA | AI253: 4.41e-002 | AJ253: =H253+100*O253 -> 144.90000000000001 | AK253: 146.9 | AL253: 243 | AM253: 56.7 | AN253: 252 | AO253: -4.2000000000000003e-002 | AP253: 4 | AQ253: 鹏辉转债
A254: 58 | B254: 128134 | C254: 鸿路转债! | D254: 2541. | E254: 鸿路钢构 | F254: 建筑 | G254: 其他 | H254: 130.523 | I254: 4.0000000000000001e-003 | J254: -1.43e-002 | K254: 45.47 | L254: -1.54e-002 | M254: 115.1 | N254: 43.74 | O254: 0.25600000000000001 | P254: 103.96 | Q254: 2月23天 | R254: 5.71年 | S254: 3.71年 | T254: 18.8 | U254: 29 | V254: 1.2e-002 | W254: 7.9000000000000001e-002 | X254: 8.199999999999999e-002 | Y254: 238 | Z254: 4.45 | AA254: -2.2099999999999998e-002 | AB254: -2.6699999999999998e-002 | AC254: -5.8200000000000002e-002 | AD254: -5.9800000000000006e-002 | AE254: 87.75 | AF254: 90.35 | AG254: 0.67 | AH254: AA | AI254: 4.41e-002 | AJ254: =H254+100*O254 -> 156.12299999999999 | AK254: 157.1 | AL254: 276 | AM254: 66.7 | AN254: 277 | AO254: 0.10000000000000001 | AP254: 4 | AQ254: 鸿路转债!
A255: 44 | B255: 123074 | C255: 隆利转债 | D255: 300752 | E255: 隆利科技 | F255: 电子 | G255: 液晶显示 | H255: 142.222 | I255: 9.1999999999999998e-003 | J255: 2.8500000000000001e-002 | K255: 46.03 | L255: 4.1200000000000001e-002 | M255: 124 | N255: 29.41 | O255: -9.0999999999999998e-002 | P255: 156.51 | Q255: 3月12天 | R255: 5.77年 | S255: 3.77年 | T255: 3.25 | U255: 832 | V255: 1.79 | W255: 5.7999999999999996e-002 | X255: 9.1999999999999998e-002 | Y255: 55 | Z255: 6.37 | AA255: -2.3900000000000001e-002 | AB255: -3.0600000000000002e-002 | AC255: -7.7300000000000008e-002 | AD255: -7.8899999999999998e-002 | AE255: 81.28 | AF255: 86.8 | AG255: 0.92 | AH255: AA- | AI255: 6.5099999999999991e-002 | AJ255: =H255+100*O255 -> 133.12200000000001 | AK255: 127.9 | AL255: 147 | AM255: 41.1 | AN255: 184 | AO255: 2.7999999999999997e-002 | AP255: 10 | AQ255: 隆利转债
A256: 189 | B256: 110065 | C256: 淮矿转债! | D256: 600985 | E256: 淮北矿业 | F256: 煤炭 | G256: 煤炭开采 | H256: 124.62 | I256: -1.1000000000000001e-002 | J256: -3.4999999999999996e-003 | K256: 10.99 | L256: -1.8799999999999997e-002 | M256: 110.8 | N256: 9.33 | O256: 5.7999999999999996e-002 | P256: 117.79 | Q256: 转股中 | R256: 4.92年 | S256: 2.92年 | T256: 27.4 | U256: 34 | V256: 1.e-002 | W256: 0.115 | X256: 0.13500000000000001 | Y256: 239 | Z256: 1.16 | AA256: -2.4e-002 | AB256: -2.7900000000000001e-002 | AC256: -5.9500000000000004e-002 | AD256: -6.13e-002 | AE256: 92.32 | AF256: 92.8 | AG256: 0.77 | AH256: AAA | AI256: 3.7400000000000003e-002 | AJ256: =H256+100*O256 -> 130.42000000000002 | AK256: 131.4 | AL256: 176 | AM256: 38.6 | AN256: 162 | AO256: -2.5000000000000001e-002 | AP256: 21 | AQ256: 淮矿转债!
A257: 121 | B257: 113587 | C257: 泛微转债! | D257: 603039 | E257: 泛微网络 | F257: 计算机及 | G257: 软件开发 | H257: 141.35 | I257: -1.18e-002 | J257: -5.9999999999999995e-004 | K257: 90.9 | L257: -1.24e-002 | M257: 124.3 | N257: 64.33 | O257: 0. | P257: 141.3 | Q257: 转股中 | R257: 5.39年 | S257: 3.39年 | T257: 1.76 | U257: 6.9 | V257: 2.7999999999999997e-002 | W257: 9.0000000000000011e-003 | X257: 1.3000000000000001e-002 | Y257: 194 | Z257: 20.02 | AA257: -2.4e-002 | AB257: -3.1200000000000002e-002 | AC257: -8.2899999999999988e-002 | AD257: -8.48e-002 | AE257: 83.49 | AF257: 89.14 | AG257: 1 | AH257: AA- | AI257: 6.5099999999999991e-002 | AJ257: =H257+100*O257 -> 141.34999999999999 | AK257: 141.4 | AL257: 226 | AM257: 52.3 | AN257: 231 | AO257: -5.0000000000000003e-002 | AP257: 6 | AQ257: 泛微转债!
A258: 205 | B258: 110061 | C258: 川投转债 | D258: 600674 | E258: 川投能源 | F258: 能源电力 | G258: 水电 | H258: 124.3 | I258: 2.7000000000000001e-003 | J258: 8.199999999999999e-003 | K258: 10.41 | L258: 1.5600000000000001e-002 | M258: 110.8 | N258: 9.58 | O258: 0.14400000000000002 | P258: 108.66 | Q258: 转股中 | R258: 4.80年 | S258: 2.80年 | T258: 40 | U258: 4.7 | V258: 1.e-003 | W258: 8.6999999999999994e-002 | X258: 9.5000000000000001e-002 | Y258: 458 | Z258: 1.66 | AA258: -2.41e-002 | AB258: -2.7999999999999997e-002 | AC258: -6.0899999999999996e-002 | AD258: -6.2800000000000009e-002 | AE258: 92.71 | AF258: 93.19 | AG258: 0.69 | AH258: AAA | AI258: 3.7400000000000003e-002 | AJ258: =H258+100*O258 -> 138.69999999999999 | AK258: 139.9 | AL258: 219 | AM258: 46.7 | AN258: 208 | AO258: 2.7000000000000003e-002 | AP258: 16 | AQ258: 川投转债
A259: 4 | B259: 123091 | C259: 长海转债 | D259: 300196 | E259: 长海股份 | F259: 其他 | G259: 非金属矿 | H259: 134.6 | I259: 9.7999999999999997e-003 | J259: -2.1299999999999999e-002 | K259: 16.68 | L259: -1.77e-002 | M259: 116.2 | N259: 16.24 | O259: 0.31 | P259: 102.71 | Q259: 5月8天 | R259: 5.92年 | S259: 3.92年 | T259: 5.5 | U259: 107 | V259: 0.14400000000000002 | W259: 8.1000000000000003e-002 | X259: 8.3000000000000004e-002 | Y259: 68 | Z259: 2.44 | AA259: -2.4900000000000002e-002 | AB259: -2.9600000000000001e-002 | AC259: -6.2300000000000001e-002 | AD259: -6.3899999999999998e-002 | AE259: 87.07 | AF259: 90.42 | AG259: 0.65 | AH259: AA | AI259: 4.41e-002 | AJ259: =H259+100*O259 -> 165.59999999999999 | AK259: 166.5 | AL259: 290 | AM259: 76.1 | AN259: 288 | AO259: -3.6000000000000004e-002 | AP259: 2 | AQ259: 长海转债
A260: 7 | B260: 128142 | C260: 新乳转债 | D260: 2946. | E260: 新乳业 | F260: 食品饮料 | G260: 乳制品 | H260: 135.4 | I260: -4.4000000000000003e-003 | J260: -1.0700000000000001e-002 | K260: 20.28 | L260: -2.12e-002 | M260: 115.1 | N260: 18.69 | O260: 0.248 | P260: 108.51 | Q260: 5月3天 | R260: 5.90年 | S260: 3.90年 | T260: 7.18 | U260: 92 | V260: 9.5000000000000001e-002 | W260: 4.0999999999999995e-002 | X260: 4.4999999999999998e-002 | Y260: 173 | Z260: 8.47 | AA260: -2.76e-002 | AB260: -3.1899999999999998e-002 | AC260: -6.4100000000000004e-002 | AD260: -6.5599999999999992e-002 | AE260: 87.03 | AF260: 89.6 | AG260: 0.71 | AH260: AA | AI260: 4.41e-002 | AJ260: =H260+100*O260 -> 160.20000000000002 | AK260: 162.3 | AL260: 287 | AM260: 72.7 | AN260: 285 | AO260: 5.0000000000000003e-002 | AP260: 1 | AQ260: 新乳转债
A261: 6 | B261: 123090 | C261: 三诺转债 | D261: 300298 | E261: 三诺生物 | F261: 医药 | G261: 医疗器械 | H261: 137.853 | I261: 0.107 | J261: 2.2200000000000001e-002 | K261: 40.97 | L261: 0.17600000000000002 | M261: 117.1 | N261: 35.35 | O261: 0.18899999999999997 | P261: 115.9 | Q261: 5月4天 | R261: 5.91年 | S261: 3.91年 | T261: 5 | U261: 1005. | V261: 1.46 | W261: 2.2000000000000002e-002 | X261: 2.5000000000000001e-002 | Y261: 232 | Z261: 8.56 | AA261: -2.76e-002 | AB261: -3.2500000000000001e-002 | AC261: -6.8099999999999994e-002 | AD261: -6.9599999999999995e-002 | AE261: 87 | AF261: 91.12 | AG261: 0.73 | AH261: AA | AI261: 4.41e-002 | AJ261: =H261+100*O261 -> 156.75300000000001 | AK261: 159.8 | AL261: 283 | AM261: 68.7 | AN261: 280 | AO261: 0.14800000000000002 | AP261: 2 | AQ261: 三诺转债
A262: 59 | B262: 113603 | C262: 东缆转债 | D262: 603606 | E262: 东方电缆 | F262: 能源电力 | G262: 电力设备 | H262: 135.63 | I262: 7.7000000000000002e-003 | J262: 2.1600000000000001e-002 | K262: 27.65 | L262: 3.8699999999999998e-002 | M262: 115.1 | N262: 23.88 | O262: 0.17100000000000001 | P262: 115.79 | Q262: 2月7天 | R262: 5.67年 | S262: 3.67年 | T262: 8 | U262: 37 | V262: 3.4000000000000002e-002 | W262: 4.4000000000000004e-002 | X262: 5.0999999999999997e-002 | Y262: 181 | Z262: 6.68 | AA262: -2.8999999999999998e-002 | AB262: -3.3500000000000002e-002 | AC262: -6.83e-002 | AD262: -6.9900000000000004e-002 | AE262: 87.91 | AF262: 90.51 | AG262: 0.76 | AH262: AA | AI262: 4.41e-002 | AJ262: =H262+100*O262 -> 152.72999999999999 | AK262: 155.5 | AL262: 270 | AM262: 65 | AN262: 270 | AO262: 7.8e-002 | AP262: 6 | AQ262: 东缆转债
A263: 38 | B263: 128136 | C263: 立讯转债 | D263: 2475. | E263: 立讯精密 | F263: 电子 | G263: 元器件制 | H263: 133 | I263: 4.5000000000000005e-003 | J263: -8.8999999999999999e-003 | K263: 57.49 | L263: -7.0999999999999995e-003 | M263: 111.9 | N263: 58.44 | O263: 0.35200000000000004 | P263: 98.37 | Q263: 3月17天 | R263: 5.78年 | S263: 3.78年 | T263: 30 | U263: 107 | V263: 2.7000000000000003e-002 | W263: 6.9999999999999993e-003 | X263: 6.9999999999999993e-003 | Y263: 4037. | Z263: 16.13 | AA263: -2.9700000000000001e-002 | AB263: -3.3300000000000003e-002 | AC263: -6.4199999999999993e-002 | AD263: -6.5299999999999997e-002 | AE263: 87.06 | AF263: 88.39 | AG263: 0.62 | AH263: AA+ | AI263: 4.2099999999999999e-002 | AJ263: =H263+100*O263 -> 168.19999999999999 | AK263: 167.6 | AL263: 291 | AM263: 79.2 | AN263: 292 | AO263: 1.e-003 | AP263: 9 | AQ263: 立讯转债
A264: 47 | B264: 113605 | C264: 大参转债 | D264: 603233 | E264: 大参林 | F264: 医药 | G264: 医药商业 | H264: 137.01 | I264: 1.5300000000000001e-002 | J264: 5.1000000000000004e-003 | K264: 99.2 | L264: 2.63e-002 | M264: 115.2 | N264: 83.85 | O264: 0.158 | P264: 118.31 | Q264: 3月6天 | R264: 5.75年 | S264: 3.75年 | T264: 14.1 | U264: 37 | V264: 1.9e-002 | W264: 2.2000000000000002e-002 | X264: 2.5000000000000001e-002 | Y264: 653 | Z264: 13.04 | AA264: -3.0200000000000001e-002 | AB264: -3.4700000000000002e-002 | AC264: -6.9199999999999998e-002 | AD264: -7.0800000000000002e-002 | AE264: 87.71 | AF264: 90.3 | AG264: 0.78 | AH264: AA | AI264: 4.41e-002 | AJ264: =H264+100*O264 -> 152.81 | AK264: 155.7 | AL264: 271 | AM264: 65.4 | AN264: 271 | AO264: 0.17899999999999999 | AP264: 5 | AQ264: 大参转债
A265: 214 | B265: 128078 | C265: 太极转债! | D265: 2368. | E265: 太极股份 | F265: 计算机及 | G265: 软件开发 | H265: 135.468 | I265: -1.7600000000000001e-002 | J265: -2.2499999999999999e-002 | K265: 26.07 | L265: -4.0099999999999997e-002 | M265: 116.9 | N265: 22.4 | O265: 0.16399999999999998 | P265: 116.38 | Q265: 转股中 | R265: 4.75年 | S265: 2.75年 | T265: 9.6 | U265: 2.2 | V265: 2.e-003 | W265: 6.4000000000000001e-002 | X265: 7.400000000000001e-002 | Y265: 151 | Z265: 4.92 | AA265: -3.1099999999999999e-002 | AB265: -3.7100000000000001e-002 | AC265: -8.929999999999999e-002 | AD265: -9.1199999999999989e-002 | AE265: 91.73 | AF265: 96.35 | AG265: 1 | AH265: AA | AI265: 4.24e-002 | AJ265: =H265+100*O265 -> 151.86799999999999 | AK265: 154.6 | AL265: 267 | AM265: 58.2 | AN265: 255 | AO265: -5.4000000000000006e-002 | AP265: 12 | AQ265: 太极转债!
A266: 181 | B266: 127015 | C266: 希望转债! | D266: 876. | E266: 新 希 望 | F266: 农业 | G266: 畜牧业 | H266: 128.5 | I266: -1.15e-002 | J266: -1.01e-002 | K266: 21.79 | L266: -2.2400000000000003e-002 | M266: 110 | N266: 19.75 | O266: 0.16500000000000001 | P266: 110.33 | Q266: 转股中 | R266: 4.95年 | S266: 2.95年 | T266: 9.5 | U266: 22 | V266: 1.8000000000000002e-002 | W266: 1.e-002 | X266: 1.1000000000000001e-002 | Y266: 982 | Z266: 2.71 | AA266: -3.1300000000000001e-002 | AB266: -3.49e-002 | AC266: -6.9900000000000004e-002 | AD266: -7.1399999999999991e-002 | AE266: 91.64 | AF266: 91.97 | AG266: 0.97 | AH266: AAA | AI266: 3.7400000000000003e-002 | AJ266: =H266+100*O266 -> 145. | AK266: 146.7 | AL266: 242 | AM266: 54.7 | AN266: 245 | AO266: -6.3e-002 | AP266: 28 | AQ266: 希望转债!
A267: 103 | B267: 128119 | C267: 龙大转债 | D267: 2726. | E267: 龙大肉食 | F267: 食品饮料 | G267: 肉制品 | H267: 143.2 | I267: 2.6800000000000001e-002 | J267: 1.9299999999999998e-002 | K267: 13.23 | L267: 5.4199999999999998e-002 | M267: 120.2 | N267: 9.57 | O267: 3.6000000000000004e-002 | P267: 138.24 | Q267: 转股中 | R267: 5.47年 | S267: 3.47年 | T267: 9.5 | U267: 153 | V267: 0.11199999999999999 | W267: 7.2000000000000008e-002 | X267: 0.10000000000000001 | Y267: 132 | Z267: 4.28 | AA267: -3.2000000000000001e-002 | AB267: -3.7999999999999999e-002 | AC267: -8.5600000000000009e-002 | AD267: -8.72e-002 | AE267: 88.76 | AF267: 95.33 | AG267: 0.85 | AH267: AA | AI267: 4.41e-002 | AJ267: =H267+100*O267 -> 146.79999999999998 | AK267: 148.2 | AL267: 245 | AM267: 52.8 | AN267: 233 | AO267: 2.7999999999999997e-002 | AP267: 7 | AQ267: 龙大转债
A268: 208 | B268: 113548 | C268: 石英转债! | D268: 603688 | E268: 石英股份 | F268: 电子 | G268: 电子产品 | H268: 145.22 | I268: -3.8800000000000001e-002 | J268: 1.47e-002 | K268: 20.09 | L268: -2.8500000000000001e-002 | M268: 124.4 | N268: 15.1 | O268: 9.0999999999999998e-002 | P268: 133.05 | Q268: 转股中 | R268: 4.76年 | S268: 2.76年 | T268: 1.23 | U268: 19 | V268: 0.106 | W268: 1.7000000000000001e-002 | X268: 2.3e-002 | Y268: 71 | Z268: 3.76 | AA268: -3.2599999999999997e-002 | AB268: -4.07e-002 | AC268: -0.106 | AD268: -0.109 | AE268: 87.29 | AF268: 93.44 | AG268: 0.84 | AH268: AA- | AI268: 6.3399999999999998e-002 | AJ268: =H268+100*O268 -> 154.31999999999999 | AK268: 157.4 | AL268: 277 | AM268: 64 | AN268: 269 | AO268: -9.6999999999999989e-002 | AP268: 12 | AQ268: 石英转债!
A269: 50 | B269: 123072 | C269: 乐歌转债! | D269: 300729 | E269: 乐歌股份 | F269: 其他 | G269: 家居用品 | H269: 156.4 | I269: -2.3099999999999999e-002 | J269: 1.9e-002 | K269: 38.4 | L269: -3.0299999999999997e-002 | M269: 129.6 | N269: 73.13 | O269: 1.98 | P269: 52.51 | Q269: 3月5天 | R269: 5.75年 | S269: 3.75年 | T269: 1.42 | U269: 133 | V269: 0.59299999999999997 | W269: 2.7000000000000003e-002 | X269: 1.3999999999999999e-002 | Y269: 53 | Z269: 5.6 | AA269: -3.3000000000000002e-002 | AB269: -4.0899999999999999e-002 | AC269: -9.4299999999999995e-002 | AD269: -9.6999999999999989e-002 | AE269: 80.41 | AF269: 86.12 | AG269: 0.13 | AH269: A+ | AI269: 7.6100000000000001e-002 | AJ269: =H269+100*O269 -> 354.39999999999998 | AK269: 260.3 | AL269: 321 | AM269: 174.2 | AN269: 321 | AO269: -6.7000000000000004e-002 | AP269: 5 | AQ269: 乐歌转债!
A270: 233 | B270: 113537 | C270: 文灿转债!! | D270: 603348 | E270: 文灿股份 | F270: 汽车 | G270: 零部件制 | H270: 140.52 | I270: -6.1999999999999998e-003 | J270: 9.7000000000000003e-003 | K270: 27.14 | L270: 4.0999999999999995e-003 | M270: 121.5 | N270: 19.43 | O270: 6.0000000000000001e-003 | P270: 139.68 | Q270: 转股中 | R270: 4.38年 | S270: 2.38年 | T270: 1.94 | U270: 42 | V270: 0.154 | W270: 2.7999999999999997e-002 | X270: 3.9e-002 | Y270: 70 | Z270: 2.79 | AA270: -3.3399999999999999e-002 | AB270: -4.1299999999999996e-002 | AC270: -0.111 | AD270: -0.113 | AE270: 89.47 | AF270: 93.48 | AG270: 0.88 | AH270: AA- | AI270: 6.3399999999999998e-002 | AJ270: =H270+100*O270 -> 141.12 | AK270: 141.4 | AL270: 225 | AM270: 47.9 | AN270: 212 | AO270: 2.3e-002 | AP270: 25 | AQ270: 文灿转债!!
A271: 153 | B271: 110069 | C271: 瀚蓝转债 | D271: 600323 | E271: 瀚蓝环境 | F271: 城市公用 | G271: 三废处理 | H271: 136.11 | I271: -9.1000000000000004e-003 | J271: -3.1600000000000003e-002 | K271: 22.81 | L271: -5.5500000000000001e-002 | M271: 113.5 | N271: 20.2 | O271: 0.20499999999999999 | P271: 112.92 | Q271: 转股中 | R271: 5.21年 | S271: 3.21年 | T271: 9.83 | U271: 26 | V271: 1.9e-002 | W271: 5.5999999999999994e-002 | X271: 6.3e-002 | Y271: 175 | Z271: 2.44 | AA271: -3.4700000000000002e-002 | AB271: -3.9100000000000003e-002 | AC271: -8.1799999999999998e-002 | AD271: -8.2899999999999988e-002 | AE271: 89.05 | AF271: 91.83 | AG271: 0.73 | AH271: AA+ | AI271: 4.2099999999999999e-002 | AJ271: =H271+100*O271 -> 156.61000000000001 | AK271: 159.3 | AL271: 281 | AM271: 67.5 | AN271: 278 | AO271: -6.5000000000000002e-002 | AP271: 8 | AQ271: 瀚蓝转债
A272: 288 | B272: 123012 | C272: 万顺转债! | D272: 300057 | E272: 万顺新材 | F272: 有色金属 | G272: 铝金属 | H272: 125.13 | I272: -1.24e-002 | J272: 8.0000000000000004e-004 | K272: 4.72 | L272: -2.4799999999999999e-002 | M272: 110.3 | N272: 5.31 | O272: 0.40799999999999997 | P272: 88.89 | Q272: 转股中 | R272: 3.49年 | S272: 1.49年 | T272: 1.29 | U272: 47 | V272: 0.29199999999999998 | W272: 4.0999999999999995e-002 | X272: 3.6000000000000004e-002 | Y272: 32 | Z272: 0.94 | AA272: -3.6200000000000003e-002 | AB272: -4.1299999999999996e-002 | AC272: -0.113 | AD272: -0.10099999999999999 | AE272: 92.93 | AF272: 89.4 | AG272: 0.47 | AH272: AA- | AI272: 6.3399999999999998e-002 | AJ272: =H272+100*O272 -> 165.93000000000001 | AK272: 161.4 | AL272: 286 | AM272: 68.4 | AN272: 279 | AO272: -2.8999999999999998e-002 | AP272: 19 | AQ272: 万顺转债!
A273: 338 | B273: 113009 | C273: XD广汽转! | D273: 601238 | E273: 广汽集团 | F273: 汽车 | G273: 乘用车 | H273: 109.99 | I273: 9.300000000000001e-003 | J273: -8.3999999999999995e-003 | K273: 12.04 | L273: 1.01e-002 | M273: 107.5 | N273: 14.23 | O273: 0.29999999999999999 | P273: 84.61 | Q273: 转股中 | R273: 1年0.1天 | S273: 回售中 | T273: 25.5 | U273: 69 | V273: 2.4e-002 | W273: 2.e-002 | X273: 1.7000000000000001e-002 | Y273: 1246. | Z273: 1.49 | AA273: -3.6299999999999999e-002 | AB273: -4.7199999999999999e-002 | AC273: 回售中 | AD273: 回售中 | AE273: 100.27 | AF273: 102.66 | AG273: 0.09 | AH273: AAA | AI273: 3.2500000000000001e-002 | AJ273: =H273+100*O273 -> 139.99000000000001 | AK273: 135.4 | AL273: 196 | AM273: 32.7 | AN273: 130 | AO273: -4.2999999999999997e-002 | AP273: 16 | AQ273: XD广汽转!
A274: 306 | B274: 110043 | C274: 无锡转债! | D274: 600908 | E274: 无锡银行 | F274: 金融 | G274: 银行行业 | H274: 122.65 | I274: -1.24e-002 | J274: -2.3999999999999998e-003 | K274: 6.06 | L274: -2.4199999999999999e-002 | M274: 109.1 | N274: 5.79 | O274: 0.17199999999999999 | P274: 104.66 | Q274: 转股中 | R274: 3年8天 | S274: 无权 | T274: 30 | U274: 26 | V274: 6.9999999999999993e-003 | W274: 0.26800000000000002 | X274: 0.28000000000000003 | Y274: 112 | Z274: 0.98 | AA274: -3.8599999999999995e-002 | AB274: -4.3899999999999995e-002 | AC274: 无权 | AD274: 无权 | AE274: 无权 | AF274: 97 | AG274: 0.61 | AH274: AA+ | AI274: 4.0399999999999998e-002 | AJ274: =H274+100*O274 -> 139.84999999999999 | AK274: 140.6 | AL274: 223 | AM274: 43.6 | AN274: 192 | AO274: 2.7000000000000003e-002 | AP274: 30 | AQ274: 无锡转债!
A275: 241 | B275: 113025 | C275: 明泰转债! | D275: 601677 | E275: 明泰铝业 | F275: 有色金属 | G275: 铝金属 | H275: 136.5 | I275: -1.2800000000000001e-002 | J275: -2.8999999999999998e-003 | K275: 14.45 | L275: -1.9e-002 | M275: 115.1 | N275: 11.2 | O275: 5.7999999999999996e-002 | P275: 129.02 | Q275: 转股中 | R275: 4.21年 | S275: 2.21年 | T275: 12.8 | U275: 45 | V275: 2.6000000000000002e-002 | W275: 0.13400000000000001 | X275: 0.17300000000000001 | Y275: 96 | Z275: 1.18 | AA275: -4.0399999999999998e-002 | AB275: -4.6399999999999997e-002 | AC275: -0.11 | AD275: -0.113 | AE275: 93.8 | AF275: 97 | AG275: 0.83 | AH275: AA | AI275: 4.24e-002 | AJ275: =H275+100*O275 -> 142.30000000000001 | AK275: 144 | AL275: 233 | AM275: 47 | AN275: 210 | AO275: -2.5000000000000001e-002 | AP275: 30 | AQ275: 明泰转债!
A276: 267 | B276: 113526 | C276: 联泰转债! | D276: 603797 | E276: 联泰环保 | F276: 城市公用 | G276: 三废处理 | H276: 130.71 | I276: -1.01e-002 | J276: -2.0000000000000001e-004 | K276: 7.33 | L276: -1.3500000000000002e-002 | M276: 110.8 | N276: 6.11 | O276: 8.9999999999999997e-002 | P276: 119.97 | Q276: 转股中 | R276: 4年1.1天 | S276: 2年1.1天 | T276: 1.93 | U276: 2.5 | V276: 1.e-002 | W276: 5.9000000000000004e-002 | X276: 7.0000000000000007e-002 | Y276: 33 | Z276: 2.13 | AA276: -4.1299999999999996e-002 | AB276: -4.5899999999999996e-002 | AC276: -0.10400000000000001 | AD276: -0.106 | AE276: 94.89 | AF276: 94.89 | AG276: 0.76 | AH276: AA+ | AI276: 4.0399999999999998e-002 | AJ276: =H276+100*O276 -> 139.71000000000001 | AK276: 141.5 | AL276: 227 | AM276: 46.6 | AN276: 206 | AO276: -3.9e-002 | AP276: 9 | AQ276: 联泰转债!
A277: 333 | B277: 113012 | C277: 骆驼转债! | D277: 601311 | E277: 骆驼股份 | F277: 汽车 | G277: 零部件制 | H277: 118.05 | I277: 1.6e-002 | J277: 3.4000000000000002e-003 | K277: 10.33 | L277: 3.3000000000000002e-002 | M277: 107.8 | N277: 10.06 | O277: 0.14999999999999999 | P277: 102.68 | Q277: 转股中 | R277: 2.17年 | S277: 0.17年 | T277: 5.1 | U277: 40 | V277: 6.5000000000000002e-002 | W277: 4.4000000000000004e-002 | X277: 4.4999999999999998e-002 | Y277: 116 | Z277: 1.73 | AA277: -4.1700000000000001e-002 | AB277: -4.8099999999999997e-002 | AC277: -0.45200000000000001 | AD277: -0.46000000000000002 | AE277: 100.22 | AF277: 99.05 | AG277: 0.59 | AH277: AA | AI277: 4.0599999999999997e-002 | AJ277: =H277+100*O277 -> 133.05000000000001 | AK277: 133.4 | AL277: 186 | AM277: 33.2 | AN277: 133 | AO277: 3.2000000000000001e-002 | AP277: 18 | AQ277: 骆驼转债!
A278: 192 | B278: 113556 | C278: 至纯转债! | D278: 603690 | E278: 至纯科技 | F278: 机械装备 | G278: 专用设备 | H278: 156.01 | I278: 4.8999999999999998e-003 | J278: -9.300000000000001e-003 | K278: 45.7 | L278: -4.4000000000000003e-003 | M278: 126.4 | N278: 29.28 | O278: 0. | P278: 156.08 | Q278: 转股中 | R278: 4.91年* | S278: 2.91年 | T278: 1.07 | U278: 227 | V278: 1.3500000000000001 | W278: 8.0000000000000002e-003 | X278: 1.2e-002 | Y278: 141 | Z278: 7.75 | AA278: -4.2800000000000005e-002 | AB278: -5.0999999999999997e-002 | AC278: -0.122 | AD278: -0.124 | AE278: 83.86 | AF278: 89.57 | AG278: 1 | AH278: A+ | AI278: 7.4400000000000008e-002 | AJ278: =H278+100*O278 -> 156.00999999999999 | AK278: 155.9 | AL278: 273 | AM278: 66.4 | AN278: 275 | AO278: 0.11599999999999999 | AP278: 13 | AQ278: 至纯转债!
A279: 156 | B279: 128103 | C279: 同德转债! | D279: 2360. | E279: 同德化工 | F279: 化工 | G279: 化工 | H279: 152.66 | I279: -1.38e-002 | J279: -7.6e-003 | K279: 7.78 | L279: -2.1400000000000002e-002 | M279: 121.8 | N279: 5.18 | O279: 1.6e-002 | P279: 150.19 | Q279: 转股中 | R279: 5.17年 | S279: 3.17年 | T279: 1.44 | U279: 131 | V279: 0.58499999999999996 | W279: 4.7e-002 | X279: 7.0999999999999994e-002 | Y279: 30 | Z279: 2.54 | AA279: -4.3700000000000003e-002 | AB279: -5.0300000000000004e-002 | AC279: -0.106 | AD279: -0.10800000000000001 | AE279: 82.24 | AF279: 84.17 | AG279: 1 | AH279: A+ | AI279: 7.6100000000000001e-002 | AJ279: =H279+100*O279 -> 154.25999999999999 | AK279: 155.1 | AL279: 268 | AM279: 71 | AN279: 282 | AO279: 1.3999999999999999e-002 | AP279: 13 | AQ279: 同德转债!
A280: 133 | B280: 113583 | C280: 益丰转债 | D280: 603939 | E280: 益丰药房 | F280: 医药 | G280: 医药商业 | H280: 146.14 | I280: 2.2700000000000001e-002 | J280: 8.6999999999999994e-003 | K280: 101.66 | L280: 3.5400000000000001e-002 | M280: 115.3 | N280: 71.82 | O280: 3.2000000000000001e-002 | P280: 141.55 | Q280: 转股中 | R280: 5.36年 | S280: 3.36年 | T280: 15.5 | U280: 100 | V280: 4.4000000000000004e-002 | W280: 2.8999999999999998e-002 | X280: 4.0999999999999995e-002 | Y280: 540 | Z280: 10.73 | AA280: -4.41e-002 | AB280: -4.8799999999999996e-002 | AC280: -9.3399999999999997e-002 | AD280: -9.5100000000000004e-002 | AE280: 89.3 | AF280: 91.94 | AG280: 0.89 | AH280: AA | AI280: 4.41e-002 | AJ280: =H280+100*O280 -> 149.33999999999997 | AK280: 150.7 | AL280: 255 | AM280: 58.8 | AN280: 259 | AO280: 7.8e-002 | AP280: 10 | AQ280: 益丰转债
A281: 298 | B281: 113508 | C281: 新凤转债! | D281: 603225 | E281: 新凤鸣 | F281: 服装纺织 | G281: 纺织行业 | H281: 129.76 | I281: 1.1000000000000001e-002 | J281: -8.8999999999999999e-003 | K281: 19.07 | L281: 2.5999999999999999e-003 | M281: 112.3 | N281: 15.78 | O281: 7.400000000000001e-002 | P281: 120.85 | Q281: 转股中 | R281: 3.26年 | S281: 1.26年 | T281: 21.5 | U281: 97 | V281: 3.5000000000000003e-002 | W281: 8.1000000000000003e-002 | X281: 9.8000000000000004e-002 | Y281: 266 | Z281: 2.36 | AA281: -4.4199999999999996e-002 | AB281: -5.0599999999999999e-002 | AC281: -0.13900000000000001 | AD281: -0.14199999999999999 | AE281: 96.95 | AF281: 98.38 | AG281: 0.78 | AH281: AA | AI281: 4.24e-002 | AJ281: =H281+100*O281 -> 137.16 | AK281: 138.7 | AL281: 215 | AM281: 40.3 | AN281: 175 | AO281: 0.214 | AP281: 25 | AQ281: 新凤转债!
A282: 134 | B282: 128108 | C282: 蓝帆转债 | D282: 2382. | E282: 蓝帆医疗 | F282: 医药 | G282: 医疗器械 | H282: 144.84 | I282: 5.4900000000000004e-002 | J282: 1.4999999999999999e-002 | K282: 26.29 | L282: 7.7899999999999997e-002 | M282: 113.3 | N282: 17.79 | O282: -2.e-002 | P282: 147.78 | Q282: 转股中 | R282: 5.35年 | S282: 4.35年 | T282: 26.4 | U282: 3406. | V282: 0.89599999999999991 | W282: 0.10199999999999999 | X282: 0.151 | Y282: 258 | Z282: 2.65 | AA282: -4.5700000000000005e-002 | AB282: -4.99e-002 | AC282: -6.8499999999999991e-002 | AD282: -7.0599999999999996e-002 | AE282: 87.23 | AF282: 90.4 | AG282: 0.9 | AH282: AA | AI282: 4.41e-002 | AJ282: =H282+100*O282 -> 142.84 | AK282: 141.9 | AL282: 228 | AM282: 51.5 | AN282: 225 | AO282: 0.183 | AP282: 25 | AQ282: 蓝帆转债
A283: 329 | B283: 113013 | C283: 国君转债! | D283: 601211 | E283: 国泰君安 | F283: 金融 | G283: 证券行业 | H283: 121.36 | I283: -5.1999999999999998e-003 | J283: -2.5999999999999999e-003 | K283: 17.33 | L283: -2.0400000000000001e-002 | M283: 108.3 | N283: 19.01 | O283: 0.33100000000000002 | P283: 91.16 | Q283: 转股中 | R283: 2.45年 | S283: 无权 | T283: 69.9 | U283: 64 | V283: 6.9999999999999993e-003 | W283: 4.4999999999999998e-002 | X283: 4.0999999999999995e-002 | Y283: 1544. | Z283: 1.24 | AA283: -4.6100000000000002e-002 | AB283: -5.2000000000000005e-002 | AC283: 无权 | AD283: 无权 | AE283: 无权 | AF283: 99.55 | AG283: 0.39 | AH283: AAA | AI283: 3.56e-002 | AJ283: =H283+100*O283 -> 154.46000000000001 | AK283: 151.6 | AL283: 259 | AM283: 52 | AN283: 228 | AO283: -9.0000000000000011e-003 | AP283: 14 | AQ283: 国君转债!
A284: 102 | B284: 123058 | C284: 欣旺转债 | D284: 300207 | E284: 欣旺达 | F284: 电子 | G284: 电子产品 | H284: 151.656 | I284: 5.7200000000000001e-002 | J284: 5.0000000000000001e-003 | K284: 27.81 | L284: 7.4999999999999997e-002 | M284: 116.3 | N284: 21.24 | O284: 0.158 | P284: 130.93 | Q284: 转股中 | R284: 5.47年 | S284: 3.47年 | T284: 11.2 | U284: 106 | V284: 6.3e-002 | W284: 2.6000000000000002e-002 | X284: 3.3000000000000002e-002 | Y284: 438 | Z284: 6.92 | AA284: -4.82e-002 | AB284: -5.2999999999999999e-002 | AC284: -9.9700000000000011e-002 | AD284: -0.10099999999999999 | AE284: 88.85 | AF284: 92.26 | AG284: 0.83 | AH284: AA | AI284: 4.41e-002 | AJ284: =H284+100*O284 -> 167.45600000000002 | AK284: 172.4 | AL284: 294 | AM284: 80.1 | AN284: 294 | AO284: -2.3e-002 | AP284: 6 | AQ284: 欣旺转债
A285: 305 | B285: 128035 | C285: 大族转债! | D285: 2008. | E285: 大族激光 | F285: 机械装备 | G285: 专用设备 | H285: 125.397 | I285: 2.4500000000000001e-002 | J285: -7.8000000000000005e-003 | K285: 51.6 | L285: 3.1e-002 | M285: 108 | N285: 52.1 | O285: 0.26600000000000001 | P285: 99.04 | Q285: 转股中 | R285: 3年15天 | S285: 1年15天 | T285: 23 | U285: 44 | V285: 1.4999999999999999e-002 | W285: 4.2000000000000003e-002 | X285: 4.0999999999999995e-002 | Y285: 551 | Z285: 6 | AA285: -4.8600000000000004e-002 | AB285: -5.3200000000000004e-002 | AC285: -0.13600000000000001 | AD285: -0.14099999999999999 | AE285: 99.56 | AF285: 95.93 | AG285: 0.54 | AH285: AA+ | AI285: 4.0399999999999998e-002 | AJ285: =H285+100*O285 -> 151.99700000000001 | AK285: 151.8 | AL285: 260 | AM285: 52.2 | AN285: 230 | AO285: 0.14800000000000002 | AP285: 21 | AQ285: 大族转债!
A286: 53 | B286: 127022 | C286: 恒逸转债 | D286: 703. | E286: 恒逸石化 | F286: 化工 | G286: 化工 | H286: 146.387 | I286: -4.1999999999999997e-003 | J286: -8.5000000000000006e-003 | K286: 14.64 | L286: -1.4800000000000001e-002 | M286: 108.9 | N286: 11.5 | O286: 0.14999999999999999 | P286: 127.3 | Q286: 3月0天 | R286: 5.73年 | S286: 3.73年 | T286: 20 | U286: 45 | V286: 1.6e-002 | W286: 3.7000000000000005e-002 | X286: 4.7e-002 | Y286: 539 | Z286: 2.15 | AA286: -5.0900000000000001e-002 | AB286: -5.3499999999999999e-002 | AC286: -8.7400000000000005e-002 | AD286: -8.8599999999999998e-002 | AE286: 87.48 | AF286: 86.25 | AG286: 0.86 | AH286: AA+ | AI286: 4.2099999999999999e-002 | AJ286: =H286+100*O286 -> 161.387 | AK286: 165.5 | AL286: 288 | AM286: 78 | AN286: 289 | AO286: 0.125 | AP286: 5 | AQ286: 恒逸转债
A287: 175 | B287: 128097 | C287: 奥佳转债! | D287: 2614. | E287: 奥佳华 | F287: 机械装备 | G287: 专用设备 | H287: 149.782 | I287: -1.72e-002 | J287: 9.7000000000000003e-003 | K287: 15.05 | L287: -8.6e-003 | M287: 115.3 | N287: 10.69 | O287: 6.4000000000000001e-002 | P287: 140.79 | Q287: 转股中 | R287: 5年34天 | S287: 3年34天 | T287: 5.85 | U287: 13 | V287: 1.4999999999999999e-002 | W287: 6.3e-002 | X287: 8.8000000000000009e-002 | Y287: 93 | Z287: 2.2 | AA287: -5.0999999999999997e-002 | AB287: -5.5899999999999998e-002 | AC287: -0.105 | AD287: -0.107 | AE287: 90.33 | AF287: 92.99 | AG287: 0.87 | AH287: AA | AI287: 4.41e-002 | AJ287: =H287+100*O287 -> 156.18200000000002 | AK287: 158.8 | AL287: 279 | AM287: 65.8 | AN287: 273 | AO287: 9.6000000000000002e-002 | AP287: 25 | AQ287: 奥佳转债!
A288: 48 | B288: 113040 | C288: 星宇转债 | D288: 601799 | E288: 星宇股份 | F288: 汽车 | G288: 零部件制 | H288: 152.55 | I288: 4.07e-002 | J288: -1.7000000000000001e-002 | K288: 215 | L288: 2.7300000000000001e-002 | M288: 111.5 | N288: 158 | O288: 0.121 | P288: 136.08 | Q288: 3月6天 | R288: 5.75年 | S288: 3.75年 | T288: 15 | U288: 86 | V288: 3.7999999999999999e-002 | W288: 2.5000000000000001e-002 | X288: 3.4000000000000002e-002 | Y288: 594 | Z288: 11.17 | AA288: -5.3600000000000002e-002 | AB288: -5.7000000000000002e-002 | AC288: -9.7599999999999992e-002 | AD288: -9.849999999999999e-002 | AE288: 87.08 | AF288: 88.22 | AG288: 0.87 | AH288: AA+ | AI288: 4.2099999999999999e-002 | AJ288: =H288+100*O288 -> 164.65000000000001 | AK288: 169 | AL288: 292 | AM288: 80.8 | AN288: 295 | AO288: 9.5000000000000001e-002 | AP288: 4 | AQ288: 星宇转债
A289: 302 | B289: 127005 | C289: 长证转债! | D289: 783. | E289: 长江证券 | F289: 金融 | G289: 证券行业 | H289: 129.505 | I289: -9.1000000000000004e-003 | J289: -3.2000000000000002e-003 | K289: 8.03 | L289: -1.83e-002 | M289: 109.3 | N289: 7.28 | O289: 0.17399999999999999 | P289: 110.3 | Q289: 转股中 | R289: 3年49天 | S289: 无权 | T289: 50 | U289: 12 | V289: 2.e-003 | W289: 0.113 | X289: 0.124 | Y289: 444 | Z289: 1.59 | AA289: -5.3800000000000001e-002 | AB289: -5.8799999999999998e-002 | AC289: 无权 | AD289: 无权 | AE289: 无权 | AF289: 97.67 | AG289: 0.68 | AH289: AAA | AI289: 3.7400000000000003e-002 | AJ289: =H289+100*O289 -> 146.905 | AK289: 148.7 | AL289: 248 | AM289: 51 | AN289: 221 | AO289: -3.4000000000000002e-002 | AP289: 15 | AQ289: 长证转债!
A290: 24 | B290: 113611 | C290: 福20转债 | D290: 603806 | E290: 福斯特 | F290: 能源电力 | G290: 太阳能 | H290: 154.32 | I290: 2.46e-002 | J290: 4.4900000000000002e-002 | K290: 105.49 | L290: 7.8399999999999997e-002 | M290: 111.85 | N290: 73.69 | O290: 7.8e-002 | P290: 143.15 | Q290: 4月16天 | R290: 5.86年 | S290: 3.86年 | T290: 17 | U290: 513 | V290: 0.19600000000000001 | W290: 2.1000000000000001e-002 | X290: 2.9999999999999999e-002 | Y290: 812 | Z290: 10.17 | AA290: -5.4100000000000002e-002 | AB290: -5.74e-002 | AC290: -9.69e-002 | AD290: -9.7899999999999987e-002 | AE290: 86.37 | AF290: 87.17 | AG290: 0.89 | AH290: AA | AI290: 4.41e-002 | AJ290: =H290+100*O290 -> 162.12 | AK290: 165.5 | AL290: 289 | AM290: 78.3 | AN290: 290 | AO290: 0.19500000000000001 | AP290: 4 | AQ290: 福20转债
A291: 249 | B291: 123025 | C291: 精测转债!! | D291: 300567 | E291: 精测电子 | F291: 电子 | G291: 液晶显示 | H291: 149.999 | I291: 1.0700000000000001e-002 | J291: -2.2099999999999998e-002 | K291: 64.9 | L291: -1.34e-002 | M291: 117.3 | N291: 49.95 | O291: 0.154 | P291: 129.93 | Q291: 转股中 | R291: 4.18年 | S291: 2.18年 | T291: 3.09 | U291: 89 | V291: 0.19399999999999998 | W291: 1.9e-002 | X291: 2.5000000000000001e-002 | Y291: 160 | Z291: 10.31 | AA291: -5.8299999999999998e-002 | AB291: -6.4899999999999999e-002 | AC291: -0.111 | AD291: -0.11199999999999999 | AE291: 89.88 | AF291: 91.28 | AG291: 0.86 | AH291: AA- | AI291: 6.3399999999999998e-002 | AJ291: =H291+100*O291 -> 165.399 | AK291: 170.1 | AL291: 293 | AM291: 78.8 | AN291: 291 | AO291: 0.127 | AP291: 18 | AQ291: 精测转债!!
A292: 180 | B292: 123042 | C292: 银河转债! | D292: 300619 | E292: 金银河 | F292: 机械装备 | G292: 专用设备 | H292: 157 | I292: -1.46e-002 | J292: 3.2000000000000002e-003 | K292: 19.47 | L292: -2.3599999999999999e-002 | M292: 115.4 | N292: 24.4 | O292: 0.96799999999999997 | P292: 79.8 | Q292: 转股中 | R292: 4.98年 | S292: 2.98年 | T292: 1.67 | U292: 186 | V292: 0.70599999999999996 | W292: 0.115 | X292: 9.1999999999999998e-002 | Y292: 15 | Z292: 2.98 | AA292: -6.0999999999999999e-002 | AB292: -6.6000000000000003e-002 | AC292: -0.122 | AD292: -0.124 | AE292: 82.98 | AF292: 81.36 | AG292: 0.48 | AH292: A+ | AI292: 7.4400000000000008e-002 | AJ292: =H292+100*O292 -> 253.80000000000001 | AK292: 234.2 | AL292: 319 | AM292: 151.2 | AN292: 319 | AO292: -8.6999999999999994e-002 | AP292: 25 | AQ292: 银河转债!
A293: 281 | B293: 128046 | C293: 利尔转债! | D293: 2258. | E293: 利尔化学 | F293: 化工 | G293: 农化 | H293: 141.9 | I293: 1.37e-002 | J293: -1.e-003 | K293: 24.32 | L293: 1.4999999999999999e-002 | M293: 112.3 | N293: 18.62 | O293: 8.5999999999999993e-002 | P293: 130.61 | Q293: 转股中 | R293: 3.73年 | S293: 1.73年 | T293: 8.52 | U293: 29 | V293: 2.5000000000000001e-002 | W293: 6.7000000000000004e-002 | X293: 8.6999999999999994e-002 | Y293: 128 | Z293: 3.57 | AA293: -6.1699999999999998e-002 | AB293: -6.7199999999999996e-002 | AC293: -0.13 | AD293: -0.13100000000000001 | AE293: 95.05 | AF293: 96.45 | AG293: 0.85 | AH293: AA | AI293: 4.24e-002 | AJ293: =H293+100*O293 -> 150.5 | AK293: 153.2 | AL293: 264 | AM293: 56.7 | AN293: 253 | AO293: 0.109 | AP293: 10 | AQ293: 利尔转债!
A294: 159 | B294: 123046 | C294: 天铁转债! | D294: 300587 | E294: 天铁股份 | F294: 铁路 | G294: 铁路设备 | H294: 164 | I294: -9.64e-002 | J294: 0.107 | K294: 13.46 | L294: 1.2e-002 | M294: 118.2 | N294: 10.12 | O294: 0.23300000000000001 | P294: 133 | Q294: 转股中 | R294: 5年56天 | S294: 3年56天 | T294: 0.99 | U294: 803 | V294: 4.6699999999999999 | W294: 2.2000000000000002e-002 | X294: 2.8999999999999998e-002 | Y294: 46 | Z294: 3.3 | AA294: -6.2800000000000009e-002 | AB294: -6.83e-002 | AC294: -0.126 | AD294: -0.128 | AE294: 84.68 | AF294: 86.08 | AG294: 0.88 | AH294: AA- | AI294: 6.5099999999999991e-002 | AJ294: =H294+100*O294 -> 187.30000000000001 | AK294: 195 | AL294: 307 | AM294: 108.9 | AN294: 307 | AO294: 8.199999999999999e-002 | AP294: 11 | AQ294: 天铁转债!
A295: 255 | B295: 123022 | C295: 长信转债!! | D295: 300088 | E295: 长信科技 | F295: 通信互联 | G295: 通信设备 | H295: 149.8 | I295: -4.3400000000000001e-002 | J295: -3.8e-003 | K295: 8.66 | L295: -5.3600000000000002e-002 | M295: 114.9 | N295: 6.15 | O295: 6.4000000000000001e-002 | P295: 140.81 | Q295: 转股中 | R295: 4年55天 | S295: 2年55天 | T295: 2.57 | U295: 22 | V295: 5.5e-002 | W295: 1.2e-002 | X295: 1.7000000000000001e-002 | Y295: 213 | Z295: 3.07 | AA295: -6.3099999999999989e-002 | AB295: -6.88e-002 | AC295: -0.113 | AD295: -0.114 | AE295: 94.02 | AF295: 97.07 | AG295: 0.88 | AH295: AA | AI295: 4.24e-002 | AJ295: =H295+100*O295 -> 156.20000000000002 | AK295: 158.8 | AL295: 280 | AM295: 61.7 | AN295: 262 | AO295: -2.9999999999999999e-002 | AP295: 12 | AQ295: 长信转债!!
A296: 304 | B296: 113504 | C296: 艾华转债!! | D296: 603989 | E296: 艾华集团 | F296: 电子 | G296: 元器件制 | H296: 134.8 | I296: -1.1299999999999999e-002 | J296: 5.1000000000000004e-003 | K296: 25.39 | L296: -7.8000000000000005e-003 | M296: 110.3 | N296: 21.13 | O296: 0.122 | P296: 120.16 | Q296: 转股中 | R296: 3年39天 | S296: 1年39天 | T296: 5.59 | U296: 2.8 | V296: 4.0000000000000001e-003 | W296: 5.5999999999999994e-002 | X296: 6.7000000000000004e-002 | Y296: 101 | Z296: 4.17 | AA296: -6.3799999999999996e-002 | AB296: -6.93e-002 | AC296: -0.182 | AD296: -0.185 | AE296: 97.56 | AF296: 97.24 | AG296: 0.8 | AH296: AA | AI296: 4.24e-002 | AJ296: =H296+100*O296 -> 147. | AK296: 149.4 | AL296: 250 | AM296: 51.9 | AN296: 227 | AO296: 3.0000000000000001e-003 | AP296: 9 | AQ296: 艾华转债!!
A297: 1 | B297: 113616 | C297: N韦尔转 | D297: 603501 | E297: 韦尔股份 | F297: 电子 | G297: 元器件制 | H297: 172.18 | I297: 0.72199999999999998 | J297: 0. | K297: 322.5 | L297: 9.1000000000000004e-003 | M297: 114.5 | N297: 222.83 | O297: 0.19 | P297: 144.73 | Q297: 5月14天 | R297: 5.93年 | S297: 3.93年 | T297: 24.4 | U297: 405 | V297: 9.6000000000000002e-002 | W297: 9.0000000000000011e-003 | X297: 1.3000000000000001e-002 | Y297: 2798. | Z297: 27.62 | AA297: -6.7199999999999996e-002 | AB297: -7.1199999999999999e-002 | AC297: -0.113 | AD297: -0.114 | AE297: 87.06 | AF297: 89.96 | AG297: 0.89 | AH297: AA+ | AI297: 4.2099999999999999e-002 | AJ297: =H297+100*O297 -> 191.18000000000001 | AK297: 199.6 | AL297: 308 | AM297: 109.7 | AN297: 310 | AO297: 0.21100000000000002 | AP297: 2 | AQ297: N韦尔转
A298: 265 | B298: 128053 | C298: 尚荣转债! | D298: 2551. | E298: 尚荣医疗 | F298: 医药 | G298: 医疗器械 | H298: 151.9 | I298: -3.9000000000000003e-003 | J298: 2.3e-003 | K298: 6.18 | L298: -1.6000000000000001e-003 | M298: 114.9 | N298: 4.89 | O298: 0.20199999999999999 | P298: 126.38 | Q298: 转股中 | R298: 4年23天 | S298: 2年23天 | T298: 1.91 | U298: 259 | V298: 0.89800000000000002 | W298: 3.7999999999999999e-002 | X298: 4.8000000000000001e-002 | Y298: 51 | Z298: 1.71 | AA298: -6.7699999999999996e-002 | AB298: -7.3499999999999996e-002 | AC298: -0.12300000000000001 | AD298: -0.124 | AE298: 94.36 | AF298: 97.43 | AG298: 1 | AH298: AA | AI298: 4.24e-002 | AJ298: =H298+100*O298 -> 172.09999999999999 | AK298: 177.4 | AL298: 299 | AM298: 80 | AN298: 293 | AO298: -1.7000000000000001e-002 | AP298: 27 | AQ298: 尚荣转债!
A299: 339 | B299: 110034 | C299: 九州转债! | D299: 600998 | E299: 九州通 | F299: 医药 | G299: 医药商业 | H299: 115.74 | I299: 5.1999999999999998e-003 | J299: 4.8999999999999998e-003 | K299: 19.23 | L299: 2.0199999999999999e-002 | M299: 108 | N299: 18.32 | O299: 0.10300000000000001 | P299: 104.97 | Q299: 转股中 | R299: 0.98年 | S299: 回售中 | T299: 15 | U299: 14 | V299: 8.0000000000000002e-003 | W299: 4.2000000000000003e-002 | X299: 4.4000000000000004e-002 | Y299: 360 | Z299: 1.92 | AA299: -6.8099999999999994e-002 | AB299: -8.2200000000000009e-002 | AC299: 回售中 | AD299: 回售中 | AE299: 103 | AF299: 104.37 | AG299: 0.5 | AH299: AA+ | AI299: 3.5499999999999997e-002 | AJ299: =H299+100*O299 -> 126.03999999999999 | AK299: 126.5 | AL299: 137 | AM299: 22.1 | AN299: 43 | AO299: 7.0999999999999994e-002 | AP299: 27 | AQ299: 九州转债!
A300: 334 | B300: 113011 | C300: 光大转债 | D300: 601818 | E300: 光大银行 | F300: 金融 | G300: 银行行业 | H300: 126.93 | I300: -6.7000000000000002e-003 | J300: -1.77e-002 | K300: 4.07 | L300: -3.78e-002 | M300: 108.3 | N300: 3.76 | O300: 0.17300000000000001 | P300: 108.24 | Q300: 转股中 | R300: 2年54天 | S300: 无权 | T300: 242 | U300: 132 | V300: 4.0000000000000001e-003 | W300: 0.11 | X300: 0.11900000000000001 | Y300: 2199. | Z300: 0.65 | AA300: -7.2599999999999998e-002 | AB300: -7.9100000000000004e-002 | AC300: 无权 | AD300: 无权 | AE300: 无权 | AF300: 100.62 | AG300: 0.65 | AH300: AAA | AI300: 3.56e-002 | AJ300: =H300+100*O300 -> 144.23000000000002 | AK300: 145.6 | AL300: 240 | AM300: 45 | AN300: 199 | AO300: 2.1000000000000001e-002 | AP300: 15 | AQ300: 光大转债
A301: 151 | B301: 113575 | C301: 东时转债! | D301: 603377 | E301: 东方时尚 | F301: 其他 | G301: 其他 | H301: 170.02 | I301: 2.2599999999999999e-002 | J301: -3.6799999999999999e-002 | K301: 13.48 | L301: -2.6000000000000002e-002 | M301: 113.5 | N301: 14.56 | O301: 0.83599999999999997 | P301: 92.58 | Q301: 转股中 | R301: 5.21年 | S301: 3.21年 | T301: 0.99 | U301: 731 | V301: 4.4299999999999997 | W301: 1.2e-002 | X301: 1.1000000000000001e-002 | Y301: 82 | Z301: 4.22 | AA301: -7.5999999999999998e-002 | AB301: -8.0000000000000002e-002 | AC301: -0.13300000000000001 | AD301: -0.13500000000000001 | AE301: 89.89 | AF301: 91.09 | AG301: 0.55 | AH301: AA | AI301: 4.41e-002 | AJ301: =H301+100*O301 -> 253.62 | AK301: 247.5 | AL301: 320 | AM301: 156.4 | AN301: 320 | AO301: -0.26700000000000002 | AP301: 16 | AQ301: 东时转债!
A302: 171 | B302: 110066 | C302: 盛屯转债!! | D302: 600711 | E302: 盛屯矿业 | F302: 有色金属 | G302: 有色行业 | H302: 171.86 | I302: 3.4300000000000004e-002 | J302: -1.9e-002 | K302: 8.03 | L302: 1.6500000000000001e-002 | M302: 115.3 | N302: 4.88 | O302: 4.4000000000000004e-002 | P302: 164.55 | Q302: 转股中 | R302: 5年39天 | S302: 3年39天 | T302: 7.5 | U302: 645 | V302: 0.50800000000000001 | W302: 3.5000000000000003e-002 | X302: 5.7999999999999996e-002 | Y302: 212 | Z302: 2.01 | AA302: -7.6499999999999999e-002 | AB302: -8.1199999999999994e-002 | AC302: -0.14000000000000001 | AD302: -0.14199999999999999 | AE302: 90.27 | AF302: 92.93 | AG302: 0.93 | AH302: AA | AI302: 4.41e-002 | AJ302: =H302+100*O302 -> 176.26000000000002 | AK302: 179.2 | AL302: 300 | AM302: 86.2 | AN302: 299 | AO302: -7.2000000000000008e-002 | AP302: 41 | AQ302: 盛屯转债!!
A303: 221 | B303: 123030 | C303: 九洲转债! | D303: 300040 | E303: 九洲集团 | F303: 能源电力 | G303: 电力设备 | H303: 171.75 | I303: 7.3000000000000001e-003 | J303: 1.03e-002 | K303: 6.91 | L303: 2.2200000000000001e-002 | M303: 120 | N303: 5.65 | O303: 0.40399999999999997 | P303: 122.3 | Q303: 转股中 | R303: 4.58年 | S303: 2.58年 | T303: 0.97 | U303: 190 | V303: 1.1499999999999999 | W303: 3.7000000000000005e-002 | X303: 4.4999999999999998e-002 | Y303: 26 | Z303: 1.2 | AA303: -7.6600000000000001e-002 | AB303: -8.3299999999999999e-002 | AC303: -0.11599999999999999 | AD303: -0.11699999999999999 | AE303: 87.61 | AF303: 91.1 | AG303: 0.8 | AH303: AA- | AI303: 6.3399999999999998e-002 | AJ303: =H303+100*O303 -> 212.15000000000001 | AK303: 221.2 | AL303: 315 | AM303: 130.1 | AN303: 315 | AO303: -4.8000000000000001e-002 | AP303: 28 | AQ303: 九洲转债!
A304: 122 | B304: 128112 | C304: 歌尔转2! | D304: 2241. | E304: 歌尔股份 | F304: 电子 | G304: 电子产品 | H304: 175.66 | I304: -3.5699999999999996e-002 | J304: 3.0999999999999999e-003 | K304: 40.94 | L304: -3.2599999999999997e-002 | M304: 114.5 | N304: 23.27 | O304: -2.e-003 | P304: 175.93 | Q304: 转股中 | R304: 5.39年 | S304: 3.39年 | T304: 25.4 | U304: 815 | V304: 0.17899999999999999 | W304: 1.9e-002 | X304: 3.3000000000000002e-002 | Y304: 1341. | Z304: 7.6 | AA304: -7.7300000000000008e-002 | AB304: -8.1600000000000006e-002 | AC304: -0.13500000000000001 | AD304: -0.13699999999999998 | AE304: 89.04 | AF304: 92 | AG304: 1 | AH304: AA+ | AI304: 4.2099999999999999e-002 | AJ304: =H304+100*O304 -> 175.46000000000001 | AK304: 175.4 | AL304: 297 | AM304: 83.4 | AN304: 298 | AO304: 2.e-002 | AP304: 17 | AQ304: 歌尔转2!
A305: 256 | B305: 110055 | C305: 伊力转债!! | D305: 600197 | E305: 伊力特 | F305: 食品饮料 | G305: 白酒 | H305: 163.39 | I305: -1.67e-002 | J305: -1.6e-002 | K305: 24 | L305: -3.6900000000000002e-002 | M305: 115 | N305: 16.81 | O305: 0.14400000000000002 | P305: 142.77 | Q305: 转股中 | R305: 4年52天 | S305: 2年52天 | T305: 2.85 | U305: 206 | V305: 0.44 | W305: 2.5000000000000001e-002 | X305: 3.6000000000000004e-002 | Y305: 112 | Z305: 3.9 | AA305: -8.2799999999999999e-002 | AB305: -8.8499999999999995e-002 | AC305: -0.13500000000000001 | AD305: -0.13699999999999998 | AE305: 94.15 | AF305: 97.21 | AG305: 0.89 | AH305: AA | AI305: 4.24e-002 | AJ305: =H305+100*O305 -> 177.78999999999999 | AK305: 184 | AL305: 303 | AM305: 86.8 | AN305: 300 | AO305: -0.122 | AP305: 25 | AQ305: 伊力转债!!
A306: 196 | B306: 113029 | C306: 明阳转债!! | D306: 601615 | E306: 明阳智能 | F306: 能源电力 | G306: 风能 | H306: 174.86 | I306: 7.1999999999999998e-003 | J306: 2.7900000000000001e-002 | K306: 22.39 | L306: 3.7100000000000001e-002 | M306: 112.9 | N306: 12.8 | O306: 0. | P306: 174.92 | Q306: 转股中 | R306: 4.90年 | S306: 2.90年 | T306: 9.71 | U306: 700 | V306: 0.41499999999999998 | W306: 2.3e-002 | X306: 4.0000000000000001e-002 | Y306: 420 | Z306: 4.15 | AA306: -8.6800000000000002e-002 | AB306: -9.0899999999999995e-002 | AC306: -0.10099999999999999 | AD306: -0.10199999999999999 | AE306: 91.14 | AF306: 92.47 | AG306: 0.95 | AH306: AA | AI306: 4.24e-002 | AJ306: =H306+100*O306 -> 174.86000000000001 | AK306: 174.8 | AL306: 296 | AM306: 82.3 | AN306: 297 | AO306: 0.154 | AP306: 22 | AQ306: 明阳转债!!
A307: 105 | B307: 113592 | C307: 安20转债 | D307: 603345 | E307: 安井食品 | F307: 食品饮料 | G307: 食品饮料 | H307: 185.18 | I307: 7.0499999999999993e-002 | J307: -1.0700000000000001e-002 | K307: 216.08 | L307: 6.2199999999999998e-002 | M307: 113.1 | N307: 115.9 | O307: -6.9999999999999993e-003 | P307: 186.44 | Q307: 转股中 | R307: 5.46年 | S307: 3.46年 | T307: 8.08 | U307: 382 | V307: 0.26400000000000001 | W307: 1.6e-002 | X307: 2.8999999999999998e-002 | Y307: 511 | Z307: 15.93 | AA307: -8.77e-002 | AB307: -9.1400000000000009e-002 | AC307: -0.14300000000000002 | AD307: -0.14400000000000002 | AE307: 88.72 | AF307: 89.77 | AG307: 0.96 | AH307: AA | AI307: 4.41e-002 | AJ307: =H307+100*O307 -> 184.48000000000002 | AK307: 183.9 | AL307: 302 | AM307: 94.2 | AN307: 303 | AO307: 0.14499999999999999 | AP307: 9 | AQ307: 安20转债
A308: 232 | B308: 123027 | C308: 蓝晓转债! | D308: 300487 | E308: 蓝晓科技 | F308: 化工 | G308: 化工 | H308: 178 | I308: 7.1999999999999998e-003 | J308: 1.3000000000000001e-002 | K308: 51.16 | L308: 2.12e-002 | M308: 119.5 | N308: 29.33 | O308: 2.e-002 | P308: 174.43 | Q308: 转股中 | R308: 4.38年 | S308: 2.38年 | T308: 1.08 | U308: 169 | V308: 0.88500000000000001 | W308: 1.e-002 | X308: 1.7000000000000001e-002 | Y308: 110 | Z308: 6.91 | AA308: -8.8800000000000004e-002 | AB308: -9.5399999999999985e-002 | AC308: -0.13400000000000001 | AD308: -0.13500000000000001 | AE308: 87.17 | AF308: 87.99 | AG308: 0.95 | AH308: A+ | AI308: 7.4400000000000008e-002 | AJ308: =H308+100*O308 -> 180. | AK308: 181.6 | AL308: 301 | AM308: 93.6 | AN308: 302 | AO308: 0.111 | AP308: 21 | AQ308: 蓝晓转债!
A309: 113 | B309: 113590 | C309: 海容转债! | D309: 603187 | E309: 海容冷链 | F309: 机械装备 | G309: 通用设备 | H309: 193.02 | I309: 2.7000000000000003e-002 | J309: -3.5999999999999999e-003 | K309: 70.59 | L309: 2.41e-002 | M309: 115.6 | N309: 36.39 | O309: -5.0000000000000001e-003 | P309: 193.98 | Q309: 转股中 | R309: 5.43年 | S309: 3.43年 | T309: 4.79 | U309: 470 | V309: 0.504 | W309: 4.2999999999999997e-002 | X309: 8.3000000000000004e-002 | Y309: 112 | Z309: 6.88 | AA309: -9.1600000000000001e-002 | AB309: -9.5899999999999999e-002 | AC309: -0.153 | AD309: -0.154 | AE309: 83.04 | AF309: 82.68 | AG309: 0.97 | AH309: AA- | AI309: 6.5099999999999991e-002 | AJ309: =H309+100*O309 -> 192.52000000000001 | AK309: 192.1 | AL309: 306 | AM309: 109 | AN309: 308 | AO309: 0.122 | AP309: 7 | AQ309: 海容转债!
A310: 299 | B310: 128036 | C310: 金农转债!! | D310: 2548. | E310: 金新农 | F310: 农业 | G310: 畜牧业 | H310: 149.046 | I310: -1.34e-002 | J310: -2.8300000000000002e-002 | K310: 8.5 | L310: -4.1700000000000001e-002 | M310: 110.3 | N310: 6.96 | O310: 0.22 | P310: 122.13 | Q310: 转股中 | R310: 3年46天 | S310: 1年46天 | T310: 1.46 | U310: 146 | V310: 0.67000000000000004 | W310: 2.5000000000000001e-002 | X310: 2.9999999999999999e-002 | Y310: 59 | Z310: 2.24 | AA310: -9.3599999999999989e-002 | AB310: -9.8699999999999996e-002 | AC310: -0.23399999999999999 | AD310: -0.23600000000000002 | AE310: 95.03 | AF310: 91.42 | AG310: 1 | AH310: AA- | AI310: 6.3399999999999998e-002 | AJ310: =H310+100*O310 -> 171.04599999999999 | AK310: 176 | AL310: 298 | AM310: 80.9 | AN310: 296 | AO310: -3.7999999999999999e-002 | AP310: 16 | AQ310: 金农转债!!
A311: 216 | B311: 113545 | C311: 金能转债! | D311: 603113 | E311: 金能科技 | F311: 煤炭 | G311: 炼焦 | H311: 184.39 | I311: 1.6399999999999998e-002 | J311: -2.4199999999999999e-002 | K311: 19.29 | L311: -8.199999999999999e-003 | M311: 114.9 | N311: 10.78 | O311: 2.9999999999999999e-002 | P311: 178.94 | Q311: 转股中 | R311: 4.73年 | S311: 2.73年 | T311: 10.6 | U311: 237 | V311: 0.12300000000000001 | W311: 6.5000000000000002e-002 | X311: 0.115 | Y311: 164 | Z311: 2.14 | AA311: -9.6699999999999994e-002 | AB311: -0.10199999999999999 | AC311: -0.11900000000000001 | AD311: -0.12 | AE311: 91.8 | AF311: 94.78 | AG311: 0.95 | AH311: AA | AI311: 4.24e-002 | AJ311: =H311+100*O311 -> 187.38999999999999 | AK311: 189.8 | AL311: 304 | AM311: 95.1 | AN311: 304 | AO311: 0.20100000000000001 | AP311: 20 | AQ311: 金能转债!
A312: 39 | B312: 113041 | C312: 紫金转债 | D312: 601899 | E312: 紫金矿业 | F312: 有色金属 | G312: 贵金属 | H312: 177.49 | I312: 1.1899999999999999e-002 | J312: -2.3599999999999999e-002 | K312: 10.83 | L312: -1.2800000000000001e-002 | M312: 108 | N312: 7.01 | O312: 0.14899999999999999 | P312: 154.49 | Q312: 3月18天 | R312: 4.78年 | S312: 2.78年 | T312: 60 | U312: 248 | V312: 2.3e-002 | W312: 2.2000000000000002e-002 | X312: 3.4000000000000002e-002 | Y312: 2748. | Z312: 5.73 | AA312: -9.9299999999999999e-002 | AB312: -0.10199999999999999 | AC312: -0.113 | AD312: -0.113 | AE312: 90.97 | AF312: 90.73 | AG312: 0.92 | AH312: AAA | AI312: 3.7400000000000003e-002 | AJ312: =H312+100*O312 -> 192.39000000000001 | AK312: 200.5 | AL312: 309 | AM312: 109.5 | AN312: 309 | AO312: 5.9999999999999998e-002 | AP312: 7 | AQ312: 紫金转债
A313: 123 | B313: 128111 | C313: 中矿转债! | D313: 2738. | E313: 中矿资源 | F313: 有色金属 | G313: 有色行业 | H313: 216.729 | I313: 7.2900000000000006e-002 | J313: -9.1999999999999998e-003 | K313: 33.57 | L313: 6.3700000000000007e-002 | M313: 124.7 | N313: 15.47 | O313: -1.e-003 | P313: 217 | Q313: 转股中 | R313: 5.38年 | S313: 3.38年 | T313: 2.87 | U313: 1582. | V313: 2.5800000000000001 | W313: 2.7999999999999997e-002 | X313: 5.9999999999999998e-002 | Y313: 104 | Z313: 3.47 | AA313: -9.9399999999999988e-002 | AB313: -0.106 | AC313: -0.10400000000000001 | AD313: -0.105 | AE313: 83.87 | AF313: 89.52 | AG313: 1 | AH313: AA- | AI313: 6.5099999999999991e-002 | AJ313: =H313+100*O313 -> 216.62900000000002 | AK313: 216.5 | AL313: 312 | AM313: 126.9 | AN313: 314 | AO313: 0.126 | AP313: 9 | AQ313: 中矿转债!
A314: 285 | B314: 123014 | C314: 凯发转债! | D314: 300407 | E314: 凯发电气 | F314: 能源电力 | G314: 电力设备 | H314: 143.7 | I314: -2.0999999999999999e-003 | J314: -8.1000000000000013e-003 | K314: 6.96 | L314: -3.0600000000000002e-002 | M314: 108.5 | N314: 8.12 | O314: 0.67599999999999993 | P314: 85.71 | Q314: 转股中 | R314: 2.51年 | S314: 0.51年 | T314: 1.16 | U314: 97 | V314: 0.57999999999999996 | W314: 5.5e-002 | X314: 4.7e-002 | Y314: 21 | Z314: 1.57 | AA314: -0.107 | AB314: -0.113 | AC314: -0.45299999999999996 | AD314: -0.45500000000000002 | AE314: 96.57 | AF314: 91.22 | AG314: 0.33 | AH314: A+ | AI314: 7.2599999999999998e-002 | AJ314: =H314+100*O314 -> 211.29999999999998 | AK314: 201.7 | AL314: 310 | AM314: 105.1 | AN314: 306 | AO314: -4.7e-002 | AP314: 16 | AQ314: 凯发转债!
A315: 206 | B315: 123034 | C315: 通光转债! | D315: 300265 | E315: 通光线缆 | F315: 通信互联 | G315: 通信设备 | H315: 215.3 | I315: -7.8000000000000005e-003 | J315: 1.66e-002 | K315: 9.93 | L315: 1.0200000000000001e-002 | M315: 118 | N315: 7.97 | O315: 0.72799999999999998 | P315: 124.59 | Q315: 转股中 | R315: 4.78年 | S315: 2.78年 | T315: 0.78 | U315: 480 | V315: 2.75 | W315: 2.2000000000000002e-002 | X315: 2.7000000000000003e-002 | Y315: 36 | Z315: 2.89 | AA315: -0.12 | AB315: -0.125 | AC315: -0.13800000000000001 | AD315: -0.13900000000000001 | AE315: 83.93 | AF315: 84.29 | AG315: 0.86 | AH315: A+ | AI315: 7.4400000000000008e-002 | AJ315: =H315+100*O315 -> 288.10000000000002 | AK315: 306 | AL315: 326 | AM315: 221.7 | AN315: 327 | AO315: -2.5000000000000001e-002 | AP315: 25 | AQ315: 通光转债!
A316: 80 | B316: 113038 | C316: 隆20转债 | D316: 601012 | E316: 隆基股份 | F316: 能源电力 | G316: 太阳能 | H316: 224.47 | I316: 3.8900000000000004e-002 | J316: 9.7000000000000003e-003 | K316: 119.7 | L316: 4.9800000000000004e-002 | M316: 111.8 | N316: 52.59 | O316: -1.3999999999999999e-002 | P316: 227.61 | Q316: 15天 | R316: 5.52年 | S316: 3.52年 | T316: 50 | U316: 2005. | V316: 0.17899999999999999 | W316: 1.1000000000000001e-002 | X316: 2.5000000000000001e-002 | Y316: 4515. | Z316: 13.92 | AA316: -0.12 | AB316: -0.12300000000000001 | AC316: -0.10199999999999999 | AD316: -0.10199999999999999 | AE316: 89.77 | AF316: 90.79 | AG316: 0.98 | AH316: AAA | AI316: 3.9100000000000003e-002 | AJ316: =H316+100*O316 -> 223.06999999999999 | AK316: 221.3 | AL316: 316 | AM316: 130.5 | AN316: 316 | AO316: 0.17399999999999999 | AP316: 13 | AQ316: 隆20转债
A317: 176 | B317: 128095 | C317: 恩捷转债!! | D317: 2812. | E317: 恩捷股份 | F317: 电子 | G317: 元器件制 | H317: 223.2 | I317: -3.5999999999999999e-003 | J317: 2.1000000000000001e-002 | K317: 141.5 | L317: 1.8000000000000002e-002 | M317: 115.3 | N317: 65.09 | O317: 2.7000000000000003e-002 | P317: 217.39 | Q317: 转股中 | R317: 5年20天 | S317: 3年20天 | T317: 8 | U317: 325 | V317: 0.17999999999999999 | W317: 6.0000000000000001e-003 | X317: 1.3999999999999999e-002 | Y317: 1254. | Z317: 12.6 | AA317: -0.124 | AB317: -0.129 | AC317: -0.125 | AD317: -0.126 | AE317: 90.48 | AF317: 93.14 | AG317: 0.97 | AH317: AA | AI317: 4.41e-002 | AJ317: =H317+100*O317 -> 225.89999999999998 | AK317: 229 | AL317: 318 | AM317: 135.9 | AN317: 317 | AO317: -6.9999999999999993e-003 | AP317: 16 | AQ317: 恩捷转债!!
A318: 78 | B318: 128126 | C318: 赣锋转2 | D318: 2460. | E318: 赣锋锂业 | F318: 有色金属 | G318: 小金属 | H318: 229.799 | I318: 8.9099999999999999e-002 | J318: 8.9999999999999998e-004 | K318: 139.55 | L318: 9.1899999999999996e-002 | M318: 111.1 | N318: 60.27 | O318: -8.0000000000000002e-003 | P318: 231.54 | Q318: 21天 | R318: 5.54年 | S318: 3.54年 | T318: 21.1 | U318: 1330. | V318: 0.28499999999999998 | W318: 1.1000000000000001e-002 | X318: 2.6000000000000002e-002 | Y318: 1870. | Z318: 20.04 | AA318: -0.124 | AB318: -0.127 | AC318: -0.10400000000000001 | AD318: -0.10400000000000001 | AE318: 87.77 | AF318: 87.82 | AG318: 0.98 | AH318: AA | AI318: 4.41e-002 | AJ318: =H318+100*O318 -> 228.999 | AK318: 228.1 | AL318: 317 | AM318: 140.2 | AN318: 318 | AO318: 0.17600000000000002 | AP318: 9 | AQ318: 赣锋转2
A319: 225 | B319: 113543 | C319: 欧派转债! | D319: 603833 | E319: 欧派家居 | F319: 其他 | G319: 家居用品 | H319: 210.08 | I319: 6.4600000000000005e-002 | J319: -1.9199999999999998e-002 | K319: 145.3 | L319: 4.6799999999999994e-002 | M319: 114.9 | N319: 71.69 | O319: 3.7000000000000005e-002 | P319: 202.68 | Q319: 转股中 | R319: 4.56年 | S319: 3.56年 | T319: 5.42 | U319: 196 | V319: 0.17399999999999999 | W319: 6.0000000000000001e-003 | X319: 1.3000000000000001e-002 | Y319: 874 | Z319: 8.01 | AA319: -0.126 | AB319: -0.13 | AC319: -0.16200000000000001 | AD319: -0.16399999999999998 | AE319: 90.35 | AF319: 95.42 | AG319: 0.97 | AH319: AA | AI319: 4.24e-002 | AJ319: =H319+100*O319 -> 213.78 | AK319: 217.5 | AL319: 314 | AM319: 122.1 | AN319: 313 | AO319: 0.126 | AP319: 14 | AQ319: 欧派转债!
A320: 277 | B320: 123017 | C320: 寒锐转债!! | D320: 300618 | E320: 寒锐钴业 | F320: 有色金属 | G320: 小金属 | H320: 188.8 | I320: 6.0700000000000004e-002 | J320: -1.0700000000000001e-002 | K320: 107.31 | L320: 5.0000000000000003e-002 | M320: 110.3 | N320: 57.4 | O320: 1.e-002 | P320: 186.95 | Q320: 转股中 | R320: 3.83年* | S320: 1.83年 | T320: 3.5 | U320: 1530. | V320: 2.3199999999999998 | W320: 1.1000000000000001e-002 | X320: 2.e-002 | Y320: 326 | Z320: 8.86 | AA320: -0.13300000000000001 | AB320: -0.13699999999999998 | AC320: -0.20399999999999999 | AD320: -0.20499999999999999 | AE320: 91.02 | AF320: 87.57 | AG320: 1 | AH320: AA- | AI320: 6.3399999999999998e-002 | AJ320: =H320+100*O320 -> 189.80000000000001 | AK320: 190.6 | AL320: 305 | AM320: 99.6 | AN320: 305 | AO320: 7.2999999999999995e-002 | AP320: 14 | AQ320: 寒锐转债!!
A321: 116 | B321: 128115 | C321: 巨星转债! | D321: 2444. | E321: 巨星科技 | F321: 机械装备 | G321: 通用设备 | H321: 269.4 | I321: 3.6200000000000003e-002 | J321: 1.2199999999999999e-002 | K321: 33.22 | L321: 4.9299999999999997e-002 | M321: 115.3 | N321: 12.28 | O321: -4.0000000000000001e-003 | P321: 270.52 | Q321: 转股中 | R321: 5.42年 | S321: 3.42年 | T321: 6.38 | U321: 562 | V321: 0.32700000000000001 | W321: 1.8000000000000002e-002 | X321: 4.8000000000000001e-002 | Y321: 357 | Z321: 4.21 | AA321: -0.14699999999999999 | AB321: -0.151 | AC321: -0.121 | AD321: -0.122 | AE321: 91.37 | AF321: 91.69 | AG321: 0.98 | AH321: AA | AI321: 4.41e-002 | AJ321: =H321+100*O321 -> 269. | AK321: 268.3 | AL321: 322 | AM321: 176.6 | AN321: 322 | AO321: 7.0999999999999994e-002 | AP321: 5 | AQ321: 巨星转债!
A322: 138 | B322: 113580 | C322: 康隆转债! | D322: 603665 | E322: 康隆达 | F322: 服装纺织 | G322: 服装行业 | H322: 290.3 | I322: -1.6399999999999998e-002 | J322: 1.5100000000000001e-002 | K322: 16.21 | L322: -1.8e-003 | M322: 121.2 | N322: 15.51 | O322: 1.78 | P322: 104.51 | Q322: 转股中 | R322: 5.25年 | S322: 3.25年 | T322: 0.41 | U322: 188 | V322: 1.5600000000000001 | W322: 1.6e-002 | X322: 1.7000000000000001e-002 | Y322: 26 | Z322: 2.52 | AA322: -0.156 | AB322: -0.161 | AC322: -0.13900000000000001 | AD322: -0.14000000000000001 | AE322: 84.16 | AF322: 87.71 | AG322: 0.7 | AH322: AA- | AI322: 6.5099999999999991e-002 | AJ322: =H322+100*O322 -> 468.30000000000001 | AK322: 476.1 | AL322: 336 | AM322: 388.4 | AN322: 337 | AO322: -0.188 | AP322: 9 | AQ322: 康隆转债!
A323: 135 | B323: 113035 | C323: 福莱转债! | D323: 601865 | E323: 福莱特 | F323: 能源电力 | G323: 太阳能 | H323: 301.9 | I323: 3.9599999999999996e-002 | J323: 7.1999999999999998e-003 | K323: 40.93 | L323: 4.6799999999999994e-002 | M323: 120.3 | N323: 13.48 | O323: -6.0000000000000001e-003 | P323: 303.64 | Q323: 转股中 | R323: 5.34年* | S323: 3.34年 | T323: 1.65 | U323: 400 | V323: 0.78700000000000003 | W323: 2.e-003 | X323: 6.0000000000000001e-003 | Y323: 873 | Z323: 15.03 | AA323: -0.16 | AB323: -0.16500000000000001 | AC323: -0.13699999999999998 | AD323: -0.13699999999999998 | AE323: 89.36 | AF323: 95.96 | AG323: 1 | AH323: AA | AI323: 4.41e-002 | AJ323: =H323+100*O323 -> 301.29999999999995 | AK323: 300.2 | AL323: 325 | AM323: 204.2 | AN323: 325 | AO323: 3.2000000000000001e-002 | AP323: 8 | AQ323: 福莱转债!
A324: 219 | B324: 123031 | C324: 晶瑞转债! | D324: 300655 | E324: 晶瑞股份 | F324: 化工 | G324: 化工 | H324: 264.789 | I324: 1.8100000000000002e-002 | J324: -6.6600000000000006e-002 | K324: 32.36 | L324: -5.0499999999999996e-002 | M324: 115.8 | N324: 18.43 | O324: 0.50800000000000001 | P324: 175.58 | Q324: 转股中 | R324: 4.60年 | S324: 2.60年 | T324: 0.63 | U324: 223 | V324: 1.3500000000000001 | W324: 1.e-002 | X324: 1.8000000000000002e-002 | Y324: 61 | Z324: 4.76 | AA324: -0.16699999999999998 | AB324: -0.17100000000000001 | AC324: -0.17899999999999999 | AD324: -0.17999999999999999 | AE324: 84.85 | AF324: 83.78 | AG324: 0.96 | AH324: A+ | AI324: 7.4400000000000008e-002 | AJ324: =H324+100*O324 -> 315.589 | AK324: 354 | AL324: 333 | AM324: 269.1 | AN324: 333 | AO324: -2.1000000000000001e-002 | AP324: 16 | AQ324: 晶瑞转债!
A325: 337 | B325: 128010 | C325: 蔚蓝转债! | D325: 2245. | E325: 蔚蓝锂芯 | F325: 交通运输 | G325: 物流业 | H325: 130.68 | I325: 1.2199999999999999e-002 | J325: 6.9999999999999993e-003 | K325: 12.19 | L325: 2.0899999999999998e-002 | M325: 109.6 | N325: 9.25 | O325: -8.0000000000000002e-003 | P325: 131.78 | Q325: 转股中 | R325: 1年0.1天 | S325: 回售中 | T325: 3.35 | U325: 678 | V325: 1.5600000000000001 | W325: 2.7999999999999997e-002 | X325: 3.6000000000000004e-002 | Y325: 122 | Z325: 5.26 | AA325: -0.17399999999999999 | AB325: -0.18600000000000003 | AC325: 回售中 | AD325: 回售中 | AE325: 100.27 | AF325: 104.1 | AG325: 0.92 | AH325: AA | AI325: 3.7499999999999999e-002 | AJ325: =H325+100*O325 -> 129.88 | AK325: 129.6 | AL325: 165 | AM325: 25.5 | AN325: 72 | AO325: 1.8000000000000002e-002 | AP325: 41 | AQ325: 蔚蓝转债!
A326: 269 | B326: 123018 | C326: 溢利转债! | D326: 300381 | E326: 溢多利 | F326: 医药 | G326: 原料药 | H326: 242.001 | I326: -3.0099999999999998e-002 | J326: 3.4099999999999998e-002 | K326: 11.25 | L326: 4.5000000000000005e-003 | M326: 114.3 | N326: 8.32 | O326: 0.79000000000000004 | P326: 135.22 | Q326: 转股中 | R326: 3.91年 | S326: 1.91年 | T326: 0.54 | U326: 186 | V326: 1.4099999999999999 | W326: 1.e-002 | X326: 1.3000000000000001e-002 | Y326: 55 | Z326: 1.9 | AA326: -0.17699999999999999 | AB326: -0.182 | AC326: -0.24600000000000002 | AD326: -0.247 | AE326: 90.56 | AF326: 90.27 | AG326: 0.89 | AH326: AA- | AI326: 6.3399999999999998e-002 | AJ326: =H326+100*O326 -> 321.00099999999998 | AK326: 348.8 | AL326: 331 | AM326: 258.2 | AN326: 332 | AO326: 2.3e-002 | AP326: 13 | AQ326: 溢利转债!
A327: 136 | B327: 113582 | C327: 火炬转债! | D327: 603678 | E327: 火炬电子 | F327: 电子 | G327: 元器件制 | H327: 324.84 | I327: -1.49e-002 | J327: -1.2800000000000001e-002 | K327: 75.9 | L327: -2.8199999999999999e-002 | M327: 115.3 | N327: 25.33 | O327: 8.4000000000000005e-002 | P327: 299.64 | Q327: 转股中 | R327: 5.34年 | S327: 3.34年 | T327: 4.18 | U327: 191 | V327: 0.14099999999999999 | W327: 1.2e-002 | X327: 3.6000000000000004e-002 | Y327: 349 | Z327: 9.9 | AA327: -0.17899999999999999 | AB327: -0.182 | AC327: -0.14199999999999999 | AD327: -0.14199999999999999 | AE327: 89.36 | AF327: 91.99 | AG327: 0.98 | AH327: AA | AI327: 4.41e-002 | AJ327: =H327+100*O327 -> 333.23999999999995 | AK327: 350 | AL327: 332 | AM327: 258 | AN327: 331 | AO327: 4.4000000000000004e-002 | AP327: 5 | AQ327: 火炬转债!
A328: 313 | B328: 128030 | C328: 天康转债!! | D328: 2100. | E328: 天康生物 | F328: 农业 | G328: 畜牧业 | H328: 212.222 | I328: 3.7499999999999999e-002 | J328: -3.7000000000000002e-003 | K328: 11.31 | L328: 3.3799999999999997e-002 | M328: 111.3 | N328: 7.85 | O328: 0.47299999999999998 | P328: 144.08 | Q328: 转股中 | R328: 2.92年 | S328: 0.92年 | T328: 0.97 | U328: 321 | V328: 1.55 | W328: 8.0000000000000002e-003 | X328: 1.1000000000000001e-002 | Y328: 122 | Z328: 2.03 | AA328: -0.20100000000000001 | AB328: -0.20600000000000002 | AC328: -0.47700000000000004 | AD328: -0.47899999999999998 | AE328: 97.52 | AF328: 99.28 | AG328: 1 | AH328: AA | AI328: 4.0599999999999997e-002 | AJ328: =H328+100*O328 -> 259.52199999999999 | AK328: 280.4 | AL328: 323 | AM328: 181.1 | AN328: 323 | AO328: -3.0000000000000001e-003 | AP328: 11 | AQ328: 天康转债!!
A329: 331 | B329: 127004 | C329: 模塑转债!! | D329: 700. | E329: 模塑科技 | F329: 汽车 | G329: 零部件制 | H329: 192.758 | I329: -2.75e-002 | J329: 2.5399999999999999e-002 | K329: 5.8 | L329: -1.8600000000000002e-002 | M329: 113.3 | N329: 7.46 | O329: 1.48 | P329: 77.75 | Q329: 转股中 | R329: 2.36年 | S329: 0.36年 | T329: 1.32 | U329: 150 | V329: 0.58299999999999996 | W329: 2.5000000000000001e-002 | X329: 1.9e-002 | Y329: 53 | Z329: 2.05 | AA329: -0.20399999999999999 | AB329: -0.21199999999999999 | AC329: -0.94400000000000006 | AD329: -0.94700000000000006 | AE329: 99.7 | AF329: 100.71 | AG329: 0.11 | AH329: AA | AI329: 4.0599999999999997e-002 | AJ329: =H329+100*O329 -> 340.75800000000004 | AK329: 307.8 | AL329: 327 | AM329: 207.1 | AN329: 326 | AO329: -1.6e-002 | AP329: 37 | AQ329: 模塑转债!!
A330: 327 | B330: 128017 | C330: 金禾转债!! | D330: 2597. | E330: 金禾实业 | F330: 化工 | G330: 化工 | H330: 204.8 | I330: 2.1400000000000002e-002 | J330: -1.7100000000000001e-002 | K330: 43.32 | L330: 4.4000000000000003e-003 | M330: 108.8 | N330: 22.42 | O330: 5.9999999999999998e-002 | P330: 193.22 | Q330: 转股中 | R330: 2.78年 | S330: 0.78年 | T330: 5.52 | U330: 359 | V330: 0.32200000000000001 | W330: 2.3e-002 | X330: 4.4000000000000004e-002 | Y330: 243 | Z330: 5.27 | AA330: -0.20600000000000002 | AB330: -0.20999999999999999 | AC330: -0.53900000000000003 | AD330: -0.54000000000000004 | AE330: 97.82 | AF330: 97.57 | AG330: 0.98 | AH330: AA | AI330: 4.0599999999999997e-002 | AJ330: =H330+100*O330 -> 210.80000000000001 | AK330: 216.4 | AL330: 311 | AM330: 118.6 | AN330: 312 | AO330: 0.16399999999999998 | AP330: 10 | AQ330: 金禾转债!!
A331: 125 | B331: 128110 | C331: 永兴转债! | D331: 2756. | E331: 永兴材料 | F331: 钢铁 | G331: 炼钢 | H331: 384 | I331: 1.7500000000000002e-002 | J331: -8.3000000000000001e-003 | K331: 65.8 | L331: 9.1999999999999998e-003 | M331: 113.2 | N331: 17.06 | O331: -4.0000000000000001e-003 | P331: 385.7 | Q331: 转股中 | R331: 5.38年* | S331: 3.38年 | T331: 0.86 | U331: 2144. | V331: 6.4100000000000001 | W331: 3.0000000000000001e-003 | X331: 1.3000000000000001e-002 | Y331: 263 | Z331: 6.89 | AA331: -0.20600000000000002 | AB331: -0.20899999999999999 | AC331: -0.151 | AD331: -0.151 | AE331: 89.12 | AF331: 90.17 | AG331: 1 | AH331: AA | AI331: 4.41e-002 | AJ331: =H331+100*O331 -> 383.60000000000002 | AK331: 382.3 | AL331: 334 | AM331: 292.1 | AN331: 334 | AO331: 0.156 | AP331: 5 | AQ331: 永兴转债!
A332: 294 | B332: 110044 | C332: 广电转债!! | D332: 600831 | E332: 广电网络 | F332: 传媒娱乐 | G332: 影视娱乐 | H332: 253.65 | I332: -2.3700000000000002e-002 | J332: 1.09e-002 | K332: 6.32 | L332: -2.92e-002 | M332: 112.3 | N332: 6.9 | O332: 1.77 | P332: 91.59 | Q332: 转股中 | R332: 3.43年 | S332: 1.43年 | T332: 0.71 | U332: 69 | V332: 0.379 | W332: 1.6e-002 | X332: 1.3999999999999999e-002 | Y332: 45 | Z332: 1.21 | AA332: -0.214 | AB332: -0.21899999999999997 | AC332: -0.35100000000000003 | AD332: -0.35200000000000004 | AE332: 96.27 | AF332: 97.69 | AG332: 0.44 | AH332: AA | AI332: 4.24e-002 | AJ332: =H332+100*O332 -> 430.64999999999998 | AK332: 415.7 | AL332: 335 | AM332: 318 | AN332: 335 | AO332: -4.5999999999999999e-002 | AP332: 12 | AQ332: 广电转债!!
A333: 238 | B333: 128065 | C333: 雅化转债!! | D333: 2497. | E333: 雅化集团 | F333: 化工 | G333: 化工 | H333: 316.99 | I333: 7.6399999999999996e-002 | J333: 2.3399999999999997e-002 | K333: 28.42 | L333: 9.98e-002 | M333: 110.9 | N333: 8.95 | O333: -2.e-003 | P333: 317.54 | Q333: 转股中 | R333: 4.23年 | S333: 2.23年 | T333: 1.83 | U333: 2471. | V333: 4.3499999999999996 | W333: 6.0000000000000001e-003 | X333: 2.e-002 | Y333: 290 | Z333: 9.38 | AA333: -0.223 | AB333: -0.22600000000000001 | AC333: -0.24100000000000002 | AD333: -0.24100000000000002 | AE333: 93.71 | AF333: 93.4 | AG333: 1 | AH333: AA | AI333: 4.24e-002 | AJ333: =H333+100*O333 -> 316.79000000000002 | AK333: 316.4 | AL333: 328 | AM333: 222.7 | AN333: 328 | AO333: 0.159 | AP333: 21 | AQ333: 雅化转债!!
A334: 268 | B334: 128052 | C334: 凯龙转债! | D334: 2783. | E334: 凯龙股份 | F334: 化工 | G334: 化工 | H334: 313.601 | I334: -1.8500000000000003e-002 | J334: 2.5699999999999997e-002 | K334: 9.68 | L334: 7.3000000000000001e-003 | M334: 114.3 | N334: 6.67 | O334: 1.1599999999999999 | P334: 145.13 | Q334: 转股中 | R334: 3.91年 | S334: 1.91年 | T334: 0.32 | U334: 287 | V334: 2.8199999999999998 | W334: 9.0000000000000011e-003 | X334: 1.3000000000000001e-002 | Y334: 37 | Z334: 2.12 | AA334: -0.23000000000000001 | AB334: -0.23399999999999999 | AC334: -0.28699999999999998 | AD334: -0.28800000000000003 | AE334: 94.35 | AF334: 97.44 | AG334: 1 | AH334: AA | AI334: 4.24e-002 | AJ334: =H334+100*O334 -> 429.601 | AK334: 482.1 | AL334: 337 | AM334: 384.6 | AN334: 336 | AO334: 9.0000000000000011e-003 | AP334: 13 | AQ334: 凯龙转债!
A335: 297 | B335: 113509 | C335: 新泉转债!! | D335: 603179 | E335: 新泉股份 | F335: 汽车 | G335: 零部件制 | H335: 263 | I335: 6.8999999999999999e-003 | J335: -2.0499999999999997e-002 | K335: 37.95 | L335: -1.38e-002 | M335: 110.3 | N335: 15.55 | O335: 7.8e-002 | P335: 244.05 | Q335: 转股中 | R335: 3.36年 | S335: 1.36年 | T335: 1.05 | U335: 162 | V335: 0.59699999999999998 | W335: 8.0000000000000002e-003 | X335: 1.8000000000000002e-002 | Y335: 140 | Z335: 5.69 | AA335: -0.23100000000000001 | AB335: -0.23399999999999999 | AC335: -0.377 | AD335: -0.37799999999999995 | AE335: 96.52 | AF335: 96.2 | AG335: 0.98 | AH335: AA | AI335: 4.24e-002 | AJ335: =H335+100*O335 -> 270.80000000000001 | AK335: 281.9 | AL335: 324 | AM335: 185.4 | AN335: 324 | AO335: 4.8000000000000001e-002 | AP335: 10 | AQ335: 新泉转债!!
A336: 283 | B336: 123015 | C336: 蓝盾转债!! | D336: 300297 | E336: 蓝盾股份 | F336: 计算机及 | G336: 软件开发 | H336: 304.78 | I336: -2.e-002 | J336: 2.1000000000000001e-002 | K336: 5.08 | L336: 2.e-003 | M336: 112.3 | N336: 5.79 | O336: 2.4700000000000002 | P336: 87.74 | Q336: 转股中 | R336: 3.56年 | S336: 1.56年 | T336: 1 | U336: 843 | V336: 2.6899999999999999 | W336: 1.6e-002 | X336: 1.3999999999999999e-002 | Y336: 63 | Z336: 1.65 | AA336: -0.248 | AB336: -0.252 | AC336: -0.35700000000000004 | AD336: -0.35700000000000004 | AE336: 92.55 | AF336: 90.65 | AG336: 0.5 | AH336: AA- | AI336: 6.3399999999999998e-002 | AJ336: =H336+100*O336 -> 551.77999999999997 | AK336: 521.8 | AL336: 338 | AM336: 429.3 | AN336: 338 | AO336: 8.3000000000000004e-002 | AP336: 19 | AQ336: 蓝盾转债!!
A337: 278 | B337: 127008 | C337: 特发转债! | D337: 70. | E337: 特发信息 | F337: 通信互联 | G337: 通信设备 | H337: 244.82 | I337: -2.46e-002 | J337: -1.1299999999999999e-002 | K337: 8.33 | L337: -3.5900000000000001e-002 | M337: 110.5 | N337: 5.54 | O337: 0.628 | P337: 150.36 | Q337: 转股中 | R337: 2.82年 | S337: 0.82年 | T337: 0.59 | U337: 56 | V337: 0.38100000000000001 | W337: 9.0000000000000011e-003 | X337: 1.3000000000000001e-002 | Y337: 68 | Z337: 2.4 | AA337: -0.248 | AB337: -0.253 | AC337: -0.59799999999999998 | AD337: -0.59899999999999998 | AE337: 97.37 | AF337: 98.91 | AG337: 1 | AH337: AA | AI337: 4.0599999999999997e-002 | AJ337: =H337+100*O337 -> 307.62 | AK337: 339.3 | AL337: 330 | AM337: 240.4 | AN337: 330 | AO337: -7.2999999999999995e-002 | AP337: 16 | AQ337: 特发转债!
A338: 290 | B338: 128041 | C338: 盛路转债!! | D338: 2446. | E338: 盛路通信 | F338: 通信互联 | G338: 通信设备 | H338: 343.998 | I338: -2.58e-002 | J338: 1.1200000000000002e-002 | K338: 6.26 | L338: -2.9500000000000002e-002 | M338: 114.3 | N338: 6.82 | O338: 2.75 | P338: 91.79 | Q338: 转股中 | R338: 3.48年 | S338: 1.48年 | T338: 0.53 | U338: 394 | V338: 2.1299999999999999 | W338: 9.0000000000000011e-003 | X338: 9.0000000000000011e-003 | Y338: 57 | Z338: 1.89 | AA338: -0.27399999999999997 | AB338: -0.27899999999999997 | AC338: -0.39799999999999996 | AD338: -0.39799999999999996 | AE338: 96.05 | AF338: 99.19 | AG338: 0.5 | AH338: AA | AI338: 4.24e-002 | AJ338: =H338+100*O338 -> 618.99800000000005 | AK338: 596.2 | AL338: 339 | AM338: 497 | AN338: 339 | AO338: -4.4999999999999998e-002 | AP338: 13 | AQ338: 盛路转债!!
A339: 314 | B339: 128029 | C339: 太阳转债!! | D339: 2078. | E339: 太阳纸业 | F339: 造纸包装 | G339: 造纸行业 | H339: 204.2 | I339: 5.2600000000000001e-002 | J339: -1.0500000000000001e-002 | K339: 16.35 | L339: 4.2099999999999999e-002 | M339: 107 | N339: 8.55 | O339: 6.8000000000000005e-002 | P339: 191.23 | Q339: 转股中 | R339: 1.92年 | S339: 回售中 | T339: 9.09 | U339: 216 | V339: 0.11599999999999999 | W339: 2.1000000000000001e-002 | X339: 4.0000000000000001e-002 | Y339: 429 | Z339: 2.76 | AA339: -0.28699999999999998 | AB339: -0.29199999999999998 | AC339: 回售中 | AD339: 回售中 | AE339: 100.17 | AF339: 99.55 | AG339: 1 | AH339: AA+ | AI339: 3.8599999999999995e-002 | AJ339: =H339+100*O339 -> 211. | AK339: 217.2 | AL339: 313 | AM339: 117 | AN339: 311 | AO339: 5.9000000000000004e-002 | AP339: 7 | AQ339: 太阳转债!!
A340: 315 | B340: 128028 | C340: 赣锋转债!! | D340: 2460. | E340: 赣锋锂业 | F340: 有色金属 | G340: 小金属 | H340: 334.603 | I340: 7.0499999999999993e-002 | J340: 2.1400000000000002e-002 | K340: 139.55 | L340: 9.1899999999999996e-002 | M340: 108.5 | N340: 41.68 | O340: -1.e-003 | P340: 334.81 | Q340: 转股中 | R340: 2.91年 | S340: 0.91年 | T340: 5.04 | U340: 2214. | V340: 1.3500000000000001 | W340: 3.0000000000000001e-003 | X340: 9.0000000000000011e-003 | Y340: 1870. | Z340: 20.04 | AA340: -0.32299999999999995 | AB340: -0.32600000000000001 | AC340: -0.6409999999999999 | AD340: -0.64200000000000002 | AE340: 97 | AF340: 96.75 | AG340: 1 | AH340: AA | AI340: 4.0599999999999997e-002 | AJ340: =H340+100*O340 -> 334.50299999999999 | AK340: 334.4 | AL340: 329 | AM340: 237.4 | AN340: 329 | AO340: 0.17600000000000002 | AP340: 13 | AQ340: 赣锋转债!!
A341: 287 | B341: 123013 | C341: 横河转债! | D341: 300539 | E341: 横河模具 | F341: 机械装备 | G341: 专用设备 | H341: 487 | I341: 2.8999999999999998e-003 | J341: -1.09e-002 | K341: 6.9 | L341: -2.8199999999999999e-002 | M341: 115.2 | N341: 9.13 | O341: 5.4400000000000004 | P341: 75.58 | Q341: 转股中 | R341: 3.51年 | S341: 1.51年 | T341: 0.38 | U341: 803 | V341: 4.29 | W341: 2.5000000000000001e-002 | X341: 1.9e-002 | Y341: 15 | Z341: 3.16 | AA341: -0.34100000000000003 | AB341: -0.34499999999999997 | AC341: -0.439 | AD341: -0.44 | AE341: 91.78 | AF341: 90.12 | AG341: 0.28 | AH341: A+ | AI341: 7.4400000000000008e-002 | AJ341: =H341+100*O341 -> 1031. | AK341: 898.4 | AL341: 340 | AM341: 806.6 | AN341: 340 | AO341: -1.9e-002 | AP341: 16 | AQ341: 横河转债!
A342: 223 | B342: 123029 | C342: 英科转债! | D342: 300677 | E342: 英科医疗 | F342: 医药 | G342: 医疗器械 | H342: 3420.4 | I342: 0.107 | J342: 1.03e-002 | K342: 284.36 | L342: 0.11800000000000001 | M342: 138.2 | N342: 11.32 | O342: 0.36200000000000004 | P342: 2512.01 | Q342: 转股中 | R342: 4.56年 | S342: 2.56年 | T342: 1.23 | U342: 3535. | V342: 0.877 | W342: 1.e-003 | X342: 3.1e-002 | Y342: 1002. | Z342: 10.47 | AA342: -0.42899999999999999 | AB342: -0.43200000000000005 | AC342: -0.29299999999999998 | AD342: -0.29299999999999998 | AE342: 90.99 | AF342: 105.43 | AG342: 1 | AH342: AA- | AI342: 6.3399999999999998e-002 | AJ342: =H342+100*O342 -> 3456.5999999999999 | AK342: 4328.8000000000002 | AL342: 341 | AM342: 4223.3999999999996 | AN342: 341 | AO342: 0.40500000000000003 | AP342: 17 | AQ342: 英科转债!