A1: 序号 | B1: 转债代码 | C1: 转债名称 | D1: 股票代码 | E1: 股票名称 | F1: 行业 | G1: 子行业 | H1: 转债价格 | I1: 涨跌 | J1: 日内套利 | K1: 股价 | L1: 涨跌 | M1: 剩余本息 | N1: 转股价格 | O1: 转股溢价率 | P1: 转股价值 | Q1: 距离转股日 | R1: 剩余年限 | S1: 回售年限 | T1: 转债余额 | U1: 转债成交额 | V1: 转债换手率 | W1: 余额/市值 | X1: 余额/股本 | Y1: 股票市值 | Z1: P/B | AA1: 税前收益率 | AB1: 税后收益率 | AC1: 税前回售收益 | AD1: 税后回售收益 | AE1: 回售价值 | AF1: 纯债价值 | AG1: 弹性 | AH1: 信用 | AI1: 折现率 | AJ1: 双低 | AK1: 老式双低 | AL1: 老式排名 | AM1: 新式双低 | AN1: 新式排名 | AO1: MA20乖离 | AP1: 热门度 | AQ1: 转债名称
A2: 249 | B2: 128062 | C2: 亚药转债! | D2: 2370 | E2: 亚太药业 | F2: 医药 | G2: 化学制药 | H2: 72.166 | I2: 6.0000000000000001e-003 | J2: -6.0000000000000001e-003 | K2: 3.69 | L2: 2.5000000000000001e-002 | M2: 119.8 | N2: 16.25 | O2: 2.1800000000000002 | P2: 22.71 | Q2: 转股中 | R2: 4年13天 | S2: 2年14天 | T2: 9.63 | U2: 31 | V2: 4.4000000000000004e-002 | W2: 0.48599999999999999 | X2: 0.11 | Y2: 20 | Z2: 6.15 | AA2: 0.13699999999999998 | AB2: 0.127 | AC2: 0.17899999999999999 | AD2: 0.17499999999999999 | AE2: 83.02 | AF2: 80.65 | AG2: 0 | AH2: BBB | AI2: 0.10550000000000001 | AJ2: =H2+100*O2 -> 290.16600000000005 | AK2: 121.6 | AL2: 106 | AM2: 38.6 | AN2: 192 | AO2: 1.3999999999999999e-002 | AP2: 86 | AQ2: 亚药转债!
A3: 268 | B3: 113527 | C3: 维格转债! | D3: 603518 | E3: 锦泓集团 | F3: 服装纺织 | G3: 服装行业 | H3: 83.75 | I3: -5.9999999999999995e-004 | J3: 2.0000000000000001e-004 | K3: 5.27 | L3: -5.6999999999999993e-003 | M3: 119.5 | N3: 9.85 | O3: 0.56499999999999995 | P3: 53.5 | Q3: 转股中 | R3: 3.85年 | S3: 1.85年 | T3: 7.46 | U3: 5.2 | V3: 8.0000000000000002e-003 | W3: 0.56100000000000005 | X3: 0.29999999999999999 | Y3: 13 | Z3: 0.84 | AA3: 9.8599999999999993e-002 | AB3: 8.8699999999999987e-002 | AC3: 0.10800000000000001 | AD3: 0.105 | AE3: 92.63 | AF3: 98.11 | AG3: 0.07 | AH3: AA | AI3: 5.3499999999999999e-002 | AJ3: =H3+100*O3 -> 140.25 | AK3: 114 | AL3: 34 | AM3: 15.9 | AN3: 11 | AO3: 3.1e-002 | AP3: 100 | AQ3: 维格转债!
A4: 125 | B4: 127018 | C4: 本钢转债! | D4: 761 | E4: 本钢板材 | F4: 钢铁 | G4: 炼钢 | H4: 83.231 | I4: -5.4000000000000003e-003 | J4: 3.0999999999999999e-003 | K4: 3.21 | L4: -1.23e-002 | M4: 128.6 | N4: 5.03 | O4: 0.30399999999999999 | P4: 63.82 | Q4: 转股中 | R4: 5.28年 | S4: 3.28年 | T4: 68 | U4: 110 | V4: 1.9e-002 | W4: 0.54600000000000004 | X4: 0.34899999999999998 | Y4: 124 | Z4: 0.63 | AA4: 8.900000000000001e-002 | AB4: 7.8899999999999998e-002 | AC4: 7.5300000000000006e-002 | AD4: 7.1199999999999999e-002 | AE4: 90.18 | AF4: 100.17 | AG4: 0.18 | AH4: AAA | AI4: 5.0099999999999999e-002 | AJ4: =H4+100*O4 -> 113.631 | AK4: 102.6 | AL4: 4 | AM4: 2.5 | AN4: 1 | AO4: 2.e-002 | AP4: 54 | AQ4: 本钢转债!
A5: 167 | B5: 128100 | C5: 搜特转债! | D5: 2503 | E5: 搜于特 | F5: 服装纺织 | G5: 服装行业 | H5: 83.455 | I5: -1.7000000000000001e-003 | J5: -3.3e-003 | K5: 1.82 | L5: -3.1899999999999998e-002 | M5: 116.9 | N5: 2.9 | O5: 0.33000000000000002 | P5: 62.76 | Q5: 转股中 | R5: 4.98年 | S5: 2.98年 | T5: 8 | U5: 30 | V5: 4.4999999999999998e-002 | W5: 0.14199999999999999 | X5: 8.900000000000001e-002 | Y5: 56 | Z5: 1.02 | AA5: 7.1399999999999991e-002 | AB5: 6.480000000000001e-002 | AC5: 7.1099999999999997e-002 | AD5: 6.8699999999999997e-002 | AE5: 90.53 | AF5: 94.93 | AG5: 0.16 | AH5: AA | AI5: 4.3499999999999997e-002 | AJ5: =H5+100*O5 -> 116.455 | AK5: 104.2 | AL5: 7 | AM5: 9.2 | AN5: 3 | AO5: 1.1000000000000001e-002 | AP5: 53 | AQ5: 搜特转债!
A6: 282 | B6: 128044 | C6: 岭南转债! | D6: 2717 | E6: 岭南股份 | F6: 城市公用 | G6: 生态环境 | H6: 89.009 | I6: 1.e-004 | J6: -1.e-004 | K6: 3.13 | L6: 0. | M6: 111.3 | N6: 5.91 | O6: 0.68099999999999994 | P6: 52.96 | Q6: 转股中 | R6: 3.40年 | S6: 1.41年 | T6: 6.59 | U6: 6.3 | V6: 1.1000000000000001e-002 | W6: 0.13800000000000001 | X6: 7.2999999999999995e-002 | Y6: 48 | Z6: 0.97 | AA6: 6.9400000000000003e-002 | AB6: 6.2600000000000003e-002 | AC6: 9.69e-002 | AD6: 9.2899999999999996e-002 | AE6: 96.2 | AF6: 96.58 | AG6: 0.03 | AH6: AA | AI6: 4.3499999999999997e-002 | AJ6: =H6+100*O6 -> 157.10899999999998 | AK6: 125.1 | AL6: 147 | AM6: 28.5 | AN6: 100 | AO6: 1.3000000000000001e-002 | AP6: 40 | AQ6: 岭南转债!
A7: 89 | B7: 110072 | C7: 广汇转债! | D7: 600297 | E7: 广汇汽车 | F7: 汽车 | G7: 分销、售 | H7: 83.36 | I7: -3.2000000000000002e-003 | J7: -1.e-004 | K7: 2.64 | L7: -1.49e-002 | M7: 114.5 | N7: 4.03 | O7: 0.27300000000000002 | P7: 65.51 | Q7: 转股中 | R7: 5.41年 | S7: 3.42年 | T7: 33.7 | U7: 49 | V7: 1.7000000000000001e-002 | W7: 0.157 | X7: 0.10300000000000001 | Y7: 214 | Z7: 0.54 | AA7: 6.1399999999999996e-002 | AB7: 5.6100000000000004e-002 | AC7: 6.1200000000000004e-002 | AD7: 5.9400000000000001e-002 | AE7: 88.63 | AF7: 91.43 | AG7: 0.22 | AH7: AA+ | AI7: 4.3099999999999999e-002 | AJ7: =H7+100*O7 -> 110.66 | AK7: 101.2 | AL7: 3 | AM7: 9.8 | AN7: 4 | AO7: -5.0000000000000001e-003 | AP7: 44 | AQ7: 广汇转债!
A8: 280 | B8: 113519 | C8: 长久转债! | D8: 603569 | E8: 长久物流 | F8: 交通运输 | G8: 物流业 | H8: 96.86 | I8: 8.9999999999999998e-004 | J8: -4.0000000000000002e-004 | K8: 7.25 | L8: 5.5000000000000005e-003 | M8: 119.3 | N8: 11.15 | O8: 0.48999999999999999 | P8: 65.02 | Q8: 转股中 | R8: 3.64年 | S8: 1.64年 | T8: 6.97 | U8: 2.2 | V8: 3.0000000000000001e-003 | W8: 0.17199999999999999 | X8: 0.11199999999999999 | Y8: 41 | Z8: 1.91 | AA8: 6.0100000000000001e-002 | AB8: 5.0199999999999995e-002 | AC8: 3.3799999999999997e-002 | AD8: 3.0600000000000002e-002 | AE8: 95.25 | AF8: 102.48 | AG8: 0.1 | AH8: AA | AI8: 4.3499999999999997e-002 | AJ8: =H8+100*O8 -> 145.86000000000001 | AK8: 128.7 | AL8: 186 | AM8: 26.2 | AN8: 69 | AO8: 2.3e-002 | AP8: 20 | AQ8: 长久转债!
A9: 126 | B9: 113589 | C9: 天创转债! | D9: 603608 | E9: 天创时尚 | F9: 服装纺织 | G9: 鞋服行业 | H9: 85.38 | I9: -1.15e-002 | J9: 8.5000000000000006e-003 | K9: 6.19 | L9: -4.3299999999999998e-002 | M9: 115.3 | N9: 12.44 | O9: 0.71599999999999997 | P9: 49.76 | Q9: 转股中 | R9: 5.26年 | S9: 3.27年 | T9: 6 | U9: 52 | V9: 0.10199999999999999 | W9: 0.22600000000000001 | X9: 0.11199999999999999 | Y9: 27 | Z9: 1.25 | AA9: 6.0100000000000001e-002 | AB9: 5.4299999999999994e-002 | AC9: 5.9299999999999999e-002 | AD9: 5.6799999999999996e-002 | AE9: 89.37 | AF9: 91.86 | AG9: 0.07 | AH9: AA | AI9: 4.5100000000000001e-002 | AJ9: =H9+100*O9 -> 156.97999999999999 | AK9: 121 | AL9: 98 | AM9: 29.1 | AN9: 107 | AO9: 4.9000000000000002e-002 | AP9: 23 | AQ9: 天创转债!
A10: 247 | B10: 128063 | C10: 未来转债! | D10: 2631 | E10: 德尔未来 | F10: 其他 | G10: 家居用品 | H10: 102.278 | I10: 6.0999999999999995e-003 | J10: -7.4999999999999997e-003 | K10: 6.02 | L10: -6.6e-003 | M10: 128.2 | N10: 8.63 | O10: 0.46600000000000003 | P10: 69.76 | Q10: 转股中 | R10: 4年14天 | S10: 3年15天 | T10: 6.3 | U10: 2.1 | V10: 3.0000000000000001e-003 | W10: 0.157 | X10: 0.11 | Y10: 40 | Z10: 2.28 | AA10: 5.9500000000000004e-002 | AB10: 4.7100000000000003e-002 | AC10: 2.0199999999999999e-002 | AD10: 1.4800000000000001e-002 | AE10: 89.57 | AF10: 100.41 | AG10: 0.21 | AH10: AA- | AI10: 6.4500000000000002e-002 | AJ10: =H10+100*O10 -> 148.87800000000001 | AK10: 134.8 | AL10: 233 | AM10: 34.4 | AN10: 159 | AO10: -1.4999999999999999e-002 | AP10: 34 | AQ10: 未来转债!
A11: 172 | B11: 113569 | C11: 科达转债! | D11: 603660 | E11: 苏州科达 | F11: 通信互联 | G11: 物联网 | H11: 90.82 | I11: 0. | J11: 1.1999999999999999e-003 | K11: 7.26 | L11: 1.3999999999999999e-002 | M11: 120.3 | N11: 14.84 | O11: 0.85599999999999998 | P11: 48.92 | Q11: 转股中 | R11: 4.97年 | S11: 2.97年 | T11: 5.16 | U11: 2.6 | V11: 6.0000000000000001e-003 | W11: 0.14199999999999999 | X11: 7.0000000000000007e-002 | Y11: 36 | Z11: 2.12 | AA11: 5.9400000000000001e-002 | AB11: 5.1799999999999999e-002 | AC11: 4.3400000000000001e-002 | AD11: 4.0899999999999999e-002 | AE11: 85.33 | AF11: 88.72 | AG11: 0.09 | AH11: AA- | AI11: 6.4500000000000002e-002 | AJ11: =H11+100*O11 -> 176.41999999999999 | AK11: 132.7 | AL11: 220 | AM11: 44 | AN11: 238 | AO11: 3.3000000000000002e-002 | AP11: 26 | AQ11: 科达转债!
A12: 108 | B12: 113595 | C12: 花王转债! | D12: 603007 | E12: 花王股份 | F12: 城市公用 | G12: 生态环境 | H12: 92.85 | I12: 3.3e-003 | J12: -3.3e-003 | K12: 5.02 | L12: 0. | M12: 125.3 | N12: 6.93 | O12: 0.28199999999999997 | P12: 72.44 | Q12: 转股中 | R12: 5.34年 | S12: 3.34年 | T12: 3.3 | U12: 3.9 | V12: 1.3000000000000001e-002 | W12: 0.19600000000000001 | X12: 0.14199999999999999 | Y12: 17 | Z12: 1.51 | AA12: 5.91e-002 | AB12: 5.0599999999999999e-002 | AC12: 3.39e-002 | AD12: 3.1400000000000004e-002 | AE12: 83.52 | AF12: 89.74 | AG12: 0.36 | AH12: AA- | AI12: 6.6100000000000006e-002 | AJ12: =H12+100*O12 -> 121.04999999999998 | AK12: 113.3 | AL12: 31 | AM12: 23.5 | AN12: 47 | AO12: -2.9999999999999999e-002 | AP12: 38 | AQ12: 花王转债!
A13: 335 | B13: 127003 | C13: 海印转债! | D13: 861 | E13: 海印股份 | F13: 商业零售 | G13: 商场 | H13: 104.351 | I13: 2.9999999999999997e-004 | J13: -5.9999999999999995e-004 | K13: 2.21 | L13: -9.0000000000000011e-003 | M13: 111.8 | N13: 3 | O13: 0.41700000000000004 | P13: 73.67 | Q13: 转股中 | R13: 1.22年 | S13: 回售内 | T13: 6.74 | U13: 4.8 | V13: 6.9999999999999993e-003 | W13: 0.13100000000000001 | X13: 9.6999999999999989e-002 | Y13: 51 | Z13: 1.3 | AA13: 5.8899999999999994e-002 | AB13: 4.0199999999999993e-002 | AC13: 回售内 | AD13: 回售内 | AE13: 100.3 | AF13: 106.37 | AG13: 0.03 | AH13: AA | AI13: 4.2199999999999994e-002 | AJ13: =H13+100*O13 -> 146.05099999999999 | AK13: 135 | AL13: 237 | AM13: 28.7 | AN13: 101 | AO13: -6.9999999999999993e-003 | AP13: 76 | AQ13: 海印转债!
A14: 233 | B14: 123028 | C14: 清水转债! | D14: 300437 | E14: 清水源 | F14: 城市公用 | G14: 三废处理 | H14: 96.4 | I14: 6.3e-003 | J14: -9.0000000000000011e-003 | K14: 8.4 | L14: -9.3999999999999986e-003 | M14: 121.8 | N14: 11.84 | O14: 0.35899999999999999 | P14: 70.95 | Q14: 转股中 | R14: 4.25年 | S14: 2.25年 | T14: 4.56 | U14: 3.5 | V14: 8.0000000000000002e-003 | W14: 0.245 | X14: 0.17399999999999999 | Y14: 19 | Z14: 1.19 | AA14: 5.8299999999999998e-002 | AB14: 4.87e-002 | AC14: 3.5400000000000001e-002 | AD14: 3.1300000000000001e-002 | AE14: 90.24 | AF14: 94.11 | AG14: 0.29 | AH14: AA- | AI14: 6.4500000000000002e-002 | AJ14: =H14+100*O14 -> 132.30000000000001 | AK14: 121.9 | AL14: 111 | AM14: 27.7 | AN14: 94 | AO14: 1.3999999999999999e-002 | AP14: 52 | AQ14: 清水转债!
A15: 115 | B15: 127019 | C15: 国城转债! | D15: 688 | E15: 国城矿业 | F15: 有色金属 | G15: 锌铅镍锡 | H15: 86.168 | I15: 5.0000000000000001e-004 | J15: -3.3e-003 | K15: 10.24 | L15: -4.5700000000000005e-002 | M15: 115.1 | N15: 21.07 | O15: 0.77300000000000002 | P15: 48.6 | Q15: 转股中 | R15: 5.32年 | S15: 3.32年 | T15: 8.5 | U15: 18 | V15: 2.4e-002 | W15: 7.2999999999999995e-002 | X15: 3.5000000000000003e-002 | Y15: 116 | Z15: 5.26 | AA15: 5.7099999999999998e-002 | AB15: 5.1500000000000004e-002 | AC15: 5.4699999999999999e-002 | AD15: 5.2499999999999998e-002 | AE15: 88.95 | AF15: 91.43 | AG15: 0.06 | AH15: AA | AI15: 4.5100000000000001e-002 | AJ15: =H15+100*O15 -> 163.46800000000002 | AK15: 123.7 | AL15: 133 | AM15: 32.3 | AN15: 141 | AO15: 4.5999999999999999e-002 | AP15: 38 | AQ15: 国城转债!
A16: 252 | B16: 113530 | C16: 大丰转债! | D16: 603081 | E16: 大丰实业 | F16: 建筑 | G16: 装饰工程 | H16: 98.2 | I16: 7.000000000000001e-004 | J16: 0. | K16: 11.29 | L16: 5.3e-003 | M16: 121.6 | N16: 16.64 | O16: 0.44700000000000001 | P16: 67.85 | Q16: 转股中 | R16: 4年7天 | S16: 2年8天 | T16: 6.3 | U16: 1.2 | V16: 2.e-003 | W16: 0.13900000000000001 | X16: 9.4e-002 | Y16: 45 | Z16: 2.21 | AA16: 5.5899999999999998e-002 | AB16: 4.6100000000000002e-002 | AC16: 2.4700000000000003e-002 | AD16: 2.1400000000000002e-002 | AE16: 94.41 | AF16: 102.87 | AG16: 0.13 | AH16: AA | AI16: 4.3499999999999997e-002 | AJ16: =H16+100*O16 -> 142.90000000000001 | AK16: 128.6 | AL16: 185 | AM16: 25.7 | AN16: 65 | AO16: 1.6e-002 | AP16: 34 | AQ16: 大丰转债!
A17: 318 | B17: 128023 | C17: 亚太转债! | D17: 2284 | E17: 亚太股份 | F17: 汽车 | G17: 零部件制 | H17: 96.291 | I17: 5.0000000000000001e-004 | J17: -8.0000000000000004e-004 | K17: 5.15 | L17: -1.9e-002 | M17: 111.3 | N17: 10.34 | O17: 0.93299999999999994 | P17: 49.81 | Q17: 转股中 | R17: 2.71年 | S17: 0.71年 | T17: 9.99 | U17: 4.5 | V17: 5.0000000000000001e-003 | W17: 0.26300000000000001 | X17: 0.13100000000000001 | Y17: 38 | Z17: 1.56 | AA17: 5.5800000000000002e-002 | AB17: 4.7599999999999996e-002 | AC17: 6.5500000000000003e-002 | AD17: 6.1200000000000004e-002 | AE17: 98.18 | AF17: 99.68 | AG17: 0.01 | AH17: AA | AI17: 4.2199999999999994e-002 | AJ17: =H17+100*O17 -> 189.59100000000001 | AK17: 142.8 | AL17: 269 | AM17: 43.1 | AN17: 225 | AO17: -2.3e-002 | AP17: 69 | AQ17: 亚太转债!
A18: 90 | B18: 113600 | C18: 新星转债! | D18: 603978 | E18: 深圳新星 | F18: 有色金属 | G18: 有色行业 | H18: 94.7 | I18: -9.1000000000000004e-003 | J18: -4.8999999999999998e-003 | K18: 18.66 | L18: -3.27e-002 | M18: 126 | N18: 23.85 | O18: 0.20999999999999999 | P18: 78.24 | Q18: 转股中 | R18: 5.40年 | S18: 3.40年 | T18: 5.95 | U18: 7.8 | V18: 1.3999999999999999e-002 | W18: 0.19899999999999998 | X18: 0.156 | Y18: 30 | Z18: 1.96 | AA18: 5.5399999999999998e-002 | AB18: 4.6900000000000004e-002 | AC18: 2.6699999999999998e-002 | AD18: 2.4399999999999998e-002 | AE18: 82.9 | AF18: 89.81 | AG18: 0.43 | AH18: AA- | AI18: 6.6100000000000006e-002 | AJ18: =H18+100*O18 -> 115.7 | AK18: 111.2 | AL18: 23 | AM18: 21.4 | AN18: 29 | AO18: -2.e-003 | AP18: 18 | AQ18: 新星转债!
A19: 300 | B19: 128037 | C19: 岩土转债! | D19: 2542 | E19: 中化岩土 | F19: 建筑 | G19: 建筑工程 | H19: 94.999 | I19: -2.7000000000000001e-003 | J19: 2.7000000000000001e-003 | K19: 2.84 | L19: 3.4999999999999996e-003 | M19: 111.3 | N19: 7.99 | O19: 1.6699999999999999 | P19: 35.54 | Q19: 转股中 | R19: 2.99年 | S19: 0.99年 | T19: 5.99 | U19: 2.3 | V19: 4.0000000000000001e-003 | W19: 0.11699999999999999 | X19: 4.2000000000000003e-002 | Y19: 51 | Z19: 1.26 | AA19: 5.5300000000000002e-002 | AB19: 4.7800000000000002e-002 | AC19: 6.1799999999999994e-002 | AD19: 5.8499999999999996e-002 | AE19: 97.06 | AF19: 98.55 | AG19: 0 | AH19: AA | AI19: 4.2199999999999994e-002 | AJ19: =H19+100*O19 -> 261.99900000000002 | AK19: 154.5 | AL19: 299 | AM19: 55.9 | AN19: 284 | AO19: 2.4e-002 | AP19: 50 | AQ19: 岩土转债!
A20: 220 | B20: 128074 | C20: 游族转债!! | D20: 2174 | E20: 游族网络 | F20: 通信互联 | G20: 互联网 | H20: 95.1 | I20: 8.9999999999999998e-004 | J20: 8.9999999999999998e-004 | K20: 10.51 | L20: 1.55e-002 | M20: 119.9 | N20: 16.97 | O20: 0.53600000000000003 | P20: 61.93 | Q20: 转股中 | R20: 4.51年 | S20: 2.52年 | T20: 6.83 | U20: 3.9 | V20: 6.0000000000000001e-003 | W20: 7.0999999999999994e-002 | X20: 4.4000000000000004e-002 | Y20: 96 | Z20: 1.7 | AA20: 5.3800000000000001e-002 | AB20: 4.5599999999999995e-002 | AC20: 3.2000000000000001e-002 | AD20: 2.9399999999999999e-002 | AE20: 92.35 | AF20: 94.35 | AG20: 0.12 | AH20: AA | AI20: 4.3499999999999997e-002 | AJ20: =H20+100*O20 -> 148.69999999999999 | AK20: 128.3 | AL20: 181 | AM20: 33.9 | AN20: 151 | AO20: -2.3e-002 | AP20: 26 | AQ20: 游族转债!!
A21: 329 | B21: 128015 | C21: 久其转债! | D21: 2279 | E21: 久其软件 | F21: 计算机及 | G21: 软件开发 | H21: 98.867 | I21: 1.7000000000000001e-003 | J21: -1.7000000000000001e-003 | K21: 4.72 | L21: 1.0700000000000001e-002 | M21: 110.8 | N21: 9.48 | O21: 0.98599999999999999 | P21: 49.79 | Q21: 转股中 | R21: 2.22年 | S21: 0.22年 | T21: 7.8 | U21: 7.3 | V21: 1.e-002 | W21: 0.23199999999999998 | X21: 0.11599999999999999 | Y21: 34 | Z21: 4.76 | AA21: 5.3600000000000002e-002 | AB21: 4.4000000000000004e-002 | AC21: 7.17e-002 | AD21: 6.3200000000000006e-002 | AE21: 98.78 | AF21: 94.77 | AG21: 0 | AH21: A+ | AI21: 7.4200000000000002e-002 | AJ21: =H21+100*O21 -> 197.46699999999998 | AK21: 147.9 | AL21: 285 | AM21: 49.2 | AN21: 263 | AO21: 1.4999999999999999e-002 | AP21: 68 | AQ21: 久其转债!
A22: 238 | B22: 113535 | C22: 大业转债! | D22: 603278 | E22: 大业股份 | F22: 汽车 | G22: 零部件制 | H22: 96.36 | I22: 5.9999999999999995e-004 | J22: -1.1999999999999999e-003 | K22: 8.18 | L22: -4.8999999999999998e-003 | M22: 113.1 | N22: 12.4 | O22: 0.46100000000000002 | P22: 65.97 | Q22: 转股中 | R22: 3年50天 | S22: 1年51天 | T22: 5 | U22: 1.2 | V22: 3.0000000000000001e-003 | W22: 0.21100000000000002 | X22: 0.13900000000000001 | Y22: 24 | Z22: 1.45 | AA22: 5.3200000000000004e-002 | AB22: 4.5100000000000001e-002 | AC22: 4.36e-002 | AD22: 4.0599999999999997e-002 | AE22: 96.37 | AF22: 99.15 | AG22: 0.11 | AH22: AA | AI22: 4.3499999999999997e-002 | AJ22: =H22+100*O22 -> 142.46000000000001 | AK22: 126.8 | AL22: 167 | AM22: 27.6 | AN22: 90 | AO22: 3.5000000000000003e-002 | AP22: 50 | AQ22: 大业转债!
A23: 199 | B23: 128085 | C23: 鸿达转债! | D23: 2002 | E23: 鸿达兴业 | F23: 化工 | G23: 化工 | H23: 98.3 | I23: 7.1999999999999998e-003 | J23: 1.e-003 | K23: 3.86 | L23: 1.0500000000000001e-002 | M23: 124.4 | N23: 3.92 | O23: -2.e-003 | P23: 98.47 | Q23: 转股中 | R23: 4.74年 | S23: 2.75年 | T23: 14.2 | U23: 504 | V23: 0.35399999999999998 | W23: 0.13400000000000001 | X23: 0.13200000000000001 | Y23: 106 | Z23: 1.4 | AA23: 5.2000000000000005e-002 | AB23: 4.2800000000000005e-002 | AC23: 1.9400000000000001e-002 | AD23: 1.67e-002 | AE23: 73.89 | AF23: 71.93 | AG23: 0.78 | AH23: BB | AI23: 0.1255 | AJ23: =H23+100*O23 -> 98.099999999999994 | AK23: 98.1 | AL23: 1 | AM23: 24.2 | AN23: 53 | AO23: 4.8000000000000001e-002 | AP23: 99 | AQ23: 鸿达转债!
A24: 310 | B24: 113017 | C24: 吉视转债! | D24: 601929 | E24: 吉视传媒 | F24: 传媒娱乐 | G24: 影视娱乐 | H24: 95.06 | I24: -2.5000000000000001e-003 | J24: 2.5000000000000001e-003 | K24: 1.85 | L24: 0. | M24: 108.8 | N24: 2.95 | O24: 0.51600000000000001 | P24: 62.71 | Q24: 转股中 | R24: 2.78年 | S24: 0.78年 | T24: 15.6 | U24: 13 | V24: 9.0000000000000011e-003 | W24: 0.27100000000000002 | X24: 0.17000000000000001 | Y24: 58 | Z24: 0.87 | AA24: 5.0599999999999999e-002 | AB24: 4.4199999999999996e-002 | AC24: 7.2800000000000004e-002 | AD24: 6.93e-002 | AE24: 97.86 | AF24: 97.68 | AG24: 0.05 | AH24: AA+ | AI24: 4.0199999999999993e-002 | AJ24: =H24+100*O24 -> 146.66 | AK24: 127.4 | AL24: 171 | AM24: 29.6 | AN24: 110 | AO24: 1.3000000000000001e-002 | AP24: 61 | AQ24: 吉视转债!
A25: 47 | B25: 128138 | C25: 侨银转债! | D25: 2973 | E25: 侨银股份 | F25: 城市公用 | G25: 城市公用 | H25: 104.2 | I25: 3.0999999999999999e-003 | J25: -2.0999999999999999e-003 | K25: 21.3 | L25: 2.3999999999999998e-003 | M25: 136.5 | N25: 25.43 | O25: 0.24399999999999999 | P25: 83.76 | Q25: 2月6天 | R25: 5.66年 | S25: 3.67年 | T25: 4.2 | U25: 2.3 | V25: 5.0000000000000001e-003 | W25: 4.8000000000000001e-002 | X25: 4.0000000000000001e-002 | Y25: 87 | Z25: 6.52 | AA25: 4.9800000000000004e-002 | AB25: 3.9300000000000002e-002 | AC25: 5.9999999999999995e-004 | AD25: -1.7000000000000001e-003 | AE25: 81.91 | AF25: 95.66 | AG25: 0.43 | AH25: AA- | AI25: 6.6100000000000006e-002 | AJ25: =H25+100*O25 -> 128.59999999999999 | AK25: 124.6 | AL25: 143 | AM25: 29 | AN25: 106 | AO25: -4.4999999999999998e-002 | AP25: 8 | AQ25: 侨银转债!
A26: 100 | B26: 113596 | C26: 城地转债! | D26: 603887 | E26: 城地香江 | F26: 通信互联 | G26: 通信设备 | H26: 88.41 | I26: 1.6200000000000003e-002 | J26: -1.54e-002 | K26: 14.63 | L26: 7.6e-003 | M26: 113.5 | N26: 29.21 | O26: 0.76500000000000001 | P26: 50.09 | Q26: 转股中 | R26: 5.36年 | S26: 3.36年 | T26: 12 | U26: 33 | V26: 3.1e-002 | W26: 0.218 | X26: 0.109 | Y26: 55 | Z26: 1.52 | AA26: 4.8799999999999996e-002 | AB26: 4.3799999999999999e-002 | AC26: 4.7199999999999999e-002 | AD26: 4.4900000000000002e-002 | AE26: 83.07 | AF26: 81.16 | AG26: 0.11 | AH26: AA- | AI26: 6.6100000000000006e-002 | AJ26: =H26+100*O26 -> 164.91 | AK26: 126.7 | AL26: 165 | AM26: 43.7 | AN26: 235 | AO26: -5.7999999999999996e-002 | AP26: 18 | AQ26: 城地转债!
A27: 289 | B27: 123011 | C27: 德尔转债! | D27: 300473 | E27: 德尔股份 | F27: 汽车 | G27: 零部件制 | H27: 99.639 | I27: 1.8200000000000001e-002 | J27: -1.7500000000000002e-002 | K27: 18.11 | L27: 1.34e-002 | M27: 116.3 | N27: 34.54 | O27: 0.90000000000000002 | P27: 52.43 | Q27: 转股中 | R27: 3.33年 | S27: 1.33年 | T27: 2.51 | U27: 7 | V27: 2.7999999999999997e-002 | W27: 0.122 | X27: 6.4000000000000001e-002 | Y27: 21 | Z27: 0.92 | AA27: 4.8600000000000004e-002 | AB27: 3.9300000000000002e-002 | AC27: 2.1299999999999999e-002 | AD27: 1.7500000000000002e-002 | AE27: 93.69 | AF27: 94.86 | AG27: 0.06 | AH27: AA- | AI27: 6.4500000000000002e-002 | AJ27: =H27+100*O27 -> 189.63900000000001 | AK27: 146.8 | AL27: 281 | AM27: 52 | AN27: 272 | AO27: -3.4000000000000002e-002 | AP27: 42 | AQ27: 德尔转债!
A28: 146 | B28: 113573 | C28: 纵横转债! | D28: 603602 | E28: 纵横通信 | F28: 通信互联 | G28: 通信设备 | H28: 98.6 | I28: 3.0999999999999999e-003 | J28: -6.6e-003 | K28: 11.24 | L28: -1.49e-002 | M28: 124.7 | N28: 18.81 | O28: 0.65000000000000002 | P28: 59.76 | Q28: 转股中 | R28: 5年28天 | S28: 3年29天 | T28: 2.7 | U28: 30 | V28: 0.11 | W28: 0.11800000000000001 | X28: 7.0000000000000007e-002 | Y28: 23 | Z28: 3.4 | AA28: 4.8600000000000004e-002 | AB28: 3.9900000000000005e-002 | AC28: 1.8700000000000001e-002 | AD28: 1.5800000000000002e-002 | AE28: 82.5 | AF28: 86.37 | AG28: 0.24 | AH28: A+ | AI28: 7.7100000000000002e-002 | AJ28: =H28+100*O28 -> 163.59999999999999 | AK28: 137.4 | AL28: 250 | AM28: 51.1 | AN28: 270 | AO28: 1.4999999999999999e-002 | AP28: 23 | AQ28: 纵横转债!
A29: 77 | B29: 128132 | C29: 交建转债! | D29: 2941 | E29: 新疆交建 | F29: 建筑 | G29: 建筑工程 | H29: 90.96 | I29: 2.9999999999999997e-004 | J29: -2.0000000000000001e-004 | K29: 10.68 | L29: 8.9999999999999998e-004 | M29: 117.3 | N29: 18.57 | O29: 0.58200000000000007 | P29: 57.51 | Q29: 3.1天 | R29: 5.49年 | S29: 3.49年 | T29: 8.5 | U29: 6.7 | V29: 9.0000000000000011e-003 | W29: 0.12300000000000001 | X29: 7.0999999999999994e-002 | Y29: 69 | Z29: 2.84 | AA29: 4.8399999999999999e-002 | AB29: 4.24e-002 | AC29: 3.7100000000000001e-002 | AD29: 3.5000000000000003e-002 | AE29: 88.48 | AF29: 92.51 | AG29: 0.12 | AH29: AA | AI29: 4.5100000000000001e-002 | AJ29: =H29+100*O29 -> 149.16 | AK29: 124.4 | AL29: 142 | AM29: 31.9 | AN29: 139 | AO29: -2.3e-002 | AP29: 15 | AQ29: 交建转债!
A30: 241 | B30: 127013 | C30: 创维转债! | D30: 810 | E30: 创维数字 | F30: 电子 | G30: 电子产品 | H30: 97.8 | I30: 5.4000000000000003e-003 | J30: -6.0999999999999995e-003 | K30: 7.36 | L30: -6.7000000000000002e-003 | M30: 117.9 | N30: 11.39 | O30: 0.51400000000000001 | P30: 64.62 | Q30: 转股中 | R30: 4年26天 | S30: 2年27天 | T30: 9.78 | U30: 3.1 | V30: 3.0000000000000001e-003 | W30: 0.125 | X30: 8.1000000000000003e-002 | Y30: 78 | Z30: 2.02 | AA30: 4.8099999999999997e-002 | AB30: 3.9800000000000002e-002 | AC30: 2.5499999999999998e-002 | AD30: 2.2400000000000003e-002 | AE30: 94.1 | AF30: 99.51 | AG30: 0.12 | AH30: AA | AI30: 4.3499999999999997e-002 | AJ30: =H30+100*O30 -> 149.19999999999999 | AK30: 131 | AL30: 203 | AM30: 31.5 | AN30: 135 | AO30: -2.9999999999999999e-002 | AP30: 24 | AQ30: 创维转债!
A31: 24 | B31: 123088 | C31: 威唐转债! | D31: 300707 | E31: 威唐工业 | F31: 汽车 | G31: 零部件制 | H31: 93.801 | I31: 1.5700000000000002e-002 | J31: -1.6299999999999999e-002 | K31: 14.04 | L31: -1.4000000000000002e-003 | M31: 121.6 | N31: 20.75 | O31: 0.38600000000000001 | P31: 67.66 | Q31: 3月4天 | R31: 5.74年 | S31: 3.74年 | T31: 3.01 | U31: 21 | V31: 7.2999999999999995e-002 | W31: 0.13699999999999998 | X31: 9.1999999999999998e-002 | Y31: 22 | Z31: 3.24 | AA31: 4.7300000000000002e-002 | AB31: 4.0399999999999998e-002 | AC31: 2.86e-002 | AD31: 2.6200000000000001e-002 | AE31: 78.52 | AF31: 80.19 | AG31: 0.43 | AH31: A+ | AI31: 7.7100000000000002e-002 | AJ31: =H31+100*O31 -> 132.40100000000001 | AK31: 119.9 | AL31: 88 | AM31: 39.8 | AN31: 202 | AO31: 1.6e-002 | AP31: 9 | AQ31: 威唐转债!
A32: 187 | B32: 128093 | C32: 百川转债! | D32: 2455 | E32: 百川股份 | F32: 化工 | G32: 化工 | H32: 105 | I32: -3.3e-003 | J32: -2.3e-003 | K32: 5.81 | L32: -1.0200000000000001e-002 | M32: 129.8 | N32: 5.87 | O32: 6.0999999999999999e-002 | P32: 98.98 | Q32: 转股中 | R32: 4.79年 | S32: 2.79年 | T32: 5.2 | U32: 12 | V32: 2.2000000000000002e-002 | W32: 0.17300000000000001 | X32: 0.17100000000000001 | Y32: 30 | Z32: 2.32 | AA32: 4.6900000000000004e-002 | AB32: 3.61e-002 | AC32: 6.0999999999999995e-003 | AD32: 1.6000000000000001e-003 | AE32: 89.1 | AF32: 97.2 | AG32: 0.55 | AH32: AA- | AI32: 6.4500000000000002e-002 | AJ32: =H32+100*O32 -> 111.09999999999999 | AK32: 111 | AL32: 20 | AM32: 13.8 | AN32: 8 | AO32: -8.0000000000000002e-003 | AP32: 50 | AQ32: 百川转债!
A33: 264 | B33: 113528 | C33: 长城转债! | D33: 603897 | E33: 长城科技 | F33: 机械装备 | G33: 专用设备 | H33: 97.86 | I33: 7.3000000000000001e-003 | J33: -1.2999999999999999e-003 | K33: 17.37 | L33: 1.8799999999999997e-002 | M33: 116.8 | N33: 23.45 | O33: 0.32100000000000001 | P33: 74.07 | Q33: 转股中 | R33: 3.95年 | S33: 1.95年 | T33: 6.34 | U33: 4.2 | V33: 6.9999999999999993e-003 | W33: 0.20499999999999999 | X33: 0.152 | Y33: 31 | Z33: 1.69 | AA33: 4.6799999999999994e-002 | AB33: 3.8699999999999998e-002 | AC33: 2.53e-002 | AD33: 2.23e-002 | AE33: 90.44 | AF33: 91.7 | AG33: 0.32 | AH33: AA- | AI33: 6.4500000000000002e-002 | AJ33: =H33+100*O33 -> 129.96000000000001 | AK33: 121.6 | AL33: 108 | AM33: 29.9 | AN33: 112 | AO33: 2.7999999999999997e-002 | AP33: 43 | AQ33: 长城转债!
A34: 44 | B34: 123077 | C34: 汉得转债! | D34: 300170 | E34: 汉得信息 | F34: 计算机及 | G34: 软件开发 | H34: 97.268 | I34: 8.9999999999999998e-004 | J34: -5.4000000000000003e-003 | K34: 7.25 | L34: -1.6299999999999999e-002 | M34: 125.5 | N34: 9.72 | O34: 0.30399999999999999 | P34: 74.59 | Q34: 2月9天 | R34: 5.68年 | S34: 3.68年 | T34: 9.37 | U34: 3.6 | V34: 4.0000000000000001e-003 | W34: 0.14599999999999999 | X34: 0.109 | Y34: 64 | Z34: 2.02 | AA34: 4.6799999999999994e-002 | AB34: 3.8900000000000004e-002 | AC34: 1.7299999999999999e-002 | AD34: 1.5300000000000001e-002 | AE34: 87.77 | AF34: 98.13 | AG34: 0.28 | AH34: AA | AI34: 4.5100000000000001e-002 | AJ34: =H34+100*O34 -> 127.66800000000001 | AK34: 119.9 | AL34: 89 | AM34: 21.8 | AN34: 31 | AO34: -1.1000000000000001e-002 | AP34: 12 | AQ34: 汉得转债!
A35: 121 | B35: 128117 | C35: 道恩转债! | D35: 2838 | E35: 道恩股份 | F35: 化工 | G35: 橡胶塑料 | H35: 97.53 | I35: 4.4000000000000003e-003 | J35: -6.1999999999999998e-003 | K35: 20.82 | L35: -4.7999999999999996e-003 | M35: 123.5 | N35: 29.03 | O35: 0.35999999999999999 | P35: 71.72 | Q35: 转股中 | R35: 5.29年 | S35: 3.29年 | T35: 3.6 | U35: 6 | V35: 1.7000000000000001e-002 | W35: 4.2000000000000003e-002 | X35: 2.9999999999999999e-002 | Y35: 85 | Z35: 4.93 | AA35: 4.6600000000000003e-002 | AB35: 3.8699999999999998e-002 | AC35: 1.8500000000000003e-002 | AD35: 1.6299999999999999e-002 | AE35: 83.45 | AF35: 88.66 | AG35: 0.36 | AH35: AA- | AI35: 6.6100000000000006e-002 | AJ35: =H35+100*O35 -> 133.53 | AK35: 123.3 | AL35: 126 | AM35: 34.7 | AN35: 164 | AO35: -6.4000000000000001e-002 | AP35: 21 | AQ35: 道恩转债!
A36: 120 | B36: 128118 | C36: 瀛通转债! | D36: 2861 | E36: 瀛通通讯 | F36: 电子 | G36: 电子产品 | H36: 96.559 | I36: 1.e-002 | J36: -8.0000000000000002e-003 | K36: 17.27 | L36: 7.6e-003 | M36: 122.1 | N36: 27.53 | O36: 0.53900000000000003 | P36: 62.73 | Q36: 转股中 | R36: 5.29年 | S36: 3.29年 | T36: 3 | U36: 1.6 | V36: 5.0000000000000001e-003 | W36: 0.14300000000000002 | X36: 8.900000000000001e-002 | Y36: 21 | Z36: 1.98 | AA36: 4.6600000000000003e-002 | AB36: 3.8900000000000004e-002 | AC36: 2.3700000000000002e-002 | AD36: 2.1000000000000001e-002 | AE36: 84.09 | AF36: 87.79 | AG36: 0.26 | AH36: AA- | AI36: 6.6100000000000006e-002 | AJ36: =H36+100*O36 -> 150.459 | AK36: 130.4 | AL36: 199 | AM36: 42.6 | AN36: 221 | AO36: 5.0000000000000001e-003 | AP36: 13 | AQ36: 瀛通转债!
A37: 286 | B37: 128042 | C37: 凯中转债! | D37: 2823 | E37: 凯中精密 | F37: 能源电力 | G37: 电力设备 | H37: 100.263 | I37: 4.0000000000000002e-004 | J37: 2.5999999999999999e-003 | K37: 9.92 | L37: 1.43e-002 | M37: 116.3 | N37: 12.96 | O37: 0.31 | P37: 76.54 | Q37: 转股中 | R37: 3.36年 | S37: 1.36年 | T37: 4.16 | U37: 1.2 | V37: 3.0000000000000001e-003 | W37: 0.14599999999999999 | X37: 0.11199999999999999 | Y37: 28 | Z37: 2.11 | AA37: 4.6100000000000002e-002 | AB37: 3.6900000000000002e-002 | AC37: 1.66e-002 | AD37: 1.29e-002 | AE37: 96.37 | AF37: 101.08 | AG37: 0.21 | AH37: AA | AI37: 4.3499999999999997e-002 | AJ37: =H37+100*O37 -> 131.26300000000001 | AK37: 124 | AL37: 137 | AM37: 22.9 | AN37: 40 | AO37: 1.1000000000000001e-002 | AP37: 29 | AQ37: 凯中转债!
A38: 239 | B38: 128066 | C38: 亚泰转债! | D38: 2811 | E38: 郑中设计 | F38: 建筑 | G38: 装饰工程 | H38: 98.3 | I38: 7.1999999999999998e-003 | J38: -7.7000000000000002e-003 | K38: 8.27 | L38: -1.1999999999999999e-003 | M38: 117.5 | N38: 9.67 | O38: 0.14899999999999999 | P38: 85.52 | Q38: 转股中 | R38: 4年28天 | S38: 2年29天 | T38: 4.8 | U38: 3.1 | V38: 6.9999999999999993e-003 | W38: 0.215 | X38: 0.184 | Y38: 22 | Z38: 1.52 | AA38: 4.5899999999999996e-002 | AB38: 3.78e-002 | AC38: 2.5099999999999997e-002 | AD38: 2.1600000000000001e-002 | AE38: 90.43 | AF38: 91.68 | AG38: 0.46 | AH38: AA- | AI38: 6.4500000000000002e-002 | AJ38: =H38+100*O38 -> 113.19999999999999 | AK38: 111.1 | AL38: 21 | AM38: 19.4 | AN38: 20 | AO38: 8.0000000000000002e-003 | AP38: 62 | AQ38: 亚泰转债!
A39: 97 | B39: 113597 | C39: 佳力转债! | D39: 603912 | E39: 佳力图 | F39: 机械装备 | G39: 专用设备 | H39: 98.43 | I39: 2.3099999999999999e-002 | J39: -6.0999999999999995e-003 | K39: 13.93 | L39: 7.9000000000000001e-002 | M39: 124.5 | N39: 23.4 | O39: 0.65300000000000002 | P39: 59.53 | Q39: 转股中 | R39: 5.36年 | S39: 3.36年 | T39: 3 | U39: 192 | V39: 0.63300000000000001 | W39: 9.9000000000000005e-002 | X39: 5.9000000000000004e-002 | Y39: 30 | Z39: 3.48 | AA39: 4.5899999999999996e-002 | AB39: 3.7699999999999997e-002 | AC39: 1.7100000000000001e-002 | AD39: 1.46e-002 | AE39: 83.54 | AF39: 89.04 | AG39: 0.21 | AH39: AA- | AI39: 6.6100000000000006e-002 | AJ39: =H39+100*O39 -> 163.73000000000002 | AK39: 137.3 | AL39: 249 | AM39: 48.3 | AN39: 260 | AO39: 9.6000000000000002e-002 | AP39: 11 | AQ39: 佳力转债!
A40: 262 | B40: 110052 | C40: 贵广转债! | D40: 600996 | E40: 贵广网络 | F40: 传媒娱乐 | G40: 影视娱乐 | H40: 98.92 | I40: 3.2000000000000002e-003 | J40: -3.2000000000000002e-003 | K40: 5.03 | L40: 0. | M40: 117.7 | N40: 7.94 | O40: 0.56100000000000005 | P40: 63.35 | Q40: 转股中 | R40: 3.96年 | S40: 1.96年 | T40: 15.3 | U40: 0.5 | V40: 0. | W40: 0.28899999999999998 | X40: 0.183 | Y40: 53 | Z40: 1.17 | AA40: 4.5700000000000005e-002 | AB40: 3.7400000000000003e-002 | AC40: 1.95e-002 | AD40: 1.66e-002 | AE40: 94.55 | AF40: 100.49 | AG40: 0.09 | AH40: AA+ | AI40: 4.1500000000000002e-002 | AJ40: =H40+100*O40 -> 155.02000000000001 | AK40: 134.5 | AL40: 230 | AM40: 34 | AN40: 152 | AO40: 5.0000000000000001e-003 | AP40: 18 | AQ40: 贵广转债!
A41: 173 | B41: 113568 | C41: 新春转债! | D41: 603667 | E41: 五洲新春 | F41: 机械装备 | G41: 通用设备 | H41: 100.59 | I41: 9.1999999999999998e-003 | J41: -8.0000000000000002e-003 | K41: 7.68 | L41: 2.5999999999999999e-003 | M41: 124.3 | N41: 8.91 | O41: 0.16699999999999998 | P41: 86.2 | Q41: 转股中 | R41: 4.96年 | S41: 2.96年 | T41: 3.3 | U41: 4.9 | V41: 1.4999999999999999e-002 | W41: 0.14699999999999999 | X41: 0.127 | Y41: 22 | Z41: 1.3 | AA41: 4.4600000000000001e-002 | AB41: 3.5900000000000001e-002 | AC41: 1.15e-002 | AD41: 8.8000000000000005e-003 | AE41: 85.87 | AF41: 91.78 | AG41: 0.48 | AH41: AA- | AI41: 6.4500000000000002e-002 | AJ41: =H41+100*O41 -> 117.29000000000001 | AK41: 115 | AL41: 38 | AM41: 23.2 | AN41: 42 | AO41: 6.2e-002 | AP41: 49 | AQ41: 新春转债!
A42: 87 | B42: 128127 | C42: 文科转债! | D42: 2775 | E42: 文科园林 | F42: 城市公用 | G42: 生态环境 | H42: 96.258 | I42: 2.7000000000000001e-003 | J42: -5.0000000000000001e-003 | K42: 4.76 | L42: -4.1999999999999997e-003 | M42: 121.3 | N42: 5.37 | O42: 8.5999999999999993e-002 | P42: 88.64 | Q42: 转股中 | R42: 5.42年 | S42: 3.42年 | T42: 9.5 | U42: 6.4 | V42: 6.9999999999999993e-003 | W42: 0.38900000000000001 | X42: 0.34499999999999997 | Y42: 24 | Z42: 0.92 | AA42: 4.4600000000000001e-002 | AB42: 3.7400000000000003e-002 | AC42: 2.2700000000000001e-002 | AD42: 2.0299999999999999e-002 | AE42: 83.08 | AF42: 86.44 | AG42: 0.56 | AH42: AA- | AI42: 6.6100000000000006e-002 | AJ42: =H42+100*O42 -> 104.85799999999999 | AK42: 103.9 | AL42: 6 | AM42: 17.4 | AN42: 14 | AO42: 2.3e-002 | AP42: 34 | AQ42: 文科转债!
A43: 198 | B43: 128087 | C43: 孚日转债! | D43: 2083 | E43: 孚日股份 | F43: 服装纺织 | G43: 家纺 | H43: 92.2 | I43: 2.2000000000000001e-003 | J43: -5.0000000000000001e-003 | K43: 4.19 | L43: -1.41e-002 | M43: 112.9 | N43: 6.3 | O43: 0.38600000000000001 | P43: 66.51 | Q43: 转股中 | R43: 4.75年 | S43: 2.75年 | T43: 6.5 | U43: 4.8 | V43: 8.0000000000000002e-003 | W43: 0.17100000000000001 | X43: 0.114 | Y43: 38 | Z43: 1.01 | AA43: 4.4500000000000005e-002 | AB43: 3.9199999999999999e-002 | AC43: 4.0500000000000001e-002 | AD43: 3.8100000000000002e-002 | AE43: 91.44 | AF43: 92.61 | AG43: 0.2 | AH43: AA | AI43: 4.3499999999999997e-002 | AJ43: =H43+100*O43 -> 130.80000000000001 | AK43: 117.9 | AL43: 70 | AM43: 25.3 | AN43: 59 | AO43: -6.0000000000000001e-003 | AP43: 55 | AQ43: 孚日转债!
A44: 196 | B44: 110064 | C44: 建工转债! | D44: 600939 | E44: 重庆建工 | F44: 建筑 | G44: 建筑工程 | H44: 98.02 | I44: -3.9000000000000003e-003 | J44: -1.7000000000000001e-003 | K44: 3.6 | L44: -1.9099999999999999e-002 | M44: 119.8 | N44: 4.57 | O44: 0.24399999999999999 | P44: 78.77 | Q44: 转股中 | R44: 4.75年 | S44: 2.76年 | T44: 16.6 | U44: 6.2 | V44: 4.0000000000000001e-003 | W44: 0.254 | X44: 0.20000000000000001 | Y44: 65 | Z44: 0.95 | AA44: 4.41e-002 | AB44: 3.6499999999999998e-002 | AC44: 2.1099999999999997e-002 | AD44: 1.83e-002 | AE44: 92.57 | AF44: 99.18 | AG44: 0.29 | AH44: AA+ | AI44: 4.1500000000000002e-002 | AJ44: =H44+100*O44 -> 122.41999999999999 | AK44: 117.3 | AL44: 61 | AM44: 18.1 | AN44: 16 | AO44: 2.e-002 | AP44: 47 | AQ44: 建工转债!
A45: 232 | B45: 128069 | C45: 华森转债! | D45: 2907 | E45: 华森制药 | F45: 医药 | G45: 化学制药 | H45: 100.28 | I45: 4.7999999999999996e-003 | J45: -3.2000000000000002e-003 | K45: 11.68 | L45: 7.8000000000000005e-003 | M45: 120 | N45: 18.04 | O45: 0.54899999999999993 | P45: 64.75 | Q45: 转股中 | R45: 4.26年 | S45: 2.27年 | T45: 3 | U45: 3.2 | V45: 1.1000000000000001e-002 | W45: 6.4000000000000001e-002 | X45: 4.0999999999999995e-002 | Y45: 47 | Z45: 4.37 | AA45: 4.4000000000000004e-002 | AB45: 3.5400000000000001e-002 | AC45: 1.32e-002 | AD45: 1.04e-002 | AE45: 89.07 | AF45: 92.47 | AG45: 0.2 | AH45: AA- | AI45: 6.4500000000000002e-002 | AJ45: =H45+100*O45 -> 155.18000000000001 | AK45: 135.8 | AL45: 240 | AM45: 43.3 | AN45: 227 | AO45: 2.8999999999999998e-002 | AP45: 45 | AQ45: 华森转债!
A46: 85 | B46: 113601 | C46: 塞力转债 | D46: 603716 | E46: 塞力医疗 | F46: 医药 | G46: 医药商业 | H46: 96.57 | I46: 1.8e-003 | J46: 6.0999999999999995e-003 | K46: 14.33 | L46: 1.49e-002 | M46: 121.3 | N46: 16.98 | O46: 0.14400000000000002 | P46: 84.39 | Q46: 转股中 | R46: 5.42年 | S46: 3.42年 | T46: 5.43 | U46: 4.7 | V46: 9.0000000000000011e-003 | W46: 0.185 | X46: 0.156 | Y46: 29 | Z46: 1.93 | AA46: 4.4000000000000004e-002 | AB46: 3.6799999999999999e-002 | AC46: 2.1700000000000001e-002 | AD46: 1.9299999999999998e-002 | AE46: 83.06 | AF46: 86.43 | AG46: 0.53 | AH46: AA- | AI46: 6.6100000000000006e-002 | AJ46: =H46+100*O46 -> 110.97 | AK46: 108.7 | AL46: 14 | AM46: 22.3 | AN46: 35 | AO46: -1.7000000000000001e-002 | AP46: 34 | AQ46: 塞力转债
A47: 46 | B47: 123076 | C47: 强力转债! | D47: 300429 | E47: 强力新材 | F47: 化工 | G47: 化工 | H47: 93.405 | I47: 5.8999999999999999e-003 | J47: -5.8999999999999999e-003 | K47: 10.71 | L47: 0. | M47: 118.5 | N47: 18.98 | O47: 0.65500000000000003 | P47: 56.43 | Q47: 2月7天 | R47: 5.67年 | S47: 3.67年 | T47: 8.5 | U47: 4.6 | V47: 6.0000000000000001e-003 | W47: 0.154 | X47: 8.6999999999999994e-002 | Y47: 55 | Z47: 3.19 | AA47: 4.3700000000000003e-002 | AB47: 3.7699999999999997e-002 | AC47: 2.8300000000000002e-002 | AD47: 2.6200000000000001e-002 | AE47: 81.42 | AF47: 83.04 | AG47: 0.21 | AH47: AA- | AI47: 6.6100000000000006e-002 | AJ47: =H47+100*O47 -> 158.905 | AK47: 130.4 | AL47: 198 | AM47: 47.3 | AN47: 255 | AO47: -5.9999999999999998e-002 | AP47: 12 | AQ47: 强力转债!
A48: 68 | B48: 123069 | C48: 金诺转债! | D48: 300505 | E48: 川金诺 | F48: 化工 | G48: 农化 | H48: 99.77 | I48: 7.000000000000001e-004 | J48: -4.8999999999999998e-003 | K48: 16.06 | L48: -8.6e-003 | M48: 126 | N48: 19.15 | O48: 0.19 | P48: 83.86 | Q48: 34天 | R48: 5.58年 | S48: 3.58年 | T48: 3.68 | U48: 6.2 | V48: 1.7000000000000001e-002 | W48: 0.17499999999999999 | X48: 0.14699999999999999 | Y48: 21 | Z48: 2.18 | AA48: 4.36e-002 | AB48: 3.5499999999999997e-002 | AC48: 1.11e-002 | AD48: 9.0000000000000011e-003 | AE48: 81.98 | AF48: 88.8 | AG48: 0.49 | AH48: AA- | AI48: 6.6100000000000006e-002 | AJ48: =H48+100*O48 -> 118.77 | AK48: 115.7 | AL48: 44 | AM48: 26.9 | AN48: 78 | AO48: -3.3000000000000002e-002 | AP48: 17 | AQ48: 金诺转债!
A49: 36 | B49: 123081 | C49: 精研转债! | D49: 300709 | E49: 精研科技 | F49: 电子 | G49: 电子产品 | H49: 96.02 | I49: 2.8000000000000004e-003 | J49: -5.1000000000000004e-003 | K49: 38.97 | L49: -8.3999999999999995e-003 | M49: 121.3 | N49: 64.28 | O49: 0.58399999999999996 | P49: 60.63 | Q49: 2月22天 | R49: 5.71年 | S49: 3.71年 | T49: 5.7 | U49: 4 | V49: 6.9999999999999993e-003 | W49: 0.127 | X49: 7.6999999999999999e-002 | Y49: 45 | Z49: 2.99 | AA49: 4.2699999999999995e-002 | AB49: 3.5900000000000001e-002 | AC49: 2.1600000000000001e-002 | AD49: 1.9400000000000001e-002 | AE49: 81.52 | AF49: 84.83 | AG49: 0.27 | AH49: AA- | AI49: 6.6100000000000006e-002 | AJ49: =H49+100*O49 -> 154.41999999999999 | AK49: 131.4 | AL49: 209 | AM49: 46.6 | AN49: 247 | AO49: -7.0000000000000007e-002 | AP49: 5 | AQ49: 精研转债!
A50: 215 | B50: 113546 | C50: 迪贝转债! | D50: 603320 | E50: 迪贝电气 | F50: 家电 | G50: 零部件制 | H50: 100.14 | I50: 4.0000000000000002e-004 | J50: 1.6000000000000001e-003 | K50: 10.49 | L50: 4.7999999999999996e-003 | M50: 120.6 | N50: 14.1 | O50: 0.34600000000000003 | P50: 74.4 | Q50: 转股中 | R50: 4.59年 | S50: 2.60年 | T50: 2.3 | U50: 3.1 | V50: 1.3000000000000001e-002 | W50: 0.16899999999999998 | X50: 0.125 | Y50: 14 | Z50: 2.05 | AA50: 4.2300000000000004e-002 | AB50: 3.4099999999999998e-002 | AC50: 1.37e-002 | AD50: 1.09e-002 | AE50: 85.21 | AF50: 86.99 | AG50: 0.42 | AH50: A+ | AI50: 7.5499999999999998e-002 | AJ50: =H50+100*O50 -> 134.74000000000001 | AK50: 125.9 | AL50: 159 | AM50: 38.9 | AN50: 197 | AO50: 3.9e-002 | AP50: 42 | AQ50: 迪贝转债!
A51: 255 | B51: 123023 | C51: 迪森转债! | D51: 300335 | E51: 迪森股份 | F51: 能源电力 | G51: 电力供应 | H51: 97.85 | I51: 6.7000000000000002e-003 | J51: -5.1999999999999998e-003 | K51: 5.28 | L51: 5.6999999999999993e-003 | M51: 114.9 | N51: 7.04 | O51: 0.30499999999999999 | P51: 75 | Q51: 转股中 | R51: 4年0.1天 | S51: 3年1.1天 | T51: 5.29 | U51: 4.1 | V51: 8.0000000000000002e-003 | W51: 0.26899999999999996 | X51: 0.20100000000000001 | Y51: 20 | Z51: 1.42 | AA51: 4.1900000000000007e-002 | AB51: 3.4799999999999998e-002 | AC51: 2.3700000000000002e-002 | AD51: 2.0299999999999999e-002 | AE51: 92.18 | AF51: 97.28 | AG51: 0.26 | AH51: AA | AI51: 4.3499999999999997e-002 | AJ51: =H51+100*O51 -> 128.34999999999999 | AK51: 120.7 | AL51: 95 | AM51: 23.4 | AN51: 46 | AO51: 6.9000000000000006e-002 | AP51: 53 | AQ51: 迪森转债!
A52: 93 | B52: 113599 | C52: 嘉友转债! | D52: 603871 | E52: 嘉友国际 | F52: 交通运输 | G52: 物流业 | H52: 101.54 | I52: -2.3e-003 | J52: 2.3e-003 | K52: 21.4 | L52: 0. | M52: 126 | N52: 24.82 | O52: 0.17800000000000002 | P52: 86.22 | Q52: 转股中 | R52: 5.38年 | S52: 3.38年 | T52: 7.2 | U52: 1.7 | V52: 2.e-003 | W52: 0.153 | X52: 0.13200000000000001 | Y52: 47 | Z52: 2.36 | AA52: 4.1799999999999997e-002 | AB52: 3.3399999999999999e-002 | AC52: 6.6e-003 | AD52: 4.4000000000000003e-003 | AE52: 83.02 | AF52: 89.93 | AG52: 0.5 | AH52: AA- | AI52: 6.6100000000000006e-002 | AJ52: =H52+100*O52 -> 119.34 | AK52: 116.9 | AL52: 53 | AM52: 26.9 | AN52: 79 | AO52: -1.2e-002 | AP52: 19 | AQ52: 嘉友转债!
A53: 316 | B53: 128026 | C53: 众兴转债! | D53: 2772 | E53: 众兴菌业 | F53: 农业 | G53: 种植业 | H53: 98 | I53: -1.1000000000000001e-003 | J53: 2.2000000000000001e-003 | K53: 9.05 | L53: 4.4000000000000003e-003 | M53: 109.3 | N53: 11.45 | O53: 0.23999999999999999 | P53: 79.04 | Q53: 转股中 | R53: 2.74年 | S53: 0.74年 | T53: 9.19 | U53: 9.8 | V53: 1.1000000000000001e-002 | W53: 0.27600000000000002 | X53: 0.218 | Y53: 33 | Z53: 1.36 | AA53: 4.1399999999999999e-002 | AB53: 3.4599999999999999e-002 | AC53: 4.3099999999999999e-002 | AD53: 3.9e-002 | AE53: 96.33 | AF53: 92.68 | AG53: 0.25 | AH53: AA- | AI53: 6.3200000000000006e-002 | AJ53: =H53+100*O53 -> 122. | AK53: 117 | AL53: 54 | AM53: 20.6 | AN53: 24 | AO53: 3.7000000000000005e-002 | AP53: 63 | AQ53: 众兴转债!
A54: 132 | B54: 123054 | C54: 思特转债! | D54: 300608 | E54: 思特奇 | F54: 通信互联 | G54: 通信设备 | H54: 99.099 | I54: 1.9400000000000001e-002 | J54: -1.8799999999999997e-002 | K54: 11.2 | L54: 1.8e-003 | M54: 121.7 | N54: 16.49 | O54: 0.45899999999999996 | P54: 67.92 | Q54: 转股中 | R54: 5.22年 | S54: 3.23年 | T54: 2.71 | U54: 9.6 | V54: 3.6000000000000004e-002 | W54: 0.153 | X54: 0.10400000000000001 | Y54: 18 | Z54: 2.33 | AA54: 4.1100000000000005e-002 | AB54: 3.3599999999999998e-002 | AC54: 1.6299999999999999e-002 | AD54: 1.3600000000000001e-002 | AE54: 84.44 | AF54: 87.85 | AG54: 0.33 | AH54: AA- | AI54: 6.6100000000000006e-002 | AJ54: =H54+100*O54 -> 144.999 | AK54: 130.3 | AL54: 196 | AM54: 42.4 | AN54: 219 | AO54: -1.8000000000000002e-002 | AP54: 20 | AQ54: 思特转债!
A55: 244 | B55: 113534 | C55: 鼎胜转债! | D55: 603876 | E55: 鼎胜新材 | F55: 有色金属 | G55: 小金属 | H55: 98.08 | I55: 4.0000000000000001e-003 | J55: 8.0000000000000004e-004 | K55: 12.36 | L55: 1.4800000000000001e-002 | M55: 114.9 | N55: 15.18 | O55: 0.20499999999999999 | P55: 81.42 | Q55: 转股中 | R55: 4年20天 | S55: 2年21天 | T55: 12 | U55: 7.6 | V55: 6.0000000000000001e-003 | W55: 0.22399999999999998 | X55: 0.182 | Y55: 54 | Z55: 1.49 | AA55: 4.07e-002 | AB55: 3.3700000000000001e-002 | AC55: 2.4300000000000002e-002 | AD55: 2.12e-002 | AE55: 94.17 | AF55: 97.06 | AG55: 0.32 | AH55: AA | AI55: 4.3499999999999997e-002 | AJ55: =H55+100*O55 -> 118.58 | AK55: 114.7 | AL55: 37 | AM55: 17.7 | AN55: 15 | AO55: 1.e-002 | AP55: 35 | AQ55: 鼎胜转债!
A56: 169 | B56: 123044 | C56: 红相转债!! | D56: 300427 | E56: 红相股份 | F56: 能源电力 | G56: 电力设备 | H56: 102.99 | I56: -1.5e-003 | J56: -1.7000000000000001e-003 | K56: 14.63 | L56: -8.1000000000000013e-003 | M56: 125 | N56: 18.8 | O56: 0.32299999999999995 | P56: 77.82 | Q56: 转股中 | R56: 4.98年 | S56: 2.98年 | T56: 5.5 | U56: 15 | V56: 2.6000000000000002e-002 | W56: 0.10400000000000001 | X56: 8.1000000000000003e-002 | Y56: 53 | Z56: 2.31 | AA56: 4.0599999999999997e-002 | AB56: 3.1800000000000002e-002 | AC56: 4.6999999999999993e-003 | AD56: 1.9e-003 | AE56: 86.03 | AF56: 92.25 | AG56: 0.4 | AH56: AA- | AI56: 6.4500000000000002e-002 | AJ56: =H56+100*O56 -> 135.28999999999999 | AK56: 128.2 | AL56: 180 | AM56: 35.9 | AN56: 174 | AO56: -6.8000000000000005e-002 | AP56: 21 | AQ56: 红相转债!!
A57: 37 | B57: 123080 | C57: 海波转债! | D57: 300517 | E57: 海波重科 | F57: 建筑 | G57: 建筑工程 | H57: 101.55 | I57: 1.04e-002 | J57: -1.8799999999999997e-002 | K57: 18.95 | L57: -1.3500000000000002e-002 | M57: 126.5 | N57: 20.91 | O57: 0.121 | P57: 90.63 | Q57: 2月21天 | R57: 5.70年 | S57: 3.71年 | T57: 2.45 | U57: 9.1 | V57: 3.7000000000000005e-002 | W57: 0.121 | X57: 0.11 | Y57: 20 | Z57: 2.65 | AA57: 4.0199999999999993e-002 | AB57: 3.2099999999999997e-002 | AC57: 7.9000000000000008e-003 | AD57: 5.6000000000000008e-003 | AE57: 78.79 | AF57: 83.62 | AG57: 0.62 | AH57: A+ | AI57: 7.7100000000000002e-002 | AJ57: =H57+100*O57 -> 113.64999999999999 | AK57: 112.5 | AL57: 29 | AM57: 28.9 | AN57: 104 | AO57: 8.4000000000000005e-002 | AP57: 11 | AQ57: 海波转债!
A58: 273 | B58: 113524 | C58: 奇精转债! | D58: 603677 | E58: 奇精机械 | F58: 家电 | G58: 零部件制 | H58: 101.56 | I58: 7.000000000000001e-004 | J58: -3.0999999999999999e-003 | K58: 11.28 | L58: -8.8000000000000005e-003 | M58: 117.3 | N58: 14.08 | O58: 0.26800000000000002 | P58: 80.11 | Q58: 转股中 | R58: 3.74年 | S58: 1.74年 | T58: 3.3 | U58: 3.7 | V58: 1.1000000000000001e-002 | W58: 0.152 | X58: 0.122 | Y58: 22 | Z58: 2.26 | AA58: 4.0000000000000001e-002 | AB58: 3.15e-002 | AC58: 6.4000000000000003e-003 | AD58: 3.4999999999999996e-003 | AE58: 94.84 | AF58: 100.33 | AG58: 0.28 | AH58: AA | AI58: 4.3499999999999997e-002 | AJ58: =H58+100*O58 -> 128.36000000000001 | AK58: 123 | AL58: 121 | AM58: 22.7 | AN58: 38 | AO58: -2.3e-002 | AP58: 48 | AQ58: 奇精转债!
A59: 293 | B59: 127007 | C59: 湖广转债! | D59: 665 | E59: 湖北广电 | F59: 传媒娱乐 | G59: 影视娱乐 | H59: 99.224 | I59: 1.e-004 | J59: -8.9999999999999998e-004 | K59: 3.87 | L59: -5.1000000000000004e-003 | M59: 112.3 | N59: 5.58 | O59: 0.43099999999999999 | P59: 69.35 | Q59: 转股中 | R59: 3.27年 | S59: 1.28年 | T59: 12.2 | U59: 0.7 | V59: 1.e-003 | W59: 0.32000000000000001 | X59: 0.222 | Y59: 38 | Z59: 0.59 | AA59: 3.9399999999999998e-002 | AB59: 3.2099999999999997e-002 | AC59: 2.5099999999999997e-002 | AD59: 2.1099999999999997e-002 | AE59: 97 | AF59: 98.58 | AG59: 0.15 | AH59: AA+ | AI59: 4.1500000000000002e-002 | AJ59: =H59+100*O59 -> 142.32400000000001 | AK59: 129.1 | AL59: 188 | AM59: 30.5 | AN59: 118 | AO59: 1.e-003 | AP59: 18 | AQ59: 湖广转债!
A60: 28 | B60: 123084 | C60: 高澜转债! | D60: 300499 | E60: 高澜股份 | F60: 能源电力 | G60: 电力设备 | H60: 98.2 | I60: 1.03e-002 | J60: -9.1000000000000004e-003 | K60: 9.02 | L60: 2.2000000000000001e-003 | M60: 121.9 | N60: 11.36 | O60: 0.23699999999999999 | P60: 79.4 | Q60: 2月29天 | R60: 5.73年 | S60: 3.73年 | T60: 2.8 | U60: 15 | V60: 5.4000000000000006e-002 | W60: 0.11199999999999999 | X60: 8.900000000000001e-002 | Y60: 25 | Z60: 3.22 | AA60: 3.9399999999999998e-002 | AB60: 3.2500000000000001e-002 | AC60: 1.7100000000000001e-002 | AD60: 1.46e-002 | AE60: 78.76 | AF60: 80.49 | AG60: 0.55 | AH60: A+ | AI60: 7.7100000000000002e-002 | AJ60: =H60+100*O60 -> 121.90000000000001 | AK60: 117 | AL60: 55 | AM60: 36.5 | AN60: 178 | AO60: 1.1000000000000001e-002 | AP60: 8 | AQ60: 高澜转债!
A61: 123 | B61: 113591 | C61: 胜达转债! | D61: 603687 | E61: 大胜达 | F61: 造纸包装 | G61: 包装用纸 | H61: 100.46 | I61: 4.6999999999999993e-003 | J61: 1.2999999999999999e-003 | K61: 9.42 | L61: 1.0700000000000001e-002 | M61: 122.2 | N61: 10.46 | O61: 0.11599999999999999 | P61: 90.06 | Q61: 转股中 | R61: 5.28年 | S61: 3.29年 | T61: 5.5 | U61: 3.5 | V61: 6.0000000000000001e-003 | W61: 0.14199999999999999 | X61: 0.128 | Y61: 39 | Z61: 2.49 | AA61: 3.8699999999999998e-002 | AB61: 3.1099999999999999e-002 | AC61: 1.06e-002 | AD61: 8.199999999999999e-003 | AE61: 83.72 | AF61: 87.82 | AG61: 0.55 | AH61: AA- | AI61: 6.6100000000000006e-002 | AJ61: =H61+100*O61 -> 112.05999999999999 | AK61: 110.9 | AL61: 19 | AM61: 23 | AN61: 41 | AO61: 1.3999999999999999e-002 | AP61: 23 | AQ61: 胜达转债!
A62: 114 | B62: 123059 | C62: 银信转债! | D62: 300231 | E62: 银信科技 | F62: 计算机及 | G62: 软件开发 | H62: 101.88 | I62: 0. | J62: -2.3999999999999998e-003 | K62: 8.26 | L62: -4.7999999999999996e-003 | M62: 124.1 | N62: 9.91 | O62: 0.222 | P62: 83.35 | Q62: 转股中 | R62: 5.32年 | S62: 3.32年 | T62: 3.91 | U62: 3.1 | V62: 8.0000000000000002e-003 | W62: 0.107 | X62: 8.900000000000001e-002 | Y62: 37 | Z62: 2.73 | AA62: 3.8599999999999995e-002 | AB62: 3.0600000000000002e-002 | AC62: 6.0000000000000001e-003 | AD62: 3.8e-003 | AE62: 83.41 | AF62: 88.93 | AG62: 0.49 | AH62: AA- | AI62: 6.6100000000000006e-002 | AJ62: =H62+100*O62 -> 124.08 | AK62: 120.4 | AL62: 92 | AM62: 31.5 | AN62: 136 | AO62: 3.1e-002 | AP62: 15 | AQ62: 银信转债!
A63: 29 | B63: 127027 | C63: 靖远转债! | D63: 552 | E63: 靖远煤电 | F63: 煤炭 | G63: 煤炭开采 | H63: 93.41 | I63: 0. | J63: -3.2000000000000002e-003 | K63: 2.86 | L63: -6.8999999999999999e-003 | M63: 115.3 | N63: 3.33 | O63: 8.8000000000000009e-002 | P63: 85.89 | Q63: 2月29天 | R63: 5.73年 | S63: 3.73年 | T63: 28 | U63: 40 | V63: 1.4999999999999999e-002 | W63: 0.42799999999999999 | X63: 0.36799999999999999 | Y63: 65 | Z63: 0.83 | AA63: 3.8199999999999998e-002 | AB63: 3.3099999999999997e-002 | AC63: 2.7699999999999999e-002 | AD63: 2.5699999999999997e-002 | AE63: 88.21 | AF63: 90.97 | AG63: 0.47 | AH63: AA+ | AI63: 4.3099999999999999e-002 | AJ63: =H63+100*O63 -> 102.20999999999999 | AK63: 100.9 | AL63: 2 | AM63: 10 | AN63: 5 | AO63: 8.0000000000000002e-003 | AP63: 21 | AQ63: 靖远转债!
A64: 277 | B64: 128049 | C64: 华源转债! | D64: 2787 | E64: 华源控股 | F64: 造纸包装 | G64: 包装材料 | H64: 100.055 | I64: 4.5000000000000005e-003 | J64: -9.1999999999999998e-003 | K64: 6.11 | L64: -1.1299999999999999e-002 | M64: 114.5 | N64: 7.42 | O64: 0.215 | P64: 82.35 | Q64: 转股中 | R64: 3.69年 | S64: 1.69年 | T64: 3.63 | U64: 3.8 | V64: 1.e-002 | W64: 0.188 | X64: 0.155 | Y64: 19 | Z64: 1.29 | AA64: 3.7900000000000003e-002 | AB64: 3.0499999999999999e-002 | AC64: 1.49e-002 | AD64: 1.1899999999999999e-002 | AE64: 91.63 | AF64: 91.32 | AG64: 0.42 | AH64: AA- | AI64: 6.4500000000000002e-002 | AJ64: =H64+100*O64 -> 121.55500000000001 | AK64: 117.8 | AL64: 68 | AM64: 26.1 | AN64: 68 | AO64: 9.0000000000000011e-003 | AP64: 50 | AQ64: 华源转债!
A65: 177 | B65: 113566 | C65: 翔港转债! | D65: 603499 | E65: 翔港科技 | F65: 造纸包装 | G65: 包装材料 | H65: 103.78 | I65: 5.9999999999999995e-004 | J65: 3.7000000000000002e-003 | K65: 8.08 | L65: 1.e-002 | M65: 124 | N65: 10.77 | O65: 0.38299999999999995 | P65: 75.02 | Q65: 转股中 | R65: 4.95年 | S65: 2.95年 | T65: 1.61 | U65: 26 | V65: 0.153 | W65: 9.9000000000000005e-002 | X65: 7.400000000000001e-002 | Y65: 16 | Z65: 2.84 | AA65: 3.7499999999999999e-002 | AB65: 2.8900000000000002e-002 | AC65: 1.1999999999999999e-003 | AD65: -1.4000000000000002e-003 | AE65: 83.25 | AF65: 87.21 | AG65: 0.43 | AH65: A+ | AI65: 7.5499999999999998e-002 | AJ65: =H65+100*O65 -> 142.07999999999998 | AK65: 132.5 | AL65: 218 | AM65: 45.3 | AN65: 244 | AO65: 4.5999999999999999e-002 | AP65: 28 | AQ65: 翔港转债!
A66: 106 | B66: 123061 | C66: 航新转债! | D66: 300424 | E66: 航新科技 | F66: 航空航天 | G66: 航空航天 | H66: 103 | I66: 7.8000000000000005e-003 | J66: 1.7000000000000001e-003 | K66: 12.81 | L66: 1.67e-002 | M66: 124.8 | N66: 14.86 | O66: 0.19500000000000001 | P66: 86.2 | Q66: 转股中 | R66: 5.34年 | S66: 3.34年 | T66: 2.5 | U66: 189 | V66: 0.72799999999999998 | W66: 8.1000000000000003e-002 | X66: 7.0000000000000007e-002 | Y66: 31 | Z66: 2.81 | AA66: 3.7499999999999999e-002 | AB66: 2.9300000000000003e-002 | AC66: 4.7999999999999996e-003 | AD66: 2.2000000000000001e-003 | AE66: 80.99 | AF66: 84.79 | AG66: 0.57 | AH66: A+ | AI66: 7.7100000000000002e-002 | AJ66: =H66+100*O66 -> 122.5 | AK66: 119.8 | AL66: 87 | AM66: 35 | AN66: 166 | AO66: -1.e-002 | AP66: 13 | AQ66: 航新转债!
A67: 240 | B67: 110058 | C67: 永鼎转债! | D67: 600105 | E67: 永鼎股份 | F67: 通信互联 | G67: 通信设备 | H67: 99.45 | I67: 1.8600000000000002e-002 | J67: -1.8200000000000001e-002 | K67: 3.24 | L67: 3.0999999999999999e-003 | M67: 114.9 | N67: 5.04 | O67: 0.54700000000000004 | P67: 64.29 | Q67: 转股中 | R67: 4年27天 | S67: 2年28天 | T67: 2.61 | U67: 30 | V67: 0.11599999999999999 | W67: 5.7999999999999996e-002 | X67: 3.7999999999999999e-002 | Y67: 45 | Z67: 1.59 | AA67: 3.6900000000000002e-002 | AB67: 2.9999999999999999e-002 | AC67: 1.77e-002 | AD67: 1.47e-002 | AE67: 94.09 | AF67: 96.98 | AG67: 0.14 | AH67: AA | AI67: 4.3499999999999997e-002 | AJ67: =H67+100*O67 -> 154.15000000000001 | AK67: 134.6 | AL67: 232 | AM67: 37.6 | AN67: 182 | AO67: -1.7000000000000001e-002 | AP67: 50 | AQ67: 永鼎转债!
A68: 223 | B68: 128073 | C68: 哈尔转债! | D68: 2615 | E68: 哈尔斯 | F68: 其他 | G68: 家居用品 | H68: 102.02 | I68: 6.9999999999999993e-003 | J68: -8.3000000000000001e-003 | K68: 4.23 | L68: -4.6999999999999993e-003 | M68: 115.3 | N68: 5.7 | O68: 0.375 | P68: 74.21 | Q68: 转股中 | R68: 3.42年 | S68: 1.43年 | T68: 2.99 | U68: 174 | V68: 0.56399999999999995 | W68: 0.17100000000000001 | X68: 0.127 | Y68: 17 | Z68: 2.18 | AA68: 3.6900000000000002e-002 | AB68: 2.86e-002 | AC68: 2.0000000000000001e-004 | AD68: -2.3999999999999998e-003 | AE68: 92.44 | AF68: 93.38 | AG68: 0.27 | AH68: AA- | AI68: 6.4500000000000002e-002 | AJ68: =H68+100*O68 -> 139.51999999999998 | AK68: 129.8 | AL68: 195 | AM68: 36.4 | AN68: 177 | AO68: 2.e-002 | AP68: 40 | AQ68: 哈尔转债!
A69: 71 | B69: 113604 | C69: 多伦转债! | D69: 603528 | E69: 多伦科技 | F69: 计算机及 | G69: 软件开发 | H69: 96.5 | I69: 2.8000000000000004e-003 | J69: -3.3e-003 | K69: 7.03 | L69: -1.4000000000000002e-003 | M69: 117.3 | N69: 10.44 | O69: 0.433 | P69: 67.34 | Q69: 31天 | R69: 5.57年 | S69: 3.57年 | T69: 6.4 | U69: 1.5 | V69: 2.e-003 | W69: 0.14499999999999999 | X69: 9.8000000000000004e-002 | Y69: 44 | Z69: 2.73 | AA69: 3.6400000000000002e-002 | AB69: 3.0600000000000002e-002 | AC69: 1.9900000000000001e-002 | AD69: 1.7899999999999999e-002 | AE69: 81.92 | AF69: 82.73 | AG69: 0.37 | AH69: AA- | AI69: 6.6100000000000006e-002 | AJ69: =H69+100*O69 -> 139.80000000000001 | AK69: 125.7 | AL69: 156 | AM69: 42.9 | AN69: 224 | AO69: -6.4000000000000001e-002 | AP69: 6 | AQ69: 多伦转债!
A70: 63 | B70: 123071 | C70: 天能转债! | D70: 300569 | E70: 天能重工 | F70: 能源电力 | G70: 风能 | H70: 99.7 | I70: 8.0000000000000004e-004 | J70: 1.61e-002 | K70: 14.65 | L70: 4.0500000000000001e-002 | M70: 121.1 | N70: 20.05 | O70: 0.36399999999999999 | P70: 73.07 | Q70: 39天 | R70: 5.59年 | S70: 3.59年 | T70: 7 | U70: 18 | V70: 2.6000000000000002e-002 | W70: 0.122 | X70: 8.900000000000001e-002 | Y70: 57 | Z70: 2.6 | AA70: 3.61e-002 | AB70: 2.9300000000000003e-002 | AC70: 1.15e-002 | AD70: 9.300000000000001e-003 | AE70: 81.98 | AF70: 85.31 | AG70: 0.42 | AH70: AA- | AI70: 6.6100000000000006e-002 | AJ70: =H70+100*O70 -> 136.09999999999999 | AK70: 126.3 | AL70: 161 | AM70: 41 | AN70: 212 | AO70: 5.9999999999999998e-002 | AP70: 10 | AQ70: 天能转债!
A71: 265 | B71: 128056 | C71: 今飞转债! | D71: 2863 | E71: 今飞凯达 | F71: 汽车 | G71: 零部件制 | H71: 104.946 | I71: -2.9999999999999997e-004 | J71: -5.0000000000000001e-004 | K71: 5.76 | L71: -1.7000000000000001e-003 | M71: 120.2 | N71: 6.7 | O71: 0.221 | P71: 85.97 | Q71: 转股中 | R71: 3.95年 | S71: 1.95年 | T71: 1.72 | U71: 34 | V71: 0.18899999999999997 | W71: 5.9999999999999998e-002 | X71: 5.0999999999999997e-002 | Y71: 29 | Z71: 1.95 | AA71: 3.5699999999999996e-002 | AB71: 2.6499999999999999e-002 | AC71: -7.1999999999999998e-003 | AD71: -1.03e-002 | AE71: 88.73 | AF71: 90.72 | AG71: 0.48 | AH71: A+ | AI71: 7.5499999999999998e-002 | AJ71: =H71+100*O71 -> 127.04599999999999 | AK71: 123.9 | AL71: 135 | AM71: 33.2 | AN71: 147 | AO71: 2.8999999999999998e-002 | AP71: 56 | AQ71: 今飞转债!
A72: 248 | B72: 113532 | C72: 海环转债! | D72: 603817 | E72: 海峡环保 | F72: 城市公用 | G72: 三废处理 | H72: 98.32 | I72: -1.6000000000000001e-003 | J72: -2.0000000000000001e-004 | K72: 5.73 | L72: -6.8999999999999999e-003 | M72: 112.9 | N72: 7.69 | O72: 0.32000000000000001 | P72: 74.51 | Q72: 转股中 | R72: 4年13天 | S72: 2年14天 | T72: 4.6 | U72: 1.4 | V72: 3.0000000000000001e-003 | W72: 0.17800000000000002 | X72: 0.13300000000000001 | Y72: 26 | Z72: 1.51 | AA72: 3.5699999999999996e-002 | AB72: 2.9500000000000002e-002 | AC72: 2.3399999999999997e-002 | AD72: 2.0299999999999999e-002 | AE72: 94.24 | AF72: 95.45 | AG72: 0.26 | AH72: AA | AI72: 4.3499999999999997e-002 | AJ72: =H72+100*O72 -> 130.31999999999999 | AK72: 122.1 | AL72: 114 | AM72: 26.7 | AN72: 75 | AO72: 2.7999999999999997e-002 | AP72: 26 | AQ72: 海环转债!
A73: 202 | B73: 128082 | C73: 华锋转债! | D73: 2806 | E73: 华锋股份 | F73: 电子 | G73: 元器件制 | H73: 103.35 | I73: 4.5000000000000005e-003 | J73: -4.5000000000000005e-003 | K73: 8.94 | L73: 0. | M73: 121.4 | N73: 11.71 | O73: 0.35399999999999998 | P73: 76.35 | Q73: 转股中 | R73: 4.71年 | S73: 2.71年 | T73: 3.45 | U73: 2 | V73: 6.0000000000000001e-003 | W73: 0.21899999999999997 | X73: 0.16699999999999998 | Y73: 16 | Z73: 1.26 | AA73: 3.56e-002 | AB73: 2.75e-002 | AC73: 3.8e-003 | AD73: 8.0000000000000004e-004 | AE73: 84.96 | AF73: 86.92 | AG73: 0.45 | AH73: A+ | AI73: 7.5499999999999998e-002 | AJ73: =H73+100*O73 -> 138.75 | AK73: 130.4 | AL73: 197 | AM73: 43.4 | AN73: 230 | AO73: -1.7000000000000001e-002 | AP73: 56 | AQ73: 华锋转债!
A74: 26 | B74: 123085 | C74: 万顺转2! | D74: 300057 | E74: 万顺新材 | F74: 有色金属 | G74: 铝金属 | H74: 93.1 | I74: -5.0000000000000001e-004 | J74: 5.0000000000000001e-004 | K74: 4.87 | L74: 0. | M74: 113.3 | N74: 6.24 | O74: 0.193 | P74: 78.04 | Q74: 3月0天 | R74: 5.73年 | S74: 3.73年 | T74: 9 | U74: 12 | V74: 1.4999999999999999e-002 | W74: 0.27399999999999997 | X74: 0.214 | Y74: 33 | Z74: 0.96 | AA74: 3.56e-002 | AB74: 3.1099999999999999e-002 | AC74: 2.86e-002 | AD74: 2.6600000000000002e-002 | AE74: 81.08 | AF74: 79.1 | AG74: 0.52 | AH74: AA- | AI74: 6.6100000000000006e-002 | AJ74: =H74+100*O74 -> 112.39999999999999 | AK74: 108.2 | AL74: 13 | AM74: 27.1 | AN74: 81 | AO74: -3.0000000000000001e-003 | AP74: 11 | AQ74: 万顺转2!
A75: 272 | B75: 113525 | C75: 台华转债! | D75: 603055 | E75: 台华新材 | F75: 服装纺织 | G75: 纺织行业 | H75: 100.65 | I75: -2.9999999999999997e-004 | J75: -3.4999999999999996e-003 | K75: 6.03 | L75: -1.47e-002 | M75: 114.3 | N75: 7.83 | O75: 0.307 | P75: 77.01 | Q75: 转股中 | R75: 3.75年 | S75: 1.75年 | T75: 4.69 | U75: 0.5 | V75: 1.e-003 | W75: 9.3000000000000013e-002 | X75: 7.2000000000000008e-002 | Y75: 50 | Z75: 1.76 | AA75: 3.5200000000000002e-002 | AB75: 2.7999999999999997e-002 | AC75: 1.1200000000000002e-002 | AD75: 8.3000000000000001e-003 | AE75: 94.81 | AF75: 97.74 | AG75: 0.26 | AH75: AA | AI75: 4.3499999999999997e-002 | AJ75: =H75+100*O75 -> 131.34999999999999 | AK75: 124.3 | AL75: 139 | AM75: 26.6 | AN75: 72 | AO75: 6.9999999999999993e-003 | AP75: 21 | AQ75: 台华转债!
A76: 13 | B76: 127028 | C76: 英特转债! | D76: 411 | E76: 英特集团 | F76: 医药 | G76: 医药商业 | H76: 92.904 | I76: 2.7000000000000001e-003 | J76: -5.6999999999999993e-003 | K76: 13.28 | L76: -1.1899999999999999e-002 | M76: 113.1 | N76: 19.89 | O76: 0.39100000000000001 | P76: 66.77 | Q76: 3月24天 | R76: 5.80年 | S76: 3.80年 | T76: 6 | U76: 15 | V76: 2.7999999999999997e-002 | W76: 0.18100000000000002 | X76: 0.121 | Y76: 33 | Z76: 2.04 | AA76: 3.5099999999999999e-002 | AB76: 3.0800000000000001e-002 | AC76: 2.81e-002 | AD76: 2.6200000000000001e-002 | AE76: 87.76 | AF76: 88.94 | AG76: 0.25 | AH76: AA+ | AI76: 4.3099999999999999e-002 | AJ76: =H76+100*O76 -> 132.00399999999999 | AK76: 119 | AL76: 82 | AM76: 30.1 | AN76: 114 | AO76: -5.0000000000000001e-003 | AP76: 4 | AQ76: 英特转债!
A77: 119 | B77: 113036 | C77: 宁建转债! | D77: 601789 | E77: 宁波建工 | F77: 建筑 | G77: 建筑工程 | H77: 98.12 | I77: -4.4000000000000003e-003 | J77: 2.5000000000000001e-003 | K77: 3.89 | L77: -5.1000000000000004e-003 | M77: 117.3 | N77: 4.86 | O77: 0.22600000000000001 | P77: 80.04 | Q77: 转股中 | R77: 5.30年 | S77: 3.30年 | T77: 5.4 | U77: 1.1 | V77: 2.e-003 | W77: 0.14199999999999999 | X77: 0.114 | Y77: 38 | Z77: 1.28 | AA77: 3.5000000000000003e-002 | AB77: 2.8900000000000002e-002 | AC77: 1.66e-002 | AD77: 1.43e-002 | AE77: 89.24 | AF77: 93.31 | AG77: 0.37 | AH77: AA | AI77: 4.5100000000000001e-002 | AJ77: =H77+100*O77 -> 120.72 | AK77: 116.2 | AL77: 47 | AM77: 22.9 | AN77: 39 | AO77: -1.e-003 | AP77: 9 | AQ77: 宁建转债!
A78: 12 | B78: 128143 | C78: 锋龙转债! | D78: 2931 | E78: 锋龙股份 | F78: 机械装备 | G78: 专用设备 | H78: 100.082 | I78: 2.8000000000000004e-003 | J78: -1.11e-002 | K78: 15 | L78: -1.38e-002 | M78: 121.7 | N78: 17.97 | O78: 0.19899999999999998 | P78: 83.47 | Q78: 3月27天 | R78: 5.81年 | S78: 3.81年 | T78: 2.45 | U78: 9.5 | V78: 3.9e-002 | W78: 0.115 | X78: 9.6000000000000002e-002 | Y78: 21 | Z78: 3.7 | AA78: 3.5000000000000003e-002 | AB78: 2.8300000000000002e-002 | AC78: 1.1399999999999999e-002 | AD78: 9.1000000000000004e-003 | AE78: 78.15 | AF78: 79.87 | AG78: 0.6 | AH78: A+ | AI78: 7.7100000000000002e-002 | AJ78: =H78+100*O78 -> 119.982 | AK78: 116.7 | AL78: 51 | AM78: 36.8 | AN78: 180 | AO78: 0. | AP78: 8 | AQ78: 锋龙转债!
A79: 331 | B79: 128014 | C79: 永东转债! | D79: 2753 | E79: 永东股份 | F79: 化工 | G79: 化工 | H79: 103.79 | I79: 5.6999999999999993e-003 | J79: -5.6999999999999993e-003 | K79: 8.02 | L79: 1.1999999999999999e-003 | M79: 111.3 | N79: 12.6 | O79: 0.63100000000000001 | P79: 63.65 | Q79: 转股中 | R79: 2年29天 | S79: 29天 | T79: 3.37 | U79: 1.7 | V79: 5.0000000000000001e-003 | W79: 0.11199999999999999 | X79: 7.0999999999999994e-002 | Y79: 30 | Z79: 1.71 | AA79: 3.49e-002 | AB79: 2.4399999999999998e-002 | AC79: -7.6399999999999996e-002 | AD79: -0.10300000000000001 | AE79: 100.29 | AF79: 98.26 | AG79: 0 | AH79: AA- | AI79: 6.3200000000000006e-002 | AJ79: =H79+100*O79 -> 166.89000000000001 | AK79: 143.9 | AL79: 274 | AM79: 43.6 | AN79: 234 | AO79: 1.6e-002 | AP79: 39 | AQ79: 永东转债!
A80: 225 | B80: 128072 | C80: 翔鹭转债! | D80: 2842 | E80: 翔鹭钨业 | F80: 有色金属 | G80: 小金属 | H80: 99.2 | I80: 1.0200000000000001e-002 | J80: -9.1000000000000004e-003 | K80: 10.07 | L80: 4.0000000000000001e-003 | M80: 115.1 | N80: 15.34 | O80: 0.51100000000000001 | P80: 65.65 | Q80: 转股中 | R80: 4.42年 | S80: 2.42年 | T80: 3.02 | U80: 4.1 | V80: 1.3999999999999999e-002 | W80: 0.11 | X80: 7.2000000000000008e-002 | Y80: 28 | Z80: 3.03 | AA80: 3.49e-002 | AB80: 2.8500000000000001e-002 | AC80: 1.6399999999999998e-002 | AD80: 1.38e-002 | AE80: 88.13 | AF80: 87.84 | AG80: 0.28 | AH80: AA- | AI80: 6.4500000000000002e-002 | AJ80: =H80+100*O80 -> 150.30000000000001 | AK80: 132.8 | AL80: 221 | AM80: 44.6 | AN80: 242 | AO80: -3.1e-002 | AP80: 28 | AQ80: 翔鹭转债!
A81: 48 | B81: 113608 | C81: 威派转债! | D81: 603956 | E81: 威派格 | F81: 机械装备 | G81: 专用设备 | H81: 100.63 | I81: 6.3e-003 | J81: 1.24e-002 | K81: 15.74 | L81: 3.2799999999999996e-002 | M81: 121.6 | N81: 19.24 | O81: 0.23000000000000001 | P81: 81.81 | Q81: 55天 | R81: 5.64年 | S81: 3.64年 | T81: 4.2 | U81: 8.1 | V81: 1.9e-002 | W81: 6.3e-002 | X81: 5.0999999999999997e-002 | Y81: 67 | Z81: 5.88 | AA81: 3.49e-002 | AB81: 2.7999999999999997e-002 | AC81: 1.03e-002 | AD81: 8.0000000000000002e-003 | AE81: 79.1 | AF81: 80.78 | AG81: 0.57 | AH81: A+ | AI81: 7.7100000000000002e-002 | AJ81: =H81+100*O81 -> 123.63 | AK81: 119.5 | AL81: 85 | AM81: 38.7 | AN81: 193 | AO81: 1.3999999999999999e-002 | AP81: 7 | AQ81: 威派转债!
A82: 39 | B82: 113610 | C82: 灵康转债 | D82: 603669 | E82: 灵康药业 | F82: 医药 | G82: 化学制药 | H82: 100.02 | I82: 4.4000000000000003e-003 | J82: 8.0000000000000004e-004 | K82: 7.9 | L82: 8.8999999999999999e-003 | M82: 121.1 | N82: 8.81 | O82: 0.115 | P82: 89.67 | Q82: 2月20天 | R82: 5.70年 | S82: 3.70年 | T82: 5.25 | U82: 6.2 | V82: 1.2e-002 | W82: 9.3000000000000013e-002 | X82: 8.4000000000000005e-002 | Y82: 56 | Z82: 4.13 | AA82: 3.4799999999999998e-002 | AB82: 2.8199999999999999e-002 | AC82: 1.03e-002 | AD82: 8.199999999999999e-003 | AE82: 81.41 | AF82: 84.71 | AG82: 0.58 | AH82: AA- | AI82: 6.6100000000000006e-002 | AJ82: =H82+100*O82 -> 111.52 | AK82: 110.4 | AL82: 18 | AM82: 25.7 | AN82: 64 | AO82: 1.6e-002 | AP82: 16 | AQ82: 灵康转债
A83: 292 | B83: 123010 | C83: 博世转债! | D83: 300422 | E83: 博世科 | F83: 城市公用 | G83: 三废处理 | H83: 100.599 | I83: 3.4000000000000002e-003 | J83: 1.e-004 | K83: 9.67 | L83: 1.04e-002 | M83: 112.3 | N83: 12.2 | O83: 0.26899999999999996 | P83: 79.26 | Q83: 转股中 | R83: 3.29年 | S83: 1.30年 | T83: 4.3 | U83: 1.2 | V83: 3.0000000000000001e-003 | W83: 0.11 | X83: 8.6999999999999994e-002 | Y83: 39 | Z83: 1.66 | AA83: 3.4700000000000002e-002 | AB83: 2.75e-002 | AC83: 1.5100000000000001e-002 | AD83: 1.1200000000000002e-002 | AE83: 93.9 | AF83: 91.82 | AG83: 0.34 | AH83: AA- | AI83: 6.4500000000000002e-002 | AJ83: =H83+100*O83 -> 127.499 | AK83: 121.9 | AL83: 113 | AM83: 28 | AN83: 95 | AO83: 2.3e-002 | AP83: 32 | AQ83: 博世转债!
A84: 291 | B84: 110045 | C84: 海澜转债! | D84: 600398 | E84: 海澜之家 | F84: 服装纺织 | G84: 服装行业 | H84: 99.51 | I84: -1.e-004 | J84: -5.0000000000000001e-004 | K84: 7.12 | L84: -9.7000000000000003e-003 | M84: 111.1 | N84: 11.75 | O84: 0.64200000000000002 | P84: 60.6 | Q84: 转股中 | R84: 3.32年 | S84: 1.32年 | T84: 29.5 | U84: 24 | V84: 8.0000000000000002e-003 | W84: 9.6000000000000002e-002 | X84: 5.7999999999999996e-002 | Y84: 308 | Z84: 2.42 | AA84: 3.4300000000000004e-002 | AB84: 2.7900000000000001e-002 | AC84: 1.7000000000000001e-002 | AD84: 1.43e-002 | AE84: 96.08 | AF84: 97.29 | AG84: 0.07 | AH84: AA+ | AI84: 4.1500000000000002e-002 | AJ84: =H84+100*O84 -> 163.71000000000001 | AK84: 138.4 | AL84: 256 | AM84: 41.1 | AN84: 213 | AO84: 1.9e-002 | AP84: 57 | AQ84: 海澜转债!
A85: 145 | B85: 113578 | C85: 全筑转债! | D85: 603030 | E85: 全筑股份 | F85: 建筑 | G85: 装饰工程 | H85: 100.09 | I85: 2.3999999999999998e-003 | J85: -5.0000000000000001e-003 | K85: 4.54 | L85: -6.6e-003 | M85: 118.3 | N85: 5.43 | O85: 0.19699999999999998 | P85: 83.61 | Q85: 转股中 | R85: 5年31天 | S85: 3年32天 | T85: 3.84 | U85: 3.6 | V85: 9.0000000000000011e-003 | W85: 0.157 | X85: 0.13100000000000001 | Y85: 24 | Z85: 1.1 | AA85: 3.4099999999999998e-002 | AB85: 2.75e-002 | AC85: 1.1399999999999999e-002 | AD85: 9.1000000000000004e-003 | AE85: 90.07 | AF85: 94.98 | AG85: 0.4 | AH85: AA | AI85: 4.5100000000000001e-002 | AJ85: =H85+100*O85 -> 119.79000000000001 | AK85: 116.6 | AL85: 50 | AM85: 21.6 | AN85: 30 | AO85: 1.3999999999999999e-002 | AP85: 19 | AQ85: 全筑转债!
A86: 153 | B86: 113576 | C86: 起步转债!! | D86: 603557 | E86: 起步股份 | F86: 服装纺织 | G86: 鞋服行业 | H86: 103.4 | I86: -1.1000000000000001e-003 | J86: 7.4000000000000003e-003 | K86: 9.23 | L86: 1.21e-002 | M86: 121.8 | N86: 10.55 | O86: 0.182 | P86: 87.49 | Q86: 转股中 | R86: 5年21天 | S86: 3年22天 | T86: 2.66 | U86: 72 | V86: 0.26000000000000001 | W86: 5.7999999999999996e-002 | X86: 5.0999999999999997e-002 | Y86: 46 | Z86: 2.72 | AA86: 3.3799999999999997e-002 | AB86: 2.6000000000000002e-002 | AC86: 4.0000000000000001e-003 | AD86: 1.1000000000000001e-003 | AE86: 85.45 | AF86: 88.89 | AG86: 0.53 | AH86: AA- | AI86: 6.6100000000000006e-002 | AJ86: =H86+100*O86 -> 121.60000000000001 | AK86: 119.3 | AL86: 84 | AM86: 30.4 | AN86: 115 | AO86: 8.9999999999999997e-002 | AP86: 27 | AQ86: 起步转债!!
A87: 27 | B87: 123086 | C87: 海兰转债! | D87: 300065 | E87: 海兰信 | F87: 电子 | G87: 电子产品 | H87: 102.55 | I87: 9.3999999999999986e-003 | J87: 2.8000000000000004e-003 | K87: 10.65 | L87: 1.9099999999999999e-002 | M87: 123.5 | N87: 10.88 | O87: 4.8000000000000001e-002 | P87: 97.89 | Q87: 3月0天 | R87: 5.73年 | S87: 3.73年 | T87: 7.3 | U87: 38 | V87: 5.0000000000000003e-002 | W87: 0.17199999999999999 | X87: 0.16899999999999998 | Y87: 42 | Z87: 2.84 | AA87: 3.3599999999999998e-002 | AB87: 2.64e-002 | AC87: 3.2000000000000002e-003 | AD87: 1.2999999999999999e-003 | AE87: 81.11 | AF87: 86.18 | AG87: 0.63 | AH87: AA- | AI87: 6.6100000000000006e-002 | AJ87: =H87+100*O87 -> 107.34999999999999 | AK87: 107.2 | AL87: 11 | AM87: 21 | AN87: 26 | AO87: 0. | AP87: 7 | AQ87: 海兰转债!
A88: 163 | B88: 123047 | C88: 久吾转债 | D88: 300631 | E88: 久吾高科 | F88: 机械装备 | G88: 专用设备 | H88: 111.02 | I88: 1.9e-003 | J88: -4.3e-003 | K88: 16.8 | L88: -4.0999999999999995e-003 | M88: 130.1 | N88: 17.61 | O88: 0.16399999999999998 | P88: 95.4 | Q88: 转股中 | R88: 5年0.1天 | S88: 3年1.1天 | T88: 1.99 | U88: 9.7 | V88: 4.4000000000000004e-002 | W88: 0.109 | X88: 0.10400000000000001 | Y88: 18 | Z88: 2.51 | AA88: 3.32e-002 | AB88: 2.3099999999999999e-002 | AC88: -1.44e-002 | AD88: -1.8000000000000002e-002 | AE88: 84.17 | AF88: 90.8 | AG88: 0.58 | AH88: A+ | AI88: 7.7100000000000002e-002 | AJ88: =H88+100*O88 -> 127.41999999999999 | AK88: 126.6 | AL88: 164 | AM88: 35.8 | AN88: 173 | AO88: 1.e-003 | AP88: 23 | AQ88: 久吾转债
A89: 159 | B89: 113033 | C89: 利群转债! | D89: 601366 | E89: 利群股份 | F89: 商业零售 | G89: 商场 | H89: 98.19 | I89: 1.4000000000000002e-003 | J89: 8.9999999999999998e-004 | K89: 6.3 | L89: 4.7999999999999996e-003 | M89: 115.3 | N89: 7.01 | O89: 9.3000000000000013e-002 | P89: 89.87 | Q89: 转股中 | R89: 5年12天 | S89: 3年13天 | T89: 18 | U89: 9.9 | V89: 6.0000000000000001e-003 | W89: 0.33200000000000002 | X89: 0.29799999999999999 | Y89: 54 | Z89: 1.22 | AA89: 3.32e-002 | AB89: 2.7400000000000001e-002 | AC89: 1.77e-002 | AD89: 1.5300000000000001e-002 | AE89: 90.28 | AF89: 92.79 | AG89: 0.49 | AH89: AA | AI89: 4.5100000000000001e-002 | AJ89: =H89+100*O89 -> 107.48999999999999 | AK89: 106.5 | AL89: 10 | AM89: 13.7 | AN89: 7 | AO89: -3.2000000000000001e-002 | AP89: 44 | AQ89: 利群转债!
A90: 303 | B90: 113505 | C90: 杭电转债! | D90: 603618 | E90: 杭电股份 | F90: 能源电力 | G90: 电力设备 | H90: 101.21 | I90: 6.9999999999999993e-003 | J90: -3.9000000000000003e-003 | K90: 6.44 | L90: 7.8000000000000005e-003 | M90: 111.3 | N90: 7.14 | O90: 0.122 | P90: 90.2 | Q90: 转股中 | R90: 2.96年 | S90: 0.96年 | T90: 7.5 | U90: 14 | V90: 1.9e-002 | W90: 0.16899999999999998 | X90: 0.152 | Y90: 45 | Z90: 1.76 | AA90: 3.3099999999999997e-002 | AB90: 2.58e-002 | AC90: 5.1999999999999998e-003 | AD90: 2.e-003 | AE90: 97.16 | AF90: 98.65 | AG90: 0.39 | AH90: AA | AI90: 4.2199999999999994e-002 | AJ90: =H90+100*O90 -> 113.41 | AK90: 112.2 | AL90: 28 | AM90: 13.6 | AN90: 6 | AO90: 2.4e-002 | AP90: 42 | AQ90: 杭电转债!
A91: 218 | B91: 128076 | C91: 金轮转债! | D91: 2722 | E91: 金轮股份 | F91: 机械装备 | G91: 专用设备 | H91: 99.35 | I91: 1.04e-002 | J91: -9.7000000000000003e-003 | K91: 10.24 | L91: 2.e-003 | M91: 114.9 | N91: 14.76 | O91: 0.43200000000000005 | P91: 69.38 | Q91: 转股中 | R91: 4.57年 | S91: 2.57年 | T91: 2.14 | U91: 6.4 | V91: 2.9999999999999999e-002 | W91: 0.11900000000000001 | X91: 8.3000000000000004e-002 | Y91: 18 | Z91: 0.98 | AA91: 3.3000000000000002e-002 | AB91: 2.6800000000000001e-002 | AC91: 1.4800000000000001e-002 | AD91: 1.23e-002 | AE91: 87.28 | AF91: 86.86 | AG91: 0.33 | AH91: AA- | AI91: 6.4500000000000002e-002 | AJ91: =H91+100*O91 -> 142.55000000000001 | AK91: 129.3 | AL91: 191 | AM91: 42 | AN91: 217 | AO91: 1.7000000000000001e-002 | AP91: 43 | AQ91: 金轮转债!
A92: 124 | B92: 128116 | C92: 瑞达转债! | D92: 2961 | E92: 瑞达期货 | F92: 金融 | G92: 期货行业 | H92: 97.599 | I92: 3.5999999999999999e-003 | J92: -7.4000000000000003e-003 | K92: 20.84 | L92: -1.3300000000000001e-002 | M92: 115.3 | N92: 29.82 | O92: 0.39700000000000002 | P92: 69.89 | Q92: 转股中 | R92: 5.28年 | S92: 3.28年 | T92: 6.5 | U92: 5.8 | V92: 9.0000000000000011e-003 | W92: 7.0000000000000007e-002 | X92: 4.9000000000000002e-002 | Y92: 93 | Z92: 5.27 | AA92: 3.2799999999999996e-002 | AB92: 2.7300000000000001e-002 | AC92: 1.8000000000000002e-002 | AD92: 1.5800000000000002e-002 | AE92: 89.23 | AF92: 91.79 | AG92: 0.28 | AH92: AA | AI92: 4.5100000000000001e-002 | AJ92: =H92+100*O92 -> 137.29900000000001 | AK92: 125.3 | AL92: 150 | AM92: 33.5 | AN92: 148 | AO92: -5.2000000000000005e-002 | AP92: 17 | AQ92: 瑞达转债!
A93: 317 | B93: 128025 | C93: 特一转债! | D93: 2728 | E93: 特一药业 | F93: 医药 | G93: 化学制药 | H93: 99.824 | I93: -4.0000000000000002e-004 | J93: 1.4000000000000002e-003 | K93: 10.97 | L93: 5.5000000000000005e-003 | M93: 108.8 | N93: 14.7 | O93: 0.33799999999999997 | P93: 74.63 | Q93: 转股中 | R93: 2.72年 | S93: 0.72年 | T93: 2.99 | U93: 3.3 | V93: 1.1000000000000001e-002 | W93: 0.13400000000000001 | X93: 0.10000000000000001 | Y93: 22 | Z93: 2.21 | AA93: 3.27e-002 | AB93: 2.63e-002 | AC93: 1.9599999999999999e-002 | AD93: 1.61e-002 | AE93: 96.2 | AF93: 92.33 | AG93: 0.19 | AH93: AA- | AI93: 6.3200000000000006e-002 | AJ93: =H93+100*O93 -> 133.624 | AK93: 125 | AL93: 146 | AM93: 28.8 | AN93: 102 | AO93: 2.9999999999999999e-002 | AP93: 55 | AQ93: 特一转债!
A94: 134 | B94: 123053 | C94: 宝通转债! | D94: 300031 | E94: 宝通科技 | F94: 通信互联 | G94: 互联网 | H94: 103.28 | I94: 2.2000000000000001e-003 | J94: -2.8000000000000004e-003 | K94: 16.27 | L94: -1.1999999999999999e-003 | M94: 121.3 | N94: 20.8 | O94: 0.32000000000000001 | P94: 78.22 | Q94: 转股中 | R94: 5.21年 | S94: 3.21年 | T94: 5 | U94: 1 | V94: 2.e-003 | W94: 7.6999999999999999e-002 | X94: 6.0999999999999999e-002 | Y94: 65 | Z94: 2.25 | AA94: 3.2099999999999997e-002 | AB94: 2.4799999999999999e-002 | AC94: 2.7000000000000001e-003 | AD94: 2.9999999999999997e-004 | AE94: 84.19 | AF94: 87.6 | AG94: 0.45 | AH94: AA- | AI94: 6.6100000000000006e-002 | AJ94: =H94+100*O94 -> 135.28 | AK94: 128.3 | AL94: 182 | AM94: 40.7 | AN94: 210 | AO94: -1.1000000000000001e-002 | AP94: 10 | AQ94: 宝通转债!
A95: 8 | B95: 113042 | C95: 上银转债! | D95: 601229 | E95: 上海银行 | F95: 金融 | G95: 银行行业 | H95: 101.1 | I95: -1.1999999999999999e-003 | J95: -3.0999999999999999e-003 | K95: 8.52 | L95: -1.2699999999999999e-002 | M95: 120.9 | N95: 11.03 | O95: 0.309 | P95: 77.24 | Q95: 4月12天 | R95: 5.85年 | S95: 无权 | T95: 200 | U95: 264 | V95: 1.3000000000000001e-002 | W95: 0.16500000000000001 | X95: 0.128 | Y95: 1210. | Z95: 0.73 | AA95: 3.1899999999999998e-002 | AB95: 2.5399999999999999e-002 | AC95: 无权 | AD95: 无权 | AE95: 无权 | AF95: 96.64 | AG95: 0.34 | AH95: AAA | AI95: 4.0099999999999997e-002 | AJ95: =H95+100*O95 -> 132. | AK95: 125 | AL95: 145 | AM95: 28.3 | AN95: 99 | AO95: 1.e-003 | AP95: 9 | AQ95: 上银转债!
A96: 213 | B96: 110059 | C96: 浦发转债! | D96: 600000 | E96: 浦发银行 | F96: 金融 | G96: 银行行业 | H96: 102.38 | I96: -1.1000000000000001e-003 | J96: -7.1999999999999998e-003 | K96: 10.65 | L96: -3.4500000000000003e-002 | M96: 117.6 | N96: 14.45 | O96: 0.38900000000000001 | P96: 73.7 | Q96: 转股中 | R96: 4.61年 | S96: 无权 | T96: 500 | U96: 55 | V96: 1.e-003 | W96: 0.16 | X96: 0.11800000000000001 | Y96: 3126. | Z96: 0.61 | AA96: 3.1400000000000004e-002 | AB96: 2.4300000000000002e-002 | AC96: 无权 | AD96: 无权 | AE96: 无权 | AF96: 99.3 | AG96: 0.24 | AH96: AAA | AI96: 3.85e-002 | AJ96: =H96+100*O96 -> 141.28 | AK96: 131.1 | AL96: 204 | AM96: 31.8 | AN96: 138 | AO96: -1.4999999999999999e-002 | AP96: 71 | AQ96: 浦发转债!
A97: 23 | B97: 123087 | C97: 明电转债! | D97: 300739 | E97: 明阳电路 | F97: 电子 | G97: 元器件制 | H97: 102.1 | I97: 1.6000000000000001e-003 | J97: -5.1999999999999998e-003 | K97: 15.19 | L97: -5.8999999999999999e-003 | M97: 121.2 | N97: 16.62 | O97: 0.11699999999999999 | P97: 91.4 | Q97: 3月4天 | R97: 5.74年 | S97: 4.74年 | T97: 6.73 | U97: 11 | V97: 1.4999999999999999e-002 | W97: 0.159 | X97: 0.14499999999999999 | Y97: 42 | Z97: 3.09 | AA97: 3.1e-002 | AB97: 2.4399999999999998e-002 | AC97: 9.1999999999999998e-003 | AD97: 6.5000000000000006e-003 | AE97: 78.36 | AF97: 84.59 | AG97: 0.6 | AH97: AA- | AI97: 6.6100000000000006e-002 | AJ97: =H97+100*O97 -> 113.8 | AK97: 112.8 | AL97: 30 | AM97: 28.2 | AN97: 97 | AO97: -3.7999999999999999e-002 | AP97: 5 | AQ97: 明电转债!
A98: 112 | B98: 128120 | C98: 联诚转债! | D98: 2921 | E98: 联诚精密 | F98: 汽车 | G98: 零部件制 | H98: 101.082 | I98: 1.03e-002 | J98: -7.8000000000000005e-003 | K98: 21.64 | L98: 3.7000000000000002e-003 | M98: 118.4 | N98: 24.37 | O98: 0.13800000000000001 | P98: 88.8 | Q98: 转股中 | R98: 5.33年 | S98: 3.33年 | T98: 2.6 | U98: 6 | V98: 2.3e-002 | W98: 0.14699999999999999 | X98: 0.13100000000000001 | Y98: 18 | Z98: 2.36 | AA98: 3.0899999999999997e-002 | AB98: 2.4500000000000001e-002 | AC98: 9.8999999999999991e-003 | AD98: 7.3000000000000001e-003 | AE98: 78.41 | AF98: 76.77 | AG98: 0.67 | AH98: A | AI98: 8.7100000000000011e-002 | AJ98: =H98+100*O98 -> 114.88199999999999 | AK98: 113.4 | AL98: 32 | AM98: 35 | AN98: 165 | AO98: 0.121 | AP98: 18 | AQ98: 联诚转债!
A99: 334 | B99: 128013 | C99: 洪涛转债! | D99: 2325 | E99: 洪涛股份 | F99: 建筑 | G99: 装饰工程 | H99: 105.409 | I99: -3.5999999999999999e-003 | J99: -1.e-003 | K99: 2.44 | L99: -8.1000000000000013e-003 | M99: 109.8 | N99: 2.32 | O99: 2.e-003 | P99: 105.17 | Q99: 转股中 | R99: 1.36年 | S99: 回售内 | T99: 11.8 | U99: 39 | V99: 3.2000000000000001e-002 | W99: 0.38700000000000001 | X99: 0.40700000000000003 | Y99: 30 | Z99: 1.02 | AA99: 3.0800000000000001e-002 | AB99: 1.7100000000000001e-002 | AC99: 回售内 | AD99: 回售内 | AE99: 100.3 | AF99: 101.11 | AG99: 0.56 | AH99: AA- | AI99: 6.3200000000000006e-002 | AJ99: =H99+100*O99 -> 105.60900000000001 | AK99: 105.6 | AL99: 8 | AM99: 4.5 | AN99: 2 | AO99: 3.9e-002 | AP99: 93 | AQ99: 洪涛转债!
A100: 91 | B100: 127021 | C100: 特发转2! | D100: 70 | E100: 特发信息 | F100: 通信互联 | G100: 通信设备 | H100: 99.384 | I100: -6.0999999999999995e-003 | J100: 5.4000000000000003e-003 | K100: 7.11 | L100: -6.9999999999999993e-003 | M100: 113.3 | N100: 12.33 | O100: 0.72299999999999998 | P100: 57.66 | Q100: 转股中 | R100: 4.38年 | S100: 2.39年 | T100: 5.5 | U100: 4.4 | V100: 8.0000000000000002e-003 | W100: 9.4e-002 | X100: 5.4000000000000006e-002 | Y100: 59 | Z100: 2.05 | AA100: 3.0699999999999998e-002 | AB100: 2.5000000000000001e-002 | AC100: 1.0500000000000001e-002 | AD100: 8.8999999999999999e-003 | AE100: 91.59 | AF100: 94.23 | AG100: 0.1 | AH100: AA | AI100: 4.3499999999999997e-002 | AJ100: =H100+100*O100 -> 171.684 | AK100: 141.1 | AL100: 264 | AM100: 46.9 | AN100: 248 | AO100: -3.6000000000000004e-002 | AP100: 9 | AQ100: 特发转2!
A101: 43 | B101: 113609 | C101: 永安转债! | D101: 603776 | E101: 永安行 | F101: 城市公用 | G101: 其他 | H101: 101.82 | I101: 4.3e-003 | J101: 2.8999999999999998e-003 | K101: 20.4 | L101: 1.09e-002 | M101: 120.5 | N101: 20.34 | O101: 1.4999999999999999e-002 | P101: 100.29 | Q101: 2月13天 | R101: 5.68年 | S101: 3.69年 | T101: 8.86 | U101: 38 | V101: 4.2000000000000003e-002 | W101: 0.23199999999999998 | X101: 0.23199999999999998 | Y101: 38 | Z101: 1.38 | AA101: 3.0699999999999998e-002 | AB101: 2.4199999999999999e-002 | AC101: 5.1999999999999998e-003 | AD101: 3.2000000000000002e-003 | AE101: 81.35 | AF101: 84.35 | AG101: 0.67 | AH101: AA- | AI101: 6.6100000000000006e-002 | AJ101: =H101+100*O101 -> 103.31999999999999 | AK101: 103.3 | AL101: 5 | AM101: 19 | AN101: 18 | AO101: 0.126 | AP101: 15 | AQ101: 永安转债!
A102: 136 | B102: 113584 | C102: 家悦转债! | D102: 603708 | E102: 家家悦 | F102: 商业零售 | G102: 超市 | H102: 99.05 | I102: -4.1999999999999997e-003 | J102: -1.4000000000000002e-003 | K102: 22.17 | L102: -4.36e-002 | M102: 115.3 | N102: 37.97 | O102: 0.69599999999999995 | P102: 58.39 | Q102: 转股中 | R102: 5.21年 | S102: 3.21年 | T102: 6.45 | U102: 2 | V102: 3.0000000000000001e-003 | W102: 4.8000000000000001e-002 | X102: 2.7999999999999997e-002 | Y102: 135 | Z102: 4.49 | AA102: 3.0200000000000001e-002 | AB102: 2.4700000000000003e-002 | AC102: 1.41e-002 | AD102: 1.1899999999999999e-002 | AE102: 89.57 | AF102: 92.07 | AG102: 0.13 | AH102: AA | AI102: 4.5100000000000001e-002 | AJ102: =H102+100*O102 -> 168.64999999999998 | AK102: 139.7 | AL102: 260 | AM102: 47.6 | AN102: 256 | AO102: -3.5000000000000003e-002 | AP102: 9 | AQ102: 家悦转债!
A103: 263 | B103: 113021 | C103: 中信转债! | D103: 601998 | E103: 中信银行 | F103: 金融 | G103: 银行行业 | H103: 105.32 | I103: 4.0000000000000002e-004 | J103: -4.8999999999999998e-003 | K103: 5.29 | L103: -2.0400000000000001e-002 | M103: 118 | N103: 6.98 | O103: 0.39000000000000001 | P103: 75.79 | Q103: 转股中 | R103: 3.96年 | S103: 无权 | T103: 400 | U103: 55 | V103: 1.e-003 | W103: 0.155 | X103: 0.11699999999999999 | Y103: 2589. | Z103: 0.57 | AA103: 2.9999999999999999e-002 | AB103: 2.1600000000000001e-002 | AC103: 无权 | AD103: 无权 | AE103: 无权 | AF103: 102.03 | AG103: 0.22 | AH103: AAA | AI103: 3.85e-002 | AJ103: =H103+100*O103 -> 144.31999999999999 | AK103: 134.9 | AL103: 235 | AM103: 32.8 | AN103: 143 | AO103: -1.e-003 | AP103: 49 | AQ103: 中信转债!
A104: 111 | B104: 113593 | C104: 沪工转债 | D104: 603131 | E104: 上海沪工 | F104: 机械装备 | G104: 通用设备 | H104: 104.39 | I104: -6.3e-003 | J104: 1.41e-002 | K104: 19.52 | L104: 1.24e-002 | M104: 121.6 | N104: 21.32 | O104: 0.14000000000000001 | P104: 91.56 | Q104: 转股中 | R104: 5.33年 | S104: 3.34年 | T104: 4 | U104: 15 | V104: 3.5000000000000003e-002 | W104: 6.4000000000000001e-002 | X104: 5.9000000000000004e-002 | Y104: 62 | Z104: 5.03 | AA104: 2.9700000000000001e-002 | AB104: 2.2499999999999999e-002 | AC104: 5.9999999999999995e-004 | AD104: -1.9e-003 | AE104: 80.89 | AF104: 82.61 | AG104: 0.63 | AH104: A+ | AI104: 7.7100000000000002e-002 | AJ104: =H104+100*O104 -> 118.39 | AK104: 117.2 | AL104: 59 | AM104: 34.6 | AN104: 162 | AO104: -2.7000000000000003e-002 | AP104: 9 | AQ104: 沪工转债
A105: 214 | B105: 127014 | C105: 北方转债! | D105: 65 | E105: 北方国际 | F105: 建筑 | G105: 建筑工程 | H105: 101 | I105: -4.7999999999999996e-003 | J105: 3.3e-003 | K105: 7.03 | L105: -4.1999999999999997e-003 | M105: 115.1 | N105: 8.75 | O105: 0.25700000000000001 | P105: 80.34 | Q105: 转股中 | R105: 4.60年 | S105: 2.60年 | T105: 5.78 | U105: 0.7 | V105: 1.e-003 | W105: 0.107 | X105: 8.5999999999999993e-002 | Y105: 54 | Z105: 1.02 | AA105: 2.9500000000000002e-002 | AB105: 2.3300000000000001e-002 | AC105: 9.300000000000001e-003 | AD105: 6.7000000000000002e-003 | AE105: 92.7 | AF105: 95.86 | AG105: 0.34 | AH105: AA+ | AI105: 4.1500000000000002e-002 | AJ105: =H105+100*O105 -> 126.7 | AK105: 121.7 | AL105: 109 | AM105: 25.8 | AN105: 67 | AO105: 6.9999999999999993e-003 | AP105: 17 | AQ105: 北方转债!
A106: 160 | B106: 113574 | C106: 华体转债! | D106: 603679 | E106: 华体科技 | F106: 城市公用 | G106: 城市公用 | H106: 100.96 | I106: 7.8000000000000005e-003 | J106: 2.8999999999999998e-003 | K106: 19.03 | L106: 6.0199999999999997e-002 | M106: 116.4 | N106: 33.99 | O106: 0.80299999999999994 | P106: 55.99 | Q106: 转股中 | R106: 5年11天 | S106: 3年12天 | T106: 2.09 | U106: 196 | V106: 0.89700000000000002 | W106: 7.6999999999999999e-002 | X106: 4.2999999999999997e-002 | Y106: 27 | Z106: 3.71 | AA106: 2.9500000000000002e-002 | AB106: 2.3399999999999997e-002 | AC106: 1.1200000000000002e-002 | AD106: 8.3999999999999995e-003 | AE106: 82.74 | AF106: 80.94 | AG106: 0.18 | AH106: A+ | AI106: 7.7100000000000002e-002 | AJ106: =H106+100*O106 -> 181.25999999999999 | AK106: 145.9 | AL106: 278 | AM106: 63.2 | AN106: 297 | AO106: 1.e-002 | AP106: 17 | AQ106: 华体转债!
A107: 55 | B107: 123075 | C107: 贝斯转债! | D107: 300580 | E107: 贝斯特 | F107: 汽车 | G107: 零部件制 | H107: 98.4 | I107: -2.e-003 | J107: -8.0000000000000004e-004 | K107: 17.53 | L107: -6.1999999999999998e-003 | M107: 115.5 | N107: 23.99 | O107: 0.34700000000000003 | P107: 73.07 | Q107: 48天 | R107: 5.62年 | S107: 3.62年 | T107: 6 | U107: 1 | V107: 2.e-003 | W107: 0.17100000000000001 | X107: 0.125 | Y107: 35 | Z107: 2.18 | AA107: 2.9500000000000002e-002 | AB107: 2.4300000000000002e-002 | AC107: 1.44e-002 | AD107: 1.24e-002 | AE107: 81.66 | AF107: 81.19 | AG107: 0.45 | AH107: AA- | AI107: 6.6100000000000006e-002 | AJ107: =H107+100*O107 -> 133.10000000000002 | AK107: 123.7 | AL107: 132 | AM107: 42.1 | AN107: 218 | AO107: -2.6000000000000002e-002 | AP107: 8 | AQ107: 贝斯转债!
A108: 254 | B108: 123024 | C108: 岱勒转债! | D108: 300700 | E108: 岱勒新材 | F108: 机械装备 | G108: 专用设备 | H108: 103.72 | I108: 2.9999999999999997e-004 | J108: 5.5000000000000005e-003 | K108: 16.57 | L108: 1.1599999999999999e-002 | M108: 113 | N108: 18.33 | O108: 0.14699999999999999 | P108: 90.4 | Q108: 转股中 | R108: 3年1.1天 | S108: 1年2.1天 | T108: 2.1 | U108: 6 | V108: 2.7999999999999997e-002 | W108: 0.154 | X108: 0.13900000000000001 | Y108: 14 | Z108: 2.77 | AA108: 2.9399999999999999e-002 | AB108: 2.12e-002 | AC108: -1.6299999999999999e-002 | AD108: -1.9199999999999998e-002 | AE108: 93.48 | AF108: 91.11 | AG108: 0.5 | AH108: A+ | AI108: 7.5499999999999998e-002 | AJ108: =H108+100*O108 -> 118.42 | AK108: 117 | AL108: 56 | AM108: 23.6 | AN108: 48 | AO108: 1.4999999999999999e-002 | AP108: 35 | AQ108: 岱勒转债!
A109: 327 | B109: 113014 | C109: 林洋转债! | D109: 601222 | E109: 林洋能源 | F109: 能源电力 | G109: 电力设备 | H109: 101.5 | I109: 3.9000000000000003e-003 | J109: -5.0000000000000001e-004 | K109: 7.24 | L109: 1.1200000000000002e-002 | M109: 109.3 | N109: 8.54 | O109: 0.19699999999999998 | P109: 84.78 | Q109: 转股中 | R109: 2.61年 | S109: 0.61年 | T109: 30 | U109: 25 | V109: 8.0000000000000002e-003 | W109: 0.23699999999999999 | X109: 0.20100000000000001 | Y109: 127 | Z109: 1.21 | AA109: 2.9300000000000003e-002 | AB109: 2.2400000000000003e-002 | AC109: 3.8e-003 | AD109: -8.0000000000000004e-004 | AE109: 98.6 | AF109: 98.31 | AG109: 0.3 | AH109: AA | AI109: 4.2199999999999994e-002 | AJ109: =H109+100*O109 -> 121.2 | AK109: 118.2 | AL109: 75 | AM109: 19.6 | AN109: 21 | AO109: 3.0000000000000001e-003 | AP109: 30 | AQ109: 林洋转债!
A110: 127 | B110: 123056 | C110: 雪榕转债 | D110: 300511 | E110: 雪榕生物 | F110: 农业 | G110: 种植业 | H110: 104.4 | I110: 3.5999999999999999e-003 | J110: -9.5999999999999992e-003 | K110: 9.95 | L110: -1.1899999999999999e-002 | M110: 121.1 | N110: 11.89 | O110: 0.248 | P110: 83.68 | Q110: 转股中 | R110: 5.26年 | S110: 3.27年 | T110: 5.85 | U110: 3.6 | V110: 6.0000000000000001e-003 | W110: 0.13300000000000001 | X110: 0.111 | Y110: 44 | Z110: 2.3 | AA110: 2.92e-002 | AB110: 2.2099999999999998e-002 | AC110: -1.1000000000000001e-003 | AD110: -3.3e-003 | AE110: 83.72 | AF110: 87.12 | AG110: 0.5 | AH110: AA- | AI110: 6.6100000000000006e-002 | AJ110: =H110+100*O110 -> 129.20000000000002 | AK110: 125.1 | AL110: 148 | AM110: 38 | AN110: 187 | AO110: -8.0000000000000002e-002 | AP110: 16 | AQ110: 雪榕转债
A111: 79 | B111: 123065 | C111: 宝莱转债! | D111: 300246 | E111: 宝莱特 | F111: 医药 | G111: 医疗器械 | H111: 104.222 | I111: 6.9999999999999993e-003 | J111: 5.1999999999999998e-003 | K111: 24.19 | L111: 4.8499999999999995e-002 | M111: 121.4 | N111: 40.54 | O111: 0.747 | P111: 59.67 | Q111: 转股中 | R111: 5.46年 | S111: 3.46年 | T111: 2.19 | U111: 388 | V111: 1.6499999999999999 | W111: 6.2e-002 | X111: 3.7000000000000005e-002 | Y111: 35 | Z111: 4.24 | AA111: 2.8999999999999998e-002 | AB111: 2.2000000000000002e-002 | AC111: 2.9999999999999997e-004 | AD111: -2.e-003 | AE111: 82.91 | AF111: 86.27 | AG111: 0.25 | AH111: AA- | AI111: 6.6100000000000006e-002 | AJ111: =H111+100*O111 -> 178.922 | AK111: 148.8 | AL111: 287 | AM111: 62.5 | AN111: 296 | AO111: 1.3999999999999999e-002 | AP111: 14 | AQ111: 宝莱转债!
A112: 10 | B112: 123093 | C112: 金陵转债 | D112: 300651 | E112: 金陵体育 | F112: 其他 | G112: 文化教育 | H112: 109.957 | I112: -4.0999999999999995e-003 | J112: -5.6000000000000008e-003 | K112: 42.78 | L112: -1.66e-002 | M112: 129.3 | N112: 49.29 | O112: 0.26700000000000002 | P112: 86.79 | Q112: 4月9天 | R112: 5.84年 | S112: 3.84年 | T112: 2.5 | U112: 60 | V112: 0.218 | W112: 4.4999999999999998e-002 | X112: 3.9e-002 | Y112: 55 | Z112: 8.03 | AA112: 2.8900000000000002e-002 | AB112: 2.0499999999999997e-002 | AC112: -8.3000000000000001e-003 | AD112: -1.1299999999999999e-002 | AE112: 79.33 | AF112: 84.86 | AG112: 0.59 | AH112: A+ | AI112: 7.7100000000000002e-002 | AJ112: =H112+100*O112 -> 136.65699999999998 | AK112: 133.1 | AL112: 223 | AM112: 48.3 | AN112: 259 | AO112: -5.9000000000000004e-002 | AP112: 3 | AQ112: 金陵转债
A113: 171 | B113: 113570 | C113: 百达转债! | D113: 603331 | E113: 百达精工 | F113: 机械装备 | G113: 机械装备 | H113: 100.01 | I113: 1.9099999999999999e-002 | J113: -1.9099999999999999e-002 | K113: 9.14 | L113: 0. | M113: 114.9 | N113: 11.54 | O113: 0.26300000000000001 | P113: 79.2 | Q113: 转股中 | R113: 4.98年 | S113: 2.98年 | T113: 2.8 | U113: 13 | V113: 4.7e-002 | W113: 0.17100000000000001 | X113: 0.13600000000000001 | Y113: 16 | Z113: 2.11 | AA113: 2.8799999999999999e-002 | AB113: 2.3199999999999998e-002 | AC113: 1.0800000000000001e-002 | AD113: 8.6e-003 | AE113: 82.4 | AF113: 80.55 | AG113: 0.52 | AH113: A+ | AI113: 7.5499999999999998e-002 | AJ113: =H113+100*O113 -> 126.31 | AK113: 120.8 | AL113: 96 | AM113: 38.4 | AN113: 190 | AO113: 1.9e-002 | AP113: 35 | AQ113: 百达转债!
A114: 69 | B114: 123068 | C114: 弘信转债 | D114: 300657 | E114: 弘信电子 | F114: 电子 | G114: 元器件制 | H114: 103.8 | I114: -8.0000000000000004e-004 | J114: -6.9999999999999993e-003 | K114: 16 | L114: -1.4199999999999999e-002 | M114: 121.2 | N114: 18.45 | O114: 0.19699999999999998 | P114: 86.72 | Q114: 33天 | R114: 5.57年 | S114: 3.58年 | T114: 5.7 | U114: 1.9 | V114: 3.0000000000000001e-003 | W114: 0.10400000000000001 | X114: 8.9999999999999997e-002 | Y114: 55 | Z114: 3.74 | AA114: 2.8799999999999999e-002 | AB114: 2.2000000000000002e-002 | AC114: 8.0000000000000004e-004 | AD114: -1.2999999999999999e-003 | AE114: 82.17 | AF114: 85.5 | AG114: 0.55 | AH114: AA- | AI114: 6.6100000000000006e-002 | AJ114: =H114+100*O114 -> 123.5 | AK114: 120.9 | AL114: 97 | AM114: 35.4 | AN114: 169 | AO114: -4.4999999999999998e-002 | AP114: 7 | AQ114: 弘信转债
A115: 157 | B115: 127016 | C115: 鲁泰转债! | D115: 726 | E115: 鲁 泰Ａ | F115: 服装纺织 | G115: 纺织行业 | H115: 101 | I115: -2.e-003 | J115: -5.3e-003 | K115: 6.94 | L115: -2.2499999999999999e-002 | M115: 116.2 | N115: 8.91 | O115: 0.29699999999999999 | P115: 77.89 | Q115: 转股中 | R115: 5年20天 | S115: 3年21天 | T115: 14 | U115: 2.7 | V115: 2.e-003 | W115: 0.23499999999999999 | X115: 0.183 | Y115: 60 | Z115: 0.78 | AA115: 2.87e-002 | AB115: 2.2799999999999997e-002 | AC115: 8.3000000000000001e-003 | AD115: 6.0000000000000001e-003 | AE115: 90.64 | AF115: 94.29 | AG115: 0.32 | AH115: AA+ | AI115: 4.3099999999999999e-002 | AJ115: =H115+100*O115 -> 130.69999999999999 | AK115: 124.1 | AL115: 138 | AM115: 29.8 | AN115: 111 | AO115: 2.5000000000000001e-002 | AP115: 22 | AQ115: 鲁泰转债!
A116: 206 | B116: 113549 | C116: 白电转债 | D116: 603861 | E116: 白云电器 | F116: 能源电力 | G116: 电力设备 | H116: 101.05 | I116: -3.0000000000000001e-003 | J116: -4.6999999999999993e-003 | K116: 7.71 | L116: -1.78e-002 | M116: 114.8 | N116: 8.88 | O116: 0.16399999999999998 | P116: 86.82 | Q116: 转股中 | R116: 4.66年 | S116: 2.66年 | T116: 8.8 | U116: 1.9 | V116: 2.e-003 | W116: 0.25800000000000001 | X116: 0.22399999999999998 | Y116: 34 | Z116: 1.45 | AA116: 2.8300000000000002e-002 | AB116: 2.2400000000000003e-002 | AC116: 7.9000000000000008e-003 | AD116: 5.6000000000000008e-003 | AE116: 91.68 | AF116: 94.5 | AG116: 0.43 | AH116: AA | AI116: 4.3499999999999997e-002 | AJ116: =H116+100*O116 -> 117.44999999999999 | AK116: 115.3 | AL116: 41 | AM116: 20.8 | AN116: 25 | AO116: -3.0000000000000001e-003 | AP116: 35 | AQ116: 白电转债
A117: 204 | B117: 128081 | C117: 海亮转债! | D117: 2203 | E117: 海亮股份 | F117: 有色金属 | G117: 铜金属 | H117: 101.1 | I117: 4.0000000000000001e-003 | J117: -7.000000000000001e-004 | K117: 8.97 | L117: 6.7000000000000002e-003 | M117: 114.9 | N117: 9.76 | O117: 0.10000000000000001 | P117: 91.91 | Q117: 转股中 | R117: 4.67年 | S117: 2.68年 | T117: 31.5 | U117: 9.6 | V117: 3.0000000000000001e-003 | W117: 0.17999999999999999 | X117: 0.16500000000000001 | Y117: 175 | Z117: 1.94 | AA117: 2.8300000000000002e-002 | AB117: 2.23e-002 | AC117: 8.0000000000000002e-003 | AD117: 5.6000000000000008e-003 | AE117: 91.72 | AF117: 94.53 | AG117: 0.49 | AH117: AA | AI117: 4.3499999999999997e-002 | AJ117: =H117+100*O117 -> 111.09999999999999 | AK117: 110.3 | AL117: 17 | AM117: 15.8 | AN117: 10 | AO117: -6.0000000000000001e-003 | AP117: 51 | AQ117: 海亮转债!
A118: 256 | B118: 110056 | C118: XD亨通转! | D118: 600487 | E118: 亨通光电 | F118: 通信互联 | G118: 通信设备 | H118: 102.66 | I118: 5.0000000000000001e-003 | J118: -5.0000000000000001e-003 | K118: 12.43 | L118: 0. | M118: 114.8 | N118: 15.01 | O118: 0.23999999999999999 | P118: 82.81 | Q118: 转股中 | R118: 3.998年 | S118: 2年0.1天 | T118: 17.1 | U118: 8.1 | V118: 5.0000000000000001e-003 | W118: 5.7999999999999996e-002 | X118: 4.8000000000000001e-002 | Y118: 294 | Z118: 1.61 | AA118: 2.7699999999999999e-002 | AB118: 2.1000000000000001e-002 | AC118: 5.9999999999999995e-004 | AD118: -1.9e-003 | AE118: 94.18 | AF118: 97.42 | AG118: 0.33 | AH118: AA+ | AI118: 4.1500000000000002e-002 | AJ118: =H118+100*O118 -> 126.66 | AK118: 122.5 | AL118: 118 | AM118: 25.1 | AN118: 58 | AO118: -3.1e-002 | AP118: 31 | AQ118: XD亨通转!
A119: 234 | B119: 113027 | C119: 华钰转债!! | D119: 601020 | E119: 华钰矿业 | F119: 有色金属 | G119: 锌铅镍锡 | H119: 102.63 | I119: -1.4000000000000002e-003 | J119: -1.1599999999999999e-002 | K119: 8.95 | L119: -2.5099999999999997e-002 | M119: 114.9 | N119: 10.17 | O119: 0.16600000000000001 | P119: 88 | Q119: 转股中 | R119: 4.24年 | S119: 2.24年 | T119: 3.25 | U119: 9.9 | V119: 2.9999999999999999e-002 | W119: 6.5000000000000002e-002 | X119: 5.7999999999999996e-002 | Y119: 50 | Z119: 2.04 | AA119: 2.76e-002 | AB119: 2.1000000000000001e-002 | AC119: 3.0999999999999999e-003 | AD119: 4.0000000000000002e-004 | AE119: 89.12 | AF119: 88.69 | AG119: 0.52 | AH119: AA- | AI119: 6.4500000000000002e-002 | AJ119: =H119+100*O119 -> 119.22999999999999 | AK119: 117.3 | AL119: 60 | AM119: 28.1 | AN119: 96 | AO119: -8.1000000000000003e-002 | AP119: 45 | AQ119: 华钰转债!!
A120: 118 | B120: 110071 | C120: 湖盐转债! | D120: 600929 | E120: 雪天盐业 | F120: 食品饮料 | G120: 食品饮料 | H120: 100 | I120: 1.6000000000000001e-003 | J120: -1.6000000000000001e-003 | K120: 5.46 | L120: 0. | M120: 115.2 | N120: 6.6 | O120: 0.20899999999999999 | P120: 82.73 | Q120: 转股中 | R120: 5.31年 | S120: 3.31年 | T120: 7.2 | U120: 0.6 | V120: 1.e-003 | W120: 0.14400000000000002 | X120: 0.11900000000000001 | Y120: 50 | Z120: 1.97 | AA120: 2.76e-002 | AB120: 2.2200000000000001e-002 | AC120: 1.06e-002 | AD120: 8.5000000000000006e-003 | AE120: 89.1 | AF120: 91.58 | AG120: 0.42 | AH120: AA | AI120: 4.5100000000000001e-002 | AJ120: =H120+100*O120 -> 120.90000000000001 | AK120: 117.3 | AL120: 62 | AM120: 25.7 | AN120: 66 | AO120: 2.9999999999999999e-002 | AP120: 16 | AQ120: 湖盐转债!
A121: 2 | B121: 123100 | C121: 朗科转债 | D121: 300543 | E121: 朗科智能 | F121: 电子 | G121: 电子产品 | H121: 100.79 | I121: 4.0000000000000001e-003 | J121: 6.7000000000000002e-003 | K121: 14.13 | L121: 1.6500000000000001e-002 | M121: 117.5 | N121: 15.34 | O121: 9.4e-002 | P121: 92.11 | Q121: 5月6天 | R121: 5.89年 | S121: 3.90年 | T121: 3.8 | U121: 67 | V121: 0.17600000000000002 | W121: 0.13 | X121: 0.12 | Y121: 29 | Z121: 3.55 | AA121: 2.69e-002 | AB121: 2.1400000000000002e-002 | AC121: 7.4000000000000003e-003 | AD121: 5.6000000000000008e-003 | AE121: 80.26 | AF121: 81.16 | AG121: 0.64 | AH121: AA- | AI121: 6.6100000000000006e-002 | AJ121: =H121+100*O121 -> 110.19000000000001 | AK121: 109.5 | AL121: 15 | AM121: 28.3 | AN121: 98 | AO121: -1.4999999999999999e-002 | AP121: 3 | AQ121: 朗科转债
A122: 78 | B122: 128131 | C122: 崇达转2! | D122: 2815 | E122: 崇达技术 | F122: 电子 | G122: 元器件制 | H122: 99.946 | I122: 1.1999999999999999e-003 | J122: -1.2999999999999999e-003 | K122: 12.05 | L122: -8.0000000000000004e-004 | M122: 115.2 | N122: 19.54 | O122: 0.621 | P122: 61.67 | Q122: 转股中 | R122: 5.47年 | S122: 3.47年 | T122: 14 | U122: 1.2 | V122: 1.e-003 | W122: 0.13200000000000001 | X122: 8.1000000000000003e-002 | Y122: 106 | Z122: 2.66 | AA122: 2.6800000000000001e-002 | AB122: 2.1600000000000001e-002 | AC122: 1.03e-002 | AD122: 8.3000000000000001e-003 | AE122: 88.46 | AF122: 90.93 | AG122: 0.17 | AH122: AA | AI122: 4.5100000000000001e-002 | AJ122: =H122+100*O122 -> 162.04599999999999 | AK122: 138.2 | AL122: 254 | AM122: 47.3 | AN122: 254 | AO122: -4.4000000000000004e-002 | AP122: 7 | AQ122: 崇达转2!
A123: 5 | B123: 123097 | C123: 美力转债 | D123: 300611 | E123: 美力科技 | F123: 机械装备 | G123: 通用设备 | H123: 104.5 | I123: 3.2000000000000002e-003 | J123: -1.7000000000000001e-003 | K123: 9.23 | L123: 2.2000000000000001e-003 | M123: 121.6 | N123: 9.34 | O123: 5.7000000000000002e-002 | P123: 98.82 | Q123: 4月16天 | R123: 5.86年 | S123: 3.86年 | T123: 3 | U123: 11 | V123: 3.6000000000000004e-002 | W123: 0.182 | X123: 0.17899999999999999 | Y123: 17 | Z123: 2.56 | AA123: 2.6800000000000001e-002 | AB123: 2.0199999999999999e-002 | AC123: 2.9999999999999997e-004 | AD123: -2.e-003 | AE123: 77.84 | AF123: 79.49 | AG123: 0.69 | AH123: A+ | AI123: 7.7100000000000002e-002 | AJ123: =H123+100*O123 -> 110.2 | AK123: 110.2 | AL123: 16 | AM123: 30.7 | AN123: 121 | AO123: 5.0000000000000001e-003 | AP123: 6 | AQ123: 美力转债
A124: 99 | B124: 128124 | C124: 科华转债! | D124: 2022 | E124: 科华生物 | F124: 医药 | G124: 生物制药 | H124: 95.999 | I124: 3.0999999999999999e-003 | J124: -1.4000000000000002e-003 | K124: 14.85 | L124: 6.0999999999999995e-003 | M124: 110.3 | N124: 21.51 | O124: 0.39100000000000001 | P124: 69.04 | Q124: 转股中 | R124: 5.36年 | S124: 3.36年 | T124: 7.38 | U124: 3.3 | V124: 5.0000000000000001e-003 | W124: 9.6999999999999989e-002 | X124: 6.7000000000000004e-002 | Y124: 76 | Z124: 2.66 | AA124: 2.6699999999999998e-002 | AB124: 2.3e-002 | AC124: 2.0499999999999997e-002 | AD124: 1.8700000000000001e-002 | AE124: 88.33 | AF124: 87.44 | AG124: 0.28 | AH124: AA | AI124: 4.5100000000000001e-002 | AJ124: =H124+100*O124 -> 135.09899999999999 | AK124: 123 | AL124: 120 | AM124: 34.6 | AN124: 163 | AO124: -3.3000000000000002e-002 | AP124: 17 | AQ124: 科华转债!
A125: 193 | B125: 113030 | C125: 东风转债! | D125: 601515 | E125: 东风股份 | F125: 造纸包装 | G125: 包装材料 | H125: 103.52 | I125: -6.0000000000000001e-003 | J125: -8.9999999999999998e-004 | K125: 5.84 | L125: -1.6799999999999999e-002 | M125: 116.9 | N125: 6.75 | O125: 0.19699999999999998 | P125: 86.52 | Q125: 转股中 | R125: 4.76年 | S125: 2.77年 | T125: 2.95 | U125: 2.9 | V125: 1.e-002 | W125: 3.7999999999999999e-002 | X125: 3.3000000000000002e-002 | Y125: 78 | Z125: 1.87 | AA125: 2.63e-002 | AB125: 1.9799999999999998e-002 | AC125: -4.0000000000000002e-004 | AD125: -2.7000000000000001e-003 | AE125: 91.36 | AF125: 95.8 | AG125: 0.41 | AH125: AA | AI125: 4.3499999999999997e-002 | AJ125: =H125+100*O125 -> 123.22 | AK125: 120.5 | AL125: 93 | AM125: 24.7 | AN125: 55 | AO125: -6.9999999999999993e-003 | AP125: 17 | AQ125: 东风转债!
A126: 201 | B126: 128083 | C126: 新北转债! | D126: 2376 | E126: 新北洋 | F126: 电子 | G126: 电子产品 | H126: 102 | I126: -8.3999999999999995e-003 | J126: -2.0999999999999999e-003 | K126: 9.46 | L126: -2.87e-002 | M126: 114.9 | N126: 11.7 | O126: 0.26200000000000001 | P126: 80.85 | Q126: 转股中 | R126: 4.73年 | S126: 2.73年 | T126: 8.77 | U126: 1 | V126: 1.e-003 | W126: 0.13900000000000001 | X126: 0.113 | Y126: 63 | Z126: 1.87 | AA126: 2.6000000000000002e-002 | AB126: 2.0099999999999996e-002 | AC126: 4.7999999999999996e-003 | AD126: 2.3999999999999998e-003 | AE126: 91.49 | AF126: 94.3 | AG126: 0.36 | AH126: AA | AI126: 4.3499999999999997e-002 | AJ126: =H126+100*O126 -> 128.19999999999999 | AK126: 123.1 | AL126: 124 | AM126: 28.8 | AN126: 103 | AO126: -5.5999999999999994e-002 | AP126: 19 | AQ126: 新北转债!
A127: 175 | B127: 113567 | C127: 君禾转债! | D127: 603617 | E127: 君禾股份 | F127: 机械装备 | G127: 通用设备 | H127: 104.89 | I127: 3.7000000000000002e-003 | J127: -3.0999999999999999e-003 | K127: 10.46 | L127: 1.e-003 | M127: 118.8 | N127: 11.46 | O127: 0.14899999999999999 | P127: 91.27 | Q127: 转股中 | R127: 4.96年 | S127: 2.96年 | T127: 2.1 | U127: 1.5 | V127: 6.9999999999999993e-003 | W127: 0.10099999999999999 | X127: 9.1999999999999998e-002 | Y127: 21 | Z127: 3.24 | AA127: 2.6000000000000002e-002 | AB127: 1.9099999999999999e-002 | AC127: -2.8000000000000004e-003 | AD127: -5.3e-003 | AE127: 83.01 | AF127: 83.49 | AG127: 0.61 | AH127: A+ | AI127: 7.5499999999999998e-002 | AJ127: =H127+100*O127 -> 119.78999999999999 | AK127: 118.5 | AL127: 76 | AM127: 35 | AN127: 167 | AO127: 1.6e-002 | AP127: 36 | AQ127: 君禾转债!
A128: 138 | B128: 123051 | C128: 今天转债 | D128: 300532 | E128: 今天国际 | F128: 计算机及 | G128: 软件开发 | H128: 107.89 | I128: -3.0000000000000001e-003 | J128: 3.0000000000000001e-003 | K128: 8.78 | L128: 0. | M128: 122.8 | N128: 8.8 | O128: 8.1000000000000003e-002 | P128: 99.77 | Q128: 转股中 | R128: 5.21年 | S128: 3.21年 | T128: 2.8 | U128: 2.3 | V128: 8.0000000000000002e-003 | W128: 0.11699999999999999 | X128: 0.11599999999999999 | Y128: 24 | Z128: 3.01 | AA128: 2.58e-002 | AB128: 1.8100000000000002e-002 | AC128: -8.8999999999999999e-003 | AD128: -1.1599999999999999e-002 | AE128: 81.79 | AF128: 84.26 | AG128: 0.66 | AH128: A+ | AI128: 7.7100000000000002e-002 | AJ128: =H128+100*O128 -> 115.98999999999999 | AK128: 116 | AL128: 46 | AM128: 31.7 | AN128: 137 | AO128: -1.7000000000000001e-002 | AP128: 15 | AQ128: 今天转债
A129: 15 | B129: 123092 | C129: 天壕转债 | D129: 300332 | E129: 天壕环境 | F129: 石油天然 | G129: 天然气 | H129: 105.499 | I129: -5.6000000000000008e-003 | J129: -1.32e-002 | K129: 4.92 | L129: -2.7699999999999999e-002 | M129: 121.6 | N129: 5.2 | O129: 0.115 | P129: 94.62 | Q129: 3月13天 | R129: 5.76年 | S129: 3.77年 | T129: 4.23 | U129: 15 | V129: 3.4000000000000002e-002 | W129: 9.8000000000000004e-002 | X129: 9.1999999999999998e-002 | Y129: 43 | Z129: 1.26 | AA129: 2.5499999999999998e-002 | AB129: 1.89e-002 | AC129: -2.2000000000000001e-003 | AD129: -4.4000000000000003e-003 | AE129: 78.38 | AF129: 80.04 | AG129: 0.68 | AH129: A+ | AI129: 7.7100000000000002e-002 | AJ129: =H129+100*O129 -> 116.999 | AK129: 116.4 | AL129: 49 | AM129: 36.3 | AN129: 176 | AO129: 4.0000000000000001e-003 | AP129: 6 | AQ129: 天壕转债
A130: 32 | B130: 127026 | C130: 超声转债! | D130: 823 | E130: 超声电子 | F130: 电子 | G130: 元器件制 | H130: 98.223 | I130: -5.7999999999999996e-003 | J130: 5.0000000000000001e-003 | K130: 9.92 | L130: -2.e-003 | M130: 113.1 | N130: 12.85 | O130: 0.27200000000000002 | P130: 77.2 | Q130: 2月27天 | R130: 5.72年 | S130: 3.72年 | T130: 7 | U130: 2.9 | V130: 4.0000000000000001e-003 | W130: 0.13100000000000001 | X130: 0.10099999999999999 | Y130: 53 | Z130: 1.45 | AA130: 2.5399999999999999e-002 | AB130: 2.1099999999999997e-002 | AC130: 1.3899999999999999e-002 | AD130: 1.21e-002 | AE130: 87.39 | AF130: 88.28 | AG130: 0.4 | AH130: AA | AI130: 4.5100000000000001e-002 | AJ130: =H130+100*O130 -> 125.423 | AK130: 119.2 | AL130: 83 | AM130: 31 | AN130: 125 | AO130: 0. | AP130: 8 | AQ130: 超声转债!
A131: 315 | B131: 123004 | C131: 铁汉转债! | D131: 300197 | E131: 铁汉生态 | F131: 城市公用 | G131: 生态环境 | H131: 101.7 | I131: 1.9e-003 | J131: -1.9e-003 | K131: 3.49 | L131: 0. | M131: 108.8 | N131: 3.82 | O131: 0.113 | P131: 91.36 | Q131: 转股中 | R131: 2.75年 | S131: 0.75年 | T131: 8.03 | U131: 30 | V131: 3.7000000000000005e-002 | W131: 8.199999999999999e-002 | X131: 7.400000000000001e-002 | Y131: 99 | Z131: 1.59 | AA131: 2.52e-002 | AB131: 1.9e-002 | AC131: -1.6000000000000001e-003 | AD131: -4.8999999999999998e-003 | AE131: 97.78 | AF131: 97.26 | AG131: 0.41 | AH131: AA | AI131: 4.2199999999999994e-002 | AJ131: =H131+100*O131 -> 113. | AK131: 112 | AL131: 26 | AM131: 14.3 | AN131: 9 | AO131: 5.9999999999999998e-002 | AP131: 48 | AQ131: 铁汉转债!
A132: 74 | B132: 128133 | C132: 奇正转债! | D132: 2287 | E132: 奇正藏药 | F132: 医药 | G132: 中药 | H132: 102.52 | I132: 2.e-003 | J132: 1.1999999999999999e-003 | K132: 23.82 | L132: 8.5000000000000006e-003 | M132: 117.3 | N132: 30.12 | O132: 0.29600000000000004 | P132: 79.08 | Q132: 9天 | R132: 5.51年 | S132: 3.51年 | T132: 8 | U132: 18 | V132: 2.2000000000000002e-002 | W132: 6.3e-002 | X132: 5.0000000000000003e-002 | Y132: 126 | Z132: 5.26 | AA132: 2.52e-002 | AB132: 1.95e-002 | AC132: 3.4000000000000002e-003 | AD132: 1.4000000000000002e-003 | AE132: 88.4 | AF132: 92.43 | AG132: 0.38 | AH132: AA | AI132: 4.5100000000000001e-002 | AJ132: =H132+100*O132 -> 132.12 | AK132: 126 | AL132: 160 | AM132: 33.5 | AN132: 149 | AO132: -1.6e-002 | AP132: 14 | AQ132: 奇正转债!
A133: 41 | B133: 128139 | C133: 祥鑫转债! | D133: 2965 | E133: 祥鑫科技 | F133: 汽车 | G133: 零部件制 | H133: 105.3 | I133: 7.7000000000000002e-003 | J133: -2.5999999999999999e-003 | K133: 36.73 | L133: 7.7000000000000002e-003 | M133: 121 | N133: 37.28 | O133: 6.9000000000000006e-002 | P133: 98.52 | Q133: 2月20天 | R133: 5.70年 | S133: 3.70年 | T133: 6.47 | U133: 8.2 | V133: 1.2e-002 | W133: 0.11699999999999999 | X133: 0.115 | Y133: 55 | Z133: 3.27 | AA133: 2.52e-002 | AB133: 1.8600000000000002e-002 | AC133: -3.4000000000000002e-003 | AD133: -5.4000000000000003e-003 | AE133: 81.32 | AF133: 84.62 | AG133: 0.65 | AH133: AA- | AI133: 6.6100000000000006e-002 | AJ133: =H133+100*O133 -> 112.2 | AK133: 112.1 | AL133: 27 | AM133: 27.5 | AN133: 88 | AO133: 5.7000000000000002e-002 | AP133: 10 | AQ133: 祥鑫转债!
A134: 105 | B134: 113037 | C134: 紫银转债 | D134: 601860 | E134: 紫金银行 | F134: 金融 | G134: 银行行业 | H134: 101.73 | I134: -2.5999999999999999e-003 | J134: -5.0000000000000001e-004 | K134: 3.88 | L134: -7.7000000000000002e-003 | M134: 115.8 | N134: 4.75 | O134: 0.245 | P134: 81.68 | Q134: 转股中 | R134: 5.34年 | S134: 无权 | T134: 45 | U134: 4.9 | V134: 1.e-003 | W134: 0.317 | X134: 0.25900000000000001 | Y134: 142 | Z134: 1 | AA134: 2.5099999999999997e-002 | AB134: 1.9599999999999999e-002 | AC134: 无权 | AD134: 无权 | AE134: 无权 | AF134: 92.87 | AG134: 0.41 | AH134: AA+ | AI134: 4.3099999999999999e-002 | AJ134: =H134+100*O134 -> 126.23 | AK134: 121.8 | AL134: 110 | AM134: 28.9 | AN134: 105 | AO134: -1.e-002 | AP134: 18 | AQ134: 紫银转债
A135: 231 | B135: 128070 | C135: 智能转债! | D135: 2877 | E135: 智能自控 | F135: 机械装备 | G135: 通用设备 | H135: 106.2 | I135: 1.9e-003 | J135: -4.6999999999999993e-003 | K135: 6.85 | L135: -7.1999999999999998e-003 | M135: 117.6 | N135: 9.51 | O135: 0.47399999999999998 | P135: 72.03 | Q135: 转股中 | R135: 4.29年 | S135: 无权 | T135: 2.3 | U135: 302 | V135: 1.21 | W135: 0.10099999999999999 | X135: 7.2999999999999995e-002 | Y135: 23 | Z135: 3.19 | AA135: 2.4700000000000003e-002 | AB135: 1.72e-002 | AC135: 无权 | AD135: 无权 | AE135: 无权 | AF135: 86.78 | AG135: 0.38 | AH135: A+ | AI135: 7.5499999999999998e-002 | AJ135: =H135+100*O135 -> 153.59999999999999 | AK135: 140.4 | AL135: 262 | AM135: 53.6 | AN135: 277 | AO135: 1.7000000000000001e-002 | AP135: 32 | AQ135: 智能转债!
A136: 98 | B136: 123063 | C136: 大禹转债 | D136: 300021 | E136: 大禹节水 | F136: 化工 | G136: 橡胶塑料 | H136: 111.3 | I136: 4.8999999999999998e-003 | J136: -1.34e-002 | K136: 5.18 | L136: -1.3300000000000001e-002 | M136: 126.5 | N136: 4.94 | O136: 6.0999999999999999e-002 | P136: 104.86 | Q136: 转股中 | R136: 5.36年 | S136: 4.36年 | T136: 6.38 | U136: 6.5 | V136: 9.0000000000000011e-003 | W136: 0.154 | X136: 0.16200000000000001 | Y136: 41 | Z136: 2.86 | AA136: 2.4700000000000003e-002 | AB136: 1.6299999999999999e-002 | AC136: -8.8000000000000005e-003 | AD136: -1.1699999999999999e-002 | AE136: 80.53 | AF136: 90.47 | AG136: 0.64 | AH136: AA- | AI136: 6.6100000000000006e-002 | AJ136: =H136+100*O136 -> 117.39999999999999 | AK136: 117.7 | AL136: 66 | AM136: 27.3 | AN136: 85 | AO136: 8.0000000000000002e-003 | AP136: 16 | AQ136: 大禹转债
A137: 6 | B137: 123096 | C137: 思创转债 | D137: 300078 | E137: 思创医惠 | F137: 通信互联 | G137: 物联网 | H137: 108 | I137: 3.7000000000000002e-003 | J137: -3.7000000000000002e-003 | K137: 8.17 | L137: 0. | M137: 124 | N137: 8.27 | O137: 9.3000000000000013e-002 | P137: 98.79 | Q137: 4月16天 | R137: 5.86年 | S137: 3.86年 | T137: 8.17 | U137: 58 | V137: 6.6000000000000003e-002 | W137: 0.115 | X137: 0.114 | Y137: 71 | Z137: 2.33 | AA137: 2.4300000000000002e-002 | AB137: 1.7299999999999999e-002 | AC137: -9.5999999999999992e-003 | AD137: -1.15e-002 | AE137: 80.52 | AF137: 85.85 | AG137: 0.64 | AH137: AA- | AI137: 6.6100000000000006e-002 | AJ137: =H137+100*O137 -> 117.3 | AK137: 117.2 | AL137: 58 | AM137: 31.4 | AN137: 132 | AO137: 7.4999999999999997e-002 | AP137: 3 | AQ137: 思创转债
A138: 301 | B138: 127006 | C138: 敖东转债! | D138: 623 | E138: 吉林敖东 | F138: 金融 | G138: 证券行业 | H138: 100.1 | I138: -5.0000000000000001e-004 | J138: 5.9999999999999995e-004 | K138: 15.69 | L138: 5.9999999999999995e-004 | M138: 107.4 | N138: 20.42 | O138: 0.30299999999999999 | P138: 76.84 | Q138: 转股中 | R138: 2.98年 | S138: 0.98年 | T138: 24.1 | U138: 2.3 | V138: 1.e-003 | W138: 0.13200000000000001 | X138: 0.10099999999999999 | Y138: 182 | Z138: 0.81 | AA138: 2.41e-002 | AB138: 1.9299999999999998e-002 | AC138: 8.3999999999999995e-003 | AD138: 6.5000000000000006e-003 | AE138: 96.59 | AF138: 95.6 | AG138: 0.21 | AH138: AA+ | AI138: 4.0199999999999993e-002 | AJ138: =H138+100*O138 -> 130.40000000000001 | AK138: 123.4 | AL138: 127 | AM138: 26.8 | AN138: 76 | AO138: -5.0000000000000001e-003 | AP138: 27 | AQ138: 敖东转债!
A139: 34 | B139: 128140 | C139: 润建转债! | D139: 2929 | E139: 润建股份 | F139: 通信互联 | G139: 通信设备 | H139: 100.796 | I139: 3.2000000000000002e-003 | J139: -2.3e-003 | K139: 24.84 | L139: 1.6000000000000001e-003 | M139: 115.2 | N139: 26.55 | O139: 7.6999999999999999e-002 | P139: 93.56 | Q139: 2月24天 | R139: 5.72年 | S139: 3.72年 | T139: 10.9 | U139: 6.3 | V139: 6.0000000000000001e-003 | W139: 0.19899999999999998 | X139: 0.18600000000000003 | Y139: 55 | Z139: 1.85 | AA139: 2.41e-002 | AB139: 1.9099999999999999e-002 | AC139: 7.4000000000000003e-003 | AD139: 5.5000000000000005e-003 | AE139: 87.5 | AF139: 89.94 | AG139: 0.55 | AH139: AA | AI139: 4.5100000000000001e-002 | AJ139: =H139+100*O139 -> 108.49600000000001 | AK139: 108 | AL139: 12 | AM139: 18.1 | AN139: 17 | AO139: 2.e-003 | AP139: 11 | AQ139: 润建转债!
A140: 128 | B140: 113588 | C140: 润达转债! | D140: 603108 | E140: 润达医疗 | F140: 医药 | G140: 医疗器械 | H140: 101.16 | I140: 3.4000000000000002e-003 | J140: -4.5000000000000005e-003 | K140: 10.78 | L140: -2.8000000000000004e-003 | M140: 114.2 | N140: 13.36 | O140: 0.254 | P140: 80.69 | Q140: 转股中 | R140: 5.24年 | S140: 3.25年 | T140: 5.5 | U140: 7.8 | V140: 1.3999999999999999e-002 | W140: 8.8000000000000009e-002 | X140: 7.0999999999999994e-002 | Y140: 62 | Z140: 2.08 | AA140: 2.3900000000000001e-002 | AB140: 1.8799999999999997e-002 | AC140: 7.4000000000000003e-003 | AD140: 5.1999999999999998e-003 | AE140: 89.34 | AF140: 91.04 | AG140: 0.41 | AH140: AA | AI140: 4.5100000000000001e-002 | AJ140: =H140+100*O140 -> 126.56 | AK140: 121.6 | AL140: 107 | AM140: 30.6 | AN140: 120 | AO140: 2.5000000000000001e-002 | AP140: 10 | AQ140: 润达转债!
A141: 35 | B141: 123082 | C141: 北陆转债! | D141: 300016 | E141: 北陆药业 | F141: 医药 | G141: 化学制药 | H141: 106.701 | I141: -2.6499999999999999e-002 | J141: -1.21e-002 | K141: 9.02 | L141: -5.45e-002 | M141: 121.7 | N141: 8.86 | O141: 4.8000000000000001e-002 | P141: 101.81 | Q141: 2月24天 | R141: 5.72年 | S141: 3.72年 | T141: 5 | U141: 28 | V141: 5.2000000000000005e-002 | W141: 0.11199999999999999 | X141: 0.114 | Y141: 45 | Z141: 2.81 | AA141: 2.3799999999999998e-002 | AB141: 1.7100000000000001e-002 | AC141: -5.1000000000000004e-003 | AD141: -7.4000000000000003e-003 | AE141: 78.66 | AF141: 80.39 | AG141: 0.71 | AH141: A+ | AI141: 7.7100000000000002e-002 | AJ141: =H141+100*O141 -> 111.50099999999999 | AK141: 111.6 | AL141: 24 | AM141: 31.2 | AN141: 130 | AO141: 4.4000000000000004e-002 | AP141: 9 | AQ141: 北陆转债!
A142: 122 | B142: 123057 | C142: 美联转债! | D142: 300586 | E142: 美联新材 | F142: 化工 | G142: 橡胶塑料 | H142: 105.259 | I142: 6.9999999999999993e-003 | J142: -1.1000000000000001e-003 | K142: 8.43 | L142: 1.0800000000000001e-002 | M142: 118.2 | N142: 9.91 | O142: 0.23699999999999999 | P142: 85.07 | Q142: 转股中 | R142: 5.28年 | S142: 3.29年 | T142: 2.07 | U142: 57 | V142: 0.26200000000000001 | W142: 5.4000000000000006e-002 | X142: 4.5999999999999999e-002 | Y142: 38 | Z142: 5.17 | AA142: 2.2700000000000001e-002 | AB142: 1.6500000000000001e-002 | AC142: -3.2000000000000002e-003 | AD142: -5.5000000000000005e-003 | AE142: 83.71 | AF142: 84.97 | AG142: 0.54 | AH142: AA- | AI142: 6.6100000000000006e-002 | AJ142: =H142+100*O142 -> 128.959 | AK142: 125.5 | AL142: 152 | AM142: 40.5 | AN142: 208 | AO142: 6.8000000000000005e-002 | AP142: 14 | AQ142: 美联转债!
A143: 104 | B143: 128122 | C143: 兴森转债! | D143: 2436 | E143: 兴森科技 | F143: 电子 | G143: 元器件制 | H143: 102.898 | I143: 5.7999999999999996e-003 | J143: -5.6999999999999993e-003 | K143: 9.14 | L143: 1.1000000000000001e-003 | M143: 113.3 | N143: 14.18 | O143: 0.59599999999999997 | P143: 64.46 | Q143: 转股中 | R143: 4.34年 | S143: 3.35年 | T143: 2.69 | U143: 3.1 | V143: 1.1000000000000001e-002 | W143: 2.e-002 | X143: 1.3000000000000001e-002 | Y143: 136 | Z143: 4.31 | AA143: 2.2700000000000001e-002 | AB143: 1.7000000000000001e-002 | AC143: 2.0999999999999999e-003 | AD143: 0. | AE143: 89.37 | AF143: 94.39 | AG143: 0.16 | AH143: AA | AI143: 4.3499999999999997e-002 | AJ143: =H143+100*O143 -> 162.49799999999999 | AK143: 141.3 | AL143: 266 | AM143: 46.9 | AN143: 251 | AO143: 1.7000000000000001e-002 | AP143: 11 | AQ143: 兴森转债!
A144: 9 | B144: 113619 | C144: 世运转债! | D144: 603920 | E144: 世运电路 | F144: 电子 | G144: 元器件制 | H144: 101.31 | I144: -7.000000000000001e-004 | J144: -1.4000000000000002e-003 | K144: 16.56 | L144: -9.5999999999999992e-003 | M144: 115.2 | N144: 26.5 | O144: 0.621 | P144: 62.49 | Q144: 4月9天 | R144: 5.84年 | S144: 3.84年 | T144: 10 | U144: 2.6 | V144: 3.0000000000000001e-003 | W144: 0.14699999999999999 | X144: 9.1999999999999998e-002 | Y144: 68 | Z144: 2.61 | AA144: 2.2700000000000001e-002 | AB144: 1.78e-002 | AC144: 5.8999999999999999e-003 | AD144: 4.0999999999999995e-003 | AE144: 87.03 | AF144: 89.46 | AG144: 0.22 | AH144: AA | AI144: 4.5100000000000001e-002 | AJ144: =H144+100*O144 -> 163.41 | AK144: 140.1 | AL144: 261 | AM144: 50.7 | AN144: 268 | AO144: -0.11900000000000001 | AP144: 3 | AQ144: 世运转债!
A145: 179 | B145: 113565 | C145: 宏辉转债 | D145: 603336 | E145: 宏辉果蔬 | F145: 农业 | G145: 农产品加 | H145: 105.87 | I145: 8.1000000000000013e-003 | J145: 1.8799999999999997e-002 | K145: 9.75 | L145: 4.2800000000000005e-002 | M145: 117.8 | N145: 10 | O145: 8.5999999999999993e-002 | P145: 97.5 | Q145: 转股中 | R145: 4.94年 | S145: 2.94年 | T145: 2.25 | U145: 102 | V145: 0.42499999999999999 | W145: 6.8000000000000005e-002 | X145: 6.7000000000000004e-002 | Y145: 33 | Z145: 3.46 | AA145: 2.23e-002 | AB145: 1.5800000000000002e-002 | AC145: -6.7000000000000002e-003 | AD145: -9.0000000000000011e-003 | AE145: 85.57 | AF145: 87.08 | AG145: 0.63 | AH145: AA- | AI145: 6.4500000000000002e-002 | AJ145: =H145+100*O145 -> 114.47 | AK145: 114.2 | AL145: 35 | AM145: 27.2 | AN145: 82 | AO145: 3.3000000000000002e-002 | AP145: 24 | AQ145: 宏辉转债
A146: 18 | B146: 123089 | C146: 九洲转2! | D146: 300040 | E146: 九洲集团 | F146: 能源电力 | G146: 电力设备 | H146: 107 | I146: 1.e-004 | J146: 9.1000000000000004e-003 | K146: 8.23 | L146: 1.3500000000000002e-002 | M146: 121 | N146: 8 | O146: 4.0000000000000001e-002 | P146: 102.88 | Q146: 3月8天 | R146: 5.76年 | S146: 3.76年 | T146: 5 | U146: 59 | V146: 0.11 | W146: 0.16 | X146: 0.16399999999999998 | Y146: 31 | Z146: 1.43 | AA146: 2.2000000000000002e-002 | AB146: 1.5600000000000001e-002 | AC146: -7.4999999999999997e-003 | AD146: -9.3999999999999986e-003 | AE146: 81.03 | AF146: 84.32 | AG146: 0.68 | AH146: AA- | AI146: 6.6100000000000006e-002 | AJ146: =H146+100*O146 -> 111. | AK146: 111.1 | AL146: 22 | AM146: 26.8 | AN146: 77 | AO146: 0.13300000000000001 | AP146: 12 | AQ146: 九洲转2!
A147: 162 | B147: 110068 | C147: 龙净转债! | D147: 600388 | E147: 龙净环保 | F147: 城市公用 | G147: 三废处理 | H147: 103.55 | I147: 2.9999999999999997e-004 | J147: 7.000000000000001e-004 | K147: 9.6 | L147: 2.0999999999999999e-003 | M147: 115 | N147: 10.73 | O147: 0.157 | P147: 89.47 | Q147: 转股中 | R147: 5年4.1天 | S147: 3年5.1天 | T147: 20 | U147: 19 | V147: 9.0000000000000011e-003 | W147: 0.19500000000000001 | X147: 0.17399999999999999 | Y147: 103 | Z147: 1.78 | AA147: 2.1600000000000001e-002 | AB147: 1.6e-002 | AC147: -1.e-004 | AD147: -2.3e-003 | AE147: 90.62 | AF147: 93.46 | AG147: 0.47 | AH147: AA+ | AI147: 4.3099999999999999e-002 | AJ147: =H147+100*O147 -> 119.25 | AK147: 117.6 | AL147: 65 | AM147: 24.2 | AN147: 51 | AO147: 5.2000000000000005e-002 | AP147: 31 | AQ147: 龙净转债!
A148: 324 | B148: 128018 | C148: 时达转债! | D148: 2527 | E148: 新时达 | F148: 机械装备 | G148: 机器人及 | H148: 103.44 | I148: 1.6000000000000001e-003 | J148: 1.e-003 | K148: 6.08 | L148: 1.e-002 | M148: 109.3 | N148: 7.42 | O148: 0.26200000000000001 | P148: 81.94 | Q148: 转股中 | R148: 2.64年 | S148: 0.64年 | T148: 4.04 | U148: 1.2 | V148: 3.0000000000000001e-003 | W148: 0.107 | X148: 8.8000000000000009e-002 | Y148: 38 | Z148: 1.48 | AA148: 2.1499999999999998e-002 | AB148: 1.47e-002 | AC148: -1.9799999999999998e-002 | AD148: -2.41e-002 | AE148: 98.49 | AF148: 98.2 | AG148: 0.26 | AH148: AA | AI148: 4.2199999999999994e-002 | AJ148: =H148+100*O148 -> 129.63999999999999 | AK148: 124.9 | AL148: 144 | AM148: 26.4 | AN148: 70 | AO148: 5.0000000000000003e-002 | AP148: 39 | AQ148: 时达转债!
A149: 339 | B149: 110031 | C149: 航信转债!! | D149: 600271 | E149: 航天信息 | F149: 计算机及 | G149: 软件开发 | H149: 106.48 | I149: -2.9999999999999997e-004 | J149: 2.9999999999999997e-004 | K149: 11.26 | L149: -4.4000000000000003e-003 | M149: 107 | N149: 21.56 | O149: 1.04 | P149: 52.23 | Q149: 转股中 | R149: 0.23年 | S149: 回售内 | T149: 24 | U149: 8.4 | V149: 3.0000000000000001e-003 | W149: 0.115 | X149: 5.9999999999999998e-002 | Y149: 209 | Z149: 1.81 | AA149: 2.1099999999999997e-002 | AB149: -3.5000000000000003e-002 | AC149: 回售内 | AD149: 回售内 | AE149: 100.27 | AF149: 106.3 | AG149: 0 | AH149: AAA | AI149: 2.8399999999999998e-002 | AJ149: =H149+100*O149 -> 210.48000000000002 | AK149: 160.7 | AL149: 305 | AM149: 54.4 | AN149: 281 | AO149: -4.0000000000000001e-003 | AP149: 15 | AQ149: 航信转债!!
A150: 284 | B150: 113516 | C150: 苏农转债! | D150: 603323 | E150: 苏农银行 | F150: 金融 | G150: 银行行业 | H150: 106.73 | I150: -5.5000000000000005e-003 | J150: 2.9999999999999997e-004 | K150: 4.85 | L150: -1.4199999999999999e-002 | M150: 114.3 | N150: 5.52 | O150: 0.215 | P150: 87.86 | Q150: 转股中 | R150: 3.37年 | S150: 无权 | T150: 12.9 | U150: 1.7 | V150: 1.e-003 | W150: 0.14699999999999999 | X150: 0.13 | Y150: 87 | Z150: 0.74 | AA150: 2.1000000000000001e-002 | AB150: 1.3100000000000001e-002 | AC150: 无权 | AD150: 无权 | AE150: 无权 | AF150: 99.94 | AG150: 0.37 | AH150: AA+ | AI150: 4.1500000000000002e-002 | AJ150: =H150+100*O150 -> 128.23000000000002 | AK150: 125.6 | AL150: 155 | AM150: 25.7 | AN150: 63 | AO150: -4.0000000000000001e-003 | AP150: 32 | AQ150: 苏农转债!
A151: 101 | B151: 123062 | C151: 三超转债 | D151: 300554 | E151: 三超新材 | F151: 机械装备 | G151: 通用设备 | H151: 107.5 | I151: -2.8000000000000004e-003 | J151: 8.1000000000000013e-003 | K151: 16.11 | L151: 7.4999999999999997e-003 | M151: 119.7 | N151: 17.17 | O151: 0.14599999999999999 | P151: 93.83 | Q151: 转股中 | R151: 5.35年 | S151: 3.36年 | T151: 1.95 | U151: 23 | V151: 0.10800000000000001 | W151: 0.129 | X151: 0.121 | Y151: 15 | Z151: 2.89 | AA151: 2.0799999999999999e-002 | AB151: 1.4199999999999999e-002 | AC151: -7.8000000000000005e-003 | AD151: -1.03e-002 | AE151: 78.25 | AF151: 77.43 | AG151: 0.7 | AH151: A | AI151: 8.7100000000000011e-002 | AJ151: =H151+100*O151 -> 122.09999999999999 | AK151: 121.2 | AL151: 102 | AM151: 42.9 | AN151: 223 | AO151: -3.4000000000000002e-002 | AP151: 16 | AQ151: 三超转债
A152: 33 | B152: 113612 | C152: 永冠转债 | D152: 603681 | E152: 永冠新材 | F152: 化工 | G152: 其他 | H152: 108.04 | I152: 4.0000000000000002e-004 | J152: -8.6e-003 | K152: 20.97 | L152: -1.2199999999999999e-002 | M152: 121.2 | N152: 20.79 | O152: 7.0999999999999994e-002 | P152: 100.87 | Q152: 2月27天 | R152: 5.72年 | S152: 3.72年 | T152: 5.2 | U152: 6.5 | V152: 1.1000000000000001e-002 | W152: 0.14899999999999999 | X152: 0.14999999999999999 | Y152: 35 | Z152: 2.36 | AA152: 2.07e-002 | AB152: 1.4199999999999999e-002 | AC152: -9.4999999999999998e-003 | AD152: -1.1599999999999999e-002 | AE152: 81.4 | AF152: 84.7 | AG152: 0.67 | AH152: AA- | AI152: 6.6100000000000006e-002 | AJ152: =H152+100*O152 -> 115.14 | AK152: 115.2 | AL152: 40 | AM152: 30.5 | AN152: 119 | AO152: 2.e-003 | AP152: 5 | AQ152: 永冠转债
A153: 96 | B153: 128125 | C153: 华阳转债! | D153: 2949 | E153: 华阳国际 | F153: 建筑 | G153: 建筑工程 | H153: 106.47 | I153: -6.0999999999999995e-003 | J153: 5.7999999999999996e-003 | K153: 21.87 | L153: -5.0000000000000001e-004 | M153: 118.5 | N153: 25.79 | O153: 0.25600000000000001 | P153: 84.8 | Q153: 转股中 | R153: 5.36年 | S153: 3.36年 | T153: 4.5 | U153: 3.1 | V153: 6.0000000000000001e-003 | W153: 0.105 | X153: 8.900000000000001e-002 | Y153: 43 | Z153: 3.52 | AA153: 2.06e-002 | AB153: 1.44e-002 | AC153: -7.0999999999999995e-003 | AD153: -9.1999999999999998e-003 | AE153: 83.04 | AF153: 84.68 | AG153: 0.55 | AH153: AA- | AI153: 6.6100000000000006e-002 | AJ153: =H153+100*O153 -> 132.06999999999999 | AK153: 128.1 | AL153: 178 | AM153: 43.5 | AN153: 231 | AO153: -2.9999999999999999e-002 | AP153: 6 | AQ153: 华阳转债!
A154: 308 | B154: 123007 | C154: 道氏转债! | D154: 300409 | E154: 道氏技术 | F154: 建筑 | G154: 建筑行业 | H154: 104.413 | I154: -1.e-003 | J154: -1.09e-002 | K154: 13.31 | L154: -2.4900000000000002e-002 | M154: 110.3 | N154: 14.55 | O154: 0.14099999999999999 | P154: 91.48 | Q154: 转股中 | R154: 2.78年 | S154: 0.78年 | T154: 3.04 | U154: 5.8 | V154: 1.8000000000000002e-002 | W154: 4.0999999999999995e-002 | X154: 3.7999999999999999e-002 | Y154: 74 | Z154: 2.53 | AA154: 2.0299999999999999e-002 | AB154: 1.32e-002 | AC154: -2.6499999999999999e-002 | AD154: -3.0200000000000001e-002 | AE154: 96.09 | AF154: 93.29 | AG154: 0.48 | AH154: AA- | AI154: 6.3200000000000006e-002 | AJ154: =H154+100*O154 -> 118.51299999999999 | AK154: 117.3 | AL154: 63 | AM154: 21.3 | AN154: 28 | AO154: -0.105 | AP154: 22 | AQ154: 道氏转债!
A155: 75 | B155: 123067 | C155: 斯莱转债 | D155: 300382 | E155: 斯莱克 | F155: 机械装备 | G155: 专用设备 | H155: 109.09 | I155: -1.1000000000000001e-003 | J155: -2.3e-003 | K155: 9.32 | L155: -5.3e-003 | M155: 121.2 | N155: 9.38 | O155: 9.8000000000000004e-002 | P155: 99.36 | Q155: 4.1天 | R155: 5.50年 | S155: 3.50年 | T155: 3.88 | U155: 5.4 | V155: 1.3000000000000001e-002 | W155: 7.400000000000001e-002 | X155: 7.2999999999999995e-002 | Y155: 53 | Z155: 5.16 | AA155: 1.9799999999999998e-002 | AB155: 1.3000000000000001e-002 | AC155: -1.2800000000000001e-002 | AD155: -1.49e-002 | AE155: 82.57 | AF155: 85.92 | AG155: 0.64 | AH155: AA- | AI155: 6.6100000000000006e-002 | AJ155: =H155+100*O155 -> 118.89 | AK155: 118.8 | AL155: 80 | AM155: 32.9 | AN155: 144 | AO155: 8.5999999999999993e-002 | AP155: 14 | AQ155: 斯莱转债
A156: 150 | B156: 110070 | C156: 凌钢转债! | D156: 600231 | E156: 凌钢股份 | F156: 钢铁 | G156: 炼钢 | H156: 107.04 | I156: 5.5000000000000005e-003 | J156: -9.4999999999999998e-003 | K156: 2.64 | L156: -7.4999999999999997e-003 | M156: 117.8 | N156: 2.75 | O156: 0.115 | P156: 96 | Q156: 转股中 | R156: 5年24天 | S156: 3年25天 | T156: 2.89 | U156: 23 | V156: 7.2999999999999995e-002 | W156: 4.0000000000000001e-002 | X156: 3.7999999999999999e-002 | Y156: 73 | Z156: 0.91 | AA156: 1.95e-002 | AB156: 1.32e-002 | AC156: -8.6e-003 | AD156: -1.1000000000000001e-002 | AE156: 90.45 | AF156: 94.7 | AG156: 0.53 | AH156: AA | AI156: 4.5100000000000001e-002 | AJ156: =H156+100*O156 -> 118.54000000000001 | AK156: 118.1 | AL156: 72 | AM156: 23.4 | AN156: 45 | AO156: 4.0000000000000001e-002 | AP156: 20 | AQ156: 凌钢转债!
A157: 25 | B157: 113044 | C157: 大秦转债! | D157: 601006 | E157: 大秦铁路 | F157: 铁路 | G157: 铁路运输 | H157: 102.4 | I157: -2.2000000000000001e-003 | J157: 1.e-004 | K157: 6.83 | L157: -4.4000000000000003e-003 | M157: 114.1 | N157: 7.66 | O157: 0.14800000000000002 | P157: 89.16 | Q157: 3月1天 | R157: 5.74年 | S157: 3.74年 | T157: 320 | U157: 280 | V157: 9.0000000000000011e-003 | W157: 0.315 | X157: 0.28100000000000003 | Y157: 1015. | Z157: 0.87 | AA157: 1.9400000000000001e-002 | AB157: 1.4800000000000001e-002 | AC157: 3.9000000000000003e-003 | AD157: 1.9e-003 | AE157: 89.24 | AF157: 91.45 | AG157: 0.5 | AH157: AAA | AI157: 4.0099999999999997e-002 | AJ157: =H157+100*O157 -> 117.2 | AK157: 115.6 | AL157: 43 | AM157: 24.2 | AN157: 52 | AO157: 1.6e-002 | AP157: 13 | AQ157: 大秦转债!
A158: 57 | B158: 113606 | C158: 荣泰转债 | D158: 603579 | E158: 荣泰健康 | F158: 机械装备 | G158: 专用设备 | H158: 109.15 | I158: 4.1999999999999997e-003 | J158: 3.8e-003 | K158: 31.32 | L158: 1.29e-002 | M158: 121.2 | N158: 33.32 | O158: 0.161 | P158: 94 | Q158: 47天 | R158: 5.61年 | S158: 3.62年 | T158: 6 | U158: 3.8 | V158: 6.0000000000000001e-003 | W158: 0.13699999999999998 | X158: 0.129 | Y158: 44 | Z158: 2.77 | AA158: 1.9199999999999998e-002 | AB158: 1.26e-002 | AC158: -1.2500000000000001e-002 | AD158: -1.46e-002 | AE158: 81.96 | AF158: 85.28 | AG158: 0.62 | AH158: AA- | AI158: 6.6100000000000006e-002 | AJ158: =H158+100*O158 -> 125.25 | AK158: 124.3 | AL158: 141 | AM158: 39 | AN158: 199 | AO158: 4.2999999999999997e-002 | AP158: 9 | AQ158: 荣泰转债
A159: 309 | B159: 128033 | C159: 迪龙转债! | D159: 2658 | E159: 雪迪龙 | F159: 城市公用 | G159: 三废处理 | H159: 103.3 | I159: -1.8e-003 | J159: -5.4000000000000003e-003 | K159: 7.17 | L159: -2.58e-002 | M159: 108.8 | N159: 8.83 | O159: 0.27200000000000002 | P159: 81.2 | Q159: 转股中 | R159: 2.78年 | S159: 0.78年 | T159: 5.2 | U159: 20 | V159: 3.7000000000000005e-002 | W159: 0.12 | X159: 9.6999999999999989e-002 | Y159: 43 | Z159: 2.14 | AA159: 1.9099999999999999e-002 | AB159: 1.3000000000000001e-002 | AC159: -1.8000000000000002e-002 | AD159: -2.12e-002 | AE159: 97.68 | AF159: 97.16 | AG159: 0.28 | AH159: AA | AI159: 4.2199999999999994e-002 | AJ159: =H159+100*O159 -> 130.5 | AK159: 125.4 | AL159: 151 | AM159: 27.7 | AN159: 91 | AO159: 6.4000000000000001e-002 | AP159: 39 | AQ159: 迪龙转债!
A160: 148 | B160: 123050 | C160: 聚飞转债 | D160: 300303 | E160: 聚飞光电 | F160: 电子 | G160: LED制 | H160: 113.17 | I160: 3.3e-003 | J160: -7.9000000000000008e-003 | K160: 5.03 | L160: -7.9000000000000008e-003 | M160: 124.2 | N160: 5.18 | O160: 0.16500000000000001 | P160: 97.1 | Q160: 转股中 | R160: 5年25天 | S160: 3年26天 | T160: 7.05 | U160: 1.7 | V160: 2.e-003 | W160: 0.11 | X160: 0.106 | Y160: 64 | Z160: 2.77 | AA160: 1.89e-002 | AB160: 1.0800000000000001e-002 | AC160: -2.5699999999999997e-002 | AD160: -2.81e-002 | AE160: 84.86 | AF160: 90.47 | AG160: 0.59 | AH160: AA- | AI160: 6.6100000000000006e-002 | AJ160: =H160+100*O160 -> 129.67000000000002 | AK160: 129.2 | AL160: 190 | AM160: 38.8 | AN160: 194 | AO160: -2.9999999999999999e-002 | AP160: 12 | AQ160: 聚飞转债
A161: 102 | B161: 128123 | C161: 国光转债! | D161: 2749 | E161: 国光股份 | F161: 化工 | G161: 农化 | H161: 105.346 | I161: -6.1999999999999998e-003 | J161: 4.6999999999999993e-003 | K161: 11.5 | L161: -2.5999999999999999e-003 | M161: 116.2 | N161: 13.7 | O161: 0.255 | P161: 83.94 | Q161: 转股中 | R161: 5.35年 | S161: 3.36年 | T161: 3.2 | U161: 1.9 | V161: 6.0000000000000001e-003 | W161: 6.5000000000000002e-002 | X161: 5.4000000000000006e-002 | Y161: 50 | Z161: 4.03 | AA161: 1.89e-002 | AB161: 1.34e-002 | AC161: -3.3e-003 | AD161: -5.6000000000000008e-003 | AE161: 83.34 | AF161: 83.17 | AG161: 0.56 | AH161: AA- | AI161: 6.6100000000000006e-002 | AJ161: =H161+100*O161 -> 130.846 | AK161: 126.8 | AL161: 166 | AM161: 43.4 | AN161: 229 | AO161: 6.9999999999999993e-003 | AP161: 10 | AQ161: 国光转债!
A162: 149 | B162: 123049 | C162: 维尔转债 | D162: 300190 | E162: 维尔利 | F162: 城市公用 | G162: 三废处理 | H162: 113.85 | I162: 8.3999999999999995e-003 | J162: -3.4000000000000002e-003 | K162: 8.15 | L162: 7.4000000000000003e-003 | M162: 124.8 | N162: 7.48 | O162: 4.4999999999999998e-002 | P162: 108.96 | Q162: 转股中 | R162: 5年24天 | S162: 3年25天 | T162: 9.17 | U162: 25 | V162: 2.4e-002 | W162: 0.14400000000000002 | X162: 0.157 | Y162: 64 | Z162: 1.51 | AA162: 1.8799999999999997e-002 | AB162: 1.04e-002 | AC162: -2.58e-002 | AD162: -2.8500000000000001e-002 | AE162: 85.4 | AF162: 91.01 | AG162: 0.67 | AH162: AA- | AI162: 6.6100000000000006e-002 | AJ162: =H162+100*O162 -> 118.34999999999999 | AK162: 118.7 | AL162: 78 | AM162: 27.7 | AN162: 93 | AO162: 7.2999999999999995e-002 | AP162: 16 | AQ162: 维尔转债
A163: 165 | B163: 128101 | C163: 联创转债! | D163: 2036 | E163: 联创电子 | F163: 电子 | G163: 液晶显示 | H163: 104.904 | I163: -3.2000000000000002e-003 | J163: 4.3e-003 | K163: 9.98 | L163: 4.0000000000000001e-003 | M163: 114.8 | N163: 13.86 | O163: 0.45700000000000002 | P163: 72.01 | Q163: 转股中 | R163: 4.99年 | S163: 2.99年 | T163: 3 | U163: 2.2 | V163: 6.9999999999999993e-003 | W163: 2.8999999999999998e-002 | X163: 2.1000000000000001e-002 | Y163: 105 | Z163: 3.55 | AA163: 1.8600000000000002e-002 | AB163: 1.3100000000000001e-002 | AC163: -4.8999999999999998e-003 | AD163: -6.8999999999999999e-003 | AE163: 90.39 | AF163: 93.17 | AG163: 0.28 | AH163: AA | AI163: 4.3499999999999997e-002 | AJ163: =H163+100*O163 -> 150.60399999999998 | AK163: 137.8 | AL163: 251 | AM163: 44.6 | AN163: 243 | AO163: -6.4000000000000001e-002 | AP163: 16 | AQ163: 联创转债!
A164: 191 | B164: 123039 | C164: 开润转债! | D164: 300577 | E164: 开润股份 | F164: 服装纺织 | G164: 纺织行业 | H164: 111.61 | I164: 2.5399999999999999e-002 | J164: -1.3600000000000001e-002 | K164: 26.93 | L164: 2.0499999999999997e-002 | M164: 121 | N164: 30 | O164: 0.24299999999999999 | P164: 89.77 | Q164: 转股中 | R164: 4.77年 | S164: 2.77年 | T164: 2.22 | U164: 156 | V164: 0.625 | W164: 3.4000000000000002e-002 | X164: 3.1e-002 | Y164: 65 | Z164: 4.27 | AA164: 1.7500000000000002e-002 | AB164: 9.7000000000000003e-003 | AC164: -2.3700000000000002e-002 | AD164: -2.63e-002 | AE164: 84.24 | AF164: 86.19 | AG164: 0.57 | AH164: A+ | AI164: 7.5499999999999998e-002 | AJ164: =H164+100*O164 -> 135.91 | AK164: 133.5 | AL164: 225 | AM164: 47.3 | AN164: 253 | AO164: 0.125 | AP164: 24 | AQ164: 开润转债!
A165: 135 | B165: 123052 | C165: 飞鹿转债 | D165: 300665 | E165: 飞鹿股份 | F165: 化工 | G165: 化工 | H165: 116.7 | I165: -4.0999999999999995e-003 | J165: 6.6e-003 | K165: 11.35 | L165: 3.4999999999999996e-003 | M165: 127.3 | N165: 9.9 | O165: 1.8000000000000002e-002 | P165: 114.65 | Q165: 转股中 | R165: 5.21年 | S165: 3.21年 | T165: 1.77 | U165: 24 | V165: 0.11800000000000001 | W165: 0.128 | X165: 0.14699999999999999 | Y165: 14 | Z165: 2.93 | AA165: 1.7299999999999999e-002 | AB165: 8.5000000000000006e-003 | AC165: -3.0600000000000002e-002 | AD165: -3.3399999999999999e-002 | AE165: 82.18 | AF165: 87.37 | AG165: 0.7 | AH165: A+ | AI165: 7.7100000000000002e-002 | AJ165: =H165+100*O165 -> 118.5 | AK165: 118.8 | AL165: 79 | AM165: 31.4 | AN165: 134 | AO165: 6.4000000000000001e-002 | AP165: 15 | AQ165: 飞鹿转债
A166: 323 | B166: 113502 | C166: 嘉澳转债! | D166: 603822 | E166: 嘉澳环保 | F166: 化工 | G166: 化工 | H166: 106.58 | I166: -4.36e-002 | J166: 4.3499999999999997e-002 | K166: 19.91 | L166: -2.4e-002 | M166: 111.3 | N166: 44.79 | O166: 1.3999999999999999 | P166: 44.45 | Q166: 转股中 | R166: 2.65年 | S166: 0.65年 | T166: 1.85 | U166: 359 | V166: 1.79 | W166: 0.127 | X166: 5.5999999999999994e-002 | Y166: 15 | Z166: 1.94 | AA166: 1.6799999999999999e-002 | AB166: 8.8000000000000005e-003 | AC166: -5.5e-002 | AD166: -5.91e-002 | AE166: 96.87 | AF166: 94.9 | AG166: 0 | AH166: AA- | AI166: 6.3200000000000006e-002 | AJ166: =H166+100*O166 -> 246.57999999999998 | AK166: 168.7 | AL166: 309 | AM166: 71.8 | AN166: 306 | AO166: -1.6e-002 | AP166: 35 | AQ166: 嘉澳转债!
A167: 88 | B167: 110074 | C167: 精达转债! | D167: 600577 | E167: 精达股份 | F167: 电子 | G167: 电子产品 | H167: 107.35 | I167: 3.3e-003 | J167: -4.7999999999999996e-003 | K167: 3.62 | L167: -2.8000000000000004e-003 | M167: 117.3 | N167: 3.75 | O167: 0.11199999999999999 | P167: 96.53 | Q167: 转股中 | R167: 5.42年 | S167: 3.42年 | T167: 7.87 | U167: 14 | V167: 1.7000000000000001e-002 | W167: 0.113 | X167: 0.109 | Y167: 70 | Z167: 1.89 | AA167: 1.6799999999999999e-002 | AB167: 1.11e-002 | AC167: -9.3999999999999986e-003 | AD167: -1.1399999999999999e-002 | AE167: 88.76 | AF167: 92.81 | AG167: 0.55 | AH167: AA | AI167: 4.5100000000000001e-002 | AJ167: =H167+100*O167 -> 118.55 | AK167: 118.2 | AL167: 74 | AM167: 25.4 | AN167: 61 | AO167: 1.6e-002 | AP167: 12 | AQ167: 精达转债!
A168: 322 | B168: 110038 | C168: 济川转债! | D168: 600566 | E168: 济川药业 | F168: 医药 | G168: 中药 | H168: 104.62 | I168: -4.0000000000000002e-004 | J168: -1.4000000000000002e-003 | K168: 20.56 | L168: -8.199999999999999e-003 | M168: 107.5 | N168: 23.85 | O168: 0.214 | P168: 86.21 | Q168: 转股中 | R168: 1.66年 | S168: 回售内 | T168: 6.28 | U168: 2.1 | V168: 3.0000000000000001e-003 | W168: 3.4000000000000002e-002 | X168: 2.9999999999999999e-002 | Y168: 183 | Z168: 2.49 | AA168: 1.67e-002 | AB168: 8.0000000000000002e-003 | AC168: 回售内 | AD168: 回售内 | AE168: 100.25 | AF168: 100.45 | AG168: 0.22 | AH168: AA | AI168: 4.2199999999999994e-002 | AJ168: =H168+100*O168 -> 126.02000000000001 | AK168: 123 | AL168: 123 | AM168: 22.6 | AN168: 36 | AO168: 1.e-002 | AP168: 23 | AQ168: 济川转债!
A169: 166 | B169: 123045 | C169: 雷迪转债 | D169: 300652 | E169: 雷迪克 | F169: 汽车 | G169: 零部件制 | H169: 109.79 | I169: -9.1000000000000004e-003 | J169: -1.e-004 | K169: 19.39 | L169: -1.4199999999999999e-002 | M169: 118.9 | N169: 20.13 | O169: 0.14000000000000001 | P169: 96.32 | Q169: 转股中 | R169: 4.98年 | S169: 2.98年 | T169: 1.66 | U169: 43 | V169: 0.23499999999999999 | W169: 9.0999999999999998e-002 | X169: 8.8000000000000009e-002 | Y169: 18 | Z169: 2.14 | AA169: 1.6500000000000001e-002 | AB169: 9.7000000000000003e-003 | AC169: -1.7000000000000001e-002 | AD169: -1.9400000000000001e-002 | AE169: 82.95 | AF169: 83.42 | AG169: 0.64 | AH169: A+ | AI169: 7.5499999999999998e-002 | AJ169: =H169+100*O169 -> 123.79000000000001 | AK169: 123.3 | AL169: 125 | AM169: 39.8 | AN169: 203 | AO169: 4.9000000000000002e-002 | AP169: 34 | AQ169: 雷迪转债
A170: 188 | B170: 113561 | C170: 正裕转债! | D170: 603089 | E170: 正裕工业 | F170: 汽车 | G170: 零部件制 | H170: 109.61 | I170: -2.e-002 | J170: 1.1999999999999999e-003 | K170: 10.99 | L170: -2.6600000000000002e-002 | M170: 118 | N170: 10.23 | O170: 2.e-002 | P170: 107.43 | Q170: 转股中 | R170: 4.78年 | S170: 2.79年 | T170: 1.5 | U170: 16 | V170: 9.6000000000000002e-002 | W170: 6.0999999999999999e-002 | X170: 6.6000000000000003e-002 | Y170: 24 | Z170: 2.63 | AA170: 1.5900000000000001e-002 | AB170: 9.1000000000000004e-003 | AC170: -1.7299999999999999e-002 | AD170: -1.9900000000000001e-002 | AE170: 84.23 | AF170: 84 | AG170: 0.71 | AH170: A+ | AI170: 7.5499999999999998e-002 | AJ170: =H170+100*O170 -> 111.61 | AK170: 111.8 | AL170: 25 | AM170: 27.6 | AN170: 89 | AO170: 0.13300000000000001 | AP170: 33 | AQ170: 正裕转债!
A171: 59 | B171: 123073 | C171: 同和转债! | D171: 300636 | E171: 同和药业 | F171: 医药 | G171: 原料药 | H171: 112.37 | I171: 1.6500000000000001e-002 | J171: 9.7000000000000003e-003 | K171: 26.03 | L171: 3.5400000000000001e-002 | M171: 122.4 | N171: 23.8 | O171: 2.7000000000000003e-002 | P171: 109.37 | Q171: 45天 | R171: 5.60年 | S171: 3.61年 | T171: 3.6 | U171: 78 | V171: 0.18899999999999997 | W171: 0.10800000000000001 | X171: 0.11800000000000001 | Y171: 33 | Z171: 4.43 | AA171: 1.5700000000000002e-002 | AB171: 8.8000000000000005e-003 | AC171: -1.9099999999999999e-002 | AD171: -2.1400000000000002e-002 | AE171: 79.3 | AF171: 81.53 | AG171: 0.74 | AH171: A+ | AI171: 7.7100000000000002e-002 | AJ171: =H171+100*O171 -> 115.07000000000001 | AK171: 115.4 | AL171: 42 | AM171: 33.8 | AN171: 150 | AO171: 4.9000000000000002e-002 | AP171: 10 | AQ171: 同和转债!
A172: 109 | B172: 113594 | C172: 淳中转债! | D172: 603516 | E172: 淳中科技 | F172: 电子 | G172: 电子产品 | H172: 112 | I172: 5.7999999999999996e-003 | J172: -2.06e-002 | K172: 35.75 | L172: -2.3799999999999998e-002 | M172: 121.4 | N172: 39.37 | O172: 0.23300000000000001 | P172: 90.81 | Q172: 转股中 | R172: 5.34年 | S172: 3.34年 | T172: 3 | U172: 4.8 | V172: 1.3999999999999999e-002 | W172: 6.3e-002 | X172: 5.7000000000000002e-002 | Y172: 48 | Z172: 5.01 | AA172: 1.5600000000000001e-002 | AB172: 8.6e-003 | AC172: -1.9599999999999999e-002 | AD172: -2.2000000000000002e-002 | AE172: 80.88 | AF172: 82.48 | AG172: 0.62 | AH172: A+ | AI172: 7.7100000000000002e-002 | AJ172: =H172+100*O172 -> 135.30000000000001 | AK172: 133.2 | AL172: 224 | AM172: 50.7 | AN172: 269 | AO172: 2.6000000000000002e-002 | AP172: 9 | AQ172: 淳中转债!
A173: 245 | B173: 113024 | C173: 核建转债! | D173: 601611 | E173: 中国核建 | F173: 建筑 | G173: 建筑工程 | H173: 103.67 | I173: 1.2999999999999999e-003 | J173: -2.5000000000000001e-003 | K173: 7.77 | L173: -3.8e-003 | M173: 109.7 | N173: 9.76 | O173: 0.30199999999999999 | P173: 79.61 | Q173: 转股中 | R173: 4年19天 | S173: 2年20天 | T173: 30 | U173: 8.8 | V173: 3.0000000000000001e-003 | W173: 0.14599999999999999 | X173: 0.11599999999999999 | Y173: 206 | Z173: 1.91 | AA173: 1.44e-002 | AB173: 9.7999999999999997e-003 | AC173: -2.0999999999999999e-003 | AD173: -4.8999999999999998e-003 | AE173: 94.97 | AF173: 94.44 | AG173: 0.32 | AH173: AAA | AI173: 3.85e-002 | AJ173: =H173+100*O173 -> 133.87 | AK173: 127.7 | AL173: 175 | AM173: 32.8 | AN173: 142 | AO173: 3.2000000000000001e-002 | AP173: 41 | AQ173: 核建转债!
A174: 155 | B174: 128105 | C174: 长集转债 | D174: 2616 | E174: 长青集团 | F174: 城市公用 | G174: 三废处理 | H174: 107.598 | I174: 5.6000000000000008e-003 | J174: -6.9999999999999993e-003 | K174: 7.87 | L174: -2.5000000000000001e-003 | M174: 115.3 | N174: 8.11 | O174: 0.109 | P174: 97.04 | Q174: 转股中 | R174: 5年20天 | S174: 3年21天 | T174: 8 | U174: 1.6 | V174: 2.e-003 | W174: 0.13699999999999998 | X174: 0.13300000000000001 | Y174: 58 | Z174: 2.32 | AA174: 1.41e-002 | AB174: 8.5000000000000006e-003 | AC174: -1.1200000000000002e-002 | AD174: -1.34e-002 | AE174: 90.19 | AF174: 92.7 | AG174: 0.56 | AH174: AA | AI174: 4.5100000000000001e-002 | AJ174: =H174+100*O174 -> 118.498 | AK174: 118.2 | AL174: 73 | AM174: 25.5 | AN174: 62 | AO174: 4.2999999999999997e-002 | AP174: 14 | AQ174: 长集转债
A175: 65 | B175: 123070 | C175: 鹏辉转债 | D175: 300438 | E175: 鹏辉能源 | F175: 汽车 | G175: 零部件制 | H175: 106.565 | I175: 1.6000000000000001e-003 | J175: -7.3000000000000001e-003 | K175: 15.9 | L175: -1.49e-002 | M175: 115.1 | N175: 20.16 | O175: 0.35100000000000003 | P175: 78.87 | Q175: 38天 | R175: 5.59年 | S175: 3.59年 | T175: 8.9 | U175: 8.4 | V175: 9.0000000000000011e-003 | W175: 0.13300000000000001 | X175: 0.105 | Y175: 67 | Z175: 2.7 | AA175: 1.41e-002 | AB175: 9.1999999999999998e-003 | AC175: -7.4999999999999997e-003 | AD175: -9.3999999999999986e-003 | AE175: 87.91 | AF175: 90.37 | AG175: 0.39 | AH175: AA | AI175: 4.5100000000000001e-002 | AJ175: =H175+100*O175 -> 141.66499999999999 | AK175: 134.3 | AL175: 228 | AM175: 43.9 | AN175: 237 | AO175: -8.3000000000000004e-002 | AP175: 4 | AQ175: 鹏辉转债
A176: 58 | B176: 123074 | C176: 隆利转债 | D176: 300752 | E176: 隆利科技 | F176: 电子 | G176: 液晶显示 | H176: 114.8 | I176: -1.46e-002 | J176: -1.0700000000000001e-002 | K176: 31.81 | L176: -3.6900000000000002e-002 | M176: 124 | N176: 29.41 | O176: 6.0999999999999999e-002 | P176: 108.16 | Q176: 46天 | R176: 5.61年 | S176: 3.61年 | T176: 3.25 | U176: 56 | V176: 0.14999999999999999 | W176: 8.5000000000000006e-002 | X176: 9.1999999999999998e-002 | Y176: 38 | Z176: 4.4 | AA176: 1.41e-002 | AB176: 6.8000000000000005e-003 | AC176: -2.6200000000000001e-002 | AD176: -2.81e-002 | AE176: 81.79 | AF176: 87.2 | AG176: 0.68 | AH176: AA- | AI176: 6.6100000000000006e-002 | AJ176: =H176+100*O176 -> 120.89999999999999 | AK176: 121.4 | AL176: 105 | AM176: 34.2 | AN176: 156 | AO176: -7.9000000000000001e-002 | AP176: 13 | AQ176: 隆利转债
A177: 42 | B177: 123078 | C177: 飞凯转债! | D177: 300398 | E177: 飞凯材料 | F177: 化工 | G177: 化工 | H177: 106.612 | I177: 1.8000000000000002e-002 | J177: -1.8000000000000002e-002 | K177: 15.6 | L177: 0. | M177: 115.2 | N177: 19.34 | O177: 0.32200000000000001 | P177: 80.66 | Q177: 2月16天 | R177: 5.69年 | S177: 3.69年 | T177: 8.2 | U177: 12 | V177: 1.3999999999999999e-002 | W177: 0.10199999999999999 | X177: 8.199999999999999e-002 | Y177: 80 | Z177: 3.05 | AA177: 1.3999999999999999e-002 | AB177: 9.1000000000000004e-003 | AC177: -7.1999999999999998e-003 | AD177: -9.0000000000000011e-003 | AE177: 87.6 | AF177: 90.04 | AG177: 0.42 | AH177: AA | AI177: 4.5100000000000001e-002 | AJ177: =H177+100*O177 -> 138.81200000000001 | AK177: 132.6 | AL177: 219 | AM177: 42.5 | AN177: 220 | AO177: 2.6000000000000002e-002 | AP177: 8 | AQ177: 飞凯转债!
A178: 295 | B178: 128040 | C178: 华通转债! | D178: 2758 | E178: 浙农股份 | F178: 医药 | G178: 医药商业 | H178: 107.5 | I178: 2.8000000000000004e-003 | J178: 7.000000000000001e-004 | K178: 10.4 | L178: 5.7999999999999996e-003 | M178: 112.3 | N178: 10.33 | O178: 6.8000000000000005e-002 | P178: 100.68 | Q178: 转股中 | R178: 3.24年 | S178: 1.24年 | T178: 2.22 | U178: 3.6 | V178: 1.4999999999999999e-002 | W178: 4.4000000000000004e-002 | X178: 4.4000000000000004e-002 | Y178: 51 | Z178: 3.44 | AA178: 1.3899999999999999e-002 | AB178: 6.8000000000000005e-003 | AC178: -3.1600000000000003e-002 | AD178: -3.5299999999999998e-002 | AE178: 94.24 | AF178: 92.15 | AG178: 0.6 | AH178: AA- | AI178: 6.4500000000000002e-002 | AJ178: =H178+100*O178 -> 114.3 | AK178: 114.3 | AL178: 36 | AM178: 20.1 | AN178: 23 | AO178: -1.8000000000000002e-002 | AP178: 30 | AQ178: 华通转债!
A179: 227 | B179: 128071 | C179: 合兴转债! | D179: 2228 | E179: 合兴包装 | F179: 造纸包装 | G179: 包装材料 | H179: 108.16 | I179: 9.8999999999999991e-003 | J179: -9.8999999999999991e-003 | K179: 4 | L179: 0. | M179: 114.8 | N179: 4.28 | O179: 0.157 | P179: 93.46 | Q179: 转股中 | R179: 4.41年 | S179: 2.41年 | T179: 3 | U179: 4.8 | V179: 1.4999999999999999e-002 | W179: 6.0999999999999999e-002 | X179: 5.7000000000000002e-002 | Y179: 50 | Z179: 1.48 | AA179: 1.3899999999999999e-002 | AB179: 7.7000000000000002e-003 | AC179: -1.78e-002 | AD179: -2.0299999999999999e-002 | AE179: 92.66 | AF179: 95.51 | AG179: 0.5 | AH179: AA | AI179: 4.3499999999999997e-002 | AJ179: =H179+100*O179 -> 123.86 | AK179: 122.9 | AL179: 119 | AM179: 27.4 | AN179: 86 | AO179: 1.7000000000000001e-002 | AP179: 25 | AQ179: 合兴转债!
A180: 11 | B180: 113618 | C180: 美诺转债! | D180: 603538 | E180: 美诺华 | F180: 医药 | G180: 原料药 | H180: 106.61 | I180: 4.1999999999999997e-003 | J180: 4.8999999999999998e-003 | K180: 31.38 | L180: 1.5900000000000001e-002 | M180: 115.3 | N180: 37.47 | O180: 0.27300000000000002 | P180: 83.75 | Q180: 4月3天 | R180: 5.82年 | S180: 3.82年 | T180: 5.2 | U180: 7.7 | V180: 1.3999999999999999e-002 | W180: 0.111 | X180: 9.3000000000000013e-002 | Y180: 47 | Z180: 3.09 | AA180: 1.38e-002 | AB180: 9.0000000000000011e-003 | AC180: -6.7000000000000002e-003 | AD180: -8.5000000000000006e-003 | AE180: 80.6 | AF180: 80.01 | AG180: 0.58 | AH180: AA- | AI180: 6.6100000000000006e-002 | AJ180: =H180+100*O180 -> 133.91 | AK180: 129.5 | AL180: 192 | AM180: 48.9 | AN180: 262 | AO180: -1.2e-002 | AP180: 4 | AQ180: 美诺转债!
A181: 82 | B181: 128129 | C181: 青农转债! | D181: 2958 | E181: 青农商行 | F181: 金融 | G181: 银行行业 | H181: 104.497 | I181: -2.3e-003 | J181: -2.7000000000000001e-003 | K181: 4.48 | L181: -1.32e-002 | M181: 112.2 | N181: 5.74 | O181: 0.33899999999999997 | P181: 78.05 | Q181: 转股中 | R181: 5.43年 | S181: 无权 | T181: 50 | U181: 12 | V181: 2.e-003 | W181: 0.20100000000000001 | X181: 0.157 | Y181: 249 | Z181: 0.97 | AA181: 1.34e-002 | AB181: 9.1999999999999998e-003 | AC181: 无权 | AD181: 无权 | AE181: 无权 | AF181: 90.91 | AG181: 0.38 | AH181: AAA | AI181: 4.0099999999999997e-002 | AJ181: =H181+100*O181 -> 138.39699999999999 | AK181: 130.9 | AL181: 202 | AM181: 40 | AN181: 204 | AO181: -2.6000000000000002e-002 | AP181: 14 | AQ181: 青农转债!
A182: 259 | B182: 110053 | C182: 苏银转债! | D182: 600919 | E182: 江苏银行 | F182: 金融 | G182: 银行行业 | H182: 112.41 | I182: -4.5000000000000005e-003 | J182: -7.3000000000000001e-003 | K182: 6.37 | L182: -2.6000000000000002e-002 | M182: 118.3 | N182: 6.69 | O182: 0.18100000000000002 | P182: 95.22 | Q182: 转股中 | R182: 3.98年 | S182: 无权 | T182: 200 | U182: 172 | V182: 8.0000000000000002e-003 | W182: 0.21299999999999999 | X182: 0.20199999999999999 | Y182: 941 | Z182: 0.62 | AA182: 1.3300000000000001e-002 | AB182: 5.1000000000000004e-003 | AC182: 无权 | AD182: 无权 | AE182: 无权 | AF182: 102.19 | AG182: 0.45 | AH182: AAA | AI182: 3.85e-002 | AJ182: =H182+100*O182 -> 130.50999999999999 | AK182: 129.6 | AL182: 193 | AM182: 27.4 | AN182: 87 | AO182: 4.8000000000000001e-002 | AP182: 43 | AQ182: 苏银转债!
A183: 311 | B183: 110041 | C183: 蒙电转债! | D183: 600863 | E183: 内蒙华电 | F183: 能源电力 | G183: 电力供应 | H183: 105.59 | I183: -7.000000000000001e-004 | J183: 9.1000000000000004e-003 | K183: 2.49 | L183: 2.0499999999999997e-002 | M183: 109.3 | N183: 2.69 | O183: 0.14099999999999999 | P183: 92.57 | Q183: 转股中 | R183: 2.76年 | S183: 0.76年 | T183: 18.7 | U183: 18 | V183: 9.0000000000000011e-003 | W183: 0.129 | X183: 0.12 | Y183: 145 | Z183: 1.22 | AA183: 1.2800000000000001e-002 | AB183: 6.4000000000000003e-003 | AC183: -3.8699999999999998e-002 | AD183: -4.24e-002 | AE183: 98.42 | AF183: 98.98 | AG183: 0.41 | AH183: AAA | AI183: 3.7200000000000004e-002 | AJ183: =H183+100*O183 -> 119.69 | AK183: 118.6 | AL183: 77 | AM183: 19.6 | AN183: 22 | AO183: 4.2999999999999997e-002 | AP183: 10 | AQ183: 蒙电转债!
A184: 190 | B184: 128090 | C184: 汽模转2 | D184: 2510 | E184: 天汽模 | F184: 汽车 | G184: 零部件制 | H184: 108.6 | I184: -1.7000000000000001e-003 | J184: 1.7000000000000001e-003 | K184: 4.2 | L184: 0. | M184: 114.9 | N184: 4.21 | O184: 8.900000000000001e-002 | P184: 99.76 | Q184: 转股中 | R184: 4.77年 | S184: 2.78年 | T184: 3.1 | U184: 18 | V184: 5.2000000000000005e-002 | W184: 7.8e-002 | X184: 7.6999999999999999e-002 | Y184: 40 | Z184: 1.45 | AA184: 1.21e-002 | AB184: 6.4000000000000003e-003 | AC184: -1.67e-002 | AD184: -1.89e-002 | AE184: 91.33 | AF184: 94.13 | AG184: 0.57 | AH184: AA | AI184: 4.3499999999999997e-002 | AJ184: =H184+100*O184 -> 117.5 | AK184: 117.4 | AL184: 64 | AM184: 23.3 | AN184: 43 | AO184: -1.7000000000000001e-002 | AP184: 27 | AQ184: 汽模转2
A185: 84 | B185: 113039 | C185: 嘉泽转债! | D185: 601619 | E185: 嘉泽新能 | F185: 能源电力 | G185: 风能 | H185: 106.15 | I185: 2.1099999999999997e-002 | J185: 2.4300000000000002e-002 | K185: 3.79 | L185: 6.7599999999999993e-002 | M185: 113.1 | N185: 3.57 | O185: 0. | P185: 106.16 | Q185: 转股中 | R185: 5.43年 | S185: 3.43年 | T185: 13 | U185: 625 | V185: 0.442 | W185: 0.16500000000000001 | X185: 0.17499999999999999 | Y185: 79 | Z185: 2.29 | AA185: 1.2e-002 | AB185: 7.4999999999999997e-003 | AC185: -6.8000000000000005e-003 | AD185: -8.6999999999999994e-003 | AE185: 88.52 | AF185: 89.42 | AG185: 0.67 | AH185: AA | AI185: 4.5100000000000001e-002 | AJ185: =H185+100*O185 -> 106.15000000000001 | AK185: 106.1 | AL185: 9 | AM185: 16.7 | AN185: 13 | AO185: 9.4e-002 | AP185: 24 | AQ185: 嘉泽转债!
A186: 296 | B186: 128039 | C186: 三力转债! | D186: 2224 | E186: 三 力 士 | F186: 机械装备 | G186: 专用设备 | H186: 105.8 | I186: 1.9e-003 | J186: 1.1999999999999999e-003 | K186: 5.51 | L186: 5.5000000000000005e-003 | M186: 109.8 | N186: 5.81 | O186: 0.11599999999999999 | P186: 94.84 | Q186: 转股中 | R186: 3.22年 | S186: 1.22年 | T186: 2.03 | U186: 3.8 | V186: 1.8000000000000002e-002 | W186: 5.0000000000000003e-002 | X186: 4.8000000000000001e-002 | Y186: 40 | Z186: 1.72 | AA186: 1.18e-002 | AB186: 6.0000000000000001e-003 | AC186: -2.2400000000000003e-002 | AD186: -2.5899999999999999e-002 | AE186: 94.11 | AF186: 90.16 | AG186: 0.56 | AH186: AA- | AI186: 6.4500000000000002e-002 | AJ186: =H186+100*O186 -> 117.39999999999999 | AK186: 116.8 | AL186: 52 | AM186: 22.7 | AN186: 37 | AO186: -1.e-002 | AP186: 26 | AQ186: 三力转债!
A187: 250 | B187: 110057 | C187: 现代转债 | D187: 600420 | E187: 现代制药 | F187: 医药 | G187: 化学制药 | H187: 105.94 | I187: 1.5e-003 | J187: 6.8000000000000005e-003 | K187: 9.31 | L187: 1.6399999999999998e-002 | M187: 110.8 | N187: 9.89 | O187: 0.125 | P187: 94.14 | Q187: 转股中 | R187: 4年12天 | S187: 2年13天 | T187: 16.2 | U187: 12 | V187: 6.9999999999999993e-003 | W187: 0.16899999999999998 | X187: 0.159 | Y187: 96 | Z187: 1.22 | AA187: 1.1399999999999999e-002 | AB187: 6.4000000000000003e-003 | AC187: -1.15e-002 | AD187: -1.44e-002 | AE187: 95.14 | AF187: 95.47 | AG187: 0.51 | AH187: AAA | AI187: 3.85e-002 | AJ187: =H187+100*O187 -> 118.44 | AK187: 117.7 | AL187: 67 | AM187: 22.3 | AN187: 33 | AO187: 4.4999999999999998e-002 | AP187: 24 | AQ187: 现代转债
A188: 192 | B188: 123038 | C188: 联得转债! | D188: 300545 | E188: 联得装备 | F188: 机械装备 | G188: 专用设备 | H188: 112.598 | I188: -1.06e-002 | J188: 1.2500000000000001e-002 | K188: 22.83 | L188: 3.0999999999999999e-003 | M188: 118.6 | N188: 25.29 | O188: 0.247 | P188: 90.27 | Q188: 转股中 | R188: 4.77年 | S188: 2.77年 | T188: 1.47 | U188: 29 | V188: 0.17699999999999999 | W188: 4.4000000000000004e-002 | X188: 4.0000000000000001e-002 | Y188: 33 | Z188: 4.35 | AA188: 1.1200000000000002e-002 | AB188: 4.3e-003 | AC188: -2.7400000000000001e-002 | AD188: -2.9900000000000003e-002 | AE188: 84.06 | AF188: 84.47 | AG188: 0.6 | AH188: A+ | AI188: 7.5499999999999998e-002 | AJ188: =H188+100*O188 -> 137.298 | AK188: 134.9 | AL188: 236 | AM188: 50.5 | AN188: 266 | AO188: 1.3000000000000001e-002 | AP188: 19 | AQ188: 联得转债!
A189: 3 | B189: 123099 | C189: 普利转债 | D189: 300630 | E189: 普利制药 | F189: 医药 | G189: 化学制药 | H189: 115.9 | I189: -9.3999999999999986e-003 | J189: 1.e-003 | K189: 43.19 | L189: -1.3899999999999999e-002 | M189: 123.5 | N189: 46.22 | O189: 0.23999999999999999 | P189: 93.44 | Q189: 5月7天 | R189: 5.89年 | S189: 3.90年 | T189: 8.5 | U189: 11 | V189: 1.1000000000000001e-002 | W189: 4.4999999999999998e-002 | X189: 4.2000000000000003e-002 | Y189: 189 | Z189: 9.64 | AA189: 1.1000000000000001e-002 | AB189: 4.3e-003 | AC189: -2.69e-002 | AD189: -2.87e-002 | AE189: 80.26 | AF189: 85.28 | AG189: 0.61 | AH189: AA- | AI189: 6.6100000000000006e-002 | AJ189: =H189+100*O189 -> 139.90000000000001 | AK189: 138.4 | AL189: 255 | AM189: 53.1 | AN189: 275 | AO189: -5.5999999999999994e-002 | AP189: 3 | AQ189: 普利转债
A190: 45 | B190: 110077 | C190: 洪城转债 | D190: 600461 | E190: 洪城水业 | F190: 城市公用 | G190: 城市公用 | H190: 106.84 | I190: 8.0000000000000004e-004 | J190: 1.0200000000000001e-002 | K190: 6.63 | L190: 2.e-002 | M190: 113.5 | N190: 7.13 | O190: 0.14899999999999999 | P190: 92.99 | Q190: 2月8天 | R190: 5.67年 | S190: 3.67年 | T190: 18 | U190: 9 | V190: 5.0000000000000001e-003 | W190: 0.28600000000000003 | X190: 0.26600000000000001 | Y190: 63 | Z190: 1.25 | AA190: 1.0800000000000001e-002 | AB190: 6.5000000000000006e-003 | AC190: -1.1399999999999999e-002 | AD190: -1.2500000000000001e-002 | AE190: 87.03 | AF190: 89.6 | AG190: 0.55 | AH190: AA+ | AI190: 4.3099999999999999e-002 | AJ190: =H190+100*O190 -> 121.74000000000001 | AK190: 120.7 | AL190: 94 | AM190: 31.1 | AN190: 127 | AO190: 5.7000000000000002e-002 | AP190: 6 | AQ190: 洪城转债
A191: 183 | B191: 113563 | C191: 柳药转债 | D191: 603368 | E191: 柳药股份 | F191: 医药 | G191: 医药商业 | H191: 107.54 | I191: 0. | J191: -6.1999999999999998e-003 | K191: 21.38 | L191: -1.34e-002 | M191: 112.9 | N191: 24.47 | O191: 0.23100000000000001 | P191: 87.37 | Q191: 转股中 | R191: 4.83年 | S191: 2.83年 | T191: 8.02 | U191: 0.7 | V191: 1.e-003 | W191: 0.10300000000000001 | X191: 8.9999999999999997e-002 | Y191: 78 | Z191: 1.61 | AA191: 1.03e-002 | AB191: 5.4000000000000003e-003 | AC191: -1.3100000000000001e-002 | AD191: -1.5300000000000001e-002 | AE191: 91.12 | AF191: 92.29 | AG191: 0.46 | AH191: AA | AI191: 4.3499999999999997e-002 | AJ191: =H191+100*O191 -> 130.64000000000001 | AK191: 127.7 | AL191: 174 | AM191: 35.4 | AN191: 170 | AO191: -8.0000000000000002e-003 | AP191: 18 | AQ191: 柳药转债
A192: 189 | B192: 128091 | C192: 新天转债 | D192: 2873 | E192: 新天药业 | F192: 医药 | G192: 中药 | H192: 113.91 | I192: -5.1000000000000004e-003 | J192: 9.7000000000000003e-003 | K192: 16.16 | L192: 6.8999999999999999e-003 | M192: 119.4 | N192: 16.39 | O192: 0.155 | P192: 98.6 | Q192: 转股中 | R192: 4.78年 | S192: 2.78年 | T192: 1.76 | U192: 58 | V192: 0.28800000000000003 | W192: 9.3000000000000013e-002 | X192: 9.1999999999999998e-002 | Y192: 19 | Z192: 2.51 | AA192: 1.01e-002 | AB192: 3.0000000000000001e-003 | AC192: -2.92e-002 | AD192: -3.2000000000000001e-002 | AE192: 84.52 | AF192: 85.06 | AG192: 0.66 | AH192: A+ | AI192: 7.5499999999999998e-002 | AJ192: =H192+100*O192 -> 129.41 | AK192: 129.2 | AL192: 189 | AM192: 44.2 | AN192: 239 | AO192: 1.9e-002 | AP192: 18 | AQ192: 新天转债
A193: 137 | B193: 128109 | C193: 楚江转债 | D193: 2171 | E193: 楚江新材 | F193: 有色金属 | G193: 铜金属 | H193: 109.588 | I193: 5.1000000000000004e-003 | J193: -6.9999999999999993e-003 | K193: 7.64 | L193: -3.9000000000000003e-003 | M193: 115.3 | N193: 8.73 | O193: 0.252 | P193: 87.51 | Q193: 转股中 | R193: 5.21年 | S193: 3.21年 | T193: 18.3 | U193: 4.4 | V193: 2.e-003 | W193: 0.17999999999999999 | X193: 0.157 | Y193: 102 | Z193: 1.85 | AA193: 1.e-002 | AB193: 4.6999999999999993e-003 | AC193: -1.61e-002 | AD193: -1.8200000000000001e-002 | AE193: 89.58 | AF193: 92.08 | AG193: 0.47 | AH193: AA | AI193: 4.5100000000000001e-002 | AJ193: =H193+100*O193 -> 134.78799999999998 | AK193: 131.7 | AL193: 211 | AM193: 39.6 | AN193: 200 | AO193: -3.1e-002 | AP193: 6 | AQ193: 楚江转债
A194: 212 | B194: 110060 | C194: 天路转债! | D194: 600326 | E194: 西藏天路 | F194: 建筑 | G194: 水泥 | H194: 110.04 | I194: 2.0999999999999999e-003 | J194: 1.1000000000000001e-003 | K194: 7.19 | L194: 5.6000000000000008e-003 | M194: 114.9 | N194: 7.16 | O194: 9.6000000000000002e-002 | P194: 100.42 | Q194: 转股中 | R194: 4.61年 | S194: 2.61年 | T194: 7.06 | U194: 1.6 | V194: 2.e-003 | W194: 0.107 | X194: 0.107 | Y194: 66 | Z194: 1.77 | AA194: 9.5999999999999992e-003 | AB194: 3.7000000000000002e-003 | AC194: -2.2400000000000003e-002 | AD194: -2.4700000000000003e-002 | AE194: 91.97 | AF194: 94.79 | AG194: 0.58 | AH194: AA | AI194: 4.3499999999999997e-002 | AJ194: =H194+100*O194 -> 119.64 | AK194: 119.7 | AL194: 86 | AM194: 24.9 | AN194: 56 | AO194: 3.0000000000000001e-003 | AP194: 13 | AQ194: 天路转债!
A195: 103 | B195: 110073 | C195: 国投转债 | D195: 600061 | E195: 国投资本 | F195: 金融 | G195: 证券行业 | H195: 105.06 | I195: -2.3999999999999998e-003 | J195: -2.2000000000000001e-003 | K195: 12.04 | L195: -1.15e-002 | M195: 110.5 | N195: 15.25 | O195: 0.33100000000000002 | P195: 78.95 | Q195: 转股中 | R195: 5.35年 | S195: 无权 | T195: 80 | U195: 32 | V195: 4.0000000000000001e-003 | W195: 0.157 | X195: 0.124 | Y195: 509 | Z195: 1.22 | AA195: 9.5999999999999992e-003 | AB195: 5.8999999999999999e-003 | AC195: 无权 | AD195: 无权 | AE195: 无权 | AF195: 89.8 | AG195: 0.39 | AH195: AAA | AI195: 4.0099999999999997e-002 | AJ195: =H195+100*O195 -> 138.16 | AK195: 131.2 | AL195: 207 | AM195: 41.4 | AN195: 215 | AO195: -2.5000000000000001e-002 | AP195: 22 | AQ195: 国投转债
A196: 184 | B196: 128094 | C196: 星帅转债 | D196: 2860 | E196: 星帅尔 | F196: 家电 | G196: 零部件制 | H196: 115.7 | I196: 2.12e-002 | J196: -1.47e-002 | K196: 15.93 | L196: 8.8999999999999999e-003 | M196: 121 | N196: 13.95 | O196: 1.3000000000000001e-002 | P196: 114.19 | Q196: 转股中 | R196: 4.83年 | S196: 2.83年 | T196: 2.72 | U196: 14 | V196: 4.5999999999999999e-002 | W196: 8.5999999999999993e-002 | X196: 9.8000000000000004e-002 | Y196: 32 | Z196: 3.4 | AA196: 9.4999999999999998e-003 | AB196: 2.e-003 | AC196: -3.5000000000000003e-002 | AD196: -3.7499999999999999e-002 | AE196: 83.88 | AF196: 85.83 | AG196: 0.73 | AH196: A+ | AI196: 7.5499999999999998e-002 | AJ196: =H196+100*O196 -> 117. | AK196: 117.2 | AL196: 57 | AM196: 31.4 | AN196: 133 | AO196: -1.1000000000000001e-002 | AP196: 31 | AQ196: 星帅转债
A197: 246 | B197: 128064 | C197: 司尔转债! | D197: 2538 | E197: 司尔特 | F197: 化工 | G197: 农化 | H197: 110.759 | I197: 6.8000000000000005e-003 | J197: -1.9799999999999998e-002 | K197: 5.94 | L197: -2.46e-002 | M197: 114.9 | N197: 6.07 | O197: 0.13200000000000001 | P197: 97.86 | Q197: 转股中 | R197: 4年19天 | S197: 2年20天 | T197: 8 | U197: 16 | V197: 1.8000000000000002e-002 | W197: 0.188 | X197: 0.184 | Y197: 43 | Z197: 1.11 | AA197: 9.300000000000001e-003 | AB197: 2.5999999999999999e-003 | AC197: -3.0800000000000001e-002 | AD197: -3.3700000000000001e-002 | AE197: 94.18 | AF197: 97.07 | AG197: 0.53 | AH197: AA | AI197: 4.3499999999999997e-002 | AJ197: =H197+100*O197 -> 123.959 | AK197: 123.7 | AL197: 129 | AM197: 26.6 | AN197: 73 | AO197: -2.1000000000000001e-002 | AP197: 50 | AQ197: 司尔转债!
A198: 1 | B198: 118000 | C198: 嘉元转债 | D198: 688388 | E198: 嘉元科技 | F198: 电子 | G198: 电子产品 | H198: 114.9 | I198: 3.4999999999999996e-003 | J198: -2.3599999999999999e-002 | K198: 73.1 | L198: -3.2199999999999999e-002 | M198: 121 | N198: 78.99 | O198: 0.24199999999999999 | P198: 92.54 | Q198: 5月16天 | R198: 5.93年 | S198: 3.93年 | T198: 12.4 | U198: 56 | V198: 3.9e-002 | W198: 7.2999999999999995e-002 | X198: 6.8000000000000005e-002 | Y198: 169 | Z198: 6.64 | AA198: 8.8999999999999999e-003 | AB198: 2.8000000000000004e-003 | AC198: -2.4399999999999998e-002 | AD198: -2.6200000000000001e-002 | AE198: 80.13 | AF198: 83.38 | AG198: 0.62 | AH198: AA- | AI198: 6.6100000000000006e-002 | AJ198: =H198+100*O198 -> 139.09999999999999 | AK198: 137.3 | AL198: 248 | AM198: 53.9 | AN198: 279 | AO198: -1.3000000000000001e-002 | AP198: 2 | AQ198: 嘉元转债
A199: 217 | B199: 128078 | C199: 太极转债! | D199: 2368 | E199: 太极股份 | F199: 计算机及 | G199: 软件开发 | H199: 112.539 | I199: 1.3899999999999999e-002 | J199: -1.49e-002 | K199: 20.35 | L199: -2.e-003 | M199: 116.9 | N199: 22.4 | O199: 0.23899999999999999 | P199: 90.85 | Q199: 转股中 | R199: 4.59年 | S199: 2.59年 | T199: 9.6 | U199: 6.7 | V199: 6.0000000000000001e-003 | W199: 8.1000000000000003e-002 | X199: 7.400000000000001e-002 | Y199: 118 | Z199: 3.84 | AA199: 8.5000000000000006e-003 | AB199: 1.9e-003 | AC199: -3.0499999999999999e-002 | AD199: -3.2799999999999996e-002 | AE199: 92.05 | AF199: 96.52 | AG199: 0.53 | AH199: AA | AI199: 4.3499999999999997e-002 | AJ199: =H199+100*O199 -> 136.43899999999999 | AK199: 134.2 | AL199: 227 | AM199: 37.7 | AN199: 184 | AO199: -6.4000000000000001e-002 | AP199: 12 | AQ199: 太极转债!
A200: 110 | B200: 127020 | C200: 中金转债 | D200: 60 | E200: 中金岭南 | F200: 有色金属 | G200: 有色行业 | H200: 108.865 | I200: -1.1999999999999999e-003 | J200: -1.1999999999999999e-003 | K200: 4.55 | L200: -4.4000000000000003e-003 | M200: 113.7 | N200: 4.71 | O200: 0.127 | P200: 96.6 | Q200: 转股中 | R200: 5.33年 | S200: 3.34年 | T200: 38 | U200: 28 | V200: 6.9999999999999993e-003 | W200: 0.23399999999999999 | X200: 0.22600000000000001 | Y200: 162 | Z200: 1.44 | AA200: 8.3000000000000001e-003 | AB200: 3.5999999999999999e-003 | AC200: -1.7299999999999999e-002 | AD200: -1.8600000000000002e-002 | AE200: 88.45 | AF200: 91.06 | AG200: 0.56 | AH200: AA+ | AI200: 4.3099999999999999e-002 | AJ200: =H200+100*O200 -> 121.565 | AK200: 121.1 | AL200: 99 | AM200: 30.1 | AN200: 113 | AO200: -4.4999999999999998e-002 | AP200: 14 | AQ200: 中金转债
A201: 210 | B201: 123033 | C201: 金力转债! | D201: 300748 | E201: 金力永磁 | F201: 电子 | G201: 元器件制 | H201: 117.3 | I201: 1.e-002 | J201: 1.9299999999999998e-002 | K201: 40.03 | L201: 4.9299999999999997e-002 | M201: 121.5 | N201: 40.68 | O201: 0.192 | P201: 98.4 | Q201: 转股中 | R201: 4.62年 | S201: 2.62年 | T201: 4.34 | U201: 1218. | V201: 2.2799999999999998 | W201: 2.5000000000000001e-002 | X201: 2.5000000000000001e-002 | Y201: 173 | Z201: 12.39 | AA201: 7.9000000000000008e-003 | AB201: -2.0000000000000001e-004 | AC201: -3.95e-002 | AD201: -4.2699999999999995e-002 | AE201: 88.44 | AF201: 91.8 | AG201: 0.59 | AH201: AA- | AI201: 6.4500000000000002e-002 | AJ201: =H201+100*O201 -> 136.5 | AK201: 136.2 | AL201: 242 | AM201: 44.4 | AN201: 241 | AO201: 1.6e-002 | AP201: 28 | AQ201: 金力转债!
A202: 144 | B202: 128107 | C202: 交科转债 | D202: 2061 | E202: 浙江交科 | F202: 建筑 | G202: 建筑工程 | H202: 110.847 | I202: 1.e-003 | J202: -2.0999999999999999e-003 | K202: 5.68 | L202: -1.8e-003 | M202: 115.3 | N202: 5.36 | O202: 4.5999999999999999e-002 | P202: 105.97 | Q202: 转股中 | R202: 5年33天 | S202: 3年34天 | T202: 25 | U202: 13 | V202: 5.0000000000000001e-003 | W202: 0.32000000000000001 | X202: 0.33899999999999997 | Y202: 78 | Z202: 0.98 | AA202: 7.9000000000000008e-003 | AB202: 2.5000000000000001e-003 | AC202: -2.0099999999999996e-002 | AD202: -2.23e-002 | AE202: 90.61 | AF202: 93.44 | AG202: 0.64 | AH202: AA+ | AI202: 4.3099999999999999e-002 | AJ202: =H202+100*O202 -> 115.44699999999999 | AK202: 115.7 | AL202: 45 | AM202: 22.3 | AN202: 34 | AO202: 1.7000000000000001e-002 | AP202: 17 | AQ202: 交科转债
A203: 113 | B203: 128121 | C203: 宏川转债! | D203: 2930 | E203: 宏川智慧 | F203: 交通运输 | G203: 物流业 | H203: 109.05 | I203: -1.4000000000000002e-003 | J203: 1.7000000000000001e-003 | K203: 17.57 | L203: 5.9999999999999995e-004 | M203: 113.3 | N203: 20.25 | O203: 0.25700000000000001 | P203: 86.77 | Q203: 转股中 | R203: 5.33年 | S203: 3.33年 | T203: 6.7 | U203: 2.3 | V203: 3.0000000000000001e-003 | W203: 8.5999999999999993e-002 | X203: 7.4999999999999997e-002 | Y203: 78 | Z203: 4.06 | AA203: 7.4000000000000003e-003 | AB203: 2.8000000000000004e-003 | AC203: -1.41e-002 | AD203: -1.6200000000000003e-002 | AE203: 83.2 | AF203: 81.17 | AG203: 0.59 | AH203: AA- | AI203: 6.6100000000000006e-002 | AJ203: =H203+100*O203 -> 134.75 | AK203: 131.3 | AL203: 208 | AM203: 48.1 | AN203: 258 | AO203: -1.2e-002 | AP203: 5 | AQ203: 宏川转债!
A204: 307 | B204: 128034 | C204: 江银转债! | D204: 2807 | E204: 江阴银行 | F204: 金融 | G204: 银行行业 | H204: 106.205 | I204: -3.4999999999999996e-003 | J204: -8.9999999999999998e-004 | K204: 4.25 | L204: -9.300000000000001e-003 | M204: 108.3 | N204: 4.5 | O204: 0.125 | P204: 94.44 | Q204: 转股中 | R204: 2.86年 | S204: 无权 | T204: 17.6 | U204: 3.4 | V204: 2.e-003 | W204: 0.19 | X204: 0.17999999999999999 | Y204: 92 | Z204: 0.81 | AA204: 6.8999999999999999e-003 | AB204: 1.4000000000000002e-003 | AC204: 无权 | AD204: 无权 | AE204: 无权 | AF204: 96.88 | AG204: 0.47 | AH204: AA+ | AI204: 4.0199999999999993e-002 | AJ204: =H204+100*O204 -> 118.705 | AK204: 118 | AL204: 71 | AM204: 21.1 | AN204: 27 | AO204: 1.e-003 | AP204: 26 | AQ204: 江银转债!
A205: 242 | B205: 113026 | C205: 核能转债! | D205: 601985 | E205: 中国核电 | F205: 能源电力 | G205: 核电 | H205: 107.02 | I205: -7.0999999999999995e-003 | J205: 8.1000000000000013e-003 | K205: 5.49 | L205: 1.8e-003 | M205: 109.8 | N205: 5.86 | O205: 0.14199999999999999 | P205: 93.69 | Q205: 转股中 | R205: 4年26天 | S205: 2年27天 | T205: 78 | U205: 32 | V205: 4.0000000000000001e-003 | W205: 8.1000000000000003e-002 | X205: 7.5999999999999998e-002 | Y205: 958 | Z205: 1.64 | AA205: 6.5000000000000006e-003 | AB205: 1.9e-003 | AC205: -1.5800000000000002e-002 | AD205: -1.8600000000000002e-002 | AE205: 95.01 | AF205: 94.47 | AG205: 0.52 | AH205: AAA | AI205: 3.85e-002 | AJ205: =H205+100*O205 -> 121.22 | AK205: 120.4 | AL205: 91 | AM205: 25.3 | AN205: 60 | AO205: 3.4000000000000002e-002 | AP205: 48 | AQ205: 核能转债!
A206: 152 | B206: 123048 | C206: 应急转债! | D206: 300527 | E206: 中船应急 | F206: 机械装备 | G206: 专用设备 | H206: 110.15 | I206: 9.3999999999999986e-003 | J206: -2.0000000000000001e-004 | K206: 8.41 | L206: 1.6899999999999998e-002 | M206: 113.1 | N206: 8.9 | O206: 0.16600000000000001 | P206: 94.49 | Q206: 转股中 | R206: 5年21天 | S206: 3年22天 | T206: 3.8 | U206: 214 | V206: 0.504 | W206: 4.7e-002 | X206: 4.4000000000000004e-002 | Y206: 81 | Z206: 3.25 | AA206: 5.3e-003 | AB206: 5.9999999999999995e-004 | AC206: -1.9e-002 | AD206: -2.1099999999999997e-002 | AE206: 90.54 | AF206: 91.76 | AG206: 0.55 | AH206: AA+ | AI206: 4.3099999999999999e-002 | AJ206: =H206+100*O206 -> 126.75 | AK206: 125.8 | AL206: 158 | AM206: 34 | AN206: 153 | AO206: 2.7000000000000003e-002 | AP206: 17 | AQ206: 应急转债!
A207: 54 | B207: 110076 | C207: 华海转债! | D207: 600521 | E207: 华海药业 | F207: 医药 | G207: 医药行业 | H207: 111.8 | I207: -1.89e-002 | J207: 1.43e-002 | K207: 24.9 | L207: -1.43e-002 | M207: 115.1 | N207: 34.66 | O207: 0.55600000000000005 | P207: 71.84 | Q207: 48天 | R207: 5.62年 | S207: 3.62年 | T207: 18.4 | U207: 11 | V207: 5.0000000000000001e-003 | W207: 5.0999999999999997e-002 | X207: 3.7000000000000005e-002 | Y207: 362 | Z207: 5.86 | AA207: 5.3e-003 | AB207: 5.0000000000000001e-004 | AC207: -2.e-002 | AD207: -2.18e-002 | AE207: 87.77 | AF207: 90.22 | AG207: 0.32 | AH207: AA | AI207: 4.5100000000000001e-002 | AJ207: =H207+100*O207 -> 167.40000000000001 | AK207: 151.8 | AL207: 292 | AM207: 61.5 | AN207: 294 | AO207: -9.3000000000000013e-002 | AP207: 6 | AQ207: 华海转债!
A208: 139 | B208: 127017 | C208: 万青转债 | D208: 789 | E208: 万年青 | F208: 建筑 | G208: 水泥 | H208: 115.301 | I208: -1.7600000000000001e-002 | J208: 9.1000000000000004e-003 | K208: 13.29 | L208: -1.7000000000000001e-002 | M208: 118.4 | N208: 14.16 | O208: 0.22800000000000001 | P208: 93.86 | Q208: 转股中 | R208: 5.21年 | S208: 3.21年 | T208: 10 | U208: 12 | V208: 1.e-002 | W208: 9.4e-002 | X208: 8.900000000000001e-002 | Y208: 106 | Z208: 1.91 | AA208: 5.1999999999999998e-003 | AB208: -1.e-003 | AC208: -3.1099999999999999e-002 | AD208: -3.32e-002 | AE208: 90.11 | AF208: 95.48 | AG208: 0.5 | AH208: AA+ | AI208: 4.3099999999999999e-002 | AJ208: =H208+100*O208 -> 138.101 | AK208: 136.7 | AL208: 245 | AM208: 41.3 | AN208: 214 | AO208: -1.7000000000000001e-002 | AP208: 9 | AQ208: 万青转债
A209: 236 | B209: 113537 | C209: 文灿转债!! | D209: 603348 | E209: 文灿股份 | F209: 汽车 | G209: 零部件制 | H209: 119.09 | I209: -6.0000000000000001e-003 | J209: 1.3500000000000002e-002 | K209: 21.32 | L209: 1.1399999999999999e-002 | M209: 121.5 | N209: 19.43 | O209: 8.5000000000000006e-002 | P209: 109.73 | Q209: 转股中 | R209: 4.22年 | S209: 2.23年 | T209: 1.77 | U209: 10 | V209: 4.7e-002 | W209: 3.2000000000000001e-002 | X209: 3.5000000000000003e-002 | Y209: 55 | Z209: 2.19 | AA209: 4.8999999999999998e-003 | AB209: -3.9000000000000003e-003 | AC209: -5.4100000000000002e-002 | AD209: -5.74e-002 | AE209: 90.1 | AF209: 93.98 | AG209: 0.66 | AH209: AA- | AI209: 6.4500000000000002e-002 | AJ209: =H209+100*O209 -> 127.59 | AK209: 128.5 | AL209: 184 | AM209: 34.5 | AN209: 161 | AO209: -7.8e-002 | AP209: 25 | AQ209: 文灿转债!!
A210: 319 | B210: 128022 | C210: 众信转债! | D210: 2707 | E210: 众信旅游 | F210: 旅游餐饮 | G210: 旅游 | H210: 107.501 | I210: -1.4999999999999999e-002 | J210: -9.300000000000001e-003 | K210: 7.52 | L210: -4.5700000000000005e-002 | M210: 108.8 | N210: 7.92 | O210: 0.13200000000000001 | P210: 94.95 | Q210: 转股中 | R210: 2.70年 | S210: 0.70年 | T210: 4.56 | U210: 19 | V210: 3.7999999999999999e-002 | W210: 6.7000000000000004e-002 | X210: 6.4000000000000001e-002 | Y210: 68 | Z210: 3.21 | AA210: 4.5000000000000005e-003 | AB210: -1.6000000000000001e-003 | AC210: -6.3500000000000001e-002 | AD210: -6.6699999999999995e-002 | AE210: 96.29 | AF210: 92.41 | AG210: 0.53 | AH210: AA- | AI210: 6.3200000000000006e-002 | AJ210: =H210+100*O210 -> 120.70100000000001 | AK210: 120.1 | AL210: 90 | AM210: 23.8 | AN210: 50 | AO210: 0.10199999999999999 | AP210: 31 | AQ210: 众信转债!
A211: 312 | B211: 128032 | C211: 双环转债! | D211: 2472 | E211: 双环传动 | F211: 机械装备 | G211: 通用设备 | H211: 108 | I211: 1.37e-002 | J211: -1.41e-002 | K211: 8.66 | L211: -1.1999999999999999e-003 | M211: 109.3 | N211: 9.89 | O211: 0.23300000000000001 | P211: 87.56 | Q211: 转股中 | R211: 2.77年 | S211: 0.77年 | T211: 10 | U211: 2.2 | V211: 2.e-003 | W211: 0.16800000000000001 | X211: 0.14699999999999999 | Y211: 59 | Z211: 1.78 | AA211: 4.4000000000000003e-003 | AB211: -1.9e-003 | AC211: -6.13e-002 | AD211: -6.4899999999999999e-002 | AE211: 97.94 | AF211: 97.66 | AG211: 0.36 | AH211: AA | AI211: 4.2199999999999994e-002 | AJ211: =H211+100*O211 -> 131.30000000000001 | AK211: 128.4 | AL211: 183 | AM211: 30.5 | AN211: 117 | AO211: -5.7999999999999996e-002 | AP211: 42 | AQ211: 双环转债!
A212: 31 | B212: 123083 | C212: 朗新转债 | D212: 300682 | E212: 朗新科技 | F212: 计算机及 | G212: 软件开发 | H212: 112.495 | I212: -4.5000000000000005e-003 | J212: 1.e-003 | K212: 15.18 | L212: -5.8999999999999999e-003 | M212: 115.1 | N212: 15.57 | O212: 0.154 | P212: 97.5 | Q212: 2月28天 | R212: 5.72年 | S212: 3.73年 | T212: 8 | U212: 4.7 | V212: 5.0000000000000001e-003 | W212: 5.2000000000000005e-002 | X212: 5.0000000000000003e-002 | Y212: 155 | Z212: 3.25 | AA212: 4.0999999999999995e-003 | AB212: -7.000000000000001e-004 | AC212: -2.1099999999999997e-002 | AD212: -2.2799999999999997e-002 | AE212: 87.38 | AF212: 89.82 | AG212: 0.59 | AH212: AA | AI212: 4.5100000000000001e-002 | AJ212: =H212+100*O212 -> 127.89500000000001 | AK212: 127.5 | AL212: 172 | AM212: 37.7 | AN212: 183 | AO212: 5.7999999999999996e-002 | AP212: 4 | AQ212: 朗新转债
A213: 30 | B213: 113043 | C213: 财通转债 | D213: 601108 | E213: 财通证券 | F213: 金融 | G213: 证券行业 | H213: 107.75 | I213: -1.7899999999999999e-002 | J213: 1.01e-002 | K213: 11.16 | L213: -1.67e-002 | M213: 110.2 | N213: 13.33 | O213: 0.28699999999999998 | P213: 83.72 | Q213: 2月29天 | R213: 5.73年 | S213: 无权 | T213: 38 | U213: 37 | V213: 9.0000000000000011e-003 | W213: 9.5000000000000001e-002 | X213: 7.9000000000000001e-002 | Y213: 401 | Z213: 1.84 | AA213: 4.0000000000000001e-003 | AB213: 7.000000000000001e-004 | AC213: 无权 | AD213: 无权 | AE213: 无权 | AF213: 88.25 | AG213: 0.47 | AH213: AAA | AI213: 4.0099999999999997e-002 | AJ213: =H213+100*O213 -> 136.44999999999999 | AK213: 131.8 | AL213: 213 | AM213: 43.5 | AN213: 232 | AO213: -2.8999999999999998e-002 | AP213: 9 | AQ213: 财通转债
A214: 66 | B214: 128135 | C214: 洽洽转债 | D214: 2557 | E214: 洽洽食品 | F214: 食品饮料 | G214: 休闲食品 | H214: 117.69 | I214: -1.0200000000000001e-002 | J214: 1.06e-002 | K214: 50.75 | L214: 1.e-003 | M214: 120.2 | N214: 60.83 | O214: 0.41100000000000003 | P214: 83.43 | Q214: 38天 | R214: 5.59年 | S214: 3.59年 | T214: 13.4 | U214: 12 | V214: 8.0000000000000002e-003 | W214: 5.2000000000000005e-002 | X214: 4.2999999999999997e-002 | Y214: 257 | Z214: 6.71 | AA214: 3.9000000000000003e-003 | AB214: -2.3999999999999998e-003 | AC214: -3.3399999999999999e-002 | AD214: -3.5200000000000002e-002 | AE214: 88 | AF214: 94.37 | AG214: 0.4 | AH214: AA | AI214: 4.5100000000000001e-002 | AJ214: =H214+100*O214 -> 158.78999999999999 | AK214: 152 | AL214: 294 | AM214: 57.6 | AN214: 287 | AO214: -4.0000000000000001e-002 | AP214: 9 | AQ214: 洽洽转债
A215: 203 | B215: 110062 | C215: 烽火转债! | D215: 600498 | E215: 烽火通信 | F215: 通信互联 | G215: 通信设备 | H215: 108.87 | I215: 2.0000000000000001e-004 | J215: -3.8e-003 | K215: 18.39 | L215: -1.4499999999999999e-002 | M215: 110.8 | N215: 25.65 | O215: 0.51800000000000002 | P215: 71.7 | Q215: 转股中 | R215: 4.70年 | S215: 2.71年 | T215: 30.9 | U215: 4.7 | V215: 1.e-003 | W215: 0.14300000000000002 | X215: 0.10300000000000001 | Y215: 215 | Z215: 2.03 | AA215: 3.8e-003 | AB215: -5.0000000000000001e-004 | AC215: -1.83e-002 | AD215: -2.0400000000000001e-002 | AE215: 92.76 | AF215: 93.08 | AG215: 0.25 | AH215: AAA | AI215: 3.85e-002 | AJ215: =H215+100*O215 -> 160.67000000000002 | AK215: 146 | AL215: 279 | AM215: 53 | AN215: 274 | AO215: -3.6000000000000004e-002 | AP215: 21 | AQ215: 烽火转债!
A216: 64 | B216: 123072 | C216: 乐歌转债! | D216: 300729 | E216: 乐歌股份 | F216: 其他 | G216: 家居用品 | H216: 127 | I216: 3.0000000000000001e-003 | J216: -5.4000000000000003e-003 | K216: 34 | L216: -2.0499999999999997e-002 | M216: 129.6 | N216: 73.13 | O216: 1.73 | P216: 46.49 | Q216: 39天 | R216: 5.59年 | S216: 3.59年 | T216: 1.42 | U216: 623 | V216: 3.3700000000000001 | W216: 2.9999999999999999e-002 | X216: 1.3999999999999999e-002 | Y216: 47 | Z216: 4.95 | AA216: 3.7000000000000002e-003 | AB216: -4.7999999999999996e-003 | AC216: -4.5899999999999996e-002 | AD216: -4.9000000000000002e-002 | AE216: 81.05 | AF216: 86.68 | AG216: 0.11 | AH216: A+ | AI216: 7.7100000000000002e-002 | AJ216: =H216+100*O216 -> 300. | AK216: 207.5 | AL216: 323 | AM216: 120.8 | AN216: 323 | AO216: -0.109 | AP216: 8 | AQ216: 乐歌转债!
A217: 129 | B217: 128114 | C217: 正邦转债 | D217: 2157 | E217: 正邦科技 | F217: 农业 | G217: 畜牧业 | H217: 113.331 | I217: -1.09e-002 | J217: -1.1999999999999999e-003 | K217: 16.03 | L217: -1.9599999999999999e-002 | M217: 115.3 | N217: 15.56 | O217: 0.10000000000000001 | P217: 103.02 | Q217: 转股中 | R217: 5.24年 | S217: 3.25年 | T217: 16 | U217: 31 | V217: 1.7000000000000001e-002 | W217: 3.2000000000000001e-002 | X217: 3.3000000000000002e-002 | Y217: 497 | Z217: 2.69 | AA217: 3.4000000000000002e-003 | AB217: -1.9e-003 | AC217: -2.5699999999999997e-002 | AD217: -2.7699999999999999e-002 | AE217: 90.02 | AF217: 92.84 | AG217: 0.62 | AH217: AA+ | AI217: 4.3099999999999999e-002 | AJ217: =H217+100*O217 -> 123.331 | AK217: 123.6 | AL217: 128 | AM217: 30.8 | AN217: 122 | AO217: -3.7999999999999999e-002 | AP217: 17 | AQ217: 正邦转债
A218: 274 | B218: 128051 | C218: 光华转债! | D218: 2741 | E218: 光华科技 | F218: 电子 | G218: 元器件制 | H218: 113.501 | I218: 9.0000000000000011e-003 | J218: 1.3000000000000001e-002 | K218: 14.4 | L218: 3.0800000000000001e-002 | M218: 114.8 | N218: 12.72 | O218: 3.0000000000000001e-003 | P218: 113.21 | Q218: 转股中 | R218: 3.74年 | S218: 1.74年 | T218: 2.48 | U218: 7.7 | V218: 2.7000000000000003e-002 | W218: 4.5999999999999999e-002 | X218: 5.2000000000000005e-002 | Y218: 54 | Z218: 4.45 | AA218: 3.0999999999999999e-003 | AB218: -4.0000000000000001e-003 | AC218: -4.9400000000000006e-002 | AD218: -5.2300000000000006e-002 | AE218: 91.63 | AF218: 91.33 | AG218: 0.71 | AH218: AA- | AI218: 6.4500000000000002e-002 | AJ218: =H218+100*O218 -> 113.801 | AK218: 113.8 | AL218: 33 | AM218: 22.2 | AN218: 32 | AO218: 4.0999999999999995e-002 | AP218: 26 | AQ218: 光华转债!
A219: 253 | B219: 127012 | C219: 招路转债! | D219: 1965 | E219: 招商公路 | F219: 机场高速 | G219: 高速 | H219: 107.099 | I219: 7.4999999999999997e-003 | J219: 3.5999999999999999e-003 | K219: 7.59 | L219: 2.7099999999999999e-002 | M219: 108.2 | N219: 8.81 | O219: 0.24299999999999999 | P219: 86.15 | Q219: 转股中 | R219: 4年2.1天 | S219: 2年3.1天 | T219: 50 | U219: 70 | V219: 1.3000000000000001e-002 | W219: 0.107 | X219: 9.1999999999999998e-002 | Y219: 469 | Z219: 0.96 | AA219: 2.5999999999999999e-003 | AB219: -1.2999999999999999e-003 | AC219: -2.2499999999999999e-002 | AD219: -2.4199999999999999e-002 | AE219: 93.96 | AF219: 93.2 | AG219: 0.41 | AH219: AAA | AI219: 3.85e-002 | AJ219: =H219+100*O219 -> 131.399 | AK219: 128 | AL219: 177 | AM219: 34.1 | AN219: 154 | AO219: 6.0999999999999999e-002 | AP219: 35 | AQ219: 招路转债!
A220: 80 | B220: 123064 | C220: 万孚转债! | D220: 300482 | E220: 万孚生物 | F220: 医药 | G220: 医疗器械 | H220: 113.5 | I220: -8.6999999999999994e-003 | J220: -4.3e-003 | K220: 75 | L220: -3.2300000000000002e-002 | M220: 115.1 | N220: 93.57 | O220: 0.41600000000000004 | P220: 80.15 | Q220: 转股中 | R220: 5.45年 | S220: 3.46年 | T220: 6 | U220: 1.3 | V220: 2.e-003 | W220: 2.3e-002 | X220: 1.9e-002 | Y220: 257 | Z220: 9.49 | AA220: 2.5999999999999999e-003 | AB220: -2.3e-003 | AC220: -2.5099999999999997e-002 | AD220: -2.69e-002 | AE220: 88.43 | AF220: 90.9 | AG220: 0.4 | AH220: AA | AI220: 4.5100000000000001e-002 | AJ220: =H220+100*O220 -> 155.09999999999999 | AK220: 146.8 | AL220: 282 | AM220: 55.9 | AN220: 285 | AO220: -3.4000000000000002e-002 | AP220: 10 | AQ220: 万孚转债!
A221: 170 | B221: 110067 | C221: 华安转债! | D221: 600909 | E221: 华安证券 | F221: 金融 | G221: 证券行业 | H221: 109.16 | I221: -5.4000000000000003e-003 | J221: 3.0000000000000001e-003 | K221: 6.41 | L221: -7.7000000000000002e-003 | M221: 110.3 | N221: 8.67 | O221: 0.47600000000000003 | P221: 73.93 | Q221: 转股中 | R221: 4.98年 | S221: 无权 | T221: 28 | U221: 22 | V221: 6.9999999999999993e-003 | W221: 0.121 | X221: 8.900000000000001e-002 | Y221: 232 | Z221: 1.67 | AA221: 2.0999999999999999e-003 | AB221: -1.7000000000000001e-003 | AC221: 无权 | AD221: 无权 | AE221: 无权 | AF221: 91.59 | AG221: 0.3 | AH221: AAA | AI221: 3.85e-002 | AJ221: =H221+100*O221 -> 156.75999999999999 | AK221: 144.4 | AL221: 275 | AM221: 52.8 | AN221: 273 | AO221: -4.4999999999999998e-002 | AP221: 27 | AQ221: 华安转债!
A222: 107 | B222: 123060 | C222: 苏试转债 | D222: 300416 | E222: 苏试试验 | F222: 机械装备 | G222: 专用设备 | H222: 116.331 | I222: -9.4999999999999998e-003 | J222: 1.6899999999999998e-002 | K222: 22.63 | L222: 1.1599999999999999e-002 | M222: 117.6 | N222: 23.86 | O222: 0.22699999999999998 | P222: 94.84 | Q222: 转股中 | R222: 5.34年 | S222: 3.34年 | T222: 3.1 | U222: 1.6 | V222: 4.0000000000000001e-003 | W222: 6.7000000000000004e-002 | X222: 6.4000000000000001e-002 | Y222: 46 | Z222: 4.77 | AA222: 2.0999999999999999e-003 | AB222: -3.7000000000000002e-003 | AC222: -3.1899999999999998e-002 | AD222: -3.4000000000000002e-002 | AE222: 83.26 | AF222: 84.2 | AG222: 0.63 | AH222: AA- | AI222: 6.6100000000000006e-002 | AJ222: =H222+100*O222 -> 139.03100000000001 | AK222: 137.8 | AL222: 252 | AM222: 53.6 | AN222: 278 | AO222: -6.0000000000000001e-003 | AP222: 9 | AQ222: 苏试转债
A223: 19 | B223: 123090 | C223: 三诺转债 | D223: 300298 | E223: 三诺生物 | F223: 医药 | G223: 医疗器械 | H223: 115.8 | I223: -1.7000000000000001e-003 | J223: -8.9999999999999998e-004 | K223: 29.59 | L223: -6.0000000000000001e-003 | M223: 117.1 | N223: 35.35 | O223: 0.38299999999999995 | P223: 83.71 | Q223: 3月8天 | R223: 5.76年 | S223: 3.76年 | T223: 5 | U223: 9.9 | V223: 1.7000000000000001e-002 | W223: 2.9999999999999999e-002 | X223: 2.5000000000000001e-002 | Y223: 167 | Z223: 6.18 | AA223: 2.e-003 | AB223: -3.2000000000000002e-003 | AC223: -2.8199999999999999e-002 | AD223: -2.9900000000000003e-002 | AE223: 87.25 | AF223: 91.24 | AG223: 0.44 | AH223: AA | AI223: 4.5100000000000001e-002 | AJ223: =H223+100*O223 -> 154.09999999999999 | AK223: 147.9 | AL223: 284 | AM223: 56.7 | AN223: 286 | AO223: -0.13200000000000001 | AP223: 3 | AQ223: 三诺转债
A224: 278 | B224: 110047 | C224: 山鹰转债 | D224: 600567 | E224: 山鹰国际 | F224: 造纸包装 | G224: 包装用纸 | H224: 116.75 | I224: -1.21e-002 | J224: -3.5999999999999999e-003 | K224: 3.6 | L224: -2.7000000000000003e-002 | M224: 117.5 | N224: 3.34 | O224: 8.3000000000000004e-002 | P224: 107.78 | Q224: 转股中 | R224: 3.67年 | S224: 1.68年 | T224: 22.5 | U224: 19 | V224: 6.9999999999999993e-003 | W224: 0.13600000000000001 | X224: 0.14599999999999999 | Y224: 165 | Z224: 1.13 | AA224: 1.8e-003 | AB224: -6.6e-003 | AC224: -6.7000000000000004e-002 | AD224: -6.9699999999999998e-002 | AE224: 95.46 | AF224: 101.48 | AG224: 0.58 | AH224: AA+ | AI224: 4.1500000000000002e-002 | AJ224: =H224+100*O224 -> 125.05 | AK224: 125.7 | AL224: 157 | AM224: 24.2 | AN224: 54 | AO224: -2.4e-002 | AP224: 35 | AQ224: 山鹰转债
A225: 76 | B225: 123066 | C225: 赛意转债 | D225: 300687 | E225: 赛意信息 | F225: 计算机及 | G225: 软件开发 | H225: 120.488 | I225: -4.1999999999999997e-003 | J225: -2.0099999999999996e-002 | K225: 24.85 | L225: -3.3500000000000002e-002 | M225: 121.4 | N225: 22.58 | O225: 9.5000000000000001e-002 | P225: 110.05 | Q225: 3.1天 | R225: 5.49年 | S225: 3.50年 | T225: 3.2 | U225: 20 | V225: 5.0000000000000003e-002 | W225: 5.9000000000000004e-002 | X225: 6.5000000000000002e-002 | Y225: 54 | Z225: 5.7 | AA225: 1.4000000000000002e-003 | AB225: -5.1999999999999998e-003 | AC225: -3.8900000000000004e-002 | AD225: -4.1100000000000005e-002 | AE225: 79.72 | AF225: 81.48 | AG225: 0.73 | AH225: A+ | AI225: 7.7100000000000002e-002 | AJ225: =H225+100*O225 -> 129.988 | AK225: 130.9 | AL225: 201 | AM225: 49.4 | AN225: 265 | AO225: -9.0999999999999998e-002 | AP225: 7 | AQ225: 赛意转债
A226: 260 | B226: 127011 | C226: 中鼎转2! | D226: 887 | E226: 中鼎股份 | F226: 汽车 | G226: 零部件制 | H226: 113.969 | I226: -1.84e-002 | J226: 4.7999999999999996e-003 | K226: 10.74 | L226: -2.98e-002 | M226: 114.5 | N226: 11.59 | O226: 0.23000000000000001 | P226: 92.67 | Q226: 转股中 | R226: 3.97年 | S226: 1.97年 | T226: 12 | U226: 4.4 | V226: 3.0000000000000001e-003 | W226: 9.1999999999999998e-002 | X226: 8.5000000000000006e-002 | Y226: 131 | Z226: 1.5 | AA226: 1.1999999999999999e-003 | AB226: -5.4000000000000003e-003 | AC226: -4.7300000000000002e-002 | AD226: -4.9699999999999994e-002 | AE226: 94.33 | AF226: 97.72 | AG226: 0.45 | AH226: AA+ | AI226: 4.1500000000000002e-002 | AJ226: =H226+100*O226 -> 136.96899999999999 | AK226: 135.3 | AL226: 238 | AM226: 37.6 | AN226: 181 | AO226: 3.3000000000000002e-002 | AP226: 24 | AQ226: 中鼎转2!
A227: 52 | B227: 128136 | C227: 立讯转债 | D227: 2475 | E227: 立讯精密 | F227: 电子 | G227: 元器件制 | H227: 111.21 | I227: -1.5800000000000002e-002 | J227: 1.9e-003 | K227: 35.84 | L227: -7.0999999999999994e-002 | M227: 111.9 | N227: 58.36 | O227: 0.81099999999999994 | P227: 61.41 | Q227: 51天 | R227: 5.62年 | S227: 3.63年 | T227: 30 | U227: 53 | V227: 1.6e-002 | W227: 1.2e-002 | X227: 6.9999999999999993e-003 | Y227: 2521. | Z227: 10.06 | AA227: 1.1000000000000001e-003 | AB227: -2.7000000000000001e-003 | AC227: -2.1600000000000001e-002 | AD227: -2.2799999999999997e-002 | AE227: 87.3 | AF227: 88.49 | AG227: 0.2 | AH227: AA+ | AI227: 4.3099999999999999e-002 | AJ227: =H227+100*O227 -> 192.31 | AK227: 161 | AL227: 306 | AM227: 72.5 | AN227: 307 | AO227: -0.20199999999999999 | AP227: 11 | AQ227: 立讯转债
A228: 205 | B228: 113550 | C228: 常汽转债! | D228: 603035 | E228: 常熟汽饰 | F228: 汽车 | G228: 零部件制 | H228: 120.83 | I228: -9.7999999999999997e-003 | J228: 7.3000000000000001e-003 | K228: 11.21 | L228: -3.5999999999999999e-003 | M228: 121.3 | N228: 9.65 | O228: 4.0000000000000001e-002 | P228: 116.17 | Q228: 转股中 | R228: 4.67年 | S228: 2.67年 | T228: 3.78 | U228: 3.8 | V228: 8.0000000000000002e-003 | W228: 9.8000000000000004e-002 | X228: 0.114 | Y228: 39 | Z228: 1.12 | AA228: 8.9999999999999998e-004 | AB228: -6.8999999999999999e-003 | AC228: -5.1399999999999994e-002 | AD228: -5.4000000000000006e-002 | AE228: 87.48 | AF228: 91.25 | AG228: 0.71 | AH228: AA- | AI228: 6.4500000000000002e-002 | AJ228: =H228+100*O228 -> 124.83 | AK228: 125.5 | AL228: 154 | AM228: 34.2 | AN228: 158 | AO228: -2.6000000000000002e-002 | AP228: 16 | AQ228: 常汽转债!
A229: 230 | B229: 113541 | C229: 荣晟转债! | D229: 603165 | E229: 荣晟环保 | F229: 造纸包装 | G229: 包装用纸 | H229: 114.82 | I229: 2.9999999999999997e-004 | J229: 2.0000000000000001e-004 | K229: 13.22 | L229: 8.0000000000000004e-004 | M229: 115 | N229: 11.54 | O229: 2.e-003 | P229: 114.56 | Q229: 转股中 | R229: 4.34年 | S229: 2.35年 | T229: 2.69 | U229: 12 | V229: 3.7999999999999999e-002 | W229: 8.0000000000000002e-002 | X229: 9.1999999999999998e-002 | Y229: 33 | Z229: 2.18 | AA229: 4.0000000000000002e-004 | AB229: -5.7999999999999996e-003 | AC229: -4.0899999999999999e-002 | AD229: -4.3400000000000001e-002 | AE229: 88.63 | AF229: 88.2 | AG229: 0.73 | AH229: AA- | AI229: 6.4500000000000002e-002 | AJ229: =H229+100*O229 -> 115.02 | AK229: 115.1 | AL229: 39 | AM229: 26.5 | AN229: 71 | AO229: 3.2000000000000001e-002 | AP229: 46 | AQ229: 荣晟转债!
A230: 237 | B230: 113536 | C230: 三星转债 | D230: 603578 | E230: 三星新材 | F230: 家电 | G230: 零部件制 | H230: 114.7 | I230: -8.9999999999999998e-004 | J230: -5.9999999999999995e-004 | K230: 19.96 | L230: -2.5000000000000001e-003 | M230: 114.8 | N230: 19.54 | O230: 0.12300000000000001 | P230: 102.15 | Q230: 转股中 | R230: 4.20年 | S230: 2.20年 | T230: 1.49 | U230: 32 | V230: 0.185 | W230: 8.1000000000000003e-002 | X230: 8.3000000000000004e-002 | Y230: 18 | Z230: 2.62 | AA230: 2.0000000000000001e-004 | AB230: -6.0999999999999995e-003 | AC230: -4.3700000000000003e-002 | AD230: -4.6199999999999998e-002 | AE230: 93.5 | AF230: 96.37 | AG230: 0.57 | AH230: AA | AI230: 4.3499999999999997e-002 | AJ230: =H230+100*O230 -> 127. | AK230: 127.3 | AL230: 170 | AM230: 30.9 | AN230: 124 | AO230: 2.e-002 | AP230: 38 | AQ230: 三星转债
A231: 40 | B231: 123079 | C231: 运达转债 | D231: 300772 | E231: 运达股份 | F231: 能源电力 | G231: 风能 | H231: 115.16 | I231: 9.300000000000001e-003 | J231: -8.5000000000000006e-003 | K231: 15.25 | L231: 1.2999999999999999e-003 | M231: 115.1 | N231: 15.31 | O231: 0.156 | P231: 99.61 | Q231: 2月20天 | R231: 5.70年 | S231: 3.70年 | T231: 5.77 | U231: 6.9 | V231: 1.e-002 | W231: 0.129 | X231: 0.128 | Y231: 45 | Z231: 2.91 | AA231: -1.e-004 | AB231: -4.7999999999999996e-003 | AC231: -2.7200000000000002e-002 | AD231: -2.8900000000000002e-002 | AE231: 87.47 | AF231: 89.91 | AG231: 0.61 | AH231: AA | AI231: 4.5100000000000001e-002 | AJ231: =H231+100*O231 -> 130.75999999999999 | AK231: 130.7 | AL231: 200 | AM231: 40.8 | AN231: 211 | AO231: -4.0000000000000001e-002 | AP231: 4 | AQ231: 运达转债
A232: 117 | B232: 128119 | C232: 龙大转债! | D232: 2726 | E232: 龙大肉食 | F232: 食品饮料 | G232: 肉制品 | H232: 120.608 | I232: -5.6000000000000008e-003 | J232: -3.0000000000000001e-003 | K232: 10.67 | L232: -1.3000000000000001e-002 | M232: 120.2 | N232: 9.57 | O232: 8.199999999999999e-002 | P232: 111.49 | Q232: 转股中 | R232: 5.32年 | S232: 3.32年 | T232: 9.5 | U232: 6.2 | V232: 5.0000000000000001e-003 | W232: 8.900000000000001e-002 | X232: 9.9000000000000005e-002 | Y232: 107 | Z232: 3.45 | AA232: -5.9999999999999995e-004 | AB232: -7.0999999999999995e-003 | AC232: -4.2800000000000005e-002 | AD232: -4.4699999999999997e-002 | AE232: 89.06 | AF232: 95.5 | AG232: 0.66 | AH232: AA | AI232: 4.5100000000000001e-002 | AJ232: =H232+100*O232 -> 128.80799999999999 | AK232: 129.7 | AL232: 194 | AM232: 34.2 | AN232: 155 | AO232: -2.6000000000000002e-002 | AP232: 8 | AQ232: 龙大转债!
A233: 336 | B233: 113009 | C233: 广汽转债! | D233: 601238 | E233: 广汽集团 | F233: 汽车 | G233: 乘用车 | H233: 106.08 | I233: -1.1000000000000001e-003 | J233: 1.e-003 | K233: 10.46 | L233: -1.32e-002 | M233: 106 | N233: 14.12 | O233: 0.43200000000000005 | P233: 74.08 | Q233: 转股中 | R233: 0.85年 | S233: 回售内 | T233: 25.5 | U233: 12 | V233: 4.0000000000000001e-003 | W233: 2.4e-002 | X233: 1.7000000000000001e-002 | Y233: 1083. | Z233: 1.29 | AA233: -8.9999999999999998e-004 | AB233: -1.4199999999999999e-002 | AC233: 回售内 | AD233: 回售内 | AE233: 100.27 | AF233: 103.01 | AG233: 0.01 | AH233: AAA | AI233: 3.44e-002 | AJ233: =H233+100*O233 -> 149.28 | AK233: 138.1 | AL233: 253 | AM233: 35.1 | AN233: 168 | AO233: -2.7000000000000003e-002 | AP233: 16 | AQ233: 广汽转债!
A234: 7 | B234: 113621 | C234: 彤程转债 | D234: 603650 | E234: 彤程新材 | F234: 化工 | G234: 橡胶塑料 | H234: 115.67 | I234: -1.15e-002 | J234: -9.4999999999999998e-003 | K234: 33.74 | L234: -3.2400000000000005e-002 | M234: 115.1 | N234: 32.96 | O234: 0.13 | P234: 102.37 | Q234: 4月16天 | R234: 5.86年 | S234: 3.86年 | T234: 8 | U234: 22 | V234: 2.4e-002 | W234: 4.0000000000000001e-002 | X234: 4.0999999999999995e-002 | Y234: 198 | Z234: 8.39 | AA234: -8.9999999999999998e-004 | AB234: -5.4000000000000003e-003 | AC234: -2.7200000000000002e-002 | AD234: -2.8900000000000002e-002 | AE234: 86.88 | AF234: 89.3 | AG234: 0.65 | AH234: AA | AI234: 4.5100000000000001e-002 | AJ234: =H234+100*O234 -> 128.67000000000002 | AK234: 129 | AL234: 187 | AM234: 39.7 | AN234: 201 | AO234: -7.9000000000000001e-002 | AP234: 2 | AQ234: 彤程转债
A235: 95 | B235: 113598 | C235: 法兰转债 | D235: 603966 | E235: 法兰泰克 | F235: 机械装备 | G235: 工程机械 | H235: 122.05 | I235: -1.1000000000000001e-003 | J235: 9.8999999999999991e-003 | K235: 16.91 | L235: 1.1399999999999999e-002 | M235: 121.2 | N235: 13.88 | O235: 2.e-003 | P235: 121.83 | Q235: 转股中 | R235: 5.36年 | S235: 3.37年 | T235: 2.98 | U235: 9.8 | V235: 2.7000000000000003e-002 | W235: 8.4000000000000005e-002 | X235: 0.10199999999999999 | Y235: 36 | Z235: 3.2 | AA235: -1.2999999999999999e-003 | AB235: -8.0000000000000002e-003 | AC235: -4.4400000000000002e-002 | AD235: -4.6500000000000007e-002 | AE235: 83.27 | AF235: 86.65 | AG235: 0.77 | AH235: AA- | AI235: 6.6100000000000006e-002 | AJ235: =H235+100*O235 -> 122.25 | AK235: 122.3 | AL235: 115 | AM235: 35.6 | AN235: 171 | AO235: -1.6e-002 | AP235: 8 | AQ235: 法兰转债
A236: 83 | B236: 113602 | C236: 景20转债! | D236: 603228 | E236: 景旺电子 | F236: 电子 | G236: 元器件制 | H236: 114.38 | I236: -5.1999999999999998e-003 | J236: 5.6999999999999993e-003 | K236: 26.52 | L236: 8.0000000000000004e-004 | M236: 113.3 | N236: 27.7 | O236: 0.19500000000000001 | P236: 95.74 | Q236: 转股中 | R236: 5.43年 | S236: 3.43年 | T236: 17.8 | U236: 7.7 | V236: 4.0000000000000001e-003 | W236: 7.9000000000000001e-002 | X236: 7.4999999999999997e-002 | Y236: 226 | Z236: 3.77 | AA236: -1.8e-003 | AB236: -6.1999999999999998e-003 | AC236: -2.6800000000000001e-002 | AD236: -2.8799999999999999e-002 | AE236: 88.71 | AF236: 89.61 | AG236: 0.59 | AH236: AA | AI236: 4.5100000000000001e-002 | AJ236: =H236+100*O236 -> 133.88 | AK236: 133 | AL236: 222 | AM236: 43.4 | AN236: 228 | AO236: -4.2999999999999997e-002 | AP236: 9 | AQ236: 景20转债!
A237: 21 | B237: 128141 | C237: 旺能转债 | D237: 2034 | E237: 旺能环境 | F237: 城市公用 | G237: 三废处理 | H237: 116.363 | I237: 6.3e-003 | J237: 1.7000000000000001e-003 | K237: 19.17 | L237: 1.11e-002 | M237: 115.1 | N237: 16.47 | O237: 0. | P237: 116.39 | Q237: 3月6天 | R237: 5.75年 | S237: 3.75年 | T237: 14 | U237: 40 | V237: 2.5000000000000001e-002 | W237: 0.17300000000000001 | X237: 0.20199999999999999 | Y237: 81 | Z237: 1.82 | AA237: -1.9e-003 | AB237: -6.6e-003 | AC237: -2.9500000000000002e-002 | AD237: -3.1099999999999999e-002 | AE237: 87.3 | AF237: 89.73 | AG237: 0.73 | AH237: AA | AI237: 4.5100000000000001e-002 | AJ237: =H237+100*O237 -> 116.363 | AK237: 116.3 | AL237: 48 | AM237: 26.6 | AN237: 74 | AO237: 6.7000000000000004e-002 | AP237: 4 | AQ237: 旺能转债
A238: 207 | B238: 123035 | C238: 利德转债! | D238: 300296 | E238: 利亚德 | F238: 电子 | G238: LED制 | H238: 116.297 | I238: -6.6e-003 | J238: -5.3e-003 | K238: 7.04 | L238: -2.0899999999999998e-002 | M238: 115.1 | N238: 6.98 | O238: 0.153 | P238: 100.86 | Q238: 转股中 | R238: 4.66年 | S238: 2.66年 | T238: 8 | U238: 4.6 | V238: 5.0000000000000001e-003 | W238: 4.4999999999999998e-002 | X238: 4.4999999999999998e-002 | Y238: 179 | Z238: 2.1 | AA238: -2.3e-003 | AB238: -8.0000000000000002e-003 | AC238: -4.0500000000000001e-002 | AD238: -4.2800000000000005e-002 | AE238: 92.48 | AF238: 95.63 | AG238: 0.57 | AH238: AA+ | AI238: 4.1500000000000002e-002 | AJ238: =H238+100*O238 -> 131.59700000000001 | AK238: 131.7 | AL238: 212 | AM238: 36.1 | AN238: 175 | AO238: -4.2999999999999997e-002 | AP238: 16 | AQ238: 利德转债!
A239: 200 | B239: 110063 | C239: 鹰19转债 | D239: 600567 | E239: 山鹰国际 | F239: 造纸包装 | G239: 包装用纸 | H239: 117.16 | I239: -2.3399999999999997e-002 | J239: 6.0999999999999995e-003 | K239: 3.6 | L239: -2.7000000000000003e-002 | M239: 115.9 | N239: 3.3 | O239: 7.400000000000001e-002 | P239: 109.09 | Q239: 转股中 | R239: 4.73年 | S239: 2.74年 | T239: 18.5 | U239: 16 | V239: 6.9999999999999993e-003 | W239: 0.11199999999999999 | X239: 0.122 | Y239: 165 | Z239: 1.13 | AA239: -2.3e-003 | AB239: -8.199999999999999e-003 | AC239: -4.2999999999999997e-002 | AD239: -4.4999999999999998e-002 | AE239: 91.83 | AF239: 95.94 | AG239: 0.64 | AH239: AA+ | AI239: 4.1500000000000002e-002 | AJ239: =H239+100*O239 -> 124.56 | AK239: 125.2 | AL239: 149 | AM239: 29.3 | AN239: 108 | AO239: -2.4e-002 | AP239: 40 | AQ239: 鹰19转债
A240: 320 | B240: 128021 | C240: 兄弟转债!! | D240: 2562 | E240: 兄弟科技 | F240: 医药 | G240: 原料药 | H240: 109.6 | I240: 8.9999999999999998e-004 | J240: -8.9999999999999998e-004 | K240: 5.08 | L240: 4.0000000000000001e-003 | M240: 108.8 | N240: 5.19 | O240: 0.12 | P240: 97.88 | Q240: 转股中 | R240: 2.70年 | S240: 0.70年 | T240: 2.65 | U240: 1.5 | V240: 5.0000000000000001e-003 | W240: 4.9000000000000002e-002 | X240: 4.8000000000000001e-002 | Y240: 54 | Z240: 1.98 | AA240: -2.8000000000000004e-003 | AB240: -8.8000000000000005e-003 | AC240: -8.48e-002 | AD240: -8.8000000000000009e-002 | AE240: 98 | AF240: 97.48 | AG240: 0 | AH240: AA | AI240: 4.2199999999999994e-002 | AJ240: =H240+100*O240 -> 121.59999999999999 | AK240: 121.3 | AL240: 104 | AM240: 23.3 | AN240: 44 | AO240: -8.0000000000000002e-003 | AP240: 14 | AQ240: 兄弟转债!!
A241: 56 | B241: 113607 | C241: 伟20转债! | D241: 603568 | E241: 伟明环保 | F241: 城市公用 | G241: 三废处理 | H241: 116.99 | I241: 5.1000000000000004e-003 | J241: 3.3e-003 | K241: 21.46 | L241: 1.4199999999999999e-002 | M241: 115.1 | N241: 22.01 | O241: 0.20000000000000001 | P241: 97.5 | Q241: 48天 | R241: 5.62年 | S241: 3.62年 | T241: 12 | U241: 6.4 | V241: 5.0000000000000001e-003 | W241: 4.4999999999999998e-002 | X241: 4.2999999999999997e-002 | Y241: 270 | Z241: 5.37 | AA241: -2.8999999999999998e-003 | AB241: -7.7000000000000002e-003 | AC241: -3.1800000000000002e-002 | AD241: -3.3500000000000002e-002 | AE241: 87.77 | AF241: 90.22 | AG241: 0.59 | AH241: AA | AI241: 4.5100000000000001e-002 | AJ241: =H241+100*O241 -> 136.99000000000001 | AK241: 136.5 | AL241: 244 | AM241: 46.3 | AN241: 245 | AO241: 2.6000000000000002e-002 | AP241: 4 | AQ241: 伟20转债!
A242: 81 | B242: 128130 | C242: 景兴转债 | D242: 2067 | E242: 景兴纸业 | F242: 造纸包装 | G242: 包装用纸 | H242: 117.01 | I242: -1.5700000000000002e-002 | J242: -3.9000000000000003e-003 | K242: 3.95 | L242: -2.7099999999999999e-002 | M242: 115.1 | N242: 3.4 | O242: 6.9999999999999993e-003 | P242: 116.18 | Q242: 转股中 | R242: 5.45年 | S242: 3.45年 | T242: 12.2 | U242: 26 | V242: 1.8000000000000002e-002 | W242: 0.27800000000000002 | X242: 0.32299999999999995 | Y242: 44 | Z242: 0.97 | AA242: -3.0999999999999999e-003 | AB242: -8.0000000000000002e-003 | AC242: -3.3300000000000003e-002 | AD242: -3.5200000000000002e-002 | AE242: 88.44 | AF242: 90.91 | AG242: 0.72 | AH242: AA | AI242: 4.5100000000000001e-002 | AJ242: =H242+100*O242 -> 117.71000000000001 | AK242: 117.8 | AL242: 69 | AM242: 26.9 | AN242: 80 | AO242: -2.e-002 | AP242: 13 | AQ242: 景兴转债
A243: 50 | B243: 127024 | C243: 盈峰转债 | D243: 967 | E243: 盈峰环境 | F243: 机械装备 | G243: 专用设备 | H243: 119 | I243: -8.8999999999999999e-003 | J243: 1.47e-002 | K243: 8.45 | L243: 9.5999999999999992e-003 | M243: 116.8 | N243: 8.31 | O243: 0.17000000000000001 | P243: 101.68 | Q243: 52天 | R243: 5.63年 | S243: 3.63年 | T243: 14.8 | U243: 15 | V243: 9.0000000000000011e-003 | W243: 5.5e-002 | X243: 5.5999999999999994e-002 | Y243: 267 | Z243: 1.65 | AA243: -3.4000000000000002e-003 | AB243: -8.6e-003 | AC243: -3.6799999999999999e-002 | AD243: -3.8399999999999997e-002 | AE243: 88.11 | AF243: 92.46 | AG243: 0.61 | AH243: AA+ | AI243: 4.3099999999999999e-002 | AJ243: =H243+100*O243 -> 136. | AK243: 136.3 | AL243: 243 | AM243: 43.9 | AN243: 236 | AO243: -2.3e-002 | AP243: 5 | AQ243: 盈峰转债
A244: 86 | B244: 128128 | C244: 齐翔转2 | D244: 2408 | E244: 齐翔腾达 | F244: 化工 | G244: 化工 | H244: 117.62 | I244: -5.0499999999999996e-002 | J244: 3.3e-003 | K244: 9.56 | L244: -6.4600000000000005e-002 | M244: 115.3 | N244: 8.22 | O244: 1.1000000000000001e-002 | P244: 116.3 | Q244: 转股中 | R244: 5.42年 | S244: 3.42年 | T244: 17.6 | U244: 169 | V244: 8.0000000000000002e-002 | W244: 0.10000000000000001 | X244: 0.11699999999999999 | Y244: 175 | Z244: 2.07 | AA244: -3.7000000000000002e-003 | AB244: -8.6999999999999994e-003 | AC244: -3.4700000000000002e-002 | AD244: -3.6600000000000001e-002 | AE244: 88.67 | AF244: 91.21 | AG244: 0.73 | AH244: AA | AI244: 4.5100000000000001e-002 | AJ244: =H244+100*O244 -> 118.72 | AK244: 118.9 | AL244: 81 | AM244: 27.7 | AN244: 92 | AO244: -1.7000000000000001e-002 | AP244: 40 | AQ244: 齐翔转2
A245: 142 | B245: 113579 | C245: 健友转债! | D245: 603707 | E245: 健友股份 | F245: 医药 | G245: 原料药 | H245: 116.4 | I245: -8.9999999999999998e-004 | J245: -4.3e-003 | K245: 38.82 | L245: -9.7000000000000003e-003 | M245: 114.2 | N245: 42.05 | O245: 0.26100000000000001 | P245: 92.32 | Q245: 转股中 | R245: 5年34天 | S245: 3年35天 | T245: 5.03 | U245: 12 | V245: 2.e-002 | W245: 1.3999999999999999e-002 | X245: 1.3000000000000001e-002 | Y245: 363 | Z245: 10.58 | AA245: -3.8e-003 | AB245: -8.8000000000000005e-003 | AC245: -3.5099999999999999e-002 | AD245: -3.7200000000000004e-002 | AE245: 89.94 | AF245: 91.65 | AG245: 0.53 | AH245: AA | AI245: 4.5100000000000001e-002 | AJ245: =H245+100*O245 -> 142.5 | AK245: 140.5 | AL245: 263 | AM245: 48.8 | AN245: 261 | AO245: 1.3000000000000001e-002 | AP245: 9 | AQ245: 健友转债!
A246: 140 | B246: 128108 | C246: 蓝帆转债! | D246: 2382 | E246: 蓝帆医疗 | F246: 医药 | G246: 医疗器械 | H246: 115.606 | I246: 4.3e-003 | J246: -4.3e-003 | K246: 19.45 | L246: 0. | M246: 113.3 | N246: 17.79 | O246: 5.7000000000000002e-002 | P246: 109.33 | Q246: 转股中 | R246: 5.19年 | S246: 4.19年 | T246: 16.6 | U246: 61 | V246: 3.2000000000000001e-002 | W246: 8.1000000000000003e-002 | X246: 8.900000000000001e-002 | Y246: 204 | Z246: 1.96 | AA246: -4.0000000000000001e-003 | AB246: -8.6e-003 | AC246: -2.0799999999999999e-002 | AD246: -2.3199999999999998e-002 | AE246: 87.45 | AF246: 90.57 | AG246: 0.69 | AH246: AA | AI246: 4.5100000000000001e-002 | AJ246: =H246+100*O246 -> 121.306 | AK246: 121.9 | AL246: 112 | AM246: 31.3 | AN246: 131 | AO246: -9.0999999999999998e-002 | AP246: 26 | AQ246: 蓝帆转债!
A247: 279 | B247: 128048 | C247: 张行转债 | D247: 2839 | E247: 张家港行 | F247: 金融 | G247: 银行行业 | H247: 115.111 | I247: -7.9000000000000008e-003 | J247: -8.1000000000000013e-003 | K247: 5.71 | L247: -3.0600000000000002e-002 | M247: 113.3 | N247: 5.76 | O247: 0.161 | P247: 99.13 | Q247: 转股中 | R247: 3.65年 | S247: 无权 | T247: 25 | U247: 4.5 | V247: 2.e-003 | W247: 0.24199999999999999 | X247: 0.23999999999999999 | Y247: 103 | Z247: 0.98 | AA247: -4.4000000000000003e-003 | AB247: -1.1000000000000001e-002 | AC247: 无权 | AD247: 无权 | AE247: 无权 | AF247: 97.95 | AG247: 0.53 | AH247: AA+ | AI247: 4.1500000000000002e-002 | AJ247: =H247+100*O247 -> 131.21100000000001 | AK247: 131.1 | AL247: 205 | AM247: 33.1 | AN247: 146 | AO247: -1.3999999999999999e-002 | AP247: 13 | AQ247: 张行转债
A248: 261 | B248: 128057 | C248: 博彦转债 | D248: 2649 | E248: 博彦科技 | F248: 计算机及 | G248: 软件开发 | H248: 118.308 | I248: -2.5000000000000001e-003 | J248: -7.4999999999999997e-003 | K248: 9.97 | L248: -1.38e-002 | M248: 116.3 | N248: 8.72 | O248: 3.5000000000000003e-002 | P248: 114.33 | Q248: 转股中 | R248: 3.96年 | S248: 1.96年 | T248: 5.1 | U248: 3.8 | V248: 6.0000000000000001e-003 | W248: 9.6000000000000002e-002 | X248: 0.11 | Y248: 53 | Z248: 1.8 | AA248: -4.4000000000000003e-003 | AB248: -1.1599999999999999e-002 | AC248: -6.4299999999999996e-002 | AD248: -6.6600000000000006e-002 | AE248: 90.08 | AF248: 91.2 | AG248: 0.72 | AH248: AA- | AI248: 6.4500000000000002e-002 | AJ248: =H248+100*O248 -> 121.80800000000001 | AK248: 122.3 | AL248: 116 | AM248: 31.1 | AN248: 126 | AO248: 1.3000000000000001e-002 | AP248: 27 | AQ248: 博彦转债
A249: 151 | B249: 128106 | C249: 华统转债 | D249: 2840 | E249: 华统股份 | F249: 农业 | G249: 农产品加 | H249: 115.814 | I249: -1.6899999999999998e-002 | J249: 1.0200000000000001e-002 | K249: 9.98 | L249: -9.8999999999999991e-003 | M249: 113.2 | N249: 9.4 | O249: 9.0999999999999998e-002 | P249: 106.17 | Q249: 转股中 | R249: 5年21天 | S249: 3年22天 | T249: 5.37 | U249: 1.2 | V249: 2.e-003 | W249: 0.12 | X249: 0.128 | Y249: 45 | Z249: 2.66 | AA249: -4.5999999999999999e-003 | AB249: -9.300000000000001e-003 | AC249: -3.4000000000000002e-002 | AD249: -3.61e-002 | AE249: 90.08 | AF249: 90.99 | AG249: 0.67 | AH249: AA | AI249: 4.5100000000000001e-002 | AJ249: =H249+100*O249 -> 124.91399999999999 | AK249: 125.5 | AL249: 153 | AM249: 34.5 | AN249: 160 | AO249: 2.1000000000000001e-002 | AP249: 9 | AQ249: 华统转债
A250: 195 | B250: 113559 | C250: 永创转债! | D250: 603901 | E250: 永创智能 | F250: 机械装备 | G250: 专用设备 | H250: 121.12 | I250: -7.9000000000000008e-003 | J250: -1.7100000000000001e-002 | K250: 11.96 | L250: -3.39e-002 | M250: 118.3 | N250: 10.32 | O250: 4.4999999999999998e-002 | P250: 115.89 | Q250: 转股中 | R250: 4.76年 | S250: 2.76年 | T250: 5.1 | U250: 41 | V250: 6.5000000000000002e-002 | W250: 9.6999999999999989e-002 | X250: 0.11199999999999999 | Y250: 53 | Z250: 3.8 | AA250: -5.1000000000000004e-003 | AB250: -1.1699999999999999e-002 | AC250: -5.0000000000000003e-002 | AD250: -5.2699999999999997e-002 | AE250: 87.11 | AF250: 88.5 | AG250: 0.74 | AH250: AA- | AI250: 6.4500000000000002e-002 | AJ250: =H250+100*O250 -> 125.62 | AK250: 126.3 | AL250: 162 | AM250: 37.8 | AN250: 186 | AO250: 0.114 | AP250: 20 | AQ250: 永创转债!
A251: 116 | B251: 123058 | C251: 欣旺转债 | D251: 300207 | E251: 欣旺达 | F251: 电子 | G251: 电子产品 | H251: 119.5 | I251: -8.199999999999999e-003 | J251: -1.6000000000000001e-003 | K251: 20.4 | L251: -1.78e-002 | M251: 116.3 | N251: 21.24 | O251: 0.24399999999999999 | P251: 96.05 | Q251: 转股中 | R251: 5.32年 | S251: 3.32年 | T251: 11.2 | U251: 28 | V251: 2.1000000000000001e-002 | W251: 3.5000000000000003e-002 | X251: 3.3000000000000002e-002 | Y251: 321 | Z251: 4.76 | AA251: -5.1999999999999998e-003 | AB251: -1.06e-002 | AC251: -4.0000000000000001e-002 | AD251: -4.1900000000000007e-002 | AE251: 89.15 | AF251: 92.43 | AG251: 0.55 | AH251: AA | AI251: 4.5100000000000001e-002 | AJ251: =H251+100*O251 -> 143.90000000000001 | AK251: 143 | AL251: 271 | AM251: 50.5 | AN251: 267 | AO251: -0.13 | AP251: 7 | AQ251: 欣旺转债
A252: 338 | B252: 110033 | C252: 国贸转债! | D252: 600755 | E252: 厦门国贸 | F252: 交通运输 | G252: 交通运输 | H252: 108.46 | I252: -2.2000000000000001e-003 | J252: 1.1999999999999999e-003 | K252: 6.65 | L252: -6.0000000000000001e-003 | M252: 108 | N252: 7.18 | O252: 0.17100000000000001 | P252: 92.62 | Q252: 转股中 | R252: 0.80年 | S252: 回售内 | T252: 12.1 | U252: 5 | V252: 4.0000000000000001e-003 | W252: 9.4e-002 | X252: 8.6999999999999994e-002 | Y252: 129 | Z252: 0.86 | AA252: -5.3e-003 | AB252: -2.3700000000000002e-002 | AC252: 回售内 | AD252: 回售内 | AE252: 100.33 | AF252: 105.12 | AG252: 0.16 | AH252: AAA | AI252: 3.44e-002 | AJ252: =H252+100*O252 -> 125.56 | AK252: 124.3 | AL252: 140 | AM252: 19.2 | AN252: 19 | AO252: 8.0000000000000002e-003 | AP252: 18 | AQ252: 国贸转债!
A253: 20 | B253: 128142 | C253: 新乳转债 | D253: 2946 | E253: 新乳业 | F253: 食品饮料 | G253: 乳制品 | H253: 119.731 | I253: -7.1999999999999998e-003 | J253: -3.3700000000000001e-002 | K253: 16.02 | L253: -8.6099999999999996e-002 | M253: 115.1 | N253: 18.69 | O253: 0.39700000000000002 | P253: 85.71 | Q253: 3月7天 | R253: 5.75年 | S253: 3.75年 | T253: 7.18 | U253: 1.5 | V253: 2.e-003 | W253: 5.2000000000000005e-002 | X253: 4.4999999999999998e-002 | Y253: 137 | Z253: 6.69 | AA253: -6.9999999999999993e-003 | AB253: -1.1599999999999999e-002 | AC253: -3.6499999999999998e-002 | AD253: -3.8199999999999998e-002 | AE253: 87.29 | AF253: 89.72 | AG253: 0.47 | AH253: AA | AI253: 4.5100000000000001e-002 | AJ253: =H253+100*O253 -> 159.43099999999998 | AK253: 153.7 | AL253: 298 | AM253: 64 | AN253: 299 | AO253: -0.13800000000000001 | AP253: 3 | AQ253: 新乳转债
A254: 51 | B254: 128137 | C254: 洁美转债 | D254: 2859 | E254: 洁美科技 | F254: 电子 | G254: 元器件制 | H254: 122 | I254: -9.7000000000000003e-003 | J254: 4.7999999999999996e-003 | K254: 28.52 | L254: -6.9999999999999993e-003 | M254: 117.3 | N254: 27.77 | O254: 0.188 | P254: 102.7 | Q254: 52天 | R254: 5.63年 | S254: 3.63年 | T254: 6 | U254: 1.8 | V254: 2.e-003 | W254: 5.0999999999999997e-002 | X254: 5.2999999999999999e-002 | Y254: 117 | Z254: 6.7 | AA254: -7.0999999999999995e-003 | AB254: -1.24e-002 | AC254: -4.2000000000000003e-002 | AD254: -4.3799999999999999e-002 | AE254: 81.61 | AF254: 82.41 | AG254: 0.71 | AH254: AA- | AI254: 6.6100000000000006e-002 | AJ254: =H254+100*O254 -> 140.80000000000001 | AK254: 141.3 | AL254: 265 | AM254: 58.9 | AN254: 290 | AO254: -2.e-002 | AP254: 4 | AQ254: 洁美转债
A255: 73 | B255: 113603 | C255: 东缆转债 | D255: 603606 | E255: 东方电缆 | F255: 能源电力 | G255: 电力设备 | H255: 120.02 | I255: 1.2999999999999999e-003 | J255: 7.3000000000000001e-003 | K255: 22.8 | L255: 1.5100000000000001e-002 | M255: 115.1 | N255: 23.88 | O255: 0.25700000000000001 | P255: 95.48 | Q255: 11天 | R255: 5.52年 | S255: 3.52年 | T255: 8 | U255: 10 | V255: 1.1000000000000001e-002 | W255: 5.4000000000000006e-002 | X255: 5.0999999999999997e-002 | Y255: 149 | Z255: 5.51 | AA255: -7.7000000000000002e-003 | AB255: -1.2500000000000001e-002 | AC255: -3.9399999999999998e-002 | AD255: -4.1200000000000001e-002 | AE255: 88.19 | AF255: 90.65 | AG255: 0.56 | AH255: AA | AI255: 4.5100000000000001e-002 | AJ255: =H255+100*O255 -> 145.72 | AK255: 144.6 | AL255: 276 | AM255: 53.9 | AN255: 280 | AO255: 1.3000000000000001e-002 | AP255: 7 | AQ255: 东缆转债
A256: 275 | B256: 128050 | C256: 钧达转债! | D256: 2865 | E256: 钧达股份 | F256: 汽车 | G256: 零部件制 | H256: 126.4 | I256: -5.5000000000000005e-003 | J256: 1.1999999999999999e-003 | K256: 18.68 | L256: -5.8999999999999999e-003 | M256: 122.7 | N256: 14.85 | O256: 5.0000000000000001e-003 | P256: 125.79 | Q256: 转股中 | R256: 3.73年 | S256: 1.73年 | T256: 1.55 | U256: 36 | V256: 0.182 | W256: 6.4000000000000001e-002 | X256: 8.1000000000000003e-002 | Y256: 24 | Z256: 2.37 | AA256: -8.1000000000000013e-003 | AB256: -1.8200000000000001e-002 | AC256: -0.10300000000000001 | AD256: -0.106 | AE256: 91.62 | AF256: 97.65 | AG256: 0.73 | AH256: AA- | AI256: 6.4500000000000002e-002 | AJ256: =H256+100*O256 -> 126.90000000000001 | AK256: 127 | AL256: 169 | AM256: 29.4 | AN256: 109 | AO256: -4.5999999999999999e-002 | AP256: 56 | AQ256: 钧达转债!
A257: 221 | B257: 128075 | C257: 远东转债! | D257: 2406 | E257: 远东传动 | F257: 汽车 | G257: 零部件制 | H257: 119.307 | I257: 4.7999999999999996e-003 | J257: -3.7000000000000002e-003 | K257: 6.44 | L257: 1.6000000000000001e-003 | M257: 114.9 | N257: 5.54 | O257: 2.6000000000000002e-002 | P257: 116.25 | Q257: 转股中 | R257: 4.51年 | S257: 2.52年 | T257: 5.44 | U257: 2.9 | V257: 4.0000000000000001e-003 | W257: 0.13500000000000001 | X257: 0.157 | Y257: 40 | Z257: 1.28 | AA257: -8.5000000000000006e-003 | AB257: -1.43e-002 | AC257: -5.2400000000000002e-002 | AD257: -5.4699999999999999e-002 | AE257: 92.35 | AF257: 95.18 | AG257: 0.71 | AH257: AA | AI257: 4.3499999999999997e-002 | AJ257: =H257+100*O257 -> 121.907 | AK257: 122.4 | AL257: 117 | AM257: 27.2 | AN257: 84 | AO257: 1.4999999999999999e-002 | AP257: 15 | AQ257: 远东转债!
A258: 229 | B258: 113542 | C258: 好客转债 | D258: 603898 | E258: 好莱客 | F258: 其他 | G258: 家居用品 | H258: 119.4 | I258: 1.1599999999999999e-002 | J258: -9.0000000000000011e-003 | K258: 18.04 | L258: 3.9000000000000003e-003 | M258: 114.9 | N258: 16.27 | O258: 7.6999999999999999e-002 | P258: 110.88 | Q258: 转股中 | R258: 4.37年 | S258: 2.37年 | T258: 6.03 | U258: 15 | V258: 2.1000000000000001e-002 | W258: 0.107 | X258: 0.11900000000000001 | Y258: 56 | Z258: 2.29 | AA258: -8.8999999999999999e-003 | AB258: -1.49e-002 | AC258: -5.57e-002 | AD258: -5.7999999999999996e-002 | AE258: 92.92 | AF258: 95.77 | AG258: 0.66 | AH258: AA | AI258: 4.3499999999999997e-002 | AJ258: =H258+100*O258 -> 127.10000000000001 | AK258: 127.9 | AL258: 176 | AM258: 32.1 | AN258: 140 | AO258: 4.8000000000000001e-002 | AP258: 18 | AQ258: 好客转债
A259: 49 | B259: 127025 | C259: 冀东转债 | D259: 401 | E259: 冀东水泥 | F259: 建筑 | G259: 水泥 | H259: 115.7 | I259: 0. | J259: 0. | K259: 15.65 | L259: 0. | M259: 110.1 | N259: 15.78 | O259: 0.16699999999999998 | P259: 99.18 | Q259: 53天 | R259: 5.63年 | S259: 3.63年 | T259: 28.2 | U259: 0 | V259: 0. | W259: 0.13400000000000001 | X259: 0.13300000000000001 | Y259: 211 | Z259: 1.48 | AA259: -8.8999999999999999e-003 | AB259: -1.2199999999999999e-002 | AC259: -3.0699999999999998e-002 | AD259: -3.2099999999999997e-002 | AE259: 88.66 | AF259: 88.52 | AG259: 0.62 | AH259: AAA | AI259: 4.0099999999999997e-002 | AJ259: =H259+100*O259 -> 132.40000000000001 | AK259: 132.2 | AL259: 216 | AM259: 43.6 | AN259: 233 | AO259: 1.4999999999999999e-002 | AP259: 9 | AQ259: 冀东转债
A260: 133 | B260: 113585 | C260: 寿仙转债! | D260: 603896 | E260: 寿仙谷 | F260: 医药 | G260: 中药 | H260: 123.5 | I260: -2.2000000000000001e-003 | J260: 2.3999999999999998e-003 | K260: 35.32 | L260: 2.9999999999999997e-004 | M260: 117.8 | N260: 28.68 | O260: 3.0000000000000001e-003 | P260: 123.15 | Q260: 转股中 | R260: 5.22年 | S260: 3.22年 | T260: 1.9 | U260: 9.8 | V260: 4.0999999999999995e-002 | W260: 3.6000000000000004e-002 | X260: 4.4999999999999998e-002 | Y260: 52 | Z260: 4.11 | AA260: -9.1999999999999998e-003 | AB260: -1.5100000000000001e-002 | AC260: -4.9599999999999998e-002 | AD260: -5.1699999999999996e-002 | AE260: 84.07 | AF260: 85.01 | AG260: 0.8 | AH260: AA- | AI260: 6.6100000000000006e-002 | AJ260: =H260+100*O260 -> 123.8 | AK260: 123.8 | AL260: 134 | AM260: 38.8 | AN260: 195 | AO260: -1.3000000000000001e-002 | AP260: 9 | AQ260: 寿仙转债!
A261: 147 | B261: 113577 | C261: 春秋转债 | D261: 603890 | E261: 春秋电子 | F261: 电子 | G261: 电子产品 | H261: 123.82 | I261: -2.1000000000000001e-002 | J261: -4.8999999999999998e-003 | K261: 13.39 | L261: -3.39e-002 | M261: 118.2 | N261: 11.06 | O261: 2.3e-002 | P261: 121.07 | Q261: 转股中 | R261: 5年25天 | S261: 3年26天 | T261: 1.83 | U261: 7.5 | V261: 3.3000000000000002e-002 | W261: 3.5000000000000003e-002 | X261: 4.2999999999999997e-002 | Y261: 52 | Z261: 3.06 | AA261: -9.300000000000001e-003 | AB261: -1.55e-002 | AC261: -5.2699999999999997e-002 | AD261: -5.4900000000000004e-002 | AE261: 84.87 | AF261: 86.14 | AG261: 0.76 | AH261: AA- | AI261: 6.6100000000000006e-002 | AJ261: =H261+100*O261 -> 126.11999999999999 | AK261: 126.6 | AL261: 163 | AM261: 40.4 | AN261: 207 | AO261: -6.4000000000000001e-002 | AP261: 14 | AQ261: 春秋转债
A262: 267 | B262: 128053 | C262: 尚荣转债! | D262: 2551 | E262: 尚荣医疗 | F262: 医药 | G262: 医疗器械 | H262: 118.674 | I262: -4.4000000000000003e-003 | J262: 8.9999999999999998e-004 | K262: 5.37 | L262: -3.7000000000000002e-003 | M262: 114.3 | N262: 4.89 | O262: 8.1000000000000003e-002 | P262: 109.82 | Q262: 转股中 | R262: 3.91年 | S262: 1.91年 | T262: 1.91 | U262: 35 | V262: 0.153 | W262: 4.2999999999999997e-002 | X262: 4.8000000000000001e-002 | Y262: 44 | Z262: 1.49 | AA262: -9.7000000000000003e-003 | AB262: -1.6200000000000003e-002 | AC262: -6.7199999999999996e-002 | AD262: -6.9599999999999995e-002 | AE262: 94.16 | AF262: 97.05 | AG262: 0.96 | AH262: AA | AI262: 4.3499999999999997e-002 | AJ262: =H262+100*O262 -> 126.774 | AK262: 127.5 | AL262: 173 | AM262: 30.5 | AN262: 116 | AO262: -1.4999999999999999e-002 | AP262: 27 | AQ262: 尚荣转债!
A263: 174 | B263: 123043 | C263: 正元转债 | D263: 300645 | E263: 正元智慧 | F263: 计算机及 | G263: 软件开发 | H263: 127.28 | I263: 1.55e-002 | J263: 1.77e-002 | K263: 15.77 | L263: 4.9200000000000001e-002 | M263: 120.9 | N263: 15.41 | O263: 0.24399999999999999 | P263: 102.34 | Q263: 转股中 | R263: 4.96年 | S263: 2.96年 | T263: 1.66 | U263: 1887. | V263: 8.6999999999999993 | W263: 8.3000000000000004e-002 | X263: 8.5000000000000006e-002 | Y263: 20 | Z263: 3.26 | AA263: -1.0500000000000001e-002 | AB263: -1.7600000000000001e-002 | AC263: -6.2800000000000009e-002 | AD263: -6.5099999999999991e-002 | AE263: 83.06 | AF263: 84.93 | AG263: 0.67 | AH263: A+ | AI263: 7.5499999999999998e-002 | AJ263: =H263+100*O263 -> 151.68000000000001 | AK263: 152.2 | AL263: 295 | AM263: 67.3 | AN263: 302 | AO263: 8.1000000000000003e-002 | AP263: 18 | AQ263: 正元转债
A264: 321 | B264: 123002 | C264: 国祯转债!! | D264: 300388 | E264: 节能国祯 | F264: 城市公用 | G264: 三废处理 | H264: 112.1 | I264: -6.9999999999999993e-003 | J264: 6.9999999999999993e-003 | K264: 8.58 | L264: -1.1999999999999999e-003 | M264: 108.8 | N264: 8.48 | O264: 0.10800000000000001 | P264: 101.18 | Q264: 转股中 | R264: 2.69年 | S264: 0.69年 | T264: 2.52 | U264: 0.7 | V264: 3.0000000000000001e-003 | W264: 4.2000000000000003e-002 | X264: 4.2999999999999997e-002 | Y264: 60 | Z264: 1.58 | AA264: -1.1200000000000002e-002 | AB264: -1.72e-002 | AC264: -0.113 | AD264: -0.11599999999999999 | AE264: 98.05 | AF264: 97.53 | AG264: 0 | AH264: AA | AI264: 4.2199999999999994e-002 | AJ264: =H264+100*O264 -> 122.89999999999999 | AK264: 123 | AL264: 122 | AM264: 25 | AN264: 57 | AO264: 3.3000000000000002e-002 | AP264: 15 | AQ264: 国祯转债!!
A265: 305 | B265: 128035 | C265: 大族转债! | D265: 2008 | E265: 大族激光 | F265: 机械装备 | G265: 专用设备 | H265: 111 | I265: -7.4999999999999997e-003 | J265: 4.5999999999999999e-003 | K265: 39.35 | L265: -2.41e-002 | M265: 107.4 | N265: 52.1 | O265: 0.46999999999999997 | P265: 75.53 | Q265: 转股中 | R265: 2.89年 | S265: 0.89年 | T265: 23 | U265: 3.2 | V265: 1.e-003 | W265: 5.5e-002 | X265: 4.0999999999999995e-002 | Y265: 420 | Z265: 4.57 | AA265: -1.15e-002 | AB265: -1.6200000000000003e-002 | AC265: -6.1699999999999998e-002 | AD265: -6.8199999999999997e-002 | AE265: 99.58 | AF265: 95.96 | AG265: 0.12 | AH265: AA+ | AI265: 4.0199999999999993e-002 | AJ265: =H265+100*O265 -> 158. | AK265: 146.5 | AL265: 280 | AM265: 46.9 | AN265: 249 | AO265: -9.4e-002 | AP265: 20 | AQ265: 大族转债!
A266: 22 | B266: 113614 | C266: 健20转债! | D266: 603707 | E266: 健友股份 | F266: 医药 | G266: 原料药 | H266: 122.16 | I266: -6.6e-003 | J266: 2.9999999999999997e-004 | K266: 38.82 | L266: -9.7000000000000003e-003 | M266: 114.2 | N266: 38.04 | O266: 0.19699999999999998 | P266: 102.05 | Q266: 3月6天 | R266: 5.75年 | S266: 3.75年 | T266: 7.8 | U266: 6 | V266: 6.0000000000000001e-003 | W266: 2.2000000000000002e-002 | X266: 2.2000000000000002e-002 | Y266: 363 | Z266: 10.58 | AA266: -1.1899999999999999e-002 | AB266: -1.6200000000000003e-002 | AC266: -4.1299999999999996e-002 | AD266: -4.2999999999999997e-002 | AE266: 87.39 | AF266: 89.05 | AG266: 0.65 | AH266: AA | AI266: 4.5100000000000001e-002 | AJ266: =H266+100*O266 -> 141.85999999999999 | AK266: 142.3 | AL266: 267 | AM266: 53.2 | AN266: 276 | AO266: 1.3000000000000001e-002 | AP266: 3 | AQ266: 健20转债!
A267: 168 | B267: 113572 | C267: 三祥转债! | D267: 603663 | E267: 三祥新材 | F267: 其他 | G267: 其他 | H267: 119.7 | I267: -1.5300000000000001e-002 | J267: 4.8999999999999998e-003 | K267: 16.78 | L267: -1.29e-002 | M267: 112.8 | N267: 14.19 | O267: 1.2e-002 | P267: 118.25 | Q267: 转股中 | R267: 4.98年 | S267: 2.98年 | T267: 1.69 | U267: 7 | V267: 3.4000000000000002e-002 | W267: 5.2000000000000005e-002 | X267: 6.2e-002 | Y267: 32 | Z267: 5.42 | AA267: -1.21e-002 | AB267: -1.66e-002 | AC267: -4.5999999999999999e-002 | AD267: -4.7899999999999998e-002 | AE267: 82.29 | AF267: 79.04 | AG267: 0.8 | AH267: A+ | AI267: 7.5499999999999998e-002 | AJ267: =H267+100*O267 -> 120.90000000000001 | AK267: 121.1 | AL267: 100 | AM267: 38.9 | AN267: 196 | AO267: 1.7000000000000001e-002 | AP267: 18 | AQ267: 三祥转债!
A268: 178 | B268: 113564 | C268: 天目转债 | D268: 603136 | E268: 天目湖 | F268: 旅游餐饮 | G268: 旅游 | H268: 134 | I268: 8.6e-003 | J268: -6.3e-003 | K268: 31 | L268: 2.8999999999999998e-003 | M268: 126.2 | N268: 23.1 | O268: -1.e-003 | P268: 134.2 | Q268: 转股中 | R268: 4.95年 | S268: 2.95年 | T268: 2.54 | U268: 83 | V268: 0.24600000000000002 | W268: 7.0000000000000007e-002 | X268: 9.4e-002 | Y268: 36 | Z268: 3.86 | AA268: -1.23e-002 | AB268: -2.0799999999999999e-002 | AC268: -7.85e-002 | AD268: -8.0700000000000008e-002 | AE268: 85.87 | AF268: 93.25 | AG268: 0.79 | AH268: AA- | AI268: 6.4500000000000002e-002 | AJ268: =H268+100*O268 -> 133.90000000000001 | AK268: 133.8 | AL268: 226 | AM268: 40.6 | AN268: 209 | AO268: 7.0000000000000007e-002 | AP268: 14 | AQ268: 天目转债
A269: 154 | B269: 113034 | C269: 滨化转债 | D269: 601678 | E269: 滨化股份 | F269: 化工 | G269: 化工 | H269: 122.41 | I269: -3.8300000000000001e-002 | J269: -4.3e-003 | K269: 5.67 | L269: -5.6600000000000004e-002 | M269: 115.1 | N269: 4.68 | O269: 1.e-002 | P269: 121.15 | Q269: 转股中 | R269: 5年21天 | S269: 3年22天 | T269: 15.8 | U269: 56 | V269: 2.8999999999999998e-002 | W269: 0.16399999999999998 | X269: 0.19899999999999998 | Y269: 97 | Z269: 1.4 | AA269: -1.23e-002 | AB269: -1.7500000000000002e-002 | AC269: -5.0799999999999998e-002 | AD269: -5.28e-002 | AE269: 89.99 | AF269: 92.5 | AG269: 0.75 | AH269: AA | AI269: 4.5100000000000001e-002 | AJ269: =H269+100*O269 -> 123.41 | AK269: 123.7 | AL269: 130 | AM269: 31.2 | AN269: 128 | AO269: -1.6e-002 | AP269: 26 | AQ269: 滨化转债
A270: 211 | B270: 113548 | C270: 石英转债! | D270: 603688 | E270: 石英股份 | F270: 电子 | G270: 电子产品 | H270: 132.08 | I270: -3.2199999999999999e-002 | J270: 2.5899999999999999e-002 | K270: 17.44 | L270: -9.1000000000000004e-003 | M270: 124.4 | N270: 15.1 | O270: 0.14400000000000002 | P270: 115.5 | Q270: 转股中 | R270: 4.61年 | S270: 2.61年 | T270: 1.23 | U270: 154 | V270: 0.93900000000000006 | W270: 2.e-002 | X270: 2.3e-002 | Y270: 62 | Z270: 3.27 | AA270: -1.32e-002 | AB270: -2.18e-002 | AC270: -8.2299999999999998e-002 | AD270: -8.4900000000000003e-002 | AE270: 87.87 | AF270: 93.91 | AG270: 0.68 | AH270: AA- | AI270: 6.4500000000000002e-002 | AJ270: =H270+100*O270 -> 146.48000000000002 | AK270: 148.7 | AL270: 286 | AM270: 54.8 | AN270: 282 | AO270: -3.6000000000000004e-002 | AP270: 13 | AQ270: 石英转债!
A271: 328 | B271: 113013 | C271: 国君转债! | D271: 601211 | E271: 国泰君安 | F271: 金融 | G271: 证券行业 | H271: 111.7 | I271: -4.5000000000000005e-003 | J271: 3.2000000000000002e-003 | K271: 16.11 | L271: -4.8999999999999998e-003 | M271: 108.3 | N271: 19.01 | O271: 0.318 | P271: 84.74 | Q271: 转股中 | R271: 2.30年 | S271: 无权 | T271: 69.9 | U271: 16 | V271: 2.e-003 | W271: 4.9000000000000002e-002 | X271: 4.0999999999999995e-002 | Y271: 1435. | Z271: 1.16 | AA271: -1.3600000000000001e-002 | AB271: -2.0299999999999999e-002 | AC271: 无权 | AD271: 无权 | AE271: 无权 | AF271: 99.73 | AG271: 0.28 | AH271: AAA | AI271: 3.7200000000000004e-002 | AJ271: =H271+100*O271 -> 143.5 | AK271: 138.7 | AL271: 257 | AM271: 38.9 | AN271: 198 | AO271: -1.9e-002 | AP271: 14 | AQ271: 国君转债!
A272: 16 | B272: 113615 | C272: 金诚转债 | D272: 603979 | E272: 金诚信 | F272: 有色金属 | G272: 有色行业 | H272: 126.73 | I272: -1.1299999999999999e-002 | J272: -8.8000000000000005e-003 | K272: 15.14 | L272: -2.7000000000000003e-002 | M272: 117.3 | N272: 12.73 | O272: 6.6000000000000003e-002 | P272: 118.93 | Q272: 3月12天 | R272: 5.76年 | S272: 3.76年 | T272: 10 | U272: 7.3 | V272: 6.0000000000000001e-003 | W272: 0.113 | X272: 0.13500000000000001 | Y272: 88 | Z272: 1.98 | AA272: -1.3600000000000001e-002 | AB272: -1.8700000000000001e-002 | AC272: -4.99e-002 | AD272: -5.16e-002 | AE272: 87.42 | AF272: 91.41 | AG272: 0.74 | AH272: AA | AI272: 4.5100000000000001e-002 | AJ272: =H272+100*O272 -> 133.33000000000001 | AK272: 134.5 | AL272: 231 | AM272: 43.1 | AN272: 226 | AO272: -6.9999999999999993e-003 | AP272: 3 | AQ272: 金诚转债
A273: 61 | B273: 113605 | C273: 大参转债 | D273: 603233 | E273: 大参林 | F273: 医药 | G273: 医药商业 | H273: 124.26 | I273: -2.3e-003 | J273: 2.2000000000000001e-003 | K273: 80.4 | L273: -2.0000000000000001e-004 | M273: 115.2 | N273: 83.85 | O273: 0.29600000000000004 | P273: 95.89 | Q273: 40天 | R273: 5.59年 | S273: 3.59年 | T273: 14.1 | U273: 4.8 | V273: 3.0000000000000001e-003 | W273: 2.7000000000000003e-002 | X273: 2.5000000000000001e-002 | Y273: 530 | Z273: 10.57 | AA273: -1.37e-002 | AB273: -1.84e-002 | AC273: -4.7300000000000002e-002 | AD273: -4.9100000000000005e-002 | AE273: 87.98 | AF273: 90.44 | AG273: 0.57 | AH273: AA | AI273: 4.5100000000000001e-002 | AJ273: =H273+100*O273 -> 153.86000000000001 | AK273: 152.6 | AL273: 296 | AM273: 62.2 | AN273: 295 | AO273: -3.1e-002 | AP273: 6 | AQ273: 大参转债
A274: 276 | B274: 110048 | C274: 福能转债! | D274: 600483 | E274: 福能股份 | F274: 能源电力 | G274: 电力供应 | H274: 119.28 | I274: -6.8999999999999999e-003 | J274: -6.6e-003 | K274: 9.52 | L274: -1.8600000000000002e-002 | M274: 113.3 | N274: 8.12 | O274: 1.7000000000000001e-002 | P274: 117.24 | Q274: 转股中 | R274: 3.72年 | S274: 1.72年 | T274: 27.6 | U274: 56 | V274: 1.7000000000000001e-002 | W274: 0.16500000000000001 | X274: 0.193 | Y274: 168 | Z274: 1.19 | AA274: -1.3999999999999999e-002 | AB274: -2.0299999999999999e-002 | AC274: -7.6299999999999993e-002 | AD274: -7.8899999999999998e-002 | AE274: 95.26 | AF274: 97.68 | AG274: 0.73 | AH274: AA+ | AI274: 4.1500000000000002e-002 | AJ274: =H274+100*O274 -> 120.98 | AK274: 121.3 | AL274: 103 | AM274: 23.6 | AN274: 49 | AO274: 7.400000000000001e-002 | AP274: 9 | AQ274: 福能转债!
A275: 266 | B275: 110051 | C275: 中天转债! | D275: 600522 | E275: 中天科技 | F275: 通信互联 | G275: 通信设备 | H275: 120.45 | I275: 1.2199999999999999e-002 | J275: 1.1299999999999999e-002 | K275: 11.8 | L275: 3.2400000000000005e-002 | M275: 113.3 | N275: 10.09 | O275: 2.9999999999999999e-002 | P275: 116.95 | Q275: 转股中 | R275: 3.95年 | S275: 1.95年 | T275: 39.6 | U275: 217 | V275: 4.4999999999999998e-002 | W275: 0.11 | X275: 0.128 | Y275: 362 | Z275: 1.58 | AA275: -1.5600000000000001e-002 | AB275: -2.1600000000000001e-002 | AC275: -7.2599999999999998e-002 | AD275: -7.4900000000000008e-002 | AE275: 94.38 | AF275: 96.77 | AG275: 0.73 | AH275: AA+ | AI275: 4.1500000000000002e-002 | AJ275: =H275+100*O275 -> 123.45 | AK275: 124 | AL275: 136 | AM275: 27.2 | AN275: 83 | AO275: 6.6000000000000003e-002 | AP275: 26 | AQ275: 中天转债!
A276: 251 | B276: 123025 | C276: 精测转债!! | D276: 300567 | E276: 精测电子 | F276: 电子 | G276: 液晶显示 | H276: 125.443 | I276: -5.1999999999999998e-003 | J276: -4.0000000000000002e-004 | K276: 55.6 | L276: -8.0000000000000002e-003 | M276: 117.3 | N276: 49.95 | O276: 0.127 | P276: 111.31 | Q276: 转股中 | R276: 4年9天 | S276: 2年10天 | T276: 3.09 | U276: 6.1 | V276: 1.6e-002 | W276: 2.3e-002 | X276: 2.5000000000000001e-002 | Y276: 137 | Z276: 8.83 | AA276: -1.6899999999999998e-002 | AB276: -2.4300000000000002e-002 | AC276: -8.4399999999999989e-002 | AD276: -8.72e-002 | AE276: 90.53 | AF276: 91.79 | AG276: 0.69 | AH276: AA- | AI276: 6.4500000000000002e-002 | AJ276: =H276+100*O276 -> 138.143 | AK276: 139.6 | AL276: 259 | AM276: 47.8 | AN276: 257 | AO276: 2.1000000000000001e-002 | AP276: 17 | AQ276: 精测转债!!
A277: 302 | B277: 127005 | C277: 长证转债! | D277: 783 | E277: 长江证券 | F277: 金融 | G277: 证券行业 | H277: 113.91 | I277: -9.4999999999999998e-003 | J277: 6.7000000000000002e-003 | K277: 7.01 | L277: -5.6999999999999993e-003 | M277: 108.3 | N277: 7.28 | O277: 0.183 | P277: 96.29 | Q277: 转股中 | R277: 2.98年 | S277: 无权 | T277: 50 | U277: 64 | V277: 1.1000000000000001e-002 | W277: 0.129 | X277: 0.124 | Y277: 388 | Z277: 1.38 | AA277: -1.7000000000000001e-002 | AB277: -2.2099999999999998e-002 | AC277: 无权 | AD277: 无权 | AE277: 无权 | AF277: 97.29 | AG277: 0.5 | AH277: AAA | AI277: 3.7200000000000004e-002 | AJ277: =H277+100*O277 -> 132.21000000000001 | AK277: 131.5 | AL277: 210 | AM277: 34.2 | AN277: 157 | AO277: -2.6000000000000002e-002 | AP277: 15 | AQ277: 长证转债!
A278: 288 | B278: 123012 | C278: 万顺转债! | D278: 300057 | E278: 万顺新材 | F278: 有色金属 | G278: 铝金属 | H278: 117.3 | I278: -1.6799999999999999e-002 | J278: 1.6799999999999999e-002 | K278: 4.87 | L278: 0. | M278: 110.3 | N278: 5.31 | O278: 0.27899999999999997 | P278: 91.71 | Q278: 转股中 | R278: 3.33年 | S278: 1.34年 | T278: 1.29 | U278: 29 | V278: 0.192 | W278: 3.9e-002 | X278: 3.6000000000000004e-002 | Y278: 33 | Z278: 0.96 | AA278: -1.8700000000000001e-002 | AB278: -2.4199999999999999e-002 | AC278: -8.4700000000000011e-002 | AD278: -8.7899999999999992e-002 | AE278: 93.66 | AF278: 89.96 | AG278: 0.52 | AH278: AA- | AI278: 6.4500000000000002e-002 | AJ278: =H278+100*O278 -> 145.19999999999999 | AK278: 142.9 | AL278: 270 | AM278: 49.2 | AN278: 264 | AO278: -3.0000000000000001e-003 | AP278: 20 | AQ278: 万顺转债!
A279: 186 | B279: 127015 | C279: 希望转债! | D279: 876 | E279: 新 希 望 | F279: 农业 | G279: 畜牧业 | H279: 120.29 | I279: -6.7000000000000002e-003 | J279: -8.3999999999999995e-003 | K279: 20.89 | L279: -1.7899999999999999e-002 | M279: 110 | N279: 19.75 | O279: 0.13699999999999998 | P279: 105.77 | Q279: 转股中 | R279: 4.79年 | S279: 2.79年 | T279: 9.5 | U279: 13 | V279: 1.2e-002 | W279: 1.e-002 | X279: 1.1000000000000001e-002 | Y279: 941 | Z279: 2.6 | AA279: -1.8799999999999997e-002 | AB279: -2.2499999999999999e-002 | AC279: -5.2400000000000002e-002 | AD279: -5.4000000000000006e-002 | AE279: 91.87 | AF279: 92.04 | AG279: 0.84 | AH279: AAA | AI279: 3.85e-002 | AJ279: =H279+100*O279 -> 133.99000000000001 | AK279: 134.8 | AL279: 234 | AM279: 42.8 | AN279: 222 | AO279: -0.10400000000000001 | AP279: 28 | AQ279: 希望转债!
A280: 4 | B280: 123098 | C280: 一品转债 | D280: 300723 | E280: 一品红 | F280: 医药 | G280: 医药行业 | H280: 138.42 | I280: 3.8e-003 | J280: -2.3999999999999998e-003 | K280: 50.25 | L280: 2.e-003 | M280: 124 | N280: 45.78 | O280: 0.26100000000000001 | P280: 109.76 | Q280: 4月17天 | R280: 5.86年 | S280: 3.86年 | T280: 4.8 | U280: 9 | V280: 1.3999999999999999e-002 | W280: 5.9000000000000004e-002 | X280: 6.5000000000000002e-002 | Y280: 81 | Z280: 5.52 | AA280: -1.89e-002 | AB280: -2.5499999999999998e-002 | AC280: -6.9199999999999998e-002 | AD280: -7.0900000000000005e-002 | AE280: 80.49 | AF280: 85.82 | AG280: 0.71 | AH280: AA- | AI280: 6.6100000000000006e-002 | AJ280: =H280+100*O280 -> 164.51999999999998 | AK280: 167.1 | AL280: 308 | AM280: 81.3 | AN280: 311 | AO280: 3.6000000000000004e-002 | AP280: 2 | AQ280: 一品转债
A281: 182 | B281: 128096 | C281: 奥瑞转债!! | D281: 2701 | E281: 奥瑞金 | F281: 造纸包装 | G281: 包装材料 | H281: 126.956 | I281: 1.7399999999999999e-002 | J281: -3.4999999999999996e-003 | K281: 5.71 | L281: 1.78e-002 | M281: 115.5 | N281: 4.54 | O281: 9.0000000000000011e-003 | P281: 125.77 | Q281: 转股中 | R281: 4.90年 | S281: 2.90年 | T281: 7.07 | U281: 66 | V281: 7.4999999999999997e-002 | W281: 5.0999999999999997e-002 | X281: 6.4000000000000001e-002 | Y281: 138 | Z281: 2.31 | AA281: -1.95e-002 | AB281: -2.4900000000000002e-002 | AC281: -6.4000000000000001e-002 | AD281: -6.6199999999999995e-002 | AE281: 91.77 | AF281: 95.04 | AG281: 0.78 | AH281: AA+ | AI281: 4.1500000000000002e-002 | AJ281: =H281+100*O281 -> 127.85600000000001 | AK281: 128.1 | AL281: 179 | AM281: 33.1 | AN281: 145 | AO281: 9.3000000000000013e-002 | AP281: 20 | AQ281: 奥瑞转债!!
A282: 17 | B282: 123091 | C282: 长海转债 | D282: 300196 | E282: 长海股份 | F282: 其他 | G282: 非金属矿 | H282: 130.6 | I282: -3.2599999999999997e-002 | J282: 8.3999999999999995e-003 | K282: 16.6 | L282: -3.8199999999999998e-002 | M282: 116.2 | N282: 16.24 | O282: 0.27800000000000002 | P282: 102.22 | Q282: 3月12天 | R282: 5.76年 | S282: 3.76年 | T282: 5.5 | U282: 46 | V282: 6.4000000000000001e-002 | W282: 8.1000000000000003e-002 | X282: 8.3000000000000004e-002 | Y282: 68 | Z282: 2.43 | AA282: -2.0400000000000001e-002 | AB282: -2.52e-002 | AC282: -5.74e-002 | AD282: -5.9000000000000004e-002 | AE282: 87.33 | AF282: 90.54 | AG282: 0.63 | AH282: AA | AI282: 4.5100000000000001e-002 | AJ282: =H282+100*O282 -> 158.40000000000001 | AK282: 159 | AL282: 304 | AM282: 68.4 | AN282: 304 | AO282: -6.9000000000000006e-002 | AP282: 3 | AQ282: 长海转债
A283: 298 | B283: 113508 | C283: 新凤转债! | D283: 603225 | E283: 新凤鸣 | F283: 服装纺织 | G283: 纺织行业 | H283: 119.99 | I283: -3.4700000000000002e-002 | J283: 4.0000000000000001e-003 | K283: 16.66 | L283: -5.0199999999999995e-002 | M283: 112.3 | N283: 15.78 | O283: 0.13699999999999998 | P283: 105.58 | Q283: 转股中 | R283: 3年37天 | S283: 1年38天 | T283: 20.7 | U283: 63 | V283: 2.5000000000000001e-002 | W283: 8.900000000000001e-002 | X283: 9.4e-002 | Y283: 233 | Z283: 2.06 | AA283: -2.1600000000000001e-002 | AB283: -2.86e-002 | AC283: -0.11 | AD283: -0.113 | AE283: 97.44 | AF283: 98.7 | AG283: 0.61 | AH283: AA | AI283: 4.3499999999999997e-002 | AJ283: =H283+100*O283 -> 133.69 | AK283: 134.4 | AL283: 229 | AM283: 35.7 | AN283: 172 | AO283: -0.11199999999999999 | AP283: 24 | AQ283: 新凤转债!
A284: 72 | B284: 128134 | C284: 鸿路转债! | D284: 2541 | E284: 鸿路钢构 | F284: 建筑 | G284: 其他 | H284: 130 | I284: 6.1999999999999998e-003 | J284: 1.1999999999999999e-003 | K284: 53.8 | L284: 9.3999999999999986e-003 | M284: 115.1 | N284: 43.74 | O284: 5.7000000000000002e-002 | P284: 123 | Q284: 27天 | R284: 5.56年 | S284: 3.56年 | T284: 18.8 | U284: 27 | V284: 1.1000000000000001e-002 | W284: 6.7000000000000004e-002 | X284: 8.199999999999999e-002 | Y284: 282 | Z284: 5.26 | AA284: -2.2000000000000002e-002 | AB284: -2.6699999999999998e-002 | AC284: -5.9500000000000004e-002 | AD284: -6.1200000000000004e-002 | AE284: 88.03 | AF284: 90.49 | AG284: 0.78 | AH284: AA | AI284: 4.5100000000000001e-002 | AJ284: =H284+100*O284 -> 135.69999999999999 | AK284: 137 | AL284: 246 | AM284: 46.5 | AN284: 246 | AO284: 8.0000000000000002e-002 | AP284: 4 | AQ284: 鸿路转债!
A285: 130 | B285: 128113 | C285: 比音转债 | D285: 2832 | E285: 比音勒芬 | F285: 服装纺织 | G285: 服装行业 | H285: 132.39 | I285: -1.1899999999999999e-002 | J285: 1.e-004 | K285: 19.81 | L285: -1.44e-002 | M285: 117.3 | N285: 14.9 | O285: -4.0000000000000001e-003 | P285: 132.95 | Q285: 转股中 | R285: 5.24年 | S285: 3.24年 | T285: 6.29 | U285: 64 | V285: 7.8e-002 | W285: 6.0999999999999999e-002 | X285: 8.1000000000000003e-002 | Y285: 104 | Z285: 4.82 | AA285: -2.3300000000000001e-002 | AB285: -2.8799999999999999e-002 | AC285: -6.9500000000000006e-002 | AD285: -7.1399999999999991e-002 | AE285: 89.46 | AF285: 93.54 | AG285: 0.82 | AH285: AA | AI285: 4.5100000000000001e-002 | AJ285: =H285+100*O285 -> 131.98999999999998 | AK285: 131.8 | AL285: 214 | AM285: 38.3 | AN285: 188 | AO285: 0.10099999999999999 | AP285: 8 | AQ285: 比音转债
A286: 194 | B286: 110065 | C286: 淮矿转债! | D286: 600985 | E286: 淮北矿业 | F286: 煤炭 | G286: 煤炭开采 | H286: 124.5 | I286: 5.3e-003 | J286: 3.7000000000000002e-003 | K286: 11.69 | L286: 1.1200000000000002e-002 | M286: 110.8 | N286: 9.33 | O286: -6.0000000000000001e-003 | P286: 125.29 | Q286: 转股中 | R286: 4.76年 | S286: 2.76年 | T286: 23.5 | U286: 188 | V286: 6.4000000000000001e-002 | W286: 9.3000000000000013e-002 | X286: 0.11599999999999999 | Y286: 254 | Z286: 1.23 | AA286: -2.46e-002 | AB286: -2.86e-002 | AC286: -6.2199999999999998e-002 | AD286: -6.4100000000000004e-002 | AE286: 92.56 | AF286: 92.87 | AG286: 0.81 | AH286: AAA | AI286: 3.85e-002 | AJ286: =H286+100*O286 -> 123.90000000000001 | AK286: 123.7 | AL286: 131 | AM286: 30.8 | AN286: 123 | AO286: 1.6e-002 | AP286: 21 | AQ286: 淮矿转债!
A287: 38 | B287: 113611 | C287: 福20转债 | D287: 603806 | E287: 福斯特 | F287: 能源电力 | G287: 太阳能 | H287: 129.16 | I287: 1.1999999999999999e-003 | J287: -1.5600000000000001e-002 | K287: 74.8 | L287: -2.2200000000000001e-002 | M287: 111.85 | N287: 73.69 | O287: 0.27200000000000002 | P287: 101.51 | Q287: 2月20天 | R287: 5.70年 | S287: 3.70年 | T287: 17 | U287: 21 | V287: 1.e-002 | W287: 2.9999999999999999e-002 | X287: 2.9999999999999999e-002 | Y287: 576 | Z287: 7.21 | AA287: -2.52e-002 | AB287: -2.8900000000000002e-002 | AC287: -5.7999999999999996e-002 | AD287: -5.9200000000000003e-002 | AE287: 86.63 | AF287: 87.28 | AG287: 0.64 | AH287: AA | AI287: 4.5100000000000001e-002 | AJ287: =H287+100*O287 -> 156.36000000000001 | AK287: 156.8 | AL287: 302 | AM287: 69.5 | AN287: 305 | AO287: -0.121 | AP287: 5 | AQ287: 福20转债
A288: 258 | B288: 110055 | C288: 伊力转债!! | D288: 600197 | E288: 伊力特 | F288: 食品饮料 | G288: 白酒 | H288: 126.62 | I288: -9.1999999999999998e-003 | J288: 1.e-004 | K288: 18.42 | L288: -1.3899999999999999e-002 | M288: 114.3 | N288: 16.81 | O288: 0.156 | P288: 109.58 | Q288: 转股中 | R288: 3.99年 | S288: 1.99年 | T288: 2.85 | U288: 34 | V288: 9.4e-002 | W288: 3.3000000000000002e-002 | X288: 3.6000000000000004e-002 | Y288: 86 | Z288: 3 | AA288: -2.58e-002 | AB288: -3.1899999999999998e-002 | AC288: -9.2699999999999991e-002 | AD288: -9.4899999999999998e-002 | AE288: 93.84 | AF288: 96.74 | AG288: 0.65 | AH288: AA | AI288: 4.3499999999999997e-002 | AJ288: =H288+100*O288 -> 142.22 | AK288: 143.7 | AL288: 272 | AM288: 46.9 | AN288: 250 | AO288: -5.5e-002 | AP288: 24 | AQ288: 伊力转债!!
A289: 70 | B289: 110075 | C289: 南航转债 | D289: 600029 | E289: 南方航空 | F289: 交通运输 | G289: 航空运输 | H289: 129.7 | I289: -1.41e-002 | J289: -5.7999999999999996e-003 | K289: 6.85 | L289: -2.8399999999999998e-002 | M289: 110 | N289: 6.24 | O289: 0.182 | P289: 109.78 | Q289: 33天 | R289: 5.57年 | S289: 3.58年 | T289: 160 | U289: 68 | V289: 3.0000000000000001e-003 | W289: 0.152 | X289: 0.16699999999999998 | Y289: 1050. | Z289: 1.46 | AA289: -2.9500000000000002e-002 | AB289: -3.2599999999999997e-002 | AC289: -6.1900000000000004e-002 | AD289: -6.2899999999999998e-002 | AE289: 88.34 | AF289: 88.6 | AG289: 0.7 | AH289: AAA | AI289: 4.0099999999999997e-002 | AJ289: =H289+100*O289 -> 147.89999999999998 | AK289: 149.6 | AL289: 290 | AM289: 61 | AN289: 293 | AO289: 6.8000000000000005e-002 | AP289: 8 | AQ289: 南航转债
A290: 185 | B290: 123042 | C290: 银河转债! | D290: 300619 | E290: 金银河 | F290: 机械装备 | G290: 专用设备 | H290: 133 | I290: -1.26e-002 | J290: 2.2000000000000001e-003 | K290: 21.34 | L290: -1.7500000000000002e-002 | M290: 115.4 | N290: 24.4 | O290: 0.52100000000000002 | P290: 87.46 | Q290: 转股中 | R290: 4.82年 | S290: 2.82年 | T290: 1.67 | U290: 433 | V290: 1.9199999999999999 | W290: 0.105 | X290: 9.1999999999999998e-002 | Y290: 16 | Z290: 3.26 | AA290: -2.9600000000000001e-002 | AB290: -3.5000000000000003e-002 | AC290: -8.0500000000000002e-002 | AD290: -8.2599999999999993e-002 | AE290: 83.64 | AF290: 81.88 | AG290: 0.6 | AH290: A+ | AI290: 7.5499999999999998e-002 | AJ290: =H290+100*O290 -> 185.09999999999999 | AK290: 178.5 | AL290: 319 | AM290: 94.9 | AN290: 320 | AO290: 5.5999999999999994e-002 | AP290: 25 | AQ290: 银河转债!
A291: 158 | B291: 110069 | C291: 瀚蓝转债 | D291: 600323 | E291: 瀚蓝环境 | F291: 城市公用 | G291: 三废处理 | H291: 132.2 | I291: -1.8600000000000002e-002 | J291: -2.3999999999999998e-003 | K291: 26.68 | L291: -2.52e-002 | M291: 113.5 | N291: 20.2 | O291: 1.e-003 | P291: 132.08 | Q291: 转股中 | R291: 5年18天 | S291: 3年19天 | T291: 9.71 | U291: 40 | V291: 3.1e-002 | W291: 4.7e-002 | X291: 6.3e-002 | Y291: 205 | Z291: 2.85 | AA291: -3.0099999999999998e-002 | AB291: -3.4700000000000002e-002 | AC291: -7.7100000000000002e-002 | AD291: -7.8299999999999995e-002 | AE291: 89.35 | AF291: 91.98 | AG291: 0.83 | AH291: AA+ | AI291: 4.3099999999999999e-002 | AJ291: =H291+100*O291 -> 132.29999999999998 | AK291: 132.3 | AL291: 217 | AM291: 40.3 | AN291: 205 | AO291: 3.6000000000000004e-002 | AP291: 9 | AQ291: 瀚蓝转债
A292: 208 | B292: 110061 | C292: 川投转债 | D292: 600674 | E292: 川投能源 | F292: 能源电力 | G292: 水电 | H292: 127.55 | I292: -1.1200000000000002e-002 | J292: 5.1999999999999998e-003 | K292: 11.88 | L292: -7.4999999999999997e-003 | M292: 110.8 | N292: 9.58 | O292: 2.8999999999999998e-002 | P292: 124.01 | Q292: 转股中 | R292: 4.65年 | S292: 2.65年 | T292: 39.8 | U292: 89 | V292: 1.7000000000000001e-002 | W292: 7.5999999999999998e-002 | X292: 9.4e-002 | Y292: 523 | Z292: 1.89 | AA292: -3.04e-002 | AB292: -3.44e-002 | AC292: -7.2700000000000001e-002 | AD292: -7.4700000000000003e-002 | AE292: 92.96 | AF292: 93.28 | AG292: 0.8 | AH292: AAA | AI292: 3.85e-002 | AJ292: =H292+100*O292 -> 130.44999999999999 | AK292: 131.1 | AL292: 206 | AM292: 37.8 | AN292: 185 | AO292: 4.9000000000000002e-002 | AP292: 16 | AQ292: 川投转债
A293: 337 | B293: 110034 | C293: 九州转债! | D293: 600998 | E293: 九州通 | F293: 医药 | G293: 医药商业 | H293: 110.85 | I293: 3.2000000000000002e-003 | J293: -1.8e-003 | K293: 18.42 | L293: 3.8e-003 | M293: 108 | N293: 18.32 | O293: 0.10199999999999999 | P293: 100.55 | Q293: 转股中 | R293: 0.83年 | S293: 回售内 | T293: 15 | U293: 10 | V293: 6.0000000000000001e-003 | W293: 4.2999999999999997e-002 | X293: 4.4000000000000004e-002 | Y293: 345 | Z293: 1.84 | AA293: -3.1e-002 | AB293: -4.8300000000000003e-002 | AC293: 回售内 | AD293: 回售内 | AE293: 103 | AF293: 104.77 | AG293: 0.36 | AH293: AA+ | AI293: 3.7400000000000003e-002 | AJ293: =H293+100*O293 -> 121.05 | AK293: 121.2 | AL293: 101 | AM293: 16.4 | AN293: 12 | AO293: 5.0999999999999997e-002 | AP293: 26 | AQ293: 九州转债!
A294: 257 | B294: 123022 | C294: 长信转债!! | D294: 300088 | E294: 长信科技 | F294: 通信互联 | G294: 通信设备 | H294: 129.459 | I294: -7.3000000000000001e-003 | J294: 1.2999999999999999e-003 | K294: 7.49 | L294: -7.9000000000000008e-003 | M294: 114.3 | N294: 6.15 | O294: 6.3e-002 | P294: 121.79 | Q294: 转股中 | R294: 3.99年 | S294: 1.998年 | T294: 2.57 | U294: 4.3 | V294: 1.3000000000000001e-002 | W294: 1.3999999999999999e-002 | X294: 1.7000000000000001e-002 | Y294: 184 | Z294: 2.66 | AA294: -3.1200000000000002e-002 | AB294: -3.73e-002 | AC294: -0.10099999999999999 | AD294: -0.10400000000000001 | AE294: 93.81 | AF294: 96.7 | AG294: 0.76 | AH294: AA | AI294: 4.3499999999999997e-002 | AJ294: =H294+100*O294 -> 135.75900000000001 | AK294: 137.1 | AL294: 247 | AM294: 40.4 | AN294: 206 | AO294: -6.6000000000000003e-002 | AP294: 12 | AQ294: 长信转债!!
A295: 62 | B295: 113040 | C295: 星宇转债 | D295: 601799 | E295: 星宇股份 | F295: 汽车 | G295: 零部件制 | H295: 134.08 | I295: -8.6999999999999994e-003 | J295: -1.4000000000000002e-003 | K295: 191.5 | L295: -1.3000000000000001e-002 | M295: 111.5 | N295: 158 | O295: 0.106 | P295: 121.2 | Q295: 40天 | R295: 5.59年 | S295: 3.59年 | T295: 15 | U295: 57 | V295: 2.7999999999999997e-002 | W295: 2.7999999999999997e-002 | X295: 3.4000000000000002e-002 | Y295: 529 | Z295: 9.95 | AA295: -3.2799999999999996e-002 | AB295: -3.6400000000000002e-002 | AC295: -6.9800000000000001e-002 | AD295: -7.0900000000000005e-002 | AE295: 87.33 | AF295: 88.32 | AG295: 0.78 | AH295: AA+ | AI295: 4.3099999999999999e-002 | AJ295: =H295+100*O295 -> 144.68000000000001 | AK295: 147 | AL295: 283 | AM295: 58.6 | AN295: 289 | AO295: 1.2e-002 | AP295: 5 | AQ295: 星宇转债
A296: 156 | B296: 113575 | C296: 东时转债! | D296: 603377 | E296: 东方时尚 | F296: 其他 | G296: 其他 | H296: 135.01 | I296: -3.1200000000000002e-002 | J296: 1.9099999999999999e-002 | K296: 13.43 | L296: -2.2599999999999999e-002 | M296: 113.5 | N296: 14.56 | O296: 0.46399999999999997 | P296: 92.24 | Q296: 转股中 | R296: 5年20天 | S296: 3年21天 | T296: 0.99 | U296: 100 | V296: 0.73699999999999999 | W296: 1.2e-002 | X296: 1.1000000000000001e-002 | Y296: 82 | Z296: 4.2 | AA296: -3.44e-002 | AB296: -3.9e-002 | AC296: -7.9000000000000001e-002 | AD296: -8.09e-002 | AE296: 90.22 | AF296: 91.27 | AG296: 0.54 | AH296: AA | AI296: 4.5100000000000001e-002 | AJ296: =H296+100*O296 -> 181.41 | AK296: 177.8 | AL296: 317 | AM296: 86.5 | AN296: 317 | AO296: -2.e-002 | AP296: 16 | AQ296: 东时转债!
A297: 60 | B297: 127023 | C297: 华菱转2 | D297: 932 | E297: 华菱钢铁 | F297: 钢铁 | G297: 炼钢 | H297: 135.6 | I297: -1.24e-002 | J297: -5.7999999999999996e-003 | K297: 7.47 | L297: -2.1000000000000001e-002 | M297: 110.1 | N297: 5.18 | O297: -5.9999999999999998e-002 | P297: 144.21 | Q297: 41天 | R297: 5.59年 | S297: 4.60年 | T297: 40 | U297: 573 | V297: 0.10400000000000001 | W297: 8.6999999999999994e-002 | X297: 0.126 | Y297: 458 | Z297: 1.45 | AA297: -3.7000000000000005e-002 | AB297: -4.0199999999999993e-002 | AC297: -5.3800000000000001e-002 | AD297: -5.5399999999999998e-002 | AE297: 86.78 | AF297: 88.65 | AG297: 0.87 | AH297: AAA | AI297: 4.0099999999999997e-002 | AJ297: =H297+100*O297 -> 129.59999999999999 | AK297: 127 | AL297: 168 | AM297: 38.3 | AN297: 189 | AO297: 0.10800000000000001 | AP297: 11 | AQ297: 华菱转2
A298: 131 | B298: 128111 | C298: 中矿转债! | D298: 2738 | E298: 中矿资源 | F298: 有色金属 | G298: 有色行业 | H298: 151.879 | I298: -3.5699999999999996e-002 | J298: -4.4000000000000003e-003 | K298: 23.26 | L298: -4.6300000000000001e-002 | M298: 124.7 | N298: 15.47 | O298: 1.e-002 | P298: 150.36 | Q298: 转股中 | R298: 5.23年 | S298: 3.23年 | T298: 2.3 | U298: 73 | V298: 0.20699999999999999 | W298: 3.1e-002 | X298: 4.7e-002 | Y298: 74 | Z298: 2.4 | AA298: -3.78e-002 | AB298: -4.5199999999999997e-002 | AC298: -0.10300000000000001 | AD298: -0.105 | AE298: 84.43 | AF298: 89.98 | AG298: 0.86 | AH298: AA- | AI298: 6.6100000000000006e-002 | AJ298: =H298+100*O298 -> 152.87899999999999 | AK298: 153.4 | AL298: 297 | AM298: 63.4 | AN298: 298 | AO298: -0.10300000000000001 | AP298: 8 | AQ298: 中矿转债!
A299: 14 | B299: 113616 | C299: 韦尔转债 | D299: 603501 | E299: 韦尔股份 | F299: 电子 | G299: 元器件制 | H299: 143.36 | I299: 3.2000000000000002e-003 | J299: -3.7000000000000002e-003 | K299: 258.43 | L299: -7.000000000000001e-004 | M299: 114.5 | N299: 222.83 | O299: 0.23600000000000002 | P299: 115.98 | Q299: 3月18天 | R299: 5.78年 | S299: 3.78年 | T299: 24.4 | U299: 116 | V299: 3.3000000000000002e-002 | W299: 1.1000000000000001e-002 | X299: 1.3000000000000001e-002 | Y299: 2242. | Z299: 22.13 | AA299: -3.8699999999999998e-002 | AB299: -4.2900000000000001e-002 | AC299: -8.0799999999999997e-002 | AD299: -8.199999999999999e-002 | AE299: 87.29 | AF299: 90.05 | AG299: 0.74 | AH299: AA+ | AI299: 4.3099999999999999e-002 | AJ299: =H299+100*O299 -> 166.96000000000001 | AK299: 170.7 | AL299: 311 | AM299: 80.7 | AN299: 310 | AO299: -5.2000000000000005e-002 | AP299: 7 | AQ299: 韦尔转债
A300: 180 | B300: 128097 | C300: 奥佳转债! | D300: 2614 | E300: 奥佳华 | F300: 机械装备 | G300: 专用设备 | H300: 140 | I300: 3.5499999999999997e-002 | J300: 9.5999999999999992e-003 | K300: 14.39 | L300: 5.5e-002 | M300: 114.9 | N300: 10.69 | O300: 4.0000000000000001e-002 | P300: 134.61 | Q300: 转股中 | R300: 4.94年 | S300: 2.94年 | T300: 5.85 | U300: 101 | V300: 0.122 | W300: 6.6000000000000003e-002 | X300: 8.8000000000000009e-002 | Y300: 89 | Z300: 2.1 | AA300: -3.9900000000000005e-002 | AB300: -4.4900000000000002e-002 | AC300: -9.3599999999999989e-002 | AD300: -9.5399999999999985e-002 | AE300: 90.69 | AF300: 93.48 | AG300: 0.82 | AH300: AA | AI300: 4.3499999999999997e-002 | AJ300: =H300+100*O300 -> 144. | AK300: 145.4 | AL300: 277 | AM300: 51.9 | AN300: 271 | AO300: 3.4000000000000002e-002 | AP300: 24 | AQ300: 奥佳转债!
A301: 216 | B301: 128079 | C301: 英联转债! | D301: 2846 | E301: 英联股份 | F301: 造纸包装 | G301: 包装材料 | H301: 141.81 | I301: 7.4299999999999991e-002 | J301: -3.0200000000000001e-002 | K301: 17.75 | L301: 4.41e-002 | M301: 117.5 | N301: 13.41 | O301: 7.0999999999999994e-002 | P301: 132.36 | Q301: 转股中 | R301: 4.59年 | S301: 2.59年 | T301: 1.52 | U301: 4808. | V301: 21.670000000000002 | W301: 4.2999999999999997e-002 | X301: 5.7000000000000002e-002 | Y301: 35 | Z301: 4.55 | AA301: -4.0899999999999999e-002 | AB301: -4.7199999999999999e-002 | AC301: -0.107 | AD301: -0.109 | AE301: 84.98 | AF301: 84.75 | AG301: 1 | AH301: A+ | AI301: 7.5499999999999998e-002 | AJ301: =H301+100*O301 -> 148.91 | AK301: 151.3 | AL301: 291 | AM301: 66.3 | AN301: 301 | AO301: 8.4000000000000005e-002 | AP301: 20 | AQ301: 英联转债!
A302: 306 | B302: 110043 | C302: 无锡转债! | D302: 600908 | E302: 无锡银行 | F302: 金融 | G302: 银行行业 | H302: 124.24 | I302: 2.0000000000000001e-004 | J302: -1.06e-002 | K302: 6.55 | L302: -1.4999999999999999e-002 | M302: 108.3 | N302: 5.79 | O302: 9.8000000000000004e-002 | P302: 113.13 | Q302: 转股中 | R302: 2.87年 | S302: 无权 | T302: 29.2 | U302: 43 | V302: 1.2e-002 | W302: 0.24100000000000002 | X302: 0.27300000000000002 | Y302: 121 | Z302: 1.06 | AA302: -4.7199999999999999e-002 | AB302: -5.2300000000000006e-002 | AC302: 无权 | AD302: 无权 | AE302: 无权 | AF302: 96.84 | AG302: 0.69 | AH302: AA+ | AI302: 4.0199999999999993e-002 | AJ302: =H302+100*O302 -> 134.03999999999999 | AK302: 135.4 | AL302: 239 | AM302: 38.5 | AN302: 191 | AO302: -6.7000000000000004e-002 | AP302: 27 | AQ302: 无锡转债!
A303: 176 | B303: 110066 | C303: 盛屯转债!! | D303: 600711 | E303: 盛屯矿业 | F303: 有色金属 | G303: 有色行业 | H303: 145.43 | I303: -2.8500000000000001e-002 | J303: 4.5000000000000005e-003 | K303: 6.92 | L303: -2.81e-002 | M303: 114.9 | N303: 4.88 | O303: 2.6000000000000002e-002 | P303: 141.8 | Q303: 转股中 | R303: 4.95年 | S303: 2.95年 | T303: 6.02 | U303: 92 | V303: 0.10400000000000001 | W303: 3.3000000000000002e-002 | X303: 4.7e-002 | Y303: 183 | Z303: 1.74 | AA303: -4.7199999999999999e-002 | AB303: -5.2199999999999996e-002 | AC303: -0.10300000000000001 | AD303: -0.10400000000000001 | AE303: 90.63 | AF303: 93.42 | AG303: 0.85 | AH303: AA | AI303: 4.3499999999999997e-002 | AJ303: =H303+100*O303 -> 148.03 | AK303: 149.1 | AL303: 288 | AM303: 55.6 | AN303: 283 | AO303: -0.125 | AP303: 38 | AQ303: 盛屯转债!!
A304: 164 | B304: 123046 | C304: 天铁转债! | D304: 300587 | E304: 天铁股份 | F304: 铁路 | G304: 铁路设备 | H304: 151.411 | I304: 9.3999999999999986e-003 | J304: 5.0000000000000001e-004 | K304: 15.28 | L304: 1.1299999999999999e-002 | M304: 118.2 | N304: 10.12 | O304: 3.0000000000000001e-003 | P304: 150.99 | Q304: 转股中 | R304: 4.998年 | S304: 3年0.1天 | T304: 0.99 | U304: 218 | V304: 1.4399999999999999 | W304: 1.9e-002 | X304: 2.8999999999999998e-002 | Y304: 52 | Z304: 3.75 | AA304: -5.0000000000000003e-002 | AB304: -5.57e-002 | AC304: -0.11199999999999999 | AD304: -0.113 | AE304: 85.16 | AF304: 86.67 | AG304: 0.88 | AH304: AA- | AI304: 6.4500000000000002e-002 | AJ304: =H304+100*O304 -> 151.71100000000001 | AK304: 151.8 | AL304: 293 | AM304: 65.2 | AN304: 300 | AO304: 7.8e-002 | AP304: 12 | AQ304: 天铁转债!
A305: 94 | B305: 113038 | C305: 隆20转债!* | D305: 601012 | E305: 隆基股份 | F305: 能源电力 | G305: 太阳能 | H305: 149.75 | I305: -4.7500000000000001e-002 | J305: 5.9999999999999995e-004 | K305: 78.96 | L305: -4.7e-002 | M305: 111.8 | N305: 52.59 | O305: -3.0000000000000001e-003 | P305: 150.14 | Q305: 转股中 | R305: 5.36年 | S305: 3.37年 | T305: 18.2 | U305: 984 | V305: 0.35999999999999999 | W305: 6.0000000000000001e-003 | X305: 9.0000000000000011e-003 | Y305: 2978. | Z305: 9.18 | AA305: -5.3800000000000001e-002 | AB305: -5.7500000000000002e-002 | AC305: -0.10000000000000001 | AD305: -0.10199999999999999 | AE305: 90 | AF305: 90.88 | AG305: 1 | AH305: AAA | AI305: 4.0099999999999997e-002 | AJ305: =H305+100*O305 -> 149.44999999999999 | AK305: 149.4 | AL305: 289 | AM305: 58.5 | AN305: 288 | AO305: -0.187 | AP305: 13 | AQ305: 隆20转债!*
A306: 67 | B306: 127022 | C306: 恒逸转债 | D306: 703 | E306: 恒逸石化 | F306: 化工 | G306: 化工 | H306: 148 | I306: -1.9900000000000001e-002 | J306: -1.54e-002 | K306: 16.19 | L306: -3.9699999999999999e-002 | M306: 108.9 | N306: 11.5 | O306: 5.0999999999999997e-002 | P306: 140.78 | Q306: 34天 | R306: 5.58年 | S306: 3.58年 | T306: 20 | U306: 93 | V306: 3.1e-002 | W306: 3.4000000000000002e-002 | X306: 4.7e-002 | Y306: 596 | Z306: 2.38 | AA306: -5.4199999999999998e-002 | AB306: -5.6900000000000006e-002 | AC306: -9.35e-002 | AD306: -9.4700000000000006e-002 | AE306: 87.73 | AF306: 86.35 | AG306: 0.89 | AH306: AA+ | AI306: 4.3099999999999999e-002 | AJ306: =H306+100*O306 -> 153.09999999999999 | AK306: 155.2 | AL306: 300 | AM306: 67.5 | AN306: 303 | AO306: -5.7999999999999996e-002 | AP306: 6 | AQ306: 恒逸转债
A307: 235 | B307: 123027 | C307: 蓝晓转债! | D307: 300487 | E307: 蓝晓科技 | F307: 化工 | G307: 化工 | H307: 150.501 | I307: -2.2700000000000001e-002 | J307: 3.7000000000000002e-003 | K307: 40 | L307: -2.3e-002 | M307: 119.5 | N307: 29.33 | O307: 0.10400000000000001 | P307: 136.38 | Q307: 转股中 | R307: 4.23年 | S307: 2.23年 | T307: 1.08 | U307: 58 | V307: 0.35600000000000004 | W307: 1.3000000000000001e-002 | X307: 1.7000000000000001e-002 | Y307: 86 | Z307: 5.4 | AA307: -5.4400000000000004e-002 | AB307: -6.1699999999999998e-002 | AC307: -0.106 | AD307: -0.10800000000000001 | AE307: 87.92 | AF307: 88.61 | AG307: 0.83 | AH307: A+ | AI307: 7.5499999999999998e-002 | AJ307: =H307+100*O307 -> 160.90100000000001 | AK307: 164.6 | AL307: 307 | AM307: 76 | AN307: 309 | AO307: -3.4000000000000002e-002 | AP307: 21 | AQ307: 蓝晓转债!
A308: 161 | B308: 128103 | C308: 同德转债! | D308: 2360 | E308: 同德化工 | F308: 化工 | G308: 化工 | H308: 161 | I308: -9.7999999999999997e-003 | J308: -9.1999999999999998e-003 | K308: 7.72 | L308: -1.9099999999999999e-002 | M308: 121.8 | N308: 5.18 | O308: 8.0000000000000002e-002 | P308: 149.03 | Q308: 转股中 | R308: 5年6.1天 | S308: 3年7天 | T308: 1.09 | U308: 106 | V308: 0.60099999999999998 | W308: 3.5000000000000003e-002 | X308: 5.2999999999999999e-002 | Y308: 31 | Z308: 2.52 | AA308: -5.5300000000000002e-002 | AB308: -6.2e-002 | AC308: -0.125 | AD308: -0.127 | AE308: 82.93 | AF308: 84.75 | AG308: 1 | AH308: A+ | AI308: 7.7100000000000002e-002 | AJ308: =H308+100*O308 -> 169. | AK308: 173 | AL308: 313 | AM308: 88.2 | AN308: 319 | AO308: -8.3000000000000004e-002 | AP308: 14 | AQ308: 同德转债!
A309: 299 | B309: 128036 | C309: 金农转债!! | D309: 2548 | E309: 金新农 | F309: 农业 | G309: 畜牧业 | H309: 129.6 | I309: -3.4999999999999996e-003 | J309: 3.0999999999999999e-003 | K309: 7.2 | L309: -1.23e-002 | M309: 109.3 | N309: 6.96 | O309: 0.253 | P309: 103.45 | Q309: 转股中 | R309: 2.97年 | S309: 0.97年 | T309: 1.46 | U309: 56 | V309: 0.29299999999999998 | W309: 2.8999999999999998e-002 | X309: 2.9999999999999999e-002 | Y309: 50 | Z309: 1.9 | AA309: -5.6500000000000002e-002 | AB309: -6.1799999999999994e-002 | AC309: -0.185 | AD309: -0.188 | AE309: 94.95 | AF309: 91.35 | AG309: 0.03 | AH309: AA- | AI309: 6.3200000000000006e-002 | AJ309: =H309+100*O309 -> 154.90000000000001 | AK309: 155.8 | AL309: 301 | AM309: 60.8 | AN309: 292 | AO309: -5.2999999999999999e-002 | AP309: 17 | AQ309: 金农转债!!
A310: 281 | B310: 128046 | C310: 利尔转债!! | D310: 2258 | E310: 利尔化学 | F310: 化工 | G310: 农化 | H310: 138.399 | I310: -1.2800000000000001e-002 | J310: -1.01e-002 | K310: 24.75 | L310: -2.29e-002 | M310: 112.3 | N310: 18.62 | O310: 4.0999999999999995e-002 | P310: 132.92 | Q310: 转股中 | R310: 3.58年 | S310: 1.58年 | T310: 8.47 | U310: 26 | V310: 2.2000000000000002e-002 | W310: 6.5000000000000002e-002 | X310: 8.6999999999999994e-002 | Y310: 130 | Z310: 3.44 | AA310: -5.7699999999999994e-002 | AB310: -6.3399999999999998e-002 | AC310: -0.13400000000000001 | AD310: -0.13600000000000001 | AE310: 95.49 | AF310: 96.72 | AG310: 1 | AH310: AA | AI310: 4.3499999999999997e-002 | AJ310: =H310+100*O310 -> 142.499 | AK310: 143.9 | AL310: 273 | AM310: 47.2 | AN310: 252 | AO310: -3.7999999999999999e-002 | AP310: 10 | AQ310: 利尔转债!!
A311: 285 | B311: 123014 | C311: 凯发转债! | D311: 300407 | E311: 凯发电气 | F311: 能源电力 | G311: 电力设备 | H311: 125.4 | I311: -1.01e-002 | J311: 2.4399999999999998e-002 | K311: 7.6 | L311: 2.8399999999999998e-002 | M311: 108.5 | N311: 8.12 | O311: 0.34000000000000002 | P311: 93.6 | Q311: 转股中 | R311: 2.36年 | S311: 0.36年 | T311: 1.16 | U311: 53 | V311: 0.36299999999999999 | W311: 5.0000000000000003e-002 | X311: 4.7e-002 | Y311: 23 | Z311: 1.72 | AA311: -6.0400000000000002e-002 | AB311: -6.6500000000000004e-002 | AC311: -0.38900000000000001 | AD311: -0.39299999999999996 | AE311: 97.54 | AF311: 91.89 | AG311: 0.5 | AH311: A+ | AI311: 7.4200000000000002e-002 | AJ311: =H311+100*O311 -> 159.40000000000001 | AK311: 157.2 | AL311: 303 | AM311: 59.7 | AN311: 291 | AO311: 6.8000000000000005e-002 | AP311: 17 | AQ311: 凯发转债!
A312: 304 | B312: 113504 | C312: 艾华转债!! | D312: 603989 | E312: 艾华集团 | F312: 电子 | G312: 元器件制 | H312: 132.26 | I312: 1.2999999999999999e-003 | J312: -5.6000000000000008e-003 | K312: 26.5 | L312: -5.3e-003 | M312: 109.3 | N312: 21.13 | O312: 5.5e-002 | P312: 125.41 | Q312: 转股中 | R312: 2.95年 | S312: 0.95年 | T312: 5.59 | U312: 4.5 | V312: 6.0000000000000001e-003 | W312: 5.2999999999999999e-002 | X312: 6.7000000000000004e-002 | Y312: 105 | Z312: 4.35 | AA312: -6.3399999999999998e-002 | AB312: -6.8699999999999997e-002 | AC312: -0.20300000000000001 | AD312: -0.20499999999999999 | AE312: 97.2 | AF312: 96.92 | AG312: 0.82 | AH312: AA | AI312: 4.2199999999999994e-002 | AJ312: =H312+100*O312 -> 137.75999999999999 | AK312: 139.1 | AL312: 258 | AM312: 41.9 | AN312: 216 | AO312: -1.e-003 | AP312: 9 | AQ312: 艾华转债!!
A313: 224 | B313: 123030 | C313: 九洲转债! | D313: 300040 | E313: 九洲集团 | F313: 能源电力 | G313: 电力设备 | H313: 159.7 | I313: -8.1000000000000013e-003 | J313: 1.95e-002 | K313: 8.23 | L313: 1.3500000000000002e-002 | M313: 120 | N313: 5.65 | O313: 9.6000000000000002e-002 | P313: 145.66 | Q313: 转股中 | R313: 4.42年 | S313: 2.42年 | T313: 0.97 | U313: 532 | V313: 3.3999999999999999 | W313: 3.1e-002 | X313: 4.4999999999999998e-002 | Y313: 31 | Z313: 1.43 | AA313: -6.3700000000000007e-002 | AB313: -7.0800000000000002e-002 | AC313: -0.11 | AD313: -0.11199999999999999 | AE313: 88.2 | AF313: 91.57 | AG313: 0.84 | AH313: AA- | AI313: 6.4500000000000002e-002 | AJ313: =H313+100*O313 -> 169.29999999999998 | AK313: 173.7 | AL313: 314 | AM313: 82.2 | AN313: 314 | AO313: 0.13300000000000001 | AP313: 27 | AQ313: 九洲转债!
A314: 333 | B314: 113011 | C314: 光大转债 | D314: 601818 | E314: 光大银行 | F314: 金融 | G314: 银行行业 | H314: 122.21 | I314: -1.6000000000000001e-003 | J314: -1.55e-002 | K314: 4.08 | L314: -2.63e-002 | M314: 106.8 | N314: 3.76 | O314: 0.126 | P314: 108.51 | Q314: 转股中 | R314: 1.99年 | S314: 无权 | T314: 242 | U314: 96 | V314: 3.0000000000000001e-003 | W314: 0.11 | X314: 0.11900000000000001 | Y314: 2205. | Z314: 0.65 | AA314: -6.59e-002 | AB314: -7.1800000000000003e-002 | AC314: 无权 | AD314: 无权 | AE314: 无权 | AF314: 99.36 | AG314: 0.65 | AH314: AAA | AI314: 3.7200000000000004e-002 | AJ314: =H314+100*O314 -> 134.81 | AK314: 135.9 | AL314: 241 | AM314: 36.6 | AN314: 179 | AO314: -1.9e-002 | AP314: 15 | AQ314: 光大转债
A315: 332 | B315: 113012 | C315: 骆驼转债! | D315: 601311 | E315: 骆驼股份 | F315: 汽车 | G315: 零部件制 | H315: 124.14 | I315: 9.1000000000000004e-003 | J315: -1.2999999999999999e-003 | K315: 11.7 | L315: 1.04e-002 | M315: 107.8 | N315: 10.06 | O315: 6.7000000000000004e-002 | P315: 116.3 | Q315: 转股中 | R315: 2年5.1天 | S315: 5.1天 | T315: 5.1 | U315: 137 | V315: 0.215 | W315: 3.9e-002 | X315: 4.4999999999999998e-002 | Y315: 131 | Z315: 1.96 | AA315: -6.8900000000000003e-002 | AB315: -7.5499999999999998e-002 | AC315: -1.105 | AD315: -1.1179999999999999 | AE315: 100.8 | AF315: 99.35 | AG315: 0.76 | AH315: AA | AI315: 4.2199999999999994e-002 | AJ315: =H315+100*O315 -> 130.84 | AK315: 132 | AL315: 215 | AM315: 31.2 | AN315: 129 | AO315: 8.9999999999999997e-002 | AP315: 17 | AQ315: 骆驼转债!
A316: 92 | B316: 128126 | C316: 赣锋转2! | D316: 2460 | E316: 赣锋锂业 | F316: 有色金属 | G316: 小金属 | H316: 165.198 | I316: -3.95e-002 | J316: -1.1699999999999999e-002 | K316: 96.77 | L316: -5.1299999999999998e-002 | M316: 111.1 | N316: 60.27 | O316: 2.8999999999999998e-002 | P316: 160.56 | Q316: 转股中 | R316: 5.38年 | S316: 3.38年 | T316: 20.4 | U316: 562 | V316: 0.16600000000000001 | W316: 1.6e-002 | X316: 2.5000000000000001e-002 | Y316: 1312. | Z316: 13.9 | AA316: -7.2000000000000008e-002 | AB316: -7.5300000000000006e-002 | AC316: -0.122 | AD316: -0.12300000000000001 | AE316: 88.06 | AF316: 87.96 | AG316: 1 | AH316: AA | AI316: 4.5100000000000001e-002 | AJ316: =H316+100*O316 -> 168.09800000000001 | AK316: 169.8 | AL316: 310 | AM316: 81.8 | AN316: 313 | AO316: -7.2000000000000008e-002 | AP316: 9 | AQ316: 赣锋转2!
A317: 197 | B317: 113557 | C317: 森特转债 | D317: 603098 | E317: 森特股份 | F317: 建筑 | G317: 建筑工程 | H317: 174.85 | I317: -1.84e-002 | J317: 0.111 | K317: 17.58 | L317: 0.10000000000000001 | M317: 120.3 | N317: 10.11 | O317: 6.0000000000000001e-003 | P317: 173.89 | Q317: 转股中 | R317: 4.75年 | S317: 2.75年 | T317: 2.9 | U317: 3986. | V317: 7.5700000000000003 | W317: 3.4000000000000002e-002 | X317: 5.9999999999999998e-002 | Y317: 84 | Z317: 4.07 | AA317: -7.6999999999999999e-002 | AB317: -8.3499999999999991e-002 | AC317: -0.10800000000000001 | AD317: -0.109 | AE317: 86.52 | AF317: 89.94 | AG317: 0.92 | AH317: AA- | AI317: 6.4500000000000002e-002 | AJ317: =H317+100*O317 -> 175.44999999999999 | AK317: 175.8 | AL317: 315 | AM317: 85.9 | AN317: 316 | AO317: 0.53500000000000003 | AP317: 37 | AQ317: 森特转债
A318: 181 | B318: 128095 | C318: 恩捷转债!! | D318: 2812 | E318: 恩捷股份 | F318: 电子 | G318: 元器件制 | H318: 177.8 | I318: 4.0999999999999995e-003 | J318: 3.3e-003 | K318: 116.41 | L318: 7.9000000000000008e-003 | M318: 114.9 | N318: 65.09 | O318: -6.0000000000000001e-003 | P318: 178.84 | Q318: 转股中 | R318: 4.90年 | S318: 2.90年 | T318: 7.84 | U318: 281 | V318: 0.20199999999999999 | W318: 8.0000000000000002e-003 | X318: 1.3999999999999999e-002 | Y318: 1033. | Z318: 9.37 | AA318: -8.6599999999999996e-002 | AB318: -9.1300000000000006e-002 | AC318: -0.10300000000000001 | AD318: -0.10400000000000001 | AE318: 90.84 | AF318: 93.63 | AG318: 0.94 | AH318: AA | AI318: 4.3499999999999997e-002 | AJ318: =H318+100*O318 -> 177.20000000000002 | AK318: 176.8 | AL318: 316 | AM318: 83.1 | AN318: 315 | AO318: 2.3e-002 | AP318: 16 | AQ318: 恩捷转债!!
A319: 270 | B319: 128052 | C319: 凯龙转债!* | D319: 2783 | E319: 凯龙股份 | F319: 化工 | G319: 化工 | H319: 160 | I319: -1.84e-002 | J319: 1.6399999999999998e-002 | K319: 9.9 | L319: -2.e-003 | M319: 114.3 | N319: 6.67 | O319: 7.8e-002 | P319: 148.43 | Q319: 转股中 | R319: 3.76年 | S319: 1.76年 | T319: 0.32 | U319: 262 | V319: 5.0899999999999999 | W319: 9.0000000000000011e-003 | X319: 1.3000000000000001e-002 | Y319: 37 | Z319: 2.17 | AA319: -8.6999999999999994e-002 | AB319: -9.2899999999999996e-002 | AC319: -0.16600000000000001 | AD319: -0.16800000000000001 | AE319: 94.76 | AF319: 97.69 | AG319: 1 | AH319: AA | AI319: 4.3499999999999997e-002 | AJ319: =H319+100*O319 -> 167.80000000000001 | AK319: 171.6 | AL319: 312 | AM319: 73.9 | AN319: 308 | AO319: -3.2000000000000001e-002 | AP319: 12 | AQ319: 凯龙转债!*
A320: 209 | B320: 123034 | C320: 通光转债! | D320: 300265 | E320: 通光线缆 | F320: 通信互联 | G320: 通信设备 | H320: 180.2 | I320: -3.6400000000000002e-002 | J320: 1.29e-002 | K320: 9.67 | L320: -3.0099999999999998e-002 | M320: 118 | N320: 7.97 | O320: 0.48499999999999999 | P320: 121.33 | Q320: 转股中 | R320: 4.63年 | S320: 2.63年 | T320: 0.78 | U320: 131 | V320: 0.92000000000000004 | W320: 2.2000000000000002e-002 | X320: 2.7000000000000003e-002 | Y320: 35 | Z320: 2.81 | AA320: -8.8900000000000007e-002 | AB320: -9.4700000000000006e-002 | AC320: -0.121 | AD320: -0.122 | AE320: 84.62 | AF320: 84.85 | AG320: 0.78 | AH320: A+ | AI320: 7.5499999999999998e-002 | AJ320: =H320+100*O320 -> 228.69999999999999 | AK320: 239.1 | AL320: 327 | AM320: 154.2 | AN320: 327 | AO320: 4.4999999999999998e-002 | AP320: 24 | AQ320: 通光转债!
A321: 53 | B321: 113041 | C321: 紫金转债 | D321: 601899 | E321: 紫金矿业 | F321: 有色金属 | G321: 贵金属 | H321: 166.7 | I321: -2.52e-002 | J321: -3.4000000000000002e-003 | K321: 10.83 | L321: -3.1300000000000001e-002 | M321: 108 | N321: 7 | O321: 7.6999999999999999e-002 | P321: 154.71 | Q321: 52天 | R321: 4.62年 | S321: 2.63年 | T321: 60 | U321: 354 | V321: 3.5000000000000003e-002 | W321: 2.2000000000000002e-002 | X321: 3.4000000000000002e-002 | Y321: 2759. | Z321: 5.73 | AA321: -9.0200000000000002e-002 | AB321: -9.3000000000000013e-002 | AC321: -0.111 | AD321: -0.111 | AE321: 91.22 | AF321: 90.81 | AG321: 0.91 | AH321: AAA | AI321: 3.85e-002 | AJ321: =H321+100*O321 -> 174.39999999999998 | AK321: 178.7 | AL321: 320 | AM321: 87.5 | AN321: 318 | AO321: -9.1999999999999998e-002 | AP321: 8 | AQ321: 紫金转债
A322: 325 | B322: 113016 | C322: 小康转债! | D322: 601127 | E322: 小康股份 | F322: 汽车 | G322: 零部件制 | H322: 142.53 | I322: 2.0299999999999999e-002 | J322: -4.5999999999999999e-003 | K322: 22.35 | L322: 1.7299999999999999e-002 | M322: 109.3 | N322: 15.7 | O322: 1.e-003 | P322: 142.36 | Q322: 转股中 | R322: 2.64年 | S322: 0.64年 | T322: 4.17 | U322: 1928. | V322: 3.2599999999999998 | W322: 1.4999999999999999e-002 | X322: 2.1000000000000001e-002 | Y322: 286 | Z322: 4.87 | AA322: -9.7200000000000009e-002 | AB322: -0.10300000000000001 | AC322: -0.36499999999999999 | AD322: -0.36799999999999999 | AE322: 98.49 | AF322: 98.2 | AG322: 0.91 | AH322: AA | AI322: 4.2199999999999994e-002 | AJ322: =H322+100*O322 -> 142.63 | AK322: 142.7 | AL322: 268 | AM322: 44.2 | AN322: 240 | AO322: 0.14300000000000002 | AP322: 48 | AQ322: 小康转债!
A323: 243 | B323: 113025 | C323: 明泰转债!! | D323: 601677 | E323: 明泰铝业 | F323: 有色金属 | G323: 铝金属 | H323: 175.43 | I323: -3.5400000000000001e-002 | J323: -2.6600000000000002e-002 | K323: 19.3 | L323: -6.5799999999999997e-002 | M323: 115.1 | N323: 11.2 | O323: 1.8000000000000002e-002 | P323: 172.32 | Q323: 转股中 | R323: 4年21天 | S323: 2年22天 | T323: 12.3 | U323: 295 | V323: 0.13699999999999998 | W323: 9.6000000000000002e-002 | X323: 0.16500000000000001 | Y323: 128 | Z323: 1.58 | AA323: -0.10000000000000001 | AB323: -0.106 | AC323: -0.159 | AD323: -0.161 | AE323: 94.18 | AF323: 97.22 | AG323: 0.94 | AH323: AA | AI323: 4.3499999999999997e-002 | AJ323: =H323+100*O323 -> 177.23000000000002 | AK323: 178.5 | AL323: 318 | AM323: 81.3 | AN323: 312 | AO323: 0.10099999999999999 | AP323: 28 | AQ323: 明泰转债!!
A324: 219 | B324: 113545 | C324: 金能转债! | D324: 603113 | E324: 金能科技 | F324: 煤炭 | G324: 炼焦 | H324: 206.36 | I324: -4.58e-002 | J324: -4.9599999999999998e-002 | K324: 20.61 | L324: -0.10000000000000001 | M324: 114.9 | N324: 10.78 | O324: 7.9000000000000001e-002 | P324: 191.19 | Q324: 转股中 | R324: 4.57年 | S324: 2.57年 | T324: 10.2 | U324: 172 | V324: 8.1000000000000003e-002 | W324: 5.9000000000000004e-002 | X324: 0.11199999999999999 | Y324: 175 | Z324: 2.29 | AA324: -0.122 | AB324: -0.127 | AC324: -0.14699999999999999 | AD324: -0.14800000000000002 | AE324: 92.12 | AF324: 94.95 | AG324: 0.95 | AH324: AA | AI324: 4.3499999999999997e-002 | AJ324: =H324+100*O324 -> 214.26000000000002 | AK324: 221.5 | AL324: 324 | AM324: 126.6 | AN324: 325 | AO324: -6.8000000000000005e-002 | AP324: 19 | AQ324: 金能转债!
A325: 222 | B325: 123031 | C325: 晶瑞转债! | D325: 300655 | E325: 晶瑞股份 | F325: 化工 | G325: 化工 | H325: 213.501 | I325: 1.1000000000000001e-002 | J325: -6.6e-003 | K325: 28.78 | L325: 4.8999999999999998e-003 | M325: 115.8 | N325: 18.43 | O325: 0.36700000000000005 | P325: 156.16 | Q325: 转股中 | R325: 4.44年 | S325: 2.45年 | T325: 0.63 | U325: 64 | V325: 0.48399999999999999 | W325: 1.2e-002 | X325: 1.8000000000000002e-002 | Y325: 54 | Z325: 4.23 | AA325: -0.13100000000000001 | AB325: -0.13600000000000001 | AC325: -0.16300000000000001 | AD325: -0.16399999999999998 | AE325: 85.57 | AF325: 84.35 | AG325: 0.9 | AH325: A+ | AI325: 7.5499999999999998e-002 | AJ325: =H325+100*O325 -> 250.20100000000002 | AK325: 270.8 | AL325: 329 | AM325: 185.3 | AN325: 330 | AO325: -2.7000000000000003e-002 | AP325: 17 | AQ325: 晶瑞转债!
A326: 141 | B326: 113582 | C326: 火炬转债! | D326: 603678 | E326: 火炬电子 | F326: 电子 | G326: 元器件制 | H326: 235.66 | I326: 1.8500000000000003e-002 | J326: -1.1699999999999999e-002 | K326: 55.97 | L326: 6.9999999999999993e-003 | M326: 115.3 | N326: 25.33 | O326: 6.7000000000000004e-002 | P326: 220.96 | Q326: 转股中 | R326: 5.19年 | S326: 3.19年 | T326: 4.18 | U326: 258 | V326: 0.26000000000000001 | W326: 1.6e-002 | X326: 3.6000000000000004e-002 | Y326: 257 | Z326: 7.3 | AA326: -0.13100000000000001 | AB326: -0.13500000000000001 | AC326: -0.12300000000000001 | AD326: -0.124 | AE326: 89.67 | AF326: 92.17 | AG326: 0.97 | AH326: AA | AI326: 4.5100000000000001e-002 | AJ326: =H326+100*O326 -> 242.35999999999999 | AK326: 250.4 | AL326: 328 | AM326: 158.2 | AN326: 328 | AO326: -4.2000000000000003e-002 | AP326: 6 | AQ326: 火炬转债!
A327: 228 | B327: 113543 | C327: 欧派转债! | D327: 603833 | E327: 欧派家居 | F327: 其他 | G327: 家居用品 | H327: 222.71 | I327: 1.e-002 | J327: -1.e-004 | K327: 159.59 | L327: 1.0200000000000001e-002 | M327: 114.9 | N327: 71.69 | O327: 0. | P327: 222.61 | Q327: 转股中 | R327: 4.41年 | S327: 3.41年 | T327: 5.37 | U327: 226 | V327: 0.187 | W327: 6.0000000000000001e-003 | X327: 1.2e-002 | Y327: 960 | Z327: 8.8 | AA327: -0.14199999999999999 | AB327: -0.14599999999999999 | AC327: -0.105 | AD327: -0.106 | AE327: 90.59 | AF327: 95.61 | AG327: 0.97 | AH327: AA | AI327: 4.3499999999999997e-002 | AJ327: =H327+100*O327 -> 222.71000000000001 | AK327: 222.8 | AL327: 325 | AM327: 127.2 | AN327: 326 | AO327: 6.6000000000000003e-002 | AP327: 14 | AQ327: 欧派转债!
A328: 271 | B328: 123018 | C328: 溢利转债! | D328: 300381 | E328: 溢多利 | F328: 医药 | G328: 原料药 | H328: 213.58 | I328: -6.6e-003 | J328: 7.4000000000000003e-003 | K328: 9.11 | L328: 1.1000000000000001e-003 | M328: 114.3 | N328: 8.32 | O328: 0.95099999999999996 | P328: 109.5 | Q328: 转股中 | R328: 3.75年 | S328: 1.76年 | T328: 0.54 | U328: 132 | V328: 1.1599999999999999 | W328: 1.2e-002 | X328: 1.3000000000000001e-002 | Y328: 45 | Z328: 1.54 | AA328: -0.156 | AB328: -0.161 | AC328: -0.24399999999999999 | AD328: -0.245 | AE328: 91.24 | AF328: 90.79 | AG328: 0.69 | AH328: AA- | AI328: 6.4500000000000002e-002 | AJ328: =H328+100*O328 -> 308.68000000000001 | AK328: 317.7 | AL328: 331 | AM328: 226.4 | AN328: 331 | AO328: -5.4000000000000006e-002 | AP328: 13 | AQ328: 溢利转债!
A329: 143 | B329: 113580 | C329: 康隆转债! | D329: 603665 | E329: 康隆达 | F329: 服装纺织 | G329: 服装行业 | H329: 282.48 | I329: -7.4900000000000008e-002 | J329: 7.5700000000000003e-002 | K329: 17.23 | L329: 1.1999999999999999e-003 | M329: 121.2 | N329: 15.51 | O329: 1.54 | P329: 111.09 | Q329: 转股中 | R329: 5年34天 | S329: 3年35天 | T329: 0.41 | U329: 509 | V329: 4.2599999999999998 | W329: 1.4999999999999999e-002 | X329: 1.7000000000000001e-002 | Y329: 27 | Z329: 2.67 | AA329: -0.156 | AB329: -0.161 | AC329: -0.14699999999999999 | AD329: -0.14699999999999999 | AE329: 84.73 | AF329: 88.16 | AG329: 0.7 | AH329: AA- | AI329: 6.6100000000000006e-002 | AJ329: =H329+100*O329 -> 436.48000000000002 | AK329: 453.9 | AL329: 335 | AM329: 365.7 | AN329: 335 | AO329: 1.7000000000000001e-002 | AP329: 9 | AQ329: 康隆转债!
A330: 330 | B330: 127004 | C330: 模塑转债!! | D330: 700 | E330: 模塑科技 | F330: 汽车 | G330: 零部件制 | H330: 169 | I330: -7.8000000000000005e-003 | J330: 7.8000000000000005e-003 | K330: 4.87 | L330: -2.0099999999999996e-002 | M330: 113.3 | N330: 7.46 | O330: 1.5900000000000001 | P330: 65.28 | Q330: 转股中 | R330: 2.21年 | S330: 0.21年 | T330: 1.32 | U330: 58 | V330: 0.25800000000000001 | W330: 2.9999999999999999e-002 | X330: 1.9e-002 | Y330: 45 | Z330: 1.72 | AA330: -0.16800000000000001 | AB330: -0.17699999999999999 | AC330: -1.1420000000000001 | AD330: -1.147 | AE330: 100.26 | AF330: 100.5 | AG330: 0 | AH330: AA | AI330: 4.2199999999999994e-002 | AJ330: =H330+100*O330 -> 328. | AK330: 272.7 | AL330: 330 | AM330: 172.2 | AN330: 329 | AO330: -4.8000000000000001e-002 | AP330: 35 | AQ330: 模塑转债!!
A331: 297 | B331: 113509 | C331: 新泉转债!! | D331: 603179 | E331: 新泉股份 | F331: 汽车 | G331: 零部件制 | H331: 205.06 | I331: -1.7399999999999999e-002 | J331: -1.78e-002 | K331: 31.69 | L331: -3.6200000000000003e-002 | M331: 110.3 | N331: 15.55 | O331: 6.0000000000000001e-003 | P331: 203.79 | Q331: 转股中 | R331: 3.21年 | S331: 1.21年 | T331: 0.92 | U331: 118 | V331: 0.626 | W331: 8.0000000000000002e-003 | X331: 1.6e-002 | Y331: 117 | Z331: 4.75 | AA331: -0.17899999999999999 | AB331: -0.183 | AC331: -0.34899999999999998 | AD331: -0.35100000000000003 | AE331: 97 | AF331: 96.51 | AG331: 0.97 | AH331: AA | AI331: 4.3499999999999997e-002 | AJ331: =H331+100*O331 -> 205.66 | AK331: 206.3 | AL331: 322 | AM331: 109.3 | AN331: 322 | AO331: 3.7999999999999999e-002 | AP331: 11 | AQ331: 新泉转债!!
A332: 326 | B332: 128017 | C332: 金禾转债!! | D332: 2597 | E332: 金禾实业 | F332: 化工 | G332: 化工 | H332: 183.389 | I332: -3.39e-002 | J332: -1.1399999999999999e-002 | K332: 38.88 | L332: -4.6799999999999994e-002 | M332: 108.8 | N332: 22.42 | O332: 5.7999999999999996e-002 | P332: 173.42 | Q332: 转股中 | R332: 2.62年 | S332: 0.62年 | T332: 5.52 | U332: 69 | V332: 6.7000000000000004e-002 | W332: 2.5000000000000001e-002 | X332: 4.4000000000000004e-002 | Y332: 218 | Z332: 4.73 | AA332: -0.183 | AB332: -0.187 | AC332: -0.57899999999999996 | AD332: -0.58099999999999996 | AE332: 98.3 | AF332: 97.78 | AG332: 0.97 | AH332: AA | AI332: 4.2199999999999994e-002 | AJ332: =H332+100*O332 -> 189.18900000000002 | AK332: 193.4 | AL332: 321 | AM332: 95.1 | AN332: 321 | AO332: -6.4000000000000001e-002 | AP332: 10 | AQ332: 金禾转债!!
A333: 294 | B333: 110044 | C333: 广电转债!! | D333: 600831 | E333: 广电网络 | F333: 传媒娱乐 | G333: 影视娱乐 | H333: 227.21 | I333: -1.8100000000000002e-002 | J333: 1.4199999999999999e-002 | K333: 5.77 | L333: -1.2e-002 | M333: 112.3 | N333: 6.9 | O333: 1.72 | P333: 83.62 | Q333: 转股中 | R333: 3.27年 | S333: 1.27年 | T333: 0.71 | U333: 302 | V333: 1.8200000000000001 | W333: 1.7000000000000001e-002 | X333: 1.3999999999999999e-002 | Y333: 41 | Z333: 1.11 | AA333: -0.19699999999999998 | AB333: -0.20199999999999999 | AC333: -0.36399999999999999 | AD333: -0.36499999999999999 | AE333: 96.74 | AF333: 97.99 | AG333: 0.33 | AH333: AA | AI333: 4.3499999999999997e-002 | AJ333: =H333+100*O333 -> 399.21000000000004 | AK333: 370.8 | AL333: 332 | AM333: 272.8 | AN333: 332 | AO333: -5.0000000000000001e-003 | AP333: 12 | AQ333: 广电转债!!
A334: 283 | B334: 123015 | C334: 蓝盾转债!! | D334: 300297 | E334: 蓝盾股份 | F334: 计算机及 | G334: 软件开发 | H334: 234 | I334: -2.0899999999999998e-002 | J334: 1.8700000000000001e-002 | K334: 4.33 | L334: -9.1999999999999998e-003 | M334: 112.3 | N334: 5.79 | O334: 2.1299999999999999 | P334: 74.78 | Q334: 转股中 | R334: 3.40年 | S334: 1.40年 | T334: 1 | U334: 123 | V334: 0.51900000000000002 | W334: 1.8000000000000002e-002 | X334: 1.3999999999999999e-002 | Y334: 54 | Z334: 1.4 | AA334: -0.19699999999999998 | AB334: -0.20199999999999999 | AC334: -0.33700000000000002 | AD334: -0.33799999999999997 | AE334: 93.28 | AF334: 91.21 | AG334: 0.24 | AH334: AA- | AI334: 6.4500000000000002e-002 | AJ334: =H334+100*O334 -> 447. | AK334: 393.2 | AL334: 333 | AM334: 299.9 | AN334: 333 | AO334: -6.2e-002 | AP334: 18 | AQ334: 蓝盾转债!!
A335: 290 | B335: 128041 | C335: 盛路转债!! | D335: 2446 | E335: 盛路通信 | F335: 通信互联 | G335: 通信设备 | H335: 296 | I335: -1.8700000000000001e-002 | J335: 1.8700000000000001e-002 | K335: 5.71 | L335: 0. | M335: 114.3 | N335: 6.82 | O335: 2.54 | P335: 83.72 | Q335: 转股中 | R335: 3.33年 | S335: 1.33年 | T335: 0.53 | U335: 185 | V335: 1.1599999999999999 | W335: 1.e-002 | X335: 9.0000000000000011e-003 | Y335: 52 | Z335: 1.72 | AA335: -0.252 | AB335: -0.25700000000000001 | AC335: -0.41499999999999998 | AD335: -0.41600000000000004 | AE335: 96.52 | AF335: 99.5 | AG335: 0.35 | AH335: AA | AI335: 4.3499999999999997e-002 | AJ335: =H335+100*O335 -> 550. | AK335: 508.3 | AL335: 336 | AM335: 408.8 | AN335: 336 | AO335: -1.2e-002 | AP335: 13 | AQ335: 盛路转债!!
A336: 269 | B336: 113526 | C336: 联泰转债! | D336: 603797 | E336: 联泰环保 | F336: 城市公用 | G336: 三废处理 | H336: 339.76 | I336: -6.3200000000000006e-002 | J336: 6.6299999999999998e-002 | K336: 7.91 | L336: 3.8e-003 | M336: 110.3 | N336: 6.11 | O336: 1.6200000000000001 | P336: 129.46 | Q336: 转股中 | R336: 3.85年 | S336: 1.85年 | T336: 1.93 | U336: 3001. | V336: 4.1900000000000004 | W336: 5.4000000000000006e-002 | X336: 7.0000000000000007e-002 | Y336: 36 | Z336: 2.3 | AA336: -0.25600000000000001 | AB336: -0.25900000000000001 | AC336: -0.31 | AD336: -0.311 | AE336: 94.76 | AF336: 94.59 | AG336: 0.81 | AH336: AA+ | AI336: 4.1500000000000002e-002 | AJ336: =H336+100*O336 -> 501.75999999999999 | AK336: 550.1 | AL336: 337 | AM336: 455.3 | AN336: 337 | AO336: 2.2000000000000002e-002 | AP336: 10 | AQ336: 联泰转债!
A337: 313 | B337: 128030 | C337: 天康转债!! | D337: 2100 | E337: 天康生物 | F337: 农业 | G337: 畜牧业 | H337: 274.398 | I337: 6.9999999999999993e-003 | J337: -2.4700000000000003e-002 | K337: 11.1 | L337: -1.77e-002 | M337: 111.3 | N337: 7.85 | O337: 0.94099999999999995 | P337: 141.4 | Q337: 转股中 | R337: 2.76年 | S337: 0.76年 | T337: 0.96 | U337: 24 | V337: 9.1999999999999998e-002 | W337: 8.0000000000000002e-003 | X337: 1.1000000000000001e-002 | Y337: 119 | Z337: 2 | AA337: -0.28199999999999997 | AB337: -0.28600000000000003 | AC337: -0.68299999999999994 | AD337: -0.68400000000000005 | AE337: 97.98 | AF337: 99.48 | AG337: 1 | AH337: AA | AI337: 4.2199999999999994e-002 | AJ337: =H337+100*O337 -> 368.49800000000005 | AK337: 407.4 | AL337: 334 | AM337: 307.9 | AN337: 334 | AO337: -7.400000000000001e-002 | AP337: 12 | AQ337: 天康转债!!
A338: 314 | B338: 128029 | C338: 太阳转债!! | D338: 2078 | E338: 太阳纸业 | F338: 造纸包装 | G338: 造纸行业 | H338: 205.6 | I338: -3.4700000000000002e-002 | J338: -2.7400000000000001e-002 | K338: 15.85 | L338: -6.2100000000000002e-002 | M338: 107 | N338: 8.55 | O338: 0.109 | P338: 185.38 | Q338: 转股中 | R338: 1.76年 | S338: 回售内 | T338: 9.09 | U338: 294 | V338: 0.156 | W338: 2.2000000000000002e-002 | X338: 4.0999999999999995e-002 | Y338: 416 | Z338: 2.68 | AA338: -0.311 | AB338: -0.316 | AC338: 回售内 | AD338: 回售内 | AE338: 100.17 | AF338: 99.86 | AG338: 1 | AH338: AA+ | AI338: 4.0199999999999993e-002 | AJ338: =H338+100*O338 -> 216.5 | AK338: 225.8 | AL338: 326 | AM338: 125.7 | AN338: 324 | AO338: -0.10400000000000001 | AP338: 7 | AQ338: 太阳转债!!
A339: 287 | B339: 123013 | C339: 横河转债! | D339: 300539 | E339: 横河模具 | F339: 机械装备 | G339: 专用设备 | H339: 409.468 | I339: -6.0999999999999995e-003 | J339: 9.8999999999999991e-003 | K339: 7.18 | L339: 9.7999999999999997e-003 | M339: 115.2 | N339: 9.13 | O339: 4.21 | P339: 78.64 | Q339: 转股中 | R339: 3.35年 | S339: 1.35年 | T339: 0.38 | U339: 458 | V339: 2.9100000000000001 | W339: 2.4e-002 | X339: 1.9e-002 | Y339: 16 | Z339: 3.29 | AA339: -0.31900000000000001 | AB339: -0.32400000000000001 | AC339: -0.46700000000000003 | AD339: -0.46799999999999997 | AE339: 92.65 | AF339: 90.83 | AG339: 0.38 | AH339: A+ | AI339: 7.5499999999999998e-002 | AJ339: =H339+100*O339 -> 830.46800000000007 | AK339: 740.3 | AL339: 338 | AM339: 647.6 | AN339: 338 | AO339: 9.0000000000000011e-003 | AP339: 16 | AQ339: 横河转债!
A340: 226 | B340: 123029 | C340: 英科转债! | D340: 300677 | E340: 英科医疗 | F340: 医药 | G340: 医疗器械 | H340: 2036 | I340: -6.8000000000000005e-003 | J340: -8.8999999999999999e-003 | K340: 181.08 | L340: -1.5800000000000002e-002 | M340: 138.2 | N340: 11.32 | O340: 0.27300000000000002 | P340: 1599.65 | Q340: 转股中 | R340: 4.41年 | S340: 2.41年 | T340: 1.23 | U340: 382 | V340: 0.152 | W340: 2.e-003 | X340: 3.1e-002 | Y340: 638 | Z340: 6.83 | AA340: -0.41399999999999998 | AB340: -0.41700000000000004 | AC340: -0.309 | AD340: -0.31 | AE340: 91.61 | AF340: 105.98 | AG340: 0.99 | AH340: AA- | AI340: 6.4500000000000002e-002 | AJ340: =H340+100*O340 -> 2063.3000000000002 | AK340: 2472.4000000000001 | AL340: 339 | AM340: 2366.4000000000001 | AN340: 339 | AO340: -0.13600000000000001 | AP340: 17 | AQ340: 英科转债!