A1: 序号 | B1: 转债代码 | C1: 转债名称 | D1: 股票代码 | E1: 股票名称 | F1: 行业 | G1: 子行业 | H1: 转债价格 | I1: 涨跌 | J1: 日内套利 | K1: 股价 | L1: 涨跌 | M1: 剩余本息 | N1: 转股价格 | O1: 转股溢价率 | P1: 转股价值 | Q1: 距离转股日 | R1: 剩余年限 | S1: 回售年限 | T1: 转债余额 | U1: 转债成交额 | V1: 转债换手率 | W1: 余额/市值 | X1: 余额/股本 | Y1: 股票市值 | Z1: P/B | AA1: 税前收益率 | AB1: 税后收益率 | AC1: 税前回售收益 | AD1: 税后回售收益 | AE1: 回售价值 | AF1: 纯债价值 | AG1: 弹性 | AH1: 信用 | AI1: 折现率 | AJ1: 双低 | AK1: 老式双低 | AL1: 老式排名 | AM1: 新式双低 | AN1: 新式排名 | AO1: MA20乖离 | AP1: 热门度 | AQ1: 转债名称
A2: 1 | B2: 123131 | C2: 奥飞转债 | D2: 300738 | E2: 奥飞数据 | F2: 通信互联 | G2: 通信设备 | H2: 132.95 | I2: -1.9e-003 | J2: -9.300000000000001e-003 | K2: 22.14 | L2: -1.6e-002 | M2: 121.7 | N2: 22.02 | O2: 0.32200000000000001 | P2: 100.54 | Q2: 5月16天 | R2: 5.94年 | S2: 3.94年 | T2: 6.35 | U2: 80 | V2: 9.4e-002 | W2: 7.4999999999999997e-002 | X2: 7.5999999999999998e-002 | Y2: 84 | Z2: 6 | AA2: -1.5100000000000001e-002 | AB2: -2.1099999999999997e-002 | AC2: -5.7200000000000001e-002 | AD2: -5.9200000000000003e-002 | AE2: 78.48 | AF2: 80.68 | AG2: 0.7 | AH2: A+ | AI2: 7.3399999999999993e-002 | AJ2: =H2+100*O2 -> 165.14999999999998 | AK2: 165.4 | AL2: 221 | AM2: 84.7 | AN2: 271 | AO2: 4.0000000000000001e-003 | AP2: 1 | AQ2: 奥飞转债
A3: 2 | B3: 118003 | C3: 华兴转债 | D3: 688001 | E3: 华兴源创 | F3: 机械装备 | G3: 专用设备 | H3: 129.01 | I3: 7.7000000000000002e-003 | J3: -1.5800000000000002e-002 | K3: 34.82 | L3: -1.6399999999999998e-002 | M3: 115.1 | N3: 39.33 | O3: 0.45700000000000002 | P3: 88.53 | Q3: 5月10天 | R3: 5.93年 | S3: 3.93年 | T3: 8 | U3: 44 | V3: 4.2999999999999997e-002 | W3: 5.2000000000000005e-002 | X3: 4.5999999999999999e-002 | Y3: 153 | Z3: 4.5 | AA3: -1.9400000000000001e-002 | AB3: -2.3799999999999998e-002 | AC3: -5.2499999999999998e-002 | AD3: -5.4000000000000006e-002 | AE3: 87.86 | AF3: 90.88 | AG3: 0.5 | AH3: AA | AI3: 4.1399999999999999e-002 | AJ3: =H3+100*O3 -> 174.70999999999998 | AK3: 169.5 | AL3: 246 | AM3: 78.6 | AN3: 246 | AO3: -3.2000000000000001e-002 | AP3: 1 | AQ3: 华兴转债
A4: 3 | B4: 127051 | C4: 博杰转债 | D4: 2975 | E4: 博杰股份 | F4: 机械装备 | G4: 机器人及 | H4: 134.29 | I4: 2.0099999999999996e-002 | J4: -8.8000000000000005e-003 | K4: 61.83 | L4: 1.7399999999999999e-002 | M4: 121.1 | N4: 62.17 | O4: 0.34999999999999998 | P4: 99.45 | Q4: 4月29天 | R4: 5.90年 | S4: 4.90年 | T4: 5.26 | U4: 47 | V4: 6.7000000000000004e-002 | W4: 6.0999999999999999e-002 | X4: 6.0999999999999999e-002 | Y4: 86 | Z4: 5.83 | AA4: -1.77e-002 | AB4: -2.3599999999999999e-002 | AC4: -4.5199999999999997e-002 | AD4: -4.7400000000000005e-002 | AE4: 78.84 | AF4: 85.36 | AG4: 0.64 | AH4: AA- | AI4: 6.2400000000000004e-002 | AJ4: =H4+100*O4 -> 169.28999999999999 | AK4: 169.1 | AL4: 243 | AM4: 83.8 | AN4: 267 | AO4: 4.8000000000000001e-002 | AP4: 1 | AQ4: 博杰转债
A5: 4 | B5: 113632 | C5: 鹤21转债 | D5: 603733 | E5: 仙鹤股份 | F5: 造纸包装 | G5: 造纸行业 | H5: 139.52 | I5: 3.4999999999999996e-003 | J5: -1.3300000000000001e-002 | K5: 39.2 | L5: -1.6799999999999999e-002 | M5: 117.1 | N5: 39.09 | O5: 0.39100000000000001 | P5: 100.28 | Q5: 4月29天 | R5: 5.90年 | S5: 3.90年 | T5: 20.5 | U5: 20 | V5: 6.9999999999999993e-003 | W5: 7.400000000000001e-002 | X5: 7.400000000000001e-002 | Y5: 277 | Z5: 4.58 | AA5: -2.9700000000000001e-002 | AB5: -3.4599999999999999e-002 | AC5: -7.1099999999999997e-002 | AD5: -7.2599999999999998e-002 | AE5: 87.98 | AF5: 92.57 | AG5: 0.59 | AH5: AA | AI5: 4.1399999999999999e-002 | AJ5: =H5+100*O5 -> 178.62 | AK5: 178.8 | AL5: 276 | AM5: 86.2 | AN5: 277 | AO5: 2.5000000000000001e-002 | AP5: 1 | AQ5: 鹤21转债
A6: 5 | B6: 127050 | C6: 麒麟转债 | D6: 2984 | E6: 森麒麟 | F6: 汽车 | G6: 零部件制 | H6: 146 | I6: 0. | J6: 2.3999999999999998e-003 | K6: 36.67 | L6: 3.8e-003 | M6: 115.1 | N6: 34.85 | O6: 0.38799999999999996 | P6: 105.22 | Q6: 4月23天 | R6: 5.88年 | S6: 3.88年 | T6: 22 | U6: 7.2 | V6: 2.e-003 | W6: 9.1999999999999998e-002 | X6: 9.6999999999999989e-002 | Y6: 238 | Z6: 3.9 | AA6: -4.0300000000000002e-002 | AB6: -4.4500000000000005e-002 | AC6: -8.1799999999999998e-002 | AD6: -8.3299999999999999e-002 | AE6: 88.03 | AF6: 91.06 | AG6: 0.64 | AH6: AA | AI6: 4.1399999999999999e-002 | AJ6: =H6+100*O6 -> 184.80000000000001 | AK6: 186.8 | AL6: 293 | AM6: 95.7 | AN6: 298 | AO6: 1.4999999999999999e-002 | AP6: 2 | AQ6: 麒麟转债
A7: 6 | B7: 110083 | C7: 苏租转债 | D7: 600901 | E7: 江苏租赁 | F7: 金融 | G7: 其他 | H7: 117.05 | I7: -2.0999999999999999e-003 | J7: 1.1000000000000001e-003 | K7: 5.09 | L7: -2.e-003 | M7: 110.5 | N7: 5.42 | O7: 0.24600000000000002 | P7: 93.91 | Q7: 4月23天 | R7: 5.88年 | S7: 无权 | T7: 50 | U7: 50 | V7: 8.0000000000000002e-003 | W7: 0.32899999999999996 | X7: 0.309 | Y7: 152 | Z7: 1.11 | AA7: -9.8999999999999991e-003 | AB7: -1.3100000000000001e-002 | AC7: 无权 | AD7: 无权 | AE7: 无权 | AF7: 90.79 | AG7: 0.54 | AH7: AAA | AI7: 3.44e-002 | AJ7: =H7+100*O7 -> 141.65000000000001 | AK7: 140.2 | AL7: 32 | AM7: 49.4 | AN7: 79 | AO7: -3.0000000000000001e-003 | AP7: 4 | AQ7: 苏租转债
A8: 7 | B8: 123130 | C8: 设研转债 | D8: 300732 | E8: 设研院 | F8: 建筑 | G8: 建筑工程 | H8: 129.599 | I8: -3.2000000000000002e-003 | J8: -5.6999999999999993e-003 | K8: 11.67 | L8: -1.44e-002 | M8: 117.1 | N8: 11.24 | O8: 0.248 | P8: 103.83 | Q8: 4月23天 | R8: 5.88年 | S8: 3.88年 | T8: 3.76 | U8: 6.6 | V8: 1.3999999999999999e-002 | W8: 0.11699999999999999 | X8: 0.122 | Y8: 32 | Z8: 1.27 | AA8: -1.7399999999999999e-002 | AB8: -2.23e-002 | AC8: -5.4199999999999998e-002 | AD8: -5.5800000000000002e-002 | AE8: 88.03 | AF8: 92.63 | AG8: 0.62 | AH8: AA | AI8: 4.1399999999999999e-002 | AJ8: =H8+100*O8 -> 154.399 | AK8: 155.4 | AL8: 161 | AM8: 62.7 | AN8: 164 | AO8: -3.7000000000000005e-002 | AP8: 3 | AQ8: 设研转债
A9: 8 | B9: 111001 | C9: 山玻转债 | D9: 605006 | E9: 山东玻纤 | F9: 其他 | G9: 非金属矿 | H9: 128.27 | I9: -4.0000000000000001e-003 | J9: -1.18e-002 | K9: 13.36 | L9: -2.4799999999999999e-002 | M9: 120.1 | N9: 13.91 | O9: 0.33600000000000002 | P9: 96.05 | Q9: 4月18天 | R9: 5.87年 | S9: 3.87年 | T9: 6 | U9: 4.4 | V9: 6.0000000000000001e-003 | W9: 8.9999999999999997e-002 | X9: 8.5999999999999993e-002 | Y9: 67 | Z9: 3.1 | AA9: -1.1299999999999999e-002 | AB9: -1.7100000000000001e-002 | AC9: -5.1900000000000002e-002 | AD9: -5.3399999999999996e-002 | AE9: 81.3 | AF9: 84.7 | AG9: 0.63 | AH9: AA- | AI9: 6.2400000000000004e-002 | AJ9: =H9+100*O9 -> 161.87 | AK9: 160.5 | AL9: 187 | AM9: 75.8 | AN9: 238 | AO9: -6.6000000000000003e-002 | AP9: 2 | AQ9: 山玻转债
A10: 9 | B10: 113631 | C10: 皖天转债 | D10: 603689 | E10: 皖天然气 | F10: 石油天然 | G10: 天然气 | H10: 120.8 | I10: -1.7000000000000001e-003 | J10: -5.1999999999999998e-003 | K10: 10.55 | L10: -1.3100000000000001e-002 | M10: 114.5 | N10: 11.12 | O10: 0.27300000000000002 | P10: 94.87 | Q10: 4月18天 | R10: 5.87年 | S10: 3.87年 | T10: 9.3 | U10: 17 | V10: 1.4999999999999999e-002 | W10: 0.26200000000000001 | X10: 0.249 | Y10: 35 | Z10: 1.44 | AA10: -9.1999999999999998e-003 | AB10: -1.3500000000000002e-002 | AC10: -3.8900000000000004e-002 | AD10: -4.0199999999999993e-002 | AE10: 89.23 | AF10: 93.1 | AG10: 0.53 | AH10: AA+ | AI10: 3.6400000000000002e-002 | AJ10: =H10+100*O10 -> 148.09999999999999 | AK10: 146.7 | AL10: 77 | AM10: 53.6 | AN10: 105 | AO10: 1.6e-002 | AP10: 2 | AQ10: 皖天转债
A11: 10 | B11: 123129 | C11: 锦鸡转债 | D11: 300798 | E11: 锦鸡股份 | F11: 化工 | G11: 其他 | H11: 122.53 | I11: -1.8e-003 | J11: -1.32e-002 | K11: 9.42 | L11: -2.2799999999999997e-002 | M11: 117.8 | N11: 9.53 | O11: 0.23999999999999999 | P11: 98.85 | Q11: 4月16天 | R11: 5.86年 | S11: 3.86年 | T11: 6 | U11: 14 | V11: 1.8000000000000002e-002 | W11: 0.152 | X11: 0.151 | Y11: 39 | Z11: 3.15 | AA11: -6.8000000000000005e-003 | AB11: -1.21e-002 | AC11: -4.0500000000000001e-002 | AD11: -4.2199999999999994e-002 | AE11: 81.6 | AF11: 83.21 | AG11: 0.66 | AH11: AA- | AI11: 6.2400000000000004e-002 | AJ11: =H11+100*O11 -> 146.53 | AK11: 146.2 | AL11: 69 | AM11: 63 | AN11: 168 | AO11: -3.7999999999999999e-002 | AP11: 4 | AQ11: 锦鸡转债
A12: 11 | B12: 127049 | C12: 希望转2 | D12: 876 | E12: 新 希 望 | F12: 农业 | G12: 畜牧业 | H12: 132.71 | I12: -4.4000000000000003e-003 | J12: 4.0000000000000001e-003 | K12: 15.01 | L12: -7.000000000000001e-004 | M12: 111.2 | N12: 14.45 | O12: 0.27800000000000002 | P12: 103.88 | Q12: 4月14天 | R12: 5.86年 | S12: 3.86年 | T12: 81.5 | U12: 87 | V12: 8.0000000000000002e-003 | W12: 0.121 | X12: 0.125 | Y12: 676 | Z12: 2.21 | AA12: -3.0099999999999998e-002 | AB12: -3.3500000000000002e-002 | AC12: -6.1699999999999998e-002 | AD12: -6.2899999999999998e-002 | AE12: 89.86 | AF12: 91.48 | AG12: 0.62 | AH12: AAA | AI12: 3.44e-002 | AJ12: =H12+100*O12 -> 160.51000000000002 | AK12: 161.5 | AL12: 196 | AM12: 70.1 | AN12: 206 | AO12: 3.4000000000000002e-002 | AP12: 7 | AQ12: 希望转2
A13: 12 | B13: 123128 | C13: 首华转债! | D13: 300483 | E13: 首华燃气 | F13: 石油天然 | G13: 天然气 | H13: 111.03 | I13: -8.199999999999999e-003 | J13: -4.5999999999999999e-003 | K13: 17.9 | L13: -4.07e-002 | M13: 115.1 | N13: 25.02 | O13: 0.55200000000000005 | P13: 71.54 | Q13: 4月11天 | R13: 5.85年 | S13: 3.85年 | T13: 13.8 | U13: 44 | V13: 2.7999999999999997e-002 | W13: 0.28699999999999998 | X13: 0.20499999999999999 | Y13: 48 | Z13: 1.71 | AA13: 6.3e-003 | AB13: 1.6000000000000001e-003 | AC13: -1.72e-002 | AD13: -1.89e-002 | AE13: 88.13 | AF13: 91.16 | AG13: 0.31 | AH13: AA | AI13: 4.1399999999999999e-002 | AJ13: =H13+100*O13 -> 166.23000000000002 | AK13: 150.5 | AL13: 116 | AM13: 59.4 | AN13: 146 | AO13: -1.4999999999999999e-002 | AP13: 6 | AQ13: 首华转债!
A14: 13 | B14: 123127 | C14: 耐普转债 | D14: 300818 | E14: 耐普矿机 | F14: 机械装备 | G14: 专用设备 | H14: 121.69 | I14: -4.6999999999999993e-003 | J14: -1.8100000000000002e-002 | K14: 33.04 | L14: -3.4200000000000001e-002 | M14: 116.2 | N14: 37 | O14: 0.36299999999999999 | P14: 89.3 | Q14: 4月10天 | R14: 5.84年 | S14: 3.84年 | T14: 4 | U14: 8 | V14: 1.6e-002 | W14: 0.17300000000000001 | X14: 0.154 | Y14: 23 | Z14: 2.46 | AA14: -8.0000000000000002e-003 | AB14: -1.29e-002 | AC14: -3.8100000000000002e-002 | AD14: -4.0000000000000001e-002 | AE14: 78.72 | AF14: 77.52 | AG14: 0.67 | AH14: A+ | AI14: 7.3399999999999993e-002 | AJ14: =H14+100*O14 -> 157.99000000000001 | AK14: 154.1 | AL14: 151 | AM14: 75.4 | AN14: 235 | AO14: -6.0999999999999999e-002 | AP14: 3 | AQ14: 耐普转债
A15: 14 | B15: 110082 | C15: 宏发转债 | D15: 600885 | E15: 宏发股份 | F15: 能源电力 | G15: 电力设备 | H15: 137.95 | I15: -4.0000000000000001e-003 | J15: -4.3e-003 | K15: 71.05 | L15: -1.46e-002 | M15: 117.1 | N15: 72.28 | O15: 0.40299999999999997 | P15: 98.3 | Q15: 4月9天 | R15: 5.84年 | S15: 3.84年 | T15: 20 | U15: 44 | V15: 1.6e-002 | W15: 3.7999999999999999e-002 | X15: 3.7000000000000005e-002 | Y15: 529 | Z15: 8.7 | AA15: -2.81e-002 | AB15: -3.3000000000000002e-002 | AC15: -6.9400000000000003e-002 | AD15: -7.0900000000000005e-002 | AE15: 88.17 | AF15: 92.78 | AG15: 0.57 | AH15: AA | AI15: 4.1399999999999999e-002 | AJ15: =H15+100*O15 -> 178.25 | AK15: 177.6 | AL15: 271 | AM15: 84.8 | AN15: 272 | AO15: -2.5000000000000001e-002 | AP15: 4 | AQ15: 宏发转债
A16: 15 | B16: 113630 | C16: 赛伍转债 | D16: 603212 | E16: 赛伍技术 | F16: 能源电力 | G16: 太阳能 | H16: 140.77 | I16: -1.1899999999999999e-002 | J16: -7.3000000000000001e-003 | K16: 29.97 | L16: -3.2599999999999997e-002 | M16: 120.5 | N16: 32.9 | O16: 0.54500000000000004 | P16: 91.09 | Q16: 4月8天 | R16: 5.84年 | S16: 3.84年 | T16: 7 | U16: 16 | V16: 1.6e-002 | W16: 5.7999999999999996e-002 | X16: 5.2999999999999999e-002 | Y16: 120 | Z16: 6.01 | AA16: -2.6699999999999998e-002 | AB16: -3.2500000000000001e-002 | AC16: -7.3700000000000002e-002 | AD16: -7.5300000000000006e-002 | AE16: 81.67 | AF16: 85.2 | AG16: 0.59 | AH16: AA- | AI16: 6.2400000000000004e-002 | AJ16: =H16+100*O16 -> 195.27000000000001 | AK16: 190.4 | AL16: 300 | AM16: 105.2 | AN16: 312 | AO16: -0.10800000000000001 | AP16: 4 | AQ16: 赛伍转债
A17: 16 | B17: 127048 | C17: 中大转债 | D17: 2896 | E17: 中大力德 | F17: 机械装备 | G17: 通用设备 | H17: 138.037 | I17: -1.0200000000000001e-002 | J17: -7.4999999999999997e-003 | K17: 22.96 | L17: -2.5099999999999997e-002 | M17: 121.7 | N17: 22.1 | O17: 0.32899999999999996 | P17: 103.89 | Q17: 4月7天 | R17: 5.84年 | S17: 3.84年 | T17: 2.7 | U17: 5 | V17: 1.3000000000000001e-002 | W17: 0.113 | X17: 0.11699999999999999 | Y17: 24 | Z17: 3.27 | AA17: -2.18e-002 | AB17: -2.7900000000000001e-002 | AC17: -6.7500000000000004e-002 | AD17: -6.9500000000000006e-002 | AE17: 79.05 | AF17: 81.27 | AG17: 0.71 | AH17: A+ | AI17: 7.3399999999999993e-002 | AJ17: =H17+100*O17 -> 170.93700000000001 | AK17: 172.2 | AL17: 257 | AM17: 90.9 | AN17: 291 | AO17: -7.0999999999999994e-002 | AP17: 3 | AQ17: 中大转债
A18: 17 | B18: 127047 | C18: 帝欧转债 | D18: 2798 | E18: 帝欧家居 | F18: 其他 | G18: 家居用品 | H18: 135.23 | I18: -1.44e-002 | J18: 2.1700000000000001e-002 | K18: 14.54 | L18: 1.04e-002 | M18: 120.4 | N18: 13.53 | O18: 0.25800000000000001 | P18: 107.46 | Q18: 4月5天 | R18: 5.83年 | S18: 3.83年 | T18: 15 | U18: 30 | V18: 1.4999999999999999e-002 | W18: 0.26700000000000002 | X18: 0.28699999999999998 | Y18: 56 | Z18: 1.23 | AA18: -2.e-002 | AB18: -2.58e-002 | AC18: -6.4600000000000005e-002 | AD18: -6.6199999999999995e-002 | AE18: 81.59 | AF18: 85.13 | AG18: 0.7 | AH18: AA- | AI18: 6.2400000000000004e-002 | AJ18: =H18+100*O18 -> 161.03 | AK18: 163 | AL18: 210 | AM18: 77.9 | AN18: 242 | AO18: 1.3000000000000001e-002 | AP18: 4 | AQ18: 帝欧转债
A19: 18 | B19: 127046 | C19: 百润转债 | D19: 2568 | E19: 百润股份 | F19: 食品饮料 | G19: 葡萄酒洋 | H19: 139.368 | I19: -1.7000000000000001e-003 | J19: -2.e-003 | K19: 63.72 | L19: -6.7000000000000002e-003 | M19: 115.1 | N19: 66.89 | O19: 0.46299999999999997 | P19: 95.26 | Q19: 3月18天 | R19: 5.76年 | S19: 3.76年 | T19: 11.3 | U19: 25 | V19: 1.6e-002 | W19: 2.4e-002 | X19: 2.2000000000000002e-002 | Y19: 478 | Z19: 13.6 | AA19: -3.32e-002 | AB19: -3.7599999999999995e-002 | AC19: -7.3200000000000001e-002 | AD19: -7.4800000000000005e-002 | AE19: 88.46 | AF19: 91.49 | AG19: 0.55 | AH19: AA | AI19: 4.1399999999999999e-002 | AJ19: =H19+100*O19 -> 185.66800000000001 | AK19: 183.5 | AL19: 288 | AM19: 92 | AN19: 293 | AO19: 2.5000000000000001e-002 | AP19: 4 | AQ19: 百润转债
A20: 19 | B20: 113629 | C20: 泉峰转债 | D20: 603982 | E20: 泉峰汽车 | F20: 汽车 | G20: 零部件制 | H20: 213.84 | I20: -3.4300000000000004e-002 | J20: -4.0599999999999997e-002 | K20: 47.2 | L20: -7.9600000000000004e-002 | M20: 121 | N20: 23.03 | O20: 4.2999999999999997e-002 | P20: 204.95 | Q20: 2月27天 | R20: 5.72年 | S20: 3.72年 | T20: 6.2 | U20: 441 | V20: 0.33100000000000002 | W20: 6.5000000000000002e-002 | X20: 0.13400000000000001 | Y20: 95 | Z20: 5.72 | AA20: -9.6199999999999994e-002 | AB20: -0.10199999999999999 | AC20: -0.16 | AD20: -0.16200000000000001 | AE20: 82.32 | AF20: 86.19 | AG20: 0.94 | AH20: AA- | AI20: 6.2400000000000004e-002 | AJ20: =H20+100*O20 -> 218.14000000000001 | AK20: 222.7 | AL20: 331 | AM20: 136.5 | AN20: 336 | AO20: 6.8000000000000005e-002 | AP20: 5 | AQ20: 泉峰转债
A21: 20 | B21: 123126 | C21: 瑞丰转债! | D21: 300243 | E21: 瑞丰高材 | F21: 化工 | G21: 橡胶塑料 | H21: 117.6 | I21: -6.7000000000000002e-003 | J21: -5.4000000000000003e-003 | K21: 13.1 | L21: -2.75e-002 | M21: 129.6 | N21: 17.8 | O21: 0.59799999999999998 | P21: 73.6 | Q21: 2月21天 | R21: 5.71年 | S21: 3.71年 | T21: 3.4 | U21: 7.4 | V21: 1.9e-002 | W21: 0.11199999999999999 | X21: 8.199999999999999e-002 | Y21: 30 | Z21: 3.75 | AA21: 1.77e-002 | AB21: 9.1000000000000004e-003 | AC21: -2.5099999999999997e-002 | AD21: -2.8300000000000002e-002 | AE21: 81.4 | AF21: 87.57 | AG21: 0.44 | AH21: A+ | AI21: 7.3399999999999993e-002 | AJ21: =H21+100*O21 -> 177.39999999999998 | AK21: 161.6 | AL21: 197 | AM21: 74 | AN21: 228 | AO21: -7.9000000000000001e-002 | AP21: 7 | AQ21: 瑞丰转债!
A22: 21 | B22: 123125 | C22: 元力转债 | D22: 300174 | E22: 元力股份 | F22: 化工 | G22: 化工 | H22: 123 | I22: -2.8999999999999998e-003 | J22: -9.300000000000001e-003 | K22: 16.16 | L22: -1.8799999999999997e-002 | M22: 109.3 | N22: 17.61 | O22: 0.34000000000000002 | P22: 91.77 | Q22: 2月15天 | R22: 5.70年 | S22: 3.70年 | T22: 9 | U22: 7.1 | V22: 6.0000000000000001e-003 | W22: 0.17800000000000002 | X22: 0.16399999999999998 | Y22: 50 | Z22: 2.88 | AA22: -2.0799999999999999e-002 | AB22: -2.3700000000000002e-002 | AC22: -4.5499999999999999e-002 | AD22: -4.6799999999999994e-002 | AE22: 81.45 | AF22: 77.81 | AG22: 0.64 | AH22: AA- | AI22: 6.2400000000000004e-002 | AJ22: =H22+100*O22 -> 157. | AK22: 154.2 | AL22: 152 | AM22: 72.8 | AN22: 221 | AO22: -6.9000000000000006e-002 | AP22: 4 | AQ22: 元力转债
A23: 22 | B23: 113628 | C23: 晨丰转债 | D23: 603685 | E23: 晨丰科技 | F23: 能源电力 | G23: 电力设备 | H23: 118.6 | I23: -8.9999999999999998e-004 | J23: -1.2999999999999999e-003 | K23: 12.06 | L23: -3.3e-003 | M23: 121.7 | N23: 13.06 | O23: 0.28399999999999997 | P23: 92.34 | Q23: 2月4天 | R23: 5.66年 | S23: 3.66年 | T23: 4.15 | U23: 1.1 | V23: 2.e-003 | W23: 0.20399999999999999 | X23: 0.188 | Y23: 20 | Z23: 1.81 | AA23: 4.6999999999999993e-003 | AB23: -1.9e-003 | AC23: -3.2599999999999997e-002 | AD23: -3.4799999999999998e-002 | AE23: 77.28 | AF23: 78.18 | AG23: 0.68 | AH23: A | AI23: 8.3400000000000002e-002 | AJ23: =H23+100*O23 -> 147. | AK23: 144.9 | AL23: 58 | AM23: 66.7 | AN23: 189 | AO23: -1.e-002 | AP23: 10 | AQ23: 晨丰转债
A24: 23 | B24: 123124 | C24: 晶瑞转2! | D24: 300655 | E24: 晶瑞电材 | F24: 电子 | G24: 电子行业 | H24: 132.069 | I24: -5.5000000000000005e-003 | J24: -1.3899999999999999e-002 | K24: 42.93 | L24: -3.0899999999999997e-002 | M24: 111.2 | N24: 50.31 | O24: 0.54799999999999993 | P24: 85.33 | Q24: 57天 | R24: 5.64年 | S24: 3.64年 | T24: 5.23 | U24: 13 | V24: 1.9e-002 | W24: 3.6000000000000004e-002 | X24: 3.1e-002 | Y24: 146 | Z24: 10.08 | AA24: -3.04e-002 | AB24: -3.39e-002 | AC24: -6.4199999999999993e-002 | AD24: -6.54e-002 | AE24: 78.53 | AF24: 75 | AG24: 0.63 | AH24: A+ | AI24: 7.3399999999999993e-002 | AJ24: =H24+100*O24 -> 186.86899999999997 | AK24: 178.8 | AL24: 277 | AM24: 100.3 | AN24: 304 | AO24: -7.9000000000000001e-002 | AP24: 7 | AQ24: 晶瑞转2!
A25: 24 | B25: 127044 | C25: 蒙娜转债! | D25: 2918 | E25: 蒙娜丽莎 | F25: 建筑 | G25: 其他建材 | H25: 132.762 | I25: 1.66e-002 | J25: 2.0899999999999998e-002 | K25: 26.74 | L25: 6.6600000000000006e-002 | M25: 117.1 | N25: 27.07 | O25: 0.34399999999999997 | P25: 98.78 | Q25: 58天 | R25: 5.64年 | S25: 3.64年 | T25: 11.7 | U25: 472 | V25: 0.29499999999999998 | W25: 0.106 | X25: 0.10400000000000001 | Y25: 111 | Z25: 2.98 | AA25: -2.2400000000000003e-002 | AB25: -2.75e-002 | AC25: -6.3500000000000001e-002 | AD25: -6.5099999999999991e-002 | AE25: 88.89 | AF25: 93.53 | AG25: 0.56 | AH25: AA | AI25: 4.1399999999999999e-002 | AJ25: =H25+100*O25 -> 167.16200000000001 | AK25: 166.7 | AL25: 233 | AM25: 73.2 | AN25: 224 | AO25: 7.400000000000001e-002 | AP25: 3 | AQ25: 蒙娜转债!
A26: 25 | B26: 127045 | C26: 牧原转债 | D26: 2714 | E26: 牧原股份 | F26: 农业 | G26: 畜牧业 | H26: 137.01 | I26: 7.4000000000000003e-003 | J26: 2.1299999999999999e-002 | K26: 52.28 | L26: 4.2699999999999995e-002 | M26: 111.1 | N26: 47.91 | O26: 0.25600000000000001 | P26: 109.12 | Q26: 58天 | R26: 5.64年 | S26: 3.64年 | T26: 95.5 | U26: 175 | V26: 1.3000000000000001e-002 | W26: 3.5000000000000003e-002 | X26: 3.7999999999999999e-002 | Y26: 2751. | Z26: 5.22 | AA26: -3.7000000000000005e-002 | AB26: -4.0399999999999998e-002 | AC26: -7.2900000000000006e-002 | AD26: -7.4200000000000002e-002 | AE26: 89.84 | AF26: 91.08 | AG26: 0.67 | AH26: AA+ | AI26: 3.6400000000000002e-002 | AJ26: =H26+100*O26 -> 162.60999999999999 | AK26: 164.9 | AL26: 218 | AM26: 73.8 | AN26: 226 | AO26: 3.7999999999999999e-002 | AP26: 9 | AQ26: 牧原转债
A27: 26 | B27: 118002 | C27: 天合转债 | D27: 688599 | E27: 天合光能 | F27: 能源电力 | G27: 太阳能 | H27: 170.03 | I27: -2.3900000000000001e-002 | J27: -1.8100000000000002e-002 | K27: 74.92 | L27: -4.9800000000000004e-002 | M27: 120.1 | N27: 50.51 | O27: 0.14599999999999999 | P27: 148.33 | Q27: 58天 | R27: 5.63年 | S27: 3.63年 | T27: 52.5 | U27: 299 | V27: 3.3000000000000002e-002 | W27: 3.4000000000000002e-002 | X27: 5.0000000000000003e-002 | Y27: 1549. | Z27: 9.65 | AA27: -6.08e-002 | AB27: -6.6299999999999998e-002 | AC27: -0.11800000000000001 | AD27: -0.12 | AE27: 88.92 | AF27: 95.95 | AG27: 0.84 | AH27: AA | AI27: 4.1399999999999999e-002 | AJ27: =H27+100*O27 -> 184.63 | AK27: 191.7 | AL27: 305 | AM27: 95.8 | AN27: 299 | AO27: -1.4999999999999999e-002 | AP27: 8 | AQ27: 天合转债
A28: 27 | B28: 127043 | C28: 川恒转债 | D28: 2895 | E28: 川恒股份 | F28: 化工 | G28: 农化 | H28: 159.8 | I28: -1.34e-002 | J28: -2.4399999999999998e-002 | K28: 25.19 | L28: -5.0199999999999995e-002 | M28: 121 | N28: 21.02 | O28: 0.33299999999999996 | P28: 119.84 | Q28: 55天 | R28: 5.63年 | S28: 3.63年 | T28: 11.6 | U28: 49 | V28: 2.6000000000000002e-002 | W28: 9.4e-002 | X28: 0.113 | Y28: 123 | Z28: 3.89 | AA28: -4.9000000000000002e-002 | AB28: -5.4900000000000004e-002 | AC28: -0.10400000000000001 | AD28: -0.106 | AE28: 82.77 | AF28: 86.66 | AG28: 0.75 | AH28: AA- | AI28: 6.2400000000000004e-002 | AJ28: =H28+100*O28 -> 193.10000000000002 | AK28: 199.8 | AL28: 316 | AM28: 113.1 | AN28: 319 | AO28: -0.157 | AP28: 7 | AQ28: 川恒转债
A29: 28 | B29: 123123 | C29: 江丰转债! | D29: 300666 | E29: 江丰电子 | F29: 电子 | G29: 电子行业 | H29: 128.32 | I29: 1.04e-002 | J29: 4.5999999999999999e-002 | K29: 49.91 | L29: 8.4499999999999992e-002 | M29: 121.5 | N29: 51.93 | O29: 0.33500000000000002 | P29: 96.11 | Q29: 55天 | R29: 5.63年 | S29: 3.63年 | T29: 5.17 | U29: 133 | V29: 0.19899999999999998 | W29: 4.5999999999999999e-002 | X29: 4.4000000000000004e-002 | Y29: 113 | Z29: 9.1 | AA29: -9.8999999999999991e-003 | AB29: -1.6200000000000003e-002 | AC29: -5.33e-002 | AD29: -5.5300000000000002e-002 | AE29: 80.03 | AF29: 82.28 | AG29: 0.67 | AH29: A+ | AI29: 7.3399999999999993e-002 | AJ29: =H29+100*O29 -> 161.81999999999999 | AK29: 160.5 | AL29: 188 | AM29: 78.2 | AN29: 243 | AO29: 9.9000000000000005e-002 | AP29: 7 | AQ29: 江丰转债!
A30: 29 | B30: 127042 | C30: 嘉美转债 | D30: 2969 | E30: 嘉美包装 | F30: 造纸包装 | G30: 包装材料 | H30: 123.885 | I30: -1.e-003 | J30: -2.5999999999999999e-003 | K30: 5.34 | L30: -5.6000000000000008e-003 | M30: 117.1 | N30: 4.87 | O30: 0.13 | P30: 109.65 | Q30: 51天 | R30: 5.62年 | S30: 3.62年 | T30: 7.5 | U30: 9.5 | V30: 1.e-002 | W30: 0.14599999999999999 | X30: 0.16 | Y30: 51 | Z30: 2.34 | AA30: -1.01e-002 | AB30: -1.54e-002 | AC30: -4.6399999999999997e-002 | AD30: -4.8099999999999997e-002 | AE30: 88.96 | AF30: 93.61 | AG30: 0.64 | AH30: AA | AI30: 4.1399999999999999e-002 | AJ30: =H30+100*O30 -> 136.88499999999999 | AK30: 138.1 | AL30: 24 | AM30: 44.5 | AN30: 45 | AO30: -6.9999999999999993e-003 | AP30: 12 | AQ30: 嘉美转债
A31: 30 | B31: 123122 | C31: 富瀚转债 | D31: 300613 | E31: 富瀚微 | F31: 电子 | G31: 芯片制造 | H31: 134.7 | I31: 1.01e-002 | J31: -1.e-002 | K31: 163.03 | L31: 2.0000000000000001e-004 | M31: 120.3 | N31: 177.04 | O31: 0.46299999999999997 | P31: 92.09 | Q31: 49天 | R31: 5.61年 | S31: 3.61年 | T31: 5.81 | U31: 207 | V31: 0.26400000000000001 | W31: 2.9999999999999999e-002 | X31: 2.7000000000000003e-002 | Y31: 196 | Z31: 11.97 | AA31: -2.0299999999999999e-002 | AB31: -2.63e-002 | AC31: -6.7500000000000004e-002 | AD31: -6.9099999999999995e-002 | AE31: 79.48 | AF31: 81.44 | AG31: 0.64 | AH31: A+ | AI31: 7.3399999999999993e-002 | AJ31: =H31+100*O31 -> 181. | AK31: 177.3 | AL31: 269 | AM31: 95.9 | AN31: 300 | AO31: 5.4000000000000006e-002 | AP31: 6 | AQ31: 富瀚转债
A32: 31 | B32: 123121 | C32: 帝尔转债! | D32: 300776 | E32: 帝尔激光 | F32: 机械装备 | G32: 专用设备 | H32: 156.349 | I32: -2.1000000000000001e-002 | J32: 2.0000000000000001e-004 | K32: 229.79 | L32: -2.7799999999999998e-002 | M32: 121 | N32: 192.24 | O32: 0.308 | P32: 119.53 | Q32: 48天 | R32: 5.61年 | S32: 3.61年 | T32: 8.4 | U32: 93 | V32: 7.0000000000000007e-002 | W32: 3.4000000000000002e-002 | X32: 4.0999999999999995e-002 | Y32: 244 | Z32: 12.07 | AA32: -4.5400000000000003e-002 | AB32: -5.1399999999999994e-002 | AC32: -0.10000000000000001 | AD32: -0.10199999999999999 | AE32: 82.87 | AF32: 86.76 | AG32: 0.75 | AH32: AA- | AI32: 6.2400000000000004e-002 | AJ32: =H32+100*O32 -> 187.149 | AK32: 193.2 | AL32: 309 | AM32: 106.4 | AN32: 313 | AO32: 4.5999999999999999e-002 | AP32: 5 | AQ32: 帝尔转债!
A33: 32 | B33: 123120 | C33: 隆华转债 | D33: 300263 | E33: 隆华科技 | F33: 机械装备 | G33: 通用设备 | H33: 164.78 | I33: -1.9199999999999998e-002 | J33: -4.5000000000000005e-003 | K33: 9.96 | L33: -3.0200000000000001e-002 | M33: 121.1 | N33: 7.76 | O33: 0.28399999999999997 | P33: 128.35 | Q33: 42天 | R33: 5.59年 | S33: 3.59年 | T33: 7.99 | U33: 29 | V33: 2.2000000000000002e-002 | W33: 8.8000000000000009e-002 | X33: 0.113 | Y33: 91 | Z33: 3.16 | AA33: -5.45e-002 | AB33: -6.0400000000000002e-002 | AC33: -0.11199999999999999 | AD33: -0.114 | AE33: 83.11 | AF33: 86.94 | AG33: 0.78 | AH33: AA- | AI33: 6.2400000000000004e-002 | AJ33: =H33+100*O33 -> 193.18000000000001 | AK33: 201.2 | AL33: 318 | AM33: 114.3 | AN33: 321 | AO33: -8.1000000000000003e-002 | AP33: 4 | AQ33: 隆华转债
A34: 33 | B34: 110081 | C34: 闻泰转债 | D34: 600745 | E34: 闻泰科技 | F34: 电子 | G34: 电子行业 | H34: 162.99 | I34: -3.9000000000000003e-003 | J34: 1.01e-002 | K34: 136.98 | L34: 7.3000000000000001e-003 | M34: 111.9 | N34: 96.67 | O34: 0.14999999999999999 | P34: 141.7 | Q34: 40天 | R34: 5.59年 | S34: 3.59年 | T34: 86 | U34: 158 | V34: 1.1000000000000001e-002 | W34: 5.0000000000000003e-002 | X34: 7.0999999999999994e-002 | Y34: 1707. | Z34: 5.43 | AA34: -6.5700000000000008e-002 | AB34: -6.9199999999999998e-002 | AC34: -0.113 | AD34: -0.114 | AE34: 89.57 | AF34: 91.84 | AG34: 0.86 | AH34: AA+ | AI34: 3.6400000000000002e-002 | AJ34: =H34+100*O34 -> 177.99000000000001 | AK34: 184.3 | AL34: 289 | AM34: 92.4 | AN34: 295 | AO34: 3.5000000000000003e-002 | AP34: 10 | AQ34: 闻泰转债
A35: 34 | B35: 118001 | C35: 金博转债 | D35: 688598 | E35: 金博股份 | F35: 能源电力 | G35: 太阳能 | H35: 161.72 | I35: -1.04e-002 | J35: -2.6699999999999998e-002 | K35: 337.12 | L35: -4.7400000000000005e-002 | M35: 121.6 | N35: 271.12 | O35: 0.30099999999999999 | P35: 124.34 | Q35: 35天 | R35: 5.58年 | S35: 3.58年 | T35: 6 | U35: 18 | V35: 1.8000000000000002e-002 | W35: 2.2000000000000002e-002 | X35: 2.7999999999999997e-002 | Y35: 270 | Z35: 16.42 | AA35: -5.0900000000000001e-002 | AB35: -5.6900000000000006e-002 | AC35: -0.107 | AD35: -0.109 | AE35: 80.52 | AF35: 82.72 | AG35: 0.78 | AH35: A+ | AI35: 7.3399999999999993e-002 | AJ35: =H35+100*O35 -> 191.81999999999999 | AK35: 199.1 | AL35: 315 | AM35: 116.4 | AN35: 322 | AO35: -7.2999999999999995e-002 | AP35: 4 | AQ35: 金博转债
A36: 35 | B36: 113627 | C36: 太平转债! | D36: 603877 | E36: 太平鸟 | F36: 服装纺织 | G36: 服装行业 | H36: 119.21 | I36: -7.6e-003 | J36: 3.8e-003 | K36: 28.23 | L36: -2.9900000000000003e-002 | M36: 115.1 | N36: 50.32 | O36: 1.1200000000000001 | P36: 56.1 | Q36: 27天 | R36: 5.55年 | S36: 3.55年 | T36: 8 | U36: 2.9 | V36: 3.0000000000000001e-003 | W36: 5.9000000000000004e-002 | X36: 3.3000000000000002e-002 | Y36: 135 | Z36: 3.3 | AA36: -6.4000000000000003e-003 | AB36: -1.1200000000000002e-002 | AC36: -3.73e-002 | AD36: -3.9100000000000003e-002 | AE36: 89.21 | AF36: 92.27 | AG36: 0.13 | AH36: AA | AI36: 4.1399999999999999e-002 | AJ36: =H36+100*O36 -> 231.21000000000001 | AK36: 182.3 | AL36: 286 | AM36: 90 | AN36: 286 | AO36: -0.11699999999999999 | AP36: 3 | AQ36: 太平转债!
A37: 36 | B37: 123119 | C37: 康泰转2! | D37: 300601 | E37: 康泰生物 | F37: 医药 | G37: 生物制药 | H37: 131.799 | I37: 3.0000000000000001e-003 | J37: -4.6999999999999993e-003 | K37: 100.57 | L37: -6.3e-003 | M37: 117.1 | N37: 145.33 | O37: 0.90500000000000003 | P37: 69.2 | Q37: 27天 | R37: 5.55年 | S37: 3.55年 | T37: 20 | U37: 15 | V37: 6.0000000000000001e-003 | W37: 2.8999999999999998e-002 | X37: 2.e-002 | Y37: 691 | Z37: 8.12 | AA37: -2.1400000000000002e-002 | AB37: -2.6600000000000002e-002 | AC37: -6.3099999999999989e-002 | AD37: -6.480000000000001e-002 | AE37: 89.21 | AF37: 93.87 | AG37: 0.26 | AH37: AA | AI37: 4.1399999999999999e-002 | AJ37: =H37+100*O37 -> 222.29900000000001 | AK37: 194.4 | AL37: 311 | AM37: 100.5 | AN37: 307 | AO37: -8.5999999999999993e-002 | AP37: 10 | AQ37: 康泰转2!
A38: 37 | B38: 127041 | C38: 弘亚转债! | D38: 2833 | E38: 弘亚数控 | F38: 机械装备 | G38: 专用设备 | H38: 124.383 | I38: -6.5000000000000006e-003 | J38: 4.8999999999999998e-003 | K38: 31.88 | L38: -3.8e-003 | M38: 118.75 | N38: 38.09 | O38: 0.48599999999999999 | P38: 83.7 | Q38: 23天 | R38: 4.55年 | S38: 2.55年 | T38: 6 | U38: 3.4 | V38: 5.0000000000000001e-003 | W38: 6.2e-002 | X38: 5.2000000000000005e-002 | Y38: 97 | Z38: 4.84 | AA38: -1.03e-002 | AB38: -1.7299999999999999e-002 | AC38: -6.93e-002 | AD38: -7.0900000000000005e-002 | AE38: 87.44 | AF38: 91.18 | AG38: 0.44 | AH38: AA- | AI38: 6.08e-002 | AJ38: =H38+100*O38 -> 172.983 | AK38: 165.1 | AL38: 220 | AM38: 73.9 | AN38: 227 | AO38: -1.6e-002 | AP38: 5 | AQ38: 弘亚转债!
A39: 38 | B39: 123118 | C39: 惠城转债 | D39: 300779 | E39: 惠城环保 | F39: 化工 | G39: 其他 | H39: 122.801 | I39: -1.29e-002 | J39: -1.77e-002 | K39: 16.93 | L39: -4.6199999999999998e-002 | M39: 121.7 | N39: 17.11 | O39: 0.24100000000000002 | P39: 98.95 | Q39: 19天 | R39: 5.53年 | S39: 3.53年 | T39: 3.2 | U39: 11 | V39: 2.7999999999999997e-002 | W39: 0.18899999999999997 | X39: 0.187 | Y39: 17 | Z39: 2.54 | AA39: -1.7000000000000001e-003 | AB39: -8.3000000000000001e-003 | AC39: -4.2900000000000001e-002 | AD39: -4.5100000000000001e-002 | AE39: 80.78 | AF39: 83.05 | AG39: 0.66 | AH39: A+ | AI39: 7.3399999999999993e-002 | AJ39: =H39+100*O39 -> 146.90100000000001 | AK39: 146.7 | AL39: 76 | AM39: 63.6 | AN39: 173 | AO39: -4.9000000000000002e-002 | AP39: 10 | AQ39: 惠城转债
A40: 39 | B40: 127040 | C40: 国泰转债 | D40: 2091 | E40: 江苏国泰 | F40: 商业零售 | G40: 商业零售 | H40: 159.18 | I40: -1.2500000000000001e-002 | J40: -1.1699999999999999e-002 | K40: 13.28 | L40: -2.7799999999999998e-002 | M40: 112.5 | N40: 9.02 | O40: 8.1000000000000003e-002 | P40: 147.23 | Q40: 19天 | R40: 5.53年 | S40: 3.53年 | T40: 45.6 | U40: 177 | V40: 2.4e-002 | W40: 0.21899999999999997 | X40: 0.32299999999999995 | Y40: 208 | Z40: 2.17 | AA40: -6.1600000000000002e-002 | AB40: -6.5299999999999997e-002 | AC40: -0.10800000000000001 | AD40: -0.109 | AE40: 90.32 | AF40: 92.6 | AG40: 0.87 | AH40: AA+ | AI40: 3.6400000000000002e-002 | AJ40: =H40+100*O40 -> 167.28 | AK40: 171.1 | AL40: 251 | AM40: 78.5 | AN40: 245 | AO40: 5.7000000000000002e-002 | AP40: 11 | AQ40: 国泰转债
A41: 40 | B41: 127039 | C41: 北港转债 | D41: 582 | E41: 北部湾港 | F41: 机场高速 | G41: 港口 | H41: 124 | I41: -2.0999999999999999e-003 | J41: 7.000000000000001e-004 | K41: 7.98 | L41: -2.5000000000000001e-003 | M41: 113 | N41: 8.35 | O41: 0.29699999999999999 | P41: 95.57 | Q41: 11天 | R41: 5.51年 | S41: 3.51年 | T41: 30 | U41: 30 | V41: 8.0000000000000002e-003 | W41: 0.23000000000000001 | X41: 0.22 | Y41: 130 | Z41: 1.21 | AA41: -1.7000000000000001e-002 | AB41: -2.12e-002 | AC41: -4.8300000000000003e-002 | AD41: -5.0000000000000003e-002 | AE41: 91.49 | AF41: 94.11 | AG41: 0.53 | AH41: AAA | AI41: 3.44e-002 | AJ41: =H41+100*O41 -> 153.69999999999999 | AK41: 152.4 | AL41: 137 | AM41: 58.3 | AN41: 139 | AO41: 8.0000000000000002e-003 | AP41: 6 | AQ41: 北港转债
A42: 41 | B42: 113626 | C42: 伯特转债 | D42: 603596 | E42: 伯特利 | F42: 汽车 | G42: 零部件制 | H42: 224.26 | I42: 4.0000000000000002e-004 | J42: -3.9199999999999999e-002 | K42: 72.51 | L42: -4.0999999999999995e-002 | M42: 121.1 | N42: 36.01 | O42: 0.114 | P42: 201.36 | Q42: 11天 | R42: 5.51年 | S42: 3.51年 | T42: 9.02 | U42: 209 | V42: 0.10400000000000001 | W42: 2.9999999999999999e-002 | X42: 6.0999999999999999e-002 | Y42: 296 | Z42: 9.36 | AA42: -0.107 | AB42: -0.113 | AC42: -0.10199999999999999 | AD42: -0.10300000000000001 | AE42: 89.37 | AF42: 97.23 | AG42: 0.95 | AH42: AA | AI42: 4.1399999999999999e-002 | AJ42: =H42+100*O42 -> 235.66 | AK42: 247.2 | AL42: 342 | AM42: 149.9 | AN42: 343 | AO42: 5.2000000000000005e-002 | AP42: 3 | AQ42: 伯特转债
A43: 42 | B43: 123117 | C43: 健帆转债! | D43: 300529 | E43: 健帆生物 | F43: 医药 | G43: 医疗器械 | H43: 116.188 | I43: -2.2000000000000001e-003 | J43: 4.0000000000000001e-003 | K43: 51.71 | L43: 1.3500000000000002e-002 | M43: 115.1 | N43: 90.57 | O43: 1.04 | P43: 57.09 | Q43: 4.5天 | R43: 5.49年 | S43: 3.49年 | T43: 10 | U43: 23 | V43: 1.9e-002 | W43: 2.4e-002 | X43: 1.3999999999999999e-002 | Y43: 417 | Z43: 13.65 | AA43: -1.7000000000000001e-003 | AB43: -6.6e-003 | AC43: -3.1099999999999999e-002 | AD43: -3.2899999999999999e-002 | AE43: 89.43 | AF43: 92.5 | AG43: 0.13 | AH43: AA | AI43: 4.1399999999999999e-002 | AJ43: =H43+100*O43 -> 220.18799999999999 | AK43: 175.3 | AL43: 265 | AM43: 82.8 | AN43: 261 | AO43: 1.e-003 | AP43: 7 | AQ43: 健帆转债!
A44: 43 | B44: 113051 | C44: 节能转债 | D44: 601016 | E44: 节能风电 | F44: 能源电力 | G44: 风能 | H44: 189.17 | I44: -1.4199999999999999e-002 | J44: 2.3999999999999998e-003 | K44: 6.97 | L44: -1.2699999999999999e-002 | M44: 114.5 | N44: 4.05 | O44: 9.9000000000000005e-002 | P44: 172.1 | Q44: 0.5天 | R44: 5.49年 | S44: 3.49年 | T44: 30 | U44: 1075. | V44: 0.18600000000000003 | W44: 8.5999999999999993e-002 | X44: 0.14800000000000002 | Y44: 349 | Z44: 3.39 | AA44: -8.8499999999999995e-002 | AB44: -9.2600000000000002e-002 | AC44: -0.14699999999999999 | AD44: -0.14800000000000002 | AE44: 90.46 | AF44: 94.38 | AG44: 0.92 | AH44: AA+ | AI44: 3.6400000000000002e-002 | AJ44: =H44+100*O44 -> 199.06999999999999 | AK44: 206.2 | AL44: 321 | AM44: 111.9 | AN44: 318 | AO44: 4.4000000000000004e-002 | AP44: 9 | AQ44: 节能转债
A45: 44 | B45: 113050 | C45: 南银转债 | D45: 601009 | E45: 南京银行 | F45: 金融 | G45: 银行行业 | H45: 118.8 | I45: -1.5e-003 | J45: -3.2000000000000002e-003 | K45: 8.92 | L45: -1.e-002 | M45: 111.2 | N45: 10.1 | O45: 0.34499999999999997 | P45: 88.32 | Q45: 已到 | R45: 5.47年 | S45: 无权 | T45: 200 | U45: 82 | V45: 3.0000000000000001e-003 | W45: 0.22399999999999998 | X45: 0.19800000000000001 | Y45: 893 | Z45: 0.84 | AA45: -1.2199999999999999e-002 | AB45: -1.5900000000000001e-002 | AC45: 无权 | AD45: 无权 | AE45: 无权 | AF45: 92.67 | AG45: 0.47 | AH45: AAA | AI45: 3.44e-002 | AJ45: =H45+100*O45 -> 153.30000000000001 | AK45: 149.3 | AL45: 105 | AM45: 56.6 | AN45: 124 | AO45: -2.3e-002 | AP45: 7 | AQ45: 南银转债
A46: 45 | B46: 113625 | C46: 江山转债! | D46: 603208 | E46: 江山欧派 | F46: 其他 | G46: 家居用品 | H46: 114.88 | I46: -8.9999999999999998e-004 | J46: -6.8000000000000005e-003 | K46: 56.16 | L46: -3.9e-002 | M46: 124 | N46: 96.33 | O46: 0.97099999999999997 | P46: 58.3 | Q46: 已到 | R46: 5.46年 | S46: 3.46年 | T46: 5.83 | U46: 5.8 | V46: 9.0000000000000011e-003 | W46: 9.9000000000000005e-002 | X46: 5.7999999999999996e-002 | Y46: 59 | Z46: 3.21 | AA46: 1.44e-002 | AB46: 6.8999999999999999e-003 | AC46: -2.75e-002 | AD46: -2.9500000000000002e-002 | AE46: 83.63 | AF46: 89.71 | AG46: 0.2 | AH46: AA- | AI46: 6.2400000000000004e-002 | AJ46: =H46+100*O46 -> 211.97999999999999 | AK46: 171.5 | AL46: 255 | AM46: 81.7 | AN46: 255 | AO46: -3.6000000000000004e-002 | AP46: 7 | AQ46: 江山转债!
A47: 46 | B47: 127038 | C47: 国微转债 | D47: 2049 | E47: 紫光国微 | F47: 电子 | G47: 芯片制造 | H47: 188.5 | I47: -4.1999999999999997e-003 | J47: 1.9900000000000001e-002 | K47: 206.08 | L47: 1.8100000000000002e-002 | M47: 114.5 | N47: 137.78 | O47: 0.26000000000000001 | P47: 149.57 | Q47: 已到 | R47: 5.46年 | S47: 3.46年 | T47: 15 | U47: 41 | V47: 1.3999999999999999e-002 | W47: 1.2e-002 | X47: 1.8000000000000002e-002 | Y47: 1251. | Z47: 19.03 | AA47: -8.8399999999999992e-002 | AB47: -9.2499999999999999e-002 | AC47: -0.14800000000000002 | AD47: -0.14899999999999999 | AE47: 90.56 | AF47: 94.49 | AG47: 0.87 | AH47: AA+ | AI47: 3.6400000000000002e-002 | AJ47: =H47+100*O47 -> 214.5 | AK47: 227.4 | AL47: 335 | AM47: 132.9 | AN47: 333 | AO47: -5.4000000000000006e-002 | AP47: 5 | AQ47: 国微转债
A48: 47 | B48: 113049 | C48: 长汽转债 | D48: 601633 | E48: 长城汽车 | F48: 汽车 | G48: 乘用车 | H48: 170.46 | I48: -4.3899999999999995e-002 | J48: 2.e-003 | K48: 50.12 | L48: -5.2199999999999996e-002 | M48: 110.5 | N48: 38.01 | O48: 0.29299999999999998 | P48: 131.86 | Q48: 已到 | R48: 5.46年 | S48: 3.46年 | T48: 35 | U48: 195 | V48: 3.3000000000000002e-002 | W48: 8.0000000000000002e-003 | X48: 1.e-002 | Y48: 4629. | Z48: 7.89 | AA48: -7.7199999999999991e-002 | AB48: -8.0299999999999996e-002 | AC48: -0.128 | AD48: -0.128 | AE48: 90.52 | AF48: 92.1 | AG48: 0.8 | AH48: AAA | AI48: 3.44e-002 | AJ48: =H48+100*O48 -> 199.75999999999999 | AK48: 209.1 | AL48: 325 | AM48: 117 | AN48: 323 | AO48: -9.4e-002 | AP48: 5 | AQ48: 长汽转债
A49: 48 | B49: 123116 | C49: 万兴转债 | D49: 300624 | E49: 万兴科技 | F49: 计算机及 | G49: 软件开发 | H49: 128.902 | I49: 9.4999999999999998e-003 | J49: 6.0000000000000001e-003 | K49: 50.01 | L49: 2.29e-002 | M49: 121.4 | N49: 49.78 | O49: 0.28300000000000003 | P49: 100.46 | Q49: 已到 | R49: 5.46年 | S49: 3.46年 | T49: 3.78 | U49: 216 | V49: 0.44400000000000001 | W49: 5.7999999999999996e-002 | X49: 5.7999999999999996e-002 | Y49: 65 | Z49: 7.81 | AA49: -1.1200000000000002e-002 | AB49: -1.77e-002 | AC49: -5.7300000000000004e-002 | AD49: -5.9400000000000001e-002 | AE49: 80.95 | AF49: 83.23 | AG49: 0.67 | AH49: A+ | AI49: 7.3399999999999993e-002 | AJ49: =H49+100*O49 -> 157.202 | AK49: 157.3 | AL49: 170 | AM49: 74.1 | AN49: 229 | AO49: 8.900000000000001e-002 | AP49: 8 | AQ49: 万兴转债
A50: 49 | B50: 123115 | C50: 捷捷转债 | D50: 300623 | E50: 捷捷微电 | F50: 电子 | G50: 元器件制 | H50: 140.69 | I50: -1.2699999999999999e-002 | J50: 2.5999999999999999e-003 | K50: 31.62 | L50: -1.43e-002 | M50: 118.5 | N50: 29 | O50: 0.28999999999999998 | P50: 109.03 | Q50: 已到 | R50: 5.45年 | S50: 3.45年 | T50: 11.9 | U50: 46 | V50: 2.7000000000000003e-002 | W50: 5.0999999999999997e-002 | X50: 5.5999999999999994e-002 | Y50: 233 | Z50: 8.19 | AA50: -3.1600000000000003e-002 | AB50: -3.7200000000000004e-002 | AC50: -8.1199999999999994e-002 | AD50: -8.2899999999999988e-002 | AE50: 83.6 | AF50: 85.78 | AG50: 0.7 | AH50: AA- | AI50: 6.2400000000000004e-002 | AJ50: =H50+100*O50 -> 169.69 | AK50: 172.3 | AL50: 258 | AM50: 86.6 | AN50: 278 | AO50: -6.9000000000000006e-002 | AP50: 7 | AQ50: 捷捷转债
A51: 50 | B51: 127037 | C51: 银轮转债 | D51: 2126 | E51: 银轮股份 | F51: 汽车 | G51: 零部件制 | H51: 153.63 | I51: -1.09e-002 | J51: -9.0000000000000011e-003 | K51: 12.23 | L51: -2.86e-002 | M51: 115.1 | N51: 10.77 | O51: 0.35299999999999998 | P51: 113.56 | Q51: 已到 | R51: 5.45年 | S51: 3.45年 | T51: 7 | U51: 8 | V51: 6.9999999999999993e-003 | W51: 7.2000000000000008e-002 | X51: 8.199999999999999e-002 | Y51: 97 | Z51: 2.29 | AA51: -5.2499999999999998e-002 | AB51: -5.7000000000000002e-002 | AC51: -0.10099999999999999 | AD51: -0.10300000000000001 | AE51: 89.58 | AF51: 92.66 | AG51: 0.7 | AH51: AA | AI51: 4.1399999999999999e-002 | AJ51: =H51+100*O51 -> 188.93000000000001 | AK51: 193.7 | AL51: 310 | AM51: 101 | AN51: 308 | AO51: -6.5000000000000002e-002 | AP51: 3 | AQ51: 银轮转债
A52: 51 | B52: 127036 | C52: 三花转债 | D52: 2050 | E52: 三花智控 | F52: 机械装备 | G52: 通用设备 | H52: 138.3 | I52: 5.1000000000000004e-003 | J52: -1.15e-002 | K52: 22.7 | L52: -1.0500000000000001e-002 | M52: 114.5 | N52: 21.55 | O52: 0.313 | P52: 105.34 | Q52: 已到 | R52: 5.43年 | S52: 3.43年 | T52: 30 | U52: 18 | V52: 4.0000000000000001e-003 | W52: 3.7000000000000005e-002 | X52: 3.9e-002 | Y52: 815 | Z52: 7.89 | AA52: -3.4599999999999999e-002 | AB52: -3.9199999999999999e-002 | AC52: -7.9000000000000001e-002 | AD52: -8.0399999999999985e-002 | AE52: 90.64 | AF52: 94.57 | AG52: 0.61 | AH52: AA+ | AI52: 3.6400000000000002e-002 | AJ52: =H52+100*O52 -> 169.60000000000002 | AK52: 171.3 | AL52: 253 | AM52: 76.7 | AN52: 240 | AO52: -2.7000000000000003e-002 | AP52: 7 | AQ52: 三花转债
A53: 52 | B53: 127035 | C53: 濮耐转债 | D53: 2225 | E53: 濮耐股份 | F53: 钢铁 | G53: 钢铁行业 | H53: 124.3 | I53: -1.2199999999999999e-002 | J53: -5.6000000000000008e-003 | K53: 4.33 | L53: -3.3500000000000002e-002 | M53: 114.7 | N53: 4.43 | O53: 0.27200000000000002 | P53: 97.74 | Q53: 已到 | R53: 4.42年 | S53: 2.42年 | T53: 6.26 | U53: 9.4 | V53: 1.2e-002 | W53: 0.14300000000000002 | X53: 0.14000000000000001 | Y53: 44 | Z53: 1.43 | AA53: -1.84e-002 | AB53: -2.4199999999999999e-002 | AC53: -6.93e-002 | AD53: -7.1500000000000008e-002 | AE53: 93.57 | AF53: 96.91 | AG53: 0.53 | AH53: AA | AI53: 3.9800000000000002e-002 | AJ53: =H53+100*O53 -> 151.5 | AK53: 150.9 | AL53: 120 | AM53: 53.9 | AN53: 106 | AO53: -3.9e-002 | AP53: 9 | AQ53: 濮耐转债
A54: 53 | B54: 123114 | C54: 三角转债! | D54: 300775 | E54: 三角防务 | F54: 航空航天 | G54: 航空航天 | H54: 170.23 | I54: -1.84e-002 | J54: 0. | K54: 45.81 | L54: -2.2000000000000002e-002 | M54: 121 | N54: 31.82 | O54: 0.182 | P54: 143.97 | Q54: 已到 | R54: 5.41年 | S54: 3.41年 | T54: 9.04 | U54: 73 | V54: 4.7e-002 | W54: 4.0000000000000001e-002 | X54: 5.7000000000000002e-002 | Y54: 227 | Z54: 10.5 | AA54: -6.2199999999999998e-002 | AB54: -6.8199999999999997e-002 | AC54: -0.126 | AD54: -0.127 | AE54: 83.87 | AF54: 87.8 | AG54: 0.84 | AH54: AA- | AI54: 6.2400000000000004e-002 | AJ54: =H54+100*O54 -> 188.42999999999998 | AK54: 196.5 | AL54: 313 | AM54: 108.7 | AN54: 316 | AO54: -4.4999999999999998e-002 | AP54: 6 | AQ54: 三角转债!
A55: 54 | B55: 111000 | C55: 起帆转债 | D55: 605222 | E55: 起帆电缆 | F55: 能源电力 | G55: 电力设备 | H55: 142 | I55: 1.1999999999999999e-003 | J55: -3.0800000000000001e-002 | K55: 24.06 | L55: -3.95e-002 | M55: 120.5 | N55: 20.1 | O55: 0.18600000000000003 | P55: 119.7 | Q55: 已到 | R55: 5.41年 | S55: 3.41年 | T55: 10 | U55: 45 | V55: 3.2000000000000001e-002 | W55: 9.9000000000000005e-002 | X55: 0.11900000000000001 | Y55: 101 | Z55: 2.9 | AA55: -3.04e-002 | AB55: -3.6600000000000001e-002 | AC55: -8.4499999999999992e-002 | AD55: -8.6199999999999999e-002 | AE55: 83.81 | AF55: 87.44 | AG55: 0.75 | AH55: AA- | AI55: 6.2400000000000004e-002 | AJ55: =H55+100*O55 -> 160.59999999999999 | AK55: 164.3 | AL55: 217 | AM55: 76.9 | AN55: 241 | AO55: -7.0999999999999994e-002 | AP55: 10 | AQ55: 起帆转债
A56: 55 | B56: 127034 | C56: 绿茵转债! | D56: 2887 | E56: 绿茵生态 | F56: 城市公用 | G56: 生态环境 | H56: 106.31 | I56: 5.0000000000000001e-004 | J56: -9.1000000000000004e-003 | K56: 9.49 | L56: -1.9599999999999999e-002 | M56: 119 | N56: 12.38 | O56: 0.38700000000000001 | P56: 76.66 | Q56: 已到 | R56: 5.35年 | S56: 3.35年 | T56: 7.12 | U56: 14 | V56: 1.9e-002 | W56: 0.23999999999999999 | X56: 0.184 | Y56: 30 | Z56: 1.45 | AA56: 2.18e-002 | AB56: 1.54e-002 | AC56: -6.5000000000000006e-003 | AD56: -8.6999999999999994e-003 | AE56: 84.21 | AF56: 86.72 | AG56: 0.44 | AH56: AA- | AI56: 6.2400000000000004e-002 | AJ56: =H56+100*O56 -> 145.00999999999999 | AK56: 136 | AL56: 17 | AM56: 49.2 | AN56: 78 | AO56: -1.3000000000000001e-002 | AP56: 39 | AQ56: 绿茵转债!
A57: 56 | B57: 113624 | C57: 正川转债! | D57: 603976 | E57: 正川股份 | F57: 医药 | G57: 医药行业 | H57: 114.05 | I57: -3.5999999999999999e-003 | J57: -8.8999999999999999e-003 | K57: 32.04 | L57: -3.1699999999999999e-002 | M57: 121.6 | N57: 46.69 | O57: 0.66200000000000003 | P57: 68.62 | Q57: 已到 | R57: 5.34年 | S57: 3.34年 | T57: 4.05 | U57: 7.6 | V57: 1.6e-002 | W57: 8.4000000000000005e-002 | X57: 5.7000000000000002e-002 | Y57: 48 | Z57: 4.39 | AA57: 1.24e-002 | AB57: 5.3e-003 | AC57: -2.46e-002 | AD57: -2.7099999999999999e-002 | AE57: 81.87 | AF57: 84.11 | AG57: 0.39 | AH57: A+ | AI57: 7.3399999999999993e-002 | AJ57: =H57+100*O57 -> 180.25 | AK57: 159.5 | AL57: 184 | AM57: 75.4 | AN57: 236 | AO57: -7.2000000000000008e-002 | AP57: 22 | AQ57: 正川转债!
A58: 57 | B58: 113048 | C58: 晶科转债!! | D58: 601778 | E58: 晶科科技 | F58: 能源电力 | G58: 太阳能 | H58: 189.19 | I58: -2.2599999999999999e-002 | J58: 6.1999999999999998e-003 | K58: 9.27 | L58: -1.8000000000000002e-002 | M58: 117.1 | N58: 5.46 | O58: 0.114 | P58: 169.78 | Q58: 已到 | R58: 5.33年 | S58: 3.33年 | T58: 23 | U58: 438 | V58: 9.9000000000000005e-002 | W58: 8.5999999999999993e-002 | X58: 0.14499999999999999 | Y58: 268 | Z58: 2.26 | AA58: -8.7499999999999994e-002 | AB58: -9.2399999999999996e-002 | AC58: -0.153 | AD58: -0.155 | AE58: 90.03 | AF58: 94.74 | AG58: 0.91 | AH58: AA | AI58: 4.1399999999999999e-002 | AJ58: =H58+100*O58 -> 200.59 | AK58: 208.6 | AL58: 323 | AM58: 113.9 | AN58: 320 | AO58: -3.0000000000000001e-003 | AP58: 14 | AQ58: 晶科转债!!
A59: 58 | B59: 123113 | C59: 仙乐转债! | D59: 300791 | E59: 仙乐健康 | F59: 食品饮料 | G59: 食品饮料 | H59: 116.701 | I59: 1.9e-003 | J59: 4.0999999999999995e-003 | K59: 40.8 | L59: 1.5700000000000002e-002 | M59: 118.5 | N59: 56.88 | O59: 0.627 | P59: 71.73 | Q59: 已到 | R59: 5.32年 | S59: 3.32年 | T59: 10.2 | U59: 9.3 | V59: 8.0000000000000002e-003 | W59: 0.13900000000000001 | X59: 0.10000000000000001 | Y59: 74 | Z59: 3.17 | AA59: 2.8999999999999998e-003 | AB59: -3.0999999999999999e-003 | AC59: -3.3300000000000003e-002 | AD59: -3.5299999999999998e-002 | AE59: 84.3 | AF59: 86.5 | AG59: 0.38 | AH59: AA- | AI59: 6.2400000000000004e-002 | AJ59: =H59+100*O59 -> 179.40100000000001 | AK59: 161.7 | AL59: 199 | AM59: 75.2 | AN59: 232 | AO59: -2.e-002 | AP59: 5 | AQ59: 仙乐转债!
A60: 59 | B60: 127033 | C60: 中装转2! | D60: 2822 | E60: 中装建设 | F60: 建筑 | G60: 装饰工程 | H60: 124.5 | I60: 0. | J60: -4.0800000000000003e-002 | K60: 6.27 | L60: -7.2499999999999995e-002 | M60: 117.1 | N60: 6.28 | O60: 0.247 | P60: 99.84 | Q60: 已到 | R60: 5.31年 | S60: 3.31年 | T60: 11.6 | U60: 863 | V60: 0.60199999999999998 | W60: 0.25700000000000001 | X60: 0.25600000000000001 | Y60: 45 | Z60: 1.29 | AA60: -1.1699999999999999e-002 | AB60: -1.72e-002 | AC60: -5.1900000000000002e-002 | AD60: -5.3800000000000001e-002 | AE60: 90.1 | AF60: 94.81 | AG60: 0.56 | AH60: AA | AI60: 4.1399999999999999e-002 | AJ60: =H60+100*O60 -> 149.19999999999999 | AK60: 149.2 | AL60: 103 | AM60: 54.3 | AN60: 109 | AO60: 9.5000000000000001e-002 | AP60: 27 | AQ60: 中装转2!
A61: 60 | B61: 110080 | C61: 东湖转债 | D61: 600133 | E61: 东湖高新 | F61: 建筑 | G61: 建筑工程 | H61: 112.02 | I61: -2.5000000000000001e-003 | J61: 3.4000000000000002e-003 | K61: 5.37 | L61: 1.9e-003 | M61: 115.1 | N61: 6.05 | O61: 0.26200000000000001 | P61: 88.76 | Q61: 已到 | R61: 5.30年 | S61: 3.30年 | T61: 15.5 | U61: 12 | V61: 6.9999999999999993e-003 | W61: 0.36299999999999999 | X61: 0.32200000000000001 | Y61: 43 | Z61: 0.76 | AA61: 5.1999999999999998e-003 | AB61: 1.e-004 | AC61: -2.2499999999999999e-002 | AD61: -2.4399999999999998e-002 | AE61: 90.14 | AF61: 93.24 | AG61: 0.47 | AH61: AA | AI61: 4.1399999999999999e-002 | AJ61: =H61+100*O61 -> 138.22 | AK61: 135.3 | AL61: 16 | AM61: 42 | AN61: 34 | AO61: 1.8000000000000002e-002 | AP61: 31 | AQ61: 东湖转债
A62: 61 | B62: 127032 | C62: 苏行转债 | D62: 2966 | E62: 苏州银行 | F62: 金融 | G62: 银行行业 | H62: 112.38 | I62: 2.5000000000000001e-003 | J62: -2.5000000000000001e-003 | K62: 6.75 | L62: 0. | M62: 115.1 | N62: 8.1 | O62: 0.34899999999999998 | P62: 83.33 | Q62: 已到 | R62: 5.30年 | S62: 无权 | T62: 50 | U62: 5.9 | V62: 1.e-003 | W62: 0.222 | X62: 0.185 | Y62: 225 | Z62: 0.71 | AA62: 4.5999999999999999e-003 | AB62: -5.0000000000000001e-004 | AC62: 无权 | AD62: 无权 | AE62: 无权 | AF62: 96.54 | AG62: 0.37 | AH62: AAA | AI62: 3.44e-002 | AJ62: =H62+100*O62 -> 147.28 | AK62: 141.4 | AL62: 38 | AM62: 44.9 | AN62: 48 | AO62: 1.e-003 | AP62: 10 | AQ62: 苏行转债
A63: 62 | B63: 113047 | C63: 旗滨转债! | D63: 601636 | E63: 旗滨集团 | F63: 建筑 | G63: 玻璃 | H63: 169.37 | I63: -2.0400000000000001e-002 | J63: 8.5000000000000006e-003 | K63: 17.43 | L63: -1.47e-002 | M63: 114 | N63: 12.8 | O63: 0.24399999999999999 | P63: 136.17 | Q63: 已到 | R63: 5.29年 | S63: 3.29年 | T63: 15 | U63: 117 | V63: 4.5999999999999999e-002 | W63: 3.2000000000000001e-002 | X63: 4.4000000000000004e-002 | Y63: 468 | Z63: 3.81 | AA63: -7.2999999999999995e-002 | AB63: -7.7199999999999991e-002 | AC63: -0.13200000000000001 | AD63: -0.13300000000000001 | AE63: 90.66 | AF63: 94.62 | AG63: 0.81 | AH63: AA+ | AI63: 3.6400000000000002e-002 | AJ63: =H63+100*O63 -> 193.77000000000001 | AK63: 202.6 | AL63: 319 | AM63: 108 | AN63: 315 | AO63: -1.8000000000000002e-002 | AP63: 7 | AQ63: 旗滨转债!
A64: 63 | B64: 123112 | C64: 万讯转债! | D64: 300112 | E64: 万讯自控 | F64: 机械装备 | G64: 专用设备 | H64: 150.491 | I64: -2.0099999999999996e-002 | J64: -1.8500000000000003e-002 | K64: 12.38 | L64: -4.8399999999999999e-002 | M64: 124.4 | N64: 8.93 | O64: 8.5999999999999993e-002 | P64: 138.63 | Q64: 已到 | R64: 5.29年 | S64: 3.29年 | T64: 2.45 | U64: 206 | V64: 0.55600000000000005 | W64: 6.9000000000000006e-002 | X64: 9.6000000000000002e-002 | Y64: 35 | Z64: 3.25 | AA64: -3.61e-002 | AB64: -4.3400000000000001e-002 | AC64: -0.10199999999999999 | AD64: -0.10099999999999999 | AE64: 84.86 | AF64: 91.01 | AG64: 0.8 | AH64: AA- | AI64: 6.2400000000000004e-002 | AJ64: =H64+100*O64 -> 159.09100000000001 | AK64: 162.3 | AL64: 203 | AM64: 71.3 | AN64: 216 | AO64: -1.1000000000000001e-002 | AP64: 15 | AQ64: 万讯转债!
A65: 64 | B65: 113623 | C65: 凤21转债 | D65: 603225 | E65: 新凤鸣 | F65: 化工 | G65: 化纤 | H65: 121.75 | I65: -4.0000000000000002e-004 | J65: -8.0000000000000002e-003 | K65: 13.92 | L65: -2.0400000000000001e-002 | M65: 117.1 | N65: 16.47 | O65: 0.441 | P65: 84.52 | Q65: 已到 | R65: 5.29年 | S65: 3.29年 | T65: 25 | U65: 69 | V65: 2.3e-002 | W65: 0.11699999999999999 | X65: 9.9000000000000005e-002 | Y65: 213 | Z65: 1.34 | AA65: -7.4999999999999997e-003 | AB65: -1.3100000000000001e-002 | AC65: -4.6100000000000002e-002 | AD65: -4.7899999999999998e-002 | AE65: 90.18 | AF65: 94.89 | AG65: 0.41 | AH65: AA | AI65: 4.1399999999999999e-002 | AJ65: =H65+100*O65 -> 165.84999999999999 | AK65: 159 | AL65: 178 | AM65: 64.1 | AN65: 177 | AO65: -4.2999999999999997e-002 | AP65: 4 | AQ65: 凤21转债
A66: 65 | B66: 123111 | C66: 东财转3! | D66: 300059 | E66: 东方财富 | F66: 金融 | G66: 证券行业 | H66: 168.8 | I66: -8.199999999999999e-003 | J66: 4.4000000000000003e-003 | K66: 37.31 | L66: -4.3e-003 | M66: 110.5 | N66: 23.35 | O66: 5.5999999999999994e-002 | P66: 159.79 | Q66: 已到 | R66: 5.28年 | S66: 3.28年 | T66: 151 | U66: 518 | V66: 2.e-002 | W66: 3.9e-002 | X66: 6.3e-002 | Y66: 3856. | Z66: 9.89 | AA66: -7.7899999999999997e-002 | AB66: -8.1099999999999992e-002 | AC66: -0.13200000000000001 | AD66: -0.13300000000000001 | AE66: 90.22 | AF66: 91.69 | AG66: 0.91 | AH66: AA+ | AI66: 3.6400000000000002e-002 | AJ66: =H66+100*O66 -> 174.40000000000001 | AK66: 177.8 | AL66: 273 | AM66: 86.1 | AN66: 276 | AO66: 2.e-002 | AP66: 26 | AQ66: 东财转3!
A67: 66 | B67: 123109 | C67: 昌红转债! | D67: 300151 | E67: 昌红科技 | F67: 机械装备 | G67: 专用设备 | H67: 160.303 | I67: -5.3e-003 | J67: -2.5000000000000001e-003 | K67: 42.41 | L67: -9.1000000000000004e-003 | M67: 121 | N67: 28.06 | O67: 6.0999999999999999e-002 | P67: 151.14 | Q67: 已到 | R67: 5.27年 | S67: 3.27年 | T67: 4.6 | U67: 54 | V67: 7.2999999999999995e-002 | W67: 2.2000000000000002e-002 | X67: 3.3000000000000002e-002 | Y67: 213 | Z67: 20.63 | AA67: -5.2999999999999999e-002 | AB67: -5.9200000000000003e-002 | AC67: -0.11699999999999999 | AD67: -0.11800000000000001 | AE67: 84.62 | AF67: 88.59 | AG67: 0.85 | AH67: AA- | AI67: 6.2400000000000004e-002 | AJ67: =H67+100*O67 -> 166.40299999999999 | AK67: 169.5 | AL67: 245 | AM67: 80.9 | AN67: 252 | AO67: 2.e-002 | AP67: 6 | AQ67: 昌红转债!
A68: 67 | B68: 123110 | C68: 九典转债 | D68: 300705 | E68: 九典制药 | F68: 医药 | G68: 化学制药 | H68: 139.9 | I68: -4.0000000000000002e-004 | J68: -2.0199999999999999e-002 | K68: 32 | L68: -2.6800000000000001e-002 | M68: 121.4 | N68: 26.44 | O68: 0.156 | P68: 121.03 | Q68: 已到 | R68: 5.27年 | S68: 3.27年 | T68: 2.7 | U68: 85 | V68: 0.22500000000000001 | W68: 3.6000000000000004e-002 | X68: 4.2999999999999997e-002 | Y68: 75 | Z68: 7.55 | AA68: -2.7099999999999999e-002 | AB68: -3.3799999999999997e-002 | AC68: -8.2500000000000004e-002 | AD68: -8.4600000000000009e-002 | AE68: 82.11 | AF68: 84.36 | AG68: 0.77 | AH68: A+ | AI68: 7.3399999999999993e-002 | AJ68: =H68+100*O68 -> 155.5 | AK68: 158.8 | AL68: 177 | AM68: 74.4 | AN68: 231 | AO68: 9.0999999999999998e-002 | AP68: 11 | AQ68: 九典转债
A69: 68 | B69: 123108 | C69: 乐普转2! | D69: 300003 | E69: 乐普医疗 | F69: 医药 | G69: 医疗器械 | H69: 118.499 | I69: 1.2999999999999999e-003 | J69: 1.3300000000000001e-002 | K69: 22.97 | L69: 4.9800000000000004e-002 | M69: 111.1 | N69: 29.5 | O69: 0.52200000000000002 | P69: 77.86 | Q69: 已到 | R69: 4.26年 | S69: 2.26年 | T69: 16.4 | U69: 61 | V69: 3.1e-002 | W69: 4.0000000000000001e-002 | X69: 3.1e-002 | Y69: 415 | Z69: 3.6 | AA69: -1.52e-002 | AB69: -1.9900000000000001e-002 | AC69: -5.9900000000000002e-002 | AD69: -6.1399999999999996e-002 | AE69: 93.96 | AF69: 96.22 | AG69: 0.29 | AH69: AA+ | AI69: 3.4799999999999998e-002 | AJ69: =H69+100*O69 -> 170.69900000000001 | AK69: 159.1 | AL69: 181 | AM69: 62.9 | AN69: 166 | AO69: 5.0999999999999997e-002 | AP69: 12 | AQ69: 乐普转2!
A70: 69 | B70: 123107 | C70: 温氏转债! | D70: 300498 | E70: 温氏股份 | F70: 农业 | G70: 畜牧业 | H70: 133 | I70: 2.3999999999999998e-003 | J70: 1.1000000000000001e-003 | K70: 19.46 | L70: 5.1999999999999998e-003 | M70: 113 | N70: 17.62 | O70: 0.20399999999999999 | P70: 110.44 | Q70: 已到 | R70: 5.26年 | S70: 3.26年 | T70: 93 | U70: 144 | V70: 1.2e-002 | W70: 7.4999999999999997e-002 | X70: 8.3000000000000004e-002 | Y70: 1236. | Z70: 3.52 | AA70: -3.1099999999999999e-002 | AB70: -3.5299999999999998e-002 | AC70: -7.1099999999999997e-002 | AD70: -7.2900000000000006e-002 | AE70: 92.27 | AF70: 94.91 | AG70: 0.66 | AH70: AAA | AI70: 3.44e-002 | AJ70: =H70+100*O70 -> 153.40000000000001 | AK70: 155.6 | AL70: 163 | AM70: 60.6 | AN70: 151 | AO70: 0.121 | AP70: 12 | AQ70: 温氏转债!
A71: 70 | B71: 110079 | C71: 杭银转债! | D71: 600926 | E71: 杭州银行 | F71: 金融 | G71: 银行行业 | H71: 125.79 | I71: 1.6000000000000001e-003 | J71: -6.4000000000000003e-003 | K71: 13.15 | L71: -8.3000000000000001e-003 | M71: 112.4 | N71: 12.99 | O71: 0.24299999999999999 | P71: 101.23 | Q71: 已到 | R71: 5.26年 | S71: 无权 | T71: 150 | U71: 124 | V71: 6.9999999999999993e-003 | W71: 0.192 | X71: 0.19500000000000001 | Y71: 780 | Z71: 1.12 | AA71: -2.1499999999999998e-002 | AB71: -2.5600000000000001e-002 | AC71: 无权 | AD71: 无权 | AE71: 无权 | AF71: 94.36 | AG71: 0.59 | AH71: AAA | AI71: 3.44e-002 | AJ71: =H71+100*O71 -> 150.09 | AK71: 150.3 | AL71: 113 | AM71: 56 | AN71: 118 | AO71: -4.5999999999999999e-002 | AP71: 12 | AQ71: 杭银转债!
A72: 71 | B72: 113622 | C72: 杭叉转债! | D72: 603298 | E72: 杭叉集团 | F72: 机械装备 | G72: 通用设备 | H72: 116.46 | I72: 1.1999999999999999e-003 | J72: -6.4000000000000003e-003 | K72: 16.55 | L72: -1.9e-002 | M72: 112.5 | N72: 23.08 | O72: 0.624 | P72: 71.71 | Q72: 已到 | R72: 5.25年 | S72: 3.25年 | T72: 11.5 | U72: 8 | V72: 6.0000000000000001e-003 | W72: 8.0000000000000002e-002 | X72: 5.7999999999999996e-002 | Y72: 143 | Z72: 2.72 | AA72: -6.7000000000000002e-003 | AB72: -1.1000000000000001e-002 | AC72: -3.5499999999999997e-002 | AD72: -3.7100000000000001e-002 | AE72: 91.24 | AF72: 93.54 | AG72: 0.27 | AH72: AA+ | AI72: 3.6400000000000002e-002 | AJ72: =H72+100*O72 -> 178.85999999999999 | AK72: 161.2 | AL72: 192 | AM72: 67.7 | AN72: 195 | AO72: -5.0000000000000001e-003 | AP72: 5 | AQ72: 杭叉转债!
A73: 72 | B73: 127031 | C73: 洋丰转债! | D73: 902 | E73: 新洋丰 | F73: 化工 | G73: 农化 | H73: 129.55 | I73: -3.4999999999999996e-003 | J73: -8.3000000000000001e-003 | K73: 17.17 | L73: -2.2200000000000001e-002 | M73: 117.1 | N73: 17.76 | O73: 0.34000000000000002 | P73: 96.68 | Q73: 已到 | R73: 5.25年 | S73: 3.25年 | T73: 10 | U73: 14 | V73: 1.1000000000000001e-002 | W73: 4.4999999999999998e-002 | X73: 4.2999999999999997e-002 | Y73: 224 | Z73: 2.98 | AA73: -1.9400000000000001e-002 | AB73: -2.5000000000000001e-002 | AC73: -6.3899999999999998e-002 | AD73: -6.5700000000000008e-002 | AE73: 90.32 | AF73: 95.04 | AG73: 0.53 | AH73: AA | AI73: 4.1399999999999999e-002 | AJ73: =H73+100*O73 -> 163.55000000000001 | AK73: 162.4 | AL73: 204 | AM73: 67.4 | AN73: 192 | AO73: -2.e-002 | AP73: 6 | AQ73: 洋丰转债!
A74: 73 | B74: 123106 | C74: 正丹转债! | D74: 300641 | E74: 正丹股份 | F74: 化工 | G74: 化工 | H74: 118.6 | I74: -4.7999999999999996e-003 | J74: -1.06e-002 | K74: 6.77 | L74: -3.0099999999999998e-002 | M74: 125.5 | N74: 7.5 | O74: 0.314 | P74: 90.27 | Q74: 已到 | R74: 5.24年 | S74: 3.24年 | T74: 3.2 | U74: 4.3 | V74: 1.1000000000000001e-002 | W74: 9.6999999999999989e-002 | X74: 8.6999999999999994e-002 | Y74: 33 | Z74: 2.32 | AA74: 1.11e-002 | AB74: 2.8999999999999998e-003 | AC74: -3.8599999999999995e-002 | AD74: -4.0599999999999997e-002 | AE74: 84.66 | AF74: 91.96 | AG74: 0.51 | AH74: AA- | AI74: 6.2400000000000004e-002 | AJ74: =H74+100*O74 -> 150. | AK74: 146.9 | AL74: 79 | AM74: 55 | AN74: 112 | AO74: -2.1000000000000001e-002 | AP74: 19 | AQ74: 正丹转债!
A75: 74 | B75: 128145 | C75: 日丰转债! | D75: 2953 | E75: 日丰股份 | F75: 家电 | G75: 零部件制 | H75: 135.77 | I75: -2.5600000000000001e-002 | J75: -1.7299999999999999e-002 | K75: 16.34 | L75: -5.5500000000000001e-002 | M75: 115.4 | N75: 13.66 | O75: 0.13500000000000001 | P75: 119.62 | Q75: 已到 | R75: 5.24年 | S75: 3.24年 | T75: 3.8 | U75: 42 | V75: 8.0000000000000002e-002 | W75: 9.5000000000000001e-002 | X75: 0.114 | Y75: 40 | Z75: 3.48 | AA75: -3.1099999999999999e-002 | AB75: -3.61e-002 | AC75: -7.6600000000000001e-002 | AD75: -7.85e-002 | AE75: 84.59 | AF75: 84.61 | AG75: 0.77 | AH75: AA- | AI75: 6.2400000000000004e-002 | AJ75: =H75+100*O75 -> 149.27000000000001 | AK75: 151.9 | AL75: 131 | AM75: 67.3 | AN75: 191 | AO75: -0.107 | AP75: 11 | AQ75: 日丰转债!
A76: 75 | B76: 127030 | C76: 盛虹转债! | D76: 301 | E76: 东方盛虹 | F76: 化工 | G76: 化纤 | H76: 195.111 | I76: 2.5999999999999999e-003 | J76: 5.8999999999999999e-003 | K76: 22.47 | L76: 9.3999999999999986e-003 | M76: 112.5 | N76: 14.1 | O76: 0.22399999999999998 | P76: 159.36 | Q76: 已到 | R76: 5.24年 | S76: 3.24年 | T76: 50 | U76: 198 | V76: 2.e-002 | W76: 4.5999999999999999e-002 | X76: 7.2999999999999995e-002 | Y76: 1086. | Z76: 9.58 | AA76: -0.10099999999999999 | AB76: -0.105 | AC76: -0.16500000000000001 | AD76: -0.10099999999999999 | AE76: 91.27 | AF76: 93.57 | AG76: 0.91 | AH76: AA+ | AI76: 3.6400000000000002e-002 | AJ76: =H76+100*O76 -> 217.511 | AK76: 230.9 | AL76: 337 | AM76: 137.3 | AN76: 337 | AO76: -5.2999999999999999e-002 | AP76: 5 | AQ76: 盛虹转债!
A77: 76 | B77: 113046 | C77: 金田转债! | D77: 601609 | E77: 金田铜业 | F77: 有色金属 | G77: 铜金属 | H77: 118.74 | I77: -1.09e-002 | J77: 2.5999999999999999e-003 | K77: 8.58 | L77: -2.3900000000000001e-002 | M77: 114.9 | N77: 10.75 | O77: 0.48799999999999999 | P77: 79.81 | Q77: 已到 | R77: 5.24年 | S77: 3.24年 | T77: 15 | U77: 50 | V77: 2.7999999999999997e-002 | W77: 0.11800000000000001 | X77: 9.4e-002 | Y77: 127 | Z77: 1.81 | AA77: -6.4000000000000003e-003 | AB77: -1.1399999999999999e-002 | AC77: -4.0099999999999997e-002 | AD77: -4.1900000000000007e-002 | AE77: 91.65 | AF77: 95.61 | AG77: 0.35 | AH77: AA+ | AI77: 3.6400000000000002e-002 | AJ77: =H77+100*O77 -> 167.53999999999999 | AK77: 157.7 | AL77: 172 | AM77: 62.1 | AN77: 158 | AO77: -6.9000000000000006e-002 | AP77: 13 | AQ77: 金田转债!
A78: 77 | B78: 127029 | C78: 中钢转债! | D78: 928 | E78: 中钢国际 | F78: 建筑 | G78: 建筑工程 | H78: 174.968 | I78: -2.2499999999999999e-002 | J78: 6.1999999999999998e-003 | K78: 9.76 | L78: -1.8100000000000002e-002 | M78: 117.5 | N78: 5.79 | O78: 3.7999999999999999e-002 | P78: 168.57 | Q78: 已到 | R78: 5.23年 | S78: 3.23年 | T78: 8.2 | U78: 263 | V78: 0.182 | W78: 6.6000000000000003e-002 | X78: 0.111 | Y78: 125 | Z78: 2.09 | AA78: -7.4299999999999991e-002 | AB78: -7.9500000000000001e-002 | AC78: -0.14099999999999999 | AD78: -0.14199999999999999 | AE78: 91.3 | AF78: 97.75 | AG78: 0.9 | AH78: AA+ | AI78: 3.6400000000000002e-002 | AJ78: =H78+100*O78 -> 178.768 | AK78: 181.4 | AL78: 283 | AM78: 83.6 | AN78: 266 | AO78: 8.9999999999999997e-002 | AP78: 12 | AQ78: 中钢转债!
A79: 78 | B79: 123105 | C79: 拓尔转债! | D79: 300229 | E79: 拓尔思 | F79: 计算机及 | G79: 软件开发 | H79: 125.065 | I79: -8.199999999999999e-003 | J79: -4.0999999999999995e-003 | K79: 9.71 | L79: -2.0199999999999999e-002 | M79: 121 | N79: 9.96 | O79: 0.28300000000000003 | P79: 97.49 | Q79: 已到 | R79: 5.23年 | S79: 3.23年 | T79: 8 | U79: 7.5 | V79: 8.0000000000000002e-003 | W79: 0.115 | X79: 0.11199999999999999 | Y79: 69 | Z79: 3.14 | AA79: -6.4000000000000003e-003 | AB79: -1.32e-002 | AC79: -5.3600000000000002e-002 | AD79: -5.5599999999999997e-002 | AE79: 84.8 | AF79: 88.79 | AG79: 0.61 | AH79: AA- | AI79: 6.2400000000000004e-002 | AJ79: =H79+100*O79 -> 153.36500000000001 | AK79: 152.6 | AL79: 138 | AM79: 63.9 | AN79: 176 | AO79: -8.0000000000000002e-003 | AP79: 9 | AQ79: 拓尔转债!
A80: 79 | B80: 123104 | C80: 卫宁转债! | D80: 300253 | E80: 卫宁健康 | F80: 计算机及 | G80: 软件开发 | H80: 128.499 | I80: 2.3e-003 | J80: 5.9999999999999995e-004 | K80: 15.48 | L80: 7.8000000000000005e-003 | M80: 125.1 | N80: 17.74 | O80: 0.47299999999999998 | P80: 87.26 | Q80: 已到 | R80: 5.22年 | S80: 3.22年 | T80: 9.7 | U80: 3.7 | V80: 3.0000000000000001e-003 | W80: 2.8999999999999998e-002 | X80: 2.5000000000000001e-002 | Y80: 332 | Z80: 6.93 | AA80: -5.1999999999999998e-003 | AB80: -1.3100000000000001e-002 | AC80: -6.2100000000000002e-002 | AD80: -6.3899999999999998e-002 | AE80: 90.41 | AF80: 101.61 | AG80: 0.37 | AH80: AA | AI80: 4.1399999999999999e-002 | AJ80: =H80+100*O80 -> 175.79899999999998 | AK80: 169.7 | AL80: 247 | AM80: 68.1 | AN80: 197 | AO80: 2.5000000000000001e-002 | AP80: 5 | AQ80: 卫宁转债!
A81: 80 | B81: 123103 | C81: 震安转债! | D81: 300767 | E81: 震安科技 | F81: 化工 | G81: 橡胶塑料 | H81: 193.19 | I81: -3.2000000000000002e-003 | J81: -1.67e-002 | K81: 103.23 | L81: -2.1499999999999998e-002 | M81: 121.4 | N81: 56.89 | O81: 6.5000000000000002e-002 | P81: 181.46 | Q81: 已到 | R81: 5.21年 | S81: 3.21年 | T81: 2.53 | U81: 103 | V81: 0.21100000000000002 | W81: 1.2e-002 | X81: 2.2000000000000002e-002 | Y81: 208 | Z81: 17.8 | AA81: -8.6999999999999994e-002 | AB81: -9.3100000000000002e-002 | AC81: -0.16200000000000001 | AD81: -0.16300000000000001 | AE81: 82.59 | AF81: 84.73 | AG81: 0.92 | AH81: A+ | AI81: 7.3399999999999993e-002 | AJ81: =H81+100*O81 -> 199.69 | AK81: 204.9 | AL81: 320 | AM81: 120.2 | AN81: 325 | AO81: 7.9000000000000001e-002 | AP81: 5 | AQ81: 震安转债!
A82: 81 | B82: 123101 | C82: 拓斯转债! | D82: 300607 | E82: 拓斯达 | F82: 机械装备 | G82: 机器人及 | H82: 113.665 | I82: -2.5000000000000001e-003 | J82: 3.0999999999999999e-003 | K82: 15.22 | L82: 4.5999999999999999e-003 | M82: 115.1 | N82: 26.18 | O82: 0.95499999999999996 | P82: 58.14 | Q82: 已到 | R82: 5.21年 | S82: 3.21年 | T82: 6.7 | U82: 3.6 | V82: 5.0000000000000001e-003 | W82: 0.10300000000000001 | X82: 5.9999999999999998e-002 | Y82: 65 | Z82: 2.94 | AA82: 2.5000000000000001e-003 | AB82: -2.7000000000000001e-003 | AC82: -2.7300000000000001e-002 | AD82: -2.9300000000000003e-002 | AE82: 90.48 | AF82: 93.58 | AG82: 0.13 | AH82: AA | AI82: 4.1399999999999999e-002 | AJ82: =H82+100*O82 -> 209.16500000000002 | AK82: 169.2 | AL82: 244 | AM82: 75.6 | AN82: 237 | AO82: -4.0000000000000001e-002 | AP82: 10 | AQ82: 拓斯转债!
A83: 82 | B83: 113620 | C83: 傲农转债! | D83: 603363 | E83: 傲农生物 | F83: 农业 | G83: 畜牧业 | H83: 121.16 | I83: 1.2800000000000001e-002 | J83: -1.2800000000000001e-002 | K83: 12.05 | L83: 0. | M83: 121.1 | N83: 14.51 | O83: 0.45899999999999996 | P83: 83.05 | Q83: 已到 | R83: 5.21年 | S83: 3.21年 | T83: 10 | U83: 30 | V83: 2.4e-002 | W83: 0.121 | X83: 0.10099999999999999 | Y83: 83 | Z83: 3.79 | AA83: -1.e-004 | AB83: -6.9999999999999993e-003 | AC83: -4.5700000000000005e-002 | AD83: -4.7599999999999996e-002 | AE83: 90.48 | AF83: 98.44 | AG83: 0.36 | AH83: AA | AI83: 4.1399999999999999e-002 | AJ83: =H83+100*O83 -> 167.06 | AK83: 159.3 | AL83: 183 | AM83: 60.8 | AN83: 152 | AO83: 0.10300000000000001 | AP83: 10 | AQ83: 傲农转债!
A84: 83 | B84: 113045 | C84: 环旭转债! | D84: 601231 | E84: 环旭电子 | F84: 电子 | G84: 电子产品 | H84: 121.93 | I84: 1.03e-002 | J84: -8.8000000000000005e-003 | K84: 16.74 | L84: 3.5999999999999999e-003 | M84: 112 | N84: 19.75 | O84: 0.439 | P84: 84.76 | Q84: 已到 | R84: 5.19年 | S84: 2.19年 | T84: 34.5 | U84: 15 | V84: 4.0000000000000001e-003 | W84: 9.3000000000000013e-002 | X84: 7.9000000000000001e-002 | Y84: 370 | Z84: 3.1 | AA84: -1.6399999999999998e-002 | AB84: -2.0499999999999997e-002 | AC84: -6.9599999999999995e-002 | AD84: -7.1800000000000003e-002 | AE84: 94.6 | AF84: 93.27 | AG84: 0.41 | AH84: AA+ | AI84: 3.6400000000000002e-002 | AJ84: =H84+100*O84 -> 165.83000000000001 | AK84: 159.1 | AL84: 180 | AM84: 64.5 | AN84: 180 | AO84: 5.0000000000000003e-002 | AP84: 6 | AQ84: 环旭转债!
A85: 84 | B85: 128144 | C85: 利民转债! | D85: 2734 | E85: 利民股份 | F85: 化工 | G85: 农化 | H85: 141.6 | I85: -1.2e-002 | J85: -1.7000000000000001e-002 | K85: 12.4 | L85: -4.4699999999999997e-002 | M85: 114.1 | N85: 11.5 | O85: 0.313 | P85: 107.83 | Q85: 已到 | R85: 5.18年 | S85: 3.18年 | T85: 9.79 | U85: 27 | V85: 2.e-002 | W85: 0.21199999999999999 | X85: 0.22899999999999998 | Y85: 46 | Z85: 1.84 | AA85: -4.1399999999999999e-002 | AB85: -4.5999999999999999e-002 | AC85: -9.1700000000000004e-002 | AD85: -9.3100000000000002e-002 | AE85: 89.9 | AF85: 92.8 | AG85: 0.65 | AH85: AA | AI85: 4.1399999999999999e-002 | AJ85: =H85+100*O85 -> 172.90000000000001 | AK85: 175.4 | AL85: 266 | AM85: 82.6 | AN85: 259 | AO85: -3.6000000000000004e-002 | AP85: 5 | AQ85: 利民转债!
A86: 85 | B86: 118000 | C86: 嘉元转债! | D86: 688388 | E86: 嘉元科技 | F86: 电子 | G86: 电子产品 | H86: 182.17 | I86: -6.4899999999999999e-002 | J86: 1.18e-002 | K86: 119.5 | L86: -6.2e-002 | M86: 121 | N86: 78.74 | O86: 0.20000000000000001 | P86: 151.77 | Q86: 已到 | R86: 5.16年 | S86: 3.16年 | T86: 9.79 | U86: 245 | V86: 0.13500000000000001 | W86: 3.5000000000000003e-002 | X86: 5.2999999999999999e-002 | Y86: 280 | Z86: 9.34 | AA86: -7.7499999999999999e-002 | AB86: -8.3699999999999997e-002 | AC86: -0.151 | AD86: -0.153 | AE86: 85.14 | AF86: 89.14 | AG86: 0.86 | AH86: AA- | AI86: 6.2400000000000004e-002 | AJ86: =H86+100*O86 -> 202.16999999999999 | AK86: 212.6 | AL86: 326 | AM86: 123.4 | AN86: 327 | AO86: -0.193 | AP86: 6 | AQ86: 嘉元转债!
A87: 86 | B87: 123100 | C87: 朗科转债! | D87: 300543 | E87: 朗科智能 | F87: 电子 | G87: 电子产品 | H87: 132.885 | I87: -2.7200000000000002e-002 | J87: -1.34e-002 | K87: 13.72 | L87: -5.3800000000000001e-002 | M87: 117.5 | N87: 11.61 | O87: 0.124 | P87: 118.17 | Q87: 已到 | R87: 5年46天 | S87: 3年46天 | T87: 3.8 | U87: 41 | V87: 7.9000000000000001e-002 | W87: 0.10300000000000001 | X87: 0.122 | Y87: 37 | Z87: 3.89 | AA87: -2.4199999999999999e-002 | AB87: -2.9900000000000003e-002 | AC87: -7.2900000000000006e-002 | AD87: -7.4800000000000005e-002 | AE87: 85.27 | AF87: 86.76 | AG87: 0.75 | AH87: AA- | AI87: 6.2400000000000004e-002 | AJ87: =H87+100*O87 -> 145.285 | AK87: 147.6 | AL87: 87 | AM87: 60.8 | AN87: 153 | AO87: -7.6999999999999999e-002 | AP87: 9 | AQ87: 朗科转债!
A88: 87 | B88: 123099 | C88: 普利转债 | D88: 300630 | E88: 普利制药 | F88: 医药 | G88: 化学制药 | H88: 140.807 | I88: 6.0000000000000001e-003 | J88: 1.03e-002 | K88: 53 | L88: 2.3599999999999999e-002 | M88: 123.5 | N88: 46.03 | O88: 0.223 | P88: 115.14 | Q88: 已到 | R88: 5年46天 | S88: 3年46天 | T88: 8.5 | U88: 6.7 | V88: 6.0000000000000001e-003 | W88: 3.7000000000000005e-002 | X88: 4.2000000000000003e-002 | Y88: 232 | Z88: 9.73 | AA88: -2.5699999999999997e-002 | AB88: -3.3099999999999997e-002 | AC88: -8.9200000000000002e-002 | AD88: -9.11e-002 | AE88: 85.27 | AF88: 91.16 | AG88: 0.69 | AH88: AA- | AI88: 6.2400000000000004e-002 | AJ88: =H88+100*O88 -> 163.107 | AK88: 166.5 | AL88: 231 | AM88: 75.3 | AN88: 234 | AO88: 2.7999999999999997e-002 | AP88: 5 | AQ88: 普利转债
A89: 88 | B89: 123098 | C89: 一品转债! | D89: 300723 | E89: 一品红 | F89: 医药 | G89: 医药行业 | H89: 148.396 | I89: -7.3000000000000001e-003 | J89: 1.4999999999999999e-002 | K89: 32.15 | L89: 1.04e-002 | M89: 124 | N89: 25.48 | O89: 0.17600000000000002 | P89: 126.18 | Q89: 已到 | R89: 5年34天 | S89: 3年34天 | T89: 4.25 | U89: 18 | V89: 2.7999999999999997e-002 | W89: 4.5999999999999999e-002 | X89: 5.7999999999999996e-002 | Y89: 93 | Z89: 5.54 | AA89: -3.5299999999999998e-002 | AB89: -4.2800000000000005e-002 | AC89: -0.10300000000000001 | AD89: -0.10400000000000001 | AE89: 85.51 | AF89: 91.73 | AG89: 0.75 | AH89: AA- | AI89: 6.2400000000000004e-002 | AJ89: =H89+100*O89 -> 165.99599999999998 | AK89: 170.6 | AL89: 250 | AM89: 78.9 | AN89: 248 | AO89: -1.4999999999999999e-002 | AP89: 7 | AQ89: 一品转债!
A90: 89 | B90: 123097 | C90: 美力转债 | D90: 300611 | E90: 美力科技 | F90: 机械装备 | G90: 通用设备 | H90: 134.4 | I90: -1.5600000000000001e-002 | J90: -2.0400000000000001e-002 | K90: 11.47 | L90: -4.7300000000000002e-002 | M90: 121.6 | N90: 9.28 | O90: 8.6999999999999994e-002 | P90: 123.6 | Q90: 已到 | R90: 5年33天 | S90: 3年33天 | T90: 3 | U90: 118 | V90: 0.28899999999999998 | W90: 0.14599999999999999 | X90: 0.18100000000000002 | Y90: 21 | Z90: 2.92 | AA90: -1.9900000000000001e-002 | AB90: -2.69e-002 | AC90: -7.4900000000000008e-002 | AD90: -7.7300000000000008e-002 | AE90: 83.33 | AF90: 85.61 | AG90: 0.76 | AH90: A+ | AI90: 7.3399999999999993e-002 | AJ90: =H90+100*O90 -> 143.09999999999999 | AK90: 145.2 | AL90: 64 | AM90: 59.6 | AN90: 147 | AO90: -2.9999999999999999e-002 | AP90: 22 | AQ90: 美力转债
A91: 90 | B91: 123096 | C91: 思创转债! | D91: 300078 | E91: 思创医惠 | F91: 通信互联 | G91: 物联网 | H91: 116.829 | I91: -2.8000000000000004e-003 | J91: -1.7000000000000001e-003 | K91: 6.85 | L91: -1.01e-002 | M91: 124 | N91: 8.27 | O91: 0.40999999999999998 | P91: 82.83 | Q91: 已到 | R91: 5年32天 | S91: 3年32天 | T91: 8.17 | U91: 4.7 | V91: 5.0000000000000001e-003 | W91: 0.13800000000000001 | X91: 0.114 | Y91: 59 | Z91: 2.17 | AA91: 1.2e-002 | AB91: 4.0000000000000001e-003 | AC91: -3.5699999999999996e-002 | AD91: -3.7900000000000003e-002 | AE91: 85.54 | AF91: 91.76 | AG91: 0.45 | AH91: AA- | AI91: 6.2400000000000004e-002 | AJ91: =H91+100*O91 -> 157.82900000000001 | AK91: 150.8 | AL91: 119 | AM91: 59.1 | AN91: 144 | AO91: 1.e-003 | AP91: 14 | AQ91: 思创转债!
A92: 91 | B92: 113621 | C92: 彤程转债! | D92: 603650 | E92: 彤程新材 | F92: 化工 | G92: 橡胶塑料 | H92: 170.62 | I92: -3.0800000000000001e-002 | J92: 7.4999999999999997e-003 | K92: 48.45 | L92: -2.6499999999999999e-002 | M92: 115.1 | N92: 32.62 | O92: 0.14899999999999999 | P92: 148.53 | Q92: 已到 | R92: 5年32天 | S92: 3年32天 | T92: 5.37 | U92: 85 | V92: 9.0999999999999998e-002 | W92: 1.9e-002 | X92: 2.7999999999999997e-002 | Y92: 289 | Z92: 10.79 | AA92: -7.5700000000000003e-002 | AB92: -8.0399999999999985e-002 | AC92: -0.13900000000000001 | AD92: -0.14099999999999999 | AE92: 90.91 | AF92: 94.03 | AG92: 0.88 | AH92: AA | AI92: 4.1399999999999999e-002 | AJ92: =H92+100*O92 -> 185.52000000000001 | AK92: 192.7 | AL92: 307 | AM92: 98.7 | AN92: 303 | AO92: -7.0000000000000007e-002 | AP92: 7 | AQ92: 彤程转债!
A93: 92 | B93: 113042 | C93: 上银转债! | D93: 601229 | E93: 上海银行 | F93: 金融 | G93: 银行行业 | H93: 105.55 | I93: 5.0000000000000001e-004 | J93: -8.9999999999999998e-004 | K93: 7.14 | L93: -2.8000000000000004e-003 | M93: 120.9 | N93: 10.63 | O93: 0.57100000000000006 | P93: 67.17 | Q93: 已到 | R93: 5年31天 | S93: 无权 | T93: 200 | U93: 110 | V93: 5.0000000000000001e-003 | W93: 0.19699999999999998 | X93: 0.13200000000000001 | Y93: 1014. | Z93: 0.56 | AA93: 2.7900000000000001e-002 | AB93: 2.0499999999999997e-002 | AC93: 无权 | AD93: 无权 | AE93: 无权 | AF93: 102.34 | AG93: 0.17 | AH93: AAA | AI93: 3.44e-002 | AJ93: =H93+100*O93 -> 162.65000000000001 | AK93: 143.9 | AL93: 49 | AM93: 41.6 | AN93: 32 | AO93: -5.0000000000000001e-003 | AP93: 15 | AQ93: 上银转债!
A94: 93 | B94: 113619 | C94: 世运转债! | D94: 603920 | E94: 世运电路 | F94: 电子 | G94: 元器件制 | H94: 138.9 | I94: -1.1999999999999999e-003 | J94: 3.0000000000000001e-003 | K94: 22.82 | L94: 2.5999999999999999e-003 | M94: 115.2 | N94: 19.92 | O94: 0.21199999999999999 | P94: 114.56 | Q94: 已到 | R94: 5年26天 | S94: 3年26天 | T94: 10 | U94: 120 | V94: 8.5999999999999993e-002 | W94: 8.199999999999999e-002 | X94: 9.4e-002 | Y94: 121 | Z94: 4.66 | AA94: -3.6900000000000002e-002 | AB94: -4.1900000000000007e-002 | AC94: -8.6999999999999994e-002 | AD94: -8.8900000000000007e-002 | AE94: 91.06 | AF94: 94.19 | AG94: 0.7 | AH94: AA | AI94: 4.1399999999999999e-002 | AJ94: =H94+100*O94 -> 160.09999999999999 | AK94: 163.2 | AL94: 212 | AM94: 69.1 | AN94: 201 | AO94: 7.6999999999999999e-002 | AP94: 6 | AQ94: 世运转债!
A95: 94 | B95: 123093 | C95: 金陵转债! | D95: 300651 | E95: 金陵体育 | F95: 其他 | G95: 文化教育 | H95: 117.52 | I95: -4.0999999999999995e-003 | J95: -1.8e-003 | K95: 25.99 | L95: -4.1700000000000001e-002 | M95: 129.3 | N95: 49.19 | O95: 1.22 | P95: 52.84 | Q95: 已到 | R95: 5年25天 | S95: 3年25天 | T95: 2.5 | U95: 6.8 | V95: 2.3e-002 | W95: 7.4999999999999997e-002 | X95: 3.9e-002 | Y95: 33 | Z95: 4.8 | AA95: 1.9599999999999999e-002 | AB95: 1.e-002 | AC95: -3.0699999999999998e-002 | AD95: -3.4300000000000004e-002 | AE95: 84.92 | AF95: 91.37 | AG95: 0.14 | AH95: A+ | AI95: 7.3399999999999993e-002 | AJ95: =H95+100*O95 -> 239.51999999999998 | AK95: 182.2 | AL95: 285 | AM95: 90.8 | AN95: 290 | AO95: -5.9999999999999998e-002 | AP95: 11 | AQ95: 金陵转债!
A96: 95 | B96: 113618 | C96: 美诺转债! | D96: 603538 | E96: 美诺华 | F96: 医药 | G96: 原料药 | H96: 129.79 | I96: 1.9699999999999999e-002 | J96: -1.54e-002 | K96: 34.05 | L96: 7.4000000000000003e-003 | M96: 115.3 | N96: 37.47 | O96: 0.42799999999999999 | P96: 90.87 | Q96: 已到 | R96: 5年20天 | S96: 3年20天 | T96: 5.2 | U96: 12 | V96: 1.8000000000000002e-002 | W96: 0.10199999999999999 | X96: 9.3000000000000013e-002 | Y96: 51 | Z96: 3.01 | AA96: -2.3599999999999999e-002 | AB96: -2.8799999999999999e-002 | AC96: -6.7699999999999996e-002 | AD96: -6.9699999999999998e-002 | AE96: 85.61 | AF96: 85.5 | AG96: 0.59 | AH96: AA- | AI96: 6.2400000000000004e-002 | AJ96: =H96+100*O96 -> 172.58999999999997 | AK96: 168.7 | AL96: 241 | AM96: 83.1 | AN96: 265 | AO96: 6.0000000000000001e-003 | AP96: 5 | AQ96: 美诺转债!
A97: 96 | B97: 128143 | C97: 锋龙转债! | D97: 2931 | E97: 锋龙股份 | F97: 机械装备 | G97: 专用设备 | H97: 128 | I97: -1.1899999999999999e-002 | J97: -9.3999999999999986e-003 | K97: 13.85 | L97: -3.0099999999999998e-002 | M97: 121.7 | N97: 12.73 | O97: 0.17600000000000002 | P97: 108.8 | Q97: 已到 | R97: 5年14天 | S97: 3年14天 | T97: 2.44 | U97: 5 | V97: 1.6e-002 | W97: 8.900000000000001e-002 | X97: 9.6000000000000002e-002 | Y97: 28 | Z97: 4.34 | AA97: -1.0200000000000001e-002 | AB97: -1.7399999999999999e-002 | AC97: -6.1699999999999998e-002 | AD97: -6.4199999999999993e-002 | AE97: 83.65 | AF97: 86 | AG97: 0.71 | AH97: A+ | AI97: 7.3399999999999993e-002 | AJ97: =H97+100*O97 -> 145.59999999999999 | AK97: 147.2 | AL97: 83 | AM97: 61.2 | AN97: 154 | AO97: -6.8000000000000005e-002 | AP97: 15 | AQ97: 锋龙转债!
A98: 97 | B98: 127028 | C98: 英特转债! | D98: 411 | E98: 英特集团 | F98: 医药 | G98: 医药商业 | H98: 124.45 | I98: 1.47e-002 | J98: -9.5999999999999992e-003 | K98: 14.6 | L98: 7.6e-003 | M98: 113.1 | N98: 13.22 | O98: 0.127 | P98: 110.44 | Q98: 已到 | R98: 5年11天 | S98: 3年11天 | T98: 6 | U98: 188 | V98: 0.252 | W98: 0.16500000000000001 | X98: 0.182 | Y98: 36 | Z98: 2.05 | AA98: -1.9199999999999998e-002 | AB98: -2.3799999999999998e-002 | AC98: -5.62e-002 | AD98: -5.8200000000000002e-002 | AE98: 92.52 | AF98: 94.84 | AG98: 0.67 | AH98: AA+ | AI98: 3.6400000000000002e-002 | AJ98: =H98+100*O98 -> 137.15000000000001 | AK98: 138.5 | AL98: 26 | AM98: 43.6 | AN98: 41 | AO98: 5.5999999999999994e-002 | AP98: 31 | AQ98: 英特转债!
A99: 98 | B99: 113616 | C99: 韦尔转债! | D99: 603501 | E99: 韦尔股份 | F99: 电子 | G99: 元器件制 | H99: 166.55 | I99: 1.3600000000000001e-002 | J99: -8.1000000000000013e-003 | K99: 308 | L99: 6.7000000000000002e-003 | M99: 114.5 | N99: 222.52 | O99: 0.20300000000000001 | P99: 138.41 | Q99: 已到 | R99: 5年3.1天 | S99: 3年3.1天 | T99: 24.3 | U99: 167 | V99: 4.0999999999999995e-002 | W99: 9.0000000000000011e-003 | X99: 1.3000000000000001e-002 | Y99: 2695. | Z99: 18.47 | AA99: -7.3099999999999998e-002 | AB99: -7.7699999999999991e-002 | AC99: -0.13800000000000001 | AD99: -0.13900000000000001 | AE99: 92.02 | AF99: 96.02 | AG99: 0.83 | AH99: AA+ | AI99: 3.6400000000000002e-002 | AJ99: =H99+100*O99 -> 186.85000000000002 | AK99: 194.7 | AL99: 312 | AM99: 98.7 | AN99: 302 | AO99: 4.2999999999999997e-002 | AP99: 9 | AQ99: 韦尔转债!
A100: 99 | B100: 123092 | C100: 天壕转债! | D100: 300332 | E100: 天壕环境 | F100: 石油天然 | G100: 天然气 | H100: 219.355 | I100: -4.1799999999999997e-002 | J100: -1.24e-002 | K100: 10.8 | L100: -5.6799999999999996e-002 | M100: 121.6 | N100: 5.19 | O100: 5.4000000000000006e-002 | P100: 208.09 | Q100: 已到 | R100: 4.997年 | S100: 2.997年 | T100: 4.17 | U100: 154 | V100: 0.16600000000000001 | W100: 4.4000000000000004e-002 | X100: 9.0999999999999998e-002 | Y100: 95 | Z100: 2.79 | AA100: -0.114 | AB100: -0.12 | AC100: -0.126 | AD100: -0.127 | AE100: 83.38 | AF100: 85.67 | AG100: 0.95 | AH100: A+ | AI100: 7.3399999999999993e-002 | AJ100: =H100+100*O100 -> 224.755 | AK100: 230.6 | AL100: 336 | AM100: 144.9 | AN100: 341 | AO100: -0.10400000000000001 | AP100: 10 | AQ100: 天壕转债!
A101: 100 | B101: 113615 | C101: 金诚转债! | D101: 603979 | E101: 金诚信 | F101: 有色金属 | G101: 有色行业 | H101: 194.7 | I101: 0. | J101: -2.23e-002 | K101: 21.39 | L101: -2.4199999999999999e-002 | M101: 117.3 | N101: 12.65 | O101: 0.151 | P101: 169.09 | Q101: 已到 | R101: 4.99年 | S101: 2.99年 | T101: 8.66 | U101: 59 | V101: 3.5000000000000003e-002 | W101: 6.8000000000000005e-002 | X101: 0.115 | Y101: 127 | Z101: 2.57 | AA101: -9.849999999999999e-002 | AB101: -0.10400000000000001 | AC101: -0.11199999999999999 | AD101: -0.11199999999999999 | AE101: 91.49 | AF101: 96.54 | AG101: 0.92 | AH101: AA | AI101: 3.9800000000000002e-002 | AJ101: =H101+100*O101 -> 209.79999999999998 | AK101: 220.3 | AL101: 329 | AM101: 123.8 | AN101: 328 | AO101: 2.1000000000000001e-002 | AP101: 4 | AQ101: 金诚转债!
A102: 101 | B102: 123091 | C102: 长海转债 | D102: 300196 | E102: 长海股份 | F102: 其他 | G102: 非金属矿 | H102: 134.1 | I102: -3.4999999999999996e-003 | J102: 3.4999999999999996e-003 | K102: 17.48 | L102: 0. | M102: 116.2 | N102: 16.14 | O102: 0.23800000000000002 | P102: 108.3 | Q102: 已到 | R102: 4.99年 | S102: 2.99年 | T102: 5.5 | U102: 5.4 | V102: 6.9999999999999993e-003 | W102: 7.6999999999999999e-002 | X102: 8.3000000000000004e-002 | Y102: 71 | Z102: 2.2 | AA102: -2.9300000000000003e-002 | AB102: -3.4599999999999999e-002 | AC102: -7.9500000000000001e-002 | AD102: -8.1300000000000011e-002 | AE102: 91.49 | AF102: 95.72 | AG102: 0.64 | AH102: AA | AI102: 3.9800000000000002e-002 | AJ102: =H102+100*O102 -> 157.90000000000001 | AK102: 159.9 | AL102: 186 | AM102: 64.2 | AN102: 178 | AO102: -2.7000000000000003e-002 | AP102: 4 | AQ102: 长海转债
A103: 102 | B103: 123089 | C103: 九洲转2!! | D103: 300040 | E103: 九洲集团 | F103: 能源电力 | G103: 电力设备 | H103: 181.7 | I103: -1.2199999999999999e-002 | J103: 2.9999999999999997e-004 | K103: 9.81 | L103: -1.3100000000000001e-002 | M103: 120.6 | N103: 5.68 | O103: 5.2000000000000005e-002 | P103: 172.71 | Q103: 已到 | R103: 4.99年 | S103: 2.99年 | T103: 3.06 | U103: 211 | V103: 0.373 | W103: 5.2999999999999999e-002 | X103: 9.1999999999999998e-002 | Y103: 58 | Z103: 2.25 | AA103: -8.0100000000000005e-002 | AB103: -8.6400000000000005e-002 | AC103: -0.10199999999999999 | AD103: -0.10300000000000001 | AE103: 86.05 | AF103: 90.35 | AG103: 0.91 | AH103: AA- | AI103: 6.08e-002 | AJ103: =H103+100*O103 -> 186.89999999999998 | AK103: 190.7 | AL103: 302 | AM103: 100.3 | AN103: 305 | AO103: -6.2e-002 | AP103: 18 | AQ103: 九洲转2!!
A104: 103 | B104: 123090 | C104: 三诺转债! | D104: 300298 | E104: 三诺生物 | F104: 医药 | G104: 医疗器械 | H104: 124.6 | I104: 7.000000000000001e-004 | J104: -5.9999999999999995e-004 | K104: 29.3 | L104: 2.9999999999999997e-004 | M104: 116.8 | N104: 35.18 | O104: 0.496 | P104: 83.29 | Q104: 已到 | R104: 4.99年 | S104: 2.99年 | T104: 5 | U104: 18 | V104: 2.8999999999999998e-002 | W104: 2.9999999999999999e-002 | X104: 2.5000000000000001e-002 | Y104: 165 | Z104: 6.12 | AA104: -1.3100000000000001e-002 | AB104: -1.89e-002 | AC104: -5.7999999999999996e-002 | AD104: -5.9900000000000002e-002 | AE104: 91.41 | AF104: 96.46 | AG104: 0.38 | AH104: AA | AI104: 3.9800000000000002e-002 | AJ104: =H104+100*O104 -> 174.19999999999999 | AK104: 165.9 | AL104: 227 | AM104: 69.4 | AN104: 202 | AO104: 5.0000000000000001e-003 | AP104: 5 | AQ104: 三诺转债!
A105: 104 | B105: 128142 | C105: 新乳转债! | D105: 2946 | E105: 新乳业 | F105: 食品饮料 | G105: 乳制品 | H105: 120.145 | I105: 4.0000000000000001e-003 | J105: 6.9999999999999993e-003 | K105: 15.84 | L105: 2.6600000000000002e-002 | M105: 114.8 | N105: 18.47 | O105: 0.40100000000000002 | P105: 85.76 | Q105: 已到 | R105: 4.98年 | S105: 2.98年 | T105: 7.18 | U105: 54 | V105: 6.3e-002 | W105: 5.2000000000000005e-002 | X105: 4.4999999999999998e-002 | Y105: 137 | Z105: 5.4 | AA105: -9.300000000000001e-003 | AB105: -1.4499999999999999e-002 | AC105: -4.7100000000000003e-002 | AD105: -4.9000000000000002e-002 | AE105: 91.44 | AF105: 94.85 | AG105: 0.41 | AH105: AA | AI105: 3.9800000000000002e-002 | AJ105: =H105+100*O105 -> 160.245 | AK105: 154.5 | AL105: 155 | AM105: 59.7 | AN105: 148 | AO105: 4.0999999999999995e-002 | AP105: 5 | AQ105: 新乳转债!
A106: 105 | B106: 128141 | C106: 旺能转债 | D106: 2034 | E106: 旺能环境 | F106: 城市公用 | G106: 三废处理 | H106: 128.3 | I106: -7.6e-003 | J106: -2.9999999999999997e-004 | K106: 17.12 | L106: -1.2699999999999999e-002 | M106: 114.8 | N106: 15.97 | O106: 0.19699999999999998 | P106: 107.2 | Q106: 已到 | R106: 4.98年 | S106: 2.98年 | T106: 12.7 | U106: 15 | V106: 9.0000000000000011e-003 | W106: 0.17300000000000001 | X106: 0.185 | Y106: 74 | Z106: 1.46 | AA106: -2.2499999999999999e-002 | AB106: -2.76e-002 | AC106: -6.7000000000000004e-002 | AD106: -6.88e-002 | AE106: 91.45 | AF106: 94.86 | AG106: 0.62 | AH106: AA | AI106: 3.9800000000000002e-002 | AJ106: =H106+100*O106 -> 148. | AK106: 149.4 | AL106: 107 | AM106: 54.5 | AN106: 110 | AO106: 6.0000000000000001e-003 | AP106: 8 | AQ106: 旺能转债
A107: 106 | B107: 123087 | C107: 明电转债! | D107: 300739 | E107: 明阳电路 | F107: 电子 | G107: 元器件制 | H107: 135 | I107: 3.7000000000000002e-003 | J107: -5.1999999999999998e-003 | K107: 19.85 | L107: -2.e-003 | M107: 120.8 | N107: 16.32 | O107: 0.11 | P107: 121.63 | Q107: 已到 | R107: 4.97年 | S107: 3.97年 | T107: 4.19 | U107: 82 | V107: 0.14400000000000002 | W107: 7.2000000000000008e-002 | X107: 8.6999999999999994e-002 | Y107: 59 | Z107: 3.53 | AA107: -2.2499999999999999e-002 | AB107: -2.9399999999999999e-002 | AC107: -5.6900000000000006e-002 | AD107: -5.9500000000000004e-002 | AE107: 83.59 | AF107: 90.63 | AG107: 0.74 | AH107: AA- | AI107: 6.08e-002 | AJ107: =H107+100*O107 -> 146. | AK107: 148.4 | AL107: 93 | AM107: 57.7 | AN107: 135 | AO107: 4.7e-002 | AP107: 19 | AQ107: 明电转债!
A108: 107 | B108: 123088 | C108: 威唐转债! | D108: 300707 | E108: 威唐工业 | F108: 汽车 | G108: 零部件制 | H108: 124.688 | I108: -1.43e-002 | J108: -1.2500000000000001e-002 | K108: 19 | L108: -4.5700000000000005e-002 | M108: 121.1 | N108: 20.72 | O108: 0.35999999999999999 | P108: 91.7 | Q108: 已到 | R108: 4.97年 | S108: 2.97年 | T108: 3.01 | U108: 78 | V108: 0.20499999999999999 | W108: 0.10099999999999999 | X108: 9.3000000000000013e-002 | Y108: 30 | Z108: 4.24 | AA108: -6.0000000000000001e-003 | AB108: -1.3100000000000001e-002 | AC108: -5.6299999999999996e-002 | AD108: -5.8600000000000006e-002 | AE108: 83.91 | AF108: 86.45 | AG108: 0.59 | AH108: A+ | AI108: 7.1800000000000003e-002 | AJ108: =H108+100*O108 -> 160.68799999999999 | AK108: 157.7 | AL108: 173 | AM108: 71.2 | AN108: 215 | AO108: -3.9e-002 | AP108: 18 | AQ108: 威唐转债!
A109: 108 | B109: 113044 | C109: 大秦转债! | D109: 601006 | E109: 大秦铁路 | F109: 铁路 | G109: 铁路运输 | H109: 108.16 | I109: 5.0000000000000001e-004 | J109: -3.7000000000000002e-003 | K109: 6.33 | L109: -7.8000000000000005e-003 | M109: 113.9 | N109: 7.18 | O109: 0.22699999999999998 | P109: 88.16 | Q109: 已到 | R109: 4.97年 | S109: 2.97年 | T109: 320 | U109: 212 | V109: 6.0000000000000001e-003 | W109: 0.34000000000000002 | X109: 0.29999999999999999 | Y109: 941 | Z109: 0.78 | AA109: 1.0700000000000001e-002 | AB109: 5.5000000000000005e-003 | AC109: -1.3300000000000001e-002 | AD109: -1.5600000000000001e-002 | AE109: 93.82 | AF109: 97.34 | AG109: 0.41 | AH109: AAA | AI109: 3.2799999999999996e-002 | AJ109: =H109+100*O109 -> 130.85999999999999 | AK109: 128.2 | AL109: 5 | AM109: 30.8 | AN109: 8 | AO109: 1.e-002 | AP109: 32 | AQ109: 大秦转债!
A110: 109 | B110: 123085 | C110: 万顺转2!! | D110: 300057 | E110: 万顺新材 | F110: 有色金属 | G110: 铝金属 | H110: 164.11 | I110: -1.44e-002 | J110: -8.0000000000000002e-003 | K110: 9.93 | L110: -2.46e-002 | M110: 112.9 | N110: 6.2 | O110: 2.5000000000000001e-002 | P110: 160.16 | Q110: 已到 | R110: 4.96年 | S110: 2.96年 | T110: 8.51 | U110: 283 | V110: 0.19899999999999998 | W110: 0.126 | X110: 0.20100000000000001 | Y110: 68 | Z110: 1.88 | AA110: -7.3800000000000004e-002 | AB110: -7.7899999999999997e-002 | AC110: -0.13500000000000001 | AD110: -0.13699999999999998 | AE110: 86.1 | AF110: 84.72 | AG110: 0.91 | AH110: AA- | AI110: 6.08e-002 | AJ110: =H110+100*O110 -> 166.61000000000001 | AK110: 168.1 | AL110: 238 | AM110: 82 | AN110: 258 | AO110: 4.9000000000000002e-002 | AP110: 20 | AQ110: 万顺转2!!
A111: 110 | B111: 123086 | C111: 海兰转债!! | D111: 300065 | E111: 海兰信 | F111: 电子 | G111: 电子产品 | H111: 286 | I111: -5.5099999999999996e-002 | J111: 5.6999999999999993e-003 | K111: 20.5 | L111: -5.0499999999999996e-002 | M111: 123.1 | N111: 7.27 | O111: 1.3999999999999999e-002 | P111: 281.98 | Q111: 已到 | R111: 4.96年 | S111: 2.96年 | T111: 4.82 | U111: 1918. | V111: 1.3500000000000001 | W111: 3.7999999999999999e-002 | X111: 0.107 | Y111: 127 | Z111: 7.67 | AA111: -0.158 | AB111: -0.16399999999999998 | AC111: -0.157 | AD111: -0.158 | AE111: 86.12 | AF111: 92.34 | AG111: 0.98 | AH111: AA- | AI111: 6.08e-002 | AJ111: =H111+100*O111 -> 287.39999999999998 | AK111: 290 | AL111: 358 | AM111: 197.7 | AN111: 359 | AO111: 0.12300000000000001 | AP111: 19 | AQ111: 海兰转债!!
A112: 111 | B112: 123084 | C112: 高澜转债!! | D112: 300499 | E112: 高澜股份 | F112: 能源电力 | G112: 电力设备 | H112: 191.736 | I112: -9.8100000000000007e-002 | J112: 5.4400000000000004e-002 | K112: 15.39 | L112: -4.82e-002 | M112: 121.4 | N112: 9.01 | O112: 0.12300000000000001 | P112: 170.81 | Q112: 已到 | R112: 4.96年 | S112: 2.96年 | T112: 2.54 | U112: 256 | V112: 0.501 | W112: 5.9000000000000004e-002 | X112: 0.10099999999999999 | Y112: 43 | Z112: 5.01 | AA112: -8.9700000000000002e-002 | AB112: -9.6099999999999991e-002 | AC112: -0.11 | AD112: -0.111 | AE112: 84.17 | AF112: 86.77 | AG112: 0.91 | AH112: A+ | AI112: 7.1800000000000003e-002 | AJ112: =H112+100*O112 -> 204.036 | AK112: 212.7 | AL112: 327 | AM112: 125.9 | AN112: 330 | AO112: -0.14699999999999999 | AP112: 14 | AQ112: 高澜转债!!
A113: 112 | B113: 127027 | C113: 靖远转债! | D113: 552 | E113: 靖远煤电 | F113: 煤炭 | G113: 煤炭开采 | H113: 130.7 | I113: -1.21e-002 | J113: -9.5999999999999992e-003 | K113: 3.6 | L113: -3.2300000000000002e-002 | M113: 114.9 | N113: 3.13 | O113: 0.13600000000000001 | P113: 115.02 | Q113: 已到 | R113: 4.96年 | S113: 2.96年 | T113: 24.3 | U113: 286 | V113: 8.900000000000001e-002 | W113: 0.28699999999999998 | X113: 0.33000000000000002 | Y113: 85 | Z113: 1.02 | AA113: -2.6099999999999998e-002 | AB113: -3.1200000000000002e-002 | AC113: -7.2700000000000001e-002 | AD113: -7.46e-002 | AE113: 93 | AF113: 97.28 | AG113: 0.67 | AH113: AA+ | AI113: 3.4799999999999998e-002 | AJ113: =H113+100*O113 -> 144.29999999999998 | AK113: 146.4 | AL113: 72 | AM113: 49.1 | AN113: 75 | AO113: 0.13900000000000001 | AP113: 39 | AQ113: 靖远转债!
A114: 113 | B114: 113043 | C114: 财通转债! | D114: 601108 | E114: 财通证券 | F114: 金融 | G114: 证券行业 | H114: 118.21 | I114: 6.1999999999999998e-003 | J114: 4.5999999999999999e-003 | K114: 11.07 | L114: 2.69e-002 | M114: 110 | N114: 13.13 | O114: 0.40200000000000002 | P114: 84.31 | Q114: 已到 | R114: 4.96年 | S114: 无权 | T114: 38 | U114: 88 | V114: 1.9e-002 | W114: 9.6000000000000002e-002 | X114: 8.1000000000000003e-002 | Y114: 397 | Z114: 1.7 | AA114: -1.46e-002 | AB114: -1.8200000000000001e-002 | AC114: 无权 | AD114: 无权 | AE114: 无权 | AF114: 93.94 | AG114: 0.4 | AH114: AAA | AI114: 3.2799999999999996e-002 | AJ114: =H114+100*O114 -> 158.41 | AK114: 152.1 | AL114: 135 | AM114: 58.2 | AN114: 138 | AO114: 2.3e-002 | AP114: 11 | AQ114: 财通转债!
A115: 114 | B115: 123083 | C115: 朗新转债! | D115: 300682 | E115: 朗新科技 | F115: 计算机及 | G115: 软件开发 | H115: 258.292 | I115: -2.9700000000000001e-002 | J115: -3.4999999999999996e-003 | K115: 37.49 | L115: -3.4000000000000002e-002 | M115: 114.8 | N115: 15.39 | O115: 5.9999999999999998e-002 | P115: 243.6 | Q115: 已到 | R115: 4.96年 | S115: 2.96年 | T115: 6.01 | U115: 180 | V115: 0.114 | W115: 1.4999999999999999e-002 | X115: 3.7000000000000005e-002 | Y115: 391 | Z115: 7.13 | AA115: -0.153 | AB115: -0.157 | AC115: -0.14800000000000002 | AD115: -0.14800000000000002 | AE115: 91.53 | AF115: 94.94 | AG115: 0.98 | AH115: AA | AI115: 3.9800000000000002e-002 | AJ115: =H115+100*O115 -> 264.29199999999997 | AK115: 273 | AL115: 351 | AM115: 178 | AN115: 351 | AO115: -2.5000000000000001e-002 | AP115: 7 | AQ115: 朗新转债!
A116: 115 | B116: 127026 | C116: 超声转债! | D116: 823 | E116: 超声电子 | F116: 电子 | G116: 元器件制 | H116: 133.744 | I116: 2.4900000000000002e-002 | J116: -4.0000000000000001e-003 | K116: 13.4 | L116: 3.32e-002 | M116: 112.8 | N116: 12.72 | O116: 0.27000000000000002 | P116: 105.35 | Q116: 已到 | R116: 4.95年 | S116: 2.95年 | T116: 7 | U116: 120 | V116: 0.128 | W116: 9.6999999999999989e-002 | X116: 0.10199999999999999 | Y116: 72 | Z116: 1.81 | AA116: -3.44e-002 | AB116: -3.8800000000000001e-002 | AC116: -7.9899999999999999e-002 | AD116: -8.1699999999999995e-002 | AE116: 91.54 | AF116: 93.3 | AG116: 0.63 | AH116: AA | AI116: 3.9800000000000002e-002 | AJ116: =H116+100*O116 -> 160.744 | AK116: 162.1 | AL116: 201 | AM116: 68.8 | AN116: 200 | AO116: 2.5000000000000001e-002 | AP116: 12 | AQ116: 超声转债!
A117: 116 | B117: 128140 | C117: 润建转债!! | D117: 2929 | E117: 润建股份 | F117: 通信互联 | G117: 通信设备 | H117: 164 | I117: 0. | J117: -8.5000000000000006e-003 | K117: 37.12 | L117: -1.01e-002 | M117: 114.9 | N117: 26.4 | O117: 0.16600000000000001 | P117: 140.61 | Q117: 已到 | R117: 4.95年 | S117: 2.95年 | T117: 10.9 | U117: 30 | V117: 1.7000000000000001e-002 | W117: 0.13 | X117: 0.183 | Y117: 84 | Z117: 2.42 | AA117: -7.0499999999999993e-002 | AB117: -7.5199999999999989e-002 | AC117: -0.13500000000000001 | AD117: -0.13699999999999998 | AE117: 91.65 | AF117: 95.06 | AG117: 0.84 | AH117: AA | AI117: 3.9800000000000002e-002 | AJ117: =H117+100*O117 -> 180.59999999999999 | AK117: 187.4 | AL117: 294 | AM117: 92.3 | AN117: 294 | AO117: 2.3e-002 | AP117: 10 | AQ117: 润建转债!!
A118: 117 | B118: 123082 | C118: 北陆转债! | D118: 300016 | E118: 北陆药业 | F118: 医药 | G118: 化学制药 | H118: 119.5 | I118: 1.44e-002 | J118: 9.8999999999999991e-003 | K118: 8.35 | L118: 3.9900000000000005e-002 | M118: 121.2 | N118: 8.81 | O118: 0.26100000000000001 | P118: 94.78 | Q118: 已到 | R118: 4.95年 | S118: 2.95年 | T118: 4.99 | U118: 128 | V118: 0.21199999999999999 | W118: 0.121 | X118: 0.115 | Y118: 41 | Z118: 2.4 | AA118: 2.8999999999999998e-003 | AB118: -4.4000000000000003e-003 | AC118: -4.36e-002 | AD118: -4.5999999999999999e-002 | AE118: 84.06 | AF118: 86.66 | AG118: 0.61 | AH118: A+ | AI118: 7.1800000000000003e-002 | AJ118: =H118+100*O118 -> 145.59999999999999 | AK118: 144.2 | AL118: 51 | AM118: 57.6 | AN118: 133 | AO118: 4.7e-002 | AP118: 18 | AQ118: 北陆转债!
A119: 118 | B119: 123080 | C119: 海波转债! | D119: 300517 | E119: 海波重科 | F119: 建筑 | G119: 建筑工程 | H119: 126 | I119: -1.29e-002 | J119: -2.1700000000000001e-002 | K119: 12.68 | L119: -5.16e-002 | M119: 126 | N119: 11.58 | O119: 0.151 | P119: 109.5 | Q119: 已到 | R119: 4.94年 | S119: 2.94年 | T119: 2.44 | U119: 14 | V119: 4.7e-002 | W119: 0.10000000000000001 | X119: 0.11 | Y119: 24 | Z119: 2.83 | AA119: 0. | AB119: -8.6e-003 | AC119: -5.9999999999999998e-002 | AD119: -6.2300000000000001e-002 | AE119: 84.19 | AF119: 90.15 | AG119: 0.67 | AH119: A+ | AI119: 7.1800000000000003e-002 | AJ119: =H119+100*O119 -> 141.09999999999999 | AK119: 142.5 | AL119: 42 | AM119: 52.3 | AN119: 100 | AO119: -7.6999999999999999e-002 | AP119: 24 | AQ119: 海波转债!
A120: 119 | B120: 113610 | C120: 灵康转债 | D120: 603669 | E120: 灵康药业 | F120: 医药 | G120: 化学制药 | H120: 125.29 | I120: 4.1999999999999997e-003 | J120: -7.7000000000000002e-003 | K120: 9.73 | L120: -5.1000000000000004e-003 | M120: 120.7 | N120: 8.61 | O120: 0.109 | P120: 113.01 | Q120: 已到 | R120: 4.93年 | S120: 2.93年 | T120: 4.58 | U120: 31 | V120: 5.4000000000000006e-002 | W120: 6.5000000000000002e-002 | X120: 7.400000000000001e-002 | Y120: 70 | Z120: 5.09 | AA120: -7.7000000000000002e-003 | AB120: -1.4800000000000001e-002 | AC120: -5.9800000000000006e-002 | AD120: -6.1900000000000004e-002 | AE120: 86.43 | AF120: 90.74 | AG120: 0.69 | AH120: AA- | AI120: 6.08e-002 | AJ120: =H120+100*O120 -> 136.19 | AK120: 137.6 | AL120: 21 | AM120: 46.8 | AN120: 59 | AO120: 2.3e-002 | AP120: 29 | AQ120: 灵康转债
A121: 120 | B121: 128139 | C121: 祥鑫转债! | D121: 2965 | E121: 祥鑫科技 | F121: 汽车 | G121: 零部件制 | H121: 116.02 | I121: -5.6999999999999993e-003 | J121: 9.5999999999999992e-003 | K121: 25.96 | L121: 1.2500000000000001e-002 | M121: 120.6 | N121: 36.52 | O121: 0.63200000000000001 | P121: 71.08 | Q121: 已到 | R121: 4.93年 | S121: 2.93年 | T121: 6.47 | U121: 32 | V121: 4.2000000000000003e-002 | W121: 0.16200000000000001 | X121: 0.115 | Y121: 40 | Z121: 2.24 | AA121: 8.0000000000000002e-003 | AB121: 8.0000000000000004e-004 | AC121: -3.6299999999999999e-002 | AD121: -3.8399999999999997e-002 | AE121: 86.33 | AF121: 90.65 | AG121: 0.32 | AH121: AA- | AI121: 6.08e-002 | AJ121: =H121+100*O121 -> 179.22 | AK121: 161 | AL121: 190 | AM121: 70.3 | AN121: 208 | AO121: -3.5000000000000003e-002 | AP121: 14 | AQ121: 祥鑫转债!
A122: 121 | B122: 123078 | C122: 飞凯转债!! | D122: 300398 | E122: 飞凯材料 | F122: 化工 | G122: 化工 | H122: 154.6 | I122: -1.5300000000000001e-002 | J122: -9.0000000000000011e-003 | K122: 21.06 | L122: -2.9900000000000003e-002 | M122: 114.9 | N122: 15.56 | O122: 0.14199999999999999 | P122: 135.35 | Q122: 已到 | R122: 4.92年 | S122: 2.92年 | T122: 8.15 | U122: 93 | V122: 7.2999999999999995e-002 | W122: 7.4999999999999997e-002 | X122: 0.10099999999999999 | Y122: 109 | Z122: 3.76 | AA122: -5.9500000000000004e-002 | AB122: -6.4399999999999999e-002 | AC122: -0.121 | AD122: -0.122 | AE122: 91.74 | AF122: 95.16 | AG122: 0.81 | AH122: AA | AI122: 3.9800000000000002e-002 | AJ122: =H122+100*O122 -> 168.79999999999998 | AK122: 173.9 | AL122: 262 | AM122: 78.7 | AN122: 247 | AO122: 6.0000000000000001e-003 | AP122: 8 | AQ122: 飞凯转债!!
A123: 122 | B123: 113609 | C123: 永安转债! | D123: 603776 | E123: 永安行 | F123: 城市公用 | G123: 其他 | H123: 135.51 | I123: -9.8999999999999991e-003 | J123: -1.3999999999999999e-002 | K123: 20.42 | L123: -3.1300000000000001e-002 | M123: 120.1 | N123: 16.48 | O123: 9.4e-002 | P123: 123.91 | Q123: 已到 | R123: 4.92年 | S123: 2.92年 | T123: 7.34 | U123: 181 | V123: 0.184 | W123: 0.154 | X123: 0.191 | Y123: 48 | Z123: 1.46 | AA123: -2.4700000000000003e-002 | AB123: -3.1400000000000004e-002 | AC123: -8.4499999999999992e-002 | AD123: -8.6300000000000002e-002 | AE123: 86.36 | AF123: 90.35 | AG123: 0.76 | AH123: AA- | AI123: 6.08e-002 | AJ123: =H123+100*O123 -> 144.91 | AK123: 147.1 | AL123: 82 | AM123: 56.8 | AN123: 127 | AO123: 5.9000000000000004e-002 | AP123: 26 | AQ123: 永安转债!
A124: 123 | B124: 123077 | C124: 汉得转债! | D124: 300170 | E124: 汉得信息 | F124: 计算机及 | G124: 软件开发 | H124: 118.583 | I124: -1.0800000000000001e-002 | J124: 3.3e-003 | K124: 8.39 | L124: -2.2099999999999998e-002 | M124: 125.1 | N124: 9.69 | O124: 0.37 | P124: 86.58 | Q124: 已到 | R124: 4.91年 | S124: 2.91年 | T124: 9.37 | U124: 35 | V124: 3.1e-002 | W124: 0.126 | X124: 0.109 | Y124: 74 | Z124: 2.37 | AA124: 1.11e-002 | AB124: 2.5999999999999999e-003 | AC124: -4.3700000000000003e-002 | AD124: -4.5700000000000005e-002 | AE124: 91.81 | AF124: 103.63 | AG124: 0.34 | AH124: AA | AI124: 3.9800000000000002e-002 | AJ124: =H124+100*O124 -> 155.583 | AK124: 150.6 | AL124: 117 | AM124: 47 | AN124: 60 | AO124: 1.9e-002 | AP124: 17 | AQ124: 汉得转债!
A125: 124 | B125: 110077 | C125: 洪城转债 | D125: 600461 | E125: 洪城环境 | F125: 城市公用 | G125: 城市公用 | H125: 136.58 | I125: -7.000000000000001e-004 | J125: -1.e-002 | K125: 8.01 | L125: -1.4800000000000001e-002 | M125: 113.3 | N125: 6.71 | O125: 0.14400000000000002 | P125: 119.37 | Q125: 已到 | R125: 4.90年 | S125: 2.90年 | T125: 17.7 | U125: 11 | V125: 5.0000000000000001e-003 | W125: 0.23199999999999998 | X125: 0.27699999999999997 | Y125: 76 | Z125: 1.41 | AA125: -3.78e-002 | AB125: -4.24e-002 | AC125: -9.0899999999999995e-002 | AD125: -9.1999999999999998e-002 | AE125: 91.92 | AF125: 96 | AG125: 0.73 | AH125: AA+ | AI125: 3.4799999999999998e-002 | AJ125: =H125+100*O125 -> 150.98000000000002 | AK125: 153.8 | AL125: 147 | AM125: 57.8 | AN125: 137 | AO125: -1.3000000000000001e-002 | AP125: 7 | AQ125: 洪城转债
A126: 125 | B126: 123076 | C126: 强力转债! | D126: 300429 | E126: 强力新材 | F126: 化工 | G126: 化工 | H126: 109 | I126: -5.1999999999999998e-003 | J126: 2.0000000000000001e-004 | K126: 11.65 | L126: -2.35e-002 | M126: 118.1 | N126: 18.94 | O126: 0.77200000000000002 | P126: 61.51 | Q126: 已到 | R126: 4.90年 | S126: 2.90年 | T126: 8.5 | U126: 6.9 | V126: 6.9999999999999993e-003 | W126: 0.14199999999999999 | X126: 8.6999999999999994e-002 | Y126: 60 | Z126: 3.32 | AA126: 1.6799999999999999e-002 | AB126: 1.0200000000000001e-002 | AC126: -1.7100000000000001e-002 | AD126: -1.9199999999999998e-002 | AE126: 86.43 | AF126: 88.93 | AG126: 0.21 | AH126: AA- | AI126: 6.08e-002 | AJ126: =H126+100*O126 -> 186.19999999999999 | AK126: 156.5 | AL126: 166 | AM126: 67.6 | AN126: 194 | AO126: -5.5e-002 | AP126: 21 | AQ126: 强力转债!
A127: 126 | B127: 128138 | C127: 侨银转债! | D127: 2973 | E127: 侨银股份 | F127: 城市公用 | G127: 城市公用 | H127: 114.585 | I127: -2.3999999999999998e-003 | J127: 1.e-003 | K127: 14.91 | L127: -1.1299999999999999e-002 | M127: 136.1 | N127: 25.33 | O127: 0.94700000000000006 | P127: 58.86 | Q127: 已到 | R127: 4.90年 | S127: 2.90年 | T127: 4.2 | U127: 5.2 | V127: 1.1000000000000001e-002 | W127: 6.9000000000000006e-002 | X127: 4.0999999999999995e-002 | Y127: 61 | Z127: 3.8 | AA127: 3.6499999999999998e-002 | AB127: 2.4700000000000003e-002 | AC127: -3.1300000000000001e-002 | AD127: -3.3700000000000001e-002 | AE127: 86.95 | AF127: 102.51 | AG127: 0.12 | AH127: AA- | AI127: 6.08e-002 | AJ127: =H127+100*O127 -> 209.285 | AK127: 170.3 | AL127: 249 | AM127: 67.8 | AN127: 196 | AO127: 1.3999999999999999e-002 | AP127: 24 | AQ127: 侨银转债!
A128: 127 | B128: 113608 | C128: 威派转债! | D128: 603956 | E128: 威派格 | F128: 机械装备 | G128: 专用设备 | H128: 120 | I128: -5.7999999999999996e-003 | J128: -1.61e-002 | K128: 16.55 | L128: -4.0599999999999997e-002 | M128: 121.1 | N128: 19.08 | O128: 0.38299999999999995 | P128: 86.74 | Q128: 已到 | R128: 4.87年 | S128: 2.87年 | T128: 4.2 | U128: 13 | V128: 2.5000000000000001e-002 | W128: 5.9999999999999998e-002 | X128: 5.2000000000000005e-002 | Y128: 70 | Z128: 5.96 | AA128: 1.9e-003 | AB128: -5.5000000000000005e-003 | AC128: -4.5999999999999999e-002 | AD128: -4.8499999999999995e-002 | AE128: 84.49 | AF128: 87.04 | AG128: 0.54 | AH128: A+ | AI128: 7.1800000000000003e-002 | AJ128: =H128+100*O128 -> 158.30000000000001 | AK128: 153.3 | AL128: 142 | AM128: 66.2 | AN128: 187 | AO128: -4.2999999999999997e-002 | AP128: 8 | AQ128: 威派转债!
A129: 128 | B129: 127025 | C129: 冀东转债! | D129: 401 | E129: 冀东水泥 | F129: 建筑 | G129: 水泥 | H129: 117 | I129: -4.3e-003 | J129: 8.9999999999999998e-004 | K129: 12.16 | L129: -8.199999999999999e-003 | M129: 109.9 | N129: 14.21 | O129: 0.36700000000000005 | P129: 85.57 | Q129: 已到 | R129: 4.86年 | S129: 2.86年 | T129: 17.8 | U129: 6.4 | V129: 3.0000000000000001e-003 | W129: 5.9000000000000004e-002 | X129: 5.0000000000000003e-002 | Y129: 302 | Z129: 1.06 | AA129: -1.3000000000000001e-002 | AB129: -1.67e-002 | AC129: -4.2500000000000003e-002 | AD129: -4.41e-002 | AE129: 93.14 | AF129: 94.16 | AG129: 0.42 | AH129: AAA | AI129: 3.2799999999999996e-002 | AJ129: =H129+100*O129 -> 153.69999999999999 | AK129: 148.4 | AL129: 94 | AM129: 54.3 | AN129: 107 | AO129: 1.9e-002 | AP129: 8 | AQ129: 冀东转债!
A130: 129 | B130: 127024 | C130: 盈峰转债! | D130: 967 | E130: 盈峰环境 | F130: 机械装备 | G130: 专用设备 | H130: 123.599 | I130: -1.1599999999999999e-002 | J130: -5.1999999999999998e-003 | K130: 7.97 | L130: -3.39e-002 | M130: 116.6 | N130: 8.19 | O130: 0.27000000000000002 | P130: 97.31 | Q130: 已到 | R130: 4.86年 | S130: 2.86年 | T130: 14.8 | U130: 12 | V130: 6.0000000000000001e-003 | W130: 5.9000000000000004e-002 | X130: 5.7000000000000002e-002 | Y130: 252 | Z130: 1.54 | AA130: -1.21e-002 | AB130: -1.8000000000000002e-002 | AC130: -5.8499999999999996e-002 | AD130: -6.0299999999999999e-002 | AE130: 93.03 | AF130: 99.02 | AG130: 0.49 | AH130: AA+ | AI130: 3.4799999999999998e-002 | AJ130: =H130+100*O130 -> 150.59899999999999 | AK130: 149.9 | AL130: 108 | AM130: 50.9 | AN130: 91 | AO130: -2.2000000000000002e-002 | AP130: 6 | AQ130: 盈峰转债!
A131: 130 | B131: 128137 | C131: 洁美转债! | D131: 2859 | E131: 洁美科技 | F131: 电子 | G131: 元器件制 | H131: 158.25 | I131: -5.5000000000000005e-003 | J131: -1.6000000000000001e-003 | K131: 37.98 | L131: -8.3999999999999995e-003 | M131: 116.9 | N131: 27.63 | O131: 0.151 | P131: 137.46 | Q131: 已到 | R131: 4.86年 | S131: 2.86年 | T131: 5.99 | U131: 27 | V131: 2.8999999999999998e-002 | W131: 3.7999999999999999e-002 | X131: 5.2999999999999999e-002 | Y131: 156 | Z131: 7.91 | AA131: -6.1399999999999996e-002 | AB131: -6.6900000000000001e-002 | AC131: -0.13 | AD131: -0.13100000000000001 | AE131: 86.61 | AF131: 88.23 | AG131: 0.84 | AH131: AA- | AI131: 6.08e-002 | AJ131: =H131+100*O131 -> 173.34999999999999 | AK131: 179 | AL131: 278 | AM131: 90.8 | AN131: 289 | AO131: 5.4000000000000006e-002 | AP131: 5 | AQ131: 洁美转债!
A132: 131 | B132: 128136 | C132: 立讯转债! | D132: 2475 | E132: 立讯精密 | F132: 电子 | G132: 元器件制 | H132: 126.601 | I132: 1.37e-002 | J132: -9.300000000000001e-003 | K132: 49.54 | L132: 1.1000000000000001e-002 | M132: 111.8 | N132: 58.16 | O132: 0.48599999999999999 | P132: 85.18 | Q132: 已到 | R132: 4.86年 | S132: 2.86年 | T132: 30 | U132: 102 | V132: 2.7000000000000003e-002 | W132: 9.0000000000000011e-003 | X132: 6.9999999999999993e-003 | Y132: 3493. | Z132: 10.84 | AA132: -2.5600000000000001e-002 | AB132: -2.98e-002 | AC132: -6.8199999999999997e-002 | AD132: -6.9500000000000006e-002 | AE132: 92.27 | AF132: 94.88 | AG132: 0.4 | AH132: AA+ | AI132: 3.4799999999999998e-002 | AJ132: =H132+100*O132 -> 175.20099999999999 | AK132: 168 | AL132: 237 | AM132: 73.1 | AN132: 223 | AO132: 0.13800000000000001 | AP132: 14 | AQ132: 立讯转债!
A133: 132 | B133: 110076 | C133: 华海转债! | D133: 600521 | E133: 华海药业 | F133: 医药 | G133: 医药行业 | H133: 120.21 | I133: -3.5999999999999999e-003 | J133: 3.4000000000000002e-003 | K133: 20.1 | L133: -1.e-003 | M133: 114.8 | N133: 33.85 | O133: 1.02 | P133: 59.38 | Q133: 已到 | R133: 4.86年 | S133: 2.86年 | T133: 18.4 | U133: 9.4 | V133: 4.0000000000000001e-003 | W133: 6.0999999999999999e-002 | X133: 3.6000000000000004e-002 | Y133: 300 | Z133: 4.57 | AA133: -9.5999999999999992e-003 | AB133: -1.4999999999999999e-002 | AC133: -4.9200000000000001e-002 | AD133: -5.1200000000000002e-002 | AE133: 91.89 | AF133: 95.32 | AG133: 0.12 | AH133: AA | AI133: 3.9800000000000002e-002 | AJ133: =H133+100*O133 -> 222.20999999999998 | AK133: 181 | AL133: 281 | AM133: 85.7 | AN133: 274 | AO133: -1.2e-002 | AP133: 8 | AQ133: 华海转债!
A134: 133 | B134: 123075 | C134: 贝斯转债! | D134: 300580 | E134: 贝斯特 | F134: 汽车 | G134: 零部件制 | H134: 143.95 | I134: 2.0899999999999998e-002 | J134: -2.3900000000000001e-002 | K134: 26.81 | L134: -4.0999999999999995e-003 | M134: 115.1 | N134: 23.74 | O134: 0.27500000000000002 | P134: 112.93 | Q134: 已到 | R134: 4.86年 | S134: 2.86年 | T134: 6 | U134: 275 | V134: 0.32000000000000001 | W134: 0.11199999999999999 | X134: 0.126 | Y134: 54 | Z134: 3.03 | AA134: -4.58e-002 | AB134: -5.0999999999999997e-002 | AC134: -0.10300000000000001 | AD134: -0.105 | AE134: 86.67 | AF134: 86.92 | AG134: 0.72 | AH134: AA- | AI134: 6.08e-002 | AJ134: =H134+100*O134 -> 171.44999999999999 | AK134: 175 | AL134: 263 | AM134: 88 | AN134: 281 | AO134: 5.7000000000000002e-002 | AP134: 8 | AQ134: 贝斯转债!
A135: 134 | B135: 113607 | C135: 伟20转债!!* | D135: 603568 | E135: 伟明环保 | F135: 城市公用 | G135: 三废处理 | H135: 167.71 | I135: -1.9099999999999999e-002 | J135: -3.4999999999999996e-003 | K135: 36.46 | L135: -2.2499999999999999e-002 | M135: 114.8 | N135: 21.71 | O135: -1.e-003 | P135: 167.94 | Q135: 已到 | R135: 4.1天 | S135: 无权 | T135: 0.7 | U135: 49 | V135: 0.41499999999999998 | W135: 1.e-003 | X135: 2.e-003 | Y135: 468 | Z135: 7.4 | AA135: <-100% | AB135: <-100% | AC135: 无权 | AD135: 无权 | AE135: 无权 | AF135: 99.96 | AG135: 1 | AH135: AA | AI135: 3.6499999999999998e-002 | AJ135: =H135+100*O135 -> 167.61000000000001 | AK135: 167.5 | AL135: 234 | AM135: 67.5 | AN135: 193 | AO135: 2.9999999999999999e-002 | AP135: 10 | AQ135: 伟20转债!!*
A136: 135 | B136: 113606 | C136: 荣泰转债 | D136: 603579 | E136: 荣泰健康 | F136: 机械装备 | G136: 专用设备 | H136: 122.69 | I136: -4.8999999999999998e-003 | J136: -1.9e-003 | K136: 29.75 | L136: -1.29e-002 | M136: 120.7 | N136: 32.83 | O136: 0.35399999999999998 | P136: 90.62 | Q136: 已到 | R136: 4.85年 | S136: 2.85年 | T136: 6 | U136: 3.9 | V136: 5.0000000000000001e-003 | W136: 0.14400000000000002 | X136: 0.13100000000000001 | Y136: 42 | Z136: 2.49 | AA136: -3.4000000000000002e-003 | AB136: -1.0700000000000001e-002 | AC136: -5.4900000000000004e-002 | AD136: -5.7099999999999998e-002 | AE136: 86.88 | AF136: 91.21 | AG136: 0.52 | AH136: AA- | AI136: 6.08e-002 | AJ136: =H136+100*O136 -> 158.09 | AK136: 154.8 | AL136: 157 | AM136: 63.6 | AN136: 172 | AO136: -9.0000000000000011e-003 | AP136: 11 | AQ136: 荣泰转债
A137: 136 | B137: 123073 | C137: 同和转债! | D137: 300636 | E137: 同和药业 | F137: 医药 | G137: 原料药 | H137: 166.001 | I137: -3.95e-002 | J137: -1.67e-002 | K137: 23.7 | L137: -6.3600000000000004e-002 | M137: 121.9 | N137: 14.82 | O137: 3.7999999999999999e-002 | P137: 159.92 | Q137: 已到 | R137: 4.84年 | S137: 2.84年 | T137: 3.59 | U137: 284 | V137: 0.47499999999999998 | W137: 7.400000000000001e-002 | X137: 0.11800000000000001 | Y137: 49 | Z137: 5.94 | AA137: -6.3e-002 | AB137: -7.0000000000000007e-002 | AC137: -0.14199999999999999 | AD137: -0.14400000000000002 | AE137: 84.69 | AF137: 87.83 | AG137: 0.88 | AH137: A+ | AI137: 7.1800000000000003e-002 | AJ137: =H137+100*O137 -> 169.80100000000002 | AK137: 172.1 | AL137: 256 | AM137: 84.2 | AN137: 268 | AO137: 0.20800000000000002 | AP137: 13 | AQ137: 同和转债!
A138: 137 | B138: 113605 | C138: 大参转债! | D138: 603233 | E138: 大参林 | F138: 医药 | G138: 医药商业 | H138: 115.08 | I138: -7.000000000000001e-004 | J138: 1.9e-003 | K138: 36.42 | L138: 1.9599999999999999e-002 | M138: 114.9 | N138: 69.05 | O138: 1.1799999999999999 | P138: 52.74 | Q138: 已到 | R138: 4.82年 | S138: 2.82年 | T138: 14 | U138: 29 | V138: 1.8000000000000002e-002 | W138: 4.9000000000000002e-002 | X138: 2.6000000000000002e-002 | Y138: 288 | Z138: 5.41 | AA138: -2.9999999999999997e-004 | AB138: -5.7999999999999996e-003 | AC138: -3.5400000000000001e-002 | AD138: -3.7499999999999999e-002 | AE138: 92.1 | AF138: 95.53 | AG138: 0.06 | AH138: AA | AI138: 3.9800000000000002e-002 | AJ138: =H138+100*O138 -> 233.07999999999998 | AK138: 177.4 | AL138: 270 | AM138: 81.9 | AN138: 256 | AO138: 6.0000000000000001e-003 | AP138: 7 | AQ138: 大参转债!
A139: 138 | B139: 123071 | C139: 天能转债!! | D139: 300569 | E139: 天能重工 | F139: 能源电力 | G139: 风能 | H139: 213.314 | I139: -1.7399999999999999e-002 | J139: 7.000000000000001e-004 | K139: 15.48 | L139: -1.78e-002 | M139: 120.7 | N139: 7.91 | O139: 8.9999999999999997e-002 | P139: 195.7 | Q139: 已到 | R139: 4.82年 | S139: 2.82年 | T139: 6.94 | U139: 337 | V139: 0.22399999999999998 | W139: 5.7000000000000002e-002 | X139: 0.111 | Y139: 123 | Z139: 3.51 | AA139: -0.113 | AB139: -0.11900000000000001 | AC139: -0.13400000000000001 | AD139: -0.13500000000000001 | AE139: 86.99 | AF139: 91.33 | AG139: 0.94 | AH139: AA- | AI139: 6.08e-002 | AJ139: =H139+100*O139 -> 222.31399999999999 | AK139: 230.9 | AL139: 338 | AM139: 139.6 | AN139: 339 | AO139: 6.9999999999999993e-003 | AP139: 12 | AQ139: 天能转债!!
A140: 139 | B140: 123072 | C140: 乐歌转债! | D140: 300729 | E140: 乐歌股份 | F140: 其他 | G140: 家居用品 | H140: 122.647 | I140: -1.4000000000000002e-003 | J140: -6.0000000000000001e-003 | K140: 27.19 | L140: -4.5999999999999999e-002 | M140: 129.1 | N140: 49.24 | O140: 1.22 | P140: 55.22 | Q140: 已到 | R140: 4.82年 | S140: 2.82年 | T140: 1.42 | U140: 7 | V140: 4.0000000000000001e-002 | W140: 2.4e-002 | X140: 1.3000000000000001e-002 | Y140: 60 | Z140: 3.31 | AA140: 1.1000000000000001e-002 | AB140: 1.1000000000000001e-003 | AC140: -4.7599999999999996e-002 | AD140: -5.1299999999999998e-002 | AE140: 86.56 | AF140: 93.39 | AG140: 0.16 | AH140: A+ | AI140: 7.1800000000000003e-002 | AJ140: =H140+100*O140 -> 244.64699999999999 | AK140: 190.1 | AL140: 299 | AM140: 96.7 | AN140: 301 | AO140: -0.11699999999999999 | AP140: 11 | AQ140: 乐歌转债!
A141: 140 | B141: 123070 | C141: 鹏辉转债! | D141: 300438 | E141: 鹏辉能源 | F141: 汽车 | G141: 零部件制 | H141: 251.8 | I141: -5.4100000000000002e-002 | J141: -5.0000000000000001e-003 | K141: 45.38 | L141: -6.0700000000000004e-002 | M141: 114.8 | N141: 20.08 | O141: 0.114 | P141: 226 | Q141: 已到 | R141: 4.82年 | S141: 2.82年 | T141: 5.99 | U141: 470 | V141: 0.309 | W141: 2.9999999999999999e-002 | X141: 6.9000000000000006e-002 | Y141: 197 | Z141: 7.53 | AA141: -0.152 | AB141: -0.157 | AC141: -0.155 | AD141: -0.156 | AE141: 92.02 | AF141: 95.45 | AG141: 0.97 | AH141: AA | AI141: 3.9800000000000002e-002 | AJ141: =H141+100*O141 -> 263.19999999999999 | AK141: 277.6 | AL141: 354 | AM141: 182.2 | AN141: 354 | AO141: -0.17699999999999999 | AP141: 8 | AQ141: 鹏辉转债!
A142: 141 | B142: 128135 | C142: 洽洽转债! | D142: 2557 | E142: 洽洽食品 | F142: 食品饮料 | G142: 休闲食品 | H142: 133.699 | I142: 2.9600000000000001e-002 | J142: 1.7899999999999999e-002 | K142: 65.3 | L142: 7.9199999999999993e-002 | M142: 119.9 | N142: 60.03 | O142: 0.22899999999999998 | P142: 108.78 | Q142: 已到 | R142: 4.82年 | S142: 2.82年 | T142: 13.4 | U142: 117 | V142: 6.6000000000000003e-002 | W142: 4.0000000000000001e-002 | X142: 4.4000000000000004e-002 | Y142: 331 | Z142: 7.59 | AA142: -2.2700000000000001e-002 | AB142: -2.9600000000000001e-002 | AC142: -8.3000000000000004e-002 | AD142: -8.4900000000000003e-002 | AE142: 92.12 | AF142: 99.69 | AG142: 0.6 | AH142: AA | AI142: 3.9800000000000002e-002 | AJ142: =H142+100*O142 -> 156.59900000000002 | AK142: 158.6 | AL142: 176 | AM142: 58.9 | AN142: 143 | AO142: 0.154 | AP142: 11 | AQ142: 洽洽转债!
A143: 142 | B143: 127022 | C143: 恒逸转债 | D143: 703 | E143: 恒逸石化 | F143: 化工 | G143: 化工 | H143: 123.601 | I143: -4.7999999999999996e-003 | J143: 4.7999999999999996e-003 | K143: 10.44 | L143: 0. | M143: 108.7 | N143: 11.2 | O143: 0.32600000000000001 | P143: 93.21 | Q143: 已到 | R143: 4.81年 | S143: 2.81年 | T143: 20 | U143: 10 | V143: 4.0000000000000001e-003 | W143: 5.2000000000000005e-002 | X143: 4.9000000000000002e-002 | Y143: 383 | Z143: 1.48 | AA143: -2.6699999999999998e-002 | AB143: -2.9900000000000003e-002 | AC143: -6.1399999999999996e-002 | AD143: -6.2899999999999998e-002 | AE143: 92.59 | AF143: 92.43 | AG143: 0.52 | AH143: AA+ | AI143: 3.4799999999999998e-002 | AJ143: =H143+100*O143 -> 156.20099999999999 | AK143: 154 | AL143: 149 | AM143: 61.4 | AN143: 156 | AO143: -6.0000000000000001e-003 | AP143: 6 | AQ143: 恒逸转债
A144: 143 | B144: 110075 | C144: 南航转债 | D144: 600029 | E144: 南方航空 | F144: 交通运输 | G144: 航空运输 | H144: 132.61 | I144: 1.e-003 | J144: 8.9999999999999998e-004 | K144: 6.25 | L144: 3.2000000000000002e-003 | M144: 109.8 | N144: 6.24 | O144: 0.32400000000000001 | P144: 100.16 | Q144: 已到 | R144: 4.81年 | S144: 2.81年 | T144: 59 | U144: 74 | V144: 9.0000000000000011e-003 | W144: 5.5999999999999994e-002 | X144: 5.5999999999999994e-002 | Y144: 1059. | Z144: 1.44 | AA144: -3.9e-002 | AB144: -4.2500000000000003e-002 | AC144: -8.4700000000000011e-002 | AD144: -8.5900000000000004e-002 | AE144: 92.76 | AF144: 94.21 | AG144: 0.57 | AH144: AAA | AI144: 3.2799999999999996e-002 | AJ144: =H144+100*O144 -> 165.01000000000002 | AK144: 165.1 | AL144: 219 | AM144: 70.8 | AN144: 212 | AO144: -4.0000000000000001e-003 | AP144: 8 | AQ144: 南航转债
A145: 144 | B145: 113604 | C145: 多伦转债! | D145: 603528 | E145: 多伦科技 | F145: 计算机及 | G145: 软件开发 | H145: 108.05 | I145: -1.5e-003 | J145: -3.0999999999999999e-003 | K145: 6.72 | L145: -1.7500000000000002e-002 | M145: 116.9 | N145: 10.4 | O145: 0.67200000000000004 | P145: 64.62 | Q145: 已到 | R145: 4.80年 | S145: 2.80年 | T145: 6.4 | U145: 1.6 | V145: 2.e-003 | W145: 0.152 | X145: 9.8000000000000004e-002 | Y145: 42 | Z145: 2.57 | AA145: 1.6899999999999998e-002 | AB145: 1.0500000000000001e-002 | AC145: -1.4800000000000001e-002 | AD145: -1.7000000000000001e-002 | AE145: 86.92 | AF145: 88.55 | AG145: 0.26 | AH145: AA- | AI145: 6.08e-002 | AJ145: =H145+100*O145 -> 175.25 | AK145: 151.5 | AL145: 126 | AM145: 62.9 | AN145: 167 | AO145: -3.0000000000000001e-003 | AP145: 12 | AQ145: 多伦转债!
A146: 145 | B146: 128134 | C146: 鸿路转债! | D146: 2541 | E146: 鸿路钢构 | F146: 建筑 | G146: 其他建材 | H146: 148.4 | I146: 7.000000000000001e-004 | J146: -1.66e-002 | K146: 51.56 | L146: -2.2000000000000002e-002 | M146: 114.8 | N146: 43.51 | O146: 0.252 | P146: 118.5 | Q146: 已到 | R146: 4.79年 | S146: 2.79年 | T146: 15.7 | U146: 17 | V146: 6.9999999999999993e-003 | W146: 5.7000000000000002e-002 | X146: 6.8000000000000005e-002 | Y146: 274 | Z146: 4.12 | AA146: -5.3099999999999994e-002 | AB146: -5.8099999999999999e-002 | AC146: -0.114 | AD146: -0.11599999999999999 | AE146: 92.13 | AF146: 95.56 | AG146: 0.72 | AH146: AA | AI146: 3.9800000000000002e-002 | AJ146: =H146+100*O146 -> 173.59999999999999 | AK146: 178.3 | AL146: 275 | AM146: 82.7 | AN146: 260 | AO146: -1.9e-002 | AP146: 4 | AQ146: 鸿路转债!
A147: 146 | B147: 128133 | C147: 奇正转债! | D147: 2287 | E147: 奇正藏药 | F147: 医药 | G147: 中药 | H147: 122.456 | I147: 1.8200000000000001e-002 | J147: 4.6999999999999993e-003 | K147: 28.66 | L147: 4.5999999999999999e-002 | M147: 116.9 | N147: 29.78 | O147: 0.27200000000000002 | P147: 96.24 | Q147: 已到 | R147: 4.74年 | S147: 2.74年 | T147: 8 | U147: 353 | V147: 0.35600000000000004 | W147: 5.2999999999999999e-002 | X147: 5.0999999999999997e-002 | Y147: 152 | Z147: 5.14 | AA147: -9.8999999999999991e-003 | AB147: -1.61e-002 | AC147: -5.6900000000000006e-002 | AD147: -5.8899999999999994e-002 | AE147: 92.39 | AF147: 97.49 | AG147: 0.5 | AH147: AA | AI147: 3.9800000000000002e-002 | AJ147: =H147+100*O147 -> 149.65600000000001 | AK147: 148.7 | AL147: 95 | AM147: 51.2 | AN147: 93 | AO147: 6.0999999999999999e-002 | AP147: 19 | AQ147: 奇正转债!
A148: 147 | B148: 123067 | C148: 斯莱转债! | D148: 300382 | E148: 斯莱克 | F148: 机械装备 | G148: 专用设备 | H148: 260.769 | I148: -4.3e-003 | J148: 8.6e-003 | K148: 22.81 | L148: 4.4000000000000003e-003 | M148: 120.8 | N148: 9.36 | O148: 7.0000000000000007e-002 | P148: 243.7 | Q148: 已到 | R148: 4.73年 | S148: 2.73年 | T148: 2.4 | U148: 369 | V148: 0.57999999999999996 | W148: 1.8000000000000002e-002 | X148: 4.4999999999999998e-002 | Y148: 131 | Z148: 11.46 | AA148: -0.153 | AB148: -0.158 | AC148: -0.16600000000000001 | AD148: -0.16600000000000001 | AE148: 87.58 | AF148: 91.94 | AG148: 0.97 | AH148: AA- | AI148: 6.08e-002 | AJ148: =H148+100*O148 -> 267.76900000000001 | AK148: 277.8 | AL148: 355 | AM148: 185.9 | AN148: 356 | AO148: -5.0000000000000003e-002 | AP148: 11 | AQ148: 斯莱转债!
A149: 148 | B149: 128132 | C149: 交建转债! | D149: 2941 | E149: 新疆交建 | F149: 建筑 | G149: 建筑工程 | H149: 107.849 | I149: -4.1999999999999997e-003 | J149: 2.5999999999999999e-003 | K149: 11.82 | L149: -1.1699999999999999e-002 | M149: 116.9 | N149: 18.53 | O149: 0.69099999999999995 | P149: 63.79 | Q149: 已到 | R149: 4.72年 | S149: 2.72年 | T149: 8.49 | U149: 5.3 | V149: 6.0000000000000001e-003 | W149: 0.111 | X149: 7.0999999999999994e-002 | Y149: 76 | Z149: 2.95 | AA149: 1.7500000000000002e-002 | AB149: 1.11e-002 | AC149: -1.46e-002 | AD149: -1.6799999999999999e-002 | AE149: 92.46 | AF149: 97.57 | AG149: 0.14 | AH149: AA | AI149: 3.9800000000000002e-002 | AJ149: =H149+100*O149 -> 176.94900000000001 | AK149: 151.9 | AL149: 130 | AM149: 54.3 | AN149: 108 | AO149: -2.e-003 | AP149: 28 | AQ149: 交建转债!
A150: 149 | B150: 128131 | C150: 崇达转2! | D150: 2815 | E150: 崇达技术 | F150: 电子 | G150: 元器件制 | H150: 126.6 | I150: 7.1999999999999998e-003 | J150: 3.9800000000000002e-002 | K150: 17.81 | L150: 0.10000000000000001 | M150: 114.9 | N150: 19.38 | O150: 0.37799999999999995 | P150: 91.9 | Q150: 已到 | R150: 4.70年 | S150: 2.70年 | T150: 14 | U150: 123 | V150: 6.8000000000000005e-002 | W150: 8.9999999999999997e-002 | X150: 8.199999999999999e-002 | Y150: 156 | Z150: 3.63 | AA150: -2.0799999999999999e-002 | AB150: -2.63e-002 | AC150: -6.8600000000000008e-002 | AD150: -7.0699999999999999e-002 | AE150: 92.54 | AF150: 95.99 | AG150: 0.47 | AH150: AA | AI150: 3.9800000000000002e-002 | AJ150: =H150+100*O150 -> 164.39999999999998 | AK150: 161.3 | AL150: 193 | AM150: 65.3 | AN150: 183 | AO150: 0.122 | AP150: 11 | AQ150: 崇达转2!
A151: 150 | B151: 123065 | C151: 宝莱转债! | D151: 300246 | E151: 宝莱特 | F151: 医药 | G151: 医疗器械 | H151: 114.482 | I151: -1.5e-003 | J151: 1.9e-003 | K151: 18.43 | L151: 8.199999999999999e-003 | M151: 121 | N151: 40.14 | O151: 1.49 | P151: 45.91 | Q151: 已到 | R151: 4.69年 | S151: 2.69年 | T151: 2.19 | U151: 17 | V151: 6.7000000000000004e-002 | W151: 8.1000000000000003e-002 | X151: 3.7000000000000005e-002 | Y151: 27 | Z151: 3.09 | AA151: 1.21e-002 | AB151: 4.4000000000000003e-003 | AC151: -3.3599999999999998e-002 | AD151: -3.61e-002 | AE151: 87.92 | AF151: 92.3 | AG151: 0.06 | AH151: AA- | AI151: 6.08e-002 | AJ151: =H151+100*O151 -> 263.48199999999997 | AK151: 183 | AL151: 287 | AM151: 90.8 | AN151: 288 | AO151: 4.0000000000000001e-003 | AP151: 23 | AQ151: 宝莱转债!
A152: 151 | B152: 123064 | C152: 万孚转债! | D152: 300482 | E152: 万孚生物 | F152: 医药 | G152: 医疗器械 | H152: 113.573 | I152: -8.9999999999999998e-004 | J152: 1.e-003 | K152: 36.47 | L152: 2.9999999999999997e-004 | M152: 114.8 | N152: 71.65 | O152: 1.23 | P152: 50.9 | Q152: 已到 | R152: 4.69年 | S152: 2.69年 | T152: 5.99 | U152: 1.9 | V152: 3.0000000000000001e-003 | W152: 3.7000000000000005e-002 | X152: 1.9e-002 | Y152: 162 | Z152: 5.06 | AA152: 2.3e-003 | AB152: -3.3e-003 | AC152: -3.2899999999999999e-002 | AD152: -3.5099999999999999e-002 | AE152: 92.5 | AF152: 95.95 | AG152: 0.05 | AH152: AA | AI152: 3.9800000000000002e-002 | AJ152: =H152+100*O152 -> 236.57299999999998 | AK152: 176.2 | AL152: 267 | AM152: 80.3 | AN152: 250 | AO152: -1.4999999999999999e-002 | AP152: 12 | AQ152: 万孚转债!
A153: 152 | B153: 128130 | C153: 景兴转债 | D153: 2067 | E153: 景兴纸业 | F153: 造纸包装 | G153: 包装用纸 | H153: 126.638 | I153: -4.7999999999999996e-003 | J153: -3.8e-003 | K153: 3.95 | L153: -1.2500000000000001e-002 | M153: 114.8 | N153: 3.4 | O153: 8.9999999999999997e-002 | P153: 116.18 | Q153: 已到 | R153: 4.68年 | S153: 2.68年 | T153: 9.99 | U153: 25 | V153: 2.e-002 | W153: 0.21199999999999999 | X153: 0.24600000000000002 | Y153: 47 | Z153: 0.9 | AA153: -2.1099999999999997e-002 | AB153: -2.6600000000000002e-002 | AC153: -6.9500000000000006e-002 | AD153: -7.1500000000000008e-002 | AE153: 92.51 | AF153: 95.96 | AG153: 0.69 | AH153: AA | AI153: 3.9800000000000002e-002 | AJ153: =H153+100*O153 -> 135.63800000000001 | AK153: 137.1 | AL153: 19 | AM153: 41.1 | AN153: 28 | AO153: -6.0000000000000001e-003 | AP153: 18 | AQ153: 景兴转债
A154: 153 | B154: 128129 | C154: 青农转债! | D154: 2958 | E154: 青农商行 | F154: 金融 | G154: 银行行业 | H154: 110.12 | I154: -2.0000000000000001e-004 | J154: -8.9999999999999998e-004 | K154: 3.85 | L154: -2.5999999999999999e-003 | M154: 112 | N154: 4.32 | O154: 0.23600000000000002 | P154: 89.12 | Q154: 已到 | R154: 4.67年 | S154: 无权 | T154: 50 | U154: 23 | V154: 4.0000000000000001e-003 | W154: 0.23399999999999999 | X154: 0.20800000000000002 | Y154: 214 | Z154: 0.75 | AA154: 3.7000000000000002e-003 | AB154: -1.e-003 | AC154: 无权 | AD154: 无权 | AE154: 无权 | AF154: 96.57 | AG154: 0.43 | AH154: AAA | AI154: 3.2799999999999996e-002 | AJ154: =H154+100*O154 -> 133.72 | AK154: 131.1 | AL154: 7 | AM154: 34.5 | AN154: 16 | AO154: -1.e-003 | AP154: 26 | AQ154: 青农转债!
A155: 154 | B155: 113602 | C155: 景20转债! | D155: 603228 | E155: 景旺电子 | F155: 电子 | G155: 元器件制 | H155: 138.95 | I155: 1.2e-002 | J155: 5.9299999999999999e-002 | K155: 34.6 | L155: 9.01e-002 | M155: 112.9 | N155: 27.4 | O155: 0.10000000000000001 | P155: 126.28 | Q155: 已到 | R155: 4.66年 | S155: 2.66年 | T155: 17.8 | U155: 426 | V155: 0.16800000000000001 | W155: 5.9999999999999998e-002 | X155: 7.5999999999999998e-002 | Y155: 295 | Z155: 4.37 | AA155: -4.4299999999999999e-002 | AB155: -4.9000000000000002e-002 | AC155: -9.9900000000000003e-002 | AD155: -0.10099999999999999 | AE155: 92.68 | AF155: 94.46 | AG155: 0.79 | AH155: AA | AI155: 3.9800000000000002e-002 | AJ155: =H155+100*O155 -> 148.94999999999999 | AK155: 151.6 | AL155: 127 | AM155: 57.2 | AN155: 129 | AO155: 0.187 | AP155: 9 | AQ155: 景20转债!
A156: 155 | B156: 113039 | C156: 嘉泽转债!! | D156: 601619 | E156: 嘉泽新能 | F156: 能源电力 | G156: 风能 | H156: 166.99 | I156: -1.1999999999999999e-003 | J156: -1.2e-002 | K156: 5.35 | L156: -1.47e-002 | M156: 112.8 | N156: 3.46 | O156: 8.0000000000000002e-002 | P156: 154.62 | Q156: 已到 | R156: 4.66年 | S156: 2.66年 | T156: 2.89 | U156: 374 | V156: 0.7659999999999999 | W156: 2.2000000000000002e-002 | X156: 3.5000000000000003e-002 | Y156: 129 | Z156: 2.73 | AA156: -8.199999999999999e-002 | AB156: -8.6300000000000002e-002 | AC156: -0.105 | AD156: -0.107 | AE156: 92.58 | AF156: 94.37 | AG156: 0.9 | AH156: AA | AI156: 3.9800000000000002e-002 | AJ156: =H156+100*O156 -> 174.99000000000001 | AK156: 179.4 | AL156: 279 | AM156: 85 | AN156: 273 | AO156: -4.0000000000000001e-003 | AP156: 33 | AQ156: 嘉泽转债!!
A157: 156 | B157: 113601 | C157: 塞力转债! | D157: 603716 | E157: 塞力医疗 | F157: 医药 | G157: 医药商业 | H157: 109.77 | I157: -3.2000000000000002e-003 | J157: -3.4999999999999996e-003 | K157: 13.35 | L157: -1.6899999999999998e-002 | M157: 120.8 | N157: 16.98 | O157: 0.39600000000000002 | P157: 78.62 | Q157: 已到 | R157: 4.66年 | S157: 2.66年 | T157: 5.43 | U157: 13 | V157: 2.2000000000000002e-002 | W157: 0.19800000000000001 | X157: 0.156 | Y157: 27 | Z157: 1.8 | AA157: 2.12e-002 | AB157: 1.34e-002 | AC157: -2.0099999999999996e-002 | AD157: -2.2499999999999999e-002 | AE157: 87.96 | AF157: 92.35 | AG157: 0.39 | AH157: AA- | AI157: 6.08e-002 | AJ157: =H157+100*O157 -> 149.37 | AK157: 140.9 | AL157: 35 | AM157: 48.6 | AN157: 67 | AO157: -7.4999999999999997e-002 | AP157: 38 | AQ157: 塞力转债!
A158: 157 | B158: 128128 | C158: 齐翔转2! | D158: 2408 | E158: 齐翔腾达 | F158: 化工 | G158: 化工 | H158: 189.736 | I158: -2.8500000000000001e-002 | J158: 2.7000000000000001e-003 | K158: 10.22 | L158: -2.76e-002 | M158: 115 | N158: 5.69 | O158: 5.5999999999999994e-002 | P158: 179.61 | Q158: 已到 | R158: 4.65年 | S158: 2.65年 | T158: 6.81 | U158: 74 | V158: 5.7000000000000002e-002 | W158: 2.3e-002 | X158: 4.2000000000000003e-002 | Y158: 291 | Z158: 2.33 | AA158: -0.10400000000000001 | AB158: -0.109 | AC158: -0.128 | AD158: -0.129 | AE158: 92.73 | AF158: 96.26 | AG158: 0.94 | AH158: AA | AI158: 3.9800000000000002e-002 | AJ158: =H158+100*O158 -> 195.33599999999998 | AK158: 199.9 | AL158: 317 | AM158: 103.6 | AN158: 311 | AO158: 0. | AP158: 27 | AQ158: 齐翔转2!
A159: 158 | B159: 128127 | C159: 文科转债! | D159: 2775 | E159: 文科园林 | F159: 城市公用 | G159: 生态环境 | H159: 116.599 | I159: -1.1899999999999999e-002 | J159: 6.6600000000000006e-002 | K159: 4.61 | L159: 0.10000000000000001 | M159: 120.8 | N159: 4.88 | O159: 0.23399999999999999 | P159: 94.47 | Q159: 已到 | R159: 4.65年 | S159: 2.65年 | T159: 9.5 | U159: 853 | V159: 0.76500000000000001 | W159: 0.40200000000000002 | X159: 0.38 | Y159: 24 | Z159: 1.11 | AA159: 7.8000000000000005e-003 | AB159: 1.e-004 | AC159: -4.0999999999999995e-002 | AD159: -4.3400000000000001e-002 | AE159: 87.98 | AF159: 92.36 | AG159: 0.55 | AH159: AA- | AI159: 6.08e-002 | AJ159: =H159+100*O159 -> 139.999 | AK159: 138.7 | AL159: 29 | AM159: 46.4 | AN159: 55 | AO159: 0.25900000000000001 | AP159: 77 | AQ159: 文科转债!
A160: 159 | B160: 110074 | C160: 精达转债!! | D160: 600577 | E160: 精达股份 | F160: 电子 | G160: 电子产品 | H160: 245.59 | I160: 3.0600000000000002e-002 | J160: -3.56e-002 | K160: 7.6 | L160: -5.1999999999999998e-003 | M160: 116.9 | N160: 3.73 | O160: 0.20499999999999999 | P160: 203.75 | Q160: 已到 | R160: 4.65年 | S160: 2.65年 | T160: 5.1 | U160: 578 | V160: 0.45399999999999996 | W160: 3.4000000000000002e-002 | X160: 6.9000000000000006e-002 | Y160: 151 | Z160: 3.51 | AA160: -0.14999999999999999 | AB160: -0.155 | AC160: -0.16500000000000001 | AD160: -0.16600000000000001 | AE160: 92.73 | AF160: 97.85 | AG160: 0.96 | AH160: AA | AI160: 3.9800000000000002e-002 | AJ160: =H160+100*O160 -> 266.09000000000003 | AK160: 287.4 | AL160: 357 | AM160: 189.6 | AN160: 357 | AO160: -9.5000000000000001e-002 | AP160: 11 | AQ160: 精达转债!!
A161: 160 | B161: 110072 | C161: 广汇转债! | D161: 600297 | E161: 广汇汽车 | F161: 汽车 | G161: 分销、售 | H161: 101.48 | I161: -2.8000000000000004e-003 | J161: 2.2000000000000001e-003 | K161: 2.64 | L161: -3.8e-003 | M161: 114.3 | N161: 4.03 | O161: 0.54899999999999993 | P161: 65.51 | Q161: 已到 | R161: 4.65年 | S161: 2.65年 | T161: 33.7 | U161: 21 | V161: 6.0000000000000001e-003 | W161: 0.157 | X161: 0.10300000000000001 | Y161: 214 | Z161: 0.52 | AA161: 2.64e-002 | AB161: 2.06e-002 | AC161: 4.5999999999999999e-003 | AD161: 2.7000000000000001e-003 | AE161: 93.42 | AF161: 97.75 | AG161: 0.15 | AH161: AA+ | AI161: 3.4799999999999998e-002 | AJ161: =H161+100*O161 -> 156.38 | AK161: 137.5 | AL161: 20 | AM161: 39.7 | AN161: 23 | AO161: 2.2000000000000002e-002 | AP161: 83 | AQ161: 广汇转债!
A162: 161 | B162: 113600 | C162: 新星转债!! | D162: 603978 | E162: 深圳新星 | F162: 有色金属 | G162: 有色行业 | H162: 140.68 | I162: -8.9999999999999998e-004 | J162: -2.3599999999999999e-002 | K162: 28.36 | L162: -3.6000000000000004e-002 | M162: 125.6 | N162: 23.85 | O162: 0.183 | P162: 118.91 | Q162: 已到 | R162: 4.63年 | S162: 2.63年 | T162: 4.53 | U162: 89 | V162: 0.14099999999999999 | W162: 9.8000000000000004e-002 | X162: 0.11599999999999999 | Y162: 46 | Z162: 2.99 | AA162: -2.46e-002 | AB162: -3.3399999999999999e-002 | AC162: -0.10300000000000001 | AD162: -0.105 | AE162: 87.88 | AF162: 96.08 | AG162: 0.68 | AH162: AA- | AI162: 6.08e-002 | AJ162: =H162+100*O162 -> 158.98000000000002 | AK162: 162.5 | AL162: 205 | AM162: 66.4 | AN162: 188 | AO162: -9.1999999999999998e-002 | AP162: 25 | AQ162: 新星转债!!
A163: 162 | B163: 127021 | C163: 特发转2! | D163: 70 | E163: 特发信息 | F163: 通信互联 | G163: 通信设备 | H163: 127.587 | I163: -1.1999999999999999e-003 | J163: -1.9199999999999998e-002 | K163: 6.87 | L163: -4.58e-002 | M163: 113 | N163: 7.33 | O163: 0.36099999999999999 | P163: 93.72 | Q163: 已到 | R163: 3.62年 | S163: 1.62年 | T163: 5.5 | U163: 17 | V163: 2.4e-002 | W163: 9.6999999999999989e-002 | X163: 9.0999999999999998e-002 | Y163: 57 | Z163: 1.96 | AA163: -3.3399999999999999e-002 | AB163: -3.9599999999999996e-002 | AC163: -0.10199999999999999 | AD163: -0.10300000000000001 | AE163: 94.94 | AF163: 98.3 | AG163: 0.44 | AH163: AA | AI163: 3.9800000000000002e-002 | AJ163: =H163+100*O163 -> 163.68700000000001 | AK163: 161.4 | AL163: 195 | AM163: 63.1 | AN163: 169 | AO163: -2.5000000000000001e-002 | AP163: 16 | AQ163: 特发转2!
A164: 163 | B164: 113599 | C164: 嘉友转债! | D164: 603871 | E164: 嘉友国际 | F164: 交通运输 | G164: 物流业 | H164: 135.71 | I164: -2.2499999999999999e-002 | J164: -1.41e-002 | K164: 21.56 | L164: -5.4400000000000004e-002 | M164: 125.6 | N164: 18.32 | O164: 0.153 | P164: 117.69 | Q164: 已到 | R164: 4.61年 | S164: 2.61年 | T164: 7.2 | U164: 24 | V164: 2.5000000000000001e-002 | W164: 0.105 | X164: 0.124 | Y164: 68 | Z164: 2.94 | AA164: -1.7000000000000001e-002 | AB164: -2.5899999999999999e-002 | AC164: -9.3599999999999989e-002 | AD164: -9.5600000000000004e-002 | AE164: 88 | AF164: 96.2 | AG164: 0.67 | AH164: AA- | AI164: 6.08e-002 | AJ164: =H164+100*O164 -> 151.01000000000002 | AK164: 153.7 | AL164: 146 | AM164: 57.5 | AN164: 132 | AO164: 1.e-002 | AP164: 18 | AQ164: 嘉友转债!
A165: 164 | B165: 113598 | C165: 法兰转债 | D165: 603966 | E165: 法兰泰克 | F165: 机械装备 | G165: 工程机械 | H165: 123.1 | I165: -9.300000000000001e-003 | J165: -2.3999999999999998e-003 | K165: 9.6 | L165: -2.0400000000000001e-002 | M165: 120.8 | N165: 9.7 | O165: 0.24399999999999999 | P165: 98.97 | Q165: 已到 | R165: 4.60年 | S165: 2.60年 | T165: 2.75 | U165: 18 | V165: 5.2999999999999999e-002 | W165: 9.5000000000000001e-002 | X165: 9.4e-002 | Y165: 29 | Z165: 2.3 | AA165: -4.1999999999999997e-003 | AB165: -1.1899999999999999e-002 | AC165: -6.0599999999999994e-002 | AD165: -6.3e-002 | AE165: 88.26 | AF165: 92.66 | AG165: 0.58 | AH165: AA- | AI165: 6.08e-002 | AJ165: =H165+100*O165 -> 147.5 | AK165: 147.2 | AL165: 84 | AM165: 54.6 | AN165: 111 | AO165: 4.7e-002 | AP165: 13 | AQ165: 法兰转债
A166: 165 | B166: 128125 | C166: 华阳转债! | D166: 2949 | E166: 华阳国际 | F166: 建筑 | G166: 建筑工程 | H166: 111.651 | I166: -6.1999999999999998e-003 | J166: 2.0000000000000001e-004 | K166: 15.29 | L166: -3.2300000000000002e-002 | M166: 118.1 | N166: 25.39 | O166: 0.85400000000000009 | P166: 60.22 | Q166: 已到 | R166: 4.59年 | S166: 2.59年 | T166: 4.5 | U166: 3.5 | V166: 6.9999999999999993e-003 | W166: 0.14999999999999999 | X166: 8.9999999999999997e-002 | Y166: 30 | Z166: 2.22 | AA166: 1.2500000000000001e-002 | AB166: 5.5000000000000005e-003 | AC166: -2.75e-002 | AD166: -2.98e-002 | AE166: 88.01 | AF166: 90.55 | AG166: 0.19 | AH166: AA- | AI166: 6.08e-002 | AJ166: =H166+100*O166 -> 197.05099999999999 | AK166: 163.1 | AL166: 211 | AM166: 72.5 | AN166: 220 | AO166: 2.7999999999999997e-002 | AP166: 13 | AQ166: 华阳转债!
A167: 166 | B167: 113597 | C167: 佳力转债! | D167: 603912 | E167: 佳力图 | F167: 机械装备 | G167: 专用设备 | H167: 115.07 | I167: -4.1999999999999997e-003 | J167: -2.8000000000000004e-003 | K167: 14.48 | L167: -3.6600000000000001e-002 | M167: 124 | N167: 23.15 | O167: 0.83999999999999997 | P167: 62.55 | Q167: 已到 | R167: 4.59年 | S167: 2.59年 | T167: 3 | U167: 6.2 | V167: 1.8000000000000002e-002 | W167: 9.5000000000000001e-002 | X167: 5.9999999999999998e-002 | Y167: 31 | Z167: 3.28 | AA167: 1.6799999999999999e-002 | AB167: 7.8000000000000005e-003 | AC167: -3.6600000000000001e-002 | AD167: -3.9100000000000003e-002 | AE167: 88.44 | AF167: 95.12 | AG167: 0.19 | AH167: AA- | AI167: 6.08e-002 | AJ167: =H167+100*O167 -> 199.06999999999999 | AK167: 167.6 | AL167: 235 | AM167: 72.5 | AN167: 219 | AO167: -4.2000000000000003e-002 | AP167: 21 | AQ167: 佳力转债!
A168: 167 | B168: 123063 | C168: 大禹转债 | D168: 300021 | E168: 大禹节水 | F168: 化工 | G168: 橡胶塑料 | H168: 130.749 | I168: 1.3899999999999999e-002 | J168: 2.e-003 | K168: 5.93 | L168: 2.2400000000000003e-002 | M168: 126.1 | N168: 4.83 | O168: 6.5000000000000002e-002 | P168: 122.77 | Q168: 已到 | R168: 4.59年 | S168: 3.59年 | T168: 6.35 | U168: 153 | V168: 0.184 | W168: 0.13400000000000001 | X168: 0.16399999999999998 | Y168: 48 | Z168: 3.19 | AA168: -8.0000000000000002e-003 | AB168: -1.72e-002 | AC168: -5.3699999999999998e-002 | AD168: -5.67e-002 | AE168: 85.75 | AF168: 96.76 | AG168: 0.71 | AH168: AA- | AI168: 6.08e-002 | AJ168: =H168+100*O168 -> 137.249 | AK168: 138.7 | AL168: 28 | AM168: 42 | AN168: 33 | AO168: 7.0000000000000007e-002 | AP168: 21 | AQ168: 大禹转债
A169: 168 | B169: 128124 | C169: 科华转债! | D169: 2022 | E169: 科华生物 | F169: 医药 | G169: 生物制药 | H169: 109.57 | I169: 0. | J169: 1.1999999999999999e-003 | K169: 14.49 | L169: 5.6000000000000008e-003 | M169: 110 | N169: 21.3 | O169: 0.61099999999999999 | P169: 68.03 | Q169: 已到 | R169: 4.59年 | S169: 2.59年 | T169: 7.38 | U169: 7.4 | V169: 9.0000000000000011e-003 | W169: 9.9000000000000005e-002 | X169: 6.7000000000000004e-002 | Y169: 75 | Z169: 2.06 | AA169: 8.9999999999999998e-004 | AB169: -3.2000000000000002e-003 | AC169: -2.3199999999999998e-002 | AD169: -2.5099999999999997e-002 | AE169: 92.35 | AF169: 92.25 | AG169: 0.22 | AH169: AA | AI169: 3.9800000000000002e-002 | AJ169: =H169+100*O169 -> 170.66999999999999 | AK169: 151.1 | AL169: 124 | AM169: 58.8 | AN169: 141 | AO169: -6.9999999999999993e-003 | AP169: 26 | AQ169: 科华转债!
A170: 169 | B170: 113596 | C170: 城地转债! | D170: 603887 | E170: 城地香江 | F170: 通信互联 | G170: 通信设备 | H170: 96.98 | I170: 1.1000000000000001e-003 | J170: -1.1999999999999999e-003 | K170: 7.91 | L170: -2.2200000000000001e-002 | M170: 113.1 | N170: 24.26 | O170: 1.97 | P170: 32.61 | Q170: 已到 | R170: 4.59年 | S170: 2.59年 | T170: 12 | U170: 24 | V170: 2.1000000000000001e-002 | W170: 0.33600000000000002 | X170: 0.11 | Y170: 36 | Z170: 0.95 | AA170: 3.4799999999999998e-002 | AB170: 2.9300000000000003e-002 | AC170: 2.3900000000000001e-002 | AD170: 2.1299999999999999e-002 | AE170: 88.04 | AF170: 86.77 | AG170: 0 | AH170: AA- | AI170: 6.08e-002 | AJ170: =H170+100*O170 -> 293.98000000000002 | AK170: 161.4 | AL170: 194 | AM170: 73.3 | AN170: 225 | AO170: 9.0000000000000011e-003 | AP170: 42 | AQ170: 城地转债!
A171: 170 | B171: 123062 | C171: 三超转债 | D171: 300554 | E171: 三超新材 | F171: 机械装备 | G171: 通用设备 | H171: 121.05 | I171: -1.1699999999999999e-002 | J171: -1.1200000000000002e-002 | K171: 15.97 | L171: -3.6200000000000003e-002 | M171: 119.2 | N171: 17.13 | O171: 0.29799999999999999 | P171: 93.23 | Q171: 已到 | R171: 4.59年 | S171: 2.59年 | T171: 1.95 | U171: 15 | V171: 6.2e-002 | W171: 0.13 | X171: 0.121 | Y171: 15 | Z171: 2.85 | AA171: -3.4000000000000002e-003 | AB171: -1.06e-002 | AC171: -5.3699999999999998e-002 | AD171: -5.6399999999999999e-002 | AE171: 84.04 | AF171: 83.86 | AG171: 0.63 | AH171: A | AI171: 8.1799999999999998e-002 | AJ171: =H171+100*O171 -> 150.84999999999999 | AK171: 148.9 | AL171: 98 | AM171: 64.8 | AN171: 182 | AO171: -2.7999999999999997e-002 | AP171: 27 | AQ171: 三超转债
A172: 171 | B172: 128123 | C172: 国光转债! | D172: 2749 | E172: 国光股份 | F172: 化工 | G172: 农化 | H172: 111.44 | I172: 4.0000000000000002e-004 | J172: -7.000000000000001e-004 | K172: 9.81 | L172: -1.e-003 | M172: 115.7 | N172: 13.49 | O172: 0.53200000000000003 | P172: 72.72 | Q172: 已到 | R172: 4.59年 | S172: 2.59年 | T172: 3.2 | U172: 2.1 | V172: 6.0000000000000001e-003 | W172: 7.4999999999999997e-002 | X172: 5.4000000000000006e-002 | Y172: 43 | Z172: 3.26 | AA172: 8.3999999999999995e-003 | AB172: 2.2000000000000001e-003 | AC172: -2.63e-002 | AD172: -2.87e-002 | AE172: 88.22 | AF172: 88.81 | AG172: 0.35 | AH172: AA- | AI172: 6.08e-002 | AJ172: =H172+100*O172 -> 164.63999999999999 | AK172: 150.2 | AL172: 110 | AM172: 61.4 | AN172: 155 | AO172: 5.9000000000000004e-002 | AP172: 14 | AQ172: 国光转债!
A173: 172 | B173: 110073 | C173: 国投转债 | D173: 600061 | E173: 国投资本 | F173: 金融 | G173: 证券行业 | H173: 116.32 | I173: -1.8e-003 | J173: -2.3999999999999998e-003 | K173: 8.12 | L173: -1.2199999999999999e-002 | M173: 110.3 | N173: 9.9 | O173: 0.41799999999999998 | P173: 82.02 | Q173: 已到 | R173: 4.58年 | S173: 无权 | T173: 80 | U173: 17 | V173: 2.e-003 | W173: 0.153 | X173: 0.126 | Y173: 522 | Z173: 1.15 | AA173: -1.1699999999999999e-002 | AB173: -1.5800000000000002e-002 | AC173: 无权 | AD173: 无权 | AE173: 无权 | AF173: 95.34 | AG173: 0.35 | AH173: AAA | AI173: 3.2799999999999996e-002 | AJ173: =H173+100*O173 -> 158.12 | AK173: 150.6 | AL173: 118 | AM173: 55.3 | AN173: 114 | AO173: -1.3000000000000001e-002 | AP173: 22 | AQ173: 国投转债
A174: 173 | B174: 128122 | C174: 兴森转债! | D174: 2436 | E174: 兴森科技 | F174: 电子 | G174: 元器件制 | H174: 134.63 | I174: -1.46e-002 | J174: 1.04e-002 | K174: 13.63 | L174: -8.6999999999999994e-003 | M174: 113 | N174: 14.1 | O174: 0.39299999999999996 | P174: 96.67 | Q174: 已到 | R174: 3.58年 | S174: 2.58年 | T174: 2.69 | U174: 7.6 | V174: 2.1000000000000001e-002 | W174: 1.3000000000000001e-002 | X174: 1.3000000000000001e-002 | Y174: 203 | Z174: 5.66 | AA174: -4.8399999999999999e-002 | AB174: -5.45e-002 | AC174: -9.2600000000000002e-002 | AD174: -9.4600000000000004e-002 | AE174: 92.93 | AF174: 98.46 | AG174: 0.48 | AH174: AA | AI174: 3.9800000000000002e-002 | AJ174: =H174+100*O174 -> 173.93000000000001 | AK174: 172.6 | AL174: 260 | AM174: 74.1 | AN174: 230 | AO174: -3.3000000000000002e-002 | AP174: 11 | AQ174: 兴森转债!
A175: 174 | B175: 113037 | C175: 紫银转债! | D175: 601860 | E175: 紫金银行 | F175: 金融 | G175: 银行行业 | H175: 108.28 | I175: 3.2000000000000002e-003 | J175: -1.1999999999999999e-003 | K175: 3.37 | L175: 6.0000000000000001e-003 | M175: 115.6 | N175: 4.05 | O175: 0.30099999999999999 | P175: 83.21 | Q175: 已到 | R175: 4.58年 | S175: 无权 | T175: 45 | U175: 63 | V175: 1.3000000000000001e-002 | W175: 0.36499999999999999 | X175: 0.30299999999999999 | Y175: 123 | Z175: 0.8 | AA175: 1.47e-002 | AB175: 8.5000000000000006e-003 | AC175: 无权 | AD175: 无权 | AE175: 无权 | AF175: 99.21 | AG175: 0.35 | AH175: AA+ | AI175: 3.4799999999999998e-002 | AJ175: =H175+100*O175 -> 138.38 | AK175: 133.4 | AL175: 12 | AM175: 34.1 | AN175: 15 | AO175: 4.5999999999999999e-002 | AP175: 28 | AQ175: 紫银转债!
A176: 175 | B176: 123061 | C176: 航新转债! | D176: 300424 | E176: 航新科技 | F176: 航空航天 | G176: 航空航天 | H176: 124.899 | I176: -7.1999999999999998e-003 | J176: -1.6000000000000001e-003 | K176: 14.97 | L176: -1.4499999999999999e-002 | M176: 124.3 | N176: 14.85 | O176: 0.23899999999999999 | P176: 100.81 | Q176: 已到 | R176: 4.57年 | S176: 2.57年 | T176: 2.5 | U176: 48 | V176: 0.154 | W176: 7.0000000000000007e-002 | X176: 7.0000000000000007e-002 | Y176: 36 | Z176: 5.31 | AA176: -1.1000000000000001e-003 | AB176: -9.8999999999999991e-003 | AC176: -6.4600000000000005e-002 | AD176: -6.7199999999999996e-002 | AE176: 86.38 | AF176: 91.24 | AG176: 0.61 | AH176: A+ | AI176: 7.1800000000000003e-002 | AJ176: =H176+100*O176 -> 148.79900000000001 | AK176: 149 | AL176: 101 | AM176: 57.8 | AN176: 136 | AO176: -4.0999999999999995e-002 | AP176: 19 | AQ176: 航新转债!
A177: 176 | B177: 123060 | C177: 苏试转债! | D177: 300416 | E177: 苏试试验 | F177: 机械装备 | G177: 专用设备 | H177: 197.882 | I177: -2.2799999999999997e-002 | J177: -4.8999999999999998e-003 | K177: 31.72 | L177: -2.9999999999999999e-002 | M177: 117.2 | N177: 18.28 | O177: 0.14000000000000001 | P177: 173.52 | Q177: 已到 | R177: 4.57年 | S177: 2.57年 | T177: 3.1 | U177: 38 | V177: 6.0999999999999999e-002 | W177: 3.7000000000000005e-002 | X177: 6.4000000000000001e-002 | Y177: 84 | Z177: 8.25 | AA177: -0.11 | AB177: -0.11599999999999999 | AC177: -0.14000000000000001 | AD177: -0.14099999999999999 | AE177: 88.23 | AF177: 90.02 | AG177: 0.92 | AH177: AA- | AI177: 6.08e-002 | AJ177: =H177+100*O177 -> 211.88200000000001 | AK177: 222.2 | AL177: 330 | AM177: 132.2 | AN177: 331 | AO177: 7.2000000000000008e-002 | AP177: 7 | AQ177: 苏试转债!
A178: 177 | B178: 113595 | C178: 花王转债! | D178: 603007 | E178: ST花王 | F178: 城市公用 | G178: 生态环境 | H178: 107.94 | I178: -4.5000000000000005e-003 | J178: 0. | K178: 3.3 | L178: -3.5099999999999999e-002 | M178: 124.8 | N178: 6.92 | O178: 1.26 | P178: 47.69 | Q178: 已到 | R178: 4.57年 | S178: 2.57年 | T178: 3.3 | U178: 34 | V178: 9.6000000000000002e-002 | W178: 0.29799999999999999 | X178: 0.14199999999999999 | Y178: 11 | Z178: 1.03 | AA178: 3.3000000000000002e-002 | AB178: 2.3599999999999999e-002 | AC178: -1.46e-002 | AD178: -1.72e-002 | AE178: 79.78 | AF178: 80.96 | AG178: 0.13 | AH178: BBB+ | AI178: 0.1018 | AJ178: =H178+100*O178 -> 233.94 | AK178: 168.2 | AL178: 239 | AM178: 87.2 | AN178: 280 | AO178: -3.9e-002 | AP178: 50 | AQ178: 花王转债!
A179: 178 | B179: 113594 | C179: 淳中转债! | D179: 603516 | E179: 淳中科技 | F179: 电子 | G179: 电子产品 | H179: 137.9 | I179: -1.e-004 | J179: -3.5200000000000002e-002 | K179: 19.49 | L179: -5.2499999999999998e-002 | M179: 120.9 | N179: 18.23 | O179: 0.28999999999999998 | P179: 106.91 | Q179: 已到 | R179: 4.57年 | S179: 2.57年 | T179: 3 | U179: 59 | V179: 0.14400000000000002 | W179: 8.199999999999999e-002 | X179: 8.8000000000000009e-002 | Y179: 36 | Z179: 3.75 | AA179: -2.8999999999999998e-002 | AB179: -3.6499999999999998e-002 | AC179: -9.8599999999999993e-002 | AD179: -0.10000000000000001 | AE179: 86.26 | AF179: 88.74 | AG179: 0.67 | AH179: A+ | AI179: 7.1800000000000003e-002 | AJ179: =H179+100*O179 -> 166.90000000000001 | AK179: 168.9 | AL179: 242 | AM179: 80.1 | AN179: 249 | AO179: -1.9e-002 | AP179: 9 | AQ179: 淳中转债!
A180: 179 | B180: 127020 | C180: 中金转债 | D180: 60 | E180: 中金岭南 | F180: 有色金属 | G180: 有色行业 | H180: 124.626 | I180: -6.6e-003 | J180: -8.8000000000000005e-003 | K180: 4.96 | L180: -2.5499999999999998e-002 | M180: 113.5 | N180: 4.63 | O180: 0.16300000000000001 | P180: 107.13 | Q180: 已到 | R180: 4.57年 | S180: 2.57年 | T180: 34.3 | U180: 43 | V180: 1.e-002 | W180: 0.18899999999999997 | X180: 0.20300000000000001 | Y180: 181 | Z180: 1.44 | AA180: -2.0499999999999997e-002 | AB180: -2.5699999999999997e-002 | AC180: -7.0099999999999996e-002 | AD180: -7.1599999999999997e-002 | AE180: 93.17 | AF180: 97.29 | AG180: 0.6 | AH180: AA+ | AI180: 3.4799999999999998e-002 | AJ180: =H180+100*O180 -> 140.92600000000002 | AK180: 142.1 | AL180: 40 | AM180: 44.8 | AN180: 47 | AO180: -5.0000000000000001e-003 | AP180: 20 | AQ180: 中金转债
A181: 180 | B181: 113593 | C181: 沪工转债! | D181: 603131 | E181: 上海沪工 | F181: 机械装备 | G181: 通用设备 | H181: 146.01 | I181: -1.8000000000000002e-002 | J181: -1.03e-002 | K181: 25.73 | L181: -3.78e-002 | M181: 121.2 | N181: 21.12 | O181: 0.19800000000000001 | P181: 121.83 | Q181: 已到 | R181: 4.57年 | S181: 2.57年 | T181: 4 | U181: 26 | V181: 4.4999999999999998e-002 | W181: 4.9000000000000002e-002 | X181: 5.9999999999999998e-002 | Y181: 82 | Z181: 6.16 | AA181: -4.0800000000000003e-002 | AB181: -4.82e-002 | AC181: -0.11599999999999999 | AD181: -0.11800000000000001 | AE181: 86.38 | AF181: 88.98 | AG181: 0.75 | AH181: A+ | AI181: 7.1800000000000003e-002 | AJ181: =H181+100*O181 -> 165.81 | AK181: 170.2 | AL181: 248 | AM181: 81.2 | AN181: 253 | AO181: 1.9e-002 | AP181: 9 | AQ181: 沪工转债!
A182: 181 | B182: 128120 | C182: 联诚转债! | D182: 2921 | E182: 联诚精密 | F182: 汽车 | G182: 零部件制 | H182: 118.186 | I182: -6.8000000000000005e-003 | J182: -7.6e-003 | K182: 16.57 | L182: -2.3599999999999999e-002 | M182: 117.9 | N182: 18.44 | O182: 0.315 | P182: 89.86 | Q182: 已到 | R182: 4.56年 | S182: 2.56年 | T182: 2.6 | U182: 5 | V182: 1.6e-002 | W182: 0.14800000000000002 | X182: 0.13300000000000001 | Y182: 18 | Z182: 2.2 | AA182: -5.0000000000000001e-004 | AB182: -7.4000000000000003e-003 | AC182: -4.5999999999999999e-002 | AD182: -4.87e-002 | AE182: 84.2 | AF182: 83.13 | AG182: 0.61 | AH182: A | AI182: 8.1799999999999998e-002 | AJ182: =H182+100*O182 -> 149.68600000000001 | AK182: 146.5 | AL182: 73 | AM182: 62.3 | AN182: 160 | AO182: 2.e-003 | AP182: 22 | AQ182: 联诚转债!
A183: 182 | B183: 128121 | C183: 宏川转债! | D183: 2930 | E183: 宏川智慧 | F183: 交通运输 | G183: 物流业 | H183: 138.998 | I183: -8.6e-003 | J183: 1.2999999999999999e-003 | K183: 26.49 | L183: -8.6e-003 | M183: 112.9 | N183: 19.89 | O183: 4.4000000000000004e-002 | P183: 133.18 | Q183: 已到 | R183: 4.56年 | S183: 2.56年 | T183: 6.7 | U183: 51 | V183: 5.5e-002 | W183: 5.7000000000000002e-002 | X183: 7.4999999999999997e-002 | Y183: 118 | Z183: 5.58 | AA183: -4.5400000000000003e-002 | AB183: -5.0199999999999995e-002 | AC183: -0.10300000000000001 | AD183: -0.105 | AE183: 88.17 | AF183: 86.76 | AG183: 0.85 | AH183: AA- | AI183: 6.08e-002 | AJ183: =H183+100*O183 -> 143.398 | AK183: 144.8 | AL183: 56 | AM183: 56.6 | AN183: 125 | AO183: 4.9000000000000002e-002 | AP183: 7 | AQ183: 宏川转债!
A184: 183 | B184: 123059 | C184: 银信转债! | D184: 300231 | E184: 银信科技 | F184: 计算机及 | G184: 软件开发 | H184: 118.525 | I184: -8.199999999999999e-003 | J184: -9.0000000000000011e-003 | K184: 8.3 | L184: -3.9399999999999998e-002 | M184: 123.7 | N184: 9.72 | O184: 0.38799999999999996 | P184: 85.39 | Q184: 已到 | R184: 4.55年 | S184: 2.55年 | T184: 3.91 | U184: 3.5 | V184: 8.0000000000000002e-003 | W184: 0.107 | X184: 9.0999999999999998e-002 | Y184: 37 | Z184: 2.62 | AA184: 9.5999999999999992e-003 | AB184: 8.0000000000000004e-004 | AC184: -4.8600000000000004e-002 | AD184: -5.0999999999999997e-002 | AE184: 88.39 | AF184: 95.1 | AG184: 0.44 | AH184: AA- | AI184: 6.08e-002 | AJ184: =H184+100*O184 -> 157.32499999999999 | AK184: 151.7 | AL184: 129 | AM184: 56.6 | AN184: 123 | AO184: -2.8999999999999998e-002 | AP184: 19 | AQ184: 银信转债!
A185: 184 | B185: 127019 | C185: 国城转债! | D185: 688 | E185: 国城矿业 | F185: 有色金属 | G185: 锌铅镍锡 | H185: 107.9 | I185: -2.0999999999999999e-003 | J185: 6.0999999999999995e-003 | K185: 14.32 | L185: 2.07e-002 | M185: 114.8 | N185: 21.06 | O185: 0.58700000000000008 | P185: 68 | Q185: 已到 | R185: 4.55年 | S185: 2.55年 | T185: 8.5 | U185: 14 | V185: 1.4999999999999999e-002 | W185: 5.2000000000000005e-002 | X185: 3.5000000000000003e-002 | Y185: 163 | Z185: 6.74 | AA185: 1.3999999999999999e-002 | AB185: 8.0000000000000002e-003 | AC185: -1.6e-002 | AD185: -1.83e-002 | AE185: 92.98 | AF185: 96.44 | AG185: 0.19 | AH185: AA | AI185: 3.9800000000000002e-002 | AJ185: =H185+100*O185 -> 166.60000000000002 | AK185: 147.8 | AL185: 88 | AM185: 51.4 | AN185: 95 | AO185: 4.0000000000000001e-002 | AP185: 51 | AQ185: 国城转债!
A186: 185 | B186: 128119 | C186: 龙大转债! | D186: 2726 | E186: 龙大美食 | F186: 食品饮料 | G186: 肉制品 | H186: 130.5 | I186: 1.1599999999999999e-002 | J186: -9.300000000000001e-003 | K186: 10.05 | L186: 4.0000000000000001e-003 | M186: 119.9 | N186: 9.29 | O186: 0.20600000000000002 | P186: 108.18 | Q186: 已到 | R186: 4.55年 | S186: 2.55年 | T186: 9.46 | U186: 67 | V186: 5.4000000000000006e-002 | W186: 8.6999999999999994e-002 | X186: 9.4e-002 | Y186: 108 | Z186: 2.68 | AA186: -1.8799999999999997e-002 | AB186: -2.6099999999999998e-002 | AC186: -8.2799999999999999e-002 | AD186: -8.4900000000000003e-002 | AE186: 93.1 | AF186: 100.75 | AG186: 0.59 | AH186: AA | AI186: 3.9800000000000002e-002 | AJ186: =H186+100*O186 -> 151.09999999999999 | AK186: 152.8 | AL186: 140 | AM186: 52.1 | AN186: 97 | AO186: -4.5999999999999999e-002 | AP186: 9 | AQ186: 龙大转债!
A187: 186 | B187: 110071 | C187: 湖盐转债! | D187: 600929 | E187: 雪天盐业 | F187: 食品饮料 | G187: 食品饮料 | H187: 126.2 | I187: 3.0000000000000001e-003 | J187: -1.01e-002 | K187: 6.93 | L187: -1.1399999999999999e-002 | M187: 114.9 | N187: 6.52 | O187: 0.187 | P187: 106.29 | Q187: 已到 | R187: 4.54年 | S187: 2.54年 | T187: 7.2 | U187: 20 | V187: 2.2000000000000002e-002 | W187: 0.111 | X187: 0.11800000000000001 | Y187: 65 | Z187: 2.48 | AA187: -2.0799999999999999e-002 | AB187: -2.6499999999999999e-002 | AC187: -7.1500000000000008e-002 | AD187: -7.3700000000000002e-002 | AE187: 93.13 | AF187: 96.59 | AG187: 0.62 | AH187: AA | AI187: 3.9800000000000002e-002 | AJ187: =H187+100*O187 -> 144.90000000000001 | AK187: 146.1 | AL187: 67 | AM187: 49.5 | AN187: 80 | AO187: -2.2000000000000002e-002 | AP187: 19 | AQ187: 湖盐转债!
A188: 187 | B188: 113036 | C188: 宁建转债! | D188: 601789 | E188: 宁波建工 | F188: 建筑 | G188: 建筑工程 | H188: 113.5 | I188: -2.5999999999999999e-003 | J188: -1.1000000000000001e-003 | K188: 3.72 | L188: -1.3300000000000001e-002 | M188: 116.9 | N188: 4.76 | O188: 0.45200000000000001 | P188: 78.15 | Q188: 已到 | R188: 4.53年 | S188: 2.53年 | T188: 5.4 | U188: 1.8 | V188: 3.0000000000000001e-003 | W188: 0.14899999999999999 | X188: 0.11599999999999999 | Y188: 36 | Z188: 1.12 | AA188: 6.7000000000000002e-003 | AB188: 0. | AC188: -3.4300000000000004e-002 | AD188: -3.6600000000000001e-002 | AE188: 93.17 | AF188: 98.31 | AG188: 0.28 | AH188: AA | AI188: 3.9800000000000002e-002 | AJ188: =H188+100*O188 -> 158.69999999999999 | AK188: 148.8 | AL188: 97 | AM188: 50.5 | AN188: 86 | AO188: 1.7000000000000001e-002 | AP188: 14 | AQ188: 宁建转债!
A189: 188 | B189: 128118 | C189: 瀛通转债! | D189: 2861 | E189: 瀛通通讯 | F189: 电子 | G189: 电子产品 | H189: 110.728 | I189: 3.7000000000000002e-003 | J189: -7.0999999999999995e-003 | K189: 12.16 | L189: -2.41e-002 | M189: 121.7 | N189: 21.24 | O189: 0.93400000000000005 | P189: 57.25 | Q189: 已到 | R189: 4.52年 | S189: 2.52年 | T189: 3 | U189: 9.1 | V189: 2.7000000000000003e-002 | W189: 0.157 | X189: 8.9999999999999997e-002 | Y189: 19 | Z189: 1.82 | AA189: 2.1700000000000001e-002 | AB189: 1.32e-002 | AC189: -2.2599999999999999e-002 | AD189: -2.5499999999999998e-002 | AE189: 89.09 | AF189: 93.85 | AG189: 0.14 | AH189: AA- | AI189: 6.08e-002 | AJ189: =H189+100*O189 -> 204.12799999999999 | AK189: 164.2 | AL189: 216 | AM189: 70.4 | AN189: 210 | AO189: -2.1000000000000001e-002 | AP189: 25 | AQ189: 瀛通转债!
A190: 189 | B190: 128117 | C190: 道恩转债! | D190: 2838 | E190: 道恩股份 | F190: 化工 | G190: 橡胶塑料 | H190: 111.094 | I190: -4.0000000000000002e-004 | J190: -3.9000000000000003e-003 | K190: 16.23 | L190: -3.5699999999999996e-002 | M190: 123.1 | N190: 28.83 | O190: 0.97299999999999998 | P190: 56.3 | Q190: 已到 | R190: 4.52年 | S190: 2.52年 | T190: 3.6 | U190: 5.8 | V190: 1.4999999999999999e-002 | W190: 5.4000000000000006e-002 | X190: 3.1e-002 | Y190: 66 | Z190: 3.48 | AA190: 2.3399999999999997e-002 | AB190: 1.46e-002 | AC190: -2.6499999999999999e-002 | AD190: -2.8799999999999999e-002 | AE190: 88.41 | AF190: 94.79 | AG190: 0.12 | AH190: AA- | AI190: 6.08e-002 | AJ190: =H190+100*O190 -> 208.39400000000001 | AK190: 165.9 | AL190: 225 | AM190: 71.1 | AN190: 214 | AO190: -6.8000000000000005e-002 | AP190: 26 | AQ190: 道恩转债!
A191: 190 | B191: 123057 | C191: 美联转债!! | D191: 300586 | E191: 美联新材 | F191: 化工 | G191: 橡胶塑料 | H191: 162.8 | I191: -6.7099999999999993e-002 | J191: -3.4000000000000002e-003 | K191: 14.05 | L191: -8.1699999999999995e-002 | M191: 117.8 | N191: 9.5 | O191: 0.10099999999999999 | P191: 147.89 | Q191: 已到 | R191: 4.52年 | S191: 2.52年 | T191: 2.07 | U191: 323 | V191: 0.93099999999999994 | W191: 2.7999999999999997e-002 | X191: 4.0999999999999995e-002 | Y191: 74 | Z191: 6.16 | AA191: -7.0499999999999993e-002 | AB191: -7.6700000000000004e-002 | AC191: -0.10800000000000001 | AD191: -0.11 | AE191: 88.69 | AF191: 90.81 | AG191: 0.86 | AH191: AA- | AI191: 6.08e-002 | AJ191: =H191+100*O191 -> 172.90000000000001 | AK191: 177.7 | AL191: 272 | AM191: 86.9 | AN191: 279 | AO191: 3.5000000000000003e-002 | AP191: 19 | AQ191: 美联转债!!
A192: 191 | B192: 113591 | C192: 胜达转债! | D192: 603687 | E192: 大胜达 | F192: 造纸包装 | G192: 包装用纸 | H192: 124.42 | I192: -1.09e-002 | J192: -4.8999999999999998e-003 | K192: 10.34 | L192: -2.2700000000000001e-002 | M192: 121.7 | N192: 8.76 | O192: 5.4000000000000006e-002 | P192: 118.04 | Q192: 已到 | R192: 4.52年 | S192: 2.52年 | T192: 5.19 | U192: 67 | V192: 0.10400000000000001 | W192: 0.122 | X192: 0.14400000000000002 | Y192: 42 | Z192: 2.45 | AA192: -5.0000000000000001e-003 | AB192: -1.3100000000000001e-002 | AC192: -6.6500000000000004e-002 | AD192: -6.88e-002 | AE192: 88.59 | AF192: 93.78 | AG192: 0.69 | AH192: AA- | AI192: 6.08e-002 | AJ192: =H192+100*O192 -> 129.81999999999999 | AK192: 130.8 | AL192: 6 | AM192: 37 | AN192: 18 | AO192: -2.4e-002 | AP192: 35 | AQ192: 胜达转债!
A193: 192 | B193: 128116 | C193: 瑞达转债! | D193: 2961 | E193: 瑞达期货 | F193: 金融 | G193: 期货行业 | H193: 118.299 | I193: -5.7999999999999996e-003 | J193: 3.7000000000000002e-003 | K193: 24.71 | L193: -5.6000000000000008e-003 | M193: 114.9 | N193: 29.55 | O193: 0.41499999999999998 | P193: 83.62 | Q193: 已到 | R193: 4.51年 | S193: 2.51年 | T193: 6.49 | U193: 13 | V193: 1.7000000000000001e-002 | W193: 5.9000000000000004e-002 | X193: 4.9000000000000002e-002 | Y193: 110 | Z193: 5.18 | AA193: -6.6e-003 | AB193: -1.24e-002 | AC193: -4.9699999999999994e-002 | AD193: -5.1900000000000002e-002 | AE193: 93.15 | AF193: 96.7 | AG193: 0.38 | AH193: AA | AI193: 3.9800000000000002e-002 | AJ193: =H193+100*O193 -> 159.79900000000001 | AK193: 153 | AL193: 141 | AM193: 56.3 | AN193: 122 | AO193: 1.1000000000000001e-002 | AP193: 17 | AQ193: 瑞达转债!
A194: 193 | B194: 127018 | C194: 本钢转债! | D194: 761 | E194: 本钢板材 | F194: 钢铁 | G194: 炼钢 | H194: 119.4 | I194: -5.7999999999999996e-003 | J194: -3.2000000000000002e-003 | K194: 4.28 | L194: -2.5099999999999997e-002 | M194: 128 | N194: 4.55 | O194: 0.26899999999999996 | P194: 94.07 | Q194: 已到 | R194: 4.51年 | S194: 2.51年 | T194: 56.3 | U194: 32 | V194: 5.0000000000000001e-003 | W194: 0.32000000000000001 | X194: 0.30099999999999999 | Y194: 176 | Z194: 0.77 | AA194: 1.6e-002 | AB194: 5.6999999999999993e-003 | AC194: -4.4600000000000001e-002 | AD194: -4.8499999999999995e-002 | AE194: 97.2 | AF194: 111.16 | AG194: 0.36 | AH194: AAA | AI194: 3.2799999999999996e-002 | AJ194: =H194+100*O194 -> 146.30000000000001 | AK194: 144.7 | AL194: 55 | AM194: 33.6 | AN194: 12 | AO194: 9.0000000000000011e-003 | AP194: 60 | AQ194: 本钢转债!
A195: 194 | B195: 113589 | C195: 天创转债! | D195: 603608 | E195: 天创时尚 | F195: 服装纺织 | G195: 鞋服行业 | H195: 104.45 | I195: 3.4999999999999996e-003 | J195: -4.0999999999999995e-003 | K195: 6.34 | L195: -1.2500000000000001e-002 | M195: 114.9 | N195: 12.29 | O195: 1.02 | P195: 51.59 | Q195: 已到 | R195: 4.50年 | S195: 2.50年 | T195: 6 | U195: 14 | V195: 2.2000000000000002e-002 | W195: 0.22 | X195: 0.114 | Y195: 27 | Z195: 1.73 | AA195: 2.1899999999999999e-002 | AB195: 1.5700000000000002e-002 | AC195: -3.8e-003 | AD195: -6.3e-003 | AE195: 93.29 | AF195: 96.76 | AG195: 0.05 | AH195: AA | AI195: 3.9800000000000002e-002 | AJ195: =H195+100*O195 -> 206.44999999999999 | AK195: 157.3 | AL195: 169 | AM195: 60.6 | AN195: 149 | AO195: 5.0999999999999997e-002 | AP195: 41 | AQ195: 天创转债!
A196: 195 | B196: 123056 | C196: 雪榕转债! | D196: 300511 | E196: 雪榕生物 | F196: 农业 | G196: 种植业 | H196: 109.85 | I196: 4.4000000000000003e-003 | J196: -3.3e-003 | K196: 7.56 | L196: 5.3e-003 | M196: 120.7 | N196: 11.77 | O196: 0.70999999999999996 | P196: 64.23 | Q196: 已到 | R196: 4.50年 | S196: 2.50年 | T196: 5.84 | U196: 11 | V196: 1.8000000000000002e-002 | W196: 0.17499999999999999 | X196: 0.11199999999999999 | Y196: 33 | Z196: 1.87 | AA196: 2.1600000000000001e-002 | AB196: 1.3500000000000002e-002 | AC196: -2.1899999999999999e-002 | AD196: -2.4399999999999998e-002 | AE196: 88.69 | AF196: 93.12 | AG196: 0.2 | AH196: AA- | AI196: 6.08e-002 | AJ196: =H196+100*O196 -> 180.84999999999999 | AK196: 155.5 | AL196: 162 | AM196: 62.4 | AN196: 161 | AO196: 2.8999999999999998e-002 | AP196: 20 | AQ196: 雪榕转债!
A197: 196 | B197: 113588 | C197: 润达转债! | D197: 603108 | E197: 润达医疗 | F197: 医药 | G197: 医疗器械 | H197: 121.61 | I197: -3.5999999999999999e-003 | J197: -5.8999999999999999e-003 | K197: 11.89 | L197: -2.1400000000000002e-002 | M197: 113.9 | N197: 13.25 | O197: 0.35499999999999998 | P197: 89.74 | Q197: 已到 | R197: 4.48年 | S197: 2.48年 | T197: 5.5 | U197: 4.2 | V197: 6.0000000000000001e-003 | W197: 8.0000000000000002e-002 | X197: 7.2000000000000008e-002 | Y197: 69 | Z197: 2.09 | AA197: -1.4800000000000001e-002 | AB197: -2.0299999999999999e-002 | AC197: -5.9999999999999998e-002 | AD197: -6.2199999999999998e-002 | AE197: 93.36 | AF197: 95.99 | AG197: 0.45 | AH197: AA | AI197: 3.9800000000000002e-002 | AJ197: =H197+100*O197 -> 157.11000000000001 | AK197: 153.5 | AL197: 144 | AM197: 57.5 | AN197: 131 | AO197: -6.7000000000000004e-002 | AP197: 12 | AQ197: 润达转债!
A198: 197 | B198: 128114 | C198: 正邦转债! | D198: 2157 | E198: 正邦科技 | F198: 农业 | G198: 畜牧业 | H198: 108.41 | I198: 2.9999999999999997e-004 | J198: -1.e-003 | K198: 9.56 | L198: -4.1999999999999997e-003 | M198: 114.9 | N198: 14.77 | O198: 0.67500000000000004 | P198: 64.73 | Q198: 已到 | R198: 4.48年 | S198: 2.48年 | T198: 16 | U198: 13 | V198: 6.9999999999999993e-003 | W198: 5.2999999999999999e-002 | X198: 3.4000000000000002e-002 | Y198: 301 | Z198: 2.32 | AA198: 1.3300000000000001e-002 | AB198: 7.3000000000000001e-003 | AC198: -1.7899999999999999e-002 | AD198: -2.0299999999999999e-002 | AE198: 93.36 | AF198: 96.83 | AG198: 0.16 | AH198: AA | AI198: 3.9800000000000002e-002 | AJ198: =H198+100*O198 -> 175.91 | AK198: 152.1 | AL198: 134 | AM198: 55.3 | AN198: 113 | AO198: 0. | AP198: 24 | AQ198: 正邦转债!
A199: 198 | B199: 128113 | C199: 比音转债! | D199: 2832 | E199: 比音勒芬 | F199: 服装纺织 | G199: 服装行业 | H199: 178.702 | I199: -9.7999999999999997e-003 | J199: -1.1000000000000001e-003 | K199: 24.01 | L199: -1.1899999999999999e-002 | M199: 116.9 | N199: 14.6 | O199: 8.6999999999999994e-002 | P199: 164.45 | Q199: 已到 | R199: 4.47年 | S199: 2.47年 | T199: 2.98 | U199: 20 | V199: 3.7999999999999999e-002 | W199: 2.3e-002 | X199: 3.7000000000000005e-002 | Y199: 132 | Z199: 4.46 | AA199: -9.2100000000000015e-002 | AB199: -9.7799999999999998e-002 | AC199: -0.13 | AD199: -0.13100000000000001 | AE199: 93.38 | AF199: 98.53 | AG199: 0.92 | AH199: AA | AI199: 3.9800000000000002e-002 | AJ199: =H199+100*O199 -> 187.40199999999999 | AK199: 193 | AL199: 308 | AM199: 94.4 | AN199: 297 | AO199: 2.e-003 | AP199: 8 | AQ199: 比音转债!
A200: 199 | B200: 128111 | C200: 中矿转债! | D200: 2738 | E200: 中矿资源 | F200: 有色金属 | G200: 有色行业 | H200: 404.001 | I200: -4.1700000000000001e-002 | J200: -1.2699999999999999e-002 | K200: 57.9 | L200: -5.5300000000000002e-002 | M200: 124.2 | N200: 15.42 | O200: 7.5999999999999998e-002 | P200: 375.49 | Q200: 已到 | R200: 4.46年 | S200: 2.46年 | T200: 1.45 | U200: 288 | V200: 0.48499999999999999 | W200: 8.0000000000000002e-003 | X200: 2.8999999999999998e-002 | Y200: 188 | Z200: 5.03 | AA200: -0.23600000000000002 | AB200: -0.24199999999999999 | AC200: -0.23499999999999999 | AD200: -0.23600000000000002 | AE200: 89.32 | AF200: 96.06 | AG200: 0.98 | AH200: AA- | AI200: 6.08e-002 | AJ200: =H200+100*O200 -> 411.601 | AK200: 432.5 | AL200: 368 | AM200: 336.5 | AN200: 368 | AO200: -0.153 | AP200: 10 | AQ200: 中矿转债!
A201: 200 | B201: 123054 | C201: 思特转债!! | D201: 300608 | E201: 思特奇 | F201: 通信互联 | G201: 通信设备 | H201: 144 | I201: -1.23e-002 | J201: -1.9900000000000001e-002 | K201: 14.06 | L201: -4.87e-002 | M201: 121.2 | N201: 12.63 | O201: 0.29399999999999998 | P201: 111.32 | Q201: 已到 | R201: 4.46年 | S201: 2.46年 | T201: 2.07 | U201: 209 | V201: 0.69200000000000006 | W201: 7.0000000000000007e-002 | X201: 7.8e-002 | Y201: 30 | Z201: 3.54 | AA201: -3.8800000000000001e-002 | AB201: -4.6399999999999997e-002 | AC201: -0.11599999999999999 | AD201: -0.11900000000000001 | AE201: 89.34 | AF201: 93.77 | AG201: 0.66 | AH201: AA- | AI201: 6.08e-002 | AJ201: =H201+100*O201 -> 173.40000000000001 | AK201: 176.7 | AL201: 268 | AM201: 82.9 | AN201: 263 | AO201: -2.2000000000000002e-002 | AP201: 18 | AQ201: 思特转债!!
A202: 201 | B202: 113585 | C202: 寿仙转债! | D202: 603896 | E202: 寿仙谷 | F202: 医药 | G202: 中药 | H202: 208.95 | I202: 0. | J202: -1.8200000000000001e-002 | K202: 55 | L202: -1.9099999999999999e-002 | M202: 117.3 | N202: 28.38 | O202: 7.8e-002 | P202: 193.8 | Q202: 已到 | R202: 4.46年 | S202: 2.46年 | T202: 1.01 | U202: 401 | V202: 1.9099999999999999 | W202: 1.2e-002 | X202: 2.3e-002 | Y202: 84 | Z202: 5.65 | AA202: -0.124 | AB202: -0.129 | AC202: -0.158 | AD202: -0.159 | AE202: 88.93 | AF202: 90.73 | AG202: 0.96 | AH202: AA- | AI202: 6.08e-002 | AJ202: =H202+100*O202 -> 216.75 | AK202: 224.1 | AL202: 334 | AM202: 133.4 | AN202: 334 | AO202: 0.125 | AP202: 18 | AQ202: 寿仙转债!
A203: 202 | B203: 123053 | C203: 宝通转债!!* | D203: 300031 | E203: 宝通科技 | F203: 通信互联 | G203: 互联网 | H203: 143.25 | I203: 4.5599999999999995e-002 | J203: 1.2199999999999999e-002 | K203: 29.99 | L203: 5.7800000000000004e-002 | M203: 120.8 | N203: 20.73 | O203: -1.e-002 | P203: 144.67 | Q203: 已到 | R203: 6.1天 | S203: 无权 | T203: 2.67 | U203: 2819. | V203: 7.3200000000000003 | W203: 2.3e-002 | X203: 3.3000000000000002e-002 | Y203: 116 | Z203: 3.76 | AA203: <-100% | AB203: <-100% | AC203: 无权 | AD203: 无权 | AE203: 无权 | AF203: 100.36 | AG203: 1 | AH203: AA- | AI203: 5.7500000000000002e-002 | AJ203: =H203+100*O203 -> 142.25 | AK203: 141.8 | AL203: 39 | AM203: 41.5 | AN203: 30 | AO203: 0.10300000000000001 | AP203: 13 | AQ203: 宝通转债!!*
A204: 203 | B204: 123052 | C204: 飞鹿转债! | D204: 300665 | E204: 飞鹿股份 | F204: 化工 | G204: 化工 | H204: 144.669 | I204: -4.7599999999999996e-002 | J204: 2.2000000000000001e-003 | K204: 9.32 | L204: -6.0499999999999998e-002 | M204: 126.8 | N204: 7.05 | O204: 9.4e-002 | P204: 132.2 | Q204: 已到 | R204: 4.44年 | S204: 2.44年 | T204: 1.5 | U204: 75 | V204: 0.34100000000000003 | W204: 9.3000000000000013e-002 | X204: 0.12300000000000001 | Y204: 16 | Z204: 3.16 | AA204: -2.9900000000000003e-002 | AB204: -3.9399999999999998e-002 | AC204: -0.11699999999999999 | AD204: -0.11900000000000001 | AE204: 87.6 | AF204: 93.97 | AG204: 0.75 | AH204: A+ | AI204: 7.1800000000000003e-002 | AJ204: =H204+100*O204 -> 154.06900000000002 | AK204: 157.1 | AL204: 167 | AM204: 63.2 | AN204: 170 | AO204: -5.4000000000000006e-002 | AP204: 23 | AQ204: 飞鹿转债!
A205: 204 | B205: 113584 | C205: 家悦转债! | D205: 603708 | E205: 家家悦 | F205: 商业零售 | G205: 超市 | H205: 107.74 | I205: 6.5000000000000006e-003 | J205: -5.6000000000000008e-003 | K205: 15.83 | L205: 7.3899999999999993e-002 | M205: 114.9 | N205: 37.53 | O205: 1.55 | P205: 42.18 | Q205: 已到 | R205: 4.44年 | S205: 2.44年 | T205: 6.45 | U205: 56 | V205: 8.1000000000000003e-002 | W205: 6.7000000000000004e-002 | X205: 2.7999999999999997e-002 | Y205: 96 | Z205: 3.75 | AA205: 1.49e-002 | AB205: 8.6999999999999994e-003 | AC205: -1.5700000000000002e-002 | AD205: -1.8200000000000001e-002 | AE205: 93.48 | AF205: 96.96 | AG205: 0.01 | AH205: AA | AI205: 3.9800000000000002e-002 | AJ205: =H205+100*O205 -> 262.74000000000001 | AK205: 173.3 | AL205: 261 | AM205: 76.3 | AN205: 239 | AO205: 8.1000000000000003e-002 | AP205: 19 | AQ205: 家悦转债!
A206: 205 | B206: 128109 | C206: 楚江转债! | D206: 2171 | E206: 楚江新材 | F206: 有色金属 | G206: 铜金属 | H206: 166 | I206: -1.1899999999999999e-002 | J206: -3.7000000000000002e-003 | K206: 12.21 | L206: -1.8500000000000003e-002 | M206: 114.9 | N206: 8.63 | O206: 0.17300000000000001 | P206: 141.48 | Q206: 已到 | R206: 4.44年 | S206: 2.44年 | T206: 18.2 | U206: 87 | V206: 2.7999999999999997e-002 | W206: 0.11199999999999999 | X206: 0.158 | Y206: 163 | Z206: 2.78 | AA206: -8.09e-002 | AB206: -8.6099999999999996e-002 | AC206: -0.11699999999999999 | AD206: -0.11900000000000001 | AE206: 93.49 | AF206: 96.97 | AG206: 0.84 | AH206: AA | AI206: 3.9800000000000002e-002 | AJ206: =H206+100*O206 -> 183.30000000000001 | AK206: 190.5 | AL206: 301 | AM206: 93.6 | AN206: 296 | AO206: 3.4000000000000002e-002 | AP206: 6 | AQ206: 楚江转债!
A207: 206 | B207: 127017 | C207: 万青转债 | D207: 789 | E207: 万年青 | F207: 建筑 | G207: 水泥 | H207: 126.3 | I207: -5.4000000000000003e-003 | J207: -3.0000000000000001e-003 | K207: 12.15 | L207: -2.1700000000000001e-002 | M207: 118 | N207: 13.46 | O207: 0.39899999999999997 | P207: 90.27 | Q207: 已到 | R207: 4.44年 | S207: 2.44年 | T207: 10 | U207: 23 | V207: 1.8000000000000002e-002 | W207: 0.10300000000000001 | X207: 9.3000000000000013e-002 | Y207: 97 | Z207: 1.42 | AA207: -1.55e-002 | AB207: -2.2400000000000003e-002 | AC207: -7.4700000000000003e-002 | AD207: -7.690000000000001e-002 | AE207: 94.6 | AF207: 101.69 | AG207: 0.39 | AH207: AA+ | AI207: 3.4799999999999998e-002 | AJ207: =H207+100*O207 -> 166.19999999999999 | AK207: 162.3 | AL207: 202 | AM207: 60.6 | AN207: 150 | AO207: 1.3000000000000001e-002 | AP207: 7 | AQ207: 万青转债
A208: 207 | B208: 128108 | C208: 蓝帆转债!! | D208: 2382 | E208: 蓝帆医疗 | F208: 医药 | G208: 医疗器械 | H208: 115.299 | I208: -6.8999999999999999e-003 | J208: 7.1999999999999998e-003 | K208: 15.81 | L208: 5.9999999999999995e-004 | M208: 112.9 | N208: 18.24 | O208: 0.33000000000000002 | P208: 86.68 | Q208: 已到 | R208: 4.42年 | S208: 3.42年 | T208: 15.2 | U208: 34 | V208: 2.e-002 | W208: 9.6000000000000002e-002 | X208: 8.3000000000000004e-002 | Y208: 159 | Z208: 1.25 | AA208: -4.7999999999999996e-003 | AB208: -1.01e-002 | AC208: -2.5499999999999998e-002 | AD208: -2.8199999999999999e-002 | AE208: 91.69 | AF208: 95.36 | AG208: 0.42 | AH208: AA | AI208: 3.9800000000000002e-002 | AJ208: =H208+100*O208 -> 148.29900000000001 | AK208: 143.9 | AL208: 48 | AM208: 48.6 | AN208: 66 | AO208: -8.0000000000000002e-003 | AP208: 29 | AQ208: 蓝帆转债!!
A209: 208 | B209: 113582 | C209: 火炬转债! | D209: 603678 | E209: 火炬电子 | F209: 电子 | G209: 元器件制 | H209: 367.8 | I209: -1.8200000000000001e-002 | J209: 1.5600000000000001e-002 | K209: 74.21 | L209: -2.7000000000000001e-003 | M209: 114.9 | N209: 24.99 | O209: 0.23899999999999999 | P209: 296.96 | Q209: 已到 | R209: 4.42年 | S209: 2.42年 | T209: 4.18 | U209: 44 | V209: 2.7999999999999997e-002 | W209: 1.2e-002 | X209: 3.6000000000000004e-002 | Y209: 341 | Z209: 7.69 | AA209: -0.23399999999999999 | AB209: -0.23899999999999999 | AC209: -0.23199999999999998 | AD209: -0.23300000000000001 | AE209: 93.57 | AF209: 97.05 | AG209: 0.98 | AH209: AA | AI209: 3.9800000000000002e-002 | AJ209: =H209+100*O209 -> 391.69999999999999 | AK209: 438.6 | AL209: 369 | AM209: 341.6 | AN209: 369 | AO209: -4.0999999999999995e-002 | AP209: 5 | AQ209: 火炬转债!
A210: 209 | B210: 113579 | C210: 健友转债! | D210: 603707 | E210: 健友股份 | F210: 医药 | G210: 原料药 | H210: 138.17 | I210: -6.0000000000000001e-003 | J210: 2.3999999999999998e-003 | K210: 39.41 | L210: -4.7999999999999996e-003 | M210: 113.9 | N210: 32.2 | O210: 0.129 | P210: 122.39 | Q210: 已到 | R210: 4.33年 | S210: 2.33年 | T210: 5.03 | U210: 13 | V210: 1.9e-002 | W210: 1.e-002 | X210: 1.3000000000000001e-002 | Y210: 490 | Z210: 11.17 | AA210: -4.4500000000000005e-002 | AB210: -4.99e-002 | AC210: -0.11 | AD210: -0.11199999999999999 | AE210: 93.91 | AF210: 96.56 | AG210: 0.75 | AH210: AA | AI210: 3.9800000000000002e-002 | AJ210: =H210+100*O210 -> 151.06999999999999 | AK210: 153.9 | AL210: 148 | AM210: 57.4 | AN210: 130 | AO210: -3.4000000000000002e-002 | AP210: 10 | AQ210: 健友转债!
A211: 210 | B211: 128107 | C211: 交科转债 | D211: 2061 | E211: 浙江交科 | F211: 建筑 | G211: 建筑工程 | H211: 121.64 | I211: -6.4000000000000003e-003 | J211: -5.7999999999999996e-003 | K211: 5.46 | L211: -2.1499999999999998e-002 | M211: 114.9 | N211: 5.24 | O211: 0.16699999999999998 | P211: 104.2 | Q211: 已到 | R211: 4.32年 | S211: 2.32年 | T211: 25 | U211: 12 | V211: 4.0000000000000001e-003 | W211: 0.33299999999999996 | X211: 0.34700000000000003 | Y211: 75 | Z211: 0.84 | AA211: -1.34e-002 | AB211: -1.9400000000000001e-002 | AC211: -6.3700000000000007e-002 | AD211: -6.6100000000000006e-002 | AE211: 95.04 | AF211: 99.42 | AG211: 0.57 | AH211: AA+ | AI211: 3.4799999999999998e-002 | AJ211: =H211+100*O211 -> 138.34 | AK211: 139.1 | AL211: 30 | AM211: 39.7 | AN211: 21 | AO211: 3.0000000000000001e-003 | AP211: 21 | AQ211: 交科转债
A212: 211 | B212: 113578 | C212: 全筑转债! | D212: 603030 | E212: 全筑股份 | F212: 建筑 | G212: 装饰工程 | H212: 107.84 | I212: -8.3999999999999995e-003 | J212: 3.9000000000000003e-003 | K212: 3.58 | L212: -2.7200000000000002e-002 | M212: 117.9 | N212: 5.25 | O212: 0.58099999999999996 | P212: 68.19 | Q212: 已到 | R212: 4.32年 | S212: 2.32年 | T212: 3.84 | U212: 8.2 | V212: 2.e-002 | W212: 0.185 | X212: 0.126 | Y212: 21 | Z212: 0.95 | AA212: 2.1299999999999999e-002 | AB212: 1.38e-002 | AC212: -1.6899999999999998e-002 | AD212: -1.95e-002 | AE212: 93.94 | AF212: 99.97 | AG212: 0.17 | AH212: AA | AI212: 3.9800000000000002e-002 | AJ212: =H212+100*O212 -> 165.94 | AK212: 147.5 | AL212: 86 | AM212: 47.5 | AN212: 62 | AO212: 5.0000000000000001e-003 | AP212: 33 | AQ212: 全筑转债!
A213: 212 | B213: 113573 | C213: 纵横转债! | D213: 603602 | E213: 纵横通信 | F213: 通信互联 | G213: 通信设备 | H213: 111.78 | I213: -2.3999999999999998e-003 | J213: 2.0000000000000001e-004 | K213: 9.82 | L213: -2.3900000000000001e-002 | M213: 124.2 | N213: 18.78 | O213: 1.1399999999999999 | P213: 52.29 | Q213: 已到 | R213: 4.31年 | S213: 2.31年 | T213: 2.7 | U213: 8.7 | V213: 2.8999999999999998e-002 | W213: 0.13500000000000001 | X213: 7.0000000000000007e-002 | Y213: 20 | Z213: 2.81 | AA213: 2.5399999999999999e-002 | AB213: 1.5700000000000002e-002 | AC213: -2.86e-002 | AD213: -3.1600000000000003e-002 | AE213: 87.88 | AF213: 92.82 | AG213: 0.09 | AH213: A+ | AI213: 7.1800000000000003e-002 | AJ213: =H213+100*O213 -> 225.77999999999997 | AK213: 171.3 | AL213: 254 | AM213: 78.5 | AN213: 244 | AO213: -4.4000000000000004e-002 | AP213: 28 | AQ213: 纵横转债!
A214: 213 | B214: 113577 | C214: 春秋转债! | D214: 603890 | E214: 春秋电子 | F214: 电子 | G214: 电子产品 | H214: 137.82 | I214: -1.03e-002 | J214: -6.6e-003 | K214: 12.37 | L214: -2.4399999999999998e-002 | M214: 117.7 | N214: 10.85 | O214: 0.20899999999999999 | P214: 114.01 | Q214: 已到 | R214: 4.30年 | S214: 2.30年 | T214: 1.78 | U214: 14 | V214: 5.7000000000000002e-002 | W214: 3.3000000000000002e-002 | X214: 3.7000000000000005e-002 | Y214: 54 | Z214: 2.19 | AA214: -3.6799999999999999e-002 | AB214: -4.36e-002 | AC214: -0.109 | AD214: -0.11199999999999999 | AE214: 89.72 | AF214: 91.87 | AG214: 0.69 | AH214: AA- | AI214: 6.08e-002 | AJ214: =H214+100*O214 -> 158.72 | AK214: 161.6 | AL214: 198 | AM214: 69.8 | AN214: 203 | AO214: -5.4000000000000006e-002 | AP214: 15 | AQ214: 春秋转债!
A215: 214 | B215: 123050 | C215: 聚飞转债! | D215: 300303 | E215: 聚飞光电 | F215: 电子 | G215: LED制 | H215: 143.102 | I215: -1.6500000000000001e-002 | J215: -1.1999999999999999e-003 | K215: 6.08 | L215: -2.5600000000000001e-002 | M215: 123.8 | N215: 5.08 | O215: 0.19600000000000001 | P215: 119.69 | Q215: 已到 | R215: 4.30年 | S215: 2.30年 | T215: 3.75 | U215: 21 | V215: 3.9e-002 | W215: 4.5999999999999999e-002 | X215: 5.5e-002 | Y215: 82 | Z215: 2.94 | AA215: -3.3799999999999997e-002 | AB215: -4.2599999999999999e-002 | AC215: -0.12300000000000001 | AD215: -0.125 | AE215: 89.82 | AF215: 96.62 | AG215: 0.69 | AH215: AA- | AI215: 6.08e-002 | AJ215: =H215+100*O215 -> 162.702 | AK215: 166.5 | AL215: 232 | AM215: 69.9 | AN215: 205 | AO215: -2.7000000000000003e-002 | AP215: 12 | AQ215: 聚飞转债!
A216: 215 | B216: 123049 | C216: 维尔转债! | D216: 300190 | E216: 维尔利 | F216: 城市公用 | G216: 三废处理 | H216: 115.65 | I216: -6.0999999999999995e-003 | J216: 7.000000000000001e-004 | K216: 5.98 | L216: -1.4800000000000001e-002 | M216: 124.3 | N216: 7.38 | O216: 0.42700000000000005 | P216: 81.03 | Q216: 已到 | R216: 4.30年 | S216: 2.30年 | T216: 9.17 | U216: 1.6 | V216: 1.e-003 | W216: 0.19600000000000001 | X216: 0.159 | Y216: 47 | Z216: 1.07 | AA216: 1.7399999999999999e-002 | AB216: 7.7000000000000002e-003 | AC216: -4.1799999999999997e-002 | AD216: -4.4900000000000002e-002 | AE216: 90.28 | AF216: 97.08 | AG216: 0.37 | AH216: AA- | AI216: 6.08e-002 | AJ216: =H216+100*O216 -> 158.35000000000002 | AK216: 150.3 | AL216: 112 | AM216: 53.2 | AN216: 103 | AO216: 9.0000000000000011e-003 | AP216: 19 | AQ216: 维尔转债!
A217: 216 | B217: 110070 | C217: 凌钢转债! | D217: 600231 | E217: 凌钢股份 | F217: 钢铁 | G217: 炼钢 | H217: 124.26 | I217: -2.0199999999999999e-002 | J217: 7.0999999999999995e-003 | K217: 2.68 | L217: -2.5499999999999998e-002 | M217: 117.4 | N217: 2.69 | O217: 0.247 | P217: 99.63 | Q217: 已到 | R217: 4.30年 | S217: 2.30年 | T217: 2.17 | U217: 11 | V217: 3.9e-002 | W217: 2.7999999999999997e-002 | X217: 2.7999999999999997e-002 | Y217: 76 | Z217: 0.82 | AA217: -1.34e-002 | AB217: -2.0400000000000001e-002 | AC217: -7.1300000000000002e-002 | AD217: -7.3899999999999993e-002 | AE217: 94.32 | AF217: 99.66 | AG217: 0.51 | AH217: AA | AI217: 3.9800000000000002e-002 | AJ217: =H217+100*O217 -> 148.96000000000001 | AK217: 148.9 | AL217: 99 | AM217: 49.2 | AN217: 77 | AO217: 1.2e-002 | AP217: 22 | AQ217: 凌钢转债!
A218: 217 | B218: 128106 | C218: 华统转债! | D218: 2840 | E218: 华统股份 | F218: 农业 | G218: 农产品加 | H218: 153.055 | I218: 1.5600000000000001e-002 | J218: -1.11e-002 | K218: 14.15 | L218: 5.0000000000000001e-003 | M218: 112.9 | N218: 9.37 | O218: 1.3999999999999999e-002 | P218: 151.01 | Q218: 已到 | R218: 4.29年 | S218: 2.29年 | T218: 5.35 | U218: 222 | V218: 0.27300000000000002 | W218: 8.4000000000000005e-002 | X218: 0.128 | Y218: 63 | Z218: 3.75 | AA218: -6.9800000000000001e-002 | AB218: -7.46e-002 | AC218: -0.109 | AD218: -0.11 | AE218: 94.04 | AF218: 95.85 | AG218: 0.9 | AH218: AA | AI218: 3.9800000000000002e-002 | AJ218: =H218+100*O218 -> 154.45500000000001 | AK218: 155.1 | AL218: 159 | AM218: 59.2 | AN218: 145 | AO218: 0.121 | AP218: 12 | AQ218: 华统转债!
A219: 218 | B219: 123048 | C219: 应急转债! | D219: 300527 | E219: 中船应急 | F219: 机械装备 | G219: 专用设备 | H219: 136.99 | I219: -1.5600000000000001e-002 | J219: -4.1999999999999997e-003 | K219: 9.39 | L219: -3.3000000000000002e-002 | M219: 112.8 | N219: 8.88 | O219: 0.29499999999999998 | P219: 105.74 | Q219: 已到 | R219: 4.29年 | S219: 2.29年 | T219: 3.79 | U219: 51 | V219: 9.6999999999999989e-002 | W219: 4.2000000000000003e-002 | X219: 4.4000000000000004e-002 | Y219: 90 | Z219: 3.44 | AA219: -4.5100000000000001e-002 | AB219: -5.0099999999999999e-002 | AC219: -0.109 | AD219: -0.111 | AE219: 95.05 | AF219: 97.7 | AG219: 0.6 | AH219: AA+ | AI219: 3.4799999999999998e-002 | AJ219: =H219+100*O219 -> 166.49000000000001 | AK219: 168.2 | AL219: 240 | AM219: 70.5 | AN219: 211 | AO219: -6.2e-002 | AP219: 16 | AQ219: 应急转债!
A220: 219 | B220: 113576 | C220: 起步转债!! | D220: 603557 | E220: ST起步 | F220: 服装纺织 | G220: 鞋服行业 | H220: 131.31 | I220: -1.2500000000000001e-002 | J220: 4.5999999999999999e-003 | K220: 5.76 | L220: -4.7899999999999998e-002 | M220: 121.3 | N220: 10.55 | O220: 1.4099999999999999 | P220: 54.6 | Q220: 已到 | R220: 4.29年 | S220: 2.29年 | T220: 2.66 | U220: 132 | V220: 0.374 | W220: 9.3000000000000013e-002 | X220: 5.0999999999999997e-002 | Y220: 29 | Z220: 1.9 | AA220: -1.8799999999999997e-002 | AB220: -2.7000000000000003e-002 | AC220: -9.0700000000000003e-002 | AD220: -9.35e-002 | AE220: 82.39 | AF220: 80.96 | AG220: 0.16 | AH220: BBB+ | AI220: 0.1018 | AJ220: =H220+100*O220 -> 272.31 | AK220: 208 | AL220: 322 | AM220: 125.6 | AN220: 329 | AO220: -5.9000000000000004e-002 | AP220: 35 | AQ220: 起步转债!!
A221: 220 | B221: 113034 | C221: 滨化转债! | D221: 601678 | E221: 滨化股份 | F221: 化工 | G221: 化工 | H221: 180.34 | I221: -4.5100000000000001e-002 | J221: 1.1000000000000001e-003 | K221: 8.26 | L221: -4.4000000000000004e-002 | M221: 114.8 | N221: 4.58 | O221: 0. | P221: 180.35 | Q221: 已到 | R221: 4.29年 | S221: 2.29年 | T221: 4.26 | U221: 307 | V221: 0.39299999999999996 | W221: 2.6000000000000002e-002 | X221: 4.8000000000000001e-002 | Y221: 162 | Z221: 1.66 | AA221: -0.10199999999999999 | AB221: -0.107 | AC221: -0.14499999999999999 | AD221: -0.14599999999999999 | AE221: 93.94 | AF221: 97.44 | AG221: 1 | AH221: AA | AI221: 3.9800000000000002e-002 | AJ221: =H221+100*O221 -> 180.34 | AK221: 180.3 | AL221: 280 | AM221: 82.9 | AN221: 262 | AO221: -4.2999999999999997e-002 | AP221: 20 | AQ221: 滨化转债!
A222: 221 | B222: 128105 | C222: 长集转债! | D222: 2616 | E222: 长青集团 | F222: 城市公用 | G222: 三废处理 | H222: 110.999 | I222: -1.1899999999999999e-002 | J222: 4.8999999999999998e-003 | K222: 6.24 | L222: -2.35e-002 | M222: 114.9 | N222: 7.91 | O222: 0.40700000000000003 | P222: 78.89 | Q222: 已到 | R222: 4.29年 | S222: 2.29年 | T222: 8 | U222: 29 | V222: 3.2000000000000001e-002 | W222: 0.17300000000000001 | X222: 0.13600000000000001 | Y222: 46 | Z222: 1.85 | AA222: 8.3000000000000001e-003 | AB222: 2.e-003 | AC222: -2.87e-002 | AD222: -3.1300000000000001e-002 | AE222: 94.05 | AF222: 97.55 | AG222: 0.3 | AH222: AA | AI222: 3.9800000000000002e-002 | AJ222: =H222+100*O222 -> 151.69900000000001 | AK222: 143.1 | AL222: 46 | AM222: 45.6 | AN222: 51 | AO222: 6.0999999999999999e-002 | AP222: 21 | AQ222: 长集转债!
A223: 222 | B223: 113575 | C223: 东时转债!! | D223: 603377 | E223: 东方时尚 | F223: 其他 | G223: 其他 | H223: 128.18 | I223: -9.3999999999999986e-003 | J223: 2.e-003 | K223: 8.51 | L223: -3.73e-002 | M223: 113.1 | N223: 12.15 | O223: 0.82999999999999996 | P223: 70.04 | Q223: 已到 | R223: 4.29年 | S223: 2.29年 | T223: 0.98 | U223: 21 | V223: 0.16699999999999998 | W223: 1.6e-002 | X223: 1.1000000000000001e-002 | Y223: 62 | Z223: 2.86 | AA223: -2.9399999999999999e-002 | AB223: -3.4599999999999999e-002 | AC223: -8.4399999999999989e-002 | AD223: -8.6699999999999999e-002 | AE223: 94.08 | AF223: 96.03 | AG223: 0.2 | AH223: AA | AI223: 3.9800000000000002e-002 | AJ223: =H223+100*O223 -> 211.18000000000001 | AK223: 186.3 | AL223: 292 | AM223: 90.3 | AN223: 287 | AO223: -1.e-003 | AP223: 14 | AQ223: 东时转债!!
A224: 223 | B224: 127016 | C224: 鲁泰转债! | D224: 726 | E224: 鲁 泰Ａ | F224: 服装纺织 | G224: 纺织行业 | H224: 109.404 | I224: 1.9e-003 | J224: -7.0999999999999995e-003 | K224: 6.29 | L224: -2.9300000000000003e-002 | M224: 115.9 | N224: 8.71 | O224: 0.51500000000000001 | P224: 72.22 | Q224: 已到 | R224: 4.29年 | S224: 2.29年 | T224: 14 | U224: 14 | V224: 9.0000000000000011e-003 | W224: 0.252 | X224: 0.182 | Y224: 55 | Z224: 0.7 | AA224: 1.38e-002 | AB224: 7.0999999999999995e-003 | AC224: -2.29e-002 | AD224: -2.5499999999999998e-002 | AE224: 95.16 | AF224: 100.4 | AG224: 0.18 | AH224: AA+ | AI224: 3.4799999999999998e-002 | AJ224: =H224+100*O224 -> 160.904 | AK224: 146.6 | AL224: 74 | AM224: 46.2 | AN224: 54 | AO224: 3.3000000000000002e-002 | AP224: 22 | AQ224: 鲁泰转债!
A225: 224 | B225: 113033 | C225: 利群转债! | D225: 601366 | E225: 利群股份 | F225: 商业零售 | G225: 商场 | H225: 109.72 | I225: 4.1999999999999997e-003 | J225: -8.9999999999999998e-004 | K225: 6.17 | L225: 8.199999999999999e-003 | M225: 114.9 | N225: 7.01 | O225: 0.247 | P225: 88.02 | Q225: 已到 | R225: 4.27年 | S225: 2.27年 | T225: 18 | U225: 21 | V225: 1.1000000000000001e-002 | W225: 0.33899999999999997 | X225: 0.29799999999999999 | Y225: 53 | Z225: 1.21 | AA225: 1.11e-002 | AB225: 4.6999999999999993e-003 | AC225: -2.4300000000000002e-002 | AD225: -2.69e-002 | AE225: 94.13 | AF225: 97.63 | AG225: 0.41 | AH225: AA | AI225: 3.9800000000000002e-002 | AJ225: =H225+100*O225 -> 134.41999999999999 | AK225: 131.4 | AL225: 8 | AM225: 33.8 | AN225: 14 | AO225: 2.e-002 | AP225: 71 | AQ225: 利群转债!
A226: 225 | B226: 113574 | C226: 华体转债! | D226: 603679 | E226: 华体科技 | F226: 城市公用 | G226: 城市公用 | H226: 113.83 | I226: 8.0000000000000004e-004 | J226: -1.1000000000000001e-003 | K226: 12.99 | L226: -3.9900000000000005e-002 | M226: 115.9 | N226: 33.91 | O226: 1.97 | P226: 38.31 | Q226: 已到 | R226: 4.26年 | S226: 2.26年 | T226: 2.09 | U226: 2.9 | V226: 1.2e-002 | W226: 0.113 | X226: 4.2999999999999997e-002 | Y226: 18 | Z226: 2.46 | AA226: 4.3e-003 | AB226: -2.3e-003 | AC226: -3.6600000000000001e-002 | AD226: -3.9699999999999999e-002 | AE226: 88.12 | AF226: 86.93 | AG226: 0.01 | AH226: A+ | AI226: 7.1800000000000003e-002 | AJ226: =H226+100*O226 -> 310.82999999999998 | AK226: 189.4 | AL226: 297 | AM226: 101.2 | AN226: 309 | AO226: -6.4000000000000001e-002 | AP226: 21 | AQ226: 华体转债!
A227: 226 | B227: 128103 | C227: 同德转债! | D227: 2360 | E227: 同德化工 | F227: 化工 | G227: 化工 | H227: 190.7 | I227: -1.95e-002 | J227: 5.6999999999999993e-003 | K227: 9.29 | L227: -1.4800000000000001e-002 | M227: 121.3 | N227: 5.08 | O227: 4.2999999999999997e-002 | P227: 182.87 | Q227: 已到 | R227: 4.25年 | S227: 2.25年 | T227: 0.88 | U227: 73 | V227: 0.42999999999999999 | W227: 2.4e-002 | X227: 4.4000000000000004e-002 | Y227: 37 | Z227: 2.78 | AA227: -0.10300000000000001 | AB227: -0.11 | AC227: -0.158 | AD227: -0.16 | AE227: 88.32 | AF227: 91.05 | AG227: 0.93 | AH227: A+ | AI227: 7.1800000000000003e-002 | AJ227: =H227+100*O227 -> 195. | AK227: 198.5 | AL227: 314 | AM227: 107.5 | AN227: 314 | AO227: 2.1000000000000001e-002 | AP227: 17 | AQ227: 同德转债!
A228: 227 | B228: 110068 | C228: 龙净转债! | D228: 600388 | E228: 龙净环保 | F228: 城市公用 | G228: 三废处理 | H228: 109.83 | I228: -4.5999999999999999e-003 | J228: 1.e-004 | K228: 8.34 | L228: -1.6500000000000001e-002 | M228: 114.8 | N228: 10.55 | O228: 0.38900000000000001 | P228: 79.05 | Q228: 已到 | R228: 4.24年 | S228: 2.24年 | T228: 20 | U228: 8.1 | V228: 4.0000000000000001e-003 | W228: 0.22399999999999998 | X228: 0.17699999999999999 | Y228: 89 | Z228: 1.38 | AA228: 1.0700000000000001e-002 | AB228: 4.4000000000000003e-003 | AC228: -2.53e-002 | AD228: -2.7900000000000001e-002 | AE228: 95.2 | AF228: 99.59 | AG228: 0.27 | AH228: AA+ | AI228: 3.4799999999999998e-002 | AJ228: =H228+100*O228 -> 148.72999999999999 | AK228: 140.6 | AL228: 34 | AM228: 41 | AN228: 26 | AO228: -4.0000000000000001e-003 | AP228: 41 | AQ228: 龙净转债!
A229: 228 | B229: 123046 | C229: 天铁转债! | D229: 300587 | E229: 天铁股份 | F229: 铁路 | G229: 铁路设备 | H229: 325.899 | I229: -2.7200000000000002e-002 | J229: 6.0000000000000001e-003 | K229: 19.51 | L229: -2.1600000000000001e-002 | M229: 117.7 | N229: 6.73 | O229: 0.124 | P229: 289.9 | Q229: 已到 | R229: 4.23年 | S229: 2.23年 | T229: 0.62 | U229: 29 | V229: 0.14400000000000002 | W229: 5.0000000000000001e-003 | X229: 1.4999999999999999e-002 | Y229: 123 | Z229: 6.63 | AA229: -0.217 | AB229: -0.222 | AC229: -0.24299999999999999 | AD229: -0.24399999999999999 | AE229: 90.1 | AF229: 92.25 | AG229: 0.98 | AH229: AA- | AI229: 6.08e-002 | AJ229: =H229+100*O229 -> 338.29899999999998 | AK229: 361.9 | AL229: 362 | AM229: 269.6 | AN229: 363 | AO229: -4.8000000000000001e-002 | AP229: 13 | AQ229: 天铁转债!
A230: 229 | B230: 128101 | C230: 联创转债!! | D230: 2036 | E230: 联创电子 | F230: 电子 | G230: 液晶显示 | H230: 209.203 | I230: -1.78e-002 | J230: -6.0999999999999995e-003 | K230: 24.5 | L230: -2.5499999999999998e-002 | M230: 114.8 | N230: 13.72 | O230: 0.17199999999999999 | P230: 178.57 | Q230: 已到 | R230: 4.22年 | S230: 2.22年 | T230: 3 | U230: 442 | V230: 0.69700000000000006 | W230: 1.2e-002 | X230: 2.1000000000000001e-002 | Y230: 260 | Z230: 6.67 | AA230: -0.13500000000000001 | AB230: -0.14000000000000001 | AC230: -0.17999999999999999 | AD230: -0.18100000000000002 | AE230: 94.19 | AF230: 97.7 | AG230: 0.94 | AH230: AA | AI230: 3.9800000000000002e-002 | AJ230: =H230+100*O230 -> 226.40299999999999 | AK230: 239.8 | AL230: 341 | AM230: 142.1 | AN230: 340 | AO230: 0.122 | AP230: 13 | AQ230: 联创转债!!
A231: 230 | B231: 123045 | C231: 雷迪转债 | D231: 300652 | E231: 雷迪克 | F231: 汽车 | G231: 零部件制 | H231: 135.44 | I231: -1.7899999999999999e-002 | J231: -6.8000000000000005e-003 | K231: 21.84 | L231: -3.5799999999999998e-002 | M231: 118.9 | N231: 19.63 | O231: 0.217 | P231: 111.26 | Q231: 已到 | R231: 4.21年 | S231: 2.21年 | T231: 1.66 | U231: 60 | V231: 0.26500000000000001 | W231: 8.1000000000000003e-002 | X231: 8.9999999999999997e-002 | Y231: 21 | Z231: 2.16 | AA231: -3.1200000000000002e-002 | AB231: -3.8599999999999995e-002 | AC231: -0.105 | AD231: -0.10800000000000001 | AE231: 88.44 | AF231: 89.48 | AG231: 0.69 | AH231: A+ | AI231: 7.1800000000000003e-002 | AJ231: =H231+100*O231 -> 157.13999999999999 | AK231: 159.6 | AL231: 185 | AM231: 70.1 | AN231: 207 | AO231: -4.2999999999999997e-002 | AP231: 33 | AQ231: 雷迪转债
A232: 231 | B232: 128100 | C232: 搜特转债! | D232: 2503 | E232: 搜于特 | F232: 服装纺织 | G232: 服装行业 | H232: 108.857 | I232: -1.0700000000000001e-002 | J232: -1.6899999999999998e-002 | K232: 1.59 | L232: -4.2199999999999994e-002 | M232: 116.9 | N232: 1.62 | O232: 0.109 | P232: 98.15 | Q232: 已到 | R232: 4.21年 | S232: 2.21年 | T232: 7.99 | U232: 111 | V232: 0.127 | W232: 0.16300000000000001 | X232: 0.159 | Y232: 49 | Z232: 3.26 | AA232: 1.7399999999999999e-002 | AB232: 1.0200000000000001e-002 | AC232: -2.1600000000000001e-002 | AD232: -2.4300000000000002e-002 | AE232: 85.94 | AF232: 84.59 | AG232: 0.65 | AH232: A | AI232: 8.1799999999999998e-002 | AJ232: =H232+100*O232 -> 119.75700000000001 | AK232: 119.6 | AL232: 2 | AM232: 33.6 | AN232: 13 | AO232: 4.0000000000000001e-003 | AP232: 89 | AQ232: 搜特转债!
A233: 232 | B233: 123044 | C233: 红相转债!! | D233: 300427 | E233: 红相股份 | F233: 能源电力 | G233: 电力设备 | H233: 115.734 | I233: -9.1000000000000004e-003 | J233: -1.9e-003 | K233: 12.82 | L233: -4.9000000000000002e-002 | M233: 125 | N233: 18.67 | O233: 0.68500000000000005 | P233: 68.67 | Q233: 已到 | R233: 4.21年 | S233: 2.21年 | T233: 5.5 | U233: 8.7 | V233: 1.3999999999999999e-002 | W233: 0.11900000000000001 | X233: 8.199999999999999e-002 | Y233: 46 | Z233: 1.96 | AA233: 1.9e-002 | AB233: 8.8000000000000005e-003 | AC233: -4.2500000000000003e-002 | AD233: -4.5899999999999996e-002 | AE233: 91.01 | AF233: 98.19 | AG233: 0.22 | AH233: AA- | AI233: 6.08e-002 | AJ233: =H233+100*O233 -> 184.23399999999998 | AK233: 162.8 | AL233: 208 | AM233: 64.6 | AN233: 181 | AO233: -7.5999999999999998e-002 | AP233: 22 | AQ233: 红相转债!!
A234: 233 | B234: 110067 | C234: 华安转债! | D234: 600909 | E234: 华安证券 | F234: 金融 | G234: 证券行业 | H234: 115.83 | I234: -1.e-003 | J234: -1.8e-003 | K234: 5.31 | L234: -7.4999999999999997e-003 | M234: 110.3 | N234: 6.22 | O234: 0.35700000000000004 | P234: 85.37 | Q234: 已到 | R234: 4.21年 | S234: 无权 | T234: 28 | U234: 3.1 | V234: 1.e-003 | W234: 0.11199999999999999 | X234: 9.6000000000000002e-002 | Y234: 249 | Z234: 1.34 | AA234: -1.1699999999999999e-002 | AB234: -1.61e-002 | AC234: 无权 | AD234: 无权 | AE234: 无权 | AF234: 96.47 | AG234: 0.38 | AH234: AAA | AI234: 3.2799999999999996e-002 | AJ234: =H234+100*O234 -> 151.53 | AK234: 146.3 | AL234: 71 | AM234: 49.8 | AN234: 82 | AO234: 1.1000000000000001e-002 | AP234: 25 | AQ234: 华安转债!
A235: 234 | B235: 113570 | C235: 百达转债! | D235: 603331 | E235: 百达精工 | F235: 机械装备 | G235: 机械装备 | H235: 126.04 | I235: -1.8000000000000002e-002 | J235: -3.0800000000000001e-002 | K235: 12.26 | L235: -6.9099999999999995e-002 | M235: 114.9 | N235: 11.34 | O235: 0.16600000000000001 | P235: 108.11 | Q235: 已到 | R235: 4.21年 | S235: 2.21年 | T235: 2.8 | U235: 83 | V235: 0.23600000000000002 | W235: 0.128 | X235: 0.13900000000000001 | Y235: 22 | Z235: 2.69 | AA235: -2.2200000000000001e-002 | AB235: -2.8300000000000002e-002 | AC235: -8.0700000000000008e-002 | AD235: -8.3100000000000007e-002 | AE235: 87.86 | AF235: 86.4 | AG235: 0.71 | AH235: A+ | AI235: 7.1800000000000003e-002 | AJ235: =H235+100*O235 -> 142.64000000000001 | AK235: 144 | AL235: 50 | AM235: 56.1 | AN235: 120 | AO235: -0.115 | AP235: 31 | AQ235: 百达转债!
A236: 235 | B236: 113569 | C236: 科达转债! | D236: 603660 | E236: 苏州科达 | F236: 通信互联 | G236: 物联网 | H236: 105.38 | I236: -2.9999999999999997e-004 | J236: -2.0000000000000001e-004 | K236: 6.63 | L236: -1.34e-002 | M236: 120.3 | N236: 14.8 | O236: 1.3500000000000001 | P236: 44.8 | Q236: 已到 | R236: 4.20年 | S236: 2.20年 | T236: 5.16 | U236: 8.5 | V236: 1.6e-002 | W236: 0.157 | X236: 7.0999999999999994e-002 | Y236: 33 | Z236: 1.94 | AA236: 3.2799999999999996e-002 | AB236: 2.41e-002 | AC236: -7.0999999999999995e-003 | AD236: -1.e-002 | AE236: 90.27 | AF236: 94.43 | AG236: 0.04 | AH236: AA- | AI236: 6.08e-002 | AJ236: =H236+100*O236 -> 240.38 | AK236: 166 | AL236: 228 | AM236: 71.5 | AN236: 218 | AO236: 1.3999999999999999e-002 | AP236: 38 | AQ236: 科达转债!
A237: 236 | B237: 113568 | C237: 新春转债!! | D237: 603667 | E237: 五洲新春 | F237: 机械装备 | G237: 通用设备 | H237: 222.81 | I237: -1.6899999999999998e-002 | J237: -4.07e-002 | K237: 16.76 | L237: -6.1600000000000002e-002 | M237: 124.3 | N237: 8.75 | O237: 0.16300000000000001 | P237: 191.54 | Q237: 已到 | R237: 4.19年 | S237: 2.19年 | T237: 2.44 | U237: 344 | V237: 0.61699999999999999 | W237: 4.8000000000000001e-002 | X237: 9.1999999999999998e-002 | Y237: 50 | Z237: 2.68 | AA237: -0.13200000000000001 | AB237: -0.14000000000000001 | AC237: -0.193 | AD237: -0.19399999999999998 | AE237: 90.83 | AF237: 97.68 | AG237: 0.93 | AH237: AA- | AI237: 6.08e-002 | AJ237: =H237+100*O237 -> 239.11000000000001 | AK237: 254.1 | AL237: 344 | AM237: 156.4 | AN237: 344 | AO237: -4.0999999999999995e-002 | AP237: 36 | AQ237: 新春转债!!
A238: 237 | B238: 123043 | C238: 正元转债! | D238: 300645 | E238: 正元智慧 | F238: 计算机及 | G238: 软件开发 | H238: 182.85 | I238: -2.3300000000000001e-002 | J238: 8.3000000000000001e-003 | K238: 21.85 | L238: -1.8000000000000002e-002 | M238: 120.9 | N238: 15.38 | O238: 0.28699999999999998 | P238: 142.07 | Q238: 已到 | R238: 4.19年 | S238: 2.19年 | T238: 1.66 | U238: 281 | V238: 0.91500000000000004 | W238: 5.9000000000000004e-002 | X238: 8.4000000000000005e-002 | Y238: 28 | Z238: 4.21 | AA238: -9.5899999999999999e-002 | AB238: -0.10300000000000001 | AC238: -0.155 | AD238: -0.157 | AE238: 88.55 | AF238: 91.1 | AG238: 0.83 | AH238: A+ | AI238: 7.1800000000000003e-002 | AJ238: =H238+100*O238 -> 211.54999999999998 | AK238: 223.6 | AL238: 333 | AM238: 132.5 | AN238: 332 | AO238: -0.10199999999999999 | AP238: 17 | AQ238: 正元转债!
A239: 238 | B239: 113567 | C239: 君禾转债! | D239: 603617 | E239: 君禾股份 | F239: 机械装备 | G239: 通用设备 | H239: 127.65 | I239: -1.2800000000000001e-002 | J239: -6.5000000000000006e-003 | K239: 12.37 | L239: -2.6800000000000001e-002 | M239: 118.8 | N239: 10.58 | O239: 9.1999999999999998e-002 | P239: 116.92 | Q239: 已到 | R239: 4.19年 | S239: 2.19年 | T239: 2.1 | U239: 37 | V239: 0.13699999999999998 | W239: 6.5000000000000002e-002 | X239: 7.6999999999999999e-002 | Y239: 32 | Z239: 3.51 | AA239: -1.7399999999999999e-002 | AB239: -2.5000000000000001e-002 | AC239: -8.4399999999999989e-002 | AD239: -8.7100000000000011e-002 | AE239: 88.5 | AF239: 89.55 | AG239: 0.72 | AH239: A+ | AI239: 7.1800000000000003e-002 | AJ239: =H239+100*O239 -> 136.84999999999999 | AK239: 138.4 | AL239: 25 | AM239: 48.8 | AN239: 71 | AO239: -6.6000000000000003e-002 | AP239: 33 | AQ239: 君禾转债!
A240: 239 | B240: 110066 | C240: 盛屯转债!! | D240: 600711 | E240: 盛屯矿业 | F240: 有色金属 | G240: 有色行业 | H240: 243.75 | I240: -5.04e-002 | J240: 7.000000000000001e-004 | K240: 10.56 | L240: -5.1200000000000002e-002 | M240: 114.9 | N240: 4.87 | O240: 0.124 | P240: 216.84 | Q240: 已到 | R240: 4.18年 | S240: 2.18年 | T240: 3.83 | U240: 132 | V240: 0.13900000000000001 | W240: 1.3000000000000001e-002 | X240: 2.8999999999999998e-002 | Y240: 290 | Z240: 2.35 | AA240: -0.16699999999999998 | AB240: -0.17199999999999999 | AC240: -0.20999999999999999 | AD240: -0.21100000000000002 | AE240: 94.43 | AF240: 97.95 | AG240: 0.97 | AH240: AA | AI240: 3.9800000000000002e-002 | AJ240: =H240+100*O240 -> 256.14999999999998 | AK240: 270.7 | AL240: 349 | AM240: 172.7 | AN240: 350 | AO240: -8.0000000000000002e-002 | AP240: 27 | AQ240: 盛屯转债!!
A241: 240 | B241: 113566 | C241: 翔港转债! | D241: 603499 | E241: 翔港科技 | F241: 造纸包装 | G241: 包装材料 | H241: 117.38 | I241: -1.9e-003 | J241: -2.8999999999999998e-003 | K241: 8.91 | L241: -1.11e-002 | M241: 124 | N241: 10.77 | O241: 0.41899999999999998 | P241: 82.73 | Q241: 已到 | R241: 4.18年 | S241: 2.18年 | T241: 1.61 | U241: 13 | V241: 6.7000000000000004e-002 | W241: 8.9999999999999997e-002 | X241: 7.400000000000001e-002 | Y241: 18 | Z241: 3.16 | AA241: 1.3600000000000001e-002 | AB241: 3.8e-003 | AC241: -5.0300000000000004e-002 | AD241: -5.3499999999999999e-002 | AE241: 88.75 | AF241: 93.53 | AG241: 0.43 | AH241: A+ | AI241: 7.1800000000000003e-002 | AJ241: =H241+100*O241 -> 159.28 | AK241: 152 | AL241: 133 | AM241: 58.5 | AN241: 140 | AO241: 2.3e-002 | AP241: 28 | AQ241: 翔港转债!
A242: 241 | B242: 113565 | C242: 宏辉转债 | D242: 603336 | E242: 宏辉果蔬 | F242: 农业 | G242: 农产品加 | H242: 126.58 | I242: 1.0800000000000001e-002 | J242: 4.8999999999999998e-003 | K242: 8.27 | L242: 2.35e-002 | M242: 117.8 | N242: 7.64 | O242: 0.16899999999999998 | P242: 108.25 | Q242: 已到 | R242: 4.17年 | S242: 2.17年 | T242: 2.25 | U242: 153 | V242: 0.53799999999999992 | W242: 6.2e-002 | X242: 6.7000000000000004e-002 | Y242: 36 | Z242: 3.49 | AA242: -1.7500000000000002e-002 | AB242: -2.4700000000000003e-002 | AC242: -8.2599999999999993e-002 | AD242: -8.5199999999999998e-002 | AE242: 90.51 | AF242: 92.67 | AG242: 0.67 | AH242: AA- | AI242: 6.08e-002 | AJ242: =H242+100*O242 -> 143.47999999999999 | AK242: 144.9 | AL242: 60 | AM242: 52.2 | AN242: 99 | AO242: 3.2000000000000001e-002 | AP242: 27 | AQ242: 宏辉转债
A243: 242 | B243: 128097 | C243: 奥佳转债!! | D243: 2614 | E243: 奥佳华 | F243: 机械装备 | G243: 专用设备 | H243: 139.4 | I243: -4.3e-003 | J243: -4.6999999999999993e-003 | K243: 11.77 | L243: -1.26e-002 | M243: 114.9 | N243: 10.39 | O243: 0.23100000000000001 | P243: 113.28 | Q243: 已到 | R243: 4.17年 | S243: 2.17年 | T243: 4.59 | U243: 5.6 | V243: 9.0000000000000011e-003 | W243: 6.2e-002 | X243: 7.0000000000000007e-002 | Y243: 74 | Z243: 1.58 | AA243: -4.6199999999999998e-002 | AB243: -5.21e-002 | AC243: -0.121 | AD243: -0.12300000000000001 | AE243: 90.22 | AF243: 90.34 | AG243: 0.71 | AH243: AA- | AI243: 6.08e-002 | AJ243: =H243+100*O243 -> 162.5 | AK243: 165.5 | AL243: 222 | AM243: 75.2 | AN243: 233 | AO243: -2.7999999999999997e-002 | AP243: 16 | AQ243: 奥佳转债!!
A244: 243 | B244: 128095 | C244: 恩捷转债!! | D244: 2812 | E244: 恩捷股份 | F244: 电子 | G244: 元器件制 | H244: 435.5 | I244: 2.3e-003 | J244: -1.7600000000000001e-002 | K244: 235.95 | L244: -1.55e-002 | M244: 114.9 | N244: 64.92 | O244: 0.19800000000000001 | P244: 363.45 | Q244: 已到 | R244: 4年48天 | S244: 2年48天 | T244: 4.54 | U244: 126 | V244: 6.5000000000000002e-002 | W244: 2.e-003 | X244: 8.0000000000000002e-003 | Y244: 2106. | Z244: 16.43 | AA244: -0.27899999999999997 | AB244: -0.28300000000000003 | AC244: -0.28800000000000003 | AD244: -0.28800000000000003 | AE244: 94.63 | AF244: 98.14 | AG244: 0.99 | AH244: AA | AI244: 3.9800000000000002e-002 | AJ244: =H244+100*O244 -> 455.30000000000001 | AK244: 507.6 | AL244: 375 | AM244: 409.4 | AN244: 375 | AO244: -6.5000000000000002e-002 | AP244: 12 | AQ244: 恩捷转债!!
A245: 244 | B245: 128096 | C245: 奥瑞转债!! | D245: 2701 | E245: 奥瑞金 | F245: 造纸包装 | G245: 包装材料 | H245: 166.35 | I245: 3.32e-002 | J245: -1.8500000000000003e-002 | K245: 6.64 | L245: 1.6799999999999999e-002 | M245: 115.5 | N245: 4.5 | O245: 0.127 | P245: 147.56 | Q245: 已到 | R245: 4年48天 | S245: 2年48天 | T245: 5.66 | U245: 200 | V245: 0.21299999999999999 | W245: 3.5000000000000003e-002 | X245: 5.2000000000000005e-002 | Y245: 162 | Z245: 2.24 | AA245: -8.6300000000000002e-002 | AB245: -9.2100000000000015e-002 | AC245: -0.14000000000000001 | AD245: -0.14099999999999999 | AE245: 96.09 | AF245: 100.64 | AG245: 0.87 | AH245: AA+ | AI245: 3.4799999999999998e-002 | AJ245: =H245+100*O245 -> 179.04999999999998 | AK245: 185.1 | AL245: 291 | AM245: 84.5 | AN245: 269 | AO245: -9.0000000000000011e-003 | AP245: 16 | AQ245: 奥瑞转债!!
A246: 245 | B246: 113563 | C246: 柳药转债! | D246: 603368 | E246: 柳药股份 | F246: 医药 | G246: 医药商业 | H246: 108.08 | I246: -7.3000000000000001e-003 | J246: 9.1999999999999998e-003 | K246: 16.26 | L246: 1.1200000000000002e-002 | M246: 112.9 | N246: 23.87 | O246: 0.58700000000000008 | P246: 68.12 | Q246: 已到 | R246: 4年22天 | S246: 2年22天 | T246: 8.02 | U246: 14 | V246: 1.6e-002 | W246: 0.13600000000000001 | X246: 9.3000000000000013e-002 | Y246: 59 | Z246: 1.13 | AA246: 1.11e-002 | AB246: 5.1999999999999998e-003 | AC246: -1.9900000000000001e-002 | AD246: -2.2799999999999997e-002 | AE246: 94.89 | AF246: 96.71 | AG246: 0.17 | AH246: AA | AI246: 3.9800000000000002e-002 | AJ246: =H246+100*O246 -> 166.78 | AK246: 148 | AL246: 91 | AM246: 51.3 | AN246: 94 | AO246: 1.4999999999999999e-002 | AP246: 18 | AQ246: 柳药转债!
A247: 246 | B247: 128094 | C247: 星帅转债! | D247: 2860 | E247: 星帅尔 | F247: 家电 | G247: 零部件制 | H247: 175.38 | I247: -2.4500000000000001e-002 | J247: -8.199999999999999e-003 | K247: 23.33 | L247: -3.6000000000000004e-002 | M247: 121 | N247: 13.8 | O247: 3.7000000000000005e-002 | P247: 169.06 | Q247: 已到 | R247: 4年22天 | S247: 2年22天 | T247: 2.09 | U247: 116 | V247: 0.313 | W247: 4.4000000000000004e-002 | X247: 7.400000000000001e-002 | Y247: 47 | Z247: 4.13 | AA247: -8.929999999999999e-002 | AB247: -9.6999999999999989e-002 | AC247: -0.158 | AD247: -0.16 | AE247: 89.39 | AF247: 92.01 | AG247: 0.91 | AH247: A+ | AI247: 7.1800000000000003e-002 | AJ247: =H247+100*O247 -> 179.07999999999998 | AK247: 181.7 | AL247: 284 | AM247: 89.7 | AN247: 285 | AO247: -8.3000000000000004e-002 | AP247: 29 | AQ247: 星帅转债!
A248: 247 | B248: 123042 | C248: 银河转债!! | D248: 300619 | E248: 金银河 | F248: 机械装备 | G248: 专用设备 | H248: 416.9 | I248: 1.03e-002 | J248: -7.3000000000000001e-003 | K248: 83.65 | L248: 3.0000000000000001e-003 | M248: 115.4 | N248: 23.59 | O248: 0.17600000000000002 | P248: 354.6 | Q248: 已到 | R248: 4年20天 | S248: 2年20天 | T248: 0.98 | U248: 1867. | V248: 4.5 | W248: 1.3999999999999999e-002 | X248: 4.9000000000000002e-002 | Y248: 71 | Z248: 11.78 | AA248: -0.27500000000000002 | AB248: -0.28000000000000003 | AC248: -0.29600000000000004 | AD248: -0.29699999999999999 | AE248: 89.13 | AF248: 87.78 | AG248: 0.98 | AH248: A+ | AI248: 7.1800000000000003e-002 | AJ248: =H248+100*O248 -> 434.5 | AK248: 479.2 | AL248: 372 | AM248: 390.1 | AN248: 372 | AO248: -8.5000000000000006e-002 | AP248: 21 | AQ248: 银河转债!!
A249: 248 | B249: 127015 | C249: 希望转债!! | D249: 876 | E249: 新 希 望 | F249: 农业 | G249: 畜牧业 | H249: 119.233 | I249: 5.1999999999999998e-003 | J249: -5.3e-003 | K249: 15.01 | L249: -7.000000000000001e-004 | M249: 110 | N249: 19.75 | O249: 0.56899999999999995 | P249: 76 | Q249: 已到 | R249: 4年9天 | S249: 2年9天 | T249: 9.5 | U249: 10 | V249: 9.0000000000000011e-003 | W249: 1.3999999999999999e-002 | X249: 1.1000000000000001e-002 | Y249: 676 | Z249: 2.21 | AA249: -2.0199999999999999e-002 | AB249: -2.46e-002 | AC249: -6.6500000000000004e-002 | AD249: -6.8600000000000008e-002 | AE249: 95.72 | AF249: 96.84 | AG249: 0.24 | AH249: AAA | AI249: 3.2799999999999996e-002 | AJ249: =H249+100*O249 -> 176.13299999999998 | AK249: 162.5 | AL249: 206 | AM249: 65.6 | AN249: 184 | AO249: 3.4000000000000002e-002 | AP249: 26 | AQ249: 希望转债!!
A250: 249 | B250: 128093 | C250: 百川转债!! | D250: 2455 | E250: 百川股份 | F250: 化工 | G250: 化工 | H250: 246.2 | I250: -7.5499999999999998e-002 | J250: 1.1599999999999999e-002 | K250: 13.16 | L250: -6.7299999999999999e-002 | M250: 129.8 | N250: 5.77 | O250: 7.9000000000000001e-002 | P250: 228.08 | Q250: 已到 | R250: 4年9天 | S250: 2年9天 | T250: 1.62 | U250: 160 | V250: 0.39100000000000001 | W250: 2.2000000000000002e-002 | X250: 4.9000000000000002e-002 | Y250: 74 | Z250: 4.21 | AA250: -0.152 | AB250: -0.161 | AC250: -0.22699999999999998 | AD250: -0.22899999999999998 | AE250: 94.19 | AF250: 103.37 | AG250: 0.95 | AH250: AA- | AI250: 6.08e-002 | AJ250: =H250+100*O250 -> 254.09999999999999 | AK250: 264.3 | AL250: 346 | AM250: 161 | AN250: 346 | AO250: -0.154 | AP250: 38 | AQ250: 百川转债!!
A251: 250 | B251: 113561 | C251: 正裕转债! | D251: 603089 | E251: 正裕工业 | F251: 汽车 | G251: 零部件制 | H251: 121.86 | I251: -1.44e-002 | J251: -8.3999999999999995e-003 | K251: 9.28 | L251: -4.1299999999999996e-002 | M251: 118 | N251: 10.08 | O251: 0.32400000000000001 | P251: 92.06 | Q251: 已到 | R251: 4年6.1天 | S251: 2年6.1天 | T251: 1.5 | U251: 12 | V251: 6.5000000000000002e-002 | W251: 7.2999999999999995e-002 | X251: 6.7000000000000004e-002 | Y251: 21 | Z251: 1.99 | AA251: -8.199999999999999e-003 | AB251: -1.5900000000000001e-002 | AC251: -7.0300000000000001e-002 | AD251: -7.3599999999999999e-002 | AE251: 89.75 | AF251: 90.04 | AG251: 0.55 | AH251: A+ | AI251: 7.1800000000000003e-002 | AJ251: =H251+100*O251 -> 154.25999999999999 | AK251: 151.7 | AL251: 128 | AM251: 61.6 | AN251: 157 | AO251: -1.6e-002 | AP251: 35 | AQ251: 正裕转债!
A252: 251 | B252: 128091 | C252: 新天转债 | D252: 2873 | E252: 新天药业 | F252: 医药 | G252: 中药 | H252: 177.6 | I252: 0.13400000000000001 | J252: -4.2199999999999994e-002 | K252: 19.01 | L252: 0.10000000000000001 | M252: 119.4 | N252: 11.62 | O252: 8.5999999999999993e-002 | P252: 163.6 | Q252: 已到 | R252: 4年5.1天 | S252: 2年5.1天 | T252: 1.76 | U252: 5086. | V252: 16.199999999999999 | W252: 5.5999999999999994e-002 | X252: 9.1999999999999998e-002 | Y252: 31 | Z252: 2.56 | AA252: -9.6500000000000002e-002 | AB252: -0.10400000000000001 | AC252: -0.16500000000000001 | AD252: -0.16699999999999998 | AE252: 90.05 | AF252: 91.17 | AG252: 0.91 | AH252: A+ | AI252: 7.1800000000000003e-002 | AJ252: =H252+100*O252 -> 186.19999999999999 | AK252: 191.6 | AL252: 304 | AM252: 100.4 | AN252: 306 | AO252: 0.29499999999999998 | AP252: 21 | AQ252: 新天转债
A253: 252 | B253: 128090 | C253: 汽模转2 | D253: 2510 | E253: 天汽模 | F253: 汽车 | G253: 零部件制 | H253: 130.4 | I253: -2.3199999999999998e-002 | J253: -4.5000000000000005e-003 | K253: 4.53 | L253: -4.2300000000000004e-002 | M253: 114.9 | N253: 4.23 | O253: 0.218 | P253: 107.09 | Q253: 已到 | R253: 4年2.1天 | S253: 2年2.1天 | T253: 3.1 | U253: 68 | V253: 0.16699999999999998 | W253: 7.2999999999999995e-002 | X253: 7.8e-002 | Y253: 43 | Z253: 2.09 | AA253: -3.1800000000000002e-002 | AB253: -3.8100000000000002e-002 | AC253: -0.10199999999999999 | AD253: -0.105 | AE253: 91.1 | AF253: 91.22 | AG253: 0.66 | AH253: AA- | AI253: 6.08e-002 | AJ253: =H253+100*O253 -> 152.20000000000002 | AK253: 153.7 | AL253: 145 | AM253: 62.5 | AN253: 163 | AO253: -6.0000000000000001e-003 | AP253: 28 | AQ253: 汽模转2
A254: 253 | B254: 123039 | C254: 开润转债! | D254: 300577 | E254: 开润股份 | F254: 服装纺织 | G254: 纺织行业 | H254: 116.21 | I254: -3.3e-003 | J254: -6.5000000000000006e-003 | K254: 20.64 | L254: -3.73e-002 | M254: 121 | N254: 29.92 | O254: 0.68500000000000005 | P254: 68.98 | Q254: 已到 | R254: 4年1.1天 | S254: 2年1.1天 | T254: 2.22 | U254: 3.8 | V254: 1.4999999999999999e-002 | W254: 4.4999999999999998e-002 | X254: 3.1e-002 | Y254: 49 | Z254: 3.07 | AA254: 1.04e-002 | AB254: 1.2999999999999999e-003 | AC254: -5.0199999999999995e-002 | AD254: -5.3499999999999999e-002 | AE254: 89.75 | AF254: 92.38 | AG254: 0.26 | AH254: A+ | AI254: 7.1800000000000003e-002 | AJ254: =H254+100*O254 -> 184.70999999999998 | AK254: 163.4 | AL254: 213 | AM254: 71.1 | AN254: 213 | AO254: -6.5000000000000002e-002 | AP254: 22 | AQ254: 开润转债!
A255: 254 | B255: 123038 | C255: 联得转债! | D255: 300545 | E255: 联得装备 | F255: 机械装备 | G255: 专用设备 | H255: 135.501 | I255: -6.7000000000000002e-003 | J255: -1.5100000000000001e-002 | K255: 23.08 | L255: -3.7900000000000003e-002 | M255: 118.6 | N255: 24.07 | O255: 0.41299999999999998 | P255: 95.89 | Q255: 已到 | R255: 4年0.1天 | S255: 2年0.1天 | T255: 1.47 | U255: 52 | V255: 0.26100000000000001 | W255: 3.6000000000000004e-002 | X255: 3.4000000000000002e-002 | Y255: 41 | Z255: 2.96 | AA255: -3.3500000000000002e-002 | AB255: -4.1200000000000001e-002 | AC255: -0.11699999999999999 | AD255: -0.11900000000000001 | AE255: 89.56 | AF255: 90.54 | AG255: 0.58 | AH255: A+ | AI255: 7.1800000000000003e-002 | AJ255: =H255+100*O255 -> 176.80099999999999 | AK255: 175.1 | AL255: 264 | AM255: 84.6 | AN255: 270 | AO255: -7.2999999999999995e-002 | AP255: 18 | AQ255: 联得转债!
A256: 255 | B256: 113030 | C256: 东风转债! | D256: 601515 | E256: 东风股份 | F256: 造纸包装 | G256: 包装材料 | H256: 144.35 | I256: -1.8799999999999997e-002 | J256: 8.9999999999999998e-004 | K256: 7.52 | L256: -2.5899999999999999e-002 | M256: 116.9 | N256: 6.4 | O256: 0.22899999999999998 | P256: 117.5 | Q256: 已到 | R256: 3.997年 | S256: 1.997年 | T256: 2.95 | U256: 34 | V256: 8.0000000000000002e-002 | W256: 2.6000000000000002e-002 | X256: 2.9999999999999999e-002 | Y256: 115 | Z256: 2.22 | AA256: -5.3399999999999996e-002 | AB256: -6.0100000000000001e-002 | AC256: -0.114 | AD256: -0.11599999999999999 | AE256: 94.53 | AF256: 99.77 | AG256: 0.69 | AH256: AA | AI256: 3.9800000000000002e-002 | AJ256: =H256+100*O256 -> 167.25 | AK256: 171.2 | AL256: 252 | AM256: 71.4 | AN256: 217 | AO256: -5.9999999999999998e-002 | AP256: 18 | AQ256: 东风转债!
A257: 256 | B257: 110064 | C257: 建工转债! | D257: 600939 | E257: 重庆建工 | F257: 建筑 | G257: 建筑工程 | H257: 115.78 | I257: 1.15e-002 | J257: 2.9999999999999997e-004 | K257: 4.29 | L257: 2.8799999999999999e-002 | M257: 119.2 | N257: 4.53 | O257: 0.223 | P257: 94.7 | Q257: 已到 | R257: 3.99年 | S257: 1.99年 | T257: 16.6 | U257: 96 | V257: 5.0999999999999997e-002 | W257: 0.21299999999999999 | X257: 0.20199999999999999 | Y257: 78 | Z257: 1.07 | AA257: 7.4999999999999997e-003 | AB257: -8.9999999999999998e-004 | AC257: -5.0900000000000001e-002 | AD257: -5.3899999999999997e-002 | AE257: 96.23 | AF257: 104.32 | AG257: 0.41 | AH257: AA+ | AI257: 3.4799999999999998e-002 | AJ257: =H257+100*O257 -> 138.08000000000001 | AK257: 136.9 | AL257: 18 | AM257: 32.5 | AN257: 10 | AO257: 0.13100000000000001 | AP257: 47 | AQ257: 建工转债!
A258: 257 | B258: 128087 | C258: 孚日转债! | D258: 2083 | E258: 孚日股份 | F258: 服装纺织 | G258: 家纺 | H258: 116.499 | I258: 2.5999999999999999e-003 | J258: 1.6000000000000001e-003 | K258: 4.41 | L258: 6.8000000000000005e-003 | M258: 112.3 | N258: 4.5 | O258: 0.18899999999999997 | P258: 98 | Q258: 已到 | R258: 3.98年 | S258: 1.98年 | T258: 6.5 | U258: 16 | V258: 2.1000000000000001e-002 | W258: 0.16200000000000001 | X258: 0.159 | Y258: 40 | Z258: 1.06 | AA258: -9.300000000000001e-003 | AB258: -1.49e-002 | AC258: -5.7000000000000002e-002 | AD258: -5.9299999999999999e-002 | AE258: 90.65 | AF258: 89.19 | AG258: 0.61 | AH258: AA- | AI258: 6.08e-002 | AJ258: =H258+100*O258 -> 135.399 | AK258: 135 | AL258: 14 | AM258: 44.3 | AN258: 44 | AO258: 3.6000000000000004e-002 | AP258: 74 | AQ258: 孚日转债!
A259: 258 | B259: 128085 | C259: 鸿达转债!! | D259: 2002 | E259: 鸿达兴业 | F259: 化工 | G259: 化工 | H259: 151.501 | I259: -3.1e-002 | J259: -4.7999999999999996e-003 | K259: 5.81 | L259: -3.9699999999999999e-002 | M259: 123.8 | N259: 3.91 | O259: 2.e-002 | P259: 148.59 | Q259: 已到 | R259: 3.98年 | S259: 1.98年 | T259: 3.43 | U259: 206 | V259: 0.39000000000000001 | W259: 1.9e-002 | X259: 2.7999999999999997e-002 | Y259: 181 | Z259: 1.75 | AA259: -5.04e-002 | AB259: -5.9699999999999996e-002 | AC259: -0.129 | AD259: -0.13 | AE259: 73.73 | AF259: 66.87 | AG259: 0.9 | AH259: B | AI259: 0.17180000000000001 | AJ259: =H259+100*O259 -> 153.501 | AK259: 154.4 | AL259: 154 | AM259: 80.7 | AN259: 251 | AO259: -3.2000000000000001e-002 | AP259: 85 | AQ259: 鸿达转债!!
A260: 259 | B260: 110063 | C260: 鹰19转债 | D260: 600567 | E260: 山鹰国际 | F260: 造纸包装 | G260: 包装用纸 | H260: 120.25 | I260: -3.0000000000000001e-003 | J260: -1.6000000000000001e-003 | K260: 3.27 | L260: -9.1000000000000004e-003 | M260: 115.4 | N260: 3.26 | O260: 0.19899999999999998 | P260: 100.31 | Q260: 已到 | R260: 3.97年 | S260: 1.97年 | T260: 18.4 | U260: 6.3 | V260: 3.0000000000000001e-003 | W260: 0.122 | X260: 0.12300000000000001 | Y260: 151 | Z260: 0.94 | AA260: -1.0500000000000001e-002 | AB260: -1.7299999999999999e-002 | AC260: -7.1500000000000008e-002 | AD260: -7.3800000000000004e-002 | AE260: 95.54 | AF260: 100.99 | AG260: 0.5 | AH260: AA+ | AI260: 3.4799999999999998e-002 | AJ260: =H260+100*O260 -> 140.15000000000001 | AK260: 140.2 | AL260: 33 | AM260: 39.2 | AN260: 19 | AO260: 3.0000000000000001e-003 | AP260: 29 | AQ260: 鹰19转债
A261: 260 | B261: 128083 | C261: 新北转债! | D261: 2376 | E261: 新北洋 | F261: 电子 | G261: 电子产品 | H261: 111.897 | I261: -3.4999999999999996e-003 | J261: 1.6000000000000001e-003 | K261: 8.57 | L261: -8.1000000000000013e-003 | M261: 114.3 | N261: 11.45 | O261: 0.495 | P261: 74.85 | Q261: 已到 | R261: 3.96年 | S261: 1.96年 | T261: 8.77 | U261: 3.5 | V261: 4.0000000000000001e-003 | W261: 0.154 | X261: 0.115 | Y261: 57 | Z261: 1.69 | AA261: 5.5000000000000005e-003 | AB261: -1.e-003 | AC261: -3.9199999999999999e-002 | AD261: -4.1700000000000001e-002 | AE261: 94.65 | AF261: 98.19 | AG261: 0.24 | AH261: AA | AI261: 3.9800000000000002e-002 | AJ261: =H261+100*O261 -> 161.39699999999999 | AK261: 148.9 | AL261: 100 | AM261: 50.8 | AN261: 88 | AO261: -1.8000000000000002e-002 | AP261: 22 | AQ261: 新北转债!
A262: 261 | B262: 128082 | C262: 华锋转债!! | D262: 2806 | E262: 华锋股份 | F262: 电子 | G262: 元器件制 | H262: 179.949 | I262: -3.4300000000000004e-002 | J262: -1.8000000000000002e-002 | K262: 15.28 | L262: -5.7999999999999996e-002 | M262: 120.6 | N262: 9.13 | O262: 7.4999999999999997e-002 | P262: 167.36 | Q262: 已到 | R262: 3.94年 | S262: 1.94年 | T262: 2.04 | U262: 165 | V262: 0.44299999999999995 | W262: 7.0000000000000007e-002 | X262: 0.11599999999999999 | Y262: 29 | Z262: 2.57 | AA262: -9.8299999999999998e-002 | AB262: -0.106 | AC262: -0.17699999999999999 | AD262: -0.17800000000000002 | AE262: 87.97 | AF262: 89.1 | AG262: 0.9 | AH262: A | AI262: 8.1799999999999998e-002 | AJ262: =H262+100*O262 -> 187.44900000000001 | AK262: 192.5 | AL262: 306 | AM262: 103.4 | AN262: 310 | AO262: -4.0000000000000001e-002 | AP262: 48 | AQ262: 华锋转债!!
A263: 262 | B263: 110062 | C263: 烽火转债! | D263: 600498 | E263: 烽火通信 | F263: 通信互联 | G263: 通信设备 | H263: 115.48 | I263: 4.1999999999999997e-003 | J263: -5.1000000000000004e-003 | K263: 17.57 | L263: -4.0000000000000001e-003 | M263: 110.3 | N263: 22.85 | O263: 0.502 | P263: 76.89 | Q263: 已到 | R263: 3.94年 | S263: 1.94年 | T263: 30.9 | U263: 17 | V263: 5.0000000000000001e-003 | W263: 0.14800000000000002 | X263: 0.114 | Y263: 209 | Z263: 1.81 | AA263: -1.18e-002 | AB263: -1.6500000000000001e-002 | AC263: -5.4100000000000002e-002 | AD263: -5.6500000000000002e-002 | AE263: 96.09 | AF263: 97.37 | AG263: 0.24 | AH263: AAA | AI263: 3.2799999999999996e-002 | AJ263: =H263+100*O263 -> 165.68000000000001 | AK263: 154.1 | AL263: 150 | AM263: 56.7 | AN263: 126 | AO263: -1.6e-002 | AP263: 17 | AQ263: 烽火转债!
A264: 263 | B264: 128081 | C264: 海亮转债! | D264: 2203 | E264: 海亮股份 | F264: 有色金属 | G264: 铜金属 | H264: 132.7 | I264: 6.1999999999999998e-003 | J264: -5.5000000000000005e-003 | K264: 12.38 | L264: 8.0000000000000004e-004 | M264: 114.3 | N264: 9.69 | O264: 3.9e-002 | P264: 127.76 | Q264: 已到 | R264: 3.91年 | S264: 1.91年 | T264: 30.1 | U264: 96 | V264: 2.4e-002 | W264: 0.12300000000000001 | X264: 0.158 | Y264: 243 | Z264: 2.44 | AA264: -3.8100000000000002e-002 | AB264: -4.4299999999999999e-002 | AC264: -0.11599999999999999 | AD264: -0.11800000000000001 | AE264: 94.86 | AF264: 98.41 | AG264: 0.78 | AH264: AA | AI264: 3.9800000000000002e-002 | AJ264: =H264+100*O264 -> 136.59999999999999 | AK264: 137.6 | AL264: 22 | AM264: 39.2 | AN264: 20 | AO264: -5.0000000000000001e-003 | AP264: 44 | AQ264: 海亮转债!
A265: 264 | B265: 113550 | C265: 常汽转债! | D265: 603035 | E265: 常熟汽饰 | F265: 汽车 | G265: 零部件制 | H265: 230.5 | I265: -1.4499999999999999e-002 | J265: 2.4199999999999999e-002 | K265: 19.02 | L265: 1.01e-002 | M265: 120.5 | N265: 9.33 | O265: 0.13100000000000001 | P265: 203.86 | Q265: 已到 | R265: 3.90年 | S265: 1.90年 | T265: 2.14 | U265: 737 | V265: 1.48 | W265: 3.1e-002 | X265: 6.4000000000000001e-002 | Y265: 69 | Z265: 1.75 | AA265: -0.156 | AB265: -0.16300000000000001 | AC265: -0.23699999999999999 | AD265: -0.23800000000000002 | AE265: 91.64 | AF265: 96.21 | AG265: 0.96 | AH265: AA- | AI265: 6.08e-002 | AJ265: =H265+100*O265 -> 243.59999999999999 | AK265: 257.1 | AL265: 345 | AM265: 160.9 | AN265: 345 | AO265: 0.17499999999999999 | AP265: 15 | AQ265: 常汽转债!
A266: 265 | B266: 113549 | C266: 白电转债 | D266: 603861 | E266: 白云电器 | F266: 能源电力 | G266: 电力设备 | H266: 140.39 | I266: -1.9599999999999999e-002 | J266: -4.3799999999999999e-002 | K266: 11.37 | L266: -8.2299999999999998e-002 | M266: 114.3 | N266: 9.06 | O266: 0.11900000000000001 | P266: 125.5 | Q266: 已到 | R266: 3.89年 | S266: 1.89年 | T266: 8.05 | U266: 370 | V266: 0.32500000000000001 | W266: 0.16300000000000001 | X266: 0.20399999999999999 | Y266: 50 | Z266: 1.91 | AA266: -5.2300000000000006e-002 | AB266: -5.8400000000000001e-002 | AC266: -0.113 | AD266: -0.115 | AE266: 94.92 | AF266: 98.47 | AG266: 0.77 | AH266: AA | AI266: 3.9800000000000002e-002 | AJ266: =H266+100*O266 -> 152.28999999999999 | AK266: 155.3 | AL266: 160 | AM266: 56.8 | AN266: 128 | AO266: 2.1000000000000001e-002 | AP266: 36 | AQ266: 白电转债
A267: 266 | B267: 123035 | C267: 利德转债!! | D267: 300296 | E267: 利亚德 | F267: 电子 | G267: LED制 | H267: 169.1 | I267: -2.3e-002 | J267: -1.6000000000000001e-003 | K267: 10.4 | L267: -2.7999999999999997e-002 | M267: 114.3 | N267: 6.96 | O267: 0.13200000000000001 | P267: 149.43 | Q267: 已到 | R267: 3.89年 | S267: 1.89年 | T267: 7.99 | U267: 83 | V267: 5.9999999999999998e-002 | W267: 2.9999999999999999e-002 | X267: 4.4999999999999998e-002 | Y267: 264 | Z267: 3.44 | AA267: -9.7299999999999998e-002 | AB267: -0.10300000000000001 | AC267: -0.16800000000000001 | AD267: -0.17000000000000001 | AE267: 95.87 | AF267: 100.31 | AG267: 0.88 | AH267: AA+ | AI267: 3.4799999999999998e-002 | AJ267: =H267+100*O267 -> 182.29999999999998 | AK267: 188.8 | AL267: 295 | AM267: 88.5 | AN267: 283 | AO267: 1.1000000000000001e-002 | AP267: 13 | AQ267: 利德转债!!
A268: 267 | B268: 110061 | C268: 川投转债! | D268: 600674 | E268: 川投能源 | F268: 能源电力 | G268: 水电 | H268: 150.8 | I268: 1.7600000000000001e-002 | J268: 5.0000000000000001e-003 | K268: 12.3 | L268: 2.6699999999999998e-002 | M268: 110.3 | N268: 9.2 | O268: 0.128 | P268: 133.7 | Q268: 已到 | R268: 3.88年 | S268: 1.88年 | T268: 39.6 | U268: 121 | V268: 2.e-002 | W268: 7.2999999999999995e-002 | X268: 9.8000000000000004e-002 | Y268: 542 | Z268: 1.77 | AA268: -7.8700000000000006e-002 | AB268: -8.3000000000000004e-002 | AC268: -0.13699999999999998 | AD268: -0.13800000000000001 | AE268: 96.27 | AF268: 97.55 | AG268: 0.85 | AH268: AAA | AI268: 3.2799999999999996e-002 | AJ268: =H268+100*O268 -> 163.60000000000002 | AK268: 167.9 | AL268: 236 | AM268: 70.4 | AN268: 209 | AO268: 3.9e-002 | AP268: 12 | AQ268: 川投转债!
A269: 268 | B269: 123034 | C269: 通光转债! | D269: 300265 | E269: 通光线缆 | F269: 通信互联 | G269: 通信设备 | H269: 214 | I269: -1.78e-002 | J269: -2.8199999999999999e-002 | K269: 10.56 | L269: -5.6299999999999996e-002 | M269: 117.3 | N269: 7.95 | O269: 0.61099999999999999 | P269: 132.83 | Q269: 已到 | R269: 3.86年 | S269: 1.86年 | T269: 0.78 | U269: 159 | V269: 0.94400000000000006 | W269: 2.e-002 | X269: 2.7000000000000003e-002 | Y269: 39 | Z269: 2.96 | AA269: -0.14599999999999999 | AB269: -0.153 | AC269: -0.22800000000000001 | AD269: -0.22899999999999998 | AE269: 89.41 | AF269: 90.2 | AG269: 0.82 | AH269: A+ | AI269: 7.1800000000000003e-002 | AJ269: =H269+100*O269 -> 275.10000000000002 | AK269: 295.2 | AL269: 359 | AM269: 205 | AN269: 360 | AO269: -6.6000000000000003e-002 | AP269: 17 | AQ269: 通光转债!
A270: 269 | B270: 113548 | C270: 石英转债! | D270: 603688 | E270: 石英股份 | F270: 电子 | G270: 电子产品 | H270: 468.55 | I270: -4.0899999999999999e-002 | J270: -1.2800000000000001e-002 | K270: 65.56 | L270: -5.4400000000000004e-002 | M270: 123.7 | N270: 14.93 | O270: 6.7000000000000004e-002 | P270: 439.12 | Q270: 已到 | R270: 3.84年 | S270: 1.84年 | T270: 1.2 | U270: 344 | V270: 0.60799999999999998 | W270: 5.0000000000000001e-003 | X270: 2.3e-002 | Y270: 231 | Z270: 11.27 | AA270: -0.29699999999999999 | AB270: -0.30299999999999999 | AC270: -0.34799999999999998 | AD270: -0.34899999999999998 | AE270: 92.13 | AF270: 99.11 | AG270: 0.99 | AH270: AA- | AI270: 6.08e-002 | AJ270: =H270+100*O270 -> 475.25 | AK270: 498 | AL270: 373 | AM270: 398.9 | AN270: 373 | AO270: 7.0000000000000007e-002 | AP270: 12 | AQ270: 石英转债!
A271: 270 | B271: 110060 | C271: 天路转债! | D271: 600326 | E271: 西藏天路 | F271: 建筑 | G271: 水泥 | H271: 120.46 | I271: -9.0000000000000011e-003 | J271: 2.0999999999999999e-003 | K271: 6.36 | L271: -1.7000000000000001e-002 | M271: 114.3 | N271: 7.08 | O271: 0.34100000000000003 | P271: 89.83 | Q271: 已到 | R271: 3.84年 | S271: 1.84年 | T271: 7.06 | U271: 3.8 | V271: 5.0000000000000001e-003 | W271: 0.121 | X271: 0.109 | Y271: 58 | Z271: 1.37 | AA271: -1.38e-002 | AB271: -2.0299999999999999e-002 | AC271: -7.6399999999999996e-002 | AD271: -7.8799999999999995e-002 | AE271: 95.1 | AF271: 98.66 | AG271: 0.4 | AH271: AA | AI271: 3.9800000000000002e-002 | AJ271: =H271+100*O271 -> 154.56 | AK271: 151.1 | AL271: 123 | AM271: 52.4 | AN271: 101 | AO271: -4.0000000000000001e-003 | AP271: 12 | AQ271: 天路转债!
A272: 271 | B272: 110059 | C272: 浦发转债! | D272: 600000 | E272: 浦发银行 | F272: 金融 | G272: 银行行业 | H272: 104.93 | I272: -5.0000000000000001e-004 | J272: 1.e-004 | K272: 8.54 | L272: -4.6999999999999993e-003 | M272: 116.8 | N272: 13.97 | O272: 0.71599999999999997 | P272: 61.13 | Q272: 已到 | R272: 3.84年 | S272: 无权 | T272: 500 | U272: 188 | V272: 4.0000000000000001e-003 | W272: 0.19899999999999998 | X272: 0.122 | Y272: 2507. | Z272: 0.46 | AA272: 2.9100000000000001e-002 | AB272: 2.1000000000000001e-002 | AC272: 无权 | AD272: 无权 | AE272: 无权 | AF272: 103.53 | AG272: 0.07 | AH272: AAA | AI272: 3.2799999999999996e-002 | AJ272: =H272+100*O272 -> 176.53 | AK272: 148.7 | AL272: 96 | AM272: 45.2 | AN272: 49 | AO272: -8.0000000000000002e-003 | AP272: 53 | AQ272: 浦发转债!
A273: 272 | B273: 127014 | C273: 北方转债! | D273: 65 | E273: 北方国际 | F273: 建筑 | G273: 建筑工程 | H273: 121.128 | I273: -4.8999999999999998e-003 | J273: -6.8000000000000005e-003 | K273: 8.24 | L273: -2.6000000000000002e-002 | M273: 114.3 | N273: 8.65 | O273: 0.27200000000000002 | P273: 95.26 | Q273: 已到 | R273: 3.83年 | S273: 1.83年 | T273: 5.35 | U273: 2.3 | V273: 4.0000000000000001e-003 | W273: 8.4000000000000005e-002 | X273: 8.0000000000000002e-002 | Y273: 64 | Z273: 1.07 | AA273: -1.5300000000000001e-002 | AB273: -2.18e-002 | AC273: -7.9399999999999998e-002 | AD273: -8.1799999999999998e-002 | AE273: 96.06 | AF273: 100.51 | AG273: 0.45 | AH273: AA+ | AI273: 3.4799999999999998e-002 | AJ273: =H273+100*O273 -> 148.328 | AK273: 147 | AL273: 80 | AM273: 46.5 | AN273: 56 | AO273: 5.0000000000000001e-003 | AP273: 17 | AQ273: 北方转债!
A274: 273 | B274: 113546 | C274: 迪贝转债! | D274: 603320 | E274: 迪贝电气 | F274: 家电 | G274: 零部件制 | H274: 119.76 | I274: -2.5999999999999999e-003 | J274: -1.6899999999999998e-002 | K274: 12.37 | L274: -4.0300000000000002e-002 | M274: 119.8 | N274: 14 | O274: 0.35499999999999998 | P274: 88.36 | Q274: 已到 | R274: 3.83年 | S274: 1.83年 | T274: 2.3 | U274: 3.9 | V274: 1.3999999999999999e-002 | W274: 0.14300000000000002 | X274: 0.126 | Y274: 16 | Z274: 2.21 | AA274: 1.e-004 | AB274: -8.8000000000000005e-003 | AC274: -7.2800000000000004e-002 | AD274: -7.5499999999999998e-002 | AE274: 89.92 | AF274: 92.38 | AG274: 0.48 | AH274: A+ | AI274: 7.1800000000000003e-002 | AJ274: =H274+100*O274 -> 155.25999999999999 | AK274: 151.2 | AL274: 125 | AM274: 58.8 | AN274: 142 | AO274: -7.0999999999999994e-002 | AP274: 37 | AQ274: 迪贝转债!
A275: 274 | B275: 128079 | C275: 英联转债! | D275: 2846 | E275: 英联股份 | F275: 造纸包装 | G275: 包装材料 | H275: 124.788 | I275: -3.3e-003 | J275: 2.5999999999999999e-003 | K275: 7.51 | L275: -1.2999999999999999e-003 | M275: 116.9 | N275: 8.29 | O275: 0.377 | P275: 90.59 | Q275: 已到 | R275: 3.82年 | S275: 1.82年 | T275: 1.52 | U275: 9.3 | V275: 4.9000000000000002e-002 | W275: 6.4000000000000001e-002 | X275: 5.7999999999999996e-002 | Y275: 24 | Z275: 2.96 | AA275: -1.7299999999999999e-002 | AB275: -2.4799999999999999e-002 | AC275: -9.2300000000000007e-002 | AD275: -9.4899999999999998e-002 | AE275: 89.88 | AF275: 90.18 | AG275: 0.57 | AH275: A+ | AI275: 7.1800000000000003e-002 | AJ275: =H275+100*O275 -> 162.488 | AK275: 159 | AL275: 179 | AM275: 68.8 | AN275: 199 | AO275: 9.0000000000000011e-003 | AP275: 16 | AQ275: 英联转债!
A276: 275 | B276: 128078 | C276: 太极转债! | D276: 2368 | E276: 太极股份 | F276: 计算机及 | G276: 软件开发 | H276: 157.28 | I276: 2.3999999999999998e-003 | J276: -3.1400000000000004e-002 | K276: 27.7 | L276: -3.8900000000000004e-002 | M276: 116.3 | N276: 22.21 | O276: 0.26100000000000001 | P276: 124.72 | Q276: 已到 | R276: 3.82年 | S276: 1.82年 | T276: 9.6 | U276: 34 | V276: 2.3e-002 | W276: 5.9999999999999998e-002 | X276: 7.4999999999999997e-002 | Y276: 161 | Z276: 4.86 | AA276: -7.7100000000000002e-002 | AB276: -8.3800000000000013e-002 | AC276: -0.155 | AD276: -0.156 | AE276: 95.17 | AF276: 100.46 | AG276: 0.75 | AH276: AA | AI276: 3.9800000000000002e-002 | AJ276: =H276+100*O276 -> 183.38 | AK276: 189.8 | AL276: 298 | AM276: 89.4 | AN276: 284 | AO276: -1.4999999999999999e-002 | AP276: 9 | AQ276: 太极转债!
A277: 276 | B277: 128076 | C277: 金轮转债! | D277: 2722 | E277: 金轮股份 | F277: 机械装备 | G277: 专用设备 | H277: 130.05 | I277: -3.0999999999999999e-003 | J277: -1.9799999999999998e-002 | K277: 16.46 | L277: -3.2899999999999999e-002 | M277: 114.3 | N277: 14.66 | O277: 0.158 | P277: 112.28 | Q277: 已到 | R277: 3.80年 | S277: 1.80年 | T277: 2.14 | U277: 35 | V277: 0.126 | W277: 7.400000000000001e-002 | X277: 8.3000000000000004e-002 | Y277: 29 | Z277: 1.47 | AA277: -3.4000000000000002e-002 | AB277: -4.0399999999999998e-002 | AC277: -0.113 | AD277: -0.115 | AE277: 91.59 | AF277: 91.71 | AG277: 0.7 | AH277: AA- | AI277: 6.08e-002 | AJ277: =H277+100*O277 -> 145.85000000000002 | AK277: 147.8 | AL277: 89 | AM277: 56.1 | AN277: 119 | AO277: 1.1000000000000001e-002 | AP277: 37 | AQ277: 金轮转债!
A278: 277 | B278: 113545 | C278: 金能转债! | D278: 603113 | E278: 金能科技 | F278: 煤炭 | G278: 炼焦 | H278: 192.06 | I278: -6.5000000000000006e-003 | J278: 1.6200000000000003e-002 | K278: 17.39 | L278: 1.0500000000000001e-002 | M278: 114.3 | N278: 10.43 | O278: 0.152 | P278: 166.73 | Q278: 已到 | R278: 3.80年 | S278: 1.80年 | T278: 9.87 | U278: 175 | V278: 9.0999999999999998e-002 | W278: 6.6000000000000003e-002 | X278: 0.111 | Y278: 149 | Z278: 1.7 | AA278: -0.129 | AB278: -0.13500000000000001 | AC278: -0.21100000000000002 | AD278: -0.21299999999999999 | AE278: 95.25 | AF278: 98.81 | AG278: 0.93 | AH278: AA | AI278: 3.9800000000000002e-002 | AJ278: =H278+100*O278 -> 207.25999999999999 | AK278: 217.4 | AL278: 328 | AM278: 118.6 | AN278: 324 | AO278: 5.2999999999999999e-002 | AP278: 13 | AQ278: 金能转债!
A279: 278 | B279: 128074 | C279: 游族转债!! | D279: 2174 | E279: 游族网络 | F279: 通信互联 | G279: 互联网 | H279: 119 | I279: -4.8999999999999998e-003 | J279: -6.7000000000000002e-003 | K279: 14.54 | L279: -2.9399999999999999e-002 | M279: 119.3 | N279: 16.97 | O279: 0.38900000000000001 | P279: 85.68 | Q279: 已到 | R279: 3.75年 | S279: 1.75年 | T279: 6.83 | U279: 22 | V279: 2.7999999999999997e-002 | W279: 5.0999999999999997e-002 | X279: 4.4000000000000004e-002 | Y279: 133 | Z279: 2.54 | AA279: 7.000000000000001e-004 | AB279: -8.199999999999999e-003 | AC279: -7.4200000000000002e-002 | AD279: -7.6700000000000004e-002 | AE279: 95.46 | AF279: 103.35 | AG279: 0.4 | AH279: AA | AI279: 3.9800000000000002e-002 | AJ279: =H279+100*O279 -> 157.90000000000001 | AK279: 152.3 | AL279: 136 | AM279: 49 | AN279: 74 | AO279: -3.3000000000000002e-002 | AP279: 29 | AQ279: 游族转债!!
A280: 279 | B280: 128075 | C280: 远东转债! | D280: 2406 | E280: 远东传动 | F280: 汽车 | G280: 零部件制 | H280: 129.5 | I280: -1.6799999999999999e-002 | J280: 7.000000000000001e-004 | K280: 6.07 | L280: -2.41e-002 | M280: 114.3 | N280: 5.29 | O280: 0.129 | P280: 114.74 | Q280: 已到 | R280: 3.75年 | S280: 1.75年 | T280: 5.44 | U280: 5.3 | V280: 6.9999999999999993e-003 | W280: 0.14400000000000002 | X280: 0.16500000000000001 | Y280: 38 | Z280: 1.16 | AA280: -3.3399999999999999e-002 | AB280: -3.9900000000000005e-002 | AC280: -0.114 | AD280: -0.11699999999999999 | AE280: 95.46 | AF280: 99.03 | AG280: 0.67 | AH280: AA | AI280: 3.9800000000000002e-002 | AJ280: =H280+100*O280 -> 142.40000000000001 | AK280: 144.3 | AL280: 52 | AM280: 45.2 | AN280: 50 | AO280: -3.0000000000000001e-003 | AP280: 16 | AQ280: 远东转债!
A281: 280 | B281: 123031 | C281: 晶瑞转债! | D281: 300655 | E281: 晶瑞电材 | F281: 电子 | G281: 电子行业 | H281: 473 | I281: -1.8700000000000001e-002 | J281: -1.1899999999999999e-002 | K281: 42.93 | L281: -3.0899999999999997e-002 | M281: 115.3 | N281: 10.13 | O281: 0.11599999999999999 | P281: 423.79 | Q281: 已到 | R281: 3.68年 | S281: 1.68年 | T281: 0.53 | U281: 61 | V281: 0.23899999999999999 | W281: 4.0000000000000001e-003 | X281: 1.4999999999999999e-002 | Y281: 146 | Z281: 10.08 | AA281: -0.32200000000000001 | AB281: -0.32700000000000001 | AC281: -0.38799999999999996 | AD281: -0.38900000000000001 | AE281: 90.55 | AF281: 89.8 | AG281: 0.99 | AH281: A+ | AI281: 7.1800000000000003e-002 | AJ281: =H281+100*O281 -> 484.60000000000002 | AK281: 522.2 | AL281: 376 | AM281: 431.7 | AN281: 377 | AO281: -7.9000000000000001e-002 | AP281: 15 | AQ281: 晶瑞转债!
A282: 281 | B282: 128073 | C282: 哈尔转债! | D282: 2615 | E282: 哈尔斯 | F282: 其他 | G282: 家居用品 | H282: 121.155 | I282: -7.7000000000000002e-003 | J282: -2.5999999999999999e-003 | K282: 5.37 | L282: -2.3599999999999999e-002 | M282: 114.5 | N282: 5.71 | O282: 0.28800000000000003 | P282: 94.05 | Q282: 已到 | R282: 2.66年 | S282: 0.66年 | T282: 2.99 | U282: 6.8 | V282: 1.9e-002 | W282: 0.13500000000000001 | X282: 0.127 | Y282: 22 | Z282: 2.58 | AA282: -2.1299999999999999e-002 | AB282: -3.0699999999999998e-002 | AC282: -0.20399999999999999 | AD282: -0.20600000000000002 | AE282: 96.55 | AF282: 98.38 | AG282: 0.44 | AH282: AA- | AI282: 5.9500000000000004e-002 | AJ282: =H282+100*O282 -> 149.95500000000001 | AK282: 148.3 | AL282: 92 | AM282: 49.9 | AN282: 83 | AO282: -5.7999999999999996e-002 | AP282: 36 | AQ282: 哈尔转债!
A283: 282 | B283: 128072 | C283: 翔鹭转债! | D283: 2842 | E283: 翔鹭钨业 | F283: 有色金属 | G283: 小金属 | H283: 112.955 | I283: -1.4000000000000002e-003 | J283: -4.0999999999999995e-003 | K283: 9.14 | L283: -3.6900000000000002e-002 | M283: 114.5 | N283: 15.19 | O283: 0.877 | P283: 60.17 | Q283: 已到 | R283: 3.65年 | S283: 1.65年 | T283: 3.02 | U283: 14 | V283: 4.0000000000000001e-002 | W283: 0.11900000000000001 | X283: 7.2000000000000008e-002 | Y283: 25 | Z283: 2.61 | AA283: 3.8e-003 | AB283: -3.4000000000000002e-003 | AC283: -5.0700000000000002e-002 | AD283: -5.3499999999999999e-002 | AE283: 92.44 | AF283: 92.7 | AG283: 0.15 | AH283: AA- | AI283: 6.08e-002 | AJ283: =H283+100*O283 -> 200.655 | AK283: 165.7 | AL283: 223 | AM283: 73 | AN283: 222 | AO283: -5.4000000000000006e-002 | AP283: 27 | AQ283: 翔鹭转债!
A284: 283 | B284: 128071 | C284: 合兴转债! | D284: 2228 | E284: 合兴包装 | F284: 造纸包装 | G284: 包装材料 | H284: 115.648 | I284: -2.5999999999999999e-003 | J284: -2.9999999999999997e-004 | K284: 3.6 | L284: -8.3000000000000001e-003 | M284: 114.3 | N284: 4.18 | O284: 0.34299999999999997 | P284: 86.12 | Q284: 已到 | R284: 3.64年 | S284: 1.64年 | T284: 3 | U284: 2.2 | V284: 6.0000000000000001e-003 | W284: 6.7000000000000004e-002 | X284: 5.7999999999999996e-002 | Y284: 45 | Z284: 1.32 | AA284: -3.3e-003 | AB284: -1.03e-002 | AC284: -6.3500000000000001e-002 | AD284: -6.6299999999999998e-002 | AE284: 95.85 | AF284: 99.43 | AG284: 0.35 | AH284: AA | AI284: 3.9800000000000002e-002 | AJ284: =H284+100*O284 -> 149.94799999999998 | AK284: 145.2 | AL284: 63 | AM284: 45.7 | AN284: 52 | AO284: 1.3000000000000001e-002 | AP284: 24 | AQ284: 合兴转债!
A285: 284 | B285: 113542 | C285: 好客转债! | D285: 603898 | E285: 好莱客 | F285: 其他 | G285: 家居用品 | H285: 111.49 | I285: -2.9999999999999997e-004 | J285: -5.0000000000000001e-004 | K285: 11.78 | L285: -4.1999999999999997e-003 | M285: 114.3 | N285: 16.14 | O285: 0.52800000000000002 | P285: 72.99 | Q285: 已到 | R285: 3.60年 | S285: 1.60年 | T285: 6.03 | U285: 8.2 | V285: 1.2e-002 | W285: 0.16399999999999998 | X285: 0.12 | Y285: 37 | Z285: 1.35 | AA285: 7.0999999999999995e-003 | AB285: -1.e-004 | AC285: -4.5199999999999997e-002 | AD285: -4.8099999999999997e-002 | AE285: 96 | AF285: 99.59 | AG285: 0.19 | AH285: AA | AI285: 3.9800000000000002e-002 | AJ285: =H285+100*O285 -> 164.28999999999999 | AK285: 150 | AL285: 109 | AM285: 50.4 | AN285: 85 | AO285: 1.2e-002 | AP285: 16 | AQ285: 好客转债!
A286: 285 | B286: 113541 | C286: 荣晟转债!! | D286: 603165 | E286: 荣晟环保 | F286: 造纸包装 | G286: 包装用纸 | H286: 177.47 | I286: 1.7500000000000002e-002 | J286: -1.1000000000000001e-002 | K286: 18.84 | L286: 6.8999999999999999e-003 | M286: 114.3 | N286: 10.84 | O286: 2.1000000000000001e-002 | P286: 173.8 | Q286: 已到 | R286: 3.58年 | S286: 1.58年 | T286: 1.63 | U286: 137 | V286: 0.47999999999999998 | W286: 3.3000000000000002e-002 | X286: 5.7000000000000002e-002 | Y286: 50 | Z286: 2.86 | AA286: -0.11800000000000001 | AB286: -0.124 | AC286: -0.223 | AD286: -0.22399999999999998 | AE286: 92.83 | AF286: 92.95 | AG286: 0.94 | AH286: AA- | AI286: 6.08e-002 | AJ286: =H286+100*O286 -> 179.56999999999999 | AK286: 181.1 | AL286: 282 | AM286: 88.2 | AN286: 282 | AO286: -5.2999999999999999e-002 | AP286: 39 | AQ286: 荣晟转债!!
A287: 286 | B287: 128070 | C287: 智能转债! | D287: 2877 | E287: 智能自控 | F287: 机械装备 | G287: 通用设备 | H287: 115.5 | I287: -5.0000000000000001e-003 | J287: 1.7000000000000001e-003 | K287: 6.67 | L287: -1.1899999999999999e-002 | M287: 116.8 | N287: 9.47 | O287: 0.64000000000000001 | P287: 70.43 | Q287: 已到 | R287: 3.52年 | S287: 无权 | T287: 2.3 | U287: 5.8 | V287: 2.2000000000000002e-002 | W287: 0.10400000000000001 | X287: 7.2999999999999995e-002 | Y287: 22 | Z287: 2.92 | AA287: 3.3e-003 | AB287: -5.1999999999999998e-003 | AC287: 无权 | AD287: 无权 | AE287: 无权 | AF287: 92.03 | AG287: 0.28 | AH287: A+ | AI287: 7.1800000000000003e-002 | AJ287: =H287+100*O287 -> 179.5 | AK287: 160.6 | AL287: 189 | AM287: 68.5 | AN287: 198 | AO287: 4.0000000000000001e-003 | AP287: 28 | AQ287: 智能转债!
A288: 287 | B288: 128069 | C288: 华森转债! | D288: 2907 | E288: 华森制药 | F288: 医药 | G288: 化学制药 | H288: 114.6 | I288: 1.8600000000000002e-002 | J288: -8.5000000000000006e-003 | K288: 13.77 | L288: 3.85e-002 | M288: 119.3 | N288: 18.01 | O288: 0.499 | P288: 76.46 | Q288: 已到 | R288: 3.50年 | S288: 1.50年 | T288: 3 | U288: 80 | V288: 0.23499999999999999 | W288: 5.4000000000000006e-002 | X288: 4.0999999999999995e-002 | Y288: 55 | Z288: 4.67 | AA288: 1.18e-002 | AB288: 2.0999999999999999e-003 | AC288: -6.3799999999999996e-002 | AD288: -6.6699999999999995e-002 | AE288: 93.27 | AF288: 97.45 | AG288: 0.26 | AH288: AA- | AI288: 6.08e-002 | AJ288: =H288+100*O288 -> 164.5 | AK288: 152.7 | AL288: 139 | AM288: 55.3 | AN288: 115 | AO288: 7.2000000000000008e-002 | AP288: 43 | AQ288: 华森转债!
A289: 288 | B289: 113027 | C289: 华钰转债!! | D289: 601020 | E289: ST华钰 | F289: 有色金属 | G289: 锌铅镍锡 | H289: 144.59 | I289: -8.5000000000000006e-003 | J289: 3.4999999999999996e-003 | K289: 13.4 | L289: -5.8999999999999999e-003 | M289: 114.3 | N289: 10.17 | O289: 9.6999999999999989e-002 | P289: 131.76 | Q289: 已到 | R289: 3.47年 | S289: 1.47年 | T289: 3.1 | U289: 188 | V289: 0.41899999999999998 | W289: 4.2000000000000003e-002 | X289: 5.5e-002 | Y289: 74 | Z289: 2.86 | AA289: -6.6699999999999995e-002 | AB289: -7.3399999999999993e-002 | AC289: -0.16399999999999998 | AD289: -0.16600000000000001 | AE289: 90.5 | AF289: 87.52 | AG289: 0.84 | AH289: A | AI289: 8.1799999999999998e-002 | AJ289: =H289+100*O289 -> 154.28999999999999 | AK289: 157.4 | AL289: 171 | AM289: 66.9 | AN289: 190 | AO289: 2.6000000000000002e-002 | AP289: 40 | AQ289: 华钰转债!!
A290: 289 | B290: 123027 | C290: 蓝晓转债! | D290: 300487 | E290: 蓝晓科技 | F290: 化工 | G290: 化工 | H290: 331.99 | I290: -4.1799999999999997e-002 | J290: 7.8000000000000005e-003 | K290: 85.39 | L290: -3.4700000000000002e-002 | M290: 118.8 | N290: 29.02 | O290: 0.128 | P290: 294.25 | Q290: 已到 | R290: 3.46年 | S290: 1.46年 | T290: 1.07 | U290: 117 | V290: 0.32400000000000001 | W290: 6.0000000000000001e-003 | X290: 1.7000000000000001e-002 | Y290: 188 | Z290: 9.49 | AA290: -0.26100000000000001 | AB290: -0.26700000000000002 | AC290: -0.39600000000000002 | AD290: -0.39700000000000002 | AE290: 92.77 | AF290: 94.07 | AG290: 0.98 | AH290: A+ | AI290: 7.1800000000000003e-002 | AJ290: =H290+100*O290 -> 344.79000000000002 | AK290: 369.7 | AL290: 364 | AM290: 275.7 | AN290: 364 | AO290: -4.8000000000000001e-002 | AP290: 17 | AQ290: 蓝晓转债!
A291: 290 | B291: 113537 | C291: 文灿转债!! | D291: 603348 | E291: 文灿股份 | F291: 汽车 | G291: 零部件制 | H291: 350.11 | I291: -2.3e-002 | J291: -3.0000000000000001e-003 | K291: 61.5 | L291: -2.64e-002 | M291: 120.7 | N291: 19.28 | O291: 9.8000000000000004e-002 | P291: 318.98 | Q291: 已到 | R291: 3.46年 | S291: 1.46年 | T291: 1.41 | U291: 638 | V291: 1.29 | W291: 9.0000000000000011e-003 | X291: 2.7999999999999997e-002 | Y291: 161 | Z291: 6.15 | AA291: -0.26899999999999996 | AB291: -0.27600000000000002 | AC291: -0.40700000000000003 | AD291: -0.40799999999999997 | AE291: 94.24 | AF291: 98.93 | AG291: 0.98 | AH291: AA- | AI291: 6.08e-002 | AJ291: =H291+100*O291 -> 359.91000000000003 | AK291: 381.2 | AL291: 365 | AM291: 282.3 | AN291: 365 | AO291: 0.14800000000000002 | AP291: 22 | AQ291: 文灿转债!!
A292: 291 | B292: 113536 | C292: 三星转债!* | D292: 603578 | E292: 三星新材 | F292: 家电 | G292: 零部件制 | H292: 124.45 | I292: -1.9900000000000001e-002 | J292: 0. | K292: 17.19 | L292: -2.e-002 | M292: 114.3 | N292: 13.76 | O292: -4.0000000000000001e-003 | P292: 124.93 | Q292: 已到 | R292: 6.1天 | S292: 无权 | T292: 0.98 | U292: 40 | V292: 0.32700000000000001 | W292: 4.4000000000000004e-002 | X292: 5.5e-002 | Y292: 22 | Z292: 2.84 | AA292: <-100% | AB292: <-100% | AC292: 无权 | AD292: 无权 | AE292: 无权 | AF292: 100.53 | AG292: 1 | AH292: AA | AI292: 3.6499999999999998e-002 | AJ292: =H292+100*O292 -> 124.05 | AK292: 124 | AL292: 3 | AM292: 23.4 | AN292: 3 | AO292: -6.5000000000000002e-002 | AP292: 32 | AQ292: 三星转债!*
A293: 292 | B293: 113535 | C293: 大业转债! | D293: 603278 | E293: 大业股份 | F293: 汽车 | G293: 零部件制 | H293: 120.99 | I293: 3.5999999999999999e-003 | J293: -1.1000000000000001e-002 | K293: 11.9 | L293: -1.8200000000000001e-002 | M293: 112.5 | N293: 12.29 | O293: 0.25 | P293: 96.83 | Q293: 已到 | R293: 2.37年 | S293: 0.37年 | T293: 5 | U293: 52 | V293: 8.5999999999999993e-002 | W293: 0.14499999999999999 | X293: 0.14000000000000001 | Y293: 35 | Z293: 1.93 | AA293: -3.0600000000000002e-002 | AB293: -3.9800000000000002e-002 | AC293: -0.32100000000000001 | AD293: -0.32400000000000001 | AE293: 99.22 | AF293: 102.99 | AG293: 0.41 | AH293: AA | AI293: 3.85e-002 | AJ293: =H293+100*O293 -> 145.99000000000001 | AK293: 145.2 | AL293: 61 | AM293: 42.2 | AN293: 36 | AO293: 7.9000000000000001e-002 | AP293: 46 | AQ293: 大业转债!
A294: 293 | B294: 128066 | C294: 亚泰转债! | D294: 2811 | E294: 郑中设计 | F294: 建筑 | G294: 装饰工程 | H294: 117.794 | I294: -6.0999999999999995e-003 | J294: -1.2e-002 | K294: 9 | L294: -3.5400000000000001e-002 | M294: 116.7 | N294: 9.27 | O294: 0.21299999999999999 | P294: 97.09 | Q294: 已到 | R294: 3.31年 | S294: 1.31年 | T294: 4.8 | U294: 11 | V294: 2.e-002 | W294: 0.19699999999999998 | X294: 0.192 | Y294: 24 | Z294: 1.75 | AA294: -2.8999999999999998e-003 | AB294: -1.1699999999999999e-002 | AC294: -8.7499999999999994e-002 | AD294: -9.11e-002 | AE294: 94.53 | AF294: 96.44 | AG294: 0.51 | AH294: AA- | AI294: 6.08e-002 | AJ294: =H294+100*O294 -> 139.09399999999999 | AK294: 138.5 | AL294: 27 | AM294: 42.1 | AN294: 35 | AO294: 8.0000000000000002e-003 | AP294: 67 | AQ294: 亚泰转债!
A295: 294 | B295: 110058 | C295: 永鼎转债! | D295: 600105 | E295: 永鼎股份 | F295: 通信互联 | G295: 通信设备 | H295: 127.17 | I295: -1.7000000000000001e-002 | J295: -2.9500000000000002e-002 | K295: 5.43 | L295: -7.1800000000000003e-002 | M295: 114.3 | N295: 5.04 | O295: 0.17999999999999999 | P295: 107.74 | Q295: 已到 | R295: 3.31年 | S295: 1.31年 | T295: 2.61 | U295: 75 | V295: 0.22600000000000001 | W295: 3.4000000000000002e-002 | X295: 3.7000000000000005e-002 | Y295: 77 | Z295: 2.67 | AA295: -3.2400000000000005e-002 | AB295: -3.9800000000000002e-002 | AC295: -0.12300000000000001 | AD295: -0.126 | AE295: 94.31 | AF295: 94.44 | AG295: 0.65 | AH295: AA- | AI295: 6.08e-002 | AJ295: =H295+100*O295 -> 145.17000000000002 | AK295: 146.6 | AL295: 75 | AM295: 52.2 | AN295: 98 | AO295: -2.7000000000000003e-002 | AP295: 46 | AQ295: 永鼎转债!
A296: 295 | B296: 127013 | C296: 创维转债! | D296: 810 | E296: 创维数字 | F296: 电子 | G296: 电子产品 | H296: 123.26 | I296: -7.7000000000000002e-003 | J296: 5.3e-003 | K296: 9.66 | L296: -8.199999999999999e-003 | M296: 117.3 | N296: 11.29 | O296: 0.441 | P296: 85.56 | Q296: 已到 | R296: 3.30年 | S296: 1.30年 | T296: 9.78 | U296: 28 | V296: 2.4e-002 | W296: 9.5000000000000001e-002 | X296: 8.1000000000000003e-002 | Y296: 103 | Z296: 2.42 | AA296: -1.52e-002 | AB296: -2.4199999999999999e-002 | AC296: -0.106 | AD296: -0.109 | AE296: 97.12 | AF296: 103.39 | AG296: 0.29 | AH296: AA | AI296: 3.9800000000000002e-002 | AJ296: =H296+100*O296 -> 167.36000000000001 | AK296: 161 | AL296: 191 | AM296: 57.6 | AN296: 134 | AO296: 6.3e-002 | AP296: 24 | AQ296: 创维转债!
A297: 296 | B297: 113026 | C297: 核能转债! | D297: 601985 | E297: 中国核电 | F297: 能源电力 | G297: 核电 | H297: 147.22 | I297: 2.1600000000000001e-002 | J297: 1.e-003 | K297: 8.25 | L297: 2.4799999999999999e-002 | M297: 109.3 | N297: 5.73 | O297: 2.3e-002 | P297: 143.98 | Q297: 已到 | R297: 3.30年 | S297: 1.30年 | T297: 76 | U297: 989 | V297: 8.8000000000000009e-002 | W297: 5.2999999999999999e-002 | X297: 7.5999999999999998e-002 | Y297: 1445. | Z297: 2.24 | AA297: -8.7799999999999989e-002 | AB297: -9.2300000000000007e-002 | AC297: -0.19500000000000001 | AD297: -0.19699999999999998 | AE297: 98.08 | AF297: 98.48 | AG297: 0.91 | AH297: AAA | AI297: 3.2799999999999996e-002 | AJ297: =H297+100*O297 -> 149.52000000000001 | AK297: 150.5 | AL297: 115 | AM297: 52 | AN297: 96 | AO297: 0.14099999999999999 | AP297: 37 | AQ297: 核能转债!
A298: 297 | B298: 113025 | C298: 明泰转债!! | D298: 601677 | E298: 明泰铝业 | F298: 有色金属 | G298: 铝金属 | H298: 430.97 | I298: -6.4000000000000003e-003 | J298: -5.3e-003 | K298: 43.38 | L298: -1.18e-002 | M298: 114.5 | N298: 11 | O298: 9.3000000000000013e-002 | P298: 394.36 | Q298: 已到 | R298: 3.29年 | S298: 1.29年 | T298: 11 | U298: 297 | V298: 6.3e-002 | W298: 3.7000000000000005e-002 | X298: 0.14599999999999999 | Y298: 296 | Z298: 2.94 | AA298: -0.33600000000000002 | AB298: -0.34000000000000002 | AC298: -0.499 | AD298: -0.5 | AE298: 97.2 | AF298: 100.99 | AG298: 0.99 | AH298: AA | AI298: 3.9800000000000002e-002 | AJ298: =H298+100*O298 -> 440.27000000000004 | AK298: 467.6 | AL298: 371 | AM298: 366.6 | AN298: 371 | AO298: 0.14499999999999999 | AP298: 18 | AQ298: 明泰转债!!
A299: 298 | B299: 113534 | C299: 鼎胜转债!! | D299: 603876 | E299: 鼎胜新材 | F299: 有色金属 | G299: 小金属 | H299: 267.28 | I299: -2.0899999999999998e-002 | J299: 4.0999999999999995e-003 | K299: 39.07 | L299: -1.7100000000000001e-002 | M299: 114.3 | N299: 15.18 | O299: 3.7999999999999999e-002 | P299: 257.38 | Q299: 已到 | R299: 3.29年 | S299: 1.29年 | T299: 4.04 | U299: 201 | V299: 0.184 | W299: 2.1000000000000001e-002 | X299: 5.5e-002 | Y299: 190 | Z299: 4.06 | AA299: -0.23100000000000001 | AB299: -0.23600000000000002 | AC299: -0.40399999999999997 | AD299: -0.40600000000000003 | AE299: 94.42 | AF299: 94.54 | AG299: 0.98 | AH299: AA- | AI299: 6.08e-002 | AJ299: =H299+100*O299 -> 271.07999999999998 | AK299: 277.2 | AL299: 353 | AM299: 182.6 | AN299: 355 | AO299: -7.8e-002 | AP299: 28 | AQ299: 鼎胜转债!!
A300: 299 | B300: 113024 | C300: 核建转债! | D300: 601611 | E300: 中国核建 | F300: 建筑 | G300: 建筑工程 | H300: 134.78 | I300: 7.0999999999999995e-003 | J300: -1.66e-002 | K300: 10.35 | L300: -1.52e-002 | M300: 109.3 | N300: 9.7 | O300: 0.26300000000000001 | P300: 106.7 | Q300: 已到 | R300: 3.29年 | S300: 1.29年 | T300: 30 | U300: 72 | V300: 1.8000000000000002e-002 | W300: 0.109 | X300: 0.11699999999999999 | Y300: 274 | Z300: 2.2 | AA300: -6.3e-002 | AB300: -6.7799999999999999e-002 | AC300: -0.156 | AD300: -0.158 | AE300: 98.14 | AF300: 98.54 | AG300: 0.62 | AH300: AAA | AI300: 3.2799999999999996e-002 | AJ300: =H300+100*O300 -> 161.08000000000001 | AK300: 162.9 | AL300: 209 | AM300: 64.3 | AN300: 179 | AO300: 2.7000000000000003e-002 | AP300: 31 | AQ300: 核建转债!
A301: 300 | B301: 128063 | C301: 未来转债! | D301: 2631 | E301: 德尔未来 | F301: 其他 | G301: 家居用品 | H301: 119.505 | I301: -2.8000000000000004e-003 | J301: -3.4000000000000002e-003 | K301: 6.96 | L301: -2.52e-002 | M301: 127.5 | N301: 8.64 | O301: 0.48399999999999999 | P301: 80.56 | Q301: 已到 | R301: 3.27年 | S301: 2.27年 | T301: 6.29 | U301: 3.8 | V301: 5.0000000000000001e-003 | W301: 0.13699999999999998 | X301: 0.111 | Y301: 46 | Z301: 2.68 | AA301: 2.07e-002 | AB301: 6.5000000000000006e-003 | AC301: -4.0999999999999995e-002 | AD301: -4.6900000000000004e-002 | AE301: 94.03 | AF301: 105.78 | AG301: 0.25 | AH301: AA- | AI301: 6.08e-002 | AJ301: =H301+100*O301 -> 167.905 | AK301: 158.5 | AL301: 174 | AM301: 52.7 | AN301: 102 | AO301: -6.5000000000000002e-002 | AP301: 35 | AQ301: 未来转债!
A302: 301 | B302: 113532 | C302: 海环转债! | D302: 603817 | E302: 海峡环保 | F302: 城市公用 | G302: 三废处理 | H302: 110.29 | I302: -1.6000000000000001e-003 | J302: -2.0999999999999999e-003 | K302: 6.04 | L302: -1.47e-002 | M302: 112.3 | N302: 7.63 | O302: 0.39299999999999996 | P302: 79.16 | Q302: 已到 | R302: 3.27年 | S302: 1.27年 | T302: 4.59 | U302: 2.3 | V302: 5.0000000000000001e-003 | W302: 0.16899999999999998 | X302: 0.13400000000000001 | Y302: 27 | Z302: 1.5 | AA302: 5.6999999999999993e-003 | AB302: -1.2999999999999999e-003 | AC302: -4.8300000000000003e-002 | AD302: -5.1799999999999999e-002 | AE302: 97.25 | AF302: 99.13 | AG302: 0.25 | AH302: AA | AI302: 3.9800000000000002e-002 | AJ302: =H302+100*O302 -> 149.59 | AK302: 141.4 | AL302: 37 | AM302: 42.3 | AN302: 38 | AO302: 1.e-002 | AP302: 33 | AQ302: 海环转债!
A303: 302 | B303: 128062 | C303: 亚药转债! | D303: 2370 | E303: 亚太药业 | F303: 医药 | G303: 化学制药 | H303: 95.02 | I303: -1.6000000000000001e-003 | J303: 1.6000000000000001e-003 | K303: 4.23 | L303: 2.4199999999999999e-002 | M303: 119.3 | N303: 16.25 | O303: 2.6499999999999999 | P303: 26.03 | Q303: 已到 | R303: 3.27年 | S303: 1.27年 | T303: 9.63 | U303: 45 | V303: 4.9000000000000002e-002 | W303: 0.42399999999999999 | X303: 0.11 | Y303: 23 | Z303: 6.28 | AA303: 7.3700000000000002e-002 | AB303: 6.25e-002 | AC303: 5.6900000000000006e-002 | AD303: 5.28e-002 | AE303: 82.07 | AF303: 71.93 | AG303: 0 | AH303: B | AI303: 0.17180000000000001 | AJ303: =H303+100*O303 -> 360.01999999999998 | AK303: 164 | AL303: 215 | AM303: 81.9 | AN303: 257 | AO303: 2.4e-002 | AP303: 92 | AQ303: 亚药转债!
A304: 303 | B304: 110057 | C304: 现代转债 | D304: 600420 | E304: 国药现代 | F304: 医药 | G304: 化学制药 | H304: 119.8 | I304: 6.6e-003 | J304: 1.1000000000000001e-003 | K304: 9.83 | L304: 1.44e-002 | M304: 110.3 | N304: 9.79 | O304: 0.193 | P304: 100.41 | Q304: 已到 | R304: 3.27年 | S304: 1.27年 | T304: 16.2 | U304: 39 | V304: 2.e-002 | W304: 0.16 | X304: 0.161 | Y304: 101 | Z304: 1.2 | AA304: -2.5499999999999998e-002 | AB304: -3.1099999999999999e-002 | AC304: -0.10199999999999999 | AD304: -0.105 | AE304: 98.2 | AF304: 99.5 | AG304: 0.53 | AH304: AAA | AI304: 3.2799999999999996e-002 | AJ304: =H304+100*O304 -> 139.09999999999999 | AK304: 139.2 | AL304: 31 | AM304: 39.7 | AN304: 22 | AO304: 2.7999999999999997e-002 | AP304: 23 | AQ304: 现代转债
A305: 304 | B305: 123025 | C305: 精测转债!! | D305: 300567 | E305: 精测电子 | F305: 电子 | G305: 液晶显示 | H305: 157.5 | I305: -2.7799999999999998e-002 | J305: 4.3e-003 | K305: 67.6 | L305: -2.8300000000000002e-002 | M305: 116.5 | N305: 49.37 | O305: 0.14999999999999999 | P305: 136.93 | Q305: 已到 | R305: 3.26年 | S305: 1.26年 | T305: 3.09 | U305: 47 | V305: 9.5000000000000001e-002 | W305: 1.6e-002 | X305: 2.2000000000000002e-002 | Y305: 188 | Z305: 5.82 | AA305: -8.9999999999999997e-002 | AB305: -9.7899999999999987e-002 | AC305: -0.23300000000000001 | AD305: -0.23600000000000002 | AE305: 94.62 | AF305: 96.54 | AG305: 0.83 | AH305: AA- | AI305: 6.08e-002 | AJ305: =H305+100*O305 -> 172.5 | AK305: 178.1 | AL305: 274 | AM305: 81.5 | AN305: 254 | AO305: 7.0999999999999994e-002 | AP305: 14 | AQ305: 精测转债!!
A306: 305 | B306: 113530 | C306: 大丰转债! | D306: 603081 | E306: 大丰实业 | F306: 建筑 | G306: 装饰工程 | H306: 117.42 | I306: -4.0000000000000002e-004 | J306: -3.0000000000000001e-003 | K306: 13.07 | L306: -1.8000000000000002e-002 | M306: 121 | N306: 16.3 | O306: 0.46399999999999997 | P306: 80.18 | Q306: 已到 | R306: 3.25年 | S306: 1.25年 | T306: 6.3 | U306: 8.6 | V306: 1.2e-002 | W306: 0.11800000000000001 | X306: 9.4e-002 | Y306: 53 | Z306: 2.24 | AA306: 9.4999999999999998e-003 | AB306: -1.7000000000000001e-003 | AC306: -8.9499999999999996e-002 | AD306: -9.3000000000000013e-002 | AE306: 97.43 | AF306: 106.88 | AG306: 0.19 | AH306: AA | AI306: 3.9800000000000002e-002 | AJ306: =H306+100*O306 -> 163.81999999999999 | AK306: 154.7 | AL306: 156 | AM306: 47.8 | AN306: 64 | AO306: 5.5e-002 | AP306: 29 | AQ306: 大丰转债!
A307: 306 | B307: 127012 | C307: 招路转债! | D307: 1965 | E307: 招商公路 | F307: 机场高速 | G307: 高速 | H307: 116.59 | I307: -3.4999999999999996e-003 | J307: 2.5000000000000001e-003 | K307: 7.62 | L307: -2.5999999999999999e-003 | M307: 107.9 | N307: 8.63 | O307: 0.32000000000000001 | P307: 88.3 | Q307: 已到 | R307: 3.24年 | S307: 1.24年 | T307: 50 | U307: 12 | V307: 2.e-003 | W307: 0.106 | X307: 9.4e-002 | Y307: 471 | Z307: 0.91 | AA307: -2.4e-002 | AB307: -2.8399999999999998e-002 | AC307: -9.35e-002 | AD307: -9.5500000000000002e-002 | AE307: 97.17 | AF307: 97.34 | AG307: 0.38 | AH307: AAA | AI307: 3.2799999999999996e-002 | AJ307: =H307+100*O307 -> 148.59 | AK307: 144.9 | AL307: 59 | AM307: 47.5 | AN307: 63 | AO307: 1.7000000000000001e-002 | AP307: 25 | AQ307: 招路转债!
A308: 307 | B308: 123024 | C308: 岱勒转债! | D308: 300700 | E308: 岱勒新材 | F308: 机械装备 | G308: 专用设备 | H308: 122.11 | I308: -8.199999999999999e-003 | J308: -1.1299999999999999e-002 | K308: 13.38 | L308: -4.2199999999999994e-002 | M308: 112.5 | N308: 14.1 | O308: 0.28699999999999998 | P308: 94.89 | Q308: 已到 | R308: 2.24年 | S308: 0.24年 | T308: 2.1 | U308: 6.3 | V308: 2.5000000000000001e-002 | W308: 0.14599999999999999 | X308: 0.13900000000000001 | Y308: 14 | Z308: 3.03 | AA308: -3.6499999999999998e-002 | AB308: -4.6100000000000002e-002 | AC308: -0.45299999999999996 | AD308: -0.45899999999999996 | AE308: 98.52 | AF308: 96.82 | AG308: 0.46 | AH308: A+ | AI308: 7.0499999999999993e-002 | AJ308: =H308+100*O308 -> 150.81 | AK308: 149.3 | AL308: 106 | AM308: 50.8 | AN308: 90 | AO308: -3.7999999999999999e-002 | AP308: 36 | AQ308: 岱勒转债!
A309: 308 | B309: 123023 | C309: 迪森转债! | D309: 300335 | E309: 迪森股份 | F309: 能源电力 | G309: 电力供应 | H309: 115.4 | I309: -5.7999999999999996e-003 | J309: -8.0000000000000002e-003 | K309: 5.88 | L309: -3.4500000000000003e-002 | M309: 114.3 | N309: 6.89 | O309: 0.35200000000000004 | P309: 85.34 | Q309: 已到 | R309: 3.23年 | S309: 2.23年 | T309: 5.29 | U309: 14 | V309: 2.3e-002 | W309: 0.24100000000000002 | X309: 0.20600000000000002 | Y309: 22 | Z309: 1.61 | AA309: -3.0000000000000001e-003 | AB309: -1.09e-002 | AC309: -4.0599999999999997e-002 | AD309: -4.4000000000000004e-002 | AE309: 91.03 | AF309: 94.85 | AG309: 0.4 | AH309: AA- | AI309: 6.08e-002 | AJ309: =H309+100*O309 -> 150.60000000000002 | AK309: 145.5 | AL309: 65 | AM309: 50.6 | AN309: 87 | AO309: -2.e-003 | AP309: 50 | AQ309: 迪森转债!
A310: 309 | B310: 110056 | C310: 亨通转债! | D310: 600487 | E310: 亨通光电 | F310: 通信互联 | G310: 通信设备 | H310: 134.53 | I310: -3.7000000000000002e-003 | J310: -8.1000000000000013e-003 | K310: 14.44 | L310: -2.76e-002 | M310: 114.3 | N310: 14.95 | O310: 0.39299999999999996 | P310: 96.59 | Q310: 已到 | R310: 3.23年 | S310: 1.23年 | T310: 17.1 | U310: 32 | V310: 1.3999999999999999e-002 | W310: 5.0000000000000003e-002 | X310: 4.8000000000000001e-002 | Y310: 341 | Z310: 1.65 | AA310: -5.0199999999999995e-002 | AB310: -5.7500000000000002e-002 | AC310: -0.16200000000000001 | AD310: -0.16500000000000001 | AE310: 98.05 | AF310: 102.59 | AG310: 0.43 | AH310: AA+ | AI310: 3.4799999999999998e-002 | AJ310: =H310+100*O310 -> 173.82999999999998 | AK310: 172.5 | AL310: 259 | AM310: 69.9 | AN310: 204 | AO310: -5.9000000000000004e-002 | AP310: 24 | AQ310: 亨通转债!
A311: 310 | B311: 123022 | C311: 长信转债!! | D311: 300088 | E311: 长信科技 | F311: 通信互联 | G311: 通信设备 | H311: 247.5 | I311: 2.5000000000000001e-003 | J311: -5.4000000000000003e-003 | K311: 13.46 | L311: -3.0000000000000001e-003 | M311: 114.3 | N311: 6.05 | O311: 0.11199999999999999 | P311: 222.48 | Q311: 已到 | R311: 3.23年 | S311: 1.23年 | T311: 2.57 | U311: 1484. | V311: 2.3100000000000001 | W311: 8.0000000000000002e-003 | X311: 1.7000000000000001e-002 | Y311: 330 | Z311: 4.38 | AA311: -0.21600000000000003 | AB311: -0.222 | AC311: -0.40399999999999997 | AD311: -0.40500000000000003 | AE311: 97.41 | AF311: 101.05 | AG311: 0.98 | AH311: AA | AI311: 3.9800000000000002e-002 | AJ311: =H311+100*O311 -> 258.69999999999999 | AK311: 272.5 | AL311: 350 | AM311: 171.5 | AN311: 349 | AO311: 0.14300000000000002 | AP311: 11 | AQ311: 长信转债!!
A312: 311 | B312: 110055 | C312: 伊力转债!! | D312: 600197 | E312: 伊力特 | F312: 食品饮料 | G312: 白酒 | H312: 205.94 | I312: -2.8000000000000004e-003 | J312: -1.6299999999999999e-002 | K312: 28.4 | L312: -2.e-002 | M312: 114.3 | N312: 16.41 | O312: 0.19 | P312: 173.07 | Q312: 已到 | R312: 3.22年 | S312: 1.22年 | T312: 2.44 | U312: 434 | V312: 0.85699999999999998 | W312: 1.8000000000000002e-002 | X312: 3.1e-002 | Y312: 134 | Z312: 3.72 | AA312: -0.17000000000000001 | AB312: -0.17600000000000002 | AC312: -0.34799999999999998 | AD312: -0.34999999999999998 | AE312: 97.44 | AF312: 101.08 | AG312: 0.95 | AH312: AA | AI312: 3.9800000000000002e-002 | AJ312: =H312+100*O312 -> 224.94 | AK312: 238.8 | AL312: 340 | AM312: 137.7 | AN312: 338 | AO312: 3.2000000000000001e-002 | AP312: 20 | AQ312: 伊力转债!!
A313: 312 | B313: 110053 | C313: 苏银转债! | D313: 600919 | E313: 江苏银行 | F313: 金融 | G313: 银行行业 | H313: 119.32 | I313: -1.8e-003 | J313: -5.9999999999999995e-004 | K313: 5.78 | L313: -6.8999999999999999e-003 | M313: 118.3 | N313: 6.37 | O313: 0.315 | P313: 90.74 | Q313: 已到 | R313: 3.22年 | S313: 无权 | T313: 200 | U313: 112 | V313: 5.0000000000000001e-003 | W313: 0.23399999999999999 | X313: 0.21299999999999999 | Y313: 854 | Z313: 0.58 | AA313: -2.8000000000000004e-003 | AB313: -1.2699999999999999e-002 | AC313: 无权 | AD313: 无权 | AE313: 无权 | AF313: 107.01 | AG313: 0.34 | AH313: AAA | AI313: 3.2799999999999996e-002 | AJ313: =H313+100*O313 -> 150.81999999999999 | AK313: 147.9 | AL313: 90 | AM313: 40.9 | AN313: 24 | AO313: -2.6000000000000002e-002 | AP313: 32 | AQ313: 苏银转债!
A314: 313 | B314: 127011 | C314: 中鼎转2!! | D314: 887 | E314: 中鼎股份 | F314: 汽车 | G314: 零部件制 | H314: 223 | I314: -2.3399999999999997e-002 | J314: 1.5700000000000002e-002 | K314: 22.45 | L314: -8.0000000000000002e-003 | M314: 114.5 | N314: 11.39 | O314: 0.13100000000000001 | P314: 197.1 | Q314: 已到 | R314: 3.20年 | S314: 1.20年 | T314: 12 | U314: 272 | V314: 9.9000000000000005e-002 | W314: 4.4000000000000004e-002 | X314: 8.5999999999999993e-002 | Y314: 274 | Z314: 2.98 | AA314: -0.191 | AB314: -0.19699999999999998 | AC314: -0.38100000000000001 | AD314: -0.38200000000000001 | AE314: 98.18 | AF314: 102.88 | AG314: 0.97 | AH314: AA+ | AI314: 3.4799999999999998e-002 | AJ314: =H314+100*O314 -> 236.09999999999999 | AK314: 248.9 | AL314: 343 | AM314: 146 | AN314: 342 | AO314: 4.2000000000000003e-002 | AP314: 18 | AQ314: 中鼎转2!!
A315: 314 | B315: 110052 | C315: 贵广转债! | D315: 600996 | E315: 贵广网络 | F315: 传媒娱乐 | G315: 影视娱乐 | H315: 108.43 | I315: -1.e-004 | J315: -8.0000000000000004e-004 | K315: 4.96 | L315: -1.78e-002 | M315: 117.7 | N315: 7.94 | O315: 0.73599999999999999 | P315: 62.47 | Q315: 已到 | R315: 3.19年 | S315: 1.19年 | T315: 15.3 | U315: 22 | V315: 1.3999999999999999e-002 | W315: 0.29299999999999998 | X315: 0.183 | Y315: 52 | Z315: 1.36 | AA315: 2.6699999999999998e-002 | AB315: 1.66e-002 | AC315: -3.7200000000000004e-002 | AD315: -4.1399999999999999e-002 | AE315: 98.4 | AF315: 105.79 | AG315: 0.05 | AH315: AA+ | AI315: 3.4799999999999998e-002 | AJ315: =H315+100*O315 -> 182.03 | AK315: 154.4 | AL315: 153 | AM315: 48.6 | AN315: 68 | AO315: 5.7999999999999996e-002 | AP315: 27 | AQ315: 贵广转债!
A316: 315 | B316: 113021 | C316: 中信转债! | D316: 601998 | E316: 中信银行 | F316: 金融 | G316: 银行行业 | H316: 109.45 | I316: 1.1000000000000001e-003 | J316: -1.2999999999999999e-003 | K316: 4.61 | L316: -2.2000000000000001e-003 | M316: 118 | N316: 6.73 | O316: 0.59799999999999998 | P316: 68.5 | Q316: 已到 | R316: 3.19年 | S316: 无权 | T316: 400 | U316: 26 | V316: 1.e-003 | W316: 0.17699999999999999 | X316: 0.121 | Y316: 2256. | Z316: 0.46 | AA316: 2.4700000000000003e-002 | AB316: 1.44e-002 | AC316: 无权 | AD316: 无权 | AE316: 无权 | AF316: 106.83 | AG316: 0.09 | AH316: AAA | AI316: 3.2799999999999996e-002 | AJ316: =H316+100*O316 -> 169.25 | AK316: 150.4 | AL316: 114 | AM316: 43.6 | AN316: 40 | AO316: 1.4999999999999999e-002 | AP316: 36 | AQ316: 中信转债!
A317: 316 | B317: 128056 | C317: 今飞转债! | D317: 2863 | E317: 今飞凯达 | F317: 汽车 | G317: 零部件制 | H317: 123.494 | I317: -5.0000000000000001e-003 | J317: -1.1899999999999999e-002 | K317: 5.87 | L317: -4.0800000000000003e-002 | M317: 120.2 | N317: 6.69 | O317: 0.40700000000000003 | P317: 87.74 | Q317: 已到 | R317: 3.18年 | S317: 1.18年 | T317: 1.72 | U317: 18 | V317: 8.5999999999999993e-002 | W317: 5.9000000000000004e-002 | X317: 5.2000000000000005e-002 | Y317: 29 | Z317: 1.55 | AA317: -8.6999999999999994e-003 | AB317: -1.9400000000000001e-002 | AC317: -0.11699999999999999 | AD317: -0.121 | AE317: 94.27 | AF317: 96.97 | AG317: 0.41 | AH317: A+ | AI317: 7.1800000000000003e-002 | AJ317: =H317+100*O317 -> 164.19400000000002 | AK317: 159.2 | AL317: 182 | AM317: 62.3 | AN317: 159 | AO317: 1.e-002 | AP317: 46 | AQ317: 今飞转债!
A318: 317 | B318: 128053 | C318: 尚荣转债! | D318: 2551 | E318: 尚荣医疗 | F318: 医药 | G318: 医疗器械 | H318: 147 | I318: 2.6499999999999999e-002 | J318: -1.5900000000000001e-002 | K318: 5.35 | L318: 1.1299999999999999e-002 | M318: 114.3 | N318: 4.88 | O318: 0.34100000000000003 | P318: 109.63 | Q318: 已到 | R318: 3年51天 | S318: 1年51天 | T318: 1.9 | U318: 1397. | V318: 4.9500000000000002 | W318: 4.2000000000000003e-002 | X318: 4.5999999999999999e-002 | Y318: 45 | Z318: 1.43 | AA318: -7.8399999999999997e-002 | AB318: -8.5699999999999998e-002 | AC318: -0.22399999999999998 | AD318: -0.22600000000000001 | AE318: 97.74 | AF318: 101.39 | AG318: 0.94 | AH318: AA | AI318: 3.9800000000000002e-002 | AJ318: =H318+100*O318 -> 181.09999999999999 | AK318: 184.4 | AL318: 290 | AM318: 83 | AN318: 264 | AO318: 3.7000000000000005e-002 | AP318: 21 | AQ318: 尚荣转债!
A319: 318 | B319: 113527 | C319: 维格转债!! | D319: 603518 | E319: 锦泓集团 | F319: 服装纺织 | G319: 服装行业 | H319: 139.3 | I319: -2.0299999999999999e-002 | J319: -1.e-003 | K319: 11.82 | L319: -3.1899999999999998e-002 | M319: 119.5 | N319: 9.85 | O319: 0.161 | P319: 120 | Q319: 已到 | R319: 3年30天 | S319: 1年30天 | T319: 2.86 | U319: 79 | V319: 0.19500000000000001 | W319: 8.199999999999999e-002 | X319: 9.8000000000000004e-002 | Y319: 35 | Z319: 1.44 | AA319: -4.9500000000000002e-002 | AB319: -5.96e-002 | AC319: -0.20499999999999999 | AD319: -0.20800000000000002 | AE319: 96.84 | AF319: 103.21 | AG319: 0.67 | AH319: AA | AI319: 4.9800000000000004e-002 | AJ319: =H319+100*O319 -> 155.40000000000001 | AK319: 158.6 | AL319: 175 | AM319: 55.4 | AN319: 116 | AO319: -8.8000000000000009e-002 | AP319: 67 | AQ319: 维格转债!!
A320: 319 | B320: 113526 | C320: 联泰转债! | D320: 603797 | E320: 联泰环保 | F320: 城市公用 | G320: 三废处理 | H320: 242.76 | I320: 1.e-004 | J320: -1.01e-002 | K320: 6.9 | L320: -1.43e-002 | M320: 110.3 | N320: 5.92 | O320: 1.0800000000000001 | P320: 116.55 | Q320: 已到 | R320: 3年29天 | S320: 1年29天 | T320: 1.93 | U320: 248 | V320: 0.51800000000000002 | W320: 4.8000000000000001e-002 | X320: 5.5999999999999994e-002 | Y320: 40 | Z320: 1.59 | AA320: -0.22899999999999998 | AB320: -0.23300000000000001 | AC320: -0.45299999999999996 | AD320: -0.45399999999999996 | AE320: 98.56 | AF320: 99.51 | AG320: 0.7 | AH320: AA+ | AI320: 3.4799999999999998e-002 | AJ320: =H320+100*O320 -> 350.75999999999999 | AK320: 369 | AL320: 363 | AM320: 269.5 | AN320: 362 | AO320: 5.0000000000000001e-003 | AP320: 7 | AQ320: 联泰转债!
A321: 320 | B321: 123018 | C321: 溢利转债! | D321: 300381 | E321: 溢多利 | F321: 医药 | G321: 原料药 | H321: 205.98 | I321: 5.7999999999999996e-003 | J321: -1.3300000000000001e-002 | K321: 11.3 | L321: -8.8000000000000005e-003 | M321: 113.3 | N321: 8.25 | O321: 0.504 | P321: 136.97 | Q321: 已到 | R321: 2.99年 | S321: 0.99年 | T321: 0.54 | U321: 223 | V321: 2. | W321: 1.e-002 | X321: 1.3000000000000001e-002 | Y321: 55 | Z321: 1.86 | AA321: -0.183 | AB321: -0.19 | AC321: -0.43200000000000005 | AD321: -0.433 | AE321: 95.25 | AF321: 95.58 | AG321: 0.85 | AH321: AA- | AI321: 5.9500000000000004e-002 | AJ321: =H321+100*O321 -> 256.38 | AK321: 275 | AL321: 352 | AM321: 179.4 | AN321: 352 | AO321: 5.4000000000000006e-002 | AP321: 10 | AQ321: 溢利转债!
A322: 321 | B322: 113525 | C322: XD台华转!! | D322: 603055 | E322: 台华新材 | F322: 服装纺织 | G322: 纺织行业 | H322: 219.95 | I322: 6.0999999999999995e-003 | J322: -5.0000000000000001e-004 | K322: 15.82 | L322: 5.6999999999999993e-003 | M322: 113.3 | N322: 7.78 | O322: 8.199999999999999e-002 | P322: 203.34 | Q322: 已到 | R322: 2.98年 | S322: 0.98年 | T322: 1.82 | U322: 44 | V322: 0.109 | W322: 1.3000000000000001e-002 | X322: 2.7000000000000003e-002 | Y322: 137 | Z322: 3.84 | AA322: -0.20199999999999999 | AB322: -0.20800000000000002 | AC322: -0.46200000000000002 | AD322: -0.46399999999999997 | AE322: 97.5 | AF322: 101.41 | AG322: 0.98 | AH322: AA | AI322: 3.85e-002 | AJ322: =H322+100*O322 -> 228.14999999999998 | AK322: 236.6 | AL322: 339 | AM322: 135.1 | AN322: 335 | AO322: -6.7000000000000004e-002 | AP322: 18 | AQ322: XD台华转!!
A323: 322 | B323: 113524 | C323: 奇精转债! | D323: 603677 | E323: 奇精机械 | F323: 家电 | G323: 零部件制 | H323: 118.5 | I323: -4.7999999999999996e-003 | J323: 2.8999999999999998e-003 | K323: 12.58 | L323: -4.6999999999999993e-003 | M323: 116.3 | N323: 13.98 | O323: 0.317 | P323: 89.99 | Q323: 已到 | R323: 2.97年 | S323: 0.97年 | T323: 3.3 | U323: 7.8 | V323: 2.e-002 | W323: 0.13600000000000001 | X323: 0.12300000000000001 | Y323: 24 | Z323: 2.38 | AA323: -6.4000000000000003e-003 | AB323: -1.5900000000000001e-002 | AC323: -0.122 | AD323: -0.125 | AE323: 95.34 | AF323: 98.2 | AG323: 0.4 | AH323: AA- | AI323: 5.9500000000000004e-002 | AJ323: =H323+100*O323 -> 150.19999999999999 | AK323: 147 | AL323: 81 | AM323: 48.8 | AN323: 70 | AO323: 2.6000000000000002e-002 | AP323: 40 | AQ323: 奇精转债!
A324: 323 | B324: 128050 | C324: 钧达转债!! | D324: 2865 | E324: 钧达股份 | F324: 汽车 | G324: 零部件制 | H324: 500.485 | I324: -1.9799999999999998e-002 | J324: 4.1399999999999999e-002 | K324: 73.27 | L324: 2.1600000000000001e-002 | M324: 121.5 | N324: 14.81 | O324: 1.2e-002 | P324: 494.73 | Q324: 已到 | R324: 2.96年 | S324: 0.96年 | T324: 0.64 | U324: 1099. | V324: 3.46 | W324: 6.0000000000000001e-003 | X324: 3.1e-002 | Y324: 100 | Z324: 9.61 | AA324: -0.38299999999999995 | AB324: -0.39000000000000001 | AC324: -0.69900000000000007 | AD324: -0.69900000000000007 | AE324: 95.43 | AF324: 102.65 | AG324: 1 | AH324: AA- | AI324: 5.9500000000000004e-002 | AJ324: =H324+100*O324 -> 501.685 | AK324: 506.2 | AL324: 374 | AM324: 403.6 | AN324: 374 | AO324: 0.151 | AP324: 44 | AQ324: 钧达转债!!
A325: 324 | B325: 110048 | C325: 福能转债!! | D325: 600483 | E325: 福能股份 | F325: 能源电力 | G325: 电力供应 | H325: 257.23 | I325: -2.5399999999999999e-002 | J325: -2.23e-002 | K325: 17.03 | L325: -4.8600000000000004e-002 | M325: 112.3 | N325: 7.85 | O325: 0.18600000000000003 | P325: 216.94 | Q325: 已到 | R325: 2.95年 | S325: 0.95年 | T325: 12.8 | U325: 792 | V325: 0.23300000000000001 | W325: 3.9e-002 | X325: 8.5000000000000006e-002 | Y325: 327 | Z325: 4.2 | AA325: -0.247 | AB325: -0.253 | AC325: -0.53400000000000003 | AD325: -0.53600000000000003 | AE325: 98.13 | AF325: 102.04 | AG325: 0.98 | AH325: AA+ | AI325: 3.3500000000000002e-002 | AJ325: =H325+100*O325 -> 275.83000000000004 | AK325: 297.5 | AL325: 360 | AM325: 195.5 | AN325: 358 | AO325: 3.7999999999999999e-002 | AP325: 9 | AQ325: 福能转债!!
A326: 325 | B326: 128049 | C326: 华源转债! | D326: 2787 | E326: 华源控股 | F326: 造纸包装 | G326: 包装材料 | H326: 112.445 | I326: -5.0000000000000001e-004 | J326: -6.6e-003 | K326: 6.04 | L326: -2.1099999999999997e-002 | M326: 113.5 | N326: 7.37 | O326: 0.37200000000000005 | P326: 81.95 | Q326: 已到 | R326: 2.92年 | S326: 0.92年 | T326: 3.63 | U326: 6 | V326: 1.4999999999999999e-002 | W326: 0.19 | X326: 0.156 | Y326: 19 | Z326: 1.24 | AA326: 3.2000000000000002e-003 | AB326: -5.1000000000000004e-003 | AC326: -8.7100000000000011e-002 | AD326: -9.01e-002 | AE326: 95.63 | AF326: 96.11 | AG326: 0.34 | AH326: AA- | AI326: 5.9500000000000004e-002 | AJ326: =H326+100*O326 -> 149.64499999999998 | AK326: 142.9 | AL326: 43 | AM326: 46.8 | AN326: 58 | AO326: 2.9999999999999999e-002 | AP326: 43 | AQ326: 华源转债!
A327: 326 | B327: 110047 | C327: 山鹰转债 | D327: 600567 | E327: 山鹰国际 | F327: 造纸包装 | G327: 包装用纸 | H327: 120.25 | I327: -2.5999999999999999e-003 | J327: -1.1999999999999999e-003 | K327: 3.27 | L327: -9.1000000000000004e-003 | M327: 116.5 | N327: 3.3 | O327: 0.214 | P327: 99.09 | Q327: 已到 | R327: 2.91年 | S327: 0.91年 | T327: 22.5 | U327: 13 | V327: 5.0000000000000001e-003 | W327: 0.14899999999999999 | X327: 0.14699999999999999 | Y327: 151 | Z327: 0.94 | AA327: -1.1000000000000001e-002 | AB327: -2.0799999999999999e-002 | AC327: -0.14199999999999999 | AD327: -0.14400000000000002 | AE327: 98.3 | AF327: 106.01 | AG327: 0.41 | AH327: AA+ | AI327: 3.3500000000000002e-002 | AJ327: =H327+100*O327 -> 141.65000000000001 | AK327: 141.4 | AL327: 36 | AM327: 35.4 | AN327: 17 | AO327: 3.0000000000000001e-003 | AP327: 27 | AQ327: 山鹰转债
A328: 327 | B328: 128048 | C328: 张行转债 | D328: 2839 | E328: 张家港行 | F328: 金融 | G328: 银行行业 | H328: 123.849 | I328: 4.0000000000000002e-004 | J328: -3.0000000000000001e-003 | K328: 5.72 | L328: -5.1999999999999998e-003 | M328: 112.3 | N328: 5.6 | O328: 0.21299999999999999 | P328: 102.14 | Q328: 已到 | R328: 2.88年 | S328: 无权 | T328: 25 | U328: 9.7 | V328: 3.0000000000000001e-003 | W328: 0.24199999999999999 | X328: 0.247 | Y328: 103 | Z328: 0.89 | AA328: -3.39e-002 | AB328: -4.1299999999999996e-002 | AC328: 无权 | AD328: 无权 | AE328: 无权 | AF328: 102.27 | AG328: 0.5 | AH328: AA+ | AI328: 3.3500000000000002e-002 | AJ328: =H328+100*O328 -> 145.149 | AK328: 145.6 | AL328: 66 | AM328: 43.3 | AN328: 39 | AO328: -3.0000000000000001e-003 | AP328: 11 | AQ328: 张行转债
A329: 328 | B329: 113519 | C329: 长久转债! | D329: 603569 | E329: 长久物流 | F329: 交通运输 | G329: 物流业 | H329: 110.13 | I329: -9.0000000000000011e-003 | J329: 7.4999999999999997e-003 | K329: 7.1 | L329: -2.4700000000000003e-002 | M329: 118.3 | N329: 11.04 | O329: 0.71200000000000008 | P329: 64.31 | Q329: 已到 | R329: 2.87年 | S329: 0.87年 | T329: 6.97 | U329: 17 | V329: 2.2000000000000002e-002 | W329: 0.17499999999999999 | X329: 0.113 | Y329: 40 | Z329: 1.87 | AA329: 2.5600000000000001e-002 | AB329: 1.43e-002 | AC329: -7.3300000000000004e-002 | AD329: -7.6399999999999996e-002 | AE329: 97.9 | AF329: 106.32 | AG329: 0.06 | AH329: AA | AI329: 3.85e-002 | AJ329: =H329+100*O329 -> 181.32999999999998 | AK329: 155.9 | AL329: 164 | AM329: 49.6 | AN329: 81 | AO329: 2.2000000000000002e-002 | AP329: 26 | AQ329: 长久转债!
A330: 329 | B330: 128046 | C330: 利尔转债!! | D330: 2258 | E330: 利尔化学 | F330: 化工 | G330: 农化 | H330: 186.6 | I330: -1.7899999999999999e-002 | J330: 1.1599999999999999e-002 | K330: 33.52 | L330: -6.5000000000000006e-003 | M330: 111.3 | N330: 18.42 | O330: 2.5000000000000001e-002 | P330: 181.98 | Q330: 已到 | R330: 2.81年 | S330: 0.81年 | T330: 8.08 | U330: 79 | V330: 5.2999999999999999e-002 | W330: 4.5999999999999999e-002 | X330: 8.3000000000000004e-002 | Y330: 177 | Z330: 4.08 | AA330: -0.17000000000000001 | AB330: -0.17600000000000002 | AC330: -0.46600000000000003 | AD330: -0.46799999999999997 | AE330: 98.12 | AF330: 100.25 | AG330: 0.97 | AH330: AA | AI330: 3.85e-002 | AJ330: =H330+100*O330 -> 189.09999999999999 | AK330: 191.2 | AL330: 303 | AM330: 91 | AN330: 292 | AO330: 7.9000000000000001e-002 | AP330: 8 | AQ330: 利尔转债!!
A331: 330 | B331: 128044 | C331: 岭南转债! | D331: 2717 | E331: 岭南股份 | F331: 城市公用 | G331: 生态环境 | H331: 122.978 | I331: 6.4000000000000003e-003 | J331: -1.6399999999999998e-002 | K331: 3.53 | L331: -1.67e-002 | M331: 110.3 | N331: 3.43 | O331: 0.19500000000000001 | P331: 102.92 | Q331: 已到 | R331: 2.64年 | S331: 0.64年 | T331: 6.59 | U331: 84 | V331: 0.10300000000000001 | W331: 0.111 | X331: 0.114 | Y331: 59 | Z331: 1.26 | AA331: -4.1100000000000005e-002 | AB331: -4.7899999999999998e-002 | AC331: -0.22 | AD331: -0.22399999999999998 | AE331: 97.2 | AF331: 94.96 | AG331: 0.6 | AH331: AA- | AI331: 5.9500000000000004e-002 | AJ331: =H331+100*O331 -> 142.47800000000001 | AK331: 143 | AL331: 44 | AM331: 45.8 | AN331: 53 | AO331: 6.4000000000000001e-002 | AP331: 55 | AQ331: 岭南转债!
A332: 331 | B332: 123015 | C332: 蓝盾转债!! | D332: 300297 | E332: 蓝盾股份 | F332: 计算机及 | G332: 软件开发 | H332: 240.52 | I332: -4.0999999999999995e-003 | J332: 4.0999999999999995e-003 | K332: 3.6 | L332: -2.7000000000000003e-002 | M332: 111.3 | N332: 5.79 | O332: 2.8700000000000001 | P332: 62.18 | Q332: 已到 | R332: 2.63年 | S332: 0.63年 | T332: 1 | U332: 107 | V332: 0.44400000000000001 | W332: 2.2000000000000002e-002 | X332: 1.3999999999999999e-002 | Y332: 45 | Z332: 2.53 | AA332: -0.25700000000000001 | AB332: -0.26200000000000001 | AC332: -0.73699999999999999 | AD332: -0.7390000000000001 | AE332: 92.97 | AF332: 82.93 | AG332: 0 | AH332: BBB- | AI332: 0.12050000000000001 | AJ332: =H332+100*O332 -> 527.51999999999998 | AK332: 418.9 | AL332: 366 | AM332: 325.9 | AN332: 367 | AO332: -1.3000000000000001e-002 | AP332: 14 | AQ332: 蓝盾转债!!
A333: 332 | B333: 113516 | C333: 苏农转债! | D333: 603323 | E333: 苏农银行 | F333: 金融 | G333: 银行行业 | H333: 117.83 | I333: -3.4999999999999996e-003 | J333: 2.8000000000000004e-003 | K333: 4.86 | L333: -2.0999999999999999e-003 | M333: 113.3 | N333: 5.37 | O333: 0.30199999999999999 | P333: 90.5 | Q333: 已到 | R333: 2.60年 | S333: 无权 | T333: 12.9 | U333: 2.2 | V333: 1.e-003 | W333: 0.14699999999999999 | X333: 0.13300000000000001 | Y333: 88 | Z333: 0.68 | AA333: -1.52e-002 | AB333: -2.4199999999999999e-002 | AC333: 无权 | AD333: 无权 | AE333: 无权 | AF333: 104.14 | AG333: 0.33 | AH333: AA+ | AI333: 3.3500000000000002e-002 | AJ333: =H333+100*O333 -> 148.03 | AK333: 145.2 | AL333: 62 | AM333: 41 | AN333: 27 | AO333: -3.0000000000000001e-003 | AP333: 23 | AQ333: 苏农转债!
A334: 333 | B334: 123014 | C334: 凯发转债! | D334: 300407 | E334: 凯发电气 | F334: 能源电力 | G334: 电力设备 | H334: 133.7 | I334: -9.5999999999999992e-003 | J334: -9.1999999999999998e-003 | K334: 8.17 | L334: -3.4300000000000004e-002 | M334: 107.5 | N334: 8.05 | O334: 0.317 | P334: 101.49 | Q334: 已到 | R334: 1.59年 | S334: 回售内 | T334: 1.16 | U334: 17 | V334: 0.106 | W334: 4.7e-002 | X334: 4.7e-002 | Y334: 25 | Z334: 1.8 | AA334: -0.129 | AB334: -0.13699999999999998 | AC334: 回售内 | AD334: 回售内 | AE334: 100.25 | AF334: 96.58 | AG334: 0.55 | AH334: A+ | AI334: 7.0499999999999993e-002 | AJ334: =H334+100*O334 -> 165.39999999999998 | AK334: 165.9 | AL334: 226 | AM334: 65.7 | AN334: 185 | AO334: -5.2000000000000005e-002 | AP334: 15 | AQ334: 凯发转债!
A335: 334 | B335: 128042 | C335: 凯中转债! | D335: 2823 | E335: 凯中精密 | F335: 能源电力 | G335: 电力设备 | H335: 118.731 | I335: -1.4000000000000002e-003 | J335: -7.0999999999999995e-003 | K335: 10.61 | L335: -4.07e-002 | M335: 115.3 | N335: 12.86 | O335: 0.439 | P335: 82.5 | Q335: 已到 | R335: 2.59年 | S335: 0.59年 | T335: 4.16 | U335: 15 | V335: 3.1e-002 | W335: 0.13600000000000001 | X335: 0.113 | Y335: 30 | Z335: 2.32 | AA335: -1.1399999999999999e-002 | AB335: -2.1700000000000001e-002 | AC335: -0.193 | AD335: -0.19699999999999998 | AE335: 98.92 | AF335: 104.7 | AG335: 0.21 | AH335: AA | AI335: 3.85e-002 | AJ335: =H335+100*O335 -> 162.631 | AK335: 155 | AL335: 158 | AM335: 50.3 | AN335: 84 | AO335: -4.4999999999999998e-002 | AP335: 24 | AQ335: 凯中转债!
A336: 335 | B336: 123013 | C336: 横河转债! | D336: 300539 | E336: 横河精密 | F336: 机械装备 | G336: 专用设备 | H336: 303.878 | I336: -4.6999999999999993e-003 | J336: -5.6999999999999993e-003 | K336: 7.6 | L336: -2.9399999999999999e-002 | M336: 114 | N336: 9.04 | O336: 2.6099999999999999 | P336: 84.07 | Q336: 已到 | R336: 2.58年 | S336: 0.58年 | T336: 0.38 | U336: 81 | V336: 0.69299999999999995 | W336: 2.3e-002 | X336: 1.9e-002 | Y336: 17 | Z336: 3.42 | AA336: -0.32000000000000001 | AB336: -0.32600000000000001 | AC336: -0.90799999999999992 | AD336: -0.91000000000000003 | AE336: 97.09 | AF336: 95.95 | AG336: 0.35 | AH336: A+ | AI336: 7.0499999999999993e-002 | AJ336: =H336+100*O336 -> 564.87799999999993 | AK336: 523.7 | AL336: 377 | AM336: 426.6 | AN336: 376 | AO336: -4.5999999999999999e-002 | AP336: 12 | AQ336: 横河转债!
A337: 336 | B337: 123012 | C337: 万顺转债! | D337: 300057 | E337: 万顺新材 | F337: 有色金属 | G337: 铝金属 | H337: 198.689 | I337: 1.e-004 | J337: -2.3900000000000001e-002 | K337: 9.93 | L337: -2.46e-002 | M337: 109.3 | N337: 5.27 | O337: 5.4000000000000006e-002 | P337: 188.43 | Q337: 已到 | R337: 2.57年 | S337: 0.57年 | T337: 1.23 | U337: 415 | V337: 1.6899999999999999 | W337: 1.8000000000000002e-002 | X337: 3.4000000000000002e-002 | Y337: 68 | Z337: 1.88 | AA337: -0.20999999999999999 | AB337: -0.215 | AC337: -0.68400000000000005 | AD337: -0.68599999999999994 | AE337: 97.58 | AF337: 94.48 | AG337: 0.97 | AH337: AA- | AI337: 5.9500000000000004e-002 | AJ337: =H337+100*O337 -> 204.089 | AK337: 209 | AL337: 324 | AM337: 111.4 | AN337: 317 | AO337: 4.9000000000000002e-002 | AP337: 23 | AQ337: 万顺转债!
A338: 337 | B338: 123011 | C338: 德尔转债! | D338: 300473 | E338: 德尔股份 | F338: 汽车 | G338: 零部件制 | H338: 119.702 | I338: -3.7000000000000002e-003 | J338: -2.7000000000000001e-003 | K338: 24.25 | L338: -2.9999999999999999e-002 | M338: 115.3 | N338: 31.38 | O338: 0.54899999999999993 | P338: 77.28 | Q338: 已到 | R338: 2.56年 | S338: 0.56年 | T338: 2.51 | U338: 41 | V338: 0.13600000000000001 | W338: 7.6999999999999999e-002 | X338: 5.9000000000000004e-002 | Y338: 33 | Z338: 1.54 | AA338: -1.4800000000000001e-002 | AB338: -2.5099999999999997e-002 | AC338: -0.21199999999999999 | AD338: -0.217 | AE338: 97.62 | AF338: 99.68 | AG338: 0.21 | AH338: AA- | AI338: 5.9500000000000004e-002 | AJ338: =H338+100*O338 -> 174.60199999999998 | AK338: 162.1 | AL338: 200 | AM338: 62.4 | AN338: 162 | AO338: -2.8999999999999998e-002 | AP338: 37 | AQ338: 德尔转债!
A339: 338 | B339: 128041 | C339: 盛路转债!! | D339: 2446 | E339: 盛路通信 | F339: 通信互联 | G339: 通信设备 | H339: 274.2 | I339: 4.0999999999999995e-003 | J339: -5.6999999999999993e-003 | K339: 5.86 | L339: -5.1000000000000004e-003 | M339: 113.3 | N339: 6.82 | O339: 2.1899999999999999 | P339: 85.92 | Q339: 已到 | R339: 2.56年 | S339: 0.56年 | T339: 0.53 | U339: 46 | V339: 0.317 | W339: 1.e-002 | X339: 9.0000000000000011e-003 | Y339: 53 | Z339: 1.74 | AA339: -0.29499999999999998 | AB339: -0.30099999999999999 | AC339: -0.8909999999999999 | AD339: -0.89300000000000002 | AE339: 99.06 | AF339: 102.79 | AG339: 0.31 | AH339: AA | AI339: 3.85e-002 | AJ339: =H339+100*O339 -> 493.19999999999999 | AK339: 462.5 | AL339: 370 | AM339: 359.7 | AN339: 370 | AO339: -8.5000000000000006e-002 | AP339: 10 | AQ339: 盛路转债!!
A340: 339 | B340: 110045 | C340: 海澜转债! | D340: 600398 | E340: 海澜之家 | F340: 服装纺织 | G340: 服装行业 | H340: 116.79 | I340: -8.9999999999999998e-004 | J340: 1.5e-003 | K340: 6.37 | L340: 1.6000000000000001e-003 | M340: 110.3 | N340: 7.04 | O340: 0.29100000000000004 | P340: 90.48 | Q340: 已到 | R340: 2.55年 | S340: 0.55年 | T340: 29.5 | U340: 6.3 | V340: 2.e-003 | W340: 0.107 | X340: 9.6999999999999989e-002 | Y340: 275 | Z340: 1.95 | AA340: -2.2400000000000003e-002 | AB340: -2.9700000000000001e-002 | AC340: -0.193 | AD340: -0.19600000000000001 | AE340: 98.87 | AF340: 101.52 | AG340: 0.33 | AH340: AA+ | AI340: 3.3500000000000002e-002 | AJ340: =H340+100*O340 -> 145.89000000000001 | AK340: 143.1 | AL340: 45 | AM340: 41.6 | AN340: 31 | AO340: -2.e-003 | AP340: 42 | AQ340: 海澜转债!
A341: 340 | B341: 123010 | C341: 博世转债! | D341: 300422 | E341: 博世科 | F341: 城市公用 | G341: 三废处理 | H341: 112.001 | I341: -4.8999999999999998e-003 | J341: -1.4000000000000002e-003 | K341: 8.7 | L341: -2.58e-002 | M341: 111.3 | N341: 11.26 | O341: 0.45000000000000001 | P341: 77.26 | Q341: 已到 | R341: 2.53年 | S341: 0.53年 | T341: 4.3 | U341: 2.8 | V341: 6.0000000000000001e-003 | W341: 9.8000000000000004e-002 | X341: 7.5999999999999998e-002 | Y341: 44 | Z341: 1.36 | AA341: -2.5000000000000001e-003 | AB341: -1.0700000000000001e-002 | AC341: -0.13699999999999998 | AD341: -0.14199999999999999 | AE341: 97.82 | AF341: 96.43 | AG341: 0.25 | AH341: AA- | AI341: 5.9500000000000004e-002 | AJ341: =H341+100*O341 -> 157.001 | AK341: 146.7 | AL341: 78 | AM341: 48.9 | AN341: 72 | AO341: -1.1000000000000001e-002 | AP341: 32 | AQ341: 博世转债!
A342: 341 | B342: 127007 | C342: 湖广转债! | D342: 665 | E342: 湖北广电 | F342: 传媒娱乐 | G342: 影视娱乐 | H342: 140.5 | I342: 0.14199999999999999 | J342: -5.57e-002 | K342: 7.65 | L342: 0.10099999999999999 | M342: 111.3 | N342: 5.58 | O342: 2.5000000000000001e-002 | P342: 137.1 | Q342: 已到 | R342: 2.51年 | S342: 0.51年 | T342: 11 | U342: 4037. | V342: 2.6899999999999999 | W342: 0.14599999999999999 | X342: 0.20000000000000001 | Y342: 75 | Z342: 1.32 | AA342: -9.01e-002 | AB342: -9.74e-002 | AC342: -0.42399999999999999 | AD342: -0.42799999999999999 | AE342: 99.57 | AF342: 102.62 | AG342: 0.86 | AH342: AA+ | AI342: 3.3500000000000002e-002 | AJ342: =H342+100*O342 -> 143. | AK342: 143.9 | AL342: 47 | AM342: 41.3 | AN342: 29 | AO342: 0.69700000000000006 | AP342: 30 | AQ342: 湖广转债!
A343: 342 | B343: 110044 | C343: 广电转债!! | D343: 600831 | E343: 广电网络 | F343: 传媒娱乐 | G343: 影视娱乐 | H343: 207.73 | I343: -5.1000000000000004e-003 | J343: 3.2000000000000002e-003 | K343: 5.91 | L343: -6.7000000000000002e-003 | M343: 111.3 | N343: 6.87 | O343: 1.4099999999999999 | P343: 86.03 | Q343: 已到 | R343: 2.50年 | S343: 0.50年 | T343: 0.71 | U343: 41 | V343: 0.27600000000000002 | W343: 1.7000000000000001e-002 | X343: 1.4999999999999999e-002 | Y343: 42 | Z343: 1.12 | AA343: -0.223 | AB343: -0.22899999999999998 | AC343: -0.78700000000000003 | AD343: -0.78900000000000003 | AE343: 99.26 | AF343: 101.42 | AG343: 0.29 | AH343: AA | AI343: 3.85e-002 | AJ343: =H343+100*O343 -> 348.73000000000002 | AK343: 329.4 | AL343: 361 | AM343: 228 | AN343: 361 | AO343: 6.7000000000000004e-002 | AP343: 9 | AQ343: 广电转债!!
A344: 343 | B344: 128040 | C344: 华通转债! | D344: 2758 | E344: 浙农股份 | F344: 医药 | G344: 医药商业 | H344: 126.288 | I344: 1.26e-002 | J344: -2.3e-003 | K344: 10.8 | L344: 1.7899999999999999e-002 | M344: 111.3 | N344: 10.15 | O344: 0.187 | P344: 106.4 | Q344: 已到 | R344: 2.47年 | S344: 0.47年 | T344: 2.22 | U344: 36 | V344: 0.128 | W344: 4.2000000000000003e-002 | X344: 4.4999999999999998e-002 | Y344: 53 | Z344: 1.61 | AA344: -5.0700000000000002e-002 | AB344: -5.8499999999999996e-002 | AC344: -0.31900000000000001 | AD344: -0.32299999999999995 | AE344: 99.39 | AF344: 101.56 | AG344: 0.57 | AH344: AA | AI344: 3.85e-002 | AJ344: =H344+100*O344 -> 144.988 | AK344: 146.2 | AL344: 68 | AM344: 44.6 | AN344: 46 | AO344: 3.5000000000000003e-002 | AP344: 30 | AQ344: 华通转债!
A345: 344 | B345: 128039 | C345: 三力转债! | D345: 2224 | E345: 三 力 士 | F345: 机械装备 | G345: 专用设备 | H345: 117.08 | I345: -5.3e-003 | J345: 0. | K345: 5.09 | L345: -1.3600000000000001e-002 | M345: 108.8 | N345: 5.79 | O345: 0.33200000000000002 | P345: 87.91 | Q345: 已到 | R345: 2.45年 | S345: 0.45年 | T345: 2.02 | U345: 4.5 | V345: 1.9e-002 | W345: 5.5e-002 | X345: 4.8000000000000001e-002 | Y345: 37 | Z345: 1.55 | AA345: -2.9900000000000003e-002 | AB345: -3.6299999999999999e-002 | AC345: -0.22500000000000001 | AD345: -0.22899999999999998 | AE345: 97.99 | AF345: 94.64 | AG345: 0.39 | AH345: AA- | AI345: 5.9500000000000004e-002 | AJ345: =H345+100*O345 -> 150.28 | AK345: 146.2 | AL345: 70 | AM345: 48.3 | AN345: 65 | AO345: 1.e-003 | AP345: 29 | AQ345: 三力转债!
A346: 345 | B346: 128036 | C346: 金农转债!! | D346: 2548 | E346: 金新农 | F346: 农业 | G346: 畜牧业 | H346: 124.387 | I346: -4.1999999999999997e-003 | J346: -1.2699999999999999e-002 | K346: 5.98 | L346: -5.0799999999999998e-002 | M346: 109.3 | N346: 6.93 | O346: 0.441 | P346: 86.29 | Q346: 已到 | R346: 2.20年 | S346: 0.20年 | T346: 1.46 | U346: 85 | V346: 0.46700000000000003 | W346: 3.5000000000000003e-002 | X346: 2.9999999999999999e-002 | Y346: 41 | Z346: 1.77 | AA346: -5.8099999999999999e-002 | AB346: -6.5299999999999997e-002 | AC346: -0.52700000000000002 | AD346: -0.53500000000000003 | AE346: 99.66 | AF346: 96.49 | AG346: 0.33 | AH346: AA- | AI346: 5.9500000000000004e-002 | AJ346: =H346+100*O346 -> 168.48699999999999 | AK346: 162.5 | AL346: 207 | AM346: 62.8 | AN346: 165 | AO346: 5.4000000000000006e-002 | AP346: 15 | AQ346: 金农转债!!
A347: 346 | B347: 128037 | C347: 岩土转债! | D347: 2542 | E347: 中化岩土 | F347: 建筑 | G347: 建筑工程 | H347: 114.19 | I347: -2.9999999999999997e-004 | J347: -2.3e-003 | K347: 2.89 | L347: -6.8999999999999999e-003 | M347: 111.3 | N347: 3.1 | O347: 0.22500000000000001 | P347: 93.23 | Q347: 已到 | R347: 2.22年 | S347: 0.22年 | T347: 5.99 | U347: 19 | V347: 2.7999999999999997e-002 | W347: 0.115 | X347: 0.107 | Y347: 52 | Z347: 1.32 | AA347: -1.1699999999999999e-002 | AB347: -2.0899999999999998e-002 | AC347: -0.30199999999999999 | AD347: -0.311 | AE347: 100.34 | AF347: 102.52 | AG347: 0.37 | AH347: AA | AI347: 3.85e-002 | AJ347: =H347+100*O347 -> 136.69 | AK347: 135.2 | AL347: 15 | AM347: 32.6 | AN347: 11 | AO347: 1.8000000000000002e-002 | AP347: 53 | AQ347: 岩土转债!
A348: 347 | B348: 127006 | C348: 敖东转债! | D348: 623 | E348: 吉林敖东 | F348: 金融 | G348: 证券行业 | H348: 118.684 | I348: 1.7000000000000001e-003 | J348: 1.5e-003 | K348: 18.19 | L348: 9.3999999999999986e-003 | M348: 107.4 | N348: 20.22 | O348: 0.31900000000000001 | P348: 89.96 | Q348: 已到 | R348: 2.21年 | S348: 0.21年 | T348: 24.1 | U348: 17 | V348: 6.0000000000000001e-003 | W348: 0.114 | X348: 0.10199999999999999 | Y348: 212 | Z348: 0.88 | AA348: -4.4699999999999997e-002 | AB348: -5.0599999999999999e-002 | AC348: -0.41799999999999998 | AD348: -0.42299999999999999 | AE348: 99.81 | AF348: 99.94 | AG348: 0.34 | AH348: AA+ | AI348: 3.3500000000000002e-002 | AJ348: =H348+100*O348 -> 150.584 | AK348: 147.4 | AL348: 85 | AM348: 47.5 | AN348: 61 | AO348: 5.7000000000000002e-002 | AP348: 25 | AQ348: 敖东转债!
A349: 348 | B349: 127005 | C349: 长证转债! | D349: 783 | E349: 长江证券 | F349: 金融 | G349: 证券行业 | H349: 127 | I349: -8.9999999999999998e-004 | J349: -2.8000000000000004e-003 | K349: 7.4 | L349: -6.7000000000000002e-003 | M349: 108.3 | N349: 7.13 | O349: 0.22399999999999998 | P349: 103.79 | Q349: 已到 | R349: 2.21年 | S349: 无权 | T349: 50 | U349: 28 | V349: 4.0000000000000001e-003 | W349: 0.122 | X349: 0.127 | Y349: 409 | Z349: 1.38 | AA349: -7.0800000000000002e-002 | AB349: -7.7100000000000002e-002 | AC349: 无权 | AD349: 无权 | AE349: 无权 | AF349: 101.26 | AG349: 0.56 | AH349: AAA | AI349: 3.15e-002 | AJ349: =H349+100*O349 -> 149.40000000000001 | AK349: 150.2 | AL349: 111 | AM349: 48.9 | AN349: 73 | AO349: 3.0000000000000001e-003 | AP349: 11 | AQ349: 长证转债!
A350: 349 | B350: 113505 | C350: 杭电转债! | D350: 603618 | E350: 杭电股份 | F350: 能源电力 | G350: 电力设备 | H350: 122.77 | I350: -6.0000000000000001e-003 | J350: -3.3e-003 | K350: 7.13 | L350: -1.9299999999999998e-002 | M350: 111.3 | N350: 7.08 | O350: 0.21899999999999997 | P350: 100.71 | Q350: 已到 | R350: 2.19年 | S350: 0.19年 | T350: 7.5 | U350: 22 | V350: 2.4e-002 | W350: 0.152 | X350: 0.153 | Y350: 49 | Z350: 1.86 | AA350: -4.4500000000000005e-002 | AB350: -5.3399999999999996e-002 | AC350: -0.50800000000000001 | AD350: -0.51600000000000001 | AE350: 100.43 | AF350: 102.62 | AG350: 0.48 | AH350: AA | AI350: 3.85e-002 | AJ350: =H350+100*O350 -> 144.66999999999999 | AK350: 144.8 | AL350: 57 | AM350: 42.2 | AN350: 37 | AO350: -2.5000000000000001e-002 | AP350: 43 | AQ350: 杭电转债!
A351: 350 | B351: 113504 | C351: 艾华转债!! | D351: 603989 | E351: 艾华集团 | F351: 电子 | G351: 元器件制 | H351: 204.31 | I351: -1.11e-002 | J351: 7.8000000000000005e-003 | K351: 38.53 | L351: -3.4000000000000002e-003 | M351: 109.3 | N351: 20.81 | O351: 0.10300000000000001 | P351: 185.15 | Q351: 已到 | R351: 2.18年 | S351: 0.18年 | T351: 4.63 | U351: 9.4 | V351: 1.e-002 | W351: 2.9999999999999999e-002 | X351: 5.5999999999999994e-002 | Y351: 154 | Z351: 5.42 | AA351: -0.253 | AB351: -0.25800000000000001 | AC351: <-100% | AD351: <-100% | AE351: 100.47 | AF351: 100.82 | AG351: 0.98 | AH351: AA | AI351: 3.85e-002 | AJ351: =H351+100*O351 -> 214.61000000000001 | AK351: 223.5 | AL351: 332 | AM351: 122.7 | AN351: 326 | AO351: -3.7000000000000005e-002 | AP351: 10 | AQ351: 艾华转债!!
A352: 351 | B352: 128035 | C352: 大族转债! | D352: 2008 | E352: 大族激光 | F352: 机械装备 | G352: 专用设备 | H352: 134.7 | I352: 1.5e-003 | J352: -7.6e-003 | K352: 53.42 | L352: -1.09e-002 | M352: 107.4 | N352: 51.9 | O352: 0.309 | P352: 102.93 | Q352: 已到 | R352: 2年43天 | S352: 43天 | T352: 23 | U352: 54 | V352: 1.7000000000000001e-002 | W352: 4.0000000000000001e-002 | X352: 4.2000000000000003e-002 | Y352: 570 | Z352: 5.37 | AA352: -0.10300000000000001 | AB352: -0.10800000000000001 | AC352: -0.86900000000000011 | AD352: -0.88900000000000001 | AE352: 102.84 | AF352: 100.26 | AG352: 0.56 | AH352: AA+ | AI352: 3.3500000000000002e-002 | AJ352: =H352+100*O352 -> 165.59999999999999 | AK352: 166.5 | AL352: 230 | AM352: 63.6 | AN352: 174 | AO352: 9.3000000000000013e-002 | AP352: 17 | AQ352: 大族转债!
A353: 352 | B353: 110043 | C353: 无锡转债! | D353: 600908 | E353: 无锡银行 | F353: 金融 | G353: 银行行业 | H353: 121.6 | I353: -1.1000000000000001e-003 | J353: 2.8000000000000004e-003 | K353: 5.67 | L353: 3.4999999999999996e-003 | M353: 108.3 | N353: 5.61 | O353: 0.20300000000000001 | P353: 101.07 | Q353: 已到 | R353: 2年36天 | S353: 无权 | T353: 29.2 | U353: 45 | V353: 1.3000000000000001e-002 | W353: 0.27699999999999997 | X353: 0.28000000000000003 | Y353: 106 | Z353: 0.82 | AA353: -5.4400000000000004e-002 | AB353: -6.13e-002 | AC353: 无权 | AD353: 无权 | AE353: 无权 | AF353: 101.17 | AG353: 0.5 | AH353: AA+ | AI353: 3.3500000000000002e-002 | AJ353: =H353+100*O353 -> 141.90000000000001 | AK353: 142.1 | AL353: 41 | AM353: 41 | AN353: 25 | AO353: 5.0000000000000001e-003 | AP353: 21 | AQ353: 无锡转债!
A354: 353 | B354: 128034 | C354: 江银转债! | D354: 2807 | E354: 江阴银行 | F354: 金融 | G354: 银行行业 | H354: 110.72 | I354: 1.4000000000000002e-003 | J354: -3.0999999999999999e-003 | K354: 3.83 | L354: -5.1999999999999998e-003 | M354: 108.3 | N354: 4.32 | O354: 0.249 | P354: 88.66 | Q354: 已到 | R354: 2年32天 | S354: 无权 | T354: 17.6 | U354: 13 | V354: 6.9999999999999993e-003 | W354: 0.21100000000000002 | X354: 0.187 | Y354: 83 | Z354: 0.69 | AA354: -1.0700000000000001e-002 | AB354: -1.8000000000000002e-002 | AC354: 无权 | AD354: 无权 | AE354: 无权 | AF354: 101.2 | AG354: 0.31 | AH354: AA+ | AI354: 3.3500000000000002e-002 | AJ354: =H354+100*O354 -> 135.62 | AK354: 132.8 | AL354: 10 | AM354: 31.6 | AN354: 9 | AO354: 9.0000000000000011e-003 | AP354: 29 | AQ354: 江银转债!
A355: 354 | B355: 128033 | C355: 迪龙转债! | D355: 2658 | E355: 雪迪龙 | F355: 城市公用 | G355: 三废处理 | H355: 124.1 | I355: -1.55e-002 | J355: -5.5000000000000005e-003 | K355: 8.24 | L355: -4.8499999999999995e-002 | M355: 108.8 | N355: 8.56 | O355: 0.28899999999999998 | P355: 96.26 | Q355: 已到 | R355: 2年2.1天 | S355: 2.1天 | T355: 2.98 | U355: 40 | V355: 0.10800000000000001 | W355: 5.7000000000000002e-002 | X355: 5.5e-002 | Y355: 52 | Z355: 2.12 | AA355: -6.4600000000000005e-002 | AB355: -7.2099999999999997e-002 | AC355: <-100% | AD355: <-100% | AE355: 100.9 | AF355: 101.01 | AG355: 0.43 | AH355: AA | AI355: 3.85e-002 | AJ355: =H355+100*O355 -> 153. | AK355: 151.9 | AL355: 132 | AM355: 50.9 | AN355: 92 | AO355: -5.5e-002 | AP355: 33 | AQ355: 迪龙转债!
A356: 355 | B356: 113017 | C356: 吉视转债! | D356: 601929 | E356: 吉视传媒 | F356: 传媒娱乐 | G356: 影视娱乐 | H356: 117 | I356: 9.1000000000000004e-003 | J356: -6.8999999999999999e-003 | K356: 2.26 | L356: 4.4000000000000003e-003 | M356: 108.8 | N356: 2.23 | O356: 0.154 | P356: 101.35 | Q356: 已到 | R356: 2年2.1天 | S356: 2.1天 | T356: 15.6 | U356: 164 | V356: 8.9999999999999997e-002 | W356: 0.222 | X356: 0.22500000000000001 | Y356: 70 | Z356: 1.05 | AA356: -3.6200000000000003e-002 | AB356: -4.4000000000000004e-002 | AC356: -0.84099999999999997 | AD356: -0.85599999999999998 | AE356: 100.98 | AF356: 101.97 | AG356: 0.5 | AH356: AA+ | AI356: 3.3500000000000002e-002 | AJ356: =H356+100*O356 -> 132.40000000000001 | AK356: 132.7 | AL356: 9 | AM356: 30.7 | AN356: 7 | AO356: 0.115 | AP356: 68 | AQ356: 吉视转债!
A357: 356 | B357: 128030 | C357: 天康转债!! | D357: 2100 | E357: 天康生物 | F357: 农业 | G357: 畜牧业 | H357: 207.777 | I357: -4.3e-003 | J357: 1.6000000000000001e-003 | K357: 10.99 | L357: -2.7000000000000001e-003 | M357: 111.3 | N357: 7.4 | O357: 0.39899999999999997 | P357: 148.51 | Q357: 已到 | R357: 1.99年 | S357: 回售内 | T357: 0.88 | U357: 39 | V357: 0.21299999999999999 | W357: 6.0000000000000001e-003 | X357: 9.0000000000000011e-003 | Y357: 149 | Z357: 2.1 | AA357: -0.27600000000000002 | AB357: -0.28199999999999997 | AC357: 回售内 | AD357: 回售内 | AE357: 100.3 | AF357: 101.9 | AG357: 1 | AH357: AA | AI357: 3.85e-002 | AJ357: =H357+100*O357 -> 247.67699999999999 | AK357: 267 | AL357: 348 | AM357: 165.1 | AN357: 348 | AO357: 0.185 | AP357: 9 | AQ357: 天康转债!!
A358: 357 | B358: 128029 | C358: 太阳转债!! | D358: 2078 | E358: 太阳纸业 | F358: 造纸包装 | G358: 造纸行业 | H358: 161.2 | I358: -6.3e-003 | J358: -7.000000000000001e-004 | K358: 11.29 | L358: -6.9999999999999993e-003 | M358: 107 | N358: 8.45 | O358: 0.20699999999999999 | P358: 133.61 | Q358: 已到 | R358: 0.99年 | S358: 回售内 | T358: 9.09 | U358: 16 | V358: 1.1000000000000001e-002 | W358: 2.9999999999999999e-002 | X358: 4.0000000000000001e-002 | Y358: 303 | Z358: 1.6 | AA358: -0.34499999999999997 | AB358: -0.35200000000000004 | AC358: 回售内 | AD358: 回售内 | AE358: 100.25 | AF358: 102.81 | AG358: 1 | AH358: AA+ | AI358: 3.1300000000000001e-002 | AJ358: =H358+100*O358 -> 181.89999999999998 | AK358: 188.8 | AL358: 296 | AM358: 86 | AN358: 275 | AO358: -2.3e-002 | AP358: 7 | AQ358: 太阳转债!!
A359: 358 | B359: 123004 | C359: 铁汉转债! | D359: 300197 | E359: 节能铁汉 | F359: 城市公用 | G359: 生态环境 | H359: 109.144 | I359: -2.2000000000000001e-003 | J359: 7.000000000000001e-004 | K359: 2.82 | L359: -1.7399999999999999e-002 | M359: 107.5 | N359: 3.82 | O359: 0.47799999999999998 | P359: 73.82 | Q359: 已到 | R359: 1.98年 | S359: 回售内 | T359: 8.03 | U359: 8.1 | V359: 9.0000000000000011e-003 | W359: 0.10099999999999999 | X359: 7.400000000000001e-002 | Y359: 80 | Z359: 1.24 | AA359: -7.7000000000000002e-003 | AB359: -1.47e-002 | AC359: 回售内 | AD359: 回售内 | AE359: 100.25 | AF359: 99.8 | AG359: 0.09 | AH359: AA | AI359: 3.85e-002 | AJ359: =H359+100*O359 -> 156.94400000000002 | AK359: 144.5 | AL359: 54 | AM359: 44.2 | AN359: 43 | AO359: -1.e-003 | AP359: 49 | AQ359: 铁汉转债!
A360: 359 | B360: 128026 | C360: 众兴转债! | D360: 2772 | E360: 众兴菌业 | F360: 农业 | G360: 种植业 | H360: 111.55 | I360: -8.9999999999999998e-004 | J360: -8.0000000000000004e-004 | K360: 8.41 | L360: -3.44e-002 | M360: 107.8 | N360: 11.36 | O360: 0.50700000000000001 | P360: 74.03 | Q360: 已到 | R360: 1.97年 | S360: 回售内 | T360: 4.09 | U360: 13 | V360: 2.7999999999999997e-002 | W360: 0.11900000000000001 | X360: 8.8000000000000009e-002 | Y360: 34 | Z360: 1.14 | AA360: -1.7399999999999999e-002 | AB360: -2.4700000000000003e-002 | AC360: 回售内 | AD360: 回售内 | AE360: 100.3 | AF360: 96.31 | AG360: 0.05 | AH360: AA- | AI360: 5.9500000000000004e-002 | AJ360: =H360+100*O360 -> 162.25 | AK360: 149.1 | AL360: 102 | AM360: 48.8 | AN360: 69 | AO360: 0. | AP360: 57 | AQ360: 众兴转债!
A361: 360 | B361: 128025 | C361: 特一转债! | D361: 2728 | E361: 特一药业 | F361: 医药 | G361: 化学制药 | H361: 135 | I361: 5.9999999999999995e-004 | J361: -2.06e-002 | K361: 16.08 | L361: -2.6600000000000002e-002 | M361: 107.5 | N361: 13.8 | O361: 0.159 | P361: 116.52 | Q361: 已到 | R361: 1.95年 | S361: 回售内 | T361: 2.98 | U361: 911 | V361: 2.2400000000000002 | W361: 8.4000000000000005e-002 | X361: 9.6999999999999989e-002 | Y361: 36 | Z361: 3.28 | AA361: -0.111 | AB361: -0.11699999999999999 | AC361: 回售内 | AD361: 回售内 | AE361: 100.25 | AF361: 96.13 | AG361: 0.75 | AH361: AA- | AI361: 5.9500000000000004e-002 | AJ361: =H361+100*O361 -> 150.90000000000001 | AK361: 153.5 | AL361: 143 | AM361: 53.2 | AN361: 104 | AO361: 0.10400000000000001 | AP361: 47 | AQ361: 特一转债!
A362: 361 | B362: 128023 | C362: 亚太转债! | D362: 2284 | E362: 亚太股份 | F362: 汽车 | G362: 零部件制 | H362: 129.6 | I362: -1.0800000000000001e-002 | J362: -5.1999999999999998e-003 | K362: 9.66 | L362: -4.4500000000000005e-002 | M362: 109.8 | N362: 10.34 | O362: 0.38700000000000001 | P362: 93.42 | Q362: 已到 | R362: 1.94年 | S362: 回售内 | T362: 9.99 | U362: 80 | V362: 6.0999999999999999e-002 | W362: 0.14000000000000001 | X362: 0.13100000000000001 | Y362: 71 | Z362: 2.84 | AA362: -8.2400000000000001e-002 | AB362: -9.0800000000000006e-002 | AC362: 回售内 | AD362: 回售内 | AE362: 100.3 | AF362: 102.09 | AG362: 0.36 | AH362: AA | AI362: 3.85e-002 | AJ362: =H362+100*O362 -> 168.30000000000001 | AK362: 165.8 | AL362: 224 | AM362: 63.7 | AN362: 175 | AO362: -2.5000000000000001e-002 | AP362: 54 | AQ362: 亚太转债!
A363: 362 | B363: 128022 | C363: 众信转债! | D363: 2707 | E363: 众信旅游 | F363: 旅游餐饮 | G363: 旅游 | H363: 115.8 | I363: -4.3e-003 | J363: 4.3e-003 | K363: 5.19 | L363: 9.7000000000000003e-003 | M363: 107.5 | N363: 7.92 | O363: 0.76700000000000002 | P363: 65.53 | Q363: 已到 | R363: 1.93年 | S363: 回售内 | T363: 4.55 | U363: 29 | V363: 5.5e-002 | W363: 9.6999999999999989e-002 | X363: 6.3e-002 | Y363: 47 | Z363: 9.11 | AA363: -3.7999999999999999e-002 | AB363: -4.4900000000000002e-002 | AC363: 回售内 | AD363: 回售内 | AE363: 100.25 | AF363: 92.65 | AG363: 0 | AH363: A | AI363: 8.0500000000000002e-002 | AJ363: =H363+100*O363 -> 192.5 | AK363: 166.1 | AL363: 229 | AM363: 65.8 | AN363: 186 | AO363: -6.0000000000000001e-003 | AP363: 38 | AQ363: 众信转债!
A364: 363 | B364: 128021 | C364: 兄弟转债!! | D364: 2562 | E364: 兄弟科技 | F364: 医药 | G364: 原料药 | H364: 122.642 | I364: -1.49e-002 | J364: 5.0000000000000001e-004 | K364: 4.61 | L364: -4.5499999999999999e-002 | M364: 107.5 | N364: 5.19 | O364: 0.38100000000000001 | P364: 88.82 | Q364: 已到 | R364: 1.93年 | S364: 回售内 | T364: 2.65 | U364: 37 | V364: 0.11199999999999999 | W364: 5.4000000000000006e-002 | X364: 4.8000000000000001e-002 | Y364: 49 | Z364: 1.67 | AA364: -6.6600000000000006e-002 | AB364: -7.3300000000000004e-002 | AC364: 回售内 | AD364: 回售内 | AE364: 100.25 | AF364: 100.01 | AG364: 0.32 | AH364: AA | AI364: 3.85e-002 | AJ364: =H364+100*O364 -> 160.74199999999999 | AK364: 156.5 | AL364: 165 | AM364: 56.2 | AN364: 121 | AO364: 2.7999999999999997e-002 | AP364: 18 | AQ364: 兄弟转债!!
A365: 364 | B365: 123002 | C365: 国祯转债!! | D365: 300388 | E365: 节能国祯 | F365: 城市公用 | G365: 三废处理 | H365: 117.836 | I365: -4.8999999999999998e-003 | J365: -5.0000000000000001e-004 | K365: 7.63 | L365: -1.4199999999999999e-002 | M365: 107.5 | N365: 8.36 | O365: 0.29100000000000004 | P365: 91.27 | Q365: 已到 | R365: 1.92年 | S365: 回售内 | T365: 2.52 | U365: 2.3 | V365: 8.0000000000000002e-003 | W365: 4.7e-002 | X365: 4.2999999999999997e-002 | Y365: 53 | Z365: 1.45 | AA365: -4.7100000000000003e-002 | AB365: -5.4100000000000002e-002 | AC365: 回售内 | AD365: 回售内 | AE365: 100.25 | AF365: 100.05 | AG365: 0.38 | AH365: AA | AI365: 3.85e-002 | AJ365: =H365+100*O365 -> 146.93600000000001 | AK365: 144.4 | AL365: 53 | AM365: 44.2 | AN365: 42 | AO365: 3.0000000000000001e-003 | AP365: 18 | AQ365: 国祯转债!!
A366: 365 | B366: 110038 | C366: 济川转债! | D366: 600566 | E366: 济川药业 | F366: 医药 | G366: 中药 | H366: 133.27 | I366: 2.92e-002 | J366: 5.1500000000000004e-002 | K366: 27.45 | L366: 0.10000000000000001 | M366: 106 | N366: 23.4 | O366: 0.13600000000000001 | P366: 117.31 | Q366: 已到 | R366: 0.89年 | S366: 回售内 | T366: 6.27 | U366: 1457. | V366: 1.71 | W366: 2.6000000000000002e-002 | X366: 2.9999999999999999e-002 | Y366: 244 | Z366: 2.85 | AA366: -0.22800000000000001 | AB366: -0.23800000000000002 | AC366: 回售内 | AD366: 回售内 | AE366: 101 | AF366: 102.71 | AG366: 0.8 | AH366: AA | AI366: 3.6299999999999999e-002 | AJ366: =H366+100*O366 -> 146.87 | AK366: 149.2 | AL366: 104 | AM366: 46.5 | AN366: 57 | AO366: 0.35899999999999999 | AP366: 23 | AQ366: 济川转债!
A367: 366 | B367: 113502 | C367: 嘉澳转债! | D367: 603822 | E367: 嘉澳环保 | F367: 化工 | G367: 化工 | H367: 128.68 | I367: -5.3e-003 | J367: -9.7000000000000003e-003 | K367: 41.81 | L367: -3.6400000000000002e-002 | M367: 109.8 | N367: 44.64 | O367: 0.374 | P367: 93.66 | Q367: 已到 | R367: 1.88年 | S367: 回售内 | T367: 1.84 | U367: 10 | V367: 4.2000000000000003e-002 | W367: 5.9999999999999998e-002 | X367: 5.5999999999999994e-002 | Y367: 31 | Z367: 3.69 | AA367: -8.1699999999999995e-002 | AB367: -9.0399999999999994e-002 | AC367: 回售内 | AD367: 回售内 | AE367: 100.3 | AF367: 98.61 | AG367: 0.41 | AH367: AA- | AI367: 5.9500000000000004e-002 | AJ367: =H367+100*O367 -> 166.08000000000001 | AK367: 163.7 | AL367: 214 | AM367: 63.4 | AN367: 171 | AO367: -6.2e-002 | AP367: 33 | AQ367: 嘉澳转债!
A368: 367 | B368: 113016 | C368: 小康转债!! | D368: 601127 | E368: 小康股份 | F368: 汽车 | G368: 零部件制 | H368: 398.49 | I368: -0.113 | J368: 1.3300000000000001e-002 | K368: 63.19 | L368: -0.10000000000000001 | M368: 107.8 | N368: 16.96 | O368: 7.0000000000000007e-002 | P368: 372.58 | Q368: 已到 | R368: 1.87年 | S368: 回售内 | T368: 2.07 | U368: 1073. | V368: 1.24 | W368: 2.e-003 | X368: 9.0000000000000011e-003 | Y368: 859 | Z368: 11.95 | AA368: -0.49099999999999999 | AB368: -0.49399999999999999 | AC368: 回售内 | AD368: 回售内 | AE368: 100.3 | AF368: 96.87 | AG368: 1 | AH368: AA- | AI368: 5.9500000000000004e-002 | AJ368: =H368+100*O368 -> 405.49000000000001 | AK368: 424.4 | AL368: 367 | AM368: 324.1 | AN368: 366 | AO368: -0.12 | AP368: 33 | AQ368: 小康转债!!
A369: 368 | B369: 128017 | C369: 金禾转债!! | D369: 2597 | E369: 金禾实业 | F369: 化工 | G369: 化工 | H369: 249.998 | I369: -7.9000000000000008e-003 | J369: 6.8999999999999999e-003 | K369: 47.95 | L369: -1.e-003 | M369: 107.5 | N369: 21.97 | O369: 0.14499999999999999 | P369: 218.25 | Q369: 已到 | R369: 1.85年 | S369: 回售内 | T369: 5.52 | U369: 74 | V369: 5.2999999999999999e-002 | W369: 2.1000000000000001e-002 | X369: 4.4999999999999998e-002 | Y369: 269 | Z369: 5.18 | AA369: -0.36799999999999999 | AB369: -0.37200000000000005 | AC369: 回售内 | AD369: 回售内 | AE369: 100.25 | AF369: 100.29 | AG369: 0.99 | AH369: AA | AI369: 3.85e-002 | AJ369: =H369+100*O369 -> 264.49799999999999 | AK369: 281.7 | AL369: 356 | AM369: 181.5 | AN369: 353 | AO369: -3.2000000000000001e-002 | AP369: 9 | AQ369: 金禾转债!!
A370: 369 | B370: 113013 | C370: 国君转债! | D370: 601211 | E370: 国泰君安 | F370: 金融 | G370: 证券行业 | H370: 122.88 | I370: 1.e-004 | J370: -5.0000000000000001e-004 | K370: 17.48 | L370: -1.1000000000000001e-003 | M370: 106.8 | N370: 18.45 | O370: 0.29699999999999999 | P370: 94.74 | Q370: 已到 | R370: 1.53年 | S370: 无权 | T370: 69.9 | U370: 22 | V370: 3.0000000000000001e-003 | W370: 4.4999999999999998e-002 | X370: 4.2999999999999997e-002 | Y370: 1557. | Z370: 1.17 | AA370: -8.8399999999999992e-002 | AB370: -9.5899999999999999e-002 | AC370: 无权 | AD370: 无权 | AE370: 无权 | AF370: 101.9 | AG370: 0.37 | AH370: AAA | AI370: 3.15e-002 | AJ370: =H370+100*O370 -> 152.57999999999998 | AK370: 151 | AL370: 121 | AM370: 49.1 | AN370: 76 | AO370: 1.3999999999999999e-002 | AP370: 11 | AQ370: 国君转债!
A371: 370 | B371: 128015 | C371: 久其转债!! | D371: 2279 | E371: 久其软件 | F371: 计算机及 | G371: 软件开发 | H371: 108.294 | I371: -1.e-004 | J371: 0. | K371: 4.57 | L371: -1.3000000000000001e-002 | M371: 109.5 | N371: 6.97 | O371: 0.65200000000000002 | P371: 65.57 | Q371: 已到 | R371: 1.45年 | S371: 回售内 | T371: 7.79 | U371: 11 | V371: 1.3000000000000001e-002 | W371: 0.23999999999999999 | X371: 0.157 | Y371: 32 | Z371: 4.06 | AA371: 7.7000000000000002e-003 | AB371: -4.5000000000000005e-003 | AC371: 回售内 | AD371: 回售内 | AE371: 100.25 | AF371: 99.28 | AG371: 0 | AH371: A+ | AI371: 7.0499999999999993e-002 | AJ371: =H371+100*O371 -> 173.494 | AK371: 151 | AL371: 122 | AM371: 50.8 | AN371: 89 | AO371: 6.0000000000000001e-003 | AP371: 70 | AQ371: 久其转债!!
A372: 371 | B372: 127004 | C372: 模塑转债!! | D372: 700 | E372: 模塑科技 | F372: 汽车 | G372: 零部件制 | H372: 167.35 | I372: -1.47e-002 | J372: 1.47e-002 | K372: 5.03 | L372: -1.7600000000000001e-002 | M372: 111.8 | N372: 7.24 | O372: 1.4099999999999999 | P372: 69.48 | Q372: 已到 | R372: 1.44年 | S372: 回售内 | T372: 1.31 | U372: 82 | V372: 0.37 | W372: 2.7999999999999997e-002 | X372: 2.e-002 | Y372: 46 | Z372: 2.03 | AA372: -0.247 | AB372: -0.25800000000000001 | AC372: 回售内 | AD372: 回售内 | AE372: 100.3 | AF372: 101.02 | AG372: 0 | AH372: AA- | AI372: 5.9500000000000004e-002 | AJ372: =H372+100*O372 -> 308.35000000000002 | AK372: 265.2 | AL372: 347 | AM372: 164.2 | AN372: 347 | AO372: 1.6e-002 | AP372: 24 | AQ372: 模塑转债!!
A373: 372 | B373: 128014 | C373: 永东转债! | D373: 2753 | E373: 永东股份 | F373: 化工 | G373: 化工 | H373: 115.39 | I373: 0. | J373: -1.7000000000000001e-003 | K373: 9.2 | L373: -2.3399999999999997e-002 | M373: 109.8 | N373: 12.52 | O373: 0.56999999999999995 | P373: 73.48 | Q373: 已到 | R373: 1.31年 | S373: 回售内 | T373: 3.37 | U373: 7.1 | V373: 1.8000000000000002e-002 | W373: 9.8000000000000004e-002 | X373: 7.2000000000000008e-002 | Y373: 35 | Z373: 1.65 | AA373: -3.7699999999999997e-002 | AB373: -5.0799999999999998e-002 | AC373: 回售内 | AD373: 回售内 | AE373: 100.3 | AF373: 101.89 | AG373: 0.07 | AH373: AA- | AI373: 5.9500000000000004e-002 | AJ373: =H373+100*O373 -> 172.38999999999999 | AK373: 157.3 | AL373: 168 | AM373: 55.4 | AN373: 117 | AO373: -4.2000000000000003e-002 | AP373: 37 | AQ373: 永东转债!
A374: 373 | B374: 113011 | C374: 光大转债 | D374: 601818 | E374: 光大银行 | F374: 金融 | G374: 银行行业 | H374: 113.36 | I374: 2.5000000000000001e-003 | J374: -3.4000000000000002e-003 | K374: 3.32 | L374: -3.0000000000000001e-003 | M374: 106.8 | N374: 3.55 | O374: 0.21199999999999999 | P374: 93.52 | Q374: 已到 | R374: 1.22年 | S374: 无权 | T374: 242 | U374: 274 | V374: 1.e-002 | W374: 0.13500000000000001 | X374: 0.126 | Y374: 1794. | Z374: 0.49 | AA374: -4.8099999999999997e-002 | AB374: -5.7999999999999996e-002 | AC374: 无权 | AD374: 无权 | AE374: 无权 | AF374: 102.87 | AG374: 0.31 | AH374: AAA | AI374: 3.15e-002 | AJ374: =H374+100*O374 -> 134.56 | AK374: 133.2 | AL374: 11 | AM374: 30.3 | AN374: 6 | AO374: -1.2e-002 | AP374: 16 | AQ374: 光大转债
A375: 374 | B375: 128013 | C375: 洪涛转债! | D375: 2325 | E375: 洪涛股份 | F375: 建筑 | G375: 装饰工程 | H375: 124.313 | I375: -1.1200000000000002e-002 | J375: -1.1000000000000001e-003 | K375: 2.85 | L375: -1.38e-002 | M375: 108 | N375: 2.31 | O375: 8.0000000000000002e-003 | P375: 123.38 | Q375: 已到 | R375: 0.59年 | S375: 回售内 | T375: 10.6 | U375: 108 | V375: 8.199999999999999e-002 | W375: 0.28899999999999998 | X375: 0.35600000000000004 | Y375: 37 | Z375: 1.28 | AA375: -0.21100000000000002 | AB375: -0.23100000000000001 | AC375: 回售内 | AD375: 回售内 | AE375: 100.33 | AF375: 102.72 | AG375: 0.89 | AH375: A- | AI375: 8.8300000000000003e-002 | AJ375: =H375+100*O375 -> 125.113 | AK375: 125.2 | AL375: 4 | AM375: 22.5 | AN375: 2 | AO375: 2.7000000000000003e-002 | AP375: 100 | AQ375: 洪涛转债!
A376: 375 | B376: 127003 | C376: 海印转债! | D376: 861 | E376: 海印股份 | F376: 商业零售 | G376: 商场 | H376: 118.703 | I376: -1.18e-002 | J376: -5.1000000000000004e-003 | K376: 3.1 | L376: -5.2000000000000005e-002 | M376: 110 | N376: 2.99 | O376: 0.14499999999999999 | P376: 103.68 | Q376: 已到 | R376: 0.45年 | S376: 回售内 | T376: 6.74 | U376: 47 | V376: 5.7999999999999996e-002 | W376: 9.3000000000000013e-002 | X376: 9.6999999999999989e-002 | Y376: 72 | Z376: 1.96 | AA376: -0.155 | AB376: -0.18899999999999997 | AC376: 回售内 | AD376: 回售内 | AE376: 100.33 | AF376: 108.23 | AG376: 0.32 | AH376: AA | AI376: 3.6499999999999998e-002 | AJ376: =H376+100*O376 -> 133.203 | AK376: 133.7 | AL376: 13 | AM376: 25.5 | AN376: 4 | AO376: -4.0000000000000001e-002 | AP376: 73 | AQ376: 海印转债!
A377: 376 | B377: 113009 | C377: 广汽转债!* | D377: 601238 | E377: 广汽集团 | F377: 汽车 | G377: 乘用车 | H377: 108.77 | I377: -1.5700000000000002e-002 | J377: 1.7000000000000001e-003 | K377: 15.03 | L377: -2.2099999999999998e-002 | M377: 106 | N377: 13.92 | O377: 6.9999999999999993e-003 | P377: 107.97 | Q377: 已到 | R377: 28天 | S377: 回售内 | T377: 24.2 | U377: 312 | V377: 0.11800000000000001 | W377: 1.6e-002 | X377: 1.7000000000000001e-002 | Y377: 1558. | Z377: 1.78 | AA377: -0.28499999999999998 | AB377: -0.52200000000000002 | AC377: 回售内 | AD377: 回售内 | AE377: 100.27 | AF377: 105.76 | AG377: 0.63 | AH377: AAA | AI377: 2.9500000000000002e-002 | AJ377: =H377+100*O377 -> 109.47 | AK377: 109.6 | AL377: 1 | AM377: 3.8 | AN377: 1 | AO377: -6.9000000000000006e-002 | AP377: 22 | AQ377: 广汽转债!*
A378: 377 | B378: 110034 | C378: 九州转债!* | D378: 600998 | E378: 九州通 | F378: 医药 | G378: 医药商业 | H378: 107.68 | I378: -1.e-003 | J378: 1.e-003 | K378: 13.8 | L378: 5.1000000000000004e-003 | M378: 108 | N378: 17.83 | O378: 0.39100000000000001 | P378: 77.4 | Q378: 已到 | R378: 21天 | S378: 回售内 | T378: 15 | U378: 47 | V378: 2.8999999999999998e-002 | W378: 5.7999999999999996e-002 | X378: 4.4999999999999998e-002 | Y378: 259 | Z378: 1.24 | AA378: 5.2600000000000001e-002 | AB378: -0.187 | AC378: 回售内 | AD378: 回售内 | AE378: 103 | AF378: 107.81 | AG378: 0 | AH378: AA+ | AI378: 3.15e-002 | AJ378: =H378+100*O378 -> 146.78 | AK378: 138 | AL378: 23 | AM378: 30.2 | AN378: 5 | AO378: 1.e-003 | AP378: 29 | AQ378: 九州转债!*