A1: 序号 | B1: 转债代码 | C1: 转债名称 | D1: 股票代码 | E1: 股票名称 | F1: 行业 | G1: 子行业 | H1: 转债价格 | I1: 涨跌 | J1: 日内套利 | K1: 股价 | L1: 涨跌 | M1: 剩余本息 | N1: 转股价格 | O1: 转股溢价率 | P1: 转股价值 | Q1: 距离转股日 | R1: 剩余年限 | S1: 回售年限 | T1: 转债余额 | U1: 转债成交额 | V1: 转债换手率 | W1: 余额/市值 | X1: 余额/股本 | Y1: 股票市值 | Z1: P/B | AA1: 税前收益率 | AB1: 税后收益率 | AC1: 税前回售收益 | AD1: 税后回售收益 | AE1: 回售价值 | AF1: 纯债价值 | AG1: 弹性 | AH1: 信用 | AI1: 折现率 | AJ1: 双低 | AK1: 老式双低 | AL1: 老式排名 | AM1: 新式双低 | AN1: 新式排名 | AO1: MA20乖离 | AP1: 热门度 | AQ1: 转债名称
A2: 1 | B2: 123137 | C2: 锦浪转债 | D2: 300763 | E2: 锦浪科技 | F2: 能源电力 | G2: 太阳能 | H2: 134.3 | I2: 2.3e-003 | J2: 1.55e-002 | K2: 247.4 | L2: 2.4900000000000002e-002 | M2: 118.2 | N2: 227.02 | O2: 0.23199999999999998 | P2: 108.98 | Q2: 5月14天 | R2: 5.94年 | S2: 3.94年 | T2: 8.97 | U2: 733 | V2: 0.60299999999999998 | W2: 1.4999999999999999e-002 | X2: 1.6e-002 | Y2: 613 | Z2: 28.64 | AA2: -2.1600000000000001e-002 | AB2: -2.6800000000000001e-002 | AC2: -6.1799999999999994e-002 | AD2: -6.3299999999999995e-002 | AE2: 80.94 | AF2: 83.07 | AG2: 0.72 | AH2: AA- | AI2: 6.2300000000000001e-002 | AJ2: =H2+100*O2 -> 157.5 | AK2: 159.6 | AL2: 229 | AM2: 76.5 | AN2: 296 | AO2: 7.0999999999999994e-002 | AP2: 3 | AQ2: 锦浪转债
A3: 2 | B3: 118005 | C3: 天奈转债 | D3: 688116 | E3: 天奈科技 | F3: 化工 | G3: 化工 | H3: 129.61 | I3: -2.7200000000000002e-002 | J3: 2.3e-003 | K3: 137.27 | L3: -4.0099999999999997e-002 | M3: 115.1 | N3: 153.67 | O3: 0.45100000000000001 | P3: 89.33 | Q3: 5月7天 | R3: 5.90年 | S3: 3.90年 | T3: 8.3 | U3: 91 | V3: 8.3000000000000004e-002 | W3: 2.6000000000000002e-002 | X3: 2.3e-002 | Y3: 319 | Z3: 17.05 | AA3: -2.0299999999999999e-002 | AB3: -2.4700000000000003e-002 | AC3: -5.4000000000000006e-002 | AD3: -5.5500000000000001e-002 | AE3: 81.2 | AF3: 81.11 | AG3: 0.62 | AH3: AA- | AI3: 6.2300000000000001e-002 | AJ3: =H3+100*O3 -> 174.71000000000001 | AK3: 169.9 | AL3: 301 | AM3: 88.7 | AN3: 326 | AO3: -3.4000000000000002e-002 | AP3: 1 | AQ3: 天奈转债
A4: 3 | B4: 127053 | C4: N豪美转 | D4: 2988 | E4: 豪美新材 | F4: 有色金属 | G4: 铝金属 | H4: 116.68 | I4: 0.16699999999999998 | J4: 0. | K4: 17.86 | L4: -3.7200000000000004e-002 | M4: 124 | N4: 21.51 | O4: 0.40500000000000003 | P4: 83.03 | Q4: 4月25天 | R4: 5.89年 | S4: 3.89年 | T4: 8.24 | U4: 760 | V4: 0.78400000000000003 | W4: 0.19800000000000001 | X4: 0.16500000000000001 | Y4: 42 | Z4: 1.89 | AA4: 1.06e-002 | AB4: 3.7000000000000002e-003 | AC4: -2.8399999999999998e-002 | AD4: -3.0099999999999998e-002 | AE4: 81.5 | AF4: 87.44 | AG4: 0.51 | AH4: AA- | AI4: 6.2300000000000001e-002 | AJ4: =H4+100*O4 -> 157.18000000000001 | AK4: 150.3 | AL4: 139 | AM4: 62.9 | AN4: 204 | AO4: -2.5000000000000001e-002 | AP4: 1 | AQ4: N豪美转
A5: 4 | B5: 113639 | C5: 华正转债 | D5: 603186 | E5: 华正新材 | F5: 电子 | G5: 元器件制 | H5: 117.33 | I5: -1.84e-002 | J5: 2.0999999999999999e-003 | K5: 32.87 | L5: -3.7200000000000004e-002 | M5: 112.5 | N5: 39.09 | O5: 0.39500000000000002 | P5: 84.09 | Q5: 4月25天 | R5: 5.89年 | S5: 3.89年 | T5: 5.7 | U5: 50 | V5: 7.4999999999999997e-002 | W5: 0.122 | X5: 0.10300000000000001 | Y5: 47 | Z5: 2.85 | AA5: -7.1999999999999998e-003 | AB5: -1.1000000000000001e-002 | AC5: -3.1699999999999999e-002 | AD5: -3.3099999999999997e-002 | AE5: 89.2 | AF5: 91.47 | AG5: 0.44 | AH5: AA+ | AI5: 3.6299999999999999e-002 | AJ5: =H5+100*O5 -> 156.82999999999998 | AK5: 150.6 | AL5: 144 | AM5: 59.1 | AN5: 173 | AO5: -3.4000000000000002e-002 | AP5: 2 | AQ5: 华正转债
A6: 5 | B6: 123136 | C6: 城市转债 | D6: 300778 | E6: 新城市 | F6: 建筑 | G6: 建筑工程 | H6: 141.6 | I6: -3.7999999999999999e-002 | J6: 3.2000000000000001e-002 | K6: 20.95 | L6: -9.4999999999999998e-003 | M6: 120.7 | N6: 21.18 | O6: 0.43200000000000005 | P6: 98.91 | Q6: 4月24天 | R6: 5.88年 | S6: 3.88年 | T6: 4.6 | U6: 388 | V6: 0.58999999999999997 | W6: 0.17600000000000002 | X6: 0.17399999999999999 | Y6: 26 | Z6: 2.63 | AA6: -2.7200000000000002e-002 | AB6: -3.3000000000000002e-002 | AC6: -7.4700000000000003e-002 | AD6: -7.6200000000000004e-002 | AE6: 81.28 | AF6: 85.12 | AG6: 0.64 | AH6: AA- | AI6: 6.2300000000000001e-002 | AJ6: =H6+100*O6 -> 184.80000000000001 | AK6: 184.3 | AL6: 328 | AM6: 99.2 | AN6: 342 | AO6: 1.9e-002 | AP6: 3 | AQ6: 城市转债
A7: 6 | B7: 113053 | C7: 隆22转债 | D7: 601012 | E7: 隆基股份 | F7: 能源电力 | G7: 太阳能 | H7: 126.35 | I7: -8.0000000000000002e-003 | J7: 3.3e-003 | K7: 77.8 | L7: -8.8000000000000005e-003 | M7: 111.2 | N7: 82.65 | O7: 0.34200000000000003 | P7: 94.13 | Q7: 4月8天 | R7: 5.84年 | S7: 3.84年 | T7: 70 | U7: 410 | V7: 4.5999999999999999e-002 | W7: 1.7000000000000001e-002 | X7: 1.6e-002 | Y7: 4211. | Z7: 9.15 | AA7: -2.1899999999999999e-002 | AB7: -2.53e-002 | AC7: -5.0300000000000004e-002 | AD7: -5.16e-002 | AE7: 89.95 | AF7: 91.59 | AG7: 0.54 | AH7: AAA | AI7: 3.4300000000000004e-002 | AJ7: =H7+100*O7 -> 160.55000000000001 | AK7: 158.6 | AL7: 219 | AM7: 67 | AN7: 233 | AO7: 8.5999999999999993e-002 | AP7: 8 | AQ7: 隆22转债
A8: 7 | B8: 118004 | C8: 博瑞转债! | D8: 688166 | E8: 博瑞医药 | F8: 医药 | G8: 原料药 | H8: 122.27 | I8: -2.e-003 | J8: 1.9e-003 | K8: 29.33 | L8: -2.9999999999999997e-004 | M8: 121 | N8: 35.68 | O8: 0.48700000000000004 | P8: 82.2 | Q8: 4月7天 | R8: 5.84年 | S8: 3.84年 | T8: 4.65 | U8: 24 | V8: 4.2000000000000003e-002 | W8: 3.9e-002 | X8: 3.2000000000000001e-002 | Y8: 120 | Z8: 7.6 | AA8: -1.8e-003 | AB8: -7.9000000000000008e-003 | AC8: -4.0099999999999997e-002 | AD8: -4.1900000000000007e-002 | AE8: 81.78 | AF8: 85.64 | AG8: 0.52 | AH8: AA- | AI8: 6.2300000000000001e-002 | AJ8: =H8+100*O8 -> 170.97 | AK8: 162.3 | AL8: 255 | AM8: 76.7 | AN8: 297 | AO8: -6.0000000000000001e-003 | AP8: 3 | AQ8: 博瑞转债!
A9: 8 | B9: 113638 | C9: 台21转债 | D9: 603055 | E9: 台华新材 | F9: 服装纺织 | G9: 纺织行业 | H9: 122.72 | I9: -3.5999999999999999e-003 | J9: 0. | K9: 14.38 | L9: -8.3000000000000001e-003 | M9: 117.1 | N9: 16.87 | O9: 0.44 | P9: 85.24 | Q9: 4月2天 | R9: 5.82年 | S9: 3.82年 | T9: 6 | U9: 5.6 | V9: 8.0000000000000002e-003 | W9: 4.8000000000000001e-002 | X9: 4.0999999999999995e-002 | Y9: 125 | Z9: 3.49 | AA9: -8.199999999999999e-003 | AB9: -1.32e-002 | AC9: -4.1900000000000007e-002 | AD9: -4.3499999999999997e-002 | AE9: 88.28 | AF9: 92.91 | AG9: 0.43 | AH9: AA | AI9: 4.1299999999999996e-002 | AJ9: =H9+100*O9 -> 166.72 | AK9: 160.2 | AL9: 232 | AM9: 67.3 | AN9: 236 | AO9: -4.2000000000000003e-002 | AP9: 2 | AQ9: 台21转债
A10: 9 | B10: 123135 | C10: 泰林转债! | D10: 300813 | E10: 泰林生物 | F10: 医药 | G10: 医疗器械 | H10: 170.06 | I10: -2.2000000000000002e-002 | J10: 4.07e-002 | K10: 76.93 | L10: 3.0499999999999999e-002 | M10: 121.5 | N10: 87.38 | O10: 0.93200000000000005 | P10: 88.04 | Q10: 4月1天 | R10: 5.82年 | S10: 3.82年 | T10: 2.1 | U10: 1024. | V10: 2.8100000000000001 | W10: 5.2999999999999999e-002 | X10: 4.5999999999999999e-002 | Y10: 40 | Z10: 8.24 | AA10: -5.7300000000000004e-002 | AB10: -6.3e-002 | AC10: -0.111 | AD10: -0.113 | AE10: 79.24 | AF10: 81.31 | AG10: 0.61 | AH10: A+ | AI10: 7.3300000000000004e-002 | AJ10: =H10+100*O10 -> 263.25999999999999 | AK10: 252.1 | AL10: 360 | AM10: 170.8 | AN10: 364 | AO10: 5.7999999999999996e-002 | AP10: 3 | AQ10: 泰林转债!
A11: 10 | B11: 123134 | C11: 卡倍转债! | D11: 300863 | E11: 卡倍亿 | F11: 汽车 | G11: 零部件制 | H11: 192 | I11: 2.0299999999999999e-002 | J11: -6.7000000000000002e-003 | K11: 79.35 | L11: 2.2799999999999997e-002 | M11: 121 | N11: 92.5 | O11: 1.24 | P11: 85.78 | Q11: 3月28天 | R11: 5.81年 | S11: 3.81年 | T11: 2.79 | U11: 4973. | V11: 8.9199999999999999 | W11: 6.4000000000000001e-002 | X11: 5.5e-002 | Y11: 44 | Z11: 6.92 | AA11: -7.7600000000000002e-002 | AB11: -8.3000000000000004e-002 | AC11: -0.13600000000000001 | AD11: -0.13800000000000001 | AE11: 78.63 | AF11: 80.87 | AG11: 0.6 | AH11: A+ | AI11: 7.3300000000000004e-002 | AJ11: =H11+100*O11 -> 316. | AK11: 298.2 | AL11: 368 | AM11: 217.3 | AN11: 368 | AO11: 5.7999999999999996e-002 | AP11: 4 | AQ11: 卡倍转债!
A12: 11 | B12: 110084 | C12: 贵燃转债 | D12: 600903 | E12: 贵州燃气 | F12: 石油天然 | G12: 天然气 | H12: 118.78 | I12: -4.1100000000000005e-002 | J12: 2.76e-002 | K12: 9.74 | L12: -2.4e-002 | M12: 115.1 | N12: 10.17 | O12: 0.23999999999999999 | P12: 95.77 | Q12: 3月28天 | R12: 5.81年 | S12: 3.81年 | T12: 10 | U12: 303 | V12: 0.251 | W12: 8.9999999999999997e-002 | X12: 8.5999999999999993e-002 | Y12: 111 | Z12: 3.92 | AA12: -5.5000000000000005e-003 | AB12: -1.01e-002 | AC12: -3.4000000000000002e-002 | AD12: -3.5699999999999996e-002 | AE12: 88.3 | AF12: 91.35 | AG12: 0.56 | AH12: AA | AI12: 4.1299999999999996e-002 | AJ12: =H12+100*O12 -> 142.78 | AK12: 141.8 | AL12: 57 | AM12: 50.4 | AN12: 96 | AO12: 3.2000000000000001e-002 | AP12: 5 | AQ12: 贵燃转债
A13: 12 | B13: 113052 | C13: 兴业转债 | D13: 601166 | E13: 兴业银行 | F13: 金融 | G13: 银行行业 | H13: 113.81 | I13: -1.03e-002 | J13: 3.2000000000000002e-003 | K13: 21.71 | L13: -1.6799999999999999e-002 | M13: 114.4 | N13: 25.51 | O13: 0.33700000000000002 | P13: 85.1 | Q13: 3月27天 | R13: 5.81年 | S13: 无权 | T13: 500 | U13: 921 | V13: 1.6e-002 | W13: 0.111 | X13: 9.4e-002 | Y13: 4510. | Z13: 0.78 | AA13: 8.9999999999999998e-004 | AB13: -3.4999999999999996e-003 | AC13: 无权 | AD13: 无权 | AE13: 无权 | AF13: 94.35 | AG13: 0.42 | AH13: AAA | AI13: 3.4300000000000004e-002 | AJ13: =H13+100*O13 -> 147.50999999999999 | AK13: 142.5 | AL13: 61 | AM13: 48.2 | AN13: 79 | AO13: -2.6000000000000002e-002 | AP13: 11 | AQ13: 兴业转债
A14: 13 | B14: 127052 | C14: 西子转债 | D14: 2534 | E14: 西子洁能 | F14: 机械装备 | G14: 通用设备 | H14: 125 | I14: -1.9699999999999999e-002 | J14: 6.8999999999999999e-003 | K14: 25.04 | L14: -2.5699999999999997e-002 | M14: 115.1 | N14: 28.08 | O14: 0.40200000000000002 | P14: 89.17 | Q14: 3月27天 | R14: 5.81年 | S14: 3.81年 | T14: 11.1 | U14: 22 | V14: 1.6e-002 | W14: 5.9999999999999998e-002 | X14: 5.2999999999999999e-002 | Y14: 185 | Z14: 5.36 | AA14: -1.43e-002 | AB14: -1.89e-002 | AC14: -4.6500000000000007e-002 | AD14: -4.8099999999999997e-002 | AE14: 88.33 | AF14: 91.38 | AG14: 0.5 | AH14: AA | AI14: 4.1299999999999996e-002 | AJ14: =H14+100*O14 -> 165.19999999999999 | AK14: 160.8 | AL14: 241 | AM14: 69.4 | AN14: 261 | AO14: -3.0000000000000001e-003 | AP14: 3 | AQ14: 西子转债
A15: 14 | B15: 113637 | C15: 华翔转债 | D15: 603112 | E15: 华翔股份 | F15: 机械装备 | G15: 专用设备 | H15: 136.08 | I15: -2.46e-002 | J15: 1.3100000000000001e-002 | K15: 15.31 | L15: -1.54e-002 | M15: 121 | N15: 12.99 | O15: 0.155 | P15: 117.86 | Q15: 3月25天 | R15: 5.80年 | S15: 3.80年 | T15: 8 | U15: 29 | V15: 2.6000000000000002e-002 | W15: 0.12 | X15: 0.14099999999999999 | Y15: 67 | Z15: 3.36 | AA15: -2.0400000000000001e-002 | AB15: -2.64e-002 | AC15: -6.6199999999999995e-002 | AD15: -6.7900000000000002e-002 | AE15: 81.96 | AF15: 85.82 | AG15: 0.75 | AH15: AA- | AI15: 6.2300000000000001e-002 | AJ15: =H15+100*O15 -> 151.58000000000001 | AK15: 154.3 | AL15: 182 | AM15: 68.5 | AN15: 251 | AO15: 2.3e-002 | AP15: 2 | AQ15: 华翔转债
A16: 15 | B16: 123133 | C16: 佩蒂转债 | D16: 300673 | E16: 佩蒂股份 | F16: 食品饮料 | G16: 食品加工 | H16: 121.6 | I16: -2.7999999999999997e-002 | J16: 1.4999999999999999e-002 | K16: 16.65 | L16: -2.46e-002 | M16: 120.5 | N16: 19.92 | O16: 0.45500000000000002 | P16: 83.58 | Q16: 3月25天 | R16: 5.80年 | S16: 3.80年 | T16: 7.2 | U16: 16 | V16: 1.8000000000000002e-002 | W16: 0.17100000000000001 | X16: 0.14300000000000002 | Y16: 42 | Z16: 2.53 | AA16: -1.6000000000000001e-003 | AB16: -7.6e-003 | AC16: -3.9399999999999998e-002 | AD16: -4.1100000000000005e-002 | AE16: 81.89 | AF16: 85.45 | AG16: 0.53 | AH16: AA- | AI16: 6.2300000000000001e-002 | AJ16: =H16+100*O16 -> 167.09999999999999 | AK16: 159.6 | AL16: 228 | AM16: 74.2 | AN16: 284 | AO16: -4.2000000000000003e-002 | AP16: 3 | AQ16: 佩蒂转债
A17: 16 | B17: 123132 | C17: 回盛转债 | D17: 300871 | E17: 回盛生物 | F17: 医药 | G17: 医药行业 | H17: 124.109 | I17: 8.9999999999999998e-004 | J17: 8.8999999999999999e-003 | K17: 26.73 | L17: 1.6e-002 | M17: 121 | N17: 28.32 | O17: 0.315 | P17: 94.39 | Q17: 3月20天 | R17: 5.79年 | S17: 3.79年 | T17: 7 | U17: 11 | V17: 1.3000000000000001e-002 | W17: 0.158 | X17: 0.14899999999999999 | Y17: 44 | Z17: 3.06 | AA17: -4.5000000000000005e-003 | AB17: -1.06e-002 | AC17: -4.4299999999999999e-002 | AD17: -4.5999999999999999e-002 | AE17: 82.03 | AF17: 85.89 | AG17: 0.61 | AH17: AA- | AI17: 6.2300000000000001e-002 | AJ17: =H17+100*O17 -> 155.60899999999998 | AK17: 153.8 | AL17: 178 | AM17: 67.9 | AN17: 245 | AO17: 4.4999999999999998e-002 | AP17: 3 | AQ17: 回盛转债
A18: 17 | B18: 113636 | C18: 甬金转债 | D18: 603995 | E18: 甬金股份 | F18: 钢铁 | G18: 钢铁行业 | H18: 137.78 | I18: 4.4000000000000003e-003 | J18: -1.37e-002 | K18: 60.98 | L18: -1.26e-002 | M18: 120.6 | N18: 53.07 | O18: 0.19899999999999998 | P18: 114.9 | Q18: 3月14天 | R18: 5.78年 | S18: 3.78年 | T18: 10 | U18: 56 | V18: 4.0000000000000001e-002 | W18: 7.0000000000000007e-002 | X18: 8.1000000000000003e-002 | Y18: 142 | Z18: 4.14 | AA18: -2.3199999999999998e-002 | AB18: -2.8999999999999998e-002 | AC18: -7.0400000000000004e-002 | AD18: -7.1900000000000006e-002 | AE18: 81.73 | AF18: 85.59 | AG18: 0.73 | AH18: AA- | AI18: 6.2300000000000001e-002 | AJ18: =H18+100*O18 -> 157.68000000000001 | AK18: 160.7 | AL18: 235 | AM18: 75.1 | AN18: 287 | AO18: 1.2e-002 | AP18: 3 | AQ18: 甬金转债
A19: 18 | B19: 113635 | C19: 升21转债 | D19: 603305 | E19: 旭升股份 | F19: 汽车 | G19: 零部件制 | H19: 124.18 | I19: -1.9400000000000001e-002 | J19: -2.3e-003 | K19: 40.65 | L19: -3.9e-002 | M19: 119.6 | N19: 46.37 | O19: 0.41700000000000004 | P19: 87.66 | Q19: 3月13天 | R19: 5.77年 | S19: 3.77年 | T19: 13.5 | U19: 36 | V19: 2.1000000000000001e-002 | W19: 7.400000000000001e-002 | X19: 6.5000000000000002e-002 | Y19: 182 | Z19: 5.18 | AA19: -6.6e-003 | AB19: -1.24e-002 | AC19: -4.5899999999999996e-002 | AD19: -4.7400000000000005e-002 | AE19: 81.64 | AF19: 84.9 | AG19: 0.56 | AH19: AA- | AI19: 6.2300000000000001e-002 | AJ19: =H19+100*O19 -> 165.88 | AK19: 160.7 | AL19: 239 | AM19: 75.8 | AN19: 291 | AO19: -3.2000000000000001e-002 | AP19: 3 | AQ19: 升21转债
A20: 19 | B20: 111002 | C20: 特纸转债 | D20: 605007 | E20: 五洲特纸 | F20: 造纸包装 | G20: 包装用纸 | H20: 156.76 | I20: -3.4000000000000002e-002 | J20: 2.9500000000000002e-002 | K20: 23.53 | L20: -5.8999999999999999e-003 | M20: 117.1 | N20: 18.5 | O20: 0.23199999999999998 | P20: 127.19 | Q20: 3月11天 | R20: 5.76年 | S20: 3.76年 | T20: 6.7 | U20: 147 | V20: 0.13800000000000001 | W20: 7.0999999999999994e-002 | X20: 9.0999999999999998e-002 | Y20: 94 | Z20: 5 | AA20: -5.0099999999999999e-002 | AB20: -5.4900000000000004e-002 | AC20: -0.10099999999999999 | AD20: -0.10199999999999999 | AE20: 88.49 | AF20: 93.13 | AG20: 0.77 | AH20: AA | AI20: 4.1299999999999996e-002 | AJ20: =H20+100*O20 -> 179.95999999999998 | AK20: 186.3 | AL20: 330 | AM20: 93.2 | AN20: 330 | AO20: 5.0999999999999997e-002 | AP20: 3 | AQ20: 特纸转债
A21: 20 | B21: 113634 | C21: 珀莱转债 | D21: 603605 | E21: 珀莱雅 | F21: 化工 | G21: 日化 | H21: 126.12 | I21: -2.3e-003 | J21: 3.2000000000000002e-003 | K21: 176.38 | L21: 1.9e-003 | M21: 120.1 | N21: 195.98 | O21: 0.40100000000000002 | P21: 90 | Q21: 3月11天 | R21: 5.76年 | S21: 3.76年 | T21: 7.52 | U21: 12 | V21: 1.2e-002 | W21: 2.1000000000000001e-002 | X21: 1.9e-002 | Y21: 355 | Z21: 13.57 | AA21: -8.6e-003 | AB21: -1.4499999999999999e-002 | AC21: -4.9200000000000001e-002 | AD21: -5.0799999999999998e-002 | AE21: 88.49 | AF21: 95.5 | AG21: 0.46 | AH21: AA | AI21: 4.1299999999999996e-002 | AJ21: =H21+100*O21 -> 166.22 | AK21: 162.2 | AL21: 254 | AM21: 66.7 | AN21: 232 | AO21: -1.3000000000000001e-002 | AP21: 6 | AQ21: 珀莱转债
A22: 21 | B22: 123131 | C22: 奥飞转债 | D22: 300738 | E22: 奥飞数据 | F22: 通信互联 | G22: 通信设备 | H22: 141.82 | I22: -1.78e-002 | J22: 3.3e-003 | K22: 25.53 | L22: -1.9199999999999998e-002 | M22: 121.7 | N22: 22.02 | O22: 0.223 | P22: 115.94 | Q22: 3月6天 | R22: 5.75年 | S22: 3.75年 | T22: 6.35 | U22: 196 | V22: 0.217 | W22: 6.5000000000000002e-002 | X22: 7.5999999999999998e-002 | Y22: 97 | Z22: 6.92 | AA22: -2.6800000000000001e-002 | AB22: -3.2899999999999999e-002 | AC22: -7.5499999999999998e-002 | AD22: -7.7499999999999999e-002 | AE22: 79.58 | AF22: 81.83 | AG22: 0.76 | AH22: A+ | AI22: 7.3300000000000004e-002 | AJ22: =H22+100*O22 -> 164.12 | AK22: 167.7 | AL22: 295 | AM22: 85.9 | AN22: 321 | AO22: 5.2999999999999999e-002 | AP22: 5 | AQ22: 奥飞转债
A23: 22 | B23: 113633 | C23: 科沃转债! | D23: 603486 | E23: 科沃斯 | F23: 机械装备 | G23: 机器人及 | H23: 118.36 | I23: -1.24e-002 | J23: 9.0000000000000011e-003 | K23: 123.6 | L23: -1.2e-002 | M23: 115.1 | N23: 178.13 | O23: 0.70599999999999996 | P23: 69.39 | Q23: 3月3天 | R23: 5.74年 | S23: 3.74年 | T23: 10.4 | U23: 31 | V23: 2.5000000000000001e-002 | W23: 1.4999999999999999e-002 | X23: 1.e-002 | Y23: 709 | Z23: 16.75 | AA23: -4.8999999999999998e-003 | AB23: -9.5999999999999992e-003 | AC23: -3.3799999999999997e-002 | AD23: -3.5400000000000001e-002 | AE23: 88.57 | AF23: 91.63 | AG23: 0.29 | AH23: AA | AI23: 4.1299999999999996e-002 | AJ23: =H23+100*O23 -> 188.95999999999998 | AK23: 167.3 | AL23: 293 | AM23: 75.7 | AN23: 290 | AO23: -6.0999999999999999e-002 | AP23: 8 | AQ23: 科沃转债!
A24: 23 | B24: 118003 | C24: 华兴转债 | D24: 688001 | E24: 华兴源创 | F24: 机械装备 | G24: 专用设备 | H24: 120.67 | I24: -1.0700000000000001e-002 | J24: 5.3e-003 | K24: 31.72 | L24: -1.34e-002 | M24: 115.1 | N24: 39.33 | O24: 0.496 | P24: 80.65 | Q24: 3月0天 | R24: 5.74年 | S24: 3.74年 | T24: 8 | U24: 3.3 | V24: 3.0000000000000001e-003 | W24: 5.7000000000000002e-002 | X24: 4.5999999999999999e-002 | Y24: 139 | Z24: 4.1 | AA24: -8.3000000000000001e-003 | AB24: -1.3000000000000001e-002 | AC24: -3.8599999999999995e-002 | AD24: -4.0300000000000002e-002 | AE24: 88.58 | AF24: 91.64 | AG24: 0.41 | AH24: AA | AI24: 4.1299999999999996e-002 | AJ24: =H24+100*O24 -> 170.27000000000001 | AK24: 160.7 | AL24: 238 | AM24: 69.1 | AN24: 257 | AO24: -5.2000000000000005e-002 | AP24: 3 | AQ24: 华兴转债
A25: 24 | B25: 127051 | C25: 博杰转债 | D25: 2975 | E25: 博杰股份 | F25: 机械装备 | G25: 机器人及 | H25: 131.9 | I25: 1.9e-003 | J25: -7.6e-003 | K25: 52.03 | L25: -1.0800000000000001e-002 | M25: 121.1 | N25: 62.17 | O25: 0.57600000000000007 | P25: 83.69 | Q25: 2月19天 | R25: 5.70年 | S25: 4.70年 | T25: 5.26 | U25: 59 | V25: 8.5999999999999993e-002 | W25: 7.2000000000000008e-002 | X25: 6.0999999999999999e-002 | Y25: 73 | Z25: 4.91 | AA25: -1.5100000000000001e-002 | AB25: -2.1299999999999999e-002 | AC25: -4.3400000000000001e-002 | AD25: -4.5700000000000005e-002 | AE25: 79.8 | AF25: 86.4 | AG25: 0.52 | AH25: AA- | AI25: 6.2300000000000001e-002 | AJ25: =H25+100*O25 -> 189.5 | AK25: 180.1 | AL25: 324 | AM25: 93.7 | AN25: 331 | AO25: -5.9000000000000004e-002 | AP25: 5 | AQ25: 博杰转债
A26: 25 | B26: 113632 | C26: 鹤21转债 | D26: 603733 | E26: 仙鹤股份 | F26: 造纸包装 | G26: 造纸行业 | H26: 122.36 | I26: -8.3000000000000001e-003 | J26: 3.4999999999999996e-003 | K26: 31.73 | L26: -1.21e-002 | M26: 117.1 | N26: 39.09 | O26: 0.50700000000000001 | P26: 81.17 | Q26: 2月19天 | R26: 5.70年 | S26: 3.70年 | T26: 20.5 | U26: 5.7 | V26: 2.e-003 | W26: 9.1999999999999998e-002 | X26: 7.400000000000001e-002 | Y26: 224 | Z26: 3.71 | AA26: -7.8000000000000005e-003 | AB26: -1.3000000000000001e-002 | AC26: -4.24e-002 | AD26: -4.41e-002 | AE26: 88.7 | AF26: 93.35 | AG26: 0.39 | AH26: AA | AI26: 4.1299999999999996e-002 | AJ26: =H26+100*O26 -> 173.06 | AK26: 163.5 | AL26: 268 | AM26: 70.2 | AN26: 264 | AO26: 1.2e-002 | AP26: 3 | AQ26: 鹤21转债
A27: 26 | B27: 127050 | C27: 麒麟转债 | D27: 2984 | E27: 森麒麟 | F27: 汽车 | G27: 零部件制 | H27: 130.007 | I27: -7.6e-003 | J27: 9.300000000000001e-003 | K27: 33.6 | L27: 3.0000000000000001e-003 | M27: 115.1 | N27: 34.85 | O27: 0.34799999999999998 | P27: 96.41 | Q27: 2月13天 | R27: 5.69年 | S27: 3.69年 | T27: 22 | U27: 37 | V27: 1.3000000000000001e-002 | W27: 0.10099999999999999 | X27: 9.6999999999999989e-002 | Y27: 218 | Z27: 3.49 | AA27: -2.1499999999999998e-002 | AB27: -2.6099999999999998e-002 | AC27: -5.7599999999999998e-002 | AD27: -5.9200000000000003e-002 | AE27: 88.76 | AF27: 91.82 | AG27: 0.56 | AH27: AA | AI27: 4.1299999999999996e-002 | AJ27: =H27+100*O27 -> 164.80700000000002 | AK27: 163.6 | AL27: 270 | AM27: 71.8 | AN27: 275 | AO27: 1.e-002 | AP27: 4 | AQ27: 麒麟转债
A28: 27 | B28: 110083 | C28: 苏租转债 | D28: 600901 | E28: 江苏租赁 | F28: 金融 | G28: 其他 | H28: 117.4 | I28: -7.000000000000001e-004 | J28: 1.7000000000000001e-003 | K28: 5.2 | L28: 1.9e-003 | M28: 110.5 | N28: 5.42 | O28: 0.22399999999999998 | P28: 95.94 | Q28: 2月13天 | R28: 5.69年 | S28: 无权 | T28: 50 | U28: 28 | V28: 5.0000000000000001e-003 | W28: 0.32200000000000001 | X28: 0.309 | Y28: 155 | Z28: 1.13 | AA28: -1.0700000000000001e-002 | AB28: -1.41e-002 | AC28: 无权 | AD28: 无权 | AE28: 无权 | AF28: 91.43 | AG28: 0.55 | AH28: AAA | AI28: 3.4300000000000004e-002 | AJ28: =H28+100*O28 -> 139.80000000000001 | AK28: 138.9 | AL28: 33 | AM28: 47.4 | AN28: 73 | AO28: 1.6e-002 | AP28: 6 | AQ28: 苏租转债
A29: 28 | B29: 123130 | C29: 设研转债 | D29: 300732 | E29: 设研院 | F29: 建筑 | G29: 建筑工程 | H29: 148 | I29: -4.8099999999999997e-002 | J29: 2.6200000000000001e-002 | K29: 14.53 | L29: -2.81e-002 | M29: 117.1 | N29: 11.22 | O29: 0.14300000000000002 | P29: 129.5 | Q29: 2月13天 | R29: 5.69年 | S29: 3.69年 | T29: 3.76 | U29: 188 | V29: 0.33399999999999996 | W29: 9.4e-002 | X29: 0.122 | Y29: 40 | Z29: 1.58 | AA29: -4.0999999999999995e-002 | AB29: -4.5899999999999996e-002 | AC29: -8.900000000000001e-002 | AD29: -9.0500000000000011e-002 | AE29: 88.76 | AF29: 93.41 | AG29: 0.78 | AH29: AA | AI29: 4.1299999999999996e-002 | AJ29: =H29+100*O29 -> 162.30000000000001 | AK29: 166.5 | AL29: 287 | AM29: 73.1 | AN29: 280 | AO29: -0.13100000000000001 | AP29: 5 | AQ29: 设研转债
A30: 29 | B30: 111001 | C30: 山玻转债 | D30: 605006 | E30: 山东玻纤 | F30: 其他 | G30: 非金属矿 | H30: 120.19 | I30: -7.4000000000000003e-003 | J30: 5.9999999999999995e-004 | K30: 12.43 | L30: -1.1899999999999999e-002 | M30: 120.1 | N30: 13.91 | O30: 0.34499999999999997 | P30: 89.36 | Q30: 2月8天 | R30: 5.68年 | S30: 3.68年 | T30: 6 | U30: 4.8 | V30: 6.9999999999999993e-003 | W30: 9.6999999999999989e-002 | X30: 8.5999999999999993e-002 | Y30: 62 | Z30: 2.88 | AA30: -1.e-004 | AB30: -6.1999999999999998e-003 | AC30: -3.8199999999999998e-002 | AD30: -3.9800000000000002e-002 | AE30: 82.28 | AF30: 85.73 | AG30: 0.57 | AH30: AA- | AI30: 6.2300000000000001e-002 | AJ30: =H30+100*O30 -> 154.69 | AK30: 151 | AL30: 150 | AM30: 65.3 | AN30: 221 | AO30: 0. | AP30: 4 | AQ30: 山玻转债
A31: 30 | B31: 113631 | C31: 皖天转债 | D31: 603689 | E31: 皖天然气 | F31: 石油天然 | G31: 天然气 | H31: 119.7 | I31: -2.0299999999999999e-002 | J31: 1.0800000000000001e-002 | K31: 10.42 | L31: -1.8799999999999997e-002 | M31: 114.5 | N31: 11.12 | O31: 0.27699999999999997 | P31: 93.71 | Q31: 2月8天 | R31: 5.68年 | S31: 3.68年 | T31: 9.3 | U31: 20 | V31: 1.8000000000000002e-002 | W31: 0.26600000000000001 | X31: 0.249 | Y31: 35 | Z31: 1.42 | AA31: -7.9000000000000008e-003 | AB31: -1.24e-002 | AC31: -3.85e-002 | AD31: -3.9900000000000005e-002 | AE31: 89.87 | AF31: 93.79 | AG31: 0.51 | AH31: AA+ | AI31: 3.6299999999999999e-002 | AJ31: =H31+100*O31 -> 147.40000000000001 | AK31: 145.7 | AL31: 82 | AM31: 51.9 | AN31: 116 | AO31: 2.4e-002 | AP31: 4 | AQ31: 皖天转债
A32: 31 | B32: 123129 | C32: 锦鸡转债 | D32: 300798 | E32: 锦鸡股份 | F32: 化工 | G32: 其他 | H32: 120 | I32: -4.5000000000000005e-003 | J32: -1.7000000000000001e-003 | K32: 8.9 | L32: -1.e-002 | M32: 117.8 | N32: 9.53 | O32: 0.28499999999999998 | P32: 93.39 | Q32: 2月6天 | R32: 5.67年 | S32: 3.67年 | T32: 6 | U32: 7.3 | V32: 1.e-002 | W32: 0.161 | X32: 0.151 | Y32: 37 | Z32: 2.97 | AA32: -3.3e-003 | AB32: -8.8000000000000005e-003 | AC32: -3.7200000000000004e-002 | AD32: -3.9e-002 | AE32: 82.59 | AF32: 84.23 | AG32: 0.62 | AH32: AA- | AI32: 6.2300000000000001e-002 | AJ32: =H32+100*O32 -> 148.5 | AK32: 146.6 | AL32: 94 | AM32: 62.4 | AN32: 200 | AO32: -1.2e-002 | AP32: 4 | AQ32: 锦鸡转债
A33: 32 | B33: 127049 | C33: 希望转2 | D33: 876 | E33: 新 希 望 | F33: 农业 | G33: 畜牧业 | H33: 132.16 | I33: -7.7000000000000002e-003 | J33: 1.84e-002 | K33: 16.72 | L33: 1.52e-002 | M33: 111.2 | N33: 14.45 | O33: 0.14199999999999999 | P33: 115.71 | Q33: 2月4天 | R33: 5.66年 | S33: 3.66年 | T33: 81.5 | U33: 146 | V33: 1.3000000000000001e-002 | W33: 0.10800000000000001 | X33: 0.125 | Y33: 753 | Z33: 2.47 | AA33: -3.04e-002 | AB33: -3.39e-002 | AC33: -6.3700000000000007e-002 | AD33: -6.5000000000000002e-002 | AE33: 90.48 | AF33: 92.13 | AG33: 0.71 | AH33: AAA | AI33: 3.4300000000000004e-002 | AJ33: =H33+100*O33 -> 146.35999999999999 | AK33: 148.6 | AL33: 121 | AM33: 56.5 | AN33: 149 | AO33: 1.9e-002 | AP33: 9 | AQ33: 希望转2
A34: 33 | B34: 123128 | C34: 首华转债! | D34: 300483 | E34: 首华燃气 | F34: 石油天然 | G34: 天然气 | H34: 113.48 | I34: -3.0899999999999997e-002 | J34: 3.9000000000000003e-003 | K34: 18.84 | L34: -7.8299999999999995e-002 | M34: 115.1 | N34: 25.02 | O34: 0.50700000000000001 | P34: 75.3 | Q34: 2月1天 | R34: 5.66年 | S34: 3.66年 | T34: 13.8 | U34: 472 | V34: 0.29999999999999999 | W34: 0.27300000000000002 | X34: 0.20499999999999999 | Y34: 51 | Z34: 1.8 | AA34: 2.5999999999999999e-003 | AB34: -2.2000000000000001e-003 | AC34: -2.3700000000000002e-002 | AD34: -2.5399999999999999e-002 | AE34: 88.85 | AF34: 91.92 | AG34: 0.34 | AH34: AA | AI34: 4.1299999999999996e-002 | AJ34: =H34+100*O34 -> 164.18000000000001 | AK34: 151.7 | AL34: 156 | AM34: 59.7 | AN34: 177 | AO34: 0.13500000000000001 | AP34: 14 | AQ34: 首华转债!
A35: 34 | B35: 123127 | C35: 耐普转债 | D35: 300818 | E35: 耐普矿机 | F35: 机械装备 | G35: 专用设备 | H35: 132.566 | I35: -2.81e-002 | J35: 1.83e-002 | K35: 43.05 | L35: -1.26e-002 | M35: 116.2 | N35: 37 | O35: 0.13900000000000001 | P35: 116.35 | Q35: 2月0天 | R35: 5.65年 | S35: 3.65年 | T35: 4 | U35: 57 | V35: 0.106 | W35: 0.13300000000000001 | X35: 0.154 | Y35: 30 | Z35: 3.2 | AA35: -2.35e-002 | AB35: -2.8399999999999998e-002 | AC35: -6.1399999999999996e-002 | AD35: -6.3399999999999998e-002 | AE35: 79.83 | AF35: 78.62 | AG35: 0.78 | AH35: A+ | AI35: 7.3300000000000004e-002 | AJ35: =H35+100*O35 -> 146.46600000000001 | AK35: 148.8 | AL35: 124 | AM35: 69 | AN35: 255 | AO35: 1.3999999999999999e-002 | AP35: 5 | AQ35: 耐普转债
A36: 35 | B36: 110082 | C36: 宏发转债! | D36: 600885 | E36: 宏发股份 | F36: 能源电力 | G36: 电力设备 | H36: 120.98 | I36: -2.1000000000000001e-002 | J36: 8.6e-003 | K36: 54.94 | L36: -3.78e-002 | M36: 117.1 | N36: 72.28 | O36: 0.59200000000000008 | P36: 76.01 | Q36: 59天 | R36: 5.65年 | S36: 3.65年 | T36: 20 | U36: 56 | V36: 2.3e-002 | W36: 4.9000000000000002e-002 | X36: 3.7000000000000005e-002 | Y36: 409 | Z36: 6.73 | AA36: -5.8999999999999999e-003 | AB36: -1.11e-002 | AC36: -4.0099999999999997e-002 | AD36: -4.1799999999999997e-002 | AE36: 88.89 | AF36: 93.55 | AG36: 0.33 | AH36: AA | AI36: 4.1299999999999996e-002 | AJ36: =H36+100*O36 -> 180.18000000000001 | AK36: 166 | AL36: 285 | AM36: 72.4 | AN36: 278 | AO36: -0.113 | AP36: 5 | AQ36: 宏发转债!
A37: 36 | B37: 113630 | C37: 赛伍转债! | D37: 603212 | E37: 赛伍技术 | F37: 能源电力 | G37: 太阳能 | H37: 123.96 | I37: -1.09e-002 | J37: 3.4000000000000002e-003 | K37: 25.64 | L37: -1.6500000000000001e-002 | M37: 120.5 | N37: 32.9 | O37: 0.59099999999999997 | P37: 77.93 | Q37: 58天 | R37: 5.65年 | S37: 3.65年 | T37: 7 | U37: 15 | V37: 1.7000000000000001e-002 | W37: 6.8000000000000005e-002 | X37: 5.2999999999999999e-002 | Y37: 104 | Z37: 5.15 | AA37: -5.1000000000000004e-003 | AB37: -1.1200000000000002e-002 | AC37: -4.58e-002 | AD37: -4.7599999999999996e-002 | AE37: 82.66 | AF37: 86.24 | AG37: 0.46 | AH37: AA- | AI37: 6.2300000000000001e-002 | AJ37: =H37+100*O37 -> 183.06 | AK37: 170 | AL37: 302 | AM37: 83.7 | AN37: 317 | AO37: -5.0000000000000001e-003 | AP37: 5 | AQ37: 赛伍转债!
A38: 37 | B38: 127048 | C38: 中大转债 | D38: 2896 | E38: 中大力德 | F38: 机械装备 | G38: 通用设备 | H38: 125.099 | I38: -1.66e-002 | J38: 2.7000000000000001e-003 | K38: 21.28 | L38: -2.12e-002 | M38: 121.7 | N38: 22.1 | O38: 0.29899999999999999 | P38: 96.29 | Q38: 57天 | R38: 5.64年 | S38: 3.64年 | T38: 2.7 | U38: 32 | V38: 9.4e-002 | W38: 0.122 | X38: 0.11699999999999999 | Y38: 22 | Z38: 3.03 | AA38: -5.0000000000000001e-003 | AB38: -1.15e-002 | AC38: -4.6300000000000001e-002 | AD38: -4.8399999999999999e-002 | AE38: 80.16 | AF38: 82.43 | AG38: 0.66 | AH38: A+ | AI38: 7.3300000000000004e-002 | AJ38: =H38+100*O38 -> 154.999 | AK38: 153.9 | AL38: 179 | AM38: 71.5 | AN38: 270 | AO38: -2.7000000000000003e-002 | AP38: 5 | AQ38: 中大转债
A39: 38 | B39: 127047 | C39: 帝欧转债 | D39: 2798 | E39: 帝欧家居 | F39: 其他 | G39: 家居用品 | H39: 121.183 | I39: -6.4000000000000003e-003 | J39: 2.5999999999999999e-003 | K39: 12.61 | L39: -6.3e-003 | M39: 120.4 | N39: 13.53 | O39: 0.29999999999999999 | P39: 93.2 | Q39: 55天 | R39: 5.64年 | S39: 3.64年 | T39: 15 | U39: 28 | V39: 1.4999999999999999e-002 | W39: 0.307 | X39: 0.28699999999999998 | Y39: 49 | Z39: 1.07 | AA39: -1.1999999999999999e-003 | AB39: -7.3000000000000001e-003 | AC39: -4.0300000000000002e-002 | AD39: -4.2099999999999999e-002 | AE39: 82.58 | AF39: 86.17 | AG39: 0.6 | AH39: AA- | AI39: 6.2300000000000001e-002 | AJ39: =H39+100*O39 -> 151.18299999999999 | AK39: 149.2 | AL39: 128 | AM39: 63 | AN39: 206 | AO39: -2.7999999999999997e-002 | AP39: 5 | AQ39: 帝欧转债
A40: 39 | B40: 127046 | C40: 百润转债! | D40: 2568 | E40: 百润股份 | F40: 食品饮料 | G40: 葡萄酒洋 | H40: 119 | I40: -1.e-002 | J40: 8.9999999999999998e-004 | K40: 41.15 | L40: -5.0999999999999997e-002 | M40: 115.1 | N40: 66.83 | O40: 0.93299999999999994 | P40: 61.57 | Q40: 38天 | R40: 5.57年 | S40: 3.57年 | T40: 11.3 | U40: 8.3 | V40: 6.0000000000000001e-003 | W40: 3.6000000000000004e-002 | X40: 2.2000000000000002e-002 | Y40: 309 | Z40: 8.79 | AA40: -6.0999999999999995e-003 | AB40: -1.09e-002 | AC40: -3.6699999999999997e-002 | AD40: -3.8399999999999997e-002 | AE40: 89.18 | AF40: 92.26 | AG40: 0.18 | AH40: AA | AI40: 4.1299999999999996e-002 | AJ40: =H40+100*O40 -> 212.30000000000001 | AK40: 176.4 | AL40: 318 | AM40: 84.2 | AN40: 319 | AO40: -8.4000000000000005e-002 | AP40: 6 | AQ40: 百润转债!
A41: 40 | B41: 113629 | C41: 泉峰转债 | D41: 603982 | E41: 泉峰汽车 | F41: 汽车 | G41: 零部件制 | H41: 139.38 | I41: -2.86e-002 | J41: -6.1999999999999998e-003 | K41: 26.62 | L41: -4.8600000000000004e-002 | M41: 121 | N41: 23.03 | O41: 0.20600000000000002 | P41: 115.59 | Q41: 17天 | R41: 5.53年 | S41: 3.53年 | T41: 6.2 | U41: 91 | V41: 0.105 | W41: 0.11599999999999999 | X41: 0.13400000000000001 | Y41: 54 | Z41: 3.23 | AA41: -2.5699999999999997e-002 | AB41: -3.1899999999999998e-002 | AC41: -7.6999999999999999e-002 | AD41: -7.8799999999999995e-002 | AE41: 83.31 | AF41: 87.24 | AG41: 0.72 | AH41: AA- | AI41: 6.2300000000000001e-002 | AJ41: =H41+100*O41 -> 159.97999999999999 | AK41: 163.2 | AL41: 265 | AM41: 75.9 | AN41: 294 | AO41: -0.122 | AP41: 6 | AQ41: 泉峰转债
A42: 41 | B42: 123126 | C42: 瑞丰转债! | D42: 300243 | E42: 瑞丰高材 | F42: 化工 | G42: 橡胶塑料 | H42: 117.687 | I42: -1.89e-002 | J42: 2.4799999999999999e-002 | K42: 13.76 | L42: 1.2500000000000001e-002 | M42: 129.6 | N42: 17.8 | O42: 0.52200000000000002 | P42: 77.3 | Q42: 11天 | R42: 5.52年 | S42: 3.52年 | T42: 3.4 | U42: 172 | V42: 0.41999999999999998 | W42: 0.106 | X42: 8.199999999999999e-002 | Y42: 32 | Z42: 3.94 | AA42: 1.8200000000000001e-002 | AB42: 9.300000000000001e-003 | AC42: -2.6600000000000002e-002 | AD42: -2.9900000000000003e-002 | AE42: 82.54 | AF42: 88.81 | AG42: 0.47 | AH42: A+ | AI42: 7.3300000000000004e-002 | AJ42: =H42+100*O42 -> 169.887 | AK42: 158.1 | AL42: 214 | AM42: 69.3 | AN42: 259 | AO42: 8.8000000000000009e-002 | AP42: 10 | AQ42: 瑞丰转债!
A43: 42 | B43: 123125 | C43: 元力转债 | D43: 300174 | E43: 元力股份 | F43: 化工 | G43: 化工 | H43: 115.656 | I43: -1.5600000000000001e-002 | J43: 1.0700000000000001e-002 | K43: 14.88 | L43: -8.6999999999999994e-003 | M43: 109.3 | N43: 17.61 | O43: 0.36899999999999999 | P43: 84.5 | Q43: 5.5天 | R43: 5.51年 | S43: 3.51年 | T43: 9 | U43: 5.2 | V43: 5.0000000000000001e-003 | W43: 0.19399999999999998 | X43: 0.16399999999999998 | Y43: 46 | Z43: 2.65 | AA43: -1.04e-002 | AB43: -1.34e-002 | AC43: -3.1699999999999999e-002 | AD43: -3.3099999999999997e-002 | AE43: 82.43 | AF43: 78.75 | AG43: 0.57 | AH43: AA- | AI43: 6.2300000000000001e-002 | AJ43: =H43+100*O43 -> 152.55600000000001 | AK43: 146.8 | AL43: 98 | AM43: 64.4 | AN43: 214 | AO43: -6.0000000000000001e-003 | AP43: 5 | AQ43: 元力转债
A44: 43 | B44: 113628 | C44: 晨丰转债 | D44: 603685 | E44: 晨丰科技 | F44: 能源电力 | G44: 电力设备 | H44: 115.7 | I44: -1.11e-002 | J44: 6.1999999999999998e-003 | K44: 11.72 | L44: -7.6e-003 | M44: 121.7 | N44: 13.06 | O44: 0.28899999999999998 | P44: 89.74 | Q44: 已到 | R44: 5.47年 | S44: 3.47年 | T44: 4.15 | U44: 7.6 | V44: 1.6e-002 | W44: 0.20999999999999999 | X44: 0.188 | Y44: 20 | Z44: 1.76 | AA44: 9.4999999999999998e-003 | AB44: 2.7000000000000001e-003 | AC44: -2.76e-002 | AD44: -2.9900000000000003e-002 | AE44: 78.5 | AF44: 79.43 | AG44: 0.65 | AH44: A | AI44: 8.3299999999999999e-002 | AJ44: =H44+100*O44 -> 144.59999999999999 | AK44: 141.7 | AL44: 55 | AM44: 62.2 | AN44: 198 | AO44: 1.4999999999999999e-002 | AP44: 11 | AQ44: 晨丰转债
A45: 44 | B45: 123124 | C45: 晶瑞转2! | D45: 300655 | E45: 晶瑞电材 | F45: 电子 | G45: 电子行业 | H45: 119.61 | I45: -3.0000000000000001e-003 | J45: 4.5000000000000005e-003 | K45: 36.26 | L45: 3.3e-003 | M45: 111.2 | N45: 50.16 | O45: 0.65500000000000003 | P45: 72.29 | Q45: 已到 | R45: 5.45年 | S45: 3.45年 | T45: 5.23 | U45: 12 | V45: 1.9e-002 | W45: 4.2000000000000003e-002 | X45: 2.9999999999999999e-002 | Y45: 126 | Z45: 8.51 | AA45: -1.3500000000000002e-002 | AB45: -1.72e-002 | AC45: -4.1399999999999999e-002 | AD45: -4.2800000000000005e-002 | AE45: 79.63 | AF45: 76.06 | AG45: 0.46 | AH45: A+ | AI45: 7.3300000000000004e-002 | AJ45: =H45+100*O45 -> 185.11000000000001 | AK45: 166.9 | AL45: 292 | AM45: 87.3 | AN45: 325 | AO45: 2.8999999999999998e-002 | AP45: 8 | AQ45: 晶瑞转2!
A46: 45 | B46: 127044 | C46: 蒙娜转债! | D46: 2918 | E46: 蒙娜丽莎 | F46: 建筑 | G46: 其他建材 | H46: 118.28 | I46: -2.7900000000000001e-002 | J46: 2.1099999999999997e-002 | K46: 19.26 | L46: -2.4799999999999999e-002 | M46: 117.1 | N46: 26.92 | O46: 0.65300000000000002 | P46: 71.55 | Q46: 已到 | R46: 5.45年 | S46: 3.45年 | T46: 11.7 | U46: 33 | V46: 2.4e-002 | W46: 0.14499999999999999 | X46: 0.10400000000000001 | Y46: 80 | Z46: 2.15 | AA46: -1.9e-003 | AB46: -7.4000000000000003e-003 | AC46: -3.6299999999999999e-002 | AD46: -3.8100000000000002e-002 | AE46: 89.62 | AF46: 94.31 | AG46: 0.27 | AH46: AA | AI46: 4.1299999999999996e-002 | AJ46: =H46+100*O46 -> 183.57999999999998 | AK46: 165 | AL46: 278 | AM46: 70.7 | AN46: 268 | AO46: -0.14300000000000002 | AP46: 4 | AQ46: 蒙娜转债!
A47: 46 | B47: 127045 | C47: 牧原转债 | D47: 2714 | E47: 牧原股份 | F47: 农业 | G47: 畜牧业 | H47: 139.533 | I47: -1.18e-002 | J47: 1.1699999999999999e-002 | K47: 58.74 | L47: -2.0000000000000001e-004 | M47: 111.1 | N47: 47.91 | O47: 0.13800000000000001 | P47: 122.6 | Q47: 已到 | R47: 5.45年 | S47: 3.45年 | T47: 95.5 | U47: 217 | V47: 1.6e-002 | W47: 3.1e-002 | X47: 3.7999999999999999e-002 | Y47: 3091. | Z47: 5.86 | AA47: -4.1500000000000002e-002 | AB47: -4.4999999999999998e-002 | AC47: -8.1300000000000011e-002 | AD47: -8.2699999999999996e-002 | AE47: 90.49 | AF47: 91.75 | AG47: 0.76 | AH47: AA+ | AI47: 3.6299999999999999e-002 | AJ47: =H47+100*O47 -> 153.333 | AK47: 156.5 | AL47: 201 | AM47: 64.7 | AN47: 217 | AO47: 6.0000000000000001e-003 | AP47: 11 | AQ47: 牧原转债
A48: 47 | B48: 118002 | C48: 天合转债 | D48: 688599 | E48: 天合光能 | F48: 能源电力 | G48: 太阳能 | H48: 148.07 | I48: -1.8799999999999997e-002 | J48: 4.4000000000000003e-003 | K48: 74.9 | L48: -1.7100000000000001e-002 | M48: 120.1 | N48: 50.4 | O48: -4.0000000000000001e-003 | P48: 148.61 | Q48: 已到 | R48: 5.44年 | S48: 3.44年 | T48: 52.5 | U48: 1212. | V48: 0.154 | W48: 3.4000000000000002e-002 | X48: 5.0000000000000003e-002 | Y48: 1553. | Z48: 9.65 | AA48: -3.8399999999999997e-002 | AB48: -4.4299999999999999e-002 | AC48: -9.4899999999999998e-002 | AD48: -9.6500000000000002e-002 | AE48: 89.65 | AF48: 96.75 | AG48: 0.85 | AH48: AA | AI48: 4.1299999999999996e-002 | AJ48: =H48+100*O48 -> 147.66999999999999 | AK48: 147.5 | AL48: 108 | AM48: 50.8 | AN48: 101 | AO48: 0.152 | AP48: 10 | AQ48: 天合转债
A49: 48 | B49: 127043 | C49: 川恒转债 | D49: 2895 | E49: 川恒股份 | F49: 化工 | G49: 农化 | H49: 141.3 | I49: -1.1599999999999999e-002 | J49: -8.8999999999999999e-003 | K49: 23.8 | L49: -2.8999999999999998e-002 | M49: 121 | N49: 21.02 | O49: 0.248 | P49: 113.23 | Q49: 已到 | R49: 5.44年 | S49: 3.44年 | T49: 11.6 | U49: 32 | V49: 1.9e-002 | W49: 0.10000000000000001 | X49: 0.113 | Y49: 116 | Z49: 3.67 | AA49: -2.86e-002 | AB49: -3.49e-002 | AC49: -8.2400000000000001e-002 | AD49: -8.4199999999999997e-002 | AE49: 83.77 | AF49: 87.72 | AG49: 0.71 | AH49: AA- | AI49: 6.2300000000000001e-002 | AJ49: =H49+100*O49 -> 166.10000000000002 | AK49: 169.4 | AL49: 299 | AM49: 81.7 | AN49: 312 | AO49: -1.6e-002 | AP49: 8 | AQ49: 川恒转债
A50: 49 | B50: 123123 | C50: 江丰转债! | D50: 300666 | E50: 江丰电子 | F50: 电子 | G50: 电子行业 | H50: 133.791 | I50: -1.6000000000000001e-003 | J50: 2.63e-002 | K50: 58.26 | L50: 3.3700000000000001e-002 | M50: 121.5 | N50: 51.8 | O50: 0.19 | P50: 112.47 | Q50: 已到 | R50: 5.44年 | S50: 3.44年 | T50: 5.16 | U50: 460 | V50: 0.64700000000000002 | W50: 3.9e-002 | X50: 4.4000000000000004e-002 | Y50: 133 | Z50: 10.62 | AA50: -1.7899999999999999e-002 | AB50: -2.4500000000000001e-002 | AC50: -6.7099999999999993e-002 | AD50: -6.9199999999999998e-002 | AE50: 81.15 | AF50: 83.45 | AG50: 0.73 | AH50: A+ | AI50: 7.3300000000000004e-002 | AJ50: =H50+100*O50 -> 152.791 | AK50: 155.1 | AL50: 191 | AM50: 71.7 | AN50: 273 | AO50: 5.7999999999999996e-002 | AP50: 7 | AQ50: 江丰转债!
A51: 50 | B51: 127042 | C51: 嘉美转债 | D51: 2969 | E51: 嘉美包装 | F51: 造纸包装 | G51: 包装材料 | H51: 128.61 | I51: -1.7899999999999999e-002 | J51: 1.18e-002 | K51: 6.04 | L51: -8.199999999999999e-003 | M51: 117.1 | N51: 4.87 | O51: 3.7000000000000005e-002 | P51: 124.02 | Q51: 已到 | R51: 5.43年 | S51: 3.43年 | T51: 7.5 | U51: 50 | V51: 5.2000000000000005e-002 | W51: 0.129 | X51: 0.16 | Y51: 58 | Z51: 2.65 | AA51: -1.7399999999999999e-002 | AB51: -2.2799999999999997e-002 | AC51: -5.8799999999999998e-002 | AD51: -6.0499999999999998e-002 | AE51: 89.69 | AF51: 94.39 | AG51: 0.73 | AH51: AA | AI51: 4.1299999999999996e-002 | AJ51: =H51+100*O51 -> 132.31 | AK51: 133.2 | AL51: 8 | AM51: 38.8 | AN51: 33 | AO51: -2.e-003 | AP51: 16 | AQ51: 嘉美转债
A52: 51 | B52: 123122 | C52: 富瀚转债! | D52: 300613 | E52: 富瀚微 | F52: 电子 | G52: 芯片制造 | H52: 120.2 | I52: -7.8000000000000005e-003 | J52: 1.e-002 | K52: 126.04 | L52: 5.1000000000000004e-003 | M52: 120.3 | N52: 177.01 | O52: 0.68799999999999994 | P52: 71.21 | Q52: 已到 | R52: 5.42年 | S52: 3.42年 | T52: 5.81 | U52: 28 | V52: 3.9e-002 | W52: 3.7999999999999999e-002 | X52: 2.7000000000000003e-002 | Y52: 152 | Z52: 9.25 | AA52: 2.0000000000000001e-004 | AB52: -6.1999999999999998e-003 | AC52: -4.0800000000000003e-002 | AD52: -4.2599999999999999e-002 | AE52: 80.59 | AF52: 82.59 | AG52: 0.43 | AH52: A+ | AI52: 7.3300000000000004e-002 | AJ52: =H52+100*O52 -> 189. | AK52: 169.2 | AL52: 298 | AM52: 86.6 | AN52: 323 | AO52: 2.4e-002 | AP52: 7 | AQ52: 富瀚转债!
A53: 52 | B53: 123121 | C53: 帝尔转债! | D53: 300776 | E53: 帝尔激光 | F53: 机械装备 | G53: 专用设备 | H53: 136.6 | I53: -3.3e-003 | J53: 2.3399999999999997e-002 | K53: 213.88 | L53: 2.8900000000000002e-002 | M53: 121 | N53: 192.24 | O53: 0.22800000000000001 | P53: 111.26 | Q53: 已到 | R53: 5.42年 | S53: 3.42年 | T53: 8.4 | U53: 82 | V53: 7.0999999999999994e-002 | W53: 3.7000000000000005e-002 | X53: 4.0999999999999995e-002 | Y53: 227 | Z53: 11.23 | AA53: -2.2599999999999999e-002 | AB53: -2.8900000000000002e-002 | AC53: -7.4099999999999999e-002 | AD53: -7.5899999999999995e-002 | AE53: 83.87 | AF53: 87.82 | AG53: 0.7 | AH53: AA- | AI53: 6.2300000000000001e-002 | AJ53: =H53+100*O53 -> 159.40000000000001 | AK53: 161.9 | AL53: 252 | AM53: 74.1 | AN53: 283 | AO53: -6.9999999999999993e-003 | AP53: 6 | AQ53: 帝尔转债!
A54: 53 | B54: 123120 | C54: 隆华转债 | D54: 300263 | E54: 隆华科技 | F54: 机械装备 | G54: 通用设备 | H54: 138.653 | I54: -2.7099999999999999e-002 | J54: 1.6799999999999999e-002 | K54: 9.14 | L54: -1.3999999999999999e-002 | M54: 121.1 | N54: 7.76 | O54: 0.17699999999999999 | P54: 117.78 | Q54: 已到 | R54: 5.40年 | S54: 3.40年 | T54: 7.99 | U54: 21 | V54: 1.9e-002 | W54: 9.6000000000000002e-002 | X54: 0.113 | Y54: 84 | Z54: 2.9 | AA54: -2.52e-002 | AB54: -3.1600000000000003e-002 | AC54: -7.7899999999999997e-002 | AD54: -7.980000000000001e-002 | AE54: 84.11 | AF54: 88 | AG54: 0.73 | AH54: AA- | AI54: 6.2300000000000001e-002 | AJ54: =H54+100*O54 -> 156.35299999999998 | AK54: 159.5 | AL54: 225 | AM54: 71.5 | AN54: 271 | AO54: 6.0000000000000001e-003 | AP54: 4 | AQ54: 隆华转债
A55: 54 | B55: 110081 | C55: 闻泰转债 | D55: 600745 | E55: 闻泰科技 | F55: 电子 | G55: 电子行业 | H55: 134.42 | I55: -1.29e-002 | J55: -1.1000000000000001e-003 | K55: 113.26 | L55: -1.9299999999999998e-002 | M55: 111.9 | N55: 96.69 | O55: 0.14800000000000002 | P55: 117.14 | Q55: 已到 | R55: 5.40年 | S55: 3.40年 | T55: 86 | U55: 517 | V55: 4.4999999999999998e-002 | W55: 6.0999999999999999e-002 | X55: 7.0999999999999994e-002 | Y55: 1412. | Z55: 4.49 | AA55: -3.3799999999999997e-002 | AB55: -3.7599999999999995e-002 | AC55: -7.3700000000000002e-002 | AD55: -7.4900000000000008e-002 | AE55: 90.22 | AF55: 92.52 | AG55: 0.72 | AH55: AA+ | AI55: 3.6299999999999999e-002 | AJ55: =H55+100*O55 -> 149.22 | AK55: 151.7 | AL55: 157 | AM55: 59.2 | AN55: 174 | AO55: 8.0000000000000002e-003 | AP55: 10 | AQ55: 闻泰转债
A56: 55 | B56: 118001 | C56: 金博转债 | D56: 688598 | E56: 金博股份 | F56: 能源电力 | G56: 太阳能 | H56: 131.01 | I56: -2.7099999999999999e-002 | J56: -5.3e-003 | K56: 246.62 | L56: -5.2900000000000003e-002 | M56: 121.6 | N56: 270.54 | O56: 0.43700000000000006 | P56: 91.16 | Q56: 已到 | R56: 5.38年 | S56: 3.38年 | T56: 6 | U56: 32 | V56: 4.0000000000000001e-002 | W56: 2.9999999999999999e-002 | X56: 2.7999999999999997e-002 | Y56: 198 | Z56: 10.67 | AA56: -1.41e-002 | AB56: -2.07e-002 | AC56: -6.2100000000000002e-002 | AD56: -6.4299999999999996e-002 | AE56: 81.64 | AF56: 83.89 | AG56: 0.61 | AH56: A+ | AI56: 7.3300000000000004e-002 | AJ56: =H56+100*O56 -> 174.70999999999998 | AK56: 170.9 | AL56: 306 | AM56: 87 | AN56: 324 | AO56: -7.2000000000000008e-002 | AP56: 4 | AQ56: 金博转债
A57: 56 | B57: 113627 | C57: 太平转债! | D57: 603877 | E57: 太平鸟 | F57: 服装纺织 | G57: 服装行业 | H57: 108.93 | I57: -9.4999999999999998e-003 | J57: 8.6999999999999994e-003 | K57: 23.18 | L57: -1.78e-002 | M57: 115.1 | N57: 50.32 | O57: 1.3600000000000001 | P57: 46.07 | Q57: 已到 | R57: 5.36年 | S57: 3.36年 | T57: 8 | U57: 16 | V57: 1.9e-002 | W57: 7.2000000000000008e-002 | X57: 3.3000000000000002e-002 | Y57: 111 | Z57: 2.71 | AA57: 1.0500000000000001e-002 | AB57: 5.4000000000000003e-003 | AC57: -1.4199999999999999e-002 | AD57: -1.6200000000000003e-002 | AE57: 89.93 | AF57: 93.04 | AG57: 0.05 | AH57: AA | AI57: 4.1299999999999996e-002 | AJ57: =H57+100*O57 -> 244.93000000000001 | AK57: 171.8 | AL57: 312 | AM57: 78.8 | AN57: 302 | AO57: -4.7e-002 | AP57: 6 | AQ57: 太平转债!
A58: 57 | B58: 123119 | C58: 康泰转2! | D58: 300601 | E58: 康泰生物 | F58: 医药 | G58: 生物制药 | H58: 118.96 | I58: -9.8999999999999991e-003 | J58: 9.8999999999999991e-003 | K58: 82.19 | L58: 1.e-004 | M58: 117.1 | N58: 108.5 | O58: 0.56999999999999995 | P58: 75.75 | Q58: 已到 | R58: 5.36年 | S58: 3.36年 | T58: 20 | U58: 45 | V58: 1.9e-002 | W58: 3.5000000000000003e-002 | X58: 2.7000000000000003e-002 | Y58: 565 | Z58: 6.63 | AA58: -3.0000000000000001e-003 | AB58: -8.6e-003 | AC58: -3.8699999999999998e-002 | AD58: -4.0599999999999997e-002 | AE58: 89.93 | AF58: 94.65 | AG58: 0.32 | AH58: AA | AI58: 4.1299999999999996e-002 | AJ58: =H58+100*O58 -> 175.95999999999998 | AK58: 162.2 | AL58: 253 | AM58: 67.5 | AN58: 241 | AO58: 4.0000000000000001e-003 | AP58: 12 | AQ58: 康泰转2!
A59: 58 | B59: 127041 | C59: 弘亚转债! | D59: 2833 | E59: 弘亚数控 | F59: 机械装备 | G59: 专用设备 | H59: 116.158 | I59: -7.1999999999999998e-003 | J59: 5.6999999999999993e-003 | K59: 26.58 | L59: -5.6000000000000008e-003 | M59: 118.75 | N59: 38.09 | O59: 0.66500000000000004 | P59: 69.78 | Q59: 已到 | R59: 4.35年 | S59: 2.35年 | T59: 6 | U59: 7 | V59: 1.e-002 | W59: 7.400000000000001e-002 | X59: 5.2000000000000005e-002 | Y59: 81 | Z59: 4.03 | AA59: 5.1999999999999998e-003 | AB59: -2.3e-003 | AC59: -4.87e-002 | AD59: -5.0499999999999996e-002 | AE59: 88.6 | AF59: 92.52 | AG59: 0.27 | AH59: AA- | AI59: 5.9999999999999998e-002 | AJ59: =H59+100*O59 -> 182.65800000000002 | AK59: 162.5 | AL59: 259 | AM59: 70 | AN59: 263 | AO59: -2.7999999999999997e-002 | AP59: 6 | AQ59: 弘亚转债!
A60: 59 | B60: 123118 | C60: 惠城转债 | D60: 300779 | E60: 惠城环保 | F60: 化工 | G60: 其他 | H60: 123 | I60: -9.8999999999999991e-003 | J60: -8.9999999999999998e-004 | K60: 16.37 | L60: -1.6799999999999999e-002 | M60: 121.7 | N60: 17.11 | O60: 0.28600000000000003 | P60: 95.68 | Q60: 已到 | R60: 5.34年 | S60: 3.34年 | T60: 3.2 | U60: 3.1 | V60: 8.0000000000000002e-003 | W60: 0.19500000000000001 | X60: 0.187 | Y60: 16 | Z60: 2.46 | AA60: -2.e-003 | AB60: -8.8999999999999999e-003 | AC60: -4.5599999999999995e-002 | AD60: -4.7899999999999998e-002 | AE60: 81.91 | AF60: 84.22 | AG60: 0.65 | AH60: A+ | AI60: 7.3300000000000004e-002 | AJ60: =H60+100*O60 -> 151.59999999999999 | AK60: 150.3 | AL60: 138 | AM60: 66.1 | AN60: 228 | AO60: 4.0000000000000001e-003 | AP60: 10 | AQ60: 惠城转债
A61: 60 | B61: 127040 | C61: 国泰转债! | D61: 2091 | E61: 江苏国泰 | F61: 商业零售 | G61: 商业零售 | H61: 126.3 | I61: -1.47e-002 | J61: -2.0999999999999999e-003 | K61: 11.15 | L61: -2.1899999999999999e-002 | M61: 112.5 | N61: 9.02 | O61: 2.2000000000000002e-002 | P61: 123.61 | Q61: 已到 | R61: 5.34年 | S61: 3.34年 | T61: 42.6 | U61: 162 | V61: 2.9999999999999999e-002 | W61: 0.24399999999999999 | X61: 0.30199999999999999 | Y61: 174 | Z61: 1.82 | AA61: -2.18e-002 | AB61: -2.5899999999999999e-002 | AC61: -5.6799999999999996e-002 | AD61: -5.8299999999999998e-002 | AE61: 90.97 | AF61: 93.28 | AG61: 0.77 | AH61: AA+ | AI61: 3.6299999999999999e-002 | AJ61: =H61+100*O61 -> 128.5 | AK61: 129 | AL61: 3 | AM61: 35.7 | AN61: 19 | AO61: -4.2000000000000003e-002 | AP61: 14 | AQ61: 国泰转债!
A62: 61 | B62: 127039 | C62: 北港转债 | D62: 582 | E62: 北部湾港 | F62: 机场高速 | G62: 港口 | H62: 120.15 | I62: -1.9199999999999998e-002 | J62: 1.8e-003 | K62: 8.06 | L62: -3.2400000000000005e-002 | M62: 113 | N62: 8.35 | O62: 0.245 | P62: 96.53 | Q62: 已到 | R62: 5.32年 | S62: 3.32年 | T62: 30 | U62: 36 | V62: 1.e-002 | W62: 0.22800000000000001 | X62: 0.22 | Y62: 132 | Z62: 1.23 | AA62: -1.1699999999999999e-002 | AB62: -1.6e-002 | AC62: -4.2199999999999994e-002 | AD62: -4.4000000000000004e-002 | AE62: 92.12 | AF62: 94.77 | AG62: 0.54 | AH62: AAA | AI62: 3.4300000000000004e-002 | AJ62: =H62+100*O62 -> 144.65000000000001 | AK62: 143.8 | AL62: 68 | AM62: 49 | AN62: 87 | AO62: -1.e-003 | AP62: 7 | AQ62: 北港转债
A63: 62 | B63: 113626 | C63: 伯特转债! | D63: 603596 | E63: 伯特利 | F63: 汽车 | G63: 零部件制 | H63: 208.02 | I63: -5.4299999999999994e-002 | J63: 1.5900000000000001e-002 | K63: 70.1 | L63: -4.0800000000000003e-002 | M63: 121.1 | N63: 36.01 | O63: 6.9000000000000006e-002 | P63: 194.67 | Q63: 已到 | R63: 5.32年 | S63: 3.32年 | T63: 9.02 | U63: 178 | V63: 9.1999999999999998e-002 | W63: 3.1e-002 | X63: 6.0999999999999999e-002 | Y63: 286 | Z63: 9.05 | AA63: -9.820000000000001e-002 | AB63: -0.10400000000000001 | AC63: -0.10300000000000001 | AD63: -0.10400000000000001 | AE63: 90.09 | AF63: 98.04 | AG63: 0.94 | AH63: AA | AI63: 4.1299999999999996e-002 | AJ63: =H63+100*O63 -> 214.92000000000002 | AK63: 221.4 | AL63: 355 | AM63: 123.3 | AN63: 355 | AO63: -8.0000000000000002e-002 | AP63: 4 | AQ63: 伯特转债!
A64: 63 | B64: 123117 | C64: 健帆转债! | D64: 300529 | E64: 健帆生物 | F64: 医药 | G64: 医疗器械 | H64: 115.361 | I64: -1.6000000000000001e-003 | J64: 3.4000000000000002e-003 | K64: 46.12 | L64: 2.35e-002 | M64: 115.1 | N64: 90.57 | O64: 1.27 | P64: 50.92 | Q64: 已到 | R64: 5.30年 | S64: 3.30年 | T64: 10 | U64: 8.2 | V64: 6.9999999999999993e-003 | W64: 2.7000000000000003e-002 | X64: 1.3999999999999999e-002 | Y64: 371 | Z64: 12.18 | AA64: -4.0000000000000002e-004 | AB64: -5.5000000000000005e-003 | AC64: -3.0800000000000001e-002 | AD64: -3.27e-002 | AE64: 90.15 | AF64: 93.27 | AG64: 0.07 | AH64: AA | AI64: 4.1299999999999996e-002 | AJ64: =H64+100*O64 -> 242.36099999999999 | AK64: 179.8 | AL64: 323 | AM64: 86.5 | AN64: 322 | AO64: -1.e-002 | AP64: 10 | AQ64: 健帆转债!
A65: 64 | B65: 113051 | C65: 节能转债! | D65: 601016 | E65: 节能风电 | F65: 能源电力 | G65: 风能 | H65: 153.88 | I65: -2.2400000000000003e-002 | J65: 1.2199999999999999e-002 | K65: 5.54 | L65: -1.2500000000000001e-002 | M65: 114.5 | N65: 4.05 | O65: 0.125 | P65: 136.79 | Q65: 已到 | R65: 5.30年 | S65: 3.30年 | T65: 30 | U65: 183 | V65: 3.9e-002 | W65: 0.10800000000000001 | X65: 0.14800000000000002 | Y65: 278 | Z65: 2.69 | AA65: -5.5e-002 | AB65: -5.9500000000000004e-002 | AC65: -0.107 | AD65: -0.109 | AE65: 91.11 | AF65: 95.08 | AG65: 0.82 | AH65: AA+ | AI65: 3.6299999999999999e-002 | AJ65: =H65+100*O65 -> 166.38 | AK65: 171 | AL65: 307 | AM65: 75.9 | AN65: 292 | AO65: 1.3000000000000001e-002 | AP65: 9 | AQ65: 节能转债!
A66: 65 | B66: 113050 | C66: 南银转债 | D66: 601009 | E66: 南京银行 | F66: 金融 | G66: 银行行业 | H66: 119.55 | I66: -7.0999999999999995e-003 | J66: 1.23e-002 | K66: 10.35 | L66: 8.8000000000000005e-003 | M66: 111.2 | N66: 10.1 | O66: 0.16699999999999998 | P66: 102.48 | Q66: 已到 | R66: 5.28年 | S66: 无权 | T66: 199 | U66: 384 | V66: 1.6e-002 | W66: 0.192 | X66: 0.19699999999999998 | Y66: 1036. | Z66: 0.98 | AA66: -1.38e-002 | AB66: -1.7600000000000001e-002 | AC66: 无权 | AD66: 无权 | AE66: 无权 | AF66: 93.32 | AG66: 0.59 | AH66: AAA | AI66: 3.4300000000000004e-002 | AJ66: =H66+100*O66 -> 136.25 | AK66: 136.6 | AL66: 24 | AM66: 43.3 | AN66: 49 | AO66: 2.8999999999999998e-002 | AP66: 8 | AQ66: 南银转债
A67: 66 | B67: 113625 | C67: 江山转债! | D67: 603208 | E67: 江山欧派 | F67: 其他 | G67: 家居用品 | H67: 121.65 | I67: -2.4500000000000001e-002 | J67: -2.e-003 | K67: 75.21 | L67: -6.3899999999999998e-002 | M67: 124 | N67: 96.33 | O67: 0.55799999999999994 | P67: 78.08 | Q67: 已到 | R67: 5.27年 | S67: 3.27年 | T67: 5.83 | U67: 218 | V67: 0.308 | W67: 7.400000000000001e-002 | X67: 5.7999999999999996e-002 | Y67: 79 | Z67: 4.3 | AA67: 3.7000000000000002e-003 | AB67: -3.9000000000000003e-003 | AC67: -4.5199999999999997e-002 | AD67: -4.7300000000000002e-002 | AE67: 84.63 | AF67: 90.8 | AG67: 0.42 | AH67: AA- | AI67: 6.2300000000000001e-002 | AJ67: =H67+100*O67 -> 177.44999999999999 | AK67: 165.2 | AL67: 282 | AM67: 74.4 | AN67: 285 | AO67: 2.2000000000000002e-002 | AP67: 8 | AQ67: 江山转债!
A68: 67 | B68: 127038 | C68: 国微转债! | D68: 2049 | E68: 紫光国微 | F68: 电子 | G68: 芯片制造 | H68: 177.087 | I68: -5.8999999999999999e-003 | J68: 2.0199999999999999e-002 | K68: 219.32 | L68: 1.5800000000000002e-002 | M68: 114.5 | N68: 137.78 | O68: 0.11199999999999999 | P68: 159.18 | Q68: 已到 | R68: 5.27年 | S68: 3.27年 | T68: 14.9 | U68: 155 | V68: 5.7999999999999996e-002 | W68: 1.1000000000000001e-002 | X68: 1.8000000000000002e-002 | Y68: 1331. | Z68: 20.25 | AA68: -8.0500000000000002e-002 | AB68: -8.4900000000000003e-002 | AC68: -0.14199999999999999 | AD68: -0.14300000000000002 | AE68: 91.21 | AF68: 95.18 | AG68: 0.9 | AH68: AA+ | AI68: 3.6299999999999999e-002 | AJ68: =H68+100*O68 -> 188.28699999999998 | AK68: 195 | AL68: 339 | AM68: 99.8 | AN68: 343 | AO68: 7.0999999999999994e-002 | AP68: 6 | AQ68: 国微转债!
A69: 68 | B69: 113049 | C69: 长汽转债 | D69: 601633 | E69: 长城汽车 | F69: 汽车 | G69: 乘用车 | H69: 125.73 | I69: -1.23e-002 | J69: 4.1999999999999997e-003 | K69: 33.24 | L69: -1.77e-002 | M69: 110.5 | N69: 38.01 | O69: 0.43799999999999994 | P69: 87.45 | Q69: 已到 | R69: 5.27年 | S69: 3.27年 | T69: 35 | U69: 176 | V69: 4.0000000000000001e-002 | W69: 1.1000000000000001e-002 | X69: 1.e-002 | Y69: 3070. | Z69: 5.23 | AA69: -2.4500000000000001e-002 | AB69: -2.81e-002 | AC69: -5.8700000000000002e-002 | AD69: -5.9900000000000002e-002 | AE69: 91.14 | AF69: 92.74 | AG69: 0.45 | AH69: AAA | AI69: 3.4300000000000004e-002 | AJ69: =H69+100*O69 -> 169.53 | AK69: 164 | AL69: 274 | AM69: 71.3 | AN69: 269 | AO69: -0.13100000000000001 | AP69: 6 | AQ69: 长汽转债
A70: 69 | B70: 123116 | C70: 万兴转债! | D70: 300624 | E70: 万兴科技 | F70: 计算机及 | G70: 软件开发 | H70: 120.23 | I70: -1.5300000000000001e-002 | J70: 1.8500000000000003e-002 | K70: 38.37 | L70: 6.6e-003 | M70: 121.4 | N70: 49.79 | O70: 0.56000000000000005 | P70: 77.06 | Q70: 已到 | R70: 5.26年 | S70: 3.26年 | T70: 3.78 | U70: 33 | V70: 7.2000000000000008e-002 | W70: 7.5999999999999998e-002 | X70: 5.7999999999999996e-002 | Y70: 50 | Z70: 5.99 | AA70: 1.9e-003 | AB70: -5.1000000000000004e-003 | AC70: -4.0999999999999995e-002 | AD70: -4.3200000000000002e-002 | AE70: 82.09 | AF70: 84.41 | AG70: 0.49 | AH70: A+ | AI70: 7.3300000000000004e-002 | AJ70: =H70+100*O70 -> 176.23000000000002 | AK70: 163.4 | AL70: 267 | AM70: 79 | AN70: 304 | AO70: -4.0999999999999995e-002 | AP70: 9 | AQ70: 万兴转债!
A71: 70 | B71: 123115 | C71: 捷捷转债 | D71: 300623 | E71: 捷捷微电 | F71: 电子 | G71: 元器件制 | H71: 126.01 | I71: -1.2500000000000001e-002 | J71: 1.38e-002 | K71: 27.91 | L71: 2.2000000000000001e-003 | M71: 118.5 | N71: 29 | O71: 0.309 | P71: 96.24 | Q71: 已到 | R71: 5.26年 | S71: 3.26年 | T71: 11.9 | U71: 33 | V71: 2.2000000000000002e-002 | W71: 5.7999999999999996e-002 | X71: 5.5999999999999994e-002 | Y71: 206 | Z71: 7.23 | AA71: -1.18e-002 | AB71: -1.78e-002 | AC71: -5.5399999999999998e-002 | AD71: -5.74e-002 | AE71: 84.61 | AF71: 86.83 | AG71: 0.61 | AH71: AA- | AI71: 6.2300000000000001e-002 | AJ71: =H71+100*O71 -> 156.91 | AK71: 155.8 | AL71: 196 | AM71: 69 | AN71: 256 | AO71: 1.9e-002 | AP71: 9 | AQ71: 捷捷转债
A72: 71 | B72: 127037 | C72: 银轮转债 | D72: 2126 | E72: 银轮股份 | F72: 汽车 | G72: 零部件制 | H72: 127 | I72: -2.9100000000000001e-002 | J72: 1.9e-002 | K72: 10.07 | L72: -1.95e-002 | M72: 115.1 | N72: 10.77 | O72: 0.35799999999999998 | P72: 93.5 | Q72: 已到 | R72: 5.26年 | S72: 3.26年 | T72: 7 | U72: 17 | V72: 1.9e-002 | W72: 8.8000000000000009e-002 | X72: 8.199999999999999e-002 | Y72: 80 | Z72: 1.89 | AA72: -1.89e-002 | AB72: -2.3799999999999998e-002 | AC72: -5.8200000000000002e-002 | AD72: -5.9999999999999998e-002 | AE72: 90.31 | AF72: 93.43 | AG72: 0.52 | AH72: AA | AI72: 4.1299999999999996e-002 | AJ72: =H72+100*O72 -> 162.80000000000001 | AK72: 160.5 | AL72: 234 | AM72: 67.1 | AN72: 234 | AO72: -2.6000000000000002e-002 | AP72: 4 | AQ72: 银轮转债
A73: 72 | B73: 127036 | C73: 三花转债 | D73: 2050 | E73: 三花智控 | F73: 机械装备 | G73: 通用设备 | H73: 124.88 | I73: -1.8e-003 | J73: -1.0500000000000001e-002 | K73: 19.2 | L73: -2.7400000000000001e-002 | M73: 114.5 | N73: 21.55 | O73: 0.40200000000000002 | P73: 89.1 | Q73: 已到 | R73: 5.24年 | S73: 3.24年 | T73: 30 | U73: 50 | V73: 1.3000000000000001e-002 | W73: 4.2999999999999997e-002 | X73: 3.9e-002 | Y73: 690 | Z73: 6.68 | AA73: -1.67e-002 | AB73: -2.1499999999999998e-002 | AC73: -5.5300000000000002e-002 | AD73: -5.6799999999999996e-002 | AE73: 91.29 | AF73: 95.27 | AG73: 0.45 | AH73: AA+ | AI73: 3.6299999999999999e-002 | AJ73: =H73+100*O73 -> 165.07999999999998 | AK73: 160.7 | AL73: 236 | AM73: 65.4 | AN73: 224 | AO73: -1.4999999999999999e-002 | AP73: 7 | AQ73: 三花转债
A74: 73 | B74: 127035 | C74: 濮耐转债 | D74: 2225 | E74: 濮耐股份 | F74: 钢铁 | G74: 钢铁行业 | H74: 120.58 | I74: -1.3000000000000001e-002 | J74: 1.0700000000000001e-002 | K74: 4.21 | L74: -4.6999999999999993e-003 | M74: 114.7 | N74: 4.43 | O74: 0.26899999999999996 | P74: 95.03 | Q74: 已到 | R74: 4.22年 | S74: 2.22年 | T74: 6.26 | U74: 3.9 | V74: 5.0000000000000001e-003 | W74: 0.14699999999999999 | X74: 0.14000000000000001 | Y74: 43 | Z74: 1.39 | AA74: -1.2e-002 | AB74: -1.8100000000000002e-002 | AC74: -6.2699999999999992e-002 | AD74: -6.5199999999999994e-002 | AE74: 94.45 | AF74: 97.95 | AG74: 0.49 | AH74: AA | AI74: 3.9e-002 | AJ74: =H74+100*O74 -> 147.47999999999999 | AK74: 146.1 | AL74: 87 | AM74: 48.2 | AN74: 80 | AO74: 1.e-003 | AP74: 9 | AQ74: 濮耐转债
A75: 74 | B75: 123114 | C75: 三角转债! | D75: 300775 | E75: 三角防务 | F75: 航空航天 | G75: 航空航天 | H75: 167.2 | I75: -1.5900000000000001e-002 | J75: 1.66e-002 | K75: 46.61 | L75: 8.9999999999999998e-004 | M75: 121 | N75: 31.82 | O75: 0.14099999999999999 | P75: 146.48 | Q75: 已到 | R75: 5.22年 | S75: 3.22年 | T75: 9.04 | U75: 164 | V75: 0.106 | W75: 3.9e-002 | X75: 5.7000000000000002e-002 | Y75: 231 | Z75: 10.69 | AA75: -6.1200000000000004e-002 | AB75: -6.7400000000000002e-002 | AC75: -0.128 | AD75: -0.13 | AE75: 84.87 | AF75: 88.87 | AG75: 0.85 | AH75: AA- | AI75: 6.2300000000000001e-002 | AJ75: =H75+100*O75 -> 181.29999999999998 | AK75: 187.9 | AL75: 333 | AM75: 99 | AN75: 341 | AO75: 3.3000000000000002e-002 | AP75: 7 | AQ75: 三角转债!
A76: 75 | B76: 111000 | C76: 起帆转债 | D76: 605222 | E76: 起帆电缆 | F76: 能源电力 | G76: 电力设备 | H76: 129.3 | I76: -2.0199999999999999e-002 | J76: 1.43e-002 | K76: 22.67 | L76: -8.3000000000000001e-003 | M76: 120.5 | N76: 20.1 | O76: 0.14599999999999999 | P76: 112.79 | Q76: 已到 | R76: 5.22年 | S76: 3.22年 | T76: 10 | U76: 26 | V76: 2.e-002 | W76: 0.105 | X76: 0.11900000000000001 | Y76: 95 | Z76: 2.73 | AA76: -1.37e-002 | AB76: -2.0299999999999999e-002 | AC76: -6.3299999999999995e-002 | AD76: -6.5299999999999997e-002 | AE76: 84.82 | AF76: 88.5 | AG76: 0.7 | AH76: AA- | AI76: 6.2300000000000001e-002 | AJ76: =H76+100*O76 -> 143.90000000000001 | AK76: 145.8 | AL76: 83 | AM76: 57.3 | AN76: 158 | AO76: -5.0000000000000003e-002 | AP76: 10 | AQ76: 起帆转债
A77: 76 | B77: 127034 | C77: 绿茵转债! | D77: 2887 | E77: 绿茵生态 | F77: 城市公用 | G77: 生态环境 | H77: 109.56 | I77: -6.5000000000000006e-003 | J77: 0. | K77: 9.96 | L77: -1.3899999999999999e-002 | M77: 119 | N77: 12.38 | O77: 0.36200000000000004 | P77: 80.45 | Q77: 已到 | R77: 5年56天 | S77: 3年56天 | T77: 7.12 | U77: 8.3 | V77: 1.1000000000000001e-002 | W77: 0.22899999999999998 | X77: 0.184 | Y77: 31 | Z77: 1.52 | AA77: 1.6500000000000001e-002 | AB77: 1.e-002 | AC77: -1.5900000000000001e-002 | AD77: -1.8200000000000001e-002 | AE77: 85.22 | AF77: 87.78 | AG77: 0.47 | AH77: AA- | AI77: 6.2300000000000001e-002 | AJ77: =H77+100*O77 -> 145.75999999999999 | AK77: 138.7 | AL77: 31 | AM77: 50.9 | AN77: 104 | AO77: -1.4999999999999999e-002 | AP77: 47 | AQ77: 绿茵转债!
A78: 77 | B78: 113624 | C78: 正川转债! | D78: 603976 | E78: 正川股份 | F78: 医药 | G78: 医药行业 | H78: 113.21 | I78: -6.8999999999999999e-003 | J78: 4.5000000000000005e-003 | K78: 29.86 | L78: -8.0000000000000002e-003 | M78: 121.6 | N78: 46.69 | O78: 0.77000000000000002 | P78: 63.95 | Q78: 已到 | R78: 5年54天 | S78: 3年54天 | T78: 4.05 | U78: 4.2 | V78: 9.0000000000000011e-003 | W78: 8.9999999999999997e-002 | X78: 5.7000000000000002e-002 | Y78: 45 | Z78: 4.09 | AA78: 1.43e-002 | AB78: 6.9999999999999993e-003 | AC78: -2.3900000000000001e-002 | AD78: -2.64e-002 | AE78: 83.02 | AF78: 85.3 | AG78: 0.31 | AH78: A+ | AI78: 7.3300000000000004e-002 | AJ78: =H78+100*O78 -> 190.20999999999998 | AK78: 162.5 | AL78: 257 | AM78: 77.2 | AN78: 299 | AO78: -1.3000000000000001e-002 | AP78: 25 | AQ78: 正川转债!
A79: 78 | B79: 113048 | C79: 晶科转债!! | D79: 601778 | E79: 晶科科技 | F79: 能源电力 | G79: 太阳能 | H79: 146.95 | I79: -2.1899999999999999e-002 | J79: 1.6399999999999998e-002 | K79: 7.13 | L79: -6.9999999999999993e-003 | M79: 117.1 | N79: 5.46 | O79: 0.125 | P79: 130.59 | Q79: 已到 | R79: 5年49天 | S79: 3年49天 | T79: 23 | U79: 243 | V79: 7.2000000000000008e-002 | W79: 0.111 | X79: 0.14499999999999999 | Y79: 206 | Z79: 1.74 | AA79: -4.4000000000000004e-002 | AB79: -4.9500000000000002e-002 | AC79: -0.10099999999999999 | AD79: -0.10099999999999999 | AE79: 90.77 | AF79: 95.52 | AG79: 0.78 | AH79: AA | AI79: 4.1299999999999996e-002 | AJ79: =H79+100*O79 -> 159.44999999999999 | AK79: 163.3 | AL79: 266 | AM79: 67.8 | AN79: 244 | AO79: 2.3e-002 | AP79: 14 | AQ79: 晶科转债!!
A80: 79 | B80: 123113 | C80: 仙乐转债! | D80: 300791 | E80: 仙乐健康 | F80: 食品饮料 | G80: 食品饮料 | H80: 113 | I80: -8.0000000000000002e-003 | J80: 7.7000000000000002e-003 | K80: 34.68 | L80: -1.1999999999999999e-003 | M80: 118.5 | N80: 56.88 | O80: 0.85299999999999998 | P80: 60.97 | Q80: 已到 | R80: 5年45天 | S80: 3年45天 | T80: 10.2 | U80: 7.7 | V80: 6.9999999999999993e-003 | W80: 0.16399999999999998 | X80: 0.10000000000000001 | Y80: 62 | Z80: 2.7 | AA80: 9.4999999999999998e-003 | AB80: 3.0999999999999999e-003 | AC80: -2.5600000000000001e-002 | AD80: -2.7799999999999998e-002 | AE80: 85.31 | AF80: 87.55 | AG80: 0.23 | AH80: AA- | AI80: 6.2300000000000001e-002 | AJ80: =H80+100*O80 -> 198.30000000000001 | AK80: 165 | AL80: 279 | AM80: 77.5 | AN80: 300 | AO80: -3.7000000000000005e-002 | AP80: 7 | AQ80: 仙乐转债!
A81: 80 | B81: 127033 | C81: 中装转2! | D81: 2822 | E81: 中装建设 | F81: 建筑 | G81: 装饰工程 | H81: 119.591 | I81: -2.5899999999999999e-002 | J81: 1.4199999999999999e-002 | K81: 6 | L81: -2.2799999999999997e-002 | M81: 117.1 | N81: 6.28 | O81: 0.252 | P81: 95.54 | Q81: 已到 | R81: 5年42天 | S81: 3年42天 | T81: 11.6 | U81: 138 | V81: 9.8000000000000004e-002 | W81: 0.26800000000000002 | X81: 0.25600000000000001 | Y81: 43 | Z81: 1.24 | AA81: -4.1999999999999997e-003 | AB81: -1.e-002 | AC81: -4.3200000000000002e-002 | AD81: -4.5100000000000001e-002 | AE81: 90.84 | AF81: 95.6 | AG81: 0.51 | AH81: AA | AI81: 4.1299999999999996e-002 | AJ81: =H81+100*O81 -> 144.791 | AK81: 143.6 | AL81: 67 | AM81: 48 | AN81: 78 | AO81: -6.9000000000000006e-002 | AP81: 29 | AQ81: 中装转2!
A82: 81 | B82: 110080 | C82: 东湖转债 | D82: 600133 | E82: 东湖高新 | F82: 建筑 | G82: 建筑工程 | H82: 114.07 | I82: -1.47e-002 | J82: 3.4000000000000002e-003 | K82: 5.54 | L82: -2.29e-002 | M82: 115.1 | N82: 6.05 | O82: 0.24600000000000002 | P82: 91.57 | Q82: 已到 | R82: 5年38天 | S82: 3年38天 | T82: 15.5 | U82: 21 | V82: 1.2e-002 | W82: 0.35200000000000004 | X82: 0.32200000000000001 | Y82: 44 | Z82: 0.78 | AA82: 1.8e-003 | AB82: -3.4999999999999996e-003 | AC82: -2.9300000000000003e-002 | AD82: -3.1300000000000001e-002 | AE82: 90.88 | AF82: 94.01 | AG82: 0.49 | AH82: AA | AI82: 4.1299999999999996e-002 | AJ82: =H82+100*O82 -> 138.66999999999999 | AK82: 136.6 | AL82: 22 | AM82: 42.6 | AN82: 46 | AO82: -6.9999999999999993e-003 | AP82: 34 | AQ82: 东湖转债
A83: 82 | B83: 127032 | C83: 苏行转债 | D83: 2966 | E83: 苏州银行 | F83: 金融 | G83: 银行行业 | H83: 113.685 | I83: -1.5700000000000002e-002 | J83: 1.32e-002 | K83: 7.42 | L83: -5.4000000000000003e-003 | M83: 115.1 | N83: 8.1 | O83: 0.24100000000000002 | P83: 91.6 | Q83: 已到 | R83: 5年38天 | S83: 无权 | T83: 50 | U83: 135 | V83: 2.4e-002 | W83: 0.20199999999999999 | X83: 0.185 | Y83: 247 | Z83: 0.78 | AA83: 2.5000000000000001e-003 | AB83: -2.8000000000000004e-003 | AC83: 无权 | AD83: 无权 | AE83: 无权 | AF83: 97.21 | AG83: 0.46 | AH83: AAA | AI83: 3.4300000000000004e-002 | AJ83: =H83+100*O83 -> 137.785 | AK83: 135.8 | AL83: 19 | AM83: 38.6 | AN83: 32 | AO83: 4.2000000000000003e-002 | AP83: 11 | AQ83: 苏行转债
A84: 83 | B84: 113047 | C84: 旗滨转债! | D84: 601636 | E84: 旗滨集团 | F84: 建筑 | G84: 玻璃 | H84: 144.13 | I84: -2.0299999999999999e-002 | J84: 8.5000000000000006e-003 | K84: 15.05 | L84: -1.7000000000000001e-002 | M84: 114 | N84: 12.8 | O84: 0.22600000000000001 | P84: 117.58 | Q84: 已到 | R84: 5年35天 | S84: 3年35天 | T84: 15 | U84: 62 | V84: 2.7999999999999997e-002 | W84: 3.7000000000000005e-002 | X84: 4.4000000000000004e-002 | Y84: 404 | Z84: 3.29 | AA84: -4.5599999999999995e-002 | AB84: -5.0199999999999995e-002 | AC84: -9.9700000000000011e-002 | AD84: -0.10099999999999999 | AE84: 91.32 | AF84: 95.31 | AG84: 0.7 | AH84: AA+ | AI84: 3.6299999999999999e-002 | AJ84: =H84+100*O84 -> 166.72999999999999 | AK84: 170.7 | AL84: 304 | AM84: 75.4 | AN84: 289 | AO84: -9.4e-002 | AP84: 8 | AQ84: 旗滨转债!
A85: 84 | B85: 123112 | C85: 万讯转债! | D85: 300112 | E85: 万讯自控 | F85: 机械装备 | G85: 专用设备 | H85: 135.288 | I85: -2.3199999999999998e-002 | J85: 7.0999999999999995e-003 | K85: 10.55 | L85: -2.3099999999999999e-002 | M85: 124.4 | N85: 8.93 | O85: 0.14499999999999999 | P85: 118.14 | Q85: 已到 | R85: 5年34天 | S85: 3年34天 | T85: 2.45 | U85: 30 | V85: 8.900000000000001e-002 | W85: 8.1000000000000003e-002 | X85: 9.6000000000000002e-002 | Y85: 30 | Z85: 2.77 | AA85: -1.67e-002 | AB85: -2.4500000000000001e-002 | AC85: -7.7399999999999997e-002 | AD85: -7.9600000000000004e-002 | AE85: 85.88 | AF85: 92.11 | AG85: 0.7 | AH85: AA- | AI85: 6.2300000000000001e-002 | AJ85: =H85+100*O85 -> 149.78800000000001 | AK85: 152.4 | AL85: 166 | AM85: 60.3 | AN85: 180 | AO85: -3.3000000000000002e-002 | AP85: 14 | AQ85: 万讯转债!
A86: 85 | B86: 113623 | C86: 凤21转债 | D86: 603225 | E86: 新凤鸣 | F86: 化工 | G86: 化纤 | H86: 118.17 | I86: -7.8000000000000005e-003 | J86: 1.8e-003 | K86: 13.27 | L86: -1.7000000000000001e-002 | M86: 117.1 | N86: 16.47 | O86: 0.46700000000000003 | P86: 80.57 | Q86: 已到 | R86: 5年34天 | S86: 3年34天 | T86: 25 | U86: 68 | V86: 2.3e-002 | W86: 0.12300000000000001 | X86: 9.9000000000000005e-002 | Y86: 203 | Z86: 1.28 | AA86: -1.8e-003 | AB86: -7.7000000000000002e-003 | AC86: -3.9900000000000005e-002 | AD86: -4.1900000000000007e-002 | AE86: 90.92 | AF86: 95.68 | AG86: 0.35 | AH86: AA | AI86: 4.1299999999999996e-002 | AJ86: =H86+100*O86 -> 164.87 | AK86: 155.8 | AL86: 195 | AM86: 60.1 | AN86: 179 | AO86: -6.5000000000000002e-002 | AP86: 4 | AQ86: 凤21转债
A87: 86 | B87: 123109 | C87: 昌红转债! | D87: 300151 | E87: 昌红科技 | F87: 机械装备 | G87: 专用设备 | H87: 124.2 | I87: -1.43e-002 | J87: -4.3e-003 | K87: 25.24 | L87: -3.4799999999999998e-002 | M87: 121 | N87: 28.06 | O87: 0.38100000000000001 | P87: 89.95 | Q87: 已到 | R87: 5年27天 | S87: 3年27天 | T87: 4.6 | U87: 15 | V87: 2.6000000000000002e-002 | W87: 3.6000000000000004e-002 | X87: 3.3000000000000002e-002 | Y87: 127 | Z87: 12.28 | AA87: -5.1999999999999998e-003 | AB87: -1.2199999999999999e-002 | AC87: -5.4100000000000002e-002 | AD87: -5.62e-002 | AE87: 85.64 | AF87: 89.67 | AG87: 0.53 | AH87: AA- | AI87: 6.2300000000000001e-002 | AJ87: =H87+100*O87 -> 162.30000000000001 | AK87: 158.4 | AL87: 217 | AM87: 68.8 | AN87: 253 | AO87: -0.154 | AP87: 6 | AQ87: 昌红转债!
A88: 87 | B88: 123110 | C88: 九典转债 | D88: 300705 | E88: 九典制药 | F88: 医药 | G88: 化学制药 | H88: 126.566 | I88: -1.5800000000000002e-002 | J88: 2.5000000000000001e-003 | K88: 27.09 | L88: -1.9900000000000001e-002 | M88: 121.4 | N88: 26.44 | O88: 0.23499999999999999 | P88: 102.46 | Q88: 已到 | R88: 5年27天 | S88: 3年27天 | T88: 2.7 | U88: 14 | V88: 4.2000000000000003e-002 | W88: 4.2000000000000003e-002 | X88: 4.2999999999999997e-002 | Y88: 64 | Z88: 6.39 | AA88: -8.3999999999999995e-003 | AB88: -1.55e-002 | AC88: -5.8299999999999998e-002 | AD88: -6.0599999999999994e-002 | AE88: 83.26 | AF88: 85.56 | AG88: 0.67 | AH88: A+ | AI88: 7.3300000000000004e-002 | AJ88: =H88+100*O88 -> 150.066 | AK88: 150.7 | AL88: 146 | AM88: 65.1 | AN88: 219 | AO88: -2.7999999999999997e-002 | AP88: 11 | AQ88: 九典转债
A89: 88 | B89: 123108 | C89: 乐普转2! | D89: 300003 | E89: 乐普医疗 | F89: 医药 | G89: 医疗器械 | H89: 117.39 | I89: -2.3e-003 | J89: 3.3e-003 | K89: 21.33 | L89: 4.6999999999999993e-003 | M89: 111.1 | N89: 29.5 | O89: 0.624 | P89: 72.31 | Q89: 已到 | R89: 4年25天 | S89: 2年25天 | T89: 16.4 | U89: 7.2 | V89: 4.0000000000000001e-003 | W89: 4.2999999999999997e-002 | X89: 3.1e-002 | Y89: 385 | Z89: 3.34 | AA89: -1.3600000000000001e-002 | AB89: -1.8500000000000003e-002 | AC89: -6.0999999999999999e-002 | AD89: -6.2600000000000003e-002 | AE89: 94.74 | AF89: 97.16 | AG89: 0.22 | AH89: AA+ | AI89: 3.4000000000000002e-002 | AJ89: =H89+100*O89 -> 179.78999999999999 | AK89: 162.5 | AL89: 258 | AM89: 65.3 | AN89: 223 | AO89: 5.0000000000000001e-003 | AP89: 14 | AQ89: 乐普转2!
A90: 89 | B90: 123107 | C90: 温氏转债! | D90: 300498 | E90: 温氏股份 | F90: 农业 | G90: 畜牧业 | H90: 131.111 | I90: -1.7899999999999999e-002 | J90: 3.7000000000000005e-002 | K90: 20.72 | L90: 2.6800000000000001e-002 | M90: 113 | N90: 17.62 | O90: 0.115 | P90: 117.59 | Q90: 已到 | R90: 5年24天 | S90: 3年24天 | T90: 93 | U90: 267 | V90: 2.2000000000000002e-002 | W90: 7.0999999999999994e-002 | X90: 8.3000000000000004e-002 | Y90: 1316. | Z90: 3.75 | AA90: -2.9399999999999999e-002 | AB90: -3.39e-002 | AC90: -7.1099999999999997e-002 | AD90: -7.2900000000000006e-002 | AE90: 92.9 | AF90: 95.58 | AG90: 0.71 | AH90: AAA | AI90: 3.4300000000000004e-002 | AJ90: =H90+100*O90 -> 142.61099999999999 | AK90: 144.6 | AL90: 73 | AM90: 49.1 | AN90: 88 | AO90: 5.0000000000000001e-003 | AP90: 12 | AQ90: 温氏转债!
A91: 90 | B91: 110079 | C91: 杭银转债! | D91: 600926 | E91: 杭州银行 | F91: 金融 | G91: 银行行业 | H91: 125.47 | I91: -1.38e-002 | J91: 5.1000000000000004e-003 | K91: 14.84 | L91: -1.26e-002 | M91: 112.4 | N91: 12.99 | O91: 9.8000000000000004e-002 | P91: 114.24 | Q91: 已到 | R91: 5年24天 | S91: 无权 | T91: 150 | U91: 265 | V91: 1.3999999999999999e-002 | W91: 0.17000000000000001 | X91: 0.19500000000000001 | Y91: 880 | Z91: 1.27 | AA91: -2.18e-002 | AB91: -2.6099999999999998e-002 | AC91: 无权 | AD91: 无权 | AE91: 无权 | AF91: 95.02 | AG91: 0.69 | AH91: AAA | AI91: 3.4300000000000004e-002 | AJ91: =H91+100*O91 -> 135.27000000000001 | AK91: 136.7 | AL91: 25 | AM91: 41.7 | AN91: 43 | AO91: 9.0000000000000011e-003 | AP91: 14 | AQ91: 杭银转债!
A92: 91 | B92: 113622 | C92: 杭叉转债! | D92: 603298 | E92: 杭叉集团 | F92: 机械装备 | G92: 通用设备 | H92: 115.11 | I92: -1.0700000000000001e-002 | J92: 6.4000000000000003e-003 | K92: 15.35 | L92: -2.1000000000000001e-002 | M92: 112.5 | N92: 23.08 | O92: 0.73099999999999998 | P92: 66.51 | Q92: 已到 | R92: 5年20天 | S92: 3年20天 | T92: 11.5 | U92: 2.9 | V92: 2.e-003 | W92: 8.5999999999999993e-002 | X92: 5.7999999999999996e-002 | Y92: 133 | Z92: 2.52 | AA92: -4.5999999999999999e-003 | AB92: -9.1000000000000004e-003 | AC92: -3.4099999999999998e-002 | AD92: -3.5799999999999998e-002 | AE92: 91.9 | AF92: 94.23 | AG92: 0.2 | AH92: AA+ | AI92: 3.6299999999999999e-002 | AJ92: =H92+100*O92 -> 188.20999999999998 | AK92: 163.7 | AL92: 272 | AM92: 69.5 | AN92: 262 | AO92: -6.6000000000000003e-002 | AP92: 5 | AQ92: 杭叉转债!
A93: 92 | B93: 127031 | C93: 洋丰转债! | D93: 902 | E93: 新洋丰 | F93: 化工 | G93: 农化 | H93: 125.501 | I93: -1.4999999999999999e-002 | J93: -2.3999999999999998e-003 | K93: 16.46 | L93: -3.5699999999999996e-002 | M93: 117.1 | N93: 17.76 | O93: 0.35399999999999998 | P93: 92.68 | Q93: 已到 | R93: 5年20天 | S93: 3年20天 | T93: 10 | U93: 28 | V93: 2.2000000000000002e-002 | W93: 4.7e-002 | X93: 4.2999999999999997e-002 | Y93: 215 | Z93: 2.85 | AA93: -1.3899999999999999e-002 | AB93: -1.9699999999999999e-002 | AC93: -5.8299999999999998e-002 | AD93: -6.0199999999999997e-002 | AE93: 91.06 | AF93: 95.83 | AG93: 0.49 | AH93: AA | AI93: 4.1299999999999996e-002 | AJ93: =H93+100*O93 -> 160.90100000000001 | AK93: 158.3 | AL93: 215 | AM93: 62.5 | AN93: 202 | AO93: -3.7999999999999999e-002 | AP93: 7 | AQ93: 洋丰转债!
A94: 93 | B94: 123106 | C94: 正丹转债! | D94: 300641 | E94: 正丹股份 | F94: 化工 | G94: 化工 | H94: 118.014 | I94: -7.4000000000000003e-003 | J94: 1.11e-002 | K94: 6.88 | L94: 7.3000000000000001e-003 | M94: 125.5 | N94: 7.5 | O94: 0.28600000000000003 | P94: 91.73 | Q94: 已到 | R94: 5年19天 | S94: 3年19天 | T94: 3.2 | U94: 5.3 | V94: 1.3999999999999999e-002 | W94: 9.5000000000000001e-002 | X94: 8.6999999999999994e-002 | Y94: 34 | Z94: 2.36 | AA94: 1.2500000000000001e-002 | AB94: 4.0000000000000001e-003 | AC94: -3.9399999999999998e-002 | AD94: -4.1500000000000002e-002 | AE94: 85.68 | AF94: 93.08 | AG94: 0.51 | AH94: AA- | AI94: 6.2300000000000001e-002 | AJ94: =H94+100*O94 -> 146.614 | AK94: 144.3 | AL94: 71 | AM94: 51.2 | AN94: 107 | AO94: 3.6000000000000004e-002 | AP94: 20 | AQ94: 正丹转债!
A95: 94 | B95: 128145 | C95: 日丰转债! | D95: 2953 | E95: 日丰股份 | F95: 家电 | G95: 零部件制 | H95: 130 | I95: -1.44e-002 | J95: 5.8999999999999999e-003 | K95: 15.52 | L95: -1.15e-002 | M95: 115.4 | N95: 13.66 | O95: 0.14400000000000002 | P95: 113.62 | Q95: 已到 | R95: 5年17天 | S95: 3年17天 | T95: 3.8 | U95: 21 | V95: 4.0999999999999995e-002 | W95: 0.10099999999999999 | X95: 0.114 | Y95: 38 | Z95: 3.31 | AA95: -2.3799999999999998e-002 | AB95: -2.8999999999999998e-002 | AC95: -6.8400000000000002e-002 | AD95: -7.0400000000000004e-002 | AE95: 85.61 | AF95: 85.64 | AG95: 0.74 | AH95: AA- | AI95: 6.2300000000000001e-002 | AJ95: =H95+100*O95 -> 144.40000000000001 | AK95: 146.4 | AL95: 91 | AM95: 60.7 | AN95: 184 | AO95: -1.3999999999999999e-002 | AP95: 10 | AQ95: 日丰转债!
A96: 95 | B96: 127030 | C96: 盛虹转债! | D96: 301 | E96: 东方盛虹 | F96: 化工 | G96: 化纤 | H96: 141.55 | I96: 1.e-003 | J96: 6.4000000000000003e-003 | K96: 16.96 | L96: 9.4999999999999998e-003 | M96: 112.5 | N96: 13.53 | O96: 0.129 | P96: 125.35 | Q96: 已到 | R96: 5年17天 | S96: 3年17天 | T96: 50 | U96: 282 | V96: 4.0000000000000001e-002 | W96: 5.0000000000000003e-002 | X96: 6.2e-002 | Y96: 1009. | Z96: 7.23 | AA96: -4.5199999999999997e-002 | AB96: -4.9299999999999997e-002 | AC96: -9.4700000000000006e-002 | AD96: -9.6300000000000011e-002 | AE96: 91.93 | AF96: 94.26 | AG96: 0.78 | AH96: AA+ | AI96: 3.6299999999999999e-002 | AJ96: =H96+100*O96 -> 154.45000000000002 | AK96: 157.7 | AL96: 209 | AM96: 63.5 | AN96: 207 | AO96: -6.2e-002 | AP96: 5 | AQ96: 盛虹转债!
A97: 96 | B97: 113046 | C97: 金田转债! | D97: 601609 | E97: 金田铜业 | F97: 有色金属 | G97: 铜金属 | H97: 114.91 | I97: -1.34e-002 | J97: 1.1399999999999999e-002 | K97: 8.72 | L97: -5.6999999999999993e-003 | M97: 114.9 | N97: 10.75 | O97: 0.41700000000000004 | P97: 81.12 | Q97: 已到 | R97: 5年17天 | S97: 3年17天 | T97: 15 | U97: 21 | V97: 1.2e-002 | W97: 0.11599999999999999 | X97: 9.4e-002 | Y97: 129 | Z97: 1.83 | AA97: 0. | AB97: -5.3e-003 | AC97: -3.2599999999999997e-002 | AD97: -3.4500000000000003e-002 | AE97: 92.31 | AF97: 96.31 | AG97: 0.36 | AH97: AA+ | AI97: 3.6299999999999999e-002 | AJ97: =H97+100*O97 -> 156.61000000000001 | AK97: 148.7 | AL97: 123 | AM97: 52.4 | AN97: 117 | AO97: 2.6000000000000002e-002 | AP97: 13 | AQ97: 金田转债!
A98: 97 | B98: 127029 | C98: 中钢转债! | D98: 928 | E98: 中钢国际 | F98: 建筑 | G98: 建筑工程 | H98: 136.549 | I98: -4.24e-002 | J98: 2.58e-002 | K98: 7.26 | L98: -2.29e-002 | M98: 117.5 | N98: 5.79 | O98: 8.900000000000001e-002 | P98: 125.39 | Q98: 已到 | R98: 5年14天 | S98: 3年14天 | T98: 8.19 | U98: 68 | V98: 5.9999999999999998e-002 | W98: 8.8000000000000009e-002 | X98: 0.11 | Y98: 93 | Z98: 1.55 | AA98: -2.98e-002 | AB98: -3.56e-002 | AC98: -8.4700000000000011e-002 | AD98: -8.6199999999999999e-002 | AE98: 91.95 | AF98: 98.47 | AG98: 0.73 | AH98: AA+ | AI98: 3.6299999999999999e-002 | AJ98: =H98+100*O98 -> 145.44900000000001 | AK98: 147.7 | AL98: 110 | AM98: 49.2 | AN98: 89 | AO98: -7.6999999999999999e-002 | AP98: 12 | AQ98: 中钢转债!
A99: 98 | B99: 123105 | C99: 拓尔转债! | D99: 300229 | E99: 拓尔思 | F99: 计算机及 | G99: 软件开发 | H99: 130.911 | I99: -8.3000000000000001e-003 | J99: 2.9999999999999997e-004 | K99: 11.03 | L99: -1.1599999999999999e-002 | M99: 121 | N99: 9.96 | O99: 0.182 | P99: 110.74 | Q99: 已到 | R99: 5年14天 | S99: 3年14天 | T99: 8 | U99: 22 | V99: 2.1000000000000001e-002 | W99: 0.10099999999999999 | X99: 0.11199999999999999 | Y99: 79 | Z99: 3.56 | AA99: -1.5800000000000002e-002 | AB99: -2.2799999999999997e-002 | AC99: -7.0199999999999999e-002 | AD99: -7.2300000000000003e-002 | AE99: 85.82 | AF99: 89.86 | AG99: 0.68 | AH99: AA- | AI99: 6.2300000000000001e-002 | AJ99: =H99+100*O99 -> 149.11099999999999 | AK99: 151.1 | AL99: 151 | AM99: 61.2 | AN99: 189 | AO99: -2.5000000000000001e-002 | AP99: 9 | AQ99: 拓尔转债!
A100: 99 | B100: 123104 | C100: 卫宁转债! | D100: 300253 | E100: 卫宁健康 | F100: 计算机及 | G100: 软件开发 | H100: 116.5 | I100: -4.3e-003 | J100: 3.5999999999999999e-003 | K100: 11.04 | L100: -5.4000000000000003e-003 | M100: 125.1 | N100: 17.74 | O100: 0.872 | P100: 62.23 | Q100: 已到 | R100: 5年11天 | S100: 3年11天 | T100: 9.7 | U100: 21 | V100: 1.9e-002 | W100: 4.0999999999999995e-002 | X100: 2.5000000000000001e-002 | Y100: 237 | Z100: 4.94 | AA100: 1.4499999999999999e-002 | AB100: 6.0999999999999995e-003 | AC100: -3.6400000000000002e-002 | AD100: -3.8399999999999997e-002 | AE100: 91.15 | AF100: 102.45 | AG100: 0.12 | AH100: AA | AI100: 4.1299999999999996e-002 | AJ100: =H100+100*O100 -> 203.69999999999999 | AK100: 170.8 | AL100: 305 | AM100: 68.3 | AN100: 249 | AO100: -3.9e-002 | AP100: 7 | AQ100: 卫宁转债!
A101: 100 | B101: 123103 | C101: 震安转债! | D101: 300767 | E101: 震安科技 | F101: 化工 | G101: 橡胶塑料 | H101: 145.299 | I101: -5.45e-002 | J101: 1.8000000000000002e-002 | K101: 73.25 | L101: -4.6100000000000002e-002 | M101: 121.4 | N101: 56.89 | O101: 0.128 | P101: 128.76 | Q101: 已到 | R101: 5年7天 | S101: 3年7天 | T101: 2.53 | U101: 40 | V101: 0.10800000000000001 | W101: 1.7000000000000001e-002 | X101: 2.2000000000000002e-002 | Y101: 148 | Z101: 12.63 | AA101: -3.6000000000000004e-002 | AB101: -4.2800000000000005e-002 | AC101: -9.9199999999999997e-002 | AD101: -0.10099999999999999 | AE101: 83.75 | AF101: 85.93 | AG101: 0.79 | AH101: A+ | AI101: 7.3300000000000004e-002 | AJ101: =H101+100*O101 -> 158.09900000000002 | AK101: 161.8 | AL101: 251 | AM101: 75.9 | AN101: 293 | AO101: -0.159 | AP101: 5 | AQ101: 震安转债!
A102: 101 | B102: 123101 | C102: 拓斯转债! | D102: 300607 | E102: 拓斯达 | F102: 机械装备 | G102: 机器人及 | H102: 113.118 | I102: -4.4000000000000003e-003 | J102: 3.0000000000000001e-003 | K102: 13.53 | L102: -1.9599999999999999e-002 | M102: 115.1 | N102: 26.18 | O102: 1.1899999999999999 | P102: 51.68 | Q102: 已到 | R102: 5年5.1天 | S102: 3年5.1天 | T102: 6.7 | U102: 4.8 | V102: 6.0000000000000001e-003 | W102: 0.11599999999999999 | X102: 5.9999999999999998e-002 | Y102: 58 | Z102: 2.61 | AA102: 3.4999999999999996e-003 | AB102: -1.9e-003 | AC102: -2.75e-002 | AD102: -2.9600000000000001e-002 | AE102: 91.21 | AF102: 94.36 | AG102: 0.07 | AH102: AA | AI102: 4.1299999999999996e-002 | AJ102: =H102+100*O102 -> 232.11799999999999 | AK102: 174.6 | AL102: 315 | AM102: 80.2 | AN102: 306 | AO102: -6.9999999999999993e-003 | AP102: 12 | AQ102: 拓斯转债!
A103: 102 | B103: 113620 | C103: 傲农转债!! | D103: 603363 | E103: 傲农生物 | F103: 农业 | G103: 畜牧业 | H103: 137.08 | I103: -1.1299999999999999e-002 | J103: 2.29e-002 | K103: 18.15 | L103: 1.6200000000000003e-002 | M103: 121.1 | N103: 14.52 | O103: 9.6999999999999989e-002 | P103: 125 | Q103: 已到 | R103: 5年5.1天 | S103: 3年5.1天 | T103: 10 | U103: 226 | V103: 0.16200000000000001 | W103: 8.0000000000000002e-002 | X103: 0.10099999999999999 | Y103: 124 | Z103: 5.71 | AA103: -2.4900000000000002e-002 | AB103: -3.1800000000000002e-002 | AC103: -8.5000000000000006e-002 | AD103: -8.6800000000000002e-002 | AE103: 91.21 | AF103: 99.26 | AG103: 0.72 | AH103: AA | AI103: 4.1299999999999996e-002 | AJ103: =H103+100*O103 -> 146.78 | AK103: 149.2 | AL103: 127 | AM103: 49.9 | AN103: 93 | AO103: -4.4999999999999998e-002 | AP103: 10 | AQ103: 傲农转债!!
A104: 103 | B104: 113045 | C104: XD环旭转! | D104: 601231 | E104: 环旭电子 | F104: 电子 | G104: 电子产品 | H104: 112.89 | I104: -4.8999999999999998e-003 | J104: 3.5999999999999999e-003 | K104: 13.75 | L104: -6.5000000000000006e-003 | M104: 112 | N104: 19.75 | O104: 0.622 | P104: 69.62 | Q104: 已到 | R104: 4.997年 | S104: 1.997年 | T104: 34.5 | U104: 4.7 | V104: 1.e-003 | W104: 0.114 | X104: 7.9000000000000001e-002 | Y104: 304 | Z104: 2.55 | AA104: -1.8e-003 | AB104: -6.0999999999999995e-003 | AC104: -4.2300000000000004e-002 | AD104: -4.4800000000000006e-002 | AE104: 95.17 | AF104: 93.85 | AG104: 0.21 | AH104: AA+ | AI104: 3.6299999999999999e-002 | AJ104: =H104+100*O104 -> 175.09 | AK104: 156.2 | AL104: 199 | AM104: 61 | AN104: 186 | AO104: -3.3000000000000002e-002 | AP104: 6 | AQ104: XD环旭转!
A105: 104 | B105: 128144 | C105: 利民转债! | D105: 2734 | E105: 利民股份 | F105: 化工 | G105: 农化 | H105: 128.78 | I105: -9.3999999999999986e-003 | J105: 1.29e-002 | K105: 11.8 | L105: 6.0000000000000001e-003 | M105: 113.8 | N105: 11.5 | O105: 0.255 | P105: 102.61 | Q105: 已到 | R105: 4.99年 | S105: 2.99年 | T105: 9.79 | U105: 13 | V105: 1.e-002 | W105: 0.223 | X105: 0.22899999999999998 | Y105: 44 | Z105: 1.75 | AA105: -2.4799999999999999e-002 | AB105: -2.9600000000000001e-002 | AC105: -7.0000000000000007e-002 | AD105: -7.1399999999999991e-002 | AE105: 90.96 | AF105: 94.29 | AG105: 0.59 | AH105: AA | AI105: 3.9e-002 | AJ105: =H105+100*O105 -> 154.28 | AK105: 155 | AL105: 188 | AM105: 60.7 | AN105: 183 | AO105: -7.4999999999999997e-002 | AP105: 5 | AQ105: 利民转债!
A106: 105 | B106: 118000 | C106: 嘉元转债! | D106: 688388 | E106: 嘉元科技 | F106: 电子 | G106: 电子产品 | H106: 149.72 | I106: -4.6100000000000002e-002 | J106: 1.66e-002 | K106: 100.87 | L106: -3.9e-002 | M106: 120.6 | N106: 78.74 | O106: 0.16899999999999998 | P106: 128.11 | Q106: 已到 | R106: 4.97年 | S106: 2.97年 | T106: 9.79 | U106: 83 | V106: 5.5999999999999994e-002 | W106: 4.0999999999999995e-002 | X106: 5.2999999999999999e-002 | Y106: 236 | Z106: 7.88 | AA106: -4.3299999999999998e-002 | AB106: -4.99e-002 | AC106: -0.11 | AD106: -0.111 | AE106: 86.34 | AF106: 90.77 | AG106: 0.76 | AH106: AA- | AI106: 5.9999999999999998e-002 | AJ106: =H106+100*O106 -> 166.62 | AK106: 171.3 | AL106: 309 | AM106: 80.6 | AN106: 308 | AO106: -0.115 | AP106: 6 | AQ106: 嘉元转债!
A107: 106 | B107: 123100 | C107: 朗科转债 | D107: 300543 | E107: 朗科智能 | F107: 电子 | G107: 电子产品 | H107: 126.28 | I107: -1.34e-002 | J107: -1.5e-003 | K107: 12.34 | L107: -2.2200000000000001e-002 | M107: 117.1 | N107: 11.61 | O107: 0.188 | P107: 106.29 | Q107: 已到 | R107: 4.93年 | S107: 2.93年 | T107: 3.8 | U107: 8.1 | V107: 1.7000000000000001e-002 | W107: 0.115 | X107: 0.122 | Y107: 33 | Z107: 3.5 | AA107: -1.54e-002 | AB107: -2.1400000000000002e-002 | AC107: -6.2800000000000009e-002 | AD107: -6.4699999999999994e-002 | AE107: 86.46 | AF107: 88.33 | AG107: 0.67 | AH107: AA- | AI107: 5.9999999999999998e-002 | AJ107: =H107+100*O107 -> 145.08000000000001 | AK107: 146.3 | AL107: 89 | AM107: 57.9 | AN107: 164 | AO107: -3.2000000000000001e-002 | AP107: 9 | AQ107: 朗科转债
A108: 107 | B108: 123099 | C108: 普利转债 | D108: 300630 | E108: 普利制药 | F108: 医药 | G108: 化学制药 | H108: 128.599 | I108: -1.0800000000000001e-002 | J108: 1.15e-002 | K108: 48.59 | L108: 1.1999999999999999e-003 | M108: 123.1 | N108: 46.03 | O108: 0.218 | P108: 105.56 | Q108: 已到 | R108: 4.93年 | S108: 2.93年 | T108: 8.5 | U108: 6.1 | V108: 5.0000000000000001e-003 | W108: 4.0000000000000001e-002 | X108: 4.2000000000000003e-002 | Y108: 212 | Z108: 8.92 | AA108: -9.0000000000000011e-003 | AB108: -1.67e-002 | AC108: -6.83e-002 | AD108: -7.0199999999999999e-002 | AE108: 86.46 | AF108: 92.83 | AG108: 0.62 | AH108: AA- | AI108: 5.9999999999999998e-002 | AJ108: =H108+100*O108 -> 150.399 | AK108: 151.6 | AL108: 155 | AM108: 58.8 | AN108: 168 | AO108: 4.2999999999999997e-002 | AP108: 6 | AQ108: 普利转债
A109: 108 | B109: 123098 | C109: 一品转债! | D109: 300723 | E109: 一品红 | F109: 医药 | G109: 医药行业 | H109: 140 | I109: 3.2400000000000005e-002 | J109: 2.2499999999999999e-002 | K109: 31.26 | L109: 7.6100000000000001e-002 | M109: 123.6 | N109: 25.48 | O109: 0.14099999999999999 | P109: 122.68 | Q109: 已到 | R109: 4.90年 | S109: 2.90年 | T109: 4.24 | U109: 1647. | V109: 2.7200000000000002 | W109: 4.7e-002 | X109: 5.7999999999999996e-002 | Y109: 90 | Z109: 5.38 | AA109: -2.5499999999999998e-002 | AB109: -3.3300000000000003e-002 | AC109: -9.4299999999999995e-002 | AD109: -9.6199999999999994e-002 | AE109: 86.7 | AF109: 93.41 | AG109: 0.72 | AH109: AA- | AI109: 5.9999999999999998e-002 | AJ109: =H109+100*O109 -> 154.09999999999999 | AK109: 157.3 | AL109: 203 | AM109: 63.9 | AN109: 210 | AO109: 8.9999999999999997e-002 | AP109: 7 | AQ109: 一品转债!
A110: 109 | B110: 123097 | C110: 美力转债 | D110: 300611 | E110: 美力科技 | F110: 机械装备 | G110: 通用设备 | H110: 126.2 | I110: -1.0200000000000001e-002 | J110: -5.0000000000000001e-003 | K110: 10.26 | L110: -2.1899999999999999e-002 | M110: 121.1 | N110: 9.28 | O110: 0.14099999999999999 | P110: 110.56 | Q110: 已到 | R110: 4.90年 | S110: 2.90年 | T110: 3 | U110: 18 | V110: 4.5999999999999999e-002 | W110: 0.16300000000000001 | X110: 0.18100000000000002 | Y110: 18 | Z110: 2.61 | AA110: -8.6e-003 | AB110: -1.5800000000000002e-002 | AC110: -6.1399999999999996e-002 | AD110: -6.3700000000000007e-002 | AE110: 84.54 | AF110: 87.2 | AG110: 0.69 | AH110: A+ | AI110: 7.0999999999999994e-002 | AJ110: =H110+100*O110 -> 140.30000000000001 | AK110: 141.8 | AL110: 58 | AM110: 54.6 | AN110: 137 | AO110: 0. | AP110: 22 | AQ110: 美力转债
A111: 110 | B111: 123096 | C111: 思创转债! | D111: 300078 | E111: 思创医惠 | F111: 通信互联 | G111: 物联网 | H111: 115.22 | I111: -3.3e-003 | J111: 1.7399999999999999e-002 | K111: 6.86 | L111: 3.3099999999999997e-002 | M111: 123.6 | N111: 8.27 | O111: 0.38900000000000001 | P111: 82.95 | Q111: 已到 | R111: 4.90年 | S111: 2.90年 | T111: 8.17 | U111: 242 | V111: 0.252 | W111: 0.13699999999999998 | X111: 0.114 | Y111: 59 | Z111: 2.18 | AA111: 1.47e-002 | AB111: 6.5000000000000006e-003 | AC111: -3.4599999999999999e-002 | AD111: -3.6699999999999997e-002 | AE111: 86.73 | AF111: 93.44 | AG111: 0.43 | AH111: AA- | AI111: 5.9999999999999998e-002 | AJ111: =H111+100*O111 -> 154.12 | AK111: 147.5 | AL111: 106 | AM111: 54.1 | AN111: 130 | AO111: 5.4000000000000006e-002 | AP111: 15 | AQ111: 思创转债!
A112: 111 | B112: 113621 | C112: 彤程转债! | D112: 603650 | E112: 彤程新材 | F112: 化工 | G112: 橡胶塑料 | H112: 140.95 | I112: -2.7300000000000001e-002 | J112: 3.4799999999999998e-002 | K112: 39.39 | L112: 1.03e-002 | M112: 114.8 | N112: 32.62 | O112: 0.16699999999999998 | P112: 120.75 | Q112: 已到 | R112: 4.90年 | S112: 2.90年 | T112: 5.37 | U112: 203 | V112: 0.26000000000000001 | W112: 2.3e-002 | X112: 2.7999999999999997e-002 | Y112: 235 | Z112: 8.77 | AA112: -4.1700000000000001e-002 | AB112: -4.6799999999999994e-002 | AC112: -9.7100000000000006e-002 | AD112: -9.8800000000000013e-002 | AE112: 91.96 | AF112: 95.52 | AG112: 0.74 | AH112: AA | AI112: 3.9e-002 | AJ112: =H112+100*O112 -> 157.64999999999998 | AK112: 161.1 | AL112: 244 | AM112: 65.6 | AN112: 226 | AO112: 7.2999999999999995e-002 | AP112: 7 | AQ112: 彤程转债!
A113: 112 | B113: 113042 | C113: 上银转债! | D113: 601229 | E113: 上海银行 | F113: 金融 | G113: 银行行业 | H113: 106.07 | I113: -4.0000000000000001e-003 | J113: 3.5999999999999999e-003 | K113: 7.01 | L113: -2.8000000000000004e-003 | M113: 120.6 | N113: 10.63 | O113: 0.60799999999999998 | P113: 65.95 | Q113: 已到 | R113: 4.89年 | S113: 无权 | T113: 200 | U113: 231 | V113: 1.1000000000000001e-002 | W113: 0.20100000000000001 | X113: 0.13200000000000001 | Y113: 996 | Z113: 0.55 | AA113: 2.7400000000000001e-002 | AB113: 1.9799999999999998e-002 | AC113: 无权 | AD113: 无权 | AE113: 无权 | AF113: 103.84 | AG113: 0.15 | AH113: AAA | AI113: 3.2000000000000001e-002 | AJ113: =H113+100*O113 -> 166.87 | AK113: 146.2 | AL113: 88 | AM113: 42.3 | AN113: 45 | AO113: -1.8000000000000002e-002 | AP113: 20 | AQ113: 上银转债!
A114: 113 | B114: 113619 | C114: 世运转债! | D114: 603920 | E114: 世运电路 | F114: 电子 | G114: 元器件制 | H114: 122.82 | I114: -6.9999999999999993e-003 | J114: -3.0000000000000001e-003 | K114: 17.97 | L114: -2.18e-002 | M114: 114.9 | N114: 19.92 | O114: 0.36099999999999999 | P114: 90.21 | Q114: 已到 | R114: 4.88年 | S114: 2.88年 | T114: 10 | U114: 118 | V114: 9.5000000000000001e-002 | W114: 0.105 | X114: 9.4e-002 | Y114: 96 | Z114: 3.67 | AA114: -1.38e-002 | AB114: -1.9099999999999999e-002 | AC114: -5.5300000000000002e-002 | AD114: -5.7300000000000004e-002 | AE114: 92.11 | AF114: 95.67 | AG114: 0.46 | AH114: AA | AI114: 3.9e-002 | AJ114: =H114+100*O114 -> 158.91999999999999 | AK114: 155.4 | AL114: 192 | AM114: 59.8 | AN114: 178 | AO114: -0.128 | AP114: 6 | AQ114: 世运转债!
A115: 114 | B115: 123093 | C115: 金陵转债! | D115: 300651 | E115: 金陵体育 | F115: 其他 | G115: 文化教育 | H115: 118.6 | I115: -3.2000000000000002e-003 | J115: 3.0999999999999999e-003 | K115: 32.33 | L115: -5.9999999999999995e-004 | M115: 128.8 | N115: 49.19 | O115: 0.80400000000000005 | P115: 65.72 | Q115: 已到 | R115: 4.88年 | S115: 2.88年 | T115: 2.5 | U115: 12 | V115: 4.0999999999999995e-002 | W115: 5.9999999999999998e-002 | X115: 3.9e-002 | Y115: 42 | Z115: 5.98 | AA115: 1.7600000000000001e-002 | AB115: 7.7000000000000002e-003 | AC115: -3.7000000000000005e-002 | AD115: -4.0399999999999998e-002 | AE115: 86.16 | AF115: 93.1 | AG115: 0.28 | AH115: A+ | AI115: 7.0999999999999994e-002 | AJ115: =H115+100*O115 -> 199. | AK115: 171.5 | AL115: 311 | AM115: 78.4 | AN115: 301 | AO115: 2.8999999999999998e-002 | AP115: 15 | AQ115: 金陵转债!
A116: 115 | B116: 113618 | C116: 美诺转债! | D116: 603538 | E116: 美诺华 | F116: 医药 | G116: 原料药 | H116: 118.47 | I116: -1.8700000000000001e-002 | J116: 5.7200000000000001e-002 | K116: 33.08 | L116: 7.0199999999999999e-002 | M116: 114.9 | N116: 37.23 | O116: 0.33299999999999996 | P116: 88.85 | Q116: 已到 | R116: 4.86年 | S116: 2.86年 | T116: 5.2 | U116: 1211. | V116: 1.8500000000000001 | W116: 0.10400000000000001 | X116: 9.1999999999999998e-002 | Y116: 50 | Z116: 2.93 | AA116: -6.4000000000000003e-003 | AB116: -1.18e-002 | AC116: -4.4199999999999996e-002 | AD116: -4.6199999999999998e-002 | AE116: 86.8 | AF116: 87.03 | AG116: 0.55 | AH116: AA- | AI116: 5.9999999999999998e-002 | AJ116: =H116+100*O116 -> 151.76999999999998 | AK116: 148.1 | AL116: 115 | AM116: 61.1 | AN116: 187 | AO116: 9.3000000000000013e-002 | AP116: 6 | AQ116: 美诺转债!
A117: 116 | B117: 128143 | C117: 锋龙转债! | D117: 2931 | E117: 锋龙股份 | F117: 机械装备 | G117: 专用设备 | H117: 125.009 | I117: -1.4800000000000001e-002 | J117: -6.8999999999999999e-003 | K117: 13.44 | L117: -3.2400000000000005e-002 | M117: 121.2 | N117: 12.73 | O117: 0.184 | P117: 105.58 | Q117: 已到 | R117: 4.85年 | S117: 2.85年 | T117: 2.44 | U117: 16 | V117: 5.2000000000000005e-002 | W117: 9.0999999999999998e-002 | X117: 9.6000000000000002e-002 | Y117: 27 | Z117: 4.21 | AA117: -6.5000000000000006e-003 | AB117: -1.3899999999999999e-002 | AC117: -5.9400000000000001e-002 | AD117: -6.1799999999999994e-002 | AE117: 84.85 | AF117: 87.59 | AG117: 0.67 | AH117: A+ | AI117: 7.0999999999999994e-002 | AJ117: =H117+100*O117 -> 143.40899999999999 | AK117: 144.4 | AL117: 72 | AM117: 56.8 | AN117: 152 | AO117: -2.2000000000000002e-002 | AP117: 16 | AQ117: 锋龙转债!
A118: 117 | B118: 127028 | C118: 英特转债! | D118: 411 | E118: 英特集团 | F118: 医药 | G118: 医药商业 | H118: 133.888 | I118: 0.109 | J118: -4.4699999999999997e-002 | K118: 14.41 | L118: 0.10000000000000001 | M118: 112.8 | N118: 13.22 | O118: 0.22800000000000001 | P118: 109 | Q118: 已到 | R118: 4.84年 | S118: 2.84年 | T118: 5.99 | U118: 6519. | V118: 7.9699999999999998 | W118: 0.16300000000000001 | X118: 0.17699999999999999 | Y118: 37 | Z118: 2.02 | AA118: -3.5400000000000001e-002 | AB118: -3.9900000000000005e-002 | AC118: -8.3199999999999996e-002 | AD118: -8.5000000000000006e-002 | AE118: 93.5 | AF118: 96.24 | AG118: 0.65 | AH118: AA+ | AI118: 3.4000000000000002e-002 | AJ118: =H118+100*O118 -> 156.68800000000002 | AK118: 158.8 | AL118: 220 | AM118: 62.5 | AN118: 203 | AO118: 0.11699999999999999 | AP118: 31 | AQ118: 英特转债!
A119: 118 | B119: 113616 | C119: 韦尔转债! | D119: 603501 | E119: 韦尔股份 | F119: 电子 | G119: 元器件制 | H119: 134.04 | I119: -1.7399999999999999e-002 | J119: 1.2800000000000001e-002 | K119: 234.14 | L119: -7.9000000000000008e-003 | M119: 114.3 | N119: 222.52 | O119: 0.27399999999999997 | P119: 105.22 | Q119: 已到 | R119: 4.82年 | S119: 2.82年 | T119: 24.3 | U119: 176 | V119: 5.2999999999999999e-002 | W119: 1.2e-002 | X119: 1.2e-002 | Y119: 2050. | Z119: 14.04 | AA119: -3.3000000000000002e-002 | AB119: -3.7999999999999999e-002 | AC119: -8.5500000000000007e-002 | AD119: -8.7100000000000011e-002 | AE119: 93.09 | AF119: 97.54 | AG119: 0.59 | AH119: AA+ | AI119: 3.4000000000000002e-002 | AJ119: =H119+100*O119 -> 161.44 | AK119: 162.9 | AL119: 262 | AM119: 65.3 | AN119: 222 | AO119: -2.5000000000000001e-002 | AP119: 9 | AQ119: 韦尔转债!
A120: 119 | B120: 123092 | C120: 天壕转债! | D120: 300332 | E120: 天壕环境 | F120: 石油天然 | G120: 天然气 | H120: 201.959 | I120: -6.4699999999999994e-002 | J120: 1.47e-002 | K120: 10.18 | L120: -5.2999999999999999e-002 | M120: 121.1 | N120: 5.19 | O120: 2.9999999999999999e-002 | P120: 196.15 | Q120: 已到 | R120: 4.81年 | S120: 2.81年 | T120: 4.17 | U120: 155 | V120: 0.18100000000000002 | W120: 4.5999999999999999e-002 | X120: 9.0999999999999998e-002 | Y120: 90 | Z120: 2.63 | AA120: -0.10300000000000001 | AB120: -0.109 | AC120: -0.127 | AD120: -0.128 | AE120: 85.08 | AF120: 87.76 | AG120: 0.94 | AH120: A+ | AI120: 7.0999999999999994e-002 | AJ120: =H120+100*O120 -> 204.959 | AK120: 207.8 | AL120: 348 | AM120: 120 | AN120: 352 | AO120: -3.5000000000000003e-002 | AP120: 9 | AQ120: 天壕转债!
A121: 120 | B121: 113615 | C121: 金诚转债! | D121: 603979 | E121: 金诚信 | F121: 有色金属 | G121: 有色行业 | H121: 203.05 | I121: -3.1300000000000001e-002 | J121: 4.0000000000000002e-004 | K121: 23.37 | L121: -3.27e-002 | M121: 116.9 | N121: 12.65 | O121: 9.9000000000000005e-002 | P121: 184.74 | Q121: 已到 | R121: 4.80年 | S121: 2.80年 | T121: 8.66 | U121: 126 | V121: 7.2000000000000008e-002 | W121: 6.2e-002 | X121: 0.115 | Y121: 139 | Z121: 2.8 | AA121: -0.11 | AB121: -0.115 | AC121: -0.129 | AD121: -0.129 | AE121: 92.39 | AF121: 97.62 | AG121: 0.94 | AH121: AA | AI121: 3.9e-002 | AJ121: =H121+100*O121 -> 212.95000000000002 | AK121: 221.4 | AL121: 354 | AM121: 123.7 | AN121: 356 | AO121: 5.0000000000000001e-003 | AP121: 3 | AQ121: 金诚转债!
A122: 121 | B122: 123091 | C122: 长海转债 | D122: 300196 | E122: 长海股份 | F122: 其他 | G122: 非金属矿 | H122: 129.2 | I122: -1.4800000000000001e-002 | J122: 1.2699999999999999e-002 | K122: 16.9 | L122: -3.4999999999999996e-003 | M122: 115.9 | N122: 16.14 | O122: 0.23399999999999999 | P122: 104.71 | Q122: 已到 | R122: 4.80年 | S122: 2.80年 | T122: 5.5 | U122: 2.4 | V122: 3.0000000000000001e-003 | W122: 8.0000000000000002e-002 | X122: 8.3000000000000004e-002 | Y122: 69 | Z122: 2.13 | AA122: -2.2799999999999997e-002 | AB122: -2.8399999999999998e-002 | AC122: -7.2800000000000004e-002 | AD122: -7.4700000000000003e-002 | AE122: 92.39 | AF122: 96.79 | AG122: 0.59 | AH122: AA | AI122: 3.9e-002 | AJ122: =H122+100*O122 -> 152.59999999999999 | AK122: 153.7 | AL122: 177 | AM122: 56.9 | AN122: 155 | AO122: -2.5000000000000001e-002 | AP122: 4 | AQ122: 长海转债
A123: 122 | B123: 123089 | C123: 九洲转2!! | D123: 300040 | E123: 九洲集团 | F123: 能源电力 | G123: 电力设备 | H123: 160.3 | I123: -3.2599999999999997e-002 | J123: 2.18e-002 | K123: 8.74 | L123: -1.24e-002 | M123: 120.6 | N123: 5.68 | O123: 4.2000000000000003e-002 | P123: 153.87 | Q123: 已到 | R123: 4.80年 | S123: 2.80年 | T123: 3.06 | U123: 51 | V123: 0.10199999999999999 | W123: 5.9999999999999998e-002 | X123: 9.1999999999999998e-002 | Y123: 51 | Z123: 2 | AA123: -5.8600000000000006e-002 | AB123: -6.5299999999999997e-002 | AC123: -0.13600000000000001 | AD123: -0.13699999999999998 | AE123: 87.23 | AF123: 91.71 | AG123: 0.87 | AH123: AA- | AI123: 5.9999999999999998e-002 | AJ123: =H123+100*O123 -> 164.5 | AK123: 166.7 | AL123: 291 | AM123: 75 | AN123: 286 | AO123: 1.3000000000000001e-002 | AP123: 18 | AQ123: 九洲转2!!
A124: 123 | B124: 123090 | C124: 三诺转债! | D124: 300298 | E124: 三诺生物 | F124: 医药 | G124: 医疗器械 | H124: 114.88 | I124: -1.4999999999999999e-002 | J124: 1.55e-002 | K124: 22.51 | L124: 3.0999999999999999e-003 | M124: 116.8 | N124: 35.18 | O124: 0.79500000000000004 | P124: 63.99 | Q124: 已到 | R124: 4.80年 | S124: 2.80年 | T124: 5 | U124: 7.4 | V124: 1.3000000000000001e-002 | W124: 3.9e-002 | X124: 2.5000000000000001e-002 | Y124: 127 | Z124: 4.7 | AA124: 3.4999999999999996e-003 | AB124: -2.7000000000000001e-003 | AC124: -3.5400000000000001e-002 | AD124: -3.7499999999999999e-002 | AE124: 92.31 | AF124: 97.54 | AG124: 0.16 | AH124: AA | AI124: 3.9e-002 | AJ124: =H124+100*O124 -> 194.38 | AK124: 165.8 | AL124: 283 | AM124: 68.2 | AN124: 247 | AO124: -4.4999999999999998e-002 | AP124: 6 | AQ124: 三诺转债!
A125: 124 | B125: 128142 | C125: 新乳转债! | D125: 2946 | E125: 新乳业 | F125: 食品饮料 | G125: 乳制品 | H125: 118.7 | I125: -7.000000000000001e-004 | J125: -1.e-003 | K125: 13.71 | L125: -6.5000000000000006e-003 | M125: 114.8 | N125: 18.47 | O125: 0.59899999999999998 | P125: 74.23 | Q125: 已到 | R125: 4.79年 | S125: 2.79年 | T125: 7.18 | U125: 3.8 | V125: 5.0000000000000001e-003 | W125: 5.9999999999999998e-002 | X125: 4.4999999999999998e-002 | Y125: 119 | Z125: 4.67 | AA125: -7.0999999999999995e-003 | AB125: -1.2500000000000001e-002 | AC125: -4.6199999999999998e-002 | AD125: -4.82e-002 | AE125: 92.34 | AF125: 95.91 | AG125: 0.26 | AH125: AA | AI125: 3.9e-002 | AJ125: =H125+100*O125 -> 178.59999999999999 | AK125: 163.2 | AL125: 264 | AM125: 67.3 | AN125: 235 | AO125: -3.2000000000000001e-002 | AP125: 5 | AQ125: 新乳转债!
A126: 125 | B126: 128141 | C126: 旺能转债! | D126: 2034 | E126: 旺能环境 | F126: 城市公用 | G126: 三废处理 | H126: 141.053 | I126: 2.9999999999999997e-004 | J126: 1.5e-003 | K126: 21.45 | L126: 2.3e-003 | M126: 114.8 | N126: 15.97 | O126: 5.0000000000000003e-002 | P126: 134.31 | Q126: 已到 | R126: 4.79年 | S126: 2.79年 | T126: 12.7 | U126: 94 | V126: 5.2000000000000005e-002 | W126: 0.13800000000000001 | X126: 0.185 | Y126: 92 | Z126: 1.83 | AA126: -4.2800000000000005e-002 | AB126: -4.8000000000000001e-002 | AC126: -0.10099999999999999 | AD126: -0.10099999999999999 | AE126: 92.35 | AF126: 95.92 | AG126: 0.79 | AH126: AA | AI126: 3.9e-002 | AJ126: =H126+100*O126 -> 146.053 | AK126: 147.8 | AL126: 113 | AM126: 51.9 | AN126: 115 | AO126: 3.5000000000000003e-002 | AP126: 8 | AQ126: 旺能转债!
A127: 126 | B127: 123087 | C127: 明电转债! | D127: 300739 | E127: 明阳电路 | F127: 电子 | G127: 元器件制 | H127: 122.365 | I127: -1.3999999999999999e-002 | J127: 4.1999999999999997e-003 | K127: 15.39 | L127: -1.7899999999999999e-002 | M127: 120.8 | N127: 16.32 | O127: 0.29799999999999999 | P127: 94.3 | Q127: 已到 | R127: 4.78年 | S127: 3.78年 | T127: 4.19 | U127: 5.7 | V127: 1.1000000000000001e-002 | W127: 9.1999999999999998e-002 | X127: 8.6999999999999994e-002 | Y127: 45 | Z127: 2.73 | AA127: -2.7000000000000001e-003 | AB127: -1.01e-002 | AC127: -3.5499999999999997e-002 | AD127: -3.8399999999999997e-002 | AE127: 84.79 | AF127: 91.99 | AG127: 0.55 | AH127: AA- | AI127: 5.9999999999999998e-002 | AJ127: =H127+100*O127 -> 152.16499999999999 | AK127: 150.4 | AL127: 143 | AM127: 58.4 | AN127: 165 | AO127: -3.6000000000000004e-002 | AP127: 19 | AQ127: 明电转债!
A128: 127 | B128: 123088 | C128: 威唐转债! | D128: 300707 | E128: 威唐工业 | F128: 汽车 | G128: 零部件制 | H128: 118.448 | I128: -2.35e-002 | J128: 7.0999999999999995e-003 | K128: 17.07 | L128: -3.3399999999999999e-002 | M128: 121.1 | N128: 20.72 | O128: 0.43799999999999994 | P128: 82.38 | Q128: 已到 | R128: 4.78年 | S128: 2.78年 | T128: 3.01 | U128: 7.2 | V128: 2.e-002 | W128: 0.11199999999999999 | X128: 9.3000000000000013e-002 | Y128: 27 | Z128: 3.81 | AA128: 4.6999999999999993e-003 | AB128: -2.8000000000000004e-003 | AC128: -4.3200000000000002e-002 | AD128: -4.5700000000000005e-002 | AE128: 85.22 | AF128: 87.91 | AG128: 0.49 | AH128: A+ | AI128: 7.0999999999999994e-002 | AJ128: =H128+100*O128 -> 162.24799999999999 | AK128: 154.5 | AL128: 186 | AM128: 66.6 | AN128: 231 | AO128: -4.0000000000000001e-003 | AP128: 18 | AQ128: 威唐转债!
A129: 128 | B129: 113044 | C129: 大秦转债! | D129: 601006 | E129: 大秦铁路 | F129: 铁路 | G129: 铁路运输 | H129: 111.39 | I129: -5.4000000000000003e-003 | J129: 5.4000000000000003e-003 | K129: 7 | L129: 0. | M129: 113.9 | N129: 7.18 | O129: 0.14300000000000002 | P129: 97.49 | Q129: 已到 | R129: 4.78年 | S129: 2.78年 | T129: 320 | U129: 252 | V129: 6.9999999999999993e-003 | W129: 0.307 | X129: 0.29999999999999999 | Y129: 1041. | Z129: 0.86 | AA129: 4.7999999999999996e-003 | AB129: -5.0000000000000001e-004 | AC129: -2.4e-002 | AD129: -2.64e-002 | AE129: 94.62 | AF129: 98.3 | AG129: 0.52 | AH129: AAA | AI129: 3.2000000000000001e-002 | AJ129: =H129+100*O129 -> 125.69 | AK129: 125.3 | AL129: 2 | AM129: 27 | AN129: 3 | AO129: 1.e-002 | AP129: 40 | AQ129: 大秦转债!
A130: 129 | B130: 123085 | C130: 万顺转2!! | D130: 300057 | E130: 万顺新材 | F130: 有色金属 | G130: 铝金属 | H130: 143.4 | I130: -3.9199999999999999e-002 | J130: 3.0000000000000001e-003 | K130: 8.62 | L130: -4.2199999999999994e-002 | M130: 112.9 | N130: 6.2 | O130: 3.1e-002 | P130: 139.03 | Q130: 已到 | R130: 4.77年 | S130: 2.77年 | T130: 8.51 | U130: 47 | V130: 3.7999999999999999e-002 | W130: 0.14400000000000002 | X130: 0.20100000000000001 | Y130: 59 | Z130: 1.63 | AA130: -4.9800000000000004e-002 | AB130: -5.4299999999999994e-002 | AC130: -0.105 | AD130: -0.107 | AE130: 87.27 | AF130: 85.99 | AG130: 0.86 | AH130: AA- | AI130: 5.9999999999999998e-002 | AJ130: =H130+100*O130 -> 146.5 | AK130: 147.8 | AL130: 112 | AM130: 60.5 | AN130: 182 | AO130: 2.5000000000000001e-002 | AP130: 19 | AQ130: 万顺转2!!
A131: 130 | B131: 123086 | C131: 海兰转债!! | D131: 300065 | E131: 海兰信 | F131: 电子 | G131: 电子产品 | H131: 201 | I131: -5.6600000000000004e-002 | J131: 1.3100000000000001e-002 | K131: 13.98 | L131: -4.6399999999999997e-002 | M131: 123.1 | N131: 7.27 | O131: 4.4999999999999998e-002 | P131: 192.3 | Q131: 已到 | R131: 4.77年 | S131: 2.77年 | T131: 4.81 | U131: 311 | V131: 0.314 | W131: 5.5e-002 | X131: 0.105 | Y131: 88 | Z131: 5.23 | AA131: -9.9199999999999997e-002 | AB131: -0.106 | AC131: -0.129 | AD131: -0.13 | AE131: 87.3 | AF131: 93.72 | AG131: 0.94 | AH131: AA- | AI131: 5.9999999999999998e-002 | AJ131: =H131+100*O131 -> 205.5 | AK131: 209.7 | AL131: 350 | AM131: 116 | AN131: 351 | AO131: -5.2999999999999999e-002 | AP131: 19 | AQ131: 海兰转债!!
A132: 131 | B132: 123084 | C132: 高澜转债!! | D132: 300499 | E132: 高澜股份 | F132: 能源电力 | G132: 电力设备 | H132: 168.256 | I132: -4.9500000000000002e-002 | J132: 1.77e-002 | K132: 14.04 | L132: -3.6400000000000002e-002 | M132: 121.4 | N132: 9.01 | O132: 8.0000000000000002e-002 | P132: 155.83 | Q132: 已到 | R132: 4.77年 | S132: 2.77年 | T132: 2.54 | U132: 174 | V132: 0.39899999999999997 | W132: 6.5000000000000002e-002 | X132: 0.10099999999999999 | Y132: 39 | Z132: 4.57 | AA132: -6.7500000000000004e-002 | AB132: -7.4400000000000008e-002 | AC132: -0.14899999999999999 | AD132: -0.10099999999999999 | AE132: 85.48 | AF132: 88.24 | AG132: 0.87 | AH132: A+ | AI132: 7.0999999999999994e-002 | AJ132: =H132+100*O132 -> 176.256 | AK132: 180.7 | AL132: 326 | AM132: 92.4 | AN132: 329 | AO132: 2.7999999999999997e-002 | AP132: 14 | AQ132: 高澜转债!!
A133: 132 | B133: 127027 | C133: 靖远转债! | D133: 552 | E133: 靖远煤电 | F133: 煤炭 | G133: 煤炭开采 | H133: 135.851 | I133: -3.2000000000000002e-003 | J133: 1.2999999999999999e-003 | K133: 4.05 | L133: -2.5000000000000001e-003 | M133: 114.9 | N133: 3.13 | O133: 5.0000000000000003e-002 | P133: 129.39 | Q133: 已到 | R133: 4.77年 | S133: 2.77年 | T133: 24.3 | U133: 314 | V133: 9.5000000000000001e-002 | W133: 0.255 | X133: 0.33000000000000002 | Y133: 95 | Z133: 1.17 | AA133: -3.5099999999999999e-002 | AB133: -4.0399999999999998e-002 | AC133: -8.9499999999999996e-002 | AD133: -9.1400000000000009e-002 | AE133: 93.82 | AF133: 98.27 | AG133: 0.76 | AH133: AA+ | AI133: 3.4000000000000002e-002 | AJ133: =H133+100*O133 -> 140.851 | AK133: 142.3 | AL133: 60 | AM133: 44 | AN133: 52 | AO133: 5.2000000000000005e-002 | AP133: 36 | AQ133: 靖远转债!
A134: 133 | B134: 113043 | C134: 财通转债! | D134: 601108 | E134: 财通证券 | F134: 金融 | G134: 证券行业 | H134: 109.81 | I134: -8.1000000000000013e-003 | J134: 5.7999999999999996e-003 | K134: 9.37 | L134: -9.4999999999999998e-003 | M134: 110 | N134: 13.13 | O134: 0.53900000000000003 | P134: 71.36 | Q134: 已到 | R134: 4.77年 | S134: 无权 | T134: 38 | U134: 55 | V134: 1.3000000000000001e-002 | W134: 0.113 | X134: 8.1000000000000003e-002 | Y134: 336 | Z134: 1.44 | AA134: 4.0000000000000002e-004 | AB134: -3.4999999999999996e-003 | AC134: 无权 | AD134: 无权 | AE134: 无权 | AF134: 94.87 | AG134: 0.24 | AH134: AAA | AI134: 3.2000000000000001e-002 | AJ134: =H134+100*O134 -> 163.71000000000001 | AK134: 148.3 | AL134: 117 | AM134: 53.4 | AN134: 124 | AO134: -4.0000000000000001e-002 | AP134: 11 | AQ134: 财通转债!
A135: 134 | B135: 123083 | C135: 朗新转债! | D135: 300682 | E135: 朗新科技 | F135: 计算机及 | G135: 软件开发 | H135: 205.2 | I135: -5.7000000000000002e-002 | J135: 4.5100000000000001e-002 | K135: 31.11 | L135: -1.24e-002 | M135: 114.8 | N135: 15.39 | O135: 1.4999999999999999e-002 | P135: 202.14 | Q135: 已到 | R135: 4.76年 | S135: 2.76年 | T135: 6.01 | U135: 96 | V135: 7.6999999999999999e-002 | W135: 1.8000000000000002e-002 | X135: 3.7000000000000005e-002 | Y135: 325 | Z135: 5.92 | AA135: -0.11599999999999999 | AB135: -0.121 | AC135: -0.13300000000000001 | AD135: -0.13400000000000001 | AE135: 92.42 | AF135: 96 | AG135: 0.96 | AH135: AA | AI135: 3.9e-002 | AJ135: =H135+100*O135 -> 206.69999999999999 | AK135: 208.3 | AL135: 349 | AM135: 112.3 | AN135: 349 | AO135: -4.5999999999999999e-002 | AP135: 7 | AQ135: 朗新转债!
A136: 135 | B136: 127026 | C136: 超声转债! | D136: 823 | E136: 超声电子 | F136: 电子 | G136: 元器件制 | H136: 122.2 | I136: -2.6499999999999999e-002 | J136: 1.1899999999999999e-002 | K136: 12.38 | L136: -2.6699999999999998e-002 | M136: 112.8 | N136: 12.72 | O136: 0.25600000000000001 | P136: 97.33 | Q136: 已到 | R136: 4.76年 | S136: 2.76年 | T136: 7 | U136: 21 | V136: 2.5000000000000001e-002 | W136: 0.105 | X136: 0.10199999999999999 | Y136: 66 | Z136: 1.67 | AA136: -1.7000000000000001e-002 | AB136: -2.1700000000000001e-002 | AC136: -5.6100000000000004e-002 | AD136: -5.8099999999999999e-002 | AE136: 92.43 | AF136: 94.34 | AG136: 0.55 | AH136: AA | AI136: 3.9e-002 | AJ136: =H136+100*O136 -> 147.80000000000001 | AK136: 147.1 | AL136: 102 | AM136: 52.7 | AN136: 119 | AO136: -1.4999999999999999e-002 | AP136: 12 | AQ136: 超声转债!
A137: 136 | B137: 128140 | C137: 润建转债!! | D137: 2929 | E137: 润建股份 | F137: 通信互联 | G137: 通信设备 | H137: 157.693 | I137: -2.8199999999999999e-002 | J137: 2.8999999999999998e-003 | K137: 36.71 | L137: -3.0600000000000002e-002 | M137: 114.9 | N137: 26.4 | O137: 0.13400000000000001 | P137: 139.05 | Q137: 已到 | R137: 4.76年 | S137: 2.76年 | T137: 10.9 | U137: 64 | V137: 3.7000000000000005e-002 | W137: 0.13 | X137: 0.17999999999999999 | Y137: 84 | Z137: 2.39 | AA137: -6.54e-002 | AB137: -7.0499999999999993e-002 | AC137: -0.13300000000000001 | AD137: -0.13500000000000001 | AE137: 92.54 | AF137: 96.12 | AG137: 0.83 | AH137: AA | AI137: 3.9e-002 | AJ137: =H137+100*O137 -> 171.09300000000002 | AK137: 176.3 | AL137: 316 | AM137: 80.2 | AN137: 307 | AO137: 1.3999999999999999e-002 | AP137: 10 | AQ137: 润建转债!!
A138: 137 | B138: 123082 | C138: 北陆转债! | D138: 300016 | E138: 北陆药业 | F138: 医药 | G138: 化学制药 | H138: 122 | I138: 4.6999999999999993e-003 | J138: 2.5000000000000001e-003 | K138: 8.5 | L138: 1.1899999999999999e-002 | M138: 121.2 | N138: 8.81 | O138: 0.26400000000000001 | P138: 96.48 | Q138: 已到 | R138: 4.76年 | S138: 2.76年 | T138: 4.99 | U138: 17 | V138: 2.7000000000000003e-002 | W138: 0.11900000000000001 | X138: 0.115 | Y138: 42 | Z138: 2.44 | AA138: -1.4000000000000002e-003 | AB138: -9.0000000000000011e-003 | AC138: -5.3200000000000004e-002 | AD138: -5.57e-002 | AE138: 85.37 | AF138: 88.12 | AG138: 0.61 | AH138: A+ | AI138: 7.0999999999999994e-002 | AJ138: =H138+100*O138 -> 148.40000000000001 | AK138: 147.5 | AL138: 107 | AM138: 59.4 | AN138: 175 | AO138: 4.4000000000000004e-002 | AP138: 18 | AQ138: 北陆转债!
A139: 138 | B139: 123080 | C139: 海波转债! | D139: 300517 | E139: 海波重科 | F139: 建筑 | G139: 建筑工程 | H139: 127.996 | I139: -2.6600000000000002e-002 | J139: 1.34e-002 | K139: 13.44 | L139: -1.9e-002 | M139: 126 | N139: 11.58 | O139: 0.10300000000000001 | P139: 116.06 | Q139: 已到 | R139: 4.75年 | S139: 2.75年 | T139: 2.44 | U139: 30 | V139: 9.5000000000000001e-002 | W139: 9.4e-002 | X139: 0.109 | Y139: 26 | Z139: 3 | AA139: -3.4000000000000002e-003 | AB139: -1.23e-002 | AC139: -6.8900000000000003e-002 | AD139: -7.1399999999999991e-002 | AE139: 85.5 | AF139: 91.68 | AG139: 0.7 | AH139: A+ | AI139: 7.0999999999999994e-002 | AJ139: =H139+100*O139 -> 138.29599999999999 | AK139: 139.9 | AL139: 38 | AM139: 48.3 | AN139: 81 | AO139: -9.0000000000000011e-003 | AP139: 25 | AQ139: 海波转债!
A140: 139 | B140: 113610 | C140: 灵康转债 | D140: 603669 | E140: 灵康药业 | F140: 医药 | G140: 化学制药 | H140: 120.35 | I140: 2.0000000000000001e-004 | J140: 4.0000000000000002e-004 | K140: 8.38 | L140: 1.1999999999999999e-003 | M140: 120.7 | N140: 8.61 | O140: 0.23699999999999999 | P140: 97.33 | Q140: 已到 | R140: 4.74年 | S140: 2.74年 | T140: 4.58 | U140: 11 | V140: 2.e-002 | W140: 7.5999999999999998e-002 | X140: 7.400000000000001e-002 | Y140: 60 | Z140: 4.39 | AA140: 5.9999999999999995e-004 | AB140: -6.8000000000000005e-003 | AC140: -5.0499999999999996e-002 | AD140: -5.28e-002 | AE140: 87.6 | AF140: 92.1 | AG140: 0.57 | AH140: AA- | AI140: 5.9999999999999998e-002 | AJ140: =H140+100*O140 -> 144.04999999999998 | AK140: 143.4 | AL140: 66 | AM140: 51.3 | AN140: 108 | AO140: 1.3999999999999999e-002 | AP140: 30 | AQ140: 灵康转债
A141: 140 | B141: 128139 | C141: 祥鑫转债! | D141: 2965 | E141: 祥鑫科技 | F141: 汽车 | G141: 零部件制 | H141: 126 | I141: 2.3999999999999998e-003 | J141: -1.29e-002 | K141: 26.93 | L141: -1.72e-002 | M141: 120.6 | N141: 26.38 | O141: 0.23399999999999999 | P141: 102.08 | Q141: 已到 | R141: 4.74年 | S141: 2.74年 | T141: 6.47 | U141: 23 | V141: 2.8999999999999998e-002 | W141: 0.157 | X141: 0.16 | Y141: 41 | Z141: 2.33 | AA141: -9.3999999999999986e-003 | AB141: -1.67e-002 | AC141: -6.5799999999999997e-002 | AD141: -6.7900000000000002e-002 | AE141: 87.51 | AF141: 92 | AG141: 0.61 | AH141: AA- | AI141: 5.9999999999999998e-002 | AJ141: =H141+100*O141 -> 149.40000000000001 | AK141: 149.9 | AL141: 132 | AM141: 57.9 | AN141: 163 | AO141: 4.2000000000000003e-002 | AP141: 14 | AQ141: 祥鑫转债!
A142: 141 | B142: 123078 | C142: 飞凯转债!! | D142: 300398 | E142: 飞凯材料 | F142: 化工 | G142: 化工 | H142: 185.146 | I142: -4.0999999999999995e-002 | J142: 1.7500000000000002e-002 | K142: 28.35 | L142: -2.5099999999999997e-002 | M142: 114.9 | N142: 15.56 | O142: 1.6e-002 | P142: 182.2 | Q142: 已到 | R142: 4.73年 | S142: 2.73年 | T142: 7.2 | U142: 899 | V142: 0.65000000000000002 | W142: 4.9000000000000002e-002 | X142: 8.900000000000001e-002 | Y142: 148 | Z142: 5.06 | AA142: -9.74e-002 | AB142: -0.10199999999999999 | AC142: -0.11900000000000001 | AD142: -0.12 | AE142: 92.64 | AF142: 96.22 | AG142: 0.94 | AH142: AA | AI142: 3.9e-002 | AJ142: =H142+100*O142 -> 186.74599999999998 | AK142: 188.1 | AL142: 334 | AM142: 91.9 | AN142: 328 | AO142: 0.114 | AP142: 9 | AQ142: 飞凯转债!!
A143: 142 | B143: 113609 | C143: 永安转债! | D143: 603776 | E143: 永安行 | F143: 城市公用 | G143: 其他 | H143: 117.67 | I143: -8.3000000000000001e-003 | J143: 6.8000000000000005e-003 | K143: 15.91 | L143: -2.5000000000000001e-003 | M143: 120.1 | N143: 16.48 | O143: 0.21899999999999997 | P143: 96.54 | Q143: 已到 | R143: 4.72年 | S143: 2.72年 | T143: 7.34 | U143: 14 | V143: 1.6e-002 | W143: 0.19800000000000001 | X143: 0.191 | Y143: 37 | Z143: 1.14 | AA143: 4.4000000000000003e-003 | AB143: -2.8999999999999998e-003 | AC143: -4.4000000000000004e-002 | AD143: -4.6100000000000002e-002 | AE143: 87.53 | AF143: 91.7 | AG143: 0.57 | AH143: AA- | AI143: 5.9999999999999998e-002 | AJ143: =H143+100*O143 -> 139.56999999999999 | AK143: 138.8 | AL143: 32 | AM143: 47.1 | AN143: 71 | AO143: 9.0000000000000011e-003 | AP143: 26 | AQ143: 永安转债!
A144: 143 | B144: 123077 | C144: 汉得转债! | D144: 300170 | E144: 汉得信息 | F144: 计算机及 | G144: 软件开发 | H144: 117.6 | I144: -7.8000000000000005e-003 | J144: 3.8e-003 | K144: 8.16 | L144: -1.3300000000000001e-002 | M144: 125.1 | N144: 9.69 | O144: 0.39600000000000002 | P144: 84.21 | Q144: 已到 | R144: 4.72年 | S144: 2.72年 | T144: 9.37 | U144: 8.1 | V144: 6.9999999999999993e-003 | W144: 0.13 | X144: 0.109 | Y144: 72 | Z144: 2.3 | AA144: 1.34e-002 | AB144: 4.5000000000000005e-003 | AC144: -4.3799999999999999e-002 | AD144: -4.5899999999999996e-002 | AE144: 92.71 | AF144: 104.78 | AG144: 0.3 | AH144: AA | AI144: 3.9e-002 | AJ144: =H144+100*O144 -> 157.19999999999999 | AK144: 151 | AL144: 148 | AM144: 46.2 | AN144: 67 | AO144: -3.7999999999999999e-002 | AP144: 17 | AQ144: 汉得转债!
A145: 144 | B145: 110077 | C145: 洪城转债 | D145: 600461 | E145: 洪城环境 | F145: 城市公用 | G145: 城市公用 | H145: 133.67 | I145: -1.37e-002 | J145: 1.37e-002 | K145: 8.21 | L145: 0. | M145: 113.3 | N145: 6.71 | O145: 9.1999999999999998e-002 | P145: 122.35 | Q145: 已到 | R145: 4.71年 | S145: 2.71年 | T145: 17.7 | U145: 20 | V145: 9.0000000000000011e-003 | W145: 0.22600000000000001 | X145: 0.27600000000000002 | Y145: 78 | Z145: 1.44 | AA145: -3.49e-002 | AB145: -3.9699999999999999e-002 | AC145: -8.9900000000000008e-002 | AD145: -9.0999999999999998e-002 | AE145: 92.73 | AF145: 96.98 | AG145: 0.75 | AH145: AA+ | AI145: 3.4000000000000002e-002 | AJ145: =H145+100*O145 -> 142.86999999999998 | AK145: 145 | AL145: 78 | AM145: 48 | AN145: 77 | AO145: 1.2e-002 | AP145: 6 | AQ145: 洪城转债
A146: 145 | B146: 123076 | C146: 强力转债! | D146: 300429 | E146: 强力新材 | F146: 化工 | G146: 化工 | H146: 110.508 | I146: -9.7999999999999997e-003 | J146: 8.6999999999999994e-003 | K146: 11.39 | L146: -6.0999999999999995e-003 | M146: 118.1 | N146: 18.94 | O146: 0.83799999999999997 | P146: 60.14 | Q146: 已到 | R146: 4.71年 | S146: 2.71年 | T146: 8.5 | U146: 7.1 | V146: 6.9999999999999993e-003 | W146: 0.14499999999999999 | X146: 8.6999999999999994e-002 | Y146: 59 | Z146: 3.25 | AA146: 1.4499999999999999e-002 | AB146: 7.6e-003 | AC146: -2.29e-002 | AD146: -2.5099999999999997e-002 | AE146: 87.6 | AF146: 90.25 | AG146: 0.18 | AH146: AA- | AI146: 5.9999999999999998e-002 | AJ146: =H146+100*O146 -> 194.30799999999999 | AK146: 160.9 | AL146: 243 | AM146: 70.6 | AN146: 266 | AO146: 4.0000000000000001e-003 | AP146: 25 | AQ146: 强力转债!
A147: 146 | B147: 128138 | C147: 侨银转债! | D147: 2973 | E147: 侨银股份 | F147: 城市公用 | G147: 城市公用 | H147: 118.07 | I147: -2.8000000000000004e-003 | J147: 8.9999999999999998e-004 | K147: 14.71 | L147: -1.7399999999999999e-002 | M147: 136.1 | N147: 25.33 | O147: 1.03 | P147: 58.07 | Q147: 已到 | R147: 4.70年 | S147: 2.70年 | T147: 4.2 | U147: 6.8 | V147: 1.3999999999999999e-002 | W147: 7.0000000000000007e-002 | X147: 4.0999999999999995e-002 | Y147: 60 | Z147: 3.75 | AA147: 3.1300000000000001e-002 | AB147: 1.9099999999999999e-002 | AC147: -4.3499999999999997e-002 | AD147: -4.5999999999999999e-002 | AE147: 88.13 | AF147: 104.04 | AG147: 0.11 | AH147: AA- | AI147: 5.9999999999999998e-002 | AJ147: =H147+100*O147 -> 221.06999999999999 | AK147: 178.1 | AL147: 319 | AM147: 74 | AN147: 282 | AO147: -5.5e-002 | AP147: 29 | AQ147: 侨银转债!
A148: 147 | B148: 113608 | C148: 威派转债! | D148: 603956 | E148: 威派格 | F148: 机械装备 | G148: 专用设备 | H148: 117.87 | I148: -1.34e-002 | J148: 7.0999999999999995e-003 | K148: 15.76 | L148: -1.3100000000000001e-002 | M148: 121.1 | N148: 19.08 | O148: 0.42700000000000005 | P148: 82.6 | Q148: 已到 | R148: 4.68年 | S148: 2.68年 | T148: 4.2 | U148: 2.1 | V148: 4.0000000000000001e-003 | W148: 6.3e-002 | X148: 5.2000000000000005e-002 | Y148: 67 | Z148: 5.67 | AA148: 5.8999999999999999e-003 | AB148: -1.8e-003 | AC148: -4.2999999999999997e-002 | AD148: -4.5599999999999995e-002 | AE148: 85.8 | AF148: 88.51 | AG148: 0.48 | AH148: A+ | AI148: 7.0999999999999994e-002 | AJ148: =H148+100*O148 -> 160.56999999999999 | AK148: 153.1 | AL148: 173 | AM148: 64.6 | AN148: 215 | AO148: -2.3e-002 | AP148: 9 | AQ148: 威派转债!
A149: 148 | B149: 127025 | C149: 冀东转债! | D149: 401 | E149: 冀东水泥 | F149: 建筑 | G149: 水泥 | H149: 116.915 | I149: -8.3000000000000001e-003 | J149: 5.5000000000000005e-003 | K149: 12.22 | L149: -6.5000000000000006e-003 | M149: 109.9 | N149: 14.01 | O149: 0.34000000000000002 | P149: 87.22 | Q149: 已到 | R149: 4.67年 | S149: 2.67年 | T149: 17.8 | U149: 5.6 | V149: 3.0000000000000001e-003 | W149: 5.5e-002 | X149: 4.8000000000000001e-002 | Y149: 325 | Z149: 1.06 | AA149: -1.34e-002 | AB149: -1.72e-002 | AC149: -4.5100000000000001e-002 | AD149: -4.6699999999999998e-002 | AE149: 93.93 | AF149: 95.09 | AG149: 0.42 | AH149: AAA | AI149: 3.2000000000000001e-002 | AJ149: =H149+100*O149 -> 150.91500000000002 | AK149: 146.6 | AL149: 93 | AM149: 51.5 | AN149: 113 | AO149: -6.9999999999999993e-003 | AP149: 9 | AQ149: 冀东转债!
A150: 149 | B150: 127024 | C150: 盈峰转债! | D150: 967 | E150: 盈峰环境 | F150: 机械装备 | G150: 专用设备 | H150: 114.277 | I150: -5.3e-003 | J150: 2.0999999999999999e-003 | K150: 5.92 | L150: -1.66e-002 | M150: 116.6 | N150: 8.19 | O150: 0.58099999999999996 | P150: 72.28 | Q150: 已到 | R150: 4.67年 | S150: 2.67年 | T150: 14.8 | U150: 35 | V150: 2.1000000000000001e-002 | W150: 7.8e-002 | X150: 5.7000000000000002e-002 | Y150: 188 | Z150: 1.14 | AA150: 4.4000000000000003e-003 | AB150: -1.9e-003 | AC150: -3.5900000000000001e-002 | AD150: -3.7900000000000003e-002 | AE150: 93.84 | AF150: 100.02 | AG150: 0.19 | AH150: AA+ | AI150: 3.4000000000000002e-002 | AJ150: =H150+100*O150 -> 172.37700000000001 | AK150: 156.3 | AL150: 200 | AM150: 56.2 | AN150: 146 | AO150: -3.4000000000000002e-002 | AP150: 6 | AQ150: 盈峰转债!
A151: 150 | B151: 128137 | C151: 洁美转债! | D151: 2859 | E151: 洁美科技 | F151: 电子 | G151: 元器件制 | H151: 129.9 | I151: -4.0099999999999997e-002 | J151: 2.18e-002 | K151: 29.17 | L151: -2.7699999999999999e-002 | M151: 116.9 | N151: 27.63 | O151: 0.23000000000000001 | P151: 105.57 | Q151: 已到 | R151: 4.67年 | S151: 2.67年 | T151: 5.99 | U151: 25 | V151: 3.1e-002 | W151: 5.0000000000000003e-002 | X151: 5.2999999999999999e-002 | Y151: 120 | Z151: 6.07 | AA151: -2.2700000000000001e-002 | AB151: -2.8900000000000002e-002 | AC151: -7.7899999999999997e-002 | AD151: -7.9899999999999999e-002 | AE151: 87.78 | AF151: 89.55 | AG151: 0.66 | AH151: AA- | AI151: 5.9999999999999998e-002 | AJ151: =H151+100*O151 -> 152.90000000000001 | AK151: 154.2 | AL151: 181 | AM151: 64.7 | AN151: 216 | AO151: -8.0000000000000002e-002 | AP151: 5 | AQ151: 洁美转债!
A152: 151 | B152: 128136 | C152: 立讯转债! | D152: 2475 | E152: 立讯精密 | F152: 电子 | G152: 元器件制 | H152: 117.5 | I152: -1.09e-002 | J152: 7.7000000000000002e-003 | K152: 38.27 | L152: -1.95e-002 | M152: 111.8 | N152: 57.97 | O152: 0.78000000000000003 | P152: 66.02 | Q152: 已到 | R152: 4.67年 | S152: 2.67年 | T152: 30 | U152: 50 | V152: 1.3999999999999999e-002 | W152: 1.1000000000000001e-002 | X152: 6.9999999999999993e-003 | Y152: 2708. | Z152: 8.37 | AA152: -1.0700000000000001e-002 | AB152: -1.5300000000000001e-002 | AC152: -4.7800000000000002e-002 | AD152: -4.9299999999999997e-002 | AE152: 93.08 | AF152: 95.84 | AG152: 0.17 | AH152: AA+ | AI152: 3.4000000000000002e-002 | AJ152: =H152+100*O152 -> 195.5 | AK152: 169 | AL152: 297 | AM152: 73.1 | AN152: 281 | AO152: -0.114 | AP152: 14 | AQ152: 立讯转债!
A153: 152 | B153: 110076 | C153: 华海转债! | D153: 600521 | E153: 华海药业 | F153: 医药 | G153: 医药行业 | H153: 113.97 | I153: 5.5000000000000005e-003 | J153: 8.5000000000000006e-003 | K153: 25.47 | L153: 5.0300000000000004e-002 | M153: 114.8 | N153: 33.85 | O153: 0.51500000000000001 | P153: 75.24 | Q153: 已到 | R153: 4.66年 | S153: 2.66年 | T153: 18.4 | U153: 506 | V153: 0.23800000000000002 | W153: 4.8000000000000001e-002 | X153: 3.6000000000000004e-002 | Y153: 380 | Z153: 5.79 | AA153: 1.6000000000000001e-003 | AB153: -4.0999999999999995e-003 | AC153: -3.44e-002 | AD153: -3.6499999999999998e-002 | AE153: 92.78 | AF153: 96.37 | AG153: 0.28 | AH153: AA | AI153: 3.9e-002 | AJ153: =H153+100*O153 -> 165.47 | AK153: 152.7 | AL153: 169 | AM153: 56.3 | AN153: 147 | AO153: 0.17399999999999999 | AP153: 9 | AQ153: 华海转债!
A154: 153 | B154: 123075 | C154: 贝斯转债! | D154: 300580 | E154: 贝斯特 | F154: 汽车 | G154: 零部件制 | H154: 129.297 | I154: -2.5399999999999999e-002 | J154: -8.0000000000000004e-004 | K154: 24.75 | L154: -4.0000000000000001e-002 | M154: 115.1 | N154: 23.74 | O154: 0.23999999999999999 | P154: 104.25 | Q154: 已到 | R154: 4.66年 | S154: 2.66年 | T154: 6 | U154: 21 | V154: 2.7000000000000003e-002 | W154: 0.121 | X154: 0.126 | Y154: 50 | Z154: 2.8 | AA154: -2.5099999999999997e-002 | AB154: -3.0600000000000002e-002 | AC154: -7.6399999999999996e-002 | AD154: -7.85e-002 | AE154: 87.84 | AF154: 88.21 | AG154: 0.66 | AH154: AA- | AI154: 5.9999999999999998e-002 | AJ154: =H154+100*O154 -> 153.297 | AK154: 154.3 | AL154: 183 | AM154: 66.1 | AN154: 230 | AO154: -0.129 | AP154: 8 | AQ154: 贝斯转债!
A155: 154 | B155: 113606 | C155: 荣泰转债 | D155: 603579 | E155: 荣泰健康 | F155: 机械装备 | G155: 专用设备 | H155: 116.9 | I155: -1.9099999999999999e-002 | J155: 1.3899999999999999e-002 | K155: 28.62 | L155: -1.11e-002 | M155: 120.7 | N155: 32.83 | O155: 0.34100000000000003 | P155: 87.18 | Q155: 已到 | R155: 4.66年 | S155: 2.66年 | T155: 6 | U155: 7.3 | V155: 1.e-002 | W155: 0.14999999999999999 | X155: 0.13100000000000001 | Y155: 40 | Z155: 2.4 | AA155: 6.9999999999999993e-003 | AB155: -5.9999999999999995e-004 | AC155: -4.2199999999999994e-002 | AD155: -4.4500000000000005e-002 | AE155: 88.05 | AF155: 92.57 | AG155: 0.48 | AH155: AA- | AI155: 5.9999999999999998e-002 | AJ155: =H155+100*O155 -> 151. | AK155: 146.6 | AL155: 95 | AM155: 54.1 | AN155: 131 | AO155: -5.4000000000000006e-002 | AP155: 11 | AQ155: 荣泰转债
A156: 155 | B156: 123073 | C156: 同和转债!! | D156: 300636 | E156: 同和药业 | F156: 医药 | G156: 原料药 | H156: 154.325 | I156: -4.1500000000000002e-002 | J156: 2.3799999999999998e-002 | K156: 22.36 | L156: -2.06e-002 | M156: 121.9 | N156: 14.82 | O156: 2.3e-002 | P156: 150.88 | Q156: 已到 | R156: 4.64年 | S156: 2.64年 | T156: 3.58 | U156: 45 | V156: 8.0000000000000002e-002 | W156: 7.8e-002 | X156: 0.11699999999999999 | Y156: 46 | Z156: 5.6 | AA156: -5.0499999999999996e-002 | AB156: -5.79e-002 | AC156: -0.13 | AD156: -0.13200000000000001 | AE156: 86 | AF156: 89.31 | AG156: 0.86 | AH156: A+ | AI156: 7.0999999999999994e-002 | AJ156: =H156+100*O156 -> 156.625 | AK156: 157.8 | AL156: 210 | AM156: 68.5 | AN156: 250 | AO156: 5.7999999999999996e-002 | AP156: 13 | AQ156: 同和转债!!
A157: 156 | B157: 113605 | C157: 大参转债! | D157: 603233 | E157: 大参林 | F157: 医药 | G157: 医药商业 | H157: 113.8 | I157: 8.0000000000000004e-004 | J157: -5.0000000000000001e-004 | K157: 35.38 | L157: 5.4000000000000003e-003 | M157: 114.9 | N157: 69.05 | O157: 1.22 | P157: 51.24 | Q157: 已到 | R157: 4.63年 | S157: 2.63年 | T157: 14 | U157: 3.5 | V157: 2.e-003 | W157: 5.0000000000000003e-002 | X157: 2.6000000000000002e-002 | Y157: 280 | Z157: 5.26 | AA157: 2.0999999999999999e-003 | AB157: -3.5999999999999999e-003 | AC157: -3.39e-002 | AD157: -3.61e-002 | AE157: 92.99 | AF157: 96.58 | AG157: 0.05 | AH157: AA | AI157: 3.9e-002 | AJ157: =H157+100*O157 -> 235.80000000000001 | AK157: 176.4 | AL157: 317 | AM157: 79.8 | AN157: 305 | AO157: -3.7999999999999999e-002 | AP157: 9 | AQ157: 大参转债!
A158: 157 | B158: 123071 | C158: 天能转债!! | D158: 300569 | E158: 天能重工 | F158: 能源电力 | G158: 风能 | H158: 208.516 | I158: -1.8700000000000001e-002 | J158: 2.12e-002 | K158: 15.23 | L158: 2.5999999999999999e-003 | M158: 120.7 | N158: 7.91 | O158: 8.3000000000000004e-002 | P158: 192.54 | Q158: 已到 | R158: 4.63年 | S158: 2.63年 | T158: 6.94 | U158: 403 | V158: 0.27600000000000002 | W158: 5.7000000000000002e-002 | X158: 0.11 | Y158: 121 | Z158: 3.45 | AA158: -0.113 | AB158: -0.12 | AC158: -0.14400000000000002 | AD158: -0.14499999999999999 | AE158: 88.17 | AF158: 92.69 | AG158: 0.94 | AH158: AA- | AI158: 5.9999999999999998e-002 | AJ158: =H158+100*O158 -> 216.816 | AK158: 224.5 | AL158: 357 | AM158: 131.8 | AN158: 357 | AO158: 3.9e-002 | AP158: 12 | AQ158: 天能转债!!
A159: 158 | B159: 123072 | C159: 乐歌转债! | D159: 300729 | E159: 乐歌股份 | F159: 其他 | G159: 家居用品 | H159: 122.309 | I159: -9.7000000000000003e-003 | J159: 8.199999999999999e-003 | K159: 22.62 | L159: -2.3700000000000002e-002 | M159: 129.1 | N159: 49.24 | O159: 1.6599999999999999 | P159: 45.94 | Q159: 已到 | R159: 4.63年 | S159: 2.63年 | T159: 1.42 | U159: 16 | V159: 9.1999999999999998e-002 | W159: 2.7999999999999997e-002 | X159: 1.3000000000000001e-002 | Y159: 50 | Z159: 2.76 | AA159: 1.21e-002 | AB159: 1.8e-003 | AC159: -4.99e-002 | AD159: -5.3800000000000001e-002 | AE159: 87.9 | AF159: 94.96 | AG159: 0.06 | AH159: A+ | AI159: 7.0999999999999994e-002 | AJ159: =H159+100*O159 -> 288.30899999999997 | AK159: 198.7 | AL159: 341 | AM159: 103.7 | AN159: 345 | AO159: -5.9000000000000004e-002 | AP159: 13 | AQ159: 乐歌转债!
A160: 159 | B160: 123070 | C160: 鹏辉转债! | D160: 300438 | E160: 鹏辉能源 | F160: 汽车 | G160: 零部件制 | H160: 234.511 | I160: -4.1999999999999997e-003 | J160: -1.5700000000000002e-002 | K160: 40.92 | L160: -2.06e-002 | M160: 114.8 | N160: 20.08 | O160: 0.151 | P160: 203.78 | Q160: 已到 | R160: 4.63年 | S160: 2.63年 | T160: 5.99 | U160: 403 | V160: 0.28800000000000003 | W160: 3.4000000000000002e-002 | X160: 6.9000000000000006e-002 | Y160: 177 | Z160: 6.79 | AA160: -0.14499999999999999 | AB160: -0.14999999999999999 | AC160: -0.161 | AD160: -0.16200000000000001 | AE160: 92.91 | AF160: 96.5 | AG160: 0.97 | AH160: AA | AI160: 3.9e-002 | AJ160: =H160+100*O160 -> 249.61099999999999 | AK160: 265.2 | AL160: 364 | AM160: 168.7 | AN160: 363 | AO160: -4.0000000000000001e-003 | AP160: 8 | AQ160: 鹏辉转债!
A161: 160 | B161: 128135 | C161: 洽洽转债! | D161: 2557 | E161: 洽洽食品 | F161: 食品饮料 | G161: 休闲食品 | H161: 125.105 | I161: 8.0000000000000004e-004 | J161: 9.7999999999999997e-003 | K161: 58.85 | L161: 2.2099999999999998e-002 | M161: 119.9 | N161: 60.03 | O161: 0.27600000000000002 | P161: 98.03 | Q161: 已到 | R161: 4.63年 | S161: 2.63年 | T161: 13.4 | U161: 7 | V161: 4.0000000000000001e-003 | W161: 4.4999999999999998e-002 | X161: 4.4000000000000004e-002 | Y161: 298 | Z161: 6.84 | AA161: -9.300000000000001e-003 | AB161: -1.66e-002 | AC161: -6.6400000000000001e-002 | AD161: -6.8499999999999991e-002 | AE161: 93.01 | AF161: 100.79 | AG161: 0.48 | AH161: AA | AI161: 3.9e-002 | AJ161: =H161+100*O161 -> 152.70500000000001 | AK161: 152.2 | AL161: 162 | AM161: 51.4 | AN161: 110 | AO161: 3.7999999999999999e-002 | AP161: 11 | AQ161: 洽洽转债!
A162: 161 | B162: 127022 | C162: 恒逸转债 | D162: 703 | E162: 恒逸石化 | F162: 化工 | G162: 化工 | H162: 118.653 | I162: -1.1999999999999999e-003 | J162: -3.0999999999999999e-003 | K162: 9.7 | L162: -1.0200000000000001e-002 | M162: 108.7 | N162: 11.2 | O162: 0.37 | P162: 86.61 | Q162: 已到 | R162: 4.62年 | S162: 2.62年 | T162: 20 | U162: 2.5 | V162: 1.e-003 | W162: 5.5999999999999994e-002 | X162: 4.9000000000000002e-002 | Y162: 356 | Z162: 1.37 | AA162: -1.9099999999999999e-002 | AB162: -2.2499999999999999e-002 | AC162: -5.16e-002 | AD162: -5.3200000000000004e-002 | AE162: 93.4 | AF162: 93.37 | AG162: 0.43 | AH162: AA+ | AI162: 3.4000000000000002e-002 | AJ162: =H162+100*O162 -> 155.65300000000002 | AK162: 150.7 | AL162: 147 | AM162: 57.3 | AN162: 157 | AO162: -4.5999999999999999e-002 | AP162: 6 | AQ162: 恒逸转债
A163: 162 | B163: 110075 | C163: 南航转债 | D163: 600029 | E163: 南方航空 | F163: 交通运输 | G163: 航空运输 | H163: 134.43 | I163: -1.34e-002 | J163: 9.5999999999999992e-003 | K163: 7.25 | L163: -5.5000000000000005e-003 | M163: 109.8 | N163: 6.24 | O163: 0.157 | P163: 116.19 | Q163: 已到 | R163: 4.61年 | S163: 2.61年 | T163: 59 | U163: 116 | V163: 1.4999999999999999e-002 | W163: 4.8000000000000001e-002 | X163: 5.5999999999999994e-002 | Y163: 1229. | Z163: 1.67 | AA163: -4.3400000000000001e-002 | AB163: -4.7100000000000003e-002 | AC163: -9.4800000000000009e-002 | AD163: -9.6000000000000002e-002 | AE163: 93.54 | AF163: 95.13 | AG163: 0.7 | AH163: AAA | AI163: 3.2000000000000001e-002 | AJ163: =H163+100*O163 -> 150.13 | AK163: 152.7 | AL163: 168 | AM163: 57.5 | AN163: 159 | AO163: -5.0000000000000001e-003 | AP163: 8 | AQ163: 南航转债
A164: 163 | B164: 113604 | C164: 多伦转债! | D164: 603528 | E164: 多伦科技 | F164: 计算机及 | G164: 软件开发 | H164: 109.89 | I164: -6.1999999999999998e-003 | J164: -1.03e-002 | K164: 6.74 | L164: -6.7799999999999999e-002 | M164: 116.9 | N164: 10.4 | O164: 0.69599999999999995 | P164: 64.81 | Q164: 已到 | R164: 4.61年 | S164: 2.61年 | T164: 6.4 | U164: 171 | V164: 0.23999999999999999 | W164: 0.152 | X164: 9.8000000000000004e-002 | Y164: 42 | Z164: 2.58 | AA164: 1.38e-002 | AB164: 7.1999999999999998e-003 | AC164: -2.1899999999999999e-002 | AD164: -2.4199999999999999e-002 | AE164: 88.09 | AF164: 89.86 | AG164: 0.24 | AH164: AA- | AI164: 5.9999999999999998e-002 | AJ164: =H164+100*O164 -> 179.49000000000001 | AK164: 155 | AL164: 189 | AM164: 65.1 | AN164: 218 | AO164: 6.5000000000000002e-002 | AP164: 18 | AQ164: 多伦转债!
A165: 164 | B165: 128134 | C165: 鸿路转债! | D165: 2541 | E165: 鸿路钢构 | F165: 建筑 | G165: 其他建材 | H165: 133.48 | I165: -1.e-004 | J165: -1.0500000000000001e-002 | K165: 47.39 | L165: -1.66e-002 | M165: 114.8 | N165: 43.51 | O165: 0.22600000000000001 | P165: 108.92 | Q165: 已到 | R165: 4.60年 | S165: 2.60年 | T165: 15.7 | U165: 33 | V165: 1.6e-002 | W165: 6.3e-002 | X165: 6.8000000000000005e-002 | Y165: 252 | Z165: 3.78 | AA165: -3.2799999999999996e-002 | AB165: -3.8300000000000001e-002 | AC165: -8.9200000000000002e-002 | AD165: -9.11e-002 | AE165: 93.02 | AF165: 96.61 | AG165: 0.64 | AH165: AA | AI165: 3.9e-002 | AJ165: =H165+100*O165 -> 156.07999999999998 | AK165: 158 | AL165: 213 | AM165: 61.4 | AN165: 191 | AO165: -5.9000000000000004e-002 | AP165: 4 | AQ165: 鸿路转债!
A166: 165 | B166: 128133 | C166: 奇正转债! | D166: 2287 | E166: 奇正藏药 | F166: 医药 | G166: 中药 | H166: 117 | I166: -1.03e-002 | J166: 9.300000000000001e-003 | K166: 26.52 | L166: -2.5999999999999999e-003 | M166: 116.9 | N166: 29.79 | O166: 0.314 | P166: 89.02 | Q166: 已到 | R166: 4.55年 | S166: 2.55年 | T166: 8 | U166: 11 | V166: 1.2e-002 | W166: 5.7000000000000002e-002 | X166: 5.0999999999999997e-002 | Y166: 141 | Z166: 4.75 | AA166: -2.0000000000000001e-004 | AB166: -6.7000000000000002e-003 | AC166: -4.4800000000000006e-002 | AD166: -4.7100000000000003e-002 | AE166: 93.28 | AF166: 98.56 | AG166: 0.41 | AH166: AA | AI166: 3.9e-002 | AJ166: =H166+100*O166 -> 148.40000000000001 | AK166: 145 | AL166: 77 | AM166: 46.4 | AN166: 68 | AO166: 1.3000000000000001e-002 | AP166: 21 | AQ166: 奇正转债!
A167: 166 | B167: 123067 | C167: 斯莱转债! | D167: 300382 | E167: 斯莱克 | F167: 机械装备 | G167: 专用设备 | H167: 197.55 | I167: -1.6200000000000003e-002 | J167: 1.0200000000000001e-002 | K167: 16.99 | L167: -6.4000000000000003e-003 | M167: 120.8 | N167: 9.36 | O167: 8.8000000000000009e-002 | P167: 181.52 | Q167: 已到 | R167: 4.54年 | S167: 2.54年 | T167: 2.4 | U167: 25 | V167: 5.2000000000000005e-002 | W167: 2.4e-002 | X167: 4.4000000000000004e-002 | Y167: 99 | Z167: 8.54 | AA167: -0.105 | AB167: -0.111 | AC167: -0.14199999999999999 | AD167: -0.14300000000000002 | AE167: 88.75 | AF167: 93.3 | AG167: 0.93 | AH167: AA- | AI167: 5.9999999999999998e-002 | AJ167: =H167+100*O167 -> 206.35000000000002 | AK167: 213.6 | AL167: 353 | AM167: 120.3 | AN167: 353 | AO167: -7.0000000000000007e-002 | AP167: 11 | AQ167: 斯莱转债!
A168: 167 | B168: 128132 | C168: 交建转债! | D168: 2941 | E168: 新疆交建 | F168: 建筑 | G168: 建筑工程 | H168: 112.9 | I168: -2.5600000000000001e-002 | J168: 1.4800000000000001e-002 | K168: 13.7 | L168: -4.7300000000000002e-002 | M168: 116.9 | N168: 18.53 | O168: 0.52700000000000002 | P168: 73.93 | Q168: 已到 | R168: 4.53年 | S168: 2.53年 | T168: 8.49 | U168: 50 | V168: 5.2000000000000005e-002 | W168: 9.6000000000000002e-002 | X168: 7.0999999999999994e-002 | Y168: 88 | Z168: 3.41 | AA168: 7.9000000000000008e-003 | AB168: 1.1999999999999999e-003 | AC168: -3.2300000000000002e-002 | AD168: -3.4599999999999999e-002 | AE168: 93.35 | AF168: 98.64 | AG168: 0.23 | AH168: AA | AI168: 3.9e-002 | AJ168: =H168+100*O168 -> 165.60000000000002 | AK168: 151.9 | AL168: 159 | AM168: 53.2 | AN168: 122 | AO168: 1.8000000000000002e-002 | AP168: 29 | AQ168: 交建转债!
A169: 168 | B169: 128131 | C169: 崇达转2! | D169: 2815 | E169: 崇达技术 | F169: 电子 | G169: 元器件制 | H169: 115.1 | I169: -1.9799999999999998e-002 | J169: 1.78e-002 | K169: 13.9 | L169: -9.300000000000001e-003 | M169: 114.9 | N169: 19.38 | O169: 0.60499999999999998 | P169: 71.72 | Q169: 已到 | R169: 4.51年 | S169: 2.51年 | T169: 14 | U169: 14 | V169: 8.0000000000000002e-003 | W169: 0.115 | X169: 8.199999999999999e-002 | Y169: 122 | Z169: 2.83 | AA169: -4.0000000000000002e-004 | AB169: -6.3e-003 | AC169: -3.9599999999999996e-002 | AD169: -4.1900000000000007e-002 | AE169: 93.43 | AF169: 97.04 | AG169: 0.22 | AH169: AA | AI169: 3.9e-002 | AJ169: =H169+100*O169 -> 175.59999999999999 | AK169: 158.5 | AL169: 218 | AM169: 61.4 | AN169: 192 | AO169: -4.4000000000000004e-002 | AP169: 11 | AQ169: 崇达转2!
A170: 169 | B170: 123065 | C170: 宝莱转债! | D170: 300246 | E170: 宝莱特 | F170: 医药 | G170: 医疗器械 | H170: 116.015 | I170: -4.6999999999999993e-003 | J170: 4.4000000000000003e-003 | K170: 19.28 | L170: -2.5999999999999999e-003 | M170: 121 | N170: 36.63 | O170: 1.2 | P170: 52.63 | Q170: 已到 | R170: 4.50年 | S170: 2.50年 | T170: 2.19 | U170: 18 | V170: 7.0000000000000007e-002 | W170: 6.5000000000000002e-002 | X170: 3.4000000000000002e-002 | Y170: 34 | Z170: 3.23 | AA170: 9.5999999999999992e-003 | AB170: 1.5e-003 | AC170: -4.0800000000000003e-002 | AD170: -4.3400000000000001e-002 | AE170: 89.1 | AF170: 93.66 | AG170: 0.1 | AH170: AA- | AI170: 5.9999999999999998e-002 | AJ170: =H170+100*O170 -> 236.01499999999999 | AK170: 179.4 | AL170: 322 | AM170: 85.7 | AN170: 320 | AO170: 1.7000000000000001e-002 | AP170: 25 | AQ170: 宝莱转债!
A171: 170 | B171: 123064 | C171: 万孚转债! | D171: 300482 | E171: 万孚生物 | F171: 医药 | G171: 医疗器械 | H171: 127.39 | I171: 2.8999999999999998e-003 | J171: -1.1299999999999999e-002 | K171: 47.02 | L171: -1.9e-002 | M171: 114.8 | N171: 52 | O171: 0.40899999999999997 | P171: 90.42 | Q171: 已到 | R171: 4.49年 | S171: 2.49年 | T171: 5.99 | U171: 251 | V171: 0.32799999999999996 | W171: 2.8999999999999998e-002 | X171: 2.6000000000000002e-002 | Y171: 209 | Z171: 6.53 | AA171: -2.3300000000000001e-002 | AB171: -2.8999999999999998e-002 | AC171: -7.6299999999999993e-002 | AD171: -7.8399999999999997e-002 | AE171: 93.39 | AF171: 97 | AG171: 0.44 | AH171: AA | AI171: 3.9e-002 | AJ171: =H171+100*O171 -> 168.28999999999999 | AK171: 164.4 | AL171: 276 | AM171: 67.4 | AN171: 238 | AO171: 0.215 | AP171: 16 | AQ171: 万孚转债!
A172: 171 | B172: 128130 | C172: 景兴转债 | D172: 2067 | E172: 景兴纸业 | F172: 造纸包装 | G172: 包装用纸 | H172: 126.579 | I172: -8.8999999999999999e-003 | J172: 3.8e-003 | K172: 4.03 | L172: -7.4000000000000003e-003 | M172: 114.8 | N172: 3.4 | O172: 6.8000000000000005e-002 | P172: 118.53 | Q172: 已到 | R172: 4.49年 | S172: 2.49年 | T172: 9.99 | U172: 19 | V172: 1.4999999999999999e-002 | W172: 0.20800000000000002 | X172: 0.24600000000000002 | Y172: 48 | Z172: 0.92 | AA172: -2.1899999999999999e-002 | AB172: -2.76e-002 | AC172: -7.4200000000000002e-002 | AD172: -7.6299999999999993e-002 | AE172: 93.4 | AF172: 97.01 | AG172: 0.7 | AH172: AA | AI172: 3.9e-002 | AJ172: =H172+100*O172 -> 133.37899999999999 | AK172: 134.6 | AL172: 13 | AM172: 37.6 | AN172: 28 | AO172: 1.7000000000000001e-002 | AP172: 21 | AQ172: 景兴转债
A173: 172 | B173: 128129 | C173: 青农转债! | D173: 2958 | E173: 青农商行 | F173: 金融 | G173: 银行行业 | H173: 108.26 | I173: -6.8000000000000005e-003 | J173: 3.8e-003 | K173: 3.69 | L173: -8.1000000000000013e-003 | M173: 112 | N173: 4.32 | O173: 0.26700000000000002 | P173: 85.42 | Q173: 已到 | R173: 4.47年 | S173: 无权 | T173: 50 | U173: 50 | V173: 9.0000000000000011e-003 | W173: 0.24399999999999999 | X173: 0.20800000000000002 | Y173: 205 | Z173: 0.72 | AA173: 7.7000000000000002e-003 | AB173: 2.8000000000000004e-003 | AC173: 无权 | AD173: 无权 | AE173: 无权 | AF173: 97.51 | AG173: 0.37 | AH173: AAA | AI173: 3.2000000000000001e-002 | AJ173: =H173+100*O173 -> 134.96000000000001 | AK173: 131.1 | AL173: 5 | AM173: 33.6 | AN173: 12 | AO173: -2.6000000000000002e-002 | AP173: 30 | AQ173: 青农转债!
A174: 173 | B174: 113602 | C174: 景20转债! | D174: 603228 | E174: 景旺电子 | F174: 电子 | G174: 元器件制 | H174: 128.24 | I174: -5.8999999999999999e-003 | J174: 1.41e-002 | K174: 29.6 | L174: 1.2699999999999999e-002 | M174: 112.9 | N174: 27.4 | O174: 0.187 | P174: 108.03 | Q174: 已到 | R174: 4.47年 | S174: 2.47年 | T174: 17.8 | U174: 84 | V174: 3.6000000000000004e-002 | W174: 7.0999999999999994e-002 | X174: 7.5999999999999998e-002 | Y174: 252 | Z174: 3.73 | AA174: -2.86e-002 | AB174: -3.3599999999999998e-002 | AC174: -7.9000000000000001e-002 | AD174: -8.1199999999999994e-002 | AE174: 93.56 | AF174: 95.49 | AG174: 0.65 | AH174: AA | AI174: 3.9e-002 | AJ174: =H174+100*O174 -> 146.94 | AK174: 148.5 | AL174: 119 | AM174: 53 | AN174: 121 | AO174: -7.0000000000000007e-002 | AP174: 8 | AQ174: 景20转债!
A175: 174 | B175: 113039 | C175: 嘉泽转债!! | D175: 601619 | E175: 嘉泽新能 | F175: 能源电力 | G175: 风能 | H175: 149.87 | I175: -2.46e-002 | J175: 5.8999999999999999e-003 | K175: 4.85 | L175: -2.2200000000000001e-002 | M175: 112.8 | N175: 3.46 | O175: 6.9000000000000006e-002 | P175: 140.17 | Q175: 已到 | R175: 4.47年 | S175: 2.47年 | T175: 2.88 | U175: 81 | V175: 0.18600000000000003 | W175: 2.4e-002 | X175: 3.4000000000000002e-002 | Y175: 118 | Z175: 2.47 | AA175: -6.2699999999999992e-002 | AB175: -6.7299999999999999e-002 | AC175: -0.13100000000000001 | AD175: -0.13300000000000001 | AE175: 93.47 | AF175: 95.4 | AG175: 0.85 | AH175: AA | AI175: 3.9e-002 | AJ175: =H175+100*O175 -> 156.77000000000001 | AK175: 159.6 | AL175: 227 | AM175: 64.2 | AN175: 212 | AO175: 8.0000000000000002e-003 | AP175: 31 | AQ175: 嘉泽转债!!
A176: 175 | B176: 113601 | C176: 塞力转债! | D176: 603716 | E176: 塞力医疗 | F176: 医药 | G176: 医药商业 | H176: 117.36 | I176: 2.5000000000000001e-003 | J176: 1.4800000000000001e-002 | K176: 14.32 | L176: 3.9900000000000005e-002 | M176: 120.8 | N176: 16.98 | O176: 0.39200000000000002 | P176: 84.33 | Q176: 已到 | R176: 4.46年 | S176: 2.46年 | T176: 5.43 | U176: 376 | V176: 0.57700000000000007 | W176: 0.185 | X176: 0.156 | Y176: 29 | Z176: 1.93 | AA176: 6.6e-003 | AB176: -1.4000000000000002e-003 | AC176: -4.6300000000000001e-002 | AD176: -4.8899999999999999e-002 | AE176: 89.14 | AF176: 93.7 | AG176: 0.43 | AH176: AA- | AI176: 5.9999999999999998e-002 | AJ176: =H176+100*O176 -> 156.56 | AK176: 150.4 | AL176: 141 | AM176: 56.7 | AN176: 150 | AO176: 8.0000000000000002e-003 | AP176: 40 | AQ176: 塞力转债!
A177: 176 | B177: 128128 | C177: 齐翔转2! | D177: 2408 | E177: 齐翔腾达 | F177: 化工 | G177: 化工 | H177: 171.532 | I177: -3.9199999999999999e-002 | J177: 2.4799999999999999e-002 | K177: 9.32 | L177: -1.5800000000000002e-002 | M177: 115 | N177: 5.69 | O177: 4.7e-002 | P177: 163.8 | Q177: 已到 | R177: 4.46年 | S177: 2.46年 | T177: 6.81 | U177: 47 | V177: 4.0000000000000001e-002 | W177: 2.6000000000000002e-002 | X177: 4.2000000000000003e-002 | Y177: 265 | Z177: 2.13 | AA177: -8.72e-002 | AB177: -9.2399999999999996e-002 | AC177: -0.12300000000000001 | AD177: -0.124 | AE177: 93.62 | AF177: 97.31 | AG177: 0.91 | AH177: AA | AI177: 3.9e-002 | AJ177: =H177+100*O177 -> 176.232 | AK177: 179.3 | AL177: 321 | AM177: 82 | AN177: 314 | AO177: -1.3999999999999999e-002 | AP177: 25 | AQ177: 齐翔转2!
A178: 177 | B178: 128127 | C178: 文科转债! | D178: 2775 | E178: 文科园林 | F178: 城市公用 | G178: 生态环境 | H178: 110 | I178: -7.1999999999999998e-003 | J178: -2.8000000000000004e-003 | K178: 3.9 | L178: -2.2599999999999999e-002 | M178: 120.8 | N178: 4.88 | O178: 0.376 | P178: 79.92 | Q178: 已到 | R178: 4.46年 | S178: 2.46年 | T178: 9.49 | U178: 6.5 | V178: 6.0000000000000001e-003 | W178: 0.47499999999999998 | X178: 0.379 | Y178: 20 | Z178: 0.94 | AA178: 2.1700000000000001e-002 | AB178: 1.3500000000000002e-002 | AC178: -2.23e-002 | AD178: -2.5000000000000001e-002 | AE178: 86.79 | AF178: 89.61 | AG178: 0.44 | AH178: A+ | AI178: 7.0999999999999994e-002 | AJ178: =H178+100*O178 -> 147.59999999999999 | AK178: 140.1 | AL178: 41 | AM178: 50.5 | AN178: 97 | AO178: -3.6000000000000004e-002 | AP178: 79 | AQ178: 文科转债!
A179: 178 | B179: 110074 | C179: 精达转债!! | D179: 600577 | E179: 精达股份 | F179: 电子 | G179: 电子产品 | H179: 183.99 | I179: -6.0299999999999999e-002 | J179: 2.4e-002 | K179: 6.27 | L179: -3.9800000000000002e-002 | M179: 116.9 | N179: 3.73 | O179: 9.5000000000000001e-002 | P179: 168.1 | Q179: 已到 | R179: 4.46年 | S179: 2.46年 | T179: 5.1 | U179: 129 | V179: 0.13500000000000001 | W179: 4.0999999999999995e-002 | X179: 6.8000000000000005e-002 | Y179: 125 | Z179: 2.89 | AA179: -9.8400000000000001e-002 | AB179: -0.10400000000000001 | AC179: -0.13600000000000001 | AD179: -0.13699999999999998 | AE179: 93.61 | AF179: 98.92 | AG179: 0.91 | AH179: AA | AI179: 3.9e-002 | AJ179: =H179+100*O179 -> 193.49000000000001 | AK179: 199.9 | AL179: 344 | AM179: 101 | AN179: 344 | AO179: -2.8999999999999998e-002 | AP179: 10 | AQ179: 精达转债!!
A180: 179 | B180: 110072 | C180: 广汇转债! | D180: 600297 | E180: 广汇汽车 | F180: 汽车 | G180: 分销、售 | H180: 103.21 | I180: 1.6000000000000001e-003 | J180: -2.8999999999999998e-003 | K180: 2.56 | L180: -1.1599999999999999e-002 | M180: 114.3 | N180: 4.03 | O180: 0.625 | P180: 63.52 | Q180: 已到 | R180: 4.46年 | S180: 2.46年 | T180: 33.7 | U180: 63 | V180: 1.8000000000000002e-002 | W180: 0.16200000000000001 | X180: 0.10300000000000001 | Y180: 208 | Z180: 0.51 | AA180: 2.3599999999999999e-002 | AB180: 1.7600000000000001e-002 | AC180: -1.5e-003 | AD180: -3.5999999999999999e-003 | AE180: 94.23 | AF180: 98.73 | AG180: 0.12 | AH180: AA+ | AI180: 3.4000000000000002e-002 | AJ180: =H180+100*O180 -> 165.70999999999998 | AK180: 142.9 | AL180: 65 | AM180: 44.2 | AN180: 53 | AO180: -2.e-002 | AP180: 88 | AQ180: 广汇转债!
A181: 180 | B181: 113600 | C181: 新星转债!! | D181: 603978 | E181: 深圳新星 | F181: 有色金属 | G181: 有色行业 | H181: 131.83 | I181: -2.7400000000000001e-002 | J181: 3.7000000000000002e-003 | K181: 26.85 | L181: -3.7599999999999995e-002 | M181: 125.6 | N181: 23.85 | O181: 0.17100000000000001 | P181: 112.58 | Q181: 已到 | R181: 4.44年 | S181: 2.44年 | T181: 4.53 | U181: 22 | V181: 3.7000000000000005e-002 | W181: 0.10199999999999999 | X181: 0.115 | Y181: 45 | Z181: 2.83 | AA181: -1.11e-002 | AB181: -2.0400000000000001e-002 | AC181: -8.9200000000000002e-002 | AD181: -9.1499999999999998e-002 | AE181: 89.06 | AF181: 97.49 | AG181: 0.63 | AH181: AA- | AI181: 5.9999999999999998e-002 | AJ181: =H181+100*O181 -> 148.93000000000001 | AK181: 151.1 | AL181: 152 | AM181: 53.6 | AN181: 125 | AO181: 8.0000000000000002e-002 | AP181: 23 | AQ181: 新星转债!!
A182: 181 | B182: 127021 | C182: 特发转2! | D182: 70 | E182: 特发信息 | F182: 通信互联 | G182: 通信设备 | H182: 118.33 | I182: -1.24e-002 | J182: 9.8999999999999991e-003 | K182: 6.09 | L182: -8.1000000000000013e-003 | M182: 113 | N182: 7.33 | O182: 0.42399999999999999 | P182: 83.08 | Q182: 已到 | R182: 3.42年 | S182: 1.42年 | T182: 4.16 | U182: 3.2 | V182: 6.9999999999999993e-003 | W182: 8.1000000000000003e-002 | X182: 6.7000000000000004e-002 | Y182: 51 | Z182: 1.74 | AA182: -1.3500000000000002e-002 | AB182: -2.0299999999999999e-002 | AC182: -9.0899999999999995e-002 | AD182: -9.2799999999999994e-002 | AE182: 95.77 | AF182: 99.3 | AG182: 0.3 | AH182: AA | AI182: 3.9e-002 | AJ182: =H182+100*O182 -> 160.72999999999999 | AK182: 153.6 | AL182: 176 | AM182: 54.3 | AN182: 133 | AO182: 5.0000000000000001e-003 | AP182: 16 | AQ182: 特发转2!
A183: 182 | B183: 113599 | C183: 嘉友转债! | D183: 603871 | E183: 嘉友国际 | F183: 交通运输 | G183: 物流业 | H183: 127.85 | I183: -8.5000000000000006e-002 | J183: 1.72e-002 | K183: 21.99 | L183: -9.9900000000000003e-002 | M183: 125.6 | N183: 18.32 | O183: 6.5000000000000002e-002 | P183: 120.03 | Q183: 已到 | R183: 4.42年 | S183: 2.42年 | T183: 7.2 | U183: 949 | V183: 1. | W183: 0.10300000000000001 | X183: 0.124 | Y183: 70 | Z183: 3 | AA183: -4.0999999999999995e-003 | AB183: -1.3600000000000001e-002 | AC183: -7.9000000000000001e-002 | AD183: -8.1300000000000011e-002 | AE183: 89.17 | AF183: 97.61 | AG183: 0.68 | AH183: AA- | AI183: 5.9999999999999998e-002 | AJ183: =H183+100*O183 -> 134.34999999999999 | AK183: 135.7 | AL183: 18 | AM183: 38.1 | AN183: 30 | AO183: 7.0999999999999994e-002 | AP183: 17 | AQ183: 嘉友转债!
A184: 183 | B184: 113598 | C184: 法兰转债 | D184: 603966 | E184: 法兰泰克 | F184: 机械装备 | G184: 工程机械 | H184: 119.99 | I184: -1.4999999999999999e-002 | J184: 3.8e-003 | K184: 9.16 | L184: -2.1400000000000002e-002 | M184: 120.8 | N184: 9.7 | O184: 0.27100000000000002 | P184: 94.43 | Q184: 已到 | R184: 4.41年 | S184: 2.41年 | T184: 2.75 | U184: 7.3 | V184: 2.2000000000000002e-002 | W184: 0.10000000000000001 | X184: 9.4e-002 | Y184: 28 | Z184: 2.2 | AA184: 1.6000000000000001e-003 | AB184: -6.5000000000000006e-003 | AC184: -5.5599999999999997e-002 | AD184: -5.8200000000000002e-002 | AE184: 89.44 | AF184: 94.02 | AG184: 0.53 | AH184: AA- | AI184: 5.9999999999999998e-002 | AJ184: =H184+100*O184 -> 147.09 | AK184: 145.5 | AL184: 81 | AM184: 51.5 | AN184: 114 | AO184: -1.2e-002 | AP184: 14 | AQ184: 法兰转债
A185: 184 | B185: 128125 | C185: 华阳转债! | D185: 2949 | E185: 华阳国际 | F185: 建筑 | G185: 建筑工程 | H185: 114.45 | I185: -1.6299999999999999e-002 | J185: 8.6999999999999994e-003 | K185: 16.26 | L185: -3.56e-002 | M185: 118.1 | N185: 25.39 | O185: 0.78700000000000003 | P185: 64.04 | Q185: 已到 | R185: 4.40年 | S185: 2.40年 | T185: 4.5 | U185: 7.6 | V185: 1.4999999999999999e-002 | W185: 0.14099999999999999 | X185: 8.9999999999999997e-002 | Y185: 32 | Z185: 2.36 | AA185: 7.3000000000000001e-003 | AB185: 1.e-004 | AC185: -3.8900000000000004e-002 | AD185: -4.1399999999999999e-002 | AE185: 89.18 | AF185: 91.88 | AG185: 0.22 | AH185: AA- | AI185: 5.9999999999999998e-002 | AJ185: =H185+100*O185 -> 193.15000000000001 | AK185: 164.9 | AL185: 277 | AM185: 73 | AN185: 279 | AO185: -0.13400000000000001 | AP185: 14 | AQ185: 华阳转债!
A186: 185 | B186: 113597 | C186: 佳力转债! | D186: 603912 | E186: 佳力图 | F186: 机械装备 | G186: 专用设备 | H186: 153.64 | I186: -0.126 | J186: 6.88e-002 | K186: 23.75 | L186: -0.10000000000000001 | M186: 124 | N186: 23.15 | O186: 0.498 | P186: 102.59 | Q186: 已到 | R186: 4.40年 | S186: 2.40年 | T186: 2.99 | U186: 3795. | V186: 7.8399999999999999 | W186: 5.7999999999999996e-002 | X186: 5.9000000000000004e-002 | Y186: 52 | Z186: 5.38 | AA186: -4.8499999999999995e-002 | AB186: -5.7000000000000002e-002 | AC186: -0.10199999999999999 | AD186: -0.10400000000000001 | AE186: 89.61 | AF186: 96.52 | AG186: 0.57 | AH186: AA- | AI186: 5.9999999999999998e-002 | AJ186: =H186+100*O186 -> 203.44 | AK186: 204.7 | AL186: 347 | AM186: 108.2 | AN186: 346 | AO186: 0.20199999999999999 | AP186: 22 | AQ186: 佳力转债!
A187: 186 | B187: 123063 | C187: 大禹转债 | D187: 300021 | E187: 大禹节水 | F187: 化工 | G187: 橡胶塑料 | H187: 129.298 | I187: -2.7999999999999997e-002 | J187: 1.09e-002 | K187: 5.68 | L187: -2.5699999999999997e-002 | M187: 126.1 | N187: 4.83 | O187: 9.9000000000000005e-002 | P187: 117.6 | Q187: 已到 | R187: 4.40年 | S187: 3.40年 | T187: 6.35 | U187: 28 | V187: 3.4000000000000002e-002 | W187: 0.13 | X187: 0.153 | Y187: 49 | Z187: 3.06 | AA187: -5.7999999999999996e-003 | AB187: -1.55e-002 | AC187: -5.3600000000000002e-002 | AD187: -5.67e-002 | AE187: 86.96 | AF187: 98.18 | AG187: 0.67 | AH187: AA- | AI187: 5.9999999999999998e-002 | AJ187: =H187+100*O187 -> 139.19800000000001 | AK187: 141 | AL187: 49 | AM187: 42.8 | AN187: 48 | AO187: -6.9000000000000006e-002 | AP187: 20 | AQ187: 大禹转债
A188: 187 | B188: 128124 | C188: 科华转债! | D188: 2022 | E188: 科华生物 | F188: 医药 | G188: 生物制药 | H188: 107 | I188: 2.8000000000000004e-003 | J188: -3.3e-003 | K188: 13.59 | L188: -2.8999999999999998e-003 | M188: 110 | N188: 21.31 | O188: 0.67799999999999994 | P188: 63.77 | Q188: 已到 | R188: 4.40年 | S188: 2.40年 | T188: 7.38 | U188: 25 | V188: 3.2000000000000001e-002 | W188: 0.106 | X188: 6.7000000000000004e-002 | Y188: 70 | Z188: 1.94 | AA188: 6.4000000000000003e-003 | AB188: 2.0999999999999999e-003 | AC188: -1.5800000000000002e-002 | AD188: -1.78e-002 | AE188: 93.22 | AF188: 93.25 | AG188: 0.16 | AH188: AA | AI188: 3.9e-002 | AJ188: =H188+100*O188 -> 174.80000000000001 | AK188: 150.2 | AL188: 137 | AM188: 57 | AN188: 156 | AO188: 2.3e-002 | AP188: 33 | AQ188: 科华转债!
A189: 188 | B189: 113596 | C189: 城地转债! | D189: 603887 | E189: 城地香江 | F189: 通信互联 | G189: 通信设备 | H189: 102.08 | I189: -5.0000000000000001e-003 | J189: 4.6999999999999993e-003 | K189: 9.15 | L189: -3.6799999999999999e-002 | M189: 113.1 | N189: 24.26 | O189: 1.71 | P189: 37.72 | Q189: 已到 | R189: 4.40年 | S189: 2.40年 | T189: 12 | U189: 36 | V189: 2.9999999999999999e-002 | W189: 0.29100000000000004 | X189: 0.11 | Y189: 41 | Z189: 1.1 | AA189: 2.41e-002 | AB189: 1.8500000000000003e-002 | AC189: 5.1999999999999998e-003 | AD189: 2.5999999999999999e-003 | AE189: 84.88 | AF189: 80.94 | AG189: 0.01 | AH189: A | AI189: 8.1000000000000003e-002 | AJ189: =H189+100*O189 -> 273.07999999999998 | AK189: 166.4 | AL189: 286 | AM189: 81.6 | AN189: 311 | AO189: -8.0000000000000002e-003 | AP189: 49 | AQ189: 城地转债!
A190: 189 | B190: 123062 | C190: 三超转债 | D190: 300554 | E190: 三超新材 | F190: 机械装备 | G190: 通用设备 | H190: 127.36 | I190: 1.2999999999999999e-003 | J190: -2.e-003 | K190: 17.18 | L190: -1.1999999999999999e-003 | M190: 119.2 | N190: 17.13 | O190: 0.27000000000000002 | P190: 100.29 | Q190: 已到 | R190: 4.39年 | S190: 2.39年 | T190: 1.95 | U190: 5.2 | V190: 2.1000000000000001e-002 | W190: 0.121 | X190: 0.121 | Y190: 16 | Z190: 3.06 | AA190: -1.5300000000000001e-002 | AB190: -2.2700000000000001e-002 | AC190: -7.6299999999999993e-002 | AD190: -7.9100000000000004e-002 | AE190: 85.48 | AF190: 85.4 | AG190: 0.66 | AH190: A | AI190: 8.1000000000000003e-002 | AJ190: =H190+100*O190 -> 154.36000000000001 | AK190: 154.4 | AL190: 185 | AM190: 68.9 | AN190: 254 | AO190: 1.9e-002 | AP190: 27 | AQ190: 三超转债
A191: 190 | B191: 128123 | C191: 国光转债! | D191: 2749 | E191: 国光股份 | F191: 化工 | G191: 农化 | H191: 113.5 | I191: -4.3e-003 | J191: 1.2999999999999999e-003 | K191: 10.57 | L191: -7.4999999999999997e-003 | M191: 115.7 | N191: 13.49 | O191: 0.44900000000000001 | P191: 78.35 | Q191: 已到 | R191: 4.39年 | S191: 2.39年 | T191: 3.2 | U191: 8.5 | V191: 2.3e-002 | W191: 6.9000000000000006e-002 | X191: 5.4000000000000006e-002 | Y191: 46 | Z191: 3.51 | AA191: 4.5000000000000005e-003 | AB191: -1.9e-003 | AC191: -3.5299999999999998e-002 | AD191: -3.78e-002 | AE191: 89.4 | AF191: 90.11 | AG191: 0.39 | AH191: AA- | AI191: 5.9999999999999998e-002 | AJ191: =H191+100*O191 -> 158.40000000000001 | AK191: 148.6 | AL191: 122 | AM191: 58.5 | AN191: 166 | AO191: 6.5000000000000002e-002 | AP191: 17 | AQ191: 国光转债!
A192: 191 | B192: 110073 | C192: 国投转债! | D192: 600061 | E192: 国投资本 | F192: 金融 | G192: 证券行业 | H192: 109.77 | I192: -9.1000000000000004e-003 | J192: 6.4000000000000003e-003 | K192: 7.41 | L192: -1.0700000000000001e-002 | M192: 110.3 | N192: 9.9 | O192: 0.46700000000000003 | P192: 74.85 | Q192: 已到 | R192: 4.39年 | S192: 无权 | T192: 80 | U192: 52 | V192: 6.0000000000000001e-003 | W192: 0.16800000000000001 | X192: 0.126 | Y192: 476 | Z192: 1.05 | AA192: 1.1000000000000001e-003 | AB192: -3.2000000000000002e-003 | AC192: 无权 | AD192: 无权 | AE192: 无权 | AF192: 96.25 | AG192: 0.25 | AH192: AAA | AI192: 3.2000000000000001e-002 | AJ192: =H192+100*O192 -> 156.47 | AK192: 144.7 | AL192: 74 | AM192: 48.4 | AN192: 83 | AO192: -2.7000000000000003e-002 | AP192: 24 | AQ192: 国投转债!
A193: 192 | B193: 128122 | C193: 兴森转债! | D193: 2436 | E193: 兴森科技 | F193: 电子 | G193: 元器件制 | H193: 122.85 | I193: -7.7000000000000002e-003 | J193: 5.1000000000000004e-003 | K193: 11.84 | L193: -8.3999999999999995e-003 | M193: 113 | N193: 14.1 | O193: 0.46299999999999997 | P193: 83.97 | Q193: 已到 | R193: 3.38年 | S193: 2.38年 | T193: 2.69 | U193: 3 | V193: 9.0000000000000011e-003 | W193: 1.4999999999999999e-002 | X193: 1.3000000000000001e-002 | Y193: 176 | Z193: 4.91 | AA193: -2.4700000000000003e-002 | AB193: -3.1400000000000004e-002 | AC193: -6.6100000000000006e-002 | AD193: -6.83e-002 | AE193: 93.81 | AF193: 99.45 | AG193: 0.31 | AH193: AA | AI193: 3.9e-002 | AJ193: =H193+100*O193 -> 169.14999999999998 | AK193: 161.7 | AL193: 249 | AM193: 62.3 | AN193: 199 | AO193: -3.1e-002 | AP193: 10 | AQ193: 兴森转债!
A194: 193 | B194: 113037 | C194: 紫银转债! | D194: 601860 | E194: 紫金银行 | F194: 金融 | G194: 银行行业 | H194: 107.15 | I194: -3.3e-003 | J194: 1.5e-003 | K194: 3.21 | L194: -6.1999999999999998e-003 | M194: 115.6 | N194: 4.05 | O194: 0.35200000000000004 | P194: 79.26 | Q194: 已到 | R194: 4.38年 | S194: 无权 | T194: 45 | U194: 40 | V194: 8.0000000000000002e-003 | W194: 0.38299999999999995 | X194: 0.30299999999999999 | Y194: 118 | Z194: 0.76 | AA194: 1.7899999999999999e-002 | AB194: 1.1399999999999999e-002 | AC194: 无权 | AD194: 无权 | AE194: 无权 | AF194: 100.19 | AG194: 0.29 | AH194: AA+ | AI194: 3.4000000000000002e-002 | AJ194: =H194+100*O194 -> 142.35000000000002 | AK194: 135 | AL194: 15 | AM194: 34.9 | AN194: 16 | AO194: -1.4999999999999999e-002 | AP194: 33 | AQ194: 紫银转债!
A195: 194 | B195: 123061 | C195: 航新转债! | D195: 300424 | E195: 航新科技 | F195: 航空航天 | G195: 航空航天 | H195: 123.4 | I195: -1.2800000000000001e-002 | J195: 1.1999999999999999e-003 | K195: 14.75 | L195: -1.9900000000000001e-002 | M195: 124.3 | N195: 14.85 | O195: 0.24199999999999999 | P195: 99.33 | Q195: 已到 | R195: 4.38年 | S195: 2.38年 | T195: 2.5 | U195: 50 | V195: 0.161 | W195: 7.0999999999999994e-002 | X195: 7.0000000000000007e-002 | Y195: 35 | Z195: 5.23 | AA195: 1.7000000000000001e-003 | AB195: -7.6e-003 | AC195: -6.480000000000001e-002 | AD195: -6.7699999999999996e-002 | AE195: 87.71 | AF195: 92.75 | AG195: 0.58 | AH195: A+ | AI195: 7.0999999999999994e-002 | AJ195: =H195+100*O195 -> 147.59999999999999 | AK195: 147.5 | AL195: 104 | AM195: 54.7 | AN195: 138 | AO195: 1.1000000000000001e-002 | AP195: 21 | AQ195: 航新转债!
A196: 195 | B196: 123060 | C196: 苏试转债! | D196: 300416 | E196: 苏试试验 | F196: 机械装备 | G196: 专用设备 | H196: 169 | I196: -1.7399999999999999e-002 | J196: 2.6699999999999998e-002 | K196: 28.4 | L196: 1.0700000000000001e-002 | M196: 117.2 | N196: 19.05 | O196: 0.13400000000000001 | P196: 149.08 | Q196: 已到 | R196: 4.38年 | S196: 2.38年 | T196: 3.1 | U196: 22 | V196: 4.2000000000000003e-002 | W196: 3.7999999999999999e-002 | X196: 5.7000000000000002e-002 | Y196: 81 | Z196: 7.39 | AA196: -8.1699999999999995e-002 | AB196: -8.77e-002 | AC196: -0.125 | AD196: -0.126 | AE196: 89.41 | AF196: 91.34 | AG196: 0.87 | AH196: AA- | AI196: 5.9999999999999998e-002 | AJ196: =H196+100*O196 -> 182.40000000000001 | AK196: 188.9 | AL196: 335 | AM196: 97.6 | AN196: 339 | AO196: -3.0000000000000001e-003 | AP196: 7 | AQ196: 苏试转债!
A197: 196 | B197: 113595 | C197: 花王转债! | D197: 603007 | E197: ST花王 | F197: 城市公用 | G197: 生态环境 | H197: 103.18 | I197: -6.3e-003 | J197: 5.1999999999999998e-003 | K197: 3.15 | L197: -1.2500000000000001e-002 | M197: 124.8 | N197: 6.92 | O197: 1.27 | P197: 45.52 | Q197: 已到 | R197: 4.38年 | S197: 2.38年 | T197: 3.3 | U197: 9.8 | V197: 2.8999999999999998e-002 | W197: 0.312 | X197: 0.14199999999999999 | Y197: 11 | Z197: 0.98 | AA197: 4.5499999999999999e-002 | AB197: 3.5499999999999997e-002 | AC197: 2.0999999999999999e-003 | AD197: -8.0000000000000004e-004 | AE197: 77.83 | AF197: 76.63 | AG197: 0.08 | AH197: BBB- | AI197: 0.121 | AJ197: =H197+100*O197 -> 230.18000000000001 | AK197: 160.8 | AL197: 242 | AM197: 83 | AN197: 315 | AO197: -2.e-002 | AP197: 53 | AQ197: 花王转债!
A198: 197 | B198: 113594 | C198: 淳中转债! | D198: 603516 | E198: 淳中科技 | F198: 电子 | G198: 电子产品 | H198: 120.78 | I198: -1.8799999999999997e-002 | J198: 1.18e-002 | K198: 16.25 | L198: -1.34e-002 | M198: 120.9 | N198: 18.23 | O198: 0.35499999999999998 | P198: 89.14 | Q198: 已到 | R198: 4.38年 | S198: 2.38年 | T198: 3 | U198: 8.9 | V198: 2.5000000000000001e-002 | W198: 9.9000000000000005e-002 | X198: 8.8000000000000009e-002 | Y198: 30 | Z198: 3.13 | AA198: 2.0000000000000001e-004 | AB198: -7.9000000000000008e-003 | AC198: -5.74e-002 | AD198: -6.0199999999999997e-002 | AE198: 87.58 | AF198: 90.21 | AG198: 0.52 | AH198: A+ | AI198: 7.0999999999999994e-002 | AJ198: =H198+100*O198 -> 156.28 | AK198: 152.4 | AL198: 165 | AM198: 62.2 | AN198: 197 | AO198: -1.4999999999999999e-002 | AP198: 10 | AQ198: 淳中转债!
A199: 198 | B199: 127020 | C199: 中金转债 | D199: 60 | E199: 中金岭南 | F199: 有色金属 | G199: 有色行业 | H199: 126.99 | I199: -1.7500000000000002e-002 | J199: 6.6e-003 | K199: 5.16 | L199: -1.7100000000000001e-002 | M199: 113.5 | N199: 4.63 | O199: 0.13900000000000001 | P199: 111.45 | Q199: 已到 | R199: 4.38年 | S199: 2.38年 | T199: 34.3 | U199: 95 | V199: 2.2000000000000002e-002 | W199: 0.182 | X199: 0.20300000000000001 | Y199: 188 | Z199: 1.5 | AA199: -2.5699999999999997e-002 | AB199: -3.1e-002 | AC199: -8.2100000000000006e-002 | AD199: -8.3599999999999994e-002 | AE199: 93.97 | AF199: 98.26 | AG199: 0.63 | AH199: AA+ | AI199: 3.4000000000000002e-002 | AJ199: =H199+100*O199 -> 140.88999999999999 | AK199: 142.5 | AL199: 62 | AM199: 44.3 | AN199: 54 | AO199: 4.2999999999999997e-002 | AP199: 19 | AQ199: 中金转债
A200: 199 | B200: 113593 | C200: 沪工转债! | D200: 603131 | E200: 上海沪工 | F200: 机械装备 | G200: 通用设备 | H200: 120.84 | I200: -8.5000000000000006e-003 | J200: -4.5000000000000005e-003 | K200: 17.7 | L200: -2.75e-002 | M200: 121.2 | N200: 21.12 | O200: 0.442 | P200: 83.81 | Q200: 已到 | R200: 4.38年 | S200: 2.38年 | T200: 4 | U200: 11 | V200: 2.2000000000000002e-002 | W200: 7.0999999999999994e-002 | X200: 5.9999999999999998e-002 | Y200: 56 | Z200: 4.24 | AA200: 7.000000000000001e-004 | AB200: -7.6e-003 | AC200: -5.7099999999999998e-002 | AD200: -5.9999999999999998e-002 | AE200: 87.7 | AF200: 90.46 | AG200: 0.47 | AH200: A+ | AI200: 7.0999999999999994e-002 | AJ200: =H200+100*O200 -> 165.04000000000002 | AK200: 157.9 | AL200: 211 | AM200: 67.4 | AN200: 239 | AO200: -8.9999999999999997e-002 | AP200: 10 | AQ200: 沪工转债!
A201: 200 | B201: 128120 | C201: 联诚转债! | D201: 2921 | E201: 联诚精密 | F201: 汽车 | G201: 零部件制 | H201: 119.5 | I201: -1.8100000000000002e-002 | J201: 1.06e-002 | K201: 17.15 | L201: -1.21e-002 | M201: 117.9 | N201: 18.44 | O201: 0.28499999999999998 | P201: 93 | Q201: 已到 | R201: 4.37年 | S201: 2.37年 | T201: 2.6 | U201: 11 | V201: 3.5000000000000003e-002 | W201: 0.14300000000000002 | X201: 0.13300000000000001 | Y201: 18 | Z201: 2.28 | AA201: -3.2000000000000002e-003 | AB201: -1.03e-002 | AC201: -5.3600000000000002e-002 | AD201: -5.6500000000000002e-002 | AE201: 85.63 | AF201: 84.65 | AG201: 0.62 | AH201: A | AI201: 8.1000000000000003e-002 | AJ201: =H201+100*O201 -> 148. | AK201: 146 | AL201: 86 | AM201: 60.4 | AN201: 181 | AO201: -7.6999999999999999e-002 | AP201: 23 | AQ201: 联诚转债!
A202: 201 | B202: 128121 | C202: 宏川转债! | D202: 2930 | E202: 宏川智慧 | F202: 交通运输 | G202: 物流业 | H202: 126.7 | I202: -2.98e-002 | J202: -9.1999999999999998e-003 | K202: 21.78 | L202: -5.4699999999999999e-002 | M202: 112.9 | N202: 19.89 | O202: 0.157 | P202: 109.5 | Q202: 已到 | R202: 4.37年 | S202: 2.37年 | T202: 6.7 | U202: 30 | V202: 3.6000000000000004e-002 | W202: 6.9000000000000006e-002 | X202: 7.4999999999999997e-002 | Y202: 97 | Z202: 4.59 | AA202: -2.6600000000000002e-002 | AB202: -3.1699999999999999e-002 | AC202: -7.7699999999999991e-002 | AD202: -8.0000000000000002e-002 | AE202: 89.34 | AF202: 88.03 | AG202: 0.71 | AH202: AA- | AI202: 5.9999999999999998e-002 | AJ202: =H202+100*O202 -> 142.40000000000001 | AK202: 143.9 | AL202: 69 | AM202: 54.6 | AN202: 135 | AO202: -9.0000000000000011e-003 | AP202: 7 | AQ202: 宏川转债!
A203: 202 | B203: 123059 | C203: 银信转债! | D203: 300231 | E203: 银信科技 | F203: 计算机及 | G203: 软件开发 | H203: 125.6 | I203: -3.5699999999999996e-002 | J203: 1.04e-002 | K203: 9.78 | L203: -4.5899999999999996e-002 | M203: 123.7 | N203: 9.72 | O203: 0.248 | P203: 100.62 | Q203: 已到 | R203: 4.36年 | S203: 2.36年 | T203: 3.91 | U203: 48 | V203: 9.8000000000000004e-002 | W203: 8.9999999999999997e-002 | X203: 9.0999999999999998e-002 | Y203: 43 | Z203: 3.09 | AA203: -3.5999999999999999e-003 | AB203: -1.26e-002 | AC203: -7.3899999999999993e-002 | AD203: -7.6399999999999996e-002 | AE203: 89.57 | AF203: 96.49 | AG203: 0.55 | AH203: AA- | AI203: 5.9999999999999998e-002 | AJ203: =H203+100*O203 -> 150.40000000000001 | AK203: 150.6 | AL203: 145 | AM203: 54.1 | AN203: 132 | AO203: -1.7000000000000001e-002 | AP203: 19 | AQ203: 银信转债!
A204: 203 | B204: 127019 | C204: 国城转债! | D204: 688 | E204: 国城矿业 | F204: 有色金属 | G204: 锌铅镍锡 | H204: 114.9 | I204: -2.06e-002 | J204: 1.72e-002 | K204: 17.67 | L204: -9.4999999999999998e-003 | M204: 114.8 | N204: 21.06 | O204: 0.36899999999999999 | P204: 83.9 | Q204: 已到 | R204: 4.36年 | S204: 2.36年 | T204: 8.5 | U204: 31 | V204: 3.1e-002 | W204: 4.2000000000000003e-002 | X204: 3.5000000000000003e-002 | Y204: 201 | Z204: 8.32 | AA204: -2.0000000000000001e-004 | AB204: -6.3e-003 | AC204: -4.1500000000000002e-002 | AD204: -4.3899999999999995e-002 | AE204: 93.86 | AF204: 97.49 | AG204: 0.36 | AH204: AA | AI204: 3.9e-002 | AJ204: =H204+100*O204 -> 151.80000000000001 | AK204: 145.9 | AL204: 85 | AM204: 48.4 | AN204: 82 | AO204: 9.8000000000000004e-002 | AP204: 55 | AQ204: 国城转债!
A205: 204 | B205: 128119 | C205: 龙大转债! | D205: 2726 | E205: 龙大美食 | F205: 食品饮料 | G205: 肉制品 | H205: 123 | I205: -2.3e-003 | J205: 4.3e-003 | K205: 9.1 | L205: 4.4000000000000003e-003 | M205: 119.9 | N205: 9.29 | O205: 0.25600000000000001 | P205: 97.95 | Q205: 已到 | R205: 4.36年 | S205: 2.36年 | T205: 9.46 | U205: 26 | V205: 2.2000000000000002e-002 | W205: 9.6000000000000002e-002 | X205: 9.4e-002 | Y205: 98 | Z205: 2.43 | AA205: -6.0000000000000001e-003 | AB205: -1.37e-002 | AC205: -6.7000000000000004e-002 | AD205: -6.9400000000000003e-002 | AE205: 93.98 | AF205: 101.84 | AG205: 0.47 | AH205: AA | AI205: 3.9e-002 | AJ205: =H205+100*O205 -> 148.59999999999999 | AK205: 148 | AL205: 114 | AM205: 46.2 | AN205: 66 | AO205: 3.2000000000000001e-002 | AP205: 9 | AQ205: 龙大转债!
A206: 205 | B206: 110071 | C206: 湖盐转债! | D206: 600929 | E206: 雪天盐业 | F206: 食品饮料 | G206: 食品饮料 | H206: 130.02 | I206: -8.6999999999999994e-003 | J206: -1.4000000000000002e-003 | K206: 7 | L206: -1.41e-002 | M206: 114.9 | N206: 5.89 | O206: 9.4e-002 | P206: 118.85 | Q206: 已到 | R206: 4.35年 | S206: 2.35年 | T206: 7.2 | U206: 33 | V206: 3.5000000000000003e-002 | W206: 7.5999999999999998e-002 | X206: 9.0999999999999998e-002 | Y206: 95 | Z206: 2.5 | AA206: -2.86e-002 | AB206: -3.44e-002 | AC206: -8.7799999999999989e-002 | AD206: -8.9999999999999997e-002 | AE206: 94.01 | AF206: 97.64 | AG206: 0.72 | AH206: AA | AI206: 3.9e-002 | AJ206: =H206+100*O206 -> 139.42000000000002 | AK206: 141.2 | AL206: 51 | AM206: 43.6 | AN206: 50 | AO206: 3.7000000000000005e-002 | AP206: 19 | AQ206: 湖盐转债!
A207: 206 | B207: 113036 | C207: 宁建转债!! | D207: 601789 | E207: 宁波建工 | F207: 建筑 | G207: 建筑工程 | H207: 155.92 | I207: -0.12300000000000001 | J207: 3.2000000000000001e-002 | K207: 7.7 | L207: -0.10099999999999999 | M207: 116.9 | N207: 4.76 | O207: -3.6000000000000004e-002 | P207: 161.76 | Q207: 已到 | R207: 4.34年 | S207: 2.34年 | T207: 5.24 | U207: 4856. | V207: 5.6799999999999997 | W207: 7.0000000000000007e-002 | X207: 0.113 | Y207: 75 | Z207: 2.32 | AA207: -6.54e-002 | AB207: -7.1599999999999997e-002 | AC207: -0.11 | AD207: -0.11199999999999999 | AE207: 94.05 | AF207: 99.37 | AG207: 0.91 | AH207: AA | AI207: 3.9e-002 | AJ207: =H207+100*O207 -> 152.31999999999999 | AK207: 150.1 | AL207: 135 | AM207: 50.7 | AN207: 99 | AO207: 0.223 | AP207: 15 | AQ207: 宁建转债!!
A208: 207 | B208: 128118 | C208: 瀛通转债! | D208: 2861 | E208: 瀛通通讯 | F208: 电子 | G208: 电子产品 | H208: 112.11 | I208: -4.4000000000000003e-003 | J208: 2.8999999999999998e-003 | K208: 12.4 | L208: -1.04e-002 | M208: 121.7 | N208: 21.24 | O208: 0.92000000000000004 | P208: 58.38 | Q208: 已到 | R208: 4.33年 | S208: 2.33年 | T208: 3 | U208: 2.9 | V208: 9.0000000000000011e-003 | W208: 0.154 | X208: 8.9999999999999997e-002 | Y208: 19 | Z208: 1.85 | AA208: 1.9699999999999999e-002 | AB208: 1.09e-002 | AC208: -2.92e-002 | AD208: -3.2300000000000002e-002 | AE208: 90.27 | AF208: 95.22 | AG208: 0.14 | AH208: AA- | AI208: 5.9999999999999998e-002 | AJ208: =H208+100*O208 -> 204.11000000000001 | AK208: 165.8 | AL208: 284 | AM208: 70.6 | AN208: 265 | AO208: 9.0000000000000011e-003 | AP208: 29 | AQ208: 瀛通转债!
A209: 208 | B209: 128117 | C209: 道恩转债! | D209: 2838 | E209: 道恩股份 | F209: 化工 | G209: 橡胶塑料 | H209: 112.8 | I209: -5.5000000000000005e-003 | J209: 5.8999999999999999e-003 | K209: 15.63 | L209: 4.5000000000000005e-003 | M209: 123.1 | N209: 28.78 | O209: 1.0800000000000001 | P209: 54.31 | Q209: 已到 | R209: 4.33年 | S209: 2.33年 | T209: 3.6 | U209: 5.6 | V209: 1.3999999999999999e-002 | W209: 5.5999999999999994e-002 | X209: 3.1e-002 | Y209: 64 | Z209: 3.36 | AA209: 2.0799999999999999e-002 | AB209: 1.1599999999999999e-002 | AC209: -3.4500000000000003e-002 | AD209: -3.7000000000000005e-002 | AE209: 89.58 | AF209: 96.18 | AG209: 0.1 | AH209: AA- | AI209: 5.9999999999999998e-002 | AJ209: =H209+100*O209 -> 220.80000000000001 | AK209: 171.3 | AL209: 308 | AM209: 75.1 | AN209: 288 | AO209: 4.2000000000000003e-002 | AP209: 29 | AQ209: 道恩转债!
A210: 209 | B210: 123057 | C210: 美联转债!! | D210: 300586 | E210: 美联新材 | F210: 化工 | G210: 橡胶塑料 | H210: 140 | I210: -2.3700000000000002e-002 | J210: 9.7999999999999997e-003 | K210: 11.45 | L210: -1.89e-002 | M210: 117.8 | N210: 9.5 | O210: 0.16200000000000001 | P210: 120.53 | Q210: 已到 | R210: 4.32年 | S210: 2.32年 | T210: 2.07 | U210: 40 | V210: 0.13699999999999998 | W210: 3.4000000000000002e-002 | X210: 4.0999999999999995e-002 | Y210: 60 | Z210: 5.02 | AA210: -4.0000000000000001e-002 | AB210: -4.6799999999999994e-002 | AC210: -0.114 | AD210: -0.11599999999999999 | AE210: 89.87 | AF210: 92.14 | AG210: 0.74 | AH210: AA- | AI210: 5.9999999999999998e-002 | AJ210: =H210+100*O210 -> 156.19999999999999 | AK210: 159.5 | AL210: 224 | AM210: 67.3 | AN210: 237 | AO210: -4.0000000000000001e-003 | AP210: 19 | AQ210: 美联转债!!
A211: 210 | B211: 113591 | C211: 胜达转债! | D211: 603687 | E211: 大胜达 | F211: 造纸包装 | G211: 包装用纸 | H211: 124.96 | I211: -1.2699999999999999e-002 | J211: -8.0000000000000004e-004 | K211: 9.95 | L211: -2.07e-002 | M211: 121.7 | N211: 8.76 | O211: 0.10000000000000001 | P211: 113.58 | Q211: 已到 | R211: 4.32年 | S211: 2.32年 | T211: 4.78 | U211: 27 | V211: 4.4999999999999998e-002 | W211: 0.11599999999999999 | X211: 0.13200000000000001 | Y211: 41 | Z211: 2.35 | AA211: -6.1999999999999998e-003 | AB211: -1.47e-002 | AC211: -7.3099999999999998e-002 | AD211: -7.5600000000000001e-002 | AE211: 89.77 | AF211: 95.15 | AG211: 0.66 | AH211: AA- | AI211: 5.9999999999999998e-002 | AJ211: =H211+100*O211 -> 134.95999999999998 | AK211: 136.3 | AL211: 20 | AM211: 41.2 | AN211: 41 | AO211: -1.4999999999999999e-002 | AP211: 37 | AQ211: 胜达转债!
A212: 211 | B212: 128116 | C212: 瑞达转债! | D212: 2961 | E212: 瑞达期货 | F212: 金融 | G212: 期货行业 | H212: 114.196 | I212: -7.0999999999999995e-003 | J212: 1.1000000000000001e-003 | K212: 20 | L212: -3.1899999999999998e-002 | M212: 114.9 | N212: 29.55 | O212: 0.68700000000000006 | P212: 67.68 | Q212: 已到 | R212: 4.32年 | S212: 2.32年 | T212: 6.49 | U212: 3.6 | V212: 5.0000000000000001e-003 | W212: 7.2999999999999995e-002 | X212: 4.9000000000000002e-002 | Y212: 89 | Z212: 4.19 | AA212: 1.5e-003 | AB212: -4.6999999999999993e-003 | AC212: -3.9800000000000002e-002 | AD212: -4.2199999999999994e-002 | AE212: 94.03 | AF212: 97.74 | AG212: 0.19 | AH212: AA | AI212: 3.9e-002 | AJ212: =H212+100*O212 -> 182.89600000000002 | AK212: 160.7 | AL212: 240 | AM212: 63 | AN212: 205 | AO212: -4.5999999999999999e-002 | AP212: 18 | AQ212: 瑞达转债!
A213: 212 | B213: 127018 | C213: 本钢转债! | D213: 761 | E213: 本钢板材 | F213: 钢铁 | G213: 炼钢 | H213: 117.988 | I213: -8.5000000000000006e-003 | J213: 2.8999999999999998e-003 | K213: 4.27 | L213: -1.61e-002 | M213: 128 | N213: 4.55 | O213: 0.25700000000000001 | P213: 93.85 | Q213: 已到 | R213: 4.32年 | S213: 2.32年 | T213: 56.3 | U213: 83 | V213: 1.3000000000000001e-002 | W213: 0.32100000000000001 | X213: 0.30099999999999999 | Y213: 175 | Z213: 0.77 | AA213: 1.9699999999999999e-002 | AB213: 8.8000000000000005e-003 | AC213: -4.3299999999999998e-002 | AD213: -4.7500000000000001e-002 | AE213: 97.99 | AF213: 112.22 | AG213: 0.35 | AH213: AAA | AI213: 3.2000000000000001e-002 | AJ213: =H213+100*O213 -> 143.68799999999999 | AK213: 142.1 | AL213: 59 | AM213: 29.9 | AN213: 7 | AO213: 2.7000000000000003e-002 | AP213: 60 | AQ213: 本钢转债!
A214: 213 | B214: 113589 | C214: 天创转债! | D214: 603608 | E214: 天创时尚 | F214: 服装纺织 | G214: 鞋服行业 | H214: 105.01 | I214: -6.0000000000000001e-003 | J214: 5.6000000000000008e-003 | K214: 5.7 | L214: -1.55e-002 | M214: 114.9 | N214: 12.29 | O214: 1.26 | P214: 46.38 | Q214: 已到 | R214: 4.30年 | S214: 2.30年 | T214: 6 | U214: 4.2 | V214: 6.9999999999999993e-003 | W214: 0.245 | X214: 0.114 | Y214: 24 | Z214: 1.55 | AA214: 2.1600000000000001e-002 | AB214: 1.52e-002 | AC214: -6.3e-003 | AD214: -8.8999999999999999e-003 | AE214: 94.17 | AF214: 97.8 | AG214: 0.03 | AH214: AA | AI214: 3.9e-002 | AJ214: =H214+100*O214 -> 231.00999999999999 | AK214: 163.6 | AL214: 271 | AM214: 65.8 | AN214: 227 | AO214: -5.2999999999999999e-002 | AP214: 45 | AQ214: 天创转债!
A215: 214 | B215: 123056 | C215: 雪榕转债! | D215: 300511 | E215: 雪榕生物 | F215: 农业 | G215: 种植业 | H215: 111.229 | I215: -6.4000000000000003e-003 | J215: 4.7999999999999996e-003 | K215: 7.03 | L215: -1.1299999999999999e-002 | M215: 120.7 | N215: 11.77 | O215: 0.86199999999999999 | P215: 59.73 | Q215: 已到 | R215: 4.30年 | S215: 2.30年 | T215: 5.84 | U215: 7.9 | V215: 1.2e-002 | W215: 0.188 | X215: 0.11199999999999999 | Y215: 31 | Z215: 1.74 | AA215: 1.9599999999999999e-002 | AB215: 1.11e-002 | AC215: -2.8500000000000001e-002 | AD215: -3.1300000000000001e-002 | AE215: 89.87 | AF215: 94.48 | AG215: 0.14 | AH215: AA- | AI215: 5.9999999999999998e-002 | AJ215: =H215+100*O215 -> 197.429 | AK215: 162.7 | AL215: 261 | AM215: 68.3 | AN215: 248 | AO215: 4.0000000000000001e-003 | AP215: 26 | AQ215: 雪榕转债!
A216: 215 | B216: 113588 | C216: 润达转债! | D216: 603108 | E216: 润达医疗 | F216: 医药 | G216: 医疗器械 | H216: 120.26 | I216: -6.1999999999999998e-003 | J216: 1.18e-002 | K216: 11.94 | L216: 1.2699999999999999e-002 | M216: 113.9 | N216: 13.25 | O216: 0.33500000000000002 | P216: 90.11 | Q216: 已到 | R216: 4.29年 | S216: 2.29年 | T216: 5.5 | U216: 6.3 | V216: 9.0000000000000011e-003 | W216: 7.9000000000000001e-002 | X216: 7.2000000000000008e-002 | Y216: 69 | Z216: 2.1 | AA216: -1.29e-002 | AB216: -1.8600000000000002e-002 | AC216: -6.0299999999999999e-002 | AD216: -6.2699999999999992e-002 | AE216: 94.23 | AF216: 97.03 | AG216: 0.44 | AH216: AA | AI216: 3.9e-002 | AJ216: =H216+100*O216 -> 153.75999999999999 | AK216: 150.4 | AL216: 142 | AM216: 53.4 | AN216: 123 | AO216: 4.7e-002 | AP216: 11 | AQ216: 润达转债!
A217: 216 | B217: 128114 | C217: 正邦转债! | D217: 2157 | E217: 正邦科技 | F217: 农业 | G217: 畜牧业 | H217: 103.6 | I217: -4.1999999999999997e-003 | J217: 4.0999999999999995e-003 | K217: 6.75 | L217: -7.4000000000000003e-003 | M217: 114.9 | N217: 14.77 | O217: 1.27 | P217: 45.7 | Q217: 已到 | R217: 4.29年 | S217: 2.29年 | T217: 16 | U217: 40 | V217: 2.4e-002 | W217: 7.4999999999999997e-002 | X217: 3.4000000000000002e-002 | Y217: 212 | Z217: 1.64 | AA217: 2.5000000000000001e-002 | AB217: 1.8500000000000003e-002 | AC217: -8.0000000000000004e-004 | AD217: -3.4999999999999996e-003 | AE217: 94.23 | AF217: 97.87 | AG217: 0.02 | AH217: AA | AI217: 3.9e-002 | AJ217: =H217+100*O217 -> 230.59999999999999 | AK217: 161.5 | AL217: 248 | AM217: 63.6 | AN217: 209 | AO217: -7.8e-002 | AP217: 32 | AQ217: 正邦转债!
A218: 217 | B218: 128111 | C218: 中矿转债! | D218: 2738 | E218: 中矿资源 | F218: 有色金属 | G218: 有色行业 | H218: 672 | I218: 3.2000000000000002e-003 | J218: 1.6399999999999998e-002 | K218: 102 | L218: 1.9799999999999998e-002 | M218: 124.2 | N218: 15.45 | O218: 1.8000000000000002e-002 | P218: 660.19 | Q218: 已到 | R218: 4.27年 | S218: 2.27年 | T218: 1.37 | U218: 2959. | V218: 3.1499999999999999 | W218: 4.0000000000000001e-003 | X218: 2.7000000000000003e-002 | Y218: 332 | Z218: 8.87 | AA218: -0.33100000000000002 | AB218: -0.33600000000000002 | AC218: -0.29600000000000004 | AD218: -0.29699999999999999 | AE218: 90.5 | AF218: 97.46 | AG218: 0.99 | AH218: AA- | AI218: 5.9999999999999998e-002 | AJ218: =H218+100*O218 -> 673.79999999999995 | AK218: 683.8 | AL218: 381 | AM218: 586.3 | AN218: 381 | AO218: 0.22800000000000001 | AP218: 11 | AQ218: 中矿转债!
A219: 218 | B219: 123054 | C219: 思特转债!! | D219: 300608 | E219: 思特奇 | F219: 通信互联 | G219: 通信设备 | H219: 138.9 | I219: -9.5999999999999992e-003 | J219: 8.199999999999999e-003 | K219: 14.96 | L219: -2.e-003 | M219: 121.2 | N219: 12.63 | O219: 0.17300000000000001 | P219: 118.45 | Q219: 已到 | R219: 4.27年 | S219: 2.27年 | T219: 2.07 | U219: 454 | V219: 1.54 | W219: 6.6000000000000003e-002 | X219: 7.8e-002 | Y219: 31 | Z219: 3.77 | AA219: -3.2199999999999999e-002 | AB219: -4.0300000000000002e-002 | AC219: -0.11199999999999999 | AD219: -0.115 | AE219: 90.52 | AF219: 95.14 | AG219: 0.7 | AH219: AA- | AI219: 5.9999999999999998e-002 | AJ219: =H219+100*O219 -> 156.20000000000002 | AK219: 159.4 | AL219: 223 | AM219: 64.2 | AN219: 213 | AO219: 6.3e-002 | AP219: 18 | AQ219: 思特转债!!
A220: 219 | B220: 113585 | C220: 寿仙转债! | D220: 603896 | E220: 寿仙谷 | F220: 医药 | G220: 中药 | H220: 199.32 | I220: -1.6e-002 | J220: 2.2099999999999998e-002 | K220: 55.62 | L220: 6.3e-003 | M220: 117.3 | N220: 28.38 | O220: 1.7000000000000001e-002 | P220: 195.98 | Q220: 已到 | R220: 4.26年 | S220: 2.26年 | T220: 1.01 | U220: 126 | V220: 0.61699999999999999 | W220: 1.2e-002 | X220: 2.3e-002 | Y220: 85 | Z220: 5.71 | AA220: -0.11900000000000001 | AB220: -0.125 | AC220: -0.16699999999999998 | AD220: -0.16800000000000001 | AE220: 90.11 | AF220: 92.05 | AG220: 0.96 | AH220: AA- | AI220: 5.9999999999999998e-002 | AJ220: =H220+100*O220 -> 201.01999999999998 | AK220: 202.7 | AL220: 346 | AM220: 110.6 | AN220: 348 | AO220: 3.7000000000000005e-002 | AP220: 17 | AQ220: 寿仙转债!
A221: 220 | B221: 123052 | C221: 飞鹿转债! | D221: 300665 | E221: 飞鹿股份 | F221: 化工 | G221: 化工 | H221: 155.655 | I221: -5.0900000000000001e-002 | J221: 1.8200000000000001e-002 | K221: 10.62 | L221: -3.9800000000000002e-002 | M221: 126.8 | N221: 7.05 | O221: 3.3000000000000002e-002 | P221: 150.64 | Q221: 已到 | R221: 4.25年 | S221: 2.25年 | T221: 1.5 | U221: 317 | V221: 1.3300000000000001 | W221: 8.199999999999999e-002 | X221: 0.12300000000000001 | Y221: 18 | Z221: 3.61 | AA221: -4.82e-002 | AB221: -5.79e-002 | AC221: -0.113 | AD221: -0.115 | AE221: 88.93 | AF221: 95.52 | AG221: 0.82 | AH221: A+ | AI221: 7.0999999999999994e-002 | AJ221: =H221+100*O221 -> 158.95500000000001 | AK221: 160.7 | AL221: 237 | AM221: 65.2 | AN221: 220 | AO221: 7.400000000000001e-002 | AP221: 23 | AQ221: 飞鹿转债!
A222: 221 | B222: 113584 | C222: 家悦转债! | D222: 603708 | E222: 家家悦 | F222: 商业零售 | G222: 超市 | H222: 106.95 | I222: -8.3000000000000001e-003 | J222: 8.3000000000000001e-003 | K222: 13.13 | L222: 3.8e-003 | M222: 114.9 | N222: 37.53 | O222: 2.0600000000000001 | P222: 34.99 | Q222: 已到 | R222: 4.25年 | S222: 2.25年 | T222: 6.45 | U222: 4.4 | V222: 6.0000000000000001e-003 | W222: 8.1000000000000003e-002 | X222: 2.7999999999999997e-002 | Y222: 80 | Z222: 3.11 | AA222: 1.7399999999999999e-002 | AB222: 1.09e-002 | AC222: -1.3999999999999999e-002 | AD222: -1.67e-002 | AE222: 94.35 | AF222: 98 | AG222: 0 | AH222: AA | AI222: 3.9e-002 | AJ222: =H222+100*O222 -> 312.94999999999999 | AK222: 178.9 | AL222: 320 | AM222: 80.9 | AN222: 309 | AO222: -3.7000000000000005e-002 | AP222: 23 | AQ222: 家悦转债!
A223: 222 | B223: 128109 | C223: 楚江转债! | D223: 2171 | E223: 楚江新材 | F223: 有色金属 | G223: 铜金属 | H223: 141.601 | I223: -2.1299999999999999e-002 | J223: 1.3000000000000001e-002 | K223: 10.67 | L223: -1.11e-002 | M223: 114.9 | N223: 8.63 | O223: 0.14499999999999999 | P223: 123.64 | Q223: 已到 | R223: 4.25年 | S223: 2.25年 | T223: 18.2 | U223: 66 | V223: 2.5000000000000001e-002 | W223: 0.128 | X223: 0.158 | Y223: 142 | Z223: 2.43 | AA223: -4.8899999999999999e-002 | AB223: -5.4699999999999999e-002 | AC223: -0.122 | AD223: -0.124 | AE223: 94.36 | AF223: 98.01 | AG223: 0.74 | AH223: AA | AI223: 3.9e-002 | AJ223: =H223+100*O223 -> 156.101 | AK223: 159.6 | AL223: 226 | AM223: 61.6 | AN223: 194 | AO223: -2.4e-002 | AP223: 5 | AQ223: 楚江转债!
A224: 223 | B224: 127017 | C224: 万青转债 | D224: 789 | E224: 万年青 | F224: 建筑 | G224: 水泥 | H224: 125.5 | I224: -1.0500000000000001e-002 | J224: 5.8999999999999999e-003 | K224: 13.32 | L224: -9.7000000000000003e-003 | M224: 118 | N224: 13.46 | O224: 0.26800000000000002 | P224: 98.96 | Q224: 已到 | R224: 4.25年 | S224: 2.25年 | T224: 10 | U224: 26 | V224: 2.1000000000000001e-002 | W224: 9.4e-002 | X224: 9.3000000000000013e-002 | Y224: 106 | Z224: 1.55 | AA224: -1.47e-002 | AB224: -2.1899999999999999e-002 | AC224: -7.8e-002 | AD224: -8.0299999999999996e-002 | AE224: 95.4 | AF224: 102.69 | AG224: 0.47 | AH224: AA+ | AI224: 3.4000000000000002e-002 | AJ224: =H224+100*O224 -> 152.30000000000001 | AK224: 152 | AL224: 160 | AM224: 49.4 | AN224: 90 | AO224: 6.9999999999999993e-003 | AP224: 7 | AQ224: 万青转债
A225: 224 | B225: 128108 | C225: 蓝帆转债!! | D225: 2382 | E225: 蓝帆医疗 | F225: 医药 | G225: 医疗器械 | H225: 112.79 | I225: -2.8000000000000004e-003 | J225: 6.4000000000000003e-003 | K225: 13.95 | L225: 1.3100000000000001e-002 | M225: 112.9 | N225: 18.24 | O225: 0.47499999999999998 | P225: 76.48 | Q225: 已到 | R225: 4.23年 | S225: 3.23年 | T225: 15.2 | U225: 18 | V225: 1.e-002 | W225: 0.10800000000000001 | X225: 8.3000000000000004e-002 | Y225: 140 | Z225: 1.1 | AA225: 2.0000000000000001e-004 | AB225: -5.3e-003 | AC225: -2.0499999999999997e-002 | AD225: -2.3399999999999997e-002 | AE225: 92.62 | AF225: 96.38 | AG225: 0.28 | AH225: AA | AI225: 3.9e-002 | AJ225: =H225+100*O225 -> 160.29000000000002 | AK225: 149.1 | AL225: 126 | AM225: 52.7 | AN225: 118 | AO225: 6.0000000000000001e-003 | AP225: 29 | AQ225: 蓝帆转债!!
A226: 225 | B226: 113582 | C226: 火炬转债! | D226: 603678 | E226: 火炬电子 | F226: 电子 | G226: 元器件制 | H226: 253.94 | I226: -4.4800000000000006e-002 | J226: 3.6699999999999997e-002 | K226: 56.1 | L226: -8.3000000000000001e-003 | M226: 114.9 | N226: 24.99 | O226: 0.13100000000000001 | P226: 224.49 | Q226: 已到 | R226: 4.23年 | S226: 2.23年 | T226: 4.18 | U226: 75 | V226: 6.9000000000000006e-002 | W226: 1.6e-002 | X226: 3.6000000000000004e-002 | Y226: 258 | Z226: 5.82 | AA226: -0.17399999999999999 | AB226: -0.17800000000000002 | AC226: -0.21100000000000002 | AD226: -0.21199999999999999 | AE226: 94.44 | AF226: 98.09 | AG226: 0.97 | AH226: AA | AI226: 3.9e-002 | AJ226: =H226+100*O226 -> 267.04000000000002 | AK226: 283.4 | AL226: 367 | AM226: 185.3 | AN226: 367 | AO226: -7.6999999999999999e-002 | AP226: 5 | AQ226: 火炬转债!
A227: 226 | B227: 113579 | C227: 健友转债! | D227: 603707 | E227: 健友股份 | F227: 医药 | G227: 原料药 | H227: 131.38 | I227: 3.9000000000000003e-003 | J227: 2.6499999999999999e-002 | K227: 35.31 | L227: 4.7199999999999999e-002 | M227: 113.9 | N227: 32.2 | O227: 0.19800000000000001 | P227: 109.66 | Q227: 已到 | R227: 4年49天 | S227: 2年49天 | T227: 5.03 | U227: 113 | V227: 0.16800000000000001 | W227: 1.1000000000000001e-002 | X227: 1.3000000000000001e-002 | Y227: 439 | Z227: 10.01 | AA227: -3.4599999999999999e-002 | AB227: -4.0399999999999998e-002 | AC227: -9.9700000000000011e-002 | AD227: -0.10199999999999999 | AE227: 94.78 | AF227: 97.59 | AG227: 0.64 | AH227: AA | AI227: 3.9e-002 | AJ227: =H227+100*O227 -> 151.18000000000001 | AK227: 153.1 | AL227: 172 | AM227: 55.5 | AN227: 142 | AO227: 1.4999999999999999e-002 | AP227: 9 | AQ227: 健友转债!
A228: 227 | B228: 128107 | C228: 交科转债 | D228: 2061 | E228: 浙江交科 | F228: 建筑 | G228: 建筑工程 | H228: 128 | I228: -2.6499999999999999e-002 | J228: -4.4000000000000003e-003 | K228: 6.21 | L228: -4.4600000000000001e-002 | M228: 114.9 | N228: 5.24 | O228: 8.0000000000000002e-002 | P228: 118.51 | Q228: 已到 | R228: 4年48天 | S228: 2年48天 | T228: 18.8 | U228: 106 | V228: 4.4000000000000004e-002 | W228: 0.20199999999999999 | X228: 0.23999999999999999 | Y228: 93 | Z228: 0.95 | AA228: -2.63e-002 | AB228: -3.2500000000000001e-002 | AC228: -8.9499999999999996e-002 | AD228: -9.1899999999999996e-002 | AE228: 95.83 | AF228: 100.39 | AG228: 0.69 | AH228: AA+ | AI228: 3.4000000000000002e-002 | AJ228: =H228+100*O228 -> 136. | AK228: 137.5 | AL228: 29 | AM228: 37.1 | AN228: 23 | AO228: -6.3e-002 | AP228: 22 | AQ228: 交科转债
A229: 228 | B229: 113578 | C229: 全筑转债! | D229: 603030 | E229: 全筑股份 | F229: 建筑 | G229: 装饰工程 | H229: 108.87 | I229: -1.1399999999999999e-002 | J229: 5.1999999999999998e-003 | K229: 3.62 | L229: -2.4300000000000002e-002 | M229: 117.9 | N229: 5.25 | O229: 0.57899999999999996 | P229: 68.95 | Q229: 已到 | R229: 4年46天 | S229: 2年46天 | T229: 3.84 | U229: 24 | V229: 5.7999999999999996e-002 | W229: 0.183 | X229: 0.126 | Y229: 21 | Z229: 0.96 | AA229: 1.9900000000000001e-002 | AB229: 1.21e-002 | AC229: -2.2400000000000003e-002 | AD229: -2.52e-002 | AE229: 90.6 | AF229: 93.21 | AG229: 0.25 | AH229: AA- | AI229: 5.9999999999999998e-002 | AJ229: =H229+100*O229 -> 166.77000000000001 | AK229: 148.8 | AL229: 125 | AM229: 55.6 | AN229: 143 | AO229: -4.4999999999999998e-002 | AP229: 40 | AQ229: 全筑转债!
A230: 229 | B230: 113573 | C230: 纵横转债! | D230: 603602 | E230: 纵横通信 | F230: 通信互联 | G230: 通信设备 | H230: 116.37 | I230: -4.0000000000000002e-004 | J230: 2.5000000000000001e-003 | K230: 13.2 | L230: 7.6e-003 | M230: 124.2 | N230: 18.78 | O230: 0.65599999999999992 | P230: 70.29 | Q230: 已到 | R230: 4年43天 | S230: 2年43天 | T230: 2.7 | U230: 14 | V230: 4.4000000000000004e-002 | W230: 0.10000000000000001 | X230: 7.0000000000000007e-002 | Y230: 27 | Z230: 3.78 | AA230: 1.6299999999999999e-002 | AB230: 6.3e-003 | AC230: -4.8099999999999997e-002 | AD230: -5.1299999999999998e-002 | AE230: 89.2 | AF230: 94.34 | AG230: 0.27 | AH230: A+ | AI230: 7.0999999999999994e-002 | AJ230: =H230+100*O230 -> 181.97 | AK230: 162.5 | AL230: 256 | AM230: 68.1 | AN230: 246 | AO230: 4.8000000000000001e-002 | AP230: 32 | AQ230: 纵横转债!
A231: 230 | B231: 113577 | C231: 春秋转债! | D231: 603890 | E231: 春秋电子 | F231: 电子 | G231: 电子产品 | H231: 134.88 | I231: -1.8600000000000002e-002 | J231: 6.3e-003 | K231: 11.36 | L231: -1.9799999999999998e-002 | M231: 117.7 | N231: 10.85 | O231: 0.28800000000000003 | P231: 104.7 | Q231: 已到 | R231: 4年40天 | S231: 2年40天 | T231: 1.78 | U231: 5.6 | V231: 2.3e-002 | W231: 3.6000000000000004e-002 | X231: 3.7000000000000005e-002 | Y231: 50 | Z231: 2.01 | AA231: -3.3300000000000003e-002 | AB231: -4.0500000000000001e-002 | AC231: -0.11 | AD231: -0.11199999999999999 | AE231: 90.89 | AF231: 93.19 | AG231: 0.62 | AH231: AA- | AI231: 5.9999999999999998e-002 | AJ231: =H231+100*O231 -> 163.68000000000001 | AK231: 165.1 | AL231: 280 | AM231: 71.9 | AN231: 276 | AO231: -2.7999999999999997e-002 | AP231: 14 | AQ231: 春秋转债!
A232: 231 | B232: 123050 | C232: 聚飞转债! | D232: 300303 | E232: 聚飞光电 | F232: 电子 | G232: LED制 | H232: 131.9 | I232: -1.52e-002 | J232: 6.6e-003 | K232: 5.43 | L232: -1.4499999999999999e-002 | M232: 123.8 | N232: 5.08 | O232: 0.23399999999999999 | P232: 106.89 | Q232: 已到 | R232: 4年40天 | S232: 2年40天 | T232: 3.75 | U232: 7.1 | V232: 1.3999999999999999e-002 | W232: 5.0999999999999997e-002 | X232: 5.5e-002 | Y232: 73 | Z232: 2.62 | AA232: -1.5700000000000002e-002 | AB232: -2.5099999999999997e-002 | AC232: -0.10099999999999999 | AD232: -0.10300000000000001 | AE232: 90.99 | AF232: 98.02 | AG232: 0.59 | AH232: AA- | AI232: 5.9999999999999998e-002 | AJ232: =H232+100*O232 -> 155.30000000000001 | AK232: 156.9 | AL232: 202 | AM232: 58.9 | AN232: 169 | AO232: -2.4e-002 | AP232: 12 | AQ232: 聚飞转债!
A233: 232 | B233: 123049 | C233: 维尔转债! | D233: 300190 | E233: 维尔利 | F233: 城市公用 | G233: 三废处理 | H233: 115.996 | I233: -5.1999999999999998e-003 | J233: -1.4000000000000002e-003 | K233: 5.8 | L233: -2.0299999999999999e-002 | M233: 124.3 | N233: 7.38 | O233: 0.47600000000000003 | P233: 78.59 | Q233: 已到 | R233: 4年39天 | S233: 2年39天 | T233: 9.17 | U233: 3.1 | V233: 3.0000000000000001e-003 | W233: 0.20199999999999999 | X233: 0.159 | Y233: 45 | Z233: 1.04 | AA233: 1.7399999999999999e-002 | AB233: 7.3000000000000001e-003 | AC233: -4.6600000000000003e-002 | AD233: -4.99e-002 | AE233: 91.46 | AF233: 98.48 | AG233: 0.32 | AH233: AA- | AI233: 5.9999999999999998e-002 | AJ233: =H233+100*O233 -> 163.596 | AK233: 153.4 | AL233: 175 | AM233: 54.9 | AN233: 139 | AO233: -6.0000000000000001e-003 | AP233: 22 | AQ233: 维尔转债!
A234: 233 | B234: 110070 | C234: 凌钢转债! | D234: 600231 | E234: 凌钢股份 | F234: 钢铁 | G234: 炼钢 | H234: 124.79 | I234: -2.23e-002 | J234: 8.8000000000000005e-003 | K234: 2.81 | L234: -2.4300000000000002e-002 | M234: 117.4 | N234: 2.69 | O234: 0.19500000000000001 | P234: 104.46 | Q234: 已到 | R234: 4年39天 | S234: 2年39天 | T234: 2.17 | U234: 22 | V234: 8.199999999999999e-002 | W234: 2.7000000000000003e-002 | X234: 2.7999999999999997e-002 | Y234: 80 | Z234: 0.87 | AA234: -1.5100000000000001e-002 | AB234: -2.2400000000000003e-002 | AC234: -7.8899999999999998e-002 | AD234: -8.1600000000000006e-002 | AE234: 95.2 | AF234: 100.72 | AG234: 0.55 | AH234: AA | AI234: 3.9e-002 | AJ234: =H234+100*O234 -> 144.29000000000002 | AK234: 145.1 | AL234: 79 | AM234: 44.4 | AN234: 56 | AO234: 1.9e-002 | AP234: 22 | AQ234: 凌钢转债!
A235: 234 | B235: 128106 | C235: 华统转债! | D235: 2840 | E235: 华统股份 | F235: 农业 | G235: 农产品加 | H235: 188 | I235: 1.89e-002 | J235: 2.5499999999999998e-002 | K235: 17.35 | L235: 4.6399999999999997e-002 | M235: 112.9 | N235: 9.37 | O235: 1.4999999999999999e-002 | P235: 185.17 | Q235: 已到 | R235: 4年36天 | S235: 2年36天 | T235: 3.89 | U235: 675 | V235: 0.91700000000000004 | W235: 4.9000000000000002e-002 | X235: 9.0999999999999998e-002 | Y235: 79 | Z235: 4.71 | AA235: -0.11900000000000001 | AB235: -0.124 | AC235: -0.17100000000000001 | AD235: -0.17199999999999999 | AE235: 94.91 | AF235: 96.86 | AG235: 0.96 | AH235: AA | AI235: 3.9e-002 | AJ235: =H235+100*O235 -> 189.5 | AK235: 190.8 | AL235: 336 | AM235: 94 | AN235: 332 | AO235: 0.13500000000000001 | AP235: 13 | AQ235: 华统转债!
A236: 235 | B236: 123048 | C236: 应急转债! | D236: 300527 | E236: 中船应急 | F236: 机械装备 | G236: 专用设备 | H236: 128.097 | I236: -2.1299999999999999e-002 | J236: 1.0700000000000001e-002 | K236: 9.42 | L236: -1.77e-002 | M236: 112.8 | N236: 8.88 | O236: 0.20800000000000002 | P236: 106.08 | Q236: 已到 | R236: 4年36天 | S236: 2年36天 | T236: 3.79 | U236: 284 | V236: 0.57499999999999996 | W236: 4.2000000000000003e-002 | X236: 4.4000000000000004e-002 | Y236: 91 | Z236: 3.45 | AA236: -3.1200000000000002e-002 | AB236: -3.6600000000000001e-002 | AC236: -9.1300000000000006e-002 | AD236: -9.3800000000000008e-002 | AE236: 95.84 | AF236: 98.65 | AG236: 0.6 | AH236: AA+ | AI236: 3.4000000000000002e-002 | AJ236: =H236+100*O236 -> 148.89700000000002 | AK236: 150.1 | AL236: 136 | AM236: 51.5 | AN236: 112 | AO236: 2.6000000000000002e-002 | AP236: 16 | AQ236: 应急转债!
A237: 236 | B237: 113576 | C237: 起步转债!! | D237: 603557 | E237: ST起步 | F237: 服装纺织 | G237: 鞋服行业 | H237: 114.63 | I237: -2.0899999999999998e-002 | J237: 2.e-002 | K237: 5.08 | L237: -1.3600000000000001e-002 | M237: 121.3 | N237: 10.55 | O237: 1.3799999999999999 | P237: 48.15 | Q237: 已到 | R237: 4年36天 | S237: 2年36天 | T237: 2.66 | U237: 51 | V237: 0.16500000000000001 | W237: 0.106 | X237: 5.0999999999999997e-002 | Y237: 25 | Z237: 1.67 | AA237: 1.43e-002 | AB237: 5.1999999999999998e-003 | AC237: -4.1700000000000001e-002 | AD237: -4.4999999999999998e-002 | AE237: 84.08 | AF237: 82.72 | AG237: 0.07 | AH237: BBB+ | AI237: 0.10099999999999999 | AJ237: =H237+100*O237 -> 252.63 | AK237: 181.1 | AL237: 327 | AM237: 97 | AN237: 335 | AO237: 3.5000000000000003e-002 | AP237: 34 | AQ237: 起步转债!!
A238: 237 | B238: 128105 | C238: 长集转债! | D238: 2616 | E238: 长青集团 | F238: 城市公用 | G238: 三废处理 | H238: 111.176 | I238: -1.e-002 | J238: 1.e-002 | K238: 5.55 | L238: 0. | M238: 114.9 | N238: 7.91 | O238: 0.58499999999999996 | P238: 70.16 | Q238: 已到 | R238: 4年35天 | S238: 2年35天 | T238: 8 | U238: 14 | V238: 1.6e-002 | W238: 0.19399999999999998 | X238: 0.13600000000000001 | Y238: 41 | Z238: 1.65 | AA238: 8.3000000000000001e-003 | AB238: 1.7000000000000001e-003 | AC238: -3.1800000000000002e-002 | AD238: -3.4599999999999999e-002 | AE238: 94.92 | AF238: 98.58 | AG238: 0.19 | AH238: AA | AI238: 3.9e-002 | AJ238: =H238+100*O238 -> 169.67599999999999 | AK238: 152.2 | AL238: 163 | AM238: 53.6 | AN238: 126 | AO238: 2.1000000000000001e-002 | AP238: 23 | AQ238: 长集转债!
A239: 238 | B239: 113575 | C239: 东时转债!! | D239: 603377 | E239: 东方时尚 | F239: 其他 | G239: 其他 | H239: 128.45 | I239: -1.6000000000000001e-003 | J239: 1.6000000000000001e-003 | K239: 7.6 | L239: 0. | M239: 113.1 | N239: 12.15 | O239: 1.05 | P239: 62.55 | Q239: 已到 | R239: 4年35天 | S239: 2年35天 | T239: 0.98 | U239: 22 | V239: 0.17699999999999999 | W239: 1.8000000000000002e-002 | X239: 1.1000000000000001e-002 | Y239: 55 | Z239: 2.55 | AA239: -3.1300000000000001e-002 | AB239: -3.6799999999999999e-002 | AC239: -9.2100000000000015e-002 | AD239: -9.4600000000000004e-002 | AE239: 94.95 | AF239: 97.05 | AG239: 0.11 | AH239: AA | AI239: 3.9e-002 | AJ239: =H239+100*O239 -> 233.44999999999999 | AK239: 194.3 | AL239: 338 | AM239: 97.3 | AN239: 337 | AO239: -2.2000000000000002e-002 | AP239: 14 | AQ239: 东时转债!!
A240: 239 | B240: 127016 | C240: 鲁泰转债! | D240: 726 | E240: 鲁 泰Ａ | F240: 服装纺织 | G240: 纺织行业 | H240: 115.01 | I240: -8.5000000000000006e-003 | J240: 6.5000000000000006e-003 | K240: 6.84 | L240: -8.6999999999999994e-003 | M240: 115.9 | N240: 8.71 | O240: 0.46500000000000002 | P240: 78.53 | Q240: 已到 | R240: 4年35天 | S240: 2年35天 | T240: 14 | U240: 4.9 | V240: 3.0000000000000001e-003 | W240: 0.23199999999999998 | X240: 0.182 | Y240: 60 | Z240: 0.76 | AA240: 1.9e-003 | AB240: -5.0000000000000001e-003 | AC240: -4.6399999999999997e-002 | AD240: -4.9100000000000005e-002 | AE240: 95.95 | AF240: 101.38 | AG240: 0.24 | AH240: AA+ | AI240: 3.4000000000000002e-002 | AJ240: =H240+100*O240 -> 161.50999999999999 | AK240: 151.5 | AL240: 153 | AM240: 50.1 | AN240: 94 | AO240: -1.3000000000000001e-002 | AP240: 23 | AQ240: 鲁泰转债!
A241: 240 | B241: 113033 | C241: 利群转债! | D241: 601366 | E241: 利群股份 | F241: 商业零售 | G241: 商场 | H241: 115.93 | I241: 1.6000000000000001e-003 | J241: 5.9999999999999995e-004 | K241: 6.85 | L241: 4.4000000000000003e-003 | M241: 114.9 | N241: 7.01 | O241: 0.18600000000000003 | P241: 97.72 | Q241: 已到 | R241: 4年27天 | S241: 2年27天 | T241: 18 | U241: 38 | V241: 1.8000000000000002e-002 | W241: 0.30499999999999999 | X241: 0.29799999999999999 | Y241: 59 | Z241: 1.35 | AA241: -2.2000000000000001e-003 | AB241: -8.8000000000000005e-003 | AC241: -5.0199999999999995e-002 | AD241: -5.2900000000000003e-002 | AE241: 95 | AF241: 98.67 | AG241: 0.5 | AH241: AA | AI241: 3.9e-002 | AJ241: =H241+100*O241 -> 134.53 | AK241: 134.1 | AL241: 10 | AM241: 35.5 | AN241: 18 | AO241: 1.4999999999999999e-002 | AP241: 72 | AQ241: 利群转债!
A242: 241 | B242: 113574 | C242: 华体转债! | D242: 603679 | E242: 华体科技 | F242: 城市公用 | G242: 城市公用 | H242: 114.45 | I242: -1.46e-002 | J242: 1.4199999999999999e-002 | K242: 14.2 | L242: -2.81e-002 | M242: 115.9 | N242: 33.91 | O242: 1.73 | P242: 41.88 | Q242: 已到 | R242: 4年26天 | S242: 2年26天 | T242: 2.09 | U242: 13 | V242: 5.5999999999999994e-002 | W242: 0.10400000000000001 | X242: 4.2999999999999997e-002 | Y242: 20 | Z242: 2.69 | AA242: 3.2000000000000002e-003 | AB242: -3.8e-003 | AC242: -4.2099999999999999e-002 | AD242: -4.5400000000000003e-002 | AE242: 89.44 | AF242: 88.35 | AG242: 0.01 | AH242: A+ | AI242: 7.0999999999999994e-002 | AJ242: =H242+100*O242 -> 287.44999999999999 | AK242: 187 | AL242: 331 | AM242: 97.6 | AN242: 338 | AO242: -1.6e-002 | AP242: 22 | AQ242: 华体转债!
A243: 242 | B243: 110068 | C243: 龙净转债! | D243: 600388 | E243: 龙净环保 | F243: 城市公用 | G243: 三废处理 | H243: 117.4 | I243: -2.7999999999999997e-002 | J243: 1.04e-002 | K243: 9.85 | L243: -4.0899999999999999e-002 | M243: 114.8 | N243: 10.55 | O243: 0.25700000000000001 | P243: 93.36 | Q243: 已到 | R243: 4年19天 | S243: 2年19天 | T243: 20 | U243: 109 | V243: 4.5999999999999999e-002 | W243: 0.19 | X243: 0.17699999999999999 | Y243: 105 | Z243: 1.63 | AA243: -5.6000000000000008e-003 | AB243: -1.21e-002 | AC243: -5.6500000000000002e-002 | AD243: -5.9200000000000003e-002 | AE243: 95.99 | AF243: 100.55 | AG243: 0.43 | AH243: AA+ | AI243: 3.4000000000000002e-002 | AJ243: =H243+100*O243 -> 143.09999999999999 | AK243: 141.4 | AL243: 52 | AM243: 40.9 | AN243: 40 | AO243: 0.106 | AP243: 43 | AQ243: 龙净转债!
A244: 243 | B244: 123046 | C244: 天铁转债! | D244: 300587 | E244: 天铁股份 | F244: 铁路 | G244: 铁路设备 | H244: 318.9 | I244: -2.2200000000000001e-002 | J244: 1.3300000000000001e-002 | K244: 19.68 | L244: -9.1000000000000004e-003 | M244: 117.7 | N244: 6.73 | O244: 9.0999999999999998e-002 | P244: 292.42 | Q244: 已到 | R244: 4年14天 | S244: 2年14天 | T244: 0.59 | U244: 34 | V244: 0.17800000000000002 | W244: 5.0000000000000001e-003 | X244: 1.3999999999999999e-002 | Y244: 124 | Z244: 6.69 | AA244: -0.222 | AB244: -0.22800000000000001 | AC244: -0.26800000000000002 | AD244: -0.26899999999999996 | AE244: 91.27 | AF244: 93.58 | AG244: 0.98 | AH244: AA- | AI244: 5.9999999999999998e-002 | AJ244: =H244+100*O244 -> 328. | AK244: 345.4 | AL244: 371 | AM244: 251.8 | AN244: 372 | AO244: 1.6e-002 | AP244: 13 | AQ244: 天铁转债!
A245: 244 | B245: 128101 | C245: 联创转债!! | D245: 2036 | E245: 联创电子 | F245: 电子 | G245: 液晶显示 | H245: 143.3 | I245: -4.4400000000000002e-002 | J245: 3.0800000000000001e-002 | K245: 16.78 | L245: -1.8700000000000001e-002 | M245: 114.8 | N245: 13.72 | O245: 0.17199999999999999 | P245: 122.3 | Q245: 已到 | R245: 4年11天 | S245: 2年11天 | T245: 3 | U245: 85 | V245: 0.19500000000000001 | W245: 1.7000000000000001e-002 | X245: 2.1000000000000001e-002 | Y245: 178 | Z245: 4.57 | AA245: -5.4600000000000003e-002 | AB245: -6.0599999999999994e-002 | AC245: -0.109 | AD245: -0.11 | AE245: 95.06 | AF245: 98.73 | AG245: 0.73 | AH245: AA | AI245: 3.9e-002 | AJ245: =H245+100*O245 -> 160.5 | AK245: 164.3 | AL245: 275 | AM245: 65.6 | AN245: 225 | AO245: -7.5999999999999998e-002 | AP245: 13 | AQ245: 联创转债!!
A246: 245 | B246: 123045 | C246: 雷迪转债 | D246: 300652 | E246: 雷迪克 | F246: 汽车 | G246: 零部件制 | H246: 129.889 | I246: -8.3000000000000001e-003 | J246: 4.8999999999999998e-003 | K246: 21.03 | L246: -5.1999999999999998e-003 | M246: 118.9 | N246: 19.63 | O246: 0.21199999999999999 | P246: 107.13 | Q246: 已到 | R246: 4年7天 | S246: 2年7天 | T246: 1.66 | U246: 18 | V246: 8.3000000000000004e-002 | W246: 8.4000000000000005e-002 | X246: 8.9999999999999997e-002 | Y246: 20 | Z246: 2.08 | AA246: -2.23e-002 | AB246: -3.0200000000000001e-002 | AC246: -9.7500000000000003e-002 | AD246: -0.10000000000000001 | AE246: 89.76 | AF246: 90.94 | AG246: 0.66 | AH246: A+ | AI246: 7.0999999999999994e-002 | AJ246: =H246+100*O246 -> 151.089 | AK246: 152.6 | AL246: 167 | AM246: 61.7 | AN246: 195 | AO246: 1.3999999999999999e-002 | AP246: 33 | AQ246: 雷迪转债
A247: 246 | B247: 128100 | C247: 搜特转债! | D247: 2503 | E247: 搜于特 | F247: 服装纺织 | G247: 服装行业 | H247: 110.53 | I247: -7.8899999999999998e-002 | J247: 4.1900000000000007e-002 | K247: 1.68 | L247: -4.5499999999999999e-002 | M247: 116.9 | N247: 1.62 | O247: 6.6000000000000003e-002 | P247: 103.7 | Q247: 已到 | R247: 4年7天 | S247: 2年7天 | T247: 7.98 | U247: 2293. | V247: 2.52 | W247: 0.154 | X247: 0.159 | Y247: 52 | Z247: 3.44 | AA247: 1.44e-002 | AB247: 6.8000000000000005e-003 | AC247: -3.0299999999999997e-002 | AD247: -3.32e-002 | AE247: 77.77 | AF247: 69.74 | AG247: 0.81 | AH247: BB | AI247: 0.14099999999999999 | AJ247: =H247+100*O247 -> 117.13 | AK247: 117.4 | AL247: 1 | AM247: 39.6 | AN247: 36 | AO247: 0.13900000000000001 | AP247: 95 | AQ247: 搜特转债!
A248: 247 | B248: 123044 | C248: 红相转债!! | D248: 300427 | E248: 红相股份 | F248: 能源电力 | G248: 电力设备 | H248: 117.71 | I248: -8.3000000000000001e-003 | J248: 1.2999999999999999e-003 | K248: 14 | L248: -2.5699999999999997e-002 | M248: 125 | N248: 18.67 | O248: 0.56999999999999995 | P248: 74.99 | Q248: 已到 | R248: 4年7天 | S248: 2年7天 | T248: 5.5 | U248: 6.9 | V248: 1.1000000000000001e-002 | W248: 0.109 | X248: 8.199999999999999e-002 | Y248: 50 | Z248: 2.14 | AA248: 1.55e-002 | AB248: 4.8999999999999998e-003 | AC248: -5.3699999999999998e-002 | AD248: -5.7300000000000004e-002 | AE248: 92.19 | AF248: 99.6 | AG248: 0.27 | AH248: AA- | AI248: 5.9999999999999998e-002 | AJ248: =H248+100*O248 -> 174.70999999999998 | AK248: 160.4 | AL248: 233 | AM248: 60.8 | AN248: 185 | AO248: 2.8999999999999998e-002 | AP248: 24 | AQ248: 红相转债!!
A249: 248 | B249: 110067 | C249: 华安转债! | D249: 600909 | E249: 华安证券 | F249: 金融 | G249: 证券行业 | H249: 110.92 | I249: -6.1999999999999998e-003 | J249: 5.6000000000000008e-003 | K249: 4.92 | L249: -2.e-003 | M249: 110.3 | N249: 6.22 | O249: 0.40200000000000002 | P249: 79.1 | Q249: 已到 | R249: 4年7天 | S249: 无权 | T249: 28 | U249: 21 | V249: 6.9999999999999993e-003 | W249: 0.121 | X249: 9.6000000000000002e-002 | Y249: 231 | Z249: 1.24 | AA249: -1.4000000000000002e-003 | AB249: -6.0999999999999995e-003 | AC249: 无权 | AD249: 无权 | AE249: 无权 | AF249: 97.37 | AG249: 0.29 | AH249: AAA | AI249: 3.2000000000000001e-002 | AJ249: =H249+100*O249 -> 151.12 | AK249: 142.7 | AL249: 63 | AM249: 45.4 | AN249: 63 | AO249: -2.7000000000000003e-002 | AP249: 26 | AQ249: 华安转债!
A250: 249 | B250: 113570 | C250: 百达转债! | D250: 603331 | E250: 百达精工 | F250: 机械装备 | G250: 机械装备 | H250: 125.31 | I250: -1.5100000000000001e-002 | J250: 9.4999999999999998e-003 | K250: 12.22 | L250: -8.1000000000000013e-003 | M250: 114.9 | N250: 11.34 | O250: 0.16300000000000001 | P250: 107.76 | Q250: 已到 | R250: 4年6.1天 | S250: 2年6.1天 | T250: 2.8 | U250: 7.3 | V250: 2.1000000000000001e-002 | W250: 0.129 | X250: 0.13900000000000001 | Y250: 22 | Z250: 2.68 | AA250: -2.18e-002 | AB250: -2.8199999999999999e-002 | AC250: -8.5099999999999995e-002 | AD250: -8.77e-002 | AE250: 89.18 | AF250: 87.81 | AG250: 0.69 | AH250: A+ | AI250: 7.0999999999999994e-002 | AJ250: =H250+100*O250 -> 141.61000000000001 | AK250: 142.9 | AL250: 64 | AM250: 53.7 | AN250: 128 | AO250: -1.7000000000000001e-002 | AP250: 30 | AQ250: 百达转债!
A251: 250 | B251: 113569 | C251: 科达转债! | D251: 603660 | E251: 苏州科达 | F251: 通信互联 | G251: 物联网 | H251: 108.61 | I251: -3.4999999999999996e-003 | J251: 3.3e-003 | K251: 6.69 | L251: -5.8999999999999999e-003 | M251: 120.3 | N251: 14.8 | O251: 1.3999999999999999 | P251: 45.2 | Q251: 已到 | R251: 4年4.1天 | S251: 2年4.1天 | T251: 5.16 | U251: 6.5 | V251: 1.2e-002 | W251: 0.156 | X251: 7.0999999999999994e-002 | Y251: 33 | Z251: 1.95 | AA251: 2.6499999999999999e-002 | AB251: 1.7399999999999999e-002 | AC251: -2.1499999999999998e-002 | AD251: -2.4700000000000003e-002 | AE251: 91.44 | AF251: 95.79 | AG251: 0.03 | AH251: AA- | AI251: 5.9999999999999998e-002 | AJ251: =H251+100*O251 -> 248.61000000000001 | AK251: 172 | AL251: 314 | AM251: 76.2 | AN251: 295 | AO251: 3.0000000000000001e-003 | AP251: 43 | AQ251: 科达转债!
A252: 251 | B252: 113568 | C252: 新春转债!! | D252: 603667 | E252: 五洲新春 | F252: 机械装备 | G252: 通用设备 | H252: 163.62 | I252: 8.3000000000000001e-003 | J252: -1.2e-002 | K252: 14.06 | L252: -4.1999999999999997e-003 | M252: 124.3 | N252: 8.75 | O252: 1.8000000000000002e-002 | P252: 160.69 | Q252: 已到 | R252: 4年1.1天 | S252: 2年1.1天 | T252: 2.44 | U252: 184 | V252: 0.46000000000000002 | W252: 5.7999999999999996e-002 | X252: 9.1999999999999998e-002 | Y252: 42 | Z252: 2.25 | AA252: -6.7900000000000002e-002 | AB252: -7.7100000000000002e-002 | AC252: -0.14499999999999999 | AD252: -0.14699999999999999 | AE252: 92.02 | AF252: 99.08 | AG252: 0.87 | AH252: AA- | AI252: 5.9999999999999998e-002 | AJ252: =H252+100*O252 -> 165.42000000000002 | AK252: 166.6 | AL252: 289 | AM252: 67.5 | AN252: 240 | AO252: -1.1000000000000001e-002 | AP252: 34 | AQ252: 新春转债!!
A253: 252 | B253: 113567 | C253: XD君禾转! | D253: 603617 | E253: 君禾股份 | F253: 机械装备 | G253: 通用设备 | H253: 136.61 | I253: -9.8999999999999991e-003 | J253: 8.199999999999999e-003 | K253: 13.93 | L253: -2.0999999999999999e-003 | M253: 118.8 | N253: 10.58 | O253: 3.7999999999999999e-002 | P253: 131.66 | Q253: 已到 | R253: 3.997年 | S253: 1.997年 | T253: 2.1 | U253: 100 | V253: 0.34299999999999997 | W253: 5.7999999999999996e-002 | X253: 7.6999999999999999e-002 | Y253: 36 | Z253: 3.96 | AA253: -3.6600000000000001e-002 | AB253: -4.41e-002 | AC253: -0.122 | AD253: -0.124 | AE253: 89.03 | AF253: 90.21 | AG253: 0.8 | AH253: A+ | AI253: 7.0999999999999994e-002 | AJ253: =H253+100*O253 -> 140.41000000000003 | AK253: 141.6 | AL253: 53 | AM253: 51.3 | AN253: 109 | AO253: 8.1000000000000003e-002 | AP253: 34 | AQ253: XD君禾转!
A254: 253 | B254: 110066 | C254: 盛屯转债!!* | D254: 600711 | E254: 盛屯矿业 | F254: 有色金属 | G254: 有色行业 | H254: 214.27 | I254: -2.0799999999999999e-002 | J254: 1.1999999999999999e-003 | K254: 10.47 | L254: -1.9699999999999999e-002 | M254: 114.3 | N254: 4.87 | O254: -3.0000000000000001e-003 | P254: 214.99 | Q254: 已到 | R254: 13天 | S254: 无权 | T254: 3.42 | U254: 342 | V254: 0.45799999999999996 | W254: 1.2e-002 | X254: 2.6000000000000002e-002 | Y254: 288 | Z254: 2.33 | AA254: <-100% | AB254: <-100% | AC254: 无权 | AD254: 无权 | AE254: 无权 | AF254: 99.93 | AG254: 1 | AH254: AA | AI254: 3.2099999999999997e-002 | AJ254: =H254+100*O254 -> 213.97 | AK254: 213.6 | AL254: 352 | AM254: 113.6 | AN254: 350 | AO254: 3.6000000000000004e-002 | AP254: 26 | AQ254: 盛屯转债!!*
A255: 254 | B255: 113566 | C255: 翔港转债! | D255: 603499 | E255: 翔港科技 | F255: 造纸包装 | G255: 包装材料 | H255: 118.88 | I255: -4.0999999999999995e-003 | J255: 1.e-004 | K255: 7.99 | L255: -1.24e-002 | M255: 123.2 | N255: 10.77 | O255: 0.60199999999999998 | P255: 74.19 | Q255: 已到 | R255: 3.99年 | S255: 1.99年 | T255: 1.61 | U255: 5.8 | V255: 2.9999999999999999e-002 | W255: 0.10000000000000001 | X255: 7.400000000000001e-002 | Y255: 16 | Z255: 2.83 | AA255: 9.1999999999999998e-003 | AB255: -7.000000000000001e-004 | AC255: -6.3299999999999995e-002 | AD255: -6.6100000000000006e-002 | AE255: 89.28 | AF255: 94.25 | AG255: 0.33 | AH255: A+ | AI255: 7.0999999999999994e-002 | AJ255: =H255+100*O255 -> 179.07999999999998 | AK255: 163.6 | AL255: 269 | AM255: 69.3 | AN255: 260 | AO255: 6.0000000000000001e-003 | AP255: 31 | AQ255: 翔港转债!
A256: 255 | B256: 113565 | C256: 宏辉转债 | D256: 603336 | E256: 宏辉果蔬 | F256: 农业 | G256: 农产品加 | H256: 120.99 | I256: -1.1000000000000001e-002 | J256: 3.0999999999999999e-003 | K256: 7.27 | L256: -1.49e-002 | M256: 117 | N256: 7.64 | O256: 0.27100000000000002 | P256: 95.16 | Q256: 已到 | R256: 3.98年 | S256: 1.98年 | T256: 2.25 | U256: 36 | V256: 0.13200000000000001 | W256: 7.0999999999999994e-002 | X256: 6.7000000000000004e-002 | Y256: 32 | Z256: 3.07 | AA256: -8.5000000000000006e-003 | AB256: -1.5900000000000001e-002 | AC256: -7.2999999999999995e-002 | AD256: -7.5399999999999995e-002 | AE256: 90.89 | AF256: 93.19 | AG256: 0.53 | AH256: AA- | AI256: 5.9999999999999998e-002 | AJ256: =H256+100*O256 -> 148.09 | AK256: 146.8 | AL256: 99 | AM256: 53.6 | AN256: 127 | AO256: 2.e-003 | AP256: 29 | AQ256: 宏辉转债
A257: 256 | B257: 128097 | C257: 奥佳转债!! | D257: 2614 | E257: 奥佳华 | F257: 机械装备 | G257: 专用设备 | H257: 126.49 | I257: -1.4499999999999999e-002 | J257: 6.9999999999999993e-003 | K257: 10.7 | L257: -1.2e-002 | M257: 114.3 | N257: 10.39 | O257: 0.22800000000000001 | P257: 102.98 | Q257: 已到 | R257: 3.98年 | S257: 1.98年 | T257: 4.59 | U257: 3.6 | V257: 6.0000000000000001e-003 | W257: 6.8000000000000005e-002 | X257: 7.0000000000000007e-002 | Y257: 67 | Z257: 1.43 | AA257: -2.5600000000000001e-002 | AB257: -3.1800000000000002e-002 | AC257: -9.2699999999999991e-002 | AD257: -9.4899999999999998e-002 | AE257: 90.8 | AF257: 91.03 | AG257: 0.63 | AH257: AA- | AI257: 5.9999999999999998e-002 | AJ257: =H257+100*O257 -> 149.28999999999999 | AK257: 150 | AL257: 133 | AM257: 59 | AN257: 171 | AO257: -5.5e-002 | AP257: 16 | AQ257: 奥佳转债!!
A258: 257 | B258: 128095 | C258: 恩捷转债!! | D258: 2812 | E258: 恩捷股份 | F258: 电子 | G258: 元器件制 | H258: 398.2 | I258: -5.5300000000000002e-002 | J258: 1.1200000000000002e-002 | K258: 225.67 | L258: -4.4699999999999997e-002 | M258: 114.3 | N258: 64.92 | O258: 0.14599999999999999 | P258: 347.61 | Q258: 已到 | R258: 3.94年 | S258: 1.94年 | T258: 4.54 | U258: 95 | V258: 5.0999999999999997e-002 | W258: 2.e-003 | X258: 8.0000000000000002e-003 | Y258: 2014. | Z258: 15.71 | AA258: -0.27399999999999997 | AB258: -0.27899999999999997 | AC258: -0.312 | AD258: -0.313 | AE258: 94.89 | AF258: 98.57 | AG258: 0.99 | AH258: AA | AI258: 3.9e-002 | AJ258: =H258+100*O258 -> 412.80000000000001 | AK258: 448.8 | AL258: 378 | AM258: 350.2 | AN258: 379 | AO258: -8.0000000000000002e-002 | AP258: 12 | AQ258: 恩捷转债!!
A259: 258 | B259: 113563 | C259: 柳药转债! | D259: 603368 | E259: 柳药股份 | F259: 医药 | G259: 医药商业 | H259: 115.37 | I259: 1.6500000000000001e-002 | J259: 1.29e-002 | K259: 19.03 | L259: 0.10000000000000001 | M259: 112.3 | N259: 23.87 | O259: 0.44700000000000001 | P259: 79.72 | Q259: 已到 | R259: 3.87年 | S259: 1.87年 | T259: 8.02 | U259: 881 | V259: 0.93000000000000005 | W259: 0.11599999999999999 | X259: 9.3000000000000013e-002 | Y259: 69 | Z259: 1.32 | AA259: -7.0999999999999995e-003 | AB259: -1.2800000000000001e-002 | AC259: -5.5500000000000001e-002 | AD259: -5.79e-002 | AE259: 95.15 | AF259: 97.12 | AG259: 0.29 | AH259: AA | AI259: 3.9e-002 | AJ259: =H259+100*O259 -> 160.06999999999999 | AK259: 151 | AL259: 149 | AM259: 53.9 | AN259: 129 | AO259: 0.13300000000000001 | AP259: 20 | AQ259: 柳药转债!
A260: 259 | B260: 127015 | C260: 希望转债!! | D260: 876 | E260: 新 希 望 | F260: 农业 | G260: 畜牧业 | H260: 122.2 | I260: -8.8999999999999999e-003 | J260: 1.44e-002 | K260: 16.72 | L260: 1.52e-002 | M260: 109.6 | N260: 19.75 | O260: 0.44299999999999995 | P260: 84.66 | Q260: 已到 | R260: 3.83年 | S260: 1.83年 | T260: 9.5 | U260: 46 | V260: 3.9e-002 | W260: 1.3000000000000001e-002 | X260: 1.1000000000000001e-002 | Y260: 753 | Z260: 2.47 | AA260: -2.8399999999999998e-002 | AB260: -3.2799999999999996e-002 | AC260: -8.5600000000000009e-002 | AD260: -8.7599999999999997e-002 | AE260: 96.06 | AF260: 97.32 | AG260: 0.36 | AH260: AAA | AI260: 3.2000000000000001e-002 | AJ260: =H260+100*O260 -> 166.5 | AK260: 159.7 | AL260: 230 | AM260: 62.4 | AN260: 201 | AO260: 1.9e-002 | AP260: 26 | AQ260: 希望转债!!
A261: 260 | B261: 113561 | C261: 正裕转债! | D261: 603089 | E261: 正裕工业 | F261: 汽车 | G261: 零部件制 | H261: 119.65 | I261: -6.4000000000000003e-003 | J261: -8.0000000000000004e-004 | K261: 8.78 | L261: -1.46e-002 | M261: 117.2 | N261: 10.08 | O261: 0.374 | P261: 87.1 | Q261: 已到 | R261: 3.82年 | S261: 1.82年 | T261: 1.5 | U261: 2.8 | V261: 1.6e-002 | W261: 7.6999999999999999e-002 | X261: 6.7000000000000004e-002 | Y261: 20 | Z261: 1.88 | AA261: -5.5000000000000005e-003 | AB261: -1.3300000000000001e-002 | AC261: -7.1399999999999991e-002 | AD261: -7.4299999999999991e-002 | AE261: 90.27 | AF261: 90.69 | AG261: 0.49 | AH261: A+ | AI261: 7.0999999999999994e-002 | AJ261: =H261+100*O261 -> 157.05000000000001 | AK261: 152.2 | AL261: 164 | AM261: 61.5 | AN261: 193 | AO261: 1.e-003 | AP261: 35 | AQ261: 正裕转债!
A262: 261 | B262: 128091 | C262: 新天转债! | D262: 2873 | E262: 新天药业 | F262: 医药 | G262: 中药 | H262: 223.002 | I262: -4.7500000000000001e-002 | J262: -8.0000000000000002e-003 | K262: 22.42 | L262: -5.7999999999999996e-002 | M262: 118.6 | N262: 11.62 | O262: 0.156 | P262: 192.94 | Q262: 已到 | R262: 3.82年 | S262: 1.82年 | T262: 1.54 | U262: 1538. | V262: 4.3099999999999996 | W262: 4.2000000000000003e-002 | X262: 8.1000000000000003e-002 | Y262: 37 | Z262: 3.02 | AA262: -0.155 | AB262: -0.16200000000000001 | AC262: -0.24100000000000002 | AD262: -0.24299999999999999 | AE262: 90.58 | AF262: 91.83 | AG262: 0.96 | AH262: A+ | AI262: 7.0999999999999994e-002 | AJ262: =H262+100*O262 -> 238.602 | AK262: 253.1 | AL262: 361 | AM262: 161.2 | AN262: 362 | AO262: 2.6000000000000002e-002 | AP262: 22 | AQ262: 新天转债!
A263: 262 | B263: 128090 | C263: 汽模转2 | D263: 2510 | E263: 天汽模 | F263: 汽车 | G263: 零部件制 | H263: 120.799 | I263: -1.1399999999999999e-002 | J263: 3.3e-003 | K263: 4.03 | L263: -1.47e-002 | M263: 114.3 | N263: 4.23 | O263: 0.26800000000000002 | P263: 95.27 | Q263: 已到 | R263: 3.81年 | S263: 1.81年 | T263: 3.1 | U263: 7.2 | V263: 1.9e-002 | W263: 8.199999999999999e-002 | X263: 7.8e-002 | Y263: 38 | Z263: 1.86 | AA263: -1.47e-002 | AB263: -2.12e-002 | AC263: -7.8700000000000006e-002 | AD263: -8.1199999999999994e-002 | AE263: 91.67 | AF263: 91.91 | AG263: 0.55 | AH263: AA- | AI263: 5.9999999999999998e-002 | AJ263: =H263+100*O263 -> 147.59900000000002 | AK263: 146.3 | AL263: 90 | AM263: 54.4 | AN263: 134 | AO263: -1.6e-002 | AP263: 29 | AQ263: 汽模转2
A264: 263 | B264: 123039 | C264: 开润转债! | D264: 300577 | E264: 开润股份 | F264: 服装纺织 | G264: 纺织行业 | H264: 114.66 | I264: -1.01e-002 | J264: 5.8999999999999999e-003 | K264: 17.16 | L264: -3.4300000000000004e-002 | M264: 120.3 | N264: 29.92 | O264: 0.99900000000000011 | P264: 57.35 | Q264: 已到 | R264: 3.81年 | S264: 1.81年 | T264: 2.22 | U264: 5.2 | V264: 2.1000000000000001e-002 | W264: 5.4000000000000006e-002 | X264: 3.1e-002 | Y264: 41 | Z264: 2.56 | AA264: 1.3000000000000001e-002 | AB264: 3.7000000000000002e-003 | AC264: -5.1399999999999994e-002 | AD264: -5.45e-002 | AE264: 90.37 | AF264: 93.17 | AG264: 0.12 | AH264: A+ | AI264: 7.0999999999999994e-002 | AJ264: =H264+100*O264 -> 214.56 | AK264: 172 | AL264: 313 | AM264: 78.8 | AN264: 303 | AO264: -7.5999999999999998e-002 | AP264: 23 | AQ264: 开润转债!
A265: 264 | B265: 123038 | C265: 联得转债! | D265: 300545 | E265: 联得装备 | F265: 机械装备 | G265: 专用设备 | H265: 124.967 | I265: -1.52e-002 | J265: 1.1399999999999999e-002 | K265: 20.91 | L265: -8.1000000000000013e-003 | M265: 117.9 | N265: 24.07 | O265: 0.439 | P265: 86.87 | Q265: 已到 | R265: 3.81年 | S265: 1.81年 | T265: 1.47 | U265: 24 | V265: 0.129 | W265: 4.0000000000000001e-002 | X265: 3.4000000000000002e-002 | Y265: 37 | Z265: 2.68 | AA265: -1.55e-002 | AB265: -2.35e-002 | AC265: -9.3200000000000005e-002 | AD265: -9.5899999999999999e-002 | AE265: 90.18 | AF265: 91.3 | AG265: 0.48 | AH265: A+ | AI265: 7.0999999999999994e-002 | AJ265: =H265+100*O265 -> 168.86699999999999 | AK265: 163.1 | AL265: 263 | AM265: 71.8 | AN265: 274 | AO265: 6.0000000000000001e-003 | AP265: 18 | AQ265: 联得转债!
A266: 265 | B266: 113030 | C266: 东风转债! | D266: 601515 | E266: 东风股份 | F266: 造纸包装 | G266: 包装材料 | H266: 128.04 | I266: -1.77e-002 | J266: 7.7000000000000002e-003 | K266: 6.88 | L266: -1.7100000000000001e-002 | M266: 116.3 | N266: 6.4 | O266: 0.191 | P266: 107.5 | Q266: 已到 | R266: 3.81年 | S266: 1.81年 | T266: 2.95 | U266: 25 | V266: 6.5000000000000002e-002 | W266: 2.7999999999999997e-002 | X266: 2.9999999999999999e-002 | Y266: 106 | Z266: 2.03 | AA266: -2.5399999999999999e-002 | AB266: -3.27e-002 | AC266: -0.106 | AD266: -0.10800000000000001 | AE266: 95.38 | AF266: 100.81 | AG266: 0.59 | AH266: AA | AI266: 3.9e-002 | AJ266: =H266+100*O266 -> 147.13999999999999 | AK266: 148.6 | AL266: 120 | AM266: 47.8 | AN266: 75 | AO266: -2.5000000000000001e-002 | AP266: 17 | AQ266: 东风转债!
A267: 266 | B267: 110064 | C267: 建工转债! | D267: 600939 | E267: 重庆建工 | F267: 建筑 | G267: 建筑工程 | H267: 122.15 | I267: -5.3800000000000001e-002 | J267: 2.3e-002 | K267: 4.88 | L267: -5.6100000000000004e-002 | M267: 119.2 | N267: 4.53 | O267: 0.13400000000000001 | P267: 107.73 | Q267: 已到 | R267: 3.79年 | S267: 1.79年 | T267: 12.6 | U267: 260 | V267: 0.16699999999999998 | W267: 0.14300000000000002 | X267: 0.154 | Y267: 89 | Z267: 1.22 | AA267: -6.6e-003 | AB267: -1.52e-002 | AC267: -8.14e-002 | AD267: -8.4499999999999992e-002 | AE267: 97.01 | AF267: 105.31 | AG267: 0.55 | AH267: AA+ | AI267: 3.4000000000000002e-002 | AJ267: =H267+100*O267 -> 135.55000000000001 | AK267: 136.6 | AL267: 23 | AM267: 31.3 | AN267: 8 | AO267: -0.114 | AP267: 49 | AQ267: 建工转债!
A268: 267 | B268: 128087 | C268: 孚日转债! | D268: 2083 | E268: 孚日股份 | F268: 服装纺织 | G268: 家纺 | H268: 119.687 | I268: -1.49e-002 | J268: 8.1000000000000013e-003 | K268: 4.61 | L268: -1.0700000000000001e-002 | M268: 112.3 | N268: 4.5 | O268: 0.16800000000000001 | P268: 102.44 | Q268: 已到 | R268: 3.79年 | S268: 1.79年 | T268: 6.5 | U268: 24 | V268: 3.1e-002 | W268: 0.155 | X268: 0.159 | Y268: 42 | Z268: 1.11 | AA268: -1.7000000000000001e-002 | AB268: -2.2700000000000001e-002 | AC268: -7.5399999999999995e-002 | AD268: -7.7899999999999997e-002 | AE268: 91.82 | AF268: 90.45 | AG268: 0.64 | AH268: AA- | AI268: 5.9999999999999998e-002 | AJ268: =H268+100*O268 -> 136.48699999999999 | AK268: 136.9 | AL268: 26 | AM268: 45.1 | AN268: 62 | AO268: -3.9e-002 | AP268: 72 | AQ268: 孚日转债!
A269: 268 | B269: 128085 | C269: 鸿达转债!! | D269: 2002 | E269: 鸿达兴业 | F269: 化工 | G269: 化工 | H269: 139.687 | I269: -3.2400000000000005e-002 | J269: 7.0999999999999995e-003 | K269: 5.44 | L269: -2.86e-002 | M269: 123.8 | N269: 3.91 | O269: 4.0000000000000001e-003 | P269: 139.13 | Q269: 已到 | R269: 3.78年 | S269: 1.78年 | T269: 3.38 | U269: 76 | V269: 0.158 | W269: 2.e-002 | X269: 2.7999999999999997e-002 | Y269: 170 | Z269: 1.64 | AA269: -3.2000000000000001e-002 | AB269: -4.2099999999999999e-002 | AC269: -0.11800000000000001 | AD269: -0.12 | AE269: 76.11 | AF269: 69.11 | AG269: 0.88 | AH269: B | AI269: 0.17100000000000001 | AJ269: =H269+100*O269 -> 140.08700000000002 | AK269: 140.2 | AL269: 47 | AM269: 64.1 | AN269: 211 | AO269: 8.0000000000000002e-003 | AP269: 83 | AQ269: 鸿达转债!!
A270: 269 | B270: 110063 | C270: 鹰19转债 | D270: 600567 | E270: 山鹰国际 | F270: 造纸包装 | G270: 包装用纸 | H270: 118.8 | I270: -5.8999999999999999e-003 | J270: 1.5e-003 | K270: 3.18 | L270: -9.300000000000001e-003 | M270: 115.4 | N270: 3.26 | O270: 0.218 | P270: 97.55 | Q270: 已到 | R270: 3.78年 | S270: 1.78年 | T270: 18.4 | U270: 11 | V270: 5.0000000000000001e-003 | W270: 0.126 | X270: 0.12300000000000001 | Y270: 147 | Z270: 0.91 | AA270: -7.8000000000000005e-003 | AB270: -1.4999999999999999e-002 | AC270: -7.2499999999999995e-002 | AD270: -7.4999999999999997e-002 | AE270: 96.32 | AF270: 101.95 | AG270: 0.46 | AH270: AA+ | AI270: 3.4000000000000002e-002 | AJ270: =H270+100*O270 -> 140.59999999999999 | AK270: 140.1 | AL270: 40 | AM270: 38.1 | AN270: 31 | AO270: -3.0000000000000001e-003 | AP270: 29 | AQ270: 鹰19转债
A271: 270 | B271: 128083 | C271: 新北转债! | D271: 2376 | E271: 新北洋 | F271: 电子 | G271: 电子产品 | H271: 114.053 | I271: -1.1699999999999999e-002 | J271: 1.0500000000000001e-002 | K271: 8.94 | L271: -4.5000000000000005e-003 | M271: 114.3 | N271: 11.45 | O271: 0.46100000000000002 | P271: 78.08 | Q271: 已到 | R271: 3.77年 | S271: 1.77年 | T271: 8.77 | U271: 6.6 | V271: 6.9999999999999993e-003 | W271: 0.14699999999999999 | X271: 0.115 | Y271: 60 | Z271: 1.77 | AA271: 5.9999999999999995e-004 | AB271: -6.1999999999999998e-003 | AC271: -5.2499999999999998e-002 | AD271: -5.5099999999999996e-002 | AE271: 95.5 | AF271: 99.21 | AG271: 0.26 | AH271: AA | AI271: 3.9e-002 | AJ271: =H271+100*O271 -> 160.15299999999999 | AK271: 150 | AL271: 134 | AM271: 50.8 | AN271: 103 | AO271: 1.2e-002 | AP271: 22 | AQ271: 新北转债!
A272: 271 | B272: 128082 | C272: 华锋转债!! | D272: 2806 | E272: 华锋股份 | F272: 电子 | G272: 元器件制 | H272: 147.499 | I272: -4.5899999999999996e-002 | J272: 1.8200000000000001e-002 | K272: 12.2 | L272: -3.4799999999999998e-002 | M272: 120.6 | N272: 9.13 | O272: 0.10400000000000001 | P272: 133.63 | Q272: 已到 | R272: 3.75年 | S272: 1.75年 | T272: 2.04 | U272: 13 | V272: 4.2000000000000003e-002 | W272: 8.6999999999999994e-002 | X272: 0.11599999999999999 | Y272: 23 | Z272: 2.05 | AA272: -5.3399999999999996e-002 | AB272: -6.2100000000000002e-002 | AC272: -0.13900000000000001 | AD272: -0.14099999999999999 | AE272: 89.43 | AF272: 90.7 | AG272: 0.8 | AH272: A | AI272: 8.1000000000000003e-002 | AJ272: =H272+100*O272 -> 157.899 | AK272: 161.4 | AL272: 247 | AM272: 70.7 | AN272: 267 | AO272: -4.7e-002 | AP272: 45 | AQ272: 华锋转债!!
A273: 272 | B273: 110062 | C273: 烽火转债! | D273: 600498 | E273: 烽火通信 | F273: 通信互联 | G273: 通信设备 | H273: 114.45 | I273: -4.7999999999999996e-003 | J273: 2.3999999999999998e-003 | K273: 16.89 | L273: -1.23e-002 | M273: 110.3 | N273: 22.85 | O273: 0.54799999999999993 | P273: 73.92 | Q273: 已到 | R273: 3.75年 | S273: 1.75年 | T273: 30.9 | U273: 3.2 | V273: 1.e-003 | W273: 0.154 | X273: 0.114 | Y273: 201 | Z273: 1.74 | AA273: -1.e-002 | AB273: -1.4999999999999999e-002 | AC273: -5.5e-002 | AD273: -5.7599999999999998e-002 | AE273: 96.83 | AF273: 98.25 | AG273: 0.2 | AH273: AAA | AI273: 3.2000000000000001e-002 | AJ273: =H273+100*O273 -> 169.25 | AK273: 155 | AL273: 190 | AM273: 56.7 | AN273: 151 | AO273: -1.4999999999999999e-002 | AP273: 18 | AQ273: 烽火转债!
A274: 273 | B274: 128081 | C274: 海亮转债! | D274: 2203 | E274: 海亮股份 | F274: 有色金属 | G274: 铜金属 | H274: 129.39 | I274: -7.0999999999999995e-003 | J274: -3.3e-003 | K274: 11.8 | L274: -1.4199999999999999e-002 | M274: 114.3 | N274: 9.69 | O274: 6.3e-002 | P274: 121.78 | Q274: 已到 | R274: 3.72年 | S274: 1.72年 | T274: 30.1 | U274: 61 | V274: 1.6e-002 | W274: 0.13 | X274: 0.158 | Y274: 232 | Z274: 2.32 | AA274: -3.3399999999999999e-002 | AB274: -4.0000000000000001e-002 | AC274: -0.11599999999999999 | AD274: -0.11800000000000001 | AE274: 95.71 | AF274: 99.42 | AG274: 0.73 | AH274: AA | AI274: 3.9e-002 | AJ274: =H274+100*O274 -> 135.69 | AK274: 137 | AL274: 27 | AM274: 37.6 | AN274: 27 | AO274: -5.0000000000000001e-003 | AP274: 43 | AQ274: 海亮转债!
A275: 274 | B275: 113550 | C275: 常汽转债! | D275: 603035 | E275: 常熟汽饰 | F275: 汽车 | G275: 零部件制 | H275: 200.47 | I275: -9.0500000000000011e-002 | J275: 2.63e-002 | K275: 15.94 | L275: -7.0000000000000007e-002 | M275: 120.5 | N275: 9.33 | O275: 0.17300000000000001 | P275: 170.85 | Q275: 已到 | R275: 3.71年 | S275: 1.71年 | T275: 2.14 | U275: 342 | V275: 0.78299999999999992 | W275: 3.7000000000000005e-002 | X275: 6.4000000000000001e-002 | Y275: 58 | Z275: 1.47 | AA275: -0.13100000000000001 | AB275: -0.13800000000000001 | AC275: -0.23499999999999999 | AD275: -0.23600000000000002 | AE275: 92.81 | AF275: 97.58 | AG275: 0.92 | AH275: AA- | AI275: 5.9999999999999998e-002 | AJ275: =H275+100*O275 -> 217.77000000000001 | AK275: 230.1 | AL275: 358 | AM275: 132.5 | AN275: 358 | AO275: -0.16899999999999998 | AP275: 14 | AQ275: 常汽转债!
A276: 275 | B276: 113549 | C276: 白电转债 | D276: 603861 | E276: 白云电器 | F276: 能源电力 | G276: 电力设备 | H276: 124.71 | I276: -2.3e-002 | J276: 1.3600000000000001e-002 | K276: 9.93 | L276: -1.49e-002 | M276: 114.3 | N276: 9.06 | O276: 0.13800000000000001 | P276: 109.6 | Q276: 已到 | R276: 3.70年 | S276: 1.70年 | T276: 8.05 | U276: 41 | V276: 4.0000000000000001e-002 | W276: 0.18600000000000003 | X276: 0.20399999999999999 | Y276: 43 | Z276: 1.67 | AA276: -2.3700000000000002e-002 | AB276: -3.04e-002 | AC276: -9.9000000000000005e-002 | AD276: -0.10099999999999999 | AE276: 95.77 | AF276: 99.49 | AG276: 0.63 | AH276: AA | AI276: 3.9e-002 | AJ276: =H276+100*O276 -> 138.50999999999999 | AK276: 139.8 | AL276: 37 | AM276: 40.3 | AN276: 39 | AO276: -1.8000000000000002e-002 | AP276: 35 | AQ276: 白电转债
A277: 276 | B277: 123035 | C277: 利德转债!! | D277: 300296 | E277: 利亚德 | F277: 电子 | G277: LED制 | H277: 137 | I277: -3.15e-002 | J277: 1.7600000000000001e-002 | K277: 8.1 | L277: -2.06e-002 | M277: 114.3 | N277: 6.96 | O277: 0.17699999999999999 | P277: 116.38 | Q277: 已到 | R277: 3.70年 | S277: 1.70年 | T277: 7.99 | U277: 19 | V277: 1.8000000000000002e-002 | W277: 3.9e-002 | X277: 4.4999999999999998e-002 | Y277: 206 | Z277: 2.68 | AA277: -4.87e-002 | AB277: -5.5099999999999996e-002 | AC277: -0.12 | AD277: -0.122 | AE277: 96.64 | AF277: 101.25 | AG277: 0.68 | AH277: AA+ | AI277: 3.4000000000000002e-002 | AJ277: =H277+100*O277 -> 154.69999999999999 | AK277: 157.6 | AL277: 208 | AM277: 56.4 | AN277: 148 | AO277: -8.4000000000000005e-002 | AP277: 13 | AQ277: 利德转债!!
A278: 277 | B278: 110061 | C278: 川投转债! | D278: 600674 | E278: 川投能源 | F278: 能源电力 | G278: 水电 | H278: 144.82 | I278: -1.4800000000000001e-002 | J278: 7.3000000000000001e-003 | K278: 12.17 | L278: -9.0000000000000011e-003 | M278: 110.3 | N278: 9.2 | O278: 9.5000000000000001e-002 | P278: 132.28 | Q278: 已到 | R278: 3.69年 | S278: 1.69年 | T278: 39.6 | U278: 38 | V278: 6.9999999999999993e-003 | W278: 7.400000000000001e-002 | X278: 9.8000000000000004e-002 | Y278: 536 | Z278: 1.75 | AA278: -7.2400000000000006e-002 | AB278: -7.6999999999999999e-002 | AC278: -0.14099999999999999 | AD278: -0.14300000000000002 | AE278: 97.01 | AF278: 98.43 | AG278: 0.84 | AH278: AAA | AI278: 3.2000000000000001e-002 | AJ278: =H278+100*O278 -> 154.31999999999999 | AK278: 157.4 | AL278: 204 | AM278: 58.9 | AN278: 170 | AO278: 1.4999999999999999e-002 | AP278: 11 | AQ278: 川投转债!
A279: 278 | B279: 123034 | C279: 通光转债! | D279: 300265 | E279: 通光线缆 | F279: 通信互联 | G279: 通信设备 | H279: 199 | I279: -2.2099999999999998e-002 | J279: 9.8999999999999991e-003 | K279: 10.02 | L279: -1.5700000000000002e-002 | M279: 117.3 | N279: 7.95 | O279: 0.57899999999999996 | P279: 126.04 | Q279: 已到 | R279: 3.67年 | S279: 1.67年 | T279: 0.78 | U279: 63 | V279: 0.40399999999999997 | W279: 2.1000000000000001e-002 | X279: 2.7000000000000003e-002 | Y279: 37 | Z279: 2.81 | AA279: -0.13600000000000001 | AB279: -0.14300000000000002 | AC279: -0.23999999999999999 | AD279: -0.24199999999999999 | AE279: 90.73 | AF279: 91.65 | AG279: 0.78 | AH279: A+ | AI279: 7.0999999999999994e-002 | AJ279: =H279+100*O279 -> 256.89999999999998 | AK279: 272 | AL279: 365 | AM279: 180.3 | AN279: 366 | AO279: -1.3000000000000001e-002 | AP279: 16 | AQ279: 通光转债!
A280: 279 | B280: 113548 | C280: 石英转债! | D280: 603688 | E280: 石英股份 | F280: 电子 | G280: 电子产品 | H280: 416.96 | I280: -3.8e-003 | J280: 3.0000000000000001e-003 | K280: 59.8 | L280: -8.0000000000000004e-004 | M280: 123.7 | N280: 14.93 | O280: 4.0999999999999995e-002 | P280: 400.54 | Q280: 已到 | R280: 3.65年 | S280: 1.65年 | T280: 1.2 | U280: 201 | V280: 0.39600000000000002 | W280: 6.0000000000000001e-003 | X280: 2.3e-002 | Y280: 211 | Z280: 10.28 | AA280: -0.28699999999999998 | AB280: -0.29399999999999998 | AC280: -0.38 | AD280: -0.38100000000000001 | AE280: 93.3 | AF280: 100.51 | AG280: 0.99 | AH280: AA- | AI280: 5.9999999999999998e-002 | AJ280: =H280+100*O280 -> 421.06 | AK280: 433.4 | AL280: 377 | AM280: 332.9 | AN280: 377 | AO280: 5.9999999999999998e-002 | AP280: 12 | AQ280: 石英转债!
A281: 280 | B281: 110060 | C281: 天路转债! | D281: 600326 | E281: 西藏天路 | F281: 建筑 | G281: 水泥 | H281: 118.31 | I281: -1.06e-002 | J281: 1.8e-003 | K281: 6.55 | L281: -2.0899999999999998e-002 | M281: 114.3 | N281: 7.08 | O281: 0.27899999999999997 | P281: 92.51 | Q281: 已到 | R281: 3.65年 | S281: 1.65年 | T281: 7.06 | U281: 11 | V281: 1.3000000000000001e-002 | W281: 0.11699999999999999 | X281: 0.109 | Y281: 60 | Z281: 1.41 | AA281: -9.5999999999999992e-003 | AB281: -1.6500000000000001e-002 | AC281: -7.4999999999999997e-002 | AD281: -7.7699999999999991e-002 | AE281: 95.95 | AF281: 99.68 | AG281: 0.42 | AH281: AA | AI281: 3.9e-002 | AJ281: =H281+100*O281 -> 146.21000000000001 | AK281: 144.1 | AL281: 70 | AM281: 44.4 | AN281: 57 | AO281: 2.e-003 | AP281: 13 | AQ281: 天路转债!
A282: 281 | B282: 110059 | C282: 浦发转债! | D282: 600000 | E282: 浦发银行 | F282: 金融 | G282: 银行行业 | H282: 106.14 | I282: -4.0000000000000002e-004 | J282: 0. | K282: 8.4 | L282: -7.0999999999999995e-003 | M282: 116.8 | N282: 13.97 | O282: 0.76500000000000001 | P282: 60.13 | Q282: 已到 | R282: 3.65年 | S282: 无权 | T282: 500 | U282: 323 | V282: 6.0000000000000001e-003 | W282: 0.20300000000000001 | X282: 0.122 | Y282: 2466. | Z282: 0.45 | AA282: 2.7400000000000001e-002 | AB282: 1.8799999999999997e-002 | AC282: 无权 | AD282: 无权 | AE282: 无权 | AF282: 104.46 | AG282: 0.06 | AH282: AAA | AI282: 3.2000000000000001e-002 | AJ282: =H282+100*O282 -> 182.63999999999999 | AK282: 152.2 | AL282: 161 | AM282: 47.7 | AN282: 74 | AO282: -1.7000000000000001e-002 | AP282: 54 | AQ282: 浦发转债!
A283: 282 | B283: 127014 | C283: 北方转债! | D283: 65 | E283: 北方国际 | F283: 建筑 | G283: 建筑工程 | H283: 125.01 | I283: -4.7199999999999999e-002 | J283: 2.7799999999999998e-002 | K283: 8.87 | L283: -3.6900000000000002e-002 | M283: 114.3 | N283: 8.65 | O283: 0.21899999999999997 | P283: 102.54 | Q283: 已到 | R283: 3.64年 | S283: 1.64年 | T283: 5.35 | U283: 103 | V283: 0.151 | W283: 7.8e-002 | X283: 8.0000000000000002e-002 | Y283: 69 | Z283: 1.15 | AA283: -2.4799999999999999e-002 | AB283: -3.15e-002 | AC283: -0.10300000000000001 | AD283: -0.106 | AE283: 96.82 | AF283: 101.45 | AG283: 0.52 | AH283: AA+ | AI283: 3.4000000000000002e-002 | AJ283: =H283+100*O283 -> 146.91 | AK283: 147.5 | AL283: 105 | AM283: 46 | AN283: 65 | AO283: 2.2000000000000002e-002 | AP283: 17 | AQ283: 北方转债!
A284: 283 | B284: 113546 | C284: 迪贝转债! | D284: 603320 | E284: 迪贝电气 | F284: 家电 | G284: 零部件制 | H284: 123.86 | I284: -1.6500000000000001e-002 | J284: 7.7000000000000002e-003 | K284: 14.15 | L284: -1.5300000000000001e-002 | M284: 119.8 | N284: 14 | O284: 0.22500000000000001 | P284: 101.07 | Q284: 已到 | R284: 3.64年 | S284: 1.64年 | T284: 2.3 | U284: 6.7 | V284: 2.3e-002 | W284: 0.125 | X284: 0.126 | Y284: 18 | Z284: 2.53 | AA284: -9.300000000000001e-003 | AB284: -1.8500000000000003e-002 | AC284: -9.74e-002 | AD284: -0.10000000000000001 | AE284: 91.24 | AF284: 93.86 | AG284: 0.58 | AH284: A+ | AI284: 7.0999999999999994e-002 | AJ284: =H284+100*O284 -> 146.36000000000001 | AK284: 146.6 | AL284: 96 | AM284: 52.8 | AN284: 120 | AO284: 3.9e-002 | AP284: 36 | AQ284: 迪贝转债!
A285: 284 | B285: 128079 | C285: 英联转债! | D285: 2846 | E285: 英联股份 | F285: 造纸包装 | G285: 包装材料 | H285: 124 | I285: -7.1999999999999998e-003 | J285: 2.3e-003 | K285: 7.35 | L285: -9.3999999999999986e-003 | M285: 116.9 | N285: 8.29 | O285: 0.39899999999999997 | P285: 88.66 | Q285: 已到 | R285: 3.63年 | S285: 1.63年 | T285: 1.52 | U285: 13 | V285: 6.9000000000000006e-002 | W285: 6.5000000000000002e-002 | X285: 5.7999999999999996e-002 | Y285: 23 | Z285: 2.89 | AA285: -1.6399999999999998e-002 | AB285: -2.4399999999999998e-002 | AC285: -9.849999999999999e-002 | AD285: -0.10099999999999999 | AE285: 91.21 | AF285: 91.63 | AG285: 0.52 | AH285: A+ | AI285: 7.0999999999999994e-002 | AJ285: =H285+100*O285 -> 163.90000000000001 | AK285: 159.3 | AL285: 222 | AM285: 67.7 | AN285: 243 | AO285: 1.3999999999999999e-002 | AP285: 15 | AQ285: 英联转债!
A286: 285 | B286: 128078 | C286: 太极转债! | D286: 2368 | E286: 太极股份 | F286: 计算机及 | G286: 软件开发 | H286: 138.222 | I286: -1.2699999999999999e-002 | J286: -1.6000000000000001e-003 | K286: 24.73 | L286: -2.29e-002 | M286: 116.3 | N286: 22.21 | O286: 0.24100000000000002 | P286: 111.35 | Q286: 已到 | R286: 3.63年 | S286: 1.63年 | T286: 9.6 | U286: 19 | V286: 1.3999999999999999e-002 | W286: 6.7000000000000004e-002 | X286: 7.4999999999999997e-002 | Y286: 143 | Z286: 4.34 | AA286: -4.7300000000000002e-002 | AB286: -5.4699999999999999e-002 | AC286: -0.129 | AD286: -0.13100000000000001 | AE286: 96.02 | AF286: 101.49 | AG286: 0.62 | AH286: AA | AI286: 3.9e-002 | AJ286: =H286+100*O286 -> 162.322 | AK286: 165.1 | AL286: 281 | AM286: 63.6 | AN286: 208 | AO286: -1.3999999999999999e-002 | AP286: 9 | AQ286: 太极转债!
A287: 286 | B287: 128076 | C287: 金轮转债! | D287: 2722 | E287: 金轮股份 | F287: 机械装备 | G287: 专用设备 | H287: 124.9 | I287: -7.1999999999999998e-003 | J287: -1.1000000000000001e-003 | K287: 14.75 | L287: -1.3999999999999999e-002 | M287: 114.3 | N287: 14.66 | O287: 0.24100000000000002 | P287: 100.61 | Q287: 已到 | R287: 3.61年 | S287: 1.61年 | T287: 2.14 | U287: 3.3 | V287: 1.2e-002 | W287: 8.3000000000000004e-002 | X287: 8.3000000000000004e-002 | Y287: 26 | Z287: 1.32 | AA287: -2.4700000000000003e-002 | AB287: -3.15e-002 | AC287: -0.10400000000000001 | AD287: -0.107 | AE287: 92.76 | AF287: 93 | AG287: 0.59 | AH287: AA- | AI287: 5.9999999999999998e-002 | AJ287: =H287+100*O287 -> 149. | AK287: 149.2 | AL287: 129 | AM287: 56.2 | AN287: 145 | AO287: -4.0999999999999995e-002 | AP287: 37 | AQ287: 金轮转债!
A288: 287 | B288: 113545 | C288: 金能转债! | D288: 603113 | E288: 金能科技 | F288: 煤炭 | G288: 炼焦 | H288: 158.02 | I288: -1.52e-002 | J288: 4.5000000000000005e-003 | K288: 15.08 | L288: -1.24e-002 | M288: 114.3 | N288: 10.43 | O288: 9.3000000000000013e-002 | P288: 144.58 | Q288: 已到 | R288: 3.61年 | S288: 1.61年 | T288: 9.87 | U288: 65 | V288: 4.2000000000000003e-002 | W288: 7.6999999999999999e-002 | X288: 0.111 | Y288: 129 | Z288: 1.48 | AA288: -8.72e-002 | AB288: -9.3399999999999997e-002 | AC288: -0.17999999999999999 | AD288: -0.18100000000000002 | AE288: 96.09 | AF288: 99.82 | AG288: 0.86 | AH288: AA | AI288: 3.9e-002 | AJ288: =H288+100*O288 -> 167.32000000000002 | AK288: 171.5 | AL288: 310 | AM288: 71.6 | AN288: 272 | AO288: 2.4e-002 | AP288: 12 | AQ288: 金能转债!
A289: 288 | B289: 128074 | C289: 游族转债!! | D289: 2174 | E289: 游族网络 | F289: 通信互联 | G289: 互联网 | H289: 114.83 | I289: -1.e-002 | J289: 1.03e-002 | K289: 12.17 | L289: 1.6000000000000001e-003 | M289: 119.3 | N289: 16.97 | O289: 0.60099999999999998 | P289: 71.71 | Q289: 已到 | R289: 3.55年 | S289: 1.55年 | T289: 6.83 | U289: 16 | V289: 2.1000000000000001e-002 | W289: 6.0999999999999999e-002 | X289: 4.4000000000000004e-002 | Y289: 111 | Z289: 2.13 | AA289: 1.1000000000000001e-002 | AB289: 1.5e-003 | AC289: -6.2800000000000009e-002 | AD289: -6.5700000000000008e-002 | AE289: 96.3 | AF289: 98.88 | AG289: 0.17 | AH289: AA | AI289: 3.9e-002 | AJ289: =H289+100*O289 -> 174.93000000000001 | AK289: 157.9 | AL289: 212 | AM289: 59.1 | AN289: 172 | AO289: -1.2e-002 | AP289: 31 | AQ289: 游族转债!!
A290: 289 | B290: 128075 | C290: 远东转债! | D290: 2406 | E290: 远东传动 | F290: 汽车 | G290: 零部件制 | H290: 124.343 | I290: -3.4000000000000002e-002 | J290: 2.4500000000000001e-002 | K290: 5.9 | L290: -1.4999999999999999e-002 | M290: 114.3 | N290: 5.29 | O290: 0.115 | P290: 111.53 | Q290: 已到 | R290: 3.55年 | S290: 1.55年 | T290: 5.44 | U290: 31 | V290: 4.5999999999999999e-002 | W290: 0.14800000000000002 | X290: 0.16500000000000001 | Y290: 37 | Z290: 1.13 | AA290: -2.3900000000000001e-002 | AB290: -3.0800000000000001e-002 | AC290: -0.105 | AD290: -0.10800000000000001 | AE290: 96.3 | AF290: 100.04 | AG290: 0.63 | AH290: AA | AI290: 3.9e-002 | AJ290: =H290+100*O290 -> 135.84300000000002 | AK290: 137.2 | AL290: 28 | AM290: 37.1 | AN290: 24 | AO290: 9.0000000000000011e-003 | AP290: 17 | AQ290: 远东转债!
A291: 290 | B291: 123031 | C291: 晶瑞转债! | D291: 300655 | E291: 晶瑞电材 | F291: 电子 | G291: 电子行业 | H291: 398.2 | I291: 4.4000000000000003e-003 | J291: -1.1000000000000001e-003 | K291: 36.26 | L291: 3.3e-003 | M291: 115.3 | N291: 10.66 | O291: 0.17100000000000001 | P291: 340.15 | Q291: 已到 | R291: 3.49年 | S291: 1.49年 | T291: 0.53 | U291: 341 | V291: 1.6000000000000001 | W291: 4.0000000000000001e-003 | X291: 1.3999999999999999e-002 | Y291: 126 | Z291: 8.51 | AA291: -0.30299999999999999 | AB291: -0.308 | AC291: -0.41999999999999998 | AD291: -0.42100000000000004 | AE291: 91.88 | AF291: 91.24 | AG291: 0.99 | AH291: A+ | AI291: 7.0999999999999994e-002 | AJ291: =H291+100*O291 -> 415.30000000000001 | AK291: 456.2 | AL291: 380 | AM291: 364.4 | AN291: 380 | AO291: 2.8999999999999998e-002 | AP291: 15 | AQ291: 晶瑞转债!
A292: 291 | B292: 128073 | C292: 哈尔转债! | D292: 2615 | E292: 哈尔斯 | F292: 其他 | G292: 家居用品 | H292: 121.128 | I292: -1.2e-002 | J292: 7.1999999999999998e-003 | K292: 5.55 | L292: -1.0700000000000001e-002 | M292: 114.5 | N292: 5.7 | O292: 0.24399999999999999 | P292: 97.37 | Q292: 已到 | R292: 2.47年 | S292: 0.47年 | T292: 2.99 | U292: 6.5 | V292: 1.8000000000000002e-002 | W292: 0.13 | X292: 0.127 | Y292: 23 | Z292: 2.67 | AA292: -2.2799999999999997e-002 | AB292: -3.3000000000000002e-002 | AC292: -0.27100000000000002 | AD292: -0.27399999999999997 | AE292: 97.75 | AF292: 99.96 | AG292: 0.45 | AH292: AA- | AI292: 5.74e-002 | AJ292: =H292+100*O292 -> 145.52799999999999 | AK292: 144.9 | AL292: 76 | AM292: 44.9 | AN292: 60 | AO292: -4.0000000000000001e-003 | AP292: 36 | AQ292: 哈尔转债!
A293: 292 | B293: 128072 | C293: 翔鹭转债! | D293: 2842 | E293: 翔鹭钨业 | F293: 有色金属 | G293: 小金属 | H293: 114.4 | I293: -8.6999999999999994e-003 | J293: 3.5999999999999999e-003 | K293: 10.06 | L293: -2.52e-002 | M293: 114.5 | N293: 15.19 | O293: 0.72699999999999998 | P293: 66.23 | Q293: 已到 | R293: 3.46年 | S293: 1.46年 | T293: 3.02 | U293: 7.6 | V293: 2.2000000000000002e-002 | W293: 0.10800000000000001 | X293: 7.2000000000000008e-002 | Y293: 28 | Z293: 2.87 | AA293: 2.9999999999999997e-004 | AB293: -7.3000000000000001e-003 | AC293: -6.3899999999999998e-002 | AD293: -6.7000000000000004e-002 | AE293: 93.61 | AF293: 94 | AG293: 0.2 | AH293: AA- | AI293: 5.9999999999999998e-002 | AJ293: =H293+100*O293 -> 187.10000000000002 | AK293: 162.6 | AL293: 260 | AM293: 68.6 | AN293: 252 | AO293: 3.6000000000000004e-002 | AP293: 30 | AQ293: 翔鹭转债!
A294: 293 | B294: 128071 | C294: 合兴转债! | D294: 2228 | E294: 合兴包装 | F294: 造纸包装 | G294: 包装材料 | H294: 115.122 | I294: -8.3999999999999995e-003 | J294: 3.8e-003 | K294: 3.57 | L294: -1.38e-002 | M294: 114.3 | N294: 4.18 | O294: 0.34799999999999998 | P294: 85.41 | Q294: 已到 | R294: 3.45年 | S294: 1.45年 | T294: 3 | U294: 2.8 | V294: 8.0000000000000002e-003 | W294: 6.8000000000000005e-002 | X294: 5.7999999999999996e-002 | Y294: 44 | Z294: 1.31 | AA294: -2.0999999999999999e-003 | AB294: -9.4999999999999998e-003 | AC294: -6.8199999999999997e-002 | AD294: -7.1199999999999999e-002 | AE294: 96.69 | AF294: 100.44 | AG294: 0.33 | AH294: AA | AI294: 3.9e-002 | AJ294: =H294+100*O294 -> 149.922 | AK294: 144.8 | AL294: 75 | AM294: 44.4 | AN294: 55 | AO294: -6.9999999999999993e-003 | AP294: 26 | AQ294: 合兴转债!
A295: 294 | B295: 113542 | C295: 好客转债! | D295: 603898 | E295: 好莱客 | F295: 其他 | G295: 家居用品 | H295: 112.41 | I295: -1.0500000000000001e-002 | J295: 8.8999999999999999e-003 | K295: 10.87 | L295: -1.2699999999999999e-002 | M295: 114.3 | N295: 16.14 | O295: 0.66900000000000004 | P295: 67.35 | Q295: 已到 | R295: 3.41年 | S295: 1.41年 | T295: 6.03 | U295: 5.5 | V295: 8.0000000000000002e-003 | W295: 0.17800000000000002 | X295: 0.12 | Y295: 34 | Z295: 1.25 | AA295: 5.0000000000000001e-003 | AB295: -2.5999999999999999e-003 | AC295: -5.5599999999999997e-002 | AD295: -5.8799999999999998e-002 | AE295: 96.84 | AF295: 100.6 | AG295: 0.12 | AH295: AA | AI295: 3.9e-002 | AJ295: =H295+100*O295 -> 179.31 | AK295: 157.5 | AL295: 206 | AM295: 56.9 | AN295: 153 | AO295: -2.e-002 | AP295: 18 | AQ295: 好客转债!
A296: 295 | B296: 113541 | C296: 荣晟转债!! | D296: 603165 | E296: 荣晟环保 | F296: 造纸包装 | G296: 包装用纸 | H296: 164.87 | I296: -1.8e-003 | J296: -1.2999999999999999e-003 | K296: 17.68 | L296: -3.4000000000000002e-003 | M296: 114.3 | N296: 10.84 | O296: 1.1000000000000001e-002 | P296: 163.1 | Q296: 已到 | R296: 3.38年 | S296: 1.38年 | T296: 1.63 | U296: 56 | V296: 0.20899999999999999 | W296: 3.5000000000000003e-002 | X296: 5.7000000000000002e-002 | Y296: 47 | Z296: 2.69 | AA296: -0.10400000000000001 | AB296: -0.111 | AC296: -0.22899999999999998 | AD296: -0.23100000000000001 | AE296: 94 | AF296: 94.24 | AG296: 0.92 | AH296: AA- | AI296: 5.9999999999999998e-002 | AJ296: =H296+100*O296 -> 165.97 | AK296: 166.6 | AL296: 290 | AM296: 72.4 | AN296: 277 | AO296: 9.6999999999999989e-002 | AP296: 38 | AQ296: 荣晟转债!!
A297: 296 | B297: 128070 | C297: 智能转债! | D297: 2877 | E297: 智能自控 | F297: 机械装备 | G297: 通用设备 | H297: 117.004 | I297: -8.9999999999999998e-004 | J297: -2.e-003 | K297: 6.9 | L297: -1.e-002 | M297: 116.8 | N297: 9.47 | O297: 0.60599999999999998 | P297: 72.86 | Q297: 已到 | R297: 3.33年 | S297: 无权 | T297: 2.3 | U297: 8.7 | V297: 3.2000000000000001e-002 | W297: 0.10000000000000001 | X297: 7.2999999999999995e-002 | Y297: 23 | Z297: 3.02 | AA297: -5.0000000000000001e-004 | AB297: -9.3999999999999986e-003 | AC297: 无权 | AD297: 无权 | AE297: 无权 | AF297: 93.49 | AG297: 0.29 | AH297: A+ | AI297: 7.0999999999999994e-002 | AJ297: =H297+100*O297 -> 177.60400000000001 | AK297: 161.1 | AL297: 245 | AM297: 67.7 | AN297: 242 | AO297: 1.6e-002 | AP297: 29 | AQ297: 智能转债!
A298: 297 | B298: 128069 | C298: 华森转债! | D298: 2907 | E298: 华森制药 | F298: 医药 | G298: 化学制药 | H298: 117.775 | I298: -1.11e-002 | J298: -8.0000000000000004e-004 | K298: 14.38 | L298: -4.2000000000000003e-002 | M298: 119.3 | N298: 18.01 | O298: 0.47499999999999998 | P298: 79.84 | Q298: 已到 | R298: 3.30年 | S298: 1.30年 | T298: 3 | U298: 47 | V298: 0.13300000000000001 | W298: 5.2000000000000005e-002 | X298: 4.0999999999999995e-002 | Y298: 58 | Z298: 4.87 | AA298: 4.0000000000000001e-003 | AB298: -6.0999999999999995e-003 | AC298: -8.9099999999999999e-002 | AD298: -9.2300000000000007e-002 | AE298: 94.43 | AF298: 98.81 | AG298: 0.28 | AH298: AA- | AI298: 5.9999999999999998e-002 | AJ298: =H298+100*O298 -> 165.27500000000001 | AK298: 155.7 | AL298: 193 | AM298: 56.9 | AN298: 154 | AO298: 2.4e-002 | AP298: 44 | AQ298: 华森转债!
A299: 298 | B299: 113027 | C299: 华钰转债!! | D299: 601020 | E299: ST华钰 | F299: 有色金属 | G299: 锌铅镍锡 | H299: 160.3 | I299: -2.18e-002 | J299: 7.9000000000000008e-003 | K299: 15.45 | L299: -1.5300000000000001e-002 | M299: 114.3 | N299: 10.17 | O299: 5.5e-002 | P299: 151.92 | Q299: 已到 | R299: 3.28年 | S299: 1.28年 | T299: 3.1 | U299: 423 | V299: 0.83900000000000008 | W299: 3.6000000000000004e-002 | X299: 5.5e-002 | Y299: 86 | Z299: 3.3 | AA299: -9.98e-002 | AB299: -0.107 | AC299: -0.23800000000000002 | AD299: -0.23999999999999999 | AE299: 91.97 | AF299: 89.07 | AG299: 0.91 | AH299: A | AI299: 8.1000000000000003e-002 | AJ299: =H299+100*O299 -> 165.80000000000001 | AK299: 168.7 | AL299: 296 | AM299: 76.7 | AN299: 298 | AO299: 0.14099999999999999 | AP299: 41 | AQ299: 华钰转债!!
A300: 299 | B300: 123027 | C300: 蓝晓转债! | D300: 300487 | E300: 蓝晓科技 | F300: 化工 | G300: 化工 | H300: 368.646 | I300: -3.4500000000000003e-002 | J300: 3.3e-003 | K300: 90.88 | L300: -3.1699999999999999e-002 | M300: 118.8 | N300: 29.03 | O300: 0.17800000000000002 | P300: 313.06 | Q300: 已到 | R300: 3.27年 | S300: 1.27年 | T300: 1.07 | U300: 187 | V300: 0.46200000000000002 | W300: 5.0000000000000001e-003 | X300: 1.7000000000000001e-002 | Y300: 200 | Z300: 10.1 | AA300: -0.29799999999999999 | AB300: -0.30399999999999999 | AC300: -0.47999999999999998 | AD300: -0.48100000000000004 | AE300: 94.11 | AF300: 95.55 | AG300: 0.98 | AH300: A+ | AI300: 7.0999999999999994e-002 | AJ300: =H300+100*O300 -> 386.44600000000003 | AK300: 424.2 | AL300: 376 | AM300: 328.7 | AN300: 376 | AO300: -4.7e-002 | AP300: 17 | AQ300: 蓝晓转债!
A301: 300 | B301: 113537 | C301: 文灿转债!! | D301: 603348 | E301: 文灿股份 | F301: 汽车 | G301: 零部件制 | H301: 225.22 | I301: -0.124 | J301: 5.1100000000000007e-002 | K301: 38.64 | L301: -7.6700000000000004e-002 | M301: 120.7 | N301: 19.28 | O301: 0.124 | P301: 200.41 | Q301: 已到 | R301: 3.27年 | S301: 1.27年 | T301: 1.41 | U301: 264 | V301: 0.80000000000000004 | W301: 1.3999999999999999e-002 | X301: 2.7999999999999997e-002 | Y301: 101 | Z301: 3.86 | AA301: -0.17699999999999999 | AB301: -0.18600000000000003 | AC301: -0.36200000000000004 | AD301: -0.36299999999999999 | AE301: 95.41 | AF301: 100.3 | AG301: 0.96 | AH301: AA- | AI301: 5.9999999999999998e-002 | AJ301: =H301+100*O301 -> 237.62 | AK301: 250 | AL301: 359 | AM301: 149.7 | AN301: 359 | AO301: -0.16699999999999998 | AP301: 22 | AQ301: 文灿转债!!
A302: 301 | B302: 113535 | C302: 大业转债! | D302: 603278 | E302: 大业股份 | F302: 汽车 | G302: 零部件制 | H302: 115.25 | I302: -1.2699999999999999e-002 | J302: 8.8000000000000005e-003 | K302: 9.54 | L302: -2.75e-002 | M302: 112.5 | N302: 12.29 | O302: 0.48499999999999999 | P302: 77.62 | Q302: 已到 | R302: 2.18年 | S302: 0.18年 | T302: 5 | U302: 7.4 | V302: 1.3000000000000001e-002 | W302: 0.18100000000000002 | X302: 0.14000000000000001 | Y302: 28 | Z302: 1.55 | AA302: -1.1200000000000002e-002 | AB302: -2.1400000000000002e-002 | AC302: -0.379 | AD302: -0.38600000000000001 | AE302: 100.02 | AF302: 104.19 | AG302: 0.14 | AH302: AA | AI302: 3.6400000000000002e-002 | AJ302: =H302+100*O302 -> 163.75 | AK302: 152.9 | AL302: 170 | AM302: 48.7 | AN302: 85 | AO302: -4.8000000000000001e-002 | AP302: 47 | AQ302: 大业转债!
A303: 302 | B303: 128066 | C303: 亚泰转债! | D303: 2811 | E303: 郑中设计 | F303: 建筑 | G303: 装饰工程 | H303: 118.104 | I303: -3.2099999999999997e-002 | J303: 1.8e-003 | K303: 9.52 | L303: -5.3699999999999998e-002 | M303: 116.7 | N303: 9.27 | O303: 0.14999999999999999 | P303: 102.7 | Q303: 已到 | R303: 3年43天 | S303: 1年43天 | T303: 4.8 | U303: 149 | V303: 0.26000000000000001 | W303: 0.187 | X303: 0.192 | Y303: 26 | Z303: 1.85 | AA303: -3.9000000000000003e-003 | AB303: -1.3300000000000001e-002 | AC303: -0.10199999999999999 | AD303: -0.10000000000000001 | AE303: 95.69 | AF303: 97.76 | AG303: 0.56 | AH303: AA- | AI303: 5.9999999999999998e-002 | AJ303: =H303+100*O303 -> 133.10399999999998 | AK303: 133.5 | AL303: 9 | AM303: 35.8 | AN303: 20 | AO303: 9.0000000000000011e-003 | AP303: 68 | AQ303: 亚泰转债!
A304: 303 | B304: 110058 | C304: 永鼎转债! | D304: 600105 | E304: 永鼎股份 | F304: 通信互联 | G304: 通信设备 | H304: 118.82 | I304: -1.34e-002 | J304: 4.7999999999999996e-003 | K304: 4.25 | L304: -2.3e-002 | M304: 114.3 | N304: 5.04 | O304: 0.40899999999999997 | P304: 84.33 | Q304: 已到 | R304: 3年42天 | S304: 1年42天 | T304: 2.61 | U304: 6.1 | V304: 2.e-002 | W304: 4.4000000000000004e-002 | X304: 3.7000000000000005e-002 | Y304: 60 | Z304: 2.09 | AA304: -1.26e-002 | AB304: -2.07e-002 | AC304: -0.10199999999999999 | AD304: -0.105 | AE304: 95.48 | AF304: 95.73 | AG304: 0.37 | AH304: AA- | AI304: 5.9999999999999998e-002 | AJ304: =H304+100*O304 -> 159.72 | AK304: 153.3 | AL304: 174 | AM304: 57.6 | AN304: 160 | AO304: -2.7000000000000003e-002 | AP304: 44 | AQ304: 永鼎转债!
A305: 304 | B305: 127013 | C305: 创维转债! | D305: 810 | E305: 创维数字 | F305: 电子 | G305: 电子产品 | H305: 132.228 | I305: -2.0499999999999997e-002 | J305: 9.300000000000001e-003 | K305: 13.26 | L305: -1.7000000000000001e-002 | M305: 117.3 | N305: 11.29 | O305: 0.126 | P305: 117.45 | Q305: 已到 | R305: 3年41天 | S305: 1年41天 | T305: 9.78 | U305: 113 | V305: 8.5999999999999993e-002 | W305: 6.9000000000000006e-002 | X305: 8.1000000000000003e-002 | Y305: 141 | Z305: 3.33 | AA305: -3.85e-002 | AB305: -4.7699999999999992e-002 | AC305: -0.16899999999999998 | AD305: -0.17199999999999999 | AE305: 97.94 | AF305: 104.41 | AG305: 0.66 | AH305: AA | AI305: 3.9e-002 | AJ305: =H305+100*O305 -> 144.828 | AK305: 147 | AL305: 101 | AM305: 42.6 | AN305: 47 | AO305: 8.5000000000000006e-002 | AP305: 25 | AQ305: 创维转债!
A306: 305 | B306: 113026 | C306: 核能转债!!* | D306: 601985 | E306: 中国核电 | F306: 能源电力 | G306: 核电 | H306: 134.91 | I306: 2.8000000000000004e-003 | J306: -1.5e-003 | K306: 7.77 | L306: 1.2999999999999999e-003 | M306: 109.3 | N306: 5.73 | O306: -5.0000000000000001e-003 | P306: 135.6 | Q306: 已到 | R306: 4.1天 | S306: 无权 | T306: 27.7 | U306: 661 | V306: 0.17600000000000002 | W306: 2.e-002 | X306: 2.7000000000000003e-002 | Y306: 1397. | Z306: 2.11 | AA306: <-100% | AB306: <-100% | AC306: 无权 | AD306: 无权 | AE306: 无权 | AF306: 100.87 | AG306: 1 | AH306: AAA | AI306: 2.5099999999999997e-002 | AJ306: =H306+100*O306 -> 134.41 | AK306: 134.2 | AL306: 11 | AM306: 33.3 | AN306: 11 | AO306: 5.9999999999999998e-002 | AP306: 36 | AQ306: 核能转债!!*
A307: 306 | B307: 113025 | C307: 明泰转债!! | D307: 601677 | E307: 明泰铝业 | F307: 有色金属 | G307: 铝金属 | H307: 385.96 | I307: -9.3000000000000013e-002 | J307: 1.6000000000000001e-003 | K307: 39.6 | L307: -9.2600000000000002e-002 | M307: 114.5 | N307: 11 | O307: 7.2000000000000008e-002 | P307: 360 | Q307: 已到 | R307: 3年36天 | S307: 1年36天 | T307: 11 | U307: 580 | V307: 0.13300000000000001 | W307: 4.0999999999999995e-002 | X307: 0.14599999999999999 | Y307: 270 | Z307: 2.69 | AA307: -0.32899999999999996 | AB307: -0.33299999999999996 | AC307: -0.56600000000000006 | AD307: -0.56600000000000006 | AE307: 98.03 | AF307: 101.98 | AG307: 0.99 | AH307: AA | AI307: 3.9e-002 | AJ307: =H307+100*O307 -> 393.15999999999997 | AK307: 411.9 | AL307: 375 | AM307: 309.9 | AN307: 375 | AO307: -0.10400000000000001 | AP307: 17 | AQ307: 明泰转债!!
A308: 307 | B308: 113534 | C308: 鼎胜转债!! | D308: 603876 | E308: 鼎胜新材 | F308: 有色金属 | G308: 小金属 | H308: 256.51 | I308: -2.9999999999999999e-002 | J308: 1.5e-003 | K308: 36.5 | L308: -2.8999999999999998e-002 | M308: 114.3 | N308: 15.18 | O308: 6.7000000000000004e-002 | P308: 240.45 | Q308: 已到 | R308: 3年35天 | S308: 1年35天 | T308: 4.04 | U308: 96 | V308: 9.1999999999999998e-002 | W308: 2.3e-002 | X308: 5.5e-002 | Y308: 177 | Z308: 3.79 | AA308: -0.23300000000000001 | AB308: -0.23899999999999999 | AC308: -0.46399999999999997 | AD308: -0.46500000000000002 | AE308: 95.59 | AF308: 95.84 | AG308: 0.98 | AH308: AA- | AI308: 5.9999999999999998e-002 | AJ308: =H308+100*O308 -> 263.20999999999998 | AK308: 272.6 | AL308: 366 | AM308: 176.7 | AN308: 365 | AO308: 4.0000000000000001e-003 | AP308: 26 | AQ308: 鼎胜转债!!
A309: 308 | B309: 113024 | C309: 核建转债! | D309: 601611 | E309: 中国核建 | F309: 建筑 | G309: 建筑工程 | H309: 121.13 | I309: -1.46e-002 | J309: 1.0500000000000001e-002 | K309: 9.27 | L309: -8.6e-003 | M309: 109.3 | N309: 9.7 | O309: 0.26700000000000002 | P309: 95.57 | Q309: 已到 | R309: 3年34天 | S309: 1年34天 | T309: 30 | U309: 39 | V309: 1.1000000000000001e-002 | W309: 0.122 | X309: 0.11699999999999999 | Y309: 246 | Z309: 1.97 | AA309: -3.3399999999999999e-002 | AB309: -3.8699999999999998e-002 | AC309: -0.11699999999999999 | AD309: -0.12 | AE309: 98.84 | AF309: 99.38 | AG309: 0.47 | AH309: AAA | AI309: 3.2000000000000001e-002 | AJ309: =H309+100*O309 -> 147.82999999999998 | AK309: 146.7 | AL309: 97 | AM309: 47.3 | AN309: 72 | AO309: 2.e-002 | AP309: 30 | AQ309: 核建转债!
A310: 309 | B310: 128063 | C310: 未来转债! | D310: 2631 | E310: 德尔未来 | F310: 其他 | G310: 家居用品 | H310: 119.09 | I310: -2.3e-003 | J310: -1.e-003 | K310: 6.6 | L310: -1.7899999999999999e-002 | M310: 127.5 | N310: 8.64 | O310: 0.55899999999999994 | P310: 76.39 | Q310: 已到 | R310: 3年29天 | S310: 2年29天 | T310: 6.29 | U310: 3.1 | V310: 4.0000000000000001e-003 | W310: 0.14499999999999999 | X310: 0.111 | Y310: 43 | Z310: 2.54 | AA310: 2.3199999999999998e-002 | AB310: 8.1000000000000013e-003 | AC310: -4.2999999999999997e-002 | AD310: -4.9299999999999997e-002 | AE310: 95.25 | AF310: 107.23 | AG310: 0.18 | AH310: AA- | AI310: 5.9999999999999998e-002 | AJ310: =H310+100*O310 -> 174.99000000000001 | AK310: 161.8 | AL310: 250 | AM310: 54.6 | AN310: 136 | AO310: -2.e-002 | AP310: 36 | AQ310: 未来转债!
A311: 310 | B311: 113532 | C311: 海环转债! | D311: 603817 | E311: 海峡环保 | F311: 城市公用 | G311: 三废处理 | H311: 116.1 | I311: -1.1200000000000002e-002 | J311: 2.3e-003 | K311: 6.91 | L311: -2.2599999999999999e-002 | M311: 112.3 | N311: 7.63 | O311: 0.28199999999999997 | P311: 90.56 | Q311: 已到 | R311: 3年28天 | S311: 1年28天 | T311: 4.59 | U311: 19 | V311: 3.6000000000000004e-002 | W311: 0.14699999999999999 | X311: 0.13400000000000001 | Y311: 31 | Z311: 1.71 | AA311: -1.1000000000000001e-002 | AB311: -1.8200000000000001e-002 | AC311: -9.4100000000000003e-002 | AD311: -9.8000000000000004e-002 | AE311: 98.08 | AF311: 100.11 | AG311: 0.39 | AH311: AA | AI311: 3.9e-002 | AJ311: =H311+100*O311 -> 144.29999999999998 | AK311: 141.6 | AL311: 54 | AM311: 41.5 | AN311: 42 | AO311: 1.8000000000000002e-002 | AP311: 36 | AQ311: 海环转债!
A312: 311 | B312: 128062 | C312: 亚药转债! | D312: 2370 | E312: 亚太药业 | F312: 医药 | G312: 化学制药 | H312: 102.02 | I312: -7.8000000000000005e-003 | J312: 7.7000000000000002e-003 | K312: 6.1 | L312: -1.29e-002 | M312: 119.3 | N312: 16.25 | O312: 1.72 | P312: 37.54 | Q312: 已到 | R312: 3年28天 | S312: 1年28天 | T312: 9.62 | U312: 67 | V312: 6.8000000000000005e-002 | W312: 0.29399999999999998 | X312: 0.11 | Y312: 33 | Z312: 9.05 | AA312: 5.3399999999999996e-002 | AB312: 4.1799999999999997e-002 | AC312: 6.1999999999999998e-003 | AD312: 1.7000000000000001e-003 | AE312: 84.68 | AF312: 74.3 | AG312: 0.01 | AH312: B | AI312: 0.17100000000000001 | AJ312: =H312+100*O312 -> 274.01999999999998 | AK312: 166.5 | AL312: 288 | AM312: 81.8 | AN312: 313 | AO312: 8.9999999999999997e-002 | AP312: 97 | AQ312: 亚药转债!
A313: 312 | B313: 110057 | C313: 现代转债 | D313: 600420 | E313: 国药现代 | F313: 医药 | G313: 化学制药 | H313: 118.48 | I313: -4.0000000000000001e-003 | J313: 1.0700000000000001e-002 | K313: 9.49 | L313: 1.3899999999999999e-002 | M313: 110.3 | N313: 9.79 | O313: 0.222 | P313: 96.94 | Q313: 已到 | R313: 3年27天 | S313: 1年27天 | T313: 16.2 | U313: 53 | V313: 2.7000000000000003e-002 | W313: 0.16600000000000001 | X313: 0.161 | Y313: 97 | Z313: 1.16 | AA313: -2.35e-002 | AB313: -2.9500000000000002e-002 | AC313: -0.10400000000000001 | AD313: -0.10800000000000001 | AE313: 98.9 | AF313: 100.35 | AG313: 0.48 | AH313: AAA | AI313: 3.2000000000000001e-002 | AJ313: =H313+100*O313 -> 140.68000000000001 | AK313: 140 | AL313: 39 | AM313: 39.7 | AN313: 37 | AO313: 3.9e-002 | AP313: 23 | AQ313: 现代转债
A314: 313 | B314: 123025 | C314: 精测转债!! | D314: 300567 | E314: 精测电子 | F314: 电子 | G314: 液晶显示 | H314: 131.88 | I314: -2.7099999999999999e-002 | J314: 2.5699999999999997e-002 | K314: 51.65 | L314: -2.3e-003 | M314: 116.5 | N314: 49.37 | O314: 0.26100000000000001 | P314: 104.62 | Q314: 已到 | R314: 3年24天 | S314: 1年24天 | T314: 3.09 | U314: 20 | V314: 4.9000000000000002e-002 | W314: 2.1000000000000001e-002 | X314: 2.2000000000000002e-002 | Y314: 144 | Z314: 4.45 | AA314: -4.0500000000000001e-002 | AB314: -4.9400000000000006e-002 | AC314: -0.17499999999999999 | AD314: -0.17800000000000002 | AE314: 95.79 | AF314: 97.86 | AG314: 0.58 | AH314: AA- | AI314: 5.9999999999999998e-002 | AJ314: =H314+100*O314 -> 157.97999999999999 | AK314: 159.1 | AL314: 221 | AM314: 61.3 | AN314: 190 | AO314: -2.9999999999999999e-002 | AP314: 14 | AQ314: 精测转债!!
A315: 314 | B315: 113530 | C315: 大丰转债! | D315: 603081 | E315: 大丰实业 | F315: 建筑 | G315: 装饰工程 | H315: 116.31 | I315: -1.6200000000000003e-002 | J315: 1.2e-002 | K315: 12.51 | L315: -2.87e-002 | M315: 121 | N315: 16.3 | O315: 0.51500000000000001 | P315: 76.75 | Q315: 已到 | R315: 3年22天 | S315: 1年22天 | T315: 6.3 | U315: 12 | V315: 1.6e-002 | W315: 0.12300000000000001 | X315: 9.4e-002 | Y315: 51 | Z315: 2.15 | AA315: 1.3300000000000001e-002 | AB315: 1.4000000000000002e-003 | AC315: -9.5899999999999999e-002 | AD315: -9.9900000000000003e-002 | AE315: 98.25 | AF315: 107.93 | AG315: 0.14 | AH315: AA | AI315: 3.9e-002 | AJ315: =H315+100*O315 -> 167.81 | AK315: 155.9 | AL315: 197 | AM315: 47.9 | AN315: 76 | AO315: -4.0000000000000001e-002 | AP315: 30 | AQ315: 大丰转债!
A316: 315 | B316: 127012 | C316: 招路转债! | D316: 1965 | E316: 招商公路 | F316: 机场高速 | G316: 高速 | H316: 118.4 | I316: -7.9000000000000008e-003 | J316: 1.0800000000000001e-002 | K316: 8.2 | L316: 6.0999999999999995e-003 | M316: 107.9 | N316: 8.63 | O316: 0.24600000000000002 | P316: 95.02 | Q316: 已到 | R316: 3年17天 | S316: 1年17天 | T316: 50 | U316: 50 | V316: 8.0000000000000002e-003 | W316: 9.9000000000000005e-002 | X316: 9.4e-002 | Y316: 507 | Z316: 0.98 | AA316: -3.0499999999999999e-002 | AB316: -3.5099999999999999e-002 | AC316: -0.114 | AD316: -0.11599999999999999 | AE316: 97.86 | AF316: 98.17 | AG316: 0.47 | AH316: AAA | AI316: 3.2000000000000001e-002 | AJ316: =H316+100*O316 -> 143. | AK316: 141.8 | AL316: 56 | AM316: 43.6 | AN316: 51 | AO316: -2.7000000000000003e-002 | AP316: 26 | AQ316: 招路转债!
A317: 316 | B317: 123024 | C317: 岱勒转债!! | D317: 300700 | E317: 岱勒新材 | F317: 机械装备 | G317: 专用设备 | H317: 147.5 | I317: -4.6900000000000004e-002 | J317: -2.0999999999999999e-003 | K317: 20.49 | L317: -5.45e-002 | M317: 112.5 | N317: 14.1 | O317: 1.4999999999999999e-002 | P317: 145.32 | Q317: 已到 | R317: 2年16天 | S317: 16天 | T317: 2.1 | U317: 181 | V317: 0.57499999999999996 | W317: 9.5000000000000001e-002 | X317: 0.13900000000000001 | Y317: 22 | Z317: 4.63 | AA317: -0.126 | AB317: -0.13500000000000001 | AC317: <-100% | AD317: <-100% | AE317: 99.86 | AF317: 98.48 | AG317: 0.9 | AH317: A+ | AI317: 6.8400000000000002e-002 | AJ317: =H317+100*O317 -> 149. | AK317: 149.7 | AL317: 131 | AM317: 49.8 | AN317: 92 | AO317: -9.6000000000000002e-002 | AP317: 36 | AQ317: 岱勒转债!!
A318: 317 | B318: 123023 | C318: 迪森转债! | D318: 300335 | E318: 迪森股份 | F318: 能源电力 | G318: 电力供应 | H318: 112.591 | I318: -1.23e-002 | J318: 6.4000000000000003e-003 | K318: 5.38 | L318: -2.e-002 | M318: 114.3 | N318: 6.89 | O318: 0.442 | P318: 78.08 | Q318: 已到 | R318: 3年15天 | S318: 2年15天 | T318: 5.29 | U318: 8.3 | V318: 1.3999999999999999e-002 | W318: 0.26400000000000001 | X318: 0.20600000000000002 | Y318: 20 | Z318: 1.48 | AA318: 5.1000000000000004e-003 | AB318: -3.4000000000000002e-003 | AC318: -3.32e-002 | AD318: -3.7000000000000005e-002 | AE318: 92.22 | AF318: 96.14 | AG318: 0.3 | AH318: AA- | AI318: 5.9999999999999998e-002 | AJ318: =H318+100*O318 -> 156.791 | AK318: 147.1 | AL318: 103 | AM318: 51 | AN318: 106 | AO318: 4.0999999999999995e-002 | AP318: 52 | AQ318: 迪森转债!
A319: 318 | B319: 110056 | C319: 亨通转债! | D319: 600487 | E319: 亨通光电 | F319: 通信互联 | G319: 通信设备 | H319: 125.88 | I319: -1.3500000000000002e-002 | J319: 8.199999999999999e-003 | K319: 14.6 | L319: -1.2199999999999999e-002 | M319: 114.3 | N319: 14.95 | O319: 0.28899999999999998 | P319: 97.66 | Q319: 已到 | R319: 3年14天 | S319: 1年14天 | T319: 17.1 | U319: 24 | V319: 1.1000000000000001e-002 | W319: 5.0000000000000003e-002 | X319: 4.8000000000000001e-002 | Y319: 345 | Z319: 1.67 | AA319: -3.1899999999999998e-002 | AB319: -4.0000000000000001e-002 | AC319: -0.14999999999999999 | AD319: -0.153 | AE319: 98.79 | AF319: 103.5 | AG319: 0.44 | AH319: AA+ | AI319: 3.4000000000000002e-002 | AJ319: =H319+100*O319 -> 154.78 | AK319: 154.1 | AL319: 180 | AM319: 50.6 | AN319: 98 | AO319: 6.0000000000000001e-003 | AP319: 23 | AQ319: 亨通转债!
A320: 319 | B320: 123022 | C320: 长信转债!! | D320: 300088 | E320: 长信科技 | F320: 通信互联 | G320: 通信设备 | H320: 175 | I320: -2.18e-002 | J320: 8.1000000000000013e-003 | K320: 9.13 | L320: -1.5100000000000001e-002 | M320: 114.3 | N320: 6.05 | O320: 0.16 | P320: 150.91 | Q320: 已到 | R320: 3年13天 | S320: 1年13天 | T320: 2.56 | U320: 145 | V320: 0.32000000000000001 | W320: 1.1000000000000001e-002 | X320: 1.7000000000000001e-002 | Y320: 224 | Z320: 2.97 | AA320: -0.13300000000000001 | AB320: -0.14000000000000001 | AC320: -0.33799999999999997 | AD320: -0.34000000000000002 | AE320: 98.23 | AF320: 102.04 | AG320: 0.9 | AH320: AA | AI320: 3.9e-002 | AJ320: =H320+100*O320 -> 191. | AK320: 199.1 | AL320: 342 | AM320: 97 | AN320: 336 | AO320: -6.7000000000000004e-002 | AP320: 11 | AQ320: 长信转债!!
A321: 320 | B321: 110055 | C321: 伊力转债!! | D321: 600197 | E321: 伊力特 | F321: 食品饮料 | G321: 白酒 | H321: 180.16 | I321: -2.0099999999999996e-002 | J321: 4.0000000000000002e-004 | K321: 26.55 | L321: -2.1000000000000001e-002 | M321: 114.3 | N321: 16.41 | O321: 0.114 | P321: 161.79 | Q321: 已到 | R321: 3年10天 | S321: 1年10天 | T321: 2.44 | U321: 320 | V321: 0.71299999999999997 | W321: 1.9e-002 | X321: 3.1e-002 | Y321: 125 | Z321: 3.48 | AA321: -0.14199999999999999 | AB321: -0.14899999999999999 | AC321: -0.35399999999999998 | AD321: -0.35600000000000004 | AE321: 98.26 | AF321: 102.08 | AG321: 0.93 | AH321: AA | AI321: 3.9e-002 | AJ321: =H321+100*O321 -> 191.56 | AK321: 198.5 | AL321: 340 | AM321: 96.5 | AN321: 333 | AO321: 9.1999999999999998e-002 | AP321: 19 | AQ321: 伊力转债!!
A322: 321 | B322: 110053 | C322: 苏银转债! | D322: 600919 | E322: 江苏银行 | F322: 金融 | G322: 银行行业 | H322: 122.2 | I322: -7.0999999999999995e-003 | J322: 8.6999999999999994e-003 | K322: 6.94 | L322: 2.8999999999999998e-003 | M322: 118.3 | N322: 6.37 | O322: 0.122 | P322: 108.95 | Q322: 已到 | R322: 3年9天 | S322: 无权 | T322: 200 | U322: 137 | V322: 6.0000000000000001e-003 | W322: 0.19500000000000001 | X322: 0.21299999999999999 | Y322: 1025. | Z322: 0.7 | AA322: -1.1000000000000001e-002 | AB322: -2.1499999999999998e-002 | AC322: 无权 | AD322: 无权 | AE322: 无权 | AF322: 107.92 | AG322: 0.55 | AH322: AAA | AI322: 3.2000000000000001e-002 | AJ322: =H322+100*O322 -> 134.40000000000001 | AK322: 135.5 | AL322: 16 | AM322: 27.5 | AN322: 4 | AO322: 2.1000000000000001e-002 | AP322: 33 | AQ322: 苏银转债!
A323: 322 | B323: 110052 | C323: 贵广转债! | D323: 600996 | E323: 贵广网络 | F323: 传媒娱乐 | G323: 影视娱乐 | H323: 122.96 | I323: -3.78e-002 | J323: -2.e-003 | K323: 8.83 | L323: -6.8600000000000008e-002 | M323: 117.7 | N323: 7.94 | O323: 0.106 | P323: 111.21 | Q323: 已到 | R323: 3年0.1天 | S323: 1年0.1天 | T323: 14.2 | U323: 1051. | V323: 0.59499999999999997 | W323: 0.153 | X323: 0.17000000000000001 | Y323: 93 | Z323: 2.42 | AA323: -1.4800000000000001e-002 | AB323: -2.4900000000000002e-002 | AC323: -0.13699999999999998 | AD323: -0.14099999999999999 | AE323: 99.14 | AF323: 106.73 | AG323: 0.58 | AH323: AA+ | AI323: 3.4000000000000002e-002 | AJ323: =H323+100*O323 -> 133.56 | AK323: 134.7 | AL323: 14 | AM323: 28 | AN323: 5 | AO323: 5.7000000000000002e-002 | AP323: 36 | AQ323: 贵广转债!
A324: 323 | B324: 113021 | C324: XD中信转! | D324: 601998 | E324: 中信银行 | F324: 金融 | G324: 银行行业 | H324: 108.72 | I324: -1.5e-003 | J324: 1.5e-003 | K324: 4.66 | L324: 0. | M324: 118 | N324: 6.73 | O324: 0.56999999999999995 | P324: 69.24 | Q324: 已到 | R324: 2.997年 | S324: 无权 | T324: 400 | U324: 68 | V324: 2.e-003 | W324: 0.17499999999999999 | X324: 0.121 | Y324: 2280. | Z324: 0.46 | AA324: 2.3900000000000001e-002 | AB324: 1.38e-002 | AC324: 无权 | AD324: 无权 | AE324: 无权 | AF324: 106.23 | AG324: 0.09 | AH324: AAA | AI324: 3.2000000000000001e-002 | AJ324: =H324+100*O324 -> 165.72 | AK324: 148.2 | AL324: 116 | AM324: 42 | AN324: 44 | AO324: -1.3999999999999999e-002 | AP324: 38 | AQ324: XD中信转!
A325: 324 | B325: 128056 | C325: 今飞转债! | D325: 2863 | E325: 今飞凯达 | F325: 汽车 | G325: 零部件制 | H325: 118.77 | I325: -3.8e-003 | J325: -1.8e-003 | K325: 5.36 | L325: -1.83e-002 | M325: 119 | N325: 6.69 | O325: 0.48200000000000004 | P325: 80.12 | Q325: 已到 | R325: 2.99年 | S325: 0.99年 | T325: 1.72 | U325: 4.1 | V325: 2.e-002 | W325: 6.4000000000000001e-002 | X325: 5.2000000000000005e-002 | Y325: 27 | Z325: 1.41 | AA325: 7.000000000000001e-004 | AB325: -1.03e-002 | AC325: -0.11900000000000001 | AD325: -0.122 | AE325: 94.68 | AF325: 97.98 | AG325: 0.3 | AH325: A+ | AI325: 6.8400000000000002e-002 | AJ325: =H325+100*O325 -> 166.97 | AK325: 157.4 | AL325: 205 | AM325: 59.4 | AN325: 176 | AO325: -1.8000000000000002e-002 | AP325: 46 | AQ325: 今飞转债!
A326: 325 | B326: 128053 | C326: 尚荣转债! | D326: 2551 | E326: 尚荣医疗 | F326: 医药 | G326: 医疗器械 | H326: 133.5 | I326: 2.3e-003 | J326: 9.8999999999999991e-003 | K326: 5.23 | L326: 1.3600000000000001e-002 | M326: 113.3 | N326: 4.88 | O326: 0.24600000000000002 | P326: 107.17 | Q326: 已到 | R326: 2.95年 | S326: 0.95年 | T326: 1.9 | U326: 749 | V326: 2.8700000000000001 | W326: 4.2999999999999997e-002 | X326: 4.5999999999999999e-002 | Y326: 44 | Z326: 1.4 | AA326: -5.4800000000000001e-002 | AB326: -6.2300000000000001e-002 | AC326: -0.20999999999999999 | AD326: -0.21299999999999999 | AE326: 97.83 | AF326: 102.11 | AG326: 0.89 | AH326: AA | AI326: 3.6400000000000002e-002 | AJ326: =H326+100*O326 -> 158.09999999999999 | AK326: 159.8 | AL326: 231 | AM326: 57.7 | AN326: 161 | AO326: 4.4000000000000004e-002 | AP326: 22 | AQ326: 尚荣转债!
A327: 326 | B327: 113527 | C327: 维格转债!! | D327: 603518 | E327: 锦泓集团 | F327: 服装纺织 | G327: 服装行业 | H327: 130.2 | I327: -9.0000000000000011e-003 | J327: 6.8999999999999999e-003 | K327: 10.95 | L327: -3.5999999999999999e-003 | M327: 118.5 | N327: 9.85 | O327: 0.17100000000000001 | P327: 111.17 | Q327: 已到 | R327: 2.89年 | S327: 0.89年 | T327: 2.86 | U327: 89 | V327: 0.23800000000000002 | W327: 8.8000000000000009e-002 | X327: 9.8000000000000004e-002 | Y327: 32 | Z327: 1.33 | AA327: -3.2500000000000001e-002 | AB327: -4.3099999999999999e-002 | AC327: -0.20499999999999999 | AD327: -0.20800000000000002 | AE327: 97.08 | AF327: 104.13 | AG327: 0.58 | AH327: AA | AI327: 4.6399999999999997e-002 | AJ327: =H327+100*O327 -> 147.29999999999998 | AK327: 149.2 | AL327: 130 | AM327: 45.1 | AN327: 61 | AO327: 1.6e-002 | AP327: 63 | AQ327: 维格转债!!
A328: 327 | B328: 113526 | C328: 联泰转债! | D328: 603797 | E328: 联泰环保 | F328: 城市公用 | G328: 三废处理 | H328: 231.05 | I328: -5.1000000000000004e-003 | J328: -7.000000000000001e-004 | K328: 6.57 | L328: -9.0000000000000011e-003 | M328: 109.3 | N328: 5.92 | O328: 1.0800000000000001 | P328: 110.98 | Q328: 已到 | R328: 2.89年 | S328: 0.89年 | T328: 1.93 | U328: 65 | V328: 0.14499999999999999 | W328: 5.0000000000000003e-002 | X328: 5.5999999999999994e-002 | Y328: 38 | Z328: 1.52 | AA328: -0.23100000000000001 | AB328: -0.23499999999999999 | AC328: -0.52800000000000002 | AD328: -0.52900000000000003 | AE328: 98.54 | AF328: 100.09 | AG328: 0.64 | AH328: AA+ | AI328: 3.1400000000000004e-002 | AJ328: =H328+100*O328 -> 339.05000000000001 | AK328: 351.1 | AL328: 372 | AM328: 251 | AN328: 371 | AO328: 1.4999999999999999e-002 | AP328: 7 | AQ328: 联泰转债!
A329: 328 | B329: 123018 | C329: 溢利转债! | D329: 300381 | E329: 溢多利 | F329: 医药 | G329: 原料药 | H329: 233 | I329: 0.128 | J329: -9.6300000000000011e-002 | K329: 10.81 | L329: 3.9399999999999998e-002 | M329: 113.3 | N329: 8.25 | O329: 0.77800000000000002 | P329: 131.03 | Q329: 已到 | R329: 2.79年 | S329: 0.79年 | T329: 0.54 | U329: 3907. | V329: 31.32 | W329: 1.e-002 | X329: 1.3000000000000001e-002 | Y329: 53 | Z329: 1.78 | AA329: -0.23000000000000001 | AB329: -0.23600000000000002 | AC329: -0.58899999999999997 | AD329: -0.58999999999999997 | AE329: 96.49 | AF329: 97.18 | AG329: 0.81 | AH329: AA- | AI329: 5.74e-002 | AJ329: =H329+100*O329 -> 310.80000000000001 | AK329: 335 | AL329: 370 | AM329: 237.8 | AN329: 370 | AO329: 2.e-002 | AP329: 9 | AQ329: 溢利转债!
A330: 329 | B330: 113525 | C330: 台华转债!! | D330: 603055 | E330: 台华新材 | F330: 服装纺织 | G330: 纺织行业 | H330: 193.16 | I330: -1.83e-002 | J330: 1.03e-002 | K330: 14.38 | L330: -8.3000000000000001e-003 | M330: 113.3 | N330: 7.78 | O330: 4.4999999999999998e-002 | P330: 184.83 | Q330: 已到 | R330: 2.79年 | S330: 0.79年 | T330: 1.82 | U330: 27 | V330: 7.4999999999999997e-002 | W330: 1.4999999999999999e-002 | X330: 2.7000000000000003e-002 | Y330: 125 | Z330: 3.49 | AA330: -0.17600000000000002 | AB330: -0.183 | AC330: -0.499 | AD330: -0.501 | AE330: 98.4 | AF330: 102.72 | AG330: 0.97 | AH330: AA | AI330: 3.6400000000000002e-002 | AJ330: =H330+100*O330 -> 197.66 | AK330: 201.5 | AL330: 345 | AM330: 98.8 | AN330: 340 | AO330: -4.2000000000000003e-002 | AP330: 17 | AQ330: 台华转债!!
A331: 330 | B331: 113524 | C331: 奇精转债! | D331: 603677 | E331: 奇精机械 | F331: 家电 | G331: 零部件制 | H331: 118.71 | I331: -1.3300000000000001e-002 | J331: 9.0000000000000011e-003 | K331: 12.8 | L331: -1.0800000000000001e-002 | M331: 116.3 | N331: 13.98 | O331: 0.29699999999999999 | P331: 91.56 | Q331: 已到 | R331: 2.78年 | S331: 0.78年 | T331: 3.3 | U331: 6.5 | V331: 1.6e-002 | W331: 0.13400000000000001 | X331: 0.12300000000000001 | Y331: 25 | Z331: 2.42 | AA331: -7.4999999999999997e-003 | AB331: -1.77e-002 | AC331: -0.152 | AD331: -0.155 | AE331: 96.58 | AF331: 99.83 | AG331: 0.4 | AH331: AA- | AI331: 5.74e-002 | AJ331: =H331+100*O331 -> 148.41 | AK331: 145.9 | AL331: 84 | AM331: 46 | AN331: 64 | AO331: 2.1000000000000001e-002 | AP331: 40 | AQ331: 奇精转债!
A332: 331 | B332: 110048 | C332: 福能转债!! | D332: 600483 | E332: 福能股份 | F332: 能源电力 | G332: 电力供应 | H332: 189.78 | I332: -4.7999999999999996e-003 | J332: -2.9999999999999997e-004 | K332: 13.06 | L332: -5.3e-003 | M332: 112.3 | N332: 7.85 | O332: 0.14099999999999999 | P332: 166.37 | Q332: 已到 | R332: 2.76年 | S332: 0.76年 | T332: 12.8 | U332: 176 | V332: 7.2999999999999995e-002 | W332: 5.0000000000000003e-002 | X332: 8.3000000000000004e-002 | Y332: 255 | Z332: 3.22 | AA332: -0.17499999999999999 | AB332: -0.182 | AC332: -0.505 | AD332: -0.50700000000000001 | AE332: 98.94 | AF332: 103.26 | AG332: 0.95 | AH332: AA+ | AI332: 3.1400000000000004e-002 | AJ332: =H332+100*O332 -> 203.88 | AK332: 213.2 | AL332: 351 | AM332: 109.9 | AN332: 347 | AO332: -1.2e-002 | AP332: 9 | AQ332: 福能转债!!
A333: 332 | B333: 128049 | C333: 华源转债! | D333: 2787 | E333: 华源控股 | F333: 造纸包装 | G333: 包装材料 | H333: 114.928 | I333: -1.06e-002 | J333: 4.3e-003 | K333: 6.14 | L333: -1.9199999999999998e-002 | M333: 113.5 | N333: 7.37 | O333: 0.38 | P333: 83.31 | Q333: 已到 | R333: 2.73年 | S333: 0.73年 | T333: 3.63 | U333: 2.4 | V333: 6.0000000000000001e-003 | W333: 0.187 | X333: 0.156 | Y333: 19 | Z333: 1.27 | AA333: -4.5999999999999999e-003 | AB333: -1.3500000000000002e-002 | AC333: -0.129 | AD333: -0.13200000000000001 | AE333: 96.87 | AF333: 97.7 | AG333: 0.33 | AH333: AA- | AI333: 5.74e-002 | AJ333: =H333+100*O333 -> 152.928 | AK333: 146.5 | AL333: 92 | AM333: 48.8 | AN333: 86 | AO333: 2.3e-002 | AP333: 43 | AQ333: 华源转债!
A334: 333 | B334: 110047 | C334: 山鹰转债 | D334: 600567 | E334: 山鹰国际 | F334: 造纸包装 | G334: 包装用纸 | H334: 118.29 | I334: -5.8999999999999999e-003 | J334: 2.5000000000000001e-003 | K334: 3.18 | L334: -9.300000000000001e-003 | M334: 116.5 | N334: 3.3 | O334: 0.22800000000000001 | P334: 96.36 | Q334: 已到 | R334: 2.72年 | S334: 0.72年 | T334: 22.5 | U334: 16 | V334: 6.0000000000000001e-003 | W334: 0.153 | X334: 0.14699999999999999 | Y334: 147 | Z334: 0.91 | AA334: -5.6999999999999993e-003 | AB334: -1.6299999999999999e-002 | AC334: -0.16 | AD334: -0.16399999999999998 | AE334: 99.1 | AF334: 107.27 | AG334: 0.36 | AH334: AA+ | AI334: 3.1400000000000004e-002 | AJ334: =H334+100*O334 -> 141.09 | AK334: 140.2 | AL334: 46 | AM334: 33 | AN334: 9 | AO334: -3.0000000000000001e-003 | AP334: 29 | AQ334: 山鹰转债
A335: 334 | B335: 128048 | C335: 张行转债 | D335: 2839 | E335: 张家港行 | F335: 金融 | G335: 银行行业 | H335: 127.171 | I335: -1.03e-002 | J335: 6.3e-003 | K335: 6.52 | L335: -6.0999999999999995e-003 | M335: 112.3 | N335: 5.6 | O335: 9.1999999999999998e-002 | P335: 116.43 | Q335: 已到 | R335: 2.69年 | S335: 无权 | T335: 25 | U335: 65 | V335: 2.e-002 | W335: 0.21199999999999999 | X335: 0.247 | Y335: 118 | Z335: 1.02 | AA335: -4.5899999999999996e-002 | AB335: -5.3600000000000002e-002 | AC335: 无权 | AD335: 无权 | AE335: 无权 | AF335: 103.48 | AG335: 0.66 | AH335: AA+ | AI335: 3.1400000000000004e-002 | AJ335: =H335+100*O335 -> 136.37100000000001 | AK335: 137.9 | AL335: 30 | AM335: 34.4 | AN335: 14 | AO335: 1.2e-002 | AP335: 12 | AQ335: 张行转债
A336: 335 | B336: 113519 | C336: 长久转债! | D336: 603569 | E336: 长久物流 | F336: 交通运输 | G336: 物流业 | H336: 131.39 | I336: -3.6900000000000002e-002 | J336: 6.7199999999999996e-002 | K336: 10.26 | L336: 9.9700000000000011e-002 | M336: 118.3 | N336: 11.04 | O336: 0.41399999999999998 | P336: 92.93 | Q336: 已到 | R336: 2.68年 | S336: 0.68年 | T336: 6.97 | U336: 6096. | V336: 6.2999999999999998 | W336: 0.121 | X336: 0.113 | Y336: 57 | Z336: 2.71 | AA336: -3.9e-002 | AB336: -5.0300000000000004e-002 | AC336: -0.27200000000000002 | AD336: -0.27500000000000002 | AE336: 98.78 | AF336: 107.66 | AG336: 0.3 | AH336: AA | AI336: 3.6400000000000002e-002 | AJ336: =H336+100*O336 -> 172.78999999999999 | AK336: 169.8 | AL336: 300 | AM336: 62.2 | AN336: 196 | AO336: 0.32200000000000001 | AP336: 29 | AQ336: 长久转债!
A337: 336 | B337: 128046 | C337: 利尔转债!! | D337: 2258 | E337: 利尔化学 | F337: 化工 | G337: 农化 | H337: 193 | I337: 1.1000000000000001e-003 | J337: 1.4000000000000002e-003 | K337: 35.6 | L337: 2.5000000000000001e-003 | M337: 111.3 | N337: 18.42 | O337: -1.e-003 | P337: 193.27 | Q337: 已到 | R337: 2.62年 | S337: 0.62年 | T337: 8.07 | U337: 228 | V337: 0.14599999999999999 | W337: 4.2999999999999997e-002 | X337: 8.3000000000000004e-002 | Y337: 188 | Z337: 4.34 | AA337: -0.192 | AB337: -0.19800000000000001 | AC337: -0.61499999999999999 | AD337: -0.61799999999999999 | AE337: 98.99 | AF337: 101.51 | AG337: 0.98 | AH337: AA | AI337: 3.6400000000000002e-002 | AJ337: =H337+100*O337 -> 192.90000000000001 | AK337: 192.7 | AL337: 337 | AM337: 91.2 | AN337: 327 | AO337: 0.10300000000000001 | AP337: 9 | AQ337: 利尔转债!!
A338: 337 | B338: 128044 | C338: 岭南转债! | D338: 2717 | E338: 岭南股份 | F338: 城市公用 | G338: 生态环境 | H338: 126.36 | I338: -1.1000000000000001e-003 | J338: 3.1899999999999998e-002 | K338: 4.02 | L338: 4.1500000000000002e-002 | M338: 110.3 | N338: 3.43 | O338: 7.8e-002 | P338: 117.2 | Q338: 已到 | R338: 2.44年 | S338: 0.44年 | T338: 6.58 | U338: 592 | V338: 0.70400000000000007 | W338: 9.6999999999999989e-002 | X338: 0.114 | Y338: 68 | Z338: 1.43 | AA338: -5.5e-002 | AB338: -6.2199999999999998e-002 | AC338: -0.33299999999999996 | AD338: -0.33799999999999997 | AE338: 98.4 | AF338: 96.48 | AG338: 0.74 | AH338: AA- | AI338: 5.74e-002 | AJ338: =H338+100*O338 -> 134.16 | AK338: 135.5 | AL338: 17 | AM338: 37.1 | AN338: 25 | AO338: -5.0000000000000001e-003 | AP338: 56 | AQ338: 岭南转债!
A339: 338 | B339: 123015 | C339: 蓝盾转债!! | D339: 300297 | E339: 蓝盾股份 | F339: 计算机及 | G339: 软件开发 | H339: 217.7 | I339: -2.98e-002 | J339: 2.98e-002 | K339: 3.14 | L339: -1.8799999999999997e-002 | M339: 111.3 | N339: 5.79 | O339: 3.0099999999999998 | P339: 54.23 | Q339: 已到 | R339: 2.44年 | S339: 0.44年 | T339: 1 | U339: 208 | V339: 0.94499999999999995 | W339: 2.6000000000000002e-002 | X339: 1.3999999999999999e-002 | Y339: 39 | Z339: 2.21 | AA339: -0.24299999999999999 | AB339: -0.249 | AC339: -0.91200000000000003 | AD339: -0.91500000000000004 | AE339: 95.13 | AF339: 85.14 | AG339: 0 | AH339: BBB- | AI339: 0.11840000000000001 | AJ339: =H339+100*O339 -> 518.70000000000005 | AK339: 381.2 | AL339: 373 | AM339: 286 | AN339: 373 | AO339: 1.e-003 | AP339: 14 | AQ339: 蓝盾转债!!
A340: 339 | B340: 113516 | C340: 苏农转债! | D340: 603323 | E340: 苏农银行 | F340: 金融 | G340: 银行行业 | H340: 120.41 | I340: -2.5699999999999997e-002 | J340: 1.83e-002 | K340: 5.46 | L340: -1.6200000000000003e-002 | M340: 113.3 | N340: 5.37 | O340: 0.184 | P340: 101.68 | Q340: 已到 | R340: 2.41年 | S340: 无权 | T340: 12.9 | U340: 35 | V340: 2.2000000000000002e-002 | W340: 0.13100000000000001 | X340: 0.13300000000000001 | Y340: 98 | Z340: 0.76 | AA340: -2.5399999999999999e-002 | AB340: -3.5000000000000003e-002 | AC340: 无权 | AD340: 无权 | AE340: 无权 | AF340: 105.3 | AG340: 0.46 | AH340: AA+ | AI340: 3.1400000000000004e-002 | AJ340: =H340+100*O340 -> 138.81 | AK340: 139.1 | AL340: 36 | AM340: 33.8 | AN340: 13 | AO340: -1.1000000000000001e-002 | AP340: 24 | AQ340: 苏农转债!
A341: 340 | B341: 123014 | C341: 凯发转债! | D341: 300407 | E341: 凯发电气 | F341: 能源电力 | G341: 电力设备 | H341: 136 | I341: -1.9199999999999998e-002 | J341: 4.3e-003 | K341: 8.91 | L341: -2.2000000000000002e-002 | M341: 107.5 | N341: 8.05 | O341: 0.22899999999999998 | P341: 110.68 | Q341: 已到 | R341: 1.39年 | S341: 回售内 | T341: 1.16 | U341: 16 | V341: 0.10099999999999999 | W341: 4.2999999999999997e-002 | X341: 4.7e-002 | Y341: 27 | Z341: 1.96 | AA341: -0.156 | AB341: -0.16500000000000001 | AC341: 回售内 | AD341: 回售内 | AE341: 100.25 | AF341: 98.12 | AG341: 0.68 | AH341: A+ | AI341: 6.8400000000000002e-002 | AJ341: =H341+100*O341 -> 158.90000000000001 | AK341: 161.3 | AL341: 246 | AM341: 61.1 | AN341: 188 | AO341: 3.4000000000000002e-002 | AP341: 16 | AQ341: 凯发转债!
A342: 341 | B342: 128042 | C342: 凯中转债! | D342: 2823 | E342: 凯中精密 | F342: 能源电力 | G342: 电力设备 | H342: 121.5 | I342: -4.0000000000000001e-003 | J342: 4.5000000000000005e-003 | K342: 10.18 | L342: 3.0000000000000001e-003 | M342: 115.3 | N342: 12.86 | O342: 0.53500000000000003 | P342: 79.16 | Q342: 已到 | R342: 2.40年 | S342: 0.40年 | T342: 4.16 | U342: 3.7 | V342: 6.9999999999999993e-003 | W342: 0.14199999999999999 | X342: 0.113 | Y342: 29 | Z342: 2.23 | AA342: -2.1899999999999999e-002 | AB342: -3.2899999999999999e-002 | AC342: -0.29999999999999999 | AD342: -0.30499999999999999 | AE342: 99.76 | AF342: 105.97 | AG342: 0.15 | AH342: AA | AI342: 3.6400000000000002e-002 | AJ342: =H342+100*O342 -> 175. | AK342: 163.8 | AL342: 273 | AM342: 57.9 | AN342: 162 | AO342: 1.8000000000000002e-002 | AP342: 25 | AQ342: 凯中转债!
A343: 342 | B343: 123013 | C343: 横河转债! | D343: 300539 | E343: 横河精密 | F343: 机械装备 | G343: 专用设备 | H343: 458.847 | I343: -4.3700000000000003e-002 | J343: 1.5700000000000002e-002 | K343: 9.23 | L343: -5.04e-002 | M343: 114 | N343: 9.04 | O343: 3.4900000000000002 | P343: 102.1 | Q343: 已到 | R343: 2.39年 | S343: 0.39年 | T343: 0.38 | U343: 1358. | V343: 7.5 | W343: 1.9e-002 | X343: 1.9e-002 | Y343: 21 | Z343: 4.16 | AA343: -0.41700000000000004 | AB343: -0.42100000000000004 | AC343: <-100% | AD343: <-100% | AE343: 98.48 | AF343: 97.66 | AG343: 0.55 | AH343: A+ | AI343: 6.8400000000000002e-002 | AJ343: =H343+100*O343 -> 807.84699999999998 | AK343: 815.6 | AL343: 382 | AM343: 717.1 | AN343: 382 | AO343: 8.199999999999999e-002 | AP343: 12 | AQ343: 横河转债!
A344: 343 | B344: 123012 | C344: 万顺转债! | D344: 300057 | E344: 万顺新材 | F344: 有色金属 | G344: 铝金属 | H344: 171.845 | I344: -5.0599999999999999e-002 | J344: 1.0500000000000001e-002 | K344: 8.62 | L344: -4.2199999999999994e-002 | M344: 109.3 | N344: 5.27 | O344: 5.0999999999999997e-002 | P344: 163.57 | Q344: 已到 | R344: 2.38年 | S344: 0.38年 | T344: 1.22 | U344: 120 | V344: 0.56200000000000006 | W344: 2.1000000000000001e-002 | X344: 3.4000000000000002e-002 | Y344: 59 | Z344: 1.63 | AA344: -0.17600000000000002 | AB344: -0.182 | AC344: -0.78900000000000003 | AD344: -0.79299999999999993 | AE344: 98.78 | AF344: 95.97 | AG344: 0.95 | AH344: AA- | AI344: 5.74e-002 | AJ344: =H344+100*O344 -> 176.94499999999999 | AK344: 180.1 | AL344: 325 | AM344: 81.3 | AN344: 310 | AO344: 2.5000000000000001e-002 | AP344: 23 | AQ344: 万顺转债!
A345: 344 | B345: 123011 | C345: 德尔转债! | D345: 300473 | E345: 德尔股份 | F345: 汽车 | G345: 零部件制 | H345: 116.349 | I345: -7.4999999999999997e-003 | J345: 4.5999999999999999e-003 | K345: 20.5 | L345: -3.1600000000000003e-002 | M345: 115.3 | N345: 31.38 | O345: 0.78099999999999992 | P345: 65.33 | Q345: 已到 | R345: 2.37年 | S345: 0.37年 | T345: 2.51 | U345: 4.2 | V345: 1.4999999999999999e-002 | W345: 9.0999999999999998e-002 | X345: 5.9000000000000004e-002 | Y345: 28 | Z345: 1.3 | AA345: -3.9000000000000003e-003 | AB345: -1.5300000000000001e-002 | AC345: -0.247 | AD345: -0.252 | AE345: 98.81 | AF345: 101.26 | AG345: 0.09 | AH345: AA- | AI345: 5.74e-002 | AJ345: =H345+100*O345 -> 194.44900000000001 | AK345: 167.4 | AL345: 294 | AM345: 66.1 | AN345: 229 | AO345: -5.0999999999999997e-002 | AP345: 37 | AQ345: 德尔转债!
A346: 345 | B346: 128041 | C346: 盛路转债!! | D346: 2446 | E346: 盛路通信 | F346: 通信互联 | G346: 通信设备 | H346: 271.1 | I346: -2.4799999999999999e-002 | J346: 1.41e-002 | K346: 6.08 | L346: -3.0299999999999997e-002 | M346: 113.3 | N346: 6.82 | O346: 2.04 | P346: 89.15 | Q346: 已到 | R346: 2.37年 | S346: 0.37年 | T346: 0.53 | U346: 223 | V346: 1.53 | W346: 1.e-002 | X346: 9.0000000000000011e-003 | Y346: 55 | Z346: 1.8 | AA346: -0.312 | AB346: -0.318 | AC346: <-100% | AD346: <-100% | AE346: 99.88 | AF346: 104.27 | AG346: 0.35 | AH346: AA | AI346: 3.6400000000000002e-002 | AJ346: =H346+100*O346 -> 475.10000000000002 | AK346: 453.1 | AL346: 379 | AM346: 348.8 | AN346: 378 | AO346: -4.0999999999999995e-002 | AP346: 11 | AQ346: 盛路转债!!
A347: 346 | B347: 110045 | C347: 海澜转债! | D347: 600398 | E347: 海澜之家 | F347: 服装纺织 | G347: 服装行业 | H347: 112.96 | I347: -8.8999999999999999e-003 | J347: 1.1399999999999999e-002 | K347: 6.11 | L347: 9.8999999999999991e-003 | M347: 110.3 | N347: 7.04 | O347: 0.30199999999999999 | P347: 86.79 | Q347: 已到 | R347: 2.36年 | S347: 0.36年 | T347: 29.5 | U347: 9 | V347: 3.0000000000000001e-003 | W347: 0.11199999999999999 | X347: 9.6999999999999989e-002 | Y347: 264 | Z347: 1.87 | AA347: -1.0200000000000001e-002 | AB347: -1.8100000000000002e-002 | AC347: -0.21100000000000002 | AD347: -0.215 | AE347: 99.6 | AF347: 102.65 | AG347: 0.26 | AH347: AA+ | AI347: 3.1400000000000004e-002 | AJ347: =H347+100*O347 -> 143.16 | AK347: 139.1 | AL347: 35 | AM347: 36.5 | AN347: 22 | AO347: -8.0000000000000002e-003 | AP347: 42 | AQ347: 海澜转债!
A348: 347 | B348: 123010 | C348: 博世转债! | D348: 300422 | E348: 博世科 | F348: 城市公用 | G348: 三废处理 | H348: 112.956 | I348: -7.4999999999999997e-003 | J348: 5.1999999999999998e-003 | K348: 7.69 | L348: -2.0400000000000001e-002 | M348: 111.3 | N348: 11.26 | O348: 0.65400000000000003 | P348: 68.29 | Q348: 已到 | R348: 2.33年 | S348: 0.33年 | T348: 4.3 | U348: 4 | V348: 8.0000000000000002e-003 | W348: 0.111 | X348: 7.5999999999999998e-002 | Y348: 39 | Z348: 1.2 | AA348: -6.4000000000000003e-003 | AB348: -1.52e-002 | AC348: -0.20999999999999999 | AD348: -0.21600000000000003 | AE348: 99.01 | AF348: 97.95 | AG348: 0.11 | AH348: AA- | AI348: 5.74e-002 | AJ348: =H348+100*O348 -> 178.35599999999999 | AK348: 157.6 | AL348: 207 | AM348: 58.6 | AN348: 167 | AO348: -2.2000000000000002e-002 | AP348: 35 | AQ348: 博世转债!
A349: 348 | B349: 127007 | C349: 湖广转债!! | D349: 665 | E349: 湖北广电 | F349: 传媒娱乐 | G349: 影视娱乐 | H349: 142.858 | I349: 5.5000000000000005e-003 | J349: 2.6000000000000002e-002 | K349: 7.32 | L349: 3.8300000000000001e-002 | M349: 111.3 | N349: 5.58 | O349: 8.900000000000001e-002 | P349: 131.18 | Q349: 已到 | R349: 2.32年 | S349: 0.32年 | T349: 4.14 | U349: 3333. | V349: 5.4800000000000004 | W349: 5.5999999999999994e-002 | X349: 7.2999999999999995e-002 | Y349: 74 | Z349: 1.27 | AA349: -0.10400000000000001 | AB349: -0.11199999999999999 | AC349: -0.63100000000000001 | AD349: -0.63600000000000001 | AE349: 100.3 | AF349: 103.75 | AG349: 0.82 | AH349: AA+ | AI349: 3.1400000000000004e-002 | AJ349: =H349+100*O349 -> 151.75800000000001 | AK349: 154.5 | AL349: 187 | AM349: 50.8 | AN349: 102 | AO349: -8.3000000000000004e-002 | AP349: 32 | AQ349: 湖广转债!!
A350: 349 | B350: 110044 | C350: 广电转债!! | D350: 600831 | E350: 广电网络 | F350: 传媒娱乐 | G350: 影视娱乐 | H350: 249.49 | I350: 1.8700000000000001e-002 | J350: -1.38e-002 | K350: 6.97 | L350: 1.01e-002 | M350: 111.3 | N350: 6.87 | O350: 1.46 | P350: 101.46 | Q350: 已到 | R350: 2.31年 | S350: 0.31年 | T350: 0.71 | U350: 2548. | V350: 14.06 | W350: 1.3999999999999999e-002 | X350: 1.4999999999999999e-002 | Y350: 50 | Z350: 1.32 | AA350: -0.29799999999999999 | AB350: -0.30399999999999999 | AC350: <-100% | AD350: <-100% | AE350: 100.08 | AF350: 102.63 | AG350: 0.49 | AH350: AA | AI350: 3.6400000000000002e-002 | AJ350: =H350+100*O350 -> 395.49000000000001 | AK350: 397.5 | AL350: 374 | AM350: 294.9 | AN350: 374 | AO350: 8.199999999999999e-002 | AP350: 10 | AQ350: 广电转债!!
A351: 350 | B351: 128040 | C351: 华通转债!! | D351: 2758 | E351: 浙农股份 | F351: 医药 | G351: 医药商业 | H351: 185 | I351: -8.1000000000000003e-002 | J351: 3.8300000000000001e-002 | K351: 17.11 | L351: -4.4699999999999997e-002 | M351: 111.3 | N351: 10.03 | O351: 8.4000000000000005e-002 | P351: 170.59 | Q351: 已到 | R351: 2.28年 | S351: 0.28年 | T351: 2.01 | U351: 11680. | V351: 27.149999999999999 | W351: 2.3e-002 | X351: 4.0000000000000001e-002 | Y351: 86 | Z351: 2.55 | AA351: -0.20300000000000001 | AB351: -0.20999999999999999 | AC351: <-100% | AD351: <-100% | AE351: 100.21 | AF351: 102.76 | AG351: 0.96 | AH351: AA | AI351: 3.6400000000000002e-002 | AJ351: =H351+100*O351 -> 193.40000000000001 | AK351: 199.4 | AL351: 343 | AM351: 96.7 | AN351: 334 | AO351: 0.187 | AP351: 32 | AQ351: 华通转债!!
A352: 351 | B352: 128039 | C352: 三力转债! | D352: 2224 | E352: 三 力 士 | F352: 机械装备 | G352: 专用设备 | H352: 120.838 | I352: -9.4999999999999998e-003 | J352: 5.0000000000000001e-004 | K352: 5.44 | L352: -1.9799999999999998e-002 | M352: 108.8 | N352: 5.79 | O352: 0.28600000000000003 | P352: 93.96 | Q352: 已到 | R352: 2.26年 | S352: 0.26年 | T352: 2.02 | U352: 4.9 | V352: 2.e-002 | W352: 5.0999999999999997e-002 | X352: 4.8000000000000001e-002 | Y352: 40 | Z352: 1.66 | AA352: -4.6100000000000002e-002 | AB352: -5.2900000000000003e-002 | AC352: -0.39899999999999997 | AD352: -0.40500000000000003 | AE352: 99.17 | AF352: 96.11 | AG352: 0.46 | AH352: AA- | AI352: 5.74e-002 | AJ352: =H352+100*O352 -> 149.43799999999999 | AK352: 147.7 | AL352: 111 | AM352: 48.6 | AN352: 84 | AO352: 5.0000000000000001e-003 | AP352: 31 | AQ352: 三力转债!
A353: 352 | B353: 128036 | C353: 金农转债!! | D353: 2548 | E353: 金新农 | F353: 农业 | G353: 畜牧业 | H353: 137.247 | I353: 2.7000000000000001e-003 | J353: -2.8000000000000004e-003 | K353: 7.24 | L353: -6.8999999999999999e-003 | M353: 109.3 | N353: 6.93 | O353: 0.314 | P353: 104.47 | Q353: 已到 | R353: 2年4.1天 | S353: 4.1天 | T353: 1.46 | U353: 453 | V353: 2.27 | W353: 2.8999999999999998e-002 | X353: 2.9999999999999999e-002 | Y353: 50 | Z353: 2.14 | AA353: -0.109 | AB353: -0.11599999999999999 | AC353: <-100% | AD353: <-100% | AE353: 100.81 | AF353: 97.95 | AG353: 0.02 | AH353: AA- | AI353: 5.74e-002 | AJ353: =H353+100*O353 -> 168.64700000000002 | AK353: 170 | AL353: 303 | AM353: 69.2 | AN353: 258 | AO353: 4.8000000000000001e-002 | AP353: 17 | AQ353: 金农转债!!
A354: 353 | B354: 128037 | C354: 岩土转债! | D354: 2542 | E354: 中化岩土 | F354: 建筑 | G354: 建筑工程 | H354: 116.79 | I354: -2.46e-002 | J354: 1.1399999999999999e-002 | K354: 2.93 | L354: -3.6200000000000003e-002 | M354: 111.3 | N354: 3.1 | O354: 0.23600000000000002 | P354: 94.52 | Q354: 已到 | R354: 2年10天 | S354: 10天 | T354: 6.02 | U354: 84 | V354: 0.12 | W354: 0.114 | X354: 0.10800000000000001 | Y354: 53 | Z354: 1.33 | AA354: -2.4e-002 | AB354: -3.39e-002 | AC354: -0.72499999999999998 | AD354: -0.74099999999999999 | AE354: 101.1 | AF354: 103.68 | AG354: 0.36 | AH354: AA | AI354: 3.6400000000000002e-002 | AJ354: =H354+100*O354 -> 140.39000000000001 | AK354: 139.1 | AL354: 34 | AM354: 35.4 | AN354: 17 | AO354: -6.0999999999999999e-002 | AP354: 54 | AQ354: 岩土转债!
A355: 354 | B355: 127006 | C355: 敖东转债! | D355: 623 | E355: 吉林敖东 | F355: 金融 | G355: 证券行业 | H355: 110.48 | I355: -1.3999999999999999e-002 | J355: 1.23e-002 | K355: 16.35 | L355: -9.7000000000000003e-003 | M355: 107.4 | N355: 20.22 | O355: 0.36599999999999999 | P355: 80.86 | Q355: 已到 | R355: 2年8天 | S355: 8天 | T355: 24.1 | U355: 34 | V355: 1.3000000000000001e-002 | W355: 0.127 | X355: 0.10199999999999999 | Y355: 190 | Z355: 0.79 | AA355: -1.41e-002 | AB355: -2.0899999999999998e-002 | AC355: -0.495 | AD355: -0.505 | AE355: 100.48 | AF355: 100.99 | AG355: 0.18 | AH355: AA+ | AI355: 3.1400000000000004e-002 | AJ355: =H355+100*O355 -> 147.08000000000001 | AK355: 140.1 | AL355: 43 | AM355: 39.1 | AN355: 34 | AO355: -1.3999999999999999e-002 | AP355: 26 | AQ355: 敖东转债!
A356: 355 | B356: 127005 | C356: 长证转债! | D356: 783 | E356: 长江证券 | F356: 金融 | G356: 证券行业 | H356: 117.909 | I356: -5.4000000000000003e-003 | J356: 1.7000000000000001e-003 | K356: 6.82 | L356: -8.6999999999999994e-003 | M356: 108.3 | N356: 7.13 | O356: 0.23300000000000001 | P356: 95.65 | Q356: 已到 | R356: 2年7天 | S356: 无权 | T356: 50 | U356: 70 | V356: 1.2e-002 | W356: 0.13200000000000001 | X356: 0.127 | Y356: 377 | Z356: 1.28 | AA356: -4.2099999999999999e-002 | AB356: -4.9400000000000006e-002 | AC356: 无权 | AD356: 无权 | AE356: 无权 | AF356: 102.28 | AG356: 0.42 | AH356: AAA | AI356: 2.9399999999999999e-002 | AJ356: =H356+100*O356 -> 141.209 | AK356: 140.2 | AL356: 44 | AM356: 37.9 | AN356: 29 | AO356: -2.9999999999999999e-002 | AP356: 12 | AQ356: 长证转债!
A357: 356 | B357: 113505 | C357: 杭电转债! | D357: 603618 | E357: 杭电股份 | F357: 能源电力 | G357: 电力设备 | H357: 118.21 | I357: -1.9e-002 | J357: 1.24e-002 | K357: 6.82 | L357: -1.7299999999999999e-002 | M357: 111.3 | N357: 7.08 | O357: 0.22699999999999998 | P357: 96.33 | Q357: 已到 | R357: 2年1.1天 | S357: 1.1天 | T357: 7.5 | U357: 52 | V357: 5.7999999999999996e-002 | W357: 0.159 | X357: 0.153 | Y357: 47 | Z357: 1.78 | AA357: -3.0299999999999997e-002 | AB357: -4.0199999999999993e-002 | AC357: -0.90099999999999991 | AD357: -0.91799999999999993 | AE357: 101.19 | AF357: 103.77 | AG357: 0.38 | AH357: AA | AI357: 3.6400000000000002e-002 | AJ357: =H357+100*O357 -> 140.91 | AK357: 140.1 | AL357: 42 | AM357: 36.3 | AN357: 21 | AO357: 1.7000000000000001e-002 | AP357: 43 | AQ357: 杭电转债!
A358: 357 | B358: 113504 | C358: 艾华转债!! | D358: 603989 | E358: 艾华集团 | F358: 电子 | G358: 元器件制 | H358: 169.71 | I358: -4.5999999999999999e-002 | J358: 1.9099999999999999e-002 | K358: 32.28 | L358: -2.7999999999999997e-002 | M358: 107.8 | N358: 20.81 | O358: 9.4e-002 | P358: 155.12 | Q358: 已到 | R358: 1.99年 | S358: 回售内 | T358: 4.63 | U358: 15 | V358: 1.9e-002 | W358: 3.6000000000000004e-002 | X358: 5.5e-002 | Y358: 129 | Z358: 4.54 | AA358: -0.20499999999999999 | AB358: -0.21100000000000002 | AC358: 回售内 | AD358: 回售内 | AE358: 100.3 | AF358: 100.45 | AG358: 0.96 | AH358: AA | AI358: 3.6400000000000002e-002 | AJ358: =H358+100*O358 -> 179.11000000000001 | AK358: 184.3 | AL358: 329 | AM358: 83.9 | AN358: 318 | AO358: -5.9000000000000004e-002 | AP358: 10 | AQ358: 艾华转债!!
A359: 358 | B359: 128035 | C359: 大族转债! | D359: 2008 | E359: 大族激光 | F359: 机械装备 | G359: 专用设备 | H359: 122.814 | I359: -1.2e-002 | J359: 4.5000000000000005e-003 | K359: 47.61 | L359: -2.2400000000000003e-002 | M359: 106.6 | N359: 52.19 | O359: 0.34600000000000003 | P359: 91.22 | Q359: 已到 | R359: 1.93年 | S359: 回售内 | T359: 23 | U359: 44 | V359: 1.6e-002 | W359: 4.5999999999999999e-002 | X359: 4.2000000000000003e-002 | Y359: 501 | Z359: 4.79 | AA359: -7.1399999999999991e-002 | AB359: -7.7300000000000008e-002 | AC359: 回售内 | AD359: 回售内 | AE359: 103 | AF359: 100.48 | AG359: 0.33 | AH359: AA+ | AI359: 3.1400000000000004e-002 | AJ359: =H359+100*O359 -> 157.41399999999999 | AK359: 154.4 | AL359: 184 | AM359: 51.4 | AN359: 111 | AO359: 1.e-002 | AP359: 17 | AQ359: 大族转债!
A360: 359 | B360: 110043 | C360: 无锡转债! | D360: 600908 | E360: 无锡银行 | F360: 金融 | G360: 银行行业 | H360: 124.8 | I360: -6.0999999999999995e-003 | J360: -2.5999999999999999e-003 | K360: 6.09 | L360: -1.46e-002 | M360: 107.3 | N360: 5.61 | O360: 0.14999999999999999 | P360: 108.56 | Q360: 已到 | R360: 1.91年 | S360: 无权 | T360: 29.2 | U360: 64 | V360: 1.8000000000000002e-002 | W360: 0.25800000000000001 | X360: 0.28000000000000003 | Y360: 113 | Z360: 0.88 | AA360: -7.6600000000000001e-002 | AB360: -8.3199999999999996e-002 | AC360: 无权 | AD360: 无权 | AE360: 无权 | AF360: 101.19 | AG360: 0.6 | AH360: AA+ | AI360: 3.1400000000000004e-002 | AJ360: =H360+100*O360 -> 139.80000000000001 | AK360: 141 | AL360: 50 | AM360: 39.8 | AN360: 38 | AO360: -4.0000000000000001e-003 | AP360: 22 | AQ360: 无锡转债!
A361: 360 | B361: 128034 | C361: 江银转债! | D361: 2807 | E361: 江阴银行 | F361: 金融 | G361: 银行行业 | H361: 113.37 | I361: -8.3000000000000001e-003 | J361: 3.0999999999999999e-003 | K361: 3.99 | L361: -1.4800000000000001e-002 | M361: 107.3 | N361: 4.32 | O361: 0.22699999999999998 | P361: 92.36 | Q361: 已到 | R361: 1.90年 | S361: 无权 | T361: 17.6 | U361: 8.5 | V361: 4.0000000000000001e-003 | W361: 0.20300000000000001 | X361: 0.187 | Y361: 87 | Z361: 0.72 | AA361: -2.8799999999999999e-002 | AB361: -3.5799999999999998e-002 | AC361: 无权 | AD361: 无权 | AE361: 无权 | AF361: 101.23 | AG361: 0.35 | AH361: AA+ | AI361: 3.1400000000000004e-002 | AJ361: =H361+100*O361 -> 136.06999999999999 | AK361: 134.4 | AL361: 12 | AM361: 33.1 | AN361: 10 | AO361: -1.2e-002 | AP361: 31 | AQ361: 江银转债!
A362: 361 | B362: 128033 | C362: 迪龙转债! | D362: 2658 | E362: 雪迪龙 | F362: 城市公用 | G362: 三废处理 | H362: 125.351 | I362: -1.2199999999999999e-002 | J362: 7.1999999999999998e-003 | K362: 9.02 | L362: -8.8000000000000005e-003 | M362: 107.5 | N362: 8.56 | O362: 0.19 | P362: 105.37 | Q362: 已到 | R362: 1.81年 | S362: 回售内 | T362: 2.98 | U362: 67 | V362: 0.17800000000000002 | W362: 5.2000000000000005e-002 | X362: 5.5e-002 | Y362: 57 | Z362: 2.32 | AA362: -8.1799999999999998e-002 | AB362: -8.8800000000000004e-002 | AC362: 回售内 | AD362: 回售内 | AE362: 100.25 | AF362: 100.8 | AG362: 0.57 | AH362: AA | AI362: 3.6400000000000002e-002 | AJ362: =H362+100*O362 -> 144.351 | AK362: 145.3 | AL362: 80 | AM362: 44.5 | AN362: 58 | AO362: 5.0999999999999997e-002 | AP362: 34 | AQ362: 迪龙转债!
A363: 362 | B363: 113017 | C363: 吉视转债! | D363: 601929 | E363: 吉视传媒 | F363: 传媒娱乐 | G363: 影视娱乐 | H363: 122.7 | I363: -1.9599999999999999e-002 | J363: 2.2000000000000001e-003 | K363: 2.43 | L363: -2.7999999999999997e-002 | M363: 107.5 | N363: 2.23 | O363: 0.126 | P363: 108.97 | Q363: 已到 | R363: 1.81年 | S363: 回售内 | T363: 11.4 | U363: 173 | V363: 0.124 | W363: 0.14999999999999999 | X363: 0.16399999999999998 | Y363: 76 | Z363: 1.13 | AA363: -7.0800000000000002e-002 | AB363: -7.7899999999999997e-002 | AC363: 回售内 | AD363: 回售内 | AE363: 100.25 | AF363: 101.68 | AG363: 0.62 | AH363: AA+ | AI363: 3.1400000000000004e-002 | AJ363: =H363+100*O363 -> 135.30000000000001 | AK363: 136.4 | AL363: 21 | AM363: 34.7 | AN363: 15 | AO363: -2.2000000000000002e-002 | AP363: 71 | AQ363: 吉视转债!
A364: 363 | B364: 128030 | C364: 天康转债!! | D364: 2100 | E364: 天康生物 | F364: 农业 | G364: 畜牧业 | H364: 211.9 | I364: 3.7000000000000002e-003 | J364: 4.5000000000000005e-003 | K364: 11.85 | L364: 8.5000000000000006e-003 | M364: 109.8 | N364: 7.4 | O364: 0.32299999999999995 | P364: 160.14 | Q364: 已到 | R364: 1.80年 | S364: 回售内 | T364: 0.87 | U364: 41 | V364: 0.22 | W364: 5.0000000000000001e-003 | X364: 9.0000000000000011e-003 | Y364: 160 | Z364: 2.27 | AA364: -0.308 | AB364: -0.314 | AC364: 回售内 | AD364: 回售内 | AE364: 100.3 | AF364: 103.02 | AG364: 0.97 | AH364: AA | AI364: 3.6400000000000002e-002 | AJ364: =H364+100*O364 -> 244.19999999999999 | AK364: 263.7 | AL364: 363 | AM364: 160.6 | AN364: 361 | AO364: 2.e-002 | AP364: 9 | AQ364: 天康转债!!
A365: 364 | B365: 128029 | C365: 太阳转债!! | D365: 2078 | E365: 太阳纸业 | F365: 造纸包装 | G365: 造纸行业 | H365: 168 | I365: -1.5700000000000002e-002 | J365: 1.5700000000000002e-002 | K365: 12.58 | L365: 0. | M365: 106 | N365: 8.45 | O365: 0.128 | P365: 148.88 | Q365: 已到 | R365: 0.80年 | S365: 回售内 | T365: 9.09 | U365: 83 | V365: 5.4000000000000006e-002 | W365: 2.7000000000000003e-002 | X365: 4.0000000000000001e-002 | Y365: 338 | Z365: 1.78 | AA365: -0.47100000000000003 | AB365: -0.47999999999999998 | AC365: 回售内 | AD365: 回售内 | AE365: 100.25 | AF365: 103.59 | AG365: 0.99 | AH365: AA+ | AI365: 2.92e-002 | AJ365: =H365+100*O365 -> 180.80000000000001 | AK365: 187.1 | AL365: 332 | AM365: 83.5 | AN365: 316 | AO365: 6.7000000000000004e-002 | AP365: 7 | AQ365: 太阳转债!!
A366: 365 | B366: 123004 | C366: 铁汉转债! | D366: 300197 | E366: 节能铁汉 | F366: 城市公用 | G366: 生态环境 | H366: 112.58 | I366: -1.01e-002 | J366: 8.6e-003 | K366: 2.81 | L366: -2.0899999999999998e-002 | M366: 107.5 | N366: 3.82 | O366: 0.53000000000000003 | P366: 73.56 | Q366: 已到 | R366: 1.79年 | S366: 回售内 | T366: 8.03 | U366: 6.7 | V366: 6.9999999999999993e-003 | W366: 0.10099999999999999 | X366: 7.400000000000001e-002 | Y366: 79 | Z366: 1.24 | AA366: -2.5699999999999997e-002 | AB366: -3.3300000000000003e-002 | AC366: 回售内 | AD366: 回售内 | AE366: 100.25 | AF366: 100.89 | AG366: 0.07 | AH366: AA | AI366: 3.6400000000000002e-002 | AJ366: =H366+100*O366 -> 165.57999999999998 | AK366: 151.6 | AL366: 154 | AM366: 50.7 | AN366: 100 | AO366: -1.1000000000000001e-002 | AP366: 53 | AQ366: 铁汉转债!
A367: 366 | B367: 128026 | C367: 众兴转债! | D367: 2772 | E367: 众兴菌业 | F367: 农业 | G367: 种植业 | H367: 112.542 | I367: -7.6e-003 | J367: 7.6e-003 | K367: 7.86 | L367: -7.6e-003 | M367: 107.8 | N367: 11.36 | O367: 0.627 | P367: 69.19 | Q367: 已到 | R367: 1.78年 | S367: 回售内 | T367: 4.09 | U367: 7.5 | V367: 1.6e-002 | W367: 0.128 | X367: 8.8000000000000009e-002 | Y367: 32 | Z367: 1.07 | AA367: -2.4199999999999999e-002 | AB367: -3.2199999999999999e-002 | AC367: 回售内 | AD367: 回售内 | AE367: 100.3 | AF367: 97.72 | AG367: 0 | AH367: AA- | AI367: 5.74e-002 | AJ367: =H367+100*O367 -> 175.24200000000002 | AK367: 155.9 | AL367: 198 | AM367: 55.6 | AN367: 144 | AO367: 1.2e-002 | AP367: 60 | AQ367: 众兴转债!
A368: 367 | B368: 128025 | C368: 特一转债! | D368: 2728 | E368: 特一药业 | F368: 医药 | G368: 化学制药 | H368: 129.699 | I368: -9.8999999999999991e-003 | J368: 4.0999999999999995e-003 | K368: 15.53 | L368: -8.3000000000000001e-003 | M368: 107.5 | N368: 13.8 | O368: 0.153 | P368: 112.54 | Q368: 已到 | R368: 1.76年 | S368: 回售内 | T368: 2.98 | U368: 248 | V368: 0.63100000000000001 | W368: 8.5999999999999993e-002 | X368: 9.6999999999999989e-002 | Y368: 34 | Z368: 3.17 | AA368: -0.10199999999999999 | AB368: -0.109 | AC368: 回售内 | AD368: 回售内 | AE368: 100.25 | AF368: 97.54 | AG368: 0.71 | AH368: AA- | AI368: 5.74e-002 | AJ368: =H368+100*O368 -> 144.99900000000002 | AK368: 146.9 | AL368: 100 | AM368: 46.6 | AN368: 70 | AO368: 3.7000000000000005e-002 | AP368: 46 | AQ368: 特一转债!
A369: 368 | B369: 128023 | C369: 亚太转债! | D369: 2284 | E369: 亚太股份 | F369: 汽车 | G369: 零部件制 | H369: 117.765 | I369: -1.5800000000000002e-002 | J369: 9.3999999999999986e-003 | K369: 8.54 | L369: -3.7200000000000004e-002 | M369: 109.8 | N369: 10.34 | O369: 0.42599999999999999 | P369: 82.59 | Q369: 已到 | R369: 1.75年 | S369: 回售内 | T369: 9.99 | U369: 27 | V369: 2.3e-002 | W369: 0.159 | X369: 0.13100000000000001 | Y369: 63 | Z369: 2.51 | AA369: -3.9599999999999996e-002 | AB369: -4.9400000000000006e-002 | AC369: 回售内 | AD369: 回售内 | AE369: 100.3 | AF369: 103.2 | AG369: 0.17 | AH369: AA | AI369: 3.6400000000000002e-002 | AJ369: =H369+100*O369 -> 160.36500000000001 | AK369: 152.9 | AL369: 171 | AM369: 49.7 | AN369: 91 | AO369: -5.5999999999999994e-002 | AP369: 51 | AQ369: 亚太转债!
A370: 369 | B370: 128022 | C370: 众信转债! | D370: 2707 | E370: 众信旅游 | F370: 旅游餐饮 | G370: 旅游 | H370: 119 | I370: -9.1999999999999998e-003 | J370: 1.7100000000000001e-002 | K370: 6.94 | L370: 2.2099999999999998e-002 | M370: 107.5 | N370: 7.92 | O370: 0.35799999999999998 | P370: 87.63 | Q370: 已到 | R370: 1.74年 | S370: 回售内 | T370: 4.55 | U370: 261 | V370: 0.47600000000000003 | W370: 7.2000000000000008e-002 | X370: 6.3e-002 | Y370: 63 | Z370: 12.18 | AA370: -5.7099999999999998e-002 | AB370: -6.4600000000000005e-002 | AC370: 回售内 | AD370: 回售内 | AE370: 100.25 | AF370: 94.35 | AG370: 0.36 | AH370: A | AI370: 7.8399999999999997e-002 | AJ370: =H370+100*O370 -> 154.80000000000001 | AK370: 150.4 | AL370: 140 | AM370: 50.1 | AN370: 95 | AO370: -1.6e-002 | AP370: 41 | AQ370: 众信转债!
A371: 370 | B371: 128021 | C371: 兄弟转债!! | D371: 2562 | E371: 兄弟科技 | F371: 医药 | G371: 原料药 | H371: 122.912 | I371: -2.9100000000000001e-002 | J371: 2.9999999999999999e-002 | K371: 5.47 | L371: 3.7000000000000002e-003 | M371: 107.5 | N371: 5.19 | O371: 0.16600000000000001 | P371: 105.39 | Q371: 已到 | R371: 1.73年 | S371: 回售内 | T371: 2.65 | U371: 36 | V371: 0.10800000000000001 | W371: 4.5999999999999999e-002 | X371: 4.8000000000000001e-002 | Y371: 58 | Z371: 1.98 | AA371: -7.4900000000000008e-002 | AB371: -8.2299999999999998e-002 | AC371: 回售内 | AD371: 回售内 | AE371: 100.25 | AF371: 101.09 | AG371: 0.26 | AH371: AA | AI371: 3.6400000000000002e-002 | AJ371: =H371+100*O371 -> 139.512 | AK371: 140.4 | AL371: 48 | AM371: 39.3 | AN371: 35 | AO371: 4.0000000000000001e-003 | AP371: 20 | AQ371: 兄弟转债!!
A372: 371 | B372: 123002 | C372: 国祯转债!! | D372: 300388 | E372: 节能国祯 | F372: 城市公用 | G372: 三废处理 | H372: 120.8 | I372: -1.6000000000000001e-003 | J372: 1.e-003 | K372: 7.86 | L372: -1.2999999999999999e-003 | M372: 107.5 | N372: 8.36 | O372: 0.28499999999999998 | P372: 94.02 | Q372: 已到 | R372: 1.72年 | S372: 回售内 | T372: 2.52 | U372: 10 | V372: 3.3000000000000002e-002 | W372: 4.5999999999999999e-002 | X372: 4.2999999999999997e-002 | Y372: 55 | Z372: 1.49 | AA372: -6.59e-002 | AB372: -7.3499999999999996e-002 | AC372: 回售内 | AD372: 回售内 | AE372: 100.25 | AF372: 101.13 | AG372: 0.44 | AH372: AA | AI372: 3.6400000000000002e-002 | AJ372: =H372+100*O372 -> 149.29999999999998 | AK372: 147.6 | AL372: 109 | AM372: 46.5 | AN372: 69 | AO372: 2.8999999999999998e-002 | AP372: 20 | AQ372: 国祯转债!!
A373: 372 | B373: 110038 | C373: 济川转债! | D373: 600566 | E373: 济川药业 | F373: 医药 | G373: 中药 | H373: 127.28 | I373: -1.7399999999999999e-002 | J373: 9.4999999999999998e-003 | K373: 24.83 | L373: -1.43e-002 | M373: 106 | N373: 23.4 | O373: 0.19899999999999998 | P373: 106.11 | Q373: 已到 | R373: 0.69年 | S373: 回售内 | T373: 6.27 | U373: 59 | V373: 7.2999999999999995e-002 | W373: 2.7999999999999997e-002 | X373: 2.9999999999999999e-002 | Y373: 221 | Z373: 2.57 | AA373: -0.23199999999999998 | AB373: -0.24399999999999999 | AC373: 回售内 | AD373: 回售内 | AE373: 101 | AF373: 103.56 | AG373: 0.55 | AH373: AA | AI373: 3.4200000000000001e-002 | AJ373: =H373+100*O373 -> 147.18000000000001 | AK373: 148.4 | AL373: 118 | AM373: 44.9 | AN373: 59 | AO373: 1.9e-002 | AP373: 24 | AQ373: 济川转债!
A374: 373 | B374: 113502 | C374: 嘉澳转债! | D374: 603822 | E374: 嘉澳环保 | F374: 化工 | G374: 化工 | H374: 134.88 | I374: -3.7100000000000001e-002 | J374: 0. | K374: 50.9 | L374: -5.3399999999999996e-002 | M374: 109.8 | N374: 44.64 | O374: 0.183 | P374: 114.02 | Q374: 已到 | R374: 1.69年 | S374: 回售内 | T374: 1.84 | U374: 86 | V374: 0.34499999999999997 | W374: 4.9000000000000002e-002 | X374: 5.5999999999999994e-002 | Y374: 37 | Z374: 4.5 | AA374: -0.11599999999999999 | AB374: -0.125 | AC374: 回售内 | AD374: 回售内 | AE374: 100.3 | AF374: 100.04 | AG374: 0.7 | AH374: AA- | AI374: 5.74e-002 | AJ374: =H374+100*O374 -> 153.18000000000001 | AK374: 155.7 | AL374: 194 | AM374: 55.4 | AN374: 141 | AO374: 9.0000000000000011e-003 | AP374: 32 | AQ374: 嘉澳转债!
A375: 374 | B375: 113016 | C375: 小康转债!! | D375: 601127 | E375: 小康股份 | F375: 汽车 | G375: 零部件制 | H375: 289.91 | I375: -7.6e-003 | J375: 1.9699999999999999e-002 | K375: 43.22 | L375: 1.2199999999999999e-002 | M375: 107.8 | N375: 16.96 | O375: 0.13800000000000001 | P375: 254.83 | Q375: 已到 | R375: 1.67年 | S375: 回售内 | T375: 2.07 | U375: 180 | V375: 0.29699999999999999 | W375: 4.0000000000000001e-003 | X375: 9.0000000000000011e-003 | Y375: 588 | Z375: 8.17 | AA375: -0.44299999999999995 | AB375: -0.44799999999999995 | AC375: 回售内 | AD375: 回售内 | AE375: 100.3 | AF375: 98.28 | AG375: 0.99 | AH375: AA- | AI375: 5.74e-002 | AJ375: =H375+100*O375 -> 303.71000000000004 | AK375: 325 | AL375: 369 | AM375: 224.7 | AN375: 369 | AO375: -3.1e-002 | AP375: 32 | AQ375: 小康转债!!
A376: 375 | B376: 128017 | C376: 金禾转债!! | D376: 2597 | E376: 金禾实业 | F376: 化工 | G376: 化工 | H376: 198.698 | I376: 1.e-003 | J376: 1.1000000000000001e-002 | K376: 38.19 | L376: 1.2199999999999999e-002 | M376: 107.5 | N376: 21.97 | O376: 0.14300000000000002 | P376: 173.83 | Q376: 已到 | R376: 1.66年 | S376: 回售内 | T376: 5.52 | U376: 242 | V376: 0.21299999999999999 | W376: 2.6000000000000002e-002 | X376: 4.4999999999999998e-002 | Y376: 214 | Z376: 4.12 | AA376: -0.311 | AB376: -0.317 | AC376: 回售内 | AD376: 回售内 | AE376: 100.25 | AF376: 101.36 | AG376: 0.98 | AH376: AA | AI376: 3.6400000000000002e-002 | AJ376: =H376+100*O376 -> 212.99800000000002 | AK376: 223.6 | AL376: 356 | AM376: 122.2 | AN376: 354 | AO376: -6.5000000000000002e-002 | AP376: 9 | AQ376: 金禾转债!!
A377: 376 | B377: 113013 | C377: 国君转债! | D377: 601211 | E377: 国泰君安 | F377: 金融 | G377: 证券行业 | H377: 115.18 | I377: -1.8700000000000001e-002 | J377: 1.6399999999999998e-002 | K377: 16.64 | L377: -8.8999999999999999e-003 | M377: 106.8 | N377: 18.45 | O377: 0.27699999999999997 | P377: 90.19 | Q377: 已到 | R377: 1.34年 | S377: 无权 | T377: 69.9 | U377: 348 | V377: 4.2999999999999997e-002 | W377: 4.7e-002 | X377: 4.2999999999999997e-002 | Y377: 1482. | Z377: 1.12 | AA377: -5.5500000000000001e-002 | AB377: -6.4399999999999999e-002 | AC377: 无权 | AD377: 无权 | AE377: 无权 | AF377: 102.78 | AG377: 0.26 | AH377: AAA | AI377: 2.9399999999999999e-002 | AJ377: =H377+100*O377 -> 142.88 | AK377: 140.2 | AL377: 45 | AM377: 37.4 | AN377: 26 | AO377: -4.8000000000000001e-002 | AP377: 12 | AQ377: 国君转债!
A378: 377 | B378: 128015 | C378: 久其转债!! | D378: 2279 | E378: 久其软件 | F378: 计算机及 | G378: 软件开发 | H378: 114.749 | I378: -7.4000000000000003e-003 | J378: 3.0999999999999999e-003 | K378: 5.42 | L378: -3.73e-002 | M378: 109.5 | N378: 6.97 | O378: 0.47600000000000003 | P378: 77.76 | Q378: 已到 | R378: 1.26年 | S378: 回售内 | T378: 7.79 | U378: 90 | V378: 0.10000000000000001 | W378: 0.20199999999999999 | X378: 0.157 | Y378: 39 | Z378: 4.81 | AA378: -3.6900000000000002e-002 | AB378: -5.0199999999999995e-002 | AC378: 回售内 | AD378: 回售内 | AE378: 100.25 | AF378: 100.83 | AG378: 0.12 | AH378: A+ | AI378: 6.8400000000000002e-002 | AJ378: =H378+100*O378 -> 162.34899999999999 | AK378: 151.7 | AL378: 158 | AM378: 50.9 | AN378: 105 | AO378: 5.7999999999999996e-002 | AP378: 74 | AQ378: 久其转债!!
A379: 378 | B379: 127004 | C379: 模塑转债!! | D379: 700 | E379: 模塑科技 | F379: 汽车 | G379: 零部件制 | H379: 163.996 | I379: -1.38e-002 | J379: 1.38e-002 | K379: 4.8 | L379: -6.1999999999999998e-003 | M379: 111.8 | N379: 7.24 | O379: 1.47 | P379: 66.3 | Q379: 已到 | R379: 1.24年 | S379: 回售内 | T379: 1.31 | U379: 70 | V379: 0.32299999999999995 | W379: 2.9999999999999999e-002 | X379: 2.e-002 | Y379: 44 | Z379: 1.94 | AA379: -0.26800000000000002 | AB379: -0.28000000000000003 | AC379: 回售内 | AD379: 回售内 | AE379: 100.3 | AF379: 101.36 | AG379: 0 | AH379: AA- | AI379: 5.74e-002 | AJ379: =H379+100*O379 -> 310.99599999999998 | AK379: 261.7 | AL379: 362 | AM379: 160.3 | AN379: 360 | AO379: -5.0000000000000001e-003 | AP379: 24 | AQ379: 模塑转债!!
A380: 379 | B380: 128014 | C380: 永东转债! | D380: 2753 | E380: 永东股份 | F380: 化工 | G380: 化工 | H380: 116.544 | I380: -8.0000000000000002e-003 | J380: 7.1999999999999998e-003 | K380: 9.35 | L380: -1.2699999999999999e-002 | M380: 109.8 | N380: 12.52 | O380: 0.56100000000000005 | P380: 74.68 | Q380: 已到 | R380: 1年43天 | S380: 回售内 | T380: 3.37 | U380: 4.6 | V380: 1.2e-002 | W380: 9.6000000000000002e-002 | X380: 7.2000000000000008e-002 | Y380: 35 | Z380: 1.68 | AA380: -5.2699999999999997e-002 | AB380: -6.7799999999999999e-002 | AC380: 回售内 | AD380: 回售内 | AE380: 100.3 | AF380: 103.25 | AG380: 0.06 | AH380: AA- | AI380: 5.74e-002 | AJ380: =H380+100*O380 -> 172.64400000000001 | AK380: 158.4 | AL380: 216 | AM380: 55.2 | AN380: 140 | AO380: 1.9e-002 | AP380: 40 | AQ380: 永东转债!
A381: 380 | B381: 113011 | C381: 光大转债 | D381: 601818 | E381: 光大银行 | F381: 金融 | G381: 银行行业 | H381: 112.28 | I381: -3.3e-003 | J381: 4.1999999999999997e-003 | K381: 3.39 | L381: 3.0000000000000001e-003 | M381: 106.8 | N381: 3.55 | O381: 0.17600000000000002 | P381: 95.49 | Q381: 已到 | R381: 1年12天 | S381: 无权 | T381: 242 | U381: 141 | V381: 5.0000000000000001e-003 | W381: 0.13200000000000001 | X381: 0.126 | Y381: 1832. | Z381: 0.5 | AA381: -4.8000000000000001e-002 | AB381: -5.9800000000000006e-002 | AC381: 无权 | AD381: 无权 | AE381: 无权 | AF381: 103.7 | AG381: 0.32 | AH381: AAA | AI381: 2.9399999999999999e-002 | AJ381: =H381+100*O381 -> 129.88 | AK381: 129.1 | AL381: 4 | AM381: 25.4 | AN381: 2 | AO381: -6.0000000000000001e-003 | AP381: 22 | AQ381: 光大转债
A382: 381 | B382: 128013 | C382: 洪涛转债! | D382: 2325 | E382: 洪涛股份 | F382: 建筑 | G382: 装饰工程 | H382: 122.89 | I382: -1.6399999999999998e-002 | J382: -3.2000000000000002e-003 | K382: 2.62 | L382: -2.6000000000000002e-002 | M382: 108 | N382: 2.31 | O382: 8.3000000000000004e-002 | P382: 113.42 | Q382: 已到 | R382: 0.40年 | S382: 回售内 | T382: 8.23 | U382: 192 | V382: 0.18899999999999997 | W382: 0.23699999999999999 | X382: 0.26899999999999996 | Y382: 35 | Z382: 1.18 | AA382: -0.27600000000000002 | AB382: -0.30199999999999999 | AC382: 回售内 | AD382: 回售内 | AE382: 100.33 | AF382: 102.65 | AG382: 0.75 | AH382: BB | AI382: 0.13539999999999999 | AJ382: =H382+100*O382 -> 131.19 | AK382: 132.4 | AL382: 7 | AM382: 29.7 | AN382: 6 | AO382: -5.2999999999999999e-002 | AP382: 100 | AQ382: 洪涛转债!
A383: 382 | B383: 127003 | C383: 海印转债! | D383: 861 | E383: 海印股份 | F383: 商业零售 | G383: 商场 | H383: 118.011 | I383: -1.e-002 | J383: 2.8999999999999998e-003 | K383: 3.11 | L383: -2.5099999999999997e-002 | M383: 110 | N383: 2.99 | O383: 0.13500000000000001 | P383: 104.01 | Q383: 已到 | R383: 0.26年 | S383: 回售内 | T383: 6.74 | U383: 49 | V383: 6.2e-002 | W383: 9.3000000000000013e-002 | X383: 9.6999999999999989e-002 | Y383: 72 | Z383: 1.97 | AA383: -0.23699999999999999 | AB383: -0.28800000000000003 | AC383: 回售内 | AD383: 回售内 | AE383: 100.33 | AF383: 108.49 | AG383: 0.28 | AH383: AA- | AI383: 5.4400000000000004e-002 | AJ383: =H383+100*O383 -> 131.511 | AK383: 132 | AL383: 6 | AM383: 23.5 | AN383: 1 | AO383: 1.7000000000000001e-002 | AP383: 78 | AQ383: 海印转债!