A1: 序号 | B1: 转债代码 | C1: 转债名称 | D1: 股票代码 | E1: 股票名称 | F1: 行业 | G1: 子行业 | H1: 转债价格 | I1: 涨跌 | J1: 日内套利 | K1: 股价 | L1: 涨跌 | M1: 剩余本息 | N1: 转股价格 | O1: 转股溢价率 | P1: 转股价值 | Q1: 距离转股日 | R1: 剩余年限 | S1: 回售年限 | T1: 转债余额 | U1: 转债成交额 | V1: 转债换手率 | W1: 余额/市值 | X1: 余额/股本 | Y1: 股票市值 | Z1: P/B | AA1: 税前收益率 | AB1: 税后收益率 | AC1: 税前回售收益 | AD1: 税后回售收益 | AE1: 回售价值 | AF1: 纯债价值 | AG1: 弹性 | AH1: 信用 | AI1: 折现率 | AJ1: 双低 | AK1: 老式双低 | AL1: 老式排名 | AM1: 新式双低 | AN1: 新式排名 | AO1: MA20乖离 | AP1: 热门度 | AQ1: 转债名称
A2: 291 | B2: 128062 | C2: 亚药转债! | D2: 2370 | E2: 亚太药业 | F2: 医药 | G2: 化学制药 | H2: 95.099 | I2: -2.3e-003 | J2: 2.3e-003 | K2: 4.4 | L2: 0. | M2: 119.3 | N2: 16.25 | O2: 2.5099999999999998 | P2: 27.08 | Q2: 转股中 | R2: 3.56年 | S2: 1.56年 | T2: 9.63 | U2: 34 | V2: 3.7000000000000005e-002 | W2: 0.40799999999999997 | X2: 0.11 | Y2: 24 | Z2: 5.72 | AA2: 6.7099999999999993e-002 | AB2: 5.6900000000000006e-002 | AC2: 4.6500000000000007e-002 | AD2: 4.3099999999999999e-002 | AE2: 81.9 | AF2: 75.1 | AG2: 0 | AH2: BB | AI2: 0.1421 | AJ2: =H2+100*O2 -> 346.09899999999999 | AK2: 163.1 | AL2: 259 | AM2: 81.2 | AN2: 286 | AO2: 3.9e-002 | AP2: 89 | AQ2: 亚药转债!
A3: 160 | B3: 113595 | C3: 花王转债! | D3: 603007 | E3: ST花王 | F3: 城市公用 | G3: 生态环境 | H3: 95.67 | I3: -1.2800000000000001e-002 | J3: 9.1999999999999998e-003 | K3: 3.31 | L3: -2.3599999999999999e-002 | M3: 124.8 | N3: 6.92 | O3: 1. | P3: 47.83 | Q3: 转股中 | R3: 4.86年 | S3: 2.86年 | T3: 3.3 | U3: 17 | V3: 5.2999999999999999e-002 | W3: 0.29699999999999999 | X3: 0.14199999999999999 | Y3: 11 | Z3: 1 | AA3: 5.74e-002 | AB3: 4.8300000000000003e-002 | AC3: 2.7300000000000001e-002 | AD3: 2.4799999999999999e-002 | AE3: 77.51 | AF3: 78.61 | AG3: 0.15 | AH3: BBB+ | AI3: 0.10210000000000001 | AJ3: =H3+100*O3 -> 195.67000000000002 | AK3: 143.5 | AL3: 131 | AM3: 64.9 | AN3: 234 | AO3: 1.6e-002 | AP3: 48 | AQ3: 花王转债!
A4: 204 | B4: 113576 | C4: 起步转债!! | D4: 603557 | E4: ST起步 | F4: 服装纺织 | G4: 鞋服行业 | H4: 97.77 | I4: -9.8999999999999991e-003 | J4: 8.8000000000000005e-003 | K4: 4.82 | L4: -1.43e-002 | M4: 121.3 | N4: 10.55 | O4: 1.1399999999999999 | P4: 45.69 | Q4: 转股中 | R4: 4.58年 | S4: 2.58年 | T4: 2.66 | U4: 14 | V4: 5.2999999999999999e-002 | W4: 0.111 | X4: 5.0999999999999997e-002 | Y4: 24 | Z4: 1.53 | AA4: 4.9500000000000002e-002 | AB4: 4.0899999999999999e-002 | AC4: 2.3799999999999998e-002 | AD4: 2.07e-002 | AE4: 84.13 | AF4: 85.29 | AG4: 0.08 | AH4: A | AI4: 8.2100000000000006e-002 | AJ4: =H4+100*O4 -> 211.76999999999998 | AK4: 149.9 | AL4: 185 | AM4: 64.6 | AN4: 231 | AO4: -1.1000000000000001e-002 | AP4: 39 | AQ4: 起步转债!!
A5: 105 | B5: 128138 | C5: 侨银转债! | D5: 2973 | E5: 侨银股份 | F5: 城市公用 | G5: 城市公用 | H5: 111.3 | I5: -4.0000000000000002e-004 | J5: -2.3e-003 | K5: 16.18 | L5: -1.46e-002 | M5: 136.5 | N5: 25.33 | O5: 0.74199999999999999 | P5: 63.88 | Q5: 转股中 | R5: 5.18年 | S5: 3.19年 | T5: 4.2 | U5: 4.8 | V5: 1.e-002 | W5: 6.4000000000000001e-002 | X5: 4.0999999999999995e-002 | Y5: 66 | Z5: 4.33 | AA5: 4.0999999999999995e-002 | AB5: 2.9700000000000001e-002 | AC5: -1.9e-002 | AD5: -2.1499999999999998e-002 | AE5: 85.36 | AF5: 100.25 | AG5: 0.19 | AH5: AA- | AI5: 6.2699999999999992e-002 | AJ5: =H5+100*O5 -> 185.5 | AK5: 158.7 | AL5: 234 | AM5: 58.5 | AN5: 189 | AO5: 1.4999999999999999e-002 | AP5: 16 | AQ5: 侨银转债!
A6: 222 | B6: 113569 | C6: 科达转债! | D6: 603660 | E6: 苏州科达 | F6: 通信互联 | G6: 物联网 | H6: 104.5 | I6: 0. | J6: -4.0000000000000002e-004 | K6: 6.87 | L6: -8.6999999999999994e-003 | M6: 120.3 | N6: 14.8 | O6: 1.25 | P6: 46.42 | Q6: 转股中 | R6: 4.49年 | S6: 2.49年 | T6: 5.16 | U6: 6 | V6: 1.1000000000000001e-002 | W6: 0.152 | X6: 7.0999999999999994e-002 | Y6: 34 | Z6: 1.94 | AA6: 3.2500000000000001e-002 | AB6: 2.4399999999999998e-002 | AC6: -3.0999999999999999e-003 | AD6: -5.7999999999999996e-003 | AE6: 88.67 | AF6: 92.71 | AG6: 0.05 | AH6: AA- | AI6: 6.1100000000000002e-002 | AJ6: =H6+100*O6 -> 229.5 | AK6: 162.6 | AL6: 257 | AM6: 69.9 | AN6: 251 | AO6: 1.3000000000000001e-002 | AP6: 31 | AQ6: 科达转债!
A7: 320 | B7: 113519 | C7: 长久转债! | D7: 603569 | E7: 长久物流 | F7: 交通运输 | G7: 物流业 | H7: 108.13 | I7: 1.e-004 | J7: -1.e-003 | K7: 7.03 | L7: -1.3999999999999999e-002 | M7: 119.3 | N7: 11.04 | O7: 0.69799999999999995 | P7: 63.68 | Q7: 转股中 | R7: 3年57天 | S7: 1年58天 | T7: 6.97 | U7: 8.5 | V7: 1.1000000000000001e-002 | W7: 0.17699999999999999 | X7: 0.113 | Y7: 39 | Z7: 1.85 | AA7: 3.2300000000000002e-002 | AB7: 2.1299999999999999e-002 | AC7: -3.78e-002 | AD7: -4.1700000000000001e-002 | AE7: 97.63 | AF7: 105.65 | AG7: 0.07 | AH7: AA | AI7: 4.0099999999999997e-002 | AJ7: =H7+100*O7 -> 177.93000000000001 | AK7: 152.6 | AL7: 202 | AM7: 46.9 | AN7: 114 | AO7: 2.8999999999999998e-002 | AP7: 22 | AQ7: 长久转债!
A8: 177 | B8: 113589 | C8: 天创转债! | D8: 603608 | E8: 天创时尚 | F8: 服装纺织 | G8: 鞋服行业 | H8: 98.97 | I8: -1.8e-003 | J8: 1.2999999999999999e-003 | K8: 5.92 | L8: -1.1699999999999999e-002 | M8: 114.9 | N8: 12.29 | O8: 1.05 | P8: 48.17 | Q8: 转股中 | R8: 4.78年 | S8: 2.79年 | T8: 6 | U8: 13 | V8: 2.2000000000000002e-002 | W8: 0.23600000000000002 | X8: 0.114 | Y8: 25 | Z8: 1.61 | AA8: 3.2300000000000002e-002 | AB8: 2.64e-002 | AC8: 1.5100000000000001e-002 | AD8: 1.2800000000000001e-002 | AE8: 92.16 | AF8: 95.54 | AG8: 0.04 | AH8: AA | AI8: 4.0099999999999997e-002 | AJ8: =H8+100*O8 -> 203.97 | AK8: 149.8 | AL8: 183 | AM8: 54.2 | AN8: 164 | AO8: 2.1000000000000001e-002 | AP8: 33 | AQ8: 天创转债!
A9: 172 | B9: 128117 | C9: 道恩转债! | D9: 2838 | E9: 道恩股份 | F9: 化工 | G9: 橡胶塑料 | H9: 106 | I9: -6.6e-003 | J9: 4.3e-003 | K9: 14.95 | L9: -2.29e-002 | M9: 123.1 | N9: 28.82 | O9: 1.04 | P9: 51.87 | Q9: 转股中 | R9: 4.81年 | S9: 2.81年 | T9: 3.6 | U9: 7 | V9: 1.8000000000000002e-002 | W9: 5.9000000000000004e-002 | X9: 3.1e-002 | Y9: 61 | Z9: 3.28 | AA9: 3.2199999999999999e-002 | AB9: 2.3799999999999998e-002 | AC9: -8.3000000000000001e-003 | AD9: -1.0500000000000001e-002 | AE9: 86.84 | AF9: 93.06 | AG9: 0.1 | AH9: AA- | AI9: 6.1100000000000002e-002 | AJ9: =H9+100*O9 -> 210. | AK9: 160.1 | AL9: 242 | AM9: 67.1 | AN9: 244 | AO9: -2.2000000000000002e-002 | AP9: 24 | AQ9: 道恩转债!
A10: 141 | B10: 128127 | C10: 文科转债! | D10: 2775 | E10: 文科园林 | F10: 城市公用 | G10: 生态环境 | H10: 103.687 | I10: -1.24e-002 | J10: 5.5000000000000005e-003 | K10: 4.27 | L10: -1.3899999999999999e-002 | M10: 120.8 | N10: 4.88 | O10: 0.185 | P10: 87.5 | Q10: 转股中 | R10: 4.94年 | S10: 2.94年 | T10: 9.5 | U10: 31 | V10: 3.1e-002 | W10: 0.434 | X10: 0.38 | Y10: 22 | Z10: 1.01 | AA10: 3.2099999999999997e-002 | AB10: 2.4500000000000001e-002 | AC10: 1.e-004 | AD10: -2.2000000000000001e-003 | AE10: 86.41 | AF10: 90.67 | AG10: 0.5 | AH10: AA- | AI10: 6.1100000000000002e-002 | AJ10: =H10+100*O10 -> 122.187 | AK10: 119.9 | AL10: 2 | AM10: 29.2 | AN10: 5 | AO10: 4.2000000000000003e-002 | AP10: 63 | AQ10: 文科转债!
A11: 304 | B11: 110052 | C11: 贵广转债! | D11: 600996 | E11: 贵广网络 | F11: 传媒娱乐 | G11: 影视娱乐 | H11: 105.74 | I11: -3.3e-003 | J11: 3.3e-003 | K11: 5.05 | L11: 0. | M11: 117.7 | N11: 7.94 | O11: 0.66299999999999992 | P11: 63.6 | Q11: 转股中 | R11: 3.48年 | S11: 1.48年 | T11: 15.3 | U11: 15 | V11: 9.0000000000000011e-003 | W11: 0.28699999999999998 | X11: 0.183 | Y11: 53 | Z11: 1.31 | AA11: 3.1899999999999998e-002 | AB11: 2.2599999999999999e-002 | AC11: -1.5700000000000002e-002 | AD11: -1.9299999999999998e-002 | AE11: 97.38 | AF11: 104.64 | AG11: 0.06 | AH11: AA+ | AI11: 3.5099999999999999e-002 | AJ11: =H11+100*O11 -> 172.03999999999999 | AK11: 147.9 | AL11: 172 | AM11: 43.2 | AN11: 84 | AO11: 8.0000000000000002e-002 | AP11: 19 | AQ11: 贵广转债!
A12: 197 | B12: 113573 | C12: 纵横转债! | D12: 603602 | E12: 纵横通信 | F12: 通信互联 | G12: 通信设备 | H12: 108.05 | I12: -2.0999999999999999e-003 | J12: 1.1000000000000001e-003 | K12: 10.33 | L12: -7.7000000000000002e-003 | M12: 124.2 | N12: 18.78 | O12: 0.96400000000000008 | P12: 55.01 | Q12: 转股中 | R12: 4.60年 | S12: 2.60年 | T12: 2.7 | U12: 3.2 | V12: 1.1000000000000001e-002 | W12: 0.128 | X12: 7.0000000000000007e-002 | Y12: 21 | Z12: 2.97 | AA12: 3.15e-002 | AB12: 2.23e-002 | AC12: -1.34e-002 | AD12: -1.6299999999999999e-002 | AE12: 86.06 | AF12: 90.86 | AG12: 0.14 | AH12: A+ | AI12: 7.2099999999999997e-002 | AJ12: =H12+100*O12 -> 204.44999999999999 | AK12: 161.1 | AL12: 250 | AM12: 70.2 | AN12: 253 | AO12: -2.7999999999999997e-002 | AP12: 26 | AQ12: 纵横转债!
A13: 152 | B13: 113596 | C13: 城地转债! | D13: 603887 | E13: 城地香江 | F13: 通信互联 | G13: 通信设备 | H13: 97.97 | I13: -8.8000000000000005e-003 | J13: 8.6999999999999994e-003 | K13: 8.71 | L13: -1.47e-002 | M13: 113.1 | N13: 24.26 | O13: 1.73 | P13: 35.9 | Q13: 转股中 | R13: 4.88年 | S13: 2.88年 | T13: 12 | U13: 23 | V13: 1.9e-002 | W13: 0.30599999999999999 | X13: 0.11 | Y13: 39 | Z13: 1.03 | AA13: 3.0499999999999999e-002 | AB13: 2.53e-002 | AC13: 1.8100000000000002e-002 | AD13: 1.5900000000000001e-002 | AE13: 86.47 | AF13: 85.18 | AG13: 0.01 | AH13: AA- | AI13: 6.1100000000000002e-002 | AJ13: =H13+100*O13 -> 270.97000000000003 | AK13: 160 | AL13: 240 | AM13: 73.6 | AN13: 269 | AO13: -2.2000000000000002e-002 | AP13: 30 | AQ13: 城地转债!
A14: 139 | B14: 113601 | C14: 塞力转债! | D14: 603716 | E14: 塞力医疗 | F14: 医药 | G14: 医药商业 | H14: 105 | I14: -4.8999999999999998e-003 | J14: 1.1999999999999999e-003 | K14: 11.2 | L14: -1.41e-002 | M14: 120.8 | N14: 16.98 | O14: 0.59200000000000008 | P14: 65.96 | Q14: 转股中 | R14: 4.94年 | S14: 2.95年 | T14: 5.43 | U14: 9.9 | V14: 1.7000000000000001e-002 | W14: 0.23699999999999999 | X14: 0.156 | Y14: 23 | Z14: 1.52 | AA14: 2.9399999999999999e-002 | AB14: 2.1899999999999999e-002 | AC14: -4.0000000000000001e-003 | AD14: -6.3e-003 | AE14: 86.39 | AF14: 90.65 | AG14: 0.27 | AH14: AA- | AI14: 6.1100000000000002e-002 | AJ14: =H14+100*O14 -> 164.20000000000002 | AK14: 144 | AL14: 135 | AM14: 53.4 | AN14: 160 | AO14: -3.7000000000000005e-002 | AP14: 38 | AQ14: 塞力转债!
A15: 258 | B15: 110059 | C15: 浦发转债! | D15: 600000 | E15: 浦发银行 | F15: 金融 | G15: 银行行业 | H15: 104.8 | I15: 3.7000000000000002e-003 | J15: -2.2000000000000001e-003 | K15: 9.41 | L15: 1.18e-002 | M15: 117.6 | N15: 13.97 | O15: 0.55600000000000005 | P15: 67.36 | Q15: 转股中 | R15: 4年47天 | S15: 无权 | T15: 500 | U15: 456 | V15: 9.0000000000000011e-003 | W15: 0.18100000000000002 | X15: 0.122 | Y15: 2762. | Z15: 0.51 | AA15: 2.92e-002 | AB15: 2.1299999999999999e-002 | AC15: 无权 | AD15: 无权 | AE15: 无权 | AF15: 103.24 | AG15: 0.13 | AH15: AAA | AI15: 3.3099999999999997e-002 | AJ15: =H15+100*O15 -> 160.40000000000001 | AK15: 142.2 | AL15: 111 | AM15: 39 | AN15: 47 | AO15: 2.2000000000000002e-002 | AP15: 61 | AQ15: 浦发转债!
A16: 347 | B16: 113017 | C16: 吉视转债! | D16: 601929 | E16: 吉视传媒 | F16: 传媒娱乐 | G16: 影视娱乐 | H16: 102.04 | I16: 5.0000000000000001e-004 | J16: -1.2999999999999999e-003 | K16: 1.97 | L16: -1.4999999999999999e-002 | M16: 108.8 | N16: 2.95 | O16: 0.52800000000000002 | P16: 66.78 | Q16: 转股中 | R16: 2.30年 | S16: 0.30年 | T16: 15.6 | U16: 43 | V16: 2.7000000000000003e-002 | W16: 0.254 | X16: 0.17000000000000001 | Y16: 61 | Z16: 0.92 | AA16: 2.8799999999999999e-002 | AB16: 2.1299999999999999e-002 | AC16: -1.04e-002 | AD16: -1.6899999999999998e-002 | AE16: 100.01 | AF16: 100.96 | AG16: 0.05 | AH16: AA+ | AI16: 3.3700000000000001e-002 | AJ16: =H16+100*O16 -> 154.84 | AK16: 137.3 | AL16: 57 | AM16: 36.3 | AN16: 29 | AO16: 7.9000000000000001e-002 | AP16: 69 | AQ16: 吉视转债!
A17: 69 | B17: 113042 | C17: 上银转债! | D17: 601229 | E17: 上海银行 | F17: 金融 | G17: 银行行业 | H17: 104.4 | I17: 5.1000000000000004e-003 | J17: -3.5999999999999999e-003 | K17: 7.55 | L17: 6.7000000000000002e-003 | M17: 120.9 | N17: 10.63 | O17: 0.46999999999999997 | P17: 71.03 | Q17: 转股中 | R17: 5.37年 | S17: 无权 | T17: 200 | U17: 336 | V17: 1.6e-002 | W17: 0.18600000000000003 | X17: 0.13200000000000001 | Y17: 1073. | Z17: 0.61 | AA17: 2.8500000000000001e-002 | AB17: 2.1499999999999998e-002 | AC17: 无权 | AD17: 无权 | AE17: 无权 | AF17: 101.19 | AG17: 0.23 | AH17: AAA | AI17: 3.4700000000000002e-002 | AJ17: =H17+100*O17 -> 151.40000000000001 | AK17: 137.8 | AL17: 66 | AM17: 36.6 | AN17: 30 | AO17: 3.3000000000000002e-002 | AP17: 13 | AQ17: 上银转债!
A18: 178 | B18: 123056 | C18: 雪榕转债! | D18: 300511 | E18: 雪榕生物 | F18: 农业 | G18: 种植业 | H18: 105.9 | I18: -6.9999999999999993e-003 | J18: 5.5000000000000005e-003 | K18: 7.11 | L18: -8.3999999999999995e-003 | M18: 120.7 | N18: 11.77 | O18: 0.753 | P18: 60.41 | Q18: 转股中 | R18: 4.78年 | S18: 2.79年 | T18: 5.84 | U18: 9.7 | V18: 1.6e-002 | W18: 0.18600000000000003 | X18: 0.11199999999999999 | Y18: 31 | Z18: 1.7 | AA18: 2.8300000000000002e-002 | AB18: 2.06e-002 | AC18: -7.4000000000000003e-003 | AD18: -9.7999999999999997e-003 | AE18: 87.12 | AF18: 91.42 | AG18: 0.18 | AH18: AA- | AI18: 6.1100000000000002e-002 | AJ18: =H18+100*O18 -> 181.19999999999999 | AK18: 151.4 | AL18: 196 | AM18: 60 | AN18: 194 | AO18: 4.0000000000000001e-003 | AP18: 17 | AQ18: 雪榕转债!
A19: 196 | B19: 113578 | C19: 全筑转债! | D19: 603030 | E19: 全筑股份 | F19: 建筑 | G19: 装饰工程 | H19: 103.97 | I19: -7.9000000000000008e-003 | J19: 3.7000000000000002e-003 | K19: 3.82 | L19: -2.0499999999999997e-002 | M19: 117.9 | N19: 5.4 | O19: 0.46999999999999997 | P19: 70.74 | Q19: 转股中 | R19: 4.61年 | S19: 2.61年 | T19: 3.84 | U19: 8.4 | V19: 2.1000000000000001e-002 | W19: 0.17300000000000001 | X19: 0.12300000000000001 | Y19: 22 | Z19: 1 | AA19: 2.8199999999999999e-002 | AB19: 2.1099999999999997e-002 | AC19: -2.e-003 | AD19: -4.4000000000000003e-003 | AE19: 92.81 | AF19: 98.71 | AG19: 0.21 | AH19: AA | AI19: 4.0099999999999997e-002 | AJ19: =H19+100*O19 -> 150.97 | AK19: 137.2 | AL19: 56 | AM19: 38.5 | AN19: 40 | AO19: -5.9999999999999998e-002 | AP19: 24 | AQ19: 全筑转债!
A20: 365 | B20: 128015 | C20: 久其转债!! | D20: 2279 | E20: 久其软件 | F20: 计算机及 | G20: 软件开发 | H20: 104.4 | I20: -5.1999999999999998e-003 | J20: 5.1999999999999998e-003 | K20: 4.86 | L20: -1.8200000000000001e-002 | M20: 109.5 | N20: 6.97 | O20: 0.49700000000000005 | P20: 69.73 | Q20: 转股中 | R20: 1.74年 | S20: 回售内 | T20: 7.8 | U20: 29 | V20: 3.6000000000000004e-002 | W20: 0.22600000000000001 | X20: 0.157 | Y20: 35 | Z20: 4.19 | AA20: 2.7999999999999997e-002 | AB20: 1.7600000000000001e-002 | AC20: 回售内 | AD20: 回售内 | AE20: 100.25 | AF20: 97.31 | AG20: 0 | AH20: A+ | AI20: 7.0699999999999999e-002 | AJ20: =H20+100*O20 -> 154.10000000000002 | AK20: 139.1 | AL20: 82 | AM20: 38.8 | AN20: 44 | AO20: 3.7999999999999999e-002 | AP20: 69 | AQ20: 久其转债!!
A21: 171 | B21: 128118 | C21: 瀛通转债! | D21: 2861 | E21: 瀛通通讯 | F21: 电子 | G21: 电子产品 | H21: 107.01 | I21: -4.5000000000000005e-003 | J21: 1.4000000000000002e-003 | K21: 12.21 | L21: -1.9299999999999998e-002 | M21: 121.7 | N21: 21.24 | O21: 0.86199999999999999 | P21: 57.49 | Q21: 转股中 | R21: 4.81年 | S21: 2.81年 | T21: 3 | U21: 3.2 | V21: 1.e-002 | W21: 0.157 | X21: 8.9999999999999997e-002 | Y21: 19 | Z21: 1.83 | AA21: 2.7799999999999998e-002 | AB21: 1.9799999999999998e-002 | AC21: -9.0000000000000011e-003 | AD21: -1.1699999999999999e-002 | AE21: 87.51 | AF21: 92.13 | AG21: 0.16 | AH21: AA- | AI21: 6.1100000000000002e-002 | AJ21: =H21+100*O21 -> 193.21000000000001 | AK21: 156.5 | AL21: 224 | AM21: 64.4 | AN21: 227 | AO21: -1.8000000000000002e-002 | AP21: 19 | AQ21: 瀛通转债!
A22: 294 | B22: 113530 | C22: 大丰转债! | D22: 603081 | E22: 大丰实业 | F22: 建筑 | G22: 装饰工程 | H22: 110.31 | I22: -4.5000000000000005e-003 | J22: 1.1999999999999999e-003 | K22: 12.31 | L22: -2.1499999999999998e-002 | M22: 121 | N22: 16.49 | O22: 0.47799999999999998 | P22: 74.65 | Q22: 转股中 | R22: 3.54年 | S22: 1.54年 | T22: 6.3 | U22: 5 | V22: 6.9999999999999993e-003 | W22: 0.127 | X22: 9.5000000000000001e-002 | Y22: 49 | Z22: 2.18 | AA22: 2.7000000000000003e-002 | AB22: 1.6500000000000001e-002 | AC22: -4.0099999999999997e-002 | AD22: -4.3200000000000002e-002 | AE22: 96.28 | AF22: 105.57 | AG22: 0.16 | AH22: AA | AI22: 4.0099999999999997e-002 | AJ22: =H22+100*O22 -> 158.11000000000001 | AK22: 146 | AL22: 153 | AM22: 40.4 | AN22: 55 | AO22: -3.0000000000000001e-003 | AP22: 31 | AQ22: 大丰转债!
A23: 322 | B23: 128044 | C23: 岭南转债! | D23: 2717 | E23: 岭南股份 | F23: 城市公用 | G23: 生态环境 | H23: 102.304 | I23: -6.9999999999999993e-003 | J23: 6.8999999999999999e-003 | K23: 3.13 | L23: -3.4000000000000002e-002 | M23: 110.3 | N23: 5.91 | O23: 0.93200000000000005 | P23: 52.96 | Q23: 转股中 | R23: 2.92年 | S23: 0.93年 | T23: 6.59 | U23: 23 | V23: 3.3000000000000002e-002 | W23: 0.13800000000000001 | X23: 7.2999999999999995e-002 | Y23: 48 | Z23: 1.1 | AA23: 2.6499999999999999e-002 | AB23: 1.9699999999999999e-002 | AC23: -4.5000000000000005e-003 | AD23: -7.7000000000000002e-003 | AE23: 95.56 | AF23: 93.33 | AG23: 0.01 | AH23: AA- | AI23: 5.9699999999999996e-002 | AJ23: =H23+100*O23 -> 195.50400000000002 | AK23: 151.6 | AL23: 197 | AM23: 56.1 | AN23: 177 | AO23: 5.5999999999999994e-002 | AP23: 51 | AQ23: 岭南转债!
A24: 305 | B24: 113021 | C24: 中信转债! | D24: 601998 | E24: 中信银行 | F24: 金融 | G24: 银行行业 | H24: 108.19 | I24: 8.0000000000000002e-003 | J24: -7.1999999999999998e-003 | K24: 4.79 | L24: 6.3e-003 | M24: 118 | N24: 6.73 | O24: 0.52000000000000002 | P24: 71.17 | Q24: 转股中 | R24: 3.48年 | S24: 无权 | T24: 400 | U24: 245 | V24: 6.0000000000000001e-003 | W24: 0.17100000000000001 | X24: 0.121 | Y24: 2344. | Z24: 0.49 | AA24: 2.6099999999999998e-002 | AB24: 1.66e-002 | AC24: 无权 | AD24: 无权 | AE24: 无权 | AF24: 105.73 | AG24: 0.13 | AH24: AAA | AI24: 3.3099999999999997e-002 | AJ24: =H24+100*O24 -> 160.19 | AK24: 145.2 | AL24: 144 | AM24: 39.5 | AN24: 50 | AO24: 3.2000000000000001e-002 | AP24: 42 | AQ24: 中信转债!
A25: 144 | B25: 113600 | C25: 新星转债! | D25: 603978 | E25: 深圳新星 | F25: 有色金属 | G25: 有色行业 | H25: 110.94 | I25: -1.43e-002 | J25: -8.0000000000000004e-004 | K25: 20.68 | L25: -3.32e-002 | M25: 125.6 | N25: 23.85 | O25: 0.27899999999999997 | P25: 86.71 | Q25: 转股中 | R25: 4.92年 | S25: 2.92年 | T25: 5.95 | U25: 20 | V25: 3.1e-002 | W25: 0.17999999999999999 | X25: 0.156 | Y25: 33 | Z25: 2.18 | AA25: 2.6000000000000002e-002 | AB25: 1.72e-002 | AC25: -2.23e-002 | AD25: -2.4399999999999998e-002 | AE25: 86.32 | AF25: 94.32 | AG25: 0.46 | AH25: AA- | AI25: 6.1100000000000002e-002 | AJ25: =H25+100*O25 -> 138.84 | AK25: 135.2 | AL25: 37 | AM25: 40.9 | AN25: 61 | AO25: 6.4000000000000001e-002 | AP25: 25 | AQ25: 新星转债!
A26: 275 | B26: 128069 | C26: 华森转债! | D26: 2907 | E26: 华森制药 | F26: 医药 | G26: 化学制药 | H26: 108.919 | I26: -5.3e-003 | J26: 4.7999999999999996e-003 | K26: 12.33 | L26: -2.3999999999999998e-003 | M26: 119.3 | N26: 18.01 | O26: 0.59099999999999997 | P26: 68.46 | Q26: 转股中 | R26: 3.78年 | S26: 1.79年 | T26: 3 | U26: 2.9 | V26: 9.0000000000000011e-003 | W26: 6.0999999999999999e-002 | X26: 4.0999999999999995e-002 | Y26: 50 | Z26: 4.32 | AA26: 2.4799999999999999e-002 | AB26: 1.5700000000000002e-002 | AC26: -2.9399999999999999e-002 | AD26: -3.2099999999999997e-002 | AE26: 91.63 | AF26: 95.7 | AG26: 0.2 | AH26: AA- | AI26: 6.1100000000000002e-002 | AJ26: =H26+100*O26 -> 168.01900000000001 | AK26: 149.4 | AL26: 182 | AM26: 53.7 | AN26: 163 | AO26: 1.3000000000000001e-002 | AP26: 43 | AQ26: 华森转债!
A27: 243 | B27: 110064 | C27: 建工转债! | D27: 600939 | E27: 重庆建工 | F27: 建筑 | G27: 建筑工程 | H27: 108.26 | I27: -1.04e-002 | J27: 4.3e-003 | K27: 3.66 | L27: -2.4e-002 | M27: 119.8 | N27: 4.53 | O27: 0.34000000000000002 | P27: 80.79 | Q27: 转股中 | R27: 4.27年 | S27: 2.28年 | T27: 16.6 | U27: 30 | V27: 1.7000000000000001e-002 | W27: 0.25 | X27: 0.20199999999999999 | Y27: 66 | Z27: 0.92 | AA27: 2.46e-002 | AB27: 1.6299999999999999e-002 | AC27: -1.6e-002 | AD27: -1.9199999999999998e-002 | AE27: 95.81 | AF27: 103.76 | AG27: 0.25 | AH27: AA+ | AI27: 3.5099999999999999e-002 | AJ27: =H27+100*O27 -> 142.25999999999999 | AK27: 135.7 | AL27: 42 | AM27: 32 | AN27: 12 | AO27: 5.9000000000000004e-002 | AP27: 46 | AQ27: 建工转债!
A28: 227 | B28: 113566 | C28: 翔港转债! | D28: 603499 | E28: 翔港科技 | F28: 造纸包装 | G28: 包装材料 | H28: 111.53 | I28: -9.5999999999999992e-003 | J28: 7.4999999999999997e-003 | K28: 7.41 | L28: -6.7000000000000002e-003 | M28: 124 | N28: 10.77 | O28: 0.621 | P28: 68.8 | Q28: 转股中 | R28: 4.47年 | S28: 2.47年 | T28: 1.61 | U28: 4.6 | V28: 2.5000000000000001e-002 | W28: 0.10800000000000001 | X28: 7.400000000000001e-002 | Y28: 15 | Z28: 2.62 | AA28: 2.46e-002 | AB28: 1.5300000000000001e-002 | AC28: -2.5899999999999999e-002 | AD28: -2.8799999999999999e-002 | AE28: 86.92 | AF28: 91.55 | AG28: 0.31 | AH28: A+ | AI28: 7.2099999999999997e-002 | AJ28: =H28+100*O28 -> 173.63 | AK28: 154.3 | AL28: 210 | AM28: 62.7 | AN28: 215 | AO28: 4.0000000000000001e-003 | AP28: 28 | AQ28: 翔港转债!
A29: 32 | B29: 113624 | C29: 正川转债! | D29: 603976 | E29: 正川股份 | F29: 医药 | G29: 医药行业 | H29: 106.7 | I29: -2.8999999999999998e-003 | J29: -2.0000000000000001e-004 | K29: 32.66 | L29: -7.3000000000000001e-003 | M29: 121.6 | N29: 46.69 | O29: 0.52500000000000002 | P29: 69.95 | Q29: 59天 | R29: 5.63年 | S29: 3.63年 | T29: 4.05 | U29: 11 | V29: 2.6000000000000002e-002 | W29: 8.199999999999999e-002 | X29: 5.7000000000000002e-002 | Y29: 49 | Z29: 4.6 | AA29: 2.4e-002 | AB29: 1.7299999999999999e-002 | AC29: -5.3e-003 | AD29: -7.6e-003 | AE29: 80.12 | AF29: 82.27 | AG29: 0.43 | AH29: A+ | AI29: 7.3700000000000002e-002 | AJ29: =H29+100*O29 -> 159.19999999999999 | AK29: 143.4 | AL29: 130 | AM29: 61.2 | AN29: 202 | AO29: -2.7999999999999997e-002 | AP29: 16 | AQ29: 正川转债!
A30: 208 | B30: 127016 | C30: 鲁泰转债! | D30: 726 | E30: 鲁 泰Ａ | F30: 服装纺织 | G30: 纺织行业 | H30: 104.6 | I30: -2.2000000000000001e-003 | J30: 3.0000000000000001e-003 | K30: 6.01 | L30: 5.0000000000000001e-003 | M30: 115.9 | N30: 8.71 | O30: 0.51600000000000001 | P30: 69 | Q30: 转股中 | R30: 4.58年 | S30: 2.58年 | T30: 14 | U30: 8.8 | V30: 6.0000000000000001e-003 | W30: 0.26400000000000001 | X30: 0.182 | Y30: 53 | Z30: 0.68 | AA30: 2.3099999999999999e-002 | AB30: 1.67e-002 | AC30: -4.1999999999999997e-003 | AD30: -6.6e-003 | AE30: 94.14 | AF30: 99.28 | AG30: 0.16 | AH30: AA+ | AI30: 3.5099999999999999e-002 | AJ30: =H30+100*O30 -> 156.19999999999999 | AK30: 140.2 | AL30: 93 | AM30: 40.9 | AN30: 65 | AO30: 6.3e-002 | AP30: 22 | AQ30: 鲁泰转债!
A31: 67 | B31: 123096 | C31: 思创转债! | D31: 300078 | E31: 思创医惠 | F31: 通信互联 | G31: 物联网 | H31: 109.99 | I31: -8.1000000000000013e-003 | J31: 1.5e-003 | K31: 6.66 | L31: -1.4800000000000001e-002 | M31: 124 | N31: 8.27 | O31: 0.36599999999999999 | P31: 80.53 | Q31: 转股中 | R31: 5.38年 | S31: 3.38年 | T31: 8.17 | U31: 5.4 | V31: 6.0000000000000001e-003 | W31: 0.14099999999999999 | X31: 0.114 | Y31: 58 | Z31: 2.13 | AA31: 2.3e-002 | AB31: 1.5300000000000001e-002 | AC31: -1.6e-002 | AD31: -1.8100000000000002e-002 | AE31: 83.97 | AF31: 90.03 | AG31: 0.44 | AH31: AA- | AI31: 6.2699999999999992e-002 | AJ31: =H31+100*O31 -> 146.59 | AK31: 139.4 | AL31: 84 | AM31: 49.4 | AN31: 132 | AO31: -1.1000000000000001e-002 | AP31: 8 | AQ31: 思创转债!
A32: 333 | B32: 127007 | C32: 湖广转债! | D32: 665 | E32: 湖北广电 | F32: 传媒娱乐 | G32: 影视娱乐 | H32: 104.747 | I32: -2.9999999999999997e-004 | J32: -1.e-003 | K32: 3.87 | L32: -1.2800000000000001e-002 | M32: 111.3 | N32: 5.58 | O32: 0.51000000000000001 | P32: 69.35 | Q32: 转股中 | R32: 2.79年 | S32: 0.80年 | T32: 12.2 | U32: 7.6 | V32: 6.0000000000000001e-003 | W32: 0.32000000000000001 | X32: 0.222 | Y32: 38 | Z32: 0.66 | AA32: 2.23e-002 | AB32: 1.47e-002 | AC32: -2.92e-002 | AD32: -3.2799999999999996e-002 | AE32: 98.61 | AF32: 101.59 | AG32: 0.1 | AH32: AA+ | AI32: 3.3700000000000001e-002 | AJ32: =H32+100*O32 -> 155.74700000000001 | AK32: 140.1 | AL32: 92 | AM32: 38.5 | AN32: 42 | AO32: 4.7e-002 | AP32: 19 | AQ32: 湖广转债!
A33: 187 | B33: 113584 | C33: 家悦转债! | D33: 603708 | E33: 家家悦 | F33: 商业零售 | G33: 超市 | H33: 103.79 | I33: -3.8e-003 | J33: 3.5999999999999999e-003 | K33: 15.9 | L33: -1.49e-002 | M33: 114.9 | N33: 37.53 | O33: 1.45 | P33: 42.37 | Q33: 转股中 | R33: 4.73年 | S33: 2.73年 | T33: 6.45 | U33: 4.7 | V33: 6.9999999999999993e-003 | W33: 6.7000000000000004e-002 | X33: 2.7999999999999997e-002 | Y33: 97 | Z33: 3.74 | AA33: 2.2099999999999998e-002 | AB33: 1.6299999999999999e-002 | AC33: -1.2999999999999999e-003 | AD33: -3.5999999999999999e-003 | AE33: 92.35 | AF33: 95.74 | AG33: 0.02 | AH33: AA | AI33: 4.0099999999999997e-002 | AJ33: =H33+100*O33 -> 248.79000000000002 | AK33: 165.2 | AL33: 264 | AM33: 69.5 | AN33: 249 | AO33: 4.2000000000000003e-002 | AP33: 15 | AQ33: 家悦转债!
A34: 282 | B34: 128066 | C34: 亚泰转债! | D34: 2811 | E34: 郑中设计 | F34: 建筑 | G34: 装饰工程 | H34: 108.137 | I34: -9.1999999999999998e-003 | J34: 7.6e-003 | K34: 8.24 | L34: -3.5999999999999999e-003 | M34: 116.7 | N34: 9.27 | O34: 0.217 | P34: 88.89 | Q34: 转股中 | R34: 3.60年 | S34: 1.60年 | T34: 4.8 | U34: 6 | V34: 1.1000000000000001e-002 | W34: 0.21600000000000003 | X34: 0.192 | Y34: 22 | Z34: 1.62 | AA34: 2.1899999999999999e-002 | AB34: 1.34e-002 | AC34: -2.7200000000000002e-002 | AD34: -3.0499999999999999e-002 | AE34: 92.88 | AF34: 94.7 | AG34: 0.44 | AH34: AA- | AI34: 6.1100000000000002e-002 | AJ34: =H34+100*O34 -> 129.83699999999999 | AK34: 127.4 | AL34: 7 | AM34: 32.7 | AN34: 13 | AO34: 3.5000000000000003e-002 | AP34: 62 | AQ34: 亚泰转债!
A35: 240 | B35: 123039 | C35: 开润转债! | D35: 300577 | E35: 开润股份 | F35: 服装纺织 | G35: 纺织行业 | H35: 110.8 | I35: -8.6999999999999994e-003 | J35: 8.3000000000000001e-003 | K35: 20 | L35: -1.5e-003 | M35: 121 | N35: 29.9 | O35: 0.65599999999999992 | P35: 66.89 | Q35: 转股中 | R35: 4.29年 | S35: 2.29年 | T35: 2.22 | U35: 3.6 | V35: 1.4999999999999999e-002 | W35: 4.5999999999999999e-002 | X35: 3.1e-002 | Y35: 48 | Z35: 3.09 | AA35: 2.12e-002 | AB35: 1.26e-002 | AC35: -2.5399999999999999e-002 | AD35: -2.8500000000000001e-002 | AE35: 87.9 | AF35: 90.43 | AG35: 0.27 | AH35: A+ | AI35: 7.2099999999999997e-002 | AJ35: =H35+100*O35 -> 176.39999999999998 | AK35: 154.7 | AL35: 213 | AM35: 64.3 | AN35: 226 | AO35: 0.105 | AP35: 23 | AQ35: 开润转债!
A36: 289 | B36: 128063 | C36: 未来转债! | D36: 2631 | E36: 德尔未来 | F36: 其他 | G36: 家居用品 | H36: 118.687 | I36: -1.26e-002 | J36: 2.e-003 | K36: 8.99 | L36: -2.07e-002 | M36: 127.5 | N36: 8.6 | O36: 0.13500000000000001 | P36: 104.53 | Q36: 转股中 | R36: 3.56年 | S36: 2.56年 | T36: 6.29 | U36: 86 | V36: 0.114 | W36: 0.105 | X36: 0.11 | Y36: 60 | Z36: 3.53 | AA36: 2.0899999999999998e-002 | AB36: 8.0000000000000002e-003 | AC36: -3.4099999999999998e-002 | AD36: -3.95e-002 | AE36: 92.36 | AF36: 103.89 | AG36: 0.51 | AH36: AA- | AI36: 6.1100000000000002e-002 | AJ36: =H36+100*O36 -> 132.18700000000001 | AK36: 132.8 | AL36: 25 | AM36: 29 | AN36: 4 | AO36: 7.0000000000000007e-002 | AP36: 36 | AQ36: 未来转债!
A37: 102 | B37: 123077 | C37: 汉得转债! | D37: 300170 | E37: 汉得信息 | F37: 计算机及 | G37: 软件开发 | H37: 113.003 | I37: -5.1999999999999998e-003 | J37: 3.7000000000000002e-003 | K37: 7.73 | L37: -5.1000000000000004e-003 | M37: 125.5 | N37: 9.69 | O37: 0.41700000000000004 | P37: 79.77 | Q37: 转股中 | R37: 5.20年 | S37: 3.20年 | T37: 9.37 | U37: 18 | V37: 1.7000000000000001e-002 | W37: 0.13699999999999998 | X37: 0.109 | Y37: 68 | Z37: 2.16 | AA37: 2.0799999999999999e-002 | AB37: 1.2500000000000001e-002 | AC37: -2.5000000000000001e-002 | AD37: -2.7200000000000002e-002 | AE37: 90.62 | AF37: 101.9 | AG37: 0.29 | AH37: AA | AI37: 4.1700000000000001e-002 | AJ37: =H37+100*O37 -> 154.703 | AK37: 146.2 | AL37: 154 | AM37: 44.3 | AN37: 91 | AO37: 1.3000000000000001e-002 | AP37: 15 | AQ37: 汉得转债!
A38: 148 | B38: 128125 | C38: 华阳转债! | D38: 2949 | E38: 华阳国际 | F38: 建筑 | G38: 建筑工程 | H38: 107.197 | I38: -4.6999999999999993e-003 | J38: -3.0000000000000001e-003 | K38: 16.32 | L38: -3.0299999999999997e-002 | M38: 118.1 | N38: 25.39 | O38: 0.66799999999999993 | P38: 64.28 | Q38: 转股中 | R38: 4.88年 | S38: 2.89年 | T38: 4.5 | U38: 4.9 | V38: 1.e-002 | W38: 0.14099999999999999 | X38: 8.9999999999999997e-002 | Y38: 32 | Z38: 2.52 | AA38: 2.0400000000000001e-002 | AB38: 1.38e-002 | AC38: -1.1699999999999999e-002 | AD38: -1.3899999999999999e-002 | AE38: 86.44 | AF38: 88.89 | AG38: 0.25 | AH38: AA- | AI38: 6.1100000000000002e-002 | AJ38: =H38+100*O38 -> 173.99700000000001 | AK38: 150.1 | AL38: 186 | AM38: 61.2 | AN38: 203 | AO38: 6.9999999999999993e-003 | AP38: 8 | AQ38: 华阳转债!
A39: 284 | B39: 127013 | C39: 创维转债! | D39: 810 | E39: 创维数字 | F39: 电子 | G39: 电子产品 | H39: 109.3 | I39: -9.1000000000000004e-003 | J39: 8.199999999999999e-003 | K39: 8.35 | L39: -4.7999999999999996e-003 | M39: 117.3 | N39: 11.29 | O39: 0.47799999999999998 | P39: 73.96 | Q39: 转股中 | R39: 3.59年 | S39: 1.59年 | T39: 9.78 | U39: 2.8 | V39: 3.0000000000000001e-003 | W39: 0.11 | X39: 8.1000000000000003e-002 | Y39: 89 | Z39: 2.09 | AA39: 2.0199999999999999e-002 | AB39: 1.1599999999999999e-002 | AC39: -3.4500000000000003e-002 | AD39: -3.7400000000000003e-002 | AE39: 95.98 | AF39: 102.12 | AG39: 0.17 | AH39: AA | AI39: 4.0099999999999997e-002 | AJ39: =H39+100*O39 -> 157.09999999999999 | AK39: 144.6 | AL39: 139 | AM39: 42.5 | AN39: 79 | AO39: 5.5999999999999994e-002 | AP39: 23 | AQ39: 创维转债!
A40: 31 | B40: 127034 | C40: 绿茵转债! | D40: 2887 | E40: 绿茵生态 | F40: 城市公用 | G40: 生态环境 | H40: 107.257 | I40: -7.1999999999999998e-003 | J40: -4.0000000000000001e-003 | K40: 10.78 | L40: -2.e-002 | M40: 119 | N40: 12.38 | O40: 0.23199999999999998 | P40: 87.08 | Q40: 2月2天 | R40: 5.63年 | S40: 3.64年 | T40: 7.12 | U40: 14 | V40: 1.9e-002 | W40: 0.21199999999999999 | X40: 0.184 | Y40: 34 | Z40: 1.66 | AA40: 1.9e-002 | AB40: 1.3000000000000001e-002 | AC40: -8.3000000000000001e-003 | AD40: -1.03e-002 | AE40: 82.66 | AF40: 85.08 | AG40: 0.56 | AH40: AA- | AI40: 6.2699999999999992e-002 | AJ40: =H40+100*O40 -> 130.45699999999999 | AK40: 127.4 | AL40: 8 | AM40: 42.4 | AN40: 77 | AO40: 1.7000000000000001e-002 | AP40: 25 | AQ40: 绿茵转债!
A41: 59 | B41: 113620 | C41: 傲农转债! | D41: 603363 | E41: 傲农生物 | F41: 农业 | G41: 畜牧业 | H41: 109.52 | I41: -1.8e-003 | J41: -1.e-004 | K41: 8.44 | L41: -1.6299999999999999e-002 | M41: 121.1 | N41: 14.51 | O41: 0.88300000000000001 | P41: 58.17 | Q41: 6.0天 | R41: 5.49年 | S41: 3.50年 | T41: 10 | U41: 4.3 | V41: 4.0000000000000001e-003 | W41: 0.17300000000000001 | X41: 0.10099999999999999 | Y41: 58 | Z41: 2.3 | AA41: 1.8799999999999997e-002 | AB41: 1.21e-002 | AC41: -1.52e-002 | AD41: -1.7000000000000001e-002 | AE41: 89.32 | AF41: 97.14 | AG41: 0.12 | AH41: AA | AI41: 4.1700000000000001e-002 | AJ41: =H41+100*O41 -> 197.81999999999999 | AK41: 160.9 | AL41: 247 | AM41: 63.7 | AN41: 220 | AO41: -1.e-002 | AP41: 8 | AQ41: 傲农转债!
A42: 219 | B42: 123044 | C42: 红相转债!! | D42: 300427 | E42: 红相股份 | F42: 能源电力 | G42: 电力设备 | H42: 115.6 | I42: -7.1999999999999998e-003 | J42: 4.5000000000000005e-003 | K42: 14.91 | L42: -7.3000000000000001e-003 | M42: 125 | N42: 18.67 | O42: 0.44799999999999995 | P42: 79.86 | Q42: 转股中 | R42: 4.50年 | S42: 2.50年 | T42: 5.5 | U42: 26 | V42: 4.0999999999999995e-002 | W42: 0.10199999999999999 | X42: 8.199999999999999e-002 | Y42: 54 | Z42: 2.3 | AA42: 1.8000000000000002e-002 | AB42: 8.5000000000000006e-003 | AC42: -3.7499999999999999e-002 | AD42: -4.0599999999999997e-002 | AE42: 89.39 | AF42: 96.4 | AG42: 0.37 | AH42: AA- | AI42: 6.1100000000000002e-002 | AJ42: =H42+100*O42 -> 160.39999999999998 | AK42: 151.3 | AL42: 195 | AM42: 54.9 | AN42: 172 | AO42: -6.2e-002 | AP42: 22 | AQ42: 红相转债!!
A43: 104 | B43: 123076 | C43: 强力转债! | D43: 300429 | E43: 强力新材 | F43: 化工 | G43: 化工 | H43: 108.4 | I43: 1.e-004 | J43: 6.9999999999999993e-003 | K43: 12.86 | L43: 2.23e-002 | M43: 118.5 | N43: 18.94 | O43: 0.59599999999999997 | P43: 67.9 | Q43: 转股中 | R43: 5.19年 | S43: 3.19年 | T43: 8.5 | U43: 21 | V43: 2.3e-002 | W43: 0.128 | X43: 8.6999999999999994e-002 | Y43: 66 | Z43: 3.72 | AA43: 1.77e-002 | AB43: 1.1299999999999999e-002 | AC43: -1.29e-002 | AD43: -1.4999999999999999e-002 | AE43: 84.85 | AF43: 87.02 | AG43: 0.32 | AH43: AA- | AI43: 6.2699999999999992e-002 | AJ43: =H43+100*O43 -> 168. | AK43: 148.9 | AL43: 180 | AM43: 61.9 | AN43: 208 | AO43: -4.2999999999999997e-002 | AP43: 17 | AQ43: 强力转债!
A44: 200 | B44: 123049 | C44: 维尔转债! | D44: 300190 | E44: 维尔利 | F44: 城市公用 | G44: 三废处理 | H44: 114.94 | I44: 2.5000000000000001e-003 | J44: -1.23e-002 | K44: 6.59 | L44: -2.0799999999999999e-002 | M44: 124.3 | N44: 7.38 | O44: 0.28699999999999998 | P44: 89.3 | Q44: 转股中 | R44: 4.59年 | S44: 2.59年 | T44: 9.17 | U44: 9.6 | V44: 9.0000000000000011e-003 | W44: 0.17800000000000002 | X44: 0.159 | Y44: 52 | Z44: 1.19 | AA44: 1.7600000000000001e-002 | AB44: 8.6e-003 | AC44: -3.5299999999999998e-002 | AD44: -3.8100000000000002e-002 | AE44: 88.68 | AF44: 95.31 | AG44: 0.47 | AH44: AA- | AI44: 6.1100000000000002e-002 | AJ44: =H44+100*O44 -> 143.63999999999999 | AK44: 140.6 | AL44: 96 | AM44: 45.3 | AN44: 99 | AO44: 3.7000000000000005e-002 | AP44: 19 | AQ44: 维尔转债!
A45: 265 | B45: 128074 | C45: 游族转债!! | D45: 2174 | E45: 游族网络 | F45: 通信互联 | G45: 互联网 | H45: 112 | I45: 1.e-004 | J45: 1.2999999999999999e-003 | K45: 13.26 | L45: 4.5000000000000005e-003 | M45: 119.9 | N45: 16.97 | O45: 0.433 | P45: 78.14 | Q45: 转股中 | R45: 4年12天 | S45: 2年13天 | T45: 6.83 | U45: 35 | V45: 4.4999999999999998e-002 | W45: 5.5999999999999994e-002 | X45: 4.4000000000000004e-002 | Y45: 121 | Z45: 2.37 | AA45: 1.7399999999999999e-002 | AB45: 8.6999999999999994e-003 | AC45: -3.6000000000000004e-002 | AD45: -3.8900000000000004e-002 | AE45: 94.92 | AF45: 100.65 | AG45: 0.3 | AH45: AA | AI45: 4.0099999999999997e-002 | AJ45: =H45+100*O45 -> 155.30000000000001 | AK45: 145.9 | AL45: 152 | AM45: 45.2 | AN45: 96 | AO45: 6.3e-002 | AP45: 29 | AQ45: 游族转债!!
A46: 161 | B46: 113594 | C46: 淳中转债! | D46: 603516 | E46: 淳中科技 | F46: 电子 | G46: 电子产品 | H46: 111.41 | I46: -1.1000000000000001e-003 | J46: -8.9999999999999998e-004 | K46: 18.87 | L46: -5.7999999999999996e-003 | M46: 120.9 | N46: 27.84 | O46: 0.64400000000000002 | P46: 67.78 | Q46: 转股中 | R46: 4.86年 | S46: 2.86年 | T46: 3 | U46: 2.2 | V46: 6.0000000000000001e-003 | W46: 8.5000000000000006e-002 | X46: 5.7999999999999996e-002 | Y46: 35 | Z46: 3.73 | AA46: 1.7299999999999999e-002 | AB46: 9.7999999999999997e-003 | AC46: -2.2499999999999999e-002 | AD46: -2.5000000000000001e-002 | AE46: 84.47 | AF46: 86.86 | AG46: 0.34 | AH46: A+ | AI46: 7.2099999999999997e-002 | AJ46: =H46+100*O46 -> 175.81 | AK46: 155 | AL46: 214 | AM46: 68.2 | AN46: 245 | AO46: 9.0000000000000011e-003 | AP46: 9 | AQ46: 淳中转债!
A47: 131 | B47: 128132 | C47: 交建转债! | D47: 2941 | E47: 新疆交建 | F47: 建筑 | G47: 建筑工程 | H47: 107.82 | I47: -2.86e-002 | J47: 2.0099999999999996e-002 | K47: 13.03 | L47: -3.8399999999999997e-002 | M47: 117.3 | N47: 18.53 | O47: 0.53299999999999992 | P47: 70.32 | Q47: 转股中 | R47: 5年4.0天 | S47: 3年5.0天 | T47: 8.49 | U47: 142 | V47: 0.152 | W47: 0.10099999999999999 | X47: 7.0999999999999994e-002 | Y47: 84 | Z47: 3.33 | AA47: 1.7299999999999999e-002 | AB47: 1.11e-002 | AC47: -1.2e-002 | AD47: -1.43e-002 | AE47: 91.3 | AF47: 96.01 | AG47: 0.22 | AH47: AA | AI47: 4.1700000000000001e-002 | AJ47: =H47+100*O47 -> 161.11999999999998 | AK47: 145.3 | AL47: 146 | AM47: 49.3 | AN47: 131 | AO47: 8.0000000000000002e-002 | AP47: 24 | AQ47: 交建转债!
A48: 317 | B48: 128049 | C48: 华源转债! | D48: 2787 | E48: 华源控股 | F48: 造纸包装 | G48: 包装材料 | H48: 108.6 | I48: -1.1299999999999999e-002 | J48: 8.3000000000000001e-003 | K48: 5.99 | L48: -8.3000000000000001e-003 | M48: 114.5 | N48: 7.37 | O48: 0.33600000000000002 | P48: 81.28 | Q48: 转股中 | R48: 3.21年 | S48: 1.21年 | T48: 3.63 | U48: 7 | V48: 1.8000000000000002e-002 | W48: 0.192 | X48: 0.156 | Y48: 19 | Z48: 1.26 | AA48: 1.7000000000000001e-002 | AB48: 8.6999999999999994e-003 | AC48: -3.9100000000000003e-002 | AD48: -4.2900000000000001e-002 | AE48: 94.83 | AF48: 95.05 | AG48: 0.36 | AH48: AA- | AI48: 6.1100000000000002e-002 | AJ48: =H48+100*O48 -> 142.19999999999999 | AK48: 135.9 | AL48: 44 | AM48: 40.9 | AN48: 63 | AO48: 6.7000000000000004e-002 | AP48: 42 | AQ48: 华源转债!
A49: 180 | B49: 128114 | C49: 正邦转债! | D49: 2157 | E49: 正邦科技 | F49: 农业 | G49: 畜牧业 | H49: 106.26 | I49: -6.8000000000000005e-003 | J49: 5.4000000000000003e-003 | K49: 8.83 | L49: -1.34e-002 | M49: 114.9 | N49: 14.76 | O49: 0.77599999999999991 | P49: 59.82 | Q49: 转股中 | R49: 4.76年 | S49: 2.77年 | T49: 16 | U49: 43 | V49: 2.5000000000000001e-002 | W49: 5.7000000000000002e-002 | X49: 3.4000000000000002e-002 | Y49: 278 | Z49: 1.44 | AA49: 1.6899999999999998e-002 | AB49: 1.11e-002 | AC49: -9.300000000000001e-003 | AD49: -1.15e-002 | AE49: 93.53 | AF49: 97.79 | AG49: 0.11 | AH49: AA+ | AI49: 3.5099999999999999e-002 | AJ49: =H49+100*O49 -> 183.86000000000001 | AK49: 152.7 | AL49: 203 | AM49: 54.9 | AN49: 171 | AO49: -2.1000000000000001e-002 | AP49: 18 | AQ49: 正邦转债!
A50: 143 | B50: 110072 | C50: 广汇转债! | D50: 600297 | E50: 广汇汽车 | F50: 汽车 | G50: 分销、售 | H50: 105.53 | I50: -6.5000000000000006e-003 | J50: 3.4000000000000002e-003 | K50: 3.26 | L50: -9.1000000000000004e-003 | M50: 114.3 | N50: 4.03 | O50: 0.30499999999999999 | P50: 80.89 | Q50: 转股中 | R50: 4.93年 | S50: 2.94年 | T50: 33.7 | U50: 103 | V50: 2.8999999999999998e-002 | W50: 0.127 | X50: 0.10300000000000001 | Y50: 264 | Z50: 0.65 | AA50: 1.6500000000000001e-002 | AB50: 1.1200000000000002e-002 | AC50: -8.3999999999999995e-003 | AD50: -1.0200000000000001e-002 | AE50: 92.42 | AF50: 96.65 | AG50: 0.33 | AH50: AA+ | AI50: 3.5099999999999999e-002 | AJ50: =H50+100*O50 -> 136.03 | AK50: 130.2 | AL50: 13 | AM50: 33.5 | AN50: 17 | AO50: 0.121 | AP50: 70 | AQ50: 广汇转债!
A51: 126 | B51: 113604 | C51: 多伦转债! | D51: 603528 | E51: 多伦科技 | F51: 计算机及 | G51: 软件开发 | H51: 108.29 | I51: -5.3e-003 | J51: 2.2000000000000001e-003 | K51: 7.71 | L51: -7.7000000000000002e-003 | M51: 117.3 | N51: 10.4 | O51: 0.46100000000000002 | P51: 74.13 | Q51: 转股中 | R51: 5年32天 | S51: 3年33天 | T51: 6.4 | U51: 11 | V51: 1.4999999999999999e-002 | W51: 0.13200000000000001 | X51: 9.8000000000000004e-002 | Y51: 48 | Z51: 2.93 | AA51: 1.6200000000000003e-002 | AB51: 1.e-002 | AC51: -1.3000000000000001e-002 | AD51: -1.5300000000000001e-002 | AE51: 85.35 | AF51: 86.67 | AG51: 0.4 | AH51: AA- | AI51: 6.2699999999999992e-002 | AJ51: =H51+100*O51 -> 154.39000000000001 | AK51: 142.4 | AL51: 118 | AM51: 55.8 | AN51: 176 | AO51: -2.9999999999999999e-002 | AP51: 7 | AQ51: 多伦转债!
A52: 247 | B52: 128083 | C52: 新北转债! | D52: 2376 | E52: 新北洋 | F52: 电子 | G52: 电子产品 | H52: 107.7 | I52: -7.8000000000000005e-003 | J52: 5.1999999999999998e-003 | K52: 8.51 | L52: -1.0500000000000001e-002 | M52: 114.9 | N52: 11.45 | O52: 0.44900000000000001 | P52: 74.32 | Q52: 转股中 | R52: 4.25年 | S52: 2.25年 | T52: 8.77 | U52: 3.4 | V52: 4.0000000000000001e-003 | W52: 0.155 | X52: 0.115 | Y52: 57 | Z52: 1.71 | AA52: 1.5700000000000002e-002 | AB52: 9.1999999999999998e-003 | AC52: -1.6899999999999998e-002 | AD52: -1.95e-002 | AE52: 94.11 | AF52: 97.56 | AG52: 0.25 | AH52: AA | AI52: 4.0099999999999997e-002 | AJ52: =H52+100*O52 -> 152.59999999999999 | AK52: 141.1 | AL52: 104 | AM52: 43.5 | AN52: 86 | AO52: 1.2e-002 | AP52: 20 | AQ52: 新北转债!
A53: 96 | B53: 123081 | C53: 精研转债! | D53: 300709 | E53: 精研科技 | F53: 电子 | G53: 电子产品 | H53: 112.1 | I53: -7.3000000000000001e-003 | J53: 8.0000000000000004e-004 | K53: 34.24 | L53: -2.4500000000000001e-002 | M53: 121.3 | N53: 53.4 | O53: 0.748 | P53: 64.12 | Q53: 转股中 | R53: 5.23年 | S53: 3.23年 | T53: 5.7 | U53: 37 | V53: 5.9000000000000004e-002 | W53: 0.12 | X53: 7.6999999999999999e-002 | Y53: 47 | Z53: 3.03 | AA53: 1.55e-002 | AB53: 8.3999999999999995e-003 | AC53: -2.1400000000000002e-002 | AD53: -2.3799999999999998e-002 | AE53: 84.97 | AF53: 88.91 | AG53: 0.27 | AH53: AA- | AI53: 6.2699999999999992e-002 | AJ53: =H53+100*O53 -> 186.89999999999998 | AK53: 160.1 | AL53: 241 | AM53: 71.2 | AN53: 259 | AO53: 0.109 | AP53: 9 | AQ53: 精研转债!
A54: 307 | B54: 128056 | C54: 今飞转债! | D54: 2863 | E54: 今飞凯达 | F54: 汽车 | G54: 零部件制 | H54: 114.181 | I54: -3.0000000000000001e-003 | J54: -1.e-003 | K54: 5.41 | L54: -1.1000000000000001e-002 | M54: 120.2 | N54: 6.69 | O54: 0.41200000000000003 | P54: 80.87 | Q54: 转股中 | R54: 3.47年 | S54: 1.47年 | T54: 1.72 | U54: 7.6 | V54: 3.9e-002 | W54: 6.4000000000000001e-002 | X54: 5.2000000000000005e-002 | Y54: 27 | Z54: 1.43 | AA54: 1.5300000000000001e-002 | AB54: 5.1000000000000004e-003 | AC54: -5.96e-002 | AD54: -6.3299999999999995e-002 | AE54: 92.35 | AF54: 94.95 | AG54: 0.37 | AH54: A+ | AI54: 7.2099999999999997e-002 | AJ54: =H54+100*O54 -> 155.381 | AK54: 147.5 | AL54: 168 | AM54: 52.5 | AN54: 152 | AO54: 4.0999999999999995e-002 | AP54: 52 | AQ54: 今飞转债!
A55: 290 | B55: 113532 | C55: 海环转债! | D55: 603817 | E55: 海峡环保 | F55: 城市公用 | G55: 三废处理 | H55: 106.52 | I55: -8.3999999999999995e-003 | J55: 4.0999999999999995e-003 | K55: 5.92 | L55: -1.66e-002 | M55: 112.3 | N55: 7.63 | O55: 0.373 | P55: 77.59 | Q55: 转股中 | R55: 3.56年 | S55: 1.56年 | T55: 4.59 | U55: 6.6 | V55: 1.3999999999999999e-002 | W55: 0.17199999999999999 | X55: 0.13400000000000001 | Y55: 27 | Z55: 1.49 | AA55: 1.5300000000000001e-002 | AB55: 8.8000000000000005e-003 | AC55: -2.06e-002 | AD55: -2.3599999999999999e-002 | AE55: 96.11 | AF55: 97.91 | AG55: 0.26 | AH55: AA | AI55: 4.0099999999999997e-002 | AJ55: =H55+100*O55 -> 143.81999999999999 | AK55: 135.5 | AL55: 40 | AM55: 37.5 | AN55: 35 | AO55: 2.6000000000000002e-002 | AP55: 27 | AQ55: 海环转债!
A56: 167 | B56: 127019 | C56: 国城转债! | D56: 688 | E56: 国城矿业 | F56: 有色金属 | G56: 锌铅镍锡 | H56: 106.921 | I56: -1.46e-002 | J56: 8.0000000000000002e-003 | K56: 14.36 | L56: -3.1e-002 | M56: 114.8 | N56: 21.06 | O56: 0.56799999999999995 | P56: 68.19 | Q56: 转股中 | R56: 4.84年 | S56: 2.84年 | T56: 8.5 | U56: 31 | V56: 3.4000000000000002e-002 | W56: 5.2000000000000005e-002 | X56: 3.5000000000000003e-002 | Y56: 163 | Z56: 6.84 | AA56: 1.5100000000000001e-002 | AB56: 9.4999999999999998e-003 | AC56: -1.1399999999999999e-002 | AD56: -1.3500000000000002e-002 | AE56: 91.85 | AF56: 95.23 | AG56: 0.21 | AH56: AA | AI56: 4.0099999999999997e-002 | AJ56: =H56+100*O56 -> 163.721 | AK56: 145.7 | AL56: 149 | AM56: 50.4 | AN56: 139 | AO56: 0.17600000000000002 | AP56: 47 | AQ56: 国城转债!
A57: 209 | B57: 113033 | C57: 利群转债! | D57: 601366 | E57: 利群股份 | F57: 商业零售 | G57: 商场 | H57: 107.53 | I57: -4.0000000000000001e-003 | J57: 2.5999999999999999e-003 | K57: 6.33 | L57: -3.0999999999999999e-003 | M57: 114.9 | N57: 7.01 | O57: 0.191 | P57: 90.3 | Q57: 转股中 | R57: 4.55年 | S57: 2.56年 | T57: 18 | U57: 14 | V57: 6.9999999999999993e-003 | W57: 0.33000000000000002 | X57: 0.29799999999999999 | Y57: 54 | Z57: 1.27 | AA57: 1.4999999999999999e-002 | AB57: 9.0000000000000011e-003 | AC57: -1.44e-002 | AD57: -1.6799999999999999e-002 | AE57: 93 | AF57: 96.41 | AG57: 0.45 | AH57: AA | AI57: 4.0099999999999997e-002 | AJ57: =H57+100*O57 -> 126.63 | AK57: 124.8 | AL57: 5 | AM57: 28.4 | AN57: 3 | AO57: -1.e-002 | AP57: 66 | AQ57: 利群转债!
A58: 206 | B58: 128105 | C58: 长集转债! | D58: 2616 | E58: 长青集团 | F58: 城市公用 | G58: 三废处理 | H58: 107.7 | I58: 3.7000000000000002e-003 | J58: -5.5000000000000005e-003 | K58: 5.91 | L58: -6.7000000000000002e-003 | M58: 114.9 | N58: 7.91 | O58: 0.441 | P58: 74.72 | Q58: 转股中 | R58: 4.58年 | S58: 2.58年 | T58: 8 | U58: 16 | V58: 1.8000000000000002e-002 | W58: 0.182 | X58: 0.13600000000000001 | Y58: 44 | Z58: 1.72 | AA58: 1.4499999999999999e-002 | AB58: 8.6e-003 | AC58: -1.4800000000000001e-002 | AD58: -1.72e-002 | AE58: 92.92 | AF58: 96.33 | AG58: 0.27 | AH58: AA | AI58: 4.0099999999999997e-002 | AJ58: =H58+100*O58 -> 151.80000000000001 | AK58: 140.7 | AL58: 98 | AM58: 44.4 | AN58: 92 | AO58: -3.5000000000000003e-002 | AP58: 17 | AQ58: 长集转债!
A59: 133 | B59: 123065 | C59: 宝莱转债! | D59: 300246 | E59: 宝莱特 | F59: 医药 | G59: 医疗器械 | H59: 112.88 | I59: -9.3999999999999986e-003 | J59: 8.199999999999999e-003 | K59: 17.15 | L59: -2.6099999999999998e-002 | M59: 121 | N59: 40.14 | O59: 1.6399999999999999 | P59: 42.73 | Q59: 转股中 | R59: 4.98年 | S59: 2.98年 | T59: 2.19 | U59: 18 | V59: 7.400000000000001e-002 | W59: 8.6999999999999994e-002 | X59: 3.7000000000000005e-002 | Y59: 25 | Z59: 2.92 | AA59: 1.43e-002 | AB59: 6.9999999999999993e-003 | AC59: -2.6099999999999998e-002 | AD59: -2.8399999999999998e-002 | AE59: 86.35 | AF59: 90.6 | AG59: 0.05 | AH59: AA- | AI59: 6.1100000000000002e-002 | AJ59: =H59+100*O59 -> 276.88 | AK59: 183 | AL59: 308 | AM59: 92.4 | AN59: 310 | AO59: 3.7999999999999999e-002 | AP59: 19 | AQ59: 宝莱转债!
A60: 149 | B60: 113597 | C60: 佳力转债! | D60: 603912 | E60: 佳力图 | F60: 机械装备 | G60: 专用设备 | H60: 115.88 | I60: 3.2000000000000002e-003 | J60: -6.8000000000000005e-003 | K60: 17.32 | L60: -1.03e-002 | M60: 124 | N60: 23.15 | O60: 0.54899999999999993 | P60: 74.82 | Q60: 转股中 | R60: 4.88年 | S60: 2.89年 | T60: 3 | U60: 9.4 | V60: 2.7000000000000003e-002 | W60: 8.0000000000000002e-002 | X60: 5.9999999999999998e-002 | Y60: 38 | Z60: 4.01 | AA60: 1.4199999999999999e-002 | AB60: 5.8999999999999999e-003 | AC60: -3.5299999999999998e-002 | AD60: -3.7699999999999997e-002 | AE60: 86.86 | AF60: 93.38 | AG60: 0.35 | AH60: AA- | AI60: 6.1100000000000002e-002 | AJ60: =H60+100*O60 -> 170.77999999999997 | AK60: 156.9 | AL60: 226 | AM60: 63.6 | AN60: 218 | AO60: 1.8000000000000002e-002 | AP60: 18 | AQ60: 佳力转债!
A61: 157 | B61: 113037 | C61: 紫银转债! | D61: 601860 | E61: 紫金银行 | F61: 金融 | G61: 银行行业 | H61: 108.22 | I61: 1.15e-002 | J61: -5.7999999999999996e-003 | K61: 3.5 | L61: 1.4499999999999999e-002 | M61: 115.6 | N61: 4.05 | O61: 0.252 | P61: 86.42 | Q61: 转股中 | R61: 4.86年 | S61: 无权 | T61: 45 | U61: 164 | V61: 3.4000000000000002e-002 | W61: 0.35100000000000003 | X61: 0.30299999999999999 | Y61: 128 | Z61: 0.86 | AA61: 1.3899999999999999e-002 | AB61: 8.1000000000000013e-003 | AC61: 无权 | AD61: 无权 | AE61: 无权 | AF61: 98.09 | AG61: 0.39 | AH61: AA+ | AI61: 3.5099999999999999e-002 | AJ61: =H61+100*O61 -> 133.41999999999999 | AK61: 130 | AL61: 10 | AM61: 31.9 | AN61: 11 | AO61: 5.9000000000000004e-002 | AP61: 26 | AQ61: 紫银转债!
A62: 99 | B62: 128139 | C62: 祥鑫转债! | D62: 2965 | E62: 祥鑫科技 | F62: 汽车 | G62: 零部件制 | H62: 112.85 | I62: 2.23e-002 | J62: -1.9900000000000001e-002 | K62: 23.65 | L62: 9.3999999999999986e-003 | M62: 121 | N62: 36.96 | O62: 0.76400000000000001 | P62: 63.99 | Q62: 转股中 | R62: 5.22年 | S62: 3.22年 | T62: 6.47 | U62: 22 | V62: 2.9999999999999999e-002 | W62: 0.182 | X62: 0.11599999999999999 | Y62: 36 | Z62: 2.05 | AA62: 1.37e-002 | AB62: 6.7000000000000002e-003 | AC62: -2.4300000000000002e-002 | AD62: -2.64e-002 | AE62: 84.75 | AF62: 88.69 | AG62: 0.26 | AH62: AA- | AI62: 6.2699999999999992e-002 | AJ62: =H62+100*O62 -> 189.25 | AK62: 161.7 | AL62: 254 | AM62: 73 | AN62: 268 | AO62: 2.7000000000000003e-002 | AP62: 15 | AQ62: 祥鑫转债!
A63: 85 | B63: 123088 | C63: 威唐转债! | D63: 300707 | E63: 威唐工业 | F63: 汽车 | G63: 零部件制 | H63: 113.87 | I63: -7.0999999999999995e-003 | J63: -1.01e-002 | K63: 17.35 | L63: -3.1300000000000001e-002 | M63: 121.6 | N63: 20.72 | O63: 0.35999999999999999 | P63: 83.74 | Q63: 转股中 | R63: 5.26年 | S63: 3.26年 | T63: 3.01 | U63: 8.8 | V63: 2.6000000000000002e-002 | W63: 0.111 | X63: 9.3000000000000013e-002 | Y63: 27 | Z63: 3.92 | AA63: 1.29e-002 | AB63: 5.6999999999999993e-003 | AC63: -2.4700000000000003e-002 | AD63: -2.7200000000000002e-002 | AE63: 82.24 | AF63: 84.45 | AG63: 0.55 | AH63: A+ | AI63: 7.3700000000000002e-002 | AJ63: =H63+100*O63 -> 149.87 | AK63: 144 | AL63: 134 | AM63: 59.6 | AN63: 192 | AO63: -2.1000000000000001e-002 | AP63: 16 | AQ63: 威唐转债!
A64: 170 | B64: 113036 | C64: 宁建转债! | D64: 601789 | E64: 宁波建工 | F64: 建筑 | G64: 建筑工程 | H64: 110.31 | I64: -8.6e-003 | J64: 6.8000000000000005e-003 | K64: 4.03 | L64: -4.8999999999999998e-003 | M64: 116.9 | N64: 4.76 | O64: 0.30299999999999999 | P64: 84.66 | Q64: 转股中 | R64: 4.82年 | S64: 2.82年 | T64: 5.4 | U64: 8.2 | V64: 1.3999999999999999e-002 | W64: 0.13699999999999998 | X64: 0.11599999999999999 | Y64: 39 | Z64: 1.24 | AA64: 1.23e-002 | AB64: 6.0999999999999995e-003 | AC64: -2.1600000000000001e-002 | AD64: -2.3700000000000002e-002 | AE64: 92.04 | AF64: 97.07 | AG64: 0.37 | AH64: AA | AI64: 4.0099999999999997e-002 | AJ64: =H64+100*O64 -> 140.61000000000001 | AK64: 136 | AL64: 45 | AM64: 38.9 | AN64: 46 | AO64: 8.4000000000000005e-002 | AP64: 11 | AQ64: 宁建转债!
A65: 71 | B65: 123093 | C65: 金陵转债! | D65: 300651 | E65: 金陵体育 | F65: 其他 | G65: 文化教育 | H65: 121.4 | I65: -6.7000000000000002e-003 | J65: 6.5000000000000006e-003 | K65: 31.5 | L65: -5.9999999999999995e-004 | M65: 129.3 | N65: 49.19 | O65: 0.89599999999999991 | P65: 64.04 | Q65: 转股中 | R65: 5.36年 | S65: 3.36年 | T65: 2.5 | U65: 76 | V65: 0.249 | W65: 6.2e-002 | X65: 3.9e-002 | Y65: 41 | Z65: 5.88 | AA65: 1.2199999999999999e-002 | AB65: 3.2000000000000002e-003 | AC65: -3.7200000000000004e-002 | AD65: -4.0500000000000001e-002 | AE65: 83.12 | AF65: 89.39 | AG65: 0.3 | AH65: A+ | AI65: 7.3700000000000002e-002 | AJ65: =H65+100*O65 -> 211. | AK65: 178.8 | AL65: 298 | AM65: 89.4 | AN65: 303 | AO65: 1.4999999999999999e-002 | AP65: 8 | AQ65: 金陵转债!
A66: 111 | B66: 110076 | C66: 华海转债! | D66: 600521 | E66: 华海药业 | F66: 医药 | G66: 医药行业 | H66: 108.32 | I66: 1.e-003 | J66: -1.6000000000000001e-003 | K66: 17.39 | L66: -7.4000000000000003e-003 | M66: 115.1 | N66: 33.85 | O66: 1.1100000000000001 | P66: 51.37 | Q66: 转股中 | R66: 5年52天 | S66: 3年53天 | T66: 18.4 | U66: 31 | V66: 1.4999999999999999e-002 | W66: 7.0999999999999994e-002 | X66: 3.6000000000000004e-002 | Y66: 259 | Z66: 3.98 | AA66: 1.21e-002 | AB66: 6.8000000000000005e-003 | AC66: -1.3500000000000002e-002 | AD66: -1.55e-002 | AE66: 90.61 | AF66: 93.68 | AG66: 0.07 | AH66: AA | AI66: 4.1700000000000001e-002 | AJ66: =H66+100*O66 -> 219.31999999999999 | AK66: 165.3 | AL66: 265 | AM66: 71.6 | AN66: 261 | AO66: 2.e-003 | AP66: 8 | AQ66: 华海转债!
A67: 86 | B67: 113044 | C67: 大秦转债! | D67: 601006 | E67: 大秦铁路 | F67: 铁路 | G67: 铁路运输 | H67: 107.31 | I67: -2.0000000000000001e-004 | J67: 1.6000000000000001e-003 | K67: 6.42 | L67: 3.0999999999999999e-003 | M67: 114.1 | N67: 7.18 | O67: 0.20000000000000001 | P67: 89.42 | Q67: 转股中 | R67: 5.26年 | S67: 3.26年 | T67: 320 | U67: 453 | V67: 1.3000000000000001e-002 | W67: 0.33500000000000002 | X67: 0.29999999999999999 | Y67: 954 | Z67: 0.81 | AA67: 1.2e-002 | AB67: 6.9999999999999993e-003 | AC67: -9.300000000000001e-003 | AD67: -1.15e-002 | AE67: 92.56 | AF67: 95.72 | AG67: 0.45 | AH67: AAA | AI67: 3.4700000000000002e-002 | AJ67: =H67+100*O67 -> 127.31 | AK67: 125.2 | AL67: 6 | AM67: 29.5 | AN67: 6 | AO67: 5.9000000000000004e-002 | AP67: 21 | AQ67: 大秦转债!
A68: 370 | B68: 127003 | C68: 海印转债! | D68: 861 | E68: 海印股份 | F68: 商业零售 | G68: 商场 | H68: 109.069 | I68: -1.9e-003 | J68: 1.7000000000000001e-003 | K68: 2.19 | L68: -2.6699999999999998e-002 | M68: 110 | N68: 2.99 | O68: 0.48899999999999999 | P68: 73.24 | Q68: 转股中 | R68: 0.74年 | S68: 回售内 | T68: 6.74 | U68: 10 | V68: 1.3999999999999999e-002 | W68: 0.13200000000000001 | X68: 9.6999999999999989e-002 | Y68: 51 | Z68: 1.39 | AA68: 1.15e-002 | AB68: -1.32e-002 | AC68: 回售内 | AD68: 回售内 | AE68: 100.33 | AF68: 107.1 | AG68: 0.01 | AH68: AA | AI68: 3.6699999999999997e-002 | AJ68: =H68+100*O68 -> 157.96899999999999 | AK68: 144.9 | AL68: 141 | AM68: 37.8 | AN68: 38 | AO68: 5.0000000000000003e-002 | AP68: 71 | AQ68: 海印转债!
A69: 228 | B69: 113565 | C69: 宏辉转债 | D69: 603336 | E69: 宏辉果蔬 | F69: 农业 | G69: 农产品加 | H69: 112.13 | I69: -9.7000000000000003e-003 | J69: 3.3e-003 | K69: 6.61 | L69: -1.34e-002 | M69: 117.8 | N69: 7.64 | O69: 0.29600000000000004 | P69: 86.52 | Q69: 转股中 | R69: 4.46年 | S69: 2.46年 | T69: 2.25 | U69: 5.9 | V69: 2.3e-002 | W69: 7.8e-002 | X69: 6.7000000000000004e-002 | Y69: 29 | Z69: 2.81 | AA69: 1.1399999999999999e-002 | AB69: 4.3e-003 | AC69: -2.9600000000000001e-002 | AD69: -3.2199999999999999e-002 | AE69: 88.91 | AF69: 90.98 | AG69: 0.48 | AH69: AA- | AI69: 6.1100000000000002e-002 | AJ69: =H69+100*O69 -> 141.72999999999999 | AK69: 137.7 | AL69: 64 | AM69: 46.8 | AN69: 112 | AO69: -1.1000000000000001e-002 | AP69: 26 | AQ69: 宏辉转债
A70: 232 | B70: 113563 | C70: 柳药转债! | D70: 603368 | E70: 柳药股份 | F70: 医药 | G70: 医药商业 | H70: 107.78 | I70: -5.9999999999999995e-004 | J70: 8.0000000000000004e-004 | K70: 16.93 | L70: 5.9999999999999995e-004 | M70: 112.9 | N70: 23.87 | O70: 0.52000000000000002 | P70: 70.93 | Q70: 转股中 | R70: 4.35年 | S70: 2.35年 | T70: 8.02 | U70: 7.2 | V70: 8.0000000000000002e-003 | W70: 0.13100000000000001 | X70: 9.3000000000000013e-002 | Y70: 61 | Z70: 1.21 | AA70: 1.1000000000000001e-002 | AB70: 5.5000000000000005e-003 | AC70: -1.6500000000000001e-002 | AD70: -1.9099999999999999e-002 | AE70: 93.76 | AF70: 95.51 | AG70: 0.22 | AH70: AA | AI70: 4.0099999999999997e-002 | AJ70: =H70+100*O70 -> 159.78 | AK70: 144.6 | AL70: 138 | AM70: 49.1 | AN70: 130 | AO70: -2.3e-002 | AP70: 16 | AQ70: 柳药转债!
A71: 174 | B71: 113591 | C71: 胜达转债! | D71: 603687 | E71: 大胜达 | F71: 造纸包装 | G71: 包装用纸 | H71: 115.69 | I71: -1.46e-002 | J71: 4.0999999999999995e-003 | K71: 8.77 | L71: -1.7899999999999999e-002 | M71: 121.7 | N71: 8.76 | O71: 0.156 | P71: 100.11 | Q71: 转股中 | R71: 4.80年 | S71: 2.81年 | T71: 5.5 | U71: 25 | V71: 4.0000000000000001e-002 | W71: 0.153 | X71: 0.153 | Y71: 36 | Z71: 2.09 | AA71: 1.0800000000000001e-002 | AB71: 3.0000000000000001e-003 | AC71: -3.6699999999999997e-002 | AD71: -3.8900000000000004e-002 | AE71: 87.02 | AF71: 92.06 | AG71: 0.59 | AH71: AA- | AI71: 6.1100000000000002e-002 | AJ71: =H71+100*O71 -> 131.28999999999999 | AK71: 131.3 | AL71: 17 | AM71: 39.2 | AN71: 49 | AO71: 7.0000000000000007e-002 | AP71: 32 | AQ71: 胜达转债!
A72: 145 | B72: 127021 | C72: 特发转2! | D72: 70 | E72: 特发信息 | F72: 通信互联 | G72: 通信设备 | H72: 108.4 | I72: -5.5000000000000005e-003 | J72: 5.7999999999999996e-003 | K72: 7.72 | L72: 2.5999999999999999e-003 | M72: 113 | N72: 12.33 | O72: 0.73099999999999998 | P72: 62.61 | Q72: 转股中 | R72: 3.90年 | S72: 1.91年 | T72: 5.5 | U72: 3.3 | V72: 5.0000000000000001e-003 | W72: 8.5999999999999993e-002 | X72: 5.4000000000000006e-002 | Y72: 64 | Z72: 2.17 | AA72: 1.0800000000000001e-002 | AB72: 4.6999999999999993e-003 | AC72: -3.0200000000000001e-002 | AD72: -3.1800000000000002e-002 | AE72: 93.81 | AF72: 97.09 | AG72: 0.11 | AH72: AA | AI72: 4.0099999999999997e-002 | AJ72: =H72+100*O72 -> 181.5 | AK72: 154.2 | AL72: 209 | AM72: 57.1 | AN72: 180 | AO72: 4.2999999999999997e-002 | AP72: 13 | AQ72: 特发转2!
A73: 154 | B73: 128123 | C73: 国光转债! | D73: 2749 | E73: 国光股份 | F73: 化工 | G73: 农化 | H73: 109.989 | I73: -1.0700000000000001e-002 | J73: 9.1999999999999998e-003 | K73: 9.59 | L73: -4.1999999999999997e-003 | M73: 115.7 | N73: 13.49 | O73: 0.54700000000000004 | P73: 71.09 | Q73: 转股中 | R73: 4.87年 | S73: 2.88年 | T73: 3.2 | U73: 2.8 | V73: 8.0000000000000002e-003 | W73: 7.6999999999999999e-002 | X73: 5.4000000000000006e-002 | Y73: 42 | Z73: 3.31 | AA73: 1.0700000000000001e-002 | AB73: 4.7999999999999996e-003 | AC73: -1.9599999999999999e-002 | AD73: -2.18e-002 | AE73: 86.65 | AF73: 87.18 | AG73: 0.35 | AH73: AA- | AI73: 6.1100000000000002e-002 | AJ73: =H73+100*O73 -> 164.68900000000002 | AK73: 148.9 | AL73: 179 | AM73: 61.7 | AN73: 207 | AO73: 4.2000000000000003e-002 | AP73: 13 | AQ73: 国光转债!
A74: 237 | B74: 113561 | C74: 正裕转债! | D74: 603089 | E74: 正裕工业 | F74: 汽车 | G74: 零部件制 | H74: 112.87 | I74: -8.8000000000000005e-003 | J74: 4.0000000000000001e-003 | K74: 8.74 | L74: -9.1000000000000004e-003 | M74: 118 | N74: 10.08 | O74: 0.30199999999999999 | P74: 86.71 | Q74: 转股中 | R74: 4.30年 | S74: 2.31年 | T74: 1.5 | U74: 6.1 | V74: 3.6000000000000004e-002 | W74: 7.6999999999999999e-002 | X74: 6.7000000000000004e-002 | Y74: 19 | Z74: 1.9 | AA74: 1.06e-002 | AB74: 3.2000000000000002e-003 | AC74: -3.2300000000000002e-002 | AD74: -3.5400000000000001e-002 | AE74: 87.9 | AF74: 88.14 | AG74: 0.52 | AH74: A+ | AI74: 7.2099999999999997e-002 | AJ74: =H74+100*O74 -> 143.06999999999999 | AK74: 139 | AL74: 80 | AM74: 50.9 | AN74: 144 | AO74: -2.8999999999999998e-002 | AP74: 36 | AQ74: 正裕转债!
A75: 146 | B75: 113599 | C75: 嘉友转债! | D75: 603871 | E75: 嘉友国际 | F75: 交通运输 | G75: 物流业 | H75: 119.47 | I75: -6.6e-003 | J75: -2.5000000000000001e-003 | K75: 17.92 | L75: -1.6500000000000001e-002 | M75: 125.6 | N75: 18.32 | O75: 0.221 | P75: 97.82 | Q75: 转股中 | R75: 4.90年 | S75: 2.90年 | T75: 7.2 | U75: 10 | V75: 1.2e-002 | W75: 0.14099999999999999 | X75: 0.13800000000000001 | Y75: 51 | Z75: 2.57 | AA75: 1.04e-002 | AB75: 1.7000000000000001e-003 | AC75: -4.5999999999999999e-002 | AD75: -4.8000000000000001e-002 | AE75: 86.43 | AF75: 94.44 | AG75: 0.55 | AH75: AA- | AI75: 6.1100000000000002e-002 | AJ75: =H75+100*O75 -> 141.56999999999999 | AK75: 141.1 | AL75: 105 | AM75: 46.7 | AN75: 110 | AO75: 4.9000000000000002e-002 | AP75: 20 | AQ75: 嘉友转债!
A76: 244 | B76: 128087 | C76: 孚日转债! | D76: 2083 | E76: 孚日股份 | F76: 服装纺织 | G76: 家纺 | H76: 108.501 | I76: -1.2699999999999999e-002 | J76: 5.8999999999999999e-003 | K76: 4.23 | L76: -1.1699999999999999e-002 | M76: 112.9 | N76: 4.5 | O76: 0.154 | P76: 94 | Q76: 转股中 | R76: 4.27年 | S76: 2.27年 | T76: 6.5 | U76: 20 | V76: 2.8999999999999998e-002 | W76: 0.16899999999999998 | X76: 0.159 | Y76: 38 | Z76: 1.04 | AA76: 9.5999999999999992e-003 | AB76: 4.0000000000000001e-003 | AC76: -1.9799999999999998e-002 | AD76: -2.2400000000000003e-002 | AE76: 89.64 | AF76: 88.16 | AG76: 0.59 | AH76: AA- | AI76: 6.1100000000000002e-002 | AJ76: =H76+100*O76 -> 123.90100000000001 | AK76: 123 | AL76: 3 | AM76: 33.4 | AN76: 15 | AO76: 2.8999999999999998e-002 | AP76: 73 | AQ76: 孚日转债!
A77: 314 | B77: 113524 | C77: 奇精转债! | D77: 603677 | E77: 奇精机械 | F77: 家电 | G77: 零部件制 | H77: 113.8 | I77: -1.5300000000000001e-002 | J77: 1.1399999999999999e-002 | K77: 12.4 | L77: -9.5999999999999992e-003 | M77: 117.3 | N77: 13.98 | O77: 0.28300000000000003 | P77: 88.7 | Q77: 转股中 | R77: 3.26年 | S77: 1.26年 | T77: 3.3 | U77: 9.3 | V77: 2.5000000000000001e-002 | W77: 0.13800000000000001 | X77: 0.12300000000000001 | Y77: 24 | Z77: 2.4 | AA77: 9.4999999999999998e-003 | AB77: 1.e-004 | AC77: -6.9400000000000003e-002 | AD77: -7.2800000000000004e-002 | AE77: 94.54 | AF77: 97.08 | AG77: 0.41 | AH77: AA- | AI77: 6.1100000000000002e-002 | AJ77: =H77+100*O77 -> 142.09999999999999 | AK77: 138.9 | AL77: 79 | AM77: 41.8 | AN77: 72 | AO77: 9.0000000000000011e-003 | AP77: 43 | AQ77: 奇精转债!
A78: 166 | B78: 123059 | C78: 银信转债! | D78: 300231 | E78: 银信科技 | F78: 计算机及 | G78: 软件开发 | H78: 118.465 | I78: -1.44e-002 | J78: -8.6e-003 | K78: 9.01 | L78: -4.4500000000000005e-002 | M78: 123.7 | N78: 9.72 | O78: 0.27800000000000002 | P78: 92.7 | Q78: 转股中 | R78: 4.84年 | S78: 2.84年 | T78: 3.91 | U78: 23 | V78: 4.8000000000000001e-002 | W78: 9.8000000000000004e-002 | X78: 9.0999999999999998e-002 | Y78: 40 | Z78: 2.95 | AA78: 9.1000000000000004e-003 | AB78: 8.9999999999999998e-004 | AC78: -4.3799999999999999e-002 | AD78: -4.5999999999999999e-002 | AE78: 86.82 | AF78: 93.36 | AG78: 0.52 | AH78: AA- | AI78: 6.1100000000000002e-002 | AJ78: =H78+100*O78 -> 146.26500000000001 | AK78: 144.2 | AL78: 136 | AM78: 50.9 | AN78: 143 | AO78: 1.e-002 | AP78: 18 | AQ78: 银信转债!
A79: 283 | B79: 110058 | C79: 永鼎转债! | D79: 600105 | E79: 永鼎股份 | F79: 通信互联 | G79: 通信设备 | H79: 111.13 | I79: -2.0799999999999999e-002 | J79: 8.8999999999999999e-003 | K79: 3.98 | L79: -3.4000000000000002e-002 | M79: 114.3 | N79: 5.04 | O79: 0.40700000000000003 | P79: 78.97 | Q79: 转股中 | R79: 3.59年 | S79: 1.60年 | T79: 2.61 | U79: 9.7 | V79: 3.3000000000000002e-002 | W79: 4.8000000000000001e-002 | X79: 3.7999999999999999e-002 | Y79: 55 | Z79: 1.97 | AA79: 8.0000000000000002e-003 | AB79: 8.0000000000000004e-004 | AC79: -4.3499999999999997e-002 | AD79: -4.6399999999999997e-002 | AE79: 92.67 | AF79: 92.74 | AG79: 0.35 | AH79: AA- | AI79: 6.1100000000000002e-002 | AJ79: =H79+100*O79 -> 151.82999999999998 | AK79: 143.3 | AL79: 129 | AM79: 50.6 | AN79: 142 | AO79: 8.4000000000000005e-002 | AP79: 47 | AQ79: 永鼎转债!
A80: 332 | B80: 123010 | C80: 博世转债! | D80: 300422 | E80: 博世科 | F80: 城市公用 | G80: 三废处理 | H80: 108.888 | I80: -1.1000000000000001e-002 | J80: 4.0000000000000002e-004 | K80: 9.1 | L80: -4.5100000000000001e-002 | M80: 111.3 | N80: 12.15 | O80: 0.45399999999999996 | P80: 74.9 | Q80: 转股中 | R80: 2.81年 | S80: 0.82年 | T80: 4.3 | U80: 12 | V80: 2.7000000000000003e-002 | W80: 0.11599999999999999 | X80: 8.6999999999999994e-002 | Y80: 37 | Z80: 1.51 | AA80: 7.9000000000000008e-003 | AB80: 5.0000000000000001e-004 | AC80: -6.6299999999999998e-002 | AD80: -6.9699999999999998e-002 | AE80: 96.17 | AF80: 94.78 | AG80: 0.24 | AH80: AA- | AI80: 5.9699999999999996e-002 | AJ80: =H80+100*O80 -> 154.28800000000001 | AK80: 142.9 | AL80: 123 | AM80: 46.7 | AN80: 111 | AO80: -1.9e-002 | AP80: 30 | AQ80: 博世转债!
A81: 351 | B81: 123004 | C81: 铁汉转债! | D81: 300197 | E81: 节能铁汉 | F81: 城市公用 | G81: 生态环境 | H81: 106.939 | I81: -1.5300000000000001e-002 | J81: 1.11e-002 | K81: 3.01 | L81: -2.5899999999999999e-002 | M81: 108.8 | N81: 3.82 | O81: 0.35700000000000004 | P81: 78.8 | Q81: 转股中 | R81: 2.27年 | S81: 0.27年 | T81: 8.03 | U81: 15 | V81: 1.8000000000000002e-002 | W81: 9.5000000000000001e-002 | X81: 7.400000000000001e-002 | Y81: 85 | Z81: 1.33 | AA81: 7.8000000000000005e-003 | AB81: 4.0000000000000002e-004 | AC81: -0.125 | AD81: -0.13200000000000001 | AE81: 99.88 | AF81: 99.96 | AG81: 0.16 | AH81: AA | AI81: 3.8699999999999998e-002 | AJ81: =H81+100*O81 -> 142.63900000000001 | AK81: 135.1 | AL81: 34 | AM81: 35.1 | AN81: 23 | AO81: 3.7000000000000005e-002 | AP81: 46 | AQ81: 铁汉转债!
A82: 119 | B82: 123072 | C82: 乐歌转债! | D82: 300729 | E82: 乐歌股份 | F82: 其他 | G82: 家居用品 | H82: 124.884 | I82: -7.8000000000000005e-003 | J82: 7.3000000000000001e-003 | K82: 22.5 | L82: -1.1000000000000001e-002 | M82: 129.6 | N82: 55.88 | O82: 2.1000000000000001 | P82: 40.26 | Q82: 转股中 | R82: 5年40天 | S82: 3年41天 | T82: 1.42 | U82: 26 | V82: 0.14699999999999999 | W82: 3.5000000000000003e-002 | X82: 1.3999999999999999e-002 | Y82: 41 | Z82: 3.86 | AA82: 7.4999999999999997e-003 | AB82: -1.9e-003 | AC82: -4.7599999999999996e-002 | AD82: -5.1200000000000002e-002 | AE82: 84.84 | AF82: 91.23 | AG82: 0.04 | AH82: A+ | AI82: 7.3700000000000002e-002 | AJ82: =H82+100*O82 -> 334.88400000000001 | AK82: 209.5 | AL82: 327 | AM82: 118.3 | AN82: 327 | AO82: 3.5000000000000003e-002 | AP82: 9 | AQ82: 乐歌转债!
A83: 151 | B83: 128124 | C83: 科华转债! | D83: 2022 | E83: 科华生物 | F83: 医药 | G83: 生物制药 | H83: 106.17 | I83: 3.8e-003 | J83: -8.9999999999999998e-004 | K83: 14.01 | L83: 1.37e-002 | M83: 110 | N83: 21.3 | O83: 0.61399999999999999 | P83: 65.77 | Q83: 转股中 | R83: 4.88年 | S83: 2.88年 | T83: 7.38 | U83: 10 | V83: 1.3000000000000001e-002 | W83: 0.10199999999999999 | X83: 6.7000000000000004e-002 | Y83: 72 | Z83: 2.14 | AA83: 7.4000000000000003e-003 | AB83: 3.5999999999999999e-003 | AC83: -1.0700000000000001e-002 | AD83: -1.2500000000000001e-002 | AE83: 91.23 | AF83: 91.08 | AG83: 0.21 | AH83: AA | AI83: 4.0099999999999997e-002 | AJ83: =H83+100*O83 -> 167.56999999999999 | AK83: 146.6 | AL83: 161 | AM83: 55.3 | AN83: 175 | AO83: 3.9e-002 | AP83: 22 | AQ83: 科华转债!
A84: 132 | B84: 128131 | C84: 崇达转2! | D84: 2815 | E84: 崇达技术 | F84: 电子 | G84: 元器件制 | H84: 110.947 | I84: -2.2000000000000001e-003 | J84: 2.3e-003 | K84: 12.76 | L84: 8.0000000000000004e-004 | M84: 114.9 | N84: 19.38 | O84: 0.68500000000000005 | P84: 65.84 | Q84: 转股中 | R84: 4.99年 | S84: 2.99年 | T84: 14 | U84: 8 | V84: 5.0000000000000001e-003 | W84: 0.125 | X84: 8.199999999999999e-002 | Y84: 112 | Z84: 2.73 | AA84: 7.1999999999999998e-003 | AB84: 1.8e-003 | AC84: -2.2200000000000001e-002 | AD84: -2.4199999999999999e-002 | AE84: 91.42 | AF84: 94.77 | AG84: 0.18 | AH84: AA | AI84: 4.0099999999999997e-002 | AJ84: =H84+100*O84 -> 179.447 | AK84: 156.1 | AL84: 221 | AM84: 61.3 | AN84: 204 | AO84: -1.3999999999999999e-002 | AP84: 10 | AQ84: 崇达转2!
A85: 355 | B85: 128022 | C85: 众信转债! | D85: 2707 | E85: 众信旅游 | F85: 旅游餐饮 | G85: 旅游 | H85: 107.157 | I85: 6.4000000000000003e-003 | J85: -6.4000000000000003e-003 | K85: 5.43 | L85: 1.1200000000000002e-002 | M85: 108.8 | N85: 7.92 | O85: 0.56299999999999994 | P85: 68.56 | Q85: 转股中 | R85: 2.22年 | S85: 0.22年 | T85: 4.56 | U85: 50 | V85: 0.10199999999999999 | W85: 9.3000000000000013e-002 | X85: 6.3e-002 | Y85: 49 | Z85: 8.21 | AA85: 6.9999999999999993e-003 | AB85: -5.0000000000000001e-004 | AC85: -0.14499999999999999 | AD85: -0.153 | AE85: 98.53 | AF85: 91.83 | AG85: 0 | AH85: A | AI85: 8.0700000000000008e-002 | AJ85: =H85+100*O85 -> 163.45699999999999 | AK85: 145.8 | AL85: 150 | AM85: 47.2 | AN85: 118 | AO85: 8.900000000000001e-002 | AP85: 35 | AQ85: 众信转债!
A86: 210 | B86: 113574 | C86: 华体转债! | D86: 603679 | E86: 华体科技 | F86: 城市公用 | G86: 城市公用 | H86: 112.39 | I86: -5.1999999999999998e-003 | J86: 5.4000000000000003e-003 | K86: 15.6 | L86: 3.2000000000000002e-003 | M86: 115.9 | N86: 33.91 | O86: 1.4399999999999999 | P86: 46 | Q86: 转股中 | R86: 4.55年 | S86: 2.55年 | T86: 2.09 | U86: 4.4 | V86: 1.9e-002 | W86: 9.4e-002 | X86: 4.2999999999999997e-002 | Y86: 22 | Z86: 2.89 | AA86: 6.8999999999999999e-003 | AB86: 7.000000000000001e-004 | AC86: -2.8199999999999999e-002 | AD86: -3.0899999999999997e-002 | AE86: 86.3 | AF86: 85.09 | AG86: 0.04 | AH86: A+ | AI86: 7.2099999999999997e-002 | AJ86: =H86+100*O86 -> 256.38999999999999 | AK86: 178.8 | AL86: 299 | AM86: 92.5 | AN86: 311 | AO86: -1.8000000000000002e-002 | AP86: 19 | AQ86: 华体转债!
A87: 114 | B87: 113606 | C87: 荣泰转债 | D87: 603579 | E87: 荣泰健康 | F87: 机械装备 | G87: 专用设备 | H87: 117.12 | I87: -6.4000000000000003e-003 | J87: 5.6999999999999993e-003 | K87: 30 | L87: -1.2999999999999999e-003 | M87: 121.2 | N87: 32.83 | O87: 0.28199999999999997 | P87: 91.38 | Q87: 转股中 | R87: 5年49天 | S87: 3年50天 | T87: 6 | U87: 1.8 | V87: 3.0000000000000001e-003 | W87: 0.14300000000000002 | X87: 0.13100000000000001 | Y87: 42 | Z87: 2.51 | AA87: 6.8000000000000005e-003 | AB87: -2.9999999999999997e-004 | AC87: -3.5400000000000001e-002 | AD87: -3.7599999999999995e-002 | AE87: 85.4 | AF87: 89.36 | AG87: 0.55 | AH87: AA- | AI87: 6.2699999999999992e-002 | AJ87: =H87+100*O87 -> 145.31999999999999 | AK87: 142.9 | AL87: 122 | AM87: 53.5 | AN87: 162 | AO87: 1.6e-002 | AP87: 11 | AQ87: 荣泰转债
A88: 147 | B88: 113598 | C88: 法兰转债 | D88: 603966 | E88: 法兰泰克 | F88: 机械装备 | G88: 工程机械 | H88: 117.02 | I88: -1.29e-002 | J88: -8.9999999999999998e-004 | K88: 9.3 | L88: -2.41e-002 | M88: 120.8 | N88: 9.7 | O88: 0.221 | P88: 95.88 | Q88: 转股中 | R88: 4.89年 | S88: 2.89年 | T88: 2.75 | U88: 12 | V88: 3.7000000000000005e-002 | W88: 9.9000000000000005e-002 | X88: 9.5000000000000001e-002 | Y88: 28 | Z88: 1.7 | AA88: 6.7000000000000002e-003 | AB88: -7.000000000000001e-004 | AC88: -3.9100000000000003e-002 | AD88: -4.1299999999999996e-002 | AE88: 86.69 | AF88: 90.96 | AG88: 0.57 | AH88: AA- | AI88: 6.1100000000000002e-002 | AJ88: =H88+100*O88 -> 139.12 | AK88: 138.2 | AL88: 68 | AM88: 47.2 | AN88: 117 | AO88: 6.0999999999999999e-002 | AP88: 13 | AQ88: 法兰转债
A89: 21 | B89: 113625 | C89: 江山转债! | D89: 603208 | E89: 江山欧派 | F89: 其他 | G89: 家居用品 | H89: 119.74 | I89: -8.0000000000000004e-004 | J89: -5.9999999999999995e-004 | K89: 71.76 | L89: -3.4999999999999996e-003 | M89: 124 | N89: 97.55 | O89: 0.628 | P89: 73.56 | Q89: 3月9天 | R89: 5.75年 | S89: 3.75年 | T89: 5.83 | U89: 6.4 | V89: 9.0000000000000011e-003 | W89: 7.6999999999999999e-002 | X89: 5.7000000000000002e-002 | Y89: 75 | Z89: 4.07 | AA89: 6.1999999999999998e-003 | AB89: -8.0000000000000004e-004 | AC89: -3.5799999999999998e-002 | AD89: -3.7599999999999995e-002 | AE89: 82.08 | AF89: 88.01 | AG89: 0.4 | AH89: AA- | AI89: 6.2699999999999992e-002 | AJ89: =H89+100*O89 -> 182.53999999999999 | AK89: 165.9 | AL89: 268 | AM89: 77.9 | AN89: 278 | AO89: -5.9000000000000004e-002 | AP89: 3 | AQ89: 江山转债!
A90: 225 | B90: 113567 | C90: 君禾转债! | D90: 603617 | E90: 君禾股份 | F90: 机械装备 | G90: 通用设备 | H90: 115.7 | I90: -7.6e-003 | J90: 8.199999999999999e-003 | K90: 10.61 | L90: 8.9999999999999998e-004 | M90: 118.8 | N90: 11.16 | O90: 0.217 | P90: 95.07 | Q90: 转股中 | R90: 4.48年 | S90: 2.48年 | T90: 2.1 | U90: 5.2 | V90: 2.1000000000000001e-002 | W90: 9.9000000000000005e-002 | X90: 9.4e-002 | Y90: 21 | Z90: 3.12 | AA90: 6.0999999999999995e-003 | AB90: -1.2999999999999999e-003 | AC90: -4.0000000000000001e-002 | AD90: -4.2699999999999995e-002 | AE90: 86.67 | AF90: 87.66 | AG90: 0.6 | AH90: A+ | AI90: 7.2099999999999997e-002 | AJ90: =H90+100*O90 -> 137.40000000000001 | AK90: 136.3 | AL90: 48 | AM90: 48.7 | AN90: 125 | AO90: 1.2e-002 | AP90: 33 | AQ90: 君禾转债!
A91: 97 | B91: 123080 | C91: 海波转债! | D91: 300517 | E91: 海波重科 | F91: 建筑 | G91: 建筑工程 | H91: 122.759 | I91: 4.0000000000000002e-004 | J91: -5.1999999999999998e-003 | K91: 12.83 | L91: -6.9999999999999993e-003 | M91: 126.5 | N91: 11.58 | O91: 0.10800000000000001 | P91: 110.79 | Q91: 转股中 | R91: 5.22年 | S91: 3.23年 | T91: 2.44 | U91: 9.4 | V91: 3.1e-002 | W91: 9.9000000000000005e-002 | X91: 0.109 | Y91: 25 | Z91: 2.89 | AA91: 5.8999999999999999e-003 | AB91: -2.5000000000000001e-003 | AC91: -4.6500000000000007e-002 | AD91: -4.8899999999999999e-002 | AE91: 82.51 | AF91: 88.05 | AG91: 0.7 | AH91: A+ | AI91: 7.3700000000000002e-002 | AJ91: =H91+100*O91 -> 133.559 | AK91: 134.7 | AL91: 32 | AM91: 46.7 | AN91: 109 | AO91: -4.9000000000000002e-002 | AP91: 24 | AQ91: 海波转债!
A92: 49 | B92: 123106 | C92: 正丹转债! | D92: 300641 | E92: 正丹股份 | F92: 化工 | G92: 化工 | H92: 121.812 | I92: -2.5499999999999998e-002 | J92: 3.2000000000000002e-003 | K92: 7.79 | L92: -3.5900000000000001e-002 | M92: 125.5 | N92: 7.5 | O92: 0.17300000000000001 | P92: 103.87 | Q92: 20天 | R92: 5.53年 | S92: 3.53年 | T92: 3.2 | U92: 13 | V92: 3.3000000000000002e-002 | W92: 8.4000000000000005e-002 | X92: 8.6999999999999994e-002 | Y92: 38 | Z92: 2.7 | AA92: 5.5000000000000005e-003 | AB92: -2.0999999999999999e-003 | AC92: -4.2599999999999999e-002 | AD92: -4.4500000000000005e-002 | AE92: 83.1 | AF92: 90.23 | AG92: 0.62 | AH92: AA- | AI92: 6.2699999999999992e-002 | AJ92: =H92+100*O92 -> 139.11199999999999 | AK92: 139.8 | AL92: 90 | AM92: 49.5 | AN92: 133 | AO92: -6.7000000000000004e-002 | AP92: 15 | AQ92: 正丹转债!
A93: 179 | B93: 113588 | C93: 润达转债! | D93: 603108 | E93: 润达医疗 | F93: 医药 | G93: 医疗器械 | H93: 111.08 | I93: -1.41e-002 | J93: 8.0000000000000002e-003 | K93: 10.5 | L93: -1.78e-002 | M93: 113.9 | N93: 13.25 | O93: 0.40200000000000002 | P93: 79.25 | Q93: 转股中 | R93: 4.76年 | S93: 2.77年 | T93: 5.5 | U93: 5.2 | V93: 8.0000000000000002e-003 | W93: 8.9999999999999997e-002 | X93: 7.2000000000000008e-002 | Y93: 61 | Z93: 1.88 | AA93: 5.4000000000000003e-003 | AB93: 1.e-004 | AC93: -2.4300000000000002e-002 | AD93: -2.6499999999999999e-002 | AE93: 92.23 | AF93: 94.78 | AG93: 0.34 | AH93: AA | AI93: 4.0099999999999997e-002 | AJ93: =H93+100*O93 -> 151.28 | AK93: 142.9 | AL93: 124 | AM93: 48.1 | AN93: 124 | AO93: 2.8999999999999998e-002 | AP93: 11 | AQ93: 润达转债!
A94: 150 | B94: 123063 | C94: 大禹转债 | D94: 300021 | E94: 大禹节水 | F94: 化工 | G94: 橡胶塑料 | H94: 123 | I94: -1.0800000000000001e-002 | J94: -3.2000000000000002e-003 | K94: 5.33 | L94: -2.2000000000000002e-002 | M94: 126.1 | N94: 4.83 | O94: 0.115 | P94: 110.35 | Q94: 转股中 | R94: 4.88年 | S94: 3.88年 | T94: 6.35 | U94: 14 | V94: 1.8000000000000002e-002 | W94: 0.14899999999999999 | X94: 0.16399999999999998 | Y94: 43 | Z94: 2.93 | AA94: 5.1999999999999998e-003 | AB94: -3.5999999999999999e-003 | AC94: -3.5299999999999998e-002 | AD94: -3.8199999999999998e-002 | AE94: 84.2 | AF94: 94.99 | AG94: 0.64 | AH94: AA- | AI94: 6.1100000000000002e-002 | AJ94: =H94+100*O94 -> 134.5 | AK94: 135.6 | AL94: 41 | AM94: 40.7 | AN94: 59 | AO94: -8.0000000000000002e-003 | AP94: 20 | AQ94: 大禹转债
A95: 55 | B95: 123104 | C95: 卫宁转债! | D95: 300253 | E95: 卫宁健康 | F95: 计算机及 | G95: 软件开发 | H95: 121.614 | I95: 3.4999999999999996e-003 | J95: -4.8999999999999998e-003 | K95: 14.54 | L95: -4.0999999999999995e-003 | M95: 125.1 | N95: 17.74 | O95: 0.48399999999999999 | P95: 81.96 | Q95: 12天 | R95: 5.51年 | S95: 3.51年 | T95: 9.7 | U95: 11 | V95: 9.0000000000000011e-003 | W95: 3.1e-002 | X95: 2.6000000000000002e-002 | Y95: 311 | Z95: 6.78 | AA95: 5.1999999999999998e-003 | AB95: -2.3e-003 | AC95: -4.2999999999999997e-002 | AD95: -4.4699999999999997e-002 | AE95: 89.26 | AF95: 100.27 | AG95: 0.33 | AH95: AA | AI95: 4.1700000000000001e-002 | AJ95: =H95+100*O95 -> 170.01400000000001 | AK95: 161.3 | AL95: 251 | AM95: 61 | AN95: 198 | AO95: 2.9999999999999999e-002 | AP95: 5 | AQ95: 卫宁转债!
A96: 98 | B96: 113610 | C96: 灵康转债 | D96: 603669 | E96: 灵康药业 | F96: 医药 | G96: 化学制药 | H96: 118.22 | I96: -6.6e-003 | J96: 6.6e-003 | K96: 8.98 | L96: 0. | M96: 121.1 | N96: 8.61 | O96: 0.13300000000000001 | P96: 104.3 | Q96: 转股中 | R96: 5.22年 | S96: 3.22年 | T96: 4.58 | U96: 12 | V96: 2.2000000000000002e-002 | W96: 7.2000000000000008e-002 | X96: 7.4999999999999997e-002 | Y96: 64 | Z96: 4.94 | AA96: 4.6999999999999993e-003 | AB96: -2.2000000000000001e-003 | AC96: -3.7400000000000003e-002 | AD96: -3.95e-002 | AE96: 84.85 | AF96: 88.78 | AG96: 0.65 | AH96: AA- | AI96: 6.2699999999999992e-002 | AJ96: =H96+100*O96 -> 131.52000000000001 | AK96: 132.1 | AL96: 23 | AM96: 43.4 | AN96: 85 | AO96: -2.4e-002 | AP96: 28 | AQ96: 灵康转债
A97: 64 | B97: 123099 | C97: 普利转债 | D97: 300630 | E97: 普利制药 | F97: 医药 | G97: 化学制药 | H97: 120.493 | I97: 8.0000000000000004e-004 | J97: -5.0000000000000001e-003 | K97: 39.1 | L97: -8.6e-003 | M97: 123.5 | N97: 46.03 | O97: 0.41799999999999998 | P97: 84.94 | Q97: 转股中 | R97: 5.41年 | S97: 3.42年 | T97: 8.5 | U97: 5.3 | V97: 5.0000000000000001e-003 | W97: 5.0000000000000003e-002 | X97: 4.2000000000000003e-002 | Y97: 171 | Z97: 7.79 | AA97: 4.5999999999999999e-003 | AB97: -2.5999999999999999e-003 | AC97: -4.0999999999999995e-002 | AD97: -4.2999999999999997e-002 | AE97: 83.7 | AF97: 89.44 | AG97: 0.49 | AH97: AA- | AI97: 6.2699999999999992e-002 | AJ97: =H97+100*O97 -> 162.29300000000001 | AK97: 156 | AL97: 220 | AM97: 66.6 | AN97: 243 | AO97: -6.8000000000000005e-002 | AP97: 5 | AQ97: 普利转债
A98: 106 | B98: 113608 | C98: 威派转债! | D98: 603956 | E98: 威派格 | F98: 机械装备 | G98: 专用设备 | H98: 118.86 | I98: -1.9799999999999998e-002 | J98: -7.0999999999999995e-003 | K98: 17.73 | L98: -4.3700000000000003e-002 | M98: 121.6 | N98: 19.08 | O98: 0.27899999999999997 | P98: 92.92 | Q98: 转股中 | R98: 5年59天 | S98: 3.16年 | T98: 4.2 | U98: 11 | V98: 2.3e-002 | W98: 5.5999999999999994e-002 | X98: 5.2000000000000005e-002 | Y98: 76 | Z98: 6.79 | AA98: 4.5000000000000005e-003 | AB98: -2.5999999999999999e-003 | AC98: -3.8100000000000002e-002 | AD98: -4.0599999999999997e-002 | AE98: 82.82 | AF98: 85.04 | AG98: 0.62 | AH98: A+ | AI98: 7.3700000000000002e-002 | AJ98: =H98+100*O98 -> 146.75999999999999 | AK98: 144.8 | AL98: 140 | AM98: 59.8 | AN98: 193 | AO98: 1.6e-002 | AP98: 7 | AQ98: 威派转债!
A99: 134 | B99: 123064 | C99: 万孚转债! | D99: 300482 | E99: 万孚生物 | F99: 医药 | G99: 医疗器械 | H99: 112.4 | I99: 3.4999999999999996e-003 | J99: -2.8000000000000004e-003 | K99: 41.15 | L99: 6.0999999999999995e-003 | M99: 114.8 | N99: 71.65 | O99: 0.95700000000000007 | P99: 57.43 | Q99: 转股中 | R99: 4.97年 | S99: 2.98年 | T99: 5.99 | U99: 5.1 | V99: 8.0000000000000002e-003 | W99: 3.3000000000000002e-002 | X99: 1.9e-002 | Y99: 183 | Z99: 5.79 | AA99: 4.3e-003 | AB99: -1.e-003 | AC99: -2.6699999999999998e-002 | AD99: -2.86e-002 | AE99: 91.38 | AF99: 94.74 | AG99: 0.11 | AH99: AA | AI99: 4.0099999999999997e-002 | AJ99: =H99+100*O99 -> 208.10000000000002 | AK99: 167.4 | AL99: 273 | AM99: 72.6 | AN99: 265 | AO99: -9.8000000000000004e-002 | AP99: 10 | AQ99: 万孚转债!
A100: 281 | B100: 113535 | C100: 大业转债! | D100: 603278 | E100: 大业股份 | F100: 汽车 | G100: 零部件制 | H100: 111.35 | I100: -5.4000000000000003e-003 | J100: 8.9999999999999998e-004 | K100: 10.22 | L100: -1.7299999999999999e-002 | M100: 112.5 | N100: 12.29 | O100: 0.33899999999999997 | P100: 83.16 | Q100: 转股中 | R100: 2.66年 | S100: 0.66年 | T100: 5 | U100: 10 | V100: 1.9e-002 | W100: 0.16899999999999998 | X100: 0.14000000000000001 | Y100: 30 | Z100: 1.68 | AA100: 3.9000000000000003e-003 | AB100: -4.5999999999999999e-003 | AC100: -0.113 | AD100: -0.115 | AE100: 98.13 | AF100: 101.82 | AG100: 0.26 | AH100: AA | AI100: 3.8699999999999998e-002 | AJ100: =H100+100*O100 -> 145.25 | AK100: 139.5 | AL100: 86 | AM100: 37.7 | AN100: 37 | AO100: 1.8000000000000002e-002 | AP100: 48 | AQ100: 大业转债!
A101: 45 | B101: 123107 | C101: 温氏转债! | D101: 300498 | E101: 温氏股份 | F101: 农业 | G101: 畜牧业 | H101: 110.62 | I101: -9.1999999999999998e-003 | J101: 8.5000000000000006e-003 | K101: 13.65 | L101: -2.2000000000000001e-003 | M101: 113 | N101: 17.62 | O101: 0.42799999999999999 | P101: 77.47 | Q101: 28天 | R101: 5.55年 | S101: 3.55年 | T101: 93 | U101: 126 | V101: 1.2e-002 | W101: 0.107 | X101: 8.3000000000000004e-002 | Y101: 867 | Z101: 2.08 | AA101: 3.9000000000000003e-003 | AB101: -4.0000000000000002e-004 | AC101: -1.7899999999999999e-002 | AD101: -1.9599999999999999e-002 | AE101: 91.28 | AF101: 93.84 | AG101: 0.33 | AH101: AAA | AI101: 3.4700000000000002e-002 | AJ101: =H101+100*O101 -> 153.42000000000002 | AK101: 143.8 | AL101: 132 | AM101: 49.9 | AN101: 134 | AO101: 2.6000000000000002e-002 | AP101: 11 | AQ101: 温氏转债!
A102: 217 | B102: 128100 | C102: 搜特转债! | D102: 2503 | E102: 搜于特 | F102: 服装纺织 | G102: 服装行业 | H102: 114.95 | I102: -1.4999999999999999e-002 | J102: -9.300000000000001e-003 | K102: 1.72 | L102: -3.3700000000000001e-002 | M102: 116.9 | N102: 1.62 | O102: 8.3000000000000004e-002 | P102: 106.17 | Q102: 转股中 | R102: 4.50年 | S102: 2.50年 | T102: 7.99 | U102: 262 | V102: 0.27899999999999997 | W102: 0.14999999999999999 | X102: 0.16 | Y102: 53 | Z102: 2.31 | AA102: 3.8e-003 | AB102: -2.8000000000000004e-003 | AC102: -3.9199999999999999e-002 | AD102: -4.1500000000000002e-002 | AE102: 83.94 | AF102: 82.58 | AG102: 0.72 | AH102: A | AI102: 8.2100000000000006e-002 | AJ102: =H102+100*O102 -> 123.25 | AK102: 123.7 | AL102: 4 | AM102: 39.8 | AN102: 53 | AO102: 8.8000000000000009e-002 | AP102: 75 | AQ102: 搜特转债!
A103: 212 | B103: 110068 | C103: 龙净转债! | D103: 600388 | E103: 龙净环保 | F103: 城市公用 | G103: 三废处理 | H103: 112.95 | I103: -4.7999999999999996e-003 | J103: -2.9999999999999997e-004 | K103: 9.36 | L103: -1.2699999999999999e-002 | M103: 114.8 | N103: 10.55 | O103: 0.27300000000000002 | P103: 88.72 | Q103: 转股中 | R103: 4.53年 | S103: 2.53年 | T103: 20 | U103: 21 | V103: 9.0000000000000011e-003 | W103: 0.20000000000000001 | X103: 0.17699999999999999 | Y103: 100 | Z103: 1.63 | AA103: 3.7000000000000002e-003 | AB103: -2.2000000000000001e-003 | AC103: -3.2799999999999996e-002 | AD103: -3.5000000000000003e-002 | AE103: 94.19 | AF103: 98.48 | AG103: 0.4 | AH103: AA+ | AI103: 3.5099999999999999e-002 | AJ103: =H103+100*O103 -> 140.25 | AK103: 137.2 | AL103: 55 | AM103: 38.7 | AN103: 43 | AO103: 3.2000000000000001e-002 | AP103: 35 | AQ103: 龙净转债!
A104: 260 | B104: 113546 | C104: 迪贝转债! | D104: 603320 | E104: 迪贝电气 | F104: 家电 | G104: 零部件制 | H104: 118.88 | I104: 5.9999999999999995e-004 | J104: 8.5000000000000006e-003 | K104: 14.06 | L104: 1.52e-002 | M104: 120.6 | N104: 14 | O104: 0.184 | P104: 100.43 | Q104: 转股中 | R104: 4年42天 | S104: 2年43天 | T104: 2.3 | U104: 20 | V104: 7.2999999999999995e-002 | W104: 0.126 | X104: 0.126 | Y104: 18 | Z104: 2.56 | AA104: 3.5999999999999999e-003 | AB104: -5.0000000000000001e-003 | AC104: -5.79e-002 | AD104: -6.0899999999999996e-002 | AE104: 88.86 | AF104: 91.23 | AG104: 0.6 | AH104: A+ | AI104: 7.2099999999999997e-002 | AJ104: =H104+100*O104 -> 137.28 | AK104: 137.3 | AL104: 58 | AM104: 46.1 | AN104: 106 | AO104: 8.5000000000000006e-002 | AP104: 39 | AQ104: 迪贝转债!
A105: 108 | B105: 127024 | C105: 盈峰转债! | D105: 967 | E105: 盈峰环境 | F105: 机械装备 | G105: 专用设备 | H105: 114.7 | I105: -6.8999999999999999e-003 | J105: 7.9000000000000008e-003 | K105: 6.71 | L105: 3.0000000000000001e-003 | M105: 116.8 | N105: 8.19 | O105: 0.40000000000000002 | P105: 81.93 | Q105: 转股中 | R105: 5年54天 | S105: 3年55天 | T105: 14.8 | U105: 9.3 | V105: 5.0000000000000001e-003 | W105: 7.0000000000000007e-002 | X105: 5.7000000000000002e-002 | Y105: 212 | Z105: 1.31 | AA105: 3.5999999999999999e-003 | AB105: -2.2000000000000001e-003 | AC105: -3.1300000000000001e-002 | AD105: -3.3099999999999997e-002 | AE105: 91.75 | AF105: 97.33 | AG105: 0.34 | AH105: AA+ | AI105: 3.6699999999999997e-002 | AJ105: =H105+100*O105 -> 154.69999999999999 | AK105: 147.5 | AL105: 167 | AM105: 50.1 | AN105: 136 | AO105: 5.7999999999999996e-002 | AP105: 5 | AQ105: 盈峰转债!
A106: 164 | B106: 128120 | C106: 联诚转债! | D106: 2921 | E106: 联诚精密 | F106: 汽车 | G106: 零部件制 | H106: 116.062 | I106: -8.0000000000000002e-003 | J106: -1.7000000000000001e-003 | K106: 16.39 | L106: -1.5600000000000001e-002 | M106: 117.9 | N106: 18.44 | O106: 0.30599999999999999 | P106: 88.88 | Q106: 转股中 | R106: 4.85年 | S106: 2.85年 | T106: 2.6 | U106: 4.4 | V106: 1.4999999999999999e-002 | W106: 0.14999999999999999 | X106: 0.13300000000000001 | Y106: 17 | Z106: 2.22 | AA106: 3.3e-003 | AB106: -3.2000000000000002e-003 | AC106: -3.5799999999999998e-002 | AD106: -3.8300000000000001e-002 | AE106: 82.23 | AF106: 81.14 | AG106: 0.62 | AH106: A | AI106: 8.2100000000000006e-002 | AJ106: =H106+100*O106 -> 146.66200000000001 | AK106: 143.2 | AL106: 128 | AM106: 61 | AN106: 199 | AO106: 3.1e-002 | AP106: 21 | AQ106: 联诚转债!
A107: 271 | B107: 128071 | C107: 合兴转债! | D107: 2228 | E107: 合兴包装 | F107: 造纸包装 | G107: 包装材料 | H107: 113.065 | I107: -1.5900000000000001e-002 | J107: 1.4800000000000001e-002 | K107: 3.71 | L107: -2.7000000000000001e-003 | M107: 114.3 | N107: 4.18 | O107: 0.27399999999999997 | P107: 88.76 | Q107: 转股中 | R107: 3.93年 | S107: 1.93年 | T107: 3 | U107: 5.5 | V107: 1.6e-002 | W107: 6.5000000000000002e-002 | X107: 5.7999999999999996e-002 | Y107: 46 | Z107: 1.32 | AA107: 2.8000000000000004e-003 | AB107: -3.7000000000000002e-003 | AC107: -4.4600000000000001e-002 | AD107: -4.7100000000000003e-002 | AE107: 94.71 | AF107: 98.2 | AG107: 0.4 | AH107: AA | AI107: 4.0099999999999997e-002 | AJ107: =H107+100*O107 -> 140.465 | AK107: 137.4 | AL107: 59 | AM107: 39.2 | AN107: 48 | AO107: 5.2999999999999999e-002 | AP107: 25 | AQ107: 合兴转债!
A108: 95 | B108: 123082 | C108: 北陆转债! | D108: 300016 | E108: 北陆药业 | F108: 医药 | G108: 化学制药 | H108: 119.997 | I108: -1.1000000000000001e-003 | J108: -6.3e-003 | K108: 9.24 | L108: -1.0700000000000001e-002 | M108: 121.7 | N108: 8.81 | O108: 0.14400000000000002 | P108: 104.88 | Q108: 转股中 | R108: 5.24年 | S108: 3.24年 | T108: 5 | U108: 8.6 | V108: 1.3999999999999999e-002 | W108: 0.11 | X108: 0.115 | Y108: 46 | Z108: 2.68 | AA108: 2.8000000000000004e-003 | AB108: -4.3e-003 | AC108: -3.9900000000000005e-002 | AD108: -4.2300000000000004e-002 | AE108: 82.38 | AF108: 84.65 | AG108: 0.69 | AH108: A+ | AI108: 7.3700000000000002e-002 | AJ108: =H108+100*O108 -> 134.39699999999999 | AK108: 135.1 | AL108: 36 | AM108: 50.5 | AN108: 140 | AO108: 3.7000000000000005e-002 | AP108: 15 | AQ108: 北陆转债!
A109: 36 | B109: 110080 | C109: 东湖转债 | D109: 600133 | E109: 东湖高新 | F109: 建筑 | G109: 建筑工程 | H109: 113.38 | I109: -1.2699999999999999e-002 | J109: 5.1000000000000004e-003 | K109: 5.92 | L109: -1.3300000000000001e-002 | M109: 115.1 | N109: 6.05 | O109: 0.159 | P109: 97.85 | Q109: 36天 | R109: 5.58年 | S109: 3.59年 | T109: 15.5 | U109: 21 | V109: 1.2e-002 | W109: 0.32899999999999996 | X109: 0.32200000000000001 | Y109: 47 | Z109: 0.86 | AA109: 2.7000000000000001e-003 | AB109: -2.0999999999999999e-003 | AC109: -2.3900000000000001e-002 | AD109: -2.5699999999999997e-002 | AE109: 88.99 | AF109: 92 | AG109: 0.57 | AH109: AA | AI109: 4.1700000000000001e-002 | AJ109: =H109+100*O109 -> 129.28 | AK109: 128.9 | AL109: 9 | AM109: 36.9 | AN109: 32 | AO109: 3.2000000000000001e-002 | AP109: 27 | AQ109: 东湖转债
A110: 73 | B110: 128143 | C110: 锋龙转债! | D110: 2931 | E110: 锋龙股份 | F110: 机械装备 | G110: 专用设备 | H110: 120.058 | I110: -2.3399999999999997e-002 | J110: 7.6e-003 | K110: 13.79 | L110: -2.2000000000000002e-002 | M110: 121.7 | N110: 12.73 | O110: 0.10800000000000001 | P110: 108.33 | Q110: 转股中 | R110: 5.33年 | S110: 3.33年 | T110: 2.44 | U110: 20 | V110: 6.8000000000000005e-002 | W110: 8.900000000000001e-002 | X110: 9.6000000000000002e-002 | Y110: 27 | Z110: 4.38 | AA110: 2.5999999999999999e-003 | AB110: -4.3e-003 | AC110: -3.9100000000000003e-002 | AD110: -4.1399999999999999e-002 | AE110: 81.87 | AF110: 84.13 | AG110: 0.72 | AH110: A+ | AI110: 7.3700000000000002e-002 | AJ110: =H110+100*O110 -> 130.858 | AK110: 131.8 | AL110: 20 | AM110: 47.7 | AN110: 120 | AO110: 2.8999999999999998e-002 | AP110: 14 | AQ110: 锋龙转债!
A111: 117 | B111: 113605 | C111: 大参转债! | D111: 603233 | E111: 大参林 | F111: 医药 | G111: 医药商业 | H111: 114.04 | I111: 5.0000000000000001e-004 | J111: -4.0999999999999995e-003 | K111: 43.33 | L111: -2.2599999999999999e-002 | M111: 115.2 | N111: 69.09 | O111: 0.81799999999999995 | P111: 62.72 | Q111: 转股中 | R111: 5年41天 | S111: 3年42天 | T111: 14 | U111: 8.5 | V111: 5.0000000000000001e-003 | W111: 4.0999999999999995e-002 | X111: 2.6000000000000002e-002 | Y111: 342 | Z111: 6.68 | AA111: 2.e-003 | AB111: -3.3e-003 | AC111: -2.8799999999999999e-002 | AD111: -3.0899999999999997e-002 | AE111: 90.82 | AF111: 93.89 | AG111: 0.16 | AH111: AA | AI111: 4.1700000000000001e-002 | AJ111: =H111+100*O111 -> 195.84 | AK111: 165.4 | AL111: 266 | AM111: 71.5 | AN111: 260 | AO111: -8.4000000000000005e-002 | AP111: 7 | AQ111: 大参转债!
A112: 74 | B112: 127028 | C112: 英特转债! | D112: 411 | E112: 英特集团 | F112: 医药 | G112: 医药商业 | H112: 111.913 | I112: -8.0000000000000004e-004 | J112: -5.1999999999999998e-003 | K112: 12.3 | L112: -1.2e-002 | M112: 113.1 | N112: 13.4 | O112: 0.21899999999999997 | P112: 91.79 | Q112: 转股中 | R112: 5.32年 | S112: 3.32年 | T112: 6 | U112: 17 | V112: 2.6000000000000002e-002 | W112: 0.19600000000000001 | X112: 0.17999999999999999 | Y112: 31 | Z112: 1.76 | AA112: 2.e-003 | AB112: -2.5000000000000001e-003 | AC112: -2.2099999999999998e-002 | AD112: -2.4e-002 | AE112: 91.47 | AF112: 93.72 | AG112: 0.5 | AH112: AA+ | AI112: 3.6699999999999997e-002 | AJ112: =H112+100*O112 -> 133.81299999999999 | AK112: 132 | AL112: 22 | AM112: 38.3 | AN112: 39 | AO112: 2.e-002 | AP112: 25 | AQ112: 英特转债!
A113: 121 | B113: 128135 | C113: 洽洽转债! | D113: 2557 | E113: 洽洽食品 | F113: 食品饮料 | G113: 休闲食品 | H113: 119.15 | I113: 3.0999999999999999e-003 | J113: -4.6999999999999993e-003 | K113: 42.1 | L113: -7.4999999999999997e-003 | M113: 120.2 | N113: 60.03 | O113: 0.69900000000000007 | P113: 70.13 | Q113: 转股中 | R113: 5年39天 | S113: 3年40天 | T113: 13.4 | U113: 17 | V113: 1.1000000000000001e-002 | W113: 6.3e-002 | X113: 4.4000000000000004e-002 | Y113: 213 | Z113: 5.15 | AA113: 1.8e-003 | AB113: -5.0000000000000001e-003 | AC113: -4.1900000000000007e-002 | AD113: -4.3899999999999995e-002 | AE113: 90.84 | AF113: 97.97 | AG113: 0.21 | AH113: AA | AI113: 4.1700000000000001e-002 | AJ113: =H113+100*O113 -> 189.05000000000001 | AK113: 168.2 | AL113: 276 | AM113: 70.2 | AN113: 252 | AO113: 4.0999999999999995e-002 | AP113: 11 | AQ113: 洽洽转债!
A114: 80 | B114: 123090 | C114: 三诺转债! | D114: 300298 | E114: 三诺生物 | F114: 医药 | G114: 医疗器械 | H114: 116.132 | I114: 1.6000000000000001e-003 | J114: -6.8000000000000005e-003 | K114: 25.69 | L114: -1.7600000000000001e-002 | M114: 117.1 | N114: 35.18 | O114: 0.58999999999999997 | P114: 73.02 | Q114: 转股中 | R114: 5.28年 | S114: 3.28年 | T114: 5 | U114: 3.8 | V114: 6.9999999999999993e-003 | W114: 3.4000000000000002e-002 | X114: 2.5000000000000001e-002 | Y114: 145 | Z114: 5.39 | AA114: 1.6000000000000001e-003 | AB114: -4.0999999999999995e-003 | AC114: -3.2899999999999999e-002 | AD114: -3.4799999999999998e-002 | AE114: 90.12 | AF114: 94.78 | AG114: 0.29 | AH114: AA | AI114: 4.1700000000000001e-002 | AJ114: =H114+100*O114 -> 175.13200000000001 | AK114: 159.2 | AL114: 236 | AM114: 64.5 | AN114: 229 | AO114: -4.8000000000000001e-002 | AP114: 4 | AQ114: 三诺转债!
A115: 14 | B115: 123118 | C115: 惠城转债 | D115: 300779 | E115: 惠城环保 | F115: 化工 | G115: 其他 | H115: 120.601 | I115: 4.6999999999999993e-003 | J115: 1.04e-002 | K115: 18.54 | L115: 2.0899999999999998e-002 | M115: 121.7 | N115: 17.11 | O115: 0.113 | P115: 108.36 | Q115: 4月5天 | R115: 5.82年 | S115: 3.82年 | T115: 3.2 | U115: 29 | V115: 7.5999999999999998e-002 | W115: 0.17300000000000001 | X115: 0.187 | Y115: 19 | Z115: 2.8 | AA115: 1.6000000000000001e-003 | AB115: -4.7999999999999996e-003 | AC115: -3.5400000000000001e-002 | AD115: -3.7499999999999999e-002 | AE115: 79.05 | AF115: 81.23 | AG115: 0.72 | AH115: A+ | AI115: 7.3700000000000002e-002 | AJ115: =H115+100*O115 -> 131.90100000000001 | AK115: 132.8 | AL115: 26 | AM115: 51.6 | AN115: 147 | AO115: 3.7999999999999999e-002 | AP115: 6 | AQ115: 惠城转债
A116: 37 | B116: 127032 | C116: 苏行转债 | D116: 2966 | E116: 苏州银行 | F116: 金融 | G116: 银行行业 | H116: 114.3 | I116: 1.15e-002 | J116: -9.0000000000000011e-003 | K116: 7.12 | L116: 5.6000000000000008e-003 | M116: 115.1 | N116: 8.1 | O116: 0.29999999999999999 | P116: 87.9 | Q116: 38天 | R116: 5.58年 | S116: 无权 | T116: 50 | U116: 93 | V116: 1.6e-002 | W116: 0.21100000000000002 | X116: 0.185 | Y116: 237 | Z116: 0.77 | AA116: 1.2999999999999999e-003 | AB116: -3.5999999999999999e-003 | AC116: 无权 | AD116: 无权 | AE116: 无权 | AF116: 95.44 | AG116: 0.44 | AH116: AAA | AI116: 3.4700000000000002e-002 | AJ116: =H116+100*O116 -> 144.30000000000001 | AK116: 140.7 | AL116: 100 | AM116: 45.3 | AN116: 98 | AO116: 2.3e-002 | AP116: 8 | AQ116: 苏行转债
A117: 272 | B117: 113542 | C117: 好客转债! | D117: 603898 | E117: 好莱客 | F117: 其他 | G117: 家居用品 | H117: 113.76 | I117: 1.e-004 | J117: -3.9000000000000003e-003 | K117: 12.96 | L117: -1.29e-002 | M117: 114.3 | N117: 16.14 | O117: 0.41700000000000004 | P117: 80.3 | Q117: 转股中 | R117: 3.89年 | S117: 1.89年 | T117: 6.03 | U117: 1 | V117: 2.e-003 | W117: 0.14899999999999999 | X117: 0.12 | Y117: 40 | Z117: 1.53 | AA117: 1.1999999999999999e-003 | AB117: -5.4000000000000003e-003 | AC117: -4.8399999999999999e-002 | AD117: -5.0799999999999998e-002 | AE117: 94.87 | AF117: 98.36 | AG117: 0.3 | AH117: AA | AI117: 4.0099999999999997e-002 | AJ117: =H117+100*O117 -> 155.46000000000001 | AK117: 147.2 | AL117: 164 | AM117: 48.9 | AN117: 126 | AO117: 5.4000000000000006e-002 | AP117: 16 | AQ117: 好客转债!
A118: 66 | B118: 123097 | C118: 美力转债 | D118: 300611 | E118: 美力科技 | F118: 机械装备 | G118: 通用设备 | H118: 120.9 | I118: -1.8000000000000002e-002 | J118: 8.3999999999999995e-003 | K118: 10.22 | L118: -1.3500000000000002e-002 | M118: 121.6 | N118: 9.28 | O118: 9.8000000000000004e-002 | P118: 110.13 | Q118: 转股中 | R118: 5.38年 | S118: 3.38年 | T118: 3 | U118: 10 | V118: 2.7999999999999997e-002 | W118: 0.16399999999999998 | X118: 0.18100000000000002 | Y118: 18 | Z118: 2.63 | AA118: 1.1000000000000001e-003 | AB118: -5.6999999999999993e-003 | AC118: -4.0399999999999998e-002 | AD118: -4.2800000000000005e-002 | AE118: 81.55 | AF118: 83.74 | AG118: 0.71 | AH118: A+ | AI118: 7.3700000000000002e-002 | AJ118: =H118+100*O118 -> 130.70000000000002 | AK118: 131.7 | AL118: 18 | AM118: 47.9 | AN118: 122 | AO118: -5.7999999999999996e-002 | AP118: 22 | AQ118: 美力转债
A119: 274 | B119: 128070 | C119: 智能转债! | D119: 2877 | E119: 智能自控 | F119: 机械装备 | G119: 通用设备 | H119: 116.57 | I119: -2.3599999999999999e-002 | J119: 1.8500000000000003e-002 | K119: 6.74 | L119: -1.61e-002 | M119: 116.8 | N119: 9.47 | O119: 0.63800000000000001 | P119: 71.17 | Q119: 转股中 | R119: 3.81年 | S119: 无权 | T119: 2.3 | U119: 73 | V119: 0.27100000000000002 | W119: 0.10199999999999999 | X119: 7.2999999999999995e-002 | Y119: 22 | Z119: 3.03 | AA119: 5.0000000000000001e-004 | AB119: -7.1999999999999998e-003 | AC119: 无权 | AD119: 无权 | AE119: 无权 | AF119: 90.11 | AG119: 0.32 | AH119: A+ | AI119: 7.2099999999999997e-002 | AJ119: =H119+100*O119 -> 180.37 | AK119: 162 | AL119: 255 | AM119: 71.9 | AN119: 263 | AO119: 1.2e-002 | AP119: 30 | AQ119: 智能转债!
A120: 297 | B120: 123023 | C120: 迪森转债! | D120: 300335 | E120: 迪森股份 | F120: 能源电力 | G120: 电力供应 | H120: 114.2 | I120: -1.8000000000000002e-002 | J120: -1.3000000000000001e-002 | K120: 6.18 | L120: -6.5099999999999991e-002 | M120: 114.3 | N120: 6.89 | O120: 0.27300000000000002 | P120: 89.7 | Q120: 转股中 | R120: 3.52年 | S120: 2.52年 | T120: 5.29 | U120: 37 | V120: 5.9999999999999998e-002 | W120: 0.23000000000000001 | X120: 0.20600000000000002 | Y120: 23 | Z120: 1.7 | AA120: 2.9999999999999997e-004 | AB120: -6.9999999999999993e-003 | AC120: -3.2400000000000005e-002 | AD120: -3.56e-002 | AE120: 89.42 | AF120: 93.15 | AG120: 0.48 | AH120: AA- | AI120: 6.1100000000000002e-002 | AJ120: =H120+100*O120 -> 141.5 | AK120: 138.7 | AL120: 77 | AM120: 45.6 | AN120: 102 | AO120: 2.3e-002 | AP120: 51 | AQ120: 迪森转债!
A121: 326 | B121: 128042 | C121: 凯中转债! | D121: 2823 | E121: 凯中精密 | F121: 能源电力 | G121: 电力设备 | H121: 115.277 | I121: 3.3e-003 | J121: -5.5000000000000005e-003 | K121: 11.07 | L121: -8.1000000000000013e-003 | M121: 115.3 | N121: 12.86 | O121: 0.33899999999999997 | P121: 86.08 | Q121: 转股中 | R121: 2.88年 | S121: 0.89年 | T121: 4.16 | U121: 4 | V121: 8.0000000000000002e-003 | W121: 0.13100000000000001 | X121: 0.113 | Y121: 32 | Z121: 2.35 | AA121: 1.e-004 | AB121: -9.300000000000001e-003 | AC121: -0.111 | AD121: -0.114 | AE121: 97.82 | AF121: 103.51 | AG121: 0.28 | AH121: AA | AI121: 3.8699999999999998e-002 | AJ121: =H121+100*O121 -> 149.17699999999999 | AK121: 144.5 | AL121: 137 | AM121: 41 | AN121: 66 | AO121: -5.0999999999999997e-002 | AP121: 26 | AQ121: 凯中转债!
A122: 116 | B122: 123073 | C122: 同和转债! | D122: 300636 | E122: 同和药业 | F122: 医药 | G122: 原料药 | H122: 122.58 | I122: -1.6799999999999999e-002 | J122: -5.3e-003 | K122: 15.79 | L122: -3.1899999999999998e-002 | M122: 122.4 | N122: 14.82 | O122: 0.14999999999999999 | P122: 106.55 | Q122: 转股中 | R122: 5年45天 | S122: 3年46天 | T122: 3.59 | U122: 26 | V122: 5.9000000000000004e-002 | W122: 0.11 | X122: 0.11800000000000001 | Y122: 33 | Z122: 4.07 | AA122: -2.9999999999999997e-004 | AB122: -7.7000000000000002e-003 | AC122: -4.7699999999999992e-002 | AD122: -5.0099999999999999e-002 | AE122: 83.02 | AF122: 85.82 | AG122: 0.69 | AH122: A+ | AI122: 7.3700000000000002e-002 | AJ122: =H122+100*O122 -> 137.57999999999998 | AK122: 138.6 | AL122: 74 | AM122: 52.8 | AN122: 154 | AO122: 8.9999999999999997e-002 | AP122: 12 | AQ122: 同和转债!
A123: 136 | B123: 128129 | C123: 青农转债! | D123: 2958 | E123: 青农商行 | F123: 金融 | G123: 银行行业 | H123: 112.368 | I123: 1.1200000000000002e-002 | J123: -6.3e-003 | K123: 4.09 | L123: 9.8999999999999991e-003 | M123: 112 | N123: 4.32 | O123: 0.187 | P123: 94.68 | Q123: 转股中 | R123: 4.95年 | S123: 无权 | T123: 50 | U123: 53 | V123: 9.0000000000000011e-003 | W123: 0.22 | X123: 0.20800000000000002 | Y123: 227 | Z123: 0.83 | AA123: -7.000000000000001e-004 | AB123: -5.1000000000000004e-003 | AC123: 无权 | AD123: 无权 | AE123: 无权 | AF123: 95.54 | AG123: 0.5 | AH123: AAA | AI123: 3.3099999999999997e-002 | AJ123: =H123+100*O123 -> 131.06799999999998 | AK123: 130.1 | AL123: 11 | AM123: 34.5 | AN123: 19 | AO123: 3.5000000000000003e-002 | AP123: 22 | AQ123: 青农转债!
A124: 42 | B124: 123109 | C124: 昌红转债 | D124: 300151 | E124: 昌红科技 | F124: 机械装备 | G124: 专用设备 | H124: 121.456 | I124: 5.4000000000000003e-003 | J124: -1.38e-002 | K124: 26.63 | L124: -1.37e-002 | M124: 121 | N124: 28.06 | O124: 0.28000000000000003 | P124: 94.9 | Q124: 28天 | R124: 5.55年 | S124: 3.56年 | T124: 4.6 | U124: 5.2 | V124: 9.0000000000000011e-003 | W124: 3.4000000000000002e-002 | X124: 3.3000000000000002e-002 | Y124: 134 | Z124: 13.44 | AA124: -7.000000000000001e-004 | AB124: -7.0999999999999995e-003 | AC124: -4.1399999999999999e-002 | AD124: -4.3299999999999998e-002 | AE124: 83.06 | AF124: 86.92 | AG124: 0.61 | AH124: AA- | AI124: 6.2699999999999992e-002 | AJ124: =H124+100*O124 -> 149.45600000000002 | AK124: 148 | AL124: 174 | AM124: 61.1 | AN124: 200 | AO124: -6.6000000000000003e-002 | AP124: 4 | AQ124: 昌红转债
A125: 101 | B125: 113609 | C125: 永安转债! | D125: 603776 | E125: 永安行 | F125: 城市公用 | G125: 其他 | H125: 121.33 | I125: -5.8999999999999999e-003 | J125: -1.1000000000000001e-002 | K125: 18 | L125: -2.4399999999999998e-002 | M125: 120.5 | N125: 16.48 | O125: 0.111 | P125: 109.22 | Q125: 转股中 | R125: 5.20年 | S125: 3.21年 | T125: 7.34 | U125: 38 | V125: 4.2999999999999997e-002 | W125: 0.17499999999999999 | X125: 0.191 | Y125: 42 | Z125: 1.3 | AA125: -1.2999999999999999e-003 | AB125: -8.1000000000000013e-003 | AC125: -4.5599999999999995e-002 | AD125: -4.7599999999999996e-002 | AE125: 84.78 | AF125: 88.41 | AG125: 0.69 | AH125: AA- | AI125: 6.2699999999999992e-002 | AJ125: =H125+100*O125 -> 132.43000000000001 | AK125: 133.4 | AL125: 28 | AM125: 45 | AN125: 95 | AO125: -1.8000000000000002e-002 | AP125: 26 | AQ125: 永安转债!
A126: 35 | B126: 127033 | C126: 中装转2! | D126: 2822 | E126: 中装建设 | F126: 建筑 | G126: 装饰工程 | H126: 117.99 | I126: -1.e-004 | J126: -1.1200000000000002e-002 | K126: 5.5 | L126: -2.4799999999999999e-002 | M126: 117.1 | N126: 6.28 | O126: 0.34700000000000003 | P126: 87.58 | Q126: 42天 | R126: 5.59年 | S126: 3.60年 | T126: 11.6 | U126: 20 | V126: 1.4999999999999999e-002 | W126: 0.29299999999999998 | X126: 0.25600000000000001 | Y126: 40 | Z126: 1.16 | AA126: -1.4000000000000002e-003 | AB126: -6.7000000000000002e-003 | AC126: -3.4200000000000001e-002 | AD126: -3.6000000000000004e-002 | AE126: 88.95 | AF126: 93.55 | AG126: 0.45 | AH126: AA | AI126: 4.1700000000000001e-002 | AJ126: =H126+100*O126 -> 152.69 | AK126: 148.4 | AL126: 178 | AM126: 54.8 | AN126: 170 | AO126: 3.1e-002 | AP126: 26 | AQ126: 中装转2!
A127: 202 | B127: 128106 | C127: 华统转债 | D127: 2840 | E127: 华统股份 | F127: 农业 | G127: 农产品加 | H127: 113.83 | I127: -1.e-004 | J127: -5.0000000000000001e-004 | K127: 8.59 | L127: -1.1999999999999999e-003 | M127: 112.9 | N127: 9.37 | O127: 0.24199999999999999 | P127: 91.68 | Q127: 转股中 | R127: 4.58年 | S127: 2.58年 | T127: 5.35 | U127: 5.1 | V127: 8.0000000000000002e-003 | W127: 0.13900000000000001 | X127: 0.128 | Y127: 38 | Z127: 2.14 | AA127: -1.8e-003 | AB127: -6.8999999999999999e-003 | AC127: -3.4599999999999999e-002 | AD127: -3.6900000000000002e-002 | AE127: 92.91 | AF127: 94.64 | AG127: 0.48 | AH127: AA | AI127: 4.0099999999999997e-002 | AJ127: =H127+100*O127 -> 138.03 | AK127: 136 | AL127: 46 | AM127: 41.3 | AN127: 68 | AO127: -2.e-002 | AP127: 9 | AQ127: 华统转债
A128: 235 | B128: 127015 | C128: 希望转债!! | D128: 876 | E128: 新 希 望 | F128: 农业 | G128: 畜牧业 | H128: 111.001 | I128: -3.7000000000000002e-003 | J128: 4.5000000000000005e-003 | K128: 12.09 | L128: 1.1699999999999999e-002 | M128: 110 | N128: 19.75 | O128: 0.81299999999999994 | P128: 61.22 | Q128: 转股中 | R128: 4.31年 | S128: 2.32年 | T128: 9.5 | U128: 18 | V128: 1.7000000000000001e-002 | W128: 1.7000000000000001e-002 | X128: 1.1000000000000001e-002 | Y128: 545 | Z128: 1.63 | AA128: -2.0999999999999999e-003 | AB128: -6.4000000000000003e-003 | AC128: -3.1200000000000002e-002 | AD128: -3.32e-002 | AE128: 94.76 | AF128: 95.77 | AG128: 0.07 | AH128: AAA | AI128: 3.3099999999999997e-002 | AJ128: =H128+100*O128 -> 192.30099999999999 | AK128: 160.8 | AL128: 246 | AM128: 65 | AN128: 235 | AO128: 4.0000000000000001e-002 | AP128: 27 | AQ128: 希望转债!!
A129: 18 | B129: 123117 | C129: 健帆转债! | D129: 300529 | E129: 健帆生物 | F129: 医药 | G129: 医疗器械 | H129: 116.73 | I129: 3.7000000000000002e-003 | J129: -4.7999999999999996e-003 | K129: 49.37 | L129: -9.5999999999999992e-003 | M129: 115.1 | N129: 90.57 | O129: 1.1399999999999999 | P129: 54.51 | Q129: 3月20天 | R129: 5.78年 | S129: 3.78年 | T129: 10 | U129: 9 | V129: 8.0000000000000002e-003 | W129: 2.5000000000000001e-002 | X129: 1.3999999999999999e-002 | Y129: 398 | Z129: 12.89 | AA129: -2.5000000000000001e-003 | AB129: -7.0999999999999995e-003 | AC129: -2.9999999999999999e-002 | AD129: -3.1600000000000003e-002 | AE129: 88.28 | AF129: 91.26 | AG129: 0.12 | AH129: AA | AI129: 4.1700000000000001e-002 | AJ129: =H129+100*O129 -> 230.72999999999999 | AK129: 178.9 | AL129: 300 | AM129: 87.7 | AN129: 299 | AO129: -4.4999999999999998e-002 | AP129: 4 | AQ129: 健帆转债!
A130: 270 | B130: 128072 | C130: 翔鹭转债! | D130: 2842 | E130: 翔鹭钨业 | F130: 有色金属 | G130: 小金属 | H130: 115.695 | I130: -8.8999999999999999e-003 | J130: 5.9999999999999995e-004 | K130: 11.88 | L130: -2.2200000000000001e-002 | M130: 114.5 | N130: 15.36 | O130: 0.496 | P130: 77.34 | Q130: 转股中 | R130: 3.94年 | S130: 1.94年 | T130: 3.02 | U130: 9.6 | V130: 2.7000000000000003e-002 | W130: 9.3000000000000013e-002 | X130: 7.2000000000000008e-002 | Y130: 32 | Z130: 3.45 | AA130: -2.7000000000000001e-003 | AB130: -9.1999999999999998e-003 | AC130: -5.4699999999999999e-002 | AD130: -5.7099999999999998e-002 | AE130: 90.82 | AF130: 91.03 | AG130: 0.37 | AH130: AA- | AI130: 6.1100000000000002e-002 | AJ130: =H130+100*O130 -> 165.29499999999999 | AK130: 154 | AL130: 208 | AM130: 63 | AN130: 217 | AO130: 1.2e-002 | AP130: 29 | AQ130: 翔鹭转债!
A131: 43 | B131: 123110 | C131: 九典转债 | D131: 300705 | E131: 九典制药 | F131: 医药 | G131: 化学制药 | H131: 124.488 | I131: -5.5000000000000005e-003 | J131: 1.41e-002 | K131: 27.41 | L131: 1.2199999999999999e-002 | M131: 121.4 | N131: 26.44 | O131: 0.20100000000000001 | P131: 103.67 | Q131: 28天 | R131: 5.55年 | S131: 3.56年 | T131: 2.7 | U131: 19 | V131: 5.5e-002 | W131: 4.2000000000000003e-002 | X131: 4.4000000000000004e-002 | Y131: 64 | Z131: 6.85 | AA131: -4.5999999999999999e-003 | AB131: -1.11e-002 | AC131: -4.6600000000000003e-002 | AD131: -4.87e-002 | AE131: 80.36 | AF131: 82.52 | AG131: 0.7 | AH131: A+ | AI131: 7.3700000000000002e-002 | AJ131: =H131+100*O131 -> 144.58799999999999 | AK131: 145.3 | AL131: 145 | AM131: 62.8 | AN131: 216 | AO131: -2.e-002 | AP131: 7 | AQ131: 九典转债
A132: 153 | B132: 123062 | C132: 三超转债 | D132: 300554 | E132: 三超新材 | F132: 机械装备 | G132: 通用设备 | H132: 122.005 | I132: -9.8999999999999991e-003 | J132: -1.11e-002 | K132: 18.1 | L132: -2.8999999999999998e-002 | M132: 119.2 | N132: 17.13 | O132: 0.155 | P132: 105.66 | Q132: 转股中 | R132: 4.87年 | S132: 2.88年 | T132: 1.95 | U132: 19 | V132: 7.9000000000000001e-002 | W132: 0.115 | X132: 0.121 | Y132: 17 | Z132: 3.23 | AA132: -4.8999999999999998e-003 | AB132: -1.1599999999999999e-002 | AC132: -5.1200000000000002e-002 | AD132: -5.3600000000000002e-002 | AE132: 82.08 | AF132: 81.86 | AG132: 0.72 | AH132: A | AI132: 8.2100000000000006e-002 | AJ132: =H132+100*O132 -> 137.505 | AK132: 138.3 | AL132: 72 | AM132: 56.3 | AN132: 178 | AO132: -2.1000000000000001e-002 | AP132: 27 | AQ132: 三超转债
A133: 84 | B133: 123087 | C133: 明电转债! | D133: 300739 | E133: 明阳电路 | F133: 电子 | G133: 元器件制 | H133: 124.3 | I133: 1.1000000000000001e-003 | J133: 1.9e-003 | K133: 17.22 | L133: 4.6999999999999993e-003 | M133: 121.2 | N133: 16.32 | O133: 0.17800000000000002 | P133: 105.51 | Q133: 转股中 | R133: 5.26年 | S133: 4.26年 | T133: 4.19 | U133: 59 | V133: 0.11199999999999999 | W133: 8.3000000000000004e-002 | X133: 8.6999999999999994e-002 | Y133: 51 | Z133: 3.52 | AA133: -4.8999999999999998e-003 | AB133: -1.1699999999999999e-002 | AC133: -3.44e-002 | AD133: -3.7100000000000001e-002 | AE133: 81.93 | AF133: 88.67 | AG133: 0.66 | AH133: AA- | AI133: 6.2699999999999992e-002 | AJ133: =H133+100*O133 -> 142.09999999999999 | AK133: 143.1 | AL133: 127 | AM133: 54.4 | AN133: 165 | AO133: -5.0999999999999997e-002 | AP133: 19 | AQ133: 明电转债!
A134: 70 | B134: 113619 | C134: 世运转债! | D134: 603920 | E134: 世运电路 | F134: 电子 | G134: 元器件制 | H134: 118.26 | I134: 1.43e-002 | J134: -1.01e-002 | K134: 16.18 | L134: 1.06e-002 | M134: 115.2 | N134: 19.92 | O134: 0.45600000000000002 | P134: 81.22 | Q134: 转股中 | R134: 5.36年 | S134: 3.36年 | T134: 10 | U134: 41 | V134: 3.5000000000000003e-002 | W134: 0.11599999999999999 | X134: 9.4e-002 | Y134: 86 | Z134: 3.4 | AA134: -5.0000000000000001e-003 | AB134: -1.e-002 | AC134: -3.6900000000000002e-002 | AD134: -3.8800000000000001e-002 | AE134: 89.91 | AF134: 92.95 | AG134: 0.4 | AH134: AA | AI134: 4.1700000000000001e-002 | AJ134: =H134+100*O134 -> 163.86000000000001 | AK134: 155.3 | AL134: 217 | AM134: 62.3 | AN134: 213 | AO134: 0.20399999999999999 | AP134: 5 | AQ134: 世运转债!
A135: 356 | B135: 128021 | C135: 兄弟转债!! | D135: 2562 | E135: 兄弟科技 | F135: 医药 | G135: 原料药 | H135: 110.009 | I135: -4.4000000000000003e-003 | J135: 3.7000000000000002e-003 | K135: 3.95 | L135: -1.2500000000000001e-002 | M135: 108.8 | N135: 5.19 | O135: 0.44500000000000001 | P135: 76.11 | Q135: 转股中 | R135: 2.22年 | S135: 0.22年 | T135: 2.65 | U135: 8.1 | V135: 2.7999999999999997e-002 | W135: 6.3e-002 | X135: 4.8000000000000001e-002 | Y135: 42 | Z135: 1.42 | AA135: -5.1000000000000004e-003 | AB135: -1.24e-002 | AC135: -0.217 | AD135: -0.22500000000000001 | AE135: 100.09 | AF135: 100.17 | AG135: 0.06 | AH135: AA | AI135: 3.8699999999999998e-002 | AJ135: =H135+100*O135 -> 154.50900000000001 | AK135: 143.9 | AL135: 133 | AM135: 43.7 | AN135: 89 | AO135: 4.9000000000000002e-002 | AP135: 17 | AQ135: 兄弟转债!!
A136: 216 | B136: 123045 | C136: 雷迪转债 | D136: 300652 | E136: 雷迪克 | F136: 汽车 | G136: 零部件制 | H136: 121.6 | I136: -5.0000000000000001e-003 | J136: -4.5999999999999999e-003 | K136: 19.8 | L136: -1.49e-002 | M136: 118.9 | N136: 19.63 | O136: 0.20600000000000002 | P136: 100.87 | Q136: 转股中 | R136: 4.50年 | S136: 2.50年 | T136: 1.66 | U136: 12 | V136: 5.7999999999999996e-002 | W136: 8.900000000000001e-002 | X136: 8.9999999999999997e-002 | Y136: 19 | Z136: 2.02 | AA136: -5.1000000000000004e-003 | AB136: -1.23e-002 | AC136: -5.7200000000000001e-002 | AD136: -5.9900000000000002e-002 | AE136: 86.61 | AF136: 87.59 | AG136: 0.64 | AH136: A+ | AI136: 7.2099999999999997e-002 | AJ136: =H136+100*O136 -> 142.19999999999999 | AK136: 142.3 | AL136: 114 | AM136: 54.7 | AN136: 169 | AO136: -1.9e-002 | AP136: 36 | AQ136: 雷迪转债
A137: 329 | B137: 123011 | C137: 德尔转债! | D137: 300473 | E137: 德尔股份 | F137: 汽车 | G137: 零部件制 | H137: 117.076 | I137: -8.9999999999999998e-004 | J137: -8.9999999999999998e-004 | K137: 23.27 | L137: -8.5000000000000006e-003 | M137: 115.3 | N137: 31.38 | O137: 0.57899999999999996 | P137: 74.16 | Q137: 转股中 | R137: 2.85年 | S137: 0.85年 | T137: 2.51 | U137: 3.2 | V137: 1.1000000000000001e-002 | W137: 8.0000000000000002e-002 | X137: 5.9000000000000004e-002 | Y137: 31 | Z137: 1.45 | AA137: -5.4000000000000003e-003 | AB137: -1.49e-002 | AC137: -0.128 | AD137: -0.13100000000000001 | AE137: 95.97 | AF137: 97.97 | AG137: 0.21 | AH137: AA- | AI137: 5.9699999999999996e-002 | AJ137: =H137+100*O137 -> 174.976 | AK137: 160 | AL137: 239 | AM137: 62 | AN137: 210 | AO137: -9.3000000000000013e-002 | AP137: 41 | AQ137: 德尔转债!
A138: 4 | B138: 123123 | C138: 江丰转债 | D138: 300666 | E138: 江丰电子 | F138: 电子 | G138: 电子行业 | H138: 125.496 | I138: 1.04e-002 | J138: 3.5999999999999999e-003 | K138: 48.5 | L138: 2.1099999999999997e-002 | M138: 121.5 | N138: 51.93 | O138: 0.34399999999999997 | P138: 93.39 | Q138: 5月11天 | R138: 5.92年 | S138: 3.92年 | T138: 5.17 | U138: 130 | V138: 0.20000000000000001 | W138: 4.7e-002 | X138: 4.4000000000000004e-002 | Y138: 110 | Z138: 9.57 | AA138: -5.6000000000000008e-003 | AB138: -1.1699999999999999e-002 | AC138: -4.4400000000000002e-002 | AD138: -4.6300000000000001e-002 | AE138: 78.32 | AF138: 80.48 | AG138: 0.66 | AH138: A+ | AI138: 7.3700000000000002e-002 | AJ138: =H138+100*O138 -> 159.89599999999999 | AK138: 157.6 | AL138: 229 | AM138: 77.1 | AN138: 275 | AO138: -2.6000000000000002e-002 | AP138: 3 | AQ138: 江丰转债
A139: 52 | B139: 113046 | C139: 金田转债 | D139: 601609 | E139: 金田铜业 | F139: 有色金属 | G139: 铜金属 | H139: 118.53 | I139: -2.52e-002 | J139: 1.6500000000000001e-002 | K139: 9.75 | L139: -1.8100000000000002e-002 | M139: 114.9 | N139: 10.75 | O139: 0.307 | P139: 90.7 | Q139: 17天 | R139: 5.53年 | S139: 3.53年 | T139: 15 | U139: 82 | V139: 4.4999999999999998e-002 | W139: 0.10400000000000001 | X139: 9.4e-002 | Y139: 144 | Z139: 2.09 | AA139: -5.6999999999999993e-003 | AB139: -1.0500000000000001e-002 | AC139: -3.6499999999999998e-002 | AD139: -3.8199999999999998e-002 | AE139: 90.61 | AF139: 94.47 | AG139: 0.48 | AH139: AA+ | AI139: 3.6699999999999997e-002 | AJ139: =H139+100*O139 -> 149.22999999999999 | AK139: 146.4 | AL139: 157 | AM139: 51.9 | AN139: 149 | AO139: 4.2999999999999997e-002 | AP139: 12 | AQ139: 金田转债
A140: 112 | B140: 123075 | C140: 贝斯转债! | D140: 300580 | E140: 贝斯特 | F140: 汽车 | G140: 零部件制 | H140: 119.096 | I140: 1.2199999999999999e-002 | J140: -1.38e-002 | K140: 20.7 | L140: -2.8999999999999998e-003 | M140: 115.5 | N140: 23.74 | O140: 0.36599999999999999 | P140: 87.19 | Q140: 转股中 | R140: 5年52天 | S140: 3年53天 | T140: 6 | U140: 6.8 | V140: 1.e-002 | W140: 0.14499999999999999 | X140: 0.126 | Y140: 41 | Z140: 2.41 | AA140: -6.0999999999999995e-003 | AB140: -1.1399999999999999e-002 | AC140: -4.0999999999999995e-002 | AD140: -4.2999999999999997e-002 | AE140: 85.09 | AF140: 85.07 | AG140: 0.56 | AH140: AA- | AI140: 6.2699999999999992e-002 | AJ140: =H140+100*O140 -> 155.696 | AK140: 151 | AL140: 193 | AM140: 65.9 | AN140: 238 | AO140: -7.4999999999999997e-002 | AP140: 9 | AQ140: 贝斯转债!
A141: 110 | B141: 128136 | C141: 立讯转债! | D141: 2475 | E141: 立讯精密 | F141: 电子 | G141: 元器件制 | H141: 115.52 | I141: -4.7999999999999996e-003 | J141: 7.8000000000000005e-003 | K141: 36.02 | L141: 1.9199999999999998e-002 | M141: 111.9 | N141: 58.18 | O141: 0.86599999999999999 | P141: 61.91 | Q141: 转股中 | R141: 5年53天 | S141: 3年54天 | T141: 30 | U141: 103 | V141: 2.8999999999999998e-002 | W141: 1.2e-002 | X141: 6.9999999999999993e-003 | Y141: 2534. | Z141: 8.35 | AA141: -6.1999999999999998e-003 | AB141: -1.04e-002 | AC141: -3.5799999999999998e-002 | AD141: -3.7200000000000004e-002 | AE141: 90.91 | AF141: 93.17 | AG141: 0.15 | AH141: AA+ | AI141: 3.6699999999999997e-002 | AJ141: =H141+100*O141 -> 202.12 | AK141: 169.1 | AL141: 278 | AM141: 76 | AN141: 274 | AO141: -1.8000000000000002e-002 | AP141: 13 | AQ141: 立讯转债!
A142: 5 | B142: 127042 | C142: 嘉美转债 | D142: 2969 | E142: 嘉美包装 | F142: 造纸包装 | G142: 包装材料 | H142: 121.4 | I142: -1.38e-002 | J142: -5.9999999999999995e-004 | K142: 5.49 | L142: -2.1400000000000002e-002 | M142: 117.1 | N142: 4.87 | O142: 7.6999999999999999e-002 | P142: 112.73 | Q142: 5月7天 | R142: 5.91年 | S142: 3.91年 | T142: 7.5 | U142: 247 | V142: 0.27000000000000002 | W142: 0.14199999999999999 | X142: 0.16 | Y142: 53 | Z142: 2.43 | AA142: -6.1999999999999998e-003 | AB142: -1.1200000000000002e-002 | AC142: -3.8399999999999997e-002 | AD142: -4.0000000000000001e-002 | AE142: 87.82 | AF142: 92.36 | AG142: 0.68 | AH142: AA | AI142: 4.1700000000000001e-002 | AJ142: =H142+100*O142 -> 129.09999999999999 | AK142: 130.1 | AL142: 12 | AM142: 37.7 | AN142: 36 | AO142: 4.2999999999999997e-002 | AP142: 3 | AQ142: 嘉美转债
A143: 58 | B143: 123101 | C143: 拓斯转债! | D143: 300607 | E143: 拓斯达 | F143: 机械装备 | G143: 机器人及 | H143: 119.12 | I143: -1.5e-003 | J143: -1.0700000000000001e-002 | K143: 19.64 | L143: -3.7699999999999997e-002 | M143: 115.1 | N143: 26.18 | O143: 0.58799999999999997 | P143: 75.02 | Q143: 6.0天 | R143: 5.49年 | S143: 3.50年 | T143: 6.7 | U143: 19 | V143: 2.4e-002 | W143: 8.0000000000000002e-002 | X143: 5.9999999999999998e-002 | Y143: 84 | Z143: 2.39 | AA143: -6.3e-003 | AB143: -1.1200000000000002e-002 | AC143: -3.7699999999999997e-002 | AD143: -3.95e-002 | AE143: 89.32 | AF143: 92.34 | AG143: 0.32 | AH143: AA | AI143: 4.1700000000000001e-002 | AJ143: =H143+100*O143 -> 177.92000000000002 | AK143: 163.2 | AL143: 260 | AM143: 70.9 | AN143: 257 | AO143: -8.3000000000000004e-002 | AP143: 5 | AQ143: 拓斯转债!
A144: 34 | B144: 123113 | C144: 仙乐转债 | D144: 300791 | E144: 仙乐健康 | F144: 食品饮料 | G144: 食品饮料 | H144: 122.695 | I144: -1.8e-003 | J144: -4.6999999999999993e-003 | K144: 46.5 | L144: -1.2699999999999999e-002 | M144: 118.5 | N144: 56.92 | O144: 0.502 | P144: 81.69 | Q144: 45天 | R144: 5.60年 | S144: 3.61年 | T144: 10.3 | U144: 3.3 | V144: 3.0000000000000001e-003 | W144: 0.122 | X144: 0.10000000000000001 | Y144: 84 | Z144: 3.7 | AA144: -6.3e-003 | AB144: -1.2e-002 | AC144: -4.3700000000000003e-002 | AD144: -4.5499999999999999e-002 | AE144: 82.75 | AF144: 84.86 | AG144: 0.51 | AH144: AA- | AI144: 6.2699999999999992e-002 | AJ144: =H144+100*O144 -> 172.89499999999998 | AK144: 163.7 | AL144: 261 | AM144: 78.8 | AN144: 279 | AO144: -9.0999999999999998e-002 | AP144: 3 | AQ144: 仙乐转债
A145: 129 | B145: 128133 | C145: 奇正转债! | D145: 2287 | E145: 奇正藏药 | F145: 医药 | G145: 中药 | H145: 121.08 | I145: -1.6200000000000003e-002 | J145: 3.0000000000000001e-003 | K145: 31.16 | L145: -2.2000000000000002e-002 | M145: 117.3 | N145: 29.78 | O145: 0.157 | P145: 104.63 | Q145: 转股中 | R145: 5年11天 | S145: 3年12天 | T145: 8 | U145: 52 | V145: 5.4000000000000006e-002 | W145: 4.8000000000000001e-002 | X145: 5.0999999999999997e-002 | Y145: 165 | Z145: 5.01 | AA145: -6.4000000000000003e-003 | AB145: -1.24e-002 | AC145: -4.7500000000000001e-002 | AD145: -4.9599999999999998e-002 | AE145: 91.22 | AF145: 95.93 | AG145: 0.6 | AH145: AA | AI145: 4.1700000000000001e-002 | AJ145: =H145+100*O145 -> 136.78 | AK145: 137.5 | AL145: 62 | AM145: 41.6 | AN145: 70 | AO145: 7.2000000000000008e-002 | AP145: 18 | AQ145: 奇正转债!
A146: 268 | B146: 128073 | C146: 哈尔转债! | D146: 2615 | E146: 哈尔斯 | F146: 其他 | G146: 家居用品 | H146: 116.7 | I146: -1.01e-002 | J146: 4.8999999999999998e-003 | K146: 5.41 | L146: -1.1000000000000001e-002 | M146: 114.5 | N146: 5.71 | O146: 0.23199999999999998 | P146: 94.75 | Q146: 转股中 | R146: 2.95年 | S146: 0.95年 | T146: 2.99 | U146: 10 | V146: 2.8999999999999998e-002 | W146: 0.13400000000000001 | X146: 0.127 | Y146: 22 | Z146: 2.73 | AA146: -6.5000000000000006e-003 | AB146: -1.52e-002 | AC146: -0.11699999999999999 | AD146: -0.11900000000000001 | AE146: 94.92 | AF146: 96.69 | AG146: 0.47 | AH146: AA- | AI146: 5.9699999999999996e-002 | AJ146: =H146+100*O146 -> 139.90000000000001 | AK146: 138.7 | AL146: 75 | AM146: 42 | AN146: 74 | AO146: 1.7000000000000001e-002 | AP146: 39 | AQ146: 哈尔转债!
A147: 341 | B147: 113505 | C147: 杭电转债! | D147: 603618 | E147: 杭电股份 | F147: 能源电力 | G147: 电力设备 | H147: 113.35 | I147: -1.2800000000000001e-002 | J147: 1.04e-002 | K147: 6.72 | L147: -5.8999999999999999e-003 | M147: 111.3 | N147: 7.08 | O147: 0.19399999999999998 | P147: 94.92 | Q147: 转股中 | R147: 2.48年 | S147: 0.49年 | T147: 7.5 | U147: 60 | V147: 7.0000000000000007e-002 | W147: 0.161 | X147: 0.153 | Y147: 46 | Z147: 1.72 | AA147: -7.4000000000000003e-003 | AB147: -1.5700000000000002e-002 | AC147: -0.16399999999999998 | AD147: -0.16899999999999998 | AE147: 99.32 | AF147: 101.45 | AG147: 0.4 | AH147: AA | AI147: 3.8699999999999998e-002 | AJ147: =H147+100*O147 -> 132.75 | AK147: 131.8 | AL147: 19 | AM147: 30.3 | AN147: 8 | AO147: 5.4000000000000006e-002 | AP147: 46 | AQ147: 杭电转债!
A148: 72 | B148: 113618 | C148: 美诺转债! | D148: 603538 | E148: 美诺华 | F148: 医药 | G148: 原料药 | H148: 120.03 | I148: 3.7000000000000002e-003 | J148: -9.0000000000000011e-003 | K148: 31.85 | L148: -9.5999999999999992e-003 | M148: 115.3 | N148: 37.47 | O148: 0.41200000000000003 | P148: 85 | Q148: 转股中 | R148: 5.34年 | S148: 3.35年 | T148: 5.2 | U148: 4.2 | V148: 6.9999999999999993e-003 | W148: 0.109 | X148: 9.3000000000000013e-002 | Y148: 48 | Z148: 2.87 | AA148: -7.6e-003 | AB148: -1.2699999999999999e-002 | AC148: -4.0899999999999999e-002 | AD148: -4.2800000000000005e-002 | AE148: 84.04 | AF148: 83.89 | AG148: 0.55 | AH148: AA- | AI148: 6.2699999999999992e-002 | AJ148: =H148+100*O148 -> 161.23000000000002 | AK148: 155.1 | AL148: 215 | AM148: 71 | AN148: 258 | AO148: -8.0000000000000002e-003 | AP148: 5 | AQ148: 美诺转债!
A149: 47 | B149: 113622 | C149: 杭叉转债! | D149: 603298 | E149: 杭叉集团 | F149: 机械装备 | G149: 通用设备 | H149: 117.38 | I149: -8.8999999999999999e-003 | J149: 4.0000000000000001e-003 | K149: 18.03 | L149: -1.37e-002 | M149: 112.5 | N149: 23.08 | O149: 0.503 | P149: 78.12 | Q149: 28天 | R149: 5.53年 | S149: 3.54年 | T149: 11.5 | U149: 5.3 | V149: 4.0000000000000001e-003 | W149: 7.400000000000001e-002 | X149: 5.7999999999999996e-002 | Y149: 156 | Z149: 3.09 | AA149: -7.8000000000000005e-003 | AB149: -1.18e-002 | AC149: -3.4799999999999998e-002 | AD149: -3.6299999999999999e-002 | AE149: 90.2 | AF149: 92.43 | AG149: 0.36 | AH149: AA+ | AI149: 3.6699999999999997e-002 | AJ149: =H149+100*O149 -> 167.68000000000001 | AK149: 156.6 | AL149: 225 | AM149: 64.2 | AN149: 225 | AO149: -4.0999999999999995e-002 | AP149: 5 | AQ149: 杭叉转债!
A150: 238 | B150: 128091 | C150: 新天转债 | D150: 2873 | E150: 新天药业 | F150: 医药 | G150: 中药 | H150: 123.456 | I150: -6.0000000000000001e-003 | J150: -2.8000000000000004e-003 | K150: 17.44 | L150: -1.3000000000000001e-002 | M150: 119.4 | N150: 16.27 | O150: 0.152 | P150: 107.19 | Q150: 转股中 | R150: 4.30年 | S150: 2.30年 | T150: 1.76 | U150: 11 | V150: 4.8000000000000001e-002 | W150: 8.5999999999999993e-002 | X150: 9.1999999999999998e-002 | Y150: 20 | Z150: 2.48 | AA150: -7.9000000000000008e-003 | AB150: -1.5600000000000001e-002 | AC150: -6.6199999999999995e-002 | AD150: -6.93e-002 | AE150: 88.2 | AF150: 89.25 | AG150: 0.68 | AH150: A+ | AI150: 7.2099999999999997e-002 | AJ150: =H150+100*O150 -> 138.65600000000001 | AK150: 139.7 | AL150: 88 | AM150: 50.5 | AN150: 141 | AO150: 2.6000000000000002e-002 | AP150: 19 | AQ150: 新天转债
A151: 60 | B151: 113045 | C151: 环旭转债! | D151: 601231 | E151: 环旭电子 | F151: 电子 | G151: 电子产品 | H151: 116.89 | I151: 4.5999999999999999e-003 | J151: -9.0000000000000011e-003 | K151: 14.92 | L151: -1.4499999999999999e-002 | M151: 112 | N151: 19.75 | O151: 0.54700000000000004 | P151: 75.54 | Q151: 3月1天 | R151: 5.48年 | S151: 2.48年 | T151: 34.5 | U151: 4.6 | V151: 1.e-003 | W151: 0.105 | X151: 7.9000000000000001e-002 | Y151: 330 | Z151: 2.85 | AA151: -7.9000000000000008e-003 | AB151: -1.18e-002 | AC151: -4.7100000000000003e-002 | AD151: -4.9100000000000005e-002 | AE151: 93.55 | AF151: 92.16 | AG151: 0.3 | AH151: AA+ | AI151: 3.6699999999999997e-002 | AJ151: =H151+100*O151 -> 171.59 | AK151: 158.2 | AL151: 231 | AM151: 64.7 | AN151: 233 | AO151: 4.0999999999999995e-002 | AP151: 5 | AQ151: 环旭转债!
A152: 39 | B152: 123112 | C152: 万讯转债 | D152: 300112 | E152: 万讯自控 | F152: 机械装备 | G152: 专用设备 | H152: 129.98 | I152: -2.4300000000000002e-002 | J152: 5.3e-003 | K152: 10.75 | L152: -2.63e-002 | M152: 124.4 | N152: 8.93 | O152: 8.0000000000000002e-002 | P152: 120.38 | Q152: 34天 | R152: 5.57年 | S152: 3.58年 | T152: 2.46 | U152: 40 | V152: 0.125 | W152: 8.0000000000000002e-002 | X152: 9.6000000000000002e-002 | Y152: 31 | Z152: 2.95 | AA152: -8.0000000000000002e-003 | AB152: -1.52e-002 | AC152: -5.7599999999999998e-002 | AD152: -5.96e-002 | AE152: 83.3 | AF152: 89.29 | AG152: 0.72 | AH152: AA- | AI152: 6.2699999999999992e-002 | AJ152: =H152+100*O152 -> 137.97999999999999 | AK152: 139.6 | AL152: 87 | AM152: 50.3 | AN152: 138 | AO152: -6.9000000000000006e-002 | AP152: 14 | AQ152: 万讯转债
A153: 81 | B153: 128142 | C153: 新乳转债! | D153: 2946 | E153: 新乳业 | F153: 食品饮料 | G153: 乳制品 | H153: 120.227 | I153: 5.1999999999999998e-003 | J153: -4.1999999999999997e-003 | K153: 14.9 | L153: 2.7000000000000001e-003 | M153: 115.1 | N153: 18.47 | O153: 0.48999999999999999 | P153: 80.67 | Q153: 转股中 | R153: 5.27年 | S153: 3.27年 | T153: 7.18 | U153: 5.9 | V153: 6.9999999999999993e-003 | W153: 5.5999999999999994e-002 | X153: 4.4999999999999998e-002 | Y153: 129 | Z153: 5.07 | AA153: -8.3999999999999995e-003 | AB153: -1.34e-002 | AC153: -4.2699999999999995e-002 | AD153: -4.4600000000000001e-002 | AE153: 90.15 | AF153: 93.2 | AG153: 0.38 | AH153: AA | AI153: 4.1700000000000001e-002 | AJ153: =H153+100*O153 -> 169.227 | AK153: 159.8 | AL153: 237 | AM153: 66.6 | AN153: 242 | AO153: 4.4999999999999998e-002 | AP153: 4 | AQ153: 新乳转债!
A154: 54 | B154: 123105 | C154: 拓尔转债! | D154: 300229 | E154: 拓尔思 | F154: 计算机及 | G154: 软件开发 | H154: 126.656 | I154: -5.4000000000000003e-003 | J154: -1.09e-002 | K154: 10.66 | L154: -2.3799999999999998e-002 | M154: 121 | N154: 9.96 | O154: 0.183 | P154: 107.03 | Q154: 15天 | R154: 5.52年 | S154: 3.52年 | T154: 8 | U154: 12 | V154: 1.2e-002 | W154: 0.105 | X154: 0.11199999999999999 | Y154: 76 | Z154: 3.5 | AA154: -8.3999999999999995e-003 | AB154: -1.4800000000000001e-002 | AC154: -5.2699999999999997e-002 | AD154: -5.4600000000000003e-002 | AE154: 83.24 | AF154: 87.11 | AG154: 0.68 | AH154: AA- | AI154: 6.2699999999999992e-002 | AJ154: =H154+100*O154 -> 144.95600000000002 | AK154: 146.3 | AL154: 156 | AM154: 59.2 | AN154: 190 | AO154: 2.e-002 | AP154: 8 | AQ154: 拓尔转债!
A155: 263 | B155: 128076 | C155: 金轮转债! | D155: 2722 | E155: 金轮股份 | F155: 机械装备 | G155: 专用设备 | H155: 118.876 | I155: -8.0000000000000004e-004 | J155: -6.8000000000000005e-003 | K155: 13.99 | L155: -1.34e-002 | M155: 114.9 | N155: 14.66 | O155: 0.24600000000000002 | P155: 95.43 | Q155: 转股中 | R155: 4年33天 | S155: 2年34天 | T155: 2.14 | U155: 6 | V155: 2.3e-002 | W155: 8.6999999999999994e-002 | X155: 8.3000000000000004e-002 | Y155: 25 | Z155: 1.28 | AA155: -8.5000000000000006e-003 | AB155: -1.49e-002 | AC155: -6.0499999999999998e-002 | AD155: -6.3099999999999989e-002 | AE155: 90.58 | AF155: 90.65 | AG155: 0.57 | AH155: AA- | AI155: 6.1100000000000002e-002 | AJ155: =H155+100*O155 -> 143.476 | AK155: 142.3 | AL155: 112 | AM155: 51.7 | AN155: 148 | AO155: 1.3999999999999999e-002 | AP155: 39 | AQ155: 金轮转债!
A156: 249 | B156: 110062 | C156: 烽火转债! | D156: 600498 | E156: 烽火通信 | F156: 通信互联 | G156: 通信设备 | H156: 114.8 | I156: 1.9e-003 | J156: -4.0000000000000001e-003 | K156: 18.6 | L156: -6.4000000000000003e-003 | M156: 110.8 | N156: 22.85 | O156: 0.40999999999999998 | P156: 81.4 | Q156: 转股中 | R156: 4.22年 | S156: 2.23年 | T156: 30.9 | U156: 7.9 | V156: 2.e-003 | W156: 0.14699999999999999 | X156: 0.11900000000000001 | Y156: 210 | Z156: 1.94 | AA156: -8.5000000000000006e-003 | AB156: -1.32e-002 | AC156: -4.3499999999999997e-002 | AD156: -4.5999999999999999e-002 | AE156: 95.63 | AF156: 96.84 | AG156: 0.32 | AH156: AAA | AI156: 3.3099999999999997e-002 | AJ156: =H156+100*O156 -> 155.80000000000001 | AK156: 148.2 | AL156: 175 | AM156: 51.4 | AN156: 146 | AO156: -8.0000000000000002e-003 | AP156: 19 | AQ156: 烽火转债!
A157: 165 | B157: 128121 | C157: 宏川转债! | D157: 2930 | E157: 宏川智慧 | F157: 交通运输 | G157: 物流业 | H157: 117.569 | I157: -6.6e-003 | J157: 3.4000000000000002e-003 | K157: 17.57 | L157: -5.6999999999999993e-003 | M157: 112.9 | N157: 19.92 | O157: 0.33299999999999996 | P157: 88.2 | Q157: 转股中 | R157: 4.85年 | S157: 2.85年 | T157: 6.7 | U157: 12 | V157: 1.6e-002 | W157: 8.5999999999999993e-002 | X157: 7.5999999999999998e-002 | Y157: 78 | Z157: 3.85 | AA157: -8.5000000000000006e-003 | AB157: -1.32e-002 | AC157: -4.2000000000000003e-002 | AD157: -4.4000000000000004e-002 | AE157: 86.6 | AF157: 85.17 | AG157: 0.56 | AH157: AA- | AI157: 6.1100000000000002e-002 | AJ157: =H157+100*O157 -> 150.869 | AK157: 146.9 | AL157: 163 | AM157: 60.3 | AN157: 195 | AO157: 2.6000000000000002e-002 | AP157: 5 | AQ157: 宏川转债!
A158: 93 | B158: 127026 | C158: 超声转债! | D158: 823 | E158: 超声电子 | F158: 电子 | G158: 元器件制 | H158: 118.149 | I158: 5.5000000000000005e-003 | J158: -1.9e-003 | K158: 11.91 | L158: 6.8000000000000005e-003 | M158: 113.1 | N158: 12.72 | O158: 0.26200000000000001 | P158: 93.63 | Q158: 转股中 | R158: 5.24年 | S158: 3.24年 | T158: 7 | U158: 7.4 | V158: 9.0000000000000011e-003 | W158: 0.109 | X158: 0.10199999999999999 | Y158: 64 | Z158: 1.66 | AA158: -8.5000000000000006e-003 | AB158: -1.29e-002 | AC158: -3.8100000000000002e-002 | AD158: -4.0000000000000001e-002 | AE158: 90.25 | AF158: 91.69 | AG158: 0.54 | AH158: AA | AI158: 4.1700000000000001e-002 | AJ158: =H158+100*O158 -> 144.34899999999999 | AK158: 142.7 | AL158: 121 | AM158: 51 | AN158: 145 | AO158: 2.5000000000000001e-002 | AP158: 13 | AQ158: 超声转债!
A159: 158 | B159: 123061 | C159: 航新转债! | D159: 300424 | E159: 航新科技 | F159: 航空航天 | G159: 航空航天 | H159: 129.88 | I159: -1.6500000000000001e-002 | J159: -2.7000000000000001e-003 | K159: 17.4 | L159: -2.6800000000000001e-002 | M159: 124.3 | N159: 14.85 | O159: 0.10800000000000001 | P159: 117.17 | Q159: 转股中 | R159: 4.86年 | S159: 2.86年 | T159: 2.5 | U159: 101 | V159: 0.31 | W159: 5.9999999999999998e-002 | X159: 7.0000000000000007e-002 | Y159: 42 | Z159: 6.19 | AA159: -9.1999999999999998e-003 | AB159: -1.7399999999999999e-002 | AC159: -7.0699999999999999e-002 | AD159: -7.3099999999999998e-002 | AE159: 84.59 | AF159: 89.3 | AG159: 0.72 | AH159: A+ | AI159: 7.2099999999999997e-002 | AJ159: =H159+100*O159 -> 140.68000000000001 | AK159: 142.6 | AL159: 120 | AM159: 53.3 | AN159: 159 | AO159: -3.7000000000000005e-002 | AP159: 20 | AQ159: 航新转债!
A160: 24 | B160: 123116 | C160: 万兴转债 | D160: 300624 | E160: 万兴科技 | F160: 计算机及 | G160: 软件开发 | H160: 127.9 | I160: -7.4000000000000003e-003 | J160: -3.1e-002 | K160: 48.27 | L160: -5.7000000000000002e-002 | M160: 121.4 | N160: 49.78 | O160: 0.31900000000000001 | P160: 96.97 | Q160: 3月7天 | R160: 5.74年 | S160: 3.75年 | T160: 3.79 | U160: 252 | V160: 0.51600000000000001 | W160: 5.9999999999999998e-002 | X160: 5.9000000000000004e-002 | Y160: 63 | Z160: 7.45 | AA160: -9.1999999999999998e-003 | AB160: -1.55e-002 | AC160: -5.1200000000000002e-002 | AD160: -5.3099999999999994e-002 | AE160: 79.22 | AF160: 81.41 | AG160: 0.67 | AH160: A+ | AI160: 7.3700000000000002e-002 | AJ160: =H160+100*O160 -> 159.80000000000001 | AK160: 158.8 | AL160: 235 | AM160: 77.4 | AN160: 276 | AO160: 5.2999999999999999e-002 | AP160: 5 | AQ160: 万兴转债
A161: 308 | B161: 110051 | C161: 中天转债! | D161: 600522 | E161: 中天科技 | F161: 通信互联 | G161: 通信设备 | H161: 117.03 | I161: -8.6999999999999994e-003 | J161: -6.4000000000000003e-003 | K161: 8.62 | L161: -4.7500000000000001e-002 | M161: 113.3 | N161: 9.99 | O161: 0.35600000000000004 | P161: 86.29 | Q161: 转股中 | R161: 3.47年 | S161: 1.47年 | T161: 39.6 | U161: 60 | V161: 1.3000000000000001e-002 | W161: 0.14999999999999999 | X161: 0.129 | Y161: 264 | Z161: 1.16 | AA161: -9.4999999999999998e-003 | AB161: -1.6299999999999999e-002 | AC161: -7.6799999999999993e-002 | AD161: -7.980000000000001e-002 | AE161: 97.21 | AF161: 100.76 | AG161: 0.32 | AH161: AA+ | AI161: 3.5099999999999999e-002 | AJ161: =H161+100*O161 -> 152.63 | AK161: 147.8 | AL161: 171 | AM161: 47 | AN161: 116 | AO161: 2.1000000000000001e-002 | AP161: 27 | AQ161: 中天转债!
A162: 195 | B162: 128107 | C162: 交科转债 | D162: 2061 | E162: 浙江交科 | F162: 建筑 | G162: 建筑工程 | H162: 120 | I162: -1.7600000000000001e-002 | J162: 9.1000000000000004e-003 | K162: 5.65 | L162: -1.3999999999999999e-002 | M162: 114.9 | N162: 5.24 | O162: 0.113 | P162: 107.82 | Q162: 转股中 | R162: 4.61年 | S162: 2.61年 | T162: 25 | U162: 70 | V162: 2.3e-002 | W162: 0.32200000000000001 | X162: 0.34700000000000003 | Y162: 78 | Z162: 0.88 | AA162: -9.4999999999999998e-003 | AB162: -1.52e-002 | AC162: -5.2499999999999998e-002 | AD162: -5.4699999999999999e-002 | AE162: 94.03 | AF162: 98.31 | AG162: 0.61 | AH162: AA+ | AI162: 3.5099999999999999e-002 | AJ162: =H162+100*O162 -> 131.30000000000001 | AK162: 132.2 | AL162: 24 | AM162: 33.9 | AN162: 18 | AO162: 6.6000000000000003e-002 | AP162: 20 | AQ162: 交科转债
A163: 301 | B163: 110053 | C163: 苏银转债! | D163: 600919 | E163: 江苏银行 | F163: 金融 | G163: 银行行业 | H163: 122.33 | I163: 1.09e-002 | J163: -1.e-004 | K163: 6.54 | L163: 2.1899999999999999e-002 | M163: 118.3 | N163: 6.37 | O163: 0.192 | P163: 102.67 | Q163: 转股中 | R163: 3.50年 | S163: 无权 | T163: 200 | U163: 511 | V163: 2.1000000000000001e-002 | W163: 0.20699999999999999 | X163: 0.21299999999999999 | Y163: 966 | Z163: 0.69 | AA163: -9.7999999999999997e-003 | AB163: -1.8799999999999997e-002 | AC163: 无权 | AD163: 无权 | AE163: 无权 | AF163: 105.91 | AG163: 0.5 | AH163: AAA | AI163: 3.3099999999999997e-002 | AJ163: =H163+100*O163 -> 141.53 | AK163: 142 | AL163: 109 | AM163: 36.1 | AN163: 28 | AO163: -9.0000000000000011e-003 | AP163: 37 | AQ163: 苏银转债!
A164: 168 | B164: 128119 | C164: 龙大转债! | D164: 2726 | E164: 龙大肉食 | F164: 食品饮料 | G164: 肉制品 | H164: 126.154 | I164: -2.5000000000000001e-003 | J164: 8.0000000000000002e-003 | K164: 10.59 | L164: 8.6e-003 | M164: 119.9 | N164: 9.29 | O164: 0.107 | P164: 113.99 | Q164: 转股中 | R164: 4.84年 | S164: 2.84年 | T164: 9.46 | U164: 12 | V164: 1.e-002 | W164: 8.3000000000000004e-002 | X164: 9.4e-002 | Y164: 114 | Z164: 3.11 | AA164: -1.06e-002 | AB164: -1.7600000000000001e-002 | AC164: -6.4500000000000002e-002 | AD164: -6.6500000000000004e-002 | AE164: 91.97 | AF164: 99.48 | AG164: 0.65 | AH164: AA | AI164: 4.0099999999999997e-002 | AJ164: =H164+100*O164 -> 136.85399999999998 | AK164: 138.3 | AL164: 71 | AM164: 38.8 | AN164: 45 | AO164: 8.199999999999999e-002 | AP164: 9 | AQ164: 龙大转债!
A165: 276 | B165: 123028 | C165: 清水转债! | D165: 300437 | E165: 清水源 | F165: 城市公用 | G165: 三废处理 | H165: 126.1 | I165: -3.2000000000000002e-003 | J165: 0.10199999999999999 | K165: 13.98 | L165: 0.14099999999999999 | M165: 121 | N165: 11.84 | O165: 6.8000000000000005e-002 | P165: 118.07 | Q165: 转股中 | R165: 3.77年 | S165: 1.77年 | T165: 4.55 | U165: 3100. | V165: 5.4100000000000001 | W165: 0.14699999999999999 | X165: 0.17399999999999999 | Y165: 31 | Z165: 2.97 | AA165: -1.11e-002 | AB165: -2.0499999999999997e-002 | AC165: -9.5899999999999999e-002 | AD165: -9.9199999999999997e-002 | AE165: 90.92 | AF165: 93.69 | AG165: 0.7 | AH165: A+ | AI165: 7.2099999999999997e-002 | AJ165: =H165+100*O165 -> 132.90000000000001 | AK165: 134.1 | AL165: 30 | AM165: 40.4 | AN165: 57 | AO165: 0.42299999999999999 | AP165: 52 | AQ165: 清水转债!
A166: 221 | B166: 113570 | C166: 百达转债! | D166: 603331 | E166: 百达精工 | F166: 机械装备 | G166: 机械装备 | H166: 120.93 | I166: -9.8999999999999991e-003 | J166: 8.6999999999999994e-003 | K166: 12.46 | L166: -1.6000000000000001e-003 | M166: 114.9 | N166: 11.34 | O166: 0.10099999999999999 | P166: 109.88 | Q166: 转股中 | R166: 4.50年 | S166: 2.50年 | T166: 2.8 | U166: 8.7 | V166: 2.5000000000000001e-002 | W166: 0.126 | X166: 0.13900000000000001 | Y166: 22 | Z166: 2.67 | AA166: -1.15e-002 | AB166: -1.7299999999999999e-002 | AC166: -5.7500000000000002e-002 | AD166: -5.9800000000000006e-002 | AE166: 86.04 | AF166: 84.57 | AG166: 0.73 | AH166: A+ | AI166: 7.2099999999999997e-002 | AJ166: =H166+100*O166 -> 131.03 | AK166: 132 | AL166: 21 | AM166: 45.9 | AN166: 103 | AO166: 1.7000000000000001e-002 | AP166: 34 | AQ166: 百达转债!
A167: 91 | B167: 113043 | C167: 财通转债! | D167: 601108 | E167: 财通证券 | F167: 金融 | G167: 证券行业 | H167: 117.21 | I167: -8.0000000000000002e-003 | J167: 5.8999999999999999e-003 | K167: 11.74 | L167: -4.1999999999999997e-003 | M167: 110.2 | N167: 13.13 | O167: 0.311 | P167: 89.41 | Q167: 转股中 | R167: 5.25年 | S167: 无权 | T167: 38 | U167: 201 | V167: 4.4000000000000004e-002 | W167: 8.9999999999999997e-002 | X167: 8.1000000000000003e-002 | Y167: 421 | Z167: 1.85 | AA167: -1.18e-002 | AB167: -1.54e-002 | AC167: 无权 | AD167: 无权 | AE167: 无权 | AF167: 92.38 | AG167: 0.48 | AH167: AAA | AI167: 3.4700000000000002e-002 | AJ167: =H167+100*O167 -> 148.31 | AK167: 145 | AL167: 142 | AM167: 52.6 | AN167: 153 | AO167: 9.1999999999999998e-002 | AP167: 11 | AQ167: 财通转债!
A168: 354 | B168: 128023 | C168: 亚太转债! | D168: 2284 | E168: 亚太股份 | F168: 汽车 | G168: 零部件制 | H168: 114.25 | I168: -6.5000000000000006e-003 | J168: 4.0999999999999995e-003 | K168: 8.22 | L168: -1.32e-002 | M168: 111.3 | N168: 10.34 | O168: 0.43700000000000006 | P168: 79.5 | Q168: 转股中 | R168: 2.23年 | S168: 0.23年 | T168: 9.99 | U168: 17 | V168: 1.4999999999999999e-002 | W168: 0.16500000000000001 | X168: 0.13100000000000001 | Y168: 61 | Z168: 2.42 | AA168: -1.1899999999999999e-002 | AB168: -2.1000000000000001e-002 | AC168: -0.29299999999999998 | AD168: -0.30099999999999999 | AE168: 100.28 | AF168: 102.43 | AG168: 0.18 | AH168: AA | AI168: 3.8699999999999998e-002 | AJ168: =H168+100*O168 -> 157.94999999999999 | AK168: 149 | AL168: 181 | AM168: 46.6 | AN168: 107 | AO168: -2.7000000000000003e-002 | AP168: 65 | AQ168: 亚太转债!
A169: 20 | B169: 113050 | C169: 南银转债 | D169: 601009 | E169: 南京银行 | F169: 金融 | G169: 银行行业 | H169: 119.19 | I169: 6.1999999999999998e-003 | J169: 3.0999999999999999e-003 | K169: 9.76 | L169: 1.67e-002 | M169: 111.2 | N169: 10.1 | O169: 0.23300000000000001 | P169: 96.63 | Q169: 3月12天 | R169: 5.76年 | S169: 无权 | T169: 200 | U169: 246 | V169: 1.e-002 | W169: 0.20499999999999999 | X169: 0.19800000000000001 | Y169: 977 | Z169: 0.96 | AA169: -1.21e-002 | AB169: -1.5600000000000001e-002 | AC169: 无权 | AD169: 无权 | AE169: 无权 | AF169: 91.62 | AG169: 0.56 | AH169: AAA | AI169: 3.4700000000000002e-002 | AJ169: =H169+100*O169 -> 142.49000000000001 | AK169: 141.7 | AL169: 108 | AM169: 50.1 | AN169: 135 | AO169: 4.2999999999999997e-002 | AP169: 5 | AQ169: 南银转债
A170: 220 | B170: 110067 | C170: 华安转债! | D170: 600909 | E170: 华安证券 | F170: 金融 | G170: 证券行业 | H170: 116.5 | I170: 2.e-003 | J170: -2.8000000000000004e-003 | K170: 5.77 | L170: -1.7000000000000001e-003 | M170: 110.3 | N170: 6.22 | O170: 0.25600000000000001 | P170: 92.77 | Q170: 转股中 | R170: 4.50年 | S170: 无权 | T170: 28 | U170: 128 | V170: 3.9e-002 | W170: 0.10300000000000001 | X170: 9.6000000000000002e-002 | Y170: 271 | Z170: 1.49 | AA170: -1.2199999999999999e-002 | AB170: -1.6399999999999998e-002 | AC170: 无权 | AD170: 无权 | AE170: 无权 | AF170: 95.45 | AG170: 0.47 | AH170: AAA | AI170: 3.3099999999999997e-002 | AJ170: =H170+100*O170 -> 142.09999999999999 | AK170: 140.2 | AL170: 94 | AM170: 44.8 | AN170: 94 | AO170: 5.9999999999999998e-002 | AP170: 28 | AQ170: 华安转债!
A171: 163 | B171: 113593 | C171: 沪工转债! | D171: 603131 | E171: 上海沪工 | F171: 机械装备 | G171: 通用设备 | H171: 128.73 | I171: -1.8799999999999997e-002 | J171: -3.5999999999999999e-003 | K171: 23.13 | L171: -3.2199999999999999e-002 | M171: 121.2 | N171: 21.12 | O171: 0.17499999999999999 | P171: 109.52 | Q171: 转股中 | R171: 4.85年 | S171: 2.86年 | T171: 4 | U171: 43 | V171: 8.199999999999999e-002 | W171: 5.4000000000000006e-002 | X171: 5.9999999999999998e-002 | Y171: 74 | Z171: 5.7 | AA171: -1.26e-002 | AB171: -1.9900000000000001e-002 | AC171: -6.8000000000000005e-002 | AD171: -7.0400000000000004e-002 | AE171: 84.59 | AF171: 87.1 | AG171: 0.7 | AH171: A+ | AI171: 7.2099999999999997e-002 | AJ171: =H171+100*O171 -> 146.22999999999999 | AK171: 147.9 | AL171: 173 | AM171: 60.8 | AN171: 197 | AO171: -9.0000000000000011e-003 | AP171: 11 | AQ171: 沪工转债!
A172: 50 | B172: 128145 | C172: 日丰转债 | D172: 2953 | E172: 日丰股份 | F172: 家电 | G172: 零部件制 | H172: 123.8 | I172: -7.4999999999999997e-003 | J172: -3.4999999999999996e-003 | K172: 14.77 | L172: -1.5300000000000001e-002 | M172: 115.4 | N172: 13.66 | O172: 0.14499999999999999 | P172: 108.13 | Q172: 17天 | R172: 5.53年 | S172: 3.53年 | T172: 3.8 | U172: 11 | V172: 2.3e-002 | W172: 0.106 | X172: 0.114 | Y172: 36 | Z172: 3.3 | AA172: -1.29e-002 | AB172: -1.77e-002 | AC172: -4.7100000000000003e-002 | AD172: -4.8899999999999999e-002 | AE172: 83.04 | AF172: 83.01 | AG172: 0.72 | AH172: AA- | AI172: 6.2699999999999992e-002 | AJ172: =H172+100*O172 -> 138.29999999999998 | AK172: 139.5 | AL172: 85 | AM172: 56.4 | AN172: 179 | AO172: 4.0999999999999995e-002 | AP172: 7 | AQ172: 日丰转债
A173: 338 | B173: 128037 | C173: 岩土转债! | D173: 2542 | E173: 中化岩土 | F173: 建筑 | G173: 建筑工程 | H173: 114.98 | I173: -1.0200000000000001e-002 | J173: 5.6000000000000008e-003 | K173: 3.06 | L173: -9.7000000000000003e-003 | M173: 111.3 | N173: 3.1 | O173: 0.16500000000000001 | P173: 98.71 | Q173: 转股中 | R173: 2.51年 | S173: 0.51年 | T173: 5.99 | U173: 72 | V173: 0.10199999999999999 | W173: 0.10800000000000001 | X173: 0.107 | Y173: 55 | Z173: 1.4 | AA173: -1.3100000000000001e-002 | AB173: -2.12e-002 | AC173: -0.17699999999999999 | AD173: -0.182 | AE173: 99.23 | AF173: 101.35 | AG173: 0.48 | AH173: AA | AI173: 3.8699999999999998e-002 | AJ173: =H173+100*O173 -> 131.48000000000002 | AK173: 131.3 | AL173: 16 | AM173: 29.9 | AN173: 7 | AO173: 6.2e-002 | AP173: 52 | AQ173: 岩土转债!
A174: 345 | B174: 128034 | C174: 江银转债! | D174: 2807 | E174: 江阴银行 | F174: 金融 | G174: 银行行业 | H174: 111.94 | I174: 9.0000000000000011e-003 | J174: -5.1000000000000004e-003 | K174: 4.01 | L174: 1.01e-002 | M174: 108.3 | N174: 4.32 | O174: 0.20600000000000002 | P174: 92.82 | Q174: 转股中 | R174: 2.38年 | S174: 无权 | T174: 17.6 | U174: 26 | V174: 1.3000000000000001e-002 | W174: 0.20199999999999999 | X174: 0.187 | Y174: 87 | Z174: 0.73 | AA174: -1.3999999999999999e-002 | AB174: -2.0400000000000001e-002 | AC174: 无权 | AD174: 无权 | AE174: 无权 | AF174: 100.2 | AG174: 0.39 | AH174: AA+ | AI174: 3.3700000000000001e-002 | AJ174: =H174+100*O174 -> 132.53999999999999 | AK174: 131.1 | AL174: 15 | AM174: 30.9 | AN174: 10 | AO174: 4.9000000000000002e-002 | AP174: 28 | AQ174: 江银转债!
A175: 191 | B175: 128108 | C175: 蓝帆转债! | D175: 2382 | E175: 蓝帆医疗 | F175: 医药 | G175: 医疗器械 | H175: 120.527 | I175: 1.e-004 | J175: -3.7000000000000002e-003 | K175: 19.37 | L175: -5.6000000000000008e-003 | M175: 112.9 | N175: 18.24 | O175: 0.13500000000000001 | P175: 106.2 | Q175: 转股中 | R175: 4.71年 | S175: 3.71年 | T175: 15.2 | U175: 31 | V175: 1.7000000000000001e-002 | W175: 7.8e-002 | X175: 8.3000000000000004e-002 | Y175: 195 | Z175: 1.54 | AA175: -1.3999999999999999e-002 | AB175: -1.89e-002 | AC175: -3.4799999999999998e-002 | AD175: -3.73e-002 | AE175: 90.56 | AF175: 94.16 | AG175: 0.63 | AH175: AA | AI175: 4.0099999999999997e-002 | AJ175: =H175+100*O175 -> 134.02699999999999 | AK175: 134.9 | AL175: 33 | AM175: 40.7 | AN175: 60 | AO175: -4.2000000000000003e-002 | AP175: 27 | AQ175: 蓝帆转债!
A176: 324 | B176: 113516 | C176: 苏农转债! | D176: 603323 | E176: 苏农银行 | F176: 金融 | G176: 银行行业 | H176: 118.03 | I176: 1.6000000000000001e-003 | J176: 6.9999999999999993e-003 | K176: 5.25 | L176: 1.9400000000000001e-002 | M176: 113.3 | N176: 5.37 | O176: 0.20699999999999999 | P176: 97.77 | Q176: 转股中 | R176: 2.89年 | S176: 无权 | T176: 12.9 | U176: 15 | V176: 1.e-002 | W176: 0.13600000000000001 | X176: 0.13300000000000001 | Y176: 95 | Z176: 0.77 | AA176: -1.4199999999999999e-002 | AB176: -2.2400000000000003e-002 | AC176: 无权 | AD176: 无权 | AE176: 无权 | AF176: 103.09 | AG176: 0.44 | AH176: AA+ | AI176: 3.3700000000000001e-002 | AJ176: =H176+100*O176 -> 138.72999999999999 | AK176: 138.3 | AL176: 70 | AM176: 35.2 | AN176: 24 | AO176: 5.7999999999999996e-002 | AP176: 27 | AQ176: 苏农转债!
A177: 239 | B177: 128090 | C177: 汽模转2 | D177: 2510 | E177: 天汽模 | F177: 汽车 | G177: 零部件制 | H177: 122.022 | I177: -6.9999999999999993e-003 | J177: 4.0999999999999995e-003 | K177: 4.46 | L177: -4.5000000000000005e-003 | M177: 114.9 | N177: 4.23 | O177: 0.157 | P177: 105.44 | Q177: 转股中 | R177: 4.29年 | S177: 2.30年 | T177: 3.1 | U177: 19 | V177: 4.9000000000000002e-002 | W177: 7.400000000000001e-002 | X177: 7.8e-002 | Y177: 42 | Z177: 2.06 | AA177: -1.4199999999999999e-002 | AB177: -2.0199999999999999e-002 | AC177: -6.5700000000000008e-002 | AD177: -6.8099999999999994e-002 | AE177: 89.5 | AF177: 89.57 | AG177: 0.65 | AH177: AA- | AI177: 6.1100000000000002e-002 | AJ177: =H177+100*O177 -> 137.72200000000001 | AK177: 138.6 | AL177: 73 | AM177: 49 | AN177: 129 | AO177: 2.6000000000000002e-002 | AP177: 30 | AQ177: 汽模转2
A178: 61 | B178: 128144 | C178: 利民转债! | D178: 2734 | E178: 利民股份 | F178: 化工 | G178: 农化 | H178: 123.232 | I178: -2.1000000000000001e-002 | J178: 1.24e-002 | K178: 11.46 | L178: -1.46e-002 | M178: 114.1 | N178: 11.5 | O178: 0.23699999999999999 | P178: 99.65 | Q178: 转股中 | R178: 5.47年 | S178: 3.47年 | T178: 9.8 | U178: 52 | V178: 4.2999999999999997e-002 | W178: 0.23000000000000001 | X178: 0.22899999999999998 | Y178: 43 | Z178: 1.69 | AA178: -1.4199999999999999e-002 | AB178: -1.8700000000000001e-002 | AC178: -4.8799999999999996e-002 | AD178: -5.0199999999999995e-002 | AE178: 88.75 | AF178: 91.57 | AG178: 0.59 | AH178: AA | AI178: 4.1700000000000001e-002 | AJ178: =H178+100*O178 -> 146.93199999999999 | AK178: 146.8 | AL178: 162 | AM178: 55.2 | AN178: 174 | AO178: 2.7000000000000003e-002 | AP178: 6 | AQ178: 利民转债!
A179: 173 | B179: 123057 | C179: 美联转债! | D179: 300586 | E179: 美联新材 | F179: 化工 | G179: 橡胶塑料 | H179: 126.12 | I179: -1.83e-002 | J179: -2.8999999999999998e-003 | K179: 9.96 | L179: -3.2099999999999997e-002 | M179: 117.8 | N179: 9.5 | O179: 0.20300000000000001 | P179: 104.84 | Q179: 转股中 | R179: 4.80年 | S179: 2.81年 | T179: 2.07 | U179: 35 | V179: 0.13200000000000001 | W179: 4.0000000000000001e-002 | X179: 4.0999999999999995e-002 | Y179: 52 | Z179: 4.34 | AA179: -1.44e-002 | AB179: -2.07e-002 | AC179: -6.4199999999999993e-002 | AD179: -6.6400000000000001e-002 | AE179: 87.11 | AF179: 89.15 | AG179: 0.66 | AH179: AA- | AI179: 6.1100000000000002e-002 | AJ179: =H179+100*O179 -> 146.42000000000002 | AK179: 147.4 | AL179: 166 | AM179: 58.2 | AN179: 188 | AO179: -5.0000000000000003e-002 | AP179: 21 | AQ179: 美联转债!
A180: 90 | B180: 127027 | C180: 靖远转债! | D180: 552 | E180: 靖远煤电 | F180: 煤炭 | G180: 煤炭开采 | H180: 124.784 | I180: -3.3399999999999999e-002 | J180: 2.e-003 | K180: 3.66 | L180: -4.6900000000000004e-002 | M180: 115.3 | N180: 3.23 | O180: 0.10099999999999999 | P180: 113.31 | Q180: 转股中 | R180: 5.25年 | S180: 3.25年 | T180: 28 | U180: 379 | V180: 0.107 | W180: 0.33399999999999996 | X180: 0.379 | Y180: 84 | Z180: 1.06 | AA180: -1.52e-002 | AB180: -2.0299999999999999e-002 | AC180: -5.2999999999999999e-002 | AD180: -5.4900000000000004e-002 | AE180: 91.9 | AF180: 95.81 | AG180: 0.67 | AH180: AA+ | AI180: 3.6699999999999997e-002 | AJ180: =H180+100*O180 -> 134.88400000000001 | AK180: 136.3 | AL180: 47 | AM180: 40.4 | AN180: 58 | AO180: 0.11599999999999999 | AP180: 42 | AQ180: 靖远转债!
A181: 30 | B181: 111000 | C181: 起帆转债 | D181: 605222 | E181: 起帆电缆 | F181: 能源电力 | G181: 电力设备 | H181: 131.3 | I181: -3.9000000000000003e-003 | J181: 2.0000000000000001e-004 | K181: 23.67 | L181: -5.0000000000000001e-003 | M181: 120.5 | N181: 20.53 | O181: 0.13900000000000001 | P181: 115.29 | Q181: 2月20天 | R181: 5.70年 | S181: 3.70年 | T181: 10 | U181: 37 | V181: 2.7999999999999997e-002 | W181: 0.105 | X181: 0.122 | Y181: 95 | Z181: 3.05 | AA181: -1.52e-002 | AB181: -2.12e-002 | AC181: -5.9400000000000001e-002 | AD181: -6.1100000000000002e-002 | AE181: 82.26 | AF181: 85.78 | AG181: 0.73 | AH181: AA- | AI181: 6.2699999999999992e-002 | AJ181: =H181+100*O181 -> 145.20000000000002 | AK181: 147.3 | AL181: 165 | AM181: 61.5 | AN181: 206 | AO181: 3.6000000000000004e-002 | AP181: 9 | AQ181: 起帆转债
A182: 12 | B182: 123119 | C182: 康泰转2 | D182: 300601 | E182: 康泰生物 | F182: 医药 | G182: 生物制药 | H182: 128.01 | I182: -9.3999999999999986e-003 | J182: -1.9699999999999999e-002 | K182: 116.91 | L182: -7.2400000000000006e-002 | M182: 117.1 | N182: 145.63 | O182: 0.59499999999999997 | P182: 80.28 | Q182: 4月13天 | R182: 5.84年 | S182: 3.84年 | T182: 20 | U182: 80 | V182: 3.1e-002 | W182: 2.5000000000000001e-002 | X182: 2.e-002 | Y182: 803 | Z182: 10.06 | AA182: -1.54e-002 | AB182: -2.0400000000000001e-002 | AC182: -5.1699999999999996e-002 | AD182: -5.33e-002 | AE182: 88.06 | AF182: 92.62 | AG182: 0.4 | AH182: AA | AI182: 4.1700000000000001e-002 | AJ182: =H182+100*O182 -> 187.50999999999999 | AK182: 175.7 | AL182: 293 | AM182: 83.1 | AN182: 291 | AO182: -7.4999999999999997e-002 | AP182: 7 | AQ182: 康泰转2
A183: 198 | B183: 113577 | C183: 春秋转债! | D183: 603890 | E183: 春秋电子 | F183: 电子 | G183: 电子产品 | H183: 126.54 | I183: 3.8e-003 | J183: -1.e-003 | K183: 12.37 | L183: 4.0999999999999995e-003 | M183: 117.7 | N183: 10.85 | O183: 0.11 | P183: 114.01 | Q183: 转股中 | R183: 4.59年 | S183: 2.59年 | T183: 1.78 | U183: 10 | V183: 4.4000000000000004e-002 | W183: 3.3000000000000002e-002 | X183: 3.7000000000000005e-002 | Y183: 54 | Z183: 2.53 | AA183: -1.6e-002 | AB183: -2.2499999999999999e-002 | AC183: -7.0499999999999993e-002 | AD183: -7.2700000000000001e-002 | AE183: 88.13 | AF183: 90.19 | AG183: 0.7 | AH183: AA- | AI183: 6.1100000000000002e-002 | AJ183: =H183+100*O183 -> 137.54000000000002 | AK183: 139.1 | AL183: 81 | AM183: 48.9 | AN183: 127 | AO183: -3.0000000000000001e-003 | AP183: 17 | AQ183: 春秋转债!
A184: 16 | B184: 127039 | C184: 北港转债 | D184: 582 | E184: 北部湾港 | F184: 机场高速 | G184: 港口 | H184: 123.897 | I184: -1.03e-002 | J184: -2.9999999999999997e-004 | K184: 8.48 | L184: -1.7399999999999999e-002 | M184: 113 | N184: 8.35 | O184: 0.22 | P184: 101.56 | Q184: 3月27天 | R184: 5.80年 | S184: 3.80年 | T184: 30 | U184: 60 | V184: 1.6e-002 | W184: 0.217 | X184: 0.22 | Y184: 139 | Z184: 1.31 | AA184: -1.6e-002 | AB184: -1.9900000000000001e-002 | AC184: -4.4600000000000001e-002 | AD184: -4.6199999999999998e-002 | AE184: 90.49 | AF184: 93.03 | AG184: 0.61 | AH184: AAA | AI184: 3.4700000000000002e-002 | AJ184: =H184+100*O184 -> 145.89699999999999 | AK184: 146.2 | AL184: 155 | AM184: 53.2 | AN184: 155 | AO184: 7.2999999999999995e-002 | AP184: 5 | AQ184: 北港转债
A185: 193 | B185: 113579 | C185: 健友转债! | D185: 603707 | E185: 健友股份 | F185: 医药 | G185: 原料药 | H185: 122.61 | I185: 4.7999999999999996e-003 | J185: -3.2000000000000002e-003 | K185: 28.3 | L185: 3.4999999999999996e-003 | M185: 113.9 | N185: 32.2 | O185: 0.39500000000000002 | P185: 87.89 | Q185: 转股中 | R185: 4.61年 | S185: 2.62年 | T185: 5.03 | U185: 4.4 | V185: 6.9999999999999993e-003 | W185: 1.4999999999999999e-002 | X185: 1.3000000000000001e-002 | Y185: 344 | Z185: 6.62 | AA185: -1.61e-002 | AB185: -2.1400000000000002e-002 | AC185: -5.9800000000000006e-002 | AD185: -6.2e-002 | AE185: 92.78 | AF185: 95.35 | AG185: 0.43 | AH185: AA | AI185: 4.0099999999999997e-002 | AJ185: =H185+100*O185 -> 162.11000000000001 | AK185: 157.3 | AL185: 227 | AM185: 62 | AN185: 209 | AO185: -3.1e-002 | AP185: 9 | AQ185: 健友转债!
A186: 65 | B186: 123098 | C186: 一品转债! | D186: 300723 | E186: 一品红 | F186: 医药 | G186: 医药行业 | H186: 135.35 | I186: -4.7999999999999996e-003 | J186: 7.8000000000000005e-003 | K186: 34.11 | L186: 3.8e-003 | M186: 124 | N186: 25.48 | O186: 1.1000000000000001e-002 | P186: 133.87 | Q186: 转股中 | R186: 5.38年 | S186: 3.38年 | T186: 4.25 | U186: 41 | V186: 7.0999999999999994e-002 | W186: 4.2999999999999997e-002 | X186: 5.7999999999999996e-002 | Y186: 98 | Z186: 6.66 | AA186: -1.6399999999999998e-002 | AB186: -2.3700000000000002e-002 | AC186: -7.2400000000000006e-002 | AD186: -7.4200000000000002e-002 | AE186: 83.94 | AF186: 90 | AG186: 0.79 | AH186: AA- | AI186: 6.2699999999999992e-002 | AJ186: =H186+100*O186 -> 136.44999999999999 | AK186: 136.8 | AL186: 50 | AM186: 46.8 | AN186: 113 | AO186: -4.0000000000000001e-002 | AP186: 9 | AQ186: 一品转债!
A187: 155 | B187: 110073 | C187: 国投转债 | D187: 600061 | E187: 国投资本 | F187: 金融 | G187: 证券行业 | H187: 119.5 | I187: -5.0000000000000001e-003 | J187: 1.e-002 | K187: 9.57 | L187: 9.4999999999999998e-003 | M187: 110.3 | N187: 9.9 | O187: 0.23600000000000002 | P187: 96.67 | Q187: 转股中 | R187: 4.87年 | S187: 无权 | T187: 80 | U187: 236 | V187: 2.4e-002 | W187: 0.13 | X187: 0.126 | Y187: 615 | Z187: 1.4 | AA187: -1.6500000000000001e-002 | AB187: -2.0299999999999999e-002 | AC187: 无权 | AD187: 无权 | AE187: 无权 | AF187: 94.32 | AG187: 0.53 | AH187: AAA | AI187: 3.3099999999999997e-002 | AJ187: =H187+100*O187 -> 143.09999999999999 | AK187: 142.3 | AL187: 113 | AM187: 48 | AN187: 123 | AO187: 6.8000000000000005e-002 | AP187: 26 | AQ187: 国投转债
A188: 137 | B188: 113602 | C188: 景20转债! | D188: 603228 | E188: 景旺电子 | F188: 电子 | G188: 元器件制 | H188: 122.47 | I188: -3.5999999999999999e-003 | J188: -1.1000000000000001e-003 | K188: 25.83 | L188: -8.8000000000000005e-003 | M188: 112.9 | N188: 27.4 | O188: 0.29899999999999999 | P188: 94.27 | Q188: 转股中 | R188: 4.95年 | S188: 2.95年 | T188: 17.8 | U188: 14 | V188: 6.9999999999999993e-003 | W188: 8.1000000000000003e-002 | X188: 7.5999999999999998e-002 | Y188: 220 | Z188: 3.39 | AA188: -1.66e-002 | AB188: -2.12e-002 | AC188: -5.3200000000000004e-002 | AD188: -5.5099999999999996e-002 | AE188: 91.56 | AF188: 93.27 | AG188: 0.53 | AH188: AA | AI188: 4.0099999999999997e-002 | AJ188: =H188+100*O188 -> 152.37 | AK188: 150.7 | AL188: 191 | AM188: 57.4 | AN188: 184 | AO188: -1.3000000000000001e-002 | AP188: 9 | AQ188: 景20转债!
A189: 335 | B189: 128040 | C189: 华通转债! | D189: 2758 | E189: 浙农股份 | F189: 医药 | G189: 医药商业 | H189: 116.636 | I189: -5.6000000000000008e-003 | J189: 4.6999999999999993e-003 | K189: 9.73 | L189: -2.0999999999999999e-003 | M189: 111.3 | N189: 10.15 | O189: 0.217 | P189: 95.86 | Q189: 转股中 | R189: 2.76年 | S189: 0.76年 | T189: 2.22 | U189: 7.6 | V189: 2.8999999999999998e-002 | W189: 4.7e-002 | X189: 4.4999999999999998e-002 | Y189: 47 | Z189: 1.55 | AA189: -1.7100000000000001e-002 | AB189: -2.4399999999999998e-002 | AC189: -0.13900000000000001 | AD189: -0.14199999999999999 | AE189: 98.29 | AF189: 100.4 | AG189: 0.45 | AH189: AA | AI189: 3.8699999999999998e-002 | AJ189: =H189+100*O189 -> 138.33599999999998 | AK189: 137.4 | AL189: 61 | AM189: 37 | AN189: 33 | AO189: 4.5999999999999999e-002 | AP189: 32 | AQ189: 华通转债!
A190: 175 | B190: 128116 | C190: 瑞达转债! | D190: 2961 | E190: 瑞达期货 | F190: 金融 | G190: 期货行业 | H190: 124.656 | I190: -1.8200000000000001e-002 | J190: 3.5999999999999999e-003 | K190: 26.35 | L190: -3.2300000000000002e-002 | M190: 114.9 | N190: 29.55 | O190: 0.39799999999999996 | P190: 89.17 | Q190: 转股中 | R190: 4.80年 | S190: 2.80年 | T190: 6.49 | U190: 167 | V190: 0.19800000000000001 | W190: 5.5e-002 | X190: 4.9000000000000002e-002 | Y190: 117 | Z190: 5.89 | AA190: -1.7100000000000001e-002 | AB190: -2.2499999999999999e-002 | AC190: -6.1699999999999998e-002 | AD190: -6.3700000000000007e-002 | AE190: 92.03 | AF190: 95.48 | AG190: 0.45 | AH190: AA | AI190: 4.0099999999999997e-002 | AJ190: =H190+100*O190 -> 164.45600000000002 | AK190: 160.1 | AL190: 243 | AM190: 64.7 | AN190: 232 | AO190: 0.14099999999999999 | AP190: 19 | AQ190: 瑞达转债!
A191: 298 | B191: 110056 | C191: 亨通转债! | D191: 600487 | E191: 亨通光电 | F191: 通信互联 | G191: 通信设备 | H191: 121.43 | I191: -5.9999999999999995e-004 | J191: -6.0000000000000001e-003 | K191: 13.63 | L191: -1.7299999999999999e-002 | M191: 114.3 | N191: 14.95 | O191: 0.33200000000000002 | P191: 91.17 | Q191: 转股中 | R191: 3.52年 | S191: 1.52年 | T191: 17.1 | U191: 25 | V191: 1.2e-002 | W191: 5.2999999999999999e-002 | X191: 4.8000000000000001e-002 | Y191: 322 | Z191: 1.6 | AA191: -1.7399999999999999e-002 | AB191: -2.4500000000000001e-002 | AC191: -9.4700000000000006e-002 | AD191: -9.7500000000000003e-002 | AE191: 97.03 | AF191: 101.48 | AG191: 0.38 | AH191: AA+ | AI191: 3.5099999999999999e-002 | AJ191: =H191+100*O191 -> 154.63 | AK191: 151.7 | AL191: 198 | AM191: 50.2 | AN191: 137 | AO191: 7.0999999999999994e-002 | AP191: 27 | AQ191: 亨通转债!
A192: 295 | B192: 127012 | C192: 招路转债! | D192: 1965 | E192: 招商公路 | F192: 机场高速 | G192: 高速 | H192: 114.7 | I192: -2.3700000000000002e-002 | J192: 1.3000000000000001e-002 | K192: 7.67 | L192: -2.6600000000000002e-002 | M192: 107.9 | N192: 8.63 | O192: 0.29100000000000004 | P192: 88.88 | Q192: 转股中 | R192: 3.53年 | S192: 1.53年 | T192: 50 | U192: 62 | V192: 1.1000000000000001e-002 | W192: 0.106 | X192: 9.4e-002 | Y192: 474 | Z192: 0.94 | AA192: -1.7399999999999999e-002 | AB192: -2.1499999999999998e-002 | AC192: -6.9099999999999995e-002 | AD192: -7.0800000000000002e-002 | AE192: 96.22 | AF192: 96.33 | AG192: 0.4 | AH192: AAA | AI192: 3.3099999999999997e-002 | AJ192: =H192+100*O192 -> 143.80000000000001 | AK192: 140.5 | AL192: 95 | AM192: 44.2 | AN192: 90 | AO192: 4.2000000000000003e-002 | AP192: 30 | AQ192: 招路转债!
A193: 257 | B193: 110060 | C193: 天路转债! | D193: 600326 | E193: 西藏天路 | F193: 建筑 | G193: 水泥 | H193: 123.36 | I193: -6.7900000000000002e-002 | J193: 3.1800000000000002e-002 | K193: 7.2 | L193: -6.4899999999999999e-002 | M193: 114.9 | N193: 7.08 | O193: 0.21299999999999999 | P193: 101.69 | Q193: 转股中 | R193: 4年47天 | S193: 2年48天 | T193: 7.06 | U193: 332 | V193: 0.36799999999999999 | W193: 0.107 | X193: 0.109 | Y193: 66 | Z193: 1.52 | AA193: -1.7399999999999999e-002 | AB193: -2.3700000000000002e-002 | AC193: -7.4700000000000003e-002 | AD193: -7.7199999999999991e-002 | AE193: 94.57 | AF193: 98.03 | AG193: 0.56 | AH193: AA | AI193: 4.0099999999999997e-002 | AJ193: =H193+100*O193 -> 144.66 | AK193: 145 | AL193: 143 | AM193: 47 | AN193: 115 | AO193: 7.0999999999999994e-002 | AP193: 13 | AQ193: 天路转债!
A194: 185 | B194: 123053 | C194: 宝通转债! | D194: 300031 | E194: 宝通科技 | F194: 通信互联 | G194: 互联网 | H194: 131.306 | I194: -2.7400000000000001e-002 | J194: 2.7400000000000001e-002 | K194: 20.82 | L194: 0. | M194: 120.8 | N194: 20.5 | O194: 0.29299999999999998 | P194: 101.56 | Q194: 转股中 | R194: 4.73年 | S194: 2.73年 | T194: 5 | U194: 3576. | V194: 5.29 | W194: 6.0999999999999999e-002 | X194: 6.0999999999999999e-002 | Y194: 83 | Z194: 2.68 | AA194: -1.78e-002 | AB194: -2.5099999999999997e-002 | AC194: -7.8700000000000006e-002 | AD194: -8.09e-002 | AE194: 87.48 | AF194: 91.8 | AG194: 0.61 | AH194: AA- | AI194: 6.1100000000000002e-002 | AJ194: =H194+100*O194 -> 160.60599999999999 | AK194: 161.1 | AL194: 249 | AM194: 69.3 | AN194: 247 | AO194: 0.318 | AP194: 11 | AQ194: 宝通转债!
A195: 135 | B195: 128130 | C195: 景兴转债 | D195: 2067 | E195: 景兴纸业 | F195: 造纸包装 | G195: 包装用纸 | H195: 125.5 | I195: -4.0000000000000001e-003 | J195: 4.0000000000000001e-003 | K195: 4.09 | L195: 0. | M195: 114.8 | N195: 3.4 | O195: 4.2999999999999997e-002 | P195: 120.29 | Q195: 转股中 | R195: 4.97年 | S195: 2.97年 | T195: 10.7 | U195: 88 | V195: 6.5000000000000002e-002 | W195: 0.222 | X195: 0.26700000000000002 | Y195: 48 | Z195: 0.95 | AA195: -1.8100000000000002e-002 | AB195: -2.3199999999999998e-002 | AC195: -6.0499999999999998e-002 | AD195: -6.2300000000000001e-002 | AE195: 91.39 | AF195: 94.75 | AG195: 0.72 | AH195: AA | AI195: 4.0099999999999997e-002 | AJ195: =H195+100*O195 -> 129.80000000000001 | AK195: 130.7 | AL195: 14 | AM195: 36 | AN195: 27 | AO195: 9.0999999999999998e-002 | AP195: 18 | AQ195: 景兴转债
A196: 82 | B196: 128141 | C196: 旺能转债 | D196: 2034 | E196: 旺能环境 | F196: 城市公用 | G196: 三废处理 | H196: 126.569 | I196: -1.7000000000000001e-002 | J196: 6.9999999999999993e-003 | K196: 18.8 | L196: -1.4199999999999999e-002 | M196: 115.1 | N196: 15.97 | O196: 7.4999999999999997e-002 | P196: 117.72 | Q196: 转股中 | R196: 5.27年 | S196: 3.27年 | T196: 14 | U196: 62 | V196: 3.5000000000000003e-002 | W196: 0.17699999999999999 | X196: 0.20800000000000002 | Y196: 79 | Z196: 1.68 | AA196: -1.8200000000000001e-002 | AB196: -2.3199999999999998e-002 | AC196: -5.7099999999999998e-002 | AD196: -5.8899999999999994e-002 | AE196: 90.16 | AF196: 93.21 | AG196: 0.71 | AH196: AA | AI196: 4.1700000000000001e-002 | AJ196: =H196+100*O196 -> 134.06900000000002 | AK196: 135.4 | AL196: 39 | AM196: 42.2 | AN196: 76 | AO196: 6.4000000000000001e-002 | AP196: 7 | AQ196: 旺能转债
A197: 358 | B197: 110038 | C197: 济川转债! | D197: 600566 | E197: 济川药业 | F197: 医药 | G197: 中药 | H197: 109.83 | I197: 2.8999999999999998e-003 | J197: -2.8000000000000004e-003 | K197: 17.27 | L197: 3.4999999999999996e-003 | M197: 107.5 | N197: 23.4 | O197: 0.48799999999999999 | P197: 73.8 | Q197: 转股中 | R197: 1.18年 | S197: 回售内 | T197: 6.28 | U197: 3.9 | V197: 6.0000000000000001e-003 | W197: 4.0999999999999995e-002 | X197: 2.9999999999999999e-002 | Y197: 153 | Z197: 1.89 | AA197: -1.83e-002 | AB197: -2.9999999999999999e-002 | AC197: 回售内 | AD197: 回售内 | AE197: 100.25 | AF197: 102.86 | AG197: 0.03 | AH197: AA | AI197: 3.8699999999999998e-002 | AJ197: =H197+100*O197 -> 158.63 | AK197: 145.9 | AL197: 151 | AM197: 43 | AN197: 82 | AO197: 7.0999999999999994e-002 | AP197: 22 | AQ197: 济川转债!
A198: 259 | B198: 127014 | C198: 北方转债! | D198: 65 | E198: 北方国际 | F198: 建筑 | G198: 建筑工程 | H198: 124.101 | I198: -5.2699999999999997e-002 | J198: 3.0899999999999997e-002 | K198: 9.1 | L198: -3.8100000000000002e-002 | M198: 115.1 | N198: 8.65 | O198: 0.17999999999999999 | P198: 105.2 | Q198: 转股中 | R198: 4年43天 | S198: 2年44天 | T198: 5.35 | U198: 382 | V198: 0.56700000000000006 | W198: 7.5999999999999998e-002 | X198: 8.0000000000000002e-002 | Y198: 70 | Z198: 1.22 | AA198: -1.8500000000000003e-002 | AB198: -2.4900000000000002e-002 | AC198: -7.6799999999999993e-002 | AD198: -7.9500000000000001e-002 | AE198: 95.84 | AF198: 100.19 | AG198: 0.57 | AH198: AA+ | AI198: 3.5099999999999999e-002 | AJ198: =H198+100*O198 -> 142.101 | AK198: 143 | AL198: 126 | AM198: 42.8 | AN198: 81 | AO198: 0.13800000000000001 | AP198: 19 | AQ198: 北方转债!
A199: 44 | B199: 123108 | C199: 乐普转2 | D199: 300003 | E199: 乐普医疗 | F199: 医药 | G199: 医疗器械 | H199: 120.832 | I199: 1.1000000000000001e-003 | J199: -3.9000000000000003e-003 | K199: 26.37 | L199: -6.4000000000000003e-003 | M199: 111.1 | N199: 29.5 | O199: 0.35200000000000004 | P199: 89.39 | Q199: 28天 | R199: 4.55年 | S199: 2.55年 | T199: 16.4 | U199: 4.1 | V199: 2.e-003 | W199: 3.4000000000000002e-002 | X199: 3.1e-002 | Y199: 476 | Z199: 4.18 | AA199: -1.8500000000000003e-002 | AB199: -2.2799999999999997e-002 | AC199: -6.0499999999999998e-002 | AD199: -6.1799999999999994e-002 | AE199: 92.96 | AF199: 95.15 | AG199: 0.44 | AH199: AA+ | AI199: 3.5099999999999999e-002 | AJ199: =H199+100*O199 -> 156.03199999999998 | AK199: 152.3 | AL199: 200 | AM199: 57.1 | AN199: 181 | AO199: 1.4999999999999999e-002 | AP199: 11 | AQ199: 乐普转2
A200: 13 | B200: 127041 | C200: 弘亚转债 | D200: 2833 | E200: 弘亚数控 | F200: 机械装备 | G200: 专用设备 | H200: 130.098 | I200: 8.0000000000000004e-004 | J200: -2.2400000000000003e-002 | K200: 41.25 | L200: -3.2400000000000005e-002 | M200: 118.75 | N200: 38.09 | O200: 0.20100000000000001 | P200: 108.3 | Q200: 4月9天 | R200: 4.83年 | S200: 2.84年 | T200: 6 | U200: 31 | V200: 4.0000000000000001e-002 | W200: 4.8000000000000001e-002 | X200: 5.2000000000000005e-002 | Y200: 125 | Z200: 6.78 | AA200: -1.89e-002 | AB200: -2.5499999999999998e-002 | AC200: -7.6700000000000004e-002 | AD200: -7.8200000000000006e-002 | AE200: 85.88 | AF200: 89.52 | AG200: 0.67 | AH200: AA- | AI200: 6.1100000000000002e-002 | AJ200: =H200+100*O200 -> 150.19800000000001 | AK200: 151.9 | AL200: 199 | AM200: 62.4 | AN200: 214 | AO200: 8.900000000000001e-002 | AP200: 4 | AQ200: 弘亚转债
A201: 241 | B201: 123038 | C201: 联得转债! | D201: 300545 | E201: 联得装备 | F201: 机械装备 | G201: 专用设备 | H201: 128.62 | I201: 6.8999999999999999e-003 | J201: 5.0000000000000001e-004 | K201: 25.2 | L201: 1.1200000000000002e-002 | M201: 118.6 | N201: 24.07 | O201: 0.22899999999999998 | P201: 104.69 | Q201: 转股中 | R201: 4.29年 | S201: 2.29年 | T201: 1.47 | U201: 27 | V201: 0.14199999999999999 | W201: 3.3000000000000002e-002 | X201: 3.4000000000000002e-002 | Y201: 45 | Z201: 3.25 | AA201: -1.9099999999999999e-002 | AB201: -2.6499999999999999e-002 | AC201: -8.43e-002 | AD201: -8.6899999999999991e-002 | AE201: 87.71 | AF201: 88.63 | AG201: 0.66 | AH201: A+ | AI201: 7.2099999999999997e-002 | AJ201: =H201+100*O201 -> 151.52000000000001 | AK201: 152.5 | AL201: 201 | AM201: 63.9 | AN201: 223 | AO201: -2.7000000000000003e-002 | AP201: 20 | AQ201: 联得转债!
A202: 261 | B202: 128079 | C202: 英联转债! | D202: 2846 | E202: 英联股份 | F202: 造纸包装 | G202: 包装材料 | H202: 127 | I202: -4.3e-003 | J202: -2.7000000000000001e-003 | K202: 7.74 | L202: -1.15e-002 | M202: 117.5 | N202: 8.29 | O202: 0.35999999999999999 | P202: 93.37 | Q202: 转股中 | R202: 4年40天 | S202: 2年41天 | T202: 1.52 | U202: 18 | V202: 9.3000000000000013e-002 | W202: 6.2e-002 | X202: 5.7999999999999996e-002 | Y202: 25 | Z202: 3.13 | AA202: -1.9199999999999998e-002 | AB202: -2.64e-002 | AC202: -8.6099999999999996e-002 | AD202: -8.8800000000000004e-002 | AE202: 88.63 | AF202: 88.88 | AG202: 0.61 | AH202: A+ | AI202: 7.2099999999999997e-002 | AJ202: =H202+100*O202 -> 163. | AK202: 160.6 | AL202: 245 | AM202: 71.8 | AN202: 262 | AO202: 1.e-002 | AP202: 17 | AQ202: 英联转债!
A203: 189 | B203: 123051 | C203: 今天转债 | D203: 300532 | E203: 今天国际 | F203: 计算机及 | G203: 软件开发 | H203: 134.05 | I203: -1.15e-002 | J203: 1.29e-002 | K203: 11.35 | L203: 1.8e-003 | M203: 122.3 | N203: 8.7 | O203: 2.7999999999999997e-002 | P203: 130.46 | Q203: 转股中 | R203: 4.73年 | S203: 2.73年 | T203: 2.79 | U203: 27 | V203: 7.2000000000000008e-002 | W203: 8.9999999999999997e-002 | X203: 0.11800000000000001 | Y203: 31 | Z203: 3.74 | AA203: -1.9599999999999999e-002 | AB203: -2.7400000000000001e-002 | AC203: -8.4000000000000005e-002 | AD203: -8.6400000000000005e-002 | AE203: 85.37 | AF203: 88.69 | AG203: 0.78 | AH203: A+ | AI203: 7.2099999999999997e-002 | AJ203: =H203+100*O203 -> 136.85000000000002 | AK203: 137.6 | AL203: 63 | AM203: 49 | AN203: 128 | AO203: -8.0000000000000002e-003 | AP203: 20 | AQ203: 今天转债
A204: 107 | B204: 127025 | C204: 冀东转债! | D204: 401 | E204: 冀东水泥 | F204: 建筑 | G204: 水泥 | H204: 121.863 | I204: -2.12e-002 | J204: 1.4800000000000001e-002 | K204: 14.22 | L204: -1.2500000000000001e-002 | M204: 110.1 | N204: 15.28 | O204: 0.309 | P204: 93.06 | Q204: 转股中 | R204: 5年55天 | S204: 3年56天 | T204: 17.8 | U204: 135 | V204: 5.9999999999999998e-002 | W204: 8.8000000000000009e-002 | X204: 8.199999999999999e-002 | Y204: 201 | Z204: 1.28 | AA204: -1.9799999999999998e-002 | AB204: -2.3300000000000001e-002 | AC204: -5.0099999999999999e-002 | AD204: -5.16e-002 | AE204: 91.92 | AF204: 92.62 | AG204: 0.51 | AH204: AAA | AI204: 3.4700000000000002e-002 | AJ204: =H204+100*O204 -> 152.76300000000001 | AK204: 150.7 | AL204: 190 | AM204: 58 | AN204: 186 | AO204: 8.3000000000000004e-002 | AP204: 9 | AQ204: 冀东转债!
A205: 7 | B205: 123121 | C205: 帝尔转债 | D205: 300776 | E205: 帝尔激光 | F205: 机械装备 | G205: 专用设备 | H205: 135.868 | I205: -5.1000000000000004e-003 | J205: -1.5e-003 | K205: 162.01 | L205: -1.21e-002 | M205: 121 | N205: 192.7 | O205: 0.61599999999999999 | P205: 84.07 | Q205: 5月4天 | R205: 5.90年 | S205: 3.90年 | T205: 8.4 | U205: 27 | V205: 2.4e-002 | W205: 4.9000000000000002e-002 | X205: 4.0999999999999995e-002 | Y205: 171 | Z205: 8.99 | AA205: -1.9799999999999998e-002 | AB205: -2.5699999999999997e-002 | AC205: -6.4299999999999996e-002 | AD205: -6.59e-002 | AE205: 81.34 | AF205: 85.11 | AG205: 0.54 | AH205: AA- | AI205: 6.2699999999999992e-002 | AJ205: =H205+100*O205 -> 197.46799999999999 | AK205: 187.7 | AL205: 317 | AM205: 102.5 | AN205: 319 | AO205: -3.1e-002 | AP205: 3 | AQ205: 帝尔转债
A206: 199 | B206: 123050 | C206: 聚飞转债! | D206: 300303 | E206: 聚飞光电 | F206: 电子 | G206: LED制 | H206: 135.5 | I206: -6.5000000000000006e-003 | J206: 1.7100000000000001e-002 | K206: 6.23 | L206: 1.47e-002 | M206: 123.8 | N206: 5.08 | O206: 0.105 | P206: 122.64 | Q206: 转股中 | R206: 4.59年 | S206: 2.59年 | T206: 3.75 | U206: 248 | V206: 0.47799999999999998 | W206: 4.4999999999999998e-002 | X206: 5.5e-002 | Y206: 84 | Z206: 3.36 | AA206: -1.9900000000000001e-002 | AB206: -2.8300000000000002e-002 | AC206: -9.3200000000000005e-002 | AD206: -9.5399999999999985e-002 | AE206: 88.22 | AF206: 94.86 | AG206: 0.72 | AH206: AA- | AI206: 6.1100000000000002e-002 | AJ206: =H206+100*O206 -> 146. | AK206: 148.4 | AL206: 177 | AM206: 53.5 | AN206: 161 | AO206: -4.8000000000000001e-002 | AP206: 14 | AQ206: 聚飞转债!
A207: 83 | B207: 113614 | C207: 健20转债! | D207: 603707 | E207: 健友股份 | F207: 医药 | G207: 原料药 | H207: 126.72 | I207: 6.0000000000000001e-003 | J207: -3.9000000000000003e-003 | K207: 28.3 | L207: 3.4999999999999996e-003 | M207: 114.2 | N207: 29.12 | O207: 0.30399999999999999 | P207: 97.18 | Q207: 转股中 | R207: 5.27年 | S207: 3.27年 | T207: 7.8 | U207: 4 | V207: 4.0000000000000001e-003 | W207: 2.3e-002 | X207: 2.2000000000000002e-002 | Y207: 344 | Z207: 6.62 | AA207: -1.9900000000000001e-002 | AB207: -2.46e-002 | AC207: -5.7200000000000001e-002 | AD207: -5.9000000000000004e-002 | AE207: 90.25 | AF207: 92.49 | AG207: 0.57 | AH207: AA | AI207: 4.1700000000000001e-002 | AJ207: =H207+100*O207 -> 157.12 | AK207: 156.3 | AL207: 223 | AM207: 63.8 | AN207: 221 | AO207: -3.1e-002 | AP207: 4 | AQ207: 健20转债!
A208: 292 | B208: 110057 | C208: 现代转债 | D208: 600420 | E208: 国药现代 | F208: 医药 | G208: 化学制药 | H208: 118.37 | I208: -5.4000000000000003e-003 | J208: 3.5999999999999999e-003 | K208: 10.1 | L208: -3.0000000000000001e-003 | M208: 110.3 | N208: 9.79 | O208: 0.14699999999999999 | P208: 103.17 | Q208: 转股中 | R208: 3.55年 | S208: 1.56年 | T208: 16.2 | U208: 19 | V208: 1.e-002 | W208: 0.156 | X208: 0.161 | Y208: 104 | Z208: 1.27 | AA208: -2.e-002 | AB208: -2.52e-002 | AC208: -7.9199999999999993e-002 | AD208: -8.199999999999999e-002 | AE208: 97.24 | AF208: 98.47 | AG208: 0.58 | AH208: AAA | AI208: 3.3099999999999997e-002 | AJ208: =H208+100*O208 -> 133.06999999999999 | AK208: 133.6 | AL208: 29 | AM208: 35.1 | AN208: 22 | AO208: 4.8000000000000001e-002 | AP208: 24 | AQ208: 现代转债
A209: 28 | B209: 127035 | C209: 濮耐转债 | D209: 2225 | E209: 濮耐股份 | F209: 钢铁 | G209: 钢铁行业 | H209: 126.1 | I209: -2.46e-002 | J209: 2.3999999999999998e-003 | K209: 4.93 | L209: -3.3300000000000003e-002 | M209: 114.7 | N209: 4.43 | O209: 0.13300000000000001 | P209: 111.29 | Q209: 2月22天 | R209: 4.70年 | S209: 2.71年 | T209: 6.26 | U209: 42 | V209: 5.2999999999999999e-002 | W209: 0.126 | X209: 0.14000000000000001 | Y209: 50 | Z209: 1.65 | AA209: -2.0299999999999999e-002 | AB209: -2.5699999999999997e-002 | AC209: -6.7199999999999996e-002 | AD209: -6.9199999999999998e-002 | AE209: 92.44 | AF209: 95.69 | AG209: 0.67 | AH209: AA | AI209: 4.0099999999999997e-002 | AJ209: =H209+100*O209 -> 139.40000000000001 | AK209: 140.9 | AL209: 103 | AM209: 45.2 | AN209: 97 | AO209: 2.2000000000000002e-002 | AP209: 10 | AQ209: 濮耐转债
A210: 336 | B210: 128039 | C210: 三力转债! | D210: 2224 | E210: 三 力 士 | F210: 机械装备 | G210: 专用设备 | H210: 115.18 | I210: -1.1299999999999999e-002 | J210: 3.7000000000000002e-003 | K210: 5.19 | L210: -1.7000000000000001e-002 | M210: 108.8 | N210: 5.79 | O210: 0.28499999999999998 | P210: 89.64 | Q210: 转股中 | R210: 2.74年 | S210: 0.74年 | T210: 2.02 | U210: 13 | V210: 5.5e-002 | W210: 5.2999999999999999e-002 | X210: 4.8000000000000001e-002 | Y210: 38 | Z210: 1.61 | AA210: -2.0799999999999999e-002 | AB210: -2.6699999999999998e-002 | AC210: -0.13200000000000001 | AD210: -0.13500000000000001 | AE210: 96.35 | AF210: 93.02 | AG210: 0.45 | AH210: AA- | AI210: 5.9699999999999996e-002 | AJ210: =H210+100*O210 -> 143.68000000000001 | AK210: 140.7 | AL210: 101 | AM210: 44.4 | AN210: 93 | AO210: 2.3e-002 | AP210: 30 | AQ210: 三力转债!
A211: 176 | B211: 127018 | C211: 本钢转债! | D211: 761 | E211: 本钢板材 | F211: 钢铁 | G211: 炼钢 | H211: 141.39 | I211: -2.06e-002 | J211: -1.04e-002 | K211: 7.05 | L211: -4.0800000000000003e-002 | M211: 128 | N211: 5.02 | O211: 6.9999999999999993e-003 | P211: 140.44 | Q211: 转股中 | R211: 4.80年 | S211: 2.80年 | T211: 58.2 | U211: 564 | V211: 6.9000000000000006e-002 | W211: 0.21299999999999999 | X211: 0.29799999999999999 | Y211: 274 | Z211: 1.24 | AA211: -2.1099999999999997e-002 | AB211: -3.0299999999999997e-002 | AC211: -9.4e-002 | AD211: -9.7200000000000009e-002 | AE211: 93.53 | AF211: 105.16 | AG211: 0.76 | AH211: AAA | AI211: 4.3099999999999999e-002 | AJ211: =H211+100*O211 -> 142.08999999999997 | AK211: 142.3 | AL211: 115 | AM211: 37.2 | AN211: 34 | AO211: 0.19699999999999998 | AP211: 68 | AQ211: 本钢转债!
A212: 190 | B212: 127017 | C212: 万青转债 | D212: 789 | E212: 万年青 | F212: 建筑 | G212: 水泥 | H212: 130.329 | I212: 6.4000000000000003e-003 | J212: 2.0000000000000001e-004 | K212: 13.77 | L212: 1.2500000000000001e-002 | M212: 118 | N212: 13.46 | O212: 0.27399999999999997 | P212: 102.3 | Q212: 转股中 | R212: 4.73年 | S212: 2.73年 | T212: 10 | U212: 386 | V212: 0.29199999999999998 | W212: 9.0999999999999998e-002 | X212: 9.3000000000000013e-002 | Y212: 110 | Z212: 1.68 | AA212: -2.12e-002 | AB212: -2.76e-002 | AC212: -7.7600000000000002e-002 | AD212: -7.9500000000000001e-002 | AE212: 93.59 | AF212: 100.55 | AG212: 0.53 | AH212: AA+ | AI212: 3.5099999999999999e-002 | AJ212: =H212+100*O212 -> 157.72900000000001 | AK212: 158.4 | AL212: 232 | AM212: 57.8 | AN212: 185 | AO212: 0.13800000000000001 | AP212: 8 | AQ212: 万青转债
A213: 63 | B213: 123100 | C213: 朗科转债 | D213: 300543 | E213: 朗科智能 | F213: 电子 | G213: 电子产品 | H213: 131.7 | I213: -2.2000000000000001e-003 | J213: -2.2000000000000001e-003 | K213: 13.58 | L213: -5.8999999999999999e-003 | M213: 117.5 | N213: 11.61 | O213: 0.126 | P213: 116.97 | Q213: 转股中 | R213: 5.41年 | S213: 3.42年 | T213: 3.8 | U213: 15 | V213: 2.9999999999999999e-002 | W213: 0.10400000000000001 | X213: 0.122 | Y213: 36 | Z213: 3.98 | AA213: -2.12e-002 | AB213: -2.6699999999999998e-002 | AC213: -6.480000000000001e-002 | AD213: -6.6600000000000006e-002 | AE213: 83.7 | AF213: 85.12 | AG213: 0.76 | AH213: AA- | AI213: 6.2699999999999992e-002 | AJ213: =H213+100*O213 -> 144.29999999999998 | AK213: 146.4 | AL213: 159 | AM213: 61.3 | AN213: 205 | AO213: -8.900000000000001e-002 | AP213: 10 | AQ213: 朗科转债
A214: 11 | B214: 113627 | C214: 太平转债 | D214: 603877 | E214: 太平鸟 | F214: 服装纺织 | G214: 服装行业 | H214: 130.18 | I214: 1.e-004 | J214: 1.0500000000000001e-002 | K214: 46 | L214: 2.e-002 | M214: 115.1 | N214: 50.32 | O214: 0.42399999999999999 | P214: 91.41 | Q214: 4月13天 | R214: 5.84年 | S214: 3.84年 | T214: 8 | U214: 3.1 | V214: 3.0000000000000001e-003 | W214: 3.6000000000000004e-002 | X214: 3.3000000000000002e-002 | Y214: 219 | Z214: 5.58 | AA214: -2.12e-002 | AB214: -2.5600000000000001e-002 | AC214: -5.57e-002 | AD214: -5.7300000000000004e-002 | AE214: 88.06 | AF214: 91.04 | AG214: 0.53 | AH214: AA | AI214: 4.1700000000000001e-002 | AJ214: =H214+100*O214 -> 172.58000000000001 | AK214: 168.9 | AL214: 277 | AM214: 77.9 | AN214: 277 | AO214: -3.3000000000000002e-002 | AP214: 2 | AQ214: 太平转债
A215: 353 | B215: 128025 | C215: 特一转债! | D215: 2728 | E215: 特一药业 | F215: 医药 | G215: 化学制药 | H215: 114.629 | I215: -3.5999999999999999e-003 | J215: 1.1000000000000001e-003 | K215: 12.21 | L215: -7.3000000000000001e-003 | M215: 108.8 | N215: 14.05 | O215: 0.31900000000000001 | P215: 86.9 | Q215: 转股中 | R215: 2.24年 | S215: 0.24年 | T215: 2.98 | U215: 14 | V215: 4.2000000000000003e-002 | W215: 0.12 | X215: 0.10400000000000001 | Y215: 25 | Z215: 2.56 | AA215: -2.3399999999999997e-002 | AB215: -3.0499999999999999e-002 | AC215: -0.30199999999999999 | AD215: -0.309 | AE215: 99.21 | AF215: 95.78 | AG215: 0.35 | AH215: AA- | AI215: 5.9699999999999996e-002 | AJ215: =H215+100*O215 -> 146.529 | AK215: 142.4 | AL215: 117 | AM215: 43.1 | AN215: 83 | AO215: 2.7999999999999997e-002 | AP215: 50 | AQ215: 特一转债!
A216: 183 | B216: 123054 | C216: 思特转债!! | D216: 300608 | E216: 思特奇 | F216: 通信互联 | G216: 通信设备 | H216: 135.543 | I216: 8.0000000000000002e-003 | J216: -7.0999999999999995e-003 | K216: 13.48 | L216: 1.5e-003 | M216: 121.2 | N216: 12.63 | O216: 0.27000000000000002 | P216: 106.73 | Q216: 转股中 | R216: 4.75年 | S216: 2.75年 | T216: 2.08 | U216: 698 | V216: 2.4399999999999999 | W216: 7.2999999999999995e-002 | X216: 7.8e-002 | Y216: 28 | Z216: 3.32 | AA216: -2.3799999999999998e-002 | AB216: -3.1099999999999999e-002 | AC216: -8.7300000000000003e-002 | AD216: -8.9600000000000013e-002 | AE216: 87.75 | AF216: 92.06 | AG216: 0.64 | AH216: AA- | AI216: 6.1100000000000002e-002 | AJ216: =H216+100*O216 -> 162.54300000000001 | AK216: 164.4 | AL216: 263 | AM216: 72.3 | AN216: 264 | AO216: 1.7000000000000001e-002 | AP216: 19 | AQ216: 思特转债!!
A217: 246 | B217: 110063 | C217: 鹰19转债 | D217: 600567 | E217: 山鹰国际 | F217: 造纸包装 | G217: 包装用纸 | H217: 128.44 | I217: 1.2999999999999999e-003 | J217: -1.18e-002 | K217: 3.77 | L217: -1.5700000000000002e-002 | M217: 115.9 | N217: 3.26 | O217: 0.111 | P217: 115.64 | Q217: 转股中 | R217: 4.25年 | S217: 2.26年 | T217: 18.5 | U217: 41 | V217: 1.7000000000000001e-002 | W217: 0.106 | X217: 0.12300000000000001 | Y217: 174 | Z217: 1.09 | AA217: -2.4300000000000002e-002 | AB217: -3.0699999999999998e-002 | AC217: -8.6899999999999991e-002 | AD217: -8.9200000000000002e-002 | AE217: 95.03 | AF217: 100.37 | AG217: 0.67 | AH217: AA+ | AI217: 3.5099999999999999e-002 | AJ217: =H217+100*O217 -> 139.53999999999999 | AK217: 141.2 | AL217: 106 | AM217: 40.9 | AN217: 62 | AO217: 8.9999999999999997e-002 | AP217: 32 | AQ217: 鹰19转债
A218: 207 | B218: 113575 | C218: 东时转债!! | D218: 603377 | E218: 东方时尚 | F218: 其他 | G218: 其他 | H218: 126.55 | I218: -1.5e-003 | J218: -5.0000000000000001e-003 | K218: 8.41 | L218: -3.1099999999999999e-002 | M218: 113.1 | N218: 12.15 | O218: 0.82799999999999996 | P218: 69.22 | Q218: 转股中 | R218: 4.58年 | S218: 2.58年 | T218: 0.98 | U218: 24 | V218: 0.191 | W218: 1.6e-002 | X218: 1.1000000000000001e-002 | Y218: 61 | Z218: 2.94 | AA218: -2.4700000000000003e-002 | AB218: -2.9700000000000001e-002 | AC218: -7.1399999999999991e-002 | AD218: -7.3499999999999996e-002 | AE218: 92.95 | AF218: 94.83 | AG218: 0.21 | AH218: AA | AI218: 4.0099999999999997e-002 | AJ218: =H218+100*O218 -> 209.34999999999999 | AK218: 183.9 | AL218: 310 | AM218: 89.1 | AN218: 302 | AO218: 1.1000000000000001e-002 | AP218: 15 | AQ218: 东时转债!!
A219: 296 | B219: 123024 | C219: 岱勒转债! | D219: 300700 | E219: 岱勒新材 | F219: 机械装备 | G219: 专用设备 | H219: 119.786 | I219: -1.49e-002 | J219: -2.8999999999999998e-003 | K219: 14.46 | L219: -3.0800000000000001e-002 | M219: 112.5 | N219: 14.1 | O219: 0.16800000000000001 | P219: 102.55 | Q219: 转股中 | R219: 2.52年 | S219: 0.53年 | T219: 2.1 | U219: 17 | V219: 6.9000000000000006e-002 | W219: 0.13500000000000001 | X219: 0.13900000000000001 | Y219: 15 | Z219: 3.27 | AA219: -2.4799999999999999e-002 | AB219: -3.3500000000000002e-002 | AC219: -0.23199999999999998 | AD219: -0.23499999999999999 | AE219: 96.58 | AF219: 94.88 | AG219: 0.58 | AH219: A+ | AI219: 7.0699999999999999e-002 | AJ219: =H219+100*O219 -> 136.58600000000001 | AK219: 137 | AL219: 53 | AM219: 40.4 | AN219: 56 | AO219: -3.7000000000000005e-002 | AP219: 38 | AQ219: 岱勒转债!
A220: 2 | B220: 127045 | C220: N牧原转 | D220: 2714 | E220: 牧原股份 | F220: 农业 | G220: 畜牧业 | H220: 128.8 | I220: 0.28800000000000003 | J220: 0. | K220: 45.45 | L220: -3.7000000000000002e-003 | M220: 111.1 | N220: 47.91 | O220: 0.35799999999999998 | P220: 94.87 | Q220: 5月14天 | R220: 5.93年 | S220: 3.93年 | T220: 95.5 | U220: 433 | V220: 3.5000000000000003e-002 | W220: 4.0000000000000001e-002 | X220: 3.7999999999999999e-002 | Y220: 2392. | Z220: 4.48 | AA220: -2.4900000000000002e-002 | AB220: -2.8199999999999999e-002 | AC220: -5.3699999999999998e-002 | AD220: -5.4900000000000004e-002 | AE220: 88.81 | AF220: 89.99 | AG220: 0.56 | AH220: AA+ | AI220: 3.6699999999999997e-002 | AJ220: =H220+100*O220 -> 164.60000000000002 | AK220: 162.7 | AL220: 258 | AM220: 72.7 | AN220: 266 | AO220: 1.1000000000000001e-002 | AP220: 3 | AQ220: N牧原转
A221: 46 | B221: 110079 | C221: 杭银转债! | D221: 600926 | E221: 杭州银行 | F221: 金融 | G221: 银行行业 | H221: 129.2 | I221: 8.6999999999999994e-003 | J221: 6.0000000000000001e-003 | K221: 15.46 | L221: 2.0499999999999997e-002 | M221: 112.4 | N221: 12.99 | O221: 8.5999999999999993e-002 | P221: 119.01 | Q221: 28天 | R221: 5.55年 | S221: 无权 | T221: 150 | U221: 256 | V221: 1.3000000000000001e-002 | W221: 0.16399999999999998 | X221: 0.19500000000000001 | Y221: 917 | Z221: 1.37 | AA221: -2.5099999999999997e-002 | AB221: -2.8999999999999998e-002 | AC221: 无权 | AD221: 无权 | AE221: 无权 | AF221: 93.29 | AG221: 0.72 | AH221: AAA | AI221: 3.4700000000000002e-002 | AJ221: =H221+100*O221 -> 137.79999999999998 | AK221: 139.4 | AL221: 83 | AM221: 46.1 | AN221: 105 | AO221: 0.122 | AP221: 13 | AQ221: 杭银转债!
A222: 318 | B222: 110047 | C222: 山鹰转债 | D222: 600567 | E222: 山鹰国际 | F222: 造纸包装 | G222: 包装用纸 | H222: 127.52 | I222: -5.0000000000000001e-004 | J222: -9.1000000000000004e-003 | K222: 3.77 | L222: -1.5700000000000002e-002 | M222: 117.5 | N222: 3.3 | O222: 0.11599999999999999 | P222: 114.24 | Q222: 转股中 | R222: 3.19年 | S222: 1.20年 | T222: 22.5 | U222: 64 | V222: 2.2000000000000002e-002 | W222: 0.129 | X222: 0.14699999999999999 | Y222: 174 | Z222: 1.09 | AA222: -2.58e-002 | AB222: -3.5000000000000003e-002 | AC222: -0.13600000000000001 | AD222: -0.13900000000000001 | AE222: 98.15 | AF222: 105.49 | AG222: 0.61 | AH222: AA+ | AI222: 3.5099999999999999e-002 | AJ222: =H222+100*O222 -> 139.12 | AK222: 140.8 | AL222: 102 | AM222: 35.3 | AN222: 25 | AO222: 8.9999999999999997e-002 | AP222: 29 | AQ222: 山鹰转债
A223: 125 | B223: 110075 | C223: 南航转债 | D223: 600029 | E223: 南方航空 | F223: 交通运输 | G223: 航空运输 | H223: 126.01 | I223: 1.e-004 | J223: -2.8999999999999998e-003 | K223: 6.16 | L223: -4.7999999999999996e-003 | M223: 110 | N223: 6.24 | O223: 0.27600000000000002 | P223: 98.72 | Q223: 转股中 | R223: 5年34天 | S223: 3年35天 | T223: 59 | U223: 189 | V223: 2.5000000000000001e-002 | W223: 5.5999999999999994e-002 | X223: 5.5999999999999994e-002 | Y223: 1044. | Z223: 1.39 | AA223: -2.6699999999999998e-002 | AB223: -3.0099999999999998e-002 | AC223: -6.2400000000000004e-002 | AD223: -6.3600000000000004e-002 | AE223: 91.55 | AF223: 92.67 | AG223: 0.57 | AH223: AAA | AI223: 3.4700000000000002e-002 | AJ223: =H223+100*O223 -> 153.61000000000001 | AK223: 153.3 | AL223: 205 | AM223: 60.6 | AN223: 196 | AO223: 6.9000000000000006e-002 | AP223: 8 | AQ223: 南航转债
A224: 25 | B224: 123115 | C224: 捷捷转债 | D224: 300623 | E224: 捷捷微电 | F224: 电子 | G224: 元器件制 | H224: 138.359 | I224: 8.5000000000000006e-003 | J224: 2.3399999999999997e-002 | K224: 30.9 | L224: 4.53e-002 | M224: 118.5 | N224: 29 | O224: 0.29899999999999999 | P224: 106.55 | Q224: 3月6天 | R224: 5.74年 | S224: 3.74年 | T224: 12 | U224: 252 | V224: 0.14899999999999999 | W224: 5.2999999999999999e-002 | X224: 5.5999999999999994e-002 | Y224: 228 | Z224: 8.48 | AA224: -2.7099999999999999e-002 | AB224: -3.2400000000000005e-002 | AC224: -7.1399999999999991e-002 | AD224: -7.2999999999999995e-002 | AE224: 82.06 | AF224: 84.15 | AG224: 0.7 | AH224: AA- | AI224: 6.2699999999999992e-002 | AJ224: =H224+100*O224 -> 168.25900000000001 | AK224: 170.2 | AL224: 280 | AM224: 86 | AN224: 296 | AO224: -2.3e-002 | AP224: 5 | AQ224: 捷捷转债
A225: 357 | B225: 123002 | C225: 国祯转债!! | D225: 300388 | E225: 节能国祯 | F225: 城市公用 | G225: 三废处理 | H225: 115.587 | I225: -1.38e-002 | J225: 2.3e-003 | K225: 7.88 | L225: -2.4799999999999999e-002 | M225: 108.8 | N225: 8.36 | O225: 0.22600000000000001 | P225: 94.26 | Q225: 转股中 | R225: 2.21年 | S225: 0.21年 | T225: 2.52 | U225: 5.1 | V225: 1.7000000000000001e-002 | W225: 4.5999999999999999e-002 | X225: 4.2999999999999997e-002 | Y225: 55 | Z225: 1.54 | AA225: -2.75e-002 | AB225: -3.4700000000000002e-002 | AC225: -0.35100000000000003 | AD225: -0.35899999999999999 | AE225: 100.13 | AF225: 100.21 | AG225: 0.46 | AH225: AA | AI225: 3.8699999999999998e-002 | AJ225: =H225+100*O225 -> 138.18700000000001 | AK225: 136.9 | AL225: 52 | AM225: 36.7 | AN225: 31 | AO225: 4.7e-002 | AP225: 17 | AQ225: 国祯转债!!
A226: 113 | B226: 113607 | C226: 伟20转债! | D226: 603568 | E226: 伟明环保 | F226: 城市公用 | G226: 三废处理 | H226: 132.88 | I226: 6.5000000000000006e-003 | J226: -3.4000000000000002e-003 | K226: 28.78 | L226: 3.8e-003 | M226: 115.1 | N226: 21.71 | O226: 2.e-003 | P226: 132.57 | Q226: 转股中 | R226: 5年52天 | S226: 3年53天 | T226: 11.9 | U226: 160 | V226: 0.10199999999999999 | W226: 3.3000000000000002e-002 | X226: 4.4000000000000004e-002 | Y226: 362 | Z226: 6.38 | AA226: -2.7999999999999997e-002 | AB226: -3.3000000000000002e-002 | AC226: -7.2999999999999995e-002 | AD226: -7.4800000000000005e-002 | AE226: 90.61 | AF226: 93.68 | AG226: 0.8 | AH226: AA | AI226: 4.1700000000000001e-002 | AJ226: =H226+100*O226 -> 133.07999999999998 | AK226: 133.2 | AL226: 27 | AM226: 39.5 | AN226: 51 | AO226: 1.6e-002 | AP226: 7 | AQ226: 伟20转债!
A227: 319 | B227: 128048 | C227: 张行转债 | D227: 2839 | E227: 张家港行 | F227: 金融 | G227: 银行行业 | H227: 123.857 | I227: 1.9599999999999999e-002 | J227: 4.0999999999999995e-003 | K227: 6.21 | L227: 3.85e-002 | M227: 113.3 | N227: 5.6 | O227: 0.11699999999999999 | P227: 110.89 | Q227: 转股中 | R227: 3.17年 | S227: 无权 | T227: 25 | U227: 180 | V227: 5.7000000000000002e-002 | W227: 0.222 | X227: 0.247 | Y227: 112 | Z227: 1.01 | AA227: -2.8300000000000002e-002 | AB227: -3.5499999999999997e-002 | AC227: 无权 | AD227: 无权 | AE227: 无权 | AF227: 101.8 | AG227: 0.62 | AH227: AA+ | AI227: 3.5099999999999999e-002 | AJ227: =H227+100*O227 -> 135.55699999999999 | AK227: 136.8 | AL227: 49 | AM227: 35 | AN227: 20 | AO227: 6.7000000000000004e-002 | AP227: 12 | AQ227: 张行转债
A228: 252 | B228: 113549 | C228: 白电转债 | D228: 603861 | E228: 白云电器 | F228: 能源电力 | G228: 电力设备 | H228: 129.11 | I228: 4.53e-002 | J228: 2.7400000000000001e-002 | K228: 10.55 | L228: 0.10000000000000001 | M228: 114.8 | N228: 8.83 | O228: 8.1000000000000003e-002 | P228: 119.48 | Q228: 转股中 | R228: 4.18年 | S228: 2.18年 | T228: 8.8 | U228: 390 | V228: 0.33899999999999997 | W228: 0.19 | X228: 0.22699999999999998 | Y228: 46 | Z228: 1.83 | AA228: -2.8300000000000002e-002 | AB228: -3.4300000000000004e-002 | AC228: -9.1499999999999998e-002 | AD228: -9.3800000000000008e-002 | AE228: 94.28 | AF228: 97.74 | AG228: 0.73 | AH228: AA | AI228: 4.0099999999999997e-002 | AJ228: =H228+100*O228 -> 137.21000000000001 | AK228: 138.7 | AL228: 78 | AM228: 41 | AN228: 67 | AO228: 0.155 | AP228: 40 | AQ228: 白电转债
A229: 118 | B229: 123071 | C229: 天能转债!! | D229: 300569 | E229: 天能重工 | F229: 能源电力 | G229: 风能 | H229: 140 | I229: -3.0499999999999999e-002 | J229: -1.04e-002 | K229: 9.85 | L229: -4.0899999999999999e-002 | M229: 121.1 | N229: 7.91 | O229: 0.124 | P229: 124.53 | Q229: 转股中 | R229: 5年40天 | S229: 3年41天 | T229: 6.95 | U229: 95 | V229: 9.6999999999999989e-002 | W229: 8.900000000000001e-002 | X229: 0.111 | Y229: 78 | Z229: 2.83 | AA229: -2.8500000000000001e-002 | AB229: -3.5299999999999998e-002 | AC229: -8.7400000000000005e-002 | AD229: -8.9399999999999993e-002 | AE229: 85.42 | AF229: 89.38 | AG229: 1 | AH229: AA- | AI229: 6.2699999999999992e-002 | AJ229: =H229+100*O229 -> 152.40000000000001 | AK229: 155.5 | AL229: 218 | AM229: 66.1 | AN229: 239 | AO229: -3.6000000000000004e-002 | AP229: 14 | AQ229: 天能转债!!
A230: 339 | B230: 127006 | C230: 敖东转债! | D230: 623 | E230: 吉林敖东 | F230: 金融 | G230: 证券行业 | H230: 115.6 | I230: -6.1999999999999998e-003 | J230: 1.03e-002 | K230: 18.3 | L230: 1.1000000000000001e-002 | M230: 107.4 | N230: 20.22 | O230: 0.27699999999999997 | P230: 90.5 | Q230: 转股中 | R230: 2.50年 | S230: 0.50年 | T230: 24.1 | U230: 86 | V230: 2.9999999999999999e-002 | W230: 0.113 | X230: 0.10199999999999999 | Y230: 213 | Z230: 0.91 | AA230: -2.9300000000000003e-002 | AB230: -3.4599999999999999e-002 | AC230: -0.19500000000000001 | AD230: -0.19800000000000001 | AE230: 98.85 | AF230: 98.95 | AG230: 0.37 | AH230: AA+ | AI230: 3.3700000000000001e-002 | AJ230: =H230+100*O230 -> 143.29999999999998 | AK230: 140.7 | AL230: 99 | AM230: 41.7 | AN230: 71 | AO230: 0.105 | AP230: 28 | AQ230: 敖东转债!
A231: 186 | B231: 123052 | C231: 飞鹿转债! | D231: 300665 | E231: 飞鹿股份 | F231: 化工 | G231: 化工 | H231: 145.53 | I231: -1.38e-002 | J231: -1.9e-003 | K231: 9.93 | L231: -1.9699999999999999e-002 | M231: 126.8 | N231: 7.05 | O231: 3.3000000000000002e-002 | P231: 140.85 | Q231: 转股中 | R231: 4.73年 | S231: 2.73年 | T231: 1.5 | U231: 37 | V231: 0.16899999999999998 | W231: 8.6999999999999994e-002 | X231: 0.12300000000000001 | Y231: 17 | Z231: 3.42 | AA231: -2.9300000000000003e-002 | AB231: -3.8199999999999998e-002 | AC231: -0.107 | AD231: -0.11 | AE231: 85.79 | AF231: 91.98 | AG231: 0.8 | AH231: A+ | AI231: 7.2099999999999997e-002 | AJ231: =H231+100*O231 -> 148.83000000000001 | AK231: 150.2 | AL231: 187 | AM231: 58.2 | AN231: 187 | AO231: 8.0000000000000002e-003 | AP231: 25 | AQ231: 飞鹿转债!
A232: 280 | B232: 113536 | C232: 三星转债 | D232: 603578 | E232: 三星新材 | F232: 家电 | G232: 零部件制 | H232: 127.77 | I232: -1.21e-002 | J232: 4.5999999999999999e-003 | K232: 15.91 | L232: -1.1200000000000002e-002 | M232: 114.3 | N232: 13.76 | O232: 0.105 | P232: 115.63 | Q232: 转股中 | R232: 3.72年 | S232: 1.72年 | T232: 1.49 | U232: 9.2 | V232: 4.8000000000000001e-002 | W232: 7.2999999999999995e-002 | X232: 8.4000000000000005e-002 | Y232: 20 | Z232: 2.69 | AA232: -2.9999999999999999e-002 | AB232: -3.6600000000000001e-002 | AC232: -0.109 | AD232: -0.11199999999999999 | AE232: 95.5 | AF232: 99.02 | AG232: 0.67 | AH232: AA | AI232: 4.0099999999999997e-002 | AJ232: =H232+100*O232 -> 138.26999999999998 | AK232: 139.9 | AL232: 91 | AM232: 40.9 | AN232: 64 | AO232: 6.5000000000000002e-002 | AP232: 37 | AQ232: 三星转债
A233: 100 | B233: 123078 | C233: 飞凯转债!! | D233: 300398 | E233: 飞凯材料 | F233: 化工 | G233: 化工 | H233: 134.8 | I233: -1.7500000000000002e-002 | J233: 2.58e-002 | K233: 19.29 | L233: 1.1000000000000001e-002 | M233: 115.2 | N233: 15.56 | O233: 8.6999999999999994e-002 | P233: 123.97 | Q233: 转股中 | R233: 5.21年 | S233: 3.21年 | T233: 8.15 | U233: 84 | V233: 7.4999999999999997e-002 | W233: 8.199999999999999e-002 | X233: 0.10099999999999999 | Y233: 100 | Z233: 3.59 | AA233: -3.0200000000000001e-002 | AB233: -3.5200000000000002e-002 | AC233: -7.5300000000000006e-002 | AD233: -7.7100000000000002e-002 | AE233: 90.45 | AF233: 93.51 | AG233: 0.76 | AH233: AA | AI233: 4.1700000000000001e-002 | AJ233: =H233+100*O233 -> 143.5 | AK233: 145.6 | AL233: 148 | AM233: 52.1 | AN233: 150 | AO233: -2.2000000000000002e-002 | AP233: 8 | AQ233: 飞凯转债!!
A234: 288 | B234: 113024 | C234: 核建转债! | D234: 601611 | E234: 中国核建 | F234: 建筑 | G234: 建筑工程 | H234: 121.74 | I234: -1.2199999999999999e-002 | J234: 1.6200000000000003e-002 | K234: 9.75 | L234: 7.1999999999999998e-003 | M234: 109.3 | N234: 9.7 | O234: 0.21100000000000002 | P234: 100.52 | Q234: 转股中 | R234: 3.57年 | S234: 1.58年 | T234: 30 | U234: 95 | V234: 2.5000000000000001e-002 | W234: 0.11599999999999999 | X234: 0.11699999999999999 | Y234: 258 | Z234: 2.17 | AA234: -3.0299999999999997e-002 | AB234: -3.49e-002 | AC234: -9.3200000000000005e-002 | AD234: -9.5899999999999999e-002 | AE234: 97.18 | AF234: 97.52 | AG234: 0.56 | AH234: AAA | AI234: 3.3099999999999997e-002 | AJ234: =H234+100*O234 -> 142.84 | AK234: 143 | AL234: 125 | AM234: 45.4 | AN234: 101 | AO234: 0.16200000000000001 | AP234: 36 | AQ234: 核建转债!
A235: 109 | B235: 128137 | C235: 洁美转债 | D235: 2859 | E235: 洁美科技 | F235: 电子 | G235: 元器件制 | H235: 137.812 | I235: 1.0200000000000001e-002 | J235: -7.0999999999999995e-003 | K235: 30.32 | L235: 4.3e-003 | M235: 117.3 | N235: 27.63 | O235: 0.25600000000000001 | P235: 109.74 | Q235: 转股中 | R235: 5年54天 | S235: 3年55天 | T235: 5.99 | U235: 1.7 | V235: 2.e-003 | W235: 4.8000000000000001e-002 | X235: 5.2999999999999999e-002 | Y235: 124 | Z235: 6.57 | AA235: -3.1400000000000004e-002 | AB235: -3.7000000000000005e-002 | AC235: -8.2699999999999996e-002 | AD235: -8.4499999999999992e-002 | AE235: 85.04 | AF235: 86.35 | AG235: 0.72 | AH235: AA- | AI235: 6.2699999999999992e-002 | AJ235: =H235+100*O235 -> 163.41200000000001 | AK235: 165.9 | AL235: 267 | AM235: 79.5 | AN235: 282 | AO235: -2.7000000000000003e-002 | AP235: 4 | AQ235: 洁美转债
A236: 156 | B236: 128122 | C236: 兴森转债! | D236: 2436 | E236: 兴森科技 | F236: 电子 | G236: 元器件制 | H236: 127.8 | I236: 1.6000000000000001e-003 | J236: 4.7999999999999996e-003 | K236: 13.28 | L236: 1.37e-002 | M236: 113 | N236: 14.1 | O236: 0.35700000000000004 | P236: 94.18 | Q236: 转股中 | R236: 3.86年 | S236: 2.87年 | T236: 2.69 | U236: 47 | V236: 0.13699999999999998 | W236: 1.3999999999999999e-002 | X236: 1.3000000000000001e-002 | Y236: 198 | Z236: 6.02 | AA236: -3.1699999999999999e-002 | AB236: -3.7499999999999999e-002 | AC236: -6.8099999999999994e-002 | AD236: -7.0000000000000007e-002 | AE236: 91.8 | AF236: 97.24 | AG236: 0.46 | AH236: AA | AI236: 4.0099999999999997e-002 | AJ236: =H236+100*O236 -> 163.5 | AK236: 161.4 | AL236: 252 | AM236: 64.2 | AN236: 224 | AO236: -6.3e-002 | AP236: 12 | AQ236: 兴森转债!
A237: 103 | B237: 110077 | C237: 洪城转债 | D237: 600461 | E237: 洪城环境 | F237: 城市公用 | G237: 城市公用 | H237: 134.18 | I237: -4.6999999999999993e-003 | J237: -4.4000000000000003e-003 | K237: 8.63 | L237: -1.15e-002 | M237: 113.5 | N237: 6.71 | O237: 4.2999999999999997e-002 | P237: 128.61 | Q237: 转股中 | R237: 5.19年 | S237: 3.19年 | T237: 18 | U237: 53 | V237: 2.2000000000000002e-002 | W237: 0.22 | X237: 0.28300000000000003 | Y237: 82 | Z237: 1.59 | AA237: -3.2099999999999997e-002 | AB237: -3.6499999999999998e-002 | AC237: -7.8100000000000003e-002 | AD237: -7.9199999999999993e-002 | AE237: 90.66 | AF237: 94.36 | AG237: 0.8 | AH237: AA+ | AI237: 3.6699999999999997e-002 | AJ237: =H237+100*O237 -> 138.48000000000002 | AK237: 139.7 | AL237: 89 | AM237: 45.4 | AN237: 100 | AO237: 7.9000000000000001e-002 | AP237: 7 | AQ237: 洪城转债
A238: 48 | B238: 127031 | C238: 洋丰转债! | D238: 902 | E238: 新洋丰 | F238: 化工 | G238: 农化 | H238: 139.85 | I238: -1.38e-002 | J238: 1.9e-003 | K238: 21.17 | L238: -1.9e-002 | M238: 117.1 | N238: 19.94 | O238: 0.317 | P238: 106.17 | Q238: 28天 | R238: 5.53年 | S238: 3.54年 | T238: 10 | U238: 33 | V238: 2.3e-002 | W238: 3.6000000000000004e-002 | X238: 3.7999999999999999e-002 | Y238: 276 | Z238: 3.74 | AA238: -3.2099999999999997e-002 | AB238: -3.7200000000000004e-002 | AC238: -7.8399999999999997e-002 | AD238: -8.0000000000000002e-002 | AE238: 89.17 | AF238: 93.78 | AG238: 0.63 | AH238: AA | AI238: 4.1700000000000001e-002 | AJ238: =H238+100*O238 -> 171.54999999999998 | AK238: 173.5 | AL238: 288 | AM238: 79.7 | AN238: 284 | AO238: 3.1e-002 | AP238: 4 | AQ238: 洋丰转债!
A239: 303 | B239: 128057 | C239: 博彦转债 | D239: 2649 | E239: 博彦科技 | F239: 计算机及 | G239: 软件开发 | H239: 130.221 | I239: -1.4000000000000002e-003 | J239: 5.9999999999999995e-004 | K239: 10.46 | L239: -1.e-003 | M239: 116.3 | N239: 8.5 | O239: 5.7999999999999996e-002 | P239: 123.06 | Q239: 转股中 | R239: 3.48年 | S239: 1.48年 | T239: 4.94 | U239: 7.4 | V239: 1.2e-002 | W239: 8.900000000000001e-002 | X239: 0.109 | Y239: 56 | Z239: 1.84 | AA239: -3.2500000000000001e-002 | AB239: -4.0399999999999998e-002 | AC239: -0.11800000000000001 | AD239: -0.12 | AE239: 93.3 | AF239: 95 | AG239: 0.76 | AH239: AA- | AI239: 6.1100000000000002e-002 | AJ239: =H239+100*O239 -> 136.02100000000002 | AK239: 137.4 | AL239: 60 | AM239: 42.4 | AN239: 78 | AO239: 2.8999999999999998e-002 | AP239: 28 | AQ239: 博彦转债
A240: 128 | B240: 113603 | C240: 东缆转债! | D240: 603606 | E240: 东方电缆 | F240: 能源电力 | G240: 电力设备 | H240: 135.76 | I240: -2.4799999999999999e-002 | J240: -5.1999999999999998e-003 | K240: 26.72 | L240: -4.3700000000000003e-002 | M240: 115.1 | N240: 23.65 | O240: 0.20199999999999999 | P240: 112.98 | Q240: 转股中 | R240: 5年13天 | S240: 3年14天 | T240: 8 | U240: 52 | V240: 4.7e-002 | W240: 4.5999999999999999e-002 | X240: 5.2000000000000005e-002 | Y240: 175 | Z240: 4.95 | AA240: -3.2799999999999996e-002 | AB240: -3.7900000000000003e-002 | AC240: -8.1600000000000006e-002 | AD240: -8.3400000000000002e-002 | AE240: 91.01 | AF240: 94.09 | AG240: 0.69 | AH240: AA | AI240: 4.1700000000000001e-002 | AJ240: =H240+100*O240 -> 155.95999999999998 | AK240: 158.5 | AL240: 233 | AM240: 64.5 | AN240: 228 | AO240: 6.4000000000000001e-002 | AP240: 8 | AQ240: 东缆转债!
A241: 127 | B241: 128134 | C241: 鸿路转债! | D241: 2541 | E241: 鸿路钢构 | F241: 建筑 | G241: 其他建材 | H241: 136 | I241: -8.0000000000000002e-003 | J241: 1.1599999999999999e-002 | K241: 50.88 | L241: 4.8999999999999998e-003 | M241: 115.1 | N241: 43.51 | O241: 0.16300000000000001 | P241: 116.94 | Q241: 转股中 | R241: 5年28天 | S241: 3年29天 | T241: 15.7 | U241: 31 | V241: 1.3999999999999999e-002 | W241: 5.7999999999999996e-002 | X241: 6.8000000000000005e-002 | Y241: 270 | Z241: 4.4 | AA241: -3.2899999999999999e-002 | AB241: -3.7900000000000003e-002 | AC241: -8.1099999999999992e-002 | AD241: -8.2899999999999988e-002 | AE241: 90.86 | AF241: 93.93 | AG241: 0.72 | AH241: AA | AI241: 4.1700000000000001e-002 | AJ241: =H241+100*O241 -> 152.30000000000001 | AK241: 155.1 | AL241: 216 | AM241: 61.1 | AN241: 201 | AO241: -7.2999999999999995e-002 | AP241: 5 | AQ241: 鸿路转债!
A242: 3 | B242: 118002 | C242: 天合转债 | D242: 688599 | E242: 天合光能 | F242: 能源电力 | G242: 太阳能 | H242: 146.49 | I242: 2.4399999999999998e-002 | J242: -1.89e-002 | K242: 56.24 | L242: 8.3999999999999995e-003 | M242: 120.1 | N242: 50.51 | O242: 0.316 | P242: 111.34 | Q242: 5月14天 | R242: 5.92年 | S242: 3.92年 | T242: 52.5 | U242: 444 | V242: 5.7999999999999996e-002 | W242: 4.4999999999999998e-002 | X242: 5.0000000000000003e-002 | Y242: 1163. | Z242: 7.52 | AA242: -3.3500000000000002e-002 | AB242: -3.9e-002 | AC242: -8.1699999999999995e-002 | AD242: -8.3199999999999996e-002 | AE242: 87.78 | AF242: 94.67 | AG242: 0.65 | AH242: AA | AI242: 4.1700000000000001e-002 | AJ242: =H242+100*O242 -> 178.09 | AK242: 181.6 | AL242: 306 | AM242: 87 | AN242: 298 | AO242: 7.2999999999999995e-002 | AP242: 4 | AQ242: 天合转债
A243: 337 | B243: 128036 | C243: 金农转债!! | D243: 2548 | E243: 金新农 | F243: 农业 | G243: 畜牧业 | H243: 118.97 | I243: -3.5999999999999999e-003 | J243: 1.8e-003 | K243: 5.38 | L243: -1.2800000000000001e-002 | M243: 109.3 | N243: 6.93 | O243: 0.53200000000000003 | P243: 77.63 | Q243: 转股中 | R243: 2.49年 | S243: 0.49年 | T243: 1.46 | U243: 13 | V243: 7.4999999999999997e-002 | W243: 3.9e-002 | X243: 2.9999999999999999e-002 | Y243: 37 | Z243: 1.4 | AA243: -3.4000000000000002e-002 | AB243: -4.0599999999999997e-002 | AC243: -0.22800000000000001 | AD243: -0.23300000000000001 | AE243: 97.99 | AF243: 94.84 | AG243: 0.14 | AH243: AA- | AI243: 5.9699999999999996e-002 | AJ243: =H243+100*O243 -> 172.17000000000002 | AK243: 160.3 | AL243: 244 | AM243: 62.3 | AN243: 212 | AO243: 3.2000000000000001e-002 | AP243: 16 | AQ243: 金农转债!!
A244: 122 | B244: 127022 | C244: 恒逸转债 | D244: 703 | E244: 恒逸石化 | F244: 化工 | G244: 化工 | H244: 129.685 | I244: -1.01e-002 | J244: 1.1000000000000001e-003 | K244: 12.17 | L244: -1.3000000000000001e-002 | M244: 108.9 | N244: 11.2 | O244: 0.193 | P244: 108.66 | Q244: 转股中 | R244: 5年35天 | S244: 3年36天 | T244: 20 | U244: 27 | V244: 1.e-002 | W244: 4.4999999999999998e-002 | X244: 4.9000000000000002e-002 | Y244: 446 | Z244: 1.74 | AA244: -3.4200000000000001e-002 | AB244: -3.7200000000000004e-002 | AC244: -6.9500000000000006e-002 | AD244: -7.0900000000000005e-002 | AE244: 91.33 | AF244: 90.88 | AG244: 0.7 | AH244: AA+ | AI244: 3.6699999999999997e-002 | AJ244: =H244+100*O244 -> 148.98500000000001 | AK244: 150.7 | AL244: 192 | AM244: 59.4 | AN244: 191 | AO244: 2.6000000000000002e-002 | AP244: 7 | AQ244: 恒逸转债
A245: 94 | B245: 128140 | C245: 润建转债! | D245: 2929 | E245: 润建股份 | F245: 通信互联 | G245: 通信设备 | H245: 138.104 | I245: 1.8700000000000001e-002 | J245: -2.3099999999999999e-002 | K245: 30.72 | L245: -6.0999999999999995e-003 | M245: 115.2 | N245: 26.4 | O245: 0.187 | P245: 116.36 | Q245: 转股中 | R245: 5.24年 | S245: 3.24年 | T245: 10.9 | U245: 68 | V245: 4.4999999999999998e-002 | W245: 0.161 | X245: 0.187 | Y245: 68 | Z245: 2.07 | AA245: -3.4599999999999999e-002 | AB245: -3.95e-002 | AC245: -8.1300000000000011e-002 | AD245: -8.3100000000000007e-002 | AE245: 90.35 | AF245: 93.41 | AG245: 0.71 | AH245: AA | AI245: 4.1700000000000001e-002 | AJ245: =H245+100*O245 -> 156.804 | AK245: 159.8 | AL245: 238 | AM245: 66.4 | AN245: 240 | AO245: 4.2000000000000003e-002 | AP245: 12 | AQ245: 润建转债!
A246: 266 | B246: 128075 | C246: 远东转债! | D246: 2406 | E246: 远东传动 | F246: 汽车 | G246: 零部件制 | H246: 132.15 | I246: 1.52e-002 | J246: 3.5999999999999999e-003 | K246: 6.74 | L246: 2.4300000000000002e-002 | M246: 114.9 | N246: 5.29 | O246: 3.7000000000000005e-002 | P246: 127.41 | Q246: 转股中 | R246: 4年12天 | S246: 2年13天 | T246: 5.44 | U246: 19 | V246: 2.7000000000000003e-002 | W246: 0.129 | X246: 0.16500000000000001 | Y246: 42 | Z246: 1.31 | AA246: -3.4799999999999998e-002 | AB246: -4.0999999999999995e-002 | AC246: -0.106 | AD246: -0.109 | AE246: 94.92 | AF246: 98.4 | AG246: 0.77 | AH246: AA | AI246: 4.0099999999999997e-002 | AJ246: =H246+100*O246 -> 135.84999999999999 | AK246: 136.9 | AL246: 51 | AM246: 38.5 | AN246: 41 | AO246: 2.3e-002 | AP246: 16 | AQ246: 远东转债!
A247: 26 | B247: 127037 | C247: 银轮转债 | D247: 2126 | E247: 银轮股份 | F247: 汽车 | G247: 零部件制 | H247: 140.56 | I247: -6.6e-003 | J247: 6.6e-003 | K247: 11.71 | L247: 0. | M247: 115.1 | N247: 10.77 | O247: 0.29299999999999998 | P247: 108.73 | Q247: 3月2天 | R247: 5.74年 | S247: 3.74年 | T247: 7 | U247: 16 | V247: 1.6e-002 | W247: 7.4999999999999997e-002 | X247: 8.199999999999999e-002 | Y247: 93 | Z247: 2.22 | AA247: -3.4799999999999998e-002 | AB247: -3.9199999999999999e-002 | AC247: -7.5600000000000001e-002 | AD247: -7.7199999999999991e-002 | AE247: 88.44 | AF247: 91.43 | AG247: 0.67 | AH247: AA | AI247: 4.1700000000000001e-002 | AJ247: =H247+100*O247 -> 169.86000000000001 | AK247: 172.4 | AL247: 285 | AM247: 81 | AN247: 285 | AO247: 4.2000000000000003e-002 | AP247: 3 | AQ247: 银轮转债
A248: 262 | B248: 128078 | C248: 太极转债! | D248: 2368 | E248: 太极股份 | F248: 计算机及 | G248: 软件开发 | H248: 135 | I248: 1.1699999999999999e-002 | J248: -1.1699999999999999e-002 | K248: 25.7 | L248: 0. | M248: 116.9 | N248: 22.21 | O248: 0.16699999999999998 | P248: 115.71 | Q248: 转股中 | R248: 4年40天 | S248: 2年41天 | T248: 9.6 | U248: 48 | V248: 3.7000000000000005e-002 | W248: 6.4000000000000001e-002 | X248: 7.4999999999999997e-002 | Y248: 149 | Z248: 4.44 | AA248: -3.5099999999999999e-002 | AB248: -4.1900000000000007e-002 | AC248: -0.111 | AD248: -0.113 | AE248: 94.64 | AF248: 99.81 | AG248: 1 | AH248: AA | AI248: 4.0099999999999997e-002 | AJ248: =H248+100*O248 -> 151.69999999999999 | AK248: 154.3 | AL248: 211 | AM248: 54.5 | AN248: 167 | AO248: 0.13 | AP248: 10 | AQ248: 太极转债!
A249: 250 | B249: 128081 | C249: 海亮转债! | D249: 2203 | E249: 海亮股份 | F249: 有色金属 | G249: 铜金属 | H249: 133.118 | I249: 2.0799999999999999e-002 | J249: -1.3300000000000001e-002 | K249: 12.1 | L249: 1.e-002 | M249: 114.9 | N249: 9.69 | O249: 6.6000000000000003e-002 | P249: 124.87 | Q249: 转股中 | R249: 4.19年 | S249: 2.20年 | T249: 30.1 | U249: 135 | V249: 3.4000000000000002e-002 | W249: 0.126 | X249: 0.158 | Y249: 238 | Z249: 2.45 | AA249: -3.5200000000000002e-002 | AB249: -4.1100000000000005e-002 | AC249: -0.10199999999999999 | AD249: -0.10400000000000001 | AE249: 94.32 | AF249: 97.78 | AG249: 0.75 | AH249: AA | AI249: 4.0099999999999997e-002 | AJ249: =H249+100*O249 -> 139.71799999999999 | AK249: 141.4 | AL249: 107 | AM249: 43.6 | AN249: 88 | AO249: 6.8000000000000005e-002 | AP249: 51 | AQ249: 海亮转债!
A250: 27 | B250: 127036 | C250: 三花转债 | D250: 2050 | E250: 三花智控 | F250: 机械装备 | G250: 通用设备 | H250: 141 | I250: -1.9299999999999998e-002 | J250: -2.3599999999999999e-002 | K250: 24.68 | L250: -6.1200000000000004e-002 | M250: 114.5 | N250: 21.55 | O250: 0.23100000000000001 | P250: 114.52 | Q250: 2月28天 | R250: 5.72年 | S250: 3.72年 | T250: 30 | U250: 38 | V250: 9.0000000000000011e-003 | W250: 3.4000000000000002e-002 | X250: 3.9e-002 | Y250: 886 | Z250: 8.83 | AA250: -3.6200000000000003e-002 | AB250: -4.0500000000000001e-002 | AC250: -7.7899999999999997e-002 | AD250: -7.9199999999999993e-002 | AE250: 89.6 | AF250: 93.44 | AG250: 0.7 | AH250: AA+ | AI250: 3.6699999999999997e-002 | AJ250: =H250+100*O250 -> 164.09999999999999 | AK250: 167.5 | AL250: 274 | AM250: 74 | AN250: 270 | AO250: -2.2000000000000002e-002 | AP250: 5 | AQ250: 三花转债
A251: 343 | B251: 128035 | C251: 大族转债! | D251: 2008 | E251: 大族激光 | F251: 机械装备 | G251: 专用设备 | H251: 117.339 | I251: -2.2000000000000001e-003 | J251: 2.5000000000000001e-003 | K251: 41.68 | L251: 2.2000000000000001e-003 | M251: 107.4 | N251: 51.9 | O251: 0.46100000000000002 | P251: 80.31 | Q251: 转股中 | R251: 2.41年 | S251: 0.41年 | T251: 23 | U251: 39 | V251: 1.4999999999999999e-002 | W251: 5.2000000000000005e-002 | X251: 4.2000000000000003e-002 | Y251: 445 | Z251: 4.44 | AA251: -3.6499999999999998e-002 | AB251: -4.2000000000000003e-002 | AC251: -0.21100000000000002 | AD251: -0.223 | AE251: 101.85 | AF251: 99.26 | AG251: 0.15 | AH251: AA+ | AI251: 3.3700000000000001e-002 | AJ251: =H251+100*O251 -> 163.43899999999999 | AK251: 154.4 | AL251: 212 | AM251: 52.5 | AN251: 151 | AO251: -2.8999999999999998e-002 | AP251: 18 | AQ251: 大族转债!
A252: 19 | B252: 113051 | C252: 节能转债 | D252: 601016 | E252: 节能风电 | F252: 能源电力 | G252: 风能 | H252: 141.61 | I252: -1.9900000000000001e-002 | J252: 1.09e-002 | K252: 5.08 | L252: -1.1699999999999999e-002 | M252: 114.5 | N252: 4.05 | O252: 0.129 | P252: 125.43 | Q252: 3月16天 | R252: 5.78年 | S252: 3.78年 | T252: 30 | U252: 144 | V252: 3.3000000000000002e-002 | W252: 0.11800000000000001 | X252: 0.14800000000000002 | Y252: 255 | Z252: 2.5 | AA252: -3.6600000000000001e-002 | AB252: -4.0800000000000003e-002 | AC252: -7.7899999999999997e-002 | AD252: -7.9199999999999993e-002 | AE252: 89.42 | AF252: 93.26 | AG252: 0.77 | AH252: AA+ | AI252: 3.6699999999999997e-002 | AJ252: =H252+100*O252 -> 154.51000000000002 | AK252: 157.8 | AL252: 230 | AM252: 64.5 | AN252: 230 | AO252: 8.0000000000000002e-002 | AP252: 4 | AQ252: 节能转债
A253: 273 | B253: 113541 | C253: 荣晟转债! | D253: 603165 | E253: 荣晟环保 | F253: 造纸包装 | G253: 包装用纸 | H253: 131.93 | I253: -8.6e-003 | J253: 1.21e-002 | K253: 13.57 | L253: 4.4000000000000003e-003 | M253: 114.3 | N253: 10.84 | O253: 5.4000000000000006e-002 | P253: 125.18 | Q253: 转股中 | R253: 3.86年 | S253: 1.87年 | T253: 1.63 | U253: 14 | V253: 6.3e-002 | W253: 4.5999999999999999e-002 | X253: 5.7000000000000002e-002 | Y253: 36 | Z253: 2.11 | AA253: -3.7000000000000005e-002 | AB253: -4.3299999999999998e-002 | AC253: -0.11599999999999999 | AD253: -0.11800000000000001 | AE253: 91.2 | AF253: 91.27 | AG253: 0.78 | AH253: AA- | AI253: 6.1100000000000002e-002 | AJ253: =H253+100*O253 -> 137.33000000000001 | AK253: 138.7 | AL253: 76 | AM253: 47.4 | AN253: 119 | AO253: 9.0999999999999998e-002 | AP253: 44 | AQ253: 荣晟转债!
A254: 6 | B254: 123122 | C254: 富瀚转债 | D254: 300613 | E254: 富瀚微 | F254: 电子 | G254: 芯片制造 | H254: 149.897 | I254: 3.3099999999999997e-002 | J254: 7.9000000000000008e-003 | K254: 200.29 | L254: 5.4199999999999998e-002 | M254: 120.3 | N254: 177.04 | O254: 0.32500000000000001 | P254: 113.13 | Q254: 5月5天 | R254: 5.90年 | S254: 3.90年 | T254: 5.81 | U254: 561 | V254: 0.627 | W254: 2.4e-002 | X254: 2.7000000000000003e-002 | Y254: 241 | Z254: 16.06 | AA254: -3.7100000000000001e-002 | AB254: -4.2699999999999995e-002 | AC254: -8.72e-002 | AD254: -8.8699999999999987e-002 | AE254: 77.77 | AF254: 79.65 | AG254: 0.76 | AH254: A+ | AI254: 7.3700000000000002e-002 | AJ254: =H254+100*O254 -> 182.39699999999999 | AK254: 186.7 | AL254: 313 | AM254: 107 | AN254: 322 | AO254: -1.e-002 | AP254: 3 | AQ254: 富瀚转债
A255: 169 | B255: 110071 | C255: 湖盐转债! | D255: 600929 | E255: 雪天盐业 | F255: 食品饮料 | G255: 食品饮料 | H255: 137.63 | I255: -2.7300000000000001e-002 | J255: 1.7100000000000001e-002 | K255: 8.18 | L255: -1.3300000000000001e-002 | M255: 114.9 | N255: 6.52 | O255: 9.6999999999999989e-002 | P255: 125.46 | Q255: 转股中 | R255: 4.83年 | S255: 2.83年 | T255: 7.2 | U255: 43 | V255: 4.2999999999999997e-002 | W255: 9.4e-002 | X255: 0.11800000000000001 | Y255: 76 | Z255: 2.93 | AA255: -3.73e-002 | AB255: -4.2500000000000003e-002 | AC255: -9.1600000000000001e-002 | AD255: -9.35e-002 | AE255: 92 | AF255: 95.38 | AG255: 0.77 | AH255: AA | AI255: 4.0099999999999997e-002 | AJ255: =H255+100*O255 -> 147.32999999999998 | AK255: 149.8 | AL255: 184 | AM255: 54.4 | AN255: 166 | AO255: 6.0999999999999999e-002 | AP255: 23 | AQ255: 湖盐转债!
A256: 40 | B256: 113623 | C256: 凤21转债 | D256: 603225 | E256: 新凤鸣 | F256: 化工 | G256: 化纤 | H256: 144.53 | I256: -3.1300000000000001e-002 | J256: 2.5000000000000001e-003 | K256: 20.18 | L256: -3.9e-002 | M256: 117.1 | N256: 16.47 | O256: 0.17999999999999999 | P256: 122.53 | Q256: 34天 | R256: 5.57年 | S256: 3.58年 | T256: 25 | U256: 45 | V256: 1.2e-002 | W256: 8.1000000000000003e-002 | X256: 9.9000000000000005e-002 | Y256: 309 | Z256: 2.2 | AA256: -3.7699999999999997e-002 | AB256: -4.2699999999999995e-002 | AC256: -8.5699999999999998e-002 | AD256: -8.7300000000000003e-002 | AE256: 89.03 | AF256: 93.64 | AG256: 0.74 | AH256: AA | AI256: 4.1700000000000001e-002 | AJ256: =H256+100*O256 -> 162.53 | AK256: 166.5 | AL256: 270 | AM256: 72.9 | AN256: 267 | AO256: 7.0999999999999994e-002 | AP256: 3 | AQ256: 凤21转债
A257: 1 | B257: 123124 | C257: 晶瑞转2 | D257: 300655 | E257: 晶瑞电材 | F257: 电子 | G257: 电子行业 | H257: 139.5 | I257: 8.9399999999999993e-002 | J257: 3.2199999999999999e-002 | K257: 53.25 | L257: 0.158 | M257: 111.2 | N257: 50.31 | O257: 0.318 | P257: 105.84 | Q257: 5月13天 | R257: 5.93年 | S257: 3.93年 | T257: 5.23 | U257: 3461. | V257: 4.6100000000000003 | W257: 2.8999999999999998e-002 | X257: 3.1e-002 | Y257: 181 | Z257: 13.03 | AA257: -3.7900000000000003e-002 | AB257: -4.1200000000000001e-002 | AC257: -7.2300000000000003e-002 | AD257: -7.3399999999999993e-002 | AE257: 76.84 | AF257: 73.35 | AG257: 0.77 | AH257: A+ | AI257: 7.3700000000000002e-002 | AJ257: =H257+100*O257 -> 171.30000000000001 | AK257: 173.2 | AL257: 287 | AM257: 96.3 | AN257: 316 | AO257: 7.400000000000001e-002 | AP257: 2 | AQ257: 晶瑞转2
A258: 242 | B258: 113030 | C258: 东风转债! | D258: 601515 | E258: 东风股份 | F258: 造纸包装 | G258: 包装材料 | H258: 137.83 | I258: -2.7300000000000001e-002 | J258: 2.7300000000000001e-002 | K258: 7.86 | L258: 0. | M258: 116.9 | N258: 6.45 | O258: 0.13100000000000001 | P258: 121.86 | Q258: 转股中 | R258: 4.29年 | S258: 2.29年 | T258: 2.95 | U258: 87 | V258: 0.20999999999999999 | W258: 2.7999999999999997e-002 | X258: 3.4000000000000002e-002 | Y258: 105 | Z258: 2.37 | AA258: -3.8399999999999997e-002 | AB258: -4.4900000000000002e-002 | AC258: -0.111 | AD258: -0.113 | AE258: 93.99 | AF258: 99.12 | AG258: 0.73 | AH258: AA | AI258: 4.0099999999999997e-002 | AJ258: =H258+100*O258 -> 150.93000000000001 | AK258: 153.8 | AL258: 207 | AM258: 54.7 | AN258: 168 | AO258: 0.20000000000000001 | AP258: 18 | AQ258: 东风转债!
A259: 309 | B259: 128053 | C259: 尚荣转债! | D259: 2551 | E259: 尚荣医疗 | F259: 医药 | G259: 医疗器械 | H259: 130.968 | I259: -4.7999999999999996e-003 | J259: 4.7999999999999996e-003 | K259: 5.1 | L259: -5.7999999999999996e-003 | M259: 114.3 | N259: 4.88 | O259: 0.253 | P259: 104.51 | Q259: 转股中 | R259: 3.43年 | S259: 1.43年 | T259: 1.91 | U259: 23 | V259: 9.1999999999999998e-002 | W259: 4.4000000000000004e-002 | X259: 4.5999999999999999e-002 | Y259: 43 | Z259: 1.37 | AA259: -3.9599999999999996e-002 | AB259: -4.6699999999999998e-002 | AC259: -0.125 | AD259: -0.128 | AE259: 96.6 | AF259: 100.15 | AG259: 0 | AH259: AA | AI259: 4.0099999999999997e-002 | AJ259: =H259+100*O259 -> 156.268 | AK259: 157.4 | AL259: 228 | AM259: 57.3 | AN259: 183 | AO259: -4.0000000000000001e-003 | AP259: 24 | AQ259: 尚荣转债!
A260: 162 | B260: 127020 | C260: 中金转债 | D260: 60 | E260: 中金岭南 | F260: 有色金属 | G260: 有色行业 | H260: 138.799 | I260: -3.5999999999999999e-003 | J260: 7.4000000000000003e-003 | K260: 6.46 | L260: 4.6999999999999993e-003 | M260: 113.5 | N260: 4.63 | O260: -5.0000000000000001e-003 | P260: 139.52 | Q260: 转股中 | R260: 4.85年 | S260: 2.86年 | T260: 37.9 | U260: 546 | V260: 0.10300000000000001 | W260: 0.16399999999999998 | X260: 0.22899999999999998 | Y260: 231 | Z260: 1.94 | AA260: -4.1100000000000005e-002 | AB260: -4.58e-002 | AC260: -9.6500000000000002e-002 | AD260: -9.7699999999999995e-002 | AE260: 92.17 | AF260: 96.2 | AG260: 0.82 | AH260: AA+ | AI260: 3.5099999999999999e-002 | AJ260: =H260+100*O260 -> 138.29900000000001 | AK260: 138.1 | AL260: 67 | AM260: 41.9 | AN260: 73 | AO260: 0.11900000000000001 | AP260: 20 | AQ260: 中金转债
A261: 231 | B261: 128096 | C261: 奥瑞转债!! | D261: 2701 | E261: 奥瑞金 | F261: 造纸包装 | G261: 包装材料 | H261: 138.89 | I261: -4.7100000000000003e-002 | J261: 2.6200000000000001e-002 | K261: 6.1 | L261: -2.5600000000000001e-002 | M261: 115.5 | N261: 4.5 | O261: 2.5000000000000001e-002 | P261: 135.56 | Q261: 转股中 | R261: 4.42年 | S261: 2.42年 | T261: 6.74 | U261: 42 | V261: 4.4000000000000004e-002 | W261: 4.5999999999999999e-002 | X261: 6.2e-002 | Y261: 148 | Z261: 2.14 | AA261: -4.1700000000000001e-002 | AB261: -4.7500000000000001e-002 | AC261: -0.107 | AD261: -0.109 | AE261: 95.07 | AF261: 99.52 | AG261: 0.82 | AH261: AA+ | AI261: 3.5099999999999999e-002 | AJ261: =H261+100*O261 -> 141.38999999999999 | AK261: 142.2 | AL261: 110 | AM261: 42.7 | AN261: 80 | AO261: 3.9e-002 | AP261: 18 | AQ261: 奥瑞转债!!
A262: 9 | B262: 110081 | C262: 闻泰转债 | D262: 600745 | E262: 闻泰科技 | F262: 电子 | G262: 电子行业 | H262: 143.82 | I262: -4.7999999999999996e-003 | J262: 1.e-002 | K262: 108.8 | L262: 7.3000000000000001e-003 | M262: 111.9 | N262: 96.67 | O262: 0.27800000000000002 | P262: 112.55 | Q262: 4月26天 | R262: 5.88年 | S262: 3.88年 | T262: 86 | U262: 487 | V262: 3.9e-002 | W262: 6.3e-002 | X262: 7.0999999999999994e-002 | Y262: 1355. | Z262: 4.45 | AA262: -4.2199999999999994e-002 | AB262: -4.5700000000000005e-002 | AC262: -8.0700000000000008e-002 | AD262: -8.1699999999999995e-002 | AE262: 88.54 | AF262: 90.74 | AG262: 0.71 | AH262: AA+ | AI262: 3.6699999999999997e-002 | AJ262: =H262+100*O262 -> 171.62 | AK262: 175.1 | AL262: 290 | AM262: 84.3 | AN262: 294 | AO262: -1.9e-002 | AP262: 8 | AQ262: 闻泰转债
A263: 203 | B263: 123048 | C263: 应急转债! | D263: 300527 | E263: 中船应急 | F263: 机械装备 | G263: 专用设备 | H263: 137 | I263: -3.3500000000000002e-002 | J263: 1.3300000000000001e-002 | K263: 9.91 | L263: -3.0299999999999997e-002 | M263: 112.8 | N263: 8.88 | O263: 0.22800000000000001 | P263: 111.6 | Q263: 转股中 | R263: 4.58年 | S263: 2.58年 | T263: 3.79 | U263: 124 | V263: 0.23699999999999999 | W263: 4.0000000000000001e-002 | X263: 4.4000000000000004e-002 | Y263: 95 | Z263: 3.57 | AA263: -4.2300000000000004e-002 | AB263: -4.7e-002 | AC263: -9.8299999999999998e-002 | AD263: -0.10000000000000001 | AE263: 94.03 | AF263: 96.61 | AG263: 0.66 | AH263: AA+ | AI263: 3.5099999999999999e-002 | AJ263: =H263+100*O263 -> 159.80000000000001 | AK263: 162.4 | AL263: 256 | AM263: 65.8 | AN263: 236 | AO263: -4.7e-002 | AP263: 17 | AQ263: 应急转债!
A264: 87 | B264: 123085 | C264: 万顺转2!! | D264: 300057 | E264: 万顺新材 | F264: 有色金属 | G264: 铝金属 | H264: 141.6 | I264: 7.000000000000001e-004 | J264: 6.4000000000000003e-003 | K264: 8.36 | L264: 8.3999999999999995e-003 | M264: 113.3 | N264: 6.2 | O264: 5.0000000000000003e-002 | P264: 134.84 | Q264: 转股中 | R264: 5.25年 | S264: 3.25年 | T264: 8.72 | U264: 66 | V264: 5.4000000000000006e-002 | W264: 0.155 | X264: 0.20800000000000002 | Y264: 56 | Z264: 1.58 | AA264: -4.24e-002 | AB264: -4.6600000000000003e-002 | AC264: -8.7599999999999997e-002 | AD264: -8.9399999999999993e-002 | AE264: 84.52 | AF264: 82.91 | AG264: 0.85 | AH264: AA- | AI264: 6.2699999999999992e-002 | AJ264: =H264+100*O264 -> 146.59999999999999 | AK264: 148.4 | AL264: 176 | AM264: 63.8 | AN264: 222 | AO264: 5.0000000000000001e-003 | AP264: 25 | AQ264: 万顺转2!!
A265: 75 | B265: 113616 | C265: 韦尔转债! | D265: 603501 | E265: 韦尔股份 | F265: 电子 | G265: 元器件制 | H265: 143.6 | I265: -1.4000000000000002e-003 | J265: -5.6999999999999993e-003 | K265: 243.13 | L265: -1.09e-002 | M265: 114.5 | N265: 222.52 | O265: 0.314 | P265: 109.26 | Q265: 转股中 | R265: 5.30年 | S265: 3.30年 | T265: 24.3 | U265: 225 | V265: 6.4000000000000001e-002 | W265: 1.2e-002 | X265: 1.3000000000000001e-002 | Y265: 2112. | Z265: 16.13 | AA265: -4.24e-002 | AB265: -4.7e-002 | AC265: -9.1899999999999996e-002 | AD265: -9.3299999999999994e-002 | AE265: 90.98 | AF265: 94.88 | AG265: 0.65 | AH265: AA+ | AI265: 3.6699999999999997e-002 | AJ265: =H265+100*O265 -> 175. | AK265: 177.9 | AL265: 296 | AM265: 83.1 | AN265: 290 | AO265: -5.0000000000000003e-002 | AP265: 9 | AQ265: 韦尔转债!
A266: 88 | B266: 123086 | C266: 海兰转债!! | D266: 300065 | E266: 海兰信 | F266: 电子 | G266: 电子产品 | H266: 155.101 | I266: -2.3099999999999999e-002 | J266: 5.0000000000000001e-004 | K266: 10.85 | L266: -2.2499999999999999e-002 | M266: 123.5 | N266: 7.27 | O266: 3.9e-002 | P266: 149.24 | Q266: 转股中 | R266: 5.25年 | S266: 3.25年 | T266: 6.08 | U266: 252 | V266: 0.26800000000000002 | W266: 9.0999999999999998e-002 | X266: 0.13600000000000001 | Y266: 66 | Z266: 2.85 | AA266: -4.3200000000000002e-002 | AB266: -5.0199999999999995e-002 | AC266: -0.109 | AD266: -0.111 | AE266: 84.54 | AF266: 90.33 | AG266: 1 | AH266: AA- | AI266: 6.2699999999999992e-002 | AJ266: =H266+100*O266 -> 159.001 | AK266: 161 | AL266: 248 | AM266: 70.6 | AN266: 255 | AO266: 2.e-003 | AP266: 21 | AQ266: 海兰转债!!
A267: 92 | B267: 123083 | C267: 朗新转债 | D267: 300682 | E267: 朗新科技 | F267: 计算机及 | G267: 软件开发 | H267: 145 | I267: 1.3300000000000001e-002 | J267: 1.3100000000000001e-002 | K267: 21.56 | L267: 3.1600000000000003e-002 | M267: 115.1 | N267: 15.45 | O267: 3.9e-002 | P267: 139.55 | Q267: 转股中 | R267: 5.24年 | S267: 3.25年 | T267: 8 | U267: 91 | V267: 8.0000000000000002e-002 | W267: 3.6000000000000004e-002 | X267: 5.0999999999999997e-002 | Y267: 220 | Z267: 4.19 | AA267: -4.3799999999999999e-002 | AB267: -4.8600000000000004e-002 | AC267: -9.4499999999999987e-002 | AD267: -9.6199999999999994e-002 | AE267: 90.24 | AF267: 93.29 | AG267: 0.84 | AH267: AA | AI267: 4.1700000000000001e-002 | AJ267: =H267+100*O267 -> 148.90000000000001 | AK267: 150.5 | AL267: 189 | AM267: 57.2 | AN267: 182 | AO267: 9.6999999999999989e-002 | AP267: 6 | AQ267: 朗新转债
A268: 331 | B268: 110045 | C268: 海澜转债! | D268: 600398 | E268: 海澜之家 | F268: 服装纺织 | G268: 服装行业 | H268: 125.73 | I268: -4.3e-003 | J268: -5.9999999999999995e-004 | K268: 7.8 | L268: -7.6e-003 | M268: 110.3 | N268: 7.04 | O268: 0.13500000000000001 | P268: 110.8 | Q268: 转股中 | R268: 2.84年 | S268: 0.84年 | T268: 29.5 | U268: 37 | V268: 1.e-002 | W268: 8.8000000000000009e-002 | X268: 9.6999999999999989e-002 | Y268: 337 | Z268: 2.46 | AA268: -4.5499999999999999e-002 | AB268: -5.1799999999999999e-002 | AC268: -0.19399999999999998 | AD268: -0.19600000000000001 | AE268: 97.91 | AF268: 100.5 | AG268: 0.63 | AH268: AA+ | AI268: 3.3700000000000001e-002 | AJ268: =H268+100*O268 -> 139.23000000000002 | AK268: 140.7 | AL268: 97 | AM268: 40.2 | AN268: 54 | AO268: 6.0999999999999999e-002 | AP268: 49 | AQ268: 海澜转债!
A269: 285 | B269: 113026 | C269: 核能转债! | D269: 601985 | E269: 中国核电 | F269: 能源电力 | G269: 核电 | H269: 128.84 | I269: -1.67e-002 | J269: 3.3e-003 | K269: 6.91 | L269: -1.7100000000000001e-002 | M269: 109.3 | N269: 5.73 | O269: 6.8000000000000005e-002 | P269: 120.59 | Q269: 转股中 | R269: 3.59年 | S269: 1.59年 | T269: 78 | U269: 568 | V269: 5.5999999999999994e-002 | W269: 6.5000000000000002e-002 | X269: 7.8e-002 | Y269: 1206. | Z269: 1.93 | AA269: -4.5599999999999995e-002 | AB269: -5.0000000000000003e-002 | AC269: -0.10400000000000001 | AD269: -0.106 | AE269: 97.11 | AF269: 97.46 | AG269: 0.79 | AH269: AAA | AI269: 3.3099999999999997e-002 | AJ269: =H269+100*O269 -> 135.64000000000001 | AK269: 137.1 | AL269: 54 | AM269: 39.6 | AN269: 52 | AO269: 0.25900000000000001 | AP269: 43 | AQ269: 核能转债!
A270: 233 | B270: 128094 | C270: 星帅转债! | D270: 2860 | E270: 星帅尔 | F270: 家电 | G270: 零部件制 | H270: 148 | I270: -1.06e-002 | J270: 2.5000000000000001e-003 | K270: 19.63 | L270: -9.5999999999999992e-003 | M270: 121 | N270: 13.8 | O270: 4.0000000000000001e-002 | P270: 142.25 | Q270: 转股中 | R270: 4.35年 | S270: 2.35年 | T270: 2.19 | U270: 33 | V270: 0.10199999999999999 | W270: 5.5e-002 | X270: 7.8e-002 | Y270: 40 | Z270: 3.76 | AA270: -4.6199999999999998e-002 | AB270: -5.3899999999999997e-002 | AC270: -0.13100000000000001 | AD270: -0.13300000000000001 | AE270: 87.55 | AF270: 90.07 | AG270: 0.84 | AH270: A+ | AI270: 7.2099999999999997e-002 | AJ270: =H270+100*O270 -> 152. | AK270: 153.8 | AL270: 206 | AM270: 63.7 | AN270: 219 | AO270: 3.6000000000000004e-002 | AP270: 33 | AQ270: 星帅转债!
A271: 115 | B271: 123074 | C271: 隆利转债!! | D271: 300752 | E271: 隆利科技 | F271: 电子 | G271: 液晶显示 | H271: 158.18 | I271: 1.1999999999999999e-003 | J271: 7.0999999999999995e-003 | K271: 23.77 | L271: 1.11e-002 | M271: 124 | N271: 18.34 | O271: 0.22 | P271: 129.61 | Q271: 转股中 | R271: 5年48天 | S271: 3年49天 | T271: 1.48 | U271: 121 | V271: 0.52100000000000002 | W271: 3.1e-002 | X271: 4.0000000000000001e-002 | Y271: 48 | Z271: 5.68 | AA271: -4.7199999999999999e-002 | AB271: -5.4400000000000004e-002 | AC271: -0.11800000000000001 | AD271: -0.12 | AE271: 85.22 | AF271: 91.37 | AG271: 0.75 | AH271: AA- | AI271: 6.2699999999999992e-002 | AJ271: =H271+100*O271 -> 180.18000000000001 | AK271: 186.8 | AL271: 314 | AM271: 95.4 | AN271: 314 | AO271: -6.7000000000000004e-002 | AP271: 17 | AQ271: 隆利转债!!
A272: 78 | B272: 123091 | C272: 长海转债 | D272: 300196 | E272: 长海股份 | F272: 其他 | G272: 非金属矿 | H272: 149.4 | I272: -4.1100000000000005e-002 | J272: 5.0000000000000001e-003 | K272: 21.78 | L272: -4.3899999999999995e-002 | M272: 116.2 | N272: 16.14 | O272: 0.107 | P272: 134.94 | Q272: 转股中 | R272: 5.28年 | S272: 3.29年 | T272: 5.5 | U272: 149 | V272: 0.17899999999999999 | W272: 6.2e-002 | X272: 8.3000000000000004e-002 | Y272: 89 | Z272: 2.89 | AA272: -4.7300000000000002e-002 | AB272: -5.2300000000000006e-002 | AC272: -0.10099999999999999 | AD272: -0.10099999999999999 | AE272: 90.19 | AF272: 94.04 | AG272: 0.82 | AH272: AA | AI272: 4.1700000000000001e-002 | AJ272: =H272+100*O272 -> 160.09999999999999 | AK272: 163.9 | AL272: 262 | AM272: 69.8 | AN272: 250 | AO272: 7.5999999999999998e-002 | AP272: 3 | AQ272: 长海转债
A273: 352 | B273: 128026 | C273: 众兴转债! | D273: 2772 | E273: 众兴菌业 | F273: 农业 | G273: 种植业 | H273: 121.81 | I273: 7.0999999999999995e-003 | J273: 6.8000000000000005e-003 | K273: 12.41 | L273: 2.06e-002 | M273: 109.3 | N273: 11.36 | O273: 0.115 | P273: 109.24 | Q273: 转股中 | R273: 2.26年 | S273: 0.26年 | T273: 4.09 | U273: 133 | V273: 0.26700000000000002 | W273: 8.1000000000000003e-002 | X273: 8.900000000000001e-002 | Y273: 50 | Z273: 1.68 | AA273: -4.7699999999999992e-002 | AB273: -5.4900000000000004e-002 | AC273: -0.41399999999999998 | AD273: -0.42100000000000004 | AE273: 99.34 | AF273: 96.15 | AG273: 0.68 | AH273: AA- | AI273: 5.9699999999999996e-002 | AJ273: =H273+100*O273 -> 133.31 | AK273: 134.4 | AL273: 31 | AM273: 35 | AN273: 21 | AO273: 5.0000000000000001e-003 | AP273: 58 | AQ273: 众兴转债!
A274: 159 | B274: 123060 | C274: 苏试转债! | D274: 300416 | E274: 苏试试验 | F274: 机械装备 | G274: 专用设备 | H274: 148.581 | I274: 2.5999999999999999e-003 | J274: -5.0000000000000001e-004 | K274: 23.73 | L274: 2.5000000000000001e-003 | M274: 117.2 | N274: 18.28 | O274: 0.14499999999999999 | P274: 129.81 | Q274: 转股中 | R274: 4.86年 | S274: 2.86年 | T274: 3.1 | U274: 10 | V274: 2.2000000000000002e-002 | W274: 4.9000000000000002e-002 | X274: 6.4000000000000001e-002 | Y274: 63 | Z274: 6.52 | AA274: -4.8499999999999995e-002 | AB274: -5.4199999999999998e-002 | AC274: -0.11199999999999999 | AD274: -0.113 | AE274: 86.66 | AF274: 88.37 | AG274: 0.8 | AH274: AA- | AI274: 6.1100000000000002e-002 | AJ274: =H274+100*O274 -> 163.08099999999999 | AK274: 167.3 | AL274: 272 | AM274: 79 | AN274: 280 | AO274: -3.4000000000000002e-002 | AP274: 8 | AQ274: 苏试转债!
A275: 124 | B275: 123068 | C275: 弘信转债 | D275: 300657 | E275: 弘信电子 | F275: 电子 | G275: 元器件制 | H275: 156.3 | I275: -2.92e-002 | J275: 1.24e-002 | K275: 24 | L275: -1.9199999999999998e-002 | M275: 121.2 | N275: 15.34 | O275: -1.e-003 | P275: 156.45 | Q275: 转股中 | R275: 5年34天 | S275: 3年35天 | T275: 5.07 | U275: 335 | V275: 0.42399999999999999 | W275: 5.2000000000000005e-002 | X275: 8.1000000000000003e-002 | Y275: 98 | Z275: 6.19 | AA275: -4.9699999999999994e-002 | AB275: -5.62e-002 | AC275: -0.11599999999999999 | AD275: -0.11800000000000001 | AE275: 85.61 | AF275: 89.57 | AG275: 0.87 | AH275: AA- | AI275: 6.2699999999999992e-002 | AJ275: =H275+100*O275 -> 156.20000000000002 | AK275: 156.1 | AL275: 222 | AM275: 66.6 | AN275: 241 | AO275: 0.17999999999999999 | AP275: 11 | AQ275: 弘信转债
A276: 184 | B276: 113585 | C276: 寿仙转债! | D276: 603896 | E276: 寿仙谷 | F276: 医药 | G276: 中药 | H276: 148.8 | I276: 1.1599999999999999e-002 | J276: 1.37e-002 | K276: 41.55 | L276: 2.8999999999999998e-002 | M276: 117.3 | N276: 28.38 | O276: 1.6e-002 | P276: 146.41 | Q276: 转股中 | R276: 4.74年 | S276: 2.75年 | T276: 1.07 | U276: 41 | V276: 0.25900000000000001 | W276: 1.7000000000000001e-002 | X276: 2.5000000000000001e-002 | Y276: 63 | Z276: 4.48 | AA276: -4.9800000000000004e-002 | AB276: -5.57e-002 | AC276: -0.11599999999999999 | AD276: -0.11800000000000001 | AE276: 87.35 | AF276: 89.07 | AG276: 0.87 | AH276: AA- | AI276: 6.1100000000000002e-002 | AJ276: =H276+100*O276 -> 150.40000000000001 | AK276: 151.2 | AL276: 194 | AM276: 62.1 | AN276: 211 | AO276: 2.9999999999999999e-002 | AP276: 18 | AQ276: 寿仙转债!
A277: 138 | B277: 113039 | C277: 嘉泽转债! | D277: 601619 | E277: 嘉泽新能 | F277: 能源电力 | G277: 风能 | H277: 144.75 | I277: -2.9700000000000001e-002 | J277: 4.5000000000000005e-003 | K277: 4.95 | L277: -2.9399999999999999e-002 | M277: 112.8 | N277: 3.46 | O277: 1.2e-002 | P277: 143.06 | Q277: 转股中 | R277: 4.95年 | S277: 2.95年 | T277: 5.14 | U277: 404 | V277: 0.53600000000000003 | W277: 4.4000000000000004e-002 | X277: 6.3e-002 | Y277: 117 | Z277: 2.68 | AA277: -4.99e-002 | AB277: -5.4199999999999998e-002 | AC277: -0.10199999999999999 | AD277: -0.10300000000000001 | AE277: 91.46 | AF277: 93.17 | AG277: 0.86 | AH277: AA | AI277: 4.0099999999999997e-002 | AJ277: =H277+100*O277 -> 145.94999999999999 | AK277: 146.4 | AL277: 160 | AM277: 53.3 | AN277: 158 | AO277: 5.2999999999999999e-002 | AP277: 37 | AQ277: 嘉泽转债!
A278: 17 | B278: 113626 | C278: 伯特转债 | D278: 603596 | E278: 伯特利 | F278: 汽车 | G278: 零部件制 | H278: 163.51 | I278: 2.1899999999999999e-002 | J278: 8.3999999999999995e-003 | K278: 50.32 | L278: 3.7699999999999997e-002 | M278: 121.1 | N278: 36 | O278: 0.17000000000000001 | P278: 139.78 | Q278: 3月27天 | R278: 5.80年 | S278: 3.80年 | T278: 9.02 | U278: 44 | V278: 2.9999999999999999e-002 | W278: 4.4000000000000004e-002 | X278: 6.0999999999999999e-002 | Y278: 206 | Z278: 6.78 | AA278: -5.1200000000000002e-002 | AB278: -5.6900000000000006e-002 | AC278: -0.105 | AD278: -0.107 | AE278: 88.22 | AF278: 95.94 | AG278: 0.8 | AH278: AA | AI278: 4.1700000000000001e-002 | AJ278: =H278+100*O278 -> 180.50999999999999 | AK278: 187.2 | AL278: 316 | AM278: 91.3 | AN278: 307 | AO278: 0.127 | AP278: 3 | AQ278: 伯特转债
A279: 62 | B279: 118000 | C279: 嘉元转债 | D279: 688388 | E279: 嘉元科技 | F279: 电子 | G279: 电子产品 | H279: 161.97 | I279: 5.9999999999999995e-004 | J279: -1.0500000000000001e-002 | K279: 117 | L279: -1.1699999999999999e-002 | M279: 121 | N279: 78.74 | O279: 8.9999999999999997e-002 | P279: 148.59 | Q279: 转股中 | R279: 5.45年 | S279: 3.45年 | T279: 12.4 | U279: 111 | V279: 5.5999999999999994e-002 | W279: 4.5999999999999999e-002 | X279: 6.8000000000000005e-002 | Y279: 270 | Z279: 9.66 | AA279: -5.2999999999999999e-002 | AB279: -5.9000000000000004e-002 | AC279: -0.113 | AD279: -0.114 | AE279: 83.57 | AF279: 87.46 | AG279: 0.84 | AH279: AA- | AI279: 6.2699999999999992e-002 | AJ279: =H279+100*O279 -> 170.97 | AK279: 175.3 | AL279: 291 | AM279: 87.9 | AN279: 300 | AO279: 4.7e-002 | AP279: 5 | AQ279: 嘉元转债
A280: 369 | B280: 128013 | C280: 洪涛转债! | D280: 2325 | E280: 洪涛股份 | F280: 建筑 | G280: 装饰工程 | H280: 113.391 | I280: -1.8500000000000003e-002 | J280: 5.7999999999999996e-003 | K280: 2.56 | L280: -1.9199999999999998e-002 | M280: 108 | N280: 2.32 | O280: 2.7999999999999997e-002 | P280: 110.34 | Q280: 转股中 | R280: 0.88年 | S280: 回售内 | T280: 11.5 | U280: 85 | V280: 6.4000000000000001e-002 | W280: 0.35499999999999998 | X280: 0.39200000000000002 | Y280: 32 | Z280: 1.16 | AA280: -5.3699999999999998e-002 | AB280: -6.9599999999999995e-002 | AC280: 回售内 | AD280: 回售内 | AE280: 100.33 | AF280: 100.2 | AG280: 0.66 | AH280: A- | AI280: 8.8699999999999987e-002 | AJ280: =H280+100*O280 -> 116.191 | AK280: 116.4 | AL280: 1 | AM280: 16.1 | AN280: 1 | AO280: 6.7000000000000004e-002 | AP280: 99 | AQ280: 洪涛转债!
A281: 89 | B281: 123084 | C281: 高澜转债!! | D281: 300499 | E281: 高澜股份 | F281: 能源电力 | G281: 电力设备 | H281: 164.971 | I281: 3.5999999999999999e-003 | J281: -2.6699999999999998e-002 | K281: 13.44 | L281: -2.6800000000000001e-002 | M281: 121.9 | N281: 9 | O281: 0.105 | P281: 149.33 | Q281: 转股中 | R281: 5.25年 | S281: 3.25年 | T281: 2.68 | U281: 109 | V281: 0.251 | W281: 7.2000000000000008e-002 | X281: 0.107 | Y281: 37 | Z281: 4.52 | AA281: -5.7200000000000001e-002 | AB281: -6.3700000000000007e-002 | AC281: -0.122 | AD281: -0.124 | AE281: 82.49 | AF281: 84.76 | AG281: 0.86 | AH281: A+ | AI281: 7.3700000000000002e-002 | AJ281: =H281+100*O281 -> 175.471 | AK281: 180.6 | AL281: 303 | AM281: 95.8 | AN281: 315 | AO281: 6.9999999999999993e-003 | AP281: 17 | AQ281: 高澜转债!!
A282: 215 | B282: 128101 | C282: 联创转债! | D282: 2036 | E282: 联创电子 | F282: 电子 | G282: 液晶显示 | H282: 149.3 | I282: -9.1000000000000004e-003 | J282: 1.04e-002 | K282: 16.4 | L282: 1.8e-003 | M282: 114.8 | N282: 13.72 | O282: 0.249 | P282: 119.53 | Q282: 转股中 | R282: 4.51年 | S282: 2.51年 | T282: 3 | U282: 98 | V282: 0.21600000000000003 | W282: 1.7000000000000001e-002 | X282: 2.1000000000000001e-002 | Y282: 174 | Z282: 4.6 | AA282: -5.7599999999999998e-002 | AB282: -6.2899999999999998e-002 | AC282: -0.128 | AD282: -0.13 | AE282: 93.06 | AF282: 96.48 | AG282: 0.72 | AH282: AA | AI282: 4.0099999999999997e-002 | AJ282: =H282+100*O282 -> 174.20000000000002 | AK282: 179.1 | AL282: 301 | AM282: 82.6 | AN282: 288 | AO282: -3.4000000000000002e-002 | AP282: 15 | AQ282: 联创转债!
A283: 367 | B283: 128014 | C283: 永东转债! | D283: 2753 | E283: 永东股份 | F283: 化工 | G283: 化工 | H283: 120.8 | I283: 0. | J283: -9.4999999999999998e-003 | K283: 11.92 | L283: -2.3799999999999998e-002 | M283: 109.8 | N283: 12.52 | O283: 0.26899999999999996 | P283: 95.21 | Q283: 转股中 | R283: 1.60年 | S283: 回售内 | T283: 3.37 | U283: 26 | V283: 6.3e-002 | W283: 7.4999999999999997e-002 | X283: 7.2000000000000008e-002 | Y283: 45 | Z283: 2.18 | AA283: -5.8499999999999996e-002 | AB283: -6.9000000000000006e-002 | AC283: 回售内 | AD283: 回售内 | AE283: 100.3 | AF283: 100.17 | AG283: 0.4 | AH283: AA- | AI283: 5.9699999999999996e-002 | AJ283: =H283+100*O283 -> 147.69999999999999 | AK283: 146.4 | AL283: 158 | AM283: 46.1 | AN283: 104 | AO283: 5.5999999999999994e-002 | AP283: 37 | AQ283: 永东转债!
A284: 344 | B284: 110043 | C284: 无锡转债! | D284: 600908 | E284: 无锡银行 | F284: 金融 | G284: 银行行业 | H284: 125.09 | I284: 2.1299999999999999e-002 | J284: 1.e-002 | K284: 6.42 | L284: 4.5599999999999995e-002 | M284: 108.3 | N284: 5.61 | O284: 9.3000000000000013e-002 | P284: 114.44 | Q284: 转股中 | R284: 2.39年 | S284: 无权 | T284: 29.2 | U284: 341 | V284: 9.3000000000000013e-002 | W284: 0.24399999999999999 | X284: 0.28000000000000003 | Y284: 120 | Z284: 0.93 | AA284: -5.9200000000000003e-002 | AB284: -6.5199999999999994e-002 | AC284: 无权 | AD284: 无权 | AE284: 无权 | AF284: 100.16 | AG284: 0.69 | AH284: AA+ | AI284: 3.3700000000000001e-002 | AJ284: =H284+100*O284 -> 134.39000000000001 | AK284: 135.7 | AL284: 43 | AM284: 35.6 | AN284: 26 | AO284: 0.11699999999999999 | AP284: 24 | AQ284: 无锡转债!
A285: 10 | B285: 118001 | C285: 金博转债 | D285: 688598 | E285: 金博股份 | F285: 能源电力 | G285: 太阳能 | H285: 173.94 | I285: 1.7299999999999999e-002 | J285: -1.4000000000000002e-003 | K285: 383 | L285: 1.9e-002 | M285: 121.6 | N285: 271.62 | O285: 0.23399999999999999 | P285: 141.01 | Q285: 4月21天 | R285: 5.86年 | S285: 3.87年 | T285: 6 | U285: 247 | V285: 0.23100000000000001 | W285: 2.e-002 | X285: 2.7999999999999997e-002 | Y285: 307 | Z285: 20.16 | AA285: -6.0299999999999999e-002 | AB285: -6.6000000000000003e-002 | AC285: -0.114 | AD285: -0.11599999999999999 | AE285: 78.79 | AF285: 80.91 | AG285: 0.84 | AH285: A+ | AI285: 7.3700000000000002e-002 | AJ285: =H285+100*O285 -> 197.34 | AK285: 206.9 | AL285: 325 | AM285: 126 | AN285: 334 | AO285: 0.10000000000000001 | AP285: 3 | AQ285: 金博转债
A286: 254 | B286: 110061 | C286: 川投转债 | D286: 600674 | E286: 川投能源 | F286: 能源电力 | G286: 水电 | H286: 143.28 | I286: -3.1200000000000002e-002 | J286: -1.44e-002 | K286: 12.54 | L286: -5.3600000000000002e-002 | M286: 110.8 | N286: 9.2 | O286: 5.0999999999999997e-002 | P286: 136.3 | Q286: 转股中 | R286: 4.17年 | S286: 2.17年 | T286: 39.6 | U286: 99 | V286: 1.7000000000000001e-002 | W286: 7.2000000000000008e-002 | X286: 9.8000000000000004e-002 | Y286: 553 | Z286: 1.91 | AA286: -6.0999999999999999e-002 | AB286: -6.5199999999999994e-002 | AC286: -0.13100000000000001 | AD286: -0.10099999999999999 | AE286: 95.81 | AF286: 97.02 | AG286: 0.85 | AH286: AAA | AI286: 3.3099999999999997e-002 | AJ286: =H286+100*O286 -> 148.38 | AK286: 150.3 | AL286: 188 | AM286: 53.2 | AN286: 156 | AO286: 7.400000000000001e-002 | AP286: 14 | AQ286: 川投转债
A287: 201 | B287: 110070 | C287: 凌钢转债! | D287: 600231 | E287: 凌钢股份 | F287: 钢铁 | G287: 炼钢 | H287: 155.99 | I287: 2.e-002 | J287: -3.4700000000000002e-002 | K287: 3.88 | L287: -1.77e-002 | M287: 117.4 | N287: 2.69 | O287: 8.1000000000000003e-002 | P287: 144.24 | Q287: 转股中 | R287: 4.59年 | S287: 2.59年 | T287: 2.17 | U287: 335 | V287: 0.99299999999999999 | W287: 2.e-002 | X287: 2.7999999999999997e-002 | Y287: 111 | Z287: 1.2 | AA287: -6.1200000000000004e-002 | AB287: -6.7199999999999996e-002 | AC287: -0.13699999999999998 | AD287: -0.13900000000000001 | AE287: 93.19 | AF287: 98.41 | AG287: 0.83 | AH287: AA | AI287: 4.0099999999999997e-002 | AJ287: =H287+100*O287 -> 164.09 | AK287: 167.7 | AL287: 275 | AM287: 69.3 | AN287: 248 | AO287: 0.13200000000000001 | AP287: 25 | AQ287: 凌钢转债!
A288: 76 | B288: 123092 | C288: 天壕转债! | D288: 300332 | E288: 天壕环境 | F288: 石油天然 | G288: 天然气 | H288: 169.67 | I288: -1.47e-002 | J288: 1.4000000000000002e-003 | K288: 7.6 | L288: -1.55e-002 | M288: 121.6 | N288: 5.19 | O288: 0.159 | P288: 146.44 | Q288: 转股中 | R288: 5.29年 | S288: 3.29年 | T288: 4.23 | U288: 136 | V288: 0.18899999999999997 | W288: 6.3e-002 | X288: 9.3000000000000013e-002 | Y288: 67 | Z288: 1.97 | AA288: -6.2300000000000001e-002 | AB288: -6.8600000000000008e-002 | AC288: -0.128 | AD288: -0.13 | AE288: 82.1 | AF288: 84.3 | AG288: 0.85 | AH288: A+ | AI288: 7.3700000000000002e-002 | AJ288: =H288+100*O288 -> 185.56999999999999 | AK288: 192.9 | AL288: 320 | AM288: 108.6 | AN288: 323 | AO288: 8.9999999999999997e-002 | AP288: 9 | AQ288: 天壕转债!
A289: 368 | B289: 113011 | C289: 光大转债 | D289: 601818 | E289: 光大银行 | F289: 金融 | G289: 银行行业 | H289: 117.77 | I289: 7.4000000000000003e-003 | J289: -4.6999999999999993e-003 | K289: 3.56 | L289: 5.6000000000000008e-003 | M289: 106.8 | N289: 3.55 | O289: 0.17399999999999999 | P289: 100.28 | Q289: 转股中 | R289: 1.52年 | S289: 无权 | T289: 242 | U289: 367 | V289: 1.3000000000000001e-002 | W289: 0.126 | X289: 0.126 | Y289: 1924. | Z289: 0.54 | AA289: -6.3200000000000006e-002 | AB289: -7.0999999999999994e-002 | AC289: 无权 | AD289: 无权 | AE289: 无权 | AF289: 101.92 | AG289: 0.47 | AH289: AAA | AI289: 3.1699999999999999e-002 | AJ289: =H289+100*O289 -> 135.16999999999999 | AK289: 135.3 | AL289: 38 | AM289: 33.3 | AN289: 14 | AO289: 4.5999999999999999e-002 | AP289: 14 | AQ289: 光大转债
A290: 359 | B290: 113502 | C290: 嘉澳转债! | D290: 603822 | E290: 嘉澳环保 | F290: 化工 | G290: 化工 | H290: 128.31 | I290: 8.9999999999999998e-004 | J290: 7.7000000000000002e-003 | K290: 46.21 | L290: 1.52e-002 | M290: 111.3 | N290: 44.64 | O290: 0.23999999999999999 | P290: 103.52 | Q290: 转股中 | R290: 2.17年 | S290: 0.17年 | T290: 1.85 | U290: 26 | V290: 0.109 | W290: 5.4000000000000006e-002 | X290: 5.5999999999999994e-002 | Y290: 34 | Z290: 4.16 | AA290: -6.4699999999999994e-002 | AB290: -7.3399999999999993e-002 | AC290: -0.66700000000000004 | AD290: -0.67500000000000004 | AE290: 99.86 | AF290: 98.41 | AG290: 0.56 | AH290: AA- | AI290: 5.9699999999999996e-002 | AJ290: =H290+100*O290 -> 152.31 | AK290: 153.1 | AL290: 204 | AM290: 53.2 | AN290: 157 | AO290: 4.0000000000000001e-002 | AP290: 37 | AQ290: 嘉澳转债!
A291: 33 | B291: 113048 | C291: 晶科转债! | D291: 601778 | E291: 晶科科技 | F291: 能源电力 | G291: 太阳能 | H291: 170.03 | I291: -1.e-002 | J291: -5.6000000000000008e-003 | K291: 9.18 | L291: -1.7100000000000001e-002 | M291: 117.1 | N291: 5.48 | O291: 1.4999999999999999e-002 | P291: 167.52 | Q291: 49天 | R291: 5.61年 | S291: 3.62年 | T291: 30 | U291: 811 | V291: 0.158 | W291: 0.11800000000000001 | X291: 0.19800000000000001 | Y291: 254 | Z291: 2.28 | AA291: -6.5199999999999994e-002 | AB291: -7.0000000000000007e-002 | AC291: -0.11900000000000001 | AD291: -0.12 | AE291: 88.88 | AF291: 93.48 | AG291: 0.91 | AH291: AA | AI291: 4.1700000000000001e-002 | AJ291: =H291+100*O291 -> 171.53 | AK291: 172.5 | AL291: 286 | AM291: 79.1 | AN291: 281 | AO291: 6.2e-002 | AP291: 14 | AQ291: 晶科转债!
A292: 188 | B292: 128109 | C292: 楚江转债 | D292: 2171 | E292: 楚江新材 | F292: 有色金属 | G292: 铜金属 | H292: 157.6 | I292: 3.4300000000000004e-002 | J292: 2.7699999999999999e-002 | K292: 13.26 | L292: 7.0199999999999999e-002 | M292: 114.9 | N292: 8.63 | O292: 2.6000000000000002e-002 | P292: 153.65 | Q292: 转股中 | R292: 4.73年 | S292: 2.73年 | T292: 18.3 | U292: 391 | V292: 0.13500000000000001 | W292: 0.10300000000000001 | X292: 0.159 | Y292: 177 | Z292: 3.14 | AA292: -6.5700000000000008e-002 | AB292: -7.0699999999999999e-002 | AC292: -0.13400000000000001 | AD292: -0.13600000000000001 | AE292: 92.36 | AF292: 95.75 | AG292: 0.88 | AH292: AA | AI292: 4.0099999999999997e-002 | AJ292: =H292+100*O292 -> 160.19999999999999 | AK292: 161.5 | AL292: 253 | AM292: 65.8 | AN292: 237 | AO292: 0.14400000000000002 | AP292: 7 | AQ292: 楚江转债
A293: 15 | B293: 127040 | C293: 国泰转债 | D293: 2091 | E293: 江苏国泰 | F293: 商业零售 | G293: 商业零售 | H293: 166.99 | I293: 1.21e-002 | J293: 1.1699999999999999e-002 | K293: 15.04 | L293: 2.5899999999999999e-002 | M293: 112.5 | N293: 9.02 | O293: 1.e-003 | P293: 166.74 | Q293: 4月5天 | R293: 5.82年 | S293: 3.82年 | T293: 45.6 | U293: 510 | V293: 6.7000000000000004e-002 | W293: 0.19399999999999998 | X293: 0.32299999999999995 | Y293: 235 | Z293: 2.55 | AA293: -6.6400000000000001e-002 | AB293: -6.9900000000000004e-002 | AC293: -0.11 | AD293: -0.111 | AE293: 89.28 | AF293: 91.49 | AG293: 0.92 | AH293: AA+ | AI293: 3.6699999999999997e-002 | AJ293: =H293+100*O293 -> 167.09 | AK293: 167.2 | AL293: 271 | AM293: 75.8 | AN293: 273 | AO293: 0.13 | AP293: 8 | AQ293: 国泰转债
A294: 245 | B294: 128085 | C294: 鸿达转债!! | D294: 2002 | E294: 鸿达兴业 | F294: 化工 | G294: 化工 | H294: 165.822 | I294: -2.3700000000000002e-002 | J294: -3.4000000000000002e-003 | K294: 6.47 | L294: -2.7099999999999999e-002 | M294: 124.4 | N294: 3.91 | O294: 2.e-003 | P294: 165.47 | Q294: 转股中 | R294: 4.26年 | S294: 2.27年 | T294: 4.31 | U294: 430 | V294: 0.59499999999999997 | W294: 2.2000000000000002e-002 | X294: 3.7000000000000005e-002 | Y294: 195 | Z294: 2.07 | AA294: -6.6500000000000004e-002 | AB294: -7.51e-002 | AC294: -0.128 | AD294: -0.13 | AE294: 70.95 | AF294: 64.37 | AG294: 1 | AH294: B | AI294: 0.1721 | AJ294: =H294+100*O294 -> 166.02199999999999 | AK294: 166.2 | AL294: 269 | AM294: 95.2 | AN294: 313 | AO294: 9.3000000000000013e-002 | AP294: 100 | AQ294: 鸿达转债!!
A295: 224 | B295: 123043 | C295: 正元转债 | D295: 300645 | E295: 正元智慧 | F295: 计算机及 | G295: 软件开发 | H295: 164.14 | I295: -2.5899999999999999e-002 | J295: -1.7100000000000001e-002 | K295: 21.61 | L295: -5.1799999999999999e-002 | M295: 120.9 | N295: 15.38 | O295: 0.16800000000000001 | P295: 140.51 | Q295: 转股中 | R295: 4.48年 | S295: 2.48年 | T295: 1.66 | U295: 531 | V295: 1.9399999999999999 | W295: 5.9999999999999998e-002 | X295: 8.5000000000000006e-002 | Y295: 28 | Z295: 4.23 | AA295: -6.7299999999999999e-002 | AB295: -7.4499999999999997e-002 | AC295: -0.111 | AD295: -0.113 | AE295: 86.73 | AF295: 89.17 | AG295: 0.83 | AH295: A+ | AI295: 7.2099999999999997e-002 | AJ295: =H295+100*O295 -> 180.94 | AK295: 187.8 | AL295: 318 | AM295: 98.6 | AN295: 317 | AO295: 8.1000000000000003e-002 | AP295: 19 | AQ295: 正元转债
A296: 79 | B296: 123089 | C296: 九洲转2!! | D296: 300040 | E296: 九洲集团 | F296: 能源电力 | G296: 电力设备 | H296: 173.9 | I296: 3.7499999999999999e-002 | J296: 1.2e-002 | K296: 9.65 | L296: 5.4600000000000003e-002 | M296: 121 | N296: 5.68 | O296: 2.4e-002 | P296: 169.89 | Q296: 转股中 | R296: 5.28年 | S296: 3.28年 | T296: 3.07 | U296: 488 | V296: 0.91900000000000004 | W296: 5.5999999999999994e-002 | X296: 9.6000000000000002e-002 | Y296: 54 | Z296: 1.62 | AA296: -6.7599999999999993e-002 | AB296: -7.3700000000000002e-002 | AC296: -0.13600000000000001 | AD296: -0.13699999999999998 | AE296: 84.47 | AF296: 88.39 | AG296: 0.91 | AH296: AA- | AI296: 6.2699999999999992e-002 | AJ296: =H296+100*O296 -> 176.30000000000001 | AK296: 177.9 | AL296: 295 | AM296: 89.5 | AN296: 304 | AO296: 5.5e-002 | AP296: 22 | AQ296: 九洲转2!!
A297: 293 | B297: 123025 | C297: 精测转债!! | D297: 300567 | E297: 精测电子 | F297: 电子 | G297: 液晶显示 | H297: 148.8 | I297: 1.4800000000000001e-002 | J297: 5.4000000000000003e-003 | K297: 57.74 | L297: 2.8500000000000001e-002 | M297: 116.5 | N297: 49.37 | O297: 0.27200000000000002 | P297: 116.95 | Q297: 转股中 | R297: 3.55年 | S297: 1.55年 | T297: 3.09 | U297: 97 | V297: 0.21100000000000002 | W297: 1.9e-002 | X297: 2.2000000000000002e-002 | Y297: 161 | Z297: 5.03 | AA297: -6.7799999999999999e-002 | AB297: -7.5199999999999989e-002 | AC297: -0.16600000000000001 | AD297: -0.16800000000000001 | AE297: 92.97 | AF297: 94.8 | AG297: 0.71 | AH297: AA- | AI297: 6.1100000000000002e-002 | AJ297: =H297+100*O297 -> 176. | AK297: 180.6 | AL297: 304 | AM297: 85.8 | AN297: 295 | AO297: -8.3000000000000004e-002 | AP297: 16 | AQ297: 精测转债!!
A298: 120 | B298: 123070 | C298: 鹏辉转债! | D298: 300438 | E298: 鹏辉能源 | F298: 汽车 | G298: 零部件制 | H298: 165.919 | I298: 4.4000000000000003e-003 | J298: -2.0000000000000001e-004 | K298: 29.5 | L298: 4.7999999999999996e-003 | M298: 115.1 | N298: 20.08 | O298: 0.129 | P298: 146.91 | Q298: 转股中 | R298: 5年39天 | S298: 3年40天 | T298: 7.49 | U298: 103 | V298: 8.3000000000000004e-002 | W298: 5.9999999999999998e-002 | X298: 8.8000000000000009e-002 | Y298: 126 | Z298: 5.17 | AA298: -7.0300000000000001e-002 | AB298: -7.4900000000000008e-002 | AC298: -0.13200000000000001 | AD298: -0.13300000000000001 | AE298: 90.74 | AF298: 93.81 | AG298: 0.87 | AH298: AA | AI298: 4.1700000000000001e-002 | AJ298: =H298+100*O298 -> 178.81900000000002 | AK298: 184.9 | AL298: 312 | AM298: 91.1 | AN298: 306 | AO298: -6.3e-002 | AP298: 8 | AQ298: 鹏辉转债!
A299: 29 | B299: 123114 | C299: 三角转债 | D299: 300775 | E299: 三角防务 | F299: 航空航天 | G299: 航空航天 | H299: 182.65 | I299: -7.3000000000000001e-003 | J299: -5.1000000000000004e-003 | K299: 46.26 | L299: -1.47e-002 | M299: 121 | N299: 31.82 | O299: 0.25600000000000001 | P299: 145.38 | Q299: 2月21天 | R299: 5.70年 | S299: 3.70年 | T299: 9.04 | U299: 154 | V299: 9.3000000000000013e-002 | W299: 3.9e-002 | X299: 5.7000000000000002e-002 | Y299: 229 | Z299: 11.18 | AA299: -7.0800000000000002e-002 | AB299: -7.6399999999999996e-002 | AC299: -0.13 | AD299: -0.13200000000000001 | AE299: 82.32 | AF299: 86.14 | AG299: 0.85 | AH299: AA- | AI299: 6.2699999999999992e-002 | AJ299: =H299+100*O299 -> 208.25 | AK299: 219.9 | AL299: 334 | AM299: 133.8 | AN299: 338 | AO299: -6.0999999999999999e-002 | AP299: 5 | AQ299: 三角转债
A300: 41 | B300: 123111 | C300: 东财转3 | D300: 300059 | E300: 东方财富 | F300: 金融 | G300: 证券行业 | H300: 167.612 | I300: -4.8999999999999998e-003 | J300: 9.7000000000000003e-003 | K300: 35.45 | L300: 5.4000000000000003e-003 | M300: 110.5 | N300: 23.35 | O300: 0.10400000000000001 | P300: 151.82 | Q300: 33天 | R300: 5.57年 | S300: 3.57年 | T300: 158 | U300: 1202. | V300: 4.4999999999999998e-002 | W300: 4.2999999999999997e-002 | X300: 6.5000000000000002e-002 | Y300: 3664. | Z300: 10.07 | AA300: -7.2700000000000001e-002 | AB300: -7.5800000000000006e-002 | AC300: -0.12 | AD300: -0.121 | AE300: 89.2 | AF300: 90.6 | AG300: 0.88 | AH300: AA+ | AI300: 3.6699999999999997e-002 | AJ300: =H300+100*O300 -> 178.012 | AK300: 183.4 | AL300: 309 | AM300: 92.8 | AN300: 312 | AO300: 0.10199999999999999 | AP300: 23 | AQ300: 东财转3
A301: 248 | B301: 128082 | C301: 华锋转债!! | D301: 2806 | E301: 华锋股份 | F301: 电子 | G301: 元器件制 | H301: 166.667 | I301: -2.6499999999999999e-002 | J301: -9.7000000000000003e-003 | K301: 14.77 | L301: -4.0899999999999999e-002 | M301: 121.4 | N301: 9.13 | O301: 2.9999999999999999e-002 | P301: 161.77 | Q301: 转股中 | R301: 4.23年 | S301: 2.23年 | T301: 2.19 | U301: 189 | V301: 0.51000000000000001 | W301: 7.8e-002 | X301: 0.126 | Y301: 28 | Z301: 2.59 | AA301: -7.3800000000000004e-002 | AB301: -8.1500000000000003e-002 | AC301: -0.13100000000000001 | AD301: -0.13300000000000001 | AE301: 86.72 | AF301: 87.78 | AG301: 0.88 | AH301: A | AI301: 8.2100000000000006e-002 | AJ301: =H301+100*O301 -> 169.667 | AK301: 171.6 | AL301: 284 | AM301: 83.8 | AN301: 293 | AO301: -6.0999999999999999e-002 | AP301: 54 | AQ301: 华锋转债!!
A302: 340 | B302: 127005 | C302: 长证转债! | D302: 783 | E302: 长江证券 | F302: 金融 | G302: 证券行业 | H302: 130.99 | I302: 7.6e-003 | J302: 4.7899999999999998e-002 | K302: 8.53 | L302: 7.4299999999999991e-002 | M302: 108.3 | N302: 7.13 | O302: 9.5000000000000001e-002 | P302: 119.64 | Q302: 转股中 | R302: 2.50年 | S302: 无权 | T302: 50 | U302: 481 | V302: 7.2000000000000008e-002 | W302: 0.106 | X302: 0.127 | Y302: 472 | Z302: 1.64 | AA302: -7.4400000000000008e-002 | AB302: -8.0000000000000002e-002 | AC302: 无权 | AD302: 无权 | AE302: 无权 | AF302: 100.31 | AG302: 0.75 | AH302: AAA | AI302: 3.1699999999999999e-002 | AJ302: =H302+100*O302 -> 140.49000000000001 | AK302: 142.3 | AL302: 116 | AM302: 42 | AN302: 75 | AO302: 0.124 | AP302: 13 | AQ302: 长证转债!
A303: 251 | B303: 113550 | C303: 常汽转债! | D303: 603035 | E303: 常熟汽饰 | F303: 汽车 | G303: 零部件制 | H303: 166.43 | I303: 4.0199999999999993e-002 | J303: 4.7999999999999996e-003 | K303: 14.43 | L303: 5.1699999999999996e-002 | M303: 121.3 | N303: 9.33 | O303: 7.5999999999999998e-002 | P303: 154.66 | Q303: 转股中 | R303: 4.19年 | S303: 2.19年 | T303: 2.14 | U303: 283 | V303: 0.79700000000000004 | W303: 4.0999999999999995e-002 | X303: 6.4000000000000001e-002 | Y303: 52 | Z303: 1.35 | AA303: -7.4400000000000008e-002 | AB303: -8.2100000000000006e-002 | AC303: -0.13400000000000001 | AD303: -0.13600000000000001 | AE303: 90.81 | AF303: 95.26 | AG303: 0.87 | AH303: AA- | AI303: 6.1100000000000002e-002 | AJ303: =H303+100*O303 -> 174.03 | AK303: 178.2 | AL303: 297 | AM303: 82.9 | AN303: 289 | AO303: 6.3e-002 | AP303: 18 | AQ303: 常汽转债!
A304: 253 | B304: 123035 | C304: 利德转债!! | D304: 300296 | E304: 利亚德 | F304: 电子 | G304: LED制 | H304: 160.1 | I304: -1.84e-002 | J304: 2.0899999999999998e-002 | K304: 10.15 | L304: 3.0000000000000001e-003 | M304: 115.1 | N304: 6.96 | O304: 9.8000000000000004e-002 | P304: 145.83 | Q304: 转股中 | R304: 4.18年 | S304: 2.18年 | T304: 7.99 | U304: 145 | V304: 0.111 | W304: 3.1e-002 | X304: 4.4999999999999998e-002 | Y304: 258 | Z304: 3.5 | AA304: -7.7499999999999999e-002 | AB304: -8.3100000000000007e-002 | AC304: -0.127 | AD304: -0.129 | AE304: 95.65 | AF304: 99.99 | AG304: 0.86 | AH304: AA+ | AI304: 3.5099999999999999e-002 | AJ304: =H304+100*O304 -> 169.90000000000001 | AK304: 174.4 | AL304: 289 | AM304: 74.4 | AN304: 271 | AO304: 2.4e-002 | AP304: 14 | AQ304: 利德转债!!
A305: 229 | B305: 128097 | C305: 奥佳转债!! | D305: 2614 | E305: 奥佳华 | F305: 机械装备 | G305: 专用设备 | H305: 164 | I305: -1.04e-002 | J305: 9.300000000000001e-003 | K305: 14.88 | L305: -1.2999999999999999e-003 | M305: 114.9 | N305: 10.39 | O305: 0.14499999999999999 | P305: 143.21 | Q305: 转股中 | R305: 4.46年 | S305: 2.46年 | T305: 4.6 | U305: 9 | V305: 1.2e-002 | W305: 4.9000000000000002e-002 | X305: 7.0000000000000007e-002 | Y305: 94 | Z305: 2.02 | AA305: -7.8e-002 | AB305: -8.3299999999999999e-002 | AC305: -0.114 | AD305: -0.115 | AE305: 93.35 | AF305: 96.77 | AG305: 0.85 | AH305: AA | AI305: 4.0099999999999997e-002 | AJ305: =H305+100*O305 -> 178.5 | AK305: 184.8 | AL305: 311 | AM305: 88 | AN305: 301 | AO305: -3.4000000000000002e-002 | AP305: 19 | AQ305: 奥佳转债!!
A306: 53 | B306: 127029 | C306: 中钢转债 | D306: 928 | E306: 中钢国际 | F306: 建筑 | G306: 建筑工程 | H306: 185.35 | I306: -1.67e-002 | J306: -7.0999999999999995e-003 | K306: 11.06 | L306: -2.5600000000000001e-002 | M306: 117.5 | N306: 5.89 | O306: -1.3000000000000001e-002 | P306: 187.78 | Q306: 17天 | R306: 5.52年 | S306: 3.52年 | T306: 9.6 | U306: 406 | V306: 0.223 | W306: 6.9000000000000006e-002 | X306: 0.13 | Y306: 139 | Z306: 2.39 | AA306: -8.0199999999999994e-002 | AB306: -8.5099999999999995e-002 | AC306: -0.14199999999999999 | AD306: -0.14300000000000002 | AE306: 90.26 | AF306: 96.58 | AG306: 0.93 | AH306: AA+ | AI306: 3.6699999999999997e-002 | AJ306: =H306+100*O306 -> 184.04999999999998 | AK306: 182.9 | AL306: 307 | AM306: 86.3 | AN306: 297 | AO306: 5.5999999999999994e-002 | AP306: 15 | AQ306: 中钢转债
A307: 346 | B307: 128033 | C307: 迪龙转债! | D307: 2658 | E307: 雪迪龙 | F307: 城市公用 | G307: 三废处理 | H307: 132.07 | I307: 9.5999999999999992e-003 | J307: 2.29e-002 | K307: 10.15 | L307: 4.53e-002 | M307: 108.8 | N307: 8.71 | O307: 0.13300000000000001 | P307: 116.53 | Q307: 转股中 | R307: 2.30年 | S307: 0.30年 | T307: 2.98 | U307: 207 | V307: 0.52300000000000002 | W307: 4.7e-002 | X307: 5.4000000000000006e-002 | Y307: 64 | Z307: 2.66 | AA307: -8.2200000000000009e-002 | AB307: -8.8499999999999995e-002 | AC307: -0.53000000000000003 | AD307: -0.53500000000000003 | AE307: 99.79 | AF307: 99.86 | AG307: 0.72 | AH307: AA | AI307: 3.8699999999999998e-002 | AJ307: =H307+100*O307 -> 145.37 | AK307: 147.6 | AL307: 170 | AM307: 47.7 | AN307: 121 | AO307: 0.10000000000000001 | AP307: 35 | AQ307: 迪龙转债!
A308: 364 | B308: 113013 | C308: 国君转债! | D308: 601211 | E308: 国泰君安 | F308: 金融 | G308: 证券行业 | H308: 125.12 | I308: 5.8999999999999999e-003 | J308: 8.0000000000000002e-003 | K308: 18.95 | L308: 2.6000000000000002e-002 | M308: 106.8 | N308: 18.45 | O308: 0.218 | P308: 102.71 | Q308: 转股中 | R308: 1.82年 | S308: 无权 | T308: 69.9 | U308: 284 | V308: 3.2000000000000001e-002 | W308: 4.0999999999999995e-002 | X308: 4.2999999999999997e-002 | Y308: 1688. | Z308: 1.31 | AA308: -8.3900000000000002e-002 | AB308: -9.0299999999999991e-002 | AC308: 无权 | AD308: 无权 | AE308: 无权 | AF308: 100.95 | AG308: 0.54 | AH308: AAA | AI308: 3.1699999999999999e-002 | AJ308: =H308+100*O308 -> 146.92000000000002 | AK308: 147.5 | AL308: 169 | AM308: 46.6 | AN308: 108 | AO308: 6.4000000000000001e-002 | AP308: 12 | AQ308: 国君转债!
A309: 223 | B309: 113568 | C309: 新春转债!! | D309: 603667 | E309: 五洲新春 | F309: 机械装备 | G309: 通用设备 | H309: 183.71 | I309: -5.2900000000000003e-002 | J309: 2.92e-002 | K309: 15.8 | L309: -2.5899999999999999e-002 | M309: 124.3 | N309: 8.75 | O309: 1.7000000000000001e-002 | P309: 180.57 | Q309: 转股中 | R309: 4.48年 | S309: 2.49年 | T309: 2.74 | U309: 355 | V309: 0.68900000000000006 | W309: 5.7999999999999996e-002 | X309: 0.105 | Y309: 47 | Z309: 2.6 | AA309: -8.5099999999999995e-002 | AB309: -9.3100000000000002e-002 | AC309: -0.13300000000000001 | AD309: -0.13400000000000001 | AE309: 89.23 | AF309: 95.9 | AG309: 0.92 | AH309: AA- | AI309: 6.1100000000000002e-002 | AJ309: =H309+100*O309 -> 185.41 | AK309: 186.8 | AL309: 315 | AM309: 90.9 | AN309: 305 | AO309: 0.129 | AP309: 46 | AQ309: 新春转债!!
A310: 57 | B310: 123103 | C310: 震安转债 | D310: 300767 | E310: 震安科技 | F310: 化工 | G310: 橡胶塑料 | H310: 196.211 | I310: -2.5000000000000001e-003 | J310: 5.6000000000000008e-003 | K310: 101.3 | L310: 3.4000000000000002e-003 | M310: 121.4 | N310: 56.89 | O310: 0.10199999999999999 | P310: 178.06 | Q310: 10天 | R310: 5.50年 | S310: 3.50年 | T310: 2.85 | U310: 68 | V310: 0.121 | W310: 1.3999999999999999e-002 | X310: 2.5000000000000001e-002 | Y310: 204 | Z310: 17.84 | AA310: -8.5199999999999998e-002 | AB310: -9.0899999999999995e-002 | AC310: -0.152 | AD310: -0.153 | AE310: 80.83 | AF310: 82.88 | AG310: 0.92 | AH310: A+ | AI310: 7.3700000000000002e-002 | AJ310: =H310+100*O310 -> 206.411 | AK310: 214.4 | AL310: 330 | AM310: 131.5 | AN310: 336 | AO310: -7.6999999999999999e-002 | AP310: 4 | AQ310: 震安转债
A311: 68 | B311: 113621 | C311: 彤程转债! | D311: 603650 | E311: 彤程新材 | F311: 化工 | G311: 橡胶塑料 | H311: 187.78 | I311: 8.0799999999999997e-002 | J311: 1.3100000000000001e-002 | K311: 58.01 | L311: 9.9900000000000003e-002 | M311: 115.1 | N311: 32.62 | O311: 5.5999999999999994e-002 | P311: 177.84 | Q311: 转股中 | R311: 5.38年 | S311: 3.38年 | T311: 5.37 | U311: 1399. | V311: 1.3999999999999999 | W311: 1.6e-002 | X311: 2.7999999999999997e-002 | Y311: 344 | Z311: 14.26 | AA311: -8.8399999999999992e-002 | AB311: -9.2699999999999991e-002 | AC311: -0.14899999999999999 | AD311: -0.151 | AE311: 89.75 | AF311: 92.79 | AG311: 0.94 | AH311: AA | AI311: 4.1700000000000001e-002 | AJ311: =H311+100*O311 -> 193.38 | AK311: 197.7 | AL311: 321 | AM311: 104.9 | AN311: 321 | AO311: 6.9999999999999993e-003 | AP311: 8 | AQ311: 彤程转债!
A312: 8 | B312: 123120 | C312: 隆华转债 | D312: 300263 | E312: 隆华科技 | F312: 机械装备 | G312: 通用设备 | H312: 207 | I312: 6.9199999999999998e-002 | J312: -1.29e-002 | K312: 13.79 | L312: 6.1600000000000002e-002 | M312: 121.1 | N312: 7.76 | O312: 0.16500000000000001 | P312: 177.71 | Q312: 4月28天 | R312: 5.88年 | S312: 3.89年 | T312: 7.99 | U312: 1171. | V312: 0.70599999999999996 | W312: 6.3e-002 | X312: 0.113 | Y312: 126 | Z312: 4.51 | AA312: -8.8499999999999995e-002 | AB312: -9.3800000000000008e-002 | AC312: -0.14800000000000002 | AD312: -0.14899999999999999 | AE312: 81.57 | AF312: 85.29 | AG312: 0.92 | AH312: AA- | AI312: 6.2699999999999992e-002 | AJ312: =H312+100*O312 -> 223.5 | AK312: 236.3 | AL312: 342 | AM312: 151 | AN312: 345 | AO312: 0.13100000000000001 | AP312: 3 | AQ312: 隆华转债
A313: 218 | B313: 113572 | C313: 三祥转债!!* | D313: 603663 | E313: 三祥新材 | F313: 其他 | G313: 其他 | H313: 170.16 | I313: -2.1600000000000001e-002 | J313: -3.4999999999999996e-003 | K313: 24.08 | L313: -2.5099999999999997e-002 | M313: 112.8 | N313: 14.09 | O313: -4.0000000000000001e-003 | P313: 170.9 | Q313: 转股中 | R313: 4.50年 | S313: 2.50年 | T313: 1.36 | U313: 186 | V313: 0.79299999999999993 | W313: 2.8999999999999998e-002 | X313: 5.0000000000000003e-002 | Y313: 46 | Z313: 7.18 | AA313: -8.8800000000000004e-002 | AB313: -9.3200000000000005e-002 | AC313: -0.11900000000000001 | AD313: -0.12 | AE313: 85.93 | AF313: 83 | AG313: 1 | AH313: A+ | AI313: 7.2099999999999997e-002 | AJ313: =H313+100*O313 -> 169.75999999999999 | AK313: 169.4 | AL313: 279 | AM313: 83.5 | AN313: 292 | AO313: 5.2000000000000005e-002 | AP313: 21 | AQ313: 三祥转债!!*
A314: 22 | B314: 127038 | C314: 国微转债 | D314: 2049 | E314: 紫光国微 | F314: 电子 | G314: 芯片制造 | H314: 196 | I314: 7.6e-003 | J314: 2.7900000000000001e-002 | K314: 223.39 | L314: 3.9100000000000003e-002 | M314: 114.5 | N314: 137.78 | O314: 0.20899999999999999 | P314: 162.14 | Q314: 3月8天 | R314: 5.75年 | S314: 3.75年 | T314: 15 | U314: 315 | V314: 0.107 | W314: 1.1000000000000001e-002 | X314: 1.8000000000000002e-002 | Y314: 1356. | Z314: 22.63 | AA314: -9.0299999999999991e-002 | AB314: -9.4200000000000006e-002 | AC314: -0.14400000000000002 | AD314: -0.14499999999999999 | AE314: 89.52 | AF314: 93.36 | AG314: 0.91 | AH314: AA+ | AI314: 3.6699999999999997e-002 | AJ314: =H314+100*O314 -> 216.90000000000001 | AK314: 229.9 | AL314: 339 | AM314: 136.5 | AN314: 339 | AO314: 4.0000000000000001e-002 | AP314: 5 | AQ314: 国微转债
A315: 302 | B315: 127011 | C315: 中鼎转2!! | D315: 887 | E315: 中鼎股份 | F315: 汽车 | G315: 零部件制 | H315: 160 | I315: -1.3500000000000002e-002 | J315: -1.55e-002 | K315: 17.05 | L315: -3.2899999999999999e-002 | M315: 114.5 | N315: 11.39 | O315: 6.9000000000000006e-002 | P315: 149.69 | Q315: 转股中 | R315: 3.49年 | S315: 1.49年 | T315: 12 | U315: 89 | V315: 4.7e-002 | W315: 5.7999999999999996e-002 | X315: 8.5999999999999993e-002 | Y315: 208 | Z315: 2.31 | AA315: -9.3000000000000013e-002 | AB315: -9.9499999999999991e-002 | AC315: -0.20100000000000001 | AD315: -0.20199999999999999 | AE315: 97.17 | AF315: 101.76 | AG315: 0.88 | AH315: AA+ | AI315: 3.5099999999999999e-002 | AJ315: =H315+100*O315 -> 166.90000000000001 | AK315: 170.3 | AL315: 281 | AM315: 68.5 | AN315: 246 | AO315: 4.7e-002 | AP315: 21 | AQ315: 中鼎转2!!
A316: 181 | B316: 128113 | C316: 比音转债! | D316: 2832 | E316: 比音勒芬 | F316: 服装纺织 | G316: 服装行业 | H316: 184.805 | I316: -4.3e-003 | J316: -5.9999999999999995e-004 | K316: 26.32 | L316: -5.3e-003 | M316: 116.9 | N316: 14.6 | O316: 2.5000000000000001e-002 | P316: 180.27 | Q316: 转股中 | R316: 4.76年 | S316: 2.76年 | T316: 3.03 | U316: 66 | V316: 0.115 | W316: 2.1000000000000001e-002 | X316: 3.7999999999999999e-002 | Y316: 145 | Z316: 5.27 | AA316: -9.3100000000000002e-002 | AB316: -9.849999999999999e-002 | AC316: -0.11699999999999999 | AD316: -0.11800000000000001 | AE316: 92.25 | AF316: 97.29 | AG316: 0.94 | AH316: AA | AI316: 4.0099999999999997e-002 | AJ316: =H316+100*O316 -> 187.30500000000001 | AK316: 189.3 | AL316: 319 | AM316: 92 | AN316: 308 | AO316: -1.e-003 | AP316: 9 | AQ316: 比音转债!
A317: 23 | B317: 113049 | C317: 长汽转债 | D317: 601633 | E317: 长城汽车 | F317: 汽车 | G317: 乘用车 | H317: 193.23 | I317: -1.8100000000000002e-002 | J317: 7.000000000000001e-004 | K317: 60.02 | L317: -1.9400000000000001e-002 | M317: 110.5 | N317: 38.39 | O317: 0.23600000000000002 | P317: 156.34 | Q317: 3月8天 | R317: 5.75年 | S317: 3.75年 | T317: 35 | U317: 113 | V317: 1.7000000000000001e-002 | W317: 6.0000000000000001e-003 | X317: 1.e-002 | Y317: 5524. | Z317: 9.34 | AA317: -9.3599999999999989e-002 | AB317: -9.64e-002 | AC317: -0.14300000000000002 | AD317: -0.14400000000000002 | AE317: 89.54 | AF317: 91.05 | AG317: 0.89 | AH317: AAA | AI317: 3.4700000000000002e-002 | AJ317: =H317+100*O317 -> 216.82999999999998 | AK317: 230.1 | AL317: 340 | AM317: 139.1 | AN317: 342 | AO317: -1.e-002 | AP317: 5 | AQ317: 长汽转债
A318: 310 | B318: 113527 | C318: 维格转债!! | D318: 603518 | E318: 锦泓集团 | F318: 服装纺织 | G318: 服装行业 | H318: 165.75 | I318: -1.7899999999999999e-002 | J318: -2.7000000000000001e-003 | K318: 15.26 | L318: -2.3700000000000002e-002 | M318: 119.5 | N318: 9.85 | O318: 7.0000000000000007e-002 | P318: 154.92 | Q318: 转股中 | R318: 3.37年 | S318: 1.37年 | T318: 2.87 | U318: 144 | V318: 0.29600000000000004 | W318: 6.6000000000000003e-002 | X318: 0.10300000000000001 | Y318: 43 | Z318: 1.9 | AA318: -9.4e-002 | AB318: -0.10300000000000001 | AC318: -0.23300000000000001 | AD318: -0.23499999999999999 | AE318: 95.45 | AF318: 101.67 | AG318: 0.87 | AH318: AA | AI318: 5.0099999999999999e-002 | AJ318: =H318+100*O318 -> 172.75 | AK318: 176.6 | AL318: 294 | AM318: 74.9 | AN318: 272 | AO318: -1.e-003 | AP318: 81 | AQ318: 维格转债!!
A319: 299 | B319: 123022 | C319: 长信转债!! | D319: 300088 | E319: 长信科技 | F319: 通信互联 | G319: 通信设备 | H319: 162.02 | I319: 8.3000000000000004e-002 | J319: -1.7000000000000001e-003 | K319: 8.65 | L319: 9.3599999999999989e-002 | M319: 114.3 | N319: 6.05 | O319: 0.13300000000000001 | P319: 142.98 | Q319: 转股中 | R319: 3.52年 | S319: 1.52年 | T319: 2.57 | U319: 2397. | V319: 5.6399999999999997 | W319: 1.2e-002 | X319: 1.7000000000000001e-002 | Y319: 212 | Z319: 2.95 | AA319: -9.6000000000000002e-002 | AB319: -0.10199999999999999 | AC319: -0.20100000000000001 | AD319: -0.20300000000000001 | AE319: 96.27 | AF319: 99.81 | AG319: 0.87 | AH319: AA | AI319: 4.0099999999999997e-002 | AJ319: =H319+100*O319 -> 175.32000000000002 | AK319: 181.1 | AL319: 305 | AM319: 81.3 | AN319: 287 | AO319: 0.12 | AP319: 12 | AQ319: 长信转债!!
A320: 348 | B320: 110041 | C320: 蒙电转债! | D320: 600863 | E320: 内蒙华电 | F320: 能源电力 | G320: 电力供应 | H320: 138.55 | I320: -2.12e-002 | J320: -1.29e-002 | K320: 3.37 | L320: -3.9900000000000005e-002 | M320: 109.3 | N320: 2.56 | O320: 5.2000000000000005e-002 | P320: 131.64 | Q320: 转股中 | R320: 2.28年 | S320: 0.28年 | T320: 18.5 | U320: 544 | V320: 0.20999999999999999 | W320: 9.4e-002 | X320: 0.124 | Y320: 196 | Z320: 1.77 | AA320: -0.10000000000000001 | AB320: -0.107 | AC320: -0.628 | AD320: -0.63400000000000001 | AE320: 100.39 | AF320: 101.93 | AG320: 0.85 | AH320: AAA | AI320: 3.1699999999999999e-002 | AJ320: =H320+100*O320 -> 143.75 | AK320: 145.5 | AL320: 147 | AM320: 43.5 | AN320: 87 | AO320: 0.27399999999999997 | AP320: 15 | AQ320: 蒙电转债!
A321: 277 | B321: 113027 | C321: 华钰转债!! | D321: 601020 | E321: ST华钰 | F321: 有色金属 | G321: 锌铅镍锡 | H321: 168.73 | I321: -2.8999999999999998e-002 | J321: 5.3699999999999998e-002 | K321: 15.96 | L321: 2.7000000000000003e-002 | M321: 114.3 | N321: 10.17 | O321: 7.4999999999999997e-002 | P321: 156.93 | Q321: 转股中 | R321: 3.76年 | S321: 1.76年 | T321: 3.24 | U321: 2939. | V321: 5.0700000000000003 | W321: 3.7000000000000005e-002 | X321: 5.7999999999999996e-002 | Y321: 88 | Z321: 3.51 | AA321: -0.10000000000000001 | AB321: -0.106 | AC321: -0.182 | AD321: -0.184 | AE321: 88.41 | AF321: 85.46 | AG321: 0.92 | AH321: A | AI321: 8.2100000000000006e-002 | AJ321: =H321+100*O321 -> 176.22999999999999 | AK321: 180.5 | AL321: 302 | AM321: 92.1 | AN321: 309 | AO321: 0.17899999999999999 | AP321: 47 | AQ321: 华钰转债!!
A322: 211 | B322: 128103 | C322: 同德转债! | D322: 2360 | E322: 同德化工 | F322: 化工 | G322: 化工 | H322: 197.77 | I322: -2.1499999999999998e-002 | J322: 8.5000000000000006e-003 | K322: 10.03 | L322: -1.38e-002 | M322: 121.3 | N322: 5.08 | O322: 2.e-003 | P322: 197.44 | Q322: 转股中 | R322: 4.54年 | S322: 2.54年 | T322: 1.08 | U322: 177 | V322: 0.82599999999999996 | W322: 2.7000000000000003e-002 | X322: 5.4000000000000006e-002 | Y322: 40 | Z322: 3.05 | AA322: -0.10400000000000001 | AB322: -0.111 | AC322: -0.14099999999999999 | AD322: -0.14300000000000002 | AE322: 86.49 | AF322: 89.12 | AG322: 0.95 | AH322: A+ | AI322: 7.2099999999999997e-002 | AJ322: =H322+100*O322 -> 197.97 | AK322: 198.1 | AL322: 322 | AM322: 109 | AN322: 324 | AO322: 1.e-003 | AP322: 19 | AQ322: 同德转债!
A323: 38 | B323: 113047 | C323: 旗滨转债 | D323: 601636 | E323: 旗滨集团 | F323: 建筑 | G323: 玻璃 | H323: 210.01 | I323: -5.3e-003 | J323: 1.e-002 | K323: 24.12 | L323: 5.0000000000000001e-003 | M323: 114 | N323: 12.8 | O323: 0.114 | P323: 188.44 | Q323: 35天 | R323: 5.58年 | S323: 3.58年 | T323: 15 | U323: 180 | V323: 5.7000000000000002e-002 | W323: 2.3e-002 | X323: 4.4000000000000004e-002 | Y323: 648 | Z323: 6 | AA323: -0.105 | AB323: -0.109 | AC323: -0.16500000000000001 | AD323: -0.16600000000000001 | AE323: 89.63 | AF323: 93.49 | AG323: 0.94 | AH323: AA+ | AI323: 3.6699999999999997e-002 | AJ323: =H323+100*O323 -> 221.41 | AK323: 231.6 | AL323: 341 | AM323: 138.1 | AN323: 341 | AO323: -2.3e-002 | AP323: 7 | AQ323: 旗滨转债
A324: 140 | B324: 128128 | C324: 齐翔转2! | D324: 2408 | E324: 齐翔腾达 | F324: 化工 | G324: 化工 | H324: 204.773 | I324: -1.2e-002 | J324: -6.0999999999999995e-003 | K324: 15.5 | L324: -1.9e-002 | M324: 115 | N324: 7.97 | O324: 5.2999999999999999e-002 | P324: 194.48 | Q324: 转股中 | R324: 4.94年 | S324: 2.94年 | T324: 8.73 | U324: 163 | V324: 9.0999999999999998e-002 | W324: 2.7999999999999997e-002 | X324: 5.5e-002 | Y324: 309 | Z324: 2.69 | AA324: -0.11199999999999999 | AB324: -0.11599999999999999 | AC324: -0.121 | AD324: -0.122 | AE324: 91.61 | AF324: 95.04 | AG324: 0.95 | AH324: AA | AI324: 4.0099999999999997e-002 | AJ324: =H324+100*O324 -> 210.07300000000001 | AK324: 215.1 | AL324: 331 | AM324: 120 | AN324: 329 | AO324: 0.158 | AP324: 31 | AQ324: 齐翔转2!
A325: 77 | B325: 113615 | C325: 金诚转债! | D325: 603979 | E325: 金诚信 | F325: 有色金属 | G325: 有色行业 | H325: 220.06 | I325: 9.7200000000000009e-002 | J325: -8.0000000000000004e-004 | K325: 26.86 | L325: 9.9900000000000003e-002 | M325: 117.3 | N325: 12.65 | O325: 3.6000000000000004e-002 | P325: 212.33 | Q325: 转股中 | R325: 5.28年 | S325: 3.29年 | T325: 8.98 | U325: 1835. | V325: 0.93200000000000005 | W325: 5.7000000000000002e-002 | X325: 0.12 | Y325: 159 | Z325: 3.33 | AA325: -0.114 | AB325: -0.11900000000000001 | AC325: -0.111 | AD325: -0.11199999999999999 | AE325: 90.29 | AF325: 94.95 | AG325: 0.96 | AH325: AA | AI325: 4.1700000000000001e-002 | AJ325: =H325+100*O325 -> 223.66 | AK325: 227.8 | AL325: 338 | AM325: 132.8 | AN325: 337 | AO325: 0.217 | AP325: 3 | AQ325: 金诚转债!
A326: 234 | B326: 123042 | C326: 银河转债!! | D326: 300619 | E326: 金银河 | F326: 机械装备 | G326: 专用设备 | H326: 194.5 | I326: -7.7000000000000002e-003 | J326: 8.3000000000000001e-003 | K326: 43.99 | L326: 7.000000000000001e-004 | M326: 115.4 | N326: 24.38 | O326: 7.8e-002 | P326: 180.43 | Q326: 转股中 | R326: 4.34年 | S326: 2.35年 | T326: 1.65 | U326: 1134. | V326: 3.5099999999999998 | W326: 5.0000000000000003e-002 | X326: 9.0999999999999998e-002 | Y326: 33 | Z326: 6.52 | AA326: -0.115 | AB326: -0.121 | AC326: -0.155 | AD326: -0.156 | AE326: 87.29 | AF326: 85.93 | AG326: 0.93 | AH326: A+ | AI326: 7.2099999999999997e-002 | AJ326: =H326+100*O326 -> 202.30000000000001 | AK326: 208.6 | AL326: 326 | AM326: 121.3 | AN326: 332 | AO326: -3.3000000000000002e-002 | AP326: 23 | AQ326: 银河转债!!
A327: 363 | B327: 113014 | C327: 林洋转债!! | D327: 601222 | E327: 林洋能源 | F327: 能源电力 | G327: 电力设备 | H327: 142.81 | I327: 1.8e-003 | J327: 3.2000000000000002e-003 | K327: 12.08 | L327: 5.0000000000000001e-003 | M327: 109.3 | N327: 8.44 | O327: -2.e-003 | P327: 143.13 | Q327: 转股中 | R327: 2年47天 | S327: 47天 | T327: 14.7 | U327: 645 | V327: 0.311 | W327: 6.8000000000000005e-002 | X327: 9.6999999999999989e-002 | Y327: 217 | Z327: 1.96 | AA327: -0.12 | AB327: -0.127 | AC327: -1.0490000000000002 | AD327: -1.0569999999999999 | AE327: 100.67 | AF327: 100.99 | AG327: 1 | AH327: AA | AI327: 3.8699999999999998e-002 | AJ327: =H327+100*O327 -> 142.61000000000001 | AK327: 142.5 | AL327: 119 | AM327: 41.5 | AN327: 69 | AO327: 5.9999999999999998e-002 | AP327: 36 | AQ327: 林洋转债!!
A328: 372 | B328: 110034 | C328: 九州转债! | D328: 600998 | E328: 九州通 | F328: 医药 | G328: 医药商业 | H328: 113.09 | I328: 0. | J328: 4.0000000000000002e-004 | K328: 16.24 | L328: 9.300000000000001e-003 | M328: 108 | N328: 17.83 | O328: 0.24199999999999999 | P328: 91.08 | Q328: 转股中 | R328: 0.35年 | S328: 回售内 | T328: 15 | U328: 25 | V328: 1.4999999999999999e-002 | W328: 4.9000000000000002e-002 | X328: 4.4999999999999998e-002 | Y328: 304 | Z328: 1.47 | AA328: -0.124 | AB328: -0.161 | AC328: 回售内 | AD328: 回售内 | AE328: 103 | AF328: 106.88 | AG328: 0.04 | AH328: AA+ | AI328: 3.0499999999999999e-002 | AJ328: =H328+100*O328 -> 137.28999999999999 | AK328: 135.1 | AL328: 35 | AM328: 28.2 | AN328: 2 | AO328: 8.5000000000000006e-002 | AP328: 25 | AQ328: 九州转债!
A329: 325 | B329: 123014 | C329: 凯发转债! | D329: 300407 | E329: 凯发电气 | F329: 能源电力 | G329: 电力设备 | H329: 137.6 | I329: 2.3999999999999998e-003 | J329: -9.0000000000000011e-003 | K329: 8.4 | L329: -1.06e-002 | M329: 107.5 | N329: 8.05 | O329: 0.31900000000000001 | P329: 104.35 | Q329: 转股中 | R329: 1.88年 | S329: 回售内 | T329: 1.16 | U329: 119 | V329: 0.73799999999999999 | W329: 4.4999999999999998e-002 | X329: 4.7e-002 | Y329: 26 | Z329: 1.87 | AA329: -0.124 | AB329: -0.13 | AC329: 回售内 | AD329: 回售内 | AE329: 100.25 | AF329: 94.66 | AG329: 0.62 | AH329: A+ | AI329: 7.0699999999999999e-002 | AJ329: =H329+100*O329 -> 169.5 | AK329: 170.9 | AL329: 283 | AM329: 70.6 | AN329: 254 | AO329: -3.2000000000000001e-002 | AP329: 16 | AQ329: 凯发转债!
A330: 279 | B330: 113537 | C330: 文灿转债!! | D330: 603348 | E330: 文灿股份 | F330: 汽车 | G330: 零部件制 | H330: 197.43 | I330: -1.72e-002 | J330: 4.1500000000000002e-002 | K330: 34.55 | L330: 2.6099999999999998e-002 | M330: 120.7 | N330: 19.28 | O330: 0.10199999999999999 | P330: 179.2 | Q330: 转股中 | R330: 3.75年 | S330: 1.75年 | T330: 1.41 | U330: 71 | V330: 0.253 | W330: 1.6e-002 | X330: 2.7999999999999997e-002 | Y330: 91 | Z330: 3.43 | AA330: -0.125 | AB330: -0.13300000000000001 | AC330: -0.22399999999999998 | AD330: -0.22600000000000001 | AE330: 92.59 | AF330: 97.15 | AG330: 0.93 | AH330: AA- | AI330: 6.1100000000000002e-002 | AJ330: =H330+100*O330 -> 207.63 | AK330: 215.7 | AL330: 332 | AM330: 118.5 | AN330: 328 | AO330: -5.5999999999999994e-002 | AP330: 26 | AQ330: 文灿转债!!
A331: 123 | B331: 123069 | C331: 金诺转债!! | D331: 300505 | E331: 川金诺 | F331: 化工 | G331: 农化 | H331: 249.01 | I331: -1.9599999999999999e-002 | J331: -1.7100000000000001e-002 | K331: 44.34 | L331: -3.8199999999999998e-002 | M331: 126 | N331: 19.09 | O331: 7.2000000000000008e-002 | P331: 232.27 | Q331: 转股中 | R331: 5年35天 | S331: 3年36天 | T331: 2.25 | U331: 3681. | V331: 6.4699999999999998 | W331: 3.9e-002 | X331: 8.9999999999999997e-002 | Y331: 58 | Z331: 5.9 | AA331: -0.127 | AB331: -0.13400000000000001 | AC331: -0.13400000000000001 | AD331: -0.13500000000000001 | AE331: 85.4 | AF331: 93.04 | AG331: 0.96 | AH331: AA- | AI331: 6.2699999999999992e-002 | AJ331: =H331+100*O331 -> 256.20999999999998 | AK331: 265.8 | AL331: 349 | AM331: 172.7 | AN331: 349 | AO331: 0.23300000000000001 | AP331: 18 | AQ331: 金诺转债!!
A332: 142 | B332: 110074 | C332: 精达转债!! | D332: 600577 | E332: 精达股份 | F332: 电子 | G332: 电子产品 | H332: 229.59 | I332: -1.9299999999999998e-002 | J332: 1.47e-002 | K332: 8.3 | L332: -4.7999999999999996e-003 | M332: 116.9 | N332: 3.73 | O332: 3.2000000000000001e-002 | P332: 222.52 | Q332: 转股中 | R332: 4.94年 | S332: 2.94年 | T332: 5.66 | U332: 242 | V332: 0.184 | W332: 3.4000000000000002e-002 | X332: 7.6999999999999999e-002 | Y332: 164 | Z332: 4.03 | AA332: -0.13 | AB332: -0.13400000000000001 | AC332: -0.13600000000000001 | AD332: -0.13600000000000001 | AE332: 91.6 | AF332: 96.61 | AG332: 0.97 | AH332: AA | AI332: 4.0099999999999997e-002 | AJ332: =H332+100*O332 -> 232.78999999999999 | AK332: 236.7 | AL332: 343 | AM332: 140 | AN332: 343 | AO332: -3.6000000000000004e-002 | AP332: 12 | AQ332: 精达转债!!
A333: 56 | B333: 123102 | C333: 华自转债 | D333: 300490 | E333: 华自科技 | F333: 机械装备 | G333: 机器人及 | H333: 268.3 | I333: -1.03e-002 | J333: 1.7000000000000001e-003 | K333: 26.6 | L333: -8.8999999999999999e-003 | M333: 126.9 | N333: 9.25 | O333: -6.7000000000000004e-002 | P333: 287.57 | Q333: 8天 | R333: 5.50年 | S333: 3.50年 | T333: 6.7 | U333: 1118. | V333: 0.623 | W333: 9.8000000000000004e-002 | X333: 0.28199999999999997 | Y333: 68 | Z333: 3.86 | AA333: -0.13 | AB333: -0.13600000000000001 | AC333: -0.11699999999999999 | AD333: -0.11800000000000001 | AE333: 84.21 | AF333: 91.57 | AG333: 0.97 | AH333: AA- | AI333: 6.2699999999999992e-002 | AJ333: =H333+100*O333 -> 261.60000000000002 | AK333: 249 | AL333: 346 | AM333: 157.5 | AN333: 347 | AO333: 0.106 | AP333: 27 | AQ333: 华自转债
A334: 194 | B334: 113580 | C334: 康隆转债!! | D334: 603665 | E334: 康隆达 | F334: 服装纺织 | G334: 服装行业 | H334: 233.37 | I334: 2.2700000000000001e-002 | J334: -2.69e-002 | K334: 11.74 | L334: -1.18e-002 | M334: 120.8 | N334: 15.51 | O334: 2.0800000000000001 | P334: 75.69 | Q334: 转股中 | R334: 4.61年 | S334: 2.62年 | T334: 0.41 | U334: 776 | V334: 7.9699999999999998 | W334: 2.2000000000000002e-002 | X334: 1.7000000000000001e-002 | Y334: 19 | Z334: 1.73 | AA334: -0.13500000000000001 | AB334: -0.14099999999999999 | AC334: -0.161 | AD334: -0.16200000000000001 | AE334: 88.09 | AF334: 92.44 | AG334: 0.36 | AH334: AA- | AI334: 6.1100000000000002e-002 | AJ334: =H334+100*O334 -> 441.37 | AK334: 391 | AL334: 363 | AM334: 298.6 | AN334: 363 | AO334: 2.3e-002 | AP334: 8 | AQ334: 康隆转债!!
A335: 328 | B335: 123012 | C335: 万顺转债! | D335: 300057 | E335: 万顺新材 | F335: 有色金属 | G335: 铝金属 | H335: 167.15 | I335: 1.9900000000000001e-002 | J335: -1.2e-002 | K335: 8.36 | L335: 8.3999999999999995e-003 | M335: 109.3 | N335: 5.27 | O335: 5.4000000000000006e-002 | P335: 158.63 | Q335: 转股中 | R335: 2.85年 | S335: 0.86年 | T335: 1.28 | U335: 467 | V335: 2.2000000000000002 | W335: 2.3e-002 | X335: 3.6000000000000004e-002 | Y335: 56 | Z335: 1.58 | AA335: -0.14000000000000001 | AB335: -0.14499999999999999 | AC335: -0.38100000000000001 | AD335: -0.38299999999999995 | AE335: 95.94 | AF335: 92.86 | AG335: 0.93 | AH335: AA- | AI335: 5.9699999999999996e-002 | AJ335: =H335+100*O335 -> 172.55000000000001 | AK335: 175.7 | AL335: 292 | AM335: 79.7 | AN335: 283 | AO335: 5.0000000000000001e-003 | AP335: 26 | AQ335: 万顺转债!
A336: 300 | B336: 110055 | C336: 伊力转债!! | D336: 600197 | E336: 伊力特 | F336: 食品饮料 | G336: 白酒 | H336: 192.4 | I336: 1.9900000000000001e-002 | J336: -2.6200000000000001e-002 | K336: 28.17 | L336: -6.7000000000000002e-003 | M336: 114.3 | N336: 16.41 | O336: 0.121 | P336: 171.66 | Q336: 转股中 | R336: 3.51年 | S336: 1.51年 | T336: 2.44 | U336: 735 | V336: 1.5700000000000001 | W336: 1.8000000000000002e-002 | X336: 3.1e-002 | Y336: 133 | Z336: 3.57 | AA336: -0.14000000000000001 | AB336: -0.14599999999999999 | AC336: -0.25800000000000001 | AD336: -0.26000000000000001 | AE336: 96.3 | AF336: 99.85 | AG336: 0.95 | AH336: AA | AI336: 4.0099999999999997e-002 | AJ336: =H336+100*O336 -> 204.5 | AK336: 213.1 | AL336: 329 | AM336: 113.3 | AN336: 326 | AO336: 0.10099999999999999 | AP336: 23 | AQ336: 伊力转债!!
A337: 264 | B337: 113545 | C337: 金能转债! | D337: 603113 | E337: 金能科技 | F337: 煤炭 | G337: 炼焦 | H337: 210.25 | I337: -4.5999999999999999e-002 | J337: 4.7999999999999996e-003 | K337: 21.02 | L337: -4.2800000000000005e-002 | M337: 114.9 | N337: 10.43 | O337: 4.2999999999999997e-002 | P337: 201.53 | Q337: 转股中 | R337: 4年33天 | S337: 2年34天 | T337: 10.2 | U337: 308 | V337: 0.14099999999999999 | W337: 5.7000000000000002e-002 | X337: 0.115 | Y337: 179 | Z337: 2.12 | AA337: -0.14000000000000001 | AB337: -0.14499999999999999 | AC337: -0.19500000000000001 | AD337: -0.19600000000000001 | AE337: 94.71 | AF337: 98.18 | AG337: 0.96 | AH337: AA | AI337: 4.0099999999999997e-002 | AJ337: =H337+100*O337 -> 214.55000000000001 | AK337: 219 | AL337: 333 | AM337: 120.8 | AN337: 331 | AO337: 8.5999999999999993e-002 | AP337: 15 | AQ337: 金能转债!
A338: 315 | B338: 128050 | C338: 钧达转债!! | D338: 2865 | E338: 钧达股份 | F338: 汽车 | G338: 零部件制 | H338: 199.95 | I338: -2.2000000000000001e-003 | J338: -3.5999999999999999e-003 | K338: 28.97 | L338: -5.7999999999999996e-003 | M338: 122.7 | N338: 14.8 | O338: 2.1000000000000001e-002 | P338: 195.74 | Q338: 转股中 | R338: 3.25年 | S338: 1.25年 | T338: 1.37 | U338: 166 | V338: 0.61299999999999999 | W338: 3.6000000000000004e-002 | X338: 7.0000000000000007e-002 | Y338: 38 | Z338: 3.71 | AA338: -0.14199999999999999 | AB338: -0.152 | AC338: -0.32899999999999996 | AD338: -0.33100000000000002 | AE338: 94.83 | AF338: 101.64 | AG338: 1 | AH338: AA- | AI338: 6.1100000000000002e-002 | AJ338: =H338+100*O338 -> 202.04999999999998 | AK338: 204.2 | AL338: 323 | AM338: 102.5 | AN338: 318 | AO338: -4.0999999999999995e-002 | AP338: 53 | AQ338: 钧达转债!!
A339: 360 | B339: 128018 | C339: 时达转债! | D339: 2527 | E339: 新时达 | F339: 机械装备 | G339: 机器人及 | H339: 151.529 | I339: 1.23e-002 | J339: 7.9000000000000008e-003 | K339: 10.83 | L339: 2.1700000000000001e-002 | M339: 109.3 | N339: 7.36 | O339: 2.9999999999999999e-002 | P339: 147.15 | Q339: 转股中 | R339: 2年57天 | S339: 57天 | T339: 4.05 | U339: 180 | V339: 0.28800000000000003 | W339: 5.9999999999999998e-002 | X339: 8.8000000000000009e-002 | Y339: 67 | Z339: 2.51 | AA339: -0.14300000000000002 | AB339: -0.14899999999999999 | AC339: -1.093 | AD339: -1.1000000000000001 | AE339: 100.57 | AF339: 100.88 | AG339: 0.93 | AH339: AA | AI339: 3.8699999999999998e-002 | AJ339: =H339+100*O339 -> 154.529 | AK339: 155.9 | AL339: 219 | AM339: 55 | AN339: 173 | AO339: 0.13699999999999998 | AP339: 35 | AQ339: 时达转债!
A340: 51 | B340: 127030 | C340: 盛虹转债 | D340: 301 | E340: 东方盛虹 | F340: 化工 | G340: 化纤 | H340: 263.006 | I340: 3.1400000000000004e-002 | J340: 2.8999999999999998e-002 | K340: 36.87 | L340: 6.1600000000000002e-002 | M340: 112.5 | N340: 14.1 | O340: 6.0000000000000001e-003 | P340: 261.49 | Q340: 17天 | R340: 5.53年 | S340: 3.53年 | T340: 50 | U340: 932 | V340: 7.2000000000000008e-002 | W340: 2.7999999999999997e-002 | X340: 7.2999999999999995e-002 | Y340: 1783. | Z340: 9.79 | AA340: -0.14400000000000002 | AB340: -0.14699999999999999 | AC340: -0.11599999999999999 | AD340: -0.11599999999999999 | AE340: 90.23 | AF340: 92.46 | AG340: 0.98 | AH340: AA+ | AI340: 3.6699999999999997e-002 | AJ340: =H340+100*O340 -> 263.60599999999999 | AK340: 264.5 | AL340: 348 | AM340: 172.1 | AN340: 348 | AO340: 0.23499999999999999 | AP340: 5 | AQ340: 盛虹转债
A341: 342 | B341: 113504 | C341: 艾华转债!! | D341: 603989 | E341: 艾华集团 | F341: 电子 | G341: 元器件制 | H341: 164 | I341: 2.2599999999999999e-002 | J341: 1.1000000000000001e-002 | K341: 32.77 | L341: 3.5400000000000001e-002 | M341: 109.3 | N341: 20.81 | O341: 4.0999999999999995e-002 | P341: 157.47 | Q341: 转股中 | R341: 2.47年 | S341: 0.47年 | T341: 4.9 | U341: 13 | V341: 1.7000000000000001e-002 | W341: 3.7000000000000005e-002 | X341: 5.9000000000000004e-002 | Y341: 131 | Z341: 4.82 | AA341: -0.153 | AB341: -0.159 | AC341: -0.61599999999999999 | AD341: -0.61899999999999999 | AE341: 99.36 | AF341: 99.67 | AG341: 0.95 | AH341: AA | AI341: 3.8699999999999998e-002 | AJ341: =H341+100*O341 -> 168.09999999999999 | AK341: 170.5 | AL341: 282 | AM341: 70.9 | AN341: 256 | AO341: 1.4999999999999999e-002 | AP341: 11 | AQ341: 艾华转债!!
A342: 269 | B342: 123030 | C342: 九洲转债!* | D342: 300040 | E342: 九洲集团 | F342: 能源电力 | G342: 电力设备 | H342: 239.76 | I342: 4.9599999999999998e-002 | J342: 5.0000000000000001e-003 | K342: 9.65 | L342: 5.4600000000000003e-002 | M342: 119.3 | N342: 4 | O342: -6.0000000000000001e-003 | P342: 241.25 | Q342: 转股中 | R342: 3.94年 | S342: 1.94年 | T342: 0.67 | U342: 2514. | V342: 15.449999999999999 | W342: 1.2e-002 | X342: 2.9999999999999999e-002 | Y342: 54 | Z342: 1.62 | AA342: -0.16399999999999998 | AB342: -0.17100000000000001 | AC342: -0.23899999999999999 | AD342: -0.23999999999999999 | AE342: 90.79 | AF342: 94.82 | AG342: 1 | AH342: AA- | AI342: 6.1100000000000002e-002 | AJ342: =H342+100*O342 -> 239.16 | AK342: 238.3 | AL342: 345 | AM342: 143.5 | AN342: 344 | AO342: 5.5e-002 | AP342: 25 | AQ342: 九洲转债!*
A343: 312 | B343: 123018 | C343: 溢利转债! | D343: 300381 | E343: 溢多利 | F343: 医药 | G343: 原料药 | H343: 207.4 | I343: -4.0000000000000002e-004 | J343: -1.29e-002 | K343: 10.3 | L343: -1.72e-002 | M343: 114.3 | N343: 8.25 | O343: 0.66099999999999992 | P343: 124.85 | Q343: 转股中 | R343: 3.27年 | S343: 1.28年 | T343: 0.54 | U343: 55 | V343: 0.49099999999999999 | W343: 1.1000000000000001e-002 | X343: 1.3000000000000001e-002 | Y343: 50 | Z343: 1.68 | AA343: -0.16899999999999998 | AB343: -0.17499999999999999 | AC343: -0.33399999999999996 | AD343: -0.33600000000000002 | AE343: 94.45 | AF343: 94.52 | AG343: 0.78 | AH343: AA- | AI343: 6.1100000000000002e-002 | AJ343: =H343+100*O343 -> 273.5 | AK343: 290 | AL343: 351 | AM343: 195.4 | AN343: 351 | AO343: 4.4000000000000004e-002 | AP343: 11 | AQ343: 溢利转债!
A344: 316 | B344: 110048 | C344: 福能转债!! | D344: 600483 | E344: 福能股份 | F344: 能源电力 | G344: 电力供应 | H344: 204.74 | I344: -2.98e-002 | J344: -4.4000000000000003e-003 | K344: 15.61 | L344: -3.5200000000000002e-002 | M344: 113.3 | N344: 7.85 | O344: 2.9999999999999999e-002 | P344: 198.85 | Q344: 转股中 | R344: 3.24年 | S344: 1.24年 | T344: 19.5 | U344: 293 | V344: 7.2000000000000008e-002 | W344: 6.7000000000000004e-002 | X344: 0.13300000000000001 | Y344: 292 | Z344: 1.78 | AA344: -0.17000000000000001 | AB344: -0.17499999999999999 | AC344: -0.34000000000000002 | AD344: -0.34100000000000003 | AE344: 97.97 | AF344: 101.56 | AG344: 0.97 | AH344: AA+ | AI344: 3.5099999999999999e-002 | AJ344: =H344+100*O344 -> 207.74000000000001 | AK344: 210.6 | AL344: 328 | AM344: 109.1 | AN344: 325 | AO344: 0.16600000000000001 | AP344: 9 | AQ344: 福能转债!!
A345: 255 | B345: 123034 | C345: 通光转债! | D345: 300265 | E345: 通光线缆 | F345: 通信互联 | G345: 通信设备 | H345: 253 | I345: 0.11900000000000001 | J345: -5.3800000000000001e-002 | K345: 12.68 | L345: 7.2800000000000004e-002 | M345: 118 | N345: 7.95 | O345: 0.58599999999999997 | P345: 159.5 | Q345: 转股中 | R345: 4年54天 | S345: 2年55天 | T345: 0.78 | U345: 4112. | V345: 20.079999999999998 | W345: 1.7000000000000001e-002 | X345: 2.7000000000000003e-002 | Y345: 46 | Z345: 3.51 | AA345: -0.17100000000000001 | AB345: -0.17600000000000002 | AC345: -0.22 | AD345: -0.221 | AE345: 88.26 | AF345: 88.99 | AG345: 0.9 | AH345: A+ | AI345: 7.2099999999999997e-002 | AJ345: =H345+100*O345 -> 311.60000000000002 | AK345: 346.5 | AL345: 355 | AM345: 257.5 | AN345: 356 | AO345: 4.8000000000000001e-002 | AP345: 20 | AQ345: 通光转债!
A346: 213 | B346: 123047 | C346: 久吾转债! | D346: 300631 | E346: 久吾高科 | F346: 机械装备 | G346: 专用设备 | H346: 300.3 | I346: -7.000000000000001e-004 | J346: 2.3599999999999999e-002 | K346: 45.58 | L346: 2.3799999999999998e-002 | M346: 129.6 | N346: 17.43 | O346: 0.14800000000000002 | P346: 261.5 | Q346: 转股中 | R346: 4.52年 | S346: 2.52年 | T346: 1.58 | U346: 2360. | V346: 4.9100000000000001 | W346: 3.2000000000000001e-002 | X346: 8.3000000000000004e-002 | Y346: 50 | Z346: 6.11 | AA346: -0.17300000000000001 | AB346: -0.18100000000000002 | AC346: -0.19800000000000001 | AD346: -0.19899999999999998 | AE346: 87.78 | AF346: 95.5 | AG346: 0.96 | AH346: A+ | AI346: 7.2099999999999997e-002 | AJ346: =H346+100*O346 -> 315.10000000000002 | AK346: 339.1 | AL346: 354 | AM346: 243.6 | AN346: 354 | AO346: -7.2999999999999995e-002 | AP346: 23 | AQ346: 久吾转债!
A347: 205 | B347: 113034 | C347: 滨化转债! | D347: 601678 | E347: 滨化股份 | F347: 化工 | G347: 化工 | H347: 271.03 | I347: 1.55e-002 | J347: 3.0999999999999999e-003 | K347: 11.82 | L347: 1.9e-002 | M347: 114.8 | N347: 4.58 | O347: 5.0000000000000003e-002 | P347: 258.08 | Q347: 转股中 | R347: 4.58年 | S347: 2.58年 | T347: 4.68 | U347: 797 | V347: 0.63800000000000001 | W347: 2.e-002 | X347: 5.2000000000000005e-002 | Y347: 231 | Z347: 2.46 | AA347: -0.17300000000000001 | AB347: -0.17800000000000002 | AC347: -0.183 | AD347: -0.184 | AE347: 92.81 | AF347: 96.22 | AG347: 0.98 | AH347: AA | AI347: 4.0099999999999997e-002 | AJ347: =H347+100*O347 -> 276.02999999999997 | AK347: 284 | AL347: 350 | AM347: 187.8 | AN347: 350 | AO347: 6.5000000000000002e-002 | AP347: 23 | AQ347: 滨化转债!
A348: 321 | B348: 128046 | C348: 利尔转债!! | D348: 2258 | E348: 利尔化学 | F348: 化工 | G348: 农化 | H348: 201.2 | I348: 1.11e-002 | J348: 6.6e-003 | K348: 33.32 | L348: 1.83e-002 | M348: 112.3 | N348: 18.42 | O348: 0.11199999999999999 | P348: 180.89 | Q348: 转股中 | R348: 3年36天 | S348: 1年37天 | T348: 8.08 | U348: 275 | V348: 0.16500000000000001 | W348: 4.5999999999999999e-002 | X348: 8.3000000000000004e-002 | Y348: 176 | Z348: 4.18 | AA348: -0.17399999999999999 | AB348: -0.17999999999999999 | AC348: -0.377 | AD348: -0.37799999999999995 | AE348: 97.85 | AF348: 99.69 | AG348: 0.96 | AH348: AA | AI348: 4.0099999999999997e-002 | AJ348: =H348+100*O348 -> 212.39999999999998 | AK348: 221.5 | AL348: 336 | AM348: 121.8 | AN348: 333 | AO348: 7.9000000000000001e-002 | AP348: 10 | AQ348: 利尔转债!!
A349: 306 | B349: 113528 | C349: 长城转债!! | D349: 603897 | E349: 长城科技 | F349: 机械装备 | G349: 专用设备 | H349: 225.11 | I349: 6.480000000000001e-002 | J349: -1.0800000000000001e-002 | K349: 52.61 | L349: 5.5399999999999998e-002 | M349: 116.8 | N349: 23.35 | O349: -1.e-003 | P349: 225.31 | Q349: 转股中 | R349: 3.47年 | S349: 1.47年 | T349: 5.45 | U349: 992 | V349: 0.81400000000000006 | W349: 5.7000000000000002e-002 | X349: 0.128 | Y349: 96 | Z349: 4.53 | AA349: -0.17499999999999999 | AB349: -0.182 | AC349: -0.31 | AD349: -0.311 | AE349: 93.68 | AF349: 95.52 | AG349: 0.97 | AH349: AA- | AI349: 6.1100000000000002e-002 | AJ349: =H349+100*O349 -> 225.01000000000002 | AK349: 224.9 | AL349: 337 | AM349: 129.4 | AN349: 335 | AO349: 0.28899999999999998 | AP349: 38 | AQ349: 长城转债!!
A350: 130 | B350: 123067 | C350: 斯莱转债! | D350: 300382 | E350: 斯莱克 | F350: 机械装备 | G350: 专用设备 | H350: 325.563 | I350: -3.8599999999999995e-002 | J350: 1.5800000000000002e-002 | K350: 30.28 | L350: -2.3199999999999998e-002 | M350: 121.2 | N350: 9.36 | O350: 6.0000000000000001e-003 | P350: 323.5 | Q350: 转股中 | R350: 5年6.0天 | S350: 3年7天 | T350: 3.35 | U350: 399 | V350: 0.36299999999999999 | W350: 2.e-002 | X350: 6.3e-002 | Y350: 171 | Z350: 16.39 | AA350: -0.182 | AB350: -0.187 | AC350: -0.16399999999999998 | AD350: -0.16500000000000001 | AE350: 86.01 | AF350: 89.99 | AG350: 0.98 | AH350: AA- | AI350: 6.2699999999999992e-002 | AJ350: =H350+100*O350 -> 326.16300000000001 | AK350: 327.6 | AL350: 353 | AM350: 237.6 | AN350: 353 | AO350: 0.13699999999999998 | AP350: 12 | AQ350: 斯莱转债!
A351: 313 | B351: 113525 | C351: 台华转债!! | D351: 603055 | E351: 台华新材 | F351: 服装纺织 | G351: 纺织行业 | H351: 221.32 | I351: 4.7999999999999996e-003 | J351: -8.6999999999999994e-003 | K351: 17.21 | L351: -4.0999999999999995e-003 | M351: 114.3 | N351: 7.78 | O351: 1.e-003 | P351: 221.21 | Q351: 转股中 | R351: 3.27年 | S351: 1.27年 | T351: 3.98 | U351: 1053. | V351: 1.2 | W351: 2.7999999999999997e-002 | X351: 6.0999999999999999e-002 | Y351: 144 | Z351: 4.53 | AA351: -0.18600000000000003 | AB351: -0.192 | AC351: -0.35700000000000004 | AD351: -0.35899999999999999 | AE351: 97.21 | AF351: 100.8 | AG351: 0.98 | AH351: AA | AI351: 4.0099999999999997e-002 | AJ351: =H351+100*O351 -> 221.41999999999999 | AK351: 221.4 | AL351: 335 | AM351: 120.6 | AN351: 330 | AO351: 0.41799999999999998 | AP351: 22 | AQ351: 台华转债!!
A352: 236 | B352: 128093 | C352: 百川转债!! | D352: 2455 | E352: 百川股份 | F352: 化工 | G352: 化工 | H352: 332.01 | I352: 3.8699999999999998e-002 | J352: 2.5000000000000001e-003 | K352: 18.14 | L352: 4.2500000000000003e-002 | M352: 129.8 | N352: 5.77 | O352: 5.5999999999999994e-002 | P352: 314.38 | Q352: 转股中 | R352: 4.31年 | S352: 2.32年 | T352: 1.62 | U352: 2665. | V352: 4.9500000000000002 | W352: 1.6e-002 | X352: 5.0000000000000003e-002 | Y352: 103 | Z352: 6.38 | AA352: -0.20100000000000001 | AB352: -0.20899999999999999 | AC352: -0.23199999999999998 | AD352: -0.23300000000000001 | AE352: 92.53 | AF352: 101.49 | AG352: 0.97 | AH352: AA- | AI352: 6.1100000000000002e-002 | AJ352: =H352+100*O352 -> 337.61000000000001 | AK352: 349.6 | AL352: 356 | AM352: 248.1 | AN352: 355 | AO352: -0.12 | AP352: 46 | AQ352: 百川转债!!
A353: 226 | B353: 110066 | C353: 盛屯转债!! | D353: 600711 | E353: 盛屯矿业 | F353: 有色金属 | G353: 有色行业 | H353: 307.99 | I353: 2.6600000000000002e-002 | J353: 2.81e-002 | K353: 14.23 | L353: 5.5599999999999997e-002 | M353: 114.9 | N353: 4.87 | O353: 5.4000000000000006e-002 | P353: 292.2 | Q353: 转股中 | R353: 4.47年 | S353: 2.47年 | T353: 3.83 | U353: 2299. | V353: 1.9099999999999999 | W353: 1.e-002 | X353: 2.8999999999999998e-002 | Y353: 391 | Z353: 3.35 | AA353: -0.20100000000000001 | AB353: -0.20499999999999999 | AC353: -0.20800000000000002 | AD353: -0.20899999999999999 | AE353: 93.3 | AF353: 96.72 | AG353: 0.98 | AH353: AA | AI353: 4.0099999999999997e-002 | AJ353: =H353+100*O353 -> 313.38999999999999 | AK353: 323.8 | AL353: 352 | AM353: 227.1 | AN353: 352 | AO353: 0.32100000000000001 | AP353: 33 | AQ353: 盛屯转债!!
A354: 192 | B354: 113582 | C354: 火炬转债! | D354: 603678 | E354: 火炬电子 | F354: 电子 | G354: 元器件制 | H354: 346.54 | I354: -3.9000000000000003e-003 | J354: 1.4199999999999999e-002 | K354: 73.73 | L354: 1.04e-002 | M354: 114.9 | N354: 24.99 | O354: 0.17499999999999999 | P354: 295.04 | Q354: 转股中 | R354: 4.71年 | S354: 2.71年 | T354: 4.18 | U354: 180 | V354: 0.124 | W354: 1.2e-002 | X354: 3.6000000000000004e-002 | Y354: 339 | Z354: 8.07 | AA354: -0.21199999999999999 | AB354: -0.21600000000000003 | AC354: -0.19600000000000001 | AD354: -0.19600000000000001 | AE354: 92.44 | AF354: 95.83 | AG354: 0.98 | AH354: AA | AI354: 4.0099999999999997e-002 | AJ354: =H354+100*O354 -> 364.04000000000002 | AK354: 398 | AL354: 364 | AM354: 302.2 | AN354: 365 | AO354: -5.2000000000000005e-002 | AP354: 6 | AQ354: 火炬转债!
A355: 214 | B355: 123046 | C355: 天铁转债! | D355: 300587 | E355: 天铁股份 | F355: 铁路 | G355: 铁路设备 | H355: 348.59 | I355: -1.5300000000000001e-002 | J355: 1.4000000000000002e-003 | K355: 19.52 | L355: -1.41e-002 | M355: 117.7 | N355: 5.9 | O355: 5.4000000000000006e-002 | P355: 330.85 | Q355: 转股中 | R355: 4.52年 | S355: 2.52年 | T355: 0.62 | U355: 189 | V355: 0.878 | W355: 5.0000000000000001e-003 | X355: 1.8000000000000002e-002 | Y355: 113 | Z355: 3.97 | AA355: -0.217 | AB355: -0.221 | AC355: -0.215 | AD355: -0.21600000000000003 | AE355: 88.5 | AF355: 90.57 | AG355: 0.98 | AH355: AA- | AI355: 6.1100000000000002e-002 | AJ355: =H355+100*O355 -> 353.98999999999995 | AK355: 366.3 | AL355: 357 | AM355: 275.8 | AN355: 359 | AO355: -1.4999999999999999e-002 | AP355: 14 | AQ355: 天铁转债!
A356: 366 | B356: 127004 | C356: 模塑转债!! | D356: 700 | E356: 模塑科技 | F356: 汽车 | G356: 零部件制 | H356: 170.751 | I356: -7.3000000000000001e-003 | J356: 2.8000000000000004e-003 | K356: 6.14 | L356: -1.7600000000000001e-002 | M356: 111.8 | N356: 7.24 | O356: 1.01 | P356: 84.81 | Q356: 转股中 | R356: 1.73年 | S356: 回售内 | T356: 1.32 | U356: 99 | V356: 0.43700000000000006 | W356: 2.4e-002 | X356: 2.e-002 | Y356: 56 | Z356: 2.08 | AA356: -0.21899999999999997 | AB356: -0.22899999999999998 | AC356: 回售内 | AD356: 回售内 | AE356: 100.3 | AF356: 100.05 | AG356: 0.25 | AH356: AA- | AI356: 5.9699999999999996e-002 | AJ356: =H356+100*O356 -> 271.75099999999998 | AK356: 256.7 | AL356: 347 | AM356: 156.4 | AN356: 346 | AO356: 0. | AP356: 29 | AQ356: 模塑转债!!
A357: 256 | B357: 113548 | C357: 石英转债! | D357: 603688 | E357: 石英股份 | F357: 电子 | G357: 电子产品 | H357: 343.03 | I357: 4.2900000000000001e-002 | J357: 2.3199999999999998e-002 | K357: 45.85 | L357: 6.7500000000000004e-002 | M357: 124.4 | N357: 14.93 | O357: 0.11699999999999999 | P357: 307.1 | Q357: 转股中 | R357: 4年47天 | S357: 2年48天 | T357: 1.23 | U357: 1461. | V357: 3.48 | W357: 8.0000000000000002e-003 | X357: 2.3e-002 | Y357: 162 | Z357: 8.15 | AA357: -0.221 | AB357: -0.22800000000000001 | AC357: -0.26300000000000001 | AD357: -0.26400000000000001 | AE357: 91.2 | AF357: 98.01 | AG357: 0.98 | AH357: AA- | AI357: 6.1100000000000002e-002 | AJ357: =H357+100*O357 -> 354.72999999999996 | AK357: 379 | AL357: 361 | AM357: 280.9 | AN357: 361 | AO357: 0.185 | AP357: 14 | AQ357: 石英转债!
A358: 334 | B358: 110044 | C358: 广电转债!! | D358: 600831 | E358: 广电网络 | F358: 传媒娱乐 | G358: 影视娱乐 | H358: 228.82 | I358: 2.2000000000000001e-003 | J358: -6.1999999999999998e-003 | K358: 5.81 | L358: -1.3600000000000001e-002 | M358: 111.3 | N358: 6.87 | O358: 1.71 | P358: 84.57 | Q358: 转股中 | R358: 2.79年 | S358: 0.79年 | T358: 0.71 | U358: 288 | V358: 1.75 | W358: 1.7000000000000001e-002 | X358: 1.4999999999999999e-002 | Y358: 41 | Z358: 1.1 | AA358: -0.23000000000000001 | AB358: -0.23499999999999999 | AC358: -0.57999999999999996 | AD358: -0.58200000000000007 | AE358: 98.16 | AF358: 100.26 | AG358: 0.29 | AH358: AA | AI358: 3.8699999999999998e-002 | AJ358: =H358+100*O358 -> 399.81999999999999 | AK358: 373.1 | AL358: 359 | AM358: 272.8 | AN358: 357 | AO358: 4.0000000000000001e-002 | AP358: 10 | AQ358: 广电转债!!
A359: 323 | B359: 123015 | C359: 蓝盾转债!! | D359: 300297 | E359: 蓝盾股份 | F359: 计算机及 | G359: 软件开发 | H359: 239.552 | I359: -0.14400000000000002 | J359: 0.13600000000000001 | K359: 3.95 | L359: -7.0599999999999996e-002 | M359: 111.3 | N359: 5.79 | O359: 2.5099999999999998 | P359: 68.22 | Q359: 转股中 | R359: 2.92年 | S359: 0.92年 | T359: 1 | U359: 1851. | V359: 7.2599999999999998 | W359: 2.e-002 | X359: 1.3999999999999999e-002 | Y359: 49 | Z359: 2.36 | AA359: -0.23300000000000001 | AB359: -0.23800000000000002 | AC359: -0.52300000000000002 | AD359: -0.52400000000000002 | AE359: 89.94 | AF359: 80.2 | AG359: 0.12 | AH359: BBB- | AI359: 0.1207 | AJ359: =H359+100*O359 -> 490.55199999999996 | AK359: 410.9 | AL359: 366 | AM359: 320.9 | AN359: 366 | AO359: 0.13100000000000001 | AP359: 16 | AQ359: 蓝盾转债!!
A360: 311 | B360: 113526 | C360: 联泰转债! | D360: 603797 | E360: 联泰环保 | F360: 城市公用 | G360: 三废处理 | H360: 270.03 | I360: -4.4199999999999996e-002 | J360: 3.8300000000000001e-002 | K360: 7.13 | L360: -8.3000000000000001e-003 | M360: 110.3 | N360: 6.11 | O360: 1.3100000000000001 | P360: 116.69 | Q360: 转股中 | R360: 3.37年 | S360: 1.37年 | T360: 1.93 | U360: 316 | V360: 0.60199999999999998 | W360: 4.5999999999999999e-002 | X360: 5.4000000000000006e-002 | Y360: 42 | Z360: 1.61 | AA360: -0.23600000000000002 | AB360: -0.23999999999999999 | AC360: -0.38200000000000001 | AD360: -0.38299999999999995 | AE360: 97.54 | AF360: 98.43 | AG360: 0.7 | AH360: AA+ | AI360: 3.5099999999999999e-002 | AJ360: =H360+100*O360 -> 401.02999999999997 | AK360: 423.4 | AL360: 367 | AM360: 324.9 | AN360: 367 | AO360: 3.3000000000000002e-002 | AP360: 9 | AQ360: 联泰转债!
A361: 182 | B361: 128111 | C361: 中矿转债! | D361: 2738 | E361: 中矿资源 | F361: 有色金属 | G361: 有色行业 | H361: 461 | I361: 9.8100000000000007e-002 | J361: 5.0000000000000001e-004 | K361: 66.55 | L361: 0.10000000000000001 | M361: 124.2 | N361: 15.42 | O361: 6.8000000000000005e-002 | P361: 431.58 | Q361: 转股中 | R361: 4.75年 | S361: 2.75年 | T361: 1.52 | U361: 2092. | V361: 3.0600000000000001 | W361: 6.9999999999999993e-003 | X361: 3.1e-002 | Y361: 215 | Z361: 6.11 | AA361: -0.245 | AB361: -0.25 | AC361: -0.21299999999999999 | AD361: -0.21299999999999999 | AE361: 87.74 | AF361: 94.31 | AG361: 0.99 | AH361: AA- | AI361: 6.1100000000000002e-002 | AJ361: =H361+100*O361 -> 467.80000000000001 | AK361: 490.4 | AL361: 369 | AM361: 396.1 | AN361: 369 | AO361: 0.13200000000000001 | AP361: 11 | AQ361: 中矿转债!
A362: 278 | B362: 123027 | C362: 蓝晓转债! | D362: 300487 | E362: 蓝晓科技 | F362: 化工 | G362: 化工 | H362: 348.509 | I362: 1.2999999999999999e-003 | J362: 2.63e-002 | K362: 89.64 | L362: 2.81e-002 | M362: 118.8 | N362: 29.02 | O362: 0.128 | P362: 308.89 | Q362: 转股中 | R362: 3.75年 | S362: 1.75年 | T362: 1.07 | U362: 544 | V362: 1.45 | W362: 5.0000000000000001e-003 | X362: 1.7000000000000001e-002 | Y362: 197 | Z362: 10.55 | AA362: -0.253 | AB362: -0.25900000000000001 | AC362: -0.33200000000000002 | AD362: -0.33299999999999996 | AE362: 90.87 | AF362: 92.1 | AG362: 0.98 | AH362: A+ | AI362: 7.2099999999999997e-002 | AJ362: =H362+100*O362 -> 361.30900000000003 | AK362: 388.1 | AL362: 362 | AM362: 296 | AN362: 362 | AO362: -2.7000000000000003e-002 | AP362: 20 | AQ362: 蓝晓转债!
A363: 287 | B363: 113534 | C363: 鼎胜转债!! | D363: 603876 | E363: 鼎胜新材 | F363: 有色金属 | G363: 小金属 | H363: 342.76 | I363: 2.1600000000000001e-002 | J363: 5.0900000000000001e-002 | K363: 48.19 | L363: 7.3499999999999996e-002 | M363: 114.3 | N363: 15.18 | O363: 8.0000000000000002e-002 | P363: 317.46 | Q363: 转股中 | R363: 3.58年 | S363: 1.58年 | T363: 4.39 | U363: 1430. | V363: 0.95900000000000007 | W363: 1.9e-002 | X363: 5.9999999999999998e-002 | Y363: 233 | Z363: 5.22 | AA363: -0.26800000000000002 | AB363: -0.27200000000000002 | AC363: -0.371 | AD363: -0.37200000000000005 | AE363: 92.77 | AF363: 92.85 | AG363: 0.99 | AH363: AA- | AI363: 6.1100000000000002e-002 | AJ363: =H363+100*O363 -> 350.75999999999999 | AK363: 368.1 | AL363: 358 | AM363: 275.2 | AN363: 358 | AO363: 0.20999999999999999 | AP363: 33 | AQ363: 鼎胜转债!!
A364: 362 | B364: 128017 | C364: 金禾转债!! | D364: 2597 | E364: 金禾实业 | F364: 化工 | G364: 化工 | H364: 214.62 | I364: -2.2000000000000002e-002 | J364: -1.5300000000000001e-002 | K364: 42 | L364: -3.7999999999999999e-002 | M364: 108.8 | N364: 21.97 | O364: 0.12300000000000001 | P364: 191.17 | Q364: 转股中 | R364: 2年52天 | S364: 52天 | T364: 5.52 | U364: 272 | V364: 0.22899999999999998 | W364: 2.3e-002 | X364: 4.4999999999999998e-002 | Y364: 236 | Z364: 4.72 | AA364: -0.27500000000000002 | AB364: -0.28000000000000003 | AC364: -1.829 | AD364: -1.8330000000000002 | AE364: 100.37 | AF364: 100.45 | AG364: 0.98 | AH364: AA | AI364: 3.8699999999999998e-002 | AJ364: =H364+100*O364 -> 226.92000000000002 | AK364: 238.1 | AL364: 344 | AM364: 137.6 | AN364: 340 | AO364: 0.16 | AP364: 10 | AQ364: 金禾转债!!
A365: 230 | B365: 128095 | C365: 恩捷转债!! | D365: 2812 | E365: 恩捷股份 | F365: 电子 | G365: 元器件制 | H365: 486.738 | I365: -7.000000000000001e-004 | J365: 6.0999999999999995e-003 | K365: 281.01 | L365: 5.4000000000000003e-003 | M365: 114.9 | N365: 64.92 | O365: 0.124 | P365: 432.86 | Q365: 转股中 | R365: 4.42年 | S365: 2.42年 | T365: 4.54 | U365: 293 | V365: 0.13200000000000001 | W365: 2.e-003 | X365: 8.0000000000000002e-003 | Y365: 2508. | Z365: 20.78 | AA365: -0.28199999999999997 | AB365: -0.28600000000000003 | AC365: -0.255 | AD365: -0.255 | AE365: 93.49 | AF365: 96.92 | AG365: 0.99 | AH365: AA | AI365: 4.0099999999999997e-002 | AJ365: =H365+100*O365 -> 499.13799999999998 | AK365: 540.6 | AL365: 371 | AM365: 443.7 | AN365: 371 | AO365: 5.0000000000000003e-002 | AP365: 15 | AQ365: 恩捷转债!!
A366: 286 | B366: 113025 | C366: 明泰转债!! | D366: 601677 | E366: 明泰铝业 | F366: 有色金属 | G366: 铝金属 | H366: 378.65 | I366: -1.29e-002 | J366: 3.0800000000000001e-002 | K366: 39.17 | L366: 1.8200000000000001e-002 | M366: 114.5 | N366: 11 | O366: 6.3e-002 | P366: 356.09 | Q366: 转股中 | R366: 3.58年 | S366: 1.58年 | T366: 11 | U366: 232 | V366: 5.5e-002 | W366: 4.0999999999999995e-002 | X366: 0.14599999999999999 | Y366: 267 | Z366: 2.84 | AA366: -0.28699999999999998 | AB366: -0.29199999999999998 | AC366: -0.38600000000000001 | AD366: -0.38600000000000001 | AE366: 96.06 | AF366: 99.75 | AG366: 0.99 | AH366: AA | AI366: 4.0099999999999997e-002 | AJ366: =H366+100*O366 -> 384.94999999999999 | AK366: 401.2 | AL366: 365 | AM366: 301.5 | AN366: 364 | AO366: 7.6999999999999999e-002 | AP366: 22 | AQ366: 明泰转债!!
A367: 349 | B367: 128030 | C367: 天康转债!! | D367: 2100 | E367: 天康生物 | F367: 农业 | G367: 畜牧业 | H367: 241.777 | I367: 5.1000000000000004e-003 | J367: -5.4000000000000003e-003 | K367: 7.75 | L367: -1.15e-002 | M367: 111.3 | N367: 7.39 | O367: 1.3100000000000001 | P367: 104.87 | Q367: 转股中 | R367: 2.28年 | S367: 0.28年 | T367: 0.89 | U367: 13 | V367: 6.2e-002 | W367: 1.1000000000000001e-002 | X367: 1.1000000000000001e-002 | Y367: 83 | Z367: 1.38 | AA367: -0.29199999999999998 | AB367: -0.29699999999999999 | AC367: -1.365 | AD367: -1.3680000000000001 | AE367: 100.09 | AF367: 102.23 | AG367: 0.03 | AH367: AA | AI367: 3.8699999999999998e-002 | AJ367: =H367+100*O367 -> 372.77699999999999 | AK367: 378.7 | AL367: 360 | AM367: 276.4 | AN367: 360 | AO367: 3.1e-002 | AP367: 11 | AQ367: 天康转债!!
A368: 330 | B368: 128041 | C368: 盛路转债!! | D368: 2446 | E368: 盛路通信 | F368: 通信互联 | G368: 通信设备 | H368: 301 | I368: -3.8300000000000001e-002 | J368: 3.1200000000000002e-002 | K368: 5.94 | L368: -1.9799999999999998e-002 | M368: 113.3 | N368: 6.82 | O368: 2.46 | P368: 87.1 | Q368: 转股中 | R368: 2.85年 | S368: 0.85年 | T368: 0.53 | U368: 367 | V368: 2.27 | W368: 1.e-002 | X368: 9.0000000000000011e-003 | Y368: 54 | Z368: 1.77 | AA368: -0.29299999999999998 | AB368: -0.29899999999999999 | AC368: -0.65099999999999991 | AD368: -0.65200000000000002 | AE368: 97.96 | AF368: 101.85 | AG368: 0.36 | AH368: AA | AI368: 3.8699999999999998e-002 | AJ368: =H368+100*O368 -> 547. | AK368: 514.9 | AL368: 370 | AM368: 413.1 | AN368: 370 | AO368: -4.7e-002 | AP368: 12 | AQ368: 盛路转债!!
A369: 327 | B369: 123013 | C369: 横河转债! | D369: 300539 | E369: 横河精密 | F369: 机械装备 | G369: 专用设备 | H369: 353.199 | I369: -4.7999999999999996e-003 | J369: -5.5000000000000005e-003 | K369: 8.36 | L369: -2.1099999999999997e-002 | M369: 114 | N369: 9.04 | O369: 2.8199999999999998 | P369: 92.48 | Q369: 转股中 | R369: 2.87年 | S369: 0.87年 | T369: 0.38 | U369: 182 | V369: 1.3500000000000001 | W369: 2.1000000000000001e-002 | X369: 1.9e-002 | Y369: 19 | Z369: 3.83 | AA369: -0.32899999999999996 | AB369: -0.33399999999999996 | AC369: -0.68099999999999994 | AD369: -0.68200000000000005 | AE369: 95.18 | AF369: 94.02 | AG369: 0.49 | AH369: A+ | AI369: 7.0699999999999999e-002 | AJ369: =H369+100*O369 -> 635.19900000000007 | AK369: 613.9 | AL369: 373 | AM369: 518.7 | AN369: 373 | AO369: -4.5999999999999999e-002 | AP369: 14 | AQ369: 横河转债!
A370: 267 | B370: 123031 | C370: 晶瑞转债! | D370: 300655 | E370: 晶瑞电材 | F370: 电子 | G370: 电子行业 | H370: 561.036 | I370: 0.13300000000000001 | J370: 2.3799999999999998e-002 | K370: 53.25 | L370: 0.158 | M370: 115.3 | N370: 10.13 | O370: 6.7000000000000004e-002 | P370: 525.67 | Q370: 转股中 | R370: 3.96年 | S370: 1.97年 | T370: 0.53 | U370: 6256. | V370: 20.260000000000002 | W370: 3.0000000000000001e-003 | X370: 1.4999999999999999e-002 | Y370: 181 | Z370: 13.03 | AA370: -0.33200000000000002 | AB370: -0.33600000000000002 | AC370: -0.33899999999999997 | AD370: -0.33899999999999997 | AE370: 88.7 | AF370: 87.92 | AG370: 0.99 | AH370: A+ | AI370: 7.2099999999999997e-002 | AJ370: =H370+100*O370 -> 567.73599999999999 | AK370: 596.4 | AL370: 372 | AM370: 507.7 | AN370: 372 | AO370: 7.400000000000001e-002 | AP370: 17 | AQ370: 晶瑞转债!
A371: 350 | B371: 128029 | C371: 太阳转债!! | D371: 2078 | E371: 太阳纸业 | F371: 造纸包装 | G371: 造纸行业 | H371: 187.506 | I371: 1.e-002 | J371: 1.15e-002 | K371: 14.24 | L371: 2.1499999999999998e-002 | M371: 107 | N371: 8.45 | O371: 0.113 | P371: 168.52 | Q371: 转股中 | R371: 1.28年 | S371: 回售内 | T371: 9.09 | U371: 395 | V371: 0.22699999999999998 | W371: 2.4e-002 | X371: 4.0000000000000001e-002 | Y371: 383 | Z371: 2.07 | AA371: -0.35600000000000004 | AB371: -0.36200000000000004 | AC371: 回售内 | AD371: 回售内 | AE371: 100.17 | AF371: 102.58 | AG371: 1 | AH371: AA+ | AI371: 3.3700000000000001e-002 | AJ371: =H371+100*O371 -> 198.80600000000001 | AK371: 206.5 | AL371: 324 | AM371: 103.9 | AN371: 320 | AO371: 0.152 | AP371: 8 | AQ371: 太阳转债!!
A372: 361 | B372: 113016 | C372: 小康转债!! | D372: 601127 | E372: 小康股份 | F372: 汽车 | G372: 零部件制 | H372: 441.99 | I372: -3.1200000000000002e-002 | J372: -1.1999999999999999e-003 | K372: 74.97 | L372: -3.2599999999999997e-002 | M372: 109.3 | N372: 16.96 | O372: 0. | P372: 442.04 | Q372: 转股中 | R372: 2年57天 | S372: 57天 | T372: 2.33 | U372: 1000. | V372: 0.95700000000000007 | W372: 2.e-003 | X372: 1.e-002 | Y372: 1018. | Z372: 13.17 | AA372: -0.45700000000000002 | AB372: -0.45899999999999996 | AC372: -2.5510000000000002 | AD372: -2.5529999999999999 | AE372: 99.93 | AF372: 96.71 | AG372: 0.99 | AH372: AA- | AI372: 5.9699999999999996e-002 | AJ372: =H372+100*O372 -> 441.99000000000001 | AK372: 441.9 | AL372: 368 | AM372: 342 | AN372: 368 | AO372: 0.11 | AP372: 39 | AQ372: 小康转债!!
A373: 371 | B373: 113009 | C373: 广汽转债! | D373: 601238 | E373: 广汽集团 | F373: 汽车 | G373: 乘用车 | H373: 136.14 | I373: -8.6999999999999994e-003 | J373: 1.3000000000000001e-002 | K373: 18.72 | L373: 4.3e-003 | M373: 106 | N373: 13.97 | O373: 1.6e-002 | P373: 134 | Q373: 转股中 | R373: 0.37年 | S373: 回售内 | T373: 25.4 | U373: 228 | V373: 6.6000000000000003e-002 | W373: 1.3000000000000001e-002 | X373: 1.8000000000000002e-002 | Y373: 1939. | Z373: 2.22 | AA373: -0.64400000000000002 | AB373: -0.66900000000000004 | AC373: 回售内 | AD373: 回售内 | AE373: 100.27 | AF373: 104.91 | AG373: 0.99 | AH373: AAA | AI373: 2.8500000000000001e-002 | AJ373: =H373+100*O373 -> 137.73999999999998 | AK373: 138.3 | AL373: 69 | AM373: 33.4 | AN373: 16 | AO373: 8.6999999999999994e-002 | AP373: 20 | AQ373: 广汽转债!
A374: 373 | B374: 110033 | C374: 国贸转债! | D374: 600755 | E374: 厦门国贸 | F374: 交通运输 | G374: 交通运输 | H374: 137.78 | I374: 1.6000000000000001e-003 | J374: -2.7000000000000001e-003 | K374: 9.26 | L374: -1.1000000000000001e-003 | M374: 108 | N374: 6.72 | O374: 0. | P374: 137.8 | Q374: 转股中 | R374: 0.32年 | S374: 回售内 | T374: 9.58 | U374: 285 | V374: 0.21199999999999999 | W374: 5.2999999999999999e-002 | X374: 7.2999999999999995e-002 | Y374: 181 | Z374: 1.07 | AA374: -0.72299999999999998 | AB374: -0.7609999999999999 | AC374: 回售内 | AD374: 回售内 | AE374: 100.33 | AF374: 107.03 | AG374: 1 | AH374: AAA | AI374: 2.8500000000000001e-002 | AJ374: =H374+100*O374 -> 137.78 | AK374: 137.8 | AL374: 65 | AM374: 30.7 | AN374: 9 | AO374: 0.125 | AP374: 25 | AQ374: 国贸转债!
A376: 声明：本数据不构成任何投资建议，宁稳网不对数据的准确性及完整性做出保证，对使用者参考本数据造成的任何直接或间接损失概不负责。
A378: 来源：宁稳网，http://www.ninwin.cn，版权所有，本数据仅供【十七亩，8703】参考，请勿转发，2021-09-10 23:15:31