A1: 序号 | B1: 转债代码 | C1: 转债名称 | D1: 股票代码 | E1: 股票名称 | F1: 行业 | G1: 子行业 | H1: 转债价格 | I1: 涨跌 | J1: 日内套利 | K1: 股价 | L1: 涨跌 | M1: 剩余本息 | N1: 转股价格 | O1: 转股溢价率 | P1: 转股价值 | Q1: 距离转股日 | R1: 剩余年限 | S1: 回售年限 | T1: 转债余额 | U1: 转债成交额 | V1: 转债换手率 | W1: 余额/市值 | X1: 余额/股本 | Y1: 股票市值 | Z1: P/B | AA1: 税前收益率 | AB1: 税后收益率 | AC1: 税前回售收益 | AD1: 税后回售收益 | AE1: 回售价值 | AF1: 纯债价值 | AG1: 弹性 | AH1: 信用 | AI1: 折现率 | AJ1: 双低 | AK1: 老式双低 | AL1: 老式排名 | AM1: 新式双低 | AN1: 新式排名 | AO1: MA20乖离 | AP1: 热门度 | AQ1: 转债名称
A2: 280 | B2: 128062 | C2: 亚药转债! | D2: 2370 | E2: 亚太药业 | F2: 医药 | G2: 化学制药 | H2: 79.991 | I2: -3.5999999999999999e-003 | J2: 3.5999999999999999e-003 | K2: 5.15 | L2: 9.7999999999999997e-003 | M2: 119.3 | N2: 16.25 | O2: 1.52 | P2: 31.69 | Q2: 转股中 | R2: 3.75年 | S2: 1.75年 | T2: 9.63 | U2: 8.9 | V2: 1.2e-002 | W2: 0.34899999999999998 | X2: 0.11 | Y2: 28 | Z2: 6.39 | AA2: 0.115 | AB2: 0.105 | AC2: 0.14099999999999999 | AD2: 0.13699999999999998 | AE2: 79.51 | AF2: 72.62 | AG2: 0 | AH2: BB | AI2: 0.14460000000000001 | AJ2: =H2+100*O2 -> 231.99099999999999 | AK2: 128.3 | AL2: 122 | AM2: 48.8 | AN2: 248 | AO2: 0.13500000000000001 | AP2: 84 | AQ2: 亚药转债!
A3: 203 | B3: 128100 | C3: 搜特转债! | D3: 2503 | E3: 搜于特 | F3: 服装纺织 | G3: 服装行业 | H3: 80.36 | I3: -7.7000000000000002e-003 | J3: 6.8000000000000005e-003 | K3: 1.54 | L3: -6.5000000000000006e-003 | M3: 116.9 | N3: 2.9 | O3: 0.51300000000000001 | P3: 53.1 | Q3: 转股中 | R3: 4.69年 | S3: 2.69年 | T3: 7.99 | U3: 12 | V3: 1.9e-002 | W3: 0.16800000000000001 | X3: 8.900000000000001e-002 | Y3: 48 | Z3: 1.42 | AA3: 8.5000000000000006e-002 | AB3: 7.7699999999999991e-002 | AC3: 9.3000000000000013e-002 | AD3: 9.0299999999999991e-002 | AE3: 82.14 | AF3: 80.48 | AG3: 0.14 | AH3: A | AI3: 8.4600000000000009e-002 | AJ3: =H3+100*O3 -> 131.66 | AK3: 107.6 | AL3: 1 | AM3: 25.5 | AN3: 30 | AO3: -4.8000000000000001e-002 | AP3: 66 | AQ3: 搜特转债!
A4: 145 | B4: 113595 | C4: 花王转债! | D4: 603007 | E4: ST花王 | F4: 城市公用 | G4: 生态环境 | H4: 85.67 | I4: -2.e-003 | J4: 2.7000000000000001e-003 | K4: 3.27 | L4: 6.1999999999999998e-003 | M4: 125.3 | N4: 6.92 | O4: 0.81299999999999994 | P4: 47.25 | Q4: 转股中 | R4: 5年18天 | S4: 3年19天 | T4: 3.3 | U4: 3.7 | V4: 1.3000000000000001e-002 | W4: 0.30099999999999999 | X4: 0.14199999999999999 | Y4: 11 | Z4: 0.96 | AA4: 8.0299999999999996e-002 | AB4: 7.0900000000000005e-002 | AC4: 6.3700000000000007e-002 | AD4: 6.08e-002 | AE4: 80.23 | AF4: 83.47 | AG4: 0.11 | AH4: A | AI4: 8.5999999999999993e-002 | AJ4: =H4+100*O4 -> 166.97 | AK4: 124.1 | AL4: 71 | AM4: 40.6 | AN4: 180 | AO4: -1.9e-002 | AP4: 43 | AQ4: 花王转债!
A5: 190 | B5: 113576 | C5: 起步转债!! | D5: 603557 | E5: ST起步 | F5: 服装纺织 | G5: 鞋服行业 | H5: 93.52 | I5: -1.1999999999999999e-003 | J5: 1.1699999999999999e-002 | K5: 5.82 | L5: 5.0499999999999996e-002 | M5: 121.3 | N5: 10.55 | O5: 0.69499999999999995 | P5: 55.17 | Q5: 转股中 | R5: 4.77年 | S5: 2.77年 | T5: 2.66 | U5: 25 | V5: 9.8000000000000004e-002 | W5: 9.1999999999999998e-002 | X5: 5.0999999999999997e-002 | Y5: 29 | Z5: 1.84 | AA5: 5.74e-002 | AB5: 4.9100000000000005e-002 | AC5: 3.7999999999999999e-002 | AD5: 3.5000000000000003e-002 | AE5: 82.31 | AF5: 83.12 | AG5: 0.21 | AH5: A | AI5: 8.4600000000000009e-002 | AJ5: =H5+100*O5 -> 163.01999999999998 | AK5: 131.9 | AL5: 167 | AM5: 48.8 | AN5: 247 | AO5: 0.17000000000000001 | AP5: 33 | AQ5: 起步转债!!
A6: 87 | B6: 128138 | C6: 侨银转债! | D6: 2973 | E6: 侨银股份 | F6: 城市公用 | G6: 城市公用 | H6: 102.391 | I6: -1.8e-003 | J6: -5.0000000000000001e-004 | K6: 15.8 | L6: -1.2500000000000001e-002 | M6: 136.5 | N6: 25.33 | O6: 0.6409999999999999 | P6: 62.38 | Q6: 转股中 | R6: 5.38年 | S6: 3.38年 | T6: 4.2 | U6: 2.7 | V6: 6.0000000000000001e-003 | W6: 6.5000000000000002e-002 | X6: 4.0999999999999995e-002 | Y6: 65 | Z6: 4.29 | AA6: 5.6100000000000004e-002 | AB6: 4.4999999999999998e-002 | AC6: 5.6000000000000008e-003 | AD6: 3.2000000000000002e-003 | AE6: 83.74 | AF6: 97.97 | AG6: 0.19 | AH6: AA- | AI6: 6.5000000000000002e-002 | AJ6: =H6+100*O6 -> 166.49099999999999 | AK6: 142.4 | AL6: 263 | AM6: 44.4 | AN6: 212 | AO6: -4.7e-002 | AP6: 12 | AQ6: 侨银转债!
A7: 162 | B7: 127018 | C7: 本钢转债! | D7: 761 | E7: 本钢板材 | F7: 钢铁 | G7: 炼钢 | H7: 98.99 | I7: -3.3e-003 | J7: 6.0000000000000001e-003 | K7: 4.33 | L7: 6.9999999999999993e-003 | M7: 128 | N7: 5.03 | O7: 0.14999999999999999 | P7: 86.08 | Q7: 转股中 | R7: 4.99年 | S7: 2.99年 | T7: 67.5 | U7: 53 | V7: 8.0000000000000002e-003 | W7: 0.40200000000000002 | X7: 0.34600000000000003 | Y7: 168 | Z7: 0.82 | AA7: 5.4400000000000004e-002 | AB7: 4.4500000000000005e-002 | AC7: 2.1700000000000001e-002 | AD7: 1.8000000000000002e-002 | AE7: 91.54 | AF7: 102.16 | AG7: 0.38 | AH7: AAA | AI7: 4.7599999999999996e-002 | AJ7: =H7+100*O7 -> 113.98999999999999 | AK7: 111.9 | AL7: 9 | AM7: 9.7 | AN7: 2 | AO7: 6.9999999999999993e-003 | AP7: 64 | AQ7: 本钢转债!
A8: 278 | B8: 128063 | C8: 未来转债! | D8: 2631 | E8: 德尔未来 | F8: 其他 | G8: 家居用品 | H8: 105.459 | I8: -3.7000000000000002e-003 | J8: 4.6999999999999993e-003 | K8: 6.12 | L8: 4.8999999999999998e-003 | M8: 127.5 | N8: 8.6 | O8: 0.48200000000000004 | P8: 71.16 | Q8: 转股中 | R8: 3.75年 | S8: 2.75年 | T8: 6.3 | U8: 1.1 | V8: 2.e-003 | W8: 0.155 | X8: 0.11 | Y8: 41 | Z8: 2.42 | AA8: 5.3399999999999996e-002 | AB8: 4.0599999999999997e-002 | AC8: 8.8999999999999999e-003 | AD8: 3.5999999999999999e-003 | AE8: 90.7 | AF8: 101.84 | AG8: 0.2 | AH8: AA- | AI8: 6.3600000000000004e-002 | AJ8: =H8+100*O8 -> 153.65899999999999 | AK8: 139.8 | AL8: 245 | AM8: 37.9 | AN8: 155 | AO8: -1.7000000000000001e-002 | AP8: 31 | AQ8: 未来转债!
A9: 152 | B9: 127019 | C9: 国城转债! | D9: 688 | E9: 国城矿业 | F9: 有色金属 | G9: 锌铅镍锡 | H9: 90.188 | I9: -1.03e-002 | J9: 1.01e-002 | K9: 8.51 | L9: -1.1599999999999999e-002 | M9: 115.1 | N9: 21.06 | O9: 1.23 | P9: 40.41 | Q9: 转股中 | R9: 5年12天 | S9: 3年13天 | T9: 8.5 | U9: 8.4 | V9: 1.1000000000000001e-002 | W9: 8.8000000000000009e-002 | X9: 3.5000000000000003e-002 | Y9: 97 | Z9: 4.17 | AA9: 5.0700000000000002e-002 | AB9: 4.4900000000000002e-002 | AC9: 4.4699999999999997e-002 | AD9: 4.2300000000000004e-002 | AE9: 90.38 | AF9: 93.08 | AG9: 0.02 | AH9: AA | AI9: 4.4000000000000004e-002 | AJ9: =H9+100*O9 -> 213.18799999999999 | AK9: 140 | AL9: 248 | AM9: 46.9 | AN9: 232 | AO9: -5.2999999999999999e-002 | AP9: 41 | AQ9: 国城转债!
A10: 264 | B10: 123028 | C10: 清水转债! | D10: 300437 | E10: 清水源 | F10: 城市公用 | G10: 三废处理 | H10: 100 | I10: -6.8000000000000005e-003 | J10: 1.0500000000000001e-002 | K10: 8.86 | L10: 1.03e-002 | M10: 121 | N10: 11.84 | O10: 0.33600000000000002 | P10: 74.83 | Q10: 转股中 | R10: 3.96年 | S10: 1.96年 | T10: 4.55 | U10: 16 | V10: 3.5000000000000003e-002 | W10: 0.23199999999999998 | X10: 0.17399999999999999 | Y10: 20 | Z10: 1.76 | AA10: 5.0499999999999996e-002 | AB10: 4.0800000000000003e-002 | AC10: 1.84e-002 | AD10: 1.47e-002 | AE10: 89.28 | AF10: 91.62 | AG10: 0.36 | AH10: A+ | AI10: 7.46e-002 | AJ10: =H10+100*O10 -> 133.59999999999999 | AK10: 125.2 | AL10: 80 | AM10: 33.6 | AN10: 106 | AO10: 8.0000000000000002e-003 | AP10: 51 | AQ10: 清水转债!
A11: 312 | B11: 128044 | C11: 岭南转债! | D11: 2717 | E11: 岭南股份 | F11: 城市公用 | G11: 生态环境 | H11: 96.106 | I11: -2.5000000000000001e-003 | J11: 2.5000000000000001e-003 | K11: 2.93 | L11: -6.8000000000000005e-003 | M11: 111.3 | N11: 5.91 | O11: 0.93900000000000006 | P11: 49.58 | Q11: 转股中 | R11: 3年42天 | S11: 1年43天 | T11: 6.59 | U11: 9.9 | V11: 1.6e-002 | W11: 0.14699999999999999 | X11: 7.2999999999999995e-002 | Y11: 45 | Z11: 1.03 | AA11: 4.9400000000000006e-002 | AB11: 4.2199999999999994e-002 | AC11: 5.4400000000000004e-002 | AD11: 4.9800000000000004e-002 | AE11: 95.06 | AF11: 92.26 | AG11: 0.01 | AH11: AA- | AI11: 6.3600000000000004e-002 | AJ11: =H11+100*O11 -> 190.006 | AK11: 142.6 | AL11: 264 | AM11: 47.6 | AN11: 240 | AO11: -7.2999999999999995e-002 | AP11: 47 | AQ11: 岭南转债!
A12: 365 | B12: 127003 | C12: 海印转债! | D12: 861 | E12: 海印股份 | F12: 商业零售 | G12: 商场 | H12: 105.2 | I12: -1.8e-003 | J12: 1.7000000000000001e-003 | K12: 2.07 | L12: -9.5999999999999992e-003 | M12: 110 | N12: 3 | O12: 0.52500000000000002 | P12: 69 | Q12: 转股中 | R12: 0.93年 | S12: 回售内 | T12: 6.74 | U12: 4.7 | V12: 6.9999999999999993e-003 | W12: 0.14000000000000001 | X12: 9.6999999999999989e-002 | Y12: 48 | Z12: 1.26 | AA12: 4.8899999999999999e-002 | AB12: 2.8500000000000001e-002 | AC12: 回售内 | AD12: 回售内 | AE12: 100.33 | AF12: 106.31 | AG12: 0.01 | AH12: AA | AI12: 3.7200000000000004e-002 | AJ12: =H12+100*O12 -> 157.69999999999999 | AK12: 141.4 | AL12: 256 | AM12: 35.1 | AN12: 123 | AO12: -2.e-002 | AP12: 69 | AQ12: 海印转债!
A13: 129 | B13: 113600 | C13: 新星转债! | D13: 603978 | E13: 深圳新星 | F13: 有色金属 | G13: 有色行业 | H13: 99.29 | I13: 5.9999999999999995e-004 | J13: -5.0000000000000001e-003 | K13: 17.09 | L13: -1.3300000000000001e-002 | M13: 126 | N13: 23.85 | O13: 0.38600000000000001 | P13: 71.66 | Q13: 转股中 | R13: 5年41天 | S13: 3年42天 | T13: 5.95 | U13: 2.3 | V13: 4.0000000000000001e-003 | W13: 0.218 | X13: 0.156 | Y13: 27 | Z13: 1.79 | AA13: 4.87e-002 | AB13: 3.9800000000000002e-002 | AC13: 1.4199999999999999e-002 | AD13: 1.18e-002 | AE13: 84.72 | AF13: 91.95 | AG13: 0.33 | AH13: AA- | AI13: 6.5000000000000002e-002 | AJ13: =H13+100*O13 -> 137.89000000000001 | AK13: 126.9 | AL13: 107 | AM13: 35 | AN13: 118 | AO13: -5.0000000000000003e-002 | AP13: 22 | AQ13: 新星转债!
A14: 128 | B14: 110072 | C14: 广汇转债! | D14: 600297 | E14: 广汇汽车 | F14: 汽车 | G14: 分销、售 | H14: 90.42 | I14: -1.1299999999999999e-002 | J14: 8.6999999999999994e-003 | K14: 2.8 | L14: -1.06e-002 | M14: 114.5 | N14: 4.03 | O14: 0.30099999999999999 | P14: 69.48 | Q14: 转股中 | R14: 5年46天 | S14: 3年47天 | T14: 33.7 | U14: 19 | V14: 6.0000000000000001e-003 | W14: 0.14800000000000002 | X14: 0.10300000000000001 | Y14: 227 | Z14: 0.56 | AA14: 4.7899999999999998e-002 | AB14: 4.2500000000000003e-002 | AC14: 4.0599999999999997e-002 | AD14: 3.8699999999999998e-002 | AE14: 90.31 | AF14: 93.49 | AG14: 0.24 | AH14: AA+ | AI14: 4.0999999999999995e-002 | AJ14: =H14+100*O14 -> 120.52 | AK14: 111.4 | AL14: 8 | AM14: 17.9 | AN14: 5 | AO14: -6.9999999999999993e-003 | AP14: 60 | AQ14: 广汇转债!
A15: 283 | B15: 113530 | C15: 大丰转债! | D15: 603081 | E15: 大丰实业 | F15: 建筑 | G15: 装饰工程 | H15: 102 | I15: -3.8e-003 | J15: 3.9000000000000003e-003 | K15: 10.87 | L15: 8.9999999999999998e-004 | M15: 121 | N15: 16.49 | O15: 0.54700000000000004 | P15: 65.92 | Q15: 转股中 | R15: 3.73年 | S15: 1.73年 | T15: 6.3 | U15: 0.7 | V15: 1.e-003 | W15: 0.14400000000000002 | X15: 9.5000000000000001e-002 | Y15: 44 | Z15: 1.96 | AA15: 4.7800000000000002e-002 | AB15: 3.7599999999999995e-002 | AC15: 4.7999999999999996e-003 | AD15: 1.7000000000000001e-003 | AE15: 95.13 | AF15: 103.86 | AG15: 0.1 | AH15: AA | AI15: 4.2599999999999999e-002 | AJ15: =H15+100*O15 -> 156.69999999999999 | AK15: 138.1 | AL15: 230 | AM15: 34.2 | AN15: 114 | AO15: -3.7999999999999999e-002 | AP15: 32 | AQ15: 大丰转债!
A16: 208 | B16: 113569 | C16: 科达转债! | D16: 603660 | E16: 苏州科达 | F16: 通信互联 | G16: 物联网 | H16: 97.14 | I16: -3.2000000000000002e-003 | J16: 2.8999999999999998e-003 | K16: 6.83 | L16: -4.4000000000000003e-003 | M16: 120.3 | N16: 14.8 | O16: 1.1000000000000001 | P16: 46.15 | Q16: 转股中 | R16: 4.68年 | S16: 2.68年 | T16: 5.16 | U16: 0.7 | V16: 1.e-003 | W16: 0.153 | X16: 7.0999999999999994e-002 | Y16: 34 | Z16: 1.89 | AA16: 4.7699999999999992e-002 | AB16: 3.9800000000000002e-002 | AC16: 2.3199999999999998e-002 | AD16: 2.06e-002 | AE16: 87.09 | AF16: 90.68 | AG16: 0.06 | AH16: AA- | AI16: 6.3600000000000004e-002 | AJ16: =H16+100*O16 -> 207.14000000000001 | AK16: 148.1 | AL16: 283 | AM16: 57.5 | AN16: 288 | AO16: -2.7000000000000003e-002 | AP16: 27 | AQ16: 科达转债!
A17: 310 | B17: 113519 | C17: 长久转债! | D17: 603569 | E17: 长久物流 | F17: 交通运输 | G17: 物流业 | H17: 102.87 | I17: -2.8999999999999998e-003 | J17: 2.7000000000000001e-003 | K17: 7.26 | L17: -2.7000000000000001e-003 | M17: 119.3 | N17: 11.04 | O17: 0.56399999999999995 | P17: 65.76 | Q17: 转股中 | R17: 3.35年 | S17: 1.35年 | T17: 6.97 | U17: 0.3 | V17: 0. | W17: 0.17100000000000001 | X17: 0.113 | Y17: 41 | Z17: 1.86 | AA17: 4.6199999999999998e-002 | AB17: 3.56e-002 | AC17: -5.0000000000000001e-004 | AD17: -4.0999999999999995e-003 | AE17: 96.55 | AF17: 104.03 | AG17: 0.09 | AH17: AA | AI17: 4.2599999999999999e-002 | AJ17: =H17+100*O17 -> 159.26999999999998 | AK17: 140 | AL17: 249 | AM17: 35.9 | AN17: 133 | AO17: -5.5e-002 | AP17: 20 | AQ17: 长久转债!
A18: 183 | B18: 113573 | C18: 纵横转债! | D18: 603602 | E18: 纵横通信 | F18: 通信互联 | G18: 通信设备 | H18: 100.62 | I18: -6.0000000000000001e-003 | J18: 6.0000000000000001e-003 | K18: 10.17 | L18: 0. | M18: 124.2 | N18: 18.78 | O18: 0.85799999999999998 | P18: 54.15 | Q18: 转股中 | R18: 4.79年 | S18: 2.79年 | T18: 2.7 | U18: 2.3 | V18: 8.0000000000000002e-003 | W18: 0.13 | X18: 7.0000000000000007e-002 | Y18: 21 | Z18: 2.92 | AA18: 4.5999999999999999e-002 | AB18: 3.7000000000000005e-002 | AC18: 1.1699999999999999e-002 | AD18: 9.0000000000000011e-003 | AE18: 84.34 | AF18: 88.68 | AG18: 0.14 | AH18: A+ | AI18: 7.46e-002 | AJ18: =H18+100*O18 -> 186.42000000000002 | AK18: 147.1 | AL18: 278 | AM18: 58.4 | AN18: 294 | AO18: -5.5e-002 | AP18: 24 | AQ18: 纵横转债!
A19: 137 | B19: 113596 | C19: 城地转债! | D19: 603887 | E19: 城地香江 | F19: 通信互联 | G19: 通信设备 | H19: 91 | I19: -5.4000000000000003e-003 | J19: 5.0000000000000001e-003 | K19: 9.74 | L19: -1.4199999999999999e-002 | M19: 113.5 | N19: 24.26 | O19: 1.27 | P19: 40.15 | Q19: 转股中 | R19: 5年25天 | S19: 3年26天 | T19: 12 | U19: 6.2 | V19: 6.0000000000000001e-003 | W19: 0.27300000000000002 | X19: 0.11 | Y19: 44 | Z19: 0.96 | AA19: 4.5599999999999995e-002 | AB19: 4.0399999999999998e-002 | AC19: 4.2099999999999999e-002 | AD19: 3.9599999999999996e-002 | AE19: 84.89 | AF19: 83.09 | AG19: 0.02 | AH19: AA- | AI19: 6.5000000000000002e-002 | AJ19: =H19+100*O19 -> 218. | AK19: 141.9 | AL19: 260 | AM19: 57 | AN19: 283 | AO19: -0.18100000000000002 | AP19: 25 | AQ19: 城地转债!
A20: 229 | B20: 110064 | C20: 建工转债! | D20: 600939 | E20: 重庆建工 | F20: 建筑 | G20: 建筑工程 | H20: 99.08 | I20: -1.1000000000000001e-003 | J20: -2.0000000000000001e-004 | K20: 3.44 | L20: -5.7999999999999996e-003 | M20: 119.8 | N20: 4.57 | O20: 0.316 | P20: 75.27 | Q20: 转股中 | R20: 4.47年 | S20: 2.47年 | T20: 16.6 | U20: 5.9 | V20: 4.0000000000000001e-003 | W20: 0.26600000000000001 | X20: 0.20000000000000001 | Y20: 62 | Z20: 0.89 | AA20: 4.4500000000000005e-002 | AB20: 3.6299999999999999e-002 | AC20: 1.9299999999999998e-002 | AD20: 1.61e-002 | AE20: 94.1 | AF20: 101.14 | AG20: 0.23 | AH20: AA+ | AI20: 3.9599999999999996e-002 | AJ20: =H20+100*O20 -> 130.68000000000001 | AK20: 122.9 | AL20: 62 | AM20: 21.7 | AN20: 16 | AO20: -3.4000000000000002e-002 | AP20: 45 | AQ20: 建工转债!
A21: 359 | B21: 128015 | C21: 久其转债! | D21: 2279 | E21: 久其软件 | F21: 计算机及 | G21: 软件开发 | H21: 100.8 | I21: -1.9e-003 | J21: 1.9e-003 | K21: 4.98 | L21: 2.e-003 | M21: 109.5 | N21: 6.97 | O21: 0.41100000000000003 | P21: 71.45 | Q21: 转股中 | R21: 1.93年 | S21: 回售内 | T21: 7.8 | U21: 12 | V21: 1.4999999999999999e-002 | W21: 0.22 | X21: 0.157 | Y21: 35 | Z21: 4.12 | AA21: 4.41e-002 | AB21: 3.4500000000000003e-002 | AC21: 回售内 | AD21: 回售内 | AE21: 100.25 | AF21: 95.68 | AG21: 0 | AH21: A+ | AI21: 7.2800000000000004e-002 | AJ21: =H21+100*O21 -> 141.90000000000001 | AK21: 130.2 | AL21: 141 | AM21: 29.9 | AN21: 60 | AO21: -5.7999999999999996e-002 | AP21: 65 | AQ21: 久其转债!
A22: 286 | B22: 123023 | C22: 迪森转债! | D22: 300335 | E22: 迪森股份 | F22: 能源电力 | G22: 电力供应 | H22: 97.7 | I22: -9.7999999999999997e-003 | J22: 1.21e-002 | K22: 4.87 | L22: 8.3000000000000001e-003 | M22: 114.3 | N22: 6.89 | O22: 0.38200000000000001 | P22: 70.68 | Q22: 转股中 | R22: 3.71年 | S22: 2.72年 | T22: 5.29 | U22: 8.6 | V22: 1.7000000000000001e-002 | W22: 0.29199999999999998 | X22: 0.20600000000000002 | Y22: 18 | Z22: 1.3 | AA22: 4.4000000000000004e-002 | AB22: 3.6600000000000001e-002 | AC22: 2.4399999999999998e-002 | AD22: 2.12e-002 | AE22: 87.82 | AF22: 91.31 | AG22: 0.28 | AH22: AA- | AI22: 6.3600000000000004e-002 | AJ22: =H22+100*O22 -> 135.90000000000001 | AK22: 124.7 | AL22: 77 | AM22: 33.4 | AN22: 103 | AO22: -3.1e-002 | AP22: 50 | AQ22: 迪森转债!
A23: 126 | B23: 128127 | C23: 文科转债! | D23: 2775 | E23: 文科园林 | F23: 城市公用 | G23: 生态环境 | H23: 97.83 | I23: -3.4000000000000002e-003 | J23: -6.3e-003 | K23: 4.27 | L23: -1.84e-002 | M23: 121.3 | N23: 4.88 | O23: 0.11800000000000001 | P23: 87.5 | Q23: 转股中 | R23: 5年48天 | S23: 3年49天 | T23: 9.5 | U23: 6.2 | V23: 6.9999999999999993e-003 | W23: 0.434 | X23: 0.38 | Y23: 22 | Z23: 0.93 | AA23: 4.3899999999999995e-002 | AB23: 3.6299999999999999e-002 | AC23: 1.9599999999999999e-002 | AD23: 1.7000000000000001e-002 | AE23: 84.91 | AF23: 88.5 | AG23: 0.52 | AH23: AA- | AI23: 6.5000000000000002e-002 | AJ23: =H23+100*O23 -> 109.63 | AK23: 108.2 | AL23: 4 | AM23: 19.7 | AN23: 8 | AO23: -2.4e-002 | AP23: 50 | AQ23: 文科转债!
A24: 231 | B24: 128085 | C24: 鸿达转债! | D24: 2002 | E24: 鸿达兴业 | F24: 化工 | G24: 化工 | H24: 103.51 | I24: -4.3e-003 | J24: 8.8999999999999999e-003 | K24: 3.79 | L24: 5.3e-003 | M24: 124.4 | N24: 3.91 | O24: 6.8000000000000005e-002 | P24: 96.93 | Q24: 转股中 | R24: 4.45年 | S24: 2.46年 | T24: 7.78 | U24: 25 | V24: 2.9999999999999999e-002 | W24: 6.8000000000000005e-002 | X24: 6.6000000000000003e-002 | Y24: 114 | Z24: 1.3 | AA24: 4.3099999999999999e-002 | AB24: 3.3399999999999999e-002 | AC24: 1.4000000000000002e-003 | AD24: -1.4000000000000002e-003 | AE24: 68.44 | AF24: 61.87 | AG24: 0.87 | AH24: B | AI24: 0.17460000000000001 | AJ24: =H24+100*O24 -> 110.31 | AK24: 110.1 | AL24: 5 | AM24: 41.6 | AN24: 186 | AO24: -7.9000000000000001e-002 | AP24: 100 | AQ24: 鸿达转债!
A25: 340 | B25: 113017 | C25: 吉视转债! | D25: 601929 | E25: 吉视传媒 | F25: 传媒娱乐 | G25: 影视娱乐 | H25: 98.16 | I25: 1.e-004 | J25: -8.9999999999999998e-004 | K25: 1.79 | L25: -2.1899999999999999e-002 | M25: 108.8 | N25: 2.95 | O25: 0.61799999999999999 | P25: 60.68 | Q25: 转股中 | R25: 2.49年 | S25: 0.49年 | T25: 15.6 | U25: 11 | V25: 6.9999999999999993e-003 | W25: 0.28000000000000003 | X25: 0.17000000000000001 | Y25: 56 | Z25: 0.84 | AA25: 4.2900000000000001e-002 | AB25: 3.5900000000000001e-002 | AC25: 5.3399999999999996e-002 | AD25: 4.8499999999999995e-002 | AE25: 99.12 | AF25: 99.35 | AG25: 0.04 | AH25: AA+ | AI25: 3.78e-002 | AJ25: =H25+100*O25 -> 159.95999999999998 | AK25: 135.6 | AL25: 207 | AM25: 36.3 | AN25: 137 | AO25: -4.7e-002 | AP25: 64 | AQ25: 吉视转债!
A26: 205 | B26: 123044 | C26: 红相转债!! | D26: 300427 | E26: 红相股份 | F26: 能源电力 | G26: 电力设备 | H26: 103.277 | I26: -1.3100000000000001e-002 | J26: 8.6999999999999994e-003 | K26: 12.85 | L26: -1.61e-002 | M26: 125 | N26: 18.67 | O26: 0.501 | P26: 68.83 | Q26: 转股中 | R26: 4.69年 | S26: 2.69年 | T26: 5.5 | U26: 4.8 | V26: 8.0000000000000002e-003 | W26: 0.11900000000000001 | X26: 8.199999999999999e-002 | Y26: 46 | Z26: 1.97 | AA26: 4.2599999999999999e-002 | AB26: 3.32e-002 | AC26: 4.1999999999999997e-003 | AD26: 1.1000000000000001e-003 | AE26: 87.8 | AF26: 94.29 | AG26: 0.27 | AH26: AA- | AI26: 6.3600000000000004e-002 | AJ26: =H26+100*O26 -> 153.37700000000001 | AK26: 137.7 | AL26: 225 | AM26: 43.4 | AN26: 206 | AO26: -5.0999999999999997e-002 | AP26: 20 | AQ26: 红相转债!!
A27: 293 | B27: 110052 | C27: 贵广转债! | D27: 600996 | E27: 贵广网络 | F27: 传媒娱乐 | G27: 影视娱乐 | H27: 101.33 | I27: -8.0000000000000004e-004 | J27: 5.0000000000000001e-004 | K27: 5.05 | L27: -3.9000000000000003e-003 | M27: 117.7 | N27: 7.94 | O27: 0.59299999999999997 | P27: 63.6 | Q27: 转股中 | R27: 3.67年 | S27: 1.67年 | T27: 15.3 | U27: 12 | V27: 8.0000000000000002e-003 | W27: 0.28699999999999998 | X27: 0.183 | Y27: 53 | Z27: 1.26 | AA27: 4.2500000000000003e-002 | AB27: 3.3500000000000002e-002 | AC27: 9.1999999999999998e-003 | AD27: 5.8999999999999999e-003 | AE27: 95.98 | AF27: 102.34 | AG27: 0.08 | AH27: AA+ | AI27: 3.9599999999999996e-002 | AJ27: =H27+100*O27 -> 160.63 | AK27: 139.1 | AL27: 237 | AM27: 36.7 | AN27: 141 | AO27: 5.2999999999999999e-002 | AP27: 17 | AQ27: 贵广转债!
A28: 163 | B28: 113589 | C28: 天创转债! | D28: 603608 | E28: 天创时尚 | F28: 服装纺织 | G28: 鞋服行业 | H28: 93.79 | I28: -9.7999999999999997e-003 | J28: 4.8999999999999998e-003 | K28: 6.47 | L28: -6.2300000000000001e-002 | M28: 114.9 | N28: 12.29 | O28: 0.78200000000000003 | P28: 52.64 | Q28: 转股中 | R28: 4.98年 | S28: 2.98年 | T28: 6 | U28: 10 | V28: 1.8000000000000002e-002 | W28: 0.21600000000000003 | X28: 0.114 | Y28: 28 | Z28: 1.7 | AA28: 4.24e-002 | AB28: 3.6699999999999997e-002 | AC28: 3.1800000000000002e-002 | AD28: 2.9500000000000002e-002 | AE28: 90.78 | AF28: 93.72 | AG28: 0.08 | AH28: AA | AI28: 4.2599999999999999e-002 | AJ28: =H28+100*O28 -> 171.99000000000001 | AK28: 134.9 | AL28: 202 | AM28: 41.2 | AN28: 184 | AO28: -4.0000000000000001e-002 | AP28: 28 | AQ28: 天创转债!
A29: 158 | B29: 128117 | C29: 道恩转债! | D29: 2838 | E29: 道恩股份 | F29: 化工 | G29: 橡胶塑料 | H29: 100.798 | I29: -5.0000000000000001e-003 | J29: 3.3e-003 | K29: 17.54 | L29: -7.9000000000000008e-003 | M29: 123.5 | N29: 28.83 | O29: 0.65700000000000003 | P29: 60.84 | Q29: 转股中 | R29: 4.997年 | S29: 3年0.0天 | T29: 3.6 | U29: 3.4 | V29: 9.0000000000000011e-003 | W29: 5.0000000000000003e-002 | X29: 3.1e-002 | Y29: 72 | Z29: 3.77 | AA29: 4.1500000000000002e-002 | AB29: 3.3300000000000003e-002 | AC29: 8.3000000000000001e-003 | AD29: 6.0999999999999995e-003 | AE29: 85.22 | AF29: 90.95 | AG29: 0.2 | AH29: AA- | AI29: 6.3600000000000004e-002 | AJ29: =H29+100*O29 -> 166.49799999999999 | AK29: 140.8 | AL29: 254 | AM29: 49.8 | AN29: 255 | AO29: -3.7000000000000005e-002 | AP29: 22 | AQ29: 道恩转债!
A30: 116 | B30: 128132 | C30: 交建转债! | D30: 2941 | E30: 新疆交建 | F30: 建筑 | G30: 建筑工程 | H30: 95.6 | I30: -3.0999999999999999e-003 | J30: 2.2000000000000001e-003 | K30: 10.53 | L30: -9.3999999999999986e-003 | M30: 117.3 | N30: 18.57 | O30: 0.68599999999999994 | P30: 56.7 | Q30: 转股中 | R30: 5.20年 | S30: 3.21年 | T30: 8.5 | U30: 3.4 | V30: 4.0000000000000001e-003 | W30: 0.125 | X30: 7.0999999999999994e-002 | Y30: 68 | Z30: 2.8 | AA30: 4.0999999999999995e-002 | AB30: 3.4700000000000002e-002 | AC30: 2.5000000000000001e-002 | AD30: 2.2700000000000001e-002 | AE30: 89.92 | AF30: 94.19 | AG30: 0.1 | AH30: AA | AI30: 4.4000000000000004e-002 | AJ30: =H30+100*O30 -> 164.19999999999999 | AK30: 134.5 | AL30: 198 | AM30: 40.3 | AN30: 178 | AO30: -2.7999999999999997e-002 | AP30: 19 | AQ30: 交建转债!
A31: 265 | B31: 113027 | C31: 华钰转债!! | D31: 601020 | E31: ST华钰 | F31: 有色金属 | G31: 锌铅镍锡 | H31: 97.87 | I31: 8.9999999999999998e-004 | J31: 6.0000000000000001e-003 | K31: 7 | L31: 2.3399999999999997e-002 | M31: 114.3 | N31: 10.17 | O31: 0.42200000000000004 | P31: 68.83 | Q31: 转股中 | R31: 3.95年 | S31: 1.95年 | T31: 3.25 | U31: 14 | V31: 4.2999999999999997e-002 | W31: 8.4000000000000005e-002 | X31: 5.7999999999999996e-002 | Y31: 39 | Z31: 1.56 | AA31: 4.0800000000000003e-002 | AB31: 3.39e-002 | AC31: 2.3599999999999999e-002 | AD31: 2.1000000000000001e-002 | AE31: 86.66 | AF31: 83.43 | AG31: 0.3 | AH31: A | AI31: 8.4600000000000009e-002 | AJ31: =H31+100*O31 -> 140.06999999999999 | AK31: 126.9 | AL31: 105 | AM31: 40.2 | AN31: 176 | AO31: -3.6000000000000004e-002 | AP31: 47 | AQ31: 华钰转债!!
A32: 84 | B32: 123077 | C32: 汉得转债! | D32: 300170 | E32: 汉得信息 | F32: 计算机及 | G32: 软件开发 | H32: 101.813 | I32: -1.e-003 | J32: -3.9000000000000003e-003 | K32: 7.26 | L32: -1.89e-002 | M32: 125.5 | N32: 9.69 | O32: 0.35899999999999999 | P32: 74.92 | Q32: 转股中 | R32: 5.39年 | S32: 3.39年 | T32: 9.37 | U32: 7.1 | V32: 6.9999999999999993e-003 | W32: 0.14599999999999999 | X32: 0.109 | Y32: 64 | Z32: 2.02 | AA32: 4.0300000000000002e-002 | AB32: 3.2099999999999997e-002 | AC32: 5.6000000000000008e-003 | AD32: 3.4999999999999996e-003 | AE32: 89.22 | AF32: 99.94 | AG32: 0.26 | AH32: AA | AI32: 4.4000000000000004e-002 | AJ32: =H32+100*O32 -> 137.71299999999999 | AK32: 128.7 | AL32: 128 | AM32: 28.8 | AN32: 56 | AO32: -3.3000000000000002e-002 | AP32: 14 | AQ32: 汉得转债!
A33: 81 | B33: 128139 | C33: 祥鑫转债! | D33: 2965 | E33: 祥鑫科技 | F33: 汽车 | G33: 零部件制 | H33: 98.455 | I33: -8.8000000000000005e-003 | J33: 4.1999999999999997e-003 | K33: 24.3 | L33: -1.54e-002 | M33: 121 | N33: 36.96 | O33: 0.49700000000000005 | P33: 65.75 | Q33: 转股中 | R33: 5.41年 | S33: 3.42年 | T33: 6.47 | U33: 2.5 | V33: 4.0000000000000001e-003 | W33: 0.17699999999999999 | X33: 0.11599999999999999 | Y33: 37 | Z33: 2.07 | AA33: 3.9599999999999996e-002 | AB33: 3.2599999999999997e-002 | AC33: 1.54e-002 | AD33: 1.32e-002 | AE33: 83.13 | AF33: 86.66 | AG33: 0.3 | AH33: AA- | AI33: 6.5000000000000002e-002 | AJ33: =H33+100*O33 -> 148.155 | AK33: 131.2 | AL33: 157 | AM33: 44.5 | AN33: 213 | AO33: -1.2e-002 | AP33: 14 | AQ33: 祥鑫转债!
A34: 269 | B34: 113535 | C34: 大业转债! | D34: 603278 | E34: 大业股份 | F34: 汽车 | G34: 零部件制 | H34: 100.99 | I34: -1.e-004 | J34: 2.0000000000000001e-004 | K34: 8.41 | L34: 1.1999999999999999e-003 | M34: 112.5 | N34: 12.29 | O34: 0.47600000000000003 | P34: 68.43 | Q34: 转股中 | R34: 2.85年 | S34: 0.85年 | T34: 5 | U34: 1 | V34: 2.e-003 | W34: 0.20499999999999999 | X34: 0.14000000000000001 | Y34: 24 | Z34: 1.42 | AA34: 3.9e-002 | AB34: 3.0699999999999998e-002 | AC34: 2.5000000000000001e-003 | AD34: 1.e-004 | AE34: 97.21 | AF34: 100.5 | AG34: 0.11 | AH34: AA | AI34: 4.0800000000000003e-002 | AJ34: =H34+100*O34 -> 148.59 | AK34: 133.6 | AL34: 187 | AM34: 33 | AN34: 98 | AO34: 6.0000000000000001e-003 | AP34: 48 | AQ34: 大业转债!
A35: 307 | B35: 128049 | C35: 华源转债! | D35: 2787 | E35: 华源控股 | F35: 造纸包装 | G35: 包装材料 | H35: 100.92 | I35: -1.06e-002 | J35: 1.1599999999999999e-002 | K35: 5.41 | L35: 3.7000000000000002e-003 | M35: 114.5 | N35: 7.37 | O35: 0.375 | P35: 73.41 | Q35: 转股中 | R35: 3.40年 | S35: 1.41年 | T35: 3.63 | U35: 1.6 | V35: 4.0000000000000001e-003 | W35: 0.21199999999999999 | X35: 0.156 | Y35: 17 | Z35: 1.14 | AA35: 3.8599999999999995e-002 | AB35: 3.0499999999999999e-002 | AC35: 1.21e-002 | AD35: 8.5000000000000006e-003 | AE35: 93.41 | AF35: 93.24 | AG35: 0.29 | AH35: AA- | AI35: 6.3600000000000004e-002 | AJ35: =H35+100*O35 -> 138.42000000000002 | AK35: 128.4 | AL35: 124 | AM35: 35 | AN35: 120 | AO35: -5.7999999999999996e-002 | AP35: 43 | AQ35: 华源转债!
A36: 322 | B36: 123010 | C36: 博世转债! | D36: 300422 | E36: 博世科 | F36: 城市公用 | G36: 三废处理 | H36: 100.5 | I36: 1.e-004 | J36: -2.9999999999999997e-004 | K36: 8.37 | L36: -1.1999999999999999e-003 | M36: 112.3 | N36: 12.15 | O36: 0.45899999999999996 | P36: 68.89 | Q36: 转股中 | R36: 3年2.0天 | S36: 1年3.0天 | T36: 4.3 | U36: 2.7 | V36: 6.0000000000000001e-003 | W36: 0.127 | X36: 8.6999999999999994e-002 | Y36: 34 | Z36: 1.4 | AA36: 3.85e-002 | AB36: 3.0600000000000002e-002 | AC36: 1.9699999999999999e-002 | AD36: 1.49e-002 | AE36: 95.7 | AF36: 93.72 | AG36: 0.15 | AH36: AA- | AI36: 6.3600000000000004e-002 | AJ36: =H36+100*O36 -> 146.40000000000001 | AK36: 132.1 | AL36: 171 | AM36: 36.4 | AN36: 138 | AO36: -2.7000000000000003e-002 | AP36: 30 | AQ36: 博世转债!
A37: 124 | B37: 113601 | C37: 塞力转债! | D37: 603716 | E37: 塞力医疗 | F37: 医药 | G37: 医药商业 | H37: 100.45 | I37: -4.5999999999999999e-003 | J37: -2.8000000000000004e-003 | K37: 13.9 | L37: -1.5600000000000001e-002 | M37: 121.3 | N37: 16.98 | O37: 0.22699999999999998 | P37: 81.86 | Q37: 转股中 | R37: 5年49天 | S37: 3年50天 | T37: 5.43 | U37: 7.5 | V37: 1.3999999999999999e-002 | W37: 0.191 | X37: 0.156 | Y37: 28 | Z37: 1.82 | AA37: 3.8300000000000001e-002 | AB37: 3.0800000000000001e-002 | AC37: 1.1399999999999999e-002 | AD37: 8.8000000000000005e-003 | AE37: 84.89 | AF37: 88.49 | AG37: 0.47 | AH37: AA- | AI37: 6.5000000000000002e-002 | AJ37: =H37+100*O37 -> 123.15000000000001 | AK37: 119 | AL37: 34 | AM37: 30.6 | AN37: 69 | AO37: -1.3999999999999999e-002 | AP37: 39 | AQ37: 塞力转债!
A38: 257 | B38: 128072 | C38: 翔鹭转债! | D38: 2842 | E38: 翔鹭钨业 | F38: 有色金属 | G38: 小金属 | H38: 99.554 | I38: -5.1000000000000004e-003 | J38: 7.4999999999999997e-003 | K38: 9.03 | L38: 1.46e-002 | M38: 115.1 | N38: 15.34 | O38: 0.69099999999999995 | P38: 58.87 | Q38: 转股中 | R38: 4年48天 | S38: 2年49天 | T38: 3.02 | U38: 17 | V38: 5.5e-002 | W38: 0.122 | X38: 7.2000000000000008e-002 | Y38: 25 | Z38: 2.65 | AA38: 3.6600000000000001e-002 | AB38: 2.9600000000000001e-002 | AC38: 1.7000000000000001e-002 | AD38: 1.3899999999999999e-002 | AE38: 89.9 | AF38: 89.74 | AG38: 0.16 | AH38: AA- | AI38: 6.3600000000000004e-002 | AJ38: =H38+100*O38 -> 168.654 | AK38: 140.2 | AL38: 253 | AM38: 50.3 | AN38: 257 | AO38: -5.0000000000000001e-003 | AP38: 29 | AQ38: 翔鹭转债!
A39: 323 | B39: 127007 | C39: 湖广转债! | D39: 665 | E39: 湖北广电 | F39: 传媒娱乐 | G39: 影视娱乐 | H39: 100.34 | I39: -2.7000000000000001e-003 | J39: 1.4000000000000002e-003 | K39: 3.91 | L39: -1.01e-002 | M39: 111.3 | N39: 5.58 | O39: 0.43200000000000005 | P39: 70.07 | Q39: 转股中 | R39: 2.99年 | S39: 0.99年 | T39: 12.2 | U39: 4.7 | V39: 4.0000000000000001e-003 | W39: 0.317 | X39: 0.222 | Y39: 38 | Z39: 0.66 | AA39: 3.5799999999999998e-002 | AB39: 2.86e-002 | AC39: 1.26e-002 | AD39: 9.4999999999999998e-003 | AE39: 97.54 | AF39: 99.78 | AG39: 0.13 | AH39: AA+ | AI39: 3.78e-002 | AJ39: =H39+100*O39 -> 143.54000000000002 | AK39: 130.6 | AL39: 148 | AM39: 30.8 | AN39: 70 | AO39: -4.5999999999999999e-002 | AP39: 17 | AQ39: 湖广转债!
A40: 272 | B40: 127013 | C40: 创维转债! | D40: 810 | E40: 创维数字 | F40: 电子 | G40: 电子产品 | H40: 103.082 | I40: -1.2500000000000001e-002 | J40: 1.29e-002 | K40: 8.15 | L40: 2.5000000000000001e-003 | M40: 117.3 | N40: 11.29 | O40: 0.42799999999999999 | P40: 72.19 | Q40: 转股中 | R40: 3.78年 | S40: 1.79年 | T40: 9.78 | U40: 3.4 | V40: 3.0000000000000001e-003 | W40: 0.113 | X40: 8.1000000000000003e-002 | Y40: 87 | Z40: 2.05 | AA40: 3.5400000000000001e-002 | AB40: 2.7000000000000003e-002 | AC40: -1.4000000000000002e-003 | AD40: -4.1999999999999997e-003 | AE40: 94.81 | AF40: 100.45 | AG40: 0.17 | AH40: AA | AI40: 4.2599999999999999e-002 | AJ40: =H40+100*O40 -> 145.88200000000001 | AK40: 134 | AL40: 192 | AM40: 33.5 | AN40: 105 | AO40: -7.8e-002 | AP40: 22 | AQ40: 创维转债!
A41: 151 | B41: 123059 | C41: 银信转债! | D41: 300231 | E41: 银信科技 | F41: 计算机及 | G41: 软件开发 | H41: 104.82 | I41: -2.2000000000000001e-003 | J41: 2.7000000000000001e-003 | K41: 7.7 | L41: 1.2999999999999999e-003 | M41: 124.1 | N41: 9.72 | O41: 0.32299999999999995 | P41: 79.22 | Q41: 转股中 | R41: 5年12天 | S41: 3年13天 | T41: 3.91 | U41: 1.9 | V41: 5.0000000000000001e-003 | W41: 0.115 | X41: 9.0999999999999998e-002 | Y41: 34 | Z41: 2.5 | AA41: 3.49e-002 | AB41: 2.6499999999999999e-002 | AC41: -2.3999999999999998e-003 | AD41: -4.7999999999999996e-003 | AE41: 85.24 | AF41: 91.05 | AG41: 0.42 | AH41: AA- | AI41: 6.5000000000000002e-002 | AJ41: =H41+100*O41 -> 137.12 | AK41: 130.4 | AL41: 144 | AM41: 39.4 | AN41: 168 | AO41: -4.8000000000000001e-002 | AP41: 17 | AQ41: 银信转债!
A42: 247 | B42: 113546 | C42: 迪贝转债! | D42: 603320 | E42: 迪贝电气 | F42: 家电 | G42: 零部件制 | H42: 104.43 | I42: -1.1000000000000001e-003 | J42: 1.9e-003 | K42: 11.24 | L42: 1.8e-003 | M42: 120.6 | N42: 14 | O42: 0.30099999999999999 | P42: 80.29 | Q42: 转股中 | R42: 4.31年 | S42: 2.31年 | T42: 2.3 | U42: 1.1 | V42: 5.0000000000000001e-003 | W42: 0.157 | X42: 0.126 | Y42: 15 | Z42: 2.11 | AA42: 3.4799999999999998e-002 | AB42: 2.6200000000000001e-002 | AC42: -1.9e-003 | AD42: -5.0000000000000001e-003 | AE42: 87.19 | AF42: 89.15 | AG42: 0.45 | AH42: A+ | AI42: 7.46e-002 | AJ42: =H42+100*O42 -> 134.53 | AK42: 128.6 | AL42: 127 | AM42: 39.4 | AN42: 169 | AO42: -2.e-003 | AP42: 39 | AQ42: 迪贝转债!
A43: 157 | B43: 128118 | C43: 瀛通转债! | D43: 2861 | E43: 瀛通通讯 | F43: 电子 | G43: 电子产品 | H43: 103 | I43: -8.0000000000000004e-004 | J43: -1.e-004 | K43: 14.6 | L43: -2.7000000000000001e-003 | M43: 122.1 | N43: 21.12 | O43: 0.48999999999999999 | P43: 69.13 | Q43: 转股中 | R43: 4.997年 | S43: 3年0.0天 | T43: 3 | U43: 5 | V43: 1.6e-002 | W43: 0.13 | X43: 8.9999999999999997e-002 | Y43: 23 | Z43: 1.66 | AA43: 3.4700000000000002e-002 | AB43: 2.69e-002 | AC43: 3.7000000000000002e-003 | AD43: 1.1000000000000001e-003 | AE43: 85.88 | AF43: 90.05 | AG43: 0.32 | AH43: AA- | AI43: 6.3600000000000004e-002 | AJ43: =H43+100*O43 -> 152. | AK43: 136.9 | AL43: 217 | AM43: 46.8 | AN43: 231 | AO43: -4.4999999999999998e-002 | AP43: 16 | AQ43: 瀛通转债!
A44: 319 | B44: 123011 | C44: 德尔转债! | D44: 300473 | E44: 德尔股份 | F44: 汽车 | G44: 零部件制 | H44: 105.1 | I44: 1.e-003 | J44: 3.2000000000000002e-003 | K44: 22.16 | L44: 2.12e-002 | M44: 116.3 | N44: 31.38 | O44: 0.48799999999999999 | P44: 70.62 | Q44: 转股中 | R44: 3年15天 | S44: 1年16天 | T44: 2.51 | U44: 16 | V44: 5.9000000000000004e-002 | W44: 8.4000000000000005e-002 | X44: 5.9000000000000004e-002 | Y44: 30 | Z44: 1.36 | AA44: 3.4599999999999999e-002 | AB44: 2.4700000000000003e-002 | AC44: -1.83e-002 | AD44: -2.2700000000000001e-002 | AE44: 95.49 | AF44: 96.83 | AG44: 0.19 | AH44: AA- | AI44: 6.3600000000000004e-002 | AJ44: =H44+100*O44 -> 153.89999999999998 | AK44: 139.6 | AL44: 243 | AM44: 42.8 | AN44: 199 | AO44: 7.4999999999999997e-002 | AP44: 42 | AQ44: 德尔转债!
A45: 263 | B45: 128069 | C45: 华森转债! | D45: 2907 | E45: 华森制药 | F45: 医药 | G45: 化学制药 | H45: 104.43 | I45: -8.3000000000000001e-003 | J45: 1.6000000000000001e-003 | K45: 13.48 | L45: -2.2499999999999999e-002 | M45: 119.3 | N45: 18.01 | O45: 0.39500000000000002 | P45: 74.85 | Q45: 转股中 | R45: 3.98年 | S45: 1.98年 | T45: 3 | U45: 18 | V45: 5.7000000000000002e-002 | W45: 5.5e-002 | X45: 4.0999999999999995e-002 | Y45: 54 | Z45: 4.76 | AA45: 3.4599999999999999e-002 | AB45: 2.5899999999999999e-002 | AC45: -7.4000000000000003e-003 | AD45: -9.8999999999999991e-003 | AE45: 90.14 | AF45: 93.75 | AG45: 0.29 | AH45: AA- | AI45: 6.3600000000000004e-002 | AJ45: =H45+100*O45 -> 143.93000000000001 | AK45: 134 | AL45: 194 | AM45: 40.3 | AN45: 177 | AO45: 1.9e-002 | AP45: 44 | AQ45: 华森转债!
A46: 131 | B46: 113599 | C46: 嘉友转债! | D46: 603871 | E46: 嘉友国际 | F46: 交通运输 | G46: 物流业 | H46: 106.34 | I46: -1.29e-002 | J46: 4.8999999999999998e-003 | K46: 15.65 | L46: -1.7000000000000001e-002 | M46: 126 | N46: 18.32 | O46: 0.245 | P46: 85.43 | Q46: 转股中 | R46: 5年33天 | S46: 3年34天 | T46: 7.2 | U46: 4 | V46: 5.0000000000000001e-003 | W46: 0.161 | X46: 0.13800000000000001 | Y46: 45 | Z46: 1.6 | AA46: 3.4599999999999999e-002 | AB46: 2.58e-002 | AC46: -7.0999999999999995e-003 | AD46: -9.3999999999999986e-003 | AE46: 84.84 | AF46: 92.07 | AG46: 0.47 | AH46: AA- | AI46: 6.5000000000000002e-002 | AJ46: =H46+100*O46 -> 130.84 | AK46: 127.3 | AL46: 114 | AM46: 35.2 | AN46: 125 | AO46: -0.18600000000000003 | AP46: 19 | AQ46: 嘉友转债!
A47: 173 | B47: 113584 | C47: 家悦转债! | D47: 603708 | E47: 家家悦 | F47: 商业零售 | G47: 超市 | H47: 97.55 | I47: -1.11e-002 | J47: 1.e-002 | K47: 17.39 | L47: -3.3399999999999999e-002 | M47: 114.9 | N47: 37.53 | O47: 1.1100000000000001 | P47: 46.34 | Q47: 转股中 | R47: 4.92年 | S47: 2.93年 | T47: 6.45 | U47: 15 | V47: 2.4e-002 | W47: 6.0999999999999999e-002 | X47: 2.7999999999999997e-002 | Y47: 106 | Z47: 3.76 | AA47: 3.44e-002 | AB47: 2.87e-002 | AC47: 1.9199999999999998e-002 | AD47: 1.7000000000000001e-002 | AE47: 90.98 | AF47: 93.92 | AG47: 0.03 | AH47: AA | AI47: 4.2599999999999999e-002 | AJ47: =H47+100*O47 -> 208.55000000000001 | AK47: 148.8 | AL47: 287 | AM47: 54.8 | AN47: 275 | AO47: -3.7000000000000005e-002 | AP47: 13 | AQ47: 家悦转债!
A48: 186 | B48: 123049 | C48: 维尔转债 | D48: 300190 | E48: 维尔利 | F48: 城市公用 | G48: 三废处理 | H48: 106.177 | I48: -9.4999999999999998e-003 | J48: 4.5000000000000005e-003 | K48: 6.33 | L48: -1.09e-002 | M48: 124.3 | N48: 7.38 | O48: 0.23800000000000002 | P48: 85.77 | Q48: 转股中 | R48: 4.78年 | S48: 2.78年 | T48: 9.17 | U48: 3.3 | V48: 3.0000000000000001e-003 | W48: 0.185 | X48: 0.159 | Y48: 49 | Z48: 1.14 | AA48: 3.4300000000000004e-002 | AB48: 2.5399999999999999e-002 | AC48: -6.3e-003 | AD48: -9.1000000000000004e-003 | AE48: 87.07 | AF48: 93.21 | AG48: 0.46 | AH48: AA- | AI48: 6.3600000000000004e-002 | AJ48: =H48+100*O48 -> 129.977 | AK48: 126.6 | AL48: 100 | AM48: 33.4 | AN48: 102 | AO48: -4.8000000000000001e-002 | AP48: 17 | AQ48: 维尔转债
A49: 86 | B49: 123076 | C49: 强力转债! | D49: 300429 | E49: 强力新材 | F49: 化工 | G49: 化工 | H49: 99.47 | I49: -4.0999999999999995e-003 | J49: -8.9999999999999998e-004 | K49: 12.49 | L49: -1.5800000000000002e-002 | M49: 118.5 | N49: 18.94 | O49: 0.50800000000000001 | P49: 65.95 | Q49: 转股中 | R49: 5.38年 | S49: 3.38年 | T49: 8.5 | U49: 5.2 | V49: 6.0000000000000001e-003 | W49: 0.13200000000000001 | X49: 8.6999999999999994e-002 | Y49: 64 | Z49: 3.64 | AA49: 3.3799999999999997e-002 | AB49: 2.7400000000000001e-002 | AC49: 1.23e-002 | AD49: 1.01e-002 | AE49: 83.24 | AF49: 85.04 | AG49: 0.31 | AH49: AA- | AI49: 6.5000000000000002e-002 | AJ49: =H49+100*O49 -> 150.26999999999998 | AK49: 133 | AL49: 184 | AM49: 48 | AN49: 243 | AO49: -8.0000000000000002e-003 | AP49: 16 | AQ49: 强力转债!
A50: 270 | B50: 128066 | C50: 亚泰转债! | D50: 2811 | E50: 郑中设计 | F50: 建筑 | G50: 装饰工程 | H50: 103.31 | I50: 5.8999999999999999e-003 | J50: -1.0800000000000001e-002 | K50: 8.05 | L50: -1.11e-002 | M50: 116.7 | N50: 9.27 | O50: 0.19 | P50: 86.84 | Q50: 转股中 | R50: 3.79年 | S50: 1.79年 | T50: 4.8 | U50: 7.6 | V50: 1.4999999999999999e-002 | W50: 0.221 | X50: 0.192 | Y50: 22 | Z50: 1.47 | AA50: 3.3300000000000003e-002 | AB50: 2.52e-002 | AC50: -1.4000000000000002e-003 | AD50: -4.4000000000000003e-003 | AE50: 91.41 | AF50: 92.82 | AG50: 0.45 | AH50: AA- | AI50: 6.3600000000000004e-002 | AJ50: =H50+100*O50 -> 122.31 | AK50: 119.8 | AL50: 42 | AM50: 27 | AN50: 41 | AO50: -2.1000000000000001e-002 | AP50: 60 | AQ50: 亚泰转债!
A51: 182 | B51: 113578 | C51: 全筑转债! | D51: 603030 | E51: 全筑股份 | F51: 建筑 | G51: 装饰工程 | H51: 101.11 | I51: 3.9000000000000003e-003 | J51: 1.e-003 | K51: 4.43 | L51: 1.37e-002 | M51: 117.9 | N51: 5.4 | O51: 0.23199999999999998 | P51: 82.04 | Q51: 转股中 | R51: 4.80年 | S51: 2.80年 | T51: 3.84 | U51: 5.3 | V51: 1.3999999999999999e-002 | W51: 0.161 | X51: 0.13200000000000001 | Y51: 24 | Z51: 1.05 | AA51: 3.32e-002 | AB51: 2.63e-002 | AC51: 7.7000000000000002e-003 | AD51: 5.4000000000000003e-003 | AE51: 91.46 | AF51: 96.87 | AG51: 0.35 | AH51: AA | AI51: 4.2599999999999999e-002 | AJ51: =H51+100*O51 -> 124.31 | AK51: 120.2 | AL51: 46 | AM51: 23.3 | AN51: 21 | AO51: 1.1000000000000001e-002 | AP51: 21 | AQ51: 全筑转债!
A52: 164 | B52: 123056 | C52: 雪榕转债! | D52: 300511 | E52: 雪榕生物 | F52: 农业 | G52: 种植业 | H52: 103.151 | I52: 7.000000000000001e-004 | J52: -3.7000000000000002e-003 | K52: 8.18 | L52: -9.7000000000000003e-003 | M52: 120.7 | N52: 11.77 | O52: 0.48399999999999999 | P52: 69.5 | Q52: 转股中 | R52: 4.98年 | S52: 2.98年 | T52: 5.84 | U52: 3.8 | V52: 6.0000000000000001e-003 | W52: 0.16200000000000001 | X52: 0.11199999999999999 | Y52: 36 | Z52: 1.74 | AA52: 3.27e-002 | AB52: 2.53e-002 | AC52: 1.5e-003 | AD52: -8.0000000000000004e-004 | AE52: 85.5 | AF52: 89.35 | AG52: 0.31 | AH52: AA- | AI52: 6.3600000000000004e-002 | AJ52: =H52+100*O52 -> 151.55099999999999 | AK52: 136.8 | AL52: 215 | AM52: 47.5 | AN52: 239 | AO52: -3.1e-002 | AP52: 16 | AQ52: 雪榕转债!
A53: 245 | B53: 110059 | C53: 浦发转债! | D53: 600000 | E53: 浦发银行 | F53: 金融 | G53: 银行行业 | H53: 102.95 | I53: -1.e-004 | J53: -1.6000000000000001e-003 | K53: 9.93 | L53: -1.e-002 | M53: 117.6 | N53: 14.45 | O53: 0.498 | P53: 68.72 | Q53: 转股中 | R53: 4.32年 | S53: 无权 | T53: 500 | U53: 147 | V53: 3.0000000000000001e-003 | W53: 0.17199999999999999 | X53: 0.11800000000000001 | Y53: 2915. | Z53: 0.54 | AA53: 3.2300000000000002e-002 | AB53: 2.4700000000000003e-002 | AC53: 无权 | AD53: 无权 | AE53: 无权 | AF53: 100.75 | AG53: 0.17 | AH53: AAA | AI53: 3.7599999999999995e-002 | AJ53: =H53+100*O53 -> 152.75 | AK53: 137.2 | AL53: 221 | AM53: 36.4 | AN53: 139 | AO53: -1.7000000000000001e-002 | AP53: 61 | AQ53: 浦发转债!
A54: 160 | B54: 113591 | C54: 胜达转债! | D54: 603687 | E54: 大胜达 | F54: 造纸包装 | G54: 包装用纸 | H54: 104.27 | I54: 3.3e-003 | J54: -5.1999999999999998e-003 | K54: 7.73 | L54: -3.9000000000000003e-003 | M54: 121.7 | N54: 8.76 | O54: 0.182 | P54: 88.24 | Q54: 转股中 | R54: 4.99年 | S54: 2.997年 | T54: 5.5 | U54: 6.6 | V54: 1.2e-002 | W54: 0.17300000000000001 | X54: 0.153 | Y54: 32 | Z54: 1.84 | AA54: 3.2000000000000001e-002 | AB54: 2.4300000000000002e-002 | AC54: -2.e-003 | AD54: -4.1999999999999997e-003 | AE54: 85.4 | AF54: 89.98 | AG54: 0.51 | AH54: AA- | AI54: 6.3600000000000004e-002 | AJ54: =H54+100*O54 -> 122.47 | AK54: 120.3 | AL54: 47 | AM54: 30.3 | AN54: 66 | AO54: -4.5999999999999999e-002 | AP54: 28 | AQ54: 胜达转债!
A55: 64 | B55: 123088 | C55: 威唐转债! | D55: 300707 | E55: 威唐工业 | F55: 汽车 | G55: 零部件制 | H55: 102.809 | I55: -1.9e-003 | J55: 1.34e-002 | K55: 16.58 | L55: 2.1600000000000001e-002 | M55: 121.6 | N55: 20.72 | O55: 0.28499999999999998 | P55: 80.02 | Q55: 转股中 | R55: 5.45年 | S55: 3.45年 | T55: 3.01 | U55: 9.9 | V55: 3.2000000000000001e-002 | W55: 0.11599999999999999 | X55: 9.3000000000000013e-002 | Y55: 26 | Z55: 3.78 | AA55: 3.2000000000000001e-002 | AB55: 2.4900000000000002e-002 | AC55: 4.8999999999999998e-003 | AD55: 2.3999999999999998e-003 | AE55: 80.51 | AF55: 82.36 | AG55: 0.54 | AH55: A+ | AI55: 7.5999999999999998e-002 | AJ55: =H55+100*O55 -> 131.309 | AK55: 125.6 | AL55: 86 | AM55: 43.2 | AN55: 203 | AO55: 2.6000000000000002e-002 | AP55: 14 | AQ55: 威唐转债!
A56: 194 | B56: 127016 | C56: 鲁泰转债! | D56: 726 | E56: 鲁 泰Ａ | F56: 服装纺织 | G56: 纺织行业 | H56: 100.108 | I56: -2.3999999999999998e-003 | J56: 2.3999999999999998e-003 | K56: 5.97 | L56: 0. | M56: 115.9 | N56: 8.71 | O56: 0.46100000000000002 | P56: 68.54 | Q56: 转股中 | R56: 4.77年 | S56: 2.77年 | T56: 14 | U56: 2.7 | V56: 2.e-003 | W56: 0.26600000000000001 | X56: 0.182 | Y56: 53 | Z56: 0.67 | AA56: 3.1800000000000002e-002 | AB56: 2.5600000000000001e-002 | AC56: 1.1200000000000002e-002 | AD56: 8.8999999999999999e-003 | AE56: 92.35 | AF56: 96.65 | AG56: 0.19 | AH56: AA+ | AI56: 3.9599999999999996e-002 | AJ56: =H56+100*O56 -> 146.208 | AK56: 131.7 | AL56: 163 | AM56: 35 | AN56: 121 | AO56: -2.5000000000000001e-002 | AP56: 21 | AQ56: 鲁泰转债!
A57: 10 | B57: 113624 | C57: 正川转债! | D57: 603976 | E57: 正川股份 | F57: 医药 | G57: 医药行业 | H57: 101.86 | I57: -7.1999999999999998e-003 | J57: -8.6e-003 | K57: 36.95 | L57: -2.87e-002 | M57: 121.6 | N57: 46.69 | O57: 0.28699999999999998 | P57: 79.14 | Q57: 4月9天 | R57: 5.82年 | S57: 3.82年 | T57: 4.05 | U57: 8.5 | V57: 2.e-002 | W57: 7.2000000000000008e-002 | X57: 5.7000000000000002e-002 | Y57: 56 | Z57: 5.3 | AA57: 3.1600000000000003e-002 | AB57: 2.5000000000000001e-002 | AC57: 6.8000000000000005e-003 | AD57: 4.5000000000000005e-003 | AE57: 78.37 | AF57: 80.18 | AG57: 0.55 | AH57: A+ | AI57: 7.5999999999999998e-002 | AJ57: =H57+100*O57 -> 130.56 | AK57: 124.6 | AL57: 76 | AM57: 44.4 | AN57: 211 | AO57: -5.7000000000000002e-002 | AP57: 11 | AQ57: 正川转债!
A58: 47 | B58: 113042 | C58: 上银转债! | D58: 601229 | E58: 上海银行 | F58: 金融 | G58: 银行行业 | H58: 102.35 | I58: -8.9999999999999998e-004 | J58: -1.e-004 | K58: 8.2 | L58: -3.5999999999999999e-003 | M58: 120.9 | N58: 11.03 | O58: 0.377 | P58: 74.34 | Q58: 27天 | R58: 5.56年 | S58: 无权 | T58: 200 | U58: 95 | V58: 5.0000000000000001e-003 | W58: 0.17199999999999999 | X58: 0.128 | Y58: 1165. | Z58: 0.67 | AA58: 3.1300000000000001e-002 | AB58: 2.4500000000000001e-002 | AC58: 无权 | AD58: 无权 | AE58: 无权 | AF58: 98.3 | AG58: 0.28 | AH58: AAA | AI58: 3.9e-002 | AJ58: =H58+100*O58 -> 140.05000000000001 | AK58: 130.4 | AL58: 143 | AM58: 32.1 | AN58: 84 | AO58: -1.6e-002 | AP58: 11 | AQ58: 上银转债!
A59: 279 | B59: 113532 | C59: 海环转债! | D59: 603817 | E59: 海峡环保 | F59: 城市公用 | G59: 三废处理 | H59: 100.29 | I59: -4.5999999999999999e-003 | J59: 1.6000000000000001e-003 | K59: 5.46 | L59: -1.44e-002 | M59: 112.3 | N59: 7.63 | O59: 0.40100000000000002 | P59: 71.56 | Q59: 转股中 | R59: 3.75年 | S59: 1.75年 | T59: 4.59 | U59: 0.7 | V59: 1.e-003 | W59: 0.187 | X59: 0.13400000000000001 | Y59: 25 | Z59: 1.39 | AA59: 3.1200000000000002e-002 | AB59: 2.4900000000000002e-002 | AC59: 1.3100000000000001e-002 | AD59: 1.0200000000000001e-002 | AE59: 94.95 | AF59: 96.33 | AG59: 0.21 | AH59: AA | AI59: 4.2599999999999999e-002 | AJ59: =H59+100*O59 -> 140.39000000000001 | AK59: 129 | AL59: 131 | AM59: 32.7 | AN59: 95 | AO59: -4.2000000000000003e-002 | AP59: 26 | AQ59: 海环转债!
A60: 364 | B60: 128013 | C60: 洪涛转债! | D60: 2325 | E60: 洪涛股份 | F60: 建筑 | G60: 装饰工程 | H60: 106.3 | I60: -5.4000000000000003e-003 | J60: 8.0000000000000004e-004 | K60: 2.43 | L60: -8.199999999999999e-003 | M60: 109.8 | N60: 2.32 | O60: 1.4999999999999999e-002 | P60: 104.74 | Q60: 转股中 | R60: 1年27天 | S60: 回售内 | T60: 11.5 | U60: 39 | V60: 3.2000000000000001e-002 | W60: 0.377 | X60: 0.39500000000000002 | Y60: 31 | Z60: 1.13 | AA60: 3.1099999999999999e-002 | AB60: 1.37e-002 | AC60: 回售内 | AD60: 回售内 | AE60: 100.3 | AF60: 99.97 | AG60: 0.57 | AH60: A- | AI60: 9.2799999999999994e-002 | AJ60: =H60+100*O60 -> 107.8 | AK60: 107.9 | AL60: 2 | AM60: 7.6 | AN60: 1 | AO60: 4.0000000000000001e-003 | AP60: 91 | AQ60: 洪涛转债!
A61: 77 | B61: 123080 | C61: 海波转债! | D61: 300517 | E61: 海波重科 | F61: 建筑 | G61: 建筑工程 | H61: 107.555 | I61: -3.8e-003 | J61: 4.8999999999999998e-003 | K61: 11.13 | L61: 1.8e-003 | M61: 126.5 | N61: 11.58 | O61: 0.11900000000000001 | P61: 96.11 | Q61: 转股中 | R61: 5.42年 | S61: 3.42年 | T61: 2.45 | U61: 4.3 | V61: 1.6e-002 | W61: 0.114 | X61: 0.11 | Y61: 21 | Z61: 1.43 | AA61: 3.1099999999999999e-002 | AB61: 2.2700000000000001e-002 | AC61: -7.6e-003 | AD61: -1.01e-002 | AE61: 80.78 | AF61: 85.89 | AG61: 0.63 | AH61: A+ | AI61: 7.5999999999999998e-002 | AJ61: =H61+100*O61 -> 119.45500000000001 | AK61: 119 | AL61: 32 | AM61: 33.1 | AN61: 99 | AO61: -4.0999999999999995e-002 | AP61: 21 | AQ61: 海波转债!
A62: 303 | B62: 113524 | C62: 奇精转债! | D62: 603677 | E62: 奇精机械 | F62: 家电 | G62: 零部件制 | H62: 105.86 | I62: 9.1999999999999998e-003 | J62: 8.6999999999999994e-003 | K62: 11.81 | L62: 4.5100000000000001e-002 | M62: 117.3 | N62: 13.98 | O62: 0.253 | P62: 84.48 | Q62: 转股中 | R62: 3.45年 | S62: 1.45年 | T62: 3.3 | U62: 37 | V62: 0.106 | W62: 0.14499999999999999 | X62: 0.12300000000000001 | Y62: 23 | Z62: 2.31 | AA62: 3.0800000000000001e-002 | AB62: 2.1600000000000001e-002 | AC62: -1.8100000000000002e-002 | AD62: -2.1400000000000002e-002 | AE62: 93.12 | AF62: 95.23 | AG62: 0.39 | AH62: AA- | AI62: 6.3600000000000004e-002 | AJ62: =H62+100*O62 -> 131.16 | AK62: 127.2 | AL62: 112 | AM62: 32 | AN62: 83 | AO62: 6.3e-002 | AP62: 43 | AQ62: 奇精转债!
A63: 213 | B63: 113566 | C63: 翔港转债! | D63: 603499 | E63: 翔港科技 | F63: 造纸包装 | G63: 包装材料 | H63: 107.98 | I63: -4.1999999999999997e-003 | J63: -1.5e-003 | K63: 7.4 | L63: -1.7299999999999999e-002 | M63: 124 | N63: 10.77 | O63: 0.57200000000000006 | P63: 68.71 | Q63: 转股中 | R63: 4.66年 | S63: 2.66年 | T63: 1.61 | U63: 1 | V63: 5.0000000000000001e-003 | W63: 0.10800000000000001 | X63: 7.400000000000001e-002 | Y63: 15 | Z63: 2.63 | AA63: 3.0800000000000001e-002 | AB63: 2.1899999999999999e-002 | AC63: -1.2800000000000001e-002 | AD63: -1.5600000000000001e-002 | AE63: 85.21 | AF63: 89.39 | AG63: 0.33 | AH63: A+ | AI63: 7.46e-002 | AJ63: =H63+100*O63 -> 165.18000000000001 | AK63: 147.3 | AL63: 279 | AM63: 57.9 | AN63: 289 | AO63: -5.0999999999999997e-002 | AP63: 28 | AQ63: 翔港转债!
A64: 226 | B64: 123039 | C64: 开润转债! | D64: 300577 | E64: 开润股份 | F64: 服装纺织 | G64: 纺织行业 | H64: 106 | I64: 1.e-003 | J64: 7.000000000000001e-004 | K64: 20.89 | L64: 5.3e-003 | M64: 121 | N64: 29.9 | O64: 0.51700000000000002 | P64: 69.87 | Q64: 转股中 | R64: 4.48年 | S64: 2.48年 | T64: 2.22 | U64: 1.1 | V64: 5.0000000000000001e-003 | W64: 4.4000000000000004e-002 | X64: 3.1e-002 | Y64: 50 | Z64: 3.27 | AA64: 3.0699999999999998e-002 | AB64: 2.23e-002 | AC64: -6.8999999999999999e-003 | AD64: -9.8999999999999991e-003 | AE64: 86.21 | AF64: 88.33 | AG64: 0.33 | AH64: A+ | AI64: 7.46e-002 | AJ64: =H64+100*O64 -> 157.69999999999999 | AK64: 142.1 | AL64: 261 | AM64: 53.8 | AN64: 269 | AO64: -3.7999999999999999e-002 | AP64: 23 | AQ64: 开润转债!
A65: 133 | B65: 128125 | C65: 华阳转债! | D65: 2949 | E65: 华阳国际 | F65: 建筑 | G65: 建筑工程 | H65: 101.967 | I65: -6.5000000000000006e-003 | J65: 1.8e-003 | K65: 16.68 | L65: -1.5900000000000001e-002 | M65: 118.5 | N65: 25.39 | O65: 0.55200000000000005 | P65: 65.7 | Q65: 转股中 | R65: 5年27天 | S65: 3年28天 | T65: 4.5 | U65: 0.8 | V65: 2.e-003 | W65: 0.13800000000000001 | X65: 8.9999999999999997e-002 | Y65: 33 | Z65: 2.56 | AA65: 3.0699999999999998e-002 | AB65: 2.41e-002 | AC65: 5.6999999999999993e-003 | AD65: 3.4000000000000002e-003 | AE65: 84.86 | AF65: 86.7 | AG65: 0.3 | AH65: AA- | AI65: 6.5000000000000002e-002 | AJ65: =H65+100*O65 -> 157.167 | AK65: 138.2 | AL65: 231 | AM65: 51.5 | AN65: 262 | AO65: -2.7999999999999997e-002 | AP65: 7 | AQ65: 华阳转债!
A66: 37 | B66: 113620 | C66: 傲农转债! | D66: 603363 | E66: 傲农生物 | F66: 农业 | G66: 畜牧业 | H66: 102.25 | I66: -3.9000000000000003e-003 | J66: 7.4000000000000003e-003 | K66: 10.56 | L66: 1.2500000000000001e-002 | M66: 121.1 | N66: 14.51 | O66: 0.40500000000000003 | P66: 72.78 | Q66: 2月16天 | R66: 5.68年 | S66: 3.69年 | T66: 10 | U66: 4.6 | V66: 4.0000000000000001e-003 | W66: 0.13800000000000001 | X66: 0.10099999999999999 | Y66: 72 | Z66: 2.45 | AA66: 3.0699999999999998e-002 | AB66: 2.41e-002 | AC66: 3.4000000000000002e-003 | AD66: 1.6000000000000001e-003 | AE66: 87.88 | AF66: 95.2 | AG66: 0.28 | AH66: AA | AI66: 4.4000000000000004e-002 | AJ66: =H66+100*O66 -> 142.75 | AK66: 131.7 | AL66: 164 | AM66: 36.5 | AN66: 140 | AO66: 4.9000000000000002e-002 | AP66: 6 | AQ66: 傲农转债!
A67: 287 | B67: 110056 | C67: 亨通转债! | D67: 600487 | E67: 亨通光电 | F67: 通信互联 | G67: 通信设备 | H67: 102.47 | I67: -5.7999999999999996e-003 | J67: 3.7000000000000002e-003 | K67: 11.05 | L67: -1.1599999999999999e-002 | M67: 114.3 | N67: 15.01 | O67: 0.39200000000000002 | P67: 73.62 | Q67: 转股中 | R67: 3.71年 | S67: 1.71年 | T67: 17.1 | U67: 3.9 | V67: 2.e-003 | W67: 6.6000000000000003e-002 | X67: 4.8000000000000001e-002 | Y67: 261 | Z67: 1.3 | AA67: 3.0499999999999999e-002 | AB67: 2.3199999999999998e-002 | AC67: 1.7000000000000001e-003 | AD67: -1.1999999999999999e-003 | AE67: 95.62 | AF67: 99.23 | AG67: 0.18 | AH67: AA+ | AI67: 3.9599999999999996e-002 | AJ67: =H67+100*O67 -> 141.67000000000002 | AK67: 131.3 | AL67: 159 | AM67: 32.1 | AN67: 85 | AO67: -5.2000000000000005e-002 | AP67: 28 | AQ67: 亨通转债!
A68: 294 | B68: 113021 | C68: 中信转债! | D68: 601998 | E68: 中信银行 | F68: 金融 | G68: 银行行业 | H68: 106.07 | I68: -4.0000000000000002e-004 | J68: -1.6000000000000001e-003 | K68: 5.09 | L68: -1.1699999999999999e-002 | M68: 118 | N68: 6.98 | O68: 0.45500000000000002 | P68: 72.92 | Q68: 转股中 | R68: 3.67年 | S68: 无权 | T68: 400 | U68: 19 | V68: 0. | W68: 0.161 | X68: 0.11699999999999999 | Y68: 2491. | Z68: 0.52 | AA68: 3.04e-002 | AB68: 2.1299999999999999e-002 | AC68: 无权 | AD68: 无权 | AE68: 无权 | AF68: 103.46 | AG68: 0.17 | AH68: AAA | AI68: 3.7599999999999995e-002 | AJ68: =H68+100*O68 -> 151.56999999999999 | AK68: 139.2 | AL68: 239 | AM68: 35.8 | AN68: 131 | AO68: -1.7000000000000001e-002 | AP68: 43 | AQ68: 中信转债!
A69: 296 | B69: 128056 | C69: 今飞转债! | D69: 2863 | E69: 今飞凯达 | F69: 汽车 | G69: 零部件制 | H69: 108 | I69: -4.5999999999999999e-003 | J69: 4.0000000000000001e-003 | K69: 4.97 | L69: -2.e-003 | M69: 120.2 | N69: 6.7 | O69: 0.45600000000000002 | P69: 74.18 | Q69: 转股中 | R69: 3.66年 | S69: 1.66年 | T69: 1.72 | U69: 1.3 | V69: 6.9999999999999993e-003 | W69: 7.0000000000000007e-002 | X69: 5.2000000000000005e-002 | Y69: 25 | Z69: 1.33 | AA69: 3.0299999999999997e-002 | AB69: 2.0499999999999997e-002 | AC69: -2.3900000000000001e-002 | AD69: -2.7400000000000001e-002 | AE69: 90.75 | AF69: 92.91 | AG69: 0.31 | AH69: A+ | AI69: 7.46e-002 | AJ69: =H69+100*O69 -> 153.59999999999999 | AK69: 141.8 | AL69: 259 | AM69: 48.9 | AN69: 251 | AO69: -2.6000000000000002e-002 | AP69: 53 | AQ69: 今飞转债!
A70: 156 | B70: 113036 | C70: 宁建转债! | D70: 601789 | E70: 宁波建工 | F70: 建筑 | G70: 建筑工程 | H70: 101.33 | I70: -1.2999999999999999e-003 | J70: -4.0000000000000002e-004 | K70: 3.61 | L70: -5.5000000000000005e-003 | M70: 117.3 | N70: 4.76 | O70: 0.33600000000000002 | P70: 75.84 | Q70: 转股中 | R70: 5年3.0天 | S70: 3年4.0天 | T70: 5.4 | U70: 1.5 | V70: 3.0000000000000001e-003 | W70: 0.153 | X70: 0.11599999999999999 | Y70: 35 | Z70: 1.12 | AA70: 3.0299999999999997e-002 | AB70: 2.3900000000000001e-002 | AC70: 7.7000000000000002e-003 | AD70: 5.3e-003 | AE70: 90.68 | AF70: 94.99 | AG70: 0.3 | AH70: AA | AI70: 4.4000000000000004e-002 | AJ70: =H70+100*O70 -> 134.93000000000001 | AK70: 126.8 | AL70: 102 | AM70: 31.8 | AN70: 81 | AO70: -5.5e-002 | AP70: 9 | AQ70: 宁建转债!
A71: 195 | B71: 113033 | C71: 利群转债! | D71: 601366 | E71: 利群股份 | F71: 商业零售 | G71: 商场 | H71: 100.02 | I71: 0. | J71: -7.000000000000001e-004 | K71: 6.26 | L71: -1.6000000000000001e-003 | M71: 114.9 | N71: 7.01 | O71: 0.12 | P71: 89.3 | Q71: 转股中 | R71: 4.75年 | S71: 2.75年 | T71: 18 | U71: 5.5 | V71: 3.0000000000000001e-003 | W71: 0.33399999999999996 | X71: 0.29799999999999999 | Y71: 54 | Z71: 1.16 | AA71: 3.0200000000000001e-002 | AB71: 2.4300000000000002e-002 | AC71: 1.1599999999999999e-002 | AD71: 9.300000000000001e-003 | AE71: 91.66 | AF71: 94.62 | AG71: 0.46 | AH71: AA | AI71: 4.2599999999999999e-002 | AJ71: =H71+100*O71 -> 112.02 | AK71: 110.7 | AL71: 6 | AM71: 16.1 | AN71: 4 | AO71: 3.0000000000000001e-003 | AP71: 59 | AQ71: 利群转债!
A72: 198 | B72: 110068 | C72: 龙净转债! | D72: 600388 | E72: 龙净环保 | F72: 城市公用 | G72: 三废处理 | H72: 100.03 | I72: -8.1000000000000013e-003 | J72: 3.7000000000000002e-003 | K72: 8.42 | L72: -1.41e-002 | M72: 114.8 | N72: 10.73 | O72: 0.27500000000000002 | P72: 78.47 | Q72: 转股中 | R72: 4.72年 | S72: 2.73年 | T72: 20 | U72: 6.3 | V72: 3.0000000000000001e-003 | W72: 0.222 | X72: 0.17399999999999999 | Y72: 90 | Z72: 1.48 | AA72: 3.0099999999999998e-002 | AB72: 2.4300000000000002e-002 | AC72: 1.1299999999999999e-002 | AD72: 9.0000000000000011e-003 | AE72: 92.41 | AF72: 95.88 | AG72: 0.31 | AH72: AA+ | AI72: 3.9599999999999996e-002 | AJ72: =H72+100*O72 -> 127.53 | AK72: 121.6 | AL72: 55 | AM72: 25.7 | AN72: 32 | AO72: -1.9e-002 | AP72: 33 | AQ72: 龙净转债!
A73: 171 | B73: 123053 | C73: 宝通转债! | D73: 300031 | E73: 宝通科技 | F73: 通信互联 | G73: 互联网 | H73: 104.75 | I73: -1.4000000000000002e-003 | J73: -3.4999999999999996e-003 | K73: 15.42 | L73: -1.2800000000000001e-002 | M73: 120.8 | N73: 20.5 | O73: 0.39299999999999996 | P73: 75.22 | Q73: 转股中 | R73: 4.92年 | S73: 2.93年 | T73: 5 | U73: 5.6 | V73: 1.1000000000000001e-002 | W73: 8.199999999999999e-002 | X73: 6.0999999999999999e-002 | Y73: 61 | Z73: 1.99 | AA73: 2.9999999999999999e-002 | AB73: 2.2400000000000003e-002 | AC73: -3.2000000000000002e-003 | AD73: -5.5000000000000005e-003 | AE73: 85.87 | AF73: 89.73 | AG73: 0.38 | AH73: AA- | AI73: 6.3600000000000004e-002 | AJ73: =H73+100*O73 -> 144.05000000000001 | AK73: 134.3 | AL73: 196 | AM73: 44.5 | AN73: 214 | AO73: -8.9999999999999997e-002 | AP73: 10 | AQ73: 宝通转债!
A74: 345 | B74: 123004 | C74: 铁汉转债! | D74: 300197 | E74: 节能铁汉 | F74: 城市公用 | G74: 生态环境 | H74: 101.376 | I74: -6.1999999999999998e-003 | J74: 6.1999999999999998e-003 | K74: 3 | L74: 0. | M74: 108.8 | N74: 3.82 | O74: 0.29100000000000004 | P74: 78.53 | Q74: 转股中 | R74: 2.46年 | S74: 0.46年 | T74: 8.03 | U74: 7.9 | V74: 1.e-002 | W74: 9.5000000000000001e-002 | X74: 7.400000000000001e-002 | Y74: 85 | Z74: 1.29 | AA74: 2.9600000000000001e-002 | AB74: 2.2599999999999999e-002 | AC74: 2.7000000000000001e-003 | AD74: -2.0999999999999999e-003 | AE74: 99.03 | AF74: 98.75 | AG74: 0.18 | AH74: AA | AI74: 4.0800000000000003e-002 | AJ74: =H74+100*O74 -> 130.476 | AK74: 124.2 | AL74: 72 | AM74: 25.2 | AN74: 28 | AO74: -2.9999999999999999e-002 | AP74: 44 | AQ74: 铁汉转债!
A75: 316 | B75: 128042 | C75: 凯中转债! | D75: 2823 | E75: 凯中精密 | F75: 能源电力 | G75: 电力设备 | H75: 106.751 | I75: -2.3e-003 | J75: 3.4999999999999996e-003 | K75: 10.61 | L75: 4.6999999999999993e-003 | M75: 116.3 | N75: 12.86 | O75: 0.29399999999999998 | P75: 82.5 | Q75: 转股中 | R75: 3年27天 | S75: 1年28天 | T75: 4.16 | U75: 1.4 | V75: 3.0000000000000001e-003 | W75: 0.13600000000000001 | X75: 0.113 | Y75: 30 | Z75: 2.24 | AA75: 2.8900000000000002e-002 | AB75: 1.9099999999999999e-002 | AC75: -3.0200000000000001e-002 | AD75: -3.44e-002 | AE75: 97.66 | AF75: 102.59 | AG75: 0.25 | AH75: AA | AI75: 4.2599999999999999e-002 | AJ75: =H75+100*O75 -> 136.15100000000001 | AK75: 131 | AL75: 154 | AM75: 28.4 | AN75: 52 | AO75: 2.e-002 | AP75: 26 | AQ75: 凯中转债!
A76: 134 | B76: 113597 | C76: 佳力转债! | D76: 603912 | E76: 佳力图 | F76: 机械装备 | G76: 专用设备 | H76: 108.15 | I76: -2.9999999999999997e-004 | J76: -1.6000000000000001e-003 | K76: 15.72 | L76: -6.3e-003 | M76: 124.5 | N76: 23.15 | O76: 0.59299999999999997 | P76: 67.9 | Q76: 转股中 | R76: 5年27天 | S76: 3年28天 | T76: 3 | U76: 32 | V76: 9.8000000000000004e-002 | W76: 8.8000000000000009e-002 | X76: 5.9999999999999998e-002 | Y76: 34 | Z76: 3.67 | AA76: 2.8799999999999999e-002 | AB76: 2.0400000000000001e-002 | AC76: -1.09e-002 | AD76: -1.3500000000000002e-002 | AE76: 85.37 | AF76: 91.16 | AG76: 0.29 | AH76: AA- | AI76: 6.5000000000000002e-002 | AJ76: =H76+100*O76 -> 167.44999999999999 | AK76: 148.4 | AL76: 285 | AM76: 57.2 | AN76: 286 | AO76: -9.0000000000000011e-003 | AP76: 15 | AQ76: 佳力转债!
A77: 271 | B77: 110058 | C77: 永鼎转债! | D77: 600105 | E77: 永鼎股份 | F77: 通信互联 | G77: 通信设备 | H77: 102.97 | I77: 1.e-004 | J77: -1.e-004 | K77: 3.64 | L77: 0. | M77: 114.3 | N77: 5.04 | O77: 0.42599999999999999 | P77: 72.22 | Q77: 转股中 | R77: 3.79年 | S77: 1.79年 | T77: 2.61 | U77: 8.8 | V77: 3.3000000000000002e-002 | W77: 5.2000000000000005e-002 | X77: 3.7999999999999999e-002 | Y77: 50 | Z77: 1.8 | AA77: 2.8500000000000001e-002 | AB77: 2.1400000000000002e-002 | AC77: -8.9999999999999998e-004 | AD77: -3.7000000000000002e-003 | AE77: 91.2 | AF77: 90.89 | AG77: 0.29 | AH77: AA- | AI77: 6.3600000000000004e-002 | AJ77: =H77+100*O77 -> 145.56999999999999 | AK77: 133.7 | AL77: 189 | AM77: 42.5 | AN77: 197 | AO77: -6.7000000000000004e-002 | AP77: 47 | AQ77: 永鼎转债!
A78: 76 | B78: 123081 | C78: 精研转债! | D78: 300709 | E78: 精研科技 | F78: 电子 | G78: 电子产品 | H78: 104.7 | I78: -1.9699999999999999e-002 | J78: 2.5000000000000001e-003 | K78: 40.12 | L78: -4.0199999999999993e-002 | M78: 121.3 | N78: 53.4 | O78: 0.39399999999999996 | P78: 75.13 | Q78: 转股中 | R78: 5.42年 | S78: 3.42年 | T78: 5.7 | U78: 20 | V78: 3.3000000000000002e-002 | W78: 0.10199999999999999 | X78: 7.6999999999999999e-002 | Y78: 56 | Z78: 2.92 | AA78: 2.81e-002 | AB78: 2.1099999999999997e-002 | AC78: -1.2999999999999999e-003 | AD78: -3.5999999999999999e-003 | AE78: 83.34 | AF78: 86.88 | AG78: 0.43 | AH78: AA- | AI78: 6.5000000000000002e-002 | AJ78: =H78+100*O78 -> 144.09999999999999 | AK78: 134.3 | AL78: 195 | AM78: 47.4 | AN78: 238 | AO78: 5.2000000000000005e-002 | AP78: 8 | AQ78: 精研转债!
A79: 9 | B79: 127034 | C79: 绿茵转债 | D79: 2887 | E79: 绿茵生态 | F79: 城市公用 | G79: 生态环境 | H79: 101.6 | I79: 0. | J79: 5.9999999999999995e-004 | K79: 10.58 | L79: 8.9999999999999998e-004 | M79: 119 | N79: 12.38 | O79: 0.18899999999999997 | P79: 85.46 | Q79: 4月12天 | R79: 5.82年 | S79: 3.83年 | T79: 7.12 | U79: 7.2 | V79: 1.e-002 | W79: 0.21600000000000003 | X79: 0.184 | Y79: 33 | Z79: 1.54 | AA79: 2.7999999999999997e-002 | AB79: 2.2099999999999998e-002 | AC79: 5.6999999999999993e-003 | AD79: 3.8e-003 | AE79: 81.01 | AF79: 83.06 | AG79: 0.56 | AH79: AA- | AI79: 6.5000000000000002e-002 | AJ79: =H79+100*O79 -> 120.5 | AK79: 117.7 | AL79: 23 | AM79: 34.7 | AN79: 116 | AO79: -2.8999999999999998e-002 | AP79: 15 | AQ79: 绿茵转债
A80: 333 | B80: 113505 | C80: 杭电转债! | D80: 603618 | E80: 杭电股份 | F80: 能源电力 | G80: 电力设备 | H80: 103.64 | I80: -5.9999999999999995e-004 | J80: 2.0999999999999999e-003 | K80: 6.15 | L80: 4.8999999999999998e-003 | M80: 111.3 | N80: 7.08 | O80: 0.193 | P80: 86.86 | Q80: 转股中 | R80: 2.67年 | S80: 0.68年 | T80: 7.5 | U80: 7 | V80: 9.0000000000000011e-003 | W80: 0.17600000000000002 | X80: 0.153 | Y80: 42 | Z80: 1.58 | AA80: 2.75e-002 | AB80: 1.9400000000000001e-002 | AC80: -2.1099999999999997e-002 | AD80: -2.52e-002 | AE80: 98.43 | AF80: 100.18 | AG80: 0.31 | AH80: AA | AI80: 4.0800000000000003e-002 | AJ80: =H80+100*O80 -> 122.94 | AK80: 120.4 | AL80: 49 | AM80: 20.2 | AN80: 11 | AO80: -5.9000000000000004e-002 | AP80: 44 | AQ80: 杭电转债!
A81: 161 | B81: 128116 | C81: 瑞达转债! | D81: 2961 | E81: 瑞达期货 | F81: 金融 | G81: 期货行业 | H81: 100.6 | I81: -3.7000000000000002e-003 | J81: 7.000000000000001e-004 | K81: 20.4 | L81: -1.21e-002 | M81: 114.9 | N81: 29.55 | O81: 0.45700000000000002 | P81: 69.04 | Q81: 转股中 | R81: 4.99年 | S81: 2.99年 | T81: 6.5 | U81: 4.7 | V81: 6.9999999999999993e-003 | W81: 7.2000000000000008e-002 | X81: 4.9000000000000002e-002 | Y81: 91 | Z81: 4.63 | AA81: 2.75e-002 | AB81: 2.1899999999999999e-002 | AC81: 8.5000000000000006e-003 | AD81: 6.5000000000000006e-003 | AE81: 90.65 | AF81: 93.65 | AG81: 0.25 | AH81: AA | AI81: 4.2599999999999999e-002 | AJ81: =H81+100*O81 -> 146.30000000000001 | AK81: 132.2 | AL81: 172 | AM81: 38.5 | AN81: 164 | AO81: -5.9999999999999998e-002 | AP81: 19 | AQ81: 瑞达转债!
A82: 148 | B82: 113593 | C82: 沪工转债! | D82: 603131 | E82: 上海沪工 | F82: 机械装备 | G82: 通用设备 | H82: 106.48 | I82: -1.43e-002 | J82: -5.0000000000000001e-004 | K82: 17.08 | L82: -2.8999999999999998e-002 | M82: 121.6 | N82: 21.12 | O82: 0.317 | P82: 80.87 | Q82: 转股中 | R82: 5年17天 | S82: 3年18天 | T82: 4 | U82: 1.5 | V82: 4.0000000000000001e-003 | W82: 7.400000000000001e-002 | X82: 5.9999999999999998e-002 | Y82: 54 | Z82: 4.13 | AA82: 2.7300000000000001e-002 | AB82: 1.9699999999999999e-002 | AC82: -5.6000000000000008e-003 | AD82: -8.3000000000000001e-003 | AE82: 82.9 | AF82: 84.82 | AG82: 0.51 | AH82: A+ | AI82: 7.5999999999999998e-002 | AJ82: =H82+100*O82 -> 138.18000000000001 | AK82: 132.1 | AL82: 169 | AM82: 47.3 | AN82: 236 | AO82: -1.7000000000000001e-002 | AP82: 10 | AQ82: 沪工转债!
A83: 361 | B83: 128014 | C83: 永东转债! | D83: 2753 | E83: 永东股份 | F83: 化工 | G83: 化工 | H83: 104.7 | I83: 0. | J83: -1.e-004 | K83: 8.94 | L83: -1.1000000000000001e-003 | M83: 109.8 | N83: 12.52 | O83: 0.46600000000000003 | P83: 71.41 | Q83: 转股中 | R83: 1.79年 | S83: 回售内 | T83: 3.37 | U83: 2.1 | V83: 6.0000000000000001e-003 | W83: 0.10000000000000001 | X83: 7.2000000000000008e-002 | Y83: 34 | Z83: 1.69 | AA83: 2.7200000000000002e-002 | AB83: 1.6799999999999999e-002 | AC83: 回售内 | AD83: 回售内 | AE83: 100.3 | AF83: 98.71 | AG83: 0.1 | AH83: AA- | AI83: 6.1799999999999994e-002 | AJ83: =H83+100*O83 -> 151.30000000000001 | AK83: 138 | AL83: 228 | AM83: 37.7 | AN83: 153 | AO83: 1.1000000000000001e-002 | AP83: 37 | AQ83: 永东转债!
A84: 69 | B84: 127027 | C84: 靖远转债! | D84: 552 | E84: 靖远煤电 | F84: 煤炭 | G84: 煤炭开采 | H84: 99.98 | I84: 4.0000000000000002e-004 | J84: -2.0999999999999999e-003 | K84: 2.87 | L84: -3.4999999999999996e-003 | M84: 115.3 | N84: 3.23 | O84: 0.125 | P84: 88.85 | Q84: 转股中 | R84: 5.44年 | S84: 3.44年 | T84: 28 | U84: 25 | V84: 9.0000000000000011e-003 | W84: 0.42700000000000005 | X84: 0.379 | Y84: 66 | Z84: 0.82 | AA84: 2.7099999999999999e-002 | AB84: 2.1899999999999999e-002 | AC84: 1.06e-002 | AD84: 8.5000000000000006e-003 | AE84: 89.93 | AF84: 93.08 | AG84: 0.48 | AH84: AA+ | AI84: 4.0999999999999995e-002 | AJ84: =H84+100*O84 -> 112.48 | AK84: 111.1 | AL84: 7 | AM84: 18 | AN84: 6 | AO84: -4.8000000000000001e-002 | AP84: 42 | AQ84: 靖远转债!
A85: 45 | B85: 123096 | C85: 思创转债! | D85: 300078 | E85: 思创医惠 | F85: 通信互联 | G85: 物联网 | H85: 107.2 | I85: 6.6e-003 | J85: 1.66e-002 | K85: 7.48 | L85: 4.1799999999999997e-002 | M85: 124 | N85: 8.27 | O85: 0.185 | P85: 90.45 | Q85: 31天 | R85: 5.57年 | S85: 3.57年 | T85: 8.17 | U85: 53 | V85: 5.9999999999999998e-002 | W85: 0.126 | X85: 0.114 | Y85: 65 | Z85: 2.18 | AA85: 2.7000000000000003e-002 | AB85: 1.95e-002 | AC85: -8.3999999999999995e-003 | AD85: -1.04e-002 | AE85: 82.33 | AF85: 87.94 | AG85: 0.56 | AH85: AA- | AI85: 6.5000000000000002e-002 | AJ85: =H85+100*O85 -> 125.7 | AK85: 124 | AL85: 68 | AM85: 36 | AN85: 134 | AO85: 6.0999999999999999e-002 | AP85: 5 | AQ85: 思创转债!
A86: 196 | B86: 113574 | C86: 华体转债! | D86: 603679 | E86: 华体科技 | F86: 城市公用 | G86: 城市公用 | H86: 102.78 | I86: -5.6999999999999993e-003 | J86: 5.5000000000000005e-003 | K86: 16.75 | L86: -3.0000000000000001e-003 | M86: 115.9 | N86: 33.91 | O86: 1.0800000000000001 | P86: 49.4 | Q86: 转股中 | R86: 4.74年 | S86: 2.75年 | T86: 2.09 | U86: 1.1 | V86: 5.0000000000000001e-003 | W86: 8.6999999999999994e-002 | X86: 4.2999999999999997e-002 | Y86: 24 | Z86: 3.08 | AA86: 2.6200000000000001e-002 | AB86: 2.e-002 | AC86: 4.3e-003 | AD86: 1.6000000000000001e-003 | AE86: 84.58 | AF86: 83.06 | AG86: 0.07 | AH86: A+ | AI86: 7.46e-002 | AJ86: =H86+100*O86 -> 210.78 | AK86: 156.2 | AL86: 306 | AM86: 71.6 | AN86: 318 | AO86: -7.6999999999999999e-002 | AP86: 18 | AQ86: 华体转债!
A87: 233 | B87: 128083 | C87: 新北转债! | D87: 2376 | E87: 新北洋 | F87: 电子 | G87: 电子产品 | H87: 102.752 | I87: -3.8e-003 | J87: 1.1000000000000001e-003 | K87: 8.96 | L87: -8.8000000000000005e-003 | M87: 114.9 | N87: 11.45 | O87: 0.313 | P87: 78.25 | Q87: 转股中 | R87: 4.44年 | S87: 2.45年 | T87: 8.77 | U87: 1.9 | V87: 2.e-003 | W87: 0.14699999999999999 | X87: 0.115 | Y87: 60 | Z87: 1.72 | AA87: 2.6000000000000002e-002 | AB87: 1.9699999999999999e-002 | AC87: 2.3999999999999998e-003 | AD87: -1.e-004 | AE87: 92.83 | AF87: 95.82 | AG87: 0.31 | AH87: AA | AI87: 4.2599999999999999e-002 | AJ87: =H87+100*O87 -> 134.05199999999999 | AK87: 127.3 | AL87: 113 | AM87: 31.4 | AN87: 77 | AO87: -2.7000000000000003e-002 | AP87: 19 | AQ87: 新北转债!
A88: 348 | B88: 128023 | C88: 亚太转债! | D88: 2284 | E88: 亚太股份 | F88: 汽车 | G88: 零部件制 | H88: 104.72 | I88: -1.0800000000000001e-002 | J88: 5.6000000000000008e-003 | K88: 7.71 | L88: -3.6299999999999999e-002 | M88: 111.3 | N88: 10.34 | O88: 0.40399999999999997 | P88: 74.56 | Q88: 转股中 | R88: 2.42年 | S88: 0.42年 | T88: 9.99 | U88: 9.7 | V88: 9.0000000000000011e-003 | W88: 0.17600000000000002 | X88: 0.13100000000000001 | Y88: 57 | Z88: 2.28 | AA88: 2.5899999999999999e-002 | AB88: 1.7100000000000001e-002 | AC88: -4.6900000000000004e-002 | AD88: -5.2600000000000001e-002 | AE88: 99.43 | AF88: 101.19 | AG88: 0.14 | AH88: AA | AI88: 4.0800000000000003e-002 | AJ88: =H88+100*O88 -> 145.12 | AK88: 134.9 | AL88: 201 | AM88: 33.7 | AN88: 109 | AO88: -6.5000000000000002e-002 | AP88: 66 | AQ88: 亚太转债!
A89: 149 | B89: 128120 | C89: 联诚转债! | D89: 2921 | E89: 联诚精密 | F89: 汽车 | G89: 零部件制 | H89: 104.4 | I89: -5.6999999999999993e-003 | J89: -4.7999999999999996e-003 | K89: 15.2 | L89: -1.7500000000000002e-002 | M89: 118.4 | N89: 18.44 | O89: 0.26700000000000002 | P89: 82.43 | Q89: 转股中 | R89: 5年14天 | S89: 3年15天 | T89: 2.6 | U89: 2 | V89: 6.9999999999999993e-003 | W89: 0.161 | X89: 0.13300000000000001 | Y89: 16 | Z89: 1.57 | AA89: 2.5899999999999999e-002 | AB89: 1.9299999999999998e-002 | AC89: 5.0000000000000001e-004 | AD89: -2.2000000000000001e-003 | AE89: 80.57 | AF89: 79.02 | AG89: 0.6 | AH89: A | AI89: 8.5999999999999993e-002 | AJ89: =H89+100*O89 -> 131.10000000000002 | AK89: 126.4 | AL89: 97 | AM89: 45.8 | AN89: 225 | AO89: -3.7999999999999999e-002 | AP89: 21 | AQ89: 联诚转债!
A90: 139 | B90: 128123 | C90: 国光转债! | D90: 2749 | E90: 国光股份 | F90: 化工 | G90: 农化 | H90: 102.406 | I90: -8.9999999999999998e-004 | J90: -4.8999999999999998e-003 | K90: 9.16 | L90: -1.72e-002 | M90: 116.2 | N90: 13.48 | O90: 0.50700000000000001 | P90: 67.95 | Q90: 转股中 | R90: 5年24天 | S90: 3年25天 | T90: 3.2 | U90: 0.5 | V90: 2.e-003 | W90: 8.0000000000000002e-002 | X90: 5.4000000000000006e-002 | Y90: 40 | Z90: 3.2 | AA90: 2.5899999999999999e-002 | AB90: 1.9900000000000001e-002 | AC90: 5.1999999999999998e-003 | AD90: 2.7000000000000001e-003 | AE90: 85.17 | AF90: 85.14 | AG90: 0.34 | AH90: AA- | AI90: 6.5000000000000002e-002 | AJ90: =H90+100*O90 -> 153.10599999999999 | AK90: 136.9 | AL90: 216 | AM90: 51.7 | AN90: 263 | AO90: -2.7000000000000003e-002 | AP90: 12 | AQ90: 国光转债!
A91: 67 | B91: 123086 | C91: 海兰转债! | D91: 300065 | E91: 海兰信 | F91: 电子 | G91: 电子产品 | H91: 108.088 | I91: -1.2699999999999999e-002 | J91: 4.1999999999999997e-003 | K91: 10.63 | L91: -1.3899999999999999e-002 | M91: 123.5 | N91: 10.88 | O91: 0.106 | P91: 97.7 | Q91: 转股中 | R91: 5.44年 | S91: 3.44年 | T91: 7.29 | U91: 8.1 | V91: 1.e-002 | W91: 0.17199999999999999 | X91: 0.16800000000000001 | Y91: 42 | Z91: 2.85 | AA91: 2.53e-002 | AB91: 1.78e-002 | AC91: -1.1200000000000002e-002 | AD91: -1.32e-002 | AE91: 82.92 | AF91: 88.27 | AG91: 0.61 | AH91: AA- | AI91: 6.5000000000000002e-002 | AJ91: =H91+100*O91 -> 118.68799999999999 | AK91: 118.5 | AL91: 28 | AM91: 30.2 | AN91: 64 | AO91: -4.0000000000000001e-002 | AP91: 18 | AQ91: 海兰转债!
A92: 108 | B92: 123068 | C92: 弘信转债 | D92: 300657 | E92: 弘信电子 | F92: 电子 | G92: 元器件制 | H92: 106.588 | I92: 1.8e-003 | J92: 6.8000000000000005e-003 | K92: 16.79 | L92: 1.5100000000000001e-002 | M92: 121.2 | N92: 18.45 | O92: 0.17100000000000001 | P92: 91 | Q92: 转股中 | R92: 5.28年 | S92: 3.29年 | T92: 5.7 | U92: 6.8 | V92: 1.1000000000000001e-002 | W92: 9.9000000000000005e-002 | X92: 8.9999999999999997e-002 | Y92: 57 | Z92: 4.09 | AA92: 2.52e-002 | AB92: 1.8000000000000002e-002 | AC92: -6.8000000000000005e-003 | AD92: -9.1000000000000004e-003 | AE92: 83.99 | AF92: 87.55 | AG92: 0.57 | AH92: AA- | AI92: 6.5000000000000002e-002 | AJ92: =H92+100*O92 -> 123.68799999999999 | AK92: 122.2 | AL92: 59 | AM92: 34.6 | AN92: 115 | AO92: 2.6000000000000002e-002 | AP92: 8 | AQ92: 弘信转债
A93: 117 | B93: 128131 | C93: 崇达转2! | D93: 2815 | E93: 崇达技术 | F93: 电子 | G93: 元器件制 | H93: 101.8 | I93: -1.e-003 | J93: -1.5e-003 | K93: 12.03 | L93: -1.55e-002 | M93: 115.2 | N93: 19.38 | O93: 0.64000000000000001 | P93: 62.07 | Q93: 转股中 | R93: 5.18年 | S93: 3.18年 | T93: 14 | U93: 0.5 | V93: 0. | W93: 0.13300000000000001 | X93: 8.199999999999999e-002 | Y93: 105 | Z93: 2.52 | AA93: 2.46e-002 | AB93: 1.9199999999999998e-002 | AC93: 5.6000000000000008e-003 | AD93: 3.4000000000000002e-003 | AE93: 89.91 | AF93: 92.58 | AG93: 0.16 | AH93: AA | AI93: 4.4000000000000004e-002 | AJ93: =H93+100*O93 -> 165.80000000000001 | AK93: 141.5 | AL93: 257 | AM93: 48.9 | AN93: 252 | AO93: -1.9e-002 | AP93: 10 | AQ93: 崇达转2!
A94: 132 | B94: 113598 | C94: 法兰转债 | D94: 603966 | E94: 法兰泰克 | F94: 机械装备 | G94: 工程机械 | H94: 107.47 | I94: -5.7999999999999996e-003 | J94: -5.9999999999999995e-004 | K94: 12 | L94: -1.23e-002 | M94: 121.2 | N94: 13.88 | O94: 0.24299999999999999 | P94: 86.46 | Q94: 转股中 | R94: 5年28天 | S94: 3年29天 | T94: 2.75 | U94: 2.1 | V94: 6.9999999999999993e-003 | W94: 0.107 | X94: 9.1999999999999998e-002 | Y94: 26 | Z94: 2.21 | AA94: 2.4500000000000001e-002 | AB94: 1.7100000000000001e-002 | AC94: -9.7999999999999997e-003 | AD94: -1.2199999999999999e-002 | AE94: 85.1 | AF94: 88.71 | AG94: 0.52 | AH94: AA- | AI94: 6.5000000000000002e-002 | AJ94: =H94+100*O94 -> 131.77000000000001 | AK94: 128.5 | AL94: 125 | AM94: 39.8 | AN94: 171 | AO94: -2.7999999999999997e-002 | AP94: 11 | AQ94: 法兰转债
A95: 110 | B95: 113604 | C95: 多伦转债! | D95: 603528 | E95: 多伦科技 | F95: 计算机及 | G95: 软件开发 | H95: 103.77 | I95: -1.3600000000000001e-002 | J95: -7.000000000000001e-004 | K95: 8.31 | L95: -2.92e-002 | M95: 117.3 | N95: 10.4 | O95: 0.29899999999999999 | P95: 79.9 | Q95: 转股中 | R95: 5.28年 | S95: 3.28年 | T95: 6.4 | U95: 6.7 | V95: 1.e-002 | W95: 0.12300000000000001 | X95: 9.8000000000000004e-002 | Y95: 52 | Z95: 3.13 | AA95: 2.4e-002 | AB95: 1.8000000000000002e-002 | AC95: 1.e-004 | AD95: -2.0999999999999999e-003 | AE95: 83.74 | AF95: 84.71 | AG95: 0.49 | AH95: AA- | AI95: 6.5000000000000002e-002 | AJ95: =H95+100*O95 -> 133.66999999999999 | AK95: 127.6 | AL95: 117 | AM95: 42.9 | AN95: 200 | AO95: -8.3000000000000004e-002 | AP95: 7 | AQ95: 多伦转债!
A96: 79 | B96: 113610 | C96: 灵康转债 | D96: 603669 | E96: 灵康药业 | F96: 医药 | G96: 化学制药 | H96: 106.9 | I96: -1.7000000000000001e-003 | J96: 1.61e-002 | K96: 8.7 | L96: 2.23e-002 | M96: 121.1 | N96: 8.61 | O96: 5.7999999999999996e-002 | P96: 101.05 | Q96: 转股中 | R96: 5.41年 | S96: 3.42年 | T96: 5.25 | U96: 11 | V96: 2.e-002 | W96: 8.5000000000000006e-002 | X96: 8.5000000000000006e-002 | Y96: 62 | Z96: 4.41 | AA96: 2.3799999999999998e-002 | AB96: 1.6899999999999998e-002 | AC96: -7.7000000000000002e-003 | AD96: -9.7999999999999997e-003 | AE96: 83.22 | AF96: 86.76 | AG96: 0.65 | AH96: AA- | AI96: 6.5000000000000002e-002 | AJ96: =H96+100*O96 -> 112.7 | AK96: 112.8 | AL96: 10 | AM96: 26 | AN96: 33 | AO96: 5.4000000000000006e-002 | AP96: 27 | AQ96: 灵康转债
A97: 68 | B97: 123084 | C97: 高澜转债! | D97: 300499 | E97: 高澜股份 | F97: 能源电力 | G97: 电力设备 | H97: 107.589 | I97: -5.5000000000000005e-003 | J97: 1.e-003 | K97: 8.5 | L97: -6.9999999999999993e-003 | M97: 121.9 | N97: 9 | O97: 0.13900000000000001 | P97: 94.44 | Q97: 转股中 | R97: 5.44年 | S97: 3.44年 | T97: 2.8 | U97: 2.5 | V97: 8.0000000000000002e-003 | W97: 0.11800000000000001 | X97: 0.11199999999999999 | Y97: 24 | Z97: 2.82 | AA97: 2.3799999999999998e-002 | AB97: 1.67e-002 | AC97: -7.3000000000000001e-003 | AD97: -9.7999999999999997e-003 | AE97: 80.76 | AF97: 82.68 | AG97: 0.65 | AH97: A+ | AI97: 7.5999999999999998e-002 | AJ97: =H97+100*O97 -> 121.489 | AK97: 120.7 | AL97: 51 | AM97: 38.1 | AN97: 156 | AO97: 2.5000000000000001e-002 | AP97: 13 | AQ97: 高澜转债!
A98: 135 | B98: 123063 | C98: 大禹转债 | D98: 300021 | E98: 大禹节水 | F98: 化工 | G98: 橡胶塑料 | H98: 112.634 | I98: 1.7000000000000001e-003 | J98: 3.2000000000000002e-003 | K98: 5.13 | L98: 7.9000000000000008e-003 | M98: 126.5 | N98: 4.83 | O98: 5.9999999999999998e-002 | P98: 106.21 | Q98: 转股中 | R98: 5年25天 | S98: 4年26天 | T98: 6.35 | U98: 78 | V98: 0.107 | W98: 0.155 | X98: 0.16399999999999998 | Y98: 41 | Z98: 2.7 | AA98: 2.3700000000000002e-002 | AB98: 1.4800000000000001e-002 | AC98: -1.2199999999999999e-002 | AD98: -1.5300000000000001e-002 | AE98: 82.38 | AF98: 92.62 | AG98: 0.63 | AH98: AA- | AI98: 6.5000000000000002e-002 | AJ98: =H98+100*O98 -> 118.634 | AK98: 119.1 | AL98: 35 | AM98: 26.4 | AN98: 37 | AO98: 1.2e-002 | AP98: 18 | AQ98: 大禹转债
A99: 63 | B99: 123087 | C99: 明电转债! | D99: 300739 | E99: 明阳电路 | F99: 电子 | G99: 元器件制 | H99: 107 | I99: -3.7000000000000002e-003 | J99: 1.09e-002 | K99: 15.83 | L99: 1.15e-002 | M99: 121.2 | N99: 16.32 | O99: 0.10300000000000001 | P99: 97 | Q99: 转股中 | R99: 5.45年 | S99: 4.45年 | T99: 6.73 | U99: 25 | V99: 3.5000000000000003e-002 | W99: 0.152 | X99: 0.14800000000000002 | Y99: 44 | Z99: 3.12 | AA99: 2.3599999999999999e-002 | AB99: 1.67e-002 | AC99: -5.9999999999999995e-004 | AD99: -3.4000000000000002e-003 | AE99: 80.19 | AF99: 86.64 | AG99: 0.63 | AH99: AA- | AI99: 6.5000000000000002e-002 | AJ99: =H99+100*O99 -> 117.3 | AK99: 117 | AL99: 16 | AM99: 30.4 | AN99: 68 | AO99: 1.7000000000000001e-002 | AP99: 17 | AQ99: 明电转债!
A100: 209 | B100: 113568 | C100: 新春转债! | D100: 603667 | E100: 五洲新春 | F100: 机械装备 | G100: 通用设备 | H100: 111.78 | I100: -3.4000000000000002e-003 | J100: 1.4000000000000002e-003 | K100: 9.28 | L100: -3.2000000000000002e-003 | M100: 124.3 | N100: 8.75 | O100: 5.4000000000000006e-002 | P100: 106.06 | Q100: 转股中 | R100: 4.67年 | S100: 2.68年 | T100: 3.3 | U100: 9.2 | V100: 2.5000000000000001e-002 | W100: 0.122 | X100: 0.129 | Y100: 27 | Z100: 1.53 | AA100: 2.35e-002 | AB100: 1.4499999999999999e-002 | AC100: -2.46e-002 | AD100: -2.7300000000000001e-002 | AE100: 87.64 | AF100: 93.81 | AG100: 0.62 | AH100: AA- | AI100: 6.3600000000000004e-002 | AJ100: =H100+100*O100 -> 117.18000000000001 | AK100: 117.5 | AL100: 21 | AM100: 23.7 | AN100: 24 | AO100: 1.4999999999999999e-002 | AP100: 49 | AQ100: 新春转债!
A101: 49 | B101: 113619 | C101: 世运转债! | D101: 603920 | E101: 世运电路 | F101: 电子 | G101: 元器件制 | H101: 101.6 | I101: -3.9000000000000003e-003 | J101: 4.7999999999999996e-003 | K101: 13.2 | L101: 3.8e-003 | M101: 115.2 | N101: 19.92 | O101: 0.53299999999999992 | P101: 66.27 | Q101: 24天 | R101: 5.55年 | S101: 3.55年 | T101: 10 | U101: 5.3 | V101: 5.0000000000000001e-003 | W101: 0.14199999999999999 | X101: 9.4e-002 | Y101: 70 | Z101: 1.98 | AA101: 2.3300000000000001e-002 | AB101: 1.8200000000000001e-002 | AC101: 5.6000000000000008e-003 | AD101: 3.5999999999999999e-003 | AE101: 88.49 | AF101: 91.12 | AG101: 0.24 | AH101: AA | AI101: 4.4000000000000004e-002 | AJ101: =H101+100*O101 -> 154.89999999999998 | AK101: 136.9 | AL101: 219 | AM101: 45.8 | AN101: 226 | AO101: -0.111 | AP101: 5 | AQ101: 世运转债!
A102: 142 | B102: 113037 | C102: 紫银转债 | D102: 601860 | E102: 紫金银行 | F102: 金融 | G102: 银行行业 | H102: 103.4 | I102: 8.0000000000000004e-004 | J102: -6.0999999999999995e-003 | K102: 3.56 | L102: -1.66e-002 | M102: 115.8 | N102: 4.65 | O102: 0.35100000000000003 | P102: 76.56 | Q102: 转股中 | R102: 5年20天 | S102: 无权 | T102: 45 | U102: 51 | V102: 1.1000000000000001e-002 | W102: 0.34499999999999997 | X102: 0.26400000000000001 | Y102: 130 | Z102: 0.88 | AA102: 2.3199999999999998e-002 | AB102: 1.7399999999999999e-002 | AC102: 无权 | AD102: 无权 | AE102: 无权 | AF102: 94.94 | AG102: 0.32 | AH102: AA+ | AI102: 4.0999999999999995e-002 | AJ102: =H102+100*O102 -> 138.5 | AK102: 130.2 | AL102: 142 | AM102: 35.3 | AN102: 127 | AO102: -4.7e-002 | AP102: 20 | AQ102: 紫银转债
A103: 97 | B103: 123074 | C103: 隆利转债! | D103: 300752 | E103: 隆利科技 | F103: 电子 | G103: 液晶显示 | H103: 110 | I103: 4.8999999999999998e-003 | J103: -7.4999999999999997e-003 | K103: 16.31 | L103: -4.8999999999999998e-003 | M103: 124 | N103: 18.33 | O103: 0.23600000000000002 | P103: 88.98 | Q103: 转股中 | R103: 5.32年 | S103: 3.33年 | T103: 3.24 | U103: 67 | V103: 0.185 | W103: 0.10300000000000001 | X103: 9.1999999999999998e-002 | Y103: 31 | Z103: 2.27 | AA103: 2.3199999999999998e-002 | AB103: 1.55e-002 | AC103: -1.6299999999999999e-002 | AD103: -1.84e-002 | AE103: 83.61 | AF103: 89.3 | AG103: 0.53 | AH103: AA- | AI103: 6.5000000000000002e-002 | AJ103: =H103+100*O103 -> 133.59999999999999 | AK103: 131 | AL103: 155 | AM103: 41.7 | AN103: 189 | AO103: -5.9000000000000004e-002 | AP103: 14 | AQ103: 隆利转债!
A104: 30 | B104: 113046 | C104: 金田转债 | D104: 601609 | E104: 金田铜业 | F104: 有色金属 | G104: 铜金属 | H104: 101.27 | I104: 3.5999999999999999e-003 | J104: 3.0999999999999999e-003 | K104: 8.66 | L104: 1.6399999999999998e-002 | M104: 114.9 | N104: 10.75 | O104: 0.25700000000000001 | P104: 80.56 | Q104: 2月27天 | R104: 5.72年 | S104: 3.72年 | T104: 15 | U104: 26 | V104: 1.7000000000000001e-002 | W104: 0.11699999999999999 | X104: 9.4e-002 | Y104: 128 | Z104: 1.85 | AA104: 2.2700000000000001e-002 | AB104: 1.7899999999999999e-002 | AC104: 5.4000000000000003e-003 | AD104: 3.7000000000000002e-003 | AE104: 88.56 | AF104: 91.67 | AG104: 0.41 | AH104: AA+ | AI104: 4.0999999999999995e-002 | AJ104: =H104+100*O104 -> 126.97 | AK104: 122 | AL104: 57 | AM104: 30.3 | AN104: 65 | AO104: -2.e-002 | AP104: 11 | AQ104: 金田转债
A105: 207 | B105: 113570 | C105: 百达转债! | D105: 603331 | E105: 百达精工 | F105: 机械装备 | G105: 机械装备 | H105: 103.75 | I105: -1.09e-002 | J105: 1.32e-002 | K105: 9.72 | L105: 4.0999999999999995e-003 | M105: 114.9 | N105: 11.34 | O105: 0.20999999999999999 | P105: 85.71 | Q105: 转股中 | R105: 4.69年 | S105: 2.69年 | T105: 2.8 | U105: 1.1 | V105: 4.0000000000000001e-003 | W105: 0.16200000000000001 | X105: 0.13900000000000001 | Y105: 17 | Z105: 2.06 | AA105: 2.2400000000000003e-002 | AB105: 1.66e-002 | AC105: -1.1999999999999999e-003 | AD105: -3.4999999999999996e-003 | AE105: 84.34 | AF105: 82.57 | AG105: 0.57 | AH105: A+ | AI105: 7.46e-002 | AJ105: =H105+100*O105 -> 124.75 | AK105: 121.8 | AL105: 56 | AM105: 37.4 | AN105: 150 | AO105: -3.7999999999999999e-002 | AP105: 33 | AQ105: 百达转债!
A106: 118 | B106: 123065 | C106: 宝莱转债! | D106: 300246 | E106: 宝莱特 | F106: 医药 | G106: 医疗器械 | H106: 108.6 | I106: -1.e-002 | J106: 6.6e-003 | K106: 18.97 | L106: -3.7499999999999999e-002 | M106: 121.4 | N106: 40.14 | O106: 1.3 | P106: 47.26 | Q106: 转股中 | R106: 5.17年 | S106: 3.18年 | T106: 2.19 | U106: 19 | V106: 8.1000000000000003e-002 | W106: 7.9000000000000001e-002 | X106: 3.7000000000000005e-002 | Y106: 28 | Z106: 3.12 | AA106: 2.23e-002 | AB106: 1.4999999999999999e-002 | AC106: -1.21e-002 | AD106: -1.4499999999999999e-002 | AE106: 84.74 | AF106: 88.33 | AG106: 0.09 | AH106: AA- | AI106: 6.5000000000000002e-002 | AJ106: =H106+100*O106 -> 238.59999999999999 | AK106: 169.9 | AL106: 328 | AM106: 81.6 | AN106: 334 | AO106: -1.9e-002 | AP106: 17 | AQ106: 宝莱转债!
A107: 331 | B107: 127006 | C107: 敖东转债! | D107: 623 | E107: 吉林敖东 | F107: 金融 | G107: 证券行业 | H107: 101.29 | I107: -4.1999999999999997e-003 | J107: 1.7000000000000001e-003 | K107: 15.43 | L107: -1.47e-002 | M107: 107.4 | N107: 20.42 | O107: 0.34000000000000002 | P107: 75.56 | Q107: 转股中 | R107: 2.69年 | S107: 0.70年 | T107: 24.1 | U107: 5.3 | V107: 2.e-003 | W107: 0.13400000000000001 | X107: 0.10099999999999999 | Y107: 179 | Z107: 0.78 | AA107: 2.2200000000000001e-002 | AB107: 1.6899999999999998e-002 | AC107: -2.5999999999999999e-003 | AD107: -5.0000000000000001e-003 | AE107: 97.89 | AF107: 97.29 | AG107: 0.17 | AH107: AA+ | AI107: 3.78e-002 | AJ107: =H107+100*O107 -> 135.29000000000002 | AK107: 127 | AL107: 109 | AM107: 29.1 | AN107: 57 | AO107: -4.0000000000000001e-003 | AP107: 27 | AQ107: 敖东转债!
A108: 230 | B108: 128087 | C108: 孚日转债! | D108: 2083 | E108: 孚日股份 | F108: 服装纺织 | G108: 家纺 | H108: 102.6 | I108: 1.e-004 | J108: 8.8000000000000005e-003 | K108: 4.38 | L108: 1.3899999999999999e-002 | M108: 112.9 | N108: 4.5 | O108: 5.4000000000000006e-002 | P108: 97.33 | Q108: 转股中 | R108: 4.46年 | S108: 2.46年 | T108: 6.5 | U108: 27 | V108: 4.0000000000000001e-002 | W108: 0.16300000000000001 | X108: 0.159 | Y108: 40 | Z108: 1.1 | AA108: 2.2099999999999998e-002 | AB108: 1.67e-002 | AC108: 3.0000000000000001e-003 | AD108: 4.0000000000000002e-004 | AE108: 88.09 | AF108: 86.27 | AG108: 0.64 | AH108: AA- | AI108: 6.3600000000000004e-002 | AJ108: =H108+100*O108 -> 108. | AK108: 107.9 | AL108: 3 | AM108: 19.8 | AN108: 10 | AO108: 2.6000000000000002e-002 | AP108: 65 | AQ108: 孚日转债!
A109: 8 | B109: 111000 | C109: 起帆转债 | D109: 605222 | E109: 起帆电缆 | F109: 能源电力 | G109: 电力设备 | H109: 106.16 | I109: -3.9000000000000003e-003 | J109: -1.38e-002 | K109: 19.22 | L109: -2.8300000000000002e-002 | M109: 120.5 | N109: 20.53 | O109: 0.13400000000000001 | P109: 93.62 | Q109: 5月0天 | R109: 5.89年 | S109: 3.89年 | T109: 10 | U109: 17 | V109: 1.6e-002 | W109: 0.13 | X109: 0.122 | Y109: 77 | Z109: 2.64 | AA109: 2.2099999999999998e-002 | AB109: 1.6e-002 | AC109: -5.5000000000000005e-003 | AD109: -7.3000000000000001e-003 | AE109: 80.61 | AF109: 83.73 | AG109: 0.63 | AH109: AA- | AI109: 6.5000000000000002e-002 | AJ109: =H109+100*O109 -> 119.56 | AK109: 118.7 | AL109: 30 | AM109: 35 | AN109: 117 | AO109: -3.7999999999999999e-002 | AP109: 7 | AQ109: 起帆转债
A110: 214 | B110: 113565 | C110: 宏辉转债 | D110: 603336 | E110: 宏辉果蔬 | F110: 农业 | G110: 农产品加 | H110: 107.02 | I110: -2.9999999999999997e-004 | J110: -1.2999999999999999e-003 | K110: 7.08 | L110: -2.8000000000000004e-003 | M110: 117.8 | N110: 7.64 | O110: 0.155 | P110: 92.67 | Q110: 转股中 | R110: 4.65年 | S110: 2.65年 | T110: 2.25 | U110: 9 | V110: 3.7000000000000005e-002 | W110: 7.2999999999999995e-002 | X110: 6.7000000000000004e-002 | Y110: 31 | Z110: 2.28 | AA110: 2.1299999999999999e-002 | AB110: 1.44e-002 | AC110: -1.1200000000000002e-002 | AD110: -1.37e-002 | AE110: 87.33 | AF110: 89 | AG110: 0.57 | AH110: AA- | AI110: 6.3600000000000004e-002 | AJ110: =H110+100*O110 -> 122.52 | AK110: 121.4 | AL110: 54 | AM110: 32.4 | AN110: 89 | AO110: -2.7000000000000003e-002 | AP110: 25 | AQ110: 宏辉转债
A111: 250 | B111: 128076 | C111: 金轮转债! | D111: 2722 | E111: 金轮股份 | F111: 机械装备 | G111: 专用设备 | H111: 105.25 | I111: -2.3e-003 | J111: -5.6000000000000008e-003 | K111: 12.19 | L111: -1.6899999999999998e-002 | M111: 114.9 | N111: 14.66 | O111: 0.26600000000000001 | P111: 83.15 | Q111: 转股中 | R111: 4.28年 | S111: 2.28年 | T111: 2.14 | U111: 1.4 | V111: 6.0000000000000001e-003 | W111: 0.10000000000000001 | X111: 8.3000000000000004e-002 | Y111: 21 | Z111: 1.13 | AA111: 2.1099999999999997e-002 | AB111: 1.47e-002 | AC111: -7.3000000000000001e-003 | AD111: -1.e-002 | AE111: 89.04 | AF111: 88.75 | AG111: 0.47 | AH111: AA- | AI111: 6.3600000000000004e-002 | AJ111: =H111+100*O111 -> 131.84999999999999 | AK111: 127.3 | AL111: 115 | AM111: 38.3 | AN111: 158 | AO111: -1.6e-002 | AP111: 40 | AQ111: 金轮转债!
A112: 130 | B112: 127021 | C112: 特发转2! | D112: 70 | E112: 特发信息 | F112: 通信互联 | G112: 通信设备 | H112: 104.145 | I112: -2.3999999999999998e-003 | J112: 3.0999999999999999e-003 | K112: 7.74 | L112: 5.1999999999999998e-003 | M112: 113.3 | N112: 12.33 | O112: 0.65900000000000003 | P112: 62.77 | Q112: 转股中 | R112: 4年35天 | S112: 2年36天 | T112: 5.5 | U112: 2.5 | V112: 4.0000000000000001e-003 | W112: 8.5999999999999993e-002 | X112: 5.4000000000000006e-002 | Y112: 64 | Z112: 2.18 | AA112: 2.1099999999999997e-002 | AB112: 1.4999999999999999e-002 | AC112: -9.0000000000000011e-003 | AD112: -1.0700000000000001e-002 | AE112: 92.9 | AF112: 95.72 | AG112: 0.13 | AH112: AA | AI112: 4.2599999999999999e-002 | AJ112: =H112+100*O112 -> 170.04500000000002 | AK112: 145.5 | AL112: 272 | AM112: 49.8 | AN112: 254 | AO112: -1.9e-002 | AP112: 12 | AQ112: 特发转2!
A113: 238 | B113: 113549 | C113: 白电转债 | D113: 603861 | E113: 白云电器 | F113: 能源电力 | G113: 电力设备 | H113: 105 | I113: 8.3000000000000001e-003 | J113: -4.1999999999999997e-003 | K113: 8.22 | L113: 8.6e-003 | M113: 114.8 | N113: 8.88 | O113: 0.13400000000000001 | P113: 92.57 | Q113: 转股中 | R113: 4.37年 | S113: 2.37年 | T113: 8.8 | U113: 7.8 | V113: 8.0000000000000002e-003 | W113: 0.24199999999999999 | X113: 0.22399999999999998 | Y113: 36 | Z113: 1.41 | AA113: 2.1000000000000001e-002 | AB113: 1.4800000000000001e-002 | AC113: -6.5000000000000006e-003 | AD113: -9.0000000000000011e-003 | AE113: 93.01 | AF113: 96.02 | AG113: 0.47 | AH113: AA | AI113: 4.2599999999999999e-002 | AJ113: =H113+100*O113 -> 118.40000000000001 | AK113: 117.4 | AL113: 20 | AM113: 21.4 | AN113: 15 | AO113: 2.7000000000000003e-002 | AP113: 41 | AQ113: 白电转债
A114: 146 | B114: 113594 | C114: 淳中转债! | D114: 603516 | E114: 淳中科技 | F114: 电子 | G114: 电子产品 | H114: 109.6 | I114: -1.1699999999999999e-002 | J114: 2.3e-003 | K114: 20.25 | L114: -2.2200000000000001e-002 | M114: 121.4 | N114: 27.84 | O114: 0.50700000000000001 | P114: 72.74 | Q114: 转股中 | R114: 5年18天 | S114: 3年19天 | T114: 3 | U114: 1.2 | V114: 4.0000000000000001e-003 | W114: 7.9000000000000001e-002 | X114: 5.7999999999999996e-002 | Y114: 38 | Z114: 2.76 | AA114: 2.1000000000000001e-002 | AB114: 1.3500000000000002e-002 | AC114: -1.47e-002 | AD114: -1.7299999999999999e-002 | AE114: 82.89 | AF114: 84.68 | AG114: 0.43 | AH114: A+ | AI114: 7.5999999999999998e-002 | AJ114: =H114+100*O114 -> 160.30000000000001 | AK114: 146.5 | AL114: 276 | AM114: 61.8 | AN114: 302 | AO114: -6.5000000000000002e-002 | AP114: 8 | AQ114: 淳中转债!
A115: 258 | B115: 128071 | C115: 合兴转债! | D115: 2228 | E115: 合兴包装 | F115: 造纸包装 | G115: 包装材料 | H115: 105.738 | I115: -5.7999999999999996e-003 | J115: 5.9999999999999995e-004 | K115: 3.65 | L115: -1.3500000000000002e-002 | M115: 114.8 | N115: 4.28 | O115: 0.23999999999999999 | P115: 85.28 | Q115: 转股中 | R115: 4年44天 | S115: 2年45天 | T115: 3 | U115: 1.1 | V115: 3.0000000000000001e-003 | W115: 6.6000000000000003e-002 | X115: 5.7000000000000002e-002 | Y115: 45 | Z115: 1.3 | AA115: 2.06e-002 | AB115: 1.3899999999999999e-002 | AC115: -1.0200000000000001e-002 | AD115: -1.3000000000000001e-002 | AE115: 93.99 | AF115: 97.02 | AG115: 0.38 | AH115: AA | AI115: 4.2599999999999999e-002 | AJ115: =H115+100*O115 -> 129.738 | AK115: 126.2 | AL115: 96 | AM115: 29.2 | AN115: 58 | AO115: -2.8999999999999998e-002 | AP115: 24 | AQ115: 合兴转债!
A116: 255 | B116: 128073 | C116: 哈尔转债! | D116: 2615 | E116: 哈尔斯 | F116: 其他 | G116: 家居用品 | H116: 108.255 | I116: -4.0000000000000002e-004 | J116: 4.6999999999999993e-003 | K116: 4.63 | L116: 1.3100000000000001e-002 | M116: 115.3 | N116: 5.7 | O116: 0.33299999999999996 | P116: 81.23 | Q116: 转股中 | R116: 3年50天 | S116: 1年51天 | T116: 2.99 | U116: 2.1 | V116: 6.9999999999999993e-003 | W116: 0.156 | X116: 0.127 | Y116: 19 | Z116: 2.44 | AA116: 2.06e-002 | AB116: 1.1699999999999999e-002 | AC116: -4.4500000000000005e-002 | AD116: -4.7400000000000005e-002 | AE116: 94.22 | AF116: 95.33 | AG116: 0.33 | AH116: AA- | AI116: 6.3600000000000004e-002 | AJ116: =H116+100*O116 -> 141.55500000000001 | AK116: 135.3 | AL116: 205 | AM116: 40 | AN116: 173 | AO116: -1.e-002 | AP116: 39 | AQ116: 哈尔转债!
A117: 143 | B117: 123061 | C117: 航新转债! | D117: 300424 | E117: 航新科技 | F117: 航空航天 | G117: 航空航天 | H117: 112.908 | I117: -8.3000000000000001e-003 | J117: -5.3e-003 | K117: 14.33 | L117: -2.18e-002 | M117: 124.8 | N117: 14.86 | O117: 0.17100000000000001 | P117: 96.43 | Q117: 转股中 | R117: 5年19天 | S117: 3年20天 | T117: 2.5 | U117: 96 | V117: 0.33799999999999997 | W117: 7.2999999999999995e-002 | X117: 7.0000000000000007e-002 | Y117: 34 | Z117: 5.16 | AA117: 2.0499999999999997e-002 | AB117: 1.21e-002 | AC117: -2.3399999999999997e-002 | AD117: -2.6099999999999998e-002 | AE117: 83.01 | AF117: 87.05 | AG117: 0.62 | AH117: A+ | AI117: 7.5999999999999998e-002 | AJ117: =H117+100*O117 -> 130.00800000000001 | AK117: 129.4 | AL117: 135 | AM117: 42.3 | AN117: 196 | AO117: -7.8e-002 | AP117: 17 | AQ117: 航新转债!
A118: 107 | B118: 123069 | C118: 金诺转债! | D118: 300505 | E118: 川金诺 | F118: 化工 | G118: 农化 | H118: 113.609 | I118: -2.2000000000000001e-003 | J118: -5.9999999999999995e-004 | K118: 19.28 | L118: -4.5999999999999999e-003 | M118: 126 | N118: 19.15 | O118: 0.128 | P118: 100.68 | Q118: 转股中 | R118: 5.29年 | S118: 3.29年 | T118: 3.68 | U118: 29 | V118: 7.0000000000000007e-002 | W118: 0.14599999999999999 | X118: 0.14699999999999999 | Y118: 25 | Z118: 2.66 | AA118: 2.0199999999999999e-002 | AB118: 1.1899999999999999e-002 | AC118: -2.5699999999999997e-002 | AD118: -2.7799999999999998e-002 | AE118: 83.79 | AF118: 90.94 | AG118: 0.61 | AH118: AA- | AI118: 6.5000000000000002e-002 | AJ118: =H118+100*O118 -> 126.40899999999999 | AK118: 126.5 | AL118: 98 | AM118: 35.6 | AN118: 129 | AO118: 8.8000000000000009e-002 | AP118: 19 | AQ118: 金诺转债!
A119: 65 | B119: 113044 | C119: 大秦转债! | D119: 601006 | E119: 大秦铁路 | F119: 铁路 | G119: 铁路运输 | H119: 102.66 | I119: -2.5999999999999999e-003 | J119: 2.5999999999999999e-003 | K119: 6.6 | L119: 0. | M119: 114.1 | N119: 7.66 | O119: 0.191 | P119: 86.16 | Q119: 转股中 | R119: 5.45年 | S119: 3.45年 | T119: 320 | U119: 99 | V119: 3.0000000000000001e-003 | W119: 0.32600000000000001 | X119: 0.28100000000000003 | Y119: 981 | Z119: 0.81 | AA119: 2.e-002 | AB119: 1.5100000000000001e-002 | AC119: 3.4999999999999996e-003 | AD119: 1.2999999999999999e-003 | AE119: 90.6 | AF119: 93.02 | AG119: 0.44 | AH119: AAA | AI119: 3.9e-002 | AJ119: =H119+100*O119 -> 121.75999999999999 | AK119: 119.2 | AL119: 37 | AM119: 26.1 | AN119: 35 | AO119: -2.e-003 | AP119: 15 | AQ119: 大秦转债!
A120: 211 | B120: 113567 | C120: 君禾转债! | D120: 603617 | E120: 君禾股份 | F120: 机械装备 | G120: 通用设备 | H120: 108.61 | I120: 2.e-003 | J120: 2.9999999999999997e-004 | K120: 10.2 | L120: 3.9000000000000003e-003 | M120: 118.8 | N120: 11.16 | O120: 0.188 | P120: 91.4 | Q120: 转股中 | R120: 4.67年 | S120: 2.67年 | T120: 2.1 | U120: 0.9 | V120: 4.0000000000000001e-003 | W120: 0.10300000000000001 | X120: 9.4e-002 | Y120: 20 | Z120: 2.88 | AA120: 1.9799999999999998e-002 | AB120: 1.26e-002 | AC120: -1.54e-002 | AD120: -1.8100000000000002e-002 | AE120: 84.97 | AF120: 85.58 | AG120: 0.59 | AH120: A+ | AI120: 7.46e-002 | AJ120: =H120+100*O120 -> 127.41 | AK120: 125.8 | AL120: 93 | AM120: 40.2 | AN120: 175 | AO120: 2.8999999999999998e-002 | AP120: 33 | AQ120: 君禾转债!
A121: 27 | B121: 123106 | C121: 正丹转债! | D121: 300641 | E121: 正丹股份 | F121: 化工 | G121: 化工 | H121: 112.41 | I121: -5.1000000000000004e-003 | J121: 1.43e-002 | K121: 7.93 | L121: 1.41e-002 | M121: 125.5 | N121: 7.5 | O121: 6.3e-002 | P121: 105.73 | Q121: 3月0天 | R121: 5.72年 | S121: 3.73年 | T121: 3.2 | U121: 63 | V121: 0.17600000000000002 | W121: 8.199999999999999e-002 | X121: 8.6999999999999994e-002 | Y121: 39 | Z121: 2.79 | AA121: 1.9799999999999998e-002 | AB121: 1.2199999999999999e-002 | AC121: -2.0299999999999999e-002 | AD121: -2.2200000000000001e-002 | AE121: 81.46 | AF121: 88.11 | AG121: 0.65 | AH121: AA- | AI121: 6.5000000000000002e-002 | AJ121: =H121+100*O121 -> 118.70999999999999 | AK121: 119.1 | AL121: 36 | AM121: 31 | AN121: 74 | AO121: 6.5000000000000002e-002 | AP121: 13 | AQ121: 正丹转债!
A122: 88 | B122: 113608 | C122: 威派转债! | D122: 603956 | E122: 威派格 | F122: 机械装备 | G122: 专用设备 | H122: 109.9 | I122: -1.2999999999999999e-003 | J122: -4.4000000000000003e-003 | K122: 17.72 | L122: -8.8999999999999999e-003 | M122: 121.6 | N122: 19.08 | O122: 0.183 | P122: 92.87 | Q122: 转股中 | R122: 5.35年 | S122: 3.36年 | T122: 4.2 | U122: 4.2 | V122: 9.0000000000000011e-003 | W122: 5.5999999999999994e-002 | X122: 5.2000000000000005e-002 | Y122: 75 | Z122: 6.52 | AA122: 1.95e-002 | AB122: 1.2500000000000001e-002 | AC122: -1.41e-002 | AD122: -1.6500000000000001e-002 | AE122: 81.09 | AF122: 82.96 | AG122: 0.64 | AH122: A+ | AI122: 7.5999999999999998e-002 | AJ122: =H122+100*O122 -> 128.20000000000002 | AK122: 126.9 | AL122: 108 | AM122: 44 | AN122: 209 | AO122: 1.2e-002 | AP122: 6 | AQ122: 威派转债!
A123: 75 | B123: 123082 | C123: 北陆转债! | D123: 300016 | E123: 北陆药业 | F123: 医药 | G123: 化学制药 | H123: 109.9 | I123: -1.6899999999999998e-002 | J123: 6.9999999999999993e-003 | K123: 9 | L123: -1.4199999999999999e-002 | M123: 121.7 | N123: 8.81 | O123: 7.5999999999999998e-002 | P123: 102.16 | Q123: 转股中 | R123: 5.43年 | S123: 3.43年 | T123: 5 | U123: 8.5 | V123: 1.4999999999999999e-002 | W123: 0.113 | X123: 0.115 | Y123: 44 | Z123: 2.68 | AA123: 1.9400000000000001e-002 | AB123: 1.24e-002 | AC123: -1.37e-002 | AD123: -1.6200000000000003e-002 | AE123: 80.65 | AF123: 82.57 | AG123: 0.69 | AH123: A+ | AI123: 7.5999999999999998e-002 | AJ123: =H123+100*O123 -> 117.5 | AK123: 117.6 | AL123: 22 | AM123: 35.1 | AN123: 122 | AO123: -7.0999999999999994e-002 | AP123: 11 | AQ123: 北陆转债!
A124: 223 | B124: 113561 | C124: 正裕转债! | D124: 603089 | E124: 正裕工业 | F124: 汽车 | G124: 零部件制 | H124: 108.48 | I124: -2.e-003 | J124: 2.5999999999999999e-003 | K124: 8.53 | L124: 1.1999999999999999e-003 | M124: 118 | N124: 10.08 | O124: 0.28199999999999997 | P124: 84.62 | Q124: 转股中 | R124: 4.50年 | S124: 2.50年 | T124: 1.5 | U124: 2.5 | V124: 1.4999999999999999e-002 | W124: 7.9000000000000001e-002 | X124: 6.7000000000000004e-002 | Y124: 19 | Z124: 1.78 | AA124: 1.9299999999999998e-002 | AB124: 1.21e-002 | AC124: -1.5300000000000001e-002 | AD124: -1.8200000000000001e-002 | AE124: 86.21 | AF124: 86.09 | AG124: 0.53 | AH124: A+ | AI124: 7.46e-002 | AJ124: =H124+100*O124 -> 136.68000000000001 | AK124: 132.3 | AL124: 176 | AM124: 46.1 | AN124: 227 | AO124: -3.3000000000000002e-002 | AP124: 35 | AQ124: 正裕转债!
A125: 94 | B125: 123075 | C125: 贝斯转债! | D125: 300580 | E125: 贝斯特 | F125: 汽车 | G125: 零部件制 | H125: 104.63 | I125: -1.03e-002 | J125: 1.1200000000000002e-002 | K125: 19.03 | L125: 1.6000000000000001e-003 | M125: 115.5 | N125: 23.74 | O125: 0.30499999999999999 | P125: 80.16 | Q125: 转股中 | R125: 5.33年 | S125: 3.34年 | T125: 6 | U125: 5.5 | V125: 9.0000000000000011e-003 | W125: 0.158 | X125: 0.126 | Y125: 38 | Z125: 2.21 | AA125: 1.9099999999999999e-002 | AB125: 1.37e-002 | AC125: -2.2000000000000001e-003 | AD125: -4.3e-003 | AE125: 83.48 | AF125: 83.15 | AG125: 0.52 | AH125: AA- | AI125: 6.5000000000000002e-002 | AJ125: =H125+100*O125 -> 135.13 | AK125: 129.1 | AL125: 132 | AM125: 45.6 | AN125: 224 | AO125: -2.5000000000000001e-002 | AP125: 8 | AQ125: 贝斯转债!
A126: 32 | B126: 123105 | C126: 拓尔转债! | D126: 300229 | E126: 拓尔思 | F126: 计算机及 | G126: 软件开发 | H126: 109.2 | I126: -5.8999999999999999e-003 | J126: 1.3100000000000001e-002 | K126: 8.72 | L126: 1.2800000000000001e-002 | M126: 121 | N126: 9.93 | O126: 0.24399999999999999 | P126: 87.81 | Q126: 2月25天 | R126: 5.71年 | S126: 3.71年 | T126: 8 | U126: 2.5 | V126: 3.0000000000000001e-003 | W126: 0.128 | X126: 0.11199999999999999 | Y126: 63 | Z126: 2.87 | AA126: 1.8500000000000003e-002 | AB126: 1.2e-002 | AC126: -1.2800000000000001e-002 | AD126: -1.47e-002 | AE126: 81.6 | AF126: 85.06 | AG126: 0.56 | AH126: AA- | AI126: 6.5000000000000002e-002 | AJ126: =H126+100*O126 -> 133.59999999999999 | AK126: 130.6 | AL126: 147 | AM126: 45.5 | AN126: 222 | AO126: -5.9000000000000004e-002 | AP126: 6 | AQ126: 拓尔转债!
A127: 52 | B127: 128143 | C127: 锋龙转债! | D127: 2931 | E127: 锋龙股份 | F127: 机械装备 | G127: 专用设备 | H127: 110.288 | I127: -1.03e-002 | J127: 1.8e-003 | K127: 12.85 | L127: -1.23e-002 | M127: 121.7 | N127: 12.73 | O127: 9.3000000000000013e-002 | P127: 100.94 | Q127: 12天 | R127: 5.52年 | S127: 3.52年 | T127: 2.45 | U127: 9.8 | V127: 3.6000000000000004e-002 | W127: 9.6000000000000002e-002 | X127: 9.6999999999999989e-002 | Y127: 26 | Z127: 2.91 | AA127: 1.84e-002 | AB127: 1.15e-002 | AC127: -1.44e-002 | AD127: -1.67e-002 | AE127: 80.13 | AF127: 82.04 | AG127: 0.69 | AH127: A+ | AI127: 7.5999999999999998e-002 | AJ127: =H127+100*O127 -> 119.58799999999999 | AK127: 119.6 | AL127: 40 | AM127: 37.6 | AN127: 152 | AO127: -0.16 | AP127: 12 | AQ127: 锋龙转债!
A128: 6 | B128: 127035 | C128: 濮耐转债 | D128: 2225 | E128: 濮耐股份 | F128: 钢铁 | G128: 钢铁行业 | H128: 105.16 | I128: -4.0000000000000002e-004 | J128: -3.4000000000000002e-003 | K128: 4.18 | L128: -7.0999999999999995e-003 | M128: 114.7 | N128: 4.43 | O128: 0.114 | P128: 94.36 | Q128: 5月2天 | R128: 4.90年 | S128: 2.90年 | T128: 6.26 | U128: 7.3 | V128: 1.1000000000000001e-002 | W128: 0.14800000000000002 | X128: 0.14000000000000001 | Y128: 42 | Z128: 1.39 | AA128: 1.8200000000000001e-002 | AB128: 1.2699999999999999e-002 | AC128: -5.5000000000000005e-003 | AD128: -7.7000000000000002e-003 | AE128: 91.08 | AF128: 93.89 | AG128: 0.52 | AH128: AA | AI128: 4.2599999999999999e-002 | AJ128: =H128+100*O128 -> 116.56 | AK128: 116 | AL128: 13 | AM128: 22.1 | AN128: 17 | AO128: -2.8999999999999998e-002 | AP128: 7 | AQ128: 濮耐转债
A129: 185 | B129: 123050 | C129: 聚飞转债 | D129: 300303 | E129: 聚飞光电 | F129: 电子 | G129: LED制 | H129: 113.966 | I129: -4.6999999999999993e-003 | J129: 2.0000000000000001e-004 | K129: 4.92 | L129: -8.1000000000000013e-003 | M129: 123.8 | N129: 5.08 | O129: 0.17699999999999999 | P129: 96.85 | Q129: 转股中 | R129: 4.78年 | S129: 2.78年 | T129: 7.05 | U129: 9.5 | V129: 1.2e-002 | W129: 0.11199999999999999 | X129: 0.109 | Y129: 63 | Z129: 2.56 | AA129: 1.78e-002 | AB129: 9.300000000000001e-003 | AC129: -3.1699999999999999e-002 | AD129: -3.4000000000000002e-002 | AE129: 86.63 | AF129: 92.76 | AG129: 0.56 | AH129: AA- | AI129: 6.3600000000000004e-002 | AJ129: =H129+100*O129 -> 131.666 | AK129: 131.1 | AL129: 156 | AM129: 38.3 | AN129: 159 | AO129: -4.5999999999999999e-002 | AP129: 11 | AQ129: 聚飞转债
A130: 44 | B130: 123097 | C130: 美力转债 | D130: 300611 | E130: 美力科技 | F130: 机械装备 | G130: 通用设备 | H130: 110.535 | I130: 3.4999999999999996e-003 | J130: 6.8999999999999999e-003 | K130: 9.68 | L130: 1.47e-002 | M130: 121.6 | N130: 9.34 | O130: 6.7000000000000004e-002 | P130: 103.64 | Q130: 31天 | R130: 5.57年 | S130: 3.57年 | T130: 3 | U130: 6.6 | V130: 2.e-002 | W130: 0.17300000000000001 | X130: 0.17899999999999999 | Y130: 17 | Z130: 2.6 | AA130: 1.77e-002 | AB130: 1.09e-002 | AC130: -1.4800000000000001e-002 | AD130: -1.7100000000000001e-002 | AE130: 79.82 | AF130: 81.66 | AG130: 0.7 | AH130: A+ | AI130: 7.5999999999999998e-002 | AJ130: =H130+100*O130 -> 117.235 | AK130: 117.4 | AL130: 19 | AM130: 35.8 | AN130: 132 | AO130: -1.2e-002 | AP130: 18 | AQ130: 美力转债
A131: 13 | B131: 127033 | C131: 中装转2 | D131: 2822 | E131: 中装建设 | F131: 建筑 | G131: 装饰工程 | H131: 105.999 | I131: 3.8e-003 | J131: 1.8e-003 | K131: 5.9 | L131: 1.03e-002 | M131: 117.1 | N131: 6.28 | O131: 0.128 | P131: 93.95 | Q131: 3月22天 | R131: 5.79年 | S131: 3.79年 | T131: 11.6 | U131: 40 | V131: 3.3000000000000002e-002 | W131: 0.27300000000000002 | X131: 0.25600000000000001 | Y131: 43 | Z131: 1.26 | AA131: 1.77e-002 | AB131: 1.23e-002 | AC131: -5.7999999999999996e-003 | AD131: -7.6e-003 | AE131: 87.5 | AF131: 91.67 | AG131: 0.54 | AH131: AA | AI131: 4.4000000000000004e-002 | AJ131: =H131+100*O131 -> 118.79899999999999 | AK131: 118 | AL131: 25 | AM131: 26.4 | AN131: 36 | AO131: 2.8999999999999998e-002 | AP131: 22 | AQ131: 中装转2
A132: 276 | B132: 113024 | C132: 核建转债! | D132: 601611 | E132: 中国核建 | F132: 建筑 | G132: 建筑工程 | H132: 102.66 | I132: 1.7000000000000001e-003 | J132: -3.4000000000000002e-003 | K132: 7.07 | L132: -8.3999999999999995e-003 | M132: 109.3 | N132: 9.76 | O132: 0.41700000000000004 | P132: 72.44 | Q132: 转股中 | R132: 3.76年 | S132: 1.77年 | T132: 30 | U132: 2 | V132: 1.e-003 | W132: 0.16 | X132: 0.11599999999999999 | Y132: 187 | Z132: 1.58 | AA132: 1.7100000000000001e-002 | AB132: 1.23e-002 | AC132: 7.000000000000001e-004 | AD132: -2.0999999999999999e-003 | AE132: 95.77 | AF132: 95.37 | AG132: 0.2 | AH132: AAA | AI132: 3.7599999999999995e-002 | AJ132: =H132+100*O132 -> 144.36000000000001 | AK132: 132.9 | AL132: 182 | AM132: 37.1 | AN132: 145 | AO132: -2.2000000000000002e-002 | AP132: 36 | AQ132: 核建转债!
A133: 17 | B133: 123112 | C133: 万讯转债 | D133: 300112 | E133: 万讯自控 | F133: 机械装备 | G133: 专用设备 | H133: 113 | I133: 8.8999999999999999e-003 | J133: 2.1299999999999999e-002 | K133: 9.18 | L133: 4.6799999999999994e-002 | M133: 124.4 | N133: 8.93 | O133: 9.9000000000000005e-002 | P133: 102.8 | Q133: 3月14天 | R133: 5.76年 | S133: 3.77年 | T133: 2.46 | U133: 23 | V133: 8.4000000000000005e-002 | W133: 9.4e-002 | X133: 9.6000000000000002e-002 | Y133: 26 | Z133: 2.45 | AA133: 1.7100000000000001e-002 | AB133: 9.8999999999999991e-003 | AC133: -2.0299999999999999e-002 | AD133: -2.23e-002 | AE133: 81.64 | AF133: 87.18 | AG133: 0.65 | AH133: AA- | AI133: 6.5000000000000002e-002 | AJ133: =H133+100*O133 -> 122.90000000000001 | AK133: 123.2 | AL133: 64 | AM133: 36 | AN133: 135 | AO133: 5.9000000000000004e-002 | AP133: 10 | AQ133: 万讯转债
A134: 192 | B134: 128105 | C134: 长集转债! | D134: 2616 | E134: 长青集团 | F134: 城市公用 | G134: 三废处理 | H134: 106.306 | I134: -4.5999999999999999e-003 | J134: 5.3e-003 | K134: 6.89 | L134: 1.5e-003 | M134: 114.9 | N134: 7.91 | O134: 0.22 | P134: 87.1 | Q134: 转股中 | R134: 4.77年 | S134: 2.77年 | T134: 8 | U134: 9.6 | V134: 1.1000000000000001e-002 | W134: 0.156 | X134: 0.13600000000000001 | Y134: 51 | Z134: 1.92 | AA134: 1.6799999999999999e-002 | AB134: 1.1000000000000001e-002 | AC134: -9.4999999999999998e-003 | AD134: -1.1699999999999999e-002 | AE134: 91.58 | AF134: 94.54 | AG134: 0.43 | AH134: AA | AI134: 4.2599999999999999e-002 | AJ134: =H134+100*O134 -> 128.30599999999998 | AK134: 125.5 | AL134: 85 | AM134: 31 | AN134: 73 | AO134: -3.7000000000000005e-002 | AP134: 17 | AQ134: 长集转债!
A135: 175 | B135: 123051 | C135: 今天转债 | D135: 300532 | E135: 今天国际 | F135: 计算机及 | G135: 软件开发 | H135: 113.001 | I135: -1.8000000000000002e-002 | J135: -7.4000000000000003e-003 | K135: 8.73 | L135: -3.9599999999999996e-002 | M135: 122.3 | N135: 8.7 | O135: 0.126 | P135: 100.34 | Q135: 转股中 | R135: 4.92年 | S135: 2.92年 | T135: 2.8 | U135: 20 | V135: 6.4000000000000001e-002 | W135: 0.11699999999999999 | X135: 0.11800000000000001 | Y135: 24 | Z135: 3.06 | AA135: 1.66e-002 | AB135: 8.6999999999999994e-003 | AC135: -2.6099999999999998e-002 | AD135: -2.86e-002 | AE135: 83.64 | AF135: 86.54 | AG135: 0.64 | AH135: A+ | AI135: 7.46e-002 | AJ135: =H135+100*O135 -> 125.601 | AK135: 125.7 | AL135: 88 | AM135: 39.1 | AN135: 167 | AO135: -9.0000000000000011e-003 | AP135: 18 | AQ135: 今天转债
A136: 314 | B136: 113516 | C136: 苏农转债! | D136: 603323 | E136: 苏农银行 | F136: 金融 | G136: 银行行业 | H136: 108.89 | I136: 8.6999999999999994e-003 | J136: -3.4000000000000002e-003 | K136: 4.51 | L136: 1.8100000000000002e-002 | M136: 114.3 | N136: 5.37 | O136: 0.29699999999999999 | P136: 83.99 | Q136: 转股中 | R136: 3年30天 | S136: 无权 | T136: 12.9 | U136: 69 | V136: 4.9000000000000002e-002 | W136: 0.158 | X136: 0.13300000000000001 | Y136: 81 | Z136: 0.67 | AA136: 1.6200000000000003e-002 | AB136: 7.7000000000000002e-003 | AC136: 无权 | AD136: 无权 | AE136: 无权 | AF136: 101.67 | AG136: 0.29 | AH136: AA+ | AI136: 3.9599999999999996e-002 | AJ136: =H136+100*O136 -> 138.59 | AK136: 133.8 | AL136: 190 | AM136: 32.1 | AN136: 86 | AO136: 2.9999999999999999e-002 | AP136: 28 | AQ136: 苏农转债!
A137: 14 | B137: 110080 | C137: 东湖转债 | D137: 600133 | E137: 东湖高新 | F137: 建筑 | G137: 建筑工程 | H137: 105.06 | I137: -5.6000000000000008e-003 | J137: 1.7000000000000001e-003 | K137: 5.81 | L137: -6.8000000000000005e-003 | M137: 115.1 | N137: 6.05 | O137: 9.4e-002 | P137: 96.03 | Q137: 3月16天 | R137: 5.78年 | S137: 3.78年 | T137: 15.5 | U137: 14 | V137: 8.0000000000000002e-003 | W137: 0.33500000000000002 | X137: 0.32200000000000001 | Y137: 46 | Z137: 0.85 | AA137: 1.6200000000000003e-002 | AB137: 1.1399999999999999e-002 | AC137: -3.5999999999999999e-003 | AD137: -5.3e-003 | AE137: 87.54 | AF137: 90.15 | AG137: 0.57 | AH137: AA | AI137: 4.4000000000000004e-002 | AJ137: =H137+100*O137 -> 114.46000000000001 | AK137: 114.1 | AL137: 11 | AM137: 23.9 | AN137: 25 | AO137: -2.8999999999999998e-002 | AP137: 20 | AQ137: 东湖转债
A138: 262 | B138: 128070 | C138: 智能转债! | D138: 2877 | E138: 智能自控 | F138: 机械装备 | G138: 通用设备 | H138: 109.76 | I138: -1.7399999999999999e-002 | J138: 1.32e-002 | K138: 6.45 | L138: -1.38e-002 | M138: 117.6 | N138: 9.47 | O138: 0.61199999999999999 | P138: 68.11 | Q138: 转股中 | R138: 3.997年 | S138: 无权 | T138: 2.3 | U138: 81 | V138: 0.317 | W138: 0.107 | X138: 7.2999999999999995e-002 | Y138: 21 | Z138: 2.9 | AA138: 1.6e-002 | AB138: 8.3999999999999995e-003 | AC138: 无权 | AD138: 无权 | AE138: 无权 | AF138: 88.1 | AG138: 0.31 | AH138: A+ | AI138: 7.46e-002 | AJ138: =H138+100*O138 -> 170.96000000000001 | AK138: 151.4 | AL138: 295 | AM138: 63.3 | AN138: 305 | AO138: -2.2000000000000002e-002 | AP138: 29 | AQ138: 智能转债!
A139: 330 | B139: 128037 | C139: 岩土转债! | D139: 2542 | E139: 中化岩土 | F139: 建筑 | G139: 建筑工程 | H139: 106.79 | I139: -8.8999999999999999e-003 | J139: 4.6999999999999993e-003 | K139: 2.94 | L139: -1.01e-002 | M139: 111.3 | N139: 3.13 | O139: 0.13699999999999998 | P139: 93.93 | Q139: 转股中 | R139: 2.70年 | S139: 0.70年 | T139: 5.99 | U139: 13 | V139: 2.1000000000000001e-002 | W139: 0.113 | X139: 0.106 | Y139: 53 | Z139: 1.34 | AA139: 1.5700000000000002e-002 | AB139: 7.9000000000000008e-003 | AC139: -5.3800000000000001e-002 | AD139: -5.7599999999999998e-002 | AE139: 98.34 | AF139: 100.08 | AG139: 0.41 | AH139: AA | AI139: 4.0800000000000003e-002 | AJ139: =H139+100*O139 -> 120.49000000000001 | AK139: 119.7 | AL139: 41 | AM139: 19.6 | AN139: 7 | AO139: -3.3000000000000002e-002 | AP139: 48 | AQ139: 岩土转债!
A140: 166 | B140: 128114 | C140: 正邦转债! | D140: 2157 | E140: 正邦科技 | F140: 农业 | G140: 畜牧业 | H140: 106.519 | I140: 1.7000000000000001e-003 | J140: -3.4000000000000002e-003 | K140: 11.84 | L140: -5.0000000000000001e-003 | M140: 114.9 | N140: 14.76 | O140: 0.32799999999999996 | P140: 80.22 | Q140: 转股中 | R140: 4.96年 | S140: 2.96年 | T140: 16 | U140: 23 | V140: 1.3000000000000001e-002 | W140: 4.2999999999999997e-002 | X140: 3.4000000000000002e-002 | Y140: 373 | Z140: 1.59 | AA140: 1.5700000000000002e-002 | AB140: 1.0200000000000001e-002 | AC140: -9.4999999999999998e-003 | AD140: -1.1599999999999999e-002 | AE140: 91.67 | AF140: 95.12 | AG140: 0.35 | AH140: AA+ | AI140: 3.9599999999999996e-002 | AJ140: =H140+100*O140 -> 139.31900000000002 | AK140: 132.8 | AL140: 181 | AM140: 37.7 | AN140: 154 | AO140: -6.0000000000000001e-003 | AP140: 17 | AQ140: 正邦转债!
A141: 349 | B141: 128022 | C141: 众信转债! | D141: 2707 | E141: 众信旅游 | F141: 旅游餐饮 | G141: 旅游 | H141: 104.88 | I141: 3.7000000000000002e-003 | J141: -4.0000000000000001e-003 | K141: 5.6 | L141: -1.5800000000000002e-002 | M141: 108.8 | N141: 7.92 | O141: 0.48299999999999998 | P141: 70.71 | Q141: 转股中 | R141: 2.42年 | S141: 0.42年 | T141: 4.56 | U141: 56 | V141: 0.11800000000000001 | W141: 8.9999999999999997e-002 | X141: 6.3e-002 | Y141: 51 | Z141: 7.6 | AA141: 1.55e-002 | AB141: 8.6e-003 | AC141: -5.4000000000000006e-002 | AD141: -5.8899999999999994e-002 | AE141: 96.96 | AF141: 90.06 | AG141: 0.02 | AH141: A | AI141: 8.2799999999999999e-002 | AJ141: =H141+100*O141 -> 153.18000000000001 | AK141: 139.1 | AL141: 236 | AM141: 42.1 | AN141: 193 | AO141: -3.5000000000000003e-002 | AP141: 31 | AQ141: 众信转债!
A142: 50 | B142: 123093 | C142: 金陵转债 | D142: 300651 | E142: 金陵体育 | F142: 其他 | G142: 文化教育 | H142: 118.99 | I142: 1.3100000000000001e-002 | J142: -3.27e-002 | K142: 39.59 | L142: -3.8399999999999997e-002 | M142: 129.3 | N142: 49.19 | O142: 0.47799999999999998 | P142: 80.48 | Q142: 24天 | R142: 5.55年 | S142: 3.55年 | T142: 2.5 | U142: 141 | V142: 0.46600000000000003 | W142: 4.9000000000000002e-002 | X142: 3.9e-002 | Y142: 51 | Z142: 7.39 | AA142: 1.55e-002 | AB142: 6.8000000000000005e-003 | AC142: -2.9999999999999999e-002 | AD142: -3.3099999999999997e-002 | AE142: 81.35 | AF142: 87.17 | AG142: 0.51 | AH142: A+ | AI142: 7.5999999999999998e-002 | AJ142: =H142+100*O142 -> 166.78999999999999 | AK142: 157.5 | AL142: 313 | AM142: 70.3 | AN142: 315 | AO142: -7.0999999999999994e-002 | AP142: 6 | AQ142: 金陵转债
A143: 155 | B143: 110071 | C143: 湖盐转债! | D143: 600929 | E143: 雪天盐业 | F143: 食品饮料 | G143: 食品饮料 | H143: 106.85 | I143: -8.9999999999999998e-004 | J143: 3.5999999999999999e-003 | K143: 6.38 | L143: 4.6999999999999993e-003 | M143: 115.2 | N143: 6.52 | O143: 9.1999999999999998e-002 | P143: 97.85 | Q143: 转股中 | R143: 5年7天 | S143: 3年8天 | T143: 7.2 | U143: 8.8 | V143: 1.1000000000000001e-002 | W143: 0.121 | X143: 0.11800000000000001 | Y143: 59 | Z143: 2.21 | AA143: 1.54e-002 | AB143: 9.8999999999999991e-003 | AC143: -9.3999999999999986e-003 | AD143: -1.1599999999999999e-002 | AE143: 90.53 | AF143: 93.23 | AG143: 0.57 | AH143: AA | AI143: 4.4000000000000004e-002 | AJ143: =H143+100*O143 -> 116.05 | AK143: 115.8 | AL143: 12 | AM143: 22.6 | AN143: 19 | AO143: -6.9999999999999993e-003 | AP143: 23 | AQ143: 湖盐转债!
A144: 93 | B144: 110076 | C144: 华海转债! | D144: 600521 | E144: 华海药业 | F144: 医药 | G144: 医药行业 | H144: 106.35 | I144: -4.4000000000000003e-003 | J144: 0. | K144: 20.7 | L144: -2.7699999999999999e-002 | M144: 115.1 | N144: 34.46 | O144: 0.77000000000000002 | P144: 60.07 | Q144: 转股中 | R144: 5.33年 | S144: 3.34年 | T144: 18.4 | U144: 21 | V144: 1.1000000000000001e-002 | W144: 6.0999999999999999e-002 | X144: 3.7000000000000005e-002 | Y144: 301 | Z144: 4.62 | AA144: 1.52e-002 | AB144: 1.e-002 | AC144: -7.4999999999999997e-003 | AD144: -9.4999999999999998e-003 | AE144: 89.22 | AF144: 91.88 | AG144: 0.16 | AH144: AA | AI144: 4.4000000000000004e-002 | AJ144: =H144+100*O144 -> 183.34999999999999 | AK144: 152.6 | AL144: 297 | AM144: 60.8 | AN144: 299 | AO144: -2.e-003 | AP144: 7 | AQ144: 华海转债!
A145: 11 | B145: 113048 | C145: 晶科转债! | D145: 601778 | E145: 晶科科技 | F145: 能源电力 | G145: 太阳能 | H145: 107.52 | I145: -2.9999999999999997e-004 | J145: -1.8e-003 | K145: 5.28 | L145: -3.8e-003 | M145: 117.1 | N145: 5.48 | O145: 0.11599999999999999 | P145: 96.35 | Q145: 3月29天 | R145: 5.81年 | S145: 3.81年 | T145: 30 | U145: 28 | V145: 9.0000000000000011e-003 | W145: 0.20499999999999999 | X145: 0.19800000000000001 | Y145: 146 | Z145: 1.34 | AA145: 1.5100000000000001e-002 | AB145: 9.7999999999999997e-003 | AC145: -9.3999999999999986e-003 | AD145: -1.11e-002 | AE145: 87.43 | AF145: 91.59 | AG145: 0.56 | AH145: AA | AI145: 4.4000000000000004e-002 | AJ145: =H145+100*O145 -> 119.11999999999999 | AK145: 118.7 | AL145: 29 | AM145: 27.1 | AN145: 42 | AO145: -2.1000000000000001e-002 | AP145: 7 | AQ145: 晶科转债!
A146: 102 | B146: 123071 | C146: 天能转债! | D146: 300569 | E146: 天能重工 | F146: 能源电力 | G146: 风能 | H146: 112.4 | I146: -7.000000000000001e-004 | J146: 7.000000000000001e-004 | K146: 8.1 | L146: 0. | M146: 121.1 | N146: 7.73 | O146: 7.2999999999999995e-002 | P146: 104.79 | Q146: 转股中 | R146: 5.30年 | S146: 3.30年 | T146: 7 | U146: 10 | V146: 1.3000000000000001e-002 | W146: 0.127 | X146: 0.13300000000000001 | Y146: 55 | Z146: 1.36 | AA146: 1.4499999999999999e-002 | AB146: 7.4999999999999997e-003 | AC146: -2.23e-002 | AD146: -2.4399999999999998e-002 | AE146: 83.8 | AF146: 87.36 | AG146: 0.67 | AH146: AA- | AI146: 6.5000000000000002e-002 | AJ146: =H146+100*O146 -> 119.7 | AK146: 120 | AL146: 43 | AM146: 32.7 | AN146: 94 | AO146: -0.223 | AP146: 13 | AQ146: 天能转债!
A147: 159 | B147: 123057 | C147: 美联转债! | D147: 300586 | E147: 美联新材 | F147: 化工 | G147: 橡胶塑料 | H147: 109.814 | I147: 1.e-004 | J147: 1.1000000000000001e-003 | K147: 8.82 | L147: 2.3e-003 | M147: 117.8 | N147: 9.91 | O147: 0.23399999999999999 | P147: 89 | Q147: 转股中 | R147: 4.99年 | S147: 2.997年 | T147: 2.07 | U147: 18 | V147: 7.9000000000000001e-002 | W147: 5.0999999999999997e-002 | X147: 4.5999999999999999e-002 | Y147: 40 | Z147: 5.42 | AA147: 1.44e-002 | AB147: 8.1000000000000013e-003 | AC147: -1.8000000000000002e-002 | AD147: -2.0199999999999999e-002 | AE147: 85.49 | AF147: 87.14 | AG147: 0.55 | AH147: AA- | AI147: 6.3600000000000004e-002 | AJ147: =H147+100*O147 -> 133.214 | AK147: 130.6 | AL147: 149 | AM147: 43.5 | AN147: 207 | AO147: 4.4000000000000004e-002 | AP147: 20 | AQ147: 美联转债!
A148: 260 | B148: 113542 | C148: 好客转债 | D148: 603898 | E148: 好莱客 | F148: 其他 | G148: 家居用品 | H148: 108.7 | I148: -3.3e-003 | J148: -7.7000000000000002e-003 | K148: 13.35 | L148: -3.1899999999999998e-002 | M148: 114.9 | N148: 16.14 | O148: 0.314 | P148: 82.71 | Q148: 转股中 | R148: 4年29天 | S148: 2年30天 | T148: 6.03 | U148: 0.9 | V148: 1.e-003 | W148: 0.14499999999999999 | X148: 0.12 | Y148: 42 | Z148: 1.61 | AA148: 1.3999999999999999e-002 | AB148: 7.3000000000000001e-003 | AC148: -2.2200000000000001e-002 | AD148: -2.5099999999999997e-002 | AE148: 94.25 | AF148: 97.29 | AG148: 0.34 | AH148: AA | AI148: 4.2599999999999999e-002 | AJ148: =H148+100*O148 -> 140.09999999999999 | AK148: 134.7 | AL148: 200 | AM148: 37.4 | AN148: 149 | AO148: -6.9000000000000006e-002 | AP148: 17 | AQ148: 好客转债
A149: 39 | B149: 128144 | C149: 利民转债 | D149: 2734 | E149: 利民股份 | F149: 化工 | G149: 农化 | H149: 105.581 | I149: -1.e-004 | J149: -4.0999999999999995e-003 | K149: 11.59 | L149: -9.3999999999999986e-003 | M149: 114.1 | N149: 13.98 | O149: 0.27399999999999997 | P149: 82.9 | Q149: 2月5天 | R149: 5.66年 | S149: 3.66年 | T149: 9.8 | U149: 13 | V149: 1.2e-002 | W149: 0.22699999999999998 | X149: 0.188 | Y149: 43 | Z149: 1.57 | AA149: 1.3999999999999999e-002 | AB149: 9.3999999999999986e-003 | AC149: -6.8999999999999999e-003 | AD149: -8.3000000000000001e-003 | AE149: 87.33 | AF149: 89.75 | AG149: 0.44 | AH149: AA | AI149: 4.4000000000000004e-002 | AJ149: =H149+100*O149 -> 132.98099999999999 | AK149: 128.3 | AL149: 121 | AM149: 38.5 | AN149: 163 | AO149: -3.6000000000000004e-002 | AP149: 5 | AQ149: 利民转债
A150: 326 | B150: 128039 | C150: 三力转债! | D150: 2224 | E150: 三 力 士 | F150: 机械装备 | G150: 专用设备 | H150: 104.6 | I150: -4.7999999999999996e-003 | J150: 2.2000000000000001e-003 | K150: 4.63 | L150: -8.6e-003 | M150: 108.8 | N150: 5.79 | O150: 0.308 | P150: 79.97 | Q150: 转股中 | R150: 2.93年 | S150: 0.93年 | T150: 2.03 | U150: 2.1 | V150: 1.e-002 | W150: 5.9999999999999998e-002 | X150: 4.8000000000000001e-002 | Y150: 34 | Z150: 1.47 | AA150: 1.37e-002 | AB150: 8.0000000000000002e-003 | AC150: -2.6600000000000002e-002 | AD150: -2.9300000000000003e-002 | AE150: 95.07 | AF150: 91.46 | AG150: 0.29 | AH150: AA- | AI150: 6.1799999999999994e-002 | AJ150: =H150+100*O150 -> 135.40000000000001 | AK150: 129.2 | AL150: 133 | AM150: 34.2 | AN150: 112 | AO150: -3.1e-002 | AP150: 28 | AQ150: 三力转债!
A151: 244 | B151: 110060 | C151: 天路转债! | D151: 600326 | E151: 西藏天路 | F151: 建筑 | G151: 水泥 | H151: 108.59 | I151: -1.8e-003 | J151: -1.7000000000000001e-003 | K151: 6.69 | L151: -7.4000000000000003e-003 | M151: 114.9 | N151: 7.16 | O151: 0.16200000000000001 | P151: 93.44 | Q151: 转股中 | R151: 4.32年 | S151: 2.32年 | T151: 7.06 | U151: 2.5 | V151: 3.0000000000000001e-003 | W151: 0.115 | X151: 0.107 | Y151: 61 | Z151: 1.45 | AA151: 1.34e-002 | AB151: 7.0999999999999995e-003 | AC151: -1.9699999999999999e-002 | AD151: -2.23e-002 | AE151: 93.3 | AF151: 96.31 | AG151: 0.48 | AH151: AA | AI151: 4.2599999999999999e-002 | AJ151: =H151+100*O151 -> 124.79000000000001 | AK151: 123.7 | AL151: 67 | AM151: 27.4 | AN151: 45 | AO151: -2.5000000000000001e-002 | AP151: 14 | AQ151: 天路转债!
A152: 337 | B152: 128034 | C152: 江银转债! | D152: 2807 | E152: 江阴银行 | F152: 金融 | G152: 银行行业 | H152: 104.758 | I152: -6.8000000000000005e-003 | J152: 5.7999999999999996e-003 | K152: 3.94 | L152: -2.5000000000000001e-003 | M152: 108.3 | N152: 4.32 | O152: 0.14899999999999999 | P152: 91.2 | Q152: 转股中 | R152: 2.57年 | S152: 无权 | T152: 17.6 | U152: 12 | V152: 6.9999999999999993e-003 | W152: 0.20499999999999999 | X152: 0.187 | Y152: 86 | Z152: 0.72 | AA152: 1.32e-002 | AB152: 6.9999999999999993e-003 | AC152: 无权 | AD152: 无权 | AE152: 无权 | AF152: 98.57 | AG152: 0.39 | AH152: AA+ | AI152: 3.78e-002 | AJ152: =H152+100*O152 -> 119.65799999999999 | AK152: 118.3 | AL152: 27 | AM152: 19.7 | AN152: 9 | AO152: -8.0000000000000002e-003 | AP152: 25 | AQ152: 江银转债!
A153: 90 | B153: 127024 | C153: 盈峰转债 | D153: 967 | E153: 盈峰环境 | F153: 机械装备 | G153: 专用设备 | H153: 108.998 | I153: -5.5000000000000005e-003 | J153: 6.0000000000000001e-003 | K153: 6.86 | L153: 1.5e-003 | M153: 116.8 | N153: 8.31 | O153: 0.32000000000000001 | P153: 82.55 | Q153: 转股中 | R153: 5.34年 | S153: 3.34年 | T153: 14.8 | U153: 16 | V153: 1.e-002 | W153: 6.8000000000000005e-002 | X153: 5.5999999999999994e-002 | Y153: 217 | Z153: 1.29 | AA153: 1.32e-002 | AB153: 7.6e-003 | AC153: -1.5300000000000001e-002 | AD153: -1.7100000000000001e-002 | AE153: 89.81 | AF153: 94.58 | AG153: 0.38 | AH153: AA+ | AI153: 4.0999999999999995e-002 | AJ153: =H153+100*O153 -> 140.99799999999999 | AK153: 135.4 | AL153: 206 | AM153: 40.9 | AN153: 183 | AO153: -7.2999999999999995e-002 | AP153: 5 | AQ153: 盈峰转债
A154: 225 | B154: 128090 | C154: 汽模转2 | D154: 2510 | E154: 天汽模 | F154: 汽车 | G154: 零部件制 | H154: 108.5 | I154: -1.0500000000000001e-002 | J154: 1.2e-002 | K154: 4.1 | L154: 2.3999999999999998e-003 | M154: 114.9 | N154: 4.23 | O154: 0.11900000000000001 | P154: 96.93 | Q154: 转股中 | R154: 4.48年 | S154: 2.49年 | T154: 3.1 | U154: 11 | V154: 3.1e-002 | W154: 8.0000000000000002e-002 | X154: 7.8e-002 | Y154: 39 | Z154: 1.92 | AA154: 1.3100000000000001e-002 | AB154: 7.0999999999999995e-003 | AC154: -1.8200000000000001e-002 | AD154: -2.06e-002 | AE154: 87.94 | AF154: 87.64 | AG154: 0.61 | AH154: AA- | AI154: 6.3600000000000004e-002 | AJ154: =H154+100*O154 -> 120.40000000000001 | AK154: 120.1 | AL154: 44 | AM154: 32.1 | AN154: 87 | AO154: 1.e-003 | AP154: 28 | AQ154: 汽模转2
A155: 98 | B155: 123073 | C155: 同和转债! | D155: 300636 | E155: 同和药业 | F155: 医药 | G155: 原料药 | H155: 114.4 | I155: -1.2500000000000001e-002 | J155: -1.6e-002 | K155: 15.52 | L155: -4.0800000000000003e-002 | M155: 122.4 | N155: 14.82 | O155: 9.1999999999999998e-002 | P155: 104.72 | Q155: 转股中 | R155: 5.32年 | S155: 3.32年 | T155: 3.59 | U155: 3.5 | V155: 8.0000000000000002e-003 | W155: 0.11199999999999999 | X155: 0.11800000000000001 | Y155: 32 | Z155: 2.54 | AA155: 1.3100000000000001e-002 | AB155: 5.7999999999999996e-003 | AC155: -2.58e-002 | AD155: -2.8199999999999999e-002 | AE155: 81.29 | AF155: 83.73 | AG155: 0.7 | AH155: A+ | AI155: 7.5999999999999998e-002 | AJ155: =H155+100*O155 -> 123.60000000000001 | AK155: 124.1 | AL155: 70 | AM155: 40.3 | AN155: 179 | AO155: -7.400000000000001e-002 | AP155: 12 | AQ155: 同和转债!
A156: 325 | B156: 128040 | C156: 华通转债! | D156: 2758 | E156: 浙农股份 | F156: 医药 | G156: 医药商业 | H156: 107.211 | I156: -4.0999999999999995e-003 | J156: 5.9999999999999995e-004 | K156: 9.38 | L156: -8.5000000000000006e-003 | M156: 111.3 | N156: 10.15 | O156: 0.16 | P156: 92.41 | Q156: 转股中 | R156: 2.95年 | S156: 0.95年 | T156: 2.22 | U156: 10 | V156: 4.2999999999999997e-002 | W156: 4.9000000000000002e-002 | X156: 4.4999999999999998e-002 | Y156: 46 | Z156: 1.52 | AA156: 1.3000000000000001e-002 | AB156: 5.7999999999999996e-003 | AC156: -4.5400000000000003e-002 | AD156: -4.8399999999999999e-002 | AE156: 97.36 | AF156: 99.09 | AG156: 0.42 | AH156: AA | AI156: 4.0800000000000003e-002 | AJ156: =H156+100*O156 -> 123.211 | AK156: 122 | AL156: 58 | AM156: 22.9 | AN156: 20 | AO156: -2.5000000000000001e-002 | AP156: 31 | AQ156: 华通转债!
A157: 218 | B157: 113563 | C157: 柳药转债! | D157: 603368 | E157: 柳药股份 | F157: 医药 | G157: 医药商业 | H157: 106.63 | I157: -3.5999999999999999e-003 | J157: 8.199999999999999e-003 | K157: 20.11 | L157: 1.1599999999999999e-002 | M157: 112.9 | N157: 23.87 | O157: 0.26600000000000001 | P157: 84.25 | Q157: 转股中 | R157: 4.54年 | S157: 2.54年 | T157: 8.02 | U157: 5.7 | V157: 6.9999999999999993e-003 | W157: 0.11 | X157: 9.3000000000000013e-002 | Y157: 73 | Z157: 1.41 | AA157: 1.29e-002 | AB157: 7.6e-003 | AC157: -1.1399999999999999e-002 | AD157: -1.38e-002 | AE157: 92.45 | AF157: 93.78 | AG157: 0.4 | AH157: AA | AI157: 4.2599999999999999e-002 | AJ157: =H157+100*O157 -> 133.22999999999999 | AK157: 129 | AL157: 130 | AM157: 35.2 | AN157: 126 | AO157: 1.4999999999999999e-002 | AP157: 17 | AQ157: 柳药转债!
A158: 228 | B158: 113030 | C158: 东风转债! | D158: 601515 | E158: 东风股份 | F158: 造纸包装 | G158: 包装材料 | H158: 110.58 | I158: -1.2999999999999999e-003 | J158: 1.2999999999999999e-003 | K158: 6.16 | L158: 0. | M158: 116.9 | N158: 6.45 | O158: 0.158 | P158: 95.5 | Q158: 转股中 | R158: 4.48年 | S158: 2.48年 | T158: 2.95 | U158: 5.5 | V158: 1.7000000000000001e-002 | W158: 3.6000000000000004e-002 | X158: 3.4000000000000002e-002 | Y158: 82 | Z158: 1.78 | AA158: 1.2699999999999999e-002 | AB158: 6.0000000000000001e-003 | AC158: -2.53e-002 | AD158: -2.7699999999999999e-002 | AE158: 92.7 | AF158: 97.35 | AG158: 0.49 | AH158: AA | AI158: 4.2599999999999999e-002 | AJ158: =H158+100*O158 -> 126.38 | AK158: 125.7 | AL158: 87 | AM158: 28.3 | AN158: 51 | AO158: -5.2999999999999999e-002 | AP158: 17 | AQ158: 东风转债!
A159: 341 | B159: 110041 | C159: 蒙电转债! | D159: 600863 | E159: 内蒙华电 | F159: 能源电力 | G159: 电力供应 | H159: 106.03 | I159: 1.1999999999999999e-003 | J159: -4.1999999999999997e-003 | K159: 2.29 | L159: -8.6999999999999994e-003 | M159: 109.3 | N159: 2.56 | O159: 0.185 | P159: 89.45 | Q159: 转股中 | R159: 2.47年 | S159: 0.47年 | T159: 18.7 | U159: 12 | V159: 6.0000000000000001e-003 | W159: 0.14000000000000001 | X159: 0.126 | Y159: 133 | Z159: 1.14 | AA159: 1.26e-002 | AB159: 5.4000000000000003e-003 | AC159: -6.1799999999999994e-002 | AD159: -6.6900000000000001e-002 | AE159: 99.54 | AF159: 100.35 | AG159: 0.34 | AH159: AAA | AI159: 3.5799999999999998e-002 | AJ159: =H159+100*O159 -> 124.53 | AK159: 122.6 | AL159: 61 | AM159: 22.3 | AN159: 18 | AO159: -4.8000000000000001e-002 | AP159: 11 | AQ159: 蒙电转债!
A160: 285 | B160: 123024 | C160: 岱勒转债! | D160: 300700 | E160: 岱勒新材 | F160: 机械装备 | G160: 专用设备 | H160: 108.781 | I160: -2.e-003 | J160: 7.0999999999999995e-003 | K160: 12.64 | L160: 1.1200000000000002e-002 | M160: 112.5 | N160: 14.1 | O160: 0.21299999999999999 | P160: 89.65 | Q160: 转股中 | R160: 2.72年 | S160: 0.72年 | T160: 2.1 | U160: 7.6 | V160: 3.3000000000000002e-002 | W160: 0.155 | X160: 0.13900000000000001 | Y160: 14 | Z160: 2.15 | AA160: 1.26e-002 | AB160: 4.0999999999999995e-003 | AC160: -7.8100000000000003e-002 | AD160: -8.0600000000000005e-002 | AE160: 95.16 | AF160: 93.16 | AG160: 0.46 | AH160: A+ | AI160: 7.2800000000000004e-002 | AJ160: =H160+100*O160 -> 130.08100000000002 | AK160: 127.9 | AL160: 120 | AM160: 32.8 | AN160: 96 | AO160: -2.7000000000000003e-002 | AP160: 36 | AQ160: 岱勒转债!
A161: 83 | B161: 113609 | C161: 永安转债! | D161: 603776 | E161: 永安行 | F161: 城市公用 | G161: 其他 | H161: 112.95 | I161: 8.9999999999999998e-004 | J161: 2.7000000000000001e-003 | K161: 17.59 | L161: 5.1000000000000004e-003 | M161: 120.5 | N161: 16.48 | O161: 5.7999999999999996e-002 | P161: 106.74 | Q161: 转股中 | R161: 5.39年 | S161: 3.40年 | T161: 7.43 | U161: 65 | V161: 7.6999999999999999e-002 | W161: 0.183 | X161: 0.19600000000000001 | Y161: 40 | Z161: 1.05 | AA161: 1.23e-002 | AB161: 5.6999999999999993e-003 | AC161: -2.3599999999999999e-002 | AD161: -2.5499999999999998e-002 | AE161: 83.16 | AF161: 86.39 | AG161: 0.69 | AH161: AA- | AI161: 6.5000000000000002e-002 | AJ161: =H161+100*O161 -> 118.75 | AK161: 119.2 | AL161: 38 | AM161: 32.8 | AN161: 97 | AO161: -0.155 | AP161: 21 | AQ161: 永安转债!
A162: 181 | B162: 128107 | C162: 交科转债 | D162: 2061 | E162: 浙江交科 | F162: 建筑 | G162: 建筑工程 | H162: 108.57 | I162: -2.5999999999999999e-003 | J162: -3.4999999999999996e-003 | K162: 5.26 | L162: -1.1299999999999999e-002 | M162: 114.9 | N162: 5.36 | O162: 0.106 | P162: 98.13 | Q162: 转股中 | R162: 4.80年 | S162: 2.81年 | T162: 25 | U162: 6.8 | V162: 3.0000000000000001e-003 | W162: 0.34499999999999997 | X162: 0.33899999999999997 | Y162: 72 | Z162: 0.84 | AA162: 1.21e-002 | AB162: 6.4000000000000003e-003 | AC162: -1.6399999999999998e-002 | AD162: -1.8600000000000002e-002 | AE162: 92.22 | AF162: 95.68 | AG162: 0.54 | AH162: AA+ | AI162: 3.9599999999999996e-002 | AJ162: =H162+100*O162 -> 119.16999999999999 | AK162: 119 | AL162: 33 | AM162: 23.3 | AN162: 22 | AO162: -2.2000000000000002e-002 | AP162: 18 | AQ162: 交科转债
A163: 74 | B163: 128140 | C163: 润建转债! | D163: 2929 | E163: 润建股份 | F163: 通信互联 | G163: 通信设备 | H163: 108.036 | I163: -1.1699999999999999e-002 | J163: 6.5000000000000006e-003 | K163: 24.7 | L163: -9.5999999999999992e-003 | M163: 115.2 | N163: 26.4 | O163: 0.155 | P163: 93.56 | Q163: 转股中 | R163: 5.43年 | S163: 3.43年 | T163: 10.9 | U163: 1.8 | V163: 2.e-003 | W163: 0.20000000000000001 | X163: 0.187 | Y163: 55 | Z163: 1.73 | AA163: 1.21e-002 | AB163: 6.9999999999999993e-003 | AC163: -1.1399999999999999e-002 | AD163: -1.34e-002 | AE163: 88.95 | AF163: 91.6 | AG163: 0.53 | AH163: AA | AI163: 4.4000000000000004e-002 | AJ163: =H163+100*O163 -> 123.536 | AK163: 122.5 | AL163: 60 | AM163: 30.9 | AN163: 72 | AO163: -2.2000000000000002e-002 | AP163: 14 | AQ163: 润建转债!
A164: 113 | B164: 128133 | C164: 奇正转债! | D164: 2287 | E164: 奇正藏药 | F164: 医药 | G164: 中药 | H164: 110.327 | I164: -4.3e-003 | J164: 7.4000000000000003e-003 | K164: 28.59 | L164: 6.0000000000000001e-003 | M164: 117.3 | N164: 30.12 | O164: 0.16200000000000001 | P164: 94.92 | Q164: 转股中 | R164: 5.22年 | S164: 3.22年 | T164: 8 | U164: 173 | V164: 0.192 | W164: 5.2999999999999999e-002 | X164: 5.0000000000000003e-002 | Y164: 152 | Z164: 5.85 | AA164: 1.2e-002 | AB164: 6.0999999999999995e-003 | AC164: -1.8000000000000002e-002 | AD164: -2.0099999999999996e-002 | AE164: 89.85 | AF164: 94.12 | AG164: 0.53 | AH164: AA | AI164: 4.4000000000000004e-002 | AJ164: =H164+100*O164 -> 126.527 | AK164: 125.7 | AL164: 89 | AM164: 31.6 | AN164: 79 | AO164: 9.6999999999999989e-002 | AP164: 15 | AQ164: 奇正转债!
A165: 72 | B165: 127026 | C165: 超声转债! | D165: 823 | E165: 超声电子 | F165: 电子 | G165: 元器件制 | H165: 106.14 | I165: -5.1999999999999998e-003 | J165: 3.4999999999999996e-003 | K165: 10.87 | L165: -3.7000000000000002e-003 | M165: 113.1 | N165: 12.72 | O165: 0.24199999999999999 | P165: 85.46 | Q165: 转股中 | R165: 5.43年 | S165: 3.44年 | T165: 7 | U165: 5.9 | V165: 8.0000000000000002e-003 | W165: 0.12 | X165: 0.10199999999999999 | Y165: 58 | Z165: 1.52 | AA165: 1.2e-002 | AB165: 7.4999999999999997e-003 | AC165: -6.7000000000000002e-003 | AD165: -8.6999999999999994e-003 | AE165: 88.84 | AF165: 89.91 | AG165: 0.47 | AH165: AA | AI165: 4.4000000000000004e-002 | AJ165: =H165+100*O165 -> 130.34 | AK165: 126.8 | AL165: 103 | AM165: 36.9 | AN165: 143 | AO165: -4.0000000000000001e-003 | AP165: 12 | AQ165: 超声转债!
A166: 350 | B166: 128021 | C166: 兄弟转债!! | D166: 2562 | E166: 兄弟科技 | F166: 医药 | G166: 原料药 | H166: 105.799 | I166: 8.9999999999999998e-004 | J166: -1.8e-003 | K166: 4.19 | L166: -4.7999999999999996e-003 | M166: 108.8 | N166: 5.19 | O166: 0.31 | P166: 80.73 | Q166: 转股中 | R166: 2.41年 | S166: 0.41年 | T166: 2.65 | U166: 5.4 | V166: 1.9e-002 | W166: 5.9999999999999998e-002 | X166: 4.8000000000000001e-002 | Y166: 45 | Z166: 1.5 | AA166: 1.1899999999999999e-002 | AB166: 4.8999999999999998e-003 | AC166: -6.9099999999999995e-002 | AD166: -7.400000000000001e-002 | AE166: 99.25 | AF166: 98.96 | AG166: 0.18 | AH166: AA | AI166: 4.0800000000000003e-002 | AJ166: =H166+100*O166 -> 136.79900000000001 | AK166: 130.9 | AL166: 151 | AM166: 31.6 | AN166: 78 | AO166: -4.2000000000000003e-002 | AP166: 14 | AQ166: 兄弟转债!!
A167: 246 | B167: 127014 | C167: 北方转债! | D167: 65 | E167: 北方国际 | F167: 建筑 | G167: 建筑工程 | H167: 109.6 | I167: -5.8999999999999999e-003 | J167: 6.5000000000000006e-003 | K167: 8.2 | L167: 1.1999999999999999e-003 | M167: 115.1 | N167: 8.65 | O167: 0.156 | P167: 94.8 | Q167: 转股中 | R167: 4.31年 | S167: 2.31年 | T167: 5.35 | U167: 37 | V167: 6.4000000000000001e-002 | W167: 8.4000000000000005e-002 | X167: 8.0000000000000002e-002 | Y167: 64 | Z167: 1.14 | AA167: 1.1699999999999999e-002 | AB167: 5.3e-003 | AC167: -2.2700000000000001e-002 | AD167: -2.5399999999999999e-002 | AE167: 94.21 | AF167: 97.73 | AG167: 0.48 | AH167: AA+ | AI167: 3.9599999999999996e-002 | AJ167: =H167+100*O167 -> 125.19999999999999 | AK167: 124.4 | AL167: 74 | AM167: 26.7 | AN167: 39 | AO167: 3.7999999999999999e-002 | AP167: 19 | AQ167: 北方转债!
A168: 36 | B168: 123101 | C168: 拓斯转债! | D168: 300607 | E168: 拓斯达 | F168: 机械装备 | G168: 机器人及 | H168: 107.868 | I168: -1.3000000000000001e-002 | J168: 1.32e-002 | K168: 33.81 | L168: 5.9999999999999995e-004 | M168: 115.1 | N168: 42.25 | O168: 0.34799999999999998 | P168: 80.02 | Q168: 2月16天 | R168: 5.68年 | S168: 3.69年 | T168: 6.7 | U168: 7.1 | V168: 1.e-002 | W168: 7.400000000000001e-002 | X168: 5.9999999999999998e-002 | Y168: 90 | Z168: 4.01 | AA168: 1.1699999999999999e-002 | AB168: 6.8999999999999999e-003 | AC168: -1.0500000000000001e-002 | AD168: -1.23e-002 | AE168: 87.88 | AF168: 90.5 | AG168: 0.41 | AH168: AA | AI168: 4.4000000000000004e-002 | AJ168: =H168+100*O168 -> 142.66800000000001 | AK168: 135.7 | AL168: 209 | AM168: 45.2 | AN168: 221 | AO168: 2.5000000000000001e-002 | AP168: 4 | AQ168: 拓斯转债!
A169: 23 | B169: 123107 | C169: 温氏转债! | D169: 300498 | E169: 温氏股份 | F169: 农业 | G169: 畜牧业 | H169: 106 | I169: -9.7000000000000003e-003 | J169: 6.4000000000000003e-003 | K169: 14.02 | L169: -8.5000000000000006e-003 | M169: 113 | N169: 17.82 | O169: 0.34700000000000003 | P169: 78.68 | Q169: 3月8天 | R169: 5.74年 | S169: 3.74年 | T169: 93 | U169: 30 | V169: 3.0000000000000001e-003 | W169: 0.10400000000000001 | X169: 8.199999999999999e-002 | Y169: 894 | Z169: 1.94 | AA169: 1.1399999999999999e-002 | AB169: 7.1999999999999998e-003 | AC169: -6.0999999999999995e-003 | AD169: -7.8000000000000005e-003 | AE169: 89.23 | AF169: 91.07 | AG169: 0.38 | AH169: AAA | AI169: 3.9e-002 | AJ169: =H169+100*O169 -> 140.69999999999999 | AK169: 133.3 | AL169: 186 | AM169: 42.3 | AN169: 195 | AO169: -1.2e-002 | AP169: 9 | AQ169: 温氏转债!
A170: 61 | B170: 128141 | C170: 旺能转债 | D170: 2034 | E170: 旺能环境 | F170: 城市公用 | G170: 三废处理 | H170: 108.427 | I170: -4.3e-003 | J170: 2.9999999999999997e-004 | K170: 15.45 | L170: -7.0999999999999995e-003 | M170: 115.1 | N170: 15.97 | O170: 0.121 | P170: 96.74 | Q170: 转股中 | R170: 5.46年 | S170: 3.46年 | T170: 14 | U170: 19 | V170: 1.2e-002 | W170: 0.215 | X170: 0.20800000000000002 | Y170: 65 | Z170: 1.38 | AA170: 1.1200000000000002e-002 | AB170: 6.1999999999999998e-003 | AC170: -1.26e-002 | AD170: -1.4499999999999999e-002 | AE170: 88.75 | AF170: 91.39 | AG170: 0.57 | AH170: AA | AI170: 4.4000000000000004e-002 | AJ170: =H170+100*O170 -> 120.527 | AK170: 120.1 | AL170: 45 | AM170: 28.7 | AN170: 55 | AO170: -6.5000000000000002e-002 | AP170: 6 | AQ170: 旺能转债
A171: 121 | B171: 128129 | C171: 青农转债! | D171: 2958 | E171: 青农商行 | F171: 金融 | G171: 银行行业 | H171: 106.128 | I171: -8.199999999999999e-003 | J171: 3.2000000000000002e-003 | K171: 4.24 | L171: -9.300000000000001e-003 | M171: 112.2 | N171: 4.47 | O171: 0.11900000000000001 | P171: 94.85 | Q171: 转股中 | R171: 5年53天 | S171: 无权 | T171: 50 | U171: 26 | V171: 5.0000000000000001e-003 | W171: 0.21199999999999999 | X171: 0.20100000000000001 | Y171: 236 | Z171: 0.86 | AA171: 1.1000000000000001e-002 | AB171: 6.6e-003 | AC171: 无权 | AD171: 无权 | AE171: 无权 | AF171: 92.44 | AG171: 0.53 | AH171: AAA | AI171: 3.9e-002 | AJ171: =H171+100*O171 -> 118.02800000000001 | AK171: 117.4 | AL171: 18 | AM171: 25 | AN171: 27 | AO171: -2.3e-002 | AP171: 15 | AQ171: 青农转债!
A172: 55 | B172: 123092 | C172: 天壕转债 | D172: 300332 | E172: 天壕环境 | F172: 石油天然 | G172: 天然气 | H172: 114.656 | I172: 5.6999999999999993e-003 | J172: -3.0999999999999999e-003 | K172: 5.4 | L172: 3.7000000000000002e-003 | M172: 121.6 | N172: 5.2 | O172: 0.10400000000000001 | P172: 103.85 | Q172: 转股中 | R172: 5.48年 | S172: 3.48年 | T172: 4.23 | U172: 9.6 | V172: 2.e-002 | W172: 8.900000000000001e-002 | X172: 9.1999999999999998e-002 | Y172: 48 | Z172: 1.41 | AA172: 1.1000000000000001e-002 | AB172: 4.1999999999999997e-003 | AC172: -2.5099999999999997e-002 | AD172: -2.75e-002 | AE172: 80.36 | AF172: 82.22 | AG172: 0.71 | AH172: A+ | AI172: 7.5999999999999998e-002 | AJ172: =H172+100*O172 -> 125.05600000000001 | AK172: 125.5 | AL172: 84 | AM172: 43.2 | AN172: 204 | AO172: 5.0000000000000001e-003 | AP172: 8 | AQ172: 天壕转债
A173: 302 | B173: 113525 | C173: 台华转债! | D173: 603055 | E173: 台华新材 | F173: 服装纺织 | G173: 纺织行业 | H173: 110.29 | I173: -5.0000000000000001e-003 | J173: 1.6e-002 | K173: 6.97 | L173: 2.7999999999999997e-002 | M173: 114.3 | N173: 7.78 | O173: 0.23100000000000001 | P173: 89.59 | Q173: 转股中 | R173: 3.46年 | S173: 1.46年 | T173: 4.69 | U173: 11 | V173: 2.1000000000000001e-002 | W173: 8.1000000000000003e-002 | X173: 7.2999999999999995e-002 | Y173: 58 | Z173: 1.91 | AA173: 1.06e-002 | AB173: 3.0999999999999999e-003 | AC173: -4.2699999999999995e-002 | AD173: -4.58e-002 | AE173: 96.11 | AF173: 99.23 | AG173: 0.39 | AH173: AA | AI173: 4.2599999999999999e-002 | AJ173: =H173+100*O173 -> 133.39000000000001 | AK173: 131 | AL173: 153 | AM173: 31.8 | AN173: 80 | AO173: 0.105 | AP173: 19 | AQ173: 台华转债!
A174: 352 | B174: 110038 | C174: 济川转债! | D174: 600566 | E174: 济川药业 | F174: 医药 | G174: 中药 | H174: 106 | I174: -8.0000000000000004e-004 | J174: -1.e-004 | K174: 18.15 | L174: -1.1399999999999999e-002 | M174: 107.5 | N174: 23.4 | O174: 0.36700000000000005 | P174: 77.56 | Q174: 转股中 | R174: 1.37年 | S174: 回售内 | T174: 6.28 | U174: 7.1 | V174: 1.1000000000000001e-002 | W174: 3.9e-002 | X174: 2.9999999999999999e-002 | Y174: 161 | Z174: 1.99 | AA174: 1.04e-002 | AB174: 0. | AC174: 回售内 | AD174: 回售内 | AE174: 100.25 | AF174: 101.84 | AG174: 0.07 | AH174: AA | AI174: 4.0800000000000003e-002 | AJ174: =H174+100*O174 -> 142.69999999999999 | AK174: 134.4 | AL174: 197 | AM174: 32.6 | AN174: 92 | AO174: 1.3999999999999999e-002 | AP174: 23 | AQ174: 济川转债!
A175: 235 | B175: 110062 | C175: 烽火转债! | D175: 600498 | E175: 烽火通信 | F175: 通信互联 | G175: 通信设备 | H175: 105.96 | I175: -1.1999999999999999e-003 | J175: -5.8999999999999999e-003 | K175: 17.62 | L175: -2.4399999999999998e-002 | M175: 110.8 | N175: 22.93 | O175: 0.379 | P175: 76.84 | Q175: 转股中 | R175: 4.42年 | S175: 2.42年 | T175: 30.9 | U175: 5.9 | V175: 2.e-003 | W175: 0.155 | X175: 0.11900000000000001 | Y175: 199 | Z175: 1.85 | AA175: 1.04e-002 | AB175: 5.7999999999999996e-003 | AC175: -9.8999999999999991e-003 | AD175: -1.23e-002 | AE175: 93.98 | AF175: 94.45 | AG175: 0.29 | AH175: AAA | AI175: 3.7599999999999995e-002 | AJ175: =H175+100*O175 -> 143.85999999999999 | AK175: 135.1 | AL175: 203 | AM175: 40.6 | AN175: 182 | AO175: -5.0000000000000003e-002 | AP175: 18 | AQ175: 烽火转债!
A176: 176 | B176: 127017 | C176: 万青转债 | D176: 789 | E176: 万年青 | F176: 建筑 | G176: 水泥 | H176: 112.235 | I176: -7.6e-003 | J176: 2.3e-003 | K176: 11.58 | L176: -1.3600000000000001e-002 | M176: 118 | N176: 13.46 | O176: 0.30499999999999999 | P176: 86.03 | Q176: 转股中 | R176: 4.92年 | S176: 2.92年 | T176: 10 | U176: 2.7 | V176: 2.e-003 | W176: 0.10800000000000001 | X176: 9.3000000000000013e-002 | Y176: 92 | Z176: 1.41 | AA176: 1.04e-002 | AB176: 3.9000000000000003e-003 | AC176: -2.6600000000000002e-002 | AD176: -2.86e-002 | AE176: 91.75 | AF176: 97.82 | AG176: 0.39 | AH176: AA+ | AI176: 3.9599999999999996e-002 | AJ176: =H176+100*O176 -> 142.73500000000001 | AK176: 138.4 | AL176: 234 | AM176: 40.6 | AN176: 181 | AO176: -2.7000000000000003e-002 | AP176: 9 | AQ176: 万青转债
A177: 165 | B177: 113588 | C177: 润达转债! | D177: 603108 | E177: 润达医疗 | F177: 医药 | G177: 医疗器械 | H177: 108.3 | I177: -1.5e-003 | J177: 4.5000000000000005e-003 | K177: 11.36 | L177: 7.0999999999999995e-003 | M177: 113.9 | N177: 13.36 | O177: 0.27399999999999997 | P177: 85.03 | Q177: 转股中 | R177: 4.96年 | S177: 2.96年 | T177: 5.5 | U177: 1.2 | V177: 2.e-003 | W177: 8.4000000000000005e-002 | X177: 7.0999999999999994e-002 | Y177: 66 | Z177: 2.07 | AA177: 1.04e-002 | AB177: 5.3e-003 | AC177: -1.4800000000000001e-002 | AD177: -1.6899999999999998e-002 | AE177: 90.86 | AF177: 92.98 | AG177: 0.43 | AH177: AA | AI177: 4.2599999999999999e-002 | AJ177: =H177+100*O177 -> 135.69999999999999 | AK177: 131.6 | AL177: 162 | AM177: 38.6 | AN177: 165 | AO177: 2.6000000000000002e-002 | AP177: 10 | AQ177: 润达转债!
A178: 2 | B178: 113625 | C178: 江山转债 | D178: 603208 | E178: 江山欧派 | F178: 其他 | G178: 家居用品 | H178: 116.81 | I178: 1.2999999999999999e-003 | J178: 2.5000000000000001e-003 | K178: 93.25 | L178: 6.1999999999999998e-003 | M178: 124 | N178: 97.55 | O178: 0.222 | P178: 95.59 | Q178: 5月19天 | R178: 5.94年 | S178: 3.94年 | T178: 5.83 | U178: 62 | V178: 9.1999999999999998e-002 | W178: 5.9999999999999998e-002 | X178: 5.7000000000000002e-002 | Y178: 98 | Z178: 5.83 | AA178: 1.03e-002 | AB178: 3.4999999999999996e-003 | AC178: -2.8300000000000002e-002 | AD178: -2.9999999999999999e-002 | AE178: 80.42 | AF178: 85.9 | AG178: 0.62 | AH178: AA- | AI178: 6.5000000000000002e-002 | AJ178: =H178+100*O178 -> 139.00999999999999 | AK178: 138 | AL178: 229 | AM178: 52.1 | AN178: 264 | AO178: -3.9e-002 | AP178: 1 | AQ178: 江山转债
A179: 202 | B179: 123045 | C179: 雷迪转债 | D179: 300652 | E179: 雷迪克 | F179: 汽车 | G179: 零部件制 | H179: 113.5 | I179: -3.4000000000000002e-003 | J179: 6.4000000000000003e-003 | K179: 18.49 | L179: 4.8999999999999998e-003 | M179: 118.9 | N179: 19.63 | O179: 0.20499999999999999 | P179: 94.19 | Q179: 转股中 | R179: 4.69年 | S179: 2.69年 | T179: 1.66 | U179: 9.2 | V179: 4.9000000000000002e-002 | W179: 9.6000000000000002e-002 | X179: 8.9999999999999997e-002 | Y179: 17 | Z179: 1.83 | AA179: 1.0200000000000001e-002 | AB179: 3.0999999999999999e-003 | AC179: -3.0200000000000001e-002 | AD179: -3.2799999999999996e-002 | AE179: 84.9 | AF179: 85.52 | AG179: 0.62 | AH179: A+ | AI179: 7.46e-002 | AJ179: =H179+100*O179 -> 134. | AK179: 132.8 | AL179: 180 | AM179: 47.3 | AN179: 237 | AO179: -5.5e-002 | AP179: 34 | AQ179: 雷迪转债
A180: 136 | B180: 128124 | C180: 科华转债! | D180: 2022 | E180: 科华生物 | F180: 医药 | G180: 生物制药 | H180: 104.92 | I180: -3.0999999999999999e-003 | J180: 5.4000000000000003e-003 | K180: 18.18 | L180: 5.0000000000000001e-003 | M180: 110.3 | N180: 21.51 | O180: 0.24100000000000002 | P180: 84.52 | Q180: 转股中 | R180: 5年25天 | S180: 3年26天 | T180: 7.38 | U180: 5.2 | V180: 6.9999999999999993e-003 | W180: 7.9000000000000001e-002 | X180: 6.7000000000000004e-002 | Y180: 94 | Z180: 2.81 | AA180: 1.01e-002 | AB180: 6.3e-003 | AC180: -5.6000000000000008e-003 | AD180: -7.4000000000000003e-003 | AE180: 89.76 | AF180: 89.02 | AG180: 0.46 | AH180: AA | AI180: 4.4000000000000004e-002 | AJ180: =H180+100*O180 -> 129.02000000000001 | AK180: 125.3 | AL180: 82 | AM180: 35.6 | AN180: 128 | AO180: 2.6000000000000002e-002 | AP180: 20 | AQ180: 科华转债!
A181: 150 | B181: 128121 | C181: 宏川转债! | D181: 2930 | E181: 宏川智慧 | F181: 交通运输 | G181: 物流业 | H181: 107.9 | I181: 0. | J181: 9.5999999999999992e-003 | K181: 16.2 | L181: 1.95e-002 | M181: 113.3 | N181: 20.24 | O181: 0.34799999999999998 | P181: 80.04 | Q181: 转股中 | R181: 5年14天 | S181: 3年15天 | T181: 6.7 | U181: 9.8 | V181: 1.3999999999999999e-002 | W181: 9.3000000000000013e-002 | X181: 7.400000000000001e-002 | Y181: 72 | Z181: 3.47 | AA181: 1.e-002 | AB181: 5.1000000000000004e-003 | AC181: -1.21e-002 | AD181: -1.44e-002 | AE181: 85.02 | AF181: 83.1 | AG181: 0.49 | AH181: AA- | AI181: 6.5000000000000002e-002 | AJ181: =H181+100*O181 -> 142.69999999999999 | AK181: 135.8 | AL181: 210 | AM181: 50.7 | AN181: 259 | AO181: 4.0000000000000001e-003 | AP181: 5 | AQ181: 宏川转债!
A182: 138 | B182: 123062 | C182: 三超转债 | D182: 300554 | E182: 三超新材 | F182: 机械装备 | G182: 通用设备 | H182: 114.006 | I182: -1.04e-002 | J182: 1.37e-002 | K182: 17.98 | L182: 4.5000000000000005e-003 | M182: 119.7 | N182: 17.13 | O182: 8.5999999999999993e-002 | P182: 104.96 | Q182: 转股中 | R182: 5年24天 | S182: 3年25天 | T182: 1.95 | U182: 36 | V182: 0.16300000000000001 | W182: 0.11599999999999999 | X182: 0.121 | Y182: 17 | Z182: 3.21 | AA182: 9.8999999999999991e-003 | AB182: 3.0999999999999999e-003 | AC182: -2.6499999999999999e-002 | AD182: -2.9100000000000001e-002 | AE182: 80.42 | AF182: 79.7 | AG182: 0.74 | AH182: A | AI182: 8.5999999999999993e-002 | AJ182: =H182+100*O182 -> 122.60599999999999 | AK182: 123 | AL182: 63 | AM182: 42.6 | AN182: 198 | AO182: 9.0000000000000011e-003 | AP182: 22 | AQ182: 三超转债
A183: 53 | B183: 127028 | C183: 英特转债! | D183: 411 | E183: 英特集团 | F183: 医药 | G183: 医药商业 | H183: 107.32 | I183: -7.7000000000000002e-003 | J183: -5.1999999999999998e-003 | K183: 13.17 | L183: -2.1499999999999998e-002 | M183: 113.1 | N183: 13.4 | O183: 9.1999999999999998e-002 | P183: 98.28 | Q183: 9天 | R183: 5.51年 | S183: 3.51年 | T183: 6 | U183: 13 | V183: 2.1000000000000001e-002 | W183: 0.183 | X183: 0.17999999999999999 | Y183: 33 | Z183: 1.93 | AA183: 9.7000000000000003e-003 | AB183: 5.4000000000000003e-003 | AC183: -9.5999999999999992e-003 | AD183: -1.15e-002 | AE183: 89.48 | AF183: 91.01 | AG183: 0.6 | AH183: AA+ | AI183: 4.0999999999999995e-002 | AJ183: =H183+100*O183 -> 116.52 | AK183: 116.4 | AL183: 15 | AM183: 25.3 | AN183: 29 | AO183: -2.8999999999999998e-002 | AP183: 20 | AQ183: 英特转债!
A184: 357 | B184: 113014 | C184: 林洋转债! | D184: 601222 | E184: 林洋能源 | F184: 能源电力 | G184: 电力设备 | H184: 107 | I184: -1.23e-002 | J184: 3.0000000000000001e-003 | K184: 7.92 | L184: -2.3399999999999997e-002 | M184: 109.3 | N184: 8.54 | O184: 0.154 | P184: 92.74 | Q184: 转股中 | R184: 2.32年 | S184: 0.32年 | T184: 30 | U184: 121 | V184: 3.7999999999999999e-002 | W184: 0.217 | X184: 0.20100000000000001 | Y184: 139 | Z184: 1.33 | AA184: 9.3999999999999986e-003 | AB184: 1.8e-003 | AC184: -0.10800000000000001 | AD184: -0.115 | AE184: 99.85 | AF184: 99.79 | AG184: 0.4 | AH184: AA | AI184: 4.0800000000000003e-002 | AJ184: =H184+100*O184 -> 122.40000000000001 | AK184: 121.3 | AL184: 53 | AM184: 21.4 | AN184: 14 | AO184: 5.7000000000000002e-002 | AP184: 31 | AQ184: 林洋转债!
A185: 105 | B185: 128135 | C185: 洽洽转债! | D185: 2557 | E185: 洽洽食品 | F185: 食品饮料 | G185: 休闲食品 | H185: 114.888 | I185: -1.e-004 | J185: -5.8999999999999999e-003 | K185: 44.52 | L185: -2.2000000000000002e-002 | M185: 120.2 | N185: 60.03 | O185: 0.54899999999999993 | P185: 74.16 | Q185: 转股中 | R185: 5.30年 | S185: 3.30年 | T185: 13.4 | U185: 7.9 | V185: 5.0000000000000001e-003 | W185: 5.9000000000000004e-002 | X185: 4.4000000000000004e-002 | Y185: 226 | Z185: 5.28 | AA185: 8.6999999999999994e-003 | AB185: 2.0999999999999999e-003 | AC185: -2.9399999999999999e-002 | AD185: -3.1300000000000001e-002 | AE185: 89.45 | AF185: 96.1 | AG185: 0.27 | AH185: AA | AI185: 4.4000000000000004e-002 | AJ185: =H185+100*O185 -> 169.78800000000001 | AK185: 155.6 | AL185: 304 | AM185: 59.5 | AN185: 296 | AO185: -4.2000000000000003e-002 | AP185: 11 | AQ185: 洽洽转债!
A186: 20 | B186: 123109 | C186: 昌红转债 | D186: 300151 | E186: 昌红科技 | F186: 机械装备 | G186: 专用设备 | H186: 115.2 | I186: -8.6e-003 | J186: -2.3099999999999999e-002 | K186: 25.86 | L186: -5.2400000000000002e-002 | M186: 121 | N186: 28.06 | O186: 0.25 | P186: 92.16 | Q186: 3月8天 | R186: 5.75年 | S186: 3.75年 | T186: 4.6 | U186: 7.6 | V186: 1.3999999999999999e-002 | W186: 3.5000000000000003e-002 | X186: 3.3000000000000002e-002 | Y186: 130 | Z186: 12.15 | AA186: 8.6999999999999994e-003 | AB186: 2.3999999999999998e-003 | AC186: -2.6200000000000001e-002 | AD186: -2.7999999999999997e-002 | AE186: 81.41 | AF186: 84.87 | AG186: 0.61 | AH186: AA- | AI186: 6.5000000000000002e-002 | AJ186: =H186+100*O186 -> 140.19999999999999 | AK186: 138.2 | AL186: 232 | AM186: 53.4 | AN186: 267 | AO186: -9.6999999999999989e-002 | AP186: 3 | AQ186: 昌红转债
A187: 309 | B187: 128048 | C187: 张行转债 | D187: 2839 | E187: 张家港行 | F187: 金融 | G187: 银行行业 | H187: 110.2 | I187: -6.3e-003 | J187: 6.3e-003 | K187: 5.45 | L187: 0. | M187: 113.3 | N187: 5.76 | O187: 0.16500000000000001 | P187: 94.62 | Q187: 转股中 | R187: 3.36年 | S187: 无权 | T187: 25 | U187: 4.6 | V187: 2.e-003 | W187: 0.253 | X187: 0.23999999999999999 | Y187: 99 | Z187: 0.88 | AA187: 8.5000000000000006e-003 | AB187: 1.1999999999999999e-003 | AC187: 无权 | AD187: 无权 | AE187: 无权 | AF187: 99.7 | AG187: 0.45 | AH187: AA+ | AI187: 3.9599999999999996e-002 | AJ187: =H187+100*O187 -> 126.7 | AK187: 125.8 | AL187: 91 | AM187: 26.1 | AN187: 34 | AO187: -1.6e-002 | AP187: 12 | AQ187: 张行转债
A188: 273 | B188: 113026 | C188: 核能转债! | D188: 601985 | E188: 中国核电 | F188: 能源电力 | G188: 核电 | H188: 105.9 | I188: -4.0000000000000001e-003 | J188: 1.e-004 | K188: 5.04 | L188: -9.7999999999999997e-003 | M188: 109.3 | N188: 5.86 | O188: 0.23100000000000001 | P188: 86.01 | Q188: 转股中 | R188: 3.78年 | S188: 1.79年 | T188: 78 | U188: 16 | V188: 2.e-003 | W188: 8.900000000000001e-002 | X188: 7.5999999999999998e-002 | Y188: 880 | Z188: 1.42 | AA188: 8.5000000000000006e-003 | AB188: 3.9000000000000003e-003 | AC188: -1.52e-002 | AD188: -1.7899999999999999e-002 | AE188: 95.7 | AF188: 95.3 | AG188: 0.39 | AH188: AAA | AI188: 3.7599999999999995e-002 | AJ188: =H188+100*O188 -> 129. | AK188: 125.8 | AL188: 92 | AM188: 30.1 | AN188: 63 | AO188: -6.0000000000000001e-003 | AP188: 43 | AQ188: 核能转债!
A189: 206 | B189: 110067 | C189: 华安转债! | D189: 600909 | E189: 华安证券 | F189: 金融 | G189: 证券行业 | H189: 106.33 | I189: -6.3e-003 | J189: -1.5e-003 | K189: 5.32 | L189: -1.8500000000000003e-002 | M189: 110.3 | N189: 6.22 | O189: 0.24299999999999999 | P189: 85.53 | Q189: 转股中 | R189: 4.69年 | S189: 无权 | T189: 28 | U189: 18 | V189: 6.0000000000000001e-003 | W189: 0.11199999999999999 | X189: 9.6000000000000002e-002 | Y189: 250 | Z189: 1.35 | AA189: 7.9000000000000008e-003 | AB189: 3.8e-003 | AC189: 无权 | AD189: 无权 | AE189: 无权 | AF189: 92.97 | AG189: 0.42 | AH189: AAA | AI189: 3.7599999999999995e-002 | AJ189: =H189+100*O189 -> 130.63 | AK189: 127.1 | AL189: 110 | AM189: 34.2 | AN189: 113 | AO189: -8.3000000000000004e-002 | AP189: 26 | AQ189: 华安转债!
A190: 70 | B190: 113043 | C190: 财通转债! | D190: 601108 | E190: 财通证券 | F190: 金融 | G190: 证券行业 | H190: 105.62 | I190: -5.3e-003 | J190: 5.0000000000000001e-004 | K190: 10.06 | L190: -1.2800000000000001e-002 | M190: 110.2 | N190: 13.13 | O190: 0.379 | P190: 76.62 | Q190: 转股中 | R190: 5.44年 | S190: 无权 | T190: 38 | U190: 26 | V190: 6.0000000000000001e-003 | W190: 0.105 | X190: 8.1000000000000003e-002 | Y190: 361 | Z190: 1.58 | AA190: 7.9000000000000008e-003 | AB190: 4.4000000000000003e-003 | AC190: 无权 | AD190: 无权 | AE190: 无权 | AF190: 89.77 | AG190: 0.37 | AH190: AAA | AI190: 3.9e-002 | AJ190: =H190+100*O190 -> 143.52000000000001 | AK190: 134.6 | AL190: 199 | AM190: 44.9 | AN190: 215 | AO190: -4.9000000000000002e-002 | AP190: 10 | AQ190: 财通转债!
A191: 33 | B191: 123104 | C191: 卫宁转债 | D191: 300253 | E191: 卫宁健康 | F191: 计算机及 | G191: 软件开发 | H191: 119.8 | I191: -1.9199999999999998e-002 | J191: 1.2e-002 | K191: 16.7 | L191: -1.5300000000000001e-002 | M191: 125.1 | N191: 17.74 | O191: 0.27300000000000002 | P191: 94.14 | Q191: 2月22天 | R191: 5.70年 | S191: 3.70年 | T191: 9.7 | U191: 9.9 | V191: 8.0000000000000002e-003 | W191: 2.7000000000000003e-002 | X191: 2.6000000000000002e-002 | Y191: 358 | Z191: 7.83 | AA191: 7.7000000000000002e-003 | AB191: 4.0000000000000002e-004 | AC191: -3.7100000000000001e-002 | AD191: -3.8800000000000001e-002 | AE191: 87.82 | AF191: 98.26 | AG191: 0.47 | AH191: AA | AI191: 4.4000000000000004e-002 | AJ191: =H191+100*O191 -> 147.09999999999999 | AK191: 145.5 | AL191: 271 | AM191: 47.2 | AN191: 235 | AO191: 6.9000000000000006e-002 | AP191: 4 | AQ191: 卫宁转债
A192: 58 | B192: 123089 | C192: 九洲转2! | D192: 300040 | E192: 九洲集团 | F192: 能源电力 | G192: 电力设备 | H192: 116.169 | I192: 1.1899999999999999e-002 | J192: 6.8000000000000005e-003 | K192: 9.09 | L192: 2.6000000000000002e-002 | M192: 121 | N192: 8 | O192: 2.2000000000000002e-002 | P192: 113.62 | Q192: 转股中 | R192: 5.47年 | S192: 3.47年 | T192: 5 | U192: 48 | V192: 8.199999999999999e-002 | W192: 0.14400000000000002 | X192: 0.16399999999999998 | Y192: 35 | Z192: 1.55 | AA192: 7.6e-003 | AB192: 1.e-003 | AC192: -3.04e-002 | AD192: -3.2400000000000005e-002 | AE192: 82.84 | AF192: 86.37 | AG192: 0.72 | AH192: AA- | AI192: 6.5000000000000002e-002 | AJ192: =H192+100*O192 -> 118.369 | AK192: 118.7 | AL192: 31 | AM192: 32.3 | AN192: 88 | AO192: -5.5999999999999994e-002 | AP192: 20 | AQ192: 九洲转2!
A193: 187 | B193: 110070 | C193: 凌钢转债! | D193: 600231 | E193: 凌钢股份 | F193: 钢铁 | G193: 炼钢 | H193: 113.82 | I193: -1.66e-002 | J193: 4.7999999999999996e-003 | K193: 2.77 | L193: -2.12e-002 | M193: 117.4 | N193: 2.75 | O193: 0.13 | P193: 100.73 | Q193: 转股中 | R193: 4.78年 | S193: 2.78年 | T193: 2.17 | U193: 6.4 | V193: 2.6000000000000002e-002 | W193: 2.7999999999999997e-002 | X193: 2.7999999999999997e-002 | Y193: 78 | Z193: 0.91 | AA193: 6.6e-003 | AB193: 2.0000000000000001e-004 | AC193: -3.1200000000000002e-002 | AD193: -3.3599999999999998e-002 | AE193: 91.84 | AF193: 96.58 | AG193: 0.56 | AH193: AA | AI193: 4.2599999999999999e-002 | AJ193: =H193+100*O193 -> 126.81999999999999 | AK193: 126.9 | AL193: 106 | AM193: 30.3 | AN193: 67 | AO193: -3.4000000000000002e-002 | AP193: 22 | AQ193: 凌钢转债!
A194: 147 | B194: 127020 | C194: 中金转债 | D194: 60 | E194: 中金岭南 | F194: 有色金属 | G194: 有色行业 | H194: 110.095 | I194: 3.3e-003 | J194: -2.0999999999999999e-003 | K194: 4.43 | L194: 2.3e-003 | M194: 113.7 | N194: 4.63 | O194: 0.151 | P194: 95.68 | Q194: 转股中 | R194: 5年17天 | S194: 3年18天 | T194: 38 | U194: 10 | V194: 2.e-003 | W194: 0.23999999999999999 | X194: 0.23000000000000001 | Y194: 158 | Z194: 1.32 | AA194: 6.5000000000000006e-003 | AB194: 1.6000000000000001e-003 | AC194: -2.23e-002 | AD194: -2.3700000000000002e-002 | AE194: 90.11 | AF194: 93.1 | AG194: 0.53 | AH194: AA+ | AI194: 4.0999999999999995e-002 | AJ194: =H194+100*O194 -> 125.19499999999999 | AK194: 124.5 | AL194: 75 | AM194: 31.4 | AN194: 76 | AO194: -3.3000000000000002e-002 | AP194: 14 | AQ194: 中金转债
A195: 140 | B195: 110073 | C195: 国投转债 | D195: 600061 | E195: 国投资本 | F195: 金融 | G195: 证券行业 | H195: 106.98 | I195: -4.0000000000000001e-003 | J195: -6.8000000000000005e-003 | K195: 8.02 | L195: -2.7900000000000001e-002 | M195: 110.5 | N195: 9.9 | O195: 0.32100000000000001 | P195: 81.01 | Q195: 转股中 | R195: 5年21天 | S195: 无权 | T195: 80 | U195: 35 | V195: 4.0000000000000001e-003 | W195: 0.155 | X195: 0.126 | Y195: 515 | Z195: 0.78 | AA195: 6.5000000000000006e-003 | AB195: 2.5999999999999999e-003 | AC195: 无权 | AD195: 无权 | AE195: 无权 | AF195: 91.3 | AG195: 0.39 | AH195: AAA | AI195: 3.9e-002 | AJ195: =H195+100*O195 -> 139.08000000000001 | AK195: 132.9 | AL195: 183 | AM195: 41.6 | AN195: 187 | AO195: -0.27399999999999997 | AP195: 23 | AQ195: 国投转债
A196: 26 | B196: 127031 | C196: 洋丰转债! | D196: 902 | E196: 新洋丰 | F196: 化工 | G196: 农化 | H196: 113 | I196: -1.46e-002 | J196: -2.5999999999999999e-003 | K196: 14.52 | L196: -5.4699999999999999e-002 | M196: 117.1 | N196: 19.94 | O196: 0.55200000000000005 | P196: 72.82 | Q196: 3月8天 | R196: 5.73年 | S196: 3.73年 | T196: 10 | U196: 6.2 | V196: 5.0000000000000001e-003 | W196: 5.2999999999999999e-002 | X196: 3.7999999999999999e-002 | Y196: 189 | Z196: 2.61 | AA196: 6.3e-003 | AB196: 1.1000000000000001e-003 | AC196: -2.2200000000000001e-002 | AD196: -2.3900000000000001e-002 | AE196: 87.73 | AF196: 91.91 | AG196: 0.31 | AH196: AA | AI196: 4.4000000000000004e-002 | AJ196: =H196+100*O196 -> 168.19999999999999 | AK196: 153.2 | AL196: 301 | AM196: 61.3 | AN196: 300 | AO196: -4.7e-002 | AP196: 2 | AQ196: 洋丰转债!
A197: 89 | B197: 127025 | C197: 冀东转债 | D197: 401 | E197: 冀东水泥 | F197: 建筑 | G197: 水泥 | H197: 106.66 | I197: 1.2999999999999999e-003 | J197: -5.6000000000000008e-003 | K197: 12.4 | L197: -1.04e-002 | M197: 110.1 | N197: 15.28 | O197: 0.314 | P197: 81.15 | Q197: 转股中 | R197: 5.34年 | S197: 3.35年 | T197: 17.8 | U197: 12 | V197: 6.0000000000000001e-003 | W197: 0.10099999999999999 | X197: 8.199999999999999e-002 | Y197: 175 | Z197: 1.18 | AA197: 6.0000000000000001e-003 | AB197: 2.5000000000000001e-003 | AC197: -1.04e-002 | AD197: -1.1899999999999999e-002 | AE197: 90 | AF197: 90.03 | AG197: 0.41 | AH197: AAA | AI197: 3.9e-002 | AJ197: =H197+100*O197 -> 138.06 | AK197: 132.2 | AL197: 173 | AM197: 42.1 | AN197: 194 | AO197: -2.4e-002 | AP197: 9 | AQ197: 冀东转债
A198: 120 | B198: 128130 | C198: 景兴转债 | D198: 2067 | E198: 景兴纸业 | F198: 造纸包装 | G198: 包装用纸 | H198: 111.971 | I198: -3.8e-003 | J198: 5.6000000000000008e-003 | K198: 3.67 | L198: 2.7000000000000001e-003 | M198: 115.1 | N198: 3.4 | O198: 3.7000000000000005e-002 | P198: 107.94 | Q198: 转股中 | R198: 5年59天 | S198: 3.16年 | T198: 10.7 | U198: 7.6 | V198: 6.0000000000000001e-003 | W198: 0.251 | X198: 0.27100000000000002 | Y198: 42 | Z198: 0.87 | AA198: 5.5000000000000005e-003 | AB198: 2.0000000000000001e-004 | AC198: -2.3199999999999998e-002 | AD198: -2.53e-002 | AE198: 89.89 | AF198: 92.57 | AG198: 0.65 | AH198: AA | AI198: 4.4000000000000004e-002 | AJ198: =H198+100*O198 -> 115.67100000000001 | AK198: 116 | AL198: 14 | AM198: 23.4 | AN198: 23 | AO198: -4.5999999999999999e-002 | AP198: 15 | AQ198: 景兴转债
A199: 351 | B199: 123002 | C199: 国祯转债!! | D199: 300388 | E199: 节能国祯 | F199: 城市公用 | G199: 三废处理 | H199: 107.498 | I199: -7.4000000000000003e-003 | J199: 5.0000000000000001e-003 | K199: 7.48 | L199: -6.6e-003 | M199: 108.8 | N199: 8.48 | O199: 0.21899999999999997 | P199: 88.21 | Q199: 转股中 | R199: 2.40年 | S199: 0.40年 | T199: 2.52 | U199: 1.9 | V199: 6.9999999999999993e-003 | W199: 4.8000000000000001e-002 | X199: 4.2999999999999997e-002 | Y199: 52 | Z199: 1.42 | AA199: 5.1000000000000004e-003 | AB199: -1.8e-003 | AC199: -0.105 | AD199: -0.11 | AE199: 99.29 | AF199: 99.01 | AG199: 0.36 | AH199: AA | AI199: 4.0800000000000003e-002 | AJ199: =H199+100*O199 -> 129.398 | AK199: 126.8 | AL199: 101 | AM199: 27.5 | AN199: 46 | AO199: -5.0999999999999997e-002 | AP199: 15 | AQ199: 国祯转债!!
A200: 141 | B200: 128122 | C200: 兴森转债! | D200: 2436 | E200: 兴森科技 | F200: 电子 | G200: 元器件制 | H200: 111.1 | I200: -1.6799999999999999e-002 | J200: 1.2199999999999999e-002 | K200: 10.25 | L200: -2.0099999999999996e-002 | M200: 113.3 | N200: 14.1 | O200: 0.52800000000000002 | P200: 72.7 | Q200: 转股中 | R200: 4年20天 | S200: 3年21天 | T200: 2.69 | U200: 6.8 | V200: 2.3e-002 | W200: 1.8000000000000002e-002 | X200: 1.3000000000000001e-002 | Y200: 153 | Z200: 4.75 | AA200: 4.8999999999999998e-003 | AB200: -1.e-003 | AC200: -2.1499999999999998e-002 | AD200: -2.3599999999999999e-002 | AE200: 90.72 | AF200: 95.89 | AG200: 0.23 | AH200: AA | AI200: 4.2599999999999999e-002 | AJ200: =H200+100*O200 -> 163.90000000000001 | AK200: 149.5 | AL200: 291 | AM200: 53.6 | AN200: 268 | AO200: -2.e-002 | AP200: 13 | AQ200: 兴森转债!
A201: 28 | B201: 128145 | C201: 日丰转债 | D201: 2953 | E201: 日丰股份 | F201: 家电 | G201: 零部件制 | H201: 112.25 | I201: -1.54e-002 | J201: -6.7000000000000002e-003 | K201: 14.22 | L201: -3.0699999999999998e-002 | M201: 115.4 | N201: 13.66 | O201: 7.8e-002 | P201: 104.1 | Q201: 2月27天 | R201: 5.72年 | S201: 3.72年 | T201: 3.8 | U201: 2.9 | V201: 6.9999999999999993e-003 | W201: 0.11 | X201: 0.114 | Y201: 35 | Z201: 2.31 | AA201: 4.8999999999999998e-003 | AB201: 1.e-004 | AC201: -2.0199999999999999e-002 | AD201: -2.2000000000000002e-002 | AE201: 81.39 | AF201: 81.07 | AG201: 0.72 | AH201: AA- | AI201: 6.5000000000000002e-002 | AJ201: =H201+100*O201 -> 120.05 | AK201: 120.4 | AL201: 48 | AM201: 39 | AN201: 166 | AO201: -2.9999999999999999e-002 | AP201: 6 | AQ201: 日丰转债
A202: 219 | B202: 128094 | C202: 星帅转债 | D202: 2860 | E202: 星帅尔 | F202: 家电 | G202: 零部件制 | H202: 118.6 | I202: -1.e-003 | J202: 4.5999999999999999e-003 | K202: 16.28 | L202: 4.8999999999999998e-003 | M202: 121 | N202: 13.8 | O202: 5.0000000000000001e-003 | P202: 117.97 | Q202: 转股中 | R202: 4.54年 | S202: 2.54年 | T202: 2.54 | U202: 26 | V202: 8.5999999999999993e-002 | W202: 7.8e-002 | X202: 9.1999999999999998e-002 | Y202: 32 | Z202: 3.18 | AA202: 4.5000000000000005e-003 | AB202: -3.4000000000000002e-003 | AC202: -4.7599999999999996e-002 | AD202: -5.0300000000000004e-002 | AE202: 85.85 | AF202: 87.97 | AG202: 0.74 | AH202: A+ | AI202: 7.46e-002 | AJ202: =H202+100*O202 -> 119.09999999999999 | AK202: 119.2 | AL202: 39 | AM202: 31.3 | AN202: 75 | AO202: -2.e-002 | AP202: 29 | AQ202: 星帅转债
A203: 227 | B203: 123038 | C203: 联得转债! | D203: 300545 | E203: 联得装备 | F203: 机械装备 | G203: 专用设备 | H203: 116.4 | I203: 6.0999999999999995e-003 | J203: -1.e-004 | K203: 23.08 | L203: 9.5999999999999992e-003 | M203: 118.6 | N203: 24.07 | O203: 0.214 | P203: 95.89 | Q203: 转股中 | R203: 4.48年 | S203: 2.48年 | T203: 1.47 | U203: 23 | V203: 0.13200000000000001 | W203: 3.6000000000000004e-002 | X203: 3.4000000000000002e-002 | Y203: 41 | Z203: 4.24 | AA203: 4.3e-003 | AB203: -3.0000000000000001e-003 | AC203: -4.2599999999999999e-002 | AD203: -4.5199999999999997e-002 | AE203: 86.02 | AF203: 86.57 | AG203: 0.62 | AH203: A+ | AI203: 7.46e-002 | AJ203: =H203+100*O203 -> 137.80000000000001 | AK203: 136.9 | AL203: 218 | AM203: 50.3 | AN203: 258 | AO203: 3.1e-002 | AP203: 18 | AQ203: 联得转债!
A204: 295 | B204: 113528 | C204: 长城转债! | D204: 603897 | E204: 长城科技 | F204: 机械装备 | G204: 专用设备 | H204: 115.1 | I204: -3.2000000000000002e-003 | J204: 6.3e-003 | K204: 24.3 | L204: 5.0000000000000001e-003 | M204: 116.8 | N204: 23.35 | O204: 0.106 | P204: 104.07 | Q204: 转股中 | R204: 3.66年 | S204: 1.66年 | T204: 6.34 | U204: 13 | V204: 1.7000000000000001e-002 | W204: 0.14599999999999999 | X204: 0.152 | Y204: 43 | Z204: 2.21 | AA204: 4.0999999999999995e-003 | AB204: -4.0000000000000001e-003 | AC204: -5.8700000000000002e-002 | AD204: -6.1799999999999994e-002 | AE204: 92.23 | AF204: 93.65 | AG204: 0.61 | AH204: AA- | AI204: 6.3600000000000004e-002 | AJ204: =H204+100*O204 -> 125.69999999999999 | AK204: 126.1 | AL204: 95 | AM204: 32.5 | AN204: 91 | AO204: 0.10000000000000001 | AP204: 38 | AQ204: 长城转债!
A205: 221 | B205: 127015 | C205: 希望转债!! | D205: 876 | E205: 新 希 望 | F205: 农业 | G205: 畜牧业 | H205: 108 | I205: -2.0000000000000001e-004 | J205: -2.5000000000000001e-003 | K205: 14.28 | L205: -1.24e-002 | M205: 110 | N205: 19.75 | O205: 0.49399999999999999 | P205: 72.3 | Q205: 转股中 | R205: 4.50年 | S205: 2.51年 | T205: 9.5 | U205: 6.8 | V205: 6.9999999999999993e-003 | W205: 1.4999999999999999e-002 | X205: 1.1000000000000001e-002 | Y205: 643 | Z205: 1.73 | AA205: 4.0999999999999995e-003 | AB205: 0. | AC205: -1.89e-002 | AD205: -2.0799999999999999e-002 | AE205: 93.09 | AF205: 93.4 | AG205: 0.22 | AH205: AAA | AI205: 3.7599999999999995e-002 | AJ205: =H205+100*O205 -> 157.40000000000001 | AK205: 143.7 | AL205: 268 | AM205: 50.3 | AN205: 256 | AO205: -1.e-003 | AP205: 26 | AQ205: 希望转债!!
A206: 252 | B206: 128074 | C206: 游族转债!! | D206: 2174 | E206: 游族网络 | F206: 通信互联 | G206: 互联网 | H206: 117.918 | I206: 6.8999999999999999e-003 | J206: -6.8999999999999999e-003 | K206: 16.77 | L206: 4.7999999999999996e-003 | M206: 119.9 | N206: 16.97 | O206: 0.193 | P206: 98.82 | Q206: 转股中 | R206: 4.22年 | S206: 2.23年 | T206: 6.83 | U206: 39 | V206: 4.8000000000000001e-002 | W206: 4.4000000000000004e-002 | X206: 4.4000000000000004e-002 | Y206: 154 | Z206: 3 | AA206: 4.0000000000000001e-003 | AB206: -4.0999999999999995e-003 | AC206: -5.4000000000000006e-002 | AD206: -5.6500000000000002e-002 | AE206: 93.68 | AF206: 100.89 | AG206: 0 | AH206: AA | AI206: 4.2599999999999999e-002 | AJ206: =H206+100*O206 -> 137.21800000000002 | AK206: 137 | AL206: 220 | AM206: 36.1 | AN206: 136 | AO206: -2.9999999999999999e-002 | AP206: 26 | AQ206: 游族转债!!
A207: 172 | B207: 123052 | C207: 飞鹿转债 | D207: 300665 | E207: 飞鹿股份 | F207: 化工 | G207: 化工 | H207: 124.379 | I207: -1.83e-002 | J207: 1.24e-002 | K207: 8.52 | L207: -8.1000000000000013e-003 | M207: 126.8 | N207: 7.05 | O207: 2.8999999999999998e-002 | P207: 120.85 | Q207: 转股中 | R207: 4.92年 | S207: 2.93年 | T207: 1.51 | U207: 83 | V207: 0.435 | W207: 0.10300000000000001 | X207: 0.124 | Y207: 15 | Z207: 2.22 | AA207: 4.0000000000000001e-003 | AB207: -4.8999999999999998e-003 | AC207: -5.4699999999999999e-002 | AD207: -5.7300000000000004e-002 | AE207: 84.05 | AF207: 89.75 | AG207: 0.72 | AH207: A+ | AI207: 7.46e-002 | AJ207: =H207+100*O207 -> 127.27900000000001 | AK207: 127.9 | AL207: 119 | AM207: 38.2 | AN207: 157 | AO207: -3.2000000000000001e-002 | AP207: 16 | AQ207: 飞鹿转债
A208: 15 | B208: 127032 | C208: 苏行转债 | D208: 2966 | E208: 苏州银行 | F208: 金融 | G208: 银行行业 | H208: 112.61 | I208: 5.0000000000000001e-004 | J208: -5.0000000000000001e-004 | K208: 7.39 | L208: 0. | M208: 115.1 | N208: 8.1 | O208: 0.23399999999999999 | P208: 91.23 | Q208: 3月18天 | R208: 5.78年 | S208: 无权 | T208: 50 | U208: 35 | V208: 6.0000000000000001e-003 | W208: 0.20300000000000001 | X208: 0.185 | Y208: 246 | Z208: 0.8 | AA208: 3.9000000000000003e-003 | AB208: -8.0000000000000004e-004 | AC208: 无权 | AD208: 无权 | AE208: 无权 | AF208: 92.61 | AG208: 0.51 | AH208: AAA | AI208: 3.9e-002 | AJ208: =H208+100*O208 -> 136.00999999999999 | AK208: 134 | AL208: 193 | AM208: 41.4 | AN208: 185 | AO208: -4.7e-002 | AP208: 7 | AQ208: 苏行转债
A209: 236 | B209: 128081 | C209: 海亮转债! | D209: 2203 | E209: 海亮股份 | F209: 有色金属 | G209: 铜金属 | H209: 113.25 | I209: 1.1999999999999999e-003 | J209: 3.7000000000000002e-003 | K209: 10.59 | L209: 7.6e-003 | M209: 114.9 | N209: 9.69 | O209: 3.6000000000000004e-002 | P209: 109.29 | Q209: 转股中 | R209: 4.39年 | S209: 2.39年 | T209: 30.1 | U209: 44 | V209: 1.3000000000000001e-002 | W209: 0.14400000000000002 | X209: 0.158 | Y209: 208 | Z209: 2.19 | AA209: 3.4000000000000002e-003 | AB209: -2.7000000000000001e-003 | AC209: -3.5299999999999998e-002 | AD209: -3.78e-002 | AE209: 93.05 | AF209: 96.05 | AG209: 0.65 | AH209: AA | AI209: 4.2599999999999999e-002 | AJ209: =H209+100*O209 -> 116.84999999999999 | AK209: 117.2 | AL209: 17 | AM209: 21.2 | AN209: 12 | AO209: 3.4000000000000002e-002 | AP209: 51 | AQ209: 海亮转债!
A210: 188 | B210: 128106 | C210: 华统转债 | D210: 2840 | E210: 华统股份 | F210: 农业 | G210: 农产品加 | H210: 111.099 | I210: -8.9999999999999998e-004 | J210: -2.9999999999999997e-004 | K210: 8.96 | L210: -2.2000000000000001e-003 | M210: 112.9 | N210: 9.37 | O210: 0.16200000000000001 | P210: 95.62 | Q210: 转股中 | R210: 4.77年 | S210: 2.77年 | T210: 5.35 | U210: 2.6 | V210: 4.0000000000000001e-003 | W210: 0.13300000000000001 | X210: 0.128 | Y210: 40 | Z210: 2.28 | AA210: 3.4000000000000002e-003 | AB210: -1.5e-003 | AC210: -2.4300000000000002e-002 | AD210: -2.6499999999999999e-002 | AE210: 91.57 | AF210: 92.89 | AG210: 0.55 | AH210: AA | AI210: 4.2599999999999999e-002 | AJ210: =H210+100*O210 -> 127.29900000000001 | AK210: 126.6 | AL210: 99 | AM210: 33.7 | AN210: 110 | AO210: -4.4000000000000004e-002 | AP210: 8 | AQ210: 华统转债
A211: 308 | B211: 110047 | C211: 山鹰转债 | D211: 600567 | E211: 山鹰国际 | F211: 造纸包装 | G211: 包装用纸 | H211: 116.29 | I211: -5.6999999999999993e-003 | J211: -1.4000000000000002e-003 | K211: 3.38 | L211: -1.46e-002 | M211: 117.5 | N211: 3.34 | O211: 0.14899999999999999 | P211: 101.2 | Q211: 转股中 | R211: 3.39年 | S211: 1.39年 | T211: 22.5 | U211: 18 | V211: 6.9999999999999993e-003 | W211: 0.14400000000000002 | X211: 0.14599999999999999 | Y211: 156 | Z211: 1 | AA211: 3.0999999999999999e-003 | AB211: -5.8999999999999999e-003 | AC211: -7.6600000000000001e-002 | AD211: -7.980000000000001e-002 | AE211: 96.86 | AF211: 103.29 | AG211: 0.49 | AH211: AA+ | AI211: 3.9599999999999996e-002 | AJ211: =H211+100*O211 -> 131.19 | AK211: 131.4 | AL211: 160 | AM211: 28.1 | AN211: 50 | AO211: -4.0999999999999995e-002 | AP211: 30 | AQ211: 山鹰转债
A212: 249 | B212: 128078 | C212: 太极转债! | D212: 2368 | E212: 太极股份 | F212: 计算机及 | G212: 软件开发 | H212: 115.5 | I212: -1.3000000000000001e-002 | J212: -1.21e-002 | K212: 20.41 | L212: -4.8899999999999999e-002 | M212: 116.9 | N212: 22.4 | O212: 0.26800000000000002 | P212: 91.12 | Q212: 转股中 | R212: 4.30年 | S212: 2.30年 | T212: 9.6 | U212: 48 | V212: 4.2999999999999997e-002 | W212: 8.1000000000000003e-002 | X212: 7.400000000000001e-002 | Y212: 118 | Z212: 3.53 | AA212: 2.8999999999999998e-003 | AB212: -4.0999999999999995e-003 | AC212: -4.4199999999999996e-002 | AD212: -4.6699999999999998e-002 | AE212: 93.38 | AF212: 98.06 | AG212: 0.51 | AH212: AA | AI212: 4.2599999999999999e-002 | AJ212: =H212+100*O212 -> 142.30000000000001 | AK212: 139.9 | AL212: 247 | AM212: 41.8 | AN212: 190 | AO212: -3.7999999999999999e-002 | AP212: 10 | AQ212: 太极转债!
A213: 284 | B213: 127012 | C213: 招路转债! | D213: 1965 | E213: 招商公路 | F213: 机场高速 | G213: 高速 | H213: 106.88 | I213: -2.0000000000000001e-004 | J213: 2.5999999999999999e-003 | K213: 7.23 | L213: 6.9999999999999993e-003 | M213: 107.9 | N213: 8.63 | O213: 0.27600000000000002 | P213: 83.78 | Q213: 转股中 | R213: 3.72年 | S213: 1.72年 | T213: 50 | U213: 7.7 | V213: 1.e-003 | W213: 0.11199999999999999 | X213: 9.4e-002 | Y213: 447 | Z213: 0.89 | AA213: 2.5999999999999999e-003 | AB213: -1.4000000000000002e-003 | AC213: -2.63e-002 | AD213: -2.7999999999999997e-002 | AE213: 94.84 | AF213: 94.22 | AG213: 0.35 | AH213: AAA | AI213: 3.7599999999999995e-002 | AJ213: =H213+100*O213 -> 134.47999999999999 | AK213: 130 | AL213: 140 | AM213: 35.1 | AN213: 124 | AO213: -5.5999999999999994e-002 | AP213: 30 | AQ213: 招路转债!
A214: 112 | B214: 113603 | C214: 东缆转债! | D214: 603606 | E214: 东方电缆 | F214: 能源电力 | G214: 电力设备 | H214: 113.66 | I214: -3.0000000000000001e-003 | J214: 4.8999999999999998e-003 | K214: 19.83 | L214: 4.5999999999999999e-003 | M214: 115.1 | N214: 23.65 | O214: 0.35600000000000004 | P214: 83.85 | Q214: 转股中 | R214: 5.23年 | S214: 3.23年 | T214: 8 | U214: 5.5 | V214: 6.0000000000000001e-003 | W214: 6.2e-002 | X214: 5.2000000000000005e-002 | Y214: 130 | Z214: 3.88 | AA214: 2.5000000000000001e-003 | AB214: -2.7000000000000001e-003 | AC214: -2.7099999999999999e-002 | AD214: -2.9100000000000001e-002 | AE214: 89.63 | AF214: 92.3 | AG214: 0.43 | AH214: AA | AI214: 4.4000000000000004e-002 | AJ214: =H214+100*O214 -> 149.25999999999999 | AK214: 143.5 | AL214: 267 | AM214: 51.2 | AN214: 261 | AO214: -2.e-003 | AP214: 7 | AQ214: 东缆转债!
A215: 123 | B215: 113039 | C215: 嘉泽转债! | D215: 601619 | E215: 嘉泽新能 | F215: 能源电力 | G215: 风能 | H215: 112.11 | I215: 2.5999999999999999e-003 | J215: 1.e-003 | K215: 3.67 | L215: 5.5000000000000005e-003 | M215: 113.1 | N215: 3.46 | O215: 5.7000000000000002e-002 | P215: 106.07 | Q215: 转股中 | R215: 5年52天 | S215: 3年53天 | T215: 5.41 | U215: 112 | V215: 0.184 | W215: 6.3e-002 | X215: 6.6000000000000003e-002 | Y215: 86 | Z215: 2.13 | AA215: 1.7000000000000001e-003 | AB215: -2.8999999999999998e-003 | AC215: -2.3799999999999998e-002 | AD215: -2.58e-002 | AE215: 89.96 | AF215: 91.04 | AG215: 0.66 | AH215: AA | AI215: 4.4000000000000004e-002 | AJ215: =H215+100*O215 -> 117.81 | AK215: 118.2 | AL215: 26 | AM215: 27.1 | AN215: 43 | AO215: -2.4e-002 | AP215: 32 | AQ215: 嘉泽转债!
A216: 268 | B216: 113536 | C216: 三星转债 | D216: 603578 | E216: 三星新材 | F216: 家电 | G216: 零部件制 | H216: 113.94 | I216: -4.8999999999999998e-003 | J216: -5.0000000000000001e-003 | K216: 14.15 | L216: -1.7399999999999999e-002 | M216: 114.3 | N216: 13.76 | O216: 0.10800000000000001 | P216: 102.83 | Q216: 转股中 | R216: 3.91年 | S216: 1.91年 | T216: 1.49 | U216: 3.2 | V216: 1.9e-002 | W216: 8.199999999999999e-002 | X216: 8.4000000000000005e-002 | Y216: 18 | Z216: 1.74 | AA216: 8.0000000000000004e-004 | AB216: -5.6999999999999993e-003 | AC216: -4.8600000000000004e-002 | AD216: -5.0999999999999997e-002 | AE216: 94.32 | AF216: 97.38 | AG216: 0.57 | AH216: AA | AI216: 4.2599999999999999e-002 | AJ216: =H216+100*O216 -> 124.73999999999999 | AK216: 125 | AL216: 79 | AM216: 27.7 | AN216: 47 | AO216: -3.7999999999999999e-002 | AP216: 35 | AQ216: 三星转债
A217: 154 | B217: 128119 | C217: 龙大转债! | D217: 2726 | E217: 龙大肉食 | F217: 食品饮料 | G217: 肉制品 | H217: 119.811 | I217: -4.0999999999999995e-003 | J217: 6.5000000000000006e-003 | K217: 10.2 | L217: 3.9000000000000003e-003 | M217: 120.2 | N217: 9.38 | O217: 0.10199999999999999 | P217: 108.74 | Q217: 转股中 | R217: 5年10天 | S217: 3年11天 | T217: 9.46 | U217: 7.4 | V217: 6.9999999999999993e-003 | W217: 9.3000000000000013e-002 | X217: 0.10099999999999999 | Y217: 102 | Z217: 2.93 | AA217: 7.000000000000001e-004 | AB217: -6.1999999999999998e-003 | AC217: -4.4600000000000001e-002 | AD217: -4.6600000000000003e-002 | AE217: 90.5 | AF217: 97.22 | AG217: 0.63 | AH217: AA | AI217: 4.4000000000000004e-002 | AJ217: =H217+100*O217 -> 130.011 | AK217: 130.9 | AL217: 152 | AM217: 33.7 | AN217: 107 | AO217: -7.5999999999999998e-002 | AP217: 8 | AQ217: 龙大转债!
A218: 25 | B218: 113622 | C218: 杭叉转债! | D218: 603298 | E218: 杭叉集团 | F218: 机械装备 | G218: 通用设备 | H218: 112.08 | I218: -1.5100000000000001e-002 | J218: 3.3e-003 | K218: 17.32 | L218: -3.2899999999999999e-002 | M218: 112.5 | N218: 23.08 | O218: 0.49399999999999999 | P218: 75.04 | Q218: 3月8天 | R218: 5.73年 | S218: 3.73年 | T218: 11.5 | U218: 20 | V218: 1.6e-002 | W218: 7.6999999999999999e-002 | X218: 5.7999999999999996e-002 | Y218: 150 | Z218: 2.92 | AA218: 7.000000000000001e-004 | AB218: -3.3e-003 | AC218: -2.1600000000000001e-002 | AD218: -2.3e-002 | AE218: 88.16 | AF218: 89.68 | AG218: 0.36 | AH218: AA+ | AI218: 4.0999999999999995e-002 | AJ218: =H218+100*O218 -> 161.47999999999999 | AK218: 149.1 | AL218: 290 | AM218: 59.4 | AN218: 295 | AO218: -6.4000000000000001e-002 | AP218: 4 | AQ218: 杭叉转债!
A219: 100 | B219: 113605 | C219: 大参转债! | D219: 603233 | E219: 大参林 | F219: 医药 | G219: 医药商业 | H219: 114.9 | I219: -3.4999999999999996e-003 | J219: -1.9e-003 | K219: 50.68 | L219: -1.78e-002 | M219: 115.2 | N219: 69.09 | O219: 0.56600000000000006 | P219: 73.35 | Q219: 转股中 | R219: 5.30年 | S219: 3.31年 | T219: 14.1 | U219: 7.6 | V219: 5.0000000000000001e-003 | W219: 3.5000000000000003e-002 | X219: 2.6000000000000002e-002 | Y219: 401 | Z219: 6.24 | AA219: 5.0000000000000001e-004 | AB219: -4.5999999999999999e-003 | AC219: -2.9300000000000003e-002 | AD219: -3.1300000000000001e-002 | AE219: 89.43 | AF219: 92.09 | AG219: 0.3 | AH219: AA | AI219: 4.4000000000000004e-002 | AJ219: =H219+100*O219 -> 171.5 | AK219: 156.4 | AL219: 307 | AM219: 64.4 | AN219: 307 | AO219: -0.10800000000000001 | AP219: 7 | AQ219: 大参转债!
A220: 12 | B220: 123113 | C220: 仙乐转债 | D220: 300791 | E220: 仙乐健康 | F220: 食品饮料 | G220: 食品饮料 | H220: 118.152 | I220: -2.3e-002 | J220: 4.0000000000000002e-004 | K220: 50.66 | L220: -3.78e-002 | M220: 118.5 | N220: 56.92 | O220: 0.32799999999999996 | P220: 89 | Q220: 3月25天 | R220: 5.79年 | S220: 3.80年 | T220: 10.3 | U220: 15 | V220: 1.2e-002 | W220: 0.11199999999999999 | X220: 0.10000000000000001 | Y220: 91 | Z220: 2.71 | AA220: 5.0000000000000001e-004 | AB220: -5.0000000000000001e-003 | AC220: -3.2300000000000002e-002 | AD220: -3.4099999999999998e-002 | AE220: 81.1 | AF220: 82.85 | AG220: 0.6 | AH220: AA- | AI220: 6.5000000000000002e-002 | AJ220: =H220+100*O220 -> 150.952 | AK220: 147.3 | AL220: 280 | AM220: 64.4 | AN220: 308 | AO220: -8.0000000000000002e-002 | AP220: 2 | AQ220: 仙乐转债
A221: 103 | B221: 123072 | C221: 乐歌转债! | D221: 300729 | E221: 乐歌股份 | F221: 其他 | G221: 家居用品 | H221: 129.43 | I221: -3.9800000000000002e-002 | J221: 3.8100000000000002e-002 | K221: 24.29 | L221: -2.4500000000000001e-002 | M221: 129.6 | N221: 56.12 | O221: 1.99 | P221: 43.28 | Q221: 转股中 | R221: 5.30年 | S221: 3.30年 | T221: 1.42 | U221: 231 | V221: 1.23 | W221: 3.2000000000000001e-002 | X221: 1.3999999999999999e-002 | Y221: 44 | Z221: 3.29 | AA221: 2.9999999999999997e-004 | AB221: -8.6999999999999994e-003 | AC221: -5.4900000000000004e-002 | AD221: -5.8200000000000002e-002 | AE221: 83.09 | AF221: 89.01 | AG221: 0.07 | AH221: A+ | AI221: 7.5999999999999998e-002 | AJ221: =H221+100*O221 -> 328.43000000000001 | AK221: 215.6 | AL221: 349 | AM221: 126.6 | AN221: 350 | AO221: -3.5000000000000003e-002 | AP221: 8 | AQ221: 乐歌转债!
A222: 174 | B222: 128109 | C222: 楚江转债 | D222: 2171 | E222: 楚江新材 | F222: 有色金属 | G222: 铜金属 | H222: 115 | I222: -1.2800000000000001e-002 | J222: 1.2199999999999999e-002 | K222: 8.42 | L222: -1.1999999999999999e-003 | M222: 114.9 | N222: 8.63 | O222: 0.17899999999999999 | P222: 97.57 | Q222: 转股中 | R222: 4.92年 | S222: 2.92年 | T222: 18.3 | U222: 19 | V222: 9.0000000000000011e-003 | W222: 0.16300000000000001 | X222: 0.159 | Y222: 112 | Z222: 1.98 | AA222: -2.0000000000000001e-004 | AB222: -5.6000000000000008e-003 | AC222: -3.4099999999999998e-002 | AD222: -3.61e-002 | AE222: 90.99 | AF222: 93.93 | AG222: 0.55 | AH222: AA | AI222: 4.2599999999999999e-002 | AJ222: =H222+100*O222 -> 132.90000000000001 | AK222: 132.4 | AL222: 178 | AM222: 38.5 | AN222: 162 | AO222: -1.3000000000000001e-002 | AP222: 6 | AQ222: 楚江转债
A223: 24 | B223: 110079 | C223: 杭银转债 | D223: 600926 | E223: 杭州银行 | F223: 金融 | G223: 银行行业 | H223: 112.6 | I223: -2.3999999999999998e-003 | J223: -6.5000000000000006e-003 | K223: 14.33 | L223: -1.9199999999999998e-002 | M223: 112.4 | N223: 16.71 | O223: 0.313 | P223: 85.76 | Q223: 3月8天 | R223: 5.74年 | S223: 3.74年 | T223: 150 | U223: 241 | V223: 1.3999999999999999e-002 | W223: 0.17699999999999999 | X223: 0.151 | Y223: 850 | Z223: 1.29 | AA223: -2.9999999999999997e-004 | AB223: -4.1999999999999997e-003 | AC223: -2.29e-002 | AD223: -2.4300000000000002e-002 | AE223: 88.7 | AF223: 90.54 | AG223: 0.47 | AH223: AAA | AI223: 3.9e-002 | AJ223: =H223+100*O223 -> 143.90000000000001 | AK223: 139.4 | AL223: 241 | AM223: 48.9 | AN223: 250 | AO223: -5.5e-002 | AP223: 11 | AQ223: 杭银转债
A224: 297 | B224: 110051 | C224: 中天转债! | D224: 600522 | E224: 中天科技 | F224: 通信互联 | G224: 通信设备 | H224: 113.5 | I224: -2.5999999999999999e-003 | J224: 1.e-004 | K224: 9.75 | L224: -5.1000000000000004e-003 | M224: 113.3 | N224: 9.99 | O224: 0.16300000000000001 | P224: 97.6 | Q224: 转股中 | R224: 3.66年 | S224: 1.66年 | T224: 39.6 | U224: 18 | V224: 4.0000000000000001e-003 | W224: 0.13300000000000001 | X224: 0.129 | Y224: 299 | Z224: 1.28 | AA224: -5.0000000000000001e-004 | AB224: -7.0999999999999995e-003 | AC224: -5.3099999999999994e-002 | AD224: -5.5899999999999998e-002 | AE224: 95.81 | AF224: 98.55 | AG224: 0.51 | AH224: AA+ | AI224: 3.9599999999999996e-002 | AJ224: =H224+100*O224 -> 129.80000000000001 | AK224: 129.4 | AL224: 136 | AM224: 30.9 | AN224: 71 | AO224: -2.6000000000000002e-002 | AP224: 23 | AQ224: 中天转债!
A225: 353 | B225: 113502 | C225: 嘉澳转债! | D225: 603822 | E225: 嘉澳环保 | F225: 化工 | G225: 化工 | H225: 111.56 | I225: -2.9999999999999997e-004 | J225: 4.0000000000000002e-004 | K225: 26.75 | L225: 9.1000000000000004e-003 | M225: 111.3 | N225: 44.64 | O225: 0.86199999999999999 | P225: 59.92 | Q225: 转股中 | R225: 2.36年 | S225: 0.36年 | T225: 1.85 | U225: 7.2 | V225: 3.5000000000000003e-002 | W225: 9.4e-002 | X225: 5.5999999999999994e-002 | Y225: 20 | Z225: 2.45 | AA225: -1.e-003 | AB225: -9.7999999999999997e-003 | AC225: -0.17699999999999999 | AD225: -0.183 | AE225: 98.66 | AF225: 96.88 | AG225: 0.01 | AH225: AA- | AI225: 6.1799999999999994e-002 | AJ225: =H225+100*O225 -> 197.75999999999999 | AK225: 163.2 | AL225: 322 | AM225: 64.5 | AN225: 309 | AO225: -3.1e-002 | AP225: 36 | AQ225: 嘉澳转债!
A226: 189 | B226: 123048 | C226: 应急转债! | D226: 300527 | E226: 中船应急 | F226: 机械装备 | G226: 专用设备 | H226: 113.51 | I226: -6.8999999999999999e-003 | J226: 1.2199999999999999e-002 | K226: 8.99 | L226: 9.0000000000000011e-003 | M226: 112.8 | N226: 8.9 | O226: 0.124 | P226: 101.01 | Q226: 转股中 | R226: 4.77年 | S226: 2.77年 | T226: 3.8 | U226: 187 | V226: 0.42200000000000004 | W226: 4.4000000000000004e-002 | X226: 4.4000000000000004e-002 | Y226: 87 | Z226: 3.25 | AA226: -1.2999999999999999e-003 | AB226: -6.1999999999999998e-003 | AC226: -3.1800000000000002e-002 | AD226: -3.3799999999999997e-002 | AE226: 92.24 | AF226: 94.05 | AG226: 0.59 | AH226: AA+ | AI226: 3.9599999999999996e-002 | AJ226: =H226+100*O226 -> 125.91000000000001 | AK226: 126 | AL226: 94 | AM226: 32 | AN226: 82 | AO226: -3.9e-002 | AP226: 16 | AQ226: 应急转债!
A227: 66 | B227: 123085 | C227: 万顺转2! | D227: 300057 | E227: 万顺新材 | F227: 有色金属 | G227: 铝金属 | H227: 114.5 | I227: 1.15e-002 | J227: 0. | K227: 6.27 | L227: 1.6200000000000003e-002 | M227: 113.3 | N227: 6.2 | O227: 0.13200000000000001 | P227: 101.13 | Q227: 转股中 | R227: 5.44年 | S227: 3.44年 | T227: 9 | U227: 42 | V227: 4.0999999999999995e-002 | W227: 0.21299999999999999 | X227: 0.215 | Y227: 42 | Z227: 1.19 | AA227: -2.e-003 | AB227: -6.4000000000000003e-003 | AC227: -2.7099999999999999e-002 | AD227: -2.8999999999999998e-002 | AE227: 82.89 | AF227: 81.02 | AG227: 0.71 | AH227: AA- | AI227: 6.5000000000000002e-002 | AJ227: =H227+100*O227 -> 127.7 | AK227: 127.9 | AL227: 118 | AM227: 45 | AN227: 217 | AO227: 0.12300000000000001 | AP227: 25 | AQ227: 万顺转2!
A228: 232 | B228: 110063 | C228: 鹰19转债 | D228: 600567 | E228: 山鹰国际 | F228: 造纸包装 | G228: 包装用纸 | H228: 116.99 | I228: -5.7999999999999996e-003 | J228: -2.3999999999999998e-003 | K228: 3.38 | L228: -1.46e-002 | M228: 115.9 | N228: 3.3 | O228: 0.14199999999999999 | P228: 102.42 | Q228: 转股中 | R228: 4.45年 | S228: 2.45年 | T228: 18.5 | U228: 4.3 | V228: 2.e-003 | W228: 0.11800000000000001 | X228: 0.121 | Y228: 156 | Z228: 1 | AA228: -2.0999999999999999e-003 | AB228: -8.5000000000000006e-003 | AC228: -4.7100000000000003e-002 | AD228: -4.9299999999999997e-002 | AE228: 93.35 | AF228: 97.84 | AG228: 0.56 | AH228: AA+ | AI228: 3.9599999999999996e-002 | AJ228: =H228+100*O228 -> 131.19 | AK228: 131.6 | AL228: 161 | AM228: 33.7 | AN228: 111 | AO228: -4.0999999999999995e-002 | AP228: 34 | AQ228: 鹰19转债
A229: 119 | B229: 123064 | C229: 万孚转债! | D229: 300482 | E229: 万孚生物 | F229: 医药 | G229: 医疗器械 | H229: 116.4 | I229: -5.1000000000000004e-003 | J229: -8.3999999999999995e-003 | K229: 61.82 | L229: -3.0099999999999998e-002 | M229: 115.1 | N229: 71.64 | O229: 0.34899999999999998 | P229: 86.29 | Q229: 转股中 | R229: 5.16年 | S229: 3.17年 | T229: 5.99 | U229: 2.1 | V229: 3.0000000000000001e-003 | W229: 2.2000000000000002e-002 | X229: 1.9e-002 | Y229: 275 | Z229: 7.28 | AA229: -2.2000000000000001e-003 | AB229: -7.4000000000000003e-003 | AC229: -3.4599999999999999e-002 | AD229: -3.6600000000000001e-002 | AE229: 89.87 | AF229: 92.55 | AG229: 0.45 | AH229: AA | AI229: 4.4000000000000004e-002 | AJ229: =H229+100*O229 -> 151.30000000000001 | AK229: 146.5 | AL229: 277 | AM229: 54 | AN229: 270 | AO229: -8.4000000000000005e-002 | AP229: 10 | AQ229: 万孚转债!
A230: 59 | B230: 123090 | C230: 三诺转债 | D230: 300298 | E230: 三诺生物 | F230: 医药 | G230: 医疗器械 | H230: 118.499 | I230: 0. | J230: 1.8e-003 | K230: 30.49 | L230: 4.0000000000000001e-003 | M230: 117.1 | N230: 35.15 | O230: 0.36599999999999999 | P230: 86.74 | Q230: 转股中 | R230: 5.47年 | S230: 3.47年 | T230: 5 | U230: 8 | V230: 1.3999999999999999e-002 | W230: 2.8999999999999998e-002 | X230: 2.5000000000000001e-002 | Y230: 172 | Z230: 6.46 | AA230: -2.2000000000000001e-003 | AB230: -7.7000000000000002e-003 | AC230: -3.6499999999999998e-002 | AD230: -3.8300000000000001e-002 | AE230: 88.71 | AF230: 92.93 | AG230: 0.45 | AH230: AA | AI230: 4.4000000000000004e-002 | AJ230: =H230+100*O230 -> 155.09899999999999 | AK230: 150.3 | AL230: 293 | AM230: 57.3 | AN230: 287 | AO230: 5.0000000000000001e-003 | AP230: 4 | AQ230: 三诺转债
A231: 95 | B231: 113607 | C231: 伟20转债! | D231: 603568 | E231: 伟明环保 | F231: 城市公用 | G231: 三废处理 | H231: 116.56 | I231: -6.3e-003 | J231: -5.8999999999999999e-003 | K231: 23.38 | L231: -1.89e-002 | M231: 115.1 | N231: 22.01 | O231: 9.6999999999999989e-002 | P231: 106.22 | Q231: 转股中 | R231: 5.33年 | S231: 3.34年 | T231: 12 | U231: 13 | V231: 1.e-002 | W231: 4.0999999999999995e-002 | X231: 4.2999999999999997e-002 | Y231: 294 | Z231: 5.26 | AA231: -2.3999999999999998e-003 | AB231: -7.4000000000000003e-003 | AC231: -3.3300000000000003e-002 | AD231: -3.5200000000000002e-002 | AE231: 89.22 | AF231: 91.88 | AG231: 0.65 | AH231: AA | AI231: 4.4000000000000004e-002 | AJ231: =H231+100*O231 -> 126.26000000000001 | AK231: 126.9 | AL231: 104 | AM231: 35 | AN231: 119 | AO231: 4.2000000000000003e-002 | AP231: 6 | AQ231: 伟20转债!
A232: 60 | B232: 128142 | C232: 新乳转债 | D232: 2946 | E232: 新乳业 | F232: 食品饮料 | G232: 乳制品 | H232: 116.799 | I232: -1.18e-002 | J232: -4.0999999999999995e-003 | K232: 14.71 | L232: -4.1100000000000005e-002 | M232: 115.1 | N232: 18.47 | O232: 0.46700000000000003 | P232: 79.64 | Q232: 转股中 | R232: 5.46年 | S232: 3.46年 | T232: 7.18 | U232: 7.3 | V232: 9.0000000000000011e-003 | W232: 5.5999999999999994e-002 | X232: 4.4999999999999998e-002 | Y232: 128 | Z232: 4.91 | AA232: -2.7000000000000001e-003 | AB232: -7.6e-003 | AC232: -3.27e-002 | AD232: -3.4599999999999999e-002 | AE232: 88.74 | AF232: 91.38 | AG232: 0.39 | AH232: AA | AI232: 4.4000000000000004e-002 | AJ232: =H232+100*O232 -> 163.49900000000002 | AK232: 154 | AL232: 303 | AM232: 62.6 | AN232: 304 | AO232: -8.5000000000000006e-002 | AP232: 4 | AQ232: 新乳转债
A233: 38 | B233: 113045 | C233: 环旭转债! | D233: 601231 | E233: 环旭电子 | F233: 电子 | G233: 电子产品 | H233: 113.73 | I233: -2.2499999999999999e-002 | J233: 1.9099999999999999e-002 | K233: 16.08 | L233: -8.6e-003 | M233: 112 | N233: 19.75 | O233: 0.39700000000000002 | P233: 81.42 | Q233: 5月11天 | R233: 5.67年 | S233: 2.67年 | T233: 34.5 | U233: 38 | V233: 1.e-002 | W233: 9.6999999999999989e-002 | X233: 7.9000000000000001e-002 | Y233: 355 | Z233: 2.87 | AA233: -2.7000000000000001e-003 | AB233: -6.6e-003 | AC233: -3.4700000000000002e-002 | AD233: -3.6600000000000001e-002 | AE233: 91.82 | AF233: 89.43 | AG233: 0.4 | AH233: AA+ | AI233: 4.0999999999999995e-002 | AJ233: =H233+100*O233 -> 153.43000000000001 | AK233: 146 | AL233: 275 | AM233: 54.2 | AN233: 271 | AO233: 0. | AP233: 4 | AQ233: 环旭转债!
A234: 222 | B234: 128093 | C234: 百川转债! | D234: 2455 | E234: 百川股份 | F234: 化工 | G234: 化工 | H234: 131.41 | I234: 2.4300000000000002e-002 | J234: 5.1000000000000004e-003 | K234: 7.56 | L234: 3.9900000000000005e-002 | M234: 129.8 | N234: 5.77 | O234: 3.0000000000000001e-003 | P234: 131.02 | Q234: 转股中 | R234: 4.50年 | S234: 2.51年 | T234: 3.7 | U234: 260 | V234: 0.53400000000000003 | W234: 9.4e-002 | X234: 0.12300000000000001 | Y234: 39 | Z234: 2.88 | AA234: -2.8000000000000004e-003 | AB234: -1.3500000000000002e-002 | AC234: -7.5600000000000001e-002 | AD234: -7.9899999999999999e-002 | AE234: 90.92 | AF234: 99.33 | AG234: 0.74 | AH234: AA- | AI234: 6.3600000000000004e-002 | AJ234: =H234+100*O234 -> 131.71000000000001 | AK234: 131.8 | AL234: 165 | AM234: 32.5 | AN234: 90 | AO234: 4.4000000000000004e-002 | AP234: 47 | AQ234: 百川转债!
A235: 204 | B235: 113572 | C235: 三祥转债! | D235: 603663 | E235: 三祥新材 | F235: 其他 | G235: 其他 | H235: 114.39 | I235: -1.9e-003 | J235: -6.8999999999999999e-003 | K235: 14.31 | L235: -1.24e-002 | M235: 112.8 | N235: 14.09 | O235: 0.126 | P235: 101.56 | Q235: 转股中 | R235: 4.69年 | S235: 2.69年 | T235: 1.69 | U235: 4.8 | V235: 2.5000000000000001e-002 | W235: 6.0999999999999999e-002 | X235: 6.2e-002 | Y235: 28 | Z235: 4.3 | AA235: -3.0000000000000001e-003 | AB235: -8.0000000000000002e-003 | AC235: -3.5299999999999998e-002 | AD235: -3.7400000000000003e-002 | AE235: 84.23 | AF235: 81.03 | AG235: 0.71 | AH235: A+ | AI235: 7.46e-002 | AJ235: =H235+100*O235 -> 126.98999999999999 | AK235: 127.2 | AL235: 111 | AM235: 43 | AN235: 201 | AO235: -4.2000000000000003e-002 | AP235: 19 | AQ235: 三祥转债!
A236: 85 | B236: 110077 | C236: 洪城转债 | D236: 600461 | E236: 洪城环境 | F236: 城市公用 | G236: 城市公用 | H236: 115.74 | I236: 1.5e-003 | J236: 6.3e-003 | K236: 7.34 | L236: 1.24e-002 | M236: 113.5 | N236: 7.13 | O236: 0.124 | P236: 102.95 | Q236: 转股中 | R236: 5.38年 | S236: 3.39年 | T236: 18 | U236: 3 | V236: 1.e-003 | W236: 0.25900000000000001 | X236: 0.26600000000000001 | Y236: 70 | Z236: 1.3 | AA236: -3.7000000000000002e-003 | AB236: -8.1000000000000013e-003 | AC236: -3.4500000000000003e-002 | AD236: -3.56e-002 | AE236: 88.73 | AF236: 91.67 | AG236: 0.63 | AH236: AA+ | AI236: 4.0999999999999995e-002 | AJ236: =H236+100*O236 -> 128.13999999999999 | AK236: 128.5 | AL236: 126 | AM236: 36.9 | AN236: 142 | AO236: -1.8000000000000002e-002 | AP236: 6 | AQ236: 洪城转债
A237: 42 | B237: 123099 | C237: 普利转债 | D237: 300630 | E237: 普利制药 | F237: 医药 | G237: 化学制药 | H237: 126.71 | I237: -8.5000000000000006e-003 | J237: -5.6999999999999993e-003 | K237: 50.34 | L237: -2.06e-002 | M237: 123.5 | N237: 46.22 | O237: 0.16300000000000001 | P237: 108.91 | Q237: 52天 | R237: 5.61年 | S237: 3.61年 | T237: 8.5 | U237: 2.8 | V237: 3.0000000000000001e-003 | W237: 3.9e-002 | X237: 4.2000000000000003e-002 | Y237: 220 | Z237: 10.08 | AA237: -4.5999999999999999e-003 | AB237: -1.1599999999999999e-002 | AC237: -5.1799999999999999e-002 | AD237: -5.3600000000000002e-002 | AE237: 82.07 | AF237: 87.36 | AG237: 0.69 | AH237: AA- | AI237: 6.5000000000000002e-002 | AJ237: =H237+100*O237 -> 143.00999999999999 | AK237: 144.5 | AL237: 270 | AM237: 57.1 | AN237: 285 | AO237: -2.1000000000000001e-002 | AP237: 4 | AQ237: 普利转债
A238: 3 | B238: 123116 | C238: 万兴转债 | D238: 300624 | E238: 万兴科技 | F238: 计算机及 | G238: 软件开发 | H238: 124.78 | I238: -2.8900000000000002e-002 | J238: 2.2200000000000001e-002 | K238: 55.7 | L238: -8.8999999999999999e-003 | M238: 121.4 | N238: 49.78 | O238: 0.115 | P238: 111.89 | Q238: 5月17天 | R238: 5.93年 | S238: 3.94年 | T238: 3.79 | U238: 431 | V238: 0.90500000000000003 | W238: 5.2000000000000005e-002 | X238: 5.9000000000000004e-002 | Y238: 72 | Z238: 8.14 | AA238: -4.6999999999999993e-003 | AB238: -1.0800000000000001e-002 | AC238: -4.3099999999999999e-002 | AD238: -4.4900000000000002e-002 | AE238: 77.47 | AF238: 79.32 | AG238: 0.76 | AH238: A+ | AI238: 7.5999999999999998e-002 | AJ238: =H238+100*O238 -> 136.28 | AK238: 137.7 | AL238: 224 | AM238: 58.3 | AN238: 293 | AO238: -9.6999999999999989e-002 | AP238: 2 | AQ238: 万兴转债
A239: 96 | B239: 113606 | C239: 荣泰转债 | D239: 603579 | E239: 荣泰健康 | F239: 机械装备 | G239: 专用设备 | H239: 124.42 | I239: -6.1999999999999998e-003 | J239: 4.0000000000000002e-004 | K239: 40.41 | L239: -7.6e-003 | M239: 121.2 | N239: 32.83 | O239: 1.1000000000000001e-002 | P239: 123.09 | Q239: 转股中 | R239: 5.33年 | S239: 3.33年 | T239: 6 | U239: 21 | V239: 2.7000000000000003e-002 | W239: 0.106 | X239: 0.13100000000000001 | Y239: 57 | Z239: 3.38 | AA239: -5.0000000000000001e-003 | AB239: -1.1699999999999999e-002 | AC239: -5.0199999999999995e-002 | AD239: -5.2300000000000006e-002 | AE239: 83.78 | AF239: 87.33 | AG239: 0.76 | AH239: AA- | AI239: 6.5000000000000002e-002 | AJ239: =H239+100*O239 -> 125.52 | AK239: 125.8 | AL239: 90 | AM239: 38.4 | AN239: 161 | AO239: 0.106 | AP239: 10 | AQ239: 荣泰转债
A240: 321 | B240: 110045 | C240: 海澜转债! | D240: 600398 | E240: 海澜之家 | F240: 服装纺织 | G240: 服装行业 | H240: 113.01 | I240: -4.3e-003 | J240: -1.66e-002 | K240: 6.94 | L240: -4.1399999999999999e-002 | M240: 111.1 | N240: 7.04 | O240: 0.14599999999999999 | P240: 98.58 | Q240: 转股中 | R240: 3年10天 | S240: 1年11天 | T240: 29.5 | U240: 52 | V240: 1.4999999999999999e-002 | W240: 9.8000000000000004e-002 | X240: 9.6999999999999989e-002 | Y240: 300 | Z240: 2.14 | AA240: -5.6999999999999993e-003 | AB240: -1.24e-002 | AC240: -8.2599999999999993e-002 | AD240: -8.5600000000000009e-002 | AE240: 97.43 | AF240: 98.97 | AG240: 0.51 | AH240: AA+ | AI240: 3.9599999999999996e-002 | AJ240: =H240+100*O240 -> 127.61 | AK240: 127.4 | AL240: 116 | AM240: 28.5 | AN240: 53 | AO240: -4.2999999999999997e-002 | AP240: 51 | AQ240: 海澜转债!
A241: 122 | B241: 113602 | C241: 景20转债! | D241: 603228 | E241: 景旺电子 | F241: 电子 | G241: 元器件制 | H241: 116.62 | I241: -8.5000000000000006e-003 | J241: 2.e-003 | K241: 25.7 | L241: -1.1899999999999999e-002 | M241: 113.3 | N241: 27.4 | O241: 0.24299999999999999 | P241: 93.8 | Q241: 转股中 | R241: 5年52天 | S241: 3年53天 | T241: 17.8 | U241: 4.8 | V241: 2.e-003 | W241: 8.1000000000000003e-002 | X241: 7.5999999999999998e-002 | Y241: 219 | Z241: 3.37 | AA241: -5.6999999999999993e-003 | AB241: -1.04e-002 | AC241: -3.49e-002 | AD241: -3.7000000000000005e-002 | AE241: 90.15 | AF241: 91.23 | AG241: 0.55 | AH241: AA | AI241: 4.4000000000000004e-002 | AJ241: =H241+100*O241 -> 140.92000000000002 | AK241: 139.4 | AL241: 242 | AM241: 48.2 | AN241: 244 | AO241: -2.e-003 | AP241: 10 | AQ241: 景20转债!
A242: 234 | B242: 128082 | C242: 华锋转债! | D242: 2806 | E242: 华锋股份 | F242: 电子 | G242: 元器件制 | H242: 124.5 | I242: 0.10199999999999999 | J242: -2.7999999999999997e-002 | K242: 10.7 | L242: 9.9700000000000011e-002 | M242: 121.4 | N242: 9.13 | O242: 6.2e-002 | P242: 117.2 | Q242: 转股中 | R242: 4.42年 | S242: 2.42年 | T242: 3.12 | U242: 1011. | V242: 2.6299999999999999 | W242: 0.16200000000000001 | X242: 0.19 | Y242: 19 | Z242: 1.94 | AA242: -5.7999999999999996e-003 | AB242: -1.3999999999999999e-002 | AC242: -6.6199999999999995e-002 | AD242: -6.9199999999999998e-002 | AE242: 84.91 | AF242: 85.61 | AG242: 0.74 | AH242: A | AI242: 8.4600000000000009e-002 | AJ242: =H242+100*O242 -> 130.69999999999999 | AK242: 131.8 | AL242: 166 | AM242: 46.2 | AN242: 229 | AO242: 6.3e-002 | AP242: 53 | AQ242: 华锋转债!
A243: 184 | B243: 113577 | C243: 春秋转债! | D243: 603890 | E243: 春秋电子 | F243: 电子 | G243: 电子产品 | H243: 121.18 | I243: -9.0000000000000011e-003 | J243: -1.9e-003 | K243: 12.7 | L243: -1.47e-002 | M243: 117.7 | N243: 10.86 | O243: 3.6000000000000004e-002 | P243: 116.94 | Q243: 转股中 | R243: 4.78年 | S243: 2.78年 | T243: 1.78 | U243: 7.3 | V243: 3.4000000000000002e-002 | W243: 3.6000000000000004e-002 | X243: 4.2000000000000003e-002 | Y243: 50 | Z243: 2.62 | AA243: -6.1999999999999998e-003 | AB243: -1.26e-002 | AC243: -5.21e-002 | AD243: -5.4299999999999994e-002 | AE243: 86.53 | AF243: 88.2 | AG243: 0.74 | AH243: AA- | AI243: 6.3600000000000004e-002 | AJ243: =H243+100*O243 -> 124.78 | AK243: 125.4 | AL243: 83 | AM243: 37.2 | AN243: 147 | AO243: -1.e-002 | AP243: 14 | AQ243: 春秋转债!
A244: 179 | B244: 113579 | C244: 健友转债! | D244: 603707 | E244: 健友股份 | F244: 医药 | G244: 原料药 | H244: 117.31 | I244: -2.12e-002 | J244: 1.2500000000000001e-002 | K244: 40.68 | L244: -1.5700000000000002e-002 | M244: 113.9 | N244: 42.01 | O244: 0.21100000000000002 | P244: 96.83 | Q244: 转股中 | R244: 4.81年 | S244: 2.81年 | T244: 5.03 | U244: 9.5 | V244: 1.6e-002 | W244: 1.3000000000000001e-002 | X244: 1.3000000000000001e-002 | Y244: 381 | Z244: 9.88 | AA244: -6.1999999999999998e-003 | AB244: -1.1399999999999999e-002 | AC244: -4.1799999999999997e-002 | AD244: -4.3899999999999995e-002 | AE244: 91.43 | AF244: 93.57 | AG244: 0.55 | AH244: AA | AI244: 4.2599999999999999e-002 | AJ244: =H244+100*O244 -> 138.41 | AK244: 137.8 | AL244: 226 | AM244: 44.2 | AN244: 210 | AO244: -2.9999999999999999e-002 | AP244: 9 | AQ244: 健友转债!
A245: 73 | B245: 113612 | C245: 永冠转债 | D245: 603681 | E245: 永冠新材 | F245: 化工 | G245: 其他 | H245: 125.5 | I245: -2.8999999999999998e-003 | J245: 3.5999999999999999e-003 | K245: 24.8 | L245: 8.0000000000000004e-004 | M245: 121.2 | N245: 20.59 | O245: 4.2000000000000003e-002 | P245: 120.45 | Q245: 转股中 | R245: 5.43年 | S245: 3.44年 | T245: 5.2 | U245: 17 | V245: 2.6000000000000002e-002 | W245: 0.126 | X245: 0.152 | Y245: 41 | Z245: 2.62 | AA245: -6.5000000000000006e-003 | AB245: -1.3100000000000001e-002 | AC245: -5.0999999999999997e-002 | AD245: -5.2999999999999999e-002 | AE245: 83.22 | AF245: 86.75 | AG245: 0.77 | AH245: AA- | AI245: 6.5000000000000002e-002 | AJ245: =H245+100*O245 -> 129.69999999999999 | AK245: 130.6 | AL245: 146 | AM245: 43.8 | AN245: 208 | AO245: -2.e-002 | AP245: 6 | AQ245: 永冠转债
A246: 290 | B246: 110053 | C246: 苏银转债! | D246: 600919 | E246: 江苏银行 | F246: 金融 | G246: 银行行业 | H246: 121.2 | I246: -8.8000000000000005e-003 | J246: -5.5000000000000005e-003 | K246: 7.11 | L246: -2.3399999999999997e-002 | M246: 118.3 | N246: 6.37 | O246: 8.5999999999999993e-002 | P246: 111.62 | Q246: 转股中 | R246: 3.70年 | S246: 无权 | T246: 200 | U246: 158 | V246: 6.0000000000000001e-003 | W246: 0.19 | X246: 0.21299999999999999 | Y246: 1050. | Z246: 0.75 | AA246: -6.7000000000000002e-003 | AB246: -1.5300000000000001e-002 | AC246: 无权 | AD246: 无权 | AE246: 无权 | AF246: 103.63 | AG246: 0.61 | AH246: AAA | AI246: 3.7599999999999995e-002 | AJ246: =H246+100*O246 -> 129.80000000000001 | AK246: 130.8 | AL246: 150 | AM246: 27.2 | AN246: 44 | AO246: -4.2999999999999997e-002 | AP246: 37 | AQ246: 苏银转债!
A247: 92 | B247: 128136 | C247: 立讯转债! | D247: 2475 | E247: 立讯精密 | F247: 电子 | G247: 元器件制 | H247: 116 | I247: -1.7000000000000001e-003 | J247: -1.3899999999999999e-002 | K247: 43.6 | L247: -4.8000000000000001e-002 | M247: 111.9 | N247: 58.36 | O247: 0.55299999999999994 | P247: 74.71 | Q247: 转股中 | R247: 5.34年 | S247: 3.34年 | T247: 30 | U247: 62 | V247: 1.8000000000000002e-002 | W247: 1.e-002 | X247: 6.9999999999999993e-003 | Y247: 3067. | Z247: 10.61 | AA247: -6.8000000000000005e-003 | AB247: -1.0800000000000001e-002 | AC247: -3.5000000000000003e-002 | AD247: -3.6299999999999999e-002 | AE247: 88.99 | AF247: 90.53 | AG247: 0.33 | AH247: AA+ | AI247: 4.0999999999999995e-002 | AJ247: =H247+100*O247 -> 171.30000000000001 | AK247: 157.3 | AL247: 311 | AM247: 66.8 | AN247: 310 | AO247: 3.7000000000000005e-002 | AP247: 13 | AQ247: 立讯转债!
A248: 292 | B248: 128057 | C248: 博彦转债 | D248: 2649 | E248: 博彦科技 | F248: 计算机及 | G248: 软件开发 | H248: 119.4 | I248: -3.7000000000000002e-003 | J248: 2.2000000000000001e-003 | K248: 10.02 | L248: -2.e-003 | M248: 116.3 | N248: 8.5 | O248: 1.3000000000000001e-002 | P248: 117.88 | Q248: 转股中 | R248: 3.67年 | S248: 1.67年 | T248: 5.04 | U248: 14 | V248: 2.3e-002 | W248: 9.5000000000000001e-002 | X248: 0.111 | Y248: 53 | Z248: 1.76 | AA248: -7.3000000000000001e-003 | AB248: -1.4999999999999999e-002 | AC248: -7.8700000000000006e-002 | AD248: -8.1300000000000011e-002 | AE248: 91.85 | AF248: 93.14 | AG248: 0.74 | AH248: AA- | AI248: 6.3600000000000004e-002 | AJ248: =H248+100*O248 -> 120.7 | AK248: 120.9 | AL248: 52 | AM248: 27.8 | AN248: 48 | AO248: -1.3999999999999999e-002 | AP248: 25 | AQ248: 博彦转债
A249: 281 | B249: 110057 | C249: 现代转债 | D249: 600420 | E249: 国药现代 | F249: 医药 | G249: 化学制药 | H249: 113.33 | I249: -4.7999999999999996e-003 | J249: -2.2000000000000001e-003 | K249: 10.02 | L249: -1.18e-002 | M249: 110.3 | N249: 9.79 | O249: 0.107 | P249: 102.35 | Q249: 转股中 | R249: 3.75年 | S249: 1.75年 | T249: 16.2 | U249: 16 | V249: 9.0000000000000011e-003 | W249: 0.157 | X249: 0.161 | Y249: 103 | Z249: 1.27 | AA249: -7.3000000000000001e-003 | AB249: -1.24e-002 | AC249: -5.0000000000000003e-002 | AD249: -5.2699999999999997e-002 | AE249: 95.84 | AF249: 96.31 | AG249: 0.6 | AH249: AAA | AI249: 3.7599999999999995e-002 | AJ249: =H249+100*O249 -> 124.03 | AK249: 124.3 | AL249: 73 | AM249: 28 | AN249: 49 | AO249: -1.1000000000000001e-002 | AP249: 23 | AQ249: 现代转债
A250: 82 | B250: 123078 | C250: 飞凯转债! | D250: 300398 | E250: 飞凯材料 | F250: 化工 | G250: 化工 | H250: 120.001 | I250: -1.89e-002 | J250: 8.3000000000000001e-003 | K250: 17.29 | L250: -1.54e-002 | M250: 115.2 | N250: 15.56 | O250: 8.0000000000000002e-002 | P250: 111.12 | Q250: 转股中 | R250: 5.40年 | S250: 3.41年 | T250: 8.16 | U250: 27 | V250: 2.7999999999999997e-002 | W250: 9.0999999999999998e-002 | X250: 0.10199999999999999 | Y250: 89 | Z250: 3.32 | AA250: -7.7000000000000002e-003 | AB250: -1.26e-002 | AC250: -4.0399999999999998e-002 | AD250: -4.2199999999999994e-002 | AE250: 89.05 | AF250: 91.7 | AG250: 0.69 | AH250: AA | AI250: 4.4000000000000004e-002 | AJ250: =H250+100*O250 -> 128.001 | AK250: 128.9 | AL250: 129 | AM250: 37.2 | AN250: 146 | AO250: -1.3000000000000001e-002 | AP250: 8 | AQ250: 飞凯转债!
A251: 335 | B251: 128035 | C251: 大族转债! | D251: 2008 | E251: 大族激光 | F251: 机械装备 | G251: 专用设备 | H251: 109.6 | I251: -1.2999999999999999e-003 | J251: 1.6000000000000001e-003 | K251: 38.92 | L251: 3.9000000000000003e-003 | M251: 107.4 | N251: 51.9 | O251: 0.46200000000000002 | P251: 74.99 | Q251: 转股中 | R251: 2.60年 | S251: 0.60年 | T251: 23 | U251: 8.4 | V251: 3.0000000000000001e-003 | W251: 5.5e-002 | X251: 4.2000000000000003e-002 | Y251: 415 | Z251: 4.32 | AA251: -7.9000000000000008e-003 | AB251: -1.32e-002 | AC251: -6.8600000000000008e-002 | AD251: -7.7399999999999997e-002 | AE251: 100.89 | AF251: 97.63 | AG251: 0.07 | AH251: AA+ | AI251: 3.78e-002 | AJ251: =H251+100*O251 -> 155.80000000000001 | AK251: 144.2 | AL251: 269 | AM251: 43.3 | AN251: 205 | AO251: 1.3999999999999999e-002 | AP251: 18 | AQ251: 大族转债!
A252: 57 | B252: 123091 | C252: 长海转债 | D252: 300196 | E252: 长海股份 | F252: 其他 | G252: 非金属矿 | H252: 121.56 | I252: 2.0000000000000001e-004 | J252: 1.e-003 | K252: 16.67 | L252: 1.8e-003 | M252: 116.2 | N252: 16.14 | O252: 0.17699999999999999 | P252: 103.28 | Q252: 转股中 | R252: 5.47年 | S252: 3.48年 | T252: 5.5 | U252: 4.8 | V252: 6.9999999999999993e-003 | W252: 8.1000000000000003e-002 | X252: 8.3000000000000004e-002 | Y252: 68 | Z252: 2.29 | AA252: -8.3999999999999995e-003 | AB252: -1.3500000000000002e-002 | AC252: -4.2999999999999997e-002 | AD252: -4.4800000000000006e-002 | AE252: 88.78 | AF252: 92.21 | AG252: 0.63 | AH252: AA | AI252: 4.4000000000000004e-002 | AJ252: =H252+100*O252 -> 139.25999999999999 | AK252: 139.8 | AL252: 246 | AM252: 47.6 | AN252: 241 | AO252: 6.9999999999999993e-003 | AP252: 3 | AQ252: 长海转债
A253: 224 | B253: 128091 | C253: 新天转债 | D253: 2873 | E253: 新天药业 | F253: 医药 | G253: 中药 | H253: 124 | I253: -1.5900000000000001e-002 | J253: -8.6e-003 | K253: 18.97 | L253: -3.2599999999999997e-002 | M253: 119.4 | N253: 16.39 | O253: 7.0999999999999994e-002 | P253: 115.74 | Q253: 转股中 | R253: 4.49年 | S253: 2.50年 | T253: 1.76 | U253: 122 | V253: 0.55299999999999994 | W253: 7.9000000000000001e-002 | X253: 9.1999999999999998e-002 | Y253: 22 | Z253: 2.73 | AA253: -8.6e-003 | AB253: -1.6e-002 | AC253: -6.3099999999999989e-002 | AD253: -6.6000000000000003e-002 | AE253: 86.5 | AF253: 87.18 | AG253: 0.75 | AH253: A+ | AI253: 7.46e-002 | AJ253: =H253+100*O253 -> 131.09999999999999 | AK253: 132.3 | AL253: 175 | AM253: 45.1 | AN253: 219 | AO253: 4.0000000000000001e-002 | AP253: 18 | AQ253: 新天转债
A254: 43 | B254: 123098 | C254: 一品转债 | D254: 300723 | E254: 一品红 | F254: 医药 | G254: 医药行业 | H254: 129.988 | I254: -1.9e-003 | J254: -7.4999999999999997e-003 | K254: 31.59 | L254: -1.2199999999999999e-002 | M254: 124 | N254: 25.45 | O254: 4.7e-002 | P254: 124.13 | Q254: 32天 | R254: 5.57年 | S254: 3.58年 | T254: 4.8 | U254: 42 | V254: 6.6000000000000003e-002 | W254: 5.2999999999999999e-002 | X254: 6.5000000000000002e-002 | Y254: 91 | Z254: 3.27 | AA254: -8.6e-003 | AB254: -1.5700000000000002e-002 | AC254: -5.8600000000000006e-002 | AD254: -6.0400000000000002e-002 | AE254: 82.3 | AF254: 87.91 | AG254: 0.76 | AH254: AA- | AI254: 6.5000000000000002e-002 | AJ254: =H254+100*O254 -> 134.68799999999999 | AK254: 135.9 | AL254: 211 | AM254: 47.9 | AN254: 242 | AO254: 0.16699999999999998 | AP254: 3 | AQ254: 一品转债
A255: 253 | B255: 128075 | C255: 远东转债! | D255: 2406 | E255: 远东传动 | F255: 汽车 | G255: 零部件制 | H255: 119.11 | I255: -7.3000000000000001e-003 | J255: -1.2999999999999999e-003 | K255: 6.51 | L255: -1.21e-002 | M255: 114.9 | N255: 5.54 | O255: 1.3999999999999999e-002 | P255: 117.51 | Q255: 转股中 | R255: 4.22年 | S255: 2.23年 | T255: 5.44 | U255: 20 | V255: 3.1e-002 | W255: 0.13400000000000001 | X255: 0.157 | Y255: 41 | Z255: 1.23 | AA255: -8.6999999999999994e-003 | AB255: -1.49e-002 | AC255: -5.7999999999999996e-002 | AD255: -6.0499999999999998e-002 | AE255: 93.68 | AF255: 96.7 | AG255: 0.71 | AH255: AA | AI255: 4.2599999999999999e-002 | AJ255: =H255+100*O255 -> 120.51000000000001 | AK255: 120.7 | AL255: 50 | AM255: 24 | AN255: 26 | AO255: 2.7000000000000003e-002 | AP255: 14 | AQ255: 远东转债!
A256: 71 | B256: 123083 | C256: 朗新转债 | D256: 300682 | E256: 朗新科技 | F256: 计算机及 | G256: 软件开发 | H256: 121 | I256: -2.18e-002 | J256: 7.6e-003 | K256: 16.3 | L256: -2.2200000000000001e-002 | M256: 115.1 | N256: 15.45 | O256: 0.14699999999999999 | P256: 105.5 | Q256: 转股中 | R256: 5.44年 | S256: 3.44年 | T256: 8 | U256: 5.6 | V256: 6.0000000000000001e-003 | W256: 4.8000000000000001e-002 | X256: 5.0999999999999997e-002 | Y256: 166 | Z256: 3.16 | AA256: -9.300000000000001e-003 | AB256: -1.4199999999999999e-002 | AC256: -4.2500000000000003e-002 | AD256: -4.4299999999999999e-002 | AE256: 88.83 | AF256: 91.48 | AG256: 0.64 | AH256: AA | AI256: 4.4000000000000004e-002 | AJ256: =H256+100*O256 -> 135.69999999999999 | AK256: 136.5 | AL256: 213 | AM256: 45 | AN256: 218 | AO256: -6.7000000000000004e-002 | AP256: 5 | AQ256: 朗新转债
A257: 277 | B257: 128064 | C257: 司尔转债! | D257: 2538 | E257: 司尔特 | F257: 化工 | G257: 农化 | H257: 118.939 | I257: -2.9999999999999997e-004 | J257: -8.0000000000000004e-004 | K257: 6.58 | L257: -1.5e-003 | M257: 114.3 | N257: 5.82 | O257: 5.2000000000000005e-002 | P257: 113.06 | Q257: 转股中 | R257: 3.76年 | S257: 1.77年 | T257: 7.92 | U257: 7 | V257: 6.9999999999999993e-003 | W257: 0.16800000000000001 | X257: 0.18899999999999997 | Y257: 47 | Z257: 1.18 | AA257: -1.0700000000000001e-002 | AB257: -1.7399999999999999e-002 | AC257: -7.3099999999999998e-002 | AD257: -7.5700000000000003e-002 | AE257: 94.89 | AF257: 97.97 | AG257: 0.67 | AH257: AA | AI257: 4.2599999999999999e-002 | AJ257: =H257+100*O257 -> 124.139 | AK257: 124.8 | AL257: 78 | AM257: 26.9 | AN257: 40 | AO257: -2.2000000000000002e-002 | AP257: 44 | AQ257: 司尔转债!
A258: 217 | B258: 128096 | C258: 奥瑞转债!! | D258: 2701 | E258: 奥瑞金 | F258: 造纸包装 | G258: 包装材料 | H258: 121.221 | I258: -6.4000000000000003e-003 | J258: 5.1000000000000004e-003 | K258: 5.08 | L258: -2.e-003 | M258: 115.5 | N258: 4.5 | O258: 7.400000000000001e-002 | P258: 112.89 | Q258: 转股中 | R258: 4.61年 | S258: 2.61年 | T258: 6.74 | U258: 3.4 | V258: 4.0000000000000001e-003 | W258: 5.5e-002 | X258: 6.2e-002 | Y258: 123 | Z258: 1.83 | AA258: -1.0700000000000001e-002 | AB258: -1.6500000000000001e-002 | AC258: -5.4699999999999999e-002 | AD258: -5.7200000000000001e-002 | AE258: 93.32 | AF258: 96.95 | AG258: 0.68 | AH258: AA+ | AI258: 3.9599999999999996e-002 | AJ258: =H258+100*O258 -> 128.62100000000001 | AK258: 129.6 | AL258: 138 | AM258: 32.6 | AN258: 93 | AO258: -9.0000000000000011e-003 | AP258: 18 | AQ258: 奥瑞转债!!
A259: 1 | B259: 113050 | C259: 南银转债 | D259: 601009 | E259: 南京银行 | F259: 金融 | G259: 银行行业 | H259: 118.63 | I259: -1.37e-002 | J259: 2.0999999999999999e-003 | K259: 10.78 | L259: -1.7299999999999999e-002 | M259: 111.2 | N259: 10.1 | O259: 0.111 | P259: 106.73 | Q259: 5月22天 | R259: 5.95年 | S259: 无权 | T259: 200 | U259: 2354. | V259: 9.9000000000000005e-002 | W259: 0.185 | X259: 0.19800000000000001 | Y259: 1079. | Z259: 1.07 | AA259: -1.09e-002 | AB259: -1.43e-002 | AC259: 无权 | AD259: 无权 | AE259: 无权 | AF259: 88.83 | AG259: 0.67 | AH259: AAA | AI259: 3.9e-002 | AJ259: =H259+100*O259 -> 129.72999999999999 | AK259: 130.5 | AL259: 145 | AM259: 41.7 | AN259: 188 | AO259: 4.0999999999999995e-002 | AP259: 3 | AQ259: 南银转债
A260: 291 | B260: 127011 | C260: 中鼎转2! | D260: 887 | E260: 中鼎股份 | F260: 汽车 | G260: 零部件制 | H260: 119.4 | I260: -1.6399999999999998e-002 | J260: 7.4999999999999997e-003 | K260: 11.3 | L260: -1.7399999999999999e-002 | M260: 114.5 | N260: 11.39 | O260: 0.20399999999999999 | P260: 99.21 | Q260: 转股中 | R260: 3.68年 | S260: 1.68年 | T260: 12 | U260: 42 | V260: 2.8999999999999998e-002 | W260: 8.6999999999999994e-002 | X260: 8.5999999999999993e-002 | Y260: 138 | Z260: 1.55 | AA260: -1.15e-002 | AB260: -1.8500000000000003e-002 | AC260: -7.8200000000000006e-002 | AD260: -8.0799999999999997e-002 | AE260: 95.76 | AF260: 99.52 | AG260: 0.51 | AH260: AA+ | AI260: 3.9599999999999996e-002 | AJ260: =H260+100*O260 -> 139.80000000000001 | AK260: 139.6 | AL260: 244 | AM260: 40.1 | AN260: 174 | AO260: -3.5000000000000003e-002 | AP260: 21 | AQ260: 中鼎转2!
A261: 104 | B261: 123070 | C261: 鹏辉转债 | D261: 300438 | E261: 鹏辉能源 | F261: 汽车 | G261: 零部件制 | H261: 122.64 | I261: 6.0999999999999995e-003 | J261: 2.3199999999999998e-002 | K261: 22.34 | L261: 4.2000000000000003e-002 | M261: 115.1 | N261: 20.06 | O261: 0.10099999999999999 | P261: 111.37 | Q261: 转股中 | R261: 5.30年 | S261: 3.30年 | T261: 8.9 | U261: 119 | V261: 0.107 | W261: 9.5000000000000001e-002 | X261: 0.106 | Y261: 94 | Z261: 3.97 | AA261: -1.21e-002 | AB261: -1.7100000000000001e-002 | AC261: -4.7899999999999998e-002 | AD261: -4.9699999999999994e-002 | AE261: 89.36 | AF261: 92.02 | AG261: 0.7 | AH261: AA | AI261: 4.4000000000000004e-002 | AJ261: =H261+100*O261 -> 132.74000000000001 | AK261: 133.9 | AL261: 191 | AM261: 41.9 | AN261: 191 | AO261: -8.0000000000000002e-003 | AP261: 5 | AQ261: 鹏辉转债
A262: 177 | B262: 128108 | C262: 蓝帆转债! | D262: 2382 | E262: 蓝帆医疗 | F262: 医药 | G262: 医疗器械 | H262: 119.853 | I262: -6.4000000000000003e-003 | J262: -3.4999999999999996e-003 | K262: 20.57 | L262: -1.44e-002 | M262: 112.9 | N262: 18.64 | O262: 8.5999999999999993e-002 | P262: 110.35 | Q262: 转股中 | R262: 4.90年 | S262: 3.90年 | T262: 15.3 | U262: 31 | V262: 1.7000000000000001e-002 | W262: 7.400000000000001e-002 | X262: 8.1000000000000003e-002 | Y262: 207 | Z262: 1.73 | AA262: -1.23e-002 | AB262: -1.7000000000000001e-002 | AC262: -3.1899999999999998e-002 | AD262: -3.4200000000000001e-002 | AE262: 89.02 | AF262: 92.38 | AG262: 0.68 | AH262: AA | AI262: 4.2599999999999999e-002 | AJ262: =H262+100*O262 -> 128.453 | AK262: 129.4 | AL262: 134 | AM262: 37 | AN262: 144 | AO262: 2.e-002 | AP262: 26 | AQ262: 蓝帆转债!
A263: 261 | B263: 113541 | C263: 荣晟转债! | D263: 603165 | E263: 荣晟环保 | F263: 造纸包装 | G263: 包装用纸 | H263: 120.87 | I263: -1.7399999999999999e-002 | J263: 3.8e-003 | K263: 12.81 | L263: -1.84e-002 | M263: 115 | N263: 10.84 | O263: 2.3e-002 | P263: 118.17 | Q263: 转股中 | R263: 4年20天 | S263: 2年21天 | T263: 1.63 | U263: 7 | V263: 3.5000000000000003e-002 | W263: 4.9000000000000002e-002 | X263: 5.7000000000000002e-002 | Y263: 34 | Z263: 1.92 | AA263: -1.2500000000000001e-002 | AB263: -1.9e-002 | AC263: -6.8199999999999997e-002 | AD263: -7.0900000000000005e-002 | AE263: 90.4 | AF263: 90.1 | AG263: 0.74 | AH263: AA- | AI263: 6.3600000000000004e-002 | AJ263: =H263+100*O263 -> 123.17 | AK263: 123.6 | AL263: 66 | AM263: 33.2 | AN263: 100 | AO263: -5.4000000000000006e-002 | AP263: 42 | AQ263: 荣晟转债!
A264: 336 | B264: 110043 | C264: 无锡转债! | D264: 600908 | E264: 无锡银行 | F264: 金融 | G264: 银行行业 | H264: 111.85 | I264: -1.1899999999999999e-002 | J264: 9.300000000000001e-003 | K264: 5.77 | L264: -5.1999999999999998e-003 | M264: 108.3 | N264: 5.79 | O264: 0.122 | P264: 99.65 | Q264: 转股中 | R264: 2.58年 | S264: 无权 | T264: 29.2 | U264: 82 | V264: 2.5000000000000001e-002 | W264: 0.27200000000000002 | X264: 0.27100000000000002 | Y264: 107 | Z264: 0.87 | AA264: -1.26e-002 | AB264: -1.8500000000000003e-002 | AC264: 无权 | AD264: 无权 | AE264: 无权 | AF264: 98.53 | AG264: 0.51 | AH264: AA+ | AI264: 3.78e-002 | AJ264: =H264+100*O264 -> 124.05 | AK264: 124 | AL264: 69 | AM264: 25.5 | AN264: 31 | AO264: -1.6e-002 | AP264: 23 | AQ264: 无锡转债!
A265: 201 | B265: 128101 | C265: 联创转债! | D265: 2036 | E265: 联创电子 | F265: 电子 | G265: 液晶显示 | H265: 121.8 | I265: -9.7999999999999997e-003 | J265: 9.7999999999999997e-003 | K265: 12.9 | L265: 0. | M265: 114.8 | N265: 13.72 | O265: 0.29499999999999998 | P265: 94.02 | Q265: 转股中 | R265: 4.70年 | S265: 2.70年 | T265: 3 | U265: 19 | V265: 5.0999999999999997e-002 | W265: 2.2000000000000002e-002 | X265: 2.1000000000000001e-002 | Y265: 137 | Z265: 3.72 | AA265: -1.2699999999999999e-002 | AB265: -1.8200000000000001e-002 | AC265: -5.6100000000000004e-002 | AD265: -5.8200000000000002e-002 | AE265: 91.73 | AF265: 94.7 | AG265: 0.51 | AH265: AA | AI265: 4.2599999999999999e-002 | AJ265: =H265+100*O265 -> 151.30000000000001 | AK265: 149.6 | AL265: 292 | AM265: 54.9 | AN265: 276 | AO265: 4.4999999999999998e-002 | AP265: 15 | AQ265: 联创转债!
A266: 91 | B266: 128137 | C266: 洁美转债 | D266: 2859 | E266: 洁美科技 | F266: 电子 | G266: 元器件制 | H266: 125.764 | I266: -5.7999999999999996e-003 | J266: 8.199999999999999e-003 | K266: 30.43 | L266: 3.3e-003 | M266: 117.3 | N266: 27.63 | O266: 0.14199999999999999 | P266: 110.13 | Q266: 转股中 | R266: 5.34年 | S266: 3.34年 | T266: 6 | U266: 6.1 | V266: 8.0000000000000002e-003 | W266: 4.8000000000000001e-002 | X266: 5.2999999999999999e-002 | Y266: 125 | Z266: 6.78 | AA266: -1.32e-002 | AB266: -1.8799999999999997e-002 | AC266: -5.3699999999999998e-002 | AD266: -5.5599999999999997e-002 | AE266: 83.42 | AF266: 84.39 | AG266: 0.73 | AH266: AA- | AI266: 6.5000000000000002e-002 | AJ266: =H266+100*O266 -> 139.964 | AK266: 141.4 | AL266: 255 | AM266: 57 | AN266: 284 | AO266: 2.3e-002 | AP266: 4 | AQ266: 洁美转债
A267: 62 | B267: 113614 | C267: 健20转债! | D267: 603707 | E267: 健友股份 | F267: 医药 | G267: 原料药 | H267: 123 | I267: -9.300000000000001e-003 | J267: -1.2999999999999999e-003 | K267: 40.68 | L267: -1.5700000000000002e-002 | M267: 114.2 | N267: 38 | O267: 0.14899999999999999 | P267: 107.05 | Q267: 转股中 | R267: 5.46年 | S267: 3.46年 | T267: 7.8 | U267: 14 | V267: 1.4999999999999999e-002 | W267: 2.e-002 | X267: 2.2000000000000002e-002 | Y267: 381 | Z267: 9.88 | AA267: -1.38e-002 | AB267: -1.83e-002 | AC267: -4.6300000000000001e-002 | AD267: -4.82e-002 | AE267: 88.84 | AF267: 90.7 | AG267: 0.67 | AH267: AA | AI267: 4.4000000000000004e-002 | AJ267: =H267+100*O267 -> 137.90000000000001 | AK267: 138.9 | AL267: 235 | AM267: 48.3 | AN267: 246 | AO267: -2.9999999999999999e-002 | AP267: 4 | AQ267: 健20转债!
A268: 367 | B268: 110034 | C268: 九州转债! | D268: 600998 | E268: 九州通 | F268: 医药 | G268: 医药商业 | H268: 108.82 | I268: -1.e-004 | J268: -2.9999999999999997e-004 | K268: 15.14 | L268: -1.7500000000000002e-002 | M268: 108 | N268: 17.83 | O268: 0.28199999999999997 | P268: 84.91 | Q268: 转股中 | R268: 0.54年 | S268: 回售内 | T268: 15 | U268: 15 | V268: 9.0000000000000011e-003 | W268: 5.2999999999999999e-002 | X268: 4.4999999999999998e-002 | Y268: 284 | Z268: 1.41 | AA268: -1.3899999999999999e-002 | AB268: -4.0800000000000003e-002 | AC268: 回售内 | AD268: 回售内 | AE268: 103 | AF268: 106.06 | AG268: 0.03 | AH268: AA+ | AI268: 3.4200000000000001e-002 | AJ268: =H268+100*O268 -> 137.01999999999998 | AK268: 132.7 | AL268: 179 | AM268: 26.7 | AN268: 38 | AO268: -4.8000000000000001e-002 | AP268: 24 | AQ268: 九州转债!
A269: 18 | B269: 113623 | C269: 凤21转债 | D269: 603225 | E269: 新凤鸣 | F269: 化工 | G269: 化纤 | H269: 127.36 | I269: -8.1000000000000013e-003 | J269: -1.3100000000000001e-002 | K269: 19.45 | L269: -2.8999999999999998e-002 | M269: 117.1 | N269: 16.47 | O269: 7.8e-002 | P269: 118.09 | Q269: 3月14天 | R269: 5.76年 | S269: 3.77年 | T269: 25 | U269: 8.8 | V269: 3.0000000000000001e-003 | W269: 9.1999999999999998e-002 | X269: 0.10800000000000001 | Y269: 273 | Z269: 2.23 | AA269: -1.47e-002 | AB269: -1.9799999999999998e-002 | AC269: -5.1500000000000004e-002 | AD269: -5.3099999999999994e-002 | AE269: 87.58 | AF269: 91.75 | AG269: 0.73 | AH269: AA | AI269: 4.4000000000000004e-002 | AJ269: =H269+100*O269 -> 135.16 | AK269: 136.6 | AL269: 214 | AM269: 44.9 | AN269: 216 | AO269: -1.8000000000000002e-002 | AP269: 3 | AQ269: 凤21转债
A270: 51 | B270: 113618 | C270: 美诺转债! | D270: 603538 | E270: 美诺华 | F270: 医药 | G270: 原料药 | H270: 126.59 | I270: -1.15e-002 | J270: -1.8700000000000001e-002 | K270: 44.04 | L270: -3.8800000000000001e-002 | M270: 115.3 | N270: 37.47 | O270: 7.6999999999999999e-002 | P270: 117.53 | Q270: 18天 | R270: 5.53年 | S270: 3.54年 | T270: 5.2 | U270: 41 | V270: 6.3e-002 | W270: 7.9000000000000001e-002 | X270: 9.3000000000000013e-002 | Y270: 66 | Z270: 4.15 | AA270: -1.7000000000000001e-002 | AB270: -2.18e-002 | AC270: -5.2600000000000001e-002 | AD270: -5.4400000000000004e-002 | AE270: 82.41 | AF270: 81.95 | AG270: 0.78 | AH270: AA- | AI270: 6.5000000000000002e-002 | AJ270: =H270+100*O270 -> 134.28999999999999 | AK270: 135.6 | AL270: 208 | AM270: 53.2 | AN270: 266 | AO270: -3.4000000000000002e-002 | AP270: 5 | AQ270: 美诺转债!
A271: 7 | B271: 123114 | C271: 三角转债 | D271: 300775 | E271: 三角防务 | F271: 航空航天 | G271: 航空航天 | H271: 134.189 | I271: -1.7899999999999999e-002 | J271: -2.1899999999999999e-002 | K271: 34.68 | L271: -5.5800000000000002e-002 | M271: 121 | N271: 31.82 | O271: 0.23100000000000001 | P271: 108.99 | Q271: 5月1天 | R271: 5.89年 | S271: 3.90年 | T271: 9.04 | U271: 29 | V271: 2.4e-002 | W271: 5.2999999999999999e-002 | X271: 5.7000000000000002e-002 | Y271: 172 | Z271: 8.59 | AA271: -1.77e-002 | AB271: -2.3599999999999999e-002 | AC271: -6.1500000000000006e-002 | AD271: -6.3099999999999989e-002 | AE271: 80.66 | AF271: 84.09 | AG271: 0.71 | AH271: AA- | AI271: 6.5000000000000002e-002 | AJ271: =H271+100*O271 -> 157.28899999999999 | AK271: 159.4 | AL271: 316 | AM271: 75.3 | AN271: 324 | AO271: -6.9000000000000006e-002 | AP271: 3 | AQ271: 三角转债
A272: 109 | B272: 110075 | C272: 南航转债 | D272: 600029 | E272: 南方航空 | F272: 交通运输 | G272: 航空运输 | H272: 121.88 | I272: 2.0999999999999999e-003 | J272: -7.8000000000000005e-003 | K272: 5.95 | L272: -1.e-002 | M272: 110 | N272: 6.24 | O272: 0.27800000000000002 | P272: 95.35 | Q272: 转股中 | R272: 5.28年 | S272: 3.29年 | T272: 59 | U272: 34 | V272: 5.0000000000000001e-003 | W272: 5.7999999999999996e-002 | X272: 5.5999999999999994e-002 | Y272: 1008. | Z272: 1.4 | AA272: -1.95e-002 | AB272: -2.2799999999999997e-002 | AC272: -4.9800000000000004e-002 | AD272: -5.0999999999999997e-002 | AE272: 89.67 | AF272: 90.1 | AG272: 0.56 | AH272: AAA | AI272: 3.9e-002 | AJ272: =H272+100*O272 -> 149.68000000000001 | AK272: 148.4 | AL272: 286 | AM272: 58.3 | AN272: 292 | AO272: -4.2000000000000003e-002 | AP272: 7 | AQ272: 南航转债
A273: 40 | B273: 118000 | C273: 嘉元转债 | D273: 688388 | E273: 嘉元科技 | F273: 电子 | G273: 电子产品 | H273: 135.29 | I273: 2.0799999999999999e-002 | J273: 6.3500000000000001e-002 | K273: 100.1 | L273: 0.10800000000000001 | M273: 121 | N273: 78.74 | O273: 6.4000000000000001e-002 | P273: 127.13 | Q273: 2月1天 | R273: 5.64年 | S273: 3.65年 | T273: 12.4 | U273: 187 | V273: 0.11 | W273: 5.4000000000000006e-002 | X273: 6.8000000000000005e-002 | Y273: 231 | Z273: 8.49 | AA273: -1.9900000000000001e-002 | AB273: -2.6099999999999998e-002 | AC273: -6.7400000000000002e-002 | AD273: -6.9099999999999995e-002 | AE273: 81.93 | AF273: 85.42 | AG273: 0.78 | AH273: AA- | AI273: 6.5000000000000002e-002 | AJ273: =H273+100*O273 -> 141.69 | AK273: 143.5 | AL273: 266 | AM273: 58 | AN273: 290 | AO273: 0.14199999999999999 | AP273: 4 | AQ273: 嘉元转债
A274: 239 | B274: 123035 | C274: 利德转债! | D274: 300296 | E274: 利亚德 | F274: 电子 | G274: LED制 | H274: 125.5 | I274: 4.0000000000000001e-003 | J274: -3.0999999999999999e-003 | K274: 7.91 | L274: 1.2999999999999999e-003 | M274: 115.1 | N274: 6.96 | O274: 0.10400000000000001 | P274: 113.65 | Q274: 转股中 | R274: 4.37年 | S274: 2.37年 | T274: 8 | U274: 21 | V274: 2.1000000000000001e-002 | W274: 4.0000000000000001e-002 | X274: 4.4999999999999998e-002 | Y274: 201 | Z274: 2.76 | AA274: -2.e-002 | AB274: -2.6000000000000002e-002 | AC274: -7.3599999999999999e-002 | AD274: -7.5999999999999998e-002 | AE274: 94 | AF274: 97.51 | AG274: 0.67 | AH274: AA+ | AI274: 3.9599999999999996e-002 | AJ274: =H274+100*O274 -> 135.90000000000001 | AK274: 137.4 | AL274: 222 | AM274: 39.8 | AN274: 172 | AO274: 3.1e-002 | AP274: 14 | AQ274: 利德转债!
A275: 358 | B275: 113013 | C275: 国君转债! | D275: 601211 | E275: 国泰君安 | F275: 金融 | G275: 证券行业 | H275: 112.96 | I275: -8.3000000000000001e-003 | J275: 2.e-003 | K275: 16.64 | L275: -2.18e-002 | M275: 108.3 | N275: 19.01 | O275: 0.28999999999999998 | P275: 87.53 | Q275: 转股中 | R275: 2年5.0天 | S275: 无权 | T275: 69.9 | U275: 60 | V275: 8.0000000000000002e-003 | W275: 4.7e-002 | X275: 4.0999999999999995e-002 | Y275: 1482. | Z275: 1.14 | AA275: -2.12e-002 | AB275: -2.87e-002 | AC275: 无权 | AD275: 无权 | AE275: 无权 | AF275: 101.06 | AG275: 0.29 | AH275: AAA | AI275: 3.5799999999999998e-002 | AJ275: =H275+100*O275 -> 141.95999999999998 | AK275: 138.4 | AL275: 233 | AM275: 37.3 | AN275: 148 | AO275: -2.6000000000000002e-002 | AP275: 12 | AQ275: 国君转债!
A276: 80 | B276: 123079 | C276: 运达转债 | D276: 300772 | E276: 运达股份 | F276: 能源电力 | G276: 风能 | H276: 129.2 | I276: -7.7000000000000002e-003 | J276: -1.1699999999999999e-002 | K276: 17.49 | L276: -2.6699999999999998e-002 | M276: 115.1 | N276: 15.12 | O276: 0.11699999999999999 | P276: 115.67 | Q276: 转股中 | R276: 5.41年 | S276: 3.42年 | T276: 5.77 | U276: 6.2 | V276: 8.0000000000000002e-003 | W276: 0.109 | X276: 0.126 | Y276: 53 | Z276: 3.04 | AA276: -2.1499999999999998e-002 | AB276: -2.63e-002 | AC276: -6.0199999999999997e-002 | AD276: -6.2e-002 | AE276: 88.91 | AF276: 91.57 | AG276: 0.73 | AH276: AA | AI276: 4.4000000000000004e-002 | AJ276: =H276+100*O276 -> 140.89999999999998 | AK276: 142.7 | AL276: 265 | AM276: 51.2 | AN276: 260 | AO276: 3.0000000000000001e-003 | AP276: 4 | AQ276: 运达转债
A277: 332 | B277: 127005 | C277: 长证转债! | D277: 783 | E277: 长江证券 | F277: 金融 | G277: 证券行业 | H277: 114.8 | I277: -1.03e-002 | J277: 3.4999999999999996e-003 | K277: 7.08 | L277: -1.3899999999999999e-002 | M277: 108.3 | N277: 7.28 | O277: 0.17999999999999999 | P277: 97.25 | Q277: 转股中 | R277: 2.69年 | S277: 无权 | T277: 50 | U277: 47 | V277: 8.0000000000000002e-003 | W277: 0.128 | X277: 0.124 | Y277: 392 | Z277: 1.36 | AA277: -2.18e-002 | AB277: -2.7400000000000001e-002 | AC277: 无权 | AD277: 无权 | AE277: 无权 | AF277: 98.67 | AG277: 0.49 | AH277: AAA | AI277: 3.5799999999999998e-002 | AJ277: =H277+100*O277 -> 132.80000000000001 | AK277: 132.3 | AL277: 177 | AM277: 33.7 | AN277: 108 | AO277: -3.7999999999999999e-002 | AP277: 13 | AQ277: 长证转债!
A278: 304 | B278: 128051 | C278: 光华转债! | D278: 2741 | E278: 光华科技 | F278: 电子 | G278: 元器件制 | H278: 123.698 | I278: -1.01e-002 | J278: 8.0000000000000004e-004 | K278: 15.76 | L278: -1.1899999999999999e-002 | M278: 114.8 | N278: 12.72 | O278: -2.e-003 | P278: 123.9 | Q278: 转股中 | R278: 3.45年 | S278: 1.45年 | T278: 2.21 | U278: 15 | V278: 5.4000000000000006e-002 | W278: 3.7000000000000005e-002 | X278: 4.5999999999999999e-002 | Y278: 59 | Z278: 4.77 | AA278: -2.1899999999999999e-002 | AB278: -2.9300000000000003e-002 | AC278: -0.107 | AD278: -0.11 | AE278: 93.42 | AF278: 93.25 | AG278: 0.78 | AH278: AA- | AI278: 6.3600000000000004e-002 | AJ278: =H278+100*O278 -> 123.49799999999999 | AK278: 123.5 | AL278: 65 | AM278: 30.1 | AN278: 62 | AO278: 1.6e-002 | AP278: 27 | AQ278: 光华转债!
A279: 106 | B279: 127022 | C279: 恒逸转债 | D279: 703 | E279: 恒逸石化 | F279: 化工 | G279: 化工 | H279: 123 | I279: 7.8000000000000005e-003 | J279: 1.5900000000000001e-002 | K279: 12.46 | L279: 3.32e-002 | M279: 108.9 | N279: 11.5 | O279: 0.13500000000000001 | P279: 108.35 | Q279: 转股中 | R279: 5.29年 | S279: 3.29年 | T279: 20 | U279: 46 | V279: 1.9e-002 | W279: 4.4000000000000004e-002 | X279: 4.7e-002 | Y279: 459 | Z279: 1.85 | AA279: -2.3099999999999999e-002 | AB279: -2.6099999999999998e-002 | AC279: -5.1200000000000002e-002 | AD279: -5.2600000000000001e-002 | AE279: 89.42 | AF279: 88.33 | AG279: 0.71 | AH279: AA+ | AI279: 4.0999999999999995e-002 | AJ279: =H279+100*O279 -> 136.5 | AK279: 137.7 | AL279: 223 | AM279: 48.2 | AN279: 245 | AO279: 4.0000000000000001e-003 | AP279: 6 | AQ279: 恒逸转债
A280: 4 | B280: 123115 | C280: 捷捷转债 | D280: 300623 | E280: 捷捷微电 | F280: 电子 | G280: 元器件制 | H280: 135.824 | I280: -1.5800000000000002e-002 | J280: 6.9999999999999993e-003 | K280: 33.62 | L280: -1.15e-002 | M280: 118.5 | N280: 29 | O280: 0.17199999999999999 | P280: 115.93 | Q280: 5月16天 | R280: 5.93年 | S280: 3.93年 | T280: 12 | U280: 226 | V280: 0.13800000000000001 | W280: 4.8000000000000001e-002 | X280: 5.5999999999999994e-002 | Y280: 248 | Z280: 6.35 | AA280: -2.3099999999999999e-002 | AB280: -2.8300000000000002e-002 | AC280: -6.3899999999999998e-002 | AD280: -6.5500000000000003e-002 | AE280: 80.4 | AF280: 82.14 | AG280: 0.76 | AH280: AA- | AI280: 6.5000000000000002e-002 | AJ280: =H280+100*O280 -> 153.024 | AK280: 155.7 | AL280: 305 | AM280: 73.6 | AN280: 322 | AO280: -3.0000000000000001e-003 | AP280: 2 | AQ280: 捷捷转债
A281: 41 | B281: 123100 | C281: 朗科转债 | D281: 300543 | E281: 朗科智能 | F281: 电子 | G281: 电子产品 | H281: 135.52 | I281: 3.1300000000000001e-002 | J281: 9.3999999999999986e-003 | K281: 16.14 | L281: 4.8099999999999997e-002 | M281: 117.5 | N281: 11.61 | O281: -2.5000000000000001e-002 | P281: 139.02 | Q281: 51天 | R281: 5.61年 | S281: 3.61年 | T281: 3.8 | U281: 452 | V281: 0.88300000000000001 | W281: 8.8000000000000009e-002 | X281: 0.122 | Y281: 43 | Z281: 3.55 | AA281: -2.5600000000000001e-002 | AB281: -3.0800000000000001e-002 | AC281: -6.8699999999999997e-002 | AD281: -7.0400000000000004e-002 | AE281: 82.07 | AF281: 83.14 | AG281: 0.85 | AH281: AA- | AI281: 6.5000000000000002e-002 | AJ281: =H281+100*O281 -> 133.02000000000001 | AK281: 132 | AL281: 168 | AM281: 48.9 | AN281: 249 | AO281: 0.158 | AP281: 8 | AQ281: 朗科转债
A282: 144 | B282: 123060 | C282: 苏试转债 | D282: 300416 | E282: 苏试试验 | F282: 机械装备 | G282: 专用设备 | H282: 133.81 | I282: -1.43e-002 | J282: -1.8200000000000001e-002 | K282: 22.92 | L282: -4.0999999999999995e-002 | M282: 117.6 | N282: 18.28 | O282: 6.7000000000000004e-002 | P282: 125.38 | Q282: 转股中 | R282: 5年18天 | S282: 3年19天 | T282: 3.1 | U282: 66 | V282: 0.158 | W282: 5.0999999999999997e-002 | X282: 6.4000000000000001e-002 | Y282: 60 | Z282: 4.99 | AA282: -2.58e-002 | AB282: -3.1600000000000003e-002 | AC282: -7.6299999999999993e-002 | AD282: -7.8299999999999995e-002 | AE282: 85.09 | AF282: 86.2 | AG282: 0.79 | AH282: AA- | AI282: 6.5000000000000002e-002 | AJ282: =H282+100*O282 -> 140.50999999999999 | AK282: 142.2 | AL282: 262 | AM282: 56 | AN282: 281 | AO282: 5.9999999999999998e-002 | AP282: 8 | AQ282: 苏试转债
A283: 5 | B283: 127036 | C283: 三花转债 | D283: 2050 | E283: 三花智控 | F283: 机械装备 | G283: 通用设备 | H283: 133.498 | I283: 7.4999999999999997e-003 | J283: -9.0000000000000011e-003 | K283: 23.33 | L283: -2.0999999999999999e-003 | M283: 114.5 | N283: 21.55 | O283: 0.23300000000000001 | P283: 108.26 | Q283: 5月8天 | R283: 5.91年 | S283: 3.92年 | T283: 30 | U283: 356 | V283: 8.9999999999999997e-002 | W283: 3.6000000000000004e-002 | X283: 3.9e-002 | Y283: 838 | Z283: 8.03 | AA283: -2.6000000000000002e-002 | AB283: -3.0200000000000001e-002 | AC283: -6.1799999999999994e-002 | AD283: -6.3099999999999989e-002 | AE283: 87.5 | AF283: 90.59 | AG283: 0.67 | AH283: AA+ | AI283: 4.0999999999999995e-002 | AJ283: =H283+100*O283 -> 156.798 | AK283: 158.7 | AL283: 315 | AM283: 68.2 | AN283: 311 | AO283: 6.5000000000000002e-002 | AP283: 3 | AQ283: 三花转债
A284: 22 | B284: 123108 | C284: 乐普转2 | D284: 300003 | E284: 乐普医疗 | F284: 医药 | G284: 医疗器械 | H284: 126.5 | I284: -5.3e-003 | J284: -1.3300000000000001e-002 | K284: 30.95 | L284: -2.98e-002 | M284: 111.1 | N284: 29.5 | O284: 0.20600000000000002 | P284: 104.92 | Q284: 3月8天 | R284: 4.74年 | S284: 2.74年 | T284: 16.4 | U284: 9.8 | V284: 5.0000000000000001e-003 | W284: 2.8999999999999998e-002 | X284: 3.1e-002 | Y284: 559 | Z284: 5.25 | AA284: -2.7300000000000001e-002 | AB284: -3.1400000000000004e-002 | AC284: -7.1399999999999991e-002 | AD284: -7.2599999999999998e-002 | AE284: 91.19 | AF284: 92.62 | AG284: 0.62 | AH284: AA+ | AI284: 3.9599999999999996e-002 | AJ284: =H284+100*O284 -> 147.09999999999999 | AK284: 148.1 | AL284: 282 | AM284: 55.5 | AN284: 278 | AO284: -1.9e-002 | AP284: 8 | AQ284: 乐普转2
A285: 354 | B285: 128018 | C285: 时达转债! | D285: 2527 | E285: 新时达 | F285: 机械装备 | G285: 机器人及 | H285: 116.9 | I285: 7.8000000000000005e-003 | J285: -2.06e-002 | K285: 7.8 | L285: -2.1299999999999999e-002 | M285: 109.3 | N285: 7.4 | O285: 0.109 | P285: 105.41 | Q285: 转股中 | R285: 2.35年 | S285: 0.35年 | T285: 4.04 | U285: 16 | V285: 3.5000000000000003e-002 | W285: 8.3000000000000004e-002 | X285: 8.8000000000000009e-002 | Y285: 49 | Z285: 1.84 | AA285: -2.87e-002 | AB285: -3.5799999999999998e-002 | AC285: -0.26600000000000001 | AD285: -0.27200000000000002 | AE285: 99.74 | AF285: 99.69 | AG285: 0.6 | AH285: AA | AI285: 4.0800000000000003e-002 | AJ285: =H285+100*O285 -> 127.80000000000001 | AK285: 128.4 | AL285: 123 | AM285: 28.7 | AN285: 54 | AO285: 5.9999999999999998e-002 | AP285: 35 | AQ285: 时达转债!
A286: 298 | B286: 128053 | C286: 尚荣转债! | D286: 2551 | E286: 尚荣医疗 | F286: 医药 | G286: 医疗器械 | H286: 127.59 | I286: -1.4999999999999999e-002 | J286: -7.000000000000001e-004 | K286: 5.36 | L286: -1.6500000000000001e-002 | M286: 114.3 | N286: 4.89 | O286: 0.16399999999999998 | P286: 109.61 | Q286: 转股中 | R286: 3.62年 | S286: 1.62年 | T286: 1.91 | U286: 34 | V286: 0.14000000000000001 | W286: 4.2999999999999997e-002 | X286: 4.8000000000000001e-002 | Y286: 44 | Z286: 1.44 | AA286: -3.04e-002 | AB286: -3.7200000000000004e-002 | AC286: -0.114 | AD286: -0.11699999999999999 | AE286: 95.46 | AF286: 98.55 | AG286: 0.95 | AH286: AA | AI286: 4.2599999999999999e-002 | AJ286: =H286+100*O286 -> 143.99000000000001 | AK286: 145.6 | AL286: 273 | AM286: 47 | AN286: 233 | AO286: -4.2000000000000003e-002 | AP286: 25 | AQ286: 尚荣转债!
A287: 248 | B287: 128079 | C287: 英联转债! | D287: 2846 | E287: 英联股份 | F287: 造纸包装 | G287: 包装材料 | H287: 133.8 | I287: 1.7000000000000001e-003 | J287: 8.0000000000000002e-003 | K287: 8.86 | L287: 1.1399999999999999e-002 | M287: 117.5 | N287: 8.29 | O287: 0.252 | P287: 106.88 | Q287: 转股中 | R287: 4.30年 | S287: 2.30年 | T287: 1.52 | U287: 119 | V287: 0.58099999999999996 | W287: 5.4000000000000006e-002 | X287: 5.7999999999999996e-002 | Y287: 28 | Z287: 3.66 | AA287: -3.04e-002 | AB287: -3.7100000000000001e-002 | AC287: -9.9100000000000008e-002 | AD287: -0.10099999999999999 | AE287: 86.96 | AF287: 86.85 | AG287: 0.86 | AH287: A+ | AI287: 7.46e-002 | AJ287: =H287+100*O287 -> 159. | AK287: 160.7 | AL287: 320 | AM287: 73.8 | AN287: 323 | AO287: 6.7000000000000004e-002 | AP287: 18 | AQ287: 英联转债!
A288: 282 | B288: 123025 | C288: 精测转债!! | D288: 300567 | E288: 精测电子 | F288: 电子 | G288: 液晶显示 | H288: 130.87 | I288: -5.8499999999999996e-002 | J288: 1.2e-002 | K288: 54.66 | L288: -6.8699999999999997e-002 | M288: 116.5 | N288: 49.37 | O288: 0.182 | P288: 110.72 | Q288: 转股中 | R288: 3.74年 | S288: 1.74年 | T288: 3.09 | U288: 43 | V288: 0.105 | W288: 2.e-002 | X288: 2.3e-002 | Y288: 152 | Z288: 7.66 | AA288: -3.1200000000000002e-002 | AB288: -3.8599999999999995e-002 | AC288: -0.11900000000000001 | AD288: -0.10099999999999999 | AE288: 91.51 | AF288: 92.93 | AG288: 0.68 | AH288: AA- | AI288: 6.3600000000000004e-002 | AJ288: =H288+100*O288 -> 149.06999999999999 | AK288: 151 | AL288: 294 | AM288: 58.1 | AN288: 291 | AO288: -3.2000000000000001e-002 | AP288: 16 | AQ288: 精测转债!!
A289: 193 | B289: 113575 | C289: 东时转债!! | D289: 603377 | E289: 东方时尚 | F289: 其他 | G289: 其他 | H289: 131.26 | I289: 5.1999999999999998e-003 | J289: -2.7000000000000001e-003 | K289: 10.31 | L289: 5.8999999999999999e-003 | M289: 113.1 | N289: 12.15 | O289: 0.54700000000000004 | P289: 84.86 | Q289: 转股中 | R289: 4.77年 | S289: 2.77年 | T289: 0.98 | U289: 60 | V289: 0.45899999999999996 | W289: 1.3000000000000001e-002 | X289: 1.1000000000000001e-002 | Y289: 75 | Z289: 3 | AA289: -3.1300000000000001e-002 | AB289: -3.6000000000000004e-002 | AC289: -7.85e-002 | AD289: -8.0500000000000002e-002 | AE289: 91.61 | AF289: 93.07 | AG289: 0.42 | AH289: AA | AI289: 4.2599999999999999e-002 | AJ289: =H289+100*O289 -> 185.95999999999998 | AK289: 177.7 | AL289: 335 | AM289: 84.6 | AN289: 335 | AO289: -2.4e-002 | AP289: 14 | AQ289: 东时转债!!
A290: 347 | B290: 128025 | C290: 特一转债! | D290: 2728 | E290: 特一药业 | F290: 医药 | G290: 化学制药 | H290: 117.644 | I290: -1.9699999999999999e-002 | J290: -3.2000000000000002e-003 | K290: 14.62 | L290: -3.6299999999999999e-002 | M290: 108.8 | N290: 14.05 | O290: 0.13100000000000001 | P290: 104.06 | Q290: 转股中 | R290: 2.43年 | S290: 0.43年 | T290: 2.98 | U290: 290 | V290: 0.81999999999999995 | W290: 0.10000000000000001 | X290: 0.10400000000000001 | Y290: 30 | Z290: 2.79 | AA290: -3.2099999999999997e-002 | AB290: -3.8599999999999995e-002 | AC290: -0.24100000000000002 | AD290: -0.245 | AE290: 97.99 | AF290: 94.27 | AG290: 0.63 | AH290: AA- | AI290: 6.1799999999999994e-002 | AJ290: =H290+100*O290 -> 130.744 | AK290: 131.2 | AL290: 158 | AM290: 33.2 | AN290: 101 | AO290: 1.6e-002 | AP290: 49 | AQ290: 特一转债!
A291: 329 | B291: 128036 | C291: 金农转债!! | D291: 2548 | E291: 金新农 | F291: 农业 | G291: 畜牧业 | H291: 119.48 | I291: -2.7000000000000001e-003 | J291: -1.4000000000000002e-003 | K291: 5.68 | L291: -1.5600000000000001e-002 | M291: 109.3 | N291: 6.93 | O291: 0.45799999999999996 | P291: 81.96 | Q291: 转股中 | R291: 2.68年 | S291: 0.68年 | T291: 1.46 | U291: 47 | V291: 0.26800000000000002 | W291: 3.7000000000000005e-002 | X291: 2.9999999999999999e-002 | Y291: 39 | Z291: 1.51 | AA291: -3.3099999999999997e-002 | AB291: -3.9300000000000002e-002 | AC291: -0.17699999999999999 | AD291: -0.18100000000000002 | AE291: 96.75 | AF291: 93.3 | AG291: 0.26 | AH291: AA- | AI291: 6.1799999999999994e-002 | AJ291: =H291+100*O291 -> 165.28 | AK291: 157 | AL291: 308 | AM291: 60.3 | AN291: 298 | AO291: -1.7000000000000001e-002 | AP291: 16 | AQ291: 金农转债!!
A292: 31 | B292: 127029 | C292: 中钢转债 | D292: 928 | E292: 中钢国际 | F292: 建筑 | G292: 建筑工程 | H292: 143.805 | I292: -8.6999999999999994e-003 | J292: -1.0800000000000001e-002 | K292: 9.16 | L292: -2.2400000000000003e-002 | M292: 117.5 | N292: 5.89 | O292: -7.4999999999999997e-002 | P292: 155.52 | Q292: 2月27天 | R292: 5.71年 | S292: 3.71年 | T292: 9.6 | U292: 126 | V292: 9.0999999999999998e-002 | W292: 8.3000000000000004e-002 | X292: 0.13 | Y292: 115 | Z292: 2 | AA292: -3.5200000000000002e-002 | AB292: -4.0300000000000002e-002 | AC292: -8.2799999999999999e-002 | AD292: -8.4100000000000008e-002 | AE292: 88.22 | AF292: 93.71 | AG292: 0.87 | AH292: AA+ | AI292: 4.0999999999999995e-002 | AJ292: =H292+100*O292 -> 136.30500000000001 | AK292: 132.1 | AL292: 170 | AM292: 38.4 | AN292: 160 | AO292: -5.7000000000000002e-002 | AP292: 9 | AQ292: 中钢转债
A293: 199 | B293: 123047 | C293: 久吾转债! | D293: 300631 | E293: 久吾高科 | F293: 机械装备 | G293: 专用设备 | H293: 153 | I293: 9.4600000000000004e-002 | J293: 5.7000000000000002e-002 | K293: 27.38 | L293: 0.17999999999999999 | M293: 129.6 | N293: 17.43 | O293: -2.6000000000000002e-002 | P293: 157.09 | Q293: 转股中 | R293: 4.71年 | S293: 2.72年 | T293: 1.99 | U293: 4281. | V293: 14.050000000000001 | W293: 6.7000000000000004e-002 | X293: 0.105 | Y293: 30 | Z293: 3.6 | AA293: -3.5499999999999997e-002 | AB293: -4.5100000000000001e-002 | AC293: -0.12 | AD293: -0.12300000000000001 | AE293: 86.04 | AF293: 93.23 | AG293: 0.84 | AH293: A+ | AI293: 7.46e-002 | AJ293: =H293+100*O293 -> 150.40000000000001 | AK293: 148.9 | AL293: 289 | AM293: 55.7 | AN293: 279 | AO293: 0.20499999999999999 | AP293: 22 | AQ293: 久吾转债!
A294: 99 | B294: 127023 | C294: 华菱转2!* | D294: 932 | E294: 华菱钢铁 | F294: 钢铁 | G294: 炼钢 | H294: 132.999 | I294: -2.3e-003 | J294: 7.000000000000001e-004 | K294: 6.6 | L294: -1.5e-003 | M294: 110.1 | N294: 4.97 | O294: 2.e-003 | P294: 132.8 | Q294: 转股中 | R294: 5.31年 | S294: 4.31年 | T294: 16.4 | U294: 62 | V294: 2.8999999999999998e-002 | W294: 4.0999999999999995e-002 | X294: 5.4000000000000006e-002 | Y294: 405 | Z294: 1.15 | AA294: -3.5499999999999997e-002 | AB294: -3.8800000000000001e-002 | AC294: -5.3099999999999994e-002 | AD294: -5.4800000000000001e-002 | AE294: 88.18 | AF294: 90.15 | AG294: 1 | AH294: AAA | AI294: 3.9e-002 | AJ294: =H294+100*O294 -> 133.19899999999998 | AK294: 133.2 | AL294: 185 | AM294: 43 | AN294: 202 | AO294: -1.3000000000000001e-002 | AP294: 11 | AQ294: 华菱转2!*
A295: 242 | B295: 123033 | C295: 金力转债! | D295: 300748 | E295: 金力永磁 | F295: 电子 | G295: 元器件制 | H295: 141.588 | I295: 9.3599999999999989e-002 | J295: 7.5600000000000001e-002 | K295: 36.18 | L295: 0.20000000000000001 | M295: 121.5 | N295: 25.3 | O295: -1.e-002 | P295: 143 | Q295: 转股中 | R295: 4.33年 | S295: 2.33年 | T295: 4.34 | U295: 3389. | V295: 5.4199999999999999 | W295: 1.7000000000000001e-002 | X295: 2.5000000000000001e-002 | Y295: 250 | Z295: 7.44 | AA295: -3.5699999999999996e-002 | AB295: -4.3700000000000003e-002 | AC295: -0.113 | AD295: -0.11699999999999999 | AE295: 90.23 | AF295: 93.8 | AG295: 0.85 | AH295: AA- | AI295: 6.3600000000000004e-002 | AJ295: =H295+100*O295 -> 140.58799999999999 | AK295: 140.2 | AL295: 252 | AM295: 46.4 | AN295: 230 | AO295: 0.34200000000000003 | AP295: 26 | AQ295: 金力转债!
A296: 21 | B296: 123110 | C296: 九典转债 | D296: 300705 | E296: 九典制药 | F296: 医药 | G296: 化学制药 | H296: 149 | I296: -1.72e-002 | J296: -2.0999999999999999e-003 | K296: 38.31 | L296: -2.2499999999999999e-002 | M296: 121.4 | N296: 26.44 | O296: 2.7999999999999997e-002 | P296: 144.89 | Q296: 3月8天 | R296: 5.75年 | S296: 3.75年 | T296: 2.7 | U296: 205 | V296: 0.50900000000000001 | W296: 2.9999999999999999e-002 | X296: 4.4000000000000004e-002 | Y296: 90 | Z296: 10.19 | AA296: -3.5699999999999996e-002 | AB296: -4.1700000000000001e-002 | AC296: -8.7599999999999997e-002 | AD296: -8.9399999999999993e-002 | AE296: 78.62 | AF296: 80.43 | AG296: 0.86 | AH296: A+ | AI296: 7.5999999999999998e-002 | AJ296: =H296+100*O296 -> 151.80000000000001 | AK296: 153.1 | AL296: 299 | AM296: 72.7 | AN296: 320 | AO296: 0.122 | AP296: 5 | AQ296: 九典转债
A297: 111 | B297: 128134 | C297: 鸿路转债! | D297: 2541 | E297: 鸿路钢构 | F297: 建筑 | G297: 其他 | H297: 139.6 | I297: -3.1899999999999998e-002 | J297: -1.1899999999999999e-002 | K297: 60.91 | L297: -5.1100000000000007e-002 | M297: 115.1 | N297: 43.51 | O297: -3.0000000000000001e-003 | P297: 139.99 | Q297: 转股中 | R297: 5.27年 | S297: 3.27年 | T297: 16.6 | U297: 257 | V297: 0.111 | W297: 5.2000000000000005e-002 | X297: 7.2999999999999995e-002 | Y297: 319 | Z297: 5.49 | AA297: -3.6600000000000001e-002 | AB297: -4.1399999999999999e-002 | AC297: -8.3699999999999997e-002 | AD297: -8.5500000000000007e-002 | AE297: 89.47 | AF297: 92.14 | AG297: 0.86 | AH297: AA | AI297: 4.4000000000000004e-002 | AJ297: =H297+100*O297 -> 139.29999999999998 | AK297: 139.2 | AL297: 238 | AM297: 47.1 | AN297: 234 | AO297: 8.6999999999999994e-002 | AP297: 4 | AQ297: 鸿路转债!
A298: 220 | B298: 123042 | C298: 银河转债! | D298: 300619 | E298: 金银河 | F298: 机械装备 | G298: 专用设备 | H298: 136.28 | I298: 3.4999999999999996e-003 | J298: -2.3099999999999999e-002 | K298: 22.16 | L298: -3.2300000000000002e-002 | M298: 115.4 | N298: 24.38 | O298: 0.499 | P298: 90.89 | Q298: 转股中 | R298: 4.53年 | S298: 2.54年 | T298: 1.67 | U298: 149 | V298: 0.65300000000000002 | W298: 0.10099999999999999 | X298: 9.1999999999999998e-002 | Y298: 17 | Z298: 3.39 | AA298: -3.6699999999999997e-002 | AB298: -4.24e-002 | AC298: -9.6999999999999989e-002 | AD298: -9.9199999999999997e-002 | AE298: 85.6 | AF298: 83.92 | AG298: 0.61 | AH298: A+ | AI298: 7.46e-002 | AJ298: =H298+100*O298 -> 186.18000000000001 | AK298: 181.7 | AL298: 341 | AM298: 96.1 | AN298: 342 | AO298: -2.3e-002 | AP298: 22 | AQ298: 银河转债!
A299: 46 | B299: 113621 | C299: 彤程转债 | D299: 603650 | E299: 彤程新材 | F299: 化工 | G299: 橡胶塑料 | H299: 141.28 | I299: -1.5100000000000001e-002 | J299: 2.0299999999999999e-002 | K299: 46.48 | L299: 6.0999999999999995e-003 | M299: 115.1 | N299: 32.62 | O299: -8.0000000000000002e-003 | P299: 142.49 | Q299: 31天 | R299: 5.57年 | S299: 3.57年 | T299: 8 | U299: 133 | V299: 0.11699999999999999 | W299: 2.8999999999999998e-002 | X299: 4.2000000000000003e-002 | Y299: 272 | Z299: 10.57 | AA299: -3.6699999999999997e-002 | AB299: -4.1299999999999996e-002 | AC299: -8.0199999999999994e-002 | AD299: -8.1799999999999998e-002 | AE299: 88.33 | AF299: 90.96 | AG299: 0.87 | AH299: AA | AI299: 4.4000000000000004e-002 | AJ299: =H299+100*O299 -> 140.47999999999999 | AK299: 140.1 | AL299: 250 | AM299: 49.1 | AN299: 253 | AO299: 2.5000000000000001e-002 | AP299: 5 | AQ299: 彤程转债
A300: 153 | B300: 123058 | C300: 欣旺转债!* | D300: 300207 | E300: 欣旺达 | F300: 电子 | G300: 电子产品 | H300: 139.9 | I300: -3.7200000000000004e-002 | J300: 1.1999999999999999e-003 | K300: 29.76 | L300: -3.6000000000000004e-002 | M300: 116.3 | N300: 21.17 | O300: -5.0000000000000001e-003 | P300: 140.58 | Q300: 转股中 | R300: 5年11天 | S300: 3年12天 | T300: 1.22 | U300: 131 | V300: 0.75900000000000001 | W300: 3.0000000000000001e-003 | X300: 4.0000000000000001e-003 | Y300: 468 | Z300: 6.7 | AA300: -3.6799999999999999e-002 | AB300: -4.2099999999999999e-002 | AC300: -8.9900000000000008e-002 | AD300: -9.1799999999999993e-002 | AE300: 90.59 | AF300: 94.09 | AG300: 1 | AH300: AA | AI300: 4.4000000000000004e-002 | AJ300: =H300+100*O300 -> 139.40000000000001 | AK300: 139.2 | AL300: 240 | AM300: 45.1 | AN300: 220 | AO300: -7.0000000000000007e-002 | AP300: 7 | AQ300: 欣旺转债!*
A301: 240 | B301: 110061 | C301: 川投转债 | D301: 600674 | E301: 川投能源 | F301: 能源电力 | G301: 水电 | H301: 130.3 | I301: -3.5999999999999999e-003 | J301: 1.6000000000000001e-003 | K301: 12.3 | L301: -2.3999999999999998e-003 | M301: 110.8 | N301: 9.58 | O301: 1.4999999999999999e-002 | P301: 128.39 | Q301: 转股中 | R301: 4.36年 | S301: 2.36年 | T301: 39.6 | U301: 4.1 | V301: 1.e-003 | W301: 7.2999999999999995e-002 | X301: 9.4e-002 | Y301: 542 | Z301: 1.88 | AA301: -3.7200000000000004e-002 | AB301: -4.1500000000000002e-002 | AC301: -8.8499999999999995e-002 | AD301: -9.0700000000000003e-002 | AE301: 94.18 | AF301: 94.65 | AG301: 0.82 | AH301: AAA | AI301: 3.7599999999999995e-002 | AJ301: =H301+100*O301 -> 131.80000000000001 | AK301: 132.2 | AL301: 174 | AM301: 37.6 | AN301: 151 | AO301: 3.1e-002 | AP301: 14 | AQ301: 川投转债
A302: 101 | B302: 113040 | C302: 星宇转债! | D302: 601799 | E302: 星宇股份 | F302: 汽车 | G302: 零部件制 | H302: 136.03 | I302: -4.1900000000000007e-002 | J302: -1.2199999999999999e-002 | K302: 213.31 | L302: -5.4100000000000002e-002 | M302: 111.5 | N302: 156.7 | O302: -1.e-003 | P302: 136.13 | Q302: 转股中 | R302: 5.30年 | S302: 3.31年 | T302: 14 | U302: 175 | V302: 9.0999999999999998e-002 | W302: 2.4e-002 | X302: 3.2000000000000001e-002 | Y302: 589 | Z302: 9.74 | AA302: -3.7200000000000004e-002 | AB302: -4.0899999999999999e-002 | AC302: -7.9299999999999995e-002 | AD302: -8.0399999999999985e-002 | AE302: 89.01 | AF302: 90.35 | AG302: 1 | AH302: AA+ | AI302: 4.0999999999999995e-002 | AJ302: =H302+100*O302 -> 135.93000000000001 | AK302: 135.9 | AL302: 212 | AM302: 45.6 | AN302: 223 | AO302: -8.0000000000000002e-003 | AP302: 5 | AQ302: 星宇转债!
A303: 56 | B303: 113615 | C303: 金诚转债 | D303: 603979 | E303: 金诚信 | F303: 有色金属 | G303: 有色行业 | H303: 144.38 | I303: 9.5999999999999992e-003 | J303: -9.1000000000000004e-003 | K303: 17.7 | L303: 5.9999999999999995e-004 | M303: 117.3 | N303: 12.65 | O303: 3.2000000000000001e-002 | P303: 139.92 | Q303: 转股中 | R303: 5.47年 | S303: 3.48年 | T303: 10 | U303: 7.1 | V303: 5.0000000000000001e-003 | W303: 9.6999999999999989e-002 | X303: 0.13500000000000001 | Y303: 103 | Z303: 2.22 | AA303: -3.7900000000000003e-002 | AB303: -4.3099999999999999e-002 | AC303: -8.7300000000000003e-002 | AD303: -8.900000000000001e-002 | AE303: 88.88 | AF303: 93.1 | AG303: 0.84 | AH303: AA | AI303: 4.4000000000000004e-002 | AJ303: =H303+100*O303 -> 147.57999999999998 | AK303: 148.8 | AL303: 288 | AM303: 55.7 | AN303: 280 | AO303: 1.4999999999999999e-002 | AP303: 3 | AQ303: 金诚转债
A304: 35 | B304: 123103 | C304: 震安转债 | D304: 300767 | E304: 震安科技 | F304: 化工 | G304: 橡胶塑料 | H304: 150.882 | I304: -7.4000000000000003e-003 | J304: -4.0000000000000002e-004 | K304: 82.1 | L304: -9.1000000000000004e-003 | M304: 121.4 | N304: 56.89 | O304: 4.5999999999999999e-002 | P304: 144.31 | Q304: 2月20天 | R304: 5.69年 | S304: 3.69年 | T304: 2.85 | U304: 74 | V304: 0.17399999999999999 | W304: 1.7000000000000001e-002 | X304: 2.5000000000000001e-002 | Y304: 166 | Z304: 10.38 | AA304: -3.8199999999999998e-002 | AB304: -4.4199999999999996e-002 | AC304: -9.1499999999999998e-002 | AD304: -9.3399999999999997e-002 | AE304: 79.09 | AF304: 80.8 | AG304: 0.86 | AH304: A+ | AI304: 7.5999999999999998e-002 | AJ304: =H304+100*O304 -> 155.482 | AK304: 157.5 | AL304: 312 | AM304: 76.7 | AN304: 328 | AO304: -1.4999999999999999e-002 | AP304: 3 | AQ304: 震安转债
A305: 363 | B305: 113011 | C305: 光大转债 | D305: 601818 | E305: 光大银行 | F305: 金融 | G305: 银行行业 | H305: 114.91 | I305: -5.6000000000000008e-003 | J305: 3.0999999999999999e-003 | K305: 3.76 | L305: -5.3e-003 | M305: 106.8 | N305: 3.76 | O305: 0.14899999999999999 | P305: 100 | Q305: 转股中 | R305: 1.71年 | S305: 无权 | T305: 242 | U305: 238 | V305: 9.0000000000000011e-003 | W305: 0.11900000000000001 | X305: 0.11900000000000001 | Y305: 2032. | Z305: 0.57 | AA305: -4.24e-002 | AB305: -4.9500000000000002e-002 | AC305: 无权 | AD305: 无权 | AE305: 无权 | AF305: 100.64 | AG305: 0.49 | AH305: AAA | AI305: 3.5799999999999998e-002 | AJ305: =H305+100*O305 -> 129.81 | AK305: 129.8 | AL305: 139 | AM305: 29.2 | AN305: 59 | AO305: -1.1000000000000001e-002 | AP305: 13 | AQ305: 光大转债
A306: 19 | B306: 123111 | C306: 东财转3 | D306: 300059 | E306: 东方财富 | F306: 金融 | G306: 证券行业 | H306: 142.2 | I306: -9.1000000000000004e-003 | J306: -2.8199999999999999e-002 | K306: 29.72 | L306: -4.6199999999999998e-002 | M306: 110.5 | N306: 23.35 | O306: 0.11699999999999999 | P306: 127.28 | Q306: 3月13天 | R306: 5.76年 | S306: 3.76年 | T306: 158 | U306: 543 | V306: 2.4e-002 | W306: 5.0999999999999997e-002 | X306: 6.5000000000000002e-002 | Y306: 3072. | Z306: 7.3 | AA306: -4.3200000000000002e-002 | AB306: -4.6399999999999997e-002 | AC306: -8.1300000000000011e-002 | AD306: -8.2200000000000009e-002 | AE306: 87.16 | AF306: 87.88 | AG306: 0.81 | AH306: AA+ | AI306: 4.0999999999999995e-002 | AJ306: =H306+100*O306 -> 153.89999999999998 | AK306: 157.1 | AL306: 310 | AM306: 69.2 | AN306: 312 | AO306: -4.2000000000000003e-002 | AP306: 18 | AQ306: 东财转3
A307: 306 | B307: 110048 | C307: 福能转债! | D307: 600483 | E307: 福能股份 | F307: 能源电力 | G307: 电力供应 | H307: 132.04 | I307: -1.5700000000000002e-002 | J307: 1.4199999999999999e-002 | K307: 10.47 | L307: -1.9e-003 | M307: 113.3 | N307: 8.12 | O307: 2.4e-002 | P307: 128.94 | Q307: 转股中 | R307: 3.43年 | S307: 1.43年 | T307: 19.5 | U307: 25 | V307: 1.e-002 | W307: 0.10400000000000001 | X307: 0.13400000000000001 | Y307: 187 | Z307: 1.18 | AA307: -4.4400000000000002e-002 | AB307: -5.0999999999999997e-002 | AC307: -0.129 | AD307: -0.13100000000000001 | AE307: 96.66 | AF307: 99.44 | AG307: 0.81 | AH307: AA+ | AI307: 3.9599999999999996e-002 | AJ307: =H307+100*O307 -> 134.44 | AK307: 135.1 | AL307: 204 | AM307: 35.7 | AN307: 130 | AO307: -3.1e-002 | AP307: 9 | AQ307: 福能转债!
A308: 170 | B308: 113585 | C308: 寿仙转债! | D308: 603896 | E308: 寿仙谷 | F308: 医药 | G308: 中药 | H308: 146.73 | I308: -1.1399999999999999e-002 | J308: 4.5999999999999999e-003 | K308: 41.18 | L308: -7.7000000000000002e-003 | M308: 117.3 | N308: 28.38 | O308: 1.1000000000000001e-002 | P308: 145.1 | Q308: 转股中 | R308: 4.93年 | S308: 2.94年 | T308: 1.26 | U308: 363 | V308: 1.9299999999999999 | W308: 2.e-002 | X308: 2.8999999999999998e-002 | Y308: 62 | Z308: 4.46 | AA308: -4.5100000000000001e-002 | AB308: -5.0799999999999998e-002 | AC308: -0.105 | AD308: -0.107 | AE308: 85.74 | AF308: 87.07 | AG308: 0.87 | AH308: AA- | AI308: 6.3600000000000004e-002 | AJ308: =H308+100*O308 -> 147.82999999999998 | AK308: 148.4 | AL308: 284 | AM308: 61.3 | AN308: 301 | AO308: 9.6000000000000002e-002 | AP308: 11 | AQ308: 寿仙转债!
A309: 29 | B309: 127030 | C309: 盛虹转债 | D309: 301 | E309: 东方盛虹 | F309: 化工 | G309: 化纤 | H309: 146.06 | I309: -1.24e-002 | J309: -2.3e-002 | K309: 18.65 | L309: -4.3099999999999999e-002 | M309: 112.5 | N309: 14.1 | O309: 0.10400000000000001 | P309: 132.27 | Q309: 2月27天 | R309: 5.72年 | S309: 3.72年 | T309: 50 | U309: 97 | V309: 1.3000000000000001e-002 | W309: 5.5e-002 | X309: 7.2999999999999995e-002 | Y309: 902 | Z309: 4.97 | AA309: -4.5199999999999997e-002 | AB309: -4.8899999999999999e-002 | AC309: -8.6300000000000002e-002 | AD309: -8.7599999999999997e-002 | AE309: 88.19 | AF309: 89.71 | AG309: 0.82 | AH309: AA+ | AI309: 4.0999999999999995e-002 | AJ309: =H309+100*O309 -> 156.46000000000001 | AK309: 159.9 | AL309: 318 | AM309: 70.1 | AN309: 314 | AO309: 6.2e-002 | AP309: 4 | AQ309: 盛虹转债
A310: 328 | B310: 113508 | C310: 新凤转债! | D310: 603225 | E310: 新凤鸣 | F310: 服装纺织 | G310: 纺织行业 | H310: 126.91 | I310: -1.06e-002 | J310: -1.23e-002 | K310: 19.45 | L310: -2.8999999999999998e-002 | M310: 111.3 | N310: 15.65 | O310: 2.1000000000000001e-002 | P310: 124.28 | Q310: 转股中 | R310: 2.81年 | S310: 0.82年 | T310: 20.6 | U310: 50 | V310: 1.9e-002 | W310: 7.4999999999999997e-002 | X310: 9.4e-002 | Y310: 273 | Z310: 2.23 | AA310: -4.6199999999999998e-002 | AB310: -5.3099999999999994e-002 | AC310: -0.20199999999999999 | AD310: -0.20499999999999999 | AE310: 97.89 | AF310: 99.62 | AG310: 0.79 | AH310: AA | AI310: 4.0800000000000003e-002 | AJ310: =H310+100*O310 -> 129.00999999999999 | AK310: 129.5 | AL310: 137 | AM310: 29.9 | AN310: 61 | AO310: -1.8000000000000002e-002 | AP310: 22 | AQ310: 新凤转债!
A311: 125 | B311: 128128 | C311: 齐翔转2! | D311: 2408 | E311: 齐翔腾达 | F311: 化工 | G311: 化工 | H311: 148.041 | I311: -6.3e-003 | J311: 1.1999999999999999e-003 | K311: 11.81 | L311: -5.8999999999999999e-003 | M311: 115.3 | N311: 7.97 | O311: -1.e-003 | P311: 148.18 | Q311: 转股中 | R311: 5年48天 | S311: 3年49天 | T311: 9.51 | U311: 72 | V311: 5.0999999999999997e-002 | W311: 4.0000000000000001e-002 | X311: 5.9999999999999998e-002 | Y311: 235 | Z311: 2.16 | AA311: -4.8399999999999999e-002 | AB311: -5.33e-002 | AC311: -0.10099999999999999 | AD311: -0.10300000000000001 | AE311: 90.11 | AF311: 92.86 | AG311: 0.87 | AH311: AA | AI311: 4.4000000000000004e-002 | AJ311: =H311+100*O311 -> 147.941 | AK311: 147.9 | AL311: 281 | AM311: 55 | AN311: 277 | AO311: 3.7000000000000005e-002 | AP311: 34 | AQ311: 齐翔转2!
A312: 210 | B312: 123043 | C312: 正元转债 | D312: 300645 | E312: 正元智慧 | F312: 计算机及 | G312: 软件开发 | H312: 152.15 | I312: -1.6299999999999999e-002 | J312: 2.7799999999999998e-002 | K312: 19.27 | L312: 1.47e-002 | M312: 120.9 | N312: 15.38 | O312: 0.214 | P312: 125.29 | Q312: 转股中 | R312: 4.67年 | S312: 2.67年 | T312: 1.66 | U312: 2219. | V312: 8.2799999999999994 | W312: 6.8000000000000005e-002 | X312: 8.5000000000000006e-002 | Y312: 25 | Z312: 3.82 | AA312: -4.9000000000000002e-002 | AB312: -5.5999999999999994e-002 | AC312: -0.125 | AD312: -0.127 | AE312: 85.02 | AF312: 87.06 | AG312: 0.78 | AH312: A+ | AI312: 7.46e-002 | AJ312: =H312+100*O312 -> 173.55000000000001 | AK312: 179 | AL312: 336 | AM312: 91.9 | AN312: 341 | AO312: 0.16 | AP312: 18 | AQ312: 正元转债
A313: 114 | B313: 123067 | C313: 斯莱转债 | D313: 300382 | E313: 斯莱克 | F313: 机械装备 | G313: 专用设备 | H313: 157.551 | I313: -1.5800000000000002e-002 | J313: 1.6399999999999998e-002 | K313: 14.41 | L313: 7.000000000000001e-004 | M313: 121.2 | N313: 9.36 | O313: 2.3e-002 | P313: 153.95 | Q313: 转股中 | R313: 5.21年 | S313: 3.21年 | T313: 3.88 | U313: 118 | V313: 0.19600000000000001 | W313: 4.8000000000000001e-002 | X313: 7.2999999999999995e-002 | Y313: 81 | Z313: 7.84 | AA313: -5.0099999999999999e-002 | AB313: -5.6500000000000002e-002 | AC313: -0.114 | AD313: -0.11599999999999999 | AE313: 84.4 | AF313: 87.98 | AG313: 0.87 | AH313: AA- | AI313: 6.5000000000000002e-002 | AJ313: =H313+100*O313 -> 159.851 | AK313: 161.1 | AL313: 321 | AM313: 73.2 | AN313: 321 | AO313: 0.151 | AP313: 13 | AQ313: 斯莱转债
A314: 34 | B314: 123102 | C314: 华自转债 | D314: 300490 | E314: 华自科技 | F314: 机械装备 | G314: 机器人及 | H314: 170.201 | I314: 0.185 | J314: -1.6000000000000001e-003 | K314: 18 | L314: 0.20000000000000001 | M314: 126.9 | N314: 9.26 | O314: -0.124 | P314: 194.38 | Q314: 2月18天 | R314: 5.69年 | S314: 3.69年 | T314: 6.7 | U314: 4966. | V314: 4.6200000000000001 | W314: 0.14499999999999999 | X314: 0.28199999999999997 | Y314: 46 | Z314: 2.63 | AA314: -5.1299999999999998e-002 | AB314: -5.8400000000000001e-002 | AC314: -0.114 | AD314: -0.11599999999999999 | AE314: 82.55 | AF314: 89.43 | AG314: 0.92 | AH314: AA- | AI314: 6.5000000000000002e-002 | AJ314: =H314+100*O314 -> 157.80099999999999 | AK314: 146 | AL314: 274 | AM314: 56.6 | AN314: 282 | AO314: 0.36099999999999999 | AP314: 19 | AQ314: 华自转债
A315: 311 | B315: 128046 | C315: 利尔转债!! | D315: 2258 | E315: 利尔化学 | F315: 化工 | G315: 农化 | H315: 133.266 | I315: -2.58e-002 | J315: -1.66e-002 | K315: 23.71 | L315: -4.24e-002 | M315: 112.3 | N315: 18.42 | O315: 3.5000000000000003e-002 | P315: 128.72 | Q315: 转股中 | R315: 3.29年 | S315: 1.29年 | T315: 8.35 | U315: 65 | V315: 5.9000000000000004e-002 | W315: 6.7000000000000004e-002 | X315: 8.5999999999999993e-002 | Y315: 124 | Z315: 3.19 | AA315: -5.1699999999999996e-002 | AB315: -5.79e-002 | AC315: -0.14899999999999999 | AD315: -0.151 | AE315: 96.78 | AF315: 98.18 | AG315: 1 | AH315: AA | AI315: 4.2599999999999999e-002 | AJ315: =H315+100*O315 -> 136.76599999999999 | AK315: 137.8 | AL315: 227 | AM315: 39.6 | AN315: 170 | AO315: -2.8999999999999998e-002 | AP315: 9 | AQ315: 利尔转债!!
A316: 54 | B316: 113616 | C316: 韦尔转债 | D316: 603501 | E316: 韦尔股份 | F316: 电子 | G316: 元器件制 | H316: 152.89 | I316: -1.9799999999999998e-002 | J316: -1.0200000000000001e-002 | K316: 314.49 | L316: -3.5299999999999998e-002 | M316: 114.5 | N316: 222.52 | O316: 8.199999999999999e-002 | P316: 141.33 | Q316: 3.0天 | R316: 5.49年 | S316: 3.49年 | T316: 24.4 | U316: 133 | V316: 3.5000000000000003e-002 | W316: 9.0000000000000011e-003 | X316: 1.3000000000000001e-002 | Y316: 2732. | Z316: 21.94 | AA316: -5.2000000000000005e-002 | AB316: -5.6299999999999996e-002 | AC316: -0.10000000000000001 | AD316: -0.10099999999999999 | AE316: 89.01 | AF316: 92.15 | AG316: 0.85 | AH316: AA+ | AI316: 4.0999999999999995e-002 | AJ316: =H316+100*O316 -> 161.08999999999997 | AK316: 164.4 | AL316: 325 | AM316: 72.3 | AN316: 319 | AO316: 8.3000000000000004e-002 | AP316: 8 | AQ316: 韦尔转债
A317: 16 | B317: 113047 | C317: 旗滨转债 | D317: 601636 | E317: 旗滨集团 | F317: 建筑 | G317: 玻璃 | H317: 155.85 | I317: 1.1899999999999999e-002 | J317: -9.5999999999999992e-003 | K317: 18.15 | L317: 2.8000000000000004e-003 | M317: 114 | N317: 12.8 | O317: 9.9000000000000005e-002 | P317: 141.8 | Q317: 3月15天 | R317: 5.77年 | S317: 3.77年 | T317: 15 | U317: 110 | V317: 4.7e-002 | W317: 3.1e-002 | X317: 4.4000000000000004e-002 | Y317: 488 | Z317: 4.69 | AA317: -5.3399999999999996e-002 | AB317: -5.74e-002 | AC317: -0.10099999999999999 | AD317: -0.10199999999999999 | AE317: 87.58 | AF317: 90.69 | AG317: 0.84 | AH317: AA+ | AI317: 4.0999999999999995e-002 | AJ317: =H317+100*O317 -> 165.75 | AK317: 169.9 | AL317: 327 | AM317: 79.2 | AN317: 331 | AO317: 2.7000000000000003e-002 | AP317: 5 | AQ317: 旗滨转债
A318: 115 | B318: 123066 | C318: 赛意转债! | D318: 300687 | E318: 赛意信息 | F318: 计算机及 | G318: 软件开发 | H318: 161 | I318: 3.0099999999999998e-002 | J318: 6.0000000000000001e-003 | K318: 22.73 | L318: 4.0800000000000003e-002 | M318: 121.4 | N318: 14.01 | O318: -8.0000000000000002e-003 | P318: 162.24 | Q318: 转股中 | R318: 5.21年 | S318: 3.21年 | T318: 2.45 | U318: 965 | V318: 2.4199999999999999 | W318: 3.1e-002 | X318: 5.0000000000000003e-002 | Y318: 80 | Z318: 5.02 | AA318: -5.3800000000000001e-002 | AB318: -6.0199999999999997e-002 | AC318: -0.11900000000000001 | AD318: -0.121 | AE318: 81.72 | AF318: 83.67 | AG318: 0.89 | AH318: A+ | AI318: 7.5999999999999998e-002 | AJ318: =H318+100*O318 -> 160.19999999999999 | AK318: 159.8 | AL318: 317 | AM318: 76.1 | AN318: 327 | AO318: 0.11900000000000001 | AP318: 8 | AQ318: 赛意转债!
A319: 318 | B319: 123012 | C319: 万顺转债! | D319: 300057 | E319: 万顺新材 | F319: 有色金属 | G319: 铝金属 | H319: 130.31 | I319: -2.5999999999999999e-003 | J319: 1.4999999999999999e-002 | K319: 6.27 | L319: 1.6200000000000003e-002 | M319: 110.3 | N319: 5.27 | O319: 9.5000000000000001e-002 | P319: 118.98 | Q319: 转股中 | R319: 3年17天 | S319: 1年18天 | T319: 1.29 | U319: 102 | V319: 0.60899999999999999 | W319: 2.9999999999999999e-002 | X319: 3.6000000000000004e-002 | Y319: 42 | Z319: 1.19 | AA319: -5.4400000000000004e-002 | AB319: -6.0100000000000001e-002 | AC319: -0.17100000000000001 | AD319: -0.17399999999999999 | AE319: 95.46 | AF319: 91.82 | AG319: 0.76 | AH319: AA- | AI319: 6.3600000000000004e-002 | AJ319: =H319+100*O319 -> 139.81 | AK319: 141.6 | AL319: 258 | AM319: 46.2 | AN319: 228 | AO319: 0.12300000000000001 | AP319: 20 | AQ319: 万顺转债!
A320: 212 | B320: 110066 | C320: 盛屯转债!! | D320: 600711 | E320: 盛屯矿业 | F320: 有色金属 | G320: 有色行业 | H320: 150.06 | I320: -6.3e-003 | J320: 1.49e-002 | K320: 6.98 | L320: 1.01e-002 | M320: 114.9 | N320: 4.88 | O320: 4.9000000000000002e-002 | P320: 143.03 | Q320: 转股中 | R320: 4.66年 | S320: 2.67年 | T320: 5.22 | U320: 214 | V320: 0.26800000000000002 | W320: 2.7999999999999997e-002 | X320: 4.0000000000000001e-002 | Y320: 187 | Z320: 1.67 | AA320: -5.6600000000000004e-002 | AB320: -6.1799999999999994e-002 | AC320: -0.122 | AD320: -0.124 | AE320: 91.97 | AF320: 94.95 | AG320: 0.85 | AH320: AA | AI320: 4.2599999999999999e-002 | AJ320: =H320+100*O320 -> 154.96000000000001 | AK320: 157.1 | AL320: 309 | AM320: 62.1 | AN320: 303 | AO320: -5.2000000000000005e-002 | AP320: 32 | AQ320: 盛屯转债!!
A321: 366 | B321: 113009 | C321: 广汽转债! | D321: 601238 | E321: 广汽集团 | F321: 汽车 | G321: 乘用车 | H321: 109.61 | I321: 2.7000000000000001e-003 | J321: 1.5e-003 | K321: 13.12 | L321: 2.4199999999999999e-002 | M321: 106 | N321: 13.97 | O321: 0.16699999999999998 | P321: 93.92 | Q321: 转股中 | R321: 0.56年 | S321: 回售内 | T321: 25.5 | U321: 32 | V321: 1.1000000000000001e-002 | W321: 1.9e-002 | X321: 1.8000000000000002e-002 | Y321: 1358. | Z321: 1.57 | AA321: -5.8200000000000002e-002 | AB321: -7.7199999999999991e-002 | AC321: 回售内 | AD321: 回售内 | AE321: 100.27 | AF321: 104.14 | AG321: 0.17 | AH321: AAA | AI321: 3.2199999999999999e-002 | AJ321: =H321+100*O321 -> 126.31 | AK321: 125.3 | AL321: 81 | AM321: 21.2 | AN321: 13 | AO321: 7.6999999999999999e-002 | AP321: 15 | AQ321: 广汽转债!
A322: 288 | B322: 123022 | C322: 长信转债!! | D322: 300088 | E322: 长信科技 | F322: 通信互联 | G322: 通信设备 | H322: 142.49 | I322: -5.6000000000000008e-003 | J322: 4.5999999999999999e-003 | K322: 8 | L322: -1.1999999999999999e-003 | M322: 114.3 | N322: 6.05 | O322: 7.8e-002 | P322: 132.23 | Q322: 转股中 | R322: 3.71年 | S322: 1.71年 | T322: 2.57 | U322: 8 | V322: 2.2000000000000002e-002 | W322: 1.3000000000000001e-002 | X322: 1.7000000000000001e-002 | Y322: 196 | Z322: 2.72 | AA322: -5.8700000000000002e-002 | AB322: -6.5000000000000002e-002 | AC322: -0.13300000000000001 | AD322: -0.13500000000000001 | AE322: 95.12 | AF322: 98.2 | AG322: 0.82 | AH322: AA | AI322: 4.2599999999999999e-002 | AJ322: =H322+100*O322 -> 150.29000000000002 | AK322: 152.7 | AL322: 298 | AM322: 54.5 | AN322: 272 | AO322: -2.7999999999999997e-002 | AP322: 12 | AQ322: 长信转债!!
A323: 197 | B323: 128103 | C323: 同德转债! | D323: 2360 | E323: 同德化工 | F323: 化工 | G323: 化工 | H323: 161.334 | I323: 7.6e-003 | J323: 5.6999999999999993e-003 | K323: 7.65 | L323: 1.32e-002 | M323: 121.3 | N323: 5.08 | O323: 7.0999999999999994e-002 | P323: 150.59 | Q323: 转股中 | R323: 4.73年 | S323: 2.73年 | T323: 1.09 | U323: 161 | V323: 0.90599999999999992 | W323: 3.6000000000000004e-002 | X323: 5.4000000000000006e-002 | Y323: 30 | Z323: 2.38 | AA323: -5.9699999999999996e-002 | AB323: -6.6699999999999995e-002 | AC323: -0.13900000000000001 | AD323: -0.14099999999999999 | AE323: 84.78 | AF323: 87 | AG323: 1 | AH323: A+ | AI323: 7.46e-002 | AJ323: =H323+100*O323 -> 168.434 | AK323: 172.1 | AL323: 331 | AM323: 85.1 | AN323: 336 | AO323: 2.7000000000000003e-002 | AP323: 13 | AQ323: 同德转债!
A324: 339 | B324: 128033 | C324: 迪龙转债! | D324: 2658 | E324: 雪迪龙 | F324: 城市公用 | G324: 三废处理 | H324: 127.18 | I324: 9.300000000000001e-003 | J324: -7.4999999999999997e-003 | K324: 8.78 | L324: 3.4000000000000002e-003 | M324: 108.8 | N324: 8.71 | O324: 0.26200000000000001 | P324: 100.8 | Q324: 转股中 | R324: 2.49年 | S324: 0.49年 | T324: 2.98 | U324: 171 | V324: 0.45200000000000001 | W324: 5.4000000000000006e-002 | X324: 5.4000000000000006e-002 | Y324: 55 | Z324: 2.32 | AA324: -6.1699999999999998e-002 | AB324: -6.7699999999999996e-002 | AC324: -0.32100000000000001 | AD324: -0.32400000000000001 | AE324: 98.94 | AF324: 98.65 | AG324: 0.53 | AH324: AA | AI324: 4.0800000000000003e-002 | AJ324: =H324+100*O324 -> 153.38 | AK324: 153.6 | AL324: 302 | AM324: 54.6 | AN324: 273 | AO324: -8.5999999999999993e-002 | AP324: 34 | AQ324: 迪龙转债!
A325: 243 | B325: 113548 | C325: 石英转债! | D325: 603688 | E325: 石英股份 | F325: 电子 | G325: 电子产品 | H325: 163.71 | I325: -6.0999999999999995e-003 | J325: 8.6999999999999994e-003 | K325: 23.2 | L325: 3.0000000000000001e-003 | M325: 124.4 | N325: 14.93 | O325: 5.4000000000000006e-002 | P325: 155.39 | Q325: 转股中 | R325: 4.32年 | S325: 2.32年 | T325: 1.23 | U325: 23 | V325: 0.113 | W325: 1.4999999999999999e-002 | X325: 2.3e-002 | Y325: 82 | Z325: 4.15 | AA325: -6.2899999999999998e-002 | AB325: -7.1399999999999991e-002 | AC325: -0.121 | AD325: -0.122 | AE325: 89.65 | AF325: 95.95 | AG325: 0.86 | AH325: AA- | AI325: 6.3600000000000004e-002 | AJ325: =H325+100*O325 -> 169.11000000000001 | AK325: 172 | AL325: 330 | AM325: 76.1 | AN325: 326 | AO325: 3.5000000000000003e-002 | AP325: 13 | AQ325: 石英转债!
A326: 78 | B326: 113611 | C326: 福20转债! | D326: 603806 | E326: 福斯特 | F326: 能源电力 | G326: 太阳能 | H326: 161.24 | I326: -5.0499999999999996e-002 | J326: 2.8999999999999998e-003 | K326: 99 | L326: -4.7599999999999996e-002 | M326: 111.85 | N326: 61.03 | O326: -6.0000000000000001e-003 | P326: 162.22 | Q326: 转股中 | R326: 5.41年 | S326: 3.42年 | T326: 13.3 | U326: 496 | V326: 0.22800000000000001 | W326: 1.4999999999999999e-002 | X326: 2.4e-002 | Y326: 916 | Z326: 8.32 | AA326: -6.6100000000000006e-002 | AB326: -6.9699999999999998e-002 | AC326: -0.11599999999999999 | AD326: -0.11699999999999999 | AE326: 88.07 | AF326: 88.9 | AG326: 1 | AH326: AA | AI326: 4.4000000000000004e-002 | AJ326: =H326+100*O326 -> 160.64000000000001 | AK326: 160.3 | AL326: 319 | AM326: 71.4 | AN326: 317 | AO326: 8.5000000000000006e-002 | AP326: 5 | AQ326: 福20转债!
A327: 169 | B327: 123054 | C327: 思特转债!! | D327: 300608 | E327: 思特奇 | F327: 通信互联 | G327: 通信设备 | H327: 171.3 | I327: 6.0000000000000001e-003 | J327: 8.7400000000000005e-002 | K327: 18.25 | L327: 0.111 | M327: 121.2 | N327: 12.63 | O327: 0.185 | P327: 144.5 | Q327: 转股中 | R327: 4.94年 | S327: 2.94年 | T327: 2.08 | U327: 5002. | V327: 13.81 | W327: 5.5999999999999994e-002 | X327: 8.0000000000000002e-002 | Y327: 37 | Z327: 3.75 | AA327: -6.8900000000000003e-002 | AB327: -7.5499999999999998e-002 | AC327: -0.14599999999999999 | AD327: -0.14800000000000002 | AE327: 86.13 | AF327: 89.99 | AG327: 0.84 | AH327: AA- | AI327: 6.3600000000000004e-002 | AJ327: =H327+100*O327 -> 189.80000000000001 | AK327: 198.1 | AL327: 347 | AM327: 108.1 | AN327: 347 | AO327: 5.5999999999999994e-002 | AP327: 20 | AQ327: 思特转债!!
A328: 191 | B328: 113034 | C328: 滨化转债! | D328: 601678 | E328: 滨化股份 | F328: 化工 | G328: 化工 | H328: 164.95 | I328: -8.5000000000000006e-003 | J328: 4.8999999999999998e-003 | K328: 7.58 | L328: -3.9000000000000003e-003 | M328: 114.8 | N328: 4.58 | O328: -3.0000000000000001e-003 | P328: 165.5 | Q328: 转股中 | R328: 4.77年 | S328: 2.77年 | T328: 5.02 | U328: 83 | V328: 0.10000000000000001 | W328: 3.4000000000000002e-002 | X328: 5.7000000000000002e-002 | Y328: 146 | Z328: 1.65 | AA328: -7.4299999999999991e-002 | AB328: -7.9199999999999993e-002 | AC328: -0.14499999999999999 | AD328: -0.14699999999999999 | AE328: 91.47 | AF328: 94.43 | AG328: 0.92 | AH328: AA | AI328: 4.2599999999999999e-002 | AJ328: =H328+100*O328 -> 164.64999999999998 | AK328: 164.4 | AL328: 324 | AM328: 70 | AN328: 313 | AO328: 8.6999999999999994e-002 | AP328: 23 | AQ328: 滨化转债!
A329: 127 | B329: 110074 | C329: 精达转债!! | D329: 600577 | E329: 精达股份 | F329: 电子 | G329: 电子产品 | H329: 173.48 | I329: -1.06e-002 | J329: -3.8e-003 | K329: 6.24 | L329: -1.5800000000000002e-002 | M329: 117.3 | N329: 3.73 | O329: 3.7000000000000005e-002 | P329: 167.29 | Q329: 转股中 | R329: 5年47天 | S329: 3年48天 | T329: 6.85 | U329: 146 | V329: 0.12300000000000001 | W329: 5.7000000000000002e-002 | X329: 9.6000000000000002e-002 | Y329: 120 | Z329: 3.16 | AA329: -7.4700000000000003e-002 | AB329: -8.0000000000000002e-002 | AC329: -0.14099999999999999 | AD329: -0.14300000000000002 | AE329: 90.21 | AF329: 94.49 | AG329: 0.91 | AH329: AA | AI329: 4.4000000000000004e-002 | AJ329: =H329+100*O329 -> 177.17999999999998 | AK329: 179.7 | AL329: 338 | AM329: 85.2 | AN329: 337 | AO329: 4.0000000000000001e-002 | AP329: 12 | AQ329: 精达转债!!
A330: 362 | B330: 113012 | C330: 骆驼转债! | D330: 601311 | E330: 骆驼股份 | F330: 汽车 | G330: 零部件制 | H330: 122.45 | I330: -1.0700000000000001e-002 | J330: 1.32e-002 | K330: 11.19 | L330: 3.5999999999999999e-003 | M330: 106.5 | N330: 10.06 | O330: 0.10099999999999999 | P330: 111.23 | Q330: 转股中 | R330: 1.73年 | S330: 回售内 | T330: 5.09 | U330: 3.8 | V330: 6.0000000000000001e-003 | W330: 4.0999999999999995e-002 | X330: 4.4999999999999998e-002 | Y330: 126 | Z330: 1.66 | AA330: -7.8299999999999995e-002 | AB330: -8.4700000000000011e-002 | AC330: 回售内 | AD330: 回售内 | AE330: 100.25 | AF330: 99.45 | AG330: 0.7 | AH330: AA | AI330: 4.0800000000000003e-002 | AJ330: =H330+100*O330 -> 132.55000000000001 | AK330: 133.7 | AL330: 188 | AM330: 33.4 | AN330: 104 | AO330: -1.2e-002 | AP330: 15 | AQ330: 骆驼转债!
A331: 167 | B331: 128113 | C331: 比音转债! | D331: 2832 | E331: 比音勒芬 | F331: 服装纺织 | G331: 服装行业 | H331: 174.002 | I331: -1.06e-002 | J331: -2.0000000000000001e-004 | K331: 25.48 | L331: -1.1599999999999999e-002 | M331: 116.9 | N331: 14.9 | O331: 1.8000000000000002e-002 | P331: 171.01 | Q331: 转股中 | R331: 4.95年 | S331: 2.95年 | T331: 3.05 | U331: 56 | V331: 0.105 | W331: 2.2000000000000002e-002 | X331: 3.7000000000000005e-002 | Y331: 139 | Z331: 5.26 | AA331: -7.8399999999999997e-002 | AB331: -8.3699999999999997e-002 | AC331: -0.151 | AD331: -0.152 | AE331: 90.88 | AF331: 95.44 | AG331: 0.93 | AH331: AA | AI331: 4.2599999999999999e-002 | AJ331: =H331+100*O331 -> 175.80200000000002 | AK331: 177 | AL331: 334 | AM331: 81.6 | AN331: 333 | AO331: 5.2000000000000005e-002 | AP331: 8 | AQ331: 比音转债!
A332: 48 | B332: 123094 | C332: 星源转2! | D332: 300568 | E332: 星源材质 | F332: 电子 | G332: 电子行业 | H332: 190.296 | I332: 6.3e-003 | J332: 8.5000000000000006e-003 | K332: 41.33 | L332: 1.55e-002 | M332: 117.3 | N332: 19.64 | O332: -9.6000000000000002e-002 | P332: 210.44 | Q332: 24天 | R332: 5.55年 | S332: 3.55年 | T332: 10 | U332: 610 | V332: 0.32100000000000001 | W332: 3.4000000000000002e-002 | X332: 7.0999999999999994e-002 | Y332: 297 | Z332: 6.13 | AA332: -8.48e-002 | AB332: -8.9499999999999996e-002 | AC332: -0.14499999999999999 | AD332: -0.14599999999999999 | AE332: 88.58 | AF332: 92.79 | AG332: 0.96 | AH332: AA | AI332: 4.4000000000000004e-002 | AJ332: =H332+100*O332 -> 180.696 | AK332: 170.2 | AL332: 329 | AM332: 77.4 | AN332: 329 | AO332: -0.109 | AP332: 5 | AQ332: 星源转2!
A333: 241 | B333: 123034 | C333: 通光转债! | D333: 300265 | E333: 通光线缆 | F333: 通信互联 | G333: 通信设备 | H333: 172.598 | I333: -1.6000000000000001e-003 | J333: -8.0000000000000004e-004 | K333: 8.75 | L333: -3.4000000000000002e-003 | M333: 118 | N333: 7.95 | O333: 0.56799999999999995 | P333: 110.06 | Q333: 转股中 | R333: 4.34年 | S333: 2.34年 | T333: 0.78 | U333: 36 | V333: 0.26300000000000001 | W333: 2.4e-002 | X333: 2.7000000000000003e-002 | Y333: 32 | Z333: 2.46 | AA333: -8.539999999999999e-002 | AB333: -9.1700000000000004e-002 | AC333: -0.13200000000000001 | AD333: -0.13400000000000001 | AE333: 86.59 | AF333: 86.95 | AG333: 0.71 | AH333: A+ | AI333: 7.46e-002 | AJ333: =H333+100*O333 -> 229.39800000000002 | AK333: 235.1 | AL333: 351 | AM333: 148.2 | AN333: 353 | AO333: -4.2000000000000003e-002 | AP333: 20 | AQ333: 通光转债!
A334: 251 | B334: 113545 | C334: 金能转债! | D334: 603113 | E334: 金能科技 | F334: 煤炭 | G334: 炼焦 | H334: 167.6 | I334: -8.1000000000000013e-003 | J334: 2.8999999999999998e-003 | K334: 17.5 | L334: -5.6999999999999993e-003 | M334: 114.9 | N334: 10.43 | O334: -1.e-003 | P334: 167.79 | Q334: 转股中 | R334: 4.28年 | S334: 2.28年 | T334: 10.2 | U334: 43 | V334: 2.5000000000000001e-002 | W334: 6.9000000000000006e-002 | X334: 0.115 | Y334: 149 | Z334: 1.79 | AA334: -8.5900000000000004e-002 | AB334: -9.1199999999999989e-002 | AC334: -0.13 | AD334: -0.13200000000000001 | AE334: 93.45 | AF334: 96.47 | AG334: 0.92 | AH334: AA | AI334: 4.2599999999999999e-002 | AJ334: =H334+100*O334 -> 167.5 | AK334: 167.4 | AL334: 326 | AM334: 70.9 | AN334: 316 | AO334: -5.2000000000000005e-002 | AP334: 16 | AQ334: 金能转债!
A335: 256 | B335: 123030 | C335: 九洲转债! | D335: 300040 | E335: 九洲集团 | F335: 能源电力 | G335: 电力设备 | H335: 175.7 | I335: 1.5600000000000001e-002 | J335: 7.4000000000000003e-003 | K335: 9.09 | L335: 2.6000000000000002e-002 | M335: 120 | N335: 5.65 | O335: 9.1999999999999998e-002 | P335: 160.88 | Q335: 转股中 | R335: 4年48天 | S335: 2年49天 | T335: 0.97 | U335: 356 | V335: 2.0699999999999998 | W335: 2.7999999999999997e-002 | X335: 4.4999999999999998e-002 | Y335: 35 | Z335: 1.55 | AA335: -8.9700000000000002e-002 | AB335: -9.6999999999999989e-002 | AC335: -0.153 | AD335: -0.154 | AE335: 89.98 | AF335: 93.55 | AG335: 0.89 | AH335: AA- | AI335: 6.3600000000000004e-002 | AJ335: =H335+100*O335 -> 184.89999999999998 | AK335: 190.5 | AL335: 342 | AM335: 97 | AN335: 343 | AO335: -5.5999999999999994e-002 | AP335: 24 | AQ335: 九洲转债!
A336: 237 | B336: 113550 | C336: 常汽转债! | D336: 603035 | E336: 常熟汽饰 | F336: 汽车 | G336: 零部件制 | H336: 182.16 | I336: -2.07e-002 | J336: -6.3e-003 | K336: 17.1 | L336: -2.8999999999999998e-002 | M336: 121.3 | N336: 9.33 | O336: -6.0000000000000001e-003 | P336: 183.28 | Q336: 转股中 | R336: 4.38年 | S336: 2.38年 | T336: 2.3 | U336: 1024. | V336: 2.3999999999999999 | W336: 3.7999999999999999e-002 | X336: 7.0000000000000007e-002 | Y336: 60 | Z336: 1.6 | AA336: -9.0500000000000011e-002 | AB336: -9.7699999999999995e-002 | AC336: -0.13900000000000001 | AD336: -0.14000000000000001 | AE336: 89.26 | AF336: 93.25 | AG336: 0.93 | AH336: AA- | AI336: 6.3600000000000004e-002 | AJ336: =H336+100*O336 -> 181.56 | AK336: 181 | AL336: 340 | AM336: 87.8 | AN336: 338 | AO336: 9.4e-002 | AP336: 16 | AQ336: 常汽转债!
A337: 267 | B337: 113537 | C337: 文灿转债!! | D337: 603348 | E337: 文灿股份 | F337: 汽车 | G337: 零部件制 | H337: 174.63 | I337: -2.18e-002 | J337: 1.01e-002 | K337: 33.35 | L337: -1.2699999999999999e-002 | M337: 120.7 | N337: 19.28 | O337: 1.e-002 | P337: 172.98 | Q337: 转股中 | R337: 3.94年 | S337: 1.94年 | T337: 1.41 | U337: 145 | V337: 0.58999999999999997 | W337: 1.6e-002 | X337: 2.7999999999999997e-002 | Y337: 87 | Z337: 3.36 | AA337: -9.1199999999999989e-002 | AB337: -9.9000000000000005e-002 | AC337: -0.16899999999999998 | AD337: -0.17100000000000001 | AE337: 91.09 | AF337: 95.19 | AG337: 0.92 | AH337: AA- | AI337: 6.3600000000000004e-002 | AJ337: =H337+100*O337 -> 175.63 | AK337: 176.3 | AL337: 333 | AM337: 81.1 | AN337: 332 | AO337: 2.9999999999999999e-002 | AP337: 24 | AQ337: 文灿转债!!
A338: 315 | B338: 123014 | C338: 凯发转债! | D338: 300407 | E338: 凯发电气 | F338: 能源电力 | G338: 电力设备 | H338: 132.2 | I338: 3.0000000000000001e-003 | J338: 1.7000000000000001e-003 | K338: 7.2 | L338: 1.1200000000000002e-002 | M338: 108.5 | N338: 8.05 | O338: 0.47799999999999998 | P338: 89.44 | Q338: 转股中 | R338: 2年25天 | S338: 25天 | T338: 1.16 | U338: 55 | V338: 0.36099999999999999 | W338: 5.2999999999999999e-002 | X338: 4.7e-002 | Y338: 22 | Z338: 1.61 | AA338: -9.2399999999999996e-002 | AB338: -9.9100000000000008e-002 | AC338: -1.0800000000000001 | AD338: -1.0880000000000001 | AE338: 99.6 | AF338: 94.05 | AG338: 0.42 | AH338: A+ | AI338: 7.2800000000000004e-002 | AJ338: =H338+100*O338 -> 180. | AK338: 175 | AL338: 332 | AM338: 75.4 | AN338: 325 | AO338: 2.4e-002 | AP338: 15 | AQ338: 凯发转债!
A339: 305 | B339: 128050 | C339: 钧达转债!! | D339: 2865 | E339: 钧达股份 | F339: 汽车 | G339: 零部件制 | H339: 173 | I339: 0.183 | J339: -8.3100000000000007e-002 | K339: 22.95 | L339: 0.10000000000000001 | M339: 122.7 | N339: 14.8 | O339: 0.11599999999999999 | P339: 155.07 | Q339: 转股中 | R339: 3.44年 | S339: 1.44年 | T339: 1.4 | U339: 3139. | V339: 12.73 | W339: 4.5999999999999999e-002 | X339: 7.2000000000000008e-002 | Y339: 30 | Z339: 2.84 | AA339: -9.6699999999999994e-002 | AB339: -0.106 | AC339: -0.23600000000000002 | AD339: -0.23800000000000002 | AE339: 93.4 | AF339: 99.7 | AG339: 1 | AH339: AA- | AI339: 6.3600000000000004e-002 | AJ339: =H339+100*O339 -> 184.59999999999999 | AK339: 190.9 | AL339: 343 | AM339: 91.2 | AN339: 340 | AO339: 0.22 | AP339: 50 | AQ339: 钧达转债!!
A340: 346 | B340: 128026 | C340: 众兴转债! | D340: 2772 | E340: 众兴菌业 | F340: 农业 | G340: 种植业 | H340: 140.7 | I340: -1.47e-002 | J340: 1.3000000000000001e-002 | K340: 16.05 | L340: -1.9e-003 | M340: 109.3 | N340: 11.36 | O340: -4.0000000000000001e-003 | P340: 141.29 | Q340: 转股中 | R340: 2.45年 | S340: 0.45年 | T340: 4.73 | U340: 1763. | V340: 2.6000000000000001 | W340: 8.0000000000000002e-002 | X340: 0.113 | Y340: 59 | Z340: 2.29 | AA340: -9.9499999999999991e-002 | AB340: -0.106 | AC340: -0.46899999999999997 | AD340: -0.47299999999999998 | AE340: 98.12 | AF340: 94.63 | AG340: 0.91 | AH340: AA- | AI340: 6.1799999999999994e-002 | AJ340: =H340+100*O340 -> 140.29999999999998 | AK340: 140.1 | AL340: 251 | AM340: 42 | AN340: 192 | AO340: 0.51600000000000001 | AP340: 58 | AQ340: 众兴转债!
A341: 368 | B341: 110033 | C341: 国贸转债! | D341: 600755 | E341: 厦门国贸 | F341: 交通运输 | G341: 交通运输 | H341: 114.65 | I341: -3.4000000000000002e-003 | J341: 2.0000000000000001e-004 | K341: 8.01 | L341: -5.0000000000000001e-003 | M341: 108 | N341: 7.18 | O341: 2.7999999999999997e-002 | P341: 111.56 | Q341: 转股中 | R341: 0.51年 | S341: 回售内 | T341: 11.7 | U341: 17 | V341: 1.3000000000000001e-002 | W341: 7.4999999999999997e-002 | X341: 8.3000000000000004e-002 | Y341: 156 | Z341: 0.97 | AA341: -0.11 | AB341: -0.13600000000000001 | AC341: 回售内 | AD341: 回售内 | AE341: 100.33 | AF341: 106.26 | AG341: 0.65 | AH341: AAA | AI341: 3.2199999999999999e-002 | AJ341: =H341+100*O341 -> 117.45 | AK341: 117.7 | AL341: 24 | AM341: 11.5 | AN341: 3 | AO341: 0. | AP341: 19 | AQ341: 国贸转债!
A342: 334 | B342: 113504 | C342: 艾华转债!! | D342: 603989 | E342: 艾华集团 | F342: 电子 | G342: 元器件制 | H342: 151.65 | I342: -5.1000000000000004e-003 | J342: -4.4000000000000003e-003 | K342: 31.24 | L342: -1.01e-002 | M342: 109.3 | N342: 20.81 | O342: 1.e-002 | P342: 150.12 | Q342: 转股中 | R342: 2.66年 | S342: 0.67年 | T342: 4.9 | U342: 22 | V342: 2.9999999999999999e-002 | W342: 3.9e-002 | X342: 5.9000000000000004e-002 | Y342: 125 | Z342: 4.64 | AA342: -0.11699999999999999 | AB342: -0.12300000000000001 | AC342: -0.40299999999999997 | AD342: -0.40600000000000003 | AE342: 98.48 | AF342: 98.43 | AG342: 0.93 | AH342: AA | AI342: 4.0800000000000003e-002 | AJ342: =H342+100*O342 -> 152.65000000000001 | AK342: 153.2 | AL342: 300 | AM342: 54.7 | AN342: 274 | AO342: 2.e-002 | AP342: 8 | AQ342: 艾华转债!!
A343: 275 | B343: 113534 | C343: 鼎胜转债!! | D343: 603876 | E343: 鼎胜新材 | F343: 有色金属 | G343: 小金属 | H343: 182.12 | I343: -2.6699999999999998e-002 | J343: 8.1000000000000013e-003 | K343: 27.82 | L343: -1.9400000000000001e-002 | M343: 114.3 | N343: 15.18 | O343: -6.0000000000000001e-003 | P343: 183.27 | Q343: 转股中 | R343: 3.77年 | S343: 1.77年 | T343: 6.24 | U343: 395 | V343: 0.34399999999999997 | W343: 5.2000000000000005e-002 | X343: 9.5000000000000001e-002 | Y343: 121 | Z343: 3.33 | AA343: -0.11800000000000001 | AB343: -0.124 | AC343: -0.20199999999999999 | AD343: -0.20300000000000001 | AE343: 91.31 | AF343: 91 | AG343: 0.96 | AH343: AA- | AI343: 6.3600000000000004e-002 | AJ343: =H343+100*O343 -> 181.52000000000001 | AK343: 181 | AL343: 339 | AM343: 89.7 | AN343: 339 | AO343: 0.14199999999999999 | AP343: 34 | AQ343: 鼎胜转债!!
A344: 200 | B344: 123046 | C344: 天铁转债! | D344: 300587 | E344: 天铁股份 | F344: 铁路 | G344: 铁路设备 | H344: 212.2 | I344: -1.43e-002 | J344: 7.1999999999999998e-003 | K344: 21.52 | L344: -7.4000000000000003e-003 | M344: 117.7 | N344: 10.12 | O344: -2.e-003 | P344: 212.65 | Q344: 转股中 | R344: 4.71年 | S344: 2.71年 | T344: 0.62 | U344: 83 | V344: 0.621 | W344: 8.0000000000000002e-003 | X344: 1.8000000000000002e-002 | Y344: 74 | Z344: 4.52 | AA344: -0.12 | AB344: -0.125 | AC344: -0.14099999999999999 | AD344: -0.14199999999999999 | AE344: 86.91 | AF344: 88.59 | AG344: 0.96 | AH344: AA- | AI344: 6.3600000000000004e-002 | AJ344: =H344+100*O344 -> 212. | AK344: 211.8 | AL344: 348 | AM344: 123.2 | AN344: 349 | AO344: 5.0000000000000001e-003 | AP344: 13 | AQ344: 天铁转债!
A345: 289 | B345: 110055 | C345: 伊力转债!! | D345: 600197 | E345: 伊力特 | F345: 食品饮料 | G345: 白酒 | H345: 184.67 | I345: -3.4099999999999998e-002 | J345: -4.5999999999999999e-003 | K345: 28.87 | L345: -4.0899999999999999e-002 | M345: 114.3 | N345: 16.81 | O345: 7.4999999999999997e-002 | P345: 171.74 | Q345: 转股中 | R345: 3.70年 | S345: 1.70年 | T345: 2.44 | U345: 539 | V345: 1.1899999999999999 | W345: 1.8000000000000002e-002 | X345: 3.1e-002 | Y345: 136 | Z345: 3.79 | AA345: -0.12300000000000001 | AB345: -0.129 | AC345: -0.215 | AD345: -0.217 | AE345: 95.15 | AF345: 98.24 | AG345: 0.95 | AH345: AA | AI345: 4.2599999999999999e-002 | AJ345: =H345+100*O345 -> 192.16999999999999 | AK345: 197.6 | AL345: 346 | AM345: 99.4 | AN345: 346 | AO345: -9.6000000000000002e-002 | AP345: 22 | AQ345: 伊力转债!!
A346: 259 | B346: 113543 | C346: 欧派转债!* | D346: 603833 | E346: 欧派家居 | F346: 其他 | G346: 家居用品 | H346: 196.49 | I346: -4.8300000000000003e-002 | J346: -1.5e-003 | K346: 139.2 | L346: -4.9800000000000004e-002 | M346: 114.9 | N346: 70.49 | O346: -5.0000000000000001e-003 | P346: 197.47 | Q346: 转股中 | R346: 4年44天 | S346: 3年45天 | T346: 2.06 | U346: 77 | V346: 0.18600000000000003 | W346: 2.e-003 | X346: 5.0000000000000001e-003 | Y346: 841 | Z346: 6.92 | AA346: -0.124 | AB346: -0.129 | AC346: -0.10400000000000001 | AD346: -0.105 | AE346: 91.96 | AF346: 97.12 | AG346: 1 | AH346: AA | AI346: 4.2599999999999999e-002 | AJ346: =H346+100*O346 -> 195.99000000000001 | AK346: 195.5 | AL346: 344 | AM346: 98.4 | AN346: 345 | AO346: -7.0999999999999994e-002 | AP346: 12 | AQ346: 欧派转债!*
A347: 274 | B347: 113025 | C347: 明泰转债!! | D347: 601677 | E347: 明泰铝业 | F347: 有色金属 | G347: 铝金属 | H347: 189 | I347: -8.6e-003 | J347: -1.1200000000000002e-002 | K347: 19.97 | L347: -2.06e-002 | M347: 114.5 | N347: 11 | O347: 4.0999999999999995e-002 | P347: 181.55 | Q347: 转股中 | R347: 3.77年 | S347: 1.77年 | T347: 11 | U347: 103 | V347: 4.9000000000000002e-002 | W347: 8.1000000000000003e-002 | X347: 0.14599999999999999 | Y347: 136 | Z347: 1.51 | AA347: -0.126 | AB347: -0.13200000000000001 | AC347: -0.21100000000000002 | AD347: -0.21299999999999999 | AE347: 94.9 | AF347: 98.12 | AG347: 0.96 | AH347: AA | AI347: 4.2599999999999999e-002 | AJ347: =H347+100*O347 -> 193.09999999999999 | AK347: 196.5 | AL347: 345 | AM347: 98.3 | AN347: 344 | AO347: 3.5000000000000003e-002 | AP347: 23 | AQ347: 明泰转债!!
A348: 342 | B348: 128032 | C348: 双环转债!!* | D348: 2472 | E348: 双环传动 | F348: 机械装备 | G348: 通用设备 | H348: 153 | I348: 2.3399999999999997e-002 | J348: -7.4000000000000003e-003 | K348: 15.19 | L348: 1.61e-002 | M348: 109.3 | N348: 9.87 | O348: -6.0000000000000001e-003 | P348: 153.9 | Q348: 转股中 | R348: 2.48年 | S348: 0.48年 | T348: 4.47 | U348: 402 | V348: 0.59899999999999998 | W348: 4.0999999999999995e-002 | X348: 6.3e-002 | Y348: 110 | Z348: 2.98 | AA348: -0.129 | AB348: -0.13400000000000001 | AC348: -0.53600000000000003 | AD348: -0.54000000000000004 | AE348: 99.2 | AF348: 99.15 | AG348: 1 | AH348: AA | AI348: 4.0800000000000003e-002 | AJ348: =H348+100*O348 -> 152.40000000000001 | AK348: 152.1 | AL348: 296 | AM348: 52.9 | AN348: 265 | AO348: 0.11199999999999999 | AP348: 37 | AQ348: 双环转债!!*
A349: 338 | B349: 123007 | C349: 道氏转债! | D349: 300409 | E349: 道氏技术 | F349: 建筑 | G349: 建筑行业 | H349: 157 | I349: -6.3e-003 | J349: 5.1000000000000004e-003 | K349: 22.67 | L349: -1.2999999999999999e-003 | M349: 110.3 | N349: 14.5 | O349: 4.0000000000000001e-003 | P349: 156.34 | Q349: 转股中 | R349: 2.49年 | S349: 0.49年 | T349: 2.39 | U349: 922 | V349: 2.4300000000000002 | W349: 1.9e-002 | X349: 2.9999999999999999e-002 | Y349: 126 | Z349: 3.42 | AA349: -0.13400000000000001 | AB349: -0.14000000000000001 | AC349: -0.55600000000000005 | AD349: -0.55899999999999994 | AE349: 97.88 | AF349: 95.26 | AG349: 0.95 | AH349: AA- | AI349: 6.1799999999999994e-002 | AJ349: =H349+100*O349 -> 157.40000000000001 | AK349: 157.7 | AL349: 314 | AM349: 59.8 | AN349: 297 | AO349: 0.33700000000000002 | AP349: 23 | AQ349: 道氏转债!
A350: 180 | B350: 113580 | C350: 康隆转债! | D350: 603665 | E350: 康隆达 | F350: 服装纺织 | G350: 服装行业 | H350: 247.49 | I350: 6.4000000000000003e-003 | J350: -4.7999999999999996e-003 | K350: 14.51 | L350: 2.8000000000000004e-003 | M350: 120.8 | N350: 15.51 | O350: 1.6499999999999999 | P350: 93.55 | Q350: 转股中 | R350: 4.81年 | S350: 2.81年 | T350: 0.41 | U350: 738 | V350: 6.9500000000000002 | W350: 1.8000000000000002e-002 | X350: 1.7000000000000001e-002 | Y350: 23 | Z350: 2.11 | AA350: -0.14099999999999999 | AB350: -0.14699999999999999 | AC350: -0.153 | AD350: -0.154 | AE350: 86.5 | AF350: 90.39 | AG350: 0.56 | AH350: AA- | AI350: 6.3600000000000004e-002 | AJ350: =H350+100*O350 -> 412.49000000000001 | AK350: 401.4 | AL350: 363 | AM350: 311 | AN350: 365 | AO350: -3.2000000000000001e-002 | AP350: 9 | AQ350: 康隆转债!
A351: 215 | B351: 128097 | C351: 奥佳转债! | D351: 2614 | E351: 奥佳华 | F351: 机械装备 | G351: 专用设备 | H351: 232.5 | I351: -1.8000000000000002e-002 | J351: 2.2099999999999998e-002 | K351: 23.68 | L351: 4.1999999999999997e-003 | M351: 114.9 | N351: 10.39 | O351: 2.e-002 | P351: 227.91 | Q351: 转股中 | R351: 4.65年 | S351: 2.65年 | T351: 4.6 | U351: 138 | V351: 0.127 | W351: 3.1e-002 | X351: 7.0999999999999994e-002 | Y351: 148 | Z351: 3.23 | AA351: -0.14300000000000002 | AB351: -0.14699999999999999 | AC351: -0.158 | AD351: -0.159 | AE351: 92.03 | AF351: 95 | AG351: 0.97 | AH351: AA | AI351: 4.2599999999999999e-002 | AJ351: =H351+100*O351 -> 234.5 | AK351: 237.1 | AL351: 352 | AM351: 142.1 | AN351: 352 | AO351: 0.14999999999999999 | AP351: 20 | AQ351: 奥佳转债!
A352: 356 | B352: 128017 | C352: 金禾转债!! | D352: 2597 | E352: 金禾实业 | F352: 化工 | G352: 化工 | H352: 157.12 | I352: -2.5899999999999999e-002 | J352: -1.6e-002 | K352: 33.06 | L352: -4.4800000000000006e-002 | M352: 108.8 | N352: 21.97 | O352: 4.4000000000000004e-002 | P352: 150.48 | Q352: 转股中 | R352: 2.33年 | S352: 0.33年 | T352: 5.52 | U352: 47 | V352: 5.5e-002 | W352: 2.9999999999999999e-002 | X352: 4.4999999999999998e-002 | Y352: 185 | Z352: 3.7 | AA352: -0.14800000000000002 | AB352: -0.153 | AC352: -0.745 | AD352: -0.74900000000000011 | AE352: 99.54 | AF352: 99.26 | AG352: 0.94 | AH352: AA | AI352: 4.0800000000000003e-002 | AJ352: =H352+100*O352 -> 161.52000000000001 | AK352: 163.8 | AL352: 323 | AM352: 64.2 | AN352: 306 | AO352: -2.2000000000000002e-002 | AP352: 9 | AQ352: 金禾转债!!
A353: 178 | B353: 113582 | C353: 火炬转债! | D353: 603678 | E353: 火炬电子 | F353: 电子 | G353: 元器件制 | H353: 275.93 | I353: -4.8999999999999998e-003 | J353: -2.3799999999999998e-002 | K353: 66.1 | L353: -2.92e-002 | M353: 114.9 | N353: 25.33 | O353: 5.7000000000000002e-002 | P353: 260.96 | Q353: 转股中 | R353: 4.90年 | S353: 2.90年 | T353: 4.18 | U353: 186 | V353: 0.16300000000000001 | W353: 1.3999999999999999e-002 | X353: 3.6000000000000004e-002 | Y353: 304 | Z353: 7.48 | AA353: -0.16600000000000001 | AB353: -0.17000000000000001 | AC353: -0.158 | AD353: -0.159 | AE353: 91.07 | AF353: 94.02 | AG353: 0.98 | AH353: AA | AI353: 4.2599999999999999e-002 | AJ353: =H353+100*O353 -> 281.63 | AK353: 290.9 | AL353: 356 | AM353: 196.9 | AN353: 356 | AO353: 4.9000000000000002e-002 | AP353: 6 | AQ353: 火炬转债!
A354: 301 | B354: 123018 | C354: 溢利转债! | D354: 300381 | E354: 溢多利 | F354: 医药 | G354: 原料药 | H354: 214.22 | I354: 1.e-003 | J354: -9.8999999999999991e-003 | K354: 9.47 | L354: -1.2500000000000001e-002 | M354: 114.3 | N354: 8.32 | O354: 0.88200000000000001 | P354: 113.82 | Q354: 转股中 | R354: 3.47年 | S354: 1.47年 | T354: 0.54 | U354: 35 | V354: 0.30199999999999999 | W354: 1.2e-002 | X354: 1.3000000000000001e-002 | Y354: 46 | Z354: 1.54 | AA354: -0.16800000000000001 | AB354: -0.17399999999999999 | AC354: -0.29799999999999999 | AD354: -0.29899999999999999 | AE354: 93.02 | AF354: 92.71 | AG354: 0.71 | AH354: AA- | AI354: 6.3600000000000004e-002 | AJ354: =H354+100*O354 -> 302.42000000000002 | AK354: 314.6 | AL354: 357 | AM354: 221.6 | AN354: 357 | AO354: -4.0000000000000001e-003 | AP354: 11 | AQ354: 溢利转债!
A355: 168 | B355: 128111 | C355: 中矿转债! | D355: 2738 | E355: 中矿资源 | F355: 有色金属 | G355: 有色行业 | H355: 315 | I355: 6.2400000000000004e-002 | J355: 3.5699999999999996e-002 | K355: 47.93 | L355: 0.10000000000000001 | M355: 124.2 | N355: 15.42 | O355: 1.3000000000000001e-002 | P355: 310.83 | Q355: 转股中 | R355: 4.94年 | S355: 2.94年 | T355: 1.54 | U355: 1530. | V355: 3.1600000000000001 | W355: 1.e-002 | X355: 3.1e-002 | Y355: 155 | Z355: 4.52 | AA355: -0.17399999999999999 | AB355: -0.17999999999999999 | AC355: -0.16699999999999998 | AD355: -0.16800000000000001 | AE355: 86.12 | AF355: 92.19 | AG355: 0.98 | AH355: AA- | AI355: 6.3600000000000004e-002 | AJ355: =H355+100*O355 -> 316.30000000000001 | AK355: 319.2 | AL355: 358 | AM355: 227 | AN355: 358 | AO355: 0.13400000000000001 | AP355: 9 | AQ355: 中矿转债!
A356: 299 | B356: 113527 | C356: 维格转债!! | D356: 603518 | E356: 锦泓集团 | F356: 服装纺织 | G356: 服装行业 | H356: 235.4 | I356: -2.06e-002 | J356: -1.7100000000000001e-002 | K356: 22.85 | L356: -3.8699999999999998e-002 | M356: 119.5 | N356: 9.85 | O356: 1.4999999999999999e-002 | P356: 231.98 | Q356: 转股中 | R356: 3.56年 | S356: 1.56年 | T356: 4.2 | U356: 876 | V356: 0.86900000000000011 | W356: 6.5000000000000002e-002 | X356: 0.152 | Y356: 64 | Z356: 3.01 | AA356: -0.17600000000000002 | AB356: -0.183 | AC356: -0.30099999999999999 | AD356: -0.30199999999999999 | AE356: 94.17 | AF356: 99.89 | AG356: 0.97 | AH356: AA | AI356: 5.2600000000000001e-002 | AJ356: =H356+100*O356 -> 236.90000000000001 | AK356: 238.8 | AL356: 353 | AM356: 138.9 | AN356: 351 | AO356: 9.8000000000000004e-002 | AP356: 84 | AQ356: 维格转债!!
A357: 360 | B357: 127004 | C357: 模塑转债!! | D357: 700 | E357: 模塑科技 | F357: 汽车 | G357: 零部件制 | H357: 164 | I357: 5.0000000000000001e-003 | J357: -5.0000000000000001e-003 | K357: 5.5 | L357: 0. | M357: 111.8 | N357: 7.46 | O357: 1.22 | P357: 73.73 | Q357: 转股中 | R357: 1.92年 | S357: 回售内 | T357: 1.32 | U357: 30 | V357: 0.13699999999999998 | W357: 2.6000000000000002e-002 | X357: 1.9e-002 | Y357: 50 | Z357: 1.81 | AA357: -0.182 | AB357: -0.191 | AC357: 回售内 | AD357: 回售内 | AE357: 100.3 | AF357: 98.54 | AG357: 0 | AH357: AA- | AI357: 6.1799999999999994e-002 | AJ357: =H357+100*O357 -> 286. | AK357: 254.3 | AL357: 354 | AM357: 154 | AN357: 354 | AO357: -2.e-002 | AP357: 30 | AQ357: 模塑转债!!
A358: 313 | B358: 123015 | C358: 蓝盾转债!! | D358: 300297 | E358: 蓝盾股份 | F358: 计算机及 | G358: 软件开发 | H358: 219.861 | I358: -3.3e-003 | J358: 4.5999999999999999e-003 | K358: 3.96 | L358: 7.6e-003 | M358: 112.3 | N358: 5.79 | O358: 2.21 | P358: 68.39 | Q358: 转股中 | R358: 3年41天 | S358: 1年42天 | T358: 1 | U358: 110 | V358: 0.496 | W358: 2.e-002 | X358: 1.3999999999999999e-002 | Y358: 49 | Z358: 1.9 | AA358: -0.19699999999999998 | AB358: -0.20199999999999999 | AC358: -0.40500000000000003 | AD358: -0.40700000000000003 | AE358: 88.59 | AF358: 78.62 | AG358: 0.18 | AH358: BBB- | AI358: 0.1246 | AJ358: =H358+100*O358 -> 440.86099999999999 | AK358: 371.3 | AL358: 362 | AM358: 282.7 | AN358: 362 | AO358: -7.0999999999999994e-002 | AP358: 16 | AQ358: 蓝盾转债!!
A359: 343 | B359: 128030 | C359: 天康转债!! | D359: 2100 | E359: 天康生物 | F359: 农业 | G359: 畜牧业 | H359: 191.489 | I359: 3.0999999999999999e-003 | J359: -1.11e-002 | K359: 8.7 | L359: -8.0000000000000002e-003 | M359: 111.3 | N359: 7.39 | O359: 0.627 | P359: 117.73 | Q359: 转股中 | R359: 2.47年 | S359: 0.47年 | T359: 0.89 | U359: 44 | V359: 0.254 | W359: 9.0000000000000011e-003 | X359: 1.1000000000000001e-002 | Y359: 94 | Z359: 1.43 | AA359: -0.20000000000000001 | AB359: -0.20600000000000002 | AC359: -0.76000000000000001 | AD359: -0.76300000000000001 | AE359: 99.23 | AF359: 101 | AG359: 1 | AH359: AA | AI359: 4.0800000000000003e-002 | AJ359: =H359+100*O359 -> 254.18900000000002 | AK359: 265.3 | AL359: 355 | AM359: 164.3 | AN359: 355 | AO359: -4.0000000000000001e-002 | AP359: 11 | AQ359: 天康转债!!
A360: 327 | B360: 113509 | C360: 新泉转债!! | D360: 603179 | E360: 新泉股份 | F360: 汽车 | G360: 零部件制 | H360: 212.27 | I360: -2.5600000000000001e-002 | J360: 3.8e-003 | K360: 31.1 | L360: -2.23e-002 | M360: 109.3 | N360: 15.25 | O360: 4.0999999999999995e-002 | P360: 203.93 | Q360: 转股中 | R360: 2.92年 | S360: 0.92年 | T360: 0.78 | U360: 23 | V360: 0.14000000000000001 | W360: 6.9999999999999993e-003 | X360: 1.3999999999999999e-002 | Y360: 115 | Z360: 3.24 | AA360: -0.20499999999999999 | AB360: -0.20999999999999999 | AC360: -0.47299999999999998 | AD360: -0.47499999999999998 | AE360: 97.47 | AF360: 97.42 | AG360: 0.98 | AH360: AA | AI360: 4.0800000000000003e-002 | AJ360: =H360+100*O360 -> 216.37 | AK360: 220.6 | AL360: 350 | AM360: 123.1 | AN360: 348 | AO360: -4.0000000000000001e-002 | AP360: 12 | AQ360: 新泉转债!!
A361: 300 | B361: 113526 | C361: 联泰转债! | D361: 603797 | E361: 联泰环保 | F361: 城市公用 | G361: 三废处理 | H361: 263.16 | I361: -9.8999999999999991e-003 | J361: 5.8999999999999999e-003 | K361: 7.34 | L361: -5.4000000000000003e-003 | M361: 110.3 | N361: 6.11 | O361: 1.1899999999999999 | P361: 120.13 | Q361: 转股中 | R361: 3.56年 | S361: 1.56年 | T361: 1.93 | U361: 114 | V361: 0.222 | W361: 5.7999999999999996e-002 | X361: 7.0000000000000007e-002 | Y361: 33 | Z361: 1.93 | AA361: -0.21899999999999997 | AB361: -0.223 | AC361: -0.32700000000000001 | AD361: -0.32799999999999996 | AE361: 96.18 | AF361: 96.32 | AG361: 0.74 | AH361: AA+ | AI361: 3.9599999999999996e-002 | AJ361: =H361+100*O361 -> 382.16000000000003 | AK361: 406.2 | AL361: 365 | AM361: 309.9 | AN361: 364 | AO361: -3.7999999999999999e-002 | AP361: 9 | AQ361: 联泰转债!
A362: 216 | B362: 128095 | C362: 恩捷转债!! | D362: 2812 | E362: 恩捷股份 | F362: 电子 | G362: 元器件制 | H362: 359 | I362: -1.8799999999999997e-002 | J362: 1.0500000000000001e-002 | K362: 233.98 | L362: -8.3999999999999995e-003 | M362: 114.9 | N362: 64.92 | O362: -4.0000000000000001e-003 | P362: 360.41 | Q362: 转股中 | R362: 4.61年 | S362: 2.61年 | T362: 4.94 | U362: 600 | V362: 0.33700000000000002 | W362: 2.e-003 | X362: 9.0000000000000011e-003 | Y362: 2078. | Z362: 18.03 | AA362: -0.222 | AB362: -0.22600000000000001 | AC362: -0.20899999999999999 | AD362: -0.20899999999999999 | AE362: 92.18 | AF362: 95.15 | AG362: 0.99 | AH362: AA | AI362: 4.2599999999999999e-002 | AJ362: =H362+100*O362 -> 358.60000000000002 | AK362: 357.6 | AL362: 360 | AM362: 262.4 | AN362: 359 | AO362: 0.22600000000000001 | AP362: 15 | AQ362: 恩捷转债!!
A363: 266 | B363: 123027 | C363: 蓝晓转债! | D363: 300487 | E363: 蓝晓科技 | F363: 化工 | G363: 化工 | H363: 329.16 | I363: -4.7999999999999996e-003 | J363: 1.3100000000000001e-002 | K363: 86.02 | L363: 8.3999999999999995e-003 | M363: 118.8 | N363: 29.02 | O363: 0.11 | P363: 296.42 | Q363: 转股中 | R363: 3.94年 | S363: 1.94年 | T363: 1.07 | U363: 1809. | V363: 5. | W363: 6.0000000000000001e-003 | X363: 1.7000000000000001e-002 | Y363: 189 | Z363: 10.24 | AA363: -0.23100000000000001 | AB363: -0.23699999999999999 | AC363: -0.28800000000000003 | AD363: -0.28899999999999998 | AE363: 89.23 | AF363: 90.07 | AG363: 0.98 | AH363: A+ | AI363: 7.46e-002 | AJ363: =H363+100*O363 -> 340.16000000000003 | AK363: 361.9 | AL363: 361 | AM363: 271.8 | AN363: 361 | AO363: 0.20699999999999999 | AP363: 19 | AQ363: 蓝晓转债!
A364: 324 | B364: 110044 | C364: 广电转债!! | D364: 600831 | E364: 广电网络 | F364: 传媒娱乐 | G364: 影视娱乐 | H364: 242.71 | I364: 1.3600000000000001e-002 | J364: -1.7500000000000002e-002 | K364: 5.65 | L364: -1.3999999999999999e-002 | M364: 111.3 | N364: 6.9 | O364: 1.96 | P364: 81.88 | Q364: 转股中 | R364: 2.98年 | S364: 0.99年 | T364: 0.71 | U364: 85 | V364: 0.49399999999999999 | W364: 1.8000000000000002e-002 | X364: 1.3999999999999999e-002 | Y364: 40 | Z364: 1.07 | AA364: -0.23199999999999998 | AB364: -0.23699999999999999 | AC364: -0.496 | AD364: -0.49700000000000005 | AE364: 97.22 | AF364: 98.95 | AG364: 0.28 | AH364: AA | AI364: 4.0800000000000003e-002 | AJ364: =H364+100*O364 -> 438.71000000000004 | AK364: 403.5 | AL364: 364 | AM364: 304.6 | AN364: 363 | AO364: -5.9999999999999998e-002 | AP364: 10 | AQ364: 广电转债!!
A365: 254 | B365: 123031 | C365: 晶瑞转债! | D365: 300655 | E365: 晶瑞股份 | F365: 化工 | G365: 化工 | H365: 350.5 | I365: -1.2699999999999999e-002 | J365: -1.38e-002 | K365: 35.52 | L365: -2.6800000000000001e-002 | M365: 115.8 | N365: 10.13 | O365: 0. | P365: 350.64 | Q365: 转股中 | R365: 4年57天 | S365: 2年58天 | T365: 0.59 | U365: 1266. | V365: 6.0899999999999999 | W365: 5.0000000000000001e-003 | X365: 1.7000000000000001e-002 | Y365: 121 | Z365: 5.05 | AA365: -0.23699999999999999 | AB365: -0.24100000000000002 | AC365: -0.26200000000000001 | AD365: -0.26300000000000001 | AE365: 87.55 | AF365: 86.43 | AG365: 0.99 | AH365: A+ | AI365: 7.46e-002 | AJ365: =H365+100*O365 -> 350.5 | AK365: 350.4 | AL365: 359 | AM365: 262.8 | AN365: 360 | AO365: 0.25700000000000001 | AP365: 16 | AQ365: 晶瑞转债!
A366: 320 | B366: 128041 | C366: 盛路转债!! | D366: 2446 | E366: 盛路通信 | F366: 通信互联 | G366: 通信设备 | H366: 270.47 | I366: -5.6000000000000008e-003 | J366: 1.7000000000000001e-003 | K366: 6.38 | L366: -7.8000000000000005e-003 | M366: 114.3 | N366: 6.82 | O366: 1.8899999999999999 | P366: 93.55 | Q366: 转股中 | R366: 3年14天 | S366: 1年15天 | T366: 0.53 | U366: 58 | V366: 0.40100000000000002 | W366: 9.0000000000000011e-003 | X366: 9.0000000000000011e-003 | Y366: 58 | Z366: 1.88 | AA366: -0.25 | AB366: -0.25600000000000001 | AC366: -0.504 | AD366: -0.50600000000000001 | AE366: 97.81 | AF366: 100.98 | AG366: 0.5 | AH366: AA | AI366: 4.2599999999999999e-002 | AJ366: =H366+100*O366 -> 459.47000000000003 | AK366: 447.4 | AL366: 366 | AM366: 346.4 | AN366: 366 | AO366: -5.0000000000000001e-003 | AP366: 12 | AQ366: 盛路转债!!
A367: 344 | B367: 128029 | C367: 太阳转债!! | D367: 2078 | E367: 太阳纸业 | F367: 造纸包装 | G367: 造纸行业 | H367: 168.468 | I367: -4.7999999999999996e-003 | J367: -2.2000000000000002e-002 | K367: 13.46 | L367: -2.6800000000000001e-002 | M367: 107 | N367: 8.55 | O367: 7.0000000000000007e-002 | P367: 157.43 | Q367: 转股中 | R367: 1.47年 | S367: 回售内 | T367: 9.09 | U367: 94 | V367: 6.0999999999999999e-002 | W367: 2.6000000000000002e-002 | X367: 4.0000000000000001e-002 | Y367: 353 | Z367: 2.07 | AA367: -0.26600000000000001 | AB367: -0.27300000000000002 | AC367: 回售内 | AD367: 回售内 | AE367: 100.17 | AF367: 101.34 | AG367: 1 | AH367: AA+ | AI367: 3.78e-002 | AJ367: =H367+100*O367 -> 175.46799999999999 | AK367: 179.5 | AL367: 337 | AM367: 78.2 | AN367: 330 | AO367: -1.9e-002 | AP367: 7 | AQ367: 太阳转债!!
A368: 317 | B368: 123013 | C368: 横河转债! | D368: 300539 | E368: 横河精密 | F368: 机械装备 | G368: 专用设备 | H368: 335.621 | I368: -1.1000000000000001e-003 | J368: 1.1399999999999999e-002 | K368: 7.75 | L368: 2.3799999999999998e-002 | M368: 115.2 | N368: 9.04 | O368: 2.9100000000000001 | P368: 85.73 | Q368: 转股中 | R368: 3年23天 | S368: 1年24天 | T368: 0.38 | U368: 114 | V368: 0.877 | W368: 2.2000000000000002e-002 | X368: 1.9e-002 | Y368: 17 | Z368: 3.47 | AA368: -0.29899999999999999 | AB368: -0.30499999999999999 | AC368: -0.55000000000000004 | AD368: -0.55100000000000005 | AE368: 94.71 | AF368: 92.98 | AG368: 0.43 | AH368: A+ | AI368: 7.46e-002 | AJ368: =H368+100*O368 -> 626.62099999999998 | AK368: 585.5 | AL368: 368 | AM368: 490.8 | AN368: 368 | AO368: 4.0000000000000001e-003 | AP368: 14 | AQ368: 横河转债!
A369: 355 | B369: 113016 | C369: 小康转债!! | D369: 601127 | E369: 小康股份 | F369: 汽车 | G369: 零部件制 | H369: 438.9 | I369: -6.5099999999999991e-002 | J369: -8.0000000000000002e-003 | K369: 62.13 | L369: -7.3700000000000002e-002 | M369: 109.3 | N369: 15.7 | O369: 0.109 | P369: 395.73 | Q369: 转股中 | R369: 2.35年 | S369: 0.35年 | T369: 2.39 | U369: 1795. | V369: 1.6699999999999999 | W369: 3.0000000000000001e-003 | X369: 1.1000000000000001e-002 | Y369: 844 | Z369: 17.12 | AA369: -0.42299999999999999 | AB369: -0.42599999999999999 | AC369: -1.5669999999999999 | AD369: -1.5680000000000001 | AE369: 98.72 | AF369: 95.21 | AG369: 0.99 | AH369: AA- | AI369: 6.1799999999999994e-002 | AJ369: =H369+100*O369 -> 449.79999999999995 | AK369: 482.1 | AL369: 367 | AM369: 383.3 | AN369: 367 | AO369: -8.3000000000000004e-002 | AP369: 41 | AQ369: 小康转债!!