A1: 序号 | B1: 转债代码 | C1: 转债名称 | D1: 股票代码 | E1: 股票名称 | F1: 行业 | G1: 子行业 | H1: 转债价格 | I1: 涨跌 | J1: 日内套利 | K1: 股价 | L1: 涨跌 | M1: 剩余本息 | N1: 转股价格 | O1: 转股溢价率 | P1: 转股价值 | Q1: 距离转股日 | R1: 剩余年限 | S1: 回售年限 | T1: 转债余额 | U1: 转债成交额 | V1: 转债换手率 | W1: 余额/市值 | X1: 余额/股本 | Y1: 股票市值 | Z1: P/B | AA1: 税前收益率 | AB1: 税后收益率 | AC1: 税前回售收益 | AD1: 税后回售收益 | AE1: 回售价值 | AF1: 纯债价值 | AG1: 弹性 | AH1: 信用 | AI1: 折现率 | AJ1: 双低 | AK1: 老式双低 | AL1: 老式排名 | AM1: 新式双低 | AN1: 新式排名 | AO1: MA20乖离 | AP1: 热门度 | AQ1: 转债名称
A2: 251 | B2: 128062 | C2: 亚药转债! | D2: 2370 | E2: 亚太药业 | F2: 医药 | G2: 化学制药 | H2: 69.4 | I2: -2.2000000000000001e-003 | J2: 2.2000000000000001e-003 | K2: 3.62 | L2: 1.6899999999999998e-002 | M2: 119.8 | N2: 16.25 | O2: 2.1200000000000001 | P2: 22.28 | Q2: 转股中 | R2: 4年42天 | S2: 2年42天 | T2: 9.63 | U2: 47 | V2: 7.0999999999999994e-002 | W2: 0.496 | X2: 0.11 | Y2: 19 | Z2: 6.03 | AA2: 0.14499999999999999 | AB2: 0.13500000000000001 | AC2: 0.193 | AD2: 0.18899999999999997 | AE2: 84.04 | AF2: 82.89 | AG2: 0 | AH2: A- | AI2: 9.5799999999999996e-002 | AJ2: =H2+100*O2 -> 281.39999999999998 | AK2: 116.5 | AL2: 100 | AM2: 32.5 | AN2: 164 | AO2: -7.2000000000000008e-002 | AP2: 87 | AQ2: 亚药转债!
A3: 270 | B3: 113527 | C3: 维格转债! | D3: 603518 | E3: 锦泓集团 | F3: 服装纺织 | G3: 服装行业 | H3: 80.22 | I3: 2.6499999999999999e-002 | J3: -2.58e-002 | K3: 4.75 | L3: 3.49e-002 | M3: 119.5 | N3: 9.85 | O3: 0.66400000000000003 | P3: 48.22 | Q3: 转股中 | R3: 3.93年 | S3: 1.93年 | T3: 7.46 | U3: 4.8 | V3: 8.0000000000000002e-003 | W3: 0.622 | X3: 0.29999999999999999 | Y3: 12 | Z3: 0.76 | AA3: 0.109 | AB3: 9.9000000000000005e-002 | AC3: 0.127 | AD3: 0.124 | AE3: 92.21 | AF3: 97.61 | AG3: 0.02 | AH3: AA | AI3: 5.3800000000000001e-002 | AJ3: =H3+100*O3 -> 146.62 | AK3: 112.2 | AL3: 51 | AM3: 14.6 | AN3: 19 | AO3: 4.4000000000000004e-002 | AP3: 100 | AQ3: 维格转债!
A4: 118 | B4: 127018 | C4: 本钢转债! | D4: 761 | E4: 本钢板材 | F4: 钢铁 | G4: 炼钢 | H4: 77.153 | I4: 2.1400000000000002e-002 | J4: -1.9900000000000001e-002 | K4: 2.96 | L4: 1.37e-002 | M4: 128.6 | N4: 5.03 | O4: 0.311 | P4: 58.85 | Q4: 转股中 | R4: 5.36年 | S4: 3.36年 | T4: 68 | U4: 98 | V4: 1.9e-002 | W4: 0.59299999999999997 | X4: 0.34899999999999998 | Y4: 115 | Z4: 0.58 | AA4: 0.10400000000000001 | AB4: 9.35e-002 | AC4: 9.7299999999999998e-002 | AD4: 9.3100000000000002e-002 | AE4: 89.78 | AF4: 99.68 | AG4: 0.11 | AH4: AAA | AI4: 5.0300000000000004e-002 | AJ4: =H4+100*O4 -> 108.25300000000001 | AK4: 95.5 | AL4: 3 | AM4: -4.2 | AN4: 1 | AO4: 3.0000000000000001e-003 | AP4: 48 | AQ4: 本钢转债!
A5: 286 | B5: 128044 | C5: 岭南转债! | D5: 2717 | E5: 岭南股份 | F5: 城市公用 | G5: 生态环境 | H5: 84.918 | I5: 1.5100000000000001e-002 | J5: -1.43e-002 | K5: 3.02 | L5: 4.8600000000000004e-002 | M5: 111.3 | N5: 5.91 | O5: 0.66200000000000003 | P5: 51.1 | Q5: 转股中 | R5: 3.48年 | S5: 1.48年 | T5: 6.59 | U5: 15 | V5: 2.7000000000000003e-002 | W5: 0.14300000000000002 | X5: 7.2999999999999995e-002 | Y5: 46 | Z5: 0.94 | AA5: 8.2599999999999993e-002 | AB5: 7.5800000000000006e-002 | AC5: 0.124 | AD5: 0.12 | AE5: 95.84 | AF5: 96.16 | AG5: 0.02 | AH5: AA | AI5: 4.3799999999999999e-002 | AJ5: =H5+100*O5 -> 151.11799999999999 | AK5: 118.7 | AL5: 113 | AM5: 22.6 | AN5: 64 | AO5: 1.8000000000000002e-002 | AP5: 38 | AQ5: 岭南转债!
A6: 167 | B6: 128100 | C6: 搜特转债! | D6: 2503 | E6: 搜于特 | F6: 服装纺织 | G6: 服装行业 | H6: 80.91 | I6: 8.9999999999999997e-002 | J6: -7.690000000000001e-002 | K6: 1.8 | L6: 9.7599999999999992e-002 | M6: 117.3 | N6: 2.9 | O6: 0.30399999999999999 | P6: 62.07 | Q6: 转股中 | R6: 5年21天 | S6: 3年21天 | T6: 8 | U6: 193 | V6: 0.30599999999999999 | W6: 0.14400000000000002 | X6: 8.900000000000001e-002 | Y6: 56 | Z6: 1.01 | AA6: 7.8e-002 | AB6: 7.1199999999999999e-002 | AC6: 8.14e-002 | AD6: 7.8700000000000006e-002 | AE6: 90.13 | AF6: 94.2 | AG6: 0.13 | AH6: AA | AI6: 4.53e-002 | AJ6: =H6+100*O6 -> 111.31 | AK6: 99.8 | AL6: 7 | AM6: 5.5 | AN6: 3 | AO6: -8.9999999999999997e-002 | AP6: 50 | AQ6: 搜特转债!
A7: 340 | B7: 127003 | C7: 海印转债! | D7: 861 | E7: 海印股份 | F7: 商业零售 | G7: 商场 | H7: 101.6 | I7: 1.1299999999999999e-002 | J7: -1.0800000000000001e-002 | K7: 2.26 | L7: 1.8000000000000002e-002 | M7: 111.8 | N7: 3 | O7: 0.34899999999999998 | P7: 75.33 | Q7: 转股中 | R7: 1.30年 | S7: 回售内 | T7: 6.74 | U7: 13 | V7: 1.9e-002 | W7: 0.128 | X7: 9.6999999999999989e-002 | Y7: 53 | Z7: 1.33 | AA7: 7.7499999999999999e-002 | AB7: 5.9500000000000004e-002 | AC7: 回售内 | AD7: 回售内 | AE7: 100.3 | AF7: 106.07 | AG7: 0.03 | AH7: AA | AI7: 4.1900000000000007e-002 | AJ7: =H7+100*O7 -> 136.5 | AK7: 127.9 | AL7: 203 | AM7: 21.8 | AN7: 57 | AO7: 6.9999999999999993e-003 | AP7: 76 | AQ7: 海印转债!
A8: 172 | B8: 113569 | C8: 科达转债! | D8: 603660 | E8: 苏州科达 | F8: 通信互联 | G8: 物联网 | H8: 83.98 | I8: 3.0600000000000002e-002 | J8: -2.8999999999999998e-002 | K8: 6.95 | L8: 3.4200000000000001e-002 | M8: 120.7 | N8: 14.84 | O8: 0.79299999999999993 | P8: 46.83 | Q8: 转股中 | R8: 5年18天 | S8: 3年18天 | T8: 5.16 | U8: 8.4 | V8: 2.e-002 | W8: 0.14899999999999999 | X8: 7.0000000000000007e-002 | Y8: 35 | Z8: 2.03 | AA8: 7.6399999999999996e-002 | AB8: 6.8400000000000002e-002 | AC8: 6.9800000000000001e-002 | AD8: 6.7000000000000004e-002 | AE8: 84.86 | AF8: 87.95 | AG8: 0.05 | AH8: AA- | AI8: 6.6299999999999998e-002 | AJ8: =H8+100*O8 -> 163.28 | AK8: 121.1 | AL8: 140 | AM8: 33.2 | AN8: 178 | AO8: 8.0000000000000002e-003 | AP8: 25 | AQ8: 科达转债!
A9: 81 | B9: 110072 | C9: 广汇转债! | D9: 600297 | E9: 广汇汽车 | F9: 汽车 | G9: 分销、售 | H9: 77.57 | I9: 4.2599999999999999e-002 | J9: -3.5299999999999998e-002 | K9: 2.66 | L9: 3.5000000000000003e-002 | M9: 114.5 | N9: 4.03 | O9: 0.17499999999999999 | P9: 66 | Q9: 5.1天 | R9: 5.49年 | S9: 3.49年 | T9: 33.7 | U9: 154 | V9: 5.9999999999999998e-002 | W9: 0.156 | X9: 0.10300000000000001 | Y9: 216 | Z9: 0.55 | AA9: 7.4700000000000003e-002 | AB9: 6.9400000000000003e-002 | AC9: 8.1099999999999992e-002 | AD9: 7.9199999999999993e-002 | AE9: 88.28 | AF9: 91.03 | AG9: 0.21 | AH9: AA+ | AI9: 4.3299999999999998e-002 | AJ9: =H9+100*O9 -> 95.069999999999993 | AK9: 89.1 | AL9: 2 | AM9: -1.9 | AN9: 2 | AO9: 4.8000000000000001e-002 | AP9: 36 | AQ9: 广汇转债!
A10: 234 | B10: 123028 | C10: 清水转债! | D10: 300437 | E10: 清水源 | F10: 城市公用 | G10: 三废处理 | H10: 90.027 | I10: 2.64e-002 | J10: -1.7299999999999999e-002 | K10: 7.73 | L10: 5.1699999999999996e-002 | M10: 121.8 | N10: 11.84 | O10: 0.379 | P10: 65.29 | Q10: 转股中 | R10: 4.33年 | S10: 2.33年 | T10: 4.56 | U10: 8 | V10: 2.e-002 | W10: 0.26700000000000002 | X10: 0.17399999999999999 | Y10: 17 | Z10: 1.1 | AA10: 7.46e-002 | AB10: 6.4899999999999999e-002 | AC10: 6.3399999999999998e-002 | AD10: 5.9299999999999999e-002 | AE10: 89.75 | AF10: 93.54 | AG10: 0.18 | AH10: AA- | AI10: 6.480000000000001e-002 | AJ10: =H10+100*O10 -> 127.92699999999999 | AK10: 114.8 | AL10: 82 | AM10: 21.2 | AN10: 54 | AO10: -4.2000000000000003e-002 | AP10: 54 | AQ10: 清水转债!
A11: 199 | B11: 128085 | C11: 鸿达转债! | D11: 2002 | E11: 鸿达兴业 | F11: 化工 | G11: 化工 | H11: 89 | I11: 4.9500000000000002e-002 | J11: -1.7600000000000001e-002 | K11: 3.51 | L11: 4.1500000000000002e-002 | M11: 124.4 | N11: 3.92 | O11: -6.0000000000000001e-003 | P11: 89.54 | Q11: 转股中 | R11: 4.82年 | S11: 2.82年 | T11: 17.5 | U11: 727 | V11: 0.47100000000000003 | W11: 0.182 | X11: 0.16300000000000001 | Y11: 96 | Z11: 1.27 | AA11: 7.3499999999999996e-002 | AB11: 6.4199999999999993e-002 | AC11: 5.3699999999999998e-002 | AD11: 5.0900000000000001e-002 | AE11: 73.17 | AF11: 71.16 | AG11: 0.77 | AH11: BB | AI11: 0.1258 | AJ11: =H11+100*O11 -> 88.400000000000006 | AK11: 88.5 | AL11: 1 | AM11: 15.3 | AN11: 22 | AO11: 0.13 | AP11: 99 | AQ11: 鸿达转债!
A12: 293 | B12: 123011 | C12: 德尔转债! | D12: 300473 | E12: 德尔股份 | F12: 汽车 | G12: 零部件制 | H12: 92.449 | I12: 2.e-002 | J12: -1.9400000000000001e-002 | K12: 17.7 | L12: 2.1400000000000002e-002 | M12: 116.3 | N12: 34.54 | O12: 0.80400000000000005 | P12: 51.24 | Q12: 转股中 | R12: 3.41年 | S12: 1.41年 | T12: 2.51 | U12: 3.4 | V12: 1.4999999999999999e-002 | W12: 0.124 | X12: 6.4000000000000001e-002 | Y12: 20 | Z12: 0.9 | AA12: 7.1199999999999999e-002 | AB12: 6.1799999999999994e-002 | AC12: 7.0400000000000004e-002 | AD12: 6.6500000000000004e-002 | AE12: 93.2 | AF12: 94.3 | AG12: 0.02 | AH12: AA- | AI12: 6.480000000000001e-002 | AJ12: =H12+100*O12 -> 172.84899999999999 | AK12: 133.7 | AL12: 236 | AM12: 39.4 | AN12: 219 | AO12: -8.0000000000000002e-003 | AP12: 42 | AQ12: 德尔转债!
A13: 249 | B13: 128063 | C13: 未来转债! | D13: 2631 | E13: 德尔未来 | F13: 其他 | G13: 家居用品 | H13: 98 | I13: 1.04e-002 | J13: -6.0999999999999995e-003 | K13: 6.05 | L13: 2.7200000000000002e-002 | M13: 128.2 | N13: 8.63 | O13: 0.39799999999999996 | P13: 70.1 | Q13: 转股中 | R13: 4年43天 | S13: 3年43天 | T13: 6.3 | U13: 2.7 | V13: 4.0000000000000001e-003 | W13: 0.156 | X13: 0.11 | Y13: 40 | Z13: 2.3 | AA13: 6.9699999999999998e-002 | AB13: 5.7300000000000004e-002 | AC13: 3.3399999999999999e-002 | AD13: 2.7999999999999997e-002 | AE13: 89.05 | AF13: 99.8 | AG13: 0.16 | AH13: AA- | AI13: 6.480000000000001e-002 | AJ13: =H13+100*O13 -> 137.80000000000001 | AK13: 125.9 | AL13: 187 | AM13: 26.1 | AN13: 104 | AO13: -3.7000000000000005e-002 | AP13: 35 | AQ13: 未来转债!
A14: 339 | B14: 128013 | C14: 洪涛转债! | D14: 2325 | E14: 洪涛股份 | F14: 建筑 | G14: 装饰工程 | H14: 99.791 | I14: 1.04e-002 | J14: -8.8000000000000005e-003 | K14: 2.25 | L14: 6.13e-002 | M14: 109.8 | N14: 3.1 | O14: 0.375 | P14: 72.58 | Q14: 转股中 | R14: 1.44年 | S14: 回售内 | T14: 12 | U14: 12 | V14: 1.e-002 | W14: 0.42599999999999999 | X14: 0.309 | Y14: 28 | Z14: 0.94 | AA14: 6.9599999999999995e-002 | AB14: 5.5999999999999994e-002 | AC14: 回售内 | AD14: 回售内 | AE14: 100.3 | AF14: 100.68 | AG14: 0.03 | AH14: AA- | AI14: 6.2899999999999998e-002 | AJ14: =H14+100*O14 -> 137.291 | AK14: 127 | AL14: 196 | AM14: 26.3 | AN14: 113 | AO14: 2.2000000000000002e-002 | AP14: 94 | AQ14: 洪涛转债!
A15: 107 | B15: 127019 | C15: 国城转债! | D15: 688 | E15: 国城矿业 | F15: 有色金属 | G15: 锌铅镍锡 | H15: 80.9 | I15: 3.3500000000000002e-002 | J15: -3.1099999999999999e-002 | K15: 9.37 | L15: 7.5800000000000006e-002 | M15: 115.1 | N15: 21.07 | O15: 0.81900000000000006 | P15: 44.47 | Q15: 转股中 | R15: 5.40年 | S15: 3.40年 | T15: 8.5 | U15: 22 | V15: 3.3000000000000002e-002 | W15: 8.0000000000000002e-002 | X15: 3.5000000000000003e-002 | Y15: 107 | Z15: 4.82 | AA15: 6.8900000000000003e-002 | AB15: 6.3299999999999995e-002 | AC15: 7.2499999999999995e-002 | AD15: 7.0199999999999999e-002 | AE15: 88.58 | AF15: 91.02 | AG15: 0.03 | AH15: AA | AI15: 4.53e-002 | AJ15: =H15+100*O15 -> 162.80000000000001 | AK15: 117.3 | AL15: 106 | AM15: 26.3 | AN15: 111 | AO15: 7.9000000000000001e-002 | AP15: 34 | AQ15: 国城转债!
A16: 284 | B16: 113519 | C16: 长久转债! | D16: 603569 | E16: 长久物流 | F16: 交通运输 | G16: 物流业 | H16: 93.68 | I16: 1.3899999999999999e-002 | J16: -1.1899999999999999e-002 | K16: 6.86 | L16: 3.3099999999999997e-002 | M16: 119.3 | N16: 11.15 | O16: 0.52300000000000002 | P16: 61.52 | Q16: 转股中 | R16: 3.72年 | S16: 1.72年 | T16: 6.97 | U16: 2.5 | V16: 4.0000000000000001e-003 | W16: 0.18100000000000002 | X16: 0.11199999999999999 | Y16: 38 | Z16: 1.8 | AA16: 6.8499999999999991e-002 | AB16: 5.8700000000000002e-002 | AC16: 5.0999999999999997e-002 | AD16: 4.7899999999999998e-002 | AE16: 94.89 | AF16: 102.02 | AG16: 0.06 | AH16: AA | AI16: 4.3799999999999999e-002 | AJ16: =H16+100*O16 -> 145.98000000000002 | AK16: 125.8 | AL16: 186 | AM16: 23.8 | AN16: 78 | AO16: 1.1000000000000001e-002 | AP16: 19 | AQ16: 长久转债!
A17: 254 | B17: 113530 | C17: 大丰转债! | D17: 603081 | E17: 大丰实业 | F17: 建筑 | G17: 装饰工程 | H17: 93.39 | I17: 8.6e-003 | J17: -5.6999999999999993e-003 | K17: 11.17 | L17: 2.8500000000000001e-002 | M17: 121.6 | N17: 16.64 | O17: 0.39100000000000001 | P17: 67.13 | Q17: 转股中 | R17: 4年36天 | S17: 2年36天 | T17: 6.3 | U17: 7.4 | V17: 1.3000000000000001e-002 | W17: 0.14000000000000001 | X17: 9.4e-002 | Y17: 45 | Z17: 2.19 | AA17: 6.8099999999999994e-002 | AB17: 5.8299999999999998e-002 | AC17: 4.7100000000000003e-002 | AD17: 4.3799999999999999e-002 | AE17: 94.05 | AF17: 102.41 | AG17: 0.1 | AH17: AA | AI17: 4.3799999999999999e-002 | AJ17: =H17+100*O17 -> 132.49000000000001 | AK17: 119.7 | AL17: 125 | AM17: 17.2 | AN17: 32 | AO17: 4.9000000000000002e-002 | AP17: 34 | AQ17: 大丰转债!
A18: 120 | B18: 113589 | C18: 天创转债! | D18: 603608 | E18: 天创时尚 | F18: 服装纺织 | G18: 鞋服行业 | H18: 81.91 | I18: 2.2599999999999999e-002 | J18: -2.06e-002 | K18: 5.58 | L18: 6.2899999999999998e-002 | M18: 115.3 | N18: 12.44 | O18: 0.82599999999999996 | P18: 44.86 | Q18: 转股中 | R18: 5.34年 | S18: 3.34年 | T18: 6 | U18: 6.3 | V18: 1.3000000000000001e-002 | W18: 0.251 | X18: 0.11199999999999999 | Y18: 24 | Z18: 1.12 | AA18: 6.7599999999999993e-002 | AB18: 6.1799999999999994e-002 | AC18: 7.0599999999999996e-002 | AD18: 6.8199999999999997e-002 | AE18: 89 | AF18: 91.44 | AG18: 0.03 | AH18: AA | AI18: 4.53e-002 | AJ18: =H18+100*O18 -> 164.50999999999999 | AK18: 119 | AL18: 116 | AM18: 27.5 | AN18: 123 | AO18: -6.9999999999999993e-003 | AP18: 20 | AQ18: 天创转债!
A19: 304 | B19: 128037 | C19: 岩土转债! | D19: 2542 | E19: 中化岩土 | F19: 建筑 | G19: 建筑工程 | H19: 92.405 | I19: 1.7100000000000001e-002 | J19: -1.7100000000000001e-002 | K19: 2.73 | L19: 2.63e-002 | M19: 112.3 | N19: 7.99 | O19: 1.7 | P19: 34.17 | Q19: 转股中 | R19: 3年24天 | S19: 1年24天 | T19: 5.99 | U19: 6.6 | V19: 1.2e-002 | W19: 0.122 | X19: 4.2000000000000003e-002 | Y19: 49 | Z19: 1.21 | AA19: 6.7299999999999999e-002 | AB19: 5.91e-002 | AC19: 9.1499999999999998e-002 | AD19: 8.6400000000000005e-002 | AE19: 97.57 | AF19: 98.66 | AG19: 0 | AH19: AA | AI19: 4.3799999999999999e-002 | AJ19: =H19+100*O19 -> 262.40499999999997 | AK19: 150.6 | AL19: 291 | AM19: 52 | AN19: 274 | AO19: -1.1000000000000001e-002 | AP19: 50 | AQ19: 岩土转债!
A20: 100 | B20: 113595 | C20: 花王转债! | D20: 603007 | E20: 花王股份 | F20: 城市公用 | G20: 生态环境 | H20: 88.78 | I20: 3.9199999999999999e-002 | J20: -1.46e-002 | K20: 5.17 | L20: 7.2599999999999998e-002 | M20: 125.3 | N20: 6.93 | O20: 0.19 | P20: 74.6 | Q20: 转股中 | R20: 5.42年 | S20: 3.42年 | T20: 3.3 | U20: 18 | V20: 6.2e-002 | W20: 0.19 | X20: 0.14199999999999999 | Y20: 17 | Z20: 1.56 | AA20: 6.7199999999999996e-002 | AB20: 5.8700000000000002e-002 | AC20: 4.6399999999999997e-002 | AD20: 4.3799999999999999e-002 | AE20: 83.05 | AF20: 89.2 | AG20: 0.34 | AH20: AA- | AI20: 6.6299999999999998e-002 | AJ20: =H20+100*O20 -> 107.78 | AK20: 103 | AL20: 11 | AM20: 13.8 | AN20: 13 | AO20: 4.0999999999999995e-002 | AP20: 36 | AQ20: 花王转债!
A21: 82 | B21: 113600 | C21: 新星转债! | D21: 603978 | E21: 深圳新星 | F21: 有色金属 | G21: 有色行业 | H21: 89.1 | I21: 2.06e-002 | J21: -1.29e-002 | K21: 17.13 | L21: 2.5099999999999997e-002 | M21: 126 | N21: 23.85 | O21: 0.24100000000000002 | P21: 71.82 | Q21: 转股中 | R21: 5.48年 | S21: 3.48年 | T21: 5.95 | U21: 8.8 | V21: 1.7000000000000001e-002 | W21: 0.217 | X21: 0.156 | Y21: 27 | Z21: 1.8 | AA21: 6.6699999999999995e-002 | AB21: 5.8099999999999999e-002 | AC21: 4.3499999999999997e-002 | AD21: 4.1299999999999996e-002 | AE21: 82.43 | AF21: 89.26 | AG21: 0.31 | AH21: AA- | AI21: 6.6299999999999998e-002 | AJ21: =H21+100*O21 -> 113.19999999999999 | AK21: 106.4 | AL21: 22 | AM21: 17.1 | AN21: 30 | AO21: 6.2e-002 | AP21: 15 | AQ21: 新星转债!
A22: 323 | B22: 128023 | C22: 亚太转债! | D22: 2284 | E22: 亚太股份 | F22: 汽车 | G22: 零部件制 | H22: 93.4 | I22: 1.38e-002 | J22: -1.3500000000000002e-002 | K22: 5.3 | L22: 2.5099999999999997e-002 | M22: 111.3 | N22: 10.34 | O22: 0.82200000000000006 | P22: 51.26 | Q22: 转股中 | R22: 2.79年 | S22: 0.79年 | T22: 9.99 | U22: 8.7 | V22: 9.0000000000000011e-003 | W22: 0.25600000000000001 | X22: 0.13100000000000001 | Y22: 39 | Z22: 1.61 | AA22: 6.6000000000000003e-002 | AB22: 5.79e-002 | AC22: 9.4600000000000004e-002 | AD22: 9.0399999999999994e-002 | AE22: 97.89 | AF22: 99.44 | AG22: 0.01 | AH22: AA | AI22: 4.1900000000000007e-002 | AJ22: =H22+100*O22 -> 175.60000000000002 | AK22: 135.5 | AL22: 245 | AM22: 36.1 | AN22: 202 | AO22: -1.6e-002 | AP22: 68 | AQ22: 亚太转债!
A23: 198 | B23: 128087 | C23: 孚日转债! | D23: 2083 | E23: 孚日股份 | F23: 服装纺织 | G23: 家纺 | H23: 83.89 | I23: 1.44e-002 | J23: -1.06e-002 | K23: 4.12 | L23: 2.23e-002 | M23: 112.9 | N23: 6.3 | O23: 0.28300000000000003 | P23: 65.4 | Q23: 转股中 | R23: 4.82年 | S23: 2.82年 | T23: 6.5 | U23: 19 | V23: 3.5000000000000003e-002 | W23: 0.17399999999999999 | X23: 0.114 | Y23: 37 | Z23: 0.99 | AA23: 6.480000000000001e-002 | AB23: 5.9400000000000001e-002 | AC23: 7.3099999999999998e-002 | AD23: 7.0599999999999996e-002 | AE23: 91.06 | AF23: 92.17 | AG23: 0.17 | AH23: AA | AI23: 4.3799999999999999e-002 | AJ23: =H23+100*O23 -> 112.19 | AK23: 102.4 | AL23: 8 | AM23: 10.2 | AN23: 9 | AO23: 1.7000000000000001e-002 | AP23: 53 | AQ23: 孚日转债!
A24: 240 | B24: 128066 | C24: 亚泰转债! | D24: 2811 | E24: 郑中设计 | F24: 建筑 | G24: 装饰工程 | H24: 91.39 | I24: 1.66e-002 | J24: -4.5000000000000005e-003 | K24: 7.51 | L24: 3.5900000000000001e-002 | M24: 117.5 | N24: 9.67 | O24: 0.17699999999999999 | P24: 77.66 | Q24: 转股中 | R24: 4年57天 | S24: 2年57天 | T24: 4.8 | U24: 9 | V24: 2.1000000000000001e-002 | W24: 0.23699999999999999 | X24: 0.184 | Y24: 20 | Z24: 1.38 | AA24: 6.4000000000000001e-002 | AB24: 5.5800000000000002e-002 | AC24: 5.74e-002 | AD24: 5.3800000000000001e-002 | AE24: 89.94 | AF24: 91.12 | AG24: 0.34 | AH24: AA- | AI24: 6.480000000000001e-002 | AJ24: =H24+100*O24 -> 109.09 | AK24: 105.1 | AL24: 17 | AM24: 14 | AN24: 15 | AO24: -1.9e-002 | AP24: 61 | AQ24: 亚泰转债!
A25: 334 | B25: 128015 | C25: 久其转债! | D25: 2279 | E25: 久其软件 | F25: 计算机及 | G25: 软件开发 | H25: 96.346 | I25: 9.8999999999999991e-003 | J25: -9.8999999999999991e-003 | K25: 4.55 | L25: 3.4099999999999998e-002 | M25: 110.8 | N25: 9.48 | O25: 1.01 | P25: 48 | Q25: 转股中 | R25: 2.30年 | S25: 0.30年 | T25: 7.8 | U25: 13 | V25: 1.8000000000000002e-002 | W25: 0.24100000000000002 | X25: 0.11599999999999999 | Y25: 32 | Z25: 4.59 | AA25: 6.3799999999999996e-002 | AB25: 5.4400000000000004e-002 | AC25: 0.12 | AD25: 0.113 | AE25: 98.25 | AF25: 94.31 | AG25: 0 | AH25: A+ | AI25: 7.3899999999999993e-002 | AJ25: =H25+100*O25 -> 197.346 | AK25: 144.7 | AL25: 277 | AM25: 46.4 | AN25: 253 | AO25: 5.2999999999999999e-002 | AP25: 65 | AQ25: 久其转债!
A26: 239 | B26: 113535 | C26: 大业转债! | D26: 603278 | E26: 大业股份 | F26: 汽车 | G26: 零部件制 | H26: 92.99 | I26: 1.34e-002 | J26: -1.2699999999999999e-002 | K26: 7.73 | L26: 9.1000000000000004e-003 | M26: 113.1 | N26: 12.4 | O26: 0.49200000000000005 | P26: 62.34 | Q26: 转股中 | R26: 3.22年 | S26: 1.22年 | T26: 5 | U26: 3 | V26: 6.0000000000000001e-003 | W26: 0.223 | X26: 0.13900000000000001 | Y26: 22 | Z26: 1.37 | AA26: 6.3700000000000007e-002 | AB26: 5.57e-002 | AC26: 6.8499999999999991e-002 | AD26: 6.5599999999999992e-002 | AE26: 96.02 | AF26: 98.73 | AG26: 0.07 | AH26: AA | AI26: 4.3799999999999999e-002 | AJ26: =H26+100*O26 -> 142.19 | AK26: 123.6 | AL26: 165 | AM26: 24.9 | AN26: 93 | AO26: 3.2000000000000001e-002 | AP26: 50 | AQ26: 大业转债!
A27: 266 | B27: 113528 | C27: 长城转债! | D27: 603897 | E27: 长城科技 | F27: 机械装备 | G27: 专用设备 | H27: 92.99 | I27: 1.0800000000000001e-002 | J27: -6.8000000000000005e-003 | K27: 16.85 | L27: 1.5700000000000002e-002 | M27: 117.6 | N27: 23.45 | O27: 0.29399999999999998 | P27: 71.86 | Q27: 转股中 | R27: 4年10天 | S27: 2年10天 | T27: 6.34 | U27: 2.8 | V27: 5.0000000000000001e-003 | W27: 0.21100000000000002 | X27: 0.152 | Y27: 30 | Z27: 1.64 | AA27: 6.1699999999999998e-002 | AB27: 5.3200000000000004e-002 | AC27: 5.2900000000000003e-002 | AD27: 4.9000000000000002e-002 | AE27: 90.75 | AF27: 91.95 | AG27: 0.25 | AH27: AA- | AI27: 6.480000000000001e-002 | AJ27: =H27+100*O27 -> 122.38999999999999 | AK27: 114.1 | AL27: 76 | AM27: 22.2 | AN27: 60 | AO27: 4.0999999999999995e-002 | AP27: 44 | AQ27: 长城转债!
A28: 257 | B28: 123023 | C28: 迪森转债! | D28: 300335 | E28: 迪森股份 | F28: 能源电力 | G28: 电力供应 | H28: 90.5 | I28: 2.6499999999999999e-002 | J28: -2.1400000000000002e-002 | K28: 4.52 | L28: 3.9100000000000003e-002 | M28: 114.9 | N28: 7.04 | O28: 0.40999999999999998 | P28: 64.2 | Q28: 转股中 | R28: 4年29天 | S28: 3年29天 | T28: 5.29 | U28: 6.5 | V28: 1.3999999999999999e-002 | W28: 0.314 | X28: 0.20100000000000001 | Y28: 17 | Z28: 1.21 | AA28: 6.1699999999999998e-002 | AB28: 5.45e-002 | AC28: 4.8499999999999995e-002 | AD28: 4.4999999999999998e-002 | AE28: 91.79 | AF28: 96.84 | AG28: 0.13 | AH28: AA | AI28: 4.3799999999999999e-002 | AJ28: =H28+100*O28 -> 131.5 | AK28: 116.8 | AL28: 104 | AM28: 20 | AN28: 49 | AO28: -1.e-002 | AP28: 56 | AQ28: 迪森转债!
A29: 314 | B29: 113017 | C29: 吉视转债! | D29: 601929 | E29: 吉视传媒 | F29: 传媒娱乐 | G29: 影视娱乐 | H29: 92 | I29: 8.3000000000000001e-003 | J29: -7.0999999999999995e-003 | K29: 1.79 | L29: 4.6799999999999994e-002 | M29: 108.8 | N29: 2.95 | O29: 0.51600000000000001 | P29: 60.68 | Q29: 转股中 | R29: 2.85年 | S29: 0.85年 | T29: 15.6 | U29: 8.6 | V29: 6.0000000000000001e-003 | W29: 0.28000000000000003 | X29: 0.17000000000000001 | Y29: 56 | Z29: 0.84 | AA29: 6.1399999999999996e-002 | AB29: 5.5199999999999999e-002 | AC29: 0.10199999999999999 | AD29: 9.8699999999999996e-002 | AE29: 97.59 | AF29: 97.46 | AG29: 0.03 | AH29: AA+ | AI29: 3.9900000000000005e-002 | AJ29: =H29+100*O29 -> 143.59999999999999 | AK29: 123.3 | AL29: 161 | AM29: 25.7 | AN29: 101 | AO29: 1.3000000000000001e-002 | AP29: 60 | AQ29: 吉视转债!
A30: 92 | B30: 113596 | C30: 城地转债! | D30: 603887 | E30: 城地香江 | F30: 通信互联 | G30: 通信设备 | H30: 83.14 | I30: 2.7699999999999999e-002 | J30: -2.1000000000000001e-002 | K30: 15.65 | L30: 5.96e-002 | M30: 113.5 | N30: 29.21 | O30: 0.55200000000000005 | P30: 53.58 | Q30: 转股中 | R30: 5.44年 | S30: 3.44年 | T30: 12 | U30: 25 | V30: 2.5000000000000001e-002 | W30: 0.20399999999999999 | X30: 0.109 | Y30: 59 | Z30: 1.62 | AA30: 6.0299999999999999e-002 | AB30: 5.5199999999999999e-002 | AC30: 6.4299999999999996e-002 | AD30: 6.2e-002 | AE30: 82.6 | AF30: 80.67 | AG30: 0.11 | AH30: AA- | AI30: 6.6299999999999998e-002 | AJ30: =H30+100*O30 -> 138.34 | AK30: 112.7 | AL30: 57 | AM30: 30.1 | AN30: 146 | AO30: 2.5000000000000001e-002 | AP30: 15 | AQ30: 城地转债!
A31: 173 | B31: 113568 | C31: 新春转债! | D31: 603667 | E31: 五洲新春 | F31: 机械装备 | G31: 通用设备 | H31: 93.77 | I31: 2.1000000000000001e-002 | J31: -1.4199999999999999e-002 | K31: 7.16 | L31: 1.7000000000000001e-002 | M31: 124.8 | N31: 8.91 | O31: 0.16699999999999998 | P31: 80.36 | Q31: 转股中 | R31: 5年15天 | S31: 3年15天 | T31: 3.3 | U31: 2.6 | V31: 8.0000000000000002e-003 | W31: 0.158 | X31: 0.127 | Y31: 21 | Z31: 1.21 | AA31: 5.9999999999999998e-002 | AB31: 5.0999999999999997e-002 | AC31: 3.5499999999999997e-002 | AD31: 3.2500000000000001e-002 | AE31: 85.49 | AF31: 91.07 | AG31: 0.4 | AH31: AA- | AI31: 6.6299999999999998e-002 | AJ31: =H31+100*O31 -> 110.47 | AK31: 107.2 | AL31: 25 | AM31: 16.1 | AN31: 25 | AO31: 3.7000000000000005e-002 | AP31: 49 | AQ31: 新春转债!
A32: 241 | B32: 110058 | C32: 永鼎转债! | D32: 600105 | E32: 永鼎股份 | F32: 通信互联 | G32: 通信设备 | H32: 91.18 | I32: 3.44e-002 | J32: -2.9500000000000002e-002 | K32: 3.15 | L32: 4.6500000000000007e-002 | M32: 114.9 | N32: 5.04 | O32: 0.45899999999999996 | P32: 62.5 | Q32: 转股中 | R32: 4年56天 | S32: 2年56天 | T32: 2.61 | U32: 36 | V32: 0.153 | W32: 5.9999999999999998e-002 | X32: 3.7999999999999999e-002 | Y32: 43 | Z32: 1.55 | AA32: 5.8600000000000006e-002 | AB32: 5.1500000000000004e-002 | AC32: 5.6399999999999999e-002 | AD32: 5.3200000000000004e-002 | AE32: 93.72 | AF32: 96.54 | AG32: 0.11 | AH32: AA | AI32: 4.3799999999999999e-002 | AJ32: =H32+100*O32 -> 137.08000000000001 | AK32: 119.9 | AL32: 131 | AM32: 23.3 | AN32: 73 | AO32: 5.0000000000000003e-002 | AP32: 51 | AQ32: 永鼎转债!
A33: 16 | B33: 123088 | C33: 威唐转债! | D33: 300707 | E33: 威唐工业 | F33: 汽车 | G33: 零部件制 | H33: 87.99 | I33: 2.7000000000000003e-002 | J33: -1.84e-002 | K33: 13.59 | L33: 2.5699999999999997e-002 | M33: 121.6 | N33: 20.75 | O33: 0.34299999999999997 | P33: 65.49 | Q33: 4月2天 | R33: 5.82年 | S33: 3.82年 | T33: 3.01 | U33: 12 | V33: 4.7e-002 | W33: 0.14099999999999999 | X33: 9.1999999999999998e-002 | Y33: 21 | Z33: 3.14 | AA33: 5.8499999999999996e-002 | AB33: 5.16e-002 | AC33: 4.4900000000000002e-002 | AD33: 4.24e-002 | AE33: 78.01 | AF33: 79.63 | AG33: 0.34 | AH33: A+ | AI33: 7.7300000000000008e-002 | AJ33: =H33+100*O33 -> 122.28999999999999 | AK33: 110.5 | AL33: 37 | AM33: 30.9 | AN33: 152 | AO33: -1.3000000000000001e-002 | AP33: 5 | AQ33: 威唐转债!
A34: 275 | B34: 113524 | C34: 奇精转债! | D34: 603677 | E34: 奇精机械 | F34: 家电 | G34: 零部件制 | H34: 94.83 | I34: 0. | J34: 0. | K34: 11.29 | L34: 0. | M34: 117.3 | N34: 14.08 | O34: 0.183 | P34: 80.18 | Q34: 转股中 | R34: 3.82年 | S34: 1.82年 | T34: 3.3 | U34: 0 | V34: 0. | W34: 0.152 | X34: 0.122 | Y34: 22 | Z34: 2.27 | AA34: 5.8400000000000001e-002 | AB34: 4.9800000000000004e-002 | AC34: 4.1799999999999997e-002 | AD34: 3.8900000000000004e-002 | AE34: 94.48 | AF34: 99.88 | AG34: 0.27 | AH34: AA | AI34: 4.3799999999999999e-002 | AJ34: =H34+100*O34 -> 113.13 | AK34: 109.5 | AL34: 33 | AM34: 9.6 | AN34: 7 | AO34: 2.9999999999999999e-002 | AP34: 48 | AQ34: 奇精转债!
A35: 130 | B35: 123054 | C35: 思特转债! | D35: 300608 | E35: 思特奇 | F35: 通信互联 | G35: 通信设备 | H35: 91 | I35: 2.9500000000000002e-002 | J35: -2.0199999999999999e-002 | K35: 11.25 | L35: 3.3099999999999997e-002 | M35: 121.7 | N35: 16.49 | O35: 0.33399999999999996 | P35: 68.22 | Q35: 转股中 | R35: 5.30年 | S35: 3.30年 | T35: 2.71 | U35: 7.7 | V35: 3.2000000000000001e-002 | W35: 0.153 | X35: 0.10400000000000001 | Y35: 18 | Z35: 2.34 | AA35: 5.7800000000000004e-002 | AB35: 5.0199999999999995e-002 | AC35: 4.1500000000000002e-002 | AD35: 3.8699999999999998e-002 | AE35: 83.97 | AF35: 87.32 | AG35: 0.28 | AH35: AA- | AI35: 6.6299999999999998e-002 | AJ35: =H35+100*O35 -> 124.40000000000001 | AK35: 113.8 | AL35: 69 | AM35: 26.5 | AN35: 115 | AO35: 1.1000000000000001e-002 | AP35: 19 | AQ35: 思特转债!
A36: 79 | B36: 128127 | C36: 文科转债! | D36: 2775 | E36: 文科园林 | F36: 城市公用 | G36: 生态环境 | H36: 89.699 | I36: 2.5099999999999997e-002 | J36: -1.5300000000000001e-002 | K36: 4.34 | L36: 2.12e-002 | M36: 121.3 | N36: 5.37 | O36: 0.11 | P36: 80.82 | Q36: 10天 | R36: 5.50年 | S36: 3.50年 | T36: 9.5 | U36: 25 | V36: 2.9999999999999999e-002 | W36: 0.42700000000000005 | X36: 0.34499999999999997 | Y36: 22 | Z36: 0.84 | AA36: 5.7800000000000004e-002 | AB36: 5.0499999999999996e-002 | AC36: 4.2300000000000004e-002 | AD36: 3.9900000000000005e-002 | AE36: 82.61 | AF36: 85.92 | AG36: 0.46 | AH36: AA- | AI36: 6.6299999999999998e-002 | AJ36: =H36+100*O36 -> 100.699 | AK36: 98.6 | AL36: 5 | AM36: 12.7 | AN36: 12 | AO36: -1.e-003 | AP36: 30 | AQ36: 文科转债!
A37: 233 | B37: 128069 | C37: 华森转债! | D37: 2907 | E37: 华森制药 | F37: 医药 | G37: 化学制药 | H37: 94.784 | I37: 2.06e-002 | J37: -1.6799999999999999e-002 | K37: 11.58 | L37: 2.5699999999999997e-002 | M37: 120 | N37: 18.04 | O37: 0.47700000000000004 | P37: 64.19 | Q37: 转股中 | R37: 4.34年 | S37: 2.34年 | T37: 3 | U37: 2.8 | V37: 1.e-002 | W37: 6.4000000000000001e-002 | X37: 4.0999999999999995e-002 | Y37: 47 | Z37: 4.33 | AA37: 5.7099999999999998e-002 | AB37: 4.8499999999999995e-002 | AC37: 3.61e-002 | AD37: 3.32e-002 | AE37: 88.58 | AF37: 91.9 | AG37: 0.15 | AH37: AA- | AI37: 6.480000000000001e-002 | AJ37: =H37+100*O37 -> 142.48400000000001 | AK37: 125.4 | AL37: 180 | AM37: 33.5 | AN37: 181 | AO37: 1.e-002 | AP37: 45 | AQ37: 华森转债!
A38: 224 | B38: 128073 | C38: 哈尔转债! | D38: 2615 | E38: 哈尔斯 | F38: 其他 | G38: 家居用品 | H38: 95.24 | I38: 2.5000000000000001e-002 | J38: -1.4499999999999999e-002 | K38: 4.05 | L38: 5.1900000000000002e-002 | M38: 115.3 | N38: 5.7 | O38: 0.34000000000000002 | P38: 71.05 | Q38: 转股中 | R38: 3.50年 | S38: 1.50年 | T38: 2.99 | U38: 19 | V38: 6.6000000000000003e-002 | W38: 0.17899999999999999 | X38: 0.127 | Y38: 17 | Z38: 2.09 | AA38: 5.6900000000000006e-002 | AB38: 4.8600000000000004e-002 | AC38: 4.2500000000000003e-002 | AD38: 3.9900000000000005e-002 | AE38: 91.95 | AF38: 92.83 | AG38: 0.2 | AH38: AA- | AI38: 6.480000000000001e-002 | AJ38: =H38+100*O38 -> 129.24000000000001 | AK38: 119.4 | AL38: 122 | AM38: 26.6 | AN38: 116 | AO38: 4.2999999999999997e-002 | AP38: 40 | AQ38: 哈尔转债!
A39: 203 | B39: 128082 | C39: 华锋转债! | D39: 2806 | E39: 华锋股份 | F39: 电子 | G39: 元器件制 | H39: 93.777 | I39: 3.6799999999999999e-002 | J39: -1.77e-002 | K39: 8.98 | L39: 4.6600000000000003e-002 | M39: 121.4 | N39: 11.71 | O39: 0.223 | P39: 76.69 | Q39: 转股中 | R39: 4.79年 | S39: 2.79年 | T39: 3.45 | U39: 7.8 | V39: 2.4e-002 | W39: 0.218 | X39: 0.16699999999999998 | Y39: 16 | Z39: 1.27 | AA39: 5.6799999999999996e-002 | AB39: 4.8499999999999995e-002 | AC39: 3.7699999999999997e-002 | AD39: 3.4599999999999999e-002 | AE39: 84.42 | AF39: 86.31 | AG39: 0.41 | AH39: A+ | AI39: 7.5800000000000006e-002 | AJ39: =H39+100*O39 -> 116.077 | AK39: 110.9 | AL39: 40 | AM39: 24.6 | AN39: 86 | AO39: -4.2000000000000003e-002 | AP39: 59 | AQ39: 华锋转债!
A40: 89 | B40: 113597 | C40: 佳力转债! | D40: 603912 | E40: 佳力图 | F40: 机械装备 | G40: 专用设备 | H40: 92.95 | I40: 2.5999999999999999e-003 | J40: -1.7000000000000001e-003 | K40: 12.77 | L40: 7.9000000000000008e-003 | M40: 124.5 | N40: 23.4 | O40: 0.70299999999999996 | P40: 54.57 | Q40: 转股中 | R40: 5.44年 | S40: 3.44年 | T40: 3 | U40: 5.6 | V40: 2.e-002 | W40: 0.10800000000000001 | X40: 5.9000000000000004e-002 | Y40: 28 | Z40: 3.19 | AA40: 5.6500000000000002e-002 | AB40: 4.8300000000000003e-002 | AC40: 3.32e-002 | AD40: 3.0600000000000002e-002 | AE40: 83.06 | AF40: 88.5 | AG40: 0.11 | AH40: AA- | AI40: 6.6299999999999998e-002 | AJ40: =H40+100*O40 -> 163.25 | AK40: 131.3 | AL40: 222 | AM40: 42.8 | AN40: 239 | AO40: -1.e-003 | AP40: 10 | AQ40: 佳力转债!
A41: 216 | B41: 113546 | C41: 迪贝转债! | D41: 603320 | E41: 迪贝电气 | F41: 家电 | G41: 零部件制 | H41: 94.13 | I41: 2.2799999999999997e-002 | J41: -1.46e-002 | K41: 9.78 | L41: 2.7300000000000001e-002 | M41: 120.6 | N41: 14.1 | O41: 0.35700000000000004 | P41: 69.36 | Q41: 转股中 | R41: 4.67年 | S41: 2.67年 | T41: 2.3 | U41: 1.6 | V41: 6.9999999999999993e-003 | W41: 0.18100000000000002 | X41: 0.125 | Y41: 13 | Z41: 1.91 | AA41: 5.57e-002 | AB41: 4.7500000000000001e-002 | AC41: 3.5900000000000001e-002 | AD41: 3.3000000000000002e-002 | AE41: 84.67 | AF41: 86.38 | AG41: 0.3 | AH41: A+ | AI41: 7.5800000000000006e-002 | AJ41: =H41+100*O41 -> 129.82999999999998 | AK41: 118.9 | AL41: 115 | AM41: 32.5 | AN41: 166 | AO41: 8.0000000000000002e-003 | AP41: 44 | AQ41: 迪贝转债!
A42: 113 | B42: 128118 | C42: 瀛通转债! | D42: 2861 | E42: 瀛通通讯 | F42: 电子 | G42: 电子产品 | H42: 92 | I42: 3.4799999999999998e-002 | J42: -2.8399999999999998e-002 | K42: 17.47 | L42: 2.9500000000000002e-002 | M42: 122.1 | N42: 27.53 | O42: 0.45000000000000001 | P42: 63.46 | Q42: 转股中 | R42: 5.36年 | S42: 3.36年 | T42: 3 | U42: 9.6 | V42: 3.5000000000000003e-002 | W42: 0.14099999999999999 | X42: 8.900000000000001e-002 | Y42: 21 | Z42: 2 | AA42: 5.5599999999999997e-002 | AB42: 4.7899999999999998e-002 | AC42: 3.7499999999999999e-002 | AD42: 3.4799999999999998e-002 | AE42: 83.62 | AF42: 87.26 | AG42: 0.22 | AH42: AA- | AI42: 6.6299999999999998e-002 | AJ42: =H42+100*O42 -> 137. | AK42: 120.5 | AL42: 134 | AM42: 33.3 | AN42: 180 | AO42: -6.0000000000000001e-003 | AP42: 11 | AQ42: 瀛通转债!
A43: 177 | B43: 113566 | C43: 翔港转债! | D43: 603499 | E43: 翔港科技 | F43: 造纸包装 | G43: 包装材料 | H43: 95.62 | I43: 2.0799999999999999e-002 | J43: -7.7000000000000002e-003 | K43: 7.75 | L43: 3.8900000000000004e-002 | M43: 124.5 | N43: 10.77 | O43: 0.32899999999999996 | P43: 71.96 | Q43: 转股中 | R43: 5年9天 | S43: 3年9天 | T43: 1.61 | U43: 16 | V43: 0.105 | W43: 0.10300000000000001 | X43: 7.400000000000001e-002 | Y43: 16 | Z43: 2.73 | AA43: 5.5399999999999998e-002 | AB43: 4.6500000000000007e-002 | AC43: 2.92e-002 | AD43: 2.6200000000000001e-002 | AE43: 82.85 | AF43: 86.49 | AG43: 0.34 | AH43: A+ | AI43: 7.7300000000000008e-002 | AJ43: =H43+100*O43 -> 128.52000000000001 | AK43: 119.3 | AL43: 119 | AM43: 32.8 | AN43: 172 | AO43: 1.3000000000000001e-002 | AP43: 28 | AQ43: 翔港转债!
A44: 29 | B44: 123080 | C44: 海波转债! | D44: 300517 | E44: 海波重科 | F44: 建筑 | G44: 建筑工程 | H44: 93.702 | I44: 1.95e-002 | J44: -1.0700000000000001e-002 | K44: 16.49 | L44: 1.8500000000000003e-002 | M44: 126.5 | N44: 20.91 | O44: 0.188 | P44: 78.86 | Q44: 3月19天 | R44: 5.78年 | S44: 3.78年 | T44: 2.45 | U44: 5.5 | V44: 2.4e-002 | W44: 0.13900000000000001 | X44: 0.11 | Y44: 18 | Z44: 2.3 | AA44: 5.45e-002 | AB44: 4.6300000000000001e-002 | AC44: 2.8799999999999999e-002 | AD44: 2.63e-002 | AE44: 78.28 | AF44: 83.04 | AG44: 0.48 | AH44: A+ | AI44: 7.7300000000000008e-002 | AJ44: =H44+100*O44 -> 112.502 | AK44: 108.5 | AL44: 26 | AM44: 25.5 | AN44: 97 | AO44: -3.3000000000000002e-002 | AP44: 7 | AQ44: 海波转债!
A45: 243 | B45: 127013 | C45: 创维转债! | D45: 810 | E45: 创维数字 | F45: 电子 | G45: 电子产品 | H45: 95.129 | I45: 3.0200000000000001e-002 | J45: -2.6099999999999998e-002 | K45: 7.5 | L45: 3.8800000000000001e-002 | M45: 117.9 | N45: 11.39 | O45: 0.44500000000000001 | P45: 65.85 | Q45: 转股中 | R45: 4年55天 | S45: 2年55天 | T45: 9.78 | U45: 7.7 | V45: 8.0000000000000002e-003 | W45: 0.12300000000000001 | X45: 8.1000000000000003e-002 | Y45: 80 | Z45: 2.05 | AA45: 5.4299999999999994e-002 | AB45: 4.6100000000000002e-002 | AC45: 3.7100000000000001e-002 | AD45: 3.4000000000000002e-002 | AE45: 93.73 | AF45: 99.06 | AG45: 0.11 | AH45: AA | AI45: 4.3799999999999999e-002 | AJ45: =H45+100*O45 -> 139.62900000000002 | AK45: 124.4 | AL45: 171 | AM45: 25.4 | AN45: 96 | AO45: 1.e-002 | AP45: 24 | AQ45: 创维转债!
A46: 290 | B46: 128042 | C46: 凯中转债! | D46: 2823 | E46: 凯中精密 | F46: 能源电力 | G46: 电力设备 | H46: 97.401 | I46: 1.1399999999999999e-002 | J46: -2.5999999999999999e-003 | K46: 10.04 | L46: 4.1500000000000002e-002 | M46: 116.3 | N46: 12.96 | O46: 0.25700000000000001 | P46: 77.47 | Q46: 转股中 | R46: 3.44年 | S46: 1.44年 | T46: 4.16 | U46: 1.3 | V46: 3.0000000000000001e-003 | W46: 0.14400000000000002 | X46: 0.11199999999999999 | Y46: 29 | Z46: 2.14 | AA46: 5.4000000000000006e-002 | AB46: 4.4999999999999998e-002 | AC46: 3.44e-002 | AD46: 3.0800000000000001e-002 | AE46: 96.01 | AF46: 100.64 | AG46: 0.21 | AH46: AA | AI46: 4.3799999999999999e-002 | AJ46: =H46+100*O46 -> 123.101 | AK46: 117.3 | AL46: 107 | AM46: 16.7 | AN46: 26 | AO46: 4.4999999999999998e-002 | AP46: 30 | AQ46: 凯中转债!
A47: 36 | B47: 123077 | C47: 汉得转债! | D47: 300170 | E47: 汉得信息 | F47: 计算机及 | G47: 软件开发 | H47: 93.35 | I47: 1.3600000000000001e-002 | J47: -7.4999999999999997e-003 | K47: 7.21 | L47: 2.41e-002 | M47: 125.5 | N47: 9.72 | O47: 0.25800000000000001 | P47: 74.18 | Q47: 3月7天 | R47: 5.76年 | S47: 3.76年 | T47: 9.37 | U47: 11 | V47: 1.2e-002 | W47: 0.14699999999999999 | X47: 0.109 | Y47: 64 | Z47: 2 | AA47: 5.3699999999999998e-002 | AB47: 4.5899999999999996e-002 | AC47: 2.7699999999999999e-002 | AD47: 2.5699999999999997e-002 | AE47: 87.4 | AF47: 97.68 | AG47: 0.25 | AH47: AA | AI47: 4.53e-002 | AJ47: =H47+100*O47 -> 119.14999999999999 | AK47: 112.5 | AL47: 54 | AM47: 14.8 | AN47: 20 | AO47: 1.9e-002 | AP47: 9 | AQ47: 汉得转债!
A48: 219 | B48: 128076 | C48: 金轮转债! | D48: 2722 | E48: 金轮股份 | F48: 机械装备 | G48: 专用设备 | H48: 90.684 | I48: 2.12e-002 | J48: -1.4800000000000001e-002 | K48: 9.76 | L48: 2.8500000000000001e-002 | M48: 114.9 | N48: 14.76 | O48: 0.371 | P48: 66.12 | Q48: 转股中 | R48: 4.65年 | S48: 2.65年 | T48: 2.14 | U48: 4.9 | V48: 2.6000000000000002e-002 | W48: 0.125 | X48: 8.3000000000000004e-002 | Y48: 17 | Z48: 0.93 | AA48: 5.33e-002 | AB48: 4.7100000000000003e-002 | AC48: 4.82e-002 | AD48: 4.5599999999999995e-002 | AE48: 86.79 | AF48: 86.32 | AG48: 0.23 | AH48: AA- | AI48: 6.480000000000001e-002 | AJ48: =H48+100*O48 -> 127.78399999999999 | AK48: 115.2 | AL48: 86 | AM48: 28.5 | AN48: 133 | AO48: -1.6e-002 | AP48: 43 | AQ48: 金轮转债!
A49: 246 | B49: 113534 | C49: 鼎胜转债! | D49: 603876 | E49: 鼎胜新材 | F49: 有色金属 | G49: 小金属 | H49: 93.25 | I49: 2.9700000000000001e-002 | J49: -1.38e-002 | K49: 12.42 | L49: 4.9000000000000002e-002 | M49: 114.9 | N49: 15.18 | O49: 0.14000000000000001 | P49: 81.82 | Q49: 转股中 | R49: 4年49天 | S49: 2年49天 | T49: 12 | U49: 30 | V49: 2.7000000000000003e-002 | W49: 0.223 | X49: 0.182 | Y49: 54 | Z49: 1.5 | AA49: 5.2999999999999999e-002 | AB49: 4.5999999999999999e-002 | AC49: 4.6500000000000007e-002 | AD49: 4.3400000000000001e-002 | AE49: 93.8 | AF49: 96.62 | AG49: 0.32 | AH49: AA | AI49: 4.3799999999999999e-002 | AJ49: =H49+100*O49 -> 107.25 | AK49: 104.7 | AL49: 15 | AM49: 8.1 | AN49: 5 | AO49: 1.7000000000000001e-002 | AP49: 34 | AQ49: 鼎胜转债!
A50: 39 | B50: 128138 | C50: 侨银转债! | D50: 2973 | E50: 侨银股份 | F50: 城市公用 | G50: 城市公用 | H50: 102.377 | I50: 1.37e-002 | J50: -4.3e-003 | K50: 21.2 | L50: 2.46e-002 | M50: 136.5 | N50: 25.43 | O50: 0.22800000000000001 | P50: 83.37 | Q50: 3月4天 | R50: 5.74年 | S50: 3.74年 | T50: 4.2 | U50: 5 | V50: 1.2e-002 | W50: 4.8000000000000001e-002 | X50: 4.0000000000000001e-002 | Y50: 87 | Z50: 6.49 | AA50: 5.2400000000000002e-002 | AB50: 4.2000000000000003e-002 | AC50: 5.1000000000000004e-003 | AD50: 2.8999999999999998e-003 | AE50: 81.45 | AF50: 95.07 | AG50: 0.38 | AH50: AA- | AI50: 6.6299999999999998e-002 | AJ50: =H50+100*O50 -> 125.17699999999999 | AK50: 121.4 | AL50: 143 | AM50: 26.3 | AN50: 112 | AO50: -1.6e-002 | AP50: 5 | AQ50: 侨银转债!
A51: 321 | B51: 128026 | C51: 众兴转债! | D51: 2772 | E51: 众兴菌业 | F51: 农业 | G51: 种植业 | H51: 95 | I51: 2.1600000000000001e-002 | J51: -1.0200000000000001e-002 | K51: 8.8 | L51: 5.7699999999999994e-002 | M51: 109.3 | N51: 11.45 | O51: 0.23600000000000002 | P51: 76.86 | Q51: 转股中 | R51: 2.81年 | S51: 0.81年 | T51: 9.19 | U51: 21 | V51: 2.4e-002 | W51: 0.28399999999999997 | X51: 0.218 | Y51: 32 | Z51: 1.32 | AA51: 5.2000000000000005e-002 | AB51: 4.53e-002 | AC51: 7.3300000000000004e-002 | AD51: 6.93e-002 | AE51: 95.9 | AF51: 92.32 | AG51: 0.2 | AH51: AA- | AI51: 6.2899999999999998e-002 | AJ51: =H51+100*O51 -> 118.59999999999999 | AK51: 113.1 | AL51: 62 | AM51: 17.2 | AN51: 31 | AO51: 1.8000000000000002e-002 | AP51: 62 | AQ51: 众兴转债!
A52: 267 | B52: 128056 | C52: 今飞转债! | D52: 2863 | E52: 今飞凯达 | F52: 汽车 | G52: 零部件制 | H52: 99.36 | I52: 1.3899999999999999e-002 | J52: 2.8999999999999998e-003 | K52: 5.19 | L52: 4.8499999999999995e-002 | M52: 121 | N52: 6.7 | O52: 0.28300000000000003 | P52: 77.46 | Q52: 转股中 | R52: 4年9天 | S52: 2年9天 | T52: 1.72 | U52: 13 | V52: 7.4999999999999997e-002 | W52: 6.6000000000000003e-002 | X52: 5.0999999999999997e-002 | Y52: 26 | Z52: 1.75 | AA52: 5.16e-002 | AB52: 4.1900000000000007e-002 | AC52: 2.2099999999999998e-002 | AD52: 1.83e-002 | AE52: 88.98 | AF52: 90.91 | AG52: 0.35 | AH52: A+ | AI52: 7.5800000000000006e-002 | AJ52: =H52+100*O52 -> 127.66 | AK52: 121.3 | AL52: 141 | AM52: 30.3 | AN52: 147 | AO52: 2.7999999999999997e-002 | AP52: 57 | AQ52: 今飞转债!
A53: 69 | B53: 128132 | C53: 交建转债! | D53: 2941 | E53: 新疆交建 | F53: 建筑 | G53: 建筑工程 | H53: 89.331 | I53: 2.0899999999999998e-002 | J53: -1.15e-002 | K53: 10.88 | L53: 8.2599999999999993e-002 | M53: 117.3 | N53: 18.57 | O53: 0.52500000000000002 | P53: 58.59 | Q53: 31天 | R53: 5.57年 | S53: 3.57年 | T53: 8.5 | U53: 13 | V53: 1.8000000000000002e-002 | W53: 0.121 | X53: 7.0999999999999994e-002 | Y53: 70 | Z53: 2.9 | AA53: 5.1100000000000007e-002 | AB53: 4.5199999999999997e-002 | AC53: 4.1399999999999999e-002 | AD53: 3.9300000000000002e-002 | AE53: 88.11 | AF53: 92.09 | AG53: 0.11 | AH53: AA | AI53: 4.53e-002 | AJ53: =H53+100*O53 -> 141.83100000000002 | AK53: 120.1 | AL53: 133 | AM53: 28 | AN53: 128 | AO53: 5.5999999999999994e-002 | AP53: 14 | AQ53: 交建转债!
A54: 38 | B54: 123076 | C54: 强力转债! | D54: 300429 | E54: 强力新材 | F54: 化工 | G54: 化工 | H54: 89.581 | I54: 1.7399999999999999e-002 | J54: -4.3e-003 | K54: 11.94 | L54: 5.3800000000000001e-002 | M54: 118.5 | N54: 18.98 | O54: 0.42399999999999999 | P54: 62.91 | Q54: 3月5天 | R54: 5.75年 | S54: 3.75年 | T54: 8.5 | U54: 9.5 | V54: 1.3000000000000001e-002 | W54: 0.13800000000000001 | X54: 8.6999999999999994e-002 | Y54: 62 | Z54: 3.56 | AA54: 5.0900000000000001e-002 | AB54: 4.4800000000000006e-002 | AC54: 3.8800000000000001e-002 | AD54: 3.6799999999999999e-002 | AE54: 80.96 | AF54: 82.53 | AG54: 0.24 | AH54: AA- | AI54: 6.6299999999999998e-002 | AJ54: =H54+100*O54 -> 131.98099999999999 | AK54: 116.3 | AL54: 96 | AM54: 33.7 | AN54: 184 | AO54: 5.0000000000000001e-003 | AP54: 10 | AQ54: 强力转债!
A55: 146 | B55: 113573 | C55: 纵横转债! | D55: 603602 | E55: 纵横通信 | F55: 通信互联 | G55: 通信设备 | H55: 97.28 | I55: 2.0499999999999997e-002 | J55: -1.7500000000000002e-002 | K55: 10.92 | L55: 1.9599999999999999e-002 | M55: 124.7 | N55: 18.81 | O55: 0.67599999999999993 | P55: 58.05 | Q55: 转股中 | R55: 5年57天 | S55: 3年57天 | T55: 2.7 | U55: 8.1 | V55: 3.1e-002 | W55: 0.121 | X55: 7.0000000000000007e-002 | Y55: 22 | Z55: 3.3 | AA55: 5.0599999999999999e-002 | AB55: 4.2000000000000003e-002 | AC55: 2.2400000000000003e-002 | AD55: 1.9599999999999999e-002 | AE55: 81.97 | AF55: 85.78 | AG55: 0.15 | AH55: A+ | AI55: 7.7300000000000008e-002 | AJ55: =H55+100*O55 -> 164.88 | AK55: 136.5 | AL55: 252 | AM55: 50.7 | AN55: 271 | AO55: 1.6e-002 | AP55: 21 | AQ55: 纵横转债!
A56: 35 | B56: 113609 | C56: 永安转债! | D56: 603776 | E56: 永安行 | F56: 城市公用 | G56: 其他 | H56: 91.15 | I56: 1.6299999999999999e-002 | J56: -6.8999999999999999e-003 | K56: 16.98 | L56: 1.8000000000000002e-002 | M56: 120.5 | N56: 20.34 | O56: 9.1999999999999998e-002 | P56: 83.48 | Q56: 3月11天 | R56: 5.76年 | S56: 3.76年 | T56: 8.86 | U56: 36 | V56: 4.4999999999999998e-002 | W56: 0.27800000000000002 | X56: 0.23199999999999998 | Y56: 32 | Z56: 1.15 | AA56: 5.0599999999999999e-002 | AB56: 4.4000000000000004e-002 | AC56: 3.4000000000000002e-002 | AD56: 3.2000000000000001e-002 | AE56: 80.89 | AF56: 83.84 | AG56: 0.52 | AH56: AA- | AI56: 6.6299999999999998e-002 | AJ56: =H56+100*O56 -> 100.35000000000001 | AK56: 98.8 | AL56: 6 | AM56: 15 | AN56: 21 | AO56: 9.6999999999999989e-002 | AP56: 9 | AQ56: 永安转债!
A57: 187 | B57: 128093 | C57: 百川转债! | D57: 2455 | E57: 百川股份 | F57: 化工 | G57: 化工 | H57: 103.31 | I57: 2.4399999999999998e-002 | J57: -1.4000000000000002e-003 | K57: 5.9 | L57: 3.8699999999999998e-002 | M57: 129.8 | N57: 5.87 | O57: 2.7999999999999997e-002 | P57: 100.51 | Q57: 转股中 | R57: 4.87年 | S57: 2.87年 | T57: 5.2 | U57: 47 | V57: 8.900000000000001e-002 | W57: 0.17000000000000001 | X57: 0.17100000000000001 | Y57: 31 | Z57: 2.36 | AA57: 4.9699999999999994e-002 | AB57: 3.9e-002 | AC57: 1.1399999999999999e-002 | AD57: 6.9999999999999993e-003 | AE57: 88.6 | AF57: 96.59 | AG57: 0.59 | AH57: AA- | AI57: 6.480000000000001e-002 | AJ57: =H57+100*O57 -> 106.11 | AK57: 106.1 | AL57: 20 | AM57: 9.5 | AN57: 6 | AO57: 0.12 | AP57: 50 | AQ57: 百川转债!
A58: 10 | B58: 123089 | C58: 九洲转2! | D58: 300040 | E58: 九洲集团 | F58: 能源电力 | G58: 电力设备 | H58: 91.69 | I58: 2.e-002 | J58: -5.1999999999999998e-003 | K58: 6.26 | L58: 3.3000000000000002e-002 | M58: 121 | N58: 8 | O58: 0.17199999999999999 | P58: 78.25 | Q58: 4月6天 | R58: 5.84年 | S58: 3.84年 | T58: 5 | U58: 6.8 | V58: 1.4999999999999999e-002 | W58: 0.20999999999999999 | X58: 0.16399999999999998 | Y58: 24 | Z58: 1.09 | AA58: 4.9699999999999994e-002 | AB58: 4.2999999999999997e-002 | AC58: 3.2099999999999997e-002 | AD58: 2.9999999999999999e-002 | AE58: 80.57 | AF58: 83.81 | AG58: 0.45 | AH58: AA- | AI58: 6.6299999999999998e-002 | AJ58: =H58+100*O58 -> 108.89 | AK58: 105.1 | AL58: 18 | AM58: 21.3 | AN58: 56 | AO58: -1.e-002 | AP58: 6 | AQ58: 九洲转2!
A59: 264 | B59: 110052 | C59: 贵广转债! | D59: 600996 | E59: 贵广网络 | F59: 传媒娱乐 | G59: 影视娱乐 | H59: 98 | I59: 1.4000000000000002e-003 | J59: 1.1000000000000001e-003 | K59: 4.92 | L59: 3.7999999999999999e-002 | M59: 118.5 | N59: 7.94 | O59: 0.58200000000000007 | P59: 61.96 | Q59: 转股中 | R59: 4年14天 | S59: 2年14天 | T59: 15.3 | U59: 5.8 | V59: 4.0000000000000001e-003 | W59: 0.29499999999999998 | X59: 0.183 | Y59: 52 | Z59: 1.14 | AA59: 4.9400000000000006e-002 | AB59: 4.0800000000000003e-002 | AC59: 2.7000000000000003e-002 | AD59: 2.3399999999999997e-002 | AE59: 94.99 | AF59: 100.85 | AG59: 0.07 | AH59: AA+ | AI59: 4.1799999999999997e-002 | AJ59: =H59+100*O59 -> 156.20000000000002 | AK59: 134 | AL59: 239 | AM59: 33.2 | AN59: 179 | AO59: 4.0000000000000001e-003 | AP59: 19 | AQ59: 贵广转债!
A60: 197 | B60: 113557 | C60: 森特转债 | D60: 603098 | E60: 森特股份 | F60: 建筑 | G60: 建筑工程 | H60: 96.06 | I60: 1.67e-002 | J60: -8.8999999999999999e-003 | K60: 8.59 | L60: 1.66e-002 | M60: 120.3 | N60: 10.11 | O60: 0.13100000000000001 | P60: 84.97 | Q60: 转股中 | R60: 4.83年 | S60: 2.83年 | T60: 6 | U60: 5.1 | V60: 9.0000000000000011e-003 | W60: 0.14599999999999999 | X60: 0.124 | Y60: 41 | Z60: 1.99 | AA60: 4.87e-002 | AB60: 4.0899999999999999e-002 | AC60: 2.5899999999999999e-002 | AD60: 2.3399999999999997e-002 | AE60: 86.03 | AF60: 89.38 | AG60: 0.47 | AH60: AA- | AI60: 6.480000000000001e-002 | AJ60: =H60+100*O60 -> 109.16 | AK60: 107.2 | AL60: 24 | AM60: 17.8 | AN60: 36 | AO60: 4.4000000000000004e-002 | AP60: 40 | AQ60: 森特转债
A61: 336 | B61: 128014 | C61: 永东转债! | D61: 2753 | E61: 永东股份 | F61: 化工 | G61: 化工 | H61: 100.777 | I61: 5.4000000000000003e-003 | J61: -5.4000000000000003e-003 | K61: 7.86 | L61: 1.29e-002 | M61: 111.3 | N61: 12.6 | O61: 0.61599999999999999 | P61: 62.38 | Q61: 转股中 | R61: 2年57天 | S61: 57天 | T61: 3.37 | U61: 2.6 | V61: 8.0000000000000002e-003 | W61: 0.114 | X61: 7.0999999999999994e-002 | Y61: 30 | Z61: 1.68 | AA61: 4.82e-002 | AB61: 3.7900000000000003e-002 | AC61: 3.2000000000000001e-002 | AD61: 2.06e-002 | AE61: 99.83 | AF61: 97.85 | AG61: 0 | AH61: AA- | AI61: 6.2899999999999998e-002 | AJ61: =H61+100*O61 -> 162.37700000000001 | AK61: 139.2 | AL61: 260 | AM61: 39.3 | AN61: 218 | AO61: -2.3e-002 | AP61: 41 | AQ61: 永东转债!
A62: 221 | B62: 128074 | C62: 游族转债!! | D62: 2174 | E62: 游族网络 | F62: 通信互联 | G62: 互联网 | H62: 96.988 | I62: 4.7e-002 | J62: -3.7699999999999997e-002 | K62: 11.1 | L62: 6.3200000000000006e-002 | M62: 119.9 | N62: 16.97 | O62: 0.48299999999999998 | P62: 65.41 | Q62: 转股中 | R62: 4.59年 | S62: 2.59年 | T62: 6.83 | U62: 36 | V62: 5.5999999999999994e-002 | W62: 6.7000000000000004e-002 | X62: 4.4000000000000004e-002 | Y62: 102 | Z62: 1.8 | AA62: 4.82e-002 | AB62: 4.0199999999999993e-002 | AC62: 2.3700000000000002e-002 | AD62: 2.12e-002 | AE62: 91.98 | AF62: 94.54 | AG62: 0.15 | AH62: AA | AI62: 4.3799999999999999e-002 | AJ62: =H62+100*O62 -> 145.28800000000001 | AK62: 128.6 | AL62: 208 | AM62: 34 | AN62: 186 | AO62: -5.5e-002 | AP62: 25 | AQ62: 游族转债!!
A63: 322 | B63: 128025 | C63: 特一转债! | D63: 2728 | E63: 特一药业 | F63: 医药 | G63: 化学制药 | H63: 95.629 | I63: 1.8200000000000001e-002 | J63: -1.5700000000000002e-002 | K63: 10.54 | L63: 2.3300000000000001e-002 | M63: 108.8 | N63: 14.7 | O63: 0.33399999999999996 | P63: 71.7 | Q63: 转股中 | R63: 2.79年 | S63: 0.79年 | T63: 2.99 | U63: 3.3 | V63: 1.2e-002 | W63: 0.13900000000000001 | X63: 0.10000000000000001 | Y63: 21 | Z63: 2.12 | AA63: 4.7899999999999998e-002 | AB63: 4.1599999999999998e-002 | AC63: 6.4600000000000005e-002 | AD63: 6.1200000000000004e-002 | AE63: 95.78 | AF63: 91.97 | AG63: 0.11 | AH63: AA- | AI63: 6.2899999999999998e-002 | AJ63: =H63+100*O63 -> 129.029 | AK63: 119.6 | AL63: 123 | AM63: 23.8 | AN63: 77 | AO63: -1.e-003 | AP63: 53 | AQ63: 特一转债!
A64: 297 | B64: 127007 | C64: 湖广转债! | D64: 665 | E64: 湖北广电 | F64: 传媒娱乐 | G64: 影视娱乐 | H64: 96.338 | I64: 2.3999999999999998e-003 | J64: 2.8000000000000004e-003 | K64: 3.81 | L64: 4.0999999999999995e-002 | M64: 112.3 | N64: 5.58 | O64: 0.41100000000000003 | P64: 68.28 | Q64: 转股中 | R64: 3.35年 | S64: 1.35年 | T64: 12.2 | U64: 19 | V64: 1.6e-002 | W64: 0.32500000000000001 | X64: 0.222 | Y64: 37 | Z64: 0.58 | AA64: 4.7800000000000002e-002 | AB64: 4.0599999999999997e-002 | AC64: 4.41e-002 | AD64: 4.0199999999999993e-002 | AE64: 96.65 | AF64: 98.17 | AG64: 0.13 | AH64: AA+ | AI64: 4.1799999999999997e-002 | AJ64: =H64+100*O64 -> 137.43799999999999 | AK64: 124.4 | AL64: 170 | AM64: 26.2 | AN64: 109 | AO64: -6.4000000000000001e-002 | AP64: 19 | AQ64: 湖广转债!
A65: 106 | B65: 123059 | C65: 银信转债! | D65: 300231 | E65: 银信科技 | F65: 计算机及 | G65: 软件开发 | H65: 97 | I65: 2.46e-002 | J65: -1.1599999999999999e-002 | K65: 7.92 | L65: 3.1300000000000001e-002 | M65: 124.1 | N65: 9.91 | O65: 0.214 | P65: 79.92 | Q65: 转股中 | R65: 5.40年 | S65: 3.40年 | T65: 3.91 | U65: 11 | V65: 2.7999999999999997e-002 | W65: 0.11199999999999999 | X65: 8.900000000000001e-002 | Y65: 35 | Z65: 2.66 | AA65: 4.7699999999999992e-002 | AB65: 3.9699999999999999e-002 | AC65: 2.e-002 | AD65: 1.77e-002 | AE65: 82.95 | AF65: 88.39 | AG65: 0.42 | AH65: AA- | AI65: 6.6299999999999998e-002 | AJ65: =H65+100*O65 -> 118.40000000000001 | AK65: 114.1 | AL65: 74 | AM65: 25.7 | AN65: 100 | AO65: -1.9e-002 | AP65: 14 | AQ65: 银信转债!
A66: 296 | B66: 123010 | C66: 博世转债! | D66: 300422 | E66: 博世科 | F66: 城市公用 | G66: 三废处理 | H66: 96.3 | I66: 2.0499999999999997e-002 | J66: -1.5600000000000001e-002 | K66: 9.32 | L66: 1.9699999999999999e-002 | M66: 112.3 | N66: 12.2 | O66: 0.26100000000000001 | P66: 76.39 | Q66: 转股中 | R66: 3.37年 | S66: 1.37年 | T66: 4.3 | U66: 2.9 | V66: 6.9999999999999993e-003 | W66: 0.114 | X66: 8.6999999999999994e-002 | Y66: 38 | Z66: 1.6 | AA66: 4.7599999999999996e-002 | AB66: 4.0500000000000001e-002 | AC66: 4.3799999999999999e-002 | AD66: 4.0000000000000001e-002 | AE66: 93.41 | AF66: 91.28 | AG66: 0.25 | AH66: AA- | AI66: 6.480000000000001e-002 | AJ66: =H66+100*O66 -> 122.40000000000001 | AK66: 116.2 | AL66: 94 | AM66: 22.8 | AN66: 68 | AO66: 1.1000000000000001e-002 | AP66: 32 | AQ66: 博世转债!
A67: 153 | B67: 113576 | C67: 起步转债!! | D67: 603557 | E67: 起步股份 | F67: 服装纺织 | G67: 鞋服行业 | H67: 96.57 | I67: 5.4800000000000001e-002 | J67: -2.0799999999999999e-002 | K67: 7.76 | L67: 0.10099999999999999 | M67: 121.8 | N67: 10.55 | O67: 0.313 | P67: 73.55 | Q67: 转股中 | R67: 5年50天 | S67: 3年50天 | T67: 2.66 | U67: 153 | V67: 0.60099999999999998 | W67: 6.9000000000000006e-002 | X67: 5.0999999999999997e-002 | Y67: 38 | Z67: 2.29 | AA67: 4.7500000000000001e-002 | AB67: 3.9699999999999999e-002 | AC67: 2.52e-002 | AD67: 2.23e-002 | AE67: 84.97 | AF67: 88.35 | AG67: 0.34 | AH67: AA- | AI67: 6.6299999999999998e-002 | AJ67: =H67+100*O67 -> 127.86999999999999 | AK67: 119.6 | AL67: 124 | AM67: 31.2 | AN67: 156 | AO67: 7.0999999999999994e-002 | AP67: 27 | AQ67: 起步转债!!
A68: 5 | B68: 128143 | C68: 锋龙转债! | D68: 2931 | E68: 锋龙股份 | F68: 机械装备 | G68: 专用设备 | H68: 93.3 | I68: 2.0899999999999998e-002 | J68: 2.5000000000000001e-003 | K68: 14.67 | L68: 4.1900000000000007e-002 | M68: 121.7 | N68: 17.97 | O68: 0.14300000000000002 | P68: 81.64 | Q68: 4月25天 | R68: 5.89年 | S68: 3.89年 | T68: 2.45 | U68: 20 | V68: 8.6999999999999994e-002 | W68: 0.11699999999999999 | X68: 9.6000000000000002e-002 | Y68: 21 | Z68: 3.62 | AA68: 4.7199999999999999e-002 | AB68: 4.0500000000000001e-002 | AC68: 2.8999999999999998e-002 | AD68: 2.6600000000000002e-002 | AE68: 77.64 | AF68: 79.31 | AG68: 0.56 | AH68: A+ | AI68: 7.7300000000000008e-002 | AJ68: =H68+100*O68 -> 107.59999999999999 | AK68: 105 | AL68: 16 | AM68: 25.7 | AN68: 98 | AO68: -2.2000000000000002e-002 | AP68: 5 | AQ68: 锋龙转债!
A69: 19 | B69: 123086 | C69: 海兰转债! | D69: 300065 | E69: 海兰信 | F69: 电子 | G69: 电子产品 | H69: 95.301 | I69: 1.15e-002 | J69: 3.0000000000000001e-003 | K69: 10.74 | L69: 4.4699999999999997e-002 | M69: 123.5 | N69: 15.16 | O69: 0.34499999999999997 | P69: 70.84 | Q69: 3月28天 | R69: 5.81年 | S69: 3.81年 | T69: 7.3 | U69: 34 | V69: 4.9000000000000002e-002 | W69: 0.17100000000000001 | X69: 0.121 | Y69: 43 | Z69: 2.86 | AA69: 4.6500000000000007e-002 | AB69: 3.9300000000000002e-002 | AC69: 2.2000000000000002e-002 | AD69: 2.e-002 | AE69: 80.65 | AF69: 85.65 | AG69: 0.32 | AH69: AA- | AI69: 6.6299999999999998e-002 | AJ69: =H69+100*O69 -> 129.80099999999999 | AK69: 119.8 | AL69: 129 | AM69: 34.1 | AN69: 189 | AO69: -4.5999999999999999e-002 | AP69: 4 | AQ69: 海兰转债!
A70: 114 | B70: 128117 | C70: 道恩转债 | D70: 2838 | E70: 道恩股份 | F70: 化工 | G70: 橡胶塑料 | H70: 97.35 | I70: 2.5099999999999997e-002 | J70: -1.15e-002 | K70: 23.76 | L70: 3.0800000000000001e-002 | M70: 123.5 | N70: 29.03 | O70: 0.18899999999999997 | P70: 81.85 | Q70: 转股中 | R70: 5.36年 | S70: 3.36年 | T70: 3.6 | U70: 14 | V70: 3.9e-002 | W70: 3.7000000000000005e-002 | X70: 2.9999999999999999e-002 | Y70: 97 | Z70: 5.62 | AA70: 4.6300000000000001e-002 | AB70: 3.8399999999999997e-002 | AC70: 1.8600000000000002e-002 | AD70: 1.6399999999999998e-002 | AE70: 82.98 | AF70: 88.13 | AG70: 0.44 | AH70: AA- | AI70: 6.6299999999999998e-002 | AJ70: =H70+100*O70 -> 116.25 | AK70: 112.9 | AL70: 59 | AM70: 24.7 | AN70: 91 | AO70: -5.5999999999999994e-002 | AP70: 20 | AQ70: 道恩转债
A71: 60 | B71: 123069 | C71: 金诺转债! | D71: 300505 | E71: 川金诺 | F71: 化工 | G71: 农化 | H71: 98.025 | I71: 1.6500000000000001e-002 | J71: -1.01e-002 | K71: 17.14 | L71: 1.18e-002 | M71: 126 | N71: 19.15 | O71: 9.5000000000000001e-002 | P71: 89.5 | Q71: 2月2天 | R71: 5.65年 | S71: 3.65年 | T71: 3.68 | U71: 12 | V71: 3.3000000000000002e-002 | W71: 0.16399999999999998 | X71: 0.14699999999999999 | Y71: 22 | Z71: 2.33 | AA71: 4.6300000000000001e-002 | AB71: 3.8199999999999998e-002 | AC71: 1.55e-002 | AD71: 1.3500000000000002e-002 | AE71: 81.51 | AF71: 88.26 | AG71: 0.54 | AH71: AA- | AI71: 6.6299999999999998e-002 | AJ71: =H71+100*O71 -> 107.52500000000001 | AK71: 106.5 | AL71: 23 | AM71: 18.3 | AN71: 39 | AO71: 6.9000000000000006e-002 | AP71: 14 | AQ71: 金诺转债!
A72: 116 | B72: 113591 | C72: 胜达转债! | D72: 603687 | E72: 大胜达 | F72: 造纸包装 | G72: 包装用纸 | H72: 96.51 | I72: 2.2000000000000002e-002 | J72: -1.e-002 | K72: 8.83 | L72: 2.4399999999999998e-002 | M72: 122.2 | N72: 10.46 | O72: 0.14300000000000002 | P72: 84.42 | Q72: 转股中 | R72: 5.36年 | S72: 3.36年 | T72: 5.5 | U72: 5.6 | V72: 1.1000000000000001e-002 | W72: 0.152 | X72: 0.128 | Y72: 36 | Z72: 2.33 | AA72: 4.5999999999999999e-002 | AB72: 3.85e-002 | AC72: 2.2000000000000002e-002 | AD72: 1.9599999999999999e-002 | AE72: 83.25 | AF72: 87.29 | AG72: 0.5 | AH72: AA- | AI72: 6.6299999999999998e-002 | AJ72: =H72+100*O72 -> 110.81 | AK72: 108.6 | AL72: 27 | AM72: 21.3 | AN72: 55 | AO72: -3.3000000000000002e-002 | AP72: 22 | AQ72: 胜达转债!
A73: 77 | B73: 113601 | C73: 塞力转债 | D73: 603716 | E73: 塞力医疗 | F73: 医药 | G73: 医药商业 | H73: 95.45 | I73: 1.49e-002 | J73: -1.0500000000000001e-002 | K73: 14.7 | L73: 8.199999999999999e-003 | M73: 121.3 | N73: 16.98 | O73: 0.10300000000000001 | P73: 86.57 | Q73: 8天 | R73: 5.50年 | S73: 3.50年 | T73: 5.43 | U73: 5 | V73: 1.e-002 | W73: 0.17999999999999999 | X73: 0.156 | Y73: 30 | Z73: 1.98 | AA73: 4.5599999999999995e-002 | AB73: 3.85e-002 | AC73: 2.4500000000000001e-002 | AD73: 2.2200000000000001e-002 | AE73: 82.6 | AF73: 85.9 | AG73: 0.54 | AH73: AA- | AI73: 6.6299999999999998e-002 | AJ73: =H73+100*O73 -> 105.75 | AK73: 104.3 | AL73: 14 | AM73: 18.4 | AN73: 41 | AO73: -2.e-003 | AP73: 31 | AQ73: 塞力转债
A74: 20 | B74: 123084 | C74: 高澜转债! | D74: 300499 | E74: 高澜股份 | F74: 能源电力 | G74: 电力设备 | H74: 94.7 | I74: 1.2699999999999999e-002 | J74: 2.5000000000000001e-003 | K74: 8.88 | L74: 3.0200000000000001e-002 | M74: 121.9 | N74: 11.36 | O74: 0.21100000000000002 | P74: 78.17 | Q74: 3月27天 | R74: 5.81年 | S74: 3.81年 | T74: 2.8 | U74: 4.2 | V74: 1.6e-002 | W74: 0.113 | X74: 8.900000000000001e-002 | Y74: 25 | Z74: 3.17 | AA74: 4.5499999999999999e-002 | AB74: 3.8599999999999995e-002 | AC74: 2.6200000000000001e-002 | AD74: 2.3700000000000002e-002 | AE74: 78.25 | AF74: 79.93 | AG74: 0.5 | AH74: A+ | AI74: 7.7300000000000008e-002 | AJ74: =H74+100*O74 -> 115.80000000000001 | AK74: 111.2 | AL74: 44 | AM74: 31.3 | AN74: 158 | AO74: -1.1000000000000001e-002 | AP74: 5 | AQ74: 高澜转债!
A75: 232 | B75: 128070 | C75: 智能转债! | D75: 2877 | E75: 智能自控 | F75: 机械装备 | G75: 通用设备 | H75: 97.45 | I75: 1.5600000000000001e-002 | J75: -1.01e-002 | K75: 6.61 | L75: 1.8500000000000003e-002 | M75: 117.6 | N75: 9.51 | O75: 0.40200000000000002 | P75: 69.51 | Q75: 转股中 | R75: 4.36年 | S75: 无权 | T75: 2.3 | U75: 32 | V75: 0.14199999999999999 | W75: 0.105 | X75: 7.2999999999999995e-002 | Y75: 22 | Z75: 3.08 | AA75: 4.5100000000000001e-002 | AB75: 3.7499999999999999e-002 | AC75: 无权 | AD75: 无权 | AE75: 无权 | AF75: 86.18 | AG75: 0.3 | AH75: A+ | AI75: 7.5800000000000006e-002 | AJ75: =H75+100*O75 -> 137.65000000000001 | AK75: 125.4 | AL75: 181 | AM75: 39.2 | AN75: 216 | AO75: -2.e-003 | AP75: 31 | AQ75: 智能转债!
A76: 226 | B76: 128072 | C76: 翔鹭转债! | D76: 2842 | E76: 翔鹭钨业 | F76: 有色金属 | G76: 小金属 | H76: 94.805 | I76: 1.46e-002 | J76: -7.3000000000000001e-003 | K76: 9.9 | L76: 3.56e-002 | M76: 115.1 | N76: 15.34 | O76: 0.46899999999999997 | P76: 64.54 | Q76: 转股中 | R76: 4.50年 | S76: 2.50年 | T76: 3.02 | U76: 20 | V76: 6.9000000000000006e-002 | W76: 0.111 | X76: 7.2000000000000008e-002 | Y76: 27 | Z76: 2.98 | AA76: 4.4999999999999998e-002 | AB76: 3.8599999999999995e-002 | AC76: 3.3599999999999998e-002 | AD76: 3.0899999999999997e-002 | AE76: 87.65 | AF76: 87.3 | AG76: 0.21 | AH76: AA- | AI76: 6.480000000000001e-002 | AJ76: =H76+100*O76 -> 141.70500000000001 | AK76: 125.1 | AL76: 176 | AM76: 37.4 | AN76: 208 | AO76: 0.105 | AP76: 28 | AQ76: 翔鹭转债!
A77: 307 | B77: 113505 | C77: 杭电转债! | D77: 603618 | E77: 杭电股份 | F77: 能源电力 | G77: 电力设备 | H77: 98.61 | I77: 2.1899999999999999e-002 | J77: -1.41e-002 | K77: 6.15 | L77: 2.3300000000000001e-002 | M77: 112.3 | N77: 7.14 | O77: 0.14499999999999999 | P77: 86.13 | Q77: 转股中 | R77: 3年15天 | S77: 1年15天 | T77: 7.5 | U77: 6.8 | V77: 9.0000000000000011e-003 | W77: 0.17600000000000002 | X77: 0.152 | Y77: 42 | Z77: 1.68 | AA77: 4.4699999999999997e-002 | AB77: 3.6799999999999999e-002 | AC77: 3.5499999999999997e-002 | AD77: 3.0699999999999998e-002 | AE77: 97.67 | AF77: 98.87 | AG77: 0.33 | AH77: AA | AI77: 4.3799999999999999e-002 | AJ77: =H77+100*O77 -> 113.11 | AK77: 111.1 | AL77: 42 | AM77: 12.2 | AN77: 10 | AO77: -4.2999999999999997e-002 | AP77: 41 | AQ77: 杭电转债!
A78: 313 | B78: 128033 | C78: 迪龙转债! | D78: 2658 | E78: 雪迪龙 | F78: 城市公用 | G78: 三废处理 | H78: 96.292 | I78: 9.5999999999999992e-003 | J78: -8.0000000000000002e-003 | K78: 5.29 | L78: 5.7999999999999996e-002 | M78: 108.8 | N78: 8.83 | O78: 0.60699999999999998 | P78: 59.91 | Q78: 转股中 | R78: 2.85年 | S78: 0.85年 | T78: 5.2 | U78: 2.9 | V78: 6.0000000000000001e-003 | W78: 0.16300000000000001 | X78: 9.6999999999999989e-002 | Y78: 32 | Z78: 1.58 | AA78: 4.4400000000000002e-002 | AB78: 3.8199999999999998e-002 | AC78: 5.3699999999999998e-002 | AD78: 5.0499999999999996e-002 | AE78: 97.4 | AF78: 96.94 | AG78: 0.03 | AH78: AA | AI78: 4.1900000000000007e-002 | AJ78: =H78+100*O78 -> 156.99199999999999 | AK78: 132.7 | AL78: 226 | AM78: 35.3 | AN78: 195 | AO78: 1.e-002 | AP78: 39 | AQ78: 迪龙转债!
A79: 328 | B79: 113502 | C79: 嘉澳转债! | D79: 603822 | E79: 嘉澳环保 | F79: 化工 | G79: 化工 | H79: 99.11 | I79: 6.0999999999999995e-003 | J79: -6.0999999999999995e-003 | K79: 18.49 | L79: 3.0699999999999998e-002 | M79: 111.3 | N79: 44.79 | O79: 1.3999999999999999 | P79: 41.28 | Q79: 转股中 | R79: 2.72年 | S79: 0.72年 | T79: 1.85 | U79: 5.4 | V79: 2.8999999999999998e-002 | W79: 0.13600000000000001 | X79: 5.5999999999999994e-002 | Y79: 14 | Z79: 1.8 | AA79: 4.4299999999999999e-002 | AB79: 3.6200000000000003e-002 | AC79: 3.0600000000000002e-002 | AD79: 2.6499999999999999e-002 | AE79: 96.44 | AF79: 94.53 | AG79: 0 | AH79: AA- | AI79: 6.2899999999999998e-002 | AJ79: =H79+100*O79 -> 239.11000000000001 | AK79: 156.9 | AL79: 302 | AM79: 60.5 | AN79: 294 | AO79: 7.0999999999999994e-002 | AP79: 35 | AQ79: 嘉澳转债!
A80: 104 | B80: 128120 | C80: 联诚转债! | D80: 2921 | E80: 联诚精密 | F80: 汽车 | G80: 零部件制 | H80: 94.2 | I80: 2.06e-002 | J80: -5.3e-003 | K80: 18.2 | L80: 3.1200000000000002e-002 | M80: 118.4 | N80: 24.37 | O80: 0.26100000000000001 | P80: 74.68 | Q80: 转股中 | R80: 5.41年 | S80: 3.41年 | T80: 2.6 | U80: 1.7 | V80: 6.9999999999999993e-003 | W80: 0.17499999999999999 | X80: 0.13100000000000001 | Y80: 15 | Z80: 1.99 | AA80: 4.4299999999999999e-002 | AB80: 3.7900000000000003e-002 | AC80: 2.9999999999999999e-002 | AD80: 2.7400000000000001e-002 | AE80: 77.85 | AF80: 76.19 | AG80: 0.49 | AH80: A | AI80: 8.7300000000000003e-002 | AJ80: =H80+100*O80 -> 120.30000000000001 | AK80: 113.7 | AL80: 68 | AM80: 35.9 | AN80: 200 | AO80: 2.e-003 | AP80: 18 | AQ80: 联诚转债!
A81: 196 | B81: 110064 | C81: 建工转债! | D81: 600939 | E81: 重庆建工 | F81: 建筑 | G81: 建筑工程 | H81: 97.72 | I81: 2.2599999999999999e-002 | J81: -1.77e-002 | K81: 3.42 | L81: 2.0899999999999998e-002 | M81: 119.8 | N81: 4.57 | O81: 0.30599999999999999 | P81: 74.84 | Q81: 转股中 | R81: 4.83年 | S81: 2.83年 | T81: 16.6 | U81: 7.5 | V81: 5.0000000000000001e-003 | W81: 0.26700000000000002 | X81: 0.20000000000000001 | Y81: 62 | Z81: 0.9 | AA81: 4.41e-002 | AB81: 3.6499999999999998e-002 | AC81: 2.1600000000000001e-002 | AD81: 1.8799999999999997e-002 | AE81: 92.2 | AF81: 98.72 | AG81: 0.23 | AH81: AA+ | AI81: 4.1799999999999997e-002 | AJ81: =H81+100*O81 -> 128.31999999999999 | AK81: 120.6 | AL81: 136 | AM81: 21.9 | AN81: 58 | AO81: -2.e-003 | AP81: 47 | AQ81: 建工转债!
A82: 279 | B82: 128049 | C82: 华源转债! | D82: 2787 | E82: 华源控股 | F82: 造纸包装 | G82: 包装材料 | H82: 97.65 | I82: 1.23e-002 | J82: -1.8e-003 | K82: 6.04 | L82: 2.7200000000000002e-002 | M82: 114.5 | N82: 7.42 | O82: 0.20000000000000001 | P82: 81.4 | Q82: 转股中 | R82: 3.77年 | S82: 1.77年 | T82: 3.63 | U82: 5.8 | V82: 1.7000000000000001e-002 | W82: 0.19 | X82: 0.155 | Y82: 19 | Z82: 1.27 | AA82: 4.4000000000000004e-002 | AB82: 3.6600000000000001e-002 | AC82: 2.7300000000000001e-002 | AD82: 2.4300000000000002e-002 | AE82: 91.14 | AF82: 90.78 | AG82: 0.39 | AH82: AA- | AI82: 6.480000000000001e-002 | AJ82: =H82+100*O82 -> 117.65000000000001 | AK82: 113.9 | AL82: 72 | AM82: 22.8 | AN82: 67 | AO82: 1.e-002 | AP82: 51 | AQ82: 华源转债!
A83: 163 | B83: 123047 | C83: 久吾转债 | D83: 300631 | E83: 久吾高科 | F83: 机械装备 | G83: 专用设备 | H83: 105.22 | I83: 2.1499999999999998e-002 | J83: -3.9000000000000003e-003 | K83: 16.09 | L83: 3.2099999999999997e-002 | M83: 130.1 | N83: 17.61 | O83: 0.152 | P83: 91.37 | Q83: 转股中 | R83: 5年29天 | S83: 3年29天 | T83: 1.99 | U83: 9.5 | V83: 4.5999999999999999e-002 | W83: 0.114 | X83: 0.10400000000000001 | Y83: 17 | Z83: 2.4 | AA83: 4.4000000000000004e-002 | AB83: 3.3799999999999997e-002 | AC83: 2.5999999999999999e-003 | AD83: -1.e-003 | AE83: 83.63 | AF83: 90.18 | AG83: 0.55 | AH83: A+ | AI83: 7.7300000000000008e-002 | AJ83: =H83+100*O83 -> 120.42 | AK83: 119.1 | AL83: 118 | AM83: 28.9 | AN83: 140 | AO83: 9.0000000000000011e-003 | AP83: 23 | AQ83: 久吾转债
A84: 320 | B84: 123004 | C84: 铁汉转债! | D84: 300197 | E84: 铁汉生态 | F84: 城市公用 | G84: 生态环境 | H84: 96.55 | I84: 1.2199999999999999e-002 | J84: -5.8999999999999999e-003 | K84: 3.12 | L84: 2.63e-002 | M84: 108.8 | N84: 3.82 | O84: 0.182 | P84: 81.68 | Q84: 转股中 | R84: 2.83年 | S84: 0.83年 | T84: 8.03 | U84: 8.3 | V84: 1.1000000000000001e-002 | W84: 9.0999999999999998e-002 | X84: 7.400000000000001e-002 | Y84: 88 | Z84: 1.42 | AA84: 4.3799999999999999e-002 | AB84: 3.7599999999999995e-002 | AC84: 5.2199999999999996e-002 | AD84: 4.9000000000000002e-002 | AE84: 97.5 | AF84: 97.03 | AG84: 0.24 | AH84: AA | AI84: 4.1900000000000007e-002 | AJ84: =H84+100*O84 -> 114.75 | AK84: 111.4 | AL84: 46 | AM84: 13.9 | AN84: 14 | AO84: 5.4000000000000006e-002 | AP84: 47 | AQ84: 铁汉转债!
A85: 145 | B85: 113578 | C85: 全筑转债! | D85: 603030 | E85: 全筑股份 | F85: 建筑 | G85: 装饰工程 | H85: 95.62 | I85: 3.4799999999999998e-002 | J85: -2.35e-002 | K85: 4.33 | L85: 3.3399999999999999e-002 | M85: 118.3 | N85: 5.43 | O85: 0.19899999999999998 | P85: 79.74 | Q85: 转股中 | R85: 5.16年 | S85: 3.16年 | T85: 3.84 | U85: 13 | V85: 3.5000000000000003e-002 | W85: 0.16500000000000001 | X85: 0.13100000000000001 | Y85: 23 | Z85: 1.05 | AA85: 4.2999999999999997e-002 | AB85: 3.6400000000000002e-002 | AC85: 2.52e-002 | AD85: 2.29e-002 | AE85: 89.71 | AF85: 94.55 | AG85: 0.34 | AH85: AA | AI85: 4.53e-002 | AJ85: =H85+100*O85 -> 115.52000000000001 | AK85: 111.5 | AL85: 47 | AM85: 16.9 | AN85: 28 | AO85: 1.8000000000000002e-002 | AP85: 17 | AQ85: 全筑转债!
A86: 21 | B86: 127027 | C86: 靖远转债! | D86: 552 | E86: 靖远煤电 | F86: 煤炭 | G86: 煤炭开采 | H86: 90.711 | I86: 2.5000000000000001e-002 | J86: -1.06e-002 | K86: 2.77 | L86: 3.3599999999999998e-002 | M86: 115.3 | N86: 3.33 | O86: 8.9999999999999997e-002 | P86: 83.18 | Q86: 3月27天 | R86: 5.81年 | S86: 3.81年 | T86: 28 | U86: 160 | V86: 6.4000000000000001e-002 | W86: 0.442 | X86: 0.36799999999999999 | Y86: 63 | Z86: 0.8 | AA86: 4.2999999999999997e-002 | AB86: 3.7999999999999999e-002 | AC86: 3.4799999999999998e-002 | AD86: 3.2799999999999996e-002 | AE86: 87.85 | AF86: 90.57 | AG86: 0.43 | AH86: AA+ | AI86: 4.3299999999999998e-002 | AJ86: =H86+100*O86 -> 99.710999999999999 | AK86: 98.2 | AL86: 4 | AM86: 7.7 | AN86: 4 | AO86: 1.3000000000000001e-002 | AP86: 13 | AQ86: 靖远转债!
A87: 55 | B87: 123071 | C87: 天能转债! | D87: 300569 | E87: 天能重工 | F87: 能源电力 | G87: 风能 | H87: 95.899 | I87: 2.5099999999999997e-002 | J87: -1.5100000000000001e-002 | K87: 13.66 | L87: 3.2500000000000001e-002 | M87: 121.1 | N87: 20.05 | O87: 0.40799999999999997 | P87: 68.13 | Q87: 2月7天 | R87: 5.67年 | S87: 3.67年 | T87: 7 | U87: 4.4 | V87: 6.9999999999999993e-003 | W87: 0.13100000000000001 | X87: 8.900000000000001e-002 | Y87: 54 | Z87: 2.43 | AA87: 4.2900000000000001e-002 | AB87: 3.61e-002 | AC87: 2.1600000000000001e-002 | AD87: 1.95e-002 | AE87: 81.52 | AF87: 84.79 | AG87: 0.31 | AH87: AA- | AI87: 6.6299999999999998e-002 | AJ87: =H87+100*O87 -> 136.69900000000001 | AK87: 123.7 | AL87: 166 | AM87: 38.9 | AN87: 215 | AO87: 0. | AP87: 9 | AQ87: 天能转债!
A88: 324 | B88: 128022 | C88: 众信转债! | D88: 2707 | E88: 众信旅游 | F88: 旅游餐饮 | G88: 旅游 | H88: 97 | I88: 2.0400000000000001e-002 | J88: -1.9e-003 | K88: 6.36 | L88: 7.0699999999999999e-002 | M88: 108.8 | N88: 7.92 | O88: 0.20800000000000002 | P88: 80.3 | Q88: 转股中 | R88: 2.78年 | S88: 0.78年 | T88: 4.56 | U88: 37 | V88: 8.4000000000000005e-002 | W88: 7.9000000000000001e-002 | X88: 6.4000000000000001e-002 | Y88: 58 | Z88: 2.71 | AA88: 4.2800000000000005e-002 | AB88: 3.6499999999999998e-002 | AC88: 4.9699999999999994e-002 | AD88: 4.6300000000000001e-002 | AE88: 95.86 | AF88: 92.05 | AG88: 0.26 | AH88: AA- | AI88: 6.2899999999999998e-002 | AJ88: =H88+100*O88 -> 117.8 | AK88: 113.7 | AL88: 67 | AM88: 17.8 | AN88: 37 | AO88: 0.254 | AP88: 31 | AQ88: 众信转债!
A89: 169 | B89: 123044 | C89: 红相转债! | D89: 300427 | E89: 红相股份 | F89: 能源电力 | G89: 电力设备 | H89: 102.25 | I89: 2.6600000000000002e-002 | J89: 2.e-003 | K89: 16.61 | L89: 5.7300000000000004e-002 | M89: 125.5 | N89: 18.8 | O89: 0.157 | P89: 88.35 | Q89: 转股中 | R89: 5年21天 | S89: 3年21天 | T89: 5.5 | U89: 63 | V89: 0.11199999999999999 | W89: 9.1999999999999998e-002 | X89: 8.1000000000000003e-002 | Y89: 60 | Z89: 2.62 | AA89: 4.2500000000000003e-002 | AB89: 3.3599999999999998e-002 | AC89: 8.3999999999999995e-003 | AD89: 5.3e-003 | AE89: 85.65 | AF89: 91.53 | AG89: 0.5 | AH89: AA- | AI89: 6.6299999999999998e-002 | AJ89: =H89+100*O89 -> 117.95 | AK89: 116.1 | AL89: 93 | AM89: 24.6 | AN89: 87 | AO89: -0.13400000000000001 | AP89: 19 | AQ89: 红相转债!
A90: 28 | B90: 123081 | C90: 精研转债! | D90: 300709 | E90: 精研科技 | F90: 电子 | G90: 电子产品 | H90: 95.777 | I90: 8.199999999999999e-003 | J90: 1.03e-002 | K90: 44.72 | L90: 5.62e-002 | M90: 121.3 | N90: 64.28 | O90: 0.377 | P90: 69.57 | Q90: 3月20天 | R90: 5.79年 | S90: 3.79年 | T90: 5.7 | U90: 30 | V90: 5.5999999999999994e-002 | W90: 0.11 | X90: 7.6999999999999999e-002 | Y90: 52 | Z90: 3.44 | AA90: 4.2500000000000003e-002 | AB90: 3.5900000000000001e-002 | AC90: 2.18e-002 | AD90: 1.9599999999999999e-002 | AE90: 81.06 | AF90: 84.31 | AG90: 0.33 | AH90: AA- | AI90: 6.6299999999999998e-002 | AJ90: =H90+100*O90 -> 133.477 | AK90: 122 | AL90: 153 | AM90: 37.7 | AN90: 209 | AO90: -3.9e-002 | AP90: 3 | AQ90: 精研转债!
A91: 63 | B91: 113604 | C91: 多伦转债! | D91: 603528 | E91: 多伦科技 | F91: 计算机及 | G91: 软件开发 | H91: 93.27 | I91: 2.4500000000000001e-002 | J91: -2.5000000000000001e-003 | K91: 7.68 | L91: 5.3499999999999999e-002 | M91: 117.3 | N91: 10.44 | O91: 0.26800000000000002 | P91: 73.56 | Q91: 59天 | R91: 5.65年 | S91: 3.65年 | T91: 6.4 | U91: 6.4 | V91: 1.1000000000000001e-002 | W91: 0.13300000000000001 | X91: 9.8000000000000004e-002 | Y91: 48 | Z91: 2.98 | AA91: 4.2300000000000004e-002 | AB91: 3.6499999999999998e-002 | AC91: 2.87e-002 | AD91: 2.6699999999999998e-002 | AE91: 81.46 | AF91: 82.22 | AG91: 0.41 | AH91: AA- | AI91: 6.6299999999999998e-002 | AJ91: =H91+100*O91 -> 120.06999999999999 | AK91: 113 | AL91: 60 | AM91: 30.8 | AN91: 151 | AO91: 6.0000000000000001e-003 | AP91: 5 | AQ91: 多伦转债!
A92: 171 | B92: 113570 | C92: 百达转债! | D92: 603331 | E92: 百达精工 | F92: 机械装备 | G92: 机械装备 | H92: 94.04 | I92: 2.1099999999999997e-002 | J92: -8.199999999999999e-003 | K92: 8.71 | L92: 2.9600000000000001e-002 | M92: 115.3 | N92: 11.54 | O92: 0.24600000000000002 | P92: 75.48 | Q92: 转股中 | R92: 5年20天 | S92: 3年20天 | T92: 2.8 | U92: 2.7 | V92: 1.e-002 | W92: 0.17999999999999999 | X92: 0.13600000000000001 | Y92: 16 | Z92: 2.01 | AA92: 4.2099999999999999e-002 | AB92: 3.6299999999999999e-002 | AC92: 3.15e-002 | AD92: 2.8999999999999998e-002 | AE92: 81.9 | AF92: 79.82 | AG92: 0.44 | AH92: A+ | AI92: 7.7300000000000008e-002 | AJ92: =H92+100*O92 -> 118.64000000000001 | AK92: 112.6 | AL92: 55 | AM92: 30.7 | AN92: 150 | AO92: -5.0999999999999997e-002 | AP92: 35 | AQ92: 百达转债!
A93: 98 | B93: 123061 | C93: 航新转债 | D93: 300424 | E93: 航新科技 | F93: 航空航天 | G93: 航空航天 | H93: 100.553 | I93: 3.5000000000000003e-002 | J93: -5.4000000000000003e-003 | K93: 12.93 | L93: 5.21e-002 | M93: 124.8 | N93: 14.86 | O93: 0.156 | P93: 87.01 | Q93: 转股中 | R93: 5.42年 | S93: 3.42年 | T93: 2.5 | U93: 62 | V93: 0.249 | W93: 8.1000000000000003e-002 | X93: 7.0000000000000007e-002 | Y93: 31 | Z93: 2.84 | AA93: 4.1700000000000001e-002 | AB93: 3.3599999999999998e-002 | AC93: 1.15e-002 | AD93: 8.8999999999999999e-003 | AE93: 80.47 | AF93: 84.21 | AG93: 0.57 | AH93: A+ | AI93: 7.7300000000000008e-002 | AJ93: =H93+100*O93 -> 116.15299999999999 | AK93: 114.1 | AL93: 75 | AM93: 29.9 | AN93: 145 | AO93: -7.9000000000000001e-002 | AP93: 11 | AQ93: 航新转债
A94: 85 | B94: 113599 | C94: 嘉友转债! | D94: 603871 | E94: 嘉友国际 | F94: 交通运输 | G94: 物流业 | H94: 101.45 | I94: 1.2199999999999999e-002 | J94: -6.8000000000000005e-003 | K94: 21.51 | L94: 1.0800000000000001e-002 | M94: 126 | N94: 24.82 | O94: 0.17100000000000001 | P94: 86.66 | Q94: 转股中 | R94: 5.46年 | S94: 3.46年 | T94: 7.2 | U94: 6.4 | V94: 9.0000000000000011e-003 | W94: 0.152 | X94: 0.13200000000000001 | Y94: 47 | Z94: 2.37 | AA94: 4.1299999999999996e-002 | AB94: 3.3000000000000002e-002 | AC94: 6.7000000000000002e-003 | AD94: 4.5999999999999999e-003 | AE94: 82.55 | AF94: 89.39 | AG94: 0.49 | AH94: AA- | AI94: 6.6299999999999998e-002 | AJ94: =H94+100*O94 -> 118.55000000000001 | AK94: 116.2 | AL94: 95 | AM94: 26.9 | AN94: 119 | AO94: 7.8e-002 | AP94: 18 | AQ94: 嘉友转债!
A95: 71 | B95: 123065 | C95: 宝莱转债! | D95: 300246 | E95: 宝莱特 | F95: 医药 | G95: 医疗器械 | H95: 97.62 | I95: 1.5300000000000001e-002 | J95: -1.03e-002 | K95: 25.02 | L95: 2.2499999999999999e-002 | M95: 121.4 | N95: 40.54 | O95: 0.58200000000000007 | P95: 61.72 | Q95: 20天 | R95: 5.54年 | S95: 3.54年 | T95: 2.19 | U95: 23 | V95: 0.10800000000000001 | W95: 5.9999999999999998e-002 | X95: 3.7000000000000005e-002 | Y95: 37 | Z95: 4.39 | AA95: 4.0999999999999995e-002 | AB95: 3.4000000000000002e-002 | AC95: 1.83e-002 | AD95: 1.5900000000000001e-002 | AE95: 82.44 | AF95: 85.74 | AG95: 0.22 | AH95: AA- | AI95: 6.6299999999999998e-002 | AJ95: =H95+100*O95 -> 155.82000000000002 | AK95: 133.5 | AL95: 235 | AM95: 47.8 | AN95: 264 | AO95: -3.7999999999999999e-002 | AP95: 12 | AQ95: 宝莱转债!
A96: 274 | B96: 113525 | C96: 台华转债! | D96: 603055 | E96: 台华新材 | F96: 服装纺织 | G96: 纺织行业 | H96: 98.37 | I96: 2.4900000000000002e-002 | J96: -1.3999999999999999e-002 | K96: 5.61 | L96: 6.0499999999999998e-002 | M96: 114.3 | N96: 7.83 | O96: 0.373 | P96: 71.65 | Q96: 转股中 | R96: 3.82年 | S96: 1.82年 | T96: 4.69 | U96: 13 | V96: 2.7999999999999997e-002 | W96: 0.10000000000000001 | X96: 7.2000000000000008e-002 | Y96: 47 | Z96: 1.64 | AA96: 4.0800000000000003e-002 | AB96: 3.3599999999999998e-002 | AC96: 2.2499999999999999e-002 | AD96: 1.9699999999999999e-002 | AE96: 94.45 | AF96: 97.3 | AG96: 0.18 | AH96: AA | AI96: 4.3799999999999999e-002 | AJ96: =H96+100*O96 -> 135.67000000000002 | AK96: 125.1 | AL96: 177 | AM96: 27.8 | AN96: 125 | AO96: 6.5000000000000002e-002 | AP96: 22 | AQ96: 台华转债!
A97: 115 | B97: 123057 | C97: 美联转债! | D97: 300586 | E97: 美联新材 | F97: 化工 | G97: 橡胶塑料 | H97: 96.11 | I97: 2.7900000000000001e-002 | J97: -1.3000000000000001e-002 | K97: 7.77 | L97: 3.32e-002 | M97: 118.2 | N97: 9.91 | O97: 0.22600000000000001 | P97: 78.41 | Q97: 转股中 | R97: 5.36年 | S97: 3.36年 | T97: 2.07 | U97: 21 | V97: 0.105 | W97: 5.7999999999999996e-002 | X97: 4.5999999999999999e-002 | Y97: 35 | Z97: 4.76 | AA97: 4.0300000000000002e-002 | AB97: 3.39e-002 | AC97: 2.3199999999999998e-002 | AD97: 2.0799999999999999e-002 | AE97: 83.24 | AF97: 84.45 | AG97: 0.45 | AH97: AA- | AI97: 6.6299999999999998e-002 | AJ97: =H97+100*O97 -> 118.71000000000001 | AK97: 113.8 | AL97: 70 | AM97: 29.4 | AN97: 143 | AO97: -1.3000000000000001e-002 | AP97: 14 | AQ97: 美联转债!
A98: 3 | B98: 123093 | C98: 金陵转债 | D98: 300651 | E98: 金陵体育 | F98: 其他 | G98: 文化教育 | H98: 103.27 | I98: 3.2300000000000002e-002 | J98: 1.4000000000000002e-003 | K98: 46.37 | L98: 5.2400000000000002e-002 | M98: 129.3 | N98: 49.29 | O98: 9.8000000000000004e-002 | P98: 94.08 | Q98: 5月7天 | R98: 5.92年 | S98: 3.92年 | T98: 2.5 | U98: 55 | V98: 0.21600000000000003 | W98: 4.2000000000000003e-002 | X98: 3.9e-002 | Y98: 60 | Z98: 8.7 | AA98: 3.9800000000000002e-002 | AB98: 3.1300000000000001e-002 | AC98: 7.4000000000000003e-003 | AD98: 4.4000000000000003e-003 | AE98: 78.82 | AF98: 84.27 | AG98: 0.64 | AH98: A+ | AI98: 7.7300000000000008e-002 | AJ98: =H98+100*O98 -> 113.06999999999999 | AK98: 112.5 | AL98: 53 | AM98: 28.2 | AN98: 132 | AO98: -3.1e-002 | AP98: 1 | AQ98: 金陵转债
A99: 250 | B99: 113532 | C99: 海环转债! | D99: 603817 | E99: 海峡环保 | F99: 城市公用 | G99: 三废处理 | H99: 96.54 | I99: 1.52e-002 | J99: -1.2199999999999999e-002 | K99: 5.42 | L99: 1.4999999999999999e-002 | M99: 112.9 | N99: 7.69 | O99: 0.37 | P99: 70.48 | Q99: 转股中 | R99: 4年42天 | S99: 2年42天 | T99: 4.6 | U99: 8.6 | V99: 2.e-002 | W99: 0.18899999999999997 | X99: 0.13300000000000001 | Y99: 24 | Z99: 1.43 | AA99: 3.9699999999999999e-002 | AB99: 3.3599999999999998e-002 | AC99: 3.0899999999999997e-002 | AD99: 2.7799999999999998e-002 | AE99: 93.87 | AF99: 95.02 | AG99: 0.2 | AH99: AA | AI99: 4.3799999999999999e-002 | AJ99: =H99+100*O99 -> 133.54000000000002 | AK99: 122.6 | AL99: 158 | AM99: 27.6 | AN99: 124 | AO99: -8.0000000000000002e-003 | AP99: 26 | AQ99: 海环转债!
A100: 31 | B100: 113610 | C100: 灵康转债 | D100: 603669 | E100: 灵康药业 | F100: 医药 | G100: 化学制药 | H100: 97.36 | I100: 2.4799999999999999e-002 | J100: -2.3399999999999997e-002 | K100: 7.88 | L100: 2.5000000000000001e-003 | M100: 121.1 | N100: 8.81 | O100: 8.900000000000001e-002 | P100: 89.44 | Q100: 3月18天 | R100: 5.78年 | S100: 3.78年 | T100: 5.25 | U100: 15 | V100: 2.8999999999999998e-002 | W100: 9.3000000000000013e-002 | X100: 8.4000000000000005e-002 | Y100: 56 | Z100: 4.12 | AA100: 3.9300000000000002e-002 | AB100: 3.2599999999999997e-002 | AC100: 1.7100000000000001e-002 | AD100: 1.4999999999999999e-002 | AE100: 80.94 | AF100: 84.19 | AG100: 0.58 | AH100: AA- | AI100: 6.6299999999999998e-002 | AJ100: =H100+100*O100 -> 106.26000000000001 | AK100: 105.3 | AL100: 19 | AM100: 21.1 | AN100: 53 | AO100: -1.1000000000000001e-002 | AP100: 12 | AQ100: 灵康转债
A101: 40 | B101: 113608 | C101: 威派转债! | D101: 603956 | E101: 威派格 | F101: 机械装备 | G101: 专用设备 | H101: 98.41 | I101: 1.01e-002 | J101: -2.3999999999999998e-003 | K101: 14.66 | L101: 1.5900000000000001e-002 | M101: 121.6 | N101: 19.24 | O101: 0.29199999999999998 | P101: 76.2 | Q101: 2月23天 | R101: 5.72年 | S101: 3.72年 | T101: 4.2 | U101: 0.6 | V101: 2.e-003 | W101: 6.7000000000000004e-002 | X101: 5.0999999999999997e-002 | Y101: 62 | Z101: 5.47 | AA101: 3.8599999999999995e-002 | AB101: 3.1699999999999999e-002 | AC101: 1.6e-002 | AD101: 1.3600000000000001e-002 | AE101: 78.59 | AF101: 80.22 | AG101: 0.48 | AH101: A+ | AI101: 7.7300000000000008e-002 | AJ101: =H101+100*O101 -> 127.61 | AK101: 120.6 | AL101: 137 | AM101: 40.4 | AN101: 226 | AO101: 9.0000000000000011e-003 | AP101: 6 | AQ101: 威派转债!
A102: 33 | B102: 128139 | C102: 祥鑫转债! | D102: 2965 | E102: 祥鑫科技 | F102: 汽车 | G102: 零部件制 | H102: 97.74 | I102: 1.38e-002 | J102: -2.0999999999999999e-003 | K102: 32.26 | L102: 2.0899999999999998e-002 | M102: 121 | N102: 37.28 | O102: 0.129 | P102: 86.53 | Q102: 3月18天 | R102: 5.78年 | S102: 3.78年 | T102: 6.47 | U102: 9.6 | V102: 1.4999999999999999e-002 | W102: 0.13300000000000001 | X102: 0.115 | Y102: 49 | Z102: 2.87 | AA102: 3.8399999999999997e-002 | AB102: 3.1800000000000002e-002 | AC102: 1.5800000000000002e-002 | AD102: 1.38e-002 | AE102: 80.85 | AF102: 84.1 | AG102: 0.56 | AH102: AA- | AI102: 6.6299999999999998e-002 | AJ102: =H102+100*O102 -> 110.64 | AK102: 108.9 | AL102: 31 | AM102: 24.8 | AN102: 92 | AO102: 9.8000000000000004e-002 | AP102: 6 | AQ102: 祥鑫转债!
A103: 256 | B103: 123024 | C103: 岱勒转债! | D103: 300700 | E103: 岱勒新材 | F103: 机械装备 | G103: 专用设备 | H103: 100.9 | I103: 2.9600000000000001e-002 | J103: -1.1000000000000001e-002 | K103: 16.2 | L103: 3.9800000000000002e-002 | M103: 113 | N103: 18.33 | O103: 0.14199999999999999 | P103: 88.38 | Q103: 转股中 | R103: 3年30天 | S103: 1年30天 | T103: 2.1 | U103: 11 | V103: 5.4000000000000006e-002 | W103: 0.157 | X103: 0.13900000000000001 | Y103: 13 | Z103: 2.7 | AA103: 3.7999999999999999e-002 | AB103: 2.9999999999999999e-002 | AC103: 6.8000000000000005e-003 | AD103: 4.0000000000000001e-003 | AE103: 92.93 | AF103: 90.51 | AG103: 0.47 | AH103: A+ | AI103: 7.5800000000000006e-002 | AJ103: =H103+100*O103 -> 115.10000000000001 | AK103: 113.4 | AL103: 64 | AM103: 20.5 | AN103: 50 | AO103: -6.9999999999999993e-003 | AP103: 36 | AQ103: 岱勒转债!
A104: 295 | B104: 110045 | C104: 海澜转债! | D104: 600398 | E104: 海澜之家 | F104: 服装纺织 | G104: 服装行业 | H104: 98.12 | I104: 1.4000000000000002e-003 | J104: -1.8e-003 | K104: 7.05 | L104: -6.9999999999999993e-003 | M104: 111.1 | N104: 11.75 | O104: 0.63500000000000001 | P104: 60 | Q104: 转股中 | R104: 3.39年 | S104: 1.39年 | T104: 29.5 | U104: 17 | V104: 6.0000000000000001e-003 | W104: 9.6999999999999989e-002 | X104: 5.7999999999999996e-002 | Y104: 305 | Z104: 2.4 | AA104: 3.7900000000000003e-002 | AB104: 3.15e-002 | AC104: 2.5399999999999999e-002 | AD104: 2.2799999999999997e-002 | AE104: 95.74 | AF104: 96.88 | AG104: 0.05 | AH104: AA+ | AI104: 4.1799999999999997e-002 | AJ104: =H104+100*O104 -> 161.62 | AK104: 136.2 | AL104: 249 | AM104: 39.4 | AN104: 220 | AO104: 5.5e-002 | AP104: 59 | AQ104: 海澜转债!
A105: 188 | B105: 113561 | C105: 正裕转债! | D105: 603089 | E105: 正裕工业 | F105: 汽车 | G105: 零部件制 | H105: 98.86 | I105: 2.75e-002 | J105: -1.2800000000000001e-002 | K105: 8.05 | L105: 3.2099999999999997e-002 | M105: 118 | N105: 10.23 | O105: 0.25600000000000001 | P105: 78.69 | Q105: 转股中 | R105: 4.86年 | S105: 2.86年 | T105: 1.5 | U105: 6.7 | V105: 4.5999999999999999e-002 | W105: 8.4000000000000005e-002 | X105: 6.6000000000000003e-002 | Y105: 18 | Z105: 1.93 | AA105: 3.7900000000000003e-002 | AB105: 3.1099999999999999e-002 | AC105: 1.7600000000000001e-002 | AD105: 1.4800000000000001e-002 | AE105: 83.7 | AF105: 83.41 | AG105: 0.46 | AH105: A+ | AI105: 7.5800000000000006e-002 | AJ105: =H105+100*O105 -> 124.46000000000001 | AK105: 119 | AL105: 117 | AM105: 35.3 | AN105: 196 | AO105: 2.6000000000000002e-002 | AP105: 33 | AQ105: 正裕转债!
A106: 150 | B106: 110070 | C106: 凌钢转债! | D106: 600231 | E106: 凌钢股份 | F106: 钢铁 | G106: 炼钢 | H106: 97.76 | I106: 2.0499999999999997e-002 | J106: -1.11e-002 | K106: 2.39 | L106: 2.1400000000000002e-002 | M106: 117.8 | N106: 2.75 | O106: 0.125 | P106: 86.91 | Q106: 转股中 | R106: 5年53天 | S106: 3年53天 | T106: 2.89 | U106: 4.7 | V106: 1.7000000000000001e-002 | W106: 4.4000000000000004e-002 | X106: 3.7999999999999999e-002 | Y106: 66 | Z106: 0.82 | AA106: 3.78e-002 | AB106: 3.1300000000000001e-002 | AC106: 1.95e-002 | AD106: 1.7000000000000001e-002 | AE106: 90.08 | AF106: 94.28 | AG106: 0.44 | AH106: AA | AI106: 4.53e-002 | AJ106: =H106+100*O106 -> 110.26000000000001 | AK106: 108.6 | AL106: 28 | AM106: 14.3 | AN106: 16 | AO106: 6.6000000000000003e-002 | AP106: 20 | AQ106: 凌钢转债!
A107: 149 | B107: 123049 | C107: 维尔转债 | D107: 300190 | E107: 维尔利 | F107: 城市公用 | G107: 三废处理 | H107: 103.78 | I107: 1.8600000000000002e-002 | J107: -1.8e-003 | K107: 7.07 | L107: 2.9100000000000001e-002 | M107: 124.8 | N107: 7.48 | O107: 9.8000000000000004e-002 | P107: 94.52 | Q107: 转股中 | R107: 5年53天 | S107: 3年53天 | T107: 9.17 | U107: 10 | V107: 1.1000000000000001e-002 | W107: 0.16600000000000001 | X107: 0.157 | Y107: 55 | Z107: 1.31 | AA107: 3.7400000000000003e-002 | AB107: 2.8999999999999998e-002 | AC107: 2.8000000000000004e-003 | AD107: 0. | AE107: 84.92 | AF107: 90.46 | AG107: 0.58 | AH107: AA- | AI107: 6.6299999999999998e-002 | AJ107: =H107+100*O107 -> 113.58 | AK107: 113 | AL107: 61 | AM107: 22.6 | AN107: 63 | AO107: 4.5999999999999999e-002 | AP107: 15 | AQ107: 维尔转债
A108: 117 | B108: 128116 | C108: 瑞达转债! | D108: 2961 | E108: 瑞达期货 | F108: 金融 | G108: 期货行业 | H108: 95.2 | I108: 2.9300000000000003e-002 | J108: -1.95e-002 | K108: 22.38 | L108: 3.04e-002 | M108: 115.3 | N108: 29.82 | O108: 0.26800000000000002 | P108: 75.05 | Q108: 转股中 | R108: 5.36年 | S108: 3.36年 | T108: 6.5 | U108: 12 | V108: 1.9e-002 | W108: 6.5000000000000002e-002 | X108: 4.9000000000000002e-002 | Y108: 100 | Z108: 5.66 | AA108: 3.7200000000000004e-002 | AB108: 3.1699999999999999e-002 | AC108: 2.4900000000000002e-002 | AD108: 2.2700000000000001e-002 | AE108: 88.87 | AF108: 91.38 | AG108: 0.32 | AH108: AA | AI108: 4.53e-002 | AJ108: =H108+100*O108 -> 122. | AK108: 115.3 | AL108: 88 | AM108: 24 | AN108: 82 | AO108: 2.8999999999999998e-002 | AP108: 17 | AQ108: 瑞达转债!
A109: 18 | B109: 123085 | C109: 万顺转2! | D109: 300057 | E109: 万顺新材 | F109: 有色金属 | G109: 铝金属 | H109: 92.11 | I109: 1.72e-002 | J109: 1.1200000000000002e-002 | K109: 4.71 | L109: 6.3200000000000006e-002 | M109: 113.3 | N109: 6.24 | O109: 0.22 | P109: 75.48 | Q109: 3月28天 | R109: 5.81年 | S109: 3.81年 | T109: 9 | U109: 48 | V109: 5.7000000000000002e-002 | W109: 0.28300000000000003 | X109: 0.214 | Y109: 32 | Z109: 0.93 | AA109: 3.7000000000000005e-002 | AB109: 3.2599999999999997e-002 | AC109: 3.0800000000000001e-002 | AD109: 2.8799999999999999e-002 | AE109: 80.62 | AF109: 78.62 | AG109: 0.45 | AH109: AA- | AI109: 6.6299999999999998e-002 | AJ109: =H109+100*O109 -> 114.11 | AK109: 108.7 | AL109: 29 | AM109: 28.1 | AN109: 130 | AO109: 4.9000000000000002e-002 | AP109: 5 | AQ109: 万顺转2!
A110: 175 | B110: 113567 | C110: 君禾转债! | D110: 603617 | E110: 君禾股份 | F110: 机械装备 | G110: 通用设备 | H110: 99.99 | I110: 2.0799999999999999e-002 | J110: 7.4000000000000003e-003 | K110: 9.7 | L110: 5.0900000000000001e-002 | M110: 119.3 | N110: 11.46 | O110: 0.18100000000000002 | P110: 84.64 | Q110: 转股中 | R110: 5年13天 | S110: 3年13天 | T110: 2.1 | U110: 4 | V110: 1.9e-002 | W110: 0.109 | X110: 9.1999999999999998e-002 | Y110: 19 | Z110: 3 | AA110: 3.6600000000000001e-002 | AB110: 2.9600000000000001e-002 | AC110: 1.3999999999999999e-002 | AD110: 1.1200000000000002e-002 | AE110: 82.6 | AF110: 82.83 | AG110: 0.55 | AH110: A+ | AI110: 7.7300000000000008e-002 | AJ110: =H110+100*O110 -> 118.09 | AK110: 115.3 | AL110: 87 | AM110: 32.5 | AN110: 165 | AO110: 2.3e-002 | AP110: 36 | AQ110: 君禾转债!
A111: 15 | B111: 123087 | C111: 明电转债! | D111: 300739 | E111: 明阳电路 | F111: 电子 | G111: 元器件制 | H111: 99.31 | I111: 2.9600000000000001e-002 | J111: -1.0800000000000001e-002 | K111: 15.9 | L111: 2.8500000000000001e-002 | M111: 121.2 | N111: 16.62 | O111: 3.7999999999999999e-002 | P111: 95.67 | Q111: 4月2天 | R111: 5.82年 | S111: 4.82年 | T111: 6.73 | U111: 17 | V111: 2.5000000000000001e-002 | W111: 0.152 | X111: 0.14499999999999999 | Y111: 44 | Z111: 3.23 | AA111: 3.5499999999999997e-002 | AB111: 2.8999999999999998e-002 | AC111: 1.47e-002 | AD111: 1.21e-002 | AE111: 77.89 | AF111: 84.07 | AG111: 0.66 | AH111: AA- | AI111: 6.6299999999999998e-002 | AJ111: =H111+100*O111 -> 103.11 | AK111: 103 | AL111: 10 | AM111: 18.9 | AN111: 44 | AO111: -3.1e-002 | AP111: 4 | AQ111: 明电转债!
A112: 7 | B112: 123092 | C112: 天壕转债 | D112: 300332 | E112: 天壕环境 | F112: 石油天然 | G112: 天然气 | H112: 99.79 | I112: 1.e-002 | J112: -3.2000000000000002e-003 | K112: 4.52 | L112: 1.1200000000000002e-002 | M112: 121.6 | N112: 5.2 | O112: 0.14800000000000002 | P112: 86.92 | Q112: 4月11天 | R112: 5.84年 | S112: 3.84年 | T112: 4.23 | U112: 4.3 | V112: 1.e-002 | W112: 0.106 | X112: 9.1999999999999998e-002 | Y112: 40 | Z112: 1.15 | AA112: 3.5200000000000002e-002 | AB112: 2.8500000000000001e-002 | AC112: 1.1899999999999999e-002 | AD112: 9.7000000000000003e-003 | AE112: 77.87 | AF112: 79.49 | AG112: 0.61 | AH112: A+ | AI112: 7.7300000000000008e-002 | AJ112: =H112+100*O112 -> 114.59 | AK112: 112.7 | AL112: 56 | AM112: 33.2 | AN112: 177 | AO112: 1.e-003 | AP112: 4 | AQ112: 天壕转债
A113: 112 | B113: 113036 | C113: 宁建转债! | D113: 601789 | E113: 宁波建工 | F113: 建筑 | G113: 建筑工程 | H113: 98 | I113: 3.1400000000000004e-002 | J113: -1.67e-002 | K113: 3.81 | L113: 4.3799999999999999e-002 | M113: 117.3 | N113: 4.86 | O113: 0.25 | P113: 78.4 | Q113: 转股中 | R113: 5.38年 | S113: 3.38年 | T113: 5.4 | U113: 2.8 | V113: 5.0000000000000001e-003 | W113: 0.14499999999999999 | X113: 0.114 | Y113: 37 | Z113: 1.25 | AA113: 3.4700000000000002e-002 | AB113: 2.87e-002 | AC113: 1.6500000000000001e-002 | AD113: 1.44e-002 | AE113: 88.87 | AF113: 92.89 | AG113: 0.34 | AH113: AA | AI113: 4.53e-002 | AJ113: =H113+100*O113 -> 123. | AK113: 117.6 | AL113: 111 | AM113: 24.7 | AN113: 90 | AO113: 3.3000000000000002e-002 | AP113: 8 | AQ113: 宁建转债!
A114: 67 | B114: 123067 | C114: 斯莱转债 | D114: 300382 | E114: 斯莱克 | F114: 机械装备 | G114: 专用设备 | H114: 100.683 | I114: 1.3999999999999999e-002 | J114: -9.300000000000001e-003 | K114: 7.95 | L114: 8.8999999999999999e-003 | M114: 121.2 | N114: 9.38 | O114: 0.188 | P114: 84.75 | Q114: 32天 | R114: 5.58年 | S114: 3.58年 | T114: 3.88 | U114: 4.1 | V114: 1.e-002 | W114: 8.5999999999999993e-002 | X114: 7.2999999999999995e-002 | Y114: 45 | Z114: 4.4 | AA114: 3.4599999999999999e-002 | AB114: 2.7699999999999999e-002 | AC114: 9.1000000000000004e-003 | AD114: 6.8999999999999999e-003 | AE114: 82.11 | AF114: 85.4 | AG114: 0.52 | AH114: AA- | AI114: 6.6299999999999998e-002 | AJ114: =H114+100*O114 -> 119.483 | AK114: 116.6 | AL114: 101 | AM114: 31.2 | AN114: 155 | AO114: -8.199999999999999e-002 | AP114: 14 | AQ114: 斯莱转债
A115: 160 | B115: 113574 | C115: 华体转债! | D115: 603679 | E115: 华体科技 | F115: 城市公用 | G115: 城市公用 | H115: 98.75 | I115: 1.78e-002 | J115: -1.72e-002 | K115: 18.86 | L115: 4.7999999999999996e-003 | M115: 116.4 | N115: 33.99 | O115: 0.78000000000000003 | P115: 55.49 | Q115: 转股中 | R115: 5年40天 | S115: 3年40天 | T115: 2.09 | U115: 9.6 | V115: 4.7e-002 | W115: 7.8e-002 | X115: 4.2999999999999997e-002 | Y115: 27 | Z115: 3.68 | AA115: 3.3599999999999998e-002 | AB115: 2.75e-002 | AC115: 1.7899999999999999e-002 | AD115: 1.5100000000000001e-002 | AE115: 82.22 | AF115: 80.39 | AG115: 0.12 | AH115: A+ | AI115: 7.7300000000000008e-002 | AJ115: =H115+100*O115 -> 176.75 | AK115: 142 | AL115: 270 | AM115: 59.8 | AN115: 293 | AO115: -4.0000000000000001e-002 | AP115: 16 | AQ115: 华体转债!
A116: 80 | B116: 110074 | C116: 精达转债! | D116: 600577 | E116: 精达股份 | F116: 电子 | G116: 电子产品 | H116: 98.17 | I116: 7.0300000000000001e-002 | J116: -3.3599999999999998e-002 | K116: 3.16 | L116: 8.5900000000000004e-002 | M116: 117.3 | N116: 3.75 | O116: 0.16500000000000001 | P116: 84.27 | Q116: 6.1天 | R116: 5.50年 | S116: 3.50年 | T116: 7.87 | U116: 65 | V116: 8.5000000000000006e-002 | W116: 0.13 | X116: 0.109 | Y116: 61 | Z116: 1.72 | AA116: 3.3599999999999998e-002 | AB116: 2.7799999999999998e-002 | AC116: 1.55e-002 | AD116: 1.34e-002 | AE116: 88.4 | AF116: 92.39 | AG116: 0.43 | AH116: AA | AI116: 4.53e-002 | AJ116: =H116+100*O116 -> 114.67 | AK116: 112.1 | AL116: 50 | AM116: 19.7 | AN116: 47 | AO116: 9.6999999999999989e-002 | AP116: 11 | AQ116: 精达转债!
A117: 166 | B117: 123045 | C117: 雷迪转债 | D117: 300652 | E117: 雷迪克 | F117: 汽车 | G117: 零部件制 | H117: 101.6 | I117: 3.44e-002 | J117: -1.2500000000000001e-002 | K117: 16.63 | L117: 4.1299999999999996e-002 | M117: 119.4 | N117: 20.13 | O117: 0.23000000000000001 | P117: 82.61 | Q117: 转股中 | R117: 5年21天 | S117: 3年21天 | T117: 1.66 | U117: 27 | V117: 0.16300000000000001 | W117: 0.106 | X117: 8.8000000000000009e-002 | Y117: 16 | Z117: 1.83 | AA117: 3.3300000000000003e-002 | AB117: 2.63e-002 | AC117: 9.1000000000000004e-003 | AD117: 6.3e-003 | AE117: 82.54 | AF117: 82.76 | AG117: 0.53 | AH117: A+ | AI117: 7.7300000000000008e-002 | AJ117: =H117+100*O117 -> 124.59999999999999 | AK117: 120.6 | AL117: 135 | AM117: 37.8 | AN117: 210 | AO117: -4.0000000000000001e-003 | AP117: 35 | AQ117: 雷迪转债
A118: 51 | B118: 123073 | C118: 同和转债! | D118: 300636 | E118: 同和药业 | F118: 医药 | G118: 原料药 | H118: 102.148 | I118: 2.8900000000000002e-002 | J118: -4.0000000000000002e-004 | K118: 21.61 | L118: 4.4500000000000005e-002 | M118: 122.4 | N118: 23.8 | O118: 0.125 | P118: 90.8 | Q118: 2月13天 | R118: 5.68年 | S118: 3.68年 | T118: 3.6 | U118: 11 | V118: 2.8999999999999998e-002 | W118: 0.13 | X118: 0.11800000000000001 | Y118: 28 | Z118: 3.68 | AA118: 3.3099999999999997e-002 | AB118: 2.6099999999999998e-002 | AC118: 6.1999999999999998e-003 | AD118: 3.8e-003 | AE118: 78.79 | AF118: 80.96 | AG118: 0.64 | AH118: A+ | AI118: 7.7300000000000008e-002 | AJ118: =H118+100*O118 -> 114.648 | AK118: 113.5 | AL118: 65 | AM118: 32.5 | AN118: 167 | AO118: -4.4999999999999998e-002 | AP118: 8 | AQ118: 同和转债!
A119: 155 | B119: 128105 | C119: 长集转债 | D119: 2616. | E119: 长青集团 | F119: 城市公用 | G119: 三废处理 | H119: 98 | I119: 3.4799999999999998e-002 | J119: -1.4800000000000001e-002 | K119: 7 | L119: 4.4800000000000006e-002 | M119: 115.3 | N119: 8.11 | O119: 0.13500000000000001 | P119: 86.31 | Q119: 转股中 | R119: 5年49天 | S119: 3年49天 | T119: 8 | U119: 10 | V119: 1.3000000000000001e-002 | W119: 0.154 | X119: 0.13300000000000001 | Y119: 52 | Z119: 2.06 | AA119: 3.2899999999999999e-002 | AB119: 2.7200000000000002e-002 | AC119: 1.78e-002 | AD119: 1.54e-002 | AE119: 89.83 | AF119: 92.29 | AG119: 0.45 | AH119: AA | AI119: 4.53e-002 | AJ119: =H119+100*O119 -> 111.5 | AK119: 109.7 | AL119: 34 | AM119: 17.4 | AN119: 33 | AO119: 1.6e-002 | AP119: 12 | AQ119: 长集转债
A120: 329 | B120: 128018 | C120: 时达转债!! | D120: 2527 | E120: 新时达 | F120: 机械装备 | G120: 机器人及 | H120: 100.297 | I120: 5.0000000000000001e-004 | J120: 1.8e-003 | K120: 5.57 | L120: 2.3900000000000001e-002 | M120: 109.3 | N120: 7.42 | O120: 0.33600000000000002 | P120: 75.07 | Q120: 转股中 | R120: 2.71年 | S120: 回售内 | T120: 8.8 | U120: 44 | V120: 5.0000000000000003e-002 | W120: 0.255 | X120: 0.191 | Y120: 35 | Z120: 1.36 | AA120: 3.2799999999999996e-002 | AB120: 2.6000000000000002e-002 | AC120: 回售内 | AD120: 回售内 | AE120: 100.43 | AF120: 97.97 | AG120: 0.1 | AH120: AA | AI120: 4.1900000000000007e-002 | AJ120: =H120+100*O120 -> 133.89699999999999 | AK120: 125.5 | AL120: 185 | AM120: 25.1 | AN120: 94 | AO120: 3.1e-002 | AP120: 41 | AQ120: 时达转债!!
A121: 207 | B121: 113549 | C121: 白电转债 | D121: 603861 | E121: 白云电器 | F121: 能源电力 | G121: 电力设备 | H121: 98.9 | I121: 2.06e-002 | J121: -2.12e-002 | K121: 7.79 | L121: -1.2999999999999999e-003 | M121: 114.8 | N121: 8.88 | O121: 0.127 | P121: 87.73 | Q121: 转股中 | R121: 4.74年 | S121: 2.74年 | T121: 8.8 | U121: 5.6 | V121: 6.9999999999999993e-003 | W121: 0.25600000000000001 | X121: 0.22399999999999998 | Y121: 34 | Z121: 1.47 | AA121: 3.2599999999999997e-002 | AB121: 2.6699999999999998e-002 | AC121: 1.52e-002 | AD121: 1.3000000000000001e-002 | AE121: 91.31 | AF121: 94.05 | AG121: 0.44 | AH121: AA | AI121: 4.3799999999999999e-002 | AJ121: =H121+100*O121 -> 111.60000000000001 | AK121: 110.1 | AL121: 35 | AM121: 16 | AN121: 24 | AO121: 2.6000000000000002e-002 | AP121: 34 | AQ121: 白电转债
A122: 133 | B122: 123053 | C122: 宝通转债! | D122: 300031 | E122: 宝通科技 | F122: 通信互联 | G122: 互联网 | H122: 102.77 | I122: 1.9799999999999998e-002 | J122: 1.1999999999999999e-003 | K122: 16.45 | L122: 4.9800000000000004e-002 | M122: 121.3 | N122: 20.8 | O122: 0.29899999999999999 | P122: 79.09 | Q122: 转股中 | R122: 5.29年 | S122: 3.29年 | T122: 5 | U122: 11 | V122: 2.1000000000000001e-002 | W122: 7.6999999999999999e-002 | X122: 6.0999999999999999e-002 | Y122: 65 | Z122: 2.27 | AA122: 3.2599999999999997e-002 | AB122: 2.5399999999999999e-002 | AC122: 4.0999999999999995e-003 | AD122: 1.7000000000000001e-003 | AE122: 83.72 | AF122: 87.07 | AG122: 0.42 | AH122: AA- | AI122: 6.6299999999999998e-002 | AJ122: =H122+100*O122 -> 132.66999999999999 | AK122: 126.5 | AL122: 191 | AM122: 39.4 | AN122: 221 | AO122: -2.e-003 | AP122: 8 | AQ122: 宝通转债!
A123: 61 | B123: 123068 | C123: 弘信转债 | D123: 300657 | E123: 弘信电子 | F123: 电子 | G123: 元器件制 | H123: 101.498 | I123: 6.8999999999999999e-003 | J123: -3.7000000000000002e-003 | K123: 16.94 | L123: 5.3e-003 | M123: 121.2 | N123: 18.45 | O123: 0.105 | P123: 91.82 | Q123: 2月1天 | R123: 5.65年 | S123: 3.65年 | T123: 5.7 | U123: 12 | V123: 2.1000000000000001e-002 | W123: 9.8000000000000004e-002 | X123: 8.9999999999999997e-002 | Y123: 58 | Z123: 3.96 | AA123: 3.2599999999999997e-002 | AB123: 2.58e-002 | AC123: 6.8000000000000005e-003 | AD123: 4.5999999999999999e-003 | AE123: 81.7 | AF123: 84.98 | AG123: 0.6 | AH123: AA- | AI123: 6.6299999999999998e-002 | AJ123: =H123+100*O123 -> 111.998 | AK123: 111.2 | AL123: 43 | AM123: 26.2 | AN123: 108 | AO123: 5.9000000000000004e-002 | AP123: 7 | AQ123: 弘信转债
A124: 1 | B124: 113042 | C124: 上银转债! | D124: 601229 | E124: 上海银行 | F124: 金融 | G124: 银行行业 | H124: 100.46 | I124: 4.5000000000000005e-003 | J124: -1.2999999999999999e-003 | K124: 8.67 | L124: 9.300000000000001e-003 | M124: 120.9 | N124: 11.03 | O124: 0.27800000000000002 | P124: 78.6 | Q124: 5月10天 | R124: 5.93年 | S124: 无权 | T124: 200 | U124: 1196. | V124: 5.9999999999999998e-002 | W124: 0.16200000000000001 | X124: 0.128 | Y124: 1232. | Z124: 0.74 | AA124: 3.2599999999999997e-002 | AB124: 2.6200000000000001e-002 | AC124: 无权 | AD124: 无权 | AE124: 无权 | AF124: 96.24 | AG124: 0.35 | AH124: AAA | AI124: 4.0300000000000002e-002 | AJ124: =H124+100*O124 -> 128.25999999999999 | AK124: 122.3 | AL124: 154 | AM124: 26.1 | AN124: 103 | AO124: 4.2999999999999997e-002 | AP124: 6 | AQ124: 上银转债!
A125: 90 | B125: 123063 | C125: 大禹转债 | D125: 300021 | E125: 大禹节水 | F125: 化工 | G125: 橡胶塑料 | H125: 106.698 | I125: 3.1899999999999998e-002 | J125: -1.0500000000000001e-002 | K125: 4.88 | L125: 3.39e-002 | M125: 126.5 | N125: 4.94 | O125: 8.0000000000000002e-002 | P125: 98.79 | Q125: 转股中 | R125: 5.44年 | S125: 4.44年 | T125: 6.38 | U125: 16 | V125: 2.4e-002 | W125: 0.16399999999999998 | X125: 0.16200000000000001 | Y125: 39 | Z125: 2.7 | AA125: 3.2500000000000001e-002 | AB125: 2.41e-002 | AC125: 5.9999999999999995e-004 | AD125: -2.3e-003 | AE125: 80.06 | AF125: 89.92 | AG125: 0.63 | AH125: AA- | AI125: 6.6299999999999998e-002 | AJ125: =H125+100*O125 -> 114.69799999999999 | AK125: 114.6 | AL125: 80 | AM125: 24.7 | AN125: 89 | AO125: 2.1000000000000001e-002 | AP125: 16 | AQ125: 大禹转债
A126: 214 | B126: 110059 | C126: 浦发转债! | D126: 600000 | E126: 浦发银行 | F126: 金融 | G126: 银行行业 | H126: 101.82 | I126: 1.2999999999999999e-003 | J126: 2.0999999999999999e-003 | K126: 10.97 | L126: 1.29e-002 | M126: 117.6 | N126: 14.45 | O126: 0.34100000000000003 | P126: 75.92 | Q126: 转股中 | R126: 4.69年 | S126: 无权 | T126: 500 | U126: 289 | V126: 6.0000000000000001e-003 | W126: 0.155 | X126: 0.11800000000000001 | Y126: 3220. | Z126: 0.63 | AA126: 3.2099999999999997e-002 | AB126: 2.5099999999999997e-002 | AC126: 无权 | AD126: 无权 | AE126: 无权 | AF126: 98.88 | AG126: 0.26 | AH126: AAA | AI126: 3.8800000000000001e-002 | AJ126: =H126+100*O126 -> 135.91999999999999 | AK126: 127.7 | AL126: 202 | AM126: 28.8 | AN126: 139 | AO126: 7.8e-002 | AP126: 74 | AQ126: 浦发转债!
A127: 265 | B127: 113021 | C127: 中信转债! | D127: 601998 | E127: 中信银行 | F127: 金融 | G127: 银行行业 | H127: 105.06 | I127: 1.1999999999999999e-003 | J127: 0. | K127: 5.31 | L127: 5.6999999999999993e-003 | M127: 118.8 | N127: 6.98 | O127: 0.38100000000000001 | P127: 76.07 | Q127: 转股中 | R127: 4年13天 | S127: 无权 | T127: 400 | U127: 73 | V127: 2.e-003 | W127: 0.154 | X127: 0.11699999999999999 | Y127: 2598. | Z127: 0.57 | AA127: 3.2000000000000001e-002 | AB127: 2.3399999999999997e-002 | AC127: 无权 | AD127: 无权 | AE127: 无权 | AF127: 102.4 | AG127: 0.22 | AH127: AAA | AI127: 3.8800000000000001e-002 | AJ127: =H127+100*O127 -> 143.16 | AK127: 134 | AL127: 240 | AM127: 31.6 | AN127: 160 | AO127: 1.7000000000000001e-002 | AP127: 51 | AQ127: 中信转债!
A128: 134 | B128: 123052 | C128: 飞鹿转债 | D128: 300665 | E128: 飞鹿股份 | F128: 化工 | G128: 化工 | H128: 108.257 | I128: 3.2300000000000002e-002 | J128: -1.1000000000000001e-003 | K128: 9.95 | L128: 4.6300000000000001e-002 | M128: 127.3 | N128: 9.9 | O128: 7.6999999999999999e-002 | P128: 100.51 | Q128: 转股中 | R128: 5.29年 | S128: 3.29年 | T128: 1.77 | U128: 29 | V128: 0.153 | W128: 0.14599999999999999 | X128: 0.14699999999999999 | Y128: 12 | Z128: 2.57 | AA128: 3.1899999999999998e-002 | AB128: 2.3099999999999999e-002 | AC128: -8.3000000000000001e-003 | AD128: -1.1200000000000002e-002 | AE128: 81.66 | AF128: 86.77 | AG128: 0.67 | AH128: A+ | AI128: 7.7300000000000008e-002 | AJ128: =H128+100*O128 -> 115.95700000000001 | AK128: 116 | AL128: 92 | AM128: 29.2 | AN128: 141 | AO128: 6.9999999999999993e-003 | AP128: 15 | AQ128: 飞鹿转债
A129: 215 | B129: 127014 | C129: 北方转债 | D129: 65 | E129: 北方国际 | F129: 建筑 | G129: 建筑工程 | H129: 99.85 | I129: 1.4499999999999999e-002 | J129: -5.3e-003 | K129: 6.84 | L129: 3.0099999999999998e-002 | M129: 115.1 | N129: 8.75 | O129: 0.27699999999999997 | P129: 78.17 | Q129: 转股中 | R129: 4.68年 | S129: 2.68年 | T129: 5.78 | U129: 7.6 | V129: 1.3000000000000001e-002 | W129: 0.11 | X129: 8.5999999999999993e-002 | Y129: 53 | Z129: 0.99 | AA129: 3.15e-002 | AB129: 2.5399999999999999e-002 | AC129: 1.32e-002 | AD129: 1.0700000000000001e-002 | AE129: 92.33 | AF129: 95.42 | AG129: 0.3 | AH129: AA+ | AI129: 4.1799999999999997e-002 | AJ129: =H129+100*O129 -> 127.54999999999998 | AK129: 121.5 | AL129: 145 | AM129: 26.1 | AN129: 105 | AO129: -3.0000000000000001e-003 | AP129: 17 | AQ129: 北方转债
A130: 135 | B130: 113584 | C130: 家悦转债! | D130: 603708 | E130: 家家悦 | F130: 商业零售 | G130: 超市 | H130: 98.2 | I130: 2.69e-002 | J130: -2.29e-002 | K130: 21.24 | L130: 4.53e-002 | M130: 115.3 | N130: 37.97 | O130: 0.755 | P130: 55.94 | Q130: 转股中 | R130: 5.29年 | S130: 3.29年 | T130: 6.45 | U130: 16 | V130: 2.5000000000000001e-002 | W130: 5.0000000000000003e-002 | X130: 2.7999999999999997e-002 | Y130: 129 | Z130: 4.3 | AA130: 3.15e-002 | AB130: 2.6000000000000002e-002 | AC130: 1.6299999999999999e-002 | AD130: 1.41e-002 | AE130: 89.21 | AF130: 91.66 | AG130: 0.09 | AH130: AA | AI130: 4.53e-002 | AJ130: =H130+100*O130 -> 173.69999999999999 | AK130: 140.5 | AL130: 266 | AM130: 48.8 | AN130: 269 | AO130: 6.9999999999999993e-003 | AP130: 8 | AQ130: 家悦转债!
A131: 101 | B131: 113594 | C131: 淳中转债! | D131: 603516 | E131: 淳中科技 | F131: 电子 | G131: 电子产品 | H131: 103.04 | I131: 4.6500000000000007e-002 | J131: -1.23e-002 | K131: 30.74 | L131: 7.1800000000000003e-002 | M131: 121.4 | N131: 39.37 | O131: 0.32000000000000001 | P131: 78.08 | Q131: 转股中 | R131: 5.42年 | S131: 3.42年 | T131: 3 | U131: 26 | V131: 8.3000000000000004e-002 | W131: 7.2999999999999995e-002 | X131: 5.7000000000000002e-002 | Y131: 41 | Z131: 4.56 | AA131: 3.15e-002 | AB131: 2.4399999999999998e-002 | AC131: 4.1999999999999997e-003 | AD131: 1.7000000000000001e-003 | AE131: 80.36 | AF131: 81.91 | AG131: 0.48 | AH131: A+ | AI131: 7.7300000000000008e-002 | AJ131: =H131+100*O131 -> 135.04000000000002 | AK131: 128 | AL131: 205 | AM131: 46.1 | AN131: 252 | AO131: 4.9000000000000002e-002 | AP131: 7 | AQ131: 淳中转债!
A132: 205 | B132: 128081 | C132: 海亮转债! | D132: 2203. | E132: 海亮股份 | F132: 有色金属 | G132: 铜金属 | H132: 99.612 | I132: 6.1999999999999998e-003 | J132: 2.0000000000000001e-004 | K132: 8.63 | L132: 1.41e-002 | M132: 114.9 | N132: 9.76 | O132: 0.127 | P132: 88.42 | Q132: 转股中 | R132: 4.75年 | S132: 2.75年 | T132: 31.5 | U132: 58 | V132: 1.9e-002 | W132: 0.187 | X132: 0.16500000000000001 | Y132: 168 | Z132: 1.87 | AA132: 3.1099999999999999e-002 | AB132: 2.52e-002 | AC132: 1.3000000000000001e-002 | AD132: 1.0700000000000001e-002 | AE132: 91.34 | AF132: 94.08 | AG132: 0.45 | AH132: AA | AI132: 4.3799999999999999e-002 | AJ132: =H132+100*O132 -> 112.312 | AK132: 110.8 | AL132: 39 | AM132: 16.7 | AN132: 27 | AO132: 6.2e-002 | AP132: 51 | AQ132: 海亮转债!
A133: 159 | B133: 113033 | C133: 利群转债! | D133: 601366 | E133: 利群股份 | F133: 商业零售 | G133: 商场 | H133: 98.93 | I133: 1.5700000000000002e-002 | J133: -5.6000000000000008e-003 | K133: 6.68 | L133: 1.83e-002 | M133: 115.3 | N133: 7.01 | O133: 3.7999999999999999e-002 | P133: 95.29 | Q133: 转股中 | R133: 5年41天 | S133: 3年41天 | T133: 18 | U133: 15 | V133: 9.0000000000000011e-003 | W133: 0.313 | X133: 0.29799999999999999 | Y133: 57 | Z133: 1.29 | AA133: 3.1099999999999999e-002 | AB133: 2.5399999999999999e-002 | AC133: 1.49e-002 | AD133: 1.26e-002 | AE133: 89.91 | AF133: 92.38 | AG133: 0.55 | AH133: AA | AI133: 4.53e-002 | AJ133: =H133+100*O133 -> 102.73 | AK133: 102.6 | AL133: 9 | AM133: 10.2 | AN133: 8 | AO133: -1.e-003 | AP133: 41 | AQ133: 利群转债!
A134: 332 | B134: 113014 | C134: 林洋转债! | D134: 601222 | E134: 林洋能源 | F134: 能源电力 | G134: 电力设备 | H134: 100.9 | I134: -1.5900000000000001e-002 | J134: 2.7300000000000001e-002 | K134: 7.27 | L134: 3.7100000000000001e-002 | M134: 109.3 | N134: 8.54 | O134: 0.185 | P134: 85.13 | Q134: 转股中 | R134: 2.69年 | S134: 0.69年 | T134: 30 | U134: 105 | V134: 3.5000000000000003e-002 | W134: 0.23600000000000002 | X134: 0.20100000000000001 | Y134: 127 | Z134: 1.22 | AA134: 3.0800000000000001e-002 | AB134: 2.4e-002 | AC134: 1.0500000000000001e-002 | AD134: 6.3e-003 | AE134: 98.31 | AF134: 98.08 | AG134: 0.31 | AH134: AA | AI134: 4.1900000000000007e-002 | AJ134: =H134+100*O134 -> 119.40000000000001 | AK134: 116.7 | AL134: 102 | AM134: 18.4 | AN134: 40 | AO134: -1.9e-002 | AP134: 27 | AQ134: 林洋转债!
A135: 162 | B135: 110068 | C135: 龙净转债! | D135: 600388 | E135: 龙净环保 | F135: 城市公用 | G135: 三废处理 | H135: 98.97 | I135: 1.21e-002 | J135: 3.2000000000000002e-003 | K135: 8.71 | L135: 4.0599999999999997e-002 | M135: 115 | N135: 10.73 | O135: 0.21899999999999997 | P135: 81.17 | Q135: 转股中 | R135: 5年33天 | S135: 3年33天 | T135: 20 | U135: 17 | V135: 8.0000000000000002e-003 | W135: 0.215 | X135: 0.17399999999999999 | Y135: 93 | Z135: 1.61 | AA135: 3.0499999999999999e-002 | AB135: 2.5000000000000001e-002 | AC135: 1.3999999999999999e-002 | AD135: 1.18e-002 | AE135: 90.26 | AF135: 93.06 | AG135: 0.37 | AH135: AA+ | AI135: 4.3299999999999998e-002 | AJ135: =H135+100*O135 -> 120.87 | AK135: 116.8 | AL135: 103 | AM135: 23.7 | AN135: 76 | AO135: 2.5000000000000001e-002 | AP135: 30 | AQ135: 龙净转债!
A136: 157 | B136: 127016 | C136: 鲁泰转债! | D136: 726 | E136: 鲁 泰Ａ | F136: 服装纺织 | G136: 纺织行业 | H136: 100.1 | I136: 6.0000000000000001e-003 | J136: -1.7000000000000001e-003 | K136: 6.52 | L136: 1.72e-002 | M136: 116.2 | N136: 8.91 | O136: 0.36799999999999999 | P136: 73.18 | Q136: 转股中 | R136: 5年49天 | S136: 3年49天 | T136: 14 | U136: 3 | V136: 2.e-003 | W136: 0.25 | X136: 0.183 | Y136: 56 | Z136: 0.73 | AA136: 3.0099999999999998e-002 | AB136: 2.4199999999999999e-002 | AC136: 1.09e-002 | AD136: 8.6e-003 | AE136: 90.29 | AF136: 93.89 | AG136: 0.26 | AH136: AA+ | AI136: 4.3299999999999998e-002 | AJ136: =H136+100*O136 -> 136.89999999999998 | AK136: 127 | AL136: 198 | AM136: 33.1 | AN136: 176 | AO136: 5.7000000000000002e-002 | AP136: 23 | AQ136: 鲁泰转债!
A137: 27 | B137: 123082 | C137: 北陆转债! | D137: 300016 | E137: 北陆药业 | F137: 医药 | G137: 化学制药 | H137: 103.38 | I137: 2.9700000000000001e-002 | J137: -1.1899999999999999e-002 | K137: 8.65 | L137: 2.4900000000000002e-002 | M137: 121.7 | N137: 8.86 | O137: 5.9000000000000004e-002 | P137: 97.63 | Q137: 3月22天 | R137: 5.80年 | S137: 3.80年 | T137: 5 | U137: 20 | V137: 3.9e-002 | W137: 0.11699999999999999 | X137: 0.114 | Y137: 43 | Z137: 2.7 | AA137: 2.92e-002 | AB137: 2.2499999999999999e-002 | AC137: 3.0000000000000001e-003 | AD137: 8.0000000000000004e-004 | AE137: 78.15 | AF137: 79.83 | AG137: 0.71 | AH137: A+ | AI137: 7.7300000000000008e-002 | AJ137: =H137+100*O137 -> 109.28 | AK137: 109.1 | AL137: 32 | AM137: 29.3 | AN137: 142 | AO137: 0. | AP137: 7 | AQ137: 北陆转债!
A138: 96 | B138: 128122 | C138: 兴森转债! | D138: 2436 | E138: 兴森科技 | F138: 电子 | G138: 元器件制 | H138: 100 | I138: 0. | J138: 5.5000000000000005e-003 | K138: 9.01 | L138: 4.2800000000000005e-002 | M138: 113.3 | N138: 14.18 | O138: 0.57399999999999995 | P138: 63.54 | Q138: 转股中 | R138: 4.42年 | S138: 3.42年 | T138: 2.69 | U138: 5.3 | V138: 2.e-002 | W138: 2.e-002 | X138: 1.3000000000000001e-002 | Y138: 134 | Z138: 4.24 | AA138: 2.8999999999999998e-002 | AB138: 2.3399999999999997e-002 | AC138: 1.01e-002 | AD138: 8.1000000000000013e-003 | AE138: 88.98 | AF138: 93.96 | AG138: 0.13 | AH138: AA | AI138: 4.3799999999999999e-002 | AJ138: =H138+100*O138 -> 157.40000000000001 | AK138: 136.5 | AL138: 251 | AM138: 42.5 | AN138: 238 | AO138: -1.6e-002 | AP138: 10 | AQ138: 兴森转债!
A139: 179 | B139: 113565 | C139: 宏辉转债 | D139: 603336 | E139: 宏辉果蔬 | F139: 农业 | G139: 农产品加 | H139: 102.8 | I139: 2.52e-002 | J139: -7.000000000000001e-004 | K139: 9.53 | L139: 3.8100000000000002e-002 | M139: 118.2 | N139: 10 | O139: 7.9000000000000001e-002 | P139: 95.3 | Q139: 转股中 | R139: 5年7天 | S139: 3年7天 | T139: 2.25 | U139: 51 | V139: 0.222 | W139: 7.0000000000000007e-002 | X139: 6.7000000000000004e-002 | Y139: 32 | Z139: 3.38 | AA139: 2.8900000000000002e-002 | AB139: 2.2200000000000001e-002 | AC139: 4.0999999999999995e-003 | AD139: 1.5e-003 | AE139: 85.11 | AF139: 86.33 | AG139: 0.64 | AH139: AA- | AI139: 6.6299999999999998e-002 | AJ139: =H139+100*O139 -> 110.7 | AK139: 110.3 | AL139: 36 | AM139: 24 | AN139: 81 | AO139: -1.2e-002 | AP139: 24 | AQ139: 宏辉转债
A140: 76 | B140: 113039 | C140: 嘉泽转债! | D140: 601619 | E140: 嘉泽新能 | F140: 能源电力 | G140: 风能 | H140: 96.96 | I140: 2.e-002 | J140: -9.7000000000000003e-003 | K140: 3.23 | L140: 1.89e-002 | M140: 113.1 | N140: 3.57 | O140: 7.2000000000000008e-002 | P140: 90.48 | Q140: 10天 | R140: 5.51年 | S140: 3.51年 | T140: 13 | U140: 36 | V140: 2.8999999999999998e-002 | W140: 0.19399999999999998 | X140: 0.17600000000000002 | Y140: 67 | Z140: 1.95 | AA140: 2.8900000000000002e-002 | AB140: 2.4300000000000002e-002 | AC140: 1.83e-002 | AD140: 1.6399999999999998e-002 | AE140: 88.15 | AF140: 89.01 | AG140: 0.54 | AH140: AA | AI140: 4.53e-002 | AJ140: =H140+100*O140 -> 104.16 | AK140: 103.4 | AL140: 12 | AM140: 14.4 | AN140: 18 | AO140: -3.9e-002 | AP140: 20 | AQ140: 嘉泽转债!
A141: 235 | B141: 113027 | C141: 华钰转债!! | D141: 601020 | E141: 华钰矿业 | F141: 有色金属 | G141: 锌铅镍锡 | H141: 101.89 | I141: 1.8100000000000002e-002 | J141: 2.3900000000000001e-002 | K141: 9.37 | L141: 7.3300000000000004e-002 | M141: 114.9 | N141: 10.17 | O141: 0.106 | P141: 92.13 | Q141: 转股中 | R141: 4.32年 | S141: 2.32年 | T141: 3.25 | U141: 100 | V141: 0.30399999999999999 | W141: 6.2e-002 | X141: 5.7999999999999996e-002 | Y141: 52 | Z141: 2.14 | AA141: 2.8799999999999999e-002 | AB141: 2.2400000000000003e-002 | AC141: 6.0000000000000001e-003 | AD141: 3.3e-003 | AE141: 88.63 | AF141: 88.15 | AG141: 0.57 | AH141: AA- | AI141: 6.480000000000001e-002 | AJ141: =H141+100*O141 -> 112.48999999999999 | AK141: 111.6 | AL141: 48 | AM141: 23 | AN141: 70 | AO141: 0.11800000000000001 | AP141: 45 | AQ141: 华钰转债!!
A142: 103 | B142: 113593 | C142: 沪工转债 | D142: 603131 | E142: 上海沪工 | F142: 机械装备 | G142: 通用设备 | H142: 105.23 | I142: 1.67e-002 | J142: -3.0000000000000001e-003 | K142: 20.33 | L142: 2.0099999999999996e-002 | M142: 121.6 | N142: 21.32 | O142: 0.10400000000000001 | P142: 95.36 | Q142: 转股中 | R142: 5.41年 | S142: 3.41年 | T142: 4 | U142: 9.6 | V142: 2.3e-002 | W142: 6.2e-002 | X142: 5.9000000000000004e-002 | Y142: 65 | Z142: 5.24 | AA142: 2.7699999999999999e-002 | AB142: 2.06e-002 | AC142: -1.7000000000000001e-003 | AD142: -4.1999999999999997e-003 | AE142: 80.37 | AF142: 82.04 | AG142: 0.68 | AH142: A+ | AI142: 7.7300000000000008e-002 | AJ142: =H142+100*O142 -> 115.63000000000001 | AK142: 115.1 | AL142: 84 | AM142: 33.1 | AN142: 175 | AO142: -8.9999999999999997e-002 | AP142: 9 | AQ142: 沪工转债
A143: 202 | B143: 128083 | C143: 新北转债! | D143: 2376 | E143: 新北洋 | F143: 电子 | G143: 电子产品 | H143: 101.049 | I143: 1.9799999999999998e-002 | J143: -1.1599999999999999e-002 | K143: 10.09 | L143: 1.9199999999999998e-002 | M143: 114.9 | N143: 11.7 | O143: 0.17199999999999999 | P143: 86.24 | Q143: 转股中 | R143: 4.81年 | S143: 2.81年 | T143: 8.77 | U143: 4.4 | V143: 5.0000000000000001e-003 | W143: 0.13100000000000001 | X143: 0.113 | Y143: 67 | Z143: 1.99 | AA143: 2.76e-002 | AB143: 2.18e-002 | AC143: 7.8000000000000005e-003 | AD143: 5.6000000000000008e-003 | AE143: 91.12 | AF143: 93.85 | AG143: 0.43 | AH143: AA | AI143: 4.3799999999999999e-002 | AJ143: =H143+100*O143 -> 118.24900000000001 | AK143: 115.9 | AL143: 91 | AM143: 22 | AN143: 59 | AO143: 3.7000000000000005e-002 | AP143: 19 | AQ143: 新北转债!
A144: 110 | B144: 110071 | C144: 湖盐转债! | D144: 600929 | E144: 雪天盐业 | F144: 食品饮料 | G144: 食品饮料 | H144: 99.79 | I144: 9.7999999999999997e-003 | J144: 1.1999999999999999e-003 | K144: 5.27 | L144: 2.9300000000000003e-002 | M144: 115.2 | N144: 6.6 | O144: 0.25 | P144: 79.85 | Q144: 转股中 | R144: 5.39年 | S144: 3.39年 | T144: 7.2 | U144: 1.2 | V144: 2.e-003 | W144: 0.14899999999999999 | X144: 0.11900000000000001 | Y144: 48 | Z144: 1.9 | AA144: 2.76e-002 | AB144: 2.23e-002 | AC144: 1.1000000000000001e-002 | AD144: 8.8999999999999999e-003 | AE144: 88.73 | AF144: 91.17 | AG144: 0.38 | AH144: AA | AI144: 4.53e-002 | AJ144: =H144+100*O144 -> 124.79000000000001 | AK144: 119.7 | AL144: 128 | AM144: 28.6 | AN144: 137 | AO144: 3.6000000000000004e-002 | AP144: 15 | AQ144: 湖盐转债!
A145: 26 | B145: 128140 | C145: 润建转债! | D145: 2929 | E145: 润建股份 | F145: 通信互联 | G145: 通信设备 | H145: 98.68 | I145: 1.7899999999999999e-002 | J145: -1.43e-002 | K145: 24.81 | L145: 6.5000000000000006e-003 | M145: 115.2 | N145: 26.55 | O145: 5.5999999999999994e-002 | P145: 93.45 | Q145: 3月22天 | R145: 5.80年 | S145: 3.80年 | T145: 10.9 | U145: 14 | V145: 1.3000000000000001e-002 | W145: 0.19899999999999998 | X145: 0.18600000000000003 | Y145: 55 | Z145: 1.84 | AA145: 2.76e-002 | AB145: 2.2700000000000001e-002 | AC145: 1.2699999999999999e-002 | AD145: 1.0800000000000001e-002 | AE145: 87.13 | AF145: 89.52 | AG145: 0.56 | AH145: AA | AI145: 4.53e-002 | AJ145: =H145+100*O145 -> 104.28 | AK145: 103.9 | AL145: 13 | AM145: 14.4 | AN145: 17 | AO145: 8.5999999999999993e-002 | AP145: 8 | AQ145: 润建转债!
A146: 47 | B146: 123075 | C146: 贝斯转债! | D146: 300580 | E146: 贝斯特 | F146: 汽车 | G146: 零部件制 | H146: 99.3 | I146: 3.8900000000000004e-002 | J146: -1.6799999999999999e-002 | K146: 18.24 | L146: 4.8899999999999999e-002 | M146: 115.5 | N146: 23.99 | O146: 0.30599999999999999 | P146: 76.03 | Q146: 2月16天 | R146: 5.70年 | S146: 3.70年 | T146: 6 | U146: 16 | V146: 2.7000000000000003e-002 | W146: 0.16399999999999998 | X146: 0.125 | Y146: 36 | Z146: 2.27 | AA146: 2.7400000000000001e-002 | AB146: 2.23e-002 | AC146: 1.1699999999999999e-002 | AD146: 9.7000000000000003e-003 | AE146: 81.2 | AF146: 80.69 | AG146: 0.45 | AH146: AA- | AI146: 6.6299999999999998e-002 | AJ146: =H146+100*O146 -> 129.90000000000001 | AK146: 122.6 | AL146: 157 | AM146: 41.4 | AN146: 231 | AO146: -6.0000000000000001e-003 | AP146: 7 | AQ146: 贝斯转债!
A147: 24 | B147: 127026 | C147: 超声转债! | D147: 823 | E147: 超声电子 | F147: 电子 | G147: 元器件制 | H147: 96.947 | I147: 2.5399999999999999e-002 | J147: -1.3600000000000001e-002 | K147: 9.96 | L147: 2.9999999999999999e-002 | M147: 113.1 | N147: 12.85 | O147: 0.251 | P147: 77.51 | Q147: 3月25天 | R147: 5.80年 | S147: 3.80年 | T147: 7 | U147: 9.5 | V147: 1.3999999999999999e-002 | W147: 0.13100000000000001 | X147: 0.10099999999999999 | Y147: 53 | Z147: 1.45 | AA147: 2.7400000000000001e-002 | AB147: 2.3099999999999999e-002 | AC147: 1.7000000000000001e-002 | AD147: 1.52e-002 | AE147: 87.03 | AF147: 87.87 | AG147: 0.39 | AH147: AA | AI147: 4.53e-002 | AJ147: =H147+100*O147 -> 122.047 | AK147: 116.4 | AL147: 98 | AM147: 28.5 | AN147: 135 | AO147: -2.1000000000000001e-002 | AP147: 5 | AQ147: 超声转债!
A148: 137 | B148: 123051 | C148: 今天转债 | D148: 300532 | E148: 今天国际 | F148: 计算机及 | G148: 软件开发 | H148: 106.95 | I148: 2.1700000000000001e-002 | J148: -7.1999999999999998e-003 | K148: 8.93 | L148: 2.06e-002 | M148: 122.8 | N148: 8.8 | O148: 5.4000000000000006e-002 | P148: 101.48 | Q148: 转股中 | R148: 5.29年 | S148: 3.29年 | T148: 2.8 | U148: 5.2 | V148: 1.7000000000000001e-002 | W148: 0.115 | X148: 0.11599999999999999 | Y148: 24 | Z148: 3.06 | AA148: 2.7099999999999999e-002 | AB148: 1.9599999999999999e-002 | AC148: -6.1999999999999998e-003 | AD148: -8.8000000000000005e-003 | AE148: 81.26 | AF148: 83.68 | AG148: 0.71 | AH148: A+ | AI148: 7.7300000000000008e-002 | AJ148: =H148+100*O148 -> 112.35000000000001 | AK148: 112.4 | AL148: 52 | AM148: 28.7 | AN148: 138 | AO148: 6.9999999999999993e-003 | AP148: 14 | AQ148: 今天转债
A149: 70 | B149: 128131 | C149: 崇达转2! | D149: 2815 | E149: 崇达技术 | F149: 电子 | G149: 元器件制 | H149: 99.6 | I149: 6.9999999999999993e-003 | J149: -4.0000000000000002e-004 | K149: 12.78 | L149: 3.3099999999999997e-002 | M149: 115.2 | N149: 19.54 | O149: 0.52300000000000002 | P149: 65.4 | Q149: 20天 | R149: 5.55年 | S149: 3.55年 | T149: 14 | U149: 3.9 | V149: 3.0000000000000001e-003 | W149: 0.124 | X149: 8.1000000000000003e-002 | Y149: 113 | Z149: 2.82 | AA149: 2.7099999999999999e-002 | AB149: 2.2000000000000002e-002 | AC149: 1.1000000000000001e-002 | AD149: 9.0000000000000011e-003 | AE149: 88.1 | AF149: 90.52 | AG149: 0.2 | AH149: AA | AI149: 4.53e-002 | AJ149: =H149+100*O149 -> 151.90000000000001 | AK149: 133.8 | AL149: 237 | AM149: 43.3 | AN149: 242 | AO149: 0. | AP149: 6 | AQ149: 崇达转2!
A150: 97 | B150: 113037 | C150: 紫银转债 | D150: 601860 | E150: 紫金银行 | F150: 金融 | G150: 银行行业 | H150: 100.65 | I150: 4.5000000000000005e-003 | J150: 8.0000000000000004e-004 | K150: 3.95 | L150: 1.2800000000000001e-002 | M150: 115.8 | N150: 4.75 | O150: 0.20999999999999999 | P150: 83.16 | Q150: 转股中 | R150: 5.42年 | S150: 无权 | T150: 45 | U150: 30 | V150: 6.9999999999999993e-003 | W150: 0.311 | X150: 0.25900000000000001 | Y150: 145 | Z150: 1.02 | AA150: 2.6699999999999998e-002 | AB150: 2.1299999999999999e-002 | AC150: 无权 | AD150: 无权 | AE150: 无权 | AF150: 92.46 | AG150: 0.41 | AH150: AA+ | AI150: 4.3299999999999998e-002 | AJ150: =H150+100*O150 -> 121.65000000000001 | AK150: 118.1 | AL150: 112 | AM150: 25.7 | AN150: 99 | AO150: 0. | AP150: 17 | AQ150: 紫银转债
A151: 83 | B151: 127021 | C151: 特发转2! | D151: 70 | E151: 特发信息 | F151: 通信互联 | G151: 通信设备 | H151: 100.9 | I151: 4.0199999999999993e-002 | J151: -3.5900000000000001e-002 | K151: 7.57 | L151: 3.8399999999999997e-002 | M151: 113.3 | N151: 12.33 | O151: 0.64300000000000002 | P151: 61.39 | Q151: 转股中 | R151: 4.46年 | S151: 2.46年 | T151: 5.5 | U151: 31 | V151: 5.5999999999999994e-002 | W151: 8.900000000000001e-002 | X151: 5.5e-002 | Y151: 62 | Z151: 2.18 | AA151: 2.6600000000000002e-002 | AB151: 2.1099999999999997e-002 | AC151: 4.3e-003 | AD151: 2.8000000000000004e-003 | AE151: 91.23 | AF151: 93.79 | AG151: 0.11 | AH151: AA | AI151: 4.3799999999999999e-002 | AJ151: =H151+100*O151 -> 165.19999999999999 | AK151: 140.4 | AL151: 265 | AM151: 46.6 | AN151: 255 | AO151: -1.9e-002 | AP151: 9 | AQ151: 特发转2!
A152: 258 | B152: 110056 | C152: 亨通转债! | D152: 600487 | E152: 亨通光电 | F152: 通信互联 | G152: 通信设备 | H152: 103.59 | I152: 1.95e-002 | J152: -4.4000000000000003e-003 | K152: 12.88 | L152: 4.1200000000000001e-002 | M152: 114.8 | N152: 15.01 | O152: 0.20699999999999999 | P152: 85.81 | Q152: 转股中 | R152: 4年28天 | S152: 2年28天 | T152: 17.1 | U152: 20 | V152: 1.1000000000000001e-002 | W152: 5.5999999999999994e-002 | X152: 4.8000000000000001e-002 | Y152: 304 | Z152: 1.67 | AA152: 2.6099999999999998e-002 | AB152: 1.9299999999999998e-002 | AC152: -1.2999999999999999e-003 | AD152: -4.0999999999999995e-003 | AE152: 94.33 | AF152: 97.5 | AG152: 0.37 | AH152: AA+ | AI152: 4.1799999999999997e-002 | AJ152: =H152+100*O152 -> 124.29000000000001 | AK152: 121.4 | AL152: 142 | AM152: 23.9 | AN152: 80 | AO152: 1.2e-002 | AP152: 31 | AQ152: 亨通转债!
A153: 56 | B153: 123072 | C153: 乐歌转债! | D153: 300729 | E153: 乐歌股份 | F153: 其他 | G153: 家居用品 | H153: 112.5 | I153: 2.8199999999999999e-002 | J153: -1.6e-002 | K153: 39.15 | L153: 8.4199999999999997e-002 | M153: 129.6 | N153: 73.13 | O153: 1.1000000000000001 | P153: 53.53 | Q153: 2月7天 | R153: 5.67年 | S153: 3.67年 | T153: 1.42 | U153: 123 | V153: 0.77400000000000002 | W153: 2.6000000000000002e-002 | X153: 1.3999999999999999e-002 | Y153: 54 | Z153: 5.71 | AA153: 2.6000000000000002e-002 | AB153: 1.7299999999999999e-002 | AC153: -1.3899999999999999e-002 | AD153: -1.72e-002 | AE153: 80.52 | AF153: 86.08 | AG153: 0.15 | AH153: A+ | AI153: 7.7300000000000008e-002 | AJ153: =H153+100*O153 -> 222.5 | AK153: 171.5 | AL153: 310 | AM153: 85.4 | AN153: 311 | AO153: 5.2999999999999999e-002 | AP153: 6 | AQ153: 乐歌转债!
A154: 191 | B154: 123039 | C154: 开润转债! | D154: 300577 | E154: 开润股份 | F154: 服装纺织 | G154: 纺织行业 | H154: 107.23 | I154: -4.4000000000000003e-003 | J154: 6.0999999999999995e-003 | K154: 23.79 | L154: 5.1000000000000004e-003 | M154: 121 | N154: 32.87 | O154: 0.48200000000000004 | P154: 72.38 | Q154: 转股中 | R154: 4.85年 | S154: 2.85年 | T154: 2.22 | U154: 2 | V154: 8.0000000000000002e-003 | W154: 3.9e-002 | X154: 2.7999999999999997e-002 | Y154: 57 | Z154: 6.2 | AA154: 2.58e-002 | AB154: 1.8100000000000002e-002 | AC154: -9.8999999999999991e-003 | AD154: -1.2500000000000001e-002 | AE154: 83.7 | AF154: 85.58 | AG154: 0.34 | AH154: A+ | AI154: 7.5800000000000006e-002 | AJ154: =H154+100*O154 -> 155.43000000000001 | AK154: 142.1 | AL154: 271 | AM154: 56.5 | AN154: 284 | AO154: 2.9999999999999999e-002 | AP154: 25 | AQ154: 开润转债!
A155: 123 | B155: 113588 | C155: 润达转债! | D155: 603108 | E155: 润达医疗 | F155: 医药 | G155: 医疗器械 | H155: 100 | I155: 1.5700000000000002e-002 | J155: -9.1000000000000004e-003 | K155: 11.02 | L155: 1.5700000000000002e-002 | M155: 114.2 | N155: 13.36 | O155: 0.21199999999999999 | P155: 82.49 | Q155: 转股中 | R155: 5.32年 | S155: 3.32年 | T155: 5.5 | U155: 7.8 | V155: 1.3999999999999999e-002 | W155: 8.5999999999999993e-002 | X155: 7.0999999999999994e-002 | Y155: 64 | Z155: 2.13 | AA155: 2.58e-002 | AB155: 2.07e-002 | AC155: 1.06e-002 | AD155: 8.5000000000000006e-003 | AE155: 88.98 | AF155: 90.63 | AG155: 0.42 | AH155: AA | AI155: 4.53e-002 | AJ155: =H155+100*O155 -> 121.2 | AK155: 117.5 | AL155: 109 | AM155: 26.9 | AN155: 120 | AO155: -4.2000000000000003e-002 | AP155: 9 | AQ155: 润达转债!
A156: 121 | B156: 123056 | C156: 雪榕转债 | D156: 300511 | E156: 雪榕生物 | F156: 农业 | G156: 种植业 | H156: 106.21 | I156: 6.0999999999999999e-002 | J156: 2.3099999999999999e-002 | K156: 11.43 | L156: 0.13100000000000001 | M156: 121.1 | N156: 11.89 | O156: 0.105 | P156: 96.13 | Q156: 转股中 | R156: 5.34年 | S156: 3.34年 | T156: 5.85 | U156: 241 | V156: 0.38600000000000001 | W156: 0.11599999999999999 | X156: 0.111 | Y156: 51 | Z156: 2.64 | AA156: 2.5399999999999999e-002 | AB156: 1.84e-002 | AC156: -6.0000000000000001e-003 | AD156: -8.199999999999999e-003 | AE156: 83.25 | AF156: 86.59 | AG156: 0.64 | AH156: AA- | AI156: 6.6299999999999998e-002 | AJ156: =H156+100*O156 -> 116.70999999999999 | AK156: 116.3 | AL156: 97 | AM156: 29.7 | AN156: 144 | AO156: 8.8000000000000009e-002 | AP156: 14 | AQ156: 雪榕转债
A157: 228 | B157: 128071 | C157: 合兴转债! | D157: 2228 | E157: 合兴包装 | F157: 造纸包装 | G157: 包装材料 | H157: 102.871 | I157: 1.8500000000000003e-002 | J157: 1.9e-003 | K157: 3.91 | L157: 4.2699999999999995e-002 | M157: 114.8 | N157: 4.28 | O157: 0.126 | P157: 91.36 | Q157: 转股中 | R157: 4.49年 | S157: 2.49年 | T157: 3 | U157: 4.6 | V157: 1.4999999999999999e-002 | W157: 6.2e-002 | X157: 5.7000000000000002e-002 | Y157: 48 | Z157: 1.45 | AA157: 2.52e-002 | AB157: 1.9099999999999999e-002 | AC157: 1.6000000000000001e-003 | AD157: -8.9999999999999998e-004 | AE157: 92.29 | AF157: 95.06 | AG157: 0.48 | AH157: AA | AI157: 4.3799999999999999e-002 | AJ157: =H157+100*O157 -> 115.47099999999999 | AK157: 114.4 | AL157: 77 | AM157: 19.3 | AN157: 45 | AO157: 6.9999999999999993e-003 | AP157: 26 | AQ157: 合兴转债!
A158: 88 | B158: 128125 | C158: 华阳转债! | D158: 2949 | E158: 华阳国际 | F158: 建筑 | G158: 建筑工程 | H158: 104.2 | I158: 2.1499999999999998e-002 | J158: 2.8399999999999998e-002 | K158: 21.4 | L158: 9.74e-002 | M158: 118.5 | N158: 25.79 | O158: 0.25600000000000001 | P158: 82.98 | Q158: 转股中 | R158: 5.44年 | S158: 3.44年 | T158: 4.5 | U158: 6.9 | V158: 1.4999999999999999e-002 | W158: 0.107 | X158: 8.900000000000001e-002 | Y158: 42 | Z158: 3.44 | AA158: 2.4399999999999998e-002 | AB158: 1.83e-002 | AC158: -1.e-003 | AD158: -3.0999999999999999e-003 | AE158: 82.57 | AF158: 84.17 | AG158: 0.51 | AH158: AA- | AI158: 6.6299999999999998e-002 | AJ158: =H158+100*O158 -> 129.80000000000001 | AK158: 125.4 | AL158: 183 | AM158: 41.3 | AN158: 229 | AO158: 7.0000000000000007e-002 | AP158: 5 | AQ158: 华阳转债!
A159: 34 | B159: 123078 | C159: 飞凯转债 | D159: 300398 | E159: 飞凯材料 | F159: 化工 | G159: 化工 | H159: 100.7 | I159: 8.6999999999999994e-003 | J159: 3.2000000000000002e-003 | K159: 15.44 | L159: 2.9300000000000003e-002 | M159: 115.2 | N159: 19.34 | O159: 0.26100000000000001 | P159: 79.83 | Q159: 3月14天 | R159: 5.77年 | S159: 3.77年 | T159: 8.25 | U159: 30 | V159: 3.6000000000000004e-002 | W159: 0.10400000000000001 | X159: 8.3000000000000004e-002 | Y159: 80 | Z159: 3.08 | AA159: 2.4e-002 | AB159: 1.9099999999999999e-002 | AC159: 7.4999999999999997e-003 | AD159: 5.6999999999999993e-003 | AE159: 87.24 | AF159: 89.63 | AG159: 0.4 | AH159: AA | AI159: 4.53e-002 | AJ159: =H159+100*O159 -> 126.80000000000001 | AK159: 121.6 | AL159: 146 | AM159: 31.9 | AN159: 162 | AO159: -2.5000000000000001e-002 | AP159: 6 | AQ159: 飞凯转债
A160: 49 | B160: 113606 | C160: 荣泰转债 | D160: 603579 | E160: 荣泰健康 | F160: 机械装备 | G160: 专用设备 | H160: 106.25 | I160: -9.7999999999999997e-003 | J160: 1.3300000000000001e-002 | K160: 30.18 | L160: 6.0000000000000001e-003 | M160: 121.2 | N160: 33.32 | O160: 0.17300000000000001 | P160: 90.58 | Q160: 2月15天 | R160: 5.69年 | S160: 3.69年 | T160: 6 | U160: 7.9 | V160: 1.2e-002 | W160: 0.14199999999999999 | X160: 0.129 | Y160: 42 | Z160: 2.67 | AA160: 2.3900000000000001e-002 | AB160: 1.7299999999999999e-002 | AC160: -5.3e-003 | AD160: -7.3000000000000001e-003 | AE160: 81.49 | AF160: 84.76 | AG160: 0.59 | AH160: AA- | AI160: 6.6299999999999998e-002 | AJ160: =H160+100*O160 -> 123.55 | AK160: 121.9 | AL160: 152 | AM160: 37.2 | AN160: 207 | AO160: 7.8e-002 | AP160: 8 | AQ160: 荣泰转债
A161: 25 | B161: 113612 | C161: 永冠转债 | D161: 603681 | E161: 永冠新材 | F161: 化工 | G161: 其他 | H161: 106.04 | I161: 1.44e-002 | J161: -2.8000000000000004e-003 | K161: 21.11 | L161: 1.6399999999999998e-002 | M161: 121.2 | N161: 20.79 | O161: 4.4000000000000004e-002 | P161: 101.54 | Q161: 3月25天 | R161: 5.80年 | S161: 3.80年 | T161: 5.2 | U161: 9 | V161: 1.6e-002 | W161: 0.14800000000000002 | X161: 0.14999999999999999 | Y161: 35 | Z161: 2.38 | AA161: 2.3799999999999998e-002 | AB161: 1.7299999999999999e-002 | AC161: -4.6999999999999993e-003 | AD161: -6.6e-003 | AE161: 80.94 | AF161: 84.18 | AG161: 0.71 | AH161: AA- | AI161: 6.6299999999999998e-002 | AJ161: =H161+100*O161 -> 110.44000000000001 | AK161: 110.5 | AL161: 38 | AM161: 26.4 | AN161: 114 | AO161: 7.0000000000000007e-002 | AP161: 3 | AQ161: 永冠转债
A162: 305 | B162: 127006 | C162: 敖东转债! | D162: 623 | E162: 吉林敖东 | F162: 金融 | G162: 证券行业 | H162: 100.9 | I162: 4.5000000000000005e-003 | J162: 1.4000000000000002e-003 | K162: 16 | L162: 2.76e-002 | M162: 108 | N162: 20.42 | O162: 0.28800000000000003 | P162: 78.35 | Q162: 转股中 | R162: 3年22天 | S162: 1年22天 | T162: 24.1 | U162: 24 | V162: 1.e-002 | W162: 0.129 | X162: 0.10099999999999999 | Y162: 186 | Z162: 0.82 | AA162: 2.2799999999999997e-002 | AB162: 1.77e-002 | AC162: 6.1999999999999998e-003 | AD162: 3.4999999999999996e-003 | AE162: 96.72 | AF162: 95.46 | AG162: 0.21 | AH162: AA+ | AI162: 4.1799999999999997e-002 | AJ162: =H162+100*O162 -> 129.70000000000002 | AK162: 123.4 | AL162: 162 | AM162: 26.7 | AN162: 117 | AO162: 1.8000000000000002e-002 | AP162: 26 | AQ162: 敖东转债!
A163: 211 | B163: 123033 | C163: 金力转债! | D163: 300748 | E163: 金力永磁 | F163: 电子 | G163: 元器件制 | H163: 109.6 | I163: 5.7999999999999996e-003 | J163: 1.04e-002 | K163: 34.89 | L163: 3.44e-002 | M163: 121.5 | N163: 40.68 | O163: 0.27800000000000002 | P163: 85.77 | Q163: 转股中 | R163: 4.70年 | S163: 2.70年 | T163: 4.35 | U163: 16 | V163: 3.3000000000000002e-002 | W163: 2.8999999999999998e-002 | X163: 2.5000000000000001e-002 | Y163: 151 | Z163: 10.8 | AA163: 2.2799999999999997e-002 | AB163: 1.47e-002 | AC163: -1.5100000000000001e-002 | AD163: -1.83e-002 | AE163: 87.95 | AF163: 91.23 | AG163: 0.47 | AH163: AA- | AI163: 6.480000000000001e-002 | AJ163: =H163+100*O163 -> 137.40000000000001 | AK163: 133.4 | AL163: 234 | AM163: 42.2 | AN163: 236 | AO163: -4.4999999999999998e-002 | AP163: 29 | AQ163: 金力转债!
A164: 91 | B164: 128124 | C164: 科华转债! | D164: 2022 | E164: 科华生物 | F164: 医药 | G164: 生物制药 | H164: 97.788 | I164: 1.26e-002 | J164: -6.4000000000000003e-003 | K164: 16.08 | L164: 1.84e-002 | M164: 110.3 | N164: 21.51 | O164: 0.308 | P164: 74.76 | Q164: 转股中 | R164: 5.44年 | S164: 3.44年 | T164: 7.38 | U164: 7 | V164: 1.e-002 | W164: 8.900000000000001e-002 | X164: 6.7000000000000004e-002 | Y164: 83 | Z164: 2.88 | AA164: 2.2799999999999997e-002 | AB164: 1.9099999999999999e-002 | AC164: 1.4800000000000001e-002 | AD164: 1.3100000000000001e-002 | AE164: 87.96 | AF164: 87.05 | AG164: 0.34 | AH164: AA | AI164: 4.53e-002 | AJ164: =H164+100*O164 -> 128.58799999999999 | AK164: 120.8 | AL164: 138 | AM164: 32.9 | AN164: 174 | AO164: -2.6000000000000002e-002 | AP164: 15 | AQ164: 科华转债!
A165: 261 | B165: 110053 | C165: 苏银转债! | D165: 600919 | E165: 江苏银行 | F165: 金融 | G165: 银行行业 | H165: 109.08 | I165: 1.4000000000000002e-003 | J165: 4.3e-003 | K165: 5.85 | L165: 1.5600000000000001e-002 | M165: 119.1 | N165: 6.69 | O165: 0.247 | P165: 87.44 | Q165: 转股中 | R165: 4年23天 | S165: 无权 | T165: 200 | U165: 103 | V165: 5.0000000000000001e-003 | W165: 0.23100000000000001 | X165: 0.20199999999999999 | Y165: 864 | Z165: 0.57 | AA165: 2.2599999999999999e-002 | AB165: 1.41e-002 | AC165: 无权 | AD165: 无权 | AE165: 无权 | AF165: 102.56 | AG165: 0.36 | AH165: AAA | AI165: 3.8800000000000001e-002 | AJ165: =H165+100*O165 -> 133.78 | AK165: 130.7 | AL165: 217 | AM165: 28.2 | AN165: 131 | AO165: 4.9000000000000002e-002 | AP165: 45 | AQ165: 苏银转债!
A166: 17 | B166: 113044 | C166: 大秦转债! | D166: 601006 | E166: 大秦铁路 | F166: 铁路 | G166: 铁路运输 | H166: 100.78 | I166: 2.8000000000000004e-003 | J166: 2.2000000000000001e-003 | K166: 6.59 | L166: 1.0700000000000001e-002 | M166: 114.1 | N166: 7.66 | O166: 0.17100000000000001 | P166: 86.03 | Q166: 3月29天 | R166: 5.82年 | S166: 3.82年 | T166: 320 | U166: 174 | V166: 5.0000000000000001e-003 | W166: 0.32700000000000001 | X166: 0.28100000000000003 | Y166: 980 | Z166: 0.84 | AA166: 2.2000000000000002e-002 | AB166: 1.7399999999999999e-002 | AC166: 7.8000000000000005e-003 | AD166: 5.8999999999999999e-003 | AE166: 88.9 | AF166: 91.07 | AG166: 0.47 | AH166: AAA | AI166: 4.0300000000000002e-002 | AJ166: =H166+100*O166 -> 117.88 | AK166: 115.5 | AL166: 90 | AM166: 24.5 | AN166: 85 | AO166: 1.7000000000000001e-002 | AP166: 11 | AQ166: 大秦转债!
A167: 94 | B167: 128123 | C167: 国光转债! | D167: 2749 | E167: 国光股份 | F167: 化工 | G167: 农化 | H167: 103.684 | I167: 9.7000000000000003e-003 | J167: 1.4000000000000002e-003 | K167: 11.09 | L167: 2.2099999999999998e-002 | M167: 116.2 | N167: 13.7 | O167: 0.28100000000000003 | P167: 80.95 | Q167: 转股中 | R167: 5.43年 | S167: 3.43年 | T167: 3.2 | U167: 2 | V167: 6.0000000000000001e-003 | W167: 6.7000000000000004e-002 | X167: 5.4000000000000006e-002 | Y167: 48 | Z167: 3.89 | AA167: 2.1700000000000001e-002 | AB167: 1.6200000000000003e-002 | AC167: 1.1999999999999999e-003 | AD167: -1.1000000000000001e-003 | AE167: 82.87 | AF167: 82.66 | AG167: 0.51 | AH167: AA- | AI167: 6.6299999999999998e-002 | AJ167: =H167+100*O167 -> 131.78399999999999 | AK167: 126.4 | AL167: 190 | AM167: 43.6 | AN167: 246 | AO167: 7.6999999999999999e-002 | AP167: 10 | AQ167: 国光转债!
A168: 276 | B168: 128051 | C168: 光华转债! | D168: 2741 | E168: 光华科技 | F168: 电子 | G168: 元器件制 | H168: 106.107 | I168: 1.7299999999999999e-002 | J168: -5.3e-003 | K168: 13.14 | L168: 1.78e-002 | M168: 114.8 | N168: 12.72 | O168: 2.7000000000000003e-002 | P168: 103.3 | Q168: 转股中 | R168: 3.82年 | S168: 1.82年 | T168: 2.48 | U168: 7.6 | V168: 2.8999999999999998e-002 | W168: 5.0000000000000003e-002 | X168: 5.2000000000000005e-002 | Y168: 49 | Z168: 4.06 | AA168: 2.1299999999999999e-002 | AB168: 1.41e-002 | AC168: -1.43e-002 | AD168: -1.7399999999999999e-002 | AE168: 91.14 | AF168: 90.78 | AG168: 0.68 | AH168: AA- | AI168: 6.480000000000001e-002 | AJ168: =H168+100*O168 -> 108.807 | AK168: 108.9 | AL168: 30 | AM168: 17.8 | AN168: 35 | AO168: 1.e-002 | AP168: 27 | AQ168: 光华转债!
A169: 193 | B169: 113030 | C169: 东风转债! | D169: 601515 | E169: 东风股份 | F169: 造纸包装 | G169: 包装材料 | H169: 105.8 | I169: 3.6900000000000002e-002 | J169: -1.18e-002 | K169: 5.92 | L169: 5.9000000000000004e-002 | M169: 116.9 | N169: 6.75 | O169: 0.20600000000000002 | P169: 87.7 | Q169: 转股中 | R169: 4.84年 | S169: 2.84年 | T169: 2.95 | U169: 54 | V169: 0.17399999999999999 | W169: 3.7000000000000005e-002 | X169: 3.3000000000000002e-002 | Y169: 79 | Z169: 1.9 | AA169: 2.12e-002 | AB169: 1.49e-002 | AC169: -7.7000000000000002e-003 | AD169: -9.7999999999999997e-003 | AE169: 90.99 | AF169: 95.35 | AG169: 0.43 | AH169: AA | AI169: 4.3799999999999999e-002 | AJ169: =H169+100*O169 -> 126.40000000000001 | AK169: 123.9 | AL169: 168 | AM169: 28.6 | AN169: 136 | AO169: 2.7000000000000003e-002 | AP169: 17 | AQ169: 东风转债!
A170: 174 | B170: 123043 | C170: 正元转债 | D170: 300645 | E170: 正元智慧 | F170: 计算机及 | G170: 软件开发 | H170: 109.88 | I170: 1.18e-002 | J170: 9.7999999999999997e-003 | K170: 14.39 | L170: 3.3799999999999997e-002 | M170: 121.4 | N170: 15.41 | O170: 0.17699999999999999 | P170: 93.38 | Q170: 转股中 | R170: 5年14天 | S170: 3年14天 | T170: 1.66 | U170: 118 | V170: 0.65200000000000002 | W170: 9.0999999999999998e-002 | X170: 8.5000000000000006e-002 | Y170: 18 | Z170: 2.97 | AA170: 2.0499999999999997e-002 | AB170: 1.3000000000000001e-002 | AC170: -1.55e-002 | AD170: -1.8200000000000001e-002 | AE170: 82.65 | AF170: 84.25 | AG170: 0.64 | AH170: A+ | AI170: 7.7300000000000008e-002 | AJ170: =H170+100*O170 -> 127.58 | AK170: 126.4 | AL170: 189 | AM170: 42.1 | AN170: 235 | AO170: 9.0000000000000011e-003 | AP170: 17 | AQ170: 正元转债
A171: 315 | B171: 110041 | C171: 蒙电转债! | D171: 600863 | E171: 内蒙华电 | F171: 能源电力 | G171: 电力供应 | H171: 103.44 | I171: 1.3999999999999999e-002 | J171: -5.8999999999999999e-003 | K171: 2.29 | L171: 2.69e-002 | M171: 109.3 | N171: 2.69 | O171: 0.215 | P171: 85.13 | Q171: 转股中 | R171: 2.84年 | S171: 0.84年 | T171: 18.7 | U171: 13 | V171: 6.9999999999999993e-003 | W171: 0.14000000000000001 | X171: 0.12 | Y171: 133 | Z171: 1.13 | AA171: 1.9900000000000001e-002 | AB171: 1.3600000000000001e-002 | AC171: -1.5800000000000002e-002 | AD171: -1.9299999999999998e-002 | AE171: 98.17 | AF171: 98.78 | AG171: 0.3 | AH171: AAA | AI171: 3.6900000000000002e-002 | AJ171: =H171+100*O171 -> 124.94 | AK171: 121.7 | AL171: 149 | AM171: 23 | AN171: 69 | AO171: -1.2e-002 | AP171: 10 | AQ171: 蒙电转债!
A172: 66 | B172: 128133 | C172: 奇正转债! | D172: 2287 | E172: 奇正藏药 | F172: 医药 | G172: 中药 | H172: 105.444 | I172: 8.8999999999999999e-003 | J172: -3.2000000000000002e-003 | K172: 25.13 | L172: 1.3300000000000001e-002 | M172: 117.3 | N172: 30.12 | O172: 0.26400000000000001 | P172: 83.43 | Q172: 37天 | R172: 5.59年 | S172: 3.59年 | T172: 8 | U172: 11 | V172: 1.3000000000000001e-002 | W172: 5.9999999999999998e-002 | X172: 5.0000000000000003e-002 | Y172: 133 | Z172: 5.55 | AA172: 1.9599999999999999e-002 | AB172: 1.3999999999999999e-002 | AC172: -4.1999999999999997e-003 | AD172: -6.1999999999999998e-003 | AE172: 88.03 | AF172: 92.01 | AG172: 0.42 | AH172: AA | AI172: 4.53e-002 | AJ172: =H172+100*O172 -> 131.84399999999999 | AK172: 127.5 | AL172: 201 | AM172: 35.4 | AN172: 197 | AO172: -7.4999999999999997e-002 | AP172: 12 | AQ172: 奇正转债!
A173: 4 | B173: 113618 | C173: 美诺转债! | D173: 603538 | E173: 美诺华 | F173: 医药 | G173: 原料药 | H173: 103.21 | I173: 1.0800000000000001e-002 | J173: 1.09e-002 | K173: 31.69 | L173: 3.7699999999999997e-002 | M173: 115.3 | N173: 37.47 | O173: 0.22 | P173: 84.57 | Q173: 5月1天 | R173: 5.90年 | S173: 3.90年 | T173: 5.2 | U173: 24 | V173: 4.4999999999999998e-002 | W173: 0.11 | X173: 9.3000000000000013e-002 | Y173: 47 | Z173: 3.12 | AA173: 1.9299999999999998e-002 | AB173: 1.4499999999999999e-002 | AC173: 1.4000000000000002e-003 | AD173: -4.0000000000000002e-004 | AE173: 80.14 | AF173: 79.52 | AG173: 0.57 | AH173: AA- | AI173: 6.6299999999999998e-002 | AJ173: =H173+100*O173 -> 125.20999999999999 | AK173: 121.8 | AL173: 150 | AM173: 41.7 | AN173: 233 | AO173: 1.e-002 | AP173: 2 | AQ173: 美诺转债!
A174: 184 | B174: 128094 | C174: 星帅转债 | D174: 2860 | E174: 星帅尔 | F174: 家电 | G174: 零部件制 | H174: 110.42 | I174: 8.8000000000000005e-003 | J174: -1.2800000000000001e-002 | K174: 15 | L174: -5.3e-003 | M174: 121 | N174: 13.95 | O174: 2.7000000000000003e-002 | P174: 107.53 | Q174: 转股中 | R174: 4.91年 | S174: 2.91年 | T174: 2.77 | U174: 23 | V174: 7.5999999999999998e-002 | W174: 9.3000000000000013e-002 | X174: 0.10000000000000001 | Y174: 30 | Z174: 3.2 | AA174: 1.9199999999999998e-002 | AB174: 1.1699999999999999e-002 | AC174: -1.9199999999999998e-002 | AD174: -2.1700000000000001e-002 | AE174: 83.35 | AF174: 85.22 | AG174: 0.76 | AH174: A+ | AI174: 7.5800000000000006e-002 | AJ174: =H174+100*O174 -> 113.12 | AK174: 113.3 | AL174: 63 | AM174: 28.1 | AN174: 129 | AO174: -3.0000000000000001e-003 | AP174: 33 | AQ174: 星帅转债
A175: 189 | B175: 128091 | C175: 新天转债 | D175: 2873 | E175: 新天药业 | F175: 医药 | G175: 中药 | H175: 109.18 | I175: 1.2800000000000001e-002 | J175: -8.3999999999999995e-003 | K175: 16.11 | L175: 6.1999999999999998e-003 | M175: 119.4 | N175: 16.39 | O175: 0.111 | P175: 98.29 | Q175: 转股中 | R175: 4.86年 | S175: 2.86年 | T175: 1.76 | U175: 22 | V175: 0.114 | W175: 9.3000000000000013e-002 | X175: 9.1999999999999998e-002 | Y175: 19 | Z175: 2.5 | AA175: 1.9e-002 | AB175: 1.1899999999999999e-002 | AC175: -1.46e-002 | AD175: -1.7399999999999999e-002 | AE175: 83.98 | AF175: 84.46 | AG175: 0.7 | AH175: A+ | AI175: 7.5800000000000006e-002 | AJ175: =H175+100*O175 -> 120.28 | AK175: 120.1 | AL175: 132 | AM175: 35.6 | AN175: 198 | AO175: 3.9e-002 | AP175: 17 | AQ175: 新天转债
A176: 288 | B176: 113516 | C176: 苏农转债! | D176: 603323 | E176: 苏农银行 | F176: 金融 | G176: 银行行业 | H176: 107.49 | I176: 2.0299999999999999e-002 | J176: -1.2199999999999999e-002 | K176: 4.94 | L176: 2.07e-002 | M176: 114.3 | N176: 5.52 | O176: 0.20100000000000001 | P176: 89.49 | Q176: 转股中 | R176: 3.45年 | S176: 无权 | T176: 12.9 | U176: 12 | V176: 8.0000000000000002e-003 | W176: 0.14499999999999999 | X176: 0.13 | Y176: 89 | Z176: 0.75 | AA176: 1.83e-002 | AB176: 1.0700000000000001e-002 | AC176: 无权 | AD176: 无权 | AE176: 无权 | AF176: 99.52 | AG176: 0.39 | AH176: AA+ | AI176: 4.1799999999999997e-002 | AJ176: =H176+100*O176 -> 127.59 | AK176: 125.5 | AL176: 184 | AM176: 26 | AN176: 102 | AO176: 4.0000000000000001e-002 | AP176: 33 | AQ176: 苏农转债!
A177: 74 | B177: 128129 | C177: 青农转债 | D177: 2958 | E177: 青农商行 | F177: 金融 | G177: 银行行业 | H177: 101.75 | I177: 1.04e-002 | J177: -7.000000000000001e-004 | K177: 4.7 | L177: 2.4e-002 | M177: 112.2 | N177: 5.74 | O177: 0.24299999999999999 | P177: 81.88 | Q177: 10天 | R177: 5.51年 | S177: 无权 | T177: 50 | U177: 38 | V177: 8.0000000000000002e-003 | W177: 0.191 | X177: 0.157 | Y177: 261 | Z177: 1.01 | AA177: 1.8200000000000001e-002 | AB177: 1.3999999999999999e-002 | AC177: 无权 | AD177: 无权 | AE177: 无权 | AF177: 90.53 | AG177: 0.41 | AH177: AAA | AI177: 4.0300000000000002e-002 | AJ177: =H177+100*O177 -> 126.05 | AK177: 121.6 | AL177: 148 | AM177: 31.1 | AN177: 154 | AO177: 1.3000000000000001e-002 | AP177: 12 | AQ177: 青农转债
A178: 327 | B178: 110038 | C178: 济川转债! | D178: 600566 | E178: 济川药业 | F178: 医药 | G178: 中药 | H178: 104.35 | I178: 3.4999999999999996e-003 | J178: -1.9e-003 | K178: 20.09 | L178: 8.0000000000000002e-003 | M178: 107.5 | N178: 23.85 | O178: 0.23899999999999999 | P178: 84.23 | Q178: 转股中 | R178: 1.73年 | S178: 回售内 | T178: 6.28 | U178: 8.6 | V178: 1.3000000000000001e-002 | W178: 3.5000000000000003e-002 | X178: 2.9999999999999999e-002 | Y178: 178 | Z178: 2.43 | AA178: 1.7500000000000002e-002 | AB178: 9.1999999999999998e-003 | AC178: 回售内 | AD178: 回售内 | AE178: 100.25 | AF178: 100.18 | AG178: 0.19 | AH178: AA | AI178: 4.1900000000000007e-002 | AJ178: =H178+100*O178 -> 128.25 | AK178: 124.5 | AL178: 172 | AM178: 24.2 | AN178: 83 | AO178: 3.4000000000000002e-002 | AP178: 22 | AQ178: 济川转债!
A179: 192 | B179: 123038 | C179: 联得转债! | D179: 300545 | E179: 联得装备 | F179: 机械装备 | G179: 专用设备 | H179: 109.28 | I179: 1.3600000000000001e-002 | J179: 1.1599999999999999e-002 | K179: 23.18 | L179: 4.0399999999999998e-002 | M179: 118.6 | N179: 25.29 | O179: 0.192 | P179: 91.66 | Q179: 转股中 | R179: 4.85年 | S179: 2.85年 | T179: 1.47 | U179: 11 | V179: 6.9000000000000006e-002 | W179: 4.2999999999999997e-002 | X179: 4.0000000000000001e-002 | Y179: 34 | Z179: 4.42 | AA179: 1.7399999999999999e-002 | AB179: 1.0500000000000001e-002 | AC179: -1.6899999999999998e-002 | AD179: -1.9299999999999998e-002 | AE179: 83.52 | AF179: 83.87 | AG179: 0.62 | AH179: A+ | AI179: 7.5800000000000006e-002 | AJ179: =H179+100*O179 -> 128.47999999999999 | AK179: 126.9 | AL179: 195 | AM179: 43 | AN179: 240 | AO179: 1.e-003 | AP179: 18 | AQ179: 联得转债!
A180: 183 | B180: 113563 | C180: 柳药转债 | D180: 603368 | E180: 柳药股份 | F180: 医药 | G180: 医药商业 | H180: 104.28 | I180: 2.06e-002 | J180: -5.5000000000000005e-003 | K180: 21.75 | L180: 3.0800000000000001e-002 | M180: 112.9 | N180: 24.47 | O180: 0.17300000000000001 | P180: 88.88 | Q180: 转股中 | R180: 4.91年 | S180: 2.91年 | T180: 8.02 | U180: 9 | V180: 1.1000000000000001e-002 | W180: 0.10199999999999999 | X180: 8.9999999999999997e-002 | Y180: 79 | Z180: 1.64 | AA180: 1.66e-002 | AB180: 1.1699999999999999e-002 | AC180: -2.8000000000000004e-003 | AD180: -4.8999999999999998e-003 | AE180: 90.74 | AF180: 91.85 | AG180: 0.49 | AH180: AA | AI180: 4.3799999999999999e-002 | AJ180: =H180+100*O180 -> 121.58 | AK180: 119.7 | AL180: 126 | AM180: 27.8 | AN180: 126 | AO180: 4.0000000000000001e-002 | AP180: 17 | AQ180: 柳药转债
A181: 148 | B181: 123050 | C181: 聚飞转债 | D181: 300303 | E181: 聚飞光电 | F181: 电子 | G181: LED制 | H181: 114.363 | I181: -1.e-004 | J181: 8.8999999999999999e-003 | K181: 5.2 | L181: 1.3600000000000001e-002 | M181: 124.2 | N181: 5.18 | O181: 0.13900000000000001 | P181: 100.39 | Q181: 转股中 | R181: 5年54天 | S181: 3年54天 | T181: 7.05 | U181: 11 | V181: 1.3000000000000001e-002 | W181: 0.106 | X181: 0.106 | Y181: 66 | Z181: 2.86 | AA181: 1.6500000000000001e-002 | AB181: 8.5000000000000006e-003 | AC181: -2.8199999999999999e-002 | AD181: -3.0499999999999999e-002 | AE181: 84.39 | AF181: 89.93 | AG181: 0.64 | AH181: AA- | AI181: 6.6299999999999998e-002 | AJ181: =H181+100*O181 -> 128.26300000000001 | AK181: 128.3 | AL181: 207 | AM181: 38.4 | AN181: 213 | AO181: 4.0000000000000001e-003 | AP181: 12 | AQ181: 聚飞转债
A182: 23 | B182: 123083 | C182: 朗新转债 | D182: 300682 | E182: 朗新科技 | F182: 计算机及 | G182: 软件开发 | H182: 105 | I182: 1.9e-003 | J182: 1.e-003 | K182: 13.47 | L182: 6.0000000000000001e-003 | M182: 115.1 | N182: 15.57 | O182: 0.214 | P182: 86.51 | Q182: 3月26天 | R182: 5.80年 | S182: 3.80年 | T182: 8 | U182: 21 | V182: 2.5000000000000001e-002 | W182: 5.7999999999999996e-002 | X182: 5.0000000000000003e-002 | Y182: 138 | Z182: 2.88 | AA182: 1.6200000000000003e-002 | AB182: 1.15e-002 | AC182: -3.4000000000000002e-003 | AD182: -5.1999999999999998e-003 | AE182: 87.02 | AF182: 89.41 | AG182: 0.48 | AH182: AA | AI182: 4.53e-002 | AJ182: =H182+100*O182 -> 126.40000000000001 | AK182: 123.5 | AL182: 163 | AM182: 34.1 | AN182: 188 | AO182: 9.0000000000000011e-003 | AP182: 3 | AQ182: 朗新转债
A183: 37 | B183: 110077 | C183: 洪城转债 | D183: 600461 | E183: 洪城水业 | F183: 城市公用 | G183: 城市公用 | H183: 103.7 | I183: 3.7200000000000004e-002 | J183: -2.58e-002 | K183: 6.01 | L183: 2.5600000000000001e-002 | M183: 113.5 | N183: 7.13 | O183: 0.23000000000000001 | P183: 84.29 | Q183: 3月6天 | R183: 5.75年 | S183: 3.75年 | T183: 18 | U183: 7.6 | V183: 4.0000000000000001e-003 | W183: 0.316 | X183: 0.26600000000000001 | Y183: 57 | Z183: 1.13 | AA183: 1.6e-002 | AB183: 1.1699999999999999e-002 | AC183: -3.5999999999999999e-003 | AD183: -4.6999999999999993e-003 | AE183: 86.68 | AF183: 89.2 | AG183: 0.45 | AH183: AA+ | AI183: 4.3299999999999998e-002 | AJ183: =H183+100*O183 -> 126.7 | AK183: 123.1 | AL183: 160 | AM183: 33.9 | AN183: 185 | AO183: -2.7000000000000003e-002 | AP183: 5 | AQ183: 洪城转债
A184: 238 | B184: 113536 | C184: 三星转债 | D184: 603578 | E184: 三星新材 | F184: 家电 | G184: 零部件制 | H184: 107.47 | I184: 1.29e-002 | J184: -2.8000000000000004e-003 | K184: 19.59 | L184: 1.77e-002 | M184: 114.8 | N184: 19.54 | O184: 7.2000000000000008e-002 | P184: 100.26 | Q184: 转股中 | R184: 4.28年 | S184: 2.28年 | T184: 1.49 | U184: 2.1 | V184: 1.3000000000000001e-002 | W184: 8.3000000000000004e-002 | X184: 8.3000000000000004e-002 | Y184: 18 | Z184: 2.58 | AA184: 1.5900000000000001e-002 | AB184: 9.4999999999999998e-003 | AC184: -1.6200000000000003e-002 | AD184: -1.8799999999999997e-002 | AE184: 93.13 | AF184: 95.93 | AG184: 0.57 | AH184: AA | AI184: 4.3799999999999999e-002 | AJ184: =H184+100*O184 -> 114.67 | AK184: 114.7 | AL184: 81 | AM184: 18.8 | AN184: 43 | AO184: -1.8000000000000002e-002 | AP184: 38 | AQ184: 三星转债
A185: 247 | B185: 113024 | C185: 核建转债! | D185: 601611 | E185: 中国核建 | F185: 建筑 | G185: 建筑工程 | H185: 103.07 | I185: 2.1099999999999997e-002 | J185: -1.01e-002 | K185: 7.17 | L185: 4.9800000000000004e-002 | M185: 109.7 | N185: 9.76 | O185: 0.40299999999999997 | P185: 73.46 | Q185: 转股中 | R185: 4年48天 | S185: 2年48天 | T185: 30 | U185: 9.2 | V185: 3.0000000000000001e-003 | W185: 0.158 | X185: 0.11599999999999999 | Y185: 190 | Z185: 1.76 | AA185: 1.55e-002 | AB185: 1.1000000000000001e-002 | AC185: 5.9999999999999995e-004 | AD185: -2.2000000000000001e-003 | AE185: 94.64 | AF185: 94.05 | AG185: 0.22 | AH185: AAA | AI185: 3.8800000000000001e-002 | AJ185: =H185+100*O185 -> 143.37 | AK185: 132.7 | AL185: 227 | AM185: 38 | AN185: 211 | AO185: -6.5000000000000002e-002 | AP185: 43 | AQ185: 核建转债!
A186: 93 | B186: 123062 | C186: 三超转债 | D186: 300554 | E186: 三超新材 | F186: 机械装备 | G186: 通用设备 | H186: 110.313 | I186: -3.9000000000000003e-003 | J186: 2.7300000000000001e-002 | K186: 18.39 | L186: 2.8500000000000001e-002 | M186: 119.7 | N186: 17.17 | O186: 2.9999999999999999e-002 | P186: 107.11 | Q186: 转股中 | R186: 5.43年 | S186: 3.43年 | T186: 1.95 | U186: 136 | V186: 0.63300000000000001 | W186: 0.113 | X186: 0.121 | Y186: 17 | Z186: 3.3 | AA186: 1.55e-002 | AB186: 9.1000000000000004e-003 | AC186: -1.4800000000000001e-002 | AD186: -1.72e-002 | AE186: 77.7 | AF186: 76.84 | AG186: 0.82 | AH186: A | AI186: 8.7300000000000003e-002 | AJ186: =H186+100*O186 -> 113.313 | AK186: 113.5 | AL186: 66 | AM186: 35.8 | AN186: 199 | AO186: 6.2e-002 | AP186: 15 | AQ186: 三超转债
A187: 300 | B187: 128039 | C187: 三力转债! | D187: 2224 | E187: 三 力 士 | F187: 机械装备 | G187: 专用设备 | H187: 104.5 | I187: 2.0499999999999997e-002 | J187: -9.4999999999999998e-003 | K187: 5.65 | L187: 1.8000000000000002e-002 | M187: 109.8 | N187: 5.81 | O187: 7.4999999999999997e-002 | P187: 97.25 | Q187: 转股中 | R187: 3.30年 | S187: 1.30年 | T187: 2.03 | U187: 5.4 | V187: 2.6000000000000002e-002 | W187: 4.9000000000000002e-002 | X187: 4.8000000000000001e-002 | Y187: 41 | Z187: 1.76 | AA187: 1.54e-002 | AB187: 9.7000000000000003e-003 | AC187: -1.29e-002 | AD187: -1.6200000000000003e-002 | AE187: 93.62 | AF187: 89.63 | AG187: 0.61 | AH187: AA- | AI187: 6.480000000000001e-002 | AJ187: =H187+100*O187 -> 112. | AK187: 111.8 | AL187: 49 | AM187: 18.1 | AN187: 38 | AO187: 4.4999999999999998e-002 | AP187: 25 | AQ187: 三力转债!
A188: 2 | B188: 113619 | C188: N世运转 | D188: 603920 | E188: 世运电路 | F188: 电子 | G188: 元器件制 | H188: 105.52 | I188: 5.5199999999999999e-002 | J188: 0. | K188: 21.19 | L188: 1.0500000000000001e-002 | M188: 115.2 | N188: 26.5 | O188: 0.32000000000000001 | P188: 79.96 | Q188: 5月7天 | R188: 5.92年 | S188: 3.92年 | T188: 10 | U188: 593 | V188: 0.56700000000000006 | W188: 0.115 | X188: 9.1999999999999998e-002 | Y188: 87 | Z188: 3.33 | AA188: 1.52e-002 | AB188: 1.0500000000000001e-002 | AC188: -4.3e-003 | AD188: -6.0000000000000001e-003 | AE188: 86.67 | AF188: 89.05 | AG188: 0.41 | AH188: AA | AI188: 4.53e-002 | AJ188: =H188+100*O188 -> 137.51999999999998 | AK188: 131.1 | AL188: 220 | AM188: 42 | AN188: 234 | AO188: -5.5e-002 | AP188: 2 | AQ188: N世运转
A189: 345 | B189: 110031 | C189: 航信转债!! | D189: 600271 | E189: 航天信息 | F189: 计算机及 | G189: 软件开发 | H189: 106.51 | I189: 1.7000000000000001e-003 | J189: -1.7000000000000001e-003 | K189: 11.42 | L189: 3.9100000000000003e-002 | M189: 107 | N189: 21.56 | O189: 1.01 | P189: 52.97 | Q189: 转股中 | R189: 0.31年 | S189: 回售内 | T189: 24 | U189: 9.1 | V189: 4.0000000000000001e-003 | W189: 0.113 | X189: 5.9999999999999998e-002 | Y189: 212 | Z189: 1.84 | AA189: 1.49e-002 | AB189: -2.7300000000000001e-002 | AC189: 回售内 | AD189: 回售内 | AE189: 100.27 | AF189: 105.97 | AG189: 0 | AH189: AAA | AI189: 3.1300000000000001e-002 | AJ189: =H189+100*O189 -> 207.50999999999999 | AK189: 160.1 | AL189: 304 | AM189: 54.1 | AN189: 276 | AO189: -2.e-002 | AP189: 15 | AQ189: 航信转债!!
A190: 144 | B190: 128107 | C190: 交科转债 | D190: 2061 | E190: 浙江交科 | F190: 建筑 | G190: 建筑工程 | H190: 107.3 | I190: 2.58e-002 | J190: -1.2e-002 | K190: 5.39 | L190: 2.2799999999999997e-002 | M190: 115.3 | N190: 5.36 | O190: 6.7000000000000004e-002 | P190: 100.56 | Q190: 转股中 | R190: 5.17年 | S190: 3.17年 | T190: 25 | U190: 36 | V190: 1.3999999999999999e-002 | W190: 0.33700000000000002 | X190: 0.33899999999999997 | Y190: 74 | Z190: 0.93 | AA190: 1.43e-002 | AB190: 8.8999999999999999e-003 | AC190: -1.e-002 | AD190: -1.2199999999999999e-002 | AE190: 90.25 | AF190: 93.04 | AG190: 0.61 | AH190: AA+ | AI190: 4.3299999999999998e-002 | AJ190: =H190+100*O190 -> 114. | AK190: 114 | AL190: 73 | AM190: 21 | AN190: 52 | AO190: 5.7000000000000002e-002 | AP190: 16 | AQ190: 交科转债
A191: 248 | B191: 128064 | C191: 司尔转债! | D191: 2538 | E191: 司尔特 | F191: 化工 | G191: 农化 | H191: 108.58 | I191: 4.0599999999999997e-002 | J191: -2.07e-002 | K191: 5.91 | L191: 3.6799999999999999e-002 | M191: 114.9 | N191: 6.07 | O191: 0.115 | P191: 97.36 | Q191: 转股中 | R191: 4年48天 | S191: 2年48天 | T191: 8 | U191: 27 | V191: 3.2000000000000001e-002 | W191: 0.188 | X191: 0.184 | Y191: 42 | Z191: 1.11 | AA191: 1.41e-002 | AB191: 7.4999999999999997e-003 | AC191: -2.1299999999999999e-002 | AD191: -2.41e-002 | AE191: 93.81 | AF191: 96.63 | AG191: 0.54 | AH191: AA | AI191: 4.3799999999999999e-002 | AJ191: =H191+100*O191 -> 120.08 | AK191: 119.8 | AL191: 130 | AM191: 23.2 | AN191: 71 | AO191: 7.4999999999999997e-002 | AP191: 54 | AQ191: 司尔转债!
A192: 299 | B192: 128040 | C192: 华通转债! | D192: 2758 | E192: 浙农股份 | F192: 医药 | G192: 医药商业 | H192: 107.39 | I192: 1.9299999999999998e-002 | J192: -8.5000000000000006e-003 | K192: 10.68 | L192: 1.6200000000000003e-002 | M192: 112.3 | N192: 10.33 | O192: 3.9e-002 | P192: 103.39 | Q192: 转股中 | R192: 3.32年 | S192: 1.32年 | T192: 2.22 | U192: 6.5 | V192: 2.7000000000000003e-002 | W192: 4.2999999999999997e-002 | X192: 4.4000000000000004e-002 | Y192: 52 | Z192: 3.53 | AA192: 1.3899999999999999e-002 | AB192: 6.8999999999999999e-003 | AC192: -2.9300000000000003e-002 | AD192: -3.2899999999999999e-002 | AE192: 93.75 | AF192: 91.61 | AG192: 0.67 | AH192: AA- | AI192: 6.480000000000001e-002 | AJ192: =H192+100*O192 -> 111.29000000000001 | AK192: 111.4 | AL192: 45 | AM192: 17.6 | AN192: 34 | AO192: 4.0000000000000001e-003 | AP192: 31 | AQ192: 华通转债!
A193: 252 | B193: 110057 | C193: 现代转债 | D193: 600420 | E193: 现代制药 | F193: 医药 | G193: 化学制药 | H193: 104.85 | I193: 1.11e-002 | J193: -1.1000000000000001e-003 | K193: 8.9 | L193: 2.18e-002 | M193: 110.8 | N193: 9.89 | O193: 0.16500000000000001 | P193: 89.99 | Q193: 转股中 | R193: 4年41天 | S193: 2年41天 | T193: 16.2 | U193: 23 | V193: 1.3999999999999999e-002 | W193: 0.17699999999999999 | X193: 0.159 | Y193: 91 | Z193: 1.16 | AA193: 1.38e-002 | AB193: 8.8000000000000005e-003 | AC193: -6.6e-003 | AD193: -9.3999999999999986e-003 | AE193: 94.81 | AF193: 95.07 | AG193: 0.46 | AH193: AAA | AI193: 3.8800000000000001e-002 | AJ193: =H193+100*O193 -> 121.34999999999999 | AK193: 119.7 | AL193: 127 | AM193: 24.6 | AN193: 88 | AO193: 1.9e-002 | AP193: 23 | AQ193: 现代转债
A194: 244 | B194: 113026 | C194: 核能转债! | D194: 601985 | E194: 中国核电 | F194: 能源电力 | G194: 核电 | H194: 103.87 | I194: 7.3000000000000001e-003 | J194: 2.7000000000000001e-003 | K194: 5.03 | L194: 2.4399999999999998e-002 | M194: 109.8 | N194: 5.86 | O194: 0.20999999999999999 | P194: 85.84 | Q194: 转股中 | R194: 4年55天 | S194: 2年55天 | T194: 78 | U194: 23 | V194: 3.0000000000000001e-003 | W194: 8.900000000000001e-002 | X194: 7.5999999999999998e-002 | Y194: 878 | Z194: 1.5 | AA194: 1.38e-002 | AB194: 9.1999999999999998e-003 | AC194: -2.3999999999999998e-003 | AD194: -5.1999999999999998e-003 | AE194: 94.67 | AF194: 94.08 | AG194: 0.41 | AH194: AAA | AI194: 3.8800000000000001e-002 | AJ194: =H194+100*O194 -> 124.87 | AK194: 121.9 | AL194: 151 | AM194: 27.2 | AN194: 122 | AO194: 5.0000000000000001e-003 | AP194: 50 | AQ194: 核能转债!
A195: 78 | B195: 128128 | C195: 齐翔转2 | D195: 2408 | E195: 齐翔腾达 | F195: 化工 | G195: 化工 | H195: 107.5 | I195: 2.58e-002 | J195: -7.000000000000001e-004 | K195: 8.95 | L195: 3.5900000000000001e-002 | M195: 115.3 | N195: 8.22 | O195: -1.3000000000000001e-002 | P195: 108.88 | Q195: 7天 | R195: 5.50年 | S195: 3.50年 | T195: 29.9 | U195: 206 | V195: 6.5000000000000002e-002 | W195: 0.188 | X195: 0.20499999999999999 | Y195: 159 | Z195: 1.94 | AA195: 1.3100000000000001e-002 | AB195: 8.0000000000000002e-003 | AC195: -9.7999999999999997e-003 | AD195: -1.1699999999999999e-002 | AE195: 88.3 | AF195: 90.8 | AG195: 0.7 | AH195: AA | AI195: 4.53e-002 | AJ195: =H195+100*O195 -> 106.2 | AK195: 106.1 | AL195: 21 | AM195: 15.3 | AN195: 23 | AO195: 9.0000000000000011e-003 | AP195: 40 | AQ195: 齐翔转2
A196: 190 | B196: 128090 | C196: 汽模转2 | D196: 2510 | E196: 天汽模 | F196: 汽车 | G196: 零部件制 | H196: 108.188 | I196: 1.2e-002 | J196: -6.3e-003 | K196: 4.29 | L196: 9.3999999999999986e-003 | M196: 114.9 | N196: 4.21 | O196: 6.2e-002 | P196: 101.9 | Q196: 转股中 | R196: 4.85年 | S196: 2.85年 | T196: 3.1 | U196: 67 | V196: 0.20199999999999999 | W196: 7.5999999999999998e-002 | X196: 7.6999999999999999e-002 | Y196: 41 | Z196: 1.48 | AA196: 1.2699999999999999e-002 | AB196: 7.0999999999999995e-003 | AC196: -1.4999999999999999e-002 | AD196: -1.72e-002 | AE196: 90.95 | AF196: 93.69 | AG196: 0.61 | AH196: AA | AI196: 4.3799999999999999e-002 | AJ196: =H196+100*O196 -> 114.38800000000001 | AK196: 114.5 | AL196: 79 | AM196: 20.8 | AN196: 51 | AO196: 9.0000000000000011e-003 | AP196: 27 | AQ196: 汽模转2
A197: 136 | B197: 128109 | C197: 楚江转债 | D197: 2171 | E197: 楚江新材 | F197: 有色金属 | G197: 铜金属 | H197: 108.061 | I197: 2.46e-002 | J197: -5.4000000000000003e-003 | K197: 7.81 | L197: 3.8599999999999995e-002 | M197: 115.3 | N197: 8.73 | O197: 0.20800000000000002 | P197: 89.46 | Q197: 转股中 | R197: 5.29年 | S197: 3.29年 | T197: 18.3 | U197: 44 | V197: 2.2000000000000002e-002 | W197: 0.17600000000000002 | X197: 0.157 | Y197: 104 | Z197: 1.89 | AA197: 1.26e-002 | AB197: 7.3000000000000001e-003 | AC197: -1.1699999999999999e-002 | AD197: -1.38e-002 | AE197: 89.22 | AF197: 91.67 | AG197: 0.5 | AH197: AA | AI197: 4.53e-002 | AJ197: =H197+100*O197 -> 128.86100000000002 | AK197: 126.7 | AL197: 193 | AM197: 35 | AN197: 194 | AO197: 0. | AP197: 6 | AQ197: 楚江转债
A198: 213 | B198: 110060 | C198: 天路转债! | D198: 600326 | E198: 西藏天路 | F198: 建筑 | G198: 水泥 | H198: 108.6 | I198: 3.0699999999999998e-002 | J198: 3.0999999999999999e-003 | K198: 7.05 | L198: 5.8600000000000006e-002 | M198: 114.9 | N198: 7.16 | O198: 0.10300000000000001 | P198: 98.46 | Q198: 转股中 | R198: 4.69年 | S198: 2.69年 | T198: 7.06 | U198: 27 | V198: 3.4000000000000002e-002 | W198: 0.109 | X198: 0.107 | Y198: 65 | Z198: 1.74 | AA198: 1.23e-002 | AB198: 6.5000000000000006e-003 | AC198: -1.72e-002 | AD198: -1.95e-002 | AE198: 91.6 | AF198: 94.35 | AG198: 0.58 | AH198: AA | AI198: 4.3799999999999999e-002 | AJ198: =H198+100*O198 -> 118.89999999999999 | AK198: 118.7 | AL198: 114 | AM198: 24.4 | AN198: 84 | AO198: 6.8000000000000005e-002 | AP198: 13 | AQ198: 天路转债!
A199: 255 | B199: 127012 | C199: 招路转债! | D199: 1965 | E199: 招商公路 | F199: 机场高速 | G199: 高速 | H199: 103.1 | I199: 6.3e-003 | J199: -2.5999999999999999e-003 | K199: 6.9 | L199: 1.32e-002 | M199: 108.2 | N199: 8.81 | O199: 0.316 | P199: 78.32 | Q199: 转股中 | R199: 4年31天 | S199: 2年31天 | T199: 50 | U199: 43 | V199: 8.0000000000000002e-003 | W199: 0.11699999999999999 | X199: 9.1999999999999998e-002 | Y199: 426 | Z199: 0.88 | AA199: 1.21e-002 | AB199: 8.199999999999999e-003 | AC199: -5.0000000000000001e-003 | AD199: -6.7000000000000002e-003 | AE199: 93.63 | AF199: 92.82 | AG199: 0.28 | AH199: AAA | AI199: 3.8800000000000001e-002 | AJ199: =H199+100*O199 -> 134.69999999999999 | AK199: 127.9 | AL199: 204 | AM199: 34.3 | AN199: 190 | AO199: 1.6e-002 | AP199: 36 | AQ199: 招路转债!
A200: 165 | B200: 128101 | C200: 联创转债! | D200: 2036 | E200: 联创电子 | F200: 电子 | G200: 液晶显示 | H200: 108.5 | I200: 2.0199999999999999e-002 | J200: -1.9900000000000001e-002 | K200: 10.76 | L200: 8.9999999999999998e-004 | M200: 115.1 | N200: 13.86 | O200: 0.39799999999999996 | P200: 77.63 | Q200: 转股中 | R200: 5年25天 | S200: 3年25天 | T200: 3 | U200: 3.6 | V200: 1.1000000000000001e-002 | W200: 2.7000000000000003e-002 | X200: 2.1000000000000001e-002 | Y200: 113 | Z200: 3.83 | AA200: 1.1899999999999999e-002 | AB200: 6.5000000000000006e-003 | AC200: -1.43e-002 | AD200: -1.6399999999999998e-002 | AE200: 89.89 | AF200: 92.37 | AG200: 0.33 | AH200: AA | AI200: 4.53e-002 | AJ200: =H200+100*O200 -> 148.30000000000001 | AK200: 139.4 | AL200: 263 | AM200: 47 | AN200: 256 | AO200: 3.1e-002 | AP200: 16 | AQ200: 联创转债!
A201: 263 | B201: 128057 | C201: 博彦转债 | D201: 2649 | E201: 博彦科技 | F201: 计算机及 | G201: 软件开发 | H201: 112.085 | I201: 1.0700000000000001e-002 | J201: 4.4000000000000003e-003 | K201: 9.52 | L201: 2.0400000000000001e-002 | M201: 117.1 | N201: 8.72 | O201: 2.7000000000000003e-002 | P201: 109.17 | Q201: 转股中 | R201: 4年14天 | S201: 2年14天 | T201: 5.1 | U201: 6.4 | V201: 1.1000000000000001e-002 | W201: 0.10099999999999999 | X201: 0.11 | Y201: 51 | Z201: 1.78 | AA201: 1.1200000000000002e-002 | AB201: 3.5999999999999999e-003 | AC201: -3.5499999999999997e-002 | AD201: -3.85e-002 | AE201: 90.39 | AF201: 91.44 | AG201: 0.74 | AH201: AA- | AI201: 6.480000000000001e-002 | AJ201: =H201+100*O201 -> 114.785 | AK201: 115 | AL201: 83 | AM201: 23.6 | AN201: 75 | AO201: 4.0999999999999995e-002 | AP201: 28 | AQ201: 博彦转债
A202: 152 | B202: 123048 | C202: 应急转债! | D202: 300527 | E202: 中船应急 | F202: 机械装备 | G202: 专用设备 | H202: 107.1 | I202: 2.29e-002 | J202: -4.1999999999999997e-003 | K202: 8.15 | L202: 3.56e-002 | M202: 113.1 | N202: 8.9 | O202: 0.17000000000000001 | P202: 91.57 | Q202: 转股中 | R202: 5年50天 | S202: 3年50天 | T202: 3.8 | U202: 27 | V202: 6.7000000000000004e-002 | W202: 4.8000000000000001e-002 | X202: 4.4000000000000004e-002 | Y202: 78 | Z202: 3.15 | AA202: 1.09e-002 | AB202: 6.1999999999999998e-003 | AC202: -1.01e-002 | AD202: -1.2199999999999999e-002 | AE202: 90.18 | AF202: 91.37 | AG202: 0.53 | AH202: AA+ | AI202: 4.3299999999999998e-002 | AJ202: =H202+100*O202 -> 124.09999999999999 | AK202: 122.6 | AL202: 159 | AM202: 31.3 | AN202: 157 | AO202: -3.6000000000000004e-002 | AP202: 16 | AQ202: 应急转债!
A203: 75 | B203: 113602 | C203: 景20转债! | D203: 603228 | E203: 景旺电子 | F203: 电子 | G203: 元器件制 | H203: 106.91 | I203: 7.6e-003 | J203: 7.7000000000000002e-003 | K203: 27.35 | L203: 4.1500000000000002e-002 | M203: 113.3 | N203: 35.28 | O203: 0.379 | P203: 77.52 | Q203: 10天 | R203: 5.51年 | S203: 3.51年 | T203: 17.8 | U203: 22 | V203: 1.2e-002 | W203: 7.5999999999999998e-002 | X203: 5.9000000000000004e-002 | Y203: 233 | Z203: 3.89 | AA203: 1.0800000000000001e-002 | AB203: 6.3e-003 | AC203: -8.1000000000000013e-003 | AD203: -1.01e-002 | AE203: 88.35 | AF203: 89.2 | AG203: 0.37 | AH203: AA | AI203: 4.53e-002 | AJ203: =H203+100*O203 -> 144.81 | AK203: 136.3 | AL203: 250 | AM203: 47.1 | AN203: 257 | AO203: -3.0000000000000001e-003 | AP203: 8 | AQ203: 景20转债!
A204: 231 | B204: 113541 | C204: 荣晟转债! | D204: 603165 | E204: 荣晟环保 | F204: 造纸包装 | G204: 包装用纸 | H204: 109.94 | I204: 1.34e-002 | J204: -5.0000000000000001e-003 | K204: 12.58 | L204: 1.1299999999999999e-002 | M204: 115 | N204: 11.54 | O204: 9.0000000000000011e-003 | P204: 109.01 | Q204: 转股中 | R204: 4.42年 | S204: 2.42年 | T204: 2.7 | U204: 16 | V204: 5.5e-002 | W204: 8.5000000000000006e-002 | X204: 9.1999999999999998e-002 | Y204: 32 | Z204: 2.07 | AA204: 1.04e-002 | AB204: 4.3e-003 | AC204: -2.3300000000000001e-002 | AD204: -2.58e-002 | AE204: 88.14 | AF204: 87.65 | AG204: 0.74 | AH204: AA- | AI204: 6.480000000000001e-002 | AJ204: =H204+100*O204 -> 110.84 | AK204: 110.9 | AL204: 41 | AM204: 22.7 | AN204: 66 | AO204: 5.0000000000000001e-003 | AP204: 48 | AQ204: 荣晟转债!
A205: 13 | B205: 128141 | C205: 旺能转债 | D205: 2034 | E205: 旺能环境 | F205: 城市公用 | G205: 三废处理 | H205: 108.481 | I205: 3.4599999999999999e-002 | J205: -1.4000000000000002e-003 | K205: 16.71 | L205: 5.16e-002 | M205: 115.1 | N205: 16.47 | O205: 6.9000000000000006e-002 | P205: 101.46 | Q205: 4月4天 | R205: 5.82年 | S205: 3.82年 | T205: 14 | U205: 23 | V205: 1.4999999999999999e-002 | W205: 0.19899999999999998 | X205: 0.20199999999999999 | Y205: 70 | Z205: 1.59 | AA205: 1.04e-002 | AB205: 5.6999999999999993e-003 | AC205: -1.1599999999999999e-002 | AD205: -1.3300000000000001e-002 | AE205: 86.93 | AF205: 89.32 | AG205: 0.64 | AH205: AA | AI205: 4.53e-002 | AJ205: =H205+100*O205 -> 115.381 | AK205: 115.5 | AL205: 89 | AM205: 26.2 | AN205: 107 | AO205: 6.7000000000000004e-002 | AP205: 2 | AQ205: 旺能转债
A206: 326 | B206: 123002 | C206: 国祯转债!! | D206: 300388 | E206: 节能国祯 | F206: 城市公用 | G206: 三废处理 | H206: 105.92 | I206: 2.0199999999999999e-002 | J206: -5.5000000000000005e-003 | K206: 8.01 | L206: 2.9600000000000001e-002 | M206: 108.8 | N206: 8.48 | O206: 0.121 | P206: 94.46 | Q206: 转股中 | R206: 2.76年 | S206: 0.76年 | T206: 2.52 | U206: 2.5 | V206: 9.0000000000000011e-003 | W206: 4.4999999999999998e-002 | X206: 4.2999999999999997e-002 | Y206: 56 | Z206: 1.48 | AA206: 9.8999999999999991e-003 | AB206: 3.9000000000000003e-003 | AC206: -4.4500000000000005e-002 | AD206: -4.7599999999999996e-002 | AE206: 97.76 | AF206: 97.3 | AG206: 0.5 | AH206: AA | AI206: 4.1900000000000007e-002 | AJ206: =H206+100*O206 -> 118.02 | AK206: 117.4 | AL206: 108 | AM206: 19.6 | AN206: 46 | AO206: -2.8999999999999998e-002 | AP206: 14 | AQ206: 国祯转债!!
A207: 50 | B207: 123074 | C207: 隆利转债 | D207: 300752 | E207: 隆利科技 | F207: 电子 | G207: 液晶显示 | H207: 117.49 | I207: 3.1099999999999999e-002 | J207: -2.5000000000000001e-003 | K207: 34.53 | L207: 3.6600000000000001e-002 | M207: 124 | N207: 29.41 | O207: 1.e-003 | P207: 117.41 | Q207: 2月14天 | R207: 5.69年 | S207: 3.69年 | T207: 3.25 | U207: 234 | V207: 0.628 | W207: 7.8e-002 | X207: 9.1999999999999998e-002 | Y207: 42 | Z207: 4.78 | AA207: 9.7000000000000003e-003 | AB207: 2.5999999999999999e-003 | AC207: -3.1600000000000003e-002 | AD207: -3.3500000000000002e-002 | AE207: 81.32 | AF207: 86.67 | AG207: 0.78 | AH207: AA- | AI207: 6.6299999999999998e-002 | AJ207: =H207+100*O207 -> 117.58999999999999 | AK207: 117.6 | AL207: 110 | AM207: 30.9 | AN207: 153 | AO207: -0.11900000000000001 | AP207: 10 | AQ207: 隆利转债
A208: 280 | B208: 110047 | C208: 山鹰转债 | D208: 600567 | E208: 山鹰国际 | F208: 造纸包装 | G208: 包装用纸 | H208: 113.99 | I208: 6.93e-002 | J208: -1.24e-002 | K208: 3.49 | L208: 0.10099999999999999 | M208: 117.5 | N208: 3.34 | O208: 9.0999999999999998e-002 | P208: 104.49 | Q208: 转股中 | R208: 3.75年 | S208: 1.75年 | T208: 23 | U208: 303 | V208: 0.11800000000000001 | W208: 0.14300000000000002 | X208: 0.14999999999999999 | Y208: 160 | Z208: 1.09 | AA208: 8.3000000000000001e-003 | AB208: 0. | AC208: -5.2600000000000001e-002 | AD208: -5.5300000000000002e-002 | AE208: 95.11 | AF208: 101.04 | AG208: 0.56 | AH208: AA+ | AI208: 4.1799999999999997e-002 | AJ208: =H208+100*O208 -> 123.08999999999999 | AK208: 123.5 | AL208: 164 | AM208: 22.4 | AN208: 62 | AO208: 0.127 | AP208: 36 | AQ208: 山鹰转债
A209: 170 | B209: 110067 | C209: 华安转债! | D209: 600909 | E209: 华安证券 | F209: 金融 | G209: 证券行业 | H209: 106.25 | I209: 1.41e-002 | J209: -2.3e-003 | K209: 6.88 | L209: 3.15e-002 | M209: 110.5 | N209: 8.67 | O209: 0.33899999999999997 | P209: 79.35 | Q209: 转股中 | R209: 5年21天 | S209: 无权 | T209: 28 | U209: 24 | V209: 8.0000000000000002e-003 | W209: 0.11199999999999999 | X209: 8.900000000000001e-002 | Y209: 249 | Z209: 1.8 | AA209: 7.9000000000000008e-003 | AB209: 4.0000000000000001e-003 | AC209: 无权 | AD209: 无权 | AE209: 无权 | AF209: 90.73 | AG209: 0.38 | AH209: AAA | AI209: 4.0300000000000002e-002 | AJ209: =H209+100*O209 -> 140.15000000000001 | AK209: 133.1 | AL209: 231 | AM209: 42.4 | AN209: 237 | AO209: 3.0000000000000001e-003 | AP209: 27 | AQ209: 华安转债!
A210: 262 | B210: 127011 | C210: 中鼎转2! | D210: 887 | E210: 中鼎股份 | F210: 汽车 | G210: 零部件制 | H210: 111.8 | I210: 1.8e-003 | J210: 7.4999999999999997e-003 | K210: 10.54 | L210: 2.1299999999999999e-002 | M210: 115.2 | N210: 11.59 | O210: 0.22899999999999998 | P210: 90.94 | Q210: 转股中 | R210: 4年17天 | S210: 2年17天 | T210: 12 | U210: 23 | V210: 1.7000000000000001e-002 | W210: 9.3000000000000013e-002 | X210: 8.5000000000000006e-002 | Y210: 129 | Z210: 1.47 | AA210: 7.6e-003 | AB210: 8.0000000000000004e-004 | AC210: -3.4500000000000003e-002 | AD210: -3.7499999999999999e-002 | AE210: 94.68 | AF210: 97.99 | AG210: 0.44 | AH210: AA+ | AI210: 4.1799999999999997e-002 | AJ210: =H210+100*O210 -> 134.69999999999999 | AK210: 132.7 | AL210: 225 | AM210: 34.7 | AN210: 192 | AO210: 1.3999999999999999e-002 | AP210: 26 | AQ210: 中鼎转2!
A211: 204 | B211: 110062 | C211: 烽火转债 | D211: 600498 | E211: 烽火通信 | F211: 通信互联 | G211: 通信设备 | H211: 106.91 | I211: 9.0000000000000011e-003 | J211: -1.1999999999999999e-003 | K211: 19.75 | L211: 2.4900000000000002e-002 | M211: 110.8 | N211: 25.65 | O211: 0.38799999999999996 | P211: 77 | Q211: 转股中 | R211: 4.78年 | S211: 2.78年 | T211: 30.9 | U211: 21 | V211: 6.0000000000000001e-003 | W211: 0.13400000000000001 | X211: 0.10300000000000001 | Y211: 231 | Z211: 2.18 | AA211: 7.6e-003 | AB211: 3.4000000000000002e-003 | AC211: -1.1699999999999999e-002 | AD211: -1.38e-002 | AE211: 92.41 | AF211: 92.67 | AG211: 0.31 | AH211: AAA | AI211: 3.8800000000000001e-002 | AJ211: =H211+100*O211 -> 145.70999999999998 | AK211: 136.8 | AL211: 255 | AM211: 44.2 | AN211: 248 | AO211: -5.4000000000000006e-002 | AP211: 20 | AQ211: 烽火转债
A212: 311 | B212: 128034 | C212: 江银转债! | D212: 2807 | E212: 江阴银行 | F212: 金融 | G212: 银行行业 | H212: 106.099 | I212: 1.24e-002 | J212: -4.6999999999999993e-003 | K212: 4.18 | L212: 1.7000000000000001e-002 | M212: 108.3 | N212: 4.5 | O212: 0.14199999999999999 | P212: 92.89 | Q212: 转股中 | R212: 2.93年 | S212: 无权 | T212: 17.6 | U212: 7.5 | V212: 4.0000000000000001e-003 | W212: 0.19399999999999998 | X212: 0.17999999999999999 | Y212: 91 | Z212: 0.8 | AA212: 7.0999999999999995e-003 | AB212: 1.7000000000000001e-003 | AC212: 无权 | AD212: 无权 | AE212: 无权 | AF212: 96.67 | AG212: 0.45 | AH212: AA+ | AI212: 3.9900000000000005e-002 | AJ212: =H212+100*O212 -> 120.29900000000001 | AK212: 119.3 | AL212: 120 | AM212: 22.6 | AN212: 65 | AO212: 1.6e-002 | AP212: 27 | AQ212: 江银转债!
A213: 201 | B213: 110063 | C213: 鹰19转债 | D213: 600567 | E213: 山鹰国际 | F213: 造纸包装 | G213: 包装用纸 | H213: 112.54 | I213: 6.1200000000000004e-002 | J213: 2.5000000000000001e-003 | K213: 3.49 | L213: 0.10099999999999999 | M213: 115.9 | N213: 3.3 | O213: 6.4000000000000001e-002 | P213: 105.76 | Q213: 转股中 | R213: 4.81年 | S213: 2.81年 | T213: 18.6 | U213: 158 | V213: 7.5999999999999998e-002 | W213: 0.11599999999999999 | X213: 0.12300000000000001 | Y213: 160 | Z213: 1.09 | AA213: 6.1999999999999998e-003 | AB213: 2.9999999999999997e-004 | AC213: -2.8799999999999999e-002 | AD213: -3.0800000000000001e-002 | AE213: 91.46 | AF213: 95.5 | AG213: 0.63 | AH213: AA+ | AI213: 4.1799999999999997e-002 | AJ213: =H213+100*O213 -> 118.94000000000001 | AK213: 119.3 | AL213: 121 | AM213: 23.8 | AN213: 79 | AO213: 0.127 | AP213: 41 | AQ213: 鹰19转债
A214: 278 | B214: 110048 | C214: 福能转债! | D214: 600483 | E214: 福能股份 | F214: 能源电力 | G214: 电力供应 | H214: 110.95 | I214: 2.7200000000000002e-002 | J214: -1.3100000000000001e-002 | K214: 8.07 | L214: 2.5399999999999999e-002 | M214: 113.3 | N214: 8.12 | O214: 0.11599999999999999 | P214: 99.38 | Q214: 转股中 | R214: 3.80年 | S214: 1.80年 | T214: 28.3 | U214: 20 | V214: 6.0000000000000001e-003 | W214: 0.19899999999999998 | X214: 0.19800000000000001 | Y214: 142 | Z214: 1.01 | AA214: 5.6000000000000008e-003 | AB214: -7.000000000000001e-004 | AC214: -3.8399999999999997e-002 | AD214: -4.0999999999999995e-002 | AE214: 94.91 | AF214: 97.26 | AG214: 0.55 | AH214: AA+ | AI214: 4.1799999999999997e-002 | AJ214: =H214+100*O214 -> 122.55 | AK214: 122.5 | AL214: 156 | AM214: 25.3 | AN214: 95 | AO214: 4.4000000000000004e-002 | AP214: 9 | AQ214: 福能转债!
A215: 138 | B215: 127017 | C215: 万青转债 | D215: 789 | E215: 万年青 | F215: 建筑 | G215: 水泥 | H215: 115.2 | I215: 3.78e-002 | J215: 4.7999999999999996e-003 | K215: 13.46 | L215: 8.1099999999999992e-002 | M215: 118.4 | N215: 14.16 | O215: 0.21199999999999999 | P215: 95.06 | Q215: 转股中 | R215: 5.29年 | S215: 3.29年 | T215: 10 | U215: 73 | V215: 6.4000000000000001e-002 | W215: 9.3000000000000013e-002 | X215: 8.900000000000001e-002 | Y215: 107 | Z215: 1.94 | AA215: 5.3e-003 | AB215: -8.0000000000000004e-004 | AC215: -3.0200000000000001e-002 | AD215: -3.2199999999999999e-002 | AE215: 89.75 | AF215: 95.06 | AG215: 0.53 | AH215: AA+ | AI215: 4.3299999999999998e-002 | AJ215: =H215+100*O215 -> 136.40000000000001 | AK215: 135.3 | AL215: 243 | AM215: 40.3 | AN215: 225 | AO215: 9.0999999999999998e-002 | AP215: 9 | AQ215: 万青转债
A216: 95 | B216: 110073 | C216: 国投转债 | D216: 600061 | E216: 国投资本 | F216: 金融 | G216: 证券行业 | H216: 107.49 | I216: 1.1699999999999999e-002 | J216: 1.e-004 | K216: 12.84 | L216: 2.64e-002 | M216: 110.5 | N216: 15.25 | O216: 0.27699999999999997 | P216: 84.2 | Q216: 转股中 | R216: 5.42年 | S216: 无权 | T216: 80 | U216: 56 | V216: 6.9999999999999993e-003 | W216: 0.14699999999999999 | X216: 0.124 | Y216: 543 | Z216: 1.3 | AA216: 5.1999999999999998e-003 | AB216: 1.6000000000000001e-003 | AC216: 无权 | AD216: 无权 | AE216: 无权 | AF216: 89.43 | AG216: 0.45 | AH216: AAA | AI216: 4.0300000000000002e-002 | AJ216: =H216+100*O216 -> 135.19 | AK216: 130.8 | AL216: 219 | AM216: 41.4 | AN216: 230 | AO216: -1.6e-002 | AP216: 21 | AQ216: 国投转债
A217: 178 | B217: 113564 | C217: 天目转债 | D217: 603136 | E217: 天目湖 | F217: 旅游餐饮 | G217: 旅游 | H217: 124.04 | I217: 1.44e-002 | J217: -1.3000000000000001e-002 | K217: 27.59 | L217: 1.8e-003 | M217: 126.7 | N217: 23.1 | O217: 3.9e-002 | P217: 119.44 | Q217: 转股中 | R217: 5年9天 | S217: 3年9天 | T217: 2.87 | U217: 40 | V217: 0.11199999999999999 | W217: 8.900000000000001e-002 | X217: 0.107 | Y217: 32 | Z217: 3.44 | AA217: 4.3e-003 | AB217: -4.4000000000000003e-003 | AC217: -5.2699999999999997e-002 | AD217: -5.5199999999999999e-002 | AE217: 85.51 | AF217: 92.52 | AG217: 0.79 | AH217: AA- | AI217: 6.6299999999999998e-002 | AJ217: =H217+100*O217 -> 127.94000000000001 | AK217: 128.6 | AL217: 209 | AM217: 36.1 | AN217: 203 | AO217: 0.18899999999999997 | AP217: 14 | AQ217: 天目转债
A218: 195 | B218: 113559 | C218: 永创转债! | D218: 603901 | E218: 永创智能 | F218: 机械装备 | G218: 专用设备 | H218: 116.18 | I218: 4.7999999999999996e-003 | J218: -1.06e-002 | K218: 10.43 | L218: -8.6e-003 | M218: 118.3 | N218: 10.32 | O218: 0.14999999999999999 | P218: 101.07 | Q218: 转股中 | R218: 4.84年 | S218: 2.84年 | T218: 5.1 | U218: 12 | V218: 2.1000000000000001e-002 | W218: 0.111 | X218: 0.11199999999999999 | Y218: 46 | Z218: 3.31 | AA218: 3.8e-003 | AB218: -2.8000000000000004e-003 | AC218: -3.5400000000000001e-002 | AD218: -3.7999999999999999e-002 | AE218: 86.62 | AF218: 87.95 | AG218: 0.68 | AH218: AA- | AI218: 6.480000000000001e-002 | AJ218: =H218+100*O218 -> 131.18000000000001 | AK218: 131.3 | AL218: 221 | AM218: 43.3 | AN218: 243 | AO218: 0.12 | AP218: 21 | AQ218: 永创转债!
A219: 330 | B219: 113016 | C219: 小康转债! | D219: 601127 | E219: 小康股份 | F219: 汽车 | G219: 零部件制 | H219: 108.26 | I219: 6.4199999999999993e-002 | J219: -9.7000000000000003e-003 | K219: 15.64 | L219: 9.9900000000000003e-002 | M219: 109.3 | N219: 15.7 | O219: 8.6999999999999994e-002 | P219: 99.62 | Q219: 转股中 | R219: 2.71年 | S219: 0.71年 | T219: 5.76 | U219: 850 | V219: 1.3700000000000001 | W219: 2.8999999999999998e-002 | X219: 2.8999999999999998e-002 | Y219: 200 | Z219: 3.41 | AA219: 3.5999999999999999e-003 | AB219: -2.8000000000000004e-003 | AC219: -6.7799999999999999e-002 | AD219: -7.1500000000000008e-002 | AE219: 98.2 | AF219: 97.97 | AG219: 0.55 | AH219: AA | AI219: 4.1900000000000007e-002 | AJ219: =H219+100*O219 -> 116.96000000000001 | AK219: 116.9 | AL219: 105 | AM219: 18.7 | AN219: 42 | AO219: 3.7000000000000005e-002 | AP219: 49 | AQ219: 小康转债!
A220: 57 | B220: 123070 | C220: 鹏辉转债 | D220: 300438 | E220: 鹏辉能源 | F220: 汽车 | G220: 零部件制 | H220: 113.6 | I220: 3.27e-002 | J220: -2.0799999999999999e-002 | K220: 19.56 | L220: 1.9799999999999998e-002 | M220: 115.1 | N220: 20.16 | O220: 0.17100000000000001 | P220: 97.02 | Q220: 2月6天 | R220: 5.67年 | S220: 3.67年 | T220: 8.9 | U220: 22 | V220: 2.2000000000000002e-002 | W220: 0.10800000000000001 | X220: 0.105 | Y220: 82 | Z220: 3.32 | AA220: 2.3999999999999998e-003 | AB220: -2.3999999999999998e-003 | AC220: -2.3900000000000001e-002 | AD220: -2.5699999999999997e-002 | AE220: 87.55 | AF220: 89.95 | AG220: 0.6 | AH220: AA | AI220: 4.53e-002 | AJ220: =H220+100*O220 -> 130.69999999999999 | AK220: 130.2 | AL220: 215 | AM220: 40.2 | AN220: 224 | AO220: -7.4999999999999997e-002 | AP220: 4 | AQ220: 鹏辉转债
A221: 48 | B221: 113607 | C221: 伟20转债! | D221: 603568 | E221: 伟明环保 | F221: 城市公用 | G221: 三废处理 | H221: 113.55 | I221: 1.8100000000000002e-002 | J221: -1.4000000000000002e-003 | K221: 19.82 | L221: 3.1800000000000002e-002 | M221: 115.1 | N221: 22.01 | O221: 0.26100000000000001 | P221: 90.05 | Q221: 2月16天 | R221: 5.70年 | S221: 3.70年 | T221: 12 | U221: 6.7 | V221: 5.0000000000000001e-003 | W221: 4.8000000000000001e-002 | X221: 4.2999999999999997e-002 | Y221: 249 | Z221: 4.96 | AA221: 2.3999999999999998e-003 | AB221: -2.3e-003 | AC221: -2.3599999999999999e-002 | AD221: -2.53e-002 | AE221: 87.41 | AF221: 89.81 | AG221: 0.53 | AH221: AA | AI221: 4.53e-002 | AJ221: =H221+100*O221 -> 139.65000000000001 | AK221: 137.1 | AL221: 256 | AM221: 47.2 | AN221: 258 | AO221: 9.3000000000000013e-002 | AP221: 4 | AQ221: 伟20转债!
A222: 218 | B222: 128078 | C222: 太极转债! | D222: 2368 | E222: 太极股份 | F222: 计算机及 | G222: 软件开发 | H222: 116.004 | I222: 3.7599999999999995e-002 | J222: -3.7599999999999995e-002 | K222: 22.92 | L222: 3.4300000000000004e-002 | M222: 116.9 | N222: 22.4 | O222: 0.13400000000000001 | P222: 102.32 | Q222: 转股中 | R222: 4.67年 | S222: 2.67年 | T222: 9.6 | U222: 16 | V222: 1.3999999999999999e-002 | W222: 7.2000000000000008e-002 | X222: 7.400000000000001e-002 | Y222: 133 | Z222: 4.32 | AA222: 1.7000000000000001e-003 | AB222: -4.6999999999999993e-003 | AC222: -4.0099999999999997e-002 | AD222: -4.2300000000000004e-002 | AE222: 91.67 | AF222: 96.06 | AG222: 0 | AH222: AA | AI222: 4.3799999999999999e-002 | AJ222: =H222+100*O222 -> 129.404 | AK222: 129.7 | AL222: 214 | AM222: 33.6 | AN222: 183 | AO222: -5.9999999999999998e-002 | AP222: 12 | AQ222: 太极转债!
A223: 344 | B223: 110033 | C223: 国贸转债! | D223: 600755 | E223: 厦门国贸 | F223: 交通运输 | G223: 交通运输 | H223: 107.88 | I223: 9.7000000000000003e-003 | J223: -6.3e-003 | K223: 6.55 | L223: 2.3399999999999997e-002 | M223: 108 | N223: 7.18 | O223: 0.183 | P223: 91.23 | Q223: 转股中 | R223: 0.88年 | S223: 回售内 | T223: 12.1 | U223: 7.3 | V223: 6.0000000000000001e-003 | W223: 9.5000000000000001e-002 | X223: 8.6999999999999994e-002 | Y223: 127 | Z223: 0.84 | AA223: 1.2999999999999999e-003 | AB223: -1.5600000000000001e-002 | AC223: 回售内 | AD223: 回售内 | AE223: 100.33 | AF223: 104.84 | AG223: 0.15 | AH223: AAA | AI223: 3.4500000000000003e-002 | AJ223: =H223+100*O223 -> 126.17999999999999 | AK223: 124.5 | AL223: 173 | AM223: 19.7 | AN223: 48 | AO223: 4.0000000000000001e-002 | AP223: 19 | AQ223: 国贸转债!
A224: 268 | B224: 110051 | C224: 中天转债! | D224: 600522 | E224: 中天科技 | F224: 通信互联 | G224: 通信设备 | H224: 113.5 | I224: 1.52e-002 | J224: 2.5000000000000001e-003 | K224: 10.25 | L224: 3.0200000000000001e-002 | M224: 113.9 | N224: 10.09 | O224: 0.11699999999999999 | P224: 101.59 | Q224: 转股中 | R224: 4年9天 | S224: 2年9天 | T224: 39.6 | U224: 49 | V224: 1.1000000000000001e-002 | W224: 0.126 | X224: 0.128 | Y224: 314 | Z224: 1.43 | AA224: 8.9999999999999998e-004 | AB224: -5.3e-003 | AC224: -4.2099999999999999e-002 | AD224: -4.4900000000000002e-002 | AE224: 94.63 | AF224: 96.96 | AG224: 0.59 | AH224: AA+ | AI224: 4.1799999999999997e-002 | AJ224: =H224+100*O224 -> 125.2 | AK224: 125.4 | AL224: 182 | AM224: 28.5 | AN224: 134 | AO224: -1.9e-002 | AP224: 26 | AQ224: 中天转债!
A225: 230 | B225: 113542 | C225: 好客转债 | D225: 603898 | E225: 好莱客 | F225: 其他 | G225: 家居用品 | H225: 114.6 | I225: -1.7000000000000001e-003 | J225: 1.4000000000000002e-003 | K225: 17.53 | L225: -5.9999999999999995e-004 | M225: 114.9 | N225: 16.27 | O225: 6.4000000000000001e-002 | P225: 107.74 | Q225: 转股中 | R225: 4.45年 | S225: 2.45年 | T225: 6.03 | U225: 2.2 | V225: 3.0000000000000001e-003 | W225: 0.111 | X225: 0.11900000000000001 | Y225: 55 | Z225: 2.23 | AA225: 5.9999999999999995e-004 | AB225: -5.4000000000000003e-003 | AC225: -3.9e-002 | AD225: -4.1299999999999996e-002 | AE225: 92.55 | AF225: 95.33 | AG225: 0.66 | AH225: AA | AI225: 4.3799999999999999e-002 | AJ225: =H225+100*O225 -> 121. | AK225: 121.5 | AL225: 144 | AM225: 26.1 | AN225: 106 | AO225: 6.2e-002 | AP225: 19 | AQ225: 好客转债
A226: 208 | B226: 123035 | C226: 利德转债! | D226: 300296 | E226: 利亚德 | F226: 电子 | G226: LED制 | H226: 114.801 | I226: 1.5900000000000001e-002 | J226: 6.9999999999999993e-003 | K226: 7.16 | L226: 3.7699999999999997e-002 | M226: 115.1 | N226: 6.98 | O226: 0.11900000000000001 | P226: 102.58 | Q226: 转股中 | R226: 4.73年 | S226: 2.73年 | T226: 8 | U226: 34 | V226: 3.7000000000000005e-002 | W226: 4.4000000000000004e-002 | X226: 4.4999999999999998e-002 | Y226: 182 | Z226: 2.13 | AA226: 5.9999999999999995e-004 | AB226: -5.1000000000000004e-003 | AC226: -3.5099999999999999e-002 | AD226: -3.7400000000000003e-002 | AE226: 92.11 | AF226: 95.2 | AG226: 0.61 | AH226: AA+ | AI226: 4.1799999999999997e-002 | AJ226: =H226+100*O226 -> 126.70100000000001 | AK226: 127 | AL226: 197 | AM226: 31.8 | AN226: 161 | AO226: 0.158 | AP226: 16 | AQ226: 利德转债!
A227: 46 | B227: 110076 | C227: 华海转债! | D227: 600521 | E227: 华海药业 | F227: 医药 | G227: 医药行业 | H227: 114.72 | I227: 3.85e-002 | J227: -2.7200000000000002e-002 | K227: 26.9 | L227: 3.0699999999999998e-002 | M227: 115.1 | N227: 34.66 | O227: 0.47799999999999998 | P227: 77.61 | Q227: 2月16天 | R227: 5.70年 | S227: 3.70年 | T227: 18.4 | U227: 12 | V227: 6.0000000000000001e-003 | W227: 4.7e-002 | X227: 3.7000000000000005e-002 | Y227: 391 | Z227: 6.33 | AA227: 5.9999999999999995e-004 | AB227: -4.0999999999999995e-003 | AC227: -2.6200000000000001e-002 | AD227: -2.7900000000000001e-002 | AE227: 87.41 | AF227: 89.81 | AG227: 0.37 | AH227: AA | AI227: 4.53e-002 | AJ227: =H227+100*O227 -> 162.51999999999998 | AK227: 151.8 | AL227: 295 | AM227: 62 | AN227: 296 | AO227: -1.e-003 | AP227: 6 | AQ227: 华海转债!
A228: 312 | B228: 123007 | C228: 道氏转债! | D228: 300409 | E228: 道氏技术 | F228: 建筑 | G228: 建筑行业 | H228: 110.2 | I228: 3.7599999999999995e-002 | J228: -2.0000000000000001e-004 | K228: 16.09 | L228: 5.16e-002 | M228: 110.3 | N228: 14.95 | O228: 2.4e-002 | P228: 107.63 | Q228: 转股中 | R228: 2.85年 | S228: 0.85年 | T228: 3.04 | U228: 38 | V228: 0.11599999999999999 | W228: 4.0999999999999995e-002 | X228: 4.4000000000000004e-002 | Y228: 74 | Z228: 3.06 | AA228: 2.9999999999999997e-004 | AB228: -6.3e-003 | AC228: -7.4900000000000008e-002 | AD228: -7.8e-002 | AE228: 95.66 | AF228: 92.93 | AG228: 0.72 | AH228: AA- | AI228: 6.2899999999999998e-002 | AJ228: =H228+100*O228 -> 112.60000000000001 | AK228: 112.8 | AL228: 58 | AM228: 17.1 | AN228: 29 | AO228: 6.4000000000000001e-002 | AP228: 22 | AQ228: 道氏转债!
A229: 142 | B229: 113579 | C229: 健友转债! | D229: 603707 | E229: 健友股份 | F229: 医药 | G229: 原料药 | H229: 114.06 | I229: 6.3899999999999998e-002 | J229: -2.3900000000000001e-002 | K229: 36.1 | L229: 8.8000000000000009e-002 | M229: 114.2 | N229: 42.05 | O229: 0.32899999999999996 | P229: 85.85 | Q229: 转股中 | R229: 5.17年 | S229: 3.17年 | T229: 5.03 | U229: 126 | V229: 0.222 | W229: 1.4999999999999999e-002 | X229: 1.3000000000000001e-002 | Y229: 337 | Z229: 9.84 | AA229: 2.0000000000000001e-004 | AB229: -4.6999999999999993e-003 | AC229: -2.8399999999999998e-002 | AD229: -3.04e-002 | AE229: 89.57 | AF229: 91.24 | AG229: 0.45 | AH229: AA | AI229: 4.53e-002 | AJ229: =H229+100*O229 -> 146.96000000000001 | AK229: 142.3 | AL229: 272 | AM229: 51 | AN229: 272 | AO229: 0.109 | AP229: 8 | AQ229: 健友转债!
A230: 52 | B230: 127023 | C230: 华菱转2 | D230: 932 | E230: 华菱钢铁 | F230: 钢铁 | G230: 炼钢 | H230: 110 | I230: -8.9999999999999998e-004 | J230: 2.2700000000000001e-002 | K230: 5.43 | L230: 3.2300000000000002e-002 | M230: 110.1 | N230: 5.18 | O230: 4.9000000000000002e-002 | P230: 104.83 | Q230: 2月9天 | R230: 5.67年 | S230: 4.67年 | T230: 40 | U230: 71 | V230: 1.6e-002 | W230: 0.12 | X230: 0.126 | Y230: 333 | Z230: 1.05 | AA230: 2.0000000000000001e-004 | AB230: -3.0999999999999999e-003 | AC230: -1.0800000000000001e-002 | AD230: -1.2500000000000001e-002 | AE230: 86.43 | AF230: 88.28 | AG230: 0.67 | AH230: AAA | AI230: 4.0300000000000002e-002 | AJ230: =H230+100*O230 -> 114.90000000000001 | AK230: 115.2 | AL230: 85 | AM230: 26.9 | AN230: 121 | AO230: 0.121 | AP230: 9 | AQ230: 华菱转2
A231: 168 | B231: 113572 | C231: 三祥转债! | D231: 603663 | E231: 三祥新材 | F231: 其他 | G231: 其他 | H231: 113.36 | I231: 1.46e-002 | J231: 3.7000000000000002e-003 | K231: 15.94 | L231: 2.18e-002 | M231: 113.2 | N231: 14.19 | O231: 9.0000000000000011e-003 | P231: 112.33 | Q231: 转股中 | R231: 5年21天 | S231: 3年21天 | T231: 1.7 | U231: 15 | V231: 8.0000000000000002e-002 | W231: 5.5e-002 | X231: 6.2e-002 | Y231: 31 | Z231: 5.15 | AA231: -2.9999999999999997e-004 | AB231: -5.0000000000000001e-003 | AC231: -2.75e-002 | AD231: -2.9600000000000001e-002 | AE231: 81.79 | AF231: 78.34 | AG231: 0.84 | AH231: A+ | AI231: 7.7300000000000008e-002 | AJ231: =H231+100*O231 -> 114.26000000000001 | AK231: 114.4 | AL231: 78 | AM231: 32.6 | AN231: 168 | AO231: 0.10300000000000001 | AP231: 18 | AQ231: 三祥转债!
A232: 151 | B232: 128106 | C232: 华统转债 | D232: 2840 | E232: 华统股份 | F232: 农业 | G232: 农产品加 | H232: 113.5 | I232: 1.6500000000000001e-002 | J232: 2.06e-002 | K232: 9.61 | L232: 5.5999999999999994e-002 | M232: 113.2 | N232: 9.39 | O232: 0.109 | P232: 102.34 | Q232: 转股中 | R232: 5年50天 | S232: 3年50天 | T232: 5.37 | U232: 7.4 | V232: 1.2e-002 | W232: 0.125 | X232: 0.128 | Y232: 43 | Z232: 2.57 | AA232: -5.0000000000000001e-004 | AB232: -5.1999999999999998e-003 | AC232: -2.7200000000000002e-002 | AD232: -2.9300000000000003e-002 | AE232: 89.72 | AF232: 90.59 | AG232: 0.66 | AH232: AA | AI232: 4.53e-002 | AJ232: =H232+100*O232 -> 124.40000000000001 | AK232: 124.7 | AL232: 174 | AM232: 34.1 | AN232: 187 | AO232: 6.8000000000000005e-002 | AP232: 8 | AQ232: 华统转债
A233: 22 | B233: 113043 | C233: 财通转债 | D233: 601108 | E233: 财通证券 | F233: 金融 | G233: 证券行业 | H233: 110.51 | I233: 1.54e-002 | J233: 7.6e-003 | K233: 11.69 | L233: 4.4699999999999997e-002 | M233: 110.2 | N233: 13.33 | O233: 0.26000000000000001 | P233: 87.7 | Q233: 3月27天 | R233: 5.81年 | S233: 无权 | T233: 38 | U233: 86 | V233: 2.1000000000000001e-002 | W233: 9.0999999999999998e-002 | X233: 7.9000000000000001e-002 | Y233: 420 | Z233: 1.93 | AA233: -5.0000000000000001e-004 | AB233: -3.7000000000000002e-003 | AC233: 无权 | AD233: 无权 | AE233: 无权 | AF233: 87.88 | AG233: 0.52 | AH233: AAA | AI233: 4.0300000000000002e-002 | AJ233: =H233+100*O233 -> 136.50999999999999 | AK233: 133.3 | AL233: 232 | AM233: 45.4 | AN233: 251 | AO233: 5.2999999999999999e-002 | AP233: 6 | AQ233: 财通转债
A234: 42 | B234: 127024 | C234: 盈峰转债 | D234: 967 | E234: 盈峰环境 | F234: 机械装备 | G234: 专用设备 | H234: 117.97 | I234: 8.3000000000000001e-003 | J234: 2.0999999999999999e-003 | K234: 8.34 | L234: 1.7100000000000001e-002 | M234: 116.8 | N234: 8.31 | O234: 0.17499999999999999 | P234: 100.36 | Q234: 2月20天 | R234: 5.71年 | S234: 3.71年 | T234: 14.8 | U234: 13 | V234: 6.9999999999999993e-003 | W234: 5.5999999999999994e-002 | X234: 5.5999999999999994e-002 | Y234: 264 | Z234: 1.63 | AA234: -1.8e-003 | AB234: -6.8999999999999999e-003 | AC234: -3.39e-002 | AD234: -3.5499999999999997e-002 | AE234: 87.76 | AF234: 92.05 | AG234: 0.61 | AH234: AA+ | AI234: 4.3299999999999998e-002 | AJ234: =H234+100*O234 -> 135.47 | AK234: 135.6 | AL234: 246 | AM234: 43.5 | AN234: 244 | AO234: 3.5000000000000003e-002 | AP234: 5 | AQ234: 盈峰转债
A235: 316 | B235: 128032 | C235: 双环转债! | D235: 2472 | E235: 双环传动 | F235: 机械装备 | G235: 通用设备 | H235: 109.928 | I235: -2.5999999999999999e-003 | J235: -9.300000000000001e-003 | K235: 9.49 | L235: -2.3700000000000002e-002 | M235: 109.3 | N235: 9.89 | O235: 0.14599999999999999 | P235: 95.96 | Q235: 转股中 | R235: 2.85年 | S235: 0.85年 | T235: 10 | U235: 9.4 | V235: 9.0000000000000011e-003 | W235: 0.154 | X235: 0.14699999999999999 | Y235: 65 | Z235: 1.95 | AA235: -2.e-003 | AB235: -8.1000000000000013e-003 | AC235: -7.3200000000000001e-002 | AD235: -7.6399999999999996e-002 | AE235: 97.66 | AF235: 97.43 | AG235: 0.51 | AH235: AA | AI235: 4.1900000000000007e-002 | AJ235: =H235+100*O235 -> 124.52799999999999 | AK235: 123.9 | AL235: 169 | AM235: 26.2 | AN235: 110 | AO235: 6.4000000000000001e-002 | AP235: 45 | AQ235: 双环转债!
A236: 14 | B236: 113614 | C236: 健20转债! | D236: 603707 | E236: 健友股份 | F236: 医药 | G236: 原料药 | H236: 115.54 | I236: 5.7300000000000004e-002 | J236: -5.1000000000000004e-003 | K236: 36.1 | L236: 8.8000000000000009e-002 | M236: 114.2 | N236: 38.04 | O236: 0.217 | P236: 94.9 | Q236: 4月4天 | R236: 5.82年 | S236: 3.82年 | T236: 7.8 | U236: 180 | V236: 0.19500000000000001 | W236: 2.3e-002 | X236: 2.2000000000000002e-002 | Y236: 337 | Z236: 9.84 | AA236: -2.e-003 | AB236: -6.4000000000000003e-003 | AC236: -2.69e-002 | AD236: -2.86e-002 | AE236: 87.02 | AF236: 88.64 | AG236: 0.59 | AH236: AA | AI236: 4.53e-002 | AJ236: =H236+100*O236 -> 137.24000000000001 | AK236: 136.2 | AL236: 248 | AM236: 47.5 | AN236: 260 | AO236: 0.109 | AP236: 2 | AQ236: 健20转债!
A237: 73 | B237: 128130 | C237: 景兴转债 | D237: 2067 | E237: 景兴纸业 | F237: 造纸包装 | G237: 包装用纸 | H237: 116.483 | I237: 2.9900000000000003e-002 | J237: 5.4000000000000003e-003 | K237: 4.05 | L237: 4.6500000000000007e-002 | M237: 115.1 | N237: 3.4 | O237: -2.2000000000000002e-002 | P237: 119.12 | Q237: 13天 | R237: 5.53年 | S237: 3.53年 | T237: 12.8 | U237: 142 | V237: 9.6000000000000002e-002 | W237: 0.28399999999999997 | X237: 0.33899999999999997 | Y237: 45 | Z237: 1 | AA237: -2.2000000000000001e-003 | AB237: -6.9999999999999993e-003 | AC237: -3.15e-002 | AD237: -3.3300000000000003e-002 | AE237: 88.08 | AF237: 90.5 | AG237: 0.76 | AH237: AA | AI237: 4.53e-002 | AJ237: =H237+100*O237 -> 114.283 | AK237: 113.8 | AL237: 71 | AM237: 23.3 | AN237: 74 | AO237: 7.2999999999999995e-002 | AP237: 12 | AQ237: 景兴转债
A238: 185 | B238: 123042 | C238: 银河转债! | D238: 300619 | E238: 金银河 | F238: 机械装备 | G238: 专用设备 | H238: 116.92 | I238: 5.8999999999999999e-003 | J238: 1.9799999999999998e-002 | K238: 18.88 | L238: 5.7699999999999994e-002 | M238: 115.4 | N238: 24.4 | O238: 0.51100000000000001 | P238: 77.38 | Q238: 转股中 | R238: 4.90年 | S238: 2.90年 | T238: 1.67 | U238: 142 | V238: 0.72999999999999998 | W238: 0.11800000000000001 | X238: 9.1999999999999998e-002 | Y238: 14 | Z238: 2.89 | AA238: -2.7000000000000001e-003 | AB238: -8.3000000000000001e-003 | AC238: -3.8599999999999995e-002 | AD238: -4.0800000000000003e-002 | AE238: 83.1 | AF238: 81.3 | AG238: 0.45 | AH238: A+ | AI238: 7.5800000000000006e-002 | AJ238: =H238+100*O238 -> 168.02000000000001 | AK238: 156.5 | AL238: 300 | AM238: 73.4 | AN238: 307 | AO238: 2.7000000000000003e-002 | AP238: 25 | AQ238: 银河转债!
A239: 292 | B239: 123012 | C239: 万顺转债! | D239: 300057 | E239: 万顺新材 | F239: 有色金属 | G239: 铝金属 | H239: 111.4 | I239: 4.2300000000000004e-002 | J239: -1.29e-002 | K239: 4.71 | L239: 6.3200000000000006e-002 | M239: 110.3 | N239: 5.31 | O239: 0.25600000000000001 | P239: 88.7 | Q239: 转股中 | R239: 3.41年 | S239: 1.41年 | T239: 1.29 | U239: 203 | V239: 1.3799999999999999 | W239: 4.0999999999999995e-002 | X239: 3.6000000000000004e-002 | Y239: 32 | Z239: 0.93 | AA239: -3.0000000000000001e-003 | AB239: -8.5000000000000006e-003 | AC239: -5.0000000000000003e-002 | AD239: -5.3200000000000004e-002 | AE239: 93.17 | AF239: 89.43 | AG239: 0.47 | AH239: AA- | AI239: 6.480000000000001e-002 | AJ239: =H239+100*O239 -> 137. | AK239: 134.1 | AL239: 241 | AM239: 40.9 | AN239: 228 | AO239: 4.9000000000000002e-002 | AP239: 19 | AQ239: 万顺转债!
A240: 99 | B240: 123060 | C240: 苏试转债 | D240: 300416 | E240: 苏试试验 | F240: 机械装备 | G240: 专用设备 | H240: 119.5 | I240: 1.1899999999999999e-002 | J240: 1.5e-003 | K240: 23.39 | L240: 1.9599999999999999e-002 | M240: 117.6 | N240: 23.86 | O240: 0.21899999999999997 | P240: 98.03 | Q240: 转股中 | R240: 5.42年 | S240: 3.42年 | T240: 3.1 | U240: 1.8 | V240: 5.0000000000000001e-003 | W240: 6.5000000000000002e-002 | X240: 6.4000000000000001e-002 | Y240: 48 | Z240: 4.79 | AA240: -3.0000000000000001e-003 | AB240: -8.6999999999999994e-003 | AC240: -3.8599999999999995e-002 | AD240: -4.0599999999999997e-002 | AE240: 82.79 | AF240: 83.69 | AG240: 0.68 | AH240: AA- | AI240: 6.6299999999999998e-002 | AJ240: =H240+100*O240 -> 141.40000000000001 | AK240: 141 | AL240: 268 | AM240: 57.3 | AN240: 289 | AO240: -4.0000000000000001e-003 | AP240: 9 | AQ240: 苏试转债
A241: 182 | B241: 128096 | C241: 奥瑞转债!! | D241: 2701 | E241: 奥瑞金 | F241: 造纸包装 | G241: 包装材料 | H241: 117.6 | I241: 1.3100000000000001e-002 | J241: 2.3300000000000001e-002 | K241: 4.99 | L241: 5.2699999999999997e-002 | M241: 115.5 | N241: 4.54 | O241: 7.0000000000000007e-002 | P241: 109.91 | Q241: 转股中 | R241: 4.98年 | S241: 2.98年 | T241: 7.08 | U241: 5.4 | V241: 6.9999999999999993e-003 | W241: 5.9000000000000004e-002 | X241: 6.5000000000000002e-002 | Y241: 121 | Z241: 2.02 | AA241: -3.7000000000000002e-003 | AB241: -9.1999999999999998e-003 | AC241: -3.9199999999999999e-002 | AD241: -4.1399999999999999e-002 | AE241: 91.41 | AF241: 94.6 | AG241: 0.69 | AH241: AA+ | AI241: 4.1799999999999997e-002 | AJ241: =H241+100*O241 -> 124.59999999999999 | AK241: 125.3 | AL241: 179 | AM241: 30.7 | AN241: 149 | AO241: 7.0999999999999994e-002 | AP241: 21 | AQ241: 奥瑞转债!!
A242: 102 | B242: 127020 | C242: 中金转债 | D242: 60 | E242: 中金岭南 | F242: 有色金属 | G242: 有色行业 | H242: 116 | I242: 2.3599999999999999e-002 | J242: -5.0000000000000001e-004 | K242: 4.93 | L242: 3.5699999999999996e-002 | M242: 113.7 | N242: 4.71 | O242: 0.10800000000000001 | P242: 104.67 | Q242: 转股中 | R242: 5.41年 | S242: 3.41年 | T242: 38 | U242: 66 | V242: 1.4999999999999999e-002 | W242: 0.21600000000000003 | X242: 0.22600000000000001 | Y242: 176 | Z242: 1.56 | AA242: -3.7000000000000002e-003 | AB242: -8.3000000000000001e-003 | AC242: -3.4300000000000004e-002 | AD242: -3.5499999999999997e-002 | AE242: 88.1 | AF242: 90.66 | AG242: 0.65 | AH242: AA+ | AI242: 4.3299999999999998e-002 | AJ242: =H242+100*O242 -> 126.8 | AK242: 127.3 | AL242: 200 | AM242: 36.7 | AN242: 205 | AO242: 0.14400000000000002 | AP242: 14 | AQ242: 中金转债
A243: 72 | B243: 123064 | C243: 万孚转债! | D243: 300482 | E243: 万孚生物 | F243: 医药 | G243: 医疗器械 | H243: 118 | I243: 2.0799999999999999e-002 | J243: -1.32e-002 | K243: 83.24 | L243: 1.5100000000000001e-002 | M243: 115.1 | N243: 93.57 | O243: 0.32600000000000001 | P243: 88.96 | Q243: 17天 | R243: 5.53年 | S243: 3.53年 | T243: 6 | U243: 9.7 | V243: 1.3999999999999999e-002 | W243: 2.1000000000000001e-002 | X243: 1.9e-002 | Y243: 285 | Z243: 10.53 | AA243: -4.5999999999999999e-003 | AB243: -9.3999999999999986e-003 | AC243: -3.49e-002 | AD243: -3.6600000000000001e-002 | AE243: 88.07 | AF243: 90.49 | AG243: 0.5 | AH243: AA | AI243: 4.53e-002 | AJ243: =H243+100*O243 -> 150.59999999999999 | AK243: 147 | AL243: 286 | AM243: 56.5 | AN243: 285 | AO243: -6.4000000000000001e-002 | AP243: 10 | AQ243: 万孚转债!
A244: 32 | B244: 123079 | C244: 运达转债 | D244: 300772 | E244: 运达股份 | F244: 能源电力 | G244: 风能 | H244: 118.599 | I244: 1.2199999999999999e-002 | J244: 4.0000000000000002e-004 | K244: 16.97 | L244: 1.7399999999999999e-002 | M244: 115.1 | N244: 15.31 | O244: 7.0000000000000007e-002 | P244: 110.84 | Q244: 3月18天 | R244: 5.78年 | S244: 3.78年 | T244: 5.77 | U244: 18 | V244: 2.6000000000000002e-002 | W244: 0.11599999999999999 | X244: 0.128 | Y244: 50 | Z244: 3.24 | AA244: -5.3e-003 | AB244: -9.8999999999999991e-003 | AC244: -3.39e-002 | AD244: -3.56e-002 | AE244: 87.1 | AF244: 89.5 | AG244: 0.72 | AH244: AA | AI244: 4.53e-002 | AJ244: =H244+100*O244 -> 125.599 | AK244: 126.4 | AL244: 188 | AM244: 36.9 | AN244: 206 | AO244: -1.1000000000000001e-002 | AP244: 4 | AQ244: 运达转债
A245: 283 | B245: 128048 | C245: 张行转债 | D245: 2839 | E245: 张家港行 | F245: 金融 | G245: 银行行业 | H245: 115.8 | I245: 1.3999999999999999e-002 | J245: -5.1000000000000004e-003 | K245: 5.84 | L245: 1.5700000000000002e-002 | M245: 113.3 | N245: 5.76 | O245: 0.14199999999999999 | P245: 101.39 | Q245: 转股中 | R245: 3.73年 | S245: 无权 | T245: 25 | U245: 11 | V245: 4.0000000000000001e-003 | W245: 0.23699999999999999 | X245: 0.23999999999999999 | Y245: 106 | Z245: 1.01 | AA245: -5.8999999999999999e-003 | AB245: -1.23e-002 | AC245: 无权 | AD245: 无权 | AE245: 无权 | AF245: 97.53 | AG245: 0.57 | AH245: AA+ | AI245: 4.1799999999999997e-002 | AJ245: =H245+100*O245 -> 130. | AK245: 130.2 | AL245: 216 | AM245: 32.7 | AN245: 169 | AO245: 2.9999999999999999e-002 | AP245: 14 | AQ245: 张行转债
A246: 126 | B246: 128113 | C246: 比音转债 | D246: 2832 | E246: 比音勒芬 | F246: 服装纺织 | G246: 服装行业 | H246: 121 | I246: 4.1299999999999996e-002 | J246: 1.9099999999999999e-002 | K246: 17.19 | L246: 8.1099999999999992e-002 | M246: 117.3 | N246: 14.9 | O246: 4.9000000000000002e-002 | P246: 115.37 | Q246: 转股中 | R246: 5.32年 | S246: 3.32年 | T246: 6.89 | U246: 26 | V246: 3.1e-002 | W246: 7.5999999999999998e-002 | X246: 8.8000000000000009e-002 | Y246: 90 | Z246: 4.19 | AA246: -5.8999999999999999e-003 | AB246: -1.1599999999999999e-002 | AC246: -4.3499999999999997e-002 | AD246: -4.5400000000000003e-002 | AE246: 89.1 | AF246: 93.12 | AG246: 0.74 | AH246: AA | AI246: 4.53e-002 | AJ246: =H246+100*O246 -> 125.90000000000001 | AK246: 126.6 | AL246: 192 | AM246: 33.5 | AN246: 182 | AO246: 8.8000000000000009e-002 | AP246: 7 | AQ246: 比音转债
A247: 43 | B247: 128137 | C247: 洁美转债 | D247: 2859 | E247: 洁美科技 | F247: 电子 | G247: 元器件制 | H247: 121.484 | I247: 5.8999999999999999e-003 | J247: 1.e-004 | K247: 27.23 | L247: 8.5000000000000006e-003 | M247: 117.3 | N247: 27.77 | O247: 0.23899999999999999 | P247: 98.06 | Q247: 2月20天 | R247: 5.71年 | S247: 3.71年 | T247: 6 | U247: 2.9 | V247: 4.0000000000000001e-003 | W247: 5.4000000000000006e-002 | X247: 5.2999999999999999e-002 | Y247: 112 | Z247: 6.4 | AA247: -6.1999999999999998e-003 | AB247: -1.15e-002 | AC247: -4.0099999999999997e-002 | AD247: -4.1900000000000007e-002 | AE247: 81.15 | AF247: 81.9 | AG247: 0.71 | AH247: AA- | AI247: 6.6299999999999998e-002 | AJ247: =H247+100*O247 -> 145.38399999999999 | AK247: 144.9 | AL247: 279 | AM247: 63 | AN247: 299 | AO247: -2.5000000000000001e-002 | AP247: 4 | AQ247: 洁美转债
A248: 206 | B248: 113550 | C248: 常汽转债! | D248: 603035 | E248: 常熟汽饰 | F248: 汽车 | G248: 零部件制 | H248: 124.9 | I248: 3.9599999999999996e-002 | J248: -1.7600000000000001e-002 | K248: 11.61 | L248: 2.7400000000000001e-002 | M248: 121.3 | N248: 9.65 | O248: 3.7999999999999999e-002 | P248: 120.31 | Q248: 转股中 | R248: 4.75年 | S248: 2.75年 | T248: 3.78 | U248: 20 | V248: 4.2999999999999997e-002 | W248: 9.5000000000000001e-002 | X248: 0.114 | Y248: 40 | Z248: 1.16 | AA248: -6.3e-003 | AB248: -1.38e-002 | AC248: -6.0899999999999996e-002 | AD248: -6.3399999999999998e-002 | AE248: 86.99 | AF248: 90.68 | AG248: 0.8 | AH248: AA- | AI248: 6.480000000000001e-002 | AJ248: =H248+100*O248 -> 128.70000000000002 | AK248: 129.5 | AL248: 213 | AM248: 38.8 | AN248: 214 | AO248: -1.7000000000000001e-002 | AP248: 15 | AQ248: 常汽转债!
A249: 105 | B249: 128121 | C249: 宏川转债 | D249: 2930 | E249: 宏川智慧 | F249: 交通运输 | G249: 物流业 | H249: 117.14 | I249: 6.3e-003 | J249: 7.8000000000000005e-003 | K249: 19.2 | L249: 2.07e-002 | M249: 113.3 | N249: 20.25 | O249: 0.23499999999999999 | P249: 94.81 | Q249: 转股中 | R249: 5.41年 | S249: 3.41年 | T249: 6.7 | U249: 3.5 | V249: 5.0000000000000001e-003 | W249: 7.9000000000000001e-002 | X249: 7.4999999999999997e-002 | Y249: 85 | Z249: 4.43 | AA249: -6.3e-003 | AB249: -1.0700000000000001e-002 | AC249: -3.3599999999999998e-002 | AD249: -3.5499999999999997e-002 | AE249: 82.73 | AF249: 80.68 | AG249: 0.68 | AH249: AA- | AI249: 6.6299999999999998e-002 | AJ249: =H249+100*O249 -> 140.63999999999999 | AK249: 139.5 | AL249: 264 | AM249: 56.7 | AN249: 287 | AO249: 2.3e-002 | AP249: 4 | AQ249: 宏川转债
A250: 325 | B250: 128021 | C250: 兄弟转债!! | D250: 2562 | E250: 兄弟科技 | F250: 医药 | G250: 原料药 | H250: 110.79 | I250: 1.1299999999999999e-002 | J250: -1.1000000000000001e-002 | K250: 5.22 | L250: 2.76e-002 | M250: 108.8 | N250: 5.19 | O250: 0.10199999999999999 | P250: 100.58 | Q250: 转股中 | R250: 2.77年 | S250: 0.77年 | T250: 2.65 | U250: 3.4 | V250: 1.2e-002 | W250: 4.8000000000000001e-002 | X250: 4.8000000000000001e-002 | Y250: 55 | Z250: 2.03 | AA250: -6.6e-003 | AB250: -1.2500000000000001e-002 | AC250: -8.8699999999999987e-002 | AD250: -9.1700000000000004e-002 | AE250: 97.72 | AF250: 97.25 | AG250: 0.01 | AH250: AA | AI250: 4.1900000000000007e-002 | AJ250: =H250+100*O250 -> 120.99000000000001 | AK250: 121 | AL250: 139 | AM250: 23.3 | AN250: 72 | AO250: 3.7000000000000005e-002 | AP250: 14 | AQ250: 兄弟转债!!
A251: 222 | B251: 128075 | C251: 远东转债! | D251: 2406 | E251: 远东传动 | F251: 汽车 | G251: 零部件制 | H251: 118.369 | I251: 1.1699999999999999e-002 | J251: -1.e-004 | K251: 6.38 | L251: 1.5900000000000001e-002 | M251: 114.9 | N251: 5.54 | O251: 2.7999999999999997e-002 | P251: 115.16 | Q251: 转股中 | R251: 4.59年 | S251: 2.59年 | T251: 5.44 | U251: 13 | V251: 2.1000000000000001e-002 | W251: 0.13699999999999998 | X251: 0.157 | Y251: 40 | Z251: 1.27 | AA251: -6.6e-003 | AB251: -1.23e-002 | AC251: -4.8300000000000003e-002 | AD251: -5.0499999999999996e-002 | AE251: 91.98 | AF251: 94.74 | AG251: 0.73 | AH251: AA | AI251: 4.3799999999999999e-002 | AJ251: =H251+100*O251 -> 121.169 | AK251: 121.6 | AL251: 147 | AM251: 26.8 | AN251: 118 | AO251: 4.7e-002 | AP251: 15 | AQ251: 远东转债!
A252: 124 | B252: 123055 | C252: 晨光转债!* | D252: 300138 | E252: 晨光生物 | F252: 食品饮料 | G252: 食品加工 | H252: 128.844 | I252: 5.7999999999999996e-003 | J252: 3.7000000000000002e-003 | K252: 15.97 | L252: 9.4999999999999998e-003 | M252: 124.3 | N252: 12.25 | O252: -1.2e-002 | P252: 130.37 | Q252: 转股中 | R252: 5.32年 | S252: 3.32年 | T252: 1.38 | U252: 78 | V252: 0.44400000000000001 | W252: 1.6e-002 | X252: 2.1000000000000001e-002 | Y252: 85 | Z252: 4.25 | AA252: -6.8999999999999999e-003 | AB252: -1.44e-002 | AC252: -5.96e-002 | AD252: -6.1699999999999998e-002 | AE252: 83.54 | AF252: 89.02 | AG252: 1 | AH252: AA- | AI252: 6.6299999999999998e-002 | AJ252: =H252+100*O252 -> 127.64399999999999 | AK252: 127.3 | AL252: 199 | AM252: 38.3 | AN252: 212 | AO252: 2.3e-002 | AP252: 9 | AQ252: 晨光转债!*
A253: 41 | B253: 127025 | C253: 冀东转债 | D253: 401 | E253: 冀东水泥 | F253: 建筑 | G253: 水泥 | H253: 114.75 | I253: 2.64e-002 | J253: 8.3999999999999995e-003 | K253: 15.23 | L253: 5.7599999999999998e-002 | M253: 110.1 | N253: 15.78 | O253: 0.18899999999999997 | P253: 96.51 | Q253: 2月21天 | R253: 5.71年 | S253: 3.71年 | T253: 28.2 | U253: 42 | V253: 1.3000000000000001e-002 | W253: 0.13699999999999998 | X253: 0.13300000000000001 | Y253: 205 | Z253: 1.51 | AA253: -7.3000000000000001e-003 | AB253: -1.0500000000000001e-002 | AC253: -2.7999999999999997e-002 | AD253: -2.9399999999999999e-002 | AE253: 88.33 | AF253: 88.15 | AG253: 0.6 | AH253: AAA | AI253: 4.0300000000000002e-002 | AJ253: =H253+100*O253 -> 133.65000000000001 | AK253: 133 | AL253: 230 | AM253: 44.7 | AN253: 249 | AO253: 8.199999999999999e-002 | AP253: 9 | AQ253: 冀东转债
A254: 125 | B254: 128114 | C254: 正邦转债 | D254: 2157 | E254: 正邦科技 | F254: 农业 | G254: 畜牧业 | H254: 120.25 | I254: 7.9299999999999995e-002 | J254: -5.3e-003 | K254: 17.92 | L254: 0.10000000000000001 | M254: 115.3 | N254: 15.55 | O254: 4.2999999999999997e-002 | P254: 115.24 | Q254: 转股中 | R254: 5.32年 | S254: 3.32年 | T254: 16 | U254: 342 | V254: 0.182 | W254: 2.8999999999999998e-002 | X254: 3.3000000000000002e-002 | Y254: 555 | Z254: 3.01 | AA254: -8.0000000000000002e-003 | AB254: -1.3100000000000001e-002 | AC254: -4.1700000000000001e-002 | AD254: -4.36e-002 | AE254: 89.67 | AF254: 92.44 | AG254: 0.74 | AH254: AA+ | AI254: 4.3299999999999998e-002 | AJ254: =H254+100*O254 -> 124.55 | AK254: 125.3 | AL254: 178 | AM254: 32.8 | AN254: 173 | AO254: 7.2000000000000008e-002 | AP254: 14 | AQ254: 正邦转债
A255: 277 | B255: 128050 | C255: 钧达转债! | D255: 2865 | E255: 钧达股份 | F255: 汽车 | G255: 零部件制 | H255: 126.5 | I255: -2.2400000000000003e-002 | J255: 2.07e-002 | K255: 19.02 | L255: -2.0999999999999999e-003 | M255: 122.7 | N255: 14.85 | O255: -1.2e-002 | P255: 128.08 | Q255: 转股中 | R255: 3.81年 | S255: 1.81年 | T255: 1.96 | U255: 200 | V255: 0.79099999999999993 | W255: 8.0000000000000002e-002 | X255: 0.10199999999999999 | Y255: 24 | Z255: 2.66 | AA255: -8.1000000000000013e-003 | AB255: -1.8000000000000002e-002 | AC255: -9.9499999999999991e-002 | AD255: -0.10199999999999999 | AE255: 91.13 | AF255: 97.06 | AG255: 0.8 | AH255: AA- | AI255: 6.480000000000001e-002 | AJ255: =H255+100*O255 -> 125.3 | AK255: 124.9 | AL255: 175 | AM255: 27.9 | AN255: 127 | AO255: 3.2000000000000001e-002 | AP255: 58 | AQ255: 钧达转债!
A256: 68 | B256: 123066 | C256: 赛意转债 | D256: 300687 | E256: 赛意信息 | F256: 计算机及 | G256: 软件开发 | H256: 127.032 | I256: -5.0000000000000001e-004 | J256: -7.8000000000000005e-003 | K256: 27.25 | L256: -9.7999999999999997e-003 | M256: 121.4 | N256: 22.58 | O256: 5.2999999999999999e-002 | P256: 120.68 | Q256: 31天 | R256: 5.57年 | S256: 3.57年 | T256: 3.2 | U256: 12 | V256: 2.8999999999999998e-002 | W256: 5.4000000000000006e-002 | X256: 6.5000000000000002e-002 | Y256: 59 | Z256: 6.25 | AA256: -8.3000000000000001e-003 | AB256: -1.47e-002 | AC256: -5.1799999999999999e-002 | AD256: -5.3800000000000001e-002 | AE256: 79.21 | AF256: 80.92 | AG256: 0.85 | AH256: A+ | AI256: 7.7300000000000008e-002 | AJ256: =H256+100*O256 -> 132.33199999999999 | AK256: 133.4 | AL256: 233 | AM256: 52.5 | AN256: 275 | AO256: -4.2999999999999997e-002 | AP256: 7 | AQ256: 赛意转债
A257: 8 | B257: 113615 | C257: 金诚转债 | D257: 603979 | E257: 金诚信 | F257: 有色金属 | G257: 有色行业 | H257: 123.39 | I257: 2.9700000000000001e-002 | J257: 1.46e-002 | K257: 14.12 | L257: 6.1699999999999998e-002 | M257: 117.3 | N257: 12.73 | O257: 0.11199999999999999 | P257: 110.92 | Q257: 4月10天 | R257: 5.84年 | S257: 3.84年 | T257: 10 | U257: 82 | V257: 6.8000000000000005e-002 | W257: 0.121 | X257: 0.13500000000000001 | Y257: 82 | Z257: 1.84 | AA257: -8.8000000000000005e-003 | AB257: -1.3899999999999999e-002 | AC257: -4.2599999999999999e-002 | AD257: -4.4299999999999999e-002 | AE257: 87.06 | AF257: 90.99 | AG257: 0.72 | AH257: AA | AI257: 4.53e-002 | AJ257: =H257+100*O257 -> 134.59 | AK257: 135.9 | AL257: 247 | AM257: 44.9 | AN257: 250 | AO257: 0.121 | AP257: 3 | AQ257: 金诚转债
A258: 87 | B258: 113598 | C258: 法兰转债 | D258: 603966 | E258: 法兰泰克 | F258: 机械装备 | G258: 工程机械 | H258: 128.07 | I258: 2.8000000000000004e-003 | J258: 5.1000000000000004e-003 | K258: 16.92 | L258: 9.4999999999999998e-003 | M258: 121.2 | N258: 13.88 | O258: 5.0999999999999997e-002 | P258: 121.9 | Q258: 转股中 | R258: 5.44年 | S258: 3.44年 | T258: 3.3 | U258: 12 | V258: 2.8999999999999998e-002 | W258: 9.1999999999999998e-002 | X258: 0.113 | Y258: 36 | Z258: 3.2 | AA258: -1.03e-002 | AB258: -1.6799999999999999e-002 | AC258: -5.6299999999999996e-002 | AD258: -5.8299999999999998e-002 | AE258: 82.8 | AF258: 86.12 | AG258: 0.83 | AH258: AA- | AI258: 6.6299999999999998e-002 | AJ258: =H258+100*O258 -> 133.16999999999999 | AK258: 134.2 | AL258: 242 | AM258: 48.1 | AN258: 267 | AO258: 7.8e-002 | AP258: 8 | AQ258: 法兰转债
A259: 154 | B259: 113034 | C259: 滨化转债 | D259: 601678 | E259: 滨化股份 | F259: 化工 | G259: 化工 | H259: 121.39 | I259: 2.1099999999999997e-002 | J259: -1.83e-002 | K259: 5.63 | L259: 3.5999999999999999e-003 | M259: 115.1 | N259: 4.68 | O259: 9.0000000000000011e-003 | P259: 120.3 | Q259: 转股中 | R259: 5年50天 | S259: 3年50天 | T259: 19.3 | U259: 83 | V259: 3.6000000000000004e-002 | W259: 0.20899999999999999 | X259: 0.251 | Y259: 93 | Z259: 1.39 | AA259: -1.0500000000000001e-002 | AB259: -1.5600000000000001e-002 | AC259: -4.7199999999999999e-002 | AD259: -4.9200000000000001e-002 | AE259: 89.62 | AF259: 92.09 | AG259: 0.78 | AH259: AA | AI259: 4.53e-002 | AJ259: =H259+100*O259 -> 122.29000000000001 | AK259: 122.5 | AL259: 155 | AM259: 30.4 | AN259: 148 | AO259: 9.6000000000000002e-002 | AP259: 28 | AQ259: 滨化转债
A260: 156 | B260: 113575 | C260: 东时转债! | D260: 603377 | E260: 东方时尚 | F260: 其他 | G260: 其他 | H260: 119.83 | I260: -1.9e-003 | J260: 1.41e-002 | K260: 13.15 | L260: 2.3300000000000001e-002 | M260: 113.5 | N260: 14.56 | O260: 0.32700000000000001 | P260: 90.32 | Q260: 转股中 | R260: 5年49天 | S260: 3年49天 | T260: 0.99 | U260: 75 | V260: 0.63200000000000001 | W260: 1.2e-002 | X260: 1.1000000000000001e-002 | Y260: 80 | Z260: 4.12 | AA260: -1.0700000000000001e-002 | AB260: -1.54e-002 | AC260: -4.2900000000000001e-002 | AD260: -4.4999999999999998e-002 | AE260: 89.86 | AF260: 90.86 | AG260: 0.52 | AH260: AA | AI260: 4.53e-002 | AJ260: =H260+100*O260 -> 152.53 | AK260: 149.3 | AL260: 289 | AM260: 58.5 | AN260: 292 | AO260: 1.6e-002 | AP260: 15 | AQ260: 东时转债!
A261: 237 | B261: 113537 | C261: 文灿转债!! | D261: 603348 | E261: 文灿股份 | F261: 汽车 | G261: 零部件制 | H261: 127.67 | I261: 1.7100000000000001e-002 | J261: 2.3999999999999998e-003 | K261: 24.73 | L261: 2.3599999999999999e-002 | M261: 121.5 | N261: 19.43 | O261: 3.0000000000000001e-003 | P261: 127.28 | Q261: 转股中 | R261: 4.30年 | S261: 2.30年 | T261: 1.79 | U261: 89 | V261: 0.39500000000000002 | W261: 2.7999999999999997e-002 | X261: 3.6000000000000004e-002 | Y261: 64 | Z261: 2.54 | AA261: -1.1699999999999999e-002 | AB261: -2.0099999999999996e-002 | AC261: -7.9100000000000004e-002 | AD261: -8.2100000000000006e-002 | AE261: 89.61 | AF261: 93.4 | AG261: 0.83 | AH261: AA- | AI261: 6.480000000000001e-002 | AJ261: =H261+100*O261 -> 127.97 | AK261: 128.1 | AL261: 206 | AM261: 34.7 | AN261: 191 | AO261: -1.8000000000000002e-002 | AP261: 25 | AQ261: 文灿转债!!
A262: 65 | B262: 113603 | C262: 东缆转债 | D262: 603606 | E262: 东方电缆 | F262: 能源电力 | G262: 电力设备 | H262: 123.17 | I262: -4.6999999999999993e-003 | J262: 2.3e-002 | K262: 24.35 | L262: 2.8300000000000002e-002 | M262: 115.1 | N262: 23.88 | O262: 0.20800000000000002 | P262: 101.97 | Q262: 39天 | R262: 5.59年 | S262: 3.59年 | T262: 8 | U262: 29 | V262: 2.9999999999999999e-002 | W262: 5.0000000000000003e-002 | X262: 5.0999999999999997e-002 | Y262: 159 | Z262: 5.88 | AA262: -1.2199999999999999e-002 | AB262: -1.7000000000000001e-002 | AC262: -4.53e-002 | AD262: -4.7e-002 | AE262: 87.82 | AF262: 90.24 | AG262: 0.65 | AH262: AA | AI262: 4.53e-002 | AJ262: =H262+100*O262 -> 143.97 | AK262: 144.4 | AL262: 276 | AM262: 54.1 | AN262: 277 | AO262: -5.9000000000000004e-002 | AP262: 6 | AQ262: 东缆转债
A263: 269 | B263: 128053 | C263: 尚荣转债! | D263: 2551 | E263: 尚荣医疗 | F263: 医药 | G263: 医疗器械 | H263: 120.503 | I263: 1.77e-002 | J263: 1.5800000000000002e-002 | K263: 5.46 | L263: 3.4099999999999998e-002 | M263: 114.3 | N263: 4.89 | O263: 7.9000000000000001e-002 | P263: 111.66 | Q263: 转股中 | R263: 3.99年 | S263: 1.99年 | T263: 1.91 | U263: 69 | V263: 0.30299999999999999 | W263: 4.2999999999999997e-002 | X263: 4.8000000000000001e-002 | Y263: 45 | Z263: 1.51 | AA263: -1.34e-002 | AB263: -1.9699999999999999e-002 | AC263: -7.1599999999999997e-002 | AD263: -7.3800000000000004e-002 | AE263: 93.79 | AF263: 96.63 | AG263: 0.98 | AH263: AA | AI263: 4.3799999999999999e-002 | AJ263: =H263+100*O263 -> 128.40299999999999 | AK263: 129.3 | AL263: 211 | AM263: 32.7 | AN263: 171 | AO263: -2.5000000000000001e-002 | AP263: 27 | AQ263: 尚荣转债!
A264: 44 | B264: 128136 | C264: 立讯转债 | D264: 2475 | E264: 立讯精密 | F264: 电子 | G264: 元器件制 | H264: 120.95 | I264: -5.3e-003 | J264: 2.8000000000000004e-003 | K264: 49.84 | L264: -5.4000000000000003e-003 | M264: 111.9 | N264: 58.44 | O264: 0.41799999999999998 | P264: 85.28 | Q264: 2月19天 | R264: 5.70年 | S264: 3.70年 | T264: 30 | U264: 83 | V264: 2.3e-002 | W264: 9.0000000000000011e-003 | X264: 6.9999999999999993e-003 | Y264: 3500. | Z264: 13.98 | AA264: -1.37e-002 | AB264: -1.7399999999999999e-002 | AC264: -4.2199999999999994e-002 | AD264: -4.3299999999999998e-002 | AE264: 86.94 | AF264: 88.1 | AG264: 0.48 | AH264: AA+ | AI264: 4.3299999999999998e-002 | AJ264: =H264+100*O264 -> 162.75 | AK264: 156.6 | AL264: 301 | AM264: 68.5 | AN264: 305 | AO264: -6.5000000000000002e-002 | AP264: 11 | AQ264: 立讯转债
A265: 58 | B265: 128135 | C265: 洽洽转债 | D265: 2557 | E265: 洽洽食品 | F265: 食品饮料 | G265: 休闲食品 | H265: 129.9 | I265: -8.3999999999999995e-003 | J265: -3.8e-003 | K265: 60.1 | L265: -2.1299999999999999e-002 | M265: 120.2 | N265: 60.83 | O265: 0.315 | P265: 98.8 | Q265: 2月6天 | R265: 5.67年 | S265: 3.67年 | T265: 13.4 | U265: 19 | V265: 1.1000000000000001e-002 | W265: 4.4000000000000004e-002 | X265: 4.2999999999999997e-002 | Y265: 305 | Z265: 7.95 | AA265: -1.38e-002 | AB265: -1.9799999999999998e-002 | AC265: -5.7500000000000002e-002 | AD265: -5.9200000000000003e-002 | AE265: 87.64 | AF265: 93.94 | AG265: 0.57 | AH265: AA | AI265: 4.53e-002 | AJ265: =H265+100*O265 -> 161.40000000000001 | AK265: 161 | AL265: 306 | AM265: 67.1 | AN265: 302 | AO265: -5.7000000000000002e-002 | AP265: 8 | AQ265: 洽洽转债
A266: 342 | B266: 113009 | C266: 广汽转债! | D266: 601238 | E266: 广汽集团 | F266: 汽车 | G266: 乘用车 | H266: 107.45 | I266: 3.3e-003 | J266: -2.8000000000000004e-003 | K266: 11.22 | L266: 1.54e-002 | M266: 106 | N266: 14.12 | O266: 0.35200000000000004 | P266: 79.46 | Q266: 转股中 | R266: 0.92年 | S266: 回售内 | T266: 25.5 | U266: 18 | V266: 6.9999999999999993e-003 | W266: 2.2000000000000002e-002 | X266: 1.7000000000000001e-002 | Y266: 1161. | Z266: 1.39 | AA266: -1.46e-002 | AB266: -2.6699999999999998e-002 | AC266: 回售内 | AD266: 回售内 | AE266: 100.27 | AF266: 102.73 | AG266: 0.03 | AH266: AAA | AI266: 3.4500000000000003e-002 | AJ266: =H266+100*O266 -> 142.65000000000001 | AK266: 135.4 | AL266: 244 | AM266: 32.7 | AN266: 170 | AO266: -8.0000000000000002e-003 | AP266: 16 | AQ266: 广汽转债!
A267: 212 | B267: 113548 | C267: 石英转债! | D267: 603688 | E267: 石英股份 | F267: 电子 | G267: 电子产品 | H267: 133.19 | I267: 1.5e-003 | J267: 5.0000000000000001e-003 | K267: 18.8 | L267: 8.0000000000000002e-003 | M267: 124.4 | N267: 15.1 | O267: 7.0000000000000007e-002 | P267: 124.5 | Q267: 转股中 | R267: 4.69年 | S267: 2.69年 | T267: 1.23 | U267: 18 | V267: 0.111 | W267: 1.9e-002 | X267: 2.3e-002 | Y267: 66 | Z267: 3.52 | AA267: -1.4800000000000001e-002 | AB267: -2.3199999999999998e-002 | AC267: -8.2899999999999988e-002 | AD267: -8.539999999999999e-002 | AE267: 87.38 | AF267: 93.32 | AG267: 0.81 | AH267: AA- | AI267: 6.480000000000001e-002 | AJ267: =H267+100*O267 -> 140.19 | AK267: 141.9 | AL267: 269 | AM267: 48.6 | AN267: 268 | AO267: -1.7000000000000001e-002 | AP267: 12 | AQ267: 石英转债!
A268: 225 | B268: 123030 | C268: 九洲转债! | D268: 300040 | E268: 九洲集团 | F268: 能源电力 | G268: 电力设备 | H268: 128.41 | I268: 3.2000000000000002e-003 | J268: 2.0499999999999997e-002 | K268: 6.26 | L268: 3.3000000000000002e-002 | M268: 120 | N268: 5.65 | O268: 0.159 | P268: 110.8 | Q268: 转股中 | R268: 4.50年 | S268: 2.50年 | T268: 0.97 | U268: 51 | V268: 0.41100000000000003 | W268: 4.0999999999999995e-002 | X268: 4.4999999999999998e-002 | Y268: 24 | Z268: 1.09 | AA268: -1.52e-002 | AB268: -2.2700000000000001e-002 | AC268: -7.85e-002 | AD268: -8.0700000000000008e-002 | AE268: 87.72 | AF268: 91 | AG268: 0.72 | AH268: AA- | AI268: 6.480000000000001e-002 | AJ268: =H268+100*O268 -> 144.31 | AK268: 146 | AL268: 280 | AM268: 55 | AN268: 281 | AO268: -1.e-002 | AP268: 28 | AQ268: 九洲转债!
A269: 253 | B269: 123025 | C269: 精测转债!! | D269: 300567 | E269: 精测电子 | F269: 电子 | G269: 液晶显示 | H269: 125.5 | I269: -7.7000000000000002e-003 | J269: -1.8e-003 | K269: 53.88 | L269: -1.32e-002 | M269: 117.3 | N269: 49.95 | O269: 0.16300000000000001 | P269: 107.87 | Q269: 转股中 | R269: 4年38天 | S269: 2年38天 | T269: 3.09 | U269: 14 | V269: 3.5000000000000003e-002 | W269: 2.3e-002 | X269: 2.5000000000000001e-002 | Y269: 133 | Z269: 8.56 | AA269: -1.67e-002 | AB269: -2.3900000000000001e-002 | AC269: -8.1799999999999998e-002 | AD269: -8.4499999999999992e-002 | AE269: 90.04 | AF269: 91.23 | AG269: 0.72 | AH269: AA- | AI269: 6.480000000000001e-002 | AJ269: =H269+100*O269 -> 141.80000000000001 | AK269: 143.1 | AL269: 275 | AM269: 51.9 | AN269: 273 | AO269: -0.10000000000000001 | AP269: 18 | AQ269: 精测转债!!
A270: 147 | B270: 113577 | C270: 春秋转债 | D270: 603890 | E270: 春秋电子 | F270: 电子 | G270: 电子产品 | H270: 129.13 | I270: 9.1000000000000004e-003 | J270: 6.8000000000000005e-003 | K270: 14.31 | L270: 1.8500000000000003e-002 | M270: 118.2 | N270: 11.06 | O270: -2.e-003 | P270: 129.39 | Q270: 转股中 | R270: 5年54天 | S270: 3年54天 | T270: 1.98 | U270: 75 | V270: 0.29999999999999999 | W270: 3.6000000000000004e-002 | X270: 4.5999999999999999e-002 | Y270: 55 | Z270: 3.27 | AA270: -1.7399999999999999e-002 | AB270: -2.3399999999999997e-002 | AC270: -6.3600000000000004e-002 | AD270: -6.5700000000000008e-002 | AE270: 84.4 | AF270: 85.62 | AG270: 0.86 | AH270: AA- | AI270: 6.6299999999999998e-002 | AJ270: =H270+100*O270 -> 128.93000000000001 | AK270: 128.9 | AL270: 210 | AM270: 43.3 | AN270: 241 | AO270: 5.2000000000000005e-002 | AP270: 13 | AQ270: 春秋转债
A271: 109 | B271: 128119 | C271: 龙大转债! | D271: 2726 | E271: 龙大肉食 | F271: 食品饮料 | G271: 肉制品 | H271: 132 | I271: 3.1300000000000001e-002 | J271: -9.5999999999999992e-003 | K271: 11.96 | L271: 2.75e-002 | M271: 120.2 | N271: 9.57 | O271: 5.5999999999999994e-002 | P271: 124.97 | Q271: 转股中 | R271: 5.39年 | S271: 3.39年 | T271: 9.5 | U271: 59 | V271: 4.7e-002 | W271: 8.0000000000000002e-002 | X271: 0.10000000000000001 | Y271: 119 | Z271: 3.87 | AA271: -1.7500000000000002e-002 | AB271: -2.3700000000000002e-002 | AC271: -6.6100000000000006e-002 | AD271: -6.7799999999999999e-002 | AE271: 88.7 | AF271: 95.07 | AG271: 0.79 | AH271: AA | AI271: 4.53e-002 | AJ271: =H271+100*O271 -> 137.59999999999999 | AK271: 139 | AL271: 259 | AM271: 44 | AN271: 247 | AO271: -3.5000000000000003e-002 | AP271: 8 | AQ271: 龙大转债!
A272: 127 | B272: 113587 | C272: 泛微转债!* | D272: 603039 | E272: 泛微网络 | F272: 计算机及 | G272: 软件开发 | H272: 137.15 | I272: -2.2499999999999999e-002 | J272: 1.8e-003 | K272: 88.52 | L272: -2.07e-002 | M272: 124.3 | N272: 64.33 | O272: -3.0000000000000001e-003 | P272: 137.6 | Q272: 转股中 | R272: 5.32年 | S272: 3.32年 | T272: 0.7 | U272: 17 | V272: 0.17699999999999999 | W272: 4.0000000000000001e-003 | X272: 5.0000000000000001e-003 | Y272: 189 | Z272: 19.49 | AA272: -1.8700000000000001e-002 | AB272: -2.6099999999999998e-002 | AC272: -7.6600000000000001e-002 | AD272: -7.8600000000000003e-002 | AE272: 83.57 | AF272: 89.05 | AG272: 1 | AH272: AA- | AI272: 6.6299999999999998e-002 | AJ272: =H272+100*O272 -> 136.84999999999999 | AK272: 136.7 | AL272: 253 | AM272: 47.6 | AN272: 262 | AO272: -4.4999999999999998e-002 | AP272: 6 | AQ272: 泛微转债!*
A273: 12 | B273: 128142 | C273: 新乳转债 | D273: 2946 | E273: 新乳业 | F273: 食品饮料 | G273: 乳制品 | H273: 129.748 | I273: 4.6399999999999997e-002 | J273: 2.5000000000000001e-002 | K273: 20.19 | L273: 0.10000000000000001 | M273: 115.1 | N273: 18.69 | O273: 0.20100000000000001 | P273: 108.03 | Q273: 4月5天 | R273: 5.83年 | S273: 3.83年 | T273: 7.18 | U273: 50 | V273: 5.4000000000000006e-002 | W273: 4.2000000000000003e-002 | X273: 4.4999999999999998e-002 | Y273: 172 | Z273: 8.43 | AA273: -2.07e-002 | AB273: -2.5099999999999997e-002 | AC273: -5.5199999999999999e-002 | AD273: -5.6799999999999996e-002 | AE273: 86.92 | AF273: 89.31 | AG273: 0.71 | AH273: AA | AI273: 4.53e-002 | AJ273: =H273+100*O273 -> 149.84799999999998 | AK273: 151.5 | AL273: 292 | AM273: 62.2 | AN273: 297 | AO273: 6.8000000000000005e-002 | AP273: 3 | AQ273: 新乳转债
A274: 132 | B274: 113585 | C274: 寿仙转债! | D274: 603896 | E274: 寿仙谷 | F274: 医药 | G274: 中药 | H274: 132.74 | I274: -6.0999999999999995e-003 | J274: 2.3999999999999998e-003 | K274: 38.24 | L274: -4.1999999999999997e-003 | M274: 117.8 | N274: 28.68 | O274: -4.0000000000000001e-003 | P274: 133.33 | Q274: 转股中 | R274: 5.30年 | S274: 3.30年 | T274: 2.06 | U274: 18 | V274: 6.5000000000000002e-002 | W274: 3.6000000000000004e-002 | X274: 4.9000000000000002e-002 | Y274: 57 | Z274: 4.45 | AA274: -2.2700000000000001e-002 | AB274: -2.8399999999999998e-002 | AC274: -6.83e-002 | AD274: -7.0300000000000001e-002 | AE274: 83.6 | AF274: 84.5 | AG274: 0.9 | AH274: AA- | AI274: 6.6299999999999998e-002 | AJ274: =H274+100*O274 -> 132.34 | AK274: 132.1 | AL274: 223 | AM274: 47.6 | AN274: 263 | AO274: 1.3000000000000001e-002 | AP274: 9 | AQ274: 寿仙转债!
A275: 62 | B275: 110075 | C275: 南航转债 | D275: 600029 | E275: 南方航空 | F275: 交通运输 | G275: 航空运输 | H275: 125.79 | I275: 3.7000000000000002e-003 | J275: -4.6999999999999993e-003 | K275: 6.35 | L275: -1.6000000000000001e-003 | M275: 110 | N275: 6.24 | O275: 0.23600000000000002 | P275: 101.76 | Q275: 2月1天 | R275: 5.65年 | S275: 3.65年 | T275: 160 | U275: 79 | V275: 4.0000000000000001e-003 | W275: 0.16399999999999998 | X275: 0.16699999999999998 | Y275: 973 | Z275: 1.35 | AA275: -2.3700000000000002e-002 | AB275: -2.69e-002 | AC275: -5.3099999999999994e-002 | AD275: -5.4100000000000002e-002 | AE275: 88 | AF275: 88.23 | AG275: 0.64 | AH275: AAA | AI275: 4.0300000000000002e-002 | AJ275: =H275+100*O275 -> 149.39000000000001 | AK275: 149.8 | AL275: 290 | AM275: 61.6 | AN275: 295 | AO275: 8.9999999999999997e-002 | AP275: 8 | AQ275: 南航转债
A276: 217 | B276: 128079 | C276: 英联转债! | D276: 2846 | E276: 英联股份 | F276: 造纸包装 | G276: 包装材料 | H276: 131.484 | I276: -1.66e-002 | J276: 5.5e-002 | K276: 17.29 | L276: 3.8399999999999997e-002 | M276: 117.5 | N276: 13.41 | O276: 2.e-002 | P276: 128.93 | Q276: 转股中 | R276: 4.67年 | S276: 2.67年 | T276: 1.53 | U276: 1039. | V276: 5.1200000000000001 | W276: 4.4000000000000004e-002 | X276: 5.7000000000000002e-002 | Y276: 34 | Z276: 4.43 | AA276: -2.4300000000000002e-002 | AB276: -3.0600000000000002e-002 | AC276: -8.1099999999999992e-002 | AD276: -8.3299999999999999e-002 | AE276: 84.44 | AF276: 84.15 | AG276: 1 | AH276: A+ | AI276: 7.5800000000000006e-002 | AJ276: =H276+100*O276 -> 133.48400000000001 | AK276: 134 | AL276: 238 | AM276: 49.6 | AN276: 270 | AO276: 0.26500000000000001 | AP276: 20 | AQ276: 英联转债!
A277: 11 | B277: 123090 | C277: 三诺转债 | D277: 300298 | E277: 三诺生物 | F277: 医药 | G277: 医疗器械 | H277: 135 | I277: -1.1000000000000001e-003 | J277: -1.3000000000000001e-002 | K277: 39.14 | L277: -2.0299999999999999e-002 | M277: 117.1 | N277: 35.35 | O277: 0.21899999999999997 | P277: 110.72 | Q277: 4月6天 | R277: 5.84年 | S277: 3.84年 | T277: 5 | U277: 21 | V277: 3.1e-002 | W277: 2.3e-002 | X277: 2.5000000000000001e-002 | Y277: 221 | Z277: 8.17 | AA277: -2.4500000000000001e-002 | AB277: -2.9399999999999999e-002 | AC277: -6.4500000000000002e-002 | AD277: -6.6000000000000003e-002 | AE277: 86.89 | AF277: 90.82 | AG277: 0.7 | AH277: AA | AI277: 4.53e-002 | AJ277: =H277+100*O277 -> 156.90000000000001 | AK277: 159.3 | AL277: 303 | AM277: 68.5 | AN277: 304 | AO277: -2.e-002 | AP277: 3 | AQ277: 三诺转债
A278: 53 | B278: 113605 | C278: 大参转债 | D278: 603233 | E278: 大参林 | F278: 医药 | G278: 医药商业 | H278: 133 | I278: 4.8999999999999998e-003 | J278: 6.1999999999999998e-003 | K278: 93.21 | L278: 1.5100000000000001e-002 | M278: 115.2 | N278: 83.85 | O278: 0.19600000000000001 | P278: 111.16 | Q278: 2月8天 | R278: 5.67年 | S278: 3.67年 | T278: 14.1 | U278: 8.1 | V278: 4.0000000000000001e-003 | W278: 2.3e-002 | X278: 2.5000000000000001e-002 | Y278: 614 | Z278: 12.25 | AA278: -2.5399999999999999e-002 | AB278: -2.9999999999999999e-002 | AC278: -6.3299999999999995e-002 | AD278: -6.4899999999999999e-002 | AE278: 87.62 | AF278: 90.02 | AG278: 0.73 | AH278: AA | AI278: 4.53e-002 | AJ278: =H278+100*O278 -> 152.59999999999999 | AK278: 154.8 | AL278: 298 | AM278: 64.8 | AN278: 301 | AO278: -3.7999999999999999e-002 | AP278: 6 | AQ278: 大参转债
A279: 209 | B279: 110061 | C279: 川投转债 | D279: 600674 | E279: 川投能源 | F279: 能源电力 | G279: 水电 | H279: 125 | I279: 0. | J279: 9.0000000000000011e-003 | K279: 11.23 | L279: 1.1699999999999999e-002 | M279: 110.8 | N279: 9.58 | O279: 6.6000000000000003e-002 | P279: 117.22 | Q279: 转股中 | R279: 4.73年 | S279: 2.73年 | T279: 40 | U279: 35 | V279: 6.9999999999999993e-003 | W279: 8.1000000000000003e-002 | X279: 9.5000000000000001e-002 | Y279: 494 | Z279: 1.79 | AA279: -2.5600000000000001e-002 | AB279: -2.9700000000000001e-002 | AC279: -6.4299999999999996e-002 | AD279: -6.6299999999999998e-002 | AE279: 92.62 | AF279: 92.87 | AG279: 0.77 | AH279: AAA | AI279: 3.8800000000000001e-002 | AJ279: =H279+100*O279 -> 131.59999999999999 | AK279: 132.8 | AL279: 228 | AM279: 39.9 | AN279: 222 | AO279: 5.0999999999999997e-002 | AP279: 16 | AQ279: 川投转债
A280: 194 | B280: 110065 | C280: 淮矿转债! | D280: 600985 | E280: 淮北矿业 | F280: 煤炭 | G280: 煤炭开采 | H280: 125.55 | I280: 2.7699999999999999e-002 | J280: 3.7400000000000003e-002 | K280: 11.87 | L280: 7.8100000000000003e-002 | M280: 110.8 | N280: 9.33 | O280: -1.3000000000000001e-002 | P280: 127.22 | Q280: 转股中 | R280: 4.84年 | S280: 2.84年 | T280: 27.4 | U280: 227 | V280: 6.7000000000000004e-002 | W280: 0.106 | X280: 0.13500000000000001 | Y280: 258 | Z280: 1.25 | AA280: -2.5899999999999999e-002 | AB280: -2.98e-002 | AC280: -6.3299999999999995e-002 | AD280: -6.5199999999999994e-002 | AE280: 92.21 | AF280: 92.47 | AG280: 0.83 | AH280: AAA | AI280: 3.8800000000000001e-002 | AJ280: =H280+100*O280 -> 124.25 | AK280: 123.9 | AL280: 167 | AM280: 31.4 | AN280: 159 | AO280: 0.122 | AP280: 21 | AQ280: 淮矿转债!
A281: 140 | B281: 128108 | C281: 蓝帆转债! | D281: 2382 | E281: 蓝帆医疗 | F281: 医药 | G281: 医疗器械 | H281: 130.149 | I281: 2.4900000000000002e-002 | J281: -7.8000000000000005e-003 | K281: 23.05 | L281: 2.0400000000000001e-002 | M281: 113.3 | N281: 17.79 | O281: 4.0000000000000001e-003 | P281: 129.57 | Q281: 转股中 | R281: 5.27年 | S281: 4.27年 | T281: 17.4 | U281: 438 | V281: 0.19699999999999998 | W281: 7.2999999999999995e-002 | X281: 9.4e-002 | Y281: 238 | Z281: 2.32 | AA281: -2.6499999999999999e-002 | AB281: -3.0800000000000001e-002 | AC281: -4.6699999999999998e-002 | AD281: -4.8799999999999996e-002 | AE281: 87.08 | AF281: 90.16 | AG281: 0.84 | AH281: AA | AI281: 4.53e-002 | AJ281: =H281+100*O281 -> 130.54900000000001 | AK281: 130.7 | AL281: 218 | AM281: 40.6 | AN281: 227 | AO281: -6.6000000000000003e-002 | AP281: 25 | AQ281: 蓝帆转债!
A282: 289 | B282: 123014 | C282: 凯发转债! | D282: 300407 | E282: 凯发电气 | F282: 能源电力 | G282: 电力设备 | H282: 115.989 | I282: 2.1000000000000001e-002 | J282: -1.2199999999999999e-002 | K282: 6.52 | L282: 3.9900000000000005e-002 | M282: 108.5 | N282: 8.12 | O282: 0.44500000000000001 | P282: 80.3 | Q282: 转股中 | R282: 2.43年 | S282: 0.43年 | T282: 1.16 | U282: 51 | V282: 0.38400000000000001 | W282: 5.7999999999999996e-002 | X282: 4.7e-002 | Y282: 20 | Z282: 1.47 | AA282: -2.7400000000000001e-002 | AB282: -3.3700000000000001e-002 | AC282: -0.223 | AD282: -0.22600000000000001 | AE282: 97.02 | AF282: 91.44 | AG282: 0.22 | AH282: A+ | AI282: 7.3899999999999993e-002 | AJ282: =H282+100*O282 -> 160.489 | AK282: 151.7 | AL282: 294 | AM282: 54.7 | AN282: 279 | AO282: -1.8000000000000002e-002 | AP282: 16 | AQ282: 凯发转债!
A283: 164 | B283: 123046 | C283: 天铁转债! | D283: 300587 | E283: 天铁股份 | F283: 铁路 | G283: 铁路设备 | H283: 136 | I283: 1.5700000000000002e-002 | J283: 1.4499999999999999e-002 | K283: 13.07 | L283: 3.4799999999999998e-002 | M283: 118.2 | N283: 10.12 | O283: 5.2999999999999999e-002 | P283: 129.15 | Q283: 转股中 | R283: 5年28天 | S283: 3年28天 | T283: 0.99 | U283: 70 | V283: 0.52400000000000002 | W283: 2.2000000000000002e-002 | X283: 2.8999999999999998e-002 | Y283: 44 | Z283: 3.21 | AA283: -2.7799999999999998e-002 | AB283: -3.3799999999999997e-002 | AC283: -7.9899999999999999e-002 | AD283: -8.199999999999999e-002 | AE283: 84.78 | AF283: 86.02 | AG283: 0.87 | AH283: AA- | AI283: 6.6299999999999998e-002 | AJ283: =H283+100*O283 -> 141.30000000000001 | AK283: 142.8 | AL283: 273 | AM283: 56.8 | AN283: 288 | AO283: -1.6e-002 | AP283: 11 | AQ283: 天铁转债!
A284: 333 | B284: 113013 | C284: 国君转债! | D284: 601211 | E284: 国泰君安 | F284: 金融 | G284: 证券行业 | H284: 115.77 | I284: 9.300000000000001e-003 | J284: -1.6000000000000001e-003 | K284: 16.82 | L284: 2.1899999999999999e-002 | M284: 108.3 | N284: 19.01 | O284: 0.308 | P284: 88.48 | Q284: 转股中 | R284: 2.38年 | S284: 无权 | T284: 69.9 | U284: 42 | V284: 5.0000000000000001e-003 | W284: 4.7e-002 | X284: 4.0999999999999995e-002 | Y284: 1498. | Z284: 1.21 | AA284: -2.8199999999999999e-002 | AB284: -3.4500000000000003e-002 | AC284: 无权 | AD284: 无权 | AE284: 无权 | AF284: 99.52 | AG284: 0.35 | AH284: AAA | AI284: 3.6900000000000002e-002 | AJ284: =H284+100*O284 -> 146.56999999999999 | AK284: 143.1 | AL284: 274 | AM284: 43.5 | AN284: 245 | AO284: 1.e-003 | AP284: 14 | AQ284: 国君转债!
A285: 158 | B285: 110069 | C285: 瀚蓝转债 | D285: 600323 | E285: 瀚蓝环境 | F285: 城市公用 | G285: 三废处理 | H285: 131.77 | I285: 3.7999999999999999e-002 | J285: -5.5000000000000005e-003 | K285: 23.3 | L285: 4.2999999999999997e-002 | M285: 113.5 | N285: 20.2 | O285: 0.14199999999999999 | P285: 115.35 | Q285: 转股中 | R285: 5年47天 | S285: 3年47天 | T285: 9.83 | U285: 19 | V285: 1.4999999999999999e-002 | W285: 5.5e-002 | X285: 6.3e-002 | Y285: 179 | Z285: 2.49 | AA285: -2.8999999999999998e-002 | AB285: -3.3500000000000002e-002 | AC285: -7.4499999999999997e-002 | AD285: -7.5600000000000001e-002 | AE285: 89 | AF285: 91.58 | AG285: 0.76 | AH285: AA+ | AI285: 4.3299999999999998e-002 | AJ285: =H285+100*O285 -> 145.97 | AK285: 148.2 | AL285: 287 | AM285: 56.6 | AN285: 286 | AO285: 3.7999999999999999e-002 | AP285: 9 | AQ285: 瀚蓝转债
A286: 306 | B286: 127005 | C286: 长证转债! | D286: 783 | E286: 长江证券 | F286: 金融 | G286: 证券行业 | H286: 120.3 | I286: 1.04e-002 | J286: 1.7000000000000001e-003 | K286: 7.38 | L286: 2.07e-002 | M286: 109.3 | N286: 7.28 | O286: 0.187 | P286: 101.37 | Q286: 转股中 | R286: 3年21天 | S286: 无权 | T286: 50 | U286: 65 | V286: 1.1000000000000001e-002 | W286: 0.122 | X286: 0.124 | Y286: 408 | Z286: 1.46 | AA286: -3.15e-002 | AB286: -3.6900000000000002e-002 | AC286: 无权 | AD286: 无权 | AE286: 无权 | AF286: 97.56 | AG286: 0.58 | AH286: AAA | AI286: 3.8800000000000001e-002 | AJ286: =H286+100*O286 -> 139. | AK286: 139.2 | AL286: 261 | AM286: 41.7 | AN286: 232 | AO286: -3.6000000000000004e-002 | AP286: 15 | AQ286: 长证转债!
A287: 180 | B287: 128097 | C287: 奥佳转债! | D287: 2614 | E287: 奥佳华 | F287: 机械装备 | G287: 专用设备 | H287: 135.61 | I287: 1.e-004 | J287: 2.2499999999999999e-002 | K287: 13.95 | L287: 2.7200000000000002e-002 | M287: 115.3 | N287: 10.69 | O287: 3.9e-002 | P287: 130.5 | Q287: 转股中 | R287: 5年6.1天 | S287: 3年6.1天 | T287: 5.85 | U287: 5.3 | V287: 6.9999999999999993e-003 | W287: 6.8000000000000005e-002 | X287: 8.8000000000000009e-002 | Y287: 86 | Z287: 2.04 | AA287: -3.2500000000000001e-002 | AB287: -3.7599999999999995e-002 | AC287: -8.14e-002 | AD287: -8.3400000000000002e-002 | AE287: 90.31 | AF287: 92.77 | AG287: 0.83 | AH287: AA | AI287: 4.53e-002 | AJ287: =H287+100*O287 -> 139.51000000000002 | AK287: 140.7 | AL287: 267 | AM287: 47.9 | AN287: 265 | AO287: -2.8999999999999998e-002 | AP287: 25 | AQ287: 奥佳转债!
A288: 64 | B288: 128134 | C288: 鸿路转债! | D288: 2541 | E288: 鸿路钢构 | F288: 建筑 | G288: 其他 | H288: 138.41 | I288: -4.1999999999999997e-003 | J288: 2.2799999999999997e-002 | K288: 56.99 | L288: 2.1899999999999999e-002 | M288: 115.1 | N288: 43.74 | O288: 6.2e-002 | P288: 130.29 | Q288: 55天 | R288: 5.64年 | S288: 3.64年 | T288: 18.8 | U288: 76 | V288: 2.8999999999999998e-002 | W288: 6.3e-002 | X288: 8.199999999999999e-002 | Y288: 298 | Z288: 5.57 | AA288: -3.27e-002 | AB288: -3.7200000000000004e-002 | AC288: -7.3899999999999993e-002 | AD288: -7.5499999999999998e-002 | AE288: 87.66 | AF288: 90.07 | AG288: 0.85 | AH288: AA | AI288: 4.53e-002 | AJ288: =H288+100*O288 -> 144.60999999999999 | AK288: 146.5 | AL288: 282 | AM288: 56.5 | AN288: 283 | AO288: 0.158 | AP288: 4 | AQ288: 鸿路转债!
A289: 343 | B289: 110034 | C289: 九州转债! | D289: 600998 | E289: 九州通 | F289: 医药 | G289: 医药商业 | H289: 111.38 | I289: 7.4999999999999997e-003 | J289: -4.3e-003 | K289: 17.57 | L289: 1.21e-002 | M289: 108 | N289: 18.32 | O289: 0.161 | P289: 95.91 | Q289: 转股中 | R289: 0.90年 | S289: 回售内 | T289: 15 | U289: 12 | V289: 6.9999999999999993e-003 | W289: 4.5999999999999999e-002 | X289: 4.4000000000000004e-002 | Y289: 329 | Z289: 1.75 | AA289: -3.3500000000000002e-002 | AB289: -4.9299999999999997e-002 | AC289: 回售内 | AD289: 回售内 | AE289: 103 | AF289: 104.46 | AG289: 0.26 | AH289: AA+ | AI289: 3.7499999999999999e-002 | AJ289: =H289+100*O289 -> 127.47999999999999 | AK289: 126.9 | AL289: 194 | AM289: 22.4 | AN289: 61 | AO289: -2.9999999999999999e-002 | AP289: 27 | AQ289: 九州转债!
A290: 271 | B290: 113526 | C290: 联泰转债! | D290: 603797 | E290: 联泰环保 | F290: 城市公用 | G290: 三废处理 | H290: 125.82 | I290: 1.46e-002 | J290: -5.9999999999999995e-004 | K290: 7.47 | L290: 1.77e-002 | M290: 110.3 | N290: 6.11 | O290: 2.8999999999999998e-002 | P290: 122.26 | Q290: 转股中 | R290: 3.93年 | S290: 1.93年 | T290: 1.93 | U290: 3.1 | V290: 1.3000000000000001e-002 | W290: 5.7000000000000002e-002 | X290: 7.0000000000000007e-002 | Y290: 34 | Z290: 2.17 | AA290: -3.3500000000000002e-002 | AB290: -3.8100000000000002e-002 | AC290: -9.2600000000000002e-002 | AD290: -9.4899999999999998e-002 | AE290: 94.41 | AF290: 94.19 | AG290: 0.79 | AH290: AA+ | AI290: 4.1799999999999997e-002 | AJ290: =H290+100*O290 -> 128.72 | AK290: 129.4 | AL290: 212 | AM290: 35 | AN290: 193 | AO290: 3.4000000000000002e-002 | AP290: 9 | AQ290: 联泰转债!
A291: 259 | B291: 123022 | C291: 长信转债!! | D291: 300088 | E291: 长信科技 | F291: 通信互联 | G291: 通信设备 | H291: 132.733 | I291: 1.1000000000000001e-002 | J291: 3.8e-003 | K291: 8.16 | L291: 1.7500000000000002e-002 | M291: 114.9 | N291: 6.15 | O291: 0. | P291: 132.68 | Q291: 转股中 | R291: 4年27天 | S291: 2年27天 | T291: 2.57 | U291: 17 | V291: 5.0999999999999997e-002 | W291: 1.3000000000000001e-002 | X291: 1.7000000000000001e-002 | Y291: 200 | Z291: 2.89 | AA291: -3.5499999999999997e-002 | AB291: -4.1700000000000001e-002 | AC291: -0.106 | AD291: -0.109 | AE291: 94.04 | AF291: 96.87 | AG291: 0.85 | AH291: AA | AI291: 4.3799999999999999e-002 | AJ291: =H291+100*O291 -> 132.733 | AK291: 132.8 | AL291: 229 | AM291: 35.9 | AN291: 201 | AO291: -4.0000000000000001e-003 | AP291: 12 | AQ291: 长信转债!!
A292: 139 | B292: 113583 | C292: 益丰转债!* | D292: 603939 | E292: 益丰药房 | F292: 医药 | G292: 医药商业 | H292: 140.46 | I292: -1.5700000000000002e-002 | J292: 4.7999999999999996e-003 | K292: 101.69 | L292: -1.09e-002 | M292: 115.3 | N292: 71.82 | O292: -8.0000000000000002e-003 | P292: 141.59 | Q292: 转股中 | R292: 5.28年 | S292: 3.28年 | T292: 12.2 | U292: 139 | V292: 8.1000000000000003e-002 | W292: 2.3e-002 | X292: 3.2000000000000001e-002 | Y292: 541 | Z292: 10.73 | AA292: -3.7400000000000003e-002 | AB292: -4.2199999999999994e-002 | AC292: -8.48e-002 | AD292: -8.6599999999999996e-002 | AE292: 89.25 | AF292: 91.7 | AG292: 1 | AH292: AA | AI292: 4.53e-002 | AJ292: =H292+100*O292 -> 139.66 | AK292: 139.3 | AL292: 262 | AM292: 47.6 | AN292: 261 | AO292: 1.2e-002 | AP292: 10 | AQ292: 益丰转债!*
A293: 108 | B293: 123058 | C293: 欣旺转债 | D293: 300207 | E293: 欣旺达 | F293: 电子 | G293: 电子产品 | H293: 142.59 | I293: -2.0299999999999999e-002 | J293: 2.12e-002 | K293: 27.72 | L293: 1.1000000000000001e-003 | M293: 116.3 | N293: 21.24 | O293: 9.3000000000000013e-002 | P293: 130.51 | Q293: 转股中 | R293: 5.40年 | S293: 3.40年 | T293: 11.2 | U293: 73 | V293: 4.5999999999999999e-002 | W293: 2.6000000000000002e-002 | X293: 3.3000000000000002e-002 | Y293: 437 | Z293: 6.9 | AA293: -3.7699999999999997e-002 | AB293: -4.2699999999999995e-002 | AC293: -8.5999999999999993e-002 | AD293: -8.77e-002 | AE293: 88.79 | AF293: 92.01 | AG293: 0.83 | AH293: AA | AI293: 4.53e-002 | AJ293: =H293+100*O293 -> 151.89000000000001 | AK293: 154.7 | AL293: 296 | AM293: 62.7 | AN293: 298 | AO293: 2.2000000000000002e-002 | AP293: 6 | AQ293: 欣旺转债
A294: 309 | B294: 128035 | C294: 大族转债! | D294: 2008 | E294: 大族激光 | F294: 机械装备 | G294: 专用设备 | H294: 121.305 | I294: 1.09e-002 | J294: -1.9e-002 | K294: 49.95 | L294: -1.67e-002 | M294: 107.4 | N294: 52.1 | O294: 0.26500000000000001 | P294: 95.87 | Q294: 转股中 | R294: 2.96年 | S294: 0.96年 | T294: 23 | U294: 41 | V294: 1.4999999999999999e-002 | W294: 4.2999999999999997e-002 | X294: 4.0999999999999995e-002 | Y294: 533 | Z294: 5.81 | AA294: -4.0599999999999997e-002 | AB294: -4.5100000000000001e-002 | AC294: -0.125 | AD294: -0.13100000000000001 | AE294: 99.31 | AF294: 95.75 | AG294: 0.49 | AH294: AA+ | AI294: 3.9900000000000005e-002 | AJ294: =H294+100*O294 -> 147.80500000000001 | AK294: 146.7 | AL294: 284 | AM294: 47.4 | AN294: 259 | AO294: 6.3e-002 | AP294: 21 | AQ294: 大族转债!
A295: 9 | B295: 123091 | C295: 长海转债 | D295: 300196 | E295: 长海股份 | F295: 其他 | G295: 非金属矿 | H295: 150.72 | I295: -3.2000000000000002e-003 | J295: 1.3000000000000001e-002 | K295: 20.2 | L295: 1.2e-002 | M295: 116.2 | N295: 16.24 | O295: 0.21199999999999999 | P295: 124.38 | Q295: 4月10天 | R295: 5.84年 | S295: 3.84年 | T295: 5.5 | U295: 44 | V295: 5.2000000000000005e-002 | W295: 6.7000000000000004e-002 | X295: 8.3000000000000004e-002 | Y295: 83 | Z295: 2.96 | AA295: -4.4199999999999996e-002 | AB295: -4.8799999999999996e-002 | AC295: -8.9700000000000002e-002 | AD295: -9.1199999999999989e-002 | AE295: 86.96 | AF295: 90.12 | AG295: 0.81 | AH295: AA | AI295: 4.53e-002 | AJ295: =H295+100*O295 -> 171.91999999999999 | AK295: 177.1 | AL295: 313 | AM295: 86.9 | AN295: 312 | AO295: 6.5000000000000002e-002 | AP295: 3 | AQ295: 长海转债
A296: 337 | B296: 113012 | C296: 骆驼转债! | D296: 601311 | E296: 骆驼股份 | F296: 汽车 | G296: 零部件制 | H296: 118.74 | I296: 1.4999999999999999e-002 | J296: 8.0000000000000004e-004 | K296: 10.56 | L296: 2.52e-002 | M296: 107.8 | N296: 10.06 | O296: 0.13100000000000001 | P296: 104.97 | Q296: 转股中 | R296: 2年33天 | S296: 33天 | T296: 5.1 | U296: 8.8 | V296: 1.4999999999999999e-002 | W296: 4.2999999999999997e-002 | X296: 4.4999999999999998e-002 | Y296: 118 | Z296: 1.77 | AA296: -4.5999999999999999e-002 | AB296: -5.2499999999999998e-002 | AC296: -0.61199999999999999 | AD296: -0.622 | AE296: 100.49 | AF296: 99.1 | AG296: 0.62 | AH296: AA | AI296: 4.1900000000000007e-002 | AJ296: =H296+100*O296 -> 131.84 | AK296: 132.5 | AL296: 224 | AM296: 32 | AN296: 163 | AO296: 7.400000000000001e-002 | AP296: 18 | AQ296: 骆驼转债!
A297: 128 | B297: 128112 | C297: 歌尔转2!* | D297: 2241 | E297: 歌尔股份 | F297: 电子 | G297: 电子产品 | H297: 146.493 | I297: 2.4399999999999998e-002 | J297: -1.1000000000000001e-003 | K297: 34.18 | L297: 2.3399999999999997e-002 | M297: 114.5 | N297: 23.27 | O297: -3.0000000000000001e-003 | P297: 146.88 | Q297: 转股中 | R297: 5.31年 | S297: 3.31年 | T297: 14.7 | U297: 571 | V297: 0.27000000000000002 | W297: 1.3000000000000001e-002 | X297: 1.9e-002 | Y297: 1145. | Z297: 6.34 | AA297: -4.5999999999999999e-002 | AB297: -5.0499999999999996e-002 | AC297: -9.69e-002 | AD297: -9.8299999999999998e-002 | AE297: 88.97 | AF297: 91.74 | AG297: 1 | AH297: AA+ | AI297: 4.3299999999999998e-002 | AJ297: =H297+100*O297 -> 146.19299999999998 | AK297: 146.1 | AL297: 281 | AM297: 54.4 | AN297: 278 | AO297: -7.0000000000000007e-002 | AP297: 17 | AQ297: 歌尔转2!*
A298: 186 | B298: 127015 | C298: 希望转债! | D298: 876 | E298: 新 希 望 | F298: 农业 | G298: 畜牧业 | H298: 138.3 | I298: 6.4000000000000001e-002 | J298: 3.5799999999999998e-002 | K298: 25.67 | L298: 9.98e-002 | M298: 110 | N298: 19.75 | O298: 6.4000000000000001e-002 | P298: 129.97 | Q298: 转股中 | R298: 4.87年 | S298: 2.87年 | T298: 9.5 | U298: 507 | V298: 0.39000000000000001 | W298: 8.0000000000000002e-003 | X298: 1.1000000000000001e-002 | Y298: 1157. | Z298: 3.19 | AA298: -4.6500000000000007e-002 | AB298: -5.0000000000000003e-002 | AC298: -9.4e-002 | AD298: -9.5399999999999985e-002 | AE298: 91.52 | AF298: 91.64 | AG298: 1 | AH298: AAA | AI298: 3.8800000000000001e-002 | AJ298: =H298+100*O298 -> 144.70000000000002 | AK298: 146.6 | AL298: 283 | AM298: 55 | AN298: 280 | AO298: 0.127 | AP298: 29 | AQ298: 希望转债!
A299: 54 | B299: 113040 | C299: 星宇转债 | D299: 601799 | E299: 星宇股份 | F299: 汽车 | G299: 零部件制 | H299: 148.08 | I299: -8.5000000000000006e-003 | J299: -8.1000000000000013e-003 | K299: 203.23 | L299: -1.9699999999999999e-002 | M299: 111.5 | N299: 158 | O299: 0.151 | P299: 128.63 | Q299: 2月8天 | R299: 5.67年 | S299: 3.67年 | T299: 15 | U299: 66 | V299: 2.9999999999999999e-002 | W299: 2.7000000000000003e-002 | X299: 3.4000000000000002e-002 | Y299: 561 | Z299: 10.56 | AA299: -4.9299999999999997e-002 | AB299: -5.2699999999999997e-002 | AC299: -9.2399999999999996e-002 | AD299: -9.3299999999999994e-002 | AE299: 86.98 | AF299: 87.93 | AG299: 0.84 | AH299: AA+ | AI299: 4.3299999999999998e-002 | AJ299: =H299+100*O299 -> 163.18000000000001 | AK299: 167.5 | AL299: 308 | AM299: 79.6 | AN299: 308 | AO299: -2.7000000000000003e-002 | AP299: 4 | AQ299: 星宇转债
A300: 260 | B300: 110055 | C300: 伊力转债!! | D300: 600197 | E300: 伊力特 | F300: 食品饮料 | G300: 白酒 | H300: 142.24 | I300: 3.0899999999999997e-002 | J300: 4.5999999999999999e-003 | K300: 21.81 | L300: 4.2500000000000003e-002 | M300: 115 | N300: 16.81 | O300: 9.6000000000000002e-002 | P300: 129.74 | Q300: 转股中 | R300: 4年24天 | S300: 2年24天 | T300: 2.85 | U300: 232 | V300: 0.58200000000000007 | W300: 2.7999999999999997e-002 | X300: 3.6000000000000004e-002 | Y300: 102 | Z300: 3.55 | AA300: -5.2000000000000005e-002 | AB300: -5.7999999999999996e-002 | AC300: -0.10400000000000001 | AD300: -0.106 | AE300: 94.17 | AF300: 97 | AG300: 0.83 | AH300: AA | AI300: 4.3799999999999999e-002 | AJ300: =H300+100*O300 -> 151.84 | AK300: 154.7 | AL300: 297 | AM300: 57.7 | AN300: 290 | AO300: -5.0000000000000003e-002 | AP300: 25 | AQ300: 伊力转债!!
A301: 30 | B301: 113611 | C301: 福20转债 | D301: 603806 | E301: 福斯特 | F301: 能源电力 | G301: 太阳能 | H301: 152.79 | I301: -1.26e-002 | J301: -6.0000000000000001e-003 | K301: 98.5 | L301: -2.18e-002 | M301: 111.85 | N301: 73.69 | O301: 0.14300000000000002 | P301: 133.67 | Q301: 3月18天 | R301: 5.78年 | S301: 3.78年 | T301: 17 | U301: 113 | V301: 4.4000000000000004e-002 | W301: 2.2000000000000002e-002 | X301: 2.9999999999999999e-002 | Y301: 758 | Z301: 9.5 | AA301: -5.3099999999999994e-002 | AB301: -5.6600000000000004e-002 | AC301: -9.64e-002 | AD301: -9.74e-002 | AE301: 86.27 | AF301: 86.88 | AG301: 0.85 | AH301: AA | AI301: 4.53e-002 | AJ301: =H301+100*O301 -> 167.09 | AK301: 171.9 | AL301: 311 | AM301: 85 | AN301: 309 | AO301: -1.9e-002 | AP301: 4 | AQ301: 福20转债
A302: 236 | B302: 123027 | C302: 蓝晓转债! | D302: 300487 | E302: 蓝晓科技 | F302: 化工 | G302: 化工 | H302: 150.8 | I302: -1.2999999999999999e-003 | J302: -1.1200000000000002e-002 | K302: 42.66 | L302: -1.3600000000000001e-002 | M302: 119.5 | N302: 29.33 | O302: 3.7000000000000005e-002 | P302: 145.45 | Q302: 转股中 | R302: 4.31年 | S302: 2.31年 | T302: 1.08 | U302: 64 | V302: 0.39500000000000002 | W302: 1.2e-002 | X302: 1.7000000000000001e-002 | Y302: 92 | Z302: 5.76 | AA302: -5.3800000000000001e-002 | AB302: -6.0999999999999999e-002 | AC302: -0.10199999999999999 | AD302: -0.10400000000000001 | AE302: 87.37 | AF302: 87.99 | AG302: 0.92 | AH302: A+ | AI302: 7.5800000000000006e-002 | AJ302: =H302+100*O302 -> 154.5 | AK302: 156.2 | AL302: 299 | AM302: 68.2 | AN302: 303 | AO302: -4.9000000000000002e-002 | AP302: 21 | AQ302: 蓝晓转债!
A303: 308 | B303: 113504 | C303: 艾华转债!! | D303: 603989 | E303: 艾华集团 | F303: 电子 | G303: 元器件制 | H303: 130.03 | I303: 6.8000000000000005e-003 | J303: 1.06e-002 | K303: 25.99 | L303: 2.12e-002 | M303: 110.3 | N303: 21.13 | O303: 5.7000000000000002e-002 | P303: 123 | Q303: 转股中 | R303: 3年11天 | S303: 1年11天 | T303: 5.59 | U303: 12 | V303: 1.6e-002 | W303: 5.4000000000000006e-002 | X303: 6.7000000000000004e-002 | Y303: 103 | Z303: 4.27 | AA303: -5.4000000000000006e-002 | AB303: -5.9699999999999996e-002 | AC303: -0.17199999999999999 | AD303: -0.17600000000000002 | AE303: 97.72 | AF303: 97.16 | AG303: 0.82 | AH303: AA | AI303: 4.3799999999999999e-002 | AJ303: =H303+100*O303 -> 135.72999999999999 | AK303: 137.1 | AL303: 257 | AM303: 39.3 | AN303: 217 | AO303: 5.0000000000000003e-002 | AP303: 9 | AQ303: 艾华转债!!
A304: 303 | B304: 128036 | C304: 金农转债!! | D304: 2548 | E304: 金新农 | F304: 农业 | G304: 畜牧业 | H304: 132.666 | I304: 4.9100000000000005e-002 | J304: 2.1600000000000001e-002 | K304: 7.92 | L304: 7.17e-002 | M304: 110.3 | N304: 6.96 | O304: 0.16600000000000001 | P304: 113.79 | Q304: 转股中 | R304: 3年18天 | S304: 1年18天 | T304: 1.46 | U304: 428 | V304: 2.2200000000000002 | W304: 2.7000000000000003e-002 | X304: 2.9999999999999999e-002 | Y304: 55 | Z304: 2.09 | AA304: -5.9999999999999998e-002 | AB304: -6.5599999999999992e-002 | AC304: -0.182 | AD304: -0.185 | AE304: 95.33 | AF304: 91.5 | AG304: 0.99 | AH304: AA- | AI304: 6.480000000000001e-002 | AJ304: =H304+100*O304 -> 149.26599999999999 | AK304: 151.5 | AL304: 293 | AM304: 56.2 | AN304: 282 | AO304: -1.3000000000000001e-002 | AP304: 17 | AQ304: 金农转债!!
A305: 6 | B305: 113616 | C305: 韦尔转债 | D305: 603501 | E305: 韦尔股份 | F305: 电子 | G305: 元器件制 | H305: 164.02 | I305: -1.3000000000000001e-002 | J305: 4.5000000000000005e-003 | K305: 304.28 | L305: -1.e-002 | M305: 114.5 | N305: 222.83 | O305: 0.20100000000000001 | P305: 136.55 | Q305: 4月16天 | R305: 5.85年 | S305: 3.85年 | T305: 24.4 | U305: 327 | V305: 8.199999999999999e-002 | W305: 9.0000000000000011e-003 | X305: 1.3000000000000001e-002 | Y305: 2640. | Z305: 26.06 | AA305: -6.0299999999999999e-002 | AB305: -6.4299999999999996e-002 | AC305: -0.105 | AD305: -0.106 | AE305: 86.94 | AF305: 89.65 | AG305: 0.86 | AH305: AA+ | AI305: 4.3299999999999998e-002 | AJ305: =H305+100*O305 -> 184.12 | AK305: 191.5 | AL305: 317 | AM305: 101.8 | AN305: 317 | AO305: 6.0000000000000001e-003 | AP305: 5 | AQ305: 韦尔转债
A306: 210 | B306: 123034 | C306: 通光转债! | D306: 300265 | E306: 通光线缆 | F306: 通信互联 | G306: 通信设备 | H306: 164 | I306: 6.8999999999999999e-003 | J306: 1.52e-002 | K306: 8.86 | L306: 2.7799999999999998e-002 | M306: 118 | N306: 7.97 | O306: 0.47499999999999998 | P306: 111.17 | Q306: 转股中 | R306: 4.71年 | S306: 2.71年 | T306: 0.78 | U306: 70 | V306: 0.55000000000000004 | W306: 2.4e-002 | X306: 2.7000000000000003e-002 | Y306: 32 | Z306: 2.57 | AA306: -6.8699999999999997e-002 | AB306: -7.46e-002 | AC306: -0.14699999999999999 | AD306: -0.10099999999999999 | AE306: 84.08 | AF306: 84.25 | AG306: 0.79 | AH306: A+ | AI306: 7.5800000000000006e-002 | AJ306: =H306+100*O306 -> 211.5 | AK306: 216.8 | AL306: 320 | AM306: 132.6 | AN306: 324 | AO306: -6.0000000000000001e-003 | AP306: 24 | AQ306: 通光转债!
A307: 338 | B307: 113011 | C307: 光大转债 | D307: 601818 | E307: 光大银行 | F307: 金融 | G307: 银行行业 | H307: 125.26 | I307: 3.4999999999999996e-003 | J307: 1.6000000000000001e-003 | K307: 4.26 | L307: 7.0999999999999995e-003 | M307: 108.3 | N307: 3.76 | O307: 0.106 | P307: 113.3 | Q307: 转股中 | R307: 2年26天 | S307: 无权 | T307: 242 | U307: 125 | V307: 4.0000000000000001e-003 | W307: 0.105 | X307: 0.11900000000000001 | Y307: 2302. | Z307: 0.68 | AA307: -6.9199999999999998e-002 | AB307: -7.5999999999999998e-002 | AC307: 无权 | AD307: 无权 | AE307: 无权 | AF307: 100.64 | AG307: 0.72 | AH307: AAA | AI307: 3.6900000000000002e-002 | AJ307: =H307+100*O307 -> 135.86000000000001 | AK307: 137.2 | AL307: 258 | AM307: 36.6 | AN307: 204 | AO307: 3.3000000000000002e-002 | AP307: 15 | AQ307: 光大转债
A308: 119 | B308: 113590 | C308: 海容转债!* | D308: 603187 | E308: 海容冷链 | F308: 机械装备 | G308: 通用设备 | H308: 168.89 | I308: -3.5499999999999997e-002 | J308: 5.3e-003 | K308: 61.7 | L308: -3.0200000000000001e-002 | M308: 115.6 | N308: 36.39 | O308: -4.0000000000000001e-003 | P308: 169.55 | Q308: 转股中 | R308: 5.36年 | S308: 3.36年 | T308: 2.35 | U308: 83 | V308: 0.20999999999999999 | W308: 2.4e-002 | X308: 4.0999999999999995e-002 | Y308: 98 | Z308: 6.01 | AA308: -6.9599999999999995e-002 | AB308: -7.4099999999999999e-002 | AC308: -0.126 | AD308: -0.127 | AE308: 83.11 | AF308: 82.59 | AG308: 1 | AH308: AA- | AI308: 6.6299999999999998e-002 | AJ308: =H308+100*O308 -> 168.48999999999998 | AK308: 168.2 | AL308: 309 | AM308: 85.1 | AN308: 310 | AO308: -5.0999999999999997e-002 | AP308: 7 | AQ308: 海容转债!*
A309: 59 | B309: 127022 | C309: 恒逸转债 | D309: 703 | E309: 恒逸石化 | F309: 化工 | G309: 化工 | H309: 165.2 | I309: 2.23e-002 | J309: -2.2799999999999997e-002 | K309: 17.75 | L309: -5.9999999999999995e-004 | M309: 108.9 | N309: 11.5 | O309: 7.0000000000000007e-002 | P309: 154.35 | Q309: 2月2天 | R309: 5.65年 | S309: 3.65年 | T309: 20 | U309: 274 | V309: 8.5000000000000006e-002 | W309: 3.1e-002 | X309: 4.7e-002 | Y309: 653 | Z309: 2.6 | AA309: -7.1900000000000006e-002 | AB309: -7.4400000000000008e-002 | AC309: -0.113 | AD309: -0.114 | AE309: 87.38 | AF309: 85.97 | AG309: 0.94 | AH309: AA+ | AI309: 4.3299999999999998e-002 | AJ309: =H309+100*O309 -> 172.19999999999999 | AK309: 176.1 | AL309: 312 | AM309: 88.7 | AN309: 314 | AO309: 0.221 | AP309: 5 | AQ309: 恒逸转债
A310: 310 | B310: 110043 | C310: 无锡转债! | D310: 600908 | E310: 无锡银行 | F310: 金融 | G310: 银行行业 | H310: 134.79 | I310: 2.12e-002 | J310: -9.8999999999999991e-003 | K310: 7.69 | L310: 1.32e-002 | M310: 108.3 | N310: 5.79 | O310: 1.4999999999999999e-002 | P310: 132.82 | Q310: 转股中 | R310: 2.95年 | S310: 无权 | T310: 29.2 | U310: 349 | V310: 8.900000000000001e-002 | W310: 0.20600000000000002 | X310: 0.27300000000000002 | Y310: 142 | Z310: 1.24 | AA310: -7.2300000000000003e-002 | AB310: -7.6999999999999999e-002 | AC310: 无权 | AD310: 无权 | AE310: 无权 | AF310: 96.63 | AG310: 0.86 | AH310: AA+ | AI310: 3.9900000000000005e-002 | AJ310: =H310+100*O310 -> 136.28999999999999 | AK310: 136.8 | AL310: 254 | AM310: 40.1 | AN310: 223 | AO310: 0.17399999999999999 | AP310: 29 | AQ310: 无锡转债!
A311: 302 | B311: 113508 | C311: 新凤转债! | D311: 603225 | E311: 新凤鸣 | F311: 服装纺织 | G311: 纺织行业 | H311: 141.98 | I311: -2.2700000000000001e-002 | J311: -1.7299999999999999e-002 | K311: 21.96 | L311: -4.4800000000000006e-002 | M311: 112.3 | N311: 15.78 | O311: 2.e-002 | P311: 139.16 | Q311: 转股中 | R311: 3.18年 | S311: 1.18年 | T311: 21.2 | U311: 247 | V311: 8.4000000000000005e-002 | W311: 6.9000000000000006e-002 | X311: 9.6000000000000002e-002 | Y311: 307 | Z311: 2.72 | AA311: -7.2400000000000006e-002 | AB311: -7.8700000000000006e-002 | AC311: -0.19800000000000001 | AD311: -0.20000000000000001 | AE311: 97.09 | AF311: 98.28 | AG311: 0.89 | AH311: AA | AI311: 4.3799999999999999e-002 | AJ311: =H311+100*O311 -> 143.97999999999999 | AK311: 144.8 | AL311: 278 | AM311: 46.5 | AN311: 254 | AO311: 0.125 | AP311: 25 | AQ311: 新凤转债!
A312: 245 | B312: 113025 | C312: 明泰转债!! | D312: 601677 | E312: 明泰铝业 | F312: 有色金属 | G312: 铝金属 | H312: 158.56 | I312: 2.81e-002 | J312: -6.5000000000000006e-003 | K312: 17.5 | L312: 2.3399999999999997e-002 | M312: 115.1 | N312: 11.2 | O312: 1.4999999999999999e-002 | P312: 156.25 | Q312: 转股中 | R312: 4年50天 | S312: 2年50天 | T312: 12.7 | U312: 221 | V312: 0.111 | W312: 0.11 | X312: 0.17199999999999999 | Y312: 116 | Z312: 1.43 | AA312: -7.5899999999999995e-002 | AB312: -8.1699999999999995e-002 | AC312: -0.128 | AD312: -0.13 | AE312: 93.82 | AF312: 96.78 | AG312: 0.93 | AH312: AA | AI312: 4.3799999999999999e-002 | AJ312: =H312+100*O312 -> 160.06 | AK312: 160.9 | AL312: 305 | AM312: 64.1 | AN312: 300 | AO312: 0.17999999999999999 | AP312: 29 | AQ312: 明泰转债!!
A313: 129 | B313: 128111 | C313: 中矿转债! | D313: 2738 | E313: 中矿资源 | F313: 有色金属 | G313: 有色行业 | H313: 189.555 | I313: -3.5299999999999998e-002 | J313: 1.6200000000000003e-002 | K313: 29 | L313: -1.9900000000000001e-002 | M313: 124.7 | N313: 15.47 | O313: 1.1000000000000001e-002 | P313: 187.46 | Q313: 转股中 | R313: 5.31年 | S313: 3.31年 | T313: 2.44 | U313: 391 | V313: 0.84999999999999998 | W313: 2.7000000000000003e-002 | X313: 5.0000000000000003e-002 | Y313: 92 | Z313: 3 | AA313: -7.7300000000000008e-002 | AB313: -8.4199999999999997e-002 | AC313: -0.153 | AD313: -0.155 | AE313: 83.96 | AF313: 89.44 | AG313: 0.96 | AH313: AA- | AI313: 6.6299999999999998e-002 | AJ313: =H313+100*O313 -> 190.655 | AK313: 191.7 | AL313: 318 | AM313: 102.2 | AN313: 318 | AO313: -5.2999999999999999e-002 | AP313: 9 | AQ313: 中矿转债!
A314: 161 | B314: 128103 | C314: 同德转债! | D314: 2360 | E314: 同德化工 | F314: 化工 | G314: 化工 | H314: 182 | I314: 3.4099999999999998e-002 | J314: 2.2700000000000001e-002 | K314: 9.49 | L314: 5.6799999999999996e-002 | M314: 121.8 | N314: 5.18 | O314: -6.9999999999999993e-003 | P314: 183.2 | Q314: 转股中 | R314: 5年35天 | S314: 3年35天 | T314: 1.18 | U314: 873 | V314: 4.1399999999999997 | W314: 3.2000000000000001e-002 | X314: 5.7999999999999996e-002 | Y314: 37 | Z314: 3.1 | AA314: -7.7399999999999997e-002 | AB314: -8.3800000000000013e-002 | AC314: -0.153 | AD314: -0.155 | AE314: 82.41 | AF314: 84.18 | AG314: 1 | AH314: A+ | AI314: 7.7300000000000008e-002 | AJ314: =H314+100*O314 -> 181.30000000000001 | AK314: 180.8 | AL314: 315 | AM314: 96.6 | AN314: 316 | AO314: 0.109 | AP314: 13 | AQ314: 同德转债!
A315: 281 | B315: 123017 | C315: 寒锐转债!!* | D315: 300618 | E315: 寒锐钴业 | F315: 有色金属 | G315: 小金属 | H315: 151.165 | I315: -4.4199999999999996e-002 | J315: 5.0000000000000001e-004 | K315: 87.84 | L315: -4.3700000000000003e-002 | M315: 110.3 | N315: 57.4 | O315: -1.2e-002 | P315: 153.03 | Q315: 转股中 | R315: 3.75年 | S315: 1.75年 | T315: 1.32 | U315: 434 | V315: 2.1699999999999999 | W315: 5.0000000000000001e-003 | X315: 8.0000000000000002e-003 | Y315: 269 | Z315: 7.25 | AA315: -8.1900000000000001e-002 | AB315: -8.6300000000000002e-002 | AC315: -0.14899999999999999 | AD315: -0.151 | AE315: 91.22 | AF315: 87.56 | AG315: 1 | AH315: AA- | AI315: 6.480000000000001e-002 | AJ315: =H315+100*O315 -> 149.965 | AK315: 149.3 | AL315: 288 | AM315: 58.1 | AN315: 291 | AO315: -0.121 | AP315: 13 | AQ315: 寒锐转债!!*
A316: 341 | B316: 128010 | C316: 蔚蓝转债!!* | D316: 2245 | E316: 蔚蓝锂芯 | F316: 交通运输 | G316: 物流业 | H316: 117.026 | I316: -5.9999999999999995e-004 | J316: 5.9999999999999995e-004 | K316: 10.88 | L316: 0. | M316: 108 | N316: 9.25 | O316: -5.0000000000000001e-003 | P316: 117.62 | Q316: 转股中 | R316: 0.92年 | S316: 回售内 | T316: 1.19 | U316: 190 | V316: 1.3899999999999999 | W316: 1.1000000000000001e-002 | X316: 1.3000000000000001e-002 | Y316: 109 | Z316: 4.25 | AA316: -8.3299999999999999e-002 | AB316: -9.8000000000000004e-002 | AC316: 回售内 | AD316: 回售内 | AE316: 100.27 | AF316: 104.2 | AG316: 1 | AH316: AA | AI316: 3.95e-002 | AJ316: =H316+100*O316 -> 116.526 | AK316: 116.4 | AL316: 99 | AM316: 12.2 | AN316: 11 | AO316: -5.2000000000000005e-002 | AP316: 40 | AQ316: 蔚蓝转债!!*
A317: 282 | B317: 127008 | C317: 特发转债!* | D317: 70 | E317: 特发信息 | F317: 通信互联 | G317: 通信设备 | H317: 141.799 | I317: 1.29e-002 | J317: 2.5600000000000001e-002 | K317: 7.57 | L317: 3.8399999999999997e-002 | M317: 110.5 | N317: 5.54 | O317: 3.7999999999999999e-002 | P317: 136.64 | Q317: 转股中 | R317: 2.74年 | S317: 0.74年 | T317: 0.58 | U317: 156 | V317: 1.9099999999999999 | W317: 9.0000000000000011e-003 | X317: 1.3000000000000001e-002 | Y317: 62 | Z317: 2.18 | AA317: -8.7899999999999992e-002 | AB317: -9.4200000000000006e-002 | AC317: -0.31900000000000001 | AD317: -0.32100000000000001 | AE317: 97.56 | AF317: 98.88 | AG317: 1 | AH317: AA | AI317: 4.1900000000000007e-002 | AJ317: =H317+100*O317 -> 145.59900000000002 | AK317: 147 | AL317: 285 | AM317: 48.1 | AN317: 266 | AO317: -1.9e-002 | AP317: 16 | AQ317: 特发转债!*
A318: 176 | B318: 110066 | C318: 盛屯转债!! | D318: 600711 | E318: 盛屯矿业 | F318: 有色金属 | G318: 有色行业 | H318: 184.12 | I318: 7.4299999999999991e-002 | J318: 2.e-003 | K318: 9.05 | L318: 8.0000000000000002e-002 | M318: 115.3 | N318: 4.88 | O318: -6.9999999999999993e-003 | P318: 185.45 | Q318: 转股中 | R318: 5年11天 | S318: 3年11天 | T318: 6.71 | U318: 1498. | V318: 1.23 | W318: 2.7999999999999997e-002 | X318: 5.2000000000000005e-002 | Y318: 239 | Z318: 2.28 | AA318: -9.0399999999999994e-002 | AB318: -9.5000000000000001e-002 | AC318: -0.10199999999999999 | AD318: -0.10199999999999999 | AE318: 90.24 | AF318: 92.72 | AG318: 0.95 | AH318: AA | AI318: 4.53e-002 | AJ318: =H318+100*O318 -> 183.42000000000002 | AK318: 182.8 | AL318: 316 | AM318: 90.1 | AN318: 315 | AO318: 0.158 | AP318: 39 | AQ318: 盛屯转债!!
A319: 200 | B319: 113029 | C319: 明阳转债!! | D319: 601615 | E319: 明阳智能 | F319: 能源电力 | G319: 风能 | H319: 180.63 | I319: 5.1299999999999998e-002 | J319: 2.0999999999999999e-003 | K319: 23.24 | L319: 5.5899999999999998e-002 | M319: 112.9 | N319: 12.8 | O319: -5.0000000000000001e-003 | P319: 181.56 | Q319: 转股中 | R319: 4.82年 | S319: 2.82年 | T319: 7.18 | U319: 334 | V319: 0.26500000000000001 | W319: 1.6e-002 | X319: 2.9999999999999999e-002 | Y319: 436 | Z319: 4.31 | AA319: -9.4299999999999995e-002 | AB319: -9.8400000000000001e-002 | AC319: -0.11 | AD319: -0.111 | AE319: 91.07 | AF319: 92.18 | AG319: 0.96 | AH319: AA | AI319: 4.3799999999999999e-002 | AJ319: =H319+100*O319 -> 180.13 | AK319: 179.7 | AL319: 314 | AM319: 87.5 | AN319: 313 | AO319: 0.10400000000000001 | AP319: 22 | AQ319: 明阳转债!!
A320: 181 | B320: 128095 | C320: 恩捷转债!! | D320: 2812 | E320: 恩捷股份 | F320: 电子 | G320: 元器件制 | H320: 192.7 | I320: -8.8000000000000009e-002 | J320: 1.7000000000000001e-002 | K320: 123.16 | L320: -7.4099999999999999e-002 | M320: 114.9 | N320: 65.09 | O320: 1.8000000000000002e-002 | P320: 189.21 | Q320: 转股中 | R320: 4.98年 | S320: 2.98年 | T320: 8 | U320: 333 | V320: 0.21600000000000003 | W320: 6.9999999999999993e-003 | X320: 1.3999999999999999e-002 | Y320: 1092. | Z320: 10.96 | AA320: -0.10000000000000001 | AB320: -0.105 | AC320: -0.111 | AD320: -0.11199999999999999 | AE320: 90.46 | AF320: 93.18 | AG320: 0.96 | AH320: AA | AI320: 4.3799999999999999e-002 | AJ320: =H320+100*O320 -> 194.5 | AK320: 196.2 | AL320: 319 | AM320: 103 | AN320: 319 | AO320: -9.9000000000000005e-002 | AP320: 16 | AQ320: 恩捷转债!!
A321: 285 | B321: 128046 | C321: 利尔转债! | D321: 2258 | E321: 利尔化学 | F321: 化工 | G321: 农化 | H321: 164.756 | I321: 4.3099999999999999e-002 | J321: 4.6999999999999993e-003 | K321: 30.25 | L321: 5.0300000000000004e-002 | M321: 112.3 | N321: 18.62 | O321: 1.3999999999999999e-002 | P321: 162.46 | Q321: 转股中 | R321: 3.66年 | S321: 1.66年 | T321: 8.47 | U321: 282 | V321: 0.20699999999999999 | W321: 5.2999999999999999e-002 | X321: 8.6999999999999994e-002 | Y321: 159 | Z321: 4.44 | AA321: -0.10099999999999999 | AB321: -0.106 | AC321: -0.188 | AD321: -0.18899999999999997 | AE321: 95.12 | AF321: 96.29 | AG321: 0.95 | AH321: AA | AI321: 4.3799999999999999e-002 | AJ321: =H321+100*O321 -> 166.15600000000001 | AK321: 167.1 | AL321: 307 | AM321: 70.8 | AN321: 306 | AO321: 0.188 | AP321: 10 | AQ321: 利尔转债!
A322: 143 | B322: 113580 | C322: 康隆转债! | D322: 603665 | E322: 康隆达 | F322: 服装纺织 | G322: 服装行业 | H322: 219.58 | I322: -6.3e-003 | J322: 5.3099999999999994e-002 | K322: 14.97 | L322: 7.3899999999999993e-002 | M322: 121.2 | N322: 15.51 | O322: 1.28 | P322: 96.52 | Q322: 转股中 | R322: 5.17年 | S322: 3.17年 | T322: 0.41 | U322: 112 | V322: 1.25 | W322: 1.7000000000000001e-002 | X322: 1.7000000000000001e-002 | Y322: 24 | Z322: 2.32 | AA322: -0.11 | AB322: -0.11599999999999999 | AC322: -0.11599999999999999 | AD322: -0.11699999999999999 | AE322: 84.26 | AF322: 87.63 | AG322: 0.63 | AH322: AA- | AI322: 6.6299999999999998e-002 | AJ322: =H322+100*O322 -> 347.58000000000004 | AK322: 342.6 | AL322: 340 | AM322: 255 | AN322: 340 | AO322: 1.e-002 | AP322: 9 | AQ322: 康隆转债!
A323: 223 | B323: 123031 | C323: 晶瑞转债! | D323: 300655 | E323: 晶瑞股份 | F323: 化工 | G323: 化工 | H323: 196 | I323: 2.3199999999999998e-002 | J323: 4.8300000000000003e-002 | K323: 30.85 | L323: 7.4900000000000008e-002 | M323: 115.8 | N323: 18.43 | O323: 0.17100000000000001 | P323: 167.39 | Q323: 转股中 | R323: 4.52年 | S323: 2.52年 | T323: 0.63 | U323: 139 | V323: 1.1299999999999999 | W323: 1.1000000000000001e-002 | X323: 1.8000000000000002e-002 | Y323: 58 | Z323: 4.53 | AA323: -0.111 | AB323: -0.11699999999999999 | AC323: -0.14300000000000002 | AD323: -0.14400000000000002 | AE323: 85.03 | AF323: 83.76 | AG323: 0.96 | AH323: A+ | AI323: 7.5800000000000006e-002 | AJ323: =H323+100*O323 -> 213.09999999999999 | AK323: 224.6 | AL323: 327 | AM323: 139.6 | AN323: 328 | AO323: 1.8000000000000002e-002 | AP323: 17 | AQ323: 晶瑞转债!
A324: 84 | B324: 128126 | C324: 赣锋转2 | D324: 2460 | E324: 赣锋锂业 | F324: 有色金属 | G324: 小金属 | H324: 217.7 | I324: -4.5199999999999997e-002 | J324: -7.0999999999999995e-003 | K324: 129.65 | L324: -5.3600000000000002e-002 | M324: 111.1 | N324: 60.27 | O324: 1.2e-002 | P324: 215.12 | Q324: 转股中 | R324: 5.46年 | S324: 3.46年 | T324: 21.1 | U324: 675 | V324: 0.14699999999999999 | W324: 1.2e-002 | X324: 2.6000000000000002e-002 | Y324: 1743. | Z324: 18.62 | AA324: -0.11699999999999999 | AB324: -0.12 | AC324: -0.10199999999999999 | AD324: -0.10300000000000001 | AE324: 87.7 | AF324: 87.57 | AG324: 0.97 | AH324: AA | AI324: 4.53e-002 | AJ324: =H324+100*O324 -> 218.89999999999998 | AK324: 220.3 | AL324: 322 | AM324: 132.6 | AN324: 325 | AO324: 1.e-003 | AP324: 9 | AQ324: 赣锋转2
A325: 86 | B325: 113038 | C325: 隆20转债 | D325: 601012 | E325: 隆基股份 | F325: 能源电力 | G325: 太阳能 | H325: 222.39 | I325: -4.0599999999999997e-002 | J325: -1.6000000000000001e-003 | K325: 117 | L325: -4.3299999999999998e-002 | M325: 111.8 | N325: 52.59 | O325: 0. | P325: 222.48 | Q325: 转股中 | R325: 5.44年 | S325: 3.44年 | T325: 38.7 | U325: 1412. | V325: 0.16399999999999998 | W325: 9.0000000000000011e-003 | X325: 2.e-002 | Y325: 4413. | Z325: 13.6 | AA325: -0.12 | AB325: -0.12300000000000001 | AC325: -0.105 | AD325: -0.105 | AE325: 89.66 | AF325: 90.5 | AG325: 0.97 | AH325: AAA | AI325: 4.0300000000000002e-002 | AJ325: =H325+100*O325 -> 222.38999999999999 | AK325: 222.3 | AL325: 325 | AM325: 131.8 | AN325: 323 | AO325: 4.0999999999999995e-002 | AP325: 14 | AQ325: 隆20转债
A326: 273 | B326: 123018 | C326: 溢利转债! | D326: 300381 | E326: 溢多利 | F326: 医药 | G326: 原料药 | H326: 185.65 | I326: 1.7299999999999999e-002 | J326: -3.9000000000000003e-003 | K326: 10.02 | L326: 1.6200000000000003e-002 | M326: 114.3 | N326: 8.32 | O326: 0.54200000000000004 | P326: 120.43 | Q326: 转股中 | R326: 3.83年 | S326: 1.83年 | T326: 0.54 | U326: 73 | V326: 0.7340000000000001 | W326: 1.1000000000000001e-002 | X326: 1.3000000000000001e-002 | Y326: 49 | Z326: 1.69 | AA326: -0.121 | AB326: -0.126 | AC326: -0.19899999999999998 | AD326: -0.20000000000000001 | AE326: 90.75 | AF326: 90.25 | AG326: 0.82 | AH326: AA- | AI326: 6.480000000000001e-002 | AJ326: =H326+100*O326 -> 239.85000000000002 | AK326: 250.9 | AL326: 330 | AM326: 160.1 | AN326: 331 | AO326: -2.2000000000000002e-002 | AP326: 13 | AQ326: 溢利转债!
A327: 111 | B327: 113592 | C327: 安20转债!* | D327: 603345 | E327: 安井食品 | F327: 食品饮料 | G327: 食品饮料 | H327: 226.97 | I327: -1.32e-002 | J327: 1.5e-003 | K327: 266 | L327: -1.1599999999999999e-002 | M327: 113.1 | N327: 115.9 | O327: -1.1000000000000001e-002 | P327: 229.51 | Q327: 转股中 | R327: 5.38年 | S327: 3.38年 | T327: 4.37 | U327: 256 | V327: 0.25800000000000001 | W327: 6.9999999999999993e-003 | X327: 1.6e-002 | Y327: 637 | Z327: 19.61 | AA327: -0.12300000000000001 | AB327: -0.127 | AC327: -0.109 | AD327: -0.11 | AE327: 88.66 | AF327: 89.52 | AG327: 1 | AH327: AA | AI327: 4.53e-002 | AJ327: =H327+100*O327 -> 225.87 | AK327: 224.4 | AL327: 326 | AM327: 134.9 | AN327: 326 | AO327: 0.11 | AP327: 9 | AQ327: 安20转债!*
A328: 45 | B328: 113041 | C328: 紫金转债 | D328: 601899 | E328: 紫金矿业 | F328: 有色金属 | G328: 贵金属 | H328: 206.35 | I328: -1.77e-002 | J328: 4.3299999999999998e-002 | K328: 13.64 | L328: 2.63e-002 | M328: 108 | N328: 7 | O328: 5.9000000000000004e-002 | P328: 194.86 | Q328: 2月20天 | R328: 4.70年 | S328: 2.70年 | T328: 60 | U328: 2223. | V328: 0.17999999999999999 | W328: 1.7000000000000001e-002 | X328: 3.4000000000000002e-002 | Y328: 3475. | Z328: 7.22 | AA328: -0.129 | AB328: -0.13200000000000001 | AC328: -0.14000000000000001 | AD328: -0.14099999999999999 | AE328: 90.88 | AF328: 90.42 | AG328: 0.97 | AH328: AAA | AI328: 3.8800000000000001e-002 | AJ328: =H328+100*O328 -> 212.25 | AK328: 217.8 | AL328: 321 | AM328: 127 | AN328: 322 | AO328: 0.27300000000000002 | AP328: 8 | AQ328: 紫金转债
A329: 272 | B329: 128052 | C329: 凯龙转债! | D329: 2783 | E329: 凯龙股份 | F329: 化工 | G329: 化工 | H329: 195 | I329: -2.9900000000000003e-002 | J329: 3.9599999999999996e-002 | K329: 10.34 | L329: 9.7999999999999997e-003 | M329: 114.3 | N329: 6.67 | O329: 0.25800000000000001 | P329: 155.02 | Q329: 转股中 | R329: 3.84年 | S329: 1.84年 | T329: 0.32 | U329: 193 | V329: 3.0800000000000001 | W329: 8.0000000000000002e-003 | X329: 1.3000000000000001e-002 | Y329: 39 | Z329: 2.26 | AA329: -0.13200000000000001 | AB329: -0.13699999999999998 | AC329: -0.21100000000000002 | AD329: -0.21199999999999999 | AE329: 94.4 | AF329: 97.26 | AG329: 1 | AH329: AA | AI329: 4.3799999999999999e-002 | AJ329: =H329+100*O329 -> 220.80000000000001 | AK329: 235 | AL329: 328 | AM329: 137.7 | AN329: 327 | AO329: 3.9e-002 | AP329: 13 | AQ329: 凯龙转债!
A330: 220 | B330: 113545 | C330: 金能转债! | D330: 603113 | E330: 金能科技 | F330: 煤炭 | G330: 炼焦 | H330: 227.78 | I330: 1.4999999999999999e-002 | J330: 3.44e-002 | K330: 23.21 | L330: 5.0700000000000002e-002 | M330: 114.9 | N330: 10.78 | O330: 5.7999999999999996e-002 | P330: 215.31 | Q330: 转股中 | R330: 4.65年 | S330: 2.65年 | T330: 10.2 | U330: 425 | V330: 0.187 | W330: 5.2000000000000005e-002 | X330: 0.11199999999999999 | Y330: 197 | Z330: 2.57 | AA330: -0.13900000000000001 | AB330: -0.14300000000000002 | AC330: -0.156 | AD330: -0.156 | AE330: 91.75 | AF330: 94.51 | AG330: 0.97 | AH330: AA | AI330: 4.3799999999999999e-002 | AJ330: =H330+100*O330 -> 233.58000000000001 | AK330: 240.3 | AL330: 329 | AM330: 145.7 | AN330: 329 | AO330: 0.16200000000000001 | AP330: 20 | AQ330: 金能转债!
A331: 298 | B331: 110044 | C331: 广电转债!! | D331: 600831 | E331: 广电网络 | F331: 传媒娱乐 | G331: 影视娱乐 | H331: 186.14 | I331: 4.0999999999999995e-003 | J331: 8.3000000000000001e-003 | K331: 5.78 | L331: 3.7699999999999997e-002 | M331: 112.3 | N331: 6.9 | O331: 1.22 | P331: 83.77 | Q331: 转股中 | R331: 3.35年 | S331: 1.35年 | T331: 0.71 | U331: 59 | V331: 0.44799999999999995 | W331: 1.7000000000000001e-002 | X331: 1.3999999999999999e-002 | Y331: 41 | Z331: 1.11 | AA331: -0.14199999999999999 | AB331: -0.14800000000000002 | AC331: -0.28000000000000003 | AD331: -0.28100000000000003 | AE331: 96.38 | AF331: 97.57 | AG331: 0.33 | AH331: AA | AI331: 4.3799999999999999e-002 | AJ331: =H331+100*O331 -> 308.13999999999999 | AK331: 288.5 | AL331: 336 | AM331: 190.9 | AN331: 336 | AO331: -2.5000000000000001e-002 | AP331: 12 | AQ331: 广电转债!!
A332: 131 | B332: 128110 | C332: 永兴转债!* | D332: 2756 | E332: 永兴材料 | F332: 钢铁 | G332: 炼钢 | H332: 259.772 | I332: -5.8799999999999998e-002 | J332: 1.9e-003 | K332: 44.75 | L332: -5.6900000000000006e-002 | M332: 113.2 | N332: 17.06 | O332: -1.e-002 | P332: 262.31 | Q332: 转股中 | R332: 5.30年 | S332: 3.30年 | T332: 0.37 | U332: 244 | V332: 2.5299999999999998 | W332: 2.e-003 | X332: 5.0000000000000001e-003 | Y332: 180 | Z332: 4.68 | AA332: -0.14699999999999999 | AB332: -0.151 | AC332: -0.127 | AD332: -0.127 | AE332: 89.07 | AF332: 89.93 | AG332: 1 | AH332: AA | AI332: 4.53e-002 | AJ332: =H332+100*O332 -> 258.77199999999999 | AK332: 257.2 | AL332: 331 | AM332: 167.3 | AN332: 333 | AO332: -0.14899999999999999 | AP332: 5 | AQ332: 永兴转债!*
A333: 141 | B333: 113582 | C333: 火炬转债! | D333: 603678 | E333: 火炬电子 | F333: 电子 | G333: 元器件制 | H333: 269.81 | I333: -1.9400000000000001e-002 | J333: 6.1999999999999998e-003 | K333: 62.55 | L333: -1.3600000000000001e-002 | M333: 115.3 | N333: 25.33 | O333: 9.3000000000000013e-002 | P333: 246.94 | Q333: 转股中 | R333: 5.27年 | S333: 3.27年 | T333: 4.18 | U333: 175 | V333: 0.157 | W333: 1.4999999999999999e-002 | X333: 3.6000000000000004e-002 | Y333: 288 | Z333: 8.16 | AA333: -0.151 | AB333: -0.155 | AC333: -0.13200000000000001 | AD333: -0.13200000000000001 | AE333: 89.3 | AF333: 91.76 | AG333: 0.98 | AH333: AA | AI333: 4.53e-002 | AJ333: =H333+100*O333 -> 279.11000000000001 | AK333: 292.7 | AL333: 337 | AM333: 200.9 | AN333: 337 | AO333: -0.10099999999999999 | AP333: 5 | AQ333: 火炬转债!
A334: 229 | B334: 113543 | C334: 欧派转债! | D334: 603833 | E334: 欧派家居 | F334: 其他 | G334: 家居用品 | H334: 242.36 | I334: -3.3300000000000003e-002 | J334: 5.5000000000000005e-003 | K334: 161.26 | L334: -2.8500000000000001e-002 | M334: 114.9 | N334: 71.69 | O334: 7.6999999999999999e-002 | P334: 224.94 | Q334: 转股中 | R334: 4.49年 | S334: 3.49年 | T334: 5.42 | U334: 104 | V334: 7.9000000000000001e-002 | W334: 6.0000000000000001e-003 | X334: 1.3000000000000001e-002 | Y334: 970 | Z334: 8.89 | AA334: -0.155 | AB334: -0.16 | AC334: -0.109 | AD334: -0.11 | AE334: 90.2 | AF334: 95.16 | AG334: 0.98 | AH334: AA | AI334: 4.3799999999999999e-002 | AJ334: =H334+100*O334 -> 250.06 | AK334: 259.8 | AL334: 333 | AM334: 164.6 | AN334: 332 | AO334: 6.8000000000000005e-002 | AP334: 14 | AQ334: 欧派转债!
A335: 242 | B335: 128065 | C335: 雅化转债!!* | D335: 2497 | E335: 雅化集团 | F335: 化工 | G335: 化工 | H335: 221.923 | I335: -4.0000000000000001e-002 | J335: 3.0000000000000001e-003 | K335: 21.05 | L335: -3.7100000000000001e-002 | M335: 110.9 | N335: 9.43 | O335: -6.0000000000000001e-003 | P335: 223.22 | Q335: 转股中 | R335: 4年56天 | S335: 2年56天 | T335: 0.99 | U335: 236 | V335: 1.0800000000000001 | W335: 4.0000000000000001e-003 | X335: 9.0000000000000011e-003 | Y335: 240 | Z335: 6.95 | AA335: -0.156 | AB335: -0.16 | AC335: -0.19800000000000001 | AD335: -0.19899999999999998 | AE335: 93.72 | AF335: 93.19 | AG335: 1 | AH335: AA | AI335: 4.3799999999999999e-002 | AJ335: =H335+100*O335 -> 221.32300000000001 | AK335: 220.6 | AL335: 324 | AM335: 126.9 | AN335: 321 | AO335: -0.109 | AP335: 21 | AQ335: 雅化转债!!*
A336: 335 | B336: 127004 | C336: 模塑转债!! | D336: 700 | E336: 模塑科技 | F336: 汽车 | G336: 零部件制 | H336: 169.8 | I336: 1.37e-002 | J336: -1.37e-002 | K336: 5.18 | L336: 3.1899999999999998e-002 | M336: 113.3 | N336: 7.46 | O336: 1.45 | P336: 69.44 | Q336: 转股中 | R336: 2.28年 | S336: 0.28年 | T336: 1.32 | U336: 82 | V336: 0.37 | W336: 2.7999999999999997e-002 | X336: 1.9e-002 | Y336: 48 | Z336: 1.83 | AA336: -0.16500000000000001 | AB336: -0.17300000000000001 | AC336: -0.94599999999999995 | AD336: -0.94999999999999996 | AE336: 99.95 | AF336: 100.01 | AG336: 0 | AH336: AA | AI336: 4.1900000000000007e-002 | AJ336: =H336+100*O336 -> 314.80000000000001 | AK336: 270.2 | AL336: 334 | AM336: 170.2 | AN336: 334 | AO336: -3.4000000000000002e-002 | AP336: 37 | AQ336: 模塑转债!!
A337: 122 | B337: 128115 | C337: 巨星转债!* | D337: 2444 | E337: 巨星科技 | F337: 机械装备 | G337: 通用设备 | H337: 306.5 | I337: -5.9999999999999998e-002 | J337: -1.1999999999999999e-003 | K337: 38.3 | L337: -6.13e-002 | M337: 115.3 | N337: 12.28 | O337: -1.7000000000000001e-002 | P337: 311.89 | Q337: 转股中 | R337: 5.34年 | S337: 3.34年 | T337: 1.3 | U337: 402 | V337: 1. | W337: 3.0000000000000001e-003 | X337: 1.e-002 | Y337: 421 | Z337: 4.86 | AA337: -0.17000000000000001 | AB337: -0.17300000000000001 | AC337: -0.13600000000000001 | AD337: -0.13699999999999998 | AE337: 91.31 | AF337: 91.44 | AG337: 1 | AH337: AA | AI337: 4.53e-002 | AJ337: =H337+100*O337 -> 304.80000000000001 | AK337: 301.1 | AL337: 338 | AM337: 209.7 | AN337: 338 | AO337: 8.900000000000001e-002 | AP337: 5 | AQ337: 巨星转债!*
A338: 301 | B338: 113509 | C338: 新泉转债!! | D338: 603179 | E338: 新泉股份 | F338: 汽车 | G338: 零部件制 | H338: 210.35 | I338: -3.5799999999999998e-002 | J338: 1.7000000000000001e-003 | K338: 31.15 | L338: -3.5000000000000003e-002 | M338: 110.3 | N338: 15.55 | O338: 5.0000000000000003e-002 | P338: 200.32 | Q338: 转股中 | R338: 3.29年 | S338: 1.29年 | T338: 1.04 | U338: 24 | V338: 0.111 | W338: 9.0000000000000011e-003 | X338: 1.8000000000000002e-002 | Y338: 115 | Z338: 4.67 | AA338: -0.18100000000000002 | AB338: -0.185 | AC338: -0.33600000000000002 | AD338: -0.33799999999999997 | AE338: 96.64 | AF338: 96.09 | AG338: 0.97 | AH338: AA | AI338: 4.3799999999999999e-002 | AJ338: =H338+100*O338 -> 215.34999999999999 | AK338: 220.4 | AL338: 323 | AM338: 123.7 | AN338: 320 | AO338: -0.129 | AP338: 11 | AQ338: 新泉转债!!
A339: 287 | B339: 123015 | C339: 蓝盾转债!! | D339: 300297 | E339: 蓝盾股份 | F339: 计算机及 | G339: 软件开发 | H339: 247.4 | I339: -6.0000000000000001e-003 | J339: 1.9799999999999998e-002 | K339: 4.61 | L339: 5.0099999999999999e-002 | M339: 112.3 | N339: 5.79 | O339: 2.1099999999999999 | P339: 79.62 | Q339: 转股中 | R339: 3.48年 | S339: 1.48年 | T339: 1 | U339: 289 | V339: 1.1599999999999999 | W339: 1.7000000000000001e-002 | X339: 1.3999999999999999e-002 | Y339: 58 | Z339: 1.5 | AA339: -0.20600000000000002 | AB339: -0.20999999999999999 | AC339: -0.33200000000000002 | AD339: -0.33299999999999996 | AE339: 92.79 | AF339: 90.67 | AG339: 0.27 | AH339: AA- | AI339: 6.480000000000001e-002 | AJ339: =H339+100*O339 -> 458.39999999999998 | AK339: 415.2 | AL339: 342 | AM339: 322.4 | AN339: 342 | AO339: 1.e-003 | AP339: 19 | AQ339: 蓝盾转债!!
A340: 294 | B340: 128041 | C340: 盛路转债!! | D340: 2446 | E340: 盛路通信 | F340: 通信互联 | G340: 通信设备 | H340: 280 | I340: 1.49e-002 | J340: -1.6000000000000001e-003 | K340: 5.81 | L340: 3.5699999999999996e-002 | M340: 114.3 | N340: 6.82 | O340: 2.29 | P340: 85.19 | Q340: 转股中 | R340: 3.41年 | S340: 1.41年 | T340: 0.53 | U340: 558 | V340: 3.7799999999999998 | W340: 1.e-002 | X340: 9.0000000000000011e-003 | Y340: 53 | Z340: 1.75 | AA340: -0.23399999999999999 | AB340: -0.23899999999999999 | AC340: -0.38 | AD340: -0.38100000000000001 | AE340: 96.16 | AF340: 99.07 | AG340: 0.37 | AH340: AA | AI340: 4.3799999999999999e-002 | AJ340: =H340+100*O340 -> 509. | AK340: 474.8 | AL340: 343 | AM340: 375.7 | AN340: 343 | AO340: -1.e-002 | AP340: 14 | AQ340: 盛路转债!!
A341: 331 | B341: 128017 | C341: 金禾转债!! | D341: 2597 | E341: 金禾实业 | F341: 化工 | G341: 化工 | H341: 244.65 | I341: 4.6999999999999993e-003 | J341: -4.0000000000000001e-003 | K341: 51.94 | L341: 8.0000000000000004e-004 | M341: 108.8 | N341: 22.42 | O341: 5.5999999999999994e-002 | P341: 231.67 | Q341: 转股中 | R341: 2.70年 | S341: 0.70年 | T341: 5.52 | U341: 204 | V341: 0.154 | W341: 1.9e-002 | X341: 4.4000000000000004e-002 | Y341: 291 | Z341: 6.32 | AA341: -0.26200000000000001 | AB341: -0.26600000000000001 | AC341: -0.68599999999999994 | AD341: -0.68700000000000006 | AE341: 98.02 | AF341: 97.55 | AG341: 0.99 | AH341: AA | AI341: 4.1900000000000007e-002 | AJ341: =H341+100*O341 -> 250.25 | AK341: 257.6 | AL341: 332 | AM341: 159.6 | AN341: 330 | AO341: 0.14099999999999999 | AP341: 10 | AQ341: 金禾转债!!
A342: 317 | B342: 128030 | C342: 天康转债!! | D342: 2100 | E342: 天康生物 | F342: 农业 | G342: 畜牧业 | H342: 265.57 | I342: 2.06e-002 | J342: 7.9699999999999993e-002 | K342: 12.61 | L342: 0.10000000000000001 | M342: 111.3 | N342: 7.85 | O342: 0.65300000000000002 | P342: 160.64 | Q342: 转股中 | R342: 2.84年 | S342: 0.84年 | T342: 0.97 | U342: 145 | V342: 0.56600000000000006 | W342: 6.9999999999999993e-003 | X342: 1.1000000000000001e-002 | Y342: 136 | Z342: 2.27 | AA342: -0.26700000000000002 | AB342: -0.27100000000000002 | AC342: -0.61399999999999999 | AD342: -0.61499999999999999 | AE342: 97.7 | AF342: 99.24 | AG342: 1 | AH342: AA | AI342: 4.1900000000000007e-002 | AJ342: =H342+100*O342 -> 330.87 | AK342: 370.5 | AL342: 341 | AM342: 271.3 | AN342: 341 | AO342: 0.125 | AP342: 12 | AQ342: 天康转债!!
A343: 319 | B343: 128028 | C343: 赣锋转债!!* | D343: 2460 | E343: 赣锋锂业 | F343: 有色金属 | G343: 小金属 | H343: 310.292 | I343: -5.3099999999999994e-002 | J343: -5.0000000000000001e-004 | K343: 129.65 | L343: -5.3600000000000002e-002 | M343: 108.5 | N343: 41.68 | O343: -2.e-003 | P343: 311.06 | Q343: 转股中 | R343: 2.84年 | S343: 0.84年 | T343: 2.99 | U343: 885 | V343: 0.95700000000000007 | W343: 2.e-003 | X343: 5.0000000000000001e-003 | Y343: 1743. | Z343: 18.62 | AA343: -0.312 | AB343: -0.315 | AC343: -0.67200000000000004 | AD343: -0.67299999999999993 | AE343: 97.18 | AF343: 96.71 | AG343: 1 | AH343: AA | AI343: 4.1900000000000007e-002 | AJ343: =H343+100*O343 -> 310.09199999999998 | AK343: 309.5 | AL343: 339 | AM343: 212.3 | AN343: 339 | AO343: 1.e-003 | AP343: 13 | AQ343: 赣锋转债!!*
A344: 291 | B344: 123013 | C344: 横河转债! | D344: 300539 | E344: 横河模具 | F344: 机械装备 | G344: 专用设备 | H344: 406.4 | I344: -1.3600000000000001e-002 | J344: 2.46e-002 | K344: 6.71 | L344: 4.8399999999999999e-002 | M344: 115.2 | N344: 9.13 | O344: 4.5300000000000002 | P344: 73.49 | Q344: 转股中 | R344: 3.43年 | S344: 1.43年 | T344: 0.38 | U344: 442 | V344: 2.8500000000000001 | W344: 2.6000000000000002e-002 | X344: 1.9e-002 | Y344: 15 | Z344: 3.08 | AA344: -0.312 | AB344: -0.316 | AC344: -0.439 | AD344: -0.44 | AE344: 92.1 | AF344: 90.22 | AG344: 0.23 | AH344: A+ | AI344: 7.5800000000000006e-002 | AJ344: =H344+100*O344 -> 859.39999999999998 | AK344: 739.3 | AL344: 344 | AM344: 647.2 | AN344: 344 | AO344: 1.3999999999999999e-002 | AP344: 16 | AQ344: 横河转债!
A345: 318 | B345: 128029 | C345: 太阳转债!! | D345: 2078 | E345: 太阳纸业 | F345: 造纸包装 | G345: 造纸行业 | H345: 253.711 | I345: 1.1599999999999999e-002 | J345: -2.4199999999999999e-002 | K345: 19.68 | L345: -1.2500000000000001e-002 | M345: 107 | N345: 8.55 | O345: 0.10199999999999999 | P345: 230.18 | Q345: 转股中 | R345: 1.84年 | S345: 回售内 | T345: 9.09 | U345: 259 | V345: 0.11199999999999999 | W345: 1.8000000000000002e-002 | X345: 4.0999999999999995e-002 | Y345: 517 | Z345: 3.33 | AA345: -0.376 | AB345: -0.38 | AC345: 回售内 | AD345: 回售内 | AE345: 100.17 | AF345: 99.61 | AG345: 1 | AH345: AA+ | AI345: 3.9900000000000005e-002 | AJ345: =H345+100*O345 -> 263.911 | AK345: 277.2 | AL345: 335 | AM345: 177.1 | AN345: 335 | AO345: 0.13800000000000001 | AP345: 7 | AQ345: 太阳转债!!
A346: 227 | B346: 123029 | C346: 英科转债! | D346: 300677 | E346: 英科医疗 | F346: 医药 | G346: 医疗器械 | H346: 2508 | I346: 4.7199999999999999e-002 | J346: -1.5900000000000001e-002 | K346: 210.25 | L346: 3.1400000000000004e-002 | M346: 138.2 | N346: 11.32 | O346: 0.34999999999999998 | P346: 1857.33 | Q346: 转股中 | R346: 4.49年 | S346: 2.49年 | T346: 1.23 | U346: 1036. | V346: 0.34200000000000003 | W346: 2.e-003 | X346: 3.1e-002 | Y346: 741 | Z346: 7.74 | AA346: -0.41999999999999998 | AB346: -0.42299999999999999 | AC346: -0.30099999999999999 | AD346: -0.30099999999999999 | AE346: 91.11 | AF346: 105.33 | AG346: 1 | AH346: AA- | AI346: 6.480000000000001e-002 | AJ346: =H346+100*O346 -> 2543. | AK346: 3158.6999999999998 | AL346: 345 | AM346: 3053.3000000000002 | AN346: 345 | AO346: -0.13400000000000001 | AP346: 17 | AQ346: 英科转债!