A1: 序号 | B1: 转债代码 | C1: 转债名称 | D1: 股票代码 | E1: 股票名称 | F1: 行业 | G1: 子行业 | H1: 转债价格 | I1: 涨跌 | J1: 日内套利 | K1: 股价 | L1: 涨跌 | M1: 剩余本息 | N1: 转股价格 | O1: 转股溢价率 | P1: 转股价值 | Q1: 距离转股日 | R1: 剩余年限 | S1: 回售年限 | T1: 转债余额 | U1: 转债成交额 | V1: 转债换手率 | W1: 余额/市值 | X1: 余额/股本 | Y1: 股票市值 | Z1: P/B | AA1: 税前收益率 | AB1: 税后收益率 | AC1: 税前回售收益 | AD1: 税后回售收益 | AE1: 回售价值 | AF1: 纯债价值 | AG1: 弹性 | AH1: 信用 | AI1: 折现率 | AJ1: 双低 | AK1: 老式双低 | AL1: 老式排名 | AM1: 新式双低 | AN1: 新式排名 | AO1: MA20乖离 | AP1: 热门度 | AQ1: 转债名称
A2: 287 | B2: 128062 | C2: 亚药转债! | D2: 2370 | E2: 亚太药业 | F2: 医药 | G2: 化学制药 | H2: 81.62 | I2: 2.3999999999999998e-003 | J2: -2.3999999999999998e-003 | K2: 4.23 | L2: -2.98e-002 | M2: 119.3 | N2: 16.25 | O2: 2.1400000000000001 | P2: 26.03 | Q2: 转股中 | R2: 3.63年 | S2: 1.64年 | T2: 9.63 | U2: 21 | V2: 2.6000000000000002e-002 | W2: 0.42399999999999999 | X2: 0.11 | Y2: 23 | Z2: 5.25 | AA2: 0.11199999999999999 | AB2: 0.10199999999999999 | AC2: 0.13800000000000001 | AD2: 0.13400000000000001 | AE2: 81.09 | AF2: 74.38 | AG2: 0 | AH2: BB | AI2: 0.1419 | AJ2: =H2+100*O2 -> 295.62 | AK2: 137.2 | AL2: 111 | AM2: 56.1 | AN2: 217 | AO2: -7.2000000000000008e-002 | AP2: 85 | AQ2: 亚药转债!
A3: 154 | B3: 113595 | C3: 花王转债! | D3: 603007 | E3: ST花王 | F3: 城市公用 | G3: 生态环境 | H3: 86.91 | I3: 4.1999999999999997e-003 | J3: -5.3e-003 | K3: 3.22 | L3: -1.23e-002 | M3: 124.8 | N3: 6.92 | O3: 0.86799999999999999 | P3: 46.53 | Q3: 转股中 | R3: 4.93年 | S3: 2.94年 | T3: 3.3 | U3: 5.4 | V3: 1.9e-002 | W3: 0.30499999999999999 | X3: 0.14199999999999999 | Y3: 11 | Z3: 0.94 | AA3: 7.7699999999999991e-002 | AB3: 6.8499999999999991e-002 | AC3: 5.9200000000000003e-002 | AD3: 5.6600000000000004e-002 | AE3: 81.43 | AF3: 85.31 | AG3: 0.09 | AH3: A | AI3: 8.1900000000000001e-002 | AJ3: =H3+100*O3 -> 173.70999999999998 | AK3: 127.3 | AL3: 27 | AM3: 42 | AN3: 113 | AO3: -6.9999999999999993e-003 | AP3: 44 | AQ3: 花王转债!
A4: 198 | B4: 113576 | C4: 起步转债!! | D4: 603557 | E4: ST起步 | F4: 服装纺织 | G4: 鞋服行业 | H4: 93.26 | I4: 2.8000000000000004e-003 | J4: -1.2999999999999999e-003 | K4: 4.76 | L4: 1.9299999999999998e-002 | M4: 121.3 | N4: 10.55 | O4: 1.0700000000000001 | P4: 45.12 | Q4: 转股中 | R4: 4.65年 | S4: 2.66年 | T4: 2.66 | U4: 14 | V4: 5.5999999999999994e-002 | W4: 0.113 | X4: 5.0999999999999997e-002 | Y4: 24 | Z4: 1.51 | AA4: 5.96e-002 | AB4: 5.0999999999999997e-002 | AC4: 4.0599999999999997e-002 | AD4: 3.7499999999999999e-002 | AE4: 83.66 | AF4: 84.85 | AG4: 0.08 | AH4: A | AI4: 8.1900000000000001e-002 | AJ4: =H4+100*O4 -> 200.25999999999999 | AK4: 141.4 | AL4: 155 | AM4: 56.6 | AN4: 218 | AO4: 1.4999999999999999e-002 | AP4: 34 | AQ4: 起步转债!!
A5: 98 | B5: 128138 | C5: 侨银转债! | D5: 2973 | E5: 侨银股份 | F5: 城市公用 | G5: 城市公用 | H5: 107.16 | I5: 1.5e-003 | J5: -2.7000000000000001e-003 | K5: 15.44 | L5: -7.7000000000000002e-003 | M5: 136.5 | N5: 25.33 | O5: 0.75800000000000001 | P5: 60.96 | Q5: 转股中 | R5: 5.26年 | S5: 3.26年 | T5: 4.2 | U5: 13 | V5: 2.8999999999999998e-002 | W5: 6.7000000000000004e-002 | X5: 4.0999999999999995e-002 | Y5: 63 | Z5: 4.19 | AA5: 4.8099999999999997e-002 | AB5: 3.6799999999999999e-002 | AC5: -7.6e-003 | AD5: -1.01e-002 | AE5: 85.1 | AF5: 100.03 | AG5: 0.16 | AH5: AA- | AI5: 6.2199999999999998e-002 | AJ5: =H5+100*O5 -> 182.95999999999998 | AK5: 153.4 | AL5: 244 | AM5: 53.3 | AN5: 195 | AO5: 1.1000000000000001e-002 | AP5: 14 | AQ5: 侨银转债!
A6: 135 | B6: 128127 | C6: 文科转债! | D6: 2775 | E6: 文科园林 | F6: 城市公用 | G6: 生态环境 | H6: 97.195 | I6: 2.e-003 | J6: -2.e-003 | K6: 4.09 | L6: 0. | M6: 121.3 | N6: 4.88 | O6: 0.16 | P6: 83.81 | Q6: 转股中 | R6: 5年6.1天 | S6: 3年7天 | T6: 9.5 | U6: 13 | V6: 1.3999999999999999e-002 | W6: 0.45299999999999996 | X6: 0.38 | Y6: 21 | Z6: 0.89 | AA6: 4.6300000000000001e-002 | AB6: 3.85e-002 | AC6: 2.2499999999999999e-002 | AD6: 1.9799999999999998e-002 | AE6: 86.23 | AF6: 90.3 | AG6: 0.48 | AH6: AA- | AI6: 6.2199999999999998e-002 | AJ6: =H6+100*O6 -> 113.19499999999999 | AK6: 110.6 | AL6: 1 | AM6: 20.3 | AN6: 3 | AO6: -2.6000000000000002e-002 | AP6: 54 | AQ6: 文科转债!
A7: 319 | B7: 128044 | C7: 岭南转债! | D7: 2717 | E7: 岭南股份 | F7: 城市公用 | G7: 生态环境 | H7: 97.901 | I7: 2.0999999999999999e-003 | J7: -2.0999999999999999e-003 | K7: 2.87 | L7: -3.4999999999999996e-003 | M7: 111.3 | N7: 5.91 | O7: 1.02 | P7: 48.56 | Q7: 转股中 | R7: 3年0.1天 | S7: 1年1.1天 | T7: 6.59 | U7: 8.5 | V7: 1.3000000000000001e-002 | W7: 0.14999999999999999 | X7: 7.2999999999999995e-002 | Y7: 44 | Z7: 1.01 | AA7: 4.4800000000000006e-002 | AB7: 3.73e-002 | AC7: 4.3200000000000002e-002 | AD7: 3.8199999999999998e-002 | AE7: 96.01 | AF7: 93.61 | AG7: 0.01 | AH7: AA- | AI7: 6.0899999999999996e-002 | AJ7: =H7+100*O7 -> 199.90100000000001 | AK7: 147.2 | AL7: 199 | AM7: 51.2 | AN7: 178 | AO7: 1.e-002 | AP7: 49 | AQ7: 岭南转债!
A8: 317 | B8: 113519 | C8: 长久转债! | D8: 603569 | E8: 长久物流 | F8: 交通运输 | G8: 物流业 | H8: 104.07 | I8: 3.0999999999999999e-003 | J8: -3.0999999999999999e-003 | K8: 6.76 | L8: 0. | M8: 119.3 | N8: 11.04 | O8: 0.69999999999999996 | P8: 61.23 | Q8: 转股中 | R8: 3.23年 | S8: 1.24年 | T8: 6.97 | U8: 5.1 | V8: 6.9999999999999993e-003 | W8: 0.184 | X8: 0.113 | Y8: 38 | Z8: 1.73 | AA8: 4.41e-002 | AB8: 3.3099999999999997e-002 | AC8: -8.8000000000000005e-003 | AD8: -1.2699999999999999e-002 | AE8: 97.37 | AF8: 105.39 | AG8: 0.06 | AH8: AA | AI8: 3.9900000000000005e-002 | AJ8: =H8+100*O8 -> 174.06999999999999 | AK8: 146.9 | AL8: 196 | AM8: 41.5 | AN8: 112 | AO8: 2.3e-002 | AP8: 21 | AQ8: 长久转债!
A9: 216 | B9: 113569 | C9: 科达转债! | D9: 603660 | E9: 苏州科达 | F9: 通信互联 | G9: 物联网 | H9: 99.4 | I9: -7.000000000000001e-004 | J9: 8.0000000000000004e-004 | K9: 6.88 | L9: 1.5e-003 | M9: 120.3 | N9: 14.8 | O9: 1.1399999999999999 | P9: 46.49 | Q9: 转股中 | R9: 4.57年 | S9: 2.57年 | T9: 5.16 | U9: 4 | V9: 8.0000000000000002e-003 | W9: 0.152 | X9: 7.0999999999999994e-002 | Y9: 34 | Z9: 1.9 | AA9: 4.36e-002 | AB9: 3.5499999999999997e-002 | AC9: 1.55e-002 | AD9: 1.29e-002 | AE9: 88.31 | AF9: 92.37 | AG9: 0.05 | AH9: AA- | AI9: 6.0899999999999996e-002 | AJ9: =H9+100*O9 -> 213.39999999999998 | AK9: 152.3 | AL9: 238 | AM9: 59.9 | AN9: 227 | AO9: 2.e-003 | AP9: 28 | AQ9: 科达转债!
A10: 137 | B10: 110072 | C10: 广汇转债! | D10: 600297 | E10: 广汇汽车 | F10: 汽车 | G10: 分销、售 | H10: 92.94 | I10: -2.9999999999999997e-004 | J10: -1.9e-003 | K10: 2.8 | L10: -1.06e-002 | M10: 114.5 | N10: 4.03 | O10: 0.33799999999999997 | P10: 69.48 | Q10: 转股中 | R10: 5年4.1天 | S10: 3年5.1天 | T10: 33.7 | U10: 43 | V10: 1.3999999999999999e-002 | W10: 0.14800000000000002 | X10: 0.10300000000000001 | Y10: 227 | Z10: 0.56 | AA10: 4.3200000000000002e-002 | AB10: 3.7699999999999997e-002 | AC10: 3.3099999999999997e-002 | AD10: 3.1099999999999999e-002 | AE10: 92.06 | AF10: 96.09 | AG10: 0.21 | AH10: AA+ | AI10: 3.6200000000000003e-002 | AJ10: =H10+100*O10 -> 126.73999999999999 | AK10: 116.4 | AL10: 4 | AM10: 20.3 | AN10: 4 | AO10: 6.9999999999999993e-003 | AP10: 64 | AQ10: 广汇转债!
A11: 211 | B11: 128100 | C11: 搜特转债! | D11: 2503 | E11: 搜于特 | F11: 服装纺织 | G11: 服装行业 | H11: 97.33 | I11: 6.3e-003 | J11: 4.3e-003 | K11: 1.64 | L11: 5.8099999999999999e-002 | M11: 116.9 | N11: 2.9 | O11: 0.72099999999999997 | P11: 56.55 | Q11: 转股中 | R11: 4.58年 | S11: 2.58年 | T11: 7.99 | U11: 151 | V11: 0.19500000000000001 | W11: 0.158 | X11: 8.900000000000001e-002 | Y11: 51 | Z11: 1.51 | AA11: 4.1700000000000001e-002 | AB11: 3.4799999999999998e-002 | AC11: 2.2499999999999999e-002 | AD11: 2.e-002 | AE11: 83.48 | AF11: 82.15 | AG11: 0.18 | AH11: A | AI11: 8.1900000000000001e-002 | AJ11: =H11+100*O11 -> 169.43000000000001 | AK11: 138.1 | AL11: 123 | AM11: 54.6 | AN11: 205 | AO11: 4.7e-002 | AP11: 68 | AQ11: 搜特转债!
A12: 146 | B12: 113596 | C12: 城地转债! | D12: 603887 | E12: 城地香江 | F12: 通信互联 | G12: 通信设备 | H12: 93.09 | I12: 4.4000000000000003e-003 | J12: -4.3e-003 | K12: 9.11 | L12: 6.6e-003 | M12: 113.1 | N12: 24.26 | O12: 1.48 | P12: 37.55 | Q12: 转股中 | R12: 4.95年 | S12: 2.96年 | T12: 12 | U12: 8.8 | V12: 8.0000000000000002e-003 | W12: 0.29199999999999998 | X12: 0.11 | Y12: 41 | Z12: 0.9 | AA12: 4.0899999999999999e-002 | AB12: 3.5699999999999996e-002 | AC12: 3.4599999999999999e-002 | AD12: 3.2300000000000002e-002 | AE12: 86.13 | AF12: 84.87 | AG12: 0.01 | AH12: AA- | AI12: 6.0899999999999996e-002 | AJ12: =H12+100*O12 -> 241.09 | AK12: 148.6 | AL12: 212 | AM12: 62.5 | AN12: 248 | AO12: 1.e-003 | AP12: 27 | AQ12: 城地转债!
A13: 300 | B13: 110052 | C13: 贵广转债! | D13: 600996 | E13: 贵广网络 | F13: 传媒娱乐 | G13: 影视娱乐 | H13: 102.4 | I13: 8.0000000000000004e-004 | J13: -1.e-003 | K13: 4.58 | L13: -6.5000000000000006e-003 | M13: 117.7 | N13: 7.94 | O13: 0.77500000000000002 | P13: 57.68 | Q13: 转股中 | R13: 3.56年 | S13: 1.56年 | T13: 15.3 | U13: 3.9 | V13: 3.0000000000000001e-003 | W13: 0.317 | X13: 0.183 | Y13: 48 | Z13: 1.14 | AA13: 4.0800000000000003e-002 | AB13: 3.1600000000000003e-002 | AC13: 3.5999999999999999e-003 | AD13: 2.0000000000000001e-004 | AE13: 97.16 | AF13: 104.44 | AG13: 0.04 | AH13: AA+ | AI13: 3.49e-002 | AJ13: =H13+100*O13 -> 179.90000000000001 | AK13: 147.1 | AL13: 197 | AM13: 42.7 | AN13: 117 | AO13: -1.7000000000000001e-002 | AP13: 18 | AQ13: 贵广转债!
A14: 346 | B14: 113017 | C14: 吉视转债! | D14: 601929 | E14: 吉视传媒 | F14: 传媒娱乐 | G14: 影视娱乐 | H14: 99.15 | I14: 8.0000000000000004e-004 | J14: -7.000000000000001e-004 | K14: 1.78 | L14: 5.6000000000000008e-003 | M14: 108.8 | N14: 2.95 | O14: 0.64300000000000002 | P14: 60.34 | Q14: 转股中 | R14: 2.37年 | S14: 0.37年 | T14: 15.6 | U14: 13 | V14: 8.0000000000000002e-003 | W14: 0.28199999999999997 | X14: 0.17000000000000001 | Y14: 55 | Z14: 0.84 | AA14: 4.0599999999999997e-002 | AB14: 3.32e-002 | AC14: 4.5499999999999999e-002 | AD14: 3.9599999999999996e-002 | AE14: 99.77 | AF14: 100.77 | AG14: 0.03 | AH14: AA+ | AI14: 3.3399999999999999e-002 | AJ14: =H14+100*O14 -> 163.44999999999999 | AK14: 138 | AL14: 119 | AM14: 37.2 | AN14: 68 | AO14: 6.0000000000000001e-003 | AP14: 66 | AQ14: 吉视转债!
A15: 171 | B15: 113589 | C15: 天创转债! | D15: 603608 | E15: 天创时尚 | F15: 服装纺织 | G15: 鞋服行业 | H15: 95.55 | I15: 5.9999999999999995e-004 | J15: -8.9999999999999998e-004 | K15: 5.73 | L15: -6.8999999999999999e-003 | M15: 114.9 | N15: 12.29 | O15: 1.05 | P15: 46.62 | Q15: 转股中 | R15: 4.86年 | S15: 2.86年 | T15: 6 | U15: 2.9 | V15: 5.0000000000000001e-003 | W15: 0.24399999999999999 | X15: 0.114 | Y15: 25 | Z15: 1.51 | AA15: 3.9399999999999998e-002 | AB15: 3.3599999999999998e-002 | AC15: 2.6600000000000002e-002 | AD15: 2.4300000000000002e-002 | AE15: 91.93 | AF15: 95.34 | AG15: 0.04 | AH15: AA | AI15: 3.9900000000000005e-002 | AJ15: =H15+100*O15 -> 200.55000000000001 | AK15: 144.5 | AL15: 182 | AM15: 49.1 | AN15: 161 | AO15: -1.9e-002 | AP15: 30 | AQ15: 天创转债!
A16: 237 | B16: 110064 | C16: 建工转债! | D16: 600939 | E16: 重庆建工 | F16: 建筑 | G16: 建筑工程 | H16: 102.16 | I16: 1.8e-003 | J16: -2.3e-003 | K16: 3.31 | L16: -3.0000000000000001e-003 | M16: 119.8 | N16: 4.53 | O16: 0.39799999999999996 | P16: 73.07 | Q16: 转股中 | R16: 4.35年 | S16: 2.35年 | T16: 16.6 | U16: 12 | V16: 6.9999999999999993e-003 | W16: 0.27600000000000002 | X16: 0.20199999999999999 | Y16: 60 | Z16: 0.85 | AA16: 3.8199999999999998e-002 | AB16: 2.9900000000000003e-002 | AC16: 7.7000000000000002e-003 | AD16: 4.5000000000000005e-003 | AE16: 95.6 | AF16: 103.57 | AG16: 0.18 | AH16: AA+ | AI16: 3.49e-002 | AJ16: =H16+100*O16 -> 141.95999999999998 | AK16: 131.3 | AL16: 48 | AM16: 27.7 | AN16: 16 | AO16: -1.3000000000000001e-002 | AP16: 45 | AQ16: 建工转债!
A17: 364 | B17: 128015 | C17: 久其转债! | D17: 2279 | E17: 久其软件 | F17: 计算机及 | G17: 软件开发 | H17: 102.4 | I17: 0. | J17: 0. | K17: 4.64 | L17: -1.0700000000000001e-002 | M17: 109.5 | N17: 6.97 | O17: 0.53799999999999992 | P17: 66.57 | Q17: 转股中 | R17: 1.82年 | S17: 回售内 | T17: 7.8 | U17: 6.4 | V17: 8.0000000000000002e-003 | W17: 0.23600000000000002 | X17: 0.157 | Y17: 33 | Z17: 3.83 | AA17: 3.78e-002 | AB17: 2.7799999999999998e-002 | AC17: 回售内 | AD17: 回售内 | AE17: 100.25 | AF17: 96.85 | AG17: 0 | AH17: A+ | AI17: 7.0400000000000004e-002 | AJ17: =H17+100*O17 -> 156.19999999999999 | AK17: 138.2 | AL17: 124 | AM17: 38 | AN17: 76 | AO17: -1.9e-002 | AP17: 67 | AQ17: 久其转债!
A18: 290 | B18: 113530 | C18: 大丰转债! | D18: 603081 | E18: 大丰实业 | F18: 建筑 | G18: 装饰工程 | H18: 106.2 | I18: -3.3e-003 | J18: -2.0000000000000001e-004 | K18: 11.61 | L18: -2.9300000000000003e-002 | M18: 121 | N18: 16.49 | O18: 0.50800000000000001 | P18: 70.41 | Q18: 转股中 | R18: 3.62年 | S18: 1.62年 | T18: 6.3 | U18: 5.4 | V18: 8.0000000000000002e-003 | W18: 0.13500000000000001 | X18: 9.5000000000000001e-002 | Y18: 47 | Z18: 2.1 | AA18: 3.7499999999999999e-002 | AB18: 2.7099999999999999e-002 | AC18: -1.7600000000000001e-002 | AD18: -2.07e-002 | AE18: 96.02 | AF18: 105.33 | AG18: 0.12 | AH18: AA | AI18: 3.9900000000000005e-002 | AJ18: =H18+100*O18 -> 157. | AK18: 142 | AL18: 161 | AM18: 36.7 | AN18: 60 | AO18: 3.6000000000000004e-002 | AP18: 31 | AQ18: 大丰转债!
A19: 125 | B19: 128132 | C19: 交建转债! | D19: 2941 | E19: 新疆交建 | F19: 建筑 | G19: 建筑工程 | H19: 98.234 | I19: -1.2999999999999999e-003 | J19: 8.9999999999999998e-004 | K19: 9.95 | L19: -5.0000000000000001e-003 | M19: 117.3 | N19: 18.53 | O19: 0.82900000000000007 | P19: 53.7 | Q19: 转股中 | R19: 5年32天 | S19: 3年33天 | T19: 8.5 | U19: 6.2 | V19: 6.9999999999999993e-003 | W19: 0.13200000000000001 | X19: 7.0999999999999994e-002 | Y19: 64 | Z19: 2.64 | AA19: 3.6299999999999999e-002 | AB19: 2.9900000000000003e-002 | AC19: 1.7299999999999999e-002 | AD19: 1.49e-002 | AE19: 91.15 | AF19: 95.93 | AG19: 0.07 | AH19: AA | AI19: 4.1200000000000001e-002 | AJ19: =H19+100*O19 -> 181.13400000000001 | AK19: 142.8 | AL19: 172 | AM19: 46.8 | AN19: 143 | AO19: -8.0000000000000002e-003 | AP19: 20 | AQ19: 交建转债!
A20: 166 | B20: 128117 | C20: 道恩转债! | D20: 2838 | E20: 道恩股份 | F20: 化工 | G20: 橡胶塑料 | H20: 103.91 | I20: 2.e-003 | J20: 1.4000000000000002e-003 | K20: 16.8 | L20: 2.1299999999999999e-002 | M20: 123.1 | N20: 28.83 | O20: 0.78299999999999992 | P20: 58.27 | Q20: 转股中 | R20: 4.88年 | S20: 2.89年 | T20: 3.6 | U20: 22 | V20: 5.7000000000000002e-002 | W20: 5.2999999999999999e-002 | X20: 3.1e-002 | Y20: 69 | Z20: 3.61 | AA20: 3.6000000000000004e-002 | AB20: 2.76e-002 | AC20: -1.5e-003 | AD20: -3.7000000000000002e-003 | AE20: 86.49 | AF20: 92.72 | AG20: 0.16 | AH20: AA- | AI20: 6.0899999999999996e-002 | AJ20: =H20+100*O20 -> 182.20999999999998 | AK20: 149.5 | AL20: 218 | AM20: 56.8 | AN20: 220 | AO20: 3.4000000000000002e-002 | AP20: 22 | AQ20: 道恩转债!
A21: 271 | B21: 123028 | C21: 清水转债! | D21: 300437 | E21: 清水源 | F21: 城市公用 | G21: 三废处理 | H21: 106.29 | I21: -3.2000000000000002e-003 | J21: -2.3999999999999998e-003 | K21: 9.72 | L21: -1.32e-002 | M21: 121 | N21: 11.84 | O21: 0.29499999999999998 | P21: 82.09 | Q21: 转股中 | R21: 3.85年 | S21: 1.85年 | T21: 4.55 | U21: 7.4 | V21: 1.4999999999999999e-002 | W21: 0.21199999999999999 | X21: 0.17399999999999999 | Y21: 22 | Z21: 1.94 | AA21: 3.5099999999999999e-002 | AB21: 2.53e-002 | AC21: -1.1200000000000002e-002 | AD21: -1.4999999999999999e-002 | AE21: 90.47 | AF21: 93.25 | AG21: 0.42 | AH21: A+ | AI21: 7.1900000000000006e-002 | AJ21: =H21+100*O21 -> 135.79000000000002 | AK21: 130.5 | AL21: 43 | AM21: 37.2 | AN21: 69 | AO21: 4.2000000000000003e-002 | AP21: 51 | AQ21: 清水转债!
A22: 285 | B22: 128063 | C22: 未来转债! | D22: 2631 | E22: 德尔未来 | F22: 其他 | G22: 家居用品 | H22: 113 | I22: 1.1399999999999999e-002 | J22: 9.8999999999999991e-003 | K22: 7.28 | L22: 6.59e-002 | M22: 127.5 | N22: 8.6 | O22: 0.33500000000000002 | P22: 84.65 | Q22: 转股中 | R22: 3.64年 | S22: 2.64年 | T22: 6.3 | U22: 81 | V22: 0.113 | W22: 0.13 | X22: 0.11 | Y22: 48 | Z22: 2.88 | AA22: 3.4799999999999998e-002 | AB22: 2.18e-002 | AC22: -1.5800000000000002e-002 | AD22: -2.1099999999999997e-002 | AE22: 91.99 | AF22: 103.48 | AG22: 0.32 | AH22: AA- | AI22: 6.0899999999999996e-002 | AJ22: =H22+100*O22 -> 146.5 | AK22: 141.3 | AL22: 154 | AM22: 37.9 | AN22: 75 | AO22: 0.129 | AP22: 31 | AQ22: 未来转债!
A23: 277 | B23: 128066 | C23: 亚泰转债! | D23: 2811 | E23: 郑中设计 | F23: 建筑 | G23: 装饰工程 | H23: 103.3 | I23: 2.8000000000000004e-003 | J23: 2.9999999999999997e-004 | K23: 7.78 | L23: 7.8000000000000005e-003 | M23: 116.7 | N23: 9.27 | O23: 0.23100000000000001 | P23: 83.93 | Q23: 转股中 | R23: 3.67年 | S23: 1.68年 | T23: 4.8 | U23: 13 | V23: 2.6000000000000002e-002 | W23: 0.22800000000000001 | X23: 0.192 | Y23: 21 | Z23: 1.42 | AA23: 3.4500000000000003e-002 | AB23: 2.6000000000000002e-002 | AC23: -1.4000000000000002e-003 | AD23: -4.5999999999999999e-003 | AE23: 92.49 | AF23: 94.34 | AG23: 0.4 | AH23: AA- | AI23: 6.0899999999999996e-002 | AJ23: =H23+100*O23 -> 126.40000000000001 | AK23: 122.7 | AL23: 9 | AM23: 28.3 | AN23: 21 | AO23: 9.0000000000000011e-003 | AP23: 60 | AQ23: 亚泰转债!
A24: 370 | B24: 127003 | C24: 海印转债! | D24: 861 | E24: 海印股份 | F24: 商业零售 | G24: 商场 | H24: 107.001 | I24: 3.8e-003 | J24: -3.8e-003 | K24: 2.06 | L24: 0. | M24: 110 | N24: 2.99 | O24: 0.55299999999999994 | P24: 68.9 | Q24: 转股中 | R24: 0.82年 | S24: 回售内 | T24: 6.74 | U24: 9.2 | V24: 1.3000000000000001e-002 | W24: 0.14099999999999999 | X24: 9.6999999999999989e-002 | Y24: 48 | Z24: 1.26 | AA24: 3.4300000000000004e-002 | AB24: 1.1399999999999999e-002 | AC24: 回售内 | AD24: 回售内 | AE24: 100.33 | AF24: 107 | AG24: 0.01 | AH24: AA | AI24: 3.4300000000000004e-002 | AJ24: =H24+100*O24 -> 162.30099999999999 | AK24: 145.1 | AL24: 184 | AM24: 38.1 | AN24: 78 | AO24: 4.9000000000000002e-002 | AP24: 69 | AQ24: 海印转债!
A25: 161 | B25: 127019 | C25: 国城转债! | D25: 688 | E25: 国城矿业 | F25: 有色金属 | G25: 锌铅镍锡 | H25: 97.681 | I25: 1.1699999999999999e-002 | J25: -1.1000000000000001e-002 | K25: 10.85 | L25: 1.0200000000000001e-002 | M25: 114.8 | N25: 21.06 | O25: 0.89599999999999991 | P25: 51.52 | Q25: 转股中 | R25: 4.92年 | S25: 2.92年 | T25: 8.5 | U25: 32 | V25: 3.7999999999999999e-002 | W25: 6.9000000000000006e-002 | X25: 3.5000000000000003e-002 | Y25: 123 | Z25: 5.32 | AA25: 3.4000000000000002e-002 | AB25: 2.8300000000000002e-002 | AC25: 1.84e-002 | AD25: 1.6299999999999999e-002 | AE25: 91.63 | AF25: 95.03 | AG25: 0.06 | AH25: AA | AI25: 3.9900000000000005e-002 | AJ25: =H25+100*O25 -> 187.28100000000001 | AK25: 143.8 | AL25: 179 | AM25: 48.8 | AN25: 155 | AO25: 0.126 | AP25: 43 | AQ25: 国城转债!
A26: 133 | B26: 113601 | C26: 塞力转债! | D26: 603716 | E26: 塞力医疗 | F26: 医药 | G26: 医药商业 | H26: 103.12 | I26: 2.9999999999999997e-004 | J26: -4.1999999999999997e-003 | K26: 12.18 | L26: -1.1399999999999999e-002 | M26: 121.3 | N26: 16.98 | O26: 0.43799999999999994 | P26: 71.73 | Q26: 转股中 | R26: 5年7天 | S26: 3年8天 | T26: 5.43 | U26: 2.6 | V26: 5.0000000000000001e-003 | W26: 0.218 | X26: 0.156 | Y26: 25 | Z26: 1.6 | AA26: 3.3700000000000001e-002 | AB26: 2.6099999999999998e-002 | AC26: 3.4000000000000002e-003 | AD26: 8.0000000000000004e-004 | AE26: 86.22 | AF26: 90.28 | AG26: 0.34 | AH26: AA- | AI26: 6.2199999999999998e-002 | AJ26: =H26+100*O26 -> 146.92000000000002 | AK26: 134.5 | AL26: 81 | AM26: 44.2 | AN26: 124 | AO26: -3.5000000000000003e-002 | AP26: 38 | AQ26: 塞力转债!
A27: 138 | B27: 113600 | C27: XD新星转! | D27: 603978 | E27: 深圳新星 | F27: 有色金属 | G27: 有色行业 | H27: 106.99 | I27: 1.7899999999999999e-002 | J27: -1.32e-002 | K27: 19.07 | L27: 1.1699999999999999e-002 | M27: 126 | N27: 23.85 | O27: 0.33799999999999997 | P27: 79.96 | Q27: 转股中 | R27: 4.997年 | S27: 3年0.1天 | T27: 5.95 | U27: 30 | V27: 4.7e-002 | W27: 0.19500000000000001 | X27: 0.156 | Y27: 31 | Z27: 1.99 | AA27: 3.32e-002 | AB27: 2.4399999999999998e-002 | AC27: -1.04e-002 | AD27: -1.26e-002 | AE27: 85.98 | AF27: 93.98 | AG27: 0.4 | AH27: AA- | AI27: 6.0899999999999996e-002 | AJ27: =H27+100*O27 -> 140.78999999999999 | AK27: 134 | AL27: 72 | AM27: 40 | AN27: 97 | AO27: 2.4e-002 | AP27: 23 | AQ27: XD新星转!
A28: 330 | B28: 127007 | C28: 湖广转债! | D28: 665 | E28: 湖北广电 | F28: 传媒娱乐 | G28: 影视娱乐 | H28: 101.897 | I28: -4.0000000000000002e-004 | J28: -2.0000000000000001e-004 | K28: 3.61 | L28: -8.199999999999999e-003 | M28: 111.3 | N28: 5.58 | O28: 0.57499999999999996 | P28: 64.7 | Q28: 转股中 | R28: 2.87年 | S28: 0.87年 | T28: 12.2 | U28: 6.7 | V28: 5.0000000000000001e-003 | W28: 0.34299999999999997 | X28: 0.222 | Y28: 35 | Z28: 0.61 | AA28: 3.1699999999999999e-002 | AB28: 2.4199999999999999e-002 | AC28: -8.9999999999999998e-004 | AD28: -4.3e-003 | AE28: 98.39 | AF28: 101.42 | AG28: 0.07 | AH28: AA+ | AI28: 3.3399999999999999e-002 | AJ28: =H28+100*O28 -> 159.39699999999999 | AK28: 139.1 | AL28: 133 | AM28: 37.7 | AN28: 70 | AO28: -1.2e-002 | AP28: 18 | AQ28: 湖广转债!
A29: 314 | B29: 128049 | C29: 华源转债! | D29: 2787 | E29: 华源控股 | F29: 造纸包装 | G29: 包装材料 | H29: 103.6 | I29: 1.6000000000000001e-003 | J29: -2.5999999999999999e-003 | K29: 5.42 | L29: -3.7000000000000002e-003 | M29: 114.5 | N29: 7.37 | O29: 0.40899999999999997 | P29: 73.54 | Q29: 转股中 | R29: 3.29年 | S29: 1.29年 | T29: 3.63 | U29: 2.6 | V29: 6.9999999999999993e-003 | W29: 0.21199999999999999 | X29: 0.156 | Y29: 17 | Z29: 1.15 | AA29: 3.1600000000000003e-002 | AB29: 2.3300000000000001e-002 | AC29: -5.1000000000000004e-003 | AD29: -8.8999999999999999e-003 | AE29: 94.43 | AF29: 94.67 | AG29: 0.27 | AH29: AA- | AI29: 6.0899999999999996e-002 | AJ29: =H29+100*O29 -> 144.5 | AK29: 133.7 | AL29: 69 | AM29: 39 | AN29: 88 | AO29: 1.7000000000000001e-002 | AP29: 42 | AQ29: 华源转债!
A30: 168 | B30: 113591 | C30: 胜达转债! | D30: 603687 | E30: 大胜达 | F30: 造纸包装 | G30: 包装用纸 | H30: 104.85 | I30: -2.0000000000000001e-004 | J30: 2.0999999999999999e-003 | K30: 7.48 | L30: 4.0000000000000001e-003 | M30: 121.7 | N30: 8.76 | O30: 0.22800000000000001 | P30: 85.39 | Q30: 转股中 | R30: 4.88年 | S30: 2.88年 | T30: 5.5 | U30: 17 | V30: 2.9999999999999999e-002 | W30: 0.17899999999999999 | X30: 0.153 | Y30: 31 | Z30: 1.78 | AA30: 3.1600000000000003e-002 | AB30: 2.3700000000000002e-002 | AC30: -3.9000000000000003e-003 | AD30: -6.1999999999999998e-003 | AE30: 86.67 | AF30: 91.73 | AG30: 0.48 | AH30: AA- | AI30: 6.0899999999999996e-002 | AJ30: =H30+100*O30 -> 127.64999999999999 | AK30: 124.3 | AL30: 14 | AM30: 32.6 | AN30: 38 | AO30: 3.0000000000000001e-003 | AP30: 30 | AQ30: 胜达转债!
A31: 191 | B31: 113573 | C31: 纵横转债! | D31: 603602 | E31: 纵横通信 | F31: 通信互联 | G31: 通信设备 | H31: 107.94 | I31: -5.6999999999999993e-003 | J31: 7.000000000000001e-004 | K31: 10.92 | L31: -2.8500000000000001e-002 | M31: 124.2 | N31: 18.78 | O31: 0.85599999999999998 | P31: 58.15 | Q31: 转股中 | R31: 4.67年 | S31: 2.68年 | T31: 2.7 | U31: 1.9 | V31: 6.0000000000000001e-003 | W31: 0.121 | X31: 7.0000000000000007e-002 | Y31: 22 | Z31: 3.14 | AA31: 3.1200000000000002e-002 | AB31: 2.2099999999999998e-002 | AC31: -1.2699999999999999e-002 | AD31: -1.55e-002 | AE31: 85.65 | AF31: 90.45 | AG31: 0.18 | AH31: A+ | AI31: 7.1900000000000006e-002 | AJ31: =H31+100*O31 -> 193.53999999999999 | AK31: 157.7 | AL31: 263 | AM31: 67.3 | AN31: 270 | AO31: 1.8000000000000002e-002 | AP31: 25 | AQ31: 纵横转债!
A32: 202 | B32: 127016 | C32: 鲁泰转债! | D32: 726 | E32: 鲁 泰Ａ | F32: 服装纺织 | G32: 纺织行业 | H32: 100.85 | I32: -1.e-003 | J32: 2.0000000000000001e-004 | K32: 5.48 | L32: -7.1999999999999998e-003 | M32: 115.9 | N32: 8.71 | O32: 0.60299999999999998 | P32: 62.92 | Q32: 转股中 | R32: 4.65年 | S32: 2.65年 | T32: 14 | U32: 5.2 | V32: 4.0000000000000001e-003 | W32: 0.28899999999999998 | X32: 0.182 | Y32: 48 | Z32: 0.61 | AA32: 3.1e-002 | AB32: 2.46e-002 | AC32: 9.0000000000000011e-003 | AD32: 6.6e-003 | AE32: 93.94 | AF32: 99.11 | AG32: 0.11 | AH32: AA+ | AI32: 3.49e-002 | AJ32: =H32+100*O32 -> 161.14999999999998 | AK32: 138.8 | AL32: 129 | AM32: 39.7 | AN32: 94 | AO32: -3.3000000000000002e-002 | AP32: 21 | AQ32: 鲁泰转债!
A33: 190 | B33: 113578 | C33: 全筑转债! | D33: 603030 | E33: 全筑股份 | F33: 建筑 | G33: 装饰工程 | H33: 102.51 | I33: 1.e-003 | J33: -1.e-003 | K33: 4.31 | L33: 0. | M33: 117.9 | N33: 5.4 | O33: 0.28399999999999997 | P33: 79.81 | Q33: 转股中 | R33: 4.68年 | S33: 2.69年 | T33: 3.84 | U33: 18 | V33: 4.5999999999999999e-002 | W33: 0.16600000000000001 | X33: 0.13200000000000001 | Y33: 23 | Z33: 1.02 | AA33: 3.0899999999999997e-002 | AB33: 2.3900000000000001e-002 | AC33: 3.0999999999999999e-003 | AD33: 7.000000000000001e-004 | AE33: 92.58 | AF33: 98.5 | AG33: 0.31 | AH33: AA | AI33: 3.9900000000000005e-002 | AJ33: =H33+100*O33 -> 130.91 | AK33: 125.2 | AL33: 17 | AM33: 26.7 | AN33: 13 | AO33: 3.9e-002 | AP33: 22 | AQ33: 全筑转债!
A34: 92 | B34: 128139 | C34: 祥鑫转债! | D34: 2965 | E34: 祥鑫科技 | F34: 汽车 | G34: 零部件制 | H34: 103.31 | I34: 1.9e-003 | J34: -4.3e-003 | K34: 23.68 | L34: -9.1999999999999998e-003 | M34: 121 | N34: 36.96 | O34: 0.61199999999999999 | P34: 64.07 | Q34: 转股中 | R34: 5.30年 | S34: 3.30年 | T34: 6.47 | U34: 9.7 | V34: 1.4999999999999999e-002 | W34: 0.18100000000000002 | X34: 0.11599999999999999 | Y34: 36 | Z34: 2.02 | AA34: 3.0899999999999997e-002 | AB34: 2.3799999999999998e-002 | AC34: 1.7000000000000001e-003 | AD34: -5.0000000000000001e-004 | AE34: 84.49 | AF34: 88.49 | AG34: 0.26 | AH34: AA- | AI34: 6.2199999999999998e-002 | AJ34: =H34+100*O34 -> 164.50999999999999 | AK34: 142.6 | AL34: 169 | AM34: 54.1 | AN34: 203 | AO34: -1.7000000000000001e-002 | AP34: 14 | AQ34: 祥鑫转债!
A35: 253 | B35: 110059 | C35: 浦发转债! | D35: 600000 | E35: 浦发银行 | F35: 金融 | G35: 银行行业 | H35: 103.96 | I35: -1.e-003 | J35: 1.1000000000000001e-003 | K35: 9.18 | L35: 1.1000000000000001e-003 | M35: 117.6 | N35: 13.97 | O35: 0.58200000000000007 | P35: 65.71 | Q35: 转股中 | R35: 4.21年 | S35: 无权 | T35: 500 | U35: 156 | V35: 3.0000000000000001e-003 | W35: 0.18600000000000003 | X35: 0.122 | Y35: 2695. | Z35: 0.5 | AA35: 3.0699999999999998e-002 | AB35: 2.29e-002 | AC35: 无权 | AD35: 无权 | AE35: 无权 | AF35: 103.07 | AG35: 0.12 | AH35: AAA | AI35: 3.2899999999999999e-002 | AJ35: =H35+100*O35 -> 162.16 | AK35: 142.2 | AL35: 166 | AM35: 39.1 | AN35: 91 | AO35: -1.7000000000000001e-002 | AP35: 60 | AQ35: 浦发转债!
A36: 165 | B36: 128118 | C36: 瀛通转债! | D36: 2861 | E36: 瀛通通讯 | F36: 电子 | G36: 电子产品 | H36: 105.4 | I36: 3.0000000000000001e-003 | J36: -1.9e-003 | K36: 12.47 | L36: 6.5000000000000006e-003 | M36: 121.7 | N36: 21.12 | O36: 0.78500000000000003 | P36: 59.04 | Q36: 转股中 | R36: 4.88年 | S36: 2.89年 | T36: 3 | U36: 2.2 | V36: 6.9999999999999993e-003 | W36: 0.152 | X36: 8.9999999999999997e-002 | Y36: 20 | Z36: 1.42 | AA36: 3.0600000000000002e-002 | AB36: 2.2700000000000001e-002 | AC36: -3.8e-003 | AD36: -6.4000000000000003e-003 | AE36: 87.16 | AF36: 91.79 | AG36: 0.18 | AH36: AA- | AI36: 6.0899999999999996e-002 | AJ36: =H36+100*O36 -> 183.90000000000001 | AK36: 151.8 | AL36: 233 | AM36: 60 | AN36: 229 | AO36: 1.e-002 | AP36: 19 | AQ36: 瀛通转债!
A37: 59 | B37: 113042 | C37: 上银转债! | D37: 601229 | E37: 上海银行 | F37: 金融 | G37: 银行行业 | H37: 103.06 | I37: -2.9999999999999997e-004 | J37: -8.0000000000000004e-004 | K37: 7.23 | L37: -5.5000000000000005e-003 | M37: 120.9 | N37: 10.63 | O37: 0.51500000000000001 | P37: 68.02 | Q37: 转股中 | R37: 5.45年 | S37: 无权 | T37: 200 | U37: 136 | V37: 6.9999999999999993e-003 | W37: 0.19500000000000001 | X37: 0.13200000000000001 | Y37: 1027. | Z37: 0.59 | AA37: 3.0600000000000002e-002 | AB37: 2.3700000000000002e-002 | AC37: 无权 | AD37: 无权 | AE37: 无权 | AF37: 101.18 | AG37: 0.19 | AH37: AAA | AI37: 3.4200000000000001e-002 | AJ37: =H37+100*O37 -> 154.56 | AK37: 138.1 | AL37: 122 | AM37: 36.9 | AN37: 63 | AO37: -6.0000000000000001e-003 | AP37: 12 | AQ37: 上银转债!
A38: 270 | B38: 128069 | C38: 华森转债! | D38: 2907 | E38: 华森制药 | F38: 医药 | G38: 化学制药 | H38: 106.65 | I38: -1.4000000000000002e-003 | J38: -2.3999999999999998e-003 | K38: 12.11 | L38: -1.9400000000000001e-002 | M38: 119.3 | N38: 18.01 | O38: 0.58599999999999997 | P38: 67.24 | Q38: 转股中 | R38: 3.86年 | S38: 1.86年 | T38: 3 | U38: 3.4 | V38: 1.1000000000000001e-002 | W38: 6.2e-002 | X38: 4.0999999999999995e-002 | Y38: 49 | Z38: 4.28 | AA38: 2.9999999999999999e-002 | AB38: 2.1000000000000001e-002 | AC38: -1.8100000000000002e-002 | AD38: -2.07e-002 | AE38: 91.25 | AF38: 95.33 | AG38: 0.19 | AH38: AA- | AI38: 6.0899999999999996e-002 | AJ38: =H38+100*O38 -> 165.25 | AK38: 146.1 | AL38: 193 | AM38: 50.7 | AN38: 174 | AO38: -1.7000000000000001e-002 | AP38: 43 | AQ38: 华森转债!
A39: 301 | B39: 113021 | C39: 中信转债! | D39: 601998 | E39: 中信银行 | F39: 金融 | G39: 银行行业 | H39: 106.74 | I39: -8.0000000000000004e-004 | J39: 1.e-004 | K39: 4.59 | L39: -6.5000000000000006e-003 | M39: 118 | N39: 6.73 | O39: 0.56499999999999995 | P39: 68.2 | Q39: 转股中 | R39: 3.55年 | S39: 无权 | T39: 400 | U39: 88 | V39: 2.e-003 | W39: 0.17800000000000002 | X39: 0.121 | Y39: 2246. | Z39: 0.47 | AA39: 2.9500000000000002e-002 | AB39: 2.0199999999999999e-002 | AC39: 无权 | AD39: 无权 | AE39: 无权 | AF39: 105.54 | AG39: 0.11 | AH39: AAA | AI39: 3.2899999999999999e-002 | AJ39: =H39+100*O39 -> 163.23999999999998 | AK39: 145.3 | AL39: 186 | AM39: 39.7 | AN39: 96 | AO39: -3.9e-002 | AP39: 42 | AQ39: 中信转债!
A40: 179 | B40: 123053 | C40: 宝通转债! | D40: 300031 | E40: 宝通科技 | F40: 通信互联 | G40: 互联网 | H40: 105.585 | I40: -4.0999999999999995e-003 | J40: -4.0000000000000002e-004 | K40: 13.51 | L40: -1.7500000000000002e-002 | M40: 120.8 | N40: 20.5 | O40: 0.60199999999999998 | P40: 65.9 | Q40: 转股中 | R40: 4.81年 | S40: 2.81年 | T40: 5 | U40: 3.7 | V40: 6.9999999999999993e-003 | W40: 9.3000000000000013e-002 | X40: 6.0999999999999999e-002 | Y40: 54 | Z40: 1.74 | AA40: 2.8999999999999998e-002 | AB40: 2.1299999999999999e-002 | AC40: -6.0000000000000001e-003 | AD40: -8.3999999999999995e-003 | AE40: 87.13 | AF40: 91.46 | AG40: 0.26 | AH40: AA- | AI40: 6.0899999999999996e-002 | AJ40: =H40+100*O40 -> 165.785 | AK40: 145.3 | AL40: 185 | AM40: 53.8 | AN40: 199 | AO40: -6.0999999999999999e-002 | AP40: 10 | AQ40: 宝通转债!
A41: 172 | B41: 123056 | C41: 雪榕转债! | D41: 300511 | E41: 雪榕生物 | F41: 农业 | G41: 种植业 | H41: 105.308 | I41: 5.6999999999999993e-003 | J41: -2.9999999999999997e-004 | K41: 7.15 | L41: 2.8799999999999999e-002 | M41: 120.7 | N41: 11.77 | O41: 0.7340000000000001 | P41: 60.75 | Q41: 转股中 | R41: 4.86年 | S41: 2.86年 | T41: 5.84 | U41: 9.3 | V41: 1.4999999999999999e-002 | W41: 0.185 | X41: 0.11199999999999999 | Y41: 32 | Z41: 1.52 | AA41: 2.8999999999999998e-002 | AB41: 2.1400000000000002e-002 | AC41: -5.4000000000000003e-003 | AD41: -7.7000000000000002e-003 | AE41: 86.77 | AF41: 91.08 | AG41: 0.19 | AH41: AA- | AI41: 6.0899999999999996e-002 | AJ41: =H41+100*O41 -> 178.70800000000003 | AK41: 149.9 | AL41: 223 | AM41: 58.8 | AN41: 223 | AO41: -8.5999999999999993e-002 | AP41: 16 | AQ41: 雪榕转债!
A42: 194 | B42: 123049 | C42: 维尔转债 | D42: 300190 | E42: 维尔利 | F42: 城市公用 | G42: 三废处理 | H42: 109.194 | I42: -1.e-004 | J42: -1.2999999999999999e-003 | K42: 6.2 | L42: -3.2000000000000002e-003 | M42: 124.3 | N42: 7.38 | O42: 0.29999999999999999 | P42: 84.01 | Q42: 转股中 | R42: 4.66年 | S42: 2.67年 | T42: 9.17 | U42: 3 | V42: 3.0000000000000001e-003 | W42: 0.18899999999999997 | X42: 0.159 | Y42: 48 | Z42: 1.12 | AA42: 2.8799999999999999e-002 | AB42: 1.9799999999999998e-002 | AC42: -1.6500000000000001e-002 | AD42: -1.9299999999999998e-002 | AE42: 88.32 | AF42: 94.96 | AG42: 0.42 | AH42: AA- | AI42: 6.0899999999999996e-002 | AJ42: =H42+100*O42 -> 139.19400000000002 | AK42: 134.4 | AL42: 76 | AM42: 39.4 | AN42: 93 | AO42: -8.0000000000000002e-003 | AP42: 17 | AQ42: 维尔转债
A43: 181 | B43: 113584 | C43: 家悦转债! | D43: 603708 | E43: 家家悦 | F43: 商业零售 | G43: 超市 | H43: 100.52 | I43: 1.2999999999999999e-003 | J43: -1.4000000000000002e-003 | K43: 15.59 | L43: -8.8999999999999999e-003 | M43: 114.9 | N43: 37.53 | O43: 1.4199999999999999 | P43: 41.54 | Q43: 转股中 | R43: 4.81年 | S43: 2.81年 | T43: 6.45 | U43: 4.7 | V43: 6.9999999999999993e-003 | W43: 6.8000000000000005e-002 | X43: 2.7999999999999997e-002 | Y43: 95 | Z43: 3.37 | AA43: 2.87e-002 | AB43: 2.29e-002 | AC43: 9.5999999999999992e-003 | AD43: 7.4000000000000003e-003 | AE43: 92.12 | AF43: 95.53 | AG43: 0.01 | AH43: AA | AI43: 3.9900000000000005e-002 | AJ43: =H43+100*O43 -> 242.51999999999998 | AK43: 159.5 | AL43: 270 | AM43: 64 | AN43: 256 | AO43: 1.7000000000000001e-002 | AP43: 13 | AQ43: 家悦转债!
A44: 260 | B44: 128074 | C44: 游族转债!! | D44: 2174 | E44: 游族网络 | F44: 通信互联 | G44: 互联网 | H44: 107.117 | I44: 1.1000000000000001e-003 | J44: -3.0000000000000001e-003 | K44: 12.15 | L44: -9.0000000000000011e-003 | M44: 119.9 | N44: 16.97 | O44: 0.496 | P44: 71.6 | Q44: 转股中 | R44: 4年40天 | S44: 2年41天 | T44: 6.83 | U44: 11 | V44: 1.3999999999999999e-002 | W44: 6.0999999999999999e-002 | X44: 4.4000000000000004e-002 | Y44: 111 | Z44: 2.17 | AA44: 2.8399999999999998e-002 | AB44: 1.9699999999999999e-002 | AC44: -1.5600000000000001e-002 | AD44: -1.84e-002 | AE44: 94.68 | AF44: 98.33 | AG44: 0.21 | AH44: AA | AI44: 3.9900000000000005e-002 | AJ44: =H44+100*O44 -> 156.71700000000001 | AK44: 142.6 | AL44: 170 | AM44: 44.3 | AN44: 125 | AO44: -0.106 | AP44: 27 | AQ44: 游族转债!!
A45: 95 | B45: 123077 | C45: 汉得转债! | D45: 300170 | E45: 汉得信息 | F45: 计算机及 | G45: 软件开发 | H45: 108.89 | I45: -1.e-002 | J45: 2.2000000000000001e-003 | K45: 7.73 | L45: -2.64e-002 | M45: 125.5 | N45: 9.69 | O45: 0.36499999999999999 | P45: 79.77 | Q45: 转股中 | R45: 5.28年 | S45: 3.28年 | T45: 9.37 | U45: 59 | V45: 5.7000000000000002e-002 | W45: 0.13699999999999998 | X45: 0.109 | Y45: 68 | Z45: 2.15 | AA45: 2.7799999999999998e-002 | AB45: 1.95e-002 | AC45: -1.38e-002 | AD45: -1.5900000000000001e-002 | AE45: 90.49 | AF45: 101.84 | AG45: 0.3 | AH45: AA | AI45: 4.1200000000000001e-002 | AJ45: =H45+100*O45 -> 145.38999999999999 | AK45: 138 | AL45: 120 | AM45: 36.2 | AN45: 56 | AO45: 3.2000000000000001e-002 | AP45: 14 | AQ45: 汉得转债!
A46: 354 | B46: 128022 | C46: 众信转债! | D46: 2707 | E46: 众信旅游 | F46: 旅游餐饮 | G46: 旅游 | H46: 102.295 | I46: 0. | J46: 0. | K46: 4.48 | L46: -1.9699999999999999e-002 | M46: 108.8 | N46: 7.92 | O46: 0.80799999999999994 | P46: 56.57 | Q46: 转股中 | R46: 2.30年 | S46: 0.30年 | T46: 4.56 | U46: 9 | V46: 1.9e-002 | W46: 0.11199999999999999 | X46: 6.3e-002 | Y46: 41 | Z46: 6.08 | AA46: 2.76e-002 | AB46: 2.0199999999999999e-002 | AC46: -1.5600000000000001e-002 | AD46: -2.2000000000000002e-002 | AE46: 97.96 | AF46: 91.35 | AG46: 0 | AH46: A | AI46: 8.0399999999999985e-002 | AJ46: =H46+100*O46 -> 183.095 | AK46: 148 | AL46: 209 | AM46: 50.1 | AN46: 168 | AO46: -6.2e-002 | AP46: 33 | AQ46: 众信转债!
A47: 88 | B47: 123081 | C47: 精研转债! | D47: 300709 | E47: 精研科技 | F47: 电子 | G47: 电子产品 | H47: 105.31 | I47: 5.5000000000000005e-003 | J47: 6.1999999999999998e-003 | K47: 32.44 | L47: 5.0499999999999996e-002 | M47: 121.3 | N47: 53.4 | O47: 0.7340000000000001 | P47: 60.75 | Q47: 转股中 | R47: 5.30年 | S47: 3.31年 | T47: 5.7 | U47: 18 | V47: 2.9999999999999999e-002 | W47: 0.127 | X47: 7.6999999999999999e-002 | Y47: 45 | Z47: 2.36 | AA47: 2.76e-002 | AB47: 2.0499999999999997e-002 | AC47: -3.0000000000000001e-003 | AD47: -5.4000000000000003e-003 | AE47: 84.71 | AF47: 88.71 | AG47: 0.23 | AH47: AA- | AI47: 6.2199999999999998e-002 | AJ47: =H47+100*O47 -> 178.71000000000001 | AK47: 149.9 | AL47: 224 | AM47: 61.2 | AN47: 237 | AO47: -2.1000000000000001e-002 | AP47: 9 | AQ47: 精研转债!
A48: 234 | B48: 123039 | C48: 开润转债! | D48: 300577 | E48: 开润股份 | F48: 服装纺织 | G48: 纺织行业 | H48: 107.777 | I48: -2.5999999999999999e-003 | J48: -8.9999999999999998e-004 | K48: 17.64 | L48: -2.e-002 | M48: 121 | N48: 29.9 | O48: 0.82700000000000007 | P48: 59 | Q48: 转股中 | R48: 4.37年 | S48: 2.37年 | T48: 2.22 | U48: 5.4 | V48: 2.3e-002 | W48: 5.2000000000000005e-002 | X48: 3.1e-002 | Y48: 42 | Z48: 2.76 | AA48: 2.75e-002 | AB48: 1.89e-002 | AC48: -1.38e-002 | AD48: -1.6899999999999998e-002 | AE48: 87.47 | AF48: 90.02 | AG48: 0.18 | AH48: A+ | AI48: 7.1900000000000006e-002 | AJ48: =H48+100*O48 -> 190.477 | AK48: 156.6 | AL48: 258 | AM48: 66.5 | AN48: 266 | AO48: 5.0000000000000001e-003 | AP48: 23 | AQ48: 开润转债!
A49: 164 | B49: 113036 | C49: 宁建转债! | D49: 601789 | E49: 宁波建工 | F49: 建筑 | G49: 建筑工程 | H49: 102.89 | I49: -2.e-003 | J49: -7.000000000000001e-004 | K49: 3.49 | L49: -1.1299999999999999e-002 | M49: 116.9 | N49: 4.76 | O49: 0.40299999999999997 | P49: 73.32 | Q49: 转股中 | R49: 4.89年 | S49: 2.90年 | T49: 5.4 | U49: 1.4 | V49: 2.e-003 | W49: 0.159 | X49: 0.11599999999999999 | Y49: 34 | Z49: 1.09 | AA49: 2.69e-002 | AB49: 2.06e-002 | AC49: 1.6000000000000001e-003 | AD49: -5.0000000000000001e-004 | AE49: 91.82 | AF49: 96.87 | AG49: 0.25 | AH49: AA | AI49: 3.9900000000000005e-002 | AJ49: =H49+100*O49 -> 143.19 | AK49: 132.5 | AL49: 59 | AM49: 35.6 | AN49: 52 | AO49: -2.e-003 | AP49: 10 | AQ49: 宁建转债!
A50: 49 | B50: 113620 | C50: 傲农转债! | D50: 603363 | E50: 傲农生物 | F50: 农业 | G50: 畜牧业 | H50: 105.22 | I50: 2.0000000000000001e-004 | J50: -7.000000000000001e-004 | K50: 8.94 | L50: -3.3e-003 | M50: 121.1 | N50: 14.51 | O50: 0.70799999999999996 | P50: 61.61 | Q50: 34天 | R50: 5.57年 | S50: 3.57年 | T50: 10 | U50: 10 | V50: 1.e-002 | W50: 0.16300000000000001 | X50: 0.10099999999999999 | Y50: 61 | Z50: 2.08 | AA50: 2.6000000000000002e-002 | AB50: 1.9299999999999998e-002 | AC50: -4.1999999999999997e-003 | AD50: -6.0000000000000001e-003 | AE50: 89.2 | AF50: 97.09 | AG50: 0.15 | AH50: AA | AI50: 4.1200000000000001e-002 | AJ50: =H50+100*O50 -> 176.01999999999998 | AK50: 148.8 | AL50: 213 | AM50: 51.7 | AN50: 184 | AO50: 5.5999999999999994e-002 | AP50: 8 | AQ50: 傲农转债!
A51: 369 | B51: 128013 | C51: 洪涛转债! | D51: 2325 | E51: 洪涛股份 | F51: 建筑 | G51: 装饰工程 | H51: 105.42 | I51: 0. | J51: -3.4000000000000002e-003 | K51: 2.28 | L51: -8.6999999999999994e-003 | M51: 108 | N51: 2.32 | O51: 7.2999999999999995e-002 | P51: 98.28 | Q51: 转股中 | R51: 0.96年 | S51: 回售内 | T51: 11.5 | U51: 17 | V51: 1.3999999999999999e-002 | W51: 0.39899999999999997 | X51: 0.39200000000000002 | Y51: 29 | Z51: 1.06 | AA51: 2.5499999999999998e-002 | AB51: 9.7000000000000003e-003 | AC51: 回售内 | AD51: 回售内 | AE51: 100.33 | AF51: 99.76 | AG51: 0.4 | AH51: A- | AI51: 8.6300000000000002e-002 | AJ51: =H51+100*O51 -> 112.72 | AK51: 112.6 | AL51: 2 | AM51: 12.2 | AN51: 1 | AO51: -1.9e-002 | AP51: 93 | AQ51: 洪涛转债!
A52: 279 | B52: 127013 | C52: 创维转债! | D52: 810 | E52: 创维数字 | F52: 电子 | G52: 电子产品 | H52: 107.282 | I52: 2.3e-003 | J52: -4.0999999999999995e-003 | K52: 8.19 | L52: -1.09e-002 | M52: 117.3 | N52: 11.29 | O52: 0.47899999999999998 | P52: 72.54 | Q52: 转股中 | R52: 3.67年 | S52: 1.67年 | T52: 9.78 | U52: 1.9 | V52: 2.e-003 | W52: 0.11199999999999999 | X52: 8.1000000000000003e-002 | Y52: 87 | Z52: 2.06 | AA52: 2.5099999999999997e-002 | AB52: 1.6500000000000001e-002 | AC52: -2.3099999999999999e-002 | AD52: -2.6000000000000002e-002 | AE52: 95.72 | AF52: 101.88 | AG52: 0.16 | AH52: AA | AI52: 3.9900000000000005e-002 | AJ52: =H52+100*O52 -> 155.18199999999999 | AK52: 142 | AL52: 163 | AM52: 40.1 | AN52: 99 | AO52: -2.7000000000000003e-002 | AP52: 23 | AQ52: 创维转债!
A53: 221 | B53: 113566 | C53: 翔港转债! | D53: 603499 | E53: 翔港科技 | F53: 造纸包装 | G53: 包装材料 | H53: 111.16 | I53: -2.2000000000000001e-003 | J53: 1.7000000000000001e-003 | K53: 7.33 | L53: -1.4000000000000002e-003 | M53: 124 | N53: 10.77 | O53: 0.63300000000000001 | P53: 68.06 | Q53: 转股中 | R53: 4.54年 | S53: 2.55年 | T53: 1.61 | U53: 0.9 | V53: 5.0000000000000001e-003 | W53: 0.109 | X53: 7.400000000000001e-002 | Y53: 15 | Z53: 2.6 | AA53: 2.4900000000000002e-002 | AB53: 1.5800000000000002e-002 | AC53: -2.4e-002 | AD53: -2.6800000000000001e-002 | AE53: 86.5 | AF53: 91.14 | AG53: 0.31 | AH53: A+ | AI53: 7.1900000000000006e-002 | AJ53: =H53+100*O53 -> 174.45999999999998 | AK53: 154.3 | AL53: 247 | AM53: 63.1 | AN53: 252 | AO53: -3.0000000000000001e-003 | AP53: 28 | AQ53: 翔港转债!
A54: 169 | B54: 128116 | C54: 瑞达转债! | D54: 2961 | E54: 瑞达期货 | F54: 金融 | G54: 期货行业 | H54: 102.131 | I54: -5.0000000000000001e-004 | J54: -2.0999999999999999e-003 | K54: 20.06 | L54: -1.18e-002 | M54: 114.9 | N54: 29.55 | O54: 0.504 | P54: 67.88 | Q54: 转股中 | R54: 4.87年 | S54: 2.88年 | T54: 6.5 | U54: 2.6 | V54: 4.0000000000000001e-003 | W54: 7.2999999999999995e-002 | X54: 4.9000000000000002e-002 | Y54: 89 | Z54: 4.55 | AA54: 2.4900000000000002e-002 | AB54: 1.9199999999999998e-002 | AC54: 3.8e-003 | AD54: 1.7000000000000001e-003 | AE54: 91.8 | AF54: 95.28 | AG54: 0.22 | AH54: AA | AI54: 3.9900000000000005e-002 | AJ54: =H54+100*O54 -> 152.53100000000001 | AK54: 136.4 | AL54: 100 | AM54: 41.1 | AN54: 107 | AO54: 2.e-003 | AP54: 19 | AQ54: 瑞达转债!
A55: 22 | B55: 113624 | C55: 正川转债! | D55: 603976 | E55: 正川股份 | F55: 医药 | G55: 医药行业 | H55: 106 | I55: -4.0000000000000001e-003 | J55: -1.6000000000000001e-003 | K55: 35.89 | L55: -1.1000000000000001e-002 | M55: 121.6 | N55: 46.69 | O55: 0.379 | P55: 76.87 | Q55: 2月27天 | R55: 5.70年 | S55: 3.71年 | T55: 4.05 | U55: 14 | V55: 3.2000000000000001e-002 | W55: 7.4999999999999997e-002 | X55: 5.7000000000000002e-002 | Y55: 54 | Z55: 5.14 | AA55: 2.4900000000000002e-002 | AB55: 1.8200000000000001e-002 | AC55: -3.4000000000000002e-003 | AD55: -5.6999999999999993e-003 | AE55: 79.83 | AF55: 82.04 | AG55: 0.52 | AH55: A+ | AI55: 7.3200000000000001e-002 | AJ55: =H55+100*O55 -> 143.90000000000001 | AK55: 135.1 | AL55: 88 | AM55: 53.1 | AN55: 194 | AO55: -2.e-003 | AP55: 14 | AQ55: 正川转债!
A56: 286 | B56: 113532 | C56: 海环转债! | D56: 603817 | E56: 海峡环保 | F56: 城市公用 | G56: 三废处理 | H56: 102.93 | I56: -3.0999999999999999e-003 | J56: 4.1999999999999997e-003 | K56: 5.59 | L56: 5.4000000000000003e-003 | M56: 112.3 | N56: 7.63 | O56: 0.40500000000000003 | P56: 73.26 | Q56: 转股中 | R56: 3.63年 | S56: 1.64年 | T56: 4.59 | U56: 1.4 | V56: 3.0000000000000001e-003 | W56: 0.182 | X56: 0.13400000000000001 | Y56: 25 | Z56: 1.41 | AA56: 2.4700000000000003e-002 | AB56: 1.83e-002 | AC56: -7.000000000000001e-004 | AD56: -3.7000000000000002e-003 | AE56: 95.85 | AF56: 97.69 | AG56: 0.21 | AH56: AA | AI56: 3.9900000000000005e-002 | AJ56: =H56+100*O56 -> 143.43000000000001 | AK56: 132.6 | AL56: 60 | AM56: 34.9 | AN56: 48 | AO56: 2.2000000000000002e-002 | AP56: 26 | AQ56: 海环转债!
A57: 350 | B57: 123004 | C57: 铁汉转债! | D57: 300197 | E57: 节能铁汉 | F57: 城市公用 | G57: 生态环境 | H57: 102.896 | I57: 8.0000000000000004e-004 | J57: 1.1999999999999999e-003 | K57: 2.91 | L57: 1.3899999999999999e-002 | M57: 108.8 | N57: 3.82 | O57: 0.35100000000000003 | P57: 76.18 | Q57: 转股中 | R57: 2.35年 | S57: 0.35年 | T57: 8.03 | U57: 12 | V57: 1.4999999999999999e-002 | W57: 9.8000000000000004e-002 | X57: 7.400000000000001e-002 | Y57: 82 | Z57: 1.25 | AA57: 2.4500000000000001e-002 | AB57: 1.72e-002 | AC57: -2.5399999999999999e-002 | AD57: -3.1099999999999999e-002 | AE57: 99.61 | AF57: 99.73 | AG57: 0.14 | AH57: AA | AI57: 3.8399999999999997e-002 | AJ57: =H57+100*O57 -> 137.99600000000001 | AK57: 129.6 | AL57: 36 | AM57: 29.9 | AN57: 26 | AO57: 1.2e-002 | AP57: 45 | AQ57: 铁汉转债!
A58: 142 | B58: 128125 | C58: 华阳转债! | D58: 2949 | E58: 华阳国际 | F58: 建筑 | G58: 建筑工程 | H58: 105 | I58: 2.9999999999999997e-004 | J58: -1.2999999999999999e-003 | K58: 16.78 | L58: -3.5999999999999999e-003 | M58: 118.1 | N58: 25.39 | O58: 0.58899999999999997 | P58: 66.09 | Q58: 转股中 | R58: 4.96年 | S58: 2.96年 | T58: 4.5 | U58: 1.4 | V58: 3.0000000000000001e-003 | W58: 0.13699999999999998 | X58: 8.9999999999999997e-002 | Y58: 33 | Z58: 2.58 | AA58: 2.4399999999999998e-002 | AB58: 1.78e-002 | AC58: -4.7999999999999996e-003 | AD58: -6.8999999999999999e-003 | AE58: 86.1 | AF58: 88.57 | AG58: 0.28 | AH58: AA- | AI58: 6.0899999999999996e-002 | AJ58: =H58+100*O58 -> 163.90000000000001 | AK58: 143.9 | AL58: 180 | AM58: 55.3 | AN58: 213 | AO58: 8.0000000000000002e-003 | AP58: 7 | AQ58: 华阳转债!
A59: 151 | B59: 113037 | C59: 紫银转债! | D59: 601860 | E59: 紫金银行 | F59: 金融 | G59: 银行行业 | H59: 102.97 | I59: -4.0999999999999995e-003 | J59: 2.e-003 | K59: 3.26 | L59: -6.0999999999999995e-003 | M59: 115.6 | N59: 4.05 | O59: 0.27899999999999997 | P59: 80.49 | Q59: 转股中 | R59: 4.94年 | S59: 无权 | T59: 45 | U59: 24 | V59: 5.0000000000000001e-003 | W59: 0.377 | X59: 0.30299999999999999 | Y59: 119 | Z59: 0.81 | AA59: 2.4199999999999999e-002 | AB59: 1.84e-002 | AC59: 无权 | AD59: 无权 | AE59: 无权 | AF59: 97.92 | AG59: 0.33 | AH59: AA+ | AI59: 3.49e-002 | AJ59: =H59+100*O59 -> 130.87 | AK59: 125.4 | AL59: 18 | AM59: 27.5 | AN59: 14 | AO59: -2.7000000000000003e-002 | AP59: 22 | AQ59: 紫银转债!
A60: 21 | B60: 127034 | C60: 绿茵转债 | D60: 2887 | E60: 绿茵生态 | F60: 城市公用 | G60: 生态环境 | H60: 104.152 | I60: -2.3999999999999998e-003 | J60: 5.5000000000000005e-003 | K60: 10.61 | L60: 5.6999999999999993e-003 | M60: 119 | N60: 12.38 | O60: 0.215 | P60: 85.7 | Q60: 3月0天 | R60: 5.71年 | S60: 3.71年 | T60: 7.12 | U60: 9.9 | V60: 1.3000000000000001e-002 | W60: 0.215 | X60: 0.184 | Y60: 33 | Z60: 1.64 | AA60: 2.41e-002 | AB60: 1.8100000000000002e-002 | AC60: -5.9999999999999995e-004 | AD60: -2.5000000000000001e-003 | AE60: 82.43 | AF60: 84.91 | AG60: 0.55 | AH60: AA- | AI60: 6.2199999999999998e-002 | AJ60: =H60+100*O60 -> 125.652 | AK60: 122.6 | AL60: 8 | AM60: 37.7 | AN60: 72 | AO60: -4.9000000000000002e-002 | AP60: 21 | AQ60: 绿茵转债
A61: 238 | B61: 128087 | C61: 孚日转债! | D61: 2083 | E61: 孚日股份 | F61: 服装纺织 | G61: 家纺 | H61: 102.65 | I61: -4.0000000000000002e-004 | J61: -3.7000000000000002e-003 | K61: 4.04 | L61: -7.4000000000000003e-003 | M61: 112.9 | N61: 4.5 | O61: 0.14300000000000002 | P61: 89.78 | Q61: 转股中 | R61: 4.34年 | S61: 2.35年 | T61: 6.5 | U61: 9.7 | V61: 1.3999999999999999e-002 | W61: 0.17699999999999999 | X61: 0.159 | Y61: 37 | Z61: 0.99 | AA61: 2.2599999999999999e-002 | AB61: 1.7000000000000001e-002 | AC61: 2.8999999999999998e-003 | AD61: 2.9999999999999997e-004 | AE61: 89.28 | AF61: 87.83 | AG61: 0.55 | AH61: AA- | AI61: 6.0899999999999996e-002 | AJ61: =H61+100*O61 -> 116.95 | AK61: 115.5 | AL61: 3 | AM61: 26.2 | AN61: 12 | AO61: -1.3999999999999999e-002 | AP61: 68 | AQ61: 孚日转债!
A62: 140 | B62: 113599 | C62: 嘉友转债! | D62: 603871 | E62: 嘉友国际 | F62: 交通运输 | G62: 物流业 | H62: 112.6 | I62: 1.52e-002 | J62: -1.e-003 | K62: 17.1 | L62: 2.76e-002 | M62: 125.6 | N62: 18.32 | O62: 0.20600000000000002 | P62: 93.34 | Q62: 转股中 | R62: 4.98年 | S62: 2.98年 | T62: 7.2 | U62: 13 | V62: 1.6e-002 | W62: 0.14800000000000002 | X62: 0.13800000000000001 | Y62: 49 | Z62: 1.75 | AA62: 2.2599999999999999e-002 | AB62: 1.3899999999999999e-002 | AC62: -2.6600000000000002e-002 | AD62: -2.86e-002 | AE62: 86.09 | AF62: 94.1 | AG62: 0.51 | AH62: AA- | AI62: 6.0899999999999996e-002 | AJ62: =H62+100*O62 -> 133.19999999999999 | AK62: 131.9 | AL62: 53 | AM62: 37.8 | AN62: 73 | AO62: 5.7000000000000002e-002 | AP62: 19 | AQ62: 嘉友转债!
A63: 241 | B63: 128083 | C63: 新北转债! | D63: 2376 | E63: 新北洋 | F63: 电子 | G63: 电子产品 | H63: 105.3 | I63: 1.9e-003 | J63: -1.9e-003 | K63: 8.49 | L63: 0. | M63: 114.9 | N63: 11.45 | O63: 0.41999999999999998 | P63: 74.15 | Q63: 转股中 | R63: 4.33年 | S63: 2.33年 | T63: 8.77 | U63: 1.9 | V63: 2.e-003 | W63: 0.155 | X63: 0.115 | Y63: 57 | Z63: 1.63 | AA63: 2.0799999999999999e-002 | AB63: 1.44e-002 | AC63: -7.3000000000000001e-003 | AD63: -1.e-002 | AE63: 93.87 | AF63: 97.34 | AG63: 0.25 | AH63: AA | AI63: 3.9900000000000005e-002 | AJ63: =H63+100*O63 -> 147.30000000000001 | AK63: 136.5 | AL63: 102 | AM63: 39.1 | AN63: 90 | AO63: -2.8999999999999998e-002 | AP63: 20 | AQ63: 新北转债!
A64: 57 | B64: 123096 | C64: 思创转债! | D64: 300078 | E64: 思创医惠 | F64: 通信互联 | G64: 物联网 | H64: 111.12 | I64: -9.3999999999999986e-003 | J64: -2.3999999999999998e-003 | K64: 7.07 | L64: -2.35e-002 | M64: 124 | N64: 8.26 | O64: 0.29799999999999999 | P64: 85.59 | Q64: 转股中 | R64: 5.45年 | S64: 3.45年 | T64: 8.17 | U64: 4.4 | V64: 5.0000000000000001e-003 | W64: 0.13300000000000001 | X64: 0.114 | Y64: 61 | Z64: 2.06 | AA64: 2.07e-002 | AB64: 1.32e-002 | AC64: -1.8500000000000003e-002 | AD64: -2.0499999999999997e-002 | AE64: 83.72 | AF64: 89.83 | AG64: 0.5 | AH64: AA- | AI64: 6.2199999999999998e-002 | AJ64: =H64+100*O64 -> 140.92000000000002 | AK64: 136.6 | AL64: 105 | AM64: 46.8 | AN64: 142 | AO64: -6.0999999999999999e-002 | AP64: 6 | AQ64: 思创转债!
A65: 203 | B65: 113033 | C65: 利群转债! | D65: 601366 | E65: 利群股份 | F65: 商业零售 | G65: 商场 | H65: 104.79 | I65: -4.4000000000000003e-003 | J65: 4.4000000000000003e-003 | K65: 6.45 | L65: 0. | M65: 114.9 | N65: 7.01 | O65: 0.13900000000000001 | P65: 92.01 | Q65: 转股中 | R65: 4.63年 | S65: 2.63年 | T65: 18 | U65: 9.7 | V65: 5.0000000000000001e-003 | W65: 0.32400000000000001 | X65: 0.29799999999999999 | Y65: 56 | Z65: 1.2 | AA65: 2.0499999999999997e-002 | AB65: 1.4499999999999999e-002 | AC65: -4.7999999999999996e-003 | AD65: -7.0999999999999995e-003 | AE65: 92.77 | AF65: 96.2 | AG65: 0.47 | AH65: AA | AI65: 3.9900000000000005e-002 | AJ65: =H65+100*O65 -> 118.69000000000001 | AK65: 117.6 | AL65: 5 | AM65: 21.4 | AN65: 5 | AO65: 1.6e-002 | AP65: 63 | AQ65: 利群转债!
A66: 155 | B66: 113594 | C66: 淳中转债! | D66: 603516 | E66: 淳中科技 | F66: 电子 | G66: 电子产品 | H66: 109.77 | I66: -6.1999999999999998e-003 | J66: -2.7000000000000001e-003 | K66: 19.44 | L66: -2.41e-002 | M66: 120.9 | N66: 27.84 | O66: 0.57200000000000006 | P66: 69.83 | Q66: 转股中 | R66: 4.93年 | S66: 2.94年 | T66: 3 | U66: 6.4 | V66: 1.9e-002 | W66: 8.3000000000000004e-002 | X66: 5.7999999999999996e-002 | Y66: 36 | Z66: 3.84 | AA66: 2.0199999999999999e-002 | AB66: 1.2699999999999999e-002 | AC66: -1.72e-002 | AD66: -1.9599999999999999e-002 | AE66: 84.07 | AF66: 86.47 | AG66: 0.37 | AH66: A+ | AI66: 7.1900000000000006e-002 | AJ66: =H66+100*O66 -> 166.97 | AK66: 149.7 | AL66: 221 | AM66: 63.2 | AN66: 253 | AO66: -3.7999999999999999e-002 | AP66: 9 | AQ66: 淳中转债!
A67: 148 | B67: 128123 | C67: 国光转债! | D67: 2749 | E67: 国光股份 | F67: 化工 | G67: 农化 | H67: 105.25 | I67: -5.1999999999999998e-003 | J67: 3.4999999999999996e-003 | K67: 9.02 | L67: -5.5000000000000005e-003 | M67: 115.7 | N67: 13.48 | O67: 0.57299999999999995 | P67: 66.91 | Q67: 转股中 | R67: 4.95年 | S67: 2.95年 | T67: 3.2 | U67: 1.6 | V67: 5.0000000000000001e-003 | W67: 8.1000000000000003e-002 | X67: 5.4000000000000006e-002 | Y67: 39 | Z67: 3.11 | AA67: 1.9699999999999999e-002 | AB67: 1.3899999999999999e-002 | AC67: -5.0000000000000001e-003 | AD67: -7.3000000000000001e-003 | AE67: 86.31 | AF67: 86.87 | AG67: 0.3 | AH67: AA- | AI67: 6.0899999999999996e-002 | AJ67: =H67+100*O67 -> 162.55000000000001 | AK67: 143.6 | AL67: 177 | AM67: 56.7 | AN67: 219 | AO67: 3.6000000000000004e-002 | AP67: 12 | AQ67: 国光转债!
A68: 25 | B68: 127033 | C68: 中装转2 | D68: 2822 | E68: 中装建设 | F68: 建筑 | G68: 装饰工程 | H68: 105.01 | I68: -1.8e-003 | J68: -5.0000000000000001e-004 | K68: 5.13 | L68: -5.7999999999999996e-003 | M68: 117.1 | N68: 6.28 | O68: 0.28600000000000003 | P68: 81.69 | Q68: 2月10天 | R68: 5.67年 | S68: 3.67年 | T68: 11.6 | U68: 8.6 | V68: 6.9999999999999993e-003 | W68: 0.313 | X68: 0.25600000000000001 | Y68: 37 | Z68: 1.1 | AA68: 1.9699999999999999e-002 | AB68: 1.43e-002 | AC68: -3.4999999999999996e-003 | AD68: -5.3e-003 | AE68: 88.84 | AF68: 93.51 | AG68: 0.4 | AH68: AA | AI68: 4.1200000000000001e-002 | AJ68: =H68+100*O68 -> 133.61000000000001 | AK68: 128.3 | AL68: 29 | AM68: 34.8 | AN68: 47 | AO68: -3.3000000000000002e-002 | AP68: 25 | AQ68: 中装转2
A69: 77 | B69: 113044 | C69: 大秦转债! | D69: 601006 | E69: 大秦铁路 | F69: 铁路 | G69: 铁路运输 | H69: 103.09 | I69: 2.9999999999999997e-004 | J69: -8.9999999999999998e-004 | K69: 5.89 | L69: -1.7000000000000001e-003 | M69: 114.1 | N69: 7.18 | O69: 0.25700000000000001 | P69: 82.03 | Q69: 转股中 | R69: 5.33年 | S69: 3.34年 | T69: 320 | U69: 72 | V69: 2.e-003 | W69: 0.36499999999999999 | X69: 0.29999999999999999 | Y69: 876 | Z69: 0.73 | AA69: 1.9599999999999999e-002 | AB69: 1.47e-002 | AC69: 2.3999999999999998e-003 | AD69: 2.0000000000000001e-004 | AE69: 92.48 | AF69: 95.71 | AG69: 0.36 | AH69: AAA | AI69: 3.4200000000000001e-002 | AJ69: =H69+100*O69 -> 128.78999999999999 | AK69: 124.1 | AL69: 13 | AM69: 28.4 | AN69: 22 | AO69: -8.0000000000000002e-003 | AP69: 17 | AQ69: 大秦转债!
A70: 170 | B70: 127018 | C70: 本钢转债! | D70: 761 | E70: 本钢板材 | F70: 钢铁 | G70: 炼钢 | H70: 116.8 | I70: 4.3e-003 | J70: 6.7000000000000002e-003 | K70: 5.2 | L70: 2.1600000000000001e-002 | M70: 128 | N70: 5.02 | O70: 0.128 | P70: 103.59 | Q70: 转股中 | R70: 4.87年 | S70: 2.88年 | T70: 67.5 | U70: 130 | V70: 1.7000000000000001e-002 | W70: 0.33399999999999996 | X70: 0.34600000000000003 | Y70: 202 | Z70: 0.98 | AA70: 1.95e-002 | AB70: 9.8999999999999991e-003 | AC70: -3.2199999999999999e-002 | AD70: -3.5699999999999996e-002 | AE70: 93.28 | AF70: 104.91 | AG70: 0.51 | AH70: AAA | AI70: 4.2900000000000001e-002 | AJ70: =H70+100*O70 -> 129.59999999999999 | AK70: 130 | AL70: 40 | AM70: 25.1 | AN70: 10 | AO70: 5.7999999999999996e-002 | AP70: 66 | AQ70: 本钢转债!
A71: 141 | B71: 113598 | C71: 法兰转债 | D71: 603966 | E71: 法兰泰克 | F71: 机械装备 | G71: 工程机械 | H71: 110.16 | I71: 8.0000000000000004e-004 | J71: -2.3999999999999998e-003 | K71: 7.73 | L71: -3.9000000000000003e-003 | M71: 120.8 | N71: 9.7 | O71: 0.38200000000000001 | P71: 79.69 | Q71: 转股中 | R71: 4.96年 | S71: 2.96年 | T71: 2.75 | U71: 0.8 | V71: 3.0000000000000001e-003 | W71: 0.11900000000000001 | X71: 9.5000000000000001e-002 | Y71: 23 | Z71: 1.42 | AA71: 1.9099999999999999e-002 | AB71: 1.18e-002 | AC71: -1.9199999999999998e-002 | AD71: -2.1400000000000002e-002 | AE71: 86.35 | AF71: 90.63 | AG71: 0.42 | AH71: AA- | AI71: 6.0899999999999996e-002 | AJ71: =H71+100*O71 -> 148.36000000000001 | AK71: 140.6 | AL71: 147 | AM71: 50 | AN71: 167 | AO71: -0.218 | AP71: 13 | AQ71: 法兰转债
A72: 143 | B72: 113597 | C72: 佳力转债! | D72: 603912 | E72: 佳力图 | F72: 机械装备 | G72: 专用设备 | H72: 113.15 | I72: -2.5000000000000001e-003 | J72: 2.5000000000000001e-003 | K72: 17.57 | L72: 0. | M72: 124 | N72: 23.15 | O72: 0.49099999999999999 | P72: 75.9 | Q72: 转股中 | R72: 4.96年 | S72: 2.96年 | T72: 3 | U72: 16 | V72: 4.8000000000000001e-002 | W72: 7.9000000000000001e-002 | X72: 5.9999999999999998e-002 | Y72: 38 | Z72: 4.1 | AA72: 1.9e-002 | AB72: 1.0700000000000001e-002 | AC72: -2.7000000000000003e-002 | AD72: -2.9399999999999999e-002 | AE72: 86.52 | AF72: 93.04 | AG72: 0.36 | AH72: AA- | AI72: 6.0899999999999996e-002 | AJ72: =H72+100*O72 -> 162.25 | AK72: 150.4 | AL72: 229 | AM72: 57.4 | AN72: 221 | AO72: 5.2999999999999999e-002 | AP72: 17 | AQ72: 佳力转债!
A73: 119 | B73: 113604 | C73: 多伦转债! | D73: 603528 | E73: 多伦科技 | F73: 计算机及 | G73: 软件开发 | H73: 106.79 | I73: 1.8e-003 | J73: -9.0000000000000011e-003 | K73: 8.23 | L73: -1.5600000000000001e-002 | M73: 117.3 | N73: 10.4 | O73: 0.34899999999999998 | P73: 79.13 | Q73: 转股中 | R73: 5.16年 | S73: 3.17年 | T73: 6.4 | U73: 4.4 | V73: 6.0000000000000001e-003 | W73: 0.124 | X73: 9.8000000000000004e-002 | Y73: 52 | Z73: 3.1 | AA73: 1.8700000000000001e-002 | AB73: 1.2699999999999999e-002 | AC73: -8.6e-003 | AD73: -1.0700000000000001e-002 | AE73: 85.08 | AF73: 86.47 | AG73: 0.46 | AH73: AA- | AI73: 6.2199999999999998e-002 | AJ73: =H73+100*O73 -> 141.69 | AK73: 134.4 | AL73: 77 | AM73: 48 | AN73: 149 | AO73: 2.7000000000000003e-002 | AP73: 7 | AQ73: 多伦转债!
A74: 278 | B74: 110058 | C74: 永鼎转债! | D74: 600105 | E74: 永鼎股份 | F74: 通信互联 | G74: 通信设备 | H74: 107.03 | I74: -7.4999999999999997e-003 | J74: -7.000000000000001e-004 | K74: 3.66 | L74: -2.92e-002 | M74: 114.3 | N74: 5.04 | O74: 0.47399999999999998 | P74: 72.62 | Q74: 转股中 | R74: 3.67年 | S74: 1.67年 | T74: 2.61 | U74: 5.1 | V74: 1.8000000000000002e-002 | W74: 5.2000000000000005e-002 | X74: 3.7999999999999999e-002 | Y74: 51 | Z74: 1.81 | AA74: 1.84e-002 | AB74: 1.1200000000000002e-002 | AC74: -2.18e-002 | AD74: -2.4700000000000003e-002 | AE74: 92.28 | AF74: 92.38 | AG74: 0.28 | AH74: AA- | AI74: 6.0899999999999996e-002 | AJ74: =H74+100*O74 -> 154.43000000000001 | AK74: 141.4 | AL74: 157 | AM74: 49.1 | AN74: 159 | AO74: 9.0000000000000011e-003 | AP74: 47 | AQ74: 永鼎转债!
A75: 213 | B75: 123044 | C75: 红相转债!! | D75: 300427 | E75: 红相股份 | F75: 能源电力 | G75: 电力设备 | H75: 115.41 | I75: -1.21e-002 | J75: 2.2000000000000001e-003 | K75: 15.88 | L75: -2.3399999999999997e-002 | M75: 125 | N75: 18.67 | O75: 0.35700000000000004 | P75: 85.06 | Q75: 转股中 | R75: 4.58年 | S75: 2.58年 | T75: 5.5 | U75: 127 | V75: 0.19600000000000001 | W75: 9.6000000000000002e-002 | X75: 8.199999999999999e-002 | Y75: 57 | Z75: 2.44 | AA75: 1.8000000000000002e-002 | AB75: 8.6999999999999994e-003 | AC75: -3.5900000000000001e-002 | AD75: -3.8900000000000004e-002 | AE75: 89.03 | AF75: 96.04 | AG75: 0.43 | AH75: AA- | AI75: 6.0899999999999996e-002 | AJ75: =H75+100*O75 -> 151.11000000000001 | AK75: 145.8 | AL75: 190 | AM75: 49.7 | AN75: 164 | AO75: 0.19600000000000001 | AP75: 21 | AQ75: 红相转债!!
A76: 329 | B76: 123010 | C76: 博世转债! | D76: 300422 | E76: 博世科 | F76: 城市公用 | G76: 三废处理 | H76: 105.885 | I76: -3.0999999999999999e-003 | J76: 5.4000000000000003e-003 | K76: 9.05 | L76: 1.e-002 | M76: 111.3 | N76: 12.15 | O76: 0.42200000000000004 | P76: 74.49 | Q76: 转股中 | R76: 2.89年 | S76: 0.89年 | T76: 4.3 | U76: 2.4 | V76: 5.0000000000000001e-003 | W76: 0.11699999999999999 | X76: 8.6999999999999994e-002 | Y76: 37 | Z76: 1.51 | AA76: 1.77e-002 | AB76: 1.03e-002 | AC76: -3.6499999999999998e-002 | AD76: -3.9699999999999999e-002 | AE76: 95.77 | AF76: 94.43 | AG76: 0.24 | AH76: AA- | AI76: 5.9400000000000001e-002 | AJ76: =H76+100*O76 -> 148.08500000000001 | AK76: 137.3 | AL76: 112 | AM76: 41.5 | AN76: 111 | AO76: 2.5000000000000001e-002 | AP76: 30 | AQ76: 博世转债!
A77: 200 | B77: 128105 | C77: 长集转债! | D77: 2616 | E77: 长青集团 | F77: 城市公用 | G77: 三废处理 | H77: 106.301 | I77: -1.8e-003 | J77: 8.0000000000000004e-004 | K77: 6.38 | L77: -3.0999999999999999e-003 | M77: 114.9 | N77: 7.91 | O77: 0.318 | P77: 80.66 | Q77: 转股中 | R77: 4.65年 | S77: 2.65年 | T77: 8 | U77: 3.1 | V77: 4.0000000000000001e-003 | W77: 0.16899999999999998 | X77: 0.13600000000000001 | Y77: 47 | Z77: 1.78 | AA77: 1.72e-002 | AB77: 1.1299999999999999e-002 | AC77: -9.7999999999999997e-003 | AD77: -1.21e-002 | AE77: 92.69 | AF77: 96.12 | AG77: 0.34 | AH77: AA | AI77: 3.9900000000000005e-002 | AJ77: =H77+100*O77 -> 138.101 | AK77: 131.9 | AL77: 55 | AM77: 35.8 | AN77: 54 | AO77: -2.4e-002 | AP77: 17 | AQ77: 长集转债!
A78: 139 | B78: 127021 | C78: 特发转2! | D78: 70 | E78: 特发信息 | F78: 通信互联 | G78: 通信设备 | H78: 105.65 | I78: -4.1999999999999997e-003 | J78: 1.6000000000000001e-003 | K78: 7.32 | L78: -3.0499999999999999e-002 | M78: 113 | N78: 12.33 | O78: 0.78000000000000003 | P78: 59.37 | Q78: 转股中 | R78: 3.98年 | S78: 1.98年 | T78: 5.5 | U78: 1.4 | V78: 2.e-003 | W78: 9.0999999999999998e-002 | X78: 5.4000000000000006e-002 | Y78: 60 | Z78: 2.06 | AA78: 1.72e-002 | AB78: 1.1200000000000002e-002 | AC78: -1.7399999999999999e-002 | AD78: -1.9e-002 | AE78: 93.57 | AF78: 96.87 | AG78: 0.09 | AH78: AA | AI78: 3.9900000000000005e-002 | AJ78: =H78+100*O78 -> 183.65000000000001 | AK78: 151.9 | AL78: 235 | AM78: 55.1 | AN78: 211 | AO78: -2.4e-002 | AP78: 12 | AQ78: 特发转2!
A79: 160 | B79: 123059 | C79: 银信转债! | D79: 300231 | E79: 银信科技 | F79: 计算机及 | G79: 软件开发 | H79: 113.99 | I79: -1.4000000000000002e-003 | J79: -1.1899999999999999e-002 | K79: 8.66 | L79: -2.7000000000000003e-002 | M79: 123.7 | N79: 9.72 | O79: 0.27899999999999997 | P79: 89.09 | Q79: 转股中 | R79: 4.92年 | S79: 2.92年 | T79: 3.91 | U79: 7.7 | V79: 1.7000000000000001e-002 | W79: 0.10199999999999999 | X79: 9.0999999999999998e-002 | Y79: 38 | Z79: 2.81 | AA79: 1.7100000000000001e-002 | AB79: 8.8000000000000005e-003 | AC79: -3.0699999999999998e-002 | AD79: -3.2799999999999996e-002 | AE79: 86.47 | AF79: 93.02 | AG79: 0.49 | AH79: AA- | AI79: 6.0899999999999996e-002 | AJ79: =H79+100*O79 -> 141.88999999999999 | AK79: 138.9 | AL79: 132 | AM79: 45.9 | AN79: 135 | AO79: 4.4999999999999998e-002 | AP79: 18 | AQ79: 银信转债!
A80: 127 | B80: 123065 | C80: 宝莱转债! | D80: 300246 | E80: 宝莱特 | F80: 医药 | G80: 医疗器械 | H80: 111.636 | I80: -1.9e-003 | J80: 8.9999999999999998e-004 | K80: 16.6 | L80: -2.41e-002 | M80: 121.4 | N80: 40.14 | O80: 1.7 | P80: 41.36 | Q80: 转股中 | R80: 5年21天 | S80: 3年22天 | T80: 2.19 | U80: 6.6 | V80: 2.7000000000000003e-002 | W80: 8.9999999999999997e-002 | X80: 3.7000000000000005e-002 | Y80: 24 | Z80: 2.73 | AA80: 1.7100000000000001e-002 | AB80: 9.7000000000000003e-003 | AC80: -2.1000000000000001e-002 | AD80: -2.35e-002 | AE80: 86.08 | AF80: 90.13 | AG80: 0.04 | AH80: AA- | AI80: 6.2199999999999998e-002 | AJ80: =H80+100*O80 -> 281.63599999999997 | AK80: 181.9 | AL80: 315 | AM80: 91.8 | AN80: 317 | AO80: -3.2000000000000001e-002 | AP80: 18 | AQ80: 宝莱转债!
A81: 255 | B81: 113546 | C81: 迪贝转债! | D81: 603320 | E81: 迪贝电气 | F81: 家电 | G81: 零部件制 | H81: 112.58 | I81: -6.4000000000000003e-003 | J81: 4.3e-003 | K81: 11.97 | L81: -4.1999999999999997e-003 | M81: 120.6 | N81: 14 | O81: 0.317 | P81: 85.5 | Q81: 转股中 | R81: 4.19年 | S81: 2.19年 | T81: 2.3 | U81: 0.9 | V81: 3.0000000000000001e-003 | W81: 0.14800000000000002 | X81: 0.126 | Y81: 16 | Z81: 2.24 | AA81: 1.7000000000000001e-002 | AB81: 8.3000000000000001e-003 | AC81: -3.3700000000000001e-002 | AD81: -3.6799999999999999e-002 | AE81: 88.43 | AF81: 90.81 | AG81: 0.48 | AH81: A+ | AI81: 7.1900000000000006e-002 | AJ81: =H81+100*O81 -> 144.28 | AK81: 139.7 | AL81: 139 | AM81: 48.8 | AN81: 157 | AO81: 9.0000000000000011e-003 | AP81: 38 | AQ81: 迪贝转债!
A82: 104 | B82: 110076 | C82: 华海转债! | D82: 600521 | E82: 华海药业 | F82: 医药 | G82: 医药行业 | H82: 105.71 | I82: -1.8e-003 | J82: 2.8999999999999998e-003 | K82: 18.78 | L82: 1.0200000000000001e-002 | M82: 115.1 | N82: 33.85 | O82: 0.90500000000000003 | P82: 55.48 | Q82: 转股中 | R82: 5.22年 | S82: 3.22年 | T82: 18.4 | U82: 34 | V82: 1.8000000000000002e-002 | W82: 6.6000000000000003e-002 | X82: 3.6000000000000004e-002 | Y82: 280 | Z82: 4.19 | AA82: 1.6799999999999999e-002 | AB82: 1.1399999999999999e-002 | AC82: -6.0000000000000001e-003 | AD82: -8.0000000000000002e-003 | AE82: 90.47 | AF82: 93.61 | AG82: 0.11 | AH82: AA | AI82: 4.1200000000000001e-002 | AJ82: =H82+100*O82 -> 196.20999999999998 | AK82: 155.9 | AL82: 256 | AM82: 62.3 | AN82: 245 | AO82: -6.2e-002 | AP82: 7 | AQ82: 华海转债!
A83: 97 | B83: 123076 | C83: 强力转债! | D83: 300429 | E83: 强力新材 | F83: 化工 | G83: 化工 | H83: 108.8 | I83: 1.8e-003 | J83: -5.6000000000000008e-003 | K83: 14.42 | L83: -8.8999999999999999e-003 | M83: 118.5 | N83: 18.94 | O83: 0.42899999999999999 | P83: 76.14 | Q83: 转股中 | R83: 5.27年 | S83: 3.27年 | T83: 8.5 | U83: 13 | V83: 1.3999999999999999e-002 | W83: 0.114 | X83: 8.6999999999999994e-002 | Y83: 74 | Z83: 4.21 | AA83: 1.67e-002 | AB83: 1.04e-002 | AC83: -1.3600000000000001e-002 | AD83: -1.5700000000000002e-002 | AE83: 84.59 | AF83: 86.83 | AG83: 0.42 | AH83: AA- | AI83: 6.2199999999999998e-002 | AJ83: =H83+100*O83 -> 151.69999999999999 | AK83: 141.5 | AL83: 158 | AM83: 54.6 | AN83: 206 | AO83: 3.3000000000000002e-002 | AP83: 16 | AQ83: 强力转债!
A84: 174 | B84: 128114 | C84: 正邦转债! | D84: 2157 | E84: 正邦科技 | F84: 农业 | G84: 畜牧业 | H84: 106.3 | I84: 2.3999999999999998e-003 | J84: -3.7000000000000002e-003 | K84: 9.62 | L84: -8.199999999999999e-003 | M84: 114.9 | N84: 14.76 | O84: 0.63100000000000001 | P84: 65.18 | Q84: 转股中 | R84: 4.84年 | S84: 2.84年 | T84: 16 | U84: 6.2 | V84: 4.0000000000000001e-003 | W84: 5.2999999999999999e-002 | X84: 3.4000000000000002e-002 | Y84: 303 | Z84: 1.29 | AA84: 1.6500000000000001e-002 | AB84: 1.09e-002 | AC84: -9.1999999999999998e-003 | AD84: -1.1399999999999999e-002 | AE84: 93.34 | AF84: 97.62 | AG84: 0.16 | AH84: AA+ | AI84: 3.49e-002 | AJ84: =H84+100*O84 -> 169.40000000000001 | AK84: 147.4 | AL84: 200 | AM84: 49.8 | AN84: 166 | AO84: -4.5999999999999999e-002 | AP84: 17 | AQ84: 正邦转债!
A85: 158 | B85: 128120 | C85: 联诚转债! | D85: 2921 | E85: 联诚精密 | F85: 汽车 | G85: 零部件制 | H85: 108.98 | I85: -1.e-004 | J85: 5.0000000000000001e-004 | K85: 15.51 | L85: 5.9999999999999995e-004 | M85: 117.9 | N85: 18.44 | O85: 0.29600000000000004 | P85: 84.11 | Q85: 转股中 | R85: 4.92年 | S85: 2.93年 | T85: 2.6 | U85: 2.6 | V85: 9.0000000000000011e-003 | W85: 0.158 | X85: 0.13300000000000001 | Y85: 16 | Z85: 1.6 | AA85: 1.6500000000000001e-002 | AB85: 9.8999999999999991e-003 | AC85: -1.49e-002 | AD85: -1.7399999999999999e-002 | AE85: 81.78 | AF85: 80.73 | AG85: 0.6 | AH85: A | AI85: 8.1900000000000001e-002 | AJ85: =H85+100*O85 -> 138.58000000000001 | AK85: 133.8 | AL85: 71 | AM85: 52.1 | AN85: 186 | AO85: 3.7000000000000005e-002 | AP85: 21 | AQ85: 联诚转债!
A86: 266 | B86: 128071 | C86: 合兴转债! | D86: 2228 | E86: 合兴包装 | F86: 造纸包装 | G86: 包装材料 | H86: 107.79 | I86: -1.9e-003 | J86: 0. | K86: 3.45 | L86: -5.7999999999999996e-003 | M86: 114.8 | N86: 4.18 | O86: 0.30599999999999999 | P86: 82.54 | Q86: 转股中 | R86: 4年2.1天 | S86: 2年3.1天 | T86: 3 | U86: 1.3 | V86: 4.0000000000000001e-003 | W86: 7.0000000000000007e-002 | X86: 5.7999999999999996e-002 | Y86: 43 | Z86: 1.23 | AA86: 1.6200000000000003e-002 | AB86: 9.3999999999999986e-003 | AC86: -1.9599999999999999e-002 | AD86: -2.2499999999999999e-002 | AE86: 94.97 | AF86: 98.48 | AG86: 0.34 | AH86: AA | AI86: 3.9900000000000005e-002 | AJ86: =H86+100*O86 -> 138.39000000000001 | AK86: 133 | AL86: 63 | AM86: 34.6 | AN86: 44 | AO86: -1.3000000000000001e-002 | AP86: 24 | AQ86: 合兴转债!
A87: 206 | B87: 110068 | C87: 龙净转债! | D87: 600388 | E87: 龙净环保 | F87: 城市公用 | G87: 三废处理 | H87: 106.74 | I87: 6.0999999999999995e-003 | J87: -2.8999999999999998e-003 | K87: 8.82 | L87: 9.1999999999999998e-003 | M87: 114.8 | N87: 10.55 | O87: 0.27699999999999997 | P87: 83.6 | Q87: 转股中 | R87: 4.61年 | S87: 2.61年 | T87: 20 | U87: 8.9 | V87: 4.0000000000000001e-003 | W87: 0.21199999999999999 | X87: 0.17699999999999999 | Y87: 94 | Z87: 1.55 | AA87: 1.6200000000000003e-002 | AB87: 1.03e-002 | AC87: -1.18e-002 | AD87: -1.41e-002 | AE87: 93.99 | AF87: 98.3 | AG87: 0.35 | AH87: AA+ | AI87: 3.49e-002 | AJ87: =H87+100*O87 -> 134.44 | AK87: 129.9 | AL87: 39 | AM87: 31.6 | AN87: 31 | AO87: 2.4e-002 | AP87: 33 | AQ87: 龙净转债!
A88: 109 | B88: 123073 | C88: 同和转债! | D88: 300636 | E88: 同和药业 | F88: 医药 | G88: 原料药 | H88: 112.95 | I88: 1.9e-003 | J88: -1.09e-002 | K88: 12.82 | L88: -1.61e-002 | M88: 122.4 | N88: 14.82 | O88: 0.30599999999999999 | P88: 86.5 | Q88: 转股中 | R88: 5.20年 | S88: 3.20年 | T88: 3.59 | U88: 4.2 | V88: 1.e-002 | W88: 0.13600000000000001 | X88: 0.11800000000000001 | Y88: 26 | Z88: 3.31 | AA88: 1.5900000000000001e-002 | AB88: 8.5000000000000006e-003 | AC88: -2.29e-002 | AD88: -2.5399999999999999e-002 | AE88: 82.69 | AF88: 85.56 | AG88: 0.56 | AH88: A+ | AI88: 7.3200000000000001e-002 | AJ88: =H88+100*O88 -> 143.55000000000001 | AK88: 139.4 | AL88: 135 | AM88: 53.8 | AN88: 201 | AO88: -0.13900000000000001 | AP88: 11 | AQ88: 同和转债!
A89: 99 | B89: 113608 | C89: 威派转债! | D89: 603956 | E89: 威派格 | F89: 机械装备 | G89: 专用设备 | H89: 112.24 | I89: 1.e-003 | J89: -6.5000000000000006e-003 | K89: 17.05 | L89: -9.300000000000001e-003 | M89: 121.6 | N89: 19.08 | O89: 0.25600000000000001 | P89: 89.36 | Q89: 转股中 | R89: 5.24年 | S89: 3.24年 | T89: 4.2 | U89: 10 | V89: 2.2000000000000002e-002 | W89: 5.7999999999999996e-002 | X89: 5.2000000000000005e-002 | Y89: 73 | Z89: 6.27 | AA89: 1.5800000000000002e-002 | AB89: 8.6e-003 | AC89: -2.07e-002 | AD89: -2.3199999999999998e-002 | AE89: 82.5 | AF89: 84.78 | AG89: 0.59 | AH89: A+ | AI89: 7.3200000000000001e-002 | AJ89: =H89+100*O89 -> 137.84 | AK89: 135.1 | AL89: 87 | AM89: 50.3 | AN89: 171 | AO89: 4.0000000000000001e-002 | AP89: 6 | AQ89: 威派转债!
A90: 303 | B90: 128056 | C90: 今飞转债! | D90: 2863 | E90: 今飞凯达 | F90: 汽车 | G90: 零部件制 | H90: 113.99 | I90: -1.8e-003 | J90: 1.8e-003 | K90: 5.26 | L90: 0. | M90: 120.2 | N90: 6.69 | O90: 0.45000000000000001 | P90: 78.62 | Q90: 转股中 | R90: 3.55年 | S90: 1.55年 | T90: 1.72 | U90: 3.9 | V90: 2.e-002 | W90: 6.6000000000000003e-002 | X90: 5.2000000000000005e-002 | Y90: 26 | Z90: 1.39 | AA90: 1.54e-002 | AB90: 5.4000000000000003e-003 | AC90: -5.6100000000000004e-002 | AD90: -5.96e-002 | AE90: 91.89 | AF90: 94.51 | AG90: 0.35 | AH90: A+ | AI90: 7.1900000000000006e-002 | AJ90: =H90+100*O90 -> 158.99000000000001 | AK90: 149.4 | AL90: 216 | AM90: 54.8 | AN90: 209 | AO90: 4.4000000000000004e-002 | AP90: 52 | AQ90: 今飞转债!
A91: 11 | B91: 113625 | C91: 江山转债! | D91: 603208 | E91: 江山欧派 | F91: 其他 | G91: 家居用品 | H91: 113.61 | I91: -1.9e-003 | J91: 2.5999999999999999e-003 | K91: 75.02 | L91: 1.6000000000000001e-003 | M91: 124 | N91: 97.55 | O91: 0.47700000000000004 | P91: 76.9 | Q91: 4月7天 | R91: 5.82年 | S91: 3.83年 | T91: 5.83 | U91: 6.4 | V91: 1.e-002 | W91: 7.400000000000001e-002 | X91: 5.7000000000000002e-002 | Y91: 79 | Z91: 4.69 | AA91: 1.54e-002 | AB91: 8.3999999999999995e-003 | AC91: -2.23e-002 | AD91: -2.41e-002 | AE91: 81.85 | AF91: 87.84 | AG91: 0.44 | AH91: AA- | AI91: 6.2199999999999998e-002 | AJ91: =H91+100*O91 -> 161.31 | AK91: 150.3 | AL91: 228 | AM91: 62.5 | AN91: 247 | AO91: -1.3999999999999999e-002 | AP91: 3 | AQ91: 江山转债!
A92: 293 | B92: 123023 | C92: 迪森转债! | D92: 300335 | E92: 迪森股份 | F92: 能源电力 | G92: 电力供应 | H92: 108.499 | I92: -6.9999999999999993e-003 | J92: 1.e-002 | K92: 6.06 | L92: 6.6e-003 | M92: 114.3 | N92: 6.89 | O92: 0.23399999999999999 | P92: 87.95 | Q92: 转股中 | R92: 3.60年 | S92: 2.60年 | T92: 5.29 | U92: 7.6 | V92: 1.3000000000000001e-002 | W92: 0.23399999999999999 | X92: 0.20600000000000002 | Y92: 23 | Z92: 1.62 | AA92: 1.49e-002 | AB92: 7.6e-003 | AC92: -1.32e-002 | AD92: -1.6399999999999998e-002 | AE92: 89.06 | AF92: 92.79 | AG92: 0.46 | AH92: AA- | AI92: 6.0899999999999996e-002 | AJ92: =H92+100*O92 -> 131.899 | AK92: 129 | AL92: 32 | AM92: 36.3 | AN92: 57 | AO92: 9.6000000000000002e-002 | AP92: 51 | AQ92: 迪森转债!
A93: 87 | B93: 123082 | C93: 北陆转债! | D93: 300016 | E93: 北陆药业 | F93: 医药 | G93: 化学制药 | H93: 112.999 | I93: -1.8e-003 | J93: 2.5000000000000001e-003 | K93: 8.76 | L93: 1.1000000000000001e-003 | M93: 121.7 | N93: 8.81 | O93: 0.13600000000000001 | P93: 99.43 | Q93: 转股中 | R93: 5.32年 | S93: 3.32年 | T93: 5 | U93: 16 | V93: 2.7999999999999997e-002 | W93: 0.11599999999999999 | X93: 0.115 | Y93: 43 | Z93: 2.61 | AA93: 1.44e-002 | AB93: 7.3000000000000001e-003 | AC93: -2.2099999999999998e-002 | AD93: -2.46e-002 | AE93: 82.06 | AF93: 84.4 | AG93: 0.66 | AH93: A+ | AI93: 7.3200000000000001e-002 | AJ93: =H93+100*O93 -> 126.59899999999999 | AK93: 126.6 | AL93: 23 | AM93: 42.2 | AN93: 115 | AO93: 8.0000000000000002e-003 | AP93: 14 | AQ93: 北陆转债!
A94: 222 | B94: 113565 | C94: 宏辉转债 | D94: 603336 | E94: 宏辉果蔬 | F94: 农业 | G94: 农产品加 | H94: 110.73 | I94: 5.0000000000000001e-004 | J94: 2.9999999999999997e-004 | K94: 7.02 | L94: 1.4000000000000002e-003 | M94: 117.8 | N94: 7.64 | O94: 0.20499999999999999 | P94: 91.88 | Q94: 转股中 | R94: 4.54年 | S94: 2.54年 | T94: 2.25 | U94: 9.9 | V94: 4.0000000000000001e-002 | W94: 7.2999999999999995e-002 | X94: 6.7000000000000004e-002 | Y94: 31 | Z94: 2.27 | AA94: 1.3999999999999999e-002 | AB94: 6.9999999999999993e-003 | AC94: -2.41e-002 | AD94: -2.6699999999999998e-002 | AE94: 88.55 | AF94: 90.64 | AG94: 0.54 | AH94: AA- | AI94: 6.0899999999999996e-002 | AJ94: =H94+100*O94 -> 131.23000000000002 | AK94: 129.6 | AL94: 35 | AM94: 38.9 | AN94: 86 | AO94: 4.8000000000000001e-002 | AP94: 25 | AQ94: 宏辉转债
A95: 61 | B95: 113619 | C95: 世运转债! | D95: 603920 | E95: 世运电路 | F95: 电子 | G95: 元器件制 | H95: 107.35 | I95: -1.2999999999999999e-003 | J95: -6.3e-003 | K95: 13.71 | L95: -3.04e-002 | M95: 115.2 | N95: 19.92 | O95: 0.56000000000000005 | P95: 68.83 | Q95: 转股中 | R95: 5.44年 | S95: 3.44年 | T95: 10 | U95: 8.3 | V95: 8.0000000000000002e-003 | W95: 0.13699999999999998 | X95: 9.4e-002 | Y95: 73 | Z95: 2.06 | AA95: 1.3300000000000001e-002 | AB95: 8.199999999999999e-003 | AC95: -9.5999999999999992e-003 | AD95: -1.1599999999999999e-002 | AE95: 89.78 | AF95: 92.89 | AG95: 0.25 | AH95: AA | AI95: 4.1200000000000001e-002 | AJ95: =H95+100*O95 -> 163.34999999999999 | AK95: 145.9 | AL95: 192 | AM95: 53 | AN95: 193 | AO95: 1.9e-002 | AP95: 5 | AQ95: 世运转债!
A96: 26 | B96: 110080 | C96: 东湖转债 | D96: 600133 | E96: 东湖高新 | F96: 建筑 | G96: 建筑工程 | H96: 107 | I96: 1.6000000000000001e-003 | J96: 3.2000000000000002e-003 | K96: 5.81 | L96: 8.6999999999999994e-003 | M96: 115.1 | N96: 6.05 | O96: 0.114 | P96: 96.03 | Q96: 2月4天 | R96: 5.66年 | S96: 3.66年 | T96: 15.5 | U96: 11 | V96: 6.9999999999999993e-003 | W96: 0.33500000000000002 | X96: 0.32200000000000001 | Y96: 46 | Z96: 0.85 | AA96: 1.32e-002 | AB96: 8.3000000000000001e-003 | AC96: -8.5000000000000006e-003 | AD96: -1.03e-002 | AE96: 88.88 | AF96: 91.96 | AG96: 0.55 | AH96: AA | AI96: 4.1200000000000001e-002 | AJ96: =H96+100*O96 -> 118.40000000000001 | AK96: 118 | AL96: 6 | AM96: 26 | AN96: 11 | AO96: 1.3000000000000001e-002 | AP96: 23 | AQ96: 东湖转债
A97: 310 | B97: 113524 | C97: 奇精转债! | D97: 603677 | E97: 奇精机械 | F97: 家电 | G97: 零部件制 | H97: 112.48 | I97: 6.9999999999999993e-003 | J97: -6.9999999999999993e-003 | K97: 12.3 | L97: 0. | M97: 117.3 | N97: 13.98 | O97: 0.27800000000000002 | P97: 87.98 | Q97: 转股中 | R97: 3.33年 | S97: 1.34年 | T97: 3.3 | U97: 3.9 | V97: 1.1000000000000001e-002 | W97: 0.14000000000000001 | X97: 0.12300000000000001 | Y97: 24 | Z97: 2.41 | AA97: 1.29e-002 | AB97: 3.7000000000000002e-003 | AC97: -5.8600000000000006e-002 | AD97: -6.1900000000000004e-002 | AE97: 94.14 | AF97: 96.7 | AG97: 0.41 | AH97: AA- | AI97: 6.0899999999999996e-002 | AJ97: =H97+100*O97 -> 140.28 | AK97: 137 | AL97: 110 | AM97: 40.3 | AN97: 100 | AO97: 3.4000000000000002e-002 | AP97: 43 | AQ97: 奇精转债!
A98: 263 | B98: 128073 | C98: 哈尔转债! | D98: 2615 | E98: 哈尔斯 | F98: 其他 | G98: 家居用品 | H98: 111 | I98: 0. | J98: 7.000000000000001e-004 | K98: 4.83 | L98: 2.0999999999999999e-003 | M98: 115.3 | N98: 5.71 | O98: 0.312 | P98: 84.59 | Q98: 转股中 | R98: 3年8天 | S98: 1年9天 | T98: 2.99 | U98: 6.5 | V98: 2.e-002 | W98: 0.14999999999999999 | X98: 0.127 | Y98: 20 | Z98: 2.54 | AA98: 1.29e-002 | AB98: 3.7000000000000002e-003 | AC98: -6.8699999999999997e-002 | AD98: -7.1800000000000003e-002 | AE98: 95.17 | AF98: 96.73 | AG98: 0.36 | AH98: AA- | AI98: 6.0899999999999996e-002 | AJ98: =H98+100*O98 -> 142.19999999999999 | AK98: 137.4 | AL98: 114 | AM98: 40.7 | AN98: 104 | AO98: 1.4999999999999999e-002 | AP98: 39 | AQ98: 哈尔转债!
A99: 340 | B99: 113505 | C99: 杭电转债! | D99: 603618 | E99: 杭电股份 | F99: 能源电力 | G99: 电力设备 | H99: 107.81 | I99: 2.5999999999999999e-003 | J99: 1.1999999999999999e-003 | K99: 6.14 | L99: 1.32e-002 | M99: 111.3 | N99: 7.08 | O99: 0.24299999999999999 | P99: 86.72 | Q99: 转股中 | R99: 2.56年 | S99: 0.56年 | T99: 7.5 | U99: 9.3 | V99: 1.2e-002 | W99: 0.17699999999999999 | X99: 0.153 | Y99: 42 | Z99: 1.57 | AA99: 1.2699999999999999e-002 | AB99: 4.5000000000000005e-003 | AC99: -7.5999999999999998e-002 | AD99: -8.0399999999999985e-002 | AE99: 99.05 | AF99: 101.23 | AG99: 0.29 | AH99: AA | AI99: 3.8399999999999997e-002 | AJ99: =H99+100*O99 -> 132.11000000000001 | AK99: 128.9 | AL99: 31 | AM99: 27.7 | AN99: 15 | AO99: 3.4000000000000002e-002 | AP99: 43 | AQ99: 杭电转债!
A100: 145 | B100: 128124 | C100: 科华转债! | D100: 2022 | E100: 科华生物 | F100: 医药 | G100: 生物制药 | H100: 103.5 | I100: -1.e-003 | J100: 5.0000000000000001e-004 | K100: 14.1 | L100: -2.0999999999999999e-003 | M100: 110 | N100: 21.3 | O100: 0.56399999999999995 | P100: 66.2 | Q100: 转股中 | R100: 4.95年 | S100: 2.96年 | T100: 7.38 | U100: 4.5 | V100: 6.0000000000000001e-003 | W100: 0.10199999999999999 | X100: 6.7000000000000004e-002 | Y100: 73 | Z100: 2.18 | AA100: 1.26e-002 | AB100: 8.6999999999999994e-003 | AC100: -2.3e-003 | AD100: -4.0000000000000001e-003 | AE100: 91.01 | AF100: 90.89 | AG100: 0.22 | AH100: AA | AI100: 3.9900000000000005e-002 | AJ100: =H100+100*O100 -> 159.89999999999998 | AK100: 140.8 | AL100: 149 | AM100: 49.8 | AN100: 165 | AO100: 3.0000000000000001e-003 | AP100: 21 | AQ100: 科华转债!
A101: 76 | B101: 123088 | C101: 威唐转债! | D101: 300707 | E101: 威唐工业 | F101: 汽车 | G101: 零部件制 | H101: 114 | I101: 2.5000000000000001e-002 | J101: -6.7000000000000002e-003 | K101: 18.95 | L101: 2.9900000000000003e-002 | M101: 121.6 | N101: 20.72 | O101: 0.24600000000000002 | P101: 91.46 | Q101: 转股中 | R101: 5.34年 | S101: 3.34年 | T101: 3.01 | U101: 26 | V101: 7.4999999999999997e-002 | W101: 0.10099999999999999 | X101: 9.3000000000000013e-002 | Y101: 30 | Z101: 4.31 | AA101: 1.2500000000000001e-002 | AB101: 5.4000000000000003e-003 | AC101: -2.4500000000000001e-002 | AD101: -2.69e-002 | AE101: 81.92 | AF101: 84.19 | AG101: 0.61 | AH101: A+ | AI101: 7.3200000000000001e-002 | AJ101: =H101+100*O101 -> 138.59999999999999 | AK101: 136.5 | AL101: 103 | AM101: 52.3 | AN101: 190 | AO101: 9.6999999999999989e-002 | AP101: 15 | AQ101: 威唐转债!
A102: 276 | B102: 113535 | C102: 大业转债! | D102: 603278 | E102: 大业股份 | F102: 汽车 | G102: 零部件制 | H102: 108.85 | I102: 1.1000000000000001e-003 | J102: 1.5e-003 | K102: 10.01 | L102: 1.11e-002 | M102: 112.5 | N102: 12.29 | O102: 0.33600000000000002 | P102: 81.45 | Q102: 转股中 | R102: 2.73年 | S102: 0.74年 | T102: 5 | U102: 16 | V102: 2.8999999999999998e-002 | W102: 0.17199999999999999 | X102: 0.14000000000000001 | Y102: 29 | Z102: 1.65 | AA102: 1.23e-002 | AB102: 3.9000000000000003e-003 | AC102: -7.7100000000000002e-002 | AD102: -7.9600000000000004e-002 | AE102: 97.87 | AF102: 101.6 | AG102: 0.23 | AH102: AA | AI102: 3.8399999999999997e-002 | AJ102: =H102+100*O102 -> 142.44999999999999 | AK102: 136.3 | AL102: 98 | AM102: 34.7 | AN102: 46 | AO102: 6.9000000000000006e-002 | AP102: 47 | AQ102: 大业转债!
A103: 219 | B103: 113567 | C103: 君禾转债! | D103: 603617 | E103: 君禾股份 | F103: 机械装备 | G103: 通用设备 | H103: 112.51 | I103: 3.4000000000000002e-003 | J103: -5.0000000000000001e-004 | K103: 10.25 | L103: 4.8999999999999998e-003 | M103: 118.8 | N103: 11.16 | O103: 0.22500000000000001 | P103: 91.85 | Q103: 转股中 | R103: 4.55年 | S103: 2.56年 | T103: 2.1 | U103: 2.3 | V103: 1.e-002 | W103: 0.10300000000000001 | X103: 9.4e-002 | Y103: 20 | Z103: 3.01 | AA103: 1.23e-002 | AB103: 5.0000000000000001e-003 | AC103: -2.8900000000000002e-002 | AD103: -3.1600000000000003e-002 | AE103: 86.25 | AF103: 87.26 | AG103: 0.58 | AH103: A+ | AI103: 7.1900000000000006e-002 | AJ103: =H103+100*O103 -> 135.00999999999999 | AK103: 133.2 | AL103: 66 | AM103: 45.9 | AN103: 136 | AO103: 2.e-003 | AP103: 33 | AQ103: 君禾转债!
A104: 283 | B104: 113024 | C104: 核建转债! | D104: 601611 | E104: 中国核建 | F104: 建筑 | G104: 建筑工程 | H104: 105 | I104: -2.3999999999999998e-003 | J104: -8.9999999999999998e-004 | K104: 7.15 | L104: -1.6500000000000001e-002 | M104: 109.3 | N104: 9.7 | O104: 0.42399999999999999 | P104: 73.71 | Q104: 转股中 | R104: 3.65年 | S104: 1.65年 | T104: 30 | U104: 19 | V104: 6.0000000000000001e-003 | W104: 0.158 | X104: 0.11699999999999999 | Y104: 189 | Z104: 1.6 | AA104: 1.1299999999999999e-002 | AB104: 6.4000000000000003e-003 | AC104: -1.1699999999999999e-002 | AD104: -1.46e-002 | AE104: 96.97 | AF104: 97.35 | AG104: 0.2 | AH104: AAA | AI104: 3.2899999999999999e-002 | AJ104: =H104+100*O104 -> 147.40000000000001 | AK104: 136.3 | AL104: 99 | AM104: 38.9 | AN104: 87 | AO104: 1.1000000000000001e-002 | AP104: 35 | AQ104: 核建转债!
A105: 337 | B105: 128037 | C105: 岩土转债! | D105: 2542 | E105: 中化岩土 | F105: 建筑 | G105: 建筑工程 | H105: 108.249 | I105: -7.8000000000000005e-003 | J105: 2.8000000000000004e-003 | K105: 2.82 | L105: -1.3999999999999999e-002 | M105: 111.3 | N105: 3.1 | O105: 0.19 | P105: 90.97 | Q105: 转股中 | R105: 2.58年 | S105: 0.59年 | T105: 5.99 | U105: 7.4 | V105: 1.1000000000000001e-002 | W105: 0.11800000000000001 | X105: 0.107 | Y105: 51 | Z105: 1.28 | AA105: 1.1000000000000001e-002 | AB105: 2.8999999999999998e-003 | AC105: -7.8600000000000003e-002 | AD105: -8.2899999999999988e-002 | AE105: 98.96 | AF105: 101.13 | AG105: 0.36 | AH105: AA | AI105: 3.8399999999999997e-002 | AJ105: =H105+100*O105 -> 127.249 | AK105: 125.5 | AL105: 19 | AM105: 24.4 | AN105: 8 | AO105: 1.3999999999999999e-002 | AP105: 50 | AQ105: 岩土转债!
A106: 130 | B106: 128129 | C106: 青农转债! | D106: 2958 | E106: 青农商行 | F106: 金融 | G106: 银行行业 | H106: 106.497 | I106: -2.8999999999999998e-003 | J106: -7.000000000000001e-004 | K106: 3.89 | L106: -7.7000000000000002e-003 | M106: 112.2 | N106: 4.32 | O106: 0.183 | P106: 90.05 | Q106: 转股中 | R106: 5年11天 | S106: 无权 | T106: 50 | U106: 20 | V106: 4.0000000000000001e-003 | W106: 0.23100000000000001 | X106: 0.20800000000000002 | Y106: 216 | Z106: 0.79 | AA106: 1.06e-002 | AB106: 6.0999999999999995e-003 | AC106: 无权 | AD106: 无权 | AE106: 无权 | AF106: 95 | AG106: 0.46 | AH106: AAA | AI106: 3.4200000000000001e-002 | AJ106: =H106+100*O106 -> 124.797 | AK106: 122.9 | AL106: 10 | AM106: 27.9 | AN106: 18 | AO106: -1.7000000000000001e-002 | AP106: 17 | AQ106: 青农转债!
A107: 173 | B107: 113588 | C107: 润达转债! | D107: 603108 | E107: 润达医疗 | F107: 医药 | G107: 医疗器械 | H107: 108.39 | I107: -5.0000000000000001e-003 | J107: 4.0999999999999995e-003 | K107: 10.17 | L107: -2.8999999999999998e-003 | M107: 113.9 | N107: 13.25 | O107: 0.41200000000000003 | P107: 76.75 | Q107: 转股中 | R107: 4.84年 | S107: 2.84年 | T107: 5.5 | U107: 7.9 | V107: 1.3000000000000001e-002 | W107: 9.3000000000000013e-002 | X107: 7.2000000000000008e-002 | Y107: 59 | Z107: 1.85 | AA107: 1.0500000000000001e-002 | AB107: 5.1999999999999998e-003 | AC107: -1.5600000000000001e-002 | AD107: -1.78e-002 | AE107: 92 | AF107: 94.58 | AG107: 0.31 | AH107: AA | AI107: 3.9900000000000005e-002 | AJ107: =H107+100*O107 -> 149.59 | AK107: 140 | AL107: 141 | AM107: 45.4 | AN107: 134 | AO107: -4.5999999999999999e-002 | AP107: 10 | AQ107: 润达转债!
A108: 338 | B108: 127006 | C108: 敖东转债! | D108: 623 | E108: 吉林敖东 | F108: 金融 | G108: 证券行业 | H108: 104.621 | I108: 1.5e-003 | J108: -4.0000000000000002e-004 | K108: 15.62 | L108: 5.7999999999999996e-003 | M108: 107.4 | N108: 20.22 | O108: 0.35399999999999998 | P108: 77.25 | Q108: 转股中 | R108: 2.58年 | S108: 0.58年 | T108: 24.1 | U108: 19 | V108: 8.0000000000000002e-003 | W108: 0.13300000000000001 | X108: 0.10199999999999999 | Y108: 182 | Z108: 0.79 | AA108: 1.03e-002 | AB108: 4.7999999999999996e-003 | AC108: -4.53e-002 | AD108: -4.7899999999999998e-002 | AE108: 98.62 | AF108: 98.77 | AG108: 0.18 | AH108: AA+ | AI108: 3.3399999999999999e-002 | AJ108: =H108+100*O108 -> 140.02099999999999 | AK108: 132 | AL108: 56 | AM108: 33.2 | AN108: 40 | AO108: 1.9e-002 | AP108: 28 | AQ108: 敖东转债!
A109: 254 | B109: 127014 | C109: 北方转债! | D109: 65 | E109: 北方国际 | F109: 建筑 | G109: 建筑工程 | H109: 110.562 | I109: 0. | J109: -3.9000000000000003e-003 | K109: 7.12 | L109: -1.2500000000000001e-002 | M109: 115.1 | N109: 8.65 | O109: 0.34299999999999997 | P109: 82.31 | Q109: 转股中 | R109: 4.19年 | S109: 2.20年 | T109: 5.35 | U109: 2.3 | V109: 4.0000000000000001e-003 | W109: 9.6999999999999989e-002 | X109: 8.0000000000000002e-002 | Y109: 55 | Z109: 0.99 | AA109: 9.8999999999999991e-003 | AB109: 3.3e-003 | AC109: -2.75e-002 | AD109: -3.0299999999999997e-002 | AE109: 95.63 | AF109: 100.01 | AG109: 0.31 | AH109: AA+ | AI109: 3.49e-002 | AJ109: =H109+100*O109 -> 144.86199999999999 | AK109: 138.8 | AL109: 130 | AM109: 38.8 | AN109: 85 | AO109: -5.0000000000000003e-002 | AP109: 18 | AQ109: 北方转债!
A110: 267 | B110: 113542 | C110: 好客转债! | D110: 603898 | E110: 好莱客 | F110: 其他 | G110: 家居用品 | H110: 110.02 | I110: -4.3e-003 | J110: 4.3e-003 | K110: 12.01 | L110: 0. | M110: 114.3 | N110: 16.14 | O110: 0.47899999999999998 | P110: 74.41 | Q110: 转股中 | R110: 3.96年 | S110: 1.97年 | T110: 6.03 | U110: 2.2 | V110: 3.0000000000000001e-003 | W110: 0.161 | X110: 0.12 | Y110: 37 | Z110: 1.45 | AA110: 9.7999999999999997e-003 | AB110: 3.3e-003 | AC110: -3.15e-002 | AD110: -3.4000000000000002e-002 | AE110: 94.62 | AF110: 98.14 | AG110: 0.23 | AH110: AA | AI110: 3.9900000000000005e-002 | AJ110: =H110+100*O110 -> 157.91999999999999 | AK110: 145.6 | AL110: 189 | AM110: 47.5 | AN110: 146 | AO110: -1.1000000000000001e-002 | AP110: 17 | AQ110: 好客转债!
A111: 101 | B111: 127024 | C111: 盈峰转债! | D111: 967 | E111: 盈峰环境 | F111: 机械装备 | G111: 专用设备 | H111: 111.1 | I111: 4.0000000000000001e-003 | J111: -1.2999999999999999e-003 | K111: 6.38 | L111: 9.4999999999999998e-003 | M111: 116.8 | N111: 8.19 | O111: 0.42599999999999999 | P111: 77.9 | Q111: 转股中 | R111: 5.22年 | S111: 3.23年 | T111: 14.8 | U111: 23 | V111: 1.3999999999999999e-002 | W111: 7.2999999999999995e-002 | X111: 5.7000000000000002e-002 | Y111: 202 | Z111: 1.2 | AA111: 9.7999999999999997e-003 | AB111: 4.0999999999999995e-003 | AC111: -2.1400000000000002e-002 | AD111: -2.3199999999999998e-002 | AE111: 91.65 | AF111: 97.3 | AG111: 0.29 | AH111: AA+ | AI111: 3.6200000000000003e-002 | AJ111: =H111+100*O111 -> 153.69999999999999 | AK111: 144.3 | AL111: 181 | AM111: 47 | AN111: 144 | AO111: -1.e-003 | AP111: 5 | AQ111: 盈峰转债!
A112: 144 | B112: 123063 | C112: 大禹转债 | D112: 300021 | E112: 大禹节水 | F112: 化工 | G112: 橡胶塑料 | H112: 120.388 | I112: 2.5999999999999999e-003 | J112: 2.3e-003 | K112: 5.5 | L112: 7.3000000000000001e-003 | M112: 126.1 | N112: 4.83 | O112: 5.7000000000000002e-002 | P112: 113.87 | Q112: 转股中 | R112: 4.95年 | S112: 3.96年 | T112: 6.35 | U112: 22 | V112: 2.8999999999999998e-002 | W112: 0.14400000000000002 | X112: 0.16399999999999998 | Y112: 44 | Z112: 2.89 | AA112: 9.5999999999999992e-003 | AB112: 8.0000000000000004e-004 | AC112: -2.9500000000000002e-002 | AD112: -3.2400000000000005e-002 | AE112: 83.88 | AF112: 94.65 | AG112: 0.67 | AH112: AA- | AI112: 6.0899999999999996e-002 | AJ112: =H112+100*O112 -> 126.08800000000001 | AK112: 126.9 | AL112: 24 | AM112: 32.3 | AN112: 37 | AO112: 3.6000000000000004e-002 | AP112: 18 | AQ112: 大禹转债
A113: 126 | B113: 128131 | C113: 崇达转2! | D113: 2815 | E113: 崇达技术 | F113: 电子 | G113: 元器件制 | H113: 109.99 | I113: 8.0000000000000004e-004 | J113: -9.0000000000000011e-003 | K113: 14.01 | L113: -3.1099999999999999e-002 | M113: 115.2 | N113: 19.38 | O113: 0.52100000000000002 | P113: 72.29 | Q113: 转股中 | R113: 5年24天 | S113: 3年25天 | T113: 14 | U113: 7 | V113: 5.0000000000000001e-003 | W113: 0.114 | X113: 8.199999999999999e-002 | Y113: 123 | Z113: 2.93 | AA113: 9.3999999999999986e-003 | AB113: 3.9000000000000003e-003 | AC113: -1.8200000000000001e-002 | AD113: -2.0400000000000001e-002 | AE113: 91.13 | AF113: 94.29 | AG113: 0.26 | AH113: AA | AI113: 4.1200000000000001e-002 | AJ113: =H113+100*O113 -> 162.09 | AK113: 147.7 | AL113: 203 | AM113: 53.4 | AN113: 196 | AO113: 3.4000000000000002e-002 | AP113: 10 | AQ113: 崇达转2!
A114: 81 | B114: 127027 | C114: 靖远转债! | D114: 552 | E114: 靖远煤电 | F114: 煤炭 | G114: 煤炭开采 | H114: 109.85 | I114: 2.06e-002 | J114: -1.7000000000000001e-003 | K114: 3.09 | L114: 3.6900000000000002e-002 | M114: 115.3 | N114: 3.23 | O114: 0.14800000000000002 | P114: 95.67 | Q114: 转股中 | R114: 5.32年 | S114: 3.33年 | T114: 28 | U114: 112 | V114: 3.7000000000000005e-002 | W114: 0.39600000000000002 | X114: 0.379 | Y114: 71 | Z114: 0.88 | AA114: 9.300000000000001e-003 | AB114: 4.0999999999999995e-003 | AC114: -1.6200000000000003e-002 | AD114: -1.83e-002 | AE114: 91.8 | AF114: 95.78 | AG114: 0.51 | AH114: AA+ | AI114: 3.6200000000000003e-002 | AJ114: =H114+100*O114 -> 124.64999999999999 | AK114: 124 | AL114: 12 | AM114: 28.2 | AN114: 20 | AO114: 8.199999999999999e-002 | AP114: 42 | AQ114: 靖远转债!
A115: 344 | B115: 128034 | C115: 江银转债! | D115: 2807 | E115: 江阴银行 | F115: 金融 | G115: 银行行业 | H115: 105.967 | I115: -4.0000000000000001e-003 | J115: 2.3e-003 | K115: 3.78 | L115: -5.3e-003 | M115: 108.3 | N115: 4.32 | O115: 0.21100000000000002 | P115: 87.5 | Q115: 转股中 | R115: 2.45年 | S115: 无权 | T115: 17.6 | U115: 11 | V115: 6.0000000000000001e-003 | W115: 0.214 | X115: 0.187 | Y115: 82 | Z115: 0.69 | AA115: 9.0000000000000011e-003 | AB115: 2.5999999999999999e-003 | AC115: 无权 | AD115: 无权 | AE115: 无权 | AF115: 100.01 | AG115: 0.33 | AH115: AA+ | AI115: 3.3399999999999999e-002 | AJ115: =H115+100*O115 -> 127.06700000000001 | AK115: 124.4 | AL115: 15 | AM115: 24.4 | AN115: 9 | AO115: -1.3999999999999999e-002 | AP115: 26 | AQ115: 江银转债!
A116: 114 | B116: 128135 | C116: 洽洽转债! | D116: 2557 | E116: 洽洽食品 | F116: 食品饮料 | G116: 休闲食品 | H116: 115 | I116: 0. | J116: -3.3e-003 | K116: 42.38 | L116: -1.5100000000000001e-002 | M116: 120.2 | N116: 60.03 | O116: 0.629 | P116: 70.6 | Q116: 转股中 | R116: 5.18年 | S116: 3.19年 | T116: 13.4 | U116: 2.7 | V116: 2.e-003 | W116: 6.2e-002 | X116: 4.4000000000000004e-002 | Y116: 215 | Z116: 5.03 | AA116: 8.6999999999999994e-003 | AB116: 2.e-003 | AC116: -3.0600000000000002e-002 | AD116: -3.27e-002 | AE116: 90.7 | AF116: 97.9 | AG116: 0.22 | AH116: AA | AI116: 4.1200000000000001e-002 | AJ116: =H116+100*O116 -> 177.90000000000001 | AK116: 159.4 | AL116: 269 | AM116: 61.5 | AN116: 240 | AO116: 6.4000000000000001e-002 | AP116: 11 | AQ116: 洽洽转债!
A117: 62 | B117: 123093 | C117: 金陵转债! | D117: 300651 | E117: 金陵体育 | F117: 其他 | G117: 文化教育 | H117: 123.799 | I117: -6.9999999999999993e-003 | J117: -2.e-003 | K117: 35.48 | L117: -2.2099999999999998e-002 | M117: 129.3 | N117: 49.19 | O117: 0.71599999999999997 | P117: 72.13 | Q117: 转股中 | R117: 5.43年 | S117: 3.44年 | T117: 2.5 | U117: 89 | V117: 0.28800000000000003 | W117: 5.5e-002 | X117: 3.9e-002 | Y117: 46 | Z117: 6.62 | AA117: 8.3000000000000001e-003 | AB117: -5.0000000000000001e-004 | AC117: -4.1700000000000001e-002 | AD117: -4.4900000000000002e-002 | AE117: 82.8 | AF117: 89.12 | AG117: 0.41 | AH117: A+ | AI117: 7.3200000000000001e-002 | AJ117: =H117+100*O117 -> 195.399 | AK117: 175.5 | AL117: 302 | AM117: 86.4 | AN117: 308 | AO117: -9.3000000000000013e-002 | AP117: 7 | AQ117: 金陵转债!
A118: 27 | B118: 127032 | C118: 苏行转债 | D118: 2966 | E118: 苏州银行 | F118: 金融 | G118: 银行行业 | H118: 109.9 | I118: 0. | J118: 7.000000000000001e-004 | K118: 7.02 | L118: 1.4000000000000002e-003 | M118: 115.1 | N118: 8.1 | O118: 0.26800000000000002 | P118: 86.67 | Q118: 2月6天 | R118: 5.66年 | S118: 无权 | T118: 50 | U118: 44 | V118: 8.0000000000000002e-003 | W118: 0.214 | X118: 0.185 | Y118: 234 | Z118: 0.76 | AA118: 8.3000000000000001e-003 | AB118: 3.4999999999999996e-003 | AC118: 无权 | AD118: 无权 | AE118: 无权 | AF118: 95.45 | AG118: 0.43 | AH118: AAA | AI118: 3.4200000000000001e-002 | AJ118: =H118+100*O118 -> 136.70000000000002 | AK118: 133.1 | AL118: 65 | AM118: 37.7 | AN118: 71 | AO118: -1.3999999999999999e-002 | AP118: 7 | AQ118: 苏行转债
A119: 65 | B119: 127028 | C119: 英特转债! | D119: 411. | E119: 英特集团 | F119: 医药 | G119: 医药商业 | H119: 108.35 | I119: -4.7999999999999996e-003 | J119: -8.0000000000000004e-004 | K119: 12.17 | L119: -1.1399999999999999e-002 | M119: 113.1 | N119: 13.4 | O119: 0.193 | P119: 90.82 | Q119: 转股中 | R119: 5.39年 | S119: 3.40年 | T119: 6 | U119: 18 | V119: 2.7000000000000003e-002 | W119: 0.19800000000000001 | X119: 0.17999999999999999 | Y119: 30 | Z119: 1.78 | AA119: 8.1000000000000013e-003 | AB119: 3.7000000000000002e-003 | AC119: -1.26e-002 | AD119: -1.4499999999999999e-002 | AE119: 91.38 | AF119: 93.7 | AG119: 0.49 | AH119: AA+ | AI119: 3.6200000000000003e-002 | AJ119: =H119+100*O119 -> 127.64999999999999 | AK119: 125.9 | AL119: 21 | AM119: 32.2 | AN119: 36 | AO119: -2.8999999999999998e-002 | AP119: 22 | AQ119: 英特转债!
A120: 204 | B120: 113574 | C120: 华体转债! | D120: 603679 | E120: 华体科技 | F120: 城市公用 | G120: 城市公用 | H120: 111.79 | I120: -1.e-004 | J120: -4.0000000000000002e-004 | K120: 16.23 | L120: -9.1999999999999998e-003 | M120: 115.9 | N120: 33.91 | O120: 1.3400000000000001 | P120: 47.86 | Q120: 转股中 | R120: 4.63年 | S120: 2.63年 | T120: 2.09 | U120: 4.5 | V120: 1.9e-002 | W120: 8.9999999999999997e-002 | X120: 4.2999999999999997e-002 | Y120: 23 | Z120: 2.99 | AA120: 8.0000000000000002e-003 | AB120: 1.8e-003 | AC120: -2.5499999999999998e-002 | AD120: -2.8199999999999999e-002 | AE120: 85.88 | AF120: 84.71 | AG120: 0.06 | AH120: A+ | AI120: 7.1900000000000006e-002 | AJ120: =H120+100*O120 -> 245.79000000000002 | AK120: 175.7 | AL120: 304 | AM120: 89.8 | AN120: 314 | AO120: 6.9999999999999993e-003 | AP120: 19 | AQ120: 华体转债!
A121: 35 | B121: 123107 | C121: 温氏转债! | D121: 300498 | E121: 温氏股份 | F121: 农业 | G121: 畜牧业 | H121: 108.19 | I121: 1.1999999999999999e-003 | J121: -2.3e-003 | K121: 13.46 | L121: -3.7000000000000002e-003 | M121: 113 | N121: 17.62 | O121: 0.41600000000000004 | P121: 76.39 | Q121: 56天 | R121: 5.62年 | S121: 3.62年 | T121: 93 | U121: 83 | V121: 8.0000000000000002e-003 | W121: 0.10800000000000001 | X121: 8.3000000000000004e-002 | Y121: 858 | Z121: 1.86 | AA121: 7.9000000000000008e-003 | AB121: 3.7000000000000002e-003 | AC121: -1.1699999999999999e-002 | AD121: -1.3500000000000002e-002 | AE121: 91.2 | AF121: 93.84 | AG121: 0.32 | AH121: AAA | AI121: 3.4200000000000001e-002 | AJ121: =H121+100*O121 -> 149.78999999999999 | AK121: 140 | AL121: 140 | AM121: 46.1 | AN121: 138 | AO121: 2.9999999999999999e-002 | AP121: 10 | AQ121: 温氏转债!
A122: 189 | B122: 128107 | C122: 交科转债 | D122: 2061 | E122: 浙江交科 | F122: 建筑 | G122: 建筑工程 | H122: 110.92 | I122: 0. | J122: 1.04e-002 | K122: 5.23 | L122: 1.95e-002 | M122: 114.9 | N122: 5.24 | O122: 0.111 | P122: 99.81 | Q122: 转股中 | R122: 4.69年 | S122: 2.69年 | T122: 25 | U122: 48 | V122: 1.7000000000000001e-002 | W122: 0.34700000000000003 | X122: 0.34700000000000003 | Y122: 72 | Z122: 0.84 | AA122: 7.7000000000000002e-003 | AB122: 1.9e-003 | AC122: -2.4500000000000001e-002 | AD122: -2.6699999999999998e-002 | AE122: 93.83 | AF122: 98.13 | AG122: 0.53 | AH122: AA+ | AI122: 3.49e-002 | AJ122: =H122+100*O122 -> 122.02 | AK122: 122 | AL122: 7 | AM122: 23.9 | AN122: 7 | AO122: 3.7999999999999999e-002 | AP122: 19 | AQ122: 交科转债
A123: 45 | B123: 123104 | C123: 卫宁转债 | D123: 300253 | E123: 卫宁健康 | F123: 计算机及 | G123: 软件开发 | H123: 120.095 | I123: 2.5000000000000001e-003 | J123: -1.8e-003 | K123: 14 | L123: 2.0999999999999999e-003 | M123: 125.1 | N123: 17.74 | O123: 0.52200000000000002 | P123: 78.92 | Q123: 40天 | R123: 5.59年 | S123: 3.59年 | T123: 9.7 | U123: 6.8 | V123: 6.0000000000000001e-003 | W123: 3.2000000000000001e-002 | X123: 2.6000000000000002e-002 | Y123: 300 | Z123: 6.56 | AA123: 7.4999999999999997e-003 | AB123: 0. | AC123: -3.8900000000000004e-002 | AD123: -4.0599999999999997e-002 | AE123: 89.14 | AF123: 100.22 | AG123: 0.31 | AH123: AA | AI123: 4.1200000000000001e-002 | AJ123: =H123+100*O123 -> 172.29500000000002 | AK123: 161.3 | AL123: 276 | AM123: 61.1 | AN123: 233 | AO123: -8.4000000000000005e-002 | AP123: 4 | AQ123: 卫宁转债
A124: 355 | B124: 128021 | C124: 兄弟转债!! | D124: 2562 | E124: 兄弟科技 | F124: 医药 | G124: 原料药 | H124: 106.996 | I124: -5.0000000000000001e-004 | J124: 5.9999999999999995e-004 | K124: 3.78 | L124: 5.3e-003 | M124: 108.8 | N124: 5.19 | O124: 0.46899999999999997 | P124: 72.83 | Q124: 转股中 | R124: 2.29年 | S124: 0.29年 | T124: 2.65 | U124: 4 | V124: 1.3999999999999999e-002 | W124: 6.6000000000000003e-002 | X124: 4.8000000000000001e-002 | Y124: 40 | Z124: 1.35 | AA124: 7.4000000000000003e-003 | AB124: 2.0000000000000001e-004 | AC124: -0.12 | AD124: -0.126 | AE124: 99.81 | AF124: 99.82 | AG124: 0.03 | AH124: AA | AI124: 3.8399999999999997e-002 | AJ124: =H124+100*O124 -> 153.89599999999999 | AK124: 141.2 | AL124: 153 | AM124: 41.3 | AN124: 108 | AO124: 2.2000000000000002e-002 | AP124: 17 | AQ124: 兄弟转债!!
A125: 236 | B125: 113030 | C125: 东风转债! | D125: 601515 | E125: 东风股份 | F125: 造纸包装 | G125: 包装材料 | H125: 113.33 | I125: 7.000000000000001e-004 | J125: 3.0999999999999999e-003 | K125: 6.04 | L125: 8.3000000000000001e-003 | M125: 116.9 | N125: 6.45 | O125: 0.20999999999999999 | P125: 93.64 | Q125: 转股中 | R125: 4.36年 | S125: 2.36年 | T125: 2.95 | U125: 3.3 | V125: 1.e-002 | W125: 3.7000000000000005e-002 | X125: 3.4000000000000002e-002 | Y125: 81 | Z125: 1.75 | AA125: 7.3000000000000001e-003 | AB125: 4.0000000000000002e-004 | AC125: -3.5900000000000001e-002 | AD125: -3.8399999999999997e-002 | AE125: 93.75 | AF125: 98.9 | AG125: 0.45 | AH125: AA | AI125: 3.9900000000000005e-002 | AJ125: =H125+100*O125 -> 134.32999999999998 | AK125: 133 | AL125: 62 | AM125: 34.1 | AN125: 43 | AO125: 6.0000000000000001e-003 | AP125: 18 | AQ125: 东风转债!
A126: 64 | B126: 128143 | C126: 锋龙转债! | D126: 2931 | E126: 锋龙股份 | F126: 机械装备 | G126: 专用设备 | H126: 117.176 | I126: -1.84e-002 | J126: -9.300000000000001e-003 | K126: 13.05 | L126: -4.0399999999999998e-002 | M126: 121.7 | N126: 12.73 | O126: 0.14300000000000002 | P126: 102.51 | Q126: 转股中 | R126: 5.40年 | S126: 3.41年 | T126: 2.45 | U126: 20 | V126: 6.8000000000000005e-002 | W126: 9.4e-002 | X126: 9.6999999999999989e-002 | Y126: 26 | Z126: 2.96 | AA126: 7.1999999999999998e-003 | AB126: 2.9999999999999997e-004 | AC126: -3.1600000000000003e-002 | AD126: -3.39e-002 | AE126: 81.56 | AF126: 83.88 | AG126: 0.68 | AH126: A+ | AI126: 7.3200000000000001e-002 | AJ126: =H126+100*O126 -> 131.476 | AK126: 131.8 | AL126: 52 | AM126: 48 | AN126: 148 | AO126: 8.1000000000000003e-002 | AP126: 13 | AQ126: 锋龙转债!
A127: 231 | B127: 113561 | C127: 正裕转债! | D127: 603089 | E127: 正裕工业 | F127: 汽车 | G127: 零部件制 | H127: 114.64 | I127: 6.5000000000000006e-003 | J127: -2.7000000000000001e-003 | K127: 9.27 | L127: 6.5000000000000006e-003 | M127: 118 | N127: 10.08 | O127: 0.247 | P127: 91.96 | Q127: 转股中 | R127: 4.38年 | S127: 2.38年 | T127: 1.5 | U127: 6.1 | V127: 3.5000000000000003e-002 | W127: 7.2999999999999995e-002 | X127: 6.7000000000000004e-002 | Y127: 21 | Z127: 1.94 | AA127: 6.8000000000000005e-003 | AB127: -5.0000000000000001e-004 | AC127: -3.73e-002 | AD127: -4.0300000000000002e-002 | AE127: 87.47 | AF127: 87.74 | AG127: 0.58 | AH127: A+ | AI127: 7.1900000000000006e-002 | AJ127: =H127+100*O127 -> 139.34 | AK127: 137.3 | AL127: 113 | AM127: 49.6 | AN127: 163 | AO127: 3.7999999999999999e-002 | AP127: 36 | AQ127: 正裕转债!
A128: 226 | B128: 113563 | C128: 柳药转债! | D128: 603368 | E128: 柳药股份 | F128: 医药 | G128: 医药商业 | H128: 109.61 | I128: -2.2000000000000001e-003 | J128: 1.8e-003 | K128: 19.68 | L128: -1.e-003 | M128: 112.9 | N128: 23.87 | O128: 0.32899999999999996 | P128: 82.45 | Q128: 转股中 | R128: 4.42年 | S128: 2.43年 | T128: 8.02 | U128: 15 | V128: 1.7000000000000001e-002 | W128: 0.11199999999999999 | X128: 9.3000000000000013e-002 | Y128: 71 | Z128: 1.38 | AA128: 6.8000000000000005e-003 | AB128: 1.5e-003 | AC128: -2.2499999999999999e-002 | AD128: -2.4900000000000002e-002 | AE128: 93.52 | AF128: 95.3 | AG128: 0.36 | AH128: AA | AI128: 3.9900000000000005e-002 | AJ128: =H128+100*O128 -> 142.50999999999999 | AK128: 136.8 | AL128: 108 | AM128: 41.5 | AN128: 110 | AO128: -2.5000000000000001e-002 | AP128: 16 | AQ128: 柳药转债!
A129: 269 | B129: 128070 | C129: 智能转债! | D129: 2877 | E129: 智能自控 | F129: 机械装备 | G129: 通用设备 | H129: 114.12 | I129: 2.3e-003 | J129: -3.7000000000000002e-003 | K129: 6.53 | L129: -4.5999999999999999e-003 | M129: 116.8 | N129: 9.47 | O129: 0.65500000000000003 | P129: 68.95 | Q129: 转股中 | R129: 3.88年 | S129: 无权 | T129: 2.3 | U129: 16 | V129: 6.3e-002 | W129: 0.106 | X129: 7.2999999999999995e-002 | Y129: 22 | Z129: 2.94 | AA129: 6.0999999999999995e-003 | AB129: -1.6000000000000001e-003 | AC129: 无权 | AD129: 无权 | AE129: 无权 | AF129: 89.69 | AG129: 0.3 | AH129: A+ | AI129: 7.1900000000000006e-002 | AJ129: =H129+100*O129 -> 179.62 | AK129: 159.3 | AL129: 267 | AM129: 69.6 | AN129: 274 | AO129: 2.7000000000000003e-002 | AP129: 30 | AQ129: 智能转债!
A130: 107 | B130: 113606 | C130: 荣泰转债 | D130: 603579 | E130: 荣泰健康 | F130: 机械装备 | G130: 专用设备 | H130: 117.49 | I130: -1.8100000000000002e-002 | J130: 5.1000000000000004e-003 | K130: 30.2 | L130: -2.3300000000000001e-002 | M130: 121.2 | N130: 32.83 | O130: 0.27699999999999997 | P130: 91.99 | Q130: 转股中 | R130: 5.21年 | S130: 3.21年 | T130: 6 | U130: 14 | V130: 2.e-002 | W130: 0.14199999999999999 | X130: 0.13100000000000001 | Y130: 42 | Z130: 2.52 | AA130: 6.0999999999999995e-003 | AB130: -8.9999999999999998e-004 | AC130: -3.5499999999999997e-002 | AD130: -3.7699999999999997e-002 | AE130: 85.13 | AF130: 89.15 | AG130: 0.56 | AH130: AA- | AI130: 6.2199999999999998e-002 | AJ130: =H130+100*O130 -> 145.19 | AK130: 143 | AL130: 174 | AM130: 53.8 | AN130: 200 | AO130: -7.9000000000000001e-002 | AP130: 10 | AQ130: 荣泰转债
A131: 347 | B131: 110041 | C131: 蒙电转债! | D131: 600863 | E131: 内蒙华电 | F131: 能源电力 | G131: 电力供应 | H131: 107.81 | I131: -8.9999999999999998e-004 | J131: 2.3999999999999998e-003 | K131: 2.32 | L131: 4.3e-003 | M131: 109.3 | N131: 2.56 | O131: 0.19 | P131: 90.62 | Q131: 转股中 | R131: 2.36年 | S131: 0.36年 | T131: 18.7 | U131: 19 | V131: 9.0000000000000011e-003 | W131: 0.13900000000000001 | X131: 0.126 | Y131: 135 | Z131: 1.15 | AA131: 5.8999999999999999e-003 | AB131: -1.5e-003 | AC131: -0.114 | AD131: -0.12 | AE131: 100.17 | AF131: 101.75 | AG131: 0.34 | AH131: AAA | AI131: 3.1400000000000004e-002 | AJ131: =H131+100*O131 -> 126.81 | AK131: 125 | AL131: 16 | AM131: 23.2 | AN131: 6 | AO131: 5.0000000000000001e-003 | AP131: 13 | AQ131: 蒙电转债!
A132: 4 | B132: 123118 | C132: 惠城转债 | D132: 300779 | E132: 惠城环保 | F132: 化工 | G132: 其他 | H132: 117.728 | I132: -5.5000000000000005e-003 | J132: -4.0000000000000002e-004 | K132: 18.2 | L132: -8.199999999999999e-003 | M132: 121.7 | N132: 17.11 | O132: 0.107 | P132: 106.37 | Q132: 5月3天 | R132: 5.90年 | S132: 3.90年 | T132: 3.2 | U132: 20 | V132: 5.2999999999999999e-002 | W132: 0.17600000000000002 | X132: 0.187 | Y132: 18 | Z132: 2.71 | AA132: 5.7999999999999996e-003 | AB132: -5.0000000000000001e-004 | AC132: -2.8900000000000002e-002 | AD132: -3.1e-002 | AE132: 78.77 | AF132: 81 | AG132: 0.72 | AH132: A+ | AI132: 7.3200000000000001e-002 | AJ132: =H132+100*O132 -> 128.428 | AK132: 129.1 | AL132: 33 | AM132: 48.1 | AN132: 150 | AO132: -2.4e-002 | AP132: 4 | AQ132: 惠城转债
A133: 94 | B133: 113609 | C133: 永安转债! | D133: 603776 | E133: 永安行 | F133: 城市公用 | G133: 其他 | H133: 117.04 | I133: 1.01e-002 | J133: -3.4999999999999996e-003 | K133: 17.6 | L133: 9.7999999999999997e-003 | M133: 120.5 | N133: 16.48 | O133: 9.6000000000000002e-002 | P133: 106.8 | Q133: 转股中 | R133: 5.28年 | S133: 3.28年 | T133: 7.34 | U133: 59 | V133: 6.9000000000000006e-002 | W133: 0.17899999999999999 | X133: 0.191 | Y133: 41 | Z133: 1.05 | AA133: 5.6000000000000008e-003 | AB133: -1.1000000000000001e-003 | AC133: -3.44e-002 | AD133: -3.6499999999999998e-002 | AE133: 84.52 | AF133: 88.21 | AG133: 0.68 | AH133: AA- | AI133: 6.2199999999999998e-002 | AJ133: =H133+100*O133 -> 126.64 | AK133: 127.3 | AL133: 26 | AM133: 39.1 | AN133: 89 | AO133: 1.9e-002 | AP133: 24 | AQ133: 永安转债!
A134: 294 | B134: 110056 | C134: 亨通转债! | D134: 600487 | E134: 亨通光电 | F134: 通信互联 | G134: 通信设备 | H134: 112.15 | I134: 4.0000000000000002e-004 | J134: -5.1000000000000004e-003 | K134: 12.7 | L134: -1.55e-002 | M134: 114.3 | N134: 14.95 | O134: 0.32000000000000001 | P134: 84.95 | Q134: 转股中 | R134: 3.59年 | S134: 1.60年 | T134: 17.1 | U134: 18 | V134: 9.0000000000000011e-003 | W134: 5.7000000000000002e-002 | X134: 4.8000000000000001e-002 | Y134: 300 | Z134: 1.49 | AA134: 5.4000000000000003e-003 | AB134: -1.8e-003 | AC134: -4.8499999999999995e-002 | AD134: -5.1399999999999994e-002 | AE134: 96.81 | AF134: 101.28 | AG134: 0.3 | AH134: AA+ | AI134: 3.49e-002 | AJ134: =H134+100*O134 -> 144.15000000000001 | AK134: 139.4 | AL134: 134 | AM134: 38.1 | AN134: 77 | AO134: 1.e-002 | AP134: 28 | AQ134: 亨通转债!
A135: 214 | B135: 110067 | C135: 华安转债! | D135: 600909 | E135: 华安证券 | F135: 金融 | G135: 证券行业 | H135: 107.64 | I135: -1.6000000000000001e-003 | J135: -5.0000000000000001e-004 | K135: 5.11 | L135: -5.7999999999999996e-003 | M135: 110.3 | N135: 6.22 | O135: 0.31 | P135: 82.15 | Q135: 转股中 | R135: 4.58年 | S135: 无权 | T135: 28 | U135: 21 | V135: 6.9999999999999993e-003 | W135: 0.11699999999999999 | X135: 9.6000000000000002e-002 | Y135: 240 | Z135: 1.29 | AA135: 5.4000000000000003e-003 | AB135: 1.1999999999999999e-003 | AC135: 无权 | AD135: 无权 | AE135: 无权 | AF135: 95.3 | AG135: 0.35 | AH135: AAA | AI135: 3.2899999999999999e-002 | AJ135: =H135+100*O135 -> 138.63999999999999 | AK135: 133.1 | AL135: 64 | AM135: 37.8 | AN135: 74 | AO135: -2.1000000000000001e-002 | AP135: 26 | AQ135: 华安转债!
A136: 258 | B136: 128076 | C136: 金轮转债! | D136: 2722 | E136: 金轮股份 | F136: 机械装备 | G136: 专用设备 | H136: 112.62 | I136: -7.1999999999999998e-003 | J136: -8.199999999999999e-003 | K136: 13.31 | L136: -2.92e-002 | M136: 114.9 | N136: 14.66 | O136: 0.23999999999999999 | P136: 90.79 | Q136: 转股中 | R136: 4.17年 | S136: 2.17年 | T136: 2.14 | U136: 12 | V136: 5.0999999999999997e-002 | W136: 9.1999999999999998e-002 | X136: 8.3000000000000004e-002 | Y136: 23 | Z136: 1.24 | AA136: 4.8999999999999998e-003 | AB136: -1.5e-003 | AC136: -3.6299999999999999e-002 | AD136: -3.9e-002 | AE136: 90.21 | AF136: 90.31 | AG136: 0.53 | AH136: AA- | AI136: 6.0899999999999996e-002 | AJ136: =H136+100*O136 -> 136.62 | AK136: 134.4 | AL136: 78 | AM136: 44.1 | AN136: 123 | AO136: 0.10300000000000001 | AP136: 40 | AQ136: 金轮转债!
A137: 353 | B137: 128023 | C137: 亚太转债! | D137: 2284 | E137: 亚太股份 | F137: 汽车 | G137: 零部件制 | H137: 110.15 | I137: -1.8e-003 | J137: 1.e-004 | K137: 8.43 | L137: -8.199999999999999e-003 | M137: 111.3 | N137: 10.34 | O137: 0.35100000000000003 | P137: 81.53 | Q137: 转股中 | R137: 2.31年 | S137: 0.31年 | T137: 9.99 | U137: 11 | V137: 1.e-002 | W137: 0.161 | X137: 0.13100000000000001 | Y137: 62 | Z137: 2.5 | AA137: 4.5999999999999999e-003 | AB137: -4.4000000000000003e-003 | AC137: -0.17100000000000001 | AD137: -0.17800000000000002 | AE137: 100 | AF137: 102.19 | AG137: 0.21 | AH137: AA | AI137: 3.8399999999999997e-002 | AJ137: =H137+100*O137 -> 145.25 | AK137: 138.8 | AL137: 128 | AM137: 36.6 | AN137: 59 | AO137: 9.6999999999999989e-002 | AP137: 66 | AQ137: 亚太转债!
A138: 149 | B138: 110073 | C138: 国投转债 | D138: 600061 | E138: 国投资本 | F138: 金融 | G138: 证券行业 | H138: 108.07 | I138: -3.9000000000000003e-003 | J138: -1.e-003 | K138: 8.11 | L138: -1.34e-002 | M138: 110.3 | N138: 9.9 | O138: 0.31900000000000001 | P138: 81.92 | Q138: 转股中 | R138: 4.94年 | S138: 无权 | T138: 80 | U138: 20 | V138: 2.e-003 | W138: 0.154 | X138: 0.126 | Y138: 521 | Z138: 0.79 | AA138: 4.1999999999999997e-003 | AB138: 2.9999999999999997e-004 | AC138: 无权 | AD138: 无权 | AE138: 无权 | AF138: 94.17 | AG138: 0.36 | AH138: AAA | AI138: 3.2899999999999999e-002 | AJ138: =H138+100*O138 -> 139.97 | AK138: 134.2 | AL138: 73 | AM138: 40 | AN138: 98 | AO138: 3.6000000000000004e-002 | AP138: 24 | AQ138: 国投转债
A139: 357 | B139: 110038 | C139: 济川转债! | D139: 600566 | E139: 济川药业 | F139: 医药 | G139: 中药 | H139: 107 | I139: 5.9999999999999995e-004 | J139: -5.9999999999999995e-004 | K139: 15.19 | L139: -3.9000000000000003e-003 | M139: 107.5 | N139: 23.4 | O139: 0.64800000000000002 | P139: 64.91 | Q139: 转股中 | R139: 1.25年 | S139: 回售内 | T139: 6.28 | U139: 6.3 | V139: 9.0000000000000011e-003 | W139: 4.7e-002 | X139: 2.9999999999999999e-002 | Y139: 135 | Z139: 1.67 | AA139: 3.8e-003 | AB139: -7.4999999999999997e-003 | AC139: 回售内 | AD139: 回售内 | AE139: 100.25 | AF139: 102.6 | AG139: 0.01 | AH139: AA | AI139: 3.8399999999999997e-002 | AJ139: =H139+100*O139 -> 171.80000000000001 | AK139: 149.1 | AL139: 215 | AM139: 46.5 | AN139: 141 | AO139: -3.1e-002 | AP139: 22 | AQ139: 济川转债!
A140: 112 | B140: 123072 | C140: 乐歌转债! | D140: 300729 | E140: 乐歌股份 | F140: 其他 | G140: 家居用品 | H140: 127.155 | I140: -5.8999999999999999e-003 | J140: 4.8999999999999998e-003 | K140: 22.03 | L140: -2.52e-002 | M140: 129.6 | N140: 56.12 | O140: 2.2400000000000002 | P140: 39.26 | Q140: 转股中 | R140: 5.19年 | S140: 3.19年 | T140: 1.42 | U140: 16 | V140: 8.8000000000000009e-002 | W140: 3.6000000000000004e-002 | X140: 1.3999999999999999e-002 | Y140: 40 | Z140: 3.78 | AA140: 3.8e-003 | AB140: -5.5000000000000005e-003 | AC140: -5.1699999999999996e-002 | AD140: -5.5099999999999996e-002 | AE140: 84.51 | AF140: 90.94 | AG140: 0.04 | AH140: A+ | AI140: 7.3200000000000001e-002 | AJ140: =H140+100*O140 -> 351.15500000000003 | AK140: 215.1 | AL140: 338 | AM140: 124.1 | AN140: 339 | AO140: 1.e-002 | AP140: 9 | AQ140: 乐歌转债!
A141: 42 | B141: 113046 | C141: 金田转债 | D141: 601609 | E141: 金田铜业 | F141: 有色金属 | G141: 铜金属 | H141: 112.5 | I141: -4.0000000000000002e-004 | J141: 3.5999999999999999e-003 | K141: 9.2 | L141: 7.7000000000000002e-003 | M141: 114.9 | N141: 10.75 | O141: 0.315 | P141: 85.58 | Q141: 45天 | R141: 5.60年 | S141: 3.61年 | T141: 15 | U141: 9.9 | V141: 6.0000000000000001e-003 | W141: 0.11 | X141: 9.4e-002 | Y141: 136 | Z141: 1.96 | AA141: 3.8e-003 | AB141: -8.9999999999999998e-004 | AC141: -2.23e-002 | AD141: -2.3900000000000001e-002 | AE141: 90.52 | AF141: 94.46 | AG141: 0.42 | AH141: AA+ | AI141: 3.6200000000000003e-002 | AJ141: =H141+100*O141 -> 144. | AK141: 139.4 | AL141: 136 | AM141: 45 | AN141: 130 | AO141: 4.2000000000000003e-002 | AP141: 12 | AQ141: 金田转债
A142: 110 | B142: 113605 | C142: 大参转债! | D142: 603233 | E142: 大参林 | F142: 医药 | G142: 医药商业 | H142: 113.33 | I142: 2.e-003 | J142: 4.0000000000000002e-004 | K142: 47.65 | L142: 1.04e-002 | M142: 115.2 | N142: 69.09 | O142: 0.64300000000000002 | P142: 68.97 | Q142: 转股中 | R142: 5.19年 | S142: 3.19年 | T142: 14 | U142: 4.7 | V142: 3.0000000000000001e-003 | W142: 3.7000000000000005e-002 | X142: 2.6000000000000002e-002 | Y142: 377 | Z142: 5.86 | AA142: 3.2000000000000002e-003 | AB142: -2.e-003 | AC142: -2.63e-002 | AD142: -2.8399999999999998e-002 | AE142: 90.68 | AF142: 93.82 | AG142: 0.23 | AH142: AA | AI142: 4.1200000000000001e-002 | AJ142: =H142+100*O142 -> 177.63 | AK142: 157.7 | AL142: 262 | AM142: 63.9 | AN142: 255 | AO142: 0.10199999999999999 | AP142: 7 | AQ142: 大参转债!
A143: 326 | B143: 123011 | C143: 德尔转债! | D143: 300473 | E143: 德尔股份 | F143: 汽车 | G143: 零部件制 | H143: 114.3 | I143: 7.0999999999999995e-003 | J143: -4.4000000000000003e-003 | K143: 26.86 | L143: 7.4999999999999997e-003 | M143: 115.3 | N143: 31.38 | O143: 0.33500000000000002 | P143: 85.6 | Q143: 转股中 | R143: 2.93年 | S143: 0.93年 | T143: 2.51 | U143: 39 | V143: 0.13600000000000001 | W143: 6.9000000000000006e-002 | X143: 5.9000000000000004e-002 | Y143: 36 | Z143: 1.64 | AA143: 3.0000000000000001e-003 | AB143: -6.3e-003 | AC143: -0.10099999999999999 | AD143: -0.10099999999999999 | AE143: 95.58 | AF143: 97.62 | AG143: 0.36 | AH143: AA- | AI143: 5.9400000000000001e-002 | AJ143: =H143+100*O143 -> 147.80000000000001 | AK143: 143 | AL143: 175 | AM143: 45.4 | AN143: 133 | AO143: 6.9000000000000006e-002 | AP143: 41 | AQ143: 德尔转债!
A144: 229 | B144: 127015 | C144: 希望转债!! | D144: 876 | E144: 新 希 望 | F144: 农业 | G144: 畜牧业 | H144: 108.635 | I144: -1.2999999999999999e-003 | J144: 1.4000000000000002e-003 | K144: 12.18 | L144: 8.0000000000000004e-004 | M144: 110 | N144: 19.75 | O144: 0.76200000000000001 | P144: 61.67 | Q144: 转股中 | R144: 4.39年 | S144: 2.39年 | T144: 9.5 | U144: 3.7 | V144: 4.0000000000000001e-003 | W144: 1.7000000000000001e-002 | X144: 1.1000000000000001e-002 | Y144: 549 | Z144: 1.48 | AA144: 2.8999999999999998e-003 | AB144: -1.4000000000000002e-003 | AC144: -2.2000000000000002e-002 | AD144: -2.4e-002 | AE144: 94.57 | AF144: 95.65 | AG144: 0.08 | AH144: AAA | AI144: 3.2899999999999999e-002 | AJ144: =H144+100*O144 -> 184.83500000000001 | AK144: 155.6 | AL144: 253 | AM144: 59.9 | AN144: 228 | AO144: 2.2000000000000002e-002 | AP144: 27 | AQ144: 希望转债!!
A145: 82 | B145: 113043 | C145: 财通转债! | D145: 601108 | E145: 财通证券 | F145: 金融 | G145: 证券行业 | H145: 108.53 | I145: -1.6000000000000001e-003 | J145: 2.2000000000000001e-003 | K145: 10.01 | L145: 2.e-003 | M145: 110.2 | N145: 13.13 | O145: 0.42399999999999999 | P145: 76.24 | Q145: 转股中 | R145: 5.32年 | S145: 无权 | T145: 38 | U145: 26 | V145: 6.0000000000000001e-003 | W145: 0.106 | X145: 8.1000000000000003e-002 | Y145: 359 | Z145: 1.57 | AA145: 2.8999999999999998e-003 | AB145: -5.9999999999999995e-004 | AC145: 无权 | AD145: 无权 | AE145: 无权 | AF145: 92.38 | AG145: 0.33 | AH145: AAA | AI145: 3.4200000000000001e-002 | AJ145: =H145+100*O145 -> 150.93000000000001 | AK145: 140.8 | AL145: 150 | AM145: 48.4 | AN145: 154 | AO145: -3.0000000000000001e-003 | AP145: 10 | AQ145: 财通转债!
A146: 321 | B146: 113516 | C146: 苏农转债! | D146: 603323 | E146: 苏农银行 | F146: 金融 | G146: 银行行业 | H146: 112.41 | I146: 8.9999999999999998e-004 | J146: -1.6000000000000001e-003 | K146: 4.85 | L146: -2.0999999999999999e-003 | M146: 113.3 | N146: 5.37 | O146: 0.245 | P146: 90.32 | Q146: 转股中 | R146: 2.97年 | S146: 无权 | T146: 12.9 | U146: 13 | V146: 9.0000000000000011e-003 | W146: 0.14699999999999999 | X146: 0.13300000000000001 | Y146: 87 | Z146: 0.72 | AA146: 2.7000000000000001e-003 | AB146: -5.4000000000000003e-003 | AC146: 无权 | AD146: 无权 | AE146: 无权 | AF146: 102.91 | AG146: 0.35 | AH146: AA+ | AI146: 3.3399999999999999e-002 | AJ146: =H146+100*O146 -> 136.91 | AK146: 134.5 | AL146: 80 | AM146: 31.6 | AN146: 32 | AO146: 3.2000000000000001e-002 | AP146: 27 | AQ146: 苏农转债!
A147: 265 | B147: 128072 | C147: 翔鹭转债! | D147: 2842 | E147: 翔鹭钨业 | F147: 有色金属 | G147: 小金属 | H147: 113.9 | I147: 7.0999999999999995e-003 | J147: -8.9999999999999998e-004 | K147: 11.6 | L147: 1.7500000000000002e-002 | M147: 115.1 | N147: 15.36 | O147: 0.50800000000000001 | P147: 75.52 | Q147: 转股中 | R147: 4年6.1天 | S147: 2年7天 | T147: 3.02 | U147: 51 | V147: 0.14699999999999999 | W147: 9.5000000000000001e-002 | X147: 7.2000000000000008e-002 | Y147: 32 | Z147: 3.37 | AA147: 2.7000000000000001e-003 | AB147: -4.0999999999999995e-003 | AC147: -4.36e-002 | AD147: -4.6500000000000007e-002 | AE147: 91.04 | AF147: 91.28 | AG147: 0.35 | AH147: AA- | AI147: 6.0899999999999996e-002 | AJ147: =H147+100*O147 -> 164.69999999999999 | AK147: 152.3 | AL147: 237 | AM147: 61 | AN147: 232 | AO147: 7.4999999999999997e-002 | AP147: 29 | AQ147: 翔鹭转债!
A148: 32 | B148: 123109 | C148: 昌红转债 | D148: 300151 | E148: 昌红科技 | F148: 机械装备 | G148: 专用设备 | H148: 119.28 | I148: 2.0799999999999999e-002 | J148: 1.26e-002 | K148: 27.21 | L148: 5.4699999999999999e-002 | M148: 121 | N148: 28.06 | O148: 0.23000000000000001 | P148: 96.97 | Q148: 56天 | R148: 5.63年 | S148: 3.63年 | T148: 4.6 | U148: 24 | V148: 4.4000000000000004e-002 | W148: 3.4000000000000002e-002 | X148: 3.3000000000000002e-002 | Y148: 137 | Z148: 12.79 | AA148: 2.5999999999999999e-003 | AB148: -3.8e-003 | AC148: -3.5900000000000001e-002 | AD148: -3.78e-002 | AE148: 82.82 | AF148: 86.74 | AG148: 0.61 | AH148: AA- | AI148: 6.2199999999999998e-002 | AJ148: =H148+100*O148 -> 142.28 | AK148: 141.6 | AL148: 159 | AM148: 54.9 | AN148: 210 | AO148: 0.16399999999999998 | AP148: 3 | AQ148: 昌红转债
A149: 291 | B149: 127012 | C149: 招路转债! | D149: 1965 | E149: 招商公路 | F149: 机场高速 | G149: 高速 | H149: 107.05 | I149: -8.9999999999999998e-004 | J149: 2.0999999999999999e-003 | K149: 6.84 | L149: 4.4000000000000003e-003 | M149: 107.9 | N149: 8.63 | O149: 0.35100000000000003 | P149: 79.26 | Q149: 转股中 | R149: 3.60年 | S149: 1.61年 | T149: 50 | U149: 13 | V149: 3.0000000000000001e-003 | W149: 0.11800000000000001 | X149: 9.4e-002 | Y149: 423 | Z149: 0.85 | AA149: 2.2000000000000001e-003 | AB149: -1.9e-003 | AC149: -2.8900000000000002e-002 | AD149: -3.0699999999999998e-002 | AE149: 96.01 | AF149: 96.16 | AG149: 0.26 | AH149: AAA | AI149: 3.2899999999999999e-002 | AJ149: =H149+100*O149 -> 142.15000000000001 | AK149: 134.8 | AL149: 84 | AM149: 38.7 | AN149: 81 | AO149: -3.2000000000000001e-002 | AP149: 30 | AQ149: 招路转债!
A150: 51 | B150: 128144 | C150: 利民转债! | D150: 2734 | E150: 利民股份 | F150: 化工 | G150: 农化 | H150: 112.8 | I150: 7.8000000000000005e-003 | J150: 4.5999999999999999e-003 | K150: 11.56 | L150: 2.9399999999999999e-002 | M150: 114.1 | N150: 13.98 | O150: 0.36399999999999999 | P150: 82.69 | Q150: 23天 | R150: 5.55年 | S150: 3.55年 | T150: 9.8 | U150: 7.3 | V150: 6.9999999999999993e-003 | W150: 0.22800000000000001 | X150: 0.188 | Y150: 43 | Z150: 1.56 | AA150: 2.0999999999999999e-003 | AB150: -2.5000000000000001e-003 | AC150: -2.4700000000000003e-002 | AD150: -2.6200000000000001e-002 | AE150: 88.63 | AF150: 91.53 | AG150: 0.42 | AH150: AA | AI150: 4.1200000000000001e-002 | AJ150: =H150+100*O150 -> 149.19999999999999 | AK150: 142.9 | AL150: 173 | AM150: 51.4 | AN150: 179 | AO150: 3.4000000000000002e-002 | AP150: 5 | AQ150: 利民转债!
A151: 332 | B151: 128040 | C151: 华通转债! | D151: 2758 | E151: 浙农股份 | F151: 医药 | G151: 医药商业 | H151: 110.89 | I151: 1.1999999999999999e-003 | J151: -2.5000000000000001e-003 | K151: 9.18 | L151: -3.3e-003 | M151: 111.3 | N151: 10.15 | O151: 0.22600000000000001 | P151: 90.44 | Q151: 转股中 | R151: 2.83年 | S151: 0.84年 | T151: 2.22 | U151: 6.5 | V151: 2.6000000000000002e-002 | W151: 5.0000000000000003e-002 | X151: 4.4999999999999998e-002 | Y151: 45 | Z151: 1.49 | AA151: 1.2999999999999999e-003 | AB151: -6.0000000000000001e-003 | AC151: -8.199999999999999e-002 | AD151: -8.5199999999999998e-002 | AE151: 98.04 | AF151: 100.19 | AG151: 0.38 | AH151: AA | AI151: 3.8399999999999997e-002 | AJ151: =H151+100*O151 -> 133.49000000000001 | AK151: 131.3 | AL151: 49 | AM151: 31.1 | AN151: 30 | AO151: -3.0000000000000001e-003 | AP151: 32 | AQ151: 华通转债!
A152: 122 | B152: 128133 | C152: 奇正转债! | D152: 2287 | E152: 奇正藏药 | F152: 医药 | G152: 中药 | H152: 116.6 | I152: 3.4000000000000002e-003 | J152: -6.8999999999999999e-003 | K152: 27.64 | L152: -7.1999999999999998e-003 | M152: 117.3 | N152: 29.78 | O152: 0.25600000000000001 | P152: 92.81 | Q152: 转股中 | R152: 5年39天 | S152: 3年40天 | T152: 8 | U152: 8 | V152: 9.0000000000000011e-003 | W152: 5.5e-002 | X152: 5.0999999999999997e-002 | Y152: 147 | Z152: 5.66 | AA152: 1.1999999999999999e-003 | AB152: -4.7999999999999996e-003 | AC152: -3.5200000000000002e-002 | AD152: -3.73e-002 | AE152: 91.08 | AF152: 95.86 | AG152: 0.49 | AH152: AA | AI152: 4.1200000000000001e-002 | AJ152: =H152+100*O152 -> 142.19999999999999 | AK152: 140.4 | AL152: 143 | AM152: 44.5 | AN152: 126 | AO152: -3.1e-002 | AP152: 16 | AQ152: 奇正转债!
A153: 184 | B153: 127017 | C153: 万青转债 | D153: 789 | E153: 万年青 | F153: 建筑 | G153: 水泥 | H153: 117.5 | I153: 2.5000000000000001e-003 | J153: 5.9999999999999995e-004 | K153: 11.46 | L153: 8.8000000000000005e-003 | M153: 118 | N153: 13.46 | O153: 0.38 | P153: 85.14 | Q153: 转股中 | R153: 4.80年 | S153: 2.81年 | T153: 10 | U153: 6.1 | V153: 5.0000000000000001e-003 | W153: 0.109 | X153: 9.3000000000000013e-002 | Y153: 91 | Z153: 1.39 | AA153: 8.9999999999999998e-004 | AB153: -5.6000000000000008e-003 | AC153: -4.2599999999999999e-002 | AD153: -4.4600000000000001e-002 | AE153: 93.4 | AF153: 100.37 | AG153: 0.35 | AH153: AA+ | AI153: 3.49e-002 | AJ153: =H153+100*O153 -> 155.5 | AK153: 149.9 | AL153: 222 | AM153: 49.5 | AN153: 162 | AO153: 4.2999999999999997e-002 | AP153: 9 | AQ153: 万青转债
A154: 162 | B154: 128119 | C154: 龙大转债! | D154: 2726 | E154: 龙大肉食 | F154: 食品饮料 | G154: 肉制品 | H154: 119.52 | I154: 7.000000000000001e-004 | J154: 3.9000000000000003e-003 | K154: 9.56 | L154: 8.3999999999999995e-003 | M154: 119.9 | N154: 9.29 | O154: 0.161 | P154: 102.91 | Q154: 转股中 | R154: 4.91年 | S154: 2.92年 | T154: 9.46 | U154: 7.8 | V154: 6.9999999999999993e-003 | W154: 9.1999999999999998e-002 | X154: 9.4e-002 | Y154: 103 | Z154: 2.75 | AA154: 7.000000000000001e-004 | AB154: -6.3e-003 | AC154: -4.6199999999999998e-002 | AD154: -4.82e-002 | AE154: 91.75 | AF154: 99.27 | AG154: 0.55 | AH154: AA | AI154: 3.9900000000000005e-002 | AJ154: =H154+100*O154 -> 135.62 | AK154: 136.1 | AL154: 95 | AM154: 36.9 | AN154: 61 | AO154: 2.4e-002 | AP154: 9 | AQ154: 龙大转债!
A155: 147 | B155: 123062 | C155: 三超转债 | D155: 300554 | E155: 三超新材 | F155: 机械装备 | G155: 通用设备 | H155: 118.922 | I155: -6.4000000000000003e-003 | J155: -6.9999999999999993e-003 | K155: 18.06 | L155: -1.8500000000000003e-002 | M155: 119.2 | N155: 17.13 | O155: 0.128 | P155: 105.43 | Q155: 转股中 | R155: 4.95年 | S155: 2.95年 | T155: 1.95 | U155: 13 | V155: 5.7999999999999996e-002 | W155: 0.115 | X155: 0.121 | Y155: 17 | Z155: 3.23 | AA155: 5.0000000000000001e-004 | AB155: -6.1999999999999998e-003 | AC155: -4.2000000000000003e-002 | AD155: -4.4400000000000002e-002 | AE155: 81.63 | AF155: 81.44 | AG155: 0.72 | AH155: A | AI155: 8.1900000000000001e-002 | AJ155: =H155+100*O155 -> 131.72200000000001 | AK155: 132.4 | AL155: 58 | AM155: 50.8 | AN155: 177 | AO155: 5.0999999999999997e-002 | AP155: 24 | AQ155: 三超转债
A156: 252 | B156: 110060 | C156: 天路转债! | D156: 600326 | E156: 西藏天路 | F156: 建筑 | G156: 水泥 | H156: 114.85 | I156: 4.8999999999999998e-003 | J156: 6.8000000000000005e-003 | K156: 6.71 | L156: 2.4399999999999998e-002 | M156: 114.9 | N156: 7.08 | O156: 0.21199999999999999 | P156: 94.77 | Q156: 转股中 | R156: 4.21年 | S156: 2.21年 | T156: 7.06 | U156: 3.9 | V156: 5.0000000000000001e-003 | W156: 0.115 | X156: 0.109 | Y156: 62 | Z156: 1.46 | AA156: 1.e-004 | AB156: -6.1999999999999998e-003 | AC156: -4.3700000000000003e-002 | AD156: -4.6300000000000001e-002 | AE156: 94.33 | AF156: 97.81 | AG156: 0.48 | AH156: AA | AI156: 3.9900000000000005e-002 | AJ156: =H156+100*O156 -> 136.04999999999998 | AK156: 134.9 | AL156: 86 | AM156: 37.1 | AN156: 65 | AO156: -1.2e-002 | AP156: 13 | AQ156: 天路转债!
A157: 6 | B157: 127039 | C157: 北港转债 | D157: 582 | E157: 北部湾港 | F157: 机场高速 | G157: 港口 | H157: 113.11 | I157: -3.0000000000000001e-003 | J157: 3.7000000000000002e-003 | K157: 7.74 | L157: 1.2999999999999999e-003 | M157: 113 | N157: 8.35 | O157: 0.22 | P157: 92.69 | Q157: 4月25天 | R157: 5.87年 | S157: 3.88年 | T157: 30 | U157: 29 | V157: 8.0000000000000002e-003 | W157: 0.23699999999999999 | X157: 0.22 | Y157: 126 | Z157: 1.2 | AA157: -2.0000000000000001e-004 | AB157: -4.1999999999999997e-003 | AC157: -2.1899999999999999e-002 | AD157: -2.35e-002 | AE157: 90.43 | AF157: 93.05 | AG157: 0.51 | AH157: AAA | AI157: 3.4200000000000001e-002 | AJ157: =H157+100*O157 -> 135.11000000000001 | AK157: 133.5 | AL157: 68 | AM157: 40.5 | AN157: 102 | AO157: -1.8000000000000002e-002 | AP157: 4 | AQ157: 北港转债
A158: 196 | B158: 128106 | C158: 华统转债 | D158: 2840 | E158: 华统股份 | F158: 农业 | G158: 农产品加 | H158: 113.062 | I158: -1.1999999999999999e-003 | J158: 9.1000000000000004e-003 | K158: 9.05 | L158: 1.46e-002 | M158: 112.9 | N158: 9.37 | O158: 0.17100000000000001 | P158: 96.58 | Q158: 转股中 | R158: 4.65年 | S158: 2.66年 | T158: 5.35 | U158: 4.2 | V158: 6.9999999999999993e-003 | W158: 0.13200000000000001 | X158: 0.128 | Y158: 41 | Z158: 2.3 | AA158: -2.9999999999999997e-004 | AB158: -5.3e-003 | AC158: -3.1400000000000004e-002 | AD158: -3.3599999999999998e-002 | AE158: 92.68 | AF158: 94.44 | AG158: 0.54 | AH158: AA | AI158: 3.9900000000000005e-002 | AJ158: =H158+100*O158 -> 130.16200000000001 | AK158: 129.5 | AL158: 34 | AM158: 35.1 | AN158: 50 | AO158: 3.5000000000000003e-002 | AP158: 9 | AQ158: 华统转债
A159: 50 | B159: 113045 | C159: 环旭转债! | D159: 601231 | E159: 环旭电子 | F159: 电子 | G159: 电子产品 | H159: 112.55 | I159: 2.0000000000000001e-004 | J159: -8.0000000000000002e-003 | K159: 13.94 | L159: -3.1300000000000001e-002 | M159: 112 | N159: 19.75 | O159: 0.59499999999999997 | P159: 70.58 | Q159: 3月29天 | R159: 5.55年 | S159: 2.56年 | T159: 34.5 | U159: 5.6 | V159: 1.e-003 | W159: 0.11199999999999999 | X159: 7.9000000000000001e-002 | Y159: 308 | Z159: 2.49 | AA159: -8.9999999999999998e-004 | AB159: -4.7999999999999996e-003 | AC159: -3.2400000000000005e-002 | AD159: -3.44e-002 | AE159: 93.41 | AF159: 92.15 | AG159: 0.25 | AH159: AA+ | AI159: 3.6200000000000003e-002 | AJ159: =H159+100*O159 -> 172.05000000000001 | AK159: 154.5 | AL159: 248 | AM159: 61.1 | AN159: 235 | AO159: -2.6000000000000002e-002 | AP159: 4 | AQ159: 环旭转债!
A160: 39 | B160: 123106 | C160: 正丹转债! | D160: 300641 | E160: 正丹股份 | F160: 化工 | G160: 化工 | H160: 126.4 | I160: -1.54e-002 | J160: -1.7000000000000001e-002 | K160: 8.85 | L160: -4.6300000000000001e-002 | M160: 125.5 | N160: 7.5 | O160: 7.0999999999999994e-002 | P160: 118 | Q160: 48天 | R160: 5.61年 | S160: 3.61年 | T160: 3.2 | U160: 61 | V160: 0.151 | W160: 7.400000000000001e-002 | X160: 8.6999999999999994e-002 | Y160: 43 | Z160: 3.11 | AA160: -1.2999999999999999e-003 | AB160: -8.8000000000000005e-003 | AC160: -5.1200000000000002e-002 | AD160: -5.2900000000000003e-002 | AE160: 82.86 | AF160: 90.04 | AG160: 0.7 | AH160: AA- | AI160: 6.2199999999999998e-002 | AJ160: =H160+100*O160 -> 133.5 | AK160: 134.8 | AL160: 83 | AM160: 44.8 | AN160: 128 | AO160: 0.13 | AP160: 14 | AQ160: 正丹转债!
A161: 72 | B161: 128142 | C161: 新乳转债! | D161: 2946 | E161: 新乳业 | F161: 食品饮料 | G161: 乳制品 | H161: 116.16 | I161: -7.1999999999999998e-003 | J161: 3.3e-003 | K161: 14.12 | L161: -1.1899999999999999e-002 | M161: 115.1 | N161: 18.47 | O161: 0.51900000000000002 | P161: 76.45 | Q161: 转股中 | R161: 5.35年 | S161: 3.35年 | T161: 7.18 | U161: 6.2 | V161: 6.9999999999999993e-003 | W161: 5.9000000000000004e-002 | X161: 4.4999999999999998e-002 | Y161: 122 | Z161: 4.71 | AA161: -1.7000000000000001e-003 | AB161: -6.8000000000000005e-003 | AC161: -3.2300000000000002e-002 | AD161: -3.4200000000000001e-002 | AE161: 90.02 | AF161: 93.14 | AG161: 0.33 | AH161: AA | AI161: 4.1200000000000001e-002 | AJ161: =H161+100*O161 -> 168.06 | AK161: 155.9 | AL161: 255 | AM161: 62.7 | AN161: 250 | AO161: -2.1000000000000001e-002 | AP161: 4 | AQ161: 新乳转债!
A162: 40 | B162: 128145 | C162: 日丰转债 | D162: 2953 | E162: 日丰股份 | F162: 家电 | G162: 零部件制 | H162: 116.501 | I162: -8.0000000000000004e-004 | J162: 4.0000000000000002e-004 | K162: 13.9 | L162: -7.000000000000001e-004 | M162: 115.4 | N162: 13.66 | O162: 0.14499999999999999 | P162: 101.76 | Q162: 45天 | R162: 5.60年 | S162: 3.61年 | T162: 3.8 | U162: 3.1 | V162: 6.9999999999999993e-003 | W162: 0.11199999999999999 | X162: 0.114 | Y162: 34 | Z162: 2.26 | AA162: -1.7000000000000001e-003 | AB162: -6.6e-003 | AC162: -3.0499999999999999e-002 | AD162: -3.2400000000000005e-002 | AE162: 82.79 | AF162: 82.84 | AG162: 0.69 | AH162: AA- | AI162: 6.2199999999999998e-002 | AJ162: =H162+100*O162 -> 131.001 | AK162: 131.2 | AL162: 47 | AM162: 48.4 | AN162: 152 | AO162: 1.7000000000000001e-002 | AP162: 6 | AQ162: 日丰转债
A163: 8 | B163: 123117 | C163: 健帆转债! | D163: 300529 | E163: 健帆生物 | F163: 医药 | G163: 医疗器械 | H163: 116.36 | I163: 1.e-003 | J163: -4.7999999999999996e-003 | K163: 56.4 | L163: -1.9e-002 | M163: 115.1 | N163: 90.6 | O163: 0.86900000000000011 | P163: 62.25 | Q163: 4月18天 | R163: 5.86年 | S163: 3.86年 | T163: 10 | U163: 7.7 | V163: 6.9999999999999993e-003 | W163: 2.2000000000000002e-002 | X163: 1.3999999999999999e-002 | Y163: 454 | Z163: 14.72 | AA163: -1.9e-003 | AB163: -6.5000000000000006e-003 | AC163: -2.86e-002 | AD163: -3.0299999999999997e-002 | AE163: 88.17 | AF163: 91.23 | AG163: 0.2 | AH163: AA | AI163: 4.1200000000000001e-002 | AJ163: =H163+100*O163 -> 203.25999999999999 | AK163: 170.5 | AL163: 297 | AM163: 79.2 | AN163: 300 | AO163: -0.16800000000000001 | AP163: 3 | AQ163: 健帆转债!
A164: 89 | B164: 123080 | C164: 海波转债! | D164: 300517 | E164: 海波重科 | F164: 建筑 | G164: 建筑工程 | H164: 128.057 | I164: -2.3599999999999999e-002 | J164: -3.9000000000000003e-003 | K164: 14.51 | L164: -3.5900000000000001e-002 | M164: 126.5 | N164: 11.58 | O164: 2.2000000000000002e-002 | P164: 125.3 | Q164: 转股中 | R164: 5.30年 | S164: 3.30年 | T164: 2.44 | U164: 29 | V164: 9.4e-002 | W164: 8.6999999999999994e-002 | X164: 0.109 | Y164: 28 | Z164: 1.87 | AA164: -2.3999999999999998e-003 | AB164: -1.0500000000000001e-002 | AC164: -5.7099999999999998e-002 | AD164: -5.9400000000000001e-002 | AE164: 82.2 | AF164: 87.79 | AG164: 0.77 | AH164: A+ | AI164: 7.3200000000000001e-002 | AJ164: =H164+100*O164 -> 130.25699999999998 | AK164: 130.8 | AL164: 45 | AM164: 43 | AN164: 118 | AO164: 4.2999999999999997e-002 | AP164: 23 | AQ164: 海波转债!
A165: 54 | B165: 123099 | C165: 普利转债 | D165: 300630 | E165: 普利制药 | F165: 医药 | G165: 化学制药 | H165: 125.363 | I165: -1.6000000000000001e-003 | J165: 3.4999999999999996e-003 | K165: 46.22 | L165: 3.3e-003 | M165: 123.5 | N165: 46.03 | O165: 0.248 | P165: 100.41 | Q165: 10天 | R165: 5.49年 | S165: 3.49年 | T165: 8.5 | U165: 5 | V165: 5.0000000000000001e-003 | W165: 4.2000000000000003e-002 | X165: 4.2000000000000003e-002 | Y165: 202 | Z165: 9.21 | AA165: -2.8000000000000004e-003 | AB165: -9.8999999999999991e-003 | AC165: -5.0599999999999999e-002 | AD165: -5.2499999999999998e-002 | AE165: 83.45 | AF165: 89.25 | AG165: 0.61 | AH165: AA- | AI165: 6.2199999999999998e-002 | AJ165: =H165+100*O165 -> 150.16300000000001 | AK165: 150.3 | AL165: 227 | AM165: 61.1 | AN165: 234 | AO165: 1.e-002 | AP165: 5 | AQ165: 普利转债
A166: 20 | B166: 111000 | C166: 起帆转债 | D166: 605222 | E166: 起帆电缆 | F166: 能源电力 | G166: 电力设备 | H166: 122.52 | I166: 8.6e-003 | J166: -5.4000000000000003e-003 | K166: 22.35 | L166: 4.5000000000000005e-003 | M166: 120.5 | N166: 20.53 | O166: 0.125 | P166: 108.87 | Q166: 3月18天 | R166: 5.78年 | S166: 3.78年 | T166: 10 | U166: 31 | V166: 2.5000000000000001e-002 | W166: 0.11199999999999999 | X166: 0.122 | Y166: 90 | Z166: 3.07 | AA166: -2.8999999999999998e-003 | AB166: -9.0000000000000011e-003 | AC166: -4.1399999999999999e-002 | AD166: -4.3200000000000002e-002 | AE166: 82.03 | AF166: 85.61 | AG166: 0.7 | AH166: AA- | AI166: 6.2199999999999998e-002 | AJ166: =H166+100*O166 -> 135.01999999999998 | AK166: 136.2 | AL166: 96 | AM166: 50.6 | AN166: 172 | AO166: 6.6000000000000003e-002 | AP166: 9 | AQ166: 起帆转债
A167: 323 | B167: 128042 | C167: 凯中转债! | D167: 2823 | E167: 凯中精密 | F167: 能源电力 | G167: 电力设备 | H167: 116.32 | I167: 6.5000000000000006e-003 | J167: -2.3e-003 | K167: 12.13 | L167: 1.0800000000000001e-002 | M167: 115.3 | N167: 12.86 | O167: 0.23300000000000001 | P167: 94.32 | Q167: 转股中 | R167: 2.96年 | S167: 0.96年 | T167: 4.16 | U167: 20 | V167: 4.2000000000000003e-002 | W167: 0.11900000000000001 | X167: 0.113 | Y167: 35 | Z167: 2.56 | AA167: -3.0000000000000001e-003 | AB167: -1.21e-002 | AC167: -0.109 | AD167: -0.11199999999999999 | AE167: 97.57 | AF167: 103.29 | AG167: 0.39 | AH167: AA | AI167: 3.8399999999999997e-002 | AJ167: =H167+100*O167 -> 139.62 | AK167: 138.3 | AL167: 125 | AM167: 35 | AN167: 49 | AO167: 4.0999999999999995e-002 | AP167: 26 | AQ167: 凯中转债!
A168: 90 | B168: 113610 | C168: 灵康转债 | D168: 603669 | E168: 灵康药业 | F168: 医药 | G168: 化学制药 | H168: 123.16 | I168: -1.9e-002 | J168: -1.8000000000000002e-002 | K168: 10.16 | L168: -5.0499999999999996e-002 | M168: 121.1 | N168: 8.61 | O168: 4.4000000000000004e-002 | P168: 118 | Q168: 转股中 | R168: 5.30年 | S168: 3.30年 | T168: 4.58 | U168: 142 | V168: 0.247 | W168: 6.3e-002 | X168: 7.4999999999999997e-002 | Y168: 72 | Z168: 5.15 | AA168: -3.2000000000000002e-003 | AB168: -1.e-002 | AC168: -4.8000000000000001e-002 | AD168: -5.0099999999999999e-002 | AE168: 84.59 | AF168: 88.58 | AG168: 0.73 | AH168: AA- | AI168: 6.2199999999999998e-002 | AJ168: =H168+100*O168 -> 127.56 | AK168: 128.3 | AL168: 28 | AM168: 39.7 | AN168: 95 | AO168: -4.0000000000000001e-003 | AP168: 27 | AQ168: 灵康转债
A169: 14 | B169: 123116 | C169: 万兴转债 | D169: 300624 | E169: 万兴科技 | F169: 计算机及 | G169: 软件开发 | H169: 123.71 | I169: -5.6999999999999993e-003 | J169: -1.43e-002 | K169: 46.59 | L169: -3.04e-002 | M169: 121.4 | N169: 49.78 | O169: 0.32200000000000001 | P169: 93.59 | Q169: 4月5天 | R169: 5.82年 | S169: 3.82年 | T169: 3.79 | U169: 5.8 | V169: 1.2e-002 | W169: 6.3e-002 | X169: 5.9000000000000004e-002 | Y169: 61 | Z169: 6.81 | AA169: -3.3e-003 | AB169: -9.4999999999999998e-003 | AC169: -4.2199999999999994e-002 | AD169: -4.41e-002 | AE169: 78.94 | AF169: 81.19 | AG169: 0.66 | AH169: A+ | AI169: 7.3200000000000001e-002 | AJ169: =H169+100*O169 -> 155.91 | AK169: 153.8 | AL169: 246 | AM169: 72.6 | AN169: 285 | AO169: -9.1999999999999998e-002 | AP169: 4 | AQ169: 万兴转债
A170: 129 | B170: 128130 | C170: 景兴转债 | D170: 2067 | E170: 景兴纸业 | F170: 造纸包装 | G170: 包装用纸 | H170: 117.15 | I170: 3.0000000000000001e-003 | J170: 5.6999999999999993e-003 | K170: 3.65 | L170: 1.3899999999999999e-002 | M170: 115.1 | N170: 3.4 | O170: 9.0999999999999998e-002 | P170: 107.35 | Q170: 转股中 | R170: 5年17天 | S170: 3年18天 | T170: 10.7 | U170: 28 | V170: 2.2000000000000002e-002 | W170: 0.248 | X170: 0.26700000000000002 | Y170: 43 | Z170: 0.86 | AA170: -3.5999999999999999e-003 | AB170: -8.8999999999999999e-003 | AC170: -3.78e-002 | AD170: -3.9900000000000005e-002 | AE170: 91.11 | AF170: 94.27 | AG170: 0.63 | AH170: AA | AI170: 4.1200000000000001e-002 | AJ170: =H170+100*O170 -> 126.25 | AK170: 126.9 | AL170: 25 | AM170: 32.7 | AN170: 39 | AO170: 2.e-002 | AP170: 16 | AQ170: 景兴转债
A171: 210 | B171: 123045 | C171: 雷迪转债 | D171: 300652 | E171: 雷迪克 | F171: 汽车 | G171: 零部件制 | H171: 121 | I171: -2.5000000000000001e-003 | J171: -7.4000000000000003e-003 | K171: 19.63 | L171: -1.55e-002 | M171: 118.9 | N171: 19.63 | O171: 0.20999999999999999 | P171: 100 | Q171: 转股中 | R171: 4.58年 | S171: 2.58年 | T171: 1.66 | U171: 13 | V171: 6.4000000000000001e-002 | W171: 8.9999999999999997e-002 | X171: 8.9999999999999997e-002 | Y171: 18 | Z171: 1.95 | AA171: -3.9000000000000003e-003 | AB171: -1.1000000000000001e-002 | AC171: -5.3899999999999997e-002 | AD171: -5.6600000000000004e-002 | AE171: 86.19 | AF171: 87.2 | AG171: 0.64 | AH171: A+ | AI171: 7.1900000000000006e-002 | AJ171: =H171+100*O171 -> 142. | AK171: 142 | AL171: 162 | AM171: 54.8 | AN171: 208 | AO171: 6.3e-002 | AP171: 35 | AQ171: 雷迪转债
A172: 48 | B172: 123101 | C172: 拓斯转债! | D172: 300607 | E172: 拓斯达 | F172: 机械装备 | G172: 机器人及 | H172: 117.631 | I172: 3.0899999999999997e-002 | J172: -9.7000000000000003e-003 | K172: 20.24 | L172: 5.9699999999999996e-002 | M172: 115.1 | N172: 26.19 | O172: 0.52200000000000002 | P172: 77.28 | Q172: 34天 | R172: 5.57年 | S172: 3.57年 | T172: 6.7 | U172: 88 | V172: 0.11 | W172: 7.8e-002 | X172: 5.9999999999999998e-002 | Y172: 86 | Z172: 2.4 | AA172: -4.0000000000000001e-003 | AB172: -8.8000000000000005e-003 | AC172: -3.3599999999999998e-002 | AD172: -3.5400000000000001e-002 | AE172: 89.2 | AF172: 92.3 | AG172: 0.36 | AH172: AA | AI172: 4.1200000000000001e-002 | AJ172: =H172+100*O172 -> 169.83100000000002 | AK172: 158 | AL172: 264 | AM172: 65.7 | AN172: 261 | AO172: 6.5000000000000002e-002 | AP172: 5 | AQ172: 拓斯转债!
A173: 243 | B173: 110062 | C173: 烽火转债! | D173: 600498 | E173: 烽火通信 | F173: 通信互联 | G173: 通信设备 | H173: 112.72 | I173: -3.4000000000000002e-003 | J173: -1.e-004 | K173: 19.4 | L173: -9.7000000000000003e-003 | M173: 110.8 | N173: 22.85 | O173: 0.32799999999999996 | P173: 84.9 | Q173: 转股中 | R173: 4.30年 | S173: 2.30年 | T173: 30.9 | U173: 12 | V173: 4.0000000000000001e-003 | W173: 0.14099999999999999 | X173: 0.11900000000000001 | Y173: 220 | Z173: 2.04 | AA173: -4.0999999999999995e-003 | AB173: -8.6999999999999994e-003 | AC173: -3.5000000000000003e-002 | AD173: -3.7499999999999999e-002 | AE173: 95.44 | AF173: 96.68 | AG173: 0.37 | AH173: AAA | AI173: 3.2899999999999999e-002 | AJ173: =H173+100*O173 -> 145.51999999999998 | AK173: 140.5 | AL173: 146 | AM173: 43.9 | AN173: 121 | AO173: -1.9e-002 | AP173: 19 | AQ173: 烽火转债!
A174: 3 | B174: 127041 | C174: 弘亚转债 | D174: 2833 | E174: 弘亚数控 | F174: 机械装备 | G174: 专用设备 | H174: 121.3 | I174: -1.6000000000000001e-003 | J174: 1.6000000000000001e-003 | K174: 34.49 | L174: 0. | M174: 118.75 | N174: 38.09 | O174: 0.34000000000000002 | P174: 90.55 | Q174: 5月7天 | R174: 4.91年 | S174: 2.91年 | T174: 6 | U174: 52 | V174: 7.0999999999999994e-002 | W174: 5.7000000000000002e-002 | X174: 5.2000000000000005e-002 | Y174: 105 | Z174: 4.04 | AA174: -4.4000000000000003e-003 | AB174: -1.09e-002 | AC174: -5.3499999999999999e-002 | AD174: -5.4900000000000004e-002 | AE174: 85.54 | AF174: 89.19 | AG174: 0.53 | AH174: AA- | AI174: 6.0899999999999996e-002 | AJ174: =H174+100*O174 -> 155.30000000000001 | AK174: 152.1 | AL174: 236 | AM174: 62.9 | AN174: 251 | AO174: 4.5999999999999999e-002 | AP174: 2 | AQ174: 弘亚转债
A175: 356 | B175: 123002 | C175: 国祯转债!! | D175: 300388 | E175: 节能国祯 | F175: 城市公用 | G175: 三废处理 | H175: 109.997 | I175: 0. | J175: -2.3999999999999998e-003 | K175: 7.21 | L175: -8.3000000000000001e-003 | M175: 108.8 | N175: 8.36 | O175: 0.27500000000000002 | P175: 86.24 | Q175: 转股中 | R175: 2.28年 | S175: 0.28年 | T175: 2.52 | U175: 0.7 | V175: 2.e-003 | W175: 5.0000000000000003e-002 | X175: 4.2999999999999997e-002 | Y175: 50 | Z175: 1.37 | AA175: -4.8999999999999998e-003 | AB175: -1.2e-002 | AC175: -0.184 | AD175: -0.19 | AE175: 99.85 | AF175: 99.98 | AG175: 0.3 | AH175: AA | AI175: 3.8399999999999997e-002 | AJ175: =H175+100*O175 -> 137.49700000000001 | AK175: 133.7 | AL175: 70 | AM175: 33.8 | AN175: 41 | AO175: 0. | AP175: 16 | AQ175: 国祯转债!!
A176: 44 | B176: 123105 | C176: 拓尔转债! | D176: 300229 | E176: 拓尔思 | F176: 计算机及 | G176: 软件开发 | H176: 124.311 | I176: -1.6000000000000001e-003 | J176: -2.35e-002 | K176: 9.86 | L176: -3.9900000000000005e-002 | M176: 121 | N176: 9.96 | O176: 0.25600000000000001 | P176: 99 | Q176: 43天 | R176: 5.59年 | S176: 3.60年 | T176: 8 | U176: 9.7 | V176: 1.e-002 | W176: 0.114 | X176: 0.11199999999999999 | Y176: 70 | Z176: 3.24 | AA176: -4.8999999999999998e-003 | AB176: -1.1200000000000002e-002 | AC176: -4.6900000000000004e-002 | AD176: -4.87e-002 | AE176: 83 | AF176: 86.93 | AG176: 0.63 | AH176: AA- | AI176: 6.2199999999999998e-002 | AJ176: =H176+100*O176 -> 149.911 | AK176: 149.6 | AL176: 219 | AM176: 62.7 | AN176: 249 | AO176: -3.4000000000000002e-002 | AP176: 7 | AQ176: 拓尔转债!
A177: 128 | B177: 123064 | C177: 万孚转债! | D177: 300482 | E177: 万孚生物 | F177: 医药 | G177: 医疗器械 | H177: 118.1 | I177: 3.4000000000000002e-003 | J177: -8.8000000000000005e-003 | K177: 54.09 | L177: -1.7399999999999999e-002 | M177: 115.1 | N177: 71.65 | O177: 0.56399999999999995 | P177: 75.49 | Q177: 转股中 | R177: 5年18天 | S177: 3年19天 | T177: 5.99 | U177: 9.3 | V177: 1.3000000000000001e-002 | W177: 2.5000000000000001e-002 | X177: 1.9e-002 | Y177: 241 | Z177: 6.37 | AA177: -5.1999999999999998e-003 | AB177: -1.0500000000000001e-002 | AC177: -4.0199999999999993e-002 | AD177: -4.2199999999999994e-002 | AE177: 91.1 | AF177: 94.26 | AG177: 0.31 | AH177: AA | AI177: 4.1200000000000001e-002 | AJ177: =H177+100*O177 -> 174.5 | AK177: 160.7 | AL177: 274 | AM177: 66.5 | AN177: 265 | AO177: -4.0000000000000001e-002 | AP177: 10 | AQ177: 万孚转债!
A178: 73 | B178: 128141 | C178: 旺能转债 | D178: 2034 | E178: 旺能环境 | F178: 城市公用 | G178: 三废处理 | H178: 118.299 | I178: 1.72e-002 | J178: -4.8999999999999998e-003 | K178: 16.72 | L178: 2.0099999999999996e-002 | M178: 115.1 | N178: 15.97 | O178: 0.13 | P178: 104.7 | Q178: 转股中 | R178: 5.34年 | S178: 3.35年 | T178: 14 | U178: 16 | V178: 1.e-002 | W178: 0.19899999999999998 | X178: 0.20800000000000002 | Y178: 70 | Z178: 1.49 | AA178: -5.1999999999999998e-003 | AB178: -1.0200000000000001e-002 | AC178: -3.7400000000000003e-002 | AD178: -3.9199999999999999e-002 | AE178: 90.03 | AF178: 93.15 | AG178: 0.61 | AH178: AA | AI178: 4.1200000000000001e-002 | AJ178: =H178+100*O178 -> 131.29900000000001 | AK178: 131.9 | AL178: 54 | AM178: 38.8 | AN178: 83 | AO178: 1.9e-002 | AP178: 7 | AQ178: 旺能转债
A179: 71 | B179: 123090 | C179: 三诺转债 | D179: 300298 | E179: 三诺生物 | F179: 医药 | G179: 医疗器械 | H179: 120.5 | I179: 0. | J179: -3.0999999999999999e-003 | K179: 29.46 | L179: -7.7000000000000002e-003 | M179: 117.1 | N179: 35.15 | O179: 0.43799999999999994 | P179: 83.81 | Q179: 转股中 | R179: 5.35年 | S179: 3.36年 | T179: 5 | U179: 6.7 | V179: 1.1000000000000001e-002 | W179: 2.9999999999999999e-002 | X179: 2.5000000000000001e-002 | Y179: 167 | Z179: 6.25 | AA179: -5.4000000000000003e-003 | AB179: -1.1000000000000001e-002 | AC179: -4.2300000000000004e-002 | AD179: -4.4199999999999996e-002 | AE179: 89.99 | AF179: 94.72 | AG179: 0.4 | AH179: AA | AI179: 4.1200000000000001e-002 | AJ179: =H179+100*O179 -> 164.30000000000001 | AK179: 157.2 | AL179: 261 | AM179: 62.5 | AN179: 246 | AO179: 8.0000000000000002e-003 | AP179: 4 | AQ179: 三诺转债
A180: 232 | B180: 128091 | C180: 新天转债 | D180: 2873 | E180: 新天药业 | F180: 医药 | G180: 中药 | H180: 122.56 | I180: -9.7000000000000003e-003 | J180: -2.9999999999999997e-004 | K180: 16.73 | L180: -1.5300000000000001e-002 | M180: 119.4 | N180: 16.27 | O180: 0.192 | P180: 102.83 | Q180: 转股中 | R180: 4.38年 | S180: 2.38年 | T180: 1.76 | U180: 21 | V180: 9.8000000000000004e-002 | W180: 8.9999999999999997e-002 | X180: 9.1999999999999998e-002 | Y180: 20 | Z180: 2.4 | AA180: -6.0999999999999995e-003 | AB180: -1.37e-002 | AC180: -6.1500000000000006e-002 | AD180: -6.4600000000000005e-002 | AE180: 87.77 | AF180: 88.84 | AG180: 0.65 | AH180: A+ | AI180: 7.1900000000000006e-002 | AJ180: =H180+100*O180 -> 141.75999999999999 | AK180: 142.3 | AL180: 167 | AM180: 53.4 | AN180: 197 | AO180: -1.6e-002 | AP180: 19 | AQ180: 新天转债
A181: 315 | B181: 110047 | C181: 山鹰转债 | D181: 600567 | E181: 山鹰国际 | F181: 造纸包装 | G181: 包装用纸 | H181: 119.95 | I181: 1.1599999999999999e-002 | J181: -2.7000000000000001e-003 | K181: 3.44 | L181: 1.78e-002 | M181: 117.5 | N181: 3.3 | O181: 0.151 | P181: 104.24 | Q181: 转股中 | R181: 3.27年 | S181: 1.27年 | T181: 22.5 | U181: 54 | V181: 2.e-002 | W181: 0.14099999999999999 | X181: 0.14699999999999999 | Y181: 159 | Z181: 1.02 | AA181: -6.4000000000000003e-003 | AB181: -1.5700000000000002e-002 | AC181: -0.10199999999999999 | AD181: -0.106 | AE181: 97.92 | AF181: 105.27 | AG181: 0.5 | AH181: AA+ | AI181: 3.49e-002 | AJ181: =H181+100*O181 -> 135.05000000000001 | AK181: 135.7 | AL181: 91 | AM181: 30.4 | AN181: 28 | AO181: 3.7000000000000005e-002 | AP181: 29 | AQ181: 山鹰转债
A182: 29 | B182: 123112 | C182: 万讯转债 | D182: 300112 | E182: 万讯自控 | F182: 机械装备 | G182: 专用设备 | H182: 129 | I182: 0. | J182: -2.e-003 | K182: 10.72 | L182: -2.8000000000000004e-003 | M182: 124.4 | N182: 8.93 | O182: 7.4999999999999997e-002 | P182: 120.04 | Q182: 2月2天 | R182: 5.65年 | S182: 3.65年 | T182: 2.46 | U182: 44 | V182: 0.13699999999999998 | W182: 8.0000000000000002e-002 | X182: 9.6000000000000002e-002 | Y182: 31 | Z182: 2.86 | AA182: -6.5000000000000006e-003 | AB182: -1.3600000000000001e-002 | AC182: -5.4600000000000003e-002 | AD182: -5.6500000000000002e-002 | AE182: 83.06 | AF182: 89.1 | AG182: 0.72 | AH182: AA- | AI182: 6.2199999999999998e-002 | AJ182: =H182+100*O182 -> 136.5 | AK182: 138 | AL182: 118 | AM182: 48.9 | AN182: 158 | AO182: 6.4000000000000001e-002 | AP182: 12 | AQ182: 万讯转债
A183: 56 | B183: 123097 | C183: 美力转债 | D183: 300611 | E183: 美力科技 | F183: 机械装备 | G183: 通用设备 | H183: 125.977 | I183: -5.6999999999999993e-003 | J183: 2.3e-003 | K183: 11.35 | L183: -4.4000000000000003e-003 | M183: 121.6 | N183: 9.28 | O183: 2.9999999999999999e-002 | P183: 122.31 | Q183: 转股中 | R183: 5.45年 | S183: 3.46年 | T183: 3 | U183: 13 | V183: 3.4000000000000002e-002 | W183: 0.14800000000000002 | X183: 0.18100000000000002 | Y183: 20 | Z183: 3.05 | AA183: -6.6e-003 | AB183: -1.3300000000000001e-002 | AC183: -5.0599999999999999e-002 | AD183: -5.28e-002 | AE183: 81.25 | AF183: 83.5 | AG183: 0.77 | AH183: A+ | AI183: 7.3200000000000001e-002 | AJ183: =H183+100*O183 -> 128.977 | AK183: 129.6 | AL183: 37 | AM183: 46.2 | AN183: 139 | AO183: 6.4000000000000001e-002 | AP183: 21 | AQ183: 美力转债
A184: 215 | B184: 113570 | C184: 百达转债! | D184: 603331 | E184: 百达精工 | F184: 机械装备 | G184: 机械装备 | H184: 118.5 | I184: 2.8999999999999998e-003 | J184: 7.3000000000000001e-003 | K184: 12.05 | L184: 1.43e-002 | M184: 114.9 | N184: 11.34 | O184: 0.115 | P184: 106.26 | Q184: 转股中 | R184: 4.57年 | S184: 2.58年 | T184: 2.8 | U184: 6.2 | V184: 1.9e-002 | W184: 0.13 | X184: 0.13900000000000001 | Y184: 21 | Z184: 2.56 | AA184: -6.8999999999999999e-003 | AB184: -1.26e-002 | AC184: -4.8899999999999999e-002 | AD184: -5.1100000000000007e-002 | AE184: 85.63 | AF184: 84.19 | AG184: 0.71 | AH184: A+ | AI184: 7.1900000000000006e-002 | AJ184: =H184+100*O184 -> 130. | AK184: 130.7 | AL184: 44 | AM184: 45.1 | AN184: 131 | AO184: 0.152 | AP184: 34 | AQ184: 百达转债!
A185: 10 | B185: 113050 | C185: 南银转债 | D185: 601009 | E185: 南京银行 | F185: 金融 | G185: 银行行业 | H185: 115.98 | I185: -3.7000000000000002e-003 | J185: 1.e-003 | K185: 9.24 | L185: -5.4000000000000003e-003 | M185: 111.2 | N185: 10.1 | O185: 0.26800000000000002 | P185: 91.49 | Q185: 4月10天 | R185: 5.84年 | S185: 无权 | T185: 200 | U185: 75 | V185: 3.0000000000000001e-003 | W185: 0.21600000000000003 | X185: 0.19800000000000001 | Y185: 925 | Z185: 0.92 | AA185: -7.3000000000000001e-003 | AB185: -1.0800000000000001e-002 | AC185: 无权 | AD185: 无权 | AE185: 无权 | AF185: 91.63 | AG185: 0.5 | AH185: AAA | AI185: 3.4200000000000001e-002 | AJ185: =H185+100*O185 -> 142.78 | AK185: 140.5 | AL185: 145 | AM185: 48.8 | AN185: 156 | AO185: 1.e-003 | AP185: 4 | AQ185: 南银转债
A186: 84 | B186: 127026 | C186: 超声转债! | D186: 823 | E186: 超声电子 | F186: 电子 | G186: 元器件制 | H186: 117.55 | I186: -1.47e-002 | J186: 7.7000000000000002e-003 | K186: 11.7 | L186: -1.3500000000000002e-002 | M186: 113.1 | N186: 12.72 | O186: 0.27800000000000002 | P186: 91.98 | Q186: 转股中 | R186: 5.32年 | S186: 3.32年 | T186: 7 | U186: 10 | V186: 1.3000000000000001e-002 | W186: 0.111 | X186: 0.10199999999999999 | Y186: 63 | Z186: 1.64 | AA186: -7.4000000000000003e-003 | AB186: -1.18e-002 | AC186: -3.5900000000000001e-002 | AD186: -3.7699999999999997e-002 | AE186: 90.11 | AF186: 91.63 | AG186: 0.52 | AH186: AA | AI186: 4.1200000000000001e-002 | AJ186: =H186+100*O186 -> 145.34999999999999 | AK186: 143.1 | AL186: 176 | AM186: 51.5 | AN186: 181 | AO186: 8.0000000000000002e-003 | AP186: 12 | AQ186: 超声转债!
A187: 280 | B187: 113026 | C187: 核能转债! | D187: 601985 | E187: 中国核电 | F187: 能源电力 | G187: 核电 | H187: 112.43 | I187: 7.000000000000001e-004 | J187: -2.3e-003 | K187: 5.09 | L187: -3.9000000000000003e-003 | M187: 109.3 | N187: 5.73 | O187: 0.26600000000000001 | P187: 88.83 | Q187: 转股中 | R187: 3.67年 | S187: 1.67年 | T187: 78 | U187: 31 | V187: 4.0000000000000001e-003 | W187: 8.8000000000000009e-002 | X187: 7.8e-002 | Y187: 889 | Z187: 1.44 | AA187: -7.8000000000000005e-003 | AB187: -1.2500000000000001e-002 | AC187: -4.7899999999999998e-002 | AD187: -5.0700000000000002e-002 | AE187: 96.91 | AF187: 97.29 | AG187: 0.4 | AH187: AAA | AI187: 3.2899999999999999e-002 | AJ187: =H187+100*O187 -> 139.03 | AK187: 136 | AL187: 94 | AM187: 38.7 | AN187: 82 | AO187: 4.0999999999999995e-002 | AP187: 42 | AQ187: 核能转债!
A188: 100 | B188: 127025 | C188: 冀东转债! | D188: 401 | E188: 冀东水泥 | F188: 建筑 | G188: 水泥 | H188: 114.65 | I188: 2.2000000000000001e-003 | J188: 4.7999999999999996e-003 | K188: 12.92 | L188: 1.6500000000000001e-002 | M188: 110.1 | N188: 15.28 | O188: 0.35600000000000004 | P188: 84.55 | Q188: 转股中 | R188: 5.23年 | S188: 3.23年 | T188: 17.8 | U188: 9 | V188: 4.0000000000000001e-003 | W188: 9.6999999999999989e-002 | X188: 8.199999999999999e-002 | Y188: 183 | Z188: 1.23 | AA188: -7.8000000000000005e-003 | AB188: -1.1399999999999999e-002 | AC188: -3.1699999999999999e-002 | AD188: -3.32e-002 | AE188: 91.82 | AF188: 92.61 | AG188: 0.42 | AH188: AAA | AI188: 3.4200000000000001e-002 | AJ188: =H188+100*O188 -> 150.25 | AK188: 144.7 | AL188: 183 | AM188: 52.1 | AN188: 187 | AO188: 4.2999999999999997e-002 | AP188: 9 | AQ188: 冀东转债!
A189: 288 | B189: 110057 | C189: 现代转债 | D189: 600420 | E189: 国药现代 | F189: 医药 | G189: 化学制药 | H189: 113.64 | I189: 1.e-004 | J189: 4.0000000000000002e-004 | K189: 9.48 | L189: 1.1000000000000001e-003 | M189: 110.3 | N189: 9.79 | O189: 0.17399999999999999 | P189: 96.83 | Q189: 转股中 | R189: 3.63年 | S189: 1.63年 | T189: 16.2 | U189: 19 | V189: 1.e-002 | W189: 0.16600000000000001 | X189: 0.161 | Y189: 97 | Z189: 1.2 | AA189: -8.3000000000000001e-003 | AB189: -1.3500000000000002e-002 | AC189: -5.4600000000000003e-002 | AD189: -5.74e-002 | AE189: 97.03 | AF189: 98.3 | AG189: 0.5 | AH189: AAA | AI189: 3.2899999999999999e-002 | AJ189: =H189+100*O189 -> 131.03999999999999 | AK189: 130.4 | AL189: 42 | AM189: 32.2 | AN189: 35 | AO189: -9.0000000000000011e-003 | AP189: 24 | AQ189: 现代转债
A190: 159 | B190: 128121 | C190: 宏川转债! | D190: 2930 | E190: 宏川智慧 | F190: 交通运输 | G190: 物流业 | H190: 117.611 | I190: -2.5000000000000001e-003 | J190: 1.5e-003 | K190: 17.55 | L190: -1.7000000000000001e-003 | M190: 112.9 | N190: 19.92 | O190: 0.33500000000000002 | P190: 88.1 | Q190: 转股中 | R190: 4.92年 | S190: 2.93年 | T190: 6.7 | U190: 3.8 | V190: 5.0000000000000001e-003 | W190: 8.5999999999999993e-002 | X190: 7.5999999999999998e-002 | Y190: 78 | Z190: 3.76 | AA190: -8.3999999999999995e-003 | AB190: -1.3100000000000001e-002 | AC190: -4.1100000000000005e-002 | AD190: -4.3099999999999999e-002 | AE190: 86.25 | AF190: 84.86 | AG190: 0.57 | AH190: AA- | AI190: 6.0899999999999996e-002 | AJ190: =H190+100*O190 -> 151.11099999999999 | AK190: 147.1 | AL190: 198 | AM190: 60.9 | AN190: 231 | AO190: 5.0000000000000001e-003 | AP190: 5 | AQ190: 宏川转债!
A191: 117 | B191: 123068 | C191: 弘信转债 | D191: 300657 | E191: 弘信电子 | F191: 电子 | G191: 元器件制 | H191: 126.502 | I191: -1.1699999999999999e-002 | J191: -6.8000000000000005e-003 | K191: 17.41 | L191: -2.63e-002 | M191: 121.2 | N191: 15.34 | O191: 0.115 | P191: 113.49 | Q191: 转股中 | R191: 5.17年 | S191: 3.17年 | T191: 5.65 | U191: 11 | V191: 1.4999999999999999e-002 | W191: 7.9000000000000001e-002 | X191: 8.9999999999999997e-002 | Y191: 71 | Z191: 4.24 | AA191: -8.3999999999999995e-003 | AB191: -1.5300000000000001e-002 | AC191: -5.7300000000000004e-002 | AD191: -5.9400000000000001e-002 | AE191: 85.34 | AF191: 89.37 | AG191: 0.7 | AH191: AA- | AI191: 6.2199999999999998e-002 | AJ191: =H191+100*O191 -> 138.00200000000001 | AK191: 139.5 | AL191: 137 | AM191: 50.1 | AN191: 170 | AO191: -4.4000000000000004e-002 | AP191: 9 | AQ191: 弘信转债
A192: 36 | B192: 110079 | C192: 杭银转债! | D192: 600926 | E192: 杭州银行 | F192: 金融 | G192: 银行行业 | H192: 117.98 | I192: 4.0000000000000001e-003 | J192: -8.3999999999999995e-003 | K192: 13.55 | L192: -1.1699999999999999e-002 | M192: 112.4 | N192: 16.71 | O192: 0.45500000000000002 | P192: 81.09 | Q192: 56天 | R192: 5.62年 | S192: 无权 | T192: 150 | U192: 273 | V192: 1.4999999999999999e-002 | W192: 0.187 | X192: 0.151 | Y192: 804 | Z192: 1.22 | AA192: -8.6999999999999994e-003 | AB192: -1.26e-002 | AC192: 无权 | AD192: 无权 | AE192: 无权 | AF192: 93.3 | AG192: 0.37 | AH192: AAA | AI192: 3.4200000000000001e-002 | AJ192: =H192+100*O192 -> 163.48000000000002 | AK192: 154.9 | AL192: 251 | AM192: 61.6 | AN192: 241 | AO192: 6.0999999999999999e-002 | AP192: 10 | AQ192: 杭银转债!
A193: 233 | B193: 128090 | C193: 汽模转2 | D193: 2510 | E193: 天汽模 | F193: 汽车 | G193: 零部件制 | H193: 119.31 | I193: -8.1000000000000013e-003 | J193: -6.3e-003 | K193: 4.41 | L193: -2.2200000000000001e-002 | M193: 114.9 | N193: 4.23 | O193: 0.14400000000000002 | P193: 104.26 | Q193: 转股中 | R193: 4.37年 | S193: 2.37年 | T193: 3.1 | U193: 106 | V193: 0.28499999999999998 | W193: 7.4999999999999997e-002 | X193: 7.8e-002 | Y193: 42 | Z193: 2.06 | AA193: -8.8000000000000005e-003 | AB193: -1.4800000000000001e-002 | AC193: -5.5300000000000002e-002 | AD193: -5.7699999999999994e-002 | AE193: 89.13 | AF193: 89.23 | AG193: 0.65 | AH193: AA- | AI193: 6.0899999999999996e-002 | AJ193: =H193+100*O193 -> 133.71000000000001 | AK193: 134.4 | AL193: 75 | AM193: 45.1 | AN193: 132 | AO193: 7.0999999999999994e-002 | AP193: 29 | AQ193: 汽模转2
A194: 304 | B194: 110051 | C194: 中天转债! | D194: 600522 | E194: 中天科技 | F194: 通信互联 | G194: 通信设备 | H194: 116.89 | I194: -7.1999999999999998e-003 | J194: -4.8999999999999998e-003 | K194: 9.28 | L194: -2.9300000000000003e-002 | M194: 113.3 | N194: 9.99 | O194: 0.25800000000000001 | P194: 92.89 | Q194: 转股中 | R194: 3.55年 | S194: 1.55年 | T194: 39.6 | U194: 710 | V194: 0.152 | W194: 0.13900000000000001 | X194: 0.129 | Y194: 285 | Z194: 1.22 | AA194: -8.8999999999999999e-003 | AB194: -1.5600000000000001e-002 | AC194: -7.2800000000000004e-002 | AD194: -7.5700000000000003e-002 | AE194: 96.98 | AF194: 100.56 | AG194: 0.41 | AH194: AA+ | AI194: 3.49e-002 | AJ194: =H194+100*O194 -> 142.69 | AK194: 140.9 | AL194: 152 | AM194: 40.3 | AN194: 101 | AO194: 0.106 | AP194: 26 | AQ194: 中天转债!
A195: 246 | B195: 113549 | C195: 白电转债 | D195: 603861 | E195: 白云电器 | F195: 能源电力 | G195: 电力设备 | H195: 119.3 | I195: 1.4000000000000002e-003 | J195: -5.3e-003 | K195: 9.27 | L195: -6.4000000000000003e-003 | M195: 114.8 | N195: 8.81 | O195: 0.13400000000000001 | P195: 105.22 | Q195: 转股中 | R195: 4.25年 | S195: 2.26年 | T195: 8.8 | U195: 13 | V195: 1.3000000000000001e-002 | W195: 0.215 | X195: 0.22600000000000001 | Y195: 41 | Z195: 1.59 | AA195: -9.1999999999999998e-003 | AB195: -1.5300000000000001e-002 | AC195: -5.8200000000000002e-002 | AD195: -6.0599999999999994e-002 | AE195: 94.04 | AF195: 97.53 | AG195: 0.6 | AH195: AA | AI195: 3.9900000000000005e-002 | AJ195: =H195+100*O195 -> 132.69999999999999 | AK195: 133.4 | AL195: 67 | AM195: 35.9 | AN195: 55 | AO195: 3.6000000000000004e-002 | AP195: 40 | AQ195: 白电转债
A196: 316 | B196: 128048 | C196: 张行转债 | D196: 2839 | E196: 张家港行 | F196: 金融 | G196: 银行行业 | H196: 116.71 | I196: -4.1999999999999997e-003 | J196: 5.1000000000000004e-003 | K196: 5.73 | L196: 1.7000000000000001e-003 | M196: 113.3 | N196: 5.6 | O196: 0.14099999999999999 | P196: 102.32 | Q196: 转股中 | R196: 3.25年 | S196: 无权 | T196: 25 | U196: 31 | V196: 1.1000000000000001e-002 | W196: 0.24100000000000002 | X196: 0.247 | Y196: 104 | Z196: 0.93 | AA196: -9.300000000000001e-003 | AB196: -1.66e-002 | AC196: 无权 | AD196: 无权 | AE196: 无权 | AF196: 101.6 | AG196: 0.52 | AH196: AA+ | AI196: 3.49e-002 | AJ196: =H196+100*O196 -> 130.81 | AK196: 131.1 | AL196: 46 | AM196: 29.5 | AN196: 24 | AO196: 2.1000000000000001e-002 | AP196: 12 | AQ196: 张行转债
A197: 63 | B197: 113618 | C197: 美诺转债! | D197: 603538 | E197: 美诺华 | F197: 医药 | G197: 原料药 | H197: 121.31 | I197: 1.2999999999999999e-003 | J197: -4.0000000000000002e-004 | K197: 34.13 | L197: 1.5e-003 | M197: 115.3 | N197: 37.47 | O197: 0.33200000000000002 | P197: 91.09 | Q197: 转股中 | R197: 5.42年 | S197: 3.42年 | T197: 5.2 | U197: 7.3 | V197: 1.2e-002 | W197: 0.10199999999999999 | X197: 9.3000000000000013e-002 | Y197: 51 | Z197: 3.08 | AA197: -9.4999999999999998e-003 | AB197: -1.4499999999999999e-002 | AC197: -4.2900000000000001e-002 | AD197: -4.4800000000000006e-002 | AE197: 83.79 | AF197: 83.71 | AG197: 0.61 | AH197: AA- | AI197: 6.2199999999999998e-002 | AJ197: =H197+100*O197 -> 154.50999999999999 | AK197: 151.5 | AL197: 232 | AM197: 67.7 | AN197: 271 | AO197: -6.2e-002 | AP197: 5 | AQ197: 美诺转债!
A198: 103 | B198: 128136 | C198: 立讯转债! | D198: 2475 | E198: 立讯精密 | F198: 电子 | G198: 元器件制 | H198: 117.649 | I198: -4.0000000000000001e-003 | J198: -1.03e-002 | K198: 39.34 | L198: -6.6900000000000001e-002 | M198: 111.9 | N198: 58.2 | O198: 0.74099999999999999 | P198: 67.59 | Q198: 转股中 | R198: 5.22年 | S198: 3.22年 | T198: 30 | U198: 26 | V198: 6.9999999999999993e-003 | W198: 1.1000000000000001e-002 | X198: 6.9999999999999993e-003 | Y198: 2768. | Z198: 9.57 | AA198: -9.7000000000000003e-003 | AB198: -1.37e-002 | AC198: -4.0199999999999993e-002 | AD198: -4.1500000000000002e-002 | AE198: 90.81 | AF198: 93.14 | AG198: 0.21 | AH198: AA+ | AI198: 3.6200000000000003e-002 | AJ198: =H198+100*O198 -> 191.749 | AK198: 167.7 | AL198: 293 | AM198: 74.6 | AN198: 289 | AO198: -2.9999999999999999e-002 | AP198: 13 | AQ198: 立讯转债!
A199: 275 | B199: 113536 | C199: 三星转债 | D199: 603578 | E199: 三星新材 | F199: 家电 | G199: 零部件制 | H199: 118.86 | I199: 8.6999999999999994e-003 | J199: -1.1999999999999999e-003 | K199: 14.03 | L199: 1.37e-002 | M199: 114.3 | N199: 13.76 | O199: 0.16600000000000001 | P199: 101.96 | Q199: 转股中 | R199: 3.79年 | S199: 1.80年 | T199: 1.49 | U199: 9.1 | V199: 5.0999999999999997e-002 | W199: 8.3000000000000004e-002 | X199: 8.4000000000000005e-002 | Y199: 18 | Z199: 1.73 | AA199: -1.04e-002 | AB199: -1.7100000000000001e-002 | AC199: -7.17e-002 | AD199: -7.4200000000000002e-002 | AE199: 95.25 | AF199: 98.79 | AG199: 0.54 | AH199: AA | AI199: 3.9900000000000005e-002 | AJ199: =H199+100*O199 -> 135.46000000000001 | AK199: 135.8 | AL199: 92 | AM199: 37 | AN199: 64 | AO199: 2.4e-002 | AP199: 35 | AQ199: 三星转债
A200: 33 | B200: 123110 | C200: 九典转债 | D200: 300705 | E200: 九典制药 | F200: 医药 | G200: 化学制药 | H200: 129.022 | I200: -1.8799999999999997e-002 | J200: 2.1299999999999999e-002 | K200: 29.53 | L200: 3.4000000000000002e-003 | M200: 121.4 | N200: 26.44 | O200: 0.155 | P200: 111.69 | Q200: 56天 | R200: 5.63年 | S200: 3.63年 | T200: 2.7 | U200: 98 | V200: 0.27899999999999997 | W200: 3.9e-002 | X200: 4.4000000000000004e-002 | Y200: 69 | Z200: 7.38 | AA200: -1.1000000000000001e-002 | AB200: -1.7299999999999999e-002 | AC200: -5.4699999999999999e-002 | AD200: -5.67e-002 | AE200: 80.06 | AF200: 82.28 | AG200: 0.73 | AH200: A+ | AI200: 7.3200000000000001e-002 | AJ200: =H200+100*O200 -> 144.52199999999999 | AK200: 146.4 | AL200: 194 | AM200: 64.1 | AN200: 257 | AO200: 6.0000000000000001e-003 | AP200: 7 | AQ200: 九典转债
A201: 297 | B201: 110053 | C201: 苏银转债! | D201: 600919 | E201: 江苏银行 | F201: 金融 | G201: 银行行业 | H201: 123 | I201: 5.0000000000000001e-004 | J201: -6.8999999999999999e-003 | K201: 6.89 | L201: -1.15e-002 | M201: 118.3 | N201: 6.37 | O201: 0.13699999999999998 | P201: 108.16 | Q201: 转股中 | R201: 3.58年 | S201: 无权 | T201: 200 | U201: 132 | V201: 5.0000000000000001e-003 | W201: 0.19699999999999998 | X201: 0.21299999999999999 | Y201: 1018. | Z201: 0.73 | AA201: -1.11e-002 | AB201: -1.9900000000000001e-002 | AC201: 无权 | AD201: 无权 | AE201: 无权 | AF201: 105.72 | AG201: 0.56 | AH201: AAA | AI201: 3.2899999999999999e-002 | AJ201: =H201+100*O201 -> 136.69999999999999 | AK201: 137.8 | AL201: 116 | AM201: 32.1 | AN201: 34 | AO201: 3.5000000000000003e-002 | AP201: 37 | AQ201: 苏银转债!
A202: 37 | B202: 113622 | C202: 杭叉转债! | D202: 603298 | E202: 杭叉集团 | F202: 机械装备 | G202: 通用设备 | H202: 120.13 | I202: 4.0999999999999995e-003 | J202: 1.9599999999999999e-002 | K202: 19.77 | L202: 5.33e-002 | M202: 112.5 | N202: 23.08 | O202: 0.40200000000000002 | P202: 85.66 | Q202: 56天 | R202: 5.61年 | S202: 3.61年 | T202: 11.5 | U202: 18 | V202: 1.3000000000000001e-002 | W202: 6.7000000000000004e-002 | X202: 5.7999999999999996e-002 | Y202: 171 | Z202: 3.34 | AA202: -1.18e-002 | AB202: -1.5800000000000002e-002 | AC202: -4.0099999999999997e-002 | AD202: -4.1500000000000002e-002 | AE202: 90.12 | AF202: 92.42 | AG202: 0.44 | AH202: AA+ | AI202: 3.6200000000000003e-002 | AJ202: =H202+100*O202 -> 160.32999999999998 | AK202: 154.6 | AL202: 249 | AM202: 62.2 | AN202: 244 | AO202: 0.159 | AP202: 4 | AQ202: 杭叉转债!
A203: 244 | B203: 128081 | C203: 海亮转债! | D203: 2203 | E203: 海亮股份 | F203: 有色金属 | G203: 铜金属 | H203: 120.894 | I203: -8.9999999999999998e-004 | J203: 7.7000000000000002e-003 | K203: 11.24 | L203: 9.8999999999999991e-003 | M203: 114.9 | N203: 9.69 | O203: 4.2000000000000003e-002 | P203: 116 | Q203: 转股中 | R203: 4.27年 | S203: 2.27年 | T203: 30.1 | U203: 22 | V203: 6.0000000000000001e-003 | W203: 0.13600000000000001 | X203: 0.158 | Y203: 221 | Z203: 2.32 | AA203: -1.21e-002 | AB203: -1.8200000000000001e-002 | AC203: -6.2699999999999992e-002 | AD203: -6.5099999999999991e-002 | AE203: 94.08 | AF203: 97.56 | AG203: 0.69 | AH203: AA | AI203: 3.9900000000000005e-002 | AJ203: =H203+100*O203 -> 125.09400000000001 | AK203: 125.8 | AL203: 20 | AM203: 28.2 | AN203: 19 | AO203: 1.3999999999999999e-002 | AP203: 50 | AQ203: 海亮转债!
A204: 240 | B204: 110063 | C204: 鹰19转债 | D204: 600567 | E204: 山鹰国际 | F204: 造纸包装 | G204: 包装用纸 | H204: 122.05 | I204: 2.0199999999999999e-002 | J204: -1.01e-002 | K204: 3.44 | L204: 1.78e-002 | M204: 115.9 | N204: 3.26 | O204: 0.157 | P204: 105.52 | Q204: 转股中 | R204: 4.33年 | S204: 2.33年 | T204: 18.5 | U204: 36 | V204: 1.6e-002 | W204: 0.11599999999999999 | X204: 0.12300000000000001 | Y204: 159 | Z204: 1.02 | AA204: -1.21e-002 | AB204: -1.8500000000000003e-002 | AC204: -6.5299999999999997e-002 | AD204: -6.7599999999999993e-002 | AE204: 94.82 | AF204: 100.19 | AG204: 0.57 | AH204: AA+ | AI204: 3.49e-002 | AJ204: =H204+100*O204 -> 137.75 | AK204: 138.6 | AL204: 127 | AM204: 38.4 | AN204: 79 | AO204: 3.7000000000000005e-002 | AP204: 32 | AQ204: 鹰19转债
A205: 333 | B205: 128039 | C205: 三力转债! | D205: 2224 | E205: 三 力 士 | F205: 机械装备 | G205: 专用设备 | H205: 112.7 | I205: 1.2999999999999999e-003 | J205: -8.6999999999999994e-003 | K205: 5.06 | L205: -1.7500000000000002e-002 | M205: 108.8 | N205: 5.79 | O205: 0.28999999999999998 | P205: 87.39 | Q205: 转股中 | R205: 2.82年 | S205: 0.82年 | T205: 2.02 | U205: 17 | V205: 7.4999999999999997e-002 | W205: 5.5e-002 | X205: 4.8000000000000001e-002 | Y205: 37 | Z205: 1.6 | AA205: -1.26e-002 | AB205: -1.83e-002 | AC205: -0.10099999999999999 | AD205: -0.10300000000000001 | AE205: 95.95 | AF205: 92.68 | AG205: 0.42 | AH205: AA- | AI205: 5.9400000000000001e-002 | AJ205: =H205+100*O205 -> 141.69999999999999 | AK205: 138 | AL205: 121 | AM205: 42.1 | AN205: 114 | AO205: -6.9999999999999993e-003 | AP205: 29 | AQ205: 三力转债!
A206: 157 | B206: 113593 | C206: 沪工转债! | D206: 603131 | E206: 上海沪工 | F206: 机械装备 | G206: 通用设备 | H206: 129.11 | I206: 6.6199999999999995e-002 | J206: 1.7000000000000001e-003 | K206: 22.35 | L206: 9.9900000000000003e-002 | M206: 121.2 | N206: 21.12 | O206: 0.22 | P206: 105.82 | Q206: 转股中 | R206: 4.93年 | S206: 2.93年 | T206: 4 | U206: 427 | V206: 0.82599999999999996 | W206: 5.5999999999999994e-002 | X206: 5.9999999999999998e-002 | Y206: 71 | Z206: 5.4 | AA206: -1.3000000000000001e-002 | AB206: -2.0199999999999999e-002 | AC206: -6.7299999999999999e-002 | AD206: -6.9599999999999995e-002 | AE206: 84.18 | AF206: 86.71 | AG206: 0.68 | AH206: A+ | AI206: 7.1900000000000006e-002 | AJ206: =H206+100*O206 -> 151.11000000000001 | AK206: 152.4 | AL206: 239 | AM206: 65.7 | AN206: 262 | AO206: 0.23899999999999999 | AP206: 10 | AQ206: 沪工转债!
A207: 257 | B207: 128078 | C207: 太极转债! | D207: 2368 | E207: 太极股份 | F207: 计算机及 | G207: 软件开发 | H207: 124.22 | I207: -7.8000000000000005e-003 | J207: 7.8000000000000005e-003 | K207: 22.31 | L207: -1.6299999999999999e-002 | M207: 116.9 | N207: 22.21 | O207: 0.23699999999999999 | P207: 100.45 | Q207: 转股中 | R207: 4.19年 | S207: 2.19年 | T207: 9.6 | U207: 4.9 | V207: 4.0000000000000001e-003 | W207: 7.400000000000001e-002 | X207: 7.4999999999999997e-002 | Y207: 129 | Z207: 3.86 | AA207: -1.47e-002 | AB207: -2.1600000000000001e-002 | AC207: -7.5700000000000003e-002 | AD207: -7.8100000000000003e-002 | AE207: 94.4 | AF207: 99.58 | AG207: 0 | AH207: AA | AI207: 3.9900000000000005e-002 | AJ207: =H207+100*O207 -> 147.91999999999999 | AK207: 148 | AL207: 208 | AM207: 48.4 | AN207: 153 | AO207: -2.4e-002 | AP207: 10 | AQ207: 太极转债!
A208: 23 | B208: 113048 | C208: 晶科转债! | D208: 601778 | E208: 晶科科技 | F208: 能源电力 | G208: 太阳能 | H208: 127.22 | I208: 1.8200000000000001e-002 | J208: 1.0700000000000001e-002 | K208: 6.45 | L208: 4.0300000000000002e-002 | M208: 117.1 | N208: 5.48 | O208: 8.1000000000000003e-002 | P208: 117.7 | Q208: 2月17天 | R208: 5.69年 | S208: 3.69年 | T208: 30 | U208: 107 | V208: 2.7999999999999997e-002 | W208: 0.16800000000000001 | X208: 0.19800000000000001 | Y208: 178 | Z208: 1.64 | AA208: -1.47e-002 | AB208: -1.9799999999999998e-002 | AC208: -5.2199999999999996e-002 | AD208: -5.3800000000000001e-002 | AE208: 88.77 | AF208: 93.44 | AG208: 0.72 | AH208: AA | AI208: 4.1200000000000001e-002 | AJ208: =H208+100*O208 -> 135.31999999999999 | AK208: 136.7 | AL208: 106 | AM208: 43.3 | AN208: 119 | AO208: 0.129 | AP208: 8 | AQ208: 晶科转债!
A209: 366 | B209: 128014 | C209: 永东转债! | D209: 2753 | E209: 永东股份 | F209: 化工 | G209: 化工 | H209: 112.552 | I209: 1.3999999999999999e-002 | J209: -5.6000000000000008e-003 | K209: 10.97 | L209: 2.9100000000000001e-002 | M209: 109.8 | N209: 12.52 | O209: 0.28499999999999998 | P209: 87.62 | Q209: 转股中 | R209: 1.68年 | S209: 回售内 | T209: 3.37 | U209: 6.5 | V209: 1.7000000000000001e-002 | W209: 8.199999999999999e-002 | X209: 7.2000000000000008e-002 | Y209: 41 | Z209: 2.08 | AA209: -1.4800000000000001e-002 | AB209: -2.5399999999999999e-002 | AC209: 回售内 | AD209: 回售内 | AE209: 100.3 | AF209: 99.77 | AG209: 0.29 | AH209: AA- | AI209: 5.9400000000000001e-002 | AJ209: =H209+100*O209 -> 141.05199999999999 | AK209: 137.5 | AL209: 115 | AM209: 37.2 | AN209: 67 | AO209: 0.109 | AP209: 36 | AQ209: 永东转债!
A210: 18 | B210: 127035 | C210: 濮耐转债 | D210: 2225 | E210: 濮耐股份 | F210: 钢铁 | G210: 钢铁行业 | H210: 123.219 | I210: 1.9199999999999998e-002 | J210: -5.5000000000000005e-003 | K210: 4.81 | L210: 2.12e-002 | M210: 114.7 | N210: 4.43 | O210: 0.13500000000000001 | P210: 108.58 | Q210: 3月20天 | R210: 4.78年 | S210: 2.78年 | T210: 6.26 | U210: 31 | V210: 4.0000000000000001e-002 | W210: 0.129 | X210: 0.14000000000000001 | Y210: 49 | Z210: 1.6 | AA210: -1.52e-002 | AB210: -2.0499999999999997e-002 | AC210: -5.8099999999999999e-002 | AD210: -6.0100000000000001e-002 | AE210: 92.21 | AF210: 95.49 | AG210: 0.64 | AH210: AA | AI210: 3.9900000000000005e-002 | AJ210: =H210+100*O210 -> 136.71899999999999 | AK210: 137.9 | AL210: 117 | AM210: 42.4 | AN210: 116 | AO210: 6.9000000000000006e-002 | AP210: 10 | AQ210: 濮耐转债
A211: 75 | B211: 123087 | C211: 明电转债! | D211: 300739 | E211: 明阳电路 | F211: 电子 | G211: 元器件制 | H211: 131.41 | I211: -2.7699999999999999e-002 | J211: -9.1000000000000004e-003 | K211: 20.9 | L211: -4.7400000000000005e-002 | M211: 121.2 | N211: 16.32 | O211: 2.6000000000000002e-002 | P211: 128.06 | Q211: 转股中 | R211: 5.34年 | S211: 4.34年 | T211: 4.2 | U211: 310 | V211: 0.55799999999999994 | W211: 6.8000000000000005e-002 | X211: 8.6999999999999994e-002 | Y211: 62 | Z211: 4.12 | AA211: -1.5300000000000001e-002 | AB211: -2.1899999999999999e-002 | AC211: -4.5899999999999996e-002 | AD211: -4.8399999999999999e-002 | AE211: 81.71 | AF211: 88.47 | AG211: 0.78 | AH211: AA- | AI211: 6.2199999999999998e-002 | AJ211: =H211+100*O211 -> 134.00999999999999 | AK211: 134.8 | AL211: 82 | AM211: 46.3 | AN211: 140 | AO211: 4.7e-002 | AP211: 19 | AQ211: 明电转债!
A212: 167 | B212: 123057 | C212: 美联转债! | D212: 300586 | E212: 美联新材 | F212: 化工 | G212: 橡胶塑料 | H212: 127.1 | I212: 2.2000000000000002e-002 | J212: 8.3999999999999995e-003 | K212: 10.81 | L212: 4.24e-002 | M212: 117.8 | N212: 9.5 | O212: 0.11699999999999999 | P212: 113.79 | Q212: 转股中 | R212: 4.88年 | S212: 2.88年 | T212: 2.07 | U212: 347 | V212: 1.3100000000000001 | W212: 3.6000000000000004e-002 | X212: 4.2000000000000003e-002 | Y212: 57 | Z212: 6.64 | AA212: -1.5800000000000002e-002 | AB212: -2.2000000000000002e-002 | AC212: -6.5000000000000002e-002 | AD212: -6.7099999999999993e-002 | AE212: 86.77 | AF212: 88.83 | AG212: 0.72 | AH212: AA- | AI212: 6.0899999999999996e-002 | AJ212: =H212+100*O212 -> 138.79999999999998 | AK212: 140.4 | AL212: 144 | AM212: 51.6 | AN212: 182 | AO212: 0.153 | AP212: 21 | AQ212: 美联转债!
A213: 299 | B213: 128057 | C213: 博彦转债 | D213: 2649 | E213: 博彦科技 | F213: 计算机及 | G213: 软件开发 | H213: 123.136 | I213: -5.4000000000000003e-003 | J213: 3.2000000000000002e-003 | K213: 9.86 | L213: -3.0000000000000001e-003 | M213: 116.3 | N213: 8.5 | O213: 6.2e-002 | P213: 116 | Q213: 转股中 | R213: 3.56年 | S213: 1.56年 | T213: 4.94 | U213: 11 | V213: 1.8000000000000002e-002 | W213: 9.4e-002 | X213: 0.109 | Y213: 53 | Z213: 1.73 | AA213: -1.6200000000000003e-002 | AB213: -2.41e-002 | AC213: -0.10000000000000001 | AD213: -0.10300000000000001 | AE213: 92.91 | AF213: 94.63 | AG213: 0.71 | AH213: AA- | AI213: 6.0899999999999996e-002 | AJ213: =H213+100*O213 -> 129.33599999999998 | AK213: 130.3 | AL213: 41 | AM213: 35.6 | AN213: 53 | AO213: -1.3000000000000001e-002 | AP213: 27 | AQ213: 博彦转债
A214: 34 | B214: 123108 | C214: 乐普转2 | D214: 300003 | E214: 乐普医疗 | F214: 医药 | G214: 医疗器械 | H214: 119.9 | I214: -5.4000000000000003e-003 | J214: 1.7000000000000001e-003 | K214: 26.28 | L214: -8.3000000000000001e-003 | M214: 111.1 | N214: 29.5 | O214: 0.34600000000000003 | P214: 89.08 | Q214: 56天 | R214: 4.62年 | S214: 2.63年 | T214: 16.4 | U214: 23 | V214: 1.2e-002 | W214: 3.5000000000000003e-002 | X214: 3.1e-002 | Y214: 474 | Z214: 4.46 | AA214: -1.6500000000000001e-002 | AB214: -2.0799999999999999e-002 | AC214: -5.6299999999999996e-002 | AD214: -5.7599999999999998e-002 | AE214: 92.76 | AF214: 94.98 | AG214: 0.44 | AH214: AA+ | AI214: 3.49e-002 | AJ214: =H214+100*O214 -> 154.5 | AK214: 150.7 | AL214: 231 | AM214: 55.7 | AN214: 215 | AO214: -3.7000000000000005e-002 | AP214: 10 | AQ214: 乐普转2
A215: 118 | B215: 110075 | C215: 南航转债 | D215: 600029 | E215: 南方航空 | F215: 交通运输 | G215: 航空运输 | H215: 119.8 | I215: 8.0000000000000004e-004 | J215: -3.3e-003 | K215: 5.4 | L215: -5.5000000000000005e-003 | M215: 110 | N215: 6.24 | O215: 0.38400000000000001 | P215: 86.54 | Q215: 转股中 | R215: 5.17年 | S215: 3.17年 | T215: 59 | U215: 6.6 | V215: 1.e-003 | W215: 6.4000000000000001e-002 | X215: 5.5999999999999994e-002 | Y215: 915 | Z215: 1.27 | AA215: -1.66e-002 | AB215: -2.0099999999999996e-002 | AC215: -4.6600000000000003e-002 | AD215: -4.7800000000000002e-002 | AE215: 91.46 | AF215: 92.66 | AG215: 0.44 | AH215: AAA | AI215: 3.4200000000000001e-002 | AJ215: =H215+100*O215 -> 158.19999999999999 | AK215: 153.1 | AL215: 242 | AM215: 60.4 | AN215: 230 | AO215: -3.6000000000000004e-002 | AP215: 7 | AQ215: 南航转债
A216: 105 | B216: 123075 | C216: 贝斯转债! | D216: 300580 | E216: 贝斯特 | F216: 汽车 | G216: 零部件制 | H216: 125.95 | I216: -7.3000000000000001e-003 | J216: 1.1999999999999999e-003 | K216: 24.54 | L216: -8.8999999999999999e-003 | M216: 115.5 | N216: 23.74 | O216: 0.218 | P216: 103.37 | Q216: 转股中 | R216: 5.22年 | S216: 3.22年 | T216: 6 | U216: 12 | V216: 1.4999999999999999e-002 | W216: 0.122 | X216: 0.126 | Y216: 49 | Z216: 2.85 | AA216: -1.6799999999999999e-002 | AB216: -2.1899999999999999e-002 | AC216: -5.5899999999999998e-002 | AD216: -5.79e-002 | AE216: 84.83 | AF216: 84.88 | AG216: 0.68 | AH216: AA- | AI216: 6.2199999999999998e-002 | AJ216: =H216+100*O216 -> 147.75 | AK216: 148.5 | AL216: 211 | AM216: 63.6 | AN216: 254 | AO216: 0.109 | AP216: 9 | AQ216: 贝斯转债!
A217: 156 | B217: 127020 | C217: 中金转债 | D217: 60 | E217: 中金岭南 | F217: 有色金属 | G217: 有色行业 | H217: 123.5 | I217: -1.2999999999999999e-003 | J217: 2.5999999999999999e-003 | K217: 5.58 | L217: 1.8e-003 | M217: 113.5 | N217: 4.63 | O217: 2.5000000000000001e-002 | P217: 120.52 | Q217: 转股中 | R217: 4.93年 | S217: 2.93年 | T217: 38 | U217: 169 | V217: 3.6000000000000004e-002 | W217: 0.191 | X217: 0.23000000000000001 | Y217: 199 | Z217: 1.67 | AA217: -1.72e-002 | AB217: -2.2000000000000002e-002 | AC217: -5.9299999999999999e-002 | AD217: -6.0599999999999994e-002 | AE217: 91.98 | AF217: 96.03 | AG217: 0.71 | AH217: AA+ | AI217: 3.49e-002 | AJ217: =H217+100*O217 -> 126. | AK217: 126.5 | AL217: 22 | AM217: 30.4 | AN217: 29 | AO217: 8.900000000000001e-002 | AP217: 16 | AQ217: 中金转债
A218: 86 | B218: 128140 | C218: 润建转债! | D218: 2929 | E218: 润建股份 | F218: 通信互联 | G218: 通信设备 | H218: 126.131 | I218: -9.5999999999999992e-003 | J218: 1.2999999999999999e-003 | K218: 28.16 | L218: -1.3000000000000001e-002 | M218: 115.2 | N218: 26.4 | O218: 0.182 | P218: 106.67 | Q218: 转股中 | R218: 5.32年 | S218: 3.32年 | T218: 10.9 | U218: 12 | V218: 9.0000000000000011e-003 | W218: 0.17499999999999999 | X218: 0.187 | Y218: 62 | Z218: 1.97 | AA218: -1.72e-002 | AB218: -2.2200000000000001e-002 | AC218: -5.5099999999999996e-002 | AD218: -5.7000000000000002e-002 | AE218: 90.22 | AF218: 93.35 | AG218: 0.64 | AH218: AA | AI218: 4.1200000000000001e-002 | AJ218: =H218+100*O218 -> 144.33099999999999 | AK218: 145.6 | AL218: 188 | AM218: 52.2 | AN218: 188 | AO218: 6.9999999999999993e-003 | AP218: 12 | AQ218: 润建转债!
A219: 187 | B219: 113579 | C219: 健友转债! | D219: 603707 | E219: 健友股份 | F219: 医药 | G219: 原料药 | H219: 123.74 | I219: 1.e-003 | J219: -1.06e-002 | K219: 31.24 | L219: -1.7899999999999999e-002 | M219: 113.9 | N219: 32.2 | O219: 0.27500000000000002 | P219: 97.02 | Q219: 转股中 | R219: 4.69年 | S219: 2.69年 | T219: 5.03 | U219: 10 | V219: 1.6e-002 | W219: 1.3000000000000001e-002 | X219: 1.3000000000000001e-002 | Y219: 380 | Z219: 7.31 | AA219: -1.78e-002 | AB219: -2.3e-002 | AC219: -6.13e-002 | AD219: -6.3399999999999998e-002 | AE219: 92.55 | AF219: 95.14 | AG219: 0.54 | AH219: AA | AI219: 3.9900000000000005e-002 | AJ219: =H219+100*O219 -> 151.24000000000001 | AK219: 150.5 | AL219: 230 | AM219: 55.3 | AN219: 212 | AO219: 2.e-002 | AP219: 9 | AQ219: 健友转债!
A220: 152 | B220: 123061 | C220: 航新转债! | D220: 300424 | E220: 航新科技 | F220: 航空航天 | G220: 航空航天 | H220: 135.88 | I220: -6.7000000000000002e-003 | J220: 1.29e-002 | K220: 18.38 | L220: 8.199999999999999e-003 | M220: 124.3 | N220: 14.85 | O220: 9.8000000000000004e-002 | P220: 123.77 | Q220: 转股中 | R220: 4.94年 | S220: 2.94年 | T220: 2.5 | U220: 584 | V220: 1.7 | W220: 5.7000000000000002e-002 | X220: 7.0000000000000007e-002 | Y220: 44 | Z220: 6.61 | AA220: -1.8200000000000001e-002 | AB220: -2.6200000000000001e-002 | AC220: -8.2599999999999993e-002 | AD220: -8.48e-002 | AE220: 84.19 | AF220: 88.91 | AG220: 0.75 | AH220: A+ | AI220: 7.1900000000000006e-002 | AJ220: =H220+100*O220 -> 145.68000000000001 | AK220: 148 | AL220: 207 | AM220: 59.1 | AN220: 225 | AO220: 5.5999999999999994e-002 | AP220: 20 | AQ220: 航新转债!
A221: 131 | B221: 113602 | C221: 景20转债! | D221: 603228 | E221: 景旺电子 | F221: 电子 | G221: 元器件制 | H221: 124.44 | I221: -1.21e-002 | J221: -2.2000000000000002e-002 | K221: 27.76 | L221: -5.6100000000000004e-002 | M221: 113.3 | N221: 27.4 | O221: 0.22800000000000001 | P221: 101.31 | Q221: 转股中 | R221: 5年10天 | S221: 3年11天 | T221: 17.8 | U221: 49 | V221: 2.2000000000000002e-002 | W221: 7.4999999999999997e-002 | X221: 7.5999999999999998e-002 | Y221: 237 | Z221: 3.64 | AA221: -1.89e-002 | AB221: -2.35e-002 | AC221: -5.57e-002 | AD221: -5.7800000000000004e-002 | AE221: 91.37 | AF221: 92.9 | AG221: 0.61 | AH221: AA | AI221: 4.1200000000000001e-002 | AJ221: =H221+100*O221 -> 147.24000000000001 | AK221: 147.6 | AL221: 201 | AM221: 54.7 | AN221: 207 | AO221: -5.2000000000000005e-002 | AP221: 9 | AQ221: 景20转债!
A222: 55 | B222: 123098 | C222: 一品转债 | D222: 300723 | E222: 一品红 | F222: 医药 | G222: 医药行业 | H222: 137.611 | I222: -7.9000000000000008e-003 | J222: 6.7000000000000002e-003 | K222: 34.7 | L222: -1.4000000000000002e-003 | M222: 124 | N222: 25.45 | O222: 9.0000000000000011e-003 | P222: 136.35 | Q222: 转股中 | R222: 5.46年 | S222: 3.46年 | T222: 4.48 | U222: 65 | V222: 0.105 | W222: 4.4999999999999998e-002 | X222: 6.0999999999999999e-002 | Y222: 100 | Z222: 6.77 | AA222: -1.9199999999999998e-002 | AB222: -2.64e-002 | AC222: -7.51e-002 | AD222: -7.6999999999999999e-002 | AE222: 83.69 | AF222: 89.8 | AG222: 0.8 | AH222: AA- | AI222: 6.2199999999999998e-002 | AJ222: =H222+100*O222 -> 138.511 | AK222: 138.9 | AL222: 131 | AM222: 49.1 | AN222: 160 | AO222: -5.2000000000000005e-002 | AP222: 7 | AQ222: 一品转债
A223: 2 | B223: 123119 | C223: 康泰转2 | D223: 300601 | E223: 康泰生物 | F223: 医药 | G223: 生物制药 | H223: 131.2 | I223: -7.9000000000000008e-003 | J223: -4.5000000000000005e-003 | K223: 131.75 | L223: -2.4700000000000003e-002 | M223: 117.1 | N223: 145.63 | O223: 0.45000000000000001 | P223: 90.47 | Q223: 5月11天 | R223: 5.92年 | S223: 3.92年 | T223: 20 | U223: 127 | V223: 4.8000000000000001e-002 | W223: 2.2000000000000002e-002 | X223: 2.e-002 | Y223: 905 | Z223: 11.93 | AA223: -1.9299999999999998e-002 | AB223: -2.4199999999999999e-002 | AC223: -5.6500000000000002e-002 | AD223: -5.8099999999999999e-002 | AE223: 87.96 | AF223: 92.58 | AG223: 0.5 | AH223: AA | AI223: 4.1200000000000001e-002 | AJ223: =H223+100*O223 -> 176.19999999999999 | AK223: 171.9 | AL223: 299 | AM223: 79.3 | AN223: 301 | AO223: -4.5999999999999999e-002 | AP223: 5 | AQ223: 康泰转2
A224: 192 | B224: 113577 | C224: 春秋转债! | D224: 603890 | E224: 春秋电子 | F224: 电子 | G224: 电子产品 | H224: 128.84 | I224: -1.8e-003 | J224: -6.7000000000000002e-003 | K224: 12.71 | L224: -1.1699999999999999e-002 | M224: 117.7 | N224: 10.86 | O224: 0.10099999999999999 | P224: 117.03 | Q224: 转股中 | R224: 4.67年 | S224: 2.67年 | T224: 1.78 | U224: 15 | V224: 6.6000000000000003e-002 | W224: 3.6000000000000004e-002 | X224: 4.2000000000000003e-002 | Y224: 50 | Z224: 2.6 | AA224: -1.9599999999999999e-002 | AB224: -2.6000000000000002e-002 | AC224: -7.46e-002 | AD224: -7.6700000000000004e-002 | AE224: 87.77 | AF224: 89.86 | AG224: 0.72 | AH224: AA- | AI224: 6.0899999999999996e-002 | AJ224: =H224+100*O224 -> 138.94 | AK224: 140.6 | AL224: 148 | AM224: 50.8 | AN224: 176 | AO224: 5.4000000000000006e-002 | AP224: 15 | AQ224: 春秋转债!
A225: 185 | B225: 128108 | C225: 蓝帆转债! | D225: 2382 | E225: 蓝帆医疗 | F225: 医药 | G225: 医疗器械 | H225: 124.08 | I225: 8.8000000000000005e-003 | J225: 9.4999999999999998e-003 | K225: 20.66 | L225: 2.63e-002 | M225: 112.9 | N225: 18.24 | O225: 9.5000000000000001e-002 | P225: 113.27 | Q225: 转股中 | R225: 4.79年 | S225: 3.79年 | T225: 15.3 | U225: 54 | V225: 2.8999999999999998e-002 | W225: 7.2999999999999995e-002 | X225: 8.3000000000000004e-002 | Y225: 208 | Z225: 1.74 | AA225: -1.9900000000000001e-002 | AB225: -2.46e-002 | AC225: -4.1299999999999996e-002 | AD225: -4.3700000000000003e-002 | AE225: 90.35 | AF225: 93.96 | AG225: 0.69 | AH225: AA | AI225: 3.9900000000000005e-002 | AJ225: =H225+100*O225 -> 133.57999999999998 | AK225: 134.9 | AL225: 85 | AM225: 40.9 | AN225: 106 | AO225: 1.6e-002 | AP225: 26 | AQ225: 蓝帆转债!
A226: 24 | B226: 123113 | C226: 仙乐转债 | D226: 300791 | E226: 仙乐健康 | F226: 食品饮料 | G226: 食品饮料 | H226: 133 | I226: -3.7000000000000002e-003 | J226: -8.0000000000000002e-003 | K226: 60.17 | L226: -1.6799999999999999e-002 | M226: 118.5 | N226: 56.92 | O226: 0.25800000000000001 | P226: 105.71 | Q226: 2月13天 | R226: 5.68年 | S226: 3.68年 | T226: 10.3 | U226: 5.5 | V226: 4.0000000000000001e-003 | W226: 9.5000000000000001e-002 | X226: 0.10000000000000001 | Y226: 108 | Z226: 3.22 | AA226: -2.0499999999999997e-002 | AB226: -2.5899999999999999e-002 | AC226: -6.2800000000000009e-002 | AD226: -6.4500000000000002e-002 | AE226: 82.51 | AF226: 84.68 | AG226: 0.7 | AH226: AA- | AI226: 6.2199999999999998e-002 | AJ226: =H226+100*O226 -> 158.80000000000001 | AK226: 160.3 | AL226: 271 | AM226: 75.6 | AN226: 293 | AO226: -1.7000000000000001e-002 | AP226: 3 | AQ226: 仙乐转债
A227: 96 | B227: 110077 | C227: 洪城转债 | D227: 600461 | E227: 洪城环境 | F227: 城市公用 | G227: 城市公用 | H227: 126.59 | I227: 4.5199999999999997e-002 | J227: 1.0800000000000001e-002 | K227: 7.57 | L227: 8.14e-002 | M227: 113.5 | N227: 6.71 | O227: 0.122 | P227: 112.82 | Q227: 转股中 | R227: 5.27年 | S227: 3.27年 | T227: 18 | U227: 171 | V227: 7.4999999999999997e-002 | W227: 0.251 | X227: 0.28300000000000003 | Y227: 72 | Z227: 1.34 | AA227: -2.07e-002 | AB227: -2.52e-002 | AC227: -6.0499999999999998e-002 | AD227: -6.1699999999999998e-002 | AE227: 90.55 | AF227: 94.33 | AG227: 0.69 | AH227: AA+ | AI227: 3.6200000000000003e-002 | AJ227: =H227+100*O227 -> 138.78999999999999 | AK227: 140.4 | AL227: 142 | AM227: 46 | AN227: 137 | AO227: 5.9999999999999998e-002 | AP227: 6 | AQ227: 洪城转债
A228: 352 | B228: 128025 | C228: 特一转债! | D228: 2728 | E228: 特一药业 | F228: 医药 | G228: 化学制药 | H228: 114.167 | I228: -5.5000000000000005e-003 | J228: 2.3999999999999998e-003 | K228: 12.07 | L228: -9.0000000000000011e-003 | M228: 108.8 | N228: 14.05 | O228: 0.32899999999999996 | P228: 85.91 | Q228: 转股中 | R228: 2.32年 | S228: 0.32年 | T228: 2.98 | U228: 13 | V228: 3.9e-002 | W228: 0.121 | X228: 0.10400000000000001 | Y228: 25 | Z228: 2.3 | AA228: -2.0899999999999998e-002 | AB228: -2.7799999999999998e-002 | AC228: -0.24399999999999999 | AD228: -0.25 | AE228: 98.78 | AF228: 95.41 | AG228: 0.34 | AH228: AA- | AI228: 5.9400000000000001e-002 | AJ228: =H228+100*O228 -> 147.06700000000001 | AK228: 142.4 | AL228: 168 | AM228: 43.6 | AN228: 120 | AO228: -2.7999999999999997e-002 | AP228: 50 | AQ228: 特一转债!
A229: 74 | B229: 113614 | C229: 健20转债! | D229: 603707 | E229: 健友股份 | F229: 医药 | G229: 原料药 | H229: 127.58 | I229: -5.3e-003 | J229: -6.5000000000000006e-003 | K229: 31.24 | L229: -1.7899999999999999e-002 | M229: 114.2 | N229: 29.12 | O229: 0.18899999999999997 | P229: 107.28 | Q229: 转股中 | R229: 5.34年 | S229: 3.35年 | T229: 7.8 | U229: 5.5 | V229: 5.0000000000000001e-003 | W229: 2.1000000000000001e-002 | X229: 2.2000000000000002e-002 | Y229: 380 | Z229: 7.31 | AA229: -2.0899999999999998e-002 | AB229: -2.5499999999999998e-002 | AC229: -5.7800000000000004e-002 | AD229: -5.96e-002 | AE229: 90.12 | AF229: 92.44 | AG229: 0.66 | AH229: AA | AI229: 4.1200000000000001e-002 | AJ229: =H229+100*O229 -> 146.47999999999999 | AK229: 147.9 | AL229: 206 | AM229: 55.4 | AN229: 214 | AO229: 2.e-002 | AP229: 4 | AQ229: 健20转债!
A230: 292 | B230: 123024 | C230: 岱勒转债! | D230: 300700 | E230: 岱勒新材 | F230: 机械装备 | G230: 专用设备 | H230: 118.802 | I230: -7.8000000000000005e-003 | J230: 5.0000000000000001e-004 | K230: 14.75 | L230: -1.21e-002 | M230: 112.5 | N230: 14.1 | O230: 0.13600000000000001 | P230: 104.61 | Q230: 转股中 | R230: 2.60年 | S230: 0.60年 | T230: 2.1 | U230: 12 | V230: 4.5999999999999999e-002 | W230: 0.13300000000000001 | X230: 0.13900000000000001 | Y230: 16 | Z230: 2.51 | AA230: -2.1000000000000001e-002 | AB230: -2.9399999999999999e-002 | AC230: -0.19800000000000001 | AD230: -0.20000000000000001 | AE230: 96.1 | AF230: 94.45 | AG230: 0.6 | AH230: A+ | AI230: 7.0400000000000004e-002 | AJ230: =H230+100*O230 -> 132.40200000000002 | AK230: 133 | AL230: 61 | AM230: 36.9 | AN230: 62 | AO230: 5.7000000000000002e-002 | AP230: 37 | AQ230: 岱勒转债!
A231: 268 | B231: 113541 | C231: 荣晟转债! | D231: 603165 | E231: 荣晟环保 | F231: 造纸包装 | G231: 包装用纸 | H231: 124.24 | I231: 2.e-003 | J231: -2.5999999999999999e-003 | K231: 12.24 | L231: -8.0000000000000004e-004 | M231: 114.3 | N231: 10.84 | O231: 0.10000000000000001 | P231: 112.92 | Q231: 转股中 | R231: 3.94年 | S231: 1.94年 | T231: 1.63 | U231: 4.5 | V231: 2.2000000000000002e-002 | W231: 5.0999999999999997e-002 | X231: 5.7000000000000002e-002 | Y231: 32 | Z231: 1.83 | AA231: -2.1299999999999999e-002 | AB231: -2.76e-002 | AC231: -8.6400000000000005e-002 | AD231: -8.8699999999999987e-002 | AE231: 90.83 | AF231: 90.93 | AG231: 0.7 | AH231: AA- | AI231: 6.0899999999999996e-002 | AJ231: =H231+100*O231 -> 134.24000000000001 | AK231: 135.6 | AL231: 90 | AM231: 44.6 | AN231: 127 | AO231: -8.0000000000000002e-003 | AP231: 43 | AQ231: 荣晟转债!
A232: 235 | B232: 123038 | C232: 联得转债! | D232: 300545 | E232: 联得装备 | F232: 机械装备 | G232: 专用设备 | H232: 130 | I232: -2.6099999999999998e-002 | J232: -1.18e-002 | K232: 26.43 | L232: -5.4400000000000004e-002 | M232: 118.6 | N232: 24.07 | O232: 0.184 | P232: 109.8 | Q232: 转股中 | R232: 4.36年 | S232: 2.37年 | T232: 1.47 | U232: 51 | V232: 0.26200000000000001 | W232: 3.1e-002 | X232: 3.4000000000000002e-002 | Y232: 47 | Z232: 4.85 | AA232: -2.1299999999999999e-002 | AB232: -2.8399999999999998e-002 | AC232: -8.5699999999999998e-002 | AD232: -8.8200000000000001e-002 | AE232: 87.29 | AF232: 88.23 | AG232: 0.7 | AH232: A+ | AI232: 7.1900000000000006e-002 | AJ232: =H232+100*O232 -> 148.40000000000001 | AK232: 150.2 | AL232: 225 | AM232: 62 | AN232: 242 | AO232: -4.8000000000000001e-002 | AP232: 20 | AQ232: 联得转债!
A233: 195 | B233: 110070 | C233: 凌钢转债! | D233: 600231 | E233: 凌钢股份 | F233: 钢铁 | G233: 炼钢 | H233: 129.56 | I233: 3.6299999999999999e-002 | J233: -7.1999999999999998e-003 | K233: 3.29 | L233: 4.1100000000000005e-002 | M233: 117.4 | N233: 2.69 | O233: 5.9000000000000004e-002 | P233: 122.3 | Q233: 转股中 | R233: 4.66年 | S233: 2.67年 | T233: 2.17 | U233: 91 | V233: 0.32700000000000001 | W233: 2.3e-002 | X233: 2.7999999999999997e-002 | Y233: 94 | Z233: 1.08 | AA233: -2.1299999999999999e-002 | AB233: -2.76e-002 | AC233: -7.6100000000000001e-002 | AD233: -7.8399999999999997e-002 | AE233: 92.96 | AF233: 98.2 | AG233: 0.71 | AH233: AA | AI233: 3.9900000000000005e-002 | AJ233: =H233+100*O233 -> 135.46000000000001 | AK233: 136.8 | AL233: 109 | AM233: 38.6 | AN233: 80 | AO233: 8.8000000000000009e-002 | AP233: 22 | AQ233: 凌钢转债!
A234: 111 | B234: 123071 | C234: 天能转债! | D234: 300569 | E234: 天能重工 | F234: 能源电力 | G234: 风能 | H234: 135.5 | I234: -9.4999999999999998e-003 | J234: -5.5000000000000005e-003 | K234: 10.21 | L234: -1.9199999999999998e-002 | M234: 121.1 | N234: 7.91 | O234: 5.0000000000000003e-002 | P234: 129.08 | Q234: 转股中 | R234: 5.19年 | S234: 3.19年 | T234: 6.95 | U234: 91 | V234: 9.6999999999999989e-002 | W234: 8.5999999999999993e-002 | X234: 0.111 | Y234: 81 | Z234: 1.72 | AA234: -2.1899999999999999e-002 | AB234: -2.86e-002 | AC234: -7.6499999999999999e-002 | AD234: -7.85e-002 | AE234: 85.15 | AF234: 89.18 | AG234: 0.78 | AH234: AA- | AI234: 6.2199999999999998e-002 | AJ234: =H234+100*O234 -> 140.5 | AK234: 141.9 | AL234: 160 | AM234: 52.7 | AN234: 192 | AO234: 3.1e-002 | AP234: 14 | AQ234: 天能转债!
A235: 239 | B235: 128085 | C235: 鸿达转债! | D235: 2002 | E235: 鸿达兴业 | F235: 化工 | G235: 化工 | H235: 136.801 | I235: 2.e-002 | J235: -1.2999999999999999e-003 | K235: 5.35 | L235: 2.1000000000000001e-002 | M235: 124.4 | N235: 3.91 | O235: 0. | P235: 136.83 | Q235: 转股中 | R235: 4.34年 | S235: 2.34年 | T235: 6.33 | U235: 747 | V235: 0.85099999999999998 | W235: 3.9e-002 | X235: 5.4000000000000006e-002 | Y235: 161 | Z235: 1.84 | AA235: -2.2099999999999998e-002 | AB235: -3.1200000000000002e-002 | AC235: -0.10400000000000001 | AD235: -0.107 | AE235: 70.12 | AF235: 63.64 | AG235: 0.89 | AH235: B | AI235: 0.17190000000000003 | AJ235: =H235+100*O235 -> 136.80099999999999 | AK235: 136.8 | AL235: 107 | AM235: 66.7 | AN235: 267 | AO235: 0.14000000000000001 | AP235: 100 | AQ235: 鸿达转债!
A236: 180 | B236: 123052 | C236: 飞鹿转债 | D236: 300665 | E236: 飞鹿股份 | F236: 化工 | G236: 化工 | H236: 140.866 | I236: -7.3000000000000001e-003 | J236: 1.1299999999999999e-002 | K236: 9.84 | L236: 5.1000000000000004e-003 | M236: 126.8 | N236: 7.05 | O236: 9.0000000000000011e-003 | P236: 139.57 | Q236: 转股中 | R236: 4.81年 | S236: 2.81年 | T236: 1.51 | U236: 48 | V236: 0.22699999999999998 | W236: 8.900000000000001e-002 | X236: 0.124 | Y236: 17 | Z236: 2.56 | AA236: -2.2099999999999998e-002 | AB236: -3.0899999999999997e-002 | AC236: -9.5700000000000007e-002 | AD236: -9.8299999999999998e-002 | AE236: 85.38 | AF236: 91.57 | AG236: 0.79 | AH236: A+ | AI236: 7.1900000000000006e-002 | AJ236: =H236+100*O236 -> 141.76600000000002 | AK236: 142.2 | AL236: 165 | AM236: 50.6 | AN236: 173 | AO236: 9.5000000000000001e-002 | AP236: 20 | AQ236: 飞鹿转债
A237: 256 | B237: 128079 | C237: 英联转债! | D237: 2846 | E237: 英联股份 | F237: 造纸包装 | G237: 包装材料 | H237: 128.801 | I237: -7.7000000000000002e-003 | J237: 2.2000000000000001e-003 | K237: 7.76 | L237: -8.8999999999999999e-003 | M237: 117.5 | N237: 8.29 | O237: 0.376 | P237: 93.61 | Q237: 转股中 | R237: 4.19年 | S237: 2.19年 | T237: 1.52 | U237: 14 | V237: 6.9000000000000006e-002 | W237: 6.2e-002 | X237: 5.7999999999999996e-002 | Y237: 25 | Z237: 3.21 | AA237: -2.2200000000000001e-002 | AB237: -2.92e-002 | AC237: -8.8900000000000007e-002 | AD237: -9.1499999999999998e-002 | AE237: 88.2 | AF237: 88.47 | AG237: 0.62 | AH237: A+ | AI237: 7.1900000000000006e-002 | AJ237: =H237+100*O237 -> 166.40099999999998 | AK237: 164 | AL237: 283 | AM237: 75.5 | AN237: 292 | AO237: -2.1000000000000001e-002 | AP237: 17 | AQ237: 英联转债!
A238: 106 | B238: 113607 | C238: 伟20转债! | D238: 603568 | E238: 伟明环保 | F238: 城市公用 | G238: 三废处理 | H238: 129.11 | I238: -7.000000000000001e-004 | J238: 1.e-003 | K238: 26.86 | L238: 4.0000000000000002e-004 | M238: 115.1 | N238: 21.71 | O238: 4.4000000000000004e-002 | P238: 123.72 | Q238: 转股中 | R238: 5.22年 | S238: 3.22年 | T238: 12 | U238: 11 | V238: 6.9999999999999993e-003 | W238: 3.6000000000000004e-002 | X238: 4.4000000000000004e-002 | Y238: 338 | Z238: 6.04 | AA238: -2.2200000000000001e-002 | AB238: -2.7099999999999999e-002 | AC238: -6.3399999999999998e-002 | AD238: -6.5199999999999994e-002 | AE238: 90.47 | AF238: 93.61 | AG238: 0.76 | AH238: AA | AI238: 4.1200000000000001e-002 | AJ238: =H238+100*O238 -> 133.51000000000002 | AK238: 134.5 | AL238: 79 | AM238: 40.9 | AN238: 105 | AO238: 8.0000000000000002e-003 | AP238: 6 | AQ238: 伟20转债!
A239: 79 | B239: 123086 | C239: 海兰转债! | D239: 300065 | E239: 海兰信 | F239: 电子 | G239: 电子产品 | H239: 139.3 | I239: 1.78e-002 | J239: -5.5000000000000005e-003 | K239: 9.88 | L239: 1.54e-002 | M239: 123.5 | N239: 7.27 | O239: 2.5000000000000001e-002 | P239: 135.9 | Q239: 转股中 | R239: 5.33年 | S239: 3.33年 | T239: 6.94 | U239: 783 | V239: 0.80500000000000005 | W239: 0.11800000000000001 | X239: 0.16 | Y239: 59 | Z239: 2.65 | AA239: -2.2700000000000001e-002 | AB239: -2.9900000000000003e-002 | AC239: -8.1300000000000011e-002 | AD239: -8.3100000000000007e-002 | AE239: 84.29 | AF239: 90.14 | AG239: 0.8 | AH239: AA- | AI239: 6.2199999999999998e-002 | AJ239: =H239+100*O239 -> 141.80000000000001 | AK239: 142.7 | AL239: 171 | AM239: 52.6 | AN239: 191 | AO239: 0.14300000000000002 | AP239: 18 | AQ239: 海兰转债!
A240: 9 | B240: 113051 | C240: 节能转债 | D240: 601016 | E240: 节能风电 | F240: 能源电力 | G240: 风能 | H240: 130.89 | I240: -1.24e-002 | J240: 7.000000000000001e-004 | K240: 4.45 | L240: -1.77e-002 | M240: 114.5 | N240: 4.05 | O240: 0.191 | P240: 109.88 | Q240: 4月14天 | R240: 5.85年 | S240: 3.85年 | T240: 30 | U240: 76 | V240: 1.9e-002 | W240: 0.13400000000000001 | X240: 0.14800000000000002 | Y240: 223 | Z240: 2.2 | AA240: -2.29e-002 | AB240: -2.7200000000000002e-002 | AC240: -5.8099999999999999e-002 | AD240: -5.9400000000000001e-002 | AE240: 89.35 | AF240: 93.26 | AG240: 0.66 | AH240: AA+ | AI240: 3.6200000000000003e-002 | AJ240: =H240+100*O240 -> 149.98999999999998 | AK240: 151.9 | AL240: 234 | AM240: 58.6 | AN240: 222 | AO240: 7.0999999999999994e-002 | AP240: 4 | AQ240: 节能转债
A241: 132 | B241: 113039 | C241: 嘉泽转债! | D241: 601619 | E241: 嘉泽新能 | F241: 能源电力 | G241: 风能 | H241: 126.91 | I241: 5.8999999999999999e-003 | J241: 2.2099999999999998e-002 | K241: 4.29 | L241: 3.6200000000000003e-002 | M241: 113.1 | N241: 3.46 | O241: 2.4e-002 | P241: 123.99 | Q241: 转股中 | R241: 5年10天 | S241: 3年11天 | T241: 5.4 | U241: 125 | V241: 0.18100000000000002 | W241: 5.2999999999999999e-002 | X241: 6.6000000000000003e-002 | Y241: 101 | Z241: 2.49 | AA241: -2.3099999999999999e-002 | AB241: -2.76e-002 | AC241: -6.2e-002 | AD241: -6.4000000000000001e-002 | AE241: 91.18 | AF241: 92.71 | AG241: 0.77 | AH241: AA | AI241: 4.1200000000000001e-002 | AJ241: =H241+100*O241 -> 129.31 | AK241: 129.8 | AL241: 38 | AM241: 37.1 | AN241: 66 | AO241: 8.5000000000000006e-002 | AP241: 35 | AQ241: 嘉泽转债!
A242: 38 | B242: 127031 | C242: 洋丰转债! | D242: 902 | E242: 新洋丰 | F242: 化工 | G242: 农化 | H242: 133.9 | I242: 4.6100000000000002e-002 | J242: -1.6299999999999999e-002 | K242: 20.41 | L242: 4.99e-002 | M242: 117.1 | N242: 19.94 | O242: 0.308 | P242: 102.36 | Q242: 56天 | R242: 5.61年 | S242: 3.61年 | T242: 10 | U242: 166 | V242: 0.124 | W242: 3.7999999999999999e-002 | X242: 3.7999999999999999e-002 | Y242: 266 | Z242: 3.66 | AA242: -2.4e-002 | AB242: -2.9100000000000001e-002 | AC242: -6.6100000000000006e-002 | AD242: -6.7699999999999996e-002 | AE242: 89.05 | AF242: 93.74 | AG242: 0.6 | AH242: AA | AI242: 4.1200000000000001e-002 | AJ242: =H242+100*O242 -> 164.70000000000002 | AK242: 165.4 | AL242: 288 | AM242: 71.7 | AN242: 280 | AO242: 6.2e-002 | AP242: 4 | AQ242: 洋丰转债!
A243: 177 | B243: 123054 | C243: 思特转债!! | D243: 300608 | E243: 思特奇 | F243: 通信互联 | G243: 通信设备 | H243: 136 | I243: -1.9099999999999999e-002 | J243: 4.0000000000000002e-004 | K243: 13.5 | L243: -2.8799999999999999e-002 | M243: 121.2 | N243: 12.63 | O243: 0.27200000000000002 | P243: 106.89 | Q243: 转股中 | R243: 4.82年 | S243: 2.82年 | T243: 2.08 | U243: 213 | V243: 0.748 | W243: 7.2999999999999995e-002 | X243: 7.8e-002 | Y243: 28 | Z243: 2.78 | AA243: -2.41e-002 | AB243: -3.1300000000000001e-002 | AC243: -8.6099999999999996e-002 | AD243: -8.8399999999999992e-002 | AE243: 87.4 | AF243: 91.72 | AG243: 0.65 | AH243: AA- | AI243: 6.0899999999999996e-002 | AJ243: =H243+100*O243 -> 163.19999999999999 | AK243: 165.1 | AL243: 285 | AM243: 73.4 | AN243: 286 | AO243: -0.10000000000000001 | AP243: 19 | AQ243: 思特转债!!
A244: 328 | B244: 110045 | C244: 海澜转债! | D244: 600398 | E244: 海澜之家 | F244: 服装纺织 | G244: 服装行业 | H244: 118.4 | I244: -1.8e-003 | J244: 1.8e-003 | K244: 7.11 | L244: 0. | M244: 110.3 | N244: 7.04 | O244: 0.17199999999999999 | P244: 100.99 | Q244: 转股中 | R244: 2.91年 | S244: 0.92年 | T244: 29.5 | U244: 16 | V244: 5.0000000000000001e-003 | W244: 9.6000000000000002e-002 | X244: 9.6999999999999989e-002 | Y244: 307 | Z244: 2.19 | AA244: -2.4300000000000002e-002 | AB244: -3.0600000000000002e-002 | AC244: -0.13300000000000001 | AD244: -0.13500000000000001 | AE244: 97.69 | AF244: 100.33 | AG244: 0.51 | AH244: AA+ | AI244: 3.3399999999999999e-002 | AJ244: =H244+100*O244 -> 135.59999999999999 | AK244: 135.8 | AL244: 93 | AM244: 35.5 | AN244: 51 | AO244: -2.1000000000000001e-002 | AP244: 49 | AQ244: 海澜转债!
A245: 85 | B245: 113612 | C245: 永冠转债 | D245: 603681 | E245: 永冠新材 | F245: 化工 | G245: 其他 | H245: 137.91 | I245: -1.04e-002 | J245: 4.4000000000000003e-003 | K245: 28.74 | L245: -7.3000000000000001e-003 | M245: 121.2 | N245: 20.59 | O245: -1.2e-002 | P245: 139.58 | Q245: 转股中 | R245: 5.32年 | S245: 3.32年 | T245: 5.2 | U245: 186 | V245: 0.25900000000000001 | W245: 0.109 | X245: 0.152 | Y245: 48 | Z245: 3.04 | AA245: -2.4500000000000001e-002 | AB245: -3.1e-002 | AC245: -7.8200000000000006e-002 | AD245: -8.0199999999999994e-002 | AE245: 84.59 | AF245: 88.58 | AG245: 0.83 | AH245: AA- | AI245: 6.2199999999999998e-002 | AJ245: =H245+100*O245 -> 136.71000000000001 | AK245: 136.2 | AL245: 97 | AM245: 47.7 | AN245: 147 | AO245: 5.5e-002 | AP245: 6 | AQ245: 永冠转债
A246: 121 | B246: 113603 | C246: 东缆转债! | D246: 603606 | E246: 东方电缆 | F246: 能源电力 | G246: 电力设备 | H246: 131.1 | I246: -1.32e-002 | J246: 1.15e-002 | K246: 24.09 | L246: -2.8999999999999998e-003 | M246: 115.1 | N246: 23.65 | O246: 0.28699999999999998 | P246: 101.86 | Q246: 转股中 | R246: 5年41天 | S246: 3年42天 | T246: 8 | U246: 50 | V246: 4.8000000000000001e-002 | W246: 5.0999999999999997e-002 | X246: 5.2000000000000005e-002 | Y246: 158 | Z246: 4.46 | AA246: -2.5600000000000001e-002 | AB246: -3.0600000000000002e-002 | AC246: -6.9800000000000001e-002 | AD246: -7.17e-002 | AE246: 90.87 | AF246: 94.02 | AG246: 0.59 | AH246: AA | AI246: 4.1200000000000001e-002 | AJ246: =H246+100*O246 -> 159.79999999999998 | AK246: 160.3 | AL246: 272 | AM246: 66.3 | AN246: 264 | AO246: 3.0000000000000001e-003 | AP246: 7 | AQ246: 东缆转债!
A247: 102 | B247: 128137 | C247: 洁美转债 | D247: 2859 | E247: 洁美科技 | F247: 电子 | G247: 元器件制 | H247: 134.279 | I247: -8.199999999999999e-003 | J247: -1.9e-002 | K247: 31.15 | L247: -3.7100000000000001e-002 | M247: 117.3 | N247: 27.63 | O247: 0.191 | P247: 112.74 | Q247: 转股中 | R247: 5.22年 | S247: 3.23年 | T247: 5.99 | U247: 15 | V247: 1.9e-002 | W247: 4.7e-002 | X247: 5.2999999999999999e-002 | Y247: 128 | Z247: 6.94 | AA247: -2.6000000000000002e-002 | AB247: -3.1600000000000003e-002 | AC247: -7.3700000000000002e-002 | AD247: -7.5600000000000001e-002 | AE247: 84.78 | AF247: 86.16 | AG247: 0.73 | AH247: AA- | AI247: 6.2199999999999998e-002 | AJ247: =H247+100*O247 -> 153.37899999999999 | AK247: 155.8 | AL247: 254 | AM247: 69.7 | AN247: 275 | AO247: -5.5e-002 | AP247: 4 | AQ247: 洁美转债
A248: 201 | B248: 113575 | C248: 东时转债!! | D248: 603377 | E248: 东方时尚 | F248: 其他 | G248: 其他 | H248: 127.63 | I248: -2.e-003 | J248: 1.2999999999999999e-003 | K248: 8.24 | L248: -3.5999999999999999e-003 | M248: 113.1 | N248: 12.15 | O248: 0.88200000000000001 | P248: 67.82 | Q248: 转股中 | R248: 4.65年 | S248: 2.65年 | T248: 0.98 | U248: 5.7 | V248: 4.5999999999999999e-002 | W248: 1.6e-002 | X248: 1.1000000000000001e-002 | Y248: 60 | Z248: 2.4 | AA248: -2.6099999999999998e-002 | AB248: -3.1e-002 | AC248: -7.2300000000000003e-002 | AD248: -7.4400000000000008e-002 | AE248: 92.72 | AF248: 94.63 | AG248: 0.2 | AH248: AA | AI248: 3.9900000000000005e-002 | AJ248: =H248+100*O248 -> 215.82999999999998 | AK248: 187.4 | AL248: 317 | AM248: 92.8 | AN248: 320 | AO248: -7.2999999999999995e-002 | AP248: 15 | AQ248: 东时转债!!
A249: 1 | B249: 113627 | C249: 太平转债 | D249: 603877 | E249: 太平鸟 | F249: 服装纺织 | G249: 服装行业 | H249: 134.33 | I249: 8.9999999999999998e-004 | J249: 5.1999999999999998e-003 | K249: 51.5 | L249: 9.7999999999999997e-003 | M249: 115.1 | N249: 50.32 | O249: 0.313 | P249: 102.34 | Q249: 5月11天 | R249: 5.92年 | S249: 3.92年 | T249: 8 | U249: 12 | V249: 1.2e-002 | W249: 3.3000000000000002e-002 | X249: 3.3000000000000002e-002 | Y249: 246 | Z249: 5.99 | AA249: -2.6200000000000001e-002 | AB249: -3.0499999999999999e-002 | AC249: -6.2e-002 | AD249: -6.3500000000000001e-002 | AE249: 87.96 | AF249: 91.01 | AG249: 0.63 | AH249: AA | AI249: 4.1200000000000001e-002 | AJ249: =H249+100*O249 -> 165.63000000000002 | AK249: 166.3 | AL249: 291 | AM249: 75.3 | AN249: 290 | AO249: -1.e-003 | AP249: 1 | AQ249: 太平转债
A250: 163 | B250: 110071 | C250: 湖盐转债! | D250: 600929 | E250: 雪天盐业 | F250: 食品饮料 | G250: 食品饮料 | H250: 132.46 | I250: -2.0299999999999999e-002 | J250: -3.3e-003 | K250: 7.7 | L250: -3.27e-002 | M250: 114.9 | N250: 6.52 | O250: 0.122 | P250: 118.1 | Q250: 转股中 | R250: 4.90年 | S250: 2.91年 | T250: 7.2 | U250: 61 | V250: 6.3e-002 | W250: 0.10000000000000001 | X250: 0.11800000000000001 | Y250: 72 | Z250: 2.66 | AA250: -2.9100000000000001e-002 | AB250: -3.4200000000000001e-002 | AC250: -7.7899999999999997e-002 | AD250: -7.980000000000001e-002 | AE250: 91.78 | AF250: 95.18 | AG250: 0.72 | AH250: AA | AI250: 3.9900000000000005e-002 | AJ250: =H250+100*O250 -> 144.66 | AK250: 146.8 | AL250: 195 | AM250: 51.6 | AN250: 183 | AO250: 3.9e-002 | AP250: 23 | AQ250: 湖盐转债!
A251: 343 | B251: 110043 | C251: 无锡转债! | D251: 600908 | E251: 无锡银行 | F251: 金融 | G251: 银行行业 | H251: 116.83 | I251: -9.7999999999999997e-003 | J251: 6.0999999999999995e-003 | K251: 5.72 | L251: -6.8999999999999999e-003 | M251: 108.3 | N251: 5.61 | O251: 0.14599999999999999 | P251: 101.96 | Q251: 转股中 | R251: 2.47年 | S251: 无权 | T251: 29.2 | U251: 79 | V251: 2.3e-002 | W251: 0.27399999999999997 | X251: 0.28000000000000003 | Y251: 106 | Z251: 0.86 | AA251: -3.0600000000000002e-002 | AB251: -3.6699999999999997e-002 | AC251: 无权 | AD251: 无权 | AE251: 无权 | AF251: 99.98 | AG251: 0.53 | AH251: AA+ | AI251: 3.3399999999999999e-002 | AJ251: =H251+100*O251 -> 131.43000000000001 | AK251: 131.7 | AL251: 50 | AM251: 31.7 | AN251: 33 | AO251: -1.3000000000000001e-002 | AP251: 23 | AQ251: 无锡转债!
A252: 261 | B252: 128075 | C252: 远东转债! | D252: 2406 | E252: 远东传动 | F252: 汽车 | G252: 零部件制 | H252: 130.253 | I252: 4.6999999999999993e-003 | J252: 1.2800000000000001e-002 | K252: 6.79 | L252: 2.2599999999999999e-002 | M252: 114.9 | N252: 5.29 | O252: 1.4999999999999999e-002 | P252: 128.36 | Q252: 转股中 | R252: 4年40天 | S252: 2年41天 | T252: 5.44 | U252: 67 | V252: 9.3000000000000013e-002 | W252: 0.128 | X252: 0.16500000000000001 | Y252: 42 | Z252: 1.28 | AA252: -3.0699999999999998e-002 | AB252: -3.6799999999999999e-002 | AC252: -9.7299999999999998e-002 | AD252: -9.98e-002 | AE252: 94.68 | AF252: 98.18 | AG252: 0.78 | AH252: AA | AI252: 3.9900000000000005e-002 | AJ252: =H252+100*O252 -> 131.75299999999999 | AK252: 132.2 | AL252: 57 | AM252: 34 | AN252: 42 | AO252: 8.5000000000000006e-002 | AP252: 14 | AQ252: 远东转债!
A253: 115 | B253: 127022 | C253: 恒逸转债 | D253: 703 | E253: 恒逸石化 | F253: 化工 | G253: 化工 | H253: 127.725 | I253: -5.3e-003 | J253: 9.8999999999999991e-003 | K253: 12.28 | L253: 6.6e-003 | M253: 108.9 | N253: 11.2 | O253: 0.16500000000000001 | P253: 109.64 | Q253: 转股中 | R253: 5.17年 | S253: 3.18年 | T253: 20 | U253: 12 | V253: 5.0000000000000001e-003 | W253: 4.4000000000000004e-002 | X253: 4.9000000000000002e-002 | Y253: 450 | Z253: 1.82 | AA253: -3.0800000000000001e-002 | AB253: -3.3799999999999997e-002 | AC253: -6.3600000000000004e-002 | AD253: -6.5000000000000002e-002 | AE253: 91.22 | AF253: 90.85 | AG253: 0.7 | AH253: AA+ | AI253: 3.6200000000000003e-002 | AJ253: =H253+100*O253 -> 144.22499999999999 | AK253: 145.8 | AL253: 191 | AM253: 54.6 | AN253: 204 | AO253: -1.2e-002 | AP253: 7 | AQ253: 恒逸转债
A254: 7 | B254: 113626 | C254: 伯特转债 | D254: 603596 | E254: 伯特利 | F254: 汽车 | G254: 零部件制 | H254: 145.2 | I254: -1.2199999999999999e-002 | J254: 0. | K254: 43.91 | L254: -1.7000000000000001e-002 | M254: 121.1 | N254: 36 | O254: 0.19 | P254: 121.97 | Q254: 4月25天 | R254: 5.87年 | S254: 3.88年 | T254: 9.02 | U254: 33 | V254: 2.5000000000000001e-002 | W254: 5.0000000000000003e-002 | X254: 6.0999999999999999e-002 | Y254: 179 | Z254: 6.35 | AA254: -3.0899999999999997e-002 | AB254: -3.6699999999999997e-002 | AC254: -8.0600000000000005e-002 | AD254: -8.2100000000000006e-002 | AE254: 88.11 | AF254: 95.9 | AG254: 0.72 | AH254: AA | AI254: 4.1200000000000001e-002 | AJ254: =H254+100*O254 -> 164.19999999999999 | AK254: 168.4 | AL254: 294 | AM254: 72.5 | AN254: 284 | AO254: 9.6999999999999989e-002 | AP254: 3 | AQ254: 伯特转债
A255: 339 | B255: 127005 | C255: 长证转债! | D255: 783 | E255: 长江证券 | F255: 金融 | G255: 证券行业 | H255: 117.598 | I255: 0. | J255: -1.4000000000000002e-003 | K255: 7.03 | L255: -2.8000000000000004e-003 | M255: 108.3 | N255: 7.13 | O255: 0.193 | P255: 98.6 | Q255: 转股中 | R255: 2.58年 | S255: 无权 | T255: 50 | U255: 26 | V255: 4.0000000000000001e-003 | W255: 0.129 | X255: 0.127 | Y255: 389 | Z255: 1.35 | AA255: -3.2000000000000001e-002 | AB255: -3.7699999999999997e-002 | AC255: 无权 | AD255: 无权 | AE255: 无权 | AF255: 100.14 | AG255: 0.49 | AH255: AAA | AI255: 3.1400000000000004e-002 | AJ255: =H255+100*O255 -> 136.898 | AK255: 136.6 | AL255: 104 | AM255: 36.5 | AN255: 58 | AO255: -3.0000000000000001e-003 | AP255: 13 | AQ255: 长证转债!
A256: 193 | B256: 123050 | C256: 聚飞转债! | D256: 300303 | E256: 聚飞光电 | F256: 电子 | G256: LED制 | H256: 143.7 | I256: 1.4000000000000002e-003 | J256: -9.1999999999999998e-003 | K256: 7.06 | L256: -9.7999999999999997e-003 | M256: 123.8 | N256: 5.08 | O256: 3.4000000000000002e-002 | P256: 138.98 | Q256: 转股中 | R256: 4.67年 | S256: 2.67年 | T256: 3.75 | U256: 373 | V256: 0.68900000000000006 | W256: 4.2000000000000003e-002 | X256: 5.7999999999999996e-002 | Y256: 90 | Z256: 3.67 | AA256: -3.2000000000000001e-002 | AB256: -4.0199999999999993e-002 | AC256: -0.10800000000000001 | AD256: -0.11 | AE256: 87.87 | AF256: 94.51 | AG256: 0.8 | AH256: AA- | AI256: 6.0899999999999996e-002 | AJ256: =H256+100*O256 -> 147.09999999999999 | AK256: 148.4 | AL256: 210 | AM256: 53.9 | AN256: 202 | AO256: -2.8999999999999998e-002 | AP256: 14 | AQ256: 聚飞转债!
A257: 227 | B257: 128094 | C257: 星帅转债! | D257: 2860 | E257: 星帅尔 | F257: 家电 | G257: 零部件制 | H257: 139.4 | I257: -7.000000000000001e-004 | J257: 1.6000000000000001e-003 | K257: 18.96 | L257: 1.1000000000000001e-003 | M257: 121 | N257: 13.8 | O257: 1.4999999999999999e-002 | P257: 137.39 | Q257: 转股中 | R257: 4.42年 | S257: 2.43年 | T257: 2.27 | U257: 39 | V257: 0.12300000000000001 | W257: 5.9000000000000004e-002 | X257: 8.199999999999999e-002 | Y257: 38 | Z257: 3.7 | AA257: -3.2199999999999999e-002 | AB257: -3.9900000000000005e-002 | AC257: -0.107 | AD257: -0.109 | AE257: 87.12 | AF257: 89.67 | AG257: 0.82 | AH257: A+ | AI257: 7.1900000000000006e-002 | AJ257: =H257+100*O257 -> 140.90000000000001 | AK257: 141.4 | AL257: 156 | AM257: 51.7 | AN257: 185 | AO257: -9.0000000000000011e-003 | AP257: 31 | AQ257: 星帅转债!
A258: 15 | B258: 123115 | C258: 捷捷转债 | D258: 300623 | E258: 捷捷微电 | F258: 电子 | G258: 元器件制 | H258: 143.3 | I258: -1.4800000000000001e-002 | J258: -9.3999999999999986e-003 | K258: 33.89 | L258: -3.2000000000000001e-002 | M258: 118.5 | N258: 29 | O258: 0.22600000000000001 | P258: 116.86 | Q258: 4月4天 | R258: 5.82年 | S258: 3.82年 | T258: 12 | U258: 47 | V258: 2.7000000000000003e-002 | W258: 4.8000000000000001e-002 | X258: 5.5999999999999994e-002 | Y258: 250 | Z258: 6.4 | AA258: -3.27e-002 | AB258: -3.7900000000000003e-002 | AC258: -7.8200000000000006e-002 | AD258: -7.980000000000001e-002 | AE258: 81.83 | AF258: 83.99 | AG258: 0.76 | AH258: AA- | AI258: 6.2199999999999998e-002 | AJ258: =H258+100*O258 -> 165.90000000000001 | AK258: 169.7 | AL258: 295 | AM258: 85.8 | AN258: 307 | AO258: -3.9e-002 | AP258: 5 | AQ258: 捷捷转债
A259: 372 | B259: 110034 | C259: 九州转债! | D259: 600998 | E259: 九州通 | F259: 医药 | G259: 医药商业 | H259: 109.54 | I259: 5.9999999999999995e-004 | J259: -5.9999999999999995e-004 | K259: 14.74 | L259: 1.03e-002 | M259: 108 | N259: 17.83 | O259: 0.32500000000000001 | P259: 82.67 | Q259: 转股中 | R259: 0.42年 | S259: 回售内 | T259: 15 | U259: 7.3 | V259: 4.0000000000000001e-003 | W259: 5.4000000000000006e-002 | X259: 4.4999999999999998e-002 | Y259: 276 | Z259: 1.37 | AA259: -3.2799999999999996e-002 | AB259: -6.6199999999999995e-002 | AC259: 回售内 | AD259: 回售内 | AE259: 103 | AF259: 106.75 | AG259: 0.01 | AH259: AA+ | AI259: 2.7699999999999999e-002 | AJ259: =H259+100*O259 -> 142.04000000000002 | AK259: 136.4 | AL259: 101 | AM259: 29.7 | AN259: 25 | AO259: 2.5000000000000001e-002 | AP259: 24 | AQ259: 九州转债!
A260: 272 | B260: 113027 | C260: 华钰转债!! | D260: 601020 | E260: ST华钰 | F260: 有色金属 | G260: 锌铅镍锡 | H260: 129.86 | I260: 8.3800000000000013e-002 | J260: -5.0900000000000001e-002 | K260: 10.1 | L260: 4.99e-002 | M260: 114.3 | N260: 10.17 | O260: 0.308 | P260: 99.31 | Q260: 转股中 | R260: 3.83年 | S260: 1.84年 | T260: 3.25 | U260: 347 | V260: 0.83799999999999997 | W260: 5.7999999999999996e-002 | X260: 5.7999999999999996e-002 | Y260: 56 | Z260: 2.25 | AA260: -3.3300000000000003e-002 | AB260: -3.9599999999999996e-002 | AC260: -0.111 | AD260: -0.113 | AE260: 87.91 | AF260: 85.01 | AG260: 0.66 | AH260: A | AI260: 8.1900000000000001e-002 | AJ260: =H260+100*O260 -> 160.66000000000003 | AK260: 160.4 | AL260: 273 | AM260: 72.5 | AN260: 283 | AO260: 0.13300000000000001 | AP260: 47 | AQ260: 华钰转债!!
A261: 225 | B261: 128096 | C261: 奥瑞转债!! | D261: 2701 | E261: 奥瑞金 | F261: 造纸包装 | G261: 包装材料 | H261: 134.362 | I261: 1.1999999999999999e-003 | J261: 1.5e-003 | K261: 5.86 | L261: 3.4000000000000002e-003 | M261: 115.5 | N261: 4.5 | O261: 3.2000000000000001e-002 | P261: 130.22 | Q261: 转股中 | R261: 4.50年 | S261: 2.50年 | T261: 6.74 | U261: 9.2 | V261: 1.e-002 | W261: 4.7e-002 | X261: 6.2e-002 | Y261: 142 | Z261: 2.11 | AA261: -3.3799999999999997e-002 | AB261: -3.9599999999999996e-002 | AC261: -9.3100000000000002e-002 | AD261: -9.5500000000000002e-002 | AE261: 94.86 | AF261: 99.34 | AG261: 0.79 | AH261: AA+ | AI261: 3.49e-002 | AJ261: =H261+100*O261 -> 137.56199999999998 | AK261: 138.5 | AL261: 126 | AM261: 39.2 | AN261: 92 | AO261: 6.8000000000000005e-002 | AP261: 18 | AQ261: 奥瑞转债!!
A262: 363 | B262: 113013 | C262: 国君转债! | D262: 601211 | E262: 国泰君安 | F262: 金融 | G262: 证券行业 | H262: 114.1 | I262: 2.0000000000000001e-004 | J262: 0. | K262: 16.85 | L262: 5.9999999999999995e-004 | M262: 106.8 | N262: 19.01 | O262: 0.28699999999999998 | P262: 88.64 | Q262: 转股中 | R262: 1.90年 | S262: 无权 | T262: 69.9 | U262: 52 | V262: 6.9999999999999993e-003 | W262: 4.7e-002 | X262: 4.0999999999999995e-002 | Y262: 1501. | Z262: 1.15 | AA262: -3.4500000000000003e-002 | AB262: -4.0999999999999995e-002 | AC262: 无权 | AD262: 无权 | AE262: 无权 | AF262: 100.77 | AG262: 0.29 | AH262: AAA | AI262: 3.1400000000000004e-002 | AJ262: =H262+100*O262 -> 142.79999999999998 | AK262: 139.6 | AL262: 138 | AM262: 38.8 | AN262: 84 | AO262: 6.0000000000000001e-003 | AP262: 12 | AQ262: 国君转债!
A263: 342 | B263: 128035 | C263: 大族转债! | D263: 2008 | E263: 大族激光 | F263: 机械装备 | G263: 专用设备 | H263: 117.06 | I263: 3.7499999999999999e-002 | J263: -2.07e-002 | K263: 42.1 | L263: 0.10000000000000001 | M263: 107.4 | N263: 51.9 | O263: 0.44299999999999995 | P263: 81.12 | Q263: 转股中 | R263: 2.49年 | S263: 0.49年 | T263: 23 | U263: 295 | V263: 0.11 | W263: 5.0999999999999997e-002 | X263: 4.2000000000000003e-002 | Y263: 449 | Z263: 4.67 | AA263: -3.4500000000000003e-002 | AB263: -3.9800000000000002e-002 | AC263: -0.182 | AD263: -0.192 | AE263: 101.61 | AF263: 99.08 | AG263: 0.17 | AH263: AA+ | AI263: 3.3399999999999999e-002 | AJ263: =H263+100*O263 -> 161.36000000000001 | AK263: 153 | AL263: 241 | AM263: 51.4 | AN263: 180 | AO263: 0.14099999999999999 | AP263: 18 | AQ263: 大族转债!
A264: 368 | B264: 113011 | C264: 光大转债 | D264: 601818 | E264: 光大银行 | F264: 金融 | G264: 银行行业 | H264: 113.1 | I264: 8.0000000000000004e-004 | J264: -2.8999999999999998e-003 | K264: 3.35 | L264: -5.8999999999999999e-003 | M264: 106.8 | N264: 3.55 | O264: 0.19899999999999998 | P264: 94.37 | Q264: 转股中 | R264: 1.59年 | S264: 无权 | T264: 242 | U264: 79 | V264: 3.0000000000000001e-003 | W264: 0.13400000000000001 | X264: 0.126 | Y264: 1810. | Z264: 0.51 | AA264: -3.5699999999999996e-002 | AB264: -4.3499999999999997e-002 | AC264: 无权 | AD264: 无权 | AE264: 无权 | AF264: 101.72 | AG264: 0.36 | AH264: AAA | AI264: 3.1400000000000004e-002 | AJ264: =H264+100*O264 -> 133. | AK264: 131.8 | AL264: 51 | AM264: 30.1 | AN264: 27 | AO264: -1.3999999999999999e-002 | AP264: 13 | AQ264: 光大转债
A265: 30 | B265: 113623 | C265: 凤21转债 | D265: 603225 | E265: 新凤鸣 | F265: 化工 | G265: 化纤 | H265: 143.4 | I265: 2.0000000000000001e-004 | J265: 1.0500000000000001e-002 | K265: 20.3 | L265: 1.4499999999999999e-002 | M265: 117.1 | N265: 16.47 | O265: 0.16300000000000001 | P265: 123.25 | Q265: 2月2天 | R265: 5.65年 | S265: 3.65年 | T265: 25 | U265: 8.6 | V265: 2.e-003 | W265: 8.8000000000000009e-002 | X265: 0.10800000000000001 | Y265: 285 | Z265: 2.33 | AA265: -3.5799999999999998e-002 | AB265: -4.0800000000000003e-002 | AC265: -8.2200000000000009e-002 | AD265: -8.3699999999999997e-002 | AE265: 88.92 | AF265: 93.59 | AG265: 0.74 | AH265: AA | AI265: 4.1200000000000001e-002 | AJ265: =H265+100*O265 -> 159.70000000000002 | AK265: 163.5 | AL265: 281 | AM265: 70 | AN265: 276 | AO265: -2.5000000000000001e-002 | AP265: 3 | AQ265: 凤21转债
A266: 69 | B266: 123091 | C266: 长海转债 | D266: 300196 | E266: 长海股份 | F266: 其他 | G266: 非金属矿 | H266: 141.28 | I266: 2.8999999999999998e-002 | J266: -5.4000000000000003e-003 | K266: 19.97 | L266: 3.1e-002 | M266: 116.2 | N266: 16.14 | O266: 0.14199999999999999 | P266: 123.73 | Q266: 转股中 | R266: 5.36年 | S266: 3.36年 | T266: 5.5 | U266: 17 | V266: 2.2000000000000002e-002 | W266: 6.7000000000000004e-002 | X266: 8.3000000000000004e-002 | Y266: 82 | Z266: 2.75 | AA266: -3.6400000000000002e-002 | AB266: -4.1500000000000002e-002 | AC266: -8.4600000000000009e-002 | AD266: -8.6300000000000002e-002 | AE266: 90.06 | AF266: 93.99 | AG266: 0.76 | AH266: AA | AI266: 4.1200000000000001e-002 | AJ266: =H266+100*O266 -> 155.47999999999999 | AK266: 158.8 | AL266: 266 | AM266: 64.8 | AN266: 258 | AO266: 4.4999999999999998e-002 | AP266: 3 | AQ266: 长海转债
A267: 17 | B267: 127036 | C267: 三花转债 | D267: 2050 | E267: 三花智控 | F267: 机械装备 | G267: 通用设备 | H267: 141.66 | I267: 2.2799999999999997e-002 | J267: 3.3599999999999998e-002 | K267: 25.32 | L267: 7.9299999999999995e-002 | M267: 114.5 | N267: 21.55 | O267: 0.20600000000000002 | P267: 117.49 | Q267: 3月26天 | R267: 5.80年 | S267: 3.80年 | T267: 30 | U267: 218 | V267: 5.0999999999999997e-002 | W267: 3.3000000000000002e-002 | X267: 3.9e-002 | Y267: 909 | Z267: 9.06 | AA267: -3.6499999999999998e-002 | AB267: -4.07e-002 | AC267: -7.7600000000000002e-002 | AD267: -7.8799999999999995e-002 | AE267: 89.52 | AF267: 93.44 | AG267: 0.71 | AH267: AA+ | AI267: 3.6200000000000003e-002 | AJ267: =H267+100*O267 -> 162.25999999999999 | AK267: 165.8 | AL267: 289 | AM267: 72.4 | AN267: 281 | AO267: 0.152 | AP267: 4 | AQ267: 三花转债
A268: 120 | B268: 128134 | C268: 鸿路转债! | D268: 2541 | E268: 鸿路钢构 | F268: 建筑 | G268: 其他建材 | H268: 139.56 | I268: -1.8e-003 | J268: -1.0500000000000001e-002 | K268: 56.32 | L268: -1.54e-002 | M268: 115.1 | N268: 43.51 | O268: 7.8e-002 | P268: 129.44 | Q268: 转股中 | R268: 5年56天 | S268: 3年57天 | T268: 15.7 | U268: 24 | V268: 1.1000000000000001e-002 | W268: 5.2999999999999999e-002 | X268: 6.9000000000000006e-002 | Y268: 296 | Z268: 5.07 | AA268: -3.73e-002 | AB268: -4.2199999999999994e-002 | AC268: -8.6400000000000005e-002 | AD268: -8.8200000000000001e-002 | AE268: 90.71 | AF268: 93.86 | AG268: 0.8 | AH268: AA | AI268: 4.1200000000000001e-002 | AJ268: =H268+100*O268 -> 147.36000000000001 | AK268: 149.7 | AL268: 220 | AM268: 55.8 | AN268: 216 | AO268: 2.2000000000000002e-002 | AP268: 5 | AQ268: 鸿路转债!
A269: 67 | B269: 123092 | C269: 天壕转债 | D269: 300332 | E269: 天壕环境 | F269: 石油天然 | G269: 天然气 | H269: 148.8 | I269: 4.4199999999999996e-002 | J269: -3.4599999999999999e-002 | K269: 6.87 | L269: 1.18e-002 | M269: 121.6 | N269: 5.19 | O269: 0.124 | P269: 132.37 | Q269: 转股中 | R269: 5.36年 | S269: 3.36年 | T269: 4.23 | U269: 55 | V269: 8.6999999999999994e-002 | W269: 7.0000000000000007e-002 | X269: 9.3000000000000013e-002 | Y269: 60 | Z269: 1.79 | AA269: -3.7699999999999997e-002 | AB269: -4.4199999999999996e-002 | AC269: -9.6000000000000002e-002 | AD269: -9.8100000000000007e-002 | AE269: 81.78 | AF269: 84.05 | AG269: 0.81 | AH269: A+ | AI269: 7.3200000000000001e-002 | AJ269: =H269+100*O269 -> 161.20000000000002 | AK269: 165.2 | AL269: 286 | AM269: 81.2 | AN269: 302 | AO269: 9.4e-002 | AP269: 9 | AQ269: 天壕转债
A270: 153 | B270: 123060 | C270: 苏试转债! | D270: 300416 | E270: 苏试试验 | F270: 机械装备 | G270: 专用设备 | H270: 141.54 | I270: -5.6999999999999993e-003 | J270: -9.3999999999999986e-003 | K270: 22.12 | L270: -1.9900000000000001e-002 | M270: 117.2 | N270: 18.28 | O270: 0.17000000000000001 | P270: 121.01 | Q270: 转股中 | R270: 4.93年 | S270: 2.94年 | T270: 3.1 | U270: 4.4 | V270: 1.e-002 | W270: 5.2999999999999999e-002 | X270: 6.4000000000000001e-002 | Y270: 58 | Z270: 4.82 | AA270: -3.8199999999999998e-002 | AB270: -4.3899999999999995e-002 | AC270: -9.6500000000000002e-002 | AD270: -9.8400000000000001e-002 | AE270: 86.32 | AF270: 88.05 | AG270: 0.76 | AH270: AA- | AI270: 6.0899999999999996e-002 | AJ270: =H270+100*O270 -> 158.53999999999999 | AK270: 162.1 | AL270: 278 | AM270: 74 | AN270: 287 | AO270: -6.9000000000000006e-002 | AP270: 8 | AQ270: 苏试转债!
A271: 52 | B271: 118000 | C271: 嘉元转债 | D271: 688388 | E271: 嘉元科技 | F271: 电子 | G271: 电子产品 | H271: 149.5 | I271: 7.7000000000000002e-003 | J271: -4.5999999999999999e-003 | K271: 106.6 | L271: 3.9000000000000003e-003 | M271: 121 | N271: 78.74 | O271: 0.10400000000000001 | P271: 135.38 | Q271: 19天 | R271: 5.53年 | S271: 3.53年 | T271: 12.4 | U271: 167 | V271: 8.8000000000000009e-002 | W271: 5.0000000000000003e-002 | X271: 6.8000000000000005e-002 | Y271: 246 | Z271: 9.04 | AA271: -3.8199999999999998e-002 | AB271: -4.4299999999999999e-002 | AC271: -9.4399999999999998e-002 | AD271: -9.6099999999999991e-002 | AE271: 83.33 | AF271: 87.27 | AG271: 0.8 | AH271: AA- | AI271: 6.2199999999999998e-002 | AJ271: =H271+100*O271 -> 159.90000000000001 | AK271: 163.6 | AL271: 282 | AM271: 76.3 | AN271: 296 | AO271: 0.159 | AP271: 5 | AQ271: 嘉元转债
A272: 336 | B272: 128036 | C272: 金农转债!! | D272: 2548 | E272: 金新农 | F272: 农业 | G272: 畜牧业 | H272: 120.844 | I272: -2.5000000000000001e-003 | J272: 1.8e-003 | K272: 5.33 | L272: -3.7000000000000002e-003 | M272: 109.3 | N272: 6.93 | O272: 0.57100000000000006 | P272: 76.91 | Q272: 转股中 | R272: 2.57年 | S272: 0.57年 | T272: 1.46 | U272: 19 | V272: 0.105 | W272: 4.0000000000000001e-002 | X272: 2.9999999999999999e-002 | Y272: 37 | Z272: 1.41 | AA272: -3.8900000000000004e-002 | AB272: -4.53e-002 | AC272: -0.221 | AD272: -0.22500000000000001 | AE272: 97.58 | AF272: 94.49 | AG272: 0.18 | AH272: AA- | AI272: 5.9400000000000001e-002 | AJ272: =H272+100*O272 -> 177.94400000000002 | AK272: 164.8 | AL272: 284 | AM272: 67.2 | AN272: 269 | AO272: 1.e-003 | AP272: 16 | AQ272: 金农转债!!
A273: 309 | B273: 113525 | C273: 台华转债! | D273: 603055 | E273: 台华新材 | F273: 服装纺织 | G273: 纺织行业 | H273: 130.27 | I273: 9.3999999999999986e-003 | J273: -8.6e-003 | K273: 9.22 | L273: 1.1000000000000001e-003 | M273: 114.3 | N273: 7.78 | O273: 9.9000000000000005e-002 | P273: 118.51 | Q273: 转股中 | R273: 3.34年 | S273: 1.35年 | T273: 4.69 | U273: 36 | V273: 5.7999999999999996e-002 | W273: 6.0999999999999999e-002 | X273: 7.2999999999999995e-002 | Y273: 77 | Z273: 2.52 | AA273: -3.9100000000000003e-002 | AB273: -4.6300000000000001e-002 | AC273: -0.13100000000000001 | AD273: -0.13400000000000001 | AE273: 96.95 | AF273: 100.56 | AG273: 0.7 | AH273: AA | AI273: 3.9900000000000005e-002 | AJ273: =H273+100*O273 -> 140.17000000000002 | AK273: 142 | AL273: 164 | AM273: 41.5 | AN273: 109 | AO273: 8.0000000000000002e-002 | AP273: 19 | AQ273: 台华转债!
A274: 80 | B274: 123084 | C274: 高澜转债! | D274: 300499 | E274: 高澜股份 | F274: 能源电力 | G274: 电力设备 | H274: 150.276 | I274: 5.9699999999999996e-002 | J274: -1.8100000000000002e-002 | K274: 13.01 | L274: 4.9200000000000001e-002 | M274: 121.9 | N274: 9 | O274: 4.0000000000000001e-002 | P274: 144.56 | Q274: 转股中 | R274: 5.32年 | S274: 3.33年 | T274: 2.8 | U274: 477 | V274: 1.1699999999999999 | W274: 7.6999999999999999e-002 | X274: 0.11199999999999999 | Y274: 36 | Z274: 4.38 | AA274: -3.9399999999999998e-002 | AB274: -4.5899999999999996e-002 | AC274: -9.9000000000000005e-002 | AD274: -0.10099999999999999 | AE274: 82.18 | AF274: 84.51 | AG274: 0.84 | AH274: A+ | AI274: 7.3200000000000001e-002 | AJ274: =H274+100*O274 -> 154.27600000000001 | AK274: 156 | AL274: 257 | AM274: 71.5 | AN274: 279 | AO274: 0.22399999999999998 | AP274: 16 | AQ274: 高澜转债!
A275: 83 | B275: 123083 | C275: 朗新转债 | D275: 300682 | E275: 朗新科技 | F275: 计算机及 | G275: 软件开发 | H275: 142.2 | I275: 1.5700000000000002e-002 | J275: -1.09e-002 | K275: 19.42 | L275: 6.1999999999999998e-003 | M275: 115.1 | N275: 15.45 | O275: 0.13100000000000001 | P275: 125.7 | Q275: 转股中 | R275: 5.32年 | S275: 3.32年 | T275: 8 | U275: 25 | V275: 2.2000000000000002e-002 | W275: 4.0000000000000001e-002 | X275: 5.0999999999999997e-002 | Y275: 199 | Z275: 3.77 | AA275: -3.9599999999999996e-002 | AB275: -4.4299999999999999e-002 | AC275: -8.7400000000000005e-002 | AD275: -8.9099999999999999e-002 | AE275: 90.1 | AF275: 93.23 | AG275: 0.77 | AH275: AA | AI275: 4.1200000000000001e-002 | AJ275: =H275+100*O275 -> 155.29999999999998 | AK275: 158.7 | AL275: 265 | AM275: 65.5 | AN275: 259 | AO275: 3.3000000000000002e-002 | AP275: 6 | AQ275: 朗新转债
A276: 16 | B276: 127037 | C276: 银轮转债 | D276: 2126 | E276: 银轮股份 | F276: 汽车 | G276: 零部件制 | H276: 145.03 | I276: -1.0200000000000001e-002 | J276: 1.3100000000000001e-002 | K276: 11.86 | L276: 4.1999999999999997e-003 | M276: 115.1 | N276: 10.77 | O276: 0.317 | P276: 110.12 | Q276: 4月0天 | R276: 5.81年 | S276: 3.82年 | T276: 7 | U276: 45 | V276: 4.4000000000000004e-002 | W276: 7.4999999999999997e-002 | X276: 8.199999999999999e-002 | Y276: 94 | Z276: 2.29 | AA276: -3.9599999999999996e-002 | AB276: -4.3899999999999995e-002 | AC276: -8.1500000000000003e-002 | AD276: -8.3000000000000004e-002 | AE276: 88.33 | AF276: 91.39 | AG276: 0.68 | AH276: AA | AI276: 4.1200000000000001e-002 | AJ276: =H276+100*O276 -> 176.72999999999999 | AK276: 179.9 | AL276: 313 | AM276: 88.5 | AN276: 312 | AO276: 1.e-002 | AP276: 2 | AQ276: 银轮转债
A277: 182 | B277: 128109 | C277: 楚江转债 | D277: 2171 | E277: 楚江新材 | F277: 有色金属 | G277: 铜金属 | H277: 140.285 | I277: 1.66e-002 | J277: 2.4900000000000002e-002 | K277: 10.69 | L277: 5.5300000000000002e-002 | M277: 114.9 | N277: 8.63 | O277: 0.13300000000000001 | P277: 123.87 | Q277: 转股中 | R277: 4.81年 | S277: 2.81年 | T277: 18.3 | U277: 133 | V277: 5.2000000000000005e-002 | W277: 0.128 | X277: 0.159 | Y277: 143 | Z277: 2.51 | AA277: -4.1399999999999999e-002 | AB277: -4.6500000000000007e-002 | AC277: -9.8100000000000007e-002 | AD277: -0.10000000000000001 | AE277: 92.13 | AF277: 95.54 | AG277: 0.75 | AH277: AA | AI277: 3.9900000000000005e-002 | AJ277: =H277+100*O277 -> 153.58500000000001 | AK277: 156.7 | AL277: 259 | AM277: 61.2 | AN277: 236 | AO277: 0.12 | AP277: 6 | AQ277: 楚江转债
A278: 197 | B278: 123048 | C278: 应急转债! | D278: 300527 | E278: 中船应急 | F278: 机械装备 | G278: 专用设备 | H278: 137.22 | I278: -2.7000000000000003e-002 | J278: 4.24e-002 | K278: 10.56 | L278: 2.1299999999999999e-002 | M278: 112.8 | N278: 8.88 | O278: 0.154 | P278: 118.92 | Q278: 转股中 | R278: 4.65年 | S278: 2.66年 | T278: 3.79 | U278: 515 | V278: 0.94200000000000006 | W278: 3.7000000000000005e-002 | X278: 4.4000000000000004e-002 | Y278: 102 | Z278: 3.82 | AA278: -4.1900000000000007e-002 | AB278: -4.6600000000000003e-002 | AC278: -9.6300000000000011e-002 | AD278: -9.820000000000001e-002 | AE278: 93.84 | AF278: 96.44 | AG278: 0.72 | AH278: AA+ | AI278: 3.49e-002 | AJ278: =H278+100*O278 -> 152.62 | AK278: 155.5 | AL278: 252 | AM278: 59.1 | AN278: 224 | AO278: 0.105 | AP278: 17 | AQ278: 应急转债!
A279: 217 | B279: 113568 | C279: 新春转债!! | D279: 603667 | E279: 五洲新春 | F279: 机械装备 | G279: 通用设备 | H279: 150.69 | I279: -1.4999999999999999e-002 | J279: 8.6e-003 | K279: 12.82 | L279: -7.7000000000000002e-003 | M279: 124.3 | N279: 8.75 | O279: 2.8999999999999998e-002 | P279: 146.51 | Q279: 转股中 | R279: 4.56年 | S279: 2.56年 | T279: 2.74 | U279: 57 | V279: 0.13699999999999998 | W279: 7.2999999999999995e-002 | X279: 0.107 | Y279: 37 | Z279: 2.11 | AA279: -4.2199999999999994e-002 | AB279: -5.0499999999999996e-002 | AC279: -0.126 | AD279: -0.128 | AE279: 88.87 | AF279: 95.55 | AG279: 0.83 | AH279: AA- | AI279: 6.0899999999999996e-002 | AJ279: =H279+100*O279 -> 153.59 | AK279: 154.9 | AL279: 250 | AM279: 59.3 | AN279: 226 | AO279: 7.5999999999999998e-002 | AP279: 47 | AQ279: 新春转债!!
A280: 43 | B280: 127029 | C280: 中钢转债 | D280: 928 | E280: 中钢国际 | F280: 建筑 | G280: 建筑工程 | H280: 150 | I280: -1.e-004 | J280: -8.0000000000000004e-004 | K280: 8.9 | L280: -1.1000000000000001e-003 | M280: 117.5 | N280: 5.89 | O280: -6.9999999999999993e-003 | P280: 151.1 | Q280: 45天 | R280: 5.59年 | S280: 3.60年 | T280: 9.6 | U280: 97 | V280: 6.7000000000000004e-002 | W280: 8.5999999999999993e-002 | X280: 0.13 | Y280: 112 | Z280: 1.94 | AA280: -4.3200000000000002e-002 | AB280: -4.8399999999999999e-002 | AC280: -9.5500000000000002e-002 | AD280: -9.6799999999999997e-002 | AE280: 90.17 | AF280: 96.57 | AG280: 0.85 | AH280: AA+ | AI280: 3.6200000000000003e-002 | AJ280: =H280+100*O280 -> 149.30000000000001 | AK280: 148.9 | AL280: 214 | AM280: 52.3 | AN280: 189 | AO280: -6.2e-002 | AP280: 11 | AQ280: 中钢转债
A281: 358 | B281: 113502 | C281: 嘉澳转债! | D281: 603822 | E281: 嘉澳环保 | F281: 化工 | G281: 化工 | H281: 123.69 | I281: 6.0000000000000001e-003 | J281: 1.e-004 | K281: 42.03 | L281: 1.37e-002 | M281: 111.3 | N281: 44.64 | O281: 0.314 | P281: 94.15 | Q281: 转股中 | R281: 2.24年 | S281: 0.24年 | T281: 1.85 | U281: 64 | V281: 0.28199999999999997 | W281: 5.9999999999999998e-002 | X281: 5.5999999999999994e-002 | Y281: 31 | Z281: 3.85 | AA281: -4.6799999999999994e-002 | AB281: -5.5399999999999998e-002 | AC281: -0.46100000000000002 | AD281: -0.46799999999999997 | AE281: 99.43 | AF281: 98.04 | AG281: 0.44 | AH281: AA- | AI281: 5.9400000000000001e-002 | AJ281: =H281+100*O281 -> 155.09 | AK281: 153.2 | AL281: 243 | AM281: 53.8 | AN281: 198 | AO281: 5.7999999999999996e-002 | AP281: 37 | AQ281: 嘉澳转债!
A282: 178 | B282: 113585 | C282: 寿仙转债! | D282: 603896 | E282: 寿仙谷 | F282: 医药 | G282: 中药 | H282: 147.69 | I282: 6.7000000000000002e-003 | J282: -6.5000000000000006e-003 | K282: 41.2 | L282: 2.0000000000000001e-004 | M282: 117.3 | N282: 28.38 | O282: 1.7000000000000001e-002 | P282: 145.17 | Q282: 转股中 | R282: 4.82年 | S282: 2.82年 | T282: 1.07 | U282: 41 | V282: 0.26300000000000001 | W282: 1.7000000000000001e-002 | X282: 2.5000000000000001e-002 | Y282: 62 | Z282: 4.46 | AA282: -4.7500000000000001e-002 | AB282: -5.33e-002 | AC282: -0.111 | AD282: -0.113 | AE282: 87 | AF282: 88.75 | AG282: 0.87 | AH282: AA- | AI282: 6.0899999999999996e-002 | AJ282: =H282+100*O282 -> 149.38999999999999 | AK282: 150.2 | AL282: 226 | AM282: 61.5 | AN282: 238 | AO282: -2.7000000000000003e-002 | AP282: 15 | AQ282: 寿仙转债!
A283: 248 | B283: 110061 | C283: 川投转债 | D283: 600674 | E283: 川投能源 | F283: 能源电力 | G283: 水电 | H283: 135.88 | I283: 1.2e-002 | J283: -3.7000000000000002e-003 | K283: 11.42 | L283: 1.06e-002 | M283: 110.8 | N283: 9.2 | O283: 9.5000000000000001e-002 | P283: 124.13 | Q283: 转股中 | R283: 4.24年 | S283: 2.25年 | T283: 39.6 | U283: 19 | V283: 4.0000000000000001e-003 | W283: 7.9000000000000001e-002 | X283: 9.8000000000000004e-002 | Y283: 503 | Z283: 1.75 | AA283: -4.7800000000000002e-002 | AB283: -5.21e-002 | AC283: -0.10800000000000001 | AD283: -0.11 | AE283: 95.61 | AF283: 96.86 | AG283: 0.78 | AH283: AAA | AI283: 3.2899999999999999e-002 | AJ283: =H283+100*O283 -> 145.38 | AK283: 147.6 | AL283: 202 | AM283: 50.8 | AN283: 175 | AO283: 1.6e-002 | AP283: 14 | AQ283: 川投转债
A284: 53 | B284: 123100 | C284: 朗科转债 | D284: 300543 | E284: 朗科智能 | F284: 电子 | G284: 电子产品 | H284: 153.25 | I284: -1.6000000000000001e-003 | J284: -4.0000000000000002e-004 | K284: 17.08 | L284: -2.3e-003 | M284: 117.5 | N284: 11.61 | O284: 4.2000000000000003e-002 | P284: 147.11 | Q284: 9天 | R284: 5.49年 | S284: 3.49年 | T284: 3.8 | U284: 55 | V284: 9.4e-002 | W284: 8.3000000000000004e-002 | X284: 0.122 | Y284: 46 | Z284: 3.76 | AA284: -4.8000000000000001e-002 | AB284: -5.3200000000000004e-002 | AC284: -0.10199999999999999 | AD284: -0.10099999999999999 | AE284: 83.45 | AF284: 84.94 | AG284: 0.87 | AH284: AA- | AI284: 6.2199999999999998e-002 | AJ284: =H284+100*O284 -> 157.44999999999999 | AK284: 159.4 | AL284: 268 | AM284: 74.4 | AN284: 288 | AO284: 8.0000000000000002e-002 | AP284: 9 | AQ284: 朗科转债
A285: 5 | B285: 127040 | C285: 国泰转债 | D285: 2091 | E285: 江苏国泰 | F285: 商业零售 | G285: 商业零售 | H285: 150.49 | I285: 1.e-002 | J285: 1.1999999999999999e-003 | K285: 13.3 | L285: 1.29e-002 | M285: 112.5 | N285: 9.02 | O285: 2.1000000000000001e-002 | P285: 147.45 | Q285: 5月3天 | R285: 5.90年 | S285: 3.90年 | T285: 45.6 | U285: 1192. | V285: 0.17399999999999999 | W285: 0.21899999999999997 | X285: 0.32299999999999995 | Y285: 208 | Z285: 2.21 | AA285: -4.87e-002 | AB285: -5.2300000000000006e-002 | AC285: -8.9399999999999993e-002 | AD285: -9.0700000000000003e-002 | AE285: 89.21 | AF285: 91.49 | AG285: 0.87 | AH285: AA+ | AI285: 3.6200000000000003e-002 | AJ285: =H285+100*O285 -> 152.59 | AK285: 153.5 | AL285: 245 | AM285: 62 | AN285: 243 | AO285: -4.0000000000000001e-003 | AP285: 5 | AQ285: 国泰转债
A286: 93 | B286: 123078 | C286: 飞凯转债!! | D286: 300398 | E286: 飞凯材料 | F286: 化工 | G286: 化工 | H286: 151 | I286: -8.9999999999999998e-004 | J286: -5.5000000000000005e-003 | K286: 21.74 | L286: -7.8000000000000005e-003 | M286: 115.2 | N286: 15.56 | O286: 8.1000000000000003e-002 | P286: 139.72 | Q286: 转股中 | R286: 5.29年 | S286: 3.29年 | T286: 8.15 | U286: 101 | V286: 8.1000000000000003e-002 | W286: 7.2999999999999995e-002 | X286: 0.10099999999999999 | Y286: 112 | Z286: 4.04 | AA286: -5.0700000000000002e-002 | AB286: -5.5399999999999998e-002 | AC286: -0.10099999999999999 | AD286: -0.10300000000000001 | AE286: 90.32 | AF286: 93.45 | AG286: 0.83 | AH286: AA | AI286: 4.1200000000000001e-002 | AJ286: =H286+100*O286 -> 159.09999999999999 | AK286: 162.3 | AL286: 279 | AM286: 68.8 | AN286: 273 | AO286: 6.7000000000000004e-002 | AP286: 8 | AQ286: 飞凯转债!!
A287: 108 | B287: 123074 | C287: 隆利转债!! | D287: 300752 | E287: 隆利科技 | F287: 电子 | G287: 液晶显示 | H287: 162.59 | I287: -4.3700000000000003e-002 | J287: 2.2000000000000001e-003 | K287: 27.28 | L287: -5.0099999999999999e-002 | M287: 124 | N287: 18.34 | O287: 9.3000000000000013e-002 | P287: 148.75 | Q287: 转股中 | R287: 5.21年 | S287: 3.21年 | T287: 1.48 | U287: 272 | V287: 1.1100000000000001 | W287: 2.7000000000000003e-002 | X287: 4.0000000000000001e-002 | Y287: 55 | Z287: 3.79 | AA287: -5.16e-002 | AB287: -5.8700000000000002e-002 | AC287: -0.122 | AD287: -0.124 | AE287: 84.96 | AF287: 91.17 | AG287: 0.83 | AH287: AA- | AI287: 6.2199999999999998e-002 | AJ287: =H287+100*O287 -> 171.89000000000001 | AK287: 176.4 | AL287: 305 | AM287: 85.3 | AN287: 305 | AO287: -0.14199999999999999 | AP287: 17 | AQ287: 隆利转债!!
A288: 150 | B288: 128122 | C288: 兴森转债! | D288: 2436 | E288: 兴森科技 | F288: 电子 | G288: 元器件制 | H288: 139.739 | I288: -2.1600000000000001e-002 | J288: -4.0000000000000001e-003 | K288: 15.05 | L288: -4.2000000000000003e-002 | M288: 113 | N288: 14.1 | O288: 0.309 | P288: 106.74 | Q288: 转股中 | R288: 3.94年 | S288: 2.94年 | T288: 2.69 | U288: 120 | V288: 0.312 | W288: 1.2e-002 | X288: 1.3000000000000001e-002 | Y288: 224 | Z288: 6.98 | AA288: -5.2999999999999999e-002 | AB288: -5.8499999999999996e-002 | AC288: -9.3100000000000002e-002 | AD288: -9.4800000000000009e-002 | AE288: 91.58 | AF288: 97.02 | AG288: 0.61 | AH288: AA | AI288: 3.9900000000000005e-002 | AJ288: =H288+100*O288 -> 170.63900000000001 | AK288: 172.7 | AL288: 300 | AM288: 75.7 | AN288: 295 | AO288: 8.6999999999999994e-002 | AP288: 13 | AQ288: 兴森转债!
A289: 183 | B289: 123051 | C289: 今天转债 | D289: 300532 | E289: 今天国际 | F289: 计算机及 | G289: 软件开发 | H289: 158.66 | I289: 0.23999999999999999 | J289: -7.8100000000000003e-002 | K289: 12.16 | L289: 0.20000000000000001 | M289: 122.3 | N289: 8.7 | O289: 0.13500000000000001 | P289: 139.77 | Q289: 转股中 | R289: 4.81年 | S289: 2.81年 | T289: 2.8 | U289: 2186. | V289: 4.9699999999999998 | W289: 8.4000000000000005e-002 | X289: 0.11800000000000001 | Y289: 33 | Z289: 4.26 | AA289: -5.3800000000000001e-002 | AB289: -6.0999999999999999e-002 | AC289: -0.13100000000000001 | AD289: -0.13300000000000001 | AE289: 84.96 | AF289: 88.29 | AG289: 0.81 | AH289: A+ | AI289: 7.1900000000000006e-002 | AJ289: =H289+100*O289 -> 172.16 | AK289: 177.5 | AL289: 306 | AM289: 89.3 | AN289: 313 | AO289: 0.252 | AP289: 18 | AQ289: 今天转债
A290: 335 | B290: 113508 | C290: 新凤转债!!* | D290: 603225 | E290: 新凤鸣 | F290: 服装纺织 | G290: 纺织行业 | H290: 129.1 | I290: 1.18e-002 | J290: 2.7000000000000001e-003 | K290: 20.3 | L290: 1.4499999999999999e-002 | M290: 111.3 | N290: 15.65 | O290: -5.0000000000000001e-003 | P290: 129.71 | Q290: 转股中 | R290: 2.70年 | S290: 0.70年 | T290: 10.6 | U290: 259 | V290: 0.18899999999999997 | W290: 3.7000000000000005e-002 | X290: 4.8000000000000001e-002 | Y290: 285 | Z290: 2.33 | AA290: -5.4199999999999998e-002 | AB290: -6.13e-002 | AC290: -0.248 | AD290: -0.251 | AE290: 98.53 | AF290: 100.7 | AG290: 1 | AH290: AA | AI290: 3.8399999999999997e-002 | AJ290: =H290+100*O290 -> 128.59999999999999 | AK290: 128.5 | AL290: 30 | AM290: 27.8 | AN290: 17 | AO290: -2.5000000000000001e-002 | AP290: 22 | AQ290: 新凤转债!!*
A291: 218 | B291: 123043 | C291: 正元转债 | D291: 300645 | E291: 正元智慧 | F291: 计算机及 | G291: 软件开发 | H291: 155.346 | I291: -3.0200000000000001e-002 | J291: -4.0999999999999995e-003 | K291: 18.25 | L291: -4.6500000000000007e-002 | M291: 120.9 | N291: 15.38 | O291: 0.309 | P291: 118.66 | Q291: 转股中 | R291: 4.56年 | S291: 2.56年 | T291: 1.66 | U291: 191 | V291: 0.73299999999999998 | W291: 7.0999999999999994e-002 | X291: 8.5000000000000006e-002 | Y291: 23 | Z291: 3.61 | AA291: -5.4600000000000003e-002 | AB291: -6.1799999999999994e-002 | AC291: -0.13600000000000001 | AD291: -0.13800000000000001 | AE291: 86.31 | AF291: 88.77 | AG291: 0.74 | AH291: A+ | AI291: 7.1900000000000006e-002 | AJ291: =H291+100*O291 -> 186.24600000000001 | AK291: 192 | AL291: 322 | AM291: 103.3 | AN291: 328 | AO291: 2.2000000000000002e-002 | AP291: 18 | AQ291: 正元转债
A292: 78 | B292: 123085 | C292: 万顺转2! | D292: 300057 | E292: 万顺新材 | F292: 有色金属 | G292: 铝金属 | H292: 152.31 | I292: -3.0600000000000002e-002 | J292: -2.7799999999999998e-002 | K292: 9.17 | L292: -6.6199999999999995e-002 | M292: 113.3 | N292: 6.2 | O292: 2.9999999999999999e-002 | P292: 147.9 | Q292: 转股中 | R292: 5.33年 | S292: 3.33年 | T292: 8.84 | U292: 340 | V292: 0.252 | W292: 0.14300000000000002 | X292: 0.21100000000000002 | Y292: 62 | Z292: 1.74 | AA292: -5.5e-002 | AB292: -5.91e-002 | AC292: -0.10199999999999999 | AD292: -0.10400000000000001 | AE292: 84.26 | AF292: 82.73 | AG292: 0.88 | AH292: AA- | AI292: 6.2199999999999998e-002 | AJ292: =H292+100*O292 -> 155.31 | AK292: 156.7 | AL292: 260 | AM292: 72.5 | AN292: 282 | AO292: 0.251 | AP292: 24 | AQ292: 万顺转2!
A293: 66 | B293: 113616 | C293: 韦尔转债! | D293: 603501 | E293: 韦尔股份 | F293: 电子 | G293: 元器件制 | H293: 155.06 | I293: -1.1299999999999999e-002 | J293: -5.8999999999999999e-003 | K293: 269.59 | L293: -2.3399999999999997e-002 | M293: 114.5 | N293: 222.52 | O293: 0.28000000000000003 | P293: 121.15 | Q293: 转股中 | R293: 5.37年 | S293: 3.38年 | T293: 24.3 | U293: 200 | V293: 5.2999999999999999e-002 | W293: 1.e-002 | X293: 1.3000000000000001e-002 | Y293: 2342. | Z293: 18.81 | AA293: -5.5599999999999997e-002 | AB293: -5.9999999999999998e-002 | AC293: -0.107 | AD293: -0.10800000000000001 | AE293: 90.89 | AF293: 94.86 | AG293: 0.73 | AH293: AA+ | AI293: 3.6200000000000003e-002 | AJ293: =H293+100*O293 -> 183.06 | AK293: 189 | AL293: 320 | AM293: 94.1 | AN293: 322 | AO293: -0.109 | AP293: 8 | AQ293: 韦尔转债!
A294: 70 | B294: 123089 | C294: 九洲转2!! | D294: 300040 | E294: 九洲集团 | F294: 能源电力 | G294: 电力设备 | H294: 164.957 | I294: -1.5e-003 | J294: -1.18e-002 | K294: 9.24 | L294: -1.49e-002 | M294: 121 | N294: 5.68 | O294: 1.3999999999999999e-002 | P294: 162.68 | Q294: 转股中 | R294: 5.35年 | S294: 3.36年 | T294: 3.1 | U294: 287 | V294: 0.55600000000000005 | W294: 5.9999999999999998e-002 | X294: 9.6999999999999989e-002 | Y294: 52 | Z294: 1.58 | AA294: -5.7200000000000001e-002 | AB294: -6.3299999999999995e-002 | AC294: -0.12 | AD294: -0.122 | AE294: 84.22 | AF294: 88.2 | AG294: 0.89 | AH294: AA- | AI294: 6.2199999999999998e-002 | AJ294: =H294+100*O294 -> 166.357 | AK294: 167.2 | AL294: 292 | AM294: 79 | AN294: 299 | AO294: 8.5000000000000006e-002 | AP294: 22 | AQ294: 九洲转2!!
A295: 305 | B295: 128053 | C295: 尚荣转债! | D295: 2551 | E295: 尚荣医疗 | F295: 医药 | G295: 医疗器械 | H295: 140.51 | I295: -1.1699999999999999e-002 | J295: 1.3500000000000002e-002 | K295: 5.38 | L295: 1.9e-003 | M295: 114.3 | N295: 4.88 | O295: 0.27500000000000002 | P295: 110.25 | Q295: 转股中 | R295: 3.51年 | S295: 1.51年 | T295: 1.91 | U295: 200 | V295: 0.73699999999999999 | W295: 4.2000000000000003e-002 | X295: 4.5999999999999999e-002 | Y295: 45 | Z295: 1.44 | AA295: -5.8200000000000002e-002 | AB295: -6.480000000000001e-002 | AC295: -0.14800000000000002 | AD295: -0.14999999999999999 | AE295: 96.34 | AF295: 99.91 | AG295: 0.96 | AH295: AA | AI295: 3.9900000000000005e-002 | AJ295: =H295+100*O295 -> 168.00999999999999 | AK295: 170.8 | AL295: 298 | AM295: 70.9 | AN295: 278 | AO295: 1.4999999999999999e-002 | AP295: 24 | AQ295: 尚荣转债!
A296: 298 | B296: 127011 | C296: 中鼎转2! | D296: 887 | E296: 中鼎股份 | F296: 汽车 | G296: 零部件制 | H296: 141.69 | I296: 2.1899999999999999e-002 | J296: -6.4000000000000003e-003 | K296: 15.7 | L296: 1.8799999999999997e-002 | M296: 114.5 | N296: 11.39 | O296: 2.7999999999999997e-002 | P296: 137.84 | Q296: 转股中 | R296: 3.56年 | S296: 1.57年 | T296: 12 | U296: 208 | V296: 0.122 | W296: 6.3e-002 | X296: 8.5999999999999993e-002 | Y296: 192 | Z296: 2.15 | AA296: -5.9000000000000004e-002 | AB296: -6.5700000000000008e-002 | AC296: -0.14499999999999999 | AD296: -0.14699999999999999 | AE296: 96.94 | AF296: 101.56 | AG296: 0.83 | AH296: AA+ | AI296: 3.49e-002 | AJ296: =H296+100*O296 -> 144.49000000000001 | AK296: 145.5 | AL296: 187 | AM296: 44 | AN296: 122 | AO296: 5.0999999999999997e-002 | AP296: 21 | AQ296: 中鼎转2!
A297: 245 | B297: 113550 | C297: 常汽转债! | D297: 603035 | E297: 常熟汽饰 | F297: 汽车 | G297: 零部件制 | H297: 157.77 | I297: 2.5000000000000001e-002 | J297: 7.3000000000000001e-003 | K297: 14.02 | L297: 3.7699999999999997e-002 | M297: 121.3 | N297: 9.33 | O297: 5.0000000000000003e-002 | P297: 150.27 | Q297: 转股中 | R297: 4.26年 | S297: 2.27年 | T297: 2.15 | U297: 349 | V297: 1.03 | W297: 4.2999999999999997e-002 | X297: 6.4000000000000001e-002 | Y297: 50 | Z297: 1.31 | AA297: -6.1100000000000002e-002 | AB297: -6.8900000000000003e-002 | AC297: -0.11599999999999999 | AD297: -0.11800000000000001 | AE297: 90.44 | AF297: 94.9 | AG297: 0.86 | AH297: AA- | AI297: 6.0899999999999996e-002 | AJ297: =H297+100*O297 -> 162.77000000000001 | AK297: 165.3 | AL297: 287 | AM297: 70.4 | AN297: 277 | AO297: 7.2999999999999995e-002 | AP297: 17 | AQ297: 常汽转债!
A298: 247 | B298: 123035 | C298: 利德转债!! | D298: 300296 | E298: 利亚德 | F298: 电子 | G298: LED制 | H298: 149.8 | I298: -2.0899999999999998e-002 | J298: -8.8000000000000005e-003 | K298: 9.31 | L298: -3.7200000000000004e-002 | M298: 115.1 | N298: 6.96 | O298: 0.12 | P298: 133.76 | Q298: 转股中 | R298: 4.25年 | S298: 2.25年 | T298: 8 | U298: 68 | V298: 5.5999999999999994e-002 | W298: 3.4000000000000002e-002 | X298: 4.4999999999999998e-002 | Y298: 237 | Z298: 3.25 | AA298: -6.13e-002 | AB298: -6.7000000000000004e-002 | AC298: -0.106 | AD298: -0.107 | AE298: 95.44 | AF298: 99.81 | AG298: 0.8 | AH298: AA+ | AI298: 3.49e-002 | AJ298: =H298+100*O298 -> 161.80000000000001 | AK298: 165.8 | AL298: 290 | AM298: 66 | AN298: 263 | AO298: -2.4e-002 | AP298: 14 | AQ298: 利德转债!!
A299: 250 | B299: 123033 | C299: 金力转债!!* | D299: 300748 | E299: 金力永磁 | F299: 电子 | G299: 元器件制 | H299: 157.817 | I299: -8.6999999999999994e-003 | J299: -1.1999999999999999e-003 | K299: 39.11 | L299: -9.8999999999999991e-003 | M299: 121.5 | N299: 25.3 | O299: 2.1000000000000001e-002 | P299: 154.58 | Q299: 转股中 | R299: 4.22年 | S299: 2.22年 | T299: 2.53 | U299: 1091. | V299: 2.6400000000000001 | W299: 9.0000000000000011e-003 | X299: 1.3999999999999999e-002 | Y299: 271 | Z299: 8.05 | AA299: -6.1799999999999994e-002 | AB299: -6.9599999999999995e-002 | AC299: -0.11800000000000001 | AD299: -0.12 | AE299: 91.42 | AF299: 95.45 | AG299: 1 | AH299: AA- | AI299: 6.0899999999999996e-002 | AJ299: =H299+100*O299 -> 159.917 | AK299: 161 | AL299: 275 | AM299: 65.6 | AN299: 260 | AO299: 1.4999999999999999e-002 | AP299: 25 | AQ299: 金力转债!!*
A300: 31 | B300: 123111 | C300: 东财转3 | D300: 300059 | E300: 东方财富 | F300: 金融 | G300: 证券行业 | H300: 158.358 | I300: 4.0000000000000002e-004 | J300: 2.2000000000000001e-003 | K300: 32.16 | L300: 3.0999999999999999e-003 | M300: 110.5 | N300: 23.35 | O300: 0.14999999999999999 | P300: 137.73 | Q300: 2月1天 | R300: 5.65年 | S300: 3.65年 | T300: 158 | U300: 398 | V300: 1.6e-002 | W300: 4.8000000000000001e-002 | X300: 6.5000000000000002e-002 | Y300: 3324. | Z300: 9.13 | AA300: -6.2300000000000001e-002 | AB300: -6.54e-002 | AC300: -0.106 | AD300: -0.106 | AE300: 89.11 | AF300: 90.6 | AG300: 0.83 | AH300: AA+ | AI300: 3.6200000000000003e-002 | AJ300: =H300+100*O300 -> 173.358 | AK300: 179 | AL300: 311 | AM300: 88.4 | AN300: 311 | AO300: -1.9e-002 | AP300: 20 | AQ300: 东财转3
A301: 345 | B301: 128033 | C301: 迪龙转债! | D301: 2658 | E301: 雪迪龙 | F301: 城市公用 | G301: 三废处理 | H301: 126.688 | I301: -1.18e-002 | J301: -2.e-003 | K301: 9.19 | L301: -2.3399999999999997e-002 | M301: 108.8 | N301: 8.71 | O301: 0.20100000000000001 | P301: 105.51 | Q301: 转股中 | R301: 2.37年 | S301: 0.37年 | T301: 2.98 | U301: 82 | V301: 0.217 | W301: 5.0999999999999997e-002 | X301: 5.4000000000000006e-002 | Y301: 58 | Z301: 2.43 | AA301: -6.3099999999999989e-002 | AB301: -6.9400000000000003e-002 | AC301: -0.38799999999999996 | AD301: -0.39200000000000002 | AE301: 99.52 | AF301: 99.64 | AG301: 0.59 | AH301: AA | AI301: 3.8399999999999997e-002 | AJ301: =H301+100*O301 -> 146.78800000000001 | AK301: 147.9 | AL301: 204 | AM301: 48.2 | AN301: 151 | AO301: -5.9999999999999998e-002 | AP301: 35 | AQ301: 迪龙转债!
A302: 351 | B302: 128026 | C302: 众兴转债! | D302: 2772 | E302: 众兴菌业 | F302: 农业 | G302: 种植业 | H302: 127.02 | I302: 7.9199999999999993e-002 | J302: -9.7000000000000003e-003 | K302: 12.53 | L302: 0.10000000000000001 | M302: 109.3 | N302: 11.36 | O302: 0.152 | P302: 110.3 | Q302: 转股中 | R302: 2.33年 | S302: 0.33年 | T302: 4.09 | U302: 876 | V302: 1.72 | W302: 8.0000000000000002e-002 | X302: 8.900000000000001e-002 | Y302: 51 | Z302: 1.69 | AA302: -6.3399999999999998e-002 | AB302: -7.0199999999999999e-002 | AC302: -0.41999999999999998 | AD302: -0.42499999999999999 | AE302: 98.91 | AF302: 95.78 | AG302: 0.69 | AH302: AA- | AI302: 5.9400000000000001e-002 | AJ302: =H302+100*O302 -> 142.22 | AK302: 143.7 | AL302: 178 | AM302: 44.8 | AN302: 129 | AO302: -6.0000000000000001e-003 | AP302: 57 | AQ302: 众兴转债!
A303: 116 | B303: 123069 | C303: 金诺转债!! | D303: 300505 | E303: 川金诺 | F303: 化工 | G303: 农化 | H303: 176 | I303: 1.15e-002 | J303: -2.3599999999999999e-002 | K303: 32.9 | L303: -1.3500000000000002e-002 | M303: 126 | N303: 19.09 | O303: 2.1000000000000001e-002 | P303: 172.34 | Q303: 转股中 | R303: 5.17年 | S303: 3.18年 | T303: 2.54 | U303: 1915. | V303: 4.2199999999999998 | W303: 5.9000000000000004e-002 | X303: 0.10199999999999999 | Y303: 43 | Z303: 4.54 | AA303: -6.3700000000000007e-002 | AB303: -7.1199999999999999e-002 | AC303: -0.14300000000000002 | AD303: -0.14400000000000002 | AE303: 85.14 | AF303: 92.83 | AG303: 0.9 | AH303: AA- | AI303: 6.2199999999999998e-002 | AJ303: =H303+100*O303 -> 178.09999999999999 | AK303: 179.7 | AL303: 312 | AM303: 86.8 | AN303: 309 | AO303: 0.10800000000000001 | AP303: 18 | AQ303: 金诺转债!!
A304: 19 | B304: 123114 | C304: 三角转债 | D304: 300775 | E304: 三角防务 | F304: 航空航天 | G304: 航空航天 | H304: 176.6 | I304: 4.0000000000000002e-004 | J304: 8.0000000000000002e-003 | K304: 45.4 | L304: 1.e-002 | M304: 121 | N304: 31.82 | O304: 0.23800000000000002 | P304: 142.68 | Q304: 3月19天 | R304: 5.78年 | S304: 3.78年 | T304: 9.04 | U304: 191 | V304: 0.11800000000000001 | W304: 4.0000000000000001e-002 | X304: 5.7000000000000002e-002 | Y304: 225 | Z304: 10.97 | AA304: -6.4399999999999999e-002 | AB304: -7.0000000000000007e-002 | AC304: -0.121 | AD304: -0.122 | AE304: 82.09 | AF304: 85.97 | AG304: 0.84 | AH304: AA- | AI304: 6.2199999999999998e-002 | AJ304: =H304+100*O304 -> 200.40000000000001 | AK304: 210.5 | AL304: 336 | AM304: 124.6 | AN304: 340 | AO304: 8.1000000000000003e-002 | AP304: 4 | AQ304: 三角转债
A305: 289 | B305: 123025 | C305: 精测转债!! | D305: 300567 | E305: 精测电子 | F305: 电子 | G305: 液晶显示 | H305: 149.276 | I305: -1.5700000000000002e-002 | J305: 1.11e-002 | K305: 67.63 | L305: -5.4000000000000003e-003 | M305: 116.5 | N305: 49.37 | O305: 8.9999999999999997e-002 | P305: 136.99 | Q305: 转股中 | R305: 3.62年 | S305: 1.62年 | T305: 3.09 | U305: 152 | V305: 0.32100000000000001 | W305: 1.6e-002 | X305: 2.2000000000000002e-002 | Y305: 188 | Z305: 9.47 | AA305: -6.7299999999999999e-002 | AB305: -7.4499999999999997e-002 | AC305: -0.158 | AD305: -0.16 | AE305: 92.58 | AF305: 94.44 | AG305: 0.83 | AH305: AA- | AI305: 6.0899999999999996e-002 | AJ305: =H305+100*O305 -> 158.27600000000001 | AK305: 161.6 | AL305: 277 | AM305: 67.1 | AN305: 268 | AO305: -2.7999999999999997e-002 | AP305: 17 | AQ305: 精测转债!!
A306: 284 | B306: 128064 | C306: 司尔转债!!* | D306: 2538 | E306: 司尔特 | F306: 化工 | G306: 农化 | H306: 148.01 | I306: 0.113 | J306: -1.2199999999999999e-002 | K306: 8.53 | L306: 0.10099999999999999 | M306: 114.3 | N306: 5.82 | O306: 1.e-002 | P306: 146.56 | Q306: 转股中 | R306: 3.65年 | S306: 1.65年 | T306: 2.55 | U306: 1306. | V306: 3.48 | W306: 3.7999999999999999e-002 | X306: 5.5e-002 | Y306: 68 | Z306: 1.53 | AA306: -6.9500000000000006e-002 | AB306: -7.5800000000000006e-002 | AC306: -0.152 | AD306: -0.154 | AE306: 95.79 | AF306: 99.36 | AG306: 1 | AH306: AA | AI306: 3.9900000000000005e-002 | AJ306: =H306+100*O306 -> 149.00999999999999 | AK306: 149.5 | AL306: 217 | AM306: 50.1 | AN306: 169 | AO306: 9.8000000000000004e-002 | AP306: 42 | AQ306: 司尔转债!!*
A307: 46 | B307: 123102 | C307: 华自转债 | D307: 300490 | E307: 华自科技 | F307: 机械装备 | G307: 机器人及 | H307: 190.21 | I307: 5.0499999999999996e-002 | J307: 3.1800000000000002e-002 | K307: 21.05 | L307: 8.6699999999999999e-002 | M307: 126.9 | N307: 9.25 | O307: -0.16399999999999998 | P307: 227.57 | Q307: 36天 | R307: 5.58年 | S307: 3.58年 | T307: 6.7 | U307: 4866. | V307: 3.6899999999999999 | W307: 0.124 | X307: 0.28199999999999997 | Y307: 54 | Z307: 3.08 | AA307: -7.1399999999999991e-002 | AB307: -7.85e-002 | AC307: -0.14099999999999999 | AD307: -0.14300000000000002 | AE307: 83.97 | AF307: 91.38 | AG307: 0.95 | AH307: AA- | AI307: 6.2199999999999998e-002 | AJ307: =H307+100*O307 -> 173.81 | AK307: 152.9 | AL307: 240 | AM307: 61.5 | AN307: 239 | AO307: 9.8000000000000004e-002 | AP307: 22 | AQ307: 华自转债
A308: 12 | B308: 127038 | C308: 国微转债 | D308: 2049 | E308: 紫光国微 | F308: 电子 | G308: 芯片制造 | H308: 179.208 | I308: -1.9299999999999998e-002 | J308: 7.6e-003 | K308: 191.84 | L308: -1.4199999999999999e-002 | M308: 114.5 | N308: 137.78 | O308: 0.28699999999999998 | P308: 139.24 | Q308: 4月6天 | R308: 5.82年 | S308: 3.82年 | T308: 15 | U308: 208 | V308: 7.6999999999999999e-002 | W308: 1.3000000000000001e-002 | X308: 1.8000000000000002e-002 | Y308: 1164. | Z308: 22.02 | AA308: -7.4900000000000008e-002 | AB308: -7.8899999999999998e-002 | AC308: -0.124 | AD308: -0.125 | AE308: 89.45 | AF308: 93.36 | AG308: 0.83 | AH308: AA+ | AI308: 3.6200000000000003e-002 | AJ308: =H308+100*O308 -> 207.90799999999999 | AK308: 219.2 | AL308: 343 | AM308: 125.8 | AN308: 343 | AO308: 4.4999999999999998e-002 | AP308: 4 | AQ308: 国微转债
A309: 242 | B309: 128082 | C309: 华锋转债!! | D309: 2806 | E309: 华锋股份 | F309: 电子 | G309: 元器件制 | H309: 168.899 | I309: 1.26e-002 | J309: -2.6099999999999998e-002 | K309: 14.6 | L309: -1.3500000000000002e-002 | M309: 121.4 | N309: 9.13 | O309: 5.5999999999999994e-002 | P309: 159.91 | Q309: 转股中 | R309: 4.31年 | S309: 2.31年 | T309: 2.19 | U309: 316 | V309: 0.83499999999999996 | W309: 7.9000000000000001e-002 | X309: 0.126 | Y309: 28 | Z309: 2.65 | AA309: -7.5499999999999998e-002 | AB309: -8.3000000000000004e-002 | AC309: -0.128 | AD309: -0.13 | AE309: 86.23 | AF309: 87.32 | AG309: 1 | AH309: A | AI309: 8.1900000000000001e-002 | AJ309: =H309+100*O309 -> 174.499 | AK309: 177.9 | AL309: 307 | AM309: 90.6 | AN309: 315 | AO309: 9.0999999999999998e-002 | AP309: 54 | AQ309: 华锋转债!!
A310: 212 | B310: 113572 | C310: 三祥转债! | D310: 603663 | E310: 三祥新材 | F310: 其他 | G310: 其他 | H310: 160.67 | I310: -8.9999999999999998e-004 | J310: 3.7000000000000005e-002 | K310: 22.36 | L310: 3.95e-002 | M310: 112.8 | N310: 14.09 | O310: 1.2e-002 | P310: 158.69 | Q310: 转股中 | R310: 4.58年 | S310: 2.58年 | T310: 1.69 | U310: 611 | V310: 2.2000000000000002 | W310: 3.9e-002 | X310: 6.2e-002 | Y310: 43 | Z310: 6.72 | AA310: -7.5600000000000001e-002 | AB310: -8.0100000000000005e-002 | AC310: -0.10300000000000001 | AD310: -0.10400000000000001 | AE310: 85.52 | AF310: 82.63 | AG310: 0.91 | AH310: A+ | AI310: 7.1900000000000006e-002 | AJ310: =H310+100*O310 -> 161.86999999999998 | AK310: 162.6 | AL310: 280 | AM310: 77.1 | AN310: 298 | AO310: 0.27200000000000002 | AP310: 21 | AQ310: 三祥转债!
A311: 134 | B311: 128128 | C311: 齐翔转2! | D311: 2408 | E311: 齐翔腾达 | F311: 化工 | G311: 化工 | H311: 171.211 | I311: 3.0899999999999997e-002 | J311: -1.11e-002 | K311: 13.11 | L311: 2.18e-002 | M311: 115.3 | N311: 7.97 | O311: 4.0999999999999995e-002 | P311: 164.49 | Q311: 转股中 | R311: 5年6.1天 | S311: 3年7天 | T311: 8.74 | U311: 69 | V311: 4.7e-002 | W311: 3.3000000000000002e-002 | X311: 5.5e-002 | Y311: 262 | Z311: 2.4 | AA311: -7.7100000000000002e-002 | AB311: -8.1900000000000001e-002 | AC311: -0.14300000000000002 | AD311: -0.14499999999999999 | AE311: 91.33 | AF311: 94.56 | AG311: 0.91 | AH311: AA | AI311: 4.1200000000000001e-002 | AJ311: =H311+100*O311 -> 175.31100000000001 | AK311: 177.9 | AL311: 308 | AM311: 83.4 | AN311: 303 | AO311: 3.6000000000000004e-002 | AP311: 31 | AQ311: 齐翔转2!
A312: 306 | B312: 113527 | C312: 维格转债!! | D312: 603518 | E312: 锦泓集团 | F312: 服装纺织 | G312: 服装行业 | H312: 157.26 | I312: -1.67e-002 | J312: -8.6999999999999994e-003 | K312: 14.24 | L312: -3.0600000000000002e-002 | M312: 119.5 | N312: 9.85 | O312: 8.8000000000000009e-002 | P312: 144.57 | Q312: 转股中 | R312: 3.45年 | S312: 1.45年 | T312: 2.87 | U312: 124 | V312: 0.27300000000000002 | W312: 7.0999999999999994e-002 | X312: 0.10199999999999999 | Y312: 41 | Z312: 1.88 | AA312: -7.7800000000000008e-002 | AB312: -8.6500000000000007e-002 | AC312: -0.20000000000000001 | AD312: -0.20199999999999999 | AE312: 95.12 | AF312: 101.36 | AG312: 0.83 | AH312: AA | AI312: 4.99e-002 | AJ312: =H312+100*O312 -> 166.06 | AK312: 170 | AL312: 296 | AM312: 68.6 | AN312: 272 | AO312: -0.10000000000000001 | AP312: 82 | AQ312: 维格转债!!
A313: 68 | B313: 113615 | C313: 金诚转债! | D313: 603979 | E313: 金诚信 | F313: 有色金属 | G313: 有色行业 | H313: 182.12 | I313: 4.5599999999999995e-002 | J313: 9.3999999999999986e-003 | K313: 21.19 | L313: 5.9999999999999998e-002 | M313: 117.3 | N313: 12.65 | O313: 8.6999999999999994e-002 | P313: 167.51 | Q313: 转股中 | R313: 5.36年 | S313: 3.36年 | T313: 8.98 | U313: 166 | V313: 0.10300000000000001 | W313: 7.2000000000000008e-002 | X313: 0.12 | Y313: 125 | Z313: 2.66 | AA313: -8.0100000000000005e-002 | AB313: -8.5099999999999995e-002 | AC313: -0.14300000000000002 | AD313: -0.14499999999999999 | AE313: 90.16 | AF313: 94.89 | AG313: 0.92 | AH313: AA | AI313: 4.1200000000000001e-002 | AJ313: =H313+100*O313 -> 190.81999999999999 | AK313: 196.7 | AL313: 329 | AM313: 101.8 | AN313: 326 | AO313: 3.7000000000000005e-002 | AP313: 3 | AQ313: 金诚转债!
A314: 113 | B314: 123070 | C314: 鹏辉转债! | D314: 300438 | E314: 鹏辉能源 | F314: 汽车 | G314: 零部件制 | H314: 178 | I314: 1.1399999999999999e-002 | J314: 1.21e-002 | K314: 35.67 | L314: 2.5000000000000001e-002 | M314: 115.1 | N314: 20.06 | O314: 1.e-003 | P314: 177.82 | Q314: 转股中 | R314: 5.18年 | S314: 3.19年 | T314: 7.49 | U314: 1190. | V314: 0.88 | W314: 5.0000000000000003e-002 | X314: 8.900000000000001e-002 | Y314: 150 | Z314: 6.33 | AA314: -8.199999999999999e-002 | AB314: -8.6500000000000007e-002 | AC314: -0.14599999999999999 | AD314: -0.14699999999999999 | AE314: 90.6 | AF314: 93.75 | AG314: 0.94 | AH314: AA | AI314: 4.1200000000000001e-002 | AJ314: =H314+100*O314 -> 178.09999999999999 | AK314: 178.2 | AL314: 309 | AM314: 84.4 | AN314: 304 | AO314: 0.13 | AP314: 7 | AQ314: 鹏辉转债!
A315: 28 | B315: 113047 | C315: 旗滨转债 | D315: 601636 | E315: 旗滨集团 | F315: 建筑 | G315: 玻璃 | H315: 187.34 | I315: 7.9000000000000008e-003 | J315: -3.1200000000000002e-002 | K315: 20.5 | L315: -2.6099999999999998e-002 | M315: 114 | N315: 12.8 | O315: 0.17000000000000001 | P315: 160.16 | Q315: 2月3天 | R315: 5.65年 | S315: 3.65年 | T315: 15 | U315: 177 | V315: 6.3e-002 | W315: 2.7000000000000003e-002 | X315: 4.4000000000000004e-002 | Y315: 551 | Z315: 5.3 | AA315: -8.5000000000000006e-002 | AB315: -8.8900000000000007e-002 | AC315: -0.14000000000000001 | AD315: -0.14099999999999999 | AE315: 89.55 | AF315: 93.48 | AG315: 0.89 | AH315: AA+ | AI315: 3.6200000000000003e-002 | AJ315: =H315+100*O315 -> 204.34 | AK315: 214.5 | AL315: 337 | AM315: 121 | AN315: 338 | AO315: -1.7000000000000001e-002 | AP315: 6 | AQ315: 旗滨转债
A316: 47 | B316: 123103 | C316: 震安转债 | D316: 300767 | E316: 震安科技 | F316: 化工 | G316: 橡胶塑料 | H316: 197.6 | I316: -5.0000000000000001e-003 | J316: 5.2400000000000002e-002 | K316: 106.88 | L316: 5.0900000000000001e-002 | M316: 121.4 | N316: 56.89 | O316: 5.2000000000000005e-002 | P316: 187.87 | Q316: 38天 | R316: 5.58年 | S316: 3.58年 | T316: 2.85 | U316: 816 | V316: 1.4399999999999999 | W316: 1.3000000000000001e-002 | X316: 2.5000000000000001e-002 | Y316: 215 | Z316: 13.51 | AA316: -8.5199999999999998e-002 | AB316: -9.0899999999999995e-002 | AC316: -0.14999999999999999 | AD316: -0.152 | AE316: 80.53 | AF316: 82.64 | AG316: 0.93 | AH316: A+ | AI316: 7.3200000000000001e-002 | AJ316: =H316+100*O316 -> 202.79999999999998 | AK316: 207.3 | AL316: 334 | AM316: 124.7 | AN316: 341 | AO316: 0.22600000000000001 | AP316: 5 | AQ316: 震安转债
A317: 209 | B317: 128101 | C317: 联创转债! | D317: 2036 | E317: 联创电子 | F317: 电子 | G317: 液晶显示 | H317: 171.8 | I317: 7.4999999999999997e-003 | J317: -6.1999999999999998e-003 | K317: 19.3 | L317: 1.6000000000000001e-003 | M317: 114.8 | N317: 13.72 | O317: 0.221 | P317: 140.67 | Q317: 转股中 | R317: 4.59年 | S317: 2.59年 | T317: 3 | U317: 591 | V317: 1.1299999999999999 | W317: 1.4999999999999999e-002 | X317: 2.1000000000000001e-002 | Y317: 205 | Z317: 5.57 | AA317: -8.5500000000000007e-002 | AB317: -9.0500000000000011e-002 | AC317: -0.115 | AD317: -0.11599999999999999 | AE317: 92.83 | AF317: 96.27 | AG317: 0.84 | AH317: AA | AI317: 3.9900000000000005e-002 | AJ317: =H317+100*O317 -> 193.90000000000001 | AK317: 202.9 | AL317: 330 | AM317: 106.7 | AN317: 331 | AO317: 5.5999999999999994e-002 | AP317: 15 | AQ317: 联创转债!
A318: 58 | B318: 113621 | C318: 彤程转债 | D318: 603650 | E318: 彤程新材 | F318: 化工 | G318: 橡胶塑料 | H318: 188.57 | I318: -4.4500000000000005e-002 | J318: 5.9999999999999995e-004 | K318: 60.12 | L318: -4.6500000000000007e-002 | M318: 115.1 | N318: 32.62 | O318: 2.3e-002 | P318: 184.3 | Q318: 转股中 | R318: 5.45年 | S318: 3.45年 | T318: 5.64 | U318: 326 | V318: 0.29899999999999999 | W318: 1.6e-002 | X318: 2.9999999999999999e-002 | Y318: 352 | Z318: 13.67 | AA318: -8.7899999999999992e-002 | AB318: -9.2100000000000015e-002 | AC318: -0.14699999999999999 | AD318: -0.14800000000000002 | AE318: 89.63 | AF318: 92.74 | AG318: 0.95 | AH318: AA | AI318: 4.1200000000000001e-002 | AJ318: =H318+100*O318 -> 190.87 | AK318: 192.8 | AL318: 324 | AM318: 100.1 | AN318: 325 | AO318: -4.2999999999999997e-002 | AP318: 7 | AQ318: 彤程转债
A319: 362 | B319: 113014 | C319: 林洋转债! | D319: 601222 | E319: 林洋能源 | F319: 能源电力 | G319: 电力设备 | H319: 133.64 | I319: -2.81e-002 | J319: -8.199999999999999e-003 | K319: 11.13 | L319: -4.2199999999999994e-002 | M319: 109.3 | N319: 8.44 | O319: 1.3000000000000001e-002 | P319: 131.87 | Q319: 转股中 | R319: 2.21年 | S319: 0.21年 | T319: 25.3 | U319: 376 | V319: 0.11 | W319: 0.127 | X319: 0.16699999999999998 | Y319: 200 | Z319: 1.87 | AA319: -8.8699999999999987e-002 | AB319: -9.5600000000000004e-002 | AC319: -0.68599999999999994 | AD319: -0.69299999999999995 | AE319: 100.39 | AF319: 100.75 | AG319: 0.86 | AH319: AA | AI319: 3.8399999999999997e-002 | AJ319: =H319+100*O319 -> 134.94 | AK319: 135.4 | AL319: 89 | AM319: 34.7 | AN319: 45 | AO319: 6.5000000000000002e-002 | AP319: 32 | AQ319: 林洋转债!
A320: 124 | B320: 123066 | C320: 赛意转债!* | D320: 300687 | E320: 赛意信息 | F320: 计算机及 | G320: 软件开发 | H320: 193.08 | I320: -5.9999999999999998e-002 | J320: 1.9699999999999999e-002 | K320: 27.67 | L320: -4.0199999999999993e-002 | M320: 121.4 | N320: 14.01 | O320: -2.2000000000000002e-002 | P320: 197.5 | Q320: 转股中 | R320: 5年33天 | S320: 3年34天 | T320: 0.36 | U320: 262 | V320: 3.6600000000000001 | W320: 4.0000000000000001e-003 | X320: 6.9999999999999993e-003 | Y320: 101 | Z320: 6.11 | AA320: -8.8800000000000004e-002 | AB320: -9.5000000000000001e-002 | AC320: -0.10400000000000001 | AD320: -0.105 | AE320: 83.11 | AF320: 85.48 | AG320: 1 | AH320: A+ | AI320: 7.3200000000000001e-002 | AJ320: =H320+100*O320 -> 190.88000000000002 | AK320: 188.7 | AL320: 319 | AM320: 103.2 | AN320: 327 | AO320: 0.13200000000000001 | AP320: 8 | AQ320: 赛意转债!*
A321: 295 | B321: 123022 | C321: 长信转债!! | D321: 300088 | E321: 长信科技 | F321: 通信互联 | G321: 通信设备 | H321: 158.846 | I321: -2.7900000000000001e-002 | J321: 1.0200000000000001e-002 | K321: 8.62 | L321: -2.0499999999999997e-002 | M321: 114.3 | N321: 6.05 | O321: 0.115 | P321: 142.48 | Q321: 转股中 | R321: 3.59年 | S321: 1.59年 | T321: 2.57 | U321: 25 | V321: 5.9999999999999998e-002 | W321: 1.2e-002 | X321: 1.7000000000000001e-002 | Y321: 212 | Z321: 2.93 | AA321: -8.900000000000001e-002 | AB321: -9.5199999999999993e-002 | AC321: -0.184 | AD321: -0.185 | AE321: 96.01 | AF321: 99.58 | AG321: 0.87 | AH321: AA | AI321: 3.9900000000000005e-002 | AJ321: =H321+100*O321 -> 170.346 | AK321: 175.2 | AL321: 301 | AM321: 75.6 | AN321: 294 | AO321: -5.0000000000000001e-003 | AP321: 12 | AQ321: 长信转债!!
A322: 223 | B322: 128097 | C322: 奥佳转债! | D322: 2614 | E322: 奥佳华 | F322: 机械装备 | G322: 专用设备 | H322: 175.2 | I322: -2.5600000000000001e-002 | J322: 2.23e-002 | K322: 16.2 | L322: -3.7000000000000002e-003 | M322: 114.9 | N322: 10.39 | O322: 0.124 | P322: 155.92 | Q322: 转股中 | R322: 4.53年 | S322: 2.54年 | T322: 4.6 | U322: 45 | V322: 5.5999999999999994e-002 | W322: 4.4999999999999998e-002 | X322: 7.0000000000000007e-002 | Y322: 102 | Z322: 2.21 | AA322: -9.0299999999999991e-002 | AB322: -9.5299999999999996e-002 | AC322: -0.122 | AD322: -0.12300000000000001 | AE322: 93.12 | AF322: 96.56 | AG322: 0.89 | AH322: AA | AI322: 3.9900000000000005e-002 | AJ322: =H322+100*O322 -> 187.59999999999999 | AK322: 194.5 | AL322: 327 | AM322: 97.9 | AN322: 324 | AO322: -3.9e-002 | AP322: 20 | AQ322: 奥佳转债!
A323: 175 | B323: 128113 | C323: 比音转债! | D323: 2832 | E323: 比音勒芬 | F323: 服装纺织 | G323: 服装行业 | H323: 183.5 | I323: -4.2300000000000004e-002 | J323: 2.0899999999999998e-002 | K323: 26.14 | L323: -2.2799999999999997e-002 | M323: 116.9 | N323: 14.6 | O323: 2.5000000000000001e-002 | P323: 179.04 | Q323: 转股中 | R323: 4.84年 | S323: 2.84年 | T323: 3.03 | U323: 56 | V323: 9.9000000000000005e-002 | W323: 2.1000000000000001e-002 | X323: 3.7999999999999999e-002 | Y323: 144 | Z323: 5.4 | AA323: -9.0399999999999994e-002 | AB323: -9.5700000000000007e-002 | AC323: -0.111 | AD323: -0.11199999999999999 | AE323: 92.02 | AF323: 97.09 | AG323: 0.94 | AH323: AA | AI323: 3.9900000000000005e-002 | AJ323: =H323+100*O323 -> 186. | AK323: 188 | AL323: 318 | AM323: 90.9 | AN323: 316 | AO323: 4.0999999999999995e-002 | AP323: 9 | AQ323: 比音转债!
A324: 205 | B324: 128103 | C324: 同德转债! | D324: 2360 | E324: 同德化工 | F324: 化工 | G324: 化工 | H324: 192 | I324: -8.0000000000000004e-004 | J324: -1.1699999999999999e-002 | K324: 9.66 | L324: -1.3300000000000001e-002 | M324: 121.3 | N324: 5.08 | O324: 1.e-002 | P324: 190.16 | Q324: 转股中 | R324: 4.61年 | S324: 2.62年 | T324: 1.09 | U324: 243 | V324: 1.1599999999999999 | W324: 2.7999999999999997e-002 | X324: 5.4000000000000006e-002 | Y324: 38 | Z324: 2.94 | AA324: -9.6500000000000002e-002 | AB324: -0.10300000000000001 | AC324: -0.13100000000000001 | AD324: -0.13200000000000001 | AE324: 86.08 | AF324: 88.72 | AG324: 0.94 | AH324: A+ | AI324: 7.1900000000000006e-002 | AJ324: =H324+100*O324 -> 193. | AK324: 193.8 | AL324: 326 | AM324: 105.1 | AN324: 329 | AO324: 0.126 | AP324: 16 | AQ324: 同德转债!
A325: 13 | B325: 113049 | C325: 长汽转债 | D325: 601633 | E325: 长城汽车 | F325: 汽车 | G325: 乘用车 | H325: 201.2 | I325: -2.3e-003 | J325: -2.9500000000000002e-002 | K325: 58.45 | L325: -3.61e-002 | M325: 110.5 | N325: 38.39 | O325: 0.32100000000000001 | P325: 152.25 | Q325: 4月6天 | R325: 5.82年 | S325: 3.82年 | T325: 35 | U325: 208 | V325: 2.9999999999999999e-002 | W325: 6.9999999999999993e-003 | X325: 1.e-002 | Y325: 5379. | Z325: 9.49 | AA325: -9.8699999999999996e-002 | AB325: -0.10199999999999999 | AC325: -0.14800000000000002 | AD325: -0.14800000000000002 | AE325: 89.47 | AF325: 91.06 | AG325: 0.88 | AH325: AAA | AI325: 3.4200000000000001e-002 | AJ325: =H325+100*O325 -> 233.29999999999998 | AK325: 250.1 | AL325: 346 | AM325: 159.1 | AN325: 349 | AO325: 5.0999999999999997e-002 | AP325: 4 | AQ325: 长汽转债
A326: 359 | B326: 128018 | C326: 时达转债! | D326: 2527 | E326: 新时达 | F326: 机械装备 | G326: 机器人及 | H326: 138 | I326: -6.9999999999999993e-003 | J326: 1.24e-002 | K326: 9.43 | L326: 6.4000000000000003e-003 | M326: 109.3 | N326: 7.36 | O326: 7.6999999999999999e-002 | P326: 128.12 | Q326: 转股中 | R326: 2.23年 | S326: 0.23年 | T326: 4.04 | U326: 6.3 | V326: 1.1000000000000001e-002 | W326: 6.9000000000000006e-002 | X326: 8.8000000000000009e-002 | Y326: 59 | Z326: 2.23 | AA326: -0.10099999999999999 | AB326: -0.10800000000000001 | AC326: -0.70099999999999996 | AD326: -0.70700000000000007 | AE326: 100.29 | AF326: 100.65 | AG326: 0.84 | AH326: AA | AI326: 3.8399999999999997e-002 | AJ326: =H326+100*O326 -> 145.69999999999999 | AK326: 147.9 | AL326: 205 | AM326: 47.2 | AN326: 145 | AO326: 7.2000000000000008e-002 | AP326: 34 | AQ326: 时达转债!
A327: 41 | B327: 127030 | C327: 盛虹转债 | D327: 301 | E327: 东方盛虹 | F327: 化工 | G327: 化纤 | H327: 202.5 | I327: 5.3499999999999999e-002 | J327: -1.5900000000000001e-002 | K327: 26.39 | L327: 3.9800000000000002e-002 | M327: 112.5 | N327: 14.1 | O327: 8.199999999999999e-002 | P327: 187.16 | Q327: 45天 | R327: 5.60年 | S327: 3.61年 | T327: 50 | U327: 380 | V327: 3.7999999999999999e-002 | W327: 3.9e-002 | X327: 7.2999999999999995e-002 | Y327: 1276. | Z327: 7.03 | AA327: -0.10099999999999999 | AB327: -0.10400000000000001 | AC327: -0.156 | AD327: -0.157 | AE327: 90.14 | AF327: 92.45 | AG327: 0.95 | AH327: AA+ | AI327: 3.6200000000000003e-002 | AJ327: =H327+100*O327 -> 210.69999999999999 | AK327: 217.8 | AL327: 341 | AM327: 125.4 | AN327: 342 | AO327: 4.0999999999999995e-002 | AP327: 4 | AQ327: 盛虹转债
A328: 312 | B328: 128050 | C328: 钧达转债!! | D328: 2865 | E328: 钧达股份 | F328: 汽车 | G328: 零部件制 | H328: 175 | I328: -1.55e-002 | J328: -6.0000000000000001e-003 | K328: 25.41 | L328: -2.1600000000000001e-002 | M328: 122.7 | N328: 14.8 | O328: 1.9e-002 | P328: 171.69 | Q328: 转股中 | R328: 3.32年 | S328: 1.33年 | T328: 1.39 | U328: 94 | V328: 0.38600000000000001 | W328: 4.0999999999999995e-002 | X328: 7.0999999999999994e-002 | Y328: 34 | Z328: 3.14 | AA328: -0.10300000000000001 | AB328: -0.113 | AC328: -0.26200000000000001 | AD328: -0.26400000000000001 | AE328: 94.42 | AF328: 101.24 | AG328: 1 | AH328: AA- | AI328: 6.0899999999999996e-002 | AJ328: =H328+100*O328 -> 176.90000000000001 | AK328: 178.3 | AL328: 310 | AM328: 77.1 | AN328: 297 | AO328: -4.4999999999999998e-002 | AP328: 51 | AQ328: 钧达转债!!
A329: 91 | B329: 123079 | C329: 运达转债!* | D329: 300772 | E329: 运达股份 | F329: 能源电力 | G329: 风能 | H329: 208 | I329: 2.3199999999999998e-002 | J329: -2.8000000000000004e-003 | K329: 31.55 | L329: 2.0400000000000001e-002 | M329: 115.1 | N329: 15.12 | O329: -3.0000000000000001e-003 | P329: 208.66 | Q329: 转股中 | R329: 5.30年 | S329: 3.30年 | T329: 1.77 | U329: 616 | V329: 1.6799999999999999 | W329: 1.7000000000000001e-002 | X329: 3.6000000000000004e-002 | Y329: 103 | Z329: 5.49 | AA329: -0.107 | AB329: -0.111 | AC329: -0.10400000000000001 | AD329: -0.105 | AE329: 90.18 | AF329: 93.31 | AG329: 1 | AH329: AA | AI329: 4.1200000000000001e-002 | AJ329: =H329+100*O329 -> 207.69999999999999 | AK329: 207.3 | AL329: 335 | AM329: 114 | AN329: 334 | AO329: 0.113 | AP329: 4 | AQ329: 运达转债!*
A330: 259 | B330: 113545 | C330: 金能转债! | D330: 603113 | E330: 金能科技 | F330: 煤炭 | G330: 炼焦 | H330: 192.16 | I330: 4.1299999999999996e-002 | J330: -2.5999999999999999e-003 | K330: 18.74 | L330: 4.1100000000000005e-002 | M330: 114.9 | N330: 10.43 | O330: 6.9000000000000006e-002 | P330: 179.67 | Q330: 转股中 | R330: 4.17年 | S330: 2.17年 | T330: 10.2 | U330: 208 | V330: 0.105 | W330: 6.4000000000000001e-002 | X330: 0.115 | Y330: 160 | Z330: 1.92 | AA330: -0.11800000000000001 | AB330: -0.12300000000000001 | AC330: -0.16899999999999998 | AD330: -0.17000000000000001 | AE330: 94.47 | AF330: 97.96 | AG330: 0.94 | AH330: AA | AI330: 3.9900000000000005e-002 | AJ330: =H330+100*O330 -> 199.06 | AK330: 204.6 | AL330: 331 | AM330: 106.7 | AN330: 332 | AO330: 0.107 | AP330: 16 | AQ330: 金能转债!
A331: 302 | B331: 113528 | C331: 长城转债! | D331: 603897 | E331: 长城科技 | F331: 机械装备 | G331: 专用设备 | H331: 181.21 | I331: -4.5000000000000005e-003 | J331: -2.7000000000000003e-002 | K331: 40.5 | L331: -3.3599999999999998e-002 | M331: 116.8 | N331: 23.35 | O331: 4.4999999999999998e-002 | P331: 173.45 | Q331: 转股中 | R331: 3.55年 | S331: 1.55年 | T331: 5.63 | U331: 292 | V331: 0.28699999999999998 | W331: 7.8e-002 | X331: 0.13500000000000001 | Y331: 72 | Z331: 3.69 | AA331: -0.11900000000000001 | AB331: -0.125 | AC331: -0.23300000000000001 | AD331: -0.23399999999999999 | AE331: 93.28 | AF331: 95.15 | AG331: 0.94 | AH331: AA- | AI331: 6.0899999999999996e-002 | AJ331: =H331+100*O331 -> 185.71000000000001 | AK331: 189 | AL331: 321 | AM331: 93.8 | AN331: 321 | AO331: 0.27100000000000002 | AP331: 38 | AQ331: 长城转债!
A332: 296 | B332: 110055 | C332: 伊力转债!! | D332: 600197 | E332: 伊力特 | F332: 食品饮料 | G332: 白酒 | H332: 178.86 | I332: 5.8999999999999999e-003 | J332: -6.3e-003 | K332: 24.74 | L332: -4.0000000000000002e-004 | M332: 114.3 | N332: 16.41 | O332: 0.18600000000000003 | P332: 150.76 | Q332: 转股中 | R332: 3.58年 | S332: 1.59年 | T332: 2.44 | U332: 525 | V332: 1.2 | W332: 2.1000000000000001e-002 | X332: 3.1e-002 | Y332: 117 | Z332: 3.25 | AA332: -0.11900000000000001 | AB332: -0.125 | AC332: -0.223 | AD332: -0.22500000000000001 | AE332: 96.04 | AF332: 99.61 | AG332: 0.9 | AH332: AA | AI332: 3.9900000000000005e-002 | AJ332: =H332+100*O332 -> 197.46000000000001 | AK332: 207 | AL332: 333 | AM332: 107.3 | AN332: 333 | AO332: -4.0999999999999995e-002 | AP332: 22 | AQ332: 伊力转债!!
A333: 220 | B333: 110066 | C333: 盛屯转债!! | D333: 600711 | E333: 盛屯矿业 | F333: 有色金属 | G333: 有色行业 | H333: 204.7 | I333: 1.67e-002 | J333: -9.4999999999999998e-003 | K333: 9.38 | L333: 7.4999999999999997e-003 | M333: 114.9 | N333: 4.87 | O333: 6.3e-002 | P333: 192.61 | Q333: 转股中 | R333: 4.55年 | S333: 2.55年 | T333: 3.84 | U333: 705 | V333: 0.88900000000000001 | W333: 1.4999999999999999e-002 | X333: 2.8999999999999998e-002 | Y333: 252 | Z333: 2.24 | AA333: -0.121 | AB333: -0.126 | AC333: -0.14699999999999999 | AD333: -0.14800000000000002 | AE333: 93.06 | AF333: 96.51 | AG333: 0.95 | AH333: AA | AI333: 3.9900000000000005e-002 | AJ333: =H333+100*O333 -> 211. | AK333: 216.8 | AL333: 339 | AM333: 120.3 | AN333: 337 | AO333: 1.7000000000000001e-002 | AP333: 33 | AQ333: 盛屯转债!!
A334: 188 | B334: 113580 | C334: 康隆转债! | D334: 603665 | E334: 康隆达 | F334: 服装纺织 | G334: 服装行业 | H334: 225.74 | I334: -1.3600000000000001e-002 | J334: 1.21e-002 | K334: 11.68 | L334: -4.3e-003 | M334: 120.8 | N334: 15.51 | O334: 2. | P334: 75.31 | Q334: 转股中 | R334: 4.69年 | S334: 2.69年 | T334: 0.41 | U334: 46 | V334: 0.49200000000000005 | W334: 2.2000000000000002e-002 | X334: 1.7000000000000001e-002 | Y334: 18 | Z334: 1.7 | AA334: -0.127 | AB334: -0.13300000000000001 | AC334: -0.151 | AD334: -0.151 | AE334: 87.74 | AF334: 92.1 | AG334: 0.36 | AH334: AA- | AI334: 6.0899999999999996e-002 | AJ334: =H334+100*O334 -> 425.74000000000001 | AK334: 376.2 | AL334: 362 | AM334: 284.1 | AN334: 363 | AO334: -0.107 | AP334: 8 | AQ334: 康隆转债!
A335: 322 | B335: 123014 | C335: 凯发转债! | D335: 300407 | E335: 凯发电气 | F335: 能源电力 | G335: 电力设备 | H335: 140.65 | I335: -7.3000000000000001e-003 | J335: 1.04e-002 | K335: 8.51 | L335: 4.6999999999999993e-003 | M335: 107.5 | N335: 8.05 | O335: 0.33000000000000002 | P335: 105.71 | Q335: 转股中 | R335: 1.95年 | S335: 回售内 | T335: 1.16 | U335: 62 | V335: 0.37799999999999995 | W335: 4.4999999999999998e-002 | X335: 4.7e-002 | Y335: 26 | Z335: 1.9 | AA335: -0.129 | AB335: -0.13500000000000001 | AC335: 回售内 | AD335: 回售内 | AE335: 100.25 | AF335: 94.21 | AG335: 0.64 | AH335: A+ | AI335: 7.0400000000000004e-002 | AJ335: =H335+100*O335 -> 173.65000000000001 | AK335: 175.6 | AL335: 303 | AM335: 75.3 | AN335: 291 | AO335: 5.2999999999999999e-002 | AP335: 15 | AQ335: 凯发转债!
A336: 313 | B336: 110048 | C336: 福能转债!! | D336: 600483 | E336: 福能股份 | F336: 能源电力 | G336: 电力供应 | H336: 178.48 | I336: -8.0000000000000004e-004 | J336: -1.3500000000000002e-002 | K336: 12.84 | L336: -1.5300000000000001e-002 | M336: 113.3 | N336: 7.85 | O336: 9.0999999999999998e-002 | P336: 163.57 | Q336: 转股中 | R336: 3.32年 | S336: 1.32年 | T336: 19.5 | U336: 83 | V336: 2.4e-002 | W336: 8.1000000000000003e-002 | X336: 0.13300000000000001 | Y336: 240 | Z336: 1.45 | AA336: -0.13 | AB336: -0.13600000000000001 | AC336: -0.27200000000000002 | AD336: -0.27399999999999997 | AE336: 97.74 | AF336: 101.36 | AG336: 0.94 | AH336: AA+ | AI336: 3.49e-002 | AJ336: =H336+100*O336 -> 187.57999999999998 | AK336: 193.4 | AL336: 325 | AM336: 92 | AN336: 318 | AO336: 4.0999999999999995e-002 | AP336: 9 | AQ336: 福能转债!!
A337: 60 | B337: 123094 | C337: 星源转2!! | D337: 300568 | E337: 星源材质 | F337: 电子 | G337: 电子行业 | H337: 248.401 | I337: -2.3999999999999998e-003 | J337: -6.0999999999999995e-003 | K337: 47.8 | L337: -8.6999999999999994e-003 | M337: 117.3 | N337: 19.64 | O337: 2.1000000000000001e-002 | P337: 243.38 | Q337: 转股中 | R337: 5.44年 | S337: 3.44年 | T337: 6.5 | U337: 740 | V337: 0.44799999999999995 | W337: 1.8000000000000002e-002 | X337: 4.4999999999999998e-002 | Y337: 352 | Z337: 7.09 | AA337: -0.13100000000000001 | AB337: -0.13500000000000001 | AC337: -0.115 | AD337: -0.11599999999999999 | AE337: 89.88 | AF337: 94.6 | AG337: 0.97 | AH337: AA | AI337: 4.1200000000000001e-002 | AJ337: =H337+100*O337 -> 250.501 | AK337: 253.4 | AL337: 348 | AM337: 158.8 | AN337: 348 | AO337: 7.6999999999999999e-002 | AP337: 7 | AQ337: 星源转2!!
A338: 228 | B338: 123042 | C338: 银河转债! | D338: 300619 | E338: 金银河 | F338: 机械装备 | G338: 专用设备 | H338: 219.309 | I338: 0.16 | J338: 3.1300000000000001e-002 | K338: 50.5 | L338: 0.20000000000000001 | M338: 115.4 | N338: 24.38 | O338: 5.9000000000000004e-002 | P338: 207.14 | Q338: 转股中 | R338: 4.42年 | S338: 2.42年 | T338: 1.66 | U338: 6402. | V338: 18.300000000000001 | W338: 4.4000000000000004e-002 | X338: 9.0999999999999998e-002 | Y338: 38 | Z338: 7.73 | AA338: -0.13800000000000001 | AB338: -0.14199999999999999 | AC338: -0.16899999999999998 | AD338: -0.17000000000000001 | AE338: 86.87 | AF338: 85.54 | AG338: 0.96 | AH338: A+ | AI338: 7.1900000000000006e-002 | AJ338: =H338+100*O338 -> 225.209 | AK338: 231.5 | AL338: 344 | AM338: 144.6 | AN338: 344 | AO338: 0.628 | AP338: 22 | AQ338: 银河转债!
A339: 311 | B339: 128051 | C339: 光华转债!!* | D339: 2741 | E339: 光华科技 | F339: 电子 | G339: 元器件制 | H339: 195.5 | I339: 6.8400000000000002e-002 | J339: 1.1699999999999999e-002 | K339: 25.24 | L339: 8.0000000000000002e-002 | M339: 114.8 | N339: 12.72 | O339: -1.4999999999999999e-002 | P339: 198.43 | Q339: 转股中 | R339: 3.33年 | S339: 1.34年 | T339: 0.9 | U339: 1139. | V339: 6.46 | W339: 9.0000000000000011e-003 | X339: 1.9e-002 | Y339: 95 | Z339: 7.63 | AA339: -0.14999999999999999 | AB339: -0.156 | AC339: -0.29899999999999999 | AD339: -0.29999999999999999 | AE339: 94.44 | AF339: 94.69 | AG339: 1 | AH339: AA- | AI339: 6.0899999999999996e-002 | AJ339: =H339+100*O339 -> 194. | AK339: 192.6 | AL339: 323 | AM339: 97.9 | AN339: 323 | AO339: 0.19600000000000001 | AP339: 29 | AQ339: 光华转债!!*
A340: 274 | B340: 113537 | C340: 文灿转债!! | D340: 603348 | E340: 文灿股份 | F340: 汽车 | G340: 零部件制 | H340: 225.06 | I340: 1.4499999999999999e-002 | J340: -2.7799999999999998e-002 | K340: 38.82 | L340: -1.3999999999999999e-002 | M340: 120.7 | N340: 19.28 | O340: 0.11800000000000001 | P340: 201.35 | Q340: 转股中 | R340: 3.82年 | S340: 1.82年 | T340: 1.41 | U340: 710 | V340: 2.23 | W340: 1.3999999999999999e-002 | X340: 2.7999999999999997e-002 | Y340: 102 | Z340: 3.85 | AA340: -0.153 | AB340: -0.16 | AC340: -0.24299999999999999 | AD340: -0.24399999999999999 | AE340: 92.2 | AF340: 96.78 | AG340: 0.95 | AH340: AA- | AI340: 6.0899999999999996e-002 | AJ340: =H340+100*O340 -> 236.86000000000001 | AK340: 248.8 | AL340: 345 | AM340: 152 | AN340: 345 | AO340: 0.14400000000000002 | AP340: 26 | AQ340: 文灿转债!!
A341: 325 | B341: 123012 | C341: 万顺转债! | D341: 300057 | E341: 万顺新材 | F341: 有色金属 | G341: 铝金属 | H341: 177.6 | I341: -3.5900000000000001e-002 | J341: -2.75e-002 | K341: 9.17 | L341: -6.6199999999999995e-002 | M341: 109.3 | N341: 5.27 | O341: 2.1000000000000001e-002 | P341: 174 | Q341: 转股中 | R341: 2.93年 | S341: 0.93年 | T341: 1.28 | U341: 789 | V341: 3.46 | W341: 2.1000000000000001e-002 | X341: 3.6000000000000004e-002 | Y341: 62 | Z341: 1.74 | AA341: -0.154 | AB341: -0.159 | AC341: -0.38400000000000001 | AD341: -0.38600000000000001 | AE341: 95.55 | AF341: 92.52 | AG341: 0.96 | AH341: AA- | AI341: 5.9400000000000001e-002 | AJ341: =H341+100*O341 -> 179.69999999999999 | AK341: 181.2 | AL341: 314 | AM341: 85.6 | AN341: 306 | AO341: 0.251 | AP341: 24 | AQ341: 万顺转债!
A342: 199 | B342: 113034 | C342: 滨化转债! | D342: 601678 | E342: 滨化股份 | F342: 化工 | G342: 化工 | H342: 247.71 | I342: 0.13500000000000001 | J342: -3.7499999999999999e-002 | K342: 11.13 | L342: 9.98e-002 | M342: 114.8 | N342: 4.58 | O342: 1.9e-002 | P342: 243.01 | Q342: 转股中 | R342: 4.65年 | S342: 2.66年 | T342: 4.74 | U342: 3798. | V342: 3.3500000000000001 | W342: 2.2000000000000002e-002 | X342: 5.2999999999999999e-002 | Y342: 217 | Z342: 2.43 | AA342: -0.154 | AB342: -0.159 | AC342: -0.16600000000000001 | AD342: -0.16600000000000001 | AE342: 92.58 | AF342: 96.01 | AG342: 0.98 | AH342: AA | AI342: 3.9900000000000005e-002 | AJ342: =H342+100*O342 -> 249.61000000000001 | AK342: 252.4 | AL342: 347 | AM342: 156.4 | AN342: 346 | AO342: 0.33000000000000002 | AP342: 22 | AQ342: 滨化转债!
A343: 251 | B343: 113548 | C343: 石英转债! | D343: 603688 | E343: 石英股份 | F343: 电子 | G343: 电子产品 | H343: 250.22 | I343: -5.16e-002 | J343: -2.8199999999999999e-002 | K343: 33.08 | L343: -8.3100000000000007e-002 | M343: 124.4 | N343: 14.93 | O343: 0.129 | P343: 221.57 | Q343: 转股中 | R343: 4.21年 | S343: 2.21年 | T343: 1.23 | U343: 453 | V343: 1.4299999999999999 | W343: 1.1000000000000001e-002 | X343: 2.3e-002 | Y343: 117 | Z343: 5.92 | AA343: -0.156 | AB343: -0.16399999999999998 | AC343: -0.20999999999999999 | AD343: -0.21100000000000002 | AE343: 90.83 | AF343: 97.64 | AG343: 0.96 | AH343: AA- | AI343: 6.0899999999999996e-002 | AJ343: =H343+100*O343 -> 263.12 | AK343: 278.9 | AL343: 351 | AM343: 181.2 | AN343: 351 | AO343: 3.9e-002 | AP343: 14 | AQ343: 石英转债!
A344: 136 | B344: 110074 | C344: 精达转债!! | D344: 600577 | E344: 精达股份 | F344: 电子 | G344: 电子产品 | H344: 272.14 | I344: 8.199999999999999e-003 | J344: -6.1999999999999998e-003 | K344: 9.88 | L344: 2.e-003 | M344: 117.3 | N344: 3.73 | O344: 2.7000000000000003e-002 | P344: 264.88 | Q344: 转股中 | R344: 5年5.1天 | S344: 3年6.1天 | T344: 5.66 | U344: 1147. | V344: 0.76200000000000001 | W344: 2.8999999999999998e-002 | X344: 7.6999999999999999e-002 | Y344: 196 | Z344: 4.79 | AA344: -0.157 | AB344: -0.161 | AC344: -0.14899999999999999 | AD344: -0.14899999999999999 | AE344: 91.42 | AF344: 96.22 | AG344: 0.98 | AH344: AA | AI344: 4.1200000000000001e-002 | AJ344: =H344+100*O344 -> 274.83999999999997 | AK344: 279.4 | AL344: 352 | AM344: 183.2 | AN344: 352 | AO344: 9.5000000000000001e-002 | AP344: 12 | AQ344: 精达转债!!
A345: 367 | B345: 113012 | C345: 骆驼转债!! | D345: 601311 | E345: 骆驼股份 | F345: 汽车 | G345: 零部件制 | H345: 141.01 | I345: -1.84e-002 | J345: -2.7000000000000001e-003 | K345: 13.92 | L345: -2.1099999999999997e-002 | M345: 106.5 | N345: 9.86 | O345: -1.e-003 | P345: 141.18 | Q345: 转股中 | R345: 1.61年 | S345: 回售内 | T345: 4.36 | U345: 149 | V345: 0.23699999999999999 | W345: 2.7999999999999997e-002 | X345: 3.9e-002 | Y345: 156 | Z345: 2.06 | AA345: -0.161 | AB345: -0.16699999999999998 | AC345: 回售内 | AD345: 回售内 | AE345: 100.25 | AF345: 100.28 | AG345: 1 | AH345: AA | AI345: 3.8399999999999997e-002 | AJ345: =H345+100*O345 -> 140.91 | AK345: 140.8 | AL345: 151 | AM345: 40.6 | AN345: 103 | AO345: 4.2000000000000003e-002 | AP345: 18 | AQ345: 骆驼转债!!
A346: 123 | B346: 123067 | C346: 斯莱转债! | D346: 300382 | E346: 斯莱克 | F346: 机械装备 | G346: 专用设备 | H346: 293.72 | I346: -1.7299999999999999e-002 | J346: 5.1999999999999998e-003 | K346: 27.95 | L346: -1.24e-002 | M346: 121.2 | N346: 9.36 | O346: -1.6e-002 | P346: 298.61 | Q346: 转股中 | R346: 5年34天 | S346: 3年35天 | T346: 3.49 | U346: 464 | V346: 0.44600000000000001 | W346: 2.2000000000000002e-002 | X346: 6.6000000000000003e-002 | Y346: 158 | Z346: 15.2 | AA346: -0.16200000000000001 | AB346: -0.16800000000000001 | AC346: -0.14999999999999999 | AD346: -0.151 | AE346: 85.74 | AF346: 89.78 | AG346: 0.98 | AH346: AA- | AI346: 6.2199999999999998e-002 | AJ346: =H346+100*O346 -> 292.12 | AK346: 288.8 | AL346: 353 | AM346: 199 | AN346: 353 | AO346: 0.20199999999999999 | AP346: 12 | AQ346: 斯莱转债!
A347: 308 | B347: 123018 | C347: 溢利转债! | D347: 300381 | E347: 溢多利 | F347: 医药 | G347: 原料药 | H347: 205.99 | I347: -8.199999999999999e-003 | J347: -1.2999999999999999e-003 | K347: 9.38 | L347: -1.37e-002 | M347: 114.3 | N347: 8.25 | O347: 0.81200000000000006 | P347: 113.7 | Q347: 转股中 | R347: 3.35年 | S347: 1.35年 | T347: 0.54 | U347: 19 | V347: 0.16699999999999998 | W347: 1.2e-002 | X347: 1.3000000000000001e-002 | Y347: 46 | Z347: 1.53 | AA347: -0.16399999999999998 | AB347: -0.17000000000000001 | AC347: -0.313 | AD347: -0.314 | AE347: 94.04 | AF347: 94.15 | AG347: 0.7 | AH347: AA- | AI347: 6.0899999999999996e-002 | AJ347: =H347+100*O347 -> 287.19 | AK347: 298.3 | AL347: 354 | AM347: 204.1 | AN347: 354 | AO347: -6.9999999999999993e-003 | AP347: 11 | AQ347: 溢利转债!
A348: 264 | B348: 123030 | C348: 九洲转债! | D348: 300040 | E348: 九洲集团 | F348: 能源电力 | G348: 电力设备 | H348: 243.968 | I348: -1.43e-002 | J348: -2.0000000000000001e-004 | K348: 9.24 | L348: -1.49e-002 | M348: 120 | N348: 4 | O348: 5.5999999999999994e-002 | P348: 231 | Q348: 转股中 | R348: 4年6.1天 | S348: 2年7天 | T348: 0.97 | U348: 880 | V348: 3.6699999999999999 | W348: 1.9e-002 | X348: 4.2999999999999997e-002 | Y348: 52 | Z348: 1.58 | AA348: -0.16399999999999998 | AB348: -0.17100000000000001 | AC348: -0.23100000000000001 | AD348: -0.23199999999999998 | AE348: 91.11 | AF348: 95.16 | AG348: 0.97 | AH348: AA- | AI348: 6.0899999999999996e-002 | AJ348: =H348+100*O348 -> 249.56799999999998 | AK348: 256.9 | AL348: 349 | AM348: 161.8 | AN348: 350 | AO348: 8.5000000000000006e-002 | AP348: 25 | AQ348: 九洲转债!
A349: 318 | B349: 128046 | C349: 利尔转债!! | D349: 2258 | E349: 利尔化学 | F349: 化工 | G349: 农化 | H349: 200.8 | I349: 1.67e-002 | J349: 7.3000000000000001e-003 | K349: 33.8 | L349: 2.4900000000000002e-002 | M349: 112.3 | N349: 18.42 | O349: 9.4e-002 | P349: 183.5 | Q349: 转股中 | R349: 3.18年 | S349: 1.18年 | T349: 8.08 | U349: 93 | V349: 5.7999999999999996e-002 | W349: 4.4999999999999998e-002 | X349: 8.3000000000000004e-002 | Y349: 178 | Z349: 4.24 | AA349: -0.17000000000000001 | AB349: -0.17499999999999999 | AC349: -0.35100000000000003 | AD349: -0.35299999999999998 | AE349: 97.58 | AF349: 99.45 | AG349: 0.96 | AH349: AA | AI349: 3.9900000000000005e-002 | AJ349: =H349+100*O349 -> 210.20000000000002 | AK349: 218.1 | AL349: 342 | AM349: 118.7 | AN349: 336 | AO349: 0.11599999999999999 | AP349: 10 | AQ349: 利尔转债!!
A350: 249 | B350: 123034 | C350: 通光转债! | D350: 300265 | E350: 通光线缆 | F350: 通信互联 | G350: 通信设备 | H350: 268 | I350: 8.2799999999999999e-002 | J350: -3.4799999999999998e-002 | K350: 13.52 | L350: 5.21e-002 | M350: 118 | N350: 7.95 | O350: 0.57600000000000007 | P350: 170.06 | Q350: 转股中 | R350: 4.22年 | S350: 2.23年 | T350: 0.78 | U350: 4168. | V350: 19.359999999999999 | W350: 1.6e-002 | X350: 2.7000000000000003e-002 | Y350: 49 | Z350: 3.79 | AA350: -0.17899999999999999 | AB350: -0.185 | AC350: -0.21899999999999997 | AD350: -0.22 | AE350: 87.83 | AF350: 88.59 | AG350: 0.92 | AH350: A+ | AI350: 7.1900000000000006e-002 | AJ350: =H350+100*O350 -> 325.60000000000002 | AK350: 365.9 | AL350: 361 | AM350: 277.3 | AN350: 361 | AO350: 0.19399999999999998 | AP350: 20 | AQ350: 通光转债!
A351: 341 | B351: 113504 | C351: 艾华转债!! | D351: 603989 | E351: 艾华集团 | F351: 电子 | G351: 元器件制 | H351: 181.91 | I351: 3.7000000000000002e-003 | J351: 5.6000000000000008e-003 | K351: 36.76 | L351: 9.5999999999999992e-003 | M351: 109.3 | N351: 20.81 | O351: 2.9999999999999999e-002 | P351: 176.65 | Q351: 转股中 | R351: 2.55年 | S351: 0.55年 | T351: 4.9 | U351: 35 | V351: 3.9e-002 | W351: 3.3000000000000002e-002 | X351: 5.9000000000000004e-002 | Y351: 147 | Z351: 5.41 | AA351: -0.183 | AB351: -0.18899999999999997 | AC351: -0.63300000000000001 | AD351: -0.63600000000000001 | AE351: 99.09 | AF351: 99.45 | AG351: 0.97 | AH351: AA | AI351: 3.8399999999999997e-002 | AJ351: =H351+100*O351 -> 184.91 | AK351: 187.2 | AL351: 316 | AM351: 87.7 | AN351: 310 | AO351: 4.4999999999999998e-002 | AP351: 9 | AQ351: 艾华转债!!
A352: 307 | B352: 113526 | C352: 联泰转债! | D352: 603797 | E352: 联泰环保 | F352: 城市公用 | G352: 三废处理 | H352: 227.2 | I352: -7.0999999999999995e-003 | J352: -3.0000000000000001e-003 | K352: 6.55 | L352: -1.6500000000000001e-002 | M352: 110.3 | N352: 6.11 | O352: 1.1200000000000001 | P352: 107.2 | Q352: 转股中 | R352: 3.45年 | S352: 1.45年 | T352: 1.93 | U352: 19 | V352: 4.2000000000000003e-002 | W352: 5.0000000000000003e-002 | X352: 5.4000000000000006e-002 | Y352: 38 | Z352: 1.73 | AA352: -0.192 | AB352: -0.19600000000000001 | AC352: -0.318 | AD352: -0.32000000000000001 | AE352: 97.31 | AF352: 98.24 | AG352: 0.61 | AH352: AA+ | AI352: 3.49e-002 | AJ352: =H352+100*O352 -> 339.19999999999999 | AK352: 347.2 | AL352: 357 | AM352: 249 | AN352: 357 | AO352: -3.2000000000000001e-002 | AP352: 9 | AQ352: 联泰转债!
A353: 320 | B353: 123015 | C353: 蓝盾转债!! | D353: 300297 | E353: 蓝盾股份 | F353: 计算机及 | G353: 软件开发 | H353: 210.85 | I353: -1.8500000000000003e-002 | J353: 1.8100000000000002e-002 | K353: 3.55 | L353: -3.7900000000000003e-002 | M353: 112.3 | N353: 5.79 | O353: 2.4399999999999999 | P353: 61.31 | Q353: 转股中 | R353: 2.997年 | S353: 1年0.1天 | T353: 1 | U353: 262 | V353: 1.23 | W353: 2.3e-002 | X353: 1.3999999999999999e-002 | Y353: 44 | Z353: 1.7 | AA353: -0.19399999999999998 | AB353: -0.19899999999999998 | AC353: -0.436 | AD353: -0.43700000000000006 | AE353: 89.18 | AF353: 79.56 | AG353: 0.01 | AH353: BBB- | AI353: 0.12039999999999999 | AJ353: =H353+100*O353 -> 454.85000000000002 | AK353: 360.4 | AL353: 360 | AM353: 271.2 | AN353: 360 | AO353: -0.19500000000000001 | AP353: 16 | AQ353: 蓝盾转债!!
A354: 373 | B354: 110033 | C354: 国贸转债! | D354: 600755 | E354: 厦门国贸 | F354: 交通运输 | G354: 交通运输 | H354: 118.11 | I354: 8.6e-003 | J354: -2.3e-003 | K354: 7.55 | L354: 9.3999999999999986e-003 | M354: 108 | N354: 6.72 | O354: 5.0999999999999997e-002 | P354: 112.35 | Q354: 转股中 | R354: 0.40年 | S354: 回售内 | T354: 11.5 | U354: 24 | V354: 1.8000000000000002e-002 | W354: 7.8e-002 | X354: 8.6999999999999994e-002 | Y354: 148 | Z354: 0.91 | AA354: -0.20199999999999999 | AB354: -0.23100000000000001 | AC354: 回售内 | AD354: 回售内 | AE354: 100.33 | AF354: 106.92 | AG354: 0.67 | AH354: AAA | AI354: 2.5699999999999997e-002 | AJ354: =H354+100*O354 -> 123.20999999999999 | AK354: 123.9 | AL354: 11 | AM354: 17 | AN354: 2 | AO354: 1.1000000000000001e-002 | AP354: 21 | AQ354: 国贸转债!
A355: 208 | B355: 123046 | C355: 天铁转债! | D355: 300587 | E355: 天铁股份 | F355: 铁路 | G355: 铁路设备 | H355: 328.306 | I355: 4.8999999999999998e-003 | J355: 5.1999999999999998e-003 | K355: 17.64 | L355: 1.03e-002 | M355: 117.7 | N355: 5.9 | O355: 9.8000000000000004e-002 | P355: 298.98 | Q355: 转股中 | R355: 4.59年 | S355: 2.60年 | T355: 0.62 | U355: 500 | V355: 2.48 | W355: 6.0000000000000001e-003 | X355: 1.8000000000000002e-002 | Y355: 102 | Z355: 3.71 | AA355: -0.20300000000000001 | AB355: -0.20800000000000002 | AC355: -0.20199999999999999 | AD355: -0.20199999999999999 | AE355: 88.14 | AF355: 90.24 | AG355: 0.98 | AH355: AA- | AI355: 6.0899999999999996e-002 | AJ355: =H355+100*O355 -> 338.10599999999999 | AK355: 357.6 | AL355: 358 | AM355: 267.4 | AN355: 359 | AO355: 0.10300000000000001 | AP355: 14 | AQ355: 天铁转债!
A356: 207 | B356: 123047 | C356: 久吾转债! | D356: 300631 | E356: 久吾高科 | F356: 机械装备 | G356: 专用设备 | H356: 370.322 | I356: -4.5000000000000005e-003 | J356: -2.2099999999999998e-002 | K356: 58.4 | L356: -2.7300000000000001e-002 | M356: 129.6 | N356: 17.43 | O356: 0.105 | P356: 335.05 | Q356: 转股中 | R356: 4.60年 | S356: 2.60年 | T356: 1.58 | U356: 10414. | V356: 16.859999999999999 | W356: 2.5000000000000001e-002 | X356: 8.4000000000000005e-002 | Y356: 63 | Z356: 7.68 | AA356: -0.20800000000000002 | AB356: -0.21600000000000003 | AC356: -0.21100000000000002 | AD356: -0.21199999999999999 | AE356: 87.36 | AF356: 95.07 | AG356: 0.97 | AH356: A+ | AI356: 7.1900000000000006e-002 | AJ356: =H356+100*O356 -> 380.822 | AK356: 405.6 | AL356: 366 | AM356: 310.5 | AN356: 366 | AO356: 0.17300000000000001 | AP356: 23 | AQ356: 久吾转债!
A357: 361 | B357: 128017 | C357: 金禾转债!! | D357: 2597 | E357: 金禾实业 | F357: 化工 | G357: 化工 | H357: 182.676 | I357: -4.8600000000000004e-002 | J357: 5.3800000000000001e-002 | K357: 34.82 | L357: 5.5000000000000005e-003 | M357: 108.8 | N357: 21.97 | O357: 0.153 | P357: 158.49 | Q357: 转股中 | R357: 2.22年 | S357: 0.22年 | T357: 5.52 | U357: 376 | V357: 0.35600000000000004 | W357: 2.7999999999999997e-002 | X357: 4.4999999999999998e-002 | Y357: 195 | Z357: 3.89 | AA357: -0.21100000000000002 | AB357: -0.21600000000000003 | AC357: -1.2270000000000001 | AD357: -1.2309999999999999 | AE357: 100.09 | AF357: 100.22 | AG357: 0.95 | AH357: AA | AI357: 3.8399999999999997e-002 | AJ357: =H357+100*O357 -> 197.976 | AK357: 206.9 | AL357: 332 | AM357: 106.6 | AN357: 330 | AO357: 0.114 | AP357: 10 | AQ357: 金禾转债!!
A358: 176 | B358: 128111 | C358: 中矿转债! | D358: 2738 | E358: 中矿资源 | F358: 有色金属 | G358: 有色行业 | H358: 387.046 | I358: -8.8999999999999999e-003 | J358: -6.6e-003 | K358: 54.63 | L358: -1.5700000000000002e-002 | M358: 124.2 | N358: 15.42 | O358: 9.1999999999999998e-002 | P358: 354.28 | Q358: 转股中 | R358: 4.82年 | S358: 2.83年 | T358: 1.52 | U358: 558 | V358: 0.93000000000000005 | W358: 9.0000000000000011e-003 | X358: 3.1e-002 | Y358: 176 | Z358: 5.15 | AA358: -0.21299999999999999 | AB358: -0.21899999999999997 | AC358: -0.193 | AD358: -0.19399999999999998 | AE358: 87.39 | AF358: 93.96 | AG358: 0.98 | AH358: AA- | AI358: 6.0899999999999996e-002 | AJ358: =H358+100*O358 -> 396.24599999999998 | AK358: 419.8 | AL358: 368 | AM358: 325.8 | AN358: 368 | AO358: -6.3e-002 | AP358: 9 | AQ358: 中矿转债!
A359: 365 | B359: 127004 | C359: 模塑转债!! | D359: 700 | E359: 模塑科技 | F359: 汽车 | G359: 零部件制 | H359: 172.5 | I359: 5.7999999999999996e-003 | J359: 1.9e-003 | K359: 6.34 | L359: 2.2599999999999999e-002 | M359: 111.8 | N359: 7.24 | O359: 0.96999999999999997 | P359: 87.57 | Q359: 转股中 | R359: 1.80年 | S359: 回售内 | T359: 1.32 | U359: 103 | V359: 0.45000000000000001 | W359: 2.3e-002 | X359: 2.e-002 | Y359: 58 | Z359: 2.08 | AA359: -0.215 | AB359: -0.22399999999999998 | AC359: 回售内 | AD359: 回售内 | AE359: 100.3 | AF359: 100.85 | AG359: 0.34 | AH359: AA- | AI359: 5.9400000000000001e-002 | AJ359: =H359+100*O359 -> 269.5 | AK359: 257.4 | AL359: 350 | AM359: 156.6 | AN359: 347 | AO359: 0.107 | AP359: 30 | AQ359: 模塑转债!!
A360: 186 | B360: 113582 | C360: 火炬转债! | D360: 603678 | E360: 火炬电子 | F360: 电子 | G360: 元器件制 | H360: 367.2 | I360: -2.8199999999999999e-002 | J360: 1.9599999999999999e-002 | K360: 80.39 | L360: -8.8000000000000005e-003 | M360: 114.9 | N360: 24.99 | O360: 0.14099999999999999 | P360: 321.69 | Q360: 转股中 | R360: 4.78年 | S360: 2.79年 | T360: 4.18 | U360: 312 | V360: 0.20000000000000001 | W360: 1.1000000000000001e-002 | X360: 3.6000000000000004e-002 | Y360: 370 | Z360: 9.1 | AA360: -0.218 | AB360: -0.222 | AC360: -0.19399999999999998 | AD360: -0.19399999999999998 | AE360: 92.21 | AF360: 95.63 | AG360: 0.99 | AH360: AA | AI360: 3.9900000000000005e-002 | AJ360: =H360+100*O360 -> 381.30000000000001 | AK360: 412.7 | AL360: 367 | AM360: 317.1 | AN360: 367 | AO360: -9.0000000000000011e-003 | AP360: 6 | AQ360: 火炬转债!
A361: 334 | B361: 113509 | C361: 新泉转债!!* | D361: 603179 | E361: 新泉股份 | F361: 汽车 | G361: 零部件制 | H361: 220.33 | I361: -3.0299999999999997e-002 | J361: 1.3300000000000001e-002 | K361: 34.1 | L361: -1.7000000000000001e-002 | M361: 109.3 | N361: 15.25 | O361: -1.4999999999999999e-002 | P361: 223.61 | Q361: 转股中 | R361: 2.81年 | S361: 0.81年 | T361: 0.49 | U361: 105 | V361: 0.95799999999999996 | W361: 4.0000000000000001e-003 | X361: 9.0000000000000011e-003 | Y361: 126 | Z361: 3.55 | AA361: -0.223 | AB361: -0.22800000000000001 | AC361: -0.55399999999999994 | AD361: -0.55500000000000005 | AE361: 98.14 | AF361: 98.49 | AG361: 1 | AH361: AA | AI361: 3.8399999999999997e-002 | AJ361: =H361+100*O361 -> 218.83000000000001 | AK361: 217.1 | AL361: 340 | AM361: 118.6 | AN361: 335 | AO361: -4.8000000000000001e-002 | AP361: 14 | AQ361: 新泉转债!!*
A362: 331 | B362: 110044 | C362: 广电转债!! | D362: 600831 | E362: 广电网络 | F362: 传媒娱乐 | G362: 影视娱乐 | H362: 235.56 | I362: -5.1000000000000004e-003 | J362: 3.0999999999999999e-003 | K362: 5.41 | L362: -9.1999999999999998e-003 | M362: 111.3 | N362: 6.87 | O362: 1.99 | P362: 78.75 | Q362: 转股中 | R362: 2.87年 | S362: 0.87年 | T362: 0.71 | U362: 54 | V362: 0.32299999999999995 | W362: 1.8000000000000002e-002 | X362: 1.4999999999999999e-002 | Y362: 38 | Z362: 1.03 | AA362: -0.23199999999999998 | AB362: -0.23699999999999999 | AC362: -0.54500000000000004 | AD362: -0.54700000000000004 | AE362: 97.9 | AF362: 100.05 | AG362: 0.22 | AH362: AA | AI362: 3.8399999999999997e-002 | AJ362: =H362+100*O362 -> 434.56 | AK362: 392.4 | AL362: 364 | AM362: 292.3 | AN362: 364 | AO362: -1.e-003 | AP362: 10 | AQ362: 广电转债!!
A363: 282 | B363: 113534 | C363: 鼎胜转债!! | D363: 603876 | E363: 鼎胜新材 | F363: 有色金属 | G363: 小金属 | H363: 298.39 | I363: 5.6299999999999996e-002 | J363: -8.8000000000000005e-003 | K363: 42.57 | L363: 4.8300000000000003e-002 | M363: 114.3 | N363: 15.18 | O363: 6.4000000000000001e-002 | P363: 280.43 | Q363: 转股中 | R363: 3.65年 | S363: 1.65年 | T363: 4.39 | U363: 2011. | V363: 1.52 | W363: 2.1000000000000001e-002 | X363: 5.9999999999999998e-002 | Y363: 206 | Z363: 5.1 | AA363: -0.23399999999999999 | AB363: -0.23899999999999999 | AC363: -0.33000000000000002 | AD363: -0.33100000000000002 | AE363: 92.38 | AF363: 92.49 | AG363: 0.98 | AH363: AA- | AI363: 6.0899999999999996e-002 | AJ363: =H363+100*O363 -> 304.78999999999996 | AK363: 316.3 | AL363: 355 | AM363: 223.9 | AN363: 355 | AO363: 0.29199999999999998 | AP363: 33 | AQ363: 鼎胜转债!!
A364: 230 | B364: 128093 | C364: 百川转债!! | D364: 2455 | E364: 百川股份 | F364: 化工 | G364: 化工 | H364: 429.042 | I364: -5.7099999999999998e-002 | J364: -9.0000000000000011e-003 | K364: 24.3 | L364: -6.7500000000000004e-002 | M364: 129.8 | N364: 5.77 | O364: 1.9e-002 | P364: 421.14 | Q364: 转股中 | R364: 4.39年 | S364: 2.39年 | T364: 1.62 | U364: 3033. | V364: 4.2699999999999996 | W364: 1.2e-002 | X364: 5.0000000000000003e-002 | Y364: 137 | Z364: 9.25 | AA364: -0.24399999999999999 | AB364: -0.251 | AC364: -0.247 | AD364: -0.248 | AE364: 92.15 | AF364: 101.11 | AG364: 0.98 | AH364: AA- | AI364: 6.0899999999999996e-002 | AJ364: =H364+100*O364 -> 430.94199999999995 | AK364: 436.9 | AL364: 369 | AM364: 335.8 | AN364: 369 | AO364: 0.52800000000000002 | AP364: 46 | AQ364: 百川转债!!
A365: 273 | B365: 123027 | C365: 蓝晓转债! | D365: 300487 | E365: 蓝晓科技 | F365: 化工 | G365: 化工 | H365: 353.607 | I365: 6.5099999999999991e-002 | J365: -4.1999999999999997e-003 | K365: 89.9 | L365: 6.2e-002 | M365: 118.8 | N365: 29.02 | O365: 0.14099999999999999 | P365: 309.79 | Q365: 转股中 | R365: 3.82年 | S365: 1.83年 | T365: 1.07 | U365: 3446. | V365: 8.8200000000000003 | W365: 5.0000000000000001e-003 | X365: 1.7000000000000001e-002 | Y365: 198 | Z365: 10.7 | AA365: -0.252 | AB365: -0.25700000000000001 | AC365: -0.31900000000000001 | AD365: -0.31900000000000001 | AE365: 90.42 | AF365: 91.67 | AG365: 0.98 | AH365: A+ | AI365: 7.1900000000000006e-002 | AJ365: =H365+100*O365 -> 367.70700000000005 | AK365: 397.4 | AL365: 365 | AM365: 305.8 | AN365: 365 | AO365: 2.1000000000000001e-002 | AP365: 19 | AQ365: 蓝晓转债!
A366: 281 | B366: 113025 | C366: 明泰转债!! | D366: 601677 | E366: 明泰铝业 | F366: 有色金属 | G366: 铝金属 | H366: 329.41 | I366: -5.6000000000000008e-003 | J366: 1.8700000000000001e-002 | K366: 34.96 | L366: 1.3300000000000001e-002 | M366: 114.5 | N366: 11 | O366: 3.6000000000000004e-002 | P366: 317.82 | Q366: 转股中 | R366: 3.65年 | S366: 1.66年 | T366: 11 | U366: 604 | V366: 0.16600000000000001 | W366: 4.5999999999999999e-002 | X366: 0.14599999999999999 | Y366: 239 | Z366: 2.65 | AA366: -0.254 | AB366: -0.25900000000000001 | AC366: -0.34600000000000003 | AD366: -0.34600000000000003 | AE366: 95.8 | AF366: 99.52 | AG366: 0.99 | AH366: AA | AI366: 3.9900000000000005e-002 | AJ366: =H366+100*O366 -> 333.01000000000005 | AK366: 341 | AL366: 356 | AM366: 241.5 | AN366: 356 | AO366: 0.20600000000000002 | AP366: 23 | AQ366: 明泰转债!!
A367: 371 | B367: 113009 | C367: 广汽转债! | D367: 601238 | E367: 广汽集团 | F367: 汽车 | G367: 乘用车 | H367: 121.52 | I367: -1.37e-002 | J367: 4.8999999999999998e-003 | K367: 15.19 | L367: -1.43e-002 | M367: 106 | N367: 13.97 | O367: 0.11800000000000001 | P367: 108.73 | Q367: 转股中 | R367: 0.44年 | S367: 回售内 | T367: 25.5 | U367: 259 | V367: 8.4000000000000005e-002 | W367: 1.6e-002 | X367: 1.8000000000000002e-002 | Y367: 1573. | Z367: 1.82 | AA367: -0.26500000000000001 | AB367: -0.28399999999999997 | AC367: 回售内 | AD367: 回售内 | AE367: 100.27 | AF367: 104.81 | AG367: 0.62 | AH367: AAA | AI367: 2.5699999999999997e-002 | AJ367: =H367+100*O367 -> 133.31999999999999 | AK367: 134.3 | AL367: 74 | AM367: 29.5 | AN367: 23 | AO367: 6.8000000000000005e-002 | AP367: 17 | AQ367: 广汽转债!
A368: 348 | B368: 128030 | C368: 天康转债!! | D368: 2100 | E368: 天康生物 | F368: 农业 | G368: 畜牧业 | H368: 231.777 | I368: 7.7000000000000002e-003 | J368: -7.6e-003 | K368: 7.77 | L368: 2.5999999999999999e-003 | M368: 111.3 | N368: 7.39 | O368: 1.2 | P368: 105.14 | Q368: 转股中 | R368: 2.36年 | S368: 0.36年 | T368: 0.89 | U368: 53 | V368: 0.26000000000000001 | W368: 1.1000000000000001e-002 | X368: 1.1000000000000001e-002 | Y368: 84 | Z368: 1.28 | AA368: -0.27100000000000002 | AB368: -0.27600000000000002 | AC368: -1.121 | AD368: -1.123 | AE368: 99.81 | AF368: 102 | AG368: 0.03 | AH368: AA | AI368: 3.8399999999999997e-002 | AJ368: =H368+100*O368 -> 351.77699999999999 | AK368: 358.4 | AL368: 359 | AM368: 256.4 | AN368: 358 | AO368: 1.6e-002 | AP368: 11 | AQ368: 天康转债!!
A369: 224 | B369: 128095 | C369: 恩捷转债!! | D369: 2812 | E369: 恩捷股份 | F369: 电子 | G369: 元器件制 | H369: 473.346 | I369: 1.8000000000000002e-002 | J369: -1.9e-002 | K369: 259 | L369: -1.e-003 | M369: 114.9 | N369: 64.92 | O369: 0.18600000000000003 | P369: 398.95 | Q369: 转股中 | R369: 4.50年 | S369: 2.50年 | T369: 4.54 | U369: 562 | V369: 0.26100000000000001 | W369: 2.e-003 | X369: 8.0000000000000002e-003 | Y369: 2309. | Z369: 19.95 | AA369: -0.27300000000000002 | AB369: -0.27699999999999997 | AC369: -0.24299999999999999 | AD369: -0.24399999999999999 | AE369: 93.26 | AF369: 96.71 | AG369: 0.99 | AH369: AA | AI369: 3.9900000000000005e-002 | AJ369: =H369+100*O369 -> 491.94600000000003 | AK369: 547.7 | AL369: 371 | AM369: 451 | AN369: 371 | AO369: -1.3999999999999999e-002 | AP369: 15 | AQ369: 恩捷转债!!
A370: 327 | B370: 128041 | C370: 盛路转债!! | D370: 2446 | E370: 盛路通信 | F370: 通信互联 | G370: 通信设备 | H370: 303.699 | I370: -1.5600000000000001e-002 | J370: 1.5600000000000001e-002 | K370: 6.87 | L370: -1.43e-002 | M370: 113.3 | N370: 6.82 | O370: 2.0099999999999998 | P370: 100.73 | Q370: 转股中 | R370: 2.92年 | S370: 0.93年 | T370: 0.53 | U370: 260 | V370: 1.6100000000000001 | W370: 8.0000000000000002e-003 | X370: 9.0000000000000011e-003 | Y370: 62 | Z370: 2.03 | AA370: -0.28899999999999998 | AB370: -0.29399999999999998 | AC370: -0.60299999999999998 | AD370: -0.60399999999999998 | AE370: 97.7 | AF370: 101.64 | AG370: 0 | AH370: AA | AI370: 3.8399999999999997e-002 | AJ370: =H370+100*O370 -> 504.69899999999996 | AK370: 506.7 | AL370: 370 | AM370: 405 | AN370: 370 | AO370: 3.5000000000000003e-002 | AP370: 12 | AQ370: 盛路转债!!
A371: 349 | B371: 128029 | C371: 太阳转债!! | D371: 2078 | E371: 太阳纸业 | F371: 造纸包装 | G371: 造纸行业 | H371: 169.9 | I371: 1.9099999999999999e-002 | J371: -5.0000000000000001e-003 | K371: 12.23 | L371: 1.41e-002 | M371: 107 | N371: 8.45 | O371: 0.17399999999999999 | P371: 144.73 | Q371: 转股中 | R371: 1.36年 | S371: 回售内 | T371: 9.09 | U371: 82 | V371: 5.2999999999999999e-002 | W371: 2.7999999999999997e-002 | X371: 4.0000000000000001e-002 | Y371: 329 | Z371: 1.88 | AA371: -0.28999999999999998 | AB371: -0.29600000000000004 | AC371: 回售内 | AD371: 回售内 | AE371: 100.17 | AF371: 102.36 | AG371: 1 | AH371: AA+ | AI371: 3.3399999999999999e-002 | AJ371: =H371+100*O371 -> 187.30000000000001 | AK371: 195.1 | AL371: 328 | AM371: 92.7 | AN371: 319 | AO371: 1.8000000000000002e-002 | AP371: 7 | AQ371: 太阳转债!!
A372: 324 | B372: 123013 | C372: 横河转债! | D372: 300539 | E372: 横河精密 | F372: 机械装备 | G372: 专用设备 | H372: 356.99 | I372: -1.e-004 | J372: 4.5999999999999999e-003 | K372: 8.88 | L372: 7.9000000000000008e-003 | M372: 114 | N372: 9.04 | O372: 2.6299999999999999 | P372: 98.23 | Q372: 转股中 | R372: 2.95年 | S372: 0.95年 | T372: 0.38 | U372: 241 | V372: 1.75 | W372: 1.9e-002 | X372: 1.9e-002 | Y372: 20 | Z372: 3.97 | AA372: -0.32400000000000001 | AB372: -0.32899999999999996 | AC372: -0.63200000000000001 | AD372: -0.63300000000000001 | AE372: 94.71 | AF372: 93.61 | AG372: 0.56 | AH372: A+ | AI372: 7.0400000000000004e-002 | AJ372: =H372+100*O372 -> 619.99000000000001 | AK372: 615.7 | AL372: 372 | AM372: 521 | AN372: 372 | AO372: 6.4000000000000001e-002 | AP372: 14 | AQ372: 横河转债!
A373: 262 | B373: 123031 | C373: 晶瑞转债! | D373: 300655 | E373: 晶瑞电材 | F373: 电子 | G373: 电子行业 | H373: 576 | I373: -2.3700000000000002e-002 | J373: -6.7000000000000002e-003 | K373: 52 | L373: -3.0800000000000001e-002 | M373: 115.8 | N373: 10.13 | O373: 0.122 | P373: 513.33 | Q373: 转股中 | R373: 4年15天 | S373: 2年16天 | T373: 0.53 | U373: 1026. | V373: 3.3100000000000001 | W373: 3.0000000000000001e-003 | X373: 1.4999999999999999e-002 | Y373: 177 | Z373: 7.39 | AA373: -0.33100000000000002 | AB373: -0.33500000000000002 | AC373: -0.32600000000000001 | AD373: -0.32600000000000001 | AE373: 88.76 | AF373: 88.01 | AG373: 0.99 | AH373: A+ | AI373: 7.1900000000000006e-002 | AJ373: =H373+100*O373 -> 588.20000000000005 | AK373: 638.7 | AL373: 373 | AM373: 549.9 | AN373: 373 | AO373: 5.0999999999999997e-002 | AP373: 16 | AQ373: 晶瑞转债!
A374: 360 | B374: 113016 | C374: 小康转债!! | D374: 601127 | E374: 小康股份 | F374: 汽车 | G374: 零部件制 | H374: 364.22 | I374: -2.4e-002 | J374: -1.3500000000000002e-002 | K374: 59.01 | L374: -3.78e-002 | M374: 109.3 | N374: 16.96 | O374: 4.7e-002 | P374: 347.94 | Q374: 转股中 | R374: 2.23年 | S374: 0.23年 | T374: 2.39 | U374: 663 | V374: 0.753 | W374: 3.0000000000000001e-003 | X374: 1.e-002 | Y374: 801 | Z374: 16.26 | AA374: -0.40299999999999997 | AB374: -0.40600000000000003 | AC374: -1.9159999999999999 | AD374: -1.9180000000000001 | AE374: 99.49 | AF374: 96.34 | AG374: 0.99 | AH374: AA- | AI374: 5.9400000000000001e-002 | AJ374: =H374+100*O374 -> 368.92000000000002 | AK374: 380.5 | AL374: 363 | AM374: 281 | AN374: 362 | AO374: -3.2000000000000001e-002 | AP374: 39 | AQ374: 小康转债!!