A1: 序号 | B1: 转债代码 | C1: 转债名称 | D1: 股票代码 | E1: 股票名称 | F1: 行业 | G1: 子行业 | H1: 转债价格 | I1: 涨跌 | J1: 日内套利 | K1: 股价 | L1: 涨跌 | M1: 剩余本息 | N1: 转股价格 | O1: 转股溢价率 | P1: 转股价值 | Q1: 距离转股日 | R1: 剩余年限 | S1: 回售年限 | T1: 转债余额 | U1: 转债成交额 | V1: 转债换手率 | W1: 余额/市值 | X1: 余额/股本 | Y1: 股票市值 | Z1: P/B | AA1: 税前收益率 | AB1: 税后收益率 | AC1: 税前回售收益 | AD1: 税后回售收益 | AE1: 回售价值 | AF1: 纯债价值 | AG1: 弹性 | AH1: 信用 | AI1: 折现率 | AJ1: 双低 | AK1: 老式双低 | AL1: 老式排名 | AM1: 新式双低 | AN1: 新式排名 | AO1: MA20乖离 | AP1: 热门度 | AQ1: 转债名称
A2: 291 | B2: 128062 | C2: 亚药转债! | D2: 2370 | E2: 亚太药业 | F2: 医药 | G2: 化学制药 | H2: 92.33 | I2: 2.6000000000000002e-002 | J2: -2.6000000000000002e-002 | K2: 4.28 | L2: 3.6299999999999999e-002 | M2: 119.3 | N2: 16.25 | O2: 2.5099999999999998 | P2: 26.34 | Q2: 转股中 | R2: 3.58年 | S2: 1.58年 | T2: 9.63 | U2: 65 | V2: 7.400000000000001e-002 | W2: 0.41899999999999998 | X2: 0.11 | Y2: 23 | Z2: 5.57 | AA2: 7.5800000000000006e-002 | AB2: 6.5500000000000003e-002 | AC2: 6.4000000000000001e-002 | AD2: 6.0599999999999994e-002 | AE2: 81.75 | AF2: 75.02 | AG2: 0 | AH2: BB | AI2: 0.1416 | AJ2: =H2+100*O2 -> 343.32999999999998 | AK2: 158.3 | AL2: 245 | AM2: 76.6 | AN2: 279 | AO2: 1.e-002 | AP2: 88 | AQ2: 亚药转债!
A3: 160 | B3: 113595 | C3: 花王转债! | D3: 603007 | E3: ST花王 | F3: 城市公用 | G3: 生态环境 | H3: 93.2 | I3: 2.2000000000000001e-003 | J3: 1.e-004 | K3: 3.28 | L3: 1.55e-002 | M3: 124.8 | N3: 6.92 | O3: 0.96599999999999997 | P3: 47.4 | Q3: 转股中 | R3: 4.88年 | S3: 2.88年 | T3: 3.3 | U3: 22 | V3: 7.0000000000000007e-002 | W3: 0.29999999999999999 | X3: 0.14199999999999999 | Y3: 11 | Z3: 1 | AA3: 6.3e-002 | AB3: 5.3800000000000001e-002 | AC3: 3.61e-002 | AD3: 3.3500000000000002e-002 | AE3: 77.47 | AF3: 78.64 | AG3: 0.15 | AH3: BBB+ | AI3: 0.1016 | AJ3: =H3+100*O3 -> 189.80000000000001 | AK3: 139 | AL3: 87 | AM3: 60.4 | AN3: 205 | AO3: 1.4999999999999999e-002 | AP3: 47 | AQ3: 花王转债!
A4: 204 | B4: 113576 | C4: 起步转债!! | D4: 603557 | E4: ST起步 | F4: 服装纺织 | G4: 鞋服行业 | H4: 96.83 | I4: 3.2000000000000002e-003 | J4: -3.7000000000000002e-003 | K4: 4.79 | L4: -6.1999999999999998e-003 | M4: 121.3 | N4: 10.55 | O4: 1.1299999999999999 | P4: 45.4 | Q4: 转股中 | R4: 4.60年 | S4: 2.60年 | T4: 2.66 | U4: 15 | V4: 5.9999999999999998e-002 | W4: 0.11199999999999999 | X4: 5.0999999999999997e-002 | Y4: 24 | Z4: 1.52 | AA4: 5.1500000000000004e-002 | AB4: 4.2999999999999997e-002 | AC4: 2.7300000000000001e-002 | AD4: 2.4199999999999999e-002 | AE4: 84.1 | AF4: 85.34 | AG4: 0.08 | AH4: A | AI4: 8.1600000000000006e-002 | AJ4: =H4+100*O4 -> 209.82999999999998 | AK4: 148.3 | AL4: 174 | AM4: 62.9 | AN4: 227 | AO4: 3.0000000000000001e-003 | AP4: 37 | AQ4: 起步转债!!
A5: 105 | B5: 128138 | C5: 侨银转债! | D5: 2973 | E5: 侨银股份 | F5: 城市公用 | G5: 城市公用 | H5: 110.815 | I5: -1.6000000000000001e-003 | J5: 4.0000000000000002e-004 | K5: 16.22 | L5: -6.0999999999999995e-003 | M5: 136.5 | N5: 25.33 | O5: 0.73099999999999998 | P5: 64.03 | Q5: 转股中 | R5: 5.20年 | S5: 3.21年 | T5: 4.2 | U5: 7.1 | V5: 1.4999999999999999e-002 | W5: 6.3e-002 | X5: 4.0999999999999995e-002 | Y5: 66 | Z5: 4.34 | AA5: 4.1700000000000001e-002 | AB5: 3.0499999999999999e-002 | AC5: -1.7600000000000001e-002 | AD5: -2.0099999999999996e-002 | AE5: 85.37 | AF5: 100.33 | AG5: 0.19 | AH5: AA- | AI5: 6.2300000000000001e-002 | AJ5: =H5+100*O5 -> 183.91499999999999 | AK5: 157.6 | AL5: 243 | AM5: 57.3 | AN5: 186 | AO5: 2.9999999999999999e-002 | AP5: 16 | AQ5: 侨银转债!
A6: 222 | B6: 113569 | C6: 科达转债! | D6: 603660 | E6: 苏州科达 | F6: 通信互联 | G6: 物联网 | H6: 101.26 | I6: 4.3e-003 | J6: -4.1999999999999997e-003 | K6: 6.69 | L6: 1.5e-003 | M6: 120.3 | N6: 14.8 | O6: 1.24 | P6: 45.2 | Q6: 转股中 | R6: 4.51年 | S6: 2.51年 | T6: 5.16 | U6: 6.1 | V6: 1.2e-002 | W6: 0.156 | X6: 7.0999999999999994e-002 | Y6: 33 | Z6: 1.89 | AA6: 3.9800000000000002e-002 | AB6: 3.1600000000000003e-002 | AC6: 8.8000000000000005e-003 | AD6: 6.0999999999999995e-003 | AE6: 88.68 | AF6: 92.8 | AG6: 0.04 | AH6: AA- | AI6: 6.0599999999999994e-002 | AJ6: =H6+100*O6 -> 225.25999999999999 | AK6: 157.3 | AL6: 240 | AM6: 64.5 | AN6: 236 | AO6: -1.3999999999999999e-002 | AP6: 30 | AQ6: 科达转债!
A7: 321 | B7: 113519 | C7: 长久转债! | D7: 603569 | E7: 长久物流 | F7: 交通运输 | G7: 物流业 | H7: 106.23 | I7: 2.e-003 | J7: -1.5e-003 | K7: 6.84 | L7: 8.8000000000000005e-003 | M7: 119.3 | N7: 11.04 | O7: 0.71499999999999997 | P7: 61.96 | Q7: 转股中 | R7: 3.18年 | S7: 1.18年 | T7: 6.97 | U7: 2.6 | V7: 4.0000000000000001e-003 | W7: 0.182 | X7: 0.113 | Y7: 38 | Z7: 1.8 | AA7: 3.7999999999999999e-002 | AB7: 2.7000000000000003e-002 | AC7: -2.4399999999999998e-002 | AD7: -2.8300000000000002e-002 | AE7: 97.62 | AF7: 105.73 | AG7: 0.06 | AH7: AA | AI7: 3.9599999999999996e-002 | AJ7: =H7+100*O7 -> 177.73000000000002 | AK7: 150.5 | AL7: 194 | AM7: 44.8 | AN7: 94 | AO7: 1.3000000000000001e-002 | AP7: 22 | AQ7: 长久转债!
A8: 141 | B8: 128127 | C8: 文科转债! | D8: 2775 | E8: 文科园林 | F8: 城市公用 | G8: 生态环境 | H8: 100.82 | I8: 8.3000000000000001e-003 | J8: -6.0000000000000001e-003 | K8: 4.15 | L8: 4.7999999999999996e-003 | M8: 120.8 | N8: 4.88 | O8: 0.18600000000000003 | P8: 85.04 | Q8: 转股中 | R8: 4.96年 | S8: 2.96年 | T8: 9.5 | U8: 27 | V8: 2.7999999999999997e-002 | W8: 0.44600000000000001 | X8: 0.38 | Y8: 21 | Z8: 0.98 | AA8: 3.7900000000000003e-002 | AB8: 3.0299999999999997e-002 | AC8: 9.1999999999999998e-003 | AD8: 6.8000000000000005e-003 | AE8: 86.44 | AF8: 90.77 | AG8: 0.48 | AH8: AA- | AI8: 6.0599999999999994e-002 | AJ8: =H8+100*O8 -> 119.41999999999999 | AK8: 116.6 | AL8: 2 | AM8: 25.8 | AN8: 4 | AO8: 2.1000000000000001e-002 | AP8: 60 | AQ8: 文科转债!
A9: 304 | B9: 110052 | C9: 贵广转债! | D9: 600996 | E9: 贵广网络 | F9: 传媒娱乐 | G9: 影视娱乐 | H9: 104.23 | I9: 1.5e-003 | J9: -4.0000000000000002e-004 | K9: 4.84 | L9: 2.3300000000000001e-002 | M9: 117.7 | N9: 7.94 | O9: 0.70999999999999996 | P9: 60.96 | Q9: 转股中 | R9: 3.50年 | S9: 1.50年 | T9: 15.3 | U9: 15 | V9: 1.e-002 | W9: 0.29999999999999999 | X9: 0.183 | Y9: 51 | Z9: 1.26 | AA9: 3.61e-002 | AB9: 2.6800000000000001e-002 | AC9: -6.9999999999999993e-003 | AD9: -1.0500000000000001e-002 | AE9: 97.4 | AF9: 104.75 | AG9: 0.05 | AH9: AA+ | AI9: 3.4599999999999999e-002 | AJ9: =H9+100*O9 -> 175.23000000000002 | AK9: 147.5 | AL9: 165 | AM9: 42.8 | AN9: 79 | AO9: 5.2000000000000005e-002 | AP9: 19 | AQ9: 贵广转债!
A10: 366 | B10: 128015 | C10: 久其转债!! | D10: 2279 | E10: 久其软件 | F10: 计算机及 | G10: 软件开发 | H10: 103.003 | I10: -5.5000000000000005e-003 | J10: 5.5000000000000005e-003 | K10: 4.79 | L10: 3.2300000000000002e-002 | M10: 109.5 | N10: 6.97 | O10: 0.499 | P10: 68.72 | Q10: 转股中 | R10: 1.76年 | S10: 回售内 | T10: 7.8 | U10: 82 | V10: 0.10199999999999999 | W10: 0.22899999999999998 | X10: 0.157 | Y10: 34 | Z10: 4.13 | AA10: 3.56e-002 | AB10: 2.53e-002 | AC10: 回售内 | AD10: 回售内 | AE10: 100.25 | AF10: 97.24 | AG10: 0 | AH10: A+ | AI10: 7.0300000000000001e-002 | AJ10: =H10+100*O10 -> 152.90299999999999 | AK10: 137.3 | AL10: 62 | AM10: 37 | AN10: 37 | AO10: 3.3000000000000002e-002 | AP10: 69 | AQ10: 久其转债!!
A11: 348 | B11: 113017 | C11: 吉视转债! | D11: 601929 | E11: 吉视传媒 | F11: 传媒娱乐 | G11: 影视娱乐 | H11: 100.63 | I11: 8.9999999999999998e-004 | J11: -8.9999999999999998e-004 | K11: 1.88 | L11: 0. | M11: 108.8 | N11: 2.95 | O11: 0.57899999999999996 | P11: 63.73 | Q11: 转股中 | R11: 2.32年 | S11: 0.32年 | T11: 15.6 | U11: 30 | V11: 1.9e-002 | W11: 0.26700000000000002 | X11: 0.17000000000000001 | Y11: 58 | Z11: 0.88 | AA11: 3.49e-002 | AB11: 2.7400000000000001e-002 | AC11: 1.9199999999999998e-002 | AD11: 1.2699999999999999e-002 | AE11: 99.97 | AF11: 100.98 | AG11: 0.04 | AH11: AA+ | AI11: 3.3300000000000003e-002 | AJ11: =H11+100*O11 -> 158.53 | AK11: 137.5 | AL11: 68 | AM11: 36.5 | AN11: 34 | AO11: 5.5e-002 | AP11: 68 | AQ11: 吉视转债!
A12: 172 | B12: 128117 | C12: 道恩转债! | D12: 2838 | E12: 道恩股份 | F12: 化工 | G12: 橡胶塑料 | H12: 104.98 | I12: 1.9e-003 | J12: -1.4000000000000002e-003 | K12: 14.75 | L12: 5.5000000000000005e-003 | M12: 123.1 | N12: 28.83 | O12: 1.05 | P12: 51.16 | Q12: 转股中 | R12: 4.82年 | S12: 2.83年 | T12: 3.6 | U12: 6.3 | V12: 1.7000000000000001e-002 | W12: 5.9999999999999998e-002 | X12: 3.1e-002 | Y12: 60 | Z12: 3.24 | AA12: 3.4200000000000001e-002 | AB12: 2.58e-002 | AC12: -5.0000000000000001e-003 | AD12: -7.1999999999999998e-003 | AE12: 86.86 | AF12: 93.16 | AG12: 0.09 | AH12: AA- | AI12: 6.0599999999999994e-002 | AJ12: =H12+100*O12 -> 209.98000000000002 | AK12: 158.8 | AL12: 248 | AM12: 65.6 | AN12: 241 | AO12: -5.7000000000000002e-002 | AP12: 23 | AQ12: 道恩转债!
A13: 152 | B13: 113596 | C13: 城地转债! | D13: 603887 | E13: 城地香江 | F13: 通信互联 | G13: 通信设备 | H13: 96.8 | I13: 7.4000000000000003e-003 | J13: -7.3000000000000001e-003 | K13: 8.54 | L13: 1.55e-002 | M13: 113.1 | N13: 24.26 | O13: 1.75 | P13: 35.2 | Q13: 转股中 | R13: 4.90年 | S13: 2.90年 | T13: 12 | U13: 20 | V13: 1.7000000000000001e-002 | W13: 0.312 | X13: 0.11 | Y13: 38 | Z13: 1.01 | AA13: 3.2899999999999999e-002 | AB13: 2.7799999999999998e-002 | AC13: 2.2099999999999998e-002 | AD13: 1.9799999999999998e-002 | AE13: 86.5 | AF13: 85.28 | AG13: 0.01 | AH13: AA- | AI13: 6.0599999999999994e-002 | AJ13: =H13+100*O13 -> 271.80000000000001 | AK13: 158.4 | AL13: 246 | AM13: 71.9 | AN13: 266 | AO13: -5.0999999999999997e-002 | AP13: 29 | AQ13: 城地转债!
A14: 177 | B14: 113589 | C14: 天创转债! | D14: 603608 | E14: 天创时尚 | F14: 服装纺织 | G14: 鞋服行业 | H14: 98.78 | I14: 4.0000000000000002e-004 | J14: 5.0000000000000001e-004 | K14: 5.86 | L14: 2.2700000000000001e-002 | M14: 114.9 | N14: 12.29 | O14: 1.0700000000000001 | P14: 47.68 | Q14: 转股中 | R14: 4.80年 | S14: 2.81年 | T14: 6 | U14: 38 | V14: 6.4000000000000001e-002 | W14: 0.23899999999999999 | X14: 0.114 | Y14: 25 | Z14: 1.59 | AA14: 3.2599999999999997e-002 | AB14: 2.6800000000000001e-002 | AC14: 1.5600000000000001e-002 | AD14: 1.3300000000000001e-002 | AE14: 92.22 | AF14: 95.68 | AG14: 0.04 | AH14: AA | AI14: 3.9599999999999996e-002 | AJ14: =H14+100*O14 -> 205.78 | AK14: 149.9 | AL14: 187 | AM14: 54.2 | AN14: 168 | AO14: 2.1000000000000001e-002 | AP14: 32 | AQ14: 天创转债!
A15: 197 | B15: 113573 | C15: 纵横转债! | D15: 603602 | E15: 纵横通信 | F15: 通信互联 | G15: 通信设备 | H15: 107.72 | I15: -2.9999999999999997e-004 | J15: 1.1000000000000001e-003 | K15: 10.36 | L15: 5.7999999999999996e-003 | M15: 124.2 | N15: 18.78 | O15: 0.95299999999999996 | P15: 55.17 | Q15: 转股中 | R15: 4.62年 | S15: 2.62年 | T15: 2.7 | U15: 6.4 | V15: 2.2000000000000002e-002 | W15: 0.128 | X15: 7.0000000000000007e-002 | Y15: 21 | Z15: 2.98 | AA15: 3.2000000000000001e-002 | AB15: 2.29e-002 | AC15: -1.2199999999999999e-002 | AD15: -1.4999999999999999e-002 | AE15: 86.06 | AF15: 90.93 | AG15: 0.14 | AH15: A+ | AI15: 7.1599999999999997e-002 | AJ15: =H15+100*O15 -> 203.01999999999998 | AK15: 160.3 | AL15: 257 | AM15: 69.3 | AN15: 260 | AO15: -4.0000000000000001e-002 | AP15: 26 | AQ15: 纵横转债!
A16: 323 | B16: 128044 | C16: 岭南转债! | D16: 2717 | E16: 岭南股份 | F16: 城市公用 | G16: 生态环境 | H16: 100.771 | I16: 7.1999999999999998e-003 | J16: -7.0999999999999995e-003 | K16: 3.04 | L16: 1.e-002 | M16: 110.3 | N16: 5.91 | O16: 0.95900000000000007 | P16: 51.44 | Q16: 转股中 | R16: 2.94年 | S16: 0.95年 | T16: 6.59 | U16: 17 | V16: 2.6000000000000002e-002 | W16: 0.14199999999999999 | X16: 7.2999999999999995e-002 | Y16: 46 | Z16: 1.07 | AA16: 3.1600000000000003e-002 | AB16: 2.4900000000000002e-002 | AC16: 9.1999999999999998e-003 | AD16: 6.0000000000000001e-003 | AE16: 95.5 | AF16: 93.33 | AG16: 0.01 | AH16: AA- | AI16: 5.9299999999999999e-002 | AJ16: =H16+100*O16 -> 196.67099999999999 | AK16: 150.1 | AL16: 190 | AM16: 54.6 | AN16: 174 | AO16: 5.5999999999999994e-002 | AP16: 51 | AQ16: 岭南转债!
A17: 139 | B17: 113601 | C17: 塞力转债! | D17: 603716 | E17: 塞力医疗 | F17: 医药 | G17: 医药商业 | H17: 103.83 | I17: 7.9000000000000008e-003 | J17: -1.4000000000000002e-003 | K17: 11.32 | L17: 2.35e-002 | M17: 120.8 | N17: 16.98 | O17: 0.55700000000000005 | P17: 66.67 | Q17: 转股中 | R17: 4.96年 | S17: 2.96年 | T17: 5.43 | U17: 9.4 | V17: 1.7000000000000001e-002 | W17: 0.23399999999999999 | X17: 0.156 | Y17: 23 | Z17: 1.54 | AA17: 3.1600000000000003e-002 | AB17: 2.41e-002 | AC17: -2.9999999999999997e-004 | AD17: -2.5999999999999999e-003 | AE17: 86.42 | AF17: 90.76 | AG17: 0.28 | AH17: AA- | AI17: 6.0599999999999994e-002 | AJ17: =H17+100*O17 -> 159.53 | AK17: 141 | AL17: 104 | AM17: 50.2 | AN17: 138 | AO17: -4.8000000000000001e-002 | AP17: 39 | AQ17: 塞力转债!
A18: 258 | B18: 110059 | C18: 浦发转债! | D18: 600000 | E18: 浦发银行 | F18: 金融 | G18: 银行行业 | H18: 104.02 | I18: 2.0000000000000001e-004 | J18: -1.e-004 | K18: 9.24 | L18: 1.1000000000000001e-003 | M18: 117.6 | N18: 13.97 | O18: 0.57299999999999995 | P18: 66.14 | Q18: 转股中 | R18: 4年54天 | S18: 无权 | T18: 500 | U18: 337 | V18: 6.0000000000000001e-003 | W18: 0.184 | X18: 0.122 | Y18: 2712. | Z18: 0.5 | AA18: 3.1e-002 | AB18: 2.3099999999999999e-002 | AC18: 无权 | AD18: 无权 | AE18: 无权 | AF18: 103.38 | AG18: 0.12 | AH18: AAA | AI18: 3.2599999999999997e-002 | AJ18: =H18+100*O18 -> 161.31999999999999 | AK18: 141.9 | AL18: 116 | AM18: 38.5 | AN18: 51 | AO18: 6.9999999999999993e-003 | AP18: 60 | AQ18: 浦发转债!
A19: 66 | B19: 113042 | C19: 上银转债! | D19: 601229 | E19: 上海银行 | F19: 金融 | G19: 银行行业 | H19: 103.37 | I19: 8.0000000000000004e-004 | J19: 1.e-004 | K19: 7.41 | L19: 4.0999999999999995e-003 | M19: 120.9 | N19: 10.63 | O19: 0.48299999999999998 | P19: 69.71 | Q19: 转股中 | R19: 5.39年 | S19: 无权 | T19: 200 | U19: 123 | V19: 6.0000000000000001e-003 | W19: 0.19 | X19: 0.13200000000000001 | Y19: 1053. | Z19: 0.6 | AA19: 3.04e-002 | AB19: 2.3300000000000001e-002 | AC19: 无权 | AD19: 无权 | AE19: 无权 | AF19: 101.33 | AG19: 0.21 | AH19: AAA | AI19: 3.4300000000000004e-002 | AJ19: =H19+100*O19 -> 151.67000000000002 | AK19: 137 | AL19: 59 | AM19: 35.7 | AN19: 31 | AO19: 2.1000000000000001e-002 | AP19: 12 | AQ19: 上银转债!
A20: 171 | B20: 128118 | C20: 瀛通转债! | D20: 2861 | E20: 瀛通通讯 | F20: 电子 | G20: 电子产品 | H20: 105.981 | I20: 2.2000000000000001e-003 | J20: -1.7000000000000001e-003 | K20: 12.01 | L20: 3.3e-003 | M20: 121.7 | N20: 21.12 | O20: 0.8640000000000001 | P20: 56.87 | Q20: 转股中 | R20: 4.82年 | S20: 2.83年 | T20: 3 | U20: 1.7 | V20: 5.0000000000000001e-003 | W20: 0.158 | X20: 8.9999999999999997e-002 | Y20: 19 | Z20: 1.8 | AA20: 2.98e-002 | AB20: 2.18e-002 | AC20: -5.6999999999999993e-003 | AD20: -8.3999999999999995e-003 | AE20: 87.53 | AF20: 92.23 | AG20: 0.15 | AH20: AA- | AI20: 6.0599999999999994e-002 | AJ20: =H20+100*O20 -> 192.381 | AK20: 155.1 | AL20: 221 | AM20: 62.9 | AN20: 225 | AO20: -3.3000000000000002e-002 | AP20: 19 | AQ20: 瀛通转债!
A21: 178 | B21: 123056 | C21: 雪榕转债! | D21: 300511 | E21: 雪榕生物 | F21: 农业 | G21: 种植业 | H21: 105.15 | I21: 5.8999999999999999e-003 | J21: -1.6000000000000001e-003 | K21: 6.92 | L21: 2.6699999999999998e-002 | M21: 120.7 | N21: 11.77 | O21: 0.78799999999999992 | P21: 58.79 | Q21: 转股中 | R21: 4.80年 | S21: 2.81年 | T21: 5.84 | U21: 22 | V21: 3.5000000000000003e-002 | W21: 0.191 | X21: 0.11199999999999999 | Y21: 31 | Z21: 1.66 | AA21: 2.9700000000000001e-002 | AB21: 2.2000000000000002e-002 | AC21: -5.0000000000000001e-003 | AD21: -7.3000000000000001e-003 | AE21: 87.14 | AF21: 91.52 | AG21: 0.16 | AH21: AA- | AI21: 6.0599999999999994e-002 | AJ21: =H21+100*O21 -> 183.94999999999999 | AK21: 151.5 | AL21: 200 | AM21: 60 | AN21: 200 | AO21: -2.2000000000000002e-002 | AP21: 16 | AQ21: 雪榕转债!
A22: 305 | B22: 113021 | C22: 中信转债! | D22: 601998 | E22: 中信银行 | F22: 金融 | G22: 银行行业 | H22: 106.97 | I22: 4.0000000000000002e-004 | J22: 4.0000000000000002e-004 | K22: 4.71 | L22: 6.4000000000000003e-003 | M22: 118 | N22: 6.73 | O22: 0.52800000000000002 | P22: 69.99 | Q22: 转股中 | R22: 3.50年 | S22: 无权 | T22: 400 | U22: 88 | V22: 2.e-003 | W22: 0.17399999999999999 | X22: 0.121 | Y22: 2305. | Z22: 0.48 | AA22: 2.9399999999999999e-002 | AB22: 1.9900000000000001e-002 | AC22: 无权 | AD22: 无权 | AE22: 无权 | AF22: 105.84 | AG22: 0.12 | AH22: AAA | AI22: 3.2599999999999997e-002 | AJ22: =H22+100*O22 -> 159.77000000000001 | AK22: 144 | AL22: 137 | AM22: 38.1 | AN22: 45 | AO22: 2.2000000000000002e-002 | AP22: 42 | AQ22: 中信转债!
A23: 196 | B23: 113578 | C23: 全筑转债! | D23: 603030 | E23: 全筑股份 | F23: 建筑 | G23: 装饰工程 | H23: 103.36 | I23: 6.4000000000000003e-003 | J23: -3.7000000000000002e-003 | K23: 3.79 | L23: 1.34e-002 | M23: 117.9 | N23: 5.4 | O23: 0.47299999999999998 | P23: 70.19 | Q23: 转股中 | R23: 4.62年 | S23: 2.63年 | T23: 3.84 | U23: 5 | V23: 1.3000000000000001e-002 | W23: 0.188 | X23: 0.13200000000000001 | Y23: 20 | Z23: 0.99 | AA23: 2.9399999999999999e-002 | AB23: 2.2400000000000003e-002 | AC23: 2.0000000000000001e-004 | AD23: -2.2000000000000001e-003 | AE23: 92.86 | AF23: 98.86 | AG23: 0.2 | AH23: AA | AI23: 3.9599999999999996e-002 | AJ23: =H23+100*O23 -> 150.66 | AK23: 136.5 | AL23: 53 | AM23: 37.7 | AN23: 40 | AO23: -8.5999999999999993e-002 | AP23: 24 | AQ23: 全筑转债!
A24: 243 | B24: 110064 | C24: 建工转债! | D24: 600939 | E24: 重庆建工 | F24: 建筑 | G24: 建筑工程 | H24: 106.76 | I24: 2.3999999999999998e-003 | J24: -2.3999999999999998e-003 | K24: 3.55 | L24: 0. | M24: 119.8 | N24: 4.53 | O24: 0.36200000000000004 | P24: 78.37 | Q24: 转股中 | R24: 4.29年 | S24: 2.30年 | T24: 16.6 | U24: 29 | V24: 1.6e-002 | W24: 0.25800000000000001 | X24: 0.20199999999999999 | Y24: 64 | Z24: 0.9 | AA24: 2.7900000000000001e-002 | AB24: 1.9599999999999999e-002 | AC24: -1.0200000000000001e-002 | AD24: -1.34e-002 | AE24: 95.86 | AF24: 103.9 | AG24: 0.23 | AH24: AA+ | AI24: 3.4599999999999999e-002 | AJ24: =H24+100*O24 -> 142.96000000000001 | AK24: 135.2 | AL24: 38 | AM24: 31.3 | AN24: 13 | AO24: 5.0999999999999997e-002 | AP24: 46 | AQ24: 建工转债!
A25: 294 | B25: 113530 | C25: 大丰转债! | D25: 603081 | E25: 大丰实业 | F25: 建筑 | G25: 装饰工程 | H25: 110.11 | I25: 4.6999999999999993e-003 | J25: -6.6e-003 | K25: 12.02 | L25: -1.3899999999999999e-002 | M25: 121 | N25: 16.49 | O25: 0.51100000000000001 | P25: 72.89 | Q25: 转股中 | R25: 3.56年 | S25: 1.56年 | T25: 6.3 | U25: 12 | V25: 1.7000000000000001e-002 | W25: 0.13 | X25: 9.5000000000000001e-002 | Y25: 48 | Z25: 2.13 | AA25: 2.7400000000000001e-002 | AB25: 1.7000000000000001e-002 | AC25: -3.8599999999999995e-002 | AD25: -4.1799999999999997e-002 | AE25: 96.29 | AF25: 105.67 | AG25: 0.14 | AH25: AA | AI25: 3.9599999999999996e-002 | AJ25: =H25+100*O25 -> 161.21000000000001 | AK25: 147.3 | AL25: 162 | AM25: 41.7 | AN25: 71 | AO25: -1.3999999999999999e-002 | AP25: 31 | AQ25: 大丰转债!
A26: 187 | B26: 113584 | C26: 家悦转债! | D26: 603708 | E26: 家家悦 | F26: 商业零售 | G26: 超市 | H26: 101.47 | I26: 2.5000000000000001e-003 | J26: -2.3e-003 | K26: 15 | L26: 1.9e-002 | M26: 114.9 | N26: 37.53 | O26: 1.54 | P26: 39.97 | Q26: 转股中 | R26: 4.75年 | S26: 2.75年 | T26: 6.45 | U26: 4.1 | V26: 6.0000000000000001e-003 | W26: 7.0999999999999994e-002 | X26: 2.7999999999999997e-002 | Y26: 91 | Z26: 3.53 | AA26: 2.7000000000000003e-002 | AB26: 2.12e-002 | AC26: 6.5000000000000006e-003 | AD26: 4.1999999999999997e-003 | AE26: 92.41 | AF26: 95.88 | AG26: 0.01 | AH26: AA | AI26: 3.9599999999999996e-002 | AJ26: =H26+100*O26 -> 255.47 | AK26: 163 | AL26: 264 | AM26: 67.1 | AN26: 245 | AO26: -1.9e-002 | AP26: 14 | AQ26: 家悦转债!
A27: 208 | B27: 127016 | C27: 鲁泰转债! | D27: 726 | E27: 鲁 泰Ａ | F27: 服装纺织 | G27: 纺织行业 | H27: 102.991 | I27: -7.000000000000001e-004 | J27: 2.7000000000000001e-003 | K27: 5.85 | L27: 1.3899999999999999e-002 | M27: 115.9 | N27: 8.71 | O27: 0.53299999999999992 | P27: 67.16 | Q27: 转股中 | R27: 4.59年 | S27: 2.60年 | T27: 14 | U27: 12 | V27: 8.0000000000000002e-003 | W27: 0.27100000000000002 | X27: 0.182 | Y27: 52 | Z27: 0.66 | AA27: 2.6600000000000002e-002 | AB27: 2.0199999999999999e-002 | AC27: 1.5e-003 | AD27: -8.9999999999999998e-004 | AE27: 94.2 | AF27: 99.43 | AG27: 0.14 | AH27: AA+ | AI27: 3.4599999999999999e-002 | AJ27: =H27+100*O27 -> 156.291 | AK27: 138.8 | AL27: 83 | AM27: 39.4 | AN27: 56 | AO27: 5.2000000000000005e-002 | AP27: 21 | AQ27: 鲁泰转债!
A28: 64 | B28: 123096 | C28: 思创转债! | D28: 300078 | E28: 思创医惠 | F28: 通信互联 | G28: 物联网 | H28: 108 | I28: -1.6000000000000001e-003 | J28: 5.0000000000000001e-003 | K28: 6.55 | L28: 7.7000000000000002e-003 | M28: 124 | N28: 8.26 | O28: 0.36200000000000004 | P28: 79.3 | Q28: 转股中 | R28: 5.39年 | S28: 3.40年 | T28: 8.17 | U28: 25 | V28: 2.8999999999999998e-002 | W28: 0.14300000000000002 | X28: 0.114 | Y28: 57 | Z28: 2.09 | AA28: 2.6499999999999999e-002 | AB28: 1.8799999999999997e-002 | AC28: -1.0800000000000001e-002 | AD28: -1.29e-002 | AE28: 83.98 | AF28: 90.1 | AG28: 0.44 | AH28: AA- | AI28: 6.2300000000000001e-002 | AJ28: =H28+100*O28 -> 144.19999999999999 | AK28: 136.7 | AL28: 55 | AM28: 46.6 | AN28: 110 | AO28: -4.8000000000000001e-002 | AP28: 7 | AQ28: 思创转债!
A29: 334 | B29: 127007 | C29: 湖广转债! | D29: 665 | E29: 湖北广电 | F29: 传媒娱乐 | G29: 影视娱乐 | H29: 103.607 | I29: 4.5000000000000005e-003 | J29: -4.3e-003 | K29: 3.77 | L29: 2.7000000000000001e-003 | M29: 111.3 | N29: 5.58 | O29: 0.53299999999999992 | P29: 67.56 | Q29: 转股中 | R29: 2.81年 | S29: 0.82年 | T29: 12.2 | U29: 11 | V29: 9.0000000000000011e-003 | W29: 0.32799999999999996 | X29: 0.222 | Y29: 37 | Z29: 0.64 | AA29: 2.6200000000000001e-002 | AB29: 1.8600000000000002e-002 | AC29: -1.78e-002 | AD29: -2.1299999999999999e-002 | AE29: 98.58 | AF29: 101.64 | AG29: 0.09 | AH29: AA+ | AI29: 3.3300000000000003e-002 | AJ29: =H29+100*O29 -> 156.90699999999998 | AK29: 139.7 | AL29: 88 | AM29: 38 | AN29: 42 | AO29: 3.7000000000000005e-002 | AP29: 18 | AQ29: 湖广转债!
A30: 144 | B30: 113600 | C30: 新星转债! | D30: 603978 | E30: 深圳新星 | F30: 有色金属 | G30: 有色行业 | H30: 110.93 | I30: 7.4000000000000003e-003 | J30: -8.6e-003 | K30: 19.93 | L30: -3.0000000000000001e-003 | M30: 125.6 | N30: 23.85 | O30: 0.32700000000000001 | P30: 83.56 | Q30: 转股中 | R30: 4.94年 | S30: 2.94年 | T30: 5.95 | U30: 10 | V30: 1.4999999999999999e-002 | W30: 0.187 | X30: 0.156 | Y30: 32 | Z30: 2.1 | AA30: 2.5899999999999999e-002 | AB30: 1.7100000000000001e-002 | AC30: -2.2099999999999998e-002 | AD30: -2.4300000000000002e-002 | AE30: 86.34 | AF30: 94.42 | AG30: 0.42 | AH30: AA- | AI30: 6.0599999999999994e-002 | AJ30: =H30+100*O30 -> 143.63 | AK30: 138.3 | AL30: 71 | AM30: 43.9 | AN30: 86 | AO30: 5.7999999999999996e-002 | AP30: 25 | AQ30: 新星转债!
A31: 276 | B31: 123028 | C31: 清水转债! | D31: 300437 | E31: 清水源 | F31: 城市公用 | G31: 三废处理 | H31: 110.3 | I31: -3.9000000000000003e-003 | J31: -9.7999999999999997e-003 | K31: 10.17 | L31: -3.0499999999999999e-002 | M31: 121 | N31: 11.84 | O31: 0.28399999999999997 | P31: 85.9 | Q31: 转股中 | R31: 3.79年 | S31: 1.79年 | T31: 4.55 | U31: 68 | V31: 0.13600000000000001 | W31: 0.20199999999999999 | X31: 0.17399999999999999 | Y31: 23 | Z31: 2.16 | AA31: 2.53e-002 | AB31: 1.55e-002 | AC31: -3.0299999999999997e-002 | AD31: -3.4000000000000002e-002 | AE31: 90.88 | AF31: 93.72 | AG31: 0.45 | AH31: A+ | AI31: 7.1599999999999997e-002 | AJ31: =H31+100*O31 -> 138.69999999999999 | AK31: 134.7 | AL31: 36 | AM31: 41 | AN31: 64 | AO31: 6.3e-002 | AP31: 51 | AQ31: 清水转债!
A32: 275 | B32: 128069 | C32: 华森转债! | D32: 2907 | E32: 华森制药 | F32: 医药 | G32: 化学制药 | H32: 108.8 | I32: 4.5999999999999999e-003 | J32: -3.3e-003 | K32: 12.19 | L32: 6.6e-003 | M32: 119.3 | N32: 18.01 | O32: 0.60699999999999998 | P32: 67.68 | Q32: 转股中 | R32: 3.80年 | S32: 1.81年 | T32: 3 | U32: 3.6 | V32: 1.1000000000000001e-002 | W32: 6.0999999999999999e-002 | X32: 4.0999999999999995e-002 | Y32: 49 | Z32: 4.27 | AA32: 2.5000000000000001e-002 | AB32: 1.5900000000000001e-002 | AC32: -2.8500000000000001e-002 | AD32: -3.1200000000000002e-002 | AE32: 91.61 | AF32: 95.76 | AG32: 0.19 | AH32: AA- | AI32: 6.0599999999999994e-002 | AJ32: =H32+100*O32 -> 169.5 | AK32: 149.9 | AL32: 188 | AM32: 54.2 | AN32: 165 | AO32: 2.e-003 | AP32: 43 | AQ32: 华森转债!
A33: 143 | B33: 110072 | C33: 广汇转债! | D33: 600297 | E33: 广汇汽车 | F33: 汽车 | G33: 分销、售 | H33: 101.5 | I33: 7.7000000000000002e-003 | J33: -6.8999999999999999e-003 | K33: 2.96 | L33: 3.4000000000000002e-003 | M33: 114.3 | N33: 4.03 | O33: 0.38200000000000001 | P33: 73.45 | Q33: 转股中 | R33: 4.95年 | S33: 2.96年 | T33: 33.7 | U33: 92 | V33: 2.7000000000000003e-002 | W33: 0.14000000000000001 | X33: 0.10300000000000001 | Y33: 240 | Z33: 0.59 | AA33: 2.46e-002 | AB33: 1.9299999999999998e-002 | AC33: 4.0999999999999995e-003 | AD33: 2.3e-003 | AE33: 92.49 | AF33: 96.81 | AG33: 0.25 | AH33: AA+ | AI33: 3.4599999999999999e-002 | AJ33: =H33+100*O33 -> 139.69999999999999 | AK33: 129.6 | AL33: 15 | AM33: 32.7 | AN33: 19 | AO33: 5.2999999999999999e-002 | AP33: 69 | AQ33: 广汇转债!
A34: 99 | B34: 128139 | C34: 祥鑫转债! | D34: 2965 | E34: 祥鑫科技 | F34: 汽车 | G34: 零部件制 | H34: 106.8 | I34: 2.8000000000000004e-003 | J34: -2.5999999999999999e-003 | K34: 22.57 | L34: 8.9999999999999998e-004 | M34: 121 | N34: 36.96 | O34: 0.74900000000000011 | P34: 61.07 | Q34: 转股中 | R34: 5.24年 | S34: 3.24年 | T34: 6.47 | U34: 3.7 | V34: 5.0000000000000001e-003 | W34: 0.19 | X34: 0.11599999999999999 | Y34: 34 | Z34: 1.96 | AA34: 2.46e-002 | AB34: 1.7500000000000002e-002 | AC34: -8.1000000000000013e-003 | AD34: -1.03e-002 | AE34: 84.76 | AF34: 88.76 | AG34: 0.22 | AH34: AA- | AI34: 6.2300000000000001e-002 | AJ34: =H34+100*O34 -> 181.69999999999999 | AK34: 152.5 | AL34: 207 | AM34: 63.8 | AN34: 233 | AO34: -2.9999999999999999e-002 | AP34: 15 | AQ34: 祥鑫转债!
A35: 29 | B35: 113624 | C35: 正川转债! | D35: 603976 | E35: 正川股份 | F35: 医药 | G35: 医药行业 | H35: 106.33 | I35: 3.4999999999999996e-003 | J35: -1.04e-002 | K35: 32.81 | L35: -1.5900000000000001e-002 | M35: 121.6 | N35: 46.69 | O35: 0.51300000000000001 | P35: 70.27 | Q35: 2月6天 | R35: 5.65年 | S35: 3.65年 | T35: 4.05 | U35: 15 | V35: 3.5000000000000003e-002 | W35: 8.199999999999999e-002 | X35: 5.7000000000000002e-002 | Y35: 50 | Z35: 4.62 | AA35: 2.46e-002 | AB35: 1.78e-002 | AC35: -4.3e-003 | AD35: -6.6e-003 | AE35: 80.12 | AF35: 82.33 | AG35: 0.43 | AH35: A+ | AI35: 7.3300000000000004e-002 | AJ35: =H35+100*O35 -> 157.63 | AK35: 142.4 | AL35: 120 | AM35: 60.1 | AN35: 201 | AO35: -5.0999999999999997e-002 | AP35: 15 | AQ35: 正川转债!
A36: 227 | B36: 113566 | C36: 翔港转债! | D36: 603499 | E36: 翔港科技 | F36: 造纸包装 | G36: 包装材料 | H36: 111.58 | I36: 3.7000000000000002e-003 | J36: 4.3e-003 | K36: 7.56 | L36: 2.4399999999999998e-002 | M36: 124 | N36: 10.77 | O36: 0.58999999999999997 | P36: 70.19 | Q36: 转股中 | R36: 4.49年 | S36: 2.49年 | T36: 1.61 | U36: 4.6 | V36: 2.5000000000000001e-002 | W36: 0.106 | X36: 7.400000000000001e-002 | Y36: 15 | Z36: 2.68 | AA36: 2.4399999999999998e-002 | AB36: 1.5100000000000001e-002 | AC36: -2.5899999999999999e-002 | AD36: -2.8799999999999999e-002 | AE36: 86.91 | AF36: 91.62 | AG36: 0.33 | AH36: A+ | AI36: 7.1599999999999997e-002 | AJ36: =H36+100*O36 -> 170.57999999999998 | AK36: 153 | AL36: 211 | AM36: 61.3 | AN36: 211 | AO36: 3.5000000000000003e-002 | AP36: 28 | AQ36: 翔港转债!
A37: 102 | B37: 123077 | C37: 汉得转债! | D37: 300170 | E37: 汉得信息 | F37: 计算机及 | G37: 软件开发 | H37: 111 | I37: 8.6e-003 | J37: -3.2000000000000002e-003 | K37: 7.67 | L37: 1.8600000000000002e-002 | M37: 125.5 | N37: 9.69 | O37: 0.40200000000000002 | P37: 79.15 | Q37: 转股中 | R37: 5.22年 | S37: 3.22年 | T37: 9.37 | U37: 12 | V37: 1.1000000000000001e-002 | W37: 0.13800000000000001 | X37: 0.109 | Y37: 68 | Z37: 2.15 | AA37: 2.4300000000000002e-002 | AB37: 1.5900000000000001e-002 | AC37: -1.9699999999999999e-002 | AD37: -2.18e-002 | AE37: 90.67 | AF37: 102.03 | AG37: 0.29 | AH37: AA | AI37: 4.1299999999999996e-002 | AJ37: =H37+100*O37 -> 151.19999999999999 | AK37: 142.8 | AL37: 125 | AM37: 40.8 | AN37: 60 | AO37: 0. | AP37: 15 | AQ37: 汉得转债!
A38: 265 | B38: 128074 | C38: 游族转债!! | D38: 2174 | E38: 游族网络 | F38: 通信互联 | G38: 互联网 | H38: 109.05 | I38: 8.199999999999999e-003 | J38: 3.0999999999999999e-003 | K38: 13.28 | L38: 3.7499999999999999e-002 | M38: 119.9 | N38: 16.97 | O38: 0.39399999999999996 | P38: 78.26 | Q38: 转股中 | R38: 4年19天 | S38: 2年20天 | T38: 6.83 | U38: 90 | V38: 0.12 | W38: 5.5999999999999994e-002 | X38: 4.4000000000000004e-002 | Y38: 122 | Z38: 2.37 | AA38: 2.4199999999999999e-002 | AB38: 1.55e-002 | AC38: -2.3900000000000001e-002 | AD38: -2.6800000000000001e-002 | AE38: 94.95 | AF38: 100.77 | AG38: 0.3 | AH38: AA | AI38: 3.9599999999999996e-002 | AJ38: =H38+100*O38 -> 148.44999999999999 | AK38: 139.8 | AL38: 90 | AM38: 39.1 | AN38: 55 | AO38: 9.0999999999999998e-002 | AP38: 29 | AQ38: 游族转债!!
A39: 95 | B39: 123081 | C39: 精研转债! | D39: 300709 | E39: 精研科技 | F39: 电子 | G39: 电子产品 | H39: 107.488 | I39: 8.3999999999999995e-003 | J39: 8.5000000000000006e-003 | K39: 31.87 | L39: 7.85e-002 | M39: 121.3 | N39: 53.4 | O39: 0.80099999999999993 | P39: 59.68 | Q39: 转股中 | R39: 5.25年 | S39: 3.25年 | T39: 5.7 | U39: 70 | V39: 0.113 | W39: 0.129 | X39: 7.6999999999999999e-002 | Y39: 44 | Z39: 2.82 | AA39: 2.3799999999999998e-002 | AB39: 1.67e-002 | AC39: -9.1000000000000004e-003 | AD39: -1.1399999999999999e-002 | AE39: 84.98 | AF39: 88.97 | AG39: 0.22 | AH39: AA- | AI39: 6.2300000000000001e-002 | AJ39: =H39+100*O39 -> 187.58799999999999 | AK39: 155.3 | AL39: 224 | AM39: 66.3 | AN39: 244 | AO39: 7.0000000000000007e-002 | AP39: 9 | AQ39: 精研转债!
A40: 148 | B40: 128125 | C40: 华阳转债! | D40: 2949 | E40: 华阳国际 | F40: 建筑 | G40: 建筑工程 | H40: 105.55 | I40: 3.3e-003 | J40: 1.8e-003 | K40: 16.61 | L40: 1.9e-002 | M40: 118.1 | N40: 25.39 | O40: 0.61299999999999999 | P40: 65.42 | Q40: 转股中 | R40: 4.90年 | S40: 2.90年 | T40: 4.5 | U40: 8 | V40: 1.7000000000000001e-002 | W40: 0.13800000000000001 | X40: 8.9999999999999997e-002 | Y40: 33 | Z40: 2.56 | AA40: 2.3599999999999999e-002 | AB40: 1.7000000000000001e-002 | AC40: -6.6e-003 | AD40: -8.8000000000000005e-003 | AE40: 86.47 | AF40: 88.99 | AG40: 0.27 | AH40: AA- | AI40: 6.0599999999999994e-002 | AJ40: =H40+100*O40 -> 166.84999999999999 | AK40: 145.7 | AL40: 151 | AM40: 56.7 | AN40: 183 | AO40: 3.1e-002 | AP40: 8 | AQ40: 华阳转债!
A41: 200 | B41: 123049 | C41: 维尔转债! | D41: 300190 | E41: 维尔利 | F41: 城市公用 | G41: 三废处理 | H41: 112 | I41: 7.1999999999999998e-003 | J41: 6.0999999999999995e-003 | K41: 6.68 | L41: 2.7699999999999999e-002 | M41: 124.3 | N41: 7.38 | O41: 0.23699999999999999 | P41: 90.51 | Q41: 转股中 | R41: 4.61年 | S41: 2.61年 | T41: 9.17 | U41: 20 | V41: 1.9e-002 | W41: 0.17600000000000002 | X41: 0.159 | Y41: 52 | Z41: 1.21 | AA41: 2.3399999999999997e-002 | AB41: 1.43e-002 | AC41: -2.5899999999999999e-002 | AD41: -2.87e-002 | AE41: 88.69 | AF41: 95.41 | AG41: 0.48 | AH41: AA- | AI41: 6.0599999999999994e-002 | AJ41: =H41+100*O41 -> 135.69999999999999 | AK41: 133.5 | AL41: 28 | AM41: 38.1 | AN41: 44 | AO41: 7.2999999999999995e-002 | AP41: 18 | AQ41: 维尔转债!
A42: 56 | B42: 113620 | C42: 傲农转债! | D42: 603363 | E42: 傲农生物 | F42: 农业 | G42: 畜牧业 | H42: 107.17 | I42: 2.5000000000000001e-003 | J42: 1.1000000000000001e-003 | K42: 8.36 | L42: 3.2099999999999997e-002 | M42: 121.1 | N42: 14.51 | O42: 0.85999999999999999 | P42: 57.62 | Q42: 13天 | R42: 5.51年 | S42: 3.52年 | T42: 10 | U42: 4 | V42: 4.0000000000000001e-003 | W42: 0.17499999999999999 | X42: 0.10099999999999999 | Y42: 57 | Z42: 2.28 | AA42: 2.2799999999999997e-002 | AB42: 1.61e-002 | AC42: -9.1999999999999998e-003 | AD42: -1.11e-002 | AE42: 89.38 | AF42: 97.26 | AG42: 0.11 | AH42: AA | AI42: 4.1299999999999996e-002 | AJ42: =H42+100*O42 -> 193.17000000000002 | AK42: 156.7 | AL42: 237 | AM42: 59.5 | AN42: 198 | AO42: -2.8999999999999998e-002 | AP42: 8 | AQ42: 傲农转债!
A43: 284 | B43: 127013 | C43: 创维转债! | D43: 810 | E43: 创维数字 | F43: 电子 | G43: 电子产品 | H43: 108.48 | I43: 4.4000000000000003e-003 | J43: -3.5999999999999999e-003 | K43: 7.86 | L43: 6.4000000000000003e-003 | M43: 117.3 | N43: 11.29 | O43: 0.55799999999999994 | P43: 69.62 | Q43: 转股中 | R43: 3.61年 | S43: 1.61年 | T43: 9.78 | U43: 5.5 | V43: 5.0000000000000001e-003 | W43: 0.11699999999999999 | X43: 8.1000000000000003e-002 | Y43: 84 | Z43: 1.96 | AA43: 2.23e-002 | AB43: 1.3600000000000001e-002 | AC43: -2.9999999999999999e-002 | AD43: -3.2899999999999999e-002 | AE43: 95.98 | AF43: 102.22 | AG43: 0.13 | AH43: AA | AI43: 3.9599999999999996e-002 | AJ43: =H43+100*O43 -> 164.28 | AK43: 147.3 | AL43: 163 | AM43: 45.1 | AN43: 97 | AO43: -1.3000000000000001e-002 | AP43: 23 | AQ43: 创维转债!
A44: 282 | B44: 128066 | C44: 亚泰转债! | D44: 2811 | E44: 郑中设计 | F44: 建筑 | G44: 装饰工程 | H44: 107.98 | I44: 9.1999999999999998e-003 | J44: -7.6e-003 | K44: 8.16 | L44: 3.7000000000000002e-003 | M44: 116.7 | N44: 9.27 | O44: 0.22699999999999998 | P44: 88.03 | Q44: 转股中 | R44: 3.62年 | S44: 1.62年 | T44: 4.8 | U44: 5.8 | V44: 1.1000000000000001e-002 | W44: 0.218 | X44: 0.192 | Y44: 22 | Z44: 1.6 | AA44: 2.2200000000000001e-002 | AB44: 1.38e-002 | AC44: -2.6099999999999998e-002 | AD44: -2.9300000000000003e-002 | AE44: 92.85 | AF44: 94.75 | AG44: 0.43 | AH44: AA- | AI44: 6.0599999999999994e-002 | AJ44: =H44+100*O44 -> 130.68000000000001 | AK44: 127.9 | AL44: 11 | AM44: 33.2 | AN44: 22 | AO44: 4.2999999999999997e-002 | AP44: 61 | AQ44: 亚泰转债!
A45: 240 | B45: 123039 | C45: 开润转债! | D45: 300577 | E45: 开润股份 | F45: 服装纺织 | G45: 纺织行业 | H45: 110.5 | I45: 8.199999999999999e-003 | J45: -1.8e-003 | K45: 19.55 | L45: 2.5699999999999997e-002 | M45: 121 | N45: 29.9 | O45: 0.68999999999999995 | P45: 65.38 | Q45: 转股中 | R45: 4.31年 | S45: 2.31年 | T45: 2.22 | U45: 12 | V45: 4.9000000000000002e-002 | W45: 4.7e-002 | X45: 3.1e-002 | Y45: 47 | Z45: 3.02 | AA45: 2.18e-002 | AB45: 1.32e-002 | AC45: -2.41e-002 | AD45: -2.7200000000000002e-002 | AE45: 87.88 | AF45: 90.49 | AG45: 0.25 | AH45: A+ | AI45: 7.1599999999999997e-002 | AJ45: =H45+100*O45 -> 179.5 | AK45: 155.6 | AL45: 229 | AM45: 65.1 | AN45: 238 | AO45: 0.11699999999999999 | AP45: 23 | AQ45: 开润转债!
A46: 289 | B46: 128063 | C46: 未来转债! | D46: 2631 | E46: 德尔未来 | F46: 其他 | G46: 家居用品 | H46: 118.498 | I46: -2.4700000000000003e-002 | J46: -1.1200000000000002e-002 | K46: 8.93 | L46: -7.0800000000000002e-002 | M46: 127.5 | N46: 8.6 | O46: 0.14099999999999999 | P46: 103.84 | Q46: 转股中 | R46: 3.58年 | S46: 2.58年 | T46: 6.29 | U46: 223 | V46: 0.29699999999999999 | W46: 0.106 | X46: 0.11 | Y46: 59 | Z46: 3.5 | AA46: 2.1299999999999999e-002 | AB46: 8.3999999999999995e-003 | AC46: -3.3300000000000003e-002 | AD46: -3.8599999999999995e-002 | AE46: 92.37 | AF46: 103.94 | AG46: 0.51 | AH46: AA- | AI46: 6.0599999999999994e-002 | AJ46: =H46+100*O46 -> 132.59800000000001 | AK46: 133.2 | AL46: 25 | AM46: 29.2 | AN46: 8 | AO46: 0.14699999999999999 | AP46: 34 | AQ46: 未来转债!
A47: 180 | B47: 128114 | C47: 正邦转债! | D47: 2157 | E47: 正邦科技 | F47: 农业 | G47: 畜牧业 | H47: 104.1 | I47: 4.7999999999999996e-003 | J47: -1.9e-003 | K47: 8.84 | L47: 2.7900000000000001e-002 | M47: 114.9 | N47: 14.76 | O47: 0.73799999999999999 | P47: 59.89 | Q47: 转股中 | R47: 4.78年 | S47: 2.79年 | T47: 16 | U47: 27 | V47: 1.7000000000000001e-002 | W47: 5.7000000000000002e-002 | X47: 3.4000000000000002e-002 | Y47: 278 | Z47: 1.44 | AA47: 2.12e-002 | AB47: 1.55e-002 | AC47: -2.3e-003 | AD47: -4.5000000000000005e-003 | AE47: 93.6 | AF47: 97.95 | AG47: 0.11 | AH47: AA+ | AI47: 3.4599999999999999e-002 | AJ47: =H47+100*O47 -> 177.89999999999998 | AK47: 148.3 | AL47: 175 | AM47: 50.4 | AN47: 140 | AO47: -4.2999999999999997e-002 | AP47: 18 | AQ47: 正邦转债!
A48: 157 | B48: 113037 | C48: 紫银转债! | D48: 601860 | E48: 紫金银行 | F48: 金融 | G48: 银行行业 | H48: 104.87 | I48: 5.3e-003 | J48: -4.1999999999999997e-003 | K48: 3.32 | L48: 3.0000000000000001e-003 | M48: 115.6 | N48: 4.05 | O48: 0.27899999999999997 | P48: 81.98 | Q48: 转股中 | R48: 4.88年 | S48: 无权 | T48: 45 | U48: 134 | V48: 2.7999999999999997e-002 | W48: 0.37 | X48: 0.30299999999999999 | Y48: 122 | Z48: 0.82 | AA48: 2.06e-002 | AB48: 1.47e-002 | AC48: 无权 | AD48: 无权 | AE48: 无权 | AF48: 98.25 | AG48: 0.35 | AH48: AA+ | AI48: 3.4599999999999999e-002 | AJ48: =H48+100*O48 -> 132.77000000000001 | AK48: 127.8 | AL48: 9 | AM48: 29.5 | AN48: 9 | AO48: 1.4999999999999999e-002 | AP48: 25 | AQ48: 紫银转债!
A49: 167 | B49: 127019 | C49: 国城转债! | D49: 688 | E49: 国城矿业 | F49: 有色金属 | G49: 锌铅镍锡 | H49: 104.5 | I49: 1.26e-002 | J49: -6.1999999999999998e-003 | K49: 12.6 | L49: 5.0000000000000003e-002 | M49: 114.8 | N49: 21.06 | O49: 0.747 | P49: 59.83 | Q49: 转股中 | R49: 4.86年 | S49: 2.86年 | T49: 8.5 | U49: 74 | V49: 8.3000000000000004e-002 | W49: 5.9000000000000004e-002 | X49: 3.5000000000000003e-002 | Y49: 143 | Z49: 6 | AA49: 1.9900000000000001e-002 | AB49: 1.43e-002 | AC49: -3.8e-003 | AD49: -5.8999999999999999e-003 | AE49: 91.92 | AF49: 95.37 | AG49: 0.13 | AH49: AA | AI49: 3.9599999999999996e-002 | AJ49: =H49+100*O49 -> 179.19999999999999 | AK49: 149.2 | AL49: 180 | AM49: 53.8 | AN49: 163 | AO49: 0.128 | AP49: 46 | AQ49: 国城转债!
A50: 371 | B50: 127003 | C50: 海印转债! | D50: 861 | E50: 海印股份 | F50: 商业零售 | G50: 商场 | H50: 108.395 | I50: 3.3e-003 | J50: -3.0000000000000001e-003 | K50: 2.14 | L50: 2.8799999999999999e-002 | M50: 110 | N50: 2.99 | O50: 0.51400000000000001 | P50: 71.57 | Q50: 转股中 | R50: 0.76年 | S50: 回售内 | T50: 6.74 | U50: 11 | V50: 1.4999999999999999e-002 | W50: 0.13500000000000001 | X50: 9.6999999999999989e-002 | Y50: 50 | Z50: 1.36 | AA50: 1.95e-002 | AB50: -4.7999999999999996e-003 | AC50: 回售内 | AD50: 回售内 | AE50: 100.33 | AF50: 107.08 | AG50: 0.01 | AH50: AA | AI50: 3.6000000000000004e-002 | AJ50: =H50+100*O50 -> 159.79499999999999 | AK50: 145.2 | AL50: 145 | AM50: 38.1 | AN50: 46 | AO50: 4.4000000000000004e-002 | AP50: 71 | AQ50: 海印转债!
A51: 28 | B51: 127034 | C51: 绿茵转债! | D51: 2887 | E51: 绿茵生态 | F51: 城市公用 | G51: 生态环境 | H51: 107.005 | I51: -8.9999999999999998e-004 | J51: -1.7000000000000001e-003 | K51: 10.67 | L51: -4.6999999999999993e-003 | M51: 119 | N51: 12.38 | O51: 0.24199999999999999 | P51: 86.19 | Q51: 2月9天 | R51: 5.65年 | S51: 3.66年 | T51: 7.12 | U51: 10 | V51: 1.3999999999999999e-002 | W51: 0.214 | X51: 0.184 | Y51: 33 | Z51: 1.65 | AA51: 1.9400000000000001e-002 | AB51: 1.34e-002 | AC51: -7.7000000000000002e-003 | AD51: -9.7000000000000003e-003 | AE51: 82.68 | AF51: 85.16 | AG51: 0.55 | AH51: AA- | AI51: 6.2300000000000001e-002 | AJ51: =H51+100*O51 -> 131.20499999999998 | AK51: 127.8 | AL51: 10 | AM51: 42.7 | AN51: 78 | AO51: 9.0000000000000011e-003 | AP51: 23 | AQ51: 绿茵转债!
A52: 318 | B52: 128049 | C52: 华源转债! | D52: 2787 | E52: 华源控股 | F52: 造纸包装 | G52: 包装材料 | H52: 107.9 | I52: 1.2e-002 | J52: -9.1999999999999998e-003 | K52: 5.8 | L52: 8.6999999999999994e-003 | M52: 114.5 | N52: 7.37 | O52: 0.371 | P52: 78.7 | Q52: 转股中 | R52: 3.23年 | S52: 1.23年 | T52: 3.63 | U52: 15 | V52: 3.7999999999999999e-002 | W52: 0.19800000000000001 | X52: 0.156 | Y52: 18 | Z52: 1.22 | AA52: 1.9e-002 | AB52: 1.0700000000000001e-002 | AC52: -3.4099999999999998e-002 | AD52: -3.7900000000000003e-002 | AE52: 94.78 | AF52: 95.08 | AG52: 0.32 | AH52: AA- | AI52: 6.0599999999999994e-002 | AJ52: =H52+100*O52 -> 145. | AK52: 137.1 | AL52: 60 | AM52: 42 | AN52: 73 | AO52: 5.5999999999999994e-002 | AP52: 42 | AQ52: 华源转债!
A53: 247 | B53: 128083 | C53: 新北转债! | D53: 2376 | E53: 新北洋 | F53: 电子 | G53: 电子产品 | H53: 106.189 | I53: 8.8999999999999999e-003 | J53: -5.7999999999999996e-003 | K53: 8.44 | L53: 1.32e-002 | M53: 114.9 | N53: 11.45 | O53: 0.441 | P53: 73.71 | Q53: 转股中 | R53: 4.27年 | S53: 2.27年 | T53: 8.77 | U53: 19 | V53: 2.1000000000000001e-002 | W53: 0.156 | X53: 0.115 | Y53: 56 | Z53: 1.69 | AA53: 1.9e-002 | AB53: 1.26e-002 | AC53: -1.1000000000000001e-002 | AD53: -1.3600000000000001e-002 | AE53: 94.15 | AF53: 97.68 | AG53: 0.24 | AH53: AA | AI53: 3.9599999999999996e-002 | AJ53: =H53+100*O53 -> 150.28899999999999 | AK53: 138.7 | AL53: 81 | AM53: 41 | AN53: 65 | AO53: 6.0000000000000001e-003 | AP53: 20 | AQ53: 新北转债!
A54: 217 | B54: 128100 | C54: 搜特转债! | D54: 2503. | E54: 搜于特 | F54: 服装纺织 | G54: 服装行业 | H54: 107.544 | I54: 7.4000000000000003e-003 | J54: -1.1599999999999999e-002 | K54: 1.59 | L54: -6.3e-003 | M54: 116.9 | N54: 1.62 | O54: 9.6000000000000002e-002 | P54: 98.15 | Q54: 转股中 | R54: 4.52年 | S54: 2.52年 | T54: 7.99 | U54: 47 | V54: 5.5e-002 | W54: 0.16300000000000001 | X54: 0.16 | Y54: 49 | Z54: 2.13 | AA54: 1.9e-002 | AB54: 1.2199999999999999e-002 | AC54: -1.46e-002 | AD54: -1.7000000000000001e-002 | AE54: 83.92 | AF54: 82.62 | AG54: 0.67 | AH54: A | AI54: 8.1600000000000006e-002 | AJ54: =H54+100*O54 -> 117.14399999999999 | AK54: 116.9 | AL54: 3 | AM54: 33 | AN54: 21 | AO54: 2.7999999999999997e-002 | AP54: 73 | AQ54: 搜特转债!
A55: 131 | B55: 128132 | C55: 交建转债! | D55: 2941 | E55: 新疆交建 | F55: 建筑 | G55: 建筑工程 | H55: 107.079 | I55: 1.4999999999999999e-002 | J55: -9.3999999999999986e-003 | K55: 13.36 | L55: 2.3e-002 | M55: 117.3 | N55: 18.53 | O55: 0.48499999999999999 | P55: 72.1 | Q55: 转股中 | R55: 5年11天 | S55: 3年12天 | T55: 8.49 | U55: 306 | V55: 0.33700000000000002 | W55: 9.9000000000000005e-002 | X55: 7.0999999999999994e-002 | Y55: 86 | Z55: 3.42 | AA55: 1.8700000000000001e-002 | AB55: 1.2500000000000001e-002 | AC55: -9.7999999999999997e-003 | AD55: -1.2e-002 | AE55: 91.34 | AF55: 96.11 | AG55: 0.24 | AH55: AA | AI55: 4.1299999999999996e-002 | AJ55: =H55+100*O55 -> 155.57900000000001 | AK55: 142.1 | AL55: 118 | AM55: 45.9 | AN55: 105 | AO55: 0.19 | AP55: 23 | AQ55: 交建转债!
A56: 149 | B56: 113597 | C56: 佳力转债! | D56: 603912 | E56: 佳力图 | F56: 机械装备 | G56: 专用设备 | H56: 113.99 | I56: 4.4000000000000003e-003 | J56: -7.4000000000000003e-003 | K56: 17.6 | L56: -8.5000000000000006e-003 | M56: 124 | N56: 23.15 | O56: 0.499 | P56: 76.03 | Q56: 转股中 | R56: 4.90年 | S56: 2.90年 | T56: 3 | U56: 25 | V56: 7.2000000000000008e-002 | W56: 7.9000000000000001e-002 | X56: 5.9999999999999998e-002 | Y56: 38 | Z56: 4.07 | AA56: 1.77e-002 | AB56: 9.300000000000001e-003 | AC56: -2.9900000000000003e-002 | AD56: -3.2300000000000002e-002 | AE56: 86.89 | AF56: 93.49 | AG56: 0.36 | AH56: AA- | AI56: 6.0599999999999994e-002 | AJ56: =H56+100*O56 -> 163.88999999999999 | AK56: 152 | AL56: 201 | AM56: 58.5 | AN56: 190 | AO56: 4.8000000000000001e-002 | AP56: 18 | AQ56: 佳力转债!
A57: 161 | B57: 113594 | C57: 淳中转债! | D57: 603516 | E57: 淳中科技 | F57: 电子 | G57: 电子产品 | H57: 111.25 | I57: 5.0000000000000001e-004 | J57: -7.000000000000001e-004 | K57: 18.49 | L57: -5.0000000000000001e-004 | M57: 120.9 | N57: 27.84 | O57: 0.67500000000000004 | P57: 66.42 | Q57: 转股中 | R57: 4.88年 | S57: 2.88年 | T57: 3 | U57: 0.8 | V57: 2.e-003 | W57: 8.6999999999999994e-002 | X57: 5.7999999999999996e-002 | Y57: 34 | Z57: 3.65 | AA57: 1.7600000000000001e-002 | AB57: 1.01e-002 | AC57: -2.1899999999999999e-002 | AD57: -2.4300000000000002e-002 | AE57: 84.48 | AF57: 86.93 | AG57: 0.32 | AH57: A+ | AI57: 7.1599999999999997e-002 | AJ57: =H57+100*O57 -> 178.75 | AK57: 156.1 | AL57: 234 | AM57: 69.2 | AN57: 257 | AO57: -3.1e-002 | AP57: 9 | AQ57: 淳中转债!
A58: 307 | B58: 128056 | C58: 今飞转债! | D58: 2863 | E58: 今飞凯达 | F58: 汽车 | G58: 零部件制 | H58: 113.3 | I58: 2.5000000000000001e-003 | J58: 7.4999999999999997e-003 | K58: 5.23 | L58: 2.9500000000000002e-002 | M58: 120.2 | N58: 6.69 | O58: 0.44900000000000001 | P58: 78.18 | Q58: 转股中 | R58: 3.49年 | S58: 1.49年 | T58: 1.72 | U58: 10 | V58: 5.2000000000000005e-002 | W58: 6.6000000000000003e-002 | X58: 5.2000000000000005e-002 | Y58: 26 | Z58: 1.38 | AA58: 1.7500000000000002e-002 | AB58: 7.3000000000000001e-003 | AC58: -5.45e-002 | AD58: -5.8099999999999999e-002 | AE58: 92.3 | AF58: 94.97 | AG58: 0.34 | AH58: A+ | AI58: 7.1599999999999997e-002 | AJ58: =H58+100*O58 -> 158.19999999999999 | AK58: 148.4 | AL58: 176 | AM58: 53.4 | AN58: 161 | AO58: 1.7000000000000001e-002 | AP58: 52 | AQ58: 今飞转债!
A59: 133 | B59: 123065 | C59: 宝莱转债! | D59: 300246 | E59: 宝莱特 | F59: 医药 | G59: 医疗器械 | H59: 111.688 | I59: 4.1999999999999997e-003 | J59: -3.5999999999999999e-003 | K59: 16.23 | L59: 1.8200000000000001e-002 | M59: 121.4 | N59: 40.14 | O59: 1.76 | P59: 40.43 | Q59: 转股中 | R59: 5年0.1天 | S59: 3年1.1天 | T59: 2.19 | U59: 6.4 | V59: 2.6000000000000002e-002 | W59: 9.1999999999999998e-002 | X59: 3.7000000000000005e-002 | Y59: 24 | Z59: 2.76 | AA59: 1.72e-002 | AB59: 9.7000000000000003e-003 | AC59: -2.1499999999999998e-002 | AD59: -2.41e-002 | AE59: 86.35 | AF59: 90.4 | AG59: 0.03 | AH59: AA- | AI59: 6.2300000000000001e-002 | AJ59: =H59+100*O59 -> 287.68799999999999 | AK59: 182.9 | AL59: 308 | AM59: 92.5 | AN59: 312 | AO59: -1.1000000000000001e-002 | AP59: 18 | AQ59: 宝莱转债!
A60: 170 | B60: 113036 | C60: 宁建转债! | D60: 601789 | E60: 宁波建工 | F60: 建筑 | G60: 建筑工程 | H60: 107.88 | I60: -1.8e-003 | J60: -1.7000000000000001e-003 | K60: 3.87 | L60: -1.0200000000000001e-002 | M60: 116.9 | N60: 4.76 | O60: 0.32700000000000001 | P60: 81.3 | Q60: 转股中 | R60: 4.84年 | S60: 2.84年 | T60: 5.4 | U60: 8.7 | V60: 1.4999999999999999e-002 | W60: 0.14300000000000002 | X60: 0.11599999999999999 | Y60: 38 | Z60: 1.19 | AA60: 1.7100000000000001e-002 | AB60: 1.0800000000000001e-002 | AC60: -1.41e-002 | AD60: -1.6299999999999999e-002 | AE60: 92.1 | AF60: 97.22 | AG60: 0.33 | AH60: AA | AI60: 3.9599999999999996e-002 | AJ60: =H60+100*O60 -> 140.57999999999998 | AK60: 134.5 | AL60: 33 | AM60: 37.2 | AN60: 38 | AO60: 7.400000000000001e-002 | AP60: 11 | AQ60: 宁建转债!
A61: 126 | B61: 113604 | C61: 多伦转债! | D61: 603528 | E61: 多伦科技 | F61: 计算机及 | G61: 软件开发 | H61: 107.8 | I61: 3.5999999999999999e-003 | J61: -1.5e-003 | K61: 7.67 | L61: 5.1999999999999998e-003 | M61: 117.3 | N61: 10.4 | O61: 0.46200000000000002 | P61: 73.75 | Q61: 转股中 | R61: 5年39天 | S61: 3年40天 | T61: 6.4 | U61: 7.7 | V61: 1.1000000000000001e-002 | W61: 0.13300000000000001 | X61: 9.8000000000000004e-002 | Y61: 48 | Z61: 2.92 | AA61: 1.7000000000000001e-002 | AB61: 1.09e-002 | AC61: -1.1599999999999999e-002 | AD61: -1.38e-002 | AE61: 85.35 | AF61: 86.73 | AG61: 0.4 | AH61: AA- | AI61: 6.2300000000000001e-002 | AJ61: =H61+100*O61 -> 154. | AK61: 141.9 | AL61: 115 | AM61: 55.1 | AN61: 177 | AO61: -4.8000000000000001e-002 | AP61: 7 | AQ61: 多伦转债!
A62: 104 | B62: 123076 | C62: 强力转债! | D62: 300429 | E62: 强力新材 | F62: 化工 | G62: 化工 | H62: 108.81 | I62: 6.5000000000000006e-003 | J62: 4.0000000000000002e-004 | K62: 12.93 | L62: 2.1299999999999999e-002 | M62: 118.5 | N62: 18.94 | O62: 0.59399999999999997 | P62: 68.27 | Q62: 转股中 | R62: 5.21年 | S62: 3.21年 | T62: 8.5 | U62: 6.3 | V62: 6.9999999999999993e-003 | W62: 0.128 | X62: 8.6999999999999994e-002 | Y62: 67 | Z62: 3.74 | AA62: 1.6899999999999998e-002 | AB62: 1.0500000000000001e-002 | AC62: -1.3899999999999999e-002 | AD62: -1.6e-002 | AE62: 84.86 | AF62: 87.09 | AG62: 0.32 | AH62: AA- | AI62: 6.2300000000000001e-002 | AJ62: =H62+100*O62 -> 168.21000000000001 | AK62: 149.4 | AL62: 181 | AM62: 62.3 | AN62: 222 | AO62: -6.2e-002 | AP62: 17 | AQ62: 强力转债!
A63: 206 | B63: 128105 | C63: 长集转债! | D63: 2616 | E63: 长青集团 | F63: 城市公用 | G63: 三废处理 | H63: 106.65 | I63: 5.5000000000000005e-003 | J63: -3.8e-003 | K63: 5.72 | L63: 6.9999999999999993e-003 | M63: 114.9 | N63: 7.91 | O63: 0.47499999999999998 | P63: 72.31 | Q63: 转股中 | R63: 4.59年 | S63: 2.60年 | T63: 8 | U63: 4.2 | V63: 5.0000000000000001e-003 | W63: 0.188 | X63: 0.13600000000000001 | Y63: 42 | Z63: 1.67 | AA63: 1.67e-002 | AB63: 1.0700000000000001e-002 | AC63: -1.1200000000000002e-002 | AD63: -1.3600000000000001e-002 | AE63: 92.97 | AF63: 96.46 | AG63: 0.24 | AH63: AA | AI63: 3.9599999999999996e-002 | AJ63: =H63+100*O63 -> 154.15000000000001 | AK63: 141 | AL63: 103 | AM63: 44.5 | AN63: 89 | AO63: -8.5999999999999993e-002 | AP63: 17 | AQ63: 长集转债!
A64: 209 | B64: 113033 | C64: 利群转债! | D64: 601366 | E64: 利群股份 | F64: 商业零售 | G64: 商场 | H64: 106.78 | I64: 3.7000000000000002e-003 | J64: -4.4000000000000003e-003 | K64: 6.34 | L64: -1.6000000000000001e-003 | M64: 114.9 | N64: 7.01 | O64: 0.18100000000000002 | P64: 90.44 | Q64: 转股中 | R64: 4.57年 | S64: 2.58年 | T64: 18 | U64: 14 | V64: 6.9999999999999993e-003 | W64: 0.33000000000000002 | X64: 0.29799999999999999 | Y64: 55 | Z64: 1.27 | AA64: 1.6500000000000001e-002 | AB64: 1.0500000000000001e-002 | AC64: -1.1699999999999999e-002 | AD64: -1.41e-002 | AE64: 93.05 | AF64: 96.54 | AG64: 0.45 | AH64: AA | AI64: 3.9599999999999996e-002 | AJ64: =H64+100*O64 -> 124.88 | AK64: 123.1 | AL64: 5 | AM64: 26.6 | AN64: 5 | AO64: -1.3000000000000001e-002 | AP64: 64 | AQ64: 利群转债!
A65: 84 | B65: 113044 | C65: 大秦转债! | D65: 601006 | E65: 大秦铁路 | F65: 铁路 | G65: 铁路运输 | H65: 105.08 | I65: 4.8999999999999998e-003 | J65: -7.4999999999999997e-003 | K65: 6.17 | L65: -6.4000000000000003e-003 | M65: 114.1 | N65: 7.18 | O65: 0.223 | P65: 85.93 | Q65: 转股中 | R65: 5.28年 | S65: 3.28年 | T65: 320 | U65: 430 | V65: 1.3000000000000001e-002 | W65: 0.34899999999999998 | X65: 0.29999999999999999 | Y65: 917 | Z65: 0.78 | AA65: 1.61e-002 | AB65: 1.11e-002 | AC65: -3.2000000000000002e-003 | AD65: -5.4000000000000003e-003 | AE65: 92.63 | AF65: 95.85 | AG65: 0.41 | AH65: AAA | AI65: 3.4300000000000004e-002 | AJ65: =H65+100*O65 -> 127.38 | AK65: 124.2 | AL65: 6 | AM65: 28.4 | AN65: 7 | AO65: 3.5000000000000003e-002 | AP65: 19 | AQ65: 大秦转债!
A66: 290 | B66: 113532 | C66: 海环转债! | D66: 603817 | E66: 海峡环保 | F66: 城市公用 | G66: 三废处理 | H66: 106.21 | I66: -4.8999999999999998e-003 | J66: 4.8999999999999998e-003 | K66: 5.87 | L66: 0. | M66: 112.3 | N66: 7.63 | O66: 0.38100000000000001 | P66: 76.93 | Q66: 转股中 | R66: 3.58年 | S66: 1.58年 | T66: 4.59 | U66: 4.7 | V66: 1.e-002 | W66: 0.17399999999999999 | X66: 0.13400000000000001 | Y66: 26 | Z66: 1.48 | AA66: 1.6e-002 | AB66: 9.5999999999999992e-003 | AC66: -1.8700000000000001e-002 | AD66: -2.1700000000000001e-002 | AE66: 96.12 | AF66: 98.01 | AG66: 0.25 | AH66: AA | AI66: 3.9599999999999996e-002 | AJ66: =H66+100*O66 -> 144.31 | AK66: 135.5 | AL66: 43 | AM66: 37.5 | AN66: 39 | AO66: 3.7999999999999999e-002 | AP66: 27 | AQ66: 海环转债!
A67: 185 | B67: 123053 | C67: 宝通转债! | D67: 300031 | E67: 宝通科技 | F67: 通信互联 | G67: 互联网 | H67: 112.685 | I67: -8.1000000000000013e-003 | J67: -1.15e-002 | K67: 16.77 | L67: -4.5499999999999999e-002 | M67: 120.8 | N67: 20.5 | O67: 0.377 | P67: 81.8 | Q67: 转股中 | R67: 4.75年 | S67: 2.75年 | T67: 5 | U67: 185 | V67: 0.32799999999999996 | W67: 7.4999999999999997e-002 | X67: 6.0999999999999999e-002 | Y67: 67 | Z67: 2.16 | AA67: 1.5100000000000001e-002 | AB67: 7.4000000000000003e-003 | AC67: -2.8199999999999999e-002 | AD67: -3.0600000000000002e-002 | AE67: 87.5 | AF67: 91.89 | AG67: 0.43 | AH67: AA- | AI67: 6.0599999999999994e-002 | AJ67: =H67+100*O67 -> 150.38499999999999 | AK67: 143.6 | AL67: 133 | AM67: 51.7 | AN67: 150 | AO67: 0.17999999999999999 | AP67: 11 | AQ67: 宝通转债!
A68: 154 | B68: 128123 | C68: 国光转债! | D68: 2749 | E68: 国光股份 | F68: 化工 | G68: 农化 | H68: 107.7 | I68: -1.e-003 | J68: 4.5999999999999999e-003 | K68: 9.35 | L68: 1.0800000000000001e-002 | M68: 115.7 | N68: 13.48 | O68: 0.55299999999999994 | P68: 69.36 | Q68: 转股中 | R68: 4.89年 | S68: 2.90年 | T68: 3.2 | U68: 4.5 | V68: 1.3000000000000001e-002 | W68: 7.8e-002 | X68: 5.4000000000000006e-002 | Y68: 41 | Z68: 3.23 | AA68: 1.5100000000000001e-002 | AB68: 9.1999999999999998e-003 | AC68: -1.26e-002 | AD68: -1.49e-002 | AE68: 86.68 | AF68: 87.28 | AG68: 0.33 | AH68: AA- | AI68: 6.0599999999999994e-002 | AJ68: =H68+100*O68 -> 163. | AK68: 146 | AL68: 155 | AM68: 58.8 | AN68: 193 | AO68: 3.7999999999999999e-002 | AP68: 12 | AQ68: 国光转债!
A69: 83 | B69: 123088 | C69: 威唐转债! | D69: 300707 | E69: 威唐工业 | F69: 汽车 | G69: 零部件制 | H69: 112.896 | I69: 1.e-003 | J69: 5.1000000000000004e-003 | K69: 17.37 | L69: 1.11e-002 | M69: 121.6 | N69: 20.72 | O69: 0.34700000000000003 | P69: 83.83 | Q69: 转股中 | R69: 5.28年 | S69: 3.28年 | T69: 3.01 | U69: 9.6 | V69: 2.7999999999999997e-002 | W69: 0.11 | X69: 9.3000000000000013e-002 | Y69: 27 | Z69: 3.92 | AA69: 1.4499999999999999e-002 | AB69: 7.4000000000000003e-003 | AC69: -2.2099999999999998e-002 | AD69: -2.46e-002 | AE69: 82.23 | AF69: 84.5 | AG69: 0.55 | AH69: A+ | AI69: 7.3300000000000004e-002 | AJ69: =H69+100*O69 -> 147.596 | AK69: 142 | AL69: 117 | AM69: 57.5 | AN69: 187 | AO69: -2.5000000000000001e-002 | AP69: 16 | AQ69: 威唐转债!
A70: 146 | B70: 113599 | C70: 嘉友转债! | D70: 603871 | E70: 嘉友国际 | F70: 交通运输 | G70: 物流业 | H70: 117.37 | I70: 2.1600000000000001e-002 | J70: 6.8000000000000005e-003 | K70: 17.23 | L70: 5.5099999999999996e-002 | M70: 125.6 | N70: 18.32 | O70: 0.248 | P70: 94.05 | Q70: 转股中 | R70: 4.92年 | S70: 2.92年 | T70: 7.2 | U70: 20 | V70: 2.3e-002 | W70: 0.14599999999999999 | X70: 0.13800000000000001 | Y70: 49 | Z70: 2.47 | AA70: 1.41e-002 | AB70: 5.4000000000000003e-003 | AC70: -4.0099999999999997e-002 | AD70: -4.2199999999999994e-002 | AE70: 86.45 | AF70: 94.55 | AG70: 0.52 | AH70: AA- | AI70: 6.0599999999999994e-002 | AJ70: =H70+100*O70 -> 142.17000000000002 | AK70: 140.7 | AL70: 100 | AM70: 46.1 | AN70: 107 | AO70: 2.7999999999999997e-002 | AP70: 20 | AQ70: 嘉友转债!
A71: 232 | B71: 113563 | C71: 柳药转债! | D71: 603368 | E71: 柳药股份 | F71: 医药 | G71: 医药商业 | H71: 106.41 | I71: 4.0000000000000001e-003 | J71: -1.2999999999999999e-003 | K71: 16.65 | L71: 1.34e-002 | M71: 112.9 | N71: 23.87 | O71: 0.52600000000000002 | P71: 69.75 | Q71: 转股中 | R71: 4.37年 | S71: 2.37年 | T71: 8.02 | U71: 13 | V71: 1.4999999999999999e-002 | W71: 0.13300000000000001 | X71: 9.3000000000000013e-002 | Y71: 60 | Z71: 1.19 | AA71: 1.3899999999999999e-002 | AB71: 8.3999999999999995e-003 | AC71: -1.1399999999999999e-002 | AD71: -1.3899999999999999e-002 | AE71: 93.8 | AF71: 95.63 | AG71: 0.2 | AH71: AA | AI71: 3.9599999999999996e-002 | AJ71: =H71+100*O71 -> 159.00999999999999 | AK71: 143.1 | AL71: 128 | AM71: 47.4 | AN71: 117 | AO71: -7.8e-002 | AP71: 16 | AQ71: 柳药转债!
A72: 356 | B72: 128022 | C72: 众信转债! | D72: 2707 | E72: 众信旅游 | F72: 旅游餐饮 | G72: 旅游 | H72: 105.582 | I72: 1.e-003 | J72: -1.e-003 | K72: 5.19 | L72: 0. | M72: 108.8 | N72: 7.92 | O72: 0.61099999999999999 | P72: 65.53 | Q72: 转股中 | R72: 2.24年 | S72: 0.24年 | T72: 4.56 | U72: 8.9 | V72: 1.9e-002 | W72: 9.6999999999999989e-002 | X72: 6.3e-002 | Y72: 47 | Z72: 7.85 | AA72: 1.37e-002 | AB72: 6.1999999999999998e-003 | AC72: -0.10199999999999999 | AD72: -0.109 | AE72: 98.4 | AF72: 91.77 | AG72: 0 | AH72: A | AI72: 8.0299999999999996e-002 | AJ72: =H72+100*O72 -> 166.68199999999999 | AK72: 145.6 | AL72: 150 | AM72: 47.2 | AN72: 115 | AO72: 8.199999999999999e-002 | AP72: 34 | AQ72: 众信转债!
A73: 111 | B73: 110076 | C73: 华海转债! | D73: 600521 | E73: 华海药业 | F73: 医药 | G73: 医药行业 | H73: 107.51 | I73: 5.8999999999999999e-003 | J73: -3.0000000000000001e-003 | K73: 17.23 | L73: 4.1700000000000001e-002 | M73: 115.1 | N73: 33.85 | O73: 1.1100000000000001 | P73: 50.9 | Q73: 转股中 | R73: 5年59天 | S73: 3.16年 | T73: 18.4 | U73: 11 | V73: 6.0000000000000001e-003 | W73: 7.2000000000000008e-002 | X73: 3.6000000000000004e-002 | Y73: 257 | Z73: 3.95 | AA73: 1.3600000000000001e-002 | AB73: 8.199999999999999e-003 | AC73: -1.11e-002 | AD73: -1.32e-002 | AE73: 90.66 | AF73: 93.78 | AG73: 0.07 | AH73: AA | AI73: 4.1299999999999996e-002 | AJ73: =H73+100*O73 -> 218.51000000000002 | AK73: 164.1 | AL73: 266 | AM73: 70.3 | AN73: 261 | AO73: -2.7000000000000003e-002 | AP73: 8 | AQ73: 华海转债!
A74: 352 | B74: 123004 | C74: 铁汉转债! | D74: 300197 | E74: 节能铁汉 | F74: 城市公用 | G74: 生态环境 | H74: 105.581 | I74: -3.0000000000000001e-003 | J74: 3.0000000000000001e-003 | K74: 2.94 | L74: 0. | M74: 108.8 | N74: 3.82 | O74: 0.37200000000000005 | P74: 76.96 | Q74: 转股中 | R74: 2.29年 | S74: 0.29年 | T74: 8.03 | U74: 10 | V74: 1.2e-002 | W74: 9.6999999999999989e-002 | X74: 7.400000000000001e-002 | Y74: 83 | Z74: 1.3 | AA74: 1.34e-002 | AB74: 6.0999999999999995e-003 | AC74: -8.199999999999999e-002 | AD74: -8.8100000000000012e-002 | AE74: 99.83 | AF74: 99.97 | AG74: 0.14 | AH74: AA | AI74: 3.8300000000000001e-002 | AJ74: =H74+100*O74 -> 142.78100000000001 | AK74: 134.2 | AL74: 32 | AM74: 34.2 | AN74: 24 | AO74: 2.7000000000000003e-002 | AP74: 46 | AQ74: 铁汉转债!
A75: 68 | B75: 113619 | C75: 世运转债! | D75: 603920 | E75: 世运电路 | F75: 电子 | G75: 元器件制 | H75: 108 | I75: 5.6999999999999993e-003 | J75: 6.9999999999999993e-003 | K75: 14.03 | L75: 4.7e-002 | M75: 115.2 | N75: 19.92 | O75: 0.53299999999999992 | P75: 70.43 | Q75: 转股中 | R75: 5.38年 | S75: 3.38年 | T75: 10 | U75: 18 | V75: 1.7000000000000001e-002 | W75: 0.13400000000000001 | X75: 9.4e-002 | Y75: 75 | Z75: 2.95 | AA75: 1.23e-002 | AB75: 7.1999999999999998e-003 | AC75: -1.15e-002 | AD75: -1.3500000000000002e-002 | AE75: 89.96 | AF75: 93.06 | AG75: 0.27 | AH75: AA | AI75: 4.1299999999999996e-002 | AJ75: =H75+100*O75 -> 161.29999999999998 | AK75: 145.6 | AL75: 148 | AM75: 52.5 | AN75: 156 | AO75: 7.2000000000000008e-002 | AP75: 5 | AQ75: 世运转债!
A76: 228 | B76: 113565 | C76: 宏辉转债 | D76: 603336 | E76: 宏辉果蔬 | F76: 农业 | G76: 农产品加 | H76: 111.69 | I76: 4.5000000000000005e-003 | J76: 4.3e-003 | K76: 6.57 | L76: 1.8600000000000002e-002 | M76: 117.8 | N76: 7.64 | O76: 0.29899999999999999 | P76: 85.99 | Q76: 转股中 | R76: 4.48年 | S76: 2.48年 | T76: 2.25 | U76: 15 | V76: 5.9000000000000004e-002 | W76: 7.8e-002 | X76: 6.7000000000000004e-002 | Y76: 29 | Z76: 2.8 | AA76: 1.2199999999999999e-002 | AB76: 5.1000000000000004e-003 | AC76: -2.7900000000000001e-002 | AD76: -3.0499999999999999e-002 | AE76: 88.92 | AF76: 91.07 | AG76: 0.47 | AH76: AA- | AI76: 6.0599999999999994e-002 | AJ76: =H76+100*O76 -> 141.59 | AK76: 137.4 | AL76: 65 | AM76: 46.3 | AN76: 108 | AO76: -2.9999999999999999e-002 | AP76: 26 | AQ76: 宏辉转债
A77: 145 | B77: 127021 | C77: 特发转2! | D77: 70 | E77: 特发信息 | F77: 通信互联 | G77: 通信设备 | H77: 107.916 | I77: 5.1000000000000004e-003 | J77: -5.1999999999999998e-003 | K77: 7.54 | L77: -1.2999999999999999e-003 | M77: 113 | N77: 12.33 | O77: 0.76500000000000001 | P77: 61.15 | Q77: 转股中 | R77: 3.92年 | S77: 1.93年 | T77: 5.5 | U77: 3.5 | V77: 6.0000000000000001e-003 | W77: 8.8000000000000009e-002 | X77: 5.4000000000000006e-002 | Y77: 62 | Z77: 2.12 | AA77: 1.1899999999999999e-002 | AB77: 5.8999999999999999e-003 | AC77: -2.7799999999999998e-002 | AD77: -2.9399999999999999e-002 | AE77: 93.84 | AF77: 97.19 | AG77: 0.1 | AH77: AA | AI77: 3.9599999999999996e-002 | AJ77: =H77+100*O77 -> 184.416 | AK77: 154.7 | AL77: 218 | AM77: 57.5 | AN77: 188 | AO77: 2.3e-002 | AP77: 13 | AQ77: 特发转2!
A78: 333 | B78: 123010 | C78: 博世转债! | D78: 300422 | E78: 博世科 | F78: 城市公用 | G78: 三废处理 | H78: 107.9 | I78: 1.e-004 | J78: -1.6000000000000001e-003 | K78: 9.51 | L78: -5.1999999999999998e-003 | M78: 111.3 | N78: 12.15 | O78: 0.379 | P78: 78.27 | Q78: 转股中 | R78: 2.83年 | S78: 0.84年 | T78: 4.3 | U78: 18 | V78: 3.9e-002 | W78: 0.111 | X78: 8.6999999999999994e-002 | Y78: 39 | Z78: 1.57 | AA78: 1.1200000000000002e-002 | AB78: 3.8e-003 | AC78: -5.6500000000000002e-002 | AD78: -5.9900000000000002e-002 | AE78: 96.1 | AF78: 94.77 | AG78: 0.29 | AH78: AA- | AI78: 5.9299999999999999e-002 | AJ78: =H78+100*O78 -> 145.80000000000001 | AK78: 137.5 | AL78: 67 | AM78: 41.4 | AN78: 67 | AO78: 4.0999999999999995e-002 | AP78: 30 | AQ78: 博世转债!
A79: 244 | B79: 128087 | C79: 孚日转债! | D79: 2083 | E79: 孚日股份 | F79: 服装纺织 | G79: 家纺 | H79: 107.74 | I79: 9.4999999999999998e-003 | J79: -3.9000000000000003e-003 | K79: 4.2 | L79: 9.5999999999999992e-003 | M79: 112.9 | N79: 4.5 | O79: 0.154 | P79: 93.33 | Q79: 转股中 | R79: 4.29年 | S79: 2.29年 | T79: 6.5 | U79: 21 | V79: 2.9999999999999999e-002 | W79: 0.17000000000000001 | X79: 0.159 | Y79: 38 | Z79: 1.03 | AA79: 1.1200000000000002e-002 | AB79: 5.6000000000000008e-003 | AC79: -1.6799999999999999e-002 | AD79: -1.9400000000000001e-002 | AE79: 89.64 | AF79: 88.23 | AG79: 0.58 | AH79: AA- | AI79: 6.0599999999999994e-002 | AJ79: =H79+100*O79 -> 123.14 | AK79: 122.1 | AL79: 4 | AM79: 32.5 | AN79: 18 | AO79: 3.4000000000000002e-002 | AP79: 71 | AQ79: 孚日转债!
A80: 151 | B80: 128124 | C80: 科华转债! | D80: 2022 | E80: 科华生物 | F80: 医药 | G80: 生物制药 | H80: 104.35 | I80: 2.9999999999999997e-004 | J80: 2.e-003 | K80: 13.38 | L80: 1.29e-002 | M80: 110 | N80: 21.3 | O80: 0.66099999999999992 | P80: 62.82 | Q80: 转股中 | R80: 4.90年 | S80: 2.90年 | T80: 7.38 | U80: 8.2 | V80: 1.1000000000000001e-002 | W80: 0.107 | X80: 6.7000000000000004e-002 | Y80: 69 | Z80: 2.04 | AA80: 1.1000000000000001e-002 | AB80: 7.0999999999999995e-003 | AC80: -5.0000000000000001e-003 | AD80: -6.8000000000000005e-003 | AE80: 91.29 | AF80: 91.22 | AG80: 0.18 | AH80: AA | AI80: 3.9599999999999996e-002 | AJ80: =H80+100*O80 -> 170.44999999999999 | AK80: 145.9 | AL80: 154 | AM80: 54.6 | AN80: 173 | AO80: -1.9e-002 | AP80: 22 | AQ80: 科华转债!
A81: 283 | B81: 110058 | C81: 永鼎转债! | D81: 600105 | E81: 永鼎股份 | F81: 通信互联 | G81: 通信设备 | H81: 110 | I81: 9.4999999999999998e-003 | J81: -2.9999999999999997e-004 | K81: 3.79 | L81: 2.9900000000000003e-002 | M81: 114.3 | N81: 5.04 | O81: 0.46299999999999997 | P81: 75.2 | Q81: 转股中 | R81: 3.61年 | S81: 1.62年 | T81: 2.61 | U81: 12 | V81: 4.2000000000000003e-002 | W81: 5.0000000000000003e-002 | X81: 3.7999999999999999e-002 | Y81: 52 | Z81: 1.87 | AA81: 1.09e-002 | AB81: 3.7000000000000002e-003 | AC81: -3.7499999999999999e-002 | AD81: -4.0399999999999998e-002 | AE81: 92.64 | AF81: 92.79 | AG81: 0.31 | AH81: AA- | AI81: 6.0599999999999994e-002 | AJ81: =H81+100*O81 -> 156.30000000000001 | AK81: 144.8 | AL81: 143 | AM81: 52 | AN81: 153 | AO81: 5.4000000000000006e-002 | AP81: 47 | AQ81: 永鼎转债!
A82: 69 | B82: 123093 | C82: 金陵转债! | D82: 300651 | E82: 金陵体育 | F82: 其他 | G82: 文化教育 | H82: 122.5 | I82: 1.84e-002 | J82: -4.6999999999999993e-003 | K82: 31.1 | L82: 4.6799999999999994e-002 | M82: 129.3 | N82: 49.19 | O82: 0.93799999999999994 | P82: 63.22 | Q82: 转股中 | R82: 5.38年 | S82: 3.38年 | T82: 2.5 | U82: 562 | V82: 1.78 | W82: 6.2e-002 | X82: 3.9e-002 | Y82: 40 | Z82: 5.81 | AA82: 1.04e-002 | AB82: 1.5e-003 | AC82: -3.95e-002 | AD82: -4.2699999999999995e-002 | AE82: 83.11 | AF82: 89.44 | AG82: 0.29 | AH82: A+ | AI82: 7.3300000000000004e-002 | AJ82: =H82+100*O82 -> 216.30000000000001 | AK82: 181.8 | AL82: 305 | AM82: 92.3 | AN82: 311 | AO82: -3.7999999999999999e-002 | AP82: 7 | AQ82: 金陵转债!
A83: 219 | B83: 123044 | C83: 红相转债!! | D83: 300427 | E83: 红相股份 | F83: 能源电力 | G83: 电力设备 | H83: 119.7 | I83: 1.7000000000000001e-002 | J83: 7.6e-003 | K83: 16.5 | L83: 5.4299999999999994e-002 | M83: 125 | N83: 18.67 | O83: 0.35399999999999998 | P83: 88.38 | Q83: 转股中 | R83: 4.52年 | S83: 2.52年 | T83: 5.5 | U83: 113 | V83: 0.17199999999999999 | W83: 9.1999999999999998e-002 | X83: 8.199999999999999e-002 | Y83: 59 | Z83: 2.54 | AA83: 9.8999999999999991e-003 | AB83: 5.9999999999999995e-004 | AC83: -4.9800000000000004e-002 | AD83: -5.28e-002 | AE83: 89.4 | AF83: 96.49 | AG83: 0.45 | AH83: AA- | AI83: 6.0599999999999994e-002 | AJ83: =H83+100*O83 -> 155.09999999999999 | AK83: 151 | AL83: 197 | AM83: 54.5 | AN83: 171 | AO83: 5.2000000000000005e-002 | AP83: 22 | AQ83: 红相转债!!
A84: 237 | B84: 113561 | C84: 正裕转债! | D84: 603089 | E84: 正裕工业 | F84: 汽车 | G84: 零部件制 | H84: 113.3 | I84: 1.8e-003 | J84: -1.1999999999999999e-003 | K84: 8.61 | L84: 1.1999999999999999e-003 | M84: 118 | N84: 10.08 | O84: 0.32600000000000001 | P84: 85.42 | Q84: 转股中 | R84: 4.32年 | S84: 2.33年 | T84: 1.5 | U84: 4.9 | V84: 2.8999999999999998e-002 | W84: 7.8e-002 | X84: 6.7000000000000004e-002 | Y84: 19 | Z84: 1.87 | AA84: 9.7000000000000003e-003 | AB84: 2.3e-003 | AC84: -3.3599999999999998e-002 | AD84: -3.6600000000000001e-002 | AE84: 87.88 | AF84: 88.2 | AG84: 0.52 | AH84: A+ | AI84: 7.1599999999999997e-002 | AJ84: =H84+100*O84 -> 145.90000000000001 | AK84: 141.2 | AL84: 108 | AM84: 53 | AN84: 158 | AO84: -5.2999999999999999e-002 | AP84: 36 | AQ84: 正裕转债!
A85: 119 | B85: 123072 | C85: 乐歌转债! | D85: 300729 | E85: 乐歌股份 | F85: 其他 | G85: 家居用品 | H85: 123.901 | I85: 8.0000000000000004e-004 | J85: -8.0000000000000004e-004 | K85: 21.89 | L85: 0. | M85: 129.6 | N85: 56.12 | O85: 2.1800000000000002 | P85: 39.01 | Q85: 转股中 | R85: 5年47天 | S85: 3年48天 | T85: 1.42 | U85: 20 | V85: 0.113 | W85: 3.6000000000000004e-002 | X85: 1.3999999999999999e-002 | Y85: 40 | Z85: 3.76 | AA85: 9.1000000000000004e-003 | AB85: -4.0000000000000002e-004 | AC85: -4.4999999999999998e-002 | AD85: -4.8600000000000004e-002 | AE85: 84.83 | AF85: 91.27 | AG85: 0.03 | AH85: A+ | AI85: 7.3300000000000004e-002 | AJ85: =H85+100*O85 -> 341.90100000000001 | AK85: 208.8 | AL85: 330 | AM85: 117.5 | AN85: 333 | AO85: 0. | AP85: 9 | AQ85: 乐歌转债!
A86: 260 | B86: 113546 | C86: 迪贝转债! | D86: 603320 | E86: 迪贝电气 | F86: 家电 | G86: 零部件制 | H86: 116.31 | I86: 4.5999999999999999e-003 | J86: -2.e-003 | K86: 13.34 | L86: 4.5000000000000005e-003 | M86: 120.6 | N86: 14 | O86: 0.221 | P86: 95.29 | Q86: 转股中 | R86: 4年49天 | S86: 2年50天 | T86: 2.3 | U86: 17 | V86: 6.3e-002 | W86: 0.13300000000000001 | X86: 0.126 | Y86: 17 | Z86: 2.43 | AA86: 9.0000000000000011e-003 | AB86: 4.0000000000000002e-004 | AC86: -4.8300000000000003e-002 | AD86: -5.1399999999999994e-002 | AE86: 88.84 | AF86: 91.28 | AG86: 0.56 | AH86: A+ | AI86: 7.1599999999999997e-002 | AJ86: =H86+100*O86 -> 138.41 | AK86: 137.3 | AL86: 64 | AM86: 46.1 | AN86: 106 | AO86: 6.8000000000000005e-002 | AP86: 39 | AQ86: 迪贝转债!
A87: 121 | B87: 128135 | C87: 洽洽转债! | D87: 2557 | E87: 洽洽食品 | F87: 食品饮料 | G87: 休闲食品 | H87: 114.914 | I87: 8.9999999999999998e-004 | J87: 2.3e-003 | K87: 38.5 | L87: 2.18e-002 | M87: 120.2 | N87: 60.03 | O87: 0.79200000000000004 | P87: 64.13 | Q87: 转股中 | R87: 5年46天 | S87: 3年47天 | T87: 13.4 | U87: 4.9 | V87: 3.0000000000000001e-003 | W87: 6.9000000000000006e-002 | X87: 4.4000000000000004e-002 | Y87: 195 | Z87: 4.71 | AA87: 9.0000000000000011e-003 | AB87: 2.0999999999999999e-003 | AC87: -3.1e-002 | AD87: -3.3000000000000002e-002 | AE87: 90.88 | AF87: 98.08 | AG87: 0.15 | AH87: AA | AI87: 4.1299999999999996e-002 | AJ87: =H87+100*O87 -> 194.114 | AK87: 165.7 | AL87: 272 | AM87: 67.6 | AN87: 247 | AO87: -5.7000000000000002e-002 | AP87: 11 | AQ87: 洽洽转债!
A88: 314 | B88: 113524 | C88: 奇精转债! | D88: 603677 | E88: 奇精机械 | F88: 家电 | G88: 零部件制 | H88: 114 | I88: -1.26e-002 | J88: 1.8799999999999997e-002 | K88: 12.49 | L88: 1.46e-002 | M88: 117.3 | N88: 13.98 | O88: 0.27600000000000002 | P88: 89.34 | Q88: 转股中 | R88: 3.28年 | S88: 1.28年 | T88: 3.3 | U88: 5.7 | V88: 1.4999999999999999e-002 | W88: 0.13699999999999998 | X88: 0.12300000000000001 | Y88: 24 | Z88: 2.42 | AA88: 8.8999999999999999e-003 | AB88: -4.0000000000000002e-004 | AC88: -6.9599999999999995e-002 | AD88: -7.2999999999999995e-002 | AE88: 94.49 | AF88: 97.12 | AG88: 0.42 | AH88: AA- | AI88: 6.0599999999999994e-002 | AJ88: =H88+100*O88 -> 141.59999999999999 | AK88: 138.7 | AL88: 80 | AM88: 41.5 | AN88: 69 | AO88: 2.3e-002 | AP88: 43 | AQ88: 奇精转债!
A89: 212 | B89: 110068 | C89: 龙净转债! | D89: 600388 | E89: 龙净环保 | F89: 城市公用 | G89: 三废处理 | H89: 110.4 | I89: -6.3e-003 | J89: 3.8e-003 | K89: 9.25 | L89: -6.4000000000000003e-003 | M89: 114.8 | N89: 10.55 | O89: 0.25900000000000001 | P89: 87.68 | Q89: 转股中 | R89: 4.55年 | S89: 2.55年 | T89: 20 | U89: 30 | V89: 1.3999999999999999e-002 | W89: 0.20199999999999999 | X89: 0.17699999999999999 | Y89: 99 | Z89: 1.61 | AA89: 8.8000000000000005e-003 | AB89: 2.8999999999999998e-003 | AC89: -2.4300000000000002e-002 | AD89: -2.6600000000000002e-002 | AE89: 94.25 | AF89: 98.63 | AG89: 0.39 | AH89: AA+ | AI89: 3.4599999999999999e-002 | AJ89: =H89+100*O89 -> 136.30000000000001 | AK89: 133.1 | AL89: 24 | AM89: 34.5 | AN89: 26 | AO89: 3.9e-002 | AP89: 35 | AQ89: 龙净转债!
A90: 132 | B90: 128131 | C90: 崇达转2! | D90: 2815 | E90: 崇达技术 | F90: 电子 | G90: 元器件制 | H90: 110.354 | I90: 1.0700000000000001e-002 | J90: -8.6e-003 | K90: 12.59 | L90: 1.21e-002 | M90: 115.2 | N90: 19.38 | O90: 0.69900000000000007 | P90: 64.96 | Q90: 转股中 | R90: 5年3.1天 | S90: 3年4.1天 | T90: 14 | U90: 5.1 | V90: 3.0000000000000001e-003 | W90: 0.127 | X90: 8.199999999999999e-002 | Y90: 110 | Z90: 2.7 | AA90: 8.8000000000000005e-003 | AB90: 3.3e-003 | AC90: -1.9599999999999999e-002 | AD90: -2.1700000000000001e-002 | AE90: 91.32 | AF90: 94.47 | AG90: 0.18 | AH90: AA | AI90: 4.1299999999999996e-002 | AJ90: =H90+100*O90 -> 180.25400000000002 | AK90: 155.7 | AL90: 230 | AM90: 61.3 | AN90: 210 | AO90: -5.0000000000000003e-002 | AP90: 10 | AQ90: 崇达转2!
A91: 134 | B91: 123064 | C91: 万孚转债! | D91: 300482 | E91: 万孚生物 | F91: 医药 | G91: 医疗器械 | H91: 110.02 | I91: -7.000000000000001e-004 | J91: 2.5999999999999999e-003 | K91: 41.45 | L91: 1.67e-002 | M91: 114.8 | N91: 71.65 | O91: 0.90200000000000002 | P91: 57.85 | Q91: 转股中 | R91: 4.99年 | S91: 2.99年 | T91: 5.99 | U91: 43 | V91: 6.5000000000000002e-002 | W91: 3.2000000000000001e-002 | X91: 1.9e-002 | Y91: 184 | Z91: 5.83 | AA91: 8.6999999999999994e-003 | AB91: 3.3e-003 | AC91: -1.9900000000000001e-002 | AD91: -2.18e-002 | AE91: 91.45 | AF91: 94.89 | AG91: 0.12 | AH91: AA | AI91: 3.9599999999999996e-002 | AJ91: =H91+100*O91 -> 200.22 | AK91: 162.2 | AL91: 263 | AM91: 67.3 | AN91: 246 | AO91: -0.16 | AP91: 11 | AQ91: 万孚转债!
A92: 34 | B92: 127032 | C92: 苏行转债 | D92: 2966 | E92: 苏州银行 | F92: 金融 | G92: 银行行业 | H92: 109.9 | I92: 5.5000000000000005e-003 | J92: -6.0999999999999995e-003 | K92: 6.91 | L92: -1.4000000000000002e-003 | M92: 115.1 | N92: 8.1 | O92: 0.28800000000000003 | P92: 85.31 | Q92: 45天 | R92: 5.60年 | S92: 无权 | T92: 50 | U92: 140 | V92: 2.5000000000000001e-002 | W92: 0.217 | X92: 0.185 | Y92: 230 | Z92: 0.75 | AA92: 8.3999999999999995e-003 | AB92: 3.5999999999999999e-003 | AC92: 无权 | AD92: 无权 | AE92: 无权 | AF92: 95.58 | AG92: 0.41 | AH92: AAA | AI92: 3.4300000000000004e-002 | AJ92: =H92+100*O92 -> 138.70000000000002 | AK92: 134.5 | AL92: 34 | AM92: 38.9 | AN92: 54 | AO92: -5.0000000000000001e-003 | AP92: 8 | AQ92: 苏行转债
A93: 166 | B93: 123059 | C93: 银信转债! | D93: 300231 | E93: 银信科技 | F93: 计算机及 | G93: 软件开发 | H93: 118.9 | I93: 1.7299999999999999e-002 | J93: -1.21e-002 | K93: 9.07 | L93: 1.e-002 | M93: 123.7 | N93: 9.72 | O93: 0.27399999999999997 | P93: 93.31 | Q93: 转股中 | R93: 4.86年 | S93: 2.86年 | T93: 3.91 | U93: 56 | V93: 0.12 | W93: 9.8000000000000004e-002 | X93: 9.0999999999999998e-002 | Y93: 40 | Z93: 2.97 | AA93: 8.3000000000000001e-003 | AB93: 1.e-004 | AC93: -4.4699999999999997e-002 | AD93: -4.6900000000000004e-002 | AE93: 86.84 | AF93: 93.46 | AG93: 0.52 | AH93: AA- | AI93: 6.0599999999999994e-002 | AJ93: =H93+100*O93 -> 146.30000000000001 | AK93: 144.5 | AL93: 140 | AM93: 51 | AN93: 145 | AO93: 3.7000000000000005e-002 | AP93: 18 | AQ93: 银信转债!
A94: 42 | B94: 123107 | C94: 温氏转债! | D94: 300498 | E94: 温氏股份 | F94: 农业 | G94: 畜牧业 | H94: 108.4 | I94: 6.1999999999999998e-003 | J94: 4.0000000000000002e-004 | K94: 13.35 | L94: 2.1400000000000002e-002 | M94: 113 | N94: 17.62 | O94: 0.43099999999999999 | P94: 75.77 | Q94: 35天 | R94: 5.56年 | S94: 3.57年 | T94: 93 | U94: 89 | V94: 9.0000000000000011e-003 | W94: 0.11 | X94: 8.3000000000000004e-002 | Y94: 848 | Z94: 2.03 | AA94: 7.6e-003 | AB94: 3.3e-003 | AC94: -1.24e-002 | AD94: -1.4199999999999999e-002 | AE94: 91.35 | AF94: 93.97 | AG94: 0.31 | AH94: AAA | AI94: 3.4300000000000004e-002 | AJ94: =H94+100*O94 -> 151.5 | AK94: 141 | AL94: 105 | AM94: 47.1 | AN94: 113 | AO94: 4.0000000000000001e-003 | AP94: 10 | AQ94: 温氏转债!
A95: 52 | B95: 123104 | C95: 卫宁转债! | D95: 300253 | E95: 卫宁健康 | F95: 计算机及 | G95: 软件开发 | H95: 120.328 | I95: 1.1000000000000001e-003 | J95: -2.2000000000000001e-003 | K95: 14.33 | L95: -3.4999999999999996e-003 | M95: 125.1 | N95: 17.74 | O95: 0.48999999999999999 | P95: 80.78 | Q95: 19天 | R95: 5.53年 | S95: 3.53年 | T95: 9.7 | U95: 6.9 | V95: 6.0000000000000001e-003 | W95: 3.2000000000000001e-002 | X95: 2.6000000000000002e-002 | Y95: 307 | Z95: 6.68 | AA95: 7.1999999999999998e-003 | AB95: -4.0000000000000002e-004 | AC95: -4.0000000000000001e-002 | AD95: -4.1700000000000001e-002 | AE95: 89.32 | AF95: 100.4 | AG95: 0.32 | AH95: AA | AI95: 4.1299999999999996e-002 | AJ95: =H95+100*O95 -> 169.328 | AK95: 159.9 | AL95: 255 | AM95: 59.5 | AN95: 199 | AO95: 2.1000000000000001e-002 | AP95: 4 | AQ95: 卫宁转债!
A96: 179 | B96: 113588 | C96: 润达转债! | D96: 603108 | E96: 润达医疗 | F96: 医药 | G96: 医疗器械 | H96: 110.31 | I96: 5.0000000000000001e-004 | J96: 3.4000000000000002e-003 | K96: 10.33 | L96: 1.18e-002 | M96: 113.9 | N96: 13.25 | O96: 0.41499999999999998 | P96: 77.96 | Q96: 转股中 | R96: 4.78年 | S96: 2.79年 | T96: 5.5 | U96: 5.6 | V96: 9.0000000000000011e-003 | W96: 9.1999999999999998e-002 | X96: 7.2000000000000008e-002 | Y96: 60 | Z96: 1.85 | AA96: 6.8000000000000005e-003 | AB96: 1.6000000000000001e-003 | AC96: -2.18e-002 | AD96: -2.4e-002 | AE96: 92.29 | AF96: 94.93 | AG96: 0.32 | AH96: AA | AI96: 3.9599999999999996e-002 | AJ96: =H96+100*O96 -> 151.81 | AK96: 142.7 | AL96: 122 | AM96: 47.7 | AN96: 120 | AO96: 1.8000000000000002e-002 | AP96: 11 | AQ96: 润达转债!
A97: 210 | B97: 113574 | C97: 华体转债! | D97: 603679 | E97: 华体科技 | F97: 城市公用 | G97: 城市公用 | H97: 112.49 | I97: -4.0000000000000002e-004 | J97: 2.0000000000000001e-004 | K97: 15.72 | L97: -5.6999999999999993e-003 | M97: 115.9 | N97: 33.91 | O97: 1.4299999999999999 | P97: 46.36 | Q97: 转股中 | R97: 4.57年 | S97: 2.57年 | T97: 2.09 | U97: 3.8 | V97: 1.6e-002 | W97: 9.4e-002 | X97: 4.2999999999999997e-002 | Y97: 22 | Z97: 2.92 | AA97: 6.7000000000000002e-003 | AB97: 5.0000000000000001e-004 | AC97: -2.8300000000000002e-002 | AD97: -3.1e-002 | AE97: 86.29 | AF97: 85.15 | AG97: 0.05 | AH97: A+ | AI97: 7.1599999999999997e-002 | AJ97: =H97+100*O97 -> 255.49000000000001 | AK97: 178.6 | AL97: 300 | AM97: 92.3 | AN97: 310 | AO97: -2.4e-002 | AP97: 19 | AQ97: 华体转债!
A98: 150 | B98: 123063 | C98: 大禹转债 | D98: 300021 | E98: 大禹节水 | F98: 化工 | G98: 橡胶塑料 | H98: 122.18 | I98: 8.5000000000000006e-003 | J98: -4.8999999999999998e-003 | K98: 5.23 | L98: 5.7999999999999996e-003 | M98: 126.1 | N98: 4.83 | O98: 0.128 | P98: 108.28 | Q98: 转股中 | R98: 4.90年 | S98: 3.90年 | T98: 6.35 | U98: 19 | V98: 2.5000000000000001e-002 | W98: 0.151 | X98: 0.16399999999999998 | Y98: 42 | Z98: 2.87 | AA98: 6.6e-003 | AB98: -2.2000000000000001e-003 | AC98: -3.3500000000000002e-002 | AD98: -3.6400000000000002e-002 | AE98: 84.26 | AF98: 95.1 | AG98: 0.62 | AH98: AA- | AI98: 6.0599999999999994e-002 | AJ98: =H98+100*O98 -> 134.98000000000002 | AK98: 136.1 | AL98: 48 | AM98: 41 | AN98: 63 | AO98: -2.7000000000000003e-002 | AP98: 19 | AQ98: 大禹转债
A99: 108 | B99: 127024 | C99: 盈峰转债! | D99: 967 | E99: 盈峰环境 | F99: 机械装备 | G99: 专用设备 | H99: 113 | I99: 0. | J99: -1.8e-003 | K99: 6.46 | L99: -6.1999999999999998e-003 | M99: 116.8 | N99: 8.19 | O99: 0.433 | P99: 78.88 | Q99: 转股中 | R99: 5.17年 | S99: 3.17年 | T99: 14.8 | U99: 4.5 | V99: 3.0000000000000001e-003 | W99: 7.2000000000000008e-002 | X99: 5.7000000000000002e-002 | Y99: 204 | Z99: 1.26 | AA99: 6.5000000000000006e-003 | AB99: 8.0000000000000004e-004 | AC99: -2.6699999999999998e-002 | AD99: -2.86e-002 | AE99: 91.8 | AF99: 97.45 | AG99: 0.3 | AH99: AA+ | AI99: 3.6299999999999999e-002 | AJ99: =H99+100*O99 -> 156.30000000000001 | AK99: 147.1 | AL99: 160 | AM99: 49.7 | AN99: 134 | AO99: 2.7000000000000003e-002 | AP99: 5 | AQ99: 盈峰转债!
A100: 18 | B100: 113625 | C100: 江山转债! | D100: 603208 | E100: 江山欧派 | F100: 其他 | G100: 家居用品 | H100: 119.56 | I100: 8.0000000000000004e-004 | J100: -4.5000000000000005e-003 | K100: 71.84 | L100: -9.1000000000000004e-003 | M100: 124 | N100: 97.55 | O100: 0.623 | P100: 73.64 | Q100: 3月16天 | R100: 5.77年 | S100: 3.77年 | T100: 5.83 | U100: 5.7 | V100: 8.0000000000000002e-003 | W100: 7.6999999999999999e-002 | X100: 5.7000000000000002e-002 | Y100: 75 | Z100: 4.08 | AA100: 6.5000000000000006e-003 | AB100: -5.0000000000000001e-004 | AC100: -3.5299999999999998e-002 | AD100: -3.7100000000000001e-002 | AE100: 82.11 | AF100: 88.1 | AG100: 0.4 | AH100: AA- | AI100: 6.2300000000000001e-002 | AJ100: =H100+100*O100 -> 181.86000000000001 | AK100: 165.5 | AL100: 271 | AM100: 77.4 | AN100: 282 | AO100: -5.7000000000000002e-002 | AP100: 3 | AQ100: 江山转债!
A101: 106 | B101: 113608 | C101: 威派转债! | D101: 603956 | E101: 威派格 | F101: 机械装备 | G101: 专用设备 | H101: 117.85 | I101: -1.e-004 | J101: 2.2000000000000001e-003 | K101: 16.78 | L101: 3.5999999999999999e-003 | M101: 121.6 | N101: 19.08 | O101: 0.34000000000000002 | P101: 87.95 | Q101: 转股中 | R101: 5.18年 | S101: 3.18年 | T101: 4.2 | U101: 9.4 | V101: 1.9e-002 | W101: 5.9000000000000004e-002 | X101: 5.2000000000000005e-002 | Y101: 71 | Z101: 6.43 | AA101: 6.1999999999999998e-003 | AB101: -1.e-003 | AC101: -3.5400000000000001e-002 | AD101: -3.7900000000000003e-002 | AE101: 82.81 | AF101: 85.09 | AG101: 0.58 | AH101: A+ | AI101: 7.3300000000000004e-002 | AJ101: =H101+100*O101 -> 151.84999999999999 | AK101: 147.8 | AL101: 169 | AM101: 62.7 | AN101: 224 | AO101: -1.9e-002 | AP101: 7 | AQ101: 威派转债!
A102: 225 | B102: 113567 | C102: 君禾转债! | D102: 603617 | E102: 君禾股份 | F102: 机械装备 | G102: 通用设备 | H102: 115.81 | I102: 9.7000000000000003e-003 | J102: -7.4000000000000003e-003 | K102: 10.38 | L102: 3.9000000000000003e-003 | M102: 118.8 | N102: 11.16 | O102: 0.245 | P102: 93.01 | Q102: 转股中 | R102: 4.50年 | S102: 2.50年 | T102: 2.1 | U102: 7.4 | V102: 2.9999999999999999e-002 | W102: 0.10099999999999999 | X102: 9.4e-002 | Y102: 21 | Z102: 3.05 | AA102: 5.7999999999999996e-003 | AB102: -1.5e-003 | AC102: -4.0099999999999997e-002 | AD102: -4.2800000000000005e-002 | AE102: 86.66 | AF102: 87.72 | AG102: 0.58 | AH102: A+ | AI102: 7.1599999999999997e-002 | AJ102: =H102+100*O102 -> 140.31 | AK102: 138.6 | AL102: 79 | AM102: 50.9 | AN102: 142 | AO102: -6.9999999999999993e-003 | AP102: 33 | AQ102: 君禾转债!
A103: 271 | B103: 128071 | C103: 合兴转债! | D103: 2228 | E103: 合兴包装 | F103: 造纸包装 | G103: 包装材料 | H103: 111.799 | I103: 1.7399999999999999e-002 | J103: -1.e-002 | K103: 3.62 | L103: 1.9699999999999999e-002 | M103: 114.3 | N103: 4.18 | O103: 0.29100000000000004 | P103: 86.6 | Q103: 转股中 | R103: 3.95年 | S103: 1.95年 | T103: 3 | U103: 19 | V103: 5.7000000000000002e-002 | W103: 6.7000000000000004e-002 | X103: 5.7999999999999996e-002 | Y103: 45 | Z103: 1.28 | AA103: 5.6999999999999993e-003 | AB103: -8.0000000000000004e-004 | AC103: -3.9100000000000003e-002 | AD103: -4.1500000000000002e-002 | AE103: 94.74 | AF103: 98.31 | AG103: 0.38 | AH103: AA | AI103: 3.9599999999999996e-002 | AJ103: =H103+100*O103 -> 140.899 | AK103: 137 | AL103: 58 | AM103: 38.7 | AN103: 53 | AO103: 4.4000000000000004e-002 | AP103: 25 | AQ103: 合兴转债!
A104: 117 | B104: 113605 | C104: 大参转债! | D104: 603233 | E104: 大参林 | F104: 医药 | G104: 医药商业 | H104: 112 | I104: 7.4000000000000003e-003 | J104: -8.0000000000000002e-003 | K104: 46 | L104: -3.3e-003 | M104: 115.2 | N104: 69.09 | O104: 0.68200000000000005 | P104: 66.58 | Q104: 转股中 | R104: 5年48天 | S104: 3年49天 | T104: 14 | U104: 23 | V104: 1.4999999999999999e-002 | W104: 3.9e-002 | X104: 2.6000000000000002e-002 | Y104: 364 | Z104: 7.09 | AA104: 5.6000000000000008e-003 | AB104: 2.9999999999999997e-004 | AC104: -2.3300000000000001e-002 | AD104: -2.5399999999999999e-002 | AE104: 90.86 | AF104: 93.99 | AG104: 0.2 | AH104: AA | AI104: 4.1299999999999996e-002 | AJ104: =H104+100*O104 -> 180.19999999999999 | AK104: 157.4 | AL104: 241 | AM104: 63.4 | AN104: 229 | AO104: -2.3e-002 | AP104: 7 | AQ104: 大参转债!
A105: 147 | B105: 113598 | C105: 法兰转债 | D105: 603966 | E105: 法兰泰克 | F105: 机械装备 | G105: 工程机械 | H105: 117.79 | I105: -6.7000000000000002e-003 | J105: 1.04e-002 | K105: 9.28 | L105: 6.5000000000000006e-003 | M105: 120.8 | N105: 9.7 | O105: 0.23100000000000001 | P105: 95.67 | Q105: 转股中 | R105: 4.90年 | S105: 2.91年 | T105: 2.75 | U105: 20 | V105: 6.0999999999999999e-002 | W105: 9.9000000000000005e-002 | X105: 9.5000000000000001e-002 | Y105: 28 | Z105: 1.69 | AA105: 5.3e-003 | AB105: -2.e-003 | AC105: -4.0899999999999999e-002 | AD105: -4.3099999999999999e-002 | AE105: 86.71 | AF105: 91.07 | AG105: 0.57 | AH105: AA- | AI105: 6.0599999999999994e-002 | AJ105: =H105+100*O105 -> 140.89000000000001 | AK105: 139.9 | AL105: 92 | AM105: 48.8 | AN105: 128 | AO105: 0.113 | AP105: 13 | AQ105: 法兰转债
A106: 136 | B106: 128129 | C106: 青农转债! | D106: 2958 | E106: 青农商行 | F106: 金融 | G106: 银行行业 | H106: 109.35 | I106: 3.2000000000000002e-003 | J106: 4.0000000000000002e-004 | K106: 4 | L106: 7.6e-003 | M106: 112 | N106: 4.32 | O106: 0.18100000000000002 | P106: 92.59 | Q106: 转股中 | R106: 4.97年 | S106: 无权 | T106: 50 | U106: 43 | V106: 8.0000000000000002e-003 | W106: 0.22500000000000001 | X106: 0.20800000000000002 | Y106: 222 | Z106: 0.81 | AA106: 4.8999999999999998e-003 | AB106: 5.0000000000000001e-004 | AC106: 无权 | AD106: 无权 | AE106: 无权 | AF106: 95.71 | AG106: 0.47 | AH106: AAA | AI106: 3.2599999999999997e-002 | AJ106: =H106+100*O106 -> 127.44999999999999 | AK106: 126.1 | AL106: 7 | AM106: 30.4 | AN106: 11 | AO106: 2.1000000000000001e-002 | AP106: 20 | AQ106: 青农转债!
A107: 97 | B107: 113610 | C107: 灵康转债 | D107: 603669 | E107: 灵康药业 | F107: 医药 | G107: 化学制药 | H107: 118.17 | I107: 9.0000000000000011e-003 | J107: 5.1000000000000004e-003 | K107: 8.88 | L107: 2.1899999999999999e-002 | M107: 121.1 | N107: 8.61 | O107: 0.14599999999999999 | P107: 103.14 | Q107: 转股中 | R107: 5.24年 | S107: 3.24年 | T107: 4.58 | U107: 17 | V107: 3.1e-002 | W107: 7.2000000000000008e-002 | X107: 7.4999999999999997e-002 | Y107: 63 | Z107: 4.88 | AA107: 4.7999999999999996e-003 | AB107: -2.0999999999999999e-003 | AC107: -3.7100000000000001e-002 | AD107: -3.9199999999999999e-002 | AE107: 84.85 | AF107: 88.85 | AG107: 0.64 | AH107: AA- | AI107: 6.2300000000000001e-002 | AJ107: =H107+100*O107 -> 132.77000000000001 | AK107: 133.2 | AL107: 26 | AM107: 44.4 | AN107: 88 | AO107: -9.1999999999999998e-002 | AP107: 27 | AQ107: 灵康转债
A108: 274 | B108: 128070 | C108: 智能转债! | D108: 2877 | E108: 智能自控 | F108: 机械装备 | G108: 通用设备 | H108: 114.75 | I108: 1.8e-003 | J108: -2.7000000000000001e-003 | K108: 6.64 | L108: -3.0000000000000001e-003 | M108: 116.8 | N108: 9.47 | O108: 0.63700000000000001 | P108: 70.12 | Q108: 转股中 | R108: 3.82年 | S108: 无权 | T108: 2.3 | U108: 15 | V108: 5.7000000000000002e-002 | W108: 0.10400000000000001 | X108: 7.2999999999999995e-002 | Y108: 22 | Z108: 2.99 | AA108: 4.6999999999999993e-003 | AB108: -3.0000000000000001e-003 | AC108: 无权 | AD108: 无权 | AE108: 无权 | AF108: 90.14 | AG108: 0.31 | AH108: A+ | AI108: 7.1599999999999997e-002 | AJ108: =H108+100*O108 -> 178.44999999999999 | AK108: 159.4 | AL108: 250 | AM108: 69.2 | AN108: 258 | AO108: 6.0000000000000001e-003 | AP108: 30 | AQ108: 智能转债!
A109: 114 | B109: 113606 | C109: 荣泰转债 | D109: 603579 | E109: 荣泰健康 | F109: 机械装备 | G109: 专用设备 | H109: 118.51 | I109: 1.9799999999999998e-002 | J109: 5.0000000000000001e-004 | K109: 29.86 | L109: 3.7200000000000004e-002 | M109: 121.2 | N109: 32.83 | O109: 0.30299999999999999 | P109: 90.95 | Q109: 转股中 | R109: 5年56天 | S109: 3年57天 | T109: 6 | U109: 12 | V109: 1.7000000000000001e-002 | W109: 0.14300000000000002 | X109: 0.13100000000000001 | Y109: 42 | Z109: 2.49 | AA109: 4.5000000000000005e-003 | AB109: -2.5999999999999999e-003 | AC109: -3.8599999999999995e-002 | AD109: -4.0899999999999999e-002 | AE109: 85.4 | AF109: 89.42 | AG109: 0.55 | AH109: AA- | AI109: 6.2300000000000001e-002 | AJ109: =H109+100*O109 -> 148.81 | AK109: 146.1 | AL109: 156 | AM109: 56.6 | AN109: 182 | AO109: -1.e-003 | AP109: 11 | AQ109: 荣泰转债
A110: 61 | B110: 123099 | C110: 普利转债 | D110: 300630 | E110: 普利制药 | F110: 医药 | G110: 化学制药 | H110: 120.55 | I110: 8.6999999999999994e-003 | J110: -1.24e-002 | K110: 39.4 | L110: -7.3000000000000001e-003 | M110: 123.5 | N110: 46.03 | O110: 0.40799999999999997 | P110: 85.6 | Q110: 转股中 | R110: 5.43年 | S110: 3.44年 | T110: 8.5 | U110: 4.6 | V110: 4.0000000000000001e-003 | W110: 4.9000000000000002e-002 | X110: 4.2000000000000003e-002 | Y110: 172 | Z110: 7.85 | AA110: 4.5000000000000005e-003 | AB110: -2.7000000000000001e-003 | AC110: -4.0999999999999995e-002 | AD110: -4.2900000000000001e-002 | AE110: 83.72 | AF110: 89.51 | AG110: 0.5 | AH110: AA- | AI110: 6.2300000000000001e-002 | AJ110: =H110+100*O110 -> 161.34999999999999 | AK110: 155.5 | AL110: 226 | AM110: 66 | AN110: 242 | AO110: -9.6000000000000002e-002 | AP110: 5 | AQ110: 普利转债
A111: 33 | B111: 110080 | C111: 东湖转债 | D111: 600133 | E111: 东湖高新 | F111: 建筑 | G111: 建筑工程 | H111: 112.26 | I111: 9.3999999999999986e-003 | J111: -5.6000000000000008e-003 | K111: 5.89 | L111: 6.8000000000000005e-003 | M111: 115.1 | N111: 6.05 | O111: 0.153 | P111: 97.36 | Q111: 43天 | R111: 5.60年 | S111: 3.61年 | T111: 15.5 | U111: 61 | V111: 3.5000000000000003e-002 | W111: 0.33100000000000002 | X111: 0.32200000000000001 | Y111: 47 | Z111: 0.85 | AA111: 4.5000000000000005e-003 | AB111: -2.9999999999999997e-004 | AC111: -2.12e-002 | AD111: -2.3e-002 | AE111: 89.05 | AF111: 92.13 | AG111: 0.57 | AH111: AA | AI111: 4.1299999999999996e-002 | AJ111: =H111+100*O111 -> 127.56 | AK111: 127.2 | AL111: 8 | AM111: 35 | AN111: 29 | AO111: 3.5000000000000003e-002 | AP111: 25 | AQ111: 东湖转债
A112: 174 | B112: 113591 | C112: 胜达转债! | D112: 603687 | E112: 大胜达 | F112: 造纸包装 | G112: 包装用纸 | H112: 119.43 | I112: 3.3000000000000002e-002 | J112: 4.0000000000000002e-004 | K112: 9.13 | L112: 5.4299999999999994e-002 | M112: 121.7 | N112: 8.76 | O112: 0.14599999999999999 | P112: 104.22 | Q112: 转股中 | R112: 4.82年 | S112: 2.82年 | T112: 5.5 | U112: 57 | V112: 8.8000000000000009e-002 | W112: 0.14699999999999999 | X112: 0.153 | Y112: 38 | Z112: 2.18 | AA112: 4.0000000000000001e-003 | AB112: -3.7000000000000002e-003 | AC112: -4.6699999999999998e-002 | AD112: -4.8899999999999999e-002 | AE112: 87.04 | AF112: 92.17 | AG112: 0.62 | AH112: AA- | AI112: 6.0599999999999994e-002 | AJ112: =H112+100*O112 -> 134.03 | AK112: 134.6 | AL112: 35 | AM112: 42.5 | AN112: 77 | AO112: 0.17300000000000001 | AP112: 32 | AQ112: 胜达转债!
A113: 72 | B113: 127028 | C113: 英特转债! | D113: 411 | E113: 英特集团 | F113: 医药 | G113: 医药商业 | H113: 110.738 | I113: 7.9000000000000008e-003 | J113: -5.1999999999999998e-003 | K113: 12.02 | L113: 5.8999999999999999e-003 | M113: 113.1 | N113: 13.4 | O113: 0.23499999999999999 | P113: 89.7 | Q113: 转股中 | R113: 5.34年 | S113: 3.34年 | T113: 6 | U113: 21 | V113: 3.1e-002 | W113: 0.20000000000000001 | X113: 0.17999999999999999 | Y113: 30 | Z113: 1.72 | AA113: 4.0000000000000001e-003 | AB113: -4.0000000000000002e-004 | AC113: -1.9e-002 | AD113: -2.0899999999999998e-002 | AE113: 91.53 | AF113: 93.84 | AG113: 0.47 | AH113: AA+ | AI113: 3.6299999999999999e-002 | AJ113: =H113+100*O113 -> 134.238 | AK113: 131.8 | AL113: 19 | AM113: 37.9 | AN113: 41 | AO113: -6.9999999999999993e-003 | AP113: 24 | AQ113: 英特转债!
A114: 297 | B114: 123023 | C114: 迪森转债! | D114: 300335 | E114: 迪森股份 | F114: 能源电力 | G114: 电力供应 | H114: 112.78 | I114: 1.3300000000000001e-002 | J114: 1.e-002 | K114: 6.14 | L114: 4.9599999999999998e-002 | M114: 114.3 | N114: 6.89 | O114: 0.26600000000000001 | P114: 89.11 | Q114: 转股中 | R114: 3.54年 | S114: 2.54年 | T114: 5.29 | U114: 112 | V114: 0.183 | W114: 0.23100000000000001 | X114: 0.20600000000000002 | Y114: 23 | Z114: 1.69 | AA114: 3.9000000000000003e-003 | AB114: -3.4000000000000002e-003 | AC114: -2.76e-002 | AD114: -3.0800000000000001e-002 | AE114: 89.43 | AF114: 93.19 | AG114: 0.47 | AH114: AA- | AI114: 6.0599999999999994e-002 | AJ114: =H114+100*O114 -> 139.38 | AK114: 136.4 | AL114: 51 | AM114: 43.3 | AN114: 83 | AO114: 3.5000000000000003e-002 | AP114: 51 | AQ114: 迪森转债!
A115: 281 | B115: 113535 | C115: 大业转债! | D115: 603278 | E115: 大业股份 | F115: 汽车 | G115: 零部件制 | H115: 111.36 | I115: -8.8999999999999999e-003 | J115: 7.1999999999999998e-003 | K115: 10.14 | L115: -6.8999999999999999e-003 | M115: 112.5 | N115: 12.29 | O115: 0.34999999999999998 | P115: 82.51 | Q115: 转股中 | R115: 2.68年 | S115: 0.68年 | T115: 5 | U115: 8.1 | V115: 1.4999999999999999e-002 | W115: 0.17000000000000001 | X115: 0.14000000000000001 | Y115: 29 | Z115: 1.67 | AA115: 3.9000000000000003e-003 | AB115: -4.5999999999999999e-003 | AC115: -0.11 | AD115: -0.11199999999999999 | AE115: 98.09 | AF115: 101.84 | AG115: 0.25 | AH115: AA | AI115: 3.8300000000000001e-002 | AJ115: =H115+100*O115 -> 146.36000000000001 | AK115: 140.2 | AL115: 95 | AM115: 38.4 | AN115: 48 | AO115: 1.7000000000000001e-002 | AP115: 48 | AQ115: 大业转债!
A116: 235 | B116: 127015 | C116: 希望转债!! | D116: 876 | E116: 新 希 望 | F116: 农业 | G116: 畜牧业 | H116: 108.22 | I116: 1.1399999999999999e-002 | J116: -9.8999999999999991e-003 | K116: 11.72 | L116: 2.63e-002 | M116: 110 | N116: 19.75 | O116: 0.82400000000000007 | P116: 59.34 | Q116: 转股中 | R116: 4.33年 | S116: 2.33年 | T116: 9.5 | U116: 10 | V116: 1.e-002 | W116: 1.8000000000000002e-002 | X116: 1.1000000000000001e-002 | Y116: 528 | Z116: 1.58 | AA116: 3.8e-003 | AB116: -5.0000000000000001e-004 | AC116: -2.1000000000000001e-002 | AD116: -2.3e-002 | AE116: 94.81 | AF116: 95.71 | AG116: 0.06 | AH116: AAA | AI116: 3.2599999999999997e-002 | AJ116: =H116+100*O116 -> 190.62 | AK116: 157.1 | AL116: 238 | AM116: 61.4 | AN116: 212 | AO116: 0. | AP116: 27 | AQ116: 希望转债!!
A117: 46 | B117: 123106 | C117: 正丹转债! | D117: 300641 | E117: 正丹股份 | F117: 化工 | G117: 化工 | H117: 123.15 | I117: 1.23e-002 | J117: -4.1999999999999997e-003 | K117: 7.87 | L117: 1.29e-002 | M117: 125.5 | N117: 7.5 | O117: 0.17399999999999999 | P117: 104.93 | Q117: 27天 | R117: 5.55年 | S117: 3.55年 | T117: 3.2 | U117: 43 | V117: 0.109 | W117: 8.3000000000000004e-002 | X117: 8.6999999999999994e-002 | Y117: 39 | Z117: 2.73 | AA117: 3.4999999999999996e-003 | AB117: -4.0999999999999995e-003 | AC117: -4.5199999999999997e-002 | AD117: -4.7e-002 | AE117: 83.12 | AF117: 90.31 | AG117: 0.63 | AH117: AA- | AI117: 6.2300000000000001e-002 | AJ117: =H117+100*O117 -> 140.55000000000001 | AK117: 141.4 | AL117: 110 | AM117: 51.1 | AN117: 147 | AO117: -6.7000000000000004e-002 | AP117: 15 | AQ117: 正丹转债!
A118: 78 | B118: 123090 | C118: 三诺转债 | D118: 300298 | E118: 三诺生物 | F118: 医药 | G118: 医疗器械 | H118: 115.025 | I118: 1.1000000000000001e-003 | J118: 1.e-003 | K118: 26.28 | L118: 6.8999999999999999e-003 | M118: 117.1 | N118: 35.18 | O118: 0.54000000000000004 | P118: 74.7 | Q118: 转股中 | R118: 5.30年 | S118: 3.30年 | T118: 5 | U118: 13 | V118: 2.2000000000000002e-002 | W118: 3.4000000000000002e-002 | X118: 2.5000000000000001e-002 | Y118: 148 | Z118: 5.51 | AA118: 3.4000000000000002e-003 | AB118: -2.3e-003 | AC118: -2.9999999999999999e-002 | AD118: -3.1899999999999998e-002 | AE118: 90.16 | AF118: 94.89 | AG118: 0.3 | AH118: AA | AI118: 4.1299999999999996e-002 | AJ118: =H118+100*O118 -> 169.02500000000001 | AK118: 155.3 | AL118: 225 | AM118: 60.5 | AN118: 207 | AO118: -5.7999999999999996e-002 | AP118: 4 | AQ118: 三诺转债
A119: 96 | B119: 123080 | C119: 海波转债! | D119: 300517 | E119: 海波重科 | F119: 建筑 | G119: 建筑工程 | H119: 124.48 | I119: 2.3e-003 | J119: 2.0999999999999999e-003 | K119: 13.16 | L119: 6.0999999999999995e-003 | M119: 126.5 | N119: 11.58 | O119: 9.5000000000000001e-002 | P119: 113.64 | Q119: 转股中 | R119: 5.24年 | S119: 3.25年 | T119: 2.44 | U119: 42 | V119: 0.13800000000000001 | W119: 9.6000000000000002e-002 | X119: 0.109 | Y119: 25 | Z119: 2.97 | AA119: 3.0999999999999999e-003 | AB119: -5.1999999999999998e-003 | AC119: -5.0099999999999999e-002 | AD119: -5.2499999999999998e-002 | AE119: 82.5 | AF119: 88.1 | AG119: 0.71 | AH119: A+ | AI119: 7.3300000000000004e-002 | AJ119: =H119+100*O119 -> 133.98000000000002 | AK119: 135.3 | AL119: 41 | AM119: 47.2 | AN119: 114 | AO119: -5.5e-002 | AP119: 24 | AQ119: 海波转债!
A120: 39 | B120: 123109 | C120: 昌红转债 | D120: 300151 | E120: 昌红科技 | F120: 机械装备 | G120: 专用设备 | H120: 119 | I120: -8.3000000000000001e-003 | J120: -7.1999999999999998e-003 | K120: 27.17 | L120: -2.5499999999999998e-002 | M120: 121 | N120: 28.06 | O120: 0.22899999999999998 | P120: 96.83 | Q120: 35天 | R120: 5.57年 | S120: 3.58年 | T120: 4.6 | U120: 12 | V120: 2.3e-002 | W120: 3.4000000000000002e-002 | X120: 3.3000000000000002e-002 | Y120: 137 | Z120: 13.71 | AA120: 3.0999999999999999e-003 | AB120: -3.4000000000000002e-003 | AC120: -3.5900000000000001e-002 | AD120: -3.78e-002 | AE120: 83.08 | AF120: 87 | AG120: 0.61 | AH120: AA- | AI120: 6.2300000000000001e-002 | AJ120: =H120+100*O120 -> 141.90000000000001 | AK120: 141.2 | AL120: 107 | AM120: 54.2 | AN120: 166 | AO120: -3.5000000000000003e-002 | AP120: 4 | AQ120: 昌红转债
A121: 94 | B121: 123082 | C121: 北陆转债! | D121: 300016 | E121: 北陆药业 | F121: 医药 | G121: 化学制药 | H121: 119.922 | I121: 7.3000000000000001e-003 | J121: 1.5100000000000001e-002 | K121: 9.18 | L121: 3.2599999999999997e-002 | M121: 121.7 | N121: 8.81 | O121: 0.151 | P121: 104.2 | Q121: 转股中 | R121: 5.26年 | S121: 3.26年 | T121: 5 | U121: 33 | V121: 5.4000000000000006e-002 | W121: 0.11 | X121: 0.115 | Y121: 45 | Z121: 2.66 | AA121: 2.8999999999999998e-003 | AB121: -4.1999999999999997e-003 | AC121: -3.95e-002 | AD121: -4.1900000000000007e-002 | AE121: 82.37 | AF121: 84.7 | AG121: 0.69 | AH121: A+ | AI121: 7.3300000000000004e-002 | AJ121: =H121+100*O121 -> 135.02199999999999 | AK121: 135.6 | AL121: 45 | AM121: 50.9 | AN121: 143 | AO121: 4.9000000000000002e-002 | AP121: 15 | AQ121: 北陆转债!
A122: 357 | B122: 128021 | C122: 兄弟转债!! | D122: 2562 | E122: 兄弟科技 | F122: 医药 | G122: 原料药 | H122: 108.268 | I122: 2.2000000000000001e-003 | J122: -1.8e-003 | K122: 3.7 | L122: 1.37e-002 | M122: 108.8 | N122: 5.19 | O122: 0.51900000000000002 | P122: 71.29 | Q122: 转股中 | R122: 2.24年 | S122: 0.24年 | T122: 2.65 | U122: 3.9 | V122: 1.3000000000000001e-002 | W122: 6.7000000000000004e-002 | X122: 4.8000000000000001e-002 | Y122: 39 | Z122: 1.33 | AA122: 2.2000000000000001e-003 | AB122: -5.1999999999999998e-003 | AC122: -0.16699999999999998 | AD122: -0.17399999999999999 | AE122: 100.03 | AF122: 100.06 | AG122: 0.03 | AH122: AA | AI122: 3.8300000000000001e-002 | AJ122: =H122+100*O122 -> 160.16800000000001 | AK122: 145.2 | AL122: 146 | AM122: 45.2 | AN122: 99 | AO122: -8.0000000000000002e-003 | AP122: 17 | AQ122: 兄弟转债!!
A123: 11 | B123: 123118 | C123: 惠城转债 | D123: 300779 | E123: 惠城环保 | F123: 化工 | G123: 其他 | H123: 120.25 | I123: 0. | J123: -9.0000000000000011e-003 | K123: 17.97 | L123: -1.26e-002 | M123: 121.7 | N123: 17.11 | O123: 0.14499999999999999 | P123: 105.03 | Q123: 4月12天 | R123: 5.84年 | S123: 3.84年 | T123: 3.2 | U123: 11 | V123: 2.8999999999999998e-002 | W123: 0.17800000000000002 | X123: 0.187 | Y123: 18 | Z123: 2.72 | AA123: 2.0999999999999999e-003 | AB123: -4.1999999999999997e-003 | AC123: -3.4500000000000003e-002 | AD123: -3.6600000000000001e-002 | AE123: 79.06 | AF123: 81.29 | AG123: 0.71 | AH123: A+ | AI123: 7.3300000000000004e-002 | AJ123: =H123+100*O123 -> 134.75 | AK123: 135.5 | AL123: 42 | AM123: 54.2 | AN123: 167 | AO123: 0. | AP123: 5 | AQ123: 惠城转债
A124: 21 | B124: 123116 | C124: 万兴转债 | D124: 300624 | E124: 万兴科技 | F124: 计算机及 | G124: 软件开发 | H124: 120.2 | I124: 1.3300000000000001e-002 | J124: 4.0000000000000002e-004 | K124: 45.22 | L124: 2.1700000000000001e-002 | M124: 121.4 | N124: 49.78 | O124: 0.32299999999999995 | P124: 90.84 | Q124: 3月14天 | R124: 5.76年 | S124: 3.76年 | T124: 3.79 | U124: 30 | V124: 6.7000000000000004e-002 | W124: 6.4000000000000001e-002 | X124: 5.9000000000000004e-002 | Y124: 59 | Z124: 6.98 | AA124: 1.8e-003 | AB124: -4.5999999999999999e-003 | AC124: -3.5699999999999996e-002 | AD124: -3.7699999999999997e-002 | AE124: 79.23 | AF124: 81.47 | AG124: 0.63 | AH124: A+ | AI124: 7.3300000000000004e-002 | AJ124: =H124+100*O124 -> 152.5 | AK124: 149.6 | AL124: 185 | AM124: 68.1 | AN124: 251 | AO124: -1.1000000000000001e-002 | AP124: 4 | AQ124: 万兴转债
A125: 116 | B125: 123073 | C125: 同和转债! | D125: 300636 | E125: 同和药业 | F125: 医药 | G125: 原料药 | H125: 121.35 | I125: 1.46e-002 | J125: 2.6000000000000002e-002 | K125: 16.15 | L125: 5.7599999999999998e-002 | M125: 122.4 | N125: 14.82 | O125: 0.114 | P125: 108.97 | Q125: 转股中 | R125: 5年52天 | S125: 3年53天 | T125: 3.59 | U125: 55 | V125: 0.125 | W125: 0.10800000000000001 | X125: 0.11800000000000001 | Y125: 33 | Z125: 4.17 | AA125: 1.7000000000000001e-003 | AB125: -5.6999999999999993e-003 | AC125: -4.4500000000000005e-002 | AD125: -4.6900000000000004e-002 | AE125: 83.01 | AF125: 85.86 | AG125: 0.71 | AH125: A+ | AI125: 7.3300000000000004e-002 | AJ125: =H125+100*O125 -> 132.75 | AK125: 133.7 | AL125: 29 | AM125: 47.9 | AN125: 121 | AO125: 0.17899999999999999 | AP125: 12 | AQ125: 同和转债!
A126: 272 | B126: 113542 | C126: 好客转债! | D126: 603898 | E126: 好莱客 | F126: 其他 | G126: 家居用品 | H126: 113.6 | I126: 8.0000000000000004e-004 | J126: -2.0000000000000001e-004 | K126: 12.43 | L126: 2.3999999999999998e-003 | M126: 114.3 | N126: 16.14 | O126: 0.47499999999999998 | P126: 77.01 | Q126: 转股中 | R126: 3.91年 | S126: 1.91年 | T126: 6.03 | U126: 3 | V126: 4.0000000000000001e-003 | W126: 0.156 | X126: 0.12 | Y126: 39 | Z126: 1.47 | AA126: 1.6000000000000001e-003 | AB126: -5.0000000000000001e-003 | AC126: -4.7300000000000002e-002 | AD126: -4.9699999999999994e-002 | AE126: 94.89 | AF126: 98.47 | AG126: 0.26 | AH126: AA | AI126: 3.9599999999999996e-002 | AJ126: =H126+100*O126 -> 161.09999999999999 | AK126: 150.2 | AL126: 191 | AM126: 51.7 | AN126: 151 | AO126: 2.8999999999999998e-002 | AP126: 16 | AQ126: 好客转债!
A127: 164 | B127: 128120 | C127: 联诚转债! | D127: 2921 | E127: 联诚精密 | F127: 汽车 | G127: 零部件制 | H127: 117.157 | I127: 4.53e-002 | J127: -1.95e-002 | K127: 16.68 | L127: 4.0500000000000001e-002 | M127: 117.9 | N127: 18.44 | O127: 0.29499999999999998 | P127: 90.46 | Q127: 转股中 | R127: 4.87年 | S127: 2.87年 | T127: 2.6 | U127: 69 | V127: 0.22800000000000001 | W127: 0.14699999999999999 | X127: 0.13300000000000001 | Y127: 18 | Z127: 2.26 | AA127: 1.2999999999999999e-003 | AB127: -5.1000000000000004e-003 | AC127: -3.8599999999999995e-002 | AD127: -4.0999999999999995e-002 | AE127: 82.22 | AF127: 81.2 | AG127: 0.64 | AH127: A | AI127: 8.1600000000000006e-002 | AJ127: =H127+100*O127 -> 146.65699999999998 | AK127: 143.9 | AL127: 135 | AM127: 61.6 | AN127: 214 | AO127: 7.0999999999999994e-002 | AP127: 21 | AQ127: 联诚转债!
A128: 327 | B128: 128042 | C128: 凯中转债! | D128: 2823 | E128: 凯中精密 | F128: 能源电力 | G128: 电力设备 | H128: 114.95 | I128: 9.0000000000000011e-003 | J128: -1.e-002 | K128: 11.14 | L128: -3.5999999999999999e-003 | M128: 115.3 | N128: 12.86 | O128: 0.32700000000000001 | P128: 86.63 | Q128: 转股中 | R128: 2.90年 | S128: 0.90年 | T128: 4.16 | U128: 4.1 | V128: 9.0000000000000011e-003 | W128: 0.13 | X128: 0.113 | Y128: 32 | Z128: 2.36 | AA128: 1.1000000000000001e-003 | AB128: -8.3000000000000001e-003 | AC128: -0.106 | AD128: -0.109 | AE128: 97.79 | AF128: 103.54 | AG128: 0.29 | AH128: AA | AI128: 3.8300000000000001e-002 | AJ128: =H128+100*O128 -> 147.65000000000001 | AK128: 143.3 | AL128: 129 | AM128: 39.7 | AN128: 58 | AO128: -5.5999999999999994e-002 | AP128: 26 | AQ128: 凯中转债!
A129: 32 | B129: 127033 | C129: 中装转2! | D129: 2822 | E129: 中装建设 | F129: 建筑 | G129: 装饰工程 | H129: 117 | I129: -4.3e-003 | J129: -4.1999999999999997e-003 | K129: 5.72 | L129: -1.72e-002 | M129: 117.1 | N129: 6.28 | O129: 0.28499999999999998 | P129: 91.08 | Q129: 49天 | R129: 5.61年 | S129: 3.62年 | T129: 11.6 | U129: 39 | V129: 2.7999999999999997e-002 | W129: 0.28100000000000003 | X129: 0.25600000000000001 | Y129: 41 | Z129: 1.21 | AA129: 2.0000000000000001e-004 | AB129: -5.1999999999999998e-003 | AC129: -3.1899999999999998e-002 | AD129: -3.3599999999999998e-002 | AE129: 89.01 | AF129: 93.68 | AG129: 0.49 | AH129: AA | AI129: 4.1299999999999996e-002 | AJ129: =H129+100*O129 -> 145.5 | AK129: 142.9 | AL129: 126 | AM129: 49.2 | AN129: 131 | AO129: 0.10000000000000001 | AP129: 26 | AQ129: 中装转2!
A130: 15 | B130: 123117 | C130: 健帆转债! | D130: 300529 | E130: 健帆生物 | F130: 医药 | G130: 医疗器械 | H130: 115.016 | I130: 3.4000000000000002e-003 | J130: 0. | K130: 49.26 | L130: 2.8199999999999999e-002 | M130: 115.1 | N130: 90.57 | O130: 1.1100000000000001 | P130: 54.39 | Q130: 3月27天 | R130: 5.80年 | S130: 3.80年 | T130: 10 | U130: 18 | V130: 1.6e-002 | W130: 2.5000000000000001e-002 | X130: 1.3999999999999999e-002 | Y130: 397 | Z130: 12.86 | AA130: 1.e-004 | AB130: -4.5000000000000005e-003 | AC130: -2.6200000000000001e-002 | AD130: -2.7900000000000001e-002 | AE130: 88.34 | AF130: 91.39 | AG130: 0.12 | AH130: AA | AI130: 4.1299999999999996e-002 | AJ130: =H130+100*O130 -> 226.01600000000002 | AK130: 175.6 | AL130: 294 | AM130: 84.3 | AN130: 297 | AO130: -7.400000000000001e-002 | AP130: 4 | AQ130: 健帆转债!
A131: 101 | B131: 113609 | C131: 永安转债! | D131: 603776 | E131: 永安行 | F131: 城市公用 | G131: 其他 | H131: 120.77 | I131: -3.7000000000000002e-003 | J131: 4.8999999999999998e-003 | K131: 18.48 | L131: 1.6000000000000001e-003 | M131: 120.5 | N131: 16.48 | O131: 7.6999999999999999e-002 | P131: 112.14 | Q131: 转股中 | R131: 5.22年 | S131: 3.22年 | T131: 7.34 | U131: 42 | V131: 4.7e-002 | W131: 0.17000000000000001 | X131: 0.191 | Y131: 43 | Z131: 1.34 | AA131: -4.0000000000000002e-004 | AB131: -7.0999999999999995e-003 | AC131: -4.4000000000000004e-002 | AD131: -4.5999999999999999e-002 | AE131: 84.79 | AF131: 88.47 | AG131: 0.71 | AH131: AA- | AI131: 6.2300000000000001e-002 | AJ131: =H131+100*O131 -> 128.47 | AK131: 129.4 | AL131: 14 | AM131: 40.9 | AN131: 61 | AO131: 2.8999999999999998e-002 | AP131: 25 | AQ131: 永安转债!
A132: 202 | B132: 128106 | C132: 华统转债 | D132: 2840 | E132: 华统股份 | F132: 农业 | G132: 农产品加 | H132: 113.13 | I132: 3.3e-003 | J132: 0. | K132: 8.43 | L132: 7.1999999999999998e-003 | M132: 112.9 | N132: 9.37 | O132: 0.25700000000000001 | P132: 89.97 | Q132: 转股中 | R132: 4.60年 | S132: 2.60年 | T132: 5.35 | U132: 3.9 | V132: 6.0000000000000001e-003 | W132: 0.14199999999999999 | X132: 0.128 | Y132: 38 | Z132: 2.1 | AA132: -5.0000000000000001e-004 | AB132: -5.5000000000000005e-003 | AC132: -3.2199999999999999e-002 | AD132: -3.4500000000000003e-002 | AE132: 92.96 | AF132: 94.78 | AG132: 0.46 | AH132: AA | AI132: 3.9599999999999996e-002 | AJ132: =H132+100*O132 -> 138.82999999999998 | AK132: 136.3 | AL132: 49 | AM132: 41.5 | AN132: 68 | AO132: -4.9000000000000002e-002 | AP132: 9 | AQ132: 华统转债
A133: 57 | B133: 113045 | C133: 环旭转债! | D133: 601231 | E133: 环旭电子 | F133: 电子 | G133: 电子产品 | H133: 112.98 | I133: -2.0000000000000001e-004 | J133: 6.0000000000000001e-003 | K133: 14.78 | L133: 2.e-002 | M133: 112 | N133: 19.75 | O133: 0.51000000000000001 | P133: 74.84 | Q133: 3月8天 | R133: 5.50年 | S133: 2.50年 | T133: 34.5 | U133: 7.6 | V133: 2.e-003 | W133: 0.106 | X133: 7.9000000000000001e-002 | Y133: 327 | Z133: 2.83 | AA133: -1.6000000000000001e-003 | AB133: -5.6000000000000008e-003 | AC133: -3.4500000000000003e-002 | AD133: -3.6499999999999998e-002 | AE133: 93.58 | AF133: 92.29 | AG133: 0.29 | AH133: AA+ | AI133: 3.6299999999999999e-002 | AJ133: =H133+100*O133 -> 163.98000000000002 | AK133: 151.1 | AL133: 198 | AM133: 57.5 | AN133: 189 | AO133: 4.5999999999999999e-002 | AP133: 5 | AQ133: 环旭转债!
A134: 249 | B134: 110062 | C134: 烽火转债! | D134: 600498 | E134: 烽火通信 | F134: 通信互联 | G134: 通信设备 | H134: 111.69 | I134: 8.0000000000000004e-004 | J134: 1.e-003 | K134: 18.27 | L134: 6.0999999999999995e-003 | M134: 110.8 | N134: 22.85 | O134: 0.39700000000000002 | P134: 79.96 | Q134: 转股中 | R134: 4.24年 | S134: 2.25年 | T134: 30.9 | U134: 7.2 | V134: 2.e-003 | W134: 0.14899999999999999 | X134: 0.11900000000000001 | Y134: 207 | Z134: 1.91 | AA134: -1.9e-003 | AB134: -6.6e-003 | AC134: -3.2199999999999999e-002 | AD134: -3.4700000000000002e-002 | AE134: 95.68 | AF134: 96.97 | AG134: 0.3 | AH134: AAA | AI134: 3.2599999999999997e-002 | AJ134: =H134+100*O134 -> 151.38999999999999 | AK134: 143.4 | AL134: 132 | AM134: 46.4 | AN134: 109 | AO134: -4.2999999999999997e-002 | AP134: 19 | AQ134: 烽火转债!
A135: 298 | B135: 110056 | C135: 亨通转债! | D135: 600487 | E135: 亨通光电 | F135: 通信互联 | G135: 通信设备 | H135: 115.12 | I135: 4.0999999999999995e-003 | J135: -6.7000000000000002e-003 | K135: 12.81 | L135: -8.5000000000000006e-003 | M135: 114.3 | N135: 14.95 | O135: 0.34399999999999997 | P135: 85.69 | Q135: 转股中 | R135: 3.54年 | S135: 1.54年 | T135: 17.1 | U135: 12 | V135: 6.0000000000000001e-003 | W135: 5.7000000000000002e-002 | X135: 4.8000000000000001e-002 | Y135: 303 | Z135: 1.51 | AA135: -2.0999999999999999e-003 | AB135: -9.300000000000001e-003 | AC135: -6.4699999999999994e-002 | AD135: -6.7599999999999993e-002 | AE135: 97.05 | AF135: 101.58 | AG135: 0.31 | AH135: AA+ | AI135: 3.4599999999999999e-002 | AJ135: =H135+100*O135 -> 149.52000000000001 | AK135: 144.6 | AL135: 141 | AM135: 43 | AN135: 82 | AO135: 1.4999999999999999e-002 | AP135: 28 | AQ135: 亨通转债!
A136: 63 | B136: 123097 | C136: 美力转债 | D136: 300611 | E136: 美力科技 | F136: 机械装备 | G136: 通用设备 | H136: 123 | I136: 4.0999999999999995e-003 | J136: 1.0700000000000001e-002 | K136: 10.61 | L136: 2.0199999999999999e-002 | M136: 121.6 | N136: 9.28 | O136: 7.5999999999999998e-002 | P136: 114.33 | Q136: 转股中 | R136: 5.40年 | S136: 3.40年 | T136: 3 | U136: 20 | V136: 5.4000000000000006e-002 | W136: 0.158 | X136: 0.18100000000000002 | Y136: 19 | Z136: 2.74 | AA136: -2.2000000000000001e-003 | AB136: -8.8999999999999999e-003 | AC136: -4.4900000000000002e-002 | AD136: -4.7199999999999999e-002 | AE136: 81.55 | AF136: 83.79 | AG136: 0.73 | AH136: A+ | AI136: 7.3300000000000004e-002 | AJ136: =H136+100*O136 -> 130.59999999999999 | AK136: 131.7 | AL136: 18 | AM136: 47.9 | AN136: 122 | AO136: -3.9e-002 | AP136: 21 | AQ136: 美力转债
A137: 49 | B137: 113046 | C137: 金田转债 | D137: 601609 | E137: 金田铜业 | F137: 有色金属 | G137: 铜金属 | H137: 116.41 | I137: -1.72e-002 | J137: 1.5300000000000001e-002 | K137: 9.47 | L137: -4.1999999999999997e-003 | M137: 114.9 | N137: 10.75 | O137: 0.32100000000000001 | P137: 88.09 | Q137: 24天 | R137: 5.55年 | S137: 3.55年 | T137: 15 | U137: 13 | V137: 6.9999999999999993e-003 | W137: 0.107 | X137: 9.4e-002 | Y137: 140 | Z137: 2.03 | AA137: -2.3999999999999998e-003 | AB137: -7.1999999999999998e-003 | AC137: -3.1600000000000003e-002 | AD137: -3.3300000000000003e-002 | AE137: 90.67 | AF137: 94.61 | AG137: 0.45 | AH137: AA+ | AI137: 3.6299999999999999e-002 | AJ137: =H137+100*O137 -> 148.50999999999999 | AK137: 144.7 | AL137: 142 | AM137: 50.1 | AN137: 137 | AO137: 3.3000000000000002e-002 | AP137: 12 | AQ137: 金田转债
A138: 175 | B138: 128116 | C138: 瑞达转债! | D138: 2961 | E138: 瑞达期货 | F138: 金融 | G138: 期货行业 | H138: 116.342 | I138: 5.5000000000000005e-003 | J138: 4.4000000000000003e-003 | K138: 25.65 | L138: 2.35e-002 | M138: 114.9 | N138: 29.55 | O138: 0.34000000000000002 | P138: 86.8 | Q138: 转股中 | R138: 4.82年 | S138: 2.82年 | T138: 6.5 | U138: 220 | V138: 0.28800000000000003 | W138: 5.7000000000000002e-002 | X138: 4.9000000000000002e-002 | Y138: 114 | Z138: 5.74 | AA138: -2.5999999999999999e-003 | AB138: -8.1000000000000013e-003 | AC138: -3.9199999999999999e-002 | AD138: -4.1299999999999996e-002 | AE138: 92.09 | AF138: 95.62 | AG138: 0.42 | AH138: AA | AI138: 3.9599999999999996e-002 | AJ138: =H138+100*O138 -> 150.34199999999998 | AK138: 145.9 | AL138: 153 | AM138: 50.3 | AN138: 139 | AO138: 0.19399999999999998 | AP138: 19 | AQ138: 瑞达转债!
A139: 346 | B139: 128034 | C139: 江银转债! | D139: 2807 | E139: 江阴银行 | F139: 金融 | G139: 银行行业 | H139: 108.999 | I139: 4.0000000000000002e-004 | J139: 5.0000000000000001e-004 | K139: 3.87 | L139: 2.5999999999999999e-003 | M139: 108.3 | N139: 4.32 | O139: 0.217 | P139: 89.58 | Q139: 转股中 | R139: 2.40年 | S139: 无权 | T139: 17.6 | U139: 12 | V139: 6.0000000000000001e-003 | W139: 0.20899999999999999 | X139: 0.187 | Y139: 84 | Z139: 0.71 | AA139: -2.7000000000000001e-003 | AB139: -9.1999999999999998e-003 | AC139: 无权 | AD139: 无权 | AE139: 无权 | AF139: 100.22 | AG139: 0.35 | AH139: AA+ | AI139: 3.3300000000000003e-002 | AJ139: =H139+100*O139 -> 130.69899999999998 | AK139: 128.4 | AL139: 12 | AM139: 28.2 | AN139: 6 | AO139: 1.9e-002 | AP139: 27 | AQ139: 江银转债!
A140: 82 | B140: 123087 | C140: 明电转债! | D140: 300739 | E140: 明阳电路 | F140: 电子 | G140: 元器件制 | H140: 122.902 | I140: 6.0999999999999995e-003 | J140: 1.e-002 | K140: 16.81 | L140: 2.5000000000000001e-002 | M140: 121.2 | N140: 16.32 | O140: 0.193 | P140: 103 | Q140: 转股中 | R140: 5.28年 | S140: 4.28年 | T140: 4.19 | U140: 108 | V140: 0.20999999999999999 | W140: 8.5000000000000006e-002 | X140: 8.6999999999999994e-002 | Y140: 50 | Z140: 3.44 | AA140: -2.7000000000000001e-003 | AB140: -9.4999999999999998e-003 | AC140: -3.1800000000000002e-002 | AD140: -3.4500000000000003e-002 | AE140: 81.96 | AF140: 88.74 | AG140: 0.64 | AH140: AA- | AI140: 6.2300000000000001e-002 | AJ140: =H140+100*O140 -> 142.202 | AK140: 142.8 | AL140: 123 | AM140: 54.1 | AN140: 164 | AO140: -0.12300000000000001 | AP140: 19 | AQ140: 明电转债!
A141: 110 | B141: 128136 | C141: 立讯转债! | D141: 2475 | E141: 立讯精密 | F141: 电子 | G141: 元器件制 | H141: 113.582 | I141: -1.e-004 | J141: -1.e-004 | K141: 34.2 | L141: -1.5e-003 | M141: 111.9 | N141: 58.18 | O141: 0.93200000000000005 | P141: 58.78 | Q141: 转股中 | R141: 5.16年 | S141: 3.17年 | T141: 30 | U141: 91 | V141: 2.7000000000000003e-002 | W141: 1.2e-002 | X141: 6.9999999999999993e-003 | Y141: 2406. | Z141: 7.93 | AA141: -2.8999999999999998e-003 | AB141: -7.0999999999999995e-003 | AC141: -3.0699999999999998e-002 | AD141: -3.2000000000000001e-002 | AE141: 90.96 | AF141: 93.29 | AG141: 0.12 | AH141: AA+ | AI141: 3.6299999999999999e-002 | AJ141: =H141+100*O141 -> 206.78199999999998 | AK141: 168.4 | AL141: 278 | AM141: 75.1 | AN141: 274 | AO141: -0.10800000000000001 | AP141: 13 | AQ141: 立讯转债!
A142: 165 | B142: 128121 | C142: 宏川转债! | D142: 2930 | E142: 宏川智慧 | F142: 交通运输 | G142: 物流业 | H142: 114.704 | I142: 4.5999999999999999e-003 | J142: 1.6000000000000001e-003 | K142: 16.7 | L142: 1.21e-002 | M142: 112.9 | N142: 19.92 | O142: 0.36799999999999999 | P142: 83.84 | Q142: 转股中 | R142: 4.87年 | S142: 2.87年 | T142: 6.7 | U142: 1.7 | V142: 2.e-003 | W142: 8.9999999999999997e-002 | X142: 7.5999999999999998e-002 | Y142: 74 | Z142: 3.66 | AA142: -3.3e-003 | AB142: -8.1000000000000013e-003 | AC142: -3.3799999999999997e-002 | AD142: -3.5900000000000001e-002 | AE142: 86.62 | AF142: 85.27 | AG142: 0.52 | AH142: AA- | AI142: 6.0599999999999994e-002 | AJ142: =H142+100*O142 -> 151.50399999999999 | AK142: 145.6 | AL142: 149 | AM142: 59 | AN142: 194 | AO142: -3.3000000000000002e-002 | AP142: 5 | AQ142: 宏川转债!
A143: 71 | B143: 128143 | C143: 锋龙转债! | D143: 2931 | E143: 锋龙股份 | F143: 机械装备 | G143: 专用设备 | H143: 123.86 | I143: 6.9999999999999993e-003 | J143: -4.8999999999999998e-003 | K143: 14.12 | L143: 2.8000000000000004e-003 | M143: 121.7 | N143: 12.73 | O143: 0.11699999999999999 | P143: 110.92 | Q143: 转股中 | R143: 5.35年 | S143: 3.35年 | T143: 2.44 | U143: 16 | V143: 5.2999999999999999e-002 | W143: 8.6999999999999994e-002 | X143: 9.6000000000000002e-002 | Y143: 28 | Z143: 4.48 | AA143: -3.4000000000000002e-003 | AB143: -1.0200000000000001e-002 | AC143: -4.7400000000000005e-002 | AD143: -4.9699999999999994e-002 | AE143: 81.86 | AF143: 84.18 | AG143: 0.72 | AH143: A+ | AI143: 7.3300000000000004e-002 | AJ143: =H143+100*O143 -> 135.56 | AK143: 136.8 | AL143: 56 | AM143: 52.6 | AN143: 157 | AO143: 8.0000000000000002e-002 | AP143: 13 | AQ143: 锋龙转债!
A144: 40 | B144: 123110 | C144: 九典转债 | D144: 300705 | E144: 九典制药 | F144: 医药 | G144: 化学制药 | H144: 123.775 | I144: 7.4999999999999997e-003 | J144: -4.8999999999999998e-003 | K144: 26.4 | L144: 3.8e-003 | M144: 121.4 | N144: 26.44 | O144: 0.23999999999999999 | P144: 99.85 | Q144: 35天 | R144: 5.57年 | S144: 3.58年 | T144: 2.7 | U144: 19 | V144: 5.7999999999999996e-002 | W144: 4.4000000000000004e-002 | X144: 4.4000000000000004e-002 | Y144: 62 | Z144: 6.6 | AA144: -3.4999999999999996e-003 | AB144: -1.e-002 | AC144: -4.4900000000000002e-002 | AD144: -4.7e-002 | AE144: 80.36 | AF144: 82.58 | AG144: 0.68 | AH144: A+ | AI144: 7.3300000000000004e-002 | AJ144: =H144+100*O144 -> 147.77500000000001 | AK144: 147.7 | AL144: 168 | AM144: 65.1 | AN144: 239 | AO144: -7.2999999999999995e-002 | AP144: 7 | AQ144: 九典转债
A145: 31 | B145: 123113 | C145: 仙乐转债 | D145: 300791 | E145: 仙乐健康 | F145: 食品饮料 | G145: 食品饮料 | H145: 120.82 | I145: 6.0000000000000001e-003 | J145: -9.7999999999999997e-003 | K145: 45.96 | L145: -7.6e-003 | M145: 118.5 | N145: 56.92 | O145: 0.496 | P145: 80.74 | Q145: 52天 | R145: 5.62年 | S145: 3.62年 | T145: 10.3 | U145: 2.5 | V145: 2.e-003 | W145: 0.124 | X145: 0.10000000000000001 | Y145: 83 | Z145: 3.66 | AA145: -3.4999999999999996e-003 | AB145: -9.1999999999999998e-003 | AC145: -3.95e-002 | AD145: -4.1299999999999996e-002 | AE145: 82.77 | AF145: 84.94 | AG145: 0.5 | AH145: AA- | AI145: 6.2300000000000001e-002 | AJ145: =H145+100*O145 -> 170.41999999999999 | AK145: 160.9 | AL145: 260 | AM145: 76 | AN145: 275 | AO145: -0.16399999999999998 | AP145: 2 | AQ145: 仙乐转债
A146: 2 | B146: 123123 | C146: 江丰转债 | D146: 300666 | E146: 江丰电子 | F146: 电子 | G146: 电子行业 | H146: 124.41 | I146: -4.6999999999999993e-003 | J146: 5.7999999999999996e-003 | K146: 47.9 | L146: 1.7000000000000001e-003 | M146: 121.5 | N146: 51.93 | O146: 0.34899999999999998 | P146: 92.24 | Q146: 5月18天 | R146: 5.94年 | S146: 3.94年 | T146: 5.17 | U146: 241 | V146: 0.374 | W146: 4.8000000000000001e-002 | X146: 4.4000000000000004e-002 | Y146: 108 | Z146: 9.45 | AA146: -4.0999999999999995e-003 | AB146: -1.0200000000000001e-002 | AC146: -4.2099999999999999e-002 | AD146: -4.4000000000000004e-002 | AE146: 78.33 | AF146: 80.54 | AG146: 0.66 | AH146: A+ | AI146: 7.3300000000000004e-002 | AJ146: =H146+100*O146 -> 159.31 | AK146: 156.6 | AL146: 236 | AM146: 76 | AN146: 276 | AO146: -5.9999999999999998e-002 | AP146: 2 | AQ146: 江丰转债
A147: 342 | B147: 113505 | C147: 杭电转债! | D147: 603618 | E147: 杭电股份 | F147: 能源电力 | G147: 电力设备 | H147: 112.61 | I147: 4.8999999999999998e-003 | J147: -1.e-002 | K147: 6.51 | L147: -1.3600000000000001e-002 | M147: 111.3 | N147: 7.08 | O147: 0.22500000000000001 | P147: 91.95 | Q147: 转股中 | R147: 2.50年 | S147: 0.50年 | T147: 7.5 | U147: 45 | V147: 5.2999999999999999e-002 | W147: 0.16699999999999998 | X147: 0.153 | Y147: 45 | Z147: 1.67 | AA147: -4.6999999999999993e-003 | AB147: -1.3000000000000001e-002 | AC147: -0.14999999999999999 | AD147: -0.155 | AE147: 99.27 | AF147: 101.47 | AG147: 0.37 | AH147: AA | AI147: 3.8300000000000001e-002 | AJ147: =H147+100*O147 -> 135.11000000000001 | AK147: 133.3 | AL147: 27 | AM147: 31.8 | AN147: 15 | AO147: 5.2000000000000005e-002 | AP147: 45 | AQ147: 杭电转债!
A148: 79 | B148: 128142 | C148: 新乳转债! | D148: 2946 | E148: 新乳业 | F148: 食品饮料 | G148: 乳制品 | H148: 117.92 | I148: -1.4000000000000002e-003 | J148: 9.7999999999999997e-003 | K148: 14.83 | L148: 2.2799999999999997e-002 | M148: 115.1 | N148: 18.47 | O148: 0.46899999999999997 | P148: 80.29 | Q148: 转股中 | R148: 5.29年 | S148: 3.29年 | T148: 7.18 | U148: 11 | V148: 1.3000000000000001e-002 | W148: 5.5999999999999994e-002 | X148: 4.4999999999999998e-002 | Y148: 129 | Z148: 5.04 | AA148: -4.6999999999999993e-003 | AB148: -9.7000000000000003e-003 | AC148: -3.7100000000000001e-002 | AD148: -3.8900000000000004e-002 | AE148: 90.19 | AF148: 93.31 | AG148: 0.37 | AH148: AA | AI148: 4.1299999999999996e-002 | AJ148: =H148+100*O148 -> 164.81999999999999 | AK148: 155.5 | AL148: 227 | AM148: 62.2 | AN148: 220 | AO148: 5.0000000000000003e-002 | AP148: 4 | AQ148: 新乳转债!
A149: 70 | B149: 113618 | C149: 美诺转债! | D149: 603538 | E149: 美诺华 | F149: 医药 | G149: 原料药 | H149: 118.22 | I149: 3.0999999999999999e-003 | J149: 2.8000000000000004e-003 | K149: 31.49 | L149: 1.09e-002 | M149: 115.3 | N149: 37.47 | O149: 0.40700000000000003 | P149: 84.04 | Q149: 转股中 | R149: 5.36年 | S149: 3.36年 | T149: 5.2 | U149: 7.6 | V149: 1.2e-002 | W149: 0.11 | X149: 9.3000000000000013e-002 | Y149: 47 | Z149: 2.84 | AA149: -4.6999999999999993e-003 | AB149: -9.7999999999999997e-003 | AC149: -3.6499999999999998e-002 | AD149: -3.85e-002 | AE149: 84.05 | AF149: 83.96 | AG149: 0.54 | AH149: AA- | AI149: 6.2300000000000001e-002 | AJ149: =H149+100*O149 -> 158.92000000000002 | AK149: 152.4 | AL149: 206 | AM149: 68.3 | AN149: 252 | AO149: -3.7999999999999999e-002 | AP149: 5 | AQ149: 美诺转债!
A150: 325 | B150: 113516 | C150: 苏农转债! | D150: 603323 | E150: 苏农银行 | F150: 金融 | G150: 银行行业 | H150: 114.97 | I150: -1.0500000000000001e-002 | J150: 9.0000000000000011e-003 | K150: 4.95 | L150: -4.0000000000000001e-003 | M150: 113.3 | N150: 5.37 | O150: 0.247 | P150: 92.18 | Q150: 转股中 | R150: 2.91年 | S150: 无权 | T150: 12.9 | U150: 15 | V150: 1.e-002 | W150: 0.14400000000000002 | X150: 0.13300000000000001 | Y150: 89 | Z150: 0.72 | AA150: -5.1000000000000004e-003 | AB150: -1.3300000000000001e-002 | AC150: 无权 | AD150: 无权 | AE150: 无权 | AF150: 103.14 | AG150: 0.37 | AH150: AA+ | AI150: 3.3300000000000003e-002 | AJ150: =H150+100*O150 -> 139.66999999999999 | AK150: 137.8 | AL150: 69 | AM150: 34.6 | AN150: 27 | AO150: 1.3000000000000001e-002 | AP150: 27 | AQ150: 苏农转债!
A151: 263 | B151: 128076 | C151: 金轮转债! | D151: 2722 | E151: 金轮股份 | F151: 机械装备 | G151: 专用设备 | H151: 117.301 | I151: 7.6e-003 | J151: -1.e-002 | K151: 13.75 | L151: -4.3e-003 | M151: 114.9 | N151: 14.66 | O151: 0.251 | P151: 93.79 | Q151: 转股中 | R151: 4年40天 | S151: 2年41天 | T151: 2.14 | U151: 9.2 | V151: 3.7000000000000005e-002 | W151: 8.900000000000001e-002 | X151: 8.3000000000000004e-002 | Y151: 24 | Z151: 1.26 | AA151: -5.1000000000000004e-003 | AB151: -1.1599999999999999e-002 | AC151: -5.4400000000000004e-002 | AD151: -5.7099999999999998e-002 | AE151: 90.57 | AF151: 90.72 | AG151: 0.55 | AH151: AA- | AI151: 6.0599999999999994e-002 | AJ151: =H151+100*O151 -> 142.40100000000001 | AK151: 140.8 | AL151: 102 | AM151: 50.1 | AN151: 136 | AO151: 2.2000000000000002e-002 | AP151: 40 | AQ151: 金轮转债!
A152: 257 | B152: 110060 | C152: 天路转债! | D152: 600326 | E152: 西藏天路 | F152: 建筑 | G152: 水泥 | H152: 117.35 | I152: -1.4000000000000002e-003 | J152: -4.7999999999999996e-003 | K152: 6.72 | L152: -1.32e-002 | M152: 114.9 | N152: 7.08 | O152: 0.23600000000000002 | P152: 94.92 | Q152: 转股中 | R152: 4年54天 | S152: 2年55天 | T152: 7.06 | U152: 13 | V152: 1.6e-002 | W152: 0.114 | X152: 0.109 | Y152: 62 | Z152: 1.42 | AA152: -5.1999999999999998e-003 | AB152: -1.15e-002 | AC152: -5.3699999999999998e-002 | AD152: -5.6299999999999996e-002 | AE152: 94.6 | AF152: 98.15 | AG152: 0.47 | AH152: AA | AI152: 3.9599999999999996e-002 | AJ152: =H152+100*O152 -> 140.94999999999999 | AK152: 139.8 | AL152: 89 | AM152: 41.6 | AN152: 70 | AO152: 1.9e-002 | AP152: 13 | AQ152: 天路转债!
A153: 270 | B153: 128072 | C153: 翔鹭转债! | D153: 2842 | E153: 翔鹭钨业 | F153: 有色金属 | G153: 小金属 | H153: 117 | I153: 2.e-003 | J153: -1.1599999999999999e-002 | K153: 11.81 | L153: -2.64e-002 | M153: 114.5 | N153: 15.36 | O153: 0.52200000000000002 | P153: 76.89 | Q153: 转股中 | R153: 3.96年 | S153: 1.96年 | T153: 3.02 | U153: 7.6 | V153: 2.2000000000000002e-002 | W153: 9.4e-002 | X153: 7.2000000000000008e-002 | Y153: 32 | Z153: 3.43 | AA153: -5.5000000000000005e-003 | AB153: -1.2e-002 | AC153: -5.9200000000000003e-002 | AD153: -6.1600000000000002e-002 | AE153: 90.81 | AF153: 91.09 | AG153: 0.37 | AH153: AA- | AI153: 6.0599999999999994e-002 | AJ153: =H153+100*O153 -> 169.19999999999999 | AK153: 157.1 | AL153: 239 | AM153: 66 | AN153: 243 | AO153: 1.8000000000000002e-002 | AP153: 29 | AQ153: 翔鹭转债!
A154: 176 | B154: 127018 | C154: 本钢转债! | D154: 761 | E154: 本钢板材 | F154: 钢铁 | G154: 炼钢 | H154: 131.455 | I154: 1.34e-002 | J154: 6.4000000000000003e-003 | K154: 6.67 | L154: 2.7699999999999999e-002 | M154: 128 | N154: 5.02 | O154: -1.1000000000000001e-002 | P154: 132.87 | Q154: 转股中 | R154: 4.82年 | S154: 2.82年 | T154: 67.1 | U154: 817 | V154: 9.4e-002 | W154: 0.25900000000000001 | X154: 0.34399999999999997 | Y154: 259 | Z154: 1.17 | AA154: -5.6999999999999993e-003 | AB154: -1.4999999999999999e-002 | AC154: -7.0800000000000002e-002 | AD154: -7.4099999999999999e-002 | AE154: 93.59 | AF154: 105.31 | AG154: 0.71 | AH154: AAA | AI154: 4.2599999999999999e-002 | AJ154: =H154+100*O154 -> 130.35500000000002 | AK154: 130 | AL154: 16 | AM154: 24.7 | AN154: 3 | AO154: 0.24299999999999999 | AP154: 66 | AQ154: 本钢转债!
A155: 91 | B155: 127026 | C155: 超声转债! | D155: 823 | E155: 超声电子 | F155: 电子 | G155: 元器件制 | H155: 116.5 | I155: 4.3e-003 | J155: -7.000000000000001e-004 | K155: 11.47 | L155: 6.9999999999999993e-003 | M155: 113.1 | N155: 12.72 | O155: 0.29199999999999998 | P155: 90.17 | Q155: 转股中 | R155: 5.26年 | S155: 3.26年 | T155: 7 | U155: 9.5 | V155: 1.2e-002 | W155: 0.114 | X155: 0.10199999999999999 | Y155: 62 | Z155: 1.6 | AA155: -5.6999999999999993e-003 | AB155: -1.0200000000000001e-002 | AC155: -3.39e-002 | AD155: -3.5799999999999998e-002 | AE155: 90.29 | AF155: 91.8 | AG155: 0.51 | AH155: AA | AI155: 4.1299999999999996e-002 | AJ155: =H155+100*O155 -> 145.69999999999999 | AK155: 142.8 | AL155: 124 | AM155: 51 | AN155: 146 | AO155: -1.7000000000000001e-002 | AP155: 13 | AQ155: 超声转债!
A156: 216 | B156: 123045 | C156: 雷迪转债 | D156: 300652 | E156: 雷迪克 | F156: 汽车 | G156: 零部件制 | H156: 121.979 | I156: 5.9999999999999995e-004 | J156: -5.9999999999999995e-004 | K156: 19.98 | L156: 0. | M156: 118.9 | N156: 19.63 | O156: 0.19800000000000001 | P156: 101.78 | Q156: 转股中 | R156: 4.52年 | S156: 2.52年 | T156: 1.66 | U156: 18 | V156: 8.6999999999999994e-002 | W156: 8.8000000000000009e-002 | X156: 8.9999999999999997e-002 | Y156: 19 | Z156: 2.04 | AA156: -5.7999999999999996e-003 | AB156: -1.3000000000000001e-002 | AC156: -5.79e-002 | AD156: -6.0599999999999994e-002 | AE156: 86.6 | AF156: 87.66 | AG156: 0.65 | AH156: A+ | AI156: 7.1599999999999997e-002 | AJ156: =H156+100*O156 -> 141.779 | AK156: 142.2 | AL156: 119 | AM156: 54.5 | AN156: 170 | AO156: 1.1000000000000001e-002 | AP156: 35 | AQ156: 雷迪转债
A157: 89 | B157: 113043 | C157: 财通转债! | D157: 601108 | E157: 财通证券 | F157: 金融 | G157: 证券行业 | H157: 113.8 | I157: -6.1999999999999998e-003 | J157: 4.6999999999999993e-003 | K157: 10.94 | L157: -3.5999999999999999e-003 | M157: 110.2 | N157: 13.13 | O157: 0.36599999999999999 | P157: 83.32 | Q157: 转股中 | R157: 5.27年 | S157: 无权 | T157: 38 | U157: 177 | V157: 4.0000000000000001e-002 | W157: 9.6999999999999989e-002 | X157: 8.1000000000000003e-002 | Y157: 393 | Z157: 1.72 | AA157: -6.1999999999999998e-003 | AB157: -9.7000000000000003e-003 | AC157: 无权 | AD157: 无权 | AE157: 无权 | AF157: 92.51 | AG157: 0.41 | AH157: AAA | AI157: 3.4300000000000004e-002 | AJ157: =H157+100*O157 -> 150.40000000000001 | AK157: 144.3 | AL157: 139 | AM157: 51.8 | AN157: 152 | AO157: 5.5999999999999994e-002 | AP157: 11 | AQ157: 财通转债!
A158: 301 | B158: 110053 | C158: 苏银转债! | D158: 600919 | E158: 江苏银行 | F158: 金融 | G158: 银行行业 | H158: 121 | I158: -1.7000000000000001e-003 | J158: -2.e-003 | K158: 6.47 | L158: -7.7000000000000002e-003 | M158: 118.3 | N158: 6.37 | O158: 0.191 | P158: 101.57 | Q158: 转股中 | R158: 3.52年 | S158: 无权 | T158: 200 | U158: 193 | V158: 8.0000000000000002e-003 | W158: 0.20899999999999999 | X158: 0.21299999999999999 | Y158: 956 | Z158: 0.68 | AA158: -6.6e-003 | AB158: -1.5600000000000001e-002 | AC158: 无权 | AD158: 无权 | AE158: 无权 | AF158: 106.02 | AG158: 0.48 | AH158: AAA | AI158: 3.2599999999999997e-002 | AJ158: =H158+100*O158 -> 140.09999999999999 | AK158: 140.4 | AL158: 98 | AM158: 34.4 | AN158: 25 | AO158: -2.8999999999999998e-002 | AP158: 37 | AQ158: 苏银转债!
A159: 308 | B159: 110051 | C159: 中天转债! | D159: 600522 | E159: 中天科技 | F159: 通信互联 | G159: 通信设备 | H159: 116.13 | I159: 8.3999999999999995e-003 | J159: -9.4999999999999998e-003 | K159: 8.36 | L159: -3.5999999999999999e-003 | M159: 113.3 | N159: 9.99 | O159: 0.38799999999999996 | P159: 83.68 | Q159: 转股中 | R159: 3.49年 | S159: 1.49年 | T159: 39.6 | U159: 103 | V159: 2.2000000000000002e-002 | W159: 0.155 | X159: 0.129 | Y159: 256 | Z159: 1.13 | AA159: -7.1999999999999998e-003 | AB159: -1.3999999999999999e-002 | AC159: -7.1599999999999997e-002 | AD159: -7.46e-002 | AE159: 97.22 | AF159: 100.86 | AG159: 0.29 | AH159: AA+ | AI159: 3.4599999999999999e-002 | AJ159: =H159+100*O159 -> 154.93000000000001 | AK159: 148.6 | AL159: 178 | AM159: 47.7 | AN159: 119 | AO159: 5.0000000000000001e-003 | AP159: 27 | AQ159: 中天转债!
A160: 220 | B160: 110067 | C160: 华安转债! | D160: 600909 | E160: 华安证券 | F160: 金融 | G160: 证券行业 | H160: 113.96 | I160: -2.0000000000000001e-004 | J160: -1.4000000000000002e-003 | K160: 5.57 | L160: -3.5999999999999999e-003 | M160: 110.3 | N160: 6.22 | O160: 0.27300000000000002 | P160: 89.55 | Q160: 转股中 | R160: 4.52年 | S160: 无权 | T160: 28 | U160: 138 | V160: 4.2999999999999997e-002 | W160: 0.107 | X160: 9.6000000000000002e-002 | Y160: 262 | Z160: 1.43 | AA160: -7.3000000000000001e-003 | AB160: -1.1399999999999999e-002 | AC160: 无权 | AD160: 无权 | AE160: 无权 | AF160: 95.6 | AG160: 0.44 | AH160: AAA | AI160: 3.2599999999999997e-002 | AJ160: =H160+100*O160 -> 141.25999999999999 | AK160: 138.4 | AL160: 73 | AM160: 42.8 | AN160: 80 | AO160: 5.0999999999999997e-002 | AP160: 28 | AQ160: 华安转债!
A161: 153 | B161: 123062 | C161: 三超转债 | D161: 300554 | E161: 三超新材 | F161: 机械装备 | G161: 通用设备 | H161: 123.5 | I161: -4.0999999999999995e-003 | J161: -7.4000000000000003e-003 | K161: 19.15 | L161: -1.54e-002 | M161: 119.2 | N161: 17.13 | O161: 0.105 | P161: 111.79 | Q161: 转股中 | R161: 4.89年 | S161: 2.90年 | T161: 1.95 | U161: 95 | V161: 0.39100000000000001 | W161: 0.109 | X161: 0.121 | Y161: 18 | Z161: 3.42 | AA161: -7.4000000000000003e-003 | AB161: -1.41e-002 | AC161: -5.4600000000000003e-002 | AD161: -5.7000000000000002e-002 | AE161: 82.07 | AF161: 81.91 | AG161: 0.75 | AH161: A | AI161: 8.1600000000000006e-002 | AJ161: =H161+100*O161 -> 134. | AK161: 135.2 | AL161: 39 | AM161: 53.1 | AN161: 159 | AO161: 5.0999999999999997e-002 | AP161: 26 | AQ161: 三超转债
A162: 295 | B162: 127012 | C162: 招路转债! | D162: 1965 | E162: 招商公路 | F162: 机场高速 | G162: 高速 | H162: 110.802 | I162: -4.4000000000000003e-003 | J162: 4.4000000000000003e-003 | K162: 7.48 | L162: 0. | M162: 107.9 | N162: 8.63 | O162: 0.27800000000000002 | P162: 86.67 | Q162: 转股中 | R162: 3.55年 | S162: 1.55年 | T162: 50 | U162: 38 | V162: 6.9999999999999993e-003 | W162: 0.10800000000000001 | X162: 9.4e-002 | Y162: 462 | Z162: 0.92 | AA162: -7.4999999999999997e-003 | AB162: -1.1699999999999999e-002 | AC162: -4.9299999999999997e-002 | AD162: -5.0999999999999997e-002 | AE162: 96.24 | AF162: 96.44 | AG162: 0.37 | AH162: AAA | AI162: 3.2599999999999997e-002 | AJ162: =H162+100*O162 -> 138.602 | AK162: 134.9 | AL162: 37 | AM162: 38.5 | AN162: 49 | AO162: 4.5999999999999999e-002 | AP162: 30 | AQ162: 招路转债!
A163: 339 | B163: 128037 | C163: 岩土转债! | D163: 2542 | E163: 中化岩土 | F163: 建筑 | G163: 建筑工程 | H163: 113.537 | I163: 2.5000000000000001e-003 | J163: -6.6e-003 | K163: 2.95 | L163: -1.01e-002 | M163: 111.3 | N163: 3.1 | O163: 0.193 | P163: 95.16 | Q163: 转股中 | R163: 2.53年 | S163: 0.53年 | T163: 5.99 | U163: 13 | V163: 2.e-002 | W163: 0.113 | X163: 0.107 | Y163: 53 | Z163: 1.35 | AA163: -8.0000000000000002e-003 | AB163: -1.61e-002 | AC163: -0.155 | AD163: -0.16 | AE163: 99.18 | AF163: 101.38 | AG163: 0.41 | AH163: AA | AI163: 3.8300000000000001e-002 | AJ163: =H163+100*O163 -> 132.83700000000002 | AK163: 131.9 | AL163: 20 | AM163: 30.5 | AN163: 12 | AO163: 4.4999999999999998e-002 | AP163: 52 | AQ163: 岩土转债!
A164: 58 | B164: 128144 | C164: 利民转债! | D164: 2734 | E164: 利民股份 | F164: 化工 | G164: 农化 | H164: 119.296 | I164: 0. | J164: 7.000000000000001e-004 | K164: 10.98 | L164: 1.8e-003 | M164: 114.1 | N164: 13.98 | O164: 0.51900000000000002 | P164: 78.54 | Q164: 2.1天 | R164: 5.49年 | S164: 3.49年 | T164: 9.8 | U164: 13 | V164: 1.1000000000000001e-002 | W164: 0.23999999999999999 | X164: 0.188 | Y164: 41 | Z164: 1.62 | AA164: -8.199999999999999e-003 | AB164: -1.2699999999999999e-002 | AC164: -4.0000000000000001e-002 | AD164: -4.1399999999999999e-002 | AE164: 88.81 | AF164: 91.69 | AG164: 0.37 | AH164: AA | AI164: 4.1299999999999996e-002 | AJ164: =H164+100*O164 -> 171.196 | AK164: 160.1 | AL164: 256 | AM164: 68.4 | AN164: 253 | AO164: -1.1000000000000001e-002 | AP164: 6 | AQ164: 利民转债!
A165: 238 | B165: 128091 | C165: 新天转债 | D165: 2873 | E165: 新天药业 | F165: 医药 | G165: 中药 | H165: 123.799 | I165: 1.4000000000000002e-003 | J165: 3.3e-003 | K165: 17.39 | L165: 6.8999999999999999e-003 | M165: 119.4 | N165: 16.27 | O165: 0.158 | P165: 106.88 | Q165: 转股中 | R165: 4.32年 | S165: 2.32年 | T165: 1.76 | U165: 14 | V165: 6.5000000000000002e-002 | W165: 8.6999999999999994e-002 | X165: 9.1999999999999998e-002 | Y165: 20 | Z165: 2.48 | AA165: -8.6e-003 | AB165: -1.6200000000000003e-002 | AC165: -6.6699999999999995e-002 | AD165: -6.9800000000000001e-002 | AE165: 88.18 | AF165: 89.3 | AG165: 0.68 | AH165: A+ | AI165: 7.1599999999999997e-002 | AJ165: =H165+100*O165 -> 139.59900000000002 | AK165: 140.7 | AL165: 101 | AM165: 51.4 | AN165: 148 | AO165: 3.3000000000000002e-002 | AP165: 19 | AQ165: 新天转债
A166: 112 | B166: 123075 | C166: 贝斯转债! | D166: 300580 | E166: 贝斯特 | F166: 汽车 | G166: 零部件制 | H166: 120.799 | I166: 0. | J166: -5.1999999999999998e-003 | K166: 21.89 | L166: -8.6e-003 | M166: 115.5 | N166: 23.74 | O166: 0.31 | P166: 92.21 | Q166: 转股中 | R166: 5年59天 | S166: 3.16年 | T166: 6 | U166: 5.7 | V166: 8.0000000000000002e-003 | W166: 0.13699999999999998 | X166: 0.126 | Y166: 44 | Z166: 2.55 | AA166: -8.8000000000000005e-003 | AB166: -1.41e-002 | AC166: -4.4800000000000006e-002 | AD166: -4.6900000000000004e-002 | AE166: 85.1 | AF166: 85.14 | AG166: 0.6 | AH166: AA- | AI166: 6.2300000000000001e-002 | AJ166: =H166+100*O166 -> 151.79900000000001 | AK166: 149.4 | AL166: 182 | AM166: 64.3 | AN166: 234 | AO166: -4.9000000000000002e-002 | AP166: 9 | AQ166: 贝斯转债!
A167: 17 | B167: 113050 | C167: 南银转债 | D167: 601009 | E167: 南京银行 | F167: 金融 | G167: 银行行业 | H167: 116.92 | I167: 2.0000000000000001e-004 | J167: -5.1000000000000004e-003 | K167: 9.46 | L167: -9.3999999999999986e-003 | M167: 111.2 | N167: 10.1 | O167: 0.248 | P167: 93.66 | Q167: 3月19天 | R167: 5.78年 | S167: 无权 | T167: 200 | U167: 127 | V167: 5.0000000000000001e-003 | W167: 0.21100000000000002 | X167: 0.19800000000000001 | Y167: 947 | Z167: 0.93 | AA167: -8.8000000000000005e-003 | AB167: -1.23e-002 | AC167: 无权 | AD167: 无权 | AE167: 无权 | AF167: 91.76 | AG167: 0.53 | AH167: AAA | AI167: 3.4300000000000004e-002 | AJ167: =H167+100*O167 -> 141.72 | AK167: 140.2 | AL167: 94 | AM167: 48.4 | AN167: 126 | AO167: 2.7000000000000003e-002 | AP167: 5 | AQ167: 南银转债
A168: 129 | B168: 128133 | C168: 奇正转债! | D168: 2287 | E168: 奇正藏药 | F168: 医药 | G168: 中药 | H168: 122.66 | I168: 2.4e-002 | J168: 2.75e-002 | K168: 32.26 | L168: 8.2200000000000009e-002 | M168: 117.3 | N168: 29.78 | O168: 0.13200000000000001 | P168: 108.33 | Q168: 转股中 | R168: 5年18天 | S168: 3年19天 | T168: 8 | U168: 187 | V168: 0.19 | W168: 4.7e-002 | X168: 5.0999999999999997e-002 | Y168: 171 | Z168: 5.19 | AA168: -9.0000000000000011e-003 | AB168: -1.49e-002 | AC168: -5.1100000000000007e-002 | AD168: -5.3099999999999994e-002 | AE168: 91.26 | AF168: 96.04 | AG168: 0.63 | AH168: AA | AI168: 4.1299999999999996e-002 | AJ168: =H168+100*O168 -> 135.85999999999999 | AK168: 137 | AL168: 57 | AM168: 41 | AN168: 62 | AO168: 0.156 | AP168: 17 | AQ168: 奇正转债!
A169: 55 | B169: 123101 | C169: 拓斯转债! | D169: 300607 | E169: 拓斯达 | F169: 机械装备 | G169: 机器人及 | H169: 120.951 | I169: -3.7000000000000002e-003 | J169: -8.199999999999999e-003 | K169: 21.21 | L169: -2.9700000000000001e-002 | M169: 115.1 | N169: 26.18 | O169: 0.49299999999999999 | P169: 81.02 | Q169: 13天 | R169: 5.51年 | S169: 3.52年 | T169: 6.7 | U169: 47 | V169: 5.7000000000000002e-002 | W169: 7.400000000000001e-002 | X169: 5.9999999999999998e-002 | Y169: 90 | Z169: 2.58 | AA169: -9.1000000000000004e-003 | AB169: -1.3899999999999999e-002 | AC169: -4.1500000000000002e-002 | AD169: -4.3299999999999998e-002 | AE169: 89.38 | AF169: 92.46 | AG169: 0.4 | AH169: AA | AI169: 4.1299999999999996e-002 | AJ169: =H169+100*O169 -> 170.25099999999998 | AK169: 160.9 | AL169: 259 | AM169: 68.4 | AN169: 255 | AO169: 1.e-002 | AP169: 5 | AQ169: 拓斯转债!
A170: 330 | B170: 123011 | C170: 德尔转债! | D170: 300473 | E170: 德尔股份 | F170: 汽车 | G170: 零部件制 | H170: 118.401 | I170: -1.1999999999999999e-003 | J170: -2.8999999999999998e-003 | K170: 24.26 | L170: -1.66e-002 | M170: 115.3 | N170: 31.38 | O170: 0.53200000000000003 | P170: 77.31 | Q170: 转股中 | R170: 2.87年 | S170: 0.87年 | T170: 2.51 | U170: 6.6 | V170: 2.2000000000000002e-002 | W170: 7.6999999999999999e-002 | X170: 5.9000000000000004e-002 | Y170: 33 | Z170: 1.51 | AA170: -9.300000000000001e-003 | AB170: -1.8700000000000001e-002 | AC170: -0.13500000000000001 | AD170: -0.13800000000000001 | AE170: 95.91 | AF170: 97.97 | AG170: 0.24 | AH170: AA- | AI170: 5.9299999999999999e-002 | AJ170: =H170+100*O170 -> 171.601 | AK170: 159.5 | AL170: 251 | AM170: 61.5 | AN170: 213 | AO170: -8.1000000000000003e-002 | AP170: 41 | AQ170: 德尔转债!
A171: 195 | B171: 128107 | C171: 交科转债 | D171: 2061 | E171: 浙江交科 | F171: 建筑 | G171: 建筑工程 | H171: 119.98 | I171: 2.0000000000000001e-004 | J171: -1.0500000000000001e-002 | K171: 5.42 | L171: -1.8100000000000002e-002 | M171: 114.9 | N171: 5.24 | O171: 0.16 | P171: 103.44 | Q171: 转股中 | R171: 4.63年 | S171: 2.63年 | T171: 25 | U171: 29 | V171: 1.e-002 | W171: 0.33500000000000002 | X171: 0.34700000000000003 | Y171: 75 | Z171: 0.84 | AA171: -9.4999999999999998e-003 | AB171: -1.5100000000000001e-002 | AC171: -5.21e-002 | AD171: -5.4299999999999994e-002 | AE171: 94.09 | AF171: 98.46 | AG171: 0.57 | AH171: AA+ | AI171: 3.4599999999999999e-002 | AJ171: =H171+100*O171 -> 135.98000000000002 | AK171: 136.5 | AL171: 52 | AM171: 38.1 | AN171: 43 | AO171: 4.5999999999999999e-002 | AP171: 20 | AQ171: 交科转债
A172: 44 | B172: 113622 | C172: 杭叉转债! | D172: 603298 | E172: 杭叉集团 | F172: 机械装备 | G172: 通用设备 | H172: 118.52 | I172: -1.77e-002 | J172: -6.4000000000000003e-003 | K172: 18.36 | L172: -6.3700000000000007e-002 | M172: 112.5 | N172: 23.08 | O172: 0.48999999999999999 | P172: 79.55 | Q172: 35天 | R172: 5.55年 | S172: 3.56年 | T172: 11.5 | U172: 6.6 | V172: 5.0000000000000001e-003 | W172: 7.2000000000000008e-002 | X172: 5.7999999999999996e-002 | Y172: 159 | Z172: 3.15 | AA172: -9.4999999999999998e-003 | AB172: -1.3500000000000002e-002 | AC172: -3.7200000000000004e-002 | AD172: -3.8699999999999998e-002 | AE172: 90.27 | AF172: 92.56 | AG172: 0.38 | AH172: AA+ | AI172: 3.6299999999999999e-002 | AJ172: =H172+100*O172 -> 167.51999999999998 | AK172: 157.5 | AL172: 242 | AM172: 64.9 | AN172: 237 | AO172: -1.9e-002 | AP172: 4 | AQ172: 杭叉转债!
A173: 135 | B173: 128130 | C173: 景兴转债 | D173: 2067 | E173: 景兴纸业 | F173: 造纸包装 | G173: 包装用纸 | H173: 120.63 | I173: -3.3e-003 | J173: 1.6000000000000001e-003 | K173: 3.83 | L173: -2.5999999999999999e-003 | M173: 114.8 | N173: 3.4 | O173: 7.0999999999999994e-002 | P173: 112.65 | Q173: 转股中 | R173: 4.99年 | S173: 2.99年 | T173: 10.7 | U173: 33 | V173: 2.6000000000000002e-002 | W173: 0.23699999999999999 | X173: 0.26700000000000002 | Y173: 45 | Z173: 0.89 | AA173: -1.e-002 | AB173: -1.5300000000000001e-002 | AC173: -4.82e-002 | AD173: -5.0099999999999999e-002 | AE173: 91.46 | AF173: 94.9 | AG173: 0.67 | AH173: AA | AI173: 3.9599999999999996e-002 | AJ173: =H173+100*O173 -> 127.72999999999999 | AK173: 128.6 | AL173: 13 | AM173: 33.7 | AN173: 23 | AO173: 4.9000000000000002e-002 | AP173: 17 | AQ173: 景兴转债
A174: 47 | B174: 128145 | C174: 日丰转债 | D174: 2953 | E174: 日丰股份 | F174: 家电 | G174: 零部件制 | H174: 122.014 | I174: 9.1999999999999998e-003 | J174: 4.1500000000000002e-002 | K174: 14.68 | L174: 7.0800000000000002e-002 | M174: 115.4 | N174: 13.66 | O174: 0.13500000000000001 | P174: 107.47 | Q174: 24天 | R174: 5.55年 | S174: 3.55年 | T174: 3.8 | U174: 87 | V174: 0.183 | W174: 0.106 | X174: 0.114 | Y174: 36 | Z174: 3.28 | AA174: -1.0200000000000001e-002 | AB174: -1.4999999999999999e-002 | AC174: -4.3099999999999999e-002 | AD174: -4.4900000000000002e-002 | AE174: 83.05 | AF174: 83.09 | AG174: 0.72 | AH174: AA- | AI174: 6.2300000000000001e-002 | AJ174: =H174+100*O174 -> 135.51400000000001 | AK174: 136.6 | AL174: 54 | AM174: 53.5 | AN174: 162 | AO174: 6.0999999999999999e-002 | AP174: 6 | AQ174: 日丰转债
A175: 268 | B175: 128073 | C175: 哈尔转债! | D175: 2615 | E175: 哈尔斯 | F175: 其他 | G175: 家居用品 | H175: 118.05 | I175: -7.6e-003 | J175: -1.7000000000000001e-003 | K175: 5.39 | L175: -2.e-002 | M175: 114.5 | N175: 5.71 | O175: 0.251 | P175: 94.4 | Q175: 转股中 | R175: 2.96年 | S175: 0.97年 | T175: 2.99 | U175: 11 | V175: 3.1e-002 | W175: 0.13500000000000001 | X175: 0.127 | Y175: 22 | Z175: 2.72 | AA175: -1.03e-002 | AB175: -1.89e-002 | AC175: -0.12300000000000001 | AD175: -0.125 | AE175: 94.86 | AF175: 96.69 | AG175: 0.46 | AH175: AA- | AI175: 5.9299999999999999e-002 | AJ175: =H175+100*O175 -> 143.15000000000001 | AK175: 141.7 | AL175: 114 | AM175: 45 | AN175: 96 | AO175: 4.8000000000000001e-002 | AP175: 39 | AQ175: 哈尔转债!
A176: 168 | B176: 128119 | C176: 龙大转债! | D176: 2726 | E176: 龙大肉食 | F176: 食品饮料 | G176: 肉制品 | H176: 126.1 | I176: 1.37e-002 | J176: 9.4999999999999998e-003 | K176: 10.4 | L176: 3.6900000000000002e-002 | M176: 119.9 | N176: 9.29 | O176: 0.126 | P176: 111.95 | Q176: 转股中 | R176: 4.86年 | S176: 2.86年 | T176: 9.46 | U176: 26 | V176: 2.2000000000000002e-002 | W176: 8.4000000000000005e-002 | X176: 9.4e-002 | Y176: 112 | Z176: 3.06 | AA176: -1.0500000000000001e-002 | AB176: -1.7399999999999999e-002 | AC176: -6.4000000000000001e-002 | AD176: -6.59e-002 | AE176: 92.03 | AF176: 99.63 | AG176: 0.63 | AH176: AA | AI176: 3.9599999999999996e-002 | AJ176: =H176+100*O176 -> 138.69999999999999 | AK176: 140.3 | AL176: 97 | AM176: 40.6 | AN176: 59 | AO176: 9.0999999999999998e-002 | AP176: 9 | AQ176: 龙大转债!
A177: 51 | B177: 123105 | C177: 拓尔转债! | D177: 300229 | E177: 拓尔思 | F177: 计算机及 | G177: 软件开发 | H177: 128.127 | I177: 0. | J177: -8.8000000000000005e-003 | K177: 10.94 | L177: -1.26e-002 | M177: 121 | N177: 9.96 | O177: 0.16600000000000001 | P177: 109.84 | Q177: 22天 | R177: 5.54年 | S177: 3.54年 | T177: 8 | U177: 49 | V177: 4.8000000000000001e-002 | W177: 0.10199999999999999 | X177: 0.11199999999999999 | Y177: 78 | Z177: 3.59 | AA177: -1.0500000000000001e-002 | AB177: -1.6799999999999999e-002 | AC177: -5.5399999999999998e-002 | AD177: -5.7200000000000001e-002 | AE177: 83.26 | AF177: 87.18 | AG177: 0.69 | AH177: AA- | AI177: 6.2300000000000001e-002 | AJ177: =H177+100*O177 -> 144.727 | AK177: 146.4 | AL177: 157 | AM177: 59.2 | AN177: 195 | AO177: 7.2999999999999995e-002 | AP177: 8 | AQ177: 拓尔转债!
A178: 13 | B178: 127039 | C178: 北港转债 | D178: 582 | E178: 北部湾港 | F178: 机场高速 | G178: 港口 | H178: 120.311 | I178: 1.9599999999999999e-002 | J178: -1.32e-002 | K178: 8.28 | L178: 1.1000000000000001e-002 | M178: 113 | N178: 8.35 | O178: 0.21299999999999999 | P178: 99.16 | Q178: 4月4天 | R178: 5.82年 | S178: 3.82年 | T178: 30 | U178: 143 | V178: 4.0000000000000001e-002 | W178: 0.222 | X178: 0.22 | Y178: 135 | Z178: 1.28 | AA178: -1.09e-002 | AB178: -1.49e-002 | AC178: -3.73e-002 | AD178: -3.8900000000000004e-002 | AE178: 90.57 | AF178: 93.18 | AG178: 0.58 | AH178: AAA | AI178: 3.4300000000000004e-002 | AJ178: =H178+100*O178 -> 141.61100000000002 | AK178: 141.5 | AL178: 111 | AM178: 48.3 | AN178: 124 | AO178: 7.0999999999999994e-002 | AP178: 5 | AQ178: 北港转债
A179: 239 | B179: 128090 | C179: 汽模转2 | D179: 2510 | E179: 天汽模 | F179: 汽车 | G179: 零部件制 | H179: 120.39 | I179: 7.4000000000000003e-003 | J179: -1.5e-003 | K179: 4.31 | L179: 9.3999999999999986e-003 | M179: 114.9 | N179: 4.23 | O179: 0.182 | P179: 101.89 | Q179: 转股中 | R179: 4.31年 | S179: 2.32年 | T179: 3.1 | U179: 34 | V179: 9.1999999999999998e-002 | W179: 7.5999999999999998e-002 | X179: 7.8e-002 | Y179: 41 | Z179: 1.99 | AA179: -1.1000000000000001e-002 | AB179: -1.7000000000000001e-002 | AC179: -5.9999999999999998e-002 | AD179: -6.2400000000000004e-002 | AE179: 89.5 | AF179: 89.64 | AG179: 0.63 | AH179: AA- | AI179: 6.0599999999999994e-002 | AJ179: =H179+100*O179 -> 138.59 | AK179: 138.9 | AL179: 85 | AM179: 49.2 | AN179: 132 | AO179: -1.1000000000000001e-002 | AP179: 30 | AQ179: 汽模转2
A180: 155 | B180: 110073 | C180: 国投转债 | D180: 600061 | E180: 国投资本 | F180: 金融 | G180: 证券行业 | H180: 116.42 | I180: 2.9999999999999997e-004 | J180: 2.0000000000000001e-004 | K180: 9.46 | L180: 1.1000000000000001e-003 | M180: 110.3 | N180: 9.9 | O180: 0.218 | P180: 95.56 | Q180: 转股中 | R180: 4.89年 | S180: 无权 | T180: 80 | U180: 637 | V180: 6.7000000000000004e-002 | W180: 0.13200000000000001 | X180: 0.126 | Y180: 608 | Z180: 1.38 | AA180: -1.11e-002 | AB180: -1.49e-002 | AC180: 无权 | AD180: 无权 | AE180: 无权 | AF180: 94.48 | AG180: 0.52 | AH180: AAA | AI180: 3.2599999999999997e-002 | AJ180: =H180+100*O180 -> 138.22 | AK180: 137.3 | AL180: 63 | AM180: 42.8 | AN180: 81 | AO180: 0.11 | AP180: 25 | AQ180: 国投转债
A181: 259 | B181: 127014 | C181: 北方转债! | D181: 65 | E181: 北方国际 | F181: 建筑 | G181: 建筑工程 | H181: 120.45 | I181: -4.7999999999999996e-003 | J181: 3.7000000000000002e-003 | K181: 8.29 | L181: -2.3999999999999998e-003 | M181: 115.1 | N181: 8.65 | O181: 0.25700000000000001 | P181: 95.84 | Q181: 转股中 | R181: 4年50天 | S181: 2年51天 | T181: 5.35 | U181: 91 | V181: 0.14000000000000001 | W181: 8.3000000000000004e-002 | X181: 8.0000000000000002e-002 | Y181: 64 | Z181: 1.11 | AA181: -1.1200000000000002e-002 | AB181: -1.7600000000000001e-002 | AC181: -6.4000000000000001e-002 | AD181: -6.6699999999999995e-002 | AE181: 95.88 | AF181: 100.32 | AG181: 0.47 | AH181: AA+ | AI181: 3.4599999999999999e-002 | AJ181: =H181+100*O181 -> 146.15000000000001 | AK181: 145.1 | AL181: 144 | AM181: 44.7 | AN181: 93 | AO181: 8.3000000000000004e-002 | AP181: 19 | AQ181: 北方转债!
A182: 190 | B182: 127017 | C182: 万青转债 | D182: 789 | E182: 万年青 | F182: 建筑 | G182: 水泥 | H182: 124.388 | I182: -3.9000000000000003e-003 | J182: 2.8999999999999998e-003 | K182: 12.5 | L182: -2.3999999999999998e-003 | M182: 118 | N182: 13.46 | O182: 0.33899999999999997 | P182: 92.87 | Q182: 转股中 | R182: 4.75年 | S182: 2.75年 | T182: 10 | U182: 7.3 | V182: 6.0000000000000001e-003 | W182: 0.10000000000000001 | X182: 9.3000000000000013e-002 | Y182: 100 | Z182: 1.53 | AA182: -1.1200000000000002e-002 | AB182: -1.77e-002 | AC182: -6.2100000000000002e-002 | AD182: -6.4100000000000004e-002 | AE182: 93.66 | AF182: 100.71 | AG182: 0.43 | AH182: AA+ | AI182: 3.4599999999999999e-002 | AJ182: =H182+100*O182 -> 158.28800000000001 | AK182: 155.9 | AL182: 233 | AM182: 55.2 | AN182: 178 | AO182: 6.9000000000000006e-002 | AP182: 8 | AQ182: 万青转债
A183: 319 | B183: 110047 | C183: 山鹰转债 | D183: 600567 | E183: 山鹰国际 | F183: 造纸包装 | G183: 包装用纸 | H183: 121.81 | I183: -9.7000000000000003e-003 | J183: 2.5000000000000001e-003 | K183: 3.47 | L183: -1.4199999999999999e-002 | M183: 117.5 | N183: 3.3 | O183: 0.158 | P183: 105.15 | Q183: 转股中 | R183: 3.21年 | S183: 1.22年 | T183: 22.5 | U183: 35 | V183: 1.3000000000000001e-002 | W183: 0.14000000000000001 | X183: 0.14699999999999999 | Y183: 160 | Z183: 1.01 | AA183: -1.1399999999999999e-002 | AB183: -2.07e-002 | AC183: -0.10800000000000001 | AD183: -0.111 | AE183: 98.15 | AF183: 105.58 | AG183: 0.51 | AH183: AA+ | AI183: 3.4599999999999999e-002 | AJ183: =H183+100*O183 -> 137.61000000000001 | AK183: 138.5 | AL183: 75 | AM183: 32.9 | AN183: 20 | AO183: 2.3e-002 | AP183: 29 | AQ183: 山鹰转债
A184: 158 | B184: 123061 | C184: 航新转债! | D184: 300424 | E184: 航新科技 | F184: 航空航天 | G184: 航空航天 | H184: 131.6 | I184: -3.2000000000000001e-002 | J184: 2.5000000000000001e-003 | K184: 17.71 | L184: -4.0599999999999997e-002 | M184: 124.3 | N184: 14.85 | O184: 0.10300000000000001 | P184: 119.26 | Q184: 转股中 | R184: 4.88年 | S184: 2.88年 | T184: 2.5 | U184: 205 | V184: 0.61399999999999999 | W184: 5.9000000000000004e-002 | X184: 7.0000000000000007e-002 | Y184: 42 | Z184: 6.3 | AA184: -1.1899999999999999e-002 | AB184: -2.e-002 | AC184: -7.4299999999999991e-002 | AD184: -7.6700000000000004e-002 | AE184: 84.6 | AF184: 89.38 | AG184: 0.73 | AH184: A+ | AI184: 7.1599999999999997e-002 | AJ184: =H184+100*O184 -> 141.90000000000001 | AK184: 143.9 | AL184: 136 | AM184: 54.6 | AN184: 172 | AO184: -2.6000000000000002e-002 | AP184: 20 | AQ184: 航新转债!
A185: 246 | B185: 110063 | C185: 鹰19转债 | D185: 600567 | E185: 山鹰国际 | F185: 造纸包装 | G185: 包装用纸 | H185: 121.96 | I185: -1.29e-002 | J185: 4.6999999999999993e-003 | K185: 3.47 | L185: -1.4199999999999999e-002 | M185: 115.9 | N185: 3.26 | O185: 0.14599999999999999 | P185: 106.44 | Q185: 转股中 | R185: 4.27年 | S185: 2.28年 | T185: 18.5 | U185: 16 | V185: 6.9999999999999993e-003 | W185: 0.115 | X185: 0.12300000000000001 | Y185: 160 | Z185: 1.01 | AA185: -1.21e-002 | AB185: -1.8500000000000003e-002 | AC185: -6.6500000000000004e-002 | AD185: -6.88e-002 | AE185: 95.08 | AF185: 100.51 | AG185: 0.58 | AH185: AA+ | AI185: 3.4599999999999999e-002 | AJ185: =H185+100*O185 -> 136.56 | AK185: 137.5 | AL185: 66 | AM185: 37 | AN185: 36 | AO185: 2.3e-002 | AP185: 32 | AQ185: 鹰19转债
A186: 193 | B186: 113579 | C186: 健友转债! | D186: 603707 | E186: 健友股份 | F186: 医药 | G186: 原料药 | H186: 120.39 | I186: -4.0999999999999995e-003 | J186: -2.e-003 | K186: 27.35 | L186: -1.55e-002 | M186: 113.9 | N186: 32.2 | O186: 0.41700000000000004 | P186: 84.94 | Q186: 转股中 | R186: 4.63年 | S186: 2.64年 | T186: 5.03 | U186: 3 | V186: 5.0000000000000001e-003 | W186: 1.4999999999999999e-002 | X186: 1.3000000000000001e-002 | Y186: 333 | Z186: 6.4 | AA186: -1.21e-002 | AB186: -1.7399999999999999e-002 | AC186: -5.3200000000000004e-002 | AD186: -5.5399999999999998e-002 | AE186: 92.83 | AF186: 95.48 | AG186: 0.39 | AH186: AA | AI186: 3.9599999999999996e-002 | AJ186: =H186+100*O186 -> 162.09 | AK186: 155.8 | AL186: 232 | AM186: 60.4 | AN186: 204 | AO186: -9.4e-002 | AP186: 9 | AQ186: 健友转债!
A187: 88 | B187: 127027 | C187: 靖远转债! | D187: 552 | E187: 靖远煤电 | F187: 煤炭 | G187: 煤炭开采 | H187: 122.8 | I187: -1.7000000000000001e-003 | J187: -3.4999999999999996e-003 | K187: 3.39 | L187: -8.8000000000000005e-003 | M187: 115.3 | N187: 3.23 | O187: 0.17000000000000001 | P187: 104.95 | Q187: 转股中 | R187: 5.27年 | S187: 3.27年 | T187: 28 | U187: 166 | V187: 4.8000000000000001e-002 | W187: 0.36099999999999999 | X187: 0.379 | Y187: 78 | Z187: 0.98 | AA187: -1.21e-002 | AB187: -1.72e-002 | AC187: -4.82e-002 | AD187: -5.0199999999999995e-002 | AE187: 91.96 | AF187: 95.93 | AG187: 0.59 | AH187: AA+ | AI187: 3.6299999999999999e-002 | AJ187: =H187+100*O187 -> 139.80000000000001 | AK187: 140.6 | AL187: 99 | AM187: 44.7 | AN187: 92 | AO187: 8.900000000000001e-002 | AP187: 42 | AQ187: 靖远转债!
A188: 9 | B188: 123119 | C188: 康泰转2 | D188: 300601 | E188: 康泰生物 | F188: 医药 | G188: 生物制药 | H188: 125.606 | I188: -1.09e-002 | J188: 1.7600000000000001e-002 | K188: 115.85 | L188: 1.6899999999999998e-002 | M188: 117.1 | N188: 145.63 | O188: 0.57899999999999996 | P188: 79.55 | Q188: 4月20天 | R188: 5.86年 | S188: 3.86年 | T188: 20 | U188: 52 | V188: 2.1000000000000001e-002 | W188: 2.5000000000000001e-002 | X188: 2.e-002 | Y188: 796 | Z188: 9.97 | AA188: -1.21e-002 | AB188: -1.7100000000000001e-002 | AC188: -4.7e-002 | AD188: -4.8600000000000004e-002 | AE188: 88.13 | AF188: 92.75 | AG188: 0.39 | AH188: AA | AI188: 4.1299999999999996e-002 | AJ188: =H188+100*O188 -> 183.506 | AK188: 171.7 | AL188: 285 | AM188: 78.9 | AN188: 287 | AO188: -0.11800000000000001 | AP188: 7 | AQ188: 康泰转2
A189: 355 | B189: 128023 | C189: 亚太转债! | D189: 2284 | E189: 亚太股份 | F189: 汽车 | G189: 零部件制 | H189: 114.38 | I189: 5.6000000000000008e-003 | J189: -8.3999999999999995e-003 | K189: 8.39 | L189: -1.41e-002 | M189: 111.3 | N189: 10.34 | O189: 0.40999999999999998 | P189: 81.14 | Q189: 转股中 | R189: 2.25年 | S189: 0.25年 | T189: 9.99 | U189: 8.8 | V189: 8.0000000000000002e-003 | W189: 0.161 | X189: 0.13100000000000001 | Y189: 62 | Z189: 2.47 | AA189: -1.23e-002 | AB189: -2.1299999999999999e-002 | AC189: -0.28199999999999997 | AD189: -0.28999999999999998 | AE189: 100.22 | AF189: 102.44 | AG189: 0.2 | AH189: AA | AI189: 3.8300000000000001e-002 | AJ189: =H189+100*O189 -> 155.38 | AK189: 147.6 | AL189: 166 | AM189: 45.2 | AN189: 98 | AO189: 2.e-003 | AP189: 65 | AQ189: 亚太转债!
A190: 137 | B190: 113602 | C190: 景20转债! | D190: 603228 | E190: 景旺电子 | F190: 电子 | G190: 元器件制 | H190: 120 | I190: -8.9999999999999998e-004 | J190: 3.8e-003 | K190: 24.53 | L190: 6.1999999999999998e-003 | M190: 112.9 | N190: 27.4 | O190: 0.34000000000000002 | P190: 89.53 | Q190: 转股中 | R190: 4.97年 | S190: 2.97年 | T190: 17.8 | U190: 12 | V190: 5.0000000000000001e-003 | W190: 8.5000000000000006e-002 | X190: 7.5999999999999998e-002 | Y190: 209 | Z190: 3.22 | AA190: -1.24e-002 | AB190: -1.7000000000000001e-002 | AC190: -4.6600000000000003e-002 | AD190: -4.8600000000000004e-002 | AE190: 91.62 | AF190: 93.42 | AG190: 0.47 | AH190: AA | AI190: 3.9599999999999996e-002 | AJ190: =H190+100*O190 -> 154. | AK190: 150.5 | AL190: 193 | AM190: 57.1 | AN190: 184 | AO190: -8.8000000000000009e-002 | AP190: 9 | AQ190: 景20转债!
A191: 336 | B191: 128040 | C191: 华通转债! | D191: 2758 | E191: 浙农股份 | F191: 医药 | G191: 医药商业 | H191: 115.429 | I191: 3.8e-003 | J191: 1.8e-003 | K191: 9.33 | L191: 1.41e-002 | M191: 111.3 | N191: 10.15 | O191: 0.25600000000000001 | P191: 91.92 | Q191: 转股中 | R191: 2.78年 | S191: 0.78年 | T191: 2.22 | U191: 4.9 | V191: 1.9e-002 | W191: 4.9000000000000002e-002 | X191: 4.4999999999999998e-002 | Y191: 46 | Z191: 1.49 | AA191: -1.32e-002 | AB191: -2.0499999999999997e-002 | AC191: -0.126 | AD191: -0.129 | AE191: 98.26 | AF191: 100.43 | AG191: 0.39 | AH191: AA | AI191: 3.8300000000000001e-002 | AJ191: =H191+100*O191 -> 141.029 | AK191: 138.9 | AL191: 86 | AM191: 38.5 | AN191: 50 | AO191: 1.1000000000000001e-002 | AP191: 33 | AQ191: 华通转债!
A192: 107 | B192: 127025 | C192: 冀东转债! | D192: 401 | E192: 冀东水泥 | F192: 建筑 | G192: 水泥 | H192: 117.9 | I192: -4.5999999999999999e-003 | J192: 1.5e-003 | K192: 13.26 | L192: -6.7000000000000002e-003 | M192: 110.1 | N192: 15.28 | O192: 0.35899999999999999 | P192: 86.78 | Q192: 转股中 | R192: 5.17年 | S192: 3.17年 | T192: 17.8 | U192: 10 | V192: 5.0000000000000001e-003 | W192: 9.5000000000000001e-002 | X192: 8.199999999999999e-002 | Y192: 187 | Z192: 1.19 | AA192: -1.3300000000000001e-002 | AB192: -1.6899999999999998e-002 | AC192: -4.0300000000000002e-002 | AD192: -4.1900000000000007e-002 | AE192: 91.97 | AF192: 92.74 | AG192: 0.45 | AH192: AAA | AI192: 3.4300000000000004e-002 | AJ192: =H192+100*O192 -> 153.80000000000001 | AK192: 149 | AL192: 179 | AM192: 56.3 | AN192: 180 | AO192: 2.8999999999999998e-002 | AP192: 9 | AQ192: 冀东转债!
A193: 8 | B193: 113627 | C193: 太平转债 | D193: 603877 | E193: 太平鸟 | F193: 服装纺织 | G193: 服装行业 | H193: 124.84 | I193: -1.55e-002 | J193: 1.2e-002 | K193: 43 | L193: -7.6e-003 | M193: 115.1 | N193: 50.32 | O193: 0.46100000000000002 | P193: 85.45 | Q193: 4月20天 | R193: 5.86年 | S193: 3.86年 | T193: 8 | U193: 13 | V193: 1.3000000000000001e-002 | W193: 3.9e-002 | X193: 3.3000000000000002e-002 | Y193: 205 | Z193: 5.21 | AA193: -1.3999999999999999e-002 | AB193: -1.8500000000000003e-002 | AC193: -4.5499999999999999e-002 | AD193: -4.7100000000000003e-002 | AE193: 88.13 | AF193: 91.17 | AG193: 0.46 | AH193: AA | AI193: 4.1299999999999996e-002 | AJ193: =H193+100*O193 -> 170.94 | AK193: 164.2 | AL193: 267 | AM193: 73.1 | AN193: 268 | AO193: -0.129 | AP193: 2 | AQ193: 太平转债
A194: 27 | B194: 111000 | C194: 起帆转债 | D194: 605222 | E194: 起帆电缆 | F194: 能源电力 | G194: 电力设备 | H194: 131.01 | I194: 2.0999999999999999e-003 | J194: -3.6200000000000003e-002 | K194: 22.2 | L194: -4.8799999999999996e-002 | M194: 120.5 | N194: 20.53 | O194: 0.21199999999999999 | P194: 108.13 | Q194: 2月27天 | R194: 5.72年 | S194: 3.72年 | T194: 10 | U194: 20 | V194: 1.4999999999999999e-002 | W194: 0.11199999999999999 | X194: 0.122 | Y194: 89 | Z194: 2.86 | AA194: -1.4800000000000001e-002 | AB194: -2.0799999999999999e-002 | AC194: -5.8499999999999996e-002 | AD194: -6.0199999999999997e-002 | AE194: 82.29 | AF194: 85.86 | AG194: 0.7 | AH194: AA- | AI194: 6.2300000000000001e-002 | AJ194: =H194+100*O194 -> 152.20999999999998 | AK194: 153.9 | AL194: 214 | AM194: 68 | AN194: 249 | AO194: -1.4999999999999999e-002 | AP194: 9 | AQ194: 起帆转债
A195: 292 | B195: 110057 | C195: 现代转债 | D195: 600420 | E195: 国药现代 | F195: 医药 | G195: 化学制药 | H195: 116.31 | I195: 1.1899999999999999e-002 | J195: -2.7000000000000001e-003 | K195: 9.64 | L195: 1.8000000000000002e-002 | M195: 110.3 | N195: 9.79 | O195: 0.18100000000000002 | P195: 98.47 | Q195: 转股中 | R195: 3.57年 | S195: 1.58年 | T195: 16.2 | U195: 29 | V195: 1.4999999999999999e-002 | W195: 0.16300000000000001 | X195: 0.161 | Y195: 99 | Z195: 1.21 | AA195: -1.4999999999999999e-002 | AB195: -2.0199999999999999e-002 | AC195: -6.8900000000000003e-002 | AD195: -7.1800000000000003e-002 | AE195: 97.26 | AF195: 98.58 | AG195: 0.52 | AH195: AAA | AI195: 3.2599999999999997e-002 | AJ195: =H195+100*O195 -> 134.41 | AK195: 134.2 | AL195: 31 | AM195: 35.6 | AN195: 30 | AO195: 1.2e-002 | AP195: 24 | AQ195: 现代转债
A196: 163 | B196: 113593 | C196: 沪工转债! | D196: 603131 | E196: 上海沪工 | F196: 机械装备 | G196: 通用设备 | H196: 130.62 | I196: -1.8000000000000002e-002 | J196: 3.1600000000000003e-002 | K196: 22.32 | L196: 2.0099999999999996e-002 | M196: 121.2 | N196: 21.12 | O196: 0.23600000000000002 | P196: 105.68 | Q196: 转股中 | R196: 4.87年 | S196: 2.88年 | T196: 4 | U196: 28 | V196: 5.0999999999999997e-002 | W196: 5.5999999999999994e-002 | X196: 5.9999999999999998e-002 | Y196: 71 | Z196: 5.5 | AA196: -1.55e-002 | AB196: -2.2799999999999997e-002 | AC196: -7.2099999999999997e-002 | AD196: -7.4499999999999997e-002 | AE196: 84.59 | AF196: 87.17 | AG196: 0.68 | AH196: A+ | AI196: 7.1599999999999997e-002 | AJ196: =H196+100*O196 -> 154.22 | AK196: 155.6 | AL196: 228 | AM196: 68.4 | AN196: 254 | AO196: -1.6e-002 | AP196: 11 | AQ196: 沪工转债!
A197: 221 | B197: 113570 | C197: 百达转债! | D197: 603331 | E197: 百达精工 | F197: 机械装备 | G197: 机械装备 | H197: 123.21 | I197: 1.61e-002 | J197: 9.8999999999999991e-003 | K197: 12.57 | L197: 3.5400000000000001e-002 | M197: 114.9 | N197: 11.34 | O197: 0.11199999999999999 | P197: 110.85 | Q197: 转股中 | R197: 4.52年 | S197: 2.52年 | T197: 2.8 | U197: 5.7 | V197: 1.7000000000000001e-002 | W197: 0.125 | X197: 0.13900000000000001 | Y197: 22 | Z197: 2.69 | AA197: -1.5600000000000001e-002 | AB197: -2.1400000000000002e-002 | AC197: -6.3700000000000007e-002 | AD197: -6.59e-002 | AE197: 86.03 | AF197: 84.64 | AG197: 0.73 | AH197: A+ | AI197: 7.1599999999999997e-002 | AJ197: =H197+100*O197 -> 134.41 | AK197: 135.6 | AL197: 44 | AM197: 49.5 | AN197: 133 | AO197: 5.4000000000000006e-002 | AP197: 34 | AQ197: 百达转债!
A198: 41 | B198: 123108 | C198: 乐普转2 | D198: 300003 | E198: 乐普医疗 | F198: 医药 | G198: 医疗器械 | H198: 119.333 | I198: 2.8999999999999998e-003 | J198: 5.5000000000000005e-003 | K198: 26.9 | L198: 1.8200000000000001e-002 | M198: 111.1 | N198: 29.5 | O198: 0.309 | P198: 91.19 | Q198: 35天 | R198: 4.57年 | S198: 2.57年 | T198: 16.4 | U198: 25 | V198: 1.3000000000000001e-002 | W198: 3.4000000000000002e-002 | X198: 3.1e-002 | Y198: 485 | Z198: 4.27 | AA198: -1.5700000000000002e-002 | AB198: -2.0099999999999996e-002 | AC198: -5.5800000000000002e-002 | AD198: -5.7099999999999998e-002 | AE198: 93.02 | AF198: 95.29 | AG198: 0.46 | AH198: AA+ | AI198: 3.4599999999999999e-002 | AJ198: =H198+100*O198 -> 150.233 | AK198: 147.5 | AL198: 164 | AM198: 52.2 | AN198: 154 | AO198: 3.7000000000000005e-002 | AP198: 11 | AQ198: 乐普转2
A199: 198 | B199: 113577 | C199: 春秋转债! | D199: 603890 | E199: 春秋电子 | F199: 电子 | G199: 电子产品 | H199: 126.56 | I199: 2.7000000000000001e-003 | J199: -4.4000000000000003e-003 | K199: 12.09 | L199: -2.5000000000000001e-003 | M199: 117.7 | N199: 10.85 | O199: 0.13600000000000001 | P199: 111.43 | Q199: 转股中 | R199: 4.61年 | S199: 2.61年 | T199: 1.78 | U199: 9.3 | V199: 4.0999999999999995e-002 | W199: 3.4000000000000002e-002 | X199: 3.7000000000000005e-002 | Y199: 53 | Z199: 2.47 | AA199: -1.5900000000000001e-002 | AB199: -2.2499999999999999e-002 | AC199: -7.0000000000000007e-002 | AD199: -7.2300000000000003e-002 | AE199: 88.14 | AF199: 90.28 | AG199: 0.68 | AH199: AA- | AI199: 6.0599999999999994e-002 | AJ199: =H199+100*O199 -> 140.16 | AK199: 141.7 | AL199: 113 | AM199: 51.4 | AN199: 149 | AO199: -3.6000000000000004e-002 | AP199: 17 | AQ199: 春秋转债!
A200: 81 | B200: 113614 | C200: 健20转债! | D200: 603707 | E200: 健友股份 | F200: 医药 | G200: 原料药 | H200: 124.4 | I200: 1.1999999999999999e-003 | J200: -9.3999999999999986e-003 | K200: 27.35 | L200: -1.55e-002 | M200: 114.2 | N200: 29.12 | O200: 0.32500000000000001 | P200: 93.92 | Q200: 转股中 | R200: 5.29年 | S200: 3.29年 | T200: 7.8 | U200: 5.6 | V200: 6.0000000000000001e-003 | W200: 2.3e-002 | X200: 2.2000000000000002e-002 | Y200: 333 | Z200: 6.4 | AA200: -1.6399999999999998e-002 | AB200: -2.1000000000000001e-002 | AC200: -5.1799999999999999e-002 | AD200: -5.3600000000000002e-002 | AE200: 90.3 | AF200: 92.61 | AG200: 0.53 | AH200: AA | AI200: 4.1299999999999996e-002 | AJ200: =H200+100*O200 -> 156.90000000000001 | AK200: 154.9 | AL200: 219 | AM200: 62.3 | AN200: 223 | AO200: -9.4e-002 | AP200: 4 | AQ200: 健20转债!
A201: 340 | B201: 127006 | C201: 敖东转债! | D201: 623 | E201: 吉林敖东 | F201: 金融 | G201: 证券行业 | H201: 112.053 | I201: -2.2000000000000001e-003 | J201: -1.e-004 | K201: 16.76 | L201: -8.8999999999999999e-003 | M201: 107.4 | N201: 20.22 | O201: 0.35200000000000004 | P201: 82.89 | Q201: 转股中 | R201: 2.52年 | S201: 0.52年 | T201: 24.1 | U201: 28 | V201: 1.e-002 | W201: 0.12300000000000001 | X201: 0.10199999999999999 | Y201: 195 | Z201: 0.83 | AA201: -1.6899999999999998e-002 | AB201: -2.23e-002 | AC201: -0.14800000000000002 | AD201: -0.151 | AE201: 98.81 | AF201: 98.98 | AG201: 0.26 | AH201: AA+ | AI201: 3.3300000000000003e-002 | AJ201: =H201+100*O201 -> 147.25299999999999 | AK201: 141.2 | AL201: 109 | AM201: 42.2 | AN201: 74 | AO201: 4.2000000000000003e-002 | AP201: 28 | AQ201: 敖东转债!
A202: 337 | B202: 128039 | C202: 三力转债! | D202: 2224 | E202: 三 力 士 | F202: 机械装备 | G202: 专用设备 | H202: 114 | I202: 4.0999999999999995e-003 | J202: -1.6000000000000001e-003 | K202: 5.18 | L202: 5.7999999999999996e-003 | M202: 108.8 | N202: 5.79 | O202: 0.27399999999999997 | P202: 89.46 | Q202: 转股中 | R202: 2.76年 | S202: 0.76年 | T202: 2.02 | U202: 11 | V202: 4.5999999999999999e-002 | W202: 5.4000000000000006e-002 | X202: 4.8000000000000001e-002 | Y202: 38 | Z202: 1.61 | AA202: -1.7000000000000001e-002 | AB202: -2.2799999999999997e-002 | AC202: -0.11900000000000001 | AD202: -0.122 | AE202: 96.27 | AF202: 93.01 | AG202: 0.44 | AH202: AA- | AI202: 5.9299999999999999e-002 | AJ202: =H202+100*O202 -> 141.40000000000001 | AK202: 138.5 | AL202: 78 | AM202: 42.3 | AN202: 75 | AO202: 2.7000000000000003e-002 | AP202: 30 | AQ202: 三力转债!
A203: 80 | B203: 128141 | C203: 旺能转债 | D203: 2034 | E203: 旺能环境 | F203: 城市公用 | G203: 三废处理 | H203: 125.8 | I203: -2.e-003 | J203: -6.6e-003 | K203: 18.06 | L203: -1.26e-002 | M203: 115.1 | N203: 15.97 | O203: 0.11199999999999999 | P203: 113.09 | Q203: 转股中 | R203: 5.29年 | S203: 3.29年 | T203: 14 | U203: 60 | V203: 3.4000000000000002e-002 | W203: 0.184 | X203: 0.20800000000000002 | Y203: 76 | Z203: 1.61 | AA203: -1.7000000000000001e-002 | AB203: -2.1899999999999999e-002 | AC203: -5.5099999999999996e-002 | AD203: -5.6900000000000006e-002 | AE203: 90.2 | AF203: 93.32 | AG203: 0.68 | AH203: AA | AI203: 4.1299999999999996e-002 | AJ203: =H203+100*O203 -> 137. | AK203: 138.5 | AL203: 76 | AM203: 45.2 | AN203: 100 | AO203: 5.5e-002 | AP203: 7 | AQ203: 旺能转债
A204: 10 | B204: 127041 | C204: 弘亚转债 | D204: 2833 | E204: 弘亚数控 | F204: 机械装备 | G204: 专用设备 | H204: 128.95 | I204: -1.7100000000000001e-002 | J204: 2.07e-002 | K204: 39.9 | L204: 5.5000000000000005e-003 | M204: 118.75 | N204: 38.09 | O204: 0.23100000000000001 | P204: 104.75 | Q204: 4月16天 | R204: 4.85年 | S204: 2.86年 | T204: 6 | U204: 17 | V204: 2.2000000000000002e-002 | W204: 5.0000000000000003e-002 | X204: 5.2000000000000005e-002 | Y204: 121 | Z204: 6.56 | AA204: -1.7100000000000001e-002 | AB204: -2.3599999999999999e-002 | AC204: -7.3499999999999996e-002 | AD204: -7.4999999999999997e-002 | AE204: 85.91 | AF204: 89.62 | AG204: 0.64 | AH204: AA- | AI204: 6.0599999999999994e-002 | AJ204: =H204+100*O204 -> 152.04999999999998 | AK204: 153.1 | AL204: 212 | AM204: 63.5 | AN204: 230 | AO204: 0.10800000000000001 | AP204: 4 | AQ204: 弘亚转债
A205: 60 | B205: 123100 | C205: 朗科转债 | D205: 300543 | E205: 朗科智能 | F205: 电子 | G205: 电子产品 | H205: 129.24 | I205: 1.8799999999999997e-002 | J205: 4.0999999999999995e-003 | K205: 13.57 | L205: 3.04e-002 | M205: 117.5 | N205: 11.61 | O205: 0.106 | P205: 116.88 | Q205: 转股中 | R205: 5.43年 | S205: 3.44年 | T205: 3.8 | U205: 53 | V205: 0.10800000000000001 | W205: 0.10400000000000001 | X205: 0.122 | Y205: 36 | Z205: 3.98 | AA205: -1.77e-002 | AB205: -2.3199999999999998e-002 | AC205: -5.9500000000000004e-002 | AD205: -6.13e-002 | AE205: 83.72 | AF205: 85.19 | AG205: 0.76 | AH205: AA- | AI205: 6.2300000000000001e-002 | AJ205: =H205+100*O205 -> 139.84 | AK205: 141.6 | AL205: 112 | AM205: 56.4 | AN205: 181 | AO205: -0.13 | AP205: 9 | AQ205: 朗科转债
A206: 62 | B206: 123098 | C206: 一品转债! | D206: 300723 | E206: 一品红 | F206: 医药 | G206: 医药行业 | H206: 136.381 | I206: -6.0000000000000001e-003 | J206: 4.0999999999999995e-003 | K206: 34.32 | L206: -2.3e-003 | M206: 124 | N206: 25.48 | O206: 1.3000000000000001e-002 | P206: 134.69 | Q206: 转股中 | R206: 5.40年 | S206: 3.40年 | T206: 4.25 | U206: 47 | V206: 8.1000000000000003e-002 | W206: 4.2999999999999997e-002 | X206: 5.7999999999999996e-002 | Y206: 99 | Z206: 6.7 | AA206: -1.78e-002 | AB206: -2.5000000000000001e-002 | AC206: -7.400000000000001e-002 | AD206: -7.5800000000000006e-002 | AE206: 83.95 | AF206: 90.07 | AG206: 0.79 | AH206: AA- | AI206: 6.2300000000000001e-002 | AJ206: =H206+100*O206 -> 137.68100000000001 | AK206: 138.1 | AL206: 70 | AM206: 48 | AN206: 123 | AO206: -4.0999999999999995e-002 | AP206: 8 | AQ206: 一品转债!
A207: 261 | B207: 128079 | C207: 英联转债! | D207: 2846 | E207: 英联股份 | F207: 造纸包装 | G207: 包装材料 | H207: 126.399 | I207: 8.0000000000000004e-004 | J207: -2.3e-003 | K207: 7.64 | L207: -2.5999999999999999e-003 | M207: 117.5 | N207: 8.29 | O207: 0.37200000000000005 | P207: 92.16 | Q207: 转股中 | R207: 4年47天 | S207: 2年48天 | T207: 1.52 | U207: 11 | V207: 5.7000000000000002e-002 | W207: 6.2e-002 | X207: 5.7999999999999996e-002 | Y207: 24 | Z207: 3.09 | AA207: -1.7899999999999999e-002 | AB207: -2.5099999999999997e-002 | AC207: -8.3499999999999991e-002 | AD207: -8.6199999999999999e-002 | AE207: 88.61 | AF207: 88.92 | AG207: 0.6 | AH207: A+ | AI207: 7.1599999999999997e-002 | AJ207: =H207+100*O207 -> 163.59899999999999 | AK207: 160.6 | AL207: 258 | AM207: 71.7 | AN207: 264 | AO207: -6.9999999999999993e-003 | AP207: 17 | AQ207: 英联转债!
A208: 354 | B208: 128025 | C208: 特一转债! | D208: 2728 | E208: 特一药业 | F208: 医药 | G208: 化学制药 | H208: 113.3 | I208: 5.1999999999999998e-003 | J208: 2.0000000000000001e-004 | K208: 11.7 | L208: 1.83e-002 | M208: 108.8 | N208: 14.05 | O208: 0.36099999999999999 | P208: 83.27 | Q208: 转股中 | R208: 2.26年 | S208: 0.26年 | T208: 2.98 | U208: 14 | V208: 4.0000000000000001e-002 | W208: 0.125 | X208: 0.10400000000000001 | Y208: 24 | Z208: 2.45 | AA208: -1.8100000000000002e-002 | AB208: -2.52e-002 | AC208: -0.26200000000000001 | AD208: -0.26899999999999996 | AE208: 99.11 | AF208: 95.75 | AG208: 0.3 | AH208: AA- | AI208: 5.9299999999999999e-002 | AJ208: =H208+100*O208 -> 149.40000000000001 | AK208: 143.3 | AL208: 130 | AM208: 44.2 | AN208: 87 | AO208: -2.e-002 | AP208: 51 | AQ208: 特一转债!
A209: 320 | B209: 128048 | C209: 张行转债 | D209: 2839 | E209: 张家港行 | F209: 金融 | G209: 银行行业 | H209: 119.991 | I209: -1.7000000000000001e-003 | J209: 1.7000000000000001e-003 | K209: 5.93 | L209: 0. | M209: 113.3 | N209: 5.6 | O209: 0.13300000000000001 | P209: 105.89 | Q209: 转股中 | R209: 3.19年 | S209: 无权 | T209: 25 | U209: 55 | V209: 1.8000000000000002e-002 | W209: 0.23300000000000001 | X209: 0.247 | Y209: 107 | Z209: 0.96 | AA209: -1.8200000000000001e-002 | AB209: -2.5499999999999998e-002 | AC209: 无权 | AD209: 无权 | AE209: 无权 | AF209: 101.89 | AG209: 0.56 | AH209: AA+ | AI209: 3.4599999999999999e-002 | AJ209: =H209+100*O209 -> 133.291 | AK209: 134.1 | AL209: 30 | AM209: 32.2 | AN209: 17 | AO209: 2.7999999999999997e-002 | AP209: 12 | AQ209: 张行转债
A210: 191 | B210: 128108 | C210: 蓝帆转债! | D210: 2382 | E210: 蓝帆医疗 | F210: 医药 | G210: 医疗器械 | H210: 122.989 | I210: 1.09e-002 | J210: -1.5e-003 | K210: 20.19 | L210: 1.41e-002 | M210: 112.9 | N210: 18.24 | O210: 0.111 | P210: 110.69 | Q210: 转股中 | R210: 4.73年 | S210: 3.73年 | T210: 15.3 | U210: 37 | V210: 2.e-002 | W210: 7.4999999999999997e-002 | X210: 8.3000000000000004e-002 | Y210: 203 | Z210: 1.6 | AA210: -1.83e-002 | AB210: -2.3099999999999999e-002 | AC210: -3.9699999999999999e-002 | AD210: -4.2099999999999999e-002 | AE210: 90.66 | AF210: 94.3 | AG210: 0.67 | AH210: AA | AI210: 3.9599999999999996e-002 | AJ210: =H210+100*O210 -> 134.089 | AK210: 135.3 | AL210: 40 | AM210: 41 | AN210: 66 | AO210: -9.0000000000000011e-003 | AP210: 27 | AQ210: 蓝帆转债!
A211: 43 | B211: 110079 | C211: 杭银转债! | D211: 600926 | E211: 杭州银行 | F211: 金融 | G211: 银行行业 | H211: 124.55 | I211: 1.9e-003 | J211: -1.55e-002 | K211: 14.33 | L211: -2.0499999999999997e-002 | M211: 112.4 | N211: 12.99 | O211: 0.129 | P211: 110.32 | Q211: 35天 | R211: 5.56年 | S211: 无权 | T211: 150 | U211: 277 | V211: 1.4999999999999999e-002 | W211: 0.17699999999999999 | X211: 0.19500000000000001 | Y211: 850 | Z211: 1.27 | AA211: -1.8500000000000003e-002 | AB211: -2.2499999999999999e-002 | AC211: 无权 | AD211: 无权 | AE211: 无权 | AF211: 93.43 | AG211: 0.66 | AH211: AAA | AI211: 3.4300000000000004e-002 | AJ211: =H211+100*O211 -> 137.44999999999999 | AK211: 138.8 | AL211: 82 | AM211: 45.4 | AN211: 103 | AO211: 7.2999999999999995e-002 | AP211: 13 | AQ211: 杭银转债!
A212: 36 | B212: 123112 | C212: 万讯转债 | D212: 300112 | E212: 万讯自控 | F212: 机械装备 | G212: 专用设备 | H212: 138.343 | I212: 1.8000000000000002e-002 | J212: -1.21e-002 | K212: 11.33 | L212: 8.0000000000000002e-003 | M212: 124.4 | N212: 8.93 | O212: 8.9999999999999997e-002 | P212: 126.88 | Q212: 41天 | R212: 5.59年 | S212: 3.59年 | T212: 2.46 | U212: 123 | V212: 0.35799999999999998 | W212: 7.5999999999999998e-002 | X212: 9.6000000000000002e-002 | Y212: 32 | Z212: 3.11 | AA212: -1.9199999999999998e-002 | AB212: -2.6200000000000001e-002 | AC212: -7.2999999999999995e-002 | AD212: -7.4900000000000008e-002 | AE212: 83.32 | AF212: 89.37 | AG212: 0.74 | AH212: AA- | AI212: 6.2300000000000001e-002 | AJ212: =H212+100*O212 -> 147.34299999999999 | AK212: 149.8 | AL212: 186 | AM212: 60.4 | AN212: 206 | AO212: -1.3000000000000001e-002 | AP212: 14 | AQ212: 万讯转债
A213: 288 | B213: 113024 | C213: 核建转债! | D213: 601611 | E213: 中国核建 | F213: 建筑 | G213: 建筑工程 | H213: 117.08 | I213: -7.0999999999999995e-003 | J213: -5.5000000000000005e-003 | K213: 8.85 | L213: -2.9600000000000001e-002 | M213: 109.3 | N213: 9.7 | O213: 0.28300000000000003 | P213: 91.24 | Q213: 转股中 | R213: 3.59年 | S213: 1.59年 | T213: 30 | U213: 59 | V213: 1.7000000000000001e-002 | W213: 0.128 | X213: 0.11699999999999999 | Y213: 234 | Z213: 1.97 | AA213: -1.9299999999999998e-002 | AB213: -2.4e-002 | AC213: -7.17e-002 | AD213: -7.4499999999999997e-002 | AE213: 97.2 | AF213: 97.63 | AG213: 0.43 | AH213: AAA | AI213: 3.2599999999999997e-002 | AJ213: =H213+100*O213 -> 145.38 | AK213: 142.9 | AL213: 127 | AM213: 45.3 | AN213: 102 | AO213: 0.121 | AP213: 35 | AQ213: 核建转债!
A214: 242 | B214: 113030 | C214: 东风转债! | D214: 601515 | E214: 东风股份 | F214: 造纸包装 | G214: 包装材料 | H214: 127.38 | I214: 2.7300000000000001e-002 | J214: 9.1999999999999998e-003 | K214: 7.14 | L214: 5.7800000000000004e-002 | M214: 116.9 | N214: 6.45 | O214: 0.151 | P214: 110.7 | Q214: 转股中 | R214: 4.30年 | S214: 2.31年 | T214: 2.95 | U214: 46 | V214: 0.12300000000000001 | W214: 3.1e-002 | X214: 3.4000000000000002e-002 | Y214: 95 | Z214: 2.15 | AA214: -2.0099999999999996e-002 | AB214: -2.6800000000000001e-002 | AC214: -8.1600000000000006e-002 | AD214: -8.4000000000000005e-002 | AE214: 94.03 | AF214: 99.25 | AG214: 0.63 | AH214: AA | AI214: 3.9599999999999996e-002 | AJ214: =H214+100*O214 -> 142.47999999999999 | AK214: 144.1 | AL214: 138 | AM214: 44.8 | AN214: 95 | AO214: 0.161 | AP214: 18 | AQ214: 东风转债!
A215: 241 | B215: 123038 | C215: 联得转债! | D215: 300545 | E215: 联得装备 | F215: 机械装备 | G215: 专用设备 | H215: 129.7 | I215: 3.5999999999999999e-003 | J215: 1.5300000000000001e-002 | K215: 26.8 | L215: 2.6800000000000001e-002 | M215: 118.6 | N215: 24.07 | O215: 0.16500000000000001 | P215: 111.34 | Q215: 转股中 | R215: 4.31年 | S215: 2.31年 | T215: 1.47 | U215: 97 | V215: 0.503 | W215: 3.1e-002 | X215: 3.4000000000000002e-002 | Y215: 48 | Z215: 3.46 | AA215: -2.1000000000000001e-002 | AB215: -2.8300000000000002e-002 | AC215: -8.6800000000000002e-002 | AD215: -8.9399999999999993e-002 | AE215: 87.7 | AF215: 88.69 | AG215: 0.7 | AH215: A+ | AI215: 7.1599999999999997e-002 | AJ215: =H215+100*O215 -> 146.19999999999999 | AK215: 148.1 | AL215: 171 | AM215: 59.4 | AN215: 197 | AO215: 1.6e-002 | AP215: 20 | AQ215: 联得转债!
A216: 173 | B216: 123057 | C216: 美联转债! | D216: 300586 | E216: 美联新材 | F216: 化工 | G216: 橡胶塑料 | H216: 130.38 | I216: 2.2599999999999999e-002 | J216: 2.0799999999999999e-002 | K216: 10.32 | L216: 6.3899999999999998e-002 | M216: 117.8 | N216: 9.5 | O216: 0.20000000000000001 | P216: 108.63 | Q216: 转股中 | R216: 4.82年 | S216: 2.82年 | T216: 2.07 | U216: 257 | V216: 0.95099999999999996 | W216: 3.7999999999999999e-002 | X216: 4.0999999999999995e-002 | Y216: 54 | Z216: 4.5 | AA216: -2.12e-002 | AB216: -2.75e-002 | AC216: -7.4200000000000002e-002 | AD216: -7.6299999999999993e-002 | AE216: 87.13 | AF216: 89.25 | AG216: 0.68 | AH216: AA- | AI216: 6.0599999999999994e-002 | AJ216: =H216+100*O216 -> 150.38 | AK216: 152.1 | AL216: 204 | AM216: 62.9 | AN216: 226 | AO216: -8.0000000000000002e-003 | AP216: 21 | AQ216: 美联转债!
A217: 207 | B217: 113575 | C217: 东时转债!! | D217: 603377 | E217: 东方时尚 | F217: 其他 | G217: 其他 | H217: 124.65 | I217: 4.1999999999999997e-003 | J217: -2.5999999999999999e-003 | K217: 8.16 | L217: 8.6999999999999994e-003 | M217: 113.1 | N217: 12.15 | O217: 0.85599999999999998 | P217: 67.16 | Q217: 转股中 | R217: 4.59年 | S217: 2.60年 | T217: 0.98 | U217: 12 | V217: 9.6999999999999989e-002 | W217: 1.7000000000000001e-002 | X217: 1.1000000000000001e-002 | Y217: 59 | Z217: 2.85 | AA217: -2.1299999999999999e-002 | AB217: -2.63e-002 | AC217: -6.5799999999999997e-002 | AD217: -6.7900000000000002e-002 | AE217: 93 | AF217: 94.96 | AG217: 0.19 | AH217: AA | AI217: 3.9599999999999996e-002 | AJ217: =H217+100*O217 -> 210.25 | AK217: 182.1 | AL217: 307 | AM217: 87.2 | AN217: 299 | AO217: -1.4999999999999999e-002 | AP217: 15 | AQ217: 东时转债!!
A218: 252 | B218: 113549 | C218: 白电转债 | D218: 603861 | E218: 白云电器 | F218: 能源电力 | G218: 电力设备 | H218: 125.5 | I218: 4.9599999999999998e-002 | J218: -2.4300000000000002e-002 | K218: 9.59 | L218: 4.0099999999999997e-002 | M218: 114.8 | N218: 8.83 | O218: 0.156 | P218: 108.61 | Q218: 转股中 | R218: 4.20年 | S218: 2.20年 | T218: 8.8 | U218: 144 | V218: 0.13200000000000001 | W218: 0.20899999999999999 | X218: 0.22699999999999998 | Y218: 42 | Z218: 1.67 | AA218: -2.1400000000000002e-002 | AB218: -2.75e-002 | AC218: -7.9699999999999993e-002 | AD218: -8.2100000000000006e-002 | AE218: 94.32 | AF218: 97.86 | AG218: 0.63 | AH218: AA | AI218: 3.9599999999999996e-002 | AJ218: =H218+100*O218 -> 141.09999999999999 | AK218: 142.4 | AL218: 121 | AM218: 44.5 | AN218: 90 | AO218: 6.3e-002 | AP218: 40 | AQ218: 白电转债
A219: 199 | B219: 123050 | C219: 聚飞转债! | D219: 300303 | E219: 聚飞光电 | F219: 电子 | G219: LED制 | H219: 136.489 | I219: 2.7000000000000003e-002 | J219: -1.6500000000000001e-002 | K219: 6.25 | L219: 1.46e-002 | M219: 123.8 | N219: 5.08 | O219: 0.109 | P219: 123.03 | Q219: 转股中 | R219: 4.61年 | S219: 2.61年 | T219: 3.75 | U219: 326 | V219: 0.63400000000000001 | W219: 4.4999999999999998e-002 | X219: 5.5e-002 | Y219: 84 | Z219: 3.37 | AA219: -2.1400000000000002e-002 | AB219: -2.9700000000000001e-002 | AC219: -9.4899999999999998e-002 | AD219: -9.7100000000000006e-002 | AE219: 88.24 | AF219: 94.95 | AG219: 0.72 | AH219: AA- | AI219: 6.0599999999999994e-002 | AJ219: =H219+100*O219 -> 147.38900000000001 | AK219: 149.9 | AL219: 189 | AM219: 55 | AN219: 175 | AO219: -7.400000000000001e-002 | AP219: 14 | AQ219: 聚飞转债!
A220: 22 | B220: 123115 | C220: 捷捷转债 | D220: 300623 | E220: 捷捷微电 | F220: 电子 | G220: 元器件制 | H220: 134.6 | I220: -1.6399999999999998e-002 | J220: 2.5699999999999997e-002 | K220: 29.69 | L220: 1.37e-002 | M220: 118.5 | N220: 29 | O220: 0.315 | P220: 102.38 | Q220: 3月13天 | R220: 5.76年 | S220: 3.76年 | T220: 12 | U220: 97 | V220: 5.9999999999999998e-002 | W220: 5.5e-002 | X220: 5.5999999999999994e-002 | Y220: 219 | Z220: 8.15 | AA220: -2.23e-002 | AB220: -2.76e-002 | AC220: -6.4399999999999999e-002 | AD220: -6.6100000000000006e-002 | AE220: 82.08 | AF220: 84.23 | AG220: 0.68 | AH220: AA- | AI220: 6.2300000000000001e-002 | AJ220: =H220+100*O220 -> 166.09999999999999 | AK220: 166.8 | AL220: 275 | AM220: 82.6 | AN220: 293 | AO220: -9.4e-002 | AP220: 5 | AQ220: 捷捷转债
A221: 125 | B221: 110075 | C221: 南航转债 | D221: 600029 | E221: 南方航空 | F221: 交通运输 | G221: 航空运输 | H221: 124.62 | I221: 1.7299999999999999e-002 | J221: -4.3e-003 | K221: 6.01 | L221: 2.3900000000000001e-002 | M221: 110 | N221: 6.24 | O221: 0.29399999999999998 | P221: 96.31 | Q221: 转股中 | R221: 5年41天 | S221: 3年42天 | T221: 59 | U221: 172 | V221: 2.3e-002 | W221: 5.7999999999999996e-002 | X221: 5.5999999999999994e-002 | Y221: 1019. | Z221: 1.36 | AA221: -2.4399999999999998e-002 | AB221: -2.7900000000000001e-002 | AC221: -5.8799999999999998e-002 | AD221: -5.9999999999999998e-002 | AE221: 91.61 | AF221: 92.79 | AG221: 0.55 | AH221: AAA | AI221: 3.4300000000000004e-002 | AJ221: =H221+100*O221 -> 154.02000000000001 | AK221: 152.9 | AL221: 210 | AM221: 60.1 | AN221: 202 | AO221: 7.4999999999999997e-002 | AP221: 7 | AQ221: 南航转债
A222: 4 | B222: 123121 | C222: 帝尔转债 | D222: 300776 | E222: 帝尔激光 | F222: 机械装备 | G222: 专用设备 | H222: 139.817 | I222: 3.7000000000000002e-003 | J222: -9.1999999999999998e-003 | K222: 176.49 | L222: -9.1999999999999998e-003 | M222: 121 | N222: 192.7 | O222: 0.52700000000000002 | P222: 91.59 | Q222: 5月11天 | R222: 5.92年 | S222: 3.92年 | T222: 8.4 | U222: 141 | V222: 0.11800000000000001 | W222: 4.4999999999999998e-002 | X222: 4.0999999999999995e-002 | Y222: 187 | Z222: 9.79 | AA222: -2.4500000000000001e-002 | AB222: -3.04e-002 | AC222: -7.0599999999999996e-002 | AD222: -7.22e-002 | AE222: 81.36 | AF222: 85.2 | AG222: 0.6 | AH222: AA- | AI222: 6.2300000000000001e-002 | AJ222: =H222+100*O222 -> 192.517 | AK222: 188 | AL222: 315 | AM222: 102.8 | AN222: 321 | AO222: 6.4000000000000001e-002 | AP222: 2 | AQ222: 帝尔转债
A223: 370 | B223: 128013 | C223: 洪涛转债! | D223: 2325 | E223: 洪涛股份 | F223: 建筑 | G223: 装饰工程 | H223: 110.65 | I223: 2.0999999999999999e-003 | J223: -4.4000000000000003e-003 | K223: 2.47 | L223: -4.0000000000000001e-003 | M223: 108 | N223: 2.32 | O223: 3.9e-002 | P223: 106.47 | Q223: 转股中 | R223: 0.90年 | S223: 回售内 | T223: 11.5 | U223: 55 | V223: 4.2999999999999997e-002 | W223: 0.36799999999999999 | X223: 0.39200000000000002 | Y223: 31 | Z223: 1.12 | AA223: -2.6499999999999999e-002 | AB223: -4.2500000000000003e-002 | AC223: 回售内 | AD223: 回售内 | AE223: 100.33 | AF223: 100.09 | AG223: 0.58 | AH223: A- | AI223: 8.8000000000000009e-002 | AJ223: =H223+100*O223 -> 114.55000000000001 | AK223: 114.8 | AL223: 1 | AM223: 14.5 | AN223: 1 | AO223: 5.5e-002 | AP223: 97 | AQ223: 洪涛转债!
A224: 359 | B224: 110038 | C224: 济川转债! | D224: 600566 | E224: 济川药业 | F224: 医药 | G224: 中药 | H224: 110.97 | I224: -2.0000000000000001e-004 | J224: 2.0000000000000001e-004 | K224: 16.94 | L224: 5.9999999999999995e-004 | M224: 107.5 | N224: 23.4 | O224: 0.53299999999999992 | P224: 72.39 | Q224: 转股中 | R224: 1.19年 | S224: 回售内 | T224: 6.28 | U224: 3.4 | V224: 5.0000000000000001e-003 | W224: 4.2000000000000003e-002 | X224: 2.9999999999999999e-002 | Y224: 150 | Z224: 1.85 | AA224: -2.6499999999999999e-002 | AB224: -3.7999999999999999e-002 | AC224: 回售内 | AD224: 回售内 | AE224: 100.25 | AF224: 102.83 | AG224: 0.03 | AH224: AA | AI224: 3.8300000000000001e-002 | AJ224: =H224+100*O224 -> 164.26999999999998 | AK224: 149.5 | AL224: 184 | AM224: 46.7 | AN224: 111 | AO224: 7.9000000000000001e-002 | AP224: 22 | AQ224: 济川转债!
A225: 273 | B225: 113541 | C225: 荣晟转债! | D225: 603165 | E225: 荣晟环保 | F225: 造纸包装 | G225: 包装用纸 | H225: 127.04 | I225: 2.7000000000000001e-003 | J225: 2.5000000000000001e-003 | K225: 12.35 | L225: 7.3000000000000001e-003 | M225: 114.3 | N225: 10.84 | O225: 0.115 | P225: 113.93 | Q225: 转股中 | R225: 3.88年 | S225: 1.89年 | T225: 1.63 | U225: 5.9 | V225: 2.7999999999999997e-002 | W225: 5.0000000000000003e-002 | X225: 5.7000000000000002e-002 | Y225: 33 | Z225: 1.92 | AA225: -2.7300000000000001e-002 | AB225: -3.3599999999999998e-002 | AC225: -9.8599999999999993e-002 | AD225: -0.10099999999999999 | AE225: 91.19 | AF225: 91.33 | AG225: 0.7 | AH225: AA- | AI225: 6.0599999999999994e-002 | AJ225: =H225+100*O225 -> 138.54000000000002 | AK225: 140.2 | AL225: 93 | AM225: 48.8 | AN225: 127 | AO225: 3.0000000000000001e-003 | AP225: 43 | AQ225: 荣晟转债!
A226: 25 | B226: 127035 | C226: 濮耐转债 | D226: 2225 | E226: 濮耐股份 | F226: 钢铁 | G226: 钢铁行业 | H226: 130.407 | I226: -3.4000000000000002e-003 | J226: -1.2500000000000001e-002 | K226: 4.99 | L226: -2.35e-002 | M226: 114.7 | N226: 4.43 | O226: 0.158 | P226: 112.64 | Q226: 2月29天 | R226: 4.72年 | S226: 2.73年 | T226: 6.26 | U226: 63 | V226: 7.5999999999999998e-002 | W226: 0.124 | X226: 0.14000000000000001 | Y226: 50 | Z226: 1.67 | AA226: -2.7300000000000001e-002 | AB226: -3.2599999999999997e-002 | AC226: -7.7600000000000002e-002 | AD226: -7.9600000000000004e-002 | AE226: 92.5 | AF226: 95.83 | AG226: 0.67 | AH226: AA | AI226: 3.9599999999999996e-002 | AJ226: =H226+100*O226 -> 146.20700000000002 | AK226: 148.2 | AL226: 173 | AM226: 52.3 | AN226: 155 | AO226: 5.5e-002 | AP226: 10 | AQ226: 濮耐转债
A227: 189 | B227: 123051 | C227: 今天转债 | D227: 300532 | E227: 今天国际 | F227: 计算机及 | G227: 软件开发 | H227: 139.3 | I227: 3.4200000000000001e-002 | J227: 1.04e-002 | K227: 11.55 | L227: 5.67e-002 | M227: 122.3 | N227: 8.7 | O227: 4.9000000000000002e-002 | P227: 132.76 | Q227: 转股中 | R227: 4.75年 | S227: 2.75年 | T227: 2.79 | U227: 196 | V227: 0.505 | W227: 8.900000000000001e-002 | X227: 0.11800000000000001 | Y227: 32 | Z227: 3.81 | AA227: -2.76e-002 | AB227: -3.5200000000000002e-002 | AC227: -9.5500000000000002e-002 | AD227: -9.7899999999999987e-002 | AE227: 85.37 | AF227: 88.76 | AG227: 0.79 | AH227: A+ | AI227: 7.1599999999999997e-002 | AJ227: =H227+100*O227 -> 144.20000000000002 | AK227: 145.8 | AL227: 152 | AM227: 57.1 | AN227: 185 | AO227: 4.0000000000000001e-002 | AP227: 19 | AQ227: 今天转债
A228: 250 | B228: 128081 | C228: 海亮转债! | D228: 2203 | E228: 海亮股份 | F228: 有色金属 | G228: 铜金属 | H228: 129.1 | I228: 1.18e-002 | J228: -3.7000000000000002e-003 | K228: 11.43 | L228: 1.15e-002 | M228: 114.9 | N228: 9.69 | O228: 9.4e-002 | P228: 117.96 | Q228: 转股中 | R228: 4.21年 | S228: 2.22年 | T228: 30.1 | U228: 120 | V228: 3.1e-002 | W228: 0.13400000000000001 | X228: 0.158 | Y228: 225 | Z228: 2.32 | AA228: -2.7799999999999998e-002 | AB228: -3.39e-002 | AC228: -8.9800000000000005e-002 | AD228: -9.2200000000000004e-002 | AE228: 94.36 | AF228: 97.9 | AG228: 0.7 | AH228: AA | AI228: 3.9599999999999996e-002 | AJ228: =H228+100*O228 -> 138.5 | AK228: 140.2 | AL228: 96 | AM228: 42.3 | AN228: 76 | AO228: 2.e-002 | AP228: 51 | AQ228: 海亮转债!
A229: 156 | B229: 128122 | C229: 兴森转债! | D229: 2436 | E229: 兴森科技 | F229: 电子 | G229: 元器件制 | H229: 126.11 | I229: -2.41e-002 | J229: 2.2400000000000003e-002 | K229: 13.06 | L229: -3.8e-003 | M229: 113 | N229: 14.1 | O229: 0.36200000000000004 | P229: 92.62 | Q229: 转股中 | R229: 3.88年 | S229: 2.89年 | T229: 2.69 | U229: 37 | V229: 0.106 | W229: 1.3999999999999999e-002 | X229: 1.3000000000000001e-002 | Y229: 194 | Z229: 5.92 | AA229: -2.8199999999999999e-002 | AB229: -3.4000000000000002e-002 | AC229: -6.3600000000000004e-002 | AD229: -6.5500000000000003e-002 | AE229: 91.87 | AF229: 97.35 | AG229: 0.45 | AH229: AA | AI229: 3.9599999999999996e-002 | AJ229: =H229+100*O229 -> 162.31 | AK229: 159.6 | AL229: 252 | AM229: 62.2 | AN229: 221 | AO229: -0.10300000000000001 | AP229: 12 | AQ229: 兴森转债!
A230: 358 | B230: 123002 | C230: 国祯转债!! | D230: 300388 | E230: 节能国祯 | F230: 城市公用 | G230: 三废处理 | H230: 115.852 | I230: -8.0000000000000002e-003 | J230: 2.3999999999999998e-003 | K230: 7.79 | L230: -1.2699999999999999e-002 | M230: 108.8 | N230: 8.36 | O230: 0.24299999999999999 | P230: 93.18 | Q230: 转股中 | R230: 2.22年 | S230: 0.22年 | T230: 2.52 | U230: 4.9 | V230: 1.7000000000000001e-002 | W230: 4.5999999999999999e-002 | X230: 4.2999999999999997e-002 | Y230: 54 | Z230: 1.52 | AA230: -2.8300000000000002e-002 | AB230: -3.5400000000000001e-002 | AC230: -0.33899999999999997 | AD230: -0.34600000000000003 | AE230: 100.08 | AF230: 100.22 | AG230: 0.44 | AH230: AA | AI230: 3.8300000000000001e-002 | AJ230: =H230+100*O230 -> 140.15200000000002 | AK230: 138.5 | AL230: 77 | AM230: 38.3 | AN230: 47 | AO230: 5.9000000000000004e-002 | AP230: 16 | AQ230: 国祯转债!!
A231: 186 | B231: 123052 | C231: 飞鹿转债! | D231: 300665 | E231: 飞鹿股份 | F231: 化工 | G231: 化工 | H231: 144.889 | I231: 1.3999999999999999e-002 | J231: -2.5999999999999999e-003 | K231: 9.69 | L231: 1.47e-002 | M231: 126.8 | N231: 7.05 | O231: 5.4000000000000006e-002 | P231: 137.45 | Q231: 转股中 | R231: 4.75年 | S231: 2.75年 | T231: 1.5 | U231: 86 | V231: 0.39200000000000002 | W231: 8.9999999999999997e-002 | X231: 0.12300000000000001 | Y231: 17 | Z231: 3.34 | AA231: -2.8300000000000002e-002 | AB231: -3.7100000000000001e-002 | AC231: -0.105 | AD231: -0.10800000000000001 | AE231: 85.79 | AF231: 92.05 | AG231: 0.78 | AH231: A+ | AI231: 7.1599999999999997e-002 | AJ231: =H231+100*O231 -> 150.28900000000002 | AK231: 152.3 | AL231: 205 | AM231: 60.3 | AN231: 203 | AO231: -1.e-002 | AP231: 24 | AQ231: 飞鹿转债!
A232: 262 | B232: 128078 | C232: 太极转债! | D232: 2368 | E232: 太极股份 | F232: 计算机及 | G232: 软件开发 | H232: 131.6 | I232: -7.4999999999999997e-003 | J232: 6.0599999999999994e-002 | K232: 26.16 | L232: 5.3099999999999994e-002 | M232: 116.9 | N232: 22.21 | O232: 0.11699999999999999 | P232: 117.78 | Q232: 转股中 | R232: 4年47天 | S232: 2年48天 | T232: 9.6 | U232: 212 | V232: 0.161 | W232: 6.3e-002 | X232: 7.4999999999999997e-002 | Y232: 152 | Z232: 4.52 | AA232: -2.8799999999999999e-002 | AB232: -3.5699999999999996e-002 | AC232: -0.10000000000000001 | AD232: -0.10300000000000001 | AE232: 94.67 | AF232: 99.93 | AG232: 1 | AH232: AA | AI232: 3.9599999999999996e-002 | AJ232: =H232+100*O232 -> 143.29999999999998 | AK232: 145.4 | AL232: 147 | AM232: 45.5 | AN232: 104 | AO232: 0.183 | AP232: 10 | AQ232: 太极转债!
A233: 280 | B233: 113536 | C233: 三星转债 | D233: 603578 | E233: 三星新材 | F233: 家电 | G233: 零部件制 | H233: 127.36 | I233: 5.0000000000000001e-004 | J233: -7.9000000000000008e-003 | K233: 15.64 | L233: -1.1399999999999999e-002 | M233: 114.3 | N233: 13.76 | O233: 0.121 | P233: 113.66 | Q233: 转股中 | R233: 3.74年 | S233: 1.74年 | T233: 1.49 | U233: 17 | V233: 8.6999999999999994e-002 | W233: 7.400000000000001e-002 | X233: 8.4000000000000005e-002 | Y233: 20 | Z233: 2.64 | AA233: -2.8999999999999998e-002 | AB233: -3.56e-002 | AC233: -0.107 | AD233: -0.109 | AE233: 95.52 | AF233: 99.12 | AG233: 0.65 | AH233: AA | AI233: 3.9599999999999996e-002 | AJ233: =H233+100*O233 -> 139.46000000000001 | AK233: 141.1 | AL233: 106 | AM233: 41.9 | AN233: 72 | AO233: 8.5999999999999993e-002 | AP233: 36 | AQ233: 三星转债
A234: 109 | B234: 128137 | C234: 洁美转债 | D234: 2859 | E234: 洁美科技 | F234: 电子 | G234: 元器件制 | H234: 136.7 | I234: -1.3000000000000001e-002 | J234: 8.1000000000000013e-003 | K234: 31.38 | L234: -6.6e-003 | M234: 117.3 | N234: 27.63 | O234: 0.20399999999999999 | P234: 113.57 | Q234: 转股中 | R234: 5.17年 | S234: 3.17年 | T234: 5.99 | U234: 6.8 | V234: 8.0000000000000002e-003 | W234: 4.7e-002 | X234: 5.2999999999999999e-002 | Y234: 129 | Z234: 6.8 | AA234: -2.9700000000000001e-002 | AB234: -3.5299999999999998e-002 | AC234: -7.9899999999999999e-002 | AD234: -8.1799999999999998e-002 | AE234: 85.04 | AF234: 86.41 | AG234: 0.74 | AH234: AA- | AI234: 6.2300000000000001e-002 | AJ234: =H234+100*O234 -> 157.09999999999999 | AK234: 159.8 | AL234: 254 | AM234: 73.4 | AN234: 270 | AO234: -2.e-003 | AP234: 4 | AQ234: 洁美转债
A235: 338 | B235: 128036 | C235: 金农转债!! | D235: 2548 | E235: 金新农 | F235: 农业 | G235: 畜牧业 | H235: 117.831 | I235: 6.1999999999999998e-003 | J235: -4.4000000000000003e-003 | K235: 5.26 | L235: 1.7399999999999999e-002 | M235: 109.3 | N235: 6.93 | O235: 0.55200000000000005 | P235: 75.9 | Q235: 转股中 | R235: 2.51年 | S235: 0.51年 | T235: 1.46 | U235: 18 | V235: 0.10300000000000001 | W235: 4.0000000000000001e-002 | X235: 2.9999999999999999e-002 | Y235: 36 | Z235: 1.36 | AA235: -2.9999999999999999e-002 | AB235: -3.6600000000000001e-002 | AC235: -0.20899999999999999 | AD235: -0.21299999999999999 | AE235: 97.91 | AF235: 94.82 | AG235: 0.11 | AH235: AA- | AI235: 5.9299999999999999e-002 | AJ235: =H235+100*O235 -> 173.03100000000001 | AK235: 159.8 | AL235: 253 | AM235: 61.9 | AN235: 218 | AO235: 6.9999999999999993e-003 | AP235: 15 | AQ235: 金农转债!!
A236: 266 | B236: 128075 | C236: 远东转债! | D236: 2406 | E236: 远东传动 | F236: 汽车 | G236: 零部件制 | H236: 130.026 | I236: 2.0000000000000001e-004 | J236: 1.e-003 | K236: 6.5 | L236: 1.5e-003 | M236: 114.9 | N236: 5.29 | O236: 5.7999999999999996e-002 | P236: 122.87 | Q236: 转股中 | R236: 4年19天 | S236: 2年20天 | T236: 5.44 | U236: 27 | V236: 3.7999999999999999e-002 | W236: 0.13400000000000001 | X236: 0.16500000000000001 | Y236: 41 | Z236: 1.26 | AA236: -3.0699999999999998e-002 | AB236: -3.6900000000000002e-002 | AC236: -9.9000000000000005e-002 | AD236: -0.10099999999999999 | AE236: 94.95 | AF236: 98.52 | AG236: 0.74 | AH236: AA | AI236: 3.9599999999999996e-002 | AJ236: =H236+100*O236 -> 135.82600000000002 | AK236: 137.2 | AL236: 61 | AM236: 38.7 | AN236: 52 | AO236: -1.2e-002 | AP236: 16 | AQ236: 远东转债!
A237: 118 | B237: 123071 | C237: 天能转债!! | D237: 300569 | E237: 天能重工 | F237: 能源电力 | G237: 风能 | H237: 141.7 | I237: 2.6200000000000001e-002 | J237: 6.7000000000000002e-003 | K237: 10.35 | L237: 3.2899999999999999e-002 | M237: 121.1 | N237: 7.91 | O237: 8.3000000000000004e-002 | P237: 130.85 | Q237: 转股中 | R237: 5年47天 | S237: 3年48天 | T237: 6.95 | U237: 392 | V237: 0.39299999999999996 | W237: 8.5000000000000006e-002 | X237: 0.111 | Y237: 82 | Z237: 2.97 | AA237: -3.0800000000000001e-002 | AB237: -3.7400000000000003e-002 | AC237: -9.0299999999999991e-002 | AD237: -9.2300000000000007e-002 | AE237: 85.42 | AF237: 89.44 | AG237: 1 | AH237: AA- | AI237: 6.2300000000000001e-002 | AJ237: =H237+100*O237 -> 150. | AK237: 152.6 | AL237: 208 | AM237: 63.1 | AN237: 228 | AO237: 1.3999999999999999e-002 | AP237: 14 | AQ237: 天能转债!!
A238: 162 | B238: 127020 | C238: 中金转债 | D238: 60 | E238: 中金岭南 | F238: 有色金属 | G238: 有色行业 | H238: 132 | I238: 1.1699999999999999e-002 | J238: 1.7500000000000002e-002 | K238: 6.1 | L238: 3.7400000000000003e-002 | M238: 113.5 | N238: 4.63 | O238: 2.e-003 | P238: 131.75 | Q238: 转股中 | R238: 4.87年 | S238: 2.88年 | T238: 37.9 | U238: 876 | V238: 0.16899999999999998 | W238: 0.17399999999999999 | X238: 0.22899999999999998 | Y238: 218 | Z238: 1.83 | AA238: -3.0899999999999997e-002 | AB238: -3.56e-002 | AC238: -8.0799999999999997e-002 | AD238: -8.2100000000000006e-002 | AE238: 92.24 | AF238: 96.36 | AG238: 0.78 | AH238: AA+ | AI238: 3.4599999999999999e-002 | AJ238: =H238+100*O238 -> 132.19999999999999 | AK238: 132.3 | AL238: 22 | AM238: 35.9 | AN238: 33 | AO238: 9.5000000000000001e-002 | AP238: 19 | AQ238: 中金转债
A239: 93 | B239: 128140 | C239: 润建转债! | D239: 2929 | E239: 润建股份 | F239: 通信互联 | G239: 通信设备 | H239: 135.752 | I239: 4.4199999999999996e-002 | J239: -1.47e-002 | K239: 31 | L239: 4.1299999999999996e-002 | M239: 115.2 | N239: 26.4 | O239: 0.156 | P239: 117.42 | Q239: 转股中 | R239: 5.26年 | S239: 3.26年 | T239: 10.9 | U239: 156 | V239: 0.105 | W239: 0.159 | X239: 0.187 | Y239: 68 | Z239: 2.09 | AA239: -3.1300000000000001e-002 | AB239: -3.6200000000000003e-002 | AC239: -7.6200000000000004e-002 | AD239: -7.8e-002 | AE239: 90.4 | AF239: 93.52 | AG239: 0.71 | AH239: AA | AI239: 4.1299999999999996e-002 | AJ239: =H239+100*O239 -> 151.352 | AK239: 154.1 | AL239: 215 | AM239: 60.6 | AN239: 209 | AO239: 8.1000000000000003e-002 | AP239: 12 | AQ239: 润建转债!
A240: 285 | B240: 113026 | C240: 核能转债! | D240: 601985 | E240: 中国核电 | F240: 能源电力 | G240: 核电 | H240: 122.8 | I240: -1.9e-003 | J240: -1.e-003 | K240: 5.68 | L240: -5.3e-003 | M240: 109.3 | N240: 5.73 | O240: 0.23899999999999999 | P240: 99.13 | Q240: 转股中 | R240: 3.61年 | S240: 1.61年 | T240: 78 | U240: 263 | V240: 2.7000000000000003e-002 | W240: 7.9000000000000001e-002 | X240: 7.8e-002 | Y240: 992 | Z240: 1.59 | AA240: -3.2300000000000002e-002 | AB240: -3.6900000000000002e-002 | AC240: -9.5700000000000007e-002 | AD240: -9.8400000000000001e-002 | AE240: 97.14 | AF240: 97.57 | AG240: 0.54 | AH240: AAA | AI240: 3.2599999999999997e-002 | AJ240: =H240+100*O240 -> 146.69999999999999 | AK240: 146.5 | AL240: 158 | AM240: 48.9 | AN240: 130 | AO240: 8.9999999999999997e-002 | AP240: 42 | AQ240: 核能转债!
A241: 23 | B241: 127037 | C241: 银轮转债 | D241: 2126 | E241: 银轮股份 | F241: 汽车 | G241: 零部件制 | H241: 138.65 | I241: 4.0000000000000002e-004 | J241: 1.0500000000000001e-002 | K241: 11.2 | L241: 1.7299999999999999e-002 | M241: 115.1 | N241: 10.77 | O241: 0.33299999999999996 | P241: 103.99 | Q241: 3月9天 | R241: 5.76年 | S241: 3.76年 | T241: 7 | U241: 16 | V241: 1.6e-002 | W241: 7.9000000000000001e-002 | X241: 8.199999999999999e-002 | Y241: 89 | Z241: 2.12 | AA241: -3.2300000000000002e-002 | AB241: -3.6699999999999997e-002 | AC241: -7.2000000000000008e-002 | AD241: -7.3599999999999999e-002 | AE241: 88.5 | AF241: 91.56 | AG241: 0.63 | AH241: AA | AI241: 4.1299999999999996e-002 | AJ241: =H241+100*O241 -> 171.94999999999999 | AK241: 173.3 | AL241: 291 | AM241: 81.8 | AN241: 291 | AO241: -3.0000000000000001e-003 | AP241: 3 | AQ241: 银轮转债
A242: 100 | B242: 123078 | C242: 飞凯转债!! | D242: 300398 | E242: 飞凯材料 | F242: 化工 | G242: 化工 | H242: 136.5 | I242: -1.e-002 | J242: 2.23e-002 | K242: 18.5 | L242: 1.7000000000000001e-002 | M242: 115.2 | N242: 15.56 | O242: 0.14800000000000002 | P242: 118.89 | Q242: 转股中 | R242: 5.23年 | S242: 3.23年 | T242: 8.15 | U242: 92 | V242: 8.1000000000000003e-002 | W242: 8.5000000000000006e-002 | X242: 0.10099999999999999 | Y242: 95 | Z242: 3.44 | AA242: -3.2500000000000001e-002 | AB242: -3.7400000000000003e-002 | AC242: -7.8299999999999995e-002 | AD242: -8.0100000000000005e-002 | AE242: 90.5 | AF242: 93.62 | AG242: 0.72 | AH242: AA | AI242: 4.1299999999999996e-002 | AJ242: =H242+100*O242 -> 151.30000000000001 | AK242: 154.1 | AL242: 216 | AM242: 60.5 | AN242: 208 | AO242: -9.0999999999999998e-002 | AP242: 8 | AQ242: 飞凯转债!!
A243: 45 | B243: 127031 | C243: 洋丰转债! | D243: 902 | E243: 新洋丰 | F243: 化工 | G243: 农化 | H243: 140.35 | I243: -3.1800000000000002e-002 | J243: 1.23e-002 | K243: 21.76 | L243: -3.0299999999999997e-002 | M243: 117.1 | N243: 19.94 | O243: 0.28600000000000003 | P243: 109.13 | Q243: 35天 | R243: 5.55年 | S243: 3.56年 | T243: 10 | U243: 160 | V243: 0.11 | W243: 3.5000000000000003e-002 | X243: 3.7999999999999999e-002 | Y243: 284 | Z243: 3.85 | AA243: -3.2599999999999997e-002 | AB243: -3.7699999999999997e-002 | AC243: -7.8899999999999998e-002 | AD243: -8.0500000000000002e-002 | AE243: 89.23 | AF243: 93.91 | AG243: 0.65 | AH243: AA | AI243: 4.1299999999999996e-002 | AJ243: =H243+100*O243 -> 168.94999999999999 | AK243: 171.6 | AL243: 284 | AM243: 77.7 | AN243: 283 | AO243: 8.3000000000000004e-002 | AP243: 4 | AQ243: 洋丰转债!
A244: 332 | B244: 110045 | C244: 海澜转债! | D244: 600398 | E244: 海澜之家 | F244: 服装纺织 | G244: 服装行业 | H244: 121.16 | I244: -1.1999999999999999e-003 | J244: 3.5999999999999999e-003 | K244: 7.46 | L244: 4.0000000000000001e-003 | M244: 110.3 | N244: 7.04 | O244: 0.14300000000000002 | P244: 105.97 | Q244: 转股中 | R244: 2.86年 | S244: 0.86年 | T244: 29.5 | U244: 26 | V244: 6.9999999999999993e-003 | W244: 9.1999999999999998e-002 | X244: 9.6999999999999989e-002 | Y244: 322 | Z244: 2.35 | AA244: -3.27e-002 | AB244: -3.9e-002 | AC244: -0.16 | AD244: -0.16200000000000001 | AE244: 97.88 | AF244: 100.55 | AG244: 0.58 | AH244: AA+ | AI244: 3.3300000000000003e-002 | AJ244: =H244+100*O244 -> 135.46000000000001 | AK244: 136.4 | AL244: 50 | AM244: 35.8 | AN244: 32 | AO244: 3.6000000000000004e-002 | AP244: 49 | AQ244: 海澜转债!
A245: 296 | B245: 123024 | C245: 岱勒转债! | D245: 300700 | E245: 岱勒新材 | F245: 机械装备 | G245: 专用设备 | H245: 122.596 | I245: -8.0000000000000004e-004 | J245: -1.72e-002 | K245: 15.4 | L245: -2.7799999999999998e-002 | M245: 112.5 | N245: 14.1 | O245: 0.122 | P245: 109.22 | Q245: 转股中 | R245: 2.54年 | S245: 0.55年 | T245: 2.1 | U245: 60 | V245: 0.23199999999999998 | W245: 0.127 | X245: 0.13900000000000001 | Y245: 16 | Z245: 3.48 | AA245: -3.3599999999999998e-002 | AB245: -4.2099999999999999e-002 | AC245: -0.253 | AD245: -0.25600000000000001 | AE245: 96.48 | AF245: 94.85 | AG245: 0.65 | AH245: A+ | AI245: 7.0300000000000001e-002 | AJ245: =H245+100*O245 -> 134.79599999999999 | AK245: 136 | AL245: 47 | AM245: 39.5 | AN245: 57 | AO245: 2.9999999999999999e-002 | AP245: 37 | AQ245: 岱勒转债!
A246: 303 | B246: 128057 | C246: 博彦转债 | D246: 2649 | E246: 博彦科技 | F246: 计算机及 | G246: 软件开发 | H246: 130.97 | I246: 1.7600000000000001e-002 | J246: -2.8000000000000004e-003 | K246: 10.46 | L246: 1.95e-002 | M246: 116.3 | N246: 8.5 | O246: 6.4000000000000001e-002 | P246: 123.06 | Q246: 转股中 | R246: 3.50年 | S246: 1.50年 | T246: 4.94 | U246: 52 | V246: 8.1000000000000003e-002 | W246: 8.900000000000001e-002 | X246: 0.109 | Y246: 56 | Z246: 1.84 | AA246: -3.4000000000000002e-002 | AB246: -4.1799999999999997e-002 | AC246: -0.11900000000000001 | AD246: -0.121 | AE246: 93.27 | AF246: 95.05 | AG246: 0.76 | AH246: AA- | AI246: 6.0599999999999994e-002 | AJ246: =H246+100*O246 -> 137.37 | AK246: 138.9 | AL246: 84 | AM246: 43.8 | AN246: 85 | AO246: 5.0000000000000003e-002 | AP246: 28 | AQ246: 博彦转债
A247: 169 | B247: 110071 | C247: 湖盐转债! | D247: 600929 | E247: 雪天盐业 | F247: 食品饮料 | G247: 食品饮料 | H247: 135.65 | I247: -1.29e-002 | J247: 3.5999999999999999e-003 | K247: 7.87 | L247: -1.2500000000000001e-002 | M247: 114.9 | N247: 6.52 | O247: 0.124 | P247: 120.71 | Q247: 转股中 | R247: 4.85年 | S247: 2.85年 | T247: 7.2 | U247: 32 | V247: 3.2000000000000001e-002 | W247: 9.8000000000000004e-002 | X247: 0.11800000000000001 | Y247: 73 | Z247: 2.82 | AA247: -3.4200000000000001e-002 | AB247: -3.9399999999999998e-002 | AC247: -8.6699999999999999e-002 | AD247: -8.8499999999999995e-002 | AE247: 92.06 | AF247: 95.52 | AG247: 0.74 | AH247: AA | AI247: 3.9599999999999996e-002 | AJ247: =H247+100*O247 -> 148.05000000000001 | AK247: 150.6 | AL247: 195 | AM247: 55.1 | AN247: 176 | AO247: 2.9999999999999999e-002 | AP247: 22 | AQ247: 湖盐转债!
A248: 90 | B248: 123083 | C248: 朗新转债 | D248: 300682 | E248: 朗新科技 | F248: 计算机及 | G248: 软件开发 | H248: 138 | I248: 1.5e-003 | J248: 7.8000000000000005e-003 | K248: 19.05 | L248: 1.2199999999999999e-002 | M248: 115.1 | N248: 15.45 | O248: 0.11900000000000001 | P248: 123.3 | Q248: 转股中 | R248: 5.26年 | S248: 3.27年 | T248: 8 | U248: 20 | V248: 1.8000000000000002e-002 | W248: 4.0999999999999995e-002 | X248: 5.0999999999999997e-002 | Y248: 195 | Z248: 3.7 | AA248: -3.4500000000000003e-002 | AB248: -3.9300000000000002e-002 | AC248: -8.0799999999999997e-002 | AD248: -8.2500000000000004e-002 | AE248: 90.28 | AF248: 93.4 | AG248: 0.75 | AH248: AA | AI248: 4.1299999999999996e-002 | AJ248: =H248+100*O248 -> 149.90000000000001 | AK248: 152.7 | AL248: 209 | AM248: 59.3 | AN248: 196 | AO248: -2.7999999999999997e-002 | AP248: 6 | AQ248: 朗新转债
A249: 345 | B249: 110043 | C249: 无锡转债! | D249: 600908 | E249: 无锡银行 | F249: 金融 | G249: 银行行业 | H249: 117.79 | I249: -4.8999999999999998e-003 | J249: 3.0000000000000001e-003 | K249: 5.8 | L249: -3.4000000000000002e-003 | M249: 108.3 | N249: 5.61 | O249: 0.13900000000000001 | P249: 103.39 | Q249: 转股中 | R249: 2.41年 | S249: 无权 | T249: 29.2 | U249: 67 | V249: 1.9e-002 | W249: 0.27100000000000002 | X249: 0.28000000000000003 | Y249: 108 | Z249: 0.84 | AA249: -3.4700000000000002e-002 | AB249: -4.0899999999999999e-002 | AC249: 无权 | AD249: 无权 | AE249: 无权 | AF249: 100.19 | AG249: 0.55 | AH249: AA+ | AI249: 3.3300000000000003e-002 | AJ249: =H249+100*O249 -> 131.69 | AK249: 132.2 | AL249: 21 | AM249: 32 | AN249: 16 | AO249: 1.4999999999999999e-002 | AP249: 23 | AQ249: 无锡转债!
A250: 1 | B250: 118002 | C250: 天合转债 | D250: 688599 | E250: 天合光能 | F250: 能源电力 | G250: 太阳能 | H250: 147.64 | I250: -1.7000000000000001e-002 | J250: -1.44e-002 | K250: 59.16 | L250: -4.53e-002 | M250: 120.1 | N250: 50.51 | O250: 0.26100000000000001 | P250: 117.13 | Q250: 5月21天 | R250: 5.94年 | S250: 3.94年 | T250: 52.5 | U250: 1062. | V250: 0.13600000000000001 | W250: 4.2999999999999997e-002 | X250: 5.0000000000000003e-002 | Y250: 1223. | Z250: 7.91 | AA250: -3.4700000000000002e-002 | AB250: -4.0199999999999993e-002 | AC250: -8.3100000000000007e-002 | AD250: -8.4600000000000009e-002 | AE250: 87.85 | AF250: 94.81 | AG250: 0.69 | AH250: AA | AI250: 4.1299999999999996e-002 | AJ250: =H250+100*O250 -> 173.73999999999998 | AK250: 178.2 | AL250: 299 | AM250: 83.3 | AN250: 295 | AO250: 0.17899999999999999 | AP250: 3 | AQ250: 天合转债
A251: 128 | B251: 113603 | C251: 东缆转债! | D251: 603606 | E251: 东方电缆 | F251: 能源电力 | G251: 电力设备 | H251: 137.32 | I251: 1.5800000000000002e-002 | J251: -6.7000000000000002e-003 | K251: 26.4 | L251: 1.34e-002 | M251: 115.1 | N251: 23.65 | O251: 0.23000000000000001 | P251: 111.63 | Q251: 转股中 | R251: 5年20天 | S251: 3年21天 | T251: 8 | U251: 277 | V251: 0.24399999999999999 | W251: 4.5999999999999999e-002 | X251: 5.2000000000000005e-002 | Y251: 173 | Z251: 4.89 | AA251: -3.49e-002 | AB251: -4.0000000000000001e-002 | AC251: -8.4399999999999989e-002 | AD251: -8.6199999999999999e-002 | AE251: 91.05 | AF251: 94.19 | AG251: 0.67 | AH251: AA | AI251: 4.1299999999999996e-002 | AJ251: =H251+100*O251 -> 160.31999999999999 | AK251: 163 | AL251: 265 | AM251: 68.8 | AN251: 256 | AO251: 7.4999999999999997e-002 | AP251: 8 | AQ251: 东缆转债!
A252: 103 | B252: 110077 | C252: 洪城转债 | D252: 600461 | E252: 洪城环境 | F252: 城市公用 | G252: 城市公用 | H252: 136.36 | I252: 1.7899999999999999e-002 | J252: 1.9799999999999998e-002 | K252: 8.68 | L252: 4.7e-002 | M252: 113.5 | N252: 6.71 | O252: 5.4000000000000006e-002 | P252: 129.36 | Q252: 转股中 | R252: 5.21年 | S252: 3.21年 | T252: 18 | U252: 100 | V252: 4.0000000000000001e-002 | W252: 0.21899999999999997 | X252: 0.28300000000000003 | Y252: 82 | Z252: 1.6 | AA252: -3.5000000000000003e-002 | AB252: -3.9399999999999998e-002 | AC252: -8.2100000000000006e-002 | AD252: -8.3199999999999996e-002 | AE252: 90.71 | AF252: 94.48 | AG252: 0.8 | AH252: AA+ | AI252: 3.6299999999999999e-002 | AJ252: =H252+100*O252 -> 141.76000000000002 | AK252: 143.4 | AL252: 131 | AM252: 48.9 | AN252: 129 | AO252: 0.14400000000000002 | AP252: 6 | AQ252: 洪城转债
A253: 201 | B253: 110070 | C253: 凌钢转债! | D253: 600231 | E253: 凌钢股份 | F253: 钢铁 | G253: 炼钢 | H253: 138.11 | I253: -1.54e-002 | J253: 5.0000000000000001e-004 | K253: 3.48 | L253: -1.9699999999999999e-002 | M253: 117.4 | N253: 2.69 | O253: 6.8000000000000005e-002 | P253: 129.37 | Q253: 转股中 | R253: 4.61年 | S253: 2.61年 | T253: 2.17 | U253: 116 | V253: 0.38100000000000001 | W253: 2.2000000000000002e-002 | X253: 2.7999999999999997e-002 | Y253: 99 | Z253: 1.08 | AA253: -3.5299999999999998e-002 | AB253: -4.1599999999999998e-002 | AC253: -9.8800000000000013e-002 | AD253: -0.10000000000000001 | AE253: 93.24 | AF253: 98.55 | AG253: 0.75 | AH253: AA | AI253: 3.9599999999999996e-002 | AJ253: =H253+100*O253 -> 144.91000000000003 | AK253: 146.9 | AL253: 159 | AM253: 48.3 | AN253: 125 | AO253: 6.0999999999999999e-002 | AP253: 24 | AQ253: 凌钢转债!
A254: 113 | B254: 113607 | C254: 伟20转债! | D254: 603568 | E254: 伟明环保 | F254: 城市公用 | G254: 三废处理 | H254: 138.09 | I254: -2.5999999999999999e-003 | J254: 3.2000000000000002e-003 | K254: 29.9 | L254: 7.000000000000001e-004 | M254: 115.1 | N254: 21.71 | O254: 3.0000000000000001e-003 | P254: 137.72 | Q254: 转股中 | R254: 5年59天 | S254: 3.16年 | T254: 11.9 | U254: 78 | V254: 4.7e-002 | W254: 3.2000000000000001e-002 | X254: 4.4000000000000004e-002 | Y254: 376 | Z254: 6.63 | AA254: -3.5299999999999998e-002 | AB254: -4.0199999999999993e-002 | AC254: -8.3299999999999999e-002 | AD254: -8.5099999999999995e-002 | AE254: 90.66 | AF254: 93.78 | AG254: 0.83 | AH254: AA | AI254: 4.1299999999999996e-002 | AJ254: =H254+100*O254 -> 138.39000000000001 | AK254: 138.5 | AL254: 74 | AM254: 44.7 | AN254: 91 | AO254: 7.5999999999999998e-002 | AP254: 7 | AQ254: 伟20转债!
A255: 183 | B255: 123054 | C255: 思特转债!! | D255: 300608 | E255: 思特奇 | F255: 通信互联 | G255: 通信设备 | H255: 143.751 | I255: 0.11 | J255: 1.9e-003 | K255: 14.56 | L255: 0.16 | M255: 121.2 | N255: 12.63 | O255: 0.247 | P255: 115.28 | Q255: 转股中 | R255: 4.76年 | S255: 2.77年 | T255: 2.08 | U255: 3255. | V255: 10.77 | W255: 6.8000000000000005e-002 | X255: 7.8e-002 | Y255: 31 | Z255: 3.58 | AA255: -3.5900000000000001e-002 | AB255: -4.3099999999999999e-002 | AC255: -0.10400000000000001 | AD255: -0.106 | AE255: 87.77 | AF255: 92.16 | AG255: 0.7 | AH255: AA- | AI255: 6.0599999999999994e-002 | AJ255: =H255+100*O255 -> 168.45099999999999 | AK255: 172.2 | AL255: 288 | AM255: 80.1 | AN255: 289 | AO255: 0.10000000000000001 | AP255: 19 | AQ255: 思特转债!!
A256: 122 | B256: 127022 | C256: 恒逸转债 | D256: 703 | E256: 恒逸石化 | F256: 化工 | G256: 化工 | H256: 131 | I256: 5.5000000000000005e-003 | J256: -8.8999999999999999e-003 | K256: 11.98 | L256: -5.0000000000000001e-003 | M256: 108.9 | N256: 11.2 | O256: 0.22500000000000001 | P256: 106.96 | Q256: 转股中 | R256: 5年42天 | S256: 3年43天 | T256: 20 | U256: 34 | V256: 1.3000000000000001e-002 | W256: 4.5999999999999999e-002 | X256: 4.9000000000000002e-002 | Y256: 439 | Z256: 1.71 | AA256: -3.6000000000000004e-002 | AB256: -3.9e-002 | AC256: -7.2000000000000008e-002 | AD256: -7.3300000000000004e-002 | AE256: 91.38 | AF256: 90.99 | AG256: 0.68 | AH256: AA+ | AI256: 3.6299999999999999e-002 | AJ256: =H256+100*O256 -> 153.5 | AK256: 155 | AL256: 220 | AM256: 63.7 | AN256: 232 | AO256: 1.e-002 | AP256: 7 | AQ256: 恒逸转债
A257: 14 | B257: 113626 | C257: 伯特转债 | D257: 603596 | E257: 伯特利 | F257: 汽车 | G257: 零部件制 | H257: 149.9 | I257: -4.53e-002 | J257: 1.3500000000000002e-002 | K257: 45.01 | L257: -4.3799999999999999e-002 | M257: 121.1 | N257: 36 | O257: 0.19899999999999998 | P257: 125.03 | Q257: 4月4天 | R257: 5.82年 | S257: 3.82年 | T257: 9.02 | U257: 62 | V257: 4.4999999999999998e-002 | W257: 4.9000000000000002e-002 | X257: 6.0999999999999999e-002 | Y257: 184 | Z257: 6.06 | AA257: -3.6499999999999998e-002 | AB257: -4.24e-002 | AC257: -8.9099999999999999e-002 | AD257: -9.06e-002 | AE257: 88.29 | AF257: 96.07 | AG257: 0.73 | AH257: AA | AI257: 4.1299999999999996e-002 | AJ257: =H257+100*O257 -> 169.80000000000001 | AK257: 174.8 | AL257: 293 | AM257: 78.7 | AN257: 285 | AO257: 3.6000000000000004e-002 | AP257: 3 | AQ257: 伯特转债
A258: 37 | B258: 113623 | C258: 凤21转债 | D258: 603225 | E258: 新凤鸣 | F258: 化工 | G258: 化纤 | H258: 143.77 | I258: -1.26e-002 | J258: 2.8000000000000004e-003 | K258: 19.18 | L258: -1.3899999999999999e-002 | M258: 117.1 | N258: 16.47 | O258: 0.23499999999999999 | P258: 116.45 | Q258: 41天 | R258: 5.59年 | S258: 3.59年 | T258: 25 | U258: 52 | V258: 1.4999999999999999e-002 | W258: 8.5000000000000006e-002 | X258: 9.9000000000000005e-002 | Y258: 294 | Z258: 2.09 | AA258: -3.6600000000000001e-002 | AB258: -4.1700000000000001e-002 | AC258: -8.4000000000000005e-002 | AD258: -8.5600000000000009e-002 | AE258: 89.09 | AF258: 93.76 | AG258: 0.71 | AH258: AA | AI258: 4.1299999999999996e-002 | AJ258: =H258+100*O258 -> 167.27000000000001 | AK258: 171.1 | AL258: 283 | AM258: 77.3 | AN258: 281 | AO258: 2.4e-002 | AP258: 3 | AQ258: 凤21转债
A259: 3 | B259: 123122 | C259: 富瀚转债 | D259: 300613 | E259: 富瀚微 | F259: 电子 | G259: 芯片制造 | H259: 150.5 | I259: 1.2999999999999999e-003 | J259: 2.0000000000000001e-004 | K259: 206.21 | L259: 2.e-003 | M259: 120.3 | N259: 177.04 | O259: 0.29199999999999998 | P259: 116.48 | Q259: 5月12天 | R259: 5.92年 | S259: 3.92年 | T259: 5.81 | U259: 212 | V259: 0.24299999999999999 | W259: 2.3e-002 | X259: 2.7000000000000003e-002 | Y259: 248 | Z259: 16.54 | AA259: -3.7699999999999997e-002 | AB259: -4.3200000000000002e-002 | AC259: -8.77e-002 | AD259: -8.9200000000000002e-002 | AE259: 77.78 | AF259: 79.71 | AG259: 0.77 | AH259: A+ | AI259: 7.3300000000000004e-002 | AJ259: =H259+100*O259 -> 179.69999999999999 | AK259: 184.5 | AL259: 312 | AM259: 104.8 | AN259: 322 | AO259: 4.2000000000000003e-002 | AP259: 3 | AQ259: 富瀚转债
A260: 24 | B260: 127036 | C260: 三花转债 | D260: 2050 | E260: 三花智控 | F260: 机械装备 | G260: 通用设备 | H260: 142.5 | I260: -1.4499999999999999e-002 | J260: 1.5e-003 | K260: 25.61 | L260: -1.8000000000000002e-002 | M260: 114.5 | N260: 21.55 | O260: 0.19899999999999998 | P260: 118.84 | Q260: 3月5天 | R260: 5.74年 | S260: 3.74年 | T260: 30 | U260: 51 | V260: 1.2e-002 | W260: 3.3000000000000002e-002 | X260: 3.9e-002 | Y260: 920 | Z260: 9.17 | AA260: -3.7900000000000003e-002 | AB260: -4.2099999999999999e-002 | AC260: -8.0100000000000005e-002 | AD260: -8.1300000000000011e-002 | AE260: 89.67 | AF260: 93.58 | AG260: 0.72 | AH260: AA+ | AI260: 3.6299999999999999e-002 | AJ260: =H260+100*O260 -> 162.40000000000001 | AK260: 166.2 | AL260: 273 | AM260: 72.6 | AN260: 267 | AO260: 4.9000000000000002e-002 | AP260: 5 | AQ260: 三花转债
A261: 127 | B261: 128134 | C261: 鸿路转债! | D261: 2541 | E261: 鸿路钢构 | F261: 建筑 | G261: 其他建材 | H261: 140 | I261: -2.0999999999999999e-003 | J261: -8.3000000000000001e-003 | K261: 53.23 | L261: -1.37e-002 | M261: 115.1 | N261: 43.51 | O261: 0.14400000000000002 | P261: 122.34 | Q261: 转股中 | R261: 5年35天 | S261: 3年36天 | T261: 15.7 | U261: 11 | V261: 5.0000000000000001e-003 | W261: 5.5999999999999994e-002 | X261: 6.9000000000000006e-002 | Y261: 280 | Z261: 4.6 | AA261: -3.8399999999999997e-002 | AB261: -4.3299999999999998e-002 | AC261: -8.8800000000000004e-002 | AD261: -9.06e-002 | AE261: 90.9 | AF261: 94.03 | AG261: 0.76 | AH261: AA | AI261: 4.1299999999999996e-002 | AJ261: =H261+100*O261 -> 154.40000000000001 | AK261: 157.7 | AL261: 244 | AM261: 63.6 | AN261: 231 | AO261: -5.9000000000000004e-002 | AP261: 5 | AQ261: 鸿路转债!
A262: 85 | B262: 123085 | C262: 万顺转2! | D262: 300057 | E262: 万顺新材 | F262: 有色金属 | G262: 铝金属 | H262: 138.754 | I262: 1.5e-003 | J262: 1.24e-002 | K262: 7.67 | L262: 1.72e-002 | M262: 113.3 | N262: 6.2 | O262: 0.122 | P262: 123.71 | Q262: 转股中 | R262: 5.27年 | S262: 3.27年 | T262: 8.72 | U262: 83 | V262: 6.7000000000000004e-002 | W262: 0.16800000000000001 | X262: 0.20800000000000002 | Y262: 52 | Z262: 1.45 | AA262: -3.8399999999999997e-002 | AB262: -4.2699999999999995e-002 | AC262: -8.1699999999999995e-002 | AD262: -8.3499999999999991e-002 | AE262: 84.53 | AF262: 82.98 | AG262: 0.81 | AH262: AA- | AI262: 6.2300000000000001e-002 | AJ262: =H262+100*O262 -> 150.95399999999998 | AK262: 153.8 | AL262: 213 | AM262: 69.3 | AN262: 259 | AO262: -8.9999999999999997e-002 | AP262: 25 | AQ262: 万顺转2!
A263: 76 | B263: 123091 | C263: 长海转债 | D263: 300196 | E263: 长海股份 | F263: 其他 | G263: 非金属矿 | H263: 142.701 | I263: -2.0999999999999999e-003 | J263: -1.4999999999999999e-002 | K263: 19.45 | L263: -2.3099999999999999e-002 | M263: 116.2 | N263: 16.14 | O263: 0.184 | P263: 120.51 | Q263: 转股中 | R263: 5.30年 | S263: 3.30年 | T263: 5.5 | U263: 30 | V263: 3.7000000000000005e-002 | W263: 6.9000000000000006e-002 | X263: 8.3000000000000004e-002 | Y263: 79 | Z263: 2.58 | AA263: -3.8699999999999998e-002 | AB263: -4.3700000000000003e-002 | AC263: -8.8599999999999998e-002 | AD263: -9.0299999999999991e-002 | AE263: 90.24 | AF263: 94.16 | AG263: 0.74 | AH263: AA | AI263: 4.1299999999999996e-002 | AJ263: =H263+100*O263 -> 161.101 | AK263: 164.9 | AL263: 268 | AM263: 70.7 | AN263: 262 | AO263: -1.7000000000000001e-002 | AP263: 3 | AQ263: 长海转债
A264: 16 | B264: 113051 | C264: 节能转债 | D264: 601016 | E264: 节能风电 | F264: 能源电力 | G264: 风能 | H264: 143.74 | I264: 1.0200000000000001e-002 | J264: 1.6299999999999999e-002 | K264: 5.22 | L264: 3.3700000000000001e-002 | M264: 114.5 | N264: 4.05 | O264: 0.115 | P264: 128.89 | Q264: 3月23天 | R264: 5.79年 | S264: 3.80年 | T264: 30 | U264: 875 | V264: 0.19600000000000001 | W264: 0.115 | X264: 0.14800000000000002 | Y264: 262 | Z264: 2.57 | AA264: -3.9e-002 | AB264: -4.3200000000000002e-002 | AC264: -8.1000000000000003e-002 | AD264: -8.2299999999999998e-002 | AE264: 89.5 | AF264: 93.4 | AG264: 0.79 | AH264: AA+ | AI264: 3.6299999999999999e-002 | AJ264: =H264+100*O264 -> 155.24000000000001 | AK264: 158.6 | AL264: 247 | AM264: 65.2 | AN264: 240 | AO264: 0.161 | AP264: 4 | AQ264: 节能转债
A265: 309 | B265: 128053 | C265: 尚荣转债! | D265: 2551 | E265: 尚荣医疗 | F265: 医药 | G265: 医疗器械 | H265: 131.05 | I265: 5.7999999999999996e-003 | J265: -5.7999999999999996e-003 | K265: 5.04 | L265: 1.e-002 | M265: 114.3 | N265: 4.88 | O265: 0.26899999999999996 | P265: 103.28 | Q265: 转股中 | R265: 3.45年 | S265: 1.45年 | T265: 1.91 | U265: 37 | V265: 0.14899999999999999 | W265: 4.4999999999999998e-002 | X265: 4.5999999999999999e-002 | Y265: 43 | Z265: 1.36 | AA265: -3.9599999999999996e-002 | AB265: -4.6600000000000003e-002 | AC265: -0.124 | AD265: -0.126 | AE265: 96.6 | AF265: 100.24 | AG265: 0 | AH265: AA | AI265: 3.9599999999999996e-002 | AJ265: =H265+100*O265 -> 157.95000000000002 | AK265: 158.8 | AL265: 249 | AM265: 58.6 | AN265: 191 | AO265: -2.6000000000000002e-002 | AP265: 24 | AQ265: 尚荣转债!
A266: 73 | B266: 113616 | C266: 韦尔转债! | D266: 603501 | E266: 韦尔股份 | F266: 电子 | G266: 元器件制 | H266: 141.87 | I266: -5.6999999999999993e-003 | J266: -1.67e-002 | K266: 232.5 | L266: -3.73e-002 | M266: 114.5 | N266: 222.52 | O266: 0.35799999999999998 | P266: 104.48 | Q266: 转股中 | R266: 5.32年 | S266: 3.32年 | T266: 24.3 | U266: 198 | V266: 5.7999999999999996e-002 | W266: 1.2e-002 | X266: 1.3000000000000001e-002 | Y266: 2019. | Z266: 15.43 | AA266: -4.0099999999999997e-002 | AB266: -4.4600000000000001e-002 | AC266: -8.8200000000000001e-002 | AD266: -8.9700000000000002e-002 | AE266: 91.04 | AF266: 95.01 | AG266: 0.6 | AH266: AA+ | AI266: 3.6299999999999999e-002 | AJ266: =H266+100*O266 -> 177.67000000000002 | AK266: 179.3 | AL266: 301 | AM266: 84.2 | AN266: 296 | AO266: -0.13 | AP266: 9 | AQ266: 韦尔转债!
A267: 124 | B267: 123068 | C267: 弘信转债 | D267: 300657 | E267: 弘信电子 | F267: 电子 | G267: 元器件制 | H267: 149.64 | I267: -2.64e-002 | J267: 2.5999999999999999e-003 | K267: 22.7 | L267: -2.7799999999999998e-002 | M267: 121.2 | N267: 15.34 | O267: 1.1000000000000001e-002 | P267: 147.98 | Q267: 转股中 | R267: 5年41天 | S267: 3年42天 | T267: 5.29 | U267: 408 | V267: 0.51000000000000001 | W267: 5.7000000000000002e-002 | X267: 8.4000000000000005e-002 | Y267: 93 | Z267: 5.86 | AA267: -4.1200000000000001e-002 | AB267: -4.7800000000000002e-002 | AC267: -0.10400000000000001 | AD267: -0.106 | AE267: 85.61 | AF267: 89.64 | AG267: 0.85 | AH267: AA- | AI267: 6.2300000000000001e-002 | AJ267: =H267+100*O267 -> 150.73999999999998 | AK267: 151.3 | AL267: 199 | AM267: 61.7 | AN267: 215 | AO267: 0.221 | AP267: 11 | AQ267: 弘信转债
A268: 368 | B268: 128014 | C268: 永东转债! | D268: 2753 | E268: 永东股份 | F268: 化工 | G268: 化工 | H268: 117.531 | I268: -9.7999999999999997e-003 | J268: -1.e-004 | K268: 10.94 | L268: -3.61e-002 | M268: 109.8 | N268: 12.52 | O268: 0.34499999999999997 | P268: 87.38 | Q268: 转股中 | R268: 1.62年 | S268: 回售内 | T268: 3.37 | U268: 21 | V268: 5.2000000000000005e-002 | W268: 8.199999999999999e-002 | X268: 7.2000000000000008e-002 | Y268: 41 | Z268: 2 | AA268: -4.1599999999999998e-002 | AB268: -5.2199999999999996e-002 | AC268: 回售内 | AD268: 回售内 | AE268: 100.3 | AF268: 100.12 | AG268: 0.27 | AH268: AA- | AI268: 5.9299999999999999e-002 | AJ268: =H268+100*O268 -> 152.03100000000001 | AK268: 147.7 | AL268: 167 | AM268: 47.4 | AN268: 116 | AO268: -3.0000000000000001e-003 | AP268: 37 | AQ268: 永东转债!
A269: 233 | B269: 128094 | C269: 星帅转债! | D269: 2860 | E269: 星帅尔 | F269: 家电 | G269: 零部件制 | H269: 145.13 | I269: -2.5000000000000001e-003 | J269: -1.32e-002 | K269: 18.72 | L269: -1.9400000000000001e-002 | M269: 121 | N269: 13.8 | O269: 7.0000000000000007e-002 | P269: 135.65 | Q269: 转股中 | R269: 4.37年 | S269: 2.37年 | T269: 2.19 | U269: 62 | V269: 0.191 | W269: 5.7000000000000002e-002 | X269: 7.8e-002 | Y269: 38 | Z269: 3.59 | AA269: -4.1700000000000001e-002 | AB269: -4.9400000000000006e-002 | AC269: -0.12300000000000001 | AD269: -0.126 | AE269: 87.53 | AF269: 90.13 | AG269: 0.81 | AH269: A+ | AI269: 7.1599999999999997e-002 | AJ269: =H269+100*O269 -> 152.13 | AK269: 154.6 | AL269: 217 | AM269: 64.5 | AN269: 235 | AO269: -1.2e-002 | AP269: 32 | AQ269: 星帅转债!
A270: 115 | B270: 123074 | C270: 隆利转债!! | D270: 300752 | E270: 隆利科技 | F270: 电子 | G270: 液晶显示 | H270: 154.446 | I270: 5.9999999999999995e-004 | J270: 3.3e-003 | K270: 22.88 | L270: 5.3e-003 | M270: 124 | N270: 18.34 | O270: 0.23800000000000002 | P270: 124.75 | Q270: 转股中 | R270: 5年55天 | S270: 3年56天 | T270: 1.48 | U270: 144 | V270: 0.624 | W270: 3.2000000000000001e-002 | X270: 4.0000000000000001e-002 | Y270: 46 | Z270: 5.46 | AA270: -4.2500000000000003e-002 | AB270: -4.9800000000000004e-002 | AC270: -0.111 | AD270: -0.113 | AE270: 85.23 | AF270: 91.44 | AG270: 0.74 | AH270: AA- | AI270: 6.2300000000000001e-002 | AJ270: =H270+100*O270 -> 178.24600000000001 | AK270: 184.1 | AL270: 309 | AM270: 92.7 | AN270: 313 | AO270: -0.14800000000000002 | AP270: 16 | AQ270: 隆利转债!!
A271: 59 | B271: 118000 | C271: 嘉元转债 | D271: 688388 | E271: 嘉元科技 | F271: 电子 | G271: 电子产品 | H271: 152.8 | I271: -4.3099999999999999e-002 | J271: 1.6000000000000001e-003 | K271: 109.58 | L271: -5.1299999999999998e-002 | M271: 121 | N271: 78.74 | O271: 9.8000000000000004e-002 | P271: 139.17 | Q271: 转股中 | R271: 5.47年 | S271: 3.47年 | T271: 12.4 | U271: 179 | V271: 9.4e-002 | W271: 4.9000000000000002e-002 | X271: 6.8000000000000005e-002 | Y271: 253 | Z271: 9.05 | AA271: -4.2500000000000003e-002 | AB271: -4.8600000000000004e-002 | AC271: -0.10099999999999999 | AD271: -0.10000000000000001 | AE271: 83.59 | AF271: 87.53 | AG271: 0.81 | AH271: AA- | AI271: 6.2300000000000001e-002 | AJ271: =H271+100*O271 -> 162.60000000000002 | AK271: 166.4 | AL271: 274 | AM271: 78.9 | AN271: 286 | AO271: 2.6000000000000002e-002 | AP271: 5 | AQ271: 嘉元转债
A272: 74 | B272: 123092 | C272: 天壕转债 | D272: 300332 | E272: 天壕环境 | F272: 石油天然 | G272: 天然气 | H272: 152.45 | I272: -7.4000000000000003e-003 | J272: -8.6999999999999994e-003 | K272: 6.89 | L272: -1.9900000000000001e-002 | M272: 121.6 | N272: 5.19 | O272: 0.14800000000000002 | P272: 132.76 | Q272: 转股中 | R272: 5.30年 | S272: 3.31年 | T272: 4.23 | U272: 67 | V272: 0.10199999999999999 | W272: 7.0000000000000007e-002 | X272: 9.3000000000000013e-002 | Y272: 61 | Z272: 1.79 | AA272: -4.2599999999999999e-002 | AB272: -4.9100000000000005e-002 | AC272: -0.10099999999999999 | AD272: -0.10300000000000001 | AE272: 82.09 | AF272: 84.35 | AG272: 0.81 | AH272: A+ | AI272: 7.3300000000000004e-002 | AJ272: =H272+100*O272 -> 167.25 | AK272: 172.1 | AL272: 287 | AM272: 87.8 | AN272: 302 | AO272: 1.2e-002 | AP272: 8 | AQ272: 天壕转债
A273: 353 | B273: 128026 | C273: 众兴转债! | D273: 2772 | E273: 众兴菌业 | F273: 农业 | G273: 种植业 | H273: 120.5 | I273: 7.4999999999999997e-003 | J273: 1.72e-002 | K273: 11.95 | L273: 3.9100000000000003e-002 | M273: 109.3 | N273: 11.36 | O273: 0.14599999999999999 | P273: 105.19 | Q273: 转股中 | R273: 2.28年 | S273: 0.28年 | T273: 4.09 | U273: 315 | V273: 0.63600000000000001 | W273: 8.4000000000000005e-002 | X273: 8.900000000000001e-002 | Y273: 49 | Z273: 1.61 | AA273: -4.2699999999999995e-002 | AB273: -4.99e-002 | AC273: -0.373 | AD273: -0.38 | AE273: 99.25 | AF273: 96.12 | AG273: 0.63 | AH273: AA- | AI273: 5.9299999999999999e-002 | AJ273: =H273+100*O273 -> 135.09999999999999 | AK273: 135.8 | AL273: 46 | AM273: 36.6 | AN273: 35 | AO273: -1.3000000000000001e-002 | AP273: 58 | AQ273: 众兴转债!
A274: 344 | B274: 128035 | C274: 大族转债! | D274: 2008 | E274: 大族激光 | F274: 机械装备 | G274: 专用设备 | H274: 119.5 | I274: -5.0000000000000001e-003 | J274: 5.4000000000000003e-003 | K274: 43.49 | L274: 1.8e-003 | M274: 107.4 | N274: 51.9 | O274: 0.42599999999999999 | P274: 83.8 | Q274: 转股中 | R274: 2.43年 | S274: 0.43年 | T274: 23 | U274: 18 | V274: 6.0000000000000001e-003 | W274: 5.0000000000000003e-002 | X274: 4.2000000000000003e-002 | Y274: 464 | Z274: 4.63 | AA274: -4.3499999999999997e-002 | AB274: -4.8899999999999999e-002 | AC274: -0.23199999999999998 | AD274: -0.24299999999999999 | AE274: 101.8 | AF274: 99.29 | AG274: 0.22 | AH274: AA+ | AI274: 3.3300000000000003e-002 | AJ274: =H274+100*O274 -> 162.09999999999999 | AK274: 155.2 | AL274: 222 | AM274: 53.4 | AN274: 160 | AO274: 5.4000000000000006e-002 | AP274: 18 | AQ274: 大族转债!
A275: 231 | B275: 128096 | C275: 奥瑞转债!! | D275: 2701 | E275: 奥瑞金 | F275: 造纸包装 | G275: 包装材料 | H275: 141.1 | I275: 2.9900000000000003e-002 | J275: -1.21e-002 | K275: 5.97 | L275: 2.23e-002 | M275: 115.5 | N275: 4.5 | O275: 6.4000000000000001e-002 | P275: 132.67 | Q275: 转股中 | R275: 4.44年 | S275: 2.44年 | T275: 6.74 | U275: 50 | V275: 5.2999999999999999e-002 | W275: 4.7e-002 | X275: 6.2e-002 | Y275: 145 | Z275: 2.09 | AA275: -4.4999999999999998e-002 | AB275: -5.0799999999999998e-002 | AC275: -0.111 | AD275: -0.113 | AE275: 95.12 | AF275: 99.66 | AG275: 0.8 | AH275: AA+ | AI275: 3.4599999999999999e-002 | AJ275: =H275+100*O275 -> 147.5 | AK275: 149.5 | AL275: 183 | AM275: 49.9 | AN275: 135 | AO275: 3.5000000000000003e-002 | AP275: 17 | AQ275: 奥瑞转债!!
A276: 184 | B276: 113585 | C276: 寿仙转债! | D276: 603896 | E276: 寿仙谷 | F276: 医药 | G276: 中药 | H276: 145.94 | I276: 2.8300000000000002e-002 | J276: 8.1000000000000013e-003 | K276: 39.99 | L276: 4.2800000000000005e-002 | M276: 117.3 | N276: 28.38 | O276: 3.6000000000000004e-002 | P276: 140.91 | Q276: 转股中 | R276: 4.76年 | S276: 2.76年 | T276: 1.07 | U276: 56 | V276: 0.36599999999999999 | W276: 1.8000000000000002e-002 | X276: 2.5000000000000001e-002 | Y276: 61 | Z276: 4.31 | AA276: -4.5700000000000005e-002 | AB276: -5.16e-002 | AC276: -0.11 | AD276: -0.11199999999999999 | AE276: 87.37 | AF276: 89.17 | AG276: 0.85 | AH276: AA- | AI276: 6.0599999999999994e-002 | AJ276: =H276+100*O276 -> 149.53999999999999 | AK276: 151 | AL276: 196 | AM276: 61.8 | AN276: 217 | AO276: -2.4e-002 | AP276: 17 | AQ276: 寿仙转债!
A277: 6 | B277: 110081 | C277: 闻泰转债 | D277: 600745 | E277: 闻泰科技 | F277: 电子 | G277: 电子行业 | H277: 147.85 | I277: -1.e-004 | J277: -6.8999999999999999e-003 | K277: 112.1 | L277: -9.7000000000000003e-003 | M277: 111.9 | N277: 96.67 | O277: 0.27500000000000002 | P277: 115.96 | Q277: 5月3天 | R277: 5.90年 | S277: 3.90年 | T277: 86 | U277: 612 | V277: 4.8000000000000001e-002 | W277: 6.2e-002 | X277: 7.0999999999999994e-002 | Y277: 1396. | Z277: 4.59 | AA277: -4.6600000000000003e-002 | AB277: -5.0000000000000003e-002 | AC277: -8.6599999999999996e-002 | AD277: -8.7599999999999997e-002 | AE277: 88.62 | AF277: 90.89 | AG277: 0.72 | AH277: AA+ | AI277: 3.6299999999999999e-002 | AJ277: =H277+100*O277 -> 175.34999999999999 | AK277: 179.7 | AL277: 303 | AM277: 88.9 | AN277: 305 | AO277: 1.e-002 | AP277: 8 | AQ277: 闻泰转债
A278: 245 | B278: 128085 | C278: 鸿达转债!! | D278: 2002 | E278: 鸿达兴业 | F278: 化工 | G278: 化工 | H278: 153 | I278: -5.3200000000000004e-002 | J278: 1.03e-002 | K278: 6.02 | L278: -4.2900000000000001e-002 | M278: 124.4 | N278: 3.91 | O278: -6.0000000000000001e-003 | P278: 153.96 | Q278: 转股中 | R278: 4.28年 | S278: 2.29年 | T278: 4.56 | U278: 438 | V278: 0.60899999999999999 | W278: 2.5000000000000001e-002 | X278: 3.9e-002 | Y278: 181 | Z278: 1.92 | AA278: -4.8099999999999997e-002 | AB278: -5.7000000000000002e-002 | AC278: -0.10800000000000001 | AD278: -0.11 | AE278: 70.81 | AF278: 64.29 | AG278: 1 | AH278: B | AI278: 0.1716 | AJ278: =H278+100*O278 -> 152.40000000000001 | AK278: 152 | AL278: 203 | AM278: 81.2 | AN278: 290 | AO278: 7.2999999999999995e-002 | AP278: 100 | AQ278: 鸿达转债!!
A279: 369 | B279: 113011 | C279: 光大转债 | D279: 601818 | E279: 光大银行 | F279: 金融 | G279: 银行行业 | H279: 115.3 | I279: 7.6e-003 | J279: -5.1000000000000004e-003 | K279: 3.49 | L279: 5.7999999999999996e-003 | M279: 106.8 | N279: 3.55 | O279: 0.17300000000000001 | P279: 98.31 | Q279: 转股中 | R279: 1.53年 | S279: 无权 | T279: 242 | U279: 241 | V279: 9.0000000000000011e-003 | W279: 0.128 | X279: 0.126 | Y279: 1886. | Z279: 0.53 | AA279: -4.9200000000000001e-002 | AB279: -5.7099999999999998e-002 | AC279: 无权 | AD279: 无权 | AE279: 无权 | AF279: 101.92 | AG279: 0.44 | AH279: AAA | AI279: 3.1300000000000001e-002 | AJ279: =H279+100*O279 -> 132.59999999999999 | AK279: 132.3 | AL279: 23 | AM279: 30.4 | AN279: 10 | AO279: 3.7999999999999999e-002 | AP279: 13 | AQ279: 光大转债
A280: 203 | B280: 123048 | C280: 应急转债! | D280: 300527 | E280: 中船应急 | F280: 机械装备 | G280: 专用设备 | H280: 142.037 | I280: -4.0300000000000002e-002 | J280: -8.0000000000000004e-004 | K280: 10.05 | L280: -6.0700000000000004e-002 | M280: 112.8 | N280: 8.88 | O280: 0.255 | P280: 113.18 | Q280: 转股中 | R280: 4.60年 | S280: 2.60年 | T280: 3.79 | U280: 187 | V280: 0.34100000000000003 | W280: 3.9e-002 | X280: 4.4000000000000004e-002 | Y280: 97 | Z280: 3.62 | AA280: -4.9699999999999994e-002 | AB280: -5.4400000000000004e-002 | AC280: -0.10800000000000001 | AD280: -0.11 | AE280: 94.1 | AF280: 96.76 | AG280: 0.68 | AH280: AA+ | AI280: 3.4599999999999999e-002 | AJ280: =H280+100*O280 -> 167.53700000000001 | AK280: 170.9 | AL280: 282 | AM280: 74.1 | AN280: 272 | AO280: -3.7999999999999999e-002 | AP280: 16 | AQ280: 应急转债!
A281: 7 | B281: 118001 | C281: 金博转债 | D281: 688598 | E281: 金博股份 | F281: 能源电力 | G281: 太阳能 | H281: 165.28 | I281: -5.7800000000000004e-002 | J281: -3.3500000000000002e-002 | K281: 364.5 | L281: -0.111 | M281: 121.6 | N281: 271.62 | O281: 0.23199999999999998 | P281: 134.19 | Q281: 4月28天 | R281: 5.88年 | S281: 3.89年 | T281: 6 | U281: 128 | V281: 0.127 | W281: 2.1000000000000001e-002 | X281: 2.7999999999999997e-002 | Y281: 292 | Z281: 19.19 | AA281: -5.1799999999999999e-002 | AB281: -5.7500000000000002e-002 | AC281: -0.10300000000000001 | AD281: -0.105 | AE281: 78.8 | AF281: 80.97 | AG281: 0.82 | AH281: A+ | AI281: 7.3300000000000004e-002 | AJ281: =H281+100*O281 -> 188.47999999999999 | AK281: 196.4 | AL281: 321 | AM281: 115.4 | AN281: 332 | AO281: 0.10000000000000001 | AP281: 2 | AQ281: 金博转债
A282: 254 | B282: 110061 | C282: 川投转债 | D282: 600674 | E282: 川投能源 | F282: 能源电力 | G282: 水电 | H282: 138.42 | I282: -3.4000000000000002e-003 | J282: 7.000000000000001e-004 | K282: 11.84 | L282: -3.4000000000000002e-003 | M282: 110.8 | N282: 9.2 | O282: 7.5999999999999998e-002 | P282: 128.7 | Q282: 转股中 | R282: 4.19年 | S282: 2.19年 | T282: 39.6 | U282: 119 | V282: 2.1000000000000001e-002 | W282: 7.5999999999999998e-002 | X282: 9.8000000000000004e-002 | Y282: 522 | Z282: 1.8 | AA282: -5.28e-002 | AB282: -5.7099999999999998e-002 | AC282: -0.11699999999999999 | AD282: -0.11900000000000001 | AE282: 95.86 | AF282: 97.15 | AG282: 0.81 | AH282: AAA | AI282: 3.2599999999999997e-002 | AJ282: =H282+100*O282 -> 146.01999999999998 | AK282: 148.1 | AL282: 172 | AM282: 51 | AN282: 144 | AO282: 4.4999999999999998e-002 | AP282: 14 | AQ282: 川投转债
A283: 12 | B283: 127040 | C283: 国泰转债 | D283: 2091 | E283: 江苏国泰 | F283: 商业零售 | G283: 商业零售 | H283: 155 | I283: -4.5700000000000005e-002 | J283: 9.1999999999999998e-003 | K283: 12.78 | L283: -4.2699999999999995e-002 | M283: 112.5 | N283: 9.02 | O283: 9.4e-002 | P283: 141.69 | Q283: 4月12天 | R283: 5.84年 | S283: 3.84年 | T283: 45.6 | U283: 230 | V283: 3.2000000000000001e-002 | W283: 0.22800000000000001 | X283: 0.32299999999999995 | Y283: 200 | Z283: 2.17 | AA283: -5.4100000000000002e-002 | AB283: -5.7599999999999998e-002 | AC283: -9.74e-002 | AD283: -9.8599999999999993e-002 | AE283: 89.36 | AF283: 91.63 | AG283: 0.85 | AH283: AA+ | AI283: 3.6299999999999999e-002 | AJ283: =H283+100*O283 -> 164.40000000000001 | AK283: 168.3 | AL283: 277 | AM283: 76.7 | AN283: 280 | AO283: -3.5000000000000003e-002 | AP283: 8 | AQ283: 国泰转债
A284: 138 | B284: 113039 | C284: 嘉泽转债! | D284: 601619 | E284: 嘉泽新能 | F284: 能源电力 | G284: 风能 | H284: 149.57 | I284: -3.4200000000000001e-002 | J284: 2.5699999999999997e-002 | K284: 5.09 | L284: -9.7000000000000003e-003 | M284: 112.8 | N284: 3.46 | O284: 1.7000000000000001e-002 | P284: 147.11 | Q284: 转股中 | R284: 4.97年 | S284: 2.97年 | T284: 5.4 | U284: 794 | V284: 0.95599999999999996 | W284: 4.4999999999999998e-002 | X284: 6.6000000000000003e-002 | Y284: 120 | Z284: 2.75 | AA284: -5.5999999999999994e-002 | AB284: -6.0299999999999999e-002 | AC284: -0.11 | AD284: -0.11199999999999999 | AE284: 91.53 | AF284: 93.32 | AG284: 0.87 | AH284: AA | AI284: 3.9599999999999996e-002 | AJ284: =H284+100*O284 -> 151.26999999999998 | AK284: 152 | AL284: 202 | AM284: 58.7 | AN284: 192 | AO284: 0.156 | AP284: 36 | AQ284: 嘉泽转债!
A285: 86 | B285: 123086 | C285: 海兰转债!! | D285: 300065 | E285: 海兰信 | F285: 电子 | G285: 电子产品 | H285: 166.712 | I285: -7.7000000000000002e-003 | J285: 8.5000000000000006e-003 | K285: 11.85 | L285: 8.0000000000000004e-004 | M285: 123.5 | N285: 7.27 | O285: 2.3e-002 | P285: 163 | Q285: 转股中 | R285: 5.27年 | S285: 3.27年 | T285: 6.08 | U285: 966 | V285: 0.92299999999999993 | W285: 8.5999999999999993e-002 | X285: 0.14000000000000001 | Y285: 71 | Z285: 3.11 | AA285: -5.6299999999999996e-002 | AB285: -6.3099999999999989e-002 | AC285: -0.126 | AD285: -0.128 | AE285: 84.55 | AF285: 90.4 | AG285: 1 | AH285: AA- | AI285: 6.2300000000000001e-002 | AJ285: =H285+100*O285 -> 169.012 | AK285: 170.4 | AL285: 281 | AM285: 80 | AN285: 288 | AO285: 0.14899999999999999 | AP285: 21 | AQ285: 海兰转债!!
A286: 159 | B286: 123060 | C286: 苏试转债! | D286: 300416 | E286: 苏试试验 | F286: 机械装备 | G286: 专用设备 | H286: 155 | I286: -3.49e-002 | J286: -1.7100000000000001e-002 | K286: 24.99 | L286: -6.3e-002 | M286: 117.2 | N286: 18.28 | O286: 0.13400000000000001 | P286: 136.71 | Q286: 转股中 | R286: 4.88年 | S286: 2.88年 | T286: 3.1 | U286: 57 | V286: 0.11599999999999999 | W286: 4.7e-002 | X286: 6.4000000000000001e-002 | Y286: 66 | Z286: 6.87 | AA286: -5.6600000000000004e-002 | AB286: -6.2300000000000001e-002 | AC286: -0.12300000000000001 | AD286: -0.125 | AE286: 86.69 | AF286: 88.47 | AG286: 0.83 | AH286: AA- | AI286: 6.0599999999999994e-002 | AJ286: =H286+100*O286 -> 168.40000000000001 | AK286: 173.3 | AL286: 290 | AM286: 84.8 | AN286: 298 | AO286: 3.5000000000000003e-002 | AP286: 8 | AQ286: 苏试转债!
A287: 215 | B287: 128101 | C287: 联创转债! | D287: 2036 | E287: 联创电子 | F287: 电子 | G287: 液晶显示 | H287: 148.99 | I287: -2.8999999999999998e-003 | J287: -1.8000000000000002e-002 | K287: 15.57 | L287: -3.1099999999999999e-002 | M287: 114.8 | N287: 13.72 | O287: 0.313 | P287: 113.48 | Q287: 转股中 | R287: 4.53年 | S287: 2.53年 | T287: 3 | U287: 91 | V287: 0.20000000000000001 | W287: 1.8000000000000002e-002 | X287: 2.1000000000000001e-002 | Y287: 165 | Z287: 4.37 | AA287: -5.6900000000000006e-002 | AB287: -6.2199999999999998e-002 | AC287: -0.126 | AD287: -0.128 | AE287: 93.11 | AF287: 96.61 | AG287: 0.67 | AH287: AA | AI287: 3.9599999999999996e-002 | AJ287: =H287+100*O287 -> 180.29000000000002 | AK287: 184.5 | AL287: 311 | AM287: 87.9 | AN287: 303 | AO287: -0.122 | AP287: 15 | AQ287: 联创转债!
A288: 299 | B288: 123022 | C288: 长信转债!! | D288: 300088 | E288: 长信科技 | F288: 通信互联 | G288: 通信设备 | H288: 140.13 | I288: 1.8500000000000003e-002 | J288: -2.2000000000000001e-003 | K288: 7.16 | L288: 2.29e-002 | M288: 114.3 | N288: 6.05 | O288: 0.184 | P288: 118.35 | Q288: 转股中 | R288: 3.53年 | S288: 1.54年 | T288: 2.57 | U288: 30 | V288: 8.4000000000000005e-002 | W288: 1.4999999999999999e-002 | X288: 1.7000000000000001e-002 | Y288: 176 | Z288: 2.44 | AA288: -5.7000000000000002e-002 | AB288: -6.3600000000000004e-002 | AC288: -0.14400000000000002 | AD288: -0.14599999999999999 | AE288: 96.27 | AF288: 99.91 | AG288: 0.71 | AH288: AA | AI288: 3.9599999999999996e-002 | AJ288: =H288+100*O288 -> 158.53 | AK288: 161.9 | AL288: 262 | AM288: 62 | AN288: 219 | AO288: -0.10800000000000001 | AP288: 12 | AQ288: 长信转债!!
A289: 92 | B289: 113612 | C289: 永冠转债!* | D289: 603681 | E289: 永冠新材 | F289: 化工 | G289: 其他 | H289: 166.3 | I289: -8.6999999999999994e-003 | J289: 8.6999999999999994e-003 | K289: 34.5 | L289: 0. | M289: 121.2 | N289: 20.59 | O289: -8.0000000000000002e-003 | P289: 167.56 | Q289: 转股中 | R289: 5.26年 | S289: 3.26年 | T289: 1.36 | U289: 240 | V289: 1.01 | W289: 2.4e-002 | X289: 4.0000000000000001e-002 | Y289: 57 | Z289: 3.57 | AA289: -5.9500000000000004e-002 | AB289: -6.5700000000000008e-002 | AC289: -0.125 | AD289: -0.127 | AE289: 84.85 | AF289: 88.84 | AG289: 1 | AH289: AA- | AI289: 6.2300000000000001e-002 | AJ289: =H289+100*O289 -> 165.5 | AK289: 165 | AL289: 270 | AM289: 76.2 | AN289: 277 | AO289: 0.129 | AP289: 7 | AQ289: 永冠转债!*
A290: 77 | B290: 123089 | C290: 九洲转2!! | D290: 300040 | E290: 九洲集团 | F290: 能源电力 | G290: 电力设备 | H290: 167.01 | I290: -5.3e-003 | J290: 1.9199999999999998e-002 | K290: 8.99 | L290: 1.5800000000000002e-002 | M290: 121 | N290: 5.68 | O290: 5.5e-002 | P290: 158.27 | Q290: 转股中 | R290: 5.30年 | S290: 3.30年 | T290: 3.07 | U290: 217 | V290: 0.41200000000000003 | W290: 6.0999999999999999e-002 | X290: 9.6000000000000002e-002 | Y290: 51 | Z290: 1.51 | AA290: -6.0100000000000001e-002 | AB290: -6.6199999999999995e-002 | AC290: -0.125 | AD290: -0.127 | AE290: 84.48 | AF290: 88.46 | AG290: 0.88 | AH290: AA- | AI290: 6.2300000000000001e-002 | AJ290: =H290+100*O290 -> 172.50999999999999 | AK290: 175.7 | AL290: 295 | AM290: 87.3 | AN290: 300 | AO290: -1.3000000000000001e-002 | AP290: 22 | AQ290: 九洲转2!!
A291: 87 | B291: 123084 | C291: 高澜转债!! | D291: 300499 | E291: 高澜股份 | F291: 能源电力 | G291: 电力设备 | H291: 168 | I291: 5.0000000000000003e-002 | J291: -1.2e-002 | K291: 14.25 | L291: 4.3200000000000002e-002 | M291: 121.9 | N291: 9 | O291: 6.0999999999999999e-002 | P291: 158.33 | Q291: 转股中 | R291: 5.27年 | S291: 3.27年 | T291: 2.68 | U291: 1196. | V291: 2.5899999999999999 | W291: 6.8000000000000005e-002 | X291: 0.107 | Y291: 40 | Z291: 4.8 | AA291: -6.0400000000000002e-002 | AB291: -6.6699999999999995e-002 | AC291: -0.126 | AD291: -0.128 | AE291: 82.48 | AF291: 84.81 | AG291: 0.88 | AH291: A+ | AI291: 7.3300000000000004e-002 | AJ291: =H291+100*O291 -> 174.09999999999999 | AK291: 177.7 | AL291: 298 | AM291: 92.9 | AN291: 314 | AO291: 0.113 | AP291: 17 | AQ291: 高澜转债!!
A292: 251 | B292: 113550 | C292: 常汽转债! | D292: 603035 | E292: 常熟汽饰 | F292: 汽车 | G292: 零部件制 | H292: 157.79 | I292: -1.1599999999999999e-002 | J292: 1.1599999999999999e-002 | K292: 13.57 | L292: 0. | M292: 121.3 | N292: 9.33 | O292: 8.5000000000000006e-002 | P292: 145.44 | Q292: 转股中 | R292: 4.21年 | S292: 2.21年 | T292: 2.14 | U292: 56 | V292: 0.16399999999999998 | W292: 4.4000000000000004e-002 | X292: 6.4000000000000001e-002 | Y292: 49 | Z292: 1.27 | AA292: -6.2e-002 | AB292: -6.9800000000000001e-002 | AC292: -0.12 | AD292: -0.122 | AE292: 90.81 | AF292: 95.34 | AG292: 0.84 | AH292: AA- | AI292: 6.0599999999999994e-002 | AJ292: =H292+100*O292 -> 166.28999999999999 | AK292: 170.1 | AL292: 280 | AM292: 74.8 | AN292: 273 | AO292: 9.0000000000000011e-003 | AP292: 17 | AQ292: 常汽转债!
A293: 38 | B293: 123111 | C293: 东财转3 | D293: 300059 | E293: 东方财富 | F293: 金融 | G293: 证券行业 | H293: 158 | I293: -3.8e-003 | J293: -8.0000000000000002e-003 | K293: 31.28 | L293: -1.4499999999999999e-002 | M293: 110.5 | N293: 23.35 | O293: 0.17899999999999999 | P293: 133.96 | Q293: 40天 | R293: 5.59年 | S293: 3.59年 | T293: 158 | U293: 1111. | V293: 4.4000000000000004e-002 | W293: 4.9000000000000002e-002 | X293: 6.5000000000000002e-002 | Y293: 3233. | Z293: 8.88 | AA293: -6.2600000000000003e-002 | AB293: -6.5700000000000008e-002 | AC293: -0.107 | AD293: -0.10800000000000001 | AE293: 89.26 | AF293: 90.73 | AG293: 0.82 | AH293: AA+ | AI293: 3.6299999999999999e-002 | AJ293: =H293+100*O293 -> 175.90000000000001 | AK293: 182 | AL293: 306 | AM293: 91.3 | AN293: 308 | AO293: -2.1000000000000001e-002 | AP293: 22 | AQ293: 东财转3
A294: 188 | B294: 128109 | C294: 楚江转债 | D294: 2171 | E294: 楚江新材 | F294: 有色金属 | G294: 铜金属 | H294: 155.5 | I294: -2.8500000000000001e-002 | J294: -3.2799999999999996e-002 | K294: 12.23 | L294: -7.2800000000000004e-002 | M294: 114.9 | N294: 8.63 | O294: 9.6999999999999989e-002 | P294: 141.71 | Q294: 转股中 | R294: 4.75年 | S294: 2.75年 | T294: 18.3 | U294: 283 | V294: 9.9000000000000005e-002 | W294: 0.11199999999999999 | X294: 0.159 | Y294: 163 | Z294: 2.89 | AA294: -6.2800000000000009e-002 | AB294: -6.7799999999999999e-002 | AC294: -0.129 | AD294: -0.13100000000000001 | AE294: 92.42 | AF294: 95.89 | AG294: 0.84 | AH294: AA | AI294: 3.9599999999999996e-002 | AJ294: =H294+100*O294 -> 165.19999999999999 | AK294: 169.3 | AL294: 279 | AM294: 73.4 | AN294: 269 | AO294: 0.109 | AP294: 7 | AQ294: 楚江转债
A295: 341 | B295: 127005 | C295: 长证转债! | D295: 783 | E295: 长江证券 | F295: 金融 | G295: 证券行业 | H295: 127.56 | I295: 1.1999999999999999e-003 | J295: 1.15e-002 | K295: 7.95 | L295: 1.9199999999999998e-002 | M295: 108.3 | N295: 7.13 | O295: 0.14400000000000002 | P295: 111.5 | Q295: 转股中 | R295: 2.52年 | S295: 无权 | T295: 50 | U295: 322 | V295: 4.9000000000000002e-002 | W295: 0.114 | X295: 0.127 | Y295: 440 | Z295: 1.53 | AA295: -6.3899999999999998e-002 | AB295: -6.9500000000000006e-002 | AC295: 无权 | AD295: 无权 | AE295: 无权 | AF295: 100.35 | AG295: 0.66 | AH295: AAA | AI295: 3.1300000000000001e-002 | AJ295: =H295+100*O295 -> 141.96000000000001 | AK295: 143.6 | AL295: 134 | AM295: 43.3 | AN295: 84 | AO295: 8.199999999999999e-002 | AP295: 13 | AQ295: 长证转债!
A296: 293 | B296: 123025 | C296: 精测转债!! | D296: 300567 | E296: 精测电子 | F296: 电子 | G296: 液晶显示 | H296: 148.45 | I296: 3.3e-003 | J296: 6.3e-003 | K296: 59.09 | L296: 1.3000000000000001e-002 | M296: 116.5 | N296: 49.37 | O296: 0.23999999999999999 | P296: 119.69 | Q296: 转股中 | R296: 3.56年 | S296: 1.57年 | T296: 3.09 | U296: 79 | V296: 0.17199999999999999 | W296: 1.9e-002 | X296: 2.2000000000000002e-002 | Y296: 164 | Z296: 5.15 | AA296: -6.6799999999999998e-002 | AB296: -7.4200000000000002e-002 | AC296: -0.16300000000000001 | AD296: -0.16500000000000001 | AE296: 92.94 | AF296: 94.85 | AG296: 0.73 | AH296: AA- | AI296: 6.0599999999999994e-002 | AJ296: =H296+100*O296 -> 172.44999999999999 | AK296: 177.2 | AL296: 297 | AM296: 82.4 | AN296: 292 | AO296: -9.8000000000000004e-002 | AP296: 16 | AQ296: 精测转债!!
A297: 224 | B297: 123043 | C297: 正元转债 | D297: 300645 | E297: 正元智慧 | F297: 计算机及 | G297: 软件开发 | H297: 163.999 | I297: 4.3299999999999998e-002 | J297: 2.8999999999999998e-002 | K297: 22.11 | L297: 8.5999999999999993e-002 | M297: 120.9 | N297: 15.38 | O297: 0.14099999999999999 | P297: 143.76 | Q297: 转股中 | R297: 4.50年 | S297: 2.50年 | T297: 1.66 | U297: 2220. | V297: 8.1400000000000006 | W297: 5.9000000000000004e-002 | X297: 8.5000000000000006e-002 | Y297: 28 | Z297: 4.33 | AA297: -6.6799999999999998e-002 | AB297: -7.400000000000001e-002 | AC297: -0.11 | AD297: -0.111 | AE297: 86.72 | AF297: 89.24 | AG297: 0.84 | AH297: A+ | AI297: 7.1599999999999997e-002 | AJ297: =H297+100*O297 -> 178.09899999999999 | AK297: 184.2 | AL297: 310 | AM297: 95 | AN297: 316 | AO297: 0.16 | AP297: 18 | AQ297: 正元转债
A298: 5 | B298: 123120 | C298: 隆华转债 | D298: 300263 | E298: 隆华科技 | F298: 机械装备 | G298: 通用设备 | H298: 183.29 | I298: -3.5900000000000001e-002 | J298: -2.0099999999999996e-002 | K298: 12.35 | L298: -6.3700000000000007e-002 | M298: 121.1 | N298: 7.76 | O298: 0.152 | P298: 159.15 | Q298: 5月5天 | R298: 5.90年 | S298: 3.90年 | T298: 7.99 | U298: 246 | V298: 0.16200000000000001 | W298: 7.0999999999999994e-002 | X298: 0.113 | Y298: 113 | Z298: 4.04 | AA298: -6.8900000000000003e-002 | AB298: -7.4400000000000008e-002 | AC298: -0.124 | AD298: -0.126 | AE298: 81.6 | AF298: 85.38 | AG298: 0.88 | AH298: AA- | AI298: 6.2300000000000001e-002 | AJ298: =H298+100*O298 -> 198.48999999999998 | AK298: 207.4 | AL298: 329 | AM298: 122.1 | AN298: 334 | AO298: 5.7999999999999996e-002 | AP298: 3 | AQ298: 隆华转债
A299: 120 | B299: 123070 | C299: 鹏辉转债! | D299: 300438 | E299: 鹏辉能源 | F299: 汽车 | G299: 零部件制 | H299: 166 | I299: -3.4200000000000001e-002 | J299: -1.9199999999999998e-002 | K299: 29.11 | L299: -6.1600000000000002e-002 | M299: 115.1 | N299: 20.08 | O299: 0.14499999999999999 | P299: 144.97 | Q299: 转股中 | R299: 5年46天 | S299: 3年47天 | T299: 7.49 | U299: 307 | V299: 0.24199999999999999 | W299: 5.9999999999999998e-002 | X299: 8.8000000000000009e-002 | Y299: 124 | Z299: 5.1 | AA299: -7.0099999999999996e-002 | AB299: -7.4700000000000003e-002 | AC299: -0.13100000000000001 | AD299: -0.13200000000000001 | AE299: 90.79 | AF299: 93.92 | AG299: 0.87 | AH299: AA | AI299: 4.1299999999999996e-002 | AJ299: =H299+100*O299 -> 180.5 | AK299: 187 | AL299: 314 | AM299: 93.1 | AN299: 315 | AO299: -0.10300000000000001 | AP299: 8 | AQ299: 鹏辉转债!
A300: 373 | B300: 110034 | C300: 九州转债! | D300: 600998 | E300: 九州通 | F300: 医药 | G300: 医药商业 | H300: 110.99 | I300: 3.3e-003 | J300: -3.2000000000000002e-003 | K300: 14.92 | L300: 4.0000000000000001e-003 | M300: 108 | N300: 17.83 | O300: 0.32600000000000001 | P300: 83.68 | Q300: 转股中 | R300: 0.37年 | S300: 回售内 | T300: 15 | U300: 20 | V300: 1.2e-002 | W300: 5.4000000000000006e-002 | X300: 4.4999999999999998e-002 | Y300: 280 | Z300: 1.35 | AA300: -7.17e-002 | AB300: -0.109 | AC300: 回售内 | AD300: 回售内 | AE300: 103 | AF300: 106.87 | AG300: 0.01 | AH300: AA+ | AI300: 2.8999999999999998e-002 | AJ300: =H300+100*O300 -> 143.59 | AK300: 138.3 | AL300: 72 | AM300: 31.4 | AN300: 14 | AO300: 1.4999999999999999e-002 | AP300: 25 | AQ300: 九州转债!
A301: 30 | B301: 113048 | C301: 晶科转债! | D301: 601778 | E301: 晶科科技 | F301: 能源电力 | G301: 太阳能 | H301: 178.18 | I301: -0.107 | J301: 0.13600000000000001 | K301: 10.49 | L301: 3.0499999999999999e-002 | M301: 117.1 | N301: 5.48 | O301: -6.9000000000000006e-002 | P301: 191.42 | Q301: 56天 | R301: 5.63年 | S301: 3.64年 | T301: 30 | U301: 6813. | V301: 1.1899999999999999 | W301: 0.10300000000000001 | X301: 0.19800000000000001 | Y301: 290 | Z301: 2.6 | AA301: -7.2900000000000006e-002 | AB301: -7.7600000000000002e-002 | AC301: -0.128 | AD301: -0.13 | AE301: 88.94 | AF301: 93.61 | AG301: 0.94 | AH301: AA | AI301: 4.1299999999999996e-002 | AJ301: =H301+100*O301 -> 171.28 | AK301: 164.9 | AL301: 269 | AM301: 71.3 | AN301: 263 | AO301: 0.376 | AP301: 12 | AQ301: 晶科转债!
A302: 229 | B302: 128097 | C302: 奥佳转债!! | D302: 2614 | E302: 奥佳华 | F302: 机械装备 | G302: 专用设备 | H302: 160.95 | I302: 5.6999999999999993e-003 | J302: 1.7000000000000001e-003 | K302: 14.78 | L302: 8.8999999999999999e-003 | M302: 114.9 | N302: 10.39 | O302: 0.13100000000000001 | P302: 142.25 | Q302: 转股中 | R302: 4.48年 | S302: 2.48年 | T302: 4.6 | U302: 38 | V302: 5.2000000000000005e-002 | W302: 4.9000000000000002e-002 | X302: 7.0000000000000007e-002 | Y302: 93 | Z302: 2 | AA302: -7.3800000000000004e-002 | AB302: -7.9000000000000001e-002 | AC302: -0.109 | AD302: -0.11 | AE302: 93.4 | AF302: 96.9 | AG302: 0.84 | AH302: AA | AI302: 3.9599999999999996e-002 | AJ302: =H302+100*O302 -> 174.04999999999998 | AK302: 179.6 | AL302: 302 | AM302: 82.7 | AN302: 294 | AO302: -5.9000000000000004e-002 | AP302: 19 | AQ302: 奥佳转债!!
A303: 347 | B303: 128033 | C303: 迪龙转债! | D303: 2658 | E303: 雪迪龙 | F303: 城市公用 | G303: 三废处理 | H303: 129.6 | I303: -8.0000000000000004e-004 | J303: -1.9e-003 | K303: 9.48 | L303: -4.1999999999999997e-003 | M303: 108.8 | N303: 8.71 | O303: 0.191 | P303: 108.84 | Q303: 转股中 | R303: 2.32年 | S303: 0.32年 | T303: 2.98 | U303: 110 | V303: 0.28399999999999997 | W303: 5.0000000000000003e-002 | X303: 5.4000000000000006e-002 | Y303: 60 | Z303: 2.49 | AA303: -7.3899999999999993e-002 | AB303: -8.0199999999999994e-002 | AC303: -0.47600000000000003 | AD303: -0.48100000000000004 | AE303: 99.74 | AF303: 99.88 | AG303: 0.62 | AH303: AA | AI303: 3.8300000000000001e-002 | AJ303: =H303+100*O303 -> 148.69999999999999 | AK303: 150.4 | AL303: 192 | AM303: 50.5 | AN303: 141 | AO303: 2.7999999999999997e-002 | AP303: 35 | AQ303: 迪龙转债!
A304: 277 | B304: 113027 | C304: 华钰转债!! | D304: 601020 | E304: ST华钰 | F304: 有色金属 | G304: 锌铅镍锡 | H304: 152.15 | I304: -5.4400000000000004e-002 | J304: 9.8999999999999991e-003 | K304: 15.04 | L304: -4.99e-002 | M304: 114.3 | N304: 10.17 | O304: 2.8999999999999998e-002 | P304: 147.89 | Q304: 转股中 | R304: 3.78年 | S304: 1.78年 | T304: 3.24 | U304: 1390. | V304: 2.7200000000000002 | W304: 3.9e-002 | X304: 5.7999999999999996e-002 | Y304: 83 | Z304: 3.3 | AA304: -7.4099999999999999e-002 | AB304: -8.0199999999999994e-002 | AC304: -0.14899999999999999 | AD304: -0.14999999999999999 | AE304: 88.35 | AF304: 85.48 | AG304: 0.89 | AH304: A | AI304: 8.1600000000000006e-002 | AJ304: =H304+100*O304 -> 155.05000000000001 | AK304: 156.4 | AL304: 235 | AM304: 68.1 | AN304: 250 | AO304: 0.24600000000000002 | AP304: 47 | AQ304: 华钰转债!!
A305: 26 | B305: 123114 | C305: 三角转债 | D305: 300775 | E305: 三角防务 | F305: 航空航天 | G305: 航空航天 | H305: 187.6 | I305: -3.4000000000000002e-002 | J305: -2.2599999999999999e-002 | K305: 47.1 | L305: -6.6199999999999995e-002 | M305: 121 | N305: 31.82 | O305: 0.26700000000000002 | P305: 148.02 | Q305: 2月28天 | R305: 5.72年 | S305: 3.72年 | T305: 9.04 | U305: 165 | V305: 9.6000000000000002e-002 | W305: 3.9e-002 | X305: 5.7000000000000002e-002 | Y305: 233 | Z305: 11.38 | AA305: -7.4999999999999997e-002 | AB305: -8.0500000000000002e-002 | AC305: -0.13500000000000001 | AD305: -0.13600000000000001 | AE305: 82.34 | AF305: 86.22 | AG305: 0.85 | AH305: AA- | AI305: 6.2300000000000001e-002 | AJ305: =H305+100*O305 -> 214.30000000000001 | AK305: 227.2 | AL305: 341 | AM305: 141 | AN305: 342 | AO305: -3.5000000000000003e-002 | AP305: 5 | AQ305: 三角转债
A306: 365 | B306: 113013 | C306: 国君转债! | D306: 601211 | E306: 国泰君安 | F306: 金融 | G306: 证券行业 | H306: 123.2 | I306: -6.6e-003 | J306: -1.e-003 | K306: 18.06 | L306: -1.6899999999999998e-002 | M306: 106.8 | N306: 18.45 | O306: 0.25900000000000001 | P306: 97.89 | Q306: 转股中 | R306: 1.84年 | S306: 无权 | T306: 69.9 | U306: 237 | V306: 2.7000000000000003e-002 | W306: 4.2999999999999997e-002 | X306: 4.2999999999999997e-002 | Y306: 1609. | Z306: 1.25 | AA306: -7.5300000000000006e-002 | AB306: -8.1600000000000006e-002 | AC306: 无权 | AD306: 无权 | AE306: 无权 | AF306: 100.96 | AG306: 0.45 | AH306: AAA | AI306: 3.1300000000000001e-002 | AJ306: =H306+100*O306 -> 149.09999999999999 | AK306: 148.5 | AL306: 177 | AM306: 47.6 | AN306: 118 | AO306: 4.0000000000000001e-002 | AP306: 12 | AQ306: 国君转债!
A307: 253 | B307: 123035 | C307: 利德转债!! | D307: 300296 | E307: 利亚德 | F307: 电子 | G307: LED制 | H307: 159 | I307: 1.9199999999999998e-002 | J307: 7.7000000000000002e-003 | K307: 10.17 | L307: 3.1400000000000004e-002 | M307: 115.1 | N307: 6.96 | O307: 8.8000000000000009e-002 | P307: 146.12 | Q307: 转股中 | R307: 4.19年 | S307: 2.20年 | T307: 7.99 | U307: 246 | V307: 0.193 | W307: 3.1e-002 | X307: 4.4999999999999998e-002 | Y307: 259 | Z307: 3.51 | AA307: -7.5600000000000001e-002 | AB307: -8.1199999999999994e-002 | AC307: -0.124 | AD307: -0.126 | AE307: 95.7 | AF307: 100.13 | AG307: 0.86 | AH307: AA+ | AI307: 3.4599999999999999e-002 | AJ307: =H307+100*O307 -> 167.80000000000001 | AK307: 171.9 | AL307: 286 | AM307: 71.8 | AN307: 265 | AO307: 5.0999999999999997e-002 | AP307: 14 | AQ307: 利德转债!!
A308: 360 | B308: 113502 | C308: 嘉澳转债! | D308: 603822 | E308: 嘉澳环保 | F308: 化工 | G308: 化工 | H308: 132.57 | I308: -4.0000000000000002e-004 | J308: -1.1200000000000002e-002 | K308: 48.8 | L308: -1.8100000000000002e-002 | M308: 111.3 | N308: 44.64 | O308: 0.21299999999999999 | P308: 109.32 | Q308: 转股中 | R308: 2.19年 | S308: 0.19年 | T308: 1.85 | U308: 102 | V308: 0.41299999999999998 | W308: 5.2000000000000005e-002 | X308: 5.5999999999999994e-002 | Y308: 36 | Z308: 4.4 | AA308: -7.8299999999999995e-002 | AB308: -8.6699999999999999e-002 | AC308: -0.70599999999999996 | AD308: -0.71400000000000008 | AE308: 99.77 | AF308: 98.38 | AG308: 0.64 | AH308: AA- | AI308: 5.9299999999999999e-002 | AJ308: =H308+100*O308 -> 153.87 | AK308: 155.8 | AL308: 231 | AM308: 56.1 | AN308: 179 | AO308: 0.13800000000000001 | AP308: 37 | AQ308: 嘉澳转债!
A309: 223 | B309: 113568 | C309: 新春转债!! | D309: 603667 | E309: 五洲新春 | F309: 机械装备 | G309: 通用设备 | H309: 179.21 | I309: 6.8099999999999994e-002 | J309: 2.0499999999999997e-002 | K309: 14.54 | L309: 9.98e-002 | M309: 124.3 | N309: 8.75 | O309: 7.8e-002 | P309: 166.17 | Q309: 转股中 | R309: 4.50年 | S309: 2.50年 | T309: 2.74 | U309: 984 | V309: 1.95 | W309: 6.3e-002 | X309: 0.105 | Y309: 43 | Z309: 2.39 | AA309: -7.9600000000000004e-002 | AB309: -8.7599999999999997e-002 | AC309: -0.127 | AD309: -0.128 | AE309: 89.24 | AF309: 95.99 | AG309: 0.89 | AH309: AA- | AI309: 6.0599999999999994e-002 | AJ309: =H309+100*O309 -> 187.01000000000002 | AK309: 192.2 | AL309: 318 | AM309: 96.3 | AN309: 317 | AO309: 0.113 | AP309: 46 | AQ309: 新春转债!!
A310: 349 | B310: 110041 | C310: 蒙电转债! | D310: 600863 | E310: 内蒙华电 | F310: 能源电力 | G310: 电力供应 | H310: 132.2 | I310: 8.5099999999999995e-002 | J310: -1.3300000000000001e-002 | K310: 3 | L310: 9.8900000000000002e-002 | M310: 109.3 | N310: 2.56 | O310: 0.128 | P310: 117.19 | Q310: 转股中 | R310: 2.30年 | S310: 0.30年 | T310: 18.7 | U310: 1090. | V310: 0.44 | W310: 0.107 | X310: 0.126 | Y310: 174 | Z310: 1.57 | AA310: -8.0700000000000008e-002 | AB310: -8.7400000000000005e-002 | AC310: -0.52100000000000002 | AD310: -0.52700000000000002 | AE310: 100.35 | AF310: 101.96 | AG310: 0.73 | AH310: AAA | AI310: 3.1300000000000001e-002 | AJ310: =H310+100*O310 -> 145. | AK310: 147.2 | AL310: 161 | AM310: 45.3 | AN310: 101 | AO310: 0.26500000000000001 | AP310: 14 | AQ310: 蒙电转债!
A311: 65 | B311: 113621 | C311: 彤程转债! | D311: 603650 | E311: 彤程新材 | F311: 化工 | G311: 橡胶塑料 | H311: 180.84 | I311: 1.5600000000000001e-002 | J311: -1.9900000000000001e-002 | K311: 52.2 | L311: -4.7999999999999996e-003 | M311: 115.1 | N311: 32.62 | O311: 0.13 | P311: 160.02 | Q311: 转股中 | R311: 5.39年 | S311: 3.40年 | T311: 5.37 | U311: 468 | V311: 0.48299999999999998 | W311: 1.7000000000000001e-002 | X311: 2.7999999999999997e-002 | Y311: 310 | Z311: 12.84 | AA311: -8.1600000000000006e-002 | AB311: -8.5900000000000004e-002 | AC311: -0.14000000000000001 | AD311: -0.14199999999999999 | AE311: 89.81 | AF311: 92.91 | AG311: 0.91 | AH311: AA | AI311: 4.1299999999999996e-002 | AJ311: =H311+100*O311 -> 193.84 | AK311: 201.7 | AL311: 325 | AM311: 108.8 | AN311: 327 | AO311: -0.127 | AP311: 7 | AQ311: 彤程转债!
A312: 50 | B312: 127029 | C312: 中钢转债 | D312: 928 | E312: 中钢国际 | F312: 建筑 | G312: 建筑工程 | H312: 187.2 | I312: -3.9399999999999998e-002 | J312: 1.5e-003 | K312: 11.14 | L312: -4.0500000000000001e-002 | M312: 117.5 | N312: 5.89 | O312: -1.e-002 | P312: 189.13 | Q312: 24天 | R312: 5.54年 | S312: 3.54年 | T312: 9.6 | U312: 904 | V312: 0.48100000000000004 | W312: 6.9000000000000006e-002 | X312: 0.13 | Y312: 140 | Z312: 2.4 | AA312: -8.1600000000000006e-002 | AB312: -8.6500000000000007e-002 | AC312: -0.14300000000000002 | AD312: -0.14400000000000002 | AE312: 90.32 | AF312: 96.72 | AG312: 0.93 | AH312: AA+ | AI312: 3.6299999999999999e-002 | AJ312: =H312+100*O312 -> 186.19999999999999 | AK312: 185.3 | AL312: 313 | AM312: 88.5 | AN312: 304 | AO312: 0.13300000000000001 | AP312: 14 | AQ312: 中钢转债
A313: 75 | B313: 113615 | C313: 金诚转债! | D313: 603979 | E313: 金诚信 | F313: 有色金属 | G313: 有色行业 | H313: 189.91 | I313: -2.4900000000000002e-002 | J313: -6.0999999999999995e-003 | K313: 22.48 | L313: -3.3099999999999997e-002 | M313: 117.3 | N313: 12.65 | O313: 6.9000000000000006e-002 | P313: 177.71 | Q313: 转股中 | R313: 5.30年 | S313: 3.30年 | T313: 8.98 | U313: 358 | V313: 0.20399999999999999 | W313: 6.8000000000000005e-002 | X313: 0.12 | Y313: 133 | Z313: 2.79 | AA313: -8.8300000000000003e-002 | AB313: -9.3200000000000005e-002 | AC313: -0.155 | AD313: -0.156 | AE313: 90.34 | AF313: 95.06 | AG313: 0.93 | AH313: AA | AI313: 4.1299999999999996e-002 | AJ313: =H313+100*O313 -> 196.81 | AK313: 202.1 | AL313: 327 | AM313: 107 | AN313: 324 | AO313: 5.2999999999999999e-002 | AP313: 3 | AQ313: 金诚转债!
A314: 181 | B314: 128113 | C314: 比音转债! | D314: 2832 | E314: 比音勒芬 | F314: 服装纺织 | G314: 服装行业 | H314: 181.897 | I314: -2.7300000000000001e-002 | J314: 7.6e-003 | K314: 25.45 | L314: -2.12e-002 | M314: 116.9 | N314: 14.6 | O314: 4.2999999999999997e-002 | P314: 174.32 | Q314: 转股中 | R314: 4.78年 | S314: 2.78年 | T314: 3.03 | U314: 29 | V314: 5.2999999999999999e-002 | W314: 2.2000000000000002e-002 | X314: 3.7999999999999999e-002 | Y314: 140 | Z314: 5.1 | AA314: -8.9700000000000002e-002 | AB314: -9.5100000000000004e-002 | AC314: -0.113 | AD314: -0.114 | AE314: 92.31 | AF314: 97.44 | AG314: 0.93 | AH314: AA | AI314: 3.9599999999999996e-002 | AJ314: =H314+100*O314 -> 186.197 | AK314: 189.5 | AL314: 316 | AM314: 92 | AN314: 309 | AO314: -4.0000000000000001e-002 | AP314: 9 | AQ314: 比音转债!
A315: 54 | B315: 123103 | C315: 震安转债 | D315: 300767 | E315: 震安科技 | F315: 化工 | G315: 橡胶塑料 | H315: 202.901 | I315: -3.4500000000000003e-002 | J315: -6.0999999999999995e-003 | K315: 105.5 | L315: -4.3700000000000003e-002 | M315: 121.4 | N315: 56.89 | O315: 9.4e-002 | P315: 185.45 | Q315: 17天 | R315: 5.52年 | S315: 3.52年 | T315: 2.85 | U315: 151 | V315: 0.25900000000000001 | W315: 1.3000000000000001e-002 | X315: 2.5000000000000001e-002 | Y315: 213 | Z315: 18.58 | AA315: -9.0500000000000011e-002 | AB315: -9.6199999999999994e-002 | AC315: -0.158 | AD315: -0.159 | AE315: 80.83 | AF315: 82.94 | AG315: 0.93 | AH315: A+ | AI315: 7.3300000000000004e-002 | AJ315: =H315+100*O315 -> 212.30100000000002 | AK315: 220.4 | AL315: 336 | AM315: 137.4 | AN315: 340 | AO315: -8.0000000000000002e-003 | AP315: 4 | AQ315: 震安转债
A316: 19 | B316: 127038 | C316: 国微转债 | D316: 2049 | E316: 紫光国微 | F316: 电子 | G316: 芯片制造 | H316: 197.689 | I316: -3.3700000000000001e-002 | J316: 9.7000000000000003e-003 | K316: 216.09 | L316: -2.7000000000000003e-002 | M316: 114.5 | N316: 137.78 | O316: 0.26000000000000001 | P316: 156.84 | Q316: 3月15天 | R316: 5.76年 | S316: 3.77年 | T316: 15 | U316: 218 | V316: 7.2000000000000008e-002 | W316: 1.1000000000000001e-002 | X316: 1.8000000000000002e-002 | Y316: 1311. | Z316: 21.89 | AA316: -9.1400000000000009e-002 | AB316: -9.5299999999999996e-002 | AC316: -0.14499999999999999 | AD316: -0.14599999999999999 | AE316: 89.59 | AF316: 93.5 | AG316: 0.89 | AH316: AA+ | AI316: 3.6299999999999999e-002 | AJ316: =H316+100*O316 -> 223.68899999999999 | AK316: 238.5 | AL316: 343 | AM316: 145 | AN316: 343 | AO316: 3.1e-002 | AP316: 5 | AQ316: 国微转债
A317: 218 | B317: 113572 | C317: 三祥转债!! | D317: 603663 | E317: 三祥新材 | F317: 其他 | G317: 其他 | H317: 175.61 | I317: -2.4900000000000002e-002 | J317: 9.300000000000001e-003 | K317: 24.7 | L317: -1.55e-002 | M317: 112.8 | N317: 14.09 | O317: 2.e-003 | P317: 175.3 | Q317: 转股中 | R317: 4.52年 | S317: 2.52年 | T317: 1.62 | U317: 285 | V317: 0.996 | W317: 3.4000000000000002e-002 | X317: 5.9999999999999998e-002 | Y317: 48 | Z317: 7.37 | AA317: -9.4800000000000009e-002 | AB317: -9.9199999999999997e-002 | AC317: -0.12300000000000001 | AD317: -0.124 | AE317: 85.92 | AF317: 83.06 | AG317: 1 | AH317: A+ | AI317: 7.1599999999999997e-002 | AJ317: =H317+100*O317 -> 175.81 | AK317: 175.9 | AL317: 296 | AM317: 90 | AN317: 306 | AO317: 0.13300000000000001 | AP317: 21 | AQ317: 三祥转债!!
A318: 140 | B318: 128128 | C318: 齐翔转2! | D318: 2408 | E318: 齐翔腾达 | F318: 化工 | G318: 化工 | H318: 187.999 | I318: -2.0999999999999999e-003 | J318: -5.0000000000000001e-004 | K318: 13.96 | L318: -2.8999999999999998e-003 | M318: 115 | N318: 7.97 | O318: 7.2999999999999995e-002 | P318: 175.16 | Q318: 转股中 | R318: 4.96年 | S318: 2.96年 | T318: 8.74 | U318: 182 | V318: 0.109 | W318: 3.1e-002 | X318: 5.5e-002 | Y318: 279 | Z318: 2.42 | AA318: -9.5799999999999996e-002 | AB318: -0.10000000000000001 | AC318: -0.10800000000000001 | AD318: -0.109 | AE318: 91.68 | AF318: 95.19 | AG318: 0.93 | AH318: AA | AI318: 3.9599999999999996e-002 | AJ318: =H318+100*O318 -> 195.29900000000001 | AK318: 200.8 | AL318: 324 | AM318: 105.6 | AN318: 323 | AO318: 9.1999999999999998e-002 | AP318: 31 | AQ318: 齐翔转2!
A319: 248 | B319: 128082 | C319: 华锋转债!! | D319: 2806 | E319: 华锋股份 | F319: 电子 | G319: 元器件制 | H319: 187 | I319: 1.9099999999999999e-002 | J319: -2.9399999999999999e-002 | K319: 15.72 | L319: -1.1299999999999999e-002 | M319: 121.4 | N319: 9.13 | O319: 8.5999999999999993e-002 | P319: 172.18 | Q319: 转股中 | R319: 4.25年 | S319: 2.25年 | T319: 2.19 | U319: 283 | V319: 0.68299999999999994 | W319: 7.2999999999999995e-002 | X319: 0.126 | Y319: 30 | Z319: 2.76 | AA319: -9.8800000000000013e-002 | AB319: -0.106 | AC319: -0.154 | AD319: -0.156 | AE319: 86.68 | AF319: 87.81 | AG319: 0.9 | AH319: A | AI319: 8.1600000000000006e-002 | AJ319: =H319+100*O319 -> 195.59999999999999 | AK319: 201.8 | AL319: 326 | AM319: 114 | AN319: 331 | AO319: 2.5000000000000001e-002 | AP319: 54 | AQ319: 华锋转债!!
A320: 20 | B320: 113049 | C320: 长汽转债 | D320: 601633 | E320: 长城汽车 | F320: 汽车 | G320: 乘用车 | H320: 200.98 | I320: -2.0400000000000001e-002 | J320: -9.1000000000000004e-003 | K320: 61.6 | L320: -3.27e-002 | M320: 110.5 | N320: 38.39 | O320: 0.253 | P320: 160.46 | Q320: 3月15天 | R320: 5.76年 | S320: 3.77年 | T320: 35 | U320: 141 | V320: 2.e-002 | W320: 6.0000000000000001e-003 | X320: 1.e-002 | Y320: 5669. | Z320: 9.59 | AA320: -9.9499999999999991e-002 | AB320: -0.10199999999999999 | AC320: -0.14999999999999999 | AD320: -0.14999999999999999 | AE320: 89.61 | AF320: 91.19 | AG320: 0.9 | AH320: AAA | AI320: 3.4300000000000004e-002 | AJ320: =H320+100*O320 -> 226.28 | AK320: 241.5 | AL320: 344 | AM320: 150.3 | AN320: 344 | AO320: 2.4e-002 | AP320: 5 | AQ320: 长汽转债
A321: 302 | B321: 127011 | C321: 中鼎转2!! | D321: 887 | E321: 中鼎股份 | F321: 汽车 | G321: 零部件制 | H321: 168.077 | I321: -2.5600000000000001e-002 | J321: -1.04e-002 | K321: 17.76 | L321: -4.0000000000000001e-002 | M321: 114.5 | N321: 11.39 | O321: 7.8e-002 | P321: 155.93 | Q321: 转股中 | R321: 3.51年 | S321: 1.51年 | T321: 12 | U321: 200 | V321: 9.8000000000000004e-002 | W321: 5.5e-002 | X321: 8.5999999999999993e-002 | Y321: 217 | Z321: 2.41 | AA321: -0.105 | AB321: -0.11199999999999999 | AC321: -0.215 | AD321: -0.217 | AE321: 97.18 | AF321: 101.87 | AG321: 0.9 | AH321: AA+ | AI321: 3.4599999999999999e-002 | AJ321: =H321+100*O321 -> 175.87700000000001 | AK321: 180.2 | AL321: 304 | AM321: 78.4 | AN321: 284 | AO321: 0.128 | AP321: 21 | AQ321: 中鼎转2!!
A322: 211 | B322: 128103 | C322: 同德转债! | D322: 2360 | E322: 同德化工 | F322: 化工 | G322: 化工 | H322: 201.5 | I322: 5.0000000000000001e-003 | J322: -7.8000000000000005e-003 | K322: 10.2 | L322: -2.8999999999999998e-003 | M322: 121.3 | N322: 5.08 | O322: 4.0000000000000001e-003 | P322: 200.79 | Q322: 转股中 | R322: 4.56年 | S322: 2.56年 | T322: 1.08 | U322: 260 | V322: 1.1799999999999999 | W322: 2.7000000000000003e-002 | X322: 5.4000000000000006e-002 | Y322: 41 | Z322: 3.1 | AA322: -0.107 | AB322: -0.114 | AC322: -0.14300000000000002 | AD322: -0.14400000000000002 | AE322: 86.49 | AF322: 89.19 | AG322: 0.95 | AH322: A+ | AI322: 7.1599999999999997e-002 | AJ322: =H322+100*O322 -> 201.90000000000001 | AK322: 202.2 | AL322: 328 | AM322: 113 | AN322: 329 | AO322: 5.0000000000000003e-002 | AP322: 18 | AQ322: 同德转债!
A323: 234 | B323: 123042 | C323: 银河转债!! | D323: 300619 | E323: 金银河 | F323: 机械装备 | G323: 专用设备 | H323: 189.969 | I323: -3.5200000000000002e-002 | J323: -2.6000000000000002e-002 | K323: 40.07 | L323: -6.7500000000000004e-002 | M323: 115.4 | N323: 24.38 | O323: 0.156 | P323: 164.36 | Q323: 转股中 | R323: 4.36年 | S323: 2.36年 | T323: 1.65 | U323: 558 | V323: 1.74 | W323: 5.5e-002 | X323: 9.0999999999999998e-002 | Y323: 30 | Z323: 5.94 | AA323: -0.11 | AB323: -0.115 | AC323: -0.14899999999999999 | AD323: -0.14999999999999999 | AE323: 87.28 | AF323: 85.98 | AG323: 0.91 | AH323: A+ | AI323: 7.1599999999999997e-002 | AJ323: =H323+100*O323 -> 205.56899999999999 | AK323: 215.6 | AL323: 335 | AM323: 128.3 | AN323: 338 | AO323: -0.13500000000000001 | AP323: 23 | AQ323: 银河转债!!
A324: 310 | B324: 113527 | C324: 维格转债!! | D324: 603518 | E324: 锦泓集团 | F324: 服装纺织 | G324: 服装行业 | H324: 177.92 | I324: 2.46e-002 | J324: -2.12e-002 | K324: 16.09 | L324: 3.7000000000000002e-003 | M324: 119.5 | N324: 9.85 | O324: 8.900000000000001e-002 | P324: 163.35 | Q324: 转股中 | R324: 3.39年 | S324: 1.39年 | T324: 2.87 | U324: 507 | V324: 1. | W324: 6.3e-002 | X324: 0.10300000000000001 | Y324: 46 | Z324: 2.01 | AA324: -0.11199999999999999 | AB324: -0.121 | AC324: -0.255 | AD324: -0.25700000000000001 | AE324: 95.43 | AF324: 101.74 | AG324: 0.9 | AH324: AA | AI324: 4.9599999999999998e-002 | AJ324: =H324+100*O324 -> 186.81999999999999 | AK324: 192.5 | AL324: 319 | AM324: 90.8 | AN324: 307 | AO324: 7.4999999999999997e-002 | AP324: 81 | AQ324: 维格转债!!
A325: 35 | B325: 113047 | C325: 旗滨转债 | D325: 601636 | E325: 旗滨集团 | F325: 建筑 | G325: 玻璃 | H325: 222.33 | I325: 2.9999999999999997e-004 | J325: 5.5000000000000005e-003 | K325: 27.02 | L325: 6.0000000000000001e-003 | M325: 114 | N325: 12.8 | O325: 5.2999999999999999e-002 | P325: 211.09 | Q325: 42天 | R325: 5.59年 | S325: 3.60年 | T325: 15 | U325: 396 | V325: 0.11699999999999999 | W325: 2.1000000000000001e-002 | X325: 4.4000000000000004e-002 | Y325: 726 | Z325: 6.72 | AA325: -0.114 | AB325: -0.11699999999999999 | AC325: -0.17499999999999999 | AD325: -0.17600000000000002 | AE325: 89.7 | AF325: 93.63 | AG325: 0.96 | AH325: AA+ | AI325: 3.6299999999999999e-002 | AJ325: =H325+100*O325 -> 227.63000000000002 | AK325: 233.6 | AL325: 342 | AM325: 139.9 | AN325: 341 | AO325: 0.155 | AP325: 6 | AQ325: 旗滨转债
A326: 306 | B326: 113528 | C326: 长城转债!! | D326: 603897 | E326: 长城科技 | F326: 机械装备 | G326: 专用设备 | H326: 180.81 | I326: -3.2099999999999997e-002 | J326: 1.3600000000000001e-002 | K326: 38.26 | L326: -2.0199999999999999e-002 | M326: 116.8 | N326: 23.35 | O326: 0.10300000000000001 | P326: 163.85 | Q326: 转股中 | R326: 3.49年 | S326: 1.49年 | T326: 5.5 | U326: 183 | V326: 0.182 | W326: 7.9000000000000001e-002 | X326: 0.13 | Y326: 70 | Z326: 3.29 | AA326: -0.12 | AB326: -0.127 | AC326: -0.24199999999999999 | AD326: -0.24299999999999999 | AE326: 93.64 | AF326: 95.57 | AG326: 0.92 | AH326: AA- | AI326: 6.0599999999999994e-002 | AJ326: =H326+100*O326 -> 191.11000000000001 | AK326: 197.8 | AL326: 322 | AM326: 102.2 | AN326: 320 | AO326: -3.4000000000000002e-002 | AP326: 38 | AQ326: 长城转债!!
A327: 123 | B327: 123069 | C327: 金诺转债!! | D327: 300505 | E327: 川金诺 | F327: 化工 | G327: 农化 | H327: 239.64 | I327: -4.1100000000000005e-002 | J327: -5.8400000000000001e-002 | K327: 43.2 | L327: -0.10400000000000001 | M327: 126 | N327: 19.09 | O327: 5.9000000000000004e-002 | P327: 226.3 | Q327: 转股中 | R327: 5年42天 | S327: 3年43天 | T327: 2.26 | U327: 2760. | V327: 5.0499999999999998 | W327: 4.0000000000000001e-002 | X327: 8.9999999999999997e-002 | Y327: 56 | Z327: 5.75 | AA327: -0.12 | AB327: -0.127 | AC327: -0.129 | AD327: -0.13 | AE327: 85.41 | AF327: 93.1 | AG327: 0.96 | AH327: AA- | AI327: 6.2300000000000001e-002 | AJ327: =H327+100*O327 -> 245.53999999999999 | AK327: 253 | AL327: 347 | AM327: 159.9 | AN327: 348 | AO327: 0.33799999999999997 | AP327: 18 | AQ327: 金诺转债!!
A328: 361 | B328: 128018 | C328: 时达转债! | D328: 2527 | E328: 新时达 | F328: 机械装备 | G328: 机器人及 | H328: 144 | I328: -1.46e-002 | J328: 2.2700000000000001e-002 | K328: 9.77 | L328: 9.300000000000001e-003 | M328: 109.3 | N328: 7.36 | O328: 8.5000000000000006e-002 | P328: 132.74 | Q328: 转股中 | R328: 2.18年 | S328: 0.18年 | T328: 4.05 | U328: 30 | V328: 5.0999999999999997e-002 | W328: 6.7000000000000004e-002 | X328: 8.8000000000000009e-002 | Y328: 61 | Z328: 2.26 | AA328: -0.121 | AB328: -0.128 | AC328: -0.92000000000000004 | AD328: -0.92700000000000005 | AE328: 100.51 | AF328: 100.89 | AG328: 0.87 | AH328: AA | AI328: 3.8300000000000001e-002 | AJ328: =H328+100*O328 -> 152.5 | AK328: 155.3 | AL328: 223 | AM328: 54.4 | AN328: 169 | AO328: 5.2000000000000005e-002 | AP328: 35 | AQ328: 时达转债!
A329: 194 | B329: 113580 | C329: 康隆转债!! | D329: 603665 | E329: 康隆达 | F329: 服装纺织 | G329: 服装行业 | H329: 216.88 | I329: -2.e-003 | J329: 7.8000000000000005e-003 | K329: 11.62 | L329: 1.66e-002 | M329: 120.8 | N329: 15.51 | O329: 1.8899999999999999 | P329: 74.92 | Q329: 转股中 | R329: 4.63年 | S329: 2.64年 | T329: 0.41 | U329: 132 | V329: 1.45 | W329: 2.2000000000000002e-002 | X329: 1.7000000000000001e-002 | Y329: 18 | Z329: 1.71 | AA329: -0.121 | AB329: -0.127 | AC329: -0.14899999999999999 | AD329: -0.14999999999999999 | AE329: 88.11 | AF329: 92.53 | AG329: 0.35 | AH329: AA- | AI329: 6.0599999999999994e-002 | AJ329: =H329+100*O329 -> 405.88 | AK329: 358.8 | AL329: 360 | AM329: 266.3 | AN329: 362 | AO329: 1.6e-002 | AP329: 8 | AQ329: 康隆转债!!
A330: 142 | B330: 110074 | C330: 精达转债!! | D330: 600577 | E330: 精达股份 | F330: 电子 | G330: 电子产品 | H330: 220.92 | I330: -2.69e-002 | J330: 3.8900000000000004e-002 | K330: 8.15 | L330: 1.24e-002 | M330: 116.9 | N330: 3.73 | O330: 1.1000000000000001e-002 | P330: 218.5 | Q330: 转股中 | R330: 4.96年 | S330: 2.96年 | T330: 5.66 | U330: 368 | V330: 0.28399999999999997 | W330: 3.5000000000000003e-002 | X330: 7.6999999999999999e-002 | Y330: 161 | Z330: 3.95 | AA330: -0.122 | AB330: -0.127 | AC330: -0.13 | AD330: -0.13100000000000001 | AE330: 91.67 | AF330: 96.77 | AG330: 0.97 | AH330: AA | AI330: 3.9599999999999996e-002 | AJ330: =H330+100*O330 -> 222.01999999999998 | AK330: 223.3 | AL330: 337 | AM330: 126.6 | AN330: 337 | AO330: -8.1000000000000003e-002 | AP330: 12 | AQ330: 精达转债!!
A331: 329 | B331: 123012 | C331: 万顺转债! | D331: 300057 | E331: 万顺新材 | F331: 有色金属 | G331: 铝金属 | H331: 158.93 | I331: 8.3999999999999995e-003 | J331: 7.0999999999999995e-003 | K331: 7.67 | L331: 1.72e-002 | M331: 109.3 | N331: 5.27 | O331: 9.1999999999999998e-002 | P331: 145.54 | Q331: 转股中 | R331: 2.87年 | S331: 0.88年 | T331: 1.28 | U331: 210 | V331: 1.02 | W331: 2.5000000000000001e-002 | X331: 3.6000000000000004e-002 | Y331: 52 | Z331: 1.45 | AA331: -0.124 | AB331: -0.129 | AC331: -0.34299999999999997 | AD331: -0.34499999999999997 | AE331: 95.88 | AF331: 92.85 | AG331: 0.9 | AH331: AA- | AI331: 5.9299999999999999e-002 | AJ331: =H331+100*O331 -> 168.13 | AK331: 172.3 | AL331: 289 | AM331: 76.4 | AN331: 278 | AO331: -8.9999999999999997e-002 | AP331: 25 | AQ331: 万顺转债!
A332: 326 | B332: 123014 | C332: 凯发转债! | D332: 300407 | E332: 凯发电气 | F332: 能源电力 | G332: 电力设备 | H332: 138.6 | I332: 1.0200000000000001e-002 | J332: 1.3500000000000002e-002 | K332: 8.78 | L332: 3.5400000000000001e-002 | M332: 107.5 | N332: 8.05 | O332: 0.27100000000000002 | P332: 109.07 | Q332: 转股中 | R332: 1.90年 | S332: 回售内 | T332: 1.16 | U332: 115 | V332: 0.71700000000000008 | W332: 4.2999999999999997e-002 | X332: 4.7e-002 | Y332: 27 | Z332: 1.95 | AA332: -0.126 | AB332: -0.13300000000000001 | AC332: 回售内 | AD332: 回售内 | AE332: 100.25 | AF332: 94.6 | AG332: 0.67 | AH332: A+ | AI332: 7.0300000000000001e-002 | AJ332: =H332+100*O332 -> 165.69999999999999 | AK332: 168.1 | AL332: 276 | AM332: 67.9 | AN332: 248 | AO332: 2.3e-002 | AP332: 15 | AQ332: 凯发转债!
A333: 313 | B333: 113525 | C333: 台华转债! | D333: 603055 | E333: 台华新材 | F333: 服装纺织 | G333: 纺织行业 | H333: 176.76 | I333: 1.43e-002 | J333: 2.7099999999999999e-002 | K333: 13.91 | L333: 4.3499999999999997e-002 | M333: 114.3 | N333: 7.78 | O333: -1.1000000000000001e-002 | P333: 178.79 | Q333: 转股中 | R333: 3.29年 | S333: 1.29年 | T333: 4.65 | U333: 409 | V333: 0.495 | W333: 4.0000000000000001e-002 | X333: 7.2000000000000008e-002 | Y333: 116 | Z333: 3.66 | AA333: -0.126 | AB333: -0.13300000000000001 | AC333: -0.27500000000000002 | AD333: -0.27699999999999997 | AE333: 97.21 | AF333: 100.88 | AG333: 0.95 | AH333: AA | AI333: 3.9599999999999996e-002 | AJ333: =H333+100*O333 -> 175.66 | AK333: 174.7 | AL333: 292 | AM333: 73.9 | AN333: 271 | AO333: 0.33000000000000002 | AP333: 21 | AQ333: 台华转债!
A334: 300 | B334: 110055 | C334: 伊力转债!! | D334: 600197 | E334: 伊力特 | F334: 食品饮料 | G334: 白酒 | H334: 182.15 | I334: 2.92e-002 | J334: 2.1899999999999999e-002 | K334: 27.26 | L334: 5.45e-002 | M334: 114.3 | N334: 16.41 | O334: 9.6999999999999989e-002 | P334: 166.12 | Q334: 转股中 | R334: 3.53年 | S334: 1.53年 | T334: 2.44 | U334: 1497. | V334: 3.3999999999999999 | W334: 1.9e-002 | X334: 3.1e-002 | Y334: 129 | Z334: 3.45 | AA334: -0.126 | AB334: -0.13200000000000001 | AC334: -0.23800000000000002 | AD334: -0.23999999999999999 | AE334: 96.3 | AF334: 99.94 | AG334: 0.94 | AH334: AA | AI334: 3.9599999999999996e-002 | AJ334: =H334+100*O334 -> 191.84999999999999 | AK334: 198.2 | AL334: 323 | AM334: 98.2 | AN334: 319 | AO334: 0.11 | AP334: 22 | AQ334: 伊力转债!!
A335: 48 | B335: 127030 | C335: 盛虹转债 | D335: 301 | E335: 东方盛虹 | F335: 化工 | G335: 化纤 | H335: 241.2 | I335: -1.9799999999999998e-002 | J335: -9.7999999999999997e-003 | K335: 32.96 | L335: -3.0299999999999997e-002 | M335: 112.5 | N335: 14.1 | O335: 3.2000000000000001e-002 | P335: 233.76 | Q335: 24天 | R335: 5.55年 | S335: 3.55年 | T335: 50 | U335: 662 | V335: 5.4000000000000006e-002 | W335: 3.1e-002 | X335: 7.2999999999999995e-002 | Y335: 1594. | Z335: 8.75 | AA335: -0.13 | AB335: -0.13300000000000001 | AC335: -0.10800000000000001 | AD335: -0.10800000000000001 | AE335: 90.3 | AF335: 92.59 | AG335: 0.97 | AH335: AA+ | AI335: 3.6299999999999999e-002 | AJ335: =H335+100*O335 -> 244.39999999999998 | AK335: 248.6 | AL335: 346 | AM335: 156.1 | AN335: 347 | AO335: 0.19399999999999998 | AP335: 5 | AQ335: 盛虹转债
A336: 343 | B336: 113504 | C336: 艾华转债!! | D336: 603989 | E336: 艾华集团 | F336: 电子 | G336: 元器件制 | H336: 154.53 | I336: 6.9999999999999993e-003 | J336: 2.8000000000000004e-003 | K336: 30.71 | L336: 1.0500000000000001e-002 | M336: 109.3 | N336: 20.81 | O336: 4.7e-002 | P336: 147.57 | Q336: 转股中 | R336: 2.49年 | S336: 0.49年 | T336: 4.9 | U336: 26 | V336: 3.4000000000000002e-002 | W336: 4.0000000000000001e-002 | X336: 5.9000000000000004e-002 | Y336: 123 | Z336: 4.52 | AA336: -0.13200000000000001 | AB336: -0.13699999999999998 | AC336: -0.53700000000000003 | AD336: -0.54000000000000004 | AE336: 99.32 | AF336: 99.69 | AG336: 0.93 | AH336: AA | AI336: 3.8300000000000001e-002 | AJ336: =H336+100*O336 -> 159.22999999999999 | AK336: 161.5 | AL336: 261 | AM336: 61.8 | AN336: 216 | AO336: -8.3000000000000004e-002 | AP336: 10 | AQ336: 艾华转债!!
A337: 279 | B337: 113537 | C337: 文灿转债!! | D337: 603348 | E337: 文灿股份 | F337: 汽车 | G337: 零部件制 | H337: 203.45 | I337: -1.6200000000000003e-002 | J337: 7.8000000000000005e-003 | K337: 35.36 | L337: -9.0000000000000011e-003 | M337: 120.7 | N337: 19.28 | O337: 0.109 | P337: 183.4 | Q337: 转股中 | R337: 3.76年 | S337: 1.77年 | T337: 1.41 | U337: 49 | V337: 0.17000000000000001 | W337: 1.4999999999999999e-002 | X337: 2.7999999999999997e-002 | Y337: 93 | Z337: 3.51 | AA337: -0.13200000000000001 | AB337: -0.14000000000000001 | AC337: -0.22899999999999998 | AD337: -0.23000000000000001 | AE337: 92.57 | AF337: 97.21 | AG337: 0.94 | AH337: AA- | AI337: 6.0599999999999994e-002 | AJ337: =H337+100*O337 -> 214.34999999999999 | AK337: 223.5 | AL337: 338 | AM337: 126.3 | AN337: 335 | AO337: -6.2e-002 | AP337: 25 | AQ337: 文灿转债!!
A338: 67 | B338: 123094 | C338: 星源转2!!* | D338: 300568 | E338: 星源材质 | F338: 电子 | G338: 电子行业 | H338: 249 | I338: 2.3799999999999998e-002 | J338: 1.2999999999999999e-003 | K338: 49.35 | L338: 2.5099999999999997e-002 | M338: 117.3 | N338: 19.64 | O338: -9.0000000000000011e-003 | P338: 251.27 | Q338: 转股中 | R338: 5.38年 | S338: 3.38年 | T338: 0.97 | U338: 1006. | V338: 4.21 | W338: 3.0000000000000001e-003 | X338: 6.9999999999999993e-003 | Y338: 365 | Z338: 11.57 | AA338: -0.13300000000000001 | AB338: -0.13699999999999998 | AC338: -0.11800000000000001 | AD338: -0.11900000000000001 | AE338: 90.06 | AF338: 94.77 | AG338: 1 | AH338: AA | AI338: 4.1299999999999996e-002 | AJ338: =H338+100*O338 -> 248.09999999999999 | AK338: 246.7 | AL338: 345 | AM338: 152 | AN338: 345 | AO338: 8.199999999999999e-002 | AP338: 7 | AQ338: 星源转2!!*
A339: 264 | B339: 113545 | C339: 金能转债! | D339: 603113 | E339: 金能科技 | F339: 煤炭 | G339: 炼焦 | H339: 207.85 | I339: -1.5800000000000002e-002 | J339: 7.7000000000000002e-003 | K339: 19.91 | L339: -8.5000000000000006e-003 | M339: 114.9 | N339: 10.43 | O339: 8.900000000000001e-002 | P339: 190.89 | Q339: 转股中 | R339: 4年40天 | S339: 2年41天 | T339: 10.2 | U339: 124 | V339: 5.7999999999999996e-002 | W339: 5.9999999999999998e-002 | X339: 0.115 | Y339: 170 | Z339: 2 | AA339: -0.13699999999999998 | AB339: -0.14199999999999999 | AC339: -0.19 | AD339: -0.192 | AE339: 94.74 | AF339: 98.3 | AG339: 0.95 | AH339: AA | AI339: 3.9599999999999996e-002 | AJ339: =H339+100*O339 -> 216.75 | AK339: 224.8 | AL339: 339 | AM339: 126.5 | AN339: 336 | AO339: 6.7000000000000004e-002 | AP339: 15 | AQ339: 金能转债!
A340: 315 | B340: 128051 | C340: 光华转债!!* | D340: 2741 | E340: 光华科技 | F340: 电子 | G340: 元器件制 | H340: 189.31 | I340: -3.1699999999999999e-002 | J340: -1.1699999999999999e-002 | K340: 23.63 | L340: -4.3299999999999998e-002 | M340: 114.8 | N340: 12.72 | O340: 1.9e-002 | P340: 185.77 | Q340: 转股中 | R340: 3.28年 | S340: 1.28年 | T340: 0.36 | U340: 146 | V340: 2.0800000000000001 | W340: 4.0000000000000001e-003 | X340: 8.0000000000000002e-003 | Y340: 89 | Z340: 6.92 | AA340: -0.14400000000000002 | AB340: -0.14999999999999999 | AC340: -0.30099999999999999 | AD340: -0.30299999999999999 | AE340: 94.8 | AF340: 95.1 | AG340: 1 | AH340: AA- | AI340: 6.0599999999999994e-002 | AJ340: =H340+100*O340 -> 191.21000000000001 | AK340: 192.8 | AL340: 320 | AM340: 97.7 | AN340: 318 | AO340: -1.7000000000000001e-002 | AP340: 27 | AQ340: 光华转债!!*
A341: 53 | B341: 123102 | C341: 华自转债 | D341: 300490 | E341: 华自科技 | F341: 机械装备 | G341: 机器人及 | H341: 303.5 | I341: -5.45e-002 | J341: 1.2699999999999999e-002 | K341: 31.33 | L341: -4.2800000000000005e-002 | M341: 126.9 | N341: 9.25 | O341: -0.10400000000000001 | P341: 338.7 | Q341: 15天 | R341: 5.52年 | S341: 3.52年 | T341: 6.7 | U341: 4393. | V341: 2.0699999999999998 | W341: 8.3000000000000004e-002 | X341: 0.28199999999999997 | Y341: 80 | Z341: 4.55 | AA341: -0.14899999999999999 | AB341: -0.155 | AC341: -0.126 | AD341: -0.127 | AE341: 84.23 | AF341: 91.65 | AG341: 0.98 | AH341: AA- | AI341: 6.2300000000000001e-002 | AJ341: =H341+100*O341 -> 293.10000000000002 | AK341: 268.3 | AL341: 349 | AM341: 176.6 | AN341: 349 | AO341: 0.46500000000000002 | AP341: 25 | AQ341: 华自转债
A342: 269 | B342: 123030 | C342: 九洲转债!* | D342: 300040 | E342: 九洲集团 | F342: 能源电力 | G342: 电力设备 | H342: 225.69 | I342: 2.35e-002 | J342: -7.7000000000000002e-003 | K342: 8.99 | L342: 1.5800000000000002e-002 | M342: 119.3 | N342: 4 | O342: 4.0000000000000001e-003 | P342: 224.75 | Q342: 转股中 | R342: 3.96年 | S342: 1.96年 | T342: 0.78 | U342: 1089. | V342: 5.9500000000000002 | W342: 1.4999999999999999e-002 | X342: 3.5000000000000003e-002 | Y342: 51 | Z342: 1.51 | AA342: -0.151 | AB342: -0.157 | AC342: -0.22500000000000001 | AD342: -0.22600000000000001 | AE342: 90.78 | AF342: 94.88 | AG342: 1 | AH342: AA- | AI342: 6.0599999999999994e-002 | AJ342: =H342+100*O342 -> 226.09 | AK342: 226.6 | AL342: 340 | AM342: 131.7 | AN342: 339 | AO342: -1.3000000000000001e-002 | AP342: 25 | AQ342: 九洲转债!*
A343: 316 | B343: 128050 | C343: 钧达转债!! | D343: 2865 | E343: 钧达股份 | F343: 汽车 | G343: 零部件制 | H343: 208 | I343: -7.4400000000000008e-002 | J343: -2.0000000000000001e-004 | K343: 30.61 | L343: -7.4700000000000003e-002 | M343: 122.7 | N343: 14.8 | O343: 6.0000000000000001e-003 | P343: 206.82 | Q343: 转股中 | R343: 3.27年 | S343: 1.27年 | T343: 1.37 | U343: 388 | V343: 1.3400000000000001 | W343: 3.4000000000000002e-002 | X343: 7.0000000000000007e-002 | Y343: 41 | Z343: 3.92 | AA343: -0.152 | AB343: -0.161 | AC343: -0.33700000000000002 | AD343: -0.33899999999999997 | AE343: 94.78 | AF343: 101.68 | AG343: 1 | AH343: AA- | AI343: 6.0599999999999994e-002 | AJ343: =H343+100*O343 -> 208.59999999999999 | AK343: 209.2 | AL343: 331 | AM343: 107.5 | AN343: 325 | AO343: 4.5999999999999999e-002 | AP343: 52 | AQ343: 钧达转债!!
A344: 255 | B344: 123034 | C344: 通光转债! | D344: 300265 | E344: 通光线缆 | F344: 通信互联 | G344: 通信设备 | H344: 231.291 | I344: -2.6000000000000002e-002 | J344: 5.5000000000000005e-003 | K344: 11.32 | L344: -2.41e-002 | M344: 118 | N344: 7.95 | O344: 0.624 | P344: 142.39 | Q344: 转股中 | R344: 4.17年 | S344: 2.17年 | T344: 0.78 | U344: 489 | V344: 2.6800000000000002 | W344: 1.9e-002 | X344: 2.7000000000000003e-002 | Y344: 41 | Z344: 3.13 | AA344: -0.152 | AB344: -0.157 | AC344: -0.20300000000000001 | AD344: -0.20399999999999999 | AE344: 88.24 | AF344: 89.04 | AG344: 0.85 | AH344: A+ | AI344: 7.1599999999999997e-002 | AJ344: =H344+100*O344 -> 293.69099999999997 | AK344: 320.2 | AL344: 355 | AM344: 231.1 | AN344: 356 | AO344: -7.9000000000000001e-002 | AP344: 20 | AQ344: 通光转债!
A345: 364 | B345: 113014 | C345: 林洋转债!! | D345: 601222 | E345: 林洋能源 | F345: 能源电力 | G345: 电力设备 | H345: 155.09 | I345: -5.1999999999999998e-003 | J345: 7.5600000000000001e-002 | K345: 13.69 | L345: 7.0400000000000004e-002 | M345: 109.3 | N345: 8.44 | O345: -4.4000000000000004e-002 | P345: 162.2 | Q345: 转股中 | R345: 2年54天 | S345: 54天 | T345: 23 | U345: 5505. | V345: 1.51 | W345: 9.4e-002 | X345: 0.152 | Y345: 246 | Z345: 2.22 | AA345: -0.153 | AB345: -0.159 | AC345: -1.175 | AD345: -1.1819999999999999 | AE345: 100.61 | AF345: 101 | AG345: 1 | AH345: AA | AI345: 3.8300000000000001e-002 | AJ345: =H345+100*O345 -> 150.69 | AK345: 148 | AL345: 170 | AM345: 47 | AN345: 112 | AO345: 0.23600000000000002 | AP345: 35 | AQ345: 林洋转债!!
A346: 130 | B346: 123067 | C346: 斯莱转债! | D346: 300382 | E346: 斯莱克 | F346: 机械装备 | G346: 专用设备 | H346: 278.86 | I346: -1.84e-002 | J346: 8.0000000000000002e-003 | K346: 25.88 | L346: -1.0700000000000001e-002 | M346: 121.2 | N346: 9.36 | O346: 9.0000000000000011e-003 | P346: 276.5 | Q346: 转股中 | R346: 5年13天 | S346: 3年14天 | T346: 3.35 | U346: 157 | V346: 0.16399999999999998 | W346: 2.3e-002 | X346: 6.3e-002 | Y346: 146 | Z346: 14 | AA346: -0.155 | AB346: -0.161 | AC346: -0.14899999999999999 | AD346: -0.14999999999999999 | AE346: 86.01 | AF346: 90.05 | AG346: 0.98 | AH346: AA- | AI346: 6.2300000000000001e-002 | AJ346: =H346+100*O346 -> 279.75999999999999 | AK346: 281.2 | AL346: 351 | AM346: 191.2 | AN346: 351 | AO346: -1.e-003 | AP346: 12 | AQ346: 斯莱转债!
A347: 322 | B347: 128046 | C347: 利尔转债!! | D347: 2258 | E347: 利尔化学 | F347: 化工 | G347: 农化 | H347: 189.5 | I347: -2.5999999999999999e-003 | J347: 1.5100000000000001e-002 | K347: 30.7 | L347: 1.32e-002 | M347: 112.3 | N347: 18.42 | O347: 0.13699999999999998 | P347: 166.67 | Q347: 转股中 | R347: 3年43天 | S347: 1年44天 | T347: 8.08 | U347: 276 | V347: 0.17199999999999999 | W347: 5.0000000000000003e-002 | X347: 8.3000000000000004e-002 | Y347: 162 | Z347: 3.85 | AA347: -0.157 | AB347: -0.16300000000000001 | AC347: -0.34600000000000003 | AD347: -0.34799999999999998 | AE347: 97.84 | AF347: 99.76 | AG347: 0.95 | AH347: AA | AI347: 3.9599999999999996e-002 | AJ347: =H347+100*O347 -> 203.19999999999999 | AK347: 212.3 | AL347: 333 | AM347: 112.6 | AN347: 328 | AO347: -1.2e-002 | AP347: 10 | AQ347: 利尔转债!!
A348: 317 | B348: 110048 | C348: 福能转债!! | D348: 600483 | E348: 福能股份 | F348: 能源电力 | G348: 电力供应 | H348: 197.93 | I348: 2.6099999999999998e-002 | J348: -1.1299999999999999e-002 | K348: 14.56 | L348: 1.5300000000000001e-002 | M348: 113.3 | N348: 7.85 | O348: 6.7000000000000004e-002 | P348: 185.48 | Q348: 转股中 | R348: 3.26年 | S348: 1.26年 | T348: 19.5 | U348: 704 | V348: 0.17800000000000002 | W348: 7.2000000000000008e-002 | X348: 0.13300000000000001 | Y348: 272 | Z348: 1.66 | AA348: -0.16 | AB348: -0.16600000000000001 | AC348: -0.32299999999999995 | AD348: -0.32500000000000001 | AE348: 97.98 | AF348: 101.65 | AG348: 0.96 | AH348: AA+ | AI348: 3.4599999999999999e-002 | AJ348: =H348+100*O348 -> 204.63 | AK348: 210.4 | AL348: 332 | AM348: 108.7 | AN348: 326 | AO348: 0.129 | AP348: 9 | AQ348: 福能转债!!
A349: 226 | B349: 110066 | C349: 盛屯转债!! | D349: 600711 | E349: 盛屯矿业 | F349: 有色金属 | G349: 有色行业 | H349: 255.6 | I349: -3.4000000000000002e-002 | J349: 1.2500000000000001e-002 | K349: 11.5 | L349: -2.2099999999999998e-002 | M349: 114.9 | N349: 4.87 | O349: 8.199999999999999e-002 | P349: 236.14 | Q349: 转股中 | R349: 4.49年 | S349: 2.49年 | T349: 3.83 | U349: 645 | V349: 0.64599999999999991 | W349: 1.2e-002 | X349: 2.8999999999999998e-002 | Y349: 316 | Z349: 2.71 | AA349: -0.16500000000000001 | AB349: -0.17000000000000001 | AC349: -0.184 | AD349: -0.185 | AE349: 93.35 | AF349: 96.85 | AG349: 0.98 | AH349: AA | AI349: 3.9599999999999996e-002 | AJ349: =H349+100*O349 -> 263.80000000000001 | AK349: 275.1 | AL349: 350 | AM349: 178.2 | AN349: 350 | AO349: 0.16 | AP349: 33 | AQ349: 盛屯转债!!
A350: 213 | B350: 123047 | C350: 久吾转债! | D350: 300631 | E350: 久吾高科 | F350: 机械装备 | G350: 专用设备 | H350: 289 | I350: -4.6500000000000007e-002 | J350: -1.3300000000000001e-002 | K350: 40.76 | L350: -6.3e-002 | M350: 129.6 | N350: 17.43 | O350: 0.23600000000000002 | P350: 233.85 | Q350: 转股中 | R350: 4.54年 | S350: 2.54年 | T350: 1.58 | U350: 537 | V350: 1.1399999999999999 | W350: 3.6000000000000004e-002 | X350: 8.3000000000000004e-002 | Y350: 44 | Z350: 5.47 | AA350: -0.16500000000000001 | AB350: -0.17300000000000001 | AC350: -0.192 | AD350: -0.193 | AE350: 87.77 | AF350: 95.57 | AG350: 0.95 | AH350: A+ | AI350: 7.1599999999999997e-002 | AJ350: =H350+100*O350 -> 312.60000000000002 | AK350: 344.2 | AL350: 358 | AM350: 248.6 | AN350: 357 | AO350: -0.23100000000000001 | AP350: 22 | AQ350: 久吾转债!
A351: 205 | B351: 113034 | C351: 滨化转债! | D351: 601678 | E351: 滨化股份 | F351: 化工 | G351: 化工 | H351: 261.17 | I351: -5.0599999999999999e-002 | J351: -2.3399999999999997e-002 | K351: 10.58 | L351: -7.5999999999999998e-002 | M351: 114.8 | N351: 4.58 | O351: 0.13100000000000001 | P351: 231 | Q351: 转股中 | R351: 4.60年 | S351: 2.60年 | T351: 4.68 | U351: 503 | V351: 0.40600000000000003 | W351: 2.3e-002 | X351: 5.2000000000000005e-002 | Y351: 206 | Z351: 2.2 | AA351: -0.16600000000000001 | AB351: -0.17000000000000001 | AC351: -0.17699999999999999 | AD351: -0.17800000000000002 | AE351: 92.86 | AF351: 96.35 | AG351: 0.97 | AH351: AA | AI351: 3.9599999999999996e-002 | AJ351: =H351+100*O351 -> 274.27000000000004 | AK351: 291.3 | AL351: 353 | AM351: 195 | AN351: 353 | AO351: 1.e-003 | AP351: 23 | AQ351: 滨化转债!
A352: 312 | B352: 123018 | C352: 溢利转债! | D352: 300381 | E352: 溢多利 | F352: 医药 | G352: 原料药 | H352: 206.6 | I352: -7.000000000000001e-004 | J352: 6.0000000000000001e-003 | K352: 10.26 | L352: 6.8999999999999999e-003 | M352: 114.3 | N352: 8.25 | O352: 0.66099999999999992 | P352: 124.36 | Q352: 转股中 | R352: 3.29年 | S352: 1.30年 | T352: 0.54 | U352: 20 | V352: 0.18100000000000002 | W352: 1.1000000000000001e-002 | X352: 1.3000000000000001e-002 | Y352: 50 | Z352: 1.68 | AA352: -0.16699999999999998 | AB352: -0.17300000000000001 | AC352: -0.32799999999999996 | AD352: -0.33000000000000002 | AE352: 94.4 | AF352: 94.56 | AG352: 0.77 | AH352: AA- | AI352: 6.0599999999999994e-002 | AJ352: =H352+100*O352 -> 272.69999999999999 | AK352: 288.8 | AL352: 352 | AM352: 194.3 | AN352: 352 | AO352: 6.2e-002 | AP352: 11 | AQ352: 溢利转债!
A353: 98 | B353: 123079 | C353: 运达转债!* | D353: 300772 | E353: 运达股份 | F353: 能源电力 | G353: 风能 | H353: 297.498 | I353: -3.7200000000000004e-002 | J353: 0.17199999999999999 | K353: 44.75 | L353: 0.13500000000000001 | M353: 115.1 | N353: 15.12 | O353: 5.0000000000000001e-003 | P353: 295.97 | Q353: 转股中 | R353: 5.24年 | S353: 3.24年 | T353: 0.52 | U353: 4443. | V353: 25.289999999999999 | W353: 3.0000000000000001e-003 | X353: 1.e-002 | Y353: 149 | Z353: 7.6 | AA353: -0.16800000000000001 | AB353: -0.17199999999999999 | AC353: -0.14199999999999999 | AD353: -0.14199999999999999 | AE353: 90.36 | AF353: 93.48 | AG353: 1 | AH353: AA | AI353: 4.1299999999999996e-002 | AJ353: =H353+100*O353 -> 297.99799999999999 | AK353: 299 | AL353: 354 | AM353: 205.5 | AN353: 354 | AO353: 0.36399999999999999 | AP353: 4 | AQ353: 运达转债!*
A354: 324 | B354: 123015 | C354: 蓝盾转债!! | D354: 300297 | E354: 蓝盾股份 | F354: 计算机及 | G354: 软件开发 | H354: 200.989 | I354: 1.e-002 | J354: -1.e-002 | K354: 3.44 | L354: 1.78e-002 | M354: 111.3 | N354: 5.79 | O354: 2.3799999999999999 | P354: 59.41 | Q354: 转股中 | R354: 2.94年 | S354: 0.94年 | T354: 1 | U354: 292 | V354: 1.4399999999999999 | W354: 2.3e-002 | X354: 1.3999999999999999e-002 | Y354: 43 | Z354: 2.05 | AA354: -0.184 | AB354: -0.18899999999999997 | AC354: -0.44 | AD354: -0.442 | AE354: 89.77 | AF354: 80.11 | AG354: 0 | AH354: BBB- | AI354: 0.12029999999999999 | AJ354: =H354+100*O354 -> 438.98900000000003 | AK354: 342.6 | AL354: 357 | AM354: 252.8 | AN354: 358 | AO354: -1.3000000000000001e-002 | AP354: 16 | AQ354: 蓝盾转债!!
A355: 236 | B355: 128093 | C355: 百川转债!! | D355: 2455 | E355: 百川股份 | F355: 化工 | G355: 化工 | H355: 316.2 | I355: -7.0800000000000002e-002 | J355: 2.4300000000000002e-002 | K355: 17.45 | L355: -4.8000000000000001e-002 | M355: 129.8 | N355: 5.77 | O355: 4.5999999999999999e-002 | P355: 302.43 | Q355: 转股中 | R355: 4.33年 | S355: 2.33年 | T355: 1.62 | U355: 1224. | V355: 2.2599999999999998 | W355: 1.6e-002 | X355: 5.0000000000000003e-002 | Y355: 99 | Z355: 6.14 | AA355: -0.191 | AB355: -0.19899999999999998 | AC355: -0.22399999999999998 | AD355: -0.22500000000000001 | AE355: 92.53 | AF355: 101.58 | AG355: 0.97 | AH355: AA- | AI355: 6.0599999999999994e-002 | AJ355: =H355+100*O355 -> 320.80000000000001 | AK355: 330 | AL355: 356 | AM355: 228.4 | AN355: 355 | AO355: -0.20000000000000001 | AP355: 46 | AQ355: 百川转债!!
A356: 311 | B356: 113526 | C356: 联泰转债! | D356: 603797 | E356: 联泰环保 | F356: 城市公用 | G356: 三废处理 | H356: 237.22 | I356: 1.6200000000000003e-002 | J356: -1.5300000000000001e-002 | K356: 7.09 | L356: 1.4000000000000002e-003 | M356: 110.3 | N356: 6.11 | O356: 1.04 | P356: 116.04 | Q356: 转股中 | R356: 3.39年 | S356: 1.39年 | T356: 1.93 | U356: 1179. | V356: 2.46 | W356: 4.7e-002 | X356: 5.4000000000000006e-002 | Y356: 41 | Z356: 1.61 | AA356: -0.20499999999999999 | AB356: -0.20899999999999999 | AC356: -0.34399999999999997 | AD356: -0.34499999999999997 | AE356: 97.55 | AF356: 98.53 | AG356: 0.7 | AH356: AA+ | AI356: 3.4599999999999999e-002 | AJ356: =H356+100*O356 -> 341.22000000000003 | AK356: 358.4 | AL356: 359 | AM356: 259.9 | AN356: 359 | AO356: 4.5999999999999999e-002 | AP356: 9 | AQ356: 联泰转债!
A357: 256 | B357: 113548 | C357: 石英转债! | D357: 603688 | E357: 石英股份 | F357: 电子 | G357: 电子产品 | H357: 319.26 | I357: -4.58e-002 | J357: -1.61e-002 | K357: 41.02 | L357: -6.3500000000000001e-002 | M357: 124.4 | N357: 14.93 | O357: 0.16200000000000001 | P357: 274.75 | Q357: 转股中 | R357: 4年54天 | S357: 2年55天 | T357: 1.23 | U357: 598 | V357: 1.51 | W357: 8.0000000000000002e-003 | X357: 2.3e-002 | Y357: 145 | Z357: 7.29 | AA357: -0.20699999999999999 | AB357: -0.214 | AC357: -0.251 | AD357: -0.252 | AE357: 91.2 | AF357: 98.09 | AG357: 0.98 | AH357: AA- | AI357: 6.0599999999999994e-002 | AJ357: =H357+100*O357 -> 335.45999999999998 | AK357: 363.8 | AL357: 362 | AM357: 265.7 | AN357: 361 | AO357: 0.115 | AP357: 14 | AQ357: 石英转债!
A358: 367 | B358: 127004 | C358: 模塑转债!! | D358: 700 | E358: 模塑科技 | F358: 汽车 | G358: 零部件制 | H358: 168.286 | I358: -1.9e-003 | J358: 1.1999999999999999e-003 | K358: 6 | L358: -3.3e-003 | M358: 111.8 | N358: 7.24 | O358: 1.03 | P358: 82.87 | Q358: 转股中 | R358: 1.75年 | S358: 回售内 | T358: 1.32 | U358: 35 | V358: 0.156 | W358: 2.4e-002 | X358: 2.e-002 | Y358: 55 | Z358: 2.03 | AA358: -0.20999999999999999 | AB358: -0.22 | AC358: 回售内 | AD358: 回售内 | AE358: 100.3 | AF358: 99.52 | AG358: 0.2 | AH358: AA- | AI358: 5.9299999999999999e-002 | AJ358: =H358+100*O358 -> 271.286 | AK358: 253.7 | AL358: 348 | AM358: 153.4 | AN358: 346 | AO358: -2.e-002 | AP358: 29 | AQ358: 模塑转债!!
A359: 192 | B359: 113582 | C359: 火炬转债! | D359: 603678 | E359: 火炬电子 | F359: 电子 | G359: 元器件制 | H359: 346.29 | I359: -6.1699999999999998e-002 | J359: 2.2099999999999998e-002 | K359: 71.21 | L359: -4.0300000000000002e-002 | M359: 114.9 | N359: 24.99 | O359: 0.215 | P359: 284.95 | Q359: 转股中 | R359: 4.73年 | S359: 2.73年 | T359: 4.18 | U359: 435 | V359: 0.29799999999999999 | W359: 1.3000000000000001e-002 | X359: 3.6000000000000004e-002 | Y359: 327 | Z359: 7.8 | AA359: -0.21100000000000002 | AB359: -0.215 | AC359: -0.19399999999999998 | AD359: -0.19500000000000001 | AE359: 92.49 | AF359: 95.97 | AG359: 0.98 | AH359: AA | AI359: 3.9599999999999996e-002 | AJ359: =H359+100*O359 -> 367.79000000000002 | AK359: 407.6 | AL359: 367 | AM359: 311.7 | AN359: 367 | AO359: -0.114 | AP359: 6 | AQ359: 火炬转债!
A360: 335 | B360: 110044 | C360: 广电转债!! | D360: 600831 | E360: 广电网络 | F360: 传媒娱乐 | G360: 影视娱乐 | H360: 223.87 | I360: 5.9999999999999995e-004 | J360: 7.0999999999999995e-003 | K360: 5.81 | L360: 2.6499999999999999e-002 | M360: 111.3 | N360: 6.87 | O360: 1.6499999999999999 | P360: 84.57 | Q360: 转股中 | R360: 2.81年 | S360: 0.81年 | T360: 0.71 | U360: 78 | V360: 0.48700000000000004 | W360: 1.7000000000000001e-002 | X360: 1.4999999999999999e-002 | Y360: 41 | Z360: 1.1 | AA360: -0.222 | AB360: -0.22800000000000001 | AC360: -0.55799999999999994 | AD360: -0.55899999999999994 | AE360: 98.13 | AF360: 100.3 | AG360: 0.29 | AH360: AA | AI360: 3.8300000000000001e-002 | AJ360: =H360+100*O360 -> 388.87 | AK360: 363.2 | AL360: 361 | AM360: 262.9 | AN360: 360 | AO360: 6.2e-002 | AP360: 10 | AQ360: 广电转债!!
A361: 363 | B361: 128017 | C361: 金禾转债!! | D361: 2597 | E361: 金禾实业 | F361: 化工 | G361: 化工 | H361: 186 | I361: -3.3799999999999997e-002 | J361: -2.3900000000000001e-002 | K361: 34.78 | L361: -6.0499999999999998e-002 | M361: 108.8 | N361: 21.97 | O361: 0.17499999999999999 | P361: 158.31 | Q361: 转股中 | R361: 2年59天 | S361: 59天 | T361: 5.52 | U361: 114 | V361: 0.11 | W361: 2.7999999999999997e-002 | X361: 4.4999999999999998e-002 | Y361: 195 | Z361: 3.91 | AA361: -0.223 | AB361: -0.22800000000000001 | AC361: -1.4830000000000001 | AD361: -1.4869999999999999 | AE361: 100.31 | AF361: 100.46 | AG361: 0.95 | AH361: AA | AI361: 3.8300000000000001e-002 | AJ361: =H361+100*O361 -> 203.5 | AK361: 213.7 | AL361: 334 | AM361: 113.2 | AN361: 330 | AO361: 2.7000000000000003e-002 | AP361: 9 | AQ361: 金禾转债!!
A362: 182 | B362: 128111 | C362: 中矿转债! | D362: 2738 | E362: 中矿资源 | F362: 有色金属 | G362: 有色行业 | H362: 406.88 | I362: -5.5999999999999994e-002 | J362: -1.04e-002 | K362: 56.21 | L362: -6.7500000000000004e-002 | M362: 124.2 | N362: 15.42 | O362: 0.11599999999999999 | P362: 364.53 | Q362: 转股中 | R362: 4.77年 | S362: 2.77年 | T362: 1.52 | U362: 469 | V362: 0.73799999999999999 | W362: 8.0000000000000002e-003 | X362: 3.1e-002 | Y362: 181 | Z362: 5.16 | AA362: -0.223 | AB362: -0.22899999999999998 | AC362: -0.20199999999999999 | AD362: -0.20300000000000001 | AE362: 87.76 | AF362: 94.41 | AG362: 0.98 | AH362: AA- | AI362: 6.0599999999999994e-002 | AJ362: =H362+100*O362 -> 418.48000000000002 | AK362: 449.2 | AL362: 368 | AM362: 354.8 | AN362: 368 | AO362: -2.4e-002 | AP362: 10 | AQ362: 中矿转债!
A363: 278 | B363: 123027 | C363: 蓝晓转债! | D363: 300487 | E363: 蓝晓科技 | F363: 化工 | G363: 化工 | H363: 338.944 | I363: -4.4500000000000005e-002 | J363: -1.3899999999999999e-002 | K363: 85.19 | L363: -5.9500000000000004e-002 | M363: 118.8 | N363: 29.02 | O363: 0.155 | P363: 293.56 | Q363: 转股中 | R363: 3.77年 | S363: 1.77年 | T363: 1.07 | U363: 270 | V363: 0.73299999999999998 | W363: 6.0000000000000001e-003 | X363: 1.7000000000000001e-002 | Y363: 187 | Z363: 10.02 | AA363: -0.247 | AB363: -0.252 | AC363: -0.32400000000000001 | AD363: -0.32500000000000001 | AE363: 90.83 | AF363: 92.13 | AG363: 0.98 | AH363: A+ | AI363: 7.1599999999999997e-002 | AJ363: =H363+100*O363 -> 354.44400000000002 | AK363: 384.3 | AL363: 364 | AM363: 292.2 | AN363: 364 | AO363: -6.9000000000000006e-002 | AP363: 19 | AQ363: 蓝晓转债!
A364: 214 | B364: 123046 | C364: 天铁转债! | D364: 300587 | E364: 天铁股份 | F364: 铁路 | G364: 铁路设备 | H364: 424.5 | I364: 5.4699999999999999e-002 | J364: -5.9800000000000006e-002 | K364: 20.97 | L364: -5.1999999999999998e-003 | M364: 117.7 | N364: 5.9 | O364: 0.19399999999999998 | P364: 355.42 | Q364: 转股中 | R364: 4.54年 | S364: 2.54年 | T364: 0.62 | U364: 317 | V364: 1.24 | W364: 5.0000000000000001e-003 | X364: 1.8000000000000002e-002 | Y364: 121 | Z364: 4.27 | AA364: -0.249 | AB364: -0.254 | AC364: -0.23000000000000001 | AD364: -0.23000000000000001 | AE364: 88.51 | AF364: 90.66 | AG364: 0.98 | AH364: AA- | AI364: 6.0599999999999994e-002 | AJ364: =H364+100*O364 -> 443.89999999999998 | AK364: 493.6 | AL364: 371 | AM364: 402.9 | AN364: 371 | AO364: 0.114 | AP364: 14 | AQ364: 天铁转债!
A365: 287 | B365: 113534 | C365: 鼎胜转债!! | D365: 603876 | E365: 鼎胜新材 | F365: 有色金属 | G365: 小金属 | H365: 336.94 | I365: 0.13400000000000001 | J365: -7.2000000000000008e-002 | K365: 42.51 | L365: 6.2800000000000009e-002 | M365: 114.3 | N365: 15.18 | O365: 0.20300000000000001 | P365: 280.04 | Q365: 转股中 | R365: 3.59年 | S365: 1.60年 | T365: 4.39 | U365: 2641. | V365: 1.8 | W365: 2.1000000000000001e-002 | X365: 5.9999999999999998e-002 | Y365: 206 | Z365: 4.6 | AA365: -0.26300000000000001 | AB365: -0.26700000000000002 | AC365: -0.36399999999999999 | AD365: -0.36399999999999999 | AE365: 92.74 | AF365: 92.89 | AG365: 0.98 | AH365: AA- | AI365: 6.0599999999999994e-002 | AJ365: =H365+100*O365 -> 357.24000000000001 | AK365: 393.8 | AL365: 366 | AM365: 300.9 | AN365: 366 | AO365: 0.11199999999999999 | AP365: 33 | AQ365: 鼎胜转债!!
A366: 230 | B366: 128095 | C366: 恩捷转债!! | D366: 2812 | E366: 恩捷股份 | F366: 电子 | G366: 元器件制 | H366: 448.43 | I366: -3.4500000000000003e-002 | J366: -1.4199999999999999e-002 | K366: 256.49 | L366: -4.9299999999999997e-002 | M366: 114.9 | N366: 64.92 | O366: 0.13500000000000001 | P366: 395.09 | Q366: 转股中 | R366: 4.44年 | S366: 2.44年 | T366: 4.54 | U366: 348 | V366: 0.17100000000000001 | W366: 2.e-003 | X366: 8.0000000000000002e-003 | Y366: 2289. | Z366: 18.97 | AA366: -0.26700000000000002 | AB366: -0.27100000000000002 | AC366: -0.24600000000000002 | AD366: -0.247 | AE366: 93.54 | AF366: 97.05 | AG366: 0.99 | AH366: AA | AI366: 3.9599999999999996e-002 | AJ366: =H366+100*O366 -> 461.93000000000001 | AK366: 501.8 | AL366: 372 | AM366: 404.7 | AN366: 372 | AO366: -4.0000000000000001e-002 | AP366: 15 | AQ366: 恩捷转债!!
A367: 286 | B367: 113025 | C367: 明泰转债!! | D367: 601677 | E367: 明泰铝业 | F367: 有色金属 | G367: 铝金属 | H367: 357.85 | I367: 7.8000000000000005e-003 | J367: -9.7999999999999997e-003 | K367: 35.45 | L367: -2.e-003 | M367: 114.5 | N367: 11 | O367: 0.11 | P367: 322.27 | Q367: 转股中 | R367: 3.60年 | S367: 1.60年 | T367: 11 | U367: 275 | V367: 7.0000000000000007e-002 | W367: 4.4999999999999998e-002 | X367: 0.14599999999999999 | Y367: 242 | Z367: 2.57 | AA367: -0.27500000000000002 | AB367: -0.27899999999999997 | AC367: -0.37200000000000005 | AD367: -0.373 | AE367: 96.07 | AF367: 99.84 | AG367: 0.99 | AH367: AA | AI367: 3.9599999999999996e-002 | AJ367: =H367+100*O367 -> 368.85000000000002 | AK367: 393.4 | AL367: 365 | AM367: 293.6 | AN367: 365 | AO367: 6.0000000000000001e-003 | AP367: 23 | AQ367: 明泰转债!!
A368: 331 | B368: 128041 | C368: 盛路转债!! | D368: 2446 | E368: 盛路通信 | F368: 通信互联 | G368: 通信设备 | H368: 290.5 | I368: -5.0000000000000001e-003 | J368: 9.8999999999999991e-003 | K368: 6.02 | L368: 1.3500000000000002e-002 | M368: 113.3 | N368: 6.82 | O368: 2.29 | P368: 88.27 | Q368: 转股中 | R368: 2.87年 | S368: 0.87年 | T368: 0.53 | U368: 189 | V368: 1.22 | W368: 1.e-002 | X368: 9.0000000000000011e-003 | Y368: 55 | Z368: 1.8 | AA368: -0.28300000000000003 | AB368: -0.28800000000000003 | AC368: -0.626 | AD368: -0.627 | AE368: 97.92 | AF368: 101.89 | AG368: 0.37 | AH368: AA | AI368: 3.8300000000000001e-002 | AJ368: =H368+100*O368 -> 519.5 | AK368: 492.7 | AL368: 370 | AM368: 390.8 | AN368: 370 | AO368: -6.4000000000000001e-002 | AP368: 12 | AQ368: 盛路转债!!
A369: 350 | B369: 128030 | C369: 天康转债!! | D369: 2100 | E369: 天康生物 | F369: 农业 | G369: 畜牧业 | H369: 237.777 | I369: 1.1999999999999999e-003 | J369: -1.1999999999999999e-003 | K369: 7.57 | L369: 1.61e-002 | M369: 111.3 | N369: 7.39 | O369: 1.3200000000000001 | P369: 102.44 | Q369: 转股中 | R369: 2.30年 | S369: 0.30年 | T369: 0.89 | U369: 13 | V369: 6.2e-002 | W369: 1.1000000000000001e-002 | X369: 1.1000000000000001e-002 | Y369: 81 | Z369: 1.35 | AA369: -0.28399999999999997 | AB369: -0.28999999999999998 | AC369: -1.2909999999999999 | AD369: -1.294 | AE369: 100.03 | AF369: 102.25 | AG369: 0 | AH369: AA | AI369: 3.8300000000000001e-002 | AJ369: =H369+100*O369 -> 369.77699999999999 | AK369: 373.1 | AL369: 363 | AM369: 270.9 | AN369: 363 | AO369: 6.0000000000000001e-003 | AP369: 11 | AQ369: 天康转债!!
A370: 351 | B370: 128029 | C370: 太阳转债!! | D370: 2078 | E370: 太阳纸业 | F370: 造纸包装 | G370: 造纸行业 | H370: 172 | I370: -2.1299999999999999e-002 | J370: 2.52e-002 | K370: 13 | L370: 3.9000000000000003e-003 | M370: 107 | N370: 8.45 | O370: 0.11800000000000001 | P370: 153.85 | Q370: 转股中 | R370: 1.30年 | S370: 回售内 | T370: 9.09 | U370: 196 | V370: 0.125 | W370: 2.6000000000000002e-002 | X370: 4.0000000000000001e-002 | Y370: 349 | Z370: 1.89 | AA370: -0.307 | AB370: -0.314 | AC370: 回售内 | AD370: 回售内 | AE370: 100.17 | AF370: 102.57 | AG370: 1 | AH370: AA+ | AI370: 3.3300000000000003e-002 | AJ370: =H370+100*O370 -> 183.80000000000001 | AK370: 190.2 | AL370: 317 | AM370: 87.6 | AN370: 301 | AO370: 8.0000000000000002e-002 | AP370: 7 | AQ370: 太阳转债!!
A371: 267 | B371: 123031 | C371: 晶瑞转债! | D371: 300655 | E371: 晶瑞电材 | F371: 电子 | G371: 电子行业 | H371: 515.3 | I371: 5.5899999999999998e-002 | J371: -2.5999999999999999e-003 | K371: 47.8 | L371: 5.3800000000000001e-002 | M371: 115.3 | N371: 10.13 | O371: 9.1999999999999998e-002 | P371: 471.87 | Q371: 转股中 | R371: 3.98年 | S371: 1.99年 | T371: 0.53 | U371: 2036. | V371: 7.3899999999999997 | W371: 3.0000000000000001e-003 | X371: 1.4999999999999999e-002 | Y371: 163 | Z371: 11.7 | AA371: -0.316 | AB371: -0.32000000000000001 | AC371: -0.32799999999999996 | AD371: -0.32899999999999996 | AE371: 88.67 | AF371: 87.96 | AG371: 0.99 | AH371: A+ | AI371: 7.1599999999999997e-002 | AJ371: =H371+100*O371 -> 524.5 | AK371: 558.7 | AL371: 373 | AM371: 470.1 | AN371: 373 | AO371: -5.5999999999999994e-002 | AP371: 16 | AQ371: 晶瑞转债!
A372: 328 | B372: 123013 | C372: 横河转债! | D372: 300539 | E372: 横河精密 | F372: 机械装备 | G372: 专用设备 | H372: 339.898 | I372: -4.4000000000000003e-003 | J372: 1.9400000000000001e-002 | K372: 9.03 | L372: 2.6099999999999998e-002 | M372: 114 | N372: 9.04 | O372: 2.3999999999999999 | P372: 99.89 | Q372: 转股中 | R372: 2.89年 | S372: 0.89年 | T372: 0.38 | U372: 93 | V372: 0.70599999999999996 | W372: 1.9e-002 | X372: 1.9e-002 | Y372: 20 | Z372: 4.14 | AA372: -0.318 | AB372: -0.32299999999999995 | AC372: -0.65599999999999992 | AD372: -0.65799999999999992 | AE372: 95.09 | AF372: 94 | AG372: 0.57 | AH372: A+ | AI372: 7.0300000000000001e-002 | AJ372: =H372+100*O372 -> 579.89800000000002 | AK372: 579.9 | AL372: 374 | AM372: 484.8 | AN372: 374 | AO372: 3.2000000000000001e-002 | AP372: 13 | AQ372: 横河转债!
A373: 362 | B373: 113016 | C373: 小康转债!! | D373: 601127 | E373: 小康股份 | F373: 汽车 | G373: 零部件制 | H373: 456 | I373: 2.3900000000000001e-002 | J373: -5.0000000000000001e-003 | K373: 77.43 | L373: 1.9099999999999999e-002 | M373: 109.3 | N373: 16.96 | O373: -1.e-003 | P373: 456.54 | Q373: 转股中 | R373: 2.18年 | S373: 0.18年 | T373: 2.34 | U373: 1518. | V373: 1.45 | W373: 2.e-003 | X373: 1.e-002 | Y373: 1052. | Z373: 13.6 | AA373: -0.45899999999999996 | AB373: -0.46200000000000002 | AC373: -2.4249999999999998 | AD373: -2.427 | AE373: 99.83 | AF373: 96.68 | AG373: 0.99 | AH373: AA- | AI373: 5.9299999999999999e-002 | AJ373: =H373+100*O373 -> 455.89999999999998 | AK373: 455.5 | AL373: 369 | AM373: 355.6 | AN373: 369 | AO373: 0.221 | AP373: 39 | AQ373: 小康转债!!
A374: 374 | B374: 110033 | C374: 国贸转债! | D374: 600755 | E374: 厦门国贸 | F374: 交通运输 | G374: 交通运输 | H374: 131.16 | I374: -1.26e-002 | J374: 8.1000000000000013e-003 | K374: 8.85 | L374: -4.5000000000000005e-003 | M374: 108 | N374: 6.72 | O374: -4.0000000000000001e-003 | P374: 131.7 | Q374: 转股中 | R374: 0.34年 | S374: 回售内 | T374: 11.3 | U374: 232 | V374: 0.155 | W374: 6.5000000000000002e-002 | X374: 8.5999999999999993e-002 | Y374: 173 | Z374: 1.02 | AA374: -0.55700000000000005 | AB374: -0.59499999999999997 | AC374: 回售内 | AD374: 回售内 | AE374: 100.33 | AF374: 107.03 | AG374: 0.99 | AH374: AAA | AI374: 2.7000000000000003e-002 | AJ374: =H374+100*O374 -> 130.75999999999999 | AK374: 130.6 | AL374: 17 | AM374: 23.6 | AN374: 2 | AO374: 0.13300000000000001 | AP374: 23 | AQ374: 国贸转债!
A375: 372 | B375: 113009 | C375: 广汽转债! | D375: 601238 | E375: 广汽集团 | F375: 汽车 | G375: 乘用车 | H375: 138.84 | I375: -2.0299999999999999e-002 | J375: -6.4000000000000003e-003 | K375: 19.25 | L375: -2.6800000000000001e-002 | M375: 106 | N375: 13.97 | O375: 8.0000000000000002e-003 | P375: 137.8 | Q375: 转股中 | R375: 0.39年 | S375: 回售内 | T375: 25.4 | U375: 455 | V375: 0.127 | W375: 1.3000000000000001e-002 | X375: 1.8000000000000002e-002 | Y375: 1993. | Z375: 2.28 | AA375: -0.65200000000000002 | AB375: -0.67599999999999993 | AC375: 回售内 | AD375: 回售内 | AE375: 100.27 | AF375: 104.92 | AG375: 1 | AH375: AAA | AI375: 2.7000000000000003e-002 | AJ375: =H375+100*O375 -> 139.64000000000001 | AK375: 139.9 | AL375: 91 | AM375: 35 | AN375: 28 | AO375: 0.20600000000000002 | AP375: 19 | AQ375: 广汽转债!
A377: 声明：本数据不构成任何投资建议，宁稳网不对数据的准确性及完整性做出保证，对使用者参考本数据造成的任何直接或间接损失概不负责。
A379: 来源：宁稳网，http://www.ninwin.cn，版权所有，本数据仅供【十七亩，8703】参考，请勿转发，2021-09-03 22:02:05