A1: 序号 | B1: 转债代码 | C1: 转债名称 | D1: 股票代码 | E1: 股票名称 | F1: 行业 | G1: 子行业 | H1: 转债价格 | I1: 涨跌 | J1: 日内套利 | K1: 股价 | L1: 涨跌 | M1: 剩余本息 | N1: 转股价格 | O1: 转股溢价率 | P1: 转股价值 | Q1: 距离转股日 | R1: 剩余年限 | S1: 回售年限 | T1: 转债余额 | U1: 转债成交额 | V1: 转债换手率 | W1: 余额/市值 | X1: 余额/股本 | Y1: 股票市值 | Z1: P/B | AA1: 税前收益率 | AB1: 税后收益率 | AC1: 税前回售收益 | AD1: 税后回售收益 | AE1: 回售价值 | AF1: 纯债价值 | AG1: 弹性 | AH1: 信用 | AI1: 折现率 | AJ1: 双低 | AK1: 老式双低 | AL1: 老式排名 | AM1: 新式双低 | AN1: 新式排名 | AO1: MA20乖离 | AP1: 热门度 | AQ1: 转债名称
A2: 256 | B2: 128062 | C2: 亚药转债! | D2: 2370 | E2: 亚太药业 | F2: 医药 | G2: 化学制药 | H2: 73.32 | I2: 5.3e-003 | J2: -5.3e-003 | K2: 3.9 | L2: -2.2599999999999999e-002 | M2: 119.8 | N2: 16.25 | O2: 2.0499999999999998 | P2: 24 | Q2: 转股中 | R2: 3.997年 | S2: 2年0.1天 | T2: 9.63 | U2: 18 | V2: 2.6000000000000002e-002 | W2: 0.46000000000000002 | X2: 0.11 | Y2: 21 | Z2: 4.59 | AA2: 0.13200000000000001 | AB2: 0.122 | AC2: 0.17000000000000001 | AD2: 0.16699999999999998 | AE2: 82.92 | AF2: 80.6 | AG2: 0 | AH2: BBB | AI2: 0.105 | AJ2: =H2+100*O2 -> 278.31999999999994 | AK2: 122.6 | AL2: 128 | AM2: 39.7 | AN2: 214 | AO2: 4.4000000000000004e-002 | AP2: 84 | AQ2: 亚药转债!
A3: 275 | B3: 113527 | C3: 维格转债! | D3: 603518 | E3: 锦泓集团 | F3: 服装纺织 | G3: 服装行业 | H3: 84.31 | I3: 4.3e-003 | J3: -5.0000000000000001e-004 | K3: 5.89 | L3: 3.5099999999999999e-002 | M3: 119.5 | N3: 9.85 | O3: 0.40999999999999998 | P3: 59.8 | Q3: 转股中 | R3: 3.81年 | S3: 1.81年 | T3: 7.46 | U3: 21 | V3: 3.3000000000000002e-002 | W3: 0.502 | X3: 0.29999999999999999 | Y3: 15 | Z3: 0.94 | AA3: 9.7699999999999995e-002 | AB3: 8.77e-002 | AC3: 0.106 | AD3: 0.10300000000000001 | AE3: 92.9 | AF3: 98.48 | AG3: 0.11 | AH3: AA | AI3: 5.2999999999999999e-002 | AJ3: =H3+100*O3 -> 125.31 | AK3: 108.8 | AL3: 20 | AM3: 10.3 | AN3: 5 | AO3: 9.9000000000000005e-002 | AP3: 100 | AQ3: 维格转债!
A4: 132 | B4: 127018 | C4: 本钢转债! | D4: 761 | E4: 本钢板材 | F4: 钢铁 | G4: 炼钢 | H4: 84.14 | I4: -1.01e-002 | J4: -1.e-004 | K4: 3.35 | L4: -4.8300000000000003e-002 | M4: 128.6 | N4: 5.03 | O4: 0.26300000000000001 | P4: 66.6 | Q4: 转股中 | R4: 5.24年 | S4: 3.24年 | T4: 68 | U4: 126 | V4: 2.2000000000000002e-002 | W4: 0.52400000000000002 | X4: 0.34899999999999998 | Y4: 130 | Z4: 0.66 | AA4: 8.7400000000000005e-002 | AB4: 7.7199999999999991e-002 | AC4: 7.2700000000000001e-002 | AD4: 6.8600000000000008e-002 | AE4: 90.41 | AF4: 100.45 | AG4: 0.21 | AH4: AAA | AI4: 4.99e-002 | AJ4: =H4+100*O4 -> 110.44 | AK4: 101.7 | AL4: 4 | AM4: 1.2 | AN4: 1 | AO4: 3.7999999999999999e-002 | AP4: 55 | AQ4: 本钢转债!
A5: 174 | B5: 128100 | C5: 搜特转债! | D5: 2503 | E5: 搜于特 | F5: 服装纺织 | G5: 服装行业 | H5: 85.2 | I5: 7.0999999999999995e-003 | J5: 1.9e-003 | K5: 2.1 | L5: 3.4500000000000003e-002 | M5: 116.9 | N5: 2.9 | O5: 0.17699999999999999 | P5: 72.41 | Q5: 转股中 | R5: 4.94年 | S5: 2.94年 | T5: 8 | U5: 255 | V5: 0.37 | W5: 0.12300000000000001 | X5: 8.900000000000001e-002 | Y5: 65 | Z5: 1.18 | AA5: 6.7400000000000002e-002 | AB5: 6.08e-002 | AC5: 6.480000000000001e-002 | AD5: 6.2400000000000004e-002 | AE5: 90.81 | AF5: 95.31 | AG5: 0.26 | AH5: AA | AI5: 4.2999999999999997e-002 | AJ5: =H5+100*O5 -> 102.90000000000001 | AK5: 98 | AL5: 2 | AM5: 2.7 | AN5: 2 | AO5: 0.121 | AP5: 56 | AQ5: 搜特转债!
A6: 240 | B6: 123028 | C6: 清水转债! | D6: 300437 | E6: 清水源 | F6: 城市公用 | G6: 三废处理 | H6: 93.423 | I6: 2.3999999999999998e-003 | J6: -4.6999999999999993e-003 | K6: 7.75 | L6: -1.0200000000000001e-002 | M6: 121.8 | N6: 11.84 | O6: 0.42700000000000005 | P6: 65.46 | Q6: 转股中 | R6: 4.21年 | S6: 2.21年 | T6: 4.56 | U6: 2 | V6: 5.0000000000000001e-003 | W6: 0.26600000000000001 | X6: 0.17399999999999999 | Y6: 17 | Z6: 1.1 | AA6: 6.7000000000000004e-002 | AB6: 5.7200000000000001e-002 | AC6: 4.99e-002 | AD6: 4.5700000000000005e-002 | AE6: 90.56 | AF6: 94.52 | AG6: 0.22 | AH6: AA- | AI6: 6.4000000000000001e-002 | AJ6: =H6+100*O6 -> 136.12299999999999 | AK6: 121.4 | AL6: 117 | AM6: 26.9 | AN6: 87 | AO6: -6.2e-002 | AP6: 52 | AQ6: 清水转债!
A7: 288 | B7: 128044 | C7: 岭南转债! | D7: 2717 | E7: 岭南股份 | F7: 城市公用 | G7: 生态环境 | H7: 90.341 | I7: 3.8e-003 | J7: -2.0999999999999999e-003 | K7: 3.27 | L7: 3.8100000000000002e-002 | M7: 111.3 | N7: 5.91 | O7: 0.63300000000000001 | P7: 55.33 | Q7: 转股中 | R7: 3.36年 | S7: 1.37年 | T7: 6.59 | U7: 9.9 | V7: 1.7000000000000001e-002 | W7: 0.13200000000000001 | X7: 7.2999999999999995e-002 | Y7: 50 | Z7: 1.02 | AA7: 6.54e-002 | AB7: 5.8499999999999996e-002 | AC7: 8.8699999999999987e-002 | AD7: 8.4700000000000011e-002 | AE7: 96.43 | AF7: 96.89 | AG7: 0.04 | AH7: AA | AI7: 4.2999999999999997e-002 | AJ7: =H7+100*O7 -> 153.64099999999999 | AK7: 125.4 | AL7: 161 | AM7: 28.5 | AN7: 110 | AO7: 3.6000000000000004e-002 | AP7: 41 | AQ7: 岭南转债!
A8: 115 | B8: 113595 | C8: 花王转债! | D8: 603007 | E8: 花王股份 | F8: 城市公用 | G8: 生态环境 | H8: 90.79 | I8: -1.e-004 | J8: -2.7000000000000001e-003 | K8: 4.93 | L8: -8.0000000000000002e-003 | M8: 125.3 | N8: 6.93 | O8: 0.27600000000000002 | P8: 71.14 | Q8: 转股中 | R8: 5.30年 | S8: 3.30年 | T8: 3.3 | U8: 17 | V8: 5.5999999999999994e-002 | W8: 0.19899999999999998 | X8: 0.14199999999999999 | Y8: 17 | Z8: 1.49 | AA8: 6.4199999999999993e-002 | AB8: 5.5500000000000001e-002 | AC8: 4.1100000000000005e-002 | AD8: 3.8599999999999995e-002 | AE8: 83.78 | AF8: 90.05 | AG8: 0.35 | AH8: AA- | AI8: 6.59e-002 | AJ8: =H8+100*O8 -> 118.39000000000001 | AK8: 110.4 | AL8: 25 | AM8: 20.4 | AN8: 33 | AO8: -5.0000000000000003e-002 | AP8: 39 | AQ8: 花王转债!
A9: 254 | B9: 128063 | C9: 未来转债! | D9: 2631 | E9: 德尔未来 | F9: 其他 | G9: 家居用品 | H9: 100.906 | I9: 5.8999999999999999e-003 | J9: -6.8000000000000005e-003 | K9: 5.74 | L9: -5.1999999999999998e-003 | M9: 128.2 | N9: 8.63 | O9: 0.51700000000000002 | P9: 66.51 | Q9: 转股中 | R9: 4年0.1天 | S9: 3年1.1天 | T9: 6.3 | U9: 2.4 | V9: 4.0000000000000001e-003 | W9: 0.16500000000000001 | X9: 0.11 | Y9: 38 | Z9: 2.18 | AA9: 6.3799999999999996e-002 | AB9: 5.1200000000000002e-002 | AC9: 2.4900000000000002e-002 | AD9: 1.9400000000000001e-002 | AE9: 89.92 | AF9: 100.84 | AG9: 0.17 | AH9: AA- | AI9: 6.4000000000000001e-002 | AJ9: =H9+100*O9 -> 152.60599999999999 | AK9: 135.3 | AL9: 239 | AM9: 34.5 | AN9: 171 | AO9: -4.8000000000000001e-002 | AP9: 32 | AQ9: 未来转债!
A10: 206 | B10: 128085 | C10: 鸿达转债! | D10: 2002 | E10: 鸿达兴业 | F10: 化工 | G10: 化工 | H10: 93.843 | I10: 5.1999999999999998e-003 | J10: -1.5700000000000002e-002 | K10: 3.5 | L10: -1.41e-002 | M10: 124.4 | N10: 3.92 | O10: 5.0999999999999997e-002 | P10: 89.29 | Q10: 转股中 | R10: 4.70年 | S10: 2.71年 | T10: 13.3 | U10: 45 | V10: 3.6000000000000004e-002 | W10: 0.13200000000000001 | X10: 0.11800000000000001 | Y10: 100 | Z10: 1.32 | AA10: 6.3099999999999989e-002 | AB10: 5.3699999999999998e-002 | AC10: 3.6400000000000002e-002 | AD10: 3.3599999999999998e-002 | AE10: 74.32 | AF10: 72.4 | AG10: 0.74 | AH10: BB | AI10: 0.125 | AJ10: =H10+100*O10 -> 98.942999999999998 | AK10: 98.4 | AL10: 3 | AM10: 24.1 | AN10: 68 | AO10: -4.8000000000000001e-002 | AP10: 98 | AQ10: 鸿达转债!
A11: 97 | B11: 110072 | C11: 广汇转债! | D11: 600297 | E11: 广汇汽车 | F11: 汽车 | G11: 分销、售 | H11: 83 | I11: -2.0099999999999996e-002 | J11: 2.3700000000000002e-002 | K11: 2.76 | L11: 1.47e-002 | M11: 114.5 | N11: 4.03 | O11: 0.21199999999999999 | P11: 68.49 | Q11: 转股中 | R11: 5.38年 | S11: 3.38年 | T11: 33.7 | U11: 315 | V11: 0.111 | W11: 0.151 | X11: 0.10300000000000001 | Y11: 224 | Z11: 0.57 | AA11: 6.2699999999999992e-002 | AB11: 5.74e-002 | AC11: 6.3200000000000006e-002 | AD11: 6.1399999999999996e-002 | AE11: 88.84 | AF11: 91.67 | AG11: 0.25 | AH11: AA+ | AI11: 4.2900000000000001e-002 | AJ11: =H11+100*O11 -> 104.2 | AK11: 97.5 | AL11: 1 | AM11: 5.8 | AN11: 4 | AO11: 4.2000000000000003e-002 | AP11: 46 | AQ11: 广汇转债!
A12: 341 | B12: 127003 | C12: 海印转债! | D12: 861 | E12: 海印股份 | F12: 商业零售 | G12: 商场 | H12: 104.155 | I12: 1.5e-003 | J12: -1.5e-003 | K12: 2.16 | L12: 0. | M12: 111.8 | N12: 3 | O12: 0.44700000000000001 | P12: 72 | Q12: 转股中 | R12: 1.18年 | S12: 回售内 | T12: 6.74 | U12: 4.3 | V12: 6.0000000000000001e-003 | W12: 0.13400000000000001 | X12: 9.6999999999999989e-002 | Y12: 50 | Z12: 1.27 | AA12: 6.2600000000000003e-002 | AB12: 4.3200000000000002e-002 | AC12: 回售内 | AD12: 回售内 | AE12: 100.3 | AF12: 106.59 | AG12: 0.02 | AH12: AA | AI12: 4.1700000000000001e-002 | AJ12: =H12+100*O12 -> 148.85500000000002 | AK12: 136.3 | AL12: 245 | AM12: 29.7 | AN12: 127 | AO12: -1.3999999999999999e-002 | AP12: 75 | AQ12: 海印转债!
A13: 133 | B13: 113589 | C13: 天创转债! | D13: 603608 | E13: 天创时尚 | F13: 服装纺织 | G13: 鞋服行业 | H13: 85.15 | I13: 2.8000000000000004e-003 | J13: -1.7000000000000001e-003 | K13: 6.21 | L13: 1.6399999999999998e-002 | M13: 115.3 | N13: 12.44 | O13: 0.70599999999999996 | P13: 49.92 | Q13: 转股中 | R13: 5.22年 | S13: 3.23年 | T13: 6 | U13: 11 | V13: 2.2000000000000002e-002 | W13: 0.22500000000000001 | X13: 0.11199999999999999 | Y13: 27 | Z13: 1.25 | AA13: 6.1100000000000002e-002 | AB13: 5.5300000000000002e-002 | AC13: 6.08e-002 | AD13: 5.8299999999999998e-002 | AE13: 89.58 | AF13: 92.1 | AG13: 0.07 | AH13: AA | AI13: 4.4900000000000002e-002 | AJ13: =H13+100*O13 -> 155.75 | AK13: 120.4 | AL13: 108 | AM13: 28.3 | AN13: 109 | AO13: 3.7999999999999999e-002 | AP13: 24 | AQ13: 天创转债!
A14: 122 | B14: 127019 | C14: 国城转债! | D14: 688 | E14: 国城矿业 | F14: 有色金属 | G14: 锌铅镍锡 | H14: 85.1 | I14: 7.4000000000000003e-003 | J14: -6.9999999999999993e-003 | K14: 8.95 | L14: 1.3600000000000001e-002 | M14: 115.1 | N14: 21.07 | O14: 1. | P14: 42.48 | Q14: 转股中 | R14: 5.28年 | S14: 3.29年 | T14: 8.5 | U14: 13 | V14: 1.8000000000000002e-002 | W14: 8.4000000000000005e-002 | X14: 3.5000000000000003e-002 | Y14: 102 | Z14: 4.6 | AA14: 5.9999999999999998e-002 | AB14: 5.4400000000000004e-002 | AC14: 5.9200000000000003e-002 | AD14: 5.7000000000000002e-002 | AE14: 89.16 | AF14: 91.68 | AG14: 0.03 | AH14: AA | AI14: 4.4900000000000002e-002 | AJ14: =H14+100*O14 -> 185.09999999999999 | AK14: 127.7 | AL14: 187 | AM14: 36 | AN14: 185 | AO14: -8.0000000000000002e-002 | AP14: 39 | AQ14: 国城转债!
A15: 295 | B15: 123011 | C15: 德尔转债! | D15: 300473 | E15: 德尔股份 | F15: 汽车 | G15: 零部件制 | H15: 97.2 | I15: -3.0000000000000001e-003 | J15: 3.8e-003 | K15: 17.45 | L15: 1.6299999999999999e-002 | M15: 116.3 | N15: 34.54 | O15: 0.92400000000000004 | P15: 50.52 | Q15: 转股中 | R15: 3.29年 | S15: 1.29年 | T15: 2.51 | U15: 1.1 | V15: 5.0000000000000001e-003 | W15: 0.126 | X15: 6.4000000000000001e-002 | Y15: 20 | Z15: 0.89 | AA15: 5.7300000000000004e-002 | AB15: 4.7800000000000002e-002 | AC15: 3.95e-002 | AD15: 3.5499999999999997e-002 | AE15: 93.98 | AF15: 95.23 | AG15: 0.05 | AH15: AA- | AI15: 6.4000000000000001e-002 | AJ15: =H15+100*O15 -> 189.60000000000002 | AK15: 143.9 | AL15: 284 | AM15: 48.6 | AN15: 269 | AO15: -4.2999999999999997e-002 | AP15: 41 | AQ15: 德尔转债!
A16: 286 | B16: 113519 | C16: 长久转债! | D16: 603569 | E16: 长久物流 | F16: 交通运输 | G16: 物流业 | H16: 98.19 | I16: -2.8999999999999998e-003 | J16: 3.4999999999999996e-003 | K16: 7.33 | L16: 5.5000000000000005e-003 | M16: 119.3 | N16: 11.15 | O16: 0.49399999999999999 | P16: 65.74 | Q16: 转股中 | R16: 3.60年 | S16: 1.60年 | T16: 6.97 | U16: 1.5 | V16: 2.e-003 | W16: 0.17000000000000001 | X16: 0.11199999999999999 | Y16: 41 | Z16: 1.93 | AA16: 5.67e-002 | AB16: 4.6699999999999998e-002 | AC16: 2.6499999999999999e-002 | AD16: 2.3300000000000001e-002 | AE16: 95.49 | AF16: 102.82 | AG16: 0.11 | AH16: AA | AI16: 4.2999999999999997e-002 | AJ16: =H16+100*O16 -> 147.59 | AK16: 130.6 | AL16: 206 | AM16: 27.8 | AN16: 101 | AO16: 1.2e-002 | AP16: 20 | AQ16: 长久转债!
A17: 324 | B17: 128023 | C17: 亚太转债! | D17: 2284 | E17: 亚太股份 | F17: 汽车 | G17: 零部件制 | H17: 96.35 | I17: -5.0000000000000001e-004 | J17: 5.0000000000000001e-004 | K17: 5.12 | L17: 0. | M17: 111.3 | N17: 10.34 | O17: 0.94599999999999995 | P17: 49.52 | Q17: 转股中 | R17: 2.67年 | S17: 0.67年 | T17: 9.99 | U17: 2 | V17: 2.e-003 | W17: 0.26500000000000001 | X17: 0.13100000000000001 | Y17: 38 | Z17: 1.56 | AA17: 5.6399999999999999e-002 | AB17: 4.8000000000000001e-002 | AC17: 6.7799999999999999e-002 | AD17: 6.3299999999999995e-002 | AE17: 98.37 | AF17: 99.96 | AG17: 0.01 | AH17: AA | AI17: 4.1700000000000001e-002 | AJ17: =H17+100*O17 -> 190.94999999999999 | AK17: 143.2 | AL17: 280 | AM17: 43.2 | AN17: 239 | AO17: -1.1000000000000001e-002 | AP17: 69 | AQ17: 亚太转债!
A18: 194 | B18: 128093 | C18: 百川转债! | D18: 2455 | E18: 百川股份 | F18: 化工 | G18: 化工 | H18: 100.965 | I18: 6.3e-003 | J18: 1.e-003 | K18: 5.29 | L18: 1.54e-002 | M18: 129.8 | N18: 5.87 | O18: 0.12 | P18: 90.12 | Q18: 转股中 | R18: 4.75年 | S18: 2.76年 | T18: 5.2 | U18: 15 | V18: 2.7999999999999997e-002 | W18: 0.19 | X18: 0.17100000000000001 | Y18: 27 | Z18: 2.12 | AA18: 5.6299999999999996e-002 | AB18: 4.5199999999999997e-002 | AC18: 2.e-002 | AD18: 1.54e-002 | AE18: 89.44 | AF18: 97.65 | AG18: 0.47 | AH18: AA- | AI18: 6.4000000000000001e-002 | AJ18: =H18+100*O18 -> 112.965 | AK18: 111.8 | AL18: 30 | AM18: 14.2 | AN18: 8 | AO18: -5.5999999999999994e-002 | AP18: 50 | AQ18: 百川转债!
A19: 245 | B19: 113535 | C19: 大业转债! | D19: 603278 | E19: 大业股份 | F19: 汽车 | G19: 零部件制 | H19: 95.78 | I19: -5.0599999999999999e-002 | J19: 4.6500000000000007e-002 | K19: 8.41 | L19: -3.1099999999999999e-002 | M19: 113.1 | N19: 12.4 | O19: 0.41200000000000003 | P19: 67.82 | Q19: 转股中 | R19: 3年36天 | S19: 1年37天 | T19: 5 | U19: 156 | V19: 0.32299999999999995 | W19: 0.20499999999999999 | X19: 0.13900000000000001 | Y19: 24 | Z19: 1.47 | AA19: 5.5999999999999994e-002 | AB19: 4.7699999999999992e-002 | AC19: 5.0000000000000003e-002 | AD19: 4.6900000000000004e-002 | AE19: 96.59 | AF19: 99.46 | AG19: 0.13 | AH19: AA | AI19: 4.2999999999999997e-002 | AJ19: =H19+100*O19 -> 136.98000000000002 | AK19: 123.7 | AL19: 145 | AM19: 24.3 | AN19: 70 | AO19: 4.4000000000000004e-002 | AP19: 49 | AQ19: 大业转债!
A20: 98 | B20: 113600 | C20: 新星转债! | D20: 603978 | E20: 深圳新星 | F20: 有色金属 | G20: 有色行业 | H20: 94.76 | I20: -8.9999999999999998e-004 | J20: -6.9999999999999993e-003 | K20: 18.08 | L20: -2.0099999999999996e-002 | M20: 126 | N20: 23.85 | O20: 0.25 | P20: 75.81 | Q20: 转股中 | R20: 5.36年 | S20: 3.36年 | T20: 5.95 | U20: 2.3 | V20: 4.0000000000000001e-003 | W20: 0.20600000000000002 | X20: 0.156 | Y20: 29 | Z20: 1.9 | AA20: 5.57e-002 | AB20: 4.7100000000000003e-002 | AC20: 2.6800000000000001e-002 | AD20: 2.4500000000000001e-002 | AE20: 83.16 | AF20: 90.11 | AG20: 0.4 | AH20: AA- | AI20: 6.59e-002 | AJ20: =H20+100*O20 -> 119.76000000000001 | AK20: 113.7 | AL20: 38 | AM20: 23.6 | AN20: 62 | AO20: -4.0000000000000001e-002 | AP20: 18 | AQ20: 新星转债!
A21: 179 | B21: 113569 | C21: 科达转债! | D21: 603660 | E21: 苏州科达 | F21: 通信互联 | G21: 物联网 | H21: 92.75 | I21: 1.1999999999999999e-003 | J21: 0. | K21: 7.99 | L21: 8.8000000000000005e-003 | M21: 120.3 | N21: 14.84 | O21: 0.72299999999999998 | P21: 53.84 | Q21: 转股中 | R21: 4.93年 | S21: 2.93年 | T21: 5.16 | U21: 1 | V21: 2.e-003 | W21: 0.129 | X21: 7.0000000000000007e-002 | Y21: 40 | Z21: 2.14 | AA21: 5.5300000000000002e-002 | AB21: 4.7599999999999996e-002 | AC21: 3.6799999999999999e-002 | AD21: 3.4300000000000004e-002 | AE21: 85.66 | AF21: 89.14 | AG21: 0.13 | AH21: AA- | AI21: 6.4000000000000001e-002 | AJ21: =H21+100*O21 -> 165.05000000000001 | AK21: 131.7 | AL21: 212 | AM21: 42.5 | AN21: 232 | AO21: 7.0000000000000007e-002 | AP21: 27 | AQ21: 科达转债!
A22: 306 | B22: 128037 | C22: 岩土转债! | D22: 2542 | E22: 中化岩土 | F22: 建筑 | G22: 建筑工程 | H22: 95.43 | I22: -8.8000000000000005e-003 | J22: 9.5999999999999992e-003 | K22: 3.6 | L22: 0.10099999999999999 | M22: 111.3 | N22: 7.99 | O22: 1.1200000000000001 | P22: 45.06 | Q22: 转股中 | R22: 2.95年 | S22: 0.95年 | T22: 5.99 | U22: 208 | V22: 0.35999999999999999 | W22: 9.1999999999999998e-002 | X22: 4.2000000000000003e-002 | Y22: 65 | Z22: 1.6 | AA22: 5.4400000000000004e-002 | AB22: 4.6799999999999994e-002 | AC22: 5.9699999999999996e-002 | AD22: 5.6299999999999996e-002 | AE22: 97.27 | AF22: 98.84 | AG22: 0.01 | AH22: AA | AI22: 4.1700000000000001e-002 | AJ22: =H22+100*O22 -> 207.43000000000001 | AK22: 145.8 | AL22: 291 | AM22: 47 | AN22: 256 | AO22: 0.26899999999999996 | AP22: 49 | AQ22: 岩土转债!
A23: 55 | B23: 128138 | C23: 侨银转债! | D23: 2973 | E23: 侨银股份 | F23: 城市公用 | G23: 城市公用 | H23: 102.88 | I23: -1.1000000000000001e-003 | J23: 4.6999999999999993e-003 | K23: 19.82 | L23: 9.7000000000000003e-003 | M23: 136.5 | N23: 25.43 | O23: 0.32000000000000001 | P23: 77.94 | Q23: 52天 | R23: 5.62年 | S23: 3.63年 | T23: 4.2 | U23: 1.9 | V23: 4.0000000000000001e-003 | W23: 5.2000000000000005e-002 | X23: 4.0000000000000001e-002 | Y23: 81 | Z23: 5.71 | AA23: 5.2600000000000001e-002 | AB23: 4.2000000000000003e-002 | AC23: 4.0000000000000001e-003 | AD23: 1.7000000000000001e-003 | AE23: 82.17 | AF23: 95.99 | AG23: 0.37 | AH23: AA- | AI23: 6.59e-002 | AJ23: =H23+100*O23 -> 134.88 | AK23: 127.8 | AL23: 188 | AM23: 31.8 | AN23: 145 | AO23: -6.8000000000000005e-002 | AP23: 8 | AQ23: 侨银转债!
A24: 259 | B24: 113530 | C24: 大丰转债! | D24: 603081 | E24: 大丰实业 | F24: 建筑 | G24: 装饰工程 | H24: 99.1 | I24: -1.e-003 | J24: -3.3e-003 | K24: 11.7 | L24: -2.9900000000000003e-002 | M24: 121 | N24: 16.64 | O24: 0.40899999999999997 | P24: 70.31 | Q24: 转股中 | R24: 3.98年 | S24: 1.98年 | T24: 6.3 | U24: 2.9 | V24: 5.0000000000000001e-003 | W24: 0.13400000000000001 | X24: 9.4e-002 | Y24: 47 | Z24: 2.29 | AA24: 5.2400000000000002e-002 | AB24: 4.2800000000000005e-002 | AC24: 1.78e-002 | AD24: 1.5100000000000001e-002 | AE24: 94.06 | AF24: 102.63 | AG24: 0.14 | AH24: AA | AI24: 4.2999999999999997e-002 | AJ24: =H24+100*O24 -> 140. | AK24: 127.9 | AL24: 189 | AM24: 25.3 | AN24: 73 | AO24: 2.5000000000000001e-002 | AP24: 34 | AQ24: 大丰转债!
A25: 248 | B25: 127013 | C25: 创维转债! | D25: 810 | E25: 创维数字 | F25: 电子 | G25: 电子产品 | H25: 96.46 | I25: -4.0000000000000002e-004 | J25: 1.e-004 | K25: 7.72 | L25: -2.5999999999999999e-003 | M25: 117.9 | N25: 11.39 | O25: 0.42299999999999999 | P25: 67.78 | Q25: 转股中 | R25: 4年12天 | S25: 2年13天 | T25: 9.78 | U25: 3.9 | V25: 4.0000000000000001e-003 | W25: 0.11900000000000001 | X25: 8.1000000000000003e-002 | Y25: 82 | Z25: 2.02 | AA25: 5.2199999999999996e-002 | AB25: 4.3799999999999999e-002 | AC25: 3.2500000000000001e-002 | AD25: 2.9300000000000003e-002 | AE25: 94.35 | AF25: 99.86 | AG25: 0.14 | AH25: AA | AI25: 4.2999999999999997e-002 | AJ25: =H25+100*O25 -> 138.75999999999999 | AK25: 125.1 | AL25: 157 | AM25: 25.3 | AN25: 74 | AO25: 6.0000000000000001e-003 | AP25: 24 | AQ25: 创维转债!
A26: 246 | B26: 128066 | C26: 亚泰转债! | D26: 2811 | E26: 郑中设计 | F26: 建筑 | G26: 装饰工程 | H26: 96.223 | I26: -1.7000000000000001e-003 | J26: -2.e-003 | K26: 8.1 | L26: -8.6e-003 | M26: 117.5 | N26: 9.67 | O26: 0.14899999999999999 | P26: 83.76 | Q26: 转股中 | R26: 4年14天 | S26: 2年15天 | T26: 4.8 | U26: 3.9 | V26: 8.0000000000000002e-003 | W26: 0.21899999999999997 | X26: 0.184 | Y26: 22 | Z26: 1.48 | AA26: 5.21e-002 | AB26: 4.3799999999999999e-002 | AC26: 3.56e-002 | AD26: 3.2000000000000001e-002 | AE26: 90.74 | AF26: 92.07 | AG26: 0.43 | AH26: AA- | AI26: 6.4000000000000001e-002 | AJ26: =H26+100*O26 -> 111.12299999999999 | AK26: 108.7 | AL26: 18 | AM26: 16.6 | AN26: 13 | AO26: -1.2e-002 | AP26: 62 | AQ26: 亚泰转债!
A27: 139 | B27: 123054 | C27: 思特转债! | D27: 300608 | E27: 思特奇 | F27: 通信互联 | G27: 通信设备 | H27: 94.29 | I27: -1.1999999999999999e-003 | J27: 7.1999999999999998e-003 | K27: 11.02 | L27: 1.9400000000000001e-002 | M27: 121.7 | N27: 16.49 | O27: 0.41100000000000003 | P27: 66.83 | Q27: 转股中 | R27: 5.19年 | S27: 3.19年 | T27: 2.71 | U27: 2.6 | V27: 1.e-002 | W27: 0.156 | X27: 0.10400000000000001 | Y27: 17 | Z27: 2.29 | AA27: 5.1799999999999999e-002 | AB27: 4.4000000000000004e-002 | AC27: 3.1899999999999998e-002 | AD27: 2.9100000000000001e-002 | AE27: 84.7 | AF27: 88.15 | AG27: 0.31 | AH27: AA- | AI27: 6.59e-002 | AJ27: =H27+100*O27 -> 135.39000000000001 | AK27: 121.8 | AL27: 121 | AM27: 33.6 | AN27: 163 | AO27: -2.1000000000000001e-002 | AP27: 20 | AQ27: 思特转债!
A28: 316 | B28: 113017 | C28: 吉视转债! | D28: 601929 | E28: 吉视传媒 | F28: 传媒娱乐 | G28: 影视娱乐 | H28: 94.99 | I28: 3.2000000000000002e-003 | J28: -2.8999999999999998e-003 | K28: 1.82 | L28: 5.5000000000000005e-003 | M28: 108.8 | N28: 2.95 | O28: 0.54000000000000004 | P28: 61.69 | Q28: 转股中 | R28: 2.74年 | S28: 0.74年 | T28: 15.6 | U28: 9.7 | V28: 6.9999999999999993e-003 | W28: 0.27500000000000002 | X28: 0.17000000000000001 | Y28: 57 | Z28: 0.86 | AA28: 5.16e-002 | AB28: 4.5100000000000001e-002 | AC28: 7.690000000000001e-002 | AD28: 7.3200000000000001e-002 | AE28: 98.05 | AF28: 97.95 | AG28: 0.05 | AH28: AA+ | AI28: 3.9699999999999999e-002 | AJ28: =H28+100*O28 -> 148.99000000000001 | AK28: 128.3 | AL28: 194 | AM28: 30.2 | AN28: 131 | AO28: -5.0000000000000001e-003 | AP28: 62 | AQ28: 吉视转债!
A29: 335 | B29: 128015 | C29: 久其转债! | D29: 2279 | E29: 久其软件 | F29: 计算机及 | G29: 软件开发 | H29: 99.49 | I29: 4.0999999999999995e-003 | J29: -4.0000000000000001e-003 | K29: 4.77 | L29: 2.3599999999999999e-002 | M29: 110.8 | N29: 9.48 | O29: 0.97699999999999998 | P29: 50.32 | Q29: 转股中 | R29: 2.18年 | S29: 0.18年 | T29: 7.8 | U29: 17 | V29: 2.2000000000000002e-002 | W29: 0.23000000000000001 | X29: 0.11599999999999999 | Y29: 34 | Z29: 4.81 | AA29: 5.1500000000000004e-002 | AB29: 4.1700000000000001e-002 | AC29: 6.0599999999999994e-002 | AD29: 5.1299999999999998e-002 | AE29: 99.07 | AF29: 95.13 | AG29: 0 | AH29: A+ | AI29: 7.3700000000000002e-002 | AJ29: =H29+100*O29 -> 197.19 | AK29: 148.7 | AL29: 294 | AM29: 49.6 | AN29: 272 | AO29: 1.e-003 | AP29: 68 | AQ29: 久其转债!
A30: 239 | B30: 128069 | C30: 华森转债! | D30: 2907 | E30: 华森制药 | F30: 医药 | G30: 化学制药 | H30: 97.53 | I30: 7.9000000000000008e-003 | J30: -4.5000000000000005e-003 | K30: 12.68 | L30: 1.2800000000000001e-002 | M30: 120 | N30: 18.04 | O30: 0.38799999999999996 | P30: 70.29 | Q30: 转股中 | R30: 4.22年 | S30: 2.23年 | T30: 3 | U30: 13 | V30: 4.4999999999999998e-002 | W30: 5.9000000000000004e-002 | X30: 4.0999999999999995e-002 | Y30: 51 | Z30: 4.74 | AA30: 5.1399999999999994e-002 | AB30: 4.2699999999999995e-002 | AC30: 2.5399999999999999e-002 | AD30: 2.2400000000000003e-002 | AE30: 89.38 | AF30: 92.87 | AG30: 0.26 | AH30: AA- | AI30: 6.4000000000000001e-002 | AJ30: =H30+100*O30 -> 136.32999999999998 | AK30: 124.8 | AL30: 152 | AM30: 31.9 | AN30: 147 | AO30: 8.3000000000000004e-002 | AP30: 45 | AQ30: 华森转债!
A31: 153 | B31: 113573 | C31: 纵横转债! | D31: 603602 | E31: 纵横通信 | F31: 通信互联 | G31: 通信设备 | H31: 97.89 | I31: -3.4999999999999996e-003 | J31: 5.1000000000000004e-003 | K31: 11.7 | L31: 6.0000000000000001e-003 | M31: 124.7 | N31: 18.81 | O31: 0.57399999999999995 | P31: 62.2 | Q31: 转股中 | R31: 5年14天 | S31: 3年15天 | T31: 2.7 | U31: 5.7 | V31: 2.2000000000000002e-002 | W31: 0.113 | X31: 7.0000000000000007e-002 | Y31: 24 | Z31: 3.54 | AA31: 5.0499999999999996e-002 | AB31: 4.1700000000000001e-002 | AC31: 2.1299999999999999e-002 | AD31: 1.83e-002 | AE31: 82.78 | AF31: 86.69 | AG31: 0.26 | AH31: A+ | AI31: 7.690000000000001e-002 | AJ31: =H31+100*O31 -> 155.28999999999999 | AK31: 133.6 | AL31: 230 | AM31: 46.9 | AN31: 255 | AO31: 3.1e-002 | AP31: 23 | AQ31: 纵横转债!
A32: 271 | B32: 113528 | C32: 长城转债! | D32: 603897 | E32: 长城科技 | F32: 机械装备 | G32: 专用设备 | H32: 96.78 | I32: -7.1999999999999998e-003 | J32: -6.8999999999999999e-003 | K32: 16.59 | L32: -5.1500000000000004e-002 | M32: 116.8 | N32: 23.45 | O32: 0.36799999999999999 | P32: 70.75 | Q32: 转股中 | R32: 3.91年 | S32: 1.91年 | T32: 6.34 | U32: 3.3 | V32: 5.0000000000000001e-003 | W32: 0.214 | X32: 0.152 | Y32: 30 | Z32: 1.62 | AA32: 5.0300000000000004e-002 | AB32: 4.2099999999999999e-002 | AC32: 3.1300000000000001e-002 | AD32: 2.8199999999999999e-002 | AE32: 90.75 | AF32: 92.09 | AG32: 0.27 | AH32: AA- | AI32: 6.4000000000000001e-002 | AJ32: =H32+100*O32 -> 133.57999999999998 | AK32: 122.8 | AL32: 132 | AM32: 30.7 | AN32: 135 | AO32: -2.8999999999999998e-002 | AP32: 42 | AQ32: 长城转债!
A33: 251 | B33: 113534 | C33: 鼎胜转债! | D33: 603876 | E33: 鼎胜新材 | F33: 有色金属 | G33: 小金属 | H33: 94.82 | I33: -1.8e-003 | J33: -5.0000000000000001e-004 | K33: 11.33 | L33: -9.5999999999999992e-003 | M33: 114.9 | N33: 15.18 | O33: 0.27000000000000002 | P33: 74.64 | Q33: 转股中 | R33: 4年6.1天 | S33: 2年7天 | T33: 12 | U33: 6 | V33: 5.0000000000000001e-003 | W33: 0.24399999999999999 | X33: 0.182 | Y33: 49 | Z33: 1.37 | AA33: 5.0199999999999995e-002 | AB33: 4.2999999999999997e-002 | AC33: 4.0899999999999999e-002 | AD33: 3.7699999999999997e-002 | AE33: 94.42 | AF33: 97.4 | AG33: 0.24 | AH33: AA | AI33: 4.2999999999999997e-002 | AJ33: =H33+100*O33 -> 121.81999999999999 | AK33: 115 | AL33: 53 | AM33: 17.6 | AN33: 19 | AO33: -4.7e-002 | AP33: 35 | AQ33: 鼎胜转债!
A34: 180 | B34: 113568 | C34: 新春转债! | D34: 603667 | E34: 五洲新春 | F34: 机械装备 | G34: 通用设备 | H34: 98.16 | I34: -4.8999999999999998e-003 | J34: -3.5999999999999999e-003 | K34: 7.59 | L34: -1.8100000000000002e-002 | M34: 124.3 | N34: 8.91 | O34: 0.152 | P34: 85.19 | Q34: 转股中 | R34: 4.92年 | S34: 2.93年 | T34: 3.3 | U34: 2.4 | V34: 6.9999999999999993e-003 | W34: 0.14899999999999999 | X34: 0.127 | Y34: 22 | Z34: 1.28 | AA34: 5.0199999999999995e-002 | AB34: 4.1399999999999999e-002 | AC34: 1.9799999999999998e-002 | AD34: 1.7000000000000001e-002 | AE34: 86.2 | AF34: 92.21 | AG34: 0.47 | AH34: AA- | AI34: 6.4000000000000001e-002 | AJ34: =H34+100*O34 -> 113.36 | AK34: 111.1 | AL34: 27 | AM34: 18.9 | AN34: 25 | AO34: 1.2e-002 | AP34: 49 | AQ34: 新春转债!
A35: 52 | B35: 123077 | C35: 汉得转债! | D35: 300170 | E35: 汉得信息 | F35: 计算机及 | G35: 软件开发 | H35: 95.72 | I35: -8.0000000000000004e-004 | J35: 3.0000000000000001e-003 | K35: 6.96 | L35: 8.6999999999999994e-003 | M35: 125.5 | N35: 9.72 | O35: 0.33700000000000002 | P35: 71.6 | Q35: 55天 | R35: 5.64年 | S35: 3.64年 | T35: 9.37 | U35: 3 | V35: 3.0000000000000001e-003 | W35: 0.152 | X35: 0.109 | Y35: 62 | Z35: 1.93 | AA35: 5.0099999999999999e-002 | AB35: 4.2099999999999999e-002 | AC35: 2.18e-002 | AD35: 1.9799999999999998e-002 | AE35: 87.98 | AF35: 98.4 | AG35: 0.25 | AH35: AA | AI35: 4.4900000000000002e-002 | AJ35: =H35+100*O35 -> 129.42000000000002 | AK35: 119.8 | AL35: 105 | AM35: 21.4 | AN35: 42 | AO35: -3.3000000000000002e-002 | AP35: 12 | AQ35: 汉得转债!
A36: 127 | B36: 128118 | C36: 瀛通转债! | D36: 2861 | E36: 瀛通通讯 | F36: 电子 | G36: 电子产品 | H36: 95.2 | I36: 4.0000000000000002e-004 | J36: 8.6999999999999994e-003 | K36: 17.95 | L36: 3.1e-002 | M36: 122.1 | N36: 27.53 | O36: 0.46000000000000002 | P36: 65.2 | Q36: 转股中 | R36: 5.25年 | S36: 3.25年 | T36: 3 | U36: 6.7 | V36: 2.3e-002 | W36: 0.13699999999999998 | X36: 8.900000000000001e-002 | Y36: 22 | Z36: 2.06 | AA36: 4.9800000000000004e-002 | AB36: 4.2099999999999999e-002 | AC36: 2.8300000000000002e-002 | AD36: 2.5600000000000001e-002 | AE36: 84.35 | AF36: 88.09 | AG36: 0.29 | AH36: AA- | AI36: 6.59e-002 | AJ36: =H36+100*O36 -> 141.19999999999999 | AK36: 125.2 | AL36: 158 | AM36: 37.1 | AN36: 192 | AO36: 4.4999999999999998e-002 | AP36: 13 | AQ36: 瀛通转债!
A37: 269 | B37: 110052 | C37: 贵广转债! | D37: 600996 | E37: 贵广网络 | F37: 传媒娱乐 | G37: 影视娱乐 | H37: 97.87 | I37: 2.e-003 | J37: -1.9e-003 | K37: 4.93 | L37: 2.e-003 | M37: 117.7 | N37: 7.94 | O37: 0.57600000000000007 | P37: 62.09 | Q37: 转股中 | R37: 3.92年 | S37: 1.92年 | T37: 15.3 | U37: 2.5 | V37: 2.e-003 | W37: 0.29499999999999998 | X37: 0.183 | Y37: 52 | Z37: 1.15 | AA37: 4.9100000000000005e-002 | AB37: 4.07e-002 | AC37: 2.5099999999999997e-002 | AD37: 2.2099999999999998e-002 | AE37: 94.79 | AF37: 100.83 | AG37: 0.08 | AH37: AA+ | AI37: 4.0999999999999995e-002 | AJ37: =H37+100*O37 -> 155.47000000000003 | AK37: 133.6 | AL37: 232 | AM37: 32.8 | AN37: 155 | AO37: -2.e-002 | AP37: 18 | AQ37: 贵广转债!
A38: 227 | B38: 128074 | C38: 游族转债!! | D38: 2174 | E38: 游族网络 | F38: 通信互联 | G38: 互联网 | H38: 97.196 | I38: 1.24e-002 | J38: -9.300000000000001e-003 | K38: 12.08 | L38: 1.34e-002 | M38: 119.9 | N38: 16.97 | O38: 0.36499999999999999 | P38: 71.18 | Q38: 转股中 | R38: 4.47年 | S38: 2.48年 | T38: 6.83 | U38: 9.8 | V38: 1.4999999999999999e-002 | W38: 6.2e-002 | X38: 4.4000000000000004e-002 | Y38: 111 | Z38: 1.95 | AA38: 4.9000000000000002e-002 | AB38: 4.0800000000000003e-002 | AC38: 2.3900000000000001e-002 | AD38: 2.1299999999999999e-002 | AE38: 92.62 | AF38: 96.82 | AG38: 0.23 | AH38: AA | AI38: 4.2999999999999997e-002 | AJ38: =H38+100*O38 -> 133.696 | AK38: 123.2 | AL38: 137 | AM38: 26.4 | AN38: 83 | AO38: 7.0000000000000007e-002 | AP38: 26 | AQ38: 游族转债!!
A39: 32 | B39: 123088 | C39: 威唐转债! | D39: 300707 | E39: 威唐工业 | F39: 汽车 | G39: 零部件制 | H39: 93.315 | I39: -2.8999999999999998e-003 | J39: -2.0000000000000001e-004 | K39: 15.05 | L39: -6.6e-003 | M39: 121.6 | N39: 20.75 | O39: 0.28699999999999998 | P39: 72.53 | Q39: 2月20天 | R39: 5.70年 | S39: 3.70年 | T39: 3.01 | U39: 4.2 | V39: 1.4999999999999999e-002 | W39: 0.127 | X39: 9.1999999999999998e-002 | Y39: 24 | Z39: 3.48 | AA39: 4.87e-002 | AB39: 4.1700000000000001e-002 | AC39: 3.0299999999999997e-002 | AD39: 2.7900000000000001e-002 | AE39: 78.8 | AF39: 80.5 | AG39: 0.48 | AH39: A+ | AI39: 7.690000000000001e-002 | AJ39: =H39+100*O39 -> 122.015 | AK39: 114.1 | AL39: 45 | AM39: 33.6 | AN39: 162 | AO39: 7.0000000000000007e-002 | AP39: 9 | AQ39: 威唐转债!
A40: 107 | B40: 113596 | C40: 城地转债! | D40: 603887 | E40: 城地香江 | F40: 通信互联 | G40: 通信设备 | H40: 88.99 | I40: 1.2500000000000001e-002 | J40: -6.7000000000000002e-003 | K40: 15.88 | L40: 3.7200000000000004e-002 | M40: 113.5 | N40: 29.21 | O40: 0.63700000000000001 | P40: 54.36 | Q40: 转股中 | R40: 5.32年 | S40: 3.32年 | T40: 12 | U40: 25 | V40: 2.4e-002 | W40: 0.20100000000000001 | X40: 0.109 | Y40: 60 | Z40: 1.6 | AA40: 4.7899999999999998e-002 | AB40: 4.2800000000000005e-002 | AC40: 4.5700000000000005e-002 | AD40: 4.3400000000000001e-002 | AE40: 83.32 | AF40: 81.44 | AG40: 0.16 | AH40: AA- | AI40: 6.59e-002 | AJ40: =H40+100*O40 -> 152.69 | AK40: 123.6 | AL40: 144 | AM40: 40.3 | AN40: 218 | AO40: 6.6000000000000003e-002 | AP40: 18 | AQ40: 城地转债!
A41: 262 | B41: 123023 | C41: 迪森转债! | D41: 300335 | E41: 迪森股份 | F41: 能源电力 | G41: 电力供应 | H41: 95.303 | I41: -9.300000000000001e-003 | J41: 5.0000000000000001e-003 | K41: 4.89 | L41: -2.2000000000000002e-002 | M41: 114.3 | N41: 7.04 | O41: 0.37200000000000005 | P41: 69.46 | Q41: 转股中 | R41: 3.96年 | S41: 2.96年 | T41: 5.29 | U41: 1.9 | V41: 4.0000000000000001e-003 | W41: 0.28999999999999998 | X41: 0.20100000000000001 | Y41: 18 | Z41: 1.31 | AA41: 4.7800000000000002e-002 | AB41: 4.0899999999999999e-002 | AC41: 3.0699999999999998e-002 | AD41: 2.76e-002 | AE41: 91.87 | AF41: 97.02 | AG41: 0.2 | AH41: AA | AI41: 4.2999999999999997e-002 | AJ41: =H41+100*O41 -> 132.50299999999999 | AK41: 121.1 | AL41: 114 | AM41: 24.1 | AN41: 69 | AO41: -6.7000000000000004e-002 | AP41: 52 | AQ41: 迪森转债!
A42: 104 | B42: 113597 | C42: 佳力转债! | D42: 603912 | E42: 佳力图 | F42: 机械装备 | G42: 专用设备 | H42: 97.66 | I42: 1.1999999999999999e-003 | J42: 1.2999999999999999e-003 | K42: 14.08 | L42: 1.15e-002 | M42: 124.5 | N42: 23.4 | O42: 0.623 | P42: 60.17 | Q42: 转股中 | R42: 5.32年 | S42: 3.33年 | T42: 3 | U42: 2.2 | V42: 6.9999999999999993e-003 | W42: 9.8000000000000004e-002 | X42: 5.9000000000000004e-002 | Y42: 31 | Z42: 3.52 | AA42: 4.7800000000000002e-002 | AB42: 3.9599999999999996e-002 | AC42: 1.9599999999999999e-002 | AD42: 1.7000000000000001e-002 | AE42: 83.79 | AF42: 89.34 | AG42: 0.22 | AH42: AA- | AI42: 6.59e-002 | AJ42: =H42+100*O42 -> 159.95999999999998 | AK42: 135.1 | AL42: 237 | AM42: 45.8 | AN42: 253 | AO42: 5.7999999999999996e-002 | AP42: 12 | AQ42: 佳力转债!
A43: 247 | B43: 110058 | C43: 永鼎转债! | D43: 600105 | E43: 永鼎股份 | F43: 通信互联 | G43: 通信设备 | H43: 95.81 | I43: -6.5000000000000006e-003 | J43: 6.8999999999999999e-003 | K43: 3.11 | L43: 3.2000000000000002e-003 | M43: 114.9 | N43: 5.04 | O43: 0.55299999999999994 | P43: 61.71 | Q43: 转股中 | R43: 4年13天 | S43: 2年14天 | T43: 2.61 | U43: 3.7 | V43: 1.4999999999999999e-002 | W43: 6.0999999999999999e-002 | X43: 3.7999999999999999e-002 | Y43: 43 | Z43: 1.53 | AA43: 4.7100000000000003e-002 | AB43: 4.0000000000000001e-002 | AC43: 3.56e-002 | AD43: 3.2400000000000005e-002 | AE43: 94.34 | AF43: 97.32 | AG43: 0.11 | AH43: AA | AI43: 4.2999999999999997e-002 | AJ43: =H43+100*O43 -> 151.11000000000001 | AK43: 129.9 | AL43: 203 | AM43: 32.6 | AN43: 153 | AO43: -4.4000000000000004e-002 | AP43: 50 | AQ43: 永鼎转债!
A44: 222 | B44: 113546 | C44: 迪贝转债! | D44: 603320 | E44: 迪贝电气 | F44: 家电 | G44: 零部件制 | H44: 98.41 | I44: -2.8000000000000004e-003 | J44: -3.5999999999999999e-003 | K44: 10.36 | L44: -1.61e-002 | M44: 120.6 | N44: 14.1 | O44: 0.33899999999999997 | P44: 73.48 | Q44: 转股中 | R44: 4.56年 | S44: 2.56年 | T44: 2.3 | U44: 0.7 | V44: 3.0000000000000001e-003 | W44: 0.17100000000000001 | X44: 0.125 | Y44: 13 | Z44: 2.02 | AA44: 4.6699999999999998e-002 | AB44: 3.8399999999999997e-002 | AC44: 2.0499999999999997e-002 | AD44: 1.7600000000000001e-002 | AE44: 85.55 | AF44: 87.42 | AG44: 0.4 | AH44: A+ | AI44: 7.4999999999999997e-002 | AJ44: =H44+100*O44 -> 132.31 | AK44: 123.3 | AL44: 141 | AM44: 35.9 | AN44: 183 | AO44: 4.0000000000000001e-003 | AP44: 42 | AQ44: 迪贝转债!
A45: 128 | B45: 128117 | C45: 道恩转债! | D45: 2838 | E45: 道恩股份 | F45: 化工 | G45: 橡胶塑料 | H45: 97.76 | I45: -4.8999999999999998e-003 | J45: 2.7000000000000001e-003 | K45: 20.37 | L45: -6.3e-003 | M45: 123.5 | N45: 29.03 | O45: 0.39299999999999996 | P45: 70.17 | Q45: 转股中 | R45: 5.25年 | S45: 3.25年 | T45: 3.6 | U45: 6.7 | V45: 1.9e-002 | W45: 4.2999999999999997e-002 | X45: 2.9999999999999999e-002 | Y45: 83 | Z45: 4.55 | AA45: 4.6500000000000007e-002 | AB45: 3.85e-002 | AC45: 1.8000000000000002e-002 | AD45: 1.5700000000000002e-002 | AE45: 83.7 | AF45: 88.97 | AG45: 0.34 | AH45: AA- | AI45: 6.59e-002 | AJ45: =H45+100*O45 -> 137.06 | AK45: 125.4 | AL45: 160 | AM45: 36.4 | AN45: 188 | AO45: -3.4000000000000002e-002 | AP45: 21 | AQ45: 道恩转债!
A46: 93 | B46: 113601 | C46: 塞力转债! | D46: 603716 | E46: 塞力医疗 | F46: 医药 | G46: 医药商业 | H46: 95.56 | I46: -2.2000000000000001e-003 | J46: -2.0999999999999999e-003 | K46: 14.11 | L46: -8.3999999999999995e-003 | M46: 121.3 | N46: 16.98 | O46: 0.14999999999999999 | P46: 83.1 | Q46: 转股中 | R46: 5.38年 | S46: 3.39年 | T46: 5.43 | U46: 4.4 | V46: 8.0000000000000002e-003 | W46: 0.188 | X46: 0.156 | Y46: 29 | Z46: 1.9 | AA46: 4.6399999999999997e-002 | AB46: 3.9100000000000003e-002 | AC46: 2.5000000000000001e-002 | AD46: 2.2599999999999999e-002 | AE46: 83.32 | AF46: 86.72 | AG46: 0.51 | AH46: AA- | AI46: 6.59e-002 | AJ46: =H46+100*O46 -> 110.56 | AK46: 108 | AL46: 17 | AM46: 21.3 | AN46: 41 | AO46: -1.1000000000000001e-002 | AP46: 34 | AQ46: 塞力转债!
A47: 279 | B47: 113524 | C47: 奇精转债! | D47: 603677 | E47: 奇精机械 | F47: 家电 | G47: 零部件制 | H47: 99.57 | I47: 2.3999999999999998e-003 | J47: -3.9000000000000003e-003 | K47: 10.76 | L47: -6.5000000000000006e-003 | M47: 117.3 | N47: 14.08 | O47: 0.30299999999999999 | P47: 76.42 | Q47: 转股中 | R47: 3.70年 | S47: 1.70年 | T47: 3.3 | U47: 2.3 | V47: 6.9999999999999993e-003 | W47: 0.16 | X47: 0.122 | Y47: 21 | Z47: 2.15 | AA47: 4.6199999999999998e-002 | AB47: 3.7400000000000003e-002 | AC47: 1.7399999999999999e-002 | AD47: 1.44e-002 | AE47: 95.08 | AF47: 100.67 | AG47: 0.23 | AH47: AA | AI47: 4.2999999999999997e-002 | AJ47: =H47+100*O47 -> 129.87 | AK47: 122.7 | AL47: 130 | AM47: 22.1 | AN47: 45 | AO47: -4.2999999999999997e-002 | AP47: 47 | AQ47: 奇精转债!
A48: 203 | B48: 110064 | C48: 建工转债! | D48: 600939 | E48: 重庆建工 | F48: 建筑 | G48: 建筑工程 | H48: 97.61 | I48: 1.e-004 | J48: -4.3e-003 | K48: 3.72 | L48: -1.3300000000000001e-002 | M48: 119.8 | N48: 4.57 | O48: 0.19899999999999998 | P48: 81.4 | Q48: 转股中 | R48: 4.72年 | S48: 2.72年 | T48: 16.6 | U48: 13 | V48: 8.0000000000000002e-003 | W48: 0.24600000000000002 | X48: 0.20000000000000001 | Y48: 68 | Z48: 0.98 | AA48: 4.5499999999999999e-002 | AB48: 3.7699999999999997e-002 | AC48: 2.29e-002 | AD48: 2.e-002 | AE48: 92.84 | AF48: 99.55 | AG48: 0.32 | AH48: AA+ | AI48: 4.0999999999999995e-002 | AJ48: =H48+100*O48 -> 117.50999999999999 | AK48: 113.8 | AL48: 40 | AM48: 14.3 | AN48: 9 | AO48: 3.3000000000000002e-002 | AP48: 46 | AQ48: 建工转债!
A49: 95 | B49: 128127 | C49: 文科转债! | D49: 2775 | E49: 文科园林 | F49: 城市公用 | G49: 生态环境 | H49: 96.08 | I49: -5.1000000000000004e-003 | J49: -1.61e-002 | K49: 4.73 | L49: -3.8599999999999995e-002 | M49: 121.3 | N49: 5.37 | O49: 9.0999999999999998e-002 | P49: 88.08 | Q49: 转股中 | R49: 5.38年 | S49: 3.38年 | T49: 9.5 | U49: 10 | V49: 1.1000000000000001e-002 | W49: 0.39200000000000002 | X49: 0.34499999999999997 | Y49: 24 | Z49: 0.92 | AA49: 4.53e-002 | AB49: 3.8100000000000002e-002 | AC49: 2.35e-002 | AD49: 2.1000000000000001e-002 | AE49: 83.34 | AF49: 86.74 | AG49: 0.55 | AH49: AA- | AI49: 6.59e-002 | AJ49: =H49+100*O49 -> 105.17999999999999 | AK49: 104.1 | AL49: 9 | AM49: 17.3 | AN49: 18 | AO49: -2.7000000000000003e-002 | AP49: 35 | AQ49: 文科转债!
A50: 292 | B50: 128042 | C50: 凯中转债! | D50: 2823 | E50: 凯中精密 | F50: 能源电力 | G50: 电力设备 | H50: 100.7 | I50: -1.37e-002 | J50: 1.1200000000000002e-002 | K50: 10.67 | L50: -9.300000000000001e-003 | M50: 116.3 | N50: 12.96 | O50: 0.223 | P50: 82.33 | Q50: 转股中 | R50: 3.32年 | S50: 1.33年 | T50: 4.16 | U50: 0.9 | V50: 2.e-003 | W50: 0.13600000000000001 | X50: 0.11199999999999999 | Y50: 31 | Z50: 2.27 | AA50: 4.5199999999999997e-002 | AB50: 3.6000000000000004e-002 | AC50: 1.41e-002 | AD50: 1.03e-002 | AE50: 96.6 | AF50: 101.4 | AG50: 0.27 | AH50: AA | AI50: 4.2999999999999997e-002 | AJ50: =H50+100*O50 -> 123. | AK50: 119.1 | AL50: 92 | AM50: 17.7 | AN50: 20 | AO50: 4.9000000000000002e-002 | AP50: 29 | AQ50: 凯中转债!
A51: 272 | B51: 128056 | C51: 今飞转债! | D51: 2863 | E51: 今飞凯达 | F51: 汽车 | G51: 零部件制 | H51: 101.851 | I51: -2.3999999999999998e-003 | J51: -2.7000000000000001e-003 | K51: 5.21 | L51: -1.3300000000000001e-002 | M51: 120.2 | N51: 6.7 | O51: 0.31 | P51: 77.76 | Q51: 转股中 | R51: 3.91年 | S51: 1.91年 | T51: 1.72 | U51: 9.3 | V51: 5.2999999999999999e-002 | W51: 6.6000000000000003e-002 | X51: 5.0999999999999997e-002 | Y51: 26 | Z51: 1.76 | AA51: 4.4199999999999996e-002 | AB51: 3.4799999999999998e-002 | AC51: 7.1999999999999998e-003 | AD51: 4.0000000000000001e-003 | AE51: 89.06 | AF51: 91.13 | AG51: 0.38 | AH51: A+ | AI51: 7.4999999999999997e-002 | AJ51: =H51+100*O51 -> 132.851 | AK51: 125.9 | AL51: 168 | AM51: 34.8 | AN51: 176 | AO51: -8.4000000000000005e-002 | AP51: 55 | AQ51: 今飞转债!
A52: 225 | B52: 128076 | C52: 金轮转债! | D52: 2722 | E52: 金轮股份 | F52: 机械装备 | G52: 专用设备 | H52: 94.998 | I52: -6.3e-003 | J52: 5.6999999999999993e-003 | K52: 10.01 | L52: -2.e-003 | M52: 114.9 | N52: 14.76 | O52: 0.40100000000000002 | P52: 67.82 | Q52: 转股中 | R52: 4.53年 | S52: 2.53年 | T52: 2.14 | U52: 1.7 | V52: 8.0000000000000002e-003 | W52: 0.122 | X52: 8.3000000000000004e-002 | Y52: 18 | Z52: 0.95 | AA52: 4.3799999999999999e-002 | AB52: 3.7499999999999999e-002 | AC52: 3.2199999999999999e-002 | AD52: 2.9600000000000001e-002 | AE52: 87.6 | AF52: 87.25 | AG52: 0.3 | AH52: AA- | AI52: 6.4000000000000001e-002 | AJ52: =H52+100*O52 -> 135.09800000000001 | AK52: 122.2 | AL52: 125 | AM52: 34.6 | AN52: 174 | AO52: -1.6e-002 | AP52: 42 | AQ52: 金轮转债!
A53: 54 | B53: 123076 | C53: 强力转债! | D53: 300429 | E53: 强力新材 | F53: 化工 | G53: 化工 | H53: 93.501 | I53: 5.4000000000000003e-003 | J53: -2.3e-003 | K53: 11.49 | L53: 1.1399999999999999e-002 | M53: 118.5 | N53: 18.98 | O53: 0.54500000000000004 | P53: 60.54 | Q53: 53天 | R53: 5.63年 | S53: 3.63年 | T53: 8.5 | U53: 5.9 | V53: 6.9999999999999993e-003 | W53: 0.14400000000000002 | X53: 8.6999999999999994e-002 | Y53: 59 | Z53: 3.42 | AA53: 4.3799999999999999e-002 | AB53: 3.7699999999999997e-002 | AC53: 2.8300000000000002e-002 | AD53: 2.6200000000000001e-002 | AE53: 81.68 | AF53: 83.33 | AG53: 0.26 | AH53: AA- | AI53: 6.59e-002 | AJ53: =H53+100*O53 -> 148.001 | AK53: 126.5 | AL53: 171 | AM53: 43.1 | AN53: 237 | AO53: 4.0000000000000001e-002 | AP53: 12 | AQ53: 强力转债!
A54: 322 | B54: 128026 | C54: 众兴转债! | D54: 2772 | E54: 众兴菌业 | F54: 农业 | G54: 种植业 | H54: 97.6 | I54: 1.e-003 | J54: -3.8e-003 | K54: 8.74 | L54: -1.47e-002 | M54: 109.3 | N54: 11.45 | O54: 0.27899999999999997 | P54: 76.33 | Q54: 转股中 | R54: 2.70年 | S54: 0.70年 | T54: 9.19 | U54: 4.5 | V54: 5.0000000000000001e-003 | W54: 0.28600000000000003 | X54: 0.218 | Y54: 32 | Z54: 1.27 | AA54: 4.36e-002 | AB54: 3.6699999999999997e-002 | AC54: 5.0000000000000003e-002 | AD54: 4.5700000000000005e-002 | AE54: 96.6 | AF54: 93.02 | AG54: 0.19 | AH54: AA- | AI54: 6.2699999999999992e-002 | AJ54: =H54+100*O54 -> 125.5 | AK54: 118.9 | AL54: 88 | AM54: 22.3 | AN54: 48 | AO54: -1.7000000000000001e-002 | AP54: 62 | AQ54: 众兴转债!
A55: 76 | B55: 123069 | C55: 金诺转债! | D55: 300505 | E55: 川金诺 | F55: 化工 | G55: 农化 | H55: 100.246 | I55: -2.5000000000000001e-003 | J55: -3.2000000000000002e-003 | K55: 16.09 | L55: -1.1699999999999999e-002 | M55: 126 | N55: 19.15 | O55: 0.193 | P55: 84.02 | Q55: 20天 | R55: 5.54年 | S55: 3.54年 | T55: 3.68 | U55: 2.4 | V55: 6.0000000000000001e-003 | W55: 0.17499999999999999 | X55: 0.14699999999999999 | Y55: 21 | Z55: 2.19 | AA55: 4.2999999999999997e-002 | AB55: 3.4799999999999998e-002 | AC55: 9.8999999999999991e-003 | AD55: 7.8000000000000005e-003 | AE55: 82.23 | AF55: 89.11 | AG55: 0.49 | AH55: AA- | AI55: 6.59e-002 | AJ55: =H55+100*O55 -> 119.54599999999999 | AK55: 116.5 | AL55: 67 | AM55: 27.4 | AN55: 93 | AO55: -1.e-003 | AP55: 17 | AQ55: 金诺转债!
A56: 130 | B56: 113591 | C56: 胜达转债! | D56: 603687 | E56: 大胜达 | F56: 造纸包装 | G56: 包装用纸 | H56: 98.58 | I56: -3.0000000000000001e-003 | J56: 4.7999999999999996e-003 | K56: 8.69 | L56: 3.4999999999999996e-003 | M56: 122.2 | N56: 10.46 | O56: 0.187 | P56: 83.08 | Q56: 转股中 | R56: 5.24年 | S56: 3.25年 | T56: 5.5 | U56: 2.6 | V56: 5.0000000000000001e-003 | W56: 0.154 | X56: 0.128 | Y56: 36 | Z56: 2.3 | AA56: 4.2800000000000005e-002 | AB56: 3.5099999999999999e-002 | AC56: 1.6399999999999998e-002 | AD56: 1.3899999999999999e-002 | AE56: 83.98 | AF56: 88.12 | AG56: 0.5 | AH56: AA- | AI56: 6.59e-002 | AJ56: =H56+100*O56 -> 117.28 | AK56: 114.1 | AL56: 44 | AM56: 26 | AN56: 81 | AO56: -5.5e-002 | AP56: 23 | AQ56: 胜达转债!
A57: 299 | B57: 127007 | C57: 湖广转债! | D57: 665 | E57: 湖北广电 | F57: 传媒娱乐 | G57: 影视娱乐 | H57: 98.5 | I57: 0. | J57: 0. | K57: 3.88 | L57: 0. | M57: 112.3 | N57: 5.58 | O57: 0.41700000000000004 | P57: 69.53 | Q57: 转股中 | R57: 3.24年 | S57: 1.24年 | T57: 12.2 | U57: 2 | V57: 2.e-003 | W57: 0.31900000000000001 | X57: 0.222 | Y57: 38 | Z57: 0.59 | AA57: 4.2300000000000004e-002 | AB57: 3.49e-002 | AC57: 3.1200000000000002e-002 | AD57: 2.7099999999999999e-002 | AE57: 97.21 | AF57: 98.89 | AG57: 0.15 | AH57: AA+ | AI57: 4.0999999999999995e-002 | AJ57: =H57+100*O57 -> 140.19999999999999 | AK57: 127.5 | AL57: 181 | AM57: 28.6 | AN57: 112 | AO57: 0. | AP57: 17 | AQ57: 湖广转债!
A58: 34 | B58: 123085 | C58: 万顺转2! | D58: 300057 | E58: 万顺新材 | F58: 有色金属 | G58: 铝金属 | H58: 90.119 | I58: -3.4000000000000002e-003 | J58: 7.4000000000000003e-003 | K58: 4.58 | L58: 8.8000000000000005e-003 | M58: 113.3 | N58: 6.24 | O58: 0.22800000000000001 | P58: 73.4 | Q58: 2月16天 | R58: 5.69年 | S58: 3.69年 | T58: 9 | U58: 20 | V58: 2.5000000000000001e-002 | W58: 0.29100000000000004 | X58: 0.214 | Y58: 31 | Z58: 0.91 | AA58: 4.1900000000000007e-002 | AB58: 3.73e-002 | AC58: 3.7699999999999997e-002 | AD58: 3.56e-002 | AE58: 81.34 | AF58: 79.38 | AG58: 0.45 | AH58: AA- | AI58: 6.59e-002 | AJ58: =H58+100*O58 -> 112.919 | AK58: 106.8 | AL58: 13 | AM58: 25.5 | AN58: 77 | AO58: -4.9000000000000002e-002 | AP58: 14 | AQ58: 万顺转2!
A59: 205 | B59: 128087 | C59: 孚日转债! | D59: 2083 | E59: 孚日股份 | F59: 服装纺织 | G59: 家纺 | H59: 93.452 | I59: 4.8999999999999998e-003 | J59: -1.5e-003 | K59: 4.23 | L59: 1.6799999999999999e-002 | M59: 112.9 | N59: 6.3 | O59: 0.39200000000000002 | P59: 67.14 | Q59: 转股中 | R59: 4.71年 | S59: 2.71年 | T59: 6.5 | U59: 8.4 | V59: 1.3999999999999999e-002 | W59: 0.16899999999999998 | X59: 0.114 | Y59: 38 | Z59: 1.02 | AA59: 4.1799999999999997e-002 | AB59: 3.6499999999999998e-002 | AC59: 3.61e-002 | AD59: 3.3700000000000001e-002 | AE59: 91.71 | AF59: 92.97 | AG59: 0.2 | AH59: AA | AI59: 4.2999999999999997e-002 | AJ59: =H59+100*O59 -> 132.65199999999999 | AK59: 119.8 | AL59: 104 | AM59: 26.8 | AN59: 86 | AO59: 9.0000000000000011e-003 | AP59: 54 | AQ59: 孚日转债!
A60: 36 | B60: 123084 | C60: 高澜转债! | D60: 300499 | E60: 高澜股份 | F60: 能源电力 | G60: 电力设备 | H60: 97.1 | I60: -1.e-003 | J60: -5.0000000000000001e-003 | K60: 9.05 | L60: -1.09e-002 | M60: 121.9 | N60: 11.36 | O60: 0.21899999999999997 | P60: 79.67 | Q60: 2月15天 | R60: 5.69年 | S60: 3.69年 | T60: 2.8 | U60: 1.8 | V60: 6.9999999999999993e-003 | W60: 0.111 | X60: 8.900000000000001e-002 | Y60: 25 | Z60: 3.02 | AA60: 4.1799999999999997e-002 | AB60: 3.4799999999999998e-002 | AC60: 2.0299999999999999e-002 | AD60: 1.78e-002 | AE60: 79.04 | AF60: 80.8 | AG60: 0.55 | AH60: A+ | AI60: 7.690000000000001e-002 | AJ60: =H60+100*O60 -> 119. | AK60: 114.5 | AL60: 49 | AM60: 33.7 | AN60: 165 | AO60: 8.0000000000000002e-003 | AP60: 8 | AQ60: 高澜转债!
A61: 340 | B61: 128013 | C61: 洪涛转债! | D61: 2325 | E61: 洪涛股份 | F61: 建筑 | G61: 装饰工程 | H61: 104.09 | I61: -1.5e-003 | J61: -2.5999999999999999e-003 | K61: 2.36 | L61: -8.3999999999999995e-003 | M61: 109.8 | N61: 2.32 | O61: 2.3e-002 | P61: 101.72 | Q61: 转股中 | R61: 1.32年 | S61: 回售内 | T61: 11.8 | U61: 17 | V61: 1.3999999999999999e-002 | W61: 0.40000000000000002 | X61: 0.40700000000000003 | Y61: 29 | Z61: 0.99 | AA61: 4.1700000000000001e-002 | AB61: 2.7400000000000001e-002 | AC61: 回售内 | AD61: 回售内 | AE61: 100.3 | AF61: 101.41 | AG61: 0.49 | AH61: AA- | AI61: 6.2699999999999992e-002 | AJ61: =H61+100*O61 -> 106.39 | AK61: 106.5 | AL61: 12 | AM61: 5 | AN61: 3 | AO61: -1.1000000000000001e-002 | AP61: 92 | AQ61: 洪涛转债!
A62: 113 | B62: 123061 | C62: 航新转债! | D62: 300424 | E62: 航新科技 | F62: 航空航天 | G62: 航空航天 | H62: 101.04 | I62: -1.7000000000000001e-003 | J62: -2.3e-003 | K62: 12.88 | L62: -6.8999999999999999e-003 | M62: 124.8 | N62: 14.86 | O62: 0.16600000000000001 | P62: 86.68 | Q62: 转股中 | R62: 5.30年 | S62: 3.30年 | T62: 2.5 | U62: 18 | V62: 7.2000000000000008e-002 | W62: 8.1000000000000003e-002 | X62: 7.0000000000000007e-002 | Y62: 31 | Z62: 2.83 | AA62: 4.1700000000000001e-002 | AB62: 3.3399999999999999e-002 | AC62: 1.0500000000000001e-002 | AD62: 7.8000000000000005e-003 | AE62: 81.27 | AF62: 85.11 | AG62: 0.57 | AH62: A+ | AI62: 7.690000000000001e-002 | AJ62: =H62+100*O62 -> 117.64000000000001 | AK62: 115.4 | AL62: 57 | AM62: 30.3 | AN62: 132 | AO62: 1.8000000000000002e-002 | AP62: 13 | AQ62: 航新转债!
A63: 176 | B63: 123044 | C63: 红相转债!! | D63: 300427 | E63: 红相股份 | F63: 能源电力 | G63: 电力设备 | H63: 102.801 | I63: -6.6e-003 | J63: 5.1000000000000004e-003 | K63: 13.86 | L63: -4.3e-003 | M63: 125 | N63: 18.8 | O63: 0.39399999999999996 | P63: 73.72 | Q63: 转股中 | R63: 4.94年 | S63: 2.94年 | T63: 5.5 | U63: 8.6 | V63: 1.4999999999999999e-002 | W63: 0.11 | X63: 8.1000000000000003e-002 | Y63: 50 | Z63: 2.19 | AA63: 4.1399999999999999e-002 | AB63: 3.2400000000000005e-002 | AC63: 5.4000000000000003e-003 | AD63: 2.5000000000000001e-003 | AE63: 86.36 | AF63: 92.69 | AG63: 0.34 | AH63: AA- | AI63: 6.4000000000000001e-002 | AJ63: =H63+100*O63 -> 142.20099999999999 | AK63: 131.9 | AL63: 217 | AM63: 39.2 | AN63: 212 | AO63: -4.4999999999999998e-002 | AP63: 20 | AQ63: 红相转债!!
A64: 230 | B64: 128073 | C64: 哈尔转债! | D64: 2615 | E64: 哈尔斯 | F64: 其他 | G64: 家居用品 | H64: 100.751 | I64: 4.0000000000000002e-004 | J64: 1.e-004 | K64: 3.96 | L64: 2.5000000000000001e-003 | M64: 115.3 | N64: 5.7 | O64: 0.45000000000000001 | P64: 69.47 | Q64: 转股中 | R64: 3.39年 | S64: 1.39年 | T64: 2.99 | U64: 7.9 | V64: 2.6000000000000002e-002 | W64: 0.183 | X64: 0.127 | Y64: 16 | Z64: 2.04 | AA64: 4.1299999999999996e-002 | AB64: 3.2799999999999996e-002 | AC64: 8.3000000000000001e-003 | AD64: 5.6999999999999993e-003 | AE64: 92.73 | AF64: 93.76 | AG64: 0.22 | AH64: AA- | AI64: 6.4000000000000001e-002 | AJ64: =H64+100*O64 -> 145.751 | AK64: 132 | AL64: 221 | AM64: 38.3 | AN64: 205 | AO64: -4.2000000000000003e-002 | AP64: 40 | AQ64: 哈尔转债!
A65: 337 | B65: 128014 | C65: 永东转债! | D65: 2753 | E65: 永东股份 | F65: 化工 | G65: 化工 | H65: 102.701 | I65: -1.e-003 | J65: 1.e-003 | K65: 7.92 | L65: 2.86e-002 | M65: 111.3 | N65: 12.6 | O65: 0.63400000000000001 | P65: 62.86 | Q65: 转股中 | R65: 2年15天 | S65: 15天 | T65: 3.37 | U65: 1.1 | V65: 3.0000000000000001e-003 | W65: 0.113 | X65: 7.0999999999999994e-002 | Y65: 30 | Z65: 1.69 | AA65: 4.1100000000000005e-002 | AB65: 3.0299999999999997e-002 | AC65: -4.2000000000000003e-002 | AD65: -5.8299999999999998e-002 | AE65: 100.54 | AF65: 98.58 | AG65: 0 | AH65: AA- | AI65: 6.2699999999999992e-002 | AJ65: =H65+100*O65 -> 166.101 | AK65: 142.5 | AL65: 277 | AM65: 42 | AN65: 227 | AO65: 2.7000000000000003e-002 | AP65: 39 | AQ65: 永东转债!
A66: 323 | B66: 128025 | C66: 特一转债! | D66: 2728 | E66: 特一药业 | F66: 医药 | G66: 化学制药 | H66: 97.884 | I66: -1.6000000000000001e-003 | J66: 1.9e-003 | K66: 11.12 | L66: 1.8e-003 | M66: 108.8 | N66: 14.7 | O66: 0.29399999999999998 | P66: 75.65 | Q66: 转股中 | R66: 2.68年 | S66: 0.68年 | T66: 2.99 | U66: 2.1 | V66: 6.9999999999999993e-003 | W66: 0.13200000000000001 | X66: 0.10000000000000001 | Y66: 23 | Z66: 2.24 | AA66: 4.0899999999999999e-002 | AB66: 3.4300000000000004e-002 | AC66: 4.4500000000000005e-002 | AD66: 4.07e-002 | AE66: 96.47 | AF66: 92.66 | AG66: 0.18 | AH66: AA- | AI66: 6.2699999999999992e-002 | AJ66: =H66+100*O66 -> 127.28399999999999 | AK66: 120.1 | AL66: 107 | AM66: 23.7 | AN66: 64 | AO66: 2.3e-002 | AP66: 54 | AQ66: 特一转债!
A67: 121 | B67: 123059 | C67: 银信转债! | D67: 300231 | E67: 银信科技 | F67: 计算机及 | G67: 软件开发 | H67: 100.887 | I67: -2.0999999999999999e-003 | J67: 4.4000000000000003e-003 | K67: 7.92 | L67: 5.1000000000000004e-003 | M67: 124.1 | N67: 9.91 | O67: 0.26200000000000001 | P67: 79.92 | Q67: 转股中 | R67: 5.28年 | S67: 3.29年 | T67: 3.91 | U67: 1.7 | V67: 4.0000000000000001e-003 | W67: 0.11199999999999999 | X67: 8.900000000000001e-002 | Y67: 35 | Z67: 2.61 | AA67: 4.0899999999999999e-002 | AB67: 3.2799999999999996e-002 | AC67: 9.0000000000000011e-003 | AD67: 6.7000000000000002e-003 | AE67: 83.67 | AF67: 89.24 | AG67: 0.45 | AH67: AA- | AI67: 6.59e-002 | AJ67: =H67+100*O67 -> 127.087 | AK67: 121.9 | AL67: 122 | AM67: 32.6 | AN67: 154 | AO67: -2.5000000000000001e-002 | AP67: 14 | AQ67: 银信转债!
A68: 44 | B68: 123081 | C68: 精研转债! | D68: 300709 | E68: 精研科技 | F68: 电子 | G68: 电子产品 | H68: 97.199 | I68: 1.6000000000000001e-003 | J68: -3.8e-003 | K68: 40.9 | L68: -7.3000000000000001e-003 | M68: 121.3 | N68: 64.28 | O68: 0.52800000000000002 | P68: 63.63 | Q68: 2月8天 | R68: 5.67年 | S68: 3.67年 | T68: 5.7 | U68: 1.8 | V68: 3.0000000000000001e-003 | W68: 0.121 | X68: 7.6999999999999999e-002 | Y68: 47 | Z68: 3.14 | AA68: 4.07e-002 | AB68: 3.39e-002 | AC68: 1.8500000000000003e-002 | AD68: 1.6299999999999999e-002 | AE68: 81.78 | AF68: 85.12 | AG68: 0.3 | AH68: AA- | AI68: 6.59e-002 | AJ68: =H68+100*O68 -> 149.999 | AK68: 130.8 | AL68: 207 | AM68: 45.6 | AN68: 252 | AO68: 2.1000000000000001e-002 | AP68: 6 | AQ68: 精研转债!
A69: 85 | B69: 128132 | C69: 交建转债! | D69: 2941 | E69: 新疆交建 | F69: 建筑 | G69: 建筑工程 | H69: 94.952 | I69: -2.5999999999999999e-003 | J69: -1.6500000000000001e-002 | K69: 13.65 | L69: -6.3799999999999996e-002 | M69: 117.3 | N69: 18.57 | O69: 0.29199999999999998 | P69: 73.51 | Q69: 转股中 | R69: 5.45年 | S69: 3.46年 | T69: 8.5 | U69: 231 | V69: 0.28300000000000003 | W69: 9.6999999999999989e-002 | X69: 7.0999999999999994e-002 | Y69: 88 | Z69: 3.64 | AA69: 4.0300000000000002e-002 | AB69: 3.44e-002 | AC69: 2.52e-002 | AD69: 2.3e-002 | AE69: 88.69 | AF69: 92.76 | AG69: 0.3 | AH69: AA | AI69: 4.4900000000000002e-002 | AJ69: =H69+100*O69 -> 124.152 | AK69: 116.4 | AL69: 66 | AM69: 23.6 | AN69: 63 | AO69: 0.16 | AP69: 16 | AQ69: 交建转债!
A70: 152 | B70: 113578 | C70: 全筑转债! | D70: 603030 | E70: 全筑股份 | F70: 建筑 | G70: 装饰工程 | H70: 97.37 | I70: -2.3e-003 | J70: 5.9999999999999995e-004 | K70: 4.35 | L70: -4.5999999999999999e-003 | M70: 118.3 | N70: 5.43 | O70: 0.215 | P70: 80.11 | Q70: 转股中 | R70: 5年17天 | S70: 3年18天 | T70: 3.84 | U70: 5.1 | V70: 1.3999999999999999e-002 | W70: 0.16399999999999998 | X70: 0.13100000000000001 | Y70: 23 | Z70: 1.05 | AA70: 4.0199999999999993e-002 | AB70: 3.3500000000000002e-002 | AC70: 2.0299999999999999e-002 | AD70: 1.7899999999999999e-002 | AE70: 90.28 | AF70: 95.23 | AG70: 0.35 | AH70: AA | AI70: 4.4900000000000002e-002 | AJ70: =H70+100*O70 -> 118.87 | AK70: 114.6 | AL70: 50 | AM70: 19.4 | AN70: 29 | AO70: -3.1e-002 | AP70: 19 | AQ70: 全筑转债!
A71: 232 | B71: 128072 | C71: 翔鹭转债! | D71: 2842 | E71: 翔鹭钨业 | F71: 有色金属 | G71: 小金属 | H71: 97.29 | I71: 1.e-003 | J71: -6.0999999999999995e-003 | K71: 9.35 | L71: -2.4e-002 | M71: 115.1 | N71: 15.34 | O71: 0.59599999999999997 | P71: 60.95 | Q71: 转股中 | R71: 4.38年 | S71: 2.38年 | T71: 3.02 | U71: 0.9 | V71: 3.0000000000000001e-003 | W71: 0.11800000000000001 | X71: 7.2000000000000008e-002 | Y71: 26 | Z71: 2.82 | AA71: 4.0000000000000001e-002 | AB71: 3.3399999999999999e-002 | AC71: 2.46e-002 | AD71: 2.18e-002 | AE71: 88.45 | AF71: 88.23 | AG71: 0.22 | AH71: AA- | AI71: 6.4000000000000001e-002 | AJ71: =H71+100*O71 -> 156.88999999999999 | AK71: 133.6 | AL71: 231 | AM71: 45.2 | AN71: 251 | AO71: -7.0000000000000007e-002 | AP71: 28 | AQ71: 翔鹭转债!
A72: 209 | B72: 128082 | C72: 华锋转债! | D72: 2806 | E72: 华锋股份 | F72: 电子 | G72: 元器件制 | H72: 101.71 | I72: -3.8e-003 | J72: -9.7999999999999997e-003 | K72: 8.52 | L72: -2.29e-002 | M72: 121.4 | N72: 9.13 | O72: 8.9999999999999997e-002 | P72: 93.32 | Q72: 转股中 | R72: 4.67年 | S72: 2.67年 | T72: 3.45 | U72: 5.6 | V72: 1.6e-002 | W72: 0.22899999999999998 | X72: 0.214 | Y72: 15 | Z72: 1.2 | AA72: 3.9599999999999996e-002 | AB72: 3.1300000000000001e-002 | AC72: 9.5999999999999992e-003 | AD72: 6.5000000000000006e-003 | AE72: 85.31 | AF72: 87.35 | AG72: 0.59 | AH72: A+ | AI72: 7.4999999999999997e-002 | AJ72: =H72+100*O72 -> 110.70999999999999 | AK72: 110.1 | AL72: 24 | AM72: 22.8 | AN72: 51 | AO72: -3.1e-002 | AP72: 56 | AQ72: 华锋转债!
A73: 119 | B73: 128120 | C73: 联诚转债! | D73: 2921 | E73: 联诚精密 | F73: 汽车 | G73: 零部件制 | H73: 96.948 | I73: -4.5999999999999999e-003 | J73: 6.1999999999999998e-003 | K73: 19.87 | L73: 2.5000000000000001e-003 | M73: 118.4 | N73: 24.37 | O73: 0.18899999999999997 | P73: 81.53 | Q73: 转股中 | R73: 5.29年 | S73: 3.29年 | T73: 2.6 | U73: 1.3 | V73: 5.0000000000000001e-003 | W73: 0.16 | X73: 0.13100000000000001 | Y73: 16 | Z73: 2.12 | AA73: 3.95e-002 | AB73: 3.3000000000000002e-002 | AC73: 2.2400000000000003e-002 | AD73: 1.9699999999999999e-002 | AE73: 78.71 | AF73: 77.09 | AG73: 0.62 | AH73: A | AI73: 8.6899999999999991e-002 | AJ73: =H73+100*O73 -> 115.84799999999998 | AK73: 112.4 | AL73: 33 | AM73: 33.7 | AN73: 164 | AO73: -1.4999999999999999e-002 | AP73: 18 | AQ73: 联诚转债!
A74: 2 | B74: 123102 | C74: 华自转债 | D74: 300490 | E74: 华自科技 | F74: 机械装备 | G74: 机器人及 | H74: 101.405 | I74: -2.4900000000000002e-002 | J74: -3.4000000000000002e-003 | K74: 9.31 | L74: -4.5100000000000001e-002 | M74: 126.9 | N74: 9.28 | O74: 1.1000000000000001e-002 | P74: 100.32 | Q74: 5月19天 | R74: 5.94年 | S74: 3.94年 | T74: 6.7 | U74: 273 | V74: 0.40000000000000002 | W74: 0.28100000000000003 | X74: 0.28199999999999997 | Y74: 24 | Z74: 1.36 | AA74: 3.9399999999999998e-002 | AB74: 3.15e-002 | AC74: 8.6e-003 | AD74: 6.1999999999999998e-003 | AE74: 80.99 | AF74: 87.61 | AG74: 0.63 | AH74: AA- | AI74: 6.59e-002 | AJ74: =H74+100*O74 -> 102.505 | AK74: 102.5 | AL74: 6 | AM74: 14.9 | AN74: 10 | AO74: -8.9999999999999997e-002 | AP74: 4 | AQ74: 华自转债
A75: 101 | B75: 113599 | C75: 嘉友转债! | D75: 603871 | E75: 嘉友国际 | F75: 交通运输 | G75: 物流业 | H75: 103.07 | I75: 2.2000000000000001e-003 | J75: -4.5999999999999999e-003 | K75: 21.75 | L75: -4.5999999999999999e-003 | M75: 126 | N75: 24.82 | O75: 0.17600000000000002 | P75: 87.63 | Q75: 转股中 | R75: 5.34年 | S75: 3.34年 | T75: 7.2 | U75: 5 | V75: 6.9999999999999993e-003 | W75: 0.151 | X75: 0.13200000000000001 | Y75: 48 | Z75: 2.4 | AA75: 3.9100000000000003e-002 | AB75: 3.0699999999999998e-002 | AC75: 2.3999999999999998e-003 | AD75: 2.0000000000000001e-004 | AE75: 83.27 | AF75: 90.24 | AG75: 0.51 | AH75: AA- | AI75: 6.59e-002 | AJ75: =H75+100*O75 -> 120.66999999999999 | AK75: 118.5 | AL75: 84 | AM75: 28.3 | AN75: 108 | AO75: 1.3000000000000001e-002 | AP75: 18 | AQ75: 嘉友转债!
A76: 298 | B76: 123010 | C76: 博世转债! | D76: 300422 | E76: 博世科 | F76: 城市公用 | G76: 三废处理 | H76: 99.5 | I76: 7.0999999999999995e-003 | J76: -7.3000000000000001e-003 | K76: 8.89 | L76: -1.1000000000000001e-003 | M76: 112.3 | N76: 12.2 | O76: 0.36499999999999999 | P76: 72.87 | Q76: 转股中 | R76: 3.26年 | S76: 1.26年 | T76: 4.3 | U76: 2.1 | V76: 5.0000000000000001e-003 | W76: 0.11900000000000001 | X76: 8.6999999999999994e-002 | Y76: 36 | Z76: 1.52 | AA76: 3.8699999999999998e-002 | AB76: 3.1400000000000004e-002 | AC76: 2.3399999999999997e-002 | AD76: 1.9400000000000001e-002 | AE76: 94.19 | AF76: 92.18 | AG76: 0.23 | AH76: AA- | AI76: 6.4000000000000001e-002 | AJ76: =H76+100*O76 -> 136. | AK76: 126.1 | AL76: 170 | AM76: 31.9 | AN76: 148 | AO76: -6.7000000000000004e-002 | AP76: 31 | AQ76: 博世转债!
A77: 283 | B77: 128049 | C77: 华源转债! | D77: 2787 | E77: 华源控股 | F77: 造纸包装 | G77: 包装材料 | H77: 100 | I77: 0. | J77: 0. | K77: 5.88 | L77: 0. | M77: 114.5 | N77: 7.42 | O77: 0.26200000000000001 | P77: 79.25 | Q77: 转股中 | R77: 3.65年 | S77: 1.66年 | T77: 3.63 | U77: 1.6 | V77: 4.0000000000000001e-003 | W77: 0.19500000000000001 | X77: 0.155 | Y77: 19 | Z77: 1.24 | AA77: 3.85e-002 | AB77: 3.1e-002 | AC77: 1.5600000000000001e-002 | AD77: 1.2500000000000001e-002 | AE77: 91.93 | AF77: 91.7 | AG77: 0.38 | AH77: AA- | AI77: 6.4000000000000001e-002 | AJ77: =H77+100*O77 -> 126.2 | AK77: 120.8 | AL77: 111 | AM77: 28.8 | AN77: 116 | AO77: -2.1000000000000001e-002 | AP77: 49 | AQ77: 华源转债!
A78: 184 | B78: 113566 | C78: 翔港转债! | D78: 603499 | E78: 翔港科技 | F78: 造纸包装 | G78: 包装材料 | H78: 103.46 | I78: -4.1999999999999997e-003 | J78: 9.7999999999999997e-003 | K78: 8.66 | L78: 1.1699999999999999e-002 | M78: 124 | N78: 10.77 | O78: 0.28699999999999998 | P78: 80.41 | Q78: 转股中 | R78: 4.91年 | S78: 2.91年 | T78: 1.61 | U78: 130 | V78: 0.76200000000000001 | W78: 9.1999999999999998e-002 | X78: 7.400000000000001e-002 | Y78: 17 | Z78: 3.05 | AA78: 3.8399999999999997e-002 | AB78: 2.98e-002 | AC78: 2.2000000000000001e-003 | AD78: -4.0000000000000002e-004 | AE78: 83.6 | AF78: 87.64 | AG78: 0.48 | AH78: A+ | AI78: 7.4999999999999997e-002 | AJ78: =H78+100*O78 -> 132.16 | AK78: 126.5 | AL78: 173 | AM78: 38.9 | AN78: 209 | AO78: 0.10099999999999999 | AP78: 28 | AQ78: 翔港转债!
A79: 309 | B79: 113505 | C79: 杭电转债! | D79: 603618 | E79: 杭电股份 | F79: 能源电力 | G79: 电力设备 | H79: 99.91 | I79: -5.4000000000000003e-003 | J79: -2.8000000000000004e-003 | K79: 5.99 | L79: -2.76e-002 | M79: 111.3 | N79: 7.14 | O79: 0.191 | P79: 83.89 | Q79: 转股中 | R79: 2.92年 | S79: 0.93年 | T79: 7.5 | U79: 6.5 | V79: 9.0000000000000011e-003 | W79: 0.18100000000000002 | X79: 0.152 | Y79: 41 | Z79: 1.63 | AA79: 3.8199999999999998e-002 | AB79: 3.0699999999999998e-002 | AC79: 1.7299999999999999e-002 | AD79: 1.3999999999999999e-002 | AE79: 97.37 | AF79: 98.94 | AG79: 0.3 | AH79: AA | AI79: 4.1700000000000001e-002 | AJ79: =H79+100*O79 -> 119.00999999999999 | AK79: 115.9 | AL79: 60 | AM79: 17 | AN79: 16 | AO79: -5.9999999999999998e-002 | AP79: 42 | AQ79: 杭电转债!
A80: 278 | B80: 113525 | C80: 台华转债! | D80: 603055 | E80: 台华新材 | F80: 服装纺织 | G80: 纺织行业 | H80: 99.94 | I80: 4.0000000000000001e-003 | J80: -5.5000000000000005e-003 | K80: 5.73 | L80: -6.8999999999999999e-003 | M80: 114.3 | N80: 7.83 | O80: 0.36599999999999999 | P80: 73.18 | Q80: 转股中 | R80: 3.71年 | S80: 1.71年 | T80: 4.69 | U80: 0.9 | V80: 2.e-003 | W80: 9.8000000000000004e-002 | X80: 7.2000000000000008e-002 | Y80: 48 | Z80: 1.62 | AA80: 3.7599999999999995e-002 | AB80: 3.0299999999999997e-002 | AC80: 1.5300000000000001e-002 | AD80: 1.23e-002 | AE80: 95.05 | AF80: 98.07 | AG80: 0.21 | AH80: AA | AI80: 4.2999999999999997e-002 | AJ80: =H80+100*O80 -> 136.53999999999999 | AK80: 126.7 | AL80: 175 | AM80: 28.6 | AN80: 115 | AO80: -5.5999999999999994e-002 | AP80: 21 | AQ80: 台华转债!
A81: 261 | B81: 123024 | C81: 岱勒转债! | D81: 300700 | E81: 岱勒新材 | F81: 机械装备 | G81: 专用设备 | H81: 101 | I81: 4.0999999999999995e-003 | J81: -3.2000000000000002e-003 | K81: 15.63 | L81: 1.9e-003 | M81: 112.5 | N81: 18.33 | O81: 0.184 | P81: 85.27 | Q81: 转股中 | R81: 2.96年 | S81: 0.97年 | T81: 2.1 | U81: 2 | V81: 1.e-002 | W81: 0.16300000000000001 | X81: 0.13900000000000001 | Y81: 13 | Z81: 2.61 | AA81: 3.7400000000000003e-002 | AB81: 2.9399999999999999e-002 | AC81: 2.2000000000000001e-003 | AD81: 0. | AE81: 93.42 | AF81: 91.31 | AG81: 0.43 | AH81: A+ | AI81: 7.3700000000000002e-002 | AJ81: =H81+100*O81 -> 119.40000000000001 | AK81: 116.7 | AL81: 68 | AM81: 23.3 | AN81: 57 | AO81: -3.4000000000000002e-002 | AP81: 35 | AQ81: 岱勒转债!
A82: 37 | B82: 127027 | C82: 靖远转债! | D82: 552 | E82: 靖远煤电 | F82: 煤炭 | G82: 煤炭开采 | H82: 94 | I82: 8.9999999999999998e-004 | J82: -1.2e-002 | K82: 2.86 | L82: -2.3900000000000001e-002 | M82: 115.3 | N82: 3.33 | O82: 9.4e-002 | P82: 85.89 | Q82: 2月15天 | R82: 5.69年 | S82: 3.69年 | T82: 28 | U82: 40 | V82: 1.4999999999999999e-002 | W82: 0.42799999999999999 | X82: 0.36799999999999999 | Y82: 65 | Z82: 0.83 | AA82: 3.73e-002 | AB82: 3.2199999999999999e-002 | AC82: 2.63e-002 | AD82: 2.4300000000000002e-002 | AE82: 88.42 | AF82: 91.22 | AG82: 0.46 | AH82: AA+ | AI82: 4.2900000000000001e-002 | AJ82: =H82+100*O82 -> 103.40000000000001 | AK82: 102.1 | AL82: 5 | AM82: 10.9 | AN82: 7 | AO82: -6.0000000000000001e-003 | AP82: 24 | AQ82: 靖远转债!
A83: 45 | B83: 123080 | C83: 海波转债! | D83: 300517 | E83: 海波重科 | F83: 建筑 | G83: 建筑工程 | H83: 103.3 | I83: 4.8999999999999998e-003 | J83: -2.3e-003 | K83: 20.77 | L83: 3.9000000000000003e-003 | M83: 126.5 | N83: 20.91 | O83: 4.0000000000000001e-002 | P83: 99.33 | Q83: 2月7天 | R83: 5.67年 | S83: 3.67年 | T83: 2.45 | U83: 6.6 | V83: 2.6000000000000002e-002 | W83: 0.111 | X83: 0.11 | Y83: 22 | Z83: 2.9 | AA83: 3.7200000000000004e-002 | AB83: 2.9100000000000001e-002 | AC83: 3.4999999999999996e-003 | AD83: 1.1000000000000001e-003 | AE83: 79.07 | AF83: 83.94 | AG83: 0.67 | AH83: A+ | AI83: 7.690000000000001e-002 | AJ83: =H83+100*O83 -> 107.3 | AK83: 107.3 | AL83: 14 | AM83: 23.3 | AN83: 58 | AO83: 0.111 | AP83: 11 | AQ83: 海波转债!
A84: 178 | B84: 113570 | C84: 百达转债! | D84: 603331 | E84: 百达精工 | F84: 机械装备 | G84: 机械装备 | H84: 96.45 | I84: -2.3e-003 | J84: 7.0999999999999995e-003 | K84: 9.57 | L84: 8.3999999999999995e-003 | M84: 114.9 | N84: 11.54 | O84: 0.16300000000000001 | P84: 82.93 | Q84: 转股中 | R84: 4.94年 | S84: 2.94年 | T84: 2.8 | U84: 5.4 | V84: 2.e-002 | W84: 0.16300000000000001 | X84: 0.13600000000000001 | Y84: 17 | Z84: 2.21 | AA84: 3.6799999999999999e-002 | AB84: 3.1099999999999999e-002 | AC84: 2.2799999999999997e-002 | AD84: 2.06e-002 | AE84: 82.75 | AF84: 80.95 | AG84: 0.57 | AH84: A+ | AI84: 7.4999999999999997e-002 | AJ84: =H84+100*O84 -> 112.75 | AK84: 110 | AL84: 23 | AM84: 27.2 | AN84: 91 | AO84: 3.7999999999999999e-002 | AP84: 35 | AQ84: 百达转债!
A85: 129 | B85: 123057 | C85: 美联转债! | D85: 300586 | E85: 美联新材 | F85: 化工 | G85: 橡胶塑料 | H85: 98.4 | I85: 6.3e-003 | J85: 1.1000000000000001e-003 | K85: 7.85 | L85: 1.55e-002 | M85: 118.2 | N85: 9.91 | O85: 0.24199999999999999 | P85: 79.21 | Q85: 转股中 | R85: 5.24年 | S85: 3.25年 | T85: 2.07 | U85: 8.6 | V85: 4.2000000000000003e-002 | W85: 5.7999999999999996e-002 | X85: 4.5999999999999999e-002 | Y85: 36 | Z85: 4.81 | AA85: 3.6400000000000002e-002 | AB85: 2.9999999999999999e-002 | AC85: 1.6899999999999998e-002 | AD85: 1.4499999999999999e-002 | AE85: 83.97 | AF85: 85.26 | AG85: 0.48 | AH85: AA- | AI85: 6.59e-002 | AJ85: =H85+100*O85 -> 122.60000000000001 | AK85: 117.6 | AL85: 73 | AM85: 32.3 | AN85: 151 | AO85: -1.1000000000000001e-002 | AP85: 14 | AQ85: 美联转债!
A86: 71 | B86: 123071 | C86: 天能转债! | D86: 300569 | E86: 天能重工 | F86: 能源电力 | G86: 风能 | H86: 99.7 | I86: -1.1999999999999999e-003 | J86: -4.4000000000000003e-003 | K86: 14.27 | L86: -1.4499999999999999e-002 | M86: 121.1 | N86: 20.05 | O86: 0.40100000000000002 | P86: 71.17 | Q86: 25天 | R86: 5.55年 | S86: 3.55年 | T86: 7 | U86: 2.3 | V86: 3.0000000000000001e-003 | W86: 0.125 | X86: 8.900000000000001e-002 | Y86: 56 | Z86: 2.53 | AA86: 3.6400000000000002e-002 | AB86: 2.9500000000000002e-002 | AC86: 1.1599999999999999e-002 | AD86: 9.3999999999999986e-003 | AE86: 82.24 | AF86: 85.61 | AG86: 0.39 | AH86: AA- | AI86: 6.59e-002 | AJ86: =H86+100*O86 -> 139.80000000000001 | AK86: 128.2 | AL86: 193 | AM86: 42.6 | AN86: 234 | AO86: -9.0000000000000011e-003 | AP86: 10 | AQ86: 天能转债!
A87: 160 | B87: 113576 | C87: 起步转债!! | D87: 603557 | E87: 起步股份 | F87: 服装纺织 | G87: 鞋服行业 | H87: 102.58 | I87: -8.3000000000000001e-003 | J87: -1.5300000000000001e-002 | K87: 9.05 | L87: -4.6399999999999997e-002 | M87: 121.8 | N87: 10.55 | O87: 0.19600000000000001 | P87: 85.78 | Q87: 转股中 | R87: 5年7天 | S87: 3年8天 | T87: 2.66 | U87: 100 | V87: 0.36399999999999999 | W87: 5.9000000000000004e-002 | X87: 5.0999999999999997e-002 | Y87: 45 | Z87: 2.66 | AA87: 3.5799999999999998e-002 | AB87: 2.7900000000000001e-002 | AC87: 6.6e-003 | AD87: 3.7000000000000002e-003 | AE87: 85.71 | AF87: 89.19 | AG87: 0.51 | AH87: AA- | AI87: 6.59e-002 | AJ87: =H87+100*O87 -> 122.18000000000001 | AK87: 119.4 | AL87: 99 | AM87: 30.2 | AN87: 129 | AO87: -2.3e-002 | AP87: 27 | AQ87: 起步转债!!
A88: 20 | B88: 128143 | C88: 锋龙转债! | D88: 2931 | E88: 锋龙股份 | F88: 机械装备 | G88: 专用设备 | H88: 99.851 | I88: -3.9e-002 | J88: 2.2000000000000002e-002 | K88: 16.15 | L88: -2.6499999999999999e-002 | M88: 121.7 | N88: 17.97 | O88: 0.111 | P88: 89.87 | Q88: 3月13天 | R88: 5.77年 | S88: 3.77年 | T88: 2.45 | U88: 188 | V88: 0.76200000000000001 | W88: 0.107 | X88: 9.6000000000000002e-002 | Y88: 23 | Z88: 3.99 | AA88: 3.5699999999999996e-002 | AB88: 2.8900000000000002e-002 | AC88: 1.21e-002 | AD88: 9.7000000000000003e-003 | AE88: 78.43 | AF88: 80.18 | AG88: 0.64 | AH88: A+ | AI88: 7.690000000000001e-002 | AJ88: =H88+100*O88 -> 110.95099999999999 | AK88: 109.8 | AL88: 22 | AM88: 29.7 | AN88: 126 | AO88: 6.5000000000000002e-002 | AP88: 9 | AQ88: 锋龙转债!
A89: 131 | B89: 128116 | C89: 瑞达转债! | D89: 2961 | E89: 瑞达期货 | F89: 金融 | G89: 期货行业 | H89: 96.7 | I89: 2.0000000000000001e-004 | J89: -3.2000000000000002e-003 | K89: 20.85 | L89: -1.09e-002 | M89: 115.3 | N89: 29.82 | O89: 0.38299999999999995 | P89: 69.92 | Q89: 转股中 | R89: 5.24年 | S89: 3.24年 | T89: 6.5 | U89: 1.9 | V89: 3.0000000000000001e-003 | W89: 7.0000000000000007e-002 | X89: 4.9000000000000002e-002 | Y89: 93 | Z89: 4.96 | AA89: 3.49e-002 | AB89: 2.9300000000000003e-002 | AC89: 2.1000000000000001e-002 | AD89: 1.8799999999999997e-002 | AE89: 89.44 | AF89: 92.04 | AG89: 0.28 | AH89: AA | AI89: 4.4900000000000002e-002 | AJ89: =H89+100*O89 -> 135. | AK89: 123.5 | AL89: 143 | AM89: 31.4 | AN89: 142 | AO89: -2.2000000000000002e-002 | AP89: 16 | AQ89: 瑞达转债!
A90: 18 | B90: 123093 | C90: 金陵转债 | D90: 300651 | E90: 金陵体育 | F90: 其他 | G90: 文化教育 | H90: 106.661 | I90: -1.7100000000000001e-002 | J90: 1.72e-002 | K90: 44.41 | L90: 2.0000000000000001e-004 | M90: 129.3 | N90: 49.29 | O90: 0.184 | P90: 90.1 | Q90: 3月25天 | R90: 5.80年 | S90: 3.80年 | T90: 2.5 | U90: 43 | V90: 0.161 | W90: 4.4000000000000004e-002 | X90: 3.9e-002 | Y90: 57 | Z90: 8.34 | AA90: 3.4700000000000002e-002 | AB90: 2.6099999999999998e-002 | AC90: -5.9999999999999995e-004 | AD90: -3.7000000000000002e-003 | AE90: 79.62 | AF90: 85.19 | AG90: 0.6 | AH90: A+ | AI90: 7.690000000000001e-002 | AJ90: =H90+100*O90 -> 125.06100000000001 | AK90: 123.2 | AL90: 138 | AM90: 38 | AN90: 201 | AO90: 1.3000000000000001e-002 | AP90: 4 | AQ90: 金陵转债
A91: 12 | B91: 123097 | C91: 美力转债 | D91: 300611 | E91: 美力科技 | F91: 机械装备 | G91: 通用设备 | H91: 100.3 | I91: -8.9999999999999998e-004 | J91: 1.7000000000000001e-003 | K91: 8.58 | L91: 1.1999999999999999e-003 | M91: 121.6 | N91: 9.34 | O91: 9.1999999999999998e-002 | P91: 91.86 | Q91: 4月2天 | R91: 5.82年 | S91: 3.82年 | T91: 3 | U91: 7.7 | V91: 2.6000000000000002e-002 | W91: 0.19500000000000001 | X91: 0.17899999999999999 | Y91: 15 | Z91: 2.38 | AA91: 3.44e-002 | AB91: 2.7699999999999999e-002 | AC91: 1.0700000000000001e-002 | AD91: 8.3999999999999995e-003 | AE91: 78.12 | AF91: 79.8 | AG91: 0.66 | AH91: A+ | AI91: 7.690000000000001e-002 | AJ91: =H91+100*O91 -> 109.5 | AK91: 108.7 | AL91: 19 | AM91: 28.9 | AN91: 118 | AO91: -5.5e-002 | AP91: 7 | AQ91: 美力转债
A92: 329 | B92: 113502 | C92: 嘉澳转债! | D92: 603822 | E92: 嘉澳环保 | F92: 化工 | G92: 化工 | H92: 102.08 | I92: -1.5e-003 | J92: 1.5e-003 | K92: 19.58 | L92: 4.0999999999999995e-003 | M92: 111.3 | N92: 44.79 | O92: 1.3400000000000001 | P92: 43.72 | Q92: 转股中 | R92: 2.61年 | S92: 0.61年 | T92: 1.85 | U92: 22 | V92: 0.114 | W92: 0.129 | X92: 5.5999999999999994e-002 | Y92: 14 | Z92: 1.91 | AA92: 3.4300000000000004e-002 | AB92: 2.6000000000000002e-002 | AC92: -3.4999999999999996e-003 | AD92: -8.1000000000000013e-003 | AE92: 97.13 | AF92: 95.24 | AG92: 0 | AH92: AA- | AI92: 6.2699999999999992e-002 | AJ92: =H92+100*O92 -> 236.07999999999998 | AK92: 160.4 | AL92: 315 | AM92: 63.3 | AN92: 306 | AO92: -3.5000000000000003e-002 | AP92: 35 | AQ92: 嘉澳转债!
A93: 170 | B93: 123047 | C93: 久吾转债 | D93: 300631 | E93: 久吾高科 | F93: 机械装备 | G93: 专用设备 | H93: 110.11 | I93: -8.0000000000000004e-004 | J93: -1.03e-002 | K93: 16.8 | L93: -1.9299999999999998e-002 | M93: 129.6 | N93: 17.61 | O93: 0.154 | P93: 95.4 | Q93: 转股中 | R93: 4.96年 | S93: 2.96年 | T93: 1.99 | U93: 2.2 | V93: 1.e-002 | W93: 0.109 | X93: 0.10400000000000001 | Y93: 18 | Z93: 2.51 | AA93: 3.4300000000000004e-002 | AB93: 2.4199999999999999e-002 | AC93: -1.34e-002 | AD93: -1.67e-002 | AE93: 84.42 | AF93: 91.41 | AG93: 0.57 | AH93: A+ | AI93: 7.4999999999999997e-002 | AJ93: =H93+100*O93 -> 125.51000000000001 | AK93: 124.8 | AL93: 153 | AM93: 33.4 | AN93: 161 | AO93: -8.0000000000000002e-003 | AP93: 23 | AQ93: 久吾转债
A94: 35 | B94: 123086 | C94: 海兰转债! | D94: 300065 | E94: 海兰信 | F94: 电子 | G94: 电子产品 | H94: 102.4 | I94: -5.7999999999999996e-003 | J94: 5.1999999999999998e-003 | K94: 10.58 | L94: -8.9999999999999998e-004 | M94: 123.5 | N94: 10.88 | O94: 5.2999999999999999e-002 | P94: 97.24 | Q94: 2月16天 | R94: 5.69年 | S94: 3.69年 | T94: 7.3 | U94: 15 | V94: 2.e-002 | W94: 0.17300000000000001 | X94: 0.16899999999999998 | Y94: 42 | Z94: 2.82 | AA94: 3.4099999999999998e-002 | AB94: 2.69e-002 | AC94: 3.7000000000000002e-003 | AD94: 1.7000000000000001e-003 | AE94: 81.37 | AF94: 86.48 | AG94: 0.63 | AH94: AA- | AI94: 6.59e-002 | AJ94: =H94+100*O94 -> 107.7 | AK94: 107.6 | AL94: 15 | AM94: 21.1 | AN94: 38 | AO94: 4.0000000000000001e-003 | AP94: 8 | AQ94: 海兰转债!
A95: 126 | B95: 113036 | C95: 宁建转债! | D95: 601789 | E95: 宁波建工 | F95: 建筑 | G95: 建筑工程 | H95: 98.72 | I95: -2.8999999999999998e-003 | J95: -1.7000000000000001e-003 | K95: 3.88 | L95: -1.2699999999999999e-002 | M95: 117.3 | N95: 4.86 | O95: 0.23699999999999999 | P95: 79.84 | Q95: 转股中 | R95: 5.26年 | S95: 3.26年 | T95: 5.4 | U95: 1.3 | V95: 3.0000000000000001e-003 | W95: 0.14300000000000002 | X95: 0.114 | Y95: 38 | Z95: 1.27 | AA95: 3.4000000000000002e-002 | AB95: 2.7900000000000001e-002 | AC95: 1.49e-002 | AD95: 1.2699999999999999e-002 | AE95: 89.45 | AF95: 93.56 | AG95: 0.36 | AH95: AA | AI95: 4.4900000000000002e-002 | AJ95: =H95+100*O95 -> 122.42 | AK95: 117.6 | AL95: 74 | AM95: 24 | AN95: 67 | AO95: -1.e-002 | AP95: 8 | AQ95: 宁建转债!
A96: 195 | B96: 113561 | C96: 正裕转债! | D96: 603089 | E96: 正裕工业 | F96: 汽车 | G96: 零部件制 | H96: 101.47 | I96: 5.4000000000000003e-003 | J96: -4.7999999999999996e-003 | K96: 8.58 | L96: 1.1999999999999999e-003 | M96: 118 | N96: 10.23 | O96: 0.20999999999999999 | P96: 83.87 | Q96: 转股中 | R96: 4.75年 | S96: 2.75年 | T96: 1.5 | U96: 13 | V96: 8.8000000000000009e-002 | W96: 7.9000000000000001e-002 | X96: 6.6000000000000003e-002 | Y96: 19 | Z96: 2.05 | AA96: 3.3099999999999997e-002 | AB96: 2.6099999999999998e-002 | AC96: 9.1000000000000004e-003 | AD96: 6.3e-003 | AE96: 84.58 | AF96: 84.42 | AG96: 0.55 | AH96: A+ | AI96: 7.4999999999999997e-002 | AJ96: =H96+100*O96 -> 122.47 | AK96: 119.1 | AL96: 91 | AM96: 34.5 | AN96: 173 | AO96: -0.19399999999999998 | AP96: 33 | AQ96: 正裕转债!
A97: 241 | B97: 113027 | C97: 华钰转债!! | D97: 601020 | E97: 华钰矿业 | F97: 有色金属 | G97: 锌铅镍锡 | H97: 100.58 | I97: 4.6999999999999993e-003 | J97: -3.5999999999999999e-003 | K97: 8.36 | L97: 2.3999999999999998e-003 | M97: 114.9 | N97: 10.17 | O97: 0.22399999999999998 | P97: 82.2 | Q97: 转股中 | R97: 4.20年 | S97: 2.20年 | T97: 3.25 | U97: 4.7 | V97: 1.3999999999999999e-002 | W97: 7.0000000000000007e-002 | X97: 5.7999999999999996e-002 | Y97: 46 | Z97: 1.91 | AA97: 3.2899999999999999e-002 | AB97: 2.6200000000000001e-002 | AC97: 1.1899999999999999e-002 | AD97: 9.0000000000000011e-003 | AE97: 89.43 | AF97: 89.07 | AG97: 0.45 | AH97: AA- | AI97: 6.4000000000000001e-002 | AJ97: =H97+100*O97 -> 122.97999999999999 | AK97: 119 | AL97: 90 | AM97: 29.5 | AN97: 125 | AO97: -6.9000000000000006e-002 | AP97: 44 | AQ97: 华钰转债!!
A98: 167 | B98: 113574 | C98: 华体转债! | D98: 603679 | E98: 华体科技 | F98: 城市公用 | G98: 城市公用 | H98: 98.99 | I98: 4.8999999999999998e-003 | J98: 2.3999999999999998e-003 | K98: 18.68 | L98: 4.7100000000000003e-002 | M98: 115.9 | N98: 33.99 | O98: 0.80099999999999993 | P98: 54.96 | Q98: 转股中 | R98: 4.99年 | S98: 2.99年 | T98: 2.09 | U98: 7.5 | V98: 3.6000000000000004e-002 | W98: 7.8e-002 | X98: 4.2999999999999997e-002 | Y98: 27 | Z98: 3.65 | AA98: 3.2799999999999996e-002 | AB98: 2.6800000000000001e-002 | AC98: 1.61e-002 | AD98: 1.3500000000000002e-002 | AE98: 82.98 | AF98: 81.44 | AG98: 0.15 | AH98: A+ | AI98: 7.4999999999999997e-002 | AJ98: =H98+100*O98 -> 179.08999999999997 | AK98: 143 | AL98: 279 | AM98: 60 | AN98: 302 | AO98: 1.6e-002 | AP98: 17 | AQ98: 华体转债!
A99: 87 | B99: 123065 | C99: 宝莱转债! | D99: 300246 | E99: 宝莱特 | F99: 医药 | G99: 医疗器械 | H99: 102.3 | I99: 2.5999999999999999e-003 | J99: -1.4000000000000002e-003 | K99: 24.84 | L99: 4.8999999999999998e-003 | M99: 121.4 | N99: 40.54 | O99: 0.67000000000000004 | P99: 61.27 | Q99: 转股中 | R99: 5.42年 | S99: 3.42年 | T99: 2.19 | U99: 15 | V99: 6.7000000000000004e-002 | W99: 5.9999999999999998e-002 | X99: 3.7000000000000005e-002 | Y99: 36 | Z99: 4.36 | AA99: 3.2799999999999996e-002 | AB99: 2.5699999999999997e-002 | AC99: 5.5000000000000005e-003 | AD99: 3.2000000000000002e-003 | AE99: 83.17 | AF99: 86.56 | AG99: 0.26 | AH99: AA- | AI99: 6.59e-002 | AJ99: =H99+100*O99 -> 169.30000000000001 | AK99: 143.3 | AL99: 281 | AM99: 56.8 | AN99: 293 | AO99: 4.8000000000000001e-002 | AP99: 15 | AQ99: 宝莱转债!
A100: 56 | B100: 113608 | C100: 威派转债! | D100: 603956 | E100: 威派格 | F100: 机械装备 | G100: 专用设备 | H100: 101.92 | I100: 2.0999999999999999e-003 | J100: -3.2000000000000002e-003 | K100: 16.3 | L100: -1.8e-003 | M100: 121.6 | N100: 19.24 | O100: 0.20300000000000001 | P100: 84.72 | Q100: 41天 | R100: 5.60年 | S100: 3.61年 | T100: 4.2 | U100: 0.3 | V100: 1.e-003 | W100: 5.9999999999999998e-002 | X100: 5.0999999999999997e-002 | Y100: 69 | Z100: 6.09 | AA100: 3.2799999999999996e-002 | AB100: 2.5899999999999999e-002 | AC100: 6.9999999999999993e-003 | AD100: 4.5999999999999999e-003 | AE100: 79.38 | AF100: 81.09 | AG100: 0.6 | AH100: A+ | AI100: 7.690000000000001e-002 | AJ100: =H100+100*O100 -> 122.22 | AK100: 119.1 | AL100: 93 | AM100: 38 | AN100: 200 | AO100: 2.8999999999999998e-002 | AP100: 7 | AQ100: 威派转债!
A101: 297 | B101: 110045 | C101: 海澜转债! | D101: 600398 | E101: 海澜之家 | F101: 服装纺织 | G101: 服装行业 | H101: 100.13 | I101: -8.9999999999999998e-004 | J101: 1.5e-003 | K101: 7.15 | L101: 8.5000000000000006e-003 | M101: 111.1 | N101: 11.75 | O101: 0.64500000000000002 | P101: 60.85 | Q101: 转股中 | R101: 3.28年 | S101: 1.28年 | T101: 29.5 | U101: 15 | V101: 5.0000000000000001e-003 | W101: 9.5000000000000001e-002 | X101: 5.7999999999999996e-002 | Y101: 309 | Z101: 2.43 | AA101: 3.27e-002 | AB101: 2.6200000000000001e-002 | AC101: 1.3100000000000001e-002 | AD101: 1.03e-002 | AE101: 96.3 | AF101: 97.59 | AG101: 0.07 | AH101: AA+ | AI101: 4.0999999999999995e-002 | AJ101: =H101+100*O101 -> 164.63 | AK101: 139.4 | AL101: 265 | AM101: 41.8 | AN101: 226 | AO101: -1.e-002 | AP101: 56 | AQ101: 海澜转债!
A102: 79 | B102: 113604 | C102: 多伦转债! | D102: 603528 | E102: 多伦科技 | F102: 计算机及 | G102: 软件开发 | H102: 98.53 | I102: 2.e-003 | J102: -2.e-003 | K102: 8.12 | L102: 0. | M102: 117.3 | N102: 10.44 | O102: 0.26700000000000002 | P102: 77.78 | Q102: 17天 | R102: 5.53年 | S102: 3.53年 | T102: 6.4 | U102: 1.9 | V102: 3.0000000000000001e-003 | W102: 0.126 | X102: 9.8000000000000004e-002 | Y102: 51 | Z102: 3.15 | AA102: 3.27e-002 | AB102: 2.69e-002 | AC102: 1.43e-002 | AD102: 1.23e-002 | AE102: 82.18 | AF102: 83.01 | AG102: 0.49 | AH102: AA- | AI102: 6.59e-002 | AJ102: =H102+100*O102 -> 125.23 | AK102: 119.3 | AL102: 96 | AM102: 36.3 | AN102: 186 | AO102: 7.2000000000000008e-002 | AP102: 6 | AQ102: 多伦转债!
A103: 141 | B103: 123053 | C103: 宝通转债! | D103: 300031 | E103: 宝通科技 | F103: 通信互联 | G103: 互联网 | H103: 103.217 | I103: -8.9999999999999998e-004 | J103: 1.e-004 | K103: 15.77 | L103: -1.9e-003 | M103: 121.3 | N103: 20.8 | O103: 0.36099999999999999 | P103: 75.82 | Q103: 转股中 | R103: 5.17年 | S103: 3.18年 | T103: 5 | U103: 2 | V103: 4.0000000000000001e-003 | W103: 8.0000000000000002e-002 | X103: 6.0999999999999999e-002 | Y103: 63 | Z103: 2.18 | AA103: 3.2500000000000001e-002 | AB103: 2.5099999999999997e-002 | AC103: 2.8999999999999998e-003 | AD103: 5.0000000000000001e-004 | AE103: 84.45 | AF103: 87.9 | AG103: 0.42 | AH103: AA- | AI103: 6.59e-002 | AJ103: =H103+100*O103 -> 139.31700000000001 | AK103: 130.6 | AL103: 205 | AM103: 42.7 | AN103: 235 | AO103: -3.5000000000000003e-002 | AP103: 10 | AQ103: 宝通转债!
A104: 164 | B104: 127016 | C104: 鲁泰转债! | D104: 726 | E104: 鲁 泰Ａ | F104: 服装纺织 | G104: 纺织行业 | H104: 99.5 | I104: 8.0000000000000004e-004 | J104: -3.2000000000000002e-003 | K104: 6.53 | L104: -9.1000000000000004e-003 | M104: 116.2 | N104: 8.91 | O104: 0.35799999999999998 | P104: 73.29 | Q104: 转股中 | R104: 5年6.1天 | S104: 3年7天 | T104: 14 | U104: 11 | V104: 8.0000000000000002e-003 | W104: 0.25 | X104: 0.183 | Y104: 56 | Z104: 0.74 | AA104: 3.2099999999999997e-002 | AB104: 2.6099999999999998e-002 | AC104: 1.32e-002 | AD104: 1.09e-002 | AE104: 90.85 | AF104: 94.54 | AG104: 0.27 | AH104: AA+ | AI104: 4.2900000000000001e-002 | AJ104: =H104+100*O104 -> 135.30000000000001 | AK104: 125.7 | AL104: 166 | AM104: 31.2 | AN104: 139 | AO104: -4.4000000000000004e-002 | AP104: 22 | AQ104: 鲁泰转债!
A105: 63 | B105: 123075 | C105: 贝斯转债! | D105: 300580 | E105: 贝斯特 | F105: 汽车 | G105: 零部件制 | H105: 97.17 | I105: -1.e-004 | J105: 7.0999999999999995e-003 | K105: 17.03 | L105: 1.61e-002 | M105: 115.5 | N105: 23.99 | O105: 0.36899999999999999 | P105: 70.99 | Q105: 34天 | R105: 5.58年 | S105: 3.59年 | T105: 6 | U105: 1.9 | V105: 3.0000000000000001e-003 | W105: 0.17600000000000002 | X105: 0.125 | Y105: 34 | Z105: 2.12 | AA105: 3.2099999999999997e-002 | AB105: 2.69e-002 | AC105: 1.8000000000000002e-002 | AD105: 1.6e-002 | AE105: 81.92 | AF105: 81.47 | AG105: 0.44 | AH105: AA- | AI105: 6.59e-002 | AJ105: =H105+100*O105 -> 134.06999999999999 | AK105: 123.4 | AL105: 142 | AM105: 41.4 | AN105: 223 | AO105: -2.9999999999999999e-002 | AP105: 8 | AQ105: 贝斯转债!
A106: 49 | B106: 128139 | C106: 祥鑫转债! | D106: 2965 | E106: 祥鑫科技 | F106: 汽车 | G106: 零部件制 | H106: 101.5 | I106: -1.3500000000000002e-002 | J106: 1.7399999999999999e-002 | K106: 35.5 | L106: 6.1999999999999998e-003 | M106: 121 | N106: 37.28 | O106: 6.6000000000000003e-002 | P106: 95.23 | Q106: 2月6天 | R106: 5.66年 | S106: 3.67年 | T106: 6.47 | U106: 26 | V106: 4.0000000000000001e-002 | W106: 0.121 | X106: 0.115 | Y106: 53 | Z106: 3.16 | AA106: 3.2099999999999997e-002 | AB106: 2.5499999999999998e-002 | AC106: 6.1999999999999998e-003 | AD106: 4.1999999999999997e-003 | AE106: 81.57 | AF106: 84.92 | AG106: 0.63 | AH106: AA- | AI106: 6.59e-002 | AJ106: =H106+100*O106 -> 108.09999999999999 | AK106: 107.8 | AL106: 16 | AM106: 22.9 | AN106: 53 | AO106: -2.2000000000000002e-002 | AP106: 10 | AQ106: 祥鑫转债!
A107: 47 | B107: 113610 | C107: 灵康转债 | D107: 603669 | E107: 灵康药业 | F107: 医药 | G107: 化学制药 | H107: 101.67 | I107: -8.9999999999999998e-004 | J107: -3.4999999999999996e-003 | K107: 8.7 | L107: -6.8000000000000005e-003 | M107: 121.1 | N107: 8.81 | O107: 2.9999999999999999e-002 | P107: 98.75 | Q107: 2月6天 | R107: 5.66年 | S107: 3.67年 | T107: 5.25 | U107: 5.3 | V107: 1.e-002 | W107: 8.5000000000000006e-002 | X107: 8.4000000000000005e-002 | Y107: 62 | Z107: 4.55 | AA107: 3.2000000000000001e-002 | AB107: 2.53e-002 | AC107: 6.0000000000000001e-003 | AD107: 4.0000000000000001e-003 | AE107: 81.66 | AF107: 85.01 | AG107: 0.65 | AH107: AA- | AI107: 6.59e-002 | AJ107: =H107+100*O107 -> 104.67 | AK107: 104.6 | AL107: 10 | AM107: 19.6 | AN107: 31 | AO107: 6.9000000000000006e-002 | AP107: 17 | AQ107: 灵康转债
A108: 26 | B108: 123089 | C108: 九洲转2! | D108: 300040 | E108: 九洲集团 | F108: 能源电力 | G108: 电力设备 | H108: 101.4 | I108: -1.34e-002 | J108: -1.8e-003 | K108: 7.35 | L108: -2.52e-002 | M108: 121 | N108: 8 | O108: 0.10400000000000001 | P108: 91.88 | Q108: 2月24天 | R108: 5.72年 | S108: 3.72年 | T108: 5 | U108: 16 | V108: 3.1e-002 | W108: 0.17899999999999999 | X108: 0.16399999999999998 | Y108: 28 | Z108: 1.28 | AA108: 3.2000000000000001e-002 | AB108: 2.5399999999999999e-002 | AC108: 6.4000000000000003e-003 | AD108: 4.4000000000000003e-003 | AE108: 81.29 | AF108: 84.62 | AG108: 0.6 | AH108: AA- | AI108: 6.59e-002 | AJ108: =H108+100*O108 -> 111.80000000000001 | AK108: 110.9 | AL108: 26 | AM108: 26.3 | AN108: 82 | AO108: -6.0999999999999999e-002 | AP108: 12 | AQ108: 九洲转2!
A109: 263 | B109: 110056 | C109: 亨通转债! | D109: 600487 | E109: 亨通光电 | F109: 通信互联 | G109: 通信设备 | H109: 101.17 | I109: 8.9999999999999998e-004 | J109: 4.0000000000000002e-004 | K109: 12.28 | L109: 4.0999999999999995e-003 | M109: 114.3 | N109: 15.01 | O109: 0.23699999999999999 | P109: 81.81 | Q109: 转股中 | R109: 3.96年 | S109: 1.96年 | T109: 17.1 | U109: 8.7 | V109: 5.0000000000000001e-003 | W109: 5.9000000000000004e-002 | X109: 4.8000000000000001e-002 | Y109: 290 | Z109: 1.59 | AA109: 3.1899999999999998e-002 | AB109: 2.5099999999999997e-002 | AC109: 7.6e-003 | AD109: 5.0000000000000001e-003 | AE109: 94.43 | AF109: 97.76 | AG109: 0.31 | AH109: AA+ | AI109: 4.0999999999999995e-002 | AJ109: =H109+100*O109 -> 124.87 | AK109: 120.5 | AL109: 109 | AM109: 22.8 | AN109: 52 | AO109: -1.6e-002 | AP109: 30 | AQ109: 亨通转债!
A110: 51 | B110: 113609 | C110: 永安转债! | D110: 603776 | E110: 永安行 | F110: 城市公用 | G110: 其他 | H110: 101.27 | I110: 5.1999999999999998e-003 | J110: 7.0999999999999995e-003 | K110: 20.15 | L110: 1.8700000000000001e-002 | M110: 120.5 | N110: 20.34 | O110: 2.2000000000000002e-002 | P110: 99.07 | Q110: 59天 | R110: 5.64年 | S110: 3.65年 | T110: 8.86 | U110: 30 | V110: 3.3000000000000002e-002 | W110: 0.23499999999999999 | X110: 0.23199999999999998 | Y110: 38 | Z110: 1.36 | AA110: 3.1899999999999998e-002 | AB110: 2.5399999999999999e-002 | AC110: 6.7000000000000002e-003 | AD110: 4.6999999999999993e-003 | AE110: 81.61 | AF110: 84.65 | AG110: 0.66 | AH110: AA- | AI110: 6.59e-002 | AJ110: =H110+100*O110 -> 103.47 | AK110: 103.5 | AL110: 7 | AM110: 18.8 | AN110: 24 | AO110: 4.0000000000000001e-002 | AP110: 17 | AQ110: 永安转债!
A111: 134 | B111: 123056 | C111: 雪榕转债 | D111: 300511 | E111: 雪榕生物 | F111: 农业 | G111: 种植业 | H111: 103.17 | I111: -1.2699999999999999e-002 | J111: 1.52e-002 | K111: 9.92 | L111: 5.1000000000000004e-003 | M111: 121.1 | N111: 11.89 | O111: 0.23699999999999999 | P111: 83.43 | Q111: 转股中 | R111: 5.22年 | S111: 3.23年 | T111: 5.85 | U111: 9.2 | V111: 1.4999999999999999e-002 | W111: 0.13300000000000001 | X111: 0.111 | Y111: 44 | Z111: 2.29 | AA111: 3.1800000000000002e-002 | AB111: 2.46e-002 | AC111: 2.5000000000000001e-003 | AD111: 1.e-004 | AE111: 83.98 | AF111: 87.42 | AG111: 0.5 | AH111: AA- | AI111: 6.59e-002 | AJ111: =H111+100*O111 -> 126.87 | AK111: 122.9 | AL111: 133 | AM111: 35.5 | AN111: 180 | AO111: -2.3e-002 | AP111: 16 | AQ111: 雪榕转债
A112: 15 | B112: 113042 | C112: 上银转债! | D112: 601229 | E112: 上海银行 | F112: 金融 | G112: 银行行业 | H112: 101.3 | I112: -1.e-004 | J112: -2.7000000000000001e-003 | K112: 8.66 | L112: -8.0000000000000002e-003 | M112: 120.9 | N112: 11.03 | O112: 0.28999999999999998 | P112: 78.51 | Q112: 3月28天 | R112: 5.81年 | S112: 无权 | T112: 200 | U112: 308 | V112: 1.4999999999999999e-002 | W112: 0.16300000000000001 | X112: 0.128 | Y112: 1230. | Z112: 0.74 | AA112: 3.1699999999999999e-002 | AB112: 2.52e-002 | AC112: 无权 | AD112: 无权 | AE112: 无权 | AF112: 96.89 | AG112: 0.35 | AH112: AAA | AI112: 3.9900000000000005e-002 | AJ112: =H112+100*O112 -> 130.29999999999998 | AK112: 124.1 | AL112: 148 | AM112: 27.2 | AN112: 90 | AO112: 6.0000000000000001e-003 | AP112: 10 | AQ112: 上银转债!
A113: 238 | B113: 128070 | C113: 智能转债! | D113: 2877 | E113: 智能自控 | F113: 机械装备 | G113: 通用设备 | H113: 103.503 | I113: 4.0999999999999995e-003 | J113: 2.3999999999999998e-003 | K113: 7.16 | L113: 1.5600000000000001e-002 | M113: 117.6 | N113: 9.51 | O113: 0.375 | P113: 75.29 | Q113: 转股中 | R113: 4.25年 | S113: 无权 | T113: 2.3 | U113: 23 | V113: 9.5000000000000001e-002 | W113: 9.6999999999999989e-002 | X113: 7.2999999999999995e-002 | Y113: 24 | Z113: 3.34 | AA113: 3.1300000000000001e-002 | AB113: 2.3700000000000002e-002 | AC113: 无权 | AD113: 无权 | AE113: 无权 | AF113: 87.19 | AG113: 0.42 | AH113: A+ | AI113: 7.4999999999999997e-002 | AJ113: =H113+100*O113 -> 141.00299999999999 | AK113: 131.7 | AL113: 215 | AM113: 44.5 | AN113: 247 | AO113: 4.4000000000000004e-002 | AP113: 31 | AQ113: 智能转债!
A114: 213 | B114: 113549 | C114: 白电转债 | D114: 603861 | E114: 白云电器 | F114: 能源电力 | G114: 电力设备 | H114: 99.87 | I114: 2.3e-003 | J114: -1.7000000000000001e-003 | K114: 7.85 | L114: 1.2999999999999999e-003 | M114: 114.8 | N114: 8.88 | O114: 0.13 | P114: 88.4 | Q114: 转股中 | R114: 4.62年 | S114: 2.62年 | T114: 8.8 | U114: 1.8 | V114: 2.e-003 | W114: 0.254 | X114: 0.22399999999999998 | Y114: 35 | Z114: 1.48 | AA114: 3.1200000000000002e-002 | AB114: 2.52e-002 | AC114: 1.23e-002 | AD114: 9.8999999999999991e-003 | AE114: 91.95 | AF114: 94.86 | AG114: 0.44 | AH114: AA | AI114: 4.2999999999999997e-002 | AJ114: =H114+100*O114 -> 112.87 | AK114: 111.3 | AL114: 29 | AM114: 16.5 | AN114: 11 | AO114: 2.2000000000000002e-002 | AP114: 36 | AQ114: 白电转债
A115: 99 | B115: 127021 | C115: 特发转2! | D115: 70 | E115: 特发信息 | F115: 通信互联 | G115: 通信设备 | H115: 99.38 | I115: 3.8e-003 | J115: -2.7000000000000001e-003 | K115: 6.93 | L115: 1.32e-002 | M115: 113.3 | N115: 12.33 | O115: 0.76800000000000002 | P115: 56.2 | Q115: 转股中 | R115: 4.35年 | S115: 2.35年 | T115: 5.5 | U115: 1.3 | V115: 2.e-003 | W115: 9.6000000000000002e-002 | X115: 5.4000000000000006e-002 | Y115: 57 | Z115: 1.99 | AA115: 3.1e-002 | AB115: 2.53e-002 | AC115: 1.0700000000000001e-002 | AD115: 9.0000000000000011e-003 | AE115: 91.85 | AF115: 94.58 | AG115: 0.08 | AH115: AA | AI115: 4.2999999999999997e-002 | AJ115: =H115+100*O115 -> 176.18000000000001 | AK115: 142.6 | AL115: 278 | AM115: 48 | AN115: 264 | AO115: -2.e-002 | AP115: 9 | AQ115: 特发转2!
A116: 125 | B116: 110071 | C116: 湖盐转债! | D116: 600929 | E116: 雪天盐业 | F116: 食品饮料 | G116: 食品饮料 | H116: 98.43 | I116: -1.8e-003 | J116: 2.5999999999999999e-003 | K116: 5.38 | L116: 1.9e-003 | M116: 115.2 | N116: 6.6 | O116: 0.20800000000000002 | P116: 81.52 | Q116: 转股中 | R116: 5.27年 | S116: 3.27年 | T116: 7.2 | U116: 2.3 | V116: 3.0000000000000001e-003 | W116: 0.14599999999999999 | X116: 0.11900000000000001 | Y116: 49 | Z116: 1.94 | AA116: 3.0899999999999997e-002 | AB116: 2.5499999999999998e-002 | AC116: 1.55e-002 | AD116: 1.3300000000000001e-002 | AE116: 89.3 | AF116: 91.83 | AG116: 0.4 | AH116: AA | AI116: 4.4900000000000002e-002 | AJ116: =H116+100*O116 -> 119.23 | AK116: 115.3 | AL116: 56 | AM116: 23.5 | AN116: 61 | AO116: 1.e-003 | AP116: 15 | AQ116: 湖盐转债!
A117: 105 | B117: 123063 | C117: 大禹转债 | D117: 300021 | E117: 大禹节水 | F117: 化工 | G117: 橡胶塑料 | H117: 107.952 | I117: -4.0000000000000002e-004 | J117: -1.0500000000000001e-002 | K117: 5.04 | L117: -1.7500000000000002e-002 | M117: 126.5 | N117: 4.94 | O117: 5.7999999999999996e-002 | P117: 102.02 | Q117: 转股中 | R117: 5.32年 | S117: 4.32年 | T117: 6.38 | U117: 3.9 | V117: 6.0000000000000001e-003 | W117: 0.159 | X117: 0.16200000000000001 | Y117: 40 | Z117: 2.78 | AA117: 3.0899999999999997e-002 | AB117: 2.2400000000000003e-002 | AC117: -2.e-003 | AD117: -5.0000000000000001e-003 | AE117: 80.8 | AF117: 90.78 | AG117: 0.62 | AH117: AA- | AI117: 6.59e-002 | AJ117: =H117+100*O117 -> 113.752 | AK117: 113.9 | AL117: 41 | AM117: 23.1 | AN117: 55 | AO117: -3.4000000000000002e-002 | AP117: 16 | AQ117: 大禹转债
A118: 333 | B118: 113014 | C118: 林洋转债! | D118: 601222 | E118: 林洋能源 | F118: 能源电力 | G118: 电力设备 | H118: 101.29 | I118: -2.0000000000000001e-004 | J118: -5.1999999999999998e-003 | K118: 6.93 | L118: -2.2599999999999999e-002 | M118: 109.3 | N118: 8.54 | O118: 0.248 | P118: 81.15 | Q118: 转股中 | R118: 2.57年 | S118: 0.57年 | T118: 30 | U118: 9.3 | V118: 3.0000000000000001e-003 | W118: 0.248 | X118: 0.20100000000000001 | Y118: 121 | Z118: 1.16 | AA118: 3.0600000000000002e-002 | AB118: 2.35e-002 | AC118: 6.8999999999999999e-003 | AD118: 2.e-003 | AE118: 98.79 | AF118: 98.59 | AG118: 0.24 | AH118: AA | AI118: 4.1700000000000001e-002 | AJ118: =H118+100*O118 -> 126.09 | AK118: 121.4 | AL118: 118 | AM118: 22.6 | AN118: 50 | AO118: -3.3000000000000002e-002 | AP118: 30 | AQ118: 林洋转债!
A119: 321 | B119: 123004 | C119: 铁汉转债! | D119: 300197 | E119: 铁汉生态 | F119: 城市公用 | G119: 生态环境 | H119: 100.37 | I119: -6.8000000000000005e-003 | J119: 4.8999999999999998e-003 | K119: 3.28 | L119: -6.0999999999999995e-003 | M119: 108.8 | N119: 3.82 | O119: 0.16899999999999998 | P119: 85.86 | Q119: 转股中 | R119: 2.71年 | S119: 0.71年 | T119: 8.03 | U119: 10 | V119: 1.2e-002 | W119: 8.6999999999999994e-002 | X119: 7.400000000000001e-002 | Y119: 93 | Z119: 1.49 | AA119: 3.0600000000000002e-002 | AB119: 2.4300000000000002e-002 | AC119: 1.34e-002 | AD119: 9.8999999999999991e-003 | AE119: 97.98 | AF119: 97.54 | AG119: 0.32 | AH119: AA | AI119: 4.1700000000000001e-002 | AJ119: =H119+100*O119 -> 117.27000000000001 | AK119: 114.9 | AL119: 52 | AM119: 16.9 | AN119: 15 | AO119: -3.5000000000000003e-002 | AP119: 48 | AQ119: 铁汉转债!
A120: 31 | B120: 123087 | C120: 明电转债! | D120: 300739 | E120: 明阳电路 | F120: 电子 | G120: 元器件制 | H120: 102.55 | I120: 1.03e-002 | J120: 5.5000000000000005e-003 | K120: 15.33 | L120: 2.6099999999999998e-002 | M120: 121.2 | N120: 16.62 | O120: 0.11199999999999999 | P120: 92.24 | Q120: 2月20天 | R120: 5.70年 | S120: 4.70年 | T120: 6.73 | U120: 6.9 | V120: 1.e-002 | W120: 0.157 | X120: 0.14499999999999999 | Y120: 43 | Z120: 3.12 | AA120: 3.04e-002 | AB120: 2.3700000000000002e-002 | AC120: 8.3000000000000001e-003 | AD120: 5.6999999999999993e-003 | AE120: 78.62 | AF120: 84.89 | AG120: 0.61 | AH120: AA- | AI120: 6.59e-002 | AJ120: =H120+100*O120 -> 113.75 | AK120: 112.9 | AL120: 34 | AM120: 28 | AN120: 104 | AO120: 5.0000000000000001e-003 | AP120: 6 | AQ120: 明电转债!
A121: 220 | B121: 110059 | C121: 浦发转债! | D121: 600000 | E121: 浦发银行 | F121: 金融 | G121: 银行行业 | H121: 103 | I121: 0. | J121: -2.8999999999999998e-003 | K121: 10.76 | L121: -1.1899999999999999e-002 | M121: 117.6 | N121: 14.45 | O121: 0.38299999999999995 | P121: 74.46 | Q121: 转股中 | R121: 4.57年 | S121: 无权 | T121: 500 | U121: 176 | V121: 3.0000000000000001e-003 | W121: 0.158 | X121: 0.11800000000000001 | Y121: 3158. | Z121: 0.6 | AA121: 3.0299999999999997e-002 | AB121: 2.3199999999999998e-002 | AC121: 无权 | AD121: 无权 | AE121: 无权 | AF121: 99.66 | AG121: 0.25 | AH121: AAA | AI121: 3.7999999999999999e-002 | AJ121: =H121+100*O121 -> 141.30000000000001 | AK121: 131.5 | AL121: 211 | AM121: 31.9 | AN121: 146 | AO121: -6.0000000000000001e-003 | AP121: 69 | AQ121: 浦发转债!
A122: 270 | B122: 113021 | C122: 中信转债! | D122: 601998 | E122: 中信银行 | F122: 金融 | G122: 银行行业 | H122: 105.5 | I122: 5.0000000000000001e-004 | J122: -3.8e-003 | K122: 5.34 | L122: -1.4800000000000001e-002 | M122: 118 | N122: 6.98 | O122: 0.379 | P122: 76.5 | Q122: 转股中 | R122: 3.92年 | S122: 无权 | T122: 400 | U122: 41 | V122: 1.e-003 | W122: 0.153 | X122: 0.11699999999999999 | Y122: 2613. | Z122: 0.56 | AA122: 2.98e-002 | AB122: 2.1400000000000002e-002 | AC122: 无权 | AD122: 无权 | AE122: 无权 | AF122: 102.36 | AG122: 0.22 | AH122: AAA | AI122: 3.7999999999999999e-002 | AJ122: =H122+100*O122 -> 143.40000000000001 | AK122: 134.5 | AL122: 235 | AM122: 32.1 | AN122: 149 | AO122: -2.e-003 | AP122: 48 | AQ122: 中信转债!
A123: 111 | B123: 128122 | C123: 兴森转债! | D123: 2436 | E123: 兴森科技 | F123: 电子 | G123: 元器件制 | H123: 100.001 | I123: -1.5e-003 | J123: 6.8000000000000005e-003 | K123: 9.66 | L123: 2.7699999999999999e-002 | M123: 113.3 | N123: 14.18 | O123: 0.46799999999999997 | P123: 68.12 | Q123: 转股中 | R123: 4.30年 | S123: 3.31年 | T123: 2.69 | U123: 10 | V123: 3.7999999999999999e-002 | W123: 1.9e-002 | X123: 1.3000000000000001e-002 | Y123: 144 | Z123: 4.55 | AA123: 2.98e-002 | AB123: 2.4e-002 | AC123: 1.04e-002 | AD123: 8.3999999999999995e-003 | AE123: 89.66 | AF123: 94.74 | AG123: 0.19 | AH123: AA | AI123: 4.2999999999999997e-002 | AJ123: =H123+100*O123 -> 146.80099999999999 | AK123: 131.9 | AL123: 216 | AM123: 37.1 | AN123: 193 | AO123: 5.7999999999999996e-002 | AP123: 10 | AQ123: 兴森转债!
A124: 255 | B124: 113532 | C124: XD海环转! | D124: 603817 | E124: 海峡环保 | F124: 城市公用 | G124: 三废处理 | H124: 100.16 | I124: 6.9999999999999993e-003 | J124: -8.1000000000000013e-003 | K124: 6.17 | L124: -3.2000000000000002e-003 | M124: 112.9 | N124: 7.69 | O124: 0.248 | P124: 80.23 | Q124: 转股中 | R124: 3.997年 | S124: 2年0.1天 | T124: 4.6 | U124: 3.7 | V124: 8.0000000000000002e-003 | W124: 0.16600000000000001 | X124: 0.13300000000000001 | Y124: 28 | Z124: 1.63 | AA124: 2.9600000000000001e-002 | AB124: 2.3700000000000002e-002 | AC124: 1.2199999999999999e-002 | AD124: 9.5999999999999992e-003 | AE124: 93.89 | AF124: 95.19 | AG124: 0.33 | AH124: AA | AI124: 4.2999999999999997e-002 | AJ124: =H124+100*O124 -> 124.95999999999999 | AK124: 120.1 | AL124: 106 | AM124: 24.9 | AN124: 72 | AO124: 2.8999999999999998e-002 | AP124: 26 | AQ124: XD海环转!
A125: 200 | B125: 113030 | C125: 东风转债! | D125: 601515 | E125: 东风股份 | F125: 造纸包装 | G125: 包装材料 | H125: 102.21 | I125: 1.8e-003 | J125: -3.0000000000000001e-003 | K125: 5.59 | L125: -3.5999999999999999e-003 | M125: 116.9 | N125: 6.75 | O125: 0.23399999999999999 | P125: 82.81 | Q125: 转股中 | R125: 4.73年 | S125: 2.73年 | T125: 2.95 | U125: 2.5 | V125: 8.0000000000000002e-003 | W125: 4.0000000000000001e-002 | X125: 3.3000000000000002e-002 | Y125: 75 | Z125: 1.79 | AA125: 2.9399999999999999e-002 | AB125: 2.2799999999999997e-002 | AC125: 4.0000000000000001e-003 | AD125: 1.7000000000000001e-003 | AE125: 91.64 | AF125: 96.17 | AG125: 0.36 | AH125: AA | AI125: 4.2999999999999997e-002 | AJ125: =H125+100*O125 -> 125.60999999999999 | AK125: 121.6 | AL125: 119 | AM125: 25.4 | AN125: 75 | AO125: -4.0000000000000001e-002 | AP125: 17 | AQ125: 东风转债!
A126: 118 | B126: 113593 | C126: 沪工转债 | D126: 603131 | E126: 上海沪工 | F126: 机械装备 | G126: 通用设备 | H126: 104.67 | I126: 3.4000000000000002e-003 | J126: 1.5e-003 | K126: 18.8 | L126: 8.0000000000000002e-003 | M126: 121.6 | N126: 21.32 | O126: 0.187 | P126: 88.18 | Q126: 转股中 | R126: 5.30年 | S126: 3.30年 | T126: 4 | U126: 3 | V126: 6.9999999999999993e-003 | W126: 6.7000000000000004e-002 | X126: 5.9000000000000004e-002 | Y126: 60 | Z126: 4.85 | AA126: 2.9399999999999999e-002 | AB126: 2.2099999999999998e-002 | AC126: -2.0000000000000001e-004 | AD126: -2.7000000000000001e-003 | AE126: 81.17 | AF126: 82.92 | AG126: 0.6 | AH126: A+ | AI126: 7.690000000000001e-002 | AJ126: =H126+100*O126 -> 123.37 | AK126: 121.2 | AL126: 115 | AM126: 38.2 | AN126: 203 | AO126: -2.7999999999999997e-002 | AP126: 9 | AQ126: 沪工转债
A127: 182 | B127: 113567 | C127: 君禾转债! | D127: 603617 | E127: 君禾股份 | F127: 机械装备 | G127: 通用设备 | H127: 103.39 | I127: 5.1999999999999998e-003 | J127: 2.e-003 | K127: 10.62 | L127: 1.1399999999999999e-002 | M127: 118.8 | N127: 11.46 | O127: 0.11599999999999999 | P127: 92.67 | Q127: 转股中 | R127: 4.92年 | S127: 2.92年 | T127: 2.1 | U127: 2.4 | V127: 1.1000000000000001e-002 | W127: 9.9000000000000005e-002 | X127: 9.1999999999999998e-002 | Y127: 21 | Z127: 3.29 | AA127: 2.9300000000000003e-002 | AB127: 2.23e-002 | AC127: 1.8e-003 | AD127: -7.000000000000001e-004 | AE127: 83.36 | AF127: 83.91 | AG127: 0.62 | AH127: A+ | AI127: 7.4999999999999997e-002 | AJ127: =H127+100*O127 -> 114.98999999999999 | AK127: 114.1 | AL127: 46 | AM127: 30.2 | AN127: 130 | AO127: 2.3e-002 | AP127: 35 | AQ127: 君禾转债!
A128: 108 | B128: 123062 | C128: 三超转债 | D128: 300554 | E128: 三超新材 | F128: 机械装备 | G128: 通用设备 | H128: 103.21 | I128: 5.9999999999999995e-004 | J128: 3.4000000000000002e-003 | K128: 15.49 | L128: 5.7999999999999996e-003 | M128: 119.7 | N128: 17.17 | O128: 0.14400000000000002 | P128: 90.22 | Q128: 转股中 | R128: 5.32年 | S128: 3.32年 | T128: 1.95 | U128: 4.7 | V128: 2.3e-002 | W128: 0.13400000000000001 | X128: 0.121 | Y128: 14 | Z128: 2.78 | AA128: 2.8999999999999998e-002 | AB128: 2.23e-002 | AC128: 4.0000000000000001e-003 | AD128: 1.4000000000000002e-003 | AE128: 78.55 | AF128: 77.75 | AG128: 0.67 | AH128: A | AI128: 8.6899999999999991e-002 | AJ128: =H128+100*O128 -> 117.61 | AK128: 116.2 | AL128: 64 | AM128: 37.7 | AN128: 198 | AO128: -2.9999999999999999e-002 | AP128: 17 | AQ128: 三超转债
A129: 166 | B129: 113033 | C129: 利群转债! | D129: 601366 | E129: 利群股份 | F129: 商业零售 | G129: 商场 | H129: 100.15 | I129: -1.e-004 | J129: -4.6999999999999993e-003 | K129: 6.76 | L129: -8.8000000000000005e-003 | M129: 114.9 | N129: 7.01 | O129: 3.9e-002 | P129: 96.43 | Q129: 转股中 | R129: 4.99年 | S129: 2.997年 | T129: 18 | U129: 6.8 | V129: 4.0000000000000001e-003 | W129: 0.309 | X129: 0.29799999999999999 | Y129: 58 | Z129: 1.31 | AA129: 2.8399999999999998e-002 | AB129: 2.2799999999999997e-002 | AC129: 1.0200000000000001e-002 | AD129: 8.1000000000000013e-003 | AE129: 90.6 | AF129: 93.47 | AG129: 0.54 | AH129: AA | AI129: 4.2999999999999997e-002 | AJ129: =H129+100*O129 -> 104.05000000000001 | AK129: 103.9 | AL129: 8 | AM129: 10.4 | AN129: 6 | AO129: 4.5999999999999999e-002 | AP129: 45 | AQ129: 利群转债!
A130: 9 | B130: 123100 | C130: 朗科转债 | D130: 300543 | E130: 朗科智能 | F130: 电子 | G130: 电子产品 | H130: 100.028 | I130: 0. | J130: 4.0000000000000001e-003 | K130: 13.61 | L130: 6.7000000000000002e-003 | M130: 117.5 | N130: 15.34 | O130: 0.127 | P130: 88.72 | Q130: 4月22天 | R130: 5.86年 | S130: 3.86年 | T130: 3.8 | U130: 13 | V130: 3.3000000000000002e-002 | W130: 0.13500000000000001 | X130: 0.12 | Y130: 28 | Z130: 3.42 | AA130: 2.8399999999999998e-002 | AB130: 2.29e-002 | AC130: 9.3999999999999986e-003 | AD130: 7.4999999999999997e-003 | AE130: 80.52 | AF130: 81.45 | AG130: 0.61 | AH130: AA- | AI130: 6.59e-002 | AJ130: =H130+100*O130 -> 112.72800000000001 | AK130: 111.3 | AL130: 28 | AM130: 29.9 | AN130: 128 | AO130: -4.4999999999999998e-002 | AP130: 5 | AQ130: 朗科转债
A131: 208 | B131: 128083 | C131: 新北转债! | D131: 2376 | E131: 新北洋 | F131: 电子 | G131: 电子产品 | H131: 101.106 | I131: 1.e-004 | J131: -1.1999999999999999e-003 | K131: 9.48 | L131: -3.2000000000000002e-003 | M131: 114.9 | N131: 11.7 | O131: 0.248 | P131: 81.03 | Q131: 转股中 | R131: 4.69年 | S131: 2.70年 | T131: 8.77 | U131: 0.8 | V131: 1.e-003 | W131: 0.13900000000000001 | X131: 0.113 | Y131: 63 | Z131: 1.87 | AA131: 2.8199999999999999e-002 | AB131: 2.2200000000000001e-002 | AC131: 7.9000000000000008e-003 | AD131: 5.6000000000000008e-003 | AE131: 91.76 | AF131: 94.66 | AG131: 0.36 | AH131: AA | AI131: 4.2999999999999997e-002 | AJ131: =H131+100*O131 -> 125.90599999999999 | AK131: 121.2 | AL131: 116 | AM131: 26.5 | AN131: 84 | AO131: -1.3999999999999999e-002 | AP131: 18 | AQ131: 新北转债!
A132: 143 | B132: 113584 | C132: 家悦转债! | D132: 603708 | E132: 家家悦 | F132: 商业零售 | G132: 超市 | H132: 100.19 | I132: 5.9999999999999995e-004 | J132: 2.0000000000000001e-004 | K132: 21.53 | L132: 7.4999999999999997e-003 | M132: 115.3 | N132: 37.97 | O132: 0.76700000000000002 | P132: 56.7 | Q132: 转股中 | R132: 5.17年 | S132: 3.18年 | T132: 6.45 | U132: 2 | V132: 3.0000000000000001e-003 | W132: 4.9000000000000002e-002 | X132: 2.7999999999999997e-002 | Y132: 131 | Z132: 4.36 | AA132: 2.81e-002 | AB132: 2.2599999999999999e-002 | AC132: 1.0800000000000001e-002 | AD132: 8.5000000000000006e-003 | AE132: 89.78 | AF132: 92.31 | AG132: 0.11 | AH132: AA | AI132: 4.4900000000000002e-002 | AJ132: =H132+100*O132 -> 176.88999999999999 | AK132: 143.7 | AL132: 283 | AM132: 51.4 | AN132: 282 | AO132: -3.6000000000000004e-002 | AP132: 10 | AQ132: 家悦转债!
A133: 156 | B133: 123049 | C133: 维尔转债 | D133: 300190 | E133: 维尔利 | F133: 城市公用 | G133: 三废处理 | H133: 108.99 | I133: -1.18e-002 | J133: -3.9000000000000003e-003 | K133: 7.76 | L133: -2.5099999999999997e-002 | M133: 124.8 | N133: 7.48 | O133: 5.0999999999999997e-002 | P133: 103.74 | Q133: 转股中 | R133: 5年10天 | S133: 3年11天 | T133: 9.17 | U133: 5.5 | V133: 5.0000000000000001e-003 | W133: 0.151 | X133: 0.157 | Y133: 61 | Z133: 1.44 | AA133: 2.7999999999999997e-002 | AB133: 1.95e-002 | AC133: -1.26e-002 | AD133: -1.54e-002 | AE133: 85.66 | AF133: 91.32 | AG133: 0.63 | AH133: AA- | AI133: 6.59e-002 | AJ133: =H133+100*O133 -> 114.08999999999999 | AK133: 114.2 | AL133: 48 | AM133: 22.9 | AN133: 54 | AO133: -3.4000000000000002e-002 | AP133: 15 | AQ133: 维尔转债
A134: 198 | B134: 123039 | C134: 开润转债! | D134: 300577 | E134: 开润股份 | F134: 服装纺织 | G134: 纺织行业 | H134: 106.597 | I134: 4.5000000000000005e-003 | J134: 5.6999999999999993e-003 | K134: 25.06 | L134: 1.9900000000000001e-002 | M134: 121 | N134: 30 | O134: 0.27600000000000002 | P134: 83.53 | Q134: 转股中 | R134: 4.73年 | S134: 2.73年 | T134: 2.22 | U134: 2.6 | V134: 1.1000000000000001e-002 | W134: 3.7000000000000005e-002 | X134: 3.1e-002 | Y134: 60 | Z134: 3.97 | AA134: 2.7799999999999998e-002 | AB134: 1.9900000000000001e-002 | AC134: -8.3000000000000001e-003 | AD134: -1.1000000000000001e-002 | AE134: 84.59 | AF134: 86.61 | AG134: 0.51 | AH134: A+ | AI134: 7.4999999999999997e-002 | AJ134: =H134+100*O134 -> 134.197 | AK134: 129.7 | AL134: 200 | AM134: 43 | AN134: 236 | AO134: 6.9999999999999993e-003 | AP134: 24 | AQ134: 开润转债!
A135: 186 | B135: 113565 | C135: 宏辉转债 | D135: 603336 | E135: 宏辉果蔬 | F135: 农业 | G135: 农产品加 | H135: 103.51 | I135: 2.e-003 | J135: -2.e-003 | K135: 9.22 | L135: 0. | M135: 117.8 | N135: 10 | O135: 0.12300000000000001 | P135: 92.2 | Q135: 转股中 | R135: 4.90年 | S135: 2.90年 | T135: 2.25 | U135: 5.6 | V135: 2.4e-002 | W135: 7.2000000000000008e-002 | X135: 6.7000000000000004e-002 | Y135: 31 | Z135: 3.02 | AA135: 2.7300000000000001e-002 | AB135: 2.07e-002 | AC135: 7.000000000000001e-004 | AD135: -1.7000000000000001e-003 | AE135: 85.9 | AF135: 87.48 | AG135: 0.58 | AH135: AA- | AI135: 6.4000000000000001e-002 | AJ135: =H135+100*O135 -> 115.81 | AK135: 114.8 | AL135: 51 | AM135: 27.3 | AN135: 92 | AO135: -2.e-002 | AP135: 23 | AQ135: 宏辉转债
A136: 42 | B136: 128140 | C136: 润建转债! | D136: 2929 | E136: 润建股份 | F136: 通信互联 | G136: 通信设备 | H136: 99.145 | I136: -5.9999999999999995e-004 | J136: 1.e-004 | K136: 23.72 | L136: -8.0000000000000004e-004 | M136: 115.2 | N136: 26.55 | O136: 0.11 | P136: 89.34 | Q136: 2月10天 | R136: 5.68年 | S136: 3.68年 | T136: 10.9 | U136: 3.5 | V136: 3.0000000000000001e-003 | W136: 0.20800000000000002 | X136: 0.18600000000000003 | Y136: 52 | Z136: 1.76 | AA136: 2.7300000000000001e-002 | AB136: 2.23e-002 | AC136: 1.1899999999999999e-002 | AD136: 9.8999999999999991e-003 | AE136: 87.71 | AF136: 90.18 | AG136: 0.51 | AH136: AA | AI136: 4.4900000000000002e-002 | AJ136: =H136+100*O136 -> 110.145 | AK136: 108.9 | AL136: 21 | AM136: 18.8 | AN136: 23 | AO136: -3.5000000000000003e-002 | AP136: 12 | AQ136: 润建转债!
A137: 86 | B137: 128131 | C137: 崇达转2! | D137: 2815 | E137: 崇达技术 | F137: 电子 | G137: 元器件制 | H137: 99.85 | I137: 6.6e-003 | J137: -1.9e-003 | K137: 12.42 | L137: 2.3900000000000001e-002 | M137: 115.2 | N137: 19.54 | O137: 0.57100000000000006 | P137: 63.56 | Q137: 转股中 | R137: 5.43年 | S137: 3.43年 | T137: 14 | U137: 5.5 | V137: 4.0000000000000001e-003 | W137: 0.128 | X137: 8.1000000000000003e-002 | Y137: 110 | Z137: 2.74 | AA137: 2.7200000000000002e-002 | AB137: 2.2000000000000002e-002 | AC137: 1.0700000000000001e-002 | AD137: 8.6e-003 | AE137: 88.67 | AF137: 91.18 | AG137: 0.19 | AH137: AA | AI137: 4.4900000000000002e-002 | AJ137: =H137+100*O137 -> 156.94999999999999 | AK137: 136.1 | AL137: 243 | AM137: 45 | AN137: 250 | AO137: 1.3999999999999999e-002 | AP137: 7 | AQ137: 崇达转2!
A138: 77 | B138: 123068 | C138: 弘信转债 | D138: 300657 | E138: 弘信电子 | F138: 电子 | G138: 元器件制 | H138: 104.8 | I138: 1.2e-002 | J138: 3.6299999999999999e-002 | K138: 17.2 | L138: 7.9699999999999993e-002 | M138: 121.2 | N138: 18.45 | O138: 0.124 | P138: 93.22 | Q138: 19天 | R138: 5.53年 | S138: 3.54年 | T138: 5.7 | U138: 29 | V138: 4.9000000000000002e-002 | W138: 9.6999999999999989e-002 | X138: 8.9999999999999997e-002 | Y138: 59 | Z138: 4.02 | AA138: 2.7200000000000002e-002 | AB138: 2.0400000000000001e-002 | AC138: -1.8e-003 | AD138: -3.9000000000000003e-003 | AE138: 82.43 | AF138: 85.8 | AG138: 0.61 | AH138: AA- | AI138: 6.59e-002 | AJ138: =H138+100*O138 -> 117.2 | AK138: 116.4 | AL138: 65 | AM138: 30.6 | AN138: 133 | AO138: 4.9000000000000002e-002 | AP138: 7 | AQ138: 弘信转债
A139: 211 | B139: 128081 | C139: 海亮转债! | D139: 2203 | E139: 海亮股份 | F139: 有色金属 | G139: 铜金属 | H139: 101.88 | I139: 1.9e-003 | J139: -3.4999999999999996e-003 | K139: 8.94 | L139: -3.3e-003 | M139: 114.9 | N139: 9.76 | O139: 0.11199999999999999 | P139: 91.6 | Q139: 转股中 | R139: 4.64年 | S139: 2.64年 | T139: 31.5 | U139: 7.1 | V139: 2.e-003 | W139: 0.17999999999999999 | X139: 0.16500000000000001 | Y139: 175 | Z139: 1.94 | AA139: 2.6800000000000001e-002 | AB139: 2.0799999999999999e-002 | AC139: 5.3e-003 | AD139: 3.0000000000000001e-003 | AE139: 91.99 | AF139: 94.89 | AG139: 0.48 | AH139: AA | AI139: 4.2999999999999997e-002 | AJ139: =H139+100*O139 -> 113.08 | AK139: 112.2 | AL139: 31 | AM139: 17.3 | AN139: 17 | AO139: -3.0000000000000001e-003 | AP139: 51 | AQ139: 海亮转债!
A140: 40 | B140: 127026 | C140: 超声转债! | D140: 823 | E140: 超声电子 | F140: 电子 | G140: 元器件制 | H140: 97.57 | I140: 6.4000000000000003e-003 | J140: 1.9e-003 | K140: 10.03 | L140: 2.0299999999999999e-002 | M140: 113.1 | N140: 12.85 | O140: 0.25 | P140: 78.05 | Q140: 2月13天 | R140: 5.68年 | S140: 3.69年 | T140: 7 | U140: 4.8 | V140: 6.9999999999999993e-003 | W140: 0.13 | X140: 0.10099999999999999 | Y140: 54 | Z140: 1.46 | AA140: 2.6800000000000001e-002 | AB140: 2.2400000000000003e-002 | AC140: 1.5800000000000002e-002 | AD140: 1.3999999999999999e-002 | AE140: 87.6 | AF140: 88.52 | AG140: 0.41 | AH140: AA | AI140: 4.4900000000000002e-002 | AJ140: =H140+100*O140 -> 122.56999999999999 | AK140: 117.1 | AL140: 70 | AM140: 28.6 | AN140: 111 | AO140: 1.3000000000000001e-002 | AP140: 8 | AQ140: 超声转债!
A141: 13 | B141: 123096 | C141: 思创转债 | D141: 300078 | E141: 思创医惠 | F141: 通信互联 | G141: 物联网 | H141: 106.666 | I141: 1.7000000000000001e-003 | J141: 2.2000000000000001e-003 | K141: 7.89 | L141: 6.4000000000000003e-003 | M141: 124 | N141: 8.27 | O141: 0.11800000000000001 | P141: 95.41 | Q141: 4月2天 | R141: 5.82年 | S141: 3.82年 | T141: 8.17 | U141: 25 | V141: 2.8999999999999998e-002 | W141: 0.11900000000000001 | X141: 0.114 | Y141: 69 | Z141: 2.25 | AA141: 2.6699999999999998e-002 | AB141: 1.9599999999999999e-002 | AC141: -6.6e-003 | AD141: -8.5000000000000006e-003 | AE141: 80.78 | AF141: 86.16 | AG141: 0.62 | AH141: AA- | AI141: 6.59e-002 | AJ141: =H141+100*O141 -> 118.46599999999999 | AK141: 117.9 | AL141: 77 | AM141: 31.8 | AN141: 144 | AO141: 3.0000000000000001e-003 | AP141: 3 | AQ141: 思创转债
A142: 157 | B142: 110070 | C142: 凌钢转债! | D142: 600231 | E142: 凌钢股份 | F142: 钢铁 | G142: 炼钢 | H142: 103.55 | I142: -4.3e-003 | J142: -9.1000000000000004e-003 | K142: 2.56 | L142: -2.6600000000000002e-002 | M142: 117.8 | N142: 2.75 | O142: 0.11199999999999999 | P142: 93.09 | Q142: 转股中 | R142: 5年10天 | S142: 3年11天 | T142: 2.89 | U142: 18 | V142: 5.9999999999999998e-002 | W142: 4.0999999999999995e-002 | X142: 3.7999999999999999e-002 | Y142: 71 | Z142: 0.88 | AA142: 2.6600000000000002e-002 | AB142: 2.0099999999999996e-002 | AC142: 1.8e-003 | AD142: -7.000000000000001e-004 | AE142: 90.66 | AF142: 94.95 | AG142: 0.51 | AH142: AA | AI142: 4.4900000000000002e-002 | AJ142: =H142+100*O142 -> 114.75 | AK142: 114 | AL142: 43 | AM142: 19.1 | AN142: 27 | AO142: -1.3999999999999999e-002 | AP142: 20 | AQ142: 凌钢转债!
A143: 103 | B143: 128125 | C143: 华阳转债! | D143: 2949 | E143: 华阳国际 | F143: 建筑 | G143: 建筑工程 | H143: 103.461 | I143: 6.0000000000000001e-003 | J143: -4.3e-003 | K143: 20.48 | L143: 3.4000000000000002e-003 | M143: 118.5 | N143: 25.79 | O143: 0.30299999999999999 | P143: 79.41 | Q143: 转股中 | R143: 5.32年 | S143: 3.33年 | T143: 4.5 | U143: 2.5 | V143: 5.0000000000000001e-003 | W143: 0.11199999999999999 | X143: 8.900000000000001e-002 | Y143: 40 | Z143: 3.29 | AA143: 2.64e-002 | AB143: 2.0099999999999996e-002 | AC143: 1.1000000000000001e-003 | AD143: -1.1000000000000001e-003 | AE143: 83.29 | AF143: 84.97 | AG143: 0.48 | AH143: AA- | AI143: 6.59e-002 | AJ143: =H143+100*O143 -> 133.761 | AK143: 127.5 | AL143: 182 | AM143: 42.5 | AN143: 233 | AO143: -6.4000000000000001e-002 | AP143: 6 | AQ143: 华阳转债!
A144: 173 | B144: 123045 | C144: 雷迪转债 | D144: 300652 | E144: 雷迪克 | F144: 汽车 | G144: 零部件制 | H144: 105.03 | I144: 1.4000000000000002e-003 | J144: -1.e-003 | K144: 18.34 | L144: 5.0000000000000001e-004 | M144: 118.9 | N144: 20.13 | O144: 0.153 | P144: 91.11 | Q144: 转股中 | R144: 4.94年 | S144: 2.94年 | T144: 1.66 | U144: 12 | V144: 6.8000000000000005e-002 | W144: 9.6000000000000002e-002 | X144: 8.8000000000000009e-002 | Y144: 17 | Z144: 2.02 | AA144: 2.6000000000000002e-002 | AB144: 1.9099999999999999e-002 | AC144: -3.0000000000000001e-003 | AD144: -5.5000000000000005e-003 | AE144: 83.3 | AF144: 83.85 | AG144: 0.61 | AH144: A+ | AI144: 7.4999999999999997e-002 | AJ144: =H144+100*O144 -> 120.33 | AK144: 119 | AL144: 89 | AM144: 35.1 | AN144: 177 | AO144: -2.8999999999999998e-002 | AP144: 34 | AQ144: 雷迪转债
A145: 169 | B145: 110068 | C145: 龙净转债! | D145: 600388 | E145: 龙净环保 | F145: 城市公用 | G145: 三废处理 | H145: 101.33 | I145: -4.6999999999999993e-003 | J145: -4.8999999999999998e-003 | K145: 9.38 | L145: -2.1899999999999999e-002 | M145: 114.8 | N145: 10.73 | O145: 0.159 | P145: 87.42 | Q145: 转股中 | R145: 4.97年 | S145: 2.98年 | T145: 20 | U145: 8.5 | V145: 4.0000000000000001e-003 | W145: 0.19899999999999998 | X145: 0.17399999999999999 | Y145: 100 | Z145: 1.74 | AA145: 2.5899999999999999e-002 | AB145: 2.0299999999999999e-002 | AC145: 6.1999999999999998e-003 | AD145: 4.0999999999999995e-003 | AE145: 91.13 | AF145: 94.34 | AG145: 0.44 | AH145: AA+ | AI145: 4.0999999999999995e-002 | AJ145: =H145+100*O145 -> 117.23 | AK145: 115.2 | AL145: 54 | AM145: 20.9 | AN145: 37 | AO145: -1.3999999999999999e-002 | AP145: 31 | AQ145: 龙净转债!
A146: 5 | B146: 113620 | C146: N傲农转 | D146: 603363 | E146: 傲农生物 | F146: 农业 | G146: 畜牧业 | H146: 104.28 | I146: 4.2800000000000005e-002 | J146: 0. | K146: 14.12 | L146: 2.0199999999999999e-002 | M146: 121.1 | N146: 14.8 | O146: 9.3000000000000013e-002 | P146: 95.41 | Q146: 5月17天 | R146: 5.93年 | S146: 3.94年 | T146: 10 | U146: 781 | V146: 0.74400000000000011 | W146: 0.105 | X146: 0.10000000000000001 | Y146: 95 | Z146: 3.47 | AA146: 2.5899999999999999e-002 | AB146: 1.9699999999999999e-002 | AC146: -1.6000000000000001e-003 | AD146: -3.3e-003 | AE146: 86.64 | AF146: 93.71 | AG146: 0.54 | AH146: AA | AI146: 4.4900000000000002e-002 | AJ146: =H146+100*O146 -> 113.58 | AK146: 113.2 | AL146: 35 | AM146: 19.4 | AN146: 30 | AO146: 2.7000000000000003e-002 | AP146: 2 | AQ146: N傲农转
A147: 145 | B147: 123051 | C147: 今天转债 | D147: 300532 | E147: 今天国际 | F147: 计算机及 | G147: 软件开发 | H147: 108.017 | I147: -4.8999999999999998e-003 | J147: 5.6999999999999993e-003 | K147: 8.66 | L147: 1.1999999999999999e-003 | M147: 122.8 | N147: 8.8 | O147: 9.8000000000000004e-002 | P147: 98.41 | Q147: 转股中 | R147: 5.17年 | S147: 3.17年 | T147: 2.79 | U147: 3.7 | V147: 1.2e-002 | W147: 0.11800000000000001 | X147: 0.11599999999999999 | Y147: 24 | Z147: 2.9 | AA147: 2.58e-002 | AB147: 1.8000000000000002e-002 | AC147: -9.3999999999999986e-003 | AD147: -1.2e-002 | AE147: 82.07 | AF147: 84.58 | AG147: 0.65 | AH147: A+ | AI147: 7.690000000000001e-002 | AJ147: =H147+100*O147 -> 117.81699999999999 | AK147: 117.6 | AL147: 75 | AM147: 33 | AN147: 157 | AO147: -2.e-002 | AP147: 15 | AQ147: 今天转债
A148: 106 | B148: 128124 | C148: 科华转债! | D148: 2022 | E148: 科华生物 | F148: 医药 | G148: 生物制药 | H148: 96.78 | I148: 1.1000000000000001e-003 | J148: -5.0000000000000001e-004 | K148: 15.23 | L148: 2.e-003 | M148: 110.3 | N148: 21.51 | O148: 0.36700000000000005 | P148: 70.8 | Q148: 转股中 | R148: 5.32年 | S148: 3.32年 | T148: 7.38 | U148: 3.4 | V148: 5.0000000000000001e-003 | W148: 9.4e-002 | X148: 6.7000000000000004e-002 | Y148: 78 | Z148: 2.72 | AA148: 2.53e-002 | AB148: 2.1600000000000001e-002 | AC148: 1.83e-002 | AD148: 1.6500000000000001e-002 | AE148: 88.53 | AF148: 87.68 | AG148: 0.31 | AH148: AA | AI148: 4.4900000000000002e-002 | AJ148: =H148+100*O148 -> 133.48000000000002 | AK148: 122.8 | AL148: 131 | AM148: 34.2 | AN148: 169 | AO148: 1.8000000000000002e-002 | AP148: 17 | AQ148: 科华转债!
A149: 82 | B149: 128133 | C149: 奇正转债! | D149: 2287 | E149: 奇正藏药 | F149: 医药 | G149: 中药 | H149: 103.078 | I149: 3.2000000000000002e-003 | J149: -2.8999999999999998e-003 | K149: 23.86 | L149: 8.0000000000000004e-004 | M149: 117.3 | N149: 30.12 | O149: 0.30099999999999999 | P149: 79.22 | Q149: 转股中 | R149: 5.47年 | S149: 3.47年 | T149: 8 | U149: 4.1 | V149: 5.0000000000000001e-003 | W149: 6.3e-002 | X149: 5.0000000000000003e-002 | Y149: 127 | Z149: 5.27 | AA149: 2.4399999999999998e-002 | AB149: 1.8600000000000002e-002 | AC149: 2.e-003 | AD149: -1.e-004 | AE149: 88.61 | AF149: 92.68 | AG149: 0.37 | AH149: AA | AI149: 4.4900000000000002e-002 | AJ149: =H149+100*O149 -> 133.178 | AK149: 126.9 | AL149: 176 | AM149: 34.3 | AN149: 170 | AO149: 5.0000000000000001e-003 | AP149: 14 | AQ149: 奇正转债!
A150: 112 | B150: 113037 | C150: 紫银转债 | D150: 601860 | E150: 紫金银行 | F150: 金融 | G150: 银行行业 | H150: 102.33 | I150: 2.9999999999999997e-004 | J150: -2.9999999999999997e-004 | K150: 3.83 | L150: 0. | M150: 115.8 | N150: 4.75 | O150: 0.26899999999999996 | P150: 80.63 | Q150: 转股中 | R150: 5.30年 | S150: 无权 | T150: 45 | U150: 19 | V150: 4.0000000000000001e-003 | W150: 0.32100000000000001 | X150: 0.25900000000000001 | Y150: 140 | Z150: 0.99 | AA150: 2.41e-002 | AB150: 1.8600000000000002e-002 | AC150: 无权 | AD150: 无权 | AE150: 无权 | AF150: 93.11 | AG150: 0.39 | AH150: AA+ | AI150: 4.2900000000000001e-002 | AJ150: =H150+100*O150 -> 129.22999999999999 | AK150: 124 | AL150: 147 | AM150: 30.9 | AN150: 137 | AO150: -1.4999999999999999e-002 | AP150: 18 | AQ150: 紫银转债
A151: 330 | B151: 128018 | C151: 时达转债! | D151: 2527 | E151: 新时达 | F151: 机械装备 | G151: 机器人及 | H151: 102.99 | I151: -7.8000000000000005e-003 | J151: 6.3e-003 | K151: 5.9 | L151: -6.7000000000000002e-003 | M151: 109.3 | N151: 7.42 | O151: 0.29499999999999998 | P151: 79.51 | Q151: 转股中 | R151: 2.60年 | S151: 0.60年 | T151: 4.04 | U151: 0.5 | V151: 1.e-003 | W151: 0.11 | X151: 8.8000000000000009e-002 | Y151: 37 | Z151: 1.44 | AA151: 2.3599999999999999e-002 | AB151: 1.67e-002 | AC151: -1.5100000000000001e-002 | AD151: -1.9699999999999999e-002 | AE151: 98.68 | AF151: 98.48 | AG151: 0.22 | AH151: AA | AI151: 4.1700000000000001e-002 | AJ151: =H151+100*O151 -> 132.49000000000001 | AK151: 126.5 | AL151: 172 | AM151: 27.8 | AN151: 100 | AO151: -1.e-002 | AP151: 38 | AQ151: 时达转债!
A152: 307 | B152: 127006 | C152: 敖东转债! | D152: 623 | E152: 吉林敖东 | F152: 金融 | G152: 证券行业 | H152: 100.4 | I152: 1.e-003 | J152: -1.2999999999999999e-003 | K152: 15.97 | L152: -1.2999999999999999e-003 | M152: 107.4 | N152: 20.42 | O152: 0.28399999999999997 | P152: 78.21 | Q152: 转股中 | R152: 2.94年 | S152: 0.95年 | T152: 24.1 | U152: 26 | V152: 1.1000000000000001e-002 | W152: 0.13 | X152: 0.10099999999999999 | Y152: 186 | Z152: 0.82 | AA152: 2.3399999999999997e-002 | AB152: 1.8500000000000003e-002 | AC152: 6.0000000000000001e-003 | AD152: 4.0999999999999995e-003 | AE152: 96.79 | AF152: 95.88 | AG152: 0.23 | AH152: AA+ | AI152: 3.9699999999999999e-002 | AJ152: =H152+100*O152 -> 128.80000000000001 | AK152: 122.6 | AL152: 127 | AM152: 25.8 | AN152: 79 | AO152: 1.2e-002 | AP152: 27 | AQ152: 敖东转债!
A153: 290 | B153: 113516 | C153: 苏农转债! | D153: 603323 | E153: 苏农银行 | F153: 金融 | G153: 银行行业 | H153: 105.98 | I153: -2.9999999999999997e-004 | J153: 1.7000000000000001e-003 | K153: 4.75 | L153: 4.1999999999999997e-003 | M153: 114.3 | N153: 5.52 | O153: 0.23199999999999998 | P153: 86.05 | Q153: 转股中 | R153: 3.33年 | S153: 无权 | T153: 12.9 | U153: 3.5 | V153: 3.0000000000000001e-003 | W153: 0.151 | X153: 0.13 | Y153: 86 | Z153: 0.72 | AA153: 2.3399999999999997e-002 | AB153: 1.54e-002 | AC153: 无权 | AD153: 无权 | AE153: 无权 | AF153: 100.25 | AG153: 0.34 | AH153: AA+ | AI153: 4.0999999999999995e-002 | AJ153: =H153+100*O153 -> 129.18000000000001 | AK153: 125.9 | AL153: 167 | AM153: 25.7 | AN153: 78 | AO153: -1.9e-002 | AP153: 31 | AQ153: 苏农转债!
A154: 17 | B154: 113619 | C154: 世运转债! | D154: 603920 | E154: 世运电路 | F154: 电子 | G154: 元器件制 | H154: 101 | I154: 5.0000000000000001e-004 | J154: 5.8999999999999999e-003 | K154: 17.29 | L154: 2.6099999999999998e-002 | M154: 115.2 | N154: 26.5 | O154: 0.54799999999999993 | P154: 65.25 | Q154: 3月25天 | R154: 5.80年 | S154: 3.80年 | T154: 10 | U154: 33 | V154: 3.3000000000000002e-002 | W154: 0.14099999999999999 | X154: 9.1999999999999998e-002 | Y154: 71 | Z154: 2.72 | AA154: 2.3399999999999997e-002 | AB154: 1.8500000000000003e-002 | AC154: 6.7000000000000002e-003 | AD154: 4.8999999999999998e-003 | AE154: 87.24 | AF154: 89.71 | AG154: 0.24 | AH154: AA | AI154: 4.4900000000000002e-002 | AJ154: =H154+100*O154 -> 155.79999999999998 | AK154: 136.8 | AL154: 249 | AM154: 47 | AN154: 257 | AO154: 1.4999999999999999e-002 | AP154: 4 | AQ154: 世运转债!
A155: 314 | B155: 123007 | C155: 道氏转债! | D155: 300409 | E155: 道氏技术 | F155: 建筑 | G155: 建筑行业 | H155: 103.687 | I155: 5.6999999999999993e-003 | J155: -4.0000000000000001e-003 | K155: 12.93 | L155: 3.9000000000000003e-003 | M155: 110.3 | N155: 14.55 | O155: 0.16699999999999998 | P155: 88.87 | Q155: 转股中 | R155: 2.74年 | S155: 0.74年 | T155: 3.04 | U155: 4.5 | V155: 1.3999999999999999e-002 | W155: 4.2000000000000003e-002 | X155: 3.7999999999999999e-002 | Y155: 72 | Z155: 2.46 | AA155: 2.3199999999999998e-002 | AB155: 1.6e-002 | AC155: -2.0099999999999996e-002 | AD155: -2.3900000000000001e-002 | AE155: 96.36 | AF155: 93.63 | AG155: 0.43 | AH155: AA- | AI155: 6.2699999999999992e-002 | AJ155: =H155+100*O155 -> 120.387 | AK155: 118.5 | AL155: 83 | AM155: 22.2 | AN155: 46 | AO155: -4.2999999999999997e-002 | AP155: 23 | AQ155: 道氏转债!
A156: 325 | B156: 128022 | C156: 众信转债! | D156: 2707 | E156: 众信旅游 | F156: 旅游餐饮 | G156: 旅游 | H156: 102.5 | I156: 1.18e-002 | J156: 1.1899999999999999e-002 | K156: 6.8 | L156: 6.4199999999999993e-002 | M156: 108.8 | N156: 7.92 | O156: 0.19399999999999998 | P156: 85.86 | Q156: 转股中 | R156: 2.67年 | S156: 0.67年 | T156: 4.56 | U156: 48 | V156: 0.10099999999999999 | W156: 7.400000000000001e-002 | X156: 6.4000000000000001e-002 | Y156: 62 | Z156: 2.9 | AA156: 2.3e-002 | AB156: 1.66e-002 | AC156: -1.1200000000000002e-002 | AD156: -1.4800000000000001e-002 | AE156: 96.55 | AF156: 92.74 | AG156: 0.37 | AH156: AA- | AI156: 6.2699999999999992e-002 | AJ156: =H156+100*O156 -> 121.90000000000001 | AK156: 119.1 | AL156: 94 | AM156: 22.6 | AN156: 49 | AO156: -3.4000000000000002e-002 | AP156: 31 | AQ156: 众信转债!
A157: 43 | B157: 123082 | C157: 北陆转债! | D157: 300016 | E157: 北陆药业 | F157: 医药 | G157: 化学制药 | H157: 108.21 | I157: 7.4999999999999997e-003 | J157: -4.0000000000000002e-004 | K157: 9.08 | L157: 1.e-002 | M157: 121.7 | N157: 8.86 | O157: 5.5999999999999994e-002 | P157: 102.48 | Q157: 2月10天 | R157: 5.68年 | S157: 3.68年 | T157: 5 | U157: 2.5 | V157: 5.0000000000000001e-003 | W157: 0.111 | X157: 0.114 | Y157: 45 | Z157: 2.79 | AA157: 2.1400000000000002e-002 | AB157: 1.47e-002 | AC157: -8.8000000000000005e-003 | AD157: -1.11e-002 | AE157: 78.94 | AF157: 80.7 | AG157: 0.71 | AH157: A+ | AI157: 7.690000000000001e-002 | AJ157: =H157+100*O157 -> 113.80999999999999 | AK157: 113.9 | AL157: 42 | AM157: 33.2 | AN157: 160 | AO157: 1.7000000000000001e-002 | AP157: 9 | AQ157: 北陆转债!
A158: 253 | B158: 128064 | C158: 司尔转债! | D158: 2538 | E158: 司尔特 | F158: 化工 | G158: 农化 | H158: 106 | I158: -4.7999999999999996e-003 | J158: -3.3e-003 | K158: 5.67 | L158: -1.7299999999999999e-002 | M158: 114.9 | N158: 6.07 | O158: 0.13500000000000001 | P158: 93.41 | Q158: 转股中 | R158: 4年5.1天 | S158: 2年6.1天 | T158: 8 | U158: 1.1 | V158: 1.e-003 | W158: 0.19600000000000001 | X158: 0.184 | Y158: 41 | Z158: 1.06 | AA158: 2.0799999999999999e-002 | AB158: 1.3899999999999999e-002 | AC158: -1.1399999999999999e-002 | AD158: -1.44e-002 | AE158: 94.43 | AF158: 97.41 | AG158: 0.47 | AH158: AA | AI158: 4.2999999999999997e-002 | AJ158: =H158+100*O158 -> 119.5 | AK158: 118.6 | AL158: 85 | AM158: 21.2 | AN158: 40 | AO158: -3.7999999999999999e-002 | AP158: 49 | AQ158: 司尔转债!
A159: 302 | B159: 128039 | C159: 三力转债! | D159: 2224 | E159: 三 力 士 | F159: 机械装备 | G159: 专用设备 | H159: 102.994 | I159: -2.0000000000000001e-004 | J159: -8.0000000000000004e-004 | K159: 5.38 | L159: -1.9e-003 | M159: 109.8 | N159: 5.81 | O159: 0.11199999999999999 | P159: 92.6 | Q159: 转股中 | R159: 3.18年 | S159: 1.18年 | T159: 2.03 | U159: 3.1 | V159: 1.4999999999999999e-002 | W159: 5.2000000000000005e-002 | X159: 4.8000000000000001e-002 | Y159: 39 | Z159: 1.68 | AA159: 2.07e-002 | AB159: 1.4800000000000001e-002 | AC159: -3.2000000000000002e-003 | AD159: -6.8999999999999999e-003 | AE159: 94.39 | AF159: 90.51 | AG159: 0.52 | AH159: AA- | AI159: 6.4000000000000001e-002 | AJ159: =H159+100*O159 -> 114.194 | AK159: 113.4 | AL159: 37 | AM159: 19 | AN159: 26 | AO159: -1.9e-002 | AP159: 26 | AQ159: 三力转债!
A160: 172 | B160: 128101 | C160: 联创转债! | D160: 2036 | E160: 联创电子 | F160: 电子 | G160: 液晶显示 | H160: 104.2 | I160: 1.3600000000000001e-002 | J160: -9.1000000000000004e-003 | K160: 10.07 | L160: 1.61e-002 | M160: 114.8 | N160: 13.86 | O160: 0.434 | P160: 72.66 | Q160: 转股中 | R160: 4.95年 | S160: 2.95年 | T160: 3 | U160: 2.4 | V160: 8.0000000000000002e-003 | W160: 2.7999999999999997e-002 | X160: 2.1000000000000001e-002 | Y160: 106 | Z160: 3.58 | AA160: 2.0099999999999996e-002 | AB160: 1.46e-002 | AC160: -2.8000000000000004e-003 | AD160: -4.7999999999999996e-003 | AE160: 90.67 | AF160: 93.54 | AG160: 0.28 | AH160: AA | AI160: 4.2999999999999997e-002 | AJ160: =H160+100*O160 -> 147.59999999999999 | AK160: 135.7 | AL160: 240 | AM160: 42.2 | AN160: 228 | AO160: -1.2e-002 | AP160: 16 | AQ160: 联创转债!
A161: 155 | B161: 123050 | C161: 聚飞转债 | D161: 300303 | E161: 聚飞光电 | F161: 电子 | G161: LED制 | H161: 113.01 | I161: 1.8799999999999997e-002 | J161: -6.8999999999999999e-003 | K161: 5 | L161: 2.0400000000000001e-002 | M161: 124.2 | N161: 5.18 | O161: 0.17100000000000001 | P161: 96.53 | Q161: 转股中 | R161: 5年11天 | S161: 3年12天 | T161: 7.05 | U161: 6.6 | V161: 8.0000000000000002e-003 | W161: 0.11 | X161: 0.106 | Y161: 64 | Z161: 2.75 | AA161: 1.9400000000000001e-002 | AB161: 1.11e-002 | AC161: -2.5600000000000001e-002 | AD161: -2.7999999999999997e-002 | AE161: 85.12 | AF161: 90.78 | AG161: 0.58 | AH161: AA- | AI161: 6.59e-002 | AJ161: =H161+100*O161 -> 130.11000000000001 | AK161: 129.5 | AL161: 199 | AM161: 38.7 | AN161: 208 | AO161: -1.2e-002 | AP161: 12 | AQ161: 聚飞转债
A162: 96 | B162: 110074 | C162: 精达转债! | D162: 600577 | E162: 精达股份 | F162: 电子 | G162: 电子产品 | H162: 106.04 | I162: 4.0000000000000002e-004 | J162: -9.1999999999999998e-003 | K162: 3.57 | L162: -1.6500000000000001e-002 | M162: 117.3 | N162: 3.75 | O162: 0.114 | P162: 95.2 | Q162: 转股中 | R162: 5.38年 | S162: 3.38年 | T162: 7.87 | U162: 2.5 | V162: 3.0000000000000001e-003 | W162: 0.115 | X162: 0.109 | Y162: 69 | Z162: 1.86 | AA162: 1.9299999999999998e-002 | AB162: 1.3500000000000002e-002 | AC162: -6.0000000000000001e-003 | AD162: -8.1000000000000013e-003 | AE162: 88.97 | AF162: 93.06 | AG162: 0.54 | AH162: AA | AI162: 4.4900000000000002e-002 | AJ162: =H162+100*O162 -> 117.44000000000001 | AK162: 116.9 | AL162: 69 | AM162: 23.8 | AN162: 66 | AO162: -1.8000000000000002e-002 | AP162: 12 | AQ162: 精达转债!
A163: 162 | B163: 128105 | C163: 长集转债 | D163: 2616 | E163: 长青集团 | F163: 城市公用 | G163: 三废处理 | H163: 105 | I163: -7.000000000000001e-004 | J163: -1.26e-002 | K163: 7.43 | L163: -2.6200000000000001e-002 | M163: 115.3 | N163: 8.11 | O163: 0.14599999999999999 | P163: 91.62 | Q163: 转股中 | R163: 5年6.1天 | S163: 3年7天 | T163: 8 | U163: 5.1 | V163: 6.0000000000000001e-003 | W163: 0.14499999999999999 | X163: 0.13300000000000001 | Y163: 55 | Z163: 2.11 | AA163: 1.9199999999999998e-002 | AB163: 1.3600000000000001e-002 | AC163: -3.5999999999999999e-003 | AD163: -5.8999999999999999e-003 | AE163: 90.4 | AF163: 92.95 | AG163: 0.51 | AH163: AA | AI163: 4.4900000000000002e-002 | AJ163: =H163+100*O163 -> 119.59999999999999 | AK163: 118.4 | AL163: 81 | AM163: 25.4 | AN163: 76 | AO163: -4.7e-002 | AP163: 13 | AQ163: 长集转债
A164: 41 | B164: 113612 | C164: 永冠转债 | D164: 603681 | E164: 永冠新材 | F164: 化工 | G164: 其他 | H164: 109.17 | I164: -1.78e-002 | J164: -4.8999999999999998e-003 | K164: 21.01 | L164: -3.4000000000000002e-002 | M164: 121.2 | N164: 20.79 | O164: 8.0000000000000002e-002 | P164: 101.06 | Q164: 2月13天 | R164: 5.68年 | S164: 3.69年 | T164: 5.2 | U164: 2.1 | V164: 4.0000000000000001e-003 | W164: 0.14899999999999999 | X164: 0.14999999999999999 | Y164: 35 | Z164: 2.37 | AA164: 1.9e-002 | AB164: 1.24e-002 | AC164: -1.23e-002 | AD164: -1.44e-002 | AE164: 81.66 | AF164: 85 | AG164: 0.67 | AH164: AA- | AI164: 6.59e-002 | AJ164: =H164+100*O164 -> 117.17 | AK164: 117.3 | AL164: 71 | AM164: 32.3 | AN164: 150 | AO164: -1.8000000000000002e-002 | AP164: 5 | AQ164: 永冠转债
A165: 33 | B165: 113044 | C165: 大秦转债! | D165: 601006 | E165: 大秦铁路 | F165: 铁路 | G165: 铁路运输 | H165: 102.69 | I165: 4.0000000000000002e-004 | J165: -4.7999999999999996e-003 | K165: 6.89 | L165: -8.6e-003 | M165: 114.1 | N165: 7.66 | O165: 0.14199999999999999 | P165: 89.95 | Q165: 2月17天 | R165: 5.70年 | S165: 3.70年 | T165: 320 | U165: 387 | V165: 1.2e-002 | W165: 0.312 | X165: 0.28100000000000003 | Y165: 1024. | Z165: 0.88 | AA165: 1.9e-002 | AB165: 1.44e-002 | AC165: 3.2000000000000002e-003 | AD165: 1.1999999999999999e-003 | AE165: 89.44 | AF165: 91.69 | AG165: 0.51 | AH165: AAA | AI165: 3.9900000000000005e-002 | AJ165: =H165+100*O165 -> 116.89 | AK165: 115.4 | AL165: 58 | AM165: 23.7 | AN165: 65 | AO165: 1.e-003 | AP165: 13 | AQ165: 大秦转债!
A166: 234 | B166: 128071 | C166: 合兴转债! | D166: 2228 | E166: 合兴包装 | F166: 造纸包装 | G166: 包装材料 | H166: 106 | I166: 8.8999999999999999e-003 | J166: -1.3300000000000001e-002 | K166: 3.73 | L166: -1.06e-002 | M166: 114.8 | N166: 4.28 | O166: 0.21600000000000003 | P166: 87.15 | Q166: 转股中 | R166: 4.37年 | S166: 2.37年 | T166: 3 | U166: 3.4 | V166: 1.1000000000000001e-002 | W166: 6.5000000000000002e-002 | X166: 5.7000000000000002e-002 | Y166: 46 | Z166: 1.38 | AA166: 1.8799999999999997e-002 | AB166: 1.2500000000000001e-002 | AC166: -1.0200000000000001e-002 | AD166: -1.2699999999999999e-002 | AE166: 92.92 | AF166: 95.86 | AG166: 0.42 | AH166: AA | AI166: 4.2999999999999997e-002 | AJ166: =H166+100*O166 -> 127.59999999999999 | AK166: 124.9 | AL166: 154 | AM166: 29 | AN166: 119 | AO166: -5.5e-002 | AP166: 25 | AQ166: 合兴转债!
A167: 109 | B167: 128123 | C167: 国光转债! | D167: 2749 | E167: 国光股份 | F167: 化工 | G167: 农化 | H167: 105.478 | I167: 2.5000000000000001e-003 | J167: -6.1999999999999998e-003 | K167: 10.98 | L167: -7.1999999999999998e-003 | M167: 116.2 | N167: 13.7 | O167: 0.316 | P167: 80.15 | Q167: 转股中 | R167: 5.32年 | S167: 3.32年 | T167: 3.2 | U167: 1 | V167: 3.0000000000000001e-003 | W167: 6.7000000000000004e-002 | X167: 5.4000000000000006e-002 | Y167: 48 | Z167: 3.85 | AA167: 1.8799999999999997e-002 | AB167: 1.32e-002 | AC167: -3.7000000000000002e-003 | AD167: -6.0000000000000001e-003 | AE167: 83.6 | AF167: 83.45 | AG167: 0.51 | AH167: AA- | AI167: 6.59e-002 | AJ167: =H167+100*O167 -> 137.078 | AK167: 130.8 | AL167: 208 | AM167: 47.2 | AN167: 258 | AO167: -4.4999999999999998e-002 | AP167: 10 | AQ167: 国光转债!
A168: 328 | B168: 110038 | C168: 济川转债! | D168: 600566 | E168: 济川药业 | F168: 医药 | G168: 中药 | H168: 104.36 | I168: 3.3e-003 | J168: -2.8000000000000004e-003 | K168: 20.21 | L168: 2.5000000000000001e-003 | M168: 107.5 | N168: 23.85 | O168: 0.23199999999999998 | P168: 84.74 | Q168: 转股中 | R168: 1.62年 | S168: 回售内 | T168: 6.28 | U168: 1.9 | V168: 3.0000000000000001e-003 | W168: 3.5000000000000003e-002 | X168: 2.9999999999999999e-002 | Y168: 180 | Z168: 2.44 | AA168: 1.8700000000000001e-002 | AB168: 9.7999999999999997e-003 | AC168: 回售内 | AD168: 回售内 | AE168: 100.25 | AF168: 100.69 | AG168: 0.19 | AH168: AA | AI168: 4.1700000000000001e-002 | AJ168: =H168+100*O168 -> 127.56 | AK168: 124 | AL168: 146 | AM168: 23.3 | AN168: 56 | AO168: -8.0000000000000002e-003 | AP168: 22 | AQ168: 济川转债!
A169: 83 | B169: 123067 | C169: 斯莱转债 | D169: 300382 | E169: 斯莱克 | F169: 机械装备 | G169: 专用设备 | H169: 109.801 | I169: -7.000000000000001e-004 | J169: -7.000000000000001e-004 | K169: 8.78 | L169: -2.3e-003 | M169: 121.2 | N169: 9.38 | O169: 0.17300000000000001 | P169: 93.6 | Q169: 转股中 | R169: 5.46年 | S169: 3.46年 | T169: 3.88 | U169: 1.8 | V169: 4.0000000000000001e-003 | W169: 7.8e-002 | X169: 7.2999999999999995e-002 | Y169: 50 | Z169: 4.86 | AA169: 1.8700000000000001e-002 | AB169: 1.18e-002 | AC169: -1.47e-002 | AD169: -1.6799999999999999e-002 | AE169: 82.83 | AF169: 86.22 | AG169: 0.6 | AH169: AA- | AI169: 6.59e-002 | AJ169: =H169+100*O169 -> 127.101 | AK169: 126 | AL169: 169 | AM169: 39.8 | AN169: 215 | AO169: -2.2000000000000002e-002 | AP169: 14 | AQ169: 斯莱转债
A170: 21 | B170: 127028 | C170: 英特转债! | D170: 411 | E170: 英特集团 | F170: 医药 | G170: 医药商业 | H170: 101.999 | I170: 4.8999999999999998e-003 | J170: -7.0999999999999995e-003 | K170: 13.26 | L170: -9.0000000000000011e-003 | M170: 113.1 | N170: 19.89 | O170: 0.53000000000000003 | P170: 66.67 | Q170: 3月10天 | R170: 5.76年 | S170: 3.76年 | T170: 6 | U170: 12 | V170: 2.e-002 | W170: 0.182 | X170: 0.121 | Y170: 33 | Z170: 2.04 | AA170: 1.84e-002 | AB170: 1.4199999999999999e-002 | AC170: 4.0000000000000001e-003 | AD170: 2.2000000000000001e-003 | AE170: 87.96 | AF170: 89.18 | AG170: 0.25 | AH170: AA+ | AI170: 4.2900000000000001e-002 | AJ170: =H170+100*O170 -> 154.999 | AK170: 137.3 | AL170: 252 | AM170: 48.1 | AN170: 266 | AO170: -6.0000000000000001e-003 | AP170: 5 | AQ170: 英特转债!
A171: 65 | B171: 113606 | C171: 荣泰转债 | D171: 603579 | E171: 荣泰健康 | F171: 机械装备 | G171: 专用设备 | H171: 110.25 | I171: 5.6999999999999993e-003 | J171: -1.1999999999999999e-003 | K171: 31.87 | L171: 7.3000000000000001e-003 | M171: 121.2 | N171: 33.32 | O171: 0.153 | P171: 95.65 | Q171: 33天 | R171: 5.58年 | S171: 3.58年 | T171: 6 | U171: 1.2 | V171: 2.e-003 | W171: 0.13400000000000001 | X171: 0.129 | Y171: 45 | Z171: 2.82 | AA171: 1.7500000000000002e-002 | AB171: 1.0800000000000001e-002 | AC171: -1.5300000000000001e-002 | AD171: -1.7399999999999999e-002 | AE171: 82.22 | AF171: 85.58 | AG171: 0.63 | AH171: AA- | AI171: 6.59e-002 | AJ171: =H171+100*O171 -> 125.55 | AK171: 124.9 | AL171: 155 | AM171: 39.3 | AN171: 213 | AO171: 2.7999999999999997e-002 | AP171: 9 | AQ171: 荣泰转债
A172: 191 | B172: 128094 | C172: 星帅转债 | D172: 2860 | E172: 星帅尔 | F172: 家电 | G172: 零部件制 | H172: 111.901 | I172: 7.0999999999999995e-003 | J172: 4.0000000000000002e-004 | K172: 15.3 | L172: 1.06e-002 | M172: 121 | N172: 13.95 | O172: 2.e-002 | P172: 109.68 | Q172: 转股中 | R172: 4.79年 | S172: 2.79年 | T172: 2.72 | U172: 2.8 | V172: 9.0000000000000011e-003 | W172: 8.900000000000001e-002 | X172: 9.8000000000000004e-002 | Y172: 30 | Z172: 3.27 | AA172: 1.6799999999999999e-002 | AB172: 9.1000000000000004e-003 | AC172: -2.4399999999999998e-002 | AD172: -2.7000000000000003e-002 | AE172: 84.23 | AF172: 86.25 | AG172: 0.71 | AH172: A+ | AI172: 7.4999999999999997e-002 | AJ172: =H172+100*O172 -> 113.901 | AK172: 114.1 | AL172: 47 | AM172: 27.9 | AN172: 102 | AO172: -3.1e-002 | AP172: 30 | AQ172: 星帅转债
A173: 142 | B173: 123052 | C173: 飞鹿转债 | D173: 300665 | E173: 飞鹿股份 | F173: 化工 | G173: 化工 | H173: 117.13 | I173: -5.9999999999999995e-004 | J173: 8.1000000000000013e-003 | K173: 11.37 | L173: 1.0700000000000001e-002 | M173: 127.3 | N173: 9.9 | O173: 2.e-002 | P173: 114.85 | Q173: 转股中 | R173: 5.17年 | S173: 3.18年 | T173: 1.76 | U173: 33 | V173: 0.16200000000000001 | W173: 0.127 | X173: 0.14599999999999999 | Y173: 14 | Z173: 2.93 | AA173: 1.67e-002 | AB173: 7.8000000000000005e-003 | AC173: -3.2000000000000001e-002 | AD173: -3.4799999999999998e-002 | AE173: 82.47 | AF173: 87.7 | AG173: 0.7 | AH173: A+ | AI173: 7.690000000000001e-002 | AJ173: =H173+100*O173 -> 119.13 | AK173: 119.4 | AL173: 100 | AM173: 31.7 | AN173: 143 | AO173: 1.3000000000000001e-002 | AP173: 15 | AQ173: 飞鹿转债
A174: 197 | B174: 128090 | C174: 汽模转2 | D174: 2510 | E174: 天汽模 | F174: 汽车 | G174: 零部件制 | H174: 106.441 | I174: 1.09e-002 | J174: -1.e-004 | K174: 4.11 | L174: 1.9900000000000001e-002 | M174: 114.9 | N174: 4.21 | O174: 8.9999999999999997e-002 | P174: 97.62 | Q174: 转股中 | R174: 4.73年 | S174: 2.74年 | T174: 3.1 | U174: 54 | V174: 0.16200000000000001 | W174: 7.9000000000000001e-002 | X174: 7.6999999999999999e-002 | Y174: 39 | Z174: 1.42 | AA174: 1.66e-002 | AB174: 1.0800000000000001e-002 | AC174: -1.e-002 | AD174: -1.23e-002 | AE174: 91.61 | AF174: 94.5 | AG174: 0.54 | AH174: AA | AI174: 4.2999999999999997e-002 | AJ174: =H174+100*O174 -> 115.441 | AK174: 115.3 | AL174: 55 | AM174: 20.8 | AN174: 35 | AO174: -2.4e-002 | AP174: 27 | AQ174: 汽模转2
A175: 199 | B175: 123038 | C175: 联得转债! | D175: 300545 | E175: 联得装备 | F175: 机械装备 | G175: 专用设备 | H175: 110.1 | I175: 1.01e-002 | J175: 8.6999999999999994e-003 | K175: 23.13 | L175: 3.1200000000000002e-002 | M175: 118.6 | N175: 25.29 | O175: 0.20399999999999999 | P175: 91.46 | Q175: 转股中 | R175: 4.73年 | S175: 2.73年 | T175: 1.47 | U175: 14 | V175: 8.4000000000000005e-002 | W175: 4.2999999999999997e-002 | X175: 4.0000000000000001e-002 | Y175: 34 | Z175: 4.41 | AA175: 1.6200000000000003e-002 | AB175: 9.1999999999999998e-003 | AC175: -2.0199999999999999e-002 | AD175: -2.2700000000000001e-002 | AE175: 84.4 | AF175: 84.89 | AG175: 0.6 | AH175: A+ | AI175: 7.4999999999999997e-002 | AJ175: =H175+100*O175 -> 130.5 | AK175: 128.7 | AL175: 196 | AM175: 43.9 | AN175: 240 | AO175: 2.3e-002 | AP175: 18 | AQ175: 联得转债!
A176: 144 | B176: 128109 | C176: 楚江转债 | D176: 2171 | E176: 楚江新材 | F176: 有色金属 | G176: 铜金属 | H176: 106.55 | I176: 9.8999999999999991e-003 | J176: 1.4000000000000002e-003 | K176: 7.36 | L176: 2.6499999999999999e-002 | M176: 115.3 | N176: 8.73 | O176: 0.26400000000000001 | P176: 84.31 | Q176: 转股中 | R176: 5.17年 | S176: 3.17年 | T176: 18.3 | U176: 40 | V176: 2.e-002 | W176: 0.18600000000000003 | X176: 0.157 | Y176: 98 | Z176: 1.79 | AA176: 1.5700000000000002e-002 | AB176: 1.03e-002 | AC176: -7.9000000000000008e-003 | AD176: -1.01e-002 | AE176: 89.79 | AF176: 92.32 | AG176: 0.43 | AH176: AA | AI176: 4.4900000000000002e-002 | AJ176: =H176+100*O176 -> 132.94999999999999 | AK176: 128.8 | AL176: 197 | AM176: 36.5 | AN176: 189 | AO176: -3.1e-002 | AP176: 6 | AQ176: 楚江转债
A177: 301 | B177: 128040 | C177: 华通转债! | D177: 2758 | E177: 浙农股份 | F177: 医药 | G177: 医药商业 | H177: 107.15 | I177: -1.6000000000000001e-003 | J177: 1.e-003 | K177: 10.44 | L177: -1.e-003 | M177: 112.3 | N177: 10.33 | O177: 5.9999999999999998e-002 | P177: 101.06 | Q177: 转股中 | R177: 3.20年 | S177: 1.20年 | T177: 2.22 | U177: 2.6 | V177: 1.1000000000000001e-002 | W177: 4.4000000000000004e-002 | X177: 4.4000000000000004e-002 | Y177: 51 | Z177: 3.45 | AA177: 1.5100000000000001e-002 | AB177: 7.9000000000000008e-003 | AC177: -3.0200000000000001e-002 | AD177: -3.4000000000000002e-002 | AE177: 94.53 | AF177: 92.5 | AG177: 0.6 | AH177: AA- | AI177: 6.4000000000000001e-002 | AJ177: =H177+100*O177 -> 113.15000000000001 | AK177: 113.2 | AL177: 36 | AM177: 18.7 | AN177: 22 | AO177: -1.e-003 | AP177: 30 | AQ177: 华通转债!
A178: 116 | B178: 113594 | C178: 淳中转债! | D178: 603516 | E178: 淳中科技 | F178: 电子 | G178: 电子产品 | H178: 112.87 | I178: -1.2999999999999999e-003 | J178: -7.0999999999999995e-003 | K178: 36.91 | L178: -1.3100000000000001e-002 | M178: 121.4 | N178: 39.37 | O178: 0.20399999999999999 | P178: 93.75 | Q178: 转股中 | R178: 5.30年 | S178: 3.30年 | T178: 3 | U178: 2.1 | V178: 6.0000000000000001e-003 | W178: 6.0999999999999999e-002 | X178: 5.7000000000000002e-002 | Y178: 49 | Z178: 5.18 | AA178: 1.4199999999999999e-002 | AB178: 7.0999999999999995e-003 | AC178: -2.2000000000000002e-002 | AD178: -2.4500000000000001e-002 | AE178: 81.16 | AF178: 82.79 | AG178: 0.64 | AH178: A+ | AI178: 7.690000000000001e-002 | AJ178: =H178+100*O178 -> 133.27000000000001 | AK178: 132 | AL178: 219 | AM178: 49.2 | AN178: 271 | AO178: 1.6e-002 | AP178: 8 | AQ178: 淳中转债!
A179: 135 | B179: 113588 | C179: 润达转债! | D179: 603108 | E179: 润达医疗 | F179: 医药 | G179: 医疗器械 | H179: 106.31 | I179: 1.e-004 | J179: -6.8000000000000005e-003 | K179: 11.48 | L179: -1.46e-002 | M179: 114.2 | N179: 13.36 | O179: 0.23699999999999999 | P179: 85.93 | Q179: 转股中 | R179: 5.21年 | S179: 3.21年 | T179: 5.5 | U179: 4.2 | V179: 6.9999999999999993e-003 | W179: 8.3000000000000004e-002 | X179: 7.0999999999999994e-002 | Y179: 67 | Z179: 2.22 | AA179: 1.41e-002 | AB179: 9.1000000000000004e-003 | AC179: -7.4000000000000003e-003 | AD179: -9.4999999999999998e-003 | AE179: 89.55 | AF179: 91.29 | AG179: 0.46 | AH179: AA | AI179: 4.4900000000000002e-002 | AJ179: =H179+100*O179 -> 130.00999999999999 | AK179: 126.7 | AL179: 174 | AM179: 35.4 | AN179: 178 | AO179: 6.7000000000000004e-002 | AP179: 10 | AQ179: 润达转债!
A180: 23 | B180: 123092 | C180: 天壕转债 | D180: 300332 | E180: 天壕环境 | F180: 石油天然 | G180: 天然气 | H180: 112.8 | I180: 2.9999999999999997e-004 | J180: -1.6000000000000001e-003 | K180: 5.07 | L180: -2.e-003 | M180: 121.6 | N180: 5.2 | O180: 0.157 | P180: 97.5 | Q180: 2月29天 | R180: 5.73年 | S180: 3.73年 | T180: 4.23 | U180: 18 | V180: 3.7999999999999999e-002 | W180: 9.5000000000000001e-002 | X180: 9.1999999999999998e-002 | Y180: 45 | Z180: 1.29 | AA180: 1.3500000000000002e-002 | AB180: 6.8999999999999999e-003 | AC180: -1.9400000000000001e-002 | AD180: -2.1600000000000001e-002 | AE180: 78.66 | AF180: 80.35 | AG180: 0.68 | AH180: A+ | AI180: 7.690000000000001e-002 | AJ180: =H180+100*O180 -> 128.5 | AK180: 128.1 | AL180: 192 | AM180: 47.7 | AN180: 263 | AO180: -8.0000000000000002e-003 | AP180: 6 | AQ180: 天壕转债
A181: 252 | B181: 113024 | C181: 核建转债! | D181: 601611 | E181: 中国核建 | F181: 建筑 | G181: 建筑工程 | H181: 104.18 | I181: -5.3e-003 | J181: 1.1999999999999999e-003 | K181: 8.22 | L181: -1.0800000000000001e-002 | M181: 109.7 | N181: 9.76 | O181: 0.23699999999999999 | P181: 84.22 | Q181: 转股中 | R181: 4年5.1天 | S181: 2年6.1天 | T181: 30 | U181: 6.8 | V181: 2.e-003 | W181: 0.13800000000000001 | X181: 0.11599999999999999 | Y181: 218 | Z181: 2.02 | AA181: 1.32e-002 | AB181: 8.6e-003 | AC181: -4.4000000000000003e-003 | AD181: -7.1999999999999998e-003 | AE181: 95.21 | AF181: 94.76 | AG181: 0.38 | AH181: AAA | AI181: 3.7999999999999999e-002 | AJ181: =H181+100*O181 -> 127.88000000000001 | AK181: 124.1 | AL181: 149 | AM181: 28.9 | AN181: 117 | AO181: 3.3000000000000002e-002 | AP181: 40 | AQ181: 核建转债!
A182: 102 | B182: 113598 | C182: 法兰转债 | D182: 603966 | E182: 法兰泰克 | F182: 机械装备 | G182: 工程机械 | H182: 113.26 | I182: 2.2499999999999999e-002 | J182: -1.3600000000000001e-002 | K182: 14.63 | L182: 1.32e-002 | M182: 121.2 | N182: 13.88 | O182: 7.4999999999999997e-002 | P182: 105.4 | Q182: 转股中 | R182: 5.33年 | S182: 3.33年 | T182: 2.98 | U182: 174 | V182: 0.498 | W182: 9.5000000000000001e-002 | X182: 0.10099999999999999 | Y182: 31 | Z182: 2.77 | AA182: 1.3100000000000001e-002 | AB182: 6.1999999999999998e-003 | AC182: -2.4e-002 | AD182: -2.6200000000000001e-002 | AE182: 83.53 | AF182: 86.95 | AG182: 0.68 | AH182: AA- | AI182: 6.59e-002 | AJ182: =H182+100*O182 -> 120.76000000000001 | AK182: 121.1 | AL182: 113 | AM182: 34.2 | AN182: 168 | AO182: -0.13 | AP182: 8 | AQ182: 法兰转债
A183: 257 | B183: 110057 | C183: 现代转债 | D183: 600420 | E183: 现代制药 | F183: 医药 | G183: 化学制药 | H183: 105.02 | I183: 0. | J183: -3.5999999999999999e-003 | K183: 9.04 | L183: -7.7000000000000002e-003 | M183: 110.3 | N183: 9.89 | O183: 0.14899999999999999 | P183: 91.41 | Q183: 转股中 | R183: 3.99年 | S183: 1.997年 | T183: 16.2 | U183: 8.4 | V183: 5.0000000000000001e-003 | W183: 0.17399999999999999 | X183: 0.159 | Y183: 93 | Z183: 1.18 | AA183: 1.26e-002 | AB183: 7.7000000000000002e-003 | AC183: -9.8999999999999991e-003 | AD183: -1.24e-002 | AE183: 94.88 | AF183: 95.28 | AG183: 0.46 | AH183: AAA | AI183: 3.7999999999999999e-002 | AJ183: =H183+100*O183 -> 119.91999999999999 | AK183: 118.6 | AL183: 86 | AM183: 23.4 | AN183: 59 | AO183: -2.e-003 | AP183: 23 | AQ183: 现代转债
A184: 4 | B184: 123101 | C184: 拓斯转债 | D184: 300607 | E184: 拓斯达 | F184: 机械装备 | G184: 机器人及 | H184: 107 | I184: -6.5000000000000006e-003 | J184: 3.9000000000000003e-003 | K184: 35.6 | L184: -5.6000000000000008e-003 | M184: 115.1 | N184: 42.25 | O184: 0.27000000000000002 | P184: 84.26 | Q184: 5月17天 | R184: 5.93年 | S184: 3.94年 | T184: 6.7 | U184: 23 | V184: 3.1e-002 | W184: 7.0999999999999994e-002 | X184: 5.9999999999999998e-002 | Y184: 95 | Z184: 4.38 | AA184: 1.26e-002 | AB184: 8.0000000000000002e-003 | AC184: -7.9000000000000008e-003 | AD184: -9.5999999999999992e-003 | AE184: 86.64 | AF184: 89.09 | AG184: 0.47 | AH184: AA | AI184: 4.4900000000000002e-002 | AJ184: =H184+100*O184 -> 134. | AK184: 129.7 | AL184: 202 | AM184: 40.7 | AN184: 219 | AO184: -3.6000000000000004e-002 | AP184: 2 | AQ184: 拓斯转债
A185: 92 | B185: 113039 | C185: 嘉泽转债! | D185: 601619 | E185: 嘉泽新能 | F185: 能源电力 | G185: 风能 | H185: 106 | I185: -3.0499999999999999e-002 | J185: 2.0000000000000001e-004 | K185: 3.77 | L185: -4.5599999999999995e-002 | M185: 113.1 | N185: 3.57 | O185: 4.0000000000000001e-003 | P185: 105.6 | Q185: 转股中 | R185: 5.39年 | S185: 3.39年 | T185: 12.2 | U185: 102 | V185: 7.8e-002 | W185: 0.156 | X185: 0.16500000000000001 | Y185: 78 | Z185: 2.28 | AA185: 1.23e-002 | AB185: 7.8000000000000005e-003 | AC185: -6.5000000000000006e-003 | AD185: -8.3999999999999995e-003 | AE185: 88.73 | AF185: 89.66 | AG185: 0.66 | AH185: AA | AI185: 4.4900000000000002e-002 | AJ185: =H185+100*O185 -> 106.40000000000001 | AK185: 106.4 | AL185: 11 | AM185: 16.7 | AN185: 14 | AO185: 2.7999999999999997e-002 | AP185: 26 | AQ185: 嘉泽转债!
A186: 3 | B186: 123103 | C186: 震安转债 | D186: 300767 | E186: 震安科技 | F186: 化工 | G186: 橡胶塑料 | H186: 113.098 | I186: -7.9000000000000008e-003 | J186: 6.8999999999999999e-003 | K186: 82.16 | L186: -1.5e-003 | M186: 121.4 | N186: 79.87 | O186: 9.9000000000000005e-002 | P186: 102.87 | Q186: 5月21天 | R186: 5.94年 | S186: 3.94年 | T186: 2.85 | U186: 37 | V186: 0.11599999999999999 | W186: 2.4e-002 | X186: 2.5000000000000001e-002 | Y186: 118 | Z186: 10.85 | AA186: 1.2199999999999999e-002 | AB186: 6.0000000000000001e-003 | AC186: -1.9099999999999999e-002 | AD186: -2.12e-002 | AE186: 77.4 | AF186: 78.95 | AG186: 0.72 | AH186: A+ | AI186: 7.690000000000001e-002 | AJ186: =H186+100*O186 -> 122.998 | AK186: 123.3 | AL186: 140 | AM186: 44.4 | AN186: 243 | AO186: 8.199999999999999e-002 | AP186: 2 | AQ186: 震安转债
A187: 266 | B187: 110053 | C187: 苏银转债! | D187: 600919 | E187: 江苏银行 | F187: 金融 | G187: 银行行业 | H187: 112.97 | I187: -3.4000000000000002e-003 | J187: 3.4000000000000002e-003 | K187: 6.44 | L187: 0. | M187: 118.3 | N187: 6.69 | O187: 0.17399999999999999 | P187: 96.26 | Q187: 转股中 | R187: 3.95年 | S187: 无权 | T187: 200 | U187: 114 | V187: 5.0000000000000001e-003 | W187: 0.20999999999999999 | X187: 0.20199999999999999 | Y187: 951 | Z187: 0.63 | AA187: 1.21e-002 | AB187: 3.8e-003 | AC187: 无权 | AD187: 无权 | AE187: 无权 | AF187: 102.52 | AG187: 0.46 | AH187: AAA | AI187: 3.7999999999999999e-002 | AJ187: =H187+100*O187 -> 130.37 | AK187: 129.7 | AL187: 201 | AM187: 27.2 | AN187: 89 | AO187: 1.3999999999999999e-002 | AP187: 42 | AQ187: 苏银转债!
A188: 217 | B188: 123033 | C188: 金力转债! | D188: 300748 | E188: 金力永磁 | F188: 电子 | G188: 元器件制 | H188: 115.45 | I188: -4.6999999999999993e-003 | J188: 6.5000000000000006e-003 | K188: 36.11 | L188: 3.5999999999999999e-003 | M188: 121.5 | N188: 40.68 | O188: 0.30099999999999999 | P188: 88.77 | Q188: 转股中 | R188: 4.58年 | S188: 2.58年 | T188: 4.34 | U188: 15 | V188: 2.9999999999999999e-002 | W188: 2.7999999999999997e-002 | X188: 2.5000000000000001e-002 | Y188: 156 | Z188: 10.29 | AA188: 1.15e-002 | AB188: 3.4000000000000002e-003 | AC188: -3.44e-002 | AD188: -3.7699999999999997e-002 | AE188: 88.76 | AF188: 92.22 | AG188: 0.5 | AH188: AA- | AI188: 6.4000000000000001e-002 | AJ188: =H188+100*O188 -> 145.55000000000001 | AK188: 142.1 | AL188: 272 | AM188: 49.9 | AN188: 275 | AO188: -5.9999999999999998e-002 | AP188: 28 | AQ188: 金力转债!
A189: 196 | B189: 128091 | C189: 新天转债 | D189: 2873 | E189: 新天药业 | F189: 医药 | G189: 中药 | H189: 113.58 | I189: -1.3500000000000002e-002 | J189: 3.0999999999999999e-003 | K189: 16.38 | L189: -1.5600000000000001e-002 | M189: 119.4 | N189: 16.39 | O189: 0.13600000000000001 | P189: 99.94 | Q189: 转股中 | R189: 4.74年 | S189: 2.75年 | T189: 1.76 | U189: 59 | V189: 0.29299999999999998 | W189: 9.1999999999999998e-002 | X189: 9.1999999999999998e-002 | Y189: 19 | Z189: 2.54 | AA189: 1.09e-002 | AB189: 3.5999999999999999e-003 | AC189: -2.86e-002 | AD189: -3.1400000000000004e-002 | AE189: 84.87 | AF189: 85.48 | AG189: 0.66 | AH189: A+ | AI189: 7.4999999999999997e-002 | AJ189: =H189+100*O189 -> 127.18000000000001 | AK189: 127.2 | AL189: 179 | AM189: 41.7 | AN189: 225 | AO189: 2.5000000000000001e-002 | AP189: 18 | AQ189: 新天转债
A190: 7 | B190: 128144 | C190: 利民转债 | D190: 2734 | E190: 利民股份 | F190: 化工 | G190: 农化 | H190: 107.112 | I190: 4.0000000000000002e-004 | J190: -2.8999999999999998e-003 | K190: 13.45 | L190: -4.4000000000000003e-003 | M190: 114.1 | N190: 14.23 | O190: 0.13300000000000001 | P190: 94.52 | Q190: 5月6天 | R190: 5.91年 | S190: 3.91年 | T190: 9.8 | U190: 27 | V190: 2.6000000000000002e-002 | W190: 0.19600000000000001 | X190: 0.185 | Y190: 50 | Z190: 2.15 | AA190: 1.09e-002 | AB190: 6.6e-003 | AC190: -1.e-002 | AD190: -1.1299999999999999e-002 | AE190: 86.09 | AF190: 88.35 | AG190: 0.57 | AH190: AA | AI190: 4.4900000000000002e-002 | AJ190: =H190+100*O190 -> 120.41199999999999 | AK190: 119.7 | AL190: 102 | AM190: 31.4 | AN190: 141 | AO190: 6.0000000000000001e-003 | AP190: 3 | AQ190: 利民转债
A191: 159 | B191: 123048 | C191: 应急转债! | D191: 300527 | E191: 中船应急 | F191: 机械装备 | G191: 专用设备 | H191: 107.5 | I191: -2.5999999999999999e-003 | J191: 1.e-004 | K191: 7.99 | L191: -5.0000000000000001e-003 | M191: 113.1 | N191: 8.9 | O191: 0.19699999999999998 | P191: 89.78 | Q191: 转股中 | R191: 5年7天 | S191: 3年8天 | T191: 3.8 | U191: 12 | V191: 2.7999999999999997e-002 | W191: 4.9000000000000002e-002 | X191: 4.4000000000000004e-002 | Y191: 77 | Z191: 3.09 | AA191: 1.04e-002 | AB191: 5.6000000000000008e-003 | AC191: -1.1599999999999999e-002 | AD191: -1.38e-002 | AE191: 90.74 | AF191: 92 | AG191: 0.5 | AH191: AA+ | AI191: 4.2900000000000001e-002 | AJ191: =H191+100*O191 -> 127.2 | AK191: 125.2 | AL191: 159 | AM191: 33.2 | AN191: 159 | AO191: -2.4e-002 | AP191: 17 | AQ191: 应急转债!
A192: 136 | B192: 128114 | C192: 正邦转债 | D192: 2157 | E192: 正邦科技 | F192: 农业 | G192: 畜牧业 | H192: 109.52 | I192: 3.4000000000000002e-003 | J192: 1.0800000000000001e-002 | K192: 15.14 | L192: 2.5099999999999997e-002 | M192: 115.3 | N192: 15.45 | O192: 0.11800000000000001 | P192: 97.99 | Q192: 转股中 | R192: 5.21年 | S192: 3.21年 | T192: 16 | U192: 40 | V192: 2.3e-002 | W192: 3.4000000000000002e-002 | X192: 3.3000000000000002e-002 | Y192: 477 | Z192: 2.54 | AA192: 1.01e-002 | AB192: 4.7999999999999996e-003 | AC192: -1.5900000000000001e-002 | AD192: -1.8000000000000002e-002 | AE192: 90.23 | AF192: 93.08 | AG192: 0.57 | AH192: AA+ | AI192: 4.2900000000000001e-002 | AJ192: =H192+100*O192 -> 121.31999999999999 | AK192: 121 | AL192: 112 | AM192: 28 | AN192: 103 | AO192: -4.5999999999999999e-002 | AP192: 17 | AQ192: 正邦转债
A193: 10 | B193: 123099 | C193: 普利转债 | D193: 300630 | E193: 普利制药 | F193: 医药 | G193: 化学制药 | H193: 116.998 | I193: 6.8999999999999999e-003 | J193: -1.01e-002 | K193: 44.12 | L193: -5.1999999999999998e-003 | M193: 123.5 | N193: 46.22 | O193: 0.22600000000000001 | P193: 95.46 | Q193: 4月23天 | R193: 5.86年 | S193: 3.86年 | T193: 8.5 | U193: 11 | V193: 1.1000000000000001e-002 | W193: 4.4000000000000004e-002 | X193: 4.2000000000000003e-002 | Y193: 193 | Z193: 9.85 | AA193: 9.3999999999999986e-003 | AB193: 2.7000000000000001e-003 | AC193: -2.9500000000000002e-002 | AD193: -3.1200000000000002e-002 | AE193: 80.52 | AF193: 85.58 | AG193: 0.62 | AH193: AA- | AI193: 6.59e-002 | AJ193: =H193+100*O193 -> 139.59800000000001 | AK193: 138.5 | AL193: 260 | AM193: 53 | AN193: 287 | AO193: 1.e-002 | AP193: 4 | AQ193: 普利转债
A194: 53 | B194: 110077 | C194: 洪城转债 | D194: 600461 | E194: 洪城水业 | F194: 城市公用 | G194: 城市公用 | H194: 107.96 | I194: -1.1000000000000001e-003 | J194: 2.9999999999999997e-004 | K194: 6.95 | L194: -1.4000000000000002e-003 | M194: 113.5 | N194: 7.13 | O194: 0.10800000000000001 | P194: 97.48 | Q194: 54天 | R194: 5.63年 | S194: 3.64年 | T194: 18 | U194: 7.4 | V194: 4.0000000000000001e-003 | W194: 0.27300000000000002 | X194: 0.26600000000000001 | Y194: 66 | Z194: 1.31 | AA194: 9.0000000000000011e-003 | AB194: 4.6999999999999993e-003 | AC194: -1.43e-002 | AD194: -1.54e-002 | AE194: 87.24 | AF194: 89.84 | AG194: 0.59 | AH194: AA+ | AI194: 4.2900000000000001e-002 | AJ194: =H194+100*O194 -> 118.75999999999999 | AK194: 118.4 | AL194: 82 | AM194: 28.6 | AN194: 113 | AO194: 5.5999999999999994e-002 | AP194: 6 | AQ194: 洪城转债
A195: 219 | B195: 110060 | C195: 天路转债! | D195: 600326 | E195: 西藏天路 | F195: 建筑 | G195: 水泥 | H195: 110.41 | I195: 2.5000000000000001e-003 | J195: -1.2800000000000001e-002 | K195: 7.25 | L195: -1.7600000000000001e-002 | M195: 114.9 | N195: 7.16 | O195: 8.9999999999999997e-002 | P195: 101.26 | Q195: 转股中 | R195: 4.57年 | S195: 2.57年 | T195: 7.06 | U195: 16 | V195: 2.e-002 | W195: 0.106 | X195: 0.107 | Y195: 67 | Z195: 1.79 | AA195: 8.8999999999999999e-003 | AB195: 3.0000000000000001e-003 | AC195: -2.3900000000000001e-002 | AD195: -2.6200000000000001e-002 | AE195: 92.24 | AF195: 95.15 | AG195: 0.58 | AH195: AA | AI195: 4.2999999999999997e-002 | AJ195: =H195+100*O195 -> 119.41 | AK195: 119.6 | AL195: 101 | AM195: 24.4 | AN195: 71 | AO195: 6.9999999999999993e-003 | AP195: 13 | AQ195: 天路转债!
A196: 317 | B196: 110041 | C196: 蒙电转债! | D196: 600863 | E196: 内蒙华电 | F196: 能源电力 | G196: 电力供应 | H196: 106.79 | I196: -9.1000000000000004e-003 | J196: -1.0700000000000001e-002 | K196: 2.63 | L196: -4.0099999999999997e-002 | M196: 109.3 | N196: 2.69 | O196: 9.1999999999999998e-002 | P196: 97.77 | Q196: 转股中 | R196: 2.72年 | S196: 0.72年 | T196: 18.7 | U196: 23 | V196: 1.2e-002 | W196: 0.122 | X196: 0.12 | Y196: 153 | Z196: 1.29 | AA196: 8.6999999999999994e-003 | AB196: 2.3e-003 | AC196: -5.2499999999999998e-002 | AD196: -5.62e-002 | AE196: 98.6 | AF196: 99.24 | AG196: 0.49 | AH196: AAA | AI196: 3.6699999999999997e-002 | AJ196: =H196+100*O196 -> 115.99000000000001 | AK196: 115.8 | AL196: 59 | AM196: 16.6 | AN196: 12 | AO196: 4.4999999999999998e-002 | AP196: 11 | AQ196: 蒙电转债!
A197: 16 | B197: 123094 | C197: 星源转2! | D197: 300568 | E197: 星源材质 | F197: 电子 | G197: 电子行业 | H197: 111.63 | I197: -1.1000000000000001e-003 | J197: -7.000000000000001e-004 | K197: 27.59 | L197: -3.5999999999999999e-003 | M197: 117.3 | N197: 31.54 | O197: 0.27600000000000002 | P197: 87.48 | Q197: 3月25天 | R197: 5.80年 | S197: 3.80年 | T197: 10 | U197: 190 | V197: 0.17199999999999999 | W197: 8.1000000000000003e-002 | X197: 7.0999999999999994e-002 | Y197: 124 | Z197: 4.25 | AA197: 8.6999999999999994e-003 | AB197: 3.4000000000000002e-003 | AC197: -1.83e-002 | AD197: -2.0099999999999996e-002 | AE197: 87.34 | AF197: 91.35 | AG197: 0.48 | AH197: AA | AI197: 4.4900000000000002e-002 | AJ197: =H197+100*O197 -> 139.22999999999999 | AK197: 135.8 | AL197: 241 | AM197: 44.4 | AN197: 245 | AO197: 7.2999999999999995e-002 | AP197: 3 | AQ197: 星源转2!
A198: 110 | B198: 110073 | C198: 国投转债 | D198: 600061 | E198: 国投资本 | F198: 金融 | G198: 证券行业 | H198: 105.66 | I198: 6.3e-003 | J198: 9.300000000000001e-003 | K198: 12.71 | L198: 3.5900000000000001e-002 | M198: 110.5 | N198: 15.25 | O198: 0.26800000000000002 | P198: 83.34 | Q198: 转股中 | R198: 5.31年 | S198: 无权 | T198: 80 | U198: 147 | V198: 1.7000000000000001e-002 | W198: 0.14899999999999999 | X198: 0.124 | Y198: 537 | Z198: 1.29 | AA198: 8.6e-003 | AB198: 4.8999999999999998e-003 | AC198: 无权 | AD198: 无权 | AE198: 无权 | AF198: 90.03 | AG198: 0.43 | AH198: AAA | AI198: 3.9900000000000005e-002 | AJ198: =H198+100*O198 -> 132.46000000000001 | AK198: 128 | AL198: 190 | AM198: 38 | AN198: 199 | AO198: 3.7000000000000005e-002 | AP198: 22 | AQ198: 国投转债
A199: 50 | B199: 123078 | C199: 飞凯转债! | D199: 300398 | E199: 飞凯材料 | F199: 化工 | G199: 化工 | H199: 110.001 | I199: 1.5700000000000002e-002 | J199: 1.3300000000000001e-002 | K199: 15.88 | L199: 4.6100000000000002e-002 | M199: 115.2 | N199: 15.62 | O199: 8.199999999999999e-002 | P199: 101.66 | Q199: 2月2天 | R199: 5.65年 | S199: 3.66年 | T199: 8.2 | U199: 37 | V199: 4.0999999999999995e-002 | W199: 0.10000000000000001 | X199: 0.10199999999999999 | Y199: 82 | Z199: 3.1 | AA199: 8.3999999999999995e-003 | AB199: 3.4999999999999996e-003 | AC199: -1.54e-002 | AD199: -1.7299999999999999e-002 | AE199: 87.81 | AF199: 90.29 | AG199: 0.63 | AH199: AA | AI199: 4.4900000000000002e-002 | AJ199: =H199+100*O199 -> 118.20100000000001 | AK199: 118.3 | AL199: 80 | AM199: 28 | AN199: 107 | AO199: 3.5000000000000003e-002 | AP199: 8 | AQ199: 飞凯转债!
A200: 212 | B200: 113550 | C200: 常汽转债! | D200: 603035 | E200: 常熟汽饰 | F200: 汽车 | G200: 零部件制 | H200: 116.9 | I200: 2.3999999999999998e-003 | J200: -3.0000000000000001e-003 | K200: 11.01 | L200: -8.9999999999999998e-004 | M200: 121.3 | N200: 9.65 | O200: 2.5000000000000001e-002 | P200: 114.09 | Q200: 转股中 | R200: 4.63年 | S200: 2.63年 | T200: 3.78 | U200: 3.1 | V200: 6.9999999999999993e-003 | W200: 0.10000000000000001 | X200: 0.114 | Y200: 38 | Z200: 1.1 | AA200: 8.199999999999999e-003 | AB200: 2.9999999999999997e-004 | AC200: -4.07e-002 | AD200: -4.3400000000000001e-002 | AE200: 87.8 | AF200: 91.67 | AG200: 0.7 | AH200: AA- | AI200: 6.4000000000000001e-002 | AJ200: =H200+100*O200 -> 119.40000000000001 | AK200: 119.7 | AL200: 103 | AM200: 28 | AN200: 106 | AO200: -2.6000000000000002e-002 | AP200: 15 | AQ200: 常汽转债!
A201: 151 | B201: 128107 | C201: 交科转债 | D201: 2061 | E201: 浙江交科 | F201: 建筑 | G201: 建筑工程 | H201: 110.763 | I201: 9.7000000000000003e-003 | J201: -1.7399999999999999e-002 | K201: 5.66 | L201: -1.2199999999999999e-002 | M201: 115.3 | N201: 5.36 | O201: 4.9000000000000002e-002 | P201: 105.6 | Q201: 转股中 | R201: 5年19天 | S201: 3年20天 | T201: 25 | U201: 16 | V201: 6.0000000000000001e-003 | W201: 0.32100000000000001 | X201: 0.33899999999999997 | Y201: 78 | Z201: 0.97 | AA201: 8.1000000000000013e-003 | AB201: 2.7000000000000001e-003 | AC201: -2.0199999999999999e-002 | AD201: -2.2400000000000003e-002 | AE201: 90.81 | AF201: 93.68 | AG201: 0.63 | AH201: AA+ | AI201: 4.2900000000000001e-002 | AJ201: =H201+100*O201 -> 115.66300000000001 | AK201: 115.9 | AL201: 61 | AM201: 22.2 | AN201: 47 | AO201: -3.0000000000000001e-003 | AP201: 16 | AQ201: 交科转债
A202: 66 | B202: 123074 | C202: 隆利转债 | D202: 300752 | E202: 隆利科技 | F202: 电子 | G202: 液晶显示 | H202: 118.84 | I202: 2.9999999999999997e-004 | J202: 4.8999999999999998e-003 | K202: 35.75 | L202: 6.9999999999999993e-003 | M202: 124 | N202: 29.41 | O202: -2.2000000000000002e-002 | P202: 121.56 | Q202: 32天 | R202: 5.57年 | S202: 3.58年 | T202: 3.25 | U202: 191 | V202: 0.49399999999999999 | W202: 7.4999999999999997e-002 | X202: 9.1999999999999998e-002 | Y202: 43 | Z202: 4.95 | AA202: 7.8000000000000005e-003 | AB202: 5.9999999999999995e-004 | AC202: -3.5499999999999997e-002 | AD202: -3.7400000000000003e-002 | AE202: 82.05 | AF202: 87.51 | AG202: 0.75 | AH202: AA- | AI202: 6.59e-002 | AJ202: =H202+100*O202 -> 116.64 | AK202: 116.1 | AL202: 63 | AM202: 28.6 | AN202: 114 | AO202: 7.4999999999999997e-002 | AP202: 13 | AQ202: 隆利转债
A203: 313 | B203: 128034 | C203: 江银转债! | D203: 2807 | E203: 江阴银行 | F203: 金融 | G203: 银行行业 | H203: 106 | I203: -8.9999999999999998e-004 | J203: -1.2999999999999999e-003 | K203: 4.26 | L203: -4.6999999999999993e-003 | M203: 108.3 | N203: 4.5 | O203: 0.12 | P203: 94.67 | Q203: 转股中 | R203: 2.82年 | S203: 无权 | T203: 17.6 | U203: 3.7 | V203: 2.e-003 | W203: 0.19 | X203: 0.17999999999999999 | Y203: 93 | Z203: 0.79 | AA203: 7.7000000000000002e-003 | AB203: 2.2000000000000001e-003 | AC203: 无权 | AD203: 无权 | AE203: 无权 | AF203: 97.16 | AG203: 0.47 | AH203: AA+ | AI203: 3.9699999999999999e-002 | AJ203: =H203+100*O203 -> 118. | AK203: 117.3 | AL203: 72 | AM203: 20.2 | AN203: 32 | AO203: -6.9999999999999993e-003 | AP203: 25 | AQ203: 江银转债!
A204: 210 | B204: 110062 | C204: 烽火转债! | D204: 600498 | E204: 烽火通信 | F204: 通信互联 | G204: 通信设备 | H204: 107.07 | I204: 1.e-003 | J204: -2.0000000000000001e-004 | K204: 18.64 | L204: 2.2000000000000001e-003 | M204: 110.8 | N204: 22.6 | O204: 0.29799999999999999 | P204: 82.48 | Q204: 转股中 | R204: 4.67年 | S204: 2.67年 | T204: 30.9 | U204: 9.3 | V204: 3.0000000000000001e-003 | W204: 0.14199999999999999 | X204: 0.11699999999999999 | Y204: 218 | Z204: 2.05 | AA204: 7.4999999999999997e-003 | AB204: 3.2000000000000002e-003 | AC204: -1.2699999999999999e-002 | AD204: -1.49e-002 | AE204: 93.02 | AF204: 93.42 | AG204: 0.38 | AH204: AAA | AI204: 3.7999999999999999e-002 | AJ204: =H204+100*O204 -> 136.87 | AK204: 131.7 | AL204: 213 | AM204: 38.2 | AN204: 204 | AO204: 3.0000000000000001e-003 | AP204: 21 | AQ204: 烽火转债!
A205: 190 | B205: 113563 | C205: 柳药转债 | D205: 603368 | E205: 柳药股份 | F205: 医药 | G205: 医药商业 | H205: 109.03 | I205: 1.1999999999999999e-003 | J205: -1.e-002 | K205: 22.2 | L205: -1.77e-002 | M205: 112.9 | N205: 24.47 | O205: 0.20199999999999999 | P205: 90.72 | Q205: 转股中 | R205: 4.79年 | S205: 2.79年 | T205: 8.02 | U205: 1.2 | V205: 1.e-003 | W205: 0.10000000000000001 | X205: 8.9999999999999997e-002 | Y205: 80 | Z205: 1.63 | AA205: 7.4000000000000003e-003 | AB205: 2.5000000000000001e-003 | AC205: -1.7899999999999999e-002 | AD205: -2.0099999999999996e-002 | AE205: 91.4 | AF205: 92.64 | AG205: 0.5 | AH205: AA | AI205: 4.2999999999999997e-002 | AJ205: =H205+100*O205 -> 129.22999999999999 | AK205: 127.3 | AL205: 180 | AM205: 34.7 | AN205: 175 | AO205: 2.2000000000000002e-002 | AP205: 18 | AQ205: 柳药转债
A206: 73 | B206: 123070 | C206: 鹏辉转债 | D206: 300438 | E206: 鹏辉能源 | F206: 汽车 | G206: 零部件制 | H206: 110.58 | I206: 2.3900000000000001e-002 | J206: -2.8999999999999998e-003 | K206: 16.7 | L206: 4.8300000000000003e-002 | M206: 115.1 | N206: 20.16 | O206: 0.33500000000000002 | P206: 82.84 | Q206: 24天 | R206: 5.55年 | S206: 3.55年 | T206: 8.9 | U206: 24 | V206: 2.4e-002 | W206: 0.127 | X206: 0.105 | Y206: 70 | Z206: 2.84 | AA206: 7.4000000000000003e-003 | AB206: 2.5000000000000001e-003 | AC206: -1.7500000000000002e-002 | AD206: -1.9299999999999998e-002 | AE206: 88.12 | AF206: 90.61 | AG206: 0.43 | AH206: AA | AI206: 4.4900000000000002e-002 | AJ206: =H206+100*O206 -> 144.07999999999998 | AK206: 138.3 | AL206: 257 | AM206: 47.7 | AN206: 261 | AO206: 2.9999999999999999e-002 | AP206: 5 | AQ206: 鹏辉转债
A207: 67 | B207: 123073 | C207: 同和转债! | D207: 300636 | E207: 同和药业 | F207: 医药 | G207: 原料药 | H207: 117.661 | I207: -6.1999999999999998e-003 | J207: -1.0200000000000001e-002 | K207: 27.74 | L207: -2.1499999999999998e-002 | M207: 122.4 | N207: 23.8 | O207: 9.0000000000000011e-003 | P207: 116.55 | Q207: 31天 | R207: 5.56年 | S207: 3.57年 | T207: 3.6 | U207: 56 | V207: 0.13 | W207: 0.10099999999999999 | X207: 0.11800000000000001 | Y207: 36 | Z207: 4.72 | AA207: 7.3000000000000001e-003 | AB207: 4.0000000000000002e-004 | AC207: -3.1400000000000004e-002 | AD207: -3.3700000000000001e-002 | AE207: 79.58 | AF207: 81.84 | AG207: 0.76 | AH207: A+ | AI207: 7.690000000000001e-002 | AJ207: =H207+100*O207 -> 118.56100000000001 | AK207: 118.8 | AL207: 87 | AM207: 36.9 | AN207: 190 | AO207: 6.4000000000000001e-002 | AP207: 10 | AQ207: 同和转债!
A208: 249 | B208: 113026 | C208: 核能转债! | D208: 601985 | E208: 中国核电 | F208: 能源电力 | G208: 核电 | H208: 106.86 | I208: -1.2999999999999999e-003 | J208: -9.7999999999999997e-003 | K208: 5.32 | L208: -2.3900000000000001e-002 | M208: 109.8 | N208: 5.86 | O208: 0.17699999999999999 | P208: 90.78 | Q208: 转股中 | R208: 4年12天 | S208: 2年13天 | T208: 78 | U208: 17 | V208: 2.e-003 | W208: 8.4000000000000005e-002 | X208: 7.5999999999999998e-002 | Y208: 929 | Z208: 1.59 | AA208: 6.8999999999999999e-003 | AB208: 2.3e-003 | AC208: -1.54e-002 | AD208: -1.83e-002 | AE208: 95.24 | AF208: 94.79 | AG208: 0.47 | AH208: AAA | AI208: 3.7999999999999999e-002 | AJ208: =H208+100*O208 -> 124.56 | AK208: 122.9 | AL208: 134 | AM208: 27.7 | AN208: 96 | AO208: -2.7999999999999997e-002 | AP208: 47 | AQ208: 核能转债!
A209: 90 | B209: 128129 | C209: 青农转债! | D209: 2958 | E209: 青农商行 | F209: 金融 | G209: 银行行业 | H209: 108.23 | I209: 5.0000000000000001e-004 | J209: 2.8999999999999998e-003 | K209: 4.46 | L209: 9.0000000000000011e-003 | M209: 112.2 | N209: 5.74 | O209: 0.39299999999999996 | P209: 77.7 | Q209: 转股中 | R209: 5.39年 | S209: 无权 | T209: 50 | U209: 19 | V209: 4.0000000000000001e-003 | W209: 0.20199999999999999 | X209: 0.157 | Y209: 248 | Z209: 0.96 | AA209: 6.8000000000000005e-003 | AB209: 2.5999999999999999e-003 | AC209: 无权 | AD209: 无权 | AE209: 无权 | AF209: 91.14 | AG209: 0.37 | AH209: AAA | AI209: 3.9900000000000005e-002 | AJ209: =H209+100*O209 -> 147.53 | AK209: 138.8 | AL209: 262 | AM209: 47.6 | AN209: 260 | AO209: -1.1000000000000001e-002 | AP209: 14 | AQ209: 青农转债!
A210: 117 | B210: 127020 | C210: 中金转债 | D210: 60 | E210: 中金岭南 | F210: 有色金属 | G210: 有色行业 | H210: 109.802 | I210: 5.1000000000000004e-003 | J210: -1.2999999999999999e-003 | K210: 4.59 | L210: 6.6e-003 | M210: 113.7 | N210: 4.71 | O210: 0.127 | P210: 97.45 | Q210: 转股中 | R210: 5.30年 | S210: 3.30年 | T210: 38 | U210: 20 | V210: 5.0000000000000001e-003 | W210: 0.23199999999999998 | X210: 0.22600000000000001 | Y210: 164 | Z210: 1.42 | AA210: 6.7000000000000002e-003 | AB210: 2.e-003 | AC210: -1.9900000000000001e-002 | AD210: -2.12e-002 | AE210: 88.66 | AF210: 91.29 | AG210: 0.57 | AH210: AA+ | AI210: 4.2900000000000001e-002 | AJ210: =H210+100*O210 -> 122.50200000000001 | AK210: 122.2 | AL210: 124 | AM210: 30.9 | AN210: 136 | AO210: 2.e-003 | AP210: 14 | AQ210: 中金转债
A211: 94 | B211: 128128 | C211: 齐翔转2 | D211: 2408 | E211: 齐翔腾达 | F211: 化工 | G211: 化工 | H211: 111.8 | I211: -1.24e-002 | J211: 1.1999999999999999e-003 | K211: 9.15 | L211: -1.61e-002 | M211: 115.3 | N211: 8.22 | O211: 4.0000000000000001e-003 | P211: 111.31 | Q211: 转股中 | R211: 5.38年 | S211: 3.38年 | T211: 17.5 | U211: 84 | V211: 4.2999999999999997e-002 | W211: 0.10400000000000001 | X211: 0.11599999999999999 | Y211: 168 | Z211: 1.98 | AA211: 5.8999999999999999e-003 | AB211: 7.000000000000001e-004 | AC211: -2.1099999999999997e-002 | AD211: -2.3e-002 | AE211: 88.88 | AF211: 91.46 | AG211: 0.69 | AH211: AA | AI211: 4.4900000000000002e-002 | AJ211: =H211+100*O211 -> 112.2 | AK211: 112.3 | AL211: 32 | AM211: 20.8 | AN211: 36 | AO211: -3.2000000000000001e-002 | AP211: 40 | AQ211: 齐翔转2
A212: 345 | B212: 110031 | C212: 航信转债!! | D212: 600271 | E212: 航天信息 | F212: 计算机及 | G212: 软件开发 | H212: 106.88 | I212: 5.0000000000000001e-004 | J212: -5.0000000000000001e-004 | K212: 12.7 | L212: 1.6000000000000001e-003 | M212: 107 | N212: 21.56 | O212: 0.81400000000000006 | P212: 58.91 | Q212: 转股中 | R212: 0.19年 | S212: 回售内 | T212: 24 | U212: 5.4 | V212: 2.e-003 | W212: 0.10199999999999999 | X212: 5.9999999999999998e-002 | Y212: 235 | Z212: 1.94 | AA212: 5.7999999999999996e-003 | AB212: -6.0100000000000001e-002 | AC212: 回售内 | AD212: 回售内 | AE212: 100.27 | AF212: 106.43 | AG212: 0 | AH212: AAA | AI212: 2.7699999999999999e-002 | AJ212: =H212+100*O212 -> 188.28 | AK212: 154.9 | AL212: 308 | AM212: 48.4 | AN212: 268 | AO212: 0.10099999999999999 | AP212: 15 | AQ212: 航信转债!!
A213: 285 | B213: 128048 | C213: 张行转债 | D213: 2839 | E213: 张家港行 | F213: 金融 | G213: 银行行业 | H213: 111.2 | I213: 3.4999999999999996e-003 | J213: -8.0000000000000004e-004 | K213: 5.57 | L213: 5.4000000000000003e-003 | M213: 113.3 | N213: 5.76 | O213: 0.14999999999999999 | P213: 96.7 | Q213: 转股中 | R213: 3.61年 | S213: 无权 | T213: 25 | U213: 3 | V213: 1.e-003 | W213: 0.248 | X213: 0.23999999999999999 | Y213: 101 | Z213: 0.96 | AA213: 5.3e-003 | AB213: -1.4000000000000002e-003 | AC213: 无权 | AD213: 无权 | AE213: 无权 | AF213: 98.27 | AG213: 0.5 | AH213: AA+ | AI213: 4.0999999999999995e-002 | AJ213: =H213+100*O213 -> 126.2 | AK213: 125.7 | AL213: 165 | AM213: 27.4 | AN213: 95 | AO213: -2.8999999999999998e-002 | AP213: 13 | AQ213: 张行转债
A214: 74 | B214: 128135 | C214: 洽洽转债! | D214: 2557 | E214: 洽洽食品 | F214: 食品饮料 | G214: 休闲食品 | H214: 117 | I214: 1.21e-002 | J214: 7.0999999999999995e-003 | K214: 50.12 | L214: 5.0099999999999999e-002 | M214: 120.2 | N214: 60.83 | O214: 0.41999999999999998 | P214: 82.39 | Q214: 24天 | R214: 5.55年 | S214: 3.55年 | T214: 13.4 | U214: 32 | V214: 2.1000000000000001e-002 | W214: 5.2999999999999999e-002 | X214: 4.2999999999999997e-002 | Y214: 254 | Z214: 6.63 | AA214: 5.0000000000000001e-003 | AB214: -1.2999999999999999e-003 | AC214: -3.2199999999999999e-002 | AD214: -3.4000000000000002e-002 | AE214: 88.22 | AF214: 94.62 | AG214: 0.38 | AH214: AA | AI214: 4.4900000000000002e-002 | AJ214: =H214+100*O214 -> 159. | AK214: 151.6 | AL214: 303 | AM214: 57 | AN214: 294 | AO214: 0. | AP214: 10 | AQ214: 洽洽转债!
A215: 267 | B215: 127011 | C215: 中鼎转2! | D215: 887 | E215: 中鼎股份 | F215: 汽车 | G215: 零部件制 | H215: 112.38 | I215: -3.4999999999999996e-003 | J215: 2.5000000000000001e-003 | K215: 9.89 | L215: -3.0000000000000001e-003 | M215: 114.5 | N215: 11.59 | O215: 0.317 | P215: 85.33 | Q215: 转股中 | R215: 3.93年 | S215: 1.93年 | T215: 12 | U215: 5 | V215: 4.0000000000000001e-003 | W215: 9.9000000000000005e-002 | X215: 8.5000000000000006e-002 | Y215: 121 | Z215: 1.38 | AA215: 4.8999999999999998e-003 | AB215: -1.8e-003 | AC215: -4.1700000000000001e-002 | AD215: -4.4199999999999996e-002 | AE215: 94.57 | AF215: 98.05 | AG215: 0.36 | AH215: AA+ | AI215: 4.0999999999999995e-002 | AJ215: =H215+100*O215 -> 144.07999999999998 | AK215: 139.4 | AL215: 266 | AM215: 41.4 | AN215: 222 | AO215: -6.0999999999999999e-002 | AP215: 24 | AQ215: 中鼎转2!
A216: 326 | B216: 128021 | C216: 兄弟转债!! | D216: 2562 | E216: 兄弟科技 | F216: 医药 | G216: 原料药 | H216: 107.444 | I216: -5.1000000000000004e-003 | J216: 5.1000000000000004e-003 | K216: 4.96 | L216: 0. | M216: 108.8 | N216: 5.19 | O216: 0.124 | P216: 95.57 | Q216: 转股中 | R216: 2.66年 | S216: 0.66年 | T216: 2.65 | U216: 5.1 | V216: 1.8000000000000002e-002 | W216: 5.0000000000000003e-002 | X216: 4.8000000000000001e-002 | Y216: 53 | Z216: 1.93 | AA216: 4.7999999999999996e-003 | AB216: -1.4000000000000002e-003 | AC216: -6.6299999999999998e-002 | AD216: -6.9800000000000001e-002 | AE216: 98.2 | AF216: 97.76 | AG216: 0.52 | AH216: AA | AI216: 4.1700000000000001e-002 | AJ216: =H216+100*O216 -> 119.84400000000001 | AK216: 119.3 | AL216: 97 | AM216: 21.1 | AN216: 39 | AO216: -1.4999999999999999e-002 | AP216: 14 | AQ216: 兄弟转债!!
A217: 124 | B217: 128119 | C217: 龙大转债! | D217: 2726 | E217: 龙大肉食 | F217: 食品饮料 | G217: 肉制品 | H217: 117.399 | I217: 2.0000000000000001e-004 | J217: -1.29e-002 | K217: 9.83 | L217: -2.1899999999999999e-002 | M217: 120.2 | N217: 9.57 | O217: 0.14300000000000002 | P217: 102.72 | Q217: 转股中 | R217: 5.28年 | S217: 3.28年 | T217: 9.5 | U217: 9 | V217: 8.0000000000000002e-003 | W217: 9.6999999999999989e-002 | X217: 9.9000000000000005e-002 | Y217: 98 | Z217: 3.05 | AA217: 4.5999999999999999e-003 | AB217: -2.e-003 | AC217: -3.5699999999999996e-002 | AD217: -3.7599999999999995e-002 | AE217: 89.27 | AF217: 95.76 | AG217: 0.58 | AH217: AA | AI217: 4.4900000000000002e-002 | AJ217: =H217+100*O217 -> 131.69900000000001 | AK217: 132.1 | AL217: 223 | AM217: 36.3 | AN217: 187 | AO217: -7.5999999999999998e-002 | AP217: 8 | AQ217: 龙大转债!
A218: 27 | B218: 123090 | C218: 三诺转债 | D218: 300298 | E218: 三诺生物 | F218: 医药 | G218: 医疗器械 | H218: 114.403 | I218: 1.7000000000000001e-003 | J218: -3.7000000000000002e-003 | K218: 30.57 | L218: -4.1999999999999997e-003 | M218: 117.1 | N218: 35.35 | O218: 0.32299999999999995 | P218: 86.48 | Q218: 2月24天 | R218: 5.72年 | S218: 3.72年 | T218: 5 | U218: 5.4 | V218: 9.0000000000000011e-003 | W218: 2.8999999999999998e-002 | X218: 2.5000000000000001e-002 | Y218: 173 | Z218: 6.38 | AA218: 4.1999999999999997e-003 | AB218: -1.1000000000000001e-003 | AC218: -2.5399999999999999e-002 | AD218: -2.7099999999999999e-002 | AE218: 87.47 | AF218: 91.49 | AG218: 0.47 | AH218: AA | AI218: 4.4900000000000002e-002 | AJ218: =H218+100*O218 -> 146.703 | AK218: 142.3 | AL218: 275 | AM218: 50.8 | AN218: 279 | AO218: -8.0000000000000002e-003 | AP218: 3 | AQ218: 三诺转债
A219: 244 | B219: 113536 | C219: 三星转债 | D219: 603578 | E219: 三星新材 | F219: 家电 | G219: 零部件制 | H219: 112.89 | I219: 3.0000000000000001e-003 | J219: 1.e-004 | K219: 20.03 | L219: 5.5000000000000005e-003 | M219: 114.8 | N219: 19.54 | O219: 0.10099999999999999 | P219: 102.51 | Q219: 转股中 | R219: 4年58天 | S219: 2年59天 | T219: 1.49 | U219: 4.9 | V219: 2.8999999999999998e-002 | W219: 8.1000000000000003e-002 | X219: 8.3000000000000004e-002 | Y219: 18 | Z219: 2.55 | AA219: 4.0999999999999995e-003 | AB219: -2.3e-003 | AC219: -3.78e-002 | AD219: -4.0399999999999998e-002 | AE219: 93.75 | AF219: 96.71 | AG219: 0.57 | AH219: AA | AI219: 4.2999999999999997e-002 | AJ219: =H219+100*O219 -> 122.98999999999999 | AK219: 123.3 | AL219: 139 | AM219: 26.6 | AN219: 85 | AO219: 1.e-002 | AP219: 37 | AQ219: 三星转债
A220: 120 | B220: 128121 | C220: 宏川转债! | D220: 2930 | E220: 宏川智慧 | F220: 交通运输 | G220: 物流业 | H220: 111.001 | I220: 1.37e-002 | J220: -1.3100000000000001e-002 | K220: 16.49 | L220: 1.1999999999999999e-003 | M220: 113.3 | N220: 20.25 | O220: 0.36299999999999999 | P220: 81.43 | Q220: 转股中 | R220: 5.29年 | S220: 3.29年 | T220: 6.7 | U220: 7.3 | V220: 1.e-002 | W220: 9.1999999999999998e-002 | X220: 7.4999999999999997e-002 | Y220: 73 | Z220: 3.81 | AA220: 4.0000000000000001e-003 | AB220: -5.9999999999999995e-004 | AC220: -1.9400000000000001e-002 | AD220: -2.1499999999999998e-002 | AE220: 83.46 | AF220: 81.45 | AG220: 0.53 | AH220: AA- | AI220: 6.59e-002 | AJ220: =H220+100*O220 -> 147.30099999999999 | AK220: 140.6 | AL220: 268 | AM220: 57.1 | AN220: 296 | AO220: -3.3000000000000002e-002 | AP220: 4 | AQ220: 宏川转债!
A221: 8 | B221: 118000 | C221: 嘉元转债 | D221: 688388 | E221: 嘉元科技 | F221: 电子 | G221: 电子产品 | H221: 118.27 | I221: 3.2000000000000002e-003 | J221: -4.0999999999999995e-003 | K221: 77.54 | L221: -1.4000000000000002e-003 | M221: 121 | N221: 78.99 | O221: 0.20499999999999999 | P221: 98.16 | Q221: 5月2天 | R221: 5.89年 | S221: 3.90年 | T221: 12.4 | U221: 24 | V221: 1.7000000000000001e-002 | W221: 6.9000000000000006e-002 | X221: 6.8000000000000005e-002 | Y221: 179 | Z221: 6.86 | AA221: 4.0000000000000001e-003 | AB221: -2.2000000000000001e-003 | AC221: -3.1600000000000003e-002 | AD221: -3.3399999999999999e-002 | AE221: 80.39 | AF221: 83.68 | AG221: 0.65 | AH221: AA- | AI221: 6.59e-002 | AJ221: =H221+100*O221 -> 138.76999999999998 | AK221: 138.4 | AL221: 259 | AM221: 54.7 | AN221: 290 | AO221: 7.5999999999999998e-002 | AP221: 3 | AQ221: 嘉元转债
A222: 280 | B222: 128051 | C222: 光华转债! | D222: 2741 | E222: 光华科技 | F222: 电子 | G222: 元器件制 | H222: 113.18 | I222: -2.0000000000000001e-004 | J222: -3.7000000000000002e-003 | K222: 14.32 | L222: -5.6000000000000008e-003 | M222: 114.8 | N222: 12.72 | O222: 5.0000000000000001e-003 | P222: 112.58 | Q222: 转股中 | R222: 3.70年 | S222: 1.70年 | T222: 2.47 | U222: 12 | V222: 4.2999999999999997e-002 | W222: 4.5999999999999999e-002 | X222: 5.2000000000000005e-002 | Y222: 54 | Z222: 4.43 | AA222: 3.9000000000000003e-003 | AB222: -3.3e-003 | AC222: -4.8899999999999999e-002 | AD222: -5.1900000000000002e-002 | AE222: 91.93 | AF222: 91.7 | AG222: 0.71 | AH222: AA- | AI222: 6.4000000000000001e-002 | AJ222: =H222+100*O222 -> 113.68000000000001 | AK222: 113.8 | AL222: 39 | AM222: 21.8 | AN222: 44 | AO222: 2.e-002 | AP222: 26 | AQ222: 光华转债!
A223: 1 | B223: 123104 | C223: 卫宁转债 | D223: 300253 | E223: 卫宁健康 | F223: 计算机及 | G223: 软件开发 | H223: 122.61 | I223: 2.e-002 | J223: -2.5000000000000001e-003 | K223: 17.34 | L223: 3.3399999999999999e-002 | M223: 125.1 | N223: 17.76 | O223: 0.25600000000000001 | P223: 97.64 | Q223: 5月23天 | R223: 5.95年 | S223: 3.95年 | T223: 9.7 | U223: 239 | V223: 0.19899999999999998 | W223: 2.6000000000000002e-002 | X223: 2.6000000000000002e-002 | Y223: 371 | Z223: 9.16 | AA223: 3.4000000000000002e-003 | AB223: -3.4999999999999996e-003 | AC223: -4.0300000000000002e-002 | AD223: -4.1900000000000007e-002 | AE223: 86.58 | AF223: 96.72 | AG223: 0.52 | AH223: AA | AI223: 4.4900000000000002e-002 | AJ223: =H223+100*O223 -> 148.21000000000001 | AK223: 147.6 | AL223: 292 | AM223: 50.9 | AN223: 280 | AO223: 5.2999999999999999e-002 | AP223: 2 | AQ223: 卫宁转债
A224: 224 | B224: 128078 | C224: 太极转债! | D224: 2368 | E224: 太极股份 | F224: 计算机及 | G224: 软件开发 | H224: 115.2 | I224: 2.0199999999999999e-002 | J224: -2.0199999999999999e-002 | K224: 21.97 | L224: 3.1899999999999998e-002 | M224: 116.9 | N224: 22.4 | O224: 0.17499999999999999 | P224: 98.08 | Q224: 转股中 | R224: 4.55年 | S224: 2.55年 | T224: 9.6 | U224: 30 | V224: 2.6000000000000002e-002 | W224: 7.4999999999999997e-002 | X224: 7.400000000000001e-002 | Y224: 127 | Z224: 4.14 | AA224: 3.3e-003 | AB224: -3.3e-003 | AC224: -3.9300000000000002e-002 | AD224: -4.1599999999999998e-002 | AE224: 92.32 | AF224: 96.88 | AG224: 0 | AH224: AA | AI224: 4.2999999999999997e-002 | AJ224: =H224+100*O224 -> 132.69999999999999 | AK224: 132.3 | AL224: 224 | AM224: 35.4 | AN224: 179 | AO224: 4.9000000000000002e-002 | AP224: 11 | AQ224: 太极转债!
A225: 19 | B225: 113618 | C225: 美诺转债! | D225: 603538 | E225: 美诺华 | F225: 医药 | G225: 原料药 | H225: 113.29 | I225: 4.7e-002 | J225: -2.3099999999999999e-002 | K225: 34 | L225: 3.7200000000000004e-002 | M225: 115.3 | N225: 37.47 | O225: 0.249 | P225: 90.74 | Q225: 3月19天 | R225: 5.78年 | S225: 3.79年 | T225: 5.2 | U225: 123 | V225: 0.20899999999999999 | W225: 0.10199999999999999 | X225: 9.3000000000000013e-002 | Y225: 51 | Z225: 3.34 | AA225: 3.0999999999999999e-003 | AB225: -1.6000000000000001e-003 | AC225: -2.2099999999999998e-002 | AD225: -2.3900000000000001e-002 | AE225: 80.86 | AF225: 80.29 | AG225: 0.64 | AH225: AA- | AI225: 6.59e-002 | AJ225: =H225+100*O225 -> 138.19 | AK225: 135.8 | AL225: 242 | AM225: 55 | AN225: 292 | AO225: 9.3000000000000013e-002 | AP225: 3 | AQ225: 美诺转债!
A226: 175 | B226: 113572 | C226: 三祥转债! | D226: 603663 | E226: 三祥新材 | F226: 其他 | G226: 其他 | H226: 111.19 | I226: 1.4000000000000002e-003 | J226: -1.37e-002 | K226: 14.15 | L226: -1.7399999999999999e-002 | M226: 112.8 | N226: 14.19 | O226: 0.115 | P226: 99.72 | Q226: 转股中 | R226: 4.94年 | S226: 2.94年 | T226: 1.69 | U226: 1.5 | V226: 8.0000000000000002e-003 | W226: 6.2e-002 | X226: 6.2e-002 | Y226: 27 | Z226: 4.43 | AA226: 3.0000000000000001e-003 | AB226: -1.8e-003 | AC226: -2.35e-002 | AD226: -2.5499999999999998e-002 | AE226: 82.64 | AF226: 79.44 | AG226: 0.71 | AH226: A+ | AI226: 7.4999999999999997e-002 | AJ226: =H226+100*O226 -> 122.69 | AK226: 122.7 | AL226: 129 | AM226: 40 | AN226: 216 | AO226: -0.127 | AP226: 18 | AQ226: 三祥转债!
A227: 327 | B227: 123002 | C227: 国祯转债!! | D227: 300388 | E227: 节能国祯 | F227: 城市公用 | G227: 三废处理 | H227: 107.986 | I227: 3.8e-003 | J227: -1.1000000000000001e-002 | K227: 8 | L227: -1.4800000000000001e-002 | M227: 108.8 | N227: 8.48 | O227: 0.14499999999999999 | P227: 94.34 | Q227: 转股中 | R227: 2.65年 | S227: 0.65年 | T227: 2.52 | U227: 4.4 | V227: 1.6e-002 | W227: 4.4999999999999998e-002 | X227: 4.2999999999999997e-002 | Y227: 56 | Z227: 1.48 | AA227: 2.8999999999999998e-003 | AB227: -3.4000000000000002e-003 | AC227: -7.2999999999999995e-002 | AD227: -7.6399999999999996e-002 | AE227: 98.24 | AF227: 97.81 | AG227: 0.48 | AH227: AA | AI227: 4.1700000000000001e-002 | AJ227: =H227+100*O227 -> 122.486 | AK227: 121.6 | AL227: 120 | AM227: 23.4 | AN227: 60 | AO227: -5.9000000000000004e-002 | AP227: 15 | AQ227: 国祯转债!!
A228: 38 | B228: 113043 | C228: 财通转债 | D228: 601108 | E228: 财通证券 | F228: 金融 | G228: 证券行业 | H228: 108.41 | I228: -2.0000000000000001e-004 | J228: -7.000000000000001e-004 | K228: 11.21 | L228: -1.8e-003 | M228: 110.2 | N228: 13.33 | O228: 0.28899999999999998 | P228: 84.1 | Q228: 2月15天 | R228: 5.69年 | S228: 无权 | T228: 38 | U228: 14 | V228: 3.0000000000000001e-003 | W228: 9.4e-002 | X228: 7.9000000000000001e-002 | Y228: 402 | Z228: 1.85 | AA228: 2.8999999999999998e-003 | AB228: -4.0000000000000002e-004 | AC228: 无权 | AD228: 无权 | AE228: 无权 | AF228: 88.48 | AG228: 0.47 | AH228: AAA | AI228: 3.9900000000000005e-002 | AJ228: =H228+100*O228 -> 137.31 | AK228: 132.7 | AL228: 227 | AM228: 44.2 | AN228: 242 | AO228: -2.5000000000000001e-002 | AP228: 9 | AQ228: 财通转债
A229: 177 | B229: 110067 | C229: 华安转债! | D229: 600909 | E229: 华安证券 | F229: 金融 | G229: 证券行业 | H229: 109.12 | I229: -8.9999999999999998e-004 | J229: 1.4000000000000002e-003 | K229: 6.42 | L229: 1.6000000000000001e-003 | M229: 110.3 | N229: 8.67 | O229: 0.47399999999999998 | P229: 74.05 | Q229: 转股中 | R229: 4.94年 | S229: 无权 | T229: 28 | U229: 29 | V229: 1.e-002 | W229: 0.12 | X229: 8.900000000000001e-002 | Y229: 232 | Z229: 1.65 | AA229: 2.2000000000000001e-003 | AB229: -1.7000000000000001e-003 | AC229: 无权 | AD229: 无权 | AE229: 无权 | AF229: 91.94 | AG229: 0.3 | AH229: AAA | AI229: 3.7999999999999999e-002 | AJ229: =H229+100*O229 -> 156.52000000000001 | AK229: 144.2 | AL229: 287 | AM229: 52.2 | AN229: 284 | AO229: -2.2000000000000002e-002 | AP229: 27 | AQ229: 华安转债!
A230: 62 | B230: 110076 | C230: 华海转债! | D230: 600521 | E230: 华海药业 | F230: 医药 | G230: 医药行业 | H230: 114.01 | I230: 1.5e-003 | J230: -5.1000000000000004e-003 | K230: 25.04 | L230: -1.1399999999999999e-002 | M230: 115.1 | N230: 34.66 | O230: 0.57799999999999996 | P230: 72.24 | Q230: 34天 | R230: 5.58年 | S230: 3.59年 | T230: 18.4 | U230: 6.5 | V230: 3.0000000000000001e-003 | W230: 5.0999999999999997e-002 | X230: 3.7000000000000005e-002 | Y230: 364 | Z230: 5.89 | AA230: 1.7000000000000001e-003 | AB230: -3.0999999999999999e-003 | AC230: -2.5399999999999999e-002 | AD230: -2.7200000000000002e-002 | AE230: 87.98 | AF230: 90.47 | AG230: 0.32 | AH230: AA | AI230: 4.4900000000000002e-002 | AJ230: =H230+100*O230 -> 171.81 | AK230: 155.8 | AL230: 311 | AM230: 65.3 | AN230: 310 | AO230: -2.7999999999999997e-002 | AP230: 6 | AQ230: 华海转债!
A231: 260 | B231: 127012 | C231: 招路转债! | D231: 1965 | E231: 招商公路 | F231: 机场高速 | G231: 高速 | H231: 107.32 | I231: -2.0999999999999999e-003 | J231: -8.8000000000000005e-003 | K231: 7.6 | L231: -2.69e-002 | M231: 107.9 | N231: 8.81 | O231: 0.24399999999999999 | P231: 86.27 | Q231: 转股中 | R231: 3.97年 | S231: 1.97年 | T231: 50 | U231: 45 | V231: 8.0000000000000002e-003 | W231: 0.106 | X231: 9.1999999999999998e-002 | Y231: 470 | Z231: 0.97 | AA231: 1.4000000000000002e-003 | AB231: -2.3999999999999998e-003 | AC231: -2.52e-002 | AD231: -2.6600000000000002e-002 | AE231: 93.89 | AF231: 93.21 | AG231: 0.41 | AH231: AAA | AI231: 3.7999999999999999e-002 | AJ231: =H231+100*O231 -> 131.72 | AK231: 128.4 | AL231: 195 | AM231: 34.5 | AN231: 172 | AO231: 1.8000000000000002e-002 | AP231: 33 | AQ231: 招路转债!
A232: 48 | B232: 123079 | C232: 运达转债 | D232: 300772 | E232: 运达股份 | F232: 能源电力 | G232: 风能 | H232: 114.2 | I232: 1.5e-003 | J232: 4.7999999999999996e-003 | K232: 14.69 | L232: 1.1000000000000001e-002 | M232: 115.1 | N232: 15.31 | O232: 0.19 | P232: 95.95 | Q232: 2月6天 | R232: 5.66年 | S232: 3.67年 | T232: 5.77 | U232: 7.7 | V232: 1.2e-002 | W232: 0.13400000000000001 | X232: 0.128 | Y232: 43 | Z232: 2.81 | AA232: 1.4000000000000002e-003 | AB232: -3.3e-003 | AC232: -2.53e-002 | AD232: -2.7000000000000003e-002 | AE232: 87.68 | AF232: 90.16 | AG232: 0.57 | AH232: AA | AI232: 4.4900000000000002e-002 | AJ232: =H232+100*O232 -> 133.19999999999999 | AK232: 132.4 | AL232: 225 | AM232: 42.3 | AN232: 229 | AO232: -4.0999999999999995e-002 | AP232: 4 | AQ232: 运达转债
A233: 344 | B233: 110033 | C233: 国贸转债! | D233: 600755 | E233: 厦门国贸 | F233: 交通运输 | G233: 交通运输 | H233: 107.9 | I233: 8.9999999999999998e-004 | J233: -2.0999999999999999e-003 | K233: 6.56 | L233: -9.1000000000000004e-003 | M233: 108 | N233: 7.18 | O233: 0.18100000000000002 | P233: 91.36 | Q233: 转股中 | R233: 0.76年 | S233: 回售内 | T233: 12.1 | U233: 12 | V233: 9.0000000000000011e-003 | W233: 9.5000000000000001e-002 | X233: 8.6999999999999994e-002 | Y233: 128 | Z233: 0.85 | AA233: 1.1999999999999999e-003 | AB233: -1.8200000000000001e-002 | AC233: 回售内 | AD233: 回售内 | AE233: 100.33 | AF233: 105.3 | AG233: 0.13 | AH233: AAA | AI233: 3.3799999999999997e-002 | AJ233: =H233+100*O233 -> 126. | AK233: 124.4 | AL233: 151 | AM233: 19.1 | AN233: 28 | AO233: -1.3000000000000001e-002 | AP233: 18 | AQ233: 国贸转债!
A234: 146 | B234: 127017 | C234: 万青转债 | D234: 789 | E234: 万年青 | F234: 建筑 | G234: 水泥 | H234: 117.775 | I234: 8.5000000000000006e-003 | J234: -1.7899999999999999e-002 | K234: 13.79 | L234: -1.78e-002 | M234: 118.4 | N234: 14.16 | O234: 0.20899999999999999 | P234: 97.39 | Q234: 转股中 | R234: 5.17年 | S234: 3.17年 | T234: 10 | U234: 7.5 | V234: 6.0000000000000001e-003 | W234: 9.0999999999999998e-002 | X234: 8.900000000000001e-002 | Y234: 110 | Z234: 1.76 | AA234: 1.e-003 | AB234: -5.1999999999999998e-003 | AC234: -3.7699999999999997e-002 | AD234: -3.9699999999999999e-002 | AE234: 90.31 | AF234: 95.72 | AG234: 0.53 | AH234: AA+ | AI234: 4.2900000000000001e-002 | AJ234: =H234+100*O234 -> 138.67500000000001 | AK234: 138.2 | AL234: 255 | AM234: 42.4 | AN234: 230 | AO234: 1.7000000000000001e-002 | AP234: 9 | AQ234: 万青转债
A235: 29 | B235: 128141 | C235: 旺能转债 | D235: 2034 | E235: 旺能环境 | F235: 城市公用 | G235: 三废处理 | H235: 114.5 | I235: 3.4999999999999996e-003 | J235: -1.4199999999999999e-002 | K235: 18.09 | L235: -1.5800000000000002e-002 | M235: 115.1 | N235: 16.47 | O235: 4.2000000000000003e-002 | P235: 109.84 | Q235: 2月22天 | R235: 5.71年 | S235: 3.71年 | T235: 14 | U235: 18 | V235: 1.1000000000000001e-002 | W235: 0.184 | X235: 0.20199999999999999 | Y235: 76 | Z235: 1.72 | AA235: 8.9999999999999998e-004 | AB235: -3.8e-003 | AC235: -2.5699999999999997e-002 | AD235: -2.7400000000000001e-002 | AE235: 87.51 | AF235: 89.98 | AG235: 0.68 | AH235: AA | AI235: 4.4900000000000002e-002 | AJ235: =H235+100*O235 -> 118.7 | AK235: 119.2 | AL235: 95 | AM235: 29.2 | AN235: 121 | AO235: -2.7000000000000003e-002 | AP235: 4 | AQ235: 旺能转债
A236: 342 | B236: 113009 | C236: 广汽转债! | D236: 601238 | E236: 广汽集团 | F236: 汽车 | G236: 乘用车 | H236: 105.94 | I236: 1.1000000000000001e-003 | J236: -1.1000000000000001e-003 | K236: 10.3 | L236: 5.8999999999999999e-003 | M236: 106 | N236: 14.12 | O236: 0.45200000000000001 | P236: 72.95 | Q236: 转股中 | R236: 0.81年 | S236: 回售内 | T236: 25.5 | U236: 7.6 | V236: 3.0000000000000001e-003 | W236: 2.4e-002 | X236: 1.7000000000000001e-002 | Y236: 1066. | Z236: 1.27 | AA236: 7.000000000000001e-004 | AB236: -1.3300000000000001e-002 | AC236: 回售内 | AD236: 回售内 | AE236: 100.27 | AF236: 103.19 | AG236: 0.01 | AH236: AAA | AI236: 3.3799999999999997e-002 | AJ236: =H236+100*O236 -> 151.13999999999999 | AK236: 138.9 | AL236: 264 | AM236: 35.7 | AN236: 182 | AO236: -2.5000000000000001e-002 | AP236: 15 | AQ236: 广汽转债!
A237: 243 | B237: 113537 | C237: 文灿转债!! | D237: 603348 | E237: 文灿股份 | F237: 汽车 | G237: 零部件制 | H237: 121.14 | I237: -5.3e-003 | J237: -2.e-003 | K237: 21.56 | L237: -1.1000000000000001e-002 | M237: 121.5 | N237: 19.43 | O237: 9.1999999999999998e-002 | P237: 110.96 | Q237: 转股中 | R237: 4.19年 | S237: 2.19年 | T237: 1.77 | U237: 2.7 | V237: 1.3000000000000001e-002 | W237: 3.2000000000000001e-002 | X237: 3.5000000000000003e-002 | Y237: 56 | Z237: 2.21 | AA237: 7.000000000000001e-004 | AB237: -8.0000000000000002e-003 | AC237: -6.1900000000000004e-002 | AD237: -6.5199999999999994e-002 | AE237: 90.42 | AF237: 94.39 | AG237: 0.66 | AH237: AA- | AI237: 6.4000000000000001e-002 | AJ237: =H237+100*O237 -> 130.34 | AK237: 131.3 | AL237: 209 | AM237: 36.9 | AN237: 191 | AO237: -1.e-002 | AP237: 25 | AQ237: 文灿转债!!
A238: 228 | B238: 128075 | C238: 远东转债! | D238: 2406 | E238: 远东传动 | F238: 汽车 | G238: 零部件制 | H238: 114.601 | I238: 0. | J238: -4.3e-003 | K238: 6.27 | L238: -6.3e-003 | M238: 114.9 | N238: 5.54 | O238: 1.3000000000000001e-002 | P238: 113.18 | Q238: 转股中 | R238: 4.47年 | S238: 2.48年 | T238: 5.44 | U238: 1.5 | V238: 2.e-003 | W238: 0.13900000000000001 | X238: 0.157 | Y238: 39 | Z238: 1.25 | AA238: 5.9999999999999995e-004 | AB238: -5.4000000000000003e-003 | AC238: -3.85e-002 | AD238: -4.0899999999999999e-002 | AE238: 92.62 | AF238: 95.54 | AG238: 0.68 | AH238: AA | AI238: 4.2999999999999997e-002 | AJ238: =H238+100*O238 -> 115.901 | AK238: 116 | AL238: 62 | AM238: 20.5 | AN238: 34 | AO238: -1.2e-002 | AP238: 15 | AQ238: 远东转债!
A239: 114 | B239: 123060 | C239: 苏试转债 | D239: 300416 | E239: 苏试试验 | F239: 机械装备 | G239: 专用设备 | H239: 117.5 | I239: 8.8999999999999999e-003 | J239: -1.11e-002 | K239: 23.3 | L239: -3.4000000000000002e-003 | M239: 117.6 | N239: 23.86 | O239: 0.20300000000000001 | P239: 97.65 | Q239: 转股中 | R239: 5.30年 | S239: 3.30年 | T239: 3.1 | U239: 2.6 | V239: 6.9999999999999993e-003 | W239: 6.5000000000000002e-002 | X239: 6.4000000000000001e-002 | Y239: 47 | Z239: 4.91 | AA239: 2.0000000000000001e-004 | AB239: -5.6999999999999993e-003 | AC239: -3.5099999999999999e-002 | AD239: -3.7200000000000004e-002 | AE239: 83.52 | AF239: 84.49 | AG239: 0.65 | AH239: AA- | AI239: 6.59e-002 | AJ239: =H239+100*O239 -> 137.80000000000001 | AK239: 137.3 | AL239: 253 | AM239: 52.9 | AN239: 286 | AO239: 3.5000000000000003e-002 | AP239: 9 | AQ239: 苏试转债
A240: 72 | B240: 123072 | C240: 乐歌转债! | D240: 300729 | E240: 乐歌股份 | F240: 其他 | G240: 家居用品 | H240: 129.65 | I240: 6.6e-003 | J240: -7.0999999999999995e-003 | K240: 33.23 | L240: -4.7999999999999996e-003 | M240: 129.6 | N240: 73.13 | O240: 1.8500000000000001 | P240: 45.44 | Q240: 25天 | R240: 5.55年 | S240: 3.55年 | T240: 1.42 | U240: 191 | V240: 1.04 | W240: 3.1e-002 | X240: 1.3999999999999999e-002 | Y240: 46 | Z240: 4.84 | AA240: -1.e-004 | AB240: -8.6999999999999994e-003 | AC240: -5.1699999999999996e-002 | AD240: -5.4800000000000001e-002 | AE240: 81.33 | AF240: 87.01 | AG240: 0.1 | AH240: A+ | AI240: 7.690000000000001e-002 | AJ240: =H240+100*O240 -> 314.64999999999998 | AK240: 213.9 | AL240: 330 | AM240: 126.9 | AN240: 331 | AO240: -7.4999999999999997e-002 | AP240: 8 | AQ240: 乐歌转债!
A241: 28 | B241: 128142 | C241: 新乳转债 | D241: 2946 | E241: 新乳业 | F241: 食品饮料 | G241: 乳制品 | H241: 115.505 | I241: -1.e-003 | J241: -1.4000000000000002e-003 | K241: 16.35 | L241: -4.8999999999999998e-003 | M241: 115.1 | N241: 18.69 | O241: 0.32000000000000001 | P241: 87.48 | Q241: 2月23天 | R241: 5.71年 | S241: 3.71年 | T241: 7.18 | U241: 16 | V241: 2.e-002 | W241: 5.0999999999999997e-002 | X241: 4.4999999999999998e-002 | Y241: 140 | Z241: 6.83 | AA241: -5.9999999999999995e-004 | AB241: -5.3e-003 | AC241: -2.7900000000000001e-002 | AD241: -2.9600000000000001e-002 | AE241: 87.5 | AF241: 89.97 | AG241: 0.49 | AH241: AA | AI241: 4.4900000000000002e-002 | AJ241: =H241+100*O241 -> 147.505 | AK241: 143.5 | AL241: 282 | AM241: 53.6 | AN241: 288 | AO241: -3.3000000000000002e-002 | AP241: 3 | AQ241: 新乳转债
A242: 236 | B242: 113542 | C242: 好客转债 | D242: 603898 | E242: 好莱客 | F242: 其他 | G242: 家居用品 | H242: 115.26 | I242: -5.6000000000000008e-003 | J242: -1.03e-002 | K242: 17.09 | L242: -2.6200000000000001e-002 | M242: 114.9 | N242: 16.27 | O242: 9.6999999999999989e-002 | P242: 105.04 | Q242: 转股中 | R242: 4.33年 | S242: 2.33年 | T242: 6.03 | U242: 2.5 | V242: 4.0000000000000001e-003 | W242: 0.113 | X242: 0.11900000000000001 | Y242: 53 | Z242: 2.17 | AA242: -7.000000000000001e-004 | AB242: -6.8999999999999999e-003 | AC242: -4.2999999999999997e-002 | AD242: -4.5400000000000003e-002 | AE242: 93.18 | AF242: 96.12 | AG242: 0.61 | AH242: AA | AI242: 4.2999999999999997e-002 | AJ242: =H242+100*O242 -> 124.96000000000001 | AK242: 125.5 | AL242: 163 | AM242: 29.4 | AN242: 124 | AO242: -1.8000000000000002e-002 | AP242: 18 | AQ242: 好客转债
A243: 284 | B243: 110047 | C243: 山鹰转债 | D243: 600567 | E243: 山鹰国际 | F243: 造纸包装 | G243: 包装用纸 | H243: 118.15 | I243: -7.0999999999999995e-003 | J243: -2.5000000000000001e-003 | K243: 3.63 | L243: -1.6299999999999999e-002 | M243: 117.5 | N243: 3.34 | O243: 8.6999999999999994e-002 | P243: 108.68 | Q243: 转股中 | R243: 3.64年 | S243: 1.64年 | T243: 22.5 | U243: 19 | V243: 6.9999999999999993e-003 | W243: 0.13500000000000001 | X243: 0.14599999999999999 | Y243: 167 | Z243: 1.13 | AA243: -1.5e-003 | AB243: -9.8999999999999991e-003 | AC243: -7.46e-002 | AD243: -7.7300000000000008e-002 | AE243: 95.69 | AF243: 101.81 | AG243: 0.59 | AH243: AA+ | AI243: 4.0999999999999995e-002 | AJ243: =H243+100*O243 -> 126.85000000000001 | AK243: 127.6 | AL243: 185 | AM243: 25.8 | AN243: 80 | AO243: 6.9999999999999993e-003 | AP243: 34 | AQ243: 山鹰转债
A244: 268 | B244: 128057 | C244: 博彦转债 | D244: 2649 | E244: 博彦科技 | F244: 计算机及 | G244: 软件开发 | H244: 117.3 | I244: -1.5100000000000001e-002 | J244: 5.7999999999999996e-003 | K244: 10.05 | L244: -1.2800000000000001e-002 | M244: 116.3 | N244: 8.72 | O244: 1.8000000000000002e-002 | P244: 115.25 | Q244: 转股中 | R244: 3.92年 | S244: 1.92年 | T244: 5.1 | U244: 11 | V244: 1.8000000000000002e-002 | W244: 9.5000000000000001e-002 | X244: 0.11 | Y244: 53 | Z244: 1.81 | AA244: -2.2000000000000001e-003 | AB244: -9.4999999999999998e-003 | AC244: -6.1600000000000002e-002 | AD244: -6.4000000000000001e-002 | AE244: 90.38 | AF244: 91.58 | AG244: 0.73 | AH244: AA- | AI244: 6.4000000000000001e-002 | AJ244: =H244+100*O244 -> 119.09999999999999 | AK244: 119.3 | AL244: 98 | AM244: 27.8 | AN244: 99 | AO244: -8.0000000000000002e-003 | AP244: 27 | AQ244: 博彦转债
A245: 60 | B245: 128136 | C245: 立讯转债! | D245: 2475 | E245: 立讯精密 | F245: 电子 | G245: 元器件制 | H245: 113.328 | I245: 3.5999999999999999e-003 | J245: -1.e-004 | K245: 35.73 | L245: 1.8500000000000003e-002 | M245: 111.9 | N245: 58.36 | O245: 0.85099999999999998 | P245: 61.22 | Q245: 37天 | R245: 5.59年 | S245: 3.59年 | T245: 30 | U245: 29 | V245: 8.0000000000000002e-003 | W245: 1.2e-002 | X245: 6.9999999999999993e-003 | Y245: 2514. | Z245: 10.03 | AA245: -2.3e-003 | AB245: -6.1999999999999998e-003 | AC245: -2.6699999999999998e-002 | AD245: -2.7900000000000001e-002 | AE245: 87.5 | AF245: 88.73 | AG245: 0.19 | AH245: AA+ | AI245: 4.2900000000000001e-002 | AJ245: =H245+100*O245 -> 198.428 | AK245: 165.4 | AL245: 318 | AM245: 76.7 | AN245: 319 | AO245: -6.0999999999999999e-002 | AP245: 11 | AQ245: 立讯转债!
A246: 147 | B246: 128108 | C246: 蓝帆转债! | D246: 2382 | E246: 蓝帆医疗 | F246: 医药 | G246: 医疗器械 | H246: 115.212 | I246: -4.1999999999999997e-003 | J246: -2.8000000000000004e-003 | K246: 19.3 | L246: -1.03e-002 | M246: 113.3 | N246: 17.79 | O246: 6.2e-002 | P246: 108.49 | Q246: 转股中 | R246: 5年55天 | S246: 4年56天 | T246: 16.6 | U246: 55 | V246: 2.8999999999999998e-002 | W246: 8.199999999999999e-002 | X246: 8.900000000000001e-002 | Y246: 202 | Z246: 1.94 | AA246: -3.3e-003 | AB246: -8.0000000000000002e-003 | AC246: -2.0199999999999999e-002 | AD246: -2.2599999999999999e-002 | AE246: 87.67 | AF246: 90.81 | AG246: 0.68 | AH246: AA | AI246: 4.4900000000000002e-002 | AJ246: =H246+100*O246 -> 121.41200000000001 | AK246: 121.9 | AL246: 123 | AM246: 31.1 | AN246: 138 | AO246: -1.8000000000000002e-002 | AP246: 26 | AQ246: 蓝帆转债!
A247: 89 | B247: 128130 | C247: 景兴转债 | D247: 2067 | E247: 景兴纸业 | F247: 造纸包装 | G247: 包装用纸 | H247: 117.466 | I247: -2.9999999999999997e-004 | J247: -5.1000000000000004e-003 | K247: 3.97 | L247: -7.4999999999999997e-003 | M247: 115.1 | N247: 3.4 | O247: 6.0000000000000001e-003 | P247: 116.76 | Q247: 转股中 | R247: 5.41年 | S247: 3.41年 | T247: 11.3 | U247: 27 | V247: 2.e-002 | W247: 0.255 | X247: 0.29799999999999999 | Y247: 44 | Z247: 0.98 | AA247: -3.8e-003 | AB247: -8.8000000000000005e-003 | AC247: -3.4700000000000002e-002 | AD247: -3.6600000000000001e-002 | AE247: 88.65 | AF247: 91.16 | AG247: 0.72 | AH247: AA | AI247: 4.4900000000000002e-002 | AJ247: =H247+100*O247 -> 118.06599999999999 | AK247: 118.2 | AL247: 78 | AM247: 27 | AN247: 88 | AO247: 3.0000000000000001e-003 | AP247: 13 | AQ247: 景兴转债
A248: 91 | B248: 113602 | C248: 景20转债! | D248: 603228 | E248: 景旺电子 | F248: 电子 | G248: 元器件制 | H248: 115.77 | I248: 1.7000000000000001e-003 | J248: 2.7000000000000001e-003 | K248: 26.89 | L248: 7.4999999999999997e-003 | M248: 113.3 | N248: 27.7 | O248: 0.193 | P248: 97.08 | Q248: 转股中 | R248: 5.39年 | S248: 3.39年 | T248: 17.8 | U248: 2.9 | V248: 1.e-003 | W248: 7.8e-002 | X248: 7.4999999999999997e-002 | Y248: 229 | Z248: 3.68 | AA248: -4.0999999999999995e-003 | AB248: -8.5000000000000006e-003 | AC248: -3.0499999999999999e-002 | AD248: -3.2400000000000005e-002 | AE248: 88.92 | AF248: 89.85 | AG248: 0.6 | AH248: AA | AI248: 4.4900000000000002e-002 | AJ248: =H248+100*O248 -> 135.06999999999999 | AK248: 134.5 | AL248: 234 | AM248: 44.6 | AN248: 248 | AO248: -1.1000000000000001e-002 | AP248: 9 | AQ248: 景20转债!
A249: 281 | B249: 128050 | C249: 钧达转债!! | D249: 2865 | E249: 钧达股份 | F249: 汽车 | G249: 零部件制 | H249: 124.62 | I249: 4.1999999999999997e-003 | J249: 2.0000000000000001e-004 | K249: 18.38 | L249: 4.4000000000000003e-003 | M249: 122.7 | N249: 14.85 | O249: 6.9999999999999993e-003 | P249: 123.77 | Q249: 转股中 | R249: 3.69年 | S249: 1.69年 | T249: 1.55 | U249: 27 | V249: 0.14099999999999999 | W249: 6.5000000000000002e-002 | X249: 8.1000000000000003e-002 | Y249: 24 | Z249: 2.33 | AA249: -4.3e-003 | AB249: -1.4499999999999999e-002 | AC249: -9.8100000000000007e-002 | AD249: -0.10099999999999999 | AE249: 91.92 | AF249: 98.05 | AG249: 1 | AH249: AA- | AI249: 6.4000000000000001e-002 | AJ249: =H249+100*O249 -> 125.32000000000001 | AK249: 125.5 | AL249: 162 | AM249: 27.4 | AN249: 94 | AO249: -4.2000000000000003e-002 | AP249: 54 | AQ249: 钧达转债!!
A250: 88 | B250: 123064 | C250: 万孚转债! | D250: 300482 | E250: 万孚生物 | F250: 医药 | G250: 医疗器械 | H250: 117.9 | I250: -3.4000000000000002e-003 | J250: -1.2999999999999999e-003 | K250: 81.18 | L250: -1.e-002 | M250: 115.1 | N250: 93.57 | O250: 0.35899999999999999 | P250: 86.76 | Q250: 转股中 | R250: 5.41年 | S250: 3.42年 | T250: 6 | U250: 1.7 | V250: 2.e-003 | W250: 2.2000000000000002e-002 | X250: 1.9e-002 | Y250: 278 | Z250: 10.17 | AA250: -4.5000000000000005e-003 | AB250: -9.3999999999999986e-003 | AC250: -3.5699999999999996e-002 | AD250: -3.7499999999999999e-002 | AE250: 88.64 | AF250: 91.15 | AG250: 0.47 | AH250: AA | AI250: 4.4900000000000002e-002 | AJ250: =H250+100*O250 -> 153.80000000000001 | AK250: 149 | AL250: 296 | AM250: 57.9 | AN250: 297 | AO250: 3.4000000000000002e-002 | AP250: 10 | AQ250: 万孚转债!
A251: 64 | B251: 113607 | C251: 伟20转债! | D251: 603568 | E251: 伟明环保 | F251: 城市公用 | G251: 三废处理 | H251: 118.11 | I251: -3.3e-003 | J251: -1.18e-002 | K251: 21.43 | L251: -2.5899999999999999e-002 | M251: 115.1 | N251: 22.01 | O251: 0.21299999999999999 | P251: 97.36 | Q251: 34天 | R251: 5.58年 | S251: 3.59年 | T251: 12 | U251: 0.4 | V251: 0. | W251: 4.4999999999999998e-002 | X251: 4.2999999999999997e-002 | Y251: 269 | Z251: 5.36 | AA251: -4.6999999999999993e-003 | AB251: -9.4999999999999998e-003 | AC251: -3.4599999999999999e-002 | AD251: -3.6299999999999999e-002 | AE251: 87.98 | AF251: 90.47 | AG251: 0.58 | AH251: AA | AI251: 4.4900000000000002e-002 | AJ251: =H251+100*O251 -> 139.41 | AK251: 138.9 | AL251: 263 | AM251: 48.4 | AN251: 267 | AO251: -1.e-003 | AP251: 4 | AQ251: 伟20转债!
A252: 14 | B252: 113621 | C252: 彤程转债 | D252: 603650 | E252: 彤程新材 | F252: 化工 | G252: 橡胶塑料 | H252: 118.34 | I252: -4.5999999999999999e-003 | J252: -2.e-003 | K252: 34.5 | L252: -1.e-002 | M252: 115.1 | N252: 32.96 | O252: 0.13100000000000001 | P252: 104.67 | Q252: 4月2天 | R252: 5.82年 | S252: 3.82年 | T252: 8 | U252: 17 | V252: 1.8000000000000002e-002 | W252: 4.0000000000000001e-002 | X252: 4.0999999999999995e-002 | Y252: 202 | Z252: 8.58 | AA252: -4.7999999999999996e-003 | AB252: -9.3999999999999986e-003 | AC252: -3.3099999999999997e-002 | AD252: -3.4700000000000002e-002 | AE252: 87.09 | AF252: 89.55 | AG252: 0.66 | AH252: AA | AI252: 4.4900000000000002e-002 | AJ252: =H252+100*O252 -> 131.44 | AK252: 132 | AL252: 220 | AM252: 42.5 | AN252: 231 | AO252: -1.3000000000000001e-002 | AP252: 3 | AQ252: 彤程转债
A253: 58 | B253: 127024 | C253: 盈峰转债 | D253: 967 | E253: 盈峰环境 | F253: 机械装备 | G253: 专用设备 | H253: 120.2 | I253: 7.7000000000000002e-003 | J253: -1.7299999999999999e-002 | K253: 8.14 | L253: -1.6899999999999998e-002 | M253: 116.8 | N253: 8.31 | O253: 0.22699999999999998 | P253: 97.95 | Q253: 38天 | R253: 5.59年 | S253: 3.59年 | T253: 14.8 | U253: 9.1 | V253: 5.0000000000000001e-003 | W253: 5.7000000000000002e-002 | X253: 5.5999999999999994e-002 | Y253: 257 | Z253: 1.59 | AA253: -5.1999999999999998e-003 | AB253: -1.04e-002 | AC253: -3.9800000000000002e-002 | AD253: -4.1299999999999996e-002 | AE253: 88.32 | AF253: 92.71 | AG253: 0.57 | AH253: AA+ | AI253: 4.2900000000000001e-002 | AJ253: =H253+100*O253 -> 142.90000000000001 | AK253: 142.4 | AL253: 276 | AM253: 49.7 | AN253: 273 | AO253: -3.7999999999999999e-002 | AP253: 5 | AQ253: 盈峰转债
A254: 207 | B254: 110063 | C254: 鹰19转债 | D254: 600567 | E254: 山鹰国际 | F254: 造纸包装 | G254: 包装用纸 | H254: 118.76 | I254: -4.6999999999999993e-003 | J254: -5.7999999999999996e-003 | K254: 3.63 | L254: -1.6299999999999999e-002 | M254: 115.9 | N254: 3.3 | O254: 8.0000000000000002e-002 | P254: 110 | Q254: 转股中 | R254: 4.70年 | S254: 2.70年 | T254: 18.5 | U254: 11 | V254: 5.0000000000000001e-003 | W254: 0.111 | X254: 0.122 | Y254: 167 | Z254: 1.13 | AA254: -5.3e-003 | AB254: -1.1200000000000002e-002 | AC254: -4.8099999999999997e-002 | AD254: -5.0099999999999999e-002 | AE254: 92.09 | AF254: 96.3 | AG254: 0.65 | AH254: AA+ | AI254: 4.0999999999999995e-002 | AJ254: =H254+100*O254 -> 126.76000000000001 | AK254: 127.5 | AL254: 183 | AM254: 31.2 | AN254: 140 | AO254: 6.9999999999999993e-003 | AP254: 39 | AQ254: 鹰19转债
A255: 161 | B255: 113034 | C255: 滨化转债 | D255: 601678 | E255: 滨化股份 | F255: 化工 | G255: 化工 | H255: 118.17 | I255: 2.0000000000000001e-004 | J255: -6.8000000000000005e-003 | K255: 5.41 | L255: -9.1999999999999998e-003 | M255: 115.1 | N255: 4.68 | O255: 2.2000000000000002e-002 | P255: 115.6 | Q255: 转股中 | R255: 5年7天 | S255: 3年8天 | T255: 15.4 | U255: 10 | V255: 5.0000000000000001e-003 | W255: 0.16699999999999998 | X255: 0.19399999999999998 | Y255: 92 | Z255: 1.34 | AA255: -5.3e-003 | AB255: -1.06e-002 | AC255: -4.0800000000000003e-002 | AD255: -4.2800000000000005e-002 | AE255: 90.19 | AF255: 92.74 | AG255: 0.72 | AH255: AA | AI255: 4.4900000000000002e-002 | AJ255: =H255+100*O255 -> 120.37 | AK255: 120.7 | AL255: 110 | AM255: 28 | AN255: 105 | AO255: -4.0999999999999995e-002 | AP255: 26 | AQ255: 滨化转债
A256: 25 | B256: 123091 | C256: 长海转债 | D256: 300196 | E256: 长海股份 | F256: 其他 | G256: 非金属矿 | H256: 119.87 | I256: -2.0000000000000001e-004 | J256: -3.4000000000000002e-003 | K256: 14.75 | L256: -6.7000000000000002e-003 | M256: 116.2 | N256: 16.24 | O256: 0.32000000000000001 | P256: 90.83 | Q256: 2月28天 | R256: 5.72年 | S256: 3.73年 | T256: 5.5 | U256: 4.2 | V256: 6.0000000000000001e-003 | W256: 9.0999999999999998e-002 | X256: 8.3000000000000004e-002 | Y256: 60 | Z256: 2.16 | AA256: -5.5000000000000005e-003 | AB256: -1.0500000000000001e-002 | AC256: -3.6799999999999999e-002 | AD256: -3.85e-002 | AE256: 87.54 | AF256: 90.79 | AG256: 0.52 | AH256: AA | AI256: 4.4900000000000002e-002 | AJ256: =H256+100*O256 -> 151.87 | AK256: 148.9 | AL256: 295 | AM256: 58.1 | AN256: 298 | AO256: -9.1999999999999998e-002 | AP256: 3 | AQ256: 长海转债
A257: 149 | B257: 113579 | C257: 健友转债! | D257: 603707 | E257: 健友股份 | F257: 医药 | G257: 原料药 | H257: 117.49 | I257: 8.9999999999999998e-004 | J257: -5.7999999999999996e-003 | K257: 39 | L257: -9.1000000000000004e-003 | M257: 114.2 | N257: 42.05 | O257: 0.26700000000000002 | P257: 92.75 | Q257: 转股中 | R257: 5年20天 | S257: 3年21天 | T257: 5.03 | U257: 5.3 | V257: 9.0000000000000011e-003 | W257: 1.3999999999999999e-002 | X257: 1.3000000000000001e-002 | Y257: 364 | Z257: 10.63 | AA257: -5.6999999999999993e-003 | AB257: -1.0700000000000001e-002 | AC257: -3.8300000000000001e-002 | AD257: -4.0399999999999998e-002 | AE257: 90.15 | AF257: 91.89 | AG257: 0.53 | AH257: AA | AI257: 4.4900000000000002e-002 | AJ257: =H257+100*O257 -> 144.19 | AK257: 142.2 | AL257: 273 | AM257: 50.3 | AN257: 277 | AO257: 2.6000000000000002e-002 | AP257: 10 | AQ257: 健友转债!
A258: 123 | B258: 123058 | C258: 欣旺转债 | D258: 300207 | E258: 欣旺达 | F258: 电子 | G258: 电子产品 | H258: 120.198 | I258: -8.0000000000000004e-004 | J258: 2.0000000000000001e-004 | K258: 19.27 | L258: -1.e-003 | M258: 116.3 | N258: 21.24 | O258: 0.32500000000000001 | P258: 90.73 | Q258: 转股中 | R258: 5.28年 | S258: 3.28年 | T258: 11.2 | U258: 7.3 | V258: 5.0000000000000001e-003 | W258: 3.7000000000000005e-002 | X258: 3.3000000000000002e-002 | Y258: 303 | Z258: 4.5 | AA258: -6.3e-003 | AB258: -1.1699999999999999e-002 | AC258: -4.2000000000000003e-002 | AD258: -4.4000000000000004e-002 | AE258: 89.36 | AF258: 92.67 | AG258: 0.5 | AH258: AA | AI258: 4.4900000000000002e-002 | AJ258: =H258+100*O258 -> 152.69799999999998 | AK258: 149.7 | AL258: 297 | AM258: 57 | AN258: 295 | AO258: -5.7000000000000002e-002 | AP258: 6 | AQ258: 欣旺转债
A259: 39 | B259: 123083 | C259: 朗新转债 | D259: 300682 | E259: 朗新科技 | F259: 计算机及 | G259: 软件开发 | H259: 119.373 | I259: 1.38e-002 | J259: -2.0099999999999996e-002 | K259: 15.91 | L259: -1.e-002 | M259: 115.1 | N259: 15.57 | O259: 0.16800000000000001 | P259: 102.18 | Q259: 2月14天 | R259: 5.69年 | S259: 3.69年 | T259: 8 | U259: 22 | V259: 2.3e-002 | W259: 4.9000000000000002e-002 | X259: 5.0000000000000003e-002 | Y259: 162 | Z259: 3 | AA259: -6.5000000000000006e-003 | AB259: -1.1200000000000002e-002 | AC259: -3.6400000000000002e-002 | AD259: -3.8100000000000002e-002 | AE259: 87.59 | AF259: 90.07 | AG259: 0.64 | AH259: AA | AI259: 4.4900000000000002e-002 | AJ259: =H259+100*O259 -> 136.173 | AK259: 136.6 | AL259: 248 | AM259: 46.5 | AN259: 254 | AO259: 2.7000000000000003e-002 | AP259: 4 | AQ259: 朗新转债
A260: 24 | B260: 113615 | C260: 金诚转债 | D260: 603979 | E260: 金诚信 | F260: 有色金属 | G260: 有色行业 | H260: 122.05 | I260: 2.3099999999999999e-002 | J260: -1.46e-002 | K260: 14.83 | L260: 1.1599999999999999e-002 | M260: 117.3 | N260: 12.73 | O260: 4.8000000000000001e-002 | P260: 116.5 | Q260: 2月28天 | R260: 5.72年 | S260: 3.73年 | T260: 10 | U260: 61 | V260: 5.0000000000000003e-002 | W260: 0.11599999999999999 | X260: 0.13500000000000001 | Y260: 87 | Z260: 1.94 | AA260: -6.9999999999999993e-003 | AB260: -1.23e-002 | AC260: -4.1100000000000005e-002 | AD260: -4.2800000000000005e-002 | AE260: 87.64 | AF260: 91.66 | AG260: 0.73 | AH260: AA | AI260: 4.4900000000000002e-002 | AJ260: =H260+100*O260 -> 126.84999999999999 | AK260: 127.6 | AL260: 184 | AM260: 35.9 | AN260: 184 | AO260: -1.3999999999999999e-002 | AP260: 3 | AQ260: 金诚转债
A261: 81 | B261: 113603 | C261: 东缆转债 | D261: 603606 | E261: 东方电缆 | F261: 能源电力 | G261: 电力设备 | H261: 119.66 | I261: 2.9999999999999997e-004 | J261: -1.5e-003 | K261: 23.18 | L261: -2.2000000000000001e-003 | M261: 115.1 | N261: 23.88 | O261: 0.23300000000000001 | P261: 97.07 | Q261: 转股中 | R261: 5.48年 | S261: 3.48年 | T261: 8 | U261: 17 | V261: 1.8000000000000002e-002 | W261: 5.2999999999999999e-002 | X261: 5.0999999999999997e-002 | Y261: 152 | Z261: 5.02 | AA261: -7.1999999999999998e-003 | AB261: -1.2e-002 | AC261: -3.9100000000000003e-002 | AD261: -4.0800000000000003e-002 | AE261: 88.4 | AF261: 90.9 | AG261: 0.58 | AH261: AA | AI261: 4.4900000000000002e-002 | AJ261: =H261+100*O261 -> 142.96000000000001 | AK261: 142.3 | AL261: 274 | AM261: 51.4 | AN261: 281 | AO261: 4.0000000000000001e-002 | AP261: 7 | AQ261: 东缆转债
A262: 11 | B262: 123098 | C262: 一品转债 | D262: 300723 | E262: 一品红 | F262: 医药 | G262: 医药行业 | H262: 130 | I262: 3.9000000000000003e-003 | J262: -5.5000000000000005e-003 | K262: 47.8 | L262: -2.5000000000000001e-003 | M262: 124 | N262: 45.78 | O262: 0.245 | P262: 104.41 | Q262: 4月3天 | R262: 5.82年 | S262: 3.82年 | T262: 4.8 | U262: 8.4 | V262: 1.3999999999999999e-002 | W262: 6.2e-002 | X262: 6.5000000000000002e-002 | Y262: 77 | Z262: 5.18 | AA262: -8.199999999999999e-003 | AB262: -1.4999999999999999e-002 | AC262: -5.5e-002 | AD262: -5.67e-002 | AE262: 80.75 | AF262: 86.13 | AG262: 0.67 | AH262: AA- | AI262: 6.59e-002 | AJ262: =H262+100*O262 -> 154.5 | AK262: 155.6 | AL262: 310 | AM262: 69.5 | AN262: 314 | AO262: -4.8000000000000001e-002 | AP262: 3 | AQ262: 一品转债
A263: 237 | B263: 113541 | C263: 荣晟转债! | D263: 603165 | E263: 荣晟环保 | F263: 造纸包装 | G263: 包装用纸 | H263: 119.12 | I263: 3.5299999999999998e-002 | J263: -8.1000000000000013e-003 | K263: 13.85 | L263: 3.5900000000000001e-002 | M263: 115 | N263: 11.54 | O263: -6.9999999999999993e-003 | P263: 120.02 | Q263: 转股中 | R263: 4.30年 | S263: 2.31年 | T263: 2.64 | U263: 95 | V263: 0.30499999999999999 | W263: 7.4999999999999997e-002 | X263: 8.9999999999999997e-002 | Y263: 35 | Z263: 2.17 | AA263: -8.3000000000000001e-003 | AB263: -1.4499999999999999e-002 | AC263: -5.5800000000000002e-002 | AD263: -5.8299999999999998e-002 | AE263: 88.94 | AF263: 88.58 | AG263: 0.76 | AH263: AA- | AI263: 6.4000000000000001e-002 | AJ263: =H263+100*O263 -> 118.42 | AK263: 118.2 | AL263: 79 | AM263: 29.3 | AN263: 123 | AO263: 5.2999999999999999e-002 | AP263: 45 | AQ263: 荣晟转债!
A264: 274 | B264: 128053 | C264: 尚荣转债! | D264: 2551 | E264: 尚荣医疗 | F264: 医药 | G264: 医疗器械 | H264: 118.5 | I264: 1.0200000000000001e-002 | J264: 2.5000000000000001e-003 | K264: 5.47 | L264: 1.3000000000000001e-002 | M264: 114.3 | N264: 4.89 | O264: 5.9000000000000004e-002 | P264: 111.86 | Q264: 转股中 | R264: 3.87年 | S264: 1.87年 | T264: 1.91 | U264: 35 | V264: 0.156 | W264: 4.2999999999999997e-002 | X264: 4.8000000000000001e-002 | Y264: 45 | Z264: 1.51 | AA264: -9.3999999999999986e-003 | AB264: -1.6e-002 | AC264: -6.7799999999999999e-002 | AD264: -7.0199999999999999e-002 | AE264: 94.4 | AF264: 97.39 | AG264: 0.98 | AH264: AA | AI264: 4.2999999999999997e-002 | AJ264: =H264+100*O264 -> 124.40000000000001 | AK264: 125.1 | AL264: 156 | AM264: 27.7 | AN264: 98 | AO264: 1.6e-002 | AP264: 27 | AQ264: 尚荣转债!
A265: 6 | B265: 113045 | C265: N环旭转 | D265: 601231 | E265: 环旭电子 | F265: 电子 | G265: 电子产品 | H265: 118.48 | I265: 0.185 | J265: 0. | K265: 19.93 | L265: 9.1000000000000004e-003 | M265: 112 | N265: 20.25 | O265: 0.20399999999999999 | P265: 98.42 | Q265: 8月12天 | R265: 5.92年 | S265: 2.92年 | T265: 34.5 | U265: 1368. | V265: 0.33600000000000002 | W265: 7.8e-002 | X265: 7.6999999999999999e-002 | Y265: 440 | Z265: 3.65 | AA265: -9.5999999999999992e-003 | AB265: -1.32e-002 | AC265: -4.4699999999999997e-002 | AD265: -4.6399999999999997e-002 | AE265: 90.4 | AF265: 87.6 | AG265: 0.61 | AH265: AA+ | AI265: 4.2900000000000001e-002 | AJ265: =H265+100*O265 -> 138.88 | AK265: 138.5 | AL265: 261 | AM265: 48.1 | AN265: 265 | AO265: 6.7000000000000004e-002 | AP265: 2 | AQ265: N环旭转
A266: 57 | B266: 127025 | C266: 冀东转债 | D266: 401 | E266: 冀东水泥 | F266: 建筑 | G266: 水泥 | H266: 116.2 | I266: 0. | J266: -1.6899999999999998e-002 | K266: 15.14 | L266: -2.8900000000000002e-002 | M266: 110.1 | N266: 15.78 | O266: 0.21100000000000002 | P266: 95.94 | Q266: 39天 | R266: 5.59年 | S266: 3.59年 | T266: 28.2 | U266: 41 | V266: 1.3000000000000001e-002 | W266: 0.13800000000000001 | X266: 0.13300000000000001 | Y266: 204 | Z266: 1.43 | AA266: -9.7000000000000003e-003 | AB266: -1.3000000000000001e-002 | AC266: -3.2099999999999997e-002 | AD266: -3.3500000000000002e-002 | AE266: 88.86 | AF266: 88.75 | AG266: 0.59 | AH266: AAA | AI266: 3.9900000000000005e-002 | AJ266: =H266+100*O266 -> 137.30000000000001 | AK266: 136.5 | AL266: 247 | AM266: 47.6 | AN266: 259 | AO266: -1.8000000000000002e-002 | AP266: 9 | AQ266: 冀东转债
A267: 189 | B267: 128096 | C267: 奥瑞转债!! | D267: 2701 | E267: 奥瑞金 | F267: 造纸包装 | G267: 包装材料 | H267: 121.03 | I267: -2.7900000000000001e-002 | J267: -4.5999999999999999e-003 | K267: 5.4 | L267: -4.4199999999999996e-002 | M267: 115.5 | N267: 4.54 | O267: 1.8000000000000002e-002 | P267: 118.94 | Q267: 转股中 | R267: 4.86年 | S267: 2.86年 | T267: 6.99 | U267: 34 | V267: 4.0000000000000001e-002 | W267: 5.4000000000000006e-002 | X267: 6.4000000000000001e-002 | Y267: 130 | Z267: 2.19 | AA267: -9.7999999999999997e-003 | AB267: -1.54e-002 | AC267: -4.9800000000000004e-002 | AD267: -5.2000000000000005e-002 | AE267: 92.05 | AF267: 95.4 | AG267: 0.73 | AH267: AA+ | AI267: 4.0999999999999995e-002 | AJ267: =H267+100*O267 -> 122.83 | AK267: 123.1 | AL267: 136 | AM267: 27.7 | AN267: 97 | AO267: -6.9999999999999993e-003 | AP267: 19 | AQ267: 奥瑞转债!!
A268: 202 | B268: 113559 | C268: 永创转债! | D268: 603901 | E268: 永创智能 | F268: 机械装备 | G268: 专用设备 | H268: 123.86 | I268: -2.0000000000000001e-004 | J268: 2.5999999999999999e-003 | K268: 12.35 | L268: 3.2000000000000002e-003 | M268: 118.3 | N268: 10.32 | O268: 3.5000000000000003e-002 | P268: 119.67 | Q268: 转股中 | R268: 4.72年 | S268: 2.73年 | T268: 5.1 | U268: 33 | V268: 5.2000000000000005e-002 | W268: 9.4e-002 | X268: 0.11199999999999999 | Y268: 54 | Z268: 3.92 | AA268: -9.8999999999999991e-003 | AB268: -1.66e-002 | AC268: -5.8099999999999999e-002 | AD268: -6.0700000000000004e-002 | AE268: 87.44 | AF268: 88.91 | AG268: 0.75 | AH268: AA- | AI268: 6.4000000000000001e-002 | AJ268: =H268+100*O268 -> 127.36 | AK268: 128 | AL268: 191 | AM268: 39.1 | AN268: 211 | AO268: 0.10199999999999999 | AP268: 19 | AQ268: 永创转债!
A269: 193 | B269: 127015 | C269: 希望转债! | D269: 876 | E269: 新 希 望 | F269: 农业 | G269: 畜牧业 | H269: 116.2 | I269: 4.7999999999999996e-003 | J269: -4.7999999999999996e-003 | K269: 19.59 | L269: 9.300000000000001e-003 | M269: 110 | N269: 19.75 | O269: 0.17100000000000001 | P269: 99.19 | Q269: 转股中 | R269: 4.75年 | S269: 2.76年 | T269: 9.5 | U269: 58 | V269: 5.2999999999999999e-002 | W269: 1.1000000000000001e-002 | X269: 1.1000000000000001e-002 | Y269: 883 | Z269: 2.44 | AA269: -1.1599999999999999e-002 | AB269: -1.55e-002 | AC269: -4.1700000000000001e-002 | AD269: -4.3400000000000001e-002 | AE269: 92.13 | AF269: 92.38 | AG269: 0 | AH269: AAA | AI269: 3.7999999999999999e-002 | AJ269: =H269+100*O269 -> 133.30000000000001 | AK269: 133.2 | AL269: 228 | AM269: 40.8 | AN269: 220 | AO269: -6.6000000000000003e-002 | AP269: 28 | AQ269: 希望转债!
A270: 140 | B270: 113585 | C270: 寿仙转债! | D270: 603896 | E270: 寿仙谷 | F270: 医药 | G270: 中药 | H270: 125.17 | I270: -2.2000000000000001e-003 | J270: -3.0999999999999999e-003 | K270: 35.8 | L270: -6.7000000000000002e-003 | M270: 117.8 | N270: 28.68 | O270: 3.0000000000000001e-003 | P270: 124.83 | Q270: 转股中 | R270: 5.18年 | S270: 3.19年 | T270: 1.87 | U270: 8.3 | V270: 3.6000000000000004e-002 | W270: 3.5000000000000003e-002 | X270: 4.4000000000000004e-002 | Y270: 53 | Z270: 4.17 | AA270: -1.1899999999999999e-002 | AB270: -1.78e-002 | AC270: -5.4000000000000006e-002 | AD270: -5.62e-002 | AE270: 84.32 | AF270: 85.3 | AG270: 0.8 | AH270: AA- | AI270: 6.59e-002 | AJ270: =H270+100*O270 -> 125.47 | AK270: 125.5 | AL270: 164 | AM270: 40.2 | AN270: 217 | AO270: 1.9e-002 | AP270: 9 | AQ270: 寿仙转债!
A271: 181 | B271: 123043 | C271: 正元转债 | D271: 300645 | E271: 正元智慧 | F271: 计算机及 | G271: 软件开发 | H271: 128.312 | I271: 2.5999999999999999e-003 | J271: 2.3900000000000001e-002 | K271: 16.43 | L271: 3.7900000000000003e-002 | M271: 120.9 | N271: 15.41 | O271: 0.20300000000000001 | P271: 106.62 | Q271: 转股中 | R271: 4.92年 | S271: 2.92年 | T271: 1.66 | U271: 635 | V271: 2.9300000000000002 | W271: 7.9000000000000001e-002 | X271: 8.5000000000000006e-002 | Y271: 21 | Z271: 3.39 | AA271: -1.23e-002 | AB271: -1.9400000000000001e-002 | AC271: -6.6100000000000006e-002 | AD271: -6.83e-002 | AE271: 83.41 | AF271: 85.36 | AG271: 0.7 | AH271: A+ | AI271: 7.4999999999999997e-002 | AJ271: =H271+100*O271 -> 148.61200000000002 | AK271: 150 | AL271: 298 | AM271: 64.6 | AN271: 309 | AO271: 5.2999999999999999e-002 | AP271: 18 | AQ271: 正元转债
A272: 273 | B272: 110051 | C272: 中天转债! | D272: 600522 | E272: 中天科技 | F272: 通信互联 | G272: 通信设备 | H272: 119 | I272: -2.3e-003 | J272: -5.4000000000000003e-003 | K272: 11.13 | L272: -1.15e-002 | M272: 113.3 | N272: 10.09 | O272: 7.9000000000000001e-002 | P272: 110.31 | Q272: 转股中 | R272: 3.91年 | S272: 1.91年 | T272: 39.6 | U272: 24 | V272: 5.0000000000000001e-003 | W272: 0.11599999999999999 | X272: 0.128 | Y272: 341 | Z272: 1.49 | AA272: -1.2699999999999999e-002 | AB272: -1.8700000000000001e-002 | AC272: -6.8499999999999991e-002 | AD272: -7.0900000000000005e-002 | AE272: 94.63 | AF272: 97.1 | AG272: 0.66 | AH272: AA+ | AI272: 4.0999999999999995e-002 | AJ272: =H272+100*O272 -> 126.90000000000001 | AK272: 127.7 | AL272: 186 | AM272: 30.6 | AN272: 134 | AO272: -2.9999999999999999e-002 | AP272: 25 | AQ272: 中天转债!
A273: 158 | B273: 128106 | C273: 华统转债 | D273: 2840 | E273: 华统股份 | F273: 农业 | G273: 农产品加 | H273: 120.719 | I273: -2.3999999999999998e-003 | J273: -6.3e-003 | K273: 11 | L273: -1.1699999999999999e-002 | M273: 113.2 | N273: 9.4 | O273: 3.2000000000000001e-002 | P273: 117.02 | Q273: 转股中 | R273: 5年7天 | S273: 3年8天 | T273: 5.35 | U273: 6.9 | V273: 1.1000000000000001e-002 | W273: 0.109 | X273: 0.127 | Y273: 49 | Z273: 2.94 | AA273: -1.3000000000000001e-002 | AB273: -1.7600000000000001e-002 | AC273: -4.7e-002 | AD273: -4.9000000000000002e-002 | AE273: 90.29 | AF273: 91.23 | AG273: 0.75 | AH273: AA | AI273: 4.4900000000000002e-002 | AJ273: =H273+100*O273 -> 123.919 | AK273: 124.4 | AL273: 150 | AM273: 33.2 | AN273: 158 | AO273: 4.0999999999999995e-002 | AP273: 8 | AQ273: 华统转债
A274: 30 | B274: 113614 | C274: 健20转债! | D274: 603707 | E274: 健友股份 | F274: 医药 | G274: 原料药 | H274: 123.27 | I274: 6.0999999999999995e-003 | J274: -1.21e-002 | K274: 39 | L274: -9.1000000000000004e-003 | M274: 114.2 | N274: 38.04 | O274: 0.20199999999999999 | P274: 102.52 | Q274: 2月22天 | R274: 5.71年 | S274: 3.71年 | T274: 7.8 | U274: 3.7 | V274: 4.0000000000000001e-003 | W274: 2.1000000000000001e-002 | X274: 2.2000000000000002e-002 | Y274: 364 | Z274: 10.63 | AA274: -1.3500000000000002e-002 | AB274: -1.7899999999999999e-002 | AC274: -4.4000000000000004e-002 | AD274: -4.5700000000000005e-002 | AE274: 87.6 | AF274: 89.3 | AG274: 0.65 | AH274: AA | AI274: 4.4900000000000002e-002 | AJ274: =H274+100*O274 -> 143.47 | AK274: 144 | AL274: 285 | AM274: 54.7 | AN274: 291 | AO274: 2.6000000000000002e-002 | AP274: 3 | AQ274: 健20转债!
A275: 214 | B275: 123035 | C275: 利德转债! | D275: 300296 | E275: 利亚德 | F275: 电子 | G275: LED制 | H275: 123.16 | I275: 4.1100000000000005e-002 | J275: 2.0799999999999999e-002 | K275: 7.88 | L275: 9.1400000000000009e-002 | M275: 115.1 | N275: 6.98 | O275: 9.0999999999999998e-002 | P275: 112.89 | Q275: 转股中 | R275: 4.62年 | S275: 2.62年 | T275: 8 | U275: 203 | V275: 0.20699999999999999 | W275: 4.0000000000000001e-002 | X275: 4.4999999999999998e-002 | Y275: 200 | Z275: 2.77 | AA275: -1.4800000000000001e-002 | AB275: -2.0499999999999997e-002 | AC275: -6.08e-002 | AD275: -6.3099999999999989e-002 | AE275: 92.75 | AF275: 95.99 | AG275: 0.68 | AH275: AA+ | AI275: 4.0999999999999995e-002 | AJ275: =H275+100*O275 -> 132.25999999999999 | AK275: 133.4 | AL275: 229 | AM275: 37.4 | AN275: 194 | AO275: 8.6999999999999994e-002 | AP275: 15 | AQ275: 利德转债!
A276: 221 | B276: 127014 | C276: 北方转债! | D276: 65 | E276: 北方国际 | F276: 建筑 | G276: 建筑工程 | H276: 123.1 | I276: 9.0000000000000011e-003 | J276: 5.3499999999999999e-002 | K276: 11.24 | L276: 7.9699999999999993e-002 | M276: 115.1 | N276: 8.75 | O276: -4.2000000000000003e-002 | P276: 128.46 | Q276: 转股中 | R276: 4.56年 | S276: 2.56年 | T276: 5.76 | U276: 2926. | V276: 3.9900000000000002 | W276: 6.7000000000000004e-002 | X276: 8.5999999999999993e-002 | Y276: 86 | Z276: 1.58 | AA276: -1.49e-002 | AB276: -2.07e-002 | AC276: -6.1900000000000004e-002 | AD276: -6.4199999999999993e-002 | AE276: 92.96 | AF276: 96.21 | AG276: 0.78 | AH276: AA+ | AI276: 4.0999999999999995e-002 | AJ276: =H276+100*O276 -> 118.89999999999999 | AK276: 117.7 | AL276: 76 | AM276: 21.5 | AN276: 43 | AO276: 0.502 | AP276: 17 | AQ276: 北方转债!
A277: 294 | B277: 123012 | C277: 万顺转债! | D277: 300057 | E277: 万顺新材 | F277: 有色金属 | G277: 铝金属 | H277: 116 | I277: 2.3599999999999999e-002 | J277: -1.9599999999999999e-002 | K277: 4.58 | L277: 8.8000000000000005e-003 | M277: 110.3 | N277: 5.31 | O277: 0.34499999999999997 | P277: 86.25 | Q277: 转股中 | R277: 3.30年 | S277: 1.30年 | T277: 1.29 | U277: 42 | V277: 0.28399999999999997 | W277: 4.2000000000000003e-002 | X277: 3.6000000000000004e-002 | Y277: 31 | Z277: 0.91 | AA277: -1.55e-002 | AB277: -2.1099999999999997e-002 | AC277: -7.980000000000001e-002 | AD277: -8.3100000000000007e-002 | AE277: 93.95 | AF277: 90.31 | AG277: 0.44 | AH277: AA- | AI277: 6.4000000000000001e-002 | AJ277: =H277+100*O277 -> 150.5 | AK277: 145.7 | AL277: 290 | AM277: 51.8 | AN277: 283 | AO277: -4.9000000000000002e-002 | AP277: 20 | AQ277: 万顺转债!
A278: 304 | B278: 113508 | C278: 新凤转债! | D278: 603225 | E278: 新凤鸣 | F278: 服装纺织 | G278: 纺织行业 | H278: 117.72 | I278: -1.3300000000000001e-002 | J278: 1.5800000000000002e-002 | K278: 16.34 | L278: 4.3e-003 | M278: 112.3 | N278: 15.78 | O278: 0.13699999999999998 | P278: 103.55 | Q278: 转股中 | R278: 3年23天 | S278: 1年24天 | T278: 20.6 | U278: 39 | V278: 1.6e-002 | W278: 8.9999999999999997e-002 | X278: 9.4e-002 | Y278: 228 | Z278: 2.02 | AA278: -1.5600000000000001e-002 | AB278: -2.2799999999999997e-002 | AC278: -0.10000000000000001 | AD278: -0.10400000000000001 | AE278: 97.66 | AF278: 99 | AG278: 0.57 | AH278: AA | AI278: 4.2999999999999997e-002 | AJ278: =H278+100*O278 -> 131.41999999999999 | AK278: 131.9 | AL278: 218 | AM278: 32.9 | AN278: 156 | AO278: -2.e-002 | AP278: 24 | AQ278: 新凤转债!
A279: 334 | B279: 113013 | C279: 国君转债! | D279: 601211 | E279: 国泰君安 | F279: 金融 | G279: 证券行业 | H279: 112.16 | I279: 0. | J279: -8.9999999999999998e-004 | K279: 16.34 | L279: -3.0999999999999999e-003 | M279: 108.3 | N279: 19.01 | O279: 0.30499999999999999 | P279: 85.95 | Q279: 转股中 | R279: 2.26年 | S279: 无权 | T279: 69.9 | U279: 13 | V279: 2.e-003 | W279: 4.8000000000000001e-002 | X279: 4.0999999999999995e-002 | Y279: 1456. | Z279: 1.15 | AA279: -1.5700000000000002e-002 | AB279: -2.2400000000000003e-002 | AC279: 无权 | AD279: 无权 | AE279: 无权 | AF279: 99.98 | AG279: 0.29 | AH279: AAA | AI279: 3.6699999999999997e-002 | AJ279: =H279+100*O279 -> 142.66 | AK279: 138.4 | AL279: 258 | AM279: 38.4 | AN279: 206 | AO279: 4.0000000000000001e-003 | AP279: 14 | AQ279: 国君转债!
A280: 218 | B280: 113548 | C280: 石英转债! | D280: 603688 | E280: 石英股份 | F280: 电子 | G280: 电子产品 | H280: 133.51 | I280: 2.7799999999999998e-002 | J280: 3.7000000000000002e-003 | K280: 18.47 | L280: 4.3499999999999997e-002 | M280: 124.4 | N280: 15.1 | O280: 9.1999999999999998e-002 | P280: 122.32 | Q280: 转股中 | R280: 4.57年 | S280: 2.57年 | T280: 1.23 | U280: 264 | V280: 1.5900000000000001 | W280: 1.9e-002 | X280: 2.3e-002 | Y280: 65 | Z280: 3.38 | AA280: -1.5700000000000002e-002 | AB280: -2.4399999999999998e-002 | AC280: -8.6999999999999994e-002 | AD280: -8.9600000000000013e-002 | AE280: 88.19 | AF280: 94.33 | AG280: 0.72 | AH280: AA- | AI280: 6.4000000000000001e-002 | AJ280: =H280+100*O280 -> 142.70999999999998 | AK280: 144.7 | AL280: 288 | AM280: 50.4 | AN280: 278 | AO280: 5.0000000000000003e-002 | AP280: 12 | AQ280: 石英转债!
A281: 318 | B281: 128032 | C281: 双环转债! | D281: 2472 | E281: 双环传动 | F281: 机械装备 | G281: 通用设备 | H281: 114.067 | I281: 1.9099999999999999e-002 | J281: 1.6899999999999998e-002 | K281: 9.5 | L281: 7.3399999999999993e-002 | M281: 109.3 | N281: 9.89 | O281: 0.187 | P281: 96.06 | Q281: 转股中 | R281: 2.73年 | S281: 0.73年 | T281: 10 | U281: 36 | V281: 3.2000000000000001e-002 | W281: 0.153 | X281: 0.14699999999999999 | Y281: 65 | Z281: 1.93 | AA281: -1.5800000000000002e-002 | AB281: -2.2000000000000002e-002 | AC281: -0.122 | AD281: -0.125 | AE281: 98.14 | AF281: 97.94 | AG281: 0.49 | AH281: AA | AI281: 4.1700000000000001e-002 | AJ281: =H281+100*O281 -> 132.767 | AK281: 132.1 | AL281: 222 | AM281: 33.9 | AN281: 167 | AO281: 0.10800000000000001 | AP281: 42 | AQ281: 双环转债!
A282: 311 | B282: 128035 | C282: 大族转债! | D282: 2008 | E282: 大族激光 | F282: 机械装备 | G282: 专用设备 | H282: 112.51 | I282: -8.6999999999999994e-003 | J282: 7.8000000000000005e-003 | K282: 42.12 | L282: -4.5000000000000005e-003 | M282: 107.4 | N282: 52.1 | O282: 0.39200000000000002 | P282: 80.84 | Q282: 转股中 | R282: 2.85年 | S282: 0.85年 | T282: 23 | U282: 6.7 | V282: 3.0000000000000001e-003 | W282: 5.0999999999999997e-002 | X282: 4.0999999999999995e-002 | Y282: 449 | Z282: 4.89 | AA282: -1.6299999999999999e-002 | AB282: -2.1099999999999997e-002 | AC282: -7.6299999999999993e-002 | AD282: -8.3000000000000004e-002 | AE282: 99.78 | AF282: 96.24 | AG282: 0.2 | AH282: AA+ | AI282: 3.9699999999999999e-002 | AJ282: =H282+100*O282 -> 151.71000000000001 | AK282: 144.2 | AL282: 286 | AM282: 44.4 | AN282: 244 | AO282: 2.6000000000000002e-002 | AP282: 20 | AQ282: 大族转债!
A283: 84 | B283: 123066 | C283: 赛意转债 | D283: 300687 | E283: 赛意信息 | F283: 计算机及 | G283: 软件开发 | H283: 132.7 | I283: 1.e-003 | J283: 1.09e-002 | K283: 30.19 | L283: 1.44e-002 | M283: 121.4 | N283: 22.58 | O283: -6.9999999999999993e-003 | P283: 133.7 | Q283: 转股中 | R283: 5.46年 | S283: 3.46年 | T283: 3.18 | U283: 34 | V283: 8.0000000000000002e-002 | W283: 4.9000000000000002e-002 | X283: 6.5000000000000002e-002 | Y283: 66 | Z283: 6.92 | AA283: -1.6500000000000001e-002 | AB283: -2.3e-002 | AC283: -6.480000000000001e-002 | AD283: -6.6900000000000001e-002 | AE283: 80 | AF283: 81.79 | AG283: 0.82 | AH283: A+ | AI283: 7.690000000000001e-002 | AJ283: =H283+100*O283 -> 132. | AK283: 131.7 | AL283: 214 | AM283: 49.9 | AN283: 274 | AO283: 0.125 | AP283: 7 | AQ283: 赛意转债
A284: 69 | B284: 113605 | C284: 大参转债 | D284: 603233 | E284: 大参林 | F284: 医药 | G284: 医药商业 | H284: 126.14 | I284: 4.0000000000000001e-003 | J284: -6.3e-003 | K284: 84.42 | L284: -3.7000000000000002e-003 | M284: 115.2 | N284: 83.71 | O284: 0.251 | P284: 100.85 | Q284: 26天 | R284: 5.55年 | S284: 3.56年 | T284: 14.1 | U284: 8.2 | V284: 5.0000000000000001e-003 | W284: 2.5000000000000001e-002 | X284: 2.5000000000000001e-002 | Y284: 556 | Z284: 11.1 | AA284: -1.6500000000000001e-002 | AB284: -2.12e-002 | AC284: -5.1699999999999996e-002 | AD284: -5.3399999999999996e-002 | AE284: 88.19 | AF284: 90.68 | AG284: 0.62 | AH284: AA | AI284: 4.4900000000000002e-002 | AJ284: =H284+100*O284 -> 151.24000000000001 | AK284: 151.4 | AL284: 301 | AM284: 60.7 | AN284: 303 | AO284: 5.2000000000000005e-002 | AP284: 6 | AQ284: 大参转债
A285: 185 | B285: 113564 | C285: 天目转债! | D285: 603136 | E285: 天目湖 | F285: 旅游餐饮 | G285: 旅游 | H285: 136.92 | I285: 2.12e-002 | J285: 5.6999999999999993e-003 | K285: 32.02 | L285: 3.32e-002 | M285: 126.2 | N285: 23.1 | O285: -1.2e-002 | P285: 138.61 | Q285: 转股中 | R285: 4.91年 | S285: 2.91年 | T285: 2.24 | U285: 232 | V285: 0.748 | W285: 5.9999999999999998e-002 | X285: 8.3000000000000004e-002 | Y285: 37 | Z285: 3.99 | AA285: -1.6799999999999999e-002 | AB285: -2.53e-002 | AC285: -8.5999999999999993e-002 | AD285: -8.8200000000000001e-002 | AE285: 86.2 | AF285: 93.68 | AG285: 0.81 | AH285: AA- | AI285: 6.4000000000000001e-002 | AJ285: =H285+100*O285 -> 135.72 | AK285: 135.2 | AL285: 238 | AM285: 41.5 | AN285: 224 | AO285: 5.0000000000000003e-002 | AP285: 14 | AQ285: 天目转债!
A286: 201 | B286: 110065 | C286: 淮矿转债! | D286: 600985 | E286: 淮北矿业 | F286: 煤炭 | G286: 煤炭开采 | H286: 120.6 | I286: -8.8999999999999999e-003 | J286: -5.8999999999999999e-003 | K286: 11.08 | L286: -1.95e-002 | M286: 110.8 | N286: 9.33 | O286: 1.6e-002 | P286: 118.76 | Q286: 转股中 | R286: 4.72年 | S286: 2.73年 | T286: 22.7 | U286: 49 | V286: 1.8000000000000002e-002 | W286: 9.1999999999999998e-002 | X286: 0.109 | Y286: 246 | Z286: 1.15 | AA286: -1.8100000000000002e-002 | AB286: -2.2200000000000001e-002 | AC286: -5.2499999999999998e-002 | AD286: -5.4600000000000003e-002 | AE286: 92.82 | AF286: 93.22 | AG286: 0.76 | AH286: AAA | AI286: 3.7999999999999999e-002 | AJ286: =H286+100*O286 -> 122.19999999999999 | AK286: 122.4 | AL286: 126 | AM286: 29.2 | AN286: 122 | AO286: -3.7999999999999999e-002 | AP286: 21 | AQ286: 淮矿转债!
A287: 308 | B287: 127005 | C287: 长证转债! | D287: 783 | E287: 长江证券 | F287: 金融 | G287: 证券行业 | H287: 114.701 | I287: -2.5999999999999999e-003 | J287: 6.1999999999999998e-003 | K287: 7.14 | L287: 7.0999999999999995e-003 | M287: 108.3 | N287: 7.28 | O287: 0.17000000000000001 | P287: 98.08 | Q287: 转股中 | R287: 2.94年 | S287: 无权 | T287: 50 | U287: 18 | V287: 3.0000000000000001e-003 | W287: 0.127 | X287: 0.124 | Y287: 395 | Z287: 1.41 | AA287: -1.9599999999999999e-002 | AB287: -2.4799999999999999e-002 | AC287: 无权 | AD287: 无权 | AE287: 无权 | AF287: 97.56 | AG287: 0.51 | AH287: AAA | AI287: 3.6699999999999997e-002 | AJ287: =H287+100*O287 -> 131.70099999999999 | AK287: 131.3 | AL287: 210 | AM287: 33.8 | AN287: 166 | AO287: 3.0000000000000001e-003 | AP287: 15 | AQ287: 长证转债!
A288: 59 | B288: 128137 | C288: 洁美转债 | D288: 2859 | E288: 洁美科技 | F288: 电子 | G288: 元器件制 | H288: 131.297 | I288: 2.0999999999999999e-003 | J288: -1.47e-002 | K288: 32.71 | L288: -1.5900000000000001e-002 | M288: 117.3 | N288: 27.77 | O288: 0.115 | P288: 117.79 | Q288: 38天 | R288: 5.59年 | S288: 3.59年 | T288: 6 | U288: 29 | V288: 3.6000000000000004e-002 | W288: 4.4999999999999998e-002 | X288: 5.2999999999999999e-002 | Y288: 135 | Z288: 7.55 | AA288: -2.0299999999999999e-002 | AB288: -2.5600000000000001e-002 | AC288: -6.1100000000000002e-002 | AD288: -6.2899999999999998e-002 | AE288: 81.87 | AF288: 82.7 | AG288: 0.79 | AH288: AA- | AI288: 6.59e-002 | AJ288: =H288+100*O288 -> 142.797 | AK288: 144.8 | AL288: 289 | AM288: 62.1 | AN288: 305 | AO288: 5.9999999999999998e-002 | AP288: 4 | AQ288: 洁美转债
A289: 192 | B289: 123042 | C289: 银河转债! | D289: 300619 | E289: 金银河 | F289: 机械装备 | G289: 专用设备 | H289: 127.82 | I289: 1.2500000000000001e-002 | J289: -1.1200000000000002e-002 | K289: 19.25 | L289: 2.5999999999999999e-003 | M289: 115.4 | N289: 24.4 | O289: 0.62 | P289: 78.89 | Q289: 转股中 | R289: 4.78年 | S289: 2.79年 | T289: 1.67 | U289: 177 | V289: 0.82900000000000007 | W289: 0.11599999999999999 | X289: 9.1999999999999998e-002 | Y289: 14 | Z289: 2.94 | AA289: -2.1600000000000001e-002 | AB289: -2.7099999999999999e-002 | AC289: -6.8900000000000003e-002 | AD289: -7.1099999999999997e-002 | AE289: 83.99 | AF289: 82.28 | AG289: 0.51 | AH289: A+ | AI289: 7.4999999999999997e-002 | AJ289: =H289+100*O289 -> 189.81999999999999 | AK289: 176.7 | AL289: 324 | AM289: 92.8 | AN289: 326 | AO289: -6.2e-002 | AP289: 24 | AQ289: 银河转债!
A290: 154 | B290: 113577 | C290: 春秋转债! | D290: 603890 | E290: 春秋电子 | F290: 电子 | G290: 电子产品 | H290: 132.13 | I290: 9.0500000000000011e-002 | J290: -1.e-002 | K290: 14.39 | L290: 0.10000000000000001 | M290: 118.2 | N290: 11.06 | O290: 1.6e-002 | P290: 130.11 | Q290: 转股中 | R290: 5年11天 | S290: 3年12天 | T290: 1.81 | U290: 715 | V290: 2.98 | W290: 3.2000000000000001e-002 | X290: 4.2000000000000003e-002 | Y290: 56 | Z290: 3.17 | AA290: -2.2400000000000003e-002 | AB290: -2.8500000000000001e-002 | AC290: -7.2599999999999998e-002 | AD290: -7.4700000000000003e-002 | AE290: 85.13 | AF290: 86.43 | AG290: 0.8 | AH290: AA- | AI290: 6.59e-002 | AJ290: =H290+100*O290 -> 133.72999999999999 | AK290: 134.2 | AL290: 233 | AM290: 47.7 | AN290: 262 | AO290: 2.9999999999999999e-002 | AP290: 13 | AQ290: 春秋转债!
A291: 80 | B291: 128134 | C291: 鸿路转债! | D291: 2541 | E291: 鸿路钢构 | F291: 建筑 | G291: 其他 | H291: 130.3 | I291: 1.09e-002 | J291: 1.e-002 | K291: 52.39 | L291: 2.75e-002 | M291: 115.1 | N291: 43.74 | O291: 8.8000000000000009e-002 | P291: 119.78 | Q291: 13天 | R291: 5.52年 | S291: 3.52年 | T291: 18.8 | U291: 46 | V291: 1.9e-002 | W291: 6.9000000000000006e-002 | X291: 8.199999999999999e-002 | Y291: 274 | Z291: 4.87 | AA291: -2.2599999999999999e-002 | AB291: -2.7300000000000001e-002 | AC291: -6.0700000000000004e-002 | AD291: -6.2400000000000004e-002 | AE291: 88.24 | AF291: 90.73 | AG291: 0.76 | AH291: AA | AI291: 4.4900000000000002e-002 | AJ291: =H291+100*O291 -> 139.10000000000002 | AK291: 140.8 | AL291: 269 | AM291: 50.1 | AN291: 276 | AO291: 4.4000000000000004e-002 | AP291: 4 | AQ291: 鸿路转债!
A292: 343 | B292: 110034 | C292: 九州转债! | D292: 600998 | E292: 九州通 | F292: 医药 | G292: 医药商业 | H292: 110.06 | I292: -5.0000000000000001e-004 | J292: -3.0999999999999999e-003 | K292: 17.8 | L292: -1.3300000000000001e-002 | M292: 108 | N292: 18.32 | O292: 0.13300000000000001 | P292: 97.16 | Q292: 转股中 | R292: 0.79年 | S292: 回售内 | T292: 15 | U292: 9 | V292: 5.0000000000000001e-003 | W292: 4.4999999999999998e-002 | X292: 4.4000000000000004e-002 | Y292: 334 | Z292: 1.78 | AA292: -2.3700000000000002e-002 | AB292: -4.2000000000000003e-002 | AC292: 回售内 | AD292: 回售内 | AE292: 103 | AF292: 104.96 | AG292: 0.26 | AH292: AA+ | AI292: 3.6799999999999999e-002 | AJ292: =H292+100*O292 -> 123.36 | AK292: 123 | AL292: 135 | AM292: 18 | AN292: 21 | AO292: -6.9999999999999993e-003 | AP292: 26 | AQ292: 九州转债!
A293: 258 | B293: 123025 | C293: 精测转债!! | D293: 300567 | E293: 精测电子 | F293: 电子 | G293: 液晶显示 | H293: 128.276 | I293: 1.e-002 | J293: 1.e-003 | K293: 58.02 | L293: 1.52e-002 | M293: 116.5 | N293: 49.95 | O293: 0.10400000000000001 | P293: 116.16 | Q293: 转股中 | R293: 3.99年 | S293: 1.99年 | T293: 3.09 | U293: 55 | V293: 0.13600000000000001 | W293: 2.2000000000000002e-002 | X293: 2.5000000000000001e-002 | Y293: 143 | Z293: 9.22 | AA293: -2.4300000000000002e-002 | AB293: -3.1300000000000001e-002 | AC293: -9.8000000000000004e-002 | AD293: -0.10000000000000001 | AE293: 90.04 | AF293: 91.38 | AG293: 0.72 | AH293: AA- | AI293: 6.4000000000000001e-002 | AJ293: =H293+100*O293 -> 138.67600000000002 | AK293: 140.4 | AL293: 267 | AM293: 49 | AN293: 270 | AO293: 4.7e-002 | AP293: 17 | AQ293: 精测转债!!
A294: 137 | B294: 128113 | C294: 比音转债 | D294: 2832 | E294: 比音勒芬 | F294: 服装纺织 | G294: 服装行业 | H294: 133.526 | I294: -1.09e-002 | J294: 9.300000000000001e-003 | K294: 20.05 | L294: -2.e-003 | M294: 117.3 | N294: 14.9 | O294: -8.0000000000000002e-003 | P294: 134.56 | Q294: 转股中 | R294: 5.20年 | S294: 3.20年 | T294: 5.23 | U294: 43 | V294: 6.0999999999999999e-002 | W294: 5.0000000000000003e-002 | X294: 6.7000000000000004e-002 | Y294: 105 | Z294: 4.88 | AA294: -2.5099999999999997e-002 | AB294: -3.0699999999999998e-002 | AC294: -7.2700000000000001e-002 | AD294: -7.46e-002 | AE294: 89.67 | AF294: 93.79 | AG294: 0.82 | AH294: AA | AI294: 4.4900000000000002e-002 | AJ294: =H294+100*O294 -> 132.726 | AK294: 132.5 | AL294: 226 | AM294: 38.7 | AN294: 207 | AO294: 5.0999999999999997e-002 | AP294: 8 | AQ294: 比音转债
A295: 163 | B295: 113575 | C295: 东时转债! | D295: 603377 | E295: 东方时尚 | F295: 其他 | G295: 其他 | H295: 129.35 | I295: 9.1999999999999998e-003 | J295: -1.7000000000000001e-003 | K295: 14.02 | L295: 1.3000000000000001e-002 | M295: 113.5 | N295: 14.56 | O295: 0.34299999999999997 | P295: 96.29 | Q295: 转股中 | R295: 5年6.1天 | S295: 3年7天 | T295: 0.99 | U295: 83 | V295: 0.64900000000000002 | W295: 1.2e-002 | X295: 1.1000000000000001e-002 | Y295: 86 | Z295: 4.39 | AA295: -2.63e-002 | AB295: -3.0899999999999997e-002 | AC295: -6.7299999999999999e-002 | AD295: -6.9400000000000003e-002 | AE295: 90.43 | AF295: 91.51 | AG295: 0.57 | AH295: AA | AI295: 4.4900000000000002e-002 | AJ295: =H295+100*O295 -> 163.64999999999998 | AK295: 162.4 | AL295: 317 | AM295: 70.9 | AN295: 315 | AO295: 1.7000000000000001e-002 | AP295: 15 | AQ295: 东时转债!
A296: 78 | B296: 110075 | C296: 南航转债 | D296: 600029 | E296: 南方航空 | F296: 交通运输 | G296: 航空运输 | H296: 128.77 | I296: -7.3000000000000001e-003 | J296: 9.3999999999999986e-003 | K296: 6.82 | L296: 2.8999999999999998e-003 | M296: 110 | N296: 6.24 | O296: 0.17800000000000002 | P296: 109.29 | Q296: 19天 | R296: 5.53年 | S296: 3.54年 | T296: 160 | U296: 47 | V296: 2.e-003 | W296: 0.153 | X296: 0.16699999999999998 | Y296: 1045. | Z296: 1.51 | AA296: -2.8399999999999998e-002 | AB296: -3.1600000000000003e-002 | AC296: -6.0700000000000004e-002 | AD296: -6.1699999999999998e-002 | AE296: 88.53 | AF296: 88.83 | AG296: 0.7 | AH296: AAA | AI296: 3.9900000000000005e-002 | AJ296: =H296+100*O296 -> 146.57000000000002 | AK296: 148.2 | AL296: 293 | AM296: 59.4 | AN296: 300 | AO296: 1.6e-002 | AP296: 8 | AQ296: 南航转债
A297: 264 | B297: 123022 | C297: 长信转债!! | D297: 300088 | E297: 长信科技 | F297: 通信互联 | G297: 通信设备 | H297: 129.23 | I297: 8.8000000000000005e-003 | J297: 4.0000000000000002e-004 | K297: 7.52 | L297: 1.21e-002 | M297: 114.3 | N297: 6.15 | O297: 5.7000000000000002e-002 | P297: 122.28 | Q297: 转股中 | R297: 3.96年 | S297: 1.96年 | T297: 2.57 | U297: 3.8 | V297: 1.1000000000000001e-002 | W297: 1.3999999999999999e-002 | X297: 1.7000000000000001e-002 | Y297: 185 | Z297: 2.67 | AA297: -3.1e-002 | AB297: -3.7200000000000004e-002 | AC297: -0.10199999999999999 | AD297: -0.105 | AE297: 94.06 | AF297: 97.04 | AG297: 0.76 | AH297: AA | AI297: 4.2999999999999997e-002 | AJ297: =H297+100*O297 -> 134.92999999999998 | AK297: 136.2 | AL297: 244 | AM297: 39.1 | AN297: 210 | AO297: -2.3e-002 | AP297: 12 | AQ297: 长信转债!!
A298: 215 | B298: 110061 | C298: 川投转债 | D298: 600674 | E298: 川投能源 | F298: 能源电力 | G298: 水电 | H298: 129.1 | I298: -1.47e-002 | J298: -1.7000000000000001e-003 | K298: 12.35 | L298: -1.9799999999999998e-002 | M298: 110.8 | N298: 9.58 | O298: 1.e-003 | P298: 128.91 | Q298: 转股中 | R298: 4.61年 | S298: 2.61年 | T298: 39.7 | U298: 42 | V298: 8.0000000000000002e-003 | W298: 7.2999999999999995e-002 | X298: 9.4e-002 | Y298: 544 | Z298: 1.96 | AA298: -3.32e-002 | AB298: -3.73e-002 | AC298: -7.7699999999999991e-002 | AD298: -7.980000000000001e-002 | AE298: 93.22 | AF298: 93.62 | AG298: 0.82 | AH298: AAA | AI298: 3.7999999999999999e-002 | AJ298: =H298+100*O298 -> 129.19999999999999 | AK298: 129.3 | AL298: 198 | AM298: 35.7 | AN298: 181 | AO298: 2.8999999999999998e-002 | AP298: 16 | AQ298: 川投转债
A299: 46 | B299: 113611 | C299: 福20转债 | D299: 603806 | E299: 福斯特 | F299: 能源电力 | G299: 太阳能 | H299: 135.76 | I299: -9.1999999999999998e-003 | J299: -1.1399999999999999e-002 | K299: 88.2 | L299: -2.7099999999999999e-002 | M299: 111.85 | N299: 73.69 | O299: 0.13400000000000001 | P299: 119.69 | Q299: 2月6天 | R299: 5.66年 | S299: 3.67年 | T299: 17 | U299: 68 | V299: 2.8999999999999998e-002 | W299: 2.5000000000000001e-002 | X299: 2.9999999999999999e-002 | Y299: 679 | Z299: 7.82 | AA299: -3.4099999999999998e-002 | AB299: -3.7699999999999997e-002 | AC299: -7.0800000000000002e-002 | AD299: -7.1900000000000006e-002 | AE299: 86.84 | AF299: 87.53 | AG299: 0.76 | AH299: AA | AI299: 4.4900000000000002e-002 | AJ299: =H299+100*O299 -> 149.16 | AK299: 151.8 | AL299: 304 | AM299: 64.3 | AN299: 308 | AO299: 0.11199999999999999 | AP299: 5 | AQ299: 福20转债
A300: 183 | B300: 110066 | C300: 盛屯转债!! | D300: 600711 | E300: 盛屯矿业 | F300: 有色金属 | G300: 有色行业 | H300: 136.21 | I300: 1.9299999999999998e-002 | J300: -1.0500000000000001e-002 | K300: 6.61 | L300: 1.0700000000000001e-002 | M300: 114.9 | N300: 4.88 | O300: 6.0000000000000001e-003 | P300: 135.45 | Q300: 转股中 | R300: 4.91年 | S300: 2.92年 | T300: 5.93 | U300: 163 | V300: 0.20300000000000001 | W300: 3.4000000000000002e-002 | X300: 4.5999999999999999e-002 | Y300: 174 | Z300: 1.66 | AA300: -3.4599999999999999e-002 | AB300: -3.9699999999999999e-002 | AC300: -8.6099999999999996e-002 | AD300: -8.8000000000000009e-002 | AE300: 90.92 | AF300: 93.79 | AG300: 0.82 | AH300: AA | AI300: 4.2999999999999997e-002 | AJ300: =H300+100*O300 -> 136.81 | AK300: 137 | AL300: 250 | AM300: 43.2 | AN300: 238 | AO300: -4.9000000000000002e-002 | AP300: 37 | AQ300: 盛屯转债!!
A301: 282 | B301: 110048 | C301: 福能转债! | D301: 600483 | E301: 福能股份 | F301: 能源电力 | G301: 电力供应 | H301: 128.84 | I301: 7.1999999999999998e-003 | J301: -8.6999999999999994e-003 | K301: 10.61 | L301: -1.9e-003 | M301: 113.3 | N301: 8.12 | O301: -1.3999999999999999e-002 | P301: 130.67 | Q301: 转股中 | R301: 3.68年 | S301: 1.68年 | T301: 23.6 | U301: 293 | V301: 9.8000000000000004e-002 | W301: 0.126 | X301: 0.16500000000000001 | Y301: 187 | Z301: 1.33 | AA301: -3.49e-002 | AB301: -4.1100000000000005e-002 | AC301: -0.11599999999999999 | AD301: -0.11800000000000001 | AE301: 95.49 | AF301: 98 | AG301: 0.82 | AH301: AA+ | AI301: 4.0999999999999995e-002 | AJ301: =H301+100*O301 -> 127.44 | AK301: 127 | AL301: 178 | AM301: 29 | AN301: 120 | AO301: 9.4e-002 | AP301: 9 | AQ301: 福能转债!
A302: 70 | B302: 113040 | C302: 星宇转债 | D302: 601799 | E302: 星宇股份 | F302: 汽车 | G302: 零部件制 | H302: 135.65 | I302: -8.0000000000000004e-004 | J302: -1.0500000000000001e-002 | K302: 187.26 | L302: -1.49e-002 | M302: 111.5 | N302: 158 | O302: 0.14499999999999999 | P302: 118.52 | Q302: 26天 | R302: 5.55年 | S302: 3.56年 | T302: 15 | U302: 11 | V302: 5.0000000000000001e-003 | W302: 2.8999999999999998e-002 | X302: 3.4000000000000002e-002 | Y302: 517 | Z302: 9.73 | AA302: -3.5099999999999999e-002 | AB302: -3.8599999999999995e-002 | AC302: -7.3499999999999996e-002 | AD302: -7.4499999999999997e-002 | AE302: 87.53 | AF302: 88.56 | AG302: 0.76 | AH302: AA+ | AI302: 4.2900000000000001e-002 | AJ302: =H302+100*O302 -> 150.15000000000001 | AK302: 152.8 | AL302: 305 | AM302: 64.2 | AN302: 307 | AO302: -1.e-003 | AP302: 5 | AQ302: 星宇转债
A303: 138 | B303: 128111 | C303: 中矿转债! | D303: 2738 | E303: 中矿资源 | F303: 有色金属 | G303: 有色行业 | H303: 149.949 | I303: 1.18e-002 | J303: -2.3999999999999998e-003 | K303: 23.16 | L303: 1.09e-002 | M303: 124.7 | N303: 15.47 | O303: 2.e-003 | P303: 149.71 | Q303: 转股中 | R303: 5.19年 | S303: 3.19年 | T303: 2.24 | U303: 102 | V303: 0.30299999999999999 | W303: 3.1e-002 | X303: 4.5999999999999999e-002 | Y303: 73 | Z303: 2.39 | AA303: -3.5699999999999996e-002 | AB303: -4.3099999999999999e-002 | AC303: -0.10099999999999999 | AD303: -0.10300000000000001 | AE303: 84.69 | AF303: 90.29 | AG303: 0.86 | AH303: AA- | AI303: 6.59e-002 | AJ303: =H303+100*O303 -> 150.149 | AK303: 150.2 | AL303: 299 | AM303: 59.9 | AN303: 301 | AO303: -1.8000000000000002e-002 | AP303: 8 | AQ303: 中矿转债!
A304: 165 | B304: 110069 | C304: 瀚蓝转债!* | D304: 600323 | E304: 瀚蓝环境 | F304: 城市公用 | G304: 三废处理 | H304: 136.7 | I304: 6.6e-003 | J304: 2.9999999999999997e-004 | K304: 27.69 | L304: 6.8999999999999999e-003 | M304: 113.5 | N304: 20.2 | O304: -3.0000000000000001e-003 | P304: 137.08 | Q304: 转股中 | R304: 5年4.1天 | S304: 3年5.1天 | T304: 7.31 | U304: 129 | V304: 0.128 | W304: 3.4000000000000002e-002 | X304: 4.7e-002 | Y304: 212 | Z304: 2.84 | AA304: -3.6900000000000002e-002 | AB304: -4.1399999999999999e-002 | AC304: -8.77e-002 | AD304: -8.8900000000000007e-002 | AE304: 89.55 | AF304: 92.22 | AG304: 1 | AH304: AA+ | AI304: 4.2900000000000001e-002 | AJ304: =H304+100*O304 -> 136.39999999999998 | AK304: 136.3 | AL304: 246 | AM304: 44.1 | AN304: 241 | AO304: 5.5999999999999994e-002 | AP304: 9 | AQ304: 瀚蓝转债!*
A305: 223 | B305: 128079 | C305: 英联转债! | D305: 2846 | E305: 英联股份 | F305: 造纸包装 | G305: 包装材料 | H305: 139.6 | I305: -6.480000000000001e-002 | J305: -3.49e-002 | K305: 10.12 | L305: -9.9600000000000008e-002 | M305: 117.5 | N305: 8.29 | O305: 0.14400000000000002 | P305: 122.07 | Q305: 转股中 | R305: 4.55年 | S305: 2.55年 | T305: 1.52 | U305: 988 | V305: 4.5099999999999998 | W305: 4.7e-002 | X305: 5.7999999999999996e-002 | Y305: 32 | Z305: 2.59 | AA305: -3.7900000000000003e-002 | AB305: -4.4199999999999996e-002 | AC305: -0.10400000000000001 | AD305: -0.106 | AE305: 85.33 | AF305: 85.16 | AG305: 1 | AH305: A+ | AI305: 7.4999999999999997e-002 | AJ305: =H305+100*O305 -> 154. | AK305: 157.1 | AL305: 312 | AM305: 71.8 | AN305: 316 | AO305: -0.34999999999999998 | AP305: 19 | AQ305: 英联转债!
A306: 265 | B306: 110055 | C306: 伊力转债!! | D306: 600197 | E306: 伊力特 | F306: 食品饮料 | G306: 白酒 | H306: 133.45 | I306: 1.9400000000000001e-002 | J306: 1.7299999999999999e-002 | K306: 21.03 | L306: 4.7300000000000002e-002 | M306: 114.3 | N306: 16.81 | O306: 6.7000000000000004e-002 | P306: 125.1 | Q306: 转股中 | R306: 3.95年 | S306: 1.95年 | T306: 2.85 | U306: 305 | V306: 0.79799999999999993 | W306: 2.8999999999999998e-002 | X306: 3.6000000000000004e-002 | Y306: 98 | Z306: 3.42 | AA306: -3.9100000000000003e-002 | AB306: -4.5199999999999997e-002 | AC306: -0.11599999999999999 | AD306: -0.11800000000000001 | AE306: 94.09 | AF306: 97.08 | AG306: 0.78 | AH306: AA | AI306: 4.2999999999999997e-002 | AJ306: =H306+100*O306 -> 140.14999999999998 | AK306: 141.8 | AL306: 271 | AM306: 44.7 | AN306: 249 | AO306: 0.10000000000000001 | AP306: 24 | AQ306: 伊力转债!!
A307: 68 | B307: 127023 | C307: 华菱转2 | D307: 932 | E307: 华菱钢铁 | F307: 钢铁 | G307: 炼钢 | H307: 138.76 | I307: -5.0000000000000001e-004 | J307: 1.2e-002 | K307: 7.8 | L307: 1.3000000000000001e-002 | M307: 110.1 | N307: 5.18 | O307: -7.8e-002 | P307: 150.58 | Q307: 27天 | R307: 5.56年 | S307: 4.56年 | T307: 40 | U307: 795 | V307: 0.14400000000000002 | W307: 8.4000000000000005e-002 | X307: 0.126 | Y307: 478 | Z307: 1.44 | AA307: -4.1299999999999996e-002 | AB307: -4.4400000000000002e-002 | AC307: -5.8899999999999994e-002 | AD307: -6.0499999999999998e-002 | AE307: 86.99 | AF307: 88.88 | AG307: 0.89 | AH307: AAA | AI307: 3.9900000000000005e-002 | AJ307: =H307+100*O307 -> 130.95999999999998 | AK307: 126.9 | AL307: 177 | AM307: 38.1 | AN307: 202 | AO307: 7.400000000000001e-002 | AP307: 11 | AQ307: 华菱转2
A308: 291 | B308: 123014 | C308: 凯发转债! | D308: 300407 | E308: 凯发电气 | F308: 能源电力 | G308: 电力设备 | H308: 119.559 | I308: 2.0999999999999999e-003 | J308: -2.0999999999999999e-003 | K308: 7.11 | L308: 0. | M308: 108.5 | N308: 8.12 | O308: 0.36499999999999999 | P308: 87.56 | Q308: 转股中 | R308: 2.32年 | S308: 0.32年 | T308: 1.16 | U308: 30 | V308: 0.21600000000000003 | W308: 5.2999999999999999e-002 | X308: 4.7e-002 | Y308: 22 | Z308: 1.61 | AA308: -4.1599999999999998e-002 | AB308: -4.8000000000000001e-002 | AC308: -0.33500000000000002 | AD308: -0.34000000000000002 | AE308: 97.83 | AF308: 92.24 | AG308: 0.4 | AH308: A+ | AI308: 7.3700000000000002e-002 | AJ308: =H308+100*O308 -> 156.059 | AK308: 151.6 | AL308: 302 | AM308: 53.7 | AN308: 289 | AO308: -2.8999999999999998e-002 | AP308: 16 | AQ308: 凯发转债!
A309: 312 | B309: 110043 | C309: 无锡转债! | D309: 600908 | E309: 无锡银行 | F309: 金融 | G309: 银行行业 | H309: 122.73 | I309: -2.0000000000000001e-004 | J309: 4.3e-003 | K309: 6.42 | L309: 6.3e-003 | M309: 108.3 | N309: 5.79 | O309: 0.107 | P309: 110.88 | Q309: 转股中 | R309: 2.83年 | S309: 无权 | T309: 29.2 | U309: 12 | V309: 3.0000000000000001e-003 | W309: 0.24600000000000002 | X309: 0.27300000000000002 | Y309: 119 | Z309: 1 | AA309: -4.3700000000000003e-002 | AB309: -4.8799999999999996e-002 | AC309: 无权 | AD309: 无权 | AE309: 无权 | AF309: 97.12 | AG309: 0.67 | AH309: AA+ | AI309: 3.9699999999999999e-002 | AJ309: =H309+100*O309 -> 133.43000000000001 | AK309: 134.6 | AL309: 236 | AM309: 37.5 | AN309: 195 | AO309: -2.5000000000000001e-002 | AP309: 27 | AQ309: 无锡转债!
A310: 75 | B310: 127022 | C310: 恒逸转债 | D310: 703 | E310: 恒逸石化 | F310: 化工 | G310: 化工 | H310: 140.7 | I310: 6.4000000000000003e-003 | J310: -2.1600000000000001e-002 | K310: 14.63 | L310: -1.8100000000000002e-002 | M310: 108.9 | N310: 11.5 | O310: 0.106 | P310: 127.22 | Q310: 20天 | R310: 5.54年 | S310: 3.54年 | T310: 20 | U310: 70 | V310: 2.5000000000000001e-002 | W310: 3.7000000000000005e-002 | X310: 4.7e-002 | Y310: 539 | Z310: 2.15 | AA310: -4.58e-002 | AB310: -4.8499999999999995e-002 | AC310: -8.1900000000000001e-002 | AD310: -8.3100000000000007e-002 | AE310: 87.93 | AF310: 86.58 | AG310: 0.84 | AH310: AA+ | AI310: 4.2900000000000001e-002 | AJ310: =H310+100*O310 -> 151.29999999999998 | AK310: 154.2 | AL310: 306 | AM310: 66.2 | AN310: 311 | AO310: -5.9000000000000004e-002 | AP310: 6 | AQ310: 恒逸转债
A311: 168 | B311: 128103 | C311: 同德转债! | D311: 2360 | E311: 同德化工 | F311: 化工 | G311: 化工 | H311: 152.58 | I311: -5.3e-003 | J311: 2.0299999999999999e-002 | K311: 7.49 | L311: 1.49e-002 | M311: 121.3 | N311: 5.18 | O311: 5.5e-002 | P311: 144.59 | Q311: 转股中 | R311: 4.98年 | S311: 2.98年 | T311: 1.09 | U311: 73 | V311: 0.436 | W311: 3.7000000000000005e-002 | X311: 5.2999999999999999e-002 | Y311: 30 | Z311: 2.44 | AA311: -4.5899999999999996e-002 | AB311: -5.2699999999999997e-002 | AC311: -0.113 | AD311: -0.115 | AE311: 83.17 | AF311: 85.3 | AG311: 1 | AH311: A+ | AI311: 7.4999999999999997e-002 | AJ311: =H311+100*O311 -> 158.08000000000001 | AK311: 160.6 | AL311: 316 | AM311: 75.3 | AN311: 317 | AO311: -2.6000000000000002e-002 | AP311: 13 | AQ311: 同德转债!
A312: 22 | B312: 113616 | C312: 韦尔转债 | D312: 603501 | E312: 韦尔股份 | F312: 电子 | G312: 元器件制 | H312: 150.74 | I312: 4.0000000000000001e-002 | J312: 1.e-004 | K312: 286.91 | L312: 4.9800000000000004e-002 | M312: 114.5 | N312: 222.83 | O312: 0.17100000000000001 | P312: 128.76 | Q312: 3月4天 | R312: 5.74年 | S312: 3.74年 | T312: 24.4 | U312: 573 | V312: 0.155 | W312: 1.e-002 | X312: 1.3000000000000001e-002 | Y312: 2489. | Z312: 24.57 | AA312: -4.7400000000000005e-002 | AB312: -5.16e-002 | AC312: -9.3299999999999994e-002 | AD312: -9.4600000000000004e-002 | AE312: 87.5 | AF312: 90.29 | AG312: 0.8 | AH312: AA+ | AI312: 4.2900000000000001e-002 | AJ312: =H312+100*O312 -> 167.84 | AK312: 172.7 | AL312: 321 | AM312: 82.4 | AN312: 322 | AO312: 0.11900000000000001 | AP312: 7 | AQ312: 韦尔转债
A313: 231 | B313: 123030 | C313: 九洲转债! | D313: 300040 | E313: 九洲集团 | F313: 能源电力 | G313: 电力设备 | H313: 149.296 | I313: -2.3999999999999998e-003 | J313: -1.72e-002 | K313: 7.35 | L313: -2.52e-002 | M313: 120 | N313: 5.65 | O313: 0.14800000000000002 | P313: 130.09 | Q313: 转股中 | R313: 4.38年 | S313: 2.38年 | T313: 0.97 | U313: 98 | V313: 0.68099999999999994 | W313: 3.5000000000000003e-002 | X313: 4.4999999999999998e-002 | Y313: 28 | Z313: 1.28 | AA313: -4.9500000000000002e-002 | AB313: -5.6799999999999996e-002 | AC313: -0.13400000000000001 | AD313: -0.13600000000000001 | AE313: 88.52 | AF313: 91.97 | AG313: 0.78 | AH313: AA- | AI313: 6.4000000000000001e-002 | AJ313: =H313+100*O313 -> 164.096 | AK313: 168.5 | AL313: 320 | AM313: 76.5 | AN313: 318 | AO313: -6.0999999999999999e-002 | AP313: 27 | AQ313: 九洲转债!
A314: 242 | B314: 123027 | C314: 蓝晓转债! | D314: 300487 | E314: 蓝晓科技 | F314: 化工 | G314: 化工 | H314: 147.7 | I314: -8.6999999999999994e-003 | J314: 1.0200000000000001e-002 | K314: 40.27 | L314: 1.7000000000000001e-003 | M314: 119.5 | N314: 29.22 | O314: 7.2000000000000008e-002 | P314: 137.82 | Q314: 转股中 | R314: 4.19年 | S314: 2.19年 | T314: 1.08 | U314: 27 | V314: 0.16699999999999998 | W314: 1.2e-002 | X314: 1.7000000000000001e-002 | Y314: 89 | Z314: 5.44 | AA314: -5.0499999999999996e-002 | AB314: -5.79e-002 | AC314: -0.10400000000000001 | AD314: -0.106 | AE314: 88.26 | AF314: 89.02 | AG314: 0.83 | AH314: A+ | AI314: 7.4999999999999997e-002 | AJ314: =H314+100*O314 -> 154.89999999999998 | AK314: 157.6 | AL314: 314 | AM314: 68.6 | AN314: 312 | AO314: -1.2e-002 | AP314: 20 | AQ314: 蓝晓转债!
A315: 287 | B315: 128046 | C315: 利尔转债!! | D315: 2258 | E315: 利尔化学 | F315: 化工 | G315: 农化 | H315: 135.1 | I315: 8.3000000000000001e-003 | J315: -2.4e-002 | K315: 23.96 | L315: -1.5600000000000001e-002 | M315: 112.3 | N315: 18.62 | O315: 5.0000000000000003e-002 | P315: 128.68 | Q315: 转股中 | R315: 3.54年 | S315: 1.54年 | T315: 8.47 | U315: 15 | V315: 1.3000000000000001e-002 | W315: 6.7000000000000004e-002 | X315: 8.6999999999999994e-002 | Y315: 126 | Z315: 3.33 | AA315: -5.1799999999999999e-002 | AB315: -5.7599999999999998e-002 | AC315: -0.128 | AD315: -0.13 | AE315: 95.72 | AF315: 97.04 | AG315: 1 | AH315: AA | AI315: 4.2999999999999997e-002 | AJ315: =H315+100*O315 -> 140.09999999999999 | AK315: 141.5 | AL315: 270 | AM315: 44.5 | AN315: 246 | AO315: -1.3999999999999999e-002 | AP315: 10 | AQ315: 利尔转债!!
A316: 305 | B316: 128036 | C316: 金农转债!! | D316: 2548 | E316: 金新农 | F316: 农业 | G316: 畜牧业 | H316: 128.15 | I316: 2.e-003 | J316: -2.e-003 | K316: 7.1 | L316: 1.4000000000000002e-003 | M316: 109.3 | N316: 6.96 | O316: 0.25600000000000001 | P316: 102.01 | Q316: 转股中 | R316: 2.93年 | S316: 0.93年 | T316: 1.46 | U316: 19 | V316: 0.10199999999999999 | W316: 2.9999999999999999e-002 | X316: 2.9999999999999999e-002 | Y316: 49 | Z316: 1.87 | AA316: -5.3499999999999999e-002 | AB316: -5.9000000000000004e-002 | AC316: -0.185 | AD316: -0.187 | AE316: 95.22 | AF316: 91.69 | AG316: 0 | AH316: AA- | AI316: 6.2699999999999992e-002 | AJ316: =H316+100*O316 -> 153.75 | AK316: 154.3 | AL316: 307 | AM316: 59.1 | AN316: 299 | AO316: -2.8999999999999998e-002 | AP316: 17 | AQ316: 金农转债!!
A317: 338 | B317: 113012 | C317: 骆驼转债! | D317: 601311 | E317: 骆驼股份 | F317: 汽车 | G317: 零部件制 | H317: 119.19 | I317: -1.2500000000000001e-002 | J317: -1.61e-002 | K317: 10.12 | L317: -5.4199999999999998e-002 | M317: 106.5 | N317: 10.06 | O317: 0.185 | P317: 100.6 | Q317: 转股中 | R317: 1.98年 | S317: 回售内 | T317: 5.1 | U317: 3.8 | V317: 6.0000000000000001e-003 | W317: 4.4999999999999998e-002 | X317: 4.4999999999999998e-002 | Y317: 114 | Z317: 1.69 | AA317: -5.5800000000000002e-002 | AB317: -6.1600000000000002e-002 | AC317: 回售内 | AD317: 回售内 | AE317: 100.25 | AF317: 98.3 | AG317: 0.53 | AH317: AA | AI317: 4.1700000000000001e-002 | AJ317: =H317+100*O317 -> 137.69 | AK317: 137.8 | AL317: 254 | AM317: 37.5 | AN317: 197 | AO317: -9.0999999999999998e-002 | AP317: 16 | AQ317: 骆驼转债!
A318: 315 | B318: 128033 | C318: 迪龙转债! | D318: 2658 | E318: 雪迪龙 | F318: 城市公用 | G318: 三废处理 | H318: 127.9 | I318: -5.2699999999999997e-002 | J318: -2.7900000000000001e-002 | K318: 11.07 | L318: -0.10000000000000001 | M318: 108.8 | N318: 8.83 | O318: 2.e-002 | P318: 125.37 | Q318: 转股中 | R318: 2.74年 | S318: 0.74年 | T318: 2.99 | U318: 1431. | V318: 3.6000000000000001 | W318: 4.4999999999999998e-002 | X318: 5.5999999999999994e-002 | Y318: 67 | Z318: 3.31 | AA318: -5.8099999999999999e-002 | AB318: -6.3600000000000004e-002 | AC318: -0.23100000000000001 | AD318: -0.23399999999999999 | AE318: 97.88 | AF318: 97.44 | AG318: 0.81 | AH318: AA | AI318: 4.1700000000000001e-002 | AJ318: =H318+100*O318 -> 129.90000000000001 | AK318: 130.4 | AL318: 204 | AM318: 32.6 | AN318: 152 | AO318: 0.26000000000000001 | AP318: 38 | AQ318: 迪龙转债!
A319: 187 | B319: 128097 | C319: 奥佳转债! | D319: 2614 | E319: 奥佳华 | F319: 机械装备 | G319: 专用设备 | H319: 156 | I319: -2.0899999999999998e-002 | J319: 1.24e-002 | K319: 16.79 | L319: -9.3999999999999986e-003 | M319: 114.9 | N319: 10.69 | O319: -6.9999999999999993e-003 | P319: 157.06 | Q319: 转股中 | R319: 4.90年 | S319: 2.90年 | T319: 5.38 | U319: 81 | V319: 9.5000000000000001e-002 | W319: 5.2000000000000005e-002 | X319: 8.1000000000000003e-002 | Y319: 104 | Z319: 2.34 | AA319: -6.1500000000000006e-002 | AB319: -6.6400000000000001e-002 | AC319: -0.124 | AD319: -0.126 | AE319: 90.97 | AF319: 93.85 | AG319: 0.9 | AH319: AA | AI319: 4.2999999999999997e-002 | AJ319: =H319+100*O319 -> 155.30000000000001 | AK319: 154.9 | AL319: 309 | AM319: 61.1 | AN319: 304 | AO319: 0.11 | AP319: 23 | AQ319: 奥佳转债!
A320: 100 | B320: 128126 | C320: 赣锋转2! | D320: 2460 | E320: 赣锋锂业 | F320: 有色金属 | G320: 小金属 | H320: 157.7 | I320: 5.9999999999999995e-004 | J320: -2.9999999999999997e-004 | K320: 95.23 | L320: 2.9999999999999997e-004 | M320: 111.1 | N320: 60.27 | O320: -2.e-003 | P320: 158.01 | Q320: 转股中 | R320: 5.34年 | S320: 3.35年 | T320: 20.2 | U320: 817 | V320: 0.25700000000000001 | W320: 1.6e-002 | X320: 2.5000000000000001e-002 | Y320: 1291. | Z320: 12.6 | AA320: -6.4299999999999996e-002 | AB320: -6.7699999999999996e-002 | AC320: -0.11199999999999999 | AD320: -0.113 | AE320: 88.27 | AF320: 88.2 | AG320: 1 | AH320: AA | AI320: 4.4900000000000002e-002 | AJ320: =H320+100*O320 -> 157.5 | AK320: 157.4 | AL320: 313 | AM320: 69.1 | AN320: 313 | AO320: -1.3999999999999999e-002 | AP320: 9 | AQ320: 赣锋转2!
A321: 339 | B321: 113011 | C321: 光大转债 | D321: 601818 | E321: 光大银行 | F321: 金融 | G321: 银行行业 | H321: 122 | I321: 0. | J321: -7.6e-003 | K321: 4.02 | L321: -1.23e-002 | M321: 106.8 | N321: 3.76 | O321: 0.14099999999999999 | P321: 106.91 | Q321: 转股中 | R321: 1.96年 | S321: 无权 | T321: 242 | U321: 82 | V321: 3.0000000000000001e-003 | W321: 0.111 | X321: 0.11900000000000001 | Y321: 2172. | Z321: 0.63 | AA321: -6.6299999999999998e-002 | AB321: -7.2300000000000003e-002 | AC321: 无权 | AD321: 无权 | AE321: 无权 | AF321: 99.59 | AG321: 0.62 | AH321: AAA | AI321: 3.6699999999999997e-002 | AJ321: =H321+100*O321 -> 136.09999999999999 | AK321: 137.1 | AL321: 251 | AM321: 37.5 | AN321: 196 | AO321: -2.5000000000000001e-002 | AP321: 14 | AQ321: 光大转债
A322: 171 | B322: 123046 | C322: 天铁转债! | D322: 300587 | E322: 天铁股份 | F322: 铁路 | G322: 铁路设备 | H322: 168.14 | I322: 8.0000000000000004e-004 | J322: -5.1000000000000004e-003 | K322: 17 | L322: -4.6999999999999993e-003 | M322: 117.7 | N322: 10.12 | O322: 1.e-003 | P322: 167.98 | Q322: 转股中 | R322: 4.96年 | S322: 2.96年 | T322: 0.85 | U322: 136 | V322: 0.94700000000000006 | W322: 1.4999999999999999e-002 | X322: 2.5000000000000001e-002 | Y322: 58 | Z322: 4.17 | AA322: -7.0599999999999996e-002 | AB322: -7.6100000000000001e-002 | AC322: -0.14099999999999999 | AD322: -0.14300000000000002 | AE322: 85.49 | AF322: 87.08 | AG322: 0.91 | AH322: AA- | AI322: 6.4000000000000001e-002 | AJ322: =H322+100*O322 -> 168.23999999999998 | AK322: 168.3 | AL322: 319 | AM322: 81.2 | AN322: 321 | AO322: 9.8000000000000004e-002 | AP322: 12 | AQ322: 天铁转债!
A323: 204 | B323: 113557 | C323: 森特转债! | D323: 603098 | E323: 森特股份 | F323: 建筑 | G323: 建筑工程 | H323: 171.56 | I323: -3.1899999999999998e-002 | J323: -2.6800000000000001e-002 | K323: 17.15 | L323: -5.8700000000000002e-002 | M323: 120.3 | N323: 10.11 | O323: 1.1000000000000001e-002 | P323: 169.63 | Q323: 转股中 | R323: 4.71年 | S323: 2.72年 | T323: 1.76 | U323: 1020. | V323: 3.3500000000000001 | W323: 2.1000000000000001e-002 | X323: 3.6000000000000004e-002 | Y323: 82 | Z323: 3.97 | AA323: -7.3800000000000004e-002 | AB323: -8.0399999999999985e-002 | AC323: -0.107 | AD323: -0.10800000000000001 | AE323: 86.84 | AF323: 90.36 | AG323: 1 | AH323: AA- | AI323: 6.4000000000000001e-002 | AJ323: =H323+100*O323 -> 172.66 | AK323: 173.5 | AL323: 322 | AM323: 83.1 | AN323: 323 | AO323: 0.111 | AP323: 36 | AQ323: 森特转债!
A324: 310 | B324: 113504 | C324: 艾华转债!! | D324: 603989 | E324: 艾华集团 | F324: 电子 | G324: 元器件制 | H324: 138 | I324: 6.6e-003 | J324: -5.6999999999999993e-003 | K324: 29.1 | L324: 1.e-003 | M324: 109.3 | N324: 21.13 | O324: 2.e-003 | P324: 137.72 | Q324: 转股中 | R324: 2.91年 | S324: 0.92年 | T324: 5.22 | U324: 25 | V324: 3.5000000000000003e-002 | W324: 4.4999999999999998e-002 | X324: 6.2e-002 | Y324: 115 | Z324: 4.78 | AA324: -7.7899999999999997e-002 | AB324: -8.3199999999999996e-002 | AC324: -0.24100000000000002 | AD324: -0.24299999999999999 | AE324: 97.41 | AF324: 97.21 | AG324: 0.88 | AH324: AA | AI324: 4.1700000000000001e-002 | AJ324: =H324+100*O324 -> 138.19999999999999 | AK324: 138.3 | AL324: 256 | AM324: 40.9 | AN324: 221 | AO324: 6.7000000000000004e-002 | AP324: 9 | AQ324: 艾华转债!!
A325: 216 | B325: 123034 | C325: 通光转债! | D325: 300265 | E325: 通光线缆 | F325: 通信互联 | G325: 通信设备 | H325: 173 | I325: 1.84e-002 | J325: -1.5900000000000001e-002 | K325: 9.08 | L325: 3.3e-003 | M325: 118 | N325: 7.97 | O325: 0.51900000000000002 | P325: 113.93 | Q325: 转股中 | R325: 4.59年 | S325: 2.59年 | T325: 0.78 | U325: 90 | V325: 0.67299999999999993 | W325: 2.4e-002 | X325: 2.7000000000000003e-002 | Y325: 33 | Z325: 2.64 | AA325: -8.1300000000000011e-002 | AB325: -8.7300000000000003e-002 | AC325: -0.11599999999999999 | AD325: -0.11699999999999999 | AE325: 84.97 | AF325: 85.26 | AG325: 0.74 | AH325: A+ | AI325: 7.4999999999999997e-002 | AJ325: =H325+100*O325 -> 224.90000000000001 | AK325: 232.1 | AL325: 332 | AM325: 146.8 | AN325: 333 | AO325: -2.9999999999999999e-002 | AP325: 23 | AQ325: 通光转债!
A326: 61 | B326: 113041 | C326: 紫金转债 | D326: 601899 | E326: 紫金矿业 | F326: 有色金属 | G326: 贵金属 | H326: 160.93 | I326: 4.36e-002 | J326: -8.3000000000000001e-003 | K326: 10.13 | L326: 4.0000000000000001e-002 | M326: 108 | N326: 7 | O326: 0.11199999999999999 | P326: 144.71 | Q326: 38天 | R326: 4.59年 | S326: 2.59年 | T326: 60 | U326: 641 | V326: 6.7000000000000004e-002 | W326: 2.3e-002 | X326: 3.4000000000000002e-002 | Y326: 2580. | Z326: 5.02 | AA326: -8.3800000000000013e-002 | AB326: -8.6699999999999999e-002 | AC326: -0.106 | AD326: -0.107 | AE326: 91.47 | AF326: 91.14 | AG326: 0.88 | AH326: AAA | AI326: 3.7999999999999999e-002 | AJ326: =H326+100*O326 -> 172.13 | AK326: 177.1 | AL326: 325 | AM326: 85.7 | AN326: 324 | AO326: -3.6000000000000004e-002 | AP326: 8 | AQ326: 紫金转债
A327: 188 | B327: 128095 | C327: 恩捷转债!! | D327: 2812 | E327: 恩捷股份 | F327: 电子 | G327: 元器件制 | H327: 179.453 | I327: 6.3e-003 | J327: -2.3999999999999998e-003 | K327: 116.38 | L327: 4.0999999999999995e-003 | M327: 114.9 | N327: 65.09 | O327: 4.0000000000000001e-003 | P327: 178.8 | Q327: 转股中 | R327: 4.86年 | S327: 2.86年 | T327: 7.59 | U327: 239 | V327: 0.17300000000000001 | W327: 6.9999999999999993e-003 | X327: 1.3000000000000001e-002 | Y327: 1033. | Z327: 9.37 | AA327: -8.900000000000001e-002 | AB327: -9.3699999999999992e-002 | AC327: -0.107 | AD327: -0.10800000000000001 | AE327: 91.12 | AF327: 94 | AG327: 0.94 | AH327: AA | AI327: 4.2999999999999997e-002 | AJ327: =H327+100*O327 -> 179.85300000000001 | AK327: 180.1 | AL327: 326 | AM327: 86.1 | AN327: 325 | AO327: 1.4999999999999999e-002 | AP327: 16 | AQ327: 恩捷转债!!
A328: 250 | B328: 113025 | C328: 明泰转债!! | D328: 601677 | E328: 明泰铝业 | F328: 有色金属 | G328: 铝金属 | H328: 172.05 | I328: -2.5399999999999999e-002 | J328: 3.2000000000000002e-003 | K328: 18.9 | L328: -2.3799999999999998e-002 | M328: 115.1 | N328: 11.2 | O328: 2.e-002 | P328: 168.75 | Q328: 转股中 | R328: 4年7天 | S328: 2年8天 | T328: 11.5 | U328: 98 | V328: 4.8000000000000001e-002 | W328: 9.1999999999999998e-002 | X328: 0.156 | Y328: 125 | Z328: 1.48 | AA328: -9.69e-002 | AB328: -0.10300000000000001 | AC328: -0.158 | AD328: -0.16 | AE328: 94.44 | AF328: 97.56 | AG328: 0.94 | AH328: AA | AI328: 4.2999999999999997e-002 | AJ328: =H328+100*O328 -> 174.05000000000001 | AK328: 175.4 | AL328: 323 | AM328: 77.8 | AN328: 320 | AO328: 8.0000000000000002e-003 | AP328: 27 | AQ328: 明泰转债!!
A329: 226 | B329: 113545 | C329: 金能转债! | D329: 603113 | E329: 金能科技 | F329: 煤炭 | G329: 炼焦 | H329: 188.09 | I329: 2.0099999999999996e-002 | J329: -1.1000000000000001e-003 | K329: 19.18 | L329: 2.0199999999999999e-002 | M329: 114.9 | N329: 10.78 | O329: 5.7000000000000002e-002 | P329: 177.92 | Q329: 转股中 | R329: 4.53年 | S329: 2.53年 | T329: 10.2 | U329: 114 | V329: 5.9000000000000004e-002 | W329: 6.3e-002 | X329: 0.11199999999999999 | Y329: 163 | Z329: 2.13 | AA329: -0.105 | AB329: -0.11 | AC329: -0.13500000000000001 | AD329: -0.13600000000000001 | AE329: 92.39 | AF329: 95.31 | AG329: 0.94 | AH329: AA | AI329: 4.2999999999999997e-002 | AJ329: =H329+100*O329 -> 193.78999999999999 | AK329: 198.3 | AL329: 328 | AM329: 103 | AN329: 329 | AO329: -5.5e-002 | AP329: 18 | AQ329: 金能转债!
A330: 331 | B330: 113016 | C330: 小康转债!! | D330: 601127 | E330: 小康股份 | F330: 汽车 | G330: 零部件制 | H330: 147.14 | I330: -1.2699999999999999e-002 | J330: -3.32e-002 | K330: 22.45 | L330: -5.0300000000000004e-002 | M330: 109.3 | N330: 15.7 | O330: 2.8999999999999998e-002 | P330: 142.99 | Q330: 转股中 | R330: 2.60年 | S330: 0.60年 | T330: 3.92 | U330: 1429. | V330: 2.4100000000000001 | W330: 1.3999999999999999e-002 | X330: 1.9e-002 | Y330: 290 | Z330: 4.89 | AA330: -0.11 | AB330: -0.115 | AC330: -0.41499999999999998 | AD330: -0.41799999999999998 | AE330: 98.68 | AF330: 98.48 | AG330: 0.91 | AH330: AA | AI330: 4.1700000000000001e-002 | AJ330: =H330+100*O330 -> 150.03999999999999 | AK330: 151.3 | AL330: 300 | AM330: 52.6 | AN330: 285 | AO330: 1.e-002 | AP330: 47 | AQ330: 小康转债!!
A331: 148 | B331: 113582 | C331: 火炬转债! | D331: 603678 | E331: 火炬电子 | F331: 电子 | G331: 元器件制 | H331: 242.63 | I331: 2.2200000000000001e-002 | J331: -3.4999999999999996e-003 | K331: 59.36 | L331: 1.9199999999999998e-002 | M331: 115.3 | N331: 25.33 | O331: 3.5000000000000003e-002 | P331: 234.35 | Q331: 转股中 | R331: 5年54天 | S331: 3年55天 | T331: 4.18 | U331: 225 | V331: 0.221 | W331: 1.4999999999999999e-002 | X331: 3.6000000000000004e-002 | Y331: 273 | Z331: 7.74 | AA331: -0.13699999999999998 | AB331: -0.14099999999999999 | AC331: -0.129 | AD331: -0.129 | AE331: 89.88 | AF331: 92.41 | AG331: 0.97 | AH331: AA | AI331: 4.4900000000000002e-002 | AJ331: =H331+100*O331 -> 246.13 | AK331: 250.9 | AL331: 334 | AM331: 158.5 | AN331: 334 | AO331: 6.6000000000000003e-002 | AP331: 5 | AQ331: 火炬转债!
A332: 150 | B332: 113580 | C332: 康隆转债! | D332: 603665 | E332: 康隆达 | F332: 服装纺织 | G332: 服装行业 | H332: 263.39 | I332: -7.3000000000000001e-003 | J332: -5.4000000000000003e-003 | K332: 16.15 | L332: -1.9400000000000001e-002 | M332: 121.2 | N332: 15.51 | O332: 1.53 | P332: 104.13 | Q332: 转股中 | R332: 5年20天 | S332: 3年21天 | T332: 0.41 | U332: 95 | V332: 0.87599999999999989 | W332: 1.6e-002 | X332: 1.7000000000000001e-002 | Y332: 26 | Z332: 2.51 | AA332: -0.14499999999999999 | AB332: -0.14999999999999999 | AC332: -0.14199999999999999 | AD332: -0.14300000000000002 | AE332: 84.99 | AF332: 88.46 | AG332: 0.66 | AH332: AA- | AI332: 6.59e-002 | AJ332: =H332+100*O332 -> 416.38999999999999 | AK332: 422.7 | AL332: 341 | AM332: 334.2 | AN332: 341 | AO332: -5.9000000000000004e-002 | AP332: 9 | AQ332: 康隆转债!
A333: 229 | B333: 123031 | C333: 晶瑞转债! | D333: 300655 | E333: 晶瑞股份 | F333: 化工 | G333: 化工 | H333: 233.19 | I333: 1.9299999999999998e-002 | J333: 1.41e-002 | K333: 36 | L333: 3.5099999999999999e-002 | M333: 115.8 | N333: 18.43 | O333: 0.19399999999999998 | P333: 195.33 | Q333: 转股中 | R333: 4.41年 | S333: 2.41年 | T333: 0.63 | U333: 650 | V333: 4.4000000000000004 | W333: 9.0000000000000011e-003 | X333: 1.8000000000000002e-002 | Y333: 68 | Z333: 5.22 | AA333: -0.14899999999999999 | AB333: -0.154 | AC333: -0.17999999999999999 | AD333: -0.18100000000000002 | AE333: 85.91 | AF333: 84.75 | AG333: 0.95 | AH333: A+ | AI333: 7.4999999999999997e-002 | AJ333: =H333+100*O333 -> 252.59 | AK333: 271 | AL333: 336 | AM333: 185.1 | AN333: 336 | AO333: 0.158 | AP333: 16 | AQ333: 晶瑞转债!
A334: 235 | B334: 113543 | C334: 欧派转债! | D334: 603833 | E334: 欧派家居 | F334: 其他 | G334: 家居用品 | H334: 234.94 | I334: 4.7e-002 | J334: -4.1999999999999997e-003 | K334: 167.9 | L334: 4.3799999999999999e-002 | M334: 114.9 | N334: 71.69 | O334: 3.0000000000000001e-003 | P334: 234.2 | Q334: 转股中 | R334: 4.37年 | S334: 3.37年 | T334: 4.84 | U334: 251 | V334: 0.222 | W334: 5.0000000000000001e-003 | X334: 1.1000000000000001e-002 | Y334: 1010. | Z334: 9.26 | AA334: -0.153 | AB334: -0.158 | AC334: -0.11199999999999999 | AD334: -0.113 | AE334: 90.89 | AF334: 95.96 | AG334: 0.98 | AH334: AA | AI334: 4.2999999999999997e-002 | AJ334: =H334+100*O334 -> 235.24000000000001 | AK334: 235.7 | AL334: 333 | AM334: 139.7 | AN334: 332 | AO334: 9.8000000000000004e-002 | AP334: 14 | AQ334: 欧派转债!
A335: 277 | B335: 123018 | C335: 溢利转债! | D335: 300381 | E335: 溢多利 | F335: 医药 | G335: 原料药 | H335: 212.6 | I335: -8.8999999999999999e-003 | J335: 1.11e-002 | K335: 9.13 | L335: 3.3e-003 | M335: 114.3 | N335: 8.32 | O335: 0.93700000000000006 | P335: 109.74 | Q335: 转股中 | R335: 3.72年 | S335: 1.72年 | T335: 0.54 | U335: 102 | V335: 0.88900000000000001 | W335: 1.2e-002 | X335: 1.3000000000000001e-002 | Y335: 45 | Z335: 1.54 | AA335: -0.156 | AB335: -0.161 | AC335: -0.249 | AD335: -0.25 | AE335: 91.54 | AF335: 91.17 | AG335: 0.69 | AH335: AA- | AI335: 6.4000000000000001e-002 | AJ335: =H335+100*O335 -> 306.30000000000001 | AK335: 315.5 | AL335: 337 | AM335: 223.9 | AN335: 337 | AO335: -1.8000000000000002e-002 | AP335: 13 | AQ335: 溢利转债!
A336: 336 | B336: 127004 | C336: 模塑转债!! | D336: 700 | E336: 模塑科技 | F336: 汽车 | G336: 零部件制 | H336: 163.559 | I336: -1.06e-002 | J336: 1.06e-002 | K336: 4.82 | L336: -1.03e-002 | M336: 113.3 | N336: 7.46 | O336: 1.53 | P336: 64.61 | Q336: 转股中 | R336: 2.17年 | S336: 0.17年 | T336: 1.32 | U336: 37 | V336: 0.17199999999999999 | W336: 2.9999999999999999e-002 | X336: 1.9e-002 | Y336: 44 | Z336: 1.7 | AA336: -0.158 | AB336: -0.16699999999999998 | AC336: -1.214 | AD336: -1.22 | AE336: 100.43 | AF336: 100.8 | AG336: 0 | AH336: AA | AI336: 4.1700000000000001e-002 | AJ336: =H336+100*O336 -> 316.55899999999997 | AK336: 262.5 | AL336: 335 | AM336: 161.7 | AN336: 335 | AO336: -2.5000000000000001e-002 | AP336: 34 | AQ336: 模塑转债!!
A337: 303 | B337: 113509 | C337: 新泉转债!! | D337: 603179 | E337: 新泉股份 | F337: 汽车 | G337: 零部件制 | H337: 195.45 | I337: -2.2799999999999997e-002 | J337: -1.7000000000000001e-002 | K337: 29.96 | L337: -4.0999999999999995e-002 | M337: 110.3 | N337: 15.55 | O337: 1.3999999999999999e-002 | P337: 192.67 | Q337: 转股中 | R337: 3.17年 | S337: 1.17年 | T337: 0.89 | U337: 91 | V337: 0.51800000000000002 | W337: 8.0000000000000002e-003 | X337: 1.6e-002 | Y337: 110 | Z337: 3.22 | AA337: -0.16800000000000001 | AB337: -0.17199999999999999 | AC337: -0.34299999999999997 | AD337: -0.34499999999999997 | AE337: 97.22 | AF337: 96.81 | AG337: 0.97 | AH337: AA | AI337: 4.2999999999999997e-002 | AJ337: =H337+100*O337 -> 196.84999999999999 | AK337: 198.2 | AL337: 327 | AM337: 101 | AN337: 328 | AO337: -4.4000000000000004e-002 | AP337: 11 | AQ337: 新泉转债!!
A338: 289 | B338: 123015 | C338: 蓝盾转债!! | D338: 300297 | E338: 蓝盾股份 | F338: 计算机及 | G338: 软件开发 | H338: 219.5 | I338: 5.0799999999999998e-002 | J338: -4.7199999999999999e-002 | K338: 3.91 | L338: 4.5499999999999999e-002 | M338: 112.3 | N338: 5.79 | O338: 2.25 | P338: 67.53 | Q338: 转股中 | R338: 3.36年 | S338: 1.36年 | T338: 1 | U338: 1793. | V338: 7.9800000000000004 | W338: 2.e-002 | X338: 1.3999999999999999e-002 | Y338: 49 | Z338: 1.27 | AA338: -0.183 | AB338: -0.188 | AC338: -0.32899999999999996 | AD338: -0.33000000000000002 | AE338: 93.57 | AF338: 91.57 | AG338: 0.08 | AH338: AA- | AI338: 6.4000000000000001e-002 | AJ338: =H338+100*O338 -> 444.5 | AK338: 371.5 | AL338: 338 | AM338: 277.9 | AN338: 338 | AO338: -0.106 | AP338: 18 | AQ338: 蓝盾转债!!
A339: 332 | B339: 128017 | C339: 金禾转债!! | D339: 2597 | E339: 金禾实业 | F339: 化工 | G339: 化工 | H339: 187.353 | I339: 5.1000000000000004e-003 | J339: -1.89e-002 | K339: 39.4 | L339: -1.43e-002 | M339: 108.8 | N339: 22.42 | O339: 6.6000000000000003e-002 | P339: 175.74 | Q339: 转股中 | R339: 2.58年 | S339: 0.58年 | T339: 5.52 | U339: 132 | V339: 0.125 | W339: 2.5000000000000001e-002 | X339: 4.4000000000000004e-002 | Y339: 221 | Z339: 4.79 | AA339: -0.192 | AB339: -0.19699999999999998 | AC339: -0.627 | AD339: -0.629 | AE339: 98.49 | AF339: 98.06 | AG339: 0.97 | AH339: AA | AI339: 4.1700000000000001e-002 | AJ339: =H339+100*O339 -> 193.953 | AK339: 199 | AL339: 329 | AM339: 100.5 | AN339: 327 | AO339: 1.8000000000000002e-002 | AP339: 10 | AQ339: 金禾转债!!
A340: 300 | B340: 110044 | C340: 广电转债!! | D340: 600831 | E340: 广电网络 | F340: 传媒娱乐 | G340: 影视娱乐 | H340: 251.48 | I340: 1.8200000000000001e-002 | J340: -1.8700000000000001e-002 | K340: 5.73 | L340: -1.7000000000000001e-003 | M340: 112.3 | N340: 6.9 | O340: 2.0299999999999998 | P340: 83.04 | Q340: 转股中 | R340: 3.23年 | S340: 1.24年 | T340: 0.71 | U340: 553 | V340: 3.1200000000000001 | W340: 1.7000000000000001e-002 | X340: 1.3999999999999999e-002 | Y340: 41 | Z340: 1.1 | AA340: -0.22399999999999998 | AB340: -0.22899999999999998 | AC340: -0.40500000000000003 | AD340: -0.40700000000000003 | AE340: 96.96 | AF340: 98.3 | AG340: 0.32 | AH340: AA | AI340: 4.2999999999999997e-002 | AJ340: =H340+100*O340 -> 454.47999999999996 | AK340: 419.9 | AL340: 340 | AM340: 321.6 | AN340: 340 | AO340: -1.3999999999999999e-002 | AP340: 11 | AQ340: 广电转债!!
A341: 276 | B341: 113526 | C341: 联泰转债! | D341: 603797 | E341: 联泰环保 | F341: 城市公用 | G341: 三废处理 | H341: 315.05 | I341: -2.76e-002 | J341: 1.6500000000000001e-002 | K341: 7.95 | L341: -1.3600000000000001e-002 | M341: 110.3 | N341: 6.11 | O341: 1.4199999999999999 | P341: 130.11 | Q341: 转股中 | R341: 3.81年 | S341: 1.81年 | T341: 1.93 | U341: 281 | V341: 0.45000000000000001 | W341: 5.4000000000000006e-002 | X341: 7.0000000000000007e-002 | Y341: 36 | Z341: 2.31 | AA341: -0.24399999999999999 | AB341: -0.247 | AC341: -0.307 | AD341: -0.307 | AE341: 95 | AF341: 94.91 | AG341: 0.81 | AH341: AA+ | AI341: 4.0999999999999995e-002 | AJ341: =H341+100*O341 -> 457.05000000000001 | AK341: 500 | AL341: 342 | AM341: 405 | AN341: 343 | AO341: -2.e-003 | AP341: 10 | AQ341: 联泰转债!
A342: 296 | B342: 128041 | C342: 盛路转债!! | D342: 2446 | E342: 盛路通信 | F342: 通信互联 | G342: 通信设备 | H342: 293 | I342: -2.e-003 | J342: 5.8999999999999999e-003 | K342: 5.65 | L342: 1.2500000000000001e-002 | M342: 114.3 | N342: 6.82 | O342: 2.54 | P342: 82.84 | Q342: 转股中 | R342: 3.29年 | S342: 1.29年 | T342: 0.53 | U342: 144 | V342: 0.92599999999999993 | W342: 1.e-002 | X342: 9.0000000000000011e-003 | Y342: 51 | Z342: 1.7 | AA342: -0.252 | AB342: -0.25700000000000001 | AC342: -0.42599999999999999 | AD342: -0.42700000000000005 | AE342: 96.74 | AF342: 99.81 | AG342: 0.31 | AH342: AA | AI342: 4.2999999999999997e-002 | AJ342: =H342+100*O342 -> 547. | AK342: 503.2 | AL342: 343 | AM342: 403.3 | AN342: 342 | AO342: -1.3000000000000001e-002 | AP342: 13 | AQ342: 盛路转债!!
A343: 319 | B343: 128030 | C343: 天康转债!! | D343: 2100 | E343: 天康生物 | F343: 农业 | G343: 畜牧业 | H343: 277.377 | I343: 1.8e-003 | J343: -3.5999999999999999e-003 | K343: 10.75 | L343: -1.9e-003 | M343: 111.3 | N343: 7.85 | O343: 1.03 | P343: 136.94 | Q343: 转股中 | R343: 2.72年 | S343: 0.72年 | T343: 0.96 | U343: 6 | V343: 2.3e-002 | W343: 8.0000000000000002e-003 | X343: 1.1000000000000001e-002 | Y343: 116 | Z343: 1.93 | AA343: -0.28800000000000003 | AB343: -0.29299999999999998 | AC343: -0.71999999999999997 | AD343: -0.72099999999999997 | AE343: 98.18 | AF343: 99.76 | AG343: 1 | AH343: AA | AI343: 4.1700000000000001e-002 | AJ343: =H343+100*O343 -> 380.37700000000001 | AK343: 417.8 | AL343: 339 | AM343: 318 | AN343: 339 | AO343: -3.7999999999999999e-002 | AP343: 12 | AQ343: 天康转债!!
A344: 320 | B344: 128029 | C344: 太阳转债!! | D344: 2078 | E344: 太阳纸业 | F344: 造纸包装 | G344: 造纸行业 | H344: 200.3 | I344: 1.5e-003 | J344: -9.1000000000000004e-003 | K344: 15.68 | L344: -7.6e-003 | M344: 107 | N344: 8.55 | O344: 9.1999999999999998e-002 | P344: 183.39 | Q344: 转股中 | R344: 1.72年 | S344: 回售内 | T344: 9.09 | U344: 175 | V344: 9.6000000000000002e-002 | W344: 2.2000000000000002e-002 | X344: 4.0999999999999995e-002 | Y344: 412 | Z344: 2.65 | AA344: -0.30599999999999999 | AB344: -0.311 | AC344: 回售内 | AD344: 回售内 | AE344: 100.17 | AF344: 100.09 | AG344: 1 | AH344: AA+ | AI344: 3.9699999999999999e-002 | AJ344: =H344+100*O344 -> 209.5 | AK344: 217.2 | AL344: 331 | AM344: 117 | AN344: 330 | AO344: -2.3e-002 | AP344: 7 | AQ344: 太阳转债!!
A345: 293 | B345: 123013 | C345: 横河转债! | D345: 300539 | E345: 横河模具 | F345: 机械装备 | G345: 专用设备 | H345: 391.5 | I345: -2.5000000000000001e-003 | J345: 3.0000000000000001e-003 | K345: 6.67 | L345: 1.5e-003 | M345: 115.2 | N345: 9.13 | O345: 4.3600000000000003 | P345: 73.06 | Q345: 转股中 | R345: 3.31年 | S345: 1.32年 | T345: 0.38 | U345: 100 | V345: 0.66700000000000004 | W345: 2.6000000000000002e-002 | X345: 1.9e-002 | Y345: 15 | Z345: 3.06 | AA345: -0.313 | AB345: -0.318 | AC345: -0.47399999999999998 | AD345: -0.47399999999999998 | AE345: 92.98 | AF345: 91.22 | AG345: 0.28 | AH345: A+ | AI345: 7.4999999999999997e-002 | AJ345: =H345+100*O345 -> 827.5 | AK345: 709.9 | AL345: 344 | AM345: 617 | AN345: 344 | AO345: -5.2999999999999999e-002 | AP345: 15 | AQ345: 横河转债!
A346: 233 | B346: 123029 | C346: 英科转债! | D346: 300677 | E346: 英科医疗 | F346: 医药 | G346: 医疗器械 | H346: 1949.91 | I346: 2.9999999999999997e-004 | J346: -9.300000000000001e-003 | K346: 169.95 | L346: -9.0000000000000011e-003 | M346: 138.2 | N346: 11.32 | O346: 0.29899999999999999 | P346: 1501.33 | Q346: 转股中 | R346: 4.37年 | S346: 2.37年 | T346: 1.23 | U346: 668 | V346: 0.27800000000000002 | W346: 2.e-003 | X346: 3.1e-002 | Y346: 599 | Z346: 6.41 | AA346: -0.41399999999999998 | AB346: -0.41799999999999998 | AC346: -0.315 | AD346: -0.315 | AE346: 91.94 | AF346: 106.45 | AG346: 0.99 | AH346: AA- | AI346: 6.4000000000000001e-002 | AJ346: =H346+100*O346 -> 1979.8100000000002 | AK346: 2398.5 | AL346: 345 | AM346: 2292. | AN346: 345 | AO346: -8.0000000000000002e-002 | AP346: 17 | AQ346: 英科转债!