A1: 序号 | B1: 转债代码 | C1: 转债名称 | D1: 股票代码 | E1: 股票名称 | F1: 行业 | G1: 子行业 | H1: 转债价格 | I1: 涨跌 | J1: 日内套利 | K1: 股价 | L1: 涨跌 | M1: 剩余本息 | N1: 转股价格 | O1: 转股溢价率 | P1: 转股价值 | Q1: 距离转股日 | R1: 剩余年限 | S1: 回售年限 | T1: 转债余额 | U1: 转债成交额 | V1: 转债换手率 | W1: 余额/市值 | X1: 余额/股本 | Y1: 股票市值 | Z1: P/B | AA1: 税前收益率 | AB1: 税后收益率 | AC1: 税前回售收益 | AD1: 税后回售收益 | AE1: 回售价值 | AF1: 纯债价值 | AG1: 弹性 | AH1: 信用 | AI1: 折现率 | AJ1: 双低 | AK1: 老式双低 | AL1: 老式排名 | AM1: 新式双低 | AN1: 新式排名 | AO1: MA20乖离 | AP1: 热门度 | AQ1: 转债名称
A2: 1 | B2: 118004 | C2: 博瑞转债 | D2: 688166 | E2: 博瑞医药 | F2: 医药 | G2: 原料药 | H2: 125.96 | I2: -2.8500000000000001e-002 | J2: -6.8000000000000005e-003 | K2: 30 | L2: -6.6000000000000003e-002 | M2: 121 | N2: 35.68 | O2: 0.498 | P2: 84.08 | Q2: 5月2天 | R2: 5.91年 | S2: 3.91年 | T2: 4.65 | U2: 397 | V2: 0.67400000000000004 | W2: 3.7999999999999999e-002 | X2: 3.2000000000000001e-002 | Y2: 123 | Z2: 7.77 | AA2: -6.8999999999999999e-003 | AB2: -1.2800000000000001e-002 | AC2: -4.1299999999999996e-002 | AD2: -4.4000000000000004e-002 | AE2: 83.65 | AF2: 85.92 | AG2: 0.53 | AH2: AA- | AI2: 6.0599999999999994e-002 | AJ2: =H2+100*O2 -> 175.75999999999999 | AK2: 167.8 | AL2: 232 | AM2: 81.9 | AN2: 280 | AO2: -0.115 | AP2: 1 | AQ2: 博瑞转债
A3: 2 | B3: 113638 | C3: 台21转债 | D3: 603055 | E3: 台华新材 | F3: 服装纺织 | G3: 纺织行业 | H3: 125.58 | I3: -2.7000000000000003e-002 | J3: 7.4999999999999997e-003 | K3: 14.22 | L3: -4.6300000000000001e-002 | M3: 117.1 | N3: 16.87 | O3: 0.48999999999999999 | P3: 84.29 | Q3: 4月27天 | R3: 5.89年 | S3: 3.89年 | T3: 6 | U3: 22 | V3: 2.8999999999999998e-002 | W3: 4.9000000000000002e-002 | X3: 4.0999999999999995e-002 | Y3: 124 | Z3: 3.45 | AA3: -1.1899999999999999e-002 | AB3: -1.6899999999999998e-002 | AC3: -4.2999999999999997e-002 | AD3: -4.53e-002 | AE3: 89.92 | AF3: 93.43 | AG3: 0.42 | AH3: AA | AI3: 3.9599999999999996e-002 | AJ3: =H3+100*O3 -> 174.57999999999998 | AK3: 166.9 | AL3: 228 | AM3: 73.4 | AN3: 228 | AO3: -0.11900000000000001 | AP3: 1 | AQ3: 台21转债
A4: 3 | B4: 123135 | C4: 泰林转债 | D4: 300813 | E4: 泰林生物 | F4: 医药 | G4: 医疗器械 | H4: 129.499 | I4: 8.9999999999999998e-004 | J4: -2.3e-003 | K4: 70 | L4: -2.5999999999999999e-003 | M4: 121.5 | N4: 87.38 | O4: 0.61699999999999999 | P4: 80.11 | Q4: 4月26天 | R4: 5.89年 | S4: 3.89年 | T4: 2.1 | U4: 7.2 | V4: 2.6000000000000002e-002 | W4: 5.7999999999999996e-002 | X4: 4.5999999999999999e-002 | Y4: 36 | Z4: 7.5 | AA4: -1.09e-002 | AB4: -1.7000000000000001e-002 | AC4: -4.7300000000000002e-002 | AD4: -5.0199999999999995e-002 | AE4: 80.71 | AF4: 81.48 | AG4: 0.56 | AH4: A+ | AI4: 7.1599999999999997e-002 | AJ4: =H4+100*O4 -> 191.19900000000001 | AK4: 178.9 | AL4: 296 | AM4: 97.4 | AN4: 322 | AO4: -0.191 | AP4: 2 | AQ4: 泰林转债
A5: 4 | B5: 123134 | C5: 卡倍转债 | D5: 300863 | E5: 卡倍亿 | F5: 汽车 | G5: 零部件制 | H5: 131.12 | I5: 2.3999999999999998e-003 | J5: 1.41e-002 | K5: 75.1 | L5: 2.8999999999999998e-002 | M5: 121 | N5: 92.5 | O5: 0.61499999999999999 | P5: 81.19 | Q5: 4月23天 | R5: 5.88年 | S5: 3.88年 | T5: 2.79 | U5: 9.1 | V5: 2.5000000000000001e-002 | W5: 6.7000000000000004e-002 | X5: 5.5e-002 | Y5: 41 | Z5: 6.55 | AA5: -1.37e-002 | AB5: -1.9699999999999999e-002 | AC5: -5.1100000000000007e-002 | AD5: -5.3800000000000001e-002 | AE5: 80.37 | AF5: 81.05 | AG5: 0.57 | AH5: A+ | AI5: 7.1599999999999997e-002 | AJ5: =H5+100*O5 -> 192.62 | AK5: 181.1 | AL5: 301 | AM5: 100 | AN5: 327 | AO5: -9.1999999999999998e-002 | AP5: 2 | AQ5: 卡倍转债
A6: 5 | B6: 110084 | C6: 贵燃转债 | D6: 600903 | E6: 贵州燃气 | F6: 石油天然 | G6: 天然气 | H6: 117.02 | I6: 2.7000000000000001e-003 | J6: -1.6000000000000001e-003 | K6: 9.07 | L6: 2.2000000000000001e-003 | M6: 115.1 | N6: 10.17 | O6: 0.312 | P6: 89.18 | Q6: 4月23天 | R6: 5.88年 | S6: 3.88年 | T6: 10 | U6: 26 | V6: 2.2000000000000002e-002 | W6: 9.6999999999999989e-002 | X6: 8.5999999999999993e-002 | Y6: 103 | Z6: 3.65 | AA6: -2.8000000000000004e-003 | AB6: -7.4000000000000003e-003 | AC6: -2.6000000000000002e-002 | AD6: -2.8399999999999998e-002 | AE6: 89.94 | AF6: 91.86 | AG6: 0.49 | AH6: AA | AI6: 3.9599999999999996e-002 | AJ6: =H6+100*O6 -> 148.22 | AK6: 144.9 | AL6: 35 | AM6: 53 | AN6: 77 | AO6: -4.9000000000000002e-002 | AP6: 4 | AQ6: 贵燃转债
A7: 6 | B7: 113052 | C7: 兴业转债 | D7: 601166 | E7: 兴业银行 | F7: 金融 | G7: 银行行业 | H7: 114.58 | I7: -2.2000000000000001e-003 | J7: -5.1999999999999998e-003 | K7: 20.88 | L7: -1.9699999999999999e-002 | M7: 114.4 | N7: 25.51 | O7: 0.40000000000000002 | P7: 81.85 | Q7: 4月22天 | R7: 5.88年 | S7: 无权 | T7: 500 | U7: 1125. | V7: 2.e-002 | W7: 0.115 | X7: 9.4e-002 | Y7: 4338. | Z7: 0.75 | AA7: -2.9999999999999997e-004 | AB7: -4.5999999999999999e-003 | AC7: 无权 | AD7: 无权 | AE7: 无权 | AF7: 94.94 | AG7: 0.38 | AH7: AAA | AI7: 3.2599999999999997e-002 | AJ7: =H7+100*O7 -> 154.57999999999998 | AK7: 147.3 | AL7: 49 | AM7: 52.4 | AN7: 74 | AO7: -1.e-003 | AP7: 9 | AQ7: 兴业转债
A8: 7 | B8: 127052 | C8: 杭锅转债 | D8: 2534 | E8: 杭锅股份 | F8: 机械装备 | G8: 通用设备 | H8: 135 | I8: -8.199999999999999e-003 | J8: 3.4999999999999996e-003 | K8: 27.36 | L8: -8.3000000000000001e-003 | M8: 115.1 | N8: 28.08 | O8: 0.38600000000000001 | P8: 97.44 | Q8: 4月22天 | R8: 5.88年 | S8: 3.88年 | T8: 11.1 | U8: 62 | V8: 4.0999999999999995e-002 | W8: 5.5e-002 | X8: 5.2999999999999999e-002 | Y8: 202 | Z8: 5.85 | AA8: -2.7099999999999999e-002 | AB8: -3.1400000000000004e-002 | AC8: -6.0299999999999999e-002 | AD8: -6.25e-002 | AE8: 89.97 | AF8: 91.88 | AG8: 0.57 | AH8: AA | AI8: 3.9599999999999996e-002 | AJ8: =H8+100*O8 -> 173.59999999999999 | AK8: 172.6 | AL8: 264 | AM8: 80.7 | AN8: 274 | AO8: -9.8000000000000004e-002 | AP8: 2 | AQ8: 杭锅转债
A9: 8 | B9: 113637 | C9: 华翔转债 | D9: 603112 | E9: 华翔股份 | F9: 机械装备 | G9: 专用设备 | H9: 136.05 | I9: 5.2199999999999996e-002 | J9: 1.7899999999999999e-002 | K9: 14.42 | L9: 9.9900000000000003e-002 | M9: 121 | N9: 12.99 | O9: 0.22600000000000001 | P9: 111.01 | Q9: 4月20天 | R9: 5.87年 | S9: 3.87年 | T9: 8 | U9: 635 | V9: 0.56899999999999995 | W9: 0.127 | X9: 0.14099999999999999 | Y9: 63 | Z9: 3.17 | AA9: -2.e-002 | AB9: -2.5899999999999999e-002 | AC9: -5.9999999999999998e-002 | AD9: -6.2699999999999992e-002 | AE9: 83.82 | AF9: 86.1 | AG9: 0.7 | AH9: AA- | AI9: 6.0599999999999994e-002 | AJ9: =H9+100*O9 -> 158.65000000000001 | AK9: 161.1 | AL9: 174 | AM9: 75 | AN9: 245 | AO9: 6.8000000000000005e-002 | AP9: 1 | AQ9: 华翔转债
A10: 9 | B10: 123133 | C10: 佩蒂转债 | D10: 300673 | E10: 佩蒂股份 | F10: 食品饮料 | G10: 食品加工 | H10: 126 | I10: -2.0999999999999999e-003 | J10: 1.44e-002 | K10: 17.23 | L10: 2.2599999999999999e-002 | M10: 120.5 | N10: 19.92 | O10: 0.45700000000000002 | P10: 86.5 | Q10: 4月20天 | R10: 5.87年 | S10: 3.87年 | T10: 7.2 | U10: 18 | V10: 1.9e-002 | W10: 0.16500000000000001 | X10: 0.14300000000000002 | Y10: 44 | Z10: 2.62 | AA10: -7.7000000000000002e-003 | AB10: -1.3500000000000002e-002 | AC10: -4.2999999999999997e-002 | AD10: -4.5499999999999999e-002 | AE10: 83.37 | AF10: 85.73 | AG10: 0.54 | AH10: AA- | AI10: 6.0599999999999994e-002 | AJ10: =H10+100*O10 -> 171.69999999999999 | AK10: 165.5 | AL10: 221 | AM10: 79.8 | AN10: 271 | AO10: -8.9999999999999997e-002 | AP10: 2 | AQ10: 佩蒂转债
A11: 10 | B11: 123132 | C11: 回盛转债 | D11: 300871 | E11: 回盛生物 | F11: 医药 | G11: 医药行业 | H11: 128.126 | I11: 1.8200000000000001e-002 | J11: -5.7999999999999996e-003 | K11: 24.75 | L11: 2.2700000000000001e-002 | M11: 121 | N11: 28.32 | O11: 0.46600000000000003 | P11: 87.39 | Q11: 4月15天 | R11: 5.86年 | S11: 3.86年 | T11: 7 | U11: 12 | V11: 1.3000000000000001e-002 | W11: 0.17000000000000001 | X11: 0.14899999999999999 | Y11: 41 | Z11: 2.83 | AA11: -9.8999999999999991e-003 | AB11: -1.5800000000000002e-002 | AC11: -4.5899999999999996e-002 | AD11: -4.87e-002 | AE11: 83.89 | AF11: 86.17 | AG11: 0.55 | AH11: AA- | AI11: 6.0599999999999994e-002 | AJ11: =H11+100*O11 -> 174.726 | AK11: 168.9 | AL11: 242 | AM11: 82.7 | AN11: 283 | AO11: -0.122 | AP11: 2 | AQ11: 回盛转债
A12: 11 | B12: 113636 | C12: 甬金转债 | D12: 603995 | E12: 甬金股份 | F12: 钢铁 | G12: 钢铁行业 | H12: 141.84 | I12: 1.e-004 | J12: -2.9999999999999997e-004 | K12: 56.62 | L12: -2.0000000000000001e-004 | M12: 120.6 | N12: 53.07 | O12: 0.32899999999999996 | P12: 106.69 | Q12: 4月9天 | R12: 5.85年 | S12: 3.85年 | T12: 10 | U12: 22 | V12: 1.4999999999999999e-002 | W12: 7.5999999999999998e-002 | X12: 8.1000000000000003e-002 | Y12: 132 | Z12: 3.84 | AA12: -2.7699999999999999e-002 | AB12: -3.3399999999999999e-002 | AC12: -7.0999999999999994e-002 | AD12: -7.3399999999999993e-002 | AE12: 83.67 | AF12: 85.88 | AG12: 0.69 | AH12: AA- | AI12: 6.0599999999999994e-002 | AJ12: =H12+100*O12 -> 174.74000000000001 | AK12: 177 | AL12: 287 | AM12: 91.1 | AN12: 308 | AO12: -2.7999999999999997e-002 | AP12: 2 | AQ12: 甬金转债
A13: 12 | B13: 113635 | C13: 升21转债 | D13: 603305 | E13: 旭升股份 | F13: 汽车 | G13: 零部件制 | H13: 135.32 | I13: -5.0000000000000001e-003 | J13: -1.0700000000000001e-002 | K13: 43.1 | L13: -2.6000000000000002e-002 | M13: 119.6 | N13: 46.37 | O13: 0.45600000000000002 | P13: 92.95 | Q13: 4月8天 | R13: 5.84年 | S13: 3.84年 | T13: 13.5 | U13: 16 | V13: 9.0000000000000011e-003 | W13: 7.0000000000000007e-002 | X13: 6.5000000000000002e-002 | Y13: 193 | Z13: 5.5 | AA13: -2.1099999999999997e-002 | AB13: -2.6699999999999998e-002 | AC13: -6.2600000000000003e-002 | AD13: -6.4600000000000005e-002 | AE13: 82.82 | AF13: 85.18 | AG13: 0.6 | AH13: AA- | AI13: 6.0599999999999994e-002 | AJ13: =H13+100*O13 -> 180.91999999999999 | AK13: 177.7 | AL13: 292 | AM13: 92.5 | AN13: 312 | AO13: -7.0000000000000007e-002 | AP13: 3 | AQ13: 升21转债
A14: 13 | B14: 111002 | C14: 特纸转债 | D14: 605007 | E14: 五洲特纸 | F14: 造纸包装 | G14: 包装用纸 | H14: 151.21 | I14: 5.7999999999999996e-003 | J14: -2.8000000000000004e-003 | K14: 21.6 | L14: 4.1999999999999997e-003 | M14: 117.1 | N14: 18.5 | O14: 0.29499999999999998 | P14: 116.76 | Q14: 4月6天 | R14: 5.83年 | S14: 3.83年 | T14: 6.7 | U14: 91 | V14: 8.900000000000001e-002 | W14: 7.8e-002 | X14: 9.0999999999999998e-002 | Y14: 86 | Z14: 4.59 | AA14: -4.3299999999999998e-002 | AB14: -4.8099999999999997e-002 | AC14: -8.7499999999999994e-002 | AD14: -8.9600000000000013e-002 | AE14: 90.12 | AF14: 93.63 | AG14: 0.7 | AH14: AA | AI14: 3.9599999999999996e-002 | AJ14: =H14+100*O14 -> 180.71000000000001 | AK14: 185.7 | AL14: 314 | AM14: 92 | AN14: 311 | AO14: -5.5999999999999994e-002 | AP14: 2 | AQ14: 特纸转债
A15: 14 | B15: 113634 | C15: 珀莱转债 | D15: 603605 | E15: 珀莱雅 | F15: 化工 | G15: 日化 | H15: 128.08 | I15: 1.6000000000000001e-003 | J15: -4.6999999999999993e-003 | K15: 169.05 | L15: -7.4000000000000003e-003 | M15: 120.1 | N15: 195.98 | O15: 0.48499999999999999 | P15: 86.26 | Q15: 4月6天 | R15: 5.83年 | S15: 3.83年 | T15: 7.52 | U15: 19 | V15: 2.e-002 | W15: 2.2000000000000002e-002 | X15: 1.9e-002 | Y15: 340 | Z15: 13 | AA15: -1.11e-002 | AB15: -1.6899999999999998e-002 | AC15: -4.8300000000000003e-002 | AD15: -5.0700000000000002e-002 | AE15: 90.12 | AF15: 96.02 | AG15: 0.42 | AH15: AA | AI15: 3.9599999999999996e-002 | AJ15: =H15+100*O15 -> 176.58000000000001 | AK15: 169.9 | AL15: 247 | AM15: 73.9 | AN15: 231 | AO15: -8.8000000000000009e-002 | AP15: 4 | AQ15: 珀莱转债
A16: 15 | B16: 123131 | C16: 奥飞转债 | D16: 300738 | E16: 奥飞数据 | F16: 通信互联 | G16: 通信设备 | H16: 144 | I16: 1.77e-002 | J16: -2.23e-002 | K16: 21.4 | L16: -6.9999999999999993e-003 | M16: 121.7 | N16: 22.02 | O16: 0.48200000000000004 | P16: 97.18 | Q16: 4月1天 | R16: 5.82年 | S16: 3.82年 | T16: 6.35 | U16: 27 | V16: 2.9999999999999999e-002 | W16: 7.8e-002 | X16: 7.5999999999999998e-002 | Y16: 82 | Z16: 5.8 | AA16: -2.8900000000000002e-002 | AB16: -3.5000000000000003e-002 | AC16: -7.2999999999999995e-002 | AD16: -7.5800000000000006e-002 | AE16: 81.26 | AF16: 82 | AG16: 0.67 | AH16: A+ | AI16: 7.1599999999999997e-002 | AJ16: =H16+100*O16 -> 192.19999999999999 | AK16: 190.8 | AL16: 327 | AM16: 108.8 | AN16: 338 | AO16: -8.8000000000000009e-002 | AP16: 2 | AQ16: 奥飞转债
A17: 16 | B17: 113633 | C17: 科沃转债! | D17: 603486 | E17: 科沃斯 | F17: 机械装备 | G17: 机器人及 | H17: 126.02 | I17: 1.2199999999999999e-002 | J17: 8.0000000000000004e-004 | K17: 135 | L17: 3.6900000000000002e-002 | M17: 115.1 | N17: 178.28 | O17: 0.66400000000000003 | P17: 75.72 | Q17: 3月28天 | R17: 5.81年 | S17: 3.81年 | T17: 10.4 | U17: 51 | V17: 3.9e-002 | W17: 1.3000000000000001e-002 | X17: 1.e-002 | Y17: 774 | Z17: 18.3 | AA17: -1.5700000000000002e-002 | AB17: -2.0099999999999996e-002 | AC17: -4.4699999999999997e-002 | AD17: -4.7e-002 | AE17: 90.2 | AF17: 92.12 | AG17: 0.35 | AH17: AA | AI17: 3.9599999999999996e-002 | AJ17: =H17+100*O17 -> 192.42000000000002 | AK17: 176.3 | AL17: 283 | AM17: 84.2 | AN17: 285 | AO17: -5.0999999999999997e-002 | AP17: 6 | AQ17: 科沃转债!
A18: 17 | B18: 118003 | C18: 华兴转债 | D18: 688001 | E18: 华兴源创 | F18: 机械装备 | G18: 专用设备 | H18: 126.59 | I18: 7.000000000000001e-004 | J18: -5.9999999999999995e-004 | K18: 33.32 | L18: 2.9999999999999997e-004 | M18: 115.1 | N18: 39.33 | O18: 0.49399999999999999 | P18: 84.72 | Q18: 3月25天 | R18: 5.81年 | S18: 3.81年 | T18: 8 | U18: 6 | V18: 6.0000000000000001e-003 | W18: 5.5e-002 | X18: 4.5999999999999999e-002 | Y18: 146 | Z18: 4.31 | AA18: -1.6399999999999998e-002 | AB18: -2.0899999999999998e-002 | AC18: -4.58e-002 | AD18: -4.8099999999999997e-002 | AE18: 90.21 | AF18: 92.13 | AG18: 0.44 | AH18: AA | AI18: 3.9599999999999996e-002 | AJ18: =H18+100*O18 -> 175.99000000000001 | AK18: 168.5 | AL18: 237 | AM18: 76.3 | AN18: 252 | AO18: -7.0999999999999994e-002 | AP18: 3 | AQ18: 华兴转债
A19: 18 | B19: 127051 | C19: 博杰转债 | D19: 2975 | E19: 博杰股份 | F19: 机械装备 | G19: 机器人及 | H19: 128.5 | I19: -2.3999999999999998e-003 | J19: -1.7000000000000001e-003 | K19: 54.88 | L19: -7.4000000000000003e-003 | M19: 121.1 | N19: 62.17 | O19: 0.45600000000000002 | P19: 88.27 | Q19: 3月14天 | R19: 5.77年 | S19: 4.77年 | T19: 5.26 | U19: 19 | V19: 2.7999999999999997e-002 | W19: 6.9000000000000006e-002 | X19: 6.0999999999999999e-002 | Y19: 77 | Z19: 5.17 | AA19: -1.04e-002 | AB19: -1.6399999999999998e-002 | AC19: -3.2599999999999997e-002 | AD19: -3.5900000000000001e-002 | AE19: 82.15 | AF19: 86.67 | AG19: 0.55 | AH19: AA- | AI19: 6.0599999999999994e-002 | AJ19: =H19+100*O19 -> 174.09999999999999 | AK19: 168.7 | AL19: 239 | AM19: 82.1 | AN19: 282 | AO19: -0.11199999999999999 | AP19: 2 | AQ19: 博杰转债
A20: 19 | B20: 113632 | C20: 鹤21转债 | D20: 603733 | E20: 仙鹤股份 | F20: 造纸包装 | G20: 造纸行业 | H20: 131.05 | I20: 1.38e-002 | J20: -9.1000000000000004e-003 | K20: 35.14 | L20: 9.7999999999999997e-003 | M20: 117.1 | N20: 39.09 | O20: 0.45799999999999996 | P20: 89.9 | Q20: 3月14天 | R20: 5.77年 | S20: 3.77年 | T20: 20.5 | U20: 13 | V20: 5.0000000000000001e-003 | W20: 8.3000000000000004e-002 | X20: 7.400000000000001e-002 | Y20: 248 | Z20: 4.11 | AA20: -1.95e-002 | AB20: -2.4500000000000001e-002 | AC20: -5.4600000000000003e-002 | AD20: -5.6900000000000006e-002 | AE20: 90.32 | AF20: 93.84 | AG20: 0.48 | AH20: AA | AI20: 3.9599999999999996e-002 | AJ20: =H20+100*O20 -> 176.85000000000002 | AK20: 172.2 | AL20: 259 | AM20: 78.4 | AN20: 262 | AO20: -8.199999999999999e-002 | AP20: 2 | AQ20: 鹤21转债
A21: 20 | B21: 127050 | C21: 麒麟转债 | D21: 2984 | E21: 森麒麟 | F21: 汽车 | G21: 零部件制 | H21: 138.9 | I21: 2.2200000000000001e-002 | J21: -1.1699999999999999e-002 | K21: 32.32 | L21: 2.0199999999999999e-002 | M21: 115.1 | N21: 34.85 | O21: 0.498 | P21: 92.74 | Q21: 3月8天 | R21: 5.76年 | S21: 3.76年 | T21: 22 | U21: 19 | V21: 6.0000000000000001e-003 | W21: 0.105 | X21: 9.6999999999999989e-002 | Y21: 210 | Z21: 3.44 | AA21: -3.2500000000000001e-002 | AB21: -3.6900000000000002e-002 | AC21: -6.8900000000000003e-002 | AD21: -7.1199999999999999e-002 | AE21: 90.38 | AF21: 92.31 | AG21: 0.52 | AH21: AA | AI21: 3.9599999999999996e-002 | AJ21: =H21+100*O21 -> 188.69999999999999 | AK21: 185.1 | AL21: 312 | AM21: 92.8 | AN21: 313 | AO21: 5.0000000000000001e-003 | AP21: 3 | AQ21: 麒麟转债
A22: 21 | B22: 110083 | C22: 苏租转债 | D22: 600901 | E22: 江苏租赁 | F22: 金融 | G22: 其他 | H22: 119.33 | I22: 2.8000000000000004e-003 | J22: -4.7999999999999996e-003 | K22: 4.93 | L22: -4.0000000000000001e-003 | M22: 110.5 | N22: 5.42 | O22: 0.312 | P22: 90.96 | Q22: 3月8天 | R22: 5.76年 | S22: 无权 | T22: 50 | U22: 14 | V22: 2.e-003 | W22: 0.34000000000000002 | X22: 0.309 | Y22: 147 | Z22: 1.07 | AA22: -1.34e-002 | AB22: -1.66e-002 | AC22: 无权 | AD22: 无权 | AE22: 无权 | AF22: 91.99 | AG22: 0.49 | AH22: AAA | AI22: 3.2599999999999997e-002 | AJ22: =H22+100*O22 -> 150.53 | AK22: 147.7 | AL22: 54 | AM22: 55.7 | AN22: 98 | AO22: -4.0000000000000001e-002 | AP22: 5 | AQ22: 苏租转债
A23: 22 | B23: 123130 | C23: 设研转债 | D23: 300732 | E23: 设研院 | F23: 建筑 | G23: 建筑工程 | H23: 146.357 | I23: 1.0500000000000001e-002 | J23: 9.1999999999999998e-003 | K23: 13.4 | L23: 2.76e-002 | M23: 117.1 | N23: 11.24 | O23: 0.22800000000000001 | P23: 119.22 | Q23: 3月8天 | R23: 5.76年 | S23: 3.76年 | T23: 3.76 | U23: 934 | V23: 1.6699999999999999 | W23: 0.10199999999999999 | X23: 0.122 | Y23: 37 | Z23: 1.46 | AA23: -3.8399999999999997e-002 | AB23: -4.3299999999999998e-002 | AC23: -8.14e-002 | AD23: -8.3599999999999994e-002 | AE23: 90.38 | AF23: 93.9 | AG23: 0.71 | AH23: AA | AI23: 3.9599999999999996e-002 | AJ23: =H23+100*O23 -> 169.15700000000001 | AK23: 173.5 | AL23: 268 | AM23: 79.6 | AN23: 268 | AO23: 5.7000000000000002e-002 | AP23: 3 | AQ23: 设研转债
A24: 23 | B24: 111001 | C24: 山玻转债 | D24: 605006 | E24: 山东玻纤 | F24: 其他 | G24: 非金属矿 | H24: 123.49 | I24: 1.2500000000000001e-002 | J24: -1.8e-003 | K24: 11.92 | L24: 1.9699999999999999e-002 | M24: 120.1 | N24: 13.91 | O24: 0.441 | P24: 85.69 | Q24: 3月3天 | R24: 5.75年 | S24: 3.75年 | T24: 6 | U24: 4 | V24: 5.0000000000000001e-003 | W24: 0.10099999999999999 | X24: 8.5999999999999993e-002 | Y24: 60 | Z24: 2.76 | AA24: -4.8999999999999998e-003 | AB24: -1.0800000000000001e-002 | AC24: -4.0300000000000002e-002 | AD24: -4.2699999999999995e-002 | AE24: 83.69 | AF24: 86 | AG24: 0.54 | AH24: AA- | AI24: 6.0599999999999994e-002 | AJ24: =H24+100*O24 -> 167.59 | AK24: 161.3 | AL24: 176 | AM24: 75.3 | AN24: 247 | AO24: -0.10199999999999999 | AP24: 3 | AQ24: 山玻转债
A25: 24 | B25: 113631 | C25: 皖天转债 | D25: 603689 | E25: 皖天然气 | F25: 石油天然 | G25: 天然气 | H25: 121.2 | I25: -2.5000000000000001e-003 | J25: 5.6999999999999993e-003 | K25: 9.71 | L25: 7.3000000000000001e-003 | M25: 114.5 | N25: 11.12 | O25: 0.38799999999999996 | P25: 87.32 | Q25: 3月3天 | R25: 5.75年 | S25: 3.75年 | T25: 9.3 | U25: 3.5 | V25: 3.0000000000000001e-003 | W25: 0.28499999999999998 | X25: 0.249 | Y25: 33 | Z25: 1.33 | AA25: -9.8999999999999991e-003 | AB25: -1.43e-002 | AC25: -3.6900000000000002e-002 | AD25: -3.9100000000000003e-002 | AE25: 91.63 | AF25: 94.34 | AG25: 0.44 | AH25: AA+ | AI25: 3.4599999999999999e-002 | AJ25: =H25+100*O25 -> 160. | AK25: 155.1 | AL25: 120 | AM25: 60.7 | AN25: 138 | AO25: -6.3e-002 | AP25: 3 | AQ25: 皖天转债
A26: 25 | B26: 123129 | C26: 锦鸡转债 | D26: 300798 | E26: 锦鸡股份 | F26: 化工 | G26: 其他 | H26: 120.949 | I26: 1.49e-002 | J26: 8.0000000000000004e-004 | K26: 8.76 | L26: 2.58e-002 | M26: 117.8 | N26: 9.53 | O26: 0.316 | P26: 91.92 | Q26: 3月1天 | R26: 5.74年 | S26: 3.74年 | T26: 6 | U26: 6.1 | V26: 9.0000000000000011e-003 | W26: 0.16399999999999998 | X26: 0.151 | Y26: 37 | Z26: 2.93 | AA26: -4.6999999999999993e-003 | AB26: -1.e-002 | AC26: -3.3500000000000002e-002 | AD26: -3.6200000000000003e-002 | AE26: 84.29 | AF26: 84.49 | AG26: 0.61 | AH26: AA- | AI26: 6.0599999999999994e-002 | AJ26: =H26+100*O26 -> 152.54900000000001 | AK26: 150 | AL26: 71 | AM26: 65.5 | AN26: 171 | AO26: -9.1999999999999998e-002 | AP26: 4 | AQ26: 锦鸡转债
A27: 26 | B27: 127049 | C27: 希望转2 | D27: 876 | E27: 新 希 望 | F27: 农业 | G27: 畜牧业 | H27: 143.6 | I27: 4.1999999999999997e-003 | J27: 2.4799999999999999e-002 | K27: 16.09 | L27: 4.2800000000000005e-002 | M27: 111.2 | N27: 14.45 | O27: 0.28999999999999998 | P27: 111.35 | Q27: 2月29天 | R27: 5.73年 | S27: 3.73年 | T27: 81.5 | U27: 130 | V27: 1.1000000000000001e-002 | W27: 0.11199999999999999 | X27: 0.125 | Y27: 725 | Z27: 2.37 | AA27: -4.4000000000000004e-002 | AB27: -4.7300000000000002e-002 | AC27: -7.9199999999999993e-002 | AD27: -8.1099999999999992e-002 | AE27: 92.09 | AF27: 92.69 | AG27: 0.68 | AH27: AAA | AI27: 3.2599999999999997e-002 | AJ27: =H27+100*O27 -> 172.59999999999999 | AK27: 175.9 | AL27: 280 | AM27: 83.2 | AN27: 284 | AO27: -3.2000000000000001e-002 | AP27: 9 | AQ27: 希望转2
A28: 27 | B28: 123128 | C28: 首华转债! | D28: 300483 | E28: 首华燃气 | F28: 石油天然 | G28: 天然气 | H28: 109 | I28: 5.9999999999999995e-004 | J28: 3.8e-003 | K28: 14.65 | L28: 2.7300000000000001e-002 | M28: 115.1 | N28: 25.02 | O28: 0.86199999999999999 | P28: 58.55 | Q28: 2月26天 | R28: 5.73年 | S28: 3.73年 | T28: 13.8 | U28: 54 | V28: 3.6000000000000004e-002 | W28: 0.35100000000000003 | X28: 0.20499999999999999 | Y28: 39 | Z28: 1.4 | AA28: 9.7000000000000003e-003 | AB28: 4.8999999999999998e-003 | AC28: -8.8000000000000005e-003 | AD28: -1.1399999999999999e-002 | AE28: 90.48 | AF28: 92.4 | AG28: 0.16 | AH28: AA | AI28: 3.9599999999999996e-002 | AJ28: =H28+100*O28 -> 195.19999999999999 | AK28: 159.4 | AL28: 157 | AM28: 67 | AN28: 180 | AO28: -8.5999999999999993e-002 | AP28: 11 | AQ28: 首华转债!
A29: 28 | B29: 123127 | C29: 耐普转债 | D29: 300818 | E29: 耐普矿机 | F29: 机械装备 | G29: 专用设备 | H29: 133 | I29: 6.4000000000000001e-002 | J29: -1.1599999999999999e-002 | K29: 40.8 | L29: 6.9699999999999998e-002 | M29: 116.2 | N29: 37 | O29: 0.20600000000000002 | P29: 110.27 | Q29: 2月25天 | R29: 5.72年 | S29: 3.72年 | T29: 4 | U29: 664 | V29: 1.26 | W29: 0.14000000000000001 | X29: 0.154 | Y29: 29 | Z29: 3.03 | AA29: -2.3700000000000002e-002 | AB29: -2.8500000000000001e-002 | AC29: -5.6399999999999999e-002 | AD29: -5.9200000000000003e-002 | AE29: 81.44 | AF29: 78.77 | AG29: 0.75 | AH29: A+ | AI29: 7.1599999999999997e-002 | AJ29: =H29+100*O29 -> 153.59999999999999 | AK29: 155.7 | AL29: 123 | AM29: 74.3 | AN29: 234 | AO29: -9.9000000000000005e-002 | AP29: 5 | AQ29: 耐普转债
A30: 29 | B30: 110082 | C30: 宏发转债 | D30: 600885 | E30: 宏发股份 | F30: 能源电力 | G30: 电力设备 | H30: 132.2 | I30: -2.7000000000000001e-003 | J30: 6.6e-003 | K30: 63.88 | L30: 8.5000000000000006e-003 | M30: 117.1 | N30: 72.28 | O30: 0.496 | P30: 88.38 | Q30: 2月24天 | R30: 5.72年 | S30: 3.72年 | T30: 20 | U30: 12 | V30: 5.0000000000000001e-003 | W30: 4.2000000000000003e-002 | X30: 3.7000000000000005e-002 | Y30: 476 | Z30: 7.83 | AA30: -2.12e-002 | AB30: -2.63e-002 | AC30: -5.7500000000000002e-002 | AD30: -5.9900000000000002e-002 | AE30: 90.51 | AF30: 94.04 | AG30: 0.46 | AH30: AA | AI30: 3.9599999999999996e-002 | AJ30: =H30+100*O30 -> 181.79999999999998 | AK30: 176 | AL30: 282 | AM30: 82 | AN30: 281 | AO30: -4.4000000000000004e-002 | AP30: 5 | AQ30: 宏发转债
A31: 30 | B31: 113630 | C31: 赛伍转债 | D31: 603212 | E31: 赛伍技术 | F31: 能源电力 | G31: 太阳能 | H31: 130.02 | I31: 8.0000000000000004e-004 | J31: 6.1999999999999998e-003 | K31: 25.89 | L31: 1.5300000000000001e-002 | M31: 120.5 | N31: 32.9 | O31: 0.65200000000000002 | P31: 78.69 | Q31: 2月23天 | R31: 5.72年 | S31: 3.72年 | T31: 7 | U31: 10 | V31: 1.1000000000000001e-002 | W31: 6.7000000000000004e-002 | X31: 5.2999999999999999e-002 | Y31: 105 | Z31: 5.2 | AA31: -1.34e-002 | AB31: -1.9400000000000001e-002 | AC31: -5.2499999999999998e-002 | AD31: -5.5099999999999996e-002 | AE31: 84.13 | AF31: 86.51 | AG31: 0.46 | AH31: AA- | AI31: 6.0599999999999994e-002 | AJ31: =H31+100*O31 -> 195.22000000000003 | AK31: 181.3 | AL31: 302 | AM31: 94.8 | AN31: 320 | AO31: -8.1000000000000003e-002 | AP31: 4 | AQ31: 赛伍转债
A32: 31 | B32: 127048 | C32: 中大转债 | D32: 2896 | E32: 中大力德 | F32: 机械装备 | G32: 通用设备 | H32: 130.001 | I32: 1.41e-002 | J32: 2.5999999999999999e-003 | K32: 21.33 | L32: 2.5499999999999998e-002 | M32: 121.7 | N32: 22.1 | O32: 0.34700000000000003 | P32: 96.52 | Q32: 2月22天 | R32: 5.71年 | S32: 3.71年 | T32: 2.7 | U32: 27 | V32: 7.5999999999999998e-002 | W32: 0.122 | X32: 0.11699999999999999 | Y32: 22 | Z32: 3.04 | AA32: -1.1699999999999999e-002 | AB32: -1.8000000000000002e-002 | AC32: -4.9699999999999994e-002 | AD32: -5.28e-002 | AE32: 81.94 | AF32: 82.58 | AG32: 0.65 | AH32: A+ | AI32: 7.1599999999999997e-002 | AJ32: =H32+100*O32 -> 164.70100000000002 | AK32: 163.5 | AL32: 202 | AM32: 80.9 | AN32: 276 | AO32: -7.2999999999999995e-002 | AP32: 3 | AQ32: 中大转债
A33: 32 | B33: 127047 | C33: 帝欧转债 | D33: 2798 | E33: 帝欧家居 | F33: 其他 | G33: 家居用品 | H33: 129.367 | I33: 1.9e-003 | J33: 1.0200000000000001e-002 | K33: 13.08 | L33: 1.95e-002 | M33: 120.4 | N33: 13.53 | O33: 0.33799999999999997 | P33: 96.67 | Q33: 2月20天 | R33: 5.71年 | S33: 3.71年 | T33: 15 | U33: 3.5 | V33: 2.e-003 | W33: 0.29600000000000004 | X33: 0.28699999999999998 | Y33: 51 | Z33: 1.11 | AA33: -1.26e-002 | AB33: -1.8600000000000002e-002 | AC33: -5.1500000000000004e-002 | AD33: -5.4100000000000002e-002 | AE33: 84.14 | AF33: 86.43 | AG33: 0.62 | AH33: AA- | AI33: 6.0599999999999994e-002 | AJ33: =H33+100*O33 -> 163.16699999999997 | AK33: 162.1 | AL33: 184 | AM33: 75.6 | AN33: 250 | AO33: -9.8000000000000004e-002 | AP33: 5 | AQ33: 帝欧转债
A34: 33 | B34: 127046 | C34: 百润转债! | D34: 2568 | E34: 百润股份 | F34: 食品饮料 | G34: 葡萄酒洋 | H34: 124.187 | I34: 2.3e-003 | J34: -6.3e-003 | K34: 43.4 | L34: -1.8500000000000003e-002 | M34: 115.1 | N34: 66.83 | O34: 0.91200000000000003 | P34: 64.94 | Q34: 2月3天 | R34: 5.64年 | S34: 3.64年 | T34: 11.3 | U34: 10 | V34: 6.9999999999999993e-003 | W34: 3.5000000000000003e-002 | X34: 2.2000000000000002e-002 | Y34: 326 | Z34: 9.27 | AA34: -1.3500000000000002e-002 | AB34: -1.8200000000000001e-002 | AC34: -4.2900000000000001e-002 | AD34: -4.5400000000000003e-002 | AE34: 90.79 | AF34: 92.73 | AG34: 0.22 | AH34: AA | AI34: 3.9599999999999996e-002 | AJ34: =H34+100*O34 -> 215.387 | AK34: 183.4 | AL34: 307 | AM34: 90.7 | AN34: 307 | AO34: -0.14199999999999999 | AP34: 5 | AQ34: 百润转债!
A35: 34 | B35: 113629 | C35: 泉峰转债 | D35: 603982 | E35: 泉峰汽车 | F35: 汽车 | G35: 零部件制 | H35: 167.02 | I35: -2.0099999999999996e-002 | J35: -1.03e-002 | K35: 32.88 | L35: -3.7200000000000004e-002 | M35: 121 | N35: 23.03 | O35: 0.17000000000000001 | P35: 142.77 | Q35: 42天 | R35: 5.60年 | S35: 3.60年 | T35: 6.2 | U35: 307 | V35: 0.29399999999999998 | W35: 9.4e-002 | X35: 0.13400000000000001 | Y35: 66 | Z35: 3.98 | AA35: -5.6600000000000004e-002 | AB35: -6.2400000000000004e-002 | AC35: -0.111 | AD35: -0.113 | AE35: 85.17 | AF35: 87.49 | AG35: 0.82 | AH35: AA- | AI35: 6.0599999999999994e-002 | AJ35: =H35+100*O35 -> 184.02000000000001 | AK35: 191.3 | AL35: 329 | AM35: 103.8 | AN35: 332 | AO35: -0.13300000000000001 | AP35: 6 | AQ35: 泉峰转债
A36: 35 | B36: 123126 | C36: 瑞丰转债! | D36: 300243 | E36: 瑞丰高材 | F36: 化工 | G36: 橡胶塑料 | H36: 117.3 | I36: 2.5999999999999999e-003 | J36: 1.1000000000000001e-003 | K36: 12.1 | L36: 1.e-002 | M36: 129.6 | N36: 17.8 | O36: 0.72599999999999998 | P36: 67.98 | Q36: 36天 | R36: 5.59年 | S36: 3.59年 | T36: 3.4 | U36: 1.1 | V36: 3.0000000000000001e-003 | W36: 0.121 | X36: 8.199999999999999e-002 | Y36: 28 | Z36: 3.46 | AA36: 1.8500000000000003e-002 | AB36: 9.7000000000000003e-003 | AC36: -1.72e-002 | AD36: -2.2000000000000002e-002 | AE36: 85.07 | AF36: 88.95 | AG36: 0.36 | AH36: A+ | AI36: 7.1599999999999997e-002 | AJ36: =H36+100*O36 -> 189.89999999999998 | AK36: 166.6 | AL36: 225 | AM36: 77.7 | AN36: 259 | AO36: -7.400000000000001e-002 | AP36: 9 | AQ36: 瑞丰转债!
A37: 36 | B37: 123125 | C37: 元力转债 | D37: 300174 | E37: 元力股份 | F37: 化工 | G37: 化工 | H37: 121.1 | I37: 9.300000000000001e-003 | J37: 1.7399999999999999e-002 | K37: 15.08 | L37: 4.58e-002 | M37: 109.3 | N37: 17.61 | O37: 0.41399999999999998 | P37: 85.63 | Q37: 30天 | R37: 5.58年 | S37: 3.58年 | T37: 9 | U37: 4.2 | V37: 4.0000000000000001e-003 | W37: 0.191 | X37: 0.16399999999999998 | Y37: 47 | Z37: 2.69 | AA37: -1.84e-002 | AB37: -2.1400000000000002e-002 | AC37: -3.8900000000000004e-002 | AD37: -4.0999999999999995e-002 | AE37: 83.99 | AF37: 78.98 | AG37: 0.58 | AH37: AA- | AI37: 6.0599999999999994e-002 | AJ37: =H37+100*O37 -> 162.5 | AK37: 156.6 | AL37: 130 | AM37: 72.6 | AN37: 221 | AO37: -6.2e-002 | AP37: 5 | AQ37: 元力转债
A38: 37 | B38: 113628 | C38: 晨丰转债 | D38: 603685 | E38: 晨丰科技 | F38: 能源电力 | G38: 电力设备 | H38: 120.76 | I38: 8.3999999999999995e-003 | J38: 4.6999999999999993e-003 | K38: 11.2 | L38: 2.1000000000000001e-002 | M38: 121.7 | N38: 13.06 | O38: 0.40799999999999997 | P38: 85.76 | Q38: 19天 | R38: 5.54年 | S38: 3.54年 | T38: 4.15 | U38: 9.8 | V38: 2.e-002 | W38: 0.21899999999999997 | X38: 0.188 | Y38: 19 | Z38: 1.68 | AA38: 1.4000000000000002e-003 | AB38: -5.1999999999999998e-003 | AC38: -3.2599999999999997e-002 | AD38: -3.6000000000000004e-002 | AE38: 80.08 | AF38: 79.48 | AG38: 0.62 | AH38: A | AI38: 8.1600000000000006e-002 | AJ38: =H38+100*O38 -> 161.56 | AK38: 155.8 | AL38: 125 | AM38: 75.7 | AN38: 251 | AO38: -8.6999999999999994e-002 | AP38: 10 | AQ38: 晨丰转债
A39: 38 | B39: 123124 | C39: 晶瑞转2! | D39: 300655 | E39: 晶瑞电材 | F39: 电子 | G39: 电子行业 | H39: 123.079 | I39: -2.2000000000000001e-003 | J39: 9.1999999999999998e-003 | K39: 33.42 | L39: 1.77e-002 | M39: 111.2 | N39: 50.31 | O39: 0.85299999999999998 | P39: 66.43 | Q39: 12天 | R39: 5.52年 | S39: 3.52年 | T39: 5.23 | U39: 6.2 | V39: 1.e-002 | W39: 4.4999999999999998e-002 | X39: 2.9999999999999999e-002 | Y39: 116 | Z39: 7.85 | AA39: -1.84e-002 | AB39: -2.2000000000000002e-002 | AC39: -4.3899999999999995e-002 | AD39: -4.6100000000000002e-002 | AE39: 80.98 | AF39: 76.19 | AG39: 0.39 | AH39: A+ | AI39: 7.1599999999999997e-002 | AJ39: =H39+100*O39 -> 208.37899999999999 | AK39: 179.7 | AL39: 297 | AM39: 98.8 | AN39: 324 | AO39: -0.11800000000000001 | AP39: 7 | AQ39: 晶瑞转2!
A40: 39 | B40: 127044 | C40: 蒙娜转债! | D40: 2918 | E40: 蒙娜丽莎 | F40: 建筑 | G40: 其他建材 | H40: 136.2 | I40: -4.6999999999999993e-003 | J40: 2.0999999999999999e-003 | K40: 24.2 | L40: -5.7999999999999996e-003 | M40: 117.1 | N40: 27.07 | O40: 0.52400000000000002 | P40: 89.4 | Q40: 13天 | R40: 5.52年 | S40: 3.52年 | T40: 11.7 | U40: 6 | V40: 4.0000000000000001e-003 | W40: 0.11599999999999999 | X40: 0.10400000000000001 | Y40: 100 | Z40: 2.7 | AA40: -2.7300000000000001e-002 | AB40: -3.2500000000000001e-002 | AC40: -6.83e-002 | AD40: -7.0699999999999999e-002 | AE40: 91.22 | AF40: 94.78 | AG40: 0.46 | AH40: AA | AI40: 3.9599999999999996e-002 | AJ40: =H40+100*O40 -> 188.59999999999999 | AK40: 183 | AL40: 306 | AM40: 88.2 | AN40: 302 | AO40: -6.5000000000000002e-002 | AP40: 3 | AQ40: 蒙娜转债!
A41: 40 | B41: 127045 | C41: 牧原转债 | D41: 2714 | E41: 牧原股份 | F41: 农业 | G41: 畜牧业 | H41: 145.5 | I41: 2.1099999999999997e-002 | J41: -1.8e-003 | K41: 54.59 | L41: 2.7699999999999999e-002 | M41: 111.1 | N41: 47.91 | O41: 0.27699999999999997 | P41: 113.94 | Q41: 13天 | R41: 5.52年 | S41: 3.52年 | T41: 95.5 | U41: 180 | V41: 1.3000000000000001e-002 | W41: 3.3000000000000002e-002 | X41: 3.7999999999999999e-002 | Y41: 2873. | Z41: 5.45 | AA41: -4.8099999999999997e-002 | AB41: -5.1500000000000004e-002 | AC41: -8.72e-002 | AD41: -8.9099999999999999e-002 | AE41: 91.97 | AF41: 92.26 | AG41: 0.7 | AH41: AA+ | AI41: 3.4599999999999999e-002 | AJ41: =H41+100*O41 -> 173.19999999999999 | AK41: 177.1 | AL41: 288 | AM41: 84.8 | AN41: 287 | AO41: -1.9e-002 | AP41: 10 | AQ41: 牧原转债
A42: 41 | B42: 118002 | C42: 天合转债 | D42: 688599 | E42: 天合光能 | F42: 能源电力 | G42: 太阳能 | H42: 160.13 | I42: -3.9599999999999996e-002 | J42: 1.8000000000000002e-002 | K42: 66.57 | L42: -2.8199999999999999e-002 | M42: 120.1 | N42: 50.51 | O42: 0.215 | P42: 131.8 | Q42: 13天 | R42: 5.51年 | S42: 3.51年 | T42: 52.5 | U42: 332 | V42: 3.9e-002 | W42: 3.7999999999999999e-002 | X42: 5.0000000000000003e-002 | Y42: 1380. | Z42: 8.58 | AA42: -5.1399999999999994e-002 | AB42: -5.7099999999999998e-002 | AC42: -0.106 | AD42: -0.10800000000000001 | AE42: 91.25 | AF42: 97.23 | AG42: 0.77 | AH42: AA | AI42: 3.9599999999999996e-002 | AJ42: =H42+100*O42 -> 181.63 | AK42: 188.5 | AL42: 321 | AM42: 91.2 | AN42: 309 | AO42: -2.2000000000000002e-002 | AP42: 8 | AQ42: 天合转债
A43: 42 | B43: 127043 | C43: 川恒转债 | D43: 2895 | E43: 川恒股份 | F43: 化工 | G43: 农化 | H43: 145.7 | I43: -2.0999999999999999e-003 | J43: -5.4000000000000003e-003 | K43: 22.05 | L43: -1.1200000000000002e-002 | M43: 121 | N43: 21.02 | O43: 0.38900000000000001 | P43: 104.9 | Q43: 10天 | R43: 5.51年 | S43: 3.51年 | T43: 11.6 | U43: 49 | V43: 2.8999999999999998e-002 | W43: 0.10800000000000001 | X43: 0.113 | Y43: 108 | Z43: 3.4 | AA43: -3.3599999999999998e-002 | AB43: -3.9699999999999999e-002 | AC43: -8.3400000000000002e-002 | AD43: -8.6099999999999996e-002 | AE43: 85.62 | AF43: 87.96 | AG43: 0.66 | AH43: AA- | AI43: 6.0599999999999994e-002 | AJ43: =H43+100*O43 -> 184.59999999999999 | AK43: 186.5 | AL43: 317 | AM43: 98.5 | AN43: 323 | AO43: -7.9000000000000001e-002 | AP43: 8 | AQ43: 川恒转债
A44: 43 | B44: 123123 | C44: 江丰转债! | D44: 300666 | E44: 江丰电子 | F44: 电子 | G44: 电子行业 | H44: 133.9 | I44: 1.72e-002 | J44: 3.9000000000000003e-003 | K44: 51.59 | L44: 3.1800000000000002e-002 | M44: 121.5 | N44: 51.93 | O44: 0.34799999999999998 | P44: 99.35 | Q44: 10天 | R44: 5.51年 | S44: 3.51年 | T44: 5.17 | U44: 29 | V44: 4.2000000000000003e-002 | W44: 4.4000000000000004e-002 | X44: 4.4000000000000004e-002 | Y44: 117 | Z44: 9.4 | AA44: -1.78e-002 | AB44: -2.4199999999999999e-002 | AC44: -6.0599999999999994e-002 | AD44: -6.3700000000000007e-002 | AE44: 82.92 | AF44: 83.58 | AG44: 0.66 | AH44: A+ | AI44: 7.1599999999999997e-002 | AJ44: =H44+100*O44 -> 168.69999999999999 | AK44: 168.5 | AL44: 236 | AM44: 84.9 | AN44: 288 | AO44: -2.5000000000000001e-002 | AP44: 7 | AQ44: 江丰转债!
A45: 44 | B45: 127042 | C45: 嘉美转债 | D45: 2969 | E45: 嘉美包装 | F45: 造纸包装 | G45: 包装材料 | H45: 127.2 | I45: 1.7600000000000001e-002 | J45: 2.87e-002 | K45: 5.53 | L45: 6.9599999999999995e-002 | M45: 117.1 | N45: 4.87 | O45: 0.12 | P45: 113.55 | Q45: 6.9天 | R45: 5.50年 | S45: 3.50年 | T45: 7.5 | U45: 156 | V45: 0.16200000000000001 | W45: 0.14099999999999999 | X45: 0.16 | Y45: 53 | Z45: 2.43 | AA45: -1.5100000000000001e-002 | AB45: -2.0400000000000001e-002 | AC45: -5.0799999999999998e-002 | AD45: -5.3399999999999996e-002 | AE45: 91.29 | AF45: 94.85 | AG45: 0.67 | AH45: AA | AI45: 3.9599999999999996e-002 | AJ45: =H45+100*O45 -> 139.19999999999999 | AK45: 140.8 | AL45: 17 | AM45: 46 | AN45: 37 | AO45: -9.0000000000000011e-003 | AP45: 14 | AQ45: 嘉美转债
A46: 45 | B46: 123122 | C46: 富瀚转债! | D46: 300613 | E46: 富瀚微 | F46: 电子 | G46: 芯片制造 | H46: 125.989 | I46: 7.000000000000001e-004 | J46: -6.1999999999999998e-003 | K46: 119.6 | L46: -1.3999999999999999e-002 | M46: 120.3 | N46: 177.01 | O46: 0.86499999999999999 | P46: 67.57 | Q46: 4.9天 | R46: 5.49年 | S46: 3.49年 | T46: 5.81 | U46: 14 | V46: 1.9e-002 | W46: 4.0000000000000001e-002 | X46: 2.7000000000000003e-002 | Y46: 144 | Z46: 8.78 | AA46: -8.5000000000000006e-003 | AB46: -1.47e-002 | AC46: -4.7899999999999998e-002 | AD46: -5.0499999999999996e-002 | AE46: 82.04 | AF46: 82.72 | AG46: 0.39 | AH46: A+ | AI46: 7.1599999999999997e-002 | AJ46: =H46+100*O46 -> 212.489 | AK46: 184.4 | AL46: 309 | AM46: 101.7 | AN46: 331 | AO46: -0.154 | AP46: 6 | AQ46: 富瀚转债!
A47: 46 | B47: 123121 | C47: 帝尔转债! | D47: 300776 | E47: 帝尔激光 | F47: 机械装备 | G47: 专用设备 | H47: 157.402 | I47: 9.0000000000000011e-003 | J47: -3.0000000000000001e-003 | K47: 240.88 | L47: 7.8000000000000005e-003 | M47: 121 | N47: 192.24 | O47: 0.25600000000000001 | P47: 125.3 | Q47: 3.9天 | R47: 5.49年 | S47: 3.49年 | T47: 8.4 | U47: 140 | V47: 0.106 | W47: 3.3000000000000002e-002 | X47: 4.0999999999999995e-002 | Y47: 256 | Z47: 12.65 | AA47: -4.7400000000000005e-002 | AB47: -5.3399999999999996e-002 | AC47: -0.10000000000000001 | AD47: -0.10300000000000001 | AE47: 85.72 | AF47: 88.06 | AG47: 0.76 | AH47: AA- | AI47: 6.0599999999999994e-002 | AJ47: =H47+100*O47 -> 183.00199999999998 | AK47: 189.5 | AL47: 322 | AM47: 101.4 | AN47: 330 | AO47: 4.0999999999999995e-002 | AP47: 6 | AQ47: 帝尔转债!
A48: 47 | B48: 123120 | C48: 隆华转债 | D48: 300263 | E48: 隆华科技 | F48: 机械装备 | G48: 通用设备 | H48: 145.5 | I48: -2.6800000000000001e-002 | J48: 2.6000000000000002e-002 | K48: 9.07 | L48: -1.1000000000000001e-003 | M48: 121.1 | N48: 7.76 | O48: 0.245 | P48: 116.88 | Q48: 已到 | R48: 5.47年 | S48: 3.47年 | T48: 7.99 | U48: 31 | V48: 2.6000000000000002e-002 | W48: 9.6000000000000002e-002 | X48: 0.113 | Y48: 83 | Z48: 2.88 | AA48: -3.3399999999999999e-002 | AB48: -3.9599999999999996e-002 | AC48: -8.3699999999999997e-002 | AD48: -8.6500000000000007e-002 | AE48: 85.89 | AF48: 88.24 | AG48: 0.72 | AH48: AA- | AI48: 6.0599999999999994e-002 | AJ48: =H48+100*O48 -> 170. | AK48: 174.1 | AL48: 272 | AM48: 85.9 | AN48: 294 | AO48: -5.4000000000000006e-002 | AP48: 4 | AQ48: 隆华转债
A49: 48 | B49: 110081 | C49: 闻泰转债 | D49: 600745 | E49: 闻泰科技 | F49: 电子 | G49: 电子行业 | H49: 144.64 | I49: -9.7000000000000003e-003 | J49: -9.4999999999999998e-003 | K49: 107 | L49: -2.8300000000000002e-002 | M49: 111.9 | N49: 96.69 | O49: 0.307 | P49: 110.66 | Q49: 已到 | R49: 5.47年 | S49: 3.47年 | T49: 86 | U49: 302 | V49: 2.4e-002 | W49: 6.4000000000000001e-002 | X49: 7.0999999999999994e-002 | Y49: 1333. | Z49: 4.24 | AA49: -4.6100000000000002e-002 | AB49: -4.9800000000000004e-002 | AC49: -8.6999999999999994e-002 | AD49: -8.8900000000000007e-002 | AE49: 92.04 | AF49: 93.03 | AG49: 0.67 | AH49: AA+ | AI49: 3.4599999999999999e-002 | AJ49: =H49+100*O49 -> 175.33999999999997 | AK49: 178.6 | AL49: 294 | AM49: 85.6 | AN49: 292 | AO49: -0.107 | AP49: 10 | AQ49: 闻泰转债
A50: 49 | B50: 118001 | C50: 金博转债 | D50: 688598 | E50: 金博股份 | F50: 能源电力 | G50: 太阳能 | H50: 146.47 | I50: 1.3999999999999999e-002 | J50: -1.7299999999999999e-002 | K50: 276.61 | L50: -4.8999999999999998e-003 | M50: 121.6 | N50: 271.12 | O50: 0.436 | P50: 102.02 | Q50: 已到 | R50: 5.45年 | S50: 3.45年 | T50: 6 | U50: 28 | V50: 3.2000000000000001e-002 | W50: 2.7000000000000003e-002 | X50: 2.7999999999999997e-002 | Y50: 222 | Z50: 13.47 | AA50: -3.4099999999999998e-002 | AB50: -4.0399999999999998e-002 | AC50: -8.48e-002 | AD50: -8.7799999999999989e-002 | AE50: 83.24 | AF50: 84.02 | AG50: 0.68 | AH50: A+ | AI50: 7.1599999999999997e-002 | AJ50: =H50+100*O50 -> 190.06999999999999 | AK50: 190.9 | AL50: 328 | AM50: 106.9 | AN50: 337 | AO50: -6.2e-002 | AP50: 4 | AQ50: 金博转债
A51: 50 | B51: 113627 | C51: 太平转债! | D51: 603877 | E51: 太平鸟 | F51: 服装纺织 | G51: 服装行业 | H51: 113.72 | I51: -7.000000000000001e-004 | J51: 1.7000000000000001e-003 | K51: 23.74 | L51: 1.89e-002 | M51: 115.1 | N51: 50.32 | O51: 1.4099999999999999 | P51: 47.18 | Q51: 已到 | R51: 5.43年 | S51: 3.43年 | T51: 8 | U51: 27 | V51: 2.8999999999999998e-002 | W51: 7.0999999999999994e-002 | X51: 3.3000000000000002e-002 | Y51: 113 | Z51: 2.78 | AA51: 2.3e-003 | AB51: -2.7000000000000001e-003 | AC51: -2.1299999999999999e-002 | AD51: -2.41e-002 | AE51: 91.53 | AF51: 93.48 | AG51: 0.05 | AH51: AA | AI51: 3.9599999999999996e-002 | AJ51: =H51+100*O51 -> 254.72 | AK51: 180.3 | AL51: 299 | AM51: 86.8 | AN51: 296 | AO51: -0.11699999999999999 | AP51: 3 | AQ51: 太平转债!
A52: 51 | B52: 123119 | C52: 康泰转2! | D52: 300601 | E52: 康泰生物 | F52: 医药 | G52: 生物制药 | H52: 124.2 | I52: -7.9000000000000008e-003 | J52: 6.7000000000000002e-003 | K52: 80.08 | L52: -4.0000000000000001e-003 | M52: 117.1 | N52: 108.5 | O52: 0.68299999999999994 | P52: 73.81 | Q52: 已到 | R52: 5.43年 | S52: 3.43年 | T52: 20 | U52: 5.1 | V52: 2.e-003 | W52: 3.6000000000000004e-002 | X52: 2.7000000000000003e-002 | Y52: 550 | Z52: 6.46 | AA52: -1.09e-002 | AB52: -1.6299999999999999e-002 | AC52: -4.5400000000000003e-002 | AD52: -4.8000000000000001e-002 | AE52: 91.53 | AF52: 95.1 | AG52: 0.3 | AH52: AA | AI52: 3.9599999999999996e-002 | AJ52: =H52+100*O52 -> 192.5 | AK52: 174.6 | AL52: 275 | AM52: 79.5 | AN52: 266 | AO52: -0.10199999999999999 | AP52: 10 | AQ52: 康泰转2!
A53: 52 | B53: 127041 | C53: 弘亚转债! | D53: 2833 | E53: 弘亚数控 | F53: 机械装备 | G53: 专用设备 | H53: 119.53 | I53: -5.9999999999999995e-004 | J53: -2.5999999999999999e-003 | K53: 26.25 | L53: -1.2e-002 | M53: 118.75 | N53: 38.09 | O53: 0.7340000000000001 | P53: 68.92 | Q53: 已到 | R53: 4.42年 | S53: 2.42年 | T53: 6 | U53: 1.7 | V53: 2.e-003 | W53: 7.4999999999999997e-002 | X53: 5.2000000000000005e-002 | Y53: 80 | Z53: 3.98 | AA53: -1.5e-003 | AB53: -8.6999999999999994e-003 | AC53: -5.3099999999999994e-002 | AD53: -5.5800000000000002e-002 | AE53: 89.57 | AF53: 92.83 | AG53: 0.26 | AH53: AA- | AI53: 5.7800000000000004e-002 | AJ53: =H53+100*O53 -> 192.93000000000001 | AK53: 170.1 | AL53: 248 | AM53: 77.3 | AN53: 257 | AO53: -0.13500000000000001 | AP53: 6 | AQ53: 弘亚转债!
A54: 53 | B54: 123118 | C54: 惠城转债 | D54: 300779 | E54: 惠城环保 | F54: 化工 | G54: 其他 | H54: 124.99 | I54: 1.1200000000000002e-002 | J54: 3.0999999999999999e-003 | K54: 15.53 | L54: 2.3700000000000002e-002 | M54: 121.7 | N54: 17.11 | O54: 0.377 | P54: 90.77 | Q54: 已到 | R54: 5.41年 | S54: 3.41年 | T54: 3.2 | U54: 8.4 | V54: 2.1000000000000001e-002 | W54: 0.20600000000000002 | X54: 0.187 | Y54: 16 | Z54: 2.33 | AA54: -5.0000000000000001e-003 | AB54: -1.1699999999999999e-002 | AC54: -4.3299999999999998e-002 | AD54: -4.6699999999999998e-002 | AE54: 83.58 | AF54: 84.34 | AG54: 0.61 | AH54: A+ | AI54: 7.1599999999999997e-002 | AJ54: =H54+100*O54 -> 162.69 | AK54: 159.2 | AL54: 153 | AM54: 74.9 | AN54: 242 | AO54: -8.3000000000000004e-002 | AP54: 10 | AQ54: 惠城转债
A55: 54 | B55: 127040 | C55: 国泰转债 | D55: 2091 | E55: 江苏国泰 | F55: 商业零售 | G55: 商业零售 | H55: 133.25 | I55: 5.7999999999999996e-003 | J55: -9.1999999999999998e-003 | K55: 11.32 | L55: -4.4000000000000003e-003 | M55: 112.5 | N55: 9.02 | O55: 6.2e-002 | P55: 125.5 | Q55: 已到 | R55: 5.41年 | S55: 3.41年 | T55: 44.8 | U55: 196 | V55: 3.3000000000000002e-002 | W55: 0.253 | X55: 0.318 | Y55: 177 | Z55: 1.85 | AA55: -3.1099999999999999e-002 | AB55: -3.5000000000000003e-002 | AC55: -6.5799999999999997e-002 | AD55: -6.8000000000000005e-002 | AE55: 92.7 | AF55: 93.77 | AG55: 0.77 | AH55: AA+ | AI55: 3.4599999999999999e-002 | AJ55: =H55+100*O55 -> 139.44999999999999 | AK55: 141 | AL55: 19 | AM55: 47.2 | AN55: 45 | AO55: -0.11699999999999999 | AP55: 12 | AQ55: 国泰转债
A56: 55 | B56: 127039 | C56: 北港转债 | D56: 582 | E56: 北部湾港 | F56: 机场高速 | G56: 港口 | H56: 122.6 | I56: -3.3e-003 | J56: 2.1600000000000001e-002 | K56: 7.79 | L56: 3.73e-002 | M56: 113 | N56: 8.35 | O56: 0.314 | P56: 93.29 | Q56: 已到 | R56: 5.39年 | S56: 3.39年 | T56: 30 | U56: 9.9 | V56: 3.0000000000000001e-003 | W56: 0.23600000000000002 | X56: 0.22 | Y56: 127 | Z56: 1.19 | AA56: -1.52e-002 | AB56: -1.9400000000000001e-002 | AC56: -4.2599999999999999e-002 | AD56: -4.5199999999999997e-002 | AE56: 93.88 | AF56: 95.28 | AG56: 0.49 | AH56: AAA | AI56: 3.2599999999999997e-002 | AJ56: =H56+100*O56 -> 154. | AK56: 151.9 | AL56: 85 | AM56: 56.6 | AN56: 104 | AO56: -2.2000000000000002e-002 | AP56: 7 | AQ56: 北港转债
A57: 56 | B57: 113626 | C57: 伯特转债! | D57: 603596 | E57: 伯特利 | F57: 汽车 | G57: 零部件制 | H57: 241.53 | I57: 6.1999999999999998e-003 | J57: -1.29e-002 | K57: 77.05 | L57: -6.9999999999999993e-003 | M57: 121.1 | N57: 36.01 | O57: 0.129 | P57: 213.97 | Q57: 已到 | R57: 5.39年 | S57: 3.39年 | T57: 9.02 | U57: 358 | V57: 0.16500000000000001 | W57: 2.8999999999999998e-002 | X57: 6.0999999999999999e-002 | Y57: 315 | Z57: 9.95 | AA57: -0.121 | AB57: -0.127 | AC57: -0.114 | AD57: -0.115 | AE57: 91.69 | AF57: 98.5 | AG57: 0.96 | AH57: AA | AI57: 3.9599999999999996e-002 | AJ57: =H57+100*O57 -> 254.43000000000001 | AK57: 269.1 | AL57: 364 | AM57: 170.6 | AN57: 363 | AO57: 3.5000000000000003e-002 | AP57: 4 | AQ57: 伯特转债!
A58: 57 | B58: 123117 | C58: 健帆转债! | D58: 300529 | E58: 健帆生物 | F58: 医药 | G58: 医疗器械 | H58: 117 | I58: 5.3e-003 | J58: -5.8999999999999999e-003 | K58: 47.2 | L58: -7.6e-003 | M58: 115.1 | N58: 90.57 | O58: 1.25 | P58: 52.11 | Q58: 已到 | R58: 5.37年 | S58: 3.37年 | T58: 10 | U58: 9.7 | V58: 8.0000000000000002e-003 | W58: 2.6000000000000002e-002 | X58: 1.3999999999999999e-002 | Y58: 380 | Z58: 12.46 | AA58: -3.0999999999999999e-003 | AB58: -8.0000000000000002e-003 | AC58: -2.9700000000000001e-002 | AD58: -3.2400000000000005e-002 | AE58: 91.75 | AF58: 93.7 | AG58: 0.08 | AH58: AA | AI58: 3.9599999999999996e-002 | AJ58: =H58+100*O58 -> 242. | AK58: 181.9 | AL58: 303 | AM58: 88.2 | AN58: 301 | AO58: -9.6999999999999989e-002 | AP58: 8 | AQ58: 健帆转债!
A59: 58 | B59: 113051 | C59: 节能转债! | D59: 601016 | E59: 节能风电 | F59: 能源电力 | G59: 风能 | H59: 157.17 | I59: 1.47e-002 | J59: -1.32e-002 | K59: 5.16 | L59: 1.9e-003 | M59: 114.5 | N59: 4.05 | O59: 0.23399999999999999 | P59: 127.41 | Q59: 已到 | R59: 5.37年 | S59: 3.37年 | T59: 30 | U59: 208 | V59: 4.4000000000000004e-002 | W59: 0.11599999999999999 | X59: 0.14800000000000002 | Y59: 259 | Z59: 2.51 | AA59: -5.7800000000000004e-002 | AB59: -6.2199999999999998e-002 | AC59: -0.107 | AD59: -0.109 | AE59: 92.84 | AF59: 95.58 | AG59: 0.77 | AH59: AA+ | AI59: 3.4599999999999999e-002 | AJ59: =H59+100*O59 -> 180.56999999999999 | AK59: 186.9 | AL59: 318 | AM59: 91.4 | AN59: 310 | AO59: -8.0000000000000002e-002 | AP59: 9 | AQ59: 节能转债!
A60: 59 | B60: 113050 | C60: 南银转债 | D60: 601009 | E60: 南京银行 | F60: 金融 | G60: 银行行业 | H60: 121.28 | I60: -3.3e-003 | J60: -6.0000000000000001e-003 | K60: 9.82 | L60: -1.7000000000000001e-002 | M60: 111.2 | N60: 10.1 | O60: 0.247 | P60: 97.23 | Q60: 已到 | R60: 5.35年 | S60: 无权 | T60: 200 | U60: 64 | V60: 3.0000000000000001e-003 | W60: 0.20399999999999999 | X60: 0.19800000000000001 | Y60: 983 | Z60: 0.93 | AA60: -1.6200000000000003e-002 | AB60: -2.e-002 | AC60: 无权 | AD60: 无权 | AE60: 无权 | AF60: 93.83 | AG60: 0.55 | AH60: AAA | AI60: 3.2599999999999997e-002 | AJ60: =H60+100*O60 -> 145.97999999999999 | AK60: 145.3 | AL60: 41 | AM60: 51.5 | AN60: 64 | AO60: 2.e-002 | AP60: 7 | AQ60: 南银转债
A61: 60 | B61: 113625 | C61: 江山转债! | D61: 603208 | E61: 江山欧派 | F61: 其他 | G61: 家居用品 | H61: 121.74 | I61: 9.7000000000000003e-003 | J61: 9.7000000000000003e-003 | K61: 79.78 | L61: 4.2199999999999994e-002 | M61: 124 | N61: 96.33 | O61: 0.46999999999999997 | P61: 82.82 | Q61: 已到 | R61: 5.34年 | S61: 3.34年 | T61: 5.83 | U61: 41 | V61: 5.7999999999999996e-002 | W61: 7.0000000000000007e-002 | X61: 5.7999999999999996e-002 | Y61: 84 | Z61: 4.56 | AA61: 3.4999999999999996e-003 | AB61: -4.0000000000000001e-003 | AC61: -3.85e-002 | AD61: -4.1700000000000001e-002 | AE61: 86.48 | AF61: 91.03 | AG61: 0.46 | AH61: AA- | AI61: 6.0599999999999994e-002 | AJ61: =H61+100*O61 -> 168.74000000000001 | AK61: 160.7 | AL61: 168 | AM61: 69.6 | AN61: 204 | AO61: 6.4000000000000001e-002 | AP61: 7 | AQ61: 江山转债!
A62: 61 | B62: 127038 | C62: 国微转债! | D62: 2049 | E62: 紫光国微 | F62: 电子 | G62: 芯片制造 | H62: 195 | I62: -1.2199999999999999e-002 | J62: 7.1999999999999998e-003 | K62: 214.5 | L62: -5.6000000000000008e-003 | M62: 114.5 | N62: 137.78 | O62: 0.253 | P62: 155.68 | Q62: 已到 | R62: 5.34年 | S62: 3.34年 | T62: 14.9 | U62: 92 | V62: 3.1e-002 | W62: 1.1000000000000001e-002 | X62: 1.8000000000000002e-002 | Y62: 1302. | Z62: 19.81 | AA62: -9.5700000000000007e-002 | AB62: -9.98e-002 | AC62: -0.157 | AD62: -0.159 | AE62: 92.93 | AF62: 95.68 | AG62: 0.88 | AH62: AA+ | AI62: 3.4599999999999999e-002 | AJ62: =H62+100*O62 -> 220.30000000000001 | AK62: 234.3 | AL62: 352 | AM62: 138.6 | AN62: 354 | AO62: -1.3999999999999999e-002 | AP62: 6 | AQ62: 国微转债!
A63: 62 | B63: 113049 | C63: 长汽转债 | D63: 601633 | E63: 长城汽车 | F63: 汽车 | G63: 乘用车 | H63: 139.02 | I63: -7.3000000000000001e-003 | J63: -2.0000000000000001e-004 | K63: 39.96 | L63: -1.21e-002 | M63: 110.5 | N63: 38.01 | O63: 0.32200000000000001 | P63: 105.13 | Q63: 已到 | R63: 5.34年 | S63: 3.34年 | T63: 35 | U63: 285 | V63: 5.9000000000000004e-002 | W63: 9.0000000000000011e-003 | X63: 1.e-002 | Y63: 3691. | Z63: 6.29 | AA63: -4.24e-002 | AB63: -4.58e-002 | AC63: -8.1000000000000003e-002 | AD63: -8.2699999999999996e-002 | AE63: 92.6 | AF63: 93.24 | AG63: 0.62 | AH63: AAA | AI63: 3.2599999999999997e-002 | AJ63: =H63+100*O63 -> 171.22000000000003 | AK63: 172.9 | AL63: 266 | AM63: 79.7 | AN63: 270 | AO63: -0.106 | AP63: 5 | AQ63: 长汽转债
A64: 63 | B64: 123116 | C64: 万兴转债 | D64: 300624 | E64: 万兴科技 | F64: 计算机及 | G64: 软件开发 | H64: 126.264 | I64: -5.6999999999999993e-003 | J64: -1.1999999999999999e-003 | K64: 41.35 | L64: -1.2699999999999999e-002 | M64: 121.4 | N64: 49.78 | O64: 0.52000000000000002 | P64: 83.07 | Q64: 已到 | R64: 5.33年 | S64: 3.33年 | T64: 3.78 | U64: 27 | V64: 5.5999999999999994e-002 | W64: 7.0000000000000007e-002 | X64: 5.7999999999999996e-002 | Y64: 54 | Z64: 6.46 | AA64: -7.4999999999999997e-003 | AB64: -1.4199999999999999e-002 | AC64: -4.7699999999999992e-002 | AD64: -5.0999999999999997e-002 | AE64: 83.85 | AF64: 84.53 | AG64: 0.54 | AH64: A+ | AI64: 7.1599999999999997e-002 | AJ64: =H64+100*O64 -> 178.26400000000001 | AK64: 169.5 | AL64: 244 | AM64: 84.9 | AN64: 289 | AO64: -0.19500000000000001 | AP64: 8 | AQ64: 万兴转债
A65: 64 | B65: 123115 | C65: 捷捷转债 | D65: 300623 | E65: 捷捷微电 | F65: 电子 | G65: 元器件制 | H65: 133.605 | I65: 8.0000000000000004e-004 | J65: 7.4000000000000003e-003 | K65: 26.82 | L65: 1.3999999999999999e-002 | M65: 118.5 | N65: 29 | O65: 0.44500000000000001 | P65: 92.48 | Q65: 已到 | R65: 5.33年 | S65: 3.33年 | T65: 11.9 | U65: 11 | V65: 6.9999999999999993e-003 | W65: 5.9999999999999998e-002 | X65: 5.5999999999999994e-002 | Y65: 198 | Z65: 6.95 | AA65: -2.2599999999999999e-002 | AB65: -2.8300000000000002e-002 | AC65: -6.5700000000000008e-002 | AD65: -6.8400000000000002e-002 | AE65: 86.06 | AF65: 87.04 | AG65: 0.58 | AH65: AA- | AI65: 6.0599999999999994e-002 | AJ65: =H65+100*O65 -> 178.10499999999999 | AK65: 174.7 | AL65: 276 | AM65: 87.7 | AN65: 298 | AO65: -7.2000000000000008e-002 | AP65: 8 | AQ65: 捷捷转债
A66: 65 | B66: 127037 | C66: 银轮转债 | D66: 2126 | E66: 银轮股份 | F66: 汽车 | G66: 零部件制 | H66: 138.702 | I66: -8.199999999999999e-003 | J66: -3.4999999999999996e-003 | K66: 10.44 | L66: -2.1600000000000001e-002 | M66: 115.1 | N66: 10.77 | O66: 0.43099999999999999 | P66: 96.94 | Q66: 已到 | R66: 5.33年 | S66: 3.33年 | T66: 7 | U66: 3 | V66: 3.0000000000000001e-003 | W66: 8.5000000000000006e-002 | X66: 8.199999999999999e-002 | Y66: 83 | Z66: 1.96 | AA66: -3.4799999999999998e-002 | AB66: -3.9599999999999996e-002 | AC66: -7.6799999999999993e-002 | AD66: -7.9299999999999995e-002 | AE66: 91.9 | AF66: 93.86 | AG66: 0.54 | AH66: AA | AI66: 3.9599999999999996e-002 | AJ66: =H66+100*O66 -> 181.80199999999999 | AK66: 180.5 | AL66: 300 | AM66: 86.6 | AN66: 295 | AO66: -0.14199999999999999 | AP66: 3 | AQ66: 银轮转债
A67: 66 | B67: 127036 | C67: 三花转债 | D67: 2050 | E67: 三花智控 | F67: 机械装备 | G67: 通用设备 | H67: 128.75 | I67: 4.0000000000000002e-004 | J67: 3.0999999999999999e-003 | K67: 19.11 | L67: 7.9000000000000008e-003 | M67: 114.5 | N67: 21.55 | O67: 0.45200000000000001 | P67: 88.68 | Q67: 已到 | R67: 5.31年 | S67: 3.31年 | T67: 30 | U67: 48 | V67: 1.2e-002 | W67: 4.4000000000000004e-002 | X67: 3.9e-002 | Y67: 686 | Z67: 6.64 | AA67: -2.2000000000000002e-002 | AB67: -2.6699999999999998e-002 | AC67: -5.8299999999999998e-002 | AD67: -6.0599999999999994e-002 | AE67: 93.01 | AF67: 95.76 | AG67: 0.44 | AH67: AA+ | AI67: 3.4599999999999999e-002 | AJ67: =H67+100*O67 -> 173.94999999999999 | AK67: 168.8 | AL67: 241 | AM67: 73.1 | AN67: 225 | AO67: -0.188 | AP67: 7 | AQ67: 三花转债
A68: 67 | B68: 127035 | C68: 濮耐转债 | D68: 2225 | E68: 濮耐股份 | F68: 钢铁 | G68: 钢铁行业 | H68: 123.78 | I68: 3.9000000000000003e-003 | J68: 2.8999999999999998e-003 | K68: 4.15 | L68: 1.47e-002 | M68: 114.7 | N68: 4.43 | O68: 0.32100000000000001 | P68: 93.68 | Q68: 已到 | R68: 4.29年 | S68: 2.29年 | T68: 6.26 | U68: 1.4 | V68: 2.e-003 | W68: 0.14899999999999999 | X68: 0.14000000000000001 | Y68: 42 | Z68: 1.37 | AA68: -1.78e-002 | AB68: -2.3799999999999998e-002 | AC68: -6.0899999999999996e-002 | AD68: -6.5299999999999997e-002 | AE68: 96.83 | AF68: 98.46 | AG68: 0.47 | AH68: AA | AI68: 3.6799999999999999e-002 | AJ68: =H68+100*O68 -> 155.88 | AK68: 153.9 | AL68: 102 | AM68: 55.4 | AN68: 96 | AO68: -5.9999999999999998e-002 | AP68: 9 | AQ68: 濮耐转债
A69: 68 | B69: 123114 | C69: 三角转债! | D69: 300775 | E69: 三角防务 | F69: 航空航天 | G69: 航空航天 | H69: 178.1 | I69: 1.66e-002 | J69: -2.3900000000000001e-002 | K69: 44.03 | L69: -9.0000000000000011e-003 | M69: 121 | N69: 31.82 | O69: 0.28699999999999998 | P69: 138.37 | Q69: 已到 | R69: 5.29年 | S69: 3.29年 | T69: 9.04 | U69: 225 | V69: 0.14099999999999999 | W69: 4.0999999999999995e-002 | X69: 5.7000000000000002e-002 | Y69: 218 | Z69: 10.1 | AA69: -7.1300000000000002e-002 | AB69: -7.7300000000000008e-002 | AC69: -0.13600000000000001 | AD69: -0.13900000000000001 | AE69: 86.72 | AF69: 89.08 | AG69: 0.81 | AH69: AA- | AI69: 6.0599999999999994e-002 | AJ69: =H69+100*O69 -> 206.79999999999998 | AK69: 217.8 | AL69: 344 | AM69: 128.7 | AN69: 346 | AO69: -6.0000000000000001e-003 | AP69: 7 | AQ69: 三角转债!
A70: 69 | B70: 111000 | C70: 起帆转债 | D70: 605222 | E70: 起帆电缆 | F70: 能源电力 | G70: 电力设备 | H70: 140.77 | I70: 2.1600000000000001e-002 | J70: -1.4800000000000001e-002 | K70: 24.4 | L70: 9.1000000000000004e-003 | M70: 120.5 | N70: 20.1 | O70: 0.16 | P70: 121.39 | Q70: 已到 | R70: 5.29年 | S70: 3.29年 | T70: 10 | U70: 92 | V70: 6.6000000000000003e-002 | W70: 9.8000000000000004e-002 | X70: 0.11900000000000001 | Y70: 102 | Z70: 2.94 | AA70: -2.9399999999999999e-002 | AB70: -3.56e-002 | AC70: -8.0700000000000008e-002 | AD70: -8.3400000000000002e-002 | AE70: 86.27 | AF70: 88.71 | AG70: 0.75 | AH70: AA- | AI70: 6.0599999999999994e-002 | AJ70: =H70+100*O70 -> 156.77000000000001 | AK70: 160.1 | AL70: 162 | AM70: 71.4 | AN70: 217 | AO70: -2.7000000000000003e-002 | AP70: 10 | AQ70: 起帆转债
A71: 70 | B71: 127034 | C71: 绿茵转债! | D71: 2887 | E71: 绿茵生态 | F71: 城市公用 | G71: 生态环境 | H71: 108 | I71: 1.1999999999999999e-003 | J71: 4.3e-003 | K71: 9.3 | L71: 1.3100000000000001e-002 | M71: 119 | N71: 12.38 | O71: 0.43799999999999994 | P71: 75.12 | Q71: 已到 | R71: 5.22年 | S71: 3.22年 | T71: 7.12 | U71: 5.9 | V71: 8.0000000000000002e-003 | W71: 0.245 | X71: 0.184 | Y71: 29 | Z71: 1.42 | AA71: 1.9e-002 | AB71: 1.26e-002 | AC71: -4.5999999999999999e-003 | AD71: -8.199999999999999e-003 | AE71: 87.07 | AF71: 87.97 | AG71: 0.41 | AH71: AA- | AI71: 6.0599999999999994e-002 | AJ71: =H71+100*O71 -> 151.80000000000001 | AK71: 140.9 | AL71: 18 | AM71: 52.9 | AN71: 76 | AO71: -4.7e-002 | AP71: 43 | AQ71: 绿茵转债!
A72: 71 | B72: 113624 | C72: 正川转债! | D72: 603976 | E72: 正川股份 | F72: 医药 | G72: 医药行业 | H72: 113.84 | I72: 4.7999999999999996e-003 | J72: 9.1000000000000004e-003 | K72: 29.96 | L72: 4.3899999999999995e-002 | M72: 121.6 | N72: 46.69 | O72: 0.77400000000000002 | P72: 64.17 | Q72: 已到 | R72: 5.22年 | S72: 3.22年 | T72: 4.05 | U72: 8.3 | V72: 1.8000000000000002e-002 | W72: 8.900000000000001e-002 | X72: 5.7000000000000002e-002 | Y72: 45 | Z72: 4.1 | AA72: 1.3000000000000001e-002 | AB72: 5.7999999999999996e-003 | AC72: -1.8700000000000001e-002 | AD72: -2.2499999999999999e-002 | AE72: 84.61 | AF72: 85.4 | AG72: 0.32 | AH72: A+ | AI72: 7.1599999999999997e-002 | AJ72: =H72+100*O72 -> 191.24000000000001 | AK72: 163.5 | AL72: 204 | AM72: 78.1 | AN72: 260 | AO72: -9.6999999999999989e-002 | AP72: 24 | AQ72: 正川转债!
A73: 72 | B73: 113048 | C73: 晶科转债!! | D73: 601778 | E73: 晶科科技 | F73: 能源电力 | G73: 太阳能 | H73: 152.27 | I73: -1.37e-002 | J73: -3.2000000000000002e-003 | K73: 6.6 | L73: -2.3700000000000002e-002 | M73: 117.1 | N73: 5.46 | O73: 0.26000000000000001 | P73: 120.88 | Q73: 已到 | R73: 5.20年 | S73: 3.20年 | T73: 23 | U73: 205 | V73: 5.9000000000000004e-002 | W73: 0.12 | X73: 0.14499999999999999 | Y73: 191 | Z73: 1.61 | AA73: -4.9800000000000004e-002 | AB73: -5.5099999999999996e-002 | AC73: -0.10300000000000001 | AD73: -0.105 | AE73: 92.34 | AF73: 95.94 | AG73: 0.72 | AH73: AA | AI73: 3.9599999999999996e-002 | AJ73: =H73+100*O73 -> 178.27000000000001 | AK73: 183.7 | AL73: 308 | AM73: 87.7 | AN73: 299 | AO73: -0.10800000000000001 | AP73: 14 | AQ73: 晶科转债!!
A74: 73 | B74: 123113 | C74: 仙乐转债! | D74: 300791 | E74: 仙乐健康 | F74: 食品饮料 | G74: 食品饮料 | H74: 116.135 | I74: 1.1999999999999999e-003 | J74: 5.6999999999999993e-003 | K74: 36.97 | L74: 2.41e-002 | M74: 118.5 | N74: 56.88 | O74: 0.78700000000000003 | P74: 65 | Q74: 已到 | R74: 5.19年 | S74: 3.19年 | T74: 10.2 | U74: 6.2 | V74: 5.0000000000000001e-003 | W74: 0.154 | X74: 0.10000000000000001 | Y74: 67 | Z74: 2.87 | AA74: 3.9000000000000003e-003 | AB74: -2.2000000000000001e-003 | AC74: -2.7900000000000001e-002 | AD74: -3.1e-002 | AE74: 86.76 | AF74: 87.74 | AG74: 0.29 | AH74: AA- | AI74: 6.0599999999999994e-002 | AJ74: =H74+100*O74 -> 194.83500000000001 | AK74: 167.3 | AL74: 230 | AM74: 79.5 | AN74: 267 | AO74: -0.13 | AP74: 6 | AQ74: 仙乐转债!
A75: 74 | B75: 127033 | C75: 中装转2! | D75: 2822 | E75: 中装建设 | F75: 建筑 | G75: 装饰工程 | H75: 122 | I75: -1.6000000000000001e-003 | J75: 1.0700000000000001e-002 | K75: 5.7 | L75: 1.9699999999999999e-002 | M75: 117.1 | N75: 6.28 | O75: 0.34399999999999997 | P75: 90.76 | Q75: 已到 | R75: 5.19年 | S75: 3.19年 | T75: 11.6 | U75: 31 | V75: 2.2000000000000002e-002 | W75: 0.28199999999999997 | X75: 0.25600000000000001 | Y75: 41 | Z75: 1.18 | AA75: -8.0000000000000002e-003 | AB75: -1.37e-002 | AC75: -4.3499999999999997e-002 | AD75: -4.6300000000000001e-002 | AE75: 92.41 | AF75: 96.02 | AG75: 0.46 | AH75: AA | AI75: 3.9599999999999996e-002 | AJ75: =H75+100*O75 -> 156.40000000000001 | AK75: 153.2 | AL75: 95 | AM75: 57.2 | AN75: 110 | AO75: -3.7999999999999999e-002 | AP75: 27 | AQ75: 中装转2!
A76: 75 | B76: 110080 | C76: 东湖转债 | D76: 600133 | E76: 东湖高新 | F76: 建筑 | G76: 建筑工程 | H76: 113.06 | I76: 2.7000000000000001e-003 | J76: 1.5e-003 | K76: 5.21 | L76: 9.7000000000000003e-003 | M76: 115.1 | N76: 6.05 | O76: 0.313 | P76: 86.12 | Q76: 已到 | R76: 5.17年 | S76: 3.17年 | T76: 15.5 | U76: 11 | V76: 6.0000000000000001e-003 | W76: 0.374 | X76: 0.32200000000000001 | Y76: 41 | Z76: 0.74 | AA76: 3.4999999999999996e-003 | AB76: -1.7000000000000001e-003 | AC76: -2.1299999999999999e-002 | AD76: -2.4199999999999999e-002 | AE76: 92.45 | AF76: 94.42 | AG76: 0.43 | AH76: AA | AI76: 3.9599999999999996e-002 | AJ76: =H76+100*O76 -> 144.36000000000001 | AK76: 140 | AL76: 13 | AM76: 45.6 | AN76: 34 | AO76: -3.5000000000000003e-002 | AP76: 33 | AQ76: 东湖转债
A77: 76 | B77: 127032 | C77: 苏行转债 | D77: 2966 | E77: 苏州银行 | F77: 金融 | G77: 银行行业 | H77: 115.878 | I77: -5.3e-003 | J77: 2.0999999999999999e-003 | K77: 6.79 | L77: -8.8000000000000005e-003 | M77: 115.1 | N77: 8.1 | O77: 0.38200000000000001 | P77: 83.83 | Q77: 已到 | R77: 5.17年 | S77: 无权 | T77: 50 | U77: 22 | V77: 4.0000000000000001e-003 | W77: 0.221 | X77: 0.185 | Y77: 226 | Z77: 0.72 | AA77: -1.2999999999999999e-003 | AB77: -6.5000000000000006e-003 | AC77: 无权 | AD77: 无权 | AE77: 无权 | AF77: 97.71 | AG77: 0.36 | AH77: AAA | AI77: 3.2599999999999997e-002 | AJ77: =H77+100*O77 -> 154.078 | AK77: 147.9 | AL77: 57 | AM77: 50.2 | AN77: 55 | AO77: -1.6e-002 | AP77: 10 | AQ77: 苏行转债
A78: 77 | B78: 113047 | C78: 旗滨转债! | D78: 601636 | E78: 旗滨集团 | F78: 建筑 | G78: 玻璃 | H78: 162.59 | I78: -1.9699999999999999e-002 | J78: -1.44e-002 | K78: 15.77 | L78: -4.6600000000000003e-002 | M78: 114 | N78: 12.8 | O78: 0.32000000000000001 | P78: 123.2 | Q78: 已到 | R78: 5.17年 | S78: 3.17年 | T78: 15 | U78: 90 | V78: 3.7000000000000005e-002 | W78: 3.5000000000000003e-002 | X78: 4.4000000000000004e-002 | Y78: 424 | Z78: 3.45 | AA78: -6.6900000000000001e-002 | AB78: -7.1199999999999999e-002 | AC78: -0.12300000000000001 | AD78: -0.125 | AE78: 93.01 | AF78: 95.78 | AG78: 0.73 | AH78: AA+ | AI78: 3.4599999999999999e-002 | AJ78: =H78+100*O78 -> 194.59 | AK78: 202 | AL78: 336 | AM78: 106.2 | AN78: 335 | AO78: -6.8000000000000005e-002 | AP78: 7 | AQ78: 旗滨转债!
A79: 78 | B79: 123112 | C79: 万讯转债! | D79: 300112 | E79: 万讯自控 | F79: 机械装备 | G79: 专用设备 | H79: 141.501 | I79: 2.5399999999999999e-002 | J79: -3.7000000000000002e-003 | K79: 10.74 | L79: 3.0699999999999998e-002 | M79: 124.4 | N79: 8.93 | O79: 0.17699999999999999 | P79: 120.27 | Q79: 已到 | R79: 5年59天 | S79: 3年59天 | T79: 2.45 | U79: 109 | V79: 0.318 | W79: 8.0000000000000002e-002 | X79: 9.6000000000000002e-002 | Y79: 31 | Z79: 2.82 | AA79: -2.5000000000000001e-002 | AB79: -3.2500000000000001e-002 | AC79: -8.2699999999999996e-002 | AD79: -8.5900000000000004e-002 | AE79: 87.74 | AF79: 92.31 | AG79: 0.71 | AH79: AA- | AI79: 6.0599999999999994e-002 | AJ79: =H79+100*O79 -> 159.20099999999999 | AK79: 162.7 | AL79: 193 | AM79: 70.4 | AN79: 208 | AO79: -0.151 | AP79: 14 | AQ79: 万讯转债!
A80: 79 | B80: 113623 | C80: 凤21转债 | D80: 603225 | E80: 新凤鸣 | F80: 化工 | G80: 化纤 | H80: 123.11 | I80: 3.3e-003 | J80: -1.1999999999999999e-003 | K80: 13.17 | L80: 6.0999999999999995e-003 | M80: 117.1 | N80: 16.47 | O80: 0.54000000000000004 | P80: 79.96 | Q80: 已到 | R80: 5年59天 | S80: 3年59天 | T80: 25 | U80: 9.9 | V80: 3.0000000000000001e-003 | W80: 0.124 | X80: 9.9000000000000005e-002 | Y80: 201 | Z80: 1.27 | AA80: -9.7999999999999997e-003 | AB80: -1.55e-002 | AC80: -4.6500000000000007e-002 | AD80: -4.9299999999999997e-002 | AE80: 92.49 | AF80: 96.1 | AG80: 0.34 | AH80: AA | AI80: 3.9599999999999996e-002 | AJ80: =H80+100*O80 -> 177.11000000000001 | AK80: 166.3 | AL80: 224 | AM80: 70.2 | AN80: 207 | AO80: -0.111 | AP80: 4 | AQ80: 凤21转债
A81: 80 | B81: 123111 | C81: 东财转3!* | D81: 300059 | E81: 东方财富 | F81: 金融 | G81: 证券行业 | H81: 134.4 | I81: -1.18e-002 | J81: -2.3e-003 | K81: 31.36 | L81: -1.41e-002 | M81: 110.5 | N81: 23.35 | O81: 1.e-003 | P81: 134.3 | Q81: 已到 | R81: 21天 | S81: 无权 | T81: 133 | U81: 1233. | V81: 6.8000000000000005e-002 | W81: 4.0999999999999995e-002 | X81: 5.5e-002 | Y81: 3251. | Z81: 8.32 | AA81: <-100% | AB81: <-100% | AC81: 无权 | AD81: 无权 | AE81: 无权 | AF81: 100.03 | AG81: 1 | AH81: AA+ | AI81: 2.5899999999999999e-002 | AJ81: =H81+100*O81 -> 134.5 | AK81: 134.5 | AL81: 8 | AM81: 34.5 | AN81: 8 | AO81: -5.9999999999999998e-002 | AP81: 28 | AQ81: 东财转3!*
A82: 81 | B82: 123109 | C82: 昌红转债! | D82: 300151 | E82: 昌红科技 | F82: 机械装备 | G82: 专用设备 | H82: 140.005 | I82: -7.0999999999999995e-003 | J82: 4.9800000000000004e-002 | K82: 32.16 | L82: 6.1399999999999996e-002 | M82: 121 | N82: 28.06 | O82: 0.222 | P82: 114.61 | Q82: 已到 | R82: 5年52天 | S82: 3年52天 | T82: 4.6 | U82: 451 | V82: 0.65799999999999992 | W82: 2.7999999999999997e-002 | X82: 3.3000000000000002e-002 | Y82: 162 | Z82: 15.64 | AA82: -2.8399999999999998e-002 | AB82: -3.5000000000000003e-002 | AC82: -8.1099999999999992e-002 | AD82: -8.4100000000000008e-002 | AE82: 87.48 | AF82: 89.86 | AG82: 0.7 | AH82: AA- | AI82: 6.0599999999999994e-002 | AJ82: =H82+100*O82 -> 162.20499999999998 | AK82: 165.4 | AL82: 219 | AM82: 75.5 | AN82: 249 | AO82: -7.9000000000000001e-002 | AP82: 6 | AQ82: 昌红转债!
A83: 82 | B83: 123110 | C83: 九典转债 | D83: 300705 | E83: 九典制药 | F83: 医药 | G83: 化学制药 | H83: 129.63 | I83: 5.5000000000000005e-003 | J83: -2.0999999999999999e-003 | K83: 27.04 | L83: 5.1999999999999998e-003 | M83: 121.4 | N83: 26.44 | O83: 0.26800000000000002 | P83: 102.27 | Q83: 已到 | R83: 5年52天 | S83: 3年52天 | T83: 2.7 | U83: 31 | V83: 8.900000000000001e-002 | W83: 4.2999999999999997e-002 | X83: 4.2999999999999997e-002 | Y83: 63 | Z83: 6.38 | AA83: -1.29e-002 | AB83: -1.9799999999999998e-002 | AC83: -5.8099999999999999e-002 | AD83: -6.1600000000000002e-002 | AE83: 84.94 | AF83: 85.64 | AG83: 0.67 | AH83: A+ | AI83: 7.1599999999999997e-002 | AJ83: =H83+100*O83 -> 156.43000000000001 | AK83: 157 | AL83: 135 | AM83: 71.3 | AN83: 216 | AO83: -0.156 | AP83: 11 | AQ83: 九典转债
A84: 83 | B84: 123108 | C84: 乐普转2! | D84: 300003 | E84: 乐普医疗 | F84: 医药 | G84: 医疗器械 | H84: 119.182 | I84: -9.1999999999999998e-003 | J84: 5.1999999999999998e-003 | K84: 20.72 | L84: -2.0799999999999999e-002 | M84: 111.1 | N84: 29.5 | O84: 0.69700000000000006 | P84: 70.24 | Q84: 已到 | R84: 4年50天 | S84: 2年50天 | T84: 16.4 | U84: 11 | V84: 6.0000000000000001e-003 | W84: 4.4000000000000004e-002 | X84: 3.1e-002 | Y84: 374 | Z84: 3.25 | AA84: -1.6899999999999998e-002 | AB84: -2.1700000000000001e-002 | AC84: -5.9900000000000002e-002 | AD84: -6.2600000000000003e-002 | AE84: 96.08 | AF84: 97.69 | AG84: 0.19 | AH84: AA+ | AI84: 3.1800000000000002e-002 | AJ84: =H84+100*O84 -> 188.88200000000001 | AK84: 168.1 | AL84: 234 | AM84: 70.4 | AN84: 209 | AO84: -0.115 | AP84: 13 | AQ84: 乐普转2!
A85: 84 | B85: 123107 | C85: 温氏转债! | D85: 300498 | E85: 温氏股份 | F85: 农业 | G85: 畜牧业 | H85: 139.799 | I85: 1.5800000000000002e-002 | J85: 1.89e-002 | K85: 20.15 | L85: 5.0599999999999999e-002 | M85: 113 | N85: 17.62 | O85: 0.222 | P85: 114.36 | Q85: 已到 | R85: 5年49天 | S85: 3年49天 | T85: 93 | U85: 324 | V85: 2.5000000000000001e-002 | W85: 7.2999999999999995e-002 | X85: 8.3000000000000004e-002 | Y85: 1280. | Z85: 3.65 | AA85: -4.1100000000000005e-002 | AB85: -4.53e-002 | AC85: -8.3599999999999994e-002 | AD85: -8.6099999999999996e-002 | AE85: 94.65 | AF85: 96.05 | AG85: 0.69 | AH85: AAA | AI85: 3.2599999999999997e-002 | AJ85: =H85+100*O85 -> 161.999 | AK85: 165.2 | AL85: 216 | AM85: 69.2 | AN85: 200 | AO85: 1.3000000000000001e-002 | AP85: 12 | AQ85: 温氏转债!
A86: 85 | B86: 110079 | C86: 杭银转债! | D86: 600926 | E86: 杭州银行 | F86: 金融 | G86: 银行行业 | H86: 126.93 | I86: 4.4000000000000003e-003 | J86: -7.0999999999999995e-003 | K86: 14.1 | L86: -4.1999999999999997e-003 | M86: 112.4 | N86: 12.99 | O86: 0.16899999999999998 | P86: 108.55 | Q86: 已到 | R86: 5年49天 | S86: 无权 | T86: 150 | U86: 229 | V86: 1.2e-002 | W86: 0.17899999999999999 | X86: 0.19500000000000001 | Y86: 836 | Z86: 1.2 | AA86: -2.3599999999999999e-002 | AB86: -2.7799999999999998e-002 | AC86: 无权 | AD86: 无权 | AE86: 无权 | AF86: 95.5 | AG86: 0.63 | AH86: AAA | AI86: 3.2599999999999997e-002 | AJ86: =H86+100*O86 -> 143.83000000000001 | AK86: 145.3 | AL86: 40 | AM86: 49.8 | AN86: 54 | AO86: 2.6000000000000002e-002 | AP86: 13 | AQ86: 杭银转债!
A87: 86 | B87: 113622 | C87: 杭叉转债! | D87: 603298 | E87: 杭叉集团 | F87: 机械装备 | G87: 通用设备 | H87: 119.9 | I87: 6.9999999999999993e-003 | J87: -1.23e-002 | K87: 15.86 | L87: -2.3399999999999997e-002 | M87: 112.5 | N87: 23.08 | O87: 0.745 | P87: 68.72 | Q87: 已到 | R87: 5年45天 | S87: 3年45天 | T87: 11.5 | U87: 11 | V87: 8.0000000000000002e-003 | W87: 8.4000000000000005e-002 | X87: 5.7999999999999996e-002 | Y87: 137 | Z87: 2.6 | AA87: -1.2500000000000001e-002 | AB87: -1.6799999999999999e-002 | AC87: -4.07e-002 | AD87: -4.3299999999999998e-002 | AE87: 93.6 | AF87: 94.69 | AG87: 0.23 | AH87: AA+ | AI87: 3.4599999999999999e-002 | AJ87: =H87+100*O87 -> 194.40000000000001 | AK87: 171.1 | AL87: 254 | AM87: 76.4 | AN87: 253 | AO87: -7.8e-002 | AP87: 5 | AQ87: 杭叉转债!
A88: 87 | B88: 127031 | C88: 洋丰转债! | D88: 902 | E88: 新洋丰 | F88: 化工 | G88: 农化 | H88: 126.251 | I88: -6.9999999999999993e-003 | J88: 2.e-003 | K88: 15.95 | L88: -1.1200000000000002e-002 | M88: 117.1 | N88: 17.76 | O88: 0.40600000000000003 | P88: 89.81 | Q88: 已到 | R88: 5年45天 | S88: 3年45天 | T88: 10 | U88: 9 | V88: 6.9999999999999993e-003 | W88: 4.8000000000000001e-002 | X88: 4.2999999999999997e-002 | Y88: 208 | Z88: 2.76 | AA88: -1.4800000000000001e-002 | AB88: -2.0499999999999997e-002 | AC88: -5.4400000000000004e-002 | AD88: -5.7200000000000001e-002 | AE88: 92.63 | AF88: 96.24 | AG88: 0.45 | AH88: AA | AI88: 3.9599999999999996e-002 | AJ88: =H88+100*O88 -> 166.851 | AK88: 162.7 | AL88: 191 | AM88: 66.5 | AN88: 178 | AO88: -4.2000000000000003e-002 | AP88: 7 | AQ88: 洋丰转债!
A89: 88 | B89: 123106 | C89: 正丹转债! | D89: 300641 | E89: 正丹股份 | F89: 化工 | G89: 化工 | H89: 119.797 | I89: 1.4499999999999999e-002 | J89: -4.8999999999999998e-003 | K89: 6.41 | L89: 2.07e-002 | M89: 125.5 | N89: 7.5 | O89: 0.40200000000000002 | P89: 85.47 | Q89: 已到 | R89: 5年44天 | S89: 3年44天 | T89: 3.2 | U89: 4.8 | V89: 1.3000000000000001e-002 | W89: 0.10199999999999999 | X89: 8.6999999999999994e-002 | Y89: 31 | Z89: 2.19 | AA89: 9.300000000000001e-003 | AB89: 1.e-003 | AC89: -3.78e-002 | AD89: -4.0899999999999999e-002 | AE89: 87.12 | AF89: 93.28 | AG89: 0.46 | AH89: AA- | AI89: 6.0599999999999994e-002 | AJ89: =H89+100*O89 -> 159.99700000000001 | AK89: 154.1 | AL89: 108 | AM89: 60.8 | AN89: 140 | AO89: -6.9000000000000006e-002 | AP89: 19 | AQ89: 正丹转债!
A90: 89 | B90: 128145 | C90: 日丰转债! | D90: 2953 | E90: 日丰股份 | F90: 家电 | G90: 零部件制 | H90: 133.191 | I90: 1.34e-002 | J90: 5.6000000000000008e-003 | K90: 15.21 | L90: 2.63e-002 | M90: 115.4 | N90: 13.66 | O90: 0.19600000000000001 | P90: 111.35 | Q90: 已到 | R90: 5年42天 | S90: 3年42天 | T90: 3.8 | U90: 22 | V90: 4.2999999999999997e-002 | W90: 0.10300000000000001 | X90: 0.114 | Y90: 37 | Z90: 3.24 | AA90: -2.7999999999999997e-002 | AB90: -3.3099999999999997e-002 | AC90: -6.9199999999999998e-002 | AD90: -7.2000000000000008e-002 | AE90: 87.15 | AF90: 85.82 | AG90: 0.72 | AH90: AA- | AI90: 6.0599999999999994e-002 | AJ90: =H90+100*O90 -> 152.791 | AK90: 155 | AL90: 118 | AM90: 67.9 | AN90: 188 | AO90: -7.8e-002 | AP90: 10 | AQ90: 日丰转债!
A91: 90 | B91: 127030 | C91: 盛虹转债! | D91: 301 | E91: 东方盛虹 | F91: 化工 | G91: 化纤 | H91: 154.25 | I91: -5.4000000000000003e-003 | J91: -1.9599999999999999e-002 | K91: 16.77 | L91: -3.2899999999999999e-002 | M91: 112.5 | N91: 13.53 | O91: 0.24399999999999999 | P91: 123.95 | Q91: 已到 | R91: 5年42天 | S91: 3年42天 | T91: 50 | U91: 73 | V91: 9.0000000000000011e-003 | W91: 5.0000000000000003e-002 | X91: 6.2e-002 | Y91: 997 | Z91: 7.15 | AA91: -6.0400000000000002e-002 | AB91: -6.4299999999999996e-002 | AC91: -0.11 | AD91: -0.11199999999999999 | AE91: 93.63 | AF91: 94.71 | AG91: 0.76 | AH91: AA+ | AI91: 3.4599999999999999e-002 | AJ91: =H91+100*O91 -> 178.65000000000001 | AK91: 184.6 | AL91: 311 | AM91: 89.8 | AN91: 305 | AO91: -0.109 | AP91: 5 | AQ91: 盛虹转债!
A92: 91 | B92: 113046 | C92: 金田转债! | D92: 601609 | E92: 金田铜业 | F92: 有色金属 | G92: 铜金属 | H92: 116.75 | I92: -7.4000000000000003e-003 | J92: 8.8000000000000005e-003 | K92: 8.02 | L92: 5.0000000000000001e-003 | M92: 114.9 | N92: 10.75 | O92: 0.56499999999999995 | P92: 74.6 | Q92: 已到 | R92: 5年42天 | S92: 3年42天 | T92: 15 | U92: 15 | V92: 8.0000000000000002e-003 | W92: 0.126 | X92: 9.4e-002 | Y92: 119 | Z92: 1.69 | AA92: -3.2000000000000002e-003 | AB92: -8.3000000000000001e-003 | AC92: -3.1899999999999998e-002 | AD92: -3.4700000000000002e-002 | AE92: 93.92 | AF92: 96.77 | AG92: 0.27 | AH92: AA+ | AI92: 3.4599999999999999e-002 | AJ92: =H92+100*O92 -> 173.25 | AK92: 158.9 | AL92: 151 | AM92: 62.1 | AN92: 150 | AO92: -5.5e-002 | AP92: 13 | AQ92: 金田转债!
A93: 92 | B93: 127029 | C93: 中钢转债! | D93: 928 | E93: 中钢国际 | F93: 建筑 | G93: 建筑工程 | H93: 145.775 | I93: -2.3199999999999998e-002 | J93: 2.3199999999999998e-002 | K93: 7.75 | L93: 0. | M93: 117.5 | N93: 5.79 | O93: 8.900000000000001e-002 | P93: 133.85 | Q93: 已到 | R93: 5年39天 | S93: 3年39天 | T93: 8.19 | U93: 105 | V93: 8.5999999999999993e-002 | W93: 8.3000000000000004e-002 | X93: 0.11 | Y93: 99 | Z93: 1.66 | AA93: -4.1700000000000001e-002 | AB93: -4.7300000000000002e-002 | AC93: -9.7100000000000006e-002 | AD93: -9.9399999999999988e-002 | AE93: 93.65 | AF93: 98.94 | AG93: 0.77 | AH93: AA+ | AI93: 3.4599999999999999e-002 | AJ93: =H93+100*O93 -> 154.67500000000001 | AK93: 157.7 | AL93: 142 | AM93: 58.8 | AN93: 122 | AO93: -4.4999999999999998e-002 | AP93: 12 | AQ93: 中钢转债!
A94: 93 | B94: 123105 | C94: 拓尔转债! | D94: 300229 | E94: 拓尔思 | F94: 计算机及 | G94: 软件开发 | H94: 135.5 | I94: 3.0800000000000001e-002 | J94: -5.9999999999999995e-004 | K94: 10.95 | L94: 4.4800000000000006e-002 | M94: 121 | N94: 9.96 | O94: 0.23199999999999998 | P94: 109.94 | Q94: 已到 | R94: 5年39天 | S94: 3年39天 | T94: 8 | U94: 181 | V94: 0.16699999999999998 | W94: 0.10199999999999999 | X94: 0.11199999999999999 | Y94: 78 | Z94: 3.54 | AA94: -2.2200000000000001e-002 | AB94: -2.8999999999999998e-002 | AC94: -7.2499999999999995e-002 | AD94: -7.5700000000000003e-002 | AE94: 87.66 | AF94: 90.05 | AG94: 0.67 | AH94: AA- | AI94: 6.0599999999999994e-002 | AJ94: =H94+100*O94 -> 158.69999999999999 | AK94: 161.1 | AL94: 173 | AM94: 71 | AN94: 214 | AO94: -9.0000000000000011e-003 | AP94: 9 | AQ94: 拓尔转债!
A95: 94 | B95: 123104 | C95: 卫宁转债! | D95: 300253 | E95: 卫宁健康 | F95: 计算机及 | G95: 软件开发 | H95: 120.294 | I95: 8.8000000000000005e-003 | J95: -8.1000000000000013e-003 | K95: 11.51 | L95: 4.4000000000000003e-003 | M95: 125.1 | N95: 17.74 | O95: 0.85400000000000009 | P95: 64.88 | Q95: 已到 | R95: 5年36天 | S95: 3年36天 | T95: 9.7 | U95: 14 | V95: 1.2e-002 | W95: 3.9e-002 | X95: 2.5000000000000001e-002 | Y95: 247 | Z95: 5.15 | AA95: 7.8000000000000005e-003 | AB95: -4.0000000000000002e-004 | AC95: -4.0500000000000001e-002 | AD95: -4.3400000000000001e-002 | AE95: 92.72 | AF95: 102.89 | AG95: 0.14 | AH95: AA | AI95: 3.9599999999999996e-002 | AJ95: =H95+100*O95 -> 205.69400000000002 | AK95: 175.7 | AL95: 279 | AM95: 72.8 | AN95: 223 | AO95: -0.21899999999999997 | AP95: 6 | AQ95: 卫宁转债!
A96: 95 | B96: 123103 | C96: 震安转债! | D96: 300767 | E96: 震安科技 | F96: 化工 | G96: 橡胶塑料 | H96: 170.66 | I96: -3.2400000000000005e-002 | J96: 1.09e-002 | K96: 88.21 | L96: -2.4799999999999999e-002 | M96: 121.4 | N96: 56.89 | O96: 0.10099999999999999 | P96: 155.05 | Q96: 已到 | R96: 5年32天 | S96: 3年32天 | T96: 2.53 | U96: 33 | V96: 7.400000000000001e-002 | W96: 1.3999999999999999e-002 | X96: 2.2000000000000002e-002 | Y96: 178 | Z96: 15.21 | AA96: -6.5799999999999997e-002 | AB96: -7.2099999999999997e-002 | AC96: -0.13400000000000001 | AD96: -0.13600000000000001 | AE96: 85.18 | AF96: 86.01 | AG96: 0.87 | AH96: A+ | AI96: 7.1599999999999997e-002 | AJ96: =H96+100*O96 -> 180.75999999999999 | AK96: 186.3 | AL96: 316 | AM96: 100.3 | AN96: 329 | AO96: -6.2e-002 | AP96: 5 | AQ96: 震安转债!
A97: 96 | B97: 123101 | C97: 拓斯转债! | D97: 300607 | E97: 拓斯达 | F97: 机械装备 | G97: 机器人及 | H97: 114 | I97: 4.0000000000000001e-003 | J97: -3.0000000000000001e-003 | K97: 13.45 | L97: 1.43e-002 | M97: 115.1 | N97: 26.18 | O97: 1.22 | P97: 51.38 | Q97: 已到 | R97: 5年30天 | S97: 3年30天 | T97: 6.7 | U97: 6.7 | V97: 9.0000000000000011e-003 | W97: 0.11699999999999999 | X97: 5.9999999999999998e-002 | Y97: 57 | Z97: 2.6 | AA97: 1.9e-003 | AB97: -3.4000000000000002e-003 | AC97: -2.4399999999999998e-002 | AD97: -2.7400000000000001e-002 | AE97: 92.78 | AF97: 94.75 | AG97: 0.07 | AH97: AA | AI97: 3.9599999999999996e-002 | AJ97: =H97+100*O97 -> 236. | AK97: 176.6 | AL97: 285 | AM97: 81.9 | AN97: 279 | AO97: -0.14400000000000002 | AP97: 11 | AQ97: 拓斯转债!
A98: 97 | B98: 113620 | C98: 傲农转债! | D98: 603363 | E98: 傲农生物 | F98: 农业 | G98: 畜牧业 | H98: 147.99 | I98: 2.9399999999999999e-002 | J98: -8.3000000000000001e-003 | K98: 16.83 | L98: 3.2500000000000001e-002 | M98: 121.1 | N98: 14.52 | O98: 0.27699999999999997 | P98: 115.91 | Q98: 已到 | R98: 5年30天 | S98: 3年30天 | T98: 10 | U98: 454 | V98: 0.30599999999999999 | W98: 8.6999999999999994e-002 | X98: 0.10099999999999999 | Y98: 115 | Z98: 5.3 | AA98: -3.9100000000000003e-002 | AB98: -4.5700000000000005e-002 | AC98: -0.10099999999999999 | AD98: -0.10099999999999999 | AE98: 92.78 | AF98: 99.67 | AG98: 0.65 | AH98: AA | AI98: 3.9599999999999996e-002 | AJ98: =H98+100*O98 -> 175.69 | AK98: 180.1 | AL98: 298 | AM98: 80.4 | AN98: 273 | AO98: 6.7000000000000004e-002 | AP98: 9 | AQ98: 傲农转债!
A99: 98 | B99: 113045 | C99: 环旭转债! | D99: 601231 | E99: 环旭电子 | F99: 电子 | G99: 电子产品 | H99: 117.14 | I99: 2.0000000000000001e-004 | J99: 0. | K99: 13.76 | L99: 7.000000000000001e-004 | M99: 112 | N99: 19.75 | O99: 0.68099999999999994 | P99: 69.67 | Q99: 已到 | R99: 5年24天 | S99: 2年24天 | T99: 34.5 | U99: 6 | V99: 1.e-003 | W99: 0.113 | X99: 7.9000000000000001e-002 | Y99: 304 | Z99: 2.55 | AA99: -8.8999999999999999e-003 | AB99: -1.3100000000000001e-002 | AC99: -5.6600000000000004e-002 | AD99: -5.8899999999999994e-002 | AE99: 95.3 | AF99: 94.4 | AG99: 0.21 | AH99: AA+ | AI99: 3.4599999999999999e-002 | AJ99: =H99+100*O99 -> 185.24000000000001 | AK99: 164.6 | AL99: 211 | AM99: 69.3 | AN99: 201 | AO99: -8.199999999999999e-002 | AP99: 6 | AQ99: 环旭转债!
A100: 99 | B100: 128144 | C100: 利民转债! | D100: 2734 | E100: 利民股份 | F100: 化工 | G100: 农化 | H100: 135.215 | I100: -1.3000000000000001e-002 | J100: 4.3299999999999998e-002 | K100: 13.14 | L100: 4.3700000000000003e-002 | M100: 114.1 | N100: 11.5 | O100: 0.183 | P100: 114.26 | Q100: 已到 | R100: 5年21天 | S100: 3年21天 | T100: 9.79 | U100: 33 | V100: 2.5000000000000001e-002 | W100: 0.20000000000000001 | X100: 0.22899999999999998 | Y100: 49 | Z100: 1.94 | AA100: -3.3300000000000003e-002 | AB100: -3.7999999999999999e-002 | AC100: -7.8299999999999995e-002 | AD100: -8.0500000000000002e-002 | AE100: 91.91 | AF100: 93.96 | AG100: 0.69 | AH100: AA | AI100: 3.9599999999999996e-002 | AJ100: =H100+100*O100 -> 153.51500000000001 | AK100: 156.2 | AL100: 126 | AM100: 62.2 | AN100: 151 | AO100: -1.3999999999999999e-002 | AP100: 5 | AQ100: 利民转债!
A101: 100 | B101: 118000 | C101: 嘉元转债! | D101: 688388 | E101: 嘉元科技 | F101: 电子 | G101: 电子产品 | H101: 189.67 | I101: 9.1999999999999998e-003 | J101: -3.6299999999999999e-002 | K101: 120.64 | L101: -3.1800000000000002e-002 | M101: 121 | N101: 78.74 | O101: 0.23800000000000002 | P101: 153.21 | Q101: 已到 | R101: 5年15天 | S101: 3年15天 | T101: 9.79 | U101: 127 | V101: 6.9000000000000006e-002 | W101: 3.5000000000000003e-002 | X101: 5.2999999999999999e-002 | Y101: 283 | Z101: 9.42 | AA101: -8.6400000000000005e-002 | AB101: -9.2499999999999999e-002 | AC101: -0.10199999999999999 | AD101: -0.10400000000000001 | AE101: 88 | AF101: 90.4 | AG101: 0.85 | AH101: AA- | AI101: 6.0599999999999994e-002 | AJ101: =H101+100*O101 -> 213.47 | AK101: 226.1 | AL101: 348 | AM101: 135.7 | AN101: 351 | AO101: -3.4000000000000002e-002 | AP101: 6 | AQ101: 嘉元转债!
A102: 101 | B102: 123100 | C102: 朗科转债 | D102: 300543 | E102: 朗科智能 | F102: 电子 | G102: 电子产品 | H102: 131.3 | I102: 7.1999999999999998e-003 | J102: 9.0000000000000011e-003 | K102: 12.6 | L102: 2.3599999999999999e-002 | M102: 117.5 | N102: 11.61 | O102: 0.20999999999999999 | P102: 108.53 | Q102: 已到 | R102: 5年1.6天 | S102: 3年1.6天 | T102: 3.8 | U102: 20 | V102: 4.0999999999999995e-002 | W102: 0.11199999999999999 | X102: 0.122 | Y102: 34 | Z102: 3.57 | AA102: -2.23e-002 | AB102: -2.81e-002 | AC102: -6.7099999999999993e-002 | AD102: -7.0099999999999996e-002 | AE102: 87.73 | AF102: 87.98 | AG102: 0.69 | AH102: AA- | AI102: 6.0599999999999994e-002 | AJ102: =H102+100*O102 -> 152.30000000000001 | AK102: 154.1 | AL102: 107 | AM102: 66.1 | AN102: 173 | AO102: -6.4000000000000001e-002 | AP102: 9 | AQ102: 朗科转债
A103: 102 | B103: 123099 | C103: 普利转债 | D103: 300630 | E103: 普利制药 | F103: 医药 | G103: 化学制药 | H103: 132.6 | I103: 4.5000000000000005e-003 | J103: 7.000000000000001e-004 | K103: 47.7 | L103: 8.6999999999999994e-003 | M103: 123.5 | N103: 46.03 | O103: 0.28000000000000003 | P103: 103.63 | Q103: 已到 | R103: 5年1.6天 | S103: 3年1.6天 | T103: 8.5 | U103: 5.9 | V103: 5.0000000000000001e-003 | W103: 4.0999999999999995e-002 | X103: 4.2000000000000003e-002 | Y103: 208 | Z103: 8.76 | AA103: -1.43e-002 | AB103: -2.1899999999999999e-002 | AC103: -7.0099999999999996e-002 | AD103: -7.3099999999999998e-002 | AE103: 87.73 | AF103: 92.44 | AG103: 0.61 | AH103: AA- | AI103: 6.0599999999999994e-002 | AJ103: =H103+100*O103 -> 160.59999999999999 | AK103: 161.6 | AL103: 182 | AM103: 69.1 | AN103: 199 | AO103: -5.7000000000000002e-002 | AP103: 6 | AQ103: 普利转债
A104: 103 | B104: 123098 | C104: 一品转债! | D104: 300723 | E104: 一品红 | F104: 医药 | G104: 医药行业 | H104: 142.3 | I104: 1.3600000000000001e-002 | J104: -1.83e-002 | K104: 27.79 | L104: -7.4999999999999997e-003 | M104: 124 | N104: 25.48 | O104: 0.30499999999999999 | P104: 109.07 | Q104: 已到 | R104: 4.97年 | S104: 2.97年 | T104: 4.24 | U104: 14 | V104: 2.3e-002 | W104: 5.2999999999999999e-002 | X104: 5.7999999999999996e-002 | Y104: 80 | Z104: 4.79 | AA104: -2.8300000000000002e-002 | AB104: -3.5799999999999998e-002 | AC104: -9.0899999999999995e-002 | AD104: -9.4e-002 | AE104: 89.09 | AF104: 93.82 | AG104: 0.64 | AH104: AA- | AI104: 5.7800000000000004e-002 | AJ104: =H104+100*O104 -> 172.80000000000001 | AK104: 175.5 | AL104: 278 | AM104: 81.7 | AN104: 278 | AO104: -0.14199999999999999 | AP104: 7 | AQ104: 一品转债!
A105: 104 | B105: 123097 | C105: 美力转债 | D105: 300611 | E105: 美力科技 | F105: 机械装备 | G105: 通用设备 | H105: 128.285 | I105: 1.09e-002 | J105: 9.1999999999999998e-003 | K105: 10.11 | L105: 2.9500000000000002e-002 | M105: 121.6 | N105: 9.28 | O105: 0.17800000000000002 | P105: 108.94 | Q105: 已到 | R105: 4.97年 | S105: 2.97年 | T105: 3 | U105: 34 | V105: 8.900000000000001e-002 | W105: 0.16600000000000001 | X105: 0.18100000000000002 | Y105: 18 | Z105: 2.57 | AA105: -1.1699999999999999e-002 | AB105: -1.8799999999999997e-002 | AC105: -5.8799999999999998e-002 | AD105: -6.2300000000000001e-002 | AE105: 86.07 | AF105: 87.49 | AG105: 0.68 | AH105: A+ | AI105: 6.88e-002 | AJ105: =H105+100*O105 -> 146.08500000000001 | AK105: 147.6 | AL105: 53 | AM105: 60.1 | AN105: 136 | AO105: -9.0999999999999998e-002 | AP105: 22 | AQ105: 美力转债
A106: 105 | B106: 123096 | C106: 思创转债! | D106: 300078 | E106: 思创医惠 | F106: 通信互联 | G106: 物联网 | H106: 116.499 | I106: 1.9e-003 | J106: 8.9999999999999998e-004 | K106: 6.24 | L106: 8.1000000000000013e-003 | M106: 123.6 | N106: 8.27 | O106: 0.54400000000000004 | P106: 75.45 | Q106: 已到 | R106: 4.97年 | S106: 2.97年 | T106: 8.17 | U106: 3.4 | V106: 4.0000000000000001e-003 | W106: 0.151 | X106: 0.114 | Y106: 54 | Z106: 1.98 | AA106: 1.21e-002 | AB106: 4.0999999999999995e-003 | AC106: -3.0299999999999997e-002 | AD106: -3.3700000000000001e-002 | AE106: 88.52 | AF106: 93.85 | AG106: 0.35 | AH106: AA- | AI106: 5.7800000000000004e-002 | AJ106: =H106+100*O106 -> 170.899 | AK106: 157.5 | AL106: 140 | AM106: 63.7 | AN106: 159 | AO106: -0.14699999999999999 | AP106: 14 | AQ106: 思创转债!
A107: 106 | B107: 113621 | C107: 彤程转债! | D107: 603650 | E107: 彤程新材 | F107: 化工 | G107: 橡胶塑料 | H107: 141.38 | I107: -2.7000000000000003e-002 | J107: 2.1899999999999999e-002 | K107: 35.39 | L107: -8.1000000000000013e-003 | M107: 114.8 | N107: 32.62 | O107: 0.30299999999999999 | P107: 108.49 | Q107: 已到 | R107: 4.97年 | S107: 2.97年 | T107: 5.37 | U107: 73 | V107: 9.4e-002 | W107: 2.5000000000000001e-002 | X107: 2.7999999999999997e-002 | Y107: 211 | Z107: 7.88 | AA107: -4.1500000000000002e-002 | AB107: -4.6399999999999997e-002 | AC107: -9.1600000000000001e-002 | AD107: -9.4200000000000006e-002 | AE107: 93.48 | AF107: 96.15 | AG107: 0.63 | AH107: AA | AI107: 3.6799999999999999e-002 | AJ107: =H107+100*O107 -> 171.68000000000001 | AK107: 174.3 | AL107: 273 | AM107: 78.1 | AN107: 261 | AO107: -0.11199999999999999 | AP107: 7 | AQ107: 彤程转债!
A108: 107 | B108: 113042 | C108: 上银转债! | D108: 601229 | E108: 上海银行 | F108: 金融 | G108: 银行行业 | H108: 107.51 | I108: 5.9999999999999995e-004 | J108: -1.8e-003 | K108: 7.03 | L108: -8.5000000000000006e-003 | M108: 120.6 | N108: 10.63 | O108: 0.626 | P108: 66.13 | Q108: 已到 | R108: 4.96年 | S108: 无权 | T108: 200 | U108: 168 | V108: 8.0000000000000002e-003 | W108: 0.20000000000000001 | X108: 0.13200000000000001 | Y108: 999 | Z108: 0.55 | AA108: 2.4e-002 | AB108: 1.66e-002 | AC108: 无权 | AD108: 无权 | AE108: 无权 | AF108: 104.6 | AG108: 0.15 | AH108: AAA | AI108: 2.98e-002 | AJ108: =H108+100*O108 -> 170.11000000000001 | AK108: 148.9 | AL108: 67 | AM108: 44.3 | AN108: 31 | AO108: -2.5000000000000001e-002 | AP108: 18 | AQ108: 上银转债!
A109: 108 | B109: 113619 | C109: 世运转债! | D109: 603920 | E109: 世运电路 | F109: 电子 | G109: 元器件制 | H109: 137.91 | I109: -1.67e-002 | J109: -1.4000000000000002e-003 | K109: 21.9 | L109: -2.8399999999999998e-002 | M109: 114.9 | N109: 19.92 | O109: 0.254 | P109: 109.94 | Q109: 已到 | R109: 4.95年 | S109: 2.95年 | T109: 10 | U109: 81 | V109: 5.7999999999999996e-002 | W109: 8.5999999999999993e-002 | X109: 9.4e-002 | Y109: 117 | Z109: 4.47 | AA109: -3.6600000000000001e-002 | AB109: -4.1599999999999998e-002 | AC109: -8.4499999999999992e-002 | AD109: -8.72e-002 | AE109: 93.53 | AF109: 96.3 | AG109: 0.64 | AH109: AA | AI109: 3.6799999999999999e-002 | AJ109: =H109+100*O109 -> 163.31 | AK109: 165.9 | AL109: 223 | AM109: 69.6 | AN109: 203 | AO109: -2.7999999999999997e-002 | AP109: 6 | AQ109: 世运转债!
A110: 109 | B110: 123093 | C110: 金陵转债! | D110: 300651 | E110: 金陵体育 | F110: 其他 | G110: 文化教育 | H110: 119.45 | I110: 2.0999999999999999e-003 | J110: 1.2699999999999999e-002 | K110: 33.5 | L110: 4.8499999999999995e-002 | M110: 128.8 | N110: 49.19 | O110: 0.754 | P110: 68.1 | Q110: 已到 | R110: 4.95年 | S110: 2.95年 | T110: 2.5 | U110: 63 | V110: 0.21100000000000002 | W110: 5.7999999999999996e-002 | X110: 3.9e-002 | Y110: 43 | Z110: 6.19 | AA110: 1.5700000000000002e-002 | AB110: 6.0999999999999995e-003 | AC110: -2.8799999999999999e-002 | AD110: -3.4099999999999998e-002 | AE110: 88.55 | AF110: 93.39 | AG110: 0.31 | AH110: A+ | AI110: 6.88e-002 | AJ110: =H110+100*O110 -> 194.85000000000002 | AK110: 170.8 | AL110: 252 | AM110: 77.4 | AN110: 258 | AO110: 8.6999999999999994e-002 | AP110: 13 | AQ110: 金陵转债!
A111: 110 | B111: 113618 | C111: 美诺转债! | D111: 603538 | E111: 美诺华 | F111: 医药 | G111: 原料药 | H111: 123.64 | I111: 1.1999999999999999e-003 | J111: 9.300000000000001e-003 | K111: 30.8 | L111: 2.1600000000000001e-002 | M111: 114.9 | N111: 37.23 | O111: 0.495 | P111: 82.73 | Q111: 已到 | R111: 4.93年 | S111: 2.93年 | T111: 5.2 | U111: 3.9 | V111: 6.0000000000000001e-003 | W111: 0.11199999999999999 | X111: 9.1999999999999998e-002 | Y111: 47 | Z111: 2.73 | AA111: -1.49e-002 | AB111: -2.0199999999999999e-002 | AC111: -5.1699999999999996e-002 | AD111: -5.4600000000000003e-002 | AE111: 88.01 | AF111: 87.41 | AG111: 0.49 | AH111: AA- | AI111: 5.7800000000000004e-002 | AJ111: =H111+100*O111 -> 173.13999999999999 | AK111: 164.6 | AL111: 209 | AM111: 76.5 | AN111: 255 | AO111: -9.3000000000000013e-002 | AP111: 5 | AQ111: 美诺转债!
A112: 111 | B112: 128143 | C112: 锋龙转债! | D112: 2931 | E112: 锋龙股份 | F112: 机械装备 | G112: 专用设备 | H112: 124.669 | I112: -9.7999999999999997e-003 | J112: 1.2800000000000001e-002 | K112: 12.75 | L112: 4.6999999999999993e-003 | M112: 121.2 | N112: 12.73 | O112: 0.245 | P112: 100.16 | Q112: 已到 | R112: 4.92年 | S112: 2.92年 | T112: 2.44 | U112: 7 | V112: 2.3e-002 | W112: 9.6000000000000002e-002 | X112: 9.6000000000000002e-002 | Y112: 25 | Z112: 4 | AA112: -5.7999999999999996e-003 | AB112: -1.3000000000000001e-002 | AC112: -5.0599999999999999e-002 | AD112: -5.4199999999999998e-002 | AE112: 86.46 | AF112: 87.87 | AG112: 0.63 | AH112: A+ | AI112: 6.88e-002 | AJ112: =H112+100*O112 -> 149.16899999999998 | AK112: 149.2 | AL112: 69 | AM112: 61.3 | AN112: 145 | AO112: -8.5000000000000006e-002 | AP112: 15 | AQ112: 锋龙转债!
A113: 112 | B113: 127028 | C113: 英特转债! | D113: 411 | E113: 英特集团 | F113: 医药 | G113: 医药商业 | H113: 123 | I113: 1.0500000000000001e-002 | J113: 1.06e-002 | K113: 12.92 | L113: 4.0300000000000002e-002 | M113: 112.8 | N113: 13.22 | O113: 0.25900000000000001 | P113: 97.73 | Q113: 已到 | R113: 4.91年 | S113: 2.91年 | T113: 5.99 | U113: 36 | V113: 4.9000000000000002e-002 | W113: 0.182 | X113: 0.17699999999999999 | Y113: 33 | Z113: 1.81 | AA113: -1.77e-002 | AB113: -2.2200000000000001e-002 | AC113: -5.0700000000000002e-002 | AD113: -5.3600000000000002e-002 | AE113: 95.06 | AF113: 96.92 | AG113: 0.52 | AH113: AA+ | AI113: 3.1800000000000002e-002 | AJ113: =H113+100*O113 -> 148.90000000000001 | AK113: 148.3 | AL113: 61 | AM113: 51.3 | AN113: 63 | AO113: -9.0999999999999998e-002 | AP113: 31 | AQ113: 英特转债!
A114: 113 | B114: 113616 | C114: 韦尔转债! | D114: 603501 | E114: 韦尔股份 | F114: 电子 | G114: 元器件制 | H114: 156.35 | I114: 4.0000000000000001e-003 | J114: -2.5000000000000001e-002 | K114: 254.2 | L114: -3.1600000000000003e-002 | M114: 114.3 | N114: 222.52 | O114: 0.36899999999999999 | P114: 114.24 | Q114: 已到 | R114: 4.89年 | S114: 2.89年 | T114: 24.3 | U114: 73 | V114: 1.9e-002 | W114: 1.1000000000000001e-002 | X114: 1.2e-002 | Y114: 2226. | Z114: 15.24 | AA114: -6.2600000000000003e-002 | AB114: -6.7299999999999999e-002 | AC114: -0.12300000000000001 | AD114: -0.125 | AE114: 94.74 | AF114: 98.23 | AG114: 0.66 | AH114: AA+ | AI114: 3.1800000000000002e-002 | AJ114: =H114+100*O114 -> 193.25 | AK114: 198.5 | AL114: 335 | AM114: 100.2 | AN114: 328 | AO114: -9.8000000000000004e-002 | AP114: 9 | AQ114: 韦尔转债!
A115: 114 | B115: 123092 | C115: 天壕转债! | D115: 300332 | E115: 天壕环境 | F115: 石油天然 | G115: 天然气 | H115: 203.09 | I115: 2.8999999999999998e-003 | J115: -1.e-004 | K115: 9.82 | L115: 3.0999999999999999e-003 | M115: 121.1 | N115: 5.19 | O115: 7.2999999999999995e-002 | P115: 189.21 | Q115: 已到 | R115: 4.88年 | S115: 2.88年 | T115: 4.17 | U115: 79 | V115: 9.3000000000000013e-002 | W115: 4.8000000000000001e-002 | X115: 9.0999999999999998e-002 | Y115: 87 | Z115: 2.54 | AA115: -0.10199999999999999 | AB115: -0.10800000000000001 | AC115: -0.121 | AD115: -0.122 | AE115: 86.61 | AF115: 88.03 | AG115: 0.93 | AH115: A+ | AI115: 6.88e-002 | AJ115: =H115+100*O115 -> 210.39000000000001 | AK115: 217 | AL115: 343 | AM115: 128.9 | AN115: 347 | AO115: -4.2000000000000003e-002 | AP115: 10 | AQ115: 天壕转债!
A116: 115 | B116: 113615 | C116: 金诚转债! | D116: 603979 | E116: 金诚信 | F116: 有色金属 | G116: 有色行业 | H116: 195.86 | I116: -1.3300000000000001e-002 | J116: 2.4e-002 | K116: 20.56 | L116: 1.18e-002 | M116: 116.9 | N116: 12.65 | O116: 0.20499999999999999 | P116: 162.53 | Q116: 已到 | R116: 4.87年 | S116: 2.87年 | T116: 8.66 | U116: 169 | V116: 0.10099999999999999 | W116: 7.0999999999999994e-002 | X116: 0.115 | Y116: 122 | Z116: 2.47 | AA116: -0.10099999999999999 | AB116: -0.107 | AC116: -0.11699999999999999 | AD116: -0.11900000000000001 | AE116: 93.79 | AF116: 98.25 | AG116: 0.9 | AH116: AA | AI116: 3.6799999999999999e-002 | AJ116: =H116+100*O116 -> 216.36000000000001 | AK116: 229.2 | AL116: 350 | AM116: 130.9 | AN116: 348 | AO116: -3.1e-002 | AP116: 3 | AQ116: 金诚转债!
A117: 116 | B117: 123091 | C117: 长海转债 | D117: 300196 | E117: 长海股份 | F117: 其他 | G117: 非金属矿 | H117: 132.25 | I117: -2.5999999999999999e-003 | J117: 3.3e-003 | K117: 16.48 | L117: 1.1999999999999999e-003 | M117: 115.9 | N117: 16.14 | O117: 0.29499999999999998 | P117: 102.11 | Q117: 已到 | R117: 4.87年 | S117: 2.87年 | T117: 5.5 | U117: 7.2 | V117: 1.e-002 | W117: 8.199999999999999e-002 | X117: 8.3000000000000004e-002 | Y117: 67 | Z117: 2.08 | AA117: -2.7000000000000003e-002 | AB117: -3.2500000000000001e-002 | AC117: -7.3700000000000002e-002 | AD117: -7.6499999999999999e-002 | AE117: 93.79 | AF117: 97.41 | AG117: 0.56 | AH117: AA | AI117: 3.6799999999999999e-002 | AJ117: =H117+100*O117 -> 161.75 | AK117: 162.4 | AL117: 189 | AM117: 65 | AN117: 168 | AO117: -4.9000000000000002e-002 | AP117: 4 | AQ117: 长海转债
A118: 117 | B118: 123089 | C118: 九洲转2!! | D118: 300040 | E118: 九洲集团 | F118: 能源电力 | G118: 电力设备 | H118: 159.2 | I118: 7.6e-003 | J118: 1.41e-002 | K118: 8.26 | L118: 2.6099999999999998e-002 | M118: 120.6 | N118: 5.68 | O118: 9.5000000000000001e-002 | P118: 145.42 | Q118: 已到 | R118: 4.87年 | S118: 2.87年 | T118: 3.06 | U118: 109 | V118: 0.222 | W118: 6.3e-002 | X118: 9.1999999999999998e-002 | Y118: 49 | Z118: 1.89 | AA118: -5.6100000000000004e-002 | AB118: -6.2699999999999992e-002 | AC118: -0.125 | AD118: -0.128 | AE118: 89.01 | AF118: 92.09 | AG118: 0.83 | AH118: AA- | AI118: 5.7800000000000004e-002 | AJ118: =H118+100*O118 -> 168.69999999999999 | AK118: 173 | AL118: 267 | AM118: 80.9 | AN118: 275 | AO118: -6.4000000000000001e-002 | AP118: 17 | AQ118: 九洲转2!!
A119: 118 | B119: 123090 | C119: 三诺转债! | D119: 300298 | E119: 三诺生物 | F119: 医药 | G119: 医疗器械 | H119: 119.63 | I119: 1.1999999999999999e-003 | J119: -4.1999999999999997e-003 | K119: 23.47 | L119: -1.55e-002 | M119: 116.8 | N119: 35.18 | O119: 0.79299999999999993 | P119: 66.71 | Q119: 已到 | R119: 4.87年 | S119: 2.87年 | T119: 5 | U119: 2.8 | V119: 5.0000000000000001e-003 | W119: 3.7999999999999999e-002 | X119: 2.5000000000000001e-002 | Y119: 133 | Z119: 4.9 | AA119: -5.0000000000000001e-003 | AB119: -1.09e-002 | AC119: -4.2500000000000003e-002 | AD119: -4.5499999999999999e-002 | AE119: 93.81 | AF119: 98.17 | AG119: 0.19 | AH119: AA | AI119: 3.6799999999999999e-002 | AJ119: =H119+100*O119 -> 198.93000000000001 | AK119: 172.5 | AL119: 263 | AM119: 74.4 | AN119: 236 | AO119: -0.17000000000000001 | AP119: 5 | AQ119: 三诺转债!
A120: 119 | B120: 128142 | C120: 新乳转债! | D120: 2946 | E120: 新乳业 | F120: 食品饮料 | G120: 乳制品 | H120: 123.794 | I120: 3.2000000000000002e-003 | J120: -6.7000000000000002e-003 | K120: 13.67 | L120: -1.37e-002 | M120: 114.8 | N120: 18.47 | O120: 0.67299999999999993 | P120: 74.01 | Q120: 已到 | R120: 4.86年 | S120: 2.86年 | T120: 7.18 | U120: 6.3 | V120: 6.9999999999999993e-003 | W120: 6.0999999999999999e-002 | X120: 4.4999999999999998e-002 | Y120: 119 | Z120: 4.66 | AA120: -1.5600000000000001e-002 | AB120: -2.0899999999999998e-002 | AC120: -5.3600000000000002e-002 | AD120: -5.6500000000000002e-002 | AE120: 93.84 | AF120: 96.52 | AG120: 0.26 | AH120: AA | AI120: 3.6799999999999999e-002 | AJ120: =H120+100*O120 -> 191.09399999999999 | AK120: 173.6 | AL120: 270 | AM120: 77.1 | AN120: 256 | AO120: -9.9000000000000005e-002 | AP120: 5 | AQ120: 新乳转债!
A121: 120 | B121: 128141 | C121: 旺能转债 | D121: 2034 | E121: 旺能环境 | F121: 城市公用 | G121: 三废处理 | H121: 140.622 | I121: 5.1999999999999998e-003 | J121: -1.24e-002 | K121: 18.55 | L121: -1.0700000000000001e-002 | M121: 114.8 | N121: 15.97 | O121: 0.21100000000000002 | P121: 116.16 | Q121: 已到 | R121: 4.86年 | S121: 2.86年 | T121: 12.7 | U121: 38 | V121: 2.1000000000000001e-002 | W121: 0.159 | X121: 0.185 | Y121: 80 | Z121: 1.58 | AA121: -4.1399999999999999e-002 | AB121: -4.6399999999999997e-002 | AC121: -9.3200000000000005e-002 | AD121: -9.5899999999999999e-002 | AE121: 93.85 | AF121: 96.53 | AG121: 0.68 | AH121: AA | AI121: 3.6799999999999999e-002 | AJ121: =H121+100*O121 -> 161.72200000000001 | AK121: 165.1 | AL121: 215 | AM121: 68.6 | AN121: 194 | AO121: -3.5000000000000003e-002 | AP121: 7 | AQ121: 旺能转债
A122: 121 | B122: 123087 | C122: 明电转债! | D122: 300739 | E122: 明阳电路 | F122: 电子 | G122: 元器件制 | H122: 123.95 | I122: 2.7000000000000001e-003 | J122: 1.49e-002 | K122: 15.68 | L122: 3.1600000000000003e-002 | M122: 120.8 | N122: 16.32 | O122: 0.28999999999999998 | P122: 96.08 | Q122: 已到 | R122: 4.85年 | S122: 3.85年 | T122: 4.19 | U122: 12 | V122: 2.3e-002 | W122: 9.0999999999999998e-002 | X122: 8.6999999999999994e-002 | Y122: 46 | Z122: 2.79 | AA122: -5.4000000000000003e-003 | AB122: -1.26e-002 | AC122: -3.1800000000000002e-002 | AD122: -3.5799999999999998e-002 | AE122: 86.94 | AF122: 92.37 | AG122: 0.56 | AH122: AA- | AI122: 5.7800000000000004e-002 | AJ122: =H122+100*O122 -> 152.94999999999999 | AK122: 151.8 | AL122: 84 | AM122: 59.5 | AN122: 132 | AO122: -9.1999999999999998e-002 | AP122: 19 | AQ122: 明电转债!
A123: 122 | B123: 123088 | C123: 威唐转债! | D123: 300707 | E123: 威唐工业 | F123: 汽车 | G123: 零部件制 | H123: 120.4 | I123: -2.5000000000000001e-003 | J123: 1.34e-002 | K123: 16.46 | L123: 2.3599999999999999e-002 | M123: 121.1 | N123: 20.72 | O123: 0.51600000000000001 | P123: 79.44 | Q123: 已到 | R123: 4.85年 | S123: 2.85年 | T123: 3.01 | U123: 6.4 | V123: 1.8000000000000002e-002 | W123: 0.11699999999999999 | X123: 9.3000000000000013e-002 | Y123: 26 | Z123: 3.67 | AA123: 1.1999999999999999e-003 | AB123: -6.1999999999999998e-003 | AC123: -4.0800000000000003e-002 | AD123: -4.4500000000000005e-002 | AE123: 86.75 | AF123: 88.18 | AG123: 0.46 | AH123: A+ | AI123: 6.88e-002 | AJ123: =H123+100*O123 -> 172. | AK123: 161.4 | AL123: 179 | AM123: 73.2 | AN123: 226 | AO123: -0.10000000000000001 | AP123: 18 | AQ123: 威唐转债!
A124: 123 | B124: 113044 | C124: 大秦转债! | D124: 601006 | E124: 大秦铁路 | F124: 铁路 | G124: 铁路运输 | H124: 111.51 | I124: 6.5000000000000006e-003 | J124: -1.8e-003 | K124: 6.61 | L124: 1.0700000000000001e-002 | M124: 113.9 | N124: 7.18 | O124: 0.21100000000000002 | P124: 92.06 | Q124: 已到 | R124: 4.85年 | S124: 2.85年 | T124: 320 | U124: 313 | V124: 9.0000000000000011e-003 | W124: 0.32600000000000001 | X124: 0.29999999999999999 | Y124: 983 | Z124: 0.82 | AA124: 4.4000000000000003e-003 | AB124: -7.000000000000001e-004 | AC124: -1.61e-002 | AD124: -2.e-002 | AE124: 96.91 | AF124: 99 | AG124: 0.44 | AH124: AAA | AI124: 2.98e-002 | AJ124: =H124+100*O124 -> 132.61000000000001 | AK124: 131 | AL124: 4 | AM124: 32 | AN124: 5 | AO124: 1.3000000000000001e-002 | AP124: 36 | AQ124: 大秦转债!
A125: 124 | B125: 123085 | C125: 万顺转2!! | D125: 300057 | E125: 万顺新材 | F125: 有色金属 | G125: 铝金属 | H125: 145.19 | I125: -6.0299999999999999e-002 | J125: 4.0500000000000001e-002 | K125: 8 | L125: -2.4399999999999998e-002 | M125: 112.9 | N125: 6.2 | O125: 0.125 | P125: 129.03 | Q125: 已到 | R125: 4.84年 | S125: 2.84年 | T125: 8.51 | U125: 120 | V125: 9.4e-002 | W125: 0.156 | X125: 0.20100000000000001 | Y125: 55 | Z125: 1.52 | AA125: -5.1200000000000002e-002 | AB125: -5.5599999999999997e-002 | AC125: -0.10199999999999999 | AD125: -0.10400000000000001 | AE125: 88.48 | AF125: 86.35 | AG125: 0.81 | AH125: AA- | AI125: 5.7800000000000004e-002 | AJ125: =H125+100*O125 -> 157.69 | AK125: 161.3 | AL125: 178 | AM125: 72.9 | AN125: 224 | AO125: -9.4e-002 | AP125: 19 | AQ125: 万顺转2!!
A126: 125 | B126: 123086 | C126: 海兰转债!! | D126: 300065 | E126: 海兰信 | F126: 电子 | G126: 电子产品 | H126: 189.744 | I126: 5.4000000000000003e-003 | J126: -1.67e-002 | K126: 12.6 | L126: -1.2500000000000001e-002 | M126: 123.1 | N126: 7.27 | O126: 9.5000000000000001e-002 | P126: 173.31 | Q126: 已到 | R126: 4.84年 | S126: 2.84年 | T126: 4.82 | U126: 351 | V126: 0.38100000000000001 | W126: 6.0999999999999999e-002 | X126: 0.105 | Y126: 79 | Z126: 4.72 | AA126: -8.6300000000000002e-002 | AB126: -9.3299999999999994e-002 | AC126: -0.114 | AD126: -0.11599999999999999 | AE126: 88.67 | AF126: 94.12 | AG126: 0.9 | AH126: AA- | AI126: 5.7800000000000004e-002 | AJ126: =H126+100*O126 -> 199.244 | AK126: 206.2 | AL126: 340 | AM126: 112.1 | AN126: 339 | AO126: -0.105 | AP126: 18 | AQ126: 海兰转债!!
A127: 126 | B127: 123084 | C127: 高澜转债!! | D127: 300499 | E127: 高澜股份 | F127: 能源电力 | G127: 电力设备 | H127: 172.327 | I127: 6.6e-003 | J127: -2.9999999999999999e-002 | K127: 12.5 | L127: -2.87e-002 | M127: 121.4 | N127: 9.01 | O127: 0.24199999999999999 | P127: 138.73 | Q127: 已到 | R127: 4.84年 | S127: 2.84年 | T127: 2.54 | U127: 133 | V127: 0.30399999999999999 | W127: 7.2000000000000008e-002 | X127: 0.10099999999999999 | Y127: 35 | Z127: 4.07 | AA127: -7.0800000000000002e-002 | AB127: -7.7499999999999999e-002 | AC127: -0.14699999999999999 | AD127: -0.14999999999999999 | AE127: 87.1 | AF127: 88.5 | AG127: 0.81 | AH127: A+ | AI127: 6.88e-002 | AJ127: =H127+100*O127 -> 196.52699999999999 | AK127: 205.9 | AL127: 339 | AM127: 117.4 | AN127: 343 | AO127: -0.10400000000000001 | AP127: 14 | AQ127: 高澜转债!!
A128: 127 | B128: 127027 | C128: 靖远转债! | D128: 552 | E128: 靖远煤电 | F128: 煤炭 | G128: 煤炭开采 | H128: 131.9 | I128: -2.5499999999999998e-002 | J128: 1.4999999999999999e-002 | K128: 3.45 | L128: -1.7100000000000001e-002 | M128: 114.9 | N128: 3.13 | O128: 0.19699999999999998 | P128: 110.22 | Q128: 已到 | R128: 4.84年 | S128: 2.84年 | T128: 24.3 | U128: 332 | V128: 0.10400000000000001 | W128: 0.29999999999999999 | X128: 0.33000000000000002 | Y128: 81 | Z128: 0.97 | AA128: -2.8500000000000001e-002 | AB128: -3.3700000000000001e-002 | AC128: -7.3800000000000004e-002 | AD128: -7.6600000000000001e-002 | AE128: 95.27 | AF128: 98.95 | AG128: 0.62 | AH128: AA+ | AI128: 3.1800000000000002e-002 | AJ128: =H128+100*O128 -> 151.59999999999999 | AK128: 153.6 | AL128: 98 | AM128: 54.6 | AN128: 89 | AO128: -5.5999999999999994e-002 | AP128: 36 | AQ128: 靖远转债!
A129: 128 | B129: 113043 | C129: 财通转债! | D129: 601108 | E129: 财通证券 | F129: 金融 | G129: 证券行业 | H129: 116.38 | I129: -6.5000000000000006e-003 | J129: 3.8e-003 | K129: 9.75 | L129: -1.0200000000000001e-002 | M129: 110 | N129: 13.13 | O129: 0.56700000000000006 | P129: 74.26 | Q129: 已到 | R129: 4.84年 | S129: 无权 | T129: 38 | U129: 47 | V129: 1.1000000000000001e-002 | W129: 0.109 | X129: 8.1000000000000003e-002 | Y129: 350 | Z129: 1.5 | AA129: -1.1699999999999999e-002 | AB129: -1.54e-002 | AC129: 无权 | AD129: 无权 | AE129: 无权 | AF129: 95.55 | AG129: 0.27 | AH129: AAA | AI129: 2.98e-002 | AJ129: =H129+100*O129 -> 173.07999999999998 | AK129: 158.5 | AL129: 149 | AM129: 63 | AN129: 153 | AO129: -7.2999999999999995e-002 | AP129: 11 | AQ129: 财通转债!
A130: 129 | B130: 123083 | C130: 朗新转债! | D130: 300682 | E130: 朗新科技 | F130: 计算机及 | G130: 软件开发 | H130: 242 | I130: -4.0999999999999995e-003 | J130: -7.1999999999999998e-003 | K130: 32.97 | L130: -1.1699999999999999e-002 | M130: 114.8 | N130: 15.39 | O130: 0.13 | P130: 214.23 | Q130: 已到 | R130: 4.83年 | S130: 2.83年 | T130: 6.01 | U130: 191 | V130: 0.13300000000000001 | W130: 1.7000000000000001e-002 | X130: 3.7000000000000005e-002 | Y130: 345 | Z130: 6.27 | AA130: -0.14400000000000002 | AB130: -0.14800000000000002 | AC130: -0.14800000000000002 | AD130: -0.14899999999999999 | AE130: 93.92 | AF130: 96.61 | AG130: 0.96 | AH130: AA | AI130: 3.6799999999999999e-002 | AJ130: =H130+100*O130 -> 255. | AK130: 269.8 | AL130: 365 | AM130: 173.2 | AN130: 364 | AO130: -6.3e-002 | AP130: 7 | AQ130: 朗新转债!
A131: 130 | B131: 127026 | C131: 超声转债! | D131: 823 | E131: 超声电子 | F131: 电子 | G131: 元器件制 | H131: 130.475 | I131: 1.54e-002 | J131: -9.4999999999999998e-003 | K131: 11.78 | L131: 1.2e-002 | M131: 112.8 | N131: 12.72 | O131: 0.40899999999999997 | P131: 92.61 | Q131: 已到 | R131: 4.83年 | S131: 2.83年 | T131: 7 | U131: 6.9 | V131: 8.0000000000000002e-003 | W131: 0.111 | X131: 0.10199999999999999 | Y131: 63 | Z131: 1.59 | AA131: -2.9999999999999999e-002 | AB131: -3.4599999999999999e-002 | AC131: -7.0699999999999999e-002 | AD131: -7.3499999999999996e-002 | AE131: 93.93 | AF131: 94.94 | AG131: 0.49 | AH131: AA | AI131: 3.6799999999999999e-002 | AJ131: =H131+100*O131 -> 171.375 | AK131: 168.3 | AL131: 235 | AM131: 73.4 | AN131: 227 | AO131: -9.0999999999999998e-002 | AP131: 12 | AQ131: 超声转债!
A132: 131 | B132: 128140 | C132: 润建转债!! | D132: 2929 | E132: 润建股份 | F132: 通信互联 | G132: 通信设备 | H132: 156.972 | I132: 1.5300000000000001e-002 | J132: 9.1999999999999998e-003 | K132: 33.82 | L132: 3.2000000000000001e-002 | M132: 114.9 | N132: 26.4 | O132: 0.22500000000000001 | P132: 128.11 | Q132: 已到 | R132: 4.83年 | S132: 2.83年 | T132: 10.9 | U132: 26 | V132: 1.4999999999999999e-002 | W132: 0.14099999999999999 | X132: 0.17999999999999999 | Y132: 77 | Z132: 2.2 | AA132: -6.3200000000000006e-002 | AB132: -6.8199999999999997e-002 | AC132: -0.125 | AD132: -0.127 | AE132: 93.94 | AF132: 96.73 | AG132: 0.77 | AH132: AA | AI132: 3.6799999999999999e-002 | AJ132: =H132+100*O132 -> 179.47200000000001 | AK132: 185.8 | AL132: 315 | AM132: 89.1 | AN132: 304 | AO132: -2.7000000000000003e-002 | AP132: 10 | AQ132: 润建转债!!
A133: 132 | B133: 123082 | C133: 北陆转债! | D133: 300016 | E133: 北陆药业 | F133: 医药 | G133: 化学制药 | H133: 118.443 | I133: -3.9000000000000003e-003 | J133: 1.24e-002 | K133: 7.94 | L133: 1.5300000000000001e-002 | M133: 121.2 | N133: 8.81 | O133: 0.314 | P133: 90.12 | Q133: 已到 | R133: 4.83年 | S133: 2.83年 | T133: 4.99 | U133: 6.7 | V133: 1.1000000000000001e-002 | W133: 0.128 | X133: 0.115 | Y133: 39 | Z133: 2.28 | AA133: 4.8999999999999998e-003 | AB133: -2.5999999999999999e-003 | AC133: -3.5400000000000001e-002 | AD133: -3.9300000000000002e-002 | AE133: 86.97 | AF133: 88.38 | AG133: 0.56 | AH133: A+ | AI133: 6.88e-002 | AJ133: =H133+100*O133 -> 149.84299999999999 | AK133: 146.8 | AL133: 46 | AM133: 58.4 | AN133: 118 | AO133: -0.10400000000000001 | AP133: 18 | AQ133: 北陆转债!
A134: 133 | B134: 123080 | C134: 海波转债! | D134: 300517 | E134: 海波重科 | F134: 建筑 | G134: 建筑工程 | H134: 126.3 | I134: -1.5e-003 | J134: 9.7999999999999997e-003 | K134: 11.93 | L134: 1.3600000000000001e-002 | M134: 126 | N134: 11.58 | O134: 0.22600000000000001 | P134: 103.02 | Q134: 已到 | R134: 4.82年 | S134: 2.82年 | T134: 2.44 | U134: 19 | V134: 6.0999999999999999e-002 | W134: 0.106 | X134: 0.109 | Y134: 23 | Z134: 2.67 | AA134: -5.0000000000000001e-004 | AB134: -9.300000000000001e-003 | AC134: -5.7200000000000001e-002 | AD134: -6.08e-002 | AE134: 86.77 | AF134: 91.95 | AG134: 0.61 | AH134: A+ | AI134: 6.88e-002 | AJ134: =H134+100*O134 -> 148.90000000000001 | AK134: 149.6 | AL134: 70 | AM134: 57.6 | AN134: 112 | AO134: -8.6999999999999994e-002 | AP134: 24 | AQ134: 海波转债!
A135: 134 | B135: 113610 | C135: 灵康转债 | D135: 603669 | E135: 灵康药业 | F135: 医药 | G135: 化学制药 | H135: 118.95 | I135: 9.3999999999999986e-003 | J135: 3.5999999999999999e-003 | K135: 8.19 | L135: 2.3799999999999998e-002 | M135: 120.7 | N135: 8.61 | O135: 0.251 | P135: 95.12 | Q135: 已到 | R135: 4.81年 | S135: 2.81年 | T135: 4.58 | U135: 11 | V135: 2.e-002 | W135: 7.8e-002 | X135: 7.400000000000001e-002 | Y135: 59 | Z135: 4.29 | AA135: 3.0999999999999999e-003 | AB135: -4.3e-003 | AC135: -3.8399999999999997e-002 | AD135: -4.2000000000000003e-002 | AE135: 89.29 | AF135: 92.47 | AG135: 0.55 | AH135: AA- | AI135: 5.7800000000000004e-002 | AJ135: =H135+100*O135 -> 144.05000000000001 | AK135: 142.8 | AL135: 25 | AM135: 50.3 | AN135: 56 | AO135: -0.11199999999999999 | AP135: 30 | AQ135: 灵康转债
A136: 135 | B136: 128139 | C136: 祥鑫转债! | D136: 2965 | E136: 祥鑫科技 | F136: 汽车 | G136: 零部件制 | H136: 125 | I136: 2.46e-002 | J136: -2.e-003 | K136: 23.86 | L136: 4.4699999999999997e-002 | M136: 120.6 | N136: 26.38 | O136: 0.38200000000000001 | P136: 90.45 | Q136: 已到 | R136: 4.81年 | S136: 2.81年 | T136: 6.47 | U136: 11 | V136: 1.3000000000000001e-002 | W136: 0.17699999999999999 | X136: 0.16 | Y136: 37 | Z136: 2.06 | AA136: -7.4999999999999997e-003 | AB136: -1.47e-002 | AC136: -5.4800000000000001e-002 | AD136: -5.8299999999999998e-002 | AE136: 89.29 | AF136: 92.38 | AG136: 0.51 | AH136: AA- | AI136: 5.7800000000000004e-002 | AJ136: =H136+100*O136 -> 163.19999999999999 | AK136: 159.6 | AL136: 159 | AM136: 67.2 | AN136: 181 | AO136: -3.6000000000000004e-002 | AP136: 14 | AQ136: 祥鑫转债!
A137: 136 | B137: 123078 | C137: 飞凯转债!! | D137: 300398 | E137: 飞凯材料 | F137: 化工 | G137: 化工 | H137: 176 | I137: 1.5600000000000001e-002 | J137: -3.5900000000000001e-002 | K137: 23.08 | L137: -2.3700000000000002e-002 | M137: 114.9 | N137: 15.56 | O137: 0.187 | P137: 148.33 | Q137: 已到 | R137: 4.80年 | S137: 2.80年 | T137: 7.2 | U137: 539 | V137: 0.43200000000000005 | W137: 5.9999999999999998e-002 | X137: 8.900000000000001e-002 | Y137: 121 | Z137: 4.12 | AA137: -8.5900000000000004e-002 | AB137: -9.06e-002 | AC137: -0.105 | AD137: -0.106 | AE137: 94.04 | AF137: 96.82 | AG137: 0.86 | AH137: AA | AI137: 3.6799999999999999e-002 | AJ137: =H137+100*O137 -> 194.69999999999999 | AK137: 203.7 | AL137: 338 | AM137: 106.8 | AN137: 336 | AO137: -0.16899999999999998 | AP137: 9 | AQ137: 飞凯转债!!
A138: 137 | B138: 113609 | C138: 永安转债! | D138: 603776 | E138: 永安行 | F138: 城市公用 | G138: 其他 | H138: 118.92 | I138: 2.2000000000000001e-003 | J138: 4.8999999999999998e-003 | K138: 15.5 | L138: 1.3100000000000001e-002 | M138: 120.1 | N138: 16.48 | O138: 0.26400000000000001 | P138: 94.05 | Q138: 已到 | R138: 4.79年 | S138: 2.79年 | T138: 7.34 | U138: 35 | V138: 4.0000000000000001e-002 | W138: 0.20300000000000001 | X138: 0.191 | Y138: 36 | Z138: 1.11 | AA138: 2.0999999999999999e-003 | AB138: -5.1000000000000004e-003 | AC138: -4.07e-002 | AD138: -4.3899999999999995e-002 | AE138: 88.9 | AF138: 92.07 | AG138: 0.54 | AH138: AA- | AI138: 5.7800000000000004e-002 | AJ138: =H138+100*O138 -> 145.31999999999999 | AK138: 143.8 | AL138: 31 | AM138: 51.7 | AN138: 67 | AO138: -0.17899999999999999 | AP138: 26 | AQ138: 永安转债!
A139: 138 | B139: 123077 | C139: 汉得转债! | D139: 300170 | E139: 汉得信息 | F139: 计算机及 | G139: 软件开发 | H139: 121.875 | I139: 4.0000000000000001e-003 | J139: 1.18e-002 | K139: 8.09 | L139: 5.4800000000000001e-002 | M139: 125.1 | N139: 9.69 | O139: 0.46000000000000002 | P139: 83.49 | Q139: 已到 | R139: 4.79年 | S139: 2.79年 | T139: 9.37 | U139: 46 | V139: 4.0000000000000001e-002 | W139: 0.13100000000000001 | X139: 0.109 | Y139: 72 | Z139: 2.28 | AA139: 5.5000000000000005e-003 | AB139: -3.0999999999999999e-003 | AC139: -4.87e-002 | AD139: -5.1900000000000002e-002 | AE139: 94.28 | AF139: 105.44 | AG139: 0.29 | AH139: AA | AI139: 3.6799999999999999e-002 | AJ139: =H139+100*O139 -> 167.875 | AK139: 160.3 | AL139: 163 | AM139: 54.8 | AN139: 91 | AO139: -5.9999999999999998e-002 | AP139: 17 | AQ139: 汉得转债!
A140: 139 | B140: 110077 | C140: 洪城转债 | D140: 600461 | E140: 洪城环境 | F140: 城市公用 | G140: 城市公用 | H140: 135.65 | I140: 1.54e-002 | J140: -1.1000000000000001e-003 | K140: 7.68 | L140: 2.1299999999999999e-002 | M140: 113.3 | N140: 6.71 | O140: 0.185 | P140: 114.46 | Q140: 已到 | R140: 4.78年 | S140: 2.78年 | T140: 17.7 | U140: 30 | V140: 1.3000000000000001e-002 | W140: 0.24199999999999999 | X140: 0.27600000000000002 | Y140: 73 | Z140: 1.35 | AA140: -3.7100000000000001e-002 | AB140: -4.1900000000000007e-002 | AC140: -8.8399999999999992e-002 | AD140: -9.0299999999999991e-002 | AE140: 94.07 | AF140: 97.64 | AG140: 0.67 | AH140: AA+ | AI140: 3.1800000000000002e-002 | AJ140: =H140+100*O140 -> 154.15000000000001 | AK140: 156.8 | AL140: 133 | AM140: 59.2 | AN140: 128 | AO140: -6.6000000000000003e-002 | AP140: 6 | AQ140: 洪城转债
A141: 140 | B141: 123076 | C141: 强力转债! | D141: 300429 | E141: 强力新材 | F141: 化工 | G141: 化工 | H141: 111.601 | I141: 3.0000000000000001e-003 | J141: -3.7000000000000002e-003 | K141: 11.03 | L141: -4.5000000000000005e-003 | M141: 118.1 | N141: 18.94 | O141: 0.91599999999999993 | P141: 58.24 | Q141: 已到 | R141: 4.78年 | S141: 2.78年 | T141: 8.5 | U141: 3.9 | V141: 4.0000000000000001e-003 | W141: 0.14999999999999999 | X141: 8.6999999999999994e-002 | Y141: 57 | Z141: 3.14 | AA141: 1.21e-002 | AB141: 5.4000000000000003e-003 | AC141: -1.9599999999999999e-002 | AD141: -2.3e-002 | AE141: 88.97 | AF141: 90.62 | AG141: 0.16 | AH141: AA- | AI141: 5.7800000000000004e-002 | AJ141: =H141+100*O141 -> 203.20099999999999 | AK141: 165 | AL141: 213 | AM141: 74.3 | AN141: 235 | AO141: -7.4999999999999997e-002 | AP141: 24 | AQ141: 强力转债!
A142: 141 | B142: 128138 | C142: 侨银转债! | D142: 2973 | E142: 侨银股份 | F142: 城市公用 | G142: 城市公用 | H142: 118.655 | I142: 2.9999999999999997e-004 | J142: -1.e-004 | K142: 14.88 | L142: 2.e-003 | M142: 136.1 | N142: 25.33 | O142: 1.02 | P142: 58.74 | Q142: 已到 | R142: 4.77年 | S142: 2.77年 | T142: 4.2 | U142: 4 | V142: 8.0000000000000002e-003 | W142: 6.9000000000000006e-002 | X142: 4.0999999999999995e-002 | Y142: 61 | Z142: 3.79 | AA142: 2.9500000000000002e-002 | AB142: 1.7600000000000001e-002 | AC142: -3.6900000000000002e-002 | AD142: -4.0800000000000003e-002 | AE142: 89.93 | AF142: 104.46 | AG142: 0.11 | AH142: AA- | AI142: 5.7800000000000004e-002 | AJ142: =H142+100*O142 -> 220.655 | AK142: 178.6 | AL142: 293 | AM142: 74.1 | AN142: 233 | AO142: -5.0000000000000003e-002 | AP142: 27 | AQ142: 侨银转债!
A143: 142 | B143: 113608 | C143: 威派转债! | D143: 603956 | E143: 威派格 | F143: 机械装备 | G143: 专用设备 | H143: 121.42 | I143: 3.4000000000000002e-003 | J143: 7.7000000000000002e-003 | K143: 16.97 | L143: 2.0400000000000001e-002 | M143: 121.1 | N143: 19.08 | O143: 0.36499999999999999 | P143: 88.94 | Q143: 已到 | R143: 4.75年 | S143: 2.75年 | T143: 4.2 | U143: 6.7 | V143: 1.3000000000000001e-002 | W143: 5.7999999999999996e-002 | X143: 5.2000000000000005e-002 | Y143: 72 | Z143: 6.11 | AA143: -5.9999999999999995e-004 | AB143: -8.1000000000000013e-003 | AC143: -4.4999999999999998e-002 | AD143: -4.8799999999999996e-002 | AE143: 87.32 | AF143: 88.76 | AG143: 0.54 | AH143: A+ | AI143: 6.88e-002 | AJ143: =H143+100*O143 -> 157.92000000000002 | AK143: 153.9 | AL143: 104 | AM143: 65.1 | AN143: 169 | AO143: -5.2999999999999999e-002 | AP143: 9 | AQ143: 威派转债!
A144: 143 | B144: 127025 | C144: 冀东转债! | D144: 401 | E144: 冀东水泥 | F144: 建筑 | G144: 水泥 | H144: 118.3 | I144: -3.7000000000000002e-003 | J144: 2.2000000000000001e-003 | K144: 11.46 | L144: -4.3e-003 | M144: 109.9 | N144: 14.01 | O144: 0.44600000000000001 | P144: 81.8 | Q144: 已到 | R144: 4.74年 | S144: 2.74年 | T144: 17.8 | U144: 2.2 | V144: 1.e-003 | W144: 5.7999999999999996e-002 | X144: 4.8000000000000001e-002 | Y144: 305 | Z144: 0.99 | AA144: -1.5600000000000001e-002 | AB144: -1.9299999999999998e-002 | AC144: -4.3499999999999997e-002 | AD144: -4.5999999999999999e-002 | AE144: 95.3 | AF144: 95.75 | AG144: 0.35 | AH144: AAA | AI144: 2.98e-002 | AJ144: =H144+100*O144 -> 162.90000000000001 | AK144: 154.8 | AL144: 115 | AM144: 59.1 | AN144: 125 | AO144: -5.2000000000000005e-002 | AP144: 8 | AQ144: 冀东转债!
A145: 144 | B145: 127024 | C145: 盈峰转债! | D145: 967 | E145: 盈峰环境 | F145: 机械装备 | G145: 专用设备 | H145: 116.37 | I145: 1.9e-003 | J145: -1.e-004 | K145: 6.12 | L145: 8.199999999999999e-003 | M145: 116.6 | N145: 8.19 | O145: 0.55700000000000005 | P145: 74.73 | Q145: 已到 | R145: 4.74年 | S145: 2.74年 | T145: 14.8 | U145: 2.6 | V145: 2.e-003 | W145: 7.5999999999999998e-002 | X145: 5.7000000000000002e-002 | Y145: 195 | Z145: 1.18 | AA145: 4.0000000000000002e-004 | AB145: -5.6999999999999993e-003 | AC145: -3.5699999999999996e-002 | AD145: -3.8699999999999998e-002 | AE145: 95.37 | AF145: 100.69 | AG145: 0.22 | AH145: AA+ | AI145: 3.1800000000000002e-002 | AJ145: =H145+100*O145 -> 172.06999999999999 | AK145: 158 | AL145: 145 | AM145: 57.3 | AN145: 111 | AO145: -8.1000000000000003e-002 | AP145: 6 | AQ145: 盈峰转债!
A146: 145 | B146: 128137 | C146: 洁美转债! | D146: 2859 | E146: 洁美科技 | F146: 电子 | G146: 元器件制 | H146: 147 | I146: 0. | J146: -5.8999999999999999e-003 | K146: 32.74 | L146: -7.9000000000000008e-003 | M146: 116.9 | N146: 27.63 | O146: 0.24100000000000002 | P146: 118.49 | Q146: 已到 | R146: 4.74年 | S146: 2.74年 | T146: 5.99 | U146: 6.3 | V146: 6.9999999999999993e-003 | W146: 4.4999999999999998e-002 | X146: 5.2999999999999999e-002 | Y146: 134 | Z146: 6.82 | AA146: -4.7699999999999992e-002 | AB146: -5.3499999999999999e-002 | AC146: -0.109 | AD146: -0.11199999999999999 | AE146: 88.98 | AF146: 89.9 | AG146: 0.74 | AH146: AA- | AI146: 5.7800000000000004e-002 | AJ146: =H146+100*O146 -> 171.09999999999999 | AK146: 175.5 | AL146: 277 | AM146: 85.6 | AN146: 293 | AO146: -4.9000000000000002e-002 | AP146: 4 | AQ146: 洁美转债!
A147: 146 | B147: 128136 | C147: 立讯转债! | D147: 2475 | E147: 立讯精密 | F147: 电子 | G147: 元器件制 | H147: 126.11 | I147: 7.000000000000001e-004 | J147: 1.9e-003 | K147: 46.66 | L147: 8.0000000000000002e-003 | M147: 111.8 | N147: 57.97 | O147: 0.56700000000000006 | P147: 80.49 | Q147: 已到 | R147: 4.74年 | S147: 2.74年 | T147: 30 | U147: 26 | V147: 6.9999999999999993e-003 | W147: 9.0000000000000011e-003 | X147: 6.9999999999999993e-003 | Y147: 3299. | Z147: 10.21 | AA147: -2.53e-002 | AB147: -2.9600000000000001e-002 | AC147: -6.4600000000000005e-002 | AD147: -6.7000000000000004e-002 | AE147: 94.89 | AF147: 96.49 | AG147: 0.33 | AH147: AA+ | AI147: 3.1800000000000002e-002 | AJ147: =H147+100*O147 -> 182.81 | AK147: 171.7 | AL147: 258 | AM147: 75.2 | AN147: 246 | AO147: -2.1000000000000001e-002 | AP147: 14 | AQ147: 立讯转债!
A148: 147 | B148: 110076 | C148: 华海转债! | D148: 600521 | E148: 华海药业 | F148: 医药 | G148: 医药行业 | H148: 117.22 | I148: -2.2000000000000001e-003 | J148: 2.7000000000000001e-003 | K148: 20.99 | L148: 3.3e-003 | M148: 114.8 | N148: 33.85 | O148: 0.89000000000000001 | P148: 62.01 | Q148: 已到 | R148: 4.73年 | S148: 2.73年 | T148: 18.4 | U148: 14 | V148: 6.0000000000000001e-003 | W148: 5.9000000000000004e-002 | X148: 3.6000000000000004e-002 | Y148: 313 | Z148: 4.77 | AA148: -4.5000000000000005e-003 | AB148: -1.e-002 | AC148: -3.7699999999999997e-002 | AD148: -4.0800000000000003e-002 | AE148: 94.27 | AF148: 96.96 | AG148: 0.13 | AH148: AA | AI148: 3.6799999999999999e-002 | AJ148: =H148+100*O148 -> 206.22 | AK148: 172.4 | AL148: 261 | AM148: 75.5 | AN148: 248 | AO148: -6.2e-002 | AP148: 8 | AQ148: 华海转债!
A149: 148 | B149: 123075 | C149: 贝斯转债! | D149: 300580 | E149: 贝斯特 | F149: 汽车 | G149: 零部件制 | H149: 149.577 | I149: 8.0000000000000004e-004 | J149: -2.53e-002 | K149: 27.8 | L149: -3.3700000000000001e-002 | M149: 115.1 | N149: 23.74 | O149: 0.27699999999999997 | P149: 117.1 | Q149: 已到 | R149: 4.73年 | S149: 2.73年 | T149: 6 | U149: 47 | V149: 5.2000000000000005e-002 | W149: 0.10800000000000001 | X149: 0.126 | Y149: 56 | Z149: 3.14 | AA149: -5.45e-002 | AB149: -5.96e-002 | AC149: -0.114 | AD149: -0.11699999999999999 | AE149: 89.2 | AF149: 88.56 | AG149: 0.73 | AH149: AA- | AI149: 5.7800000000000004e-002 | AJ149: =H149+100*O149 -> 177.27699999999999 | AK149: 182.1 | AL149: 304 | AM149: 92.8 | AN149: 316 | AO149: -8.5999999999999993e-002 | AP149: 9 | AQ149: 贝斯转债!
A150: 149 | B150: 113606 | C150: 荣泰转债 | D150: 603579 | E150: 荣泰健康 | F150: 机械装备 | G150: 专用设备 | H150: 122.64 | I150: 9.4999999999999998e-003 | J150: -6.9999999999999993e-003 | K150: 29.9 | L150: 5.0000000000000001e-003 | M150: 120.7 | N150: 32.83 | O150: 0.34700000000000003 | P150: 91.08 | Q150: 已到 | R150: 4.72年 | S150: 2.72年 | T150: 6 | U150: 3.2 | V150: 4.0000000000000001e-003 | W150: 0.14300000000000002 | X150: 0.13100000000000001 | Y150: 42 | Z150: 2.5 | AA150: -3.4000000000000002e-003 | AB150: -1.0800000000000001e-002 | AC150: -4.99e-002 | AD150: -5.3499999999999999e-002 | AE150: 89.73 | AF150: 92.93 | AG150: 0.51 | AH150: AA- | AI150: 5.7800000000000004e-002 | AJ150: =H150+100*O150 -> 157.34 | AK150: 154.2 | AL150: 109 | AM150: 61.3 | AN150: 144 | AO150: -6.9000000000000006e-002 | AP150: 11 | AQ150: 荣泰转债
A151: 150 | B151: 123073 | C151: 同和转债!! | D151: 300636 | E151: 同和药业 | F151: 医药 | G151: 原料药 | H151: 150.05 | I151: 3.4700000000000002e-002 | J151: 2.0899999999999998e-002 | K151: 21.24 | L151: 6.7299999999999999e-002 | M151: 121.9 | N151: 14.82 | O151: 4.7e-002 | P151: 143.32 | Q151: 已到 | R151: 4.71年 | S151: 2.71年 | T151: 3.58 | U151: 274 | V151: 0.499 | W151: 8.199999999999999e-002 | X151: 0.11699999999999999 | Y151: 44 | Z151: 5.32 | AA151: -4.3700000000000003e-002 | AB151: -5.0999999999999997e-002 | AC151: -0.114 | AD151: -0.11699999999999999 | AE151: 87.36 | AF151: 89.56 | AG151: 0.83 | AH151: A+ | AI151: 6.88e-002 | AJ151: =H151+100*O151 -> 154.75 | AK151: 156.8 | AL151: 132 | AM151: 67.2 | AN151: 183 | AO151: -7.2000000000000008e-002 | AP151: 13 | AQ151: 同和转债!!
A152: 151 | B152: 113605 | C152: 大参转债! | D152: 603233 | E152: 大参林 | F152: 医药 | G152: 医药商业 | H152: 115.53 | I152: -2.8000000000000004e-003 | J152: 1.1000000000000001e-003 | K152: 37 | L152: -2.76e-002 | M152: 114.9 | N152: 69.05 | O152: 1.1599999999999999 | P152: 53.58 | Q152: 已到 | R152: 4.70年 | S152: 2.70年 | T152: 14 | U152: 13 | V152: 8.0000000000000002e-003 | W152: 4.8000000000000001e-002 | X152: 2.6000000000000002e-002 | Y152: 293 | Z152: 5.5 | AA152: -1.1999999999999999e-003 | AB152: -6.8000000000000005e-003 | AC152: -3.2799999999999996e-002 | AD152: -3.6000000000000004e-002 | AE152: 94.37 | AF152: 97.17 | AG152: 0.06 | AH152: AA | AI152: 3.6799999999999999e-002 | AJ152: =H152+100*O152 -> 231.52999999999997 | AK152: 177.5 | AL152: 290 | AM152: 80.3 | AN152: 272 | AO152: -0.111 | AP152: 8 | AQ152: 大参转债!
A153: 152 | B153: 123071 | C153: 天能转债!! | D153: 300569 | E153: 天能重工 | F153: 能源电力 | G153: 风能 | H153: 203 | I153: 5.9200000000000003e-002 | J153: 3.8599999999999995e-002 | K153: 13.98 | L153: 0.107 | M153: 120.7 | N153: 7.91 | O153: 0.14899999999999999 | P153: 176.74 | Q153: 已到 | R153: 4.70年 | S153: 2.70年 | T153: 6.94 | U153: 1661. | V153: 1.1499999999999999 | W153: 6.2e-002 | X153: 0.11 | Y153: 111 | Z153: 3.17 | AA153: -0.106 | AB153: -0.11199999999999999 | AC153: -0.13200000000000001 | AD153: -0.13400000000000001 | AE153: 89.94 | AF153: 93.05 | AG153: 0.91 | AH153: AA- | AI153: 5.7800000000000004e-002 | AJ153: =H153+100*O153 -> 217.90000000000001 | AK153: 229.3 | AL153: 351 | AM153: 136.2 | AN153: 352 | AO153: 6.3e-002 | AP153: 12 | AQ153: 天能转债!!
A154: 153 | B154: 123072 | C154: 乐歌转债! | D154: 300729 | E154: 乐歌股份 | F154: 其他 | G154: 家居用品 | H154: 121.695 | I154: 4.7999999999999996e-003 | J154: -1.2999999999999999e-003 | K154: 24.25 | L154: 3.85e-002 | M154: 129.1 | N154: 49.24 | O154: 1.47 | P154: 49.25 | Q154: 已到 | R154: 4.70年 | S154: 2.70年 | T154: 1.42 | U154: 31 | V154: 0.17999999999999999 | W154: 2.7000000000000003e-002 | X154: 1.3000000000000001e-002 | Y154: 54 | Z154: 2.96 | AA154: 1.3000000000000001e-002 | AB154: 2.8000000000000004e-003 | AC154: -3.6900000000000002e-002 | AD154: -4.2699999999999995e-002 | AE154: 90.3 | AF154: 95.21 | AG154: 0.09 | AH154: A+ | AI154: 6.88e-002 | AJ154: =H154+100*O154 -> 268.69499999999999 | AK154: 194.1 | AL154: 331 | AM154: 98.9 | AN154: 326 | AO154: -9.4e-002 | AP154: 11 | AQ154: 乐歌转债!
A155: 154 | B155: 123070 | C155: 鹏辉转债! | D155: 300438 | E155: 鹏辉能源 | F155: 汽车 | G155: 零部件制 | H155: 218.944 | I155: -7.2300000000000003e-002 | J155: 1.67e-002 | K155: 39.32 | L155: -5.7999999999999996e-002 | M155: 114.8 | N155: 20.08 | O155: 0.11800000000000001 | P155: 195.82 | Q155: 已到 | R155: 4.70年 | S155: 2.70年 | T155: 5.99 | U155: 670 | V155: 0.48499999999999999 | W155: 3.5000000000000003e-002 | X155: 6.9000000000000006e-002 | Y155: 170 | Z155: 6.53 | AA155: -0.13 | AB155: -0.13400000000000001 | AC155: -0.14499999999999999 | AD155: -0.14599999999999999 | AE155: 94.39 | AF155: 97.09 | AG155: 0.96 | AH155: AA | AI155: 3.6799999999999999e-002 | AJ155: =H155+100*O155 -> 230.744 | AK155: 242.1 | AL155: 356 | AM155: 145 | AN155: 356 | AO155: -7.5999999999999998e-002 | AP155: 8 | AQ155: 鹏辉转债!
A156: 155 | B156: 128135 | C156: 洽洽转债! | D156: 2557 | E156: 洽洽食品 | F156: 食品饮料 | G156: 休闲食品 | H156: 128.046 | I156: -2.8000000000000004e-003 | J156: -1.1999999999999999e-003 | K156: 54.73 | L156: -9.7999999999999997e-003 | M156: 119.9 | N156: 60.03 | O156: 0.40399999999999997 | P156: 91.17 | Q156: 已到 | R156: 4.70年 | S156: 2.70年 | T156: 13.4 | U156: 2.4 | V156: 1.e-003 | W156: 4.8000000000000001e-002 | X156: 4.4000000000000004e-002 | Y156: 277 | Z156: 6.36 | AA156: -1.41e-002 | AB156: -2.1099999999999997e-002 | AC156: -6.7500000000000004e-002 | AD156: -7.0499999999999993e-002 | AE156: 94.39 | AF156: 101.4 | AG156: 0.4 | AH156: AA | AI156: 3.6799999999999999e-002 | AJ156: =H156+100*O156 -> 168.446 | AK156: 164.9 | AL156: 212 | AM156: 63.5 | AN156: 157 | AO156: -4.2999999999999997e-002 | AP156: 11 | AQ156: 洽洽转债!
A157: 156 | B157: 127022 | C157: 恒逸转债 | D157: 703 | E157: 恒逸石化 | F157: 化工 | G157: 化工 | H157: 126.467 | I157: 2.7000000000000001e-003 | J157: -3.5999999999999999e-003 | K157: 10.1 | L157: -2.e-003 | M157: 108.7 | N157: 11.2 | O157: 0.40200000000000002 | P157: 90.18 | Q157: 已到 | R157: 4.69年 | S157: 2.69年 | T157: 20 | U157: 1.4 | V157: 1.e-003 | W157: 5.4000000000000006e-002 | X157: 4.9000000000000002e-002 | Y157: 370 | Z157: 1.43 | AA157: -3.2000000000000001e-002 | AB157: -3.5299999999999998e-002 | AC157: -6.7199999999999996e-002 | AD157: -6.9599999999999995e-002 | AE157: 94.73 | AF157: 93.99 | AG157: 0.46 | AH157: AA+ | AI157: 3.1800000000000002e-002 | AJ157: =H157+100*O157 -> 166.667 | AK157: 162.8 | AL157: 194 | AM157: 68 | AN157: 189 | AO157: -4.0000000000000001e-002 | AP157: 6 | AQ157: 恒逸转债
A158: 157 | B158: 110075 | C158: 南航转债 | D158: 600029 | E158: 南方航空 | F158: 交通运输 | G158: 航空运输 | H158: 139.77 | I158: 6.0000000000000001e-003 | J158: 4.6999999999999993e-003 | K158: 7.33 | L158: 1.52e-002 | M158: 109.8 | N158: 6.24 | O158: 0.19 | P158: 117.47 | Q158: 已到 | R158: 4.68年 | S158: 2.68年 | T158: 59 | U158: 118 | V158: 1.3999999999999999e-002 | W158: 4.7e-002 | X158: 5.5999999999999994e-002 | Y158: 1242. | Z158: 1.69 | AA158: -5.0499999999999996e-002 | AB158: -5.4100000000000002e-002 | AC158: -0.10099999999999999 | AD158: -0.10199999999999999 | AE158: 94.88 | AF158: 95.78 | AG158: 0.7 | AH158: AAA | AI158: 2.98e-002 | AJ158: =H158+100*O158 -> 158.77000000000001 | AK158: 162.1 | AL158: 185 | AM158: 66.3 | AN158: 176 | AO158: 3.2000000000000001e-002 | AP158: 8 | AQ158: 南航转债
A159: 158 | B159: 113604 | C159: 多伦转债! | D159: 603528 | E159: 多伦科技 | F159: 计算机及 | G159: 软件开发 | H159: 110 | I159: 5.6000000000000008e-003 | J159: -3.2000000000000002e-003 | K159: 6.5 | L159: 1.09e-002 | M159: 116.9 | N159: 10.4 | O159: 0.76000000000000001 | P159: 62.5 | Q159: 已到 | R159: 4.68年 | S159: 2.68年 | T159: 6.4 | U159: 2.3 | V159: 3.0000000000000001e-003 | W159: 0.157 | X159: 9.8000000000000004e-002 | Y159: 41 | Z159: 2.49 | AA159: 1.3300000000000001e-002 | AB159: 6.8000000000000005e-003 | AC159: -1.6e-002 | AD159: -1.9400000000000001e-002 | AE159: 89.28 | AF159: 90.21 | AG159: 0.22 | AH159: AA- | AI159: 5.7800000000000004e-002 | AJ159: =H159+100*O159 -> 186. | AK159: 157.5 | AL159: 139 | AM159: 67.3 | AN159: 184 | AO159: -7.2999999999999995e-002 | AP159: 16 | AQ159: 多伦转债!
A160: 159 | B160: 128134 | C160: 鸿路转债! | D160: 2541 | E160: 鸿路钢构 | F160: 建筑 | G160: 其他建材 | H160: 149 | I160: -1.26e-002 | J160: -4.5999999999999999e-003 | K160: 49.11 | L160: -2.58e-002 | M160: 114.8 | N160: 43.51 | O160: 0.32000000000000001 | P160: 112.87 | Q160: 已到 | R160: 4.67年 | S160: 2.67年 | T160: 15.7 | U160: 13 | V160: 6.0000000000000001e-003 | W160: 5.9999999999999998e-002 | X160: 6.8000000000000005e-002 | Y160: 261 | Z160: 3.92 | AA160: -5.4900000000000004e-002 | AB160: -6.0100000000000001e-002 | AC160: -0.11599999999999999 | AD160: -0.11900000000000001 | AE160: 94.49 | AF160: 97.19 | AG160: 0.67 | AH160: AA | AI160: 3.6799999999999999e-002 | AJ160: =H160+100*O160 -> 181. | AK160: 185.1 | AL160: 313 | AM160: 87.9 | AN160: 300 | AO160: -6.3e-002 | AP160: 4 | AQ160: 鸿路转债!
A161: 160 | B161: 128133 | C161: 奇正转债! | D161: 2287 | E161: 奇正藏药 | F161: 医药 | G161: 中药 | H161: 119.68 | I161: 1.5100000000000001e-002 | J161: -9.4999999999999998e-003 | K161: 25.26 | L161: 1.5700000000000002e-002 | M161: 116.9 | N161: 29.79 | O161: 0.41100000000000003 | P161: 84.79 | Q161: 已到 | R161: 4.62年 | S161: 2.62年 | T161: 8 | U161: 15 | V161: 1.6e-002 | W161: 5.9999999999999998e-002 | X161: 5.0999999999999997e-002 | Y161: 134 | Z161: 4.53 | AA161: -5.1000000000000004e-003 | AB161: -1.15e-002 | AC161: -4.6100000000000002e-002 | AD161: -4.9400000000000006e-002 | AE161: 94.65 | AF161: 99.15 | AG161: 0.36 | AH161: AA | AI161: 3.6799999999999999e-002 | AJ161: =H161+100*O161 -> 160.78 | AK161: 154.6 | AL161: 113 | AM161: 55.4 | AN161: 95 | AO161: -0.11199999999999999 | AP161: 20 | AQ161: 奇正转债!
A162: 161 | B162: 123067 | C162: 斯莱转债! | D162: 300382 | E162: 斯莱克 | F162: 机械装备 | G162: 专用设备 | H162: 246.21 | I162: -4.9699999999999994e-002 | J162: -3.0999999999999999e-003 | K162: 20.01 | L162: -5.5199999999999999e-002 | M162: 120.8 | N162: 9.36 | O162: 0.152 | P162: 213.78 | Q162: 已到 | R162: 4.61年 | S162: 2.61年 | T162: 2.4 | U162: 82 | V162: 0.13500000000000001 | W162: 2.1000000000000001e-002 | X162: 4.4000000000000004e-002 | Y162: 116 | Z162: 10.06 | AA162: -0.14499999999999999 | AB162: -0.151 | AC162: -0.16699999999999998 | AD162: -0.16800000000000001 | AE162: 90.32 | AF162: 93.64 | AG162: 0.96 | AH162: AA- | AI162: 5.7800000000000004e-002 | AJ162: =H162+100*O162 -> 261.41000000000003 | AK162: 278.6 | AL162: 367 | AM162: 185 | AN162: 368 | AO162: -8.3000000000000004e-002 | AP162: 11 | AQ162: 斯莱转债!
A163: 162 | B163: 128132 | C163: 交建转债! | D163: 2941 | E163: 新疆交建 | F163: 建筑 | G163: 建筑工程 | H163: 112.198 | I163: 4.5000000000000005e-003 | J163: -5.5000000000000005e-003 | K163: 11.4 | L163: -9.5999999999999992e-003 | M163: 116.9 | N163: 18.53 | O163: 0.82400000000000007 | P163: 61.52 | Q163: 已到 | R163: 4.60年 | S163: 2.60年 | T163: 8.49 | U163: 5.2 | V163: 5.0000000000000001e-003 | W163: 0.115 | X163: 7.0999999999999994e-002 | Y163: 74 | Z163: 2.84 | AA163: 9.1000000000000004e-003 | AB163: 2.5999999999999999e-003 | AC163: -2.3599999999999999e-002 | AD163: -2.7000000000000003e-002 | AE163: 94.72 | AF163: 99.22 | AG163: 0.11 | AH163: AA | AI163: 3.6799999999999999e-002 | AJ163: =H163+100*O163 -> 194.59800000000001 | AK163: 162.9 | AL163: 195 | AM163: 63.7 | AN163: 158 | AO163: -7.0999999999999994e-002 | AP163: 29 | AQ163: 交建转债!
A164: 163 | B164: 128131 | C164: 崇达转2! | D164: 2815 | E164: 崇达技术 | F164: 电子 | G164: 元器件制 | H164: 120.577 | I164: -1.1699999999999999e-002 | J164: -3.0000000000000001e-003 | K164: 13.36 | L164: -7.9299999999999995e-002 | M164: 114.9 | N164: 19.38 | O164: 0.74900000000000011 | P164: 68.94 | Q164: 已到 | R164: 4.58年 | S164: 2.58年 | T164: 14 | U164: 2.1 | V164: 1.e-003 | W164: 0.12 | X164: 8.199999999999999e-002 | Y164: 117 | Z164: 2.72 | AA164: -1.06e-002 | AB164: -1.6299999999999999e-002 | AC164: -4.9400000000000006e-002 | AD164: -5.2699999999999997e-002 | AE164: 94.79 | AF164: 97.6 | AG164: 0.19 | AH164: AA | AI164: 3.6799999999999999e-002 | AJ164: =H164+100*O164 -> 195.477 | AK164: 172.2 | AL164: 260 | AM164: 74.6 | AN164: 240 | AO164: -0.16300000000000001 | AP164: 11 | AQ164: 崇达转2!
A165: 164 | B165: 123065 | C165: 宝莱转债! | D165: 300246 | E165: 宝莱特 | F165: 医药 | G165: 医疗器械 | H165: 114.66 | I165: 3.0999999999999999e-003 | J165: -2.0000000000000001e-004 | K165: 18.85 | L165: 4.9000000000000002e-002 | M165: 121 | N165: 40.14 | O165: 1.4399999999999999 | P165: 46.96 | Q165: 已到 | R165: 4.57年 | S165: 2.57年 | T165: 2.19 | U165: 21 | V165: 8.3000000000000004e-002 | W165: 7.9000000000000001e-002 | X165: 3.7000000000000005e-002 | Y165: 28 | Z165: 3.16 | AA165: 1.2e-002 | AB165: 4.0999999999999995e-003 | AC165: -2.76e-002 | AD165: -3.1800000000000002e-002 | AE165: 90.78 | AF165: 93.99 | AG165: 0.06 | AH165: AA- | AI165: 5.7800000000000004e-002 | AJ165: =H165+100*O165 -> 258.65999999999997 | AK165: 182.4 | AL165: 305 | AM165: 88.4 | AN165: 303 | AO165: -7.2999999999999995e-002 | AP165: 24 | AQ165: 宝莱转债!
A166: 165 | B166: 123064 | C166: 万孚转债! | D166: 300482 | E166: 万孚生物 | F166: 医药 | G166: 医疗器械 | H166: 126.887 | I166: 1.1000000000000001e-002 | J166: -1.1299999999999999e-002 | K166: 36.6 | L166: -6.5000000000000006e-003 | M166: 114.8 | N166: 71.65 | O166: 1.48 | P166: 51.08 | Q166: 已到 | R166: 4.56年 | S166: 2.56年 | T166: 5.99 | U166: 13 | V166: 1.7000000000000001e-002 | W166: 3.7000000000000005e-002 | X166: 1.9e-002 | Y166: 163 | Z166: 5.08 | AA166: -2.2000000000000002e-002 | AB166: -2.75e-002 | AC166: -6.7900000000000002e-002 | AD166: -7.0999999999999994e-002 | AE166: 94.85 | AF166: 97.56 | AG166: 0.05 | AH166: AA | AI166: 3.6799999999999999e-002 | AJ166: =H166+100*O166 -> 274.887 | AK166: 202.7 | AL166: 337 | AM166: 105.1 | AN166: 334 | AO166: -0.158 | AP166: 14 | AQ166: 万孚转债!
A167: 166 | B167: 128130 | C167: 景兴转债 | D167: 2067 | E167: 景兴纸业 | F167: 造纸包装 | G167: 包装用纸 | H167: 127.708 | I167: 1.61e-002 | J167: -5.8999999999999999e-003 | K167: 3.78 | L167: 1.61e-002 | M167: 114.8 | N167: 3.4 | O167: 0.14899999999999999 | P167: 111.18 | Q167: 已到 | R167: 4.56年 | S167: 2.56年 | T167: 9.99 | U167: 40 | V167: 3.2000000000000001e-002 | W167: 0.221 | X167: 0.24600000000000002 | Y167: 45 | Z167: 0.86 | AA167: -2.3399999999999997e-002 | AB167: -2.8900000000000002e-002 | AC167: -7.0199999999999999e-002 | AD167: -7.3300000000000004e-002 | AE167: 94.86 | AF167: 97.57 | AG167: 0.63 | AH167: AA | AI167: 3.6799999999999999e-002 | AJ167: =H167+100*O167 -> 142.608 | AK167: 144.2 | AL167: 33 | AM167: 46.7 | AN167: 40 | AO167: -5.2000000000000005e-002 | AP167: 20 | AQ167: 景兴转债
A168: 167 | B168: 128129 | C168: 青农转债! | D168: 2958 | E168: 青农商行 | F168: 金融 | G168: 银行行业 | H168: 112.25 | I168: -4.0000000000000001e-003 | J168: 0. | K168: 3.74 | L168: -1.06e-002 | M168: 112 | N168: 4.32 | O168: 0.29699999999999999 | P168: 86.57 | Q168: 已到 | R168: 4.54年 | S168: 无权 | T168: 50 | U168: 16 | V168: 3.0000000000000001e-003 | W168: 0.24100000000000002 | X168: 0.20800000000000002 | Y168: 208 | Z168: 0.73 | AA168: -5.0000000000000001e-004 | AB168: -5.3e-003 | AC168: 无权 | AD168: 无权 | AE168: 无权 | AF168: 98.14 | AG168: 0.38 | AH168: AAA | AI168: 2.98e-002 | AJ168: =H168+100*O168 -> 141.94999999999999 | AK168: 137.9 | AL168: 11 | AM168: 39.8 | AN168: 18 | AO168: -4.0999999999999995e-002 | AP168: 28 | AQ168: 青农转债!
A169: 168 | B169: 113602 | C169: 景20转债! | D169: 603228 | E169: 景旺电子 | F169: 电子 | G169: 元器件制 | H169: 142.16 | I169: 6.3e-003 | J169: -2.e-002 | K169: 33.81 | L169: -1.8000000000000002e-002 | M169: 112.9 | N169: 27.4 | O169: 0.152 | P169: 123.39 | Q169: 已到 | R169: 4.54年 | S169: 2.54年 | T169: 17.8 | U169: 74 | V169: 2.8999999999999998e-002 | W169: 6.2e-002 | X169: 7.5999999999999998e-002 | Y169: 288 | Z169: 4.27 | AA169: -5.0099999999999999e-002 | AB169: -5.4800000000000001e-002 | AC169: -0.106 | AD169: -0.109 | AE169: 94.93 | AF169: 96.04 | AG169: 0.76 | AH169: AA | AI169: 3.6799999999999999e-002 | AJ169: =H169+100*O169 -> 157.35999999999999 | AK169: 160.9 | AL169: 170 | AM169: 64.9 | AN169: 166 | AO169: 1.1000000000000001e-002 | AP169: 9 | AQ169: 景20转债!
A170: 169 | B170: 113039 | C170: 嘉泽转债!! | D170: 601619 | E170: 嘉泽新能 | F170: 能源电力 | G170: 风能 | H170: 146.26 | I170: 3.7000000000000002e-003 | J170: 5.1999999999999998e-003 | K170: 4.34 | L170: 1.1699999999999999e-002 | M170: 112.8 | N170: 3.46 | O170: 0.16600000000000001 | P170: 125.43 | Q170: 已到 | R170: 4.54年 | S170: 2.54年 | T170: 2.88 | U170: 45 | V170: 0.106 | W170: 2.7000000000000003e-002 | X170: 3.4000000000000002e-002 | Y170: 106 | Z170: 2.21 | AA170: -5.62e-002 | AB170: -6.08e-002 | AC170: -0.11599999999999999 | AD170: -0.11800000000000001 | AE170: 94.93 | AF170: 95.94 | AG170: 0.76 | AH170: AA | AI170: 3.6799999999999999e-002 | AJ170: =H170+100*O170 -> 162.85999999999999 | AK170: 167.1 | AL170: 229 | AM170: 71.1 | AN170: 215 | AO170: -7.4999999999999997e-002 | AP170: 32 | AQ170: 嘉泽转债!!
A171: 170 | B171: 113601 | C171: 塞力转债! | D171: 603716 | E171: 塞力医疗 | F171: 医药 | G171: 医药商业 | H171: 120.89 | I171: 1.1899999999999999e-002 | J171: 1.26e-002 | K171: 15.81 | L171: 4.7699999999999992e-002 | M171: 120.8 | N171: 16.98 | O171: 0.29799999999999999 | P171: 93.11 | Q171: 已到 | R171: 4.53年 | S171: 2.53年 | T171: 5.43 | U171: 1144. | V171: 1.72 | W171: 0.16800000000000001 | X171: 0.156 | Y171: 32 | Z171: 2.13 | AA171: -2.0000000000000001e-004 | AB171: -8.0000000000000002e-003 | AC171: -4.7899999999999998e-002 | AD171: -5.1900000000000002e-002 | AE171: 90.7 | AF171: 94.03 | AG171: 0.51 | AH171: AA- | AI171: 5.7800000000000004e-002 | AJ171: =H171+100*O171 -> 150.69 | AK171: 148.7 | AL171: 63 | AM171: 54.6 | AN171: 90 | AO171: -9.1999999999999998e-002 | AP171: 39 | AQ171: 塞力转债!
A172: 171 | B172: 128128 | C172: 齐翔转2! | D172: 2408 | E172: 齐翔腾达 | F172: 化工 | G172: 化工 | H172: 175.2 | I172: -5.4000000000000003e-003 | J172: -9.8999999999999991e-003 | K172: 9.22 | L172: -1.7100000000000001e-002 | M172: 115 | N172: 5.69 | O172: 8.1000000000000003e-002 | P172: 162.04 | Q172: 已到 | R172: 4.53年 | S172: 2.53年 | T172: 6.81 | U172: 37 | V172: 3.1e-002 | W172: 2.6000000000000002e-002 | X172: 4.2000000000000003e-002 | Y172: 262 | Z172: 2.11 | AA172: -8.9700000000000002e-002 | AB172: -9.4800000000000009e-002 | AC172: -0.12 | AD172: -0.121 | AE172: 95.07 | AF172: 97.86 | AG172: 0.9 | AH172: AA | AI172: 3.6799999999999999e-002 | AJ172: =H172+100*O172 -> 183.29999999999998 | AK172: 188.4 | AL172: 320 | AM172: 90.5 | AN172: 306 | AO172: -0.10199999999999999 | AP172: 25 | AQ172: 齐翔转2!
A173: 172 | B173: 128127 | C173: 文科转债! | D173: 2775 | E173: 文科园林 | F173: 城市公用 | G173: 生态环境 | H173: 109.994 | I173: 3.7000000000000002e-003 | J173: 6.5000000000000006e-003 | K173: 3.81 | L173: 2.7000000000000003e-002 | M173: 120.8 | N173: 4.88 | O173: 0.40899999999999997 | P173: 78.07 | Q173: 已到 | R173: 4.53年 | S173: 2.53年 | T173: 9.49 | U173: 12 | V173: 1.1000000000000001e-002 | W173: 0.48599999999999999 | X173: 0.379 | Y173: 20 | Z173: 0.91 | AA173: 2.12e-002 | AB173: 1.32e-002 | AC173: -1.34e-002 | AD173: -1.7600000000000001e-002 | AE173: 90.72 | AF173: 94.05 | AG173: 0.38 | AH173: AA- | AI173: 5.7800000000000004e-002 | AJ173: =H173+100*O173 -> 150.89400000000001 | AK173: 141.9 | AL173: 24 | AM173: 47.9 | AN173: 47 | AO173: -5.5e-002 | AP173: 79 | AQ173: 文科转债!
A174: 173 | B174: 110074 | C174: 精达转债!! | D174: 600577 | E174: 精达股份 | F174: 电子 | G174: 电子产品 | H174: 213.35 | I174: 1.4199999999999999e-002 | J174: -3.4000000000000002e-002 | K174: 6.28 | L174: -2.18e-002 | M174: 116.9 | N174: 3.73 | O174: 0.26700000000000002 | P174: 168.36 | Q174: 已到 | R174: 4.53年 | S174: 2.53年 | T174: 5.1 | U174: 220 | V174: 0.20899999999999999 | W174: 4.0999999999999995e-002 | X174: 6.8000000000000005e-002 | Y174: 125 | Z174: 2.9 | AA174: -0.126 | AB174: -0.13100000000000001 | AC174: -0.154 | AD174: -0.155 | AE174: 94.97 | AF174: 99.48 | AG174: 0.91 | AH174: AA | AI174: 3.6799999999999999e-002 | AJ174: =H174+100*O174 -> 240.05000000000001 | AK174: 258.3 | AL174: 360 | AM174: 158.9 | AN174: 360 | AO174: -0.11699999999999999 | AP174: 10 | AQ174: 精达转债!!
A175: 174 | B175: 110072 | C175: 广汇转债! | D175: 600297 | E175: 广汇汽车 | F175: 汽车 | G175: 分销、售 | H175: 101.8 | I175: 4.4000000000000003e-003 | J175: -4.4000000000000003e-003 | K175: 2.51 | L175: 0. | M175: 114.3 | N175: 4.03 | O175: 0.63400000000000001 | P175: 62.28 | Q175: 已到 | R175: 4.52年 | S175: 2.52年 | T175: 33.7 | U175: 21 | V175: 6.0000000000000001e-003 | W175: 0.16500000000000001 | X175: 0.10300000000000001 | Y175: 204 | Z175: 0.5 | AA175: 2.6200000000000001e-002 | AB175: 2.0299999999999999e-002 | AC175: 1.01e-002 | AD175: 6.8000000000000005e-003 | AE175: 95.82 | AF175: 99.35 | AG175: 0.11 | AH175: AA+ | AI175: 3.1800000000000002e-002 | AJ175: =H175+100*O175 -> 165.19999999999999 | AK175: 141.3 | AL175: 21 | AM175: 42 | AN175: 23 | AO175: -6.3e-002 | AP175: 86 | AQ175: 广汇转债!
A176: 175 | B176: 113600 | C176: 新星转债!! | D176: 603978 | E176: 深圳新星 | F176: 有色金属 | G176: 有色行业 | H176: 130.16 | I176: 1.3899999999999999e-002 | J176: -3.2000000000000002e-003 | K176: 23.2 | L176: 2.1099999999999997e-002 | M176: 125.6 | N176: 23.85 | O176: 0.33799999999999997 | P176: 97.27 | Q176: 已到 | R176: 4.51年 | S176: 2.51年 | T176: 4.53 | U176: 22 | V176: 3.7000000000000005e-002 | W176: 0.11800000000000001 | X176: 0.115 | Y176: 38 | Z176: 2.44 | AA176: -8.0000000000000002e-003 | AB176: -1.7100000000000001e-002 | AC176: -7.5199999999999989e-002 | AD176: -7.8899999999999998e-002 | AE176: 90.81 | AF176: 97.83 | AG176: 0.51 | AH176: AA- | AI176: 5.7800000000000004e-002 | AJ176: =H176+100*O176 -> 163.95999999999998 | AK176: 163 | AL176: 196 | AM176: 65.2 | AN176: 170 | AO176: -0.10099999999999999 | AP176: 23 | AQ176: 新星转债!!
A177: 176 | B177: 127021 | C177: 特发转2! | D177: 70 | E177: 特发信息 | F177: 通信互联 | G177: 通信设备 | H177: 123.404 | I177: -3.4000000000000002e-003 | J177: 8.8999999999999999e-003 | K177: 6.1 | L177: 1.84e-002 | M177: 113 | N177: 7.33 | O177: 0.48299999999999998 | P177: 83.22 | Q177: 已到 | R177: 3.49年 | S177: 1.49年 | T177: 4.16 | U177: 1.9 | V177: 4.0000000000000001e-003 | W177: 8.1000000000000003e-002 | X177: 6.7000000000000004e-002 | Y177: 52 | Z177: 1.74 | AA177: -2.5000000000000001e-002 | AB177: -3.1400000000000004e-002 | AC177: -0.10300000000000001 | AD177: -0.106 | AE177: 96.76 | AF177: 99.66 | AG177: 0.3 | AH177: AA | AI177: 3.6799999999999999e-002 | AJ177: =H177+100*O177 -> 171.70400000000001 | AK177: 163.6 | AL177: 206 | AM177: 63.9 | AN177: 161 | AO177: -5.9000000000000004e-002 | AP177: 16 | AQ177: 特发转2!
A178: 177 | B178: 113599 | C178: 嘉友转债! | D178: 603871 | E178: 嘉友国际 | F178: 交通运输 | G178: 物流业 | H178: 132.38 | I178: 2.e-003 | J178: -5.0000000000000001e-003 | K178: 19.32 | L178: -5.1000000000000004e-003 | M178: 125.6 | N178: 18.32 | O178: 0.255 | P178: 105.46 | Q178: 已到 | R178: 4.49年 | S178: 2.49年 | T178: 7.2 | U178: 31 | V178: 3.2000000000000001e-002 | W178: 0.11800000000000001 | X178: 0.124 | Y178: 61 | Z178: 2.64 | AA178: -1.18e-002 | AB178: -2.1000000000000001e-002 | AC178: -8.1799999999999998e-002 | AD178: -8.539999999999999e-002 | AE178: 90.92 | AF178: 97.95 | AG178: 0.57 | AH178: AA- | AI178: 5.7800000000000004e-002 | AJ178: =H178+100*O178 -> 157.88 | AK178: 159.3 | AL178: 154 | AM178: 61.4 | AN178: 146 | AO178: -9.6000000000000002e-002 | AP178: 17 | AQ178: 嘉友转债!
A179: 178 | B179: 113598 | C179: 法兰转债 | D179: 603966 | E179: 法兰泰克 | F179: 机械装备 | G179: 工程机械 | H179: 121.45 | I179: 1.4499999999999999e-002 | J179: 5.6000000000000008e-003 | K179: 9.12 | L179: 3.8699999999999998e-002 | M179: 120.8 | N179: 9.7 | O179: 0.29199999999999998 | P179: 94.02 | Q179: 已到 | R179: 4.48年 | S179: 2.48年 | T179: 2.75 | U179: 9.1 | V179: 2.7000000000000003e-002 | W179: 0.10099999999999999 | X179: 9.4e-002 | Y179: 27 | Z179: 2.19 | AA179: -1.1999999999999999e-003 | AB179: -9.1000000000000004e-003 | AC179: -5.0700000000000002e-002 | AD179: -5.4699999999999999e-002 | AE179: 90.99 | AF179: 94.34 | AG179: 0.52 | AH179: AA- | AI179: 5.7800000000000004e-002 | AJ179: =H179+100*O179 -> 150.65000000000001 | AK179: 148.9 | AL179: 66 | AM179: 54.5 | AN179: 88 | AO179: -6.4000000000000001e-002 | AP179: 13 | AQ179: 法兰转债
A180: 179 | B180: 128125 | C180: 华阳转债! | D180: 2949 | E180: 华阳国际 | F180: 建筑 | G180: 建筑工程 | H180: 119.121 | I180: -7.3000000000000001e-003 | J180: 1.8e-003 | K180: 17.66 | L180: -1.9400000000000001e-002 | M180: 118.1 | N180: 25.39 | O180: 0.71299999999999997 | P180: 69.55 | Q180: 已到 | R180: 4.47年 | S180: 2.47年 | T180: 4.5 | U180: 12 | V180: 2.3e-002 | W180: 0.13 | X180: 8.9999999999999997e-002 | Y180: 35 | Z180: 2.57 | AA180: -1.9e-003 | AB180: -8.8999999999999999e-003 | AC180: -4.6199999999999998e-002 | AD180: -4.9800000000000004e-002 | AE180: 90.52 | AF180: 92.19 | AG180: 0.28 | AH180: AA- | AI180: 5.7800000000000004e-002 | AJ180: =H180+100*O180 -> 190.42099999999999 | AK180: 168.7 | AL180: 238 | AM180: 76.5 | AN180: 254 | AO180: -8.0000000000000002e-002 | AP180: 14 | AQ180: 华阳转债!
A181: 180 | B181: 113597 | C181: 佳力转债! | D181: 603912 | E181: 佳力图 | F181: 机械装备 | G181: 专用设备 | H181: 115.19 | I181: -1.1999999999999999e-003 | J181: -2.3e-003 | K181: 13.86 | L181: -2.3300000000000001e-002 | M181: 124 | N181: 23.15 | O181: 0.92400000000000004 | P181: 59.87 | Q181: 已到 | R181: 4.47年 | S181: 2.47年 | T181: 3 | U181: 86 | V181: 0.248 | W181: 0.10000000000000001 | X181: 5.9999999999999998e-002 | Y181: 30 | Z181: 3.14 | AA181: 1.6899999999999998e-002 | AB181: 7.8000000000000005e-003 | AC181: -3.04e-002 | AD181: -3.4700000000000002e-002 | AE181: 91.28 | AF181: 96.85 | AG181: 0.15 | AH181: AA- | AI181: 5.7800000000000004e-002 | AJ181: =H181+100*O181 -> 207.59 | AK181: 170.5 | AL181: 250 | AM181: 73.7 | AN181: 229 | AO181: -3.6000000000000004e-002 | AP181: 22 | AQ181: 佳力转债!
A182: 181 | B182: 123063 | C182: 大禹转债 | D182: 300021 | E182: 大禹节水 | F182: 化工 | G182: 橡胶塑料 | H182: 136.4 | I182: 1.1599999999999999e-002 | J182: 7.6e-003 | K182: 5.66 | L182: 2.9100000000000001e-002 | M182: 126.1 | N182: 4.83 | O182: 0.16399999999999998 | P182: 117.18 | Q182: 已到 | R182: 4.47年 | S182: 3.47年 | T182: 6.35 | U182: 25 | V182: 2.8999999999999998e-002 | W182: 0.14000000000000001 | X182: 0.16399999999999998 | Y182: 45 | Z182: 3.05 | AA182: -1.77e-002 | AB182: -2.7000000000000003e-002 | AC182: -6.0299999999999999e-002 | AD182: -6.4600000000000005e-002 | AE182: 89.3 | AF182: 98.52 | AG182: 0.66 | AH182: AA- | AI182: 5.7800000000000004e-002 | AJ182: =H182+100*O182 -> 152.80000000000001 | AK182: 155.6 | AL182: 122 | AM182: 57.1 | AN182: 109 | AO182: -3.9e-002 | AP182: 20 | AQ182: 大禹转债
A183: 182 | B183: 128124 | C183: 科华转债! | D183: 2022 | E183: 科华生物 | F183: 医药 | G183: 生物制药 | H183: 106.899 | I183: -8.9999999999999998e-004 | J183: 3.2000000000000002e-003 | K183: 12.9 | L183: 1.7399999999999999e-002 | M183: 110 | N183: 21.31 | O183: 0.7659999999999999 | P183: 60.53 | Q183: 已到 | R183: 4.47年 | S183: 2.47年 | T183: 7.38 | U183: 14 | V183: 1.8000000000000002e-002 | W183: 0.111 | X183: 6.7000000000000004e-002 | Y183: 66 | Z183: 1.84 | AA183: 6.5000000000000006e-003 | AB183: 2.3e-003 | AC183: -9.7999999999999997e-003 | AD183: -1.2800000000000001e-002 | AE183: 94.39 | AF183: 93.77 | AG183: 0.13 | AH183: AA | AI183: 3.6799999999999999e-002 | AJ183: =H183+100*O183 -> 183.499 | AK183: 153.3 | AL183: 96 | AM183: 58.9 | AN183: 124 | AO183: -0.14699999999999999 | AP183: 30 | AQ183: 科华转债!
A184: 183 | B184: 113596 | C184: 城地转债! | D184: 603887 | E184: 城地香江 | F184: 通信互联 | G184: 通信设备 | H184: 99.78 | I184: 5.0000000000000001e-004 | J184: -8.9999999999999998e-004 | K184: 8.26 | L184: -0.10000000000000001 | M184: 113.1 | N184: 24.26 | O184: 1.9299999999999999 | P184: 34.05 | Q184: 已到 | R184: 4.47年 | S184: 2.47年 | T184: 12 | U184: 56 | V184: 4.7e-002 | W184: 0.32200000000000001 | X184: 0.11 | Y184: 37 | Z184: 0.99 | AA184: 2.8900000000000002e-002 | AB184: 2.3300000000000001e-002 | AC184: 2.1400000000000002e-002 | AD184: 1.7299999999999999e-002 | AE184: 90.54 | AF184: 88.34 | AG184: 0 | AH184: AA- | AI184: 5.7800000000000004e-002 | AJ184: =H184+100*O184 -> 292.77999999999997 | AK184: 165.5 | AL184: 222 | AM184: 75 | AN184: 244 | AO184: -8.5999999999999993e-002 | AP184: 46 | AQ184: 城地转债!
A185: 184 | B185: 123062 | C185: 三超转债 | D185: 300554 | E185: 三超新材 | F185: 机械装备 | G185: 通用设备 | H185: 121.5 | I185: 1.2800000000000001e-002 | J185: 9.1000000000000004e-003 | K185: 15.91 | L185: 3.5799999999999998e-002 | M185: 119.2 | N185: 17.13 | O185: 0.308 | P185: 92.88 | Q185: 已到 | R185: 4.46年 | S185: 2.46年 | T185: 1.95 | U185: 15 | V185: 6.4000000000000001e-002 | W185: 0.13100000000000001 | X185: 0.121 | Y185: 15 | Z185: 2.84 | AA185: -4.3e-003 | AB185: -1.1699999999999999e-002 | AC185: -4.9699999999999994e-002 | AD185: -5.4000000000000006e-002 | AE185: 86.97 | AF185: 85.51 | AG185: 0.61 | AH185: A | AI185: 7.8799999999999995e-002 | AJ185: =H185+100*O185 -> 152.30000000000001 | AK185: 150.1 | AL185: 73 | AM185: 63.2 | AN185: 154 | AO185: -5.5e-002 | AP185: 27 | AQ185: 三超转债
A186: 185 | B186: 128123 | C186: 国光转债! | D186: 2749 | E186: 国光股份 | F186: 化工 | G186: 农化 | H186: 112.899 | I186: 1.e-004 | J186: 3.8e-003 | K186: 8.82 | L186: 1.61e-002 | M186: 115.7 | N186: 13.49 | O186: 0.72699999999999998 | P186: 65.38 | Q186: 已到 | R186: 4.46年 | S186: 2.46年 | T186: 3.2 | U186: 2.2 | V186: 6.0000000000000001e-003 | W186: 8.3000000000000004e-002 | X186: 5.4000000000000006e-002 | Y186: 38 | Z186: 2.93 | AA186: 5.6000000000000008e-003 | AB186: -7.000000000000001e-004 | AC186: -2.4e-002 | AD186: -2.8199999999999999e-002 | AE186: 91.05 | AF186: 90.42 | AG186: 0.24 | AH186: AA- | AI186: 5.7800000000000004e-002 | AJ186: =H186+100*O186 -> 185.59899999999999 | AK186: 160.4 | AL186: 165 | AM186: 69.4 | AN186: 202 | AO186: -7.8e-002 | AP186: 16 | AQ186: 国光转债!
A187: 186 | B187: 110073 | C187: 国投转债 | D187: 600061 | E187: 国投资本 | F187: 金融 | G187: 证券行业 | H187: 114.82 | I187: -1.e-004 | J187: -1.7000000000000001e-003 | K187: 7.5 | L187: -6.6e-003 | M187: 110.3 | N187: 9.9 | O187: 0.51600000000000001 | P187: 75.76 | Q187: 已到 | R187: 4.46年 | S187: 无权 | T187: 80 | U187: 20 | V187: 2.e-003 | W187: 0.16600000000000001 | X187: 0.126 | Y187: 482 | Z187: 1.06 | AA187: -9.0000000000000011e-003 | AB187: -1.32e-002 | AC187: 无权 | AD187: 无权 | AE187: 无权 | AF187: 96.86 | AG187: 0.26 | AH187: AAA | AI187: 2.98e-002 | AJ187: =H187+100*O187 -> 166.41999999999999 | AK187: 153.9 | AL187: 103 | AM187: 57 | AN187: 108 | AO187: -6.4000000000000001e-002 | AP187: 23 | AQ187: 国投转债
A188: 187 | B188: 128122 | C188: 兴森转债! | D188: 2436 | E188: 兴森科技 | F188: 电子 | G188: 元器件制 | H188: 129.161 | I188: -1.2999999999999999e-003 | J188: 1.2999999999999999e-003 | K188: 11.95 | L188: 0. | M188: 113 | N188: 14.1 | O188: 0.52400000000000002 | P188: 84.75 | Q188: 已到 | R188: 3.45年 | S188: 2.45年 | T188: 2.69 | U188: 3.5 | V188: 1.e-002 | W188: 1.4999999999999999e-002 | X188: 1.3000000000000001e-002 | Y188: 178 | Z188: 4.96 | AA188: -3.8100000000000002e-002 | AB188: -4.4500000000000005e-002 | AC188: -7.6299999999999993e-002 | AD188: -7.9600000000000004e-002 | AE188: 95.43 | AF188: 99.8 | AG188: 0.31 | AH188: AA | AI188: 3.6799999999999999e-002 | AJ188: =H188+100*O188 -> 181.56100000000001 | AK188: 173.6 | AL188: 269 | AM188: 73.8 | AN188: 230 | AO188: -6.9000000000000006e-002 | AP188: 10 | AQ188: 兴森转债!
A189: 188 | B189: 113037 | C189: 紫银转债! | D189: 601860 | E189: 紫金银行 | F189: 金融 | G189: 银行行业 | H189: 108.81 | I189: -8.0000000000000004e-004 | J189: 0. | K189: 3.16 | L189: -3.2000000000000002e-003 | M189: 115.6 | N189: 4.05 | O189: 0.39500000000000002 | P189: 78.02 | Q189: 已到 | R189: 4.45年 | S189: 无权 | T189: 45 | U189: 39 | V189: 8.0000000000000002e-003 | W189: 0.38900000000000001 | X189: 0.30299999999999999 | Y189: 116 | Z189: 0.75 | AA189: 1.3899999999999999e-002 | AB189: 7.6e-003 | AC189: 无权 | AD189: 无权 | AE189: 无权 | AF189: 100.8 | AG189: 0.27 | AH189: AA+ | AI189: 3.1800000000000002e-002 | AJ189: =H189+100*O189 -> 148.31 | AK189: 139.6 | AL189: 12 | AM189: 38.8 | AN189: 15 | AO189: -4.9000000000000002e-002 | AP189: 32 | AQ189: 紫银转债!
A190: 189 | B190: 123061 | C190: 航新转债! | D190: 300424 | E190: 航新科技 | F190: 航空航天 | G190: 航空航天 | H190: 121.369 | I190: -1.8e-003 | J190: 1.2699999999999999e-002 | K190: 13.43 | L190: 2.1299999999999999e-002 | M190: 124.3 | N190: 14.85 | O190: 0.34200000000000003 | P190: 90.44 | Q190: 已到 | R190: 4.45年 | S190: 2.45年 | T190: 2.5 | U190: 17 | V190: 5.7000000000000002e-002 | W190: 7.6999999999999999e-002 | X190: 7.0000000000000007e-002 | Y190: 32 | Z190: 4.77 | AA190: 5.5000000000000005e-003 | AB190: -3.5999999999999999e-003 | AC190: -4.9299999999999997e-002 | AD190: -5.3699999999999998e-002 | AE190: 89.19 | AF190: 92.96 | AG190: 0.51 | AH190: A+ | AI190: 6.88e-002 | AJ190: =H190+100*O190 -> 155.56900000000002 | AK190: 152.3 | AL190: 87 | AM190: 59.3 | AN190: 131 | AO190: -7.400000000000001e-002 | AP190: 20 | AQ190: 航新转债!
A191: 190 | B191: 123060 | C191: 苏试转债! | D191: 300416 | E191: 苏试试验 | F191: 机械装备 | G191: 专用设备 | H191: 179 | I191: 1.47e-002 | J191: -1.0200000000000001e-002 | K191: 28.66 | L191: 5.3e-003 | M191: 117.2 | N191: 19.05 | O191: 0.19 | P191: 150.45 | Q191: 已到 | R191: 4.45年 | S191: 2.45年 | T191: 3.1 | U191: 79 | V191: 0.14000000000000001 | W191: 3.7999999999999999e-002 | X191: 5.7000000000000002e-002 | Y191: 82 | Z191: 7.46 | AA191: -9.1899999999999996e-002 | AB191: -9.7699999999999995e-002 | AC191: -0.129 | AD191: -0.13100000000000001 | AE191: 90.64 | AF191: 91.64 | AG191: 0.87 | AH191: AA- | AI191: 5.7800000000000004e-002 | AJ191: =H191+100*O191 -> 198. | AK191: 207.6 | AL191: 341 | AM191: 115.9 | AN191: 340 | AO191: -8.6999999999999994e-002 | AP191: 7 | AQ191: 苏试转债!
A192: 191 | B192: 113595 | C192: 花王转债! | D192: 603007 | E192: ST花王 | F192: 城市公用 | G192: 生态环境 | H192: 104.59 | I192: 3.0999999999999999e-003 | J192: -1.5e-003 | K192: 3.13 | L192: 1.95e-002 | M192: 124.8 | N192: 6.92 | O192: 1.3100000000000001 | P192: 45.23 | Q192: 已到 | R192: 4.45年 | S192: 2.45年 | T192: 3.3 | U192: 27 | V192: 8.0000000000000002e-002 | W192: 0.314 | X192: 0.14199999999999999 | Y192: 11 | Z192: 0.98 | AA192: 4.1200000000000001e-002 | AB192: 3.15e-002 | AC192: 5.7999999999999996e-003 | AD192: 1.1999999999999999e-003 | AE192: 78.88 | AF192: 76.43 | AG192: 0.08 | AH192: BBB- | AI192: 0.1188 | AJ192: =H192+100*O192 -> 235.59 | AK192: 163.9 | AL192: 207 | AM192: 85.1 | AN192: 290 | AO192: -6.0999999999999999e-002 | AP192: 51 | AQ192: 花王转债!
A193: 192 | B193: 113594 | C193: 淳中转债! | D193: 603516 | E193: 淳中科技 | F193: 电子 | G193: 电子产品 | H193: 126.23 | I193: 7.7000000000000002e-003 | J193: -4.4000000000000003e-003 | K193: 16.64 | L193: 6.0000000000000001e-003 | M193: 120.9 | N193: 18.23 | O193: 0.38299999999999995 | P193: 91.28 | Q193: 已到 | R193: 4.45年 | S193: 2.45年 | T193: 3 | U193: 8.8 | V193: 2.3e-002 | W193: 9.6999999999999989e-002 | X193: 8.8000000000000009e-002 | Y193: 31 | Z193: 3.2 | AA193: -9.7999999999999997e-003 | AB193: -1.77e-002 | AC193: -6.5299999999999997e-002 | AD193: -6.9199999999999998e-002 | AE193: 88.91 | AF193: 90.41 | AG193: 0.54 | AH193: A+ | AI193: 6.88e-002 | AJ193: =H193+100*O193 -> 164.53 | AK193: 161.2 | AL193: 175 | AM193: 70.8 | AN193: 211 | AO193: -0.122 | AP193: 9 | AQ193: 淳中转债!
A194: 193 | B194: 127020 | C194: 中金转债 | D194: 60 | E194: 中金岭南 | F194: 有色金属 | G194: 有色行业 | H194: 124.8 | I194: 0. | J194: 5.6000000000000008e-003 | K194: 4.56 | L194: 1.11e-002 | M194: 113.5 | N194: 4.63 | O194: 0.26700000000000002 | P194: 98.49 | Q194: 已到 | R194: 4.45年 | S194: 2.45年 | T194: 34.3 | U194: 7.8 | V194: 2.e-003 | W194: 0.20600000000000002 | X194: 0.20300000000000001 | Y194: 166 | Z194: 1.33 | AA194: -2.1299999999999999e-002 | AB194: -2.6499999999999999e-002 | AC194: -6.9099999999999995e-002 | AD194: -7.1599999999999997e-002 | AE194: 95.26 | AF194: 98.86 | AG194: 0.5 | AH194: AA+ | AI194: 3.1800000000000002e-002 | AJ194: =H194+100*O194 -> 151.5 | AK194: 151.1 | AL194: 79 | AM194: 52.2 | AN194: 73 | AO194: -6.4000000000000001e-002 | AP194: 19 | AQ194: 中金转债
A195: 194 | B195: 113593 | C195: 沪工转债! | D195: 603131 | E195: 上海沪工 | F195: 机械装备 | G195: 通用设备 | H195: 138.23 | I195: -6.0999999999999995e-003 | J195: 1.1699999999999999e-002 | K195: 22.15 | L195: 8.6999999999999994e-003 | M195: 121.2 | N195: 21.12 | O195: 0.318 | P195: 104.88 | Q195: 已到 | R195: 4.45年 | S195: 2.45年 | T195: 4 | U195: 9.6 | V195: 1.7000000000000001e-002 | W195: 5.7000000000000002e-002 | X195: 5.9999999999999998e-002 | Y195: 70 | Z195: 5.3 | AA195: -2.9600000000000001e-002 | AB195: -3.73e-002 | AC195: -9.6799999999999997e-002 | AD195: -0.10099999999999999 | AE195: 89.3 | AF195: 90.66 | AG195: 0.64 | AH195: A+ | AI195: 6.88e-002 | AJ195: =H195+100*O195 -> 170.03 | AK195: 171.6 | AL195: 257 | AM195: 80.9 | AN195: 277 | AO195: -0.114 | AP195: 9 | AQ195: 沪工转债!
A196: 195 | B196: 128120 | C196: 联诚转债! | D196: 2921 | E196: 联诚精密 | F196: 汽车 | G196: 零部件制 | H196: 120.645 | I196: 4.0999999999999995e-003 | J196: 1.54e-002 | K196: 17.73 | L196: 3.0800000000000001e-002 | M196: 117.9 | N196: 18.44 | O196: 0.255 | P196: 96.15 | Q196: 已到 | R196: 4.44年 | S196: 2.44年 | T196: 2.6 | U196: 12 | V196: 3.6000000000000004e-002 | W196: 0.13800000000000001 | X196: 0.13300000000000001 | Y196: 19 | Z196: 2.36 | AA196: -5.3e-003 | AB196: -1.2199999999999999e-002 | AC196: -4.8799999999999996e-002 | AD196: -5.2900000000000003e-002 | AE196: 86.88 | AF196: 84.75 | AG196: 0.64 | AH196: A | AI196: 7.8799999999999995e-002 | AJ196: =H196+100*O196 -> 146.14499999999998 | AK196: 145.1 | AL196: 38 | AM196: 58.3 | AN196: 116 | AO196: -5.0000000000000003e-002 | AP196: 23 | AQ196: 联诚转债!
A197: 196 | B197: 128121 | C197: 宏川转债! | D197: 2930 | E197: 宏川智慧 | F197: 交通运输 | G197: 物流业 | H197: 128.9 | I197: 9.4999999999999998e-003 | J197: -1.37e-002 | K197: 21.11 | L197: -6.0999999999999995e-003 | M197: 112.9 | N197: 19.89 | O197: 0.215 | P197: 106.13 | Q197: 已到 | R197: 4.44年 | S197: 2.44年 | T197: 6.7 | U197: 20 | V197: 2.3e-002 | W197: 7.0999999999999994e-002 | X197: 7.4999999999999997e-002 | Y197: 94 | Z197: 4.45 | AA197: -2.98e-002 | AB197: -3.4799999999999998e-002 | AC197: -7.6499999999999999e-002 | AD197: -7.980000000000001e-002 | AE197: 90.5 | AF197: 88.32 | AG197: 0.69 | AH197: AA- | AI197: 5.7800000000000004e-002 | AJ197: =H197+100*O197 -> 150.40000000000001 | AK197: 151.7 | AL197: 83 | AM197: 61.2 | AN197: 143 | AO197: -8.5999999999999993e-002 | AP197: 7 | AQ197: 宏川转债!
A198: 197 | B198: 123059 | C198: 银信转债! | D198: 300231 | E198: 银信科技 | F198: 计算机及 | G198: 软件开发 | H198: 123.305 | I198: -1.18e-002 | J198: 3.1600000000000003e-002 | K198: 8.88 | L198: 4.2300000000000004e-002 | M198: 123.7 | N198: 9.72 | O198: 0.34999999999999998 | P198: 91.36 | Q198: 已到 | R198: 4.43年 | S198: 2.43年 | T198: 3.91 | U198: 47 | V198: 9.6999999999999989e-002 | W198: 0.10000000000000001 | X198: 9.0999999999999998e-002 | Y198: 39 | Z198: 2.8 | AA198: 7.000000000000001e-004 | AB198: -8.1000000000000013e-003 | AC198: -5.74e-002 | AD198: -6.1399999999999996e-002 | AE198: 91.22 | AF198: 96.81 | AG198: 0.47 | AH198: AA- | AI198: 5.7800000000000004e-002 | AJ198: =H198+100*O198 -> 158.30500000000001 | AK198: 155.3 | AL198: 121 | AM198: 58.4 | AN198: 119 | AO198: -4.0000000000000001e-002 | AP198: 19 | AQ198: 银信转债!
A199: 198 | B199: 127019 | C199: 国城转债! | D199: 688 | E199: 国城矿业 | F199: 有色金属 | G199: 锌铅镍锡 | H199: 106.406 | I199: 2.2000000000000001e-003 | J199: -6.1999999999999998e-003 | K199: 12.27 | L199: -4.2900000000000001e-002 | M199: 114.8 | N199: 21.06 | O199: 0.82599999999999996 | P199: 58.26 | Q199: 已到 | R199: 4.43年 | S199: 2.43年 | T199: 8.5 | U199: 8.1 | V199: 9.0000000000000011e-003 | W199: 6.0999999999999999e-002 | X199: 3.5000000000000003e-002 | Y199: 140 | Z199: 5.77 | AA199: 1.7500000000000002e-002 | AB199: 1.1399999999999999e-002 | AC199: -5.0000000000000001e-003 | AD199: -8.6999999999999994e-003 | AE199: 95.3 | AF199: 98.03 | AG199: 0.09 | AH199: AA | AI199: 3.6799999999999999e-002 | AJ199: =H199+100*O199 -> 189.006 | AK199: 154.5 | AL199: 112 | AM199: 56.5 | AN199: 102 | AO199: -8.3000000000000004e-002 | AP199: 52 | AQ199: 国城转债!
A200: 199 | B200: 128119 | C200: 龙大转债! | D200: 2726 | E200: 龙大美食 | F200: 食品饮料 | G200: 肉制品 | H200: 127.123 | I200: -1.6799999999999999e-002 | J200: 1.2e-002 | K200: 8.89 | L200: -1.11e-002 | M200: 119.9 | N200: 9.29 | O200: 0.32799999999999996 | P200: 95.69 | Q200: 已到 | R200: 4.43年 | S200: 2.43年 | T200: 9.46 | U200: 22 | V200: 1.8000000000000002e-002 | W200: 9.9000000000000005e-002 | X200: 9.4e-002 | Y200: 96 | Z200: 2.37 | AA200: -1.3300000000000001e-002 | AB200: -2.0799999999999999e-002 | AC200: -7.1800000000000003e-002 | AD200: -7.51e-002 | AE200: 95.32 | AF200: 102.4 | AG200: 0.44 | AH200: AA | AI200: 3.6799999999999999e-002 | AJ200: =H200+100*O200 -> 159.923 | AK200: 158.6 | AL200: 150 | AM200: 56.2 | AN200: 99 | AO200: -0.14199999999999999 | AP200: 9 | AQ200: 龙大转债!
A201: 200 | B201: 110071 | C201: 湖盐转债! | D201: 600929 | E201: 雪天盐业 | F201: 食品饮料 | G201: 食品饮料 | H201: 129.65 | I201: 2.0000000000000001e-004 | J201: -3.0999999999999999e-003 | K201: 6.3 | L201: -4.6999999999999993e-003 | M201: 114.9 | N201: 5.89 | O201: 0.21199999999999999 | P201: 106.96 | Q201: 已到 | R201: 4.42年 | S201: 2.42年 | T201: 7.2 | U201: 24 | V201: 2.5000000000000001e-002 | W201: 8.5000000000000006e-002 | X201: 9.0999999999999998e-002 | Y201: 85 | Z201: 2.25 | AA201: -2.7300000000000001e-002 | AB201: -3.3000000000000002e-002 | AC201: -7.9199999999999993e-002 | AD201: -8.2400000000000001e-002 | AE201: 95.35 | AF201: 98.17 | AG201: 0.61 | AH201: AA | AI201: 3.6799999999999999e-002 | AJ201: =H201+100*O201 -> 150.84999999999999 | AK201: 152.3 | AL201: 89 | AM201: 54.2 | AN201: 85 | AO201: -0.124 | AP201: 19 | AQ201: 湖盐转债!
A202: 201 | B202: 113036 | C202: 宁建转债! | D202: 601789 | E202: 宁波建工 | F202: 建筑 | G202: 建筑工程 | H202: 118.83 | I202: -2.7900000000000001e-002 | J202: 2.4500000000000001e-002 | K202: 4.1 | L202: -9.7000000000000003e-003 | M202: 116.9 | N202: 4.76 | O202: 0.38 | P202: 86.13 | Q202: 已到 | R202: 4.41年 | S202: 2.41年 | T202: 5.4 | U202: 74 | V202: 0.113 | W202: 0.13500000000000001 | X202: 0.11599999999999999 | Y202: 40 | Z202: 1.23 | AA202: -3.8e-003 | AB202: -1.04e-002 | AC202: -4.7300000000000002e-002 | AD202: -5.0799999999999998e-002 | AE202: 95.39 | AF202: 99.92 | AG202: 0.35 | AH202: AA | AI202: 3.6799999999999999e-002 | AJ202: =H202+100*O202 -> 156.82999999999998 | AK202: 151.5 | AL202: 82 | AM202: 51.6 | AN202: 66 | AO202: 2.3e-002 | AP202: 14 | AQ202: 宁建转债!
A203: 202 | B203: 128118 | C203: 瀛通转债! | D203: 2861 | E203: 瀛通通讯 | F203: 电子 | G203: 电子产品 | H203: 110.904 | I203: 3.5999999999999999e-003 | J203: -1.1999999999999999e-003 | K203: 12.15 | L203: 1.84e-002 | M203: 121.7 | N203: 21.24 | O203: 0.93900000000000006 | P203: 57.2 | Q203: 已到 | R203: 4.40年 | S203: 2.40年 | T203: 3 | U203: 3.1 | V203: 9.0000000000000011e-003 | W203: 0.157 | X203: 8.9999999999999997e-002 | Y203: 19 | Z203: 1.82 | AA203: 2.18e-002 | AB203: 1.3100000000000001e-002 | AC203: -1.37e-002 | AD203: -1.89e-002 | AE203: 92.37 | AF203: 95.52 | AG203: 0.13 | AH203: AA- | AI203: 5.7800000000000004e-002 | AJ203: =H203+100*O203 -> 204.804 | AK203: 164.6 | AL203: 210 | AM203: 69.1 | AN203: 198 | AO203: -4.7e-002 | AP203: 28 | AQ203: 瀛通转债!
A204: 203 | B204: 128117 | C204: 道恩转债! | D204: 2838 | E204: 道恩股份 | F204: 化工 | G204: 橡胶塑料 | H204: 112.3 | I204: 5.1000000000000004e-003 | J204: -4.5999999999999999e-003 | K204: 14.02 | L204: 8.6e-003 | M204: 123.1 | N204: 28.78 | O204: 1.3100000000000001 | P204: 48.71 | Q204: 已到 | R204: 4.40年 | S204: 2.40年 | T204: 3.6 | U204: 2.7 | V204: 6.9999999999999993e-003 | W204: 6.3e-002 | X204: 3.1e-002 | Y204: 57 | Z204: 3.01 | AA204: 2.1400000000000002e-002 | AB204: 1.24e-002 | AC204: -2.5000000000000001e-002 | AD204: -2.8799999999999999e-002 | AE204: 90.91 | AF204: 96.49 | AG204: 0.06 | AH204: AA- | AI204: 5.7800000000000004e-002 | AJ204: =H204+100*O204 -> 243.30000000000001 | AK204: 175.9 | AL204: 281 | AM204: 79.4 | AN204: 265 | AO204: -0.127 | AP204: 28 | AQ204: 道恩转债!
A205: 204 | B205: 123057 | C205: 美联转债!! | D205: 300586 | E205: 美联新材 | F205: 化工 | G205: 橡胶塑料 | H205: 135.98 | I205: 1.29e-002 | J205: 8.8999999999999999e-003 | K205: 10.69 | L205: 3.1899999999999998e-002 | M205: 117.8 | N205: 9.5 | O205: 0.20800000000000002 | P205: 112.53 | Q205: 已到 | R205: 4.39年 | S205: 2.39年 | T205: 2.07 | U205: 37 | V205: 0.13100000000000001 | W205: 3.7000000000000005e-002 | X205: 4.0999999999999995e-002 | Y205: 56 | Z205: 4.69 | AA205: -3.2599999999999997e-002 | AB205: -3.9300000000000002e-002 | AC205: -9.3900000000000011e-002 | AD205: -9.7799999999999998e-002 | AE205: 91.42 | AF205: 92.44 | AG205: 0.68 | AH205: AA- | AI205: 5.7800000000000004e-002 | AJ205: =H205+100*O205 -> 156.78 | AK205: 159.4 | AL205: 156 | AM205: 67 | AN205: 179 | AO205: -8.1000000000000003e-002 | AP205: 19 | AQ205: 美联转债!!
A206: 205 | B206: 113591 | C206: 胜达转债!! | D206: 603687 | E206: 大胜达 | F206: 造纸包装 | G206: 包装用纸 | H206: 124.67 | I206: 1.7000000000000001e-003 | J206: 6.9999999999999993e-003 | K206: 10.23 | L206: 1.29e-002 | M206: 121.7 | N206: 8.76 | O206: 6.8000000000000005e-002 | P206: 116.78 | Q206: 已到 | R206: 4.39年 | S206: 2.39年 | T206: 4.78 | U206: 96 | V206: 0.161 | W206: 0.113 | X206: 0.13200000000000001 | Y206: 42 | Z206: 2.42 | AA206: -5.6000000000000008e-003 | AB206: -1.38e-002 | AC206: -6.2400000000000004e-002 | AD206: -6.6400000000000001e-002 | AE206: 91.42 | AF206: 95.46 | AG206: 0.67 | AH206: AA- | AI206: 5.7800000000000004e-002 | AJ206: =H206+100*O206 -> 131.47 | AK206: 132.6 | AL206: 5 | AM206: 37.1 | AN206: 13 | AO206: -0.127 | AP206: 36 | AQ206: 胜达转债!!
A207: 206 | B207: 128116 | C207: 瑞达转债! | D207: 2961 | E207: 瑞达期货 | F207: 金融 | G207: 期货行业 | H207: 114.8 | I207: 2.e-003 | J207: 8.0000000000000004e-004 | K207: 20.76 | L207: 1.32e-002 | M207: 114.9 | N207: 29.55 | O207: 0.63400000000000001 | P207: 70.25 | Q207: 已到 | R207: 4.39年 | S207: 2.39年 | T207: 6.49 | U207: 9.6 | V207: 1.3000000000000001e-002 | W207: 7.0000000000000007e-002 | X207: 4.9000000000000002e-002 | Y207: 92 | Z207: 4.35 | AA207: 2.0000000000000001e-004 | AB207: -5.7999999999999996e-003 | AC207: -3.4300000000000004e-002 | AD207: -3.7999999999999999e-002 | AE207: 95.56 | AF207: 98.27 | AG207: 0.21 | AH207: AA | AI207: 3.6799999999999999e-002 | AJ207: =H207+100*O207 -> 178.19999999999999 | AK207: 159.3 | AL207: 155 | AM207: 61.1 | AN207: 142 | AO207: -8.8000000000000009e-002 | AP207: 17 | AQ207: 瑞达转债!
A208: 207 | B208: 127018 | C208: 本钢转债! | D208: 761 | E208: 本钢板材 | F208: 钢铁 | G208: 炼钢 | H208: 117.535 | I208: -2.7799999999999998e-002 | J208: 4.6999999999999993e-003 | K208: 3.78 | L208: -9.7899999999999987e-002 | M208: 128 | N208: 4.55 | O208: 0.41499999999999998 | P208: 83.08 | Q208: 已到 | R208: 4.39年 | S208: 2.39年 | T208: 56.3 | U208: 178 | V208: 2.7000000000000003e-002 | W208: 0.36299999999999999 | X208: 0.30099999999999999 | Y208: 155 | Z208: 0.68 | AA208: 2.0099999999999996e-002 | AB208: 9.4999999999999998e-003 | AC208: -2.7999999999999997e-002 | AD208: -3.4700000000000002e-002 | AE208: 101.05 | AF208: 112.89 | AG208: 0.24 | AH208: AAA | AI208: 2.98e-002 | AJ208: =H208+100*O208 -> 159.035 | AK208: 152 | AL208: 86 | AM208: 39.1 | AN208: 16 | AO208: -0.13100000000000001 | AP208: 59 | AQ208: 本钢转债!
A209: 208 | B209: 113589 | C209: 天创转债! | D209: 603608 | E209: 天创时尚 | F209: 服装纺织 | G209: 鞋服行业 | H209: 105.1 | I209: 3.5999999999999999e-003 | J209: -2.e-003 | K209: 5.86 | L209: 5.21e-002 | M209: 114.9 | N209: 12.29 | O209: 1.2 | P209: 47.68 | Q209: 已到 | R209: 4.37年 | S209: 2.37年 | T209: 6 | U209: 8.1 | V209: 1.3000000000000001e-002 | W209: 0.23899999999999999 | X209: 0.114 | Y209: 25 | Z209: 1.59 | AA209: 2.0899999999999998e-002 | AB209: 1.46e-002 | AC209: 2.0000000000000001e-004 | AD209: -3.7000000000000002e-003 | AE209: 95.5 | AF209: 98.33 | AG209: 0.03 | AH209: AA | AI209: 3.6799999999999999e-002 | AJ209: =H209+100*O209 -> 225.09999999999999 | AK209: 162.5 | AL209: 190 | AM209: 64.2 | AN209: 163 | AO209: -8.0000000000000002e-002 | AP209: 44 | AQ209: 天创转债!
A210: 209 | B210: 123056 | C210: 雪榕转债! | D210: 300511 | E210: 雪榕生物 | F210: 农业 | G210: 种植业 | H210: 110.939 | I210: 6.7000000000000002e-003 | J210: -3.0000000000000001e-003 | K210: 6.87 | L210: 2.8399999999999998e-002 | M210: 120.7 | N210: 11.77 | O210: 0.90099999999999991 | P210: 58.37 | Q210: 已到 | R210: 4.37年 | S210: 2.37年 | T210: 5.84 | U210: 3.9 | V210: 6.0000000000000001e-003 | W210: 0.192 | X210: 0.11199999999999999 | Y210: 30 | Z210: 1.7 | AA210: 1.9799999999999998e-002 | AB210: 1.15e-002 | AC210: -1.7899999999999999e-002 | AD210: -2.2400000000000003e-002 | AE210: 91.51 | AF210: 94.78 | AG210: 0.13 | AH210: AA- | AI210: 5.7800000000000004e-002 | AJ210: =H210+100*O210 -> 201.03899999999999 | AK210: 163.5 | AL210: 203 | AM210: 68.7 | AN210: 195 | AO210: -0.122 | AP210: 23 | AQ210: 雪榕转债!
A211: 210 | B211: 113588 | C211: 润达转债! | D211: 603108 | E211: 润达医疗 | F211: 医药 | G211: 医疗器械 | H211: 123.82 | I211: 1.2e-002 | J211: -1.37e-002 | K211: 11.32 | L211: -4.4000000000000003e-003 | M211: 113.9 | N211: 13.25 | O211: 0.44900000000000001 | P211: 85.43 | Q211: 已到 | R211: 4.35年 | S211: 2.35年 | T211: 5.5 | U211: 16 | V211: 2.4e-002 | W211: 8.4000000000000005e-002 | X211: 7.2000000000000008e-002 | Y211: 66 | Z211: 1.99 | AA211: -1.9299999999999998e-002 | AB211: -2.4799999999999999e-002 | AC211: -6.3899999999999998e-002 | AD211: -6.7400000000000002e-002 | AE211: 95.57 | AF211: 97.54 | AG211: 0.38 | AH211: AA | AI211: 3.6799999999999999e-002 | AJ211: =H211+100*O211 -> 168.72 | AK211: 162.2 | AL211: 187 | AM211: 64.7 | AN211: 165 | AO211: -0.157 | AP211: 11 | AQ211: 润达转债!
A212: 211 | B212: 128114 | C212: 正邦转债! | D212: 2157 | E212: 正邦科技 | F212: 农业 | G212: 畜牧业 | H212: 111.079 | I212: -2.0000000000000001e-004 | J212: 1.8e-003 | K212: 8.85 | L212: 1.61e-002 | M212: 114.9 | N212: 14.77 | O212: 0.85400000000000009 | P212: 59.92 | Q212: 已到 | R212: 4.35年 | S212: 2.35年 | T212: 16 | U212: 14 | V212: 8.0000000000000002e-003 | W212: 5.7000000000000002e-002 | X212: 3.4000000000000002e-002 | Y212: 278 | Z212: 2.14 | AA212: 7.9000000000000008e-003 | AB212: 1.8e-003 | AC212: -2.1899999999999999e-002 | AD212: -2.5699999999999997e-002 | AE212: 95.57 | AF212: 98.4 | AG212: 0.1 | AH212: AA | AI212: 3.6799999999999999e-002 | AJ212: =H212+100*O212 -> 196.47899999999998 | AK212: 162.2 | AL212: 188 | AM212: 63.8 | AN212: 160 | AO212: -9.9000000000000005e-002 | AP212: 26 | AQ212: 正邦转债!
A213: 212 | B213: 128113 | C213: 比音转债!* | D213: 2832 | E213: 比音勒芬 | F213: 服装纺织 | G213: 服装行业 | H213: 164.82 | I213: 1.49e-002 | J213: -3.9000000000000003e-003 | K213: 24 | L213: 1.1000000000000001e-002 | M213: 116.9 | N213: 14.6 | O213: 3.0000000000000001e-003 | P213: 164.38 | Q213: 已到 | R213: 15天 | S213: 无权 | T213: 2.21 | U213: 42 | V213: 0.11599999999999999 | W213: 1.7000000000000001e-002 | X213: 2.7000000000000003e-002 | Y213: 132 | Z213: 4.46 | AA213: <-100% | AB213: <-100% | AC213: 无权 | AD213: 无权 | AE213: 无权 | AF213: 100.29 | AG213: 1 | AH213: AA | AI213: 3.0899999999999997e-002 | AJ213: =H213+100*O213 -> 165.12 | AK213: 165.3 | AL213: 217 | AM213: 65 | AN213: 167 | AO213: -3.1e-002 | AP213: 8 | AQ213: 比音转债!*
A214: 213 | B214: 128111 | C214: 中矿转债! | D214: 2738 | E214: 中矿资源 | F214: 有色金属 | G214: 有色行业 | H214: 420.6 | I214: -3.9699999999999999e-002 | J214: -3.4000000000000002e-003 | K214: 58.5 | L214: -4.3799999999999999e-002 | M214: 124.2 | N214: 15.45 | O214: 0.111 | P214: 378.64 | Q214: 已到 | R214: 4.34年 | S214: 2.34年 | T214: 1.45 | U214: 610 | V214: 0.98099999999999998 | W214: 8.0000000000000002e-003 | X214: 2.8999999999999998e-002 | Y214: 190 | Z214: 5.09 | AA214: -0.247 | AB214: -0.254 | AC214: -0.253 | AD214: -0.253 | AE214: 92.17 | AF214: 97.76 | AG214: 0.98 | AH214: AA- | AI214: 5.7800000000000004e-002 | AJ214: =H214+100*O214 -> 431.70000000000005 | AK214: 462.6 | AL214: 382 | AM214: 364.8 | AN214: 383 | AO214: -3.6000000000000004e-002 | AP214: 10 | AQ214: 中矿转债!
A215: 214 | B215: 123054 | C215: 思特转债!! | D215: 300608 | E215: 思特奇 | F215: 通信互联 | G215: 通信设备 | H215: 131.301 | I215: 2.3e-003 | J215: 9.0000000000000011e-003 | K215: 12.56 | L215: 2.0299999999999999e-002 | M215: 121.2 | N215: 12.63 | O215: 0.32000000000000001 | P215: 99.45 | Q215: 已到 | R215: 4.34年 | S215: 2.34年 | T215: 2.07 | U215: 136 | V215: 0.496 | W215: 7.9000000000000001e-002 | X215: 7.8e-002 | Y215: 26 | Z215: 3.17 | AA215: -1.8600000000000002e-002 | AB215: -2.6699999999999998e-002 | AC215: -8.1799999999999998e-002 | AD215: -8.5999999999999993e-002 | AE215: 92.19 | AF215: 95.43 | AG215: 0.56 | AH215: AA- | AI215: 5.7800000000000004e-002 | AJ215: =H215+100*O215 -> 163.30099999999999 | AK215: 163.2 | AL215: 197 | AM215: 67.7 | AN215: 186 | AO215: -0.14599999999999999 | AP215: 18 | AQ215: 思特转债!!
A216: 215 | B216: 113585 | C216: 寿仙转债! | D216: 603896 | E216: 寿仙谷 | F216: 医药 | G216: 中药 | H216: 196.79 | I216: 4.5899999999999996e-002 | J216: -7.1999999999999998e-003 | K216: 52.46 | L216: 4.0899999999999999e-002 | M216: 117.3 | N216: 28.38 | O216: 6.5000000000000002e-002 | P216: 184.85 | Q216: 已到 | R216: 4.33年 | S216: 2.33年 | T216: 1.01 | U216: 530 | V216: 2.6200000000000001 | W216: 1.3000000000000001e-002 | X216: 2.3e-002 | Y216: 80 | Z216: 5.38 | AA216: -0.114 | AB216: -0.12 | AC216: -0.156 | AD216: -0.157 | AE216: 91.23 | AF216: 92.33 | AG216: 0.95 | AH216: AA- | AI216: 5.7800000000000004e-002 | AJ216: =H216+100*O216 -> 203.28999999999999 | AK216: 208.7 | AL216: 342 | AM216: 116.4 | AN216: 341 | AO216: -4.9000000000000002e-002 | AP216: 18 | AQ216: 寿仙转债!
A217: 216 | B217: 123052 | C217: 飞鹿转债! | D217: 300665 | E217: 飞鹿股份 | F217: 化工 | G217: 化工 | H217: 143.265 | I217: 6.8000000000000005e-003 | J217: 1.6200000000000003e-002 | K217: 9.12 | L217: 3.1699999999999999e-002 | M217: 126.8 | N217: 7.05 | O217: 0.107 | P217: 129.36 | Q217: 已到 | R217: 4.32年 | S217: 2.32年 | T217: 1.5 | U217: 51 | V217: 0.23600000000000002 | W217: 9.5000000000000001e-002 | X217: 0.12300000000000001 | Y217: 16 | Z217: 3.1 | AA217: -2.8399999999999998e-002 | AB217: -3.7999999999999999e-002 | AC217: -0.11199999999999999 | AD217: -0.11599999999999999 | AE217: 90.43 | AF217: 95.7 | AG217: 0.73 | AH217: A+ | AI217: 6.88e-002 | AJ217: =H217+100*O217 -> 153.96499999999997 | AK217: 157.2 | AL217: 136 | AM217: 61.5 | AN217: 148 | AO217: -7.2000000000000008e-002 | AP217: 24 | AQ217: 飞鹿转债!
A218: 217 | B218: 113584 | C218: 家悦转债! | D218: 603708 | E218: 家家悦 | F218: 商业零售 | G218: 超市 | H218: 107.8 | I218: 5.0000000000000001e-003 | J218: -5.0000000000000001e-003 | K218: 14.3 | L218: 6.3e-003 | M218: 114.9 | N218: 37.53 | O218: 1.8300000000000001 | P218: 38.1 | Q218: 已到 | R218: 4.32年 | S218: 2.32年 | T218: 6.45 | U218: 5.1 | V218: 6.9999999999999993e-003 | W218: 7.400000000000001e-002 | X218: 2.7999999999999997e-002 | Y218: 87 | Z218: 3.39 | AA218: 1.5100000000000001e-002 | AB218: 8.8000000000000005e-003 | AC218: -1.01e-002 | AD218: -1.41e-002 | AE218: 95.68 | AF218: 98.51 | AG218: 0.01 | AH218: AA | AI218: 3.6799999999999999e-002 | AJ218: =H218+100*O218 -> 290.80000000000001 | AK218: 177.5 | AL218: 291 | AM218: 79 | AN218: 264 | AO218: -0.11199999999999999 | AP218: 21 | AQ218: 家悦转债!
A219: 218 | B219: 128109 | C219: 楚江转债! | D219: 2171 | E219: 楚江新材 | F219: 有色金属 | G219: 铜金属 | H219: 155.22 | I219: 1.1699999999999999e-002 | J219: -1.24e-002 | K219: 10.28 | L219: -1.e-003 | M219: 114.9 | N219: 8.63 | O219: 0.30299999999999999 | P219: 119.12 | Q219: 已到 | R219: 4.32年 | S219: 2.32年 | T219: 18.2 | U219: 14 | V219: 5.0000000000000001e-003 | W219: 0.13300000000000001 | X219: 0.158 | Y219: 137 | Z219: 2.34 | AA219: -6.8099999999999994e-002 | AB219: -7.3499999999999996e-002 | AC219: -0.107 | AD219: -0.109 | AE219: 95.69 | AF219: 98.52 | AG219: 0.7 | AH219: AA | AI219: 3.6799999999999999e-002 | AJ219: =H219+100*O219 -> 185.52000000000001 | AK219: 191.3 | AL219: 330 | AM219: 92.8 | AN219: 314 | AO219: -0.11199999999999999 | AP219: 5 | AQ219: 楚江转债!
A220: 219 | B220: 127017 | C220: 万青转债 | D220: 789 | E220: 万年青 | F220: 建筑 | G220: 水泥 | H220: 126.43 | I220: -3.7000000000000002e-003 | J220: 1.9e-003 | K220: 12.06 | L220: -5.0000000000000001e-003 | M220: 118 | N220: 13.46 | O220: 0.41100000000000003 | P220: 89.6 | Q220: 已到 | R220: 4.32年 | S220: 2.32年 | T220: 10 | U220: 9.3 | V220: 6.9999999999999993e-003 | W220: 0.10400000000000001 | X220: 9.3000000000000013e-002 | Y220: 96 | Z220: 1.41 | AA220: -1.61e-002 | AB220: -2.3099999999999999e-002 | AC220: -7.2300000000000003e-002 | AD220: -7.5899999999999995e-002 | AE220: 96.95 | AF220: 103.28 | AG220: 0.36 | AH220: AA+ | AI220: 3.1800000000000002e-002 | AJ220: =H220+100*O220 -> 167.53 | AK220: 163.3 | AL220: 199 | AM220: 60 | AN220: 135 | AO220: -3.6000000000000004e-002 | AP220: 7 | AQ220: 万青转债
A221: 220 | B221: 128108 | C221: 蓝帆转债!! | D221: 2382 | E221: 蓝帆医疗 | F221: 医药 | G221: 医疗器械 | H221: 115.403 | I221: -5.9999999999999995e-004 | J221: 3.4999999999999996e-003 | K221: 15.15 | L221: 8.0000000000000002e-003 | M221: 112.9 | N221: 18.24 | O221: 0.38900000000000001 | P221: 83.06 | Q221: 已到 | R221: 4.30年 | S221: 3.30年 | T221: 15.2 | U221: 9.1 | V221: 5.0000000000000001e-003 | W221: 0.10000000000000001 | X221: 8.3000000000000004e-002 | Y221: 153 | Z221: 1.2 | AA221: -5.1999999999999998e-003 | AB221: -1.0500000000000001e-002 | AC221: -2.1700000000000001e-002 | AD221: -2.5399999999999999e-002 | AE221: 94.3 | AF221: 96.88 | AG221: 0.36 | AH221: AA | AI221: 3.6799999999999999e-002 | AJ221: =H221+100*O221 -> 154.303 | AK221: 147.7 | AL221: 55 | AM221: 50.9 | AN221: 61 | AO221: -7.6999999999999999e-002 | AP221: 29 | AQ221: 蓝帆转债!!
A222: 221 | B222: 113582 | C222: 火炬转债! | D222: 603678 | E222: 火炬电子 | F222: 电子 | G222: 元器件制 | H222: 334.97 | I222: 8.1000000000000013e-003 | J222: 6.1999999999999998e-003 | K222: 64.71 | L222: 1.46e-002 | M222: 114.9 | N222: 24.99 | O222: 0.29399999999999998 | P222: 258.94 | Q222: 已到 | R222: 4.30年 | S222: 2.30年 | T222: 4.18 | U222: 42 | V222: 2.9999999999999999e-002 | W222: 1.3999999999999999e-002 | X222: 3.6000000000000004e-002 | Y222: 298 | Z222: 6.71 | AA222: -0.222 | AB222: -0.22600000000000001 | AC222: -0.23699999999999999 | AD222: -0.23800000000000002 | AE222: 95.77 | AF222: 98.6 | AG222: 0.98 | AH222: AA | AI222: 3.6799999999999999e-002 | AJ222: =H222+100*O222 -> 364.37 | AK222: 411 | AL222: 378 | AM222: 312.4 | AN222: 378 | AO222: -3.3000000000000002e-002 | AP222: 5 | AQ222: 火炬转债!
A223: 222 | B223: 113579 | C223: 健友转债! | D223: 603707 | E223: 健友股份 | F223: 医药 | G223: 原料药 | H223: 135.95 | I223: -7.7000000000000002e-003 | J223: 2.8000000000000004e-003 | K223: 36.18 | L223: -7.4000000000000003e-003 | M223: 113.9 | N223: 32.2 | O223: 0.20999999999999999 | P223: 112.36 | Q223: 已到 | R223: 4.20年 | S223: 2.20年 | T223: 5.03 | U223: 18 | V223: 2.7000000000000003e-002 | W223: 1.1000000000000001e-002 | X223: 1.3000000000000001e-002 | Y223: 450 | Z223: 10.25 | AA223: -4.1799999999999997e-002 | AB223: -4.7300000000000002e-002 | AC223: -0.10400000000000001 | AD223: -0.107 | AE223: 96.09 | AF223: 98.08 | AG223: 0.66 | AH223: AA | AI223: 3.6799999999999999e-002 | AJ223: =H223+100*O223 -> 156.94999999999999 | AK223: 159.5 | AL223: 158 | AM223: 61.5 | AN223: 147 | AO223: -4.0999999999999995e-002 | AP223: 10 | AQ223: 健友转债!
A224: 223 | B224: 128107 | C224: 交科转债 | D224: 2061 | E224: 浙江交科 | F224: 建筑 | G224: 建筑工程 | H224: 126.184 | I224: -9.1999999999999998e-003 | J224: 9.1999999999999998e-003 | K224: 5.54 | L224: 0. | M224: 114.9 | N224: 5.24 | O224: 0.19399999999999998 | P224: 105.73 | Q224: 已到 | R224: 4.20年 | S224: 2.20年 | T224: 25 | U224: 22 | V224: 6.9999999999999993e-003 | W224: 0.32799999999999996 | X224: 0.34700000000000003 | Y224: 76 | Z224: 0.85 | AA224: -2.2400000000000003e-002 | AB224: -2.8399999999999998e-002 | AC224: -7.5499999999999998e-002 | AD224: -7.9100000000000004e-002 | AE224: 97.19 | AF224: 100.94 | AG224: 0.57 | AH224: AA+ | AI224: 3.1800000000000002e-002 | AJ224: =H224+100*O224 -> 145.584 | AK224: 146.6 | AL224: 44 | AM224: 45.7 | AN224: 35 | AO224: -3.9e-002 | AP224: 20 | AQ224: 交科转债
A225: 224 | B225: 113578 | C225: 全筑转债! | D225: 603030 | E225: 全筑股份 | F225: 建筑 | G225: 装饰工程 | H225: 107.11 | I225: 5.7999999999999996e-003 | J225: 1.4000000000000002e-003 | K225: 3.51 | L225: 5.0900000000000001e-002 | M225: 117.9 | N225: 5.25 | O225: 0.60199999999999998 | P225: 66.86 | Q225: 已到 | R225: 4.20年 | S225: 2.20年 | T225: 3.84 | U225: 5.9 | V225: 1.3999999999999999e-002 | W225: 0.18899999999999997 | X225: 0.126 | Y225: 20 | Z225: 0.93 | AA225: 2.35e-002 | AB225: 1.5800000000000002e-002 | AC225: -7.9000000000000008e-003 | AD225: -1.21e-002 | AE225: 96.12 | AF225: 101.54 | AG225: 0.14 | AH225: AA | AI225: 3.6799999999999999e-002 | AJ225: =H225+100*O225 -> 167.31 | AK225: 147.4 | AL225: 50 | AM225: 45.8 | AN225: 36 | AO225: -4.2000000000000003e-002 | AP225: 37 | AQ225: 全筑转债!
A226: 225 | B226: 113573 | C226: 纵横转债! | D226: 603602 | E226: 纵横通信 | F226: 通信互联 | G226: 通信设备 | H226: 114.3 | I226: 4.1999999999999997e-003 | J226: 1.e-004 | K226: 11.88 | L226: 2.2400000000000003e-002 | M226: 124.2 | N226: 18.78 | O226: 0.80700000000000005 | P226: 63.26 | Q226: 已到 | R226: 4.19年 | S226: 2.19年 | T226: 2.7 | U226: 19 | V226: 5.9999999999999998e-002 | W226: 0.111 | X226: 7.0000000000000007e-002 | Y226: 24 | Z226: 3.4 | AA226: 2.0400000000000001e-002 | AB226: 1.0500000000000001e-002 | AC226: -3.0099999999999998e-002 | AD226: -3.5099999999999999e-002 | AE226: 90.76 | AF226: 94.5 | AG226: 0.19 | AH226: A+ | AI226: 6.88e-002 | AJ226: =H226+100*O226 -> 195. | AK226: 165.3 | AL226: 218 | AM226: 70.8 | AN226: 212 | AO226: 3.1e-002 | AP226: 32 | AQ226: 纵横转债!
A227: 226 | B227: 113577 | C227: 春秋转债! | D227: 603890 | E227: 春秋电子 | F227: 电子 | G227: 电子产品 | H227: 140.4 | I227: -1.9099999999999999e-002 | J227: 2.8500000000000001e-002 | K227: 12.25 | L227: 1.41e-002 | M227: 117.7 | N227: 10.85 | O227: 0.24399999999999999 | P227: 112.9 | Q227: 已到 | R227: 4.18年 | S227: 2.18年 | T227: 1.78 | U227: 348 | V227: 1.3200000000000001 | W227: 3.3000000000000002e-002 | X227: 3.7000000000000005e-002 | Y227: 54 | Z227: 2.16 | AA227: -4.1900000000000007e-002 | AB227: -4.8799999999999996e-002 | AC227: -0.114 | AD227: -0.11800000000000001 | AE227: 92.52 | AF227: 93.45 | AG227: 0.67 | AH227: AA- | AI227: 5.7800000000000004e-002 | AJ227: =H227+100*O227 -> 164.80000000000001 | AK227: 167.9 | AL227: 233 | AM227: 74.4 | AN227: 238 | AO227: -8.3000000000000004e-002 | AP227: 15 | AQ227: 春秋转债!
A228: 227 | B228: 123050 | C228: 聚飞转债! | D228: 300303 | E228: 聚飞光电 | F228: 电子 | G228: LED制 | H228: 135.578 | I228: -2.7000000000000001e-003 | J228: 1.1299999999999999e-002 | K228: 5.31 | L228: 1.5300000000000001e-002 | M228: 123.8 | N228: 5.08 | O228: 0.29699999999999999 | P228: 104.53 | Q228: 已到 | R228: 4.18年 | S228: 2.18年 | T228: 3.75 | U228: 12 | V228: 2.3e-002 | W228: 5.2999999999999999e-002 | X228: 5.5e-002 | Y228: 71 | Z228: 2.57 | AA228: -2.18e-002 | AB228: -3.1e-002 | AC228: -0.10099999999999999 | AD228: -0.105 | AE228: 92.52 | AF228: 98.29 | AG228: 0.57 | AH228: AA- | AI228: 5.7800000000000004e-002 | AJ228: =H228+100*O228 -> 165.27799999999999 | AK228: 166.6 | AL228: 226 | AM228: 68.3 | AN228: 192 | AO228: -0.127 | AP228: 12 | AQ228: 聚飞转债!
A229: 228 | B229: 123049 | C229: 维尔转债! | D229: 300190 | E229: 维尔利 | F229: 城市公用 | G229: 三废处理 | H229: 114.9 | I229: -1.7000000000000001e-003 | J229: 9.1999999999999998e-003 | K229: 5.57 | L229: 2.58e-002 | M229: 124.3 | N229: 7.38 | O229: 0.52200000000000002 | P229: 75.47 | Q229: 已到 | R229: 4.18年 | S229: 2.18年 | T229: 9.17 | U229: 4.1 | V229: 4.0000000000000001e-003 | W229: 0.21100000000000002 | X229: 0.159 | Y229: 44 | Z229: 1 | AA229: 1.9400000000000001e-002 | AB229: 9.4999999999999998e-003 | AC229: -3.2099999999999997e-002 | AD229: -3.7200000000000004e-002 | AE229: 93.01 | AF229: 98.76 | AG229: 0.29 | AH229: AA- | AI229: 5.7800000000000004e-002 | AJ229: =H229+100*O229 -> 167.10000000000002 | AK229: 154.3 | AL229: 110 | AM229: 55.6 | AN229: 97 | AO229: -6.3e-002 | AP229: 21 | AQ229: 维尔转债!
A230: 229 | B230: 110070 | C230: 凌钢转债! | D230: 600231 | E230: 凌钢股份 | F230: 钢铁 | G230: 炼钢 | H230: 125.37 | I230: -8.0000000000000002e-003 | J230: 6.1999999999999998e-003 | K230: 2.54 | L230: -3.9000000000000003e-003 | M230: 117.4 | N230: 2.69 | O230: 0.32799999999999996 | P230: 94.42 | Q230: 已到 | R230: 4.18年 | S230: 2.18年 | T230: 2.17 | U230: 7 | V230: 2.6000000000000002e-002 | W230: 2.9999999999999999e-002 | X230: 2.7999999999999997e-002 | Y230: 72 | Z230: 0.77 | AA230: -1.5800000000000002e-002 | AB230: -2.29e-002 | AC230: -7.1800000000000003e-002 | AD230: -7.5899999999999995e-002 | AE230: 96.59 | AF230: 101.22 | AG230: 0.45 | AH230: AA | AI230: 3.6799999999999999e-002 | AJ230: =H230+100*O230 -> 158.17000000000002 | AK230: 156.3 | AL230: 127 | AM230: 55.1 | AN230: 94 | AO230: -5.9999999999999998e-002 | AP230: 21 | AQ230: 凌钢转债!
A231: 230 | B231: 128106 | C231: 华统转债! | D231: 2840 | E231: 华统股份 | F231: 农业 | G231: 农产品加 | H231: 174.92 | I231: 1.5600000000000001e-002 | J231: -1.44e-002 | K231: 16.2 | L231: 1.1999999999999999e-003 | M231: 112.9 | N231: 9.37 | O231: 1.2e-002 | P231: 172.89 | Q231: 已到 | R231: 4.17年 | S231: 2.17年 | T231: 3.92 | U231: 292 | V231: 0.42999999999999999 | W231: 5.2999999999999999e-002 | X231: 9.1999999999999998e-002 | Y231: 74 | Z231: 4.29 | AA231: -0.10099999999999999 | AB231: -0.106 | AC231: -0.14599999999999999 | AD231: -0.14800000000000002 | AE231: 96.21 | AF231: 97.34 | AG231: 0.94 | AH231: AA | AI231: 3.6799999999999999e-002 | AJ231: =H231+100*O231 -> 176.11999999999998 | AK231: 176.9 | AL231: 286 | AM231: 79.6 | AN231: 269 | AO231: -9.6000000000000002e-002 | AP231: 13 | AQ231: 华统转债!
A232: 231 | B232: 123048 | C232: 应急转债! | D232: 300527 | E232: 中船应急 | F232: 机械装备 | G232: 专用设备 | H232: 131.498 | I232: 6.9999999999999993e-003 | J232: 3.4999999999999996e-003 | K232: 8.66 | L232: 2.12e-002 | M232: 112.8 | N232: 8.88 | O232: 0.34799999999999998 | P232: 97.52 | Q232: 已到 | R232: 4.17年 | S232: 2.17年 | T232: 3.79 | U232: 33 | V232: 6.6000000000000003e-002 | W232: 4.4999999999999998e-002 | X232: 4.4000000000000004e-002 | Y232: 83 | Z232: 3.17 | AA232: -3.6600000000000001e-002 | AB232: -4.1799999999999997e-002 | AC232: -9.3299999999999994e-002 | AD232: -9.6699999999999994e-002 | AE232: 97.29 | AF232: 99.19 | AG232: 0.5 | AH232: AA+ | AI232: 3.1800000000000002e-002 | AJ232: =H232+100*O232 -> 166.298 | AK232: 165.5 | AL232: 220 | AM232: 66.3 | AN232: 175 | AO232: -0.126 | AP232: 15 | AQ232: 应急转债!
A233: 232 | B233: 113576 | C233: 起步转债!! | D233: 603557 | E233: ST起步 | F233: 服装纺织 | G233: 鞋服行业 | H233: 117.49 | I233: 3.9000000000000003e-003 | J233: -2.3e-003 | K233: 4.73 | L233: 3.2799999999999996e-002 | M233: 121.3 | N233: 10.55 | O233: 1.6200000000000001 | P233: 44.83 | Q233: 已到 | R233: 4.17年 | S233: 2.17年 | T233: 2.66 | U233: 1776. | V233: 5.54 | W233: 0.113 | X233: 5.0999999999999997e-002 | Y233: 23 | Z233: 1.56 | AA233: 7.8000000000000005e-003 | AB233: -8.9999999999999998e-004 | AC233: -4.1599999999999998e-002 | AD233: -4.6699999999999998e-002 | AE233: 85.3 | AF233: 82.61 | AG233: 0.05 | AH233: BBB+ | AI233: 9.8800000000000013e-002 | AJ233: =H233+100*O233 -> 279.49000000000001 | AK233: 190.1 | AL233: 324 | AM233: 104.9 | AN233: 333 | AO233: -5.7000000000000002e-002 | AP233: 34 | AQ233: 起步转债!!
A234: 233 | B234: 128105 | C234: 长集转债! | D234: 2616 | E234: 长青集团 | F234: 城市公用 | G234: 三废处理 | H234: 109.892 | I234: -8.9999999999999998e-004 | J234: 3.0999999999999999e-003 | K234: 5.21 | L234: 1.5600000000000001e-002 | M234: 114.9 | N234: 7.91 | O234: 0.66799999999999993 | P234: 65.87 | Q234: 已到 | R234: 4.17年 | S234: 2.17年 | T234: 8 | U234: 2.7 | V234: 3.0000000000000001e-003 | W234: 0.20699999999999999 | X234: 0.13600000000000001 | Y234: 39 | Z234: 1.55 | AA234: 1.09e-002 | AB234: 4.4000000000000003e-003 | AC234: -1.9099999999999999e-002 | AD234: -2.3199999999999998e-002 | AE234: 96.22 | AF234: 99.07 | AG234: 0.15 | AH234: AA | AI234: 3.6799999999999999e-002 | AJ234: =H234+100*O234 -> 176.69200000000001 | AK234: 153.9 | AL234: 105 | AM234: 54.8 | AN234: 93 | AO234: -8.4000000000000005e-002 | AP234: 23 | AQ234: 长集转债!
A235: 234 | B235: 113575 | C235: 东时转债!! | D235: 603377 | E235: 东方时尚 | F235: 其他 | G235: 其他 | H235: 126.58 | I235: 1.4000000000000002e-003 | J235: 4.0000000000000002e-004 | K235: 7.58 | L235: 1.61e-002 | M235: 113.1 | N235: 12.15 | O235: 1.03 | P235: 62.39 | Q235: 已到 | R235: 4.17年 | S235: 2.17年 | T235: 0.98 | U235: 25 | V235: 0.20199999999999999 | W235: 1.8000000000000002e-002 | X235: 1.1000000000000001e-002 | Y235: 55 | Z235: 2.55 | AA235: -2.7099999999999999e-002 | AB235: -3.2500000000000001e-002 | AC235: -7.6999999999999999e-002 | AD235: -8.0799999999999997e-002 | AE235: 96.43 | AF235: 97.53 | AG235: 0.11 | AH235: AA | AI235: 3.6799999999999999e-002 | AJ235: =H235+100*O235 -> 229.57999999999998 | AK235: 190.8 | AL235: 326 | AM235: 93.2 | AN235: 317 | AO235: -0.12 | AP235: 14 | AQ235: 东时转债!!
A236: 235 | B236: 127016 | C236: 鲁泰转债! | D236: 726 | E236: 鲁 泰Ａ | F236: 服装纺织 | G236: 纺织行业 | H236: 115.4 | I236: 9.3999999999999986e-003 | J236: 6.5000000000000006e-003 | K236: 6.81 | L236: 6.9099999999999995e-002 | M236: 115.9 | N236: 8.71 | O236: 0.47600000000000003 | P236: 78.19 | Q236: 已到 | R236: 4.17年 | S236: 2.17年 | T236: 14 | U236: 16 | V236: 1.e-002 | W236: 0.23300000000000001 | X236: 0.182 | Y236: 60 | Z236: 0.76 | AA236: 1.1000000000000001e-003 | AB236: -5.6999999999999993e-003 | AC236: -3.9900000000000005e-002 | AD236: -4.3799999999999999e-002 | AE236: 97.3 | AF236: 101.93 | AG236: 0.23 | AH236: AA+ | AI236: 3.1800000000000002e-002 | AJ236: =H236+100*O236 -> 163. | AK236: 152.6 | AL236: 90 | AM236: 50.7 | AN236: 59 | AO236: 1.3000000000000001e-002 | AP236: 23 | AQ236: 鲁泰转债!
A237: 236 | B237: 113033 | C237: 利群转债! | D237: 601366 | E237: 利群股份 | F237: 商业零售 | G237: 商场 | H237: 115 | I237: 5.8999999999999999e-003 | J237: 6.3e-003 | K237: 6.64 | L237: 2.63e-002 | M237: 114.9 | N237: 7.01 | O237: 0.214 | P237: 94.72 | Q237: 已到 | R237: 4年52天 | S237: 2年52天 | T237: 18 | U237: 46 | V237: 2.2000000000000002e-002 | W237: 0.315 | X237: 0.29799999999999999 | Y237: 57 | Z237: 1.31 | AA237: -2.0000000000000001e-004 | AB237: -6.6e-003 | AC237: -3.8800000000000001e-002 | AD237: -4.2800000000000005e-002 | AE237: 96.3 | AF237: 99.15 | AG237: 0.46 | AH237: AA | AI237: 3.6799999999999999e-002 | AJ237: =H237+100*O237 -> 136.40000000000001 | AK237: 135.3 | AL237: 9 | AM237: 36.1 | AN237: 11 | AO237: 4.7e-002 | AP237: 71 | AQ237: 利群转债!
A238: 237 | B238: 113574 | C238: 华体转债! | D238: 603679 | E238: 华体科技 | F238: 城市公用 | G238: 城市公用 | H238: 113.8 | I238: 2.2000000000000001e-003 | J238: -1.9e-003 | K238: 12.89 | L238: 3.4500000000000003e-002 | M238: 115.9 | N238: 33.91 | O238: 1.99 | P238: 38.01 | Q238: 已到 | R238: 4年51天 | S238: 2年51天 | T238: 2.09 | U238: 3.3 | V238: 1.3999999999999999e-002 | W238: 0.114 | X238: 4.2999999999999997e-002 | Y238: 18 | Z238: 2.44 | AA238: 4.5000000000000005e-003 | AB238: -2.3e-003 | AC238: -3.0200000000000001e-002 | AD238: -3.5099999999999999e-002 | AE238: 90.75 | AF238: 88.49 | AG238: 0.01 | AH238: A+ | AI238: 6.88e-002 | AJ238: =H238+100*O238 -> 312.80000000000001 | AK238: 189.6 | AL238: 323 | AM238: 98.8 | AN238: 325 | AO238: -8.1000000000000003e-002 | AP238: 22 | AQ238: 华体转债!
A239: 238 | B239: 128103 | C239: 同德转债!* | D239: 2360 | E239: 同德化工 | F239: 化工 | G239: 化工 | H239: 162.844 | I239: 5.0000000000000001e-004 | J239: -5.3e-003 | K239: 8.28 | L239: -4.7999999999999996e-003 | M239: 121.3 | N239: 5.08 | O239: -1.e-003 | P239: 162.99 | Q239: 已到 | R239: 22天 | S239: 无权 | T239: 0.79 | U239: 128 | V239: 0.98999999999999999 | W239: 2.4e-002 | X239: 3.9e-002 | Y239: 33 | Z239: 2.48 | AA239: <-100% | AB239: <-100% | AC239: 无权 | AD239: 无权 | AE239: 无权 | AF239: 100.17 | AG239: 1 | AH239: A+ | AI239: 6.2899999999999998e-002 | AJ239: =H239+100*O239 -> 162.744 | AK239: 162.7 | AL239: 192 | AM239: 62.5 | AN239: 152 | AO239: -7.8e-002 | AP239: 17 | AQ239: 同德转债!*
A240: 239 | B240: 110068 | C240: 龙净转债! | D240: 600388 | E240: 龙净环保 | F240: 城市公用 | G240: 三废处理 | H240: 111.8 | I240: 2.7000000000000001e-003 | J240: -1.2999999999999999e-003 | K240: 8.03 | L240: 6.3e-003 | M240: 114.8 | N240: 10.55 | O240: 0.46899999999999997 | P240: 76.11 | Q240: 已到 | R240: 4年44天 | S240: 2年44天 | T240: 20 | U240: 15 | V240: 6.9999999999999993e-003 | W240: 0.23300000000000001 | X240: 0.17699999999999999 | Y240: 86 | Z240: 1.33 | AA240: 6.5000000000000006e-003 | AB240: 1.e-004 | AC240: -2.7400000000000001e-002 | AD240: -3.1400000000000004e-002 | AE240: 97.43 | AF240: 101.09 | AG240: 0.22 | AH240: AA+ | AI240: 3.1800000000000002e-002 | AJ240: =H240+100*O240 -> 158.69999999999999 | AK240: 147.5 | AL240: 52 | AM240: 46.4 | AN240: 39 | AO240: -5.5e-002 | AP240: 41 | AQ240: 龙净转债!
A241: 240 | B241: 123046 | C241: 天铁转债! | D241: 300587 | E241: 天铁股份 | F241: 铁路 | G241: 铁路设备 | H241: 300.05 | I241: -3.8599999999999995e-002 | J241: 2.53e-002 | K241: 18.07 | L241: -1.3600000000000001e-002 | M241: 117.7 | N241: 6.73 | O241: 0.11800000000000001 | P241: 268.5 | Q241: 已到 | R241: 4年39天 | S241: 2年39天 | T241: 0.59 | U241: 109 | V241: 0.61199999999999999 | W241: 5.0000000000000001e-003 | X241: 1.3999999999999999e-002 | Y241: 114 | Z241: 6.14 | AA241: -0.20600000000000002 | AB241: -0.21100000000000002 | AC241: -0.248 | AD241: -0.249 | AE241: 92.89 | AF241: 93.83 | AG241: 0.98 | AH241: AA- | AI241: 5.7800000000000004e-002 | AJ241: =H241+100*O241 -> 311.85000000000002 | AK241: 331.6 | AL241: 372 | AM241: 237.8 | AN241: 373 | AO241: -4.8000000000000001e-002 | AP241: 12 | AQ241: 天铁转债!
A242: 241 | B242: 128101 | C242: 联创转债!! | D242: 2036 | E242: 联创电子 | F242: 电子 | G242: 液晶显示 | H242: 177.779 | I242: -7.2300000000000003e-002 | J242: -7.7000000000000002e-003 | K242: 18.44 | L242: -0.10000000000000001 | M242: 114.8 | N242: 13.72 | O242: 0.32299999999999995 | P242: 134.4 | Q242: 已到 | R242: 4年36天 | S242: 2年36天 | T242: 3 | U242: 191 | V242: 0.34600000000000003 | W242: 1.4999999999999999e-002 | X242: 2.1000000000000001e-002 | Y242: 196 | Z242: 5.02 | AA242: -0.10199999999999999 | AB242: -0.10800000000000001 | AC242: -0.156 | AD242: -0.158 | AE242: 96.45 | AF242: 99.21 | AG242: 0.8 | AH242: AA | AI242: 3.6799999999999999e-002 | AJ242: =H242+100*O242 -> 210.07900000000001 | AK242: 221.2 | AL242: 346 | AM242: 121.9 | AN242: 345 | AO242: -0.16399999999999998 | AP242: 13 | AQ242: 联创转债!!
A243: 242 | B243: 123045 | C243: 雷迪转债 | D243: 300652 | E243: 雷迪克 | F243: 汽车 | G243: 零部件制 | H243: 130 | I243: 1.8000000000000002e-002 | J243: 1.9599999999999999e-002 | K243: 20.15 | L243: 6.0499999999999998e-002 | M243: 118.9 | N243: 19.63 | O243: 0.26600000000000001 | P243: 102.65 | Q243: 已到 | R243: 4年32天 | S243: 2年32天 | T243: 1.66 | U243: 199 | V243: 0.90700000000000003 | W243: 8.8000000000000009e-002 | X243: 8.9999999999999997e-002 | Y243: 19 | Z243: 1.99 | AA243: -2.2000000000000002e-002 | AB243: -2.9700000000000001e-002 | AC243: -8.77e-002 | AD243: -9.2100000000000015e-002 | AE243: 91.06 | AF243: 91.08 | AG243: 0.62 | AH243: A+ | AI243: 6.88e-002 | AJ243: =H243+100*O243 -> 156.59999999999999 | AK243: 157.4 | AL243: 137 | AM243: 66.3 | AN243: 174 | AO243: -7.400000000000001e-002 | AP243: 33 | AQ243: 雷迪转债
A244: 243 | B244: 128100 | C244: 搜特转债! | D244: 2503 | E244: 搜于特 | F244: 服装纺织 | G244: 服装行业 | H244: 107.603 | I244: -1.e-004 | J244: 1.2199999999999999e-002 | K244: 1.52 | L244: 2.0099999999999996e-002 | M244: 116.9 | N244: 1.62 | O244: 0.14699999999999999 | P244: 93.83 | Q244: 已到 | R244: 4年32天 | S244: 2年32天 | T244: 7.99 | U244: 43 | V244: 5.0000000000000003e-002 | W244: 0.17000000000000001 | X244: 0.159 | Y244: 47 | Z244: 3.11 | AA244: 2.0799999999999999e-002 | AB244: 1.3300000000000001e-002 | AC244: -1.04e-002 | AD244: -1.47e-002 | AE244: 88.35 | AF244: 86.17 | AG244: 0.6 | AH244: A | AI244: 7.8799999999999995e-002 | AJ244: =H244+100*O244 -> 122.303 | AK244: 121.4 | AL244: 1 | AM244: 33 | AN244: 7 | AO244: -5.9999999999999998e-002 | AP244: 95 | AQ244: 搜特转债!
A245: 244 | B245: 123044 | C245: 红相转债!! | D245: 300427 | E245: 红相股份 | F245: 能源电力 | G245: 电力设备 | H245: 115.998 | I245: -8.6e-003 | J245: 1.0200000000000001e-002 | K245: 12.84 | L245: 7.8000000000000005e-003 | M245: 125 | N245: 18.67 | O245: 0.68700000000000006 | P245: 68.77 | Q245: 已到 | R245: 4年32天 | S245: 2年32天 | T245: 5.5 | U245: 6.9 | V245: 1.1000000000000001e-002 | W245: 0.11900000000000001 | X245: 8.199999999999999e-002 | Y245: 46 | Z245: 1.96 | AA245: 1.8799999999999997e-002 | AB245: 8.5000000000000006e-003 | AC245: -3.44e-002 | AD245: -4.0300000000000002e-002 | AE245: 94.17 | AF245: 99.85 | AG245: 0.21 | AH245: AA- | AI245: 5.7800000000000004e-002 | AJ245: =H245+100*O245 -> 184.69800000000001 | AK245: 163.2 | AL245: 198 | AM245: 63.4 | AN245: 156 | AO245: -1.e-003 | AP245: 23 | AQ245: 红相转债!!
A246: 245 | B246: 110067 | C246: 华安转债! | D246: 600909 | E246: 华安证券 | F246: 金融 | G246: 证券行业 | H246: 115.3 | I246: -1.7000000000000001e-003 | J246: 2.3e-003 | K246: 5.01 | L246: 2.e-003 | M246: 110.3 | N246: 6.22 | O246: 0.43099999999999999 | P246: 80.55 | Q246: 已到 | R246: 4年32天 | S246: 无权 | T246: 28 | U246: 10 | V246: 3.0000000000000001e-003 | W246: 0.11900000000000001 | X246: 9.6000000000000002e-002 | Y246: 235 | Z246: 1.26 | AA246: -1.09e-002 | AB246: -1.54e-002 | AC246: 无权 | AD246: 无权 | AE246: 无权 | AF246: 97.91 | AG246: 0.3 | AH246: AAA | AI246: 2.98e-002 | AJ246: =H246+100*O246 -> 158.40000000000001 | AK246: 150.1 | AL246: 72 | AM246: 52.1 | AN246: 72 | AO246: -4.7e-002 | AP246: 25 | AQ246: 华安转债!
A247: 246 | B247: 113570 | C247: 百达转债! | D247: 603331 | E247: 百达精工 | F247: 机械装备 | G247: 机械装备 | H247: 127.82 | I247: 8.3000000000000001e-003 | J247: 6.0999999999999995e-003 | K247: 12.21 | L247: 2.0899999999999998e-002 | M247: 114.9 | N247: 11.34 | O247: 0.187 | P247: 107.67 | Q247: 已到 | R247: 4年31天 | S247: 2年31天 | T247: 2.8 | U247: 25 | V247: 7.0000000000000007e-002 | W247: 0.129 | X247: 0.13900000000000001 | Y247: 22 | Z247: 2.68 | AA247: -2.6099999999999998e-002 | AB247: -3.2300000000000002e-002 | AC247: -8.4600000000000009e-002 | AD247: -8.8300000000000003e-002 | AE247: 90.21 | AF247: 87.94 | AG247: 0.69 | AH247: A+ | AI247: 6.88e-002 | AJ247: =H247+100*O247 -> 146.51999999999998 | AK247: 148 | AL247: 58 | AM247: 57.8 | AN247: 115 | AO247: -2.3e-002 | AP247: 31 | AQ247: 百达转债!
A248: 247 | B248: 113569 | C248: 科达转债! | D248: 603660 | E248: 苏州科达 | F248: 通信互联 | G248: 物联网 | H248: 107.2 | I248: 4.1999999999999997e-003 | J248: -3.8e-003 | K248: 6.45 | L248: 1.4199999999999999e-002 | M248: 120.3 | N248: 14.8 | O248: 1.46 | P248: 43.58 | Q248: 已到 | R248: 4年29天 | S248: 2年29天 | T248: 5.16 | U248: 4 | V248: 6.9999999999999993e-003 | W248: 0.16200000000000001 | X248: 7.0999999999999994e-002 | Y248: 32 | Z248: 1.88 | AA248: 2.9100000000000001e-002 | AB248: 2.0299999999999999e-002 | AC248: -6.8999999999999999e-003 | AD248: -1.1699999999999999e-002 | AE248: 92.53 | AF248: 96.03 | AG248: 0.03 | AH248: AA- | AI248: 5.7800000000000004e-002 | AJ248: =H248+100*O248 -> 253.19999999999999 | AK248: 170.8 | AL248: 253 | AM248: 74.8 | AN248: 241 | AO248: -8.1000000000000003e-002 | AP248: 42 | AQ248: 科达转债!
A249: 248 | B249: 113568 | C249: 新春转债!! | D249: 603667 | E249: 五洲新春 | F249: 机械装备 | G249: 通用设备 | H249: 175.86 | I249: 3.2300000000000002e-002 | J249: -9.8999999999999991e-003 | K249: 13.7 | L249: 2.6200000000000001e-002 | M249: 124.3 | N249: 8.75 | O249: 0.12300000000000001 | P249: 156.57 | Q249: 已到 | R249: 4年26天 | S249: 2年26天 | T249: 2.44 | U249: 337 | V249: 0.77900000000000003 | W249: 5.9000000000000004e-002 | X249: 9.1999999999999998e-002 | Y249: 41 | Z249: 2.19 | AA249: -8.2899999999999988e-002 | AB249: -9.1700000000000004e-002 | AC249: -0.153 | AD249: -0.156 | AE249: 93.56 | AF249: 99.33 | AG249: 0.86 | AH249: AA- | AI249: 5.7800000000000004e-002 | AJ249: =H249+100*O249 -> 188.16000000000003 | AK249: 195.1 | AL249: 332 | AM249: 95.8 | AN249: 321 | AO249: -9.6999999999999989e-002 | AP249: 35 | AQ249: 新春转债!!
A250: 249 | B250: 123043 | C250: 正元转债!* | D250: 300645 | E250: 正元智慧 | F250: 计算机及 | G250: 软件开发 | H250: 161 | I250: -5.2400000000000002e-002 | J250: 8.9999999999999998e-004 | K250: 20.63 | L250: -5.1500000000000004e-002 | M250: 120.9 | N250: 15.38 | O250: 0.20000000000000001 | P250: 134.14 | Q250: 已到 | R250: 10天 | S250: 无权 | T250: 1.64 | U250: 3410. | V250: 11.960000000000001 | W250: 6.2e-002 | X250: 8.3000000000000004e-002 | Y250: 26 | Z250: 3.98 | AA250: <-100% | AB250: <-100% | AC250: 无权 | AD250: 无权 | AE250: 无权 | AF250: 100.48 | AG250: 1 | AH250: A+ | AI250: 6.2899999999999998e-002 | AJ250: =H250+100*O250 -> 181. | AK250: 187.9 | AL250: 319 | AM250: 87.4 | AN250: 297 | AO250: -0.13600000000000001 | AP250: 16 | AQ250: 正元转债!*
A251: 250 | B251: 113567 | C251: 君禾转债! | D251: 603617 | E251: 君禾股份 | F251: 机械装备 | G251: 通用设备 | H251: 130.71 | I251: 1.9e-002 | J251: 2.6600000000000002e-002 | K251: 12.69 | L251: 6.2800000000000009e-002 | M251: 118.8 | N251: 10.58 | O251: 8.9999999999999997e-002 | P251: 119.94 | Q251: 已到 | R251: 4年24天 | S251: 2年24天 | T251: 2.1 | U251: 103 | V251: 0.37200000000000005 | W251: 6.4000000000000001e-002 | X251: 7.6999999999999999e-002 | Y251: 33 | Z251: 3.6 | AA251: -2.3599999999999999e-002 | AB251: -3.1300000000000001e-002 | AC251: -9.1199999999999989e-002 | AD251: -9.5600000000000004e-002 | AE251: 91.01 | AF251: 91.14 | AG251: 0.73 | AH251: A+ | AI251: 6.88e-002 | AJ251: =H251+100*O251 -> 139.71000000000001 | AK251: 141.5 | AL251: 22 | AM251: 50.3 | AN251: 57 | AO251: -9.0000000000000011e-003 | AP251: 34 | AQ251: 君禾转债!
A252: 251 | B252: 110066 | C252: 盛屯转债!! | D252: 600711 | E252: 盛屯矿业 | F252: 有色金属 | G252: 有色行业 | H252: 222.24 | I252: -5.0499999999999996e-002 | J252: -3.5099999999999999e-002 | K252: 8.63 | L252: -9.1600000000000001e-002 | M252: 114.9 | N252: 4.87 | O252: 0.254 | P252: 177.21 | Q252: 已到 | R252: 4年22天 | S252: 2年22天 | T252: 3.83 | U252: 197 | V252: 0.23000000000000001 | W252: 1.6e-002 | X252: 2.8999999999999998e-002 | Y252: 237 | Z252: 1.92 | AA252: -0.151 | AB252: -0.156 | AC252: -0.20699999999999999 | AD252: -0.20800000000000002 | AE252: 96.58 | AF252: 99.44 | AG252: 0.93 | AH252: AA | AI252: 3.6799999999999999e-002 | AJ252: =H252+100*O252 -> 247.64000000000001 | AK252: 267.3 | AL252: 363 | AM252: 167.8 | AN252: 362 | AO252: -0.154 | AP252: 27 | AQ252: 盛屯转债!!
A253: 252 | B253: 113566 | C253: 翔港转债! | D253: 603499 | E253: 翔港科技 | F253: 造纸包装 | G253: 包装材料 | H253: 118.18 | I253: 2.8000000000000004e-003 | J253: 5.6000000000000008e-003 | K253: 8.05 | L253: 2.5499999999999998e-002 | M253: 124 | N253: 10.77 | O253: 0.58099999999999996 | P253: 74.74 | Q253: 已到 | R253: 4年20天 | S253: 2年20天 | T253: 1.61 | U253: 6 | V253: 3.1e-002 | W253: 0.10000000000000001 | X253: 7.400000000000001e-002 | Y253: 16 | Z253: 2.85 | AA253: 1.21e-002 | AB253: 2.2000000000000001e-003 | AC253: -4.7800000000000002e-002 | AD253: -5.28e-002 | AE253: 91.27 | AF253: 95.19 | AG253: 0.33 | AH253: A+ | AI253: 6.88e-002 | AJ253: =H253+100*O253 -> 176.28 | AK253: 161.6 | AL253: 183 | AM253: 66.4 | AN253: 177 | AO253: -0.10800000000000001 | AP253: 30 | AQ253: 翔港转债!
A254: 253 | B254: 113565 | C254: 宏辉转债 | D254: 603336 | E254: 宏辉果蔬 | F254: 农业 | G254: 农产品加 | H254: 119.34 | I254: 4.8999999999999998e-003 | J254: 1.1899999999999999e-002 | K254: 7 | L254: 3.4000000000000002e-002 | M254: 117.8 | N254: 7.64 | O254: 0.30299999999999999 | P254: 91.62 | Q254: 已到 | R254: 4年18天 | S254: 2年18天 | T254: 2.25 | U254: 58 | V254: 0.214 | W254: 7.2999999999999995e-002 | X254: 6.7000000000000004e-002 | Y254: 31 | Z254: 2.95 | AA254: -3.3e-003 | AB254: -1.09e-002 | AC254: -5.2699999999999997e-002 | AD254: -5.7500000000000002e-002 | AE254: 93.2 | AF254: 94.23 | AG254: 0.5 | AH254: AA- | AI254: 5.7800000000000004e-002 | AJ254: =H254+100*O254 -> 149.64000000000001 | AK254: 147.1 | AL254: 47 | AM254: 52.8 | AN254: 75 | AO254: -0.128 | AP254: 28 | AQ254: 宏辉转债
A255: 254 | B255: 128097 | C255: 奥佳转债!! | D255: 2614 | E255: 奥佳华 | F255: 机械装备 | G255: 专用设备 | H255: 135.051 | I255: 2.3999999999999998e-003 | J255: -5.9999999999999995e-004 | K255: 11.3 | L255: 2.7000000000000001e-003 | M255: 114.9 | N255: 10.39 | O255: 0.24199999999999999 | P255: 108.76 | Q255: 已到 | R255: 4年17天 | S255: 2年17天 | T255: 4.59 | U255: 6.6 | V255: 1.1000000000000001e-002 | W255: 6.4000000000000001e-002 | X255: 7.0000000000000007e-002 | Y255: 71 | Z255: 1.52 | AA255: -3.9699999999999999e-002 | AB255: -4.58e-002 | AC255: -0.109 | AD255: -0.11199999999999999 | AE255: 92.51 | AF255: 91.87 | AG255: 0.67 | AH255: AA- | AI255: 5.7800000000000004e-002 | AJ255: =H255+100*O255 -> 159.25099999999998 | AK255: 161.3 | AL255: 177 | AM255: 68.8 | AN255: 197 | AO255: -0.109 | AP255: 16 | AQ255: 奥佳转债!!
A256: 255 | B256: 128095 | C256: 恩捷转债!! | D256: 2812 | E256: 恩捷股份 | F256: 电子 | G256: 元器件制 | H256: 457.5 | I256: -5.3e-003 | J256: -1.34e-002 | K256: 254.09 | L256: -1.9e-002 | M256: 114.9 | N256: 64.92 | O256: 0.16899999999999998 | P256: 391.39 | Q256: 已到 | R256: 4年3.6天 | S256: 2年3.6天 | T256: 4.54 | U256: 203 | V256: 9.6999999999999989e-002 | W256: 2.e-003 | X256: 8.0000000000000002e-003 | Y256: 2268. | Z256: 17.69 | AA256: -0.29299999999999998 | AB256: -0.29699999999999999 | AC256: -0.313 | AD256: -0.313 | AE256: 96.77 | AF256: 99.63 | AG256: 0.99 | AH256: AA | AI256: 3.6799999999999999e-002 | AJ256: =H256+100*O256 -> 474.39999999999998 | AK256: 523.6 | AL256: 384 | AM256: 424 | AN256: 384 | AO256: -2.e-003 | AP256: 12 | AQ256: 恩捷转债!!
A257: 256 | B257: 128096 | C257: 奥瑞转债!!* | D257: 2701 | E257: 奥瑞金 | F257: 造纸包装 | G257: 包装材料 | H257: 132.899 | I257: 5.3e-003 | J257: 3.2000000000000002e-003 | K257: 5.99 | L257: 8.3999999999999995e-003 | M257: 115.5 | N257: 4.5 | O257: -2.e-003 | P257: 133.11 | Q257: 已到 | R257: 21天 | S257: 无权 | T257: 5.03 | U257: 71 | V257: 0.107 | W257: 3.4000000000000002e-002 | X257: 4.5999999999999999e-002 | Y257: 147 | Z257: 2.02 | AA257: <-100% | AB257: <-100% | AC257: 无权 | AD257: 无权 | AE257: 无权 | AF257: 99.9 | AG257: 1 | AH257: AA+ | AI257: 2.5899999999999999e-002 | AJ257: =H257+100*O257 -> 132.69900000000001 | AK257: 132.7 | AL257: 6 | AM257: 32.8 | AN257: 6 | AO257: -8.5000000000000006e-002 | AP257: 15 | AQ257: 奥瑞转债!!*
A258: 257 | B258: 113563 | C258: 柳药转债! | D258: 603368 | E258: 柳药股份 | F258: 医药 | G258: 医药商业 | H258: 113.62 | I258: 9.4999999999999998e-003 | J258: -1.03e-002 | K258: 16.43 | L258: -4.7999999999999996e-003 | M258: 112.3 | N258: 23.87 | O258: 0.65099999999999991 | P258: 68.83 | Q258: 已到 | R258: 3.94年 | S258: 1.94年 | T258: 8.02 | U258: 20 | V258: 2.2000000000000002e-002 | W258: 0.13500000000000001 | X258: 9.3000000000000013e-002 | Y258: 60 | Z258: 1.14 | AA258: -3.0000000000000001e-003 | AB258: -8.6e-003 | AC258: -3.9399999999999998e-002 | AD258: -4.3299999999999998e-002 | AE258: 96.02 | AF258: 97.55 | AG258: 0.16 | AH258: AA | AI258: 3.6799999999999999e-002 | AJ258: =H258+100*O258 -> 178.72 | AK258: 158.4 | AL258: 147 | AM258: 60.9 | AN258: 141 | AO258: -0.16300000000000001 | AP258: 19 | AQ258: 柳药转债!
A259: 258 | B259: 128094 | C259: 星帅转债!* | D259: 2860 | E259: 星帅尔 | F259: 家电 | G259: 零部件制 | H259: 146.667 | I259: 6.0999999999999995e-003 | J259: -9.5999999999999992e-003 | K259: 20.06 | L259: -3.4999999999999996e-003 | M259: 120.3 | N259: 13.8 | O259: 9.0000000000000011e-003 | P259: 145.36 | Q259: 已到 | R259: 17天 | S259: 无权 | T259: 1.62 | U259: 140 | V259: 0.58700000000000008 | W259: 4.0000000000000001e-002 | X259: 5.7999999999999996e-002 | Y259: 41 | Z259: 3.55 | AA259: <-100% | AB259: <-100% | AC259: 无权 | AD259: 无权 | AE259: 无权 | AF259: 99.83 | AG259: 1 | AH259: A+ | AI259: 6.2899999999999998e-002 | AJ259: =H259+100*O259 -> 147.56700000000001 | AK259: 148 | AL259: 59 | AM259: 48.1 | AN259: 48 | AO259: -0.11800000000000001 | AP259: 29 | AQ259: 星帅转债!*
A260: 259 | B260: 123042 | C260: 银河转债!!* | D260: 300619 | E260: 金银河 | F260: 机械装备 | G260: 专用设备 | H260: 294.8 | I260: -1.4999999999999999e-002 | J260: 3.32e-002 | K260: 62.68 | L260: 1.8200000000000001e-002 | M260: 114.6 | N260: 23.59 | O260: 0.109 | P260: 265.71 | Q260: 已到 | R260: 17天 | S260: 无权 | T260: 0.97 | U260: 980 | V260: 3.2799999999999998 | W260: 1.8000000000000002e-002 | X260: 4.9000000000000002e-002 | Y260: 53 | Z260: 8.83 | AA260: <-100% | AB260: <-100% | AC260: 无权 | AD260: 无权 | AE260: 无权 | AF260: 99.83 | AG260: 1 | AH260: A+ | AI260: 6.2899999999999998e-002 | AJ260: =H260+100*O260 -> 305.69999999999999 | AK260: 323.9 | AL260: 371 | AM260: 224.1 | AN260: 370 | AO260: -0.12 | AP260: 20 | AQ260: 银河转债!!*
A261: 260 | B261: 127015 | C261: 希望转债!! | D261: 876 | E261: 新 希 望 | F261: 农业 | G261: 畜牧业 | H261: 127.1 | I261: 1.5100000000000001e-002 | J261: -1.8e-003 | K261: 16.09 | L261: 4.2800000000000005e-002 | M261: 109.6 | N261: 19.75 | O261: 0.56000000000000005 | P261: 81.47 | Q261: 已到 | R261: 3.90年 | S261: 1.90年 | T261: 9.5 | U261: 30 | V261: 2.5000000000000001e-002 | W261: 1.3000000000000001e-002 | X261: 1.1000000000000001e-002 | Y261: 725 | Z261: 2.37 | AA261: -3.7499999999999999e-002 | AB261: -4.1799999999999997e-002 | AC261: -9.4299999999999995e-002 | AD261: -9.7299999999999998e-002 | AE261: 96.98 | AF261: 97.82 | AG261: 0.31 | AH261: AAA | AI261: 2.98e-002 | AJ261: =H261+100*O261 -> 183.09999999999999 | AK261: 172.7 | AL261: 265 | AM261: 74.9 | AN261: 243 | AO261: -3.2000000000000001e-002 | AP261: 26 | AQ261: 希望转债!!
A262: 261 | B262: 128093 | C262: 百川转债!! | D262: 2455 | E262: 百川股份 | F262: 化工 | G262: 化工 | H262: 222.68 | I262: -8.9999999999999998e-004 | J262: 2.2400000000000003e-002 | K262: 12.08 | L262: 2.29e-002 | M262: 129 | N262: 5.77 | O262: 6.4000000000000001e-002 | P262: 209.36 | Q262: 已到 | R262: 3.90年 | S262: 1.90年 | T262: 1.61 | U262: 124 | V262: 0.34399999999999997 | W262: 2.4e-002 | X262: 4.9000000000000002e-002 | Y262: 68 | Z262: 3.86 | AA262: -0.13300000000000001 | AB262: -0.14300000000000002 | AC262: -0.221 | AD262: -0.22399999999999998 | AE262: 95.41 | AF262: 104.25 | AG262: 0.94 | AH262: AA- | AI262: 5.7800000000000004e-002 | AJ262: =H262+100*O262 -> 229.08000000000001 | AK262: 236 | AL262: 354 | AM262: 131.8 | AN262: 349 | AO262: -5.7000000000000002e-002 | AP262: 36 | AQ262: 百川转债!!
A263: 262 | B263: 113561 | C263: 正裕转债! | D263: 603089 | E263: 正裕工业 | F263: 汽车 | G263: 零部件制 | H263: 119.59 | I263: 3.0999999999999999e-003 | J263: 1.21e-002 | K263: 8.48 | L263: 3.2899999999999999e-002 | M263: 117.2 | N263: 10.08 | O263: 0.42200000000000004 | P263: 84.13 | Q263: 已到 | R263: 3.89年 | S263: 1.89年 | T263: 1.5 | U263: 2.6 | V263: 1.3999999999999999e-002 | W263: 7.9000000000000001e-002 | X263: 6.7000000000000004e-002 | Y263: 19 | Z263: 1.82 | AA263: -5.1999999999999998e-003 | AB263: -1.29e-002 | AC263: -6.0100000000000001e-002 | AD263: -6.4699999999999994e-002 | AE263: 91.05 | AF263: 90.79 | AG263: 0.46 | AH263: A+ | AI263: 6.88e-002 | AJ263: =H263+100*O263 -> 161.79000000000002 | AK263: 155.1 | AL263: 119 | AM263: 64 | AN263: 162 | AO263: -7.0000000000000007e-002 | AP263: 35 | AQ263: 正裕转债!
A264: 263 | B264: 128091 | C264: 新天转债! | D264: 2873 | E264: 新天药业 | F264: 医药 | G264: 中药 | H264: 202 | I264: 8.0199999999999994e-002 | J264: 1.3100000000000001e-002 | K264: 20.37 | L264: 9.9900000000000003e-002 | M264: 118.6 | N264: 11.62 | O264: 0.152 | P264: 175.3 | Q264: 已到 | R264: 3.89年 | S264: 1.89年 | T264: 1.55 | U264: 5224. | V264: 16.640000000000001 | W264: 4.5999999999999999e-002 | X264: 8.1000000000000003e-002 | Y264: 33 | Z264: 2.75 | AA264: -0.129 | AB264: -0.13600000000000001 | AC264: -0.20600000000000002 | AD264: -0.20899999999999999 | AE264: 91.26 | AF264: 91.94 | AG264: 0.93 | AH264: A+ | AI264: 6.88e-002 | AJ264: =H264+100*O264 -> 217.19999999999999 | AK264: 228.7 | AL264: 349 | AM264: 136.8 | AN264: 353 | AO264: -7.4999999999999997e-002 | AP264: 22 | AQ264: 新天转债!
A265: 264 | B265: 128090 | C265: 汽模转2 | D265: 2510 | E265: 天汽模 | F265: 汽车 | G265: 零部件制 | H265: 124.079 | I265: 6.8999999999999999e-003 | J265: 2.8000000000000004e-003 | K265: 4.1 | L265: 1.7399999999999999e-002 | M265: 114.3 | N265: 4.23 | O265: 0.28000000000000003 | P265: 96.93 | Q265: 已到 | R265: 3.88年 | S265: 1.88年 | T265: 3.1 | U265: 11 | V265: 2.8999999999999998e-002 | W265: 8.0000000000000002e-002 | X265: 7.8e-002 | Y265: 39 | Z265: 1.89 | AA265: -2.1099999999999997e-002 | AB265: -2.75e-002 | AC265: -8.14e-002 | AD265: -8.5099999999999995e-002 | AE265: 92.36 | AF265: 92.12 | AG265: 0.56 | AH265: AA- | AI265: 5.7800000000000004e-002 | AJ265: =H265+100*O265 -> 152.07900000000001 | AK265: 151.2 | AL265: 80 | AM265: 58.9 | AN265: 123 | AO265: -7.6999999999999999e-002 | AP265: 28 | AQ265: 汽模转2
A266: 265 | B266: 123039 | C266: 开润转债! | D266: 300577 | E266: 开润股份 | F266: 服装纺织 | G266: 纺织行业 | H266: 115 | I266: -2.6699999999999998e-002 | J266: 6.8000000000000005e-003 | K266: 18.63 | L266: -0.113 | M266: 120.3 | N266: 29.92 | O266: 0.84699999999999998 | P266: 62.27 | Q266: 已到 | R266: 3.88年 | S266: 1.88年 | T266: 2.22 | U266: 36 | V266: 0.14099999999999999 | W266: 5.0000000000000003e-002 | X266: 3.1e-002 | Y266: 45 | Z266: 2.77 | AA266: 1.18e-002 | AB266: 2.8000000000000004e-003 | AC266: -4.1500000000000002e-002 | AD266: -4.6399999999999997e-002 | AE266: 91.24 | AF266: 93.27 | AG266: 0.18 | AH266: A+ | AI266: 6.88e-002 | AJ266: =H266+100*O266 -> 199.69999999999999 | AK266: 167.7 | AL266: 231 | AM266: 74.5 | AN266: 239 | AO266: -0.14899999999999999 | AP266: 23 | AQ266: 开润转债!
A267: 266 | B267: 123038 | C267: 联得转债! | D267: 300545 | E267: 联得装备 | F267: 机械装备 | G267: 专用设备 | H267: 123.385 | I267: 1.2999999999999999e-003 | J267: 1.2199999999999999e-002 | K267: 20.1 | L267: 3.0200000000000001e-002 | M267: 117.9 | N267: 24.07 | O267: 0.47799999999999998 | P267: 83.51 | Q267: 已到 | R267: 3.88年 | S267: 1.88年 | T267: 1.47 | U267: 12 | V267: 6.4000000000000001e-002 | W267: 4.0999999999999995e-002 | X267: 3.4000000000000002e-002 | Y267: 36 | Z267: 2.58 | AA267: -1.18e-002 | AB267: -1.9599999999999999e-002 | AC267: -7.6399999999999996e-002 | AD267: -8.0600000000000005e-002 | AE267: 90.96 | AF267: 91.4 | AG267: 0.44 | AH267: A+ | AI267: 6.88e-002 | AJ267: =H267+100*O267 -> 171.185 | AK267: 163.3 | AL267: 200 | AM267: 71.9 | AN267: 219 | AO267: -9.5000000000000001e-002 | AP267: 18 | AQ267: 联得转债!
A268: 267 | B268: 113030 | C268: 东风转债! | D268: 601515 | E268: 东风股份 | F268: 造纸包装 | G268: 包装材料 | H268: 129.97 | I268: -1.9400000000000001e-002 | J268: 3.2000000000000001e-002 | K268: 6.75 | L268: 2.2700000000000001e-002 | M268: 116.3 | N268: 6.4 | O268: 0.23199999999999998 | P268: 105.47 | Q268: 已到 | R268: 3.88年 | S268: 1.88年 | T268: 2.95 | U268: 46 | V268: 0.11699999999999999 | W268: 2.7999999999999997e-002 | X268: 2.9999999999999999e-002 | Y268: 104 | Z268: 1.99 | AA268: -2.8500000000000001e-002 | AB268: -3.56e-002 | AC268: -0.10199999999999999 | AD268: -0.106 | AE268: 96.24 | AF268: 101.25 | AG268: 0.55 | AH268: AA | AI268: 3.6799999999999999e-002 | AJ268: =H268+100*O268 -> 153.16999999999999 | AK268: 154.5 | AL268: 111 | AM268: 53.2 | AN268: 79 | AO268: -0.13699999999999998 | AP268: 17 | AQ268: 东风转债!
A269: 268 | B269: 110064 | C269: 建工转债! | D269: 600939 | E269: 重庆建工 | F269: 建筑 | G269: 建筑工程 | H269: 119.31 | I269: -4.5000000000000005e-003 | J269: 2.8999999999999998e-003 | K269: 4.07 | L269: -4.8999999999999998e-003 | M269: 119.2 | N269: 4.53 | O269: 0.32799999999999996 | P269: 89.85 | Q269: 已到 | R269: 3.86年 | S269: 1.86年 | T269: 16.6 | U269: 59 | V269: 2.9999999999999999e-002 | W269: 0.22500000000000001 | X269: 0.20199999999999999 | Y269: 74 | Z269: 1.02 | AA269: -2.0000000000000001e-004 | AB269: -8.8000000000000005e-003 | AC269: -5.4800000000000001e-002 | AD269: -6.0499999999999998e-002 | AE269: 99.2 | AF269: 105.81 | AG269: 0.33 | AH269: AA+ | AI269: 3.1800000000000002e-002 | AJ269: =H269+100*O269 -> 152.11000000000001 | AK269: 148.8 | AL269: 64 | AM269: 43 | AN269: 26 | AO269: -4.8000000000000001e-002 | AP269: 47 | AQ269: 建工转债!
A270: 269 | B270: 128087 | C270: 孚日转债! | D270: 2083 | E270: 孚日股份 | F270: 服装纺织 | G270: 家纺 | H270: 122.999 | I270: -3.0999999999999999e-003 | J270: 7.1999999999999998e-003 | K270: 4.62 | L270: 6.5000000000000006e-003 | M270: 112.3 | N270: 4.5 | O270: 0.19800000000000001 | P270: 102.67 | Q270: 已到 | R270: 3.86年 | S270: 1.86年 | T270: 6.5 | U270: 25 | V270: 3.1e-002 | W270: 0.155 | X270: 0.159 | Y270: 42 | Z270: 1.11 | AA270: -2.3599999999999999e-002 | AB270: -2.9100000000000001e-002 | AC270: -7.8399999999999997e-002 | AD270: -8.2200000000000009e-002 | AE270: 92.51 | AF270: 90.65 | AG270: 0.63 | AH270: AA- | AI270: 5.7800000000000004e-002 | AJ270: =H270+100*O270 -> 142.79900000000001 | AK270: 143.3 | AL270: 28 | AM270: 50.8 | AN270: 60 | AO270: -5.2000000000000005e-002 | AP270: 73 | AQ270: 孚日转债!
A271: 270 | B271: 128085 | C271: 鸿达转债!! | D271: 2002 | E271: 鸿达兴业 | F271: 化工 | G271: 化工 | H271: 136.336 | I271: -3.4000000000000002e-003 | J271: 6.8000000000000005e-003 | K271: 5.18 | L271: 3.9000000000000003e-003 | M271: 123.8 | N271: 3.91 | O271: 2.8999999999999998e-002 | P271: 132.48 | Q271: 已到 | R271: 3.85年 | S271: 1.85年 | T271: 3.39 | U271: 74 | V271: 0.159 | W271: 2.1000000000000001e-002 | X271: 2.7999999999999997e-002 | Y271: 162 | Z271: 1.56 | AA271: -2.5000000000000001e-002 | AB271: -3.49e-002 | AC271: -0.11800000000000001 | AD271: -0.12300000000000001 | AE271: 77.02 | AF271: 68.53 | AG271: 0.87 | AH271: B | AI271: 0.16879999999999998 | AJ271: =H271+100*O271 -> 139.23600000000002 | AK271: 140.2 | AL271: 16 | AM271: 63.2 | AN271: 155 | AO271: -9.5000000000000001e-002 | AP271: 84 | AQ271: 鸿达转债!!
A272: 271 | B272: 110063 | C272: 鹰19转债 | D272: 600567 | E272: 山鹰国际 | F272: 造纸包装 | G272: 包装用纸 | H272: 120.64 | I272: 1.11e-002 | J272: -2.5000000000000001e-003 | K272: 3.14 | L272: 1.95e-002 | M272: 115.4 | N272: 3.26 | O272: 0.253 | P272: 96.32 | Q272: 已到 | R272: 3.85年 | S272: 1.85年 | T272: 18.4 | U272: 6.8 | V272: 3.0000000000000001e-003 | W272: 0.127 | X272: 0.12300000000000001 | Y272: 145 | Z272: 0.9 | AA272: -1.1599999999999999e-002 | AB272: -1.8500000000000003e-002 | AC272: -6.9199999999999998e-002 | AD272: -7.3099999999999998e-002 | AE272: 97.49 | AF272: 102.44 | AG272: 0.44 | AH272: AA+ | AI272: 3.1800000000000002e-002 | AJ272: =H272+100*O272 -> 145.94 | AK272: 145 | AL272: 36 | AM272: 42.5 | AN272: 25 | AO272: -4.2000000000000003e-002 | AP272: 29 | AQ272: 鹰19转债
A273: 272 | B273: 128083 | C273: 新北转债! | D273: 2376 | E273: 新北洋 | F273: 电子 | G273: 电子产品 | H273: 115.5 | I273: 1.55e-002 | J273: -6.7000000000000002e-003 | K273: 8.54 | L273: 4.0199999999999993e-002 | M273: 114.3 | N273: 11.45 | O273: 0.54899999999999993 | P273: 74.59 | Q273: 已到 | R273: 3.84年 | S273: 1.84年 | T273: 8.77 | U273: 14 | V273: 1.3999999999999999e-002 | W273: 0.154 | X273: 0.115 | Y273: 57 | Z273: 1.69 | AA273: -2.7000000000000001e-003 | AB273: -9.300000000000001e-003 | AC273: -4.9200000000000001e-002 | AD273: -5.3200000000000004e-002 | AE273: 96.35 | AF273: 99.63 | AG273: 0.22 | AH273: AA | AI273: 3.6799999999999999e-002 | AJ273: =H273+100*O273 -> 170.39999999999998 | AK273: 156.4 | AL273: 129 | AM273: 56.8 | AN273: 106 | AO273: -6.4000000000000001e-002 | AP273: 22 | AQ273: 新北转债!
A274: 273 | B274: 128082 | C274: 华锋转债!! | D274: 2806 | E274: 华锋股份 | F274: 电子 | G274: 元器件制 | H274: 150.5 | I274: 1.1399999999999999e-002 | J274: 1.46e-002 | K274: 12.41 | L274: 3.2400000000000005e-002 | M274: 120.6 | N274: 9.13 | O274: 0.107 | P274: 135.93 | Q274: 已到 | R274: 3.82年 | S274: 1.82年 | T274: 2.04 | U274: 133 | V274: 0.42399999999999999 | W274: 8.5999999999999993e-002 | X274: 0.11599999999999999 | Y274: 24 | Z274: 2.09 | AA274: -5.7099999999999998e-002 | AB274: -6.5500000000000003e-002 | AC274: -0.13300000000000001 | AD274: -0.13699999999999998 | AE274: 90.03 | AF274: 90.7 | AG274: 0.8 | AH274: A | AI274: 7.8799999999999995e-002 | AJ274: =H274+100*O274 -> 161.19999999999999 | AK274: 165.1 | AL274: 214 | AM274: 74.4 | AN274: 237 | AO274: -9.6000000000000002e-002 | AP274: 46 | AQ274: 华锋转债!!
A275: 274 | B275: 110062 | C275: 烽火转债! | D275: 600498 | E275: 烽火通信 | F275: 通信互联 | G275: 通信设备 | H275: 114.71 | I275: -1.6e-002 | J275: 1.8000000000000002e-002 | K275: 16.35 | L275: 1.18e-002 | M275: 110.3 | N275: 22.85 | O275: 0.60299999999999998 | P275: 71.55 | Q275: 已到 | R275: 3.82年 | S275: 1.82年 | T275: 30.9 | U275: 53 | V275: 1.4999999999999999e-002 | W275: 0.159 | X275: 0.114 | Y275: 194 | Z275: 1.69 | AA275: -1.03e-002 | AB275: -1.52e-002 | AC275: -4.6500000000000007e-002 | AD275: -5.0599999999999999e-002 | AE275: 97.74 | AF275: 98.74 | AG275: 0.17 | AH275: AAA | AI275: 2.98e-002 | AJ275: =H275+100*O275 -> 175.00999999999999 | AK275: 157.9 | AL275: 143 | AM275: 59.1 | AN275: 126 | AO275: -8.3000000000000004e-002 | AP275: 18 | AQ275: 烽火转债!
A276: 275 | B276: 128081 | C276: 海亮转债! | D276: 2203 | E276: 海亮股份 | F276: 有色金属 | G276: 铜金属 | H276: 131.5 | I276: 5.4000000000000003e-003 | J276: -2.8999999999999998e-003 | K276: 11.4 | L276: 3.4999999999999996e-003 | M276: 114.3 | N276: 9.69 | O276: 0.11800000000000001 | P276: 117.65 | Q276: 已到 | R276: 3.79年 | S276: 1.79年 | T276: 30.1 | U276: 55 | V276: 1.3999999999999999e-002 | W276: 0.13400000000000001 | X276: 0.158 | Y276: 224 | Z276: 2.24 | AA276: -3.6699999999999997e-002 | AB276: -4.3099999999999999e-002 | AC276: -0.11199999999999999 | AD276: -0.11599999999999999 | AE276: 96.55 | AF276: 99.84 | AG276: 0.69 | AH276: AA | AI276: 3.6799999999999999e-002 | AJ276: =H276+100*O276 -> 143.30000000000001 | AK276: 145.4 | AL276: 42 | AM276: 45.5 | AN276: 33 | AO276: -5.7000000000000002e-002 | AP276: 43 | AQ276: 海亮转债!
A277: 276 | B277: 113550 | C277: 常汽转债! | D277: 603035 | E277: 常熟汽饰 | F277: 汽车 | G277: 零部件制 | H277: 239.17 | I277: -1.43e-002 | J277: -3.04e-002 | K277: 18.7 | L277: -4.6900000000000004e-002 | M277: 120.5 | N277: 9.33 | O277: 0.193 | P277: 200.43 | Q277: 已到 | R277: 3.78年 | S277: 1.78年 | T277: 2.14 | U277: 498 | V277: 0.96599999999999997 | W277: 3.2000000000000001e-002 | X277: 6.4000000000000001e-002 | Y277: 67 | Z277: 1.72 | AA277: -0.16800000000000001 | AB277: -0.17499999999999999 | AC277: -0.26000000000000001 | AD277: -0.26200000000000001 | AE277: 93.92 | AF277: 97.77 | AG277: 0.95 | AH277: AA- | AI277: 5.7800000000000004e-002 | AJ277: =H277+100*O277 -> 258.46999999999997 | AK277: 277.9 | AL277: 366 | AM277: 180.1 | AN277: 367 | AO277: -3.2000000000000001e-002 | AP277: 14 | AQ277: 常汽转债!
A278: 277 | B278: 113549 | C278: 白电转债! | D278: 603861 | E278: 白云电器 | F278: 能源电力 | G278: 电力设备 | H278: 135.04 | I278: 1.6000000000000001e-003 | J278: 9.0000000000000011e-003 | K278: 10.45 | L278: 1.55e-002 | M278: 114.3 | N278: 9.06 | O278: 0.17100000000000001 | P278: 115.34 | Q278: 已到 | R278: 3.77年 | S278: 1.77年 | T278: 8.05 | U278: 104 | V278: 9.5000000000000001e-002 | W278: 0.17699999999999999 | X278: 0.20399999999999999 | Y278: 46 | Z278: 1.76 | AA278: -4.3700000000000003e-002 | AB278: -5.0000000000000003e-002 | AC278: -0.10400000000000001 | AD278: -0.107 | AE278: 96.61 | AF278: 99.9 | AG278: 0.68 | AH278: AA | AI278: 3.6799999999999999e-002 | AJ278: =H278+100*O278 -> 152.13999999999999 | AK278: 154.7 | AL278: 114 | AM278: 54.8 | AN278: 92 | AO278: -8.900000000000001e-002 | AP278: 35 | AQ278: 白电转债!
A279: 278 | B279: 123035 | C279: 利德转债!! | D279: 300296 | E279: 利亚德 | F279: 电子 | G279: LED制 | H279: 152.199 | I279: 2.98e-002 | J279: -1.4000000000000002e-003 | K279: 9.07 | L279: 3.6600000000000001e-002 | M279: 114.3 | N279: 6.96 | O279: 0.16800000000000001 | P279: 130.32 | Q279: 已到 | R279: 3.77年 | S279: 1.77年 | T279: 7.99 | U279: 177 | V279: 0.14499999999999999 | W279: 3.5000000000000003e-002 | X279: 4.4999999999999998e-002 | Y279: 231 | Z279: 3 | AA279: -7.3899999999999993e-002 | AB279: -7.9899999999999999e-002 | AC279: -0.14599999999999999 | AD279: -0.14800000000000002 | AE279: 97.52 | AF279: 101.72 | AG279: 0.77 | AH279: AA+ | AI279: 3.1800000000000002e-002 | AJ279: =H279+100*O279 -> 168.99900000000002 | AK279: 174.1 | AL279: 271 | AM279: 72.4 | AN279: 220 | AO279: -0.11199999999999999 | AP279: 13 | AQ279: 利德转债!!
A280: 279 | B280: 110061 | C280: 川投转债! | D280: 600674 | E280: 川投能源 | F280: 能源电力 | G280: 水电 | H280: 145.2 | I280: -1.3999999999999999e-002 | J280: 7.3000000000000001e-003 | K280: 11.1 | L280: -8.8999999999999999e-003 | M280: 110.3 | N280: 9.2 | O280: 0.20300000000000001 | P280: 120.65 | Q280: 已到 | R280: 3.76年 | S280: 1.76年 | T280: 39.6 | U280: 14 | V280: 2.e-003 | W280: 8.1000000000000003e-002 | X280: 9.8000000000000004e-002 | Y280: 489 | Z280: 1.6 | AA280: -7.1199999999999999e-002 | AB280: -7.5700000000000003e-002 | AC280: -0.13100000000000001 | AD280: -0.13300000000000001 | AE280: 97.91 | AF280: 98.91 | AG280: 0.75 | AH280: AAA | AI280: 2.98e-002 | AJ280: =H280+100*O280 -> 165.5 | AK280: 169.7 | AL280: 246 | AM280: 70.8 | AN280: 213 | AO280: -4.9000000000000002e-002 | AP280: 12 | AQ280: 川投转债!
A281: 280 | B281: 123034 | C281: 通光转债! | D281: 300265 | E281: 通光线缆 | F281: 通信互联 | G281: 通信设备 | H281: 195.818 | I281: -2.9600000000000001e-002 | J281: 4.9400000000000006e-002 | K281: 9.93 | L281: 2.58e-002 | M281: 117.3 | N281: 7.95 | O281: 0.56799999999999995 | P281: 124.91 | Q281: 已到 | R281: 3.74年 | S281: 1.74年 | T281: 0.78 | U281: 119 | V281: 0.76200000000000001 | W281: 2.1000000000000001e-002 | X281: 2.7000000000000003e-002 | Y281: 36 | Z281: 2.79 | AA281: -0.129 | AB281: -0.13600000000000001 | AC281: -0.222 | AD281: -0.22399999999999998 | AE281: 91.32 | AF281: 91.73 | AG281: 0.76 | AH281: A+ | AI281: 6.88e-002 | AJ281: =H281+100*O281 -> 252.61799999999999 | AK281: 266.7 | AL281: 362 | AM281: 175 | AN281: 365 | AO281: -5.0999999999999997e-002 | AP281: 16 | AQ281: 通光转债!
A282: 281 | B282: 113548 | C282: 石英转债! | D282: 603688 | E282: 石英股份 | F282: 电子 | G282: 电子产品 | H282: 386.96 | I282: -1.0700000000000001e-002 | J282: 5.0000000000000001e-003 | K282: 53.48 | L282: -5.7999999999999996e-003 | M282: 123.7 | N282: 14.93 | O282: 8.0000000000000002e-002 | P282: 358.2 | Q282: 已到 | R282: 3.72年 | S282: 1.72年 | T282: 1.2 | U282: 190 | V282: 0.40600000000000003 | W282: 6.0000000000000001e-003 | X282: 2.3e-002 | Y282: 189 | Z282: 9.2 | AA282: -0.26600000000000001 | AB282: -0.27300000000000002 | AC282: -0.35200000000000004 | AD282: -0.35299999999999998 | AE282: 94.42 | AF282: 100.7 | AG282: 0.98 | AH282: AA- | AI282: 5.7800000000000004e-002 | AJ282: =H282+100*O282 -> 394.95999999999998 | AK282: 415.7 | AL282: 380 | AM282: 315 | AN282: 380 | AO282: -5.7999999999999996e-002 | AP282: 12 | AQ282: 石英转债!
A283: 282 | B283: 110060 | C283: 天路转债! | D283: 600326 | E283: 西藏天路 | F283: 建筑 | G283: 水泥 | H283: 121.69 | I283: -1.4000000000000002e-003 | J283: 2.5000000000000001e-003 | K283: 6.12 | L283: 3.3e-003 | M283: 114.3 | N283: 7.08 | O283: 0.40799999999999997 | P283: 86.44 | Q283: 已到 | R283: 3.72年 | S283: 1.72年 | T283: 7.06 | U283: 1.2 | V283: 1.e-003 | W283: 0.126 | X283: 0.109 | Y283: 56 | Z283: 1.32 | AA283: -1.6899999999999998e-002 | AB283: -2.35e-002 | AC283: -7.8700000000000006e-002 | AD283: -8.2699999999999996e-002 | AE283: 96.78 | AF283: 100.08 | AG283: 0.34 | AH283: AA | AI283: 3.6799999999999999e-002 | AJ283: =H283+100*O283 -> 162.49000000000001 | AK283: 156.9 | AL283: 134 | AM283: 56.9 | AN283: 107 | AO283: -5.7999999999999996e-002 | AP283: 12 | AQ283: 天路转债!
A284: 283 | B284: 110059 | C284: 浦发转债! | D284: 600000 | E284: 浦发银行 | F284: 金融 | G284: 银行行业 | H284: 106.92 | I284: 7.000000000000001e-004 | J284: -8.9999999999999998e-004 | K284: 8.41 | L284: -4.6999999999999993e-003 | M284: 116.8 | N284: 13.97 | O284: 0.77599999999999991 | P284: 60.2 | Q284: 已到 | R284: 3.72年 | S284: 无权 | T284: 500 | U284: 210 | V284: 4.0000000000000001e-003 | W284: 0.20300000000000001 | X284: 0.122 | Y284: 2469. | Z284: 0.45 | AA284: 2.46e-002 | AB284: 1.6299999999999999e-002 | AC284: 无权 | AD284: 无权 | AE284: 无权 | AF284: 104.95 | AG284: 0.06 | AH284: AAA | AI284: 2.98e-002 | AJ284: =H284+100*O284 -> 184.51999999999998 | AK284: 153.6 | AL284: 99 | AM284: 48.7 | AN284: 49 | AO284: -2.5000000000000001e-002 | AP284: 54 | AQ284: 浦发转债!
A285: 284 | B285: 127014 | C285: 北方转债! | D285: 65 | E285: 北方国际 | F285: 建筑 | G285: 建筑工程 | H285: 122 | I285: 0. | J285: 4.3e-003 | K285: 7.8 | L285: 1.1699999999999999e-002 | M285: 114.3 | N285: 8.65 | O285: 0.35299999999999998 | P285: 90.17 | Q285: 已到 | R285: 3.71年 | S285: 1.71年 | T285: 5.35 | U285: 4.1 | V285: 6.0000000000000001e-003 | W285: 8.900000000000001e-002 | X285: 8.0000000000000002e-002 | Y285: 60 | Z285: 1.01 | AA285: -1.7600000000000001e-002 | AB285: -2.4300000000000002e-002 | AC285: -8.0399999999999985e-002 | AD285: -8.4399999999999989e-002 | AE285: 97.7 | AF285: 101.91 | AG285: 0.37 | AH285: AA+ | AI285: 3.1800000000000002e-002 | AJ285: =H285+100*O285 -> 157.30000000000001 | AK285: 153.8 | AL285: 100 | AM285: 51.9 | AN285: 71 | AO285: -5.9999999999999998e-002 | AP285: 16 | AQ285: 北方转债!
A286: 285 | B286: 113546 | C286: 迪贝转债! | D286: 603320 | E286: 迪贝电气 | F286: 家电 | G286: 零部件制 | H286: 121.78 | I286: 1.7299999999999999e-002 | J286: -2.8000000000000004e-003 | K286: 12.6 | L286: 3.0299999999999997e-002 | M286: 119.8 | N286: 14 | O286: 0.35299999999999998 | P286: 90 | Q286: 已到 | R286: 3.71年 | S286: 1.71年 | T286: 2.3 | U286: 4.8 | V286: 1.7000000000000001e-002 | W286: 0.14000000000000001 | X286: 0.126 | Y286: 16 | Z286: 2.25 | AA286: -4.5000000000000005e-003 | AB286: -1.3500000000000002e-002 | AC286: -7.7300000000000008e-002 | AD286: -8.1799999999999998e-002 | AE286: 91.82 | AF286: 93.94 | AG286: 0.48 | AH286: A+ | AI286: 6.88e-002 | AJ286: =H286+100*O286 -> 157.07999999999998 | AK286: 153.6 | AL286: 97 | AM286: 59.6 | AN286: 134 | AO286: -4.8000000000000001e-002 | AP286: 37 | AQ286: 迪贝转债!
A287: 286 | B287: 128079 | C287: 英联转债! | D287: 2846 | E287: 英联股份 | F287: 造纸包装 | G287: 包装材料 | H287: 123.166 | I287: 4.6999999999999993e-003 | J287: 8.9999999999999998e-004 | K287: 7.11 | L287: 1.1399999999999999e-002 | M287: 116.9 | N287: 8.29 | O287: 0.436 | P287: 85.77 | Q287: 已到 | R287: 3.70年 | S287: 1.70年 | T287: 1.52 | U287: 9.9 | V287: 5.2999999999999999e-002 | W287: 6.7000000000000004e-002 | X287: 5.7999999999999996e-002 | Y287: 23 | Z287: 2.8 | AA287: -1.4199999999999999e-002 | AB287: -2.2000000000000002e-002 | AC287: -8.2400000000000001e-002 | AD287: -8.7100000000000011e-002 | AE287: 92.15 | AF287: 91.69 | AG287: 0.49 | AH287: A+ | AI287: 6.88e-002 | AJ287: =H287+100*O287 -> 166.76599999999999 | AK287: 160.6 | AL287: 166 | AM287: 68.4 | AN287: 193 | AO287: -7.4999999999999997e-002 | AP287: 15 | AQ287: 英联转债!
A288: 287 | B288: 128078 | C288: 太极转债! | D288: 2368 | E288: 太极股份 | F288: 计算机及 | G288: 软件开发 | H288: 152.3 | I288: -4.5999999999999999e-003 | J288: -1.18e-002 | K288: 24.11 | L288: -2.7799999999999998e-002 | M288: 116.3 | N288: 22.21 | O288: 0.40299999999999997 | P288: 108.55 | Q288: 已到 | R288: 3.70年 | S288: 1.70年 | T288: 9.6 | U288: 22 | V288: 1.4999999999999999e-002 | W288: 6.9000000000000006e-002 | X288: 7.4999999999999997e-002 | Y288: 140 | Z288: 4.23 | AA288: -7.0900000000000005e-002 | AB288: -7.7899999999999997e-002 | AC288: -0.153 | AD288: -0.155 | AE288: 96.85 | AF288: 101.89 | AG288: 0.59 | AH288: AA | AI288: 3.6799999999999999e-002 | AJ288: =H288+100*O288 -> 192.60000000000002 | AK288: 196 | AL288: 333 | AM288: 94.2 | AN288: 318 | AO288: -0.106 | AP288: 9 | AQ288: 太极转债!
A289: 288 | B289: 128076 | C289: 金轮转债! | D289: 2722 | E289: 金轮股份 | F289: 机械装备 | G289: 专用设备 | H289: 127.551 | I289: 1.6299999999999999e-002 | J289: 8.0000000000000002e-003 | K289: 15.25 | L289: 3.95e-002 | M289: 114.3 | N289: 14.66 | O289: 0.22600000000000001 | P289: 104.02 | Q289: 已到 | R289: 3.68年 | S289: 1.68年 | T289: 2.14 | U289: 18 | V289: 6.7000000000000004e-002 | W289: 8.0000000000000002e-002 | X289: 8.3000000000000004e-002 | Y289: 27 | Z289: 1.37 | AA289: -2.9700000000000001e-002 | AB289: -3.6299999999999999e-002 | AC289: -0.10400000000000001 | AD289: -0.10800000000000001 | AE289: 93.42 | AF289: 93.17 | AG289: 0.61 | AH289: AA- | AI289: 5.7800000000000004e-002 | AJ289: =H289+100*O289 -> 150.15100000000001 | AK289: 151.1 | AL289: 78 | AM289: 57.7 | AN289: 114 | AO289: -4.5999999999999999e-002 | AP289: 37 | AQ289: 金轮转债!
A290: 289 | B290: 113545 | C290: 金能转债! | D290: 603113 | E290: 金能科技 | F290: 煤炭 | G290: 炼焦 | H290: 159.44 | I290: -6.8000000000000005e-003 | J290: 1.26e-002 | K290: 14.02 | L290: 7.1999999999999998e-003 | M290: 114.3 | N290: 10.43 | O290: 0.18600000000000003 | P290: 134.42 | Q290: 已到 | R290: 3.68年 | S290: 1.68年 | T290: 9.87 | U290: 12 | V290: 8.0000000000000002e-003 | W290: 8.199999999999999e-002 | X290: 0.111 | Y290: 120 | Z290: 1.37 | AA290: -8.72e-002 | AB290: -9.3299999999999994e-002 | AC290: -0.17000000000000001 | AD290: -0.17300000000000001 | AE290: 96.92 | AF290: 100.22 | AG290: 0.8 | AH290: AA | AI290: 3.6799999999999999e-002 | AJ290: =H290+100*O290 -> 178.03999999999999 | AK290: 184.5 | AL290: 310 | AM290: 84.2 | AN290: 286 | AO290: -8.3000000000000004e-002 | AP290: 13 | AQ290: 金能转债!
A291: 290 | B291: 128074 | C291: 游族转债!! | D291: 2174 | E291: 游族网络 | F291: 通信互联 | G291: 互联网 | H291: 117.35 | I291: 3.8e-003 | J291: -1.7000000000000001e-003 | K291: 12.1 | L291: 1.26e-002 | M291: 119.3 | N291: 16.97 | O291: 0.64599999999999991 | P291: 71.3 | Q291: 已到 | R291: 3.62年 | S291: 1.62年 | T291: 6.83 | U291: 13 | V291: 1.6e-002 | W291: 6.2e-002 | X291: 4.4000000000000004e-002 | Y291: 111 | Z291: 2.12 | AA291: 4.5999999999999999e-003 | AB291: -4.5999999999999999e-003 | AC291: -6.3600000000000004e-002 | AD291: -6.8000000000000005e-002 | AE291: 97.12 | AF291: 98.97 | AG291: 0.17 | AH291: AA | AI291: 3.6799999999999999e-002 | AJ291: =H291+100*O291 -> 181.94999999999999 | AK291: 163.4 | AL291: 201 | AM291: 64.4 | AN291: 164 | AO291: -0.128 | AP291: 29 | AQ291: 游族转债!!
A292: 291 | B292: 128075 | C292: 远东转债! | D292: 2406 | E292: 远东传动 | F292: 汽车 | G292: 零部件制 | H292: 125.55 | I292: 4.0000000000000001e-003 | J292: 6.5000000000000006e-003 | K292: 5.63 | L292: 1.8100000000000002e-002 | M292: 114.3 | N292: 5.29 | O292: 0.17999999999999999 | P292: 106.43 | Q292: 已到 | R292: 3.62年 | S292: 1.62年 | T292: 5.44 | U292: 19 | V292: 2.7999999999999997e-002 | W292: 0.155 | X292: 0.16500000000000001 | Y292: 35 | Z292: 1.07 | AA292: -2.58e-002 | AB292: -3.2599999999999997e-002 | AC292: -9.8900000000000002e-002 | AD292: -0.10300000000000001 | AE292: 97.12 | AF292: 100.42 | AG292: 0.58 | AH292: AA | AI292: 3.6799999999999999e-002 | AJ292: =H292+100*O292 -> 143.55000000000001 | AK292: 144.7 | AL292: 34 | AM292: 44.2 | AN292: 30 | AO292: -6.7000000000000004e-002 | AP292: 17 | AQ292: 远东转债!
A293: 292 | B293: 123031 | C293: 晶瑞转债! | D293: 300655 | E293: 晶瑞电材 | F293: 电子 | G293: 电子行业 | H293: 380 | I293: -8.1000000000000013e-003 | J293: 2.5499999999999998e-002 | K293: 33.42 | L293: 1.77e-002 | M293: 115.3 | N293: 10.13 | O293: 0.152 | P293: 329.91 | Q293: 已到 | R293: 3.55年 | S293: 1.55年 | T293: 0.53 | U293: 145 | V293: 0.70099999999999996 | W293: 5.0000000000000001e-003 | X293: 1.4999999999999999e-002 | Y293: 116 | Z293: 7.85 | AA293: -0.28600000000000003 | AB293: -0.29100000000000004 | AC293: -0.39200000000000002 | AD293: -0.39299999999999996 | AE293: 92.44 | AF293: 91.28 | AG293: 0.99 | AH293: A+ | AI293: 6.88e-002 | AJ293: =H293+100*O293 -> 395.19999999999999 | AK293: 430.1 | AL293: 381 | AM293: 337.6 | AN293: 381 | AO293: -0.11800000000000001 | AP293: 15 | AQ293: 晶瑞转债!
A294: 293 | B294: 128073 | C294: 哈尔转债! | D294: 2615 | E294: 哈尔斯 | F294: 其他 | G294: 家居用品 | H294: 123 | I294: 1.6500000000000001e-002 | J294: -1.1000000000000001e-002 | K294: 5.31 | L294: 1.34e-002 | M294: 114.5 | N294: 5.7 | O294: 0.32000000000000001 | P294: 93.16 | Q294: 已到 | R294: 2.54年 | S294: 0.54年 | T294: 2.99 | U294: 9.3 | V294: 2.5000000000000001e-002 | W294: 0.13600000000000001 | X294: 0.127 | Y294: 22 | Z294: 2.55 | AA294: -2.7900000000000001e-002 | AB294: -3.7599999999999995e-002 | AC294: -0.24600000000000002 | AD294: -0.252 | AE294: 97.86 | AF294: 99.65 | AG294: 0.41 | AH294: AA- | AI294: 5.6399999999999999e-002 | AJ294: =H294+100*O294 -> 155. | AK294: 152.8 | AL294: 93 | AM294: 53.2 | AN294: 78 | AO294: -6.2e-002 | AP294: 36 | AQ294: 哈尔转债!
A295: 294 | B295: 128072 | C295: 翔鹭转债! | D295: 2842 | E295: 翔鹭钨业 | F295: 有色金属 | G295: 小金属 | H295: 111.71 | I295: 5.3e-003 | J295: -3.3e-003 | K295: 8.95 | L295: 1.5900000000000001e-002 | M295: 114.5 | N295: 15.19 | O295: 0.89599999999999991 | P295: 58.92 | Q295: 已到 | R295: 3.53年 | S295: 1.53年 | T295: 3.02 | U295: 2.2 | V295: 6.9999999999999993e-003 | W295: 0.121 | X295: 7.2000000000000008e-002 | Y295: 25 | Z295: 2.55 | AA295: 7.0999999999999995e-003 | AB295: -2.9999999999999997e-004 | AC295: -3.78e-002 | AD295: -4.2900000000000001e-002 | AE295: 94.42 | AF295: 94.14 | AG295: 0.13 | AH295: AA- | AI295: 5.7800000000000004e-002 | AJ295: =H295+100*O295 -> 201.31 | AK295: 164.5 | AL295: 208 | AM295: 70.1 | AN295: 205 | AO295: -4.8000000000000001e-002 | AP295: 29 | AQ295: 翔鹭转债!
A296: 295 | B296: 128071 | C296: 合兴转债! | D296: 2228 | E296: 合兴包装 | F296: 造纸包装 | G296: 包装材料 | H296: 115.869 | I296: 7.6e-003 | J296: -1.1999999999999999e-003 | K296: 3.5 | L296: 2.0400000000000001e-002 | M296: 114.3 | N296: 4.18 | O296: 0.38400000000000001 | P296: 83.73 | Q296: 已到 | R296: 3.52年 | S296: 1.52年 | T296: 3 | U296: 2.3 | V296: 6.9999999999999993e-003 | W296: 6.9000000000000006e-002 | X296: 5.7999999999999996e-002 | Y296: 43 | Z296: 1.29 | AA296: -3.9000000000000003e-003 | AB296: -1.11e-002 | AC296: -6.0299999999999999e-002 | AD296: -6.5000000000000002e-002 | AE296: 97.48 | AF296: 100.8 | AG296: 0.31 | AH296: AA | AI296: 3.6799999999999999e-002 | AJ296: =H296+100*O296 -> 154.26900000000001 | AK296: 148 | AL296: 60 | AM296: 47.2 | AN296: 44 | AO296: -4.2999999999999997e-002 | AP296: 25 | AQ296: 合兴转债!
A297: 296 | B297: 113542 | C297: 好客转债! | D297: 603898 | E297: 好莱客 | F297: 其他 | G297: 家居用品 | H297: 114.74 | I297: -6.6e-003 | J297: 9.7999999999999997e-003 | K297: 10.99 | L297: 2.4199999999999999e-002 | M297: 114.3 | N297: 16.14 | O297: 0.68500000000000005 | P297: 68.09 | Q297: 已到 | R297: 3.48年 | S297: 1.48年 | T297: 6.03 | U297: 6.1 | V297: 9.0000000000000011e-003 | W297: 0.17600000000000002 | X297: 0.12 | Y297: 34 | Z297: 1.26 | AA297: -1.1000000000000001e-003 | AB297: -8.3999999999999995e-003 | AC297: -5.6100000000000004e-002 | AD297: -6.0899999999999996e-002 | AE297: 97.63 | AF297: 100.95 | AG297: 0.13 | AH297: AA | AI297: 3.6799999999999999e-002 | AJ297: =H297+100*O297 -> 183.24000000000001 | AK297: 161.4 | AL297: 180 | AM297: 60.4 | AN297: 137 | AO297: -9.3000000000000013e-002 | AP297: 17 | AQ297: 好客转债!
A298: 297 | B298: 113541 | C298: 荣晟转债!! | D298: 603165 | E298: 荣晟环保 | F298: 造纸包装 | G298: 包装用纸 | H298: 154.12 | I298: 2.3e-003 | J298: 4.0000000000000002e-004 | K298: 16 | L298: 3.0999999999999999e-003 | M298: 114.3 | N298: 10.84 | O298: 4.4000000000000004e-002 | P298: 147.6 | Q298: 已到 | R298: 3.45年 | S298: 1.45年 | T298: 1.63 | U298: 47 | V298: 0.187 | W298: 3.9e-002 | X298: 5.7000000000000002e-002 | Y298: 42 | Z298: 2.43 | AA298: -8.3699999999999997e-002 | AB298: -9.0200000000000002e-002 | AC298: -0.187 | AD298: -0.19 | AE298: 94.62 | AF298: 94.37 | AG298: 0.87 | AH298: AA- | AI298: 5.7800000000000004e-002 | AJ298: =H298+100*O298 -> 158.52000000000001 | AK298: 160.6 | AL298: 167 | AM298: 66 | AN298: 172 | AO298: -7.5999999999999998e-002 | AP298: 39 | AQ298: 荣晟转债!!
A299: 298 | B299: 128070 | C299: 智能转债! | D299: 2877 | E299: 智能自控 | F299: 机械装备 | G299: 通用设备 | H299: 114.841 | I299: 2.5000000000000001e-003 | J299: 4.0999999999999995e-003 | K299: 6.52 | L299: 2.6800000000000001e-002 | M299: 116.8 | N299: 9.47 | O299: 0.66799999999999993 | P299: 68.85 | Q299: 已到 | R299: 3.40年 | S299: 无权 | T299: 2.3 | U299: 21 | V299: 8.0000000000000002e-002 | W299: 0.106 | X299: 7.2999999999999995e-002 | Y299: 22 | Z299: 2.86 | AA299: 5.1000000000000004e-003 | AB299: -3.5999999999999999e-003 | AC299: 无权 | AD299: 无权 | AE299: 无权 | AF299: 93.5 | AG299: 0.25 | AH299: A+ | AI299: 6.88e-002 | AJ299: =H299+100*O299 -> 181.64099999999999 | AK299: 160.8 | AL299: 169 | AM299: 67.3 | AN299: 185 | AO299: -5.5e-002 | AP299: 28 | AQ299: 智能转债!
A300: 299 | B300: 128069 | C300: 华森转债! | D300: 2907 | E300: 华森制药 | F300: 医药 | G300: 化学制药 | H300: 119.718 | I300: 1.47e-002 | J300: -1.2800000000000001e-002 | K300: 14.36 | L300: 6.3e-003 | M300: 119.3 | N300: 18.01 | O300: 0.501 | P300: 79.73 | Q300: 已到 | R300: 3.37年 | S300: 1.37年 | T300: 3 | U300: 25 | V300: 6.9000000000000006e-002 | W300: 5.2000000000000005e-002 | X300: 4.0999999999999995e-002 | Y300: 58 | Z300: 4.87 | AA300: -1.e-003 | AB300: -1.0800000000000001e-002 | AC300: -8.5900000000000004e-002 | AD300: -9.0800000000000006e-002 | AE300: 95.05 | AF300: 98.92 | AG300: 0.29 | AH300: AA- | AI300: 5.7800000000000004e-002 | AJ300: =H300+100*O300 -> 169.81800000000001 | AK300: 159.7 | AL300: 160 | AM300: 60.8 | AN300: 139 | AO300: -0.153 | AP300: 44 | AQ300: 华森转债!
A301: 300 | B301: 113027 | C301: 华钰转债!! | D301: 601020 | E301: ST华钰 | F301: 有色金属 | G301: 锌铅镍锡 | H301: 130.88 | I301: 3.4999999999999996e-003 | J301: 1.34e-002 | K301: 11.74 | L301: 2.2599999999999999e-002 | M301: 114.3 | N301: 10.17 | O301: 0.13400000000000001 | P301: 115.44 | Q301: 已到 | R301: 3.35年 | S301: 1.35年 | T301: 3.1 | U301: 263 | V301: 0.64500000000000002 | W301: 4.8000000000000001e-002 | X301: 5.5e-002 | Y301: 65 | Z301: 2.51 | AA301: -4.0099999999999997e-002 | AB301: -4.7199999999999999e-002 | AC301: -0.127 | AD301: -0.13100000000000001 | AE301: 92.43 | AF301: 88.98 | AG301: 0.74 | AH301: A | AI301: 7.8799999999999995e-002 | AJ301: =H301+100*O301 -> 144.28 | AK301: 146.3 | AL301: 43 | AM301: 53.9 | AN301: 83 | AO301: -3.5000000000000003e-002 | AP301: 41 | AQ301: 华钰转债!!
A302: 301 | B302: 123027 | C302: 蓝晓转债! | D302: 300487 | E302: 蓝晓科技 | F302: 化工 | G302: 化工 | H302: 368.433 | I302: -5.8999999999999999e-003 | J302: -4.0000000000000001e-003 | K302: 95.22 | L302: -1.01e-002 | M302: 118.8 | N302: 29.02 | O302: 0.12300000000000001 | P302: 328.12 | Q302: 已到 | R302: 3.34年 | S302: 1.34年 | T302: 1.07 | U302: 376 | V302: 0.94299999999999995 | W302: 5.0000000000000001e-003 | X302: 1.7000000000000001e-002 | Y302: 209 | Z302: 10.58 | AA302: -0.28999999999999998 | AB302: -0.29600000000000004 | AC302: -0.45200000000000001 | AD302: -0.45299999999999996 | AE302: 94.99 | AF302: 95.55 | AG302: 0.98 | AH302: A+ | AI302: 6.88e-002 | AJ302: =H302+100*O302 -> 380.733 | AK302: 408.7 | AL302: 377 | AM302: 313.2 | AN302: 379 | AO302: -4.5999999999999999e-002 | AP302: 16 | AQ302: 蓝晓转债!
A303: 302 | B303: 113537 | C303: 文灿转债!! | D303: 603348 | E303: 文灿股份 | F303: 汽车 | G303: 零部件制 | H303: 288.42 | I303: 1.7899999999999999e-002 | J303: -6.2600000000000003e-002 | K303: 46.85 | L303: -4.58e-002 | M303: 120.7 | N303: 19.28 | O303: 0.187 | P303: 243 | Q303: 已到 | R303: 3.34年 | S303: 1.34年 | T303: 1.41 | U303: 496 | V303: 1.24 | W303: 1.1000000000000001e-002 | X303: 2.7999999999999997e-002 | Y303: 123 | Z303: 4.68 | AA303: -0.23199999999999998 | AB303: -0.23899999999999999 | AC303: -0.40299999999999997 | AD303: -0.40500000000000003 | AE303: 96.47 | AF303: 100.41 | AG303: 0.97 | AH303: AA- | AI303: 5.7800000000000004e-002 | AJ303: =H303+100*O303 -> 307.12 | AK303: 333.8 | AL303: 373 | AM303: 233.4 | AN303: 372 | AO303: -0.17000000000000001 | AP303: 22 | AQ303: 文灿转债!!
A304: 303 | B304: 113535 | C304: 大业转债! | D304: 603278 | E304: 大业股份 | F304: 汽车 | G304: 零部件制 | H304: 118.39 | I304: 3.4000000000000002e-003 | J304: 4.0000000000000002e-004 | K304: 10.5 | L304: 1.55e-002 | M304: 112.5 | N304: 12.29 | O304: 0.38600000000000001 | P304: 85.44 | Q304: 已到 | R304: 2.25年 | S304: 0.25年 | T304: 5 | U304: 18 | V304: 2.9999999999999999e-002 | W304: 0.16399999999999998 | X304: 0.14000000000000001 | Y304: 30 | Z304: 1.71 | AA304: -2.2499999999999999e-002 | AB304: -3.2099999999999997e-002 | AC304: -0.34799999999999998 | AD304: -0.35799999999999998 | AE304: 100.25 | AF304: 104.05 | AG304: 0.25 | AH304: AA | AI304: 3.5400000000000001e-002 | AJ304: =H304+100*O304 -> 156.99000000000001 | AK304: 151.3 | AL304: 81 | AM304: 47.3 | AN304: 46 | AO304: -9.1999999999999998e-002 | AP304: 46 | AQ304: 大业转债!
A305: 304 | B305: 128066 | C305: 亚泰转债! | D305: 2811 | E305: 郑中设计 | F305: 建筑 | G305: 装饰工程 | H305: 114.35 | I305: 6.9999999999999993e-003 | J305: 4.4000000000000003e-003 | K305: 8.22 | L305: 2.8799999999999999e-002 | M305: 116.7 | N305: 9.27 | O305: 0.28999999999999998 | P305: 88.67 | Q305: 已到 | R305: 3.19年 | S305: 1.19年 | T305: 4.8 | U305: 8.1 | V305: 1.4999999999999999e-002 | W305: 0.21600000000000003 | X305: 0.192 | Y305: 22 | Z305: 1.6 | AA305: 6.5000000000000006e-003 | AB305: -2.8000000000000004e-003 | AC305: -6.2899999999999998e-002 | AD305: -6.9199999999999998e-002 | AE305: 96.26 | AF305: 97.83 | AG305: 0.4 | AH305: AA- | AI305: 5.7800000000000004e-002 | AJ305: =H305+100*O305 -> 143.34999999999999 | AK305: 140 | AL305: 14 | AM305: 42.2 | AN305: 24 | AO305: -7.400000000000001e-002 | AP305: 67 | AQ305: 亚泰转债!
A306: 305 | B306: 110058 | C306: 永鼎转债! | D306: 600105 | E306: 永鼎股份 | F306: 通信互联 | G306: 通信设备 | H306: 118.3 | I306: -6.4000000000000003e-003 | J306: 1.3500000000000002e-002 | K306: 4.23 | L306: 1.9299999999999998e-002 | M306: 114.3 | N306: 5.04 | O306: 0.40999999999999998 | P306: 83.93 | Q306: 已到 | R306: 3.19年 | S306: 1.19年 | T306: 2.61 | U306: 15 | V306: 4.8000000000000001e-002 | W306: 4.4000000000000004e-002 | X306: 3.7000000000000005e-002 | Y306: 60 | Z306: 2.08 | AA306: -1.09e-002 | AB306: -1.8700000000000001e-002 | AC306: -8.9399999999999993e-002 | AD306: -9.5000000000000001e-002 | AE306: 96.06 | AF306: 95.8 | AG306: 0.37 | AH306: AA- | AI306: 5.7800000000000004e-002 | AJ306: =H306+100*O306 -> 159.30000000000001 | AK306: 152.7 | AL306: 92 | AM306: 56.6 | AN306: 103 | AO306: -0.14499999999999999 | AP306: 44 | AQ306: 永鼎转债!
A307: 306 | B307: 127013 | C307: 创维转债! | D307: 810 | E307: 创维数字 | F307: 电子 | G307: 电子产品 | H307: 144.5 | I307: 0.115 | J307: -5.6399999999999999e-002 | K307: 12.46 | L307: 9.9700000000000011e-002 | M307: 117.3 | N307: 11.29 | O307: 0.309 | P307: 110.36 | Q307: 已到 | R307: 3.18年 | S307: 1.18年 | T307: 9.78 | U307: 1392. | V307: 1.03 | W307: 7.400000000000001e-002 | X307: 8.1000000000000003e-002 | Y307: 132 | Z307: 3.13 | AA307: -6.4100000000000004e-002 | AB307: -7.2700000000000001e-002 | AC307: -0.20100000000000001 | AD307: -0.20399999999999999 | AE307: 98.68 | AF307: 104.71 | AG307: 0.58 | AH307: AA | AI307: 3.6799999999999999e-002 | AJ307: =H307+100*O307 -> 175.40000000000001 | AK307: 178.6 | AL307: 295 | AM307: 73.9 | AN307: 232 | AO307: -4.0000000000000001e-003 | AP307: 25 | AQ307: 创维转债!
A308: 307 | B308: 113026 | C308: 核能转债!! | D308: 601985 | E308: 中国核电 | F308: 能源电力 | G308: 核电 | H308: 123.32 | I308: -1.0700000000000001e-002 | J308: -4.6999999999999993e-003 | K308: 7.05 | L308: -1.54e-002 | M308: 109.3 | N308: 5.73 | O308: 2.e-003 | P308: 123.04 | Q308: 已到 | R308: 29天 | S308: 无权 | T308: 55.7 | U308: 449 | V308: 6.6000000000000003e-002 | W308: 4.4999999999999998e-002 | X308: 5.5e-002 | Y308: 1235. | Z308: 1.91 | AA308: <-100% | AB308: <-100% | AC308: 无权 | AD308: 无权 | AE308: 无权 | AF308: 100.7 | AG308: 1 | AH308: AAA | AI308: 2.3900000000000001e-002 | AJ308: =H308+100*O308 -> 123.52 | AK308: 123.6 | AL308: 2 | AM308: 22.9 | AN308: 2 | AO308: -5.4000000000000006e-002 | AP308: 38 | AQ308: 核能转债!!
A309: 308 | B309: 113025 | C309: 明泰转债!! | D309: 601677 | E309: 明泰铝业 | F309: 有色金属 | G309: 铝金属 | H309: 420.59 | I309: 1.43e-002 | J309: 2.7699999999999999e-002 | K309: 41.6 | L309: 4.2599999999999999e-002 | M309: 114.5 | N309: 11 | O309: 0.11199999999999999 | P309: 378.18 | Q309: 已到 | R309: 3.17年 | S309: 1.17年 | T309: 11 | U309: 208 | V309: 4.4999999999999998e-002 | W309: 3.9e-002 | X309: 0.14599999999999999 | Y309: 284 | Z309: 2.82 | AA309: -0.33799999999999997 | AB309: -0.34299999999999997 | AC309: -0.54600000000000004 | AD309: -0.54700000000000004 | AE309: 98.95 | AF309: 102.27 | AG309: 0.99 | AH309: AA | AI309: 3.6799999999999999e-002 | AJ309: =H309+100*O309 -> 431.78999999999996 | AK309: 463 | AL309: 383 | AM309: 360.7 | AN309: 382 | AO309: 0. | AP309: 17 | AQ309: 明泰转债!!
A310: 309 | B310: 113534 | C310: 鼎胜转债!! | D310: 603876 | E310: 鼎胜新材 | F310: 有色金属 | G310: 小金属 | H310: 279.41 | I310: 5.5e-002 | J310: -6.83e-002 | K310: 35.7 | L310: -1.3500000000000002e-002 | M310: 114.3 | N310: 15.18 | O310: 0.188 | P310: 235.18 | Q310: 已到 | R310: 3.17年 | S310: 1.17年 | T310: 4.04 | U310: 574 | V310: 0.51800000000000002 | W310: 2.3e-002 | X310: 5.5e-002 | Y310: 173 | Z310: 3.71 | AA310: -0.248 | AB310: -0.253 | AC310: -0.45799999999999996 | AD310: -0.45899999999999996 | AE310: 96.17 | AF310: 95.91 | AG310: 0.98 | AH310: AA- | AI310: 5.7800000000000004e-002 | AJ310: =H310+100*O310 -> 298.21000000000004 | AK310: 323.6 | AL310: 370 | AM310: 227.5 | AN310: 371 | AO310: -2.3e-002 | AP310: 27 | AQ310: 鼎胜转债!!
A311: 310 | B311: 113024 | C311: 核建转债! | D311: 601611 | E311: 中国核建 | F311: 建筑 | G311: 建筑工程 | H311: 122.14 | I311: -9.7000000000000003e-003 | J311: -1.e-004 | K311: 8.43 | L311: -2.8799999999999999e-002 | M311: 109.3 | N311: 9.7 | O311: 0.40500000000000003 | P311: 86.91 | Q311: 已到 | R311: 3年59天 | S311: 1年59天 | T311: 30 | U311: 40 | V311: 1.1000000000000001e-002 | W311: 0.13400000000000001 | X311: 0.11699999999999999 | Y311: 223 | Z311: 1.79 | AA311: -3.49e-002 | AB311: -4.0099999999999997e-002 | AC311: -0.106 | AD311: -0.111 | AE311: 99.63 | AF311: 99.74 | AG311: 0.34 | AH311: AAA | AI311: 2.98e-002 | AJ311: =H311+100*O311 -> 162.63999999999999 | AK311: 157.4 | AL311: 138 | AM311: 57.6 | AN311: 113 | AO311: -8.4000000000000005e-002 | AP311: 30 | AQ311: 核建转债!
A312: 311 | B312: 128063 | C312: 未来转债! | D312: 2631 | E312: 德尔未来 | F312: 其他 | G312: 家居用品 | H312: 119.216 | I312: 4.5999999999999999e-003 | J312: -5.9999999999999995e-004 | K312: 6.47 | L312: 2.2099999999999998e-002 | M312: 127.5 | N312: 8.64 | O312: 0.59200000000000008 | P312: 74.88 | Q312: 已到 | R312: 3年54天 | S312: 2年54天 | T312: 6.29 | U312: 3.6 | V312: 5.0000000000000001e-003 | W312: 0.14800000000000002 | X312: 0.111 | Y312: 43 | Z312: 2.49 | AA312: 2.2099999999999998e-002 | AB312: 7.4999999999999997e-003 | AC312: -2.7699999999999999e-002 | AD312: -3.6900000000000002e-002 | AE312: 97.54 | AF312: 107.3 | AG312: 0.18 | AH312: AA- | AI312: 5.7800000000000004e-002 | AJ312: =H312+100*O312 -> 178.416 | AK312: 163.5 | AL312: 205 | AM312: 56.3 | AN312: 100 | AO312: -8.5999999999999993e-002 | AP312: 35 | AQ312: 未来转债!
A313: 312 | B313: 113532 | C313: 海环转债! | D313: 603817 | E313: 海峡环保 | F313: 城市公用 | G313: 三废处理 | H313: 113.88 | I313: 9.0000000000000011e-003 | J313: -4.5999999999999999e-003 | K313: 5.87 | L313: 2.0899999999999998e-002 | M313: 112.3 | N313: 7.63 | O313: 0.47999999999999998 | P313: 76.93 | Q313: 已到 | R313: 3年53天 | S313: 1年53天 | T313: 4.59 | U313: 3.1 | V313: 6.0000000000000001e-003 | W313: 0.17399999999999999 | X313: 0.13400000000000001 | Y313: 26 | Z313: 1.45 | AA313: -4.5000000000000005e-003 | AB313: -1.15e-002 | AC313: -6.4600000000000005e-002 | AD313: -7.0599999999999996e-002 | AE313: 98.81 | AF313: 100.39 | AG313: 0.21 | AH313: AA | AI313: 3.6799999999999999e-002 | AJ313: =H313+100*O313 -> 161.88 | AK313: 150.8 | AL313: 77 | AM313: 50.4 | AN313: 58 | AO313: -5.5e-002 | AP313: 35 | AQ313: 海环转债!
A314: 313 | B314: 128062 | C314: 亚药转债! | D314: 2370 | E314: 亚太药业 | F314: 医药 | G314: 化学制药 | H314: 101.238 | I314: 9.3999999999999986e-003 | J314: -9.300000000000001e-003 | K314: 5.32 | L314: 3.8e-003 | M314: 119.3 | N314: 16.25 | O314: 2.0899999999999999 | P314: 32.74 | Q314: 已到 | R314: 3年53天 | S314: 1年53天 | T314: 9.62 | U314: 45 | V314: 4.7e-002 | W314: 0.33700000000000002 | X314: 0.11 | Y314: 29 | Z314: 7.89 | AA314: 5.4299999999999994e-002 | AB314: 4.2999999999999997e-002 | AC314: 2.5499999999999998e-002 | AD314: 1.84e-002 | AE314: 84.59 | AF314: 73.58 | AG314: 0 | AH314: B | AI314: 0.16879999999999998 | AJ314: =H314+100*O314 -> 310.238 | AK314: 169.7 | AL314: 245 | AM314: 85.1 | AN314: 291 | AO314: -0.214 | AP314: 95 | AQ314: 亚药转债!
A315: 314 | B315: 110057 | C315: 现代转债 | D315: 600420 | E315: 国药现代 | F315: 医药 | G315: 化学制药 | H315: 118.84 | I315: -2.3999999999999998e-003 | J315: 6.3e-003 | K315: 8.84 | L315: 1.03e-002 | M315: 110.3 | N315: 9.79 | O315: 0.316 | P315: 90.3 | Q315: 已到 | R315: 3年52天 | S315: 1年52天 | T315: 16.2 | U315: 12 | V315: 6.0000000000000001e-003 | W315: 0.17800000000000002 | X315: 0.161 | Y315: 91 | Z315: 1.08 | AA315: -2.3700000000000002e-002 | AB315: -2.9500000000000002e-002 | AC315: -9.5399999999999985e-002 | AD315: -0.10099999999999999 | AE315: 99.69 | AF315: 100.7 | AG315: 0.37 | AH315: AAA | AI315: 2.98e-002 | AJ315: =H315+100*O315 -> 150.44 | AK315: 147.4 | AL315: 51 | AM315: 46.7 | AN315: 41 | AO315: -0.10199999999999999 | AP315: 23 | AQ315: 现代转债
A316: 315 | B316: 123025 | C316: 精测转债!! | D316: 300567 | E316: 精测电子 | F316: 电子 | G316: 液晶显示 | H316: 149.49 | I316: 1.6899999999999998e-002 | J316: -1.8200000000000001e-002 | K316: 53.44 | L316: -2.0999999999999999e-003 | M316: 116.5 | N316: 49.37 | O316: 0.38100000000000001 | P316: 108.24 | Q316: 已到 | R316: 3年49天 | S316: 1年49天 | T316: 3.09 | U316: 6.9 | V316: 1.4999999999999999e-002 | W316: 2.1000000000000001e-002 | X316: 2.2000000000000002e-002 | Y316: 149 | Z316: 4.6 | AA316: -7.7300000000000008e-002 | AB316: -8.5500000000000007e-002 | AC316: -0.22600000000000001 | AD316: -0.23000000000000001 | AE316: 96.54 | AF316: 97.92 | AG316: 0.62 | AH316: AA- | AI316: 5.7800000000000004e-002 | AJ316: =H316+100*O316 -> 187.59 | AK316: 190.7 | AL316: 325 | AM316: 92.8 | AN316: 315 | AO316: -0.126 | AP316: 14 | AQ316: 精测转债!!
A317: 316 | B317: 113530 | C317: 大丰转债! | D317: 603081 | E317: 大丰实业 | F317: 建筑 | G317: 装饰工程 | H317: 116.48 | I317: 1.0200000000000001e-002 | J317: -8.3999999999999995e-003 | K317: 11.9 | L317: 1.7100000000000001e-002 | M317: 121 | N317: 16.3 | O317: 0.59499999999999997 | P317: 73.01 | Q317: 已到 | R317: 3年47天 | S317: 1年47天 | T317: 6.3 | U317: 8.2 | V317: 1.1000000000000001e-002 | W317: 0.129 | X317: 9.4e-002 | Y317: 49 | Z317: 2.04 | AA317: 1.24e-002 | AB317: 8.9999999999999998e-004 | AC317: -7.6399999999999996e-002 | AD317: -8.3400000000000002e-002 | AE317: 99.63 | AF317: 108.23 | AG317: 0.11 | AH317: AA | AI317: 3.6799999999999999e-002 | AJ317: =H317+100*O317 -> 175.98000000000002 | AK317: 160 | AL317: 161 | AM317: 51.7 | AN317: 68 | AO317: -9.9000000000000005e-002 | AP317: 29 | AQ317: 大丰转债!
A318: 317 | B318: 127012 | C318: 招路转债! | D318: 1965 | E318: 招商公路 | F318: 机场高速 | G318: 高速 | H318: 118.8 | I318: 5.7999999999999996e-003 | J318: -2.7000000000000001e-003 | K318: 7.98 | L318: 7.6e-003 | M318: 107.9 | N318: 8.63 | O318: 0.28499999999999998 | P318: 92.47 | Q318: 已到 | R318: 3年42天 | S318: 1年42天 | T318: 50 | U318: 14 | V318: 2.e-003 | W318: 0.10099999999999999 | X318: 9.4e-002 | Y318: 493 | Z318: 0.96 | AA318: -3.0600000000000002e-002 | AB318: -3.5099999999999999e-002 | AC318: -0.10000000000000001 | AD318: -0.10400000000000001 | AE318: 98.74 | AF318: 98.52 | AG318: 0.41 | AH318: AAA | AI318: 2.98e-002 | AJ318: =H318+100*O318 -> 147.29999999999998 | AK318: 145.1 | AL318: 37 | AM318: 46.4 | AN318: 38 | AO318: 4.0000000000000001e-003 | AP318: 26 | AQ318: 招路转债!
A319: 318 | B319: 123024 | C319: 岱勒转债! | D319: 300700 | E319: 岱勒新材 | F319: 机械装备 | G319: 专用设备 | H319: 148.09 | I319: 1.43e-002 | J319: 2.0499999999999997e-002 | K319: 19 | L319: 4.1100000000000005e-002 | M319: 112.5 | N319: 14.1 | O319: 9.9000000000000005e-002 | P319: 134.75 | Q319: 已到 | R319: 2年41天 | S319: 41天 | T319: 2.1 | U319: 624 | V319: 1.99 | W319: 0.10300000000000001 | X319: 0.13900000000000001 | Y319: 20 | Z319: 4.3 | AA319: -0.122 | AB319: -0.13100000000000001 | AC319: <-100% | AD319: <-100% | AE319: 99.86 | AF319: 98.04 | AG319: 0.85 | AH319: A+ | AI319: 6.7400000000000002e-002 | AJ319: =H319+100*O319 -> 157.99000000000001 | AK319: 161.4 | AL319: 181 | AM319: 61.6 | AN319: 149 | AO319: 0.106 | AP319: 36 | AQ319: 岱勒转债!
A320: 319 | B320: 123023 | C320: 迪森转债! | D320: 300335 | E320: 迪森股份 | F320: 能源电力 | G320: 电力供应 | H320: 112.163 | I320: 2.0000000000000001e-004 | J320: 8.3999999999999995e-003 | K320: 4.94 | L320: 3.78e-002 | M320: 114.3 | N320: 6.89 | O320: 0.56399999999999995 | P320: 71.7 | Q320: 已到 | R320: 3年40天 | S320: 2年40天 | T320: 5.29 | U320: 9.9 | V320: 1.7000000000000001e-002 | W320: 0.28699999999999998 | X320: 0.20600000000000002 | Y320: 18 | Z320: 1.36 | AA320: 6.1999999999999998e-003 | AB320: -2.0999999999999999e-003 | AC320: -2.29e-002 | AD320: -2.8199999999999999e-002 | AE320: 93.15 | AF320: 96.2 | AG320: 0.23 | AH320: AA- | AI320: 5.7800000000000004e-002 | AJ320: =H320+100*O320 -> 168.56299999999999 | AK320: 152.6 | AL320: 91 | AM320: 56.4 | AN320: 101 | AO320: -0.126 | AP320: 52 | AQ320: 迪森转债!
A321: 320 | B321: 110056 | C321: 亨通转债! | D321: 600487 | E321: 亨通光电 | F321: 通信互联 | G321: 通信设备 | H321: 134.15 | I321: 2.3e-002 | J321: -7.1999999999999998e-003 | K321: 14.04 | L321: 4.1500000000000002e-002 | M321: 114.3 | N321: 14.95 | O321: 0.42799999999999999 | P321: 93.91 | Q321: 已到 | R321: 3年39天 | S321: 1年39天 | T321: 17.1 | U321: 51 | V321: 2.2000000000000002e-002 | W321: 5.2000000000000005e-002 | X321: 4.8000000000000001e-002 | Y321: 332 | Z321: 1.61 | AA321: -5.0799999999999998e-002 | AB321: -5.8400000000000001e-002 | AC321: -0.17100000000000001 | AD321: -0.17600000000000002 | AE321: 99.55 | AF321: 103.84 | AG321: 0.38 | AH321: AA+ | AI321: 3.1800000000000002e-002 | AJ321: =H321+100*O321 -> 176.94999999999999 | AK321: 174.4 | AL321: 274 | AM321: 70.5 | AN321: 210 | AO321: -5.4000000000000006e-002 | AP321: 23 | AQ321: 亨通转债!
A322: 321 | B322: 123022 | C322: 长信转债!! | D322: 300088 | E322: 长信科技 | F322: 通信互联 | G322: 通信设备 | H322: 210 | I322: -1.41e-002 | J322: -3.0999999999999999e-003 | K322: 10.21 | L322: -1.83e-002 | M322: 114.3 | N322: 6.05 | O322: 0.24399999999999999 | P322: 168.76 | Q322: 已到 | R322: 3年38天 | S322: 1年38天 | T322: 2.56 | U322: 108 | V322: 0.19600000000000001 | W322: 1.e-002 | X322: 1.7000000000000001e-002 | Y322: 251 | Z322: 3.32 | AA322: -0.17899999999999999 | AB322: -0.185 | AC322: -0.38900000000000001 | AD322: -0.39100000000000001 | AE322: 98.95 | AF322: 102.32 | AG322: 0.94 | AH322: AA | AI322: 3.6799999999999999e-002 | AJ322: =H322+100*O322 -> 234.40000000000001 | AK322: 251.2 | AL322: 358 | AM322: 148.9 | AN322: 358 | AO322: -0.13100000000000001 | AP322: 11 | AQ322: 长信转债!!
A323: 322 | B323: 110055 | C323: 伊力转债!! | D323: 600197 | E323: 伊力特 | F323: 食品饮料 | G323: 白酒 | H323: 185.59 | I323: -1.7500000000000002e-002 | J323: 2.0999999999999999e-003 | K323: 22.43 | L323: -1.84e-002 | M323: 114.3 | N323: 16.41 | O323: 0.35799999999999998 | P323: 136.68 | Q323: 已到 | R323: 3年35天 | S323: 1年35天 | T323: 2.44 | U323: 89 | V323: 0.19399999999999998 | W323: 2.3e-002 | X323: 3.1e-002 | Y323: 106 | Z323: 2.94 | AA323: -0.14599999999999999 | AB323: -0.153 | AC323: -0.34100000000000003 | AD323: -0.34399999999999997 | AE323: 98.98 | AF323: 102.35 | AG323: 0.84 | AH323: AA | AI323: 3.6799999999999999e-002 | AJ323: =H323+100*O323 -> 221.38999999999999 | AK323: 234.5 | AL323: 353 | AM323: 132.1 | AN323: 350 | AO323: -0.105 | AP323: 20 | AQ323: 伊力转债!!
A324: 323 | B324: 110053 | C324: 苏银转债! | D324: 600919 | E324: 江苏银行 | F324: 金融 | G324: 银行行业 | H324: 123.44 | I324: -4.0000000000000001e-003 | J324: -5.1999999999999998e-003 | K324: 6.58 | L324: -1.9400000000000001e-002 | M324: 118.3 | N324: 6.37 | O324: 0.19500000000000001 | P324: 103.3 | Q324: 已到 | R324: 3年34天 | S324: 无权 | T324: 200 | U324: 158 | V324: 6.0000000000000001e-003 | W324: 0.20600000000000002 | X324: 0.21299999999999999 | Y324: 972 | Z324: 0.66 | AA324: -1.3999999999999999e-002 | AB324: -2.41e-002 | AC324: 无权 | AD324: 无权 | AE324: 无权 | AF324: 108.28 | AG324: 0.48 | AH324: AAA | AI324: 2.98e-002 | AJ324: =H324+100*O324 -> 142.94 | AK324: 143.6 | AL324: 30 | AM324: 35.3 | AN324: 9 | AO324: 1.4999999999999999e-002 | AP324: 32 | AQ324: 苏银转债!
A325: 324 | B325: 127011 | C325: 中鼎转2!!* | D325: 887 | E325: 中鼎股份 | F325: 汽车 | G325: 零部件制 | H325: 173.4 | I325: -5.8099999999999999e-002 | J325: 2.8999999999999998e-003 | K325: 19.85 | L325: -5.5199999999999999e-002 | M325: 114.5 | N325: 11.39 | O325: -5.0000000000000001e-003 | P325: 174.28 | Q325: 已到 | R325: 16天 | S325: 无权 | T325: 9.05 | U325: 423 | V325: 0.26200000000000001 | W325: 3.7999999999999999e-002 | X325: 6.6000000000000003e-002 | Y325: 240 | Z325: 2.63 | AA325: <-100% | AB325: <-100% | AC325: 无权 | AD325: 无权 | AE325: 无权 | AF325: 100.85 | AG325: 1 | AH325: AA+ | AI325: 2.5899999999999999e-002 | AJ325: =H325+100*O325 -> 172.90000000000001 | AK325: 172.5 | AL325: 262 | AM325: 71.7 | AN325: 218 | AO325: -0.111 | AP325: 17 | AQ325: 中鼎转2!!*
A326: 325 | B326: 110052 | C326: 贵广转债! | D326: 600996 | E326: 贵广网络 | F326: 传媒娱乐 | G326: 影视娱乐 | H326: 119.22 | I326: 3.4000000000000002e-003 | J326: 2.7200000000000002e-002 | K326: 7.28 | L326: 9.9700000000000011e-002 | M326: 117.7 | N326: 7.94 | O326: 0.29999999999999999 | P326: 91.69 | Q326: 已到 | R326: 3年25天 | S326: 1年25天 | T326: 15.3 | U326: 1420. | V326: 0.76900000000000002 | W326: 0.19899999999999998 | X326: 0.183 | Y326: 77 | Z326: 2 | AA326: -4.1999999999999997e-003 | AB326: -1.4199999999999999e-002 | AC326: -0.10000000000000001 | AD326: -0.10199999999999999 | AE326: 100.09 | AF326: 107.07 | AG326: 0.31 | AH326: AA+ | AI326: 3.1800000000000002e-002 | AJ326: =H326+100*O326 -> 149.22 | AK326: 146.8 | AL326: 45 | AM326: 39.7 | AN326: 17 | AO326: 0.124 | AP326: 31 | AQ326: 贵广转债!
A327: 326 | B327: 113021 | C327: 中信转债! | D327: 601998 | E327: 中信银行 | F327: 金融 | G327: 银行行业 | H327: 110.7 | I327: -2.7000000000000001e-003 | J327: 2.e-003 | K327: 4.65 | L327: -8.5000000000000006e-003 | M327: 118 | N327: 6.73 | O327: 0.60199999999999998 | P327: 69.09 | Q327: 已到 | R327: 3年24天 | S327: 无权 | T327: 400 | U327: 175 | V327: 4.0000000000000001e-003 | W327: 0.17600000000000002 | X327: 0.121 | Y327: 2275. | Z327: 0.46 | AA327: 2.1600000000000001e-002 | AB327: 1.1000000000000001e-002 | AC327: 无权 | AD327: 无权 | AE327: 无权 | AF327: 108.09 | AG327: 0.09 | AH327: AAA | AI327: 2.98e-002 | AJ327: =H327+100*O327 -> 170.90000000000001 | AK327: 152.3 | AL327: 88 | AM327: 44.2 | AN327: 29 | AO327: -1.e-002 | AP327: 38 | AQ327: 中信转债!
A328: 327 | B328: 128056 | C328: 今飞转债! | D328: 2863 | E328: 今飞凯达 | F328: 汽车 | G328: 零部件制 | H328: 118.862 | I328: 4.5000000000000005e-003 | J328: 4.4000000000000003e-003 | K328: 5.34 | L328: 2.8900000000000002e-002 | M328: 120.2 | N328: 6.69 | O328: 0.48899999999999999 | P328: 79.82 | Q328: 已到 | R328: 3年20天 | S328: 1年20天 | T328: 1.72 | U328: 2.2 | V328: 1.1000000000000001e-002 | W328: 6.5000000000000002e-002 | X328: 5.2000000000000005e-002 | Y328: 27 | Z328: 1.41 | AA328: 3.7000000000000002e-003 | AB328: -7.6e-003 | AC328: -9.5799999999999996e-002 | AD328: -0.10300000000000001 | AE328: 96.27 | AF328: 98.42 | AG328: 0.31 | AH328: A+ | AI328: 6.88e-002 | AJ328: =H328+100*O328 -> 167.762 | AK328: 157.9 | AL328: 144 | AM328: 59.5 | AN328: 133 | AO328: -7.6999999999999999e-002 | AP328: 46 | AQ328: 今飞转债!
A329: 328 | B329: 128053 | C329: 尚荣转债! | D329: 2551 | E329: 尚荣医疗 | F329: 医药 | G329: 医疗器械 | H329: 131.7 | I329: 7.7000000000000002e-003 | J329: -7.7000000000000002e-003 | K329: 5 | L329: 3.0899999999999997e-002 | M329: 114.3 | N329: 4.88 | O329: 0.28499999999999998 | P329: 102.46 | Q329: 已到 | R329: 3年6.6天 | S329: 1年6.6天 | T329: 1.9 | U329: 95 | V329: 0.377 | W329: 4.4999999999999998e-002 | X329: 4.5999999999999999e-002 | Y329: 42 | Z329: 1.34 | AA329: -4.6399999999999997e-002 | AB329: -5.4199999999999998e-002 | AC329: -0.17499999999999999 | AD329: -0.17899999999999999 | AE329: 99.26 | AF329: 102.64 | AG329: 0 | AH329: AA | AI329: 3.6799999999999999e-002 | AJ329: =H329+100*O329 -> 160.19999999999999 | AK329: 160.9 | AL329: 171 | AM329: 58.3 | AN329: 117 | AO329: -8.8000000000000009e-002 | AP329: 21 | AQ329: 尚荣转债!
A330: 329 | B330: 113527 | C330: 维格转债!! | D330: 603518 | E330: 锦泓集团 | F330: 服装纺织 | G330: 服装行业 | H330: 131.07 | I330: 2.4199999999999999e-002 | J330: -8.9999999999999998e-004 | K330: 10.48 | L330: 4.4900000000000002e-002 | M330: 118.5 | N330: 9.85 | O330: 0.23199999999999998 | P330: 106.4 | Q330: 已到 | R330: 2.96年 | S330: 0.96年 | T330: 2.86 | U330: 182 | V330: 0.48499999999999999 | W330: 9.1999999999999998e-002 | X330: 9.8000000000000004e-002 | Y330: 31 | Z330: 1.28 | AA330: -3.3599999999999998e-002 | AB330: -4.3799999999999999e-002 | AC330: -0.184 | AD330: -0.18899999999999997 | AE330: 97.28 | AF330: 103.96 | AG330: 0.52 | AH330: AA | AI330: 4.5400000000000003e-002 | AJ330: =H330+100*O330 -> 154.26999999999998 | AK330: 155.7 | AL330: 124 | AM330: 51.8 | AN330: 69 | AO330: -9.1999999999999998e-002 | AP330: 65 | AQ330: 维格转债!!
A331: 330 | B331: 113526 | C331: 联泰转债! | D331: 603797 | E331: 联泰环保 | F331: 城市公用 | G331: 三废处理 | H331: 223.59 | I331: -1.7000000000000001e-002 | J331: 1.9799999999999998e-002 | K331: 6.2 | L331: 4.8999999999999998e-003 | M331: 109.3 | N331: 5.92 | O331: 1.1299999999999999 | P331: 104.73 | Q331: 已到 | R331: 2.96年 | S331: 0.96年 | T331: 1.93 | U331: 148 | V331: 0.33799999999999997 | W331: 5.2999999999999999e-002 | X331: 5.5999999999999994e-002 | Y331: 36 | Z331: 1.43 | AA331: -0.215 | AB331: -0.21899999999999997 | AC331: -0.47399999999999998 | AD331: -0.47600000000000003 | AE331: 98.66 | AF331: 100.08 | AG331: 0.57 | AH331: AA+ | AI331: 3.04e-002 | AJ331: =H331+100*O331 -> 336.58999999999997 | AK331: 342.5 | AL331: 374 | AM331: 242.4 | AN331: 374 | AO331: -7.8e-002 | AP331: 7 | AQ331: 联泰转债!
A332: 331 | B332: 123018 | C332: 溢利转债! | D332: 300381 | E332: 溢多利 | F332: 医药 | G332: 原料药 | H332: 181.001 | I332: -2.69e-002 | J332: 3.8300000000000001e-002 | K332: 10.29 | L332: 1.4800000000000001e-002 | M332: 113.3 | N332: 8.25 | O332: 0.45100000000000001 | P332: 124.73 | Q332: 已到 | R332: 2.86年 | S332: 0.86年 | T332: 0.54 | U332: 117 | V332: 1.1599999999999999 | W332: 1.1000000000000001e-002 | X332: 1.3000000000000001e-002 | Y332: 50 | Z332: 1.7 | AA332: -0.151 | AB332: -0.158 | AC332: -0.41700000000000004 | AD332: -0.41999999999999998 | AE332: 96.43 | AF332: 96.9 | AG332: 0.77 | AH332: AA- | AI332: 5.6399999999999999e-002 | AJ332: =H332+100*O332 -> 226.101 | AK332: 237.3 | AL332: 355 | AM332: 140.4 | AN332: 355 | AO332: -8.4000000000000005e-002 | AP332: 9 | AQ332: 溢利转债!
A333: 332 | B333: 113525 | C333: 台华转债!! | D333: 603055 | E333: 台华新材 | F333: 服装纺织 | G333: 纺织行业 | H333: 202.44 | I333: -4.2300000000000004e-002 | J333: -2.2000000000000001e-003 | K333: 14.22 | L333: -4.6300000000000001e-002 | M333: 113.3 | N333: 7.78 | O333: 0.10800000000000001 | P333: 182.78 | Q333: 已到 | R333: 2.86年 | S333: 0.86年 | T333: 1.82 | U333: 91 | V333: 0.24100000000000002 | W333: 1.4999999999999999e-002 | X333: 2.7000000000000003e-002 | Y333: 124 | Z333: 3.45 | AA333: -0.184 | AB333: -0.191 | AC333: -0.47999999999999998 | AD333: -0.48200000000000004 | AE333: 98.48 | AF333: 102.64 | AG333: 0.96 | AH333: AA | AI333: 3.5400000000000001e-002 | AJ333: =H333+100*O333 -> 213.24000000000001 | AK333: 222.1 | AL333: 347 | AM333: 119.5 | AN333: 344 | AO333: -0.11900000000000001 | AP333: 17 | AQ333: 台华转债!!
A334: 333 | B334: 113524 | C334: 奇精转债! | D334: 603677 | E334: 奇精机械 | F334: 家电 | G334: 零部件制 | H334: 119.01 | I334: 3.4999999999999996e-003 | J334: 3.5999999999999999e-003 | K334: 11.77 | L334: 2.1700000000000001e-002 | M334: 116.3 | N334: 13.98 | O334: 0.41399999999999998 | P334: 84.19 | Q334: 已到 | R334: 2.85年 | S334: 0.85年 | T334: 3.3 | U334: 3.4 | V334: 9.0000000000000011e-003 | W334: 0.14599999999999999 | X334: 0.12300000000000001 | Y334: 23 | Z334: 2.22 | AA334: -8.1000000000000013e-003 | AB334: -1.7899999999999999e-002 | AC334: -0.129 | AD334: -0.13500000000000001 | AE334: 96.52 | AF334: 99.55 | AG334: 0.32 | AH334: AA- | AI334: 5.6399999999999999e-002 | AJ334: =H334+100*O334 -> 160.41 | AK334: 153.8 | AL334: 101 | AM334: 54.3 | AN334: 87 | AO334: -5.9000000000000004e-002 | AP334: 40 | AQ334: 奇精转债!
A335: 334 | B335: 110048 | C335: 福能转债!! | D335: 600483 | E335: 福能股份 | F335: 能源电力 | G335: 电力供应 | H335: 206.27 | I335: -2.2599999999999999e-002 | J335: 3.3799999999999997e-002 | K335: 12.81 | L335: 1.18e-002 | M335: 112.3 | N335: 7.85 | O335: 0.26400000000000001 | P335: 163.18 | Q335: 已到 | R335: 2.83年 | S335: 0.83年 | T335: 12.8 | U335: 296 | V335: 0.114 | W335: 5.0999999999999997e-002 | X335: 8.3000000000000004e-002 | Y335: 250 | Z335: 3.16 | AA335: -0.19399999999999998 | AB335: -0.20000000000000001 | AC335: -0.504 | AD335: -0.50700000000000001 | AE335: 99.05 | AF335: 103.22 | AG335: 0.94 | AH335: AA+ | AI335: 3.04e-002 | AJ335: =H335+100*O335 -> 232.67000000000002 | AK335: 249.4 | AL335: 357 | AM335: 146.1 | AN335: 357 | AO335: -7.9000000000000001e-002 | AP335: 9 | AQ335: 福能转债!!
A336: 335 | B336: 128049 | C336: 华源转债! | D336: 2787 | E336: 华源控股 | F336: 造纸包装 | G336: 包装材料 | H336: 113.285 | I336: 6.1999999999999998e-003 | J336: 3.9000000000000003e-003 | K336: 5.85 | L336: 3.5400000000000001e-002 | M336: 113.5 | N336: 7.37 | O336: 0.42700000000000005 | P336: 79.38 | Q336: 已到 | R336: 2.80年 | S336: 0.80年 | T336: 3.63 | U336: 3.6 | V336: 9.0000000000000011e-003 | W336: 0.19600000000000001 | X336: 0.156 | Y336: 18 | Z336: 1.21 | AA336: 7.000000000000001e-004 | AB336: -7.9000000000000008e-003 | AC336: -8.7799999999999989e-002 | AD336: -9.4499999999999987e-002 | AE336: 96.98 | AF336: 97.42 | AG336: 0.28 | AH336: AA- | AI336: 5.6399999999999999e-002 | AJ336: =H336+100*O336 -> 155.98500000000001 | AK336: 147.2 | AL336: 48 | AM336: 49.8 | AN336: 53 | AO336: -4.4999999999999998e-002 | AP336: 44 | AQ336: 华源转债!
A337: 336 | B337: 110047 | C337: 山鹰转债 | D337: 600567 | E337: 山鹰国际 | F337: 造纸包装 | G337: 包装用纸 | H337: 119.51 | I337: 9.4999999999999998e-003 | J337: -2.5999999999999999e-003 | K337: 3.14 | L337: 1.95e-002 | M337: 116.5 | N337: 3.3 | O337: 0.25600000000000001 | P337: 95.15 | Q337: 已到 | R337: 2.79年 | S337: 0.79年 | T337: 22.5 | U337: 16 | V337: 6.0000000000000001e-003 | W337: 0.155 | X337: 0.14699999999999999 | Y337: 145 | Z337: 0.9 | AA337: -9.1999999999999998e-003 | AB337: -1.9299999999999998e-002 | AC337: -0.14099999999999999 | AD337: -0.14699999999999999 | AE337: 99.4 | AF337: 107.23 | AG337: 0.35 | AH337: AA+ | AI337: 3.04e-002 | AJ337: =H337+100*O337 -> 145.11000000000001 | AK337: 143.9 | AL337: 32 | AM337: 36.6 | AN337: 12 | AO337: -4.2000000000000003e-002 | AP337: 27 | AQ337: 山鹰转债
A338: 337 | B338: 128048 | C338: 张行转债 | D338: 2839 | E338: 张家港行 | F338: 金融 | G338: 银行行业 | H338: 128 | I338: -1.46e-002 | J338: -1.1999999999999999e-003 | K338: 6.2 | L338: -2.6699999999999998e-002 | M338: 112.3 | N338: 5.6 | O338: 0.156 | P338: 110.71 | Q338: 已到 | R338: 2.76年 | S338: 无权 | T338: 25 | U338: 57 | V338: 1.8000000000000002e-002 | W338: 0.223 | X338: 0.247 | Y338: 112 | Z338: 0.97 | AA338: -4.6500000000000007e-002 | AB338: -5.4000000000000006e-002 | AC338: 无权 | AD338: 无权 | AE338: 无权 | AF338: 103.44 | AG338: 0.59 | AH338: AA+ | AI338: 3.04e-002 | AJ338: =H338+100*O338 -> 143.59999999999999 | AK338: 145.3 | AL338: 39 | AM338: 41.8 | AN338: 22 | AO338: 0. | AP338: 11 | AQ338: 张行转债
A339: 338 | B339: 113519 | C339: 长久转债! | D339: 603569 | E339: 长久物流 | F339: 交通运输 | G339: 物流业 | H339: 114.59 | I339: -2.3999999999999998e-003 | J339: 4.0000000000000001e-003 | K339: 6.89 | L339: 3.7699999999999997e-002 | M339: 118.3 | N339: 11.04 | O339: 0.83599999999999997 | P339: 62.41 | Q339: 已到 | R339: 2.75年 | S339: 0.75年 | T339: 6.97 | U339: 8.9 | V339: 1.1000000000000001e-002 | W339: 0.18100000000000002 | X339: 0.113 | Y339: 39 | Z339: 1.82 | AA339: 1.1699999999999999e-002 | AB339: 2.0000000000000001e-004 | AC339: -0.10800000000000001 | AD339: -0.115 | AE339: 98.85 | AF339: 107.57 | AG339: 0.04 | AH339: AA | AI339: 3.5400000000000001e-002 | AJ339: =H339+100*O339 -> 198.19 | AK339: 166.8 | AL339: 227 | AM339: 59.2 | AN339: 127 | AO339: -5.4000000000000006e-002 | AP339: 28 | AQ339: 长久转债!
A340: 339 | B340: 128046 | C340: 利尔转债!! | D340: 2258 | E340: 利尔化学 | F340: 化工 | G340: 农化 | H340: 163.827 | I340: 2.6000000000000002e-002 | J340: -1.6500000000000001e-002 | K340: 28.76 | L340: 1.0200000000000001e-002 | M340: 111.3 | N340: 18.42 | O340: 4.9000000000000002e-002 | P340: 156.13 | Q340: 已到 | R340: 2.69年 | S340: 0.69年 | T340: 8.08 | U340: 102 | V340: 7.6999999999999999e-002 | W340: 5.2999999999999999e-002 | X340: 8.3000000000000004e-002 | Y340: 151 | Z340: 3.5 | AA340: -0.13400000000000001 | AB340: -0.14099999999999999 | AC340: -0.441 | AD340: -0.44500000000000001 | AE340: 99.05 | AF340: 101.42 | AG340: 0.93 | AH340: AA | AI340: 3.5400000000000001e-002 | AJ340: =H340+100*O340 -> 168.727 | AK340: 171.5 | AL340: 256 | AM340: 70.1 | AN340: 206 | AO340: -9.0999999999999998e-002 | AP340: 9 | AQ340: 利尔转债!!
A341: 340 | B341: 128044 | C341: 岭南转债! | D341: 2717 | E341: 岭南股份 | F341: 城市公用 | G341: 生态环境 | H341: 121.917 | I341: -1.6299999999999999e-002 | J341: -8.6e-003 | K341: 3.5 | L341: -4.3700000000000003e-002 | M341: 110.3 | N341: 3.43 | O341: 0.19500000000000001 | P341: 102.04 | Q341: 已到 | R341: 2.51年 | S341: 0.51年 | T341: 6.58 | U341: 754 | V341: 0.92400000000000004 | W341: 0.11199999999999999 | X341: 0.114 | Y341: 59 | Z341: 1.25 | AA341: -3.9300000000000002e-002 | AB341: -4.6300000000000001e-002 | AC341: -0.23399999999999999 | AD341: -0.24199999999999999 | AE341: 98.3 | AF341: 96.18 | AG341: 0.57 | AH341: AA- | AI341: 5.6399999999999999e-002 | AJ341: =H341+100*O341 -> 141.417 | AK341: 141.8 | AL341: 23 | AM341: 43.5 | AN341: 27 | AO341: -8.5999999999999993e-002 | AP341: 55 | AQ341: 岭南转债!
A342: 341 | B342: 123015 | C342: 蓝盾转债!! | D342: 300297 | E342: 蓝盾股份 | F342: 计算机及 | G342: 软件开发 | H342: 210.243 | I342: -1.55e-002 | J342: 1.55e-002 | K342: 3.07 | L342: 2.6800000000000001e-002 | M342: 111.3 | N342: 5.79 | O342: 2.9700000000000002 | P342: 53.02 | Q342: 已到 | R342: 2.51年 | S342: 0.51年 | T342: 1 | U342: 302 | V342: 1.3999999999999999 | W342: 2.6000000000000002e-002 | X342: 1.3999999999999999e-002 | Y342: 38 | Z342: 2.16 | AA342: -0.22399999999999998 | AB342: -0.23000000000000001 | AC342: -0.78200000000000003 | AD342: -0.78500000000000003 | AE342: 94.64 | AF342: 84.4 | AG342: 0 | AH342: BBB- | AI342: 0.1174 | AJ342: =H342+100*O342 -> 507.24299999999999 | AK342: 367.5 | AL342: 375 | AM342: 272.8 | AN342: 376 | AO342: -0.106 | AP342: 14 | AQ342: 蓝盾转债!!
A343: 342 | B343: 113516 | C343: 苏农转债! | D343: 603323 | E343: 苏农银行 | F343: 金融 | G343: 银行行业 | H343: 123.46 | I343: -1.18e-002 | J343: 4.7999999999999996e-003 | K343: 5.27 | L343: -1.6799999999999999e-002 | M343: 113.3 | N343: 5.37 | O343: 0.25800000000000001 | P343: 98.14 | Q343: 已到 | R343: 2.48年 | S343: 无权 | T343: 12.9 | U343: 41 | V343: 2.6000000000000002e-002 | W343: 0.13600000000000001 | X343: 0.13300000000000001 | Y343: 95 | Z343: 0.74 | AA343: -3.4200000000000001e-002 | AB343: -4.3299999999999998e-002 | AC343: 无权 | AD343: 无权 | AE343: 无权 | AF343: 105.23 | AG343: 0.42 | AH343: AA+ | AI343: 3.04e-002 | AJ343: =H343+100*O343 -> 149.25999999999999 | AK343: 148.8 | AL343: 65 | AM343: 43.5 | AN343: 28 | AO343: 4.0000000000000001e-003 | AP343: 23 | AQ343: 苏农转债!
A344: 343 | B344: 123014 | C344: 凯发转债! | D344: 300407 | E344: 凯发电气 | F344: 能源电力 | G344: 电力设备 | H344: 131.1 | I344: -9.1000000000000004e-003 | J344: 3.4300000000000004e-002 | K344: 8.15 | L344: 4.7599999999999996e-002 | M344: 107.5 | N344: 8.05 | O344: 0.29499999999999998 | P344: 101.24 | Q344: 已到 | R344: 1.46年 | S344: 回售内 | T344: 1.16 | U344: 21 | V344: 0.13600000000000001 | W344: 4.7e-002 | X344: 4.7e-002 | Y344: 25 | Z344: 1.8 | AA344: -0.125 | AB344: -0.13400000000000001 | AC344: 回售内 | AD344: 回售内 | AE344: 101.71 | AF344: 97.62 | AG344: 0.53 | AH344: A+ | AI344: 6.7400000000000002e-002 | AJ344: =H344+100*O344 -> 160.59999999999999 | AK344: 161 | AL344: 172 | AM344: 59.2 | AN344: 129 | AO344: -6.7000000000000004e-002 | AP344: 16 | AQ344: 凯发转债!
A345: 344 | B345: 128042 | C345: 凯中转债! | D345: 2823 | E345: 凯中精密 | F345: 能源电力 | G345: 电力设备 | H345: 117.88 | I345: -1.e-003 | J345: 5.5000000000000005e-003 | K345: 9.86 | L345: 3.3500000000000002e-002 | M345: 115.3 | N345: 12.86 | O345: 0.53700000000000003 | P345: 76.67 | Q345: 已到 | R345: 2.47年 | S345: 0.47年 | T345: 4.16 | U345: 4.5 | V345: 9.0000000000000011e-003 | W345: 0.14699999999999999 | X345: 0.113 | Y345: 28 | Z345: 2.16 | AA345: -9.0000000000000011e-003 | AB345: -1.9699999999999999e-002 | AC345: -0.20300000000000001 | AD345: -0.21199999999999999 | AE345: 99.8 | AF345: 105.85 | AG345: 0.13 | AH345: AA | AI345: 3.5400000000000001e-002 | AJ345: =H345+100*O345 -> 171.57999999999998 | AK345: 159.1 | AL345: 152 | AM345: 53.2 | AN345: 80 | AO345: -7.6999999999999999e-002 | AP345: 25 | AQ345: 凯中转债!
A346: 345 | B346: 123013 | C346: 横河转债! | D346: 300539 | E346: 横河精密 | F346: 机械装备 | G346: 专用设备 | H346: 347 | I346: -8.6e-003 | J346: 1.8600000000000002e-002 | K346: 7.75 | L346: 2.7900000000000001e-002 | M346: 114 | N346: 9.04 | O346: 3.0499999999999998 | P346: 85.73 | Q346: 已到 | R346: 2.46年 | S346: 0.46年 | T346: 0.38 | U346: 2600. | V346: 19.399999999999999 | W346: 2.2000000000000002e-002 | X346: 1.9e-002 | Y346: 17 | Z346: 3.49 | AA346: -0.36499999999999999 | AB346: -0.37 | AC346: <-100% | AD346: <-100% | AE346: 98.38 | AF346: 97.25 | AG346: 0.36 | AH346: A+ | AI346: 6.7400000000000002e-002 | AJ346: =H346+100*O346 -> 652. | AK346: 608.3 | AL346: 385 | AM346: 509.9 | AN346: 385 | AO346: -4.9000000000000002e-002 | AP346: 11 | AQ346: 横河转债!
A347: 346 | B347: 123012 | C347: 万顺转债! | D347: 300057 | E347: 万顺新材 | F347: 有色金属 | G347: 铝金属 | H347: 164.499 | I347: -4.0000000000000001e-002 | J347: 1.7600000000000001e-002 | K347: 8 | L347: -2.4399999999999998e-002 | M347: 109.3 | N347: 5.27 | O347: 8.4000000000000005e-002 | P347: 151.8 | Q347: 已到 | R347: 2.45年 | S347: 0.45年 | T347: 1.22 | U347: 110 | V347: 0.53200000000000003 | W347: 2.2000000000000002e-002 | X347: 3.4000000000000002e-002 | Y347: 55 | Z347: 1.52 | AA347: -0.155 | AB347: -0.16 | AC347: -0.64000000000000001 | AD347: -0.64500000000000002 | AE347: 98.67 | AF347: 95.67 | AG347: 0.92 | AH347: AA- | AI347: 5.6399999999999999e-002 | AJ347: =H347+100*O347 -> 172.899 | AK347: 177.2 | AL347: 289 | AM347: 78.5 | AN347: 263 | AO347: -9.4e-002 | AP347: 23 | AQ347: 万顺转债!
A348: 347 | B348: 123011 | C348: 德尔转债! | D348: 300473 | E348: 德尔股份 | F348: 汽车 | G348: 零部件制 | H348: 118 | I348: -5.1000000000000004e-003 | J348: 9.8999999999999991e-003 | K348: 21.1 | L348: 4.5100000000000001e-002 | M348: 115.3 | N348: 31.38 | O348: 0.755 | P348: 67.24 | Q348: 已到 | R348: 2.44年 | S348: 0.44年 | T348: 2.51 | U348: 7.9 | V348: 2.7000000000000003e-002 | W348: 8.8000000000000009e-002 | X348: 5.9000000000000004e-002 | Y348: 28 | Z348: 1.34 | AA348: -9.4999999999999998e-003 | AB348: -2.0299999999999999e-002 | AC348: -0.21600000000000003 | AD348: -0.22600000000000001 | AE348: 98.7 | AF348: 100.94 | AG348: 0.11 | AH348: AA- | AI348: 5.6399999999999999e-002 | AJ348: =H348+100*O348 -> 193.5 | AK348: 168.8 | AL348: 240 | AM348: 67.8 | AN348: 187 | AO348: -8.5999999999999993e-002 | AP348: 37 | AQ348: 德尔转债!
A349: 348 | B349: 128041 | C349: 盛路转债!! | D349: 2446 | E349: 盛路通信 | F349: 通信互联 | G349: 通信设备 | H349: 253.22 | I349: -3.5400000000000001e-002 | J349: 4.5199999999999997e-002 | K349: 6.21 | L349: 2.4799999999999999e-002 | M349: 113.3 | N349: 6.82 | O349: 1.78 | P349: 91.06 | Q349: 已到 | R349: 2.44年 | S349: 0.44年 | T349: 0.53 | U349: 443 | V349: 3.23 | W349: 9.0000000000000011e-003 | X349: 9.0000000000000011e-003 | Y349: 56 | Z349: 1.84 | AA349: -0.28199999999999997 | AB349: -0.28800000000000003 | AC349: <-100% | AD349: <-100% | AE349: 99.93 | AF349: 104.14 | AG349: 0.4 | AH349: AA | AI349: 3.5400000000000001e-002 | AJ349: =H349+100*O349 -> 431.22000000000003 | AK349: 415.4 | AL349: 379 | AM349: 311.2 | AN349: 377 | AO349: 2.5000000000000001e-002 | AP349: 10 | AQ349: 盛路转债!!
A350: 349 | B350: 110045 | C350: 海澜转债! | D350: 600398 | E350: 海澜之家 | F350: 服装纺织 | G350: 服装行业 | H350: 114.42 | I350: -4.4000000000000003e-003 | J350: 6.4000000000000003e-003 | K350: 6.01 | L350: 8.3999999999999995e-003 | M350: 110.3 | N350: 7.04 | O350: 0.34000000000000002 | P350: 85.37 | Q350: 已到 | R350: 2.43年 | S350: 0.43年 | T350: 29.5 | U350: 18 | V350: 5.0000000000000001e-003 | W350: 0.114 | X350: 9.6999999999999989e-002 | Y350: 260 | Z350: 1.84 | AA350: -1.4999999999999999e-002 | AB350: -2.2599999999999999e-002 | AC350: -0.188 | AD350: -0.19500000000000001 | AE350: 99.69 | AF350: 102.58 | AG350: 0.24 | AH350: AA+ | AI350: 3.04e-002 | AJ350: =H350+100*O350 -> 148.42000000000002 | AK350: 143.5 | AL350: 29 | AM350: 40.9 | AN350: 19 | AO350: -5.9000000000000004e-002 | AP350: 42 | AQ350: 海澜转债!
A351: 350 | B351: 123010 | C351: 博世转债! | D351: 300422 | E351: 博世科 | F351: 城市公用 | G351: 三废处理 | H351: 111.284 | I351: 2.3999999999999998e-003 | J351: -1.1000000000000001e-003 | K351: 7.31 | L351: 1.8100000000000002e-002 | M351: 111.3 | N351: 11.26 | O351: 0.71400000000000008 | P351: 64.92 | Q351: 已到 | R351: 2.40年 | S351: 0.40年 | T351: 4.3 | U351: 2.9 | V351: 6.0000000000000001e-003 | W351: 0.11599999999999999 | X351: 7.5999999999999998e-002 | Y351: 37 | Z351: 1.14 | AA351: 1.e-004 | AB351: -8.5000000000000006e-003 | AC351: -0.13200000000000001 | AD351: -0.14300000000000002 | AE351: 98.9 | AF351: 97.63 | AG351: 0.07 | AH351: AA- | AI351: 5.6399999999999999e-002 | AJ351: =H351+100*O351 -> 182.68400000000003 | AK351: 157.6 | AL351: 141 | AM351: 58.8 | AN351: 121 | AO351: -0.157 | AP351: 35 | AQ351: 博世转债!
A352: 351 | B352: 127007 | C352: 湖广转债!! | D352: 665 | E352: 湖北广电 | F352: 传媒娱乐 | G352: 影视娱乐 | H352: 153.144 | I352: -1.46e-002 | J352: -4.3099999999999999e-002 | K352: 7.25 | L352: -7.17e-002 | M352: 111.3 | N352: 5.58 | O352: 0.17899999999999999 | P352: 129.93 | Q352: 已到 | R352: 2.39年 | S352: 0.39年 | T352: 4.15 | U352: 3289. | V352: 5.0099999999999998 | W352: 5.5999999999999994e-002 | X352: 7.2999999999999995e-002 | Y352: 74 | Z352: 1.25 | AA352: -0.126 | AB352: -0.13300000000000001 | AC352: -0.627 | AD352: -0.63300000000000001 | AE352: 100.38 | AF352: 103.68 | AG352: 0.8 | AH352: AA+ | AI352: 3.04e-002 | AJ352: =H352+100*O352 -> 171.04400000000001 | AK352: 176.4 | AL352: 284 | AM352: 72.7 | AN352: 222 | AO352: -0.20199999999999999 | AP352: 32 | AQ352: 湖广转债!!
A353: 352 | B353: 110044 | C353: 广电转债!! | D353: 600831 | E353: 广电网络 | F353: 传媒娱乐 | G353: 影视娱乐 | H353: 201.63 | I353: 6.7000000000000002e-003 | J353: 7.9000000000000008e-003 | K353: 5.93 | L353: 5.33e-002 | M353: 111.3 | N353: 6.87 | O353: 1.3400000000000001 | P353: 86.32 | Q353: 已到 | R353: 2.38年 | S353: 0.38年 | T353: 0.71 | U353: 959 | V353: 6.5300000000000002 | W353: 1.7000000000000001e-002 | X353: 1.4999999999999999e-002 | Y353: 42 | Z353: 1.12 | AA353: -0.221 | AB353: -0.22699999999999998 | AC353: -0.93999999999999995 | AD353: -0.94400000000000006 | AE353: 100.12 | AF353: 102.5 | AG353: 0.27 | AH353: AA | AI353: 3.5400000000000001e-002 | AJ353: =H353+100*O353 -> 335.63 | AK353: 316.9 | AL353: 369 | AM353: 214.4 | AN353: 369 | AO353: -4.7e-002 | AP353: 9 | AQ353: 广电转债!!
A354: 353 | B354: 128040 | C354: 华通转债! | D354: 2758 | E354: 浙农股份 | F354: 医药 | G354: 医药商业 | H354: 128.814 | I354: 2.06e-002 | J354: 5.8999999999999999e-003 | K354: 11.01 | L354: 4.4600000000000001e-002 | M354: 111.3 | N354: 10.03 | O354: 0.17300000000000001 | P354: 109.77 | Q354: 已到 | R354: 2.35年 | S354: 0.35年 | T354: 2.22 | U354: 136 | V354: 0.46999999999999997 | W354: 4.0000000000000001e-002 | X354: 4.4000000000000004e-002 | Y354: 55 | Z354: 1.64 | AA354: -6.0700000000000004e-002 | AB354: -6.8699999999999997e-002 | AC354: -0.41299999999999998 | AD354: -0.42200000000000004 | AE354: 100.24 | AF354: 102.63 | AG354: 0.6 | AH354: AA | AI354: 3.5400000000000001e-002 | AJ354: =H354+100*O354 -> 146.114 | AK354: 147.9 | AL354: 56 | AM354: 45.2 | AN354: 32 | AO354: -5.2000000000000005e-002 | AP354: 32 | AQ354: 华通转债!
A355: 354 | B355: 128039 | C355: 三力转债! | D355: 2224 | E355: 三 力 士 | F355: 机械装备 | G355: 专用设备 | H355: 118.5 | I355: 3.3e-003 | J355: 7.6e-003 | K355: 5.12 | L355: 2.81e-002 | M355: 108.8 | N355: 5.79 | O355: 0.34000000000000002 | P355: 88.43 | Q355: 已到 | R355: 2.33年 | S355: 0.33年 | T355: 2.02 | U355: 11 | V355: 4.7e-002 | W355: 5.4000000000000006e-002 | X355: 4.8000000000000001e-002 | Y355: 37 | Z355: 1.56 | AA355: -3.61e-002 | AB355: -4.2699999999999995e-002 | AC355: -0.28499999999999998 | AD355: -0.29499999999999998 | AE355: 98.97 | AF355: 95.8 | AG355: 0.39 | AH355: AA- | AI355: 5.6399999999999999e-002 | AJ355: =H355+100*O355 -> 152.5 | AK355: 148.6 | AL355: 62 | AM355: 49.6 | AN355: 52 | AO355: -4.7e-002 | AP355: 30 | AQ355: 三力转债!
A356: 355 | B356: 128036 | C356: 金农转债!! | D356: 2548 | E356: 金新农 | F356: 农业 | G356: 畜牧业 | H356: 129.5 | I356: 6.9999999999999993e-003 | J356: 1.7600000000000001e-002 | K356: 6.24 | L356: 6.3e-002 | M356: 109.3 | N356: 6.93 | O356: 0.43799999999999994 | P356: 90.04 | Q356: 已到 | R356: 2年29天 | S356: 29天 | T356: 1.46 | U356: 86 | V356: 0.45500000000000002 | W356: 3.4000000000000002e-002 | X356: 2.9999999999999999e-002 | Y356: 43 | Z356: 1.85 | AA356: -7.8700000000000006e-002 | AB356: -8.5999999999999993e-002 | AC356: -0.92200000000000004 | AD356: -0.93500000000000005 | AE356: 100.67 | AF356: 97.6 | AG356: 0.39 | AH356: AA- | AI356: 5.6399999999999999e-002 | AJ356: =H356+100*O356 -> 173.30000000000001 | AK356: 169 | AL356: 243 | AM356: 68.3 | AN356: 191 | AO356: -1.9e-002 | AP356: 16 | AQ356: 金农转债!!
A357: 356 | B357: 128037 | C357: 岩土转债! | D357: 2542 | E357: 中化岩土 | F357: 建筑 | G357: 建筑工程 | H357: 114.6 | I357: -9.7999999999999997e-003 | J357: 1.78e-002 | K357: 2.73 | L357: 3.0200000000000001e-002 | M357: 111.3 | N357: 3.1 | O357: 0.30099999999999999 | P357: 88.06 | Q357: 已到 | R357: 2年35天 | S357: 35天 | T357: 5.99 | U357: 9.9 | V357: 1.3999999999999999e-002 | W357: 0.122 | X357: 0.107 | Y357: 49 | Z357: 1.24 | AA357: -1.3899999999999999e-002 | AB357: -2.35e-002 | AC357: -0.41899999999999998 | AD357: -0.44 | AE357: 101.11 | AF357: 103.53 | AG357: 0.27 | AH357: AA | AI357: 3.5400000000000001e-002 | AJ357: =H357+100*O357 -> 144.69999999999999 | AK357: 141.1 | AL357: 20 | AM357: 37.6 | AN357: 14 | AO357: -7.0000000000000007e-002 | AP357: 54 | AQ357: 岩土转债!
A358: 357 | B358: 127006 | C358: 敖东转债! | D358: 623 | E358: 吉林敖东 | F358: 金融 | G358: 证券行业 | H358: 118.489 | I358: 9.300000000000001e-003 | J358: -8.5000000000000006e-003 | K358: 16.6 | L358: 4.1999999999999997e-003 | M358: 107.4 | N358: 20.22 | O358: 0.44299999999999995 | P358: 82.1 | Q358: 已到 | R358: 2年33天 | S358: 33天 | T358: 24.1 | U358: 9.6 | V358: 3.0000000000000001e-003 | W358: 0.125 | X358: 0.10199999999999999 | Y358: 193 | Z358: 0.8 | AA358: -4.5899999999999996e-002 | AB358: -5.21e-002 | AC358: -0.57499999999999996 | AD358: -0.58999999999999997 | AE358: 101.03 | AF358: 100.88 | AG358: 0.19 | AH358: AA+ | AI358: 3.04e-002 | AJ358: =H358+100*O358 -> 162.78899999999999 | AK358: 154.9 | AL358: 116 | AM358: 53.8 | AN358: 82 | AO358: -6.2e-002 | AP358: 25 | AQ358: 敖东转债!
A359: 358 | B359: 127005 | C359: 长证转债! | D359: 783 | E359: 长江证券 | F359: 金融 | G359: 证券行业 | H359: 126.01 | I359: -2.3e-003 | J359: -2.8000000000000004e-003 | K359: 6.99 | L359: -1.1299999999999999e-002 | M359: 108.3 | N359: 7.13 | O359: 0.28499999999999998 | P359: 98.04 | Q359: 已到 | R359: 2年32天 | S359: 无权 | T359: 50 | U359: 54 | V359: 9.0000000000000011e-003 | W359: 0.129 | X359: 0.127 | Y359: 387 | Z359: 1.31 | AA359: -7.0400000000000004e-002 | AB359: -7.6999999999999999e-002 | AC359: 无权 | AD359: 无权 | AE359: 无权 | AF359: 102.19 | AG359: 0.45 | AH359: AAA | AI359: 2.8399999999999998e-002 | AJ359: =H359+100*O359 -> 154.50999999999999 | AK359: 154 | AL359: 106 | AM359: 51.8 | AN359: 70 | AO359: -5.2000000000000005e-002 | AP359: 11 | AQ359: 长证转债!
A360: 359 | B360: 113505 | C360: 杭电转债! | D360: 603618 | E360: 杭电股份 | F360: 能源电力 | G360: 电力设备 | H360: 119.91 | I360: -8.0000000000000004e-004 | J360: 3.9000000000000003e-003 | K360: 6.33 | L360: 1.1200000000000002e-002 | M360: 111.3 | N360: 7.08 | O360: 0.34100000000000003 | P360: 89.41 | Q360: 已到 | R360: 2年26天 | S360: 26天 | T360: 7.5 | U360: 11 | V360: 1.2e-002 | W360: 0.17100000000000001 | X360: 0.153 | Y360: 44 | Z360: 1.65 | AA360: -3.5499999999999997e-002 | AB360: -4.4900000000000002e-002 | AC360: -0.65500000000000003 | AD360: -0.67400000000000004 | AE360: 101.2 | AF360: 103.61 | AG360: 0.28 | AH360: AA | AI360: 3.5400000000000001e-002 | AJ360: =H360+100*O360 -> 154.00999999999999 | AK360: 150.4 | AL360: 74 | AM360: 46.8 | AN360: 42 | AO360: -7.9000000000000001e-002 | AP360: 42 | AQ360: 杭电转债!
A361: 360 | B361: 113504 | C361: 艾华转债!! | D361: 603989 | E361: 艾华集团 | F361: 电子 | G361: 元器件制 | H361: 191.03 | I361: 4.5999999999999999e-003 | J361: -4.0999999999999995e-003 | K361: 33.94 | L361: 5.9999999999999995e-004 | M361: 109.3 | N361: 20.81 | O361: 0.17100000000000001 | P361: 163.09 | Q361: 已到 | R361: 2年22天 | S361: 22天 | T361: 4.63 | U361: 12 | V361: 1.3999999999999999e-002 | W361: 3.4000000000000002e-002 | X361: 5.5e-002 | Y361: 136 | Z361: 4.77 | AA361: -0.23800000000000002 | AB361: -0.24399999999999999 | AC361: <-100% | AD361: <-100% | AE361: 101.24 | AF361: 101.79 | AG361: 0.96 | AH361: AA | AI361: 3.5400000000000001e-002 | AJ361: =H361+100*O361 -> 208.13 | AK361: 219 | AL361: 345 | AM361: 117.2 | AN361: 342 | AO361: -7.0000000000000007e-002 | AP361: 10 | AQ361: 艾华转债!!
A362: 361 | B362: 128035 | C362: 大族转债! | D362: 2008 | E362: 大族激光 | F362: 机械装备 | G362: 专用设备 | H362: 131 | I362: 1.2e-002 | J362: -7.3000000000000001e-003 | K362: 47.14 | L362: 1.4199999999999999e-002 | M362: 107.4 | N362: 51.9 | O362: 0.442 | P362: 90.83 | Q362: 已到 | R362: 1.996年 | S362: 回售内 | T362: 23 | U362: 26 | V362: 9.0000000000000011e-003 | W362: 4.5999999999999999e-002 | X362: 4.2000000000000003e-002 | Y362: 503 | Z362: 4.74 | AA362: -9.4700000000000006e-002 | AB362: -0.10099999999999999 | AC362: 回售内 | AD362: 回售内 | AE362: 103 | AF362: 101.17 | AG362: 0.33 | AH362: AA+ | AI362: 3.04e-002 | AJ362: =H362+100*O362 -> 175.19999999999999 | AK362: 171.2 | AL362: 255 | AM362: 68.2 | AN362: 190 | AO362: -2.7000000000000003e-002 | AP362: 17 | AQ362: 大族转债!
A363: 362 | B363: 110043 | C363: 无锡转债! | D363: 600908 | E363: 无锡银行 | F363: 金融 | G363: 银行行业 | H363: 123.72 | I363: -1.0200000000000001e-002 | J363: 2.0000000000000001e-004 | K363: 5.85 | L363: -1.8500000000000003e-002 | M363: 108.3 | N363: 5.61 | O363: 0.18600000000000003 | P363: 104.28 | Q363: 已到 | R363: 1.98年 | S363: 无权 | T363: 29.2 | U363: 117 | V363: 3.2000000000000001e-002 | W363: 0.26800000000000002 | X363: 0.28000000000000003 | Y363: 109 | Z363: 0.84 | AA363: -6.5099999999999991e-002 | AB363: -7.22e-002 | AC363: 无权 | AD363: 无权 | AE363: 无权 | AF363: 102.08 | AG363: 0.54 | AH363: AA+ | AI363: 3.04e-002 | AJ363: =H363+100*O363 -> 142.31999999999999 | AK363: 143.2 | AL363: 26 | AM363: 41.1 | AN363: 20 | AO363: -1.e-002 | AP363: 21 | AQ363: 无锡转债!
A364: 363 | B364: 128034 | C364: 江银转债! | D364: 2807 | E364: 江阴银行 | F364: 金融 | G364: 银行行业 | H364: 114 | I364: -5.1999999999999998e-003 | J364: 2.5999999999999999e-003 | K364: 3.95 | L364: -7.4999999999999997e-003 | M364: 107.3 | N364: 4.32 | O364: 0.247 | P364: 91.44 | Q364: 已到 | R364: 1.97年 | S364: 无权 | T364: 17.6 | U364: 18 | V364: 9.0000000000000011e-003 | W364: 0.20499999999999999 | X364: 0.187 | Y364: 86 | Z364: 0.71 | AA364: -3.0099999999999998e-002 | AB364: -3.6699999999999997e-002 | AC364: 无权 | AD364: 无权 | AE364: 无权 | AF364: 101.12 | AG364: 0.34 | AH364: AA+ | AI364: 3.04e-002 | AJ364: =H364+100*O364 -> 138.69999999999999 | AK364: 136.6 | AL364: 10 | AM364: 35.4 | AN364: 10 | AO364: 0. | AP364: 30 | AQ364: 江银转债!
A365: 364 | B365: 128033 | C365: 迪龙转债! | D365: 2658 | E365: 雪迪龙 | F365: 城市公用 | G365: 三废处理 | H365: 125 | I365: 8.0000000000000002e-003 | J365: 2.5000000000000001e-003 | K365: 7.84 | L365: 3.0200000000000001e-002 | M365: 107.5 | N365: 8.56 | O365: 0.36499999999999999 | P365: 91.59 | Q365: 已到 | R365: 1.88年 | S365: 回售内 | T365: 2.98 | U365: 52 | V365: 0.14099999999999999 | W365: 5.9999999999999998e-002 | X365: 5.5e-002 | Y365: 49 | Z365: 2.02 | AA365: -7.6399999999999996e-002 | AB365: -8.3100000000000007e-002 | AC365: 回售内 | AD365: 回售内 | AE365: 101.71 | AF365: 100.63 | AG365: 0.35 | AH365: AA | AI365: 3.5400000000000001e-002 | AJ365: =H365+100*O365 -> 161.5 | AK365: 158.4 | AL365: 148 | AM365: 56.7 | AN365: 105 | AO365: -9.9000000000000005e-002 | AP365: 33 | AQ365: 迪龙转债!
A366: 365 | B366: 113017 | C366: 吉视转债! | D366: 601929 | E366: 吉视传媒 | F366: 传媒娱乐 | G366: 影视娱乐 | H366: 123.2 | I366: -1.1599999999999999e-002 | J366: -1.8e-003 | K366: 2.3 | L366: -2.5399999999999999e-002 | M366: 107.5 | N366: 2.23 | O366: 0.19500000000000001 | P366: 103.14 | Q366: 已到 | R366: 1.88年 | S366: 回售内 | T366: 11.4 | U366: 766 | V366: 0.54000000000000004 | W366: 0.159 | X366: 0.16399999999999998 | Y366: 72 | Z366: 1.07 | AA366: -6.93e-002 | AB366: -7.5999999999999998e-002 | AC366: 回售内 | AD366: 回售内 | AE366: 101.71 | AF366: 101.56 | AG366: 0.53 | AH366: AA+ | AI366: 3.04e-002 | AJ366: =H366+100*O366 -> 142.69999999999999 | AK366: 143.3 | AL366: 27 | AM366: 41.6 | AN366: 21 | AO366: -0.11900000000000001 | AP366: 70 | AQ366: 吉视转债!
A367: 366 | B367: 128030 | C367: 天康转债!! | D367: 2100 | E367: 天康生物 | F367: 农业 | G367: 畜牧业 | H367: 200.1 | I367: -4.5000000000000005e-003 | J367: 3.78e-002 | K367: 10.64 | L367: 3.6000000000000004e-002 | M367: 109.8 | N367: 7.4 | O367: 0.39200000000000002 | P367: 143.78 | Q367: 已到 | R367: 1.87年 | S367: 回售内 | T367: 0.87 | U367: 54 | V367: 0.30599999999999999 | W367: 6.0000000000000001e-003 | X367: 9.0000000000000011e-003 | Y367: 144 | Z367: 2.03 | AA367: -0.27300000000000002 | AB367: -0.27899999999999997 | AC367: 回售内 | AD367: 回售内 | AE367: 102.05 | AF367: 102.84 | AG367: 0.93 | AH367: AA | AI367: 3.5400000000000001e-002 | AJ367: =H367+100*O367 -> 239.30000000000001 | AK367: 256.4 | AL367: 359 | AM367: 153.6 | AN367: 359 | AO367: -4.2000000000000003e-002 | AP367: 9 | AQ367: 天康转债!!
A368: 367 | B368: 128029 | C368: 太阳转债!! | D368: 2078 | E368: 太阳纸业 | F368: 造纸包装 | G368: 造纸行业 | H368: 164.7 | I368: 1.1999999999999999e-003 | J368: 8.199999999999999e-003 | K368: 11.12 | L368: 1.e-002 | M368: 106 | N368: 8.45 | O368: 0.252 | P368: 131.6 | Q368: 已到 | R368: 0.87年 | S368: 回售内 | T368: 9.09 | U368: 8.6 | V368: 6.0000000000000001e-003 | W368: 2.9999999999999999e-002 | X368: 4.0000000000000001e-002 | Y368: 299 | Z368: 1.58 | AA368: -0.40100000000000002 | AB368: -0.40899999999999997 | AC368: 回售内 | AD368: 回售内 | AE368: 101.71 | AF368: 103.45 | AG368: 0.94 | AH368: AA+ | AI368: 2.75e-002 | AJ368: =H368+100*O368 -> 189.89999999999998 | AK368: 197.8 | AL368: 334 | AM368: 94.4 | AN368: 319 | AO368: -4.7e-002 | AP368: 7 | AQ368: 太阳转债!!
A369: 368 | B369: 123004 | C369: 铁汉转债! | D369: 300197 | E369: 节能铁汉 | F369: 城市公用 | G369: 生态环境 | H369: 109.4 | I369: 0. | J369: 1.1999999999999999e-003 | K369: 2.67 | L369: 2.3e-002 | M369: 107.5 | N369: 3.82 | O369: 0.56499999999999995 | P369: 69.9 | Q369: 已到 | R369: 1.86年 | S369: 回售内 | T369: 8.03 | U369: 12 | V369: 1.3000000000000001e-002 | W369: 0.107 | X369: 7.400000000000001e-002 | Y369: 75 | Z369: 1.18 | AA369: -9.300000000000001e-003 | AB369: -1.67e-002 | AC369: 回售内 | AD369: 回售内 | AE369: 101.71 | AF369: 100.72 | AG369: 0.05 | AH369: AA | AI369: 3.5400000000000001e-002 | AJ369: =H369+100*O369 -> 165.90000000000001 | AK369: 148.9 | AL369: 68 | AM369: 47.2 | AN369: 43 | AO369: -7.5999999999999998e-002 | AP369: 52 | AQ369: 铁汉转债!
A370: 369 | B370: 128026 | C370: 众兴转债! | D370: 2772 | E370: 众兴菌业 | F370: 农业 | G370: 种植业 | H370: 111.392 | I370: 2.5999999999999999e-003 | J370: -2.5999999999999999e-003 | K370: 7.55 | L370: 2.0299999999999999e-002 | M370: 107.8 | N370: 11.36 | O370: 0.67599999999999993 | P370: 66.46 | Q370: 已到 | R370: 1.85年 | S370: 回售内 | T370: 4.09 | U370: 7.4 | V370: 1.6e-002 | W370: 0.13300000000000001 | X370: 8.8000000000000009e-002 | Y370: 31 | Z370: 1.02 | AA370: -1.7500000000000002e-002 | AB370: -2.5099999999999997e-002 | AC370: 回售内 | AD370: 回售内 | AE370: 102.05 | AF370: 97.36 | AG370: 0 | AH370: AA- | AI370: 5.6399999999999999e-002 | AJ370: =H370+100*O370 -> 178.99199999999999 | AK370: 156.3 | AL370: 128 | AM370: 54.3 | AN370: 86 | AO370: -8.4000000000000005e-002 | AP370: 59 | AQ370: 众兴转债!
A371: 370 | B371: 128025 | C371: 特一转债! | D371: 2728 | E371: 特一药业 | F371: 医药 | G371: 化学制药 | H371: 133.8 | I371: 2.81e-002 | J371: -1.6e-002 | K371: 14.8 | L371: 1.9299999999999998e-002 | M371: 107.5 | N371: 13.8 | O371: 0.248 | P371: 107.25 | Q371: 已到 | R371: 1.83年 | S371: 回售内 | T371: 2.98 | U371: 277 | V371: 0.69700000000000006 | W371: 9.0999999999999998e-002 | X371: 9.6999999999999989e-002 | Y371: 33 | Z371: 3.02 | AA371: -0.11199999999999999 | AB371: -0.11900000000000001 | AC371: 回售内 | AD371: 回售内 | AE371: 101.71 | AF371: 97.17 | AG371: 0.63 | AH371: AA- | AI371: 5.6399999999999999e-002 | AJ371: =H371+100*O371 -> 158.60000000000002 | AK371: 160.4 | AL371: 164 | AM371: 58.6 | AN371: 120 | AO371: -0.11800000000000001 | AP371: 46 | AQ371: 特一转债!
A372: 371 | B372: 128023 | C372: 亚太转债! | D372: 2284 | E372: 亚太股份 | F372: 汽车 | G372: 零部件制 | H372: 130.36 | I372: 6.6e-003 | J372: -3.3e-003 | K372: 9.36 | L372: 1.1899999999999999e-002 | M372: 109.8 | N372: 10.34 | O372: 0.44 | P372: 90.52 | Q372: 已到 | R372: 1.82年 | S372: 回售内 | T372: 9.99 | U372: 46 | V372: 3.6000000000000004e-002 | W372: 0.14499999999999999 | X372: 0.13100000000000001 | Y372: 69 | Z372: 2.75 | AA372: -8.9399999999999993e-002 | AB372: -9.8100000000000007e-002 | AC372: 回售内 | AD372: 回售内 | AE372: 102.05 | AF372: 103.02 | AG372: 0.28 | AH372: AA | AI372: 3.5400000000000001e-002 | AJ372: =H372+100*O372 -> 174.36000000000001 | AK372: 170.2 | AL372: 249 | AM372: 67.2 | AN372: 182 | AO372: -9.6000000000000002e-002 | AP372: 52 | AQ372: 亚太转债!
A373: 372 | B373: 128022 | C373: 众信转债! | D373: 2707 | E373: 众信旅游 | F373: 旅游餐饮 | G373: 旅游 | H373: 119.925 | I373: 9.3999999999999986e-003 | J373: 1.7600000000000001e-002 | K373: 6.88 | L373: 7.4999999999999997e-002 | M373: 107.5 | N373: 7.92 | O373: 0.38100000000000001 | P373: 86.87 | Q373: 已到 | R373: 1.81年 | S373: 回售内 | T373: 4.55 | U373: 478 | V373: 0.86099999999999999 | W373: 7.2999999999999995e-002 | X373: 6.3e-002 | Y373: 62 | Z373: 12.07 | AA373: -5.8099999999999999e-002 | AB373: -6.5199999999999994e-002 | AC373: 回售内 | AD373: 回售内 | AE373: 101.71 | AF373: 93.81 | AG373: 0.36 | AH373: A | AI373: 7.7399999999999997e-002 | AJ373: =H373+100*O373 -> 158.02500000000001 | AK373: 153 | AL373: 94 | AM373: 51.3 | AN373: 62 | AO373: 9.5000000000000001e-002 | AP373: 40 | AQ373: 众信转债!
A374: 373 | B374: 128021 | C374: 兄弟转债!! | D374: 2562 | E374: 兄弟科技 | F374: 医药 | G374: 原料药 | H374: 124.53 | I374: 2.7000000000000001e-003 | J374: -2.7000000000000001e-003 | K374: 5.11 | L374: 3.0200000000000001e-002 | M374: 107.5 | N374: 5.19 | O374: 0.26500000000000001 | P374: 98.46 | Q374: 已到 | R374: 1.80年 | S374: 回售内 | T374: 2.65 | U374: 23 | V374: 7.0000000000000007e-002 | W374: 4.9000000000000002e-002 | X374: 4.8000000000000001e-002 | Y374: 54 | Z374: 1.85 | AA374: -7.7600000000000002e-002 | AB374: -8.4600000000000009e-002 | AC374: 回售内 | AD374: 回售内 | AE374: 101.71 | AF374: 100.91 | AG374: 0 | AH374: AA | AI374: 3.5400000000000001e-002 | AJ374: =H374+100*O374 -> 151.03 | AK374: 150.6 | AL374: 75 | AM374: 48.9 | AN374: 50 | AO374: -2.7000000000000003e-002 | AP374: 19 | AQ374: 兄弟转债!!
A375: 374 | B375: 123002 | C375: 国祯转债!! | D375: 300388 | E375: 节能国祯 | F375: 城市公用 | G375: 三废处理 | H375: 118.231 | I375: -7.3000000000000001e-003 | J375: 9.5999999999999992e-003 | K375: 7.16 | L375: 9.8999999999999991e-003 | M375: 107.5 | N375: 8.36 | O375: 0.38 | P375: 85.65 | Q375: 已到 | R375: 1.79年 | S375: 回售内 | T375: 2.52 | U375: 4.7 | V375: 1.6e-002 | W375: 5.0000000000000003e-002 | X375: 4.2999999999999997e-002 | Y375: 50 | Z375: 1.36 | AA375: -5.1299999999999998e-002 | AB375: -5.8499999999999996e-002 | AC375: 回售内 | AD375: 回售内 | AE375: 101.71 | AF375: 100.95 | AG375: 0.23 | AH375: AA | AI375: 3.5400000000000001e-002 | AJ375: =H375+100*O375 -> 156.23099999999999 | AK375: 150.8 | AL375: 76 | AM375: 49.1 | AN375: 51 | AO375: -6.6000000000000003e-002 | AP375: 19 | AQ375: 国祯转债!!
A376: 375 | B376: 110038 | C376: 济川转债! | D376: 600566 | E376: 济川药业 | F376: 医药 | G376: 中药 | H376: 130.1 | I376: 4.6999999999999993e-003 | J376: -1.0200000000000001e-002 | K376: 23.82 | L376: -1.2800000000000001e-002 | M376: 106 | N376: 23.4 | O376: 0.27800000000000002 | P376: 101.79 | Q376: 已到 | R376: 0.76年 | S376: 回售内 | T376: 6.27 | U376: 71 | V376: 8.6999999999999994e-002 | W376: 2.9999999999999999e-002 | X376: 2.9999999999999999e-002 | Y376: 212 | Z376: 2.47 | AA376: -0.22800000000000001 | AB376: -0.23899999999999999 | AC376: 回售内 | AD376: 回售内 | AE376: 106.84 | AF376: 103.35 | AG376: 0.43 | AH376: AA | AI376: 3.2500000000000001e-002 | AJ376: =H376+100*O376 -> 157.90000000000001 | AK376: 158.4 | AL376: 146 | AM376: 51.6 | AN376: 65 | AO376: -0.124 | AP376: 24 | AQ376: 济川转债!
A377: 376 | B377: 113502 | C377: 嘉澳转债! | D377: 603822 | E377: 嘉澳环保 | F377: 化工 | G377: 化工 | H377: 144.79 | I377: -1.1899999999999999e-002 | J377: 5.1999999999999998e-003 | K377: 53.03 | L377: -9.0000000000000011e-003 | M377: 109.8 | N377: 44.64 | O377: 0.21899999999999997 | P377: 118.79 | Q377: 已到 | R377: 1.75年 | S377: 回售内 | T377: 1.84 | U377: 408 | V377: 1.48 | W377: 4.7e-002 | X377: 5.5999999999999994e-002 | Y377: 39 | Z377: 4.69 | AA377: -0.14499999999999999 | AB377: -0.153 | AC377: 回售内 | AD377: 回售内 | AE377: 102.05 | AF377: 99.66 | AG377: 0.74 | AH377: AA- | AI377: 5.6399999999999999e-002 | AJ377: =H377+100*O377 -> 166.69 | AK377: 170.8 | AL377: 251 | AM377: 68.7 | AN377: 196 | AO377: 0.11900000000000001 | AP377: 32 | AQ377: 嘉澳转债!
A378: 377 | B378: 113016 | C378: 小康转债!! | D378: 601127 | E378: 小康股份 | F378: 汽车 | G378: 零部件制 | H378: 319.26 | I378: -5.4000000000000003e-003 | J378: -4.0999999999999995e-003 | K378: 45.81 | L378: -9.4999999999999998e-003 | M378: 107.8 | N378: 16.96 | O378: 0.182 | P378: 270.11 | Q378: 已到 | R378: 1.74年 | S378: 回售内 | T378: 2.07 | U378: 528 | V378: 0.79599999999999993 | W378: 3.0000000000000001e-003 | X378: 9.0000000000000011e-003 | Y378: 623 | Z378: 8.66 | AA378: -0.45200000000000001 | AB378: -0.45600000000000002 | AC378: 回售内 | AD378: 回售内 | AE378: 102.05 | AF378: 97.9 | AG378: 0.99 | AH378: AA- | AI378: 5.6399999999999999e-002 | AJ378: =H378+100*O378 -> 337.45999999999998 | AK378: 368.4 | AL378: 376 | AM378: 266.4 | AN378: 375 | AO378: -0.10199999999999999 | AP378: 32 | AQ378: 小康转债!!
A379: 378 | B379: 128017 | C379: 金禾转债!! | D379: 2597 | E379: 金禾实业 | F379: 化工 | G379: 化工 | H379: 232.61 | I379: -4.1999999999999997e-003 | J379: -1.2199999999999999e-002 | K379: 40.95 | L379: -1.66e-002 | M379: 107.5 | N379: 21.97 | O379: 0.248 | P379: 186.39 | Q379: 已到 | R379: 1.73年 | S379: 回售内 | T379: 5.52 | U379: 57 | V379: 4.4000000000000004e-002 | W379: 2.4e-002 | X379: 4.4999999999999998e-002 | Y379: 230 | Z379: 4.42 | AA379: -0.35700000000000004 | AB379: -0.36200000000000004 | AC379: 回售内 | AD379: 回售内 | AE379: 101.71 | AF379: 101.17 | AG379: 0.99 | AH379: AA | AI379: 3.5400000000000001e-002 | AJ379: =H379+100*O379 -> 257.41000000000003 | AK379: 278.8 | AL379: 368 | AM379: 177.1 | AN379: 366 | AO379: -5.7999999999999996e-002 | AP379: 9 | AQ379: 金禾转债!!
A380: 379 | B380: 113013 | C380: 国君转债! | D380: 601211 | E380: 国泰君安 | F380: 金融 | G380: 证券行业 | H380: 126.1 | I380: -1.e-003 | J380: -8.6e-003 | K380: 17.63 | L380: -2.6000000000000002e-002 | M380: 106.8 | N380: 18.45 | O380: 0.32000000000000001 | P380: 95.56 | Q380: 已到 | R380: 1.41年 | S380: 无权 | T380: 69.9 | U380: 253 | V380: 2.8999999999999998e-002 | W380: 4.4999999999999998e-002 | X380: 4.2999999999999997e-002 | Y380: 1570. | Z380: 1.18 | AA380: -0.11 | AB380: -0.11800000000000001 | AC380: 无权 | AD380: 无权 | AE380: 无权 | AF380: 102.63 | AG380: 0.37 | AH380: AAA | AI380: 2.8399999999999998e-002 | AJ380: =H380+100*O380 -> 158.09999999999999 | AK380: 156.6 | AL380: 131 | AM380: 54 | AN380: 84 | AO380: -1.3000000000000001e-002 | AP380: 11 | AQ380: 国君转债!
A381: 380 | B381: 128015 | C381: 久其转债!! | D381: 2279 | E381: 久其软件 | F381: 计算机及 | G381: 软件开发 | H381: 112.229 | I381: 8.3000000000000001e-003 | J381: -4.3e-003 | K381: 4.84 | L381: 5.91e-002 | M381: 109.5 | N381: 6.97 | O381: 0.61599999999999999 | P381: 69.44 | Q381: 已到 | R381: 1.33年 | S381: 回售内 | T381: 7.79 | U381: 18 | V381: 2.1000000000000001e-002 | W381: 0.22699999999999998 | X381: 0.157 | Y381: 34 | Z381: 4.29 | AA381: -1.8100000000000002e-002 | AB381: -3.0800000000000001e-002 | AC381: 回售内 | AD381: 回售内 | AE381: 101.71 | AF381: 100.31 | AG381: 0.07 | AH381: A+ | AI381: 6.7400000000000002e-002 | AJ381: =H381+100*O381 -> 173.82900000000001 | AK381: 155 | AL381: 117 | AM381: 53.3 | AN381: 81 | AO381: -2.7999999999999997e-002 | AP381: 73 | AQ381: 久其转债!!
A382: 381 | B382: 127004 | C382: 模塑转债!! | D382: 700 | E382: 模塑科技 | F382: 汽车 | G382: 零部件制 | H382: 164.11 | I382: -4.5899999999999996e-002 | J382: 4.5899999999999996e-002 | K382: 4.87 | L382: 4.2800000000000005e-002 | M382: 111.8 | N382: 7.24 | O382: 1.4399999999999999 | P382: 67.27 | Q382: 已到 | R382: 1.31年 | S382: 回售内 | T382: 1.31 | U382: 778 | V382: 3.4399999999999999 | W382: 2.8999999999999998e-002 | X382: 2.e-002 | Y382: 45 | Z382: 1.96 | AA382: -0.251 | AB382: -0.26200000000000001 | AC382: 回售内 | AD382: 回售内 | AE382: 102.05 | AF382: 101.18 | AG382: 0 | AH382: AA- | AI382: 5.6399999999999999e-002 | AJ382: =H382+100*O382 -> 308.11000000000001 | AK382: 261 | AL382: 361 | AM382: 158.9 | AN382: 361 | AO382: -1.4999999999999999e-002 | AP382: 24 | AQ382: 模塑转债!!
A383: 382 | B383: 128014 | C383: 永东转债! | D383: 2753 | E383: 永东股份 | F383: 化工 | G383: 化工 | H383: 115.8 | I383: 1.e-003 | J383: -4.0000000000000002e-004 | K383: 8.7 | L383: 1.52e-002 | M383: 109.8 | N383: 12.52 | O383: 0.66599999999999993 | P383: 69.49 | Q383: 已到 | R383: 1.19年 | S383: 回售内 | T383: 3.37 | U383: 2.1 | V383: 5.0000000000000001e-003 | W383: 0.10300000000000001 | X383: 7.2000000000000008e-002 | Y383: 33 | Z383: 1.56 | AA383: -4.3400000000000001e-002 | AB383: -5.7500000000000002e-002 | AC383: 回售内 | AD383: 回售内 | AE383: 102.05 | AF383: 102.81 | AG383: 0.05 | AH383: AA- | AI383: 5.6399999999999999e-002 | AJ383: =H383+100*O383 -> 182.39999999999998 | AK383: 162.1 | AL383: 186 | AM383: 59.3 | AN383: 130 | AO383: -9.3000000000000013e-002 | AP383: 39 | AQ383: 永东转债!
A384: 383 | B384: 113011 | C384: 光大转债 | D384: 601818 | E384: 光大银行 | F384: 金融 | G384: 银行行业 | H384: 113.67 | I384: -2.8999999999999998e-003 | J384: 2.e-003 | K384: 3.34 | L384: -3.0000000000000001e-003 | M384: 106.8 | N384: 3.55 | O384: 0.20800000000000002 | P384: 94.08 | Q384: 已到 | R384: 1年37天 | S384: 无权 | T384: 242 | U384: 139 | V384: 5.0000000000000001e-003 | W384: 0.13400000000000001 | X384: 0.126 | Y384: 1805. | Z384: 0.49 | AA384: -5.4400000000000004e-002 | AB384: -6.5000000000000002e-002 | AC384: 无权 | AD384: 无权 | AE384: 无权 | AF384: 103.52 | AG384: 0.3 | AH384: AAA | AI384: 2.8399999999999998e-002 | AJ384: =H384+100*O384 -> 134.47 | AK384: 133.3 | AL384: 7 | AM384: 29.7 | AN384: 3 | AO384: -1.3999999999999999e-002 | AP384: 19 | AQ384: 光大转债
A385: 384 | B385: 128013 | C385: 洪涛转债! | D385: 2325 | E385: 洪涛股份 | F385: 建筑 | G385: 装饰工程 | H385: 119.011 | I385: 3.9000000000000003e-003 | J385: 4.0000000000000001e-003 | K385: 2.58 | L385: 1.18e-002 | M385: 108 | N385: 2.31 | O385: 6.6000000000000003e-002 | P385: 111.69 | Q385: 已到 | R385: 0.47年 | S385: 回售内 | T385: 10.6 | U385: 47 | V385: 3.7000000000000005e-002 | W385: 0.31 | X385: 0.34600000000000003 | Y385: 34 | Z385: 1.16 | AA385: -0.17699999999999999 | AB385: -0.20100000000000001 | AC385: 回售内 | AD385: 回售内 | AE385: 102.28 | AF385: 103.75 | AG385: 0.67 | AH385: A- | AI385: 8.3900000000000002e-002 | AJ385: =H385+100*O385 -> 125.61099999999999 | AK385: 126.3 | AL385: 3 | AM385: 22.6 | AN385: 1 | AO385: -6.8000000000000005e-002 | AP385: 100 | AQ385: 洪涛转债!
A386: 385 | B386: 127003 | C386: 海印转债! | D386: 861 | E386: 海印股份 | F386: 商业零售 | G386: 商场 | H386: 115.895 | I386: 1.e-004 | J386: 2.9999999999999997e-004 | K386: 2.74 | L386: 1.11e-002 | M386: 110 | N386: 2.99 | O386: 0.26500000000000001 | P386: 91.64 | Q386: 已到 | R386: 0.33年 | S386: 回售内 | T386: 6.74 | U386: 25 | V386: 3.2000000000000001e-002 | W386: 0.106 | X386: 9.6999999999999989e-002 | Y386: 64 | Z386: 1.74 | AA386: -0.13500000000000001 | AB386: -0.17800000000000002 | AC386: 回售内 | AD386: 回售内 | AE386: 102.28 | AF386: 108.77 | AG386: 0.04 | AH386: AA | AI386: 3.1899999999999998e-002 | AJ386: =H386+100*O386 -> 142.39499999999998 | AK386: 140.2 | AL386: 15 | AM386: 31.4 | AN386: 4 | AO386: -8.3000000000000004e-002 | AP386: 75 | AQ386: 海印转债!