A1: 序号 | B1: 转债代码 | C1: 转债名称 | D1: 股票代码 | E1: 股票名称 | F1: 行业 | G1: 子行业 | H1: 转债价格 | I1: 涨跌 | J1: 日内套利 | K1: 股价 | L1: 涨跌 | M1: 剩余本息 | N1: 转股价格 | O1: 转股溢价率 | P1: 转股价值 | Q1: 距离转股日 | R1: 剩余年限 | S1: 回售年限 | T1: 转债余额 | U1: 转债成交额 | V1: 转债换手率 | W1: 余额/市值 | X1: 余额/股本 | Y1: 股票市值 | Z1: P/B | AA1: 税前收益率 | AB1: 税后收益率 | AC1: 税前回售收益 | AD1: 税后回售收益 | AE1: 回售价值 | AF1: 纯债价值 | AG1: 弹性 | AH1: 信用 | AI1: 折现率 | AJ1: 双低 | AK1: 老式双低 | AL1: 老式排名 | AM1: 新式双低 | AN1: 新式排名 | AO1: MA20乖离 | AP1: 热门度 | AQ1: 转债名称
A2: 288 | B2: 128062 | C2: 亚药转债! | D2: 2370 | E2: 亚太药业 | F2: 医药 | G2: 化学制药 | H2: 86.6 | I2: -1.0500000000000001e-002 | J2: 1.0500000000000001e-002 | K2: 4.24 | L2: -6.9999999999999993e-003 | M2: 119.3 | N2: 16.25 | O2: 2.3199999999999998 | P2: 26.09 | Q2: 转股中 | R2: 3.62年 | S2: 1.62年 | T2: 9.63 | U2: 78 | V2: 9.1999999999999998e-002 | W2: 0.42299999999999999 | X2: 0.11 | Y2: 23 | Z2: 5.26 | AA2: 9.4600000000000004e-002 | AB2: 8.4199999999999997e-002 | AC2: 0.10199999999999999 | AD2: 9.8299999999999998e-002 | AE2: 81.27 | AF2: 74.53 | AG2: 0 | AH2: BB | AI2: 0.1421 | AJ2: =H2+100*O2 -> 318.59999999999997 | AK2: 147.1 | AL2: 213 | AM2: 65.8 | AN2: 271 | AO2: -4.0999999999999995e-002 | AP2: 87 | AQ2: 亚药转债!
A3: 155 | B3: 113595 | C3: 花王转债! | D3: 603007 | E3: ST花王 | F3: 城市公用 | G3: 生态环境 | H3: 89.46 | I3: -6.0999999999999995e-003 | J3: 2.8999999999999998e-003 | K3: 3.18 | L3: -2.4500000000000001e-002 | M3: 124.8 | N3: 6.92 | O3: 0.94700000000000006 | P3: 45.95 | Q3: 转股中 | R3: 4.92年 | S3: 2.92年 | T3: 3.3 | U3: 22 | V3: 7.2999999999999995e-002 | W3: 0.309 | X3: 0.14199999999999999 | Y3: 11 | Z3: 0.93 | AA3: 7.1599999999999997e-002 | AB3: 6.2400000000000004e-002 | AC3: 4.9599999999999998e-002 | AD3: 4.7e-002 | AE3: 77.08 | AF3: 78.17 | AG3: 0.13 | AH3: BBB+ | AI3: 0.10210000000000001 | AJ3: =H3+100*O3 -> 184.16 | AK3: 133 | AL3: 79 | AM3: 54.8 | AN3: 205 | AO3: -4.0000000000000001e-003 | AP3: 45 | AQ3: 花王转债!
A4: 199 | B4: 113576 | C4: 起步转债!! | D4: 603557 | E4: ST起步 | F4: 服装纺织 | G4: 鞋服行业 | H4: 97.03 | I4: 2.87e-002 | J4: -2.3599999999999999e-002 | K4: 5.05 | L4: 4.99e-002 | M4: 121.3 | N4: 10.55 | O4: 1.03 | P4: 47.87 | Q4: 转股中 | R4: 4.64年 | S4: 2.64年 | T4: 2.66 | U4: 257 | V4: 0.996 | W4: 0.106 | X4: 5.0999999999999997e-002 | Y4: 25 | Z4: 1.6 | AA4: 5.0599999999999999e-002 | AB4: 4.2099999999999999e-002 | AC4: 2.6099999999999998e-002 | AD4: 2.3099999999999999e-002 | AE4: 83.74 | AF4: 84.91 | AG4: 0.1 | AH4: A | AI4: 8.2100000000000006e-002 | AJ4: =H4+100*O4 -> 200.03 | AK4: 146.2 | AL4: 201 | AM4: 61.3 | AN4: 255 | AO4: 8.1000000000000003e-002 | AP4: 36 | AQ4: 起步转债!!
A5: 100 | B5: 128138 | C5: 侨银转债! | D5: 2973 | E5: 侨银股份 | F5: 城市公用 | G5: 城市公用 | H5: 107.22 | I5: 1.e-004 | J5: -7.0999999999999995e-003 | K5: 14.9 | L5: -4.9699999999999994e-002 | M5: 136.5 | N5: 25.33 | O5: 0.82299999999999995 | P5: 58.82 | Q5: 转股中 | R5: 5.24年 | S5: 3.25年 | T5: 4.2 | U5: 2.9 | V5: 6.9999999999999993e-003 | W5: 6.9000000000000006e-002 | X5: 4.0999999999999995e-002 | Y5: 61 | Z5: 4.04 | AA5: 4.8099999999999997e-002 | AB5: 3.6799999999999999e-002 | AC5: -7.8000000000000005e-003 | AD5: -1.03e-002 | AE5: 85.09 | AF5: 99.95 | AG5: 0.14 | AH5: AA- | AI5: 6.2600000000000003e-002 | AJ5: =H5+100*O5 -> 189.51999999999998 | AK5: 155.6 | AL5: 267 | AM5: 55.7 | AN5: 214 | AO5: -2.7000000000000003e-002 | AP5: 15 | AQ5: 侨银转债!
A6: 136 | B6: 128127 | C6: 文科转债! | D6: 2775 | E6: 文科园林 | F6: 城市公用 | G6: 生态环境 | H6: 96.859 | I6: -1.7000000000000001e-003 | J6: -2.8000000000000004e-003 | K6: 3.97 | L6: -1.e-002 | M6: 121.3 | N6: 4.88 | O6: 0.191 | P6: 81.35 | Q6: 转股中 | R6: 4.999年 | S6: 3年0.5天 | T6: 9.5 | U6: 20 | V6: 2.1000000000000001e-002 | W6: 0.46700000000000003 | X6: 0.38 | Y6: 20 | Z6: 0.86 | AA6: 4.6100000000000002e-002 | AB6: 3.85e-002 | AC6: 2.2099999999999998e-002 | AD6: 1.9699999999999999e-002 | AE6: 86.11 | AF6: 90.36 | AG6: 0.45 | AH6: AA- | AI6: 6.1100000000000002e-002 | AJ6: =H6+100*O6 -> 115.959 | AK6: 112.4 | AL6: 3 | AM6: 22 | AN6: 5 | AO6: -4.2000000000000003e-002 | AP6: 57 | AQ6: 文科转债!
A7: 217 | B7: 113569 | C7: 科达转债! | D7: 603660 | E7: 苏州科达 | F7: 通信互联 | G7: 物联网 | H7: 99.49 | I7: 1.9e-003 | J7: -2.3999999999999998e-003 | K7: 6.85 | L7: -8.6999999999999994e-003 | M7: 120.3 | N7: 14.8 | O7: 1.1499999999999999 | P7: 46.28 | Q7: 转股中 | R7: 4.55年 | S7: 2.55年 | T7: 5.16 | U7: 3.7 | V7: 6.9999999999999993e-003 | W7: 0.152 | X7: 7.0999999999999994e-002 | Y7: 34 | Z7: 1.89 | AA7: 4.36e-002 | AB7: 3.5400000000000001e-002 | AC7: 1.5300000000000001e-002 | AD7: 1.26e-002 | AE7: 88.37 | AF7: 92.39 | AG7: 0.05 | AH7: AA- | AI7: 6.1100000000000002e-002 | AJ7: =H7+100*O7 -> 214.48999999999998 | AK7: 152.7 | AL7: 251 | AM7: 60.3 | AN7: 248 | AO7: 5.0000000000000001e-003 | AP7: 30 | AQ7: 科达转债!
A8: 318 | B8: 113519 | C8: 长久转债! | D8: 603569 | E8: 长久物流 | F8: 交通运输 | G8: 物流业 | H8: 104.59 | I8: -5.0000000000000001e-004 | J8: -2.0000000000000001e-004 | K8: 6.68 | L8: -1.3300000000000001e-002 | M8: 119.3 | N8: 11.04 | O8: 0.72900000000000009 | P8: 60.51 | Q8: 转股中 | R8: 3.22年 | S8: 1.22年 | T8: 6.97 | U8: 2.3 | V8: 3.0000000000000001e-003 | W8: 0.18600000000000003 | X8: 0.113 | Y8: 37 | Z8: 1.71 | AA8: 4.2699999999999995e-002 | AB8: 3.1699999999999999e-002 | AC8: -1.2500000000000001e-002 | AD8: -1.6399999999999998e-002 | AE8: 97.41 | AF8: 105.41 | AG8: 0.05 | AH8: AA | AI8: 4.0099999999999997e-002 | AJ8: =H8+100*O8 -> 177.49000000000001 | AK8: 148.7 | AL8: 224 | AM8: 43.3 | AN8: 134 | AO8: 9.0000000000000011e-003 | AP8: 22 | AQ8: 长久转债!
A9: 320 | B9: 128044 | C9: 岭南转债! | D9: 2717 | E9: 岭南股份 | F9: 城市公用 | G9: 生态环境 | H9: 97.798 | I9: 1.6000000000000001e-003 | J9: -1.7000000000000001e-003 | K9: 2.78 | L9: -1.4199999999999999e-002 | M9: 110.3 | N9: 5.91 | O9: 1.0800000000000001 | P9: 47.04 | Q9: 转股中 | R9: 2.98年 | S9: 0.99年 | T9: 6.59 | U9: 8.4 | V9: 1.3000000000000001e-002 | W9: 0.155 | X9: 7.2999999999999995e-002 | Y9: 42 | Z9: 0.98 | AA9: 4.1799999999999997e-002 | AB9: 3.5000000000000003e-002 | AC9: 3.56e-002 | AD9: 3.2400000000000005e-002 | AE9: 95.25 | AF9: 93.02 | AG9: 0 | AH9: AA- | AI9: 5.9699999999999996e-002 | AJ9: =H9+100*O9 -> 205.798 | AK9: 148.6 | AL9: 221 | AM9: 53.3 | AN9: 197 | AO9: -1.4999999999999999e-002 | AP9: 50 | AQ9: 岭南转债!
A10: 301 | B10: 110052 | C10: 贵广转债! | D10: 600996 | E10: 贵广网络 | F10: 传媒娱乐 | G10: 影视娱乐 | H10: 102.39 | I10: -1.6000000000000001e-003 | J10: 1.2999999999999999e-003 | K10: 4.59 | L10: -6.5000000000000006e-003 | M10: 117.7 | N10: 7.94 | O10: 0.77099999999999991 | P10: 57.81 | Q10: 转股中 | R10: 3.54年 | S10: 1.54年 | T10: 15.3 | U10: 20 | V10: 1.3000000000000001e-002 | W10: 0.316 | X10: 0.183 | Y10: 48 | Z10: 1.14 | AA10: 4.0999999999999995e-002 | AB10: 3.1800000000000002e-002 | AC10: 3.7000000000000002e-003 | AD10: 2.0000000000000001e-004 | AE10: 97.19 | AF10: 104.44 | AG10: 0.04 | AH10: AA+ | AI10: 3.5099999999999999e-002 | AJ10: =H10+100*O10 -> 179.49000000000001 | AK10: 147 | AL10: 211 | AM10: 42.5 | AN10: 127 | AO10: -4.0000000000000001e-003 | AP10: 19 | AQ10: 贵广转债!
A11: 346 | B11: 113017 | C11: 吉视转债! | D11: 601929 | E11: 吉视传媒 | F11: 传媒娱乐 | G11: 影视娱乐 | H11: 99.42 | I11: -4.0000000000000002e-004 | J11: 2.9999999999999997e-004 | K11: 1.75 | L11: -5.6999999999999993e-003 | M11: 108.8 | N11: 2.95 | O11: 0.67599999999999993 | P11: 59.32 | Q11: 转股中 | R11: 2.35年 | S11: 0.35年 | T11: 15.6 | U11: 14 | V11: 9.0000000000000011e-003 | W11: 0.28600000000000003 | X11: 0.17000000000000001 | Y11: 54 | Z11: 0.82 | AA11: 3.9699999999999999e-002 | AB11: 3.2300000000000002e-002 | AC11: 4.1799999999999997e-002 | AD11: 3.56e-002 | AE11: 99.82 | AF11: 100.77 | AG11: 0.02 | AH11: AA+ | AI11: 3.3700000000000001e-002 | AJ11: =H11+100*O11 -> 167.01999999999998 | AK11: 139.5 | AL11: 141 | AM11: 38.8 | AN11: 87 | AO11: -6.0000000000000001e-003 | AP11: 68 | AQ11: 吉视转债!
A12: 147 | B12: 113596 | C12: 城地转债! | D12: 603887 | E12: 城地香江 | F12: 通信互联 | G12: 通信设备 | H12: 93.84 | I12: 1.9e-003 | J12: -1.9e-003 | K12: 9.16 | L12: -2.2000000000000001e-003 | M12: 113.1 | N12: 24.26 | O12: 1.49 | P12: 37.76 | Q12: 转股中 | R12: 4.94年 | S12: 2.94年 | T12: 12 | U12: 9.2 | V12: 8.0000000000000002e-003 | W12: 0.29100000000000004 | X12: 0.11 | Y12: 41 | Z12: 0.9 | AA12: 3.9300000000000002e-002 | AB12: 3.4200000000000001e-002 | AC12: 3.2099999999999997e-002 | AD12: 2.98e-002 | AE12: 86.18 | AF12: 84.89 | AG12: 0.01 | AH12: AA- | AI12: 6.1100000000000002e-002 | AJ12: =H12+100*O12 -> 242.84 | AK12: 149.9 | AL12: 227 | AM12: 63.7 | AN12: 264 | AO12: 2.1000000000000001e-002 | AP12: 28 | AQ12: 城地转债!
A13: 138 | B13: 110072 | C13: 广汇转债! | D13: 600297 | E13: 广汇汽车 | F13: 汽车 | G13: 分销、售 | H13: 95.38 | I13: 2.8999999999999998e-003 | J13: -8.9999999999999998e-004 | K13: 2.72 | L13: 1.1200000000000002e-002 | M13: 114.3 | N13: 4.03 | O13: 0.41299999999999998 | P13: 67.49 | Q13: 转股中 | R13: 4.99年 | S13: 2.996年 | T13: 33.7 | U13: 41 | V13: 1.3000000000000001e-002 | W13: 0.153 | X13: 0.10300000000000001 | Y13: 221 | Z13: 0.55 | AA13: 3.7499999999999999e-002 | AB13: 3.2000000000000001e-002 | AC13: 2.41e-002 | AD13: 2.23e-002 | AE13: 92.23 | AF13: 96.46 | AG13: 0.19 | AH13: AA+ | AI13: 3.5099999999999999e-002 | AJ13: =H13+100*O13 -> 136.68000000000001 | AK13: 123.3 | AL13: 12 | AM13: 26.8 | AN13: 14 | AO13: -1.3999999999999999e-002 | AP13: 67 | AQ13: 广汇转债!
A14: 167 | B14: 128117 | C14: 道恩转债! | D14: 2838 | E14: 道恩股份 | F14: 化工 | G14: 橡胶塑料 | H14: 103.549 | I14: 7.000000000000001e-004 | J14: -4.0000000000000002e-004 | K14: 15.36 | L14: 2.5999999999999999e-003 | M14: 123.1 | N14: 28.83 | O14: 0.94400000000000006 | P14: 53.28 | Q14: 转股中 | R14: 4.86年 | S14: 2.87年 | T14: 3.6 | U14: 4.1 | V14: 1.1000000000000001e-002 | W14: 5.7000000000000002e-002 | X14: 3.1e-002 | Y14: 63 | Z14: 3.3 | AA14: 3.6900000000000002e-002 | AB14: 2.8500000000000001e-002 | AC14: -4.0000000000000002e-004 | AD14: -2.5999999999999999e-003 | AE14: 86.54 | AF14: 92.74 | AG14: 0.11 | AH14: AA- | AI14: 6.1100000000000002e-002 | AJ14: =H14+100*O14 -> 197.94900000000001 | AK14: 153.8 | AL14: 262 | AM14: 61.1 | AN14: 252 | AO14: -5.5999999999999994e-002 | AP14: 23 | AQ14: 道恩转债!
A15: 286 | B15: 128063 | C15: 未来转债! | D15: 2631 | E15: 德尔未来 | F15: 其他 | G15: 家居用品 | H15: 112.28 | I15: 1.8e-003 | J15: -5.1999999999999998e-003 | K15: 6.77 | L15: -1.3100000000000001e-002 | M15: 127.5 | N15: 8.6 | O15: 0.42599999999999999 | P15: 78.72 | Q15: 转股中 | R15: 3.62年 | S15: 2.62年 | T15: 6.3 | U15: 5.5 | V15: 8.0000000000000002e-003 | W15: 0.14000000000000001 | X15: 0.11 | Y15: 45 | Z15: 2.67 | AA15: 3.6799999999999999e-002 | AB15: 2.3799999999999998e-002 | AC15: -1.3600000000000001e-002 | AD15: -1.9e-002 | AE15: 92.04 | AF15: 103.53 | AG15: 0.26 | AH15: AA- | AI15: 6.1100000000000002e-002 | AJ15: =H15+100*O15 -> 154.88 | AK15: 145.8 | AL15: 199 | AM15: 42.3 | AN15: 124 | AO15: 2.7000000000000003e-002 | AP15: 31 | AQ15: 未来转债!
A16: 272 | B16: 123028 | C16: 清水转债! | D16: 300437 | E16: 清水源 | F16: 城市公用 | G16: 三废处理 | H16: 106 | I16: 3.8e-003 | J16: -7.9000000000000008e-003 | K16: 9.36 | L16: -1.06e-002 | M16: 121 | N16: 11.84 | O16: 0.34100000000000003 | P16: 79.05 | Q16: 转股中 | R16: 3.83年 | S16: 1.83年 | T16: 4.55 | U16: 8.9 | V16: 1.9e-002 | W16: 0.22 | X16: 0.17399999999999999 | Y16: 21 | Z16: 1.86 | AA16: 3.61e-002 | AB16: 2.6200000000000001e-002 | AC16: -1.e-002 | AD16: -1.37e-002 | AE16: 90.56 | AF16: 93.31 | AG16: 0.39 | AH16: A+ | AI16: 7.2099999999999997e-002 | AJ16: =H16+100*O16 -> 140.09999999999999 | AK16: 132.9 | AL16: 77 | AM16: 39.6 | AN16: 92 | AO16: -5.0000000000000001e-003 | AP16: 52 | AQ16: 清水转债!
A17: 172 | B17: 113589 | C17: 天创转债! | D17: 603608 | E17: 天创时尚 | F17: 服装纺织 | G17: 鞋服行业 | H17: 97.08 | I17: 4.5999999999999999e-003 | J17: -4.3e-003 | K17: 5.82 | L17: 5.1999999999999998e-003 | M17: 114.9 | N17: 12.29 | O17: 1.05 | P17: 47.36 | Q17: 转股中 | R17: 4.84年 | S17: 2.85年 | T17: 6 | U17: 8 | V17: 1.3999999999999999e-002 | W17: 0.23999999999999999 | X17: 0.114 | Y17: 25 | Z17: 1.53 | AA17: 3.61e-002 | AB17: 3.0299999999999997e-002 | AC17: 2.1400000000000002e-002 | AD17: 1.9099999999999999e-002 | AE17: 91.95 | AF17: 95.32 | AG17: 0.04 | AH17: AA | AI17: 4.0099999999999997e-002 | AJ17: =H17+100*O17 -> 202.07999999999998 | AK17: 146.8 | AL17: 209 | AM17: 51.5 | AN17: 184 | AO17: 1.8000000000000002e-002 | AP17: 32 | AQ17: 天创转债!
A18: 238 | B18: 110064 | C18: 建工转债! | D18: 600939 | E18: 重庆建工 | F18: 建筑 | G18: 建筑工程 | H18: 103.36 | I18: 1.e-003 | J18: -2.e-003 | K18: 3.34 | L18: -6.0000000000000001e-003 | M18: 119.8 | N18: 4.53 | O18: 0.40200000000000002 | P18: 73.73 | Q18: 转股中 | R18: 4.33年 | S18: 2.34年 | T18: 16.6 | U18: 7.8 | V18: 5.0000000000000001e-003 | W18: 0.27399999999999997 | X18: 0.20199999999999999 | Y18: 61 | Z18: 0.86 | AA18: 3.56e-002 | AB18: 2.7200000000000002e-002 | AC18: 3.0000000000000001e-003 | AD18: -2.0000000000000001e-004 | AE18: 95.62 | AF18: 103.55 | AG18: 0.18 | AH18: AA+ | AI18: 3.5099999999999999e-002 | AJ18: =H18+100*O18 -> 143.56 | AK18: 133 | AL18: 80 | AM18: 29.4 | AN18: 24 | AO18: 5.0000000000000001e-003 | AP18: 46 | AQ18: 建工转债!
A19: 364 | B19: 128015 | C19: 久其转债! | D19: 2279 | E19: 久其软件 | F19: 计算机及 | G19: 软件开发 | H19: 102.98 | I19: -2.0000000000000001e-004 | J19: 2.0000000000000001e-004 | K19: 4.5 | L19: -1.1000000000000001e-002 | M19: 109.5 | N19: 6.97 | O19: 0.59499999999999997 | P19: 64.56 | Q19: 转股中 | R19: 1.80年 | S19: 回售内 | T19: 7.8 | U19: 12 | V19: 1.4999999999999999e-002 | W19: 0.24399999999999999 | X19: 0.157 | Y19: 32 | Z19: 3.72 | AA19: 3.5000000000000003e-002 | AB19: 2.4799999999999999e-002 | AC19: 回售内 | AD19: 回售内 | AE19: 100.25 | AF19: 96.92 | AG19: 0 | AH19: A+ | AI19: 7.0699999999999999e-002 | AJ19: =H19+100*O19 -> 162.48000000000002 | AK19: 141.4 | AL19: 159 | AM19: 41.1 | AN19: 112 | AO19: -3.2000000000000001e-002 | AP19: 68 | AQ19: 久其转债!
A20: 192 | B20: 113573 | C20: 纵横转债! | D20: 603602 | E20: 纵横通信 | F20: 通信互联 | G20: 通信设备 | H20: 106.34 | I20: -9.300000000000001e-003 | J20: 5.5000000000000005e-003 | K20: 10.5 | L20: -2.6000000000000002e-002 | M20: 124.2 | N20: 18.78 | O20: 0.90200000000000002 | P20: 55.91 | Q20: 转股中 | R20: 4.66年 | S20: 2.66年 | T20: 2.7 | U20: 2.4 | V20: 8.0000000000000002e-003 | W20: 0.126 | X20: 7.0000000000000007e-002 | Y20: 21 | Z20: 3.02 | AA20: 3.4700000000000002e-002 | AB20: 2.5600000000000001e-002 | AC20: -7.4999999999999997e-003 | AD20: -1.03e-002 | AE20: 85.72 | AF20: 90.49 | AG20: 0.15 | AH20: A+ | AI20: 7.2099999999999997e-002 | AJ20: =H20+100*O20 -> 196.54000000000002 | AK20: 156.8 | AL20: 273 | AM20: 66.3 | AN20: 274 | AO20: -2.7999999999999997e-002 | AP20: 26 | AQ20: 纵横转债!
A21: 134 | B21: 113601 | C21: 塞力转债! | D21: 603716 | E21: 塞力医疗 | F21: 医药 | G21: 医药商业 | H21: 102.89 | I21: -1.6000000000000001e-003 | J21: -4.8999999999999998e-003 | K21: 11.89 | L21: -1.9799999999999998e-002 | M21: 121.3 | N21: 16.98 | O21: 0.46899999999999997 | P21: 70.02 | Q21: 转股中 | R21: 5年0.5天 | S21: 3年1.5天 | T21: 5.43 | U21: 4.7 | V21: 8.0000000000000002e-003 | W21: 0.223 | X21: 0.156 | Y21: 24 | Z21: 1.56 | AA21: 3.4300000000000004e-002 | AB21: 2.6600000000000002e-002 | AC21: 4.0999999999999995e-003 | AD21: 1.5e-003 | AE21: 86.22 | AF21: 90.22 | AG21: 0.33 | AH21: AA- | AI21: 6.2600000000000003e-002 | AJ21: =H21+100*O21 -> 149.78999999999999 | AK21: 135.8 | AL21: 111 | AM21: 45.5 | AN21: 147 | AO21: -4.2000000000000003e-002 | AP21: 39 | AQ21: 塞力转债!
A22: 370 | B22: 127003 | C22: 海印转债! | D22: 861 | E22: 海印股份 | F22: 商业零售 | G22: 商场 | H22: 107.08 | I22: 1.7000000000000001e-003 | J22: -1.7000000000000001e-003 | K22: 2.01 | L22: 0. | M22: 110 | N22: 2.99 | O22: 0.59299999999999997 | P22: 67.22 | Q22: 转股中 | R22: 0.80年 | S22: 回售内 | T22: 6.74 | U22: 4.5 | V22: 6.0000000000000001e-003 | W22: 0.14400000000000002 | X22: 9.6999999999999989e-002 | Y22: 47 | Z22: 1.23 | AA22: 3.4200000000000001e-002 | AB22: 1.0800000000000001e-002 | AC22: 回售内 | AD22: 回售内 | AE22: 100.33 | AF22: 106.96 | AG22: 0.01 | AH22: AA | AI22: 3.5699999999999996e-002 | AJ22: =H22+100*O22 -> 166.38 | AK22: 146.9 | AL22: 210 | AM22: 40 | AN22: 98 | AO22: 2.4e-002 | AP22: 70 | AQ22: 海印转债!
A23: 278 | B23: 128066 | C23: 亚泰转债! | D23: 2811 | E23: 郑中设计 | F23: 建筑 | G23: 装饰工程 | H23: 103.68 | I23: 2.9999999999999997e-004 | J23: -1.2999999999999999e-003 | K23: 7.71 | L23: -2.5999999999999999e-003 | M23: 116.7 | N23: 9.27 | O23: 0.247 | P23: 83.17 | Q23: 转股中 | R23: 3.66年 | S23: 1.66年 | T23: 4.8 | U23: 7.9 | V23: 1.6e-002 | W23: 0.23000000000000001 | X23: 0.192 | Y23: 21 | Z23: 1.4 | AA23: 3.3599999999999998e-002 | AB23: 2.5099999999999997e-002 | AC23: -3.4999999999999996e-003 | AD23: -6.7000000000000002e-003 | AE23: 92.56 | AF23: 94.38 | AG23: 0.38 | AH23: AA- | AI23: 6.1100000000000002e-002 | AJ23: =H23+100*O23 -> 128.38 | AK23: 124.2 | AL23: 15 | AM23: 29.8 | AN23: 29 | AO23: 1.e-002 | AP23: 61 | AQ23: 亚泰转债!
A24: 291 | B24: 113530 | C24: 大丰转债! | D24: 603081 | E24: 大丰实业 | F24: 建筑 | G24: 装饰工程 | H24: 107.71 | I24: 3.4000000000000002e-003 | J24: -2.2000000000000001e-003 | K24: 12.32 | L24: 7.4000000000000003e-003 | M24: 121 | N24: 16.49 | O24: 0.442 | P24: 74.71 | Q24: 转股中 | R24: 3.60年 | S24: 1.60年 | T24: 6.3 | U24: 4.3 | V24: 6.0000000000000001e-003 | W24: 0.127 | X24: 9.5000000000000001e-002 | Y24: 50 | Z24: 2.23 | AA24: 3.3500000000000002e-002 | AB24: 2.3099999999999999e-002 | AC24: -2.5600000000000001e-002 | AD24: -2.87e-002 | AE24: 96.06 | AF24: 105.33 | AG24: 0.16 | AH24: AA | AI24: 4.0099999999999997e-002 | AJ24: =H24+100*O24 -> 151.91 | AK24: 140.7 | AL24: 155 | AM24: 35.4 | AN24: 55 | AO24: 7.0000000000000007e-002 | AP24: 31 | AQ24: 大丰转债!
A25: 212 | B25: 128100 | C25: 搜特转债! | D25: 2503. | E25: 搜于特 | F25: 服装纺织 | G25: 服装行业 | H25: 101.1 | I25: -3.4999999999999996e-003 | J25: -1.3100000000000001e-002 | K25: 1.49 | L25: -2.6099999999999998e-002 | M25: 116.9 | N25: 1.62 | O25: 9.9000000000000005e-002 | P25: 91.98 | Q25: 转股中 | R25: 4.56年 | S25: 2.56年 | T25: 7.99 | U25: 72 | V25: 8.900000000000001e-002 | W25: 0.17300000000000001 | X25: 0.16 | Y25: 46 | Z25: 1.38 | AA25: 3.3000000000000002e-002 | AB25: 2.6200000000000001e-002 | AC25: 8.3999999999999995e-003 | AD25: 5.8999999999999999e-003 | AE25: 83.56 | AF25: 82.21 | AG25: 0.63 | AH25: A | AI25: 8.2100000000000006e-002 | AJ25: =H25+100*O25 -> 111. | AK25: 110.2 | AL25: 1 | AM25: 26.7 | AN25: 13 | AO25: -7.0000000000000007e-002 | AP25: 70 | AQ25: 搜特转债!
A26: 139 | B26: 113600 | C26: 新星转债! | D26: 603978 | E26: 深圳新星 | F26: 有色金属 | G26: 有色行业 | H26: 107.3 | I26: 3.4000000000000002e-003 | J26: -5.7999999999999996e-003 | K26: 17.92 | L26: -7.1999999999999998e-003 | M26: 125.6 | N26: 23.85 | O26: 0.42799999999999999 | P26: 75.14 | Q26: 转股中 | R26: 4.98年 | S26: 2.98年 | T26: 5.95 | U26: 7 | V26: 1.1000000000000001e-002 | W26: 0.20699999999999999 | X26: 0.156 | Y26: 29 | Z26: 1.89 | AA26: 3.27e-002 | AB26: 2.3900000000000001e-002 | AC26: -1.1399999999999999e-002 | AD26: -1.3500000000000002e-002 | AE26: 86.02 | AF26: 94 | AG26: 0.34 | AH26: AA- | AI26: 6.1100000000000002e-002 | AJ26: =H26+100*O26 -> 150.09999999999999 | AK26: 139.5 | AL26: 140 | AM26: 45.5 | AN26: 146 | AO26: -2.5000000000000001e-002 | AP26: 24 | AQ26: 新星转债!
A27: 162 | B27: 127019 | C27: 国城转债! | D27: 688 | E27: 国城矿业 | F27: 有色金属 | G27: 锌铅镍锡 | H27: 98.57 | I27: 4.1999999999999997e-003 | J27: -3.8e-003 | K27: 11.22 | L27: 5.4000000000000003e-003 | M27: 114.8 | N27: 21.06 | O27: 0.84999999999999998 | P27: 53.28 | Q27: 转股中 | R27: 4.90年 | S27: 2.90年 | T27: 8.5 | U27: 49 | V27: 5.7999999999999996e-002 | W27: 6.7000000000000004e-002 | X27: 3.5000000000000003e-002 | Y27: 128 | Z27: 5.5 | AA27: 3.2199999999999999e-002 | AB27: 2.6499999999999999e-002 | AC27: 1.55e-002 | AD27: 1.34e-002 | AE27: 91.65 | AF27: 95.01 | AG27: 0.08 | AH27: AA | AI27: 4.0099999999999997e-002 | AJ27: =H27+100*O27 -> 183.56999999999999 | AK27: 143.9 | AL27: 183 | AM27: 48.9 | AN27: 167 | AO27: 0.121 | AP27: 45 | AQ27: 国城转债!
A28: 331 | B28: 127007 | C28: 湖广转债! | D28: 665 | E28: 湖北广电 | F28: 传媒娱乐 | G28: 影视娱乐 | H28: 101.95 | I28: -1.4000000000000002e-003 | J28: 7.000000000000001e-004 | K28: 3.6 | L28: -1.1000000000000001e-002 | M28: 111.3 | N28: 5.58 | O28: 0.57999999999999996 | P28: 64.52 | Q28: 转股中 | R28: 2.85年 | S28: 0.86年 | T28: 12.2 | U28: 9.4 | V28: 8.0000000000000002e-003 | W28: 0.34399999999999997 | X28: 0.222 | Y28: 35 | Z28: 0.61 | AA28: 3.1699999999999999e-002 | AB28: 2.41e-002 | AC28: -1.4000000000000002e-003 | AD28: -4.8999999999999998e-003 | AE28: 98.42 | AF28: 101.4 | AG28: 0.07 | AH28: AA+ | AI28: 3.3700000000000001e-002 | AJ28: =H28+100*O28 -> 159.94999999999999 | AK28: 139.4 | AL28: 139 | AM28: 38 | AN28: 80 | AO28: -4.0000000000000001e-003 | AP28: 19 | AQ28: 湖广转债!
A29: 169 | B29: 113591 | C29: 胜达转债! | D29: 603687 | E29: 大胜达 | F29: 造纸包装 | G29: 包装用纸 | H29: 104.87 | I29: -2.7000000000000001e-003 | J29: 2.e-003 | K29: 7.43 | L29: -1.2999999999999999e-003 | M29: 121.7 | N29: 8.76 | O29: 0.23600000000000002 | P29: 84.82 | Q29: 转股中 | R29: 4.86年 | S29: 2.86年 | T29: 5.5 | U29: 5.4 | V29: 9.0000000000000011e-003 | W29: 0.17999999999999999 | X29: 0.153 | Y29: 31 | Z29: 1.77 | AA29: 3.1699999999999999e-002 | AB29: 2.3799999999999998e-002 | AC29: -4.0000000000000001e-003 | AD29: -6.3e-003 | AE29: 86.72 | AF29: 91.75 | AG29: 0.47 | AH29: AA- | AI29: 6.1100000000000002e-002 | AJ29: =H29+100*O29 -> 128.47 | AK29: 124.9 | AL29: 17 | AM29: 33.2 | AN29: 46 | AO29: 4.0000000000000001e-003 | AP29: 32 | AQ29: 胜达转债!
A30: 203 | B30: 127016 | C30: 鲁泰转债! | D30: 726 | E30: 鲁 泰Ａ | F30: 服装纺织 | G30: 纺织行业 | H30: 100.7 | I30: -1.1000000000000001e-003 | J30: 7.000000000000001e-004 | K30: 5.43 | L30: -3.7000000000000002e-003 | M30: 115.9 | N30: 8.71 | O30: 0.61499999999999999 | P30: 62.34 | Q30: 转股中 | R30: 4.63年 | S30: 2.64年 | T30: 14 | U30: 4.5 | V30: 3.0000000000000001e-003 | W30: 0.29199999999999998 | X30: 0.182 | Y30: 48 | Z30: 0.6 | AA30: 3.1400000000000004e-002 | AB30: 2.5000000000000001e-002 | AC30: 9.5999999999999992e-003 | AD30: 7.1999999999999998e-003 | AE30: 93.96 | AF30: 99.09 | AG30: 0.11 | AH30: AA+ | AI30: 3.5099999999999999e-002 | AJ30: =H30+100*O30 -> 162.19999999999999 | AK30: 139.1 | AL30: 134 | AM30: 40 | AN30: 97 | AO30: -2.1000000000000001e-002 | AP30: 21 | AQ30: 鲁泰转债!
A31: 261 | B31: 128074 | C31: 游族转债!! | D31: 2174 | E31: 游族网络 | F31: 通信互联 | G31: 互联网 | H31: 106 | I31: 1.1999999999999999e-003 | J31: -2.7000000000000001e-003 | K31: 11.43 | L31: -9.4999999999999998e-003 | M31: 119.9 | N31: 16.97 | O31: 0.57399999999999995 | P31: 67.35 | Q31: 转股中 | R31: 4年33天 | S31: 2年34天 | T31: 6.83 | U31: 26 | V31: 3.6000000000000004e-002 | W31: 6.5000000000000002e-002 | X31: 4.4000000000000004e-002 | Y31: 105 | Z31: 2.05 | AA31: 3.1200000000000002e-002 | AB31: 2.2499999999999999e-002 | AC31: -1.11e-002 | AD31: -1.3899999999999999e-002 | AE31: 94.71 | AF31: 97.14 | AG31: 0.15 | AH31: AA | AI31: 4.0099999999999997e-002 | AJ31: =H31+100*O31 -> 163.40000000000001 | AK31: 144.6 | AL31: 192 | AM31: 47.5 | AN31: 158 | AO31: -9.8000000000000004e-002 | AP31: 28 | AQ31: 游族转债!!
A32: 173 | B32: 123056 | C32: 雪榕转债! | D32: 300511 | E32: 雪榕生物 | F32: 农业 | G32: 种植业 | H32: 104.451 | I32: 4.3e-003 | J32: -7.4000000000000003e-003 | K32: 7.1 | L32: -1.66e-002 | M32: 120.7 | N32: 11.77 | O32: 0.73199999999999998 | P32: 60.32 | Q32: 转股中 | R32: 4.84年 | S32: 2.85年 | T32: 5.84 | U32: 11 | V32: 1.9e-002 | W32: 0.18600000000000003 | X32: 0.11199999999999999 | Y32: 31 | Z32: 1.51 | AA32: 3.0899999999999997e-002 | AB32: 2.3300000000000001e-002 | AC32: -2.7000000000000001e-003 | AD32: -5.0000000000000001e-003 | AE32: 86.82 | AF32: 91.11 | AG32: 0.18 | AH32: AA- | AI32: 6.1100000000000002e-002 | AJ32: =H32+100*O32 -> 177.65100000000001 | AK32: 148.6 | AL32: 222 | AM32: 57.5 | AN32: 231 | AO32: -4.7e-002 | AP32: 16 | AQ32: 雪榕转债!
A33: 315 | B33: 128049 | C33: 华源转债! | D33: 2787 | E33: 华源控股 | F33: 造纸包装 | G33: 包装材料 | H33: 103.9 | I33: -1.4000000000000002e-003 | J33: 5.0000000000000001e-004 | K33: 5.33 | L33: -3.7000000000000002e-003 | M33: 114.5 | N33: 7.37 | O33: 0.43700000000000006 | P33: 72.32 | Q33: 转股中 | R33: 3.27年 | S33: 1.27年 | T33: 3.63 | U33: 2.3 | V33: 6.0000000000000001e-003 | W33: 0.21600000000000003 | X33: 0.156 | Y33: 17 | Z33: 1.13 | AA33: 3.0800000000000001e-002 | AB33: 2.2499999999999999e-002 | AC33: -7.1999999999999998e-003 | AD33: -1.1000000000000001e-002 | AE33: 94.51 | AF33: 94.73 | AG33: 0.25 | AH33: AA- | AI33: 6.1100000000000002e-002 | AJ33: =H33+100*O33 -> 147.60000000000002 | AK33: 135.5 | AL33: 104 | AM33: 40.8 | AN33: 108 | AO33: 1.e-003 | AP33: 43 | AQ33: 华源转债!
A34: 126 | B34: 128132 | C34: 交建转债! | D34: 2941 | E34: 新疆交建 | F34: 建筑 | G34: 建筑工程 | H34: 100.9 | I34: 1.9e-003 | J34: 2.3999999999999998e-003 | K34: 12.27 | L34: 2.3399999999999997e-002 | M34: 117.3 | N34: 18.53 | O34: 0.52400000000000002 | P34: 66.22 | Q34: 转股中 | R34: 5年25天 | S34: 3年26天 | T34: 8.49 | U34: 652 | V34: 0.745 | W34: 0.107 | X34: 7.0999999999999994e-002 | Y34: 79 | Z34: 3.26 | AA34: 3.0800000000000001e-002 | AB34: 2.4500000000000001e-002 | AC34: 8.8999999999999999e-003 | AD34: 6.6e-003 | AE34: 91.11 | AF34: 95.83 | AG34: 0.18 | AH34: AA | AI34: 4.1599999999999998e-002 | AJ34: =H34+100*O34 -> 153.30000000000001 | AK34: 135.6 | AL34: 105 | AM34: 39.8 | AN34: 95 | AO34: 0.18100000000000002 | AP34: 22 | AQ34: 交建转债!
A35: 180 | B35: 123053 | C35: 宝通转债! | D35: 300031 | E35: 宝通科技 | F35: 通信互联 | G35: 互联网 | H35: 104.802 | I35: -6.8000000000000005e-003 | J35: 7.000000000000001e-004 | K35: 12.98 | L35: -2.7000000000000003e-002 | M35: 120.8 | N35: 20.5 | O35: 0.65500000000000003 | P35: 63.32 | Q35: 转股中 | R35: 4.79年 | S35: 2.79年 | T35: 5 | U35: 4.4 | V35: 8.0000000000000002e-003 | W35: 9.6999999999999989e-002 | X35: 6.0999999999999999e-002 | Y35: 52 | Z35: 1.68 | AA35: 3.0699999999999998e-002 | AB35: 2.3e-002 | AC35: -3.4999999999999996e-003 | AD35: -6.0000000000000001e-003 | AE35: 87.18 | AF35: 91.48 | AG35: 0.23 | AH35: AA- | AI35: 6.1100000000000002e-002 | AJ35: =H35+100*O35 -> 170.30200000000002 | AK35: 146.3 | AL35: 202 | AM35: 54.8 | AN35: 206 | AO35: -6.2e-002 | AP35: 11 | AQ35: 宝通转债!
A36: 97 | B36: 123077 | C36: 汉得转债! | D36: 300170 | E36: 汉得信息 | F36: 计算机及 | G36: 软件开发 | H36: 107.4 | I36: -2.7000000000000001e-003 | J36: -1.9e-003 | K36: 7.47 | L36: -1.7100000000000001e-002 | M36: 125.5 | N36: 9.69 | O36: 0.39299999999999996 | P36: 77.09 | Q36: 转股中 | R36: 5.26年 | S36: 3.26年 | T36: 9.37 | U36: 14 | V36: 1.3999999999999999e-002 | W36: 0.14199999999999999 | X36: 0.109 | Y36: 66 | Z36: 2.08 | AA36: 3.0699999999999998e-002 | AB36: 2.23e-002 | AC36: -9.8999999999999991e-003 | AD36: -1.2e-002 | AE36: 90.44 | AF36: 101.72 | AG36: 0.27 | AH36: AA | AI36: 4.1599999999999998e-002 | AJ36: =H36+100*O36 -> 146.69999999999999 | AK36: 137.7 | AL36: 124 | AM36: 36 | AN36: 63 | AO36: -1.3000000000000001e-002 | AP36: 15 | AQ36: 汉得转债!
A37: 94 | B37: 128139 | C37: 祥鑫转债! | D37: 2965 | E37: 祥鑫科技 | F37: 汽车 | G37: 零部件制 | H37: 103.5 | I37: -2.8999999999999998e-003 | J37: -8.0000000000000004e-004 | K37: 22.55 | L37: -1.61e-002 | M37: 121 | N37: 36.96 | O37: 0.69599999999999995 | P37: 61.01 | Q37: 转股中 | R37: 5.28年 | S37: 3.28年 | T37: 6.47 | U37: 7.4 | V37: 1.1000000000000001e-002 | W37: 0.19 | X37: 0.11599999999999999 | Y37: 34 | Z37: 1.92 | AA37: 3.0699999999999998e-002 | AB37: 2.3599999999999999e-002 | AC37: 1.1999999999999999e-003 | AD37: -1.e-003 | AE37: 84.48 | AF37: 88.42 | AG37: 0.22 | AH37: AA- | AI37: 6.2600000000000003e-002 | AJ37: =H37+100*O37 -> 173.09999999999999 | AK37: 146 | AL37: 200 | AM37: 57.6 | AN37: 233 | AO37: -4.2999999999999997e-002 | AP37: 15 | AQ37: 祥鑫转债!
A38: 61 | B38: 113042 | C38: 上银转债! | D38: 601229 | E38: 上海银行 | F38: 金融 | G38: 银行行业 | H38: 103.16 | I38: -2.9999999999999997e-004 | J38: 1.1000000000000001e-003 | K38: 7.29 | L38: 4.0999999999999995e-003 | M38: 120.9 | N38: 10.63 | O38: 0.504 | P38: 68.58 | Q38: 转股中 | R38: 5.43年 | S38: 无权 | T38: 200 | U38: 159 | V38: 8.0000000000000002e-003 | W38: 0.193 | X38: 0.13200000000000001 | Y38: 1036. | Z38: 0.59 | AA38: 3.0499999999999999e-002 | AB38: 2.3599999999999999e-002 | AC38: 无权 | AD38: 无权 | AE38: 无权 | AF38: 101.04 | AG38: 0.2 | AH38: AAA | AI38: 3.4599999999999999e-002 | AJ38: =H38+100*O38 -> 153.56 | AK38: 137.7 | AL38: 125 | AM38: 36.7 | AN38: 67 | AO38: 8.0000000000000002e-003 | AP38: 12 | AQ38: 上银转债!
A39: 254 | B39: 110059 | C39: 浦发转债! | D39: 600000 | E39: 浦发银行 | F39: 金融 | G39: 银行行业 | H39: 104.14 | I39: -8.0000000000000004e-004 | J39: 1.2999999999999999e-003 | K39: 9.27 | L39: 4.3e-003 | M39: 117.6 | N39: 13.97 | O39: 0.56899999999999995 | P39: 66.36 | Q39: 转股中 | R39: 4.19年 | S39: 无权 | T39: 500 | U39: 81 | V39: 2.e-003 | W39: 0.184 | X39: 0.122 | Y39: 2721. | Z39: 0.5 | AA39: 3.04e-002 | AB39: 2.2599999999999999e-002 | AC39: 无权 | AD39: 无权 | AE39: 无权 | AF39: 103.05 | AG39: 0.13 | AH39: AAA | AI39: 3.3099999999999997e-002 | AJ39: =H39+100*O39 -> 161.03999999999999 | AK39: 141.9 | AL39: 163 | AM39: 38.9 | AN39: 89 | AO39: 9.0000000000000011e-003 | AP39: 61 | AQ39: 浦发转债!
A40: 191 | B40: 113578 | C40: 全筑转债! | D40: 603030 | E40: 全筑股份 | F40: 建筑 | G40: 装饰工程 | H40: 102.85 | I40: -1.4000000000000002e-003 | J40: -2.5999999999999999e-003 | K40: 4.18 | L40: -1.4199999999999999e-002 | M40: 117.9 | N40: 5.4 | O40: 0.32899999999999996 | P40: 77.41 | Q40: 转股中 | R40: 4.66年 | S40: 2.67年 | T40: 3.84 | U40: 3.6 | V40: 9.0000000000000011e-003 | W40: 0.17100000000000001 | X40: 0.13200000000000001 | Y40: 22 | Z40: 0.99 | AA40: 3.0299999999999997e-002 | AB40: 2.3300000000000001e-002 | AC40: 1.9e-003 | AD40: -4.0000000000000002e-004 | AE40: 92.6 | AF40: 98.49 | AG40: 0.28 | AH40: AA | AI40: 4.0099999999999997e-002 | AJ40: =H40+100*O40 -> 135.75 | AK40: 128.3 | AL40: 35 | AM40: 29.8 | AN40: 28 | AO40: 1.2e-002 | AP40: 23 | AQ40: 全筑转债!
A41: 235 | B41: 123039 | C41: 开润转债! | D41: 300577 | E41: 开润股份 | F41: 服装纺织 | G41: 纺织行业 | H41: 106.65 | I41: -2.3e-003 | J41: 1.2999999999999999e-003 | K41: 16.18 | L41: -8.6e-003 | M41: 121 | N41: 29.9 | O41: 0.97099999999999997 | P41: 54.11 | Q41: 转股中 | R41: 4.35年 | S41: 2.35年 | T41: 2.22 | U41: 2 | V41: 9.0000000000000011e-003 | W41: 5.7000000000000002e-002 | X41: 3.1e-002 | Y41: 39 | Z41: 2.54 | AA41: 3.0200000000000001e-002 | AB41: 2.1499999999999998e-002 | AC41: -9.7000000000000003e-003 | AD41: -1.2800000000000001e-002 | AE41: 87.55 | AF41: 90.07 | AG41: 0.12 | AH41: A+ | AI41: 7.2099999999999997e-002 | AJ41: =H41+100*O41 -> 203.75 | AK41: 159.2 | AL41: 281 | AM41: 69.1 | AN41: 288 | AO41: -5.5999999999999994e-002 | AP41: 23 | AQ41: 开润转债!
A42: 166 | B42: 128118 | C42: 瀛通转债! | D42: 2861 | E42: 瀛通通讯 | F42: 电子 | G42: 电子产品 | H42: 105.98 | I42: -7.000000000000001e-004 | J42: 2.0000000000000001e-004 | K42: 12.58 | L42: -2.3999999999999998e-003 | M42: 121.7 | N42: 21.12 | O42: 0.77900000000000003 | P42: 59.56 | Q42: 转股中 | R42: 4.86年 | S42: 2.87年 | T42: 3 | U42: 2.3 | V42: 6.9999999999999993e-003 | W42: 0.151 | X42: 8.9999999999999997e-002 | Y42: 20 | Z42: 1.43 | AA42: 2.9500000000000002e-002 | AB42: 2.1600000000000001e-002 | AC42: -5.6000000000000008e-003 | AD42: -8.3000000000000001e-003 | AE42: 87.21 | AF42: 91.82 | AG42: 0.19 | AH42: AA- | AI42: 6.1100000000000002e-002 | AJ42: =H42+100*O42 -> 183.88 | AK42: 152.4 | AL42: 248 | AM42: 60.6 | AN42: 249 | AO42: 2.e-002 | AP42: 19 | AQ42: 瀛通转债!
A43: 195 | B43: 123049 | C43: 维尔转债! | D43: 300190 | E43: 维尔利 | F43: 城市公用 | G43: 三废处理 | H43: 109.045 | I43: 4.0000000000000002e-004 | J43: -4.4000000000000003e-003 | K43: 6.04 | L43: -9.7999999999999997e-003 | M43: 124.3 | N43: 7.38 | O43: 0.33200000000000002 | P43: 81.84 | Q43: 转股中 | R43: 4.65年 | S43: 2.65年 | T43: 9.17 | U43: 9 | V43: 9.0000000000000011e-003 | W43: 0.19399999999999998 | X43: 0.159 | Y43: 47 | Z43: 1.09 | AA43: 2.9300000000000003e-002 | AB43: 2.0199999999999999e-002 | AC43: -1.61e-002 | AD43: -1.89e-002 | AE43: 88.37 | AF43: 94.99 | AG43: 0.4 | AH43: AA- | AI43: 6.1100000000000002e-002 | AJ43: =H43+100*O43 -> 142.245 | AK43: 136.2 | AL43: 116 | AM43: 41.3 | AN43: 113 | AO43: -1.8000000000000002e-002 | AP43: 18 | AQ43: 维尔转债!
A44: 182 | B44: 113584 | C44: 家悦转债! | D44: 603708 | E44: 家家悦 | F44: 商业零售 | G44: 超市 | H44: 100.34 | I44: -2.5000000000000001e-003 | J44: 2.3999999999999998e-003 | K44: 15.3 | L44: -9.7000000000000003e-003 | M44: 114.9 | N44: 37.53 | O44: 1.46 | P44: 40.77 | Q44: 转股中 | R44: 4.79年 | S44: 2.79年 | T44: 6.45 | U44: 1 | V44: 1.e-003 | W44: 6.9000000000000006e-002 | X44: 2.7999999999999997e-002 | Y44: 93 | Z44: 3.31 | AA44: 2.9300000000000003e-002 | AB44: 2.3399999999999997e-002 | AC44: 1.03e-002 | AD44: 8.0000000000000002e-003 | AE44: 92.14 | AF44: 95.52 | AG44: 0.01 | AH44: AA | AI44: 4.0099999999999997e-002 | AJ44: =H44+100*O44 -> 246.34 | AK44: 159.9 | AL44: 285 | AM44: 64.4 | AN44: 266 | AO44: 1.e-003 | AP44: 14 | AQ44: 家悦转债!
A45: 302 | B45: 113021 | C45: 中信转债! | D45: 601998 | E45: 中信银行 | F45: 金融 | G45: 银行行业 | H45: 106.9 | I45: 4.0000000000000002e-004 | J45: -5.9999999999999995e-004 | K45: 4.61 | L45: -2.2000000000000001e-003 | M45: 118 | N45: 6.73 | O45: 0.56100000000000005 | P45: 68.5 | Q45: 转股中 | R45: 3.54年 | S45: 无权 | T45: 400 | U45: 6.5 | V45: 0. | W45: 0.17699999999999999 | X45: 0.121 | Y45: 2256. | Z45: 0.47 | AA45: 2.92e-002 | AB45: 1.9900000000000001e-002 | AC45: 无权 | AD45: 无权 | AE45: 无权 | AF45: 105.53 | AG45: 0.11 | AH45: AAA | AI45: 3.3099999999999997e-002 | AJ45: =H45+100*O45 -> 163. | AK45: 145.3 | AL45: 197 | AM45: 39.8 | AN45: 96 | AO45: -1.3000000000000001e-002 | AP45: 42 | AQ45: 中信转债!
A46: 271 | B46: 128069 | C46: 华森转债! | D46: 2907 | E46: 华森制药 | F46: 医药 | G46: 化学制药 | H46: 107.1 | I46: 8.9999999999999998e-004 | J46: -2.8000000000000004e-003 | K46: 12.1 | L46: -9.7999999999999997e-003 | M46: 119.3 | N46: 18.01 | O46: 0.59399999999999997 | P46: 67.18 | Q46: 转股中 | R46: 3.84年 | S46: 1.85年 | T46: 3 | U46: 4.5 | V46: 1.3999999999999999e-002 | W46: 6.2e-002 | X46: 4.0999999999999995e-002 | Y46: 49 | Z46: 4.24 | AA46: 2.8999999999999998e-002 | AB46: 2.e-002 | AC46: -2.0299999999999999e-002 | AD46: -2.3e-002 | AE46: 91.32 | AF46: 95.37 | AG46: 0.19 | AH46: AA- | AI46: 6.1100000000000002e-002 | AJ46: =H46+100*O46 -> 166.5 | AK46: 147 | AL46: 212 | AM46: 51.6 | AN46: 186 | AO46: -9.0000000000000011e-003 | AP46: 43 | AQ46: 华森转债!
A47: 280 | B47: 127013 | C47: 创维转债! | D47: 810 | E47: 创维数字 | F47: 电子 | G47: 电子产品 | H47: 105.99 | I47: 5.9999999999999995e-004 | J47: 2.0000000000000001e-004 | K47: 7.73 | L47: 6.5000000000000006e-003 | M47: 117.3 | N47: 11.29 | O47: 0.54799999999999993 | P47: 68.47 | Q47: 转股中 | R47: 3.65年 | S47: 1.65年 | T47: 9.78 | U47: 3.7 | V47: 4.0000000000000001e-003 | W47: 0.11900000000000001 | X47: 8.1000000000000003e-002 | Y47: 82 | Z47: 1.95 | AA47: 2.87e-002 | AB47: 2.0099999999999996e-002 | AC47: -1.6799999999999999e-002 | AD47: -1.9699999999999999e-002 | AE47: 95.76 | AF47: 101.89 | AG47: 0.12 | AH47: AA | AI47: 4.0099999999999997e-002 | AJ47: =H47+100*O47 -> 160.78999999999999 | AK47: 143.5 | AL47: 182 | AM47: 41.6 | AN47: 119 | AO47: -6.6000000000000003e-002 | AP47: 23 | AQ47: 创维转债!
A48: 90 | B48: 123081 | C48: 精研转债! | D48: 300709 | E48: 精研科技 | F48: 电子 | G48: 电子产品 | H48: 105.007 | I48: -3.3e-003 | J48: 4.0000000000000002e-004 | K48: 29.35 | L48: -1.77e-002 | M48: 121.3 | N48: 53.4 | O48: 0.91099999999999992 | P48: 54.96 | Q48: 转股中 | R48: 5.29年 | S48: 3.29年 | T48: 5.7 | U48: 2.5 | V48: 4.0000000000000001e-003 | W48: 0.14000000000000001 | X48: 7.6999999999999999e-002 | Y48: 41 | Z48: 2.13 | AA48: 2.8300000000000002e-002 | AB48: 2.1099999999999997e-002 | AC48: -2.2000000000000001e-003 | AD48: -4.5999999999999999e-003 | AE48: 84.7 | AF48: 88.64 | AG48: 0.16 | AH48: AA- | AI48: 6.2600000000000003e-002 | AJ48: =H48+100*O48 -> 196.107 | AK48: 155.1 | AL48: 265 | AM48: 66.4 | AN48: 275 | AO48: -6.3e-002 | AP48: 9 | AQ48: 精研转债!
A49: 24 | B49: 113624 | C49: 正川转债! | D49: 603976 | E49: 正川股份 | F49: 医药 | G49: 医药行业 | H49: 104.47 | I49: -6.0999999999999995e-003 | J49: -5.1999999999999998e-003 | K49: 33.14 | L49: -2.53e-002 | M49: 121.6 | N49: 46.69 | O49: 0.47200000000000003 | P49: 70.98 | Q49: 2月20天 | R49: 5.69年 | S49: 3.69年 | T49: 4.05 | U49: 10 | V49: 2.4e-002 | W49: 8.1000000000000003e-002 | X49: 5.7000000000000002e-002 | Y49: 50 | Z49: 4.75 | AA49: 2.7699999999999999e-002 | AB49: 2.0899999999999998e-002 | AC49: 2.9999999999999997e-004 | AD49: -2.e-003 | AE49: 79.82 | AF49: 81.98 | AG49: 0.45 | AH49: A+ | AI49: 7.3599999999999999e-002 | AJ49: =H49+100*O49 -> 151.67000000000002 | AK49: 138 | AL49: 127 | AM49: 56 | AN49: 219 | AO49: -7.2000000000000008e-002 | AP49: 15 | AQ49: 正川转债!
A50: 143 | B50: 128125 | C50: 华阳转债! | D50: 2949 | E50: 华阳国际 | F50: 建筑 | G50: 建筑工程 | H50: 103.5 | I50: -7.4999999999999997e-003 | J50: 3.0000000000000001e-003 | K50: 15.38 | L50: -2.1000000000000001e-002 | M50: 118.1 | N50: 25.39 | O50: 0.70900000000000007 | P50: 60.58 | Q50: 转股中 | R50: 4.94年 | S50: 2.94年 | T50: 4.5 | U50: 1.9 | V50: 4.0000000000000001e-003 | W50: 0.14899999999999999 | X50: 8.9999999999999997e-002 | Y50: 30 | Z50: 2.37 | AA50: 2.76e-002 | AB50: 2.0899999999999998e-002 | AC50: -2.0000000000000001e-004 | AD50: -2.3e-003 | AE50: 86.15 | AF50: 88.59 | AG50: 0.22 | AH50: AA- | AI50: 6.1100000000000002e-002 | AJ50: =H50+100*O50 -> 174.40000000000001 | AK50: 146.4 | AL50: 204 | AM50: 57.8 | AN50: 236 | AO50: -5.9000000000000004e-002 | AP50: 8 | AQ50: 华阳转债!
A51: 222 | B51: 113566 | C51: 翔港转债! | D51: 603499 | E51: 翔港科技 | F51: 造纸包装 | G51: 包装材料 | H51: 109.98 | I51: -3.5999999999999999e-003 | J51: 2.3999999999999998e-003 | K51: 7.15 | L51: -4.1999999999999997e-003 | M51: 124 | N51: 10.77 | O51: 0.65700000000000003 | P51: 66.39 | Q51: 转股中 | R51: 4.52年 | S51: 2.53年 | T51: 1.61 | U51: 1.7 | V51: 9.0000000000000011e-003 | W51: 0.11199999999999999 | X51: 7.400000000000001e-002 | Y51: 14 | Z51: 2.54 | AA51: 2.75e-002 | AB51: 1.83e-002 | AC51: -2.0199999999999999e-002 | AD51: -2.3099999999999999e-002 | AE51: 86.57 | AF51: 91.19 | AG51: 0.28 | AH51: A+ | AI51: 7.2099999999999997e-002 | AJ51: =H51+100*O51 -> 175.68000000000001 | AK51: 153.6 | AL51: 259 | AM51: 62.4 | AN51: 261 | AO51: -1.4999999999999999e-002 | AP51: 28 | AQ51: 翔港转债!
A52: 354 | B52: 128022 | C52: 众信转债! | D52: 2707 | E52: 众信旅游 | F52: 旅游餐饮 | G52: 旅游 | H52: 102.779 | I52: 8.0000000000000004e-004 | J52: -8.0000000000000004e-004 | K52: 4.69 | L52: 0. | M52: 108.8 | N52: 7.92 | O52: 0.73599999999999999 | P52: 59.22 | Q52: 转股中 | R52: 2.28年 | S52: 0.28年 | T52: 4.56 | U52: 7.5 | V52: 1.6e-002 | W52: 0.107 | X52: 6.3e-002 | Y52: 43 | Z52: 6.36 | AA52: 2.5699999999999997e-002 | AB52: 1.8200000000000001e-002 | AC52: -2.6600000000000002e-002 | AD52: -3.32e-002 | AE52: 98.09 | AF52: 91.42 | AG52: 0 | AH52: A | AI52: 8.0700000000000008e-002 | AJ52: =H52+100*O52 -> 176.37899999999999 | AK52: 146.3 | AL52: 203 | AM52: 48.3 | AN52: 163 | AO52: 2.3e-002 | AP52: 34 | AQ52: 众信转债!
A53: 59 | B53: 123096 | C53: 思创转债! | D53: 300078 | E53: 思创医惠 | F53: 通信互联 | G53: 物联网 | H53: 108.335 | I53: -1.0200000000000001e-002 | J53: 3.4999999999999996e-003 | K53: 6.75 | L53: -1.46e-002 | M53: 124 | N53: 8.26 | O53: 0.32600000000000001 | P53: 81.72 | Q53: 转股中 | R53: 5.43年 | S53: 3.44年 | T53: 8.17 | U53: 5.7 | V53: 6.0000000000000001e-003 | W53: 0.13900000000000001 | X53: 0.114 | Y53: 59 | Z53: 1.97 | AA53: 2.5699999999999997e-002 | AB53: 1.8000000000000002e-002 | AC53: -1.1599999999999999e-002 | AD53: -1.37e-002 | AE53: 83.7 | AF53: 89.76 | AG53: 0.46 | AH53: AA- | AI53: 6.2600000000000003e-002 | AJ53: =H53+100*O53 -> 140.935 | AK53: 135 | AL53: 95 | AM53: 45.2 | AN53: 142 | AO53: -6.3e-002 | AP53: 7 | AQ53: 思创转债!
A54: 23 | B54: 127034 | C54: 绿茵转债 | D54: 2887 | E54: 绿茵生态 | F54: 城市公用 | G54: 生态环境 | H54: 103.299 | I54: -6.4000000000000003e-003 | J54: 1.8e-003 | K54: 10.36 | L54: -8.6e-003 | M54: 119 | N54: 12.38 | O54: 0.23399999999999999 | P54: 83.68 | Q54: 2月23天 | R54: 5.69年 | S54: 3.69年 | T54: 7.12 | U54: 14 | V54: 1.8000000000000002e-002 | W54: 0.22 | X54: 0.184 | Y54: 32 | Z54: 1.6 | AA54: 2.5699999999999997e-002 | AB54: 1.9699999999999999e-002 | AC54: 1.6000000000000001e-003 | AD54: -4.0000000000000002e-004 | AE54: 82.4 | AF54: 84.83 | AG54: 0.53 | AH54: AA- | AI54: 6.2600000000000003e-002 | AJ54: =H54+100*O54 -> 126.69900000000001 | AK54: 122.9 | AL54: 10 | AM54: 38.1 | AN54: 82 | AO54: -4.5999999999999999e-002 | AP54: 23 | AQ54: 绿茵转债
A55: 165 | B55: 113036 | C55: 宁建转债! | D55: 601789 | E55: 宁波建工 | F55: 建筑 | G55: 建筑工程 | H55: 103.64 | I55: -4.0999999999999995e-003 | J55: 4.7999999999999996e-003 | K55: 3.51 | L55: 2.8999999999999998e-003 | M55: 116.9 | N55: 4.76 | O55: 0.40500000000000003 | P55: 73.74 | Q55: 转股中 | R55: 4.88年 | S55: 2.88年 | T55: 5.4 | U55: 1.6 | V55: 3.0000000000000001e-003 | W55: 0.158 | X55: 0.11599999999999999 | Y55: 34 | Z55: 1.09 | AA55: 2.5499999999999998e-002 | AB55: 1.9099999999999999e-002 | AC55: -8.0000000000000004e-004 | AD55: -2.8999999999999998e-003 | AE55: 91.83 | AF55: 96.85 | AG55: 0.25 | AH55: AA | AI55: 4.0099999999999997e-002 | AJ55: =H55+100*O55 -> 144.13999999999999 | AK55: 133.5 | AL55: 85 | AM55: 36.7 | AN55: 66 | AO55: 6.0000000000000001e-003 | AP55: 10 | AQ55: 宁建转债!
A56: 51 | B56: 113620 | C56: 傲农转债! | D56: 603363 | E56: 傲农生物 | F56: 农业 | G56: 畜牧业 | H56: 105.71 | I56: -2.0000000000000001e-004 | J56: -2.e-003 | K56: 8.51 | L56: -1.7299999999999999e-002 | M56: 121.1 | N56: 14.51 | O56: 0.80200000000000005 | P56: 58.65 | Q56: 27天 | R56: 5.55年 | S56: 3.55年 | T56: 10 | U56: 8.7 | V56: 8.0000000000000002e-003 | W56: 0.17100000000000001 | X56: 0.10099999999999999 | Y56: 58 | Z56: 1.98 | AA56: 2.52e-002 | AB56: 1.8500000000000003e-002 | AC56: -5.4000000000000003e-003 | AD56: -7.3000000000000001e-003 | AE56: 89.15 | AF56: 96.96 | AG56: 0.13 | AH56: AA | AI56: 4.1599999999999998e-002 | AJ56: =H56+100*O56 -> 185.91 | AK56: 152.8 | AL56: 252 | AM56: 55.8 | AN56: 215 | AO56: 6.0000000000000001e-003 | AP56: 8 | AQ56: 傲农转债!
A57: 350 | B57: 123004 | C57: 铁汉转债! | D57: 300197 | E57: 节能铁汉 | F57: 城市公用 | G57: 生态环境 | H57: 102.851 | I57: -3.0000000000000001e-003 | J57: 1.8e-003 | K57: 2.82 | L57: -1.0500000000000001e-002 | M57: 108.8 | N57: 3.82 | O57: 0.39299999999999996 | P57: 73.82 | Q57: 转股中 | R57: 2.33年 | S57: 0.33年 | T57: 8.03 | U57: 5.2 | V57: 6.0000000000000001e-003 | W57: 0.10099999999999999 | X57: 7.400000000000001e-002 | Y57: 80 | Z57: 1.21 | AA57: 2.4900000000000002e-002 | AB57: 1.7500000000000002e-002 | AC57: -2.5499999999999998e-002 | AD57: -3.15e-002 | AE57: 99.67 | AF57: 99.74 | AG57: 0.11 | AH57: AA | AI57: 3.8699999999999998e-002 | AJ57: =H57+100*O57 -> 142.15100000000001 | AK57: 131.9 | AL57: 65 | AM57: 32.1 | AN57: 39 | AO57: -1.1000000000000001e-002 | AP57: 46 | AQ57: 铁汉转债!
A58: 171 | B58: 127018 | C58: 本钢转债! | D58: 761 | E58: 本钢板材 | F58: 钢铁 | G58: 炼钢 | H58: 114 | I58: 0. | J58: 5.7999999999999996e-003 | K58: 5.09 | L58: 1.1899999999999999e-002 | M58: 128 | N58: 5.02 | O58: 0.124 | P58: 101.39 | Q58: 转股中 | R58: 4.86年 | S58: 2.86年 | T58: 67.5 | U58: 135 | V58: 1.8000000000000002e-002 | W58: 0.34100000000000003 | X58: 0.34600000000000003 | Y58: 198 | Z58: 0.96 | AA58: 2.4900000000000002e-002 | AB58: 1.5100000000000001e-002 | AC58: -2.4500000000000001e-002 | AD58: -2.81e-002 | AE58: 93.3 | AF58: 104.9 | AG58: 0.49 | AH58: AAA | AI58: 4.3099999999999999e-002 | AJ58: =H58+100*O58 -> 126.40000000000001 | AK58: 126.6 | AL58: 26 | AM58: 21.7 | AN58: 4 | AO58: 2.7999999999999997e-002 | AP58: 66 | AQ58: 本钢转债!
A59: 144 | B59: 113597 | C59: 佳力转债! | D59: 603912 | E59: 佳力图 | F59: 机械装备 | G59: 专用设备 | H59: 110.13 | I59: -7.4000000000000003e-003 | J59: 5.7999999999999996e-003 | K59: 15.93 | L59: -5.6000000000000008e-003 | M59: 124 | N59: 23.15 | O59: 0.59999999999999998 | P59: 68.81 | Q59: 转股中 | R59: 4.94年 | S59: 2.94年 | T59: 3 | U59: 6.3 | V59: 1.9e-002 | W59: 8.6999999999999994e-002 | X59: 5.9999999999999998e-002 | Y59: 35 | Z59: 3.72 | AA59: 2.4799999999999999e-002 | AB59: 1.6399999999999998e-002 | AC59: -1.8600000000000002e-002 | AD59: -2.1000000000000001e-002 | AE59: 86.56 | AF59: 93.06 | AG59: 0.28 | AH59: AA- | AI59: 6.1100000000000002e-002 | AJ59: =H59+100*O59 -> 170.13 | AK59: 151.4 | AL59: 238 | AM59: 58.4 | AN59: 238 | AO59: -2.7999999999999997e-002 | AP59: 17 | AQ59: 佳力转债!
A60: 369 | B60: 128013 | C60: 洪涛转债! | D60: 2325 | E60: 洪涛股份 | F60: 建筑 | G60: 装饰工程 | H60: 105.555 | I60: -3.0000000000000001e-003 | J60: -5.4000000000000003e-003 | K60: 2.27 | L60: -2.1600000000000001e-002 | M60: 108 | N60: 2.32 | O60: 7.9000000000000001e-002 | P60: 97.84 | Q60: 转股中 | R60: 0.94年 | S60: 回售内 | T60: 11.5 | U60: 22 | V60: 1.8000000000000002e-002 | W60: 0.40000000000000002 | X60: 0.39200000000000002 | Y60: 29 | Z60: 1.05 | AA60: 2.4700000000000003e-002 | AB60: 8.5000000000000006e-003 | AC60: 回售内 | AD60: 回售内 | AE60: 100.33 | AF60: 99.8 | AG60: 0.39 | AH60: A- | AI60: 8.77e-002 | AJ60: =H60+100*O60 -> 113.45500000000001 | AK60: 113.3 | AL60: 4 | AM60: 12.9 | AN60: 2 | AO60: -1.1000000000000001e-002 | AP60: 95 | AQ60: 洪涛转债!
A61: 256 | B61: 113546 | C61: 迪贝转债! | D61: 603320 | E61: 迪贝电气 | F61: 家电 | G61: 零部件制 | H61: 109.2 | I61: -1.44e-002 | J61: 2.8999999999999998e-003 | K61: 11.63 | L61: -2.5099999999999997e-002 | M61: 120.6 | N61: 14 | O61: 0.315 | P61: 83.07 | Q61: 转股中 | R61: 4.17年 | S61: 2.18年 | T61: 2.3 | U61: 6 | V61: 2.4e-002 | W61: 0.152 | X61: 0.126 | Y61: 15 | Z61: 2.18 | AA61: 2.4700000000000003e-002 | AB61: 1.5900000000000001e-002 | AC61: -2.12e-002 | AD61: -2.4300000000000002e-002 | AE61: 88.51 | AF61: 90.87 | AG61: 0.46 | AH61: A+ | AI61: 7.2099999999999997e-002 | AJ61: =H61+100*O61 -> 140.69999999999999 | AK61: 135.3 | AL61: 102 | AM61: 44.5 | AN61: 139 | AO61: -2.2000000000000002e-002 | AP61: 38 | AQ61: 迪贝转债!
A62: 152 | B62: 113037 | C62: 紫银转债! | D62: 601860 | E62: 紫金银行 | F62: 金融 | G62: 银行行业 | H62: 102.92 | I62: -5.9999999999999995e-004 | J62: -1.5e-003 | K62: 3.26 | L62: -6.0999999999999995e-003 | M62: 115.6 | N62: 4.05 | O62: 0.27899999999999997 | P62: 80.49 | Q62: 转股中 | R62: 4.92年 | S62: 无权 | T62: 45 | U62: 18 | V62: 4.0000000000000001e-003 | W62: 0.377 | X62: 0.30299999999999999 | Y62: 119 | Z62: 0.81 | AA62: 2.4399999999999998e-002 | AB62: 1.8500000000000003e-002 | AC62: 无权 | AD62: 无权 | AE62: 无权 | AF62: 97.9 | AG62: 0.33 | AH62: AA+ | AI62: 3.5099999999999999e-002 | AJ62: =H62+100*O62 -> 130.81999999999999 | AK62: 125.3 | AL62: 19 | AM62: 27.5 | AN62: 18 | AO62: -1.e-002 | AP62: 24 | AQ62: 紫银转债!
A63: 141 | B63: 113599 | C63: 嘉友转债! | D63: 603871 | E63: 嘉友国际 | F63: 交通运输 | G63: 物流业 | H63: 111.71 | I63: -4.8999999999999998e-003 | J63: 7.6e-003 | K63: 17.1 | L63: 5.3e-003 | M63: 125.6 | N63: 18.32 | O63: 0.19699999999999998 | P63: 93.34 | Q63: 转股中 | R63: 4.96年 | S63: 2.96年 | T63: 7.2 | U63: 12 | V63: 1.3999999999999999e-002 | W63: 0.14800000000000002 | X63: 0.13800000000000001 | Y63: 49 | Z63: 1.75 | AA63: 2.4399999999999998e-002 | AB63: 1.5600000000000001e-002 | AC63: -2.4199999999999999e-002 | AD63: -2.63e-002 | AE63: 86.13 | AF63: 94.12 | AG63: 0.51 | AH63: AA- | AI63: 6.1100000000000002e-002 | AJ63: =H63+100*O63 -> 131.41 | AK63: 130.1 | AL63: 44 | AM63: 36 | AN63: 62 | AO63: 4.4000000000000004e-002 | AP63: 20 | AQ63: 嘉友转债!
A64: 78 | B64: 123088 | C64: 威唐转债! | D64: 300707 | E64: 威唐工业 | F64: 汽车 | G64: 零部件制 | H64: 107.4 | I64: -1.01e-002 | J64: -5.5000000000000005e-003 | K64: 16.48 | L64: -3.0600000000000002e-002 | M64: 121.6 | N64: 20.72 | O64: 0.34999999999999998 | P64: 79.54 | Q64: 转股中 | R64: 5.32年 | S64: 3.32年 | T64: 3.01 | U64: 4.6 | V64: 1.3999999999999999e-002 | W64: 0.11599999999999999 | X64: 9.3000000000000013e-002 | Y64: 26 | Z64: 3.72 | AA64: 2.4199999999999999e-002 | AB64: 1.7000000000000001e-002 | AC64: -7.6e-003 | AD64: -1.01e-002 | AE64: 81.93 | AF64: 84.14 | AG64: 0.51 | AH64: A+ | AI64: 7.3599999999999999e-002 | AJ64: =H64+100*O64 -> 142.40000000000001 | AK64: 135.3 | AL64: 100 | AM64: 51.1 | AN64: 181 | AO64: -5.0000000000000003e-002 | AP64: 16 | AQ64: 威唐转债!
A65: 304 | B65: 128056 | C65: 今飞转债! | D65: 2863 | E65: 今飞凯达 | F65: 汽车 | G65: 零部件制 | H65: 111.01 | I65: -7.7000000000000002e-003 | J65: 5.8999999999999999e-003 | K65: 5.04 | L65: -5.8999999999999999e-003 | M65: 120.2 | N65: 6.69 | O65: 0.47399999999999998 | P65: 75.34 | Q65: 转股中 | R65: 3.53年 | S65: 1.53年 | T65: 1.72 | U65: 2.3 | V65: 1.2e-002 | W65: 6.9000000000000006e-002 | X65: 5.2000000000000005e-002 | Y65: 25 | Z65: 1.33 | AA65: 2.3300000000000001e-002 | AB65: 1.32e-002 | AC65: -4.1700000000000001e-002 | AD65: -4.53e-002 | AE65: 91.98 | AF65: 94.57 | AG65: 0.31 | AH65: A+ | AI65: 7.2099999999999997e-002 | AJ65: =H65+100*O65 -> 158.41 | AK65: 146.7 | AL65: 207 | AM65: 52.1 | AN65: 193 | AO65: -3.0000000000000001e-003 | AP65: 53 | AQ65: 今飞转债!
A66: 287 | B66: 113532 | C66: 海环转债! | D66: 603817 | E66: 海峡环保 | F66: 城市公用 | G66: 三废处理 | H66: 103.49 | I66: -3.0999999999999999e-003 | J66: 1.1999999999999999e-003 | K66: 5.61 | L66: -8.8000000000000005e-003 | M66: 112.3 | N66: 7.63 | O66: 0.40799999999999997 | P66: 73.53 | Q66: 转股中 | R66: 3.62年 | S66: 1.62年 | T66: 4.59 | U66: 1.7 | V66: 3.0000000000000001e-003 | W66: 0.182 | X66: 0.13400000000000001 | Y66: 25 | Z66: 1.42 | AA66: 2.3300000000000001e-002 | AB66: 1.6899999999999998e-002 | AC66: -3.8e-003 | AD66: -6.8000000000000005e-003 | AE66: 95.89 | AF66: 97.69 | AG66: 0.22 | AH66: AA | AI66: 4.0099999999999997e-002 | AJ66: =H66+100*O66 -> 144.28999999999999 | AK66: 133.5 | AL66: 83 | AM66: 35.8 | AN66: 59 | AO66: 2.3e-002 | AP66: 27 | AQ66: 海环转债!
A67: 311 | B67: 113524 | C67: 奇精转债! | D67: 603677 | E67: 奇精机械 | F67: 家电 | G67: 零部件制 | H67: 109 | I67: -9.0000000000000011e-003 | J67: 4.3e-003 | K67: 11.73 | L67: -1.26e-002 | M67: 117.3 | N67: 13.98 | O67: 0.29899999999999999 | P67: 83.91 | Q67: 转股中 | R67: 3.32年 | S67: 1.32年 | T67: 3.3 | U67: 7.4 | V67: 2.e-002 | W67: 0.14599999999999999 | X67: 0.12300000000000001 | Y67: 23 | Z67: 2.27 | AA67: 2.2799999999999997e-002 | AB67: 1.34e-002 | AC67: -3.9e-002 | AD67: -4.2500000000000003e-002 | AE67: 94.22 | AF67: 96.75 | AG67: 0.37 | AH67: AA- | AI67: 6.1100000000000002e-002 | AJ67: =H67+100*O67 -> 138.90000000000001 | AK67: 134.1 | AL67: 91 | AM67: 37.3 | AN67: 74 | AO67: -1.8000000000000002e-002 | AP67: 43 | AQ67: 奇精转债!
A68: 239 | B68: 128087 | C68: 孚日转债! | D68: 2083 | E68: 孚日股份 | F68: 服装纺织 | G68: 家纺 | H68: 102.64 | I68: -3.4999999999999996e-003 | J68: 4.7999999999999996e-003 | K68: 4 | L68: 2.5000000000000001e-003 | M68: 112.9 | N68: 4.5 | O68: 0.155 | P68: 88.89 | Q68: 转股中 | R68: 4.32年 | S68: 2.33年 | T68: 6.5 | U68: 17 | V68: 2.6000000000000002e-002 | W68: 0.17899999999999999 | X68: 0.159 | Y68: 36 | Z68: 0.98 | AA68: 2.2799999999999997e-002 | AB68: 1.7100000000000001e-002 | AC68: 3.0000000000000001e-003 | AD68: 2.9999999999999997e-004 | AE68: 89.34 | AF68: 87.86 | AG68: 0.54 | AH68: AA- | AI68: 6.1100000000000002e-002 | AJ68: =H68+100*O68 -> 118.14 | AK68: 116.4 | AL68: 5 | AM68: 27.1 | AN68: 15 | AO68: -1.e-002 | AP68: 69 | AQ68: 孚日转债!
A69: 156 | B69: 113594 | C69: 淳中转债! | D69: 603516 | E69: 淳中科技 | F69: 电子 | G69: 电子产品 | H69: 108.8 | I69: -1.1000000000000001e-003 | J69: 5.9999999999999995e-004 | K69: 18.09 | L69: -1.7000000000000001e-003 | M69: 120.9 | N69: 27.84 | O69: 0.67400000000000004 | P69: 64.98 | Q69: 转股中 | R69: 4.92年 | S69: 2.92年 | T69: 3 | U69: 1.2 | V69: 4.0000000000000001e-003 | W69: 8.900000000000001e-002 | X69: 5.7999999999999996e-002 | Y69: 34 | Z69: 3.58 | AA69: 2.2099999999999998e-002 | AB69: 1.46e-002 | AC69: -1.44e-002 | AD69: -1.6899999999999998e-002 | AE69: 84.14 | AF69: 86.51 | AG69: 0.3 | AH69: A+ | AI69: 7.2099999999999997e-002 | AJ69: =H69+100*O69 -> 176.19999999999999 | AK69: 152.6 | AL69: 250 | AM69: 66.1 | AN69: 273 | AO69: -8.3000000000000004e-002 | AP69: 9 | AQ69: 淳中转债!
A70: 170 | B70: 128116 | C70: 瑞达转债! | D70: 2961 | E70: 瑞达期货 | F70: 金融 | G70: 期货行业 | H70: 103.558 | I70: -4.0000000000000002e-004 | J70: 1.4000000000000002e-003 | K70: 21.1 | L70: 3.8e-003 | M70: 114.9 | N70: 29.55 | O70: 0.45000000000000001 | P70: 71.4 | Q70: 转股中 | R70: 4.86年 | S70: 2.86年 | T70: 6.5 | U70: 5.1 | V70: 8.0000000000000002e-003 | W70: 6.9000000000000006e-002 | X70: 4.9000000000000002e-002 | Y70: 94 | Z70: 4.79 | AA70: 2.2000000000000002e-002 | AB70: 1.6399999999999998e-002 | AC70: -8.0000000000000004e-004 | AD70: -2.8999999999999998e-003 | AE70: 91.82 | AF70: 95.26 | AG70: 0.26 | AH70: AA | AI70: 4.0099999999999997e-002 | AJ70: =H70+100*O70 -> 148.55799999999999 | AK70: 135.7 | AL70: 109 | AM70: 40.4 | AN70: 104 | AO70: 4.8000000000000001e-002 | AP70: 19 | AQ70: 瑞达转债!
A71: 99 | B71: 123076 | C71: 强力转债! | D71: 300429 | E71: 强力新材 | F71: 化工 | G71: 化工 | H71: 106 | I71: -1.6899999999999998e-002 | J71: 1.72e-002 | K71: 13.84 | L71: 7.000000000000001e-004 | M71: 118.5 | N71: 18.94 | O71: 0.45100000000000001 | P71: 73.07 | Q71: 转股中 | R71: 5.25年 | S71: 3.25年 | T71: 8.5 | U71: 30 | V71: 3.4000000000000002e-002 | W71: 0.11900000000000001 | X71: 8.6999999999999994e-002 | Y71: 71 | Z71: 4.04 | AA71: 2.1899999999999999e-002 | AB71: 1.5600000000000001e-002 | AC71: -6.0999999999999995e-003 | AD71: -8.199999999999999e-003 | AE71: 84.58 | AF71: 86.76 | AG71: 0.39 | AH71: AA- | AI71: 6.2600000000000003e-002 | AJ71: =H71+100*O71 -> 151.09999999999999 | AK71: 138.9 | AL71: 131 | AM71: 52.2 | AN71: 194 | AO71: -2.6000000000000002e-002 | AP71: 17 | AQ71: 强力转债!
A72: 159 | B72: 128120 | C72: 联诚转债! | D72: 2921 | E72: 联诚精密 | F72: 汽车 | G72: 零部件制 | H72: 106.285 | I72: -9.7000000000000003e-003 | J72: -5.1000000000000004e-003 | K72: 14.78 | L72: -2.64e-002 | M72: 117.9 | N72: 18.44 | O72: 0.32600000000000001 | P72: 80.15 | Q72: 转股中 | R72: 4.91年 | S72: 2.91年 | T72: 2.6 | U72: 2.4 | V72: 9.0000000000000011e-003 | W72: 0.16600000000000001 | X72: 0.13300000000000001 | Y72: 16 | Z72: 1.52 | AA72: 2.18e-002 | AB72: 1.52e-002 | AC72: -6.8999999999999999e-003 | AD72: -9.3999999999999986e-003 | AE72: 81.86 | AF72: 80.78 | AG72: 0.56 | AH72: A | AI72: 8.2100000000000006e-002 | AJ72: =H72+100*O72 -> 138.88499999999999 | AK72: 132.4 | AL72: 74 | AM72: 50.6 | AN72: 178 | AO72: -1.7000000000000001e-002 | AP72: 22 | AQ72: 联诚转债!
A73: 149 | B73: 128123 | C73: 国光转债! | D73: 2749 | E73: 国光股份 | F73: 化工 | G73: 农化 | H73: 104.5 | I73: -1.e-003 | J73: -6.4000000000000003e-003 | K73: 8.78 | L73: -2.6600000000000002e-002 | M73: 115.7 | N73: 13.48 | O73: 0.60399999999999998 | P73: 65.13 | Q73: 转股中 | R73: 4.93年 | S73: 2.94年 | T73: 3.2 | U73: 2.1 | V73: 6.0000000000000001e-003 | W73: 8.4000000000000005e-002 | X73: 5.4000000000000006e-002 | Y73: 38 | Z73: 3.03 | AA73: 2.1299999999999999e-002 | AB73: 1.54e-002 | AC73: -2.7000000000000001e-003 | AD73: -5.0000000000000001e-003 | AE73: 86.35 | AF73: 86.89 | AG73: 0.28 | AH73: AA- | AI73: 6.1100000000000002e-002 | AJ73: =H73+100*O73 -> 164.90000000000001 | AK73: 143.9 | AL73: 184 | AM73: 57 | AN73: 227 | AO73: 8.0000000000000002e-003 | AP73: 13 | AQ73: 国光转债!
A74: 279 | B74: 110058 | C74: 永鼎转债! | D74: 600105 | E74: 永鼎股份 | F74: 通信互联 | G74: 通信设备 | H74: 106.03 | I74: -7.9000000000000008e-003 | J74: 6.5000000000000006e-003 | K74: 3.49 | L74: -5.6999999999999993e-003 | M74: 114.3 | N74: 5.04 | O74: 0.53100000000000003 | P74: 69.25 | Q74: 转股中 | R74: 3.65年 | S74: 1.66年 | T74: 2.61 | U74: 6.5 | V74: 2.4e-002 | W74: 5.4000000000000006e-002 | X74: 3.7999999999999999e-002 | Y74: 48 | Z74: 1.73 | AA74: 2.12e-002 | AB74: 1.3899999999999999e-002 | AC74: -1.7000000000000001e-002 | AD74: -1.9900000000000001e-002 | AE74: 92.35 | AF74: 92.42 | AG74: 0.24 | AH74: AA- | AI74: 6.1100000000000002e-002 | AJ74: =H74+100*O74 -> 159.13 | AK74: 142.8 | AL74: 175 | AM74: 50.4 | AN74: 177 | AO74: -2.1000000000000001e-002 | AP74: 47 | AQ74: 永鼎转债!
A75: 242 | B75: 128083 | C75: 新北转债! | D75: 2376 | E75: 新北洋 | F75: 电子 | G75: 电子产品 | H75: 105.26 | I75: -1.1000000000000001e-003 | J75: 5.9999999999999995e-004 | K75: 8.34 | L75: -2.3999999999999998e-003 | M75: 114.9 | N75: 11.45 | O75: 0.44500000000000001 | P75: 72.84 | Q75: 转股中 | R75: 4.31年 | S75: 2.31年 | T75: 8.77 | U75: 0.4 | V75: 0. | W75: 0.158 | X75: 0.115 | Y75: 56 | Z75: 1.6 | AA75: 2.1000000000000001e-002 | AB75: 1.46e-002 | AC75: -7.1999999999999998e-003 | AD75: -9.8999999999999991e-003 | AE75: 93.9 | AF75: 97.34 | AG75: 0.23 | AH75: AA | AI75: 4.0099999999999997e-002 | AJ75: =H75+100*O75 -> 149.75999999999999 | AK75: 137.7 | AL75: 123 | AM75: 40.3 | AN75: 103 | AO75: -2.7999999999999997e-002 | AP75: 20 | AQ75: 新北转债!
A76: 142 | B76: 113598 | C76: 法兰转债 | D76: 603966 | E76: 法兰泰克 | F76: 机械装备 | G76: 工程机械 | H76: 109.82 | I76: -4.4000000000000003e-003 | J76: -1.e-003 | K76: 7.75 | L76: -1.2699999999999999e-002 | M76: 120.8 | N76: 9.7 | O76: 0.375 | P76: 79.9 | Q76: 转股中 | R76: 4.94年 | S76: 2.95年 | T76: 2.75 | U76: 1.7 | V76: 6.0000000000000001e-003 | W76: 0.11800000000000001 | X76: 9.5000000000000001e-002 | Y76: 23 | Z76: 1.43 | AA76: 1.9900000000000001e-002 | AB76: 1.2500000000000001e-002 | AC76: -1.83e-002 | AD76: -2.06e-002 | AE76: 86.39 | AF76: 90.65 | AG76: 0.42 | AH76: AA- | AI76: 6.1100000000000002e-002 | AJ76: =H76+100*O76 -> 147.31999999999999 | AK76: 139.7 | AL76: 144 | AM76: 49.1 | AN76: 169 | AO76: -0.13200000000000001 | AP76: 13 | AQ76: 法兰转债
A77: 128 | B77: 123065 | C77: 宝莱转债! | D77: 300246 | E77: 宝莱特 | F77: 医药 | G77: 医疗器械 | H77: 110.29 | I77: -5.5000000000000005e-003 | J77: 5.0000000000000001e-003 | K77: 16.08 | L77: -1.29e-002 | M77: 121.4 | N77: 40.14 | O77: 1.75 | P77: 40.06 | Q77: 转股中 | R77: 5年14天 | S77: 3年15天 | T77: 2.19 | U77: 7.1 | V77: 2.8999999999999998e-002 | W77: 9.3000000000000013e-002 | X77: 3.7000000000000005e-002 | Y77: 23 | Z77: 2.64 | AA77: 1.9699999999999999e-002 | AB77: 1.2199999999999999e-002 | AC77: -1.7399999999999999e-002 | AD77: -1.9900000000000001e-002 | AE77: 86.07 | AF77: 90.07 | AG77: 0.03 | AH77: AA- | AI77: 6.2600000000000003e-002 | AJ77: =H77+100*O77 -> 285.29000000000002 | AK77: 180.5 | AL77: 321 | AM77: 90.5 | AN77: 328 | AO77: -4.2999999999999997e-002 | AP77: 18 | AQ77: 宝莱转债!
A78: 27 | B78: 127033 | C78: 中装转2! | D78: 2822 | E78: 中装建设 | F78: 建筑 | G78: 装饰工程 | H78: 105.4 | I78: -8.9999999999999998e-004 | J78: -2.0999999999999999e-003 | K78: 5.05 | L78: -7.9000000000000008e-003 | M78: 117.1 | N78: 6.28 | O78: 0.311 | P78: 80.41 | Q78: 2月3天 | R78: 5.65年 | S78: 3.66年 | T78: 11.6 | U78: 15 | V78: 1.2e-002 | W78: 0.318 | X78: 0.25600000000000001 | Y78: 36 | Z78: 1.08 | AA78: 1.9099999999999999e-002 | AB78: 1.37e-002 | AC78: -4.5000000000000005e-003 | AD78: -6.3e-003 | AE78: 88.78 | AF78: 93.38 | AG78: 0.38 | AH78: AA | AI78: 4.1599999999999998e-002 | AJ78: =H78+100*O78 -> 136.5 | AK78: 130.4 | AL78: 47 | AM78: 37 | AN78: 68 | AO78: -2.5000000000000001e-002 | AP78: 25 | AQ78: 中装转2!
A79: 175 | B79: 128114 | C79: 正邦转债! | D79: 2157 | E79: 正邦科技 | F79: 农业 | G79: 畜牧业 | H79: 105.101 | I79: -2.5000000000000001e-003 | J79: 5.5000000000000005e-003 | K79: 9.37 | L79: 2.18e-002 | M79: 114.9 | N79: 14.76 | O79: 0.65599999999999992 | P79: 63.48 | Q79: 转股中 | R79: 4.82年 | S79: 2.83年 | T79: 16 | U79: 12 | V79: 6.9999999999999993e-003 | W79: 5.4000000000000006e-002 | X79: 3.4000000000000002e-002 | Y79: 295 | Z79: 1.26 | AA79: 1.9e-002 | AB79: 1.3300000000000001e-002 | AC79: -5.5000000000000005e-003 | AD79: -7.7000000000000002e-003 | AE79: 93.34 | AF79: 97.59 | AG79: 0.14 | AH79: AA+ | AI79: 3.5099999999999999e-002 | AJ79: =H79+100*O79 -> 170.70099999999999 | AK79: 146.7 | AL79: 208 | AM79: 49.1 | AN79: 170 | AO79: -3.7000000000000005e-002 | AP79: 17 | AQ79: 正邦转债!
A80: 79 | B80: 113044 | C80: 大秦转债! | D80: 601006 | E80: 大秦铁路 | F80: 铁路 | G80: 铁路运输 | H80: 103.55 | I80: 5.0000000000000001e-004 | J80: -1.1000000000000001e-003 | K80: 5.95 | L80: -1.7000000000000001e-003 | M80: 114.1 | N80: 7.18 | O80: 0.25 | P80: 82.87 | Q80: 转股中 | R80: 5.32年 | S80: 3.32年 | T80: 320 | U80: 364 | V80: 1.1000000000000001e-002 | W80: 0.36200000000000004 | X80: 0.29999999999999999 | Y80: 885 | Z80: 0.73 | AA80: 1.8799999999999997e-002 | AB80: 1.3899999999999999e-002 | AC80: 1.1000000000000001e-003 | AD80: -1.1000000000000001e-003 | AE80: 92.41 | AF80: 95.58 | AG80: 0.37 | AH80: AAA | AI80: 3.4599999999999999e-002 | AJ80: =H80+100*O80 -> 128.55000000000001 | AK80: 124.2 | AL80: 16 | AM80: 28.6 | AN80: 23 | AO80: 6.9999999999999993e-003 | AP80: 17 | AQ80: 大秦转债!
A81: 330 | B81: 123010 | C81: 博世转债! | D81: 300422 | E81: 博世科 | F81: 城市公用 | G81: 三废处理 | H81: 105.601 | I81: -1.e-004 | J81: 3.0999999999999999e-003 | K81: 9.12 | L81: 1.2199999999999999e-002 | M81: 111.3 | N81: 12.15 | O81: 0.40700000000000003 | P81: 75.06 | Q81: 转股中 | R81: 2.87年 | S81: 0.88年 | T81: 4.3 | U81: 1.7 | V81: 4.0000000000000001e-003 | W81: 0.11599999999999999 | X81: 8.6999999999999994e-002 | Y81: 37 | Z81: 1.52 | AA81: 1.8700000000000001e-002 | AB81: 1.1399999999999999e-002 | AC81: -3.4700000000000002e-002 | AD81: -3.7999999999999999e-002 | AE81: 95.85 | AF81: 94.46 | AG81: 0.25 | AH81: AA- | AI81: 5.9699999999999996e-002 | AJ81: =H81+100*O81 -> 146.30099999999999 | AK81: 136.1 | AL81: 113 | AM81: 40.3 | AN81: 102 | AO81: 3.2000000000000001e-002 | AP81: 30 | AQ81: 博世转债!
A82: 294 | B82: 123023 | C82: 迪森转债! | D82: 300335 | E82: 迪森股份 | F82: 能源电力 | G82: 电力供应 | H82: 107.2 | I82: -1.32e-002 | J82: 1.2999999999999999e-003 | K82: 5.78 | L82: -2.86e-002 | M82: 114.3 | N82: 6.89 | O82: 0.27800000000000002 | P82: 83.89 | Q82: 转股中 | R82: 3.58年 | S82: 2.58年 | T82: 5.29 | U82: 12 | V82: 2.2000000000000002e-002 | W82: 0.24600000000000002 | X82: 0.20600000000000002 | Y82: 22 | Z82: 1.55 | AA82: 1.84e-002 | AB82: 1.11e-002 | AC82: -8.8999999999999999e-003 | AD82: -1.21e-002 | AE82: 89.11 | AF82: 92.83 | AG82: 0.42 | AH82: AA- | AI82: 6.1100000000000002e-002 | AJ82: =H82+100*O82 -> 135. | AK82: 130.5 | AL82: 49 | AM82: 37.7 | AN82: 79 | AO82: 1.4999999999999999e-002 | AP82: 52 | AQ82: 迪森转债!
A83: 204 | B83: 113033 | C83: 利群转债! | D83: 601366 | E83: 利群股份 | F83: 商业零售 | G83: 商场 | H83: 105.83 | I83: -1.5e-003 | J83: 1.e-004 | K83: 6.4 | L83: -3.0999999999999999e-003 | M83: 114.9 | N83: 7.01 | O83: 0.159 | P83: 91.3 | Q83: 转股中 | R83: 4.61年 | S83: 2.62年 | T83: 18 | U83: 16 | V83: 8.0000000000000002e-003 | W83: 0.32700000000000001 | X83: 0.29799999999999999 | Y83: 55 | Z83: 1.19 | AA83: 1.83e-002 | AB83: 1.24e-002 | AC83: -8.3999999999999995e-003 | AD83: -1.0700000000000001e-002 | AE83: 92.79 | AF83: 96.19 | AG83: 0.46 | AH83: AA | AI83: 4.0099999999999997e-002 | AJ83: =H83+100*O83 -> 121.73 | AK83: 120.4 | AL83: 7 | AM83: 24.2 | AN83: 6 | AO83: 2.e-003 | AP83: 64 | AQ83: 利群转债!
A84: 140 | B84: 127021 | C84: 特发转2! | D84: 70 | E84: 特发信息 | F84: 通信互联 | G84: 通信设备 | H84: 105.3 | I84: -3.3e-003 | J84: 2.3999999999999998e-003 | K84: 7.19 | L84: -1.1000000000000001e-002 | M84: 113 | N84: 12.33 | O84: 0.80599999999999994 | P84: 58.31 | Q84: 转股中 | R84: 3.96年 | S84: 1.97年 | T84: 5.5 | U84: 2.9 | V84: 5.0000000000000001e-003 | W84: 9.3000000000000013e-002 | X84: 5.4000000000000006e-002 | Y84: 59 | Z84: 2.02 | AA84: 1.8200000000000001e-002 | AB84: 1.21e-002 | AC84: -1.6e-002 | AD84: -1.7600000000000001e-002 | AE84: 93.6 | AF84: 96.87 | AG84: 0.08 | AH84: AA | AI84: 4.0099999999999997e-002 | AJ84: =H84+100*O84 -> 185.89999999999998 | AK84: 152.3 | AL84: 247 | AM84: 55.4 | AN84: 212 | AO84: -2.4e-002 | AP84: 13 | AQ84: 特发转2!
A85: 111 | B85: 123073 | C85: 同和转债! | D85: 300636 | E85: 同和药业 | F85: 医药 | G85: 原料药 | H85: 111.73 | I85: -1.0200000000000001e-002 | J85: -2.3999999999999998e-003 | K85: 12.28 | L85: -2.3799999999999998e-002 | M85: 122.4 | N85: 14.82 | O85: 0.34799999999999998 | P85: 82.86 | Q85: 转股中 | R85: 5.18年 | S85: 3.19年 | T85: 3.59 | U85: 2.7 | V85: 6.9999999999999993e-003 | W85: 0.14199999999999999 | X85: 0.11800000000000001 | Y85: 25 | Z85: 3.17 | AA85: 1.8200000000000001e-002 | AB85: 1.0700000000000001e-002 | AC85: -1.9799999999999998e-002 | AD85: -2.2400000000000003e-002 | AE85: 82.71 | AF85: 85.51 | AG85: 0.53 | AH85: A+ | AI85: 7.3599999999999999e-002 | AJ85: =H85+100*O85 -> 146.53 | AK85: 140.6 | AL85: 152 | AM85: 55.1 | AN85: 210 | AO85: -0.13400000000000001 | AP85: 11 | AQ85: 同和转债!
A86: 223 | B86: 113565 | C86: 宏辉转债 | D86: 603336 | E86: 宏辉果蔬 | F86: 农业 | G86: 农产品加 | H86: 108.9 | I86: -9.300000000000001e-003 | J86: -1.e-004 | K86: 6.62 | L86: -1.9299999999999998e-002 | M86: 117.8 | N86: 7.64 | O86: 0.25700000000000001 | P86: 86.65 | Q86: 转股中 | R86: 4.52年 | S86: 2.52年 | T86: 2.25 | U86: 7.1 | V86: 2.8999999999999998e-002 | W86: 7.8e-002 | X86: 6.7000000000000004e-002 | Y86: 29 | Z86: 2.14 | AA86: 1.7899999999999999e-002 | AB86: 1.0800000000000001e-002 | AC86: -1.8200000000000001e-002 | AD86: -2.0799999999999999e-002 | AE86: 88.6 | AF86: 90.67 | AG86: 0.49 | AH86: AA- | AI86: 6.1100000000000002e-002 | AJ86: =H86+100*O86 -> 134.59999999999999 | AK86: 131.2 | AL86: 54 | AM86: 40.5 | AN86: 105 | AO86: -2.7000000000000003e-002 | AP86: 26 | AQ86: 宏辉转债
A87: 121 | B87: 113604 | C87: 多伦转债! | D87: 603528 | E87: 多伦科技 | F87: 计算机及 | G87: 软件开发 | H87: 107.29 | I87: 2.9999999999999997e-004 | J87: -8.0000000000000004e-004 | K87: 8.14 | L87: -1.1999999999999999e-003 | M87: 117.3 | N87: 10.4 | O87: 0.371 | P87: 78.27 | Q87: 转股中 | R87: 5年53天 | S87: 3年54天 | T87: 6.4 | U87: 9.4 | V87: 1.3999999999999999e-002 | W87: 0.125 | X87: 9.8000000000000004e-002 | Y87: 51 | Z87: 3.07 | AA87: 1.7899999999999999e-002 | AB87: 1.18e-002 | AC87: -1.e-002 | AD87: -1.2199999999999999e-002 | AE87: 85.08 | AF87: 86.41 | AG87: 0.45 | AH87: AA- | AI87: 6.2600000000000003e-002 | AJ87: =H87+100*O87 -> 144.39000000000001 | AK87: 136.3 | AL87: 117 | AM87: 49.9 | AN87: 173 | AO87: 1.2e-002 | AP87: 7 | AQ87: 多伦转债!
A88: 201 | B88: 128105 | C88: 长集转债! | D88: 2616 | E88: 长青集团 | F88: 城市公用 | G88: 三废处理 | H88: 106.094 | I88: -1.4000000000000002e-003 | J88: 3.0999999999999999e-003 | K88: 6.4 | L88: 4.6999999999999993e-003 | M88: 114.9 | N88: 7.91 | O88: 0.311 | P88: 80.91 | Q88: 转股中 | R88: 4.63年 | S88: 2.64年 | T88: 8 | U88: 5.7 | V88: 6.9999999999999993e-003 | W88: 0.16800000000000001 | X88: 0.13600000000000001 | Y88: 47 | Z88: 1.78 | AA88: 1.77e-002 | AB88: 1.18e-002 | AC88: -9.1999999999999998e-003 | AD88: -1.15e-002 | AE88: 92.71 | AF88: 96.11 | AG88: 0.35 | AH88: AA | AI88: 4.0099999999999997e-002 | AJ88: =H88+100*O88 -> 137.19399999999999 | AK88: 131.3 | AL88: 57 | AM88: 35.2 | AN88: 54 | AO88: 2.e-003 | AP88: 17 | AQ88: 长集转债!
A89: 161 | B89: 123059 | C89: 银信转债! | D89: 300231 | E89: 银信科技 | F89: 计算机及 | G89: 软件开发 | H89: 113.873 | I89: 2.1299999999999999e-002 | J89: 1.1899999999999999e-002 | K89: 8.98 | L89: 6.4000000000000001e-002 | M89: 123.7 | N89: 9.72 | O89: 0.23300000000000001 | P89: 92.39 | Q89: 转股中 | R89: 4.90年 | S89: 2.90年 | T89: 3.91 | U89: 51 | V89: 0.114 | W89: 9.9000000000000005e-002 | X89: 9.0999999999999998e-002 | Y89: 40 | Z89: 2.91 | AA89: 1.7399999999999999e-002 | AB89: 9.1000000000000004e-003 | AC89: -3.0499999999999999e-002 | AD89: -3.27e-002 | AE89: 86.52 | AF89: 93.04 | AG89: 0.52 | AH89: AA- | AI89: 6.1100000000000002e-002 | AJ89: =H89+100*O89 -> 137.173 | AK89: 135.4 | AL89: 103 | AM89: 42.3 | AN89: 125 | AO89: 7.0000000000000007e-002 | AP89: 18 | AQ89: 银信转债!
A90: 106 | B90: 110076 | C90: 华海转债! | D90: 600521 | E90: 华海药业 | F90: 医药 | G90: 医药行业 | H90: 105.57 | I90: -3.9000000000000003e-003 | J90: 1.9e-003 | K90: 17.53 | L90: -2.5600000000000001e-002 | M90: 115.1 | N90: 33.85 | O90: 1.04 | P90: 51.79 | Q90: 转股中 | R90: 5.20年 | S90: 3.20年 | T90: 18.4 | U90: 7.1 | V90: 4.0000000000000001e-003 | W90: 7.0000000000000007e-002 | X90: 3.6000000000000004e-002 | Y90: 262 | Z90: 3.91 | AA90: 1.7100000000000001e-002 | AB90: 1.18e-002 | AC90: -5.6000000000000008e-003 | AD90: -7.7000000000000002e-003 | AE90: 90.43 | AF90: 93.5 | AG90: 0.08 | AH90: AA | AI90: 4.1599999999999998e-002 | AJ90: =H90+100*O90 -> 209.56999999999999 | AK90: 159.4 | AL90: 282 | AM90: 65.9 | AN90: 272 | AO90: -7.5999999999999998e-002 | AP90: 8 | AQ90: 华海转债!
A91: 214 | B91: 123044 | C91: 红相转债!! | D91: 300427 | E91: 红相股份 | F91: 能源电力 | G91: 电力设备 | H91: 116.15 | I91: 2.1400000000000002e-002 | J91: -2.0299999999999999e-002 | K91: 16.43 | L91: 2.3999999999999998e-003 | M91: 125 | N91: 18.67 | O91: 0.32000000000000001 | P91: 88 | Q91: 转股中 | R91: 4.56年 | S91: 2.56年 | T91: 5.5 | U91: 294 | V91: 0.46200000000000002 | W91: 9.3000000000000013e-002 | X91: 8.199999999999999e-002 | Y91: 59 | Z91: 2.52 | AA91: 1.67e-002 | AB91: 7.3000000000000001e-003 | AC91: -3.8399999999999997e-002 | AD91: -4.1399999999999999e-002 | AE91: 89.09 | AF91: 96.07 | AG91: 0.45 | AH91: AA- | AI91: 6.1100000000000002e-002 | AJ91: =H91+100*O91 -> 148.15000000000001 | AK91: 144.3 | AL91: 189 | AM91: 48.2 | AN91: 161 | AO91: 0.16800000000000001 | AP91: 21 | AQ91: 红相转债!!
A92: 28 | B92: 110080 | C92: 东湖转债 | D92: 600133 | E92: 东湖高新 | F92: 建筑 | G92: 建筑工程 | H92: 105.53 | I92: -1.e-002 | J92: 5.4000000000000003e-003 | K92: 5.51 | L92: -9.0000000000000011e-003 | M92: 115.1 | N92: 6.05 | O92: 0.159 | P92: 91.07 | Q92: 57天 | R92: 5.64年 | S92: 3.65年 | T92: 15.5 | U92: 22 | V92: 1.3000000000000001e-002 | W92: 0.35399999999999998 | X92: 0.32200000000000001 | Y92: 44 | Z92: 0.81 | AA92: 1.5800000000000002e-002 | AB92: 1.09e-002 | AC92: -4.8999999999999998e-003 | AD92: -6.7000000000000002e-003 | AE92: 88.82 | AF92: 91.84 | AG92: 0.52 | AH92: AA | AI92: 4.1599999999999998e-002 | AJ92: =H92+100*O92 -> 121.43000000000001 | AK92: 120 | AL92: 6 | AM92: 28.1 | AN92: 21 | AO92: -3.7000000000000005e-002 | AP92: 24 | AQ92: 东湖转债
A93: 337 | B93: 128037 | C93: 岩土转债! | D93: 2542 | E93: 中化岩土 | F93: 建筑 | G93: 建筑工程 | H93: 107.03 | I93: -1.1299999999999999e-002 | J93: 5.6999999999999993e-003 | K93: 2.75 | L93: -1.7899999999999999e-002 | M93: 111.3 | N93: 3.1 | O93: 0.20699999999999999 | P93: 88.71 | Q93: 转股中 | R93: 2.57年 | S93: 0.57年 | T93: 5.99 | U93: 12 | V93: 1.8000000000000002e-002 | W93: 0.121 | X93: 0.107 | Y93: 50 | Z93: 1.25 | AA93: 1.5600000000000001e-002 | AB93: 7.4000000000000003e-003 | AC93: -6.6199999999999995e-002 | AD93: -7.0699999999999999e-002 | AE93: 99.01 | AF93: 101.13 | AG93: 0.31 | AH93: AA | AI93: 3.8699999999999998e-002 | AJ93: =H93+100*O93 -> 127.73 | AK93: 125.4 | AL93: 20 | AM93: 24.2 | AN93: 7 | AO93: -6.0000000000000001e-003 | AP93: 52 | AQ93: 岩土转债!
A94: 267 | B94: 128071 | C94: 合兴转债! | D94: 2228 | E94: 合兴包装 | F94: 造纸包装 | G94: 包装材料 | H94: 107.6 | I94: -7.000000000000001e-004 | J94: -2.9999999999999997e-004 | K94: 3.4 | L94: -2.8999999999999998e-003 | M94: 114.3 | N94: 4.18 | O94: 0.32299999999999995 | P94: 81.34 | Q94: 转股中 | R94: 3.99年 | S94: 1.99年 | T94: 3 | U94: 1.4 | V94: 4.0000000000000001e-003 | W94: 7.0999999999999994e-002 | X94: 5.7999999999999996e-002 | Y94: 42 | Z94: 1.21 | AA94: 1.55e-002 | AB94: 9.0000000000000011e-003 | AC94: -2.1099999999999997e-002 | AD94: -2.35e-002 | AE94: 94.5 | AF94: 97.98 | AG94: 0.32 | AH94: AA | AI94: 4.0099999999999997e-002 | AJ94: =H94+100*O94 -> 139.89999999999998 | AK94: 133.9 | AL94: 89 | AM94: 35.9 | AN94: 60 | AO94: -1.4999999999999999e-002 | AP94: 25 | AQ94: 合兴转债!
A95: 64 | B95: 123093 | C95: 金陵转债! | D95: 300651 | E95: 金陵体育 | F95: 其他 | G95: 文化教育 | H95: 119.3 | I95: -5.1000000000000004e-003 | J95: -1.52e-002 | K95: 29.46 | L95: -8.1699999999999995e-002 | M95: 129.3 | N95: 49.19 | O95: 0.99199999999999999 | P95: 59.89 | Q95: 转股中 | R95: 5.42年 | S95: 3.42年 | T95: 2.5 | U95: 36 | V95: 0.12 | W95: 6.6000000000000003e-002 | X95: 3.9e-002 | Y95: 38 | Z95: 5.5 | AA95: 1.54e-002 | AB95: 6.5000000000000006e-003 | AC95: -3.1899999999999998e-002 | AD95: -3.5099999999999999e-002 | AE95: 82.8 | AF95: 89.07 | AG95: 0.25 | AH95: A+ | AI95: 7.3599999999999999e-002 | AJ95: =H95+100*O95 -> 218.5 | AK95: 178.7 | AL95: 319 | AM95: 89.6 | AN95: 327 | AO95: -0.20600000000000002 | AP95: 7 | AQ95: 金陵转债!
A96: 220 | B96: 113567 | C96: 君禾转债! | D96: 603617 | E96: 君禾股份 | F96: 机械装备 | G96: 通用设备 | H96: 111.14 | I96: -6.8000000000000005e-003 | J96: 3.4000000000000002e-003 | K96: 10.48 | L96: -5.6999999999999993e-003 | M96: 118.8 | N96: 11.16 | O96: 0.184 | P96: 93.91 | Q96: 转股中 | R96: 4.54年 | S96: 2.54年 | T96: 2.1 | U96: 2.5 | V96: 1.1000000000000001e-002 | W96: 0.10000000000000001 | X96: 9.4e-002 | Y96: 21 | Z96: 3.08 | AA96: 1.52e-002 | AB96: 7.8000000000000005e-003 | AC96: -2.46e-002 | AD96: -2.7400000000000001e-002 | AE96: 86.33 | AF96: 87.3 | AG96: 0.6 | AH96: A+ | AI96: 7.2099999999999997e-002 | AJ96: =H96+100*O96 -> 129.53999999999999 | AK96: 128.4 | AL96: 36 | AM96: 41.1 | AN96: 111 | AO96: 2.1000000000000001e-002 | AP96: 34 | AQ96: 君禾转债!
A97: 146 | B97: 128124 | C97: 科华转债! | D97: 2022 | E97: 科华生物 | F97: 医药 | G97: 生物制药 | H97: 102.29 | I97: -1.e-004 | J97: -3.4999999999999996e-003 | K97: 13.15 | L97: -2.1600000000000001e-002 | M97: 110 | N97: 21.3 | O97: 0.65700000000000003 | P97: 61.74 | Q97: 转股中 | R97: 4.94年 | S97: 2.94年 | T97: 7.38 | U97: 4.2 | V97: 6.0000000000000001e-003 | W97: 0.109 | X97: 6.7000000000000004e-002 | Y97: 68 | Z97: 2.03 | AA97: 1.5100000000000001e-002 | AB97: 1.1200000000000002e-002 | AC97: 1.5e-003 | AD97: -2.9999999999999997e-004 | AE97: 91.02 | AF97: 90.88 | AG97: 0.16 | AH97: AA | AI97: 4.0099999999999997e-002 | AJ97: =H97+100*O97 -> 167.99000000000001 | AK97: 142.8 | AL97: 177 | AM97: 51.8 | AN97: 189 | AO97: -5.9999999999999998e-002 | AP97: 22 | AQ97: 科华转债!
A98: 277 | B98: 113535 | C98: 大业转债! | D98: 603278 | E98: 大业股份 | F98: 汽车 | G98: 零部件制 | H98: 108.13 | I98: -2.1400000000000002e-002 | J98: 1.1200000000000002e-002 | K98: 9.38 | L98: -5.6299999999999996e-002 | M98: 112.5 | N98: 12.29 | O98: 0.41700000000000004 | P98: 76.32 | Q98: 转股中 | R98: 2.72年 | S98: 0.72年 | T98: 5 | U98: 20 | V98: 3.6000000000000004e-002 | W98: 0.184 | X98: 0.14000000000000001 | Y98: 27 | Z98: 1.55 | AA98: 1.49e-002 | AB98: 6.4000000000000003e-003 | AC98: -7.1800000000000003e-002 | AD98: -7.4299999999999991e-002 | AE98: 97.91 | AF98: 101.59 | AG98: 0.18 | AH98: AA | AI98: 3.8699999999999998e-002 | AJ98: =H98+100*O98 -> 149.82999999999998 | AK98: 139.9 | AL98: 146 | AM98: 38.3 | AN98: 85 | AO98: -1.8000000000000002e-002 | AP98: 49 | AQ98: 大业转债!
A99: 207 | B99: 110068 | C99: 龙净转债! | D99: 600388 | E99: 龙净环保 | F99: 城市公用 | G99: 三废处理 | H99: 107.88 | I99: 4.5000000000000005e-003 | J99: -1.6000000000000001e-003 | K99: 8.92 | L99: 7.9000000000000008e-003 | M99: 114.8 | N99: 10.55 | O99: 0.27600000000000002 | P99: 84.55 | Q99: 转股中 | R99: 4.59年 | S99: 2.59年 | T99: 20 | U99: 4.1 | V99: 2.e-003 | W99: 0.20999999999999999 | X99: 0.17699999999999999 | Y99: 95 | Z99: 1.57 | AA99: 1.3899999999999999e-002 | AB99: 8.0000000000000002e-003 | AC99: -1.5700000000000002e-002 | AD99: -1.8000000000000002e-002 | AE99: 94 | AF99: 98.28 | AG99: 0.36 | AH99: AA+ | AI99: 3.5099999999999999e-002 | AJ99: =H99+100*O99 -> 135.47999999999999 | AK99: 131.2 | AL99: 56 | AM99: 32.9 | AN99: 44 | AO99: 3.5000000000000003e-002 | AP99: 34 | AQ99: 龙净转债!
A100: 63 | B100: 113619 | C100: 世运转债! | D100: 603920 | E100: 世运电路 | F100: 电子 | G100: 元器件制 | H100: 107.17 | I100: 3.8e-003 | J100: -1.2999999999999999e-003 | K100: 12.73 | L100: 1.2699999999999999e-002 | M100: 115.2 | N100: 19.92 | O100: 0.67700000000000005 | P100: 63.91 | Q100: 转股中 | R100: 5.42年 | S100: 3.42年 | T100: 10 | U100: 25 | V100: 2.4e-002 | W100: 0.14800000000000002 | X100: 9.4e-002 | Y100: 68 | Z100: 1.91 | AA100: 1.37e-002 | AB100: 8.6e-003 | AC100: -9.1999999999999998e-003 | AD100: -1.1200000000000002e-002 | AE100: 89.73 | AF100: 92.78 | AG100: 0.2 | AH100: AA | AI100: 4.1599999999999998e-002 | AJ100: =H100+100*O100 -> 174.87 | AK100: 150.4 | AL100: 231 | AM100: 57.7 | AN100: 235 | AO100: -6.5000000000000002e-002 | AP100: 5 | AQ100: 世运转债!
A101: 227 | B101: 113563 | C101: 柳药转债! | D101: 603368 | E101: 柳药股份 | F101: 医药 | G101: 医药商业 | H101: 106.5 | I101: -8.9999999999999998e-004 | J101: -9.0000000000000011e-003 | K101: 16.92 | L101: -4.5100000000000001e-002 | M101: 112.9 | N101: 23.87 | O101: 0.502 | P101: 70.88 | Q101: 转股中 | R101: 4.41年 | S101: 2.41年 | T101: 8.02 | U101: 13 | V101: 1.4999999999999999e-002 | W101: 0.13100000000000001 | X101: 9.3000000000000013e-002 | Y101: 61 | Z101: 1.21 | AA101: 1.3600000000000001e-002 | AB101: 8.199999999999999e-003 | AC101: -1.15e-002 | AD101: -1.41e-002 | AE101: 93.54 | AF101: 95.29 | AG101: 0.22 | AH101: AA | AI101: 4.0099999999999997e-002 | AJ101: =H101+100*O101 -> 156.69999999999999 | AK101: 142.1 | AL101: 168 | AM101: 46.8 | AN101: 151 | AO101: -0.14800000000000002 | AP101: 16 | AQ101: 柳药转债!
A102: 174 | B102: 113588 | C102: 润达转债! | D102: 603108 | E102: 润达医疗 | F102: 医药 | G102: 医疗器械 | H102: 107.1 | I102: -1.0500000000000001e-002 | J102: 7.3000000000000001e-003 | K102: 9.93 | L102: -1.1000000000000001e-002 | M102: 113.9 | N102: 13.25 | O102: 0.42899999999999999 | P102: 74.94 | Q102: 转股中 | R102: 4.82年 | S102: 2.83年 | T102: 5.5 | U102: 11 | V102: 1.8000000000000002e-002 | W102: 9.6000000000000002e-002 | X102: 7.2000000000000008e-002 | Y102: 58 | Z102: 1.81 | AA102: 1.3100000000000001e-002 | AB102: 7.8000000000000005e-003 | AC102: -1.18e-002 | AD102: -1.3899999999999999e-002 | AE102: 92.02 | AF102: 94.57 | AG102: 0.29 | AH102: AA | AI102: 4.0099999999999997e-002 | AJ102: =H102+100*O102 -> 150. | AK102: 139.3 | AL102: 137 | AM102: 44.7 | AN102: 141 | AO102: -3.9e-002 | AP102: 11 | AQ102: 润达转债!
A103: 353 | B103: 128023 | C103: 亚太转债! | D103: 2284 | E103: 亚太股份 | F103: 汽车 | G103: 零部件制 | H103: 108.143 | I103: 8.9999999999999998e-004 | J103: -3.4000000000000002e-003 | K103: 7.55 | L103: -2.0799999999999999e-002 | M103: 111.3 | N103: 10.34 | O103: 0.48100000000000004 | P103: 73.02 | Q103: 转股中 | R103: 2.29年 | S103: 0.29年 | T103: 9.99 | U103: 8.6 | V103: 8.0000000000000002e-003 | W103: 0.17899999999999999 | X103: 0.13100000000000001 | Y103: 56 | Z103: 2.24 | AA103: 1.29e-002 | AB103: 3.7000000000000002e-003 | AC103: -0.13800000000000001 | AD103: -0.14599999999999999 | AE103: 100.06 | AF103: 102.2 | AG103: 0.12 | AH103: AA | AI103: 3.8699999999999998e-002 | AJ103: =H103+100*O103 -> 156.24299999999999 | AK103: 143.3 | AL103: 180 | AM103: 41.1 | AN103: 110 | AO103: -3.2000000000000001e-002 | AP103: 66 | AQ103: 亚太转债!
A104: 340 | B104: 113505 | C104: 杭电转债! | D104: 603618 | E104: 杭电股份 | F104: 能源电力 | G104: 电力设备 | H104: 107.91 | I104: -7.000000000000001e-004 | J104: 4.7999999999999996e-003 | K104: 6.26 | L104: 1.29e-002 | M104: 111.3 | N104: 7.08 | O104: 0.22 | P104: 88.42 | Q104: 转股中 | R104: 2.54年 | S104: 0.54年 | T104: 7.5 | U104: 9.9 | V104: 1.2e-002 | W104: 0.17300000000000001 | X104: 0.153 | Y104: 43 | Z104: 1.6 | AA104: 1.2500000000000001e-002 | AB104: 4.1999999999999997e-003 | AC104: -7.9199999999999993e-002 | AD104: -8.3699999999999997e-002 | AE104: 99.1 | AF104: 101.23 | AG104: 0.31 | AH104: AA | AI104: 3.8699999999999998e-002 | AJ104: =H104+100*O104 -> 129.91 | AK104: 127.4 | AL104: 30 | AM104: 26.2 | AN104: 11 | AO104: 5.5e-002 | AP104: 44 | AQ104: 杭电转债!
A105: 232 | B105: 113561 | C105: 正裕转债! | D105: 603089 | E105: 正裕工业 | F105: 汽车 | G105: 零部件制 | H105: 111.95 | I105: -1.46e-002 | J105: 3.7000000000000002e-003 | K105: 9.15 | L105: -1.9299999999999998e-002 | M105: 118 | N105: 10.08 | O105: 0.23300000000000001 | P105: 90.77 | Q105: 转股中 | R105: 4.36年 | S105: 2.37年 | T105: 1.5 | U105: 6.2 | V105: 3.7000000000000005e-002 | W105: 7.400000000000001e-002 | X105: 6.7000000000000004e-002 | Y105: 20 | Z105: 1.91 | AA105: 1.24e-002 | AB105: 5.1000000000000004e-003 | AC105: -2.8399999999999998e-002 | AD105: -3.15e-002 | AE105: 87.55 | AF105: 87.79 | AG105: 0.57 | AH105: A+ | AI105: 7.2099999999999997e-002 | AJ105: =H105+100*O105 -> 135.25 | AK105: 133.1 | AL105: 81 | AM105: 45.3 | AN105: 144 | AO105: 1.9e-002 | AP105: 36 | AQ105: 正裕转债!
A106: 89 | B106: 123082 | C106: 北陆转债! | D106: 300016 | E106: 北陆药业 | F106: 医药 | G106: 化学制药 | H106: 114.262 | I106: 1.4000000000000002e-003 | J106: -4.4000000000000003e-003 | K106: 8.91 | L106: -4.5000000000000005e-003 | M106: 121.7 | N106: 8.81 | O106: 0.13 | P106: 101.14 | Q106: 转股中 | R106: 5.30年 | S106: 3.30年 | T106: 5 | U106: 21 | V106: 3.6000000000000004e-002 | W106: 0.114 | X106: 0.115 | Y106: 44 | Z106: 2.65 | AA106: 1.23e-002 | AB106: 5.1999999999999998e-003 | AC106: -2.5399999999999999e-002 | AD106: -2.7900000000000001e-002 | AE106: 82.07 | AF106: 84.35 | AG106: 0.67 | AH106: A+ | AI106: 7.3599999999999999e-002 | AJ106: =H106+100*O106 -> 127.262 | AK106: 127.4 | AL106: 29 | AM106: 43 | AN106: 133 | AO106: 2.7999999999999997e-002 | AP106: 14 | AQ106: 北陆转债!
A107: 101 | B107: 113608 | C107: 威派转债! | D107: 603956 | E107: 威派格 | F107: 机械装备 | G107: 专用设备 | H107: 114.3 | I107: -4.8999999999999998e-003 | J107: 7.3000000000000001e-003 | K107: 16.79 | L107: 4.1999999999999997e-003 | M107: 121.6 | N107: 19.08 | O107: 0.29899999999999999 | P107: 88 | Q107: 转股中 | R107: 5.22年 | S107: 3.22年 | T107: 4.2 | U107: 6.3 | V107: 1.3000000000000001e-002 | W107: 5.9000000000000004e-002 | X107: 5.2000000000000005e-002 | Y107: 72 | Z107: 6.18 | AA107: 1.2199999999999999e-002 | AB107: 5.0000000000000001e-003 | AC107: -2.6099999999999998e-002 | AD107: -2.86e-002 | AE107: 82.51 | AF107: 84.74 | AG107: 0.58 | AH107: A+ | AI107: 7.3599999999999999e-002 | AJ107: =H107+100*O107 -> 144.19999999999999 | AK107: 140.6 | AL107: 153 | AM107: 55.9 | AN107: 217 | AO107: 3.1e-002 | AP107: 7 | AQ107: 威派转债!
A108: 264 | B108: 128073 | C108: 哈尔转债! | D108: 2615 | E108: 哈尔斯 | F108: 其他 | G108: 家居用品 | H108: 111.3 | I108: -6.9999999999999993e-003 | J108: 2.9999999999999997e-004 | K108: 4.9 | L108: -1.8000000000000002e-002 | M108: 115.3 | N108: 5.71 | O108: 0.29699999999999999 | P108: 85.81 | Q108: 转股中 | R108: 3年1.5天 | S108: 1年2.5天 | T108: 2.99 | U108: 12 | V108: 3.6000000000000004e-002 | W108: 0.14800000000000002 | X108: 0.127 | Y108: 20 | Z108: 2.58 | AA108: 1.2e-002 | AB108: 2.8000000000000004e-003 | AC108: -7.2000000000000008e-002 | AD108: -7.4999999999999997e-002 | AE108: 95.26 | AF108: 96.79 | AG108: 0.37 | AH108: AA- | AI108: 6.1100000000000002e-002 | AJ108: =H108+100*O108 -> 141. | AK108: 136.8 | AL108: 119 | AM108: 40 | AN108: 99 | AO108: 2.8999999999999998e-002 | AP108: 39 | AQ108: 哈尔转债!
A109: 259 | B109: 128076 | C109: 金轮转债! | D109: 2722 | E109: 金轮股份 | F109: 机械装备 | G109: 专用设备 | H109: 109.598 | I109: -1.3999999999999999e-002 | J109: 7.8000000000000005e-003 | K109: 13.01 | L109: -1.21e-002 | M109: 114.9 | N109: 14.66 | O109: 0.23499999999999999 | P109: 88.74 | Q109: 转股中 | R109: 4年54天 | S109: 2年55天 | T109: 2.14 | U109: 8 | V109: 3.4000000000000002e-002 | W109: 9.4e-002 | X109: 8.3000000000000004e-002 | Y109: 23 | Z109: 1.21 | AA109: 1.1699999999999999e-002 | AB109: 5.1999999999999998e-003 | AC109: -2.5099999999999997e-002 | AD109: -2.7799999999999998e-002 | AE109: 90.27 | AF109: 90.34 | AG109: 0.51 | AH109: AA- | AI109: 6.1100000000000002e-002 | AJ109: =H109+100*O109 -> 133.09800000000001 | AK109: 130.5 | AL109: 48 | AM109: 40.1 | AN109: 100 | AO109: 5.2000000000000005e-002 | AP109: 40 | AQ109: 金轮转债!
A110: 6 | B110: 123118 | C110: 惠城转债 | D110: 300779 | E110: 惠城环保 | F110: 化工 | G110: 其他 | H110: 113.825 | I110: -1.46e-002 | J110: 7.8000000000000005e-003 | K110: 17.09 | L110: -9.7999999999999997e-003 | M110: 121.7 | N110: 17.11 | O110: 0.14000000000000001 | P110: 99.88 | Q110: 4月26天 | R110: 5.88年 | S110: 3.88年 | T110: 3.2 | U110: 9.9 | V110: 2.7000000000000003e-002 | W110: 0.187 | X110: 0.187 | Y110: 17 | Z110: 2.55 | AA110: 1.1699999999999999e-002 | AB110: 5.3e-003 | AC110: -2.0799999999999999e-002 | AD110: -2.3e-002 | AE110: 78.76 | AF110: 80.94 | AG110: 0.69 | AH110: A+ | AI110: 7.3599999999999999e-002 | AJ110: =H110+100*O110 -> 127.825 | AK110: 127.8 | AL110: 33 | AM110: 46.8 | AN110: 150 | AO110: -5.7000000000000002e-002 | AP110: 4 | AQ110: 惠城转债
A111: 44 | B111: 113046 | C111: 金田转债 | D111: 601609 | E111: 金田铜业 | F111: 有色金属 | G111: 铜金属 | H111: 107.96 | I111: -6.8000000000000005e-003 | J111: 2.0999999999999999e-003 | K111: 8.82 | L111: -1.23e-002 | M111: 114.9 | N111: 10.75 | O111: 0.316 | P111: 82.05 | Q111: 38天 | R111: 5.59年 | S111: 3.59年 | T111: 15 | U111: 11 | V111: 6.9999999999999993e-003 | W111: 0.115 | X111: 9.4e-002 | Y111: 131 | Z111: 1.88 | AA111: 1.1399999999999999e-002 | AB111: 6.6e-003 | AC111: -1.15e-002 | AD111: -1.32e-002 | AE111: 90.45 | AF111: 94.33 | AG111: 0.38 | AH111: AA+ | AI111: 3.6600000000000001e-002 | AJ111: =H111+100*O111 -> 139.56 | AK111: 133.9 | AL111: 90 | AM111: 39.5 | AN111: 91 | AO111: -6.0000000000000001e-003 | AP111: 12 | AQ111: 金田转债
A112: 205 | B112: 113574 | C112: 华体转债! | D112: 603679 | E112: 华体科技 | F112: 城市公用 | G112: 城市公用 | H112: 110.2 | I112: -6.9999999999999993e-003 | J112: 5.3e-003 | K112: 15.35 | L112: -4.5999999999999999e-002 | M112: 115.9 | N112: 33.91 | O112: 1.4299999999999999 | P112: 45.27 | Q112: 转股中 | R112: 4.61年 | S112: 2.61年 | T112: 2.09 | U112: 3.6 | V112: 1.6e-002 | W112: 9.6000000000000002e-002 | X112: 4.2999999999999997e-002 | Y112: 22 | Z112: 2.82 | AA112: 1.1299999999999999e-002 | AB112: 5.0000000000000001e-003 | AC112: -2.06e-002 | AD112: -2.3300000000000001e-002 | AE112: 85.95 | AF112: 84.75 | AG112: 0.04 | AH112: A+ | AI112: 7.2099999999999997e-002 | AJ112: =H112+100*O112 -> 253.19999999999999 | AK112: 175.1 | AL112: 316 | AM112: 89.2 | AN112: 325 | AO112: -5.7000000000000002e-002 | AP112: 19 | AQ112: 华体转债!
A113: 66 | B113: 128143 | C113: 锋龙转债! | D113: 2931 | E113: 锋龙股份 | F113: 机械装备 | G113: 专用设备 | H113: 114.75 | I113: -7.9000000000000008e-003 | J113: -2.5999999999999999e-003 | K113: 11.95 | L113: -1.6500000000000001e-002 | M113: 121.7 | N113: 12.73 | O113: 0.222 | P113: 93.87 | Q113: 转股中 | R113: 5.39年 | S113: 3.39年 | T113: 2.45 | U113: 5.7 | V113: 2.e-002 | W113: 0.10300000000000001 | X113: 9.6999999999999989e-002 | Y113: 24 | Z113: 3.79 | AA113: 1.1200000000000002e-002 | AB113: 4.3e-003 | AC113: -2.6000000000000002e-002 | AD113: -2.8399999999999998e-002 | AE113: 81.56 | AF113: 83.83 | AG113: 0.64 | AH113: A+ | AI113: 7.3599999999999999e-002 | AJ113: =H113+100*O113 -> 136.94999999999999 | AK113: 135.6 | AL113: 106 | AM113: 51.8 | AN113: 187 | AO113: -1.8000000000000002e-002 | AP113: 13 | AQ113: 锋龙转债!
A114: 266 | B114: 128072 | C114: 翔鹭转债! | D114: 2842 | E114: 翔鹭钨业 | F114: 有色金属 | G114: 小金属 | H114: 109.813 | I114: -6.8999999999999999e-003 | J114: 1.e-002 | K114: 10.96 | L114: 1.01e-002 | M114: 115.1 | N114: 15.36 | O114: 0.53900000000000003 | P114: 71.35 | Q114: 转股中 | R114: 3.999年 | S114: 2年0.5天 | T114: 3.02 | U114: 8.3 | V114: 2.5000000000000001e-002 | W114: 0.10099999999999999 | X114: 7.2000000000000008e-002 | Y114: 30 | Z114: 3.18 | AA114: 1.0700000000000001e-002 | AB114: 4.0999999999999995e-003 | AC114: -2.9999999999999999e-002 | AD114: -3.2500000000000001e-002 | AE114: 90.51 | AF114: 90.72 | AG114: 0.3 | AH114: AA- | AI114: 6.1100000000000002e-002 | AJ114: =H114+100*O114 -> 163.71300000000002 | AK114: 148.3 | AL114: 218 | AM114: 57.6 | AN114: 232 | AO114: 3.0000000000000001e-003 | AP114: 29 | AQ114: 翔鹭转债!
A115: 131 | B115: 128129 | C115: 青农转债! | D115: 2958 | E115: 青农商行 | F115: 金融 | G115: 银行行业 | H115: 106.53 | I115: -8.9999999999999998e-004 | J115: -2.9999999999999997e-004 | K115: 3.92 | L115: -2.5000000000000001e-003 | M115: 112.2 | N115: 4.32 | O115: 0.17399999999999999 | P115: 90.74 | Q115: 转股中 | R115: 5年4.5天 | S115: 无权 | T115: 50 | U115: 20 | V115: 4.0000000000000001e-003 | W115: 0.23000000000000001 | X115: 0.20800000000000002 | Y115: 218 | Z115: 0.8 | AA115: 1.06e-002 | AB115: 6.0999999999999995e-003 | AC115: 无权 | AD115: 无权 | AE115: 无权 | AF115: 94.88 | AG115: 0.47 | AH115: AAA | AI115: 3.4599999999999999e-002 | AJ115: =H115+100*O115 -> 123.93000000000001 | AK115: 122.3 | AL115: 8 | AM115: 27.4 | AN115: 17 | AO115: -1.e-003 | AP115: 19 | AQ115: 青农转债!
A116: 67 | B116: 127028 | C116: 英特转债! | D116: 411 | E116: 英特集团 | F116: 医药 | G116: 医药商业 | H116: 107.077 | I116: -5.6000000000000008e-003 | J116: -3.0999999999999999e-003 | K116: 11.76 | L116: -1.9199999999999998e-002 | M116: 113.1 | N116: 13.4 | O116: 0.22 | P116: 87.76 | Q116: 转股中 | R116: 5.38年 | S116: 3.38年 | T116: 6 | U116: 18 | V116: 2.7999999999999997e-002 | W116: 0.20499999999999999 | X116: 0.17999999999999999 | Y116: 29 | Z116: 1.72 | AA116: 1.04e-002 | AB116: 5.8999999999999999e-003 | AC116: -9.300000000000001e-003 | AD116: -1.1299999999999999e-002 | AE116: 91.31 | AF116: 93.57 | AG116: 0.45 | AH116: AA+ | AI116: 3.6600000000000001e-002 | AJ116: =H116+100*O116 -> 129.077 | AK116: 126.4 | AL116: 25 | AM116: 32.8 | AN116: 43 | AO116: -5.0000000000000003e-002 | AP116: 23 | AQ116: 英特转债!
A117: 355 | B117: 128021 | C117: 兄弟转债!! | D117: 2562 | E117: 兄弟科技 | F117: 医药 | G117: 原料药 | H117: 106.396 | I117: -2.7000000000000001e-003 | J117: 2.5999999999999999e-003 | K117: 3.71 | L117: -1.3300000000000001e-002 | M117: 108.8 | N117: 5.19 | O117: 0.48799999999999999 | P117: 71.48 | Q117: 转股中 | R117: 2.28年 | S117: 0.28年 | T117: 2.65 | U117: 1.9 | V117: 6.9999999999999993e-003 | W117: 6.7000000000000004e-002 | X117: 4.8000000000000001e-002 | Y117: 39 | Z117: 1.33 | AA117: 1.e-002 | AB117: 2.7000000000000001e-003 | AC117: -0.11199999999999999 | AD117: -0.11900000000000001 | AE117: 99.87 | AF117: 99.95 | AG117: 0.01 | AH117: AA | AI117: 3.8699999999999998e-002 | AJ117: =H117+100*O117 -> 155.196 | AK117: 141.3 | AL117: 158 | AM117: 41.4 | AN117: 115 | AO117: 6.0000000000000001e-003 | AP117: 17 | AQ117: 兄弟转债!!
A118: 103 | B118: 127024 | C118: 盈峰转债! | D118: 967 | E118: 盈峰环境 | F118: 机械装备 | G118: 专用设备 | H118: 111 | I118: 1.4199999999999999e-002 | J118: -1.5100000000000001e-002 | K118: 6.27 | L118: -3.2000000000000002e-003 | M118: 116.8 | N118: 8.19 | O118: 0.45000000000000001 | P118: 76.56 | Q118: 转股中 | R118: 5.21年 | S118: 3.21年 | T118: 14.8 | U118: 3.6 | V118: 2.e-003 | W118: 7.400000000000001e-002 | X118: 5.7000000000000002e-002 | Y118: 198 | Z118: 1.18 | AA118: 1.e-002 | AB118: 4.1999999999999997e-003 | AC118: -2.12e-002 | AD118: -2.3099999999999999e-002 | AE118: 91.59 | AF118: 97.18 | AG118: 0.28 | AH118: AA+ | AI118: 3.6600000000000001e-002 | AJ118: =H118+100*O118 -> 156. | AK118: 145.4 | AL118: 198 | AM118: 48.3 | AN118: 164 | AO118: -9.0000000000000011e-003 | AP118: 5 | AQ118: 盈峰转债!
A119: 127 | B119: 128131 | C119: 崇达转2! | D119: 2815 | E119: 崇达技术 | F119: 电子 | G119: 元器件制 | H119: 109.799 | I119: -3.8e-003 | J119: 3.5999999999999999e-003 | K119: 12.95 | L119: -8.0000000000000004e-004 | M119: 115.2 | N119: 19.38 | O119: 0.64300000000000002 | P119: 66.82 | Q119: 转股中 | R119: 5年17天 | S119: 3年18天 | T119: 14 | U119: 9.3 | V119: 6.0000000000000001e-003 | W119: 0.12300000000000001 | X119: 8.199999999999999e-002 | Y119: 113 | Z119: 2.77 | AA119: 9.7999999999999997e-003 | AB119: 4.3e-003 | AC119: -1.78e-002 | AD119: -1.9900000000000001e-002 | AE119: 91.09 | AF119: 94.18 | AG119: 0.2 | AH119: AA | AI119: 4.1599999999999998e-002 | AJ119: =H119+100*O119 -> 174.09899999999999 | AK119: 152.8 | AL119: 253 | AM119: 58.6 | AN119: 241 | AO119: -5.7999999999999996e-002 | AP119: 10 | AQ119: 崇达转2!
A120: 109 | B120: 113606 | C120: 荣泰转债 | D120: 603579 | E120: 荣泰健康 | F120: 机械装备 | G120: 专用设备 | H120: 115.42 | I120: -1.9e-003 | J120: 1.9e-003 | K120: 28.98 | L120: 0. | M120: 121.2 | N120: 32.83 | O120: 0.308 | P120: 88.27 | Q120: 转股中 | R120: 5.19年 | S120: 3.20年 | T120: 6 | U120: 8.9 | V120: 1.3000000000000001e-002 | W120: 0.14800000000000002 | X120: 0.13100000000000001 | Y120: 41 | Z120: 2.42 | AA120: 9.7000000000000003e-003 | AB120: 2.5999999999999999e-003 | AC120: -3.0499999999999999e-002 | AD120: -3.2799999999999996e-002 | AE120: 85.13 | AF120: 89.09 | AG120: 0.52 | AH120: AA- | AI120: 6.2600000000000003e-002 | AJ120: =H120+100*O120 -> 146.22 | AK120: 142.6 | AL120: 171 | AM120: 53.5 | AN120: 198 | AO120: -8.1000000000000003e-002 | AP120: 11 | AQ120: 荣泰转债
A121: 83 | B121: 127027 | C121: 靖远转债! | D121: 552 | E121: 靖远煤电 | F121: 煤炭 | G121: 煤炭开采 | H121: 109.701 | I121: 1.5700000000000002e-002 | J121: -9.0000000000000011e-003 | K121: 3.08 | L121: 1.32e-002 | M121: 115.3 | N121: 3.23 | O121: 0.14999999999999999 | P121: 95.36 | Q121: 转股中 | R121: 5.31年 | S121: 3.31年 | T121: 28 | U121: 59 | V121: 1.9e-002 | W121: 0.39700000000000002 | X121: 0.379 | Y121: 70 | Z121: 0.88 | AA121: 9.5999999999999992e-003 | AB121: 4.4000000000000003e-003 | AC121: -1.5900000000000001e-002 | AD121: -1.8000000000000002e-002 | AE121: 91.74 | AF121: 95.66 | AG121: 0.51 | AH121: AA+ | AI121: 3.6600000000000001e-002 | AJ121: =H121+100*O121 -> 124.70099999999999 | AK121: 124 | AL121: 14 | AM121: 28.4 | AN121: 22 | AO121: 6.3e-002 | AP121: 43 | AQ121: 靖远转债!
A122: 47 | B122: 123104 | C122: 卫宁转债! | D122: 300253 | E122: 卫宁健康 | F122: 计算机及 | G122: 软件开发 | H122: 118.769 | I122: -1.9e-003 | J122: 3.5999999999999999e-003 | K122: 13.75 | L122: 5.8999999999999999e-003 | M122: 125.1 | N122: 17.74 | O122: 0.53200000000000003 | P122: 77.51 | Q122: 33天 | R122: 5.57年 | S122: 3.57年 | T122: 9.7 | U122: 1.6 | V122: 1.e-003 | W122: 3.3000000000000002e-002 | X122: 2.6000000000000002e-002 | Y122: 294 | Z122: 6.44 | AA122: 9.4999999999999998e-003 | AB122: 2.e-003 | AC122: -3.6200000000000003e-002 | AD122: -3.7900000000000003e-002 | AE122: 89.09 | AF122: 100.08 | AG122: 0.29 | AH122: AA | AI122: 4.1599999999999998e-002 | AJ122: =H122+100*O122 -> 171.96899999999999 | AK122: 160 | AL122: 286 | AM122: 59.9 | AN122: 245 | AO122: -5.5999999999999994e-002 | AP122: 4 | AQ122: 卫宁转债!
A123: 295 | B123: 110056 | C123: 亨通转债! | D123: 600487 | E123: 亨通光电 | F123: 通信互联 | G123: 通信设备 | H123: 110.68 | I123: 1.2999999999999999e-003 | J123: -3.9000000000000003e-003 | K123: 12.35 | L123: -9.5999999999999992e-003 | M123: 114.3 | N123: 14.95 | O123: 0.34000000000000002 | P123: 82.61 | Q123: 转股中 | R123: 3.58年 | S123: 1.58年 | T123: 17.1 | U123: 13 | V123: 6.9999999999999993e-003 | W123: 5.9000000000000004e-002 | X123: 4.8000000000000001e-002 | Y123: 292 | Z123: 1.45 | AA123: 9.1999999999999998e-003 | AB123: 1.9e-003 | AC123: -4.1799999999999997e-002 | AD123: -4.4699999999999997e-002 | AE123: 96.84 | AF123: 101.27 | AG123: 0.27 | AH123: AA+ | AI123: 3.5099999999999999e-002 | AJ123: =H123+100*O123 -> 144.68000000000001 | AK123: 138.8 | AL123: 129 | AM123: 37.5 | AN123: 75 | AO123: -2.6000000000000002e-002 | AP123: 28 | AQ123: 亨通转债!
A124: 327 | B124: 123011 | C124: 德尔转债! | D124: 300473 | E124: 德尔股份 | F124: 汽车 | G124: 零部件制 | H124: 112.342 | I124: -1.3600000000000001e-002 | J124: 4.6999999999999993e-003 | K124: 24.98 | L124: -3.1800000000000002e-002 | M124: 115.3 | N124: 31.38 | O124: 0.41100000000000003 | P124: 79.6 | Q124: 转股中 | R124: 2.91年 | S124: 0.91年 | T124: 2.51 | U124: 17 | V124: 6.0999999999999999e-002 | W124: 7.400000000000001e-002 | X124: 5.9000000000000004e-002 | Y124: 34 | Z124: 1.53 | AA124: 9.1000000000000004e-003 | AB124: -2.9999999999999997e-004 | AC124: -8.77e-002 | AD124: -9.06e-002 | AE124: 95.65 | AF124: 97.65 | AG124: 0.28 | AH124: AA- | AI124: 5.9699999999999996e-002 | AJ124: =H124+100*O124 -> 153.44200000000001 | AK124: 145.1 | AL124: 196 | AM124: 47.4 | AN124: 157 | AO124: -2.6000000000000002e-002 | AP124: 42 | AQ124: 德尔转债!
A125: 270 | B125: 128070 | C125: 智能转债! | D125: 2877 | E125: 智能自控 | F125: 机械装备 | G125: 通用设备 | H125: 112.886 | I125: -2.8000000000000004e-003 | J125: 5.0000000000000001e-003 | K125: 6.47 | L125: 7.8000000000000005e-003 | M125: 116.8 | N125: 9.47 | O125: 0.65200000000000002 | P125: 68.32 | Q125: 转股中 | R125: 3.86年 | S125: 无权 | T125: 2.3 | U125: 13 | V125: 4.8000000000000001e-002 | W125: 0.107 | X125: 7.2999999999999995e-002 | Y125: 22 | Z125: 2.91 | AA125: 9.0000000000000011e-003 | AB125: 1.2999999999999999e-003 | AC125: 无权 | AD125: 无权 | AE125: 无权 | AF125: 89.75 | AG125: 0.29 | AH125: A+ | AI125: 7.2099999999999997e-002 | AJ125: =H125+100*O125 -> 178.08600000000001 | AK125: 157.5 | AL125: 276 | AM125: 67.7 | AN125: 282 | AO125: 1.7000000000000001e-002 | AP125: 30 | AQ125: 智能转债!
A126: 41 | B126: 123106 | C126: 正丹转债! | D126: 300641 | E126: 正丹股份 | F126: 化工 | G126: 化工 | H126: 119.8 | I126: -2.0899999999999998e-002 | J126: 5.1000000000000004e-003 | K126: 8.31 | L126: -2.35e-002 | M126: 125.5 | N126: 7.5 | O126: 8.1000000000000003e-002 | P126: 110.8 | Q126: 41天 | R126: 5.59年 | S126: 3.59年 | T126: 3.2 | U126: 61 | V126: 0.159 | W126: 7.9000000000000001e-002 | X126: 8.6999999999999994e-002 | Y126: 41 | Z126: 2.88 | AA126: 8.5000000000000006e-003 | AB126: 8.9999999999999998e-004 | AC126: -3.7699999999999997e-002 | AD126: -3.95e-002 | AE126: 82.84 | AF126: 89.96 | AG126: 0.67 | AH126: AA- | AI126: 6.2600000000000003e-002 | AJ126: =H126+100*O126 -> 127.89999999999999 | AK126: 128.8 | AL126: 38 | AM126: 38.8 | AN126: 88 | AO126: 5.4000000000000006e-002 | AP126: 15 | AQ126: 正丹转债!
A127: 37 | B127: 123107 | C127: 温氏转债! | D127: 300498 | E127: 温氏股份 | F127: 农业 | G127: 畜牧业 | H127: 107.86 | I127: -2.3999999999999998e-003 | J127: 0. | K127: 13 | L127: -8.3999999999999995e-003 | M127: 113 | N127: 17.62 | O127: 0.46200000000000002 | P127: 73.78 | Q127: 49天 | R127: 5.60年 | S127: 3.61年 | T127: 93 | U127: 51 | V127: 5.0000000000000001e-003 | W127: 0.11199999999999999 | X127: 8.3000000000000004e-002 | Y127: 829 | Z127: 1.98 | AA127: 8.5000000000000006e-003 | AB127: 4.1999999999999997e-003 | AC127: -1.09e-002 | AD127: -1.2699999999999999e-002 | AE127: 91.13 | AF127: 93.7 | AG127: 0.29 | AH127: AAA | AI127: 3.4599999999999999e-002 | AJ127: =H127+100*O127 -> 154.06 | AK127: 141.9 | AL127: 164 | AM127: 48.2 | AN127: 162 | AO127: -1.1000000000000001e-002 | AP127: 11 | AQ127: 温氏转债!
A128: 29 | B128: 127032 | C128: 苏行转债 | D128: 2966 | E128: 苏州银行 | F128: 金融 | G128: 银行行业 | H128: 109.95 | I128: -1.4000000000000002e-003 | J128: 1.4000000000000002e-003 | K128: 7 | L128: 0. | M128: 115.1 | N128: 8.1 | O128: 0.27200000000000002 | P128: 86.42 | Q128: 59天 | R128: 5.64年 | S128: 无权 | T128: 50 | U128: 20 | V128: 4.0000000000000001e-003 | W128: 0.214 | X128: 0.185 | Y128: 233 | Z128: 0.76 | AA128: 8.3000000000000001e-003 | AB128: 3.4999999999999996e-003 | AC128: 无权 | AD128: 无权 | AE128: 无权 | AF128: 95.31 | AG128: 0.42 | AH128: AAA | AI128: 3.4599999999999999e-002 | AJ128: =H128+100*O128 -> 137.15000000000001 | AK128: 133.5 | AL128: 84 | AM128: 38.2 | AN128: 83 | AO128: 2.e-003 | AP128: 8 | AQ128: 苏行转债
A129: 114 | B129: 123072 | C129: 乐歌转债! | D129: 300729 | E129: 乐歌股份 | F129: 其他 | G129: 家居用品 | H129: 124.445 | I129: -5.6000000000000008e-003 | J129: 4.7999999999999996e-003 | K129: 20.67 | L129: -3.6400000000000002e-002 | M129: 129.6 | N129: 56.12 | O129: 2.3799999999999999 | P129: 36.83 | Q129: 转股中 | R129: 5.17年 | S129: 3.17年 | T129: 1.42 | U129: 13 | V129: 7.0999999999999994e-002 | W129: 3.7999999999999999e-002 | X129: 1.3999999999999999e-002 | Y129: 37 | Z129: 3.55 | AA129: 8.1000000000000013e-003 | AB129: -1.1999999999999999e-003 | AC129: -4.58e-002 | AD129: -4.9299999999999997e-002 | AE129: 84.52 | AF129: 90.9 | AG129: 0.02 | AH129: A+ | AI129: 7.3599999999999999e-002 | AJ129: =H129+100*O129 -> 362.44499999999999 | AK129: 212.1 | AL129: 343 | AM129: 121.2 | AN129: 342 | AO129: -5.9999999999999998e-002 | AP129: 9 | AQ129: 乐歌转债!
A130: 53 | B130: 128144 | C130: 利民转债! | D130: 2734 | E130: 利民股份 | F130: 化工 | G130: 农化 | H130: 109.4 | I130: -1.04e-002 | J130: -3.7000000000000002e-003 | K130: 10.86 | L130: -3.8900000000000004e-002 | M130: 114.1 | N130: 13.98 | O130: 0.40799999999999997 | P130: 77.68 | Q130: 16天 | R130: 5.53年 | S130: 3.53年 | T130: 9.8 | U130: 6.3 | V130: 6.0000000000000001e-003 | W130: 0.24199999999999999 | X130: 0.188 | Y130: 40 | Z130: 1.47 | AA130: 7.8000000000000005e-003 | AB130: 3.0999999999999999e-003 | AC130: -1.67e-002 | AD130: -1.8100000000000002e-002 | AE130: 88.58 | AF130: 91.41 | AG130: 0.36 | AH130: AA | AI130: 4.1599999999999998e-002 | AJ130: =H130+100*O130 -> 150.19999999999999 | AK130: 141.1 | AL130: 156 | AM130: 49.7 | AN130: 171 | AO130: -2.3e-002 | AP130: 5 | AQ130: 利民转债!
A131: 344 | B131: 128034 | C131: 江银转债! | D131: 2807 | E131: 江阴银行 | F131: 金融 | G131: 银行行业 | H131: 106.5 | I131: -4.8999999999999998e-003 | J131: 4.8999999999999998e-003 | K131: 3.78 | L131: 0. | M131: 108.3 | N131: 4.32 | O131: 0.217 | P131: 87.5 | Q131: 转股中 | R131: 2.44年 | S131: 无权 | T131: 17.6 | U131: 2.6 | V131: 1.e-003 | W131: 0.214 | X131: 0.187 | Y131: 82 | Z131: 0.69 | AA131: 6.9999999999999993e-003 | AB131: 5.0000000000000001e-004 | AC131: 无权 | AD131: 无权 | AE131: 无权 | AF131: 100 | AG131: 0.32 | AH131: AA+ | AI131: 3.3700000000000001e-002 | AJ131: =H131+100*O131 -> 128.19999999999999 | AK131: 125.5 | AL131: 22 | AM131: 25.5 | AN131: 8 | AO131: -6.0000000000000001e-003 | AP131: 27 | AQ131: 江银转债!
A132: 268 | B132: 113542 | C132: 好客转债! | D132: 603898 | E132: 好莱客 | F132: 其他 | G132: 家居用品 | H132: 111.28 | I132: -8.9999999999999998e-004 | J132: -4.4000000000000003e-003 | K132: 11.72 | L132: -2.5000000000000001e-002 | M132: 114.3 | N132: 16.14 | O132: 0.53200000000000003 | P132: 72.61 | Q132: 转股中 | R132: 3.95年 | S132: 1.95年 | T132: 6.03 | U132: 4.8 | V132: 6.9999999999999993e-003 | W132: 0.16500000000000001 | X132: 0.12 | Y132: 36 | Z132: 1.42 | AA132: 6.8999999999999999e-003 | AB132: 4.0000000000000002e-004 | AC132: -3.7000000000000005e-002 | AD132: -3.95e-002 | AE132: 94.65 | AF132: 98.14 | AG132: 0.21 | AH132: AA | AI132: 4.0099999999999997e-002 | AJ132: =H132+100*O132 -> 164.48000000000002 | AK132: 149.9 | AL132: 228 | AM132: 51.8 | AN132: 188 | AO132: -1.6e-002 | AP132: 17 | AQ132: 好客转债!
A133: 124 | B133: 128133 | C133: 奇正转债! | D133: 2287 | E133: 奇正藏药 | F133: 医药 | G133: 中药 | H133: 113.768 | I133: -2.4300000000000002e-002 | J133: 7.4999999999999997e-003 | K133: 26.69 | L133: -3.7200000000000004e-002 | M133: 117.3 | N133: 29.78 | O133: 0.26899999999999996 | P133: 89.62 | Q133: 转股中 | R133: 5年32天 | S133: 3年33天 | T133: 8 | U133: 11 | V133: 1.2e-002 | W133: 5.5999999999999994e-002 | X133: 5.0999999999999997e-002 | Y133: 142 | Z133: 5.46 | AA133: 6.1999999999999998e-003 | AB133: 1.e-004 | AC133: -2.7999999999999997e-002 | AD133: -3.0200000000000001e-002 | AE133: 91.04 | AF133: 95.75 | AG133: 0.45 | AH133: AA | AI133: 4.1599999999999998e-002 | AJ133: =H133+100*O133 -> 140.66800000000001 | AK133: 137.9 | AL133: 126 | AM133: 42.2 | AN133: 123 | AO133: -5.0000000000000003e-002 | AP133: 16 | AQ133: 奇正转债!
A134: 116 | B134: 128135 | C134: 洽洽转债! | D134: 2557 | E134: 洽洽食品 | F134: 食品饮料 | G134: 休闲食品 | H134: 116.5 | I134: -4.1999999999999997e-003 | J134: -2.8000000000000004e-003 | K134: 39.74 | L134: -4.1500000000000002e-002 | M134: 120.2 | N134: 60.03 | O134: 0.76000000000000001 | P134: 66.2 | Q134: 转股中 | R134: 5.17年 | S134: 3.17年 | T134: 13.4 | U134: 25 | V134: 1.6e-002 | W134: 6.7000000000000004e-002 | X134: 4.4000000000000004e-002 | Y134: 201 | Z134: 4.72 | AA134: 6.1999999999999998e-003 | AB134: -5.9999999999999995e-004 | AC134: -3.4599999999999999e-002 | AD134: -3.6600000000000001e-002 | AE134: 90.66 | AF134: 97.78 | AG134: 0.17 | AH134: AA | AI134: 4.1599999999999998e-002 | AJ134: =H134+100*O134 -> 192.5 | AK134: 166.8 | AL134: 302 | AM134: 69 | AN134: 287 | AO134: -1.7000000000000001e-002 | AP134: 11 | AQ134: 洽洽转债!
A135: 357 | B135: 110038 | C135: 济川转债! | D135: 600566 | E135: 济川药业 | F135: 医药 | G135: 中药 | H135: 106.71 | I135: -5.9999999999999995e-004 | J135: 5.0000000000000001e-004 | K135: 14.53 | L135: -6.8000000000000005e-003 | M135: 107.5 | N135: 23.4 | O135: 0.71900000000000008 | P135: 62.09 | Q135: 转股中 | R135: 1.23年 | S135: 回售内 | T135: 6.28 | U135: 4.3 | V135: 6.0000000000000001e-003 | W135: 4.9000000000000002e-002 | X135: 2.9999999999999999e-002 | Y135: 129 | Z135: 1.59 | AA135: 6.0999999999999995e-003 | AB135: -5.4000000000000003e-003 | AC135: 回售内 | AD135: 回售内 | AE135: 100.25 | AF135: 102.64 | AG135: 0.01 | AH135: AA | AI135: 3.8699999999999998e-002 | AJ135: =H135+100*O135 -> 178.61000000000001 | AK135: 151.3 | AL135: 236 | AM135: 48.7 | AN135: 166 | AO135: -5.0000000000000003e-002 | AP135: 23 | AQ135: 济川转债!
A136: 96 | B136: 113609 | C136: 永安转债! | D136: 603776 | E136: 永安行 | F136: 城市公用 | G136: 其他 | H136: 116.79 | I136: -9.300000000000001e-003 | J136: 9.7000000000000003e-003 | K136: 17.82 | L136: 5.9999999999999995e-004 | M136: 120.5 | N136: 16.48 | O136: 8.0000000000000002e-002 | P136: 108.13 | Q136: 转股中 | R136: 5.26年 | S136: 3.26年 | T136: 7.34 | U136: 37 | V136: 4.2999999999999997e-002 | W136: 0.17699999999999999 | X136: 0.191 | Y136: 42 | Z136: 1.06 | AA136: 6.0999999999999995e-003 | AB136: -5.9999999999999995e-004 | AC136: -3.4000000000000002e-002 | AD136: -3.61e-002 | AE136: 84.51 | AF136: 88.14 | AG136: 0.69 | AH136: AA- | AI136: 6.2600000000000003e-002 | AJ136: =H136+100*O136 -> 124.79000000000001 | AK136: 125.4 | AL136: 21 | AM136: 37.3 | AN136: 73 | AO136: 3.7999999999999999e-002 | AP136: 24 | AQ136: 永安转债!
A137: 13 | B137: 113625 | C137: 江山转债! | D137: 603208 | E137: 江山欧派 | F137: 其他 | G137: 家居用品 | H137: 119.96 | I137: -3.7000000000000002e-003 | J137: -9.7000000000000003e-003 | K137: 81.9 | L137: -2.63e-002 | M137: 124 | N137: 97.55 | O137: 0.42899999999999999 | P137: 83.96 | Q137: 4月0天 | R137: 5.81年 | S137: 3.81年 | T137: 5.83 | U137: 11 | V137: 1.4999999999999999e-002 | W137: 6.8000000000000005e-002 | X137: 5.7000000000000002e-002 | Y137: 86 | Z137: 4.65 | AA137: 5.7999999999999996e-003 | AB137: -1.1000000000000001e-003 | AC137: -3.5799999999999998e-002 | AD137: -3.7499999999999999e-002 | AE137: 81.83 | AF137: 87.75 | AG137: 0.51 | AH137: AA- | AI137: 6.2600000000000003e-002 | AJ137: =H137+100*O137 -> 162.85999999999999 | AK137: 156 | AL137: 268 | AM137: 68.2 | AN137: 285 | AO137: 0.10099999999999999 | AP137: 3 | AQ137: 江山转债!
A138: 145 | B138: 123063 | C138: 大禹转债 | D138: 300021 | E138: 大禹节水 | F138: 化工 | G138: 橡胶塑料 | H138: 122.69 | I138: 1.9199999999999998e-002 | J138: 4.5999999999999999e-003 | K138: 5.59 | L138: 3.5200000000000002e-002 | M138: 126.1 | N138: 4.83 | O138: 5.9999999999999998e-002 | P138: 115.73 | Q138: 转股中 | R138: 4.94年 | S138: 3.94年 | T138: 6.35 | U138: 47 | V138: 6.0999999999999999e-002 | W138: 0.14199999999999999 | X138: 0.16399999999999998 | Y138: 45 | Z138: 2.94 | AA138: 5.6999999999999993e-003 | AB138: -3.0999999999999999e-003 | AC138: -3.4200000000000001e-002 | AD138: -3.7000000000000005e-002 | AE138: 83.91 | AF138: 94.67 | AG138: 0.68 | AH138: AA- | AI138: 6.1100000000000002e-002 | AJ138: =H138+100*O138 -> 128.69 | AK138: 129.6 | AL138: 42 | AM138: 35 | AN138: 52 | AO138: 4.9000000000000002e-002 | AP138: 19 | AQ138: 大禹转债
A139: 119 | B139: 123068 | C139: 弘信转债 | D139: 300657 | E139: 弘信电子 | F139: 电子 | G139: 元器件制 | H139: 117.83 | I139: -3.0999999999999999e-003 | J139: 2.3e-003 | K139: 16.09 | L139: -1.1999999999999999e-003 | M139: 121.2 | N139: 15.34 | O139: 0.12300000000000001 | P139: 104.89 | Q139: 转股中 | R139: 5年55天 | S139: 3年56天 | T139: 5.65 | U139: 14 | V139: 2.1000000000000001e-002 | W139: 8.5999999999999993e-002 | X139: 8.9999999999999997e-002 | Y139: 66 | Z139: 3.92 | AA139: 5.6000000000000008e-003 | AB139: -1.5e-003 | AC139: -3.7000000000000005e-002 | AD139: -3.9199999999999999e-002 | AE139: 85.33 | AF139: 89.3 | AG139: 0.65 | AH139: AA- | AI139: 6.2600000000000003e-002 | AJ139: =H139+100*O139 -> 130.13 | AK139: 130.8 | AL139: 50 | AM139: 41.5 | AN139: 117 | AO139: -8.3000000000000004e-002 | AP139: 9 | AQ139: 弘信转债
A140: 305 | B140: 110051 | C140: 中天转债! | D140: 600522 | E140: 中天科技 | F140: 通信互联 | G140: 通信设备 | H140: 111.25 | I140: -8.3999999999999995e-003 | J140: 4.0000000000000001e-003 | K140: 7.97 | L140: -1.8500000000000003e-002 | M140: 113.3 | N140: 9.99 | O140: 0.39399999999999996 | P140: 79.78 | Q140: 转股中 | R140: 3.53年 | S140: 1.53年 | T140: 39.6 | U140: 53 | V140: 1.2e-002 | W140: 0.16200000000000001 | X140: 0.129 | Y140: 244 | Z140: 1.05 | AA140: 5.3e-003 | AB140: -1.6000000000000001e-003 | AC140: -4.5999999999999999e-002 | AD140: -4.9000000000000002e-002 | AE140: 97.02 | AF140: 100.56 | AG140: 0.24 | AH140: AA+ | AI140: 3.5099999999999999e-002 | AJ140: =H140+100*O140 -> 150.65000000000001 | AK140: 142.7 | AL140: 174 | AM140: 42.2 | AN140: 122 | AO140: -1.1000000000000001e-002 | AP140: 27 | AQ140: 中天转债!
A141: 247 | B141: 113549 | C141: 白电转债 | D141: 603861 | E141: 白云电器 | F141: 能源电力 | G141: 电力设备 | H141: 112.34 | I141: -1.0700000000000001e-002 | J141: 4.7999999999999996e-003 | K141: 8.6 | L141: -1.15e-002 | M141: 114.8 | N141: 8.81 | O141: 0.151 | P141: 97.62 | Q141: 转股中 | R141: 4.24年 | S141: 2.24年 | T141: 8.8 | U141: 4.8 | V141: 5.0000000000000001e-003 | W141: 0.23199999999999998 | X141: 0.22600000000000001 | Y141: 38 | Z141: 1.48 | AA141: 5.1999999999999998e-003 | AB141: -1.1000000000000001e-003 | AC141: -3.4599999999999999e-002 | AD141: -3.7100000000000001e-002 | AE141: 94.07 | AF141: 97.52 | AG141: 0.52 | AH141: AA | AI141: 4.0099999999999997e-002 | AJ141: =H141+100*O141 -> 127.44 | AK141: 127.1 | AL141: 27 | AM141: 29.5 | AN141: 25 | AO141: -4.7e-002 | AP141: 40 | AQ141: 白电转债
A142: 230 | B142: 127015 | C142: 希望转债!! | D142: 876 | E142: 新 希 望 | F142: 农业 | G142: 畜牧业 | H142: 107.601 | I142: 0. | J142: -5.9999999999999995e-004 | K142: 11.59 | L142: -1.11e-002 | M142: 110 | N142: 19.75 | O142: 0.83400000000000007 | P142: 58.68 | Q142: 转股中 | R142: 4.37年 | S142: 2.37年 | T142: 9.5 | U142: 2.8 | V142: 3.0000000000000001e-003 | W142: 1.8000000000000002e-002 | X142: 1.1000000000000001e-002 | Y142: 522 | Z142: 1.41 | AA142: 5.1000000000000004e-003 | AB142: 8.9999999999999998e-004 | AC142: -1.8500000000000003e-002 | AD142: -2.0499999999999997e-002 | AE142: 94.58 | AF142: 95.29 | AG142: 0.06 | AH142: AAA | AI142: 3.3099999999999997e-002 | AJ142: =H142+100*O142 -> 191.001 | AK142: 156.5 | AL142: 271 | AM142: 61.2 | AN142: 254 | AO142: -1.9e-002 | AP142: 26 | AQ142: 希望转债!!
A143: 92 | B143: 113610 | C143: 灵康转债 | D143: 603669 | E143: 灵康药业 | F143: 医药 | G143: 化学制药 | H143: 118 | I143: -1.1000000000000001e-002 | J143: 3.8e-003 | K143: 9.47 | L143: -1.04e-002 | M143: 121.1 | N143: 8.61 | O143: 7.2999999999999995e-002 | P143: 109.99 | Q143: 转股中 | R143: 5.28年 | S143: 3.28年 | T143: 4.58 | U143: 26 | V143: 4.8000000000000001e-002 | W143: 6.8000000000000005e-002 | X143: 7.4999999999999997e-002 | Y143: 68 | Z143: 4.8 | AA143: 5.0000000000000001e-003 | AB143: -1.8e-003 | AC143: -3.6299999999999999e-002 | AD143: -3.8399999999999997e-002 | AE143: 84.58 | AF143: 88.51 | AG143: 0.69 | AH143: AA- | AI143: 6.2600000000000003e-002 | AJ143: =H143+100*O143 -> 125.3 | AK143: 126 | AL143: 23 | AM143: 37.5 | AN143: 76 | AO143: -7.0000000000000007e-002 | AP143: 27 | AQ143: 灵康转债
A144: 129 | B144: 123064 | C144: 万孚转债! | D144: 300482 | E144: 万孚生物 | F144: 医药 | G144: 医疗器械 | H144: 112.4 | I144: -4.0099999999999997e-002 | J144: 1.8000000000000002e-002 | K144: 43.56 | L144: -0.151 | M144: 115.1 | N144: 71.65 | O144: 0.84900000000000009 | P144: 60.8 | Q144: 转股中 | R144: 5年11天 | S144: 3年12天 | T144: 5.99 | U144: 17 | V144: 2.5000000000000001e-002 | W144: 3.1e-002 | X144: 1.9e-002 | Y144: 194 | Z144: 5.13 | AA144: 4.7999999999999996e-003 | AB144: -5.9999999999999995e-004 | AC144: -2.5399999999999999e-002 | AD144: -2.75e-002 | AE144: 91.06 | AF144: 94.15 | AG144: 0.15 | AH144: AA | AI144: 4.1599999999999998e-002 | AJ144: =H144+100*O144 -> 197.30000000000001 | AK144: 164 | AL144: 298 | AM144: 69.9 | AN144: 292 | AO144: -0.21100000000000002 | AP144: 10 | AQ144: 万孚转债!
A145: 237 | B145: 113030 | C145: 东风转债! | D145: 601515 | E145: 东风股份 | F145: 造纸包装 | G145: 包装材料 | H145: 114.8 | I145: -1.e-004 | J145: 9.4999999999999998e-003 | K145: 6.14 | L145: 1.9900000000000001e-002 | M145: 116.9 | N145: 6.45 | O145: 0.20600000000000002 | P145: 95.19 | Q145: 转股中 | R145: 4.34年 | S145: 2.35年 | T145: 2.95 | U145: 6.3 | V145: 1.9e-002 | W145: 3.6000000000000004e-002 | X145: 3.4000000000000002e-002 | Y145: 82 | Z145: 1.78 | AA145: 4.3e-003 | AB145: -2.5999999999999999e-003 | AC145: -4.1200000000000001e-002 | AD145: -4.36e-002 | AE145: 93.78 | AF145: 98.9 | AG145: 0.47 | AH145: AA | AI145: 4.0099999999999997e-002 | AJ145: =H145+100*O145 -> 135.40000000000001 | AK145: 134.4 | AL145: 92 | AM145: 35.5 | AN145: 57 | AO145: 2.4e-002 | AP145: 18 | AQ145: 东风转债!
A146: 91 | B146: 123080 | C146: 海波转债! | D146: 300517 | E146: 海波重科 | F146: 建筑 | G146: 建筑工程 | H146: 123.7 | I146: -2.5999999999999999e-003 | J146: -2.2000000000000001e-003 | K146: 13.64 | L146: -6.6e-003 | M146: 126.5 | N146: 11.58 | O146: 5.0000000000000003e-002 | P146: 117.79 | Q146: 转股中 | R146: 5.28年 | S146: 3.29年 | T146: 2.44 | U146: 18 | V146: 5.9000000000000004e-002 | W146: 9.3000000000000013e-002 | X146: 0.109 | Y146: 26 | Z146: 3.08 | AA146: 4.3e-003 | AB146: -3.9000000000000003e-003 | AC146: -4.7800000000000002e-002 | AD146: -5.0199999999999995e-002 | AE146: 82.2 | AF146: 87.74 | AG146: 0.73 | AH146: A+ | AI146: 7.3599999999999999e-002 | AJ146: =H146+100*O146 -> 128.69999999999999 | AK146: 129.6 | AL146: 41 | AM146: 41.9 | AN146: 120 | AO146: -3.9e-002 | AP146: 23 | AQ146: 海波转债!
A147: 333 | B147: 128040 | C147: 华通转债! | D147: 2758 | E147: 浙农股份 | F147: 医药 | G147: 医药商业 | H147: 110.097 | I147: -7.1999999999999998e-003 | J147: 3.7000000000000002e-003 | K147: 9 | L147: -9.8999999999999991e-003 | M147: 111.3 | N147: 10.15 | O147: 0.24199999999999999 | P147: 88.67 | Q147: 转股中 | R147: 2.82年 | S147: 0.82年 | T147: 2.22 | U147: 4.2 | V147: 1.7000000000000001e-002 | W147: 5.0999999999999997e-002 | X147: 4.4999999999999998e-002 | Y147: 44 | Z147: 1.46 | AA147: 3.9000000000000003e-003 | AB147: -3.4999999999999996e-003 | AC147: -7.6799999999999993e-002 | AD147: -8.0100000000000005e-002 | AE147: 98.08 | AF147: 100.18 | AG147: 0.36 | AH147: AA | AI147: 3.8699999999999998e-002 | AJ147: =H147+100*O147 -> 134.297 | AK147: 131.5 | AL147: 61 | AM147: 31.3 | AN147: 34 | AO147: -1.7000000000000001e-002 | AP147: 33 | AQ147: 华通转债!
A148: 46 | B148: 123105 | C148: 拓尔转债! | D148: 300229 | E148: 拓尔思 | F148: 计算机及 | G148: 软件开发 | H148: 118.46 | I148: -6.9999999999999993e-003 | J148: 1.2800000000000001e-002 | K148: 9.21 | L148: 9.8999999999999991e-003 | M148: 121 | N148: 9.96 | O148: 0.28100000000000003 | P148: 92.47 | Q148: 36天 | R148: 5.58年 | S148: 3.58年 | T148: 8 | U148: 14 | V148: 1.3999999999999999e-002 | W148: 0.122 | X148: 0.11199999999999999 | Y148: 66 | Z148: 3.03 | AA148: 3.9000000000000003e-003 | AB148: -2.5999999999999999e-003 | AC148: -3.4700000000000002e-002 | AD148: -3.6600000000000001e-002 | AE148: 82.98 | AF148: 86.85 | AG148: 0.59 | AH148: AA- | AI148: 6.2600000000000003e-002 | AJ148: =H148+100*O148 -> 146.56 | AK148: 144.5 | AL148: 190 | AM148: 57.6 | AN148: 234 | AO148: -6.9000000000000006e-002 | AP148: 8 | AQ148: 拓尔转债!
A149: 16 | B149: 123116 | C149: 万兴转债 | D149: 300624 | E149: 万兴科技 | F149: 计算机及 | G149: 软件开发 | H149: 118.764 | I149: -1.6e-002 | J149: 8.8000000000000005e-003 | K149: 44.76 | L149: -1.15e-002 | M149: 121.4 | N149: 49.78 | O149: 0.32100000000000001 | P149: 89.92 | Q149: 3月28天 | R149: 5.80年 | S149: 3.80年 | T149: 3.79 | U149: 6.4 | V149: 1.3999999999999999e-002 | W149: 6.5000000000000002e-002 | X149: 5.9000000000000004e-002 | Y149: 58 | Z149: 6.54 | AA149: 3.9000000000000003e-003 | AB149: -2.3999999999999998e-003 | AC149: -3.2400000000000005e-002 | AD149: -3.44e-002 | AE149: 78.93 | AF149: 81.12 | AG149: 0.63 | AH149: A+ | AI149: 7.3599999999999999e-002 | AJ149: =H149+100*O149 -> 150.864 | AK149: 147.6 | AL149: 216 | AM149: 66.5 | AN149: 276 | AO149: -9.0999999999999998e-002 | AP149: 4 | AQ149: 万兴转债
A150: 163 | B150: 128119 | C150: 龙大转债! | D150: 2726 | E150: 龙大肉食 | F150: 食品饮料 | G150: 肉制品 | H150: 118.015 | I150: -1.04e-002 | J150: 7.7000000000000002e-003 | K150: 9.3 | L150: -5.3e-003 | M150: 119.9 | N150: 9.29 | O150: 0.17899999999999999 | P150: 100.11 | Q150: 转股中 | R150: 4.89年 | S150: 2.90年 | T150: 9.46 | U150: 18 | V150: 1.6e-002 | W150: 9.4e-002 | X150: 9.4e-002 | Y150: 100 | Z150: 2.67 | AA150: 3.3e-003 | AB150: -3.7000000000000002e-003 | AC150: -4.2500000000000003e-002 | AD150: -4.4600000000000001e-002 | AE150: 91.76 | AF150: 99.25 | AG150: 0.52 | AH150: AA | AI150: 4.0099999999999997e-002 | AJ150: =H150+100*O150 -> 135.91499999999999 | AK150: 135.9 | AL150: 112 | AM150: 36.7 | AN150: 65 | AO150: -3.0000000000000001e-003 | AP150: 9 | AQ150: 龙大转债!
A151: 148 | B151: 123062 | C151: 三超转债 | D151: 300554 | E151: 三超新材 | F151: 机械装备 | G151: 通用设备 | H151: 117.325 | I151: -3.2000000000000002e-003 | J151: 1.09e-002 | K151: 17.6 | L151: 1.09e-002 | M151: 119.2 | N151: 17.13 | O151: 0.14199999999999999 | P151: 102.74 | Q151: 转股中 | R151: 4.93年 | S151: 2.94年 | T151: 1.95 | U151: 28 | V151: 0.12 | W151: 0.11800000000000001 | X151: 0.121 | Y151: 16 | Z151: 3.14 | AA151: 3.3e-003 | AB151: -3.4999999999999996e-003 | AC151: -3.8100000000000002e-002 | AD151: -4.0500000000000001e-002 | AE151: 81.71 | AF151: 81.49 | AG151: 0.71 | AH151: A | AI151: 8.2100000000000006e-002 | AJ151: =H151+100*O151 -> 131.52500000000001 | AK151: 131.9 | AL151: 69 | AM151: 50.2 | AN151: 176 | AO151: 2.e-002 | AP151: 25 | AQ151: 三超转债
A152: 56 | B152: 123099 | C152: 普利转债 | D152: 300630 | E152: 普利制药 | F152: 医药 | G152: 化学制药 | H152: 121.503 | I152: -1.06e-002 | J152: -5.8999999999999999e-003 | K152: 43.55 | L152: -2.86e-002 | M152: 123.5 | N152: 46.03 | O152: 0.28399999999999997 | P152: 94.61 | Q152: 3.5天 | R152: 5.47年 | S152: 3.48年 | T152: 8.5 | U152: 3.5 | V152: 3.0000000000000001e-003 | W152: 4.4999999999999998e-002 | X152: 4.2000000000000003e-002 | Y152: 190 | Z152: 8.67 | AA152: 3.0000000000000001e-003 | AB152: -4.1999999999999997e-003 | AC152: -4.2599999999999999e-002 | AD152: -4.4500000000000005e-002 | AE152: 83.44 | AF152: 89.17 | AG152: 0.58 | AH152: AA- | AI152: 6.2600000000000003e-002 | AJ152: =H152+100*O152 -> 149.90299999999999 | AK152: 148.4 | AL152: 219 | AM152: 59.2 | AN152: 244 | AO152: -4.2999999999999997e-002 | AP152: 5 | AQ152: 普利转债
A153: 253 | B153: 110060 | C153: 天路转债! | D153: 600326 | E153: 西藏天路 | F153: 建筑 | G153: 水泥 | H153: 113.55 | I153: -1.26e-002 | J153: 1.7600000000000001e-002 | K153: 6.67 | L153: 1.06e-002 | M153: 114.9 | N153: 7.08 | O153: 0.20499999999999999 | P153: 94.21 | Q153: 转股中 | R153: 4.19年 | S153: 2.19年 | T153: 7.06 | U153: 15 | V153: 1.9e-002 | W153: 0.115 | X153: 0.109 | Y153: 61 | Z153: 1.41 | AA153: 2.8999999999999998e-003 | AB153: -3.4999999999999996e-003 | AC153: -3.9399999999999998e-002 | AD153: -4.2000000000000003e-002 | AE153: 94.35 | AF153: 97.81 | AG153: 0.47 | AH153: AA | AI153: 4.0099999999999997e-002 | AJ153: =H153+100*O153 -> 134.05000000000001 | AK153: 132.9 | AL153: 76 | AM153: 35.1 | AN153: 53 | AO153: 1.7000000000000001e-002 | AP153: 13 | AQ153: 天路转债!
A154: 190 | B154: 128107 | C154: 交科转债 | D154: 2061 | E154: 浙江交科 | F154: 建筑 | G154: 建筑工程 | H154: 113.497 | I154: 0. | J154: 8.3000000000000001e-003 | K154: 5.2 | L154: 1.5600000000000001e-002 | M154: 114.9 | N154: 5.24 | O154: 0.14400000000000002 | P154: 99.24 | Q154: 转股中 | R154: 4.67年 | S154: 2.67年 | T154: 25 | U154: 41 | V154: 1.4999999999999999e-002 | W154: 0.34899999999999998 | X154: 0.34700000000000003 | Y154: 72 | Z154: 0.83 | AA154: 2.7000000000000001e-003 | AB154: -3.0000000000000001e-003 | AC154: -3.2500000000000001e-002 | AD154: -3.4700000000000002e-002 | AE154: 93.84 | AF154: 98.11 | AG154: 0.53 | AH154: AA+ | AI154: 3.5099999999999999e-002 | AJ154: =H154+100*O154 -> 127.89700000000001 | AK154: 127.8 | AL154: 32 | AM154: 29.6 | AN154: 26 | AO154: 2.9999999999999999e-002 | AP154: 19 | AQ154: 交科转债
A155: 211 | B155: 123045 | C155: 雷迪转债 | D155: 300652 | E155: 雷迪克 | F155: 汽车 | G155: 零部件制 | H155: 117.52 | I155: -6.9999999999999993e-003 | J155: 1.1899999999999999e-002 | K155: 19.24 | L155: 7.9000000000000008e-003 | M155: 118.9 | N155: 19.63 | O155: 0.19899999999999998 | P155: 98.01 | Q155: 转股中 | R155: 4.56年 | S155: 2.56年 | T155: 1.66 | U155: 8.4 | V155: 4.2999999999999997e-002 | W155: 9.1999999999999998e-002 | X155: 8.9999999999999997e-002 | Y155: 18 | Z155: 1.91 | AA155: 2.5999999999999999e-003 | AB155: -4.5999999999999999e-003 | AC155: -4.4000000000000004e-002 | AD155: -4.6699999999999998e-002 | AE155: 86.26 | AF155: 87.24 | AG155: 0.62 | AH155: A+ | AI155: 7.2099999999999997e-002 | AJ155: =H155+100*O155 -> 137.41999999999999 | AK155: 137 | AL155: 120 | AM155: 49.8 | AN155: 172 | AO155: 3.7999999999999999e-002 | AP155: 35 | AQ155: 雷迪转债
A156: 112 | B156: 113605 | C156: 大参转债! | D156: 603233 | E156: 大参林 | F156: 医药 | G156: 医药商业 | H156: 113.91 | I156: -1.18e-002 | J156: 6.8999999999999999e-003 | K156: 48.38 | L156: -2.0299999999999999e-002 | M156: 115.2 | N156: 69.09 | O156: 0.627 | P156: 70.02 | Q156: 转股中 | R156: 5.17年 | S156: 3.17年 | T156: 14 | U156: 5.8 | V156: 4.0000000000000001e-003 | W156: 3.7000000000000005e-002 | X156: 2.6000000000000002e-002 | Y156: 382 | Z156: 5.95 | AA156: 2.2000000000000001e-003 | AB156: -3.0000000000000001e-003 | AC156: -2.7999999999999997e-002 | AD156: -2.9999999999999999e-002 | AE156: 90.63 | AF156: 93.71 | AG156: 0.24 | AH156: AA | AI156: 4.1599999999999998e-002 | AJ156: =H156+100*O156 -> 176.61000000000001 | AK156: 157.8 | AL156: 278 | AM156: 64.1 | AN156: 265 | AO156: 9.0999999999999998e-002 | AP156: 7 | AQ156: 大参转债!
A157: 335 | B157: 113508 | C157: 新凤转债!!* | D157: 603225 | E157: 新凤鸣 | F157: 服装纺织 | G157: 纺织行业 | H157: 110.7 | I157: -3.2300000000000002e-002 | J157: 3.7000000000000002e-003 | K157: 17.36 | L157: -2.9600000000000001e-002 | M157: 111.3 | N157: 15.65 | O157: -2.e-003 | P157: 110.93 | Q157: 转股中 | R157: 2.68年 | S157: 0.68年 | T157: 8.85 | U157: 130 | V157: 0.13200000000000001 | W157: 3.6000000000000004e-002 | X157: 4.0000000000000001e-002 | Y157: 243 | Z157: 1.89 | AA157: 2.0999999999999999e-003 | AB157: -5.6999999999999993e-003 | AC157: -9.4299999999999995e-002 | AD157: -0.10099999999999999 | AE157: 98.58 | AF157: 100.69 | AG157: 0.97 | AH157: AA | AI157: 3.8699999999999998e-002 | AJ157: =H157+100*O157 -> 110.5 | AK157: 110.5 | AL157: 2 | AM157: 9.8 | AN157: 1 | AO157: -0.13699999999999998 | AP157: 22 | AQ157: 新凤转债!!*
A158: 347 | B158: 110041 | C158: 蒙电转债! | D158: 600863 | E158: 内蒙华电 | F158: 能源电力 | G158: 电力供应 | H158: 108.94 | I158: -5.0000000000000001e-003 | J158: -3.4999999999999996e-003 | K158: 2.31 | L158: -2.53e-002 | M158: 109.3 | N158: 2.56 | O158: 0.20699999999999999 | P158: 90.23 | Q158: 转股中 | R158: 2.34年 | S158: 0.34年 | T158: 18.7 | U158: 9.4 | V158: 5.0000000000000001e-003 | W158: 0.13900000000000001 | X158: 0.126 | Y158: 134 | Z158: 1.21 | AA158: 1.4000000000000002e-003 | AB158: -6.0000000000000001e-003 | AC158: -0.13900000000000001 | AD158: -0.14499999999999999 | AE158: 100.21 | AF158: 101.75 | AG158: 0.34 | AH158: AAA | AI158: 3.1699999999999999e-002 | AJ158: =H158+100*O158 -> 129.63999999999999 | AK158: 127.6 | AL158: 31 | AM158: 25.9 | AN158: 9 | AO158: -2.e-003 | AP158: 14 | AQ158: 蒙电转债!
A159: 52 | B159: 113045 | C159: 环旭转债! | D159: 601231 | E159: 环旭电子 | F159: 电子 | G159: 电子产品 | H159: 111.2 | I159: -1.6000000000000001e-003 | J159: 3.4000000000000002e-003 | K159: 13.92 | L159: 7.1999999999999998e-003 | M159: 112 | N159: 19.75 | O159: 0.57799999999999996 | P159: 70.48 | Q159: 3月22天 | R159: 5.54年 | S159: 2.54年 | T159: 34.5 | U159: 3 | V159: 1.e-003 | W159: 0.11199999999999999 | X159: 7.9000000000000001e-002 | Y159: 308 | Z159: 2.49 | AA159: 1.2999999999999999e-003 | AB159: -2.5999999999999999e-003 | AC159: -2.8300000000000002e-002 | AD159: -3.0299999999999997e-002 | AE159: 93.38 | AF159: 92.02 | AG159: 0.24 | AH159: AA+ | AI159: 3.6600000000000001e-002 | AJ159: =H159+100*O159 -> 169. | AK159: 151.9 | AL159: 244 | AM159: 58.5 | AN159: 240 | AO159: -1.3999999999999999e-002 | AP159: 5 | AQ159: 环旭转债!
A160: 316 | B160: 110047 | C160: 山鹰转债 | D160: 600567 | E160: 山鹰国际 | F160: 造纸包装 | G160: 包装用纸 | H160: 117.11 | I160: -5.1000000000000004e-003 | J160: 8.0000000000000002e-003 | K160: 3.39 | L160: 5.8999999999999999e-003 | M160: 117.5 | N160: 3.3 | O160: 0.14000000000000001 | P160: 102.73 | Q160: 转股中 | R160: 3.25年 | S160: 1.26年 | T160: 22.5 | U160: 28 | V160: 1.1000000000000001e-002 | W160: 0.14400000000000002 | X160: 0.14699999999999999 | Y160: 156 | Z160: 1 | AA160: 1.e-003 | AB160: -8.3999999999999995e-003 | AC160: -8.8200000000000001e-002 | AD160: -9.1600000000000001e-002 | AE160: 97.96 | AF160: 105.28 | AG160: 0.48 | AH160: AA+ | AI160: 3.5099999999999999e-002 | AJ160: =H160+100*O160 -> 131.11000000000001 | AK160: 131.5 | AL160: 59 | AM160: 26.2 | AN160: 12 | AO160: 2.5000000000000001e-002 | AP160: 29 | AQ160: 山鹰转债
A161: 324 | B161: 128042 | C161: 凯中转债! | D161: 2823 | E161: 凯中精密 | F161: 能源电力 | G161: 电力设备 | H161: 114.986 | I161: -1.e-004 | J161: 2.3999999999999998e-003 | K161: 12.12 | L161: 5.7999999999999996e-003 | M161: 115.3 | N161: 12.86 | O161: 0.22 | P161: 94.25 | Q161: 转股中 | R161: 2.94年 | S161: 0.94年 | T161: 4.16 | U161: 12 | V161: 2.5000000000000001e-002 | W161: 0.11900000000000001 | X161: 0.113 | Y161: 35 | Z161: 2.56 | AA161: 8.9999999999999998e-004 | AB161: -8.3000000000000001e-003 | AC161: -0.10199999999999999 | AD161: -0.105 | AE161: 97.61 | AF161: 103.28 | AG161: 0.39 | AH161: AA | AI161: 3.8699999999999998e-002 | AJ161: =H161+100*O161 -> 136.98599999999999 | AK161: 135.7 | AL161: 110 | AM161: 32.4 | AN161: 41 | AO161: 3.4000000000000002e-002 | AP161: 26 | AQ161: 凯中转债!
A162: 215 | B162: 110067 | C162: 华安转债! | D162: 600909 | E162: 华安证券 | F162: 金融 | G162: 证券行业 | H162: 109.91 | I162: 1.5e-003 | J162: 8.6999999999999994e-003 | K162: 5.44 | L162: 2.4500000000000001e-002 | M162: 110.3 | N162: 6.22 | O162: 0.25700000000000001 | P162: 87.46 | Q162: 转股中 | R162: 4.56年 | S162: 无权 | T162: 28 | U162: 42 | V162: 1.3999999999999999e-002 | W162: 0.11 | X162: 9.6000000000000002e-002 | Y162: 256 | Z162: 1.38 | AA162: 8.0000000000000004e-004 | AB162: -3.4000000000000002e-003 | AC162: 无权 | AD162: 无权 | AE162: 无权 | AF162: 95.27 | AG162: 0.42 | AH162: AAA | AI162: 3.3099999999999997e-002 | AJ162: =H162+100*O162 -> 135.60999999999999 | AK162: 132.4 | AL162: 73 | AM162: 37.1 | AN162: 71 | AO162: 4.9000000000000002e-002 | AP162: 28 | AQ162: 华安转债!
A163: 84 | B163: 113043 | C163: 财通转债! | D163: 601108 | E163: 财通证券 | F163: 金融 | G163: 证券行业 | H163: 109.89 | I163: -2.9999999999999997e-004 | J163: 1.7000000000000001e-003 | K163: 10.56 | L163: 3.8e-003 | M163: 110.2 | N163: 13.13 | O163: 0.36599999999999999 | P163: 80.43 | Q163: 转股中 | R163: 5.31年 | S163: 无权 | T163: 38 | U163: 30 | V163: 6.9999999999999993e-003 | W163: 0.10000000000000001 | X163: 8.1000000000000003e-002 | Y163: 379 | Z163: 1.66 | AA163: 5.0000000000000001e-004 | AB163: -3.0000000000000001e-003 | AC163: 无权 | AD163: 无权 | AE163: 无权 | AF163: 92.25 | AG163: 0.38 | AH163: AAA | AI163: 3.4599999999999999e-002 | AJ163: =H163+100*O163 -> 146.49000000000001 | AK163: 139.4 | AL163: 138 | AM163: 47.1 | AN163: 154 | AO163: 5.0000000000000003e-002 | AP163: 11 | AQ163: 财通转债!
A164: 284 | B164: 113024 | C164: 核建转债! | D164: 601611 | E164: 中国核建 | F164: 建筑 | G164: 建筑工程 | H164: 109.26 | I164: 5.0000000000000001e-003 | J164: 1.0200000000000001e-002 | K164: 8.14 | L164: 4.6300000000000001e-002 | M164: 109.3 | N164: 9.7 | O164: 0.30199999999999999 | P164: 83.92 | Q164: 转股中 | R164: 3.63年 | S164: 1.63年 | T164: 30 | U164: 87 | V164: 2.6000000000000002e-002 | W164: 0.13900000000000001 | X164: 0.11699999999999999 | Y164: 216 | Z164: 1.82 | AA164: 1.e-004 | AB164: -4.6999999999999993e-003 | AC164: -3.3500000000000002e-002 | AD164: -3.6400000000000002e-002 | AE164: 96.99 | AF164: 97.34 | AG164: 0.33 | AH164: AAA | AI164: 3.3099999999999997e-002 | AJ164: =H164+100*O164 -> 139.46000000000001 | AK164: 134.6 | AL164: 94 | AM164: 37.3 | AN164: 72 | AO164: 0.13 | AP164: 35 | AQ164: 核建转债!
A165: 8 | B165: 127039 | C165: 北港转债 | D165: 582 | E165: 北部湾港 | F165: 机场高速 | G165: 港口 | H165: 113 | I165: 0. | J165: -3.2000000000000002e-003 | K165: 7.54 | L165: -6.6e-003 | M165: 113 | N165: 8.35 | O165: 0.251 | P165: 90.3 | Q165: 4月18天 | R165: 5.86年 | S165: 3.86年 | T165: 30 | U165: 17 | V165: 5.0000000000000001e-003 | W165: 0.24399999999999999 | X165: 0.22 | Y165: 123 | Z165: 1.17 | AA165: 0. | AB165: -4.0000000000000001e-003 | AC165: -2.1700000000000001e-002 | AD165: -2.3300000000000001e-002 | AE165: 90.35 | AF165: 92.9 | AG165: 0.49 | AH165: AAA | AI165: 3.4599999999999999e-002 | AJ165: =H165+100*O165 -> 138.09999999999999 | AK165: 135.7 | AL165: 108 | AM165: 42.8 | AN165: 132 | AO165: -2.7000000000000003e-002 | AP165: 5 | AQ165: 北港转债
A166: 130 | B166: 128130 | C166: 景兴转债 | D166: 2067 | E166: 景兴纸业 | F166: 造纸包装 | G166: 包装用纸 | H166: 115.198 | I166: -4.7999999999999996e-003 | J166: 4.7999999999999996e-003 | K166: 3.62 | L166: 0. | M166: 115.1 | N166: 3.4 | O166: 8.199999999999999e-002 | P166: 106.47 | Q166: 转股中 | R166: 5年10天 | S166: 3年11天 | T166: 10.7 | U166: 6.7 | V166: 6.0000000000000001e-003 | W166: 0.251 | X166: 0.26700000000000002 | Y166: 43 | Z166: 0.86 | AA166: -2.0000000000000001e-004 | AB166: -5.5000000000000005e-003 | AC166: -3.2899999999999999e-002 | AD166: -3.5000000000000003e-002 | AE166: 91.07 | AF166: 94.16 | AG166: 0.62 | AH166: AA | AI166: 4.1599999999999998e-002 | AJ166: =H166+100*O166 -> 123.398 | AK166: 123.9 | AL166: 13 | AM166: 29.8 | AN166: 27 | AO166: 1.6e-002 | AP166: 16 | AQ166: 景兴转债
A167: 356 | B167: 123002 | C167: 国祯转债!! | D167: 300388 | E167: 节能国祯 | F167: 城市公用 | G167: 三废处理 | H167: 108.861 | I167: -8.8999999999999999e-003 | J167: 8.5000000000000006e-003 | K167: 7.14 | L167: -1.4000000000000002e-003 | M167: 108.8 | N167: 8.36 | O167: 0.27500000000000002 | P167: 85.41 | Q167: 转股中 | R167: 2.26年 | S167: 0.26年 | T167: 2.52 | U167: 1.7 | V167: 6.0000000000000001e-003 | W167: 5.0999999999999997e-002 | X167: 4.2999999999999997e-002 | Y167: 50 | Z167: 1.35 | AA167: -2.9999999999999997e-004 | AB167: -7.4999999999999997e-003 | AC167: -0.16800000000000001 | AD167: -0.17499999999999999 | AE167: 99.91 | AF167: 99.99 | AG167: 0.28 | AH167: AA | AI167: 3.8699999999999998e-002 | AJ167: =H167+100*O167 -> 136.36100000000002 | AK167: 132.3 | AL167: 72 | AM167: 32.3 | AN167: 40 | AO167: -5.0000000000000001e-003 | AP167: 17 | AQ167: 国祯转债!!
A168: 150 | B168: 110073 | C168: 国投转债 | D168: 600061 | E168: 国投资本 | F168: 金融 | G168: 证券行业 | H168: 110.54 | I168: -7.3000000000000001e-003 | J168: 8.8000000000000005e-003 | K168: 8.85 | L168: 3.4000000000000002e-003 | M168: 110.3 | N168: 9.9 | O168: 0.23699999999999999 | P168: 89.39 | Q168: 转股中 | R168: 4.92年 | S168: 无权 | T168: 80 | U168: 67 | V168: 8.0000000000000002e-003 | W168: 0.14099999999999999 | X168: 0.126 | Y168: 569 | Z168: 0.86 | AA168: -4.0000000000000002e-004 | AB168: -4.3e-003 | AC168: 无权 | AD168: 无权 | AE168: 无权 | AF168: 94.14 | AG168: 0.46 | AH168: AAA | AI168: 3.3099999999999997e-002 | AJ168: =H168+100*O168 -> 134.24000000000001 | AK168: 131.7 | AL168: 62 | AM168: 37.5 | AN168: 78 | AO168: 0.121 | AP168: 25 | AQ168: 国投转债
A169: 10 | B169: 123117 | C169: 健帆转债! | D169: 300529 | E169: 健帆生物 | F169: 医药 | G169: 医疗器械 | H169: 115.4 | I169: -9.5999999999999992e-003 | J169: 1.e-003 | K169: 51.74 | L169: -5.8099999999999999e-002 | M169: 115.1 | N169: 90.6 | O169: 1.02 | P169: 57.11 | Q169: 4月11天 | R169: 5.84年 | S169: 3.84年 | T169: 10 | U169: 5.9 | V169: 5.0000000000000001e-003 | W169: 2.4e-002 | X169: 1.3999999999999999e-002 | Y169: 417 | Z169: 13.51 | AA169: -5.0000000000000001e-004 | AB169: -5.1000000000000004e-003 | AC169: -2.6699999999999998e-002 | AD169: -2.8399999999999998e-002 | AE169: 88.11 | AF169: 91.1 | AG169: 0.15 | AH169: AA | AI169: 4.1599999999999998e-002 | AJ169: =H169+100*O169 -> 217.40000000000001 | AK169: 173.7 | AL169: 314 | AM169: 82.6 | AN169: 315 | AO169: -0.158 | AP169: 3 | AQ169: 健帆转债!
A170: 50 | B170: 123101 | C170: 拓斯转债! | D170: 300607 | E170: 拓斯达 | F170: 机械装备 | G170: 机器人及 | H170: 115.5 | I170: 1.6500000000000001e-002 | J170: 3.8699999999999998e-002 | K170: 21.1 | L170: 0.13900000000000001 | M170: 115.1 | N170: 26.19 | O170: 0.434 | P170: 80.57 | Q170: 27天 | R170: 5.55年 | S170: 3.55年 | T170: 6.7 | U170: 662 | V170: 0.82299999999999995 | W170: 7.4999999999999997e-002 | X170: 5.9999999999999998e-002 | Y170: 90 | Z170: 2.5 | AA170: -5.9999999999999995e-004 | AB170: -5.5000000000000005e-003 | AC170: -2.8999999999999998e-002 | AD170: -3.0800000000000001e-002 | AE170: 89.15 | AF170: 92.18 | AG170: 0.4 | AH170: AA | AI170: 4.1599999999999998e-002 | AJ170: =H170+100*O170 -> 158.90000000000001 | AK170: 150.4 | AL170: 232 | AM170: 58.3 | AN170: 237 | AO170: 0.115 | AP170: 5 | AQ170: 拓斯转债!
A171: 58 | B171: 123097 | C171: 美力转债 | D171: 300611 | E171: 美力科技 | F171: 机械装备 | G171: 通用设备 | H171: 122.098 | I171: -2.5000000000000001e-003 | J171: 1.29e-002 | K171: 10.95 | L171: 1.3899999999999999e-002 | M171: 121.6 | N171: 9.28 | O171: 3.5000000000000003e-002 | P171: 118 | Q171: 转股中 | R171: 5.44年 | S171: 3.44年 | T171: 3 | U171: 14 | V171: 3.9e-002 | W171: 0.153 | X171: 0.18100000000000002 | Y171: 20 | Z171: 2.95 | AA171: -8.0000000000000004e-004 | AB171: -7.4999999999999997e-003 | AC171: -4.2500000000000003e-002 | AD171: -4.4699999999999997e-002 | AE171: 81.25 | AF171: 83.44 | AG171: 0.75 | AH171: A+ | AI171: 7.3599999999999999e-002 | AJ171: =H171+100*O171 -> 125.598 | AK171: 126.2 | AL171: 24 | AM171: 42.8 | AN171: 131 | AO171: 1.6e-002 | AP171: 20 | AQ171: 美力转债
A172: 244 | B172: 110062 | C172: 烽火转债! | D172: 600498 | E172: 烽火通信 | F172: 通信互联 | G172: 通信设备 | H172: 111.32 | I172: -8.8000000000000005e-003 | J172: 2.3999999999999998e-003 | K172: 19.08 | L172: -1.8500000000000003e-002 | M172: 110.8 | N172: 22.85 | O172: 0.33299999999999996 | P172: 83.5 | Q172: 转股中 | R172: 4.28年 | S172: 2.29年 | T172: 30.9 | U172: 7.3 | V172: 2.e-003 | W172: 0.14300000000000002 | X172: 0.11900000000000001 | Y172: 216 | Z172: 2 | AA172: -1.1000000000000001e-003 | AB172: -5.7999999999999996e-003 | AC172: -3.0299999999999997e-002 | AD172: -3.2799999999999996e-002 | AE172: 95.45 | AF172: 96.66 | AG172: 0.35 | AH172: AAA | AI172: 3.3099999999999997e-002 | AJ172: =H172+100*O172 -> 144.62 | AK172: 139.1 | AL172: 136 | AM172: 42.5 | AN172: 126 | AO172: -3.4000000000000002e-002 | AP172: 19 | AQ172: 烽火转债!
A173: 42 | B173: 128145 | C173: 日丰转债 | D173: 2953 | E173: 日丰股份 | F173: 家电 | G173: 零部件制 | H173: 116.1 | I173: 3.4999999999999996e-003 | J173: 1.03e-002 | K173: 13.8 | L173: 2.e-002 | M173: 115.4 | N173: 13.66 | O173: 0.14899999999999999 | P173: 101.02 | Q173: 38天 | R173: 5.59年 | S173: 3.59年 | T173: 3.8 | U173: 5.5 | V173: 1.3000000000000001e-002 | W173: 0.113 | X173: 0.114 | Y173: 34 | Z173: 2.24 | AA173: -1.1000000000000001e-003 | AB173: -6.0000000000000001e-003 | AC173: -2.98e-002 | AD173: -3.1600000000000003e-002 | AE173: 82.77 | AF173: 82.77 | AG173: 0.69 | AH173: AA- | AI173: 6.2600000000000003e-002 | AJ173: =H173+100*O173 -> 131. | AK173: 131.2 | AL173: 55 | AM173: 48.4 | AN173: 165 | AO173: 1.3000000000000001e-002 | AP173: 7 | AQ173: 日丰转债
A174: 292 | B174: 127012 | C174: 招路转债! | D174: 1965 | E174: 招商公路 | F174: 机场高速 | G174: 高速 | H174: 108.35 | I174: 1.4000000000000002e-003 | J174: 6.5000000000000006e-003 | K174: 7.29 | L174: 2.3900000000000001e-002 | M174: 107.9 | N174: 8.63 | O174: 0.28300000000000003 | P174: 84.47 | Q174: 转股中 | R174: 3.59年 | S174: 1.59年 | T174: 50 | U174: 14 | V174: 3.0000000000000001e-003 | W174: 0.111 | X174: 9.4e-002 | Y174: 450 | Z174: 0.9 | AA174: -1.1999999999999999e-003 | AB174: -5.3e-003 | AC174: -3.5900000000000001e-002 | AD174: -3.7699999999999997e-002 | AE174: 96.04 | AF174: 96.15 | AG174: 0.33 | AH174: AAA | AI174: 3.3099999999999997e-002 | AJ174: =H174+100*O174 -> 136.65000000000001 | AK174: 132.2 | AL174: 71 | AM174: 36.1 | AN174: 64 | AO174: 4.9000000000000002e-002 | AP174: 30 | AQ174: 招路转债!
A175: 34 | B175: 123109 | C175: 昌红转债 | D175: 300151 | E175: 昌红科技 | F175: 机械装备 | G175: 专用设备 | H175: 121.845 | I175: -2.7900000000000001e-002 | J175: 4.4600000000000001e-002 | K175: 28.25 | L175: 2.6200000000000001e-002 | M175: 121 | N175: 28.06 | O175: 0.20999999999999999 | P175: 100.68 | Q175: 49天 | R175: 5.61年 | S175: 3.62年 | T175: 4.6 | U175: 79 | V175: 0.13900000000000001 | W175: 3.2000000000000001e-002 | X175: 3.3000000000000002e-002 | Y175: 142 | Z175: 13.28 | AA175: -1.2999999999999999e-003 | AB175: -7.6e-003 | AC175: -4.1599999999999998e-002 | AD175: -4.3400000000000001e-002 | AE175: 82.8 | AF175: 86.66 | AG175: 0.64 | AH175: AA- | AI175: 6.2600000000000003e-002 | AJ175: =H175+100*O175 -> 142.845 | AK175: 143 | AL175: 178 | AM175: 56.4 | AN175: 224 | AO175: 0.14699999999999999 | AP175: 4 | AQ175: 昌红转债
A176: 233 | B176: 128091 | C176: 新天转债 | D176: 2873 | E176: 新天药业 | F176: 医药 | G176: 中药 | H176: 120.088 | I176: -8.8000000000000005e-003 | J176: -3.0999999999999999e-003 | K176: 16.28 | L176: -1.8700000000000001e-002 | M176: 119.4 | N176: 16.27 | O176: 0.20000000000000001 | P176: 100.06 | Q176: 转股中 | R176: 4.36年 | S176: 2.36年 | T176: 1.76 | U176: 10 | V176: 4.9000000000000002e-002 | W176: 9.1999999999999998e-002 | X176: 9.1999999999999998e-002 | Y176: 19 | Z176: 2.34 | AA176: -1.4000000000000002e-003 | AB176: -9.0000000000000011e-003 | AC176: -5.4299999999999994e-002 | AD176: -5.74e-002 | AE176: 87.85 | AF176: 88.89 | AG176: 0.63 | AH176: A+ | AI176: 7.2099999999999997e-002 | AJ176: =H176+100*O176 -> 140.08799999999999 | AK176: 140.1 | AL176: 148 | AM176: 51.2 | AN176: 182 | AO176: -3.2000000000000001e-002 | AP176: 19 | AQ176: 新天转债
A177: 197 | B177: 128106 | C177: 华统转债 | D177: 2840 | E177: 华统股份 | F177: 农业 | G177: 农产品加 | H177: 113.666 | I177: 3.0999999999999999e-003 | J177: -6.6e-003 | K177: 8.98 | L177: -6.6e-003 | M177: 112.9 | N177: 9.37 | O177: 0.18600000000000003 | P177: 95.84 | Q177: 转股中 | R177: 4.64年 | S177: 2.64年 | T177: 5.35 | U177: 13 | V177: 2.2000000000000002e-002 | W177: 0.13300000000000001 | X177: 0.128 | Y177: 40 | Z177: 2.28 | AA177: -1.5e-003 | AB177: -6.5000000000000006e-003 | AC177: -3.3399999999999999e-002 | AD177: -3.5699999999999996e-002 | AE177: 92.7 | AF177: 94.43 | AG177: 0.53 | AH177: AA | AI177: 4.0099999999999997e-002 | AJ177: =H177+100*O177 -> 132.26599999999999 | AK177: 131.5 | AL177: 60 | AM177: 37.1 | AN177: 69 | AO177: 2.4e-002 | AP177: 9 | AQ177: 华统转债
A178: 77 | B178: 123087 | C178: 明电转债! | D178: 300739 | E178: 明阳电路 | F178: 电子 | G178: 元器件制 | H178: 122.2 | I178: -1.29e-002 | J178: -3.9000000000000003e-003 | K178: 18.5 | L178: -2.3700000000000002e-002 | M178: 121.2 | N178: 16.32 | O178: 7.8e-002 | P178: 113.36 | Q178: 转股中 | R178: 5.32年 | S178: 4.32年 | T178: 4.19 | U178: 138 | V178: 0.26800000000000002 | W178: 7.6999999999999999e-002 | X178: 8.6999999999999994e-002 | Y178: 55 | Z178: 3.65 | AA178: -1.6000000000000001e-003 | AB178: -8.3000000000000001e-003 | AC178: -3.0299999999999997e-002 | AD178: -3.2899999999999999e-002 | AE178: 81.67 | AF178: 88.4 | AG178: 0.71 | AH178: AA- | AI178: 6.2600000000000003e-002 | AJ178: =H178+100*O178 -> 130. | AK178: 131 | AL178: 53 | AM178: 42.6 | AN178: 128 | AO178: -0.11800000000000001 | AP178: 19 | AQ178: 明电转债!
A179: 255 | B179: 127014 | C179: 北方转债! | D179: 65 | E179: 北方国际 | F179: 建筑 | G179: 建筑工程 | H179: 116.01 | I179: -1.0800000000000001e-002 | J179: -2.9999999999999997e-004 | K179: 7.83 | L179: -2.7300000000000001e-002 | M179: 115.1 | N179: 8.65 | O179: 0.28199999999999997 | P179: 90.52 | Q179: 转股中 | R179: 4.18年 | S179: 2.18年 | T179: 5.34 | U179: 157 | V179: 0.25 | W179: 8.8000000000000009e-002 | X179: 8.0000000000000002e-002 | Y179: 61 | Z179: 1.08 | AA179: -1.9e-003 | AB179: -8.3999999999999995e-003 | AC179: -4.7699999999999992e-002 | AD179: -5.04e-002 | AE179: 95.65 | AF179: 99.99 | AG179: 0.41 | AH179: AA+ | AI179: 3.5099999999999999e-002 | AJ179: =H179+100*O179 -> 144.21000000000001 | AK179: 141.5 | AL179: 160 | AM179: 41.5 | AN179: 118 | AO179: 5.2000000000000005e-002 | AP179: 19 | AQ179: 北方转债!
A180: 322 | B180: 113516 | C180: 苏农转债! | D180: 603323 | E180: 苏农银行 | F180: 金融 | G180: 银行行业 | H180: 114.01 | I180: -2.5999999999999999e-003 | J180: 3.4000000000000002e-003 | K180: 4.93 | L180: 2.e-003 | M180: 113.3 | N180: 5.37 | O180: 0.24199999999999999 | P180: 91.81 | Q180: 转股中 | R180: 2.95年 | S180: 无权 | T180: 12.9 | U180: 22 | V180: 1.4999999999999999e-002 | W180: 0.14499999999999999 | X180: 0.13300000000000001 | Y180: 89 | Z180: 0.73 | AA180: -2.0999999999999999e-003 | AB180: -1.0200000000000001e-002 | AC180: 无权 | AD180: 无权 | AE180: 无权 | AF180: 102.89 | AG180: 0.37 | AH180: AA+ | AI180: 3.3700000000000001e-002 | AJ180: =H180+100*O180 -> 138.21000000000001 | AK180: 136.2 | AL180: 114 | AM180: 33.3 | AN180: 47 | AO180: 3.9e-002 | AP180: 27 | AQ180: 苏农转债!
A181: 73 | B181: 123090 | C181: 三诺转债 | D181: 300298 | E181: 三诺生物 | F181: 医药 | G181: 医疗器械 | H181: 118.512 | I181: -3.3e-003 | J181: 4.8999999999999998e-003 | K181: 28.2 | L181: 4.3e-003 | M181: 117.1 | N181: 35.18 | O181: 0.47799999999999998 | P181: 80.16 | Q181: 转股中 | R181: 5.34年 | S181: 3.34年 | T181: 5 | U181: 9.9 | V181: 1.7000000000000001e-002 | W181: 3.1e-002 | X181: 2.5000000000000001e-002 | Y181: 159 | Z181: 5.98 | AA181: -2.3e-003 | AB181: -7.9000000000000008e-003 | AC181: -3.7999999999999999e-002 | AD181: -3.9800000000000002e-002 | AE181: 89.93 | AF181: 94.6 | AG181: 0.37 | AH181: AA | AI181: 4.1599999999999998e-002 | AJ181: =H181+100*O181 -> 166.31200000000001 | AK181: 156.9 | AL181: 274 | AM181: 62.3 | AN181: 259 | AO181: -3.3000000000000002e-002 | AP181: 4 | AQ181: 三诺转债
A182: 74 | B182: 128142 | C182: 新乳转债! | D182: 2946 | E182: 新乳业 | F182: 食品饮料 | G182: 乳制品 | H182: 116.59 | I182: -6.8000000000000005e-003 | J182: 1.9599999999999999e-002 | K182: 13.96 | L182: 4.0199999999999993e-002 | M182: 115.1 | N182: 18.47 | O182: 0.54299999999999993 | P182: 75.58 | Q182: 转股中 | R182: 5.33年 | S182: 3.33年 | T182: 7.18 | U182: 2.7 | V182: 3.0000000000000001e-003 | W182: 5.9000000000000004e-002 | X182: 4.4999999999999998e-002 | Y182: 121 | Z182: 4.66 | AA182: -2.5000000000000001e-003 | AB182: -7.4999999999999997e-003 | AC182: -3.3500000000000002e-002 | AD182: -3.5400000000000001e-002 | AE182: 89.97 | AF182: 93.02 | AG182: 0.32 | AH182: AA | AI182: 4.1599999999999998e-002 | AJ182: =H182+100*O182 -> 170.88999999999999 | AK182: 157.6 | AL182: 277 | AM182: 64.6 | AN182: 267 | AO182: -1.1000000000000001e-002 | AP182: 4 | AQ182: 新乳转债!
A183: 35 | B183: 123110 | C183: 九典转债 | D183: 300705 | E183: 九典制药 | F183: 医药 | G183: 化学制药 | H183: 123.13 | I183: -1.1399999999999999e-002 | J183: -4.4000000000000003e-003 | K183: 28.2 | L183: -2.1899999999999999e-002 | M183: 121.4 | N183: 26.44 | O183: 0.154 | P183: 106.66 | Q183: 49天 | R183: 5.61年 | S183: 3.62年 | T183: 2.7 | U183: 30 | V183: 8.9999999999999997e-002 | W183: 4.0999999999999995e-002 | X183: 4.4000000000000004e-002 | Y183: 66 | Z183: 7.05 | AA183: -2.5999999999999999e-003 | AB183: -9.0000000000000011e-003 | AC183: -4.3099999999999999e-002 | AD183: -4.5199999999999997e-002 | AE183: 80.06 | AF183: 82.23 | AG183: 0.72 | AH183: A+ | AI183: 7.3599999999999999e-002 | AJ183: =H183+100*O183 -> 138.53 | AK183: 139.6 | AL183: 142 | AM183: 57.4 | AN183: 230 | AO183: 4.0000000000000001e-003 | AP183: 7 | AQ183: 九典转债
A184: 22 | B184: 111000 | C184: 起帆转债 | D184: 605222 | E184: 起帆电缆 | F184: 能源电力 | G184: 电力设备 | H184: 122.5 | I184: 5.8999999999999999e-003 | J184: 7.4000000000000003e-003 | K184: 22.93 | L184: 1.8700000000000001e-002 | M184: 120.5 | N184: 20.53 | O184: 9.6999999999999989e-002 | P184: 111.69 | Q184: 3月11天 | R184: 5.76年 | S184: 3.76年 | T184: 10 | U184: 28 | V184: 2.3e-002 | W184: 0.109 | X184: 0.122 | Y184: 92 | Z184: 3.15 | AA184: -2.8999999999999998e-003 | AB184: -9.0000000000000011e-003 | AC184: -4.1599999999999998e-002 | AD184: -4.3299999999999998e-002 | AE184: 82.01 | AF184: 85.52 | AG184: 0.71 | AH184: AA- | AI184: 6.2600000000000003e-002 | AJ184: =H184+100*O184 -> 132.19999999999999 | AK184: 133.3 | AL184: 82 | AM184: 47.8 | AN184: 159 | AO184: 7.400000000000001e-002 | AP184: 9 | AQ184: 起帆转债
A185: 20 | B185: 127035 | C185: 濮耐转债 | D185: 2225 | E185: 濮耐股份 | F185: 钢铁 | G185: 钢铁行业 | H185: 116.6 | I185: -3.04e-002 | J185: -8.1000000000000013e-003 | K185: 4.34 | L185: -7.0699999999999999e-002 | M185: 114.7 | N185: 4.43 | O185: 0.19 | P185: 97.97 | Q185: 3月13天 | R185: 4.76年 | S185: 2.77年 | T185: 6.26 | U185: 66 | V185: 9.0999999999999998e-002 | W185: 0.14300000000000002 | X185: 0.14000000000000001 | Y185: 44 | Z185: 1.44 | AA185: -3.4999999999999996e-003 | AB185: -9.0000000000000011e-003 | AC185: -4.0399999999999998e-002 | AD185: -4.2500000000000003e-002 | AE185: 92.23 | AF185: 95.48 | AG185: 0.55 | AH185: AA | AI185: 4.0099999999999997e-002 | AJ185: =H185+100*O185 -> 135.59999999999999 | AK185: 135.2 | AL185: 99 | AM185: 39.8 | AN185: 94 | AO185: -5.5e-002 | AP185: 10 | AQ185: 濮耐转债
A186: 234 | B186: 128090 | C186: 汽模转2 | D186: 2510 | E186: 天汽模 | F186: 汽车 | G186: 零部件制 | H186: 116.69 | I186: -1.2800000000000001e-002 | J186: 2.7000000000000001e-003 | K186: 4.26 | L186: -1.6200000000000003e-002 | M186: 114.9 | N186: 4.23 | O186: 0.159 | P186: 100.71 | Q186: 转股中 | R186: 4.35年 | S186: 2.35年 | T186: 3.1 | U186: 29 | V186: 8.0000000000000002e-002 | W186: 7.6999999999999999e-002 | X186: 7.8e-002 | Y186: 40 | Z186: 1.99 | AA186: -3.5999999999999999e-003 | AB186: -9.7000000000000003e-003 | AC186: -4.7300000000000002e-002 | AD186: -4.9699999999999994e-002 | AE186: 89.19 | AF186: 89.26 | AG186: 0.62 | AH186: AA- | AI186: 6.1100000000000002e-002 | AJ186: =H186+100*O186 -> 132.59 | AK186: 132.7 | AL186: 75 | AM186: 43.4 | AN186: 136 | AO186: 1.3999999999999999e-002 | AP186: 30 | AQ186: 汽模转2
A187: 86 | B187: 127026 | C187: 超声转债! | D187: 823 | E187: 超声电子 | F187: 电子 | G187: 元器件制 | H187: 115.3 | I187: -3.0999999999999999e-003 | J187: 2.7000000000000001e-003 | K187: 11.47 | L187: -8.9999999999999998e-004 | M187: 113.1 | N187: 12.72 | O187: 0.27899999999999997 | P187: 90.17 | Q187: 转股中 | R187: 5.30年 | S187: 3.30年 | T187: 7 | U187: 7.1 | V187: 9.0000000000000011e-003 | W187: 0.114 | X187: 0.10199999999999999 | Y187: 62 | Z187: 1.61 | AA187: -3.7000000000000002e-003 | AB187: -8.1000000000000013e-003 | AC187: -3.0600000000000002e-002 | AD187: -3.2500000000000001e-002 | AE187: 90.07 | AF187: 91.52 | AG187: 0.51 | AH187: AA | AI187: 4.1599999999999998e-002 | AJ187: =H187+100*O187 -> 143.19999999999999 | AK187: 140.4 | AL187: 151 | AM187: 48.9 | AN187: 168 | AO187: -1.3999999999999999e-002 | AP187: 13 | AQ187: 超声转债!
A188: 241 | B188: 110063 | C188: 鹰19转债 | D188: 600567 | E188: 山鹰国际 | F188: 造纸包装 | G188: 包装用纸 | H188: 117.91 | I188: -2.8000000000000004e-003 | J188: 6.0999999999999995e-003 | K188: 3.39 | L188: 5.8999999999999999e-003 | M188: 115.9 | N188: 3.26 | O188: 0.13400000000000001 | P188: 103.99 | Q188: 转股中 | R188: 4.31年 | S188: 2.32年 | T188: 18.5 | U188: 11 | V188: 5.0000000000000001e-003 | W188: 0.11800000000000001 | X188: 0.12300000000000001 | Y188: 156 | Z188: 1 | AA188: -4.0999999999999995e-003 | AB188: -1.0500000000000001e-002 | AC188: -5.2600000000000001e-002 | AD188: -5.4900000000000004e-002 | AE188: 94.84 | AF188: 100.17 | AG188: 0.56 | AH188: AA+ | AI188: 3.5099999999999999e-002 | AJ188: =H188+100*O188 -> 131.31 | AK188: 131.8 | AL188: 63 | AM188: 31.7 | AN188: 36 | AO188: 2.5000000000000001e-002 | AP188: 32 | AQ188: 鹰19转债
A189: 216 | B189: 113570 | C189: 百达转债! | D189: 603331 | E189: 百达精工 | F189: 机械装备 | G189: 机械装备 | H189: 117.19 | I189: -5.8999999999999999e-003 | J189: 8.199999999999999e-003 | K189: 11.95 | L189: 3.4000000000000002e-003 | M189: 114.9 | N189: 11.34 | O189: 0.11199999999999999 | P189: 105.38 | Q189: 转股中 | R189: 4.55年 | S189: 2.56年 | T189: 2.8 | U189: 13 | V189: 4.0000000000000001e-002 | W189: 0.13100000000000001 | X189: 0.13900000000000001 | Y189: 21 | Z189: 2.54 | AA189: -4.4000000000000003e-003 | AB189: -1.0200000000000001e-002 | AC189: -4.53e-002 | AD189: -4.7500000000000001e-002 | AE189: 85.7 | AF189: 84.24 | AG189: 0.7 | AH189: A+ | AI189: 7.2099999999999997e-002 | AJ189: =H189+100*O189 -> 128.38999999999999 | AK189: 129 | AL189: 40 | AM189: 43.3 | AN189: 135 | AO189: 9.6999999999999989e-002 | AP189: 34 | AQ189: 百达转债!
A190: 334 | B190: 128039 | C190: 三力转债! | D190: 2224 | E190: 三 力 士 | F190: 机械装备 | G190: 专用设备 | H190: 110.217 | I190: -6.9999999999999993e-003 | J190: 4.0000000000000001e-003 | K190: 4.94 | L190: -8.0000000000000002e-003 | M190: 108.8 | N190: 5.79 | O190: 0.29199999999999998 | P190: 85.32 | Q190: 转股中 | R190: 2.80年 | S190: 0.80年 | T190: 2.02 | U190: 8.6 | V190: 3.7999999999999999e-002 | W190: 5.5999999999999994e-002 | X190: 4.8000000000000001e-002 | Y190: 36 | Z190: 1.57 | AA190: -4.6999999999999993e-003 | AB190: -1.0500000000000001e-002 | AC190: -8.14e-002 | AD190: -8.43e-002 | AE190: 96.03 | AF190: 92.71 | AG190: 0.37 | AH190: AA- | AI190: 5.9699999999999996e-002 | AJ190: =H190+100*O190 -> 139.417 | AK190: 135.1 | AL190: 97 | AM190: 39.1 | AN190: 90 | AO190: -4.0000000000000001e-002 | AP190: 30 | AQ190: 三力转债!
A191: 75 | B191: 128141 | C191: 旺能转债 | D191: 2034 | E191: 旺能环境 | F191: 城市公用 | G191: 三废处理 | H191: 117.995 | I191: -1.01e-002 | J191: -1.9e-003 | K191: 17.1 | L191: -1.89e-002 | M191: 115.1 | N191: 15.97 | O191: 0.10199999999999999 | P191: 107.08 | Q191: 转股中 | R191: 5.32年 | S191: 3.33年 | T191: 14 | U191: 31 | V191: 1.9e-002 | W191: 0.19399999999999998 | X191: 0.20800000000000002 | Y191: 72 | Z191: 1.53 | AA191: -4.6999999999999993e-003 | AB191: -9.7999999999999997e-003 | AC191: -3.6900000000000002e-002 | AD191: -3.8699999999999998e-002 | AE191: 89.98 | AF191: 93.03 | AG191: 0.63 | AH191: AA | AI191: 4.1599999999999998e-002 | AJ191: =H191+100*O191 -> 128.19499999999999 | AK191: 128.9 | AL191: 39 | AM191: 35.9 | AN191: 61 | AO191: 4.2000000000000003e-002 | AP191: 7 | AQ191: 旺能转债
A192: 276 | B192: 113536 | C192: 三星转债 | D192: 603578 | E192: 三星新材 | F192: 家电 | G192: 零部件制 | H192: 116.37 | I192: -3.3e-003 | J192: 9.1000000000000004e-003 | K192: 13.88 | L192: 1.09e-002 | M192: 114.3 | N192: 13.76 | O192: 0.154 | P192: 100.87 | Q192: 转股中 | R192: 3.78年 | S192: 1.78年 | T192: 1.49 | U192: 3.1 | V192: 1.8000000000000002e-002 | W192: 8.4000000000000005e-002 | X192: 8.4000000000000005e-002 | Y192: 18 | Z192: 1.71 | AA192: -4.7999999999999996e-003 | AB192: -1.1599999999999999e-002 | AC192: -6.2199999999999998e-002 | AD192: -6.4699999999999994e-002 | AE192: 95.29 | AF192: 98.8 | AG192: 0.53 | AH192: AA | AI192: 4.0099999999999997e-002 | AJ192: =H192+100*O192 -> 131.77000000000001 | AK192: 131.9 | AL192: 64 | AM192: 33.1 | AN192: 45 | AO192: 1.3999999999999999e-002 | AP192: 35 | AQ192: 三星转债
A193: 185 | B193: 127017 | C193: 万青转债 | D193: 789 | E193: 万年青 | F193: 建筑 | G193: 水泥 | H193: 120.75 | I193: 1.6399999999999998e-002 | J193: -2.0999999999999999e-003 | K193: 11.92 | L193: 3.7400000000000003e-002 | M193: 118 | N193: 13.46 | O193: 0.36399999999999999 | P193: 88.56 | Q193: 转股中 | R193: 4.79年 | S193: 2.79年 | T193: 10 | U193: 12 | V193: 1.e-002 | W193: 0.105 | X193: 9.3000000000000013e-002 | Y193: 95 | Z193: 1.45 | AA193: -4.8999999999999998e-003 | AB193: -1.1399999999999999e-002 | AC193: -5.1699999999999996e-002 | AD193: -5.3699999999999998e-002 | AE193: 93.4 | AF193: 100.35 | AG193: 0.38 | AH193: AA+ | AI193: 3.5099999999999999e-002 | AJ193: =H193+100*O193 -> 157.15000000000001 | AK193: 152.9 | AL193: 255 | AM193: 52.6 | AN193: 195 | AO193: 7.9000000000000001e-002 | AP193: 8 | AQ193: 万青转债
A194: 338 | B194: 127006 | C194: 敖东转债! | D194: 623 | E194: 吉林敖东 | F194: 金融 | G194: 证券行业 | H194: 108.801 | I194: -4.5999999999999999e-003 | J194: -7.000000000000001e-004 | K194: 16.35 | L194: -2.3900000000000001e-002 | M194: 107.4 | N194: 20.22 | O194: 0.34600000000000003 | P194: 80.86 | Q194: 转股中 | R194: 2.56年 | S194: 0.56年 | T194: 24.1 | U194: 26 | V194: 1.e-002 | W194: 0.127 | X194: 0.10199999999999999 | Y194: 190 | Z194: 0.83 | AA194: -5.1000000000000004e-003 | AB194: -1.0500000000000001e-002 | AC194: -0.10199999999999999 | AD194: -0.10400000000000001 | AE194: 98.66 | AF194: 98.76 | AG194: 0.22 | AH194: AA+ | AI194: 3.3700000000000001e-002 | AJ194: =H194+100*O194 -> 143.40100000000001 | AK194: 136.7 | AL194: 118 | AM194: 38 | AN194: 81 | AO194: 5.2000000000000005e-002 | AP194: 29 | AQ194: 敖东转债!
A195: 65 | B195: 113618 | C195: 美诺转债! | D195: 603538 | E195: 美诺华 | F195: 医药 | G195: 原料药 | H195: 118.58 | I195: -1.44e-002 | J195: 4.7999999999999996e-003 | K195: 32.17 | L195: -1.7100000000000001e-002 | M195: 115.3 | N195: 37.47 | O195: 0.38100000000000001 | P195: 85.86 | Q195: 转股中 | R195: 5.40年 | S195: 3.40年 | T195: 5.2 | U195: 2.8 | V195: 5.0000000000000001e-003 | W195: 0.10800000000000001 | X195: 9.3000000000000013e-002 | Y195: 48 | Z195: 2.9 | AA195: -5.3e-003 | AB195: -1.03e-002 | AC195: -3.6900000000000002e-002 | AD195: -3.8900000000000004e-002 | AE195: 83.77 | AF195: 83.64 | AG195: 0.56 | AH195: AA- | AI195: 6.2600000000000003e-002 | AJ195: =H195+100*O195 -> 156.68000000000001 | AK195: 151.3 | AL195: 235 | AM195: 67.5 | AN195: 280 | AO195: -7.4999999999999997e-002 | AP195: 5 | AQ195: 美诺转债!
A196: 12 | B196: 113050 | C196: 南银转债 | D196: 601009 | E196: 南京银行 | F196: 金融 | G196: 银行行业 | H196: 114.71 | I196: 1.e-003 | J196: 6.7000000000000002e-003 | K196: 9.15 | L196: 1.55e-002 | M196: 111.2 | N196: 10.1 | O196: 0.26600000000000001 | P196: 90.59 | Q196: 4月3天 | R196: 5.82年 | S196: 无权 | T196: 200 | U196: 83 | V196: 4.0000000000000001e-003 | W196: 0.218 | X196: 0.19800000000000001 | Y196: 916 | Z196: 0.9 | AA196: -5.4000000000000003e-003 | AB196: -8.8999999999999999e-003 | AC196: 无权 | AD196: 无权 | AE196: 无权 | AF196: 91.49 | AG196: 0.49 | AH196: AAA | AI196: 3.4599999999999999e-002 | AJ196: =H196+100*O196 -> 141.31 | AK196: 138.8 | AL196: 130 | AM196: 47.3 | AN196: 155 | AO196: 1.2e-002 | AP196: 5 | AQ196: 南银转债
A197: 293 | B197: 123024 | C197: 岱勒转债! | D197: 300700 | E197: 岱勒新材 | F197: 机械装备 | G197: 专用设备 | H197: 114.1 | I197: -6.3e-003 | J197: 7.4999999999999997e-003 | K197: 14.12 | L197: 2.0999999999999999e-003 | M197: 112.5 | N197: 14.1 | O197: 0.13900000000000001 | P197: 100.14 | Q197: 转股中 | R197: 2.58年 | S197: 0.59年 | T197: 2.1 | U197: 13 | V197: 5.4000000000000006e-002 | W197: 0.13900000000000001 | X197: 0.13900000000000001 | Y197: 15 | Z197: 2.4 | AA197: -5.5000000000000005e-003 | AB197: -1.4199999999999999e-002 | AC197: -0.155 | AD197: -0.158 | AE197: 96.2 | AF197: 94.51 | AG197: 0.56 | AH197: A+ | AI197: 7.0699999999999999e-002 | AJ197: =H197+100*O197 -> 128. | AK197: 128.1 | AL197: 34 | AM197: 31.9 | AN197: 37 | AO197: -8.0000000000000002e-003 | AP197: 38 | AQ197: 岱勒转债!
A198: 160 | B198: 128121 | C198: 宏川转债! | D198: 2930 | E198: 宏川智慧 | F198: 交通运输 | G198: 物流业 | H198: 116.401 | I198: -9.1999999999999998e-003 | J198: 9.4999999999999998e-003 | K198: 17.19 | L198: 5.9999999999999995e-004 | M198: 112.9 | N198: 19.92 | O198: 0.34899999999999998 | P198: 86.3 | Q198: 转股中 | R198: 4.91年 | S198: 2.91年 | T198: 6.7 | U198: 2 | V198: 3.0000000000000001e-003 | W198: 8.6999999999999994e-002 | X198: 7.5999999999999998e-002 | Y198: 77 | Z198: 3.77 | AA198: -6.3e-003 | AB198: -1.1000000000000001e-002 | AC198: -3.8100000000000002e-002 | AD198: -4.0099999999999997e-002 | AE198: 86.3 | AF198: 84.88 | AG198: 0.55 | AH198: AA- | AI198: 6.1100000000000002e-002 | AJ198: =H198+100*O198 -> 151.30099999999999 | AK198: 146.5 | AL198: 206 | AM198: 60.2 | AN198: 247 | AO198: -1.4999999999999999e-002 | AP198: 5 | AQ198: 宏川转债!
A199: 107 | B199: 123075 | C199: 贝斯转债! | D199: 300580 | E199: 贝斯特 | F199: 汽车 | G199: 零部件制 | H199: 119.29 | I199: -1.5800000000000002e-002 | J199: 3.9000000000000003e-003 | K199: 22.48 | L199: -1.9199999999999998e-002 | M199: 115.5 | N199: 23.74 | O199: 0.26000000000000001 | P199: 94.69 | Q199: 转股中 | R199: 5.20年 | S199: 3.20年 | T199: 6 | U199: 5.6 | V199: 8.0000000000000002e-003 | W199: 0.13300000000000001 | X199: 0.126 | Y199: 45 | Z199: 2.61 | AA199: -6.3e-003 | AB199: -1.1599999999999999e-002 | AC199: -4.07e-002 | AD199: -4.2800000000000005e-002 | AE199: 84.82 | AF199: 84.82 | AG199: 0.62 | AH199: AA- | AI199: 6.2600000000000003e-002 | AJ199: =H199+100*O199 -> 145.29000000000002 | AK199: 143.9 | AL199: 185 | AM199: 59.1 | AN199: 242 | AO199: -1.3999999999999999e-002 | AP199: 9 | AQ199: 贝斯转债!
A200: 26 | B200: 123113 | C200: 仙乐转债 | D200: 300791 | E200: 仙乐健康 | F200: 食品饮料 | G200: 食品饮料 | H200: 123.1 | I200: -1.84e-002 | J200: -6.7000000000000002e-003 | K200: 53.5 | L200: -4.0199999999999993e-002 | M200: 118.5 | N200: 56.92 | O200: 0.31 | P200: 93.99 | Q200: 2月6天 | R200: 5.66年 | S200: 3.66年 | T200: 10.3 | U200: 7 | V200: 6.0000000000000001e-003 | W200: 0.106 | X200: 0.10000000000000001 | Y200: 96 | Z200: 2.86 | AA200: -6.8000000000000005e-003 | AB200: -1.24e-002 | AC200: -4.3799999999999999e-002 | AD200: -4.5599999999999995e-002 | AE200: 82.49 | AF200: 84.61 | AG200: 0.62 | AH200: AA- | AI200: 6.2600000000000003e-002 | AJ200: =H200+100*O200 -> 154.09999999999999 | AK200: 152.2 | AL200: 245 | AM200: 67.6 | AN200: 281 | AO200: -0.126 | AP200: 2 | AQ200: 仙乐转债
A201: 88 | B201: 128140 | C201: 润建转债! | D201: 2929 | E201: 润建股份 | F201: 通信互联 | G201: 通信设备 | H201: 119.511 | I201: -2.8399999999999998e-002 | J201: 1.7899999999999999e-002 | K201: 27.39 | L201: -1.6899999999999998e-002 | M201: 115.2 | N201: 26.4 | O201: 0.152 | P201: 103.75 | Q201: 转股中 | R201: 5.30年 | S201: 3.30年 | T201: 10.9 | U201: 8.4 | V201: 6.0000000000000001e-003 | W201: 0.17999999999999999 | X201: 0.187 | Y201: 60 | Z201: 1.91 | AA201: -6.9999999999999993e-003 | AB201: -1.21e-002 | AC201: -4.0500000000000001e-002 | AD201: -4.24e-002 | AE201: 90.17 | AF201: 93.23 | AG201: 0.62 | AH201: AA | AI201: 4.1599999999999998e-002 | AJ201: =H201+100*O201 -> 134.71099999999998 | AK201: 135.3 | AL201: 101 | AM201: 42 | AN201: 121 | AO201: -2.2000000000000002e-002 | AP201: 12 | AQ201: 润建转债!
A202: 39 | B202: 113622 | C202: 杭叉转债! | D202: 603298 | E202: 杭叉集团 | F202: 机械装备 | G202: 通用设备 | H202: 116.99 | I202: -1.44e-002 | J202: 1.8600000000000002e-002 | K202: 18.53 | L202: 1.09e-002 | M202: 112.5 | N202: 23.08 | O202: 0.45700000000000002 | P202: 80.29 | Q202: 49天 | R202: 5.59年 | S202: 3.60年 | T202: 11.5 | U202: 6.2 | V202: 5.0000000000000001e-003 | W202: 7.2000000000000008e-002 | X202: 5.7999999999999996e-002 | Y202: 161 | Z202: 3.18 | AA202: -7.0999999999999995e-003 | AB202: -1.11e-002 | AC202: -3.3500000000000002e-002 | AD202: -3.49e-002 | AE202: 90.05 | AF202: 92.29 | AG202: 0.38 | AH202: AA+ | AI202: 3.6600000000000001e-002 | AJ202: =H202+100*O202 -> 162.69 | AK202: 153.7 | AL202: 261 | AM202: 61.4 | AN202: 256 | AO202: 5.7000000000000002e-002 | AP202: 4 | AQ202: 杭叉转债!
A203: 105 | B203: 128136 | C203: 立讯转债! | D203: 2475 | E203: 立讯精密 | F203: 电子 | G203: 元器件制 | H203: 116.4 | I203: -1.7000000000000001e-003 | J203: 3.0000000000000001e-003 | K203: 37.95 | L203: 6.6e-003 | M203: 111.9 | N203: 58.2 | O203: 0.78500000000000003 | P203: 65.21 | Q203: 转股中 | R203: 5.20年 | S203: 3.21年 | T203: 30 | U203: 28 | V203: 8.0000000000000002e-003 | W203: 1.1000000000000001e-002 | X203: 6.9999999999999993e-003 | Y203: 2670. | Z203: 9.24 | AA203: -7.6e-003 | AB203: -1.1699999999999999e-002 | AC203: -3.7400000000000003e-002 | AD203: -3.8699999999999998e-002 | AE203: 90.75 | AF203: 93.02 | AG203: 0.19 | AH203: AA+ | AI203: 3.6600000000000001e-002 | AJ203: =H203+100*O203 -> 194.90000000000001 | AK203: 167.6 | AL203: 304 | AM203: 74.6 | AN203: 305 | AO203: -4.2000000000000003e-002 | AP203: 13 | AQ203: 立讯转债!
A204: 245 | B204: 128081 | C204: 海亮转债! | D204: 2203 | E204: 海亮股份 | F204: 有色金属 | G204: 铜金属 | H204: 118.881 | I204: -1.18e-002 | J204: 1.7000000000000001e-003 | K204: 10.9 | L204: -1.54e-002 | M204: 114.9 | N204: 9.69 | O204: 5.7000000000000002e-002 | P204: 112.49 | Q204: 转股中 | R204: 4.25年 | S204: 2.26年 | T204: 30.1 | U204: 28 | V204: 8.0000000000000002e-003 | W204: 0.14000000000000001 | X204: 0.158 | Y204: 214 | Z204: 2.25 | AA204: -8.1000000000000013e-003 | AB204: -1.43e-002 | AC204: -5.6600000000000004e-002 | AD204: -5.9000000000000004e-002 | AE204: 94.11 | AF204: 97.56 | AG204: 0.66 | AH204: AA | AI204: 4.0099999999999997e-002 | AJ204: =H204+100*O204 -> 124.581 | AK204: 125.3 | AL204: 18 | AM204: 27.7 | AN204: 19 | AO204: -2.7999999999999997e-002 | AP204: 51 | AQ204: 海亮转债!
A205: 5 | B205: 127041 | C205: 弘亚转债 | D205: 2833 | E205: 弘亚数控 | F205: 机械装备 | G205: 专用设备 | H205: 123.5 | I205: 1.55e-002 | J205: -4.0999999999999995e-003 | K205: 35.45 | L205: 2.0400000000000001e-002 | M205: 118.75 | N205: 38.09 | O205: 0.32700000000000001 | P205: 93.07 | Q205: 5月0天 | R205: 4.89年 | S205: 2.89年 | T205: 6 | U205: 17 | V205: 2.3e-002 | W205: 5.5999999999999994e-002 | X205: 5.2000000000000005e-002 | Y205: 107 | Z205: 4.15 | AA205: -8.1000000000000013e-003 | AB205: -1.46e-002 | AC205: -5.9400000000000001e-002 | AD205: -6.08e-002 | AE205: 85.59 | AF205: 89.21 | AG205: 0.56 | AH205: AA- | AI205: 6.1100000000000002e-002 | AJ205: =H205+100*O205 -> 156.19999999999999 | AK205: 153.9 | AL205: 263 | AM205: 64.7 | AN205: 269 | AO205: 7.0999999999999994e-002 | AP205: 3 | AQ205: 弘亚转债
A206: 38 | B206: 110079 | C206: 杭银转债! | D206: 600926 | E206: 杭州银行 | F206: 金融 | G206: 银行行业 | H206: 117.88 | I206: 1.e-004 | J206: -2.5999999999999999e-003 | K206: 13.41 | L206: -6.7000000000000002e-003 | M206: 112.4 | N206: 16.71 | O206: 0.46899999999999997 | P206: 80.25 | Q206: 49天 | R206: 5.60年 | S206: 无权 | T206: 150 | U206: 70 | V206: 4.0000000000000001e-003 | W206: 0.18899999999999997 | X206: 0.151 | Y206: 795 | Z206: 1.2 | AA206: -8.6e-003 | AB206: -1.2500000000000001e-002 | AC206: 无权 | AD206: 无权 | AE206: 无权 | AF206: 93.16 | AG206: 0.37 | AH206: AAA | AI206: 3.4599999999999999e-002 | AJ206: =H206+100*O206 -> 164.78 | AK206: 155.5 | AL206: 266 | AM206: 62.3 | AN206: 260 | AO206: 4.8000000000000001e-002 | AP206: 11 | AQ206: 杭银转债!
A207: 281 | B207: 113026 | C207: 核能转债! | D207: 601985 | E207: 中国核电 | F207: 能源电力 | G207: 核电 | H207: 112.76 | I207: -4.0000000000000002e-004 | J207: 4.4000000000000003e-003 | K207: 5.15 | L207: 9.7999999999999997e-003 | M207: 109.3 | N207: 5.73 | O207: 0.255 | P207: 89.88 | Q207: 转股中 | R207: 3.65年 | S207: 1.65年 | T207: 78 | U207: 29 | V207: 3.0000000000000001e-003 | W207: 8.6999999999999994e-002 | X207: 7.8e-002 | Y207: 899 | Z207: 1.45 | AA207: -8.6999999999999994e-003 | AB207: -1.34e-002 | AC207: -4.99e-002 | AD207: -5.2699999999999997e-002 | AE207: 96.93 | AF207: 97.28 | AG207: 0.41 | AH207: AAA | AI207: 3.3099999999999997e-002 | AJ207: =H207+100*O207 -> 138.25999999999999 | AK207: 135.6 | AL207: 107 | AM207: 38.4 | AN207: 86 | AO207: 3.9e-002 | AP207: 43 | AQ207: 核能转债!
A208: 31 | B208: 123112 | C208: 万讯转债 | D208: 300112 | E208: 万讯自控 | F208: 机械装备 | G208: 专用设备 | H208: 130.6 | I208: -1.8e-003 | J208: 5.7999999999999996e-003 | K208: 11.27 | L208: 5.4000000000000003e-003 | M208: 124.4 | N208: 8.93 | O208: 3.5000000000000003e-002 | P208: 126.2 | Q208: 55天 | R208: 5.63年 | S208: 3.63年 | T208: 2.46 | U208: 124 | V208: 0.38 | W208: 7.5999999999999998e-002 | X208: 9.6000000000000002e-002 | Y208: 32 | Z208: 3.01 | AA208: -8.8000000000000005e-003 | AB208: -1.5900000000000001e-002 | AC208: -5.79e-002 | AD208: -5.9900000000000002e-002 | AE208: 83.04 | AF208: 89.02 | AG208: 0.75 | AH208: AA- | AI208: 6.2600000000000003e-002 | AJ208: =H208+100*O208 -> 134.09999999999999 | AK208: 135 | AL208: 96 | AM208: 46 | AN208: 148 | AO208: 8.199999999999999e-002 | AP208: 13 | AQ208: 万讯转债
A209: 158 | B209: 113593 | C209: 沪工转债! | D209: 603131 | E209: 上海沪工 | F209: 机械装备 | G209: 通用设备 | H209: 126.66 | I209: -2.e-003 | J209: 1.7000000000000001e-003 | K209: 23.85 | L209: -4.0000000000000002e-004 | M209: 121.2 | N209: 21.12 | O209: 0.122 | P209: 112.93 | Q209: 转股中 | R209: 4.91年 | S209: 2.92年 | T209: 4 | U209: 32 | V209: 6.4000000000000001e-002 | W209: 5.2999999999999999e-002 | X209: 5.9999999999999998e-002 | Y209: 76 | Z209: 5.76 | AA209: -9.1000000000000004e-003 | AB209: -1.6399999999999998e-002 | AC209: -6.1799999999999994e-002 | AD209: -6.4199999999999993e-002 | AE209: 84.25 | AF209: 86.75 | AG209: 0.72 | AH209: A+ | AI209: 7.2099999999999997e-002 | AJ209: =H209+100*O209 -> 138.85999999999999 | AK209: 140.4 | AL209: 150 | AM209: 53.6 | AN209: 199 | AO209: 0.21199999999999999 | AP209: 11 | AQ209: 沪工转债!
A210: 289 | B210: 110057 | C210: 现代转债 | D210: 600420 | E210: 国药现代 | F210: 医药 | G210: 化学制药 | H210: 114.23 | I210: -3.4000000000000002e-003 | J210: -2.8999999999999998e-003 | K210: 9.56 | L210: -1.24e-002 | M210: 110.3 | N210: 9.79 | O210: 0.17000000000000001 | P210: 97.65 | Q210: 转股中 | R210: 3.61年 | S210: 1.62年 | T210: 16.2 | U210: 20 | V210: 1.1000000000000001e-002 | W210: 0.16500000000000001 | X210: 0.161 | Y210: 98 | Z210: 1.21 | AA210: -9.7999999999999997e-003 | AB210: -1.4999999999999999e-002 | AC210: -5.79e-002 | AD210: -6.0700000000000004e-002 | AE210: 97.05 | AF210: 98.29 | AG210: 0.51 | AH210: AAA | AI210: 3.3099999999999997e-002 | AJ210: =H210+100*O210 -> 131.23000000000002 | AK210: 130.8 | AL210: 51 | AM210: 32.5 | AN210: 42 | AO210: 6.0000000000000001e-003 | AP210: 24 | AQ210: 现代转债
A211: 132 | B211: 113602 | C211: 景20转债! | D211: 603228 | E211: 景旺电子 | F211: 电子 | G211: 元器件制 | H211: 119.34 | I211: -1.4499999999999999e-002 | J211: 7.6e-003 | K211: 25.74 | L211: -1.3000000000000001e-002 | M211: 113.3 | N211: 27.4 | O211: 0.27000000000000002 | P211: 93.94 | Q211: 转股中 | R211: 5年3.5天 | S211: 3年4.5天 | T211: 17.8 | U211: 6.6 | V211: 3.0000000000000001e-003 | W211: 8.1000000000000003e-002 | X211: 7.5999999999999998e-002 | Y211: 219 | Z211: 3.38 | AA211: -1.0500000000000001e-002 | AB211: -1.5300000000000001e-002 | AC211: -4.3400000000000001e-002 | AD211: -4.5499999999999999e-002 | AE211: 91.33 | AF211: 92.8 | AG211: 0.53 | AH211: AA | AI211: 4.1599999999999998e-002 | AJ211: =H211+100*O211 -> 146.34 | AK211: 144.7 | AL211: 193 | AM211: 51.9 | AN211: 190 | AO211: -0.113 | AP211: 9 | AQ211: 景20转债!
A212: 298 | B212: 110053 | C212: 苏银转债! | D212: 600919 | E212: 江苏银行 | F212: 金融 | G212: 银行行业 | H212: 122.76 | I212: -3.4000000000000002e-003 | J212: 3.4000000000000002e-003 | K212: 6.74 | L212: 0. | M212: 118.3 | N212: 6.37 | O212: 0.16 | P212: 105.81 | Q212: 转股中 | R212: 3.56年 | S212: 无权 | T212: 200 | U212: 253 | V212: 1.e-002 | W212: 0.20100000000000001 | X212: 0.21299999999999999 | Y212: 995 | Z212: 0.71 | AA212: -1.06e-002 | AB212: -1.95e-002 | AC212: 无权 | AD212: 无权 | AE212: 无权 | AF212: 105.71 | AG212: 0.53 | AH212: AAA | AI212: 3.3099999999999997e-002 | AJ212: =H212+100*O212 -> 138.75999999999999 | AK212: 139.7 | AL212: 143 | AM212: 34 | AN212: 51 | AO212: 1.4999999999999999e-002 | AP212: 37 | AQ212: 苏银转债!
A213: 193 | B213: 113577 | C213: 春秋转债! | D213: 603890 | E213: 春秋电子 | F213: 电子 | G213: 电子产品 | H213: 123.82 | I213: -6.9999999999999993e-003 | J213: 3.0000000000000001e-003 | K213: 12.21 | L213: -5.6999999999999993e-003 | M213: 117.7 | N213: 10.86 | O213: 0.10099999999999999 | P213: 112.43 | Q213: 转股中 | R213: 4.65年 | S213: 2.65年 | T213: 1.78 | U213: 6.3 | V213: 2.7999999999999997e-002 | W213: 3.7000000000000005e-002 | X213: 4.2000000000000003e-002 | Y213: 48 | Z213: 2.49 | AA213: -1.11e-002 | AB213: -1.7600000000000001e-002 | AC213: -6.1799999999999994e-002 | AD213: -6.4000000000000001e-002 | AE213: 87.83 | AF213: 89.89 | AG213: 0.69 | AH213: AA- | AI213: 6.1100000000000002e-002 | AJ213: =H213+100*O213 -> 133.91999999999999 | AK213: 135.2 | AL213: 98 | AM213: 45.3 | AN213: 143 | AO213: -1.1000000000000001e-002 | AP213: 16 | AQ213: 春秋转债!
A214: 36 | B214: 123108 | C214: 乐普转2 | D214: 300003 | E214: 乐普医疗 | F214: 医药 | G214: 医疗器械 | H214: 117.008 | I214: -2.18e-002 | J214: 1.2999999999999999e-003 | K214: 24.75 | L214: -5.4299999999999994e-002 | M214: 111.1 | N214: 29.5 | O214: 0.39500000000000002 | P214: 83.9 | Q214: 49天 | R214: 4.61年 | S214: 2.61年 | T214: 16.4 | U214: 34 | V214: 1.8000000000000002e-002 | W214: 3.7000000000000005e-002 | X214: 3.1e-002 | Y214: 447 | Z214: 4.2 | AA214: -1.1299999999999999e-002 | AB214: -1.5700000000000002e-002 | AC214: -4.8300000000000003e-002 | AD214: -4.9599999999999998e-002 | AE214: 92.77 | AF214: 94.96 | AG214: 0.38 | AH214: AA+ | AI214: 3.5099999999999999e-002 | AJ214: =H214+100*O214 -> 156.50799999999998 | AK214: 150.1 | AL214: 229 | AM214: 55.2 | AN214: 211 | AO214: -6.5000000000000002e-002 | AP214: 10 | AQ214: 乐普转2
A215: 258 | B215: 128078 | C215: 太极转债! | D215: 2368 | E215: 太极股份 | F215: 计算机及 | G215: 软件开发 | H215: 122.57 | I215: -4.0000000000000001e-003 | J215: -1.15e-002 | K215: 20.77 | L215: -2.8999999999999998e-002 | M215: 116.9 | N215: 22.21 | O215: 0.311 | P215: 93.52 | Q215: 转股中 | R215: 4.17年 | S215: 2.17年 | T215: 9.6 | U215: 1.2 | V215: 1.e-003 | W215: 8.0000000000000002e-002 | X215: 7.4999999999999997e-002 | Y215: 120 | Z215: 3.59 | AA215: -1.15e-002 | AB215: -1.8500000000000003e-002 | AC215: -7.0900000000000005e-002 | AD215: -7.3399999999999993e-002 | AE215: 94.42 | AF215: 99.58 | AG215: 0.53 | AH215: AA | AI215: 4.0099999999999997e-002 | AJ215: =H215+100*O215 -> 153.66999999999999 | AK215: 151.6 | AL215: 241 | AM215: 52 | AN215: 192 | AO215: -8.1000000000000003e-002 | AP215: 10 | AQ215: 太极转债!
A216: 157 | B216: 127020 | C216: 中金转债 | D216: 60 | E216: 中金岭南 | F216: 有色金属 | G216: 有色行业 | H216: 120.25 | I216: 5.4000000000000003e-003 | J216: 1.2800000000000001e-002 | K216: 5.43 | L216: 2.6499999999999999e-002 | M216: 113.5 | N216: 4.63 | O216: 2.5000000000000001e-002 | P216: 117.28 | Q216: 转股中 | R216: 4.91年 | S216: 2.92年 | T216: 38 | U216: 143 | V216: 3.1e-002 | W216: 0.19600000000000001 | X216: 0.23000000000000001 | Y216: 194 | Z216: 1.62 | AA216: -1.18e-002 | AB216: -1.67e-002 | AC216: -5.1500000000000004e-002 | AD216: -5.28e-002 | AE216: 91.99 | AF216: 96.01 | AG216: 0.69 | AH216: AA+ | AI216: 3.5099999999999999e-002 | AJ216: =H216+100*O216 -> 122.75 | AK216: 123.2 | AL216: 11 | AM216: 27.2 | AN216: 16 | AO216: 3.4000000000000002e-002 | AP216: 16 | AQ216: 中金转债
A217: 102 | B217: 127025 | C217: 冀东转债! | D217: 401 | E217: 冀东水泥 | F217: 建筑 | G217: 水泥 | H217: 117.01 | I217: 6.1999999999999998e-003 | J217: 9.3999999999999986e-003 | K217: 13.25 | L217: 3.4300000000000004e-002 | M217: 110.1 | N217: 15.28 | O217: 0.34899999999999998 | P217: 86.71 | Q217: 转股中 | R217: 5.21年 | S217: 3.21年 | T217: 17.8 | U217: 30 | V217: 1.3999999999999999e-002 | W217: 9.5000000000000001e-002 | X217: 8.199999999999999e-002 | Y217: 187 | Z217: 1.19 | AA217: -1.18e-002 | AB217: -1.5300000000000001e-002 | AC217: -3.7699999999999997e-002 | AD217: -3.9199999999999999e-002 | AE217: 91.76 | AF217: 92.48 | AG217: 0.45 | AH217: AAA | AI217: 3.4599999999999999e-002 | AJ217: =H217+100*O217 -> 151.91 | AK217: 147.3 | AL217: 214 | AM217: 54.8 | AN217: 207 | AO217: 5.5999999999999994e-002 | AP217: 9 | AQ217: 冀东转债!
A218: 317 | B218: 128048 | C218: 张行转债 | D218: 2839 | E218: 张家港行 | F218: 金融 | G218: 银行行业 | H218: 118 | I218: -4.0000000000000001e-003 | J218: 1.1399999999999999e-002 | K218: 5.77 | L218: 1.41e-002 | M218: 113.3 | N218: 5.6 | O218: 0.14499999999999999 | P218: 103.04 | Q218: 转股中 | R218: 3.23年 | S218: 无权 | T218: 25 | U218: 21 | V218: 6.9999999999999993e-003 | W218: 0.23899999999999999 | X218: 0.247 | Y218: 104 | Z218: 0.94 | AA218: -1.2800000000000001e-002 | AB218: -2.0099999999999996e-002 | AC218: 无权 | AD218: 无权 | AE218: 无权 | AF218: 101.6 | AG218: 0.53 | AH218: AA+ | AI218: 3.5099999999999999e-002 | AJ218: =H218+100*O218 -> 132.5 | AK218: 133 | AL218: 78 | AM218: 31.4 | AN218: 35 | AO218: 2.3e-002 | AP218: 12 | AQ218: 张行转债
A219: 4 | B219: 123119 | C219: 康泰转2 | D219: 300601 | E219: 康泰生物 | F219: 医药 | G219: 生物制药 | H219: 126.499 | I219: -2.69e-002 | J219: 3.7000000000000002e-003 | K219: 129.86 | L219: -4.7400000000000005e-002 | M219: 117.1 | N219: 145.63 | O219: 0.41899999999999998 | P219: 89.17 | Q219: 5月4天 | R219: 5.90年 | S219: 3.90年 | T219: 20 | U219: 136 | V219: 5.4000000000000006e-002 | W219: 2.2000000000000002e-002 | X219: 2.e-002 | Y219: 892 | Z219: 11.76 | AA219: -1.32e-002 | AB219: -1.8200000000000001e-002 | AC219: -4.82e-002 | AD219: -4.9800000000000004e-002 | AE219: 87.89 | AF219: 92.45 | AG219: 0.49 | AH219: AA | AI219: 4.1599999999999998e-002 | AJ219: =H219+100*O219 -> 168.399 | AK219: 163.8 | AL219: 296 | AM219: 71.4 | AN219: 298 | AO219: -3.6000000000000004e-002 | AP219: 6 | AQ219: 康泰转2
A220: 76 | B220: 113614 | C220: 健20转债! | D220: 603707 | E220: 健友股份 | F220: 医药 | G220: 原料药 | H220: 122.61 | I220: -1.6799999999999999e-002 | J220: 2.5000000000000001e-003 | K220: 29.7 | L220: -2.3e-002 | M220: 114.2 | N220: 29.12 | O220: 0.20199999999999999 | P220: 101.99 | Q220: 转股中 | R220: 5.32年 | S220: 3.33年 | T220: 7.8 | U220: 16 | V220: 1.7000000000000001e-002 | W220: 2.2000000000000002e-002 | X220: 2.2000000000000002e-002 | Y220: 361 | Z220: 6.95 | AA220: -1.3500000000000002e-002 | AB220: -1.8200000000000001e-002 | AC220: -4.7199999999999999e-002 | AD220: -4.9100000000000005e-002 | AE220: 90.07 | AF220: 92.32 | AG220: 0.62 | AH220: AA | AI220: 4.1599999999999998e-002 | AJ220: =H220+100*O220 -> 142.81 | AK220: 143.2 | AL220: 179 | AM220: 50.9 | AN220: 180 | AO220: -3.7999999999999999e-002 | AP220: 4 | AQ220: 健20转债!
A221: 352 | B221: 128025 | C221: 特一转债! | D221: 2728 | E221: 特一药业 | F221: 医药 | G221: 化学制药 | H221: 112.31 | I221: -6.0000000000000001e-003 | J221: 8.199999999999999e-003 | K221: 12.02 | L221: 6.7000000000000002e-003 | M221: 108.8 | N221: 14.05 | O221: 0.313 | P221: 85.55 | Q221: 转股中 | R221: 2.30年 | S221: 0.30年 | T221: 2.98 | U221: 9 | V221: 2.7000000000000003e-002 | W221: 0.122 | X221: 0.10400000000000001 | Y221: 24 | Z221: 2.29 | AA221: -1.3999999999999999e-002 | AB221: -2.1000000000000001e-002 | AC221: -0.221 | AD221: -0.22800000000000001 | AE221: 98.87 | AF221: 95.46 | AG221: 0.34 | AH221: AA- | AI221: 5.9699999999999996e-002 | AJ221: =H221+100*O221 -> 143.61000000000001 | AK221: 139.1 | AL221: 135 | AM221: 40.2 | AN221: 101 | AO221: -8.0000000000000002e-003 | AP221: 51 | AQ221: 特一转债!
A222: 188 | B222: 113579 | C222: 健友转债! | D222: 603707 | E222: 健友股份 | F222: 医药 | G222: 原料药 | H222: 121.8 | I222: -8.1000000000000013e-003 | J222: -3.0000000000000001e-003 | K222: 29.7 | L222: -2.3e-002 | M222: 113.9 | N222: 32.2 | O222: 0.32100000000000001 | P222: 92.24 | Q222: 转股中 | R222: 4.67年 | S222: 2.68年 | T222: 5.03 | U222: 1.5 | V222: 3.0000000000000001e-003 | W222: 1.3999999999999999e-002 | X222: 1.3000000000000001e-002 | Y222: 361 | Z222: 6.95 | AA222: -1.4499999999999999e-002 | AB222: -1.9699999999999999e-002 | AC222: -5.6399999999999999e-002 | AD222: -5.8600000000000006e-002 | AE222: 92.57 | AF222: 95.13 | AG222: 0.48 | AH222: AA | AI222: 4.0099999999999997e-002 | AJ222: =H222+100*O222 -> 153.90000000000001 | AK222: 151.4 | AL222: 237 | AM222: 56.2 | AN222: 223 | AO222: -3.7999999999999999e-002 | AP222: 9 | AQ222: 健友转债!
A223: 32 | B223: 113623 | C223: 凤21转债 | D223: 603225 | E223: 新凤鸣 | F223: 化工 | G223: 化纤 | H223: 126.95 | I223: -2.2000000000000002e-002 | J223: 3.4999999999999996e-003 | K223: 17.36 | L223: -2.9600000000000001e-002 | M223: 117.1 | N223: 16.47 | O223: 0.20399999999999999 | P223: 105.4 | Q223: 55天 | R223: 5.63年 | S223: 3.63年 | T223: 25 | U223: 38 | V223: 1.2e-002 | W223: 0.10300000000000001 | X223: 0.10800000000000001 | Y223: 243 | Z223: 1.89 | AA223: -1.4499999999999999e-002 | AB223: -1.9699999999999999e-002 | AC223: -5.2499999999999998e-002 | AD223: -5.4100000000000002e-002 | AE223: 88.86 | AF223: 93.47 | AG223: 0.63 | AH223: AA | AI223: 4.1599999999999998e-002 | AJ223: =H223+100*O223 -> 147.34999999999999 | AK223: 148.5 | AL223: 220 | AM223: 55 | AN223: 209 | AO223: -0.13699999999999998 | AP223: 3 | AQ223: 凤21转债
A224: 186 | B224: 128108 | C224: 蓝帆转债! | D224: 2382 | E224: 蓝帆医疗 | F224: 医药 | G224: 医疗器械 | H224: 121.44 | I224: -1.2e-002 | J224: -1.e-003 | K224: 19.93 | L224: -1.9699999999999999e-002 | M224: 112.9 | N224: 18.24 | O224: 0.111 | P224: 109.27 | Q224: 转股中 | R224: 4.77年 | S224: 3.77年 | T224: 15.3 | U224: 22 | V224: 1.2e-002 | W224: 7.5999999999999998e-002 | X224: 8.3000000000000004e-002 | Y224: 201 | Z224: 1.68 | AA224: -1.55e-002 | AB224: -2.0199999999999999e-002 | AC224: -3.6200000000000003e-002 | AD224: -3.8599999999999995e-002 | AE224: 90.35 | AF224: 93.94 | AG224: 0.66 | AH224: AA | AI224: 4.0099999999999997e-002 | AJ224: =H224+100*O224 -> 132.53999999999999 | AK224: 133.6 | AL224: 86 | AM224: 39.7 | AN224: 93 | AO224: -1.8000000000000002e-002 | AP224: 26 | AQ224: 蓝帆转债!
A225: 113 | B225: 123071 | C225: 天能转债! | D225: 300569 | E225: 天能重工 | F225: 能源电力 | G225: 风能 | H225: 131.27 | I225: 1.21e-002 | J225: 4.5000000000000005e-003 | K225: 9.77 | L225: 2.2000000000000002e-002 | M225: 121.1 | N225: 7.91 | O225: 6.3e-002 | P225: 123.51 | Q225: 转股中 | R225: 5.17年 | S225: 3.17年 | T225: 6.95 | U225: 93 | V225: 0.10199999999999999 | W225: 8.9999999999999997e-002 | X225: 0.111 | Y225: 77 | Z225: 1.65 | AA225: -1.5800000000000002e-002 | AB225: -2.2599999999999999e-002 | AC225: -6.8000000000000005e-002 | AD225: -7.0000000000000007e-002 | AE225: 85.14 | AF225: 89.11 | AG225: 0.76 | AH225: AA- | AI225: 6.2600000000000003e-002 | AJ225: =H225+100*O225 -> 137.57000000000002 | AK225: 139 | AL225: 133 | AM225: 49.9 | AN225: 174 | AO225: -4.5999999999999999e-002 | AP225: 14 | AQ225: 天能转债!
A226: 300 | B226: 128057 | C226: 博彦转债 | D226: 2649 | E226: 博彦科技 | F226: 计算机及 | G226: 软件开发 | H226: 122.98 | I226: 1.5e-003 | J226: 3.5999999999999999e-003 | K226: 9.83 | L226: 7.1999999999999998e-003 | M226: 116.3 | N226: 8.5 | O226: 6.3e-002 | P226: 115.65 | Q226: 转股中 | R226: 3.54年 | S226: 1.54年 | T226: 4.94 | U226: 9.1 | V226: 1.4999999999999999e-002 | W226: 9.4e-002 | X226: 0.109 | Y226: 52 | Z226: 1.73 | AA226: -1.5900000000000001e-002 | AB226: -2.3900000000000001e-002 | AC226: -0.10000000000000001 | AD226: -0.10300000000000001 | AE226: 92.98 | AF226: 94.68 | AG226: 0.71 | AH226: AA- | AI226: 6.1100000000000002e-002 | AJ226: =H226+100*O226 -> 129.28 | AK226: 130.3 | AL226: 46 | AM226: 35.6 | AN226: 58 | AO226: 1.2e-002 | AP226: 27 | AQ226: 博彦转债
A227: 153 | B227: 123061 | C227: 航新转债! | D227: 300424 | E227: 航新科技 | F227: 航空航天 | G227: 航空航天 | H227: 134.3 | I227: -9.5999999999999992e-003 | J227: 1.37e-002 | K227: 18.36 | L227: 5.5000000000000005e-003 | M227: 124.3 | N227: 14.85 | O227: 8.5999999999999993e-002 | P227: 123.64 | Q227: 转股中 | R227: 4.92年 | S227: 2.92年 | T227: 2.5 | U227: 428 | V227: 1.26 | W227: 5.7000000000000002e-002 | X227: 7.0000000000000007e-002 | Y227: 44 | Z227: 6.61 | AA227: -1.5900000000000001e-002 | AB227: -2.4e-002 | AC227: -7.9500000000000001e-002 | AD227: -8.1799999999999998e-002 | AE227: 84.25 | AF227: 88.95 | AG227: 0.75 | AH227: A+ | AI227: 7.2099999999999997e-002 | AJ227: =H227+100*O227 -> 142.90000000000001 | AK227: 145 | AL227: 194 | AM227: 56 | AN227: 221 | AO227: 4.0999999999999995e-002 | AP227: 20 | AQ227: 航新转债!
A228: 236 | B228: 123038 | C228: 联得转债! | D228: 300545 | E228: 联得装备 | F228: 机械装备 | G228: 专用设备 | H228: 127 | I228: 5.6000000000000008e-003 | J228: -5.9999999999999995e-004 | K228: 25.2 | L228: 7.6e-003 | M228: 118.6 | N228: 24.07 | O228: 0.21299999999999999 | P228: 104.69 | Q228: 转股中 | R228: 4.35年 | S228: 2.35年 | T228: 1.47 | U228: 49 | V228: 0.26000000000000001 | W228: 3.3000000000000002e-002 | X228: 3.4000000000000002e-002 | Y228: 45 | Z228: 3.25 | AA228: -1.6e-002 | AB228: -2.3199999999999998e-002 | AC228: -7.7699999999999991e-002 | AD228: -8.0299999999999996e-002 | AE228: 87.36 | AF228: 88.28 | AG228: 0.66 | AH228: A+ | AI228: 7.2099999999999997e-002 | AJ228: =H228+100*O228 -> 148.30000000000001 | AK228: 149.3 | AL228: 225 | AM228: 61 | AN228: 251 | AO228: -0.11900000000000001 | AP228: 20 | AQ228: 联得转债!
A229: 329 | B229: 110045 | C229: 海澜转债! | D229: 600398 | E229: 海澜之家 | F229: 服装纺织 | G229: 服装行业 | H229: 115.7 | I229: -3.4000000000000002e-003 | J229: -2.5999999999999999e-003 | K229: 6.88 | L229: -1.29e-002 | M229: 110.3 | N229: 7.04 | O229: 0.184 | P229: 97.73 | Q229: 转股中 | R229: 2.89年 | S229: 0.90年 | T229: 29.5 | U229: 7.9 | V229: 2.e-003 | W229: 9.9000000000000005e-002 | X229: 9.6999999999999989e-002 | Y229: 297 | Z229: 2.12 | AA229: -1.6500000000000001e-002 | AB229: -2.29e-002 | AC229: -0.11699999999999999 | AD229: -0.11900000000000001 | AE229: 97.72 | AF229: 100.31 | AG229: 0.47 | AH229: AA+ | AI229: 3.3700000000000001e-002 | AJ229: =H229+100*O229 -> 134.09999999999999 | AK229: 133.7 | AL229: 87 | AM229: 33.4 | AN229: 48 | AO229: -3.6000000000000004e-002 | AP229: 50 | AQ229: 海澜转债!
A230: 257 | B230: 128079 | C230: 英联转债! | D230: 2846 | E230: 英联股份 | F230: 造纸包装 | G230: 包装材料 | H230: 125.808 | I230: -9.3999999999999986e-003 | J230: 3.0000000000000001e-003 | K230: 7.54 | L230: -1.0500000000000001e-002 | M230: 117.5 | N230: 8.29 | O230: 0.38299999999999995 | P230: 90.95 | Q230: 转股中 | R230: 4.17年 | S230: 2.17年 | T230: 1.52 | U230: 10 | V230: 5.2000000000000005e-002 | W230: 6.3e-002 | X230: 5.7999999999999996e-002 | Y230: 24 | Z230: 3.12 | AA230: -1.66e-002 | AB230: -2.3799999999999998e-002 | AC230: -8.0299999999999996e-002 | AD230: -8.3000000000000004e-002 | AE230: 88.28 | AF230: 88.52 | AG230: 0.61 | AH230: A+ | AI230: 7.2099999999999997e-002 | AJ230: =H230+100*O230 -> 164.108 | AK230: 160.7 | AL230: 288 | AM230: 72.1 | AN230: 301 | AO230: -2.8999999999999998e-002 | AP230: 18 | AQ230: 英联转债!
A231: 120 | B231: 110075 | C231: 南航转债 | D231: 600029 | E231: 南方航空 | F231: 交通运输 | G231: 航空运输 | H231: 119.9 | I231: -7.4999999999999997e-003 | J231: 4.0999999999999995e-003 | K231: 5.61 | L231: -7.0999999999999995e-003 | M231: 110 | N231: 6.24 | O231: 0.33399999999999996 | P231: 89.9 | Q231: 转股中 | R231: 5年55天 | S231: 3年56天 | T231: 59 | U231: 28 | V231: 4.0000000000000001e-003 | W231: 6.2e-002 | X231: 5.5999999999999994e-002 | Y231: 951 | Z231: 1.32 | AA231: -1.6799999999999999e-002 | AB231: -2.0299999999999999e-002 | AC231: -4.7100000000000003e-002 | AD231: -4.8300000000000003e-002 | AE231: 91.4 | AF231: 92.54 | AG231: 0.48 | AH231: AAA | AI231: 3.4599999999999999e-002 | AJ231: =H231+100*O231 -> 153.30000000000001 | AK231: 149.9 | AL231: 226 | AM231: 57.4 | AN231: 229 | AO231: 2.3e-002 | AP231: 7 | AQ231: 南航转债
A232: 196 | B232: 110070 | C232: 凌钢转债! | D232: 600231 | E232: 凌钢股份 | F232: 钢铁 | G232: 炼钢 | H232: 126.91 | I232: 1.5800000000000002e-002 | J232: -4.8999999999999998e-003 | K232: 3.28 | L232: 1.55e-002 | M232: 117.4 | N232: 2.69 | O232: 4.0999999999999995e-002 | P232: 121.93 | Q232: 转股中 | R232: 4.65年 | S232: 2.65年 | T232: 2.17 | U232: 30 | V232: 0.109 | W232: 2.3e-002 | X232: 2.7999999999999997e-002 | Y232: 94 | Z232: 1.08 | AA232: -1.7000000000000001e-002 | AB232: -2.3399999999999997e-002 | AC232: -6.9800000000000001e-002 | AD232: -7.2000000000000008e-002 | AE232: 92.98 | AF232: 98.19 | AG232: 0.71 | AH232: AA | AI232: 4.0099999999999997e-002 | AJ232: =H232+100*O232 -> 131.00999999999999 | AK232: 131.9 | AL232: 67 | AM232: 33.7 | AN232: 49 | AO232: 6.4000000000000001e-002 | AP232: 23 | AQ232: 凌钢转债!
A233: 123 | B233: 113603 | C233: 东缆转债! | D233: 603606 | E233: 东方电缆 | F233: 能源电力 | G233: 电力设备 | H233: 125.69 | I233: 2.8999999999999998e-003 | J233: -1.7000000000000001e-003 | K233: 23.25 | L233: 2.2000000000000001e-003 | M233: 115.1 | N233: 23.65 | O233: 0.27899999999999997 | P233: 98.31 | Q233: 转股中 | R233: 5年34天 | S233: 3年35天 | T233: 8 | U233: 19 | V233: 1.8000000000000002e-002 | W233: 5.2999999999999999e-002 | X233: 5.2000000000000005e-002 | Y233: 152 | Z233: 4.3 | AA233: -1.7399999999999999e-002 | AB233: -2.2599999999999999e-002 | AC233: -5.7999999999999996e-002 | AD233: -5.9900000000000002e-002 | AE233: 90.82 | AF233: 93.91 | AG233: 0.56 | AH233: AA | AI233: 4.1599999999999998e-002 | AJ233: =H233+100*O233 -> 153.59 | AK233: 153.1 | AL233: 257 | AM233: 59.2 | AN233: 243 | AO233: -3.7999999999999999e-002 | AP233: 7 | AQ233: 东缆转债!
A234: 178 | B234: 123054 | C234: 思特转债!! | D234: 300608 | E234: 思特奇 | F234: 通信互联 | G234: 通信设备 | H234: 131.9 | I234: -1.5700000000000002e-002 | J234: -1.2999999999999999e-003 | K234: 12.81 | L234: -2.81e-002 | M234: 121.2 | N234: 12.63 | O234: 0.29999999999999999 | P234: 101.43 | Q234: 转股中 | R234: 4.80年 | S234: 2.81年 | T234: 2.08 | U234: 267 | V234: 0.96499999999999997 | W234: 7.6999999999999999e-002 | X234: 7.8e-002 | Y234: 27 | Z234: 2.63 | AA234: -1.78e-002 | AB234: -2.5099999999999997e-002 | AC234: -7.7100000000000002e-002 | AD234: -7.9500000000000001e-002 | AE234: 87.45 | AF234: 91.75 | AG234: 0.61 | AH234: AA- | AI234: 6.1100000000000002e-002 | AJ234: =H234+100*O234 -> 161.90000000000001 | AK234: 162.4 | AL234: 294 | AM234: 70.6 | AN234: 297 | AO234: -9.8000000000000004e-002 | AP234: 20 | AQ234: 思特转债!!
A235: 366 | B235: 128014 | C235: 永东转债! | D235: 2753 | E235: 永东股份 | F235: 化工 | G235: 化工 | H235: 113.098 | I235: 1.7000000000000001e-002 | J235: -5.7999999999999996e-003 | K235: 11.12 | L235: 3.6299999999999999e-002 | M235: 109.8 | N235: 12.52 | O235: 0.27300000000000002 | P235: 88.82 | Q235: 转股中 | R235: 1.66年 | S235: 回售内 | T235: 3.37 | U235: 13 | V235: 3.4000000000000002e-002 | W235: 8.1000000000000003e-002 | X235: 7.2000000000000008e-002 | Y235: 42 | Z235: 2.1 | AA235: -1.7899999999999999e-002 | AB235: -2.8500000000000001e-002 | AC235: 回售内 | AD235: 回售内 | AE235: 100.3 | AF235: 99.84 | AG235: 0.31 | AH235: AA- | AI235: 5.9699999999999996e-002 | AJ235: =H235+100*O235 -> 140.398 | AK235: 137.4 | AL235: 122 | AM235: 37.1 | AN235: 70 | AO235: 9.6000000000000002e-002 | AP235: 37 | AQ235: 永东转债!
A236: 164 | B236: 110071 | C236: 湖盐转债! | D236: 600929 | E236: 雪天盐业 | F236: 食品饮料 | G236: 食品饮料 | H236: 125.7 | I236: 4.8999999999999998e-003 | J236: -1.3100000000000001e-002 | K236: 7.33 | L236: -1.21e-002 | M236: 114.9 | N236: 6.52 | O236: 0.11800000000000001 | P236: 112.42 | Q236: 转股中 | R236: 4.89年 | S236: 2.89年 | T236: 7.2 | U236: 16 | V236: 1.7000000000000001e-002 | W236: 0.105 | X236: 0.11800000000000001 | Y236: 68 | Z236: 2.53 | AA236: -1.8500000000000003e-002 | AB236: -2.3799999999999998e-002 | AC236: -6.2400000000000004e-002 | AD236: -6.4299999999999996e-002 | AE236: 91.79 | AF236: 95.16 | AG236: 0.68 | AH236: AA | AI236: 4.0099999999999997e-002 | AJ236: =H236+100*O236 -> 137.5 | AK236: 139 | AL236: 132 | AM236: 43.8 | AN236: 137 | AO236: -2.9999999999999999e-002 | AP236: 23 | AQ236: 湖盐转债!
A237: 11 | B237: 113051 | C237: 节能转债 | D237: 601016 | E237: 节能风电 | F237: 能源电力 | G237: 风能 | H237: 127.51 | I237: 5.4000000000000003e-003 | J237: 8.199999999999999e-003 | K237: 4.36 | L237: 2.1099999999999997e-002 | M237: 114.5 | N237: 4.05 | O237: 0.184 | P237: 107.65 | Q237: 4月7天 | R237: 5.83年 | S237: 3.84年 | T237: 30 | U237: 101 | V237: 2.6000000000000002e-002 | W237: 0.13699999999999998 | X237: 0.14800000000000002 | Y237: 219 | Z237: 2.16 | AA237: -1.8500000000000003e-002 | AB237: -2.2799999999999997e-002 | AC237: -5.2199999999999996e-002 | AD237: -5.3499999999999999e-002 | AE237: 89.27 | AF237: 93.11 | AG237: 0.64 | AH237: AA+ | AI237: 3.6600000000000001e-002 | AJ237: =H237+100*O237 -> 145.91 | AK237: 147.4 | AL237: 215 | AM237: 54.3 | AN237: 203 | AO237: 2.5000000000000001e-002 | AP237: 4 | AQ237: 节能转债
A238: 3 | B238: 113627 | C238: 太平转债 | D238: 603877 | E238: 太平鸟 | F238: 服装纺织 | G238: 服装行业 | H238: 128.36 | I238: -1.8700000000000001e-002 | J238: -4.1999999999999997e-003 | K238: 48.98 | L238: -3.9599999999999996e-002 | M238: 115.1 | N238: 50.32 | O238: 0.31900000000000001 | P238: 97.34 | Q238: 5月4天 | R238: 5.90年 | S238: 3.90年 | T238: 8 | U238: 23 | V238: 2.3e-002 | W238: 3.4000000000000002e-002 | X238: 3.3000000000000002e-002 | Y238: 234 | Z238: 5.69 | AA238: -1.8600000000000002e-002 | AB238: -2.3e-002 | AC238: -5.1699999999999996e-002 | AD238: -5.3200000000000004e-002 | AE238: 87.89 | AF238: 90.88 | AG238: 0.58 | AH238: AA | AI238: 4.1599999999999998e-002 | AJ238: =H238+100*O238 -> 160.26000000000002 | AK238: 159.4 | AL238: 283 | AM238: 68.5 | AN238: 286 | AO238: -3.7999999999999999e-002 | AP238: 2 | AQ238: 太平转债
A239: 181 | B239: 123052 | C239: 飞鹿转债 | D239: 300665 | E239: 飞鹿股份 | F239: 化工 | G239: 化工 | H239: 138.55 | I239: 2.8000000000000004e-003 | J239: 6.8999999999999999e-003 | K239: 9.76 | L239: 1.24e-002 | M239: 126.8 | N239: 7.05 | O239: 1.e-003 | P239: 138.44 | Q239: 转股中 | R239: 4.79年 | S239: 2.79年 | T239: 1.51 | U239: 50 | V239: 0.23999999999999999 | W239: 8.900000000000001e-002 | X239: 0.124 | Y239: 17 | Z239: 2.54 | AA239: -1.8700000000000001e-002 | AB239: -2.76e-002 | AC239: -9.1199999999999989e-002 | AD239: -9.3800000000000008e-002 | AE239: 85.44 | AF239: 91.61 | AG239: 0.79 | AH239: A+ | AI239: 7.2099999999999997e-002 | AJ239: =H239+100*O239 -> 138.65000000000001 | AK239: 138.7 | AL239: 128 | AM239: 47.1 | AN239: 152 | AO239: 5.4000000000000006e-002 | AP239: 21 | AQ239: 飞鹿转债
A240: 269 | B240: 113541 | C240: 荣晟转债! | D240: 603165 | E240: 荣晟环保 | F240: 造纸包装 | G240: 包装用纸 | H240: 123.24 | I240: 9.7000000000000003e-003 | J240: 8.0000000000000002e-003 | K240: 12.42 | L240: 2.4799999999999999e-002 | M240: 114.3 | N240: 10.84 | O240: 7.5999999999999998e-002 | P240: 114.58 | Q240: 转股中 | R240: 3.92年 | S240: 1.92年 | T240: 1.63 | U240: 8.9 | V240: 4.4000000000000004e-002 | W240: 5.0000000000000003e-002 | X240: 5.7000000000000002e-002 | Y240: 33 | Z240: 1.86 | AA240: -1.9299999999999998e-002 | AB240: -2.5699999999999997e-002 | AC240: -8.3599999999999994e-002 | AD240: -8.5900000000000004e-002 | AE240: 90.89 | AF240: 90.96 | AG240: 0.71 | AH240: AA- | AI240: 6.1100000000000002e-002 | AJ240: =H240+100*O240 -> 130.84 | AK240: 131.9 | AL240: 68 | AM240: 40.9 | AN240: 109 | AO240: 1.4999999999999999e-002 | AP240: 43 | AQ240: 荣晟转债!
A241: 25 | B241: 113048 | C241: 晶科转债! | D241: 601778 | E241: 晶科科技 | F241: 能源电力 | G241: 太阳能 | H241: 130.9 | I241: -4.53e-002 | J241: 1.1000000000000001e-002 | K241: 7.38 | L241: -4.2800000000000005e-002 | M241: 117.1 | N241: 5.48 | O241: -2.7999999999999997e-002 | P241: 134.67 | Q241: 2月10天 | R241: 5.67年 | S241: 3.68年 | T241: 30 | U241: 498 | V241: 0.125 | W241: 0.14699999999999999 | X241: 0.19800000000000001 | Y241: 204 | Z241: 1.88 | AA241: -1.9799999999999998e-002 | AB241: -2.4900000000000002e-002 | AC241: -5.9500000000000004e-002 | AD241: -6.1100000000000002e-002 | AE241: 88.71 | AF241: 93.31 | AG241: 0.8 | AH241: AA | AI241: 4.1599999999999998e-002 | AJ241: =H241+100*O241 -> 128.09999999999999 | AK241: 127.1 | AL241: 28 | AM241: 33.8 | AN241: 50 | AO241: 0.21600000000000003 | AP241: 9 | AQ241: 晶科转债!
A242: 228 | B242: 128094 | C242: 星帅转债! | D242: 2860 | E242: 星帅尔 | F242: 家电 | G242: 零部件制 | H242: 131.98 | I242: -3.8e-003 | J242: 3.8e-003 | K242: 17.97 | L242: 0. | M242: 121 | N242: 13.8 | O242: 1.3999999999999999e-002 | P242: 130.22 | Q242: 转股中 | R242: 4.41年 | S242: 2.41年 | T242: 2.24 | U242: 15 | V242: 5.2000000000000005e-002 | W242: 6.2e-002 | X242: 8.1000000000000003e-002 | Y242: 36 | Z242: 3.51 | AA242: -2.e-002 | AB242: -2.7799999999999998e-002 | AC242: -8.900000000000001e-002 | AD242: -9.1700000000000004e-002 | AE242: 87.2 | AF242: 89.71 | AG242: 0.79 | AH242: A+ | AI242: 7.2099999999999997e-002 | AJ242: =H242+100*O242 -> 133.38 | AK242: 133.7 | AL242: 88 | AM242: 44 | AN242: 138 | AO242: -5.7999999999999996e-002 | AP242: 31 | AQ242: 星帅转债!
A243: 98 | B243: 110077 | C243: 洪城转债 | D243: 600461 | E243: 洪城环境 | F243: 城市公用 | G243: 城市公用 | H243: 126.22 | I243: 2.3999999999999998e-003 | J243: -1.3100000000000001e-002 | K243: 7.44 | L243: -1.5900000000000001e-002 | M243: 113.5 | N243: 6.71 | O243: 0.13800000000000001 | P243: 110.88 | Q243: 转股中 | R243: 5.25年 | S243: 3.25年 | T243: 18 | U243: 23 | V243: 1.e-002 | W243: 0.255 | X243: 0.28300000000000003 | Y243: 71 | Z243: 1.37 | AA243: -2.0299999999999999e-002 | AB243: -2.4700000000000003e-002 | AC243: -6.0100000000000001e-002 | AD243: -6.1200000000000004e-002 | AE243: 90.5 | AF243: 94.21 | AG243: 0.67 | AH243: AA+ | AI243: 3.6600000000000001e-002 | AJ243: =H243+100*O243 -> 140.02000000000001 | AK243: 141.6 | AL243: 161 | AM243: 47.4 | AN243: 156 | AO243: 2.7000000000000003e-002 | AP243: 6 | AQ243: 洪城转债
A244: 202 | B244: 113575 | C244: 东时转债!! | D244: 603377 | E244: 东方时尚 | F244: 其他 | G244: 其他 | H244: 124.3 | I244: -1.6299999999999999e-002 | J244: 1.49e-002 | K244: 8.18 | L244: -7.3000000000000001e-003 | M244: 113.1 | N244: 12.15 | O244: 0.84599999999999997 | P244: 67.33 | Q244: 转股中 | R244: 4.63年 | S244: 2.64年 | T244: 0.98 | U244: 14 | V244: 0.11 | W244: 1.7000000000000001e-002 | X244: 1.1000000000000001e-002 | Y244: 60 | Z244: 2.38 | AA244: -2.06e-002 | AB244: -2.5499999999999998e-002 | AC244: -6.4000000000000001e-002 | AD244: -6.6100000000000006e-002 | AE244: 92.74 | AF244: 94.61 | AG244: 0.19 | AH244: AA | AI244: 4.0099999999999997e-002 | AJ244: =H244+100*O244 -> 208.89999999999998 | AK244: 181.3 | AL244: 322 | AM244: 86.7 | AN244: 319 | AO244: -3.6000000000000004e-002 | AP244: 15 | AQ244: 东时转债!!
A245: 2 | B245: 118001 | C245: 金博转债 | D245: 688598 | E245: 金博股份 | F245: 能源电力 | G245: 太阳能 | H245: 137.49 | I245: -3.7000000000000002e-003 | J245: 1.2e-002 | K245: 290.76 | L245: 1.1299999999999999e-002 | M245: 121.6 | N245: 271.62 | O245: 0.28399999999999997 | P245: 107.05 | Q245: 5月12天 | R245: 5.92年 | S245: 3.92年 | T245: 6 | U245: 146 | V245: 0.17699999999999999 | W245: 2.6000000000000002e-002 | X245: 2.7999999999999997e-002 | Y245: 233 | Z245: 16.92 | AA245: -2.0899999999999998e-002 | AB245: -2.69e-002 | AC245: -6.5299999999999997e-002 | AD245: -6.7199999999999996e-002 | AE245: 78.5 | AF245: 80.62 | AG245: 0.73 | AH245: A+ | AI245: 7.3599999999999999e-002 | AJ245: =H245+100*O245 -> 165.89000000000001 | AK245: 167.9 | AL245: 305 | AM245: 87.3 | AN245: 320 | AO245: 1.6e-002 | AP245: 2 | AQ245: 金博转债
A246: 104 | B246: 128137 | C246: 洁美转债 | D246: 2859 | E246: 洁美科技 | F246: 电子 | G246: 元器件制 | H246: 131.1 | I246: -1.18e-002 | J246: 2.06e-002 | K246: 30.56 | L246: 1.23e-002 | M246: 117.3 | N246: 27.63 | O246: 0.185 | P246: 110.6 | Q246: 转股中 | R246: 5.21年 | S246: 3.21年 | T246: 5.99 | U246: 9.4 | V246: 1.2e-002 | W246: 4.8000000000000001e-002 | X246: 5.2999999999999999e-002 | Y246: 125 | Z246: 6.62 | AA246: -2.1499999999999998e-002 | AB246: -2.7200000000000002e-002 | AC246: -6.7500000000000004e-002 | AD246: -6.9400000000000003e-002 | AE246: 84.77 | AF246: 86.09 | AG246: 0.72 | AH246: AA- | AI246: 6.2600000000000003e-002 | AJ246: =H246+100*O246 -> 149.59999999999999 | AK246: 151.6 | AL246: 240 | AM246: 65.5 | AN246: 270 | AO246: -5.5999999999999994e-002 | AP246: 5 | AQ246: 洁美转债
A247: 184 | B247: 123051 | C247: 今天转债 | D247: 300532 | E247: 今天国际 | F247: 计算机及 | G247: 软件开发 | H247: 135.72 | I247: -2.6699999999999998e-002 | J247: -3.0000000000000001e-003 | K247: 11.19 | L247: -3.8699999999999998e-002 | M247: 122.3 | N247: 8.7 | O247: 5.5e-002 | P247: 128.62 | Q247: 转股中 | R247: 4.79年 | S247: 2.79年 | T247: 2.79 | U247: 209 | V247: 0.55399999999999994 | W247: 9.0999999999999998e-002 | X247: 0.11800000000000001 | Y247: 31 | Z247: 3.92 | AA247: -2.2000000000000002e-002 | AB247: -2.9600000000000001e-002 | AC247: -8.6199999999999999e-002 | AD247: -8.8599999999999998e-002 | AE247: 85.03 | AF247: 88.33 | AG247: 0.77 | AH247: A+ | AI247: 7.2099999999999997e-002 | AJ247: =H247+100*O247 -> 141.22 | AK247: 142.8 | AL247: 176 | AM247: 54.5 | AN247: 204 | AO247: 7.8e-002 | AP247: 18 | AQ247: 今天转债
A248: 108 | B248: 113607 | C248: 伟20转债! | D248: 603568 | E248: 伟明环保 | F248: 城市公用 | G248: 三废处理 | H248: 129.04 | I248: -2.3e-002 | J248: -9.7999999999999997e-003 | K248: 26.45 | L248: -4.41e-002 | M248: 115.1 | N248: 21.71 | O248: 5.9000000000000004e-002 | P248: 121.83 | Q248: 转股中 | R248: 5.20年 | S248: 3.20年 | T248: 12 | U248: 26 | V248: 1.7000000000000001e-002 | W248: 3.6000000000000004e-002 | X248: 4.4000000000000004e-002 | Y248: 332 | Z248: 5.95 | AA248: -2.2099999999999998e-002 | AB248: -2.7099999999999999e-002 | AC248: -6.3600000000000004e-002 | AD248: -6.54e-002 | AE248: 90.43 | AF248: 93.5 | AG248: 0.75 | AH248: AA | AI248: 4.1599999999999998e-002 | AJ248: =H248+100*O248 -> 134.94 | AK248: 136.2 | AL248: 115 | AM248: 42.7 | AN248: 130 | AO248: -2.2000000000000002e-002 | AP248: 6 | AQ248: 伟20转债!
A249: 71 | B249: 123091 | C249: 长海转债 | D249: 300196 | E249: 长海股份 | F249: 其他 | G249: 非金属矿 | H249: 131.5 | I249: 7.7000000000000002e-003 | J249: 3.3399999999999999e-002 | K249: 19.2 | L249: 5.6100000000000004e-002 | M249: 116.2 | N249: 16.14 | O249: 0.105 | P249: 118.96 | Q249: 转股中 | R249: 5.34年 | S249: 3.34年 | T249: 5.5 | U249: 20 | V249: 2.7999999999999997e-002 | W249: 7.0000000000000007e-002 | X249: 8.3000000000000004e-002 | Y249: 78 | Z249: 2.64 | AA249: -2.3300000000000001e-002 | AB249: -2.8500000000000001e-002 | AC249: -6.6000000000000003e-002 | AD249: -6.7799999999999999e-002 | AE249: 90.01 | AF249: 93.87 | AG249: 0.73 | AH249: AA | AI249: 4.1599999999999998e-002 | AJ249: =H249+100*O249 -> 142. | AK249: 144 | AL249: 187 | AM249: 50.2 | AN249: 175 | AO249: 4.0000000000000001e-003 | AP249: 3 | AQ249: 长海转债
A250: 18 | B250: 127037 | C250: 银轮转债 | D250: 2126 | E250: 银轮股份 | F250: 汽车 | G250: 零部件制 | H250: 132 | I250: -3.5099999999999999e-002 | J250: 3.5699999999999996e-002 | K250: 11.09 | L250: 8.9999999999999998e-004 | M250: 115.1 | N250: 10.77 | O250: 0.28199999999999997 | P250: 102.97 | Q250: 3月23天 | R250: 5.80年 | S250: 3.80年 | T250: 7 | U250: 103 | V250: 0.111 | W250: 8.0000000000000002e-002 | X250: 8.199999999999999e-002 | Y250: 88 | Z250: 2.14 | AA250: -2.3700000000000002e-002 | AB250: -2.8199999999999999e-002 | AC250: -5.9699999999999996e-002 | AD250: -6.13e-002 | AE250: 88.26 | AF250: 91.26 | AG250: 0.63 | AH250: AA | AI250: 4.1599999999999998e-002 | AJ250: =H250+100*O250 -> 160.19999999999999 | AK250: 161 | AL250: 290 | AM250: 69.8 | AN250: 291 | AO250: -5.4000000000000006e-002 | AP250: 2 | AQ250: 银轮转债
A251: 117 | B251: 127022 | C251: 恒逸转债 | D251: 703 | E251: 恒逸石化 | F251: 化工 | G251: 化工 | H251: 123.075 | I251: 3.8e-003 | J251: 2.5000000000000001e-003 | K251: 11.6 | L251: 9.5999999999999992e-003 | M251: 108.9 | N251: 11.2 | O251: 0.188 | P251: 103.57 | Q251: 转股中 | R251: 5年56天 | S251: 3年57天 | T251: 20 | U251: 52 | V251: 2.2000000000000002e-002 | W251: 4.7e-002 | X251: 4.9000000000000002e-002 | Y251: 425 | Z251: 1.72 | AA251: -2.3799999999999998e-002 | AB251: -2.69e-002 | AC251: -5.3399999999999996e-002 | AD251: -5.4900000000000004e-002 | AE251: 91.17 | AF251: 90.74 | AG251: 0.65 | AH251: AA+ | AI251: 3.6600000000000001e-002 | AJ251: =H251+100*O251 -> 141.875 | AK251: 142.6 | AL251: 172 | AM251: 51.4 | AN251: 183 | AO251: -4.5999999999999999e-002 | AP251: 7 | AQ251: 恒逸转债
A252: 1 | B252: 110081 | C252: N闻泰转 | D252: 600745 | E252: 闻泰科技 | F252: 电子 | G252: 电子行业 | H252: 129.16 | I252: 0.29199999999999998 | J252: 0. | K252: 101.8 | L252: -1.2800000000000001e-002 | M252: 111.9 | N252: 96.67 | O252: 0.22699999999999998 | P252: 105.31 | Q252: 5月17天 | R252: 5.94年 | S252: 3.94年 | T252: 86 | U252: 1871. | V252: 0.16800000000000001 | W252: 6.8000000000000005e-002 | X252: 7.0999999999999994e-002 | Y252: 1267. | Z252: 4.25 | AA252: -2.41e-002 | AB252: -2.76e-002 | AC252: -5.5099999999999996e-002 | AD252: -5.62e-002 | AE252: 88.4 | AF252: 90.61 | AG252: 0.64 | AH252: AA+ | AI252: 3.6600000000000001e-002 | AJ252: =H252+100*O252 -> 151.85999999999999 | AK252: 153 | AL252: 256 | AM252: 62.4 | AN252: 262 | AO252: -2.6000000000000002e-002 | AP252: 6 | AQ252: N闻泰转
A253: 133 | B253: 113039 | C253: 嘉泽转债! | D253: 601619 | E253: 嘉泽新能 | F253: 能源电力 | G253: 风能 | H253: 127.93 | I253: -1.01e-002 | J253: 1.55e-002 | K253: 4.35 | L253: 6.8999999999999999e-003 | M253: 113.1 | N253: 3.46 | O253: 1.8000000000000002e-002 | P253: 125.72 | Q253: 转股中 | R253: 5年3.5天 | S253: 3年4.5天 | T253: 5.4 | U253: 150 | V253: 0.218 | W253: 5.2999999999999999e-002 | X253: 6.6000000000000003e-002 | Y253: 103 | Z253: 2.53 | AA253: -2.4799999999999999e-002 | AB253: -2.9300000000000003e-002 | AC253: -6.480000000000001e-002 | AD253: -6.6699999999999995e-002 | AE253: 91.14 | AF253: 92.61 | AG253: 0.78 | AH253: AA | AI253: 4.1599999999999998e-002 | AJ253: =H253+100*O253 -> 129.73000000000002 | AK253: 130.1 | AL253: 45 | AM253: 37.5 | AN253: 77 | AO253: 7.5999999999999998e-002 | AP253: 36 | AQ253: 嘉泽转债!
A254: 262 | B254: 128075 | C254: 远东转债! | D254: 2406 | E254: 远东传动 | F254: 汽车 | G254: 零部件制 | H254: 127.363 | I254: -5.4000000000000003e-003 | J254: 1.11e-002 | K254: 6.67 | L254: 7.6e-003 | M254: 114.9 | N254: 5.29 | O254: 1.e-002 | P254: 126.09 | Q254: 转股中 | R254: 4年33天 | S254: 2年34天 | T254: 5.44 | U254: 35 | V254: 5.0000000000000003e-002 | W254: 0.13100000000000001 | X254: 0.16500000000000001 | Y254: 42 | Z254: 1.26 | AA254: -2.5399999999999999e-002 | AB254: -3.1600000000000003e-002 | AC254: -8.900000000000001e-002 | AD254: -9.1499999999999998e-002 | AE254: 94.71 | AF254: 98.18 | AG254: 0.76 | AH254: AA | AI254: 4.0099999999999997e-002 | AJ254: =H254+100*O254 -> 128.363 | AK254: 128.6 | AL254: 37 | AM254: 30.5 | AN254: 30 | AO254: 5.0000000000000003e-002 | AP254: 15 | AQ254: 远东转债!
A255: 9 | B255: 113626 | C255: 伯特转债 | D255: 603596 | E255: 伯特利 | F255: 汽车 | G255: 零部件制 | H255: 140.66 | I255: -6.3e-003 | J255: 5.9999999999999995e-004 | K255: 42.74 | L255: -8.1000000000000013e-003 | M255: 121.1 | N255: 36 | O255: 0.185 | P255: 118.72 | Q255: 4月18天 | R255: 5.86年 | S255: 3.86年 | T255: 9.02 | U255: 12 | V255: 9.0000000000000011e-003 | W255: 5.2000000000000005e-002 | X255: 6.0999999999999999e-002 | Y255: 175 | Z255: 6.18 | AA255: -2.5600000000000001e-002 | AB255: -3.15e-002 | AC255: -7.3700000000000002e-002 | AD255: -7.5199999999999989e-002 | AE255: 88.05 | AF255: 95.77 | AG255: 0.69 | AH255: AA | AI255: 4.1599999999999998e-002 | AJ255: =H255+100*O255 -> 159.16 | AK255: 162.6 | AL255: 295 | AM255: 66.8 | AN255: 277 | AO255: 3.2000000000000001e-002 | AP255: 3 | AQ255: 伯特转债
A256: 40 | B256: 127031 | C256: 洋丰转债! | D256: 902 | E256: 新洋丰 | F256: 化工 | G256: 农化 | H256: 135.101 | I256: 2.5000000000000001e-002 | J256: -1.7399999999999999e-002 | K256: 19.2 | L256: 1.43e-002 | M256: 117.1 | N256: 19.94 | O256: 0.40299999999999997 | P256: 96.29 | Q256: 49天 | R256: 5.59年 | S256: 3.60年 | T256: 10 | U256: 180 | V256: 0.13100000000000001 | W256: 4.0000000000000001e-002 | X256: 3.7999999999999999e-002 | Y256: 250 | Z256: 3.4 | AA256: -2.5699999999999997e-002 | AB256: -3.0800000000000001e-002 | AC256: -6.8600000000000008e-002 | AD256: -7.0300000000000001e-002 | AE256: 89 | AF256: 93.61 | AG256: 0.54 | AH256: AA | AI256: 4.1599999999999998e-002 | AJ256: =H256+100*O256 -> 175.40100000000001 | AK256: 173.9 | AL256: 315 | AM256: 80.3 | AN256: 312 | AO256: 4.0000000000000001e-003 | AP256: 4 | AQ256: 洋丰转债!
A257: 57 | B257: 123098 | C257: 一品转债 | D257: 300723 | E257: 一品红 | F257: 医药 | G257: 医药行业 | H257: 142.59 | I257: -2.e-003 | J257: 2.e-003 | K257: 36.26 | L257: 0. | M257: 124 | N257: 25.45 | O257: 1.e-003 | P257: 142.48 | Q257: 转股中 | R257: 5.44年 | S257: 3.44年 | T257: 4.42 | U257: 136 | V257: 0.21899999999999997 | W257: 4.2000000000000003e-002 | X257: 5.9999999999999998e-002 | Y257: 105 | Z257: 7.08 | AA257: -2.58e-002 | AB257: -3.2899999999999999e-002 | AC257: -8.4700000000000011e-002 | AD257: -8.6500000000000007e-002 | AE257: 83.67 | AF257: 89.73 | AG257: 0.82 | AH257: AA- | AI257: 6.2600000000000003e-002 | AJ257: =H257+100*O257 -> 142.69 | AK257: 142.7 | AL257: 173 | AM257: 53 | AN257: 196 | AO257: -3.0000000000000001e-003 | AP257: 8 | AQ257: 一品转债
A258: 168 | B258: 123057 | C258: 美联转债! | D258: 300586 | E258: 美联新材 | F258: 化工 | G258: 橡胶塑料 | H258: 133.5 | I258: -1.3999999999999999e-002 | J258: 3.8699999999999998e-002 | K258: 11.02 | L258: 3.3799999999999997e-002 | M258: 117.8 | N258: 9.5 | O258: 0.151 | P258: 116 | Q258: 转股中 | R258: 4.86年 | S258: 2.86年 | T258: 2.07 | U258: 834 | V258: 3. | W258: 3.6000000000000004e-002 | X258: 4.2000000000000003e-002 | Y258: 58 | Z258: 6.77 | AA258: -2.5899999999999999e-002 | AB258: -3.2000000000000001e-002 | AC258: -8.0600000000000005e-002 | AD258: -8.2599999999999993e-002 | AE258: 86.82 | AF258: 88.85 | AG258: 0.73 | AH258: AA- | AI258: 6.1100000000000002e-002 | AJ258: =H258+100*O258 -> 148.59999999999999 | AK258: 151 | AL258: 233 | AM258: 62.2 | AN258: 257 | AO258: 0.126 | AP258: 21 | AQ258: 美联转债!
A259: 81 | B259: 123086 | C259: 海兰转债! | D259: 300065 | E259: 海兰信 | F259: 电子 | G259: 电子产品 | H259: 141.997 | I259: -6.3e-003 | J259: -1.47e-002 | K259: 10.18 | L259: -2.58e-002 | M259: 123.5 | N259: 7.27 | O259: 1.3999999999999999e-002 | P259: 140.03 | Q259: 转股中 | R259: 5.31年 | S259: 3.31年 | T259: 6.53 | U259: 839 | V259: 0.89800000000000002 | W259: 0.10800000000000001 | X259: 0.151 | Y259: 61 | Z259: 2.73 | AA259: -2.64e-002 | AB259: -3.3500000000000002e-002 | AC259: -8.6899999999999991e-002 | AD259: -8.8699999999999987e-002 | AE259: 84.27 | AF259: 90.06 | AG259: 0.81 | AH259: AA- | AI259: 6.2600000000000003e-002 | AJ259: =H259+100*O259 -> 143.39700000000002 | AK259: 144 | AL259: 186 | AM259: 53.9 | AN259: 201 | AO259: 0.128 | AP259: 19 | AQ259: 海兰转债!
A260: 55 | B260: 123100 | C260: 朗科转债 | D260: 300543 | E260: 朗科智能 | F260: 电子 | G260: 电子产品 | H260: 135.799 | I260: -1.24e-002 | J260: 6.0000000000000001e-003 | K260: 15.06 | L260: -7.9000000000000008e-003 | M260: 117.5 | N260: 11.61 | O260: 4.7e-002 | P260: 129.72 | Q260: 2.5天 | R260: 5.47年 | S260: 3.48年 | T260: 3.8 | U260: 28 | V260: 5.5e-002 | W260: 9.4e-002 | X260: 0.122 | Y260: 40 | Z260: 3.31 | AA260: -2.6600000000000002e-002 | AB260: -3.1899999999999998e-002 | AC260: -7.17e-002 | AD260: -7.3499999999999996e-002 | AE260: 83.44 | AF260: 84.87 | AG260: 0.81 | AH260: AA- | AI260: 6.2600000000000003e-002 | AJ260: =H260+100*O260 -> 140.499 | AK260: 141.9 | AL260: 162 | AM260: 57 | AN260: 228 | AO260: -5.0999999999999997e-002 | AP260: 9 | AQ260: 朗科转债
A261: 336 | B261: 128036 | C261: 金农转债!! | D261: 2548 | E261: 金新农 | F261: 农业 | G261: 畜牧业 | H261: 117.125 | I261: -7.9000000000000008e-003 | J261: 7.1999999999999998e-003 | K261: 5.11 | L261: -5.7999999999999996e-003 | M261: 109.3 | N261: 6.93 | O261: 0.58799999999999997 | P261: 73.74 | Q261: 转股中 | R261: 2.55年 | S261: 0.55年 | T261: 1.46 | U261: 9.4 | V261: 5.5e-002 | W261: 4.0999999999999995e-002 | X261: 2.9999999999999999e-002 | Y261: 35 | Z261: 1.35 | AA261: -2.7200000000000002e-002 | AB261: -3.3700000000000001e-002 | AC261: -0.18899999999999997 | AD261: -0.19399999999999998 | AE261: 97.67 | AF261: 94.52 | AG261: 0.12 | AH261: AA- | AI261: 5.9699999999999996e-002 | AJ261: =H261+100*O261 -> 175.92500000000001 | AK261: 160.5 | AL261: 287 | AM261: 62.8 | AN261: 263 | AO261: -2.9999999999999999e-002 | AP261: 16 | AQ261: 金农转债!!
A262: 240 | B262: 128085 | C262: 鸿达转债! | D262: 2002 | E262: 鸿达兴业 | F262: 化工 | G262: 化工 | H262: 139.998 | I262: -3.6299999999999999e-002 | J262: -2.7000000000000001e-003 | K262: 5.46 | L262: -4.3799999999999999e-002 | M262: 124.4 | N262: 3.91 | O262: 3.0000000000000001e-003 | P262: 139.64 | Q262: 转股中 | R262: 4.32年 | S262: 2.32年 | T262: 5.8 | U262: 420 | V262: 0.51200000000000001 | W262: 3.5000000000000003e-002 | X262: 4.9000000000000002e-002 | Y262: 164 | Z262: 1.74 | AA262: -2.75e-002 | AB262: -3.6600000000000001e-002 | AC262: -0.113 | AD262: -0.11599999999999999 | AE262: 70.3 | AF262: 63.79 | AG262: 0.89 | AH262: B | AI262: 0.1721 | AJ262: =H262+100*O262 -> 140.298 | AK262: 140.4 | AL262: 149 | AM262: 70.1 | AN262: 293 | AO262: 8.8000000000000009e-002 | AP262: 100 | AQ262: 鸿达转债!
A263: 17 | B263: 123115 | C263: 捷捷转债 | D263: 300623 | E263: 捷捷微电 | F263: 电子 | G263: 元器件制 | H263: 140.001 | I263: 1.3300000000000001e-002 | J263: -5.3e-003 | K263: 32.76 | L263: 1.0800000000000001e-002 | M263: 118.5 | N263: 29 | O263: 0.23899999999999999 | P263: 112.97 | Q263: 3月27天 | R263: 5.80年 | S263: 3.80年 | T263: 12 | U263: 173 | V263: 0.10199999999999999 | W263: 5.0000000000000003e-002 | X263: 5.5999999999999994e-002 | Y263: 241 | Z263: 6.19 | AA263: -2.8799999999999999e-002 | AB263: -3.4099999999999998e-002 | AC263: -7.3099999999999998e-002 | AD263: -7.4800000000000005e-002 | AE263: 81.8 | AF263: 83.91 | AG263: 0.74 | AH263: AA- | AI263: 6.2600000000000003e-002 | AJ263: =H263+100*O263 -> 163.90100000000001 | AK263: 167 | AL263: 303 | AM263: 83.1 | AN263: 316 | AO263: -6.5000000000000002e-002 | AP263: 5 | AQ263: 捷捷转债
A264: 69 | B264: 123092 | C264: 天壕转债 | D264: 300332 | E264: 天壕环境 | F264: 石油天然 | G264: 天然气 | H264: 141.79 | I264: -8.3999999999999995e-003 | J264: 2.7900000000000001e-002 | K264: 6.76 | L264: 2.4199999999999999e-002 | M264: 121.6 | N264: 5.19 | O264: 8.900000000000001e-002 | P264: 130.25 | Q264: 转股中 | R264: 5.34年 | S264: 3.35年 | T264: 4.23 | U264: 34 | V264: 5.7000000000000002e-002 | W264: 7.0999999999999994e-002 | X264: 9.3000000000000013e-002 | Y264: 60 | Z264: 1.77 | AA264: -2.8999999999999998e-002 | AB264: -3.5499999999999997e-002 | AC264: -8.3900000000000002e-002 | AD264: -8.5999999999999993e-002 | AE264: 81.79 | AF264: 84 | AG264: 0.8 | AH264: A+ | AI264: 7.3599999999999999e-002 | AJ264: =H264+100*O264 -> 150.69 | AK264: 153.3 | AL264: 258 | AM264: 69.3 | AN264: 289 | AO264: 4.2000000000000003e-002 | AP264: 9 | AQ264: 天壕转债
A265: 343 | B265: 110043 | C265: 无锡转债! | D265: 600908 | E265: 无锡银行 | F265: 金融 | G265: 银行行业 | H265: 116.36 | I265: -2.0999999999999999e-003 | J265: 1.1999999999999999e-003 | K265: 5.65 | L265: -1.8e-003 | M265: 108.3 | N265: 5.61 | O265: 0.155 | P265: 100.71 | Q265: 转股中 | R265: 2.45年 | S265: 无权 | T265: 29.2 | U265: 16 | V265: 5.0000000000000001e-003 | W265: 0.27800000000000002 | X265: 0.28000000000000003 | Y265: 105 | Z265: 0.85 | AA265: -2.9300000000000003e-002 | AB265: -3.5400000000000001e-002 | AC265: 无权 | AD265: 无权 | AE265: 无权 | AF265: 99.97 | AG265: 0.51 | AH265: AA+ | AI265: 3.3700000000000001e-002 | AJ265: =H265+100*O265 -> 131.86000000000001 | AK265: 132 | AL265: 70 | AM265: 32 | AN265: 38 | AO265: -2.5000000000000001e-002 | AP265: 23 | AQ265: 无锡转债!
A266: 194 | B266: 123050 | C266: 聚飞转债! | D266: 300303 | E266: 聚飞光电 | F266: 电子 | G266: LED制 | H266: 142 | I266: 3.0499999999999999e-002 | J266: 2.8999999999999998e-003 | K266: 6.8 | L266: 4.2900000000000001e-002 | M266: 123.8 | N266: 5.08 | O266: 6.0999999999999999e-002 | P266: 133.86 | Q266: 转股中 | R266: 4.65年 | S266: 2.65年 | T266: 3.75 | U266: 948 | V266: 1.76 | W266: 4.2999999999999997e-002 | X266: 5.7999999999999996e-002 | Y266: 87 | Z266: 3.53 | AA266: -2.9600000000000001e-002 | AB266: -3.78e-002 | AC266: -0.105 | AD266: -0.107 | AE266: 87.92 | AF266: 94.54 | AG266: 0.78 | AH266: AA- | AI266: 6.1100000000000002e-002 | AJ266: =H266+100*O266 -> 148.09999999999999 | AK266: 150.1 | AL266: 230 | AM266: 55.6 | AN266: 213 | AO266: -7.9000000000000001e-002 | AP266: 14 | AQ266: 聚飞转债!
A267: 342 | B267: 128035 | C267: 大族转债! | D267: 2008 | E267: 大族激光 | F267: 机械装备 | G267: 专用设备 | H267: 115.787 | I267: 5.0000000000000001e-003 | J267: -2.0000000000000001e-004 | K267: 41.18 | L267: 3.1300000000000001e-002 | M267: 107.4 | N267: 51.9 | O267: 0.45899999999999996 | P267: 79.34 | Q267: 转股中 | R267: 2.47年 | S267: 0.47年 | T267: 23 | U267: 78 | V267: 2.8999999999999998e-002 | W267: 5.2000000000000005e-002 | X267: 4.2000000000000003e-002 | Y267: 439 | Z267: 4.57 | AA267: -3.04e-002 | AB267: -3.5799999999999998e-002 | AC267: -0.17199999999999999 | AD267: -0.182 | AE267: 101.65 | AF267: 99.07 | AG267: 0.15 | AH267: AA+ | AI267: 3.3700000000000001e-002 | AJ267: =H267+100*O267 -> 161.68700000000001 | AK267: 152.2 | AL267: 246 | AM267: 50.6 | AN267: 179 | AO267: 9.6000000000000002e-002 | AP267: 18 | AQ267: 大族转债!
A268: 372 | B268: 110034 | C268: 九州转债! | D268: 600998 | E268: 九州通 | F268: 医药 | G268: 医药商业 | H268: 109.37 | I268: -3.9000000000000003e-003 | J268: 3.9000000000000003e-003 | K268: 14.52 | L268: -1.4000000000000002e-003 | M268: 108 | N268: 17.83 | O268: 0.34299999999999997 | P268: 81.44 | Q268: 转股中 | R268: 0.41年 | S268: 回售内 | T268: 15 | U268: 8.9 | V268: 5.0000000000000001e-003 | W268: 5.5e-002 | X268: 4.4999999999999998e-002 | Y268: 272 | Z268: 1.35 | AA268: -3.0600000000000002e-002 | AB268: -6.5599999999999992e-002 | AC268: 回售内 | AD268: 回售内 | AE268: 103 | AF268: 106.81 | AG268: 0.01 | AH268: AA+ | AI268: 2.76e-002 | AJ268: =H268+100*O268 -> 143.67000000000002 | AK268: 137.3 | AL268: 121 | AM268: 30.5 | AN268: 31 | AO268: 6.9999999999999993e-003 | AP268: 25 | AQ268: 九州转债!
A269: 85 | B269: 123083 | C269: 朗新转债 | D269: 300682 | E269: 朗新科技 | F269: 计算机及 | G269: 软件开发 | H269: 135.32 | I269: 6.8000000000000005e-003 | J269: -1.24e-002 | K269: 19.4 | L269: -7.1999999999999998e-003 | M269: 115.1 | N269: 15.45 | O269: 7.8e-002 | P269: 125.57 | Q269: 转股中 | R269: 5.30年 | S269: 3.31年 | T269: 8 | U269: 26 | V269: 2.4e-002 | W269: 4.0000000000000001e-002 | X269: 5.0999999999999997e-002 | Y269: 198 | Z269: 3.76 | AA269: -3.0600000000000002e-002 | AB269: -3.5400000000000001e-002 | AC269: -7.46e-002 | AD269: -7.6399999999999996e-002 | AE269: 90.06 | AF269: 93.12 | AG269: 0.77 | AH269: AA | AI269: 4.1599999999999998e-002 | AJ269: =H269+100*O269 -> 143.12 | AK269: 145.1 | AL269: 195 | AM269: 52 | AN269: 191 | AO269: 1.2e-002 | AP269: 6 | AQ269: 朗新转债
A270: 358 | B270: 113502 | C270: 嘉澳转债! | D270: 603822 | E270: 嘉澳环保 | F270: 化工 | G270: 化工 | H270: 119.2 | I270: -8.8999999999999999e-003 | J270: -7.9000000000000008e-003 | K270: 39.01 | L270: -4.8499999999999995e-002 | M270: 111.3 | N270: 44.64 | O270: 0.36399999999999999 | P270: 87.39 | Q270: 转股中 | R270: 2.23年 | S270: 0.23年 | T270: 1.85 | U270: 16 | V270: 7.400000000000001e-002 | W270: 6.4000000000000001e-002 | X270: 5.5999999999999994e-002 | Y270: 29 | Z270: 3.58 | AA270: -3.0899999999999997e-002 | AB270: -3.9900000000000005e-002 | AC270: -0.40000000000000002 | AD270: -0.40799999999999997 | AE270: 99.53 | AF270: 98.09 | AG270: 0.35 | AH270: AA- | AI270: 5.9699999999999996e-002 | AJ270: =H270+100*O270 -> 155.59999999999999 | AK270: 151 | AL270: 234 | AM270: 51.5 | AN270: 185 | AO270: -4.4000000000000004e-002 | AP270: 37 | AQ270: 嘉澳转债!
A271: 19 | B271: 127036 | C271: 三花转债 | D271: 2050 | E271: 三花智控 | F271: 机械装备 | G271: 通用设备 | H271: 137.05 | I271: 6.9999999999999993e-003 | J271: -2.7000000000000001e-003 | K271: 24.28 | L271: 6.1999999999999998e-003 | M271: 114.5 | N271: 21.55 | O271: 0.21600000000000003 | P271: 112.67 | Q271: 3月19天 | R271: 5.78年 | S271: 3.78年 | T271: 30 | U271: 40 | V271: 1.e-002 | W271: 3.4000000000000002e-002 | X271: 3.9e-002 | Y271: 872 | Z271: 8.69 | AA271: -3.1e-002 | AB271: -3.5299999999999998e-002 | AC271: -7.0099999999999996e-002 | AD271: -7.1399999999999991e-002 | AE271: 89.45 | AF271: 93.3 | AG271: 0.69 | AH271: AA+ | AI271: 3.6600000000000001e-002 | AJ271: =H271+100*O271 -> 158.65000000000001 | AK271: 161.4 | AL271: 291 | AM271: 68.1 | AN271: 284 | AO271: 6.8000000000000005e-002 | AP271: 4 | AQ271: 三花转债
A272: 368 | B272: 113011 | C272: 光大转债 | D272: 601818 | E272: 光大银行 | F272: 金融 | G272: 银行行业 | H272: 112.31 | I272: -8.9999999999999998e-004 | J272: -1.2999999999999999e-003 | K272: 3.37 | L272: -5.8999999999999999e-003 | M272: 106.8 | N272: 3.55 | O272: 0.183 | P272: 94.93 | Q272: 转股中 | R272: 1.57年 | S272: 无权 | T272: 242 | U272: 141 | V272: 5.0000000000000001e-003 | W272: 0.13300000000000001 | X272: 0.126 | Y272: 1821. | Z272: 0.51 | AA272: -3.1800000000000002e-002 | AB272: -3.9699999999999999e-002 | AC272: 无权 | AD272: 无权 | AE272: 无权 | AF272: 101.74 | AG272: 0.37 | AH272: AAA | AI272: 3.1699999999999999e-002 | AJ272: =H272+100*O272 -> 130.61000000000001 | AK272: 129.7 | AL272: 43 | AM272: 28 | AN272: 20 | AO272: 5.0000000000000001e-003 | AP272: 13 | AQ272: 光大转债
A273: 87 | B273: 113612 | C273: 永冠转债! | D273: 603681 | E273: 永冠新材 | F273: 化工 | G273: 其他 | H273: 143.55 | I273: 1.3300000000000001e-002 | J273: 9.300000000000001e-003 | K273: 29.76 | L273: 2.2700000000000001e-002 | M273: 121.2 | N273: 20.59 | O273: -6.9999999999999993e-003 | P273: 144.54 | Q273: 转股中 | R273: 5.30年 | S273: 3.30年 | T273: 3.33 | U273: 169 | V273: 0.35299999999999998 | W273: 6.7000000000000004e-002 | X273: 9.6999999999999989e-002 | Y273: 50 | Z273: 3.08 | AA273: -3.2099999999999997e-002 | AB273: -3.85e-002 | AC273: -8.929999999999999e-002 | AD273: -9.1199999999999989e-002 | AE273: 84.58 | AF273: 88.51 | AG273: 1 | AH273: AA- | AI273: 6.2600000000000003e-002 | AJ273: =H273+100*O273 -> 142.85000000000002 | AK273: 142.6 | AL273: 170 | AM273: 54.1 | AN273: 202 | AO273: 7.2000000000000008e-002 | AP273: 7 | AQ273: 永冠转债!
A274: 151 | B274: 128122 | C274: 兴森转债! | D274: 2436 | E274: 兴森科技 | F274: 电子 | G274: 元器件制 | H274: 128.6 | I274: 1.3300000000000001e-002 | J274: -6.8999999999999999e-003 | K274: 13.82 | L274: 1.2500000000000001e-002 | M274: 113 | N274: 14.1 | O274: 0.312 | P274: 98.01 | Q274: 转股中 | R274: 3.92年 | S274: 2.92年 | T274: 2.69 | U274: 71 | V274: 0.20699999999999999 | W274: 1.3000000000000001e-002 | X274: 1.3000000000000001e-002 | Y274: 206 | Z274: 6.41 | AA274: -3.2799999999999996e-002 | AB274: -3.85e-002 | AC274: -6.88e-002 | AD274: -7.0599999999999996e-002 | AE274: 91.6 | AF274: 97.02 | AG274: 0.51 | AH274: AA | AI274: 4.0099999999999997e-002 | AJ274: =H274+100*O274 -> 159.79999999999998 | AK274: 159.2 | AL274: 280 | AM274: 62.2 | AN274: 258 | AO274: -3.4000000000000002e-002 | AP274: 13 | AQ274: 兴森转债!
A275: 226 | B275: 128096 | C275: 奥瑞转债!! | D275: 2701 | E275: 奥瑞金 | F275: 造纸包装 | G275: 包装材料 | H275: 134.8 | I275: 6.0000000000000001e-003 | J275: -5.9999999999999995e-004 | K275: 5.74 | L275: 6.9999999999999993e-003 | M275: 115.5 | N275: 4.5 | O275: 5.7000000000000002e-002 | P275: 127.56 | Q275: 转股中 | R275: 4.48年 | S275: 2.48年 | T275: 6.74 | U275: 11 | V275: 1.2e-002 | W275: 4.8000000000000001e-002 | X275: 6.2e-002 | Y275: 139 | Z275: 2.07 | AA275: -3.4599999999999999e-002 | AB275: -4.0500000000000001e-002 | AC275: -9.4899999999999998e-002 | AD275: -9.7299999999999998e-002 | AE275: 94.88 | AF275: 99.32 | AG275: 0.78 | AH275: AA+ | AI275: 3.5099999999999999e-002 | AJ275: =H275+100*O275 -> 140.5 | AK275: 142 | AL275: 166 | AM275: 42.7 | AN275: 129 | AO275: 2.9999999999999999e-002 | AP275: 18 | AQ275: 奥瑞转债!!
A276: 183 | B276: 128109 | C276: 楚江转债 | D276: 2171 | E276: 楚江新材 | F276: 有色金属 | G276: 铜金属 | H276: 135.7 | I276: 2.0299999999999999e-002 | J276: 8.0000000000000002e-003 | K276: 10.34 | L276: 3.9199999999999999e-002 | M276: 114.9 | N276: 8.63 | O276: 0.13300000000000001 | P276: 119.81 | Q276: 转股中 | R276: 4.79年 | S276: 2.79年 | T276: 18.3 | U276: 141 | V276: 5.7000000000000002e-002 | W276: 0.13300000000000001 | X276: 0.159 | Y276: 138 | Z276: 2.43 | AA276: -3.4799999999999998e-002 | AB276: -4.0000000000000001e-002 | AC276: -8.8499999999999995e-002 | AD276: -9.0399999999999994e-002 | AE276: 92.15 | AF276: 95.53 | AG276: 0.72 | AH276: AA | AI276: 4.0099999999999997e-002 | AJ276: =H276+100*O276 -> 149. | AK276: 151.6 | AL276: 239 | AM276: 56.1 | AN276: 222 | AO276: 5.5e-002 | AP276: 6 | AQ276: 楚江转债
A277: 54 | B277: 118000 | C277: 嘉元转债 | D277: 688388 | E277: 嘉元科技 | F277: 电子 | G277: 电子产品 | H277: 147.04 | I277: -2.5000000000000001e-003 | J277: 2.4900000000000002e-002 | K277: 112 | L277: 2.7200000000000002e-002 | M277: 121 | N277: 78.74 | O277: 3.4000000000000002e-002 | P277: 142.24 | Q277: 12天 | R277: 5.51年 | S277: 3.51年 | T277: 12.4 | U277: 186 | V277: 0.10000000000000001 | W277: 4.8000000000000001e-002 | X277: 6.8000000000000005e-002 | Y277: 259 | Z277: 9.5 | AA277: -3.5400000000000001e-002 | AB277: -4.1500000000000002e-002 | AC277: -9.0800000000000006e-002 | AD277: -9.2499999999999999e-002 | AE277: 83.31 | AF277: 87.19 | AG277: 0.82 | AH277: AA- | AI277: 6.2600000000000003e-002 | AJ277: =H277+100*O277 -> 150.44 | AK277: 151.8 | AL277: 242 | AM277: 64.6 | AN277: 268 | AO277: 0.187 | AP277: 5 | AQ277: 嘉元转债
A278: 80 | B278: 123085 | C278: 万顺转2! | D278: 300057 | E278: 万顺新材 | F278: 有色金属 | G278: 铝金属 | H278: 136.9 | I278: -4.7899999999999998e-002 | J278: -1.1599999999999999e-002 | K278: 8.29 | L278: -7.0599999999999996e-002 | M278: 113.3 | N278: 6.2 | O278: 2.4e-002 | P278: 133.71 | Q278: 转股中 | R278: 5.31年 | S278: 3.31年 | T278: 8.75 | U278: 140 | V278: 0.115 | W278: 0.156 | X278: 0.20899999999999999 | Y278: 56 | Z278: 1.57 | AA278: -3.5699999999999996e-002 | AB278: -3.9900000000000005e-002 | AC278: -7.7199999999999991e-002 | AD278: -7.9000000000000001e-002 | AE278: 84.25 | AF278: 82.67 | AG278: 0.84 | AH278: AA- | AI278: 6.2600000000000003e-002 | AJ278: =H278+100*O278 -> 139.30000000000001 | AK278: 140.1 | AL278: 147 | AM278: 55.8 | AN278: 216 | AO278: 3.9e-002 | AP278: 24 | AQ278: 万顺转2!
A279: 122 | B279: 128134 | C279: 鸿路转债! | D279: 2541 | E279: 鸿路钢构 | F279: 建筑 | G279: 其他建材 | H279: 138.995 | I279: 5.7999999999999996e-003 | J279: -3.2000000000000002e-003 | K279: 56.3 | L279: 3.2000000000000002e-003 | M279: 115.1 | N279: 43.51 | O279: 7.400000000000001e-002 | P279: 129.4 | Q279: 转股中 | R279: 5年49天 | S279: 3年50天 | T279: 15.7 | U279: 18 | V279: 8.0000000000000002e-003 | W279: 5.2999999999999999e-002 | X279: 6.9000000000000006e-002 | Y279: 296 | Z279: 5.07 | AA279: -3.6699999999999997e-002 | AB279: -4.1599999999999998e-002 | AC279: -8.5800000000000001e-002 | AD279: -8.7599999999999997e-002 | AE279: 90.67 | AF279: 93.75 | AG279: 0.8 | AH279: AA | AI279: 4.1599999999999998e-002 | AJ279: =H279+100*O279 -> 146.39500000000001 | AK279: 148.6 | AL279: 223 | AM279: 54.8 | AN279: 208 | AO279: 1.7000000000000001e-002 | AP279: 5 | AQ279: 鸿路转债!
A280: 198 | B280: 123048 | C280: 应急转债! | D280: 300527 | E280: 中船应急 | F280: 机械装备 | G280: 专用设备 | H280: 134.541 | I280: -1.2999999999999999e-003 | J280: 4.6999999999999993e-003 | K280: 10.36 | L280: 4.7999999999999996e-003 | M280: 112.8 | N280: 8.88 | O280: 0.153 | P280: 116.67 | Q280: 转股中 | R280: 4.64年 | S280: 2.64年 | T280: 3.79 | U280: 314 | V280: 0.60599999999999998 | W280: 3.7999999999999999e-002 | X280: 4.4000000000000004e-002 | Y280: 100 | Z280: 3.75 | AA280: -3.7999999999999999e-002 | AB280: -4.2599999999999999e-002 | AC280: -9.0500000000000011e-002 | AD280: -9.2399999999999996e-002 | AE280: 93.85 | AF280: 96.42 | AG280: 0.7 | AH280: AA+ | AI280: 3.5099999999999999e-002 | AJ280: =H280+100*O280 -> 149.84100000000001 | AK280: 152.4 | AL280: 249 | AM280: 56 | AN280: 220 | AO280: 5.9999999999999998e-002 | AP280: 17 | AQ280: 应急转债!
A281: 251 | B281: 123033 | C281: 金力转债!!* | D281: 300748 | E281: 金力永磁 | F281: 电子 | G281: 元器件制 | H281: 143.12 | I281: 1.3100000000000001e-002 | J281: 1.21e-002 | K281: 36.17 | L281: 2.52e-002 | M281: 121.5 | N281: 25.3 | O281: 1.e-003 | P281: 142.96 | Q281: 转股中 | R281: 4.20年 | S281: 2.20年 | T281: 2.52 | U281: 755 | V281: 2.0499999999999998 | W281: 1.e-002 | X281: 1.3999999999999999e-002 | Y281: 251 | Z281: 7.44 | AA281: -3.9399999999999998e-002 | AB281: -4.7599999999999996e-002 | AC281: -0.124 | AD281: -0.127 | AE281: 91.48 | AF281: 95.49 | AG281: 1 | AH281: AA- | AI281: 6.1100000000000002e-002 | AJ281: =H281+100*O281 -> 143.22 | AK281: 143.3 | AL281: 181 | AM281: 47.8 | AN281: 160 | AO281: -5.2000000000000005e-002 | AP281: 25 | AQ281: 金力转债!!*
A282: 249 | B282: 110061 | C282: 川投转债 | D282: 600674 | E282: 川投能源 | F282: 能源电力 | G282: 水电 | H282: 130.95 | I282: -8.0000000000000002e-003 | J282: -8.6e-003 | K282: 11.01 | L282: -2.2200000000000001e-002 | M282: 110.8 | N282: 9.2 | O282: 9.4e-002 | P282: 119.67 | Q282: 转股中 | R282: 4.23年 | S282: 2.23年 | T282: 39.6 | U282: 11 | V282: 2.e-003 | W282: 8.199999999999999e-002 | X282: 9.8000000000000004e-002 | Y282: 485 | Z282: 1.68 | AA282: -3.95e-002 | AB282: -4.3899999999999995e-002 | AC282: -9.5199999999999993e-002 | AD282: -9.74e-002 | AE282: 95.63 | AF282: 96.84 | AG282: 0.75 | AH282: AAA | AI282: 3.3099999999999997e-002 | AJ282: =H282+100*O282 -> 140.34999999999999 | AK282: 142.2 | AL282: 169 | AM282: 45.4 | AN282: 145 | AO282: -6.9999999999999993e-003 | AP282: 14 | AQ282: 川投转债
A283: 95 | B283: 123078 | C283: 飞凯转债!! | D283: 300398 | E283: 飞凯材料 | F283: 化工 | G283: 化工 | H283: 142.117 | I283: 2.8999999999999998e-003 | J283: 5.6999999999999993e-003 | K283: 20.6 | L283: 1.0800000000000001e-002 | M283: 115.2 | N283: 15.56 | O283: 7.2999999999999995e-002 | P283: 132.39 | Q283: 转股中 | R283: 5.27年 | S283: 3.27年 | T283: 8.15 | U283: 67 | V283: 5.7999999999999996e-002 | W283: 7.6999999999999999e-002 | X283: 0.10099999999999999 | Y283: 106 | Z283: 3.83 | AA283: -3.9800000000000002e-002 | AB283: -4.4600000000000001e-002 | AC283: -8.8300000000000003e-002 | AD283: -9.01e-002 | AE283: 90.27 | AF283: 93.34 | AG283: 0.8 | AH283: AA | AI283: 4.1599999999999998e-002 | AJ283: =H283+100*O283 -> 149.417 | AK283: 151.8 | AL283: 243 | AM283: 58.5 | AN283: 239 | AO283: -1.e-002 | AP283: 8 | AQ283: 飞凯转债!!
A284: 110 | B284: 123074 | C284: 隆利转债!! | D284: 300752 | E284: 隆利科技 | F284: 电子 | G284: 液晶显示 | H284: 154.402 | I284: 3.0000000000000001e-003 | J284: 1.7000000000000001e-003 | K284: 26.1 | L284: 5.7999999999999996e-003 | M284: 124 | N284: 18.34 | O284: 8.5000000000000006e-002 | P284: 142.31 | Q284: 转股中 | R284: 5.19年 | S284: 3.19年 | T284: 1.48 | U284: 373 | V284: 1.6200000000000001 | W284: 2.7999999999999997e-002 | X284: 4.0000000000000001e-002 | Y284: 53 | Z284: 3.63 | AA284: -4.2099999999999999e-002 | AB284: -4.9400000000000006e-002 | AC284: -0.11 | AD284: -0.111 | AE284: 84.95 | AF284: 91.1 | AG284: 0.81 | AH284: AA- | AI284: 6.2600000000000003e-002 | AJ284: =H284+100*O284 -> 162.90199999999999 | AK284: 166.5 | AL284: 301 | AM284: 75.4 | AN284: 307 | AO284: -0.14499999999999999 | AP284: 17 | AQ284: 隆利转债!!
A285: 306 | B285: 128053 | C285: 尚荣转债! | D285: 2551 | E285: 尚荣医疗 | F285: 医药 | G285: 医疗器械 | H285: 132.799 | I285: -4.5000000000000005e-003 | J285: 4.5000000000000005e-003 | K285: 5.11 | L285: -1.3500000000000002e-002 | M285: 114.3 | N285: 4.88 | O285: 0.26800000000000002 | P285: 104.71 | Q285: 转股中 | R285: 3.49年 | S285: 1.49年 | T285: 1.91 | U285: 42 | V285: 0.16600000000000001 | W285: 4.4000000000000004e-002 | X285: 4.5999999999999999e-002 | Y285: 43 | Z285: 1.37 | AA285: -4.2900000000000001e-002 | AB285: -4.9699999999999994e-002 | AC285: -0.126 | AD285: -0.128 | AE285: 96.38 | AF285: 99.92 | AG285: 0 | AH285: AA | AI285: 4.0099999999999997e-002 | AJ285: =H285+100*O285 -> 159.59900000000002 | AK285: 160.9 | AL285: 289 | AM285: 61 | AN285: 250 | AO285: -3.5000000000000003e-002 | AP285: 24 | AQ285: 尚荣转债!
A286: 179 | B286: 113585 | C286: 寿仙转债! | D286: 603896 | E286: 寿仙谷 | F286: 医药 | G286: 中药 | H286: 144.41 | I286: -1.1699999999999999e-002 | J286: 2.5000000000000001e-003 | K286: 40.92 | L286: -1.06e-002 | M286: 117.3 | N286: 28.38 | O286: 2.e-003 | P286: 144.19 | Q286: 转股中 | R286: 4.80年 | S286: 2.80年 | T286: 1.07 | U286: 15 | V286: 9.5000000000000001e-002 | W286: 1.7000000000000001e-002 | X286: 2.5000000000000001e-002 | Y286: 62 | Z286: 4.43 | AA286: -4.3200000000000002e-002 | AB286: -4.9100000000000005e-002 | AC286: -0.105 | AD286: -0.107 | AE286: 87.06 | AF286: 88.77 | AG286: 0.87 | AH286: AA- | AI286: 6.1100000000000002e-002 | AJ286: =H286+100*O286 -> 144.60999999999999 | AK286: 144.6 | AL286: 191 | AM286: 55.9 | AN286: 218 | AO286: -3.4000000000000002e-002 | AP286: 15 | AQ286: 寿仙转债!
A287: 7 | B287: 127040 | C287: 国泰转债 | D287: 2091 | E287: 江苏国泰 | F287: 商业零售 | G287: 商业零售 | H287: 147.6 | I287: 1.7899999999999999e-002 | J287: -1.04e-002 | K287: 12.25 | L287: 9.1000000000000004e-003 | M287: 112.5 | N287: 9.02 | O287: 8.6999999999999994e-002 | P287: 135.81 | Q287: 4月26天 | R287: 5.88年 | S287: 3.88年 | T287: 45.6 | U287: 303 | V287: 4.4999999999999998e-002 | W287: 0.23800000000000002 | X287: 0.32299999999999995 | Y287: 192 | Z287: 2.04 | AA287: -4.5700000000000005e-002 | AB287: -4.9299999999999997e-002 | AC287: -8.5500000000000007e-002 | AD287: -8.6699999999999999e-002 | AE287: 89.13 | AF287: 91.35 | AG287: 0.83 | AH287: AA+ | AI287: 3.6600000000000001e-002 | AJ287: =H287+100*O287 -> 156.29999999999998 | AK287: 159.4 | AL287: 284 | AM287: 68 | AN287: 283 | AO287: -4.0999999999999995e-002 | AP287: 6 | AQ287: 国泰转债
A288: 307 | B288: 113527 | C288: 维格转债!! | D288: 603518 | E288: 锦泓集团 | F288: 服装纺织 | G288: 服装行业 | H288: 139.94 | I288: -3.85e-002 | J288: 1.9199999999999998e-002 | K288: 13 | L288: -2.5499999999999998e-002 | M288: 119.5 | N288: 9.85 | O288: 5.9999999999999998e-002 | P288: 131.98 | Q288: 转股中 | R288: 3.43年 | S288: 1.43年 | T288: 2.87 | U288: 181 | V288: 0.44900000000000001 | W288: 7.6999999999999999e-002 | X288: 0.10199999999999999 | Y288: 37 | Z288: 1.62 | AA288: -4.58e-002 | AB288: -5.5e-002 | AC288: -0.155 | AD288: -0.157 | AE288: 95.18 | AF288: 101.39 | AG288: 0.76 | AH288: AA | AI288: 5.0099999999999999e-002 | AJ288: =H288+100*O288 -> 145.94 | AK288: 147.9 | AL288: 217 | AM288: 46.5 | AN288: 149 | AO288: -0.11199999999999999 | AP288: 82 | AQ288: 维格转债!!
A289: 299 | B289: 127011 | C289: 中鼎转2!! | D289: 887 | E289: 中鼎股份 | F289: 汽车 | G289: 零部件制 | H289: 135 | I289: -1.0800000000000001e-002 | J289: 7.6e-003 | K289: 14.83 | L289: -4.0000000000000001e-003 | M289: 114.5 | N289: 11.39 | O289: 3.7000000000000005e-002 | P289: 130.2 | Q289: 转股中 | R289: 3.55年 | S289: 1.55年 | T289: 12 | U289: 45 | V289: 2.7999999999999997e-002 | W289: 6.6000000000000003e-002 | X289: 8.5999999999999993e-002 | Y289: 181 | Z289: 2.03 | AA289: -4.6199999999999998e-002 | AB289: -5.2999999999999999e-002 | AC289: -0.127 | AD289: -0.129 | AE289: 96.97 | AF289: 101.56 | AG289: 0.78 | AH289: AA+ | AI289: 3.5099999999999999e-002 | AJ289: =H289+100*O289 -> 138.69999999999999 | AK289: 139.8 | AL289: 145 | AM289: 38.2 | AN289: 84 | AO289: -1.3999999999999999e-002 | AP289: 21 | AQ289: 中鼎转2!!
A290: 246 | B290: 113550 | C290: 常汽转债! | D290: 603035 | E290: 常熟汽饰 | F290: 汽车 | G290: 零部件制 | H290: 147.71 | I290: -1.1000000000000001e-002 | J290: 0. | K290: 13.1 | L290: -1.3600000000000001e-002 | M290: 121.3 | N290: 9.33 | O290: 5.2000000000000005e-002 | P290: 140.41 | Q290: 转股中 | R290: 4.25年 | S290: 2.25年 | T290: 2.15 | U290: 32 | V290: 0.10099999999999999 | W290: 4.5999999999999999e-002 | X290: 6.4000000000000001e-002 | Y290: 47 | Z290: 1.22 | AA290: -4.6399999999999997e-002 | AB290: -5.4400000000000004e-002 | AC290: -0.10099999999999999 | AD290: -0.10300000000000001 | AE290: 90.5 | AF290: 94.94 | AG290: 0.82 | AH290: AA- | AI290: 6.1100000000000002e-002 | AJ290: =H290+100*O290 -> 152.91 | AK290: 155 | AL290: 264 | AM290: 60.1 | AN290: 246 | AO290: 3.0000000000000001e-003 | AP290: 17 | AQ290: 常汽转债!
A291: 118 | B291: 123069 | C291: 金诺转债!! | D291: 300505 | E291: 川金诺 | F291: 化工 | G291: 农化 | H291: 161.55 | I291: 2.2000000000000001e-003 | J291: 1.7000000000000001e-003 | K291: 27.04 | L291: 4.7999999999999996e-003 | M291: 126 | N291: 19.09 | O291: 0.14099999999999999 | P291: 141.64 | Q291: 转股中 | R291: 5年56天 | S291: 3年57天 | T291: 2.54 | U291: 390 | V291: 0.95099999999999996 | W291: 7.2000000000000008e-002 | X291: 0.10199999999999999 | Y291: 35 | Z291: 3.73 | AA291: -4.7899999999999998e-002 | AB291: -5.5599999999999997e-002 | AC291: -0.122 | AD291: -0.124 | AE291: 85.13 | AF291: 92.76 | AG291: 0.81 | AH291: AA- | AI291: 6.2600000000000003e-002 | AJ291: =H291+100*O291 -> 175.65000000000001 | AK291: 181.5 | AL291: 323 | AM291: 88.7 | AN291: 324 | AO291: -6.2e-002 | AP291: 18 | AQ291: 金诺转债!!
A292: 363 | B292: 113013 | C292: 国君转债! | D292: 601211 | E292: XD国泰君 | F292: 金融 | G292: 证券行业 | H292: 117.1 | I292: 1.e-004 | J292: 1.e-004 | K292: 16.99 | L292: 5.9999999999999995e-004 | M292: 106.8 | N292: 18.45 | O292: 0.27200000000000002 | P292: 92.09 | Q292: 转股中 | R292: 1.88年 | S292: 无权 | T292: 69.9 | U292: 58 | V292: 6.9999999999999993e-003 | W292: 4.5999999999999999e-002 | X292: 4.2999999999999997e-002 | Y292: 1514. | Z292: 1.16 | AA292: -4.82e-002 | AB292: -5.4699999999999999e-002 | AC292: 无权 | AD292: 无权 | AE292: 无权 | AF292: 100.77 | AG292: 0.35 | AH292: AAA | AI292: 3.1699999999999999e-002 | AJ292: =H292+100*O292 -> 144.30000000000001 | AK292: 142.1 | AL292: 167 | AM292: 41.3 | AN292: 114 | AO292: 1.3000000000000001e-002 | AP292: 12 | AQ292: 国君转债!
A293: 82 | B293: 123084 | C293: 高澜转债! | D293: 300499 | E293: 高澜股份 | F293: 能源电力 | G293: 电力设备 | H293: 157.6 | I293: 5.1699999999999996e-002 | J293: 6.8000000000000005e-003 | K293: 14.28 | L293: 6.6500000000000004e-002 | M293: 121.9 | N293: 9 | O293: -6.9999999999999993e-003 | P293: 158.67 | Q293: 转股中 | R293: 5.31年 | S293: 3.31年 | T293: 2.79 | U293: 585 | V293: 1.3899999999999999 | W293: 7.0000000000000007e-002 | X293: 0.111 | Y293: 40 | Z293: 4.81 | AA293: -4.8300000000000003e-002 | AB293: -5.4800000000000001e-002 | AC293: -0.109 | AD293: -0.111 | AE293: 82.18 | AF293: 84.46 | AG293: 0.88 | AH293: A+ | AI293: 7.3599999999999999e-002 | AJ293: =H293+100*O293 -> 156.90000000000001 | AK293: 156.5 | AL293: 272 | AM293: 72.1 | AN293: 300 | AO293: 0.23499999999999999 | AP293: 17 | AQ293: 高澜转债!
A294: 339 | B294: 127005 | C294: 长证转债! | D294: 783 | E294: 长江证券 | F294: 金融 | G294: 证券行业 | H294: 122.856 | I294: -2.8000000000000004e-003 | J294: 6.7000000000000002e-003 | K294: 7.49 | L294: 6.7000000000000002e-003 | M294: 108.3 | N294: 7.13 | O294: 0.17000000000000001 | P294: 105.05 | Q294: 转股中 | R294: 2.56年 | S294: 无权 | T294: 50 | U294: 84 | V294: 1.3999999999999999e-002 | W294: 0.121 | X294: 0.127 | Y294: 414 | Z294: 1.44 | AA294: -4.8899999999999999e-002 | AB294: -5.45e-002 | AC294: 无权 | AD294: 无权 | AE294: 无权 | AF294: 100.13 | AG294: 0.58 | AH294: AAA | AI294: 3.1699999999999999e-002 | AJ294: =H294+100*O294 -> 139.85599999999999 | AK294: 140.7 | AL294: 154 | AM294: 40.5 | AN294: 106 | AO294: 5.5999999999999994e-002 | AP294: 13 | AQ294: 长证转债!
A295: 45 | B295: 127029 | C295: 中钢转债 | D295: 928 | E295: 中钢国际 | F295: 建筑 | G295: 建筑工程 | H295: 155.239 | I295: 1.6000000000000001e-003 | J295: 3.0999999999999999e-003 | K295: 9.28 | L295: 5.4000000000000003e-003 | M295: 117.5 | N295: 5.89 | O295: -1.4999999999999999e-002 | P295: 157.56 | Q295: 38天 | R295: 5.58年 | S295: 3.58年 | T295: 9.6 | U295: 196 | V295: 0.13100000000000001 | W295: 8.199999999999999e-002 | X295: 0.13 | Y295: 117 | Z295: 2.02 | AA295: -4.9299999999999997e-002 | AB295: -5.4400000000000004e-002 | AC295: -0.10099999999999999 | AD295: -0.10199999999999999 | AE295: 90.1 | AF295: 96.44 | AG295: 0.87 | AH295: AA+ | AI295: 3.6600000000000001e-002 | AJ295: =H295+100*O295 -> 153.739 | AK295: 152.9 | AL295: 254 | AM295: 56.5 | AN295: 225 | AO295: 1.9e-002 | AP295: 12 | AQ295: 中钢转债
A296: 68 | B296: 113616 | C296: 韦尔转债! | D296: 603501 | E296: 韦尔股份 | F296: 电子 | G296: 元器件制 | H296: 150.04 | I296: -7.7000000000000002e-003 | J296: -1.01e-002 | K296: 258.3 | L296: -2.52e-002 | M296: 114.5 | N296: 222.52 | O296: 0.29299999999999998 | P296: 116.08 | Q296: 转股中 | R296: 5.35年 | S296: 3.36年 | T296: 24.3 | U296: 140 | V296: 3.7999999999999999e-002 | W296: 1.1000000000000001e-002 | X296: 1.3000000000000001e-002 | Y296: 2244. | Z296: 18.02 | AA296: -4.99e-002 | AB296: -5.4400000000000004e-002 | AC296: -0.10199999999999999 | AD296: -0.10099999999999999 | AE296: 90.82 | AF296: 94.73 | AG296: 0.7 | AH296: AA+ | AI296: 3.6600000000000001e-002 | AJ296: =H296+100*O296 -> 179.33999999999997 | AK296: 184 | AL296: 326 | AM296: 89.3 | AN296: 326 | AO296: -0.109 | AP296: 8 | AQ296: 韦尔转债!
A297: 351 | B297: 128026 | C297: 众兴转债! | D297: 2772 | E297: 众兴菌业 | F297: 农业 | G297: 种植业 | H297: 122.83 | I297: -3.0999999999999999e-003 | J297: -3.5999999999999999e-003 | K297: 12.63 | L297: -9.3999999999999986e-003 | M297: 109.3 | N297: 11.36 | O297: 0.105 | P297: 111.18 | Q297: 转股中 | R297: 2.32年 | S297: 0.32年 | T297: 4.09 | U297: 208 | V297: 0.41200000000000003 | W297: 8.0000000000000002e-002 | X297: 8.900000000000001e-002 | Y297: 51 | Z297: 1.7 | AA297: -5.0099999999999999e-002 | AB297: -5.7000000000000002e-002 | AC297: -0.377 | AD297: -0.38400000000000001 | AE297: 99.01 | AF297: 95.82 | AG297: 0.71 | AH297: AA- | AI297: 5.9699999999999996e-002 | AJ297: =H297+100*O297 -> 133.32999999999998 | AK297: 134.5 | AL297: 93 | AM297: 35.5 | AN297: 56 | AO297: 4.0000000000000001e-002 | AP297: 58 | AQ297: 众兴转债!
A298: 218 | B298: 113568 | C298: 新春转债!! | D298: 603667 | E298: 五洲新春 | F298: 机械装备 | G298: 通用设备 | H298: 156.47 | I298: 1.32e-002 | J298: -1.06e-002 | K298: 12.93 | L298: 3.0999999999999999e-003 | M298: 124.3 | N298: 8.75 | O298: 5.9000000000000004e-002 | P298: 147.77 | Q298: 转股中 | R298: 4.54年 | S298: 2.54年 | T298: 2.74 | U298: 41 | V298: 9.6000000000000002e-002 | W298: 7.0999999999999994e-002 | X298: 0.105 | Y298: 38 | Z298: 2.13 | AA298: -5.0499999999999996e-002 | AB298: -5.8700000000000002e-002 | AC298: -0.13900000000000001 | AD298: -0.14099999999999999 | AE298: 88.92 | AF298: 95.58 | AG298: 0.83 | AH298: AA- | AI298: 6.1100000000000002e-002 | AJ298: =H298+100*O298 -> 162.37 | AK298: 165.2 | AL298: 300 | AM298: 69.6 | AN298: 290 | AO298: 5.2999999999999999e-002 | AP298: 47 | AQ298: 新春转债!!
A299: 72 | B299: 123089 | C299: 九洲转2!! | D299: 300040 | E299: 九洲集团 | F299: 能源电力 | G299: 电力设备 | H299: 161.001 | I299: -1.09e-002 | J299: 2.2700000000000001e-002 | K299: 9.11 | L299: 1.3300000000000001e-002 | M299: 121 | N299: 5.68 | O299: 4.0000000000000001e-003 | P299: 160.39 | Q299: 转股中 | R299: 5.34年 | S299: 3.34年 | T299: 3.07 | U299: 152 | V299: 0.30599999999999999 | W299: 5.9999999999999998e-002 | X299: 9.6000000000000002e-002 | Y299: 51 | Z299: 1.55 | AA299: -5.3099999999999994e-002 | AB299: -5.9200000000000003e-002 | AC299: -0.115 | AD299: -0.11699999999999999 | AE299: 84.2 | AF299: 88.13 | AG299: 0.88 | AH299: AA- | AI299: 6.2600000000000003e-002 | AJ299: =H299+100*O299 -> 161.40100000000001 | AK299: 161.6 | AL299: 292 | AM299: 73.5 | AN299: 302 | AO299: 2.9999999999999999e-002 | AP299: 22 | AQ299: 九洲转2!!
A300: 48 | B300: 123102 | C300: 华自转债 | D300: 300490 | E300: 华自科技 | F300: 机械装备 | G300: 机器人及 | H300: 171.3 | I300: -7.4999999999999997e-003 | J300: -5.5000000000000005e-003 | K300: 17.06 | L300: -1.44e-002 | M300: 126.9 | N300: 9.25 | O300: -7.0999999999999994e-002 | P300: 184.43 | Q300: 29天 | R300: 5.56年 | S300: 3.56年 | T300: 6.7 | U300: 343 | V300: 0.29699999999999999 | W300: 0.153 | X300: 0.28199999999999997 | Y300: 44 | Z300: 2.5 | AA300: -5.3600000000000002e-002 | AB300: -6.0899999999999996e-002 | AC300: -0.12 | AD300: -0.122 | AE300: 83.95 | AF300: 91.3 | AG300: 0.9 | AH300: AA- | AI300: 6.2600000000000003e-002 | AJ300: =H300+100*O300 -> 164.20000000000002 | AK300: 158.2 | AL300: 279 | AM300: 66.9 | AN300: 278 | AO300: -8.8000000000000009e-002 | AP300: 23 | AQ300: 华自转债
A301: 210 | B301: 128101 | C301: 联创转债! | D301: 2036 | E301: 联创电子 | F301: 电子 | G301: 液晶显示 | H301: 147.6 | I301: -3.4000000000000002e-002 | J301: 2.8300000000000002e-002 | K301: 17.01 | L301: -7.6e-003 | M301: 114.8 | N301: 13.72 | O301: 0.191 | P301: 123.98 | Q301: 转股中 | R301: 4.57年 | S301: 2.57年 | T301: 3 | U301: 106 | V301: 0.23699999999999999 | W301: 1.7000000000000001e-002 | X301: 2.1000000000000001e-002 | Y301: 181 | Z301: 4.91 | AA301: -5.4400000000000004e-002 | AB301: -5.9699999999999996e-002 | AC301: -0.122 | AD301: -0.124 | AE301: 92.85 | AF301: 96.26 | AG301: 0.75 | AH301: AA | AI301: 4.0099999999999997e-002 | AJ301: =H301+100*O301 -> 166.69999999999999 | AK301: 171.2 | AL301: 309 | AM301: 75 | AN301: 306 | AO301: -6.3e-002 | AP301: 15 | AQ301: 联创转债!
A302: 345 | B302: 128033 | C302: 迪龙转债! | D302: 2658 | E302: 雪迪龙 | F302: 城市公用 | G302: 三废处理 | H302: 124.138 | I302: 2.0999999999999999e-003 | J302: 9.5999999999999992e-003 | K302: 9.07 | L302: 2.0199999999999999e-002 | M302: 108.8 | N302: 8.71 | O302: 0.192 | P302: 104.13 | Q302: 转股中 | R302: 2.35年 | S302: 0.35年 | T302: 2.98 | U302: 37 | V302: 9.9000000000000005e-002 | W302: 5.2000000000000005e-002 | X302: 5.4000000000000006e-002 | Y302: 57 | Z302: 2.4 | AA302: -5.5300000000000002e-002 | AB302: -6.1799999999999994e-002 | AC302: -0.37 | AD302: -0.375 | AE302: 99.57 | AF302: 99.65 | AG302: 0.58 | AH302: AA | AI302: 3.8699999999999998e-002 | AJ302: =H302+100*O302 -> 143.33799999999999 | AK302: 144.1 | AL302: 188 | AM302: 44.5 | AN302: 140 | AO302: -3.4000000000000002e-002 | AP302: 35 | AQ302: 迪龙转债!
A303: 219 | B303: 123043 | C303: 正元转债 | D303: 300645 | E303: 正元智慧 | F303: 计算机及 | G303: 软件开发 | H303: 156.001 | I303: 5.7999999999999996e-003 | J303: -4.5999999999999999e-003 | K303: 19.13 | L303: 1.6000000000000001e-003 | M303: 120.9 | N303: 15.38 | O303: 0.254 | P303: 124.38 | Q303: 转股中 | R303: 4.54年 | S303: 2.54年 | T303: 1.66 | U303: 473 | V303: 1.8300000000000001 | W303: 6.8000000000000005e-002 | X303: 8.5000000000000006e-002 | Y303: 24 | Z303: 3.79 | AA303: -5.57e-002 | AB303: -6.2899999999999998e-002 | AC303: -0.13800000000000001 | AD303: -0.14099999999999999 | AE303: 86.38 | AF303: 88.82 | AG303: 0.76 | AH303: A+ | AI303: 7.2099999999999997e-002 | AJ303: =H303+100*O303 -> 181.40100000000001 | AK303: 187.6 | AL303: 329 | AM303: 98.8 | AN303: 332 | AO303: 5.0999999999999997e-002 | AP303: 18 | AQ303: 正元转债
A304: 154 | B304: 123060 | C304: 苏试转债! | D304: 300416 | E304: 苏试试验 | F304: 机械装备 | G304: 专用设备 | H304: 154.87 | I304: 1.0500000000000001e-002 | J304: -1.0500000000000001e-002 | K304: 24.99 | L304: 0. | M304: 117.2 | N304: 18.28 | O304: 0.13300000000000001 | P304: 136.71 | Q304: 转股中 | R304: 4.92年 | S304: 2.92年 | T304: 3.1 | U304: 106 | V304: 0.218 | W304: 4.7e-002 | X304: 6.4000000000000001e-002 | Y304: 66 | Z304: 5.44 | AA304: -5.5999999999999994e-002 | AB304: -6.1699999999999998e-002 | AC304: -0.121 | AD304: -0.12300000000000001 | AE304: 86.37 | AF304: 88.07 | AG304: 0.83 | AH304: AA- | AI304: 6.1100000000000002e-002 | AJ304: =H304+100*O304 -> 168.17000000000002 | AK304: 173 | AL304: 312 | AM304: 85 | AN304: 317 | AO304: 7.0999999999999994e-002 | AP304: 8 | AQ304: 苏试转债!
A305: 310 | B305: 113525 | C305: 台华转债! | D305: 603055 | E305: 台华新材 | F305: 服装纺织 | G305: 纺织行业 | H305: 139.33 | I305: 1.6e-002 | J305: -1.e-004 | K305: 10.7 | L305: 1.9e-002 | M305: 114.3 | N305: 7.78 | O305: 1.3000000000000001e-002 | P305: 137.53 | Q305: 转股中 | R305: 3.32年 | S305: 1.33年 | T305: 4.69 | U305: 208 | V305: 0.316 | W305: 5.2999999999999999e-002 | X305: 7.2000000000000008e-002 | Y305: 89 | Z305: 2.93 | AA305: -5.8899999999999994e-002 | AB305: -6.6000000000000003e-002 | AC305: -0.16600000000000001 | AD305: -0.16899999999999998 | AE305: 96.99 | AF305: 100.57 | AG305: 0.84 | AH305: AA | AI305: 4.0099999999999997e-002 | AJ305: =H305+100*O305 -> 140.63000000000002 | AK305: 141.1 | AL305: 157 | AM305: 40.6 | AN305: 107 | AO305: 0.17699999999999999 | AP305: 20 | AQ305: 台华转债!
A306: 33 | B306: 123111 | C306: 东财转3 | D306: 300059 | E306: 东方财富 | F306: 金融 | G306: 证券行业 | H306: 155.01 | I306: -9.7000000000000003e-003 | J306: -7.4000000000000003e-003 | K306: 31.41 | L306: -2.0899999999999998e-002 | M306: 110.5 | N306: 23.35 | O306: 0.152 | P306: 134.52 | Q306: 54天 | R306: 5.63年 | S306: 3.63年 | T306: 158 | U306: 773 | V306: 3.1e-002 | W306: 4.9000000000000002e-002 | X306: 6.5000000000000002e-002 | Y306: 3246. | Z306: 8.92 | AA306: -5.8899999999999994e-002 | AB306: -6.2e-002 | AC306: -0.10099999999999999 | AD306: -0.10199999999999999 | AE306: 89.04 | AF306: 90.46 | AG306: 0.82 | AH306: AA+ | AI306: 3.6600000000000001e-002 | AJ306: =H306+100*O306 -> 170.20999999999998 | AK306: 175.5 | AL306: 317 | AM306: 85 | AN306: 318 | AO306: -3.3000000000000002e-002 | AP306: 21 | AQ306: 东财转3
A307: 135 | B307: 128128 | C307: 齐翔转2! | D307: 2408 | E307: 齐翔腾达 | F307: 化工 | G307: 化工 | H307: 156.2 | I307: -2.5999999999999999e-003 | J307: 8.3999999999999995e-003 | K307: 12 | L307: 6.7000000000000002e-003 | M307: 115.3 | N307: 7.97 | O307: 3.7000000000000005e-002 | P307: 150.56 | Q307: 转股中 | R307: 4.999年 | S307: 3年0.5天 | T307: 8.74 | U307: 22 | V307: 1.6e-002 | W307: 3.6000000000000004e-002 | X307: 5.5e-002 | Y307: 240 | Z307: 2.2 | AA307: -6.0400000000000002e-002 | AB307: -6.5199999999999994e-002 | AC307: -0.12 | AD307: -0.122 | AE307: 91.4 | AF307: 94.83 | AG307: 0.87 | AH307: AA | AI307: 4.0099999999999997e-002 | AJ307: =H307+100*O307 -> 159.89999999999998 | AK307: 161.8 | AL307: 293 | AM307: 67 | AN307: 279 | AO307: -3.4000000000000002e-002 | AP307: 32 | AQ307: 齐翔转2!
A308: 213 | B308: 113572 | C308: 三祥转债! | D308: 603663 | E308: 三祥新材 | F308: 其他 | G308: 其他 | H308: 149.45 | I308: -3.7400000000000003e-002 | J308: -8.199999999999999e-003 | K308: 19.96 | L308: -5.2199999999999996e-002 | M308: 112.8 | N308: 14.09 | O308: 5.5e-002 | P308: 141.66 | Q308: 转股中 | R308: 4.56年 | S308: 2.56年 | T308: 1.69 | U308: 124 | V308: 0.48799999999999999 | W308: 4.4000000000000004e-002 | X308: 6.2e-002 | Y308: 38 | Z308: 5.95 | AA308: -6.0899999999999996e-002 | AB308: -6.5500000000000003e-002 | AC308: -0.126 | AD308: -0.128 | AE308: 85.59 | AF308: 82.67 | AG308: 0.87 | AH308: A+ | AI308: 7.2099999999999997e-002 | AJ308: =H308+100*O308 -> 154.94999999999999 | AK308: 157.2 | AL308: 275 | AM308: 71.7 | AN308: 299 | AO308: 5.4000000000000006e-002 | AP308: 21 | AQ308: 三祥转债!
A309: 290 | B309: 123025 | C309: 精测转债!! | D309: 300567 | E309: 精测电子 | F309: 电子 | G309: 液晶显示 | H309: 146.37 | I309: 2.5000000000000001e-003 | J309: -2.1000000000000001e-002 | K309: 63.28 | L309: -2.3599999999999999e-002 | M309: 116.5 | N309: 49.37 | O309: 0.14199999999999999 | P309: 128.18 | Q309: 转股中 | R309: 3.60年 | S309: 1.61年 | T309: 3.09 | U309: 113 | V309: 0.248 | W309: 1.8000000000000002e-002 | X309: 2.2000000000000002e-002 | Y309: 176 | Z309: 8.86 | AA309: -6.2400000000000004e-002 | AB309: -6.9800000000000001e-002 | AC309: -0.153 | AD309: -0.155 | AE309: 92.65 | AF309: 94.48 | AG309: 0.78 | AH309: AA- | AI309: 6.1100000000000002e-002 | AJ309: =H309+100*O309 -> 160.56999999999999 | AK309: 164.6 | AL309: 299 | AM309: 70.1 | AN309: 294 | AO309: -9.0999999999999998e-002 | AP309: 17 | AQ309: 精测转债!!
A310: 115 | B310: 123070 | C310: 鹏辉转债! | D310: 300438 | E310: 鹏辉能源 | F310: 汽车 | G310: 零部件制 | H310: 160.4 | I310: -2.2000000000000002e-002 | J310: -5.9999999999999995e-004 | K310: 30.04 | L310: -2.5600000000000001e-002 | M310: 115.1 | N310: 20.08 | O310: 7.2000000000000008e-002 | P310: 149.6 | Q310: 转股中 | R310: 5.17年 | S310: 3.17年 | T310: 7.49 | U310: 322 | V310: 0.26600000000000001 | W310: 5.9000000000000004e-002 | X310: 8.8000000000000009e-002 | Y310: 128 | Z310: 5.33 | AA310: -6.3299999999999995e-002 | AB310: -6.8000000000000005e-002 | AC310: -0.121 | AD310: -0.122 | AE310: 90.56 | AF310: 93.64 | AG310: 0.88 | AH310: AA | AI310: 4.1599999999999998e-002 | AJ310: =H310+100*O310 -> 167.59999999999999 | AK310: 171.2 | AL310: 308 | AM310: 77.6 | AN310: 310 | AO310: -8.5999999999999993e-002 | AP310: 8 | AQ310: 鹏辉转债!
A311: 248 | B311: 123035 | C311: 利德转债!! | D311: 300296 | E311: 利亚德 | F311: 电子 | G311: LED制 | H311: 151.95 | I311: 7.690000000000001e-002 | J311: 9.7100000000000006e-002 | K311: 10.46 | L311: 0.20000000000000001 | M311: 115.1 | N311: 6.96 | O311: 1.1000000000000001e-002 | P311: 150.29 | Q311: 转股中 | R311: 4.23年 | S311: 2.24年 | T311: 8 | U311: 2724. | V311: 2.1699999999999999 | W311: 2.9999999999999999e-002 | X311: 4.4999999999999998e-002 | Y311: 266 | Z311: 3.65 | AA311: -6.480000000000001e-002 | AB311: -7.0499999999999993e-002 | AC311: -0.111 | AD311: -0.11199999999999999 | AE311: 95.46 | AF311: 99.8 | AG311: 0.87 | AH311: AA+ | AI311: 3.5099999999999999e-002 | AJ311: =H311+100*O311 -> 153.04999999999998 | AK311: 153.6 | AL311: 260 | AM311: 53.8 | AN311: 200 | AO311: 0.111 | AP311: 14 | AQ311: 利德转债!!
A312: 285 | B312: 128064 | C312: 司尔转债!!* | D312: 2538 | E312: 司尔特 | F312: 化工 | G312: 农化 | H312: 146.498 | I312: -1.26e-002 | J312: -2.3999999999999998e-003 | K312: 8.53 | L312: -1.4999999999999999e-002 | M312: 114.3 | N312: 5.82 | O312: 0. | P312: 146.56 | Q312: 转股中 | R312: 3.63年 | S312: 1.63年 | T312: 1.22 | U312: 221 | V312: 1.24 | W312: 1.7000000000000001e-002 | X312: 2.6000000000000002e-002 | Y312: 70 | Z312: 1.53 | AA312: -6.7199999999999996e-002 | AB312: -7.3499999999999996e-002 | AC312: -0.151 | AD312: -0.153 | AE312: 95.83 | AF312: 99.36 | AG312: 1 | AH312: AA | AI312: 4.0099999999999997e-002 | AJ312: =H312+100*O312 -> 146.49799999999999 | AK312: 146.4 | AL312: 205 | AM312: 47.1 | AN312: 153 | AO312: 8.199999999999999e-002 | AP312: 42 | AQ312: 司尔转债!!*
A313: 243 | B313: 128082 | C313: 华锋转债!! | D313: 2806 | E313: 华锋股份 | F313: 电子 | G313: 元器件制 | H313: 164 | I313: 1.3000000000000001e-002 | J313: 1.38e-002 | K313: 14.98 | L313: 2.6699999999999998e-002 | M313: 121.4 | N313: 9.13 | O313: 0. | P313: 164.07 | Q313: 转股中 | R313: 4.29年 | S313: 2.29年 | T313: 2.19 | U313: 247 | V313: 0.69099999999999995 | W313: 7.6999999999999999e-002 | X313: 0.126 | Y313: 29 | Z313: 2.72 | AA313: -6.93e-002 | AB313: -7.690000000000001e-002 | AC313: -0.12300000000000001 | AD313: -0.125 | AE313: 86.32 | AF313: 87.38 | AG313: 1 | AH313: A | AI313: 8.2100000000000006e-002 | AJ313: =H313+100*O313 -> 164. | AK313: 163.9 | AL313: 297 | AM313: 76.5 | AN313: 309 | AO313: 8.5000000000000006e-002 | AP313: 55 | AQ313: 华锋转债!!
A314: 70 | B314: 113615 | C314: 金诚转债! | D314: 603979 | E314: 金诚信 | F314: 有色金属 | G314: 有色行业 | H314: 171.57 | I314: 2.7000000000000001e-003 | J314: 7.8000000000000005e-003 | K314: 21.16 | L314: 1.15e-002 | M314: 117.3 | N314: 12.65 | O314: 2.6000000000000002e-002 | P314: 167.27 | Q314: 转股中 | R314: 5.34年 | S314: 3.34年 | T314: 8.98 | U314: 164 | V314: 0.10800000000000001 | W314: 7.2000000000000008e-002 | X314: 0.12 | Y314: 125 | Z314: 2.62 | AA314: -6.9900000000000004e-002 | AB314: -7.4900000000000008e-002 | AC314: -0.13 | AD314: -0.13200000000000001 | AE314: 90.11 | AF314: 94.77 | AG314: 0.92 | AH314: AA | AI314: 4.1599999999999998e-002 | AJ314: =H314+100*O314 -> 174.16999999999999 | AK314: 175.9 | AL314: 318 | AM314: 81.1 | AN314: 313 | AO314: 2.2000000000000002e-002 | AP314: 3 | AQ314: 金诚转债!
A315: 224 | B315: 128097 | C315: 奥佳转债! | D315: 2614 | E315: 奥佳华 | F315: 机械装备 | G315: 专用设备 | H315: 160.3 | I315: -4.0099999999999997e-002 | J315: 1.18e-002 | K315: 15.38 | L315: -3.27e-002 | M315: 114.9 | N315: 10.39 | O315: 8.3000000000000004e-002 | P315: 148.03 | Q315: 转股中 | R315: 4.52年 | S315: 2.52年 | T315: 4.6 | U315: 40 | V315: 5.2999999999999999e-002 | W315: 4.7e-002 | X315: 7.0000000000000007e-002 | Y315: 97 | Z315: 2.1 | AA315: -7.2300000000000003e-002 | AB315: -7.7499999999999999e-002 | AC315: -0.106 | AD315: -0.107 | AE315: 93.14 | AF315: 96.55 | AG315: 0.87 | AH315: AA | AI315: 4.0099999999999997e-002 | AJ315: =H315+100*O315 -> 168.60000000000002 | AK315: 172.6 | AL315: 310 | AM315: 76 | AN315: 308 | AO315: -4.5999999999999999e-002 | AP315: 20 | AQ315: 奥佳转债!
A316: 21 | B316: 123114 | C316: 三角转债 | D316: 300775 | E316: 三角防务 | F316: 航空航天 | G316: 航空航天 | H316: 186 | I316: 3.3300000000000003e-002 | J316: -3.0699999999999998e-002 | K316: 51.15 | L316: 2.8999999999999998e-003 | M316: 121 | N316: 31.82 | O316: 0.157 | P316: 160.75 | Q316: 3月12天 | R316: 5.76年 | S316: 3.76年 | T316: 9.04 | U316: 1155. | V316: 0.69400000000000006 | W316: 3.6000000000000004e-002 | X316: 5.7000000000000002e-002 | Y316: 253 | Z316: 12.36 | AA316: -7.3099999999999998e-002 | AB316: -7.8600000000000003e-002 | AC316: -0.13200000000000001 | AD316: -0.13300000000000001 | AE316: 82.06 | AF316: 85.88 | AG316: 0.88 | AH316: AA- | AI316: 6.2600000000000003e-002 | AJ316: =H316+100*O316 -> 201.69999999999999 | AK316: 211.3 | AL316: 341 | AM316: 125.4 | AN316: 343 | AO316: 0.17300000000000001 | AP316: 4 | AQ316: 三角转债
A317: 362 | B317: 113014 | C317: 林洋转债! | D317: 601222 | E317: 林洋能源 | F317: 能源电力 | G317: 电力设备 | H317: 128.68 | I317: 1.5700000000000002e-002 | J317: -1.6000000000000001e-003 | K317: 10.59 | L317: 1.7299999999999999e-002 | M317: 109.3 | N317: 8.44 | O317: 2.6000000000000002e-002 | P317: 125.47 | Q317: 转股中 | R317: 2.19年 | S317: 0.19年 | T317: 25.3 | U317: 259 | V317: 8.0000000000000002e-002 | W317: 0.13300000000000001 | X317: 0.16699999999999998 | Y317: 190 | Z317: 1.78 | AA317: -7.3300000000000004e-002 | AB317: -8.0399999999999985e-002 | AC317: -0.63600000000000001 | AD317: -0.64400000000000002 | AE317: 100.45 | AF317: 100.77 | AG317: 0.82 | AH317: AA | AI317: 3.8699999999999998e-002 | AJ317: =H317+100*O317 -> 131.28 | AK317: 131.9 | AL317: 66 | AM317: 31.1 | AN317: 33 | AO317: -2.e-002 | AP317: 33 | AQ317: 林洋转债!
A318: 296 | B318: 123022 | C318: 长信转债!! | D318: 300088 | E318: 长信科技 | F318: 通信互联 | G318: 通信设备 | H318: 151.203 | I318: -1.4199999999999999e-002 | J318: 1.1999999999999999e-003 | K318: 8.01 | L318: -1.6e-002 | M318: 114.3 | N318: 6.05 | O318: 0.14199999999999999 | P318: 132.4 | Q318: 转股中 | R318: 3.57年 | S318: 1.58年 | T318: 2.57 | U318: 6.7 | V318: 1.7000000000000001e-002 | W318: 1.3000000000000001e-002 | X318: 1.7000000000000001e-002 | Y318: 197 | Z318: 2.72 | AA318: -7.6600000000000001e-002 | AB318: -8.2899999999999988e-002 | AC318: -0.16899999999999998 | AD318: -0.17000000000000001 | AE318: 96.05 | AF318: 99.59 | AG318: 0.81 | AH318: AA | AI318: 4.0099999999999997e-002 | AJ318: =H318+100*O318 -> 165.40299999999999 | AK318: 170 | AL318: 307 | AM318: 70.4 | AN318: 296 | AO318: -6.6000000000000003e-002 | AP318: 12 | AQ318: 长信转债!!
A319: 14 | B319: 127038 | C319: 国微转债 | D319: 2049 | E319: 紫光国微 | F319: 电子 | G319: 芯片制造 | H319: 183.752 | I319: 4.4000000000000004e-002 | J319: 4.4900000000000002e-002 | K319: 215.95 | L319: 0.10000000000000001 | M319: 114.5 | N319: 137.78 | O319: 0.17199999999999999 | P319: 156.74 | Q319: 3月29天 | R319: 5.80年 | S319: 3.81年 | T319: 15 | U319: 1255. | V319: 0.45000000000000001 | W319: 1.1000000000000001e-002 | X319: 1.8000000000000002e-002 | Y319: 1310. | Z319: 24.78 | AA319: -7.9199999999999993e-002 | AB319: -8.3100000000000007e-002 | AC319: -0.13 | AD319: -0.13100000000000001 | AE319: 89.37 | AF319: 93.22 | AG319: 0.89 | AH319: AA+ | AI319: 3.6600000000000001e-002 | AJ319: =H319+100*O319 -> 200.952 | AK319: 210.8 | AL319: 340 | AM319: 117.6 | AN319: 340 | AO319: 0.14400000000000002 | AP319: 5 | AQ319: 国微转债
A320: 359 | B320: 128018 | C320: 时达转债! | D320: 2527 | E320: 新时达 | F320: 机械装备 | G320: 机器人及 | H320: 130.8 | I320: -1.5e-003 | J320: 7.000000000000001e-004 | K320: 8.8 | L320: -1.1000000000000001e-003 | M320: 109.3 | N320: 7.36 | O320: 9.4e-002 | P320: 119.57 | Q320: 转股中 | R320: 2.22年 | S320: 0.22年 | T320: 4.04 | U320: 6.6 | V320: 1.3000000000000001e-002 | W320: 7.400000000000001e-002 | X320: 8.8000000000000009e-002 | Y320: 55 | Z320: 2.08 | AA320: -7.9299999999999995e-002 | AB320: -8.6300000000000002e-002 | AC320: -0.624 | AD320: -0.63100000000000001 | AE320: 100.35 | AF320: 100.66 | AG320: 0.77 | AH320: AA | AI320: 3.8699999999999998e-002 | AJ320: =H320+100*O320 -> 140.20000000000002 | AK320: 142 | AL320: 165 | AM320: 41.4 | AN320: 116 | AO320: -1.1000000000000001e-002 | AP320: 35 | AQ320: 时达转债!
A321: 60 | B321: 113621 | C321: 彤程转债! | D321: 603650 | E321: 彤程新材 | F321: 化工 | G321: 橡胶塑料 | H321: 181.32 | I321: 3.4000000000000002e-002 | J321: -1.9400000000000001e-002 | K321: 57.21 | L321: 1.5600000000000001e-002 | M321: 115.1 | N321: 32.62 | O321: 3.4000000000000002e-002 | P321: 175.38 | Q321: 转股中 | R321: 5.43年 | S321: 3.44年 | T321: 5.64 | U321: 839 | V321: 0.82400000000000007 | W321: 1.7000000000000001e-002 | X321: 2.8999999999999998e-002 | Y321: 339 | Z321: 14.07 | AA321: -8.1500000000000003e-002 | AB321: -8.5800000000000001e-002 | AC321: -0.13900000000000001 | AD321: -0.14099999999999999 | AE321: 89.57 | AF321: 92.62 | AG321: 0.94 | AH321: AA | AI321: 4.1599999999999998e-002 | AJ321: =H321+100*O321 -> 184.72 | AK321: 187.3 | AL321: 327 | AM321: 94.6 | AN321: 331 | AO321: -0.10800000000000001 | AP321: 7 | AQ321: 彤程转债!
A322: 303 | B322: 113528 | C322: 长城转债!! | D322: 603897 | E322: 长城科技 | F322: 机械装备 | G322: 专用设备 | H322: 157.15 | I322: -2.7999999999999997e-002 | J322: 1.2999999999999999e-003 | K322: 36.87 | L322: -2.9500000000000002e-002 | M322: 116.8 | N322: 23.35 | O322: -5.0000000000000001e-003 | P322: 157.9 | Q322: 转股中 | R322: 3.53年 | S322: 1.53年 | T322: 5.55 | U322: 250 | V322: 0.28600000000000003 | W322: 8.4000000000000005e-002 | X322: 0.13300000000000001 | Y322: 66 | Z322: 3.36 | AA322: -8.2200000000000009e-002 | AB322: -8.9600000000000013e-002 | AC322: -0.188 | AD322: -0.19 | AE322: 93.36 | AF322: 95.2 | AG322: 0.9 | AH322: AA- | AI322: 6.1100000000000002e-002 | AJ322: =H322+100*O322 -> 156.65000000000001 | AK322: 156.4 | AL322: 270 | AM322: 61.2 | AN322: 253 | AO322: 6.2e-002 | AP322: 38 | AQ322: 长城转债!!
A323: 297 | B323: 110055 | C323: 伊力转债!! | D323: 600197 | E323: 伊力特 | F323: 食品饮料 | G323: 白酒 | H323: 154.56 | I323: -6.9099999999999995e-002 | J323: 2.3199999999999998e-002 | K323: 22.29 | L323: -5.5099999999999996e-002 | M323: 114.3 | N323: 16.41 | O323: 0.13800000000000001 | P323: 135.83 | Q323: 转股中 | R323: 3.57年 | S323: 1.57年 | T323: 2.44 | U323: 303 | V323: 0.78799999999999992 | W323: 2.3e-002 | X323: 3.1e-002 | Y323: 105 | Z323: 2.93 | AA323: -8.2500000000000004e-002 | AB323: -8.8800000000000004e-002 | AC323: -0.17800000000000002 | AD323: -0.17899999999999999 | AE323: 96.08 | AF323: 99.62 | AG323: 0.83 | AH323: AA | AI323: 4.0099999999999997e-002 | AJ323: =H323+100*O323 -> 168.36000000000001 | AK323: 173.3 | AL323: 313 | AM323: 73.7 | AN323: 303 | AO323: -9.4e-002 | AP323: 22 | AQ323: 伊力转债!!
A324: 15 | B324: 113049 | C324: 长汽转债 | D324: 601633 | E324: 长城汽车 | F324: 汽车 | G324: 乘用车 | H324: 185.76 | I324: -1.44e-002 | J324: 3.0699999999999998e-002 | K324: 58.27 | L324: 1.8500000000000003e-002 | M324: 110.5 | N324: 38.39 | O324: 0.22399999999999998 | P324: 151.78 | Q324: 3月29天 | R324: 5.80年 | S324: 3.81年 | T324: 35 | U324: 360 | V324: 5.5e-002 | W324: 6.9999999999999993e-003 | X324: 1.e-002 | Y324: 5363. | Z324: 9.46 | AA324: -8.6400000000000005e-002 | AB324: -8.929999999999999e-002 | AC324: -0.13300000000000001 | AD324: -0.13400000000000001 | AE324: 89.39 | AF324: 90.92 | AG324: 0.88 | AH324: AAA | AI324: 3.4599999999999999e-002 | AJ324: =H324+100*O324 -> 208.16 | AK324: 219.7 | AL324: 345 | AM324: 128.8 | AN324: 345 | AO324: 6.0000000000000001e-003 | AP324: 4 | AQ324: 长汽转债
A325: 43 | B325: 127030 | C325: 盛虹转债 | D325: 301 | E325: 东方盛虹 | F325: 化工 | G325: 化纤 | H325: 191.15 | I325: -1.21e-002 | J325: 3.5499999999999997e-002 | K325: 26.13 | L325: 2.4700000000000003e-002 | M325: 112.5 | N325: 14.1 | O325: 3.1e-002 | P325: 185.32 | Q325: 38天 | R325: 5.59年 | S325: 3.59年 | T325: 50 | U325: 281 | V325: 2.8999999999999998e-002 | W325: 4.0000000000000001e-002 | X325: 7.2999999999999995e-002 | Y325: 1263. | Z325: 6.96 | AA325: -9.1700000000000004e-002 | AB325: -9.5100000000000004e-002 | AC325: -0.14599999999999999 | AD325: -0.14699999999999999 | AE325: 90.08 | AF325: 92.32 | AG325: 0.95 | AH325: AA+ | AI325: 3.6600000000000001e-002 | AJ325: =H325+100*O325 -> 194.25 | AK325: 197 | AL325: 334 | AM325: 104.7 | AN325: 334 | AO325: 2.4e-002 | AP325: 5 | AQ325: 盛虹转债
A326: 176 | B326: 128113 | C326: 比音转债! | D326: 2832 | E326: 比音勒芬 | F326: 服装纺织 | G326: 服装行业 | H326: 186.806 | I326: -2.6000000000000002e-002 | J326: -4.0999999999999995e-003 | K326: 26.7 | L326: -3.1899999999999998e-002 | M326: 116.9 | N326: 14.6 | O326: 2.1000000000000001e-002 | P326: 182.88 | Q326: 转股中 | R326: 4.82年 | S326: 2.82年 | T326: 3.03 | U326: 141 | V326: 0.245 | W326: 2.1000000000000001e-002 | X326: 3.7999999999999999e-002 | Y326: 147 | Z326: 5.35 | AA326: -9.4100000000000003e-002 | AB326: -9.9399999999999988e-002 | AC326: -0.115 | AD326: -0.11599999999999999 | AE326: 92.04 | AF326: 97.07 | AG326: 0.94 | AH326: AA | AI326: 4.0099999999999997e-002 | AJ326: =H326+100*O326 -> 188.90600000000001 | AK326: 190.7 | AL326: 331 | AM326: 93.7 | AN326: 330 | AO326: 4.5999999999999999e-002 | AP326: 9 | AQ326: 比音转债!
A327: 30 | B327: 113047 | C327: 旗滨转债 | D327: 601636 | E327: 旗滨集团 | F327: 建筑 | G327: 玻璃 | H327: 198.97 | I327: 3.7400000000000003e-002 | J327: 2.2099999999999998e-002 | K327: 23.86 | L327: 6.3299999999999995e-002 | M327: 114 | N327: 12.8 | O327: 6.7000000000000004e-002 | P327: 186.41 | Q327: 56天 | R327: 5.63年 | S327: 3.64年 | T327: 15 | U327: 1370. | V327: 0.45899999999999996 | W327: 2.3e-002 | X327: 4.4000000000000004e-002 | Y327: 641 | Z327: 6.17 | AA327: -9.5100000000000004e-002 | AB327: -9.8900000000000002e-002 | AC327: -0.152 | AD327: -0.153 | AE327: 89.48 | AF327: 93.35 | AG327: 0.94 | AH327: AA+ | AI327: 3.6600000000000001e-002 | AJ327: =H327+100*O327 -> 205.66999999999999 | AK327: 211.5 | AL327: 342 | AM327: 118.2 | AN327: 341 | AO327: 0.161 | AP327: 6 | AQ327: 旗滨转债
A328: 273 | B328: 113027 | C328: 华钰转债!! | D328: 601020 | E328: ST华钰 | F328: 有色金属 | G328: 锌铅镍锡 | H328: 166.45 | I328: 4.9200000000000001e-002 | J328: -1.1000000000000001e-002 | K328: 11.67 | L328: 5.04e-002 | M328: 114.3 | N328: 10.17 | O328: 0.45100000000000001 | P328: 114.75 | Q328: 转股中 | R328: 3.82年 | S328: 1.82年 | T328: 3.25 | U328: 8717. | V328: 15.44 | W328: 5.0000000000000003e-002 | X328: 5.7999999999999996e-002 | Y328: 65 | Z328: 2.6 | AA328: -9.5299999999999996e-002 | AB328: -0.10099999999999999 | AC328: -0.17199999999999999 | AD328: -0.17300000000000001 | AE328: 88.01 | AF328: 85.08 | AG328: 0.76 | AH328: A | AI328: 8.2100000000000006e-002 | AJ328: =H328+100*O328 -> 211.54999999999998 | AK328: 218.2 | AL328: 344 | AM328: 130.1 | AN328: 346 | AO328: 0.252 | AP328: 47 | AQ328: 华钰转债!!
A329: 206 | B329: 128103 | C329: 同德转债! | D329: 2360 | E329: 同德化工 | F329: 化工 | G329: 化工 | H329: 195.7 | I329: 1.21e-002 | J329: 3.4000000000000002e-003 | K329: 9.9 | L329: 1.6399999999999998e-002 | M329: 121.3 | N329: 5.08 | O329: 4.0000000000000001e-003 | P329: 194.88 | Q329: 转股中 | R329: 4.60年 | S329: 2.60年 | T329: 1.09 | U329: 264 | V329: 1.25 | W329: 2.7999999999999997e-002 | X329: 5.4000000000000006e-002 | Y329: 39 | Z329: 3.01 | AA329: -0.10099999999999999 | AB329: -0.107 | AC329: -0.13600000000000001 | AD329: -0.13699999999999998 | AE329: 86.15 | AF329: 88.77 | AG329: 0.94 | AH329: A+ | AI329: 7.2099999999999997e-002 | AJ329: =H329+100*O329 -> 196.09999999999999 | AK329: 196.5 | AL329: 333 | AM329: 107.8 | AN329: 336 | AO329: 0.10000000000000001 | AP329: 17 | AQ329: 同德转债!
A330: 49 | B330: 123103 | C330: 震安转债 | D330: 300767 | E330: 震安科技 | F330: 化工 | G330: 橡胶塑料 | H330: 217.012 | I330: -1.1299999999999999e-002 | J330: 2.3599999999999999e-002 | K330: 119.1 | L330: 1.29e-002 | M330: 121.4 | N330: 56.89 | O330: 3.7000000000000005e-002 | P330: 209.35 | Q330: 31天 | R330: 5.56年 | S330: 3.56年 | T330: 2.85 | U330: 603 | V330: 0.96999999999999997 | W330: 1.2e-002 | X330: 2.5000000000000001e-002 | Y330: 240 | Z330: 15.06 | AA330: -0.10099999999999999 | AB330: -0.107 | AC330: -0.16899999999999998 | AD330: -0.17100000000000001 | AE330: 80.53 | AF330: 82.59 | AG330: 0.95 | AH330: A+ | AI330: 7.3599999999999999e-002 | AJ330: =H330+100*O330 -> 220.71199999999999 | AK330: 224.7 | AL330: 347 | AM330: 142.1 | AN330: 348 | AO330: 0.28699999999999998 | AP330: 5 | AQ330: 震安转债
A331: 62 | B331: 123094 | C331: 星源转2!!* | D331: 300568 | E331: 星源材质 | F331: 电子 | G331: 电子行业 | H331: 210.4 | I331: -5.3600000000000002e-002 | J331: -6.7000000000000002e-003 | K331: 41.5 | L331: -6.0199999999999997e-002 | M331: 117.3 | N331: 19.64 | O331: -4.0000000000000001e-003 | P331: 211.3 | Q331: 转股中 | R331: 5.42年 | S331: 3.42年 | T331: 4.72 | U331: 658 | V331: 0.65700000000000003 | W331: 1.4999999999999999e-002 | X331: 3.2000000000000001e-002 | Y331: 307 | Z331: 6.16 | AA331: -0.10400000000000001 | AB331: -0.109 | AC331: -0.17100000000000001 | AD331: -0.10000000000000001 | AE331: 89.83 | AF331: 94.48 | AG331: 1 | AH331: AA | AI331: 4.1599999999999998e-002 | AJ331: =H331+100*O331 -> 210. | AK331: 209.5 | AL331: 339 | AM331: 115 | AN331: 339 | AO331: -8.8000000000000009e-002 | AP331: 7 | AQ331: 星源转2!!*
A332: 93 | B332: 123079 | C332: 运达转债!* | D332: 300772 | E332: 运达股份 | F332: 能源电力 | G332: 风能 | H332: 208.5 | I332: 6.1100000000000002e-002 | J332: 5.6999999999999993e-003 | K332: 31.94 | L332: 6.6799999999999998e-002 | M332: 115.1 | N332: 15.12 | O332: -1.3000000000000001e-002 | P332: 211.24 | Q332: 转股中 | R332: 5.28年 | S332: 3.28年 | T332: 1.51 | U332: 1094. | V332: 3.5 | W332: 1.4999999999999999e-002 | X332: 3.1e-002 | Y332: 104 | Z332: 5.56 | AA332: -0.10800000000000001 | AB332: -0.11199999999999999 | AC332: -0.105 | AD332: -0.106 | AE332: 90.14 | AF332: 93.2 | AG332: 1 | AH332: AA | AI332: 4.1599999999999998e-002 | AJ332: =H332+100*O332 -> 207.19999999999999 | AK332: 205.8 | AL332: 338 | AM332: 112.6 | AN332: 337 | AO332: 8.5999999999999993e-002 | AP332: 4 | AQ332: 运达转债!*
A333: 221 | B333: 110066 | C333: 盛屯转债!! | D333: 600711 | E333: 盛屯矿业 | F333: 有色金属 | G333: 有色行业 | H333: 192.13 | I333: -2.4300000000000002e-002 | J333: 1.8000000000000002e-002 | K333: 8.93 | L333: -6.7000000000000002e-003 | M333: 114.9 | N333: 4.87 | O333: 4.8000000000000001e-002 | P333: 183.37 | Q333: 转股中 | R333: 4.53年 | S333: 2.53年 | T333: 3.84 | U333: 349 | V333: 0.46799999999999997 | W333: 1.6e-002 | X333: 2.8999999999999998e-002 | Y333: 240 | Z333: 2.13 | AA333: -0.109 | AB333: -0.114 | AC333: -0.13800000000000001 | AD333: -0.13900000000000001 | AE333: 93.09 | AF333: 96.5 | AG333: 0.94 | AH333: AA | AI333: 4.0099999999999997e-002 | AJ333: =H333+100*O333 -> 196.93000000000001 | AK333: 200.9 | AL333: 336 | AM333: 104.4 | AN333: 333 | AO333: -2.5000000000000001e-002 | AP333: 33 | AQ333: 盛屯转债!!
A334: 312 | B334: 128051 | C334: 光华转债!!* | D334: 2741 | E334: 光华科技 | F334: 电子 | G334: 元器件制 | H334: 169 | I334: 3.8199999999999998e-002 | J334: -6.9999999999999993e-003 | K334: 21.46 | L334: 3.1200000000000002e-002 | M334: 114.8 | N334: 12.72 | O334: 2.e-003 | P334: 168.71 | Q334: 转股中 | R334: 3.32年 | S334: 1.32年 | T334: 0.59 | U334: 316 | V334: 3.1499999999999999 | W334: 6.9999999999999993e-003 | X334: 1.2e-002 | Y334: 81 | Z334: 6.49 | AA334: -0.11199999999999999 | AB334: -0.11900000000000001 | AC334: -0.25 | AD334: -0.252 | AE334: 94.52 | AF334: 94.74 | AG334: 1 | AH334: AA- | AI334: 6.1100000000000002e-002 | AJ334: =H334+100*O334 -> 169.19999999999999 | AK334: 169.3 | AL334: 306 | AM334: 74.5 | AN334: 304 | AO334: -1.6e-002 | AP334: 28 | AQ334: 光华转债!!*
A335: 260 | B335: 113545 | C335: 金能转债! | D335: 603113 | E335: 金能科技 | F335: 煤炭 | G335: 炼焦 | H335: 187.17 | I335: -5.3899999999999997e-002 | J335: 2.1099999999999997e-002 | K335: 17.7 | L335: -3.5400000000000001e-002 | M335: 114.9 | N335: 10.43 | O335: 0.10300000000000001 | P335: 169.7 | Q335: 转股中 | R335: 4年54天 | S335: 2年55天 | T335: 10.2 | U335: 198 | V335: 0.10199999999999999 | W335: 6.7000000000000004e-002 | X335: 0.115 | Y335: 151 | Z335: 1.78 | AA335: -0.113 | AB335: -0.11800000000000001 | AC335: -0.16500000000000001 | AD335: -0.16699999999999998 | AE335: 94.5 | AF335: 97.96 | AG335: 0.93 | AH335: AA | AI335: 4.0099999999999997e-002 | AJ335: =H335+100*O335 -> 197.47 | AK335: 204.6 | AL335: 337 | AM335: 106.7 | AN335: 335 | AO335: 1.3999999999999999e-002 | AP335: 15 | AQ335: 金能转债!
A336: 314 | B336: 110048 | C336: 福能转债!! | D336: 600483 | E336: 福能股份 | F336: 能源电力 | G336: 电力供应 | H336: 169.57 | I336: 1.3999999999999999e-002 | J336: -1.1000000000000001e-003 | K336: 12.27 | L336: 1.3999999999999999e-002 | M336: 113.3 | N336: 7.85 | O336: 8.5000000000000006e-002 | P336: 156.31 | Q336: 转股中 | R336: 3.30年 | S336: 1.30年 | T336: 19.5 | U336: 121 | V336: 3.7999999999999999e-002 | W336: 8.5000000000000006e-002 | X336: 0.13300000000000001 | Y336: 229 | Z336: 1.39 | AA336: -0.11699999999999999 | AB336: -0.12300000000000001 | AC336: -0.25600000000000001 | AD336: -0.25800000000000001 | AE336: 97.78 | AF336: 101.36 | AG336: 0.92 | AH336: AA+ | AI336: 3.5099999999999999e-002 | AJ336: =H336+100*O336 -> 178.06999999999999 | AK336: 182.8 | AL336: 324 | AM336: 81.5 | AN336: 314 | AO336: -1.2e-002 | AP336: 9 | AQ336: 福能转债!!
A337: 229 | B337: 123042 | C337: 银河转债! | D337: 300619 | E337: 金银河 | F337: 机械装备 | G337: 专用设备 | H337: 201 | I337: 4.6900000000000004e-002 | J337: 6.2699999999999992e-002 | K337: 49.25 | L337: 0.115 | M337: 115.4 | N337: 24.38 | O337: -5.0000000000000001e-003 | P337: 202.01 | Q337: 转股中 | R337: 4.40年 | S337: 2.40年 | T337: 1.66 | U337: 5639. | V337: 16.43 | W337: 4.4999999999999998e-002 | X337: 9.0999999999999998e-002 | Y337: 37 | Z337: 7.54 | AA337: -0.121 | AB337: -0.126 | AC337: -0.156 | AD337: -0.157 | AE337: 86.94 | AF337: 85.58 | AG337: 0.95 | AH337: A+ | AI337: 7.2099999999999997e-002 | AJ337: =H337+100*O337 -> 200.5 | AK337: 200 | AL337: 335 | AM337: 113 | AN337: 338 | AO337: 0.36299999999999999 | AP337: 23 | AQ337: 银河转债!
A338: 189 | B338: 113580 | C338: 康隆转债!! | D338: 603665 | E338: 康隆达 | F338: 服装纺织 | G338: 服装行业 | H338: 219.77 | I338: -9.4999999999999998e-003 | J338: 4.4000000000000003e-003 | K338: 11.18 | L338: -1.5800000000000002e-002 | M338: 120.8 | N338: 15.51 | O338: 2.0499999999999998 | P338: 72.08 | Q338: 转股中 | R338: 4.67年 | S338: 2.68年 | T338: 0.41 | U338: 108 | V338: 1.1799999999999999 | W338: 2.3e-002 | X338: 1.7000000000000001e-002 | Y338: 18 | Z338: 1.63 | AA338: -0.122 | AB338: -0.128 | AC338: -0.14800000000000002 | AD338: -0.14899999999999999 | AE338: 87.79 | AF338: 92.12 | AG338: 0.32 | AH338: AA- | AI338: 6.1100000000000002e-002 | AJ338: =H338+100*O338 -> 424.76999999999998 | AK338: 367.5 | AL338: 362 | AM338: 275.3 | AN338: 363 | AO338: -9.4e-002 | AP338: 8 | AQ338: 康隆转债!!
A339: 313 | B339: 128050 | C339: 钧达转债!! | D339: 2865 | E339: 钧达股份 | F339: 汽车 | G339: 零部件制 | H339: 189.04 | I339: 9.300000000000001e-003 | J339: -2.0999999999999999e-003 | K339: 27.98 | L339: 7.1999999999999998e-003 | M339: 122.7 | N339: 14.8 | O339: 0. | P339: 189.05 | Q339: 转股中 | R339: 3.31年 | S339: 1.31年 | T339: 1.39 | U339: 372 | V339: 1.4099999999999999 | W339: 3.7999999999999999e-002 | X339: 7.0999999999999994e-002 | Y339: 37 | Z339: 3.46 | AA339: -0.125 | AB339: -0.13400000000000001 | AC339: -0.29499999999999998 | AD339: -0.29600000000000004 | AE339: 94.5 | AF339: 101.3 | AG339: 1 | AH339: AA- | AI339: 6.1100000000000002e-002 | AJ339: =H339+100*O339 -> 189.03999999999999 | AK339: 189 | AL339: 330 | AM339: 87.7 | AN339: 321 | AO339: 5.0999999999999997e-002 | AP339: 51 | AQ339: 钧达转债!!
A340: 367 | B340: 113012 | C340: 骆驼转债!!* | D340: 601311 | E340: 骆驼股份 | F340: 汽车 | G340: 零部件制 | H340: 131.79 | I340: 9.4999999999999998e-003 | J340: -2.5000000000000001e-003 | K340: 13.04 | L340: 6.8999999999999999e-003 | M340: 106.5 | N340: 9.86 | O340: -3.0000000000000001e-003 | P340: 132.25 | Q340: 转股中 | R340: 1.59年 | S340: 回售内 | T340: 3.07 | U340: 143 | V340: 0.35399999999999998 | W340: 2.1000000000000001e-002 | X340: 2.7999999999999997e-002 | Y340: 146 | Z340: 1.93 | AA340: -0.126 | AB340: -0.13300000000000001 | AC340: 回售内 | AD340: 回售内 | AE340: 100.25 | AF340: 100.31 | AG340: 1 | AH340: AA | AI340: 3.8699999999999998e-002 | AJ340: =H340+100*O340 -> 131.48999999999998 | AK340: 131.3 | AL340: 58 | AM340: 31 | AN340: 32 | AO340: -2.6000000000000002e-002 | AP340: 18 | AQ340: 骆驼转债!!*
A341: 319 | B341: 128046 | C341: 利尔转债!! | D341: 2258 | E341: 利尔化学 | F341: 化工 | G341: 农化 | H341: 173 | I341: -2.9600000000000001e-002 | J341: -1.4199999999999999e-002 | K341: 29.19 | L341: -4.7e-002 | M341: 112.3 | N341: 18.42 | O341: 9.1999999999999998e-002 | P341: 158.47 | Q341: 转股中 | R341: 3年57天 | S341: 1年58天 | T341: 8.08 | U341: 139 | V341: 9.9000000000000005e-002 | W341: 5.2999999999999999e-002 | X341: 8.3000000000000004e-002 | Y341: 154 | Z341: 3.66 | AA341: -0.13 | AB341: -0.13600000000000001 | AC341: -0.29699999999999999 | AD341: -0.29899999999999999 | AE341: 97.63 | AF341: 99.47 | AG341: 0.93 | AH341: AA | AI341: 4.0099999999999997e-002 | AJ341: =H341+100*O341 -> 182.19999999999999 | AK341: 187.5 | AL341: 328 | AM341: 88.1 | AN341: 322 | AO341: -7.400000000000001e-002 | AP341: 10 | AQ341: 利尔转债!!
A342: 341 | B342: 113504 | C342: 艾华转债!! | D342: 603989 | E342: 艾华集团 | F342: 电子 | G342: 元器件制 | H342: 155.03 | I342: -3.7599999999999995e-002 | J342: 9.3999999999999986e-003 | K342: 32.04 | L342: -2.9999999999999999e-002 | M342: 109.3 | N342: 20.81 | O342: 6.9999999999999993e-003 | P342: 153.96 | Q342: 转股中 | R342: 2.53年 | S342: 0.53年 | T342: 4.9 | U342: 78 | V342: 0.10199999999999999 | W342: 3.7999999999999999e-002 | X342: 5.9000000000000004e-002 | Y342: 128 | Z342: 4.72 | AA342: -0.13100000000000001 | AB342: -0.13600000000000001 | AC342: -0.50900000000000001 | AD342: -0.51200000000000001 | AE342: 99.15 | AF342: 99.45 | AG342: 0.94 | AH342: AA | AI342: 3.8699999999999998e-002 | AJ342: =H342+100*O342 -> 155.72999999999999 | AK342: 156.1 | AL342: 269 | AM342: 56.6 | AN342: 226 | AO342: -8.0000000000000002e-002 | AP342: 9 | AQ342: 艾华转债!!
A343: 323 | B343: 123014 | C343: 凯发转债! | D343: 300407 | E343: 凯发电气 | F343: 能源电力 | G343: 电力设备 | H343: 140.92 | I343: -3.0099999999999998e-002 | J343: -1.34e-002 | K343: 8.3 | L343: -7.1599999999999997e-002 | M343: 107.5 | N343: 8.05 | O343: 0.36700000000000005 | P343: 103.11 | Q343: 转股中 | R343: 1.94年 | S343: 回售内 | T343: 1.16 | U343: 104 | V343: 0.629 | W343: 4.5999999999999999e-002 | X343: 4.7e-002 | Y343: 25 | Z343: 1.85 | AA343: -0.13100000000000001 | AB343: -0.13800000000000001 | AC343: 回售内 | AD343: 回售内 | AE343: 100.25 | AF343: 94.29 | AG343: 0.61 | AH343: A+ | AI343: 7.0699999999999999e-002 | AJ343: =H343+100*O343 -> 177.62 | AK343: 178.7 | AL343: 320 | AM343: 78.5 | AN343: 311 | AO343: -1.7000000000000001e-002 | AP343: 15 | AQ343: 凯发转债!
A344: 137 | B344: 110074 | C344: 精达转债!! | D344: 600577 | E344: 精达股份 | F344: 电子 | G344: 电子产品 | H344: 238.61 | I344: -3.9100000000000003e-002 | J344: 1.18e-002 | K344: 8.63 | L344: -2.8199999999999999e-002 | M344: 116.9 | N344: 3.73 | O344: 3.1e-002 | P344: 231.37 | Q344: 转股中 | R344: 4.996年 | S344: 2.999年 | T344: 5.66 | U344: 214 | V344: 0.156 | W344: 3.3000000000000002e-002 | X344: 7.6999999999999999e-002 | Y344: 171 | Z344: 4.19 | AA344: -0.13500000000000001 | AB344: -0.14000000000000001 | AC344: -0.13600000000000001 | AD344: -0.13699999999999998 | AE344: 91.4 | AF344: 96.39 | AG344: 0.97 | AH344: AA | AI344: 4.0099999999999997e-002 | AJ344: =H344+100*O344 -> 241.71000000000001 | AK344: 245.9 | AL344: 349 | AM344: 149.5 | AN344: 349 | AO344: -4.4999999999999998e-002 | AP344: 12 | AQ344: 精达转债!!
A345: 275 | B345: 113537 | C345: 文灿转债!! | D345: 603348 | E345: 文灿股份 | F345: 汽车 | G345: 零部件制 | H345: 208.08 | I345: 2.3199999999999998e-002 | J345: -1.8600000000000002e-002 | K345: 37.03 | L345: 4.8999999999999998e-003 | M345: 120.7 | N345: 19.28 | O345: 8.3000000000000004e-002 | P345: 192.06 | Q345: 转股中 | R345: 3.80年 | S345: 1.81年 | T345: 1.41 | U345: 227 | V345: 0.78400000000000003 | W345: 1.4999999999999999e-002 | X345: 2.7999999999999997e-002 | Y345: 97 | Z345: 3.67 | AA345: -0.13600000000000001 | AB345: -0.14300000000000002 | AC345: -0.22800000000000001 | AD345: -0.23000000000000001 | AE345: 92.27 | AF345: 96.82 | AG345: 0.95 | AH345: AA- | AI345: 6.1100000000000002e-002 | AJ345: =H345+100*O345 -> 216.38000000000002 | AK345: 224.1 | AL345: 346 | AM345: 127.3 | AN345: 344 | AO345: 4.9000000000000002e-002 | AP345: 26 | AQ345: 文灿转债!!
A346: 326 | B346: 123012 | C346: 万顺转债! | D346: 300057 | E346: 万顺新材 | F346: 有色金属 | G346: 铝金属 | H346: 170.6 | I346: -4.2599999999999999e-002 | J346: -2.3e-002 | K346: 8.29 | L346: -7.0599999999999996e-002 | M346: 109.3 | N346: 5.27 | O346: 8.5000000000000006e-002 | P346: 157.31 | Q346: 转股中 | R346: 2.91年 | S346: 0.92年 | T346: 1.28 | U346: 317 | V346: 1.45 | W346: 2.3e-002 | X346: 3.6000000000000004e-002 | Y346: 56 | Z346: 1.57 | AA346: -0.14300000000000002 | AB346: -0.14800000000000002 | AC346: -0.37 | AD346: -0.37200000000000005 | AE346: 95.62 | AF346: 92.55 | AG346: 0.93 | AH346: AA- | AI346: 5.9699999999999996e-002 | AJ346: =H346+100*O346 -> 179.09999999999999 | AK346: 183.9 | AL346: 325 | AM346: 88.3 | AN346: 323 | AO346: 3.9e-002 | AP346: 25 | AQ346: 万顺转债!
A347: 200 | B347: 113034 | C347: 滨化转债! | D347: 601678 | E347: 滨化股份 | F347: 化工 | G347: 化工 | H347: 231.97 | I347: 1.9e-003 | J347: -5.5000000000000005e-003 | K347: 10.51 | L347: -3.8e-003 | M347: 114.8 | N347: 4.58 | O347: 1.1000000000000001e-002 | P347: 229.48 | Q347: 转股中 | R347: 4.64年 | S347: 2.64年 | T347: 4.69 | U347: 971 | V347: 0.88300000000000001 | W347: 2.3e-002 | X347: 5.2000000000000005e-002 | Y347: 205 | Z347: 2.29 | AA347: -0.14300000000000002 | AB347: -0.14699999999999999 | AC347: -0.159 | AD347: -0.16 | AE347: 92.6 | AF347: 96 | AG347: 0.97 | AH347: AA | AI347: 4.0099999999999997e-002 | AJ347: =H347+100*O347 -> 233.06999999999999 | AK347: 234.5 | AL347: 348 | AM347: 138.5 | AN347: 347 | AO347: 0.16800000000000001 | AP347: 23 | AQ347: 滨化转债!
A348: 252 | B348: 113548 | C348: 石英转债! | D348: 603688 | E348: 石英股份 | F348: 电子 | G348: 电子产品 | H348: 240.58 | I348: 2.76e-002 | J348: 3.8e-003 | K348: 32.45 | L348: 3.2799999999999996e-002 | M348: 124.4 | N348: 14.93 | O348: 0.107 | P348: 217.35 | Q348: 转股中 | R348: 4.19年 | S348: 2.19年 | T348: 1.23 | U348: 475 | V348: 1.6100000000000001 | W348: 1.1000000000000001e-002 | X348: 2.3e-002 | Y348: 115 | Z348: 5.81 | AA348: -0.14899999999999999 | AB348: -0.156 | AC348: -0.20600000000000002 | AD348: -0.20699999999999999 | AE348: 90.89 | AF348: 97.68 | AG348: 0.96 | AH348: AA- | AI348: 6.1100000000000002e-002 | AJ348: =H348+100*O348 -> 251.28 | AK348: 263.8 | AL348: 352 | AM348: 166.1 | AN348: 352 | AO348: -1.3000000000000001e-002 | AP348: 14 | AQ348: 石英转债!
A349: 125 | B349: 123067 | C349: 斯莱转债! | D349: 300382 | E349: 斯莱克 | F349: 机械装备 | G349: 专用设备 | H349: 279.314 | I349: 4.6100000000000002e-002 | J349: -1.47e-002 | K349: 26 | L349: 3.2199999999999999e-002 | M349: 121.2 | N349: 9.36 | O349: 6.0000000000000001e-003 | P349: 277.78 | Q349: 转股中 | R349: 5年27天 | S349: 3年28天 | T349: 3.43 | U349: 833 | V349: 0.88 | W349: 2.3e-002 | X349: 6.5000000000000002e-002 | Y349: 147 | Z349: 14.14 | AA349: -0.154 | AB349: -0.16 | AC349: -0.14699999999999999 | AD349: -0.14699999999999999 | AE349: 85.73 | AF349: 89.72 | AG349: 0.98 | AH349: AA- | AI349: 6.2600000000000003e-002 | AJ349: =H349+100*O349 -> 279.91400000000004 | AK349: 280.9 | AL349: 353 | AM349: 191.1 | AN349: 354 | AO349: 4.0000000000000001e-002 | AP349: 13 | AQ349: 斯莱转债!
A350: 309 | B350: 123018 | C350: 溢利转债! | D350: 300381 | E350: 溢多利 | F350: 医药 | G350: 原料药 | H350: 201.539 | I350: -8.199999999999999e-003 | J350: -1.3999999999999999e-002 | K350: 9.28 | L350: -3.2300000000000002e-002 | M350: 114.3 | N350: 8.25 | O350: 0.79200000000000004 | P350: 112.48 | Q350: 转股中 | R350: 3.33年 | S350: 1.34年 | T350: 0.54 | U350: 22 | V350: 0.19699999999999998 | W350: 1.2e-002 | X350: 1.3000000000000001e-002 | Y350: 45 | Z350: 1.51 | AA350: -0.159 | AB350: -0.16500000000000001 | AC350: -0.31 | AD350: -0.312 | AE350: 94.12 | AF350: 94.2 | AG350: 0.69 | AH350: AA- | AI350: 6.1100000000000002e-002 | AJ350: =H350+100*O350 -> 280.73899999999998 | AK350: 290.6 | AL350: 355 | AM350: 196.4 | AN350: 355 | AO350: -1.2e-002 | AP350: 11 | AQ350: 溢利转债!
A351: 265 | B351: 123030 | C351: 九洲转债! | D351: 300040 | E351: 九洲集团 | F351: 能源电力 | G351: 电力设备 | H351: 243.4 | I351: 4.0000000000000002e-004 | J351: 1.26e-002 | K351: 9.11 | L351: 1.3300000000000001e-002 | M351: 120 | N351: 4 | O351: 6.9000000000000006e-002 | P351: 227.75 | Q351: 转股中 | R351: 3.999年 | S351: 2年0.5天 | T351: 0.97 | U351: 422 | V351: 1.8 | W351: 1.9e-002 | X351: 4.2999999999999997e-002 | Y351: 51 | Z351: 1.55 | AA351: -0.16500000000000001 | AB351: -0.17199999999999999 | AC351: -0.23399999999999999 | AD351: -0.23499999999999999 | AE351: 90.48 | AF351: 94.49 | AG351: 0.97 | AH351: AA- | AI351: 6.1100000000000002e-002 | AJ351: =H351+100*O351 -> 250.30000000000001 | AK351: 259.1 | AL351: 351 | AM351: 164.6 | AN351: 351 | AO351: 2.9999999999999999e-002 | AP351: 25 | AQ351: 九洲转债!
A352: 250 | B352: 123034 | C352: 通光转债! | D352: 300265 | E352: 通光线缆 | F352: 通信互联 | G352: 通信设备 | H352: 250.714 | I352: -2.4500000000000001e-002 | J352: 3.7000000000000005e-002 | K352: 12.08 | L352: 1.43e-002 | M352: 118 | N352: 7.95 | O352: 0.65000000000000002 | P352: 151.95 | Q352: 转股中 | R352: 4.21年 | S352: 2.21年 | T352: 0.78 | U352: 829 | V352: 4.2199999999999998 | W352: 1.8000000000000002e-002 | X352: 2.7000000000000003e-002 | Y352: 44 | Z352: 3.39 | AA352: -0.16699999999999998 | AB352: -0.17199999999999999 | AC352: -0.21199999999999999 | AD352: -0.21299999999999999 | AE352: 87.91 | AF352: 88.64 | AG352: 0.88 | AH352: A+ | AI352: 7.2099999999999997e-002 | AJ352: =H352+100*O352 -> 315.714 | AK352: 349.5 | AL352: 358 | AM352: 260.8 | AN352: 358 | AO352: -2.2000000000000002e-002 | AP352: 20 | AQ352: 通光转债!
A353: 373 | B353: 110033 | C353: 国贸转债! | D353: 600755 | E353: 厦门国贸 | F353: 交通运输 | G353: 交通运输 | H353: 116.87 | I353: -2.e-003 | J353: 3.7000000000000002e-003 | K353: 7.47 | L353: 2.7000000000000001e-003 | M353: 108 | N353: 6.72 | O353: 5.0999999999999997e-002 | P353: 111.16 | Q353: 转股中 | R353: 0.38年 | S353: 回售内 | T353: 11.5 | U353: 15 | V353: 1.1000000000000001e-002 | W353: 7.9000000000000001e-002 | X353: 8.6999999999999994e-002 | Y353: 146 | Z353: 0.9 | AA353: -0.188 | AB353: -0.22 | AC353: 回售内 | AD353: 回售内 | AE353: 100.33 | AF353: 106.97 | AG353: 0.63 | AH353: AAA | AI353: 2.5600000000000001e-002 | AJ353: =H353+100*O353 -> 121.97 | AK353: 122.6 | AL353: 9 | AM353: 15.6 | AN353: 3 | AO353: 1.7000000000000001e-002 | AP353: 21 | AQ353: 国贸转债!
A354: 361 | B354: 128017 | C354: 金禾转债!! | D354: 2597 | E354: 金禾实业 | F354: 化工 | G354: 化工 | H354: 170.71 | I354: -2.7300000000000001e-002 | J354: 4.6999999999999993e-003 | K354: 32.65 | L354: -2.4199999999999999e-002 | M354: 108.8 | N354: 21.97 | O354: 0.14899999999999999 | P354: 148.61 | Q354: 转股中 | R354: 2.20年 | S354: 0.20年 | T354: 5.52 | U354: 76 | V354: 8.0000000000000002e-002 | W354: 2.9999999999999999e-002 | X354: 4.4999999999999998e-002 | Y354: 183 | Z354: 3.65 | AA354: -0.188 | AB354: -0.193 | AC354: -1.181 | AD354: -1.1850000000000001 | AE354: 100.15 | AF354: 100.23 | AG354: 0.93 | AH354: AA | AI354: 3.8699999999999998e-002 | AJ354: =H354+100*O354 -> 185.61000000000001 | AK354: 192.8 | AL354: 332 | AM354: 92.6 | AN354: 329 | AO354: 3.9e-002 | AP354: 10 | AQ354: 金禾转债!!
A355: 321 | B355: 123015 | C355: 蓝盾转债!! | D355: 300297 | E355: 蓝盾股份 | F355: 计算机及 | G355: 软件开发 | H355: 209.3 | I355: 1.06e-002 | J355: -1.06e-002 | K355: 3.45 | L355: 8.8000000000000005e-003 | M355: 111.3 | N355: 5.79 | O355: 2.5099999999999998 | P355: 59.59 | Q355: 转股中 | R355: 2.98年 | S355: 0.98年 | T355: 1 | U355: 577 | V355: 2.7200000000000002 | W355: 2.3e-002 | X355: 1.3999999999999999e-002 | Y355: 43 | Z355: 1.65 | AA355: -0.193 | AB355: -0.19800000000000001 | AC355: -0.441 | AD355: -0.442 | AE355: 89.35 | AF355: 79.67 | AG355: 0 | AH355: BBB- | AI355: 0.1207 | AJ355: =H355+100*O355 -> 460.29999999999995 | AK355: 359 | AL355: 360 | AM355: 269.7 | AN355: 362 | AO355: -0.13100000000000001 | AP355: 16 | AQ355: 蓝盾转债!!
A356: 308 | B356: 113526 | C356: 联泰转债! | D356: 603797 | E356: 联泰环保 | F356: 城市公用 | G356: 三废处理 | H356: 228.25 | I356: 9.0000000000000011e-003 | J356: -6.0999999999999995e-003 | K356: 6.68 | L356: 4.5000000000000005e-003 | M356: 110.3 | N356: 6.11 | O356: 1.0900000000000001 | P356: 109.33 | Q356: 转股中 | R356: 3.43年 | S356: 1.43年 | T356: 1.93 | U356: 907 | V356: 1.99 | W356: 4.9000000000000002e-002 | X356: 5.4000000000000006e-002 | Y356: 39 | Z356: 1.76 | AA356: -0.19399999999999998 | AB356: -0.19800000000000001 | AC356: -0.32400000000000001 | AD356: -0.32500000000000001 | AE356: 97.35 | AF356: 98.24 | AG356: 0.64 | AH356: AA+ | AI356: 3.5099999999999999e-002 | AJ356: =H356+100*O356 -> 337.25 | AK356: 347.2 | AL356: 357 | AM356: 248.9 | AN356: 357 | AO356: 1.e-003 | AP356: 9 | AQ356: 联泰转债!
A357: 208 | B357: 123047 | C357: 久吾转债! | D357: 300631 | E357: 久吾高科 | F357: 机械装备 | G357: 专用设备 | H357: 359.601 | I357: -1.9099999999999999e-002 | J357: -1.6399999999999998e-002 | K357: 54.14 | L357: -3.6499999999999998e-002 | M357: 129.6 | N357: 17.43 | O357: 0.158 | P357: 310.61 | Q357: 转股中 | R357: 4.58年 | S357: 2.58年 | T357: 1.58 | U357: 2931. | V357: 5.0899999999999999 | W357: 2.7000000000000003e-002 | X357: 8.4000000000000005e-002 | Y357: 59 | Z357: 7.12 | AA357: -0.20399999999999999 | AB357: -0.21100000000000002 | AC357: -0.20999999999999999 | AD357: -0.21100000000000002 | AE357: 87.43 | AF357: 95.11 | AG357: 0.97 | AH357: A+ | AI357: 7.2099999999999997e-002 | AJ357: =H357+100*O357 -> 375.40100000000001 | AK357: 408.6 | AL357: 366 | AM357: 313.5 | AN357: 366 | AO357: 2.7000000000000003e-002 | AP357: 23 | AQ357: 久吾转债!
A358: 365 | B358: 127004 | C358: 模塑转债!! | D358: 700 | E358: 模塑科技 | F358: 汽车 | G358: 零部件制 | H358: 168.01 | I358: 1.9e-003 | J358: 8.0000000000000004e-004 | K358: 5.98 | L358: 1.3600000000000001e-002 | M358: 111.8 | N358: 7.24 | O358: 1.03 | P358: 82.6 | Q358: 转股中 | R358: 1.79年 | S358: 回售内 | T358: 1.32 | U358: 49 | V358: 0.222 | W358: 2.4e-002 | X358: 2.e-002 | Y358: 55 | Z358: 1.97 | AA358: -0.20600000000000002 | AB358: -0.215 | AC358: 回售内 | AD358: 回售内 | AE358: 100.3 | AF358: 99.31 | AG358: 0.2 | AH358: AA- | AI358: 5.9699999999999996e-002 | AJ358: =H358+100*O358 -> 271.00999999999999 | AK358: 253.4 | AL358: 350 | AM358: 153.1 | AN358: 350 | AO358: 2.2000000000000002e-002 | AP358: 30 | AQ358: 模塑转债!!
A359: 283 | B359: 113534 | C359: 鼎胜转债!! | D359: 603876 | E359: 鼎胜新材 | F359: 有色金属 | G359: 小金属 | H359: 266.12 | I359: -1.9400000000000001e-002 | J359: 3.61e-002 | K359: 37.78 | L359: 1.7000000000000001e-002 | M359: 114.3 | N359: 15.18 | O359: 6.9000000000000006e-002 | P359: 248.88 | Q359: 转股中 | R359: 3.63年 | S359: 1.64年 | T359: 4.39 | U359: 659 | V359: 0.55299999999999994 | W359: 2.4e-002 | X359: 5.9999999999999998e-002 | Y359: 183 | Z359: 4.52 | AA359: -0.20999999999999999 | AB359: -0.215 | AC359: -0.313 | AD359: -0.314 | AE359: 92.46 | AF359: 92.53 | AG359: 0.98 | AH359: AA- | AI359: 6.1100000000000002e-002 | AJ359: =H359+100*O359 -> 273.01999999999998 | AK359: 283.4 | AL359: 354 | AM359: 190.8 | AN359: 353 | AO359: 6.9000000000000006e-002 | AP359: 33 | AQ359: 鼎胜转债!!
A360: 209 | B360: 123046 | C360: 天铁转债! | D360: 300587 | E360: 天铁股份 | F360: 铁路 | G360: 铁路设备 | H360: 351 | I360: 1.1999999999999999e-003 | J360: -5.7999999999999996e-003 | K360: 19.24 | L360: -4.6999999999999993e-003 | M360: 117.7 | N360: 5.9 | O360: 7.5999999999999998e-002 | P360: 326.1 | Q360: 转股中 | R360: 4.58年 | S360: 2.58年 | T360: 0.62 | U360: 740 | V360: 3.4199999999999999 | W360: 6.0000000000000001e-003 | X360: 1.8000000000000002e-002 | Y360: 111 | Z360: 4.04 | AA360: -0.215 | AB360: -0.22 | AC360: -0.20999999999999999 | AD360: -0.21100000000000002 | AE360: 88.2 | AF360: 90.27 | AG360: 0.98 | AH360: AA- | AI360: 6.1100000000000002e-002 | AJ360: =H360+100*O360 -> 358.60000000000002 | AK360: 375.9 | AL360: 364 | AM360: 285.6 | AN360: 365 | AO360: 0.157 | AP360: 14 | AQ360: 天铁转债!
A361: 177 | B361: 128111 | C361: 中矿转债! | D361: 2738 | E361: 中矿资源 | F361: 有色金属 | G361: 有色行业 | H361: 408 | I361: 9.0899999999999995e-002 | J361: 7.6e-003 | K361: 58.8 | L361: 0.10000000000000001 | M361: 124.2 | N361: 15.42 | O361: 7.0000000000000007e-002 | P361: 381.32 | Q361: 转股中 | R361: 4.81年 | S361: 2.81年 | T361: 1.52 | U361: 2390. | V361: 3.8199999999999998 | W361: 8.0000000000000002e-003 | X361: 3.1e-002 | Y361: 190 | Z361: 5.54 | AA361: -0.222 | AB361: -0.22800000000000001 | AC361: -0.19899999999999998 | AD361: -0.19899999999999998 | AE361: 87.44 | AF361: 93.99 | AG361: 0.98 | AH361: AA- | AI361: 6.1100000000000002e-002 | AJ361: =H361+100*O361 -> 415. | AK361: 434.7 | AL361: 369 | AM361: 340.7 | AN361: 369 | AO361: 6.8000000000000005e-002 | AP361: 9 | AQ361: 中矿转债!
A362: 332 | B362: 110044 | C362: 广电转债!! | D362: 600831 | E362: 广电网络 | F362: 传媒娱乐 | G362: 影视娱乐 | H362: 227.76 | I362: -9.300000000000001e-003 | J362: 7.3000000000000001e-003 | K362: 5.37 | L362: -9.1999999999999998e-003 | M362: 111.3 | N362: 6.87 | O362: 1.9099999999999999 | P362: 78.17 | Q362: 转股中 | R362: 2.85年 | S362: 0.85年 | T362: 0.71 | U362: 141 | V362: 0.86199999999999999 | W362: 1.9e-002 | X362: 1.4999999999999999e-002 | Y362: 38 | Z362: 1.02 | AA362: -0.22399999999999998 | AB362: -0.23000000000000001 | AC362: -0.54200000000000004 | AD362: -0.54400000000000004 | AE362: 97.95 | AF362: 100.05 | AG362: 0.21 | AH362: AA | AI362: 3.8699999999999998e-002 | AJ362: =H362+100*O362 -> 418.75999999999999 | AK362: 377.4 | AL362: 365 | AM362: 277.3 | AN362: 364 | AO362: -2.e-003 | AP362: 10 | AQ362: 广电转债!!
A363: 187 | B363: 113582 | C363: 火炬转债! | D363: 603678 | E363: 火炬电子 | F363: 电子 | G363: 元器件制 | H363: 378.41 | I363: 1.7600000000000001e-002 | J363: 3.4000000000000002e-003 | K363: 84.56 | L363: 2.1299999999999999e-002 | M363: 114.9 | N363: 24.99 | O363: 0.11800000000000001 | P363: 338.38 | Q363: 转股中 | R363: 4.77年 | S363: 2.77年 | T363: 4.18 | U363: 558 | V363: 0.35299999999999998 | W363: 1.1000000000000001e-002 | X363: 3.6000000000000004e-002 | Y363: 389 | Z363: 9.57 | AA363: -0.22399999999999998 | AB363: -0.22800000000000001 | AC363: -0.19800000000000001 | AD363: -0.19800000000000001 | AE363: 92.23 | AF363: 95.61 | AG363: 0.99 | AH363: AA | AI363: 4.0099999999999997e-002 | AJ363: =H363+100*O363 -> 390.21000000000004 | AK363: 418.4 | AL363: 367 | AM363: 322.8 | AN363: 368 | AO363: 4.8000000000000001e-002 | AP363: 6 | AQ363: 火炬转债!
A364: 231 | B364: 128093 | C364: 百川转债!! | D364: 2455 | E364: 百川股份 | F364: 化工 | G364: 化工 | H364: 402 | I364: 2.5000000000000001e-003 | J364: 2.8000000000000004e-003 | K364: 22.15 | L364: 5.4000000000000003e-003 | M364: 129.8 | N364: 5.77 | O364: 4.7e-002 | P364: 383.88 | Q364: 转股中 | R364: 4.37年 | S364: 2.37年 | T364: 1.62 | U364: 4147. | V364: 6.3399999999999999 | W364: 1.3000000000000001e-002 | X364: 5.0000000000000003e-002 | Y364: 125 | Z364: 8.43 | AA364: -0.23300000000000001 | AB364: -0.24100000000000002 | AC364: -0.24399999999999999 | AD364: -0.245 | AE364: 92.21 | AF364: 101.15 | AG364: 0.98 | AH364: AA- | AI364: 6.1100000000000002e-002 | AJ364: =H364+100*O364 -> 406.69999999999999 | AK364: 420.1 | AL364: 368 | AM364: 319 | AN364: 367 | AO364: 0.159 | AP364: 47 | AQ364: 百川转债!!
A365: 349 | B365: 128029 | C365: 太阳转债!! | D365: 2078 | E365: 太阳纸业 | F365: 造纸包装 | G365: 造纸行业 | H365: 154.001 | I365: -1.e-004 | J365: -1.46e-002 | K365: 11.44 | L365: -1.46e-002 | M365: 107 | N365: 8.45 | O365: 0.13800000000000001 | P365: 135.38 | Q365: 转股中 | R365: 1.34年 | S365: 回售内 | T365: 9.09 | U365: 22 | V365: 1.4999999999999999e-002 | W365: 2.9999999999999999e-002 | X365: 4.0000000000000001e-002 | Y365: 307 | Z365: 1.76 | AA365: -0.23899999999999999 | AB365: -0.24600000000000002 | AC365: 回售内 | AD365: 回售内 | AE365: 100.17 | AF365: 102.39 | AG365: 1 | AH365: AA+ | AI365: 3.3700000000000001e-002 | AJ365: =H365+100*O365 -> 167.80100000000002 | AK365: 172.6 | AL365: 311 | AM365: 70.2 | AN365: 295 | AO365: -3.9e-002 | AP365: 7 | AQ365: 太阳转债!!
A366: 282 | B366: 113025 | C366: 明泰转债!! | D366: 601677 | E366: 明泰铝业 | F366: 有色金属 | G366: 铝金属 | H366: 312.14 | I366: -6.0999999999999995e-003 | J366: 2.2599999999999999e-002 | K366: 33.96 | L366: 1.6799999999999999e-002 | M366: 114.5 | N366: 11 | O366: 1.1000000000000001e-002 | P366: 308.73 | Q366: 转股中 | R366: 3.64年 | S366: 1.64年 | T366: 11 | U366: 274 | V366: 7.9000000000000001e-002 | W366: 4.7e-002 | X366: 0.14599999999999999 | Y366: 232 | Z366: 2.57 | AA366: -0.24399999999999999 | AB366: -0.249 | AC366: -0.34100000000000003 | AD366: -0.34200000000000003 | AE366: 95.84 | AF366: 99.52 | AG366: 0.99 | AH366: AA | AI366: 4.0099999999999997e-002 | AJ366: =H366+100*O366 -> 313.24000000000001 | AK366: 315.6 | AL366: 356 | AM366: 216 | AN366: 356 | AO366: 8.3000000000000004e-002 | AP366: 23 | AQ366: 明泰转债!!
A367: 274 | B367: 123027 | C367: 蓝晓转债! | D367: 300487 | E367: 蓝晓科技 | F367: 化工 | G367: 化工 | H367: 341.129 | I367: -2.2000000000000002e-002 | J367: 2.2000000000000002e-002 | K367: 94 | L367: 0. | M367: 118.8 | N367: 29.02 | O367: 5.2999999999999999e-002 | P367: 323.91 | Q367: 转股中 | R367: 3.81年 | S367: 1.81年 | T367: 1.07 | U367: 918 | V367: 2.5099999999999998 | W367: 5.0000000000000001e-003 | X367: 1.7000000000000001e-002 | Y367: 207 | Z367: 11.19 | AA367: -0.24600000000000002 | AB367: -0.251 | AC367: -0.317 | AD367: -0.318 | AE367: 90.51 | AF367: 91.73 | AG367: 0.98 | AH367: A+ | AI367: 7.2099999999999997e-002 | AJ367: =H367+100*O367 -> 346.42900000000003 | AK367: 358.3 | AL367: 359 | AM367: 266.6 | AN367: 359 | AO367: 7.400000000000001e-002 | AP367: 20 | AQ367: 蓝晓转债!
A368: 225 | B368: 128095 | C368: 恩捷转债!! | D368: 2812 | E368: 恩捷股份 | F368: 电子 | G368: 元器件制 | H368: 435.481 | I368: 2.0000000000000001e-004 | J368: -9.0000000000000011e-003 | K368: 256 | L368: -8.8999999999999999e-003 | M368: 114.9 | N368: 64.92 | O368: 0.10400000000000001 | P368: 394.33 | Q368: 转股中 | R368: 4.48年 | S368: 2.48年 | T368: 4.54 | U368: 754 | V368: 0.38299999999999995 | W368: 2.e-003 | X368: 8.0000000000000002e-003 | Y368: 2285. | Z368: 19.72 | AA368: -0.26000000000000001 | AB368: -0.26400000000000001 | AC368: -0.23999999999999999 | AD368: -0.23999999999999999 | AE368: 93.28 | AF368: 96.7 | AG368: 0.99 | AH368: AA | AI368: 4.0099999999999997e-002 | AJ368: =H368+100*O368 -> 445.88099999999997 | AK368: 476.6 | AL368: 370 | AM368: 379.9 | AN368: 370 | AO368: -1.7000000000000001e-002 | AP368: 15 | AQ368: 恩捷转债!!
A369: 371 | B369: 113009 | C369: 广汽转债! | D369: 601238 | E369: 广汽集团 | F369: 汽车 | G369: 乘用车 | H369: 121.02 | I369: 1.e-003 | J369: -5.0000000000000001e-003 | K369: 15.51 | L369: -5.7999999999999996e-003 | M369: 106 | N369: 13.97 | O369: 8.9999999999999997e-002 | P369: 111.02 | Q369: 转股中 | R369: 0.43年 | S369: 回售内 | T369: 25.5 | U369: 126 | V369: 4.0999999999999995e-002 | W369: 1.6e-002 | X369: 1.8000000000000002e-002 | Y369: 1606. | Z369: 1.85 | AA369: -0.26800000000000002 | AB369: -0.28699999999999998 | AC369: 回售内 | AD369: 回售内 | AE369: 100.27 | AF369: 104.87 | AG369: 0.7 | AH369: AAA | AI369: 2.5600000000000001e-002 | AJ369: =H369+100*O369 -> 130.01999999999998 | AK369: 131 | AL369: 52 | AM369: 26.1 | AN369: 10 | AO369: 7.9000000000000001e-002 | AP369: 17 | AQ369: 广汽转债!
A370: 348 | B370: 128030 | C370: 天康转债!! | D370: 2100 | E370: 天康生物 | F370: 农业 | G370: 畜牧业 | H370: 234.888 | I370: 3.8e-003 | J370: -3.8e-003 | K370: 7.38 | L370: -1.34e-002 | M370: 111.3 | N370: 7.39 | O370: 1.3500000000000001 | P370: 99.86 | Q370: 转股中 | R370: 2.34年 | S370: 0.34年 | T370: 0.89 | U370: 13 | V370: 6.3e-002 | W370: 1.1000000000000001e-002 | X370: 1.1000000000000001e-002 | Y370: 79 | Z370: 1.21 | AA370: -0.27699999999999997 | AB370: -0.28199999999999997 | AC370: -1.1779999999999999 | AD370: -1.1799999999999999 | AE370: 99.87 | AF370: 102.01 | AG370: 0 | AH370: AA | AI370: 3.8699999999999998e-002 | AJ370: =H370+100*O370 -> 369.88800000000003 | AK370: 369.9 | AL370: 363 | AM370: 267.9 | AN370: 361 | AO370: -2.2000000000000002e-002 | AP370: 11 | AQ370: 天康转债!!
A371: 328 | B371: 128041 | C371: 盛路转债!! | D371: 2446 | E371: 盛路通信 | F371: 通信互联 | G371: 通信设备 | H371: 297.636 | I371: -1.3100000000000001e-002 | J371: 1.8e-003 | K371: 6.32 | L371: -2.4700000000000003e-002 | M371: 113.3 | N371: 6.82 | O371: 2.21 | P371: 92.67 | Q371: 转股中 | R371: 2.91年 | S371: 0.91年 | T371: 0.53 | U371: 765 | V371: 4.7400000000000002 | W371: 9.0000000000000011e-003 | X371: 9.0000000000000011e-003 | Y371: 57 | Z371: 1.87 | AA371: -0.28499999999999998 | AB371: -0.29100000000000004 | AC371: -0.60899999999999999 | AD371: -0.60999999999999999 | AE371: 97.74 | AF371: 101.63 | AG371: 0.46 | AH371: AA | AI371: 3.8699999999999998e-002 | AJ371: =H371+100*O371 -> 518.63599999999997 | AK371: 502.6 | AL371: 371 | AM371: 401 | AN371: 371 | AO371: -5.2999999999999999e-002 | AP371: 12 | AQ371: 盛路转债!!
A372: 325 | B372: 123013 | C372: 横河转债! | D372: 300539 | E372: 横河精密 | F372: 机械装备 | G372: 专用设备 | H372: 348.167 | I372: -9.4999999999999998e-003 | J372: 3.0999999999999999e-003 | K372: 8.3 | L372: -1.3100000000000001e-002 | M372: 114 | N372: 9.04 | O372: 2.79 | P372: 91.81 | Q372: 转股中 | R372: 2.93年 | S372: 0.93年 | T372: 0.38 | U372: 360 | V372: 2.6400000000000001 | W372: 2.1000000000000001e-002 | X372: 1.9e-002 | Y372: 18 | Z372: 3.71 | AA372: -0.32000000000000001 | AB372: -0.32500000000000001 | AC372: -0.63700000000000001 | AD372: -0.63800000000000001 | AE372: 94.8 | AF372: 93.65 | AG372: 0.49 | AH372: A+ | AI372: 7.0699999999999999e-002 | AJ372: =H372+100*O372 -> 627.16699999999992 | AK372: 604.5 | AL372: 372 | AM372: 509.7 | AN372: 372 | AO372: -1.9e-002 | AP372: 14 | AQ372: 横河转债!
A373: 263 | B373: 123031 | C373: 晶瑞转债! | D373: 300655 | E373: 晶瑞电材 | F373: 电子 | G373: 电子行业 | H373: 552.6 | I373: -6.5000000000000006e-003 | J373: 9.3999999999999986e-003 | K373: 50.15 | L373: 3.0000000000000001e-003 | M373: 115.8 | N373: 10.13 | O373: 0.11599999999999999 | P373: 495.06 | Q373: 转股中 | R373: 4年8天 | S373: 2年9天 | T373: 0.53 | U373: 864 | V373: 2.9100000000000001 | W373: 3.0000000000000001e-003 | X373: 1.4999999999999999e-002 | Y373: 171 | Z373: 7.12 | AA373: -0.32500000000000001 | AB373: -0.32899999999999996 | AC373: -0.32600000000000001 | AD373: -0.32700000000000001 | AE373: 88.84 | AF373: 88.07 | AG373: 0.99 | AH373: A+ | AI373: 7.2099999999999997e-002 | AJ373: =H373+100*O373 -> 564.20000000000005 | AK373: 610.1 | AL373: 373 | AM373: 521.3 | AN373: 373 | AO373: -4.2000000000000003e-002 | AP373: 16 | AQ373: 晶瑞转债!
A374: 360 | B374: 113016 | C374: 小康转债!! | D374: 601127 | E374: 小康股份 | F374: 汽车 | G374: 零部件制 | H374: 350.4 | I374: -8.199999999999999e-003 | J374: 2.0099999999999996e-002 | K374: 56.56 | L374: 1.2e-002 | M374: 109.3 | N374: 16.96 | O374: 5.0999999999999997e-002 | P374: 333.49 | Q374: 转股中 | R374: 2.22年 | S374: 0.22年 | T374: 2.39 | U374: 548 | V374: 0.66000000000000003 | W374: 3.0000000000000001e-003 | X374: 1.e-002 | Y374: 768 | Z374: 15.59 | AA374: -0.41299999999999998 | AB374: -0.40000000000000002 | AC374: -1.9850000000000001 | AD374: -1.9869999999999999 | AE374: 99.59 | AF374: 96.39 | AG374: 0.99 | AH374: AA- | AI374: 5.9699999999999996e-002 | AJ374: =H374+100*O374 -> 355.5 | AK374: 367.3 | AL374: 361 | AM374: 267.7 | AN374: 360 | AO374: -3.4000000000000002e-002 | AP374: 40 | AQ374: 小康转债!!
A376: 声明：本数据不构成任何投资建议，宁稳网不对数据的准确性及完整性做出保证，对使用者参考本数据造成的任何直接或间接损失概不负责。
A378: 来源：宁稳网，http://www.ninwin.cn，版权所有，本数据仅供【十七亩，8703】参考，请勿转发，2021-08-21 11:18:20