A1: 序号 | B1: 转债代码 | C1: 转债名称 | D1: 股票代码 | E1: 股票名称 | F1: 行业 | G1: 子行业 | H1: 转债价格 | I1: 涨跌 | J1: 日内套利 | K1: 股价 | L1: 涨跌 | M1: 剩余本息 | N1: 转股价格 | O1: 转股溢价率 | P1: 转股价值 | Q1: 距离转股日 | R1: 剩余年限 | S1: 回售年限 | T1: 转债余额 | U1: 转债成交额 | V1: 转债换手率 | W1: 余额/市值 | X1: 余额/股本 | Y1: 股票市值 | Z1: P/B | AA1: 税前收益率 | AB1: 税后收益率 | AC1: 税前回售收益 | AD1: 税后回售收益 | AE1: 回售价值 | AF1: 纯债价值 | AG1: 弹性 | AH1: 信用 | AI1: 折现率 | AJ1: 双低 | AK1: 老式双低 | AL1: 老式排名 | AM1: 新式双低 | AN1: 新式排名 | AO1: MA20乖离 | AP1: 热门度 | AQ1: 转债名称
A2: 297 | B2: 128062 | C2: 亚药转债! | D2: 2370 | E2: 亚太药业 | F2: 医药 | G2: 化学制药 | H2: 95.49 | I2: -3.4999999999999996e-003 | J2: 3.4999999999999996e-003 | K2: 4.25 | L2: -3.4099999999999998e-002 | M2: 119.3 | N2: 16.25 | O2: 2.6499999999999999 | P2: 26.15 | Q2: 已到 | R2: 3.35年 | S2: 1.35年 | T2: 9.63 | U2: 16 | V2: 1.7000000000000001e-002 | W2: 0.42200000000000004 | X2: 0.11 | Y2: 23 | Z2: 6.31 | AA2: 7.0300000000000001e-002 | AB2: 5.9400000000000001e-002 | AC2: 5.0499999999999996e-002 | AD2: 4.6600000000000003e-002 | AE2: 81.05 | AF2: 71 | AG2: 0 | AH2: B | AI2: 0.1721 | AJ2: =H2+100*O2 -> 360.49000000000001 | AK2: 164.8 | AL2: 228 | AM2: 83.8 | AN2: 273 | AO2: -1.3999999999999999e-002 | AP2: 90 | AQ2: 亚药转债!
A3: 118 | B3: 128138 | C3: 侨银转债! | D3: 2973 | E3: 侨银股份 | F3: 城市公用 | G3: 城市公用 | H3: 110.81 | I3: 2.e-003 | J3: -2.2000000000000001e-003 | K3: 14.75 | L3: -1.4000000000000002e-003 | M3: 136.1 | N3: 25.33 | O3: 0.90300000000000002 | P3: 58.23 | Q3: 已到 | R3: 4.97年 | S3: 2.97年 | T3: 4.2 | U3: 4 | V3: 9.0000000000000011e-003 | W3: 7.0000000000000007e-002 | X3: 4.0999999999999995e-002 | Y3: 60 | Z3: 3.76 | AA3: 4.2999999999999997e-002 | AB3: 3.1300000000000001e-002 | AC3: -2.0099999999999996e-002 | AD3: -2.2499999999999999e-002 | AE3: 86.48 | AF3: 101.9 | AG3: 0.12 | AH3: AA- | AI3: 6.1100000000000002e-002 | AJ3: =H3+100*O3 -> 201.11000000000001 | AK3: 163.4 | AL3: 218 | AM3: 61.5 | AN3: 160 | AO3: -6.9999999999999993e-003 | AP3: 22 | AQ3: 侨银转债!
A4: 152 | B4: 128127 | C4: 文科转债! | D4: 2775 | E4: 文科园林 | F4: 城市公用 | G4: 生态环境 | H4: 100.017 | I4: 0. | J4: 1.e-003 | K4: 3.6 | L4: 2.8000000000000004e-003 | M4: 120.8 | N4: 4.88 | O4: 0.35600000000000004 | P4: 73.77 | Q4: 已到 | R4: 4.73年 | S4: 2.73年 | T4: 9.5 | U4: 12 | V4: 1.3000000000000001e-002 | W4: 0.51400000000000001 | X4: 0.38 | Y4: 18 | Z4: 0.86 | AA4: 4.1599999999999998e-002 | AB4: 3.3700000000000001e-002 | AC4: 1.2800000000000001e-002 | AD4: 1.0200000000000001e-002 | AE4: 87.51 | AF4: 91.82 | AG4: 0.35 | AH4: AA- | AI4: 6.1100000000000002e-002 | AJ4: =H4+100*O4 -> 135.61699999999999 | AK4: 126.3 | AL4: 3 | AM4: 34.4 | AN4: 13 | AO4: 1.4999999999999999e-002 | AP4: 72 | AQ4: 文科转债!
A5: 310 | B5: 110052 | C5: 贵广转债! | D5: 600996 | E5: 贵广网络 | F5: 传媒娱乐 | G5: 影视娱乐 | H5: 104.97 | I5: -1.4000000000000002e-003 | J5: 8.9999999999999998e-004 | K5: 4.54 | L5: -1.9400000000000001e-002 | M5: 117.7 | N5: 7.94 | O5: 0.83599999999999997 | P5: 57.18 | Q5: 已到 | R5: 3.27年 | S5: 1.27年 | T5: 15.3 | U5: 13 | V5: 8.0000000000000002e-003 | W5: 0.32000000000000001 | X5: 0.183 | Y5: 48 | Z5: 1.25 | AA5: 3.6499999999999998e-002 | AB5: 2.6499999999999999e-002 | AC5: -1.3000000000000001e-002 | AD5: -1.7100000000000001e-002 | AE5: 98.1 | AF5: 105.42 | AG5: 0.03 | AH5: AA+ | AI5: 3.5099999999999999e-002 | AJ5: =H5+100*O5 -> 188.56999999999999 | AK5: 152.8 | AL5: 148 | AM5: 47.3 | AN5: 69 | AO5: 4.0000000000000001e-003 | AP5: 23 | AQ5: 贵广转债!
A6: 163 | B6: 113596 | C6: 城地转债! | D6: 603887 | E6: 城地香江 | F6: 通信互联 | G6: 通信设备 | H6: 96.2 | I6: -3.8e-003 | J6: 3.8e-003 | K6: 7.52 | L6: -1.44e-002 | M6: 113.1 | N6: 24.26 | O6: 2.1000000000000001 | P6: 31 | Q6: 已到 | R6: 4.67年 | S6: 2.67年 | T6: 12 | U6: 20 | V6: 1.7000000000000001e-002 | W6: 0.35399999999999998 | X6: 0.11 | Y6: 34 | Z6: 0.9 | AA6: 3.6000000000000004e-002 | AB6: 3.0600000000000002e-002 | AC6: 2.6200000000000001e-002 | AD6: 2.3700000000000002e-002 | AE6: 87.57 | AF6: 86.26 | AG6: 0 | AH6: AA- | AI6: 6.1100000000000002e-002 | AJ6: =H6+100*O6 -> 306.19999999999999 | AK6: 161.4 | AL6: 203 | AM6: 73.8 | AN6: 238 | AO6: 1.7000000000000001e-002 | AP6: 38 | AQ6: 城地转债!
A7: 171 | B7: 113595 | C7: 花王转债! | D7: 603007 | E7: ST花王 | F7: 城市公用 | G7: 生态环境 | H7: 106.4 | I7: -4.8999999999999998e-003 | J7: 3.4999999999999996e-003 | K7: 3.19 | L7: -1.24e-002 | M7: 124.8 | N7: 6.92 | O7: 1.3100000000000001 | P7: 46.1 | Q7: 已到 | R7: 4.65年 | S7: 2.65年 | T7: 3.3 | U7: 105 | V7: 0.29899999999999999 | W7: 0.308 | X7: 0.14199999999999999 | Y7: 11 | Z7: 1 | AA7: 3.5699999999999996e-002 | AB7: 2.64e-002 | AC7: -9.1000000000000004e-003 | AD7: -1.1599999999999999e-002 | AE7: 79.13 | AF7: 80.26 | AG7: 0.11 | AH7: BBB+ | AI7: 0.10210000000000001 | AJ7: =H7+100*O7 -> 237.40000000000001 | AK7: 166.7 | AL7: 244 | AM7: 86.4 | AN7: 280 | AO7: 0. | AP7: 49 | AQ7: 花王转债!
A8: 229 | B8: 113569 | C8: 科达转债! | D8: 603660 | E8: 苏州科达 | F8: 通信互联 | G8: 物联网 | H8: 104.49 | I8: -2.e-003 | J8: 1.7000000000000001e-003 | K8: 6.18 | L8: -1.1200000000000002e-002 | M8: 120.3 | N8: 14.8 | O8: 1.5 | P8: 41.76 | Q8: 已到 | R8: 4.28年 | S8: 2.28年 | T8: 5.16 | U8: 3.6 | V8: 6.9999999999999993e-003 | W8: 0.16899999999999998 | X8: 7.0999999999999994e-002 | Y8: 31 | Z8: 1.81 | AA8: 3.4300000000000004e-002 | AB8: 2.5699999999999997e-002 | AC8: -3.4000000000000002e-003 | AD8: -6.3e-003 | AE8: 89.8 | AF8: 93.89 | AG8: 0.02 | AH8: AA- | AI8: 6.1100000000000002e-002 | AJ8: =H8+100*O8 -> 254.49000000000001 | AK8: 167.2 | AL8: 248 | AM8: 73.3 | AN8: 234 | AO8: 2.e-002 | AP8: 35 | AQ8: 科达转债!
A9: 154 | B9: 110072 | C9: 广汇转债! | D9: 600297 | E9: 广汇汽车 | F9: 汽车 | G9: 分销、售 | H9: 98.68 | I9: -2.2000000000000001e-003 | J9: 8.0000000000000004e-004 | K9: 2.52 | L9: -1.18e-002 | M9: 114.3 | N9: 4.03 | O9: 0.57799999999999996 | P9: 62.53 | Q9: 已到 | R9: 4.72年 | S9: 2.72年 | T9: 33.7 | U9: 17 | V9: 5.0000000000000001e-003 | W9: 0.16500000000000001 | X9: 0.10300000000000001 | Y9: 204 | Z9: 0.5 | AA9: 3.2099999999999997e-002 | AB9: 2.64e-002 | AC9: 1.43e-002 | AD9: 1.24e-002 | AE9: 93.1 | AF9: 97.36 | AG9: 0.12 | AH9: AA+ | AI9: 3.5099999999999999e-002 | AJ9: =H9+100*O9 -> 156.48000000000002 | AK9: 134.8 | AL9: 15 | AM9: 37.5 | AN9: 21 | AO9: -2.6000000000000002e-002 | AP9: 80 | AQ9: 广汇转债!
A10: 265 | B10: 110059 | C10: 浦发转债! | D10: 600000 | E10: 浦发银行 | F10: 金融 | G10: 银行行业 | H10: 104.54 | I10: -1.2999999999999999e-003 | J10: 5.9999999999999995e-004 | K10: 8.56 | L10: -9.300000000000001e-003 | M10: 116.8 | N10: 13.97 | O10: 0.70599999999999996 | P10: 61.27 | Q10: 已到 | R10: 3.92年 | S10: 无权 | T10: 500 | U10: 164 | V10: 3.0000000000000001e-003 | W10: 0.19899999999999998 | X10: 0.122 | Y10: 2513. | Z10: 0.46 | AA10: 2.9500000000000002e-002 | AB10: 2.1499999999999998e-002 | AC10: 无权 | AD10: 无权 | AE10: 无权 | AF10: 103.16 | AG10: 0.08 | AH10: AAA | AI10: 3.3099999999999997e-002 | AJ10: =H10+100*O10 -> 175.13999999999999 | AK10: 147.8 | AL10: 101 | AM10: 44.6 | AN10: 43 | AO10: -6.9999999999999993e-003 | AP10: 54 | AQ10: 浦发转债!
A11: 82 | B11: 113042 | C11: 上银转债! | D11: 601229 | E11: 上海银行 | F11: 金融 | G11: 银行行业 | H11: 104.51 | I11: -2.0000000000000001e-004 | J11: -5.9999999999999995e-004 | K11: 7.19 | L11: -4.1999999999999997e-003 | M11: 120.9 | N11: 10.63 | O11: 0.54500000000000004 | P11: 67.64 | Q11: 已到 | R11: 5年59天 | S11: 无权 | T11: 200 | U11: 36 | V11: 2.e-003 | W11: 0.19600000000000001 | X11: 0.13200000000000001 | Y11: 1021. | Z11: 0.57 | AA11: 2.9500000000000002e-002 | AB11: 2.2200000000000001e-002 | AC11: 无权 | AD11: 无权 | AE11: 无权 | AF11: 101.83 | AG11: 0.18 | AH11: AAA | AI11: 3.49e-002 | AJ11: =H11+100*O11 -> 159.01000000000002 | AK11: 141.4 | AL11: 39 | AM11: 39.6 | AN11: 29 | AO11: -9.0000000000000011e-003 | AP11: 14 | AQ11: 上银转债!
A12: 188 | B12: 113589 | C12: 天创转债! | D12: 603608 | E12: 天创时尚 | F12: 服装纺织 | G12: 鞋服行业 | H12: 101.01 | I12: 2.0999999999999999e-003 | J12: -2.3999999999999998e-003 | K12: 5.5 | L12: -1.43e-002 | M12: 114.9 | N12: 12.29 | O12: 1.26 | P12: 44.75 | Q12: 已到 | R12: 4.57年 | S12: 2.57年 | T12: 6 | U12: 4.9 | V12: 8.0000000000000002e-003 | W12: 0.254 | X12: 0.114 | Y12: 24 | Z12: 1.5 | AA12: 2.92e-002 | AB12: 2.3099999999999999e-002 | AC12: 8.6999999999999994e-003 | AD12: 6.1999999999999998e-003 | AE12: 92.94 | AF12: 96.35 | AG12: 0.02 | AH12: AA | AI12: 4.0099999999999997e-002 | AJ12: =H12+100*O12 -> 227.00999999999999 | AK12: 157.3 | AL12: 172 | AM12: 60.9 | AN12: 155 | AO12: 8.0000000000000002e-003 | AP12: 39 | AQ12: 天创转债!
A13: 326 | B13: 113519 | C13: 长久转债! | D13: 603569 | E13: 长久物流 | F13: 交通运输 | G13: 物流业 | H13: 109.12 | I13: -1.e-003 | J13: 8.9999999999999998e-004 | K13: 6.53 | L13: -3.0999999999999999e-003 | M13: 118.3 | N13: 11.04 | O13: 0.84499999999999997 | P13: 59.15 | Q13: 已到 | R13: 2.95年 | S13: 0.95年 | T13: 6.97 | U13: 4.6 | V13: 6.0000000000000001e-003 | W13: 0.19 | X13: 0.113 | Y13: 37 | Z13: 1.72 | AA13: 2.8199999999999999e-002 | AB13: 1.7100000000000001e-002 | AC13: -6.0700000000000004e-002 | AD13: -6.3600000000000004e-002 | AE13: 97.59 | AF13: 105.92 | AG13: 0.04 | AH13: AA | AI13: 3.8800000000000001e-002 | AJ13: =H13+100*O13 -> 193.62 | AK13: 159.1 | AL13: 184 | AM13: 53.2 | AN13: 106 | AO13: 2.3e-002 | AP13: 22 | AQ13: 长久转债!
A14: 183 | B14: 128117 | C14: 道恩转债! | D14: 2838 | E14: 道恩股份 | F14: 化工 | G14: 橡胶塑料 | H14: 108.75 | I14: -1.5e-003 | J14: 4.3e-003 | K14: 16.2 | L14: 2.2099999999999998e-002 | M14: 123.1 | N14: 28.83 | O14: 0.93500000000000005 | P14: 56.19 | Q14: 已到 | R14: 4.59年 | S14: 2.59年 | T14: 3.6 | U14: 48 | V14: 0.122 | W14: 5.4000000000000006e-002 | X14: 3.1e-002 | Y14: 66 | Z14: 3.48 | AA14: 2.7900000000000001e-002 | AB14: 1.9099999999999999e-002 | AC14: -1.8100000000000002e-002 | AD14: -2.0499999999999997e-002 | AE14: 87.94 | AF14: 94.24 | AG14: 0.13 | AH14: AA- | AI14: 6.1100000000000002e-002 | AJ14: =H14+100*O14 -> 202.25 | AK14: 161.3 | AL14: 202 | AM14: 67.1 | AN14: 196 | AO14: 5.7999999999999996e-002 | AP14: 25 | AQ14: 道恩转债!
A15: 311 | B15: 113021 | C15: 中信转债! | D15: 601998 | E15: 中信银行 | F15: 金融 | G15: 银行行业 | H15: 108.34 | I15: 1.2999999999999999e-003 | J15: -1.5e-003 | K15: 4.5 | L15: -2.2000000000000001e-003 | M15: 118 | N15: 6.73 | O15: 0.62 | P15: 66.86 | Q15: 已到 | R15: 3.27年 | S15: 无权 | T15: 400 | U15: 21 | V15: 0. | W15: 0.182 | X15: 0.121 | Y15: 2202. | Z15: 0.44 | AA15: 2.7400000000000001e-002 | AB15: 1.7299999999999999e-002 | AC15: 无权 | AD15: 无权 | AE15: 无权 | AF15: 106.47 | AG15: 0.08 | AH15: AAA | AI15: 3.3099999999999997e-002 | AJ15: =H15+100*O15 -> 170.34 | AK15: 149.8 | AL15: 119 | AM15: 43.3 | AN15: 38 | AO15: -3.0000000000000001e-003 | AP15: 37 | AQ15: 中信转债!
A16: 250 | B16: 110064 | C16: 建工转债! | D16: 600939 | E16: 重庆建工 | F16: 建筑 | G16: 建筑工程 | H16: 108.21 | I16: 8.3999999999999995e-003 | J16: -8.8999999999999999e-003 | K16: 3.44 | L16: -2.8999999999999998e-003 | M16: 119.8 | N16: 4.53 | O16: 0.42499999999999999 | P16: 75.94 | Q16: 已到 | R16: 4年23天 | S16: 2年23天 | T16: 16.6 | U16: 12 | V16: 6.9999999999999993e-003 | W16: 0.26600000000000001 | X16: 0.20199999999999999 | Y16: 62 | Z16: 0.86 | AA16: 2.6099999999999998e-002 | AB16: 1.7299999999999999e-002 | AC16: -1.7299999999999999e-002 | AD16: -2.0799999999999999e-002 | AE16: 96.51 | AF16: 104.52 | AG16: 0.19 | AH16: AA+ | AI16: 3.5099999999999999e-002 | AJ16: =H16+100*O16 -> 150.70999999999998 | AK16: 140.5 | AL16: 30 | AM16: 36 | AN16: 19 | AO16: 1.9e-002 | AP16: 45 | AQ16: 建工转债!
A17: 189 | B17: 123056 | C17: 雪榕转债! | D17: 300511 | E17: 雪榕生物 | F17: 农业 | G17: 种植业 | H17: 107.7 | I17: -2.3e-003 | J17: -1.2999999999999999e-003 | K17: 7.26 | L17: -2.0199999999999999e-002 | M17: 120.7 | N17: 11.77 | O17: 0.746 | P17: 61.68 | Q17: 已到 | R17: 4.57年 | S17: 2.57年 | T17: 5.84 | U17: 5.3 | V17: 8.0000000000000002e-003 | W17: 0.182 | X17: 0.11199999999999999 | Y17: 32 | Z17: 1.79 | AA17: 2.58e-002 | AB17: 1.77e-002 | AC17: -1.41e-002 | AD17: -1.66e-002 | AE17: 88.23 | AF17: 92.58 | AG17: 0.18 | AH17: AA- | AI17: 6.1100000000000002e-002 | AJ17: =H17+100*O17 -> 182.30000000000001 | AK17: 153.7 | AL17: 154 | AM17: 61.1 | AN17: 156 | AO17: -4.7e-002 | AP17: 19 | AQ17: 雪榕转债!
A18: 182 | B18: 128118 | C18: 瀛通转债! | D18: 2861 | E18: 瀛通通讯 | F18: 电子 | G18: 电子产品 | H18: 109.04 | I18: -3.2000000000000002e-003 | J18: 4.5000000000000005e-003 | K18: 12.51 | L18: 8.1000000000000013e-003 | M18: 121.7 | N18: 21.24 | O18: 0.85099999999999998 | P18: 58.9 | Q18: 已到 | R18: 4.59年 | S18: 2.59年 | T18: 3 | U18: 3.6 | V18: 1.1000000000000001e-002 | W18: 0.153 | X18: 8.9999999999999997e-002 | Y18: 20 | Z18: 1.87 | AA18: 2.4799999999999999e-002 | AB18: 1.6500000000000001e-002 | AC18: -1.6399999999999998e-002 | AD18: -1.9299999999999998e-002 | AE18: 88.62 | AF18: 93.3 | AG18: 0.16 | AH18: AA- | AI18: 6.1100000000000002e-002 | AJ18: =H18+100*O18 -> 194.13999999999999 | AK18: 159.2 | AL18: 185 | AM18: 65.9 | AN18: 188 | AO18: 6.0999999999999999e-002 | AP18: 23 | AQ18: 瀛通转债!
A19: 206 | B19: 113573 | C19: 纵横转债! | D19: 603602 | E19: 纵横通信 | F19: 通信互联 | G19: 通信设备 | H19: 112.1 | I19: -2.e-003 | J19: 1.1999999999999999e-003 | K19: 10.43 | L19: -6.7000000000000002e-003 | M19: 124.2 | N19: 18.78 | O19: 1.02 | P19: 55.54 | Q19: 已到 | R19: 4.39年 | S19: 2.39年 | T19: 2.7 | U19: 8.9 | V19: 2.9999999999999999e-002 | W19: 0.127 | X19: 7.0000000000000007e-002 | Y19: 21 | Z19: 2.99 | AA19: 2.4199999999999999e-002 | AB19: 1.47e-002 | AC19: -2.8799999999999999e-002 | AD19: -3.1800000000000002e-002 | AE19: 87.35 | AF19: 92.22 | AG19: 0.13 | AH19: A+ | AI19: 7.2099999999999997e-002 | AJ19: =H19+100*O19 -> 214.09999999999999 | AK19: 168.7 | AL19: 253 | AM19: 76.4 | AN19: 250 | AO19: 0.105 | AP19: 27 | AQ19: 纵横转债!
A20: 45 | B20: 127034 | C20: 绿茵转债! | D20: 2887 | E20: 绿茵生态 | F20: 城市公用 | G20: 生态环境 | H20: 105.707 | I20: -3.2000000000000002e-003 | J20: 3.2000000000000002e-003 | K20: 9.63 | L20: 0. | M20: 119 | N20: 12.38 | O20: 0.35899999999999999 | P20: 77.79 | Q20: 已到 | R20: 5.42年 | S20: 3.42年 | T20: 7.12 | U20: 12 | V20: 1.6e-002 | W20: 0.23699999999999999 | X20: 0.184 | Y20: 30 | Z20: 1.47 | AA20: 2.2599999999999999e-002 | AB20: 1.6299999999999999e-002 | AC20: -4.7999999999999996e-003 | AD20: -6.8999999999999999e-003 | AE20: 83.68 | AF20: 86.11 | AG20: 0.46 | AH20: AA- | AI20: 6.2899999999999998e-002 | AJ20: =H20+100*O20 -> 141.607 | AK20: 133.6 | AL20: 14 | AM20: 47.5 | AN20: 70 | AO20: 2.4e-002 | AP20: 34 | AQ20: 绿茵转债!
A21: 159 | B21: 128125 | C21: 华阳转债! | D21: 2949 | E21: 华阳国际 | F21: 建筑 | G21: 建筑工程 | H21: 106.651 | I21: 1.e-004 | J21: 8.0000000000000004e-004 | K21: 14.55 | L21: 5.5000000000000005e-003 | M21: 118.1 | N21: 25.39 | O21: 0.86099999999999999 | P21: 57.31 | Q21: 已到 | R21: 4.67年 | S21: 2.67年 | T21: 4.5 | U21: 2.9 | V21: 6.0000000000000001e-003 | W21: 0.158 | X21: 8.9999999999999997e-002 | Y21: 29 | Z21: 2.11 | AA21: 2.2499999999999999e-002 | AB21: 1.55e-002 | AC21: -1.0800000000000001e-002 | AD21: -1.3100000000000001e-002 | AE21: 87.54 | AF21: 90.03 | AG21: 0.16 | AH21: AA- | AI21: 6.1100000000000002e-002 | AJ21: =H21+100*O21 -> 192.75099999999998 | AK21: 156 | AL21: 168 | AM21: 66 | AN21: 189 | AO21: 3.2000000000000001e-002 | AP21: 11 | AQ21: 华阳转债!
A22: 205 | B22: 113578 | C22: 全筑转债! | D22: 603030 | E22: 全筑股份 | F22: 建筑 | G22: 装饰工程 | H22: 107.16 | I22: 5.0000000000000001e-004 | J22: -2.e-003 | K22: 3.37 | L22: -1.1699999999999999e-002 | M22: 117.9 | N22: 5.25 | O22: 0.66900000000000004 | P22: 64.19 | Q22: 已到 | R22: 4.39年 | S22: 2.39年 | T22: 3.84 | U22: 7.4 | V22: 1.8000000000000002e-002 | W22: 0.19600000000000001 | X22: 0.126 | Y22: 20 | Z22: 0.89 | AA22: 2.2400000000000003e-002 | AB22: 1.5100000000000001e-002 | AC22: -1.3999999999999999e-002 | AD22: -1.6500000000000001e-002 | AE22: 93.59 | AF22: 99.55 | AG22: 0.13 | AH22: AA | AI22: 4.0099999999999997e-002 | AJ22: =H22+100*O22 -> 174.06 | AK22: 150.1 | AL22: 122 | AM22: 50.6 | AN22: 92 | AO22: 4.0000000000000001e-003 | AP22: 30 | AQ22: 全筑转债!
A23: 225 | B23: 128100 | C23: 搜特转债! | D23: 2503 | E23: 搜于特 | F23: 服装纺织 | G23: 服装行业 | H23: 106.745 | I23: -3.7000000000000002e-003 | J23: -4.0000000000000002e-004 | K23: 1.57 | L23: -6.3e-003 | M23: 116.9 | N23: 1.62 | O23: 0.10099999999999999 | P23: 96.91 | Q23: 已到 | R23: 4.29年 | S23: 2.29年 | T23: 7.99 | U23: 78 | V23: 8.9999999999999997e-002 | W23: 0.16500000000000001 | X23: 0.16 | Y23: 49 | Z23: 3.22 | AA23: 2.1899999999999999e-002 | AB23: 1.47e-002 | AC23: -1.3000000000000001e-002 | AD23: -1.5600000000000001e-002 | AE23: 85.37 | AF23: 83.98 | AG23: 0.65 | AH23: A | AI23: 8.2100000000000006e-002 | AJ23: =H23+100*O23 -> 116.845 | AK23: 116.6 | AL23: 1 | AM23: 31.2 | AN23: 6 | AO23: 4.2000000000000003e-002 | AP23: 84 | AQ23: 搜特转债!
A24: 142 | B24: 128132 | C24: 交建转债! | D24: 2941 | E24: 新疆交建 | F24: 建筑 | G24: 建筑工程 | H24: 105.651 | I24: -3.0000000000000001e-003 | J24: 3.7000000000000002e-003 | K24: 11.24 | L24: 6.3e-003 | M24: 116.9 | N24: 18.53 | O24: 0.74199999999999999 | P24: 60.66 | Q24: 已到 | R24: 4.80年 | S24: 2.80年 | T24: 8.49 | U24: 3.6 | V24: 4.0000000000000001e-003 | W24: 0.11699999999999999 | X24: 7.0999999999999994e-002 | Y24: 73 | Z24: 2.8 | AA24: 2.1700000000000001e-002 | AB24: 1.5300000000000001e-002 | AC24: -7.3000000000000001e-003 | AD24: -9.4999999999999998e-003 | AE24: 92.11 | AF24: 97.14 | AG24: 0.11 | AH24: AA | AI24: 4.0099999999999997e-002 | AJ24: =H24+100*O24 -> 179.851 | AK24: 150.6 | AL24: 130 | AM24: 53.5 | AN24: 111 | AO24: 1.7000000000000001e-002 | AP24: 26 | AQ24: 交建转债!
A25: 339 | B25: 127007 | C25: 湖广转债! | D25: 665 | E25: 湖北广电 | F25: 传媒娱乐 | G25: 影视娱乐 | H25: 105.515 | I25: -2.7000000000000001e-003 | J25: 1.7000000000000001e-003 | K25: 3.57 | L25: -1.9199999999999998e-002 | M25: 111.3 | N25: 5.58 | O25: 0.64900000000000002 | P25: 63.98 | Q25: 已到 | R25: 2.58年 | S25: 0.58年 | T25: 12.2 | U25: 10 | V25: 8.0000000000000002e-003 | W25: 0.34700000000000003 | X25: 0.222 | Y25: 35 | Z25: 0.62 | AA25: 2.12e-002 | AB25: 1.3000000000000001e-002 | AC25: -4.6799999999999994e-002 | AD25: -5.1299999999999998e-002 | AE25: 99.3 | AF25: 102.29 | AG25: 0.05 | AH25: AA+ | AI25: 3.3799999999999997e-002 | AJ25: =H25+100*O25 -> 170.41500000000002 | AK25: 147.1 | AL25: 94 | AM25: 44.8 | AN25: 46 | AO25: 2.7999999999999997e-002 | AP25: 25 | AQ25: 湖广转债!
A26: 368 | B26: 128015 | C26: 久其转债!! | D26: 2279 | E26: 久其软件 | F26: 计算机及 | G26: 软件开发 | H26: 106.19 | I26: 2.0000000000000001e-004 | J26: -2.0000000000000001e-004 | K26: 4.44 | L26: -6.7000000000000002e-003 | M26: 109.5 | N26: 6.97 | O26: 0.66700000000000004 | P26: 63.7 | Q26: 已到 | R26: 1.53年 | S26: 回售内 | T26: 7.79 | U26: 7.6 | V26: 9.0000000000000011e-003 | W26: 0.247 | X26: 0.157 | Y26: 32 | Z26: 3.94 | AA26: 2.0499999999999997e-002 | AB26: 8.6999999999999994e-003 | AC26: 回售内 | AD26: 回售内 | AE26: 100.25 | AF26: 98.72 | AG26: 0 | AH26: A+ | AI26: 7.0800000000000002e-002 | AJ26: =H26+100*O26 -> 172.88999999999999 | AK26: 148.7 | AL26: 110 | AM26: 48.4 | AN26: 78 | AO26: 2.1000000000000001e-002 | AP26: 68 | AQ26: 久其转债!!
A27: 281 | B27: 128069 | C27: 华森转债! | D27: 2907 | E27: 华森制药 | F27: 医药 | G27: 化学制药 | H27: 111.307 | I27: -5.8999999999999999e-003 | J27: -3.0000000000000001e-003 | K27: 12.83 | L27: -4.2500000000000003e-002 | M27: 119.3 | N27: 18.01 | O27: 0.56200000000000006 | P27: 71.24 | Q27: 已到 | R27: 3.57年 | S27: 1.57年 | T27: 3 | U27: 55 | V27: 0.16600000000000001 | W27: 5.7999999999999996e-002 | X27: 4.0999999999999995e-002 | Y27: 52 | Z27: 4.35 | AA27: 2.e-002 | AB27: 1.04e-002 | AC27: -4.4999999999999998e-002 | AD27: -4.8000000000000001e-002 | AE27: 92.8 | AF27: 96.92 | AG27: 0.21 | AH27: AA- | AI27: 6.1100000000000002e-002 | AJ27: =H27+100*O27 -> 167.50700000000001 | AK27: 151.4 | AL27: 138 | AM27: 54.5 | AN27: 117 | AO27: 0.10099999999999999 | AP27: 42 | AQ27: 华森转债!
A28: 137 | B28: 113604 | C28: 多伦转债! | D28: 603528 | E28: 多伦科技 | F28: 计算机及 | G28: 软件开发 | H28: 106.37 | I28: -5.3e-003 | J28: 4.5999999999999999e-003 | K28: 6.64 | L28: -3.0000000000000001e-003 | M28: 116.9 | N28: 10.4 | O28: 0.66599999999999993 | P28: 63.85 | Q28: 已到 | R28: 4.88年 | S28: 2.88年 | T28: 6.4 | U28: 5.5 | V28: 8.0000000000000002e-003 | W28: 0.154 | X28: 9.8000000000000004e-002 | Y28: 42 | Z28: 2.54 | AA28: 1.9900000000000001e-002 | AB28: 1.3600000000000001e-002 | AC28: -9.300000000000001e-003 | AD28: -1.15e-002 | AE28: 86.45 | AF28: 88.03 | AG28: 0.25 | AH28: AA- | AI28: 6.1100000000000002e-002 | AJ28: =H28+100*O28 -> 172.97 | AK28: 148.9 | AL28: 113 | AM28: 60.9 | AN28: 154 | AO28: 2.4e-002 | AP28: 10 | AQ28: 多伦转债!
A29: 10 | B29: 123126 | C29: 瑞丰转债! | D29: 300243 | E29: 瑞丰高材 | F29: 化工 | G29: 橡胶塑料 | H29: 116 | I29: -3.4000000000000002e-003 | J29: -4.7999999999999996e-003 | K29: 14.11 | L29: -1.6e-002 | M29: 129.6 | N29: 17.8 | O29: 0.46299999999999997 | P29: 79.27 | Q29: 3月19天 | R29: 5.79年 | S29: 3.79年 | T29: 3.4 | U29: 7.6 | V29: 1.9e-002 | W29: 0.10400000000000001 | X29: 8.199999999999999e-002 | Y29: 33 | Z29: 4.04 | AA29: 1.9900000000000001e-002 | AB29: 1.1399999999999999e-002 | AC29: -2.12e-002 | AD29: -2.4300000000000002e-002 | AE29: 80.81 | AF29: 86.86 | AG29: 0.51 | AH29: A+ | AI29: 7.3899999999999993e-002 | AJ29: =H29+100*O29 -> 162.30000000000001 | AK29: 152.7 | AL29: 147 | AM29: 65.9 | AN29: 187 | AO29: 2.7999999999999997e-002 | AP29: 5 | AQ29: 瑞丰转债!
A30: 168 | B30: 113037 | C30: 紫银转债! | D30: 601860 | E30: 紫金银行 | F30: 金融 | G30: 银行行业 | H30: 105.75 | I30: 7.1999999999999998e-003 | J30: -1.e-002 | K30: 3.16 | L30: -9.3999999999999986e-003 | M30: 115.6 | N30: 4.05 | O30: 0.35499999999999998 | P30: 78.02 | Q30: 已到 | R30: 4.65年 | S30: 无权 | T30: 45 | U30: 105 | V30: 2.2000000000000002e-002 | W30: 0.38900000000000001 | X30: 0.30299999999999999 | Y30: 116 | Z30: 0.75 | AA30: 1.9799999999999998e-002 | AB30: 1.3600000000000001e-002 | AC30: 无权 | AD30: 无权 | AE30: 无权 | AF30: 98.82 | AG30: 0.29 | AH30: AA+ | AI30: 3.5099999999999999e-002 | AJ30: =H30+100*O30 -> 141.25 | AK30: 133.5 | AL30: 12 | AM30: 34.7 | AN30: 14 | AO30: -8.0000000000000002e-003 | AP30: 27 | AQ30: 紫银转债!
A31: 198 | B31: 113584 | C31: 家悦转债! | D31: 603708 | E31: 家家悦 | F31: 商业零售 | G31: 超市 | H31: 105.69 | I31: -1.7000000000000001e-003 | J31: 1.6000000000000001e-003 | K31: 14.6 | L31: -8.8000000000000005e-003 | M31: 114.9 | N31: 37.53 | O31: 1.72 | P31: 38.9 | Q31: 已到 | R31: 4.52年 | S31: 2.52年 | T31: 6.45 | U31: 4.9 | V31: 6.9999999999999993e-003 | W31: 7.2999999999999995e-002 | X31: 2.7999999999999997e-002 | Y31: 89 | Z31: 3.46 | AA31: 1.9e-002 | AB31: 1.3000000000000001e-002 | AC31: -8.199999999999999e-003 | AD31: -1.06e-002 | AE31: 93.13 | AF31: 96.54 | AG31: 0.01 | AH31: AA | AI31: 4.0099999999999997e-002 | AJ31: =H31+100*O31 -> 277.69 | AK31: 172.5 | AL31: 264 | AM31: 75.9 | AN31: 248 | AO31: -2.9999999999999999e-002 | AP31: 17 | AQ31: 家悦转债!
A32: 295 | B32: 128063 | C32: 未来转债! | D32: 2631 | E32: 德尔未来 | F32: 其他 | G32: 家居用品 | H32: 120.01 | I32: 9.300000000000001e-003 | J32: -7.1999999999999998e-003 | K32: 7.53 | L32: 6.7000000000000002e-003 | M32: 127.5 | N32: 8.64 | O32: 0.377 | P32: 87.15 | Q32: 已到 | R32: 3.35年 | S32: 2.35年 | T32: 6.29 | U32: 21 | V32: 2.7000000000000003e-002 | W32: 0.127 | X32: 0.111 | Y32: 50 | Z32: 2.9 | AA32: 1.8799999999999997e-002 | AB32: 5.1000000000000004e-003 | AC32: -4.1399999999999999e-002 | AD32: -4.7100000000000003e-002 | AE32: 93.54 | AF32: 105.21 | AG32: 0.32 | AH32: AA- | AI32: 6.1100000000000002e-002 | AJ32: =H32+100*O32 -> 157.71000000000001 | AK32: 152.9 | AL32: 152 | AM32: 47.7 | AN32: 74 | AO32: 3.9e-002 | AP32: 35 | AQ32: 未来转债!
A33: 46 | B33: 113624 | C33: 正川转债! | D33: 603976 | E33: 正川股份 | F33: 医药 | G33: 医药行业 | H33: 110.66 | I33: 1.3000000000000001e-002 | J33: 2.8999999999999998e-003 | K33: 34.3 | L33: 3.4700000000000002e-002 | M33: 121.6 | N33: 46.69 | O33: 0.50600000000000001 | P33: 73.46 | Q33: 已到 | R33: 5.42年 | S33: 3.42年 | T33: 4.05 | U33: 26 | V33: 5.9000000000000004e-002 | W33: 7.8e-002 | X33: 5.7000000000000002e-002 | Y33: 52 | Z33: 4.7 | AA33: 1.8000000000000002e-002 | AB33: 1.1000000000000001e-002 | AC33: -1.5800000000000002e-002 | AD33: -1.8200000000000001e-002 | AE33: 81.29 | AF33: 83.45 | AG33: 0.46 | AH33: A+ | AI33: 7.3899999999999993e-002 | AJ33: =H33+100*O33 -> 161.25999999999999 | AK33: 147.9 | AL33: 102 | AM33: 64.4 | AN33: 177 | AO33: 2.1000000000000001e-002 | AP33: 21 | AQ33: 正川转债!
A34: 209 | B34: 123049 | C34: 维尔转债! | D34: 300190 | E34: 维尔利 | F34: 城市公用 | G34: 三废处理 | H34: 115.3 | I34: 1.1599999999999999e-002 | J34: -7.9000000000000008e-003 | K34: 5.95 | L34: 1.0200000000000001e-002 | M34: 124.3 | N34: 7.38 | O34: 0.42999999999999999 | P34: 80.62 | Q34: 已到 | R34: 4.38年 | S34: 2.38年 | T34: 9.17 | U34: 18 | V34: 1.7000000000000001e-002 | W34: 0.19699999999999998 | X34: 0.159 | Y34: 47 | Z34: 1.07 | AA34: 1.78e-002 | AB34: 8.3000000000000001e-003 | AC34: -3.9399999999999998e-002 | AD34: -4.24e-002 | AE34: 89.81 | AF34: 96.53 | AG34: 0.37 | AH34: AA- | AI34: 6.1100000000000002e-002 | AJ34: =H34+100*O34 -> 158.30000000000001 | AK34: 150 | AL34: 120 | AM34: 53.4 | AN34: 110 | AO34: 4.2000000000000003e-002 | AP34: 19 | AQ34: 维尔转债!
A35: 117 | B35: 123076 | C35: 强力转债! | D35: 300429 | E35: 强力新材 | F35: 化工 | G35: 化工 | H35: 108.39 | I35: -7.4000000000000003e-003 | J35: 3.4999999999999996e-003 | K35: 12.6 | L35: -1.41e-002 | M35: 118.1 | N35: 18.94 | O35: 0.629 | P35: 66.53 | Q35: 已到 | R35: 4.98年 | S35: 2.98年 | T35: 8.5 | U35: 9.6 | V35: 1.e-002 | W35: 0.13100000000000001 | X35: 8.6999999999999994e-002 | Y35: 65 | Z35: 3.59 | AA35: 1.77e-002 | AB35: 1.1200000000000002e-002 | AC35: -1.49e-002 | AD35: -1.6899999999999998e-002 | AE35: 85.96 | AF35: 88.4 | AG35: 0.28 | AH35: AA- | AI35: 6.1100000000000002e-002 | AJ35: =H35+100*O35 -> 171.28999999999999 | AK35: 150.3 | AL35: 126 | AM35: 61.9 | AN35: 163 | AO35: 2.3e-002 | AP35: 20 | AQ35: 强力转债!
A36: 160 | B36: 113597 | C36: 佳力转债! | D36: 603912 | E36: 佳力图 | F36: 机械装备 | G36: 专用设备 | H36: 114.49 | I36: -4.0000000000000002e-004 | J36: 2.9999999999999997e-004 | K36: 14.06 | L36: -7.000000000000001e-004 | M36: 124 | N36: 23.15 | O36: 0.88500000000000001 | P36: 60.73 | Q36: 已到 | R36: 4.67年 | S36: 2.67年 | T36: 3 | U36: 2.5 | V36: 6.9999999999999993e-003 | W36: 9.8000000000000004e-002 | X36: 5.9999999999999998e-002 | Y36: 30 | Z36: 3.18 | AA36: 1.7600000000000001e-002 | AB36: 8.8000000000000005e-003 | AC36: -3.3799999999999997e-002 | AD36: -3.6400000000000002e-002 | AE36: 87.97 | AF36: 94.57 | AG36: 0.17 | AH36: AA- | AI36: 6.1100000000000002e-002 | AJ36: =H36+100*O36 -> 202.99000000000001 | AK36: 168.2 | AL36: 252 | AM36: 73.7 | AN36: 236 | AO36: 2.8999999999999998e-002 | AP36: 19 | AQ36: 佳力转债!
A37: 187 | B37: 127018 | C37: 本钢转债! | D37: 761 | E37: 本钢板材 | F37: 钢铁 | G37: 炼钢 | H37: 118.564 | I37: 3.2000000000000002e-003 | J37: 1.8e-003 | K37: 4.15 | L37: 1.47e-002 | M37: 128 | N37: 4.55 | O37: 0.29999999999999999 | P37: 91.21 | Q37: 已到 | R37: 4.59年 | S37: 2.59年 | T37: 56.3 | U37: 176 | V37: 2.6000000000000002e-002 | W37: 0.33000000000000002 | X37: 0.30099999999999999 | Y37: 170 | Z37: 0.75 | AA37: 1.7399999999999999e-002 | AB37: 7.0999999999999995e-003 | AC37: -4.0899999999999999e-002 | AD37: -4.4699999999999997e-002 | AE37: 96.88 | AF37: 110.75 | AG37: 0.34 | AH37: AAA | AI37: 3.3099999999999997e-002 | AJ37: =H37+100*O37 -> 148.56399999999999 | AK37: 145.9 | AL37: 80 | AM37: 35.2 | AN37: 15 | AO37: -3.0000000000000001e-003 | AP37: 62 | AQ37: 本钢转债!
A38: 115 | B38: 123077 | C38: 汉得转债! | D38: 300170 | E38: 汉得信息 | F38: 计算机及 | G38: 软件开发 | H38: 115.024 | I38: -1.3999999999999999e-002 | J38: 7.0999999999999995e-003 | K38: 7.68 | L38: -2.5399999999999999e-002 | M38: 125.1 | N38: 9.69 | O38: 0.45100000000000001 | P38: 79.26 | Q38: 已到 | R38: 4.99年 | S38: 2.99年 | T38: 9.37 | U38: 19 | V38: 1.8000000000000002e-002 | W38: 0.13800000000000001 | X38: 0.109 | Y38: 68 | Z38: 2.17 | AA38: 1.7299999999999999e-002 | AB38: 8.8000000000000005e-003 | AC38: -3.3300000000000003e-002 | AD38: -3.5299999999999998e-002 | AE38: 91.46 | AF38: 103.17 | AG38: 0.27 | AH38: AA | AI38: 4.0099999999999997e-002 | AJ38: =H38+100*O38 -> 160.124 | AK38: 150.8 | AL38: 131 | AM38: 47.6 | AN38: 72 | AO38: -1.1000000000000001e-002 | AP38: 16 | AQ38: 汉得转债!
A39: 80 | B39: 123096 | C39: 思创转债! | D39: 300078 | E39: 思创医惠 | F39: 通信互联 | G39: 物联网 | H39: 113.688 | I39: 2.5999999999999999e-003 | J39: 3.4999999999999996e-003 | K39: 6.85 | L39: 1.3300000000000001e-002 | M39: 124 | N39: 8.27 | O39: 0.373 | P39: 82.83 | Q39: 已到 | R39: 5.16年 | S39: 3.16年 | T39: 8.17 | U39: 8.8 | V39: 1.e-002 | W39: 0.13800000000000001 | X39: 0.114 | Y39: 59 | Z39: 2.17 | AA39: 1.7299999999999999e-002 | AB39: 9.3999999999999986e-003 | AC39: -2.69e-002 | AD39: -2.8999999999999998e-002 | AE39: 85.01 | AF39: 91.12 | AG39: 0.45 | AH39: AA- | AI39: 6.2899999999999998e-002 | AJ39: =H39+100*O39 -> 150.988 | AK39: 144.5 | AL39: 66 | AM39: 53.4 | AN39: 109 | AO39: 6.2e-002 | AP39: 13 | AQ39: 思创转债!
A40: 217 | B40: 127016 | C40: 鲁泰转债! | D40: 726 | E40: 鲁 泰Ａ | F40: 服装纺织 | G40: 纺织行业 | H40: 107.93 | I40: 2.9999999999999997e-004 | J40: -2.7000000000000001e-003 | K40: 6.15 | L40: -1.44e-002 | M40: 115.9 | N40: 8.71 | O40: 0.52900000000000003 | P40: 70.61 | Q40: 已到 | R40: 4.36年 | S40: 2.36年 | T40: 14 | U40: 4.9 | V40: 3.0000000000000001e-003 | W40: 0.25800000000000001 | X40: 0.182 | Y40: 54 | Z40: 0.69 | AA40: 1.6799999999999999e-002 | AB40: 1.0200000000000001e-002 | AC40: -1.6899999999999998e-002 | AD40: -1.95e-002 | AE40: 94.84 | AF40: 100.02 | AG40: 0.17 | AH40: AA+ | AI40: 3.5099999999999999e-002 | AJ40: =H40+100*O40 -> 160.83000000000001 | AK40: 145.3 | AL40: 73 | AM40: 45.2 | AN40: 49 | AO40: -5.0000000000000001e-003 | AP40: 21 | AQ40: 鲁泰转债!
A41: 234 | B41: 113566 | C41: 翔港转债! | D41: 603499 | E41: 翔港科技 | F41: 造纸包装 | G41: 包装材料 | H41: 115.76 | I41: -1.4000000000000002e-003 | J41: 1.e-004 | K41: 7.69 | L41: -3.9000000000000003e-003 | M41: 124 | N41: 10.77 | O41: 0.621 | P41: 71.4 | Q41: 已到 | R41: 4.26年 | S41: 2.26年 | T41: 1.61 | U41: 1.8 | V41: 9.0000000000000011e-003 | W41: 0.10400000000000001 | X41: 7.400000000000001e-002 | Y41: 15 | Z41: 2.72 | AA41: 1.67e-002 | AB41: 6.9999999999999993e-003 | AC41: -4.3200000000000002e-002 | AD41: -4.6300000000000001e-002 | AE41: 88.22 | AF41: 92.92 | AG41: 0.32 | AH41: A+ | AI41: 7.2099999999999997e-002 | AJ41: =H41+100*O41 -> 177.86000000000001 | AK41: 160.1 | AL41: 192 | AM41: 67.2 | AN41: 197 | AO41: 1.1000000000000001e-002 | AP41: 27 | AQ41: 翔港转债!
A42: 181 | B42: 113036 | C42: 宁建转债! | D42: 601789 | E42: 宁波建工 | F42: 建筑 | G42: 建筑工程 | H42: 108.5 | I42: -5.6000000000000008e-003 | J42: 2.8999999999999998e-003 | K42: 3.54 | L42: -1.1200000000000002e-002 | M42: 116.9 | N42: 4.76 | O42: 0.45899999999999996 | P42: 74.37 | Q42: 已到 | R42: 4.61年 | S42: 2.61年 | T42: 5.4 | U42: 1.6 | V42: 3.0000000000000001e-003 | W42: 0.156 | X42: 0.11599999999999999 | Y42: 35 | Z42: 1.07 | AA42: 1.66e-002 | AB42: 1.e-002 | AC42: -1.7299999999999999e-002 | AD42: -1.9699999999999999e-002 | AE42: 92.82 | AF42: 97.89 | AG42: 0.24 | AH42: AA | AI42: 4.0099999999999997e-002 | AJ42: =H42+100*O42 -> 154.40000000000001 | AK42: 142.6 | AL42: 48 | AM42: 44.7 | AN42: 44 | AO42: 4.0000000000000001e-003 | AP42: 13 | AQ42: 宁建转债!
A43: 178 | B43: 127019 | C43: 国城转债! | D43: 688 | E43: 国城矿业 | F43: 有色金属 | G43: 锌铅镍锡 | H43: 106.51 | I43: 7.7000000000000002e-003 | J43: -9.0000000000000011e-003 | K43: 13.23 | L43: -9.0000000000000011e-003 | M43: 114.8 | N43: 21.06 | O43: 0.69499999999999995 | P43: 62.82 | Q43: 已到 | R43: 4.63年 | S43: 2.63年 | T43: 8.5 | U43: 23 | V43: 2.5000000000000001e-002 | W43: 5.5999999999999994e-002 | X43: 3.5000000000000003e-002 | Y43: 150 | Z43: 6.23 | AA43: 1.66e-002 | AB43: 1.0800000000000001e-002 | AC43: -1.09e-002 | AD43: -1.32e-002 | AE43: 92.63 | AF43: 96.03 | AG43: 0.14 | AH43: AA | AI43: 4.0099999999999997e-002 | AJ43: =H43+100*O43 -> 176.00999999999999 | AK43: 150.2 | AL43: 125 | AM43: 54.2 | AN43: 115 | AO43: 0.14800000000000002 | AP43: 50 | AQ43: 国城转债!
A44: 150 | B44: 113601 | C44: 塞力转债! | D44: 603716 | E44: 塞力医疗 | F44: 医药 | G44: 医药商业 | H44: 111.95 | I44: 6.6e-003 | J44: -2.3e-003 | K44: 14.8 | L44: 8.8999999999999999e-003 | M44: 120.8 | N44: 16.98 | O44: 0.28399999999999997 | P44: 87.16 | Q44: 已到 | R44: 4.73年 | S44: 2.73年 | T44: 5.43 | U44: 6.2 | V44: 1.e-002 | W44: 0.17899999999999999 | X44: 0.156 | Y44: 30 | Z44: 1.99 | AA44: 1.66e-002 | AB44: 8.8999999999999999e-003 | AC44: -2.6200000000000001e-002 | AD44: -2.86e-002 | AE44: 87.49 | AF44: 91.81 | AG44: 0.49 | AH44: AA- | AI44: 6.1100000000000002e-002 | AJ44: =H44+100*O44 -> 140.34999999999999 | AK44: 136.7 | AL44: 20 | AM44: 44.9 | AN44: 48 | AO44: 5.7999999999999996e-002 | AP44: 37 | AQ44: 塞力转债!
A45: 218 | B45: 113033 | C45: 利群转债! | D45: 601366 | E45: 利群股份 | F45: 商业零售 | G45: 商场 | H45: 107.32 | I45: -2.5000000000000001e-003 | J45: 2.5000000000000001e-003 | K45: 5.96 | L45: 0. | M45: 114.9 | N45: 7.01 | O45: 0.26200000000000001 | P45: 85.02 | Q45: 已到 | R45: 4.34年 | S45: 2.34年 | T45: 18 | U45: 10 | V45: 5.0000000000000001e-003 | W45: 0.35100000000000003 | X45: 0.29799999999999999 | Y45: 51 | Z45: 1.17 | AA45: 1.6200000000000003e-002 | AB45: 9.8999999999999991e-003 | AC45: -1.4800000000000001e-002 | AD45: -1.7399999999999999e-002 | AE45: 93.78 | AF45: 97.22 | AG45: 0.38 | AH45: AA | AI45: 4.0099999999999997e-002 | AJ45: =H45+100*O45 -> 133.51999999999998 | AK45: 129.6 | AL45: 6 | AM45: 32.4 | AN45: 9 | AO45: -6.9999999999999993e-003 | AP45: 70 | AQ45: 利群转债!
A46: 35 | B46: 113625 | C46: 江山转债! | D46: 603208 | E46: 江山欧派 | F46: 其他 | G46: 家居用品 | H46: 114.02 | I46: -2.e-003 | J46: -4.0999999999999995e-003 | K46: 55.5 | L46: -3.1800000000000002e-002 | M46: 124 | N46: 96.33 | O46: 0.97900000000000009 | P46: 57.61 | Q46: 21天 | R46: 5.54年 | S46: 3.54年 | T46: 5.83 | U46: 5.4 | V46: 8.0000000000000002e-003 | W46: 0.10000000000000001 | X46: 5.7999999999999996e-002 | Y46: 58 | Z46: 3.17 | AA46: 1.5600000000000001e-002 | AB46: 8.199999999999999e-003 | AC46: -2.5000000000000001e-002 | AD46: -2.69e-002 | AE46: 83.1 | AF46: 89.07 | AG46: 0.19 | AH46: AA- | AI46: 6.2899999999999998e-002 | AJ46: =H46+100*O46 -> 211.92000000000002 | AK46: 170.4 | AL46: 259 | AM46: 81.4 | AN46: 269 | AO46: -6.9999999999999993e-003 | AP46: 5 | AQ46: 江山转债!
A47: 226 | B47: 123044 | C47: 红相转债!! | D47: 300427 | E47: 红相股份 | F47: 能源电力 | G47: 电力设备 | H47: 117.5 | I47: -4.1999999999999997e-003 | J47: -2.3999999999999998e-003 | K47: 14 | L47: -2.23e-002 | M47: 125 | N47: 18.67 | O47: 0.56700000000000006 | P47: 74.99 | Q47: 已到 | R47: 4.29年 | S47: 2.29年 | T47: 5.5 | U47: 29 | V47: 4.4999999999999998e-002 | W47: 0.109 | X47: 8.199999999999999e-002 | Y47: 50 | Z47: 2.14 | AA47: 1.49e-002 | AB47: 5.0000000000000001e-003 | AC47: -4.7199999999999999e-002 | AD47: -5.0499999999999996e-002 | AE47: 90.53 | AF47: 97.63 | AG47: 0.3 | AH47: AA- | AI47: 6.1100000000000002e-002 | AJ47: =H47+100*O47 -> 174.19999999999999 | AK47: 160 | AL47: 188 | AM47: 62.4 | AN47: 166 | AO47: 4.9000000000000002e-002 | AP47: 22 | AQ47: 红相转债!!
A48: 99 | B48: 113044 | C48: 大秦转债! | D48: 601006 | E48: 大秦铁路 | F48: 铁路 | G48: 铁路运输 | H48: 106.11 | I48: 5.9999999999999995e-004 | J48: -1.8e-003 | K48: 6.12 | L48: -3.3e-003 | M48: 114.1 | N48: 7.18 | O48: 0.245 | P48: 85.24 | Q48: 已到 | R48: 5年17天 | S48: 3年17天 | T48: 320 | U48: 126 | V48: 4.0000000000000001e-003 | W48: 0.35200000000000004 | X48: 0.29999999999999999 | Y48: 910 | Z48: 0.76 | AA48: 1.4800000000000001e-002 | AB48: 9.5999999999999992e-003 | AC48: -6.5000000000000006e-003 | AD48: -8.8000000000000005e-003 | AE48: 93.18 | AF48: 96.33 | AG48: 0.39 | AH48: AAA | AI48: 3.49e-002 | AJ48: =H48+100*O48 -> 130.61000000000001 | AK48: 127 | AL48: 4 | AM48: 30.7 | AN48: 3 | AO48: -1.6e-002 | AP48: 29 | AQ48: 大秦转债!
A49: 300 | B49: 113530 | C49: 大丰转债! | D49: 603081 | E49: 大丰实业 | F49: 建筑 | G49: 装饰工程 | H49: 115.39 | I49: -1.2999999999999999e-003 | J49: -1.7000000000000001e-003 | K49: 11.93 | L49: -2.53e-002 | M49: 121 | N49: 16.49 | O49: 0.59499999999999997 | P49: 72.35 | Q49: 已到 | R49: 3.33年 | S49: 1.33年 | T49: 6.3 | U49: 11 | V49: 1.4999999999999999e-002 | W49: 0.13100000000000001 | X49: 9.5000000000000001e-002 | Y49: 48 | Z49: 2.05 | AA49: 1.47e-002 | AB49: 3.7000000000000002e-003 | AC49: -7.4299999999999991e-002 | AD49: -7.7699999999999991e-002 | AE49: 97.09 | AF49: 106.46 | AG49: 0.12 | AH49: AA | AI49: 4.0099999999999997e-002 | AJ49: =H49+100*O49 -> 174.88999999999999 | AK49: 158.4 | AL49: 180 | AM49: 52 | AN49: 101 | AO49: 7.9000000000000001e-002 | AP49: 29 | AQ49: 大丰转债!
A50: 296 | B50: 113532 | C50: 海环转债! | D50: 603817 | E50: 海峡环保 | F50: 城市公用 | G50: 三废处理 | H50: 107.15 | I50: 2.9999999999999997e-004 | J50: 2.2000000000000001e-003 | K50: 5.9 | L50: 1.03e-002 | M50: 112.3 | N50: 7.63 | O50: 0.38600000000000001 | P50: 77.33 | Q50: 已到 | R50: 3.35年 | S50: 1.35年 | T50: 4.59 | U50: 7.3 | V50: 1.4999999999999999e-002 | W50: 0.17300000000000001 | X50: 0.13400000000000001 | Y50: 27 | Z50: 1.46 | AA50: 1.44e-002 | AB50: 7.6e-003 | AC50: -2.7300000000000001e-002 | AD50: -3.0800000000000001e-002 | AE50: 96.92 | AF50: 98.74 | AG50: 0.24 | AH50: AA | AI50: 4.0099999999999997e-002 | AJ50: =H50+100*O50 -> 145.75 | AK50: 137 | AL50: 21 | AM50: 38.2 | AN50: 22 | AO50: 4.2999999999999997e-002 | AP50: 30 | AQ50: 海环转债!
A51: 84 | B51: 123093 | C51: 金陵转债! | D51: 300651 | E51: 金陵体育 | F51: 其他 | G51: 文化教育 | H51: 120.47 | I51: -4.0999999999999995e-003 | J51: -8.0000000000000004e-004 | K51: 29.25 | L51: -2.1700000000000001e-002 | M51: 129.3 | N51: 49.19 | O51: 1.03 | P51: 59.46 | Q51: 已到 | R51: 5年53天 | S51: 3年53天 | T51: 2.5 | U51: 17 | V51: 5.7999999999999996e-002 | W51: 6.6000000000000003e-002 | X51: 3.9e-002 | Y51: 38 | Z51: 5.41 | AA51: 1.43e-002 | AB51: 4.8999999999999998e-003 | AC51: -3.7400000000000003e-002 | AD51: -4.0800000000000003e-002 | AE51: 84.34 | AF51: 90.67 | AG51: 0.22 | AH51: A+ | AI51: 7.3899999999999993e-002 | AJ51: =H51+100*O51 -> 223.47 | AK51: 181.5 | AL51: 287 | AM51: 90.8 | AN51: 285 | AO51: 6.6000000000000003e-002 | AP51: 9 | AQ51: 金陵转债!
A52: 191 | B52: 128114 | C52: 正邦转债! | D52: 2157 | E52: 正邦科技 | F52: 农业 | G52: 畜牧业 | H52: 108 | I52: -1.4000000000000002e-003 | J52: -1.8e-003 | K52: 9.94 | L52: -1.9699999999999999e-002 | M52: 114.9 | N52: 14.77 | O52: 0.60499999999999998 | P52: 67.3 | Q52: 已到 | R52: 4.55年 | S52: 2.55年 | T52: 16 | U52: 22 | V52: 1.3000000000000001e-002 | W52: 5.0999999999999997e-002 | X52: 3.4000000000000002e-002 | Y52: 313 | Z52: 2.41 | AA52: 1.3999999999999999e-002 | AB52: 8.0000000000000002e-003 | AC52: -1.6e-002 | AD52: -1.84e-002 | AE52: 94.22 | AF52: 98.51 | AG52: 0.16 | AH52: AA+ | AI52: 3.5099999999999999e-002 | AJ52: =H52+100*O52 -> 168.5 | AK52: 148.7 | AL52: 111 | AM52: 50.2 | AN52: 91 | AO52: -5.7000000000000002e-002 | AP52: 23 | AQ52: 正邦转债!
A53: 221 | B53: 110068 | C53: 龙净转债! | D53: 600388 | E53: 龙净环保 | F53: 城市公用 | G53: 三废处理 | H53: 108.3 | I53: 4.0000000000000002e-004 | J53: -6.3e-003 | K53: 8.6 | L53: -1.9400000000000001e-002 | M53: 114.8 | N53: 10.55 | O53: 0.32899999999999996 | P53: 81.52 | Q53: 已到 | R53: 4.32年 | S53: 2.32年 | T53: 20 | U53: 50 | V53: 2.3e-002 | W53: 0.218 | X53: 0.17699999999999999 | Y53: 92 | Z53: 1.43 | AA53: 1.3899999999999999e-002 | AB53: 7.6e-003 | AC53: -1.9e-002 | AD53: -2.1499999999999998e-002 | AE53: 94.88 | AF53: 99.21 | AG53: 0.31 | AH53: AA+ | AI53: 3.5099999999999999e-002 | AJ53: =H53+100*O53 -> 141.19999999999999 | AK53: 135.1 | AL53: 16 | AM53: 35.9 | AN53: 17 | AO53: 5.0000000000000003e-002 | AP53: 39 | AQ53: 龙净转债!
A54: 239 | B54: 113563 | C54: 柳药转债! | D54: 603368 | E54: 柳药股份 | F54: 医药 | G54: 医药商业 | H54: 107 | I54: 1.e-004 | J54: -1.6000000000000001e-003 | K54: 15.92 | L54: -9.300000000000001e-003 | M54: 112.9 | N54: 23.87 | O54: 0.60399999999999998 | P54: 66.69 | Q54: 已到 | R54: 4年50天 | S54: 2年50天 | T54: 8.02 | U54: 4.4 | V54: 5.0000000000000001e-003 | W54: 0.13900000000000001 | X54: 9.3000000000000013e-002 | Y54: 58 | Z54: 1.1 | AA54: 1.34e-002 | AB54: 7.4999999999999997e-003 | AC54: -1.49e-002 | AD54: -1.77e-002 | AE54: 94.55 | AF54: 96.31 | AG54: 0.16 | AH54: AA | AI54: 4.0099999999999997e-002 | AJ54: =H54+100*O54 -> 167.40000000000001 | AK54: 147.3 | AL54: 99 | AM54: 51 | AN54: 96 | AO54: 1.9e-002 | AP54: 17 | AQ54: 柳药转债!
A55: 156 | B55: 127021 | C55: 特发转2! | D55: 70 | E55: 特发信息 | F55: 通信互联 | G55: 通信设备 | H55: 107.998 | I55: -2.8000000000000004e-003 | J55: 2.0999999999999999e-003 | K55: 6.42 | L55: -1.83e-002 | M55: 113 | N55: 12.33 | O55: 1.0700000000000001 | P55: 52.07 | Q55: 已到 | R55: 3.69年 | S55: 1.69年 | T55: 5.5 | U55: 1.9 | V55: 3.0000000000000001e-003 | W55: 0.10400000000000001 | X55: 5.4000000000000006e-002 | Y55: 53 | Z55: 1.83 | AA55: 1.2500000000000001e-002 | AB55: 6.0000000000000001e-003 | AC55: -3.1699999999999999e-002 | AD55: -3.3399999999999999e-002 | AE55: 94.6 | AF55: 97.9 | AG55: 0.04 | AH55: AA | AI55: 4.0099999999999997e-002 | AJ55: =H55+100*O55 -> 214.99799999999999 | AK55: 163.9 | AL55: 223 | AM55: 66 | AN55: 191 | AO55: 2.9999999999999999e-002 | AP55: 16 | AQ55: 特发转2!
A56: 215 | B56: 128105 | C56: 长集转债! | D56: 2616 | E56: 长青集团 | F56: 城市公用 | G56: 三废处理 | H56: 109.389 | I56: 7.7000000000000002e-003 | J56: -3.4000000000000002e-003 | K56: 5.85 | L56: 1.7399999999999999e-002 | M56: 114.9 | N56: 7.91 | O56: 0.47899999999999998 | P56: 73.96 | Q56: 已到 | R56: 4.36年 | S56: 2.36年 | T56: 8 | U56: 10 | V56: 1.2e-002 | W56: 0.184 | X56: 0.13600000000000001 | Y56: 43 | Z56: 1.74 | AA56: 1.1599999999999999e-002 | AB56: 5.3e-003 | AC56: -2.2200000000000001e-002 | AD56: -2.4700000000000003e-002 | AE56: 93.7 | AF56: 97.14 | AG56: 0.25 | AH56: AA | AI56: 4.0099999999999997e-002 | AJ56: =H56+100*O56 -> 157.28899999999999 | AK56: 144.8 | AL56: 67 | AM56: 47.7 | AN56: 75 | AO56: 3.2000000000000001e-002 | AP56: 18 | AQ56: 长集转债!
A57: 144 | B57: 123065 | C57: 宝莱转债! | D57: 300246 | E57: 宝莱特 | F57: 医药 | G57: 医疗器械 | H57: 114.661 | I57: -8.1000000000000013e-003 | J57: 7.1999999999999998e-003 | K57: 18.6 | L57: -1.43e-002 | M57: 121 | N57: 40.14 | O57: 1.47 | P57: 46.34 | Q57: 已到 | R57: 4.77年 | S57: 2.77年 | T57: 2.19 | U57: 32 | V57: 0.127 | W57: 8.1000000000000003e-002 | X57: 3.7000000000000005e-002 | Y57: 27 | Z57: 3.11 | AA57: 1.1599999999999999e-002 | AB57: 4.0000000000000001e-003 | AC57: -3.32e-002 | AD57: -3.5699999999999996e-002 | AE57: 87.45 | AF57: 91.76 | AG57: 0.06 | AH57: AA- | AI57: 6.1100000000000002e-002 | AJ57: =H57+100*O57 -> 261.661 | AK57: 183 | AL57: 289 | AM57: 91.2 | AN57: 287 | AO57: 8.9999999999999997e-002 | AP57: 21 | AQ57: 宝莱转债!
A58: 254 | B58: 128083 | C58: 新北转债! | D58: 2376 | E58: 新北洋 | F58: 电子 | G58: 电子产品 | H58: 109.899 | I58: -4.5000000000000005e-003 | J58: 2.3999999999999998e-003 | K58: 8.98 | L58: -7.7000000000000002e-003 | M58: 114.9 | N58: 11.45 | O58: 0.40100000000000002 | P58: 78.43 | Q58: 已到 | R58: 4年15天 | S58: 2年15天 | T58: 8.77 | U58: 4.8 | V58: 5.0000000000000001e-003 | W58: 0.14699999999999999 | X58: 0.115 | Y58: 60 | Z58: 1.77 | AA58: 1.1299999999999999e-002 | AB58: 4.5999999999999999e-003 | AC58: -2.75e-002 | AD58: -3.04e-002 | AE58: 94.9 | AF58: 98.38 | AG58: 0.28 | AH58: AA | AI58: 4.0099999999999997e-002 | AJ58: =H58+100*O58 -> 149.999 | AK58: 141.4 | AL58: 38 | AM58: 43 | AN58: 37 | AO58: 6.2e-002 | AP58: 21 | AQ58: 新北转债!
A59: 323 | B59: 128049 | C59: 华源转债! | D59: 2787 | E59: 华源控股 | F59: 造纸包装 | G59: 包装材料 | H59: 110.868 | I59: -2.2000000000000001e-003 | J59: -8.9999999999999998e-004 | K59: 5.73 | L59: -1.04e-002 | M59: 114.5 | N59: 7.37 | O59: 0.42599999999999999 | P59: 77.75 | Q59: 已到 | R59: 3年0.1天 | S59: 1年0.1天 | T59: 3.63 | U59: 13 | V59: 3.2000000000000001e-002 | W59: 0.20100000000000001 | X59: 0.156 | Y59: 18 | Z59: 1.18 | AA59: 1.11e-002 | AB59: 2.2000000000000001e-003 | AC59: -6.3099999999999989e-002 | AD59: -6.7500000000000004e-002 | AE59: 96.04 | AF59: 96.26 | AG59: 0.29 | AH59: AA- | AI59: 6.1100000000000002e-002 | AJ59: =H59+100*O59 -> 153.46799999999999 | AK59: 144 | AL59: 59 | AM59: 47.7 | AN59: 76 | AO59: 2.3e-002 | AP59: 42 | AQ59: 华源转债!
A60: 288 | B60: 128066 | C60: 亚泰转债! | D60: 2811 | E60: 郑中设计 | F60: 建筑 | G60: 装饰工程 | H60: 112.5 | I60: 2.7000000000000001e-003 | J60: 3.0000000000000001e-003 | K60: 8.66 | L60: 1.1699999999999999e-002 | M60: 116.7 | N60: 9.27 | O60: 0.20399999999999999 | P60: 93.42 | Q60: 已到 | R60: 3.39年 | S60: 1.39年 | T60: 4.8 | U60: 7.4 | V60: 1.3999999999999999e-002 | W60: 0.20499999999999999 | X60: 0.192 | Y60: 23 | Z60: 1.68 | AA60: 1.11e-002 | AB60: 2.3e-003 | AC60: -5.5599999999999997e-002 | AD60: -5.91e-002 | AE60: 94.06 | AF60: 95.91 | AG60: 0.48 | AH60: AA- | AI60: 6.1100000000000002e-002 | AJ60: =H60+100*O60 -> 132.90000000000001 | AK60: 131.6 | AL60: 9 | AM60: 35.7 | AN60: 16 | AO60: 5.7000000000000002e-002 | AP60: 65 | AQ60: 亚泰转债!
A61: 177 | B61: 123059 | C61: 银信转债! | D61: 300231 | E61: 银信科技 | F61: 计算机及 | G61: 软件开发 | H61: 118.139 | I61: 1.7100000000000001e-002 | J61: -1.44e-002 | K61: 8.33 | L61: 6.0000000000000001e-003 | M61: 123.7 | N61: 9.72 | O61: 0.379 | P61: 85.7 | Q61: 已到 | R61: 4.63年 | S61: 2.63年 | T61: 3.91 | U61: 44 | V61: 9.6000000000000002e-002 | W61: 0.106 | X61: 9.0999999999999998e-002 | Y61: 37 | Z61: 2.63 | AA61: 1.0200000000000001e-002 | AB61: 1.5e-003 | AC61: -4.6199999999999998e-002 | AD61: -4.8499999999999995e-002 | AE61: 87.92 | AF61: 94.55 | AG61: 0.45 | AH61: AA- | AI61: 6.1100000000000002e-002 | AJ61: =H61+100*O61 -> 156.03899999999999 | AK61: 150.6 | AL61: 129 | AM61: 56 | AN61: 129 | AO61: 3.3000000000000002e-002 | AP61: 18 | AQ61: 银信转债!
A62: 72 | B62: 113620 | C62: 傲农转债! | D62: 603363 | E62: 傲农生物 | F62: 农业 | G62: 畜牧业 | H62: 115.01 | I62: -8.0000000000000004e-004 | J62: -1.1999999999999999e-003 | K62: 10.72 | L62: -7.4000000000000003e-003 | M62: 121.1 | N62: 14.51 | O62: 0.55700000000000005 | P62: 73.88 | Q62: 已到 | R62: 5.28年 | S62: 3.28年 | T62: 10 | U62: 1.8 | V62: 2.e-003 | W62: 0.13600000000000001 | X62: 0.10099999999999999 | Y62: 73 | Z62: 3.37 | AA62: 1.e-002 | AB62: 3.0999999999999999e-003 | AC62: -3.0099999999999998e-002 | AD62: -3.2000000000000001e-002 | AE62: 90.05 | AF62: 97.89 | AG62: 0.26 | AH62: AA | AI62: 4.1900000000000007e-002 | AJ62: =H62+100*O62 -> 170.71000000000001 | AK62: 156.1 | AL62: 169 | AM62: 58.2 | AN62: 138 | AO62: -5.0000000000000003e-002 | AP62: 9 | AQ62: 傲农转债!
A63: 165 | B63: 128123 | C63: 国光转债! | D63: 2749 | E63: 国光股份 | F63: 化工 | G63: 农化 | H63: 110.617 | I63: 1.6000000000000001e-003 | J63: -3.8e-003 | K63: 9.16 | L63: -7.6e-003 | M63: 115.7 | N63: 13.49 | O63: 0.629 | P63: 67.9 | Q63: 已到 | R63: 4.66年 | S63: 2.66年 | T63: 3.2 | U63: 3.2 | V63: 9.0000000000000011e-003 | W63: 8.0000000000000002e-002 | X63: 5.4000000000000006e-002 | Y63: 40 | Z63: 3.04 | AA63: 9.8999999999999991e-003 | AB63: 3.8e-003 | AC63: -2.3e-002 | AD63: -2.5399999999999999e-002 | AE63: 87.75 | AF63: 88.29 | AG63: 0.29 | AH63: AA- | AI63: 6.1100000000000002e-002 | AJ63: =H63+100*O63 -> 173.517 | AK63: 153.3 | AL63: 153 | AM63: 65 | AN63: 181 | AO63: 8.1000000000000003e-002 | AP63: 14 | AQ63: 国光转债!
A64: 50 | B64: 110080 | C64: 东湖转债 | D64: 600133 | E64: 东湖高新 | F64: 建筑 | G64: 建筑工程 | H64: 109.3 | I64: -4.1999999999999997e-003 | J64: 0. | K64: 5.18 | L64: -9.5999999999999992e-003 | M64: 115.1 | N64: 6.05 | O64: 0.27699999999999997 | P64: 85.62 | Q64: 已到 | R64: 5.37年 | S64: 3.37年 | T64: 15.5 | U64: 9.8 | V64: 6.0000000000000001e-003 | W64: 0.376 | X64: 0.32200000000000001 | Y64: 41 | Z64: 0.73 | AA64: 9.8999999999999991e-003 | AB64: 4.7999999999999996e-003 | AC64: -1.5100000000000001e-002 | AD64: -1.7100000000000001e-002 | AE64: 89.71 | AF64: 92.72 | AG64: 0.44 | AH64: AA | AI64: 4.1900000000000007e-002 | AJ64: =H64+100*O64 -> 137. | AK64: 133 | AL64: 10 | AM64: 40.3 | AN64: 31 | AO64: -1.2e-002 | AP64: 29 | AQ64: 东湖转债
A65: 63 | B65: 123106 | C65: 正丹转债! | D65: 300641 | E65: 正丹股份 | F65: 化工 | G65: 化工 | H65: 119.272 | I65: -3.5999999999999999e-003 | J65: 9.0000000000000011e-003 | K65: 6.89 | L65: 1.03e-002 | M65: 125.5 | N65: 7.5 | O65: 0.29799999999999999 | P65: 91.87 | Q65: 已到 | R65: 5.32年 | S65: 3.32年 | T65: 3.2 | U65: 4.6 | V65: 1.2e-002 | W65: 9.5000000000000001e-002 | X65: 8.6999999999999994e-002 | Y65: 34 | Z65: 2.36 | AA65: 9.7999999999999997e-003 | AB65: 1.8e-003 | AC65: -3.9300000000000002e-002 | AD65: -4.1299999999999996e-002 | AE65: 84.14 | AF65: 91.32 | AG65: 0.53 | AH65: AA- | AI65: 6.2899999999999998e-002 | AJ65: =H65+100*O65 -> 149.072 | AK65: 146.7 | AL65: 89 | AM65: 55.4 | AN65: 125 | AO65: 4.4999999999999998e-002 | AP65: 17 | AQ65: 正丹转债!
A66: 132 | B66: 123072 | C66: 乐歌转债! | D66: 300729 | E66: 乐歌股份 | F66: 其他 | G66: 家居用品 | H66: 124 | I66: -2.3999999999999998e-003 | J66: -5.6000000000000008e-003 | K66: 32.41 | L66: -2.76e-002 | M66: 129.1 | N66: 49.24 | O66: 0.88400000000000001 | P66: 65.82 | Q66: 已到 | R66: 4.90年 | S66: 2.90年 | T66: 1.42 | U66: 23 | V66: 0.13100000000000001 | W66: 2.e-002 | X66: 1.3000000000000001e-002 | Y66: 71 | Z66: 3.95 | AA66: 8.5000000000000006e-003 | AB66: -1.1999999999999999e-003 | AC66: -4.99e-002 | AD66: -5.3399999999999996e-002 | AE66: 86.03 | AF66: 92.77 | AG66: 0.29 | AH66: A+ | AI66: 7.2099999999999997e-002 | AJ66: =H66+100*O66 -> 212.40000000000001 | AK66: 182.2 | AL66: 288 | AM66: 89.4 | AN66: 284 | AO66: 8.199999999999999e-002 | AP66: 10 | AQ66: 乐歌转债!
A67: 108 | B67: 123082 | C67: 北陆转债! | D67: 300016 | E67: 北陆药业 | F67: 医药 | G67: 化学制药 | H67: 117.08 | I67: -4.4000000000000003e-003 | J67: -4.3e-003 | K67: 7.86 | L67: -1.4999999999999999e-002 | M67: 121.7 | N67: 8.81 | O67: 0.312 | P67: 89.22 | Q67: 已到 | R67: 5年10天 | S67: 3年10天 | T67: 4.99 | U67: 3.8 | V67: 6.9999999999999993e-003 | W67: 0.129 | X67: 0.115 | Y67: 39 | Z67: 2.26 | AA67: 7.9000000000000008e-003 | AB67: 5.0000000000000001e-004 | AC67: -3.5099999999999999e-002 | AD67: -3.7699999999999997e-002 | AE67: 83.59 | AF67: 85.87 | AG67: 0.58 | AH67: A+ | AI67: 7.3899999999999993e-002 | AJ67: =H67+100*O67 -> 148.28 | AK67: 144.9 | AL67: 71 | AM67: 59.1 | AN67: 142 | AO67: 3.4000000000000002e-002 | AP67: 17 | AQ67: 北陆转债!
A68: 278 | B68: 113542 | C68: 好客转债! | D68: 603898 | E68: 好莱客 | F68: 其他 | G68: 家居用品 | H68: 111.21 | I68: -1.e-004 | J68: -2.3999999999999998e-003 | K68: 10.94 | L68: -1.7100000000000001e-002 | M68: 114.3 | N68: 16.14 | O68: 0.6409999999999999 | P68: 67.78 | Q68: 已到 | R68: 3.68年 | S68: 1.68年 | T68: 6.03 | U68: 1.2 | V68: 2.e-003 | W68: 0.17699999999999999 | X68: 0.12 | Y68: 34 | Z68: 1.26 | AA68: 7.6e-003 | AB68: 5.9999999999999995e-004 | AC68: -4.2099999999999999e-002 | AD68: -4.4800000000000006e-002 | AE68: 95.66 | AF68: 99.19 | AG68: 0.15 | AH68: AA | AI68: 4.0099999999999997e-002 | AJ68: =H68+100*O68 -> 175.31 | AK68: 154.6 | AL68: 162 | AM68: 55.4 | AN68: 126 | AO68: 1.e-003 | AP68: 16 | AQ68: 好客转债!
A69: 49 | B69: 127033 | C69: 中装转2! | D69: 2822 | E69: 中装建设 | F69: 建筑 | G69: 装饰工程 | H69: 113 | I69: -8.9999999999999998e-004 | J69: -5.9999999999999995e-004 | K69: 5.14 | L69: -3.9000000000000003e-003 | M69: 117.1 | N69: 6.28 | O69: 0.38100000000000001 | P69: 81.85 | Q69: 已到 | R69: 5.38年 | S69: 3.38年 | T69: 11.6 | U69: 8.9 | V69: 6.9999999999999993e-003 | W69: 0.313 | X69: 0.25600000000000001 | Y69: 37 | Z69: 1.06 | AA69: 6.8000000000000005e-003 | AB69: 1.1000000000000001e-003 | AC69: -2.4399999999999998e-002 | AD69: -2.6200000000000001e-002 | AE69: 89.67 | AF69: 94.28 | AG69: 0.39 | AH69: AA | AI69: 4.1900000000000007e-002 | AJ69: =H69+100*O69 -> 151.09999999999999 | AK69: 144.2 | AL69: 62 | AM69: 49.9 | AN69: 90 | AO69: 0. | AP69: 26 | AQ69: 中装转2!
A70: 147 | B70: 128129 | C70: 青农转债! | D70: 2958 | E70: 青农商行 | F70: 金融 | G70: 银行行业 | H70: 108.713 | I70: -1.7000000000000001e-003 | J70: 5.9999999999999995e-004 | K70: 3.84 | L70: -2.5999999999999999e-003 | M70: 112 | N70: 4.32 | O70: 0.223 | P70: 88.89 | Q70: 已到 | R70: 4.74年 | S70: 无权 | T70: 50 | U70: 9.3 | V70: 2.e-003 | W70: 0.23399999999999999 | X70: 0.20800000000000002 | Y70: 213 | Z70: 0.75 | AA70: 6.4000000000000003e-003 | AB70: 1.7000000000000001e-003 | AC70: 无权 | AD70: 无权 | AE70: 无权 | AF70: 96.2 | AG70: 0.43 | AH70: AAA | AI70: 3.3099999999999997e-002 | AJ70: =H70+100*O70 -> 131.01300000000001 | AK70: 128.5 | AL70: 5 | AM70: 32.3 | AN70: 8 | AO70: 5.0000000000000001e-003 | AP70: 24 | AQ70: 青农转债!
A71: 162 | B71: 128124 | C71: 科华转债! | D71: 2022 | E71: 科华生物 | F71: 医药 | G71: 生物制药 | H71: 107 | I71: -2.8000000000000004e-003 | J71: 3.7000000000000002e-003 | K71: 14.31 | L71: 4.1999999999999997e-003 | M71: 110 | N71: 21.3 | O71: 0.59299999999999997 | P71: 67.18 | Q71: 已到 | R71: 4.67年 | S71: 2.67年 | T71: 7.38 | U71: 4.8 | V71: 6.0000000000000001e-003 | W71: 0.10000000000000001 | X71: 6.7000000000000004e-002 | Y71: 74 | Z71: 2.04 | AA71: 6.0000000000000001e-003 | AB71: 2.e-003 | AC71: -1.43e-002 | AD71: -1.61e-002 | AE71: 92 | AF71: 91.85 | AG71: 0.22 | AH71: AA | AI71: 4.0099999999999997e-002 | AJ71: =H71+100*O71 -> 166.30000000000001 | AK71: 146.8 | AL71: 90 | AM71: 54.8 | AN71: 121 | AO71: 1.8000000000000002e-002 | AP71: 25 | AQ71: 科华转债!
A72: 320 | B72: 113524 | C72: 奇精转债! | D72: 603677 | E72: 奇精机械 | F72: 家电 | G72: 零部件制 | H72: 115.33 | I72: -1.1999999999999999e-003 | J72: -1.8e-003 | K72: 11.99 | L72: -8.3000000000000001e-003 | M72: 117.3 | N72: 13.98 | O72: 0.34499999999999997 | P72: 85.77 | Q72: 已到 | R72: 3年17天 | S72: 1年17天 | T72: 3.3 | U72: 6.7 | V72: 1.8000000000000002e-002 | W72: 0.14300000000000002 | X72: 0.12300000000000001 | Y72: 23 | Z72: 2.26 | AA72: 5.6999999999999993e-003 | AB72: -4.3e-003 | AC72: -9.1400000000000009e-002 | AD72: -9.5299999999999996e-002 | AE72: 95.74 | AF72: 98.32 | AG72: 0.37 | AH72: AA- | AI72: 6.1100000000000002e-002 | AJ72: =H72+100*O72 -> 149.82999999999998 | AK72: 144.9 | AL72: 69 | AM72: 46.6 | AN72: 64 | AO72: 5.0999999999999997e-002 | AP72: 41 | AQ72: 奇精转债!
A73: 12 | B73: 113628 | C73: 晨丰转债 | D73: 603685 | E73: 晨丰科技 | F73: 能源电力 | G73: 电力设备 | H73: 118.28 | I73: -1.9400000000000001e-002 | J73: 1.e-003 | K73: 12.14 | L73: -2.6499999999999999e-002 | M73: 121.7 | N73: 13.06 | O73: 0.27200000000000002 | P73: 92.96 | Q73: 3月2天 | R73: 5.74年 | S73: 3.74年 | T73: 4.15 | U73: 11 | V73: 2.2000000000000002e-002 | W73: 0.20199999999999999 | X73: 0.188 | Y73: 21 | Z73: 1.82 | AA73: 5.1000000000000004e-003 | AB73: -1.4000000000000002e-003 | AC73: -3.1300000000000001e-002 | AD73: -3.3399999999999999e-002 | AE73: 76.67 | AF73: 77.5 | AG73: 0.69 | AH73: A | AI73: 8.3900000000000002e-002 | AJ73: =H73+100*O73 -> 145.48000000000002 | AK73: 143.6 | AL73: 57 | AM73: 66.1 | AN73: 194 | AO73: 3.6000000000000004e-002 | AP73: 9 | AQ73: 晨丰转债
A74: 290 | B74: 127013 | C74: 创维转债! | D74: 810 | E74: 创维数字 | F74: 电子 | G74: 电子产品 | H74: 115.36 | I74: -7.4999999999999997e-003 | J74: 2.8000000000000004e-003 | K74: 8.67 | L74: -2.58e-002 | M74: 117.3 | N74: 11.29 | O74: 0.502 | P74: 76.79 | Q74: 已到 | R74: 3.38年 | S74: 1.38年 | T74: 9.78 | U74: 14 | V74: 1.2e-002 | W74: 0.106 | X74: 8.1000000000000003e-002 | Y74: 92 | Z74: 2.18 | AA74: 5.0000000000000001e-003 | AB74: -4.0000000000000001e-003 | AC74: -7.2400000000000006e-002 | AD74: -7.5499999999999998e-002 | AE74: 96.78 | AF74: 102.98 | AG74: 0.18 | AH74: AA | AI74: 4.0099999999999997e-002 | AJ74: =H74+100*O74 -> 165.56 | AK74: 153.9 | AL74: 156 | AM74: 50.9 | AN74: 95 | AO74: 4.4999999999999998e-002 | AP74: 25 | AQ74: 创维转债!
A75: 51 | B75: 127032 | C75: 苏行转债 | D75: 2966 | E75: 苏州银行 | F75: 金融 | G75: 银行行业 | H75: 112.367 | I75: 2.0000000000000001e-004 | J75: -1.8e-003 | K75: 6.74 | L75: -4.4000000000000003e-003 | M75: 115.1 | N75: 8.1 | O75: 0.34999999999999998 | P75: 83.21 | Q75: 已到 | R75: 5.37年 | S75: 无权 | T75: 50 | U75: 32 | V75: 6.0000000000000001e-003 | W75: 0.223 | X75: 0.185 | Y75: 225 | Z75: 0.71 | AA75: 4.5999999999999999e-003 | AB75: -5.0000000000000001e-004 | AC75: 无权 | AD75: 无权 | AE75: 无权 | AF75: 96.04 | AG75: 0.37 | AH75: AAA | AI75: 3.49e-002 | AJ75: =H75+100*O75 -> 147.36700000000002 | AK75: 141.5 | AL75: 40 | AM75: 45.5 | AN75: 51 | AO75: -9.0000000000000011e-003 | AP75: 9 | AQ75: 苏行转债
A76: 111 | B76: 113610 | C76: 灵康转债 | D76: 603669 | E76: 灵康药业 | F76: 医药 | G76: 化学制药 | H76: 118.49 | I76: 8.0000000000000004e-004 | J76: -2.3e-003 | K76: 8.49 | L76: -2.3999999999999998e-003 | M76: 121.1 | N76: 8.61 | O76: 0.20199999999999999 | P76: 98.61 | Q76: 已到 | R76: 5年4.1天 | S76: 3年4.1天 | T76: 4.58 | U76: 8.6 | V76: 1.6e-002 | W76: 7.4999999999999997e-002 | X76: 7.400000000000001e-002 | Y76: 61 | Z76: 4.45 | AA76: 4.5000000000000005e-003 | AB76: -2.8000000000000004e-003 | AC76: -4.0599999999999997e-002 | AD76: -4.2900000000000001e-002 | AE76: 85.9 | AF76: 89.86 | AG76: 0.6 | AH76: AA- | AI76: 6.2899999999999998e-002 | AJ76: =H76+100*O76 -> 138.69 | AK76: 138.4 | AL76: 27 | AM76: 48.5 | AN76: 79 | AO76: 3.7999999999999999e-002 | AP76: 28 | AQ76: 灵康转债
A77: 356 | B77: 123004 | C77: 铁汉转债! | D77: 300197 | E77: 节能铁汉 | F77: 城市公用 | G77: 生态环境 | H77: 107.849 | I77: -1.2999999999999999e-003 | J77: 2.e-003 | K77: 2.86 | L77: 6.9999999999999993e-003 | M77: 108.8 | N77: 3.82 | O77: 0.441 | P77: 74.87 | Q77: 已到 | R77: 2年21天 | S77: 21天 | T77: 8.03 | U77: 11 | V77: 1.2e-002 | W77: 9.9000000000000005e-002 | X77: 7.400000000000001e-002 | Y77: 81 | Z77: 1.26 | AA77: 4.4000000000000003e-003 | AB77: -3.7000000000000002e-003 | AC77: -0.28600000000000003 | AD77: -0.29999999999999999 | AE77: 100.69 | AF77: 100.75 | AG77: 0.1 | AH77: AA | AI77: 3.8800000000000001e-002 | AJ77: =H77+100*O77 -> 151.94900000000001 | AK77: 140.8 | AL77: 33 | AM77: 40.1 | AN77: 30 | AO77: 2.e-002 | AP77: 48 | AQ77: 铁汉转债!
A78: 175 | B78: 128120 | C78: 联诚转债! | D78: 2921 | E78: 联诚精密 | F78: 汽车 | G78: 零部件制 | H78: 115.7 | I78: -2.5999999999999999e-003 | J78: -2.2000000000000001e-003 | K78: 15.75 | L78: -8.199999999999999e-003 | M78: 117.9 | N78: 18.44 | O78: 0.35499999999999998 | P78: 85.41 | Q78: 已到 | R78: 4.64年 | S78: 2.64年 | T78: 2.6 | U78: 1.8 | V78: 6.0000000000000001e-003 | W78: 0.156 | X78: 0.13300000000000001 | Y78: 17 | Z78: 2.09 | AA78: 4.1999999999999997e-003 | AB78: -2.5999999999999999e-003 | AC78: -3.7400000000000003e-002 | AD78: -4.0099999999999997e-002 | AE78: 83.62 | AF78: 82.52 | AG78: 0.58 | AH78: A | AI78: 8.2100000000000006e-002 | AJ78: =H78+100*O78 -> 151.19999999999999 | AK78: 146 | AL78: 82 | AM78: 62.4 | AN78: 165 | AO78: 3.9e-002 | AP78: 22 | AQ78: 联诚转债!
A79: 344 | B79: 128037 | C79: 岩土转债! | D79: 2542 | E79: 中化岩土 | F79: 建筑 | G79: 建筑工程 | H79: 110.323 | I79: -1.06e-002 | J79: 7.4999999999999997e-003 | K79: 2.71 | L79: -1.09e-002 | M79: 111.3 | N79: 3.1 | O79: 0.26200000000000001 | P79: 87.42 | Q79: 已到 | R79: 2.30年 | S79: 0.30年 | T79: 5.99 | U79: 14 | V79: 2.2000000000000002e-002 | W79: 0.122 | X79: 0.107 | Y79: 49 | Z79: 1.23 | AA79: 3.9000000000000003e-003 | AB79: -5.1999999999999998e-003 | AC79: -0.17899999999999999 | AD79: -0.18600000000000003 | AE79: 100.03 | AF79: 102.16 | AG79: 0.28 | AH79: AA | AI79: 3.8800000000000001e-002 | AJ79: =H79+100*O79 -> 136.523 | AK79: 133.2 | AL79: 11 | AM79: 31.1 | AN79: 5 | AO79: 1.e-003 | AP79: 52 | AQ79: 岩土转债!
A80: 247 | B80: 123039 | C80: 开润转债! | D80: 300577 | E80: 开润股份 | F80: 服装纺织 | G80: 纺织行业 | H80: 119.228 | I80: 8.6e-003 | J80: -1.7100000000000001e-002 | K80: 23.37 | L80: -2.2200000000000001e-002 | M80: 121 | N80: 29.92 | O80: 0.52600000000000002 | P80: 78.11 | Q80: 已到 | R80: 4年29天 | S80: 2年29天 | T80: 2.22 | U80: 23 | V80: 8.5999999999999993e-002 | W80: 4.0000000000000001e-002 | X80: 3.1e-002 | Y80: 56 | Z80: 3.48 | AA80: 3.7000000000000002e-003 | AB80: -5.1000000000000004e-003 | AC80: -5.9400000000000001e-002 | AD80: -6.2600000000000003e-002 | AE80: 89.22 | AF80: 91.79 | AG80: 0.38 | AH80: A+ | AI80: 7.2099999999999997e-002 | AJ80: =H80+100*O80 -> 171.828 | AK80: 160.3 | AL80: 194 | AM80: 68.6 | AN80: 208 | AO80: 3.5000000000000003e-002 | AP80: 23 | AQ80: 开润转债!
A81: 353 | B81: 113017 | C81: 吉视转债! | D81: 601929 | E81: 吉视传媒 | F81: 传媒娱乐 | G81: 影视娱乐 | H81: 108.05 | I81: 0. | J81: -5.9999999999999995e-004 | K81: 1.92 | L81: -1.54e-002 | M81: 108.8 | N81: 2.95 | O81: 0.66000000000000003 | P81: 65.08 | Q81: 已到 | R81: 2年30天 | S81: 30天 | T81: 15.6 | U81: 10 | V81: 6.0000000000000001e-003 | W81: 0.26100000000000001 | X81: 0.17000000000000001 | Y81: 60 | Z81: 0.9 | AA81: 3.4000000000000002e-003 | AB81: -4.5999999999999999e-003 | AC81: -0.26500000000000001 | AD81: -0.27699999999999997 | AE81: 100.72 | AF81: 101.65 | AG81: 0.04 | AH81: AA+ | AI81: 3.3799999999999997e-002 | AJ81: =H81+100*O81 -> 174.05000000000001 | AK81: 151 | AL81: 133 | AM81: 49.4 | AN81: 86 | AO81: 6.9999999999999993e-003 | AP81: 67 | AQ81: 吉视转债!
A82: 145 | B82: 123064 | C82: 万孚转债! | D82: 300482 | E82: 万孚生物 | F82: 医药 | G82: 医疗器械 | H82: 112.987 | I82: -2.8999999999999998e-003 | J82: 1.2999999999999999e-003 | K82: 37.71 | L82: -2.2599999999999999e-002 | M82: 114.8 | N82: 71.65 | O82: 1.1499999999999999 | P82: 52.63 | Q82: 已到 | R82: 4.76年 | S82: 2.76年 | T82: 5.99 | U82: 26 | V82: 3.7999999999999999e-002 | W82: 3.6000000000000004e-002 | X82: 1.9e-002 | Y82: 168 | Z82: 5.23 | AA82: 3.4000000000000002e-003 | AB82: -2.2000000000000001e-003 | AC82: -3.0299999999999997e-002 | AD82: -3.2400000000000005e-002 | AE82: 92.15 | AF82: 95.53 | AG82: 0.07 | AH82: AA | AI82: 4.0099999999999997e-002 | AJ82: =H82+100*O82 -> 227.98699999999997 | AK82: 173.3 | AL82: 266 | AM82: 77.8 | AN82: 254 | AO82: 5.7000000000000002e-002 | AP82: 11 | AQ82: 万孚转债!
A83: 112 | B83: 128139 | C83: 祥鑫转债! | D83: 2965 | E83: 祥鑫科技 | F83: 汽车 | G83: 零部件制 | H83: 119 | I83: -3.2000000000000002e-003 | J83: 1.9e-003 | K83: 28.38 | L83: -3.4999999999999996e-003 | M83: 121 | N83: 36.96 | O83: 0.55000000000000004 | P83: 76.79 | Q83: 已到 | R83: 5年4.1天 | S83: 3年4.1天 | T83: 6.47 | U83: 16 | V83: 2.e-002 | W83: 0.151 | X83: 0.11599999999999999 | Y83: 43 | Z83: 2.45 | AA83: 3.4000000000000002e-003 | AB83: -3.8e-003 | AC83: -4.2199999999999994e-002 | AD83: -4.4400000000000002e-002 | AE83: 85.81 | AF83: 89.76 | AG83: 0.4 | AH83: AA- | AI83: 6.2899999999999998e-002 | AJ83: =H83+100*O83 -> 174. | AK83: 161.2 | AL83: 199 | AM83: 71.4 | AN83: 224 | AO83: 8.1000000000000003e-002 | AP83: 14 | AQ83: 祥鑫转债!
A84: 338 | B84: 123010 | C84: 博世转债! | D84: 300422 | E84: 博世科 | F84: 城市公用 | G84: 三废处理 | H84: 110.502 | I84: 1.6000000000000001e-003 | J84: 5.0000000000000001e-004 | K84: 8.75 | L84: 8.1000000000000013e-003 | M84: 111.3 | N84: 11.26 | O84: 0.42200000000000004 | P84: 77.71 | Q84: 已到 | R84: 2.60年 | S84: 0.60年 | T84: 4.3 | U84: 10 | V84: 2.1000000000000001e-002 | W84: 9.6999999999999989e-002 | X84: 7.5999999999999998e-002 | Y84: 44 | Z84: 1.37 | AA84: 2.8000000000000004e-003 | AB84: -5.1999999999999998e-003 | AC84: -0.106 | AD84: -0.11 | AE84: 97.36 | AF84: 95.93 | AG84: 0.26 | AH84: AA- | AI84: 5.9800000000000006e-002 | AJ84: =H84+100*O84 -> 152.702 | AK84: 143.3 | AL84: 53 | AM84: 45.9 | AN84: 56 | AO84: 3.6000000000000004e-002 | AP84: 31 | AQ84: 博世转债!
A85: 219 | B85: 113574 | C85: 华体转债! | D85: 603679 | E85: 华体科技 | F85: 城市公用 | G85: 城市公用 | H85: 114.72 | I85: 1.e-004 | J85: 0. | K85: 14.37 | L85: 6.9999999999999993e-003 | M85: 115.9 | N85: 33.91 | O85: 1.71 | P85: 42.38 | Q85: 已到 | R85: 4.34年 | S85: 2.34年 | T85: 2.09 | U85: 5.3 | V85: 2.2000000000000002e-002 | W85: 0.10199999999999999 | X85: 4.2999999999999997e-002 | Y85: 20 | Z85: 2.72 | AA85: 2.3999999999999998e-003 | AB85: -4.0999999999999995e-003 | AC85: -3.85e-002 | AD85: -4.1500000000000002e-002 | AE85: 87.59 | AF85: 86.36 | AG85: 0.02 | AH85: A+ | AI85: 7.2099999999999997e-002 | AJ85: =H85+100*O85 -> 285.72000000000003 | AK85: 187.1 | AL85: 294 | AM85: 99.5 | AN85: 303 | AO85: 5.5e-002 | AP85: 21 | AQ85: 华体转债!
A86: 158 | B86: 113598 | C86: 法兰转债 | D86: 603966 | E86: 法兰泰克 | F86: 机械装备 | G86: 工程机械 | H86: 119.51 | I86: -6.8999999999999999e-003 | J86: -6.8000000000000005e-003 | K86: 8.92 | L86: -2.6200000000000001e-002 | M86: 120.8 | N86: 9.7 | O86: 0.29999999999999999 | P86: 91.96 | Q86: 已到 | R86: 4.67年 | S86: 2.67年 | T86: 2.75 | U86: 4.4 | V86: 1.3000000000000001e-002 | W86: 0.10300000000000001 | X86: 9.5000000000000001e-002 | Y86: 27 | Z86: 2.14 | AA86: 2.3e-003 | AB86: -5.3e-003 | AC86: -4.9100000000000005e-002 | AD86: -5.1399999999999994e-002 | AE86: 87.79 | AF86: 92.12 | AG86: 0.52 | AH86: AA- | AI86: 6.1100000000000002e-002 | AJ86: =H86+100*O86 -> 149.50999999999999 | AK86: 147.1 | AL86: 95 | AM86: 54.9 | AN86: 122 | AO86: 1.4999999999999999e-002 | AP86: 13 | AQ86: 法兰转债
A87: 280 | B87: 128070 | C87: 智能转债! | D87: 2877 | E87: 智能自控 | F87: 机械装备 | G87: 通用设备 | H87: 116.05 | I87: -3.0000000000000001e-003 | J87: 8.9999999999999998e-004 | K87: 6.58 | L87: -7.4999999999999997e-003 | M87: 116.8 | N87: 9.47 | O87: 0.67000000000000004 | P87: 69.48 | Q87: 已到 | R87: 3.59年 | S87: 无权 | T87: 2.3 | U87: 28 | V87: 0.106 | W87: 0.105 | X87: 7.2999999999999995e-002 | Y87: 22 | Z87: 2.88 | AA87: 1.8e-003 | AB87: -6.4000000000000003e-003 | AC87: 无权 | AD87: 无权 | AE87: 无权 | AF87: 91.45 | AG87: 0.28 | AH87: A+ | AI87: 7.2099999999999997e-002 | AJ87: =H87+100*O87 -> 183.05000000000001 | AK87: 162.6 | AL87: 214 | AM87: 71.2 | AN87: 222 | AO87: 2.2000000000000002e-002 | AP87: 29 | AQ87: 智能转债!
A88: 251 | B88: 128087 | C88: 孚日转债! | D88: 2083 | E88: 孚日股份 | F88: 服装纺织 | G88: 家纺 | H88: 112.288 | I88: -7.000000000000001e-004 | J88: 7.000000000000001e-004 | K88: 4.25 | L88: 0. | M88: 112.9 | N88: 4.5 | O88: 0.18899999999999997 | P88: 94.44 | Q88: 已到 | R88: 4年20天 | S88: 2年20天 | T88: 6.5 | U88: 11 | V88: 1.4999999999999999e-002 | W88: 0.16800000000000001 | X88: 0.159 | Y88: 39 | Z88: 1.03 | AA88: 1.4000000000000002e-003 | AB88: -4.4000000000000003e-003 | AC88: -3.6900000000000002e-002 | AD88: -3.9699999999999999e-002 | AE88: 90.78 | AF88: 89.28 | AG88: 0.58 | AH88: AA- | AI88: 6.1100000000000002e-002 | AJ88: =H88+100*O88 -> 131.18799999999999 | AK88: 130.1 | AL88: 7 | AM88: 39.3 | AN88: 27 | AO88: 2.3e-002 | AP88: 75 | AQ88: 孚日转债!
A89: 2 | B89: 123128 | C89: 首华转债! | D89: 300483 | E89: 首华燃气 | F89: 石油天然 | G89: 天然气 | H89: 114.15 | I89: 8.3999999999999995e-003 | J89: 2.5999999999999999e-003 | K89: 19.45 | L89: 2.7999999999999997e-002 | M89: 115.1 | N89: 25.02 | O89: 0.46799999999999997 | P89: 77.74 | Q89: 5月9天 | R89: 5.93年 | S89: 3.93年 | T89: 13.8 | U89: 245 | V89: 0.154 | W89: 0.26400000000000001 | X89: 0.20499999999999999 | Y89: 52 | Z89: 1.86 | AA89: 1.4000000000000002e-003 | AB89: -3.0999999999999999e-003 | AC89: -2.3599999999999999e-002 | AD89: -2.52e-002 | AE89: 87.69 | AF89: 90.62 | AG89: 0.39 | AH89: AA | AI89: 4.1900000000000007e-002 | AJ89: =H89+100*O89 -> 160.94999999999999 | AK89: 150.6 | AL89: 128 | AM89: 59.9 | AN89: 147 | AO89: 1.1000000000000001e-002 | AP89: 4 | AQ89: 首华转债!
A90: 119 | B90: 113608 | C90: 威派转债! | D90: 603956 | E90: 威派格 | F90: 机械装备 | G90: 专用设备 | H90: 120.54 | I90: -3.2000000000000002e-003 | J90: 9.0000000000000011e-003 | K90: 17.12 | L90: 1.e-002 | M90: 121.1 | N90: 19.08 | O90: 0.34299999999999997 | P90: 89.73 | Q90: 已到 | R90: 4.95年 | S90: 2.95年 | T90: 4.2 | U90: 4.6 | V90: 9.0000000000000011e-003 | W90: 5.7999999999999996e-002 | X90: 5.2000000000000005e-002 | Y90: 73 | Z90: 6.16 | AA90: 1.e-003 | AB90: -6.3e-003 | AC90: -4.6300000000000001e-002 | AD90: -4.87e-002 | AE90: 83.97 | AF90: 86.46 | AG90: 0.57 | AH90: A+ | AI90: 7.2099999999999997e-002 | AJ90: =H90+100*O90 -> 154.84 | AK90: 151.4 | AL90: 137 | AM90: 64.9 | AN90: 180 | AO90: 5.0000000000000003e-002 | AP90: 7 | AQ90: 威派转债!
A91: 276 | B91: 128072 | C91: 翔鹭转债! | D91: 2842 | E91: 翔鹭钨业 | F91: 有色金属 | G91: 小金属 | H91: 114.171 | I91: 3.0000000000000001e-003 | J91: 1.1999999999999999e-003 | K91: 10.01 | L91: 1.9299999999999998e-002 | M91: 114.5 | N91: 15.19 | O91: 0.73299999999999998 | P91: 65.9 | Q91: 已到 | R91: 3.73年 | S91: 1.73年 | T91: 3.02 | U91: 19 | V91: 5.5999999999999994e-002 | W91: 0.109 | X91: 7.2000000000000008e-002 | Y91: 28 | Z91: 2.86 | AA91: 8.0000000000000004e-004 | AB91: -6.1999999999999998e-003 | AC91: -5.4000000000000006e-002 | AD91: -5.67e-002 | AE91: 91.98 | AF91: 92.19 | AG91: 0.22 | AH91: AA- | AI91: 6.1100000000000002e-002 | AJ91: =H91+100*O91 -> 187.471 | AK91: 162.4 | AL91: 212 | AM91: 70.3 | AN91: 216 | AO91: 7.9000000000000001e-002 | AP91: 27 | AQ91: 翔鹭转债!
A92: 71 | B92: 123101 | C92: 拓斯转债! | D92: 300607 | E92: 拓斯达 | F92: 机械装备 | G92: 机器人及 | H92: 114.7 | I92: -1.1999999999999999e-003 | J92: 4.3e-003 | K92: 16.37 | L92: 1.7399999999999999e-002 | M92: 115.1 | N92: 26.18 | O92: 0.83400000000000007 | P92: 62.53 | Q92: 已到 | R92: 5.28年 | S92: 3.28年 | T92: 6.7 | U92: 4.5 | V92: 6.0000000000000001e-003 | W92: 9.6000000000000002e-002 | X92: 5.9999999999999998e-002 | Y92: 70 | Z92: 3.16 | AA92: 7.000000000000001e-004 | AB92: -4.4000000000000003e-003 | AC92: -2.9300000000000003e-002 | AD92: -3.1200000000000002e-002 | AE92: 90.05 | AF92: 93.06 | AG92: 0.18 | AH92: AA | AI92: 4.1900000000000007e-002 | AJ92: =H92+100*O92 -> 198.10000000000002 | AK92: 166.9 | AL92: 246 | AM92: 73.8 | AN92: 237 | AO92: 3.2000000000000001e-002 | AP92: 9 | AQ92: 拓斯转债!
A93: 130 | B93: 113605 | C93: 大参转债! | D93: 603233 | E93: 大参林 | F93: 医药 | G93: 医药商业 | H93: 114.69 | I93: -2.3e-003 | J93: 1.2999999999999999e-003 | K93: 35.95 | L93: -1.5900000000000001e-002 | M93: 114.9 | N93: 69.09 | O93: 1.2 | P93: 52.03 | Q93: 已到 | R93: 4.90年 | S93: 2.90年 | T93: 14 | U93: 1.9 | V93: 1.e-003 | W93: 4.9000000000000002e-002 | X93: 2.6000000000000002e-002 | Y93: 284 | Z93: 5.34 | AA93: 4.0000000000000002e-004 | AB93: -5.0000000000000001e-003 | AC93: -3.3399999999999999e-002 | AD93: -3.5499999999999997e-002 | AE93: 91.74 | AF93: 95.11 | AG93: 0.06 | AH93: AA | AI93: 4.0099999999999997e-002 | AJ93: =H93+100*O93 -> 234.69 | AK93: 177.3 | AL93: 277 | AM93: 82.2 | AN93: 271 | AO93: -4.2000000000000003e-002 | AP93: 7 | AQ93: 大参转债!
A94: 161 | B94: 123063 | C94: 大禹转债 | D94: 300021 | E94: 大禹节水 | F94: 化工 | G94: 橡胶塑料 | H94: 126.1 | I94: 0. | J94: 2.3999999999999998e-003 | K94: 5.32 | L94: 3.8e-003 | M94: 126.1 | N94: 4.83 | O94: 0.14499999999999999 | P94: 110.14 | Q94: 已到 | R94: 4.67年 | S94: 3.67年 | T94: 6.35 | U94: 7.8 | V94: 1.e-002 | W94: 0.14899999999999999 | X94: 0.16399999999999998 | Y94: 43 | Z94: 2.86 | AA94: 0. | AB94: -9.1999999999999998e-003 | AC94: -4.3499999999999997e-002 | AD94: -4.6500000000000007e-002 | AE94: 85.27 | AF94: 96.2 | AG94: 0.63 | AH94: AA- | AI94: 6.1100000000000002e-002 | AJ94: =H94+100*O94 -> 140.59999999999999 | AK94: 142.1 | AL94: 44 | AM94: 45.9 | AN94: 54 | AO94: 2.4e-002 | AP94: 20 | AQ94: 大禹转债
A95: 124 | B95: 110076 | C95: 华海转债! | D95: 600521 | E95: 华海药业 | F95: 医药 | G95: 医药行业 | H95: 115.24 | I95: 1.1200000000000002e-002 | J95: -1.0800000000000001e-002 | K95: 20.37 | L95: 3.0000000000000001e-003 | M95: 114.8 | N95: 33.85 | O95: 0.91500000000000004 | P95: 60.18 | Q95: 已到 | R95: 4.93年 | S95: 2.93年 | T95: 18.4 | U95: 25 | V95: 1.2e-002 | W95: 6.0999999999999999e-002 | X95: 3.6000000000000004e-002 | Y95: 304 | Z95: 4.63 | AA95: -8.0000000000000004e-004 | AB95: -6.0999999999999995e-003 | AC95: -3.49e-002 | AD95: -3.6900000000000002e-002 | AE95: 91.54 | AF95: 94.9 | AG95: 0.13 | AH95: AA | AI95: 4.0099999999999997e-002 | AJ95: =H95+100*O95 -> 206.74000000000001 | AK95: 170.3 | AL95: 257 | AM95: 75.4 | AN95: 243 | AO95: -2.e-002 | AP95: 8 | AQ95: 华海转债!
A96: 140 | B96: 128133 | C96: 奇正转债! | D96: 2287 | E96: 奇正藏药 | F96: 医药 | G96: 中药 | H96: 117.567 | I96: -6.9999999999999993e-003 | J96: -3.8e-003 | K96: 27.28 | L96: -2.3599999999999999e-002 | M96: 116.9 | N96: 29.78 | O96: 0.28300000000000003 | P96: 91.61 | Q96: 已到 | R96: 4.82年 | S96: 2.82年 | T96: 8 | U96: 12 | V96: 1.3000000000000001e-002 | W96: 5.5e-002 | X96: 5.0999999999999997e-002 | Y96: 145 | Z96: 4.89 | AA96: -1.1999999999999999e-003 | AB96: -7.4000000000000003e-003 | AC96: -4.24e-002 | AD96: -4.4400000000000002e-002 | AE96: 92.04 | AF96: 97.07 | AG96: 0.46 | AH96: AA | AI96: 4.0099999999999997e-002 | AJ96: =H96+100*O96 -> 145.86699999999999 | AK96: 143.5 | AL96: 56 | AM96: 46.5 | AN96: 60 | AO96: 4.4999999999999998e-002 | AP96: 19 | AQ96: 奇正转债!
A97: 48 | B97: 123113 | C97: 仙乐转债! | D97: 300791 | E97: 仙乐健康 | F97: 食品饮料 | G97: 食品饮料 | H97: 119.42 | I97: -5.4000000000000003e-003 | J97: -1.1299999999999999e-002 | K97: 44.02 | L97: -3.7200000000000004e-002 | M97: 118.5 | N97: 56.88 | O97: 0.54299999999999993 | P97: 77.39 | Q97: 已到 | R97: 5.39年 | S97: 3.39年 | T97: 10.2 | U97: 9.6 | V97: 8.0000000000000002e-003 | W97: 0.129 | X97: 0.10000000000000001 | Y97: 79 | Z97: 3.42 | AA97: -1.5e-003 | AB97: -7.4000000000000003e-003 | AC97: -3.8900000000000004e-002 | AD97: -4.0800000000000003e-002 | AE97: 83.77 | AF97: 85.88 | AG97: 0.45 | AH97: AA- | AI97: 6.2899999999999998e-002 | AJ97: =H97+100*O97 -> 173.72 | AK97: 161.4 | AL97: 205 | AM97: 75.6 | AN97: 245 | AO97: -3.4000000000000002e-002 | AP97: 4 | AQ97: 仙乐转债!
A98: 313 | B98: 128056 | C98: 今飞转债! | D98: 2863 | E98: 今飞凯达 | F98: 汽车 | G98: 零部件制 | H98: 121 | I98: 2.5999999999999999e-003 | J98: -7.4000000000000003e-003 | K98: 5.74 | L98: -1.2e-002 | M98: 120.2 | N98: 6.69 | O98: 0.40999999999999998 | P98: 85.8 | Q98: 已到 | R98: 3.26年 | S98: 1.26年 | T98: 1.72 | U98: 11 | V98: 5.2000000000000005e-002 | W98: 5.9999999999999998e-002 | X98: 5.2000000000000005e-002 | Y98: 29 | Z98: 1.51 | AA98: -2.0999999999999999e-003 | AB98: -1.2699999999999999e-002 | AC98: -0.106 | AD98: -0.10099999999999999 | AE98: 93.74 | AF98: 96.37 | AG98: 0.4 | AH98: A+ | AI98: 7.2099999999999997e-002 | AJ98: =H98+100*O98 -> 162. | AK98: 156.2 | AL98: 170 | AM98: 59.8 | AN98: 146 | AO98: 4.2999999999999997e-002 | AP98: 48 | AQ98: 今飞转债!
A99: 69 | B99: 123104 | C99: 卫宁转债! | D99: 300253 | E99: 卫宁健康 | F99: 计算机及 | G99: 软件开发 | H99: 126.5 | I99: -8.0000000000000004e-004 | J99: -4.0000000000000002e-004 | K99: 14.92 | L99: -3.3e-003 | M99: 125.1 | N99: 17.74 | O99: 0.504 | P99: 84.1 | Q99: 已到 | R99: 5.30年 | S99: 3.30年 | T99: 9.7 | U99: 1.8 | V99: 1.e-003 | W99: 2.9999999999999999e-002 | X99: 2.6000000000000002e-002 | Y99: 320 | Z99: 6.68 | AA99: -2.0999999999999999e-003 | AB99: -9.8999999999999991e-003 | AC99: -5.6399999999999999e-002 | AD99: -5.8299999999999998e-002 | AE99: 89.99 | AF99: 101.04 | AG99: 0.34 | AH99: AA | AI99: 4.1900000000000007e-002 | AJ99: =H99+100*O99 -> 176.90000000000001 | AK99: 168.9 | AL99: 255 | AM99: 67.9 | AN99: 202 | AO99: 6.8000000000000005e-002 | AP99: 5 | AQ99: 卫宁转债!
A100: 303 | B100: 123023 | C100: 迪森转债! | D100: 300335 | E100: 迪森股份 | F100: 能源电力 | G100: 电力供应 | H100: 115.155 | I100: 6.1999999999999998e-003 | J100: -2.7000000000000001e-003 | K100: 5.82 | L100: 8.6999999999999994e-003 | M100: 114.3 | N100: 6.89 | O100: 0.36299999999999999 | P100: 84.47 | Q100: 已到 | R100: 3.31年 | S100: 2.31年 | T100: 5.29 | U100: 52 | V100: 8.5000000000000006e-002 | W100: 0.24399999999999999 | X100: 0.20600000000000002 | Y100: 22 | Z100: 1.6 | AA100: -2.3e-003 | AB100: -1.e-002 | AC100: -3.85e-002 | AD100: -4.1900000000000007e-002 | AE100: 90.56 | AF100: 94.33 | AG100: 0.4 | AH100: AA- | AI100: 6.1100000000000002e-002 | AJ100: =H100+100*O100 -> 151.45499999999998 | AK100: 145.8 | AL100: 78 | AM100: 51.5 | AN100: 100 | AO100: 5.0999999999999997e-002 | AP100: 50 | AQ100: 迪森转债!
A101: 307 | B101: 110053 | C101: 苏银转债! | D101: 600919 | E101: 江苏银行 | F101: 金融 | G101: 银行行业 | H101: 119.35 | I101: -4.7999999999999996e-003 | J101: 5.0000000000000001e-004 | K101: 5.94 | L101: -1.1599999999999999e-002 | M101: 118.3 | N101: 6.37 | O101: 0.28000000000000003 | P101: 93.25 | Q101: 已到 | R101: 3.29年 | S101: 无权 | T101: 200 | U101: 72 | V101: 3.0000000000000001e-003 | W101: 0.22800000000000001 | X101: 0.21299999999999999 | Y101: 877 | Z101: 0.6 | AA101: -2.8000000000000004e-003 | AB101: -1.2500000000000001e-002 | AC101: 无权 | AD101: 无权 | AE101: 无权 | AF101: 106.65 | AG101: 0.38 | AH101: AAA | AI101: 3.3099999999999997e-002 | AJ101: =H101+100*O101 -> 147.34999999999999 | AK101: 145.5 | AL101: 75 | AM101: 38.8 | AN101: 24 | AO101: -5.0000000000000003e-002 | AP101: 34 | AQ101: 苏银转债!
A102: 351 | B102: 128034 | C102: 江银转债! | D102: 2807 | E102: 江阴银行 | F102: 金融 | G102: 银行行业 | H102: 108.964 | I102: 2.8999999999999998e-003 | J102: -3.5999999999999999e-003 | K102: 3.77 | L102: -2.5999999999999999e-003 | M102: 108.3 | N102: 4.32 | O102: 0.249 | P102: 87.27 | Q102: 已到 | R102: 2.16年 | S102: 无权 | T102: 17.6 | U102: 7 | V102: 4.0000000000000001e-003 | W102: 0.215 | X102: 0.187 | Y102: 82 | Z102: 0.68 | AA102: -2.8999999999999998e-003 | AB102: -1.e-002 | AC102: 无权 | AD102: 无权 | AE102: 无权 | AF102: 100.89 | AG102: 0.29 | AH102: AA+ | AI102: 3.3799999999999997e-002 | AJ102: =H102+100*O102 -> 133.864 | AK102: 130.7 | AL102: 8 | AM102: 29.8 | AN102: 2 | AO102: 2.e-003 | AP102: 28 | AQ102: 江银转债!
A103: 244 | B103: 113561 | C103: 正裕转债! | D103: 603089 | E103: 正裕工业 | F103: 汽车 | G103: 零部件制 | H103: 119.36 | I103: -5.0000000000000001e-004 | J103: -7.000000000000001e-004 | K103: 8.72 | L103: -2.3e-003 | M103: 118 | N103: 10.08 | O103: 0.38 | P103: 86.51 | Q103: 已到 | R103: 4年34天 | S103: 2年34天 | T103: 1.5 | U103: 3.7 | V103: 2.e-002 | W103: 7.6999999999999999e-002 | X103: 6.7000000000000004e-002 | Y103: 19 | Z103: 1.87 | AA103: -2.8999999999999998e-003 | AB103: -1.0500000000000001e-002 | AC103: -5.9299999999999999e-002 | AD103: -6.25e-002 | AE103: 89.22 | AF103: 89.46 | AG103: 0.51 | AH103: A+ | AI103: 7.2099999999999997e-002 | AJ103: =H103+100*O103 -> 157.36000000000001 | AK103: 152.2 | AL103: 145 | AM103: 62.7 | AN103: 168 | AO103: 4.2999999999999997e-002 | AP103: 34 | AQ103: 正裕转债!
A104: 277 | B104: 128071 | C104: 合兴转债! | D104: 2228 | E104: 合兴包装 | F104: 造纸包装 | G104: 包装材料 | H104: 115.79 | I104: 1.0800000000000001e-002 | J104: -1.0800000000000001e-002 | K104: 3.49 | L104: 0. | M104: 114.3 | N104: 4.18 | O104: 0.38700000000000001 | P104: 83.49 | Q104: 已到 | R104: 3.72年 | S104: 1.72年 | T104: 3 | U104: 7.6 | V104: 2.2000000000000002e-002 | W104: 6.9000000000000006e-002 | X104: 5.7999999999999996e-002 | Y104: 43 | Z104: 1.28 | AA104: -3.4999999999999996e-003 | AB104: -1.04e-002 | AC104: -6.1600000000000002e-002 | AD104: -6.4299999999999996e-002 | AE104: 95.51 | AF104: 99.03 | AG104: 0.33 | AH104: AA | AI104: 4.0099999999999997e-002 | AJ104: =H104+100*O104 -> 154.49000000000001 | AK104: 148.1 | AL104: 106 | AM104: 49.1 | AN104: 82 | AO104: 6.0000000000000001e-003 | AP104: 25 | AQ104: 合兴转债!
A105: 164 | B105: 123062 | C105: 三超转债 | D105: 300554 | E105: 三超新材 | F105: 机械装备 | G105: 通用设备 | H105: 121.1 | I105: 0. | J105: -4.4000000000000003e-003 | K105: 16.19 | L105: -6.7000000000000002e-003 | M105: 119.2 | N105: 17.13 | O105: 0.28100000000000003 | P105: 94.51 | Q105: 已到 | R105: 4.66年 | S105: 2.66年 | T105: 1.95 | U105: 5.8 | V105: 2.5000000000000001e-002 | W105: 0.129 | X105: 0.121 | Y105: 15 | Z105: 2.89 | AA105: -3.4999999999999996e-003 | AB105: -1.0500000000000001e-002 | AC105: -5.2400000000000002e-002 | AD105: -5.5e-002 | AE105: 83.47 | AF105: 83.25 | AG105: 0.65 | AH105: A | AI105: 8.2100000000000006e-002 | AJ105: =H105+100*O105 -> 149.19999999999999 | AK105: 147.7 | AL105: 100 | AM105: 64.2 | AN105: 176 | AO105: 2.8999999999999998e-002 | AP105: 27 | AQ105: 三超转债
A106: 127 | B106: 113606 | C106: 荣泰转债 | D106: 603579 | E106: 荣泰健康 | F106: 机械装备 | G106: 专用设备 | H106: 122.8 | I106: -1.09e-002 | J106: 1.18e-002 | K106: 30.49 | L106: 1.6000000000000001e-003 | M106: 120.7 | N106: 32.83 | O106: 0.32200000000000001 | P106: 92.87 | Q106: 已到 | R106: 4.92年 | S106: 2.92年 | T106: 6 | U106: 7.2 | V106: 1.e-002 | W106: 0.14099999999999999 | X106: 0.13100000000000001 | Y106: 43 | Z106: 2.55 | AA106: -3.5999999999999999e-003 | AB106: -1.0700000000000001e-002 | AC106: -5.3899999999999997e-002 | AD106: -5.5899999999999998e-002 | AE106: 86.41 | AF106: 90.68 | AG106: 0.55 | AH106: AA- | AI106: 6.1100000000000002e-002 | AJ106: =H106+100*O106 -> 155. | AK106: 152.7 | AL106: 146 | AM106: 62.1 | AN106: 164 | AO106: 3.7000000000000005e-002 | AP106: 11 | AQ106: 荣泰转债
A107: 7 | B107: 127047 | C107: N帝欧转 | D107: 2798 | E107: 帝欧家居 | F107: 其他 | G107: 家居用品 | H107: 123.1 | I107: 0.23100000000000001 | J107: 0. | K107: 14.08 | L107: -1.6799999999999999e-002 | M107: 120.4 | N107: 13.53 | O107: 0.183 | P107: 104.07 | Q107: 5月3天 | R107: 5.91年 | S107: 3.91年 | T107: 15 | U107: 1986. | V107: 1.0700000000000001 | W107: 0.27500000000000002 | X107: 0.28699999999999998 | Y107: 54 | Z107: 1.19 | AA107: -3.8e-003 | AB107: -9.7000000000000003e-003 | AC107: -4.1399999999999999e-002 | AD107: -4.2999999999999997e-002 | AE107: 81.06 | AF107: 84.5 | AG107: 0.68 | AH107: AA- | AI107: 6.2899999999999998e-002 | AJ107: =H107+100*O107 -> 141.40000000000001 | AK107: 142.1 | AL107: 46 | AM107: 57.6 | AN107: 134 | AO107: 3.0000000000000001e-003 | AP107: 2 | AQ107: N帝欧转
A108: 169 | B108: 123061 | C108: 航新转债! | D108: 300424 | E108: 航新科技 | F108: 航空航天 | G108: 航空航天 | H108: 126.8 | I108: 1.7000000000000001e-003 | J108: 4.0000000000000002e-004 | K108: 14.8 | L108: 3.4000000000000002e-003 | M108: 124.3 | N108: 14.85 | O108: 0.27200000000000002 | P108: 99.66 | Q108: 已到 | R108: 4.65年 | S108: 2.65年 | T108: 2.5 | U108: 29 | V108: 9.1999999999999998e-002 | W108: 7.0000000000000007e-002 | X108: 7.0000000000000007e-002 | Y108: 36 | Z108: 5.25 | AA108: -4.4000000000000003e-003 | AB108: -1.3000000000000001e-002 | AC108: -6.7900000000000002e-002 | AD108: -7.0499999999999993e-002 | AE108: 85.86 | AF108: 90.64 | AG108: 0.61 | AH108: A+ | AI108: 7.2099999999999997e-002 | AJ108: =H108+100*O108 -> 154. | AK108: 153.9 | AL108: 157 | AM108: 63.3 | AN108: 170 | AO108: 1.6e-002 | AP108: 19 | AQ108: 航新转债!
A109: 324 | B109: 110047 | C109: 山鹰转债 | D109: 600567 | E109: 山鹰国际 | F109: 造纸包装 | G109: 包装用纸 | H109: 118.04 | I109: -3.2000000000000002e-003 | J109: -1.6000000000000001e-003 | K109: 3.18 | L109: -1.24e-002 | M109: 116.5 | N109: 3.3 | O109: 0.22500000000000001 | P109: 96.36 | Q109: 已到 | R109: 2.98年 | S109: 0.98年 | T109: 22.5 | U109: 16 | V109: 6.0000000000000001e-003 | W109: 0.153 | X109: 0.14699999999999999 | Y109: 147 | Z109: 0.91 | AA109: -4.5000000000000005e-003 | AB109: -1.41e-002 | AC109: -0.11699999999999999 | AD109: -0.12 | AE109: 98.02 | AF109: 105.65 | AG109: 0.39 | AH109: AA+ | AI109: 3.3799999999999997e-002 | AJ109: =H109+100*O109 -> 140.54000000000002 | AK109: 139.7 | AL109: 29 | AM109: 34.1 | AN109: 12 | AO109: -2.3e-002 | AP109: 27 | AQ109: 山鹰转债
A110: 210 | B110: 110070 | C110: 凌钢转债! | D110: 600231 | E110: 凌钢股份 | F110: 钢铁 | G110: 炼钢 | H110: 119.68 | I110: 4.5000000000000005e-003 | J110: -8.0000000000000004e-004 | K110: 2.58 | L110: 7.8000000000000005e-003 | M110: 117.4 | N110: 2.69 | O110: 0.248 | P110: 95.91 | Q110: 已到 | R110: 4.38年 | S110: 2.38年 | T110: 2.17 | U110: 29 | V110: 0.11 | W110: 2.9999999999999999e-002 | X110: 2.7999999999999997e-002 | Y110: 74 | Z110: 0.78 | AA110: -4.5000000000000005e-003 | AB110: -1.1399999999999999e-002 | AC110: -5.5199999999999999e-002 | AD110: -5.7800000000000004e-002 | AE110: 93.97 | AF110: 99.24 | AG110: 0.48 | AH110: AA | AI110: 4.0099999999999997e-002 | AJ110: =H110+100*O110 -> 144.48000000000002 | AK110: 143.4 | AL110: 54 | AM110: 44.2 | AN110: 42 | AO110: 1.2e-002 | AP110: 23 | AQ110: 凌钢转债!
A111: 103 | B111: 127027 | C111: 靖远转债! | D111: 552 | E111: 靖远煤电 | F111: 煤炭 | G111: 煤炭开采 | H111: 117.998 | I111: -1.7899999999999999e-002 | J111: 8.199999999999999e-003 | K111: 2.93 | L111: -2.0099999999999996e-002 | M111: 115.3 | N111: 3.13 | O111: 0.26100000000000001 | P111: 93.61 | Q111: 已到 | R111: 5年13天 | S111: 3年13天 | T111: 24.3 | U111: 41 | V111: 1.3999999999999999e-002 | W111: 0.35299999999999998 | X111: 0.33000000000000002 | Y111: 69 | Z111: 0.83 | AA111: -4.6999999999999993e-003 | AB111: -1.01e-002 | AC111: -3.9599999999999996e-002 | AD111: -4.1799999999999997e-002 | AE111: 92.56 | AF111: 96.46 | AG111: 0.48 | AH111: AA+ | AI111: 3.6900000000000002e-002 | AJ111: =H111+100*O111 -> 144.09800000000001 | AK111: 142.4 | AL111: 47 | AM111: 45.9 | AN111: 55 | AO111: -2.4e-002 | AP111: 40 | AQ111: 靖远转债!
A112: 32 | B112: 123117 | C112: 健帆转债! | D112: 300529 | E112: 健帆生物 | F112: 医药 | G112: 医疗器械 | H112: 118.39 | I112: 1.2e-002 | J112: -1.0700000000000001e-002 | K112: 54.53 | L112: 7.9000000000000008e-003 | M112: 115.1 | N112: 90.57 | O112: 0.96599999999999997 | P112: 60.21 | Q112: 32天 | R112: 5.57年 | S112: 3.57年 | T112: 10 | U112: 18 | V112: 1.4999999999999999e-002 | W112: 2.3e-002 | X112: 1.3999999999999999e-002 | Y112: 439 | Z112: 14.4 | AA112: -5.1000000000000004e-003 | AB112: -9.8999999999999991e-003 | AC112: -3.5299999999999998e-002 | AD112: -3.7100000000000001e-002 | AE112: 88.99 | AF112: 91.97 | AG112: 0.16 | AH112: AA | AI112: 4.1900000000000007e-002 | AJ112: =H112+100*O112 -> 214.99000000000001 | AK112: 176.6 | AL112: 274 | AM112: 84.6 | AN112: 276 | AO112: 4.0999999999999995e-002 | AP112: 6 | AQ112: 健帆转债!
A113: 256 | B113: 110062 | C113: 烽火转债! | D113: 600498 | E113: 烽火通信 | F113: 通信互联 | G113: 通信设备 | H113: 113.2 | I113: -3.2000000000000002e-003 | J113: 1.1000000000000001e-003 | K113: 17.77 | L113: -7.8000000000000005e-003 | M113: 110.8 | N113: 22.85 | O113: 0.45600000000000002 | P113: 77.77 | Q113: 已到 | R113: 4年5.1天 | S113: 2年5.1天 | T113: 30.9 | U113: 20 | V113: 6.0000000000000001e-003 | W113: 0.154 | X113: 0.11900000000000001 | Y113: 201 | Z113: 1.83 | AA113: -5.4000000000000003e-003 | AB113: -1.04e-002 | AC113: -4.1500000000000002e-002 | AD113: -4.4299999999999999e-002 | AE113: 96.3 | AF113: 97.52 | AG113: 0.26 | AH113: AAA | AI113: 3.3099999999999997e-002 | AJ113: =H113+100*O113 -> 158.80000000000001 | AK113: 148.6 | AL113: 109 | AM113: 51.1 | AN113: 98 | AO113: 3.0000000000000001e-003 | AP113: 18 | AQ113: 烽火转债!
A114: 68 | B114: 123105 | C114: 拓尔转债! | D114: 300229 | E114: 拓尔思 | F114: 计算机及 | G114: 软件开发 | H114: 124.49 | I114: 4.0000000000000001e-003 | J114: 4.3e-003 | K114: 9.66 | L114: 1.3600000000000001e-002 | M114: 121 | N114: 9.96 | O114: 0.28399999999999997 | P114: 96.99 | Q114: 已到 | R114: 5.31年 | S114: 3.31年 | T114: 8 | U114: 8 | V114: 8.0000000000000002e-003 | W114: 0.11599999999999999 | X114: 0.11199999999999999 | Y114: 69 | Z114: 3.12 | AA114: -5.5000000000000005e-003 | AB114: -1.21e-002 | AC114: -5.1100000000000007e-002 | AD114: -5.3099999999999994e-002 | AE114: 84.27 | AF114: 88.16 | AG114: 0.61 | AH114: AA- | AI114: 6.2899999999999998e-002 | AJ114: =H114+100*O114 -> 152.88999999999999 | AK114: 152 | AL114: 144 | AM114: 63.8 | AN114: 173 | AO114: 4.4999999999999998e-002 | AP114: 9 | AQ114: 拓尔转债!
A115: 357 | B115: 128026 | C115: 众兴转债! | D115: 2772 | E115: 众兴菌业 | F115: 农业 | G115: 种植业 | H115: 110.55 | I115: -2.3e-003 | J115: 2.3e-003 | K115: 7.76 | L115: -1.2699999999999999e-002 | M115: 109.3 | N115: 11.36 | O115: 0.61799999999999999 | P115: 68.31 | Q115: 已到 | R115: 2年16天 | S115: 16天 | T115: 4.09 | U115: 9.8 | V115: 2.2000000000000002e-002 | W115: 0.128 | X115: 8.6999999999999994e-002 | Y115: 32 | Z115: 1.05 | AA115: -5.6999999999999993e-003 | AB115: -1.41e-002 | AC115: -0.41299999999999998 | AD115: -0.42899999999999999 | AE115: 100.58 | AF115: 97.32 | AG115: 0 | AH115: AA- | AI115: 5.9800000000000006e-002 | AJ115: =H115+100*O115 -> 172.34999999999999 | AK115: 152.8 | AL115: 149 | AM115: 52.2 | AN115: 102 | AO115: -1.8000000000000002e-002 | AP115: 57 | AQ115: 众兴转债!
A116: 110 | B116: 123080 | C116: 海波转债! | D116: 300517 | E116: 海波重科 | F116: 建筑 | G116: 建筑工程 | H116: 130.28 | I116: -9.300000000000001e-003 | J116: -3.8e-003 | K116: 13.6 | L116: -1.8100000000000002e-002 | M116: 126.5 | N116: 11.58 | O116: 0.109 | P116: 117.44 | Q116: 已到 | R116: 5年5.1天 | S116: 3年5.1天 | T116: 2.44 | U116: 22 | V116: 6.9000000000000006e-002 | W116: 9.3000000000000013e-002 | X116: 0.11 | Y116: 26 | Z116: 3.04 | AA116: -6.0000000000000001e-003 | AB116: -1.46e-002 | AC116: -6.7400000000000002e-002 | AD116: -6.9800000000000001e-002 | AE116: 83.73 | AF116: 89.32 | AG116: 0.72 | AH116: A+ | AI116: 7.3899999999999993e-002 | AJ116: =H116+100*O116 -> 141.18000000000001 | AK116: 143.1 | AL116: 49 | AM116: 53.8 | AN116: 114 | AO116: 1.8000000000000002e-002 | AP116: 24 | AQ116: 海波转债!
A117: 87 | B117: 127028 | C117: 英特转债! | D117: 411 | E117: 英特集团 | F117: 医药 | G117: 医药商业 | H117: 116.7 | I117: -2.5999999999999999e-003 | J117: -4.5000000000000005e-003 | K117: 12.97 | L117: -1.29e-002 | M117: 113.1 | N117: 13.4 | O117: 0.20600000000000002 | P117: 96.79 | Q117: 已到 | R117: 5年39天 | S117: 3年39天 | T117: 6 | U117: 14 | V117: 2.1000000000000001e-002 | W117: 0.18600000000000003 | X117: 0.17999999999999999 | Y117: 32 | Z117: 1.82 | AA117: -6.1999999999999998e-003 | AB117: -1.0800000000000001e-002 | AC117: -3.6000000000000004e-002 | AD117: -3.7999999999999999e-002 | AE117: 92.12 | AF117: 94.35 | AG117: 0.55 | AH117: AA+ | AI117: 3.6900000000000002e-002 | AJ117: =H117+100*O117 -> 137.30000000000001 | AK117: 136.6 | AL117: 19 | AM117: 42.3 | AN117: 36 | AO117: 8.0000000000000002e-003 | AP117: 29 | AQ117: 英特转债!
A118: 38 | B118: 123116 | C118: 万兴转债 | D118: 300624 | E118: 万兴科技 | F118: 计算机及 | G118: 软件开发 | H118: 125.68 | I118: -1.1899999999999999e-002 | J118: -1.1699999999999999e-002 | K118: 44.66 | L118: -3.85e-002 | M118: 121.4 | N118: 49.78 | O118: 0.40100000000000002 | P118: 89.71 | Q118: 19天 | R118: 5.53年 | S118: 3.53年 | T118: 3.79 | U118: 39 | V118: 8.1000000000000003e-002 | W118: 6.5000000000000002e-002 | X118: 5.9000000000000004e-002 | Y118: 58 | Z118: 6.97 | AA118: -6.4000000000000003e-003 | AB118: -1.29e-002 | AC118: -4.9599999999999998e-002 | AD118: -5.16e-002 | AE118: 80.38 | AF118: 82.58 | AG118: 0.61 | AH118: A+ | AI118: 7.3899999999999993e-002 | AJ118: =H118+100*O118 -> 165.78 | AK118: 161.6 | AL118: 208 | AM118: 79.1 | AN118: 261 | AO118: -4.2000000000000003e-002 | AP118: 6 | AQ118: 万兴转债
A119: 287 | B119: 113535 | C119: 大业转债! | D119: 603278 | E119: 大业股份 | F119: 汽车 | G119: 零部件制 | H119: 114.3 | I119: -2.5000000000000001e-003 | J119: 2.5000000000000001e-003 | K119: 10.35 | L119: 0. | M119: 112.5 | N119: 12.29 | O119: 0.35700000000000004 | P119: 84.21 | Q119: 已到 | R119: 2.45年 | S119: 0.45年 | T119: 5 | U119: 6.8 | V119: 1.2e-002 | W119: 0.16600000000000001 | X119: 0.14000000000000001 | Y119: 30 | Z119: 1.68 | AA119: -6.5000000000000006e-003 | AB119: -1.5700000000000002e-002 | AC119: -0.19500000000000001 | AD119: -0.19899999999999998 | AE119: 98.92 | AF119: 102.62 | AG119: 0.25 | AH119: AA | AI119: 3.8800000000000001e-002 | AJ119: =H119+100*O119 -> 150. | AK119: 144.4 | AL119: 65 | AM119: 41.8 | AN119: 34 | AO119: 0.125 | AP119: 46 | AQ119: 大业转债!
A120: 253 | B120: 110063 | C120: 鹰19转债 | D120: 600567 | E120: 山鹰国际 | F120: 造纸包装 | G120: 包装用纸 | H120: 119.09 | I120: -5.0000000000000001e-004 | J120: -5.4000000000000003e-003 | K120: 3.18 | L120: -1.24e-002 | M120: 115.9 | N120: 3.26 | O120: 0.221 | P120: 97.55 | Q120: 已到 | R120: 4年16天 | S120: 2年16天 | T120: 18.4 | U120: 5.6 | V120: 3.0000000000000001e-003 | W120: 0.126 | X120: 0.12300000000000001 | Y120: 147 | Z120: 0.91 | AA120: -6.8000000000000005e-003 | AB120: -1.37e-002 | AC120: -6.3200000000000006e-002 | AD120: -6.5799999999999997e-002 | AE120: 95.73 | AF120: 101.11 | AG120: 0.48 | AH120: AA+ | AI120: 3.5099999999999999e-002 | AJ120: =H120+100*O120 -> 141.19 | AK120: 140.6 | AL120: 31 | AM120: 39.5 | AN120: 28 | AO120: -2.3e-002 | AP120: 30 | AQ120: 鹰19转债
A121: 1 | B121: 123129 | C121: 锦鸡转债 | D121: 300798 | E121: 锦鸡股份 | F121: 化工 | G121: 其他 | H121: 122.72 | I121: 1.e-004 | J121: -8.0000000000000004e-004 | K121: 9.66 | L121: -1.e-003 | M121: 117.8 | N121: 9.53 | O121: 0.21100000000000002 | P121: 101.36 | Q121: 5月14天 | R121: 5.94年 | S121: 3.94年 | T121: 6 | U121: 92 | V121: 0.125 | W121: 0.14899999999999999 | X121: 0.151 | Y121: 40 | Z121: 3.23 | AA121: -6.9999999999999993e-003 | AB121: -1.2199999999999999e-002 | AC121: -4.0099999999999997e-002 | AD121: -4.1799999999999997e-002 | AE121: 81.07 | AF121: 82.6 | AG121: 0.68 | AH121: AA- | AI121: 6.2899999999999998e-002 | AJ121: =H121+100*O121 -> 143.81999999999999 | AK121: 144.1 | AL121: 61 | AM121: 61.5 | AN121: 159 | AO121: 2.3e-002 | AP121: 1 | AQ121: 锦鸡转债
A122: 204 | B122: 128107 | C122: 交科转债 | D122: 2061 | E122: 浙江交科 | F122: 建筑 | G122: 建筑工程 | H122: 118.51 | I122: 2.8999999999999998e-003 | J122: 1.1999999999999999e-003 | K122: 5.28 | L122: 7.6e-003 | M122: 114.9 | N122: 5.24 | O122: 0.17600000000000002 | P122: 100.76 | Q122: 已到 | R122: 4.40年 | S122: 2.40年 | T122: 25 | U122: 8.9 | V122: 3.0000000000000001e-003 | W122: 0.34399999999999997 | X122: 0.34700000000000003 | Y122: 73 | Z122: 0.81 | AA122: -7.0999999999999995e-003 | AB122: -1.3100000000000001e-002 | AC122: -5.2199999999999996e-002 | AD122: -5.45e-002 | AE122: 94.72 | AF122: 99.03 | AG122: 0.53 | AH122: AA+ | AI122: 3.5099999999999999e-002 | AJ122: =H122+100*O122 -> 136.11000000000001 | AK122: 136.3 | AL122: 17 | AM122: 37.2 | AN122: 20 | AO122: 1.9e-002 | AP122: 21 | AQ122: 交科转债
A123: 267 | B123: 113546 | C123: 迪贝转债! | D123: 603320 | E123: 迪贝电气 | F123: 家电 | G123: 零部件制 | H123: 123.38 | I123: 1.e-002 | J123: -3.5999999999999999e-003 | K123: 13.66 | L123: 1.11e-002 | M123: 119.8 | N123: 14 | O123: 0.26500000000000001 | P123: 97.57 | Q123: 已到 | R123: 3.90年 | S123: 1.90年 | T123: 2.3 | U123: 9.3 | V123: 3.3000000000000002e-002 | W123: 0.129 | X123: 0.126 | Y123: 18 | Z123: 2.44 | AA123: -7.7000000000000002e-003 | AB123: -1.6299999999999999e-002 | AC123: -8.3499999999999991e-002 | AD123: -8.6099999999999996e-002 | AE123: 89.39 | AF123: 91.79 | AG123: 0.57 | AH123: A+ | AI123: 7.2099999999999997e-002 | AJ123: =H123+100*O123 -> 149.88 | AK123: 149.2 | AL123: 115 | AM123: 57.4 | AN123: 133 | AO123: 8.9999999999999997e-002 | AP123: 38 | AQ123: 迪贝转债!
A124: 227 | B124: 110067 | C124: 华安转债! | D124: 600909 | E124: 华安证券 | F124: 金融 | G124: 证券行业 | H124: 113.95 | I124: -4.0000000000000002e-004 | J124: -1.e-003 | K124: 5.15 | L124: -3.9000000000000003e-003 | M124: 110.3 | N124: 6.22 | O124: 0.376 | P124: 82.8 | Q124: 已到 | R124: 4.29年 | S124: 无权 | T124: 28 | U124: 1.9 | V124: 1.e-003 | W124: 0.11599999999999999 | X124: 9.6000000000000002e-002 | Y124: 242 | Z124: 1.3 | AA124: -7.7000000000000002e-003 | AB124: -1.2e-002 | AC124: 无权 | AD124: 无权 | AE124: 无权 | AF124: 96.12 | AG124: 0.35 | AH124: AAA | AI124: 3.3099999999999997e-002 | AJ124: =H124+100*O124 -> 151.55000000000001 | AK124: 145.1 | AL124: 72 | AM124: 49 | AN124: 81 | AO124: 4.0000000000000001e-003 | AP124: 26 | AQ124: 华安转债!
A125: 18 | B125: 123123 | C125: 江丰转债! | D125: 300666 | E125: 江丰电子 | F125: 电子 | G125: 电子行业 | H125: 126.895 | I125: -1.3999999999999999e-002 | J125: 4.3e-003 | K125: 46.73 | L125: -1.5600000000000001e-002 | M125: 121.5 | N125: 51.93 | O125: 0.40999999999999998 | P125: 89.99 | Q125: 2月23天 | R125: 5.71年 | S125: 3.71年 | T125: 5.17 | U125: 25 | V125: 3.7999999999999999e-002 | W125: 4.9000000000000002e-002 | X125: 4.4000000000000004e-002 | Y125: 106 | Z125: 8.52 | AA125: -7.7000000000000002e-003 | AB125: -1.41e-002 | AC125: -4.9500000000000002e-002 | AD125: -5.1500000000000004e-002 | AE125: 79.46 | AF125: 81.63 | AG125: 0.63 | AH125: A+ | AI125: 7.3899999999999993e-002 | AJ125: =H125+100*O125 -> 167.89499999999998 | AK125: 163.8 | AL125: 220 | AM125: 82.2 | AN125: 270 | AO125: 6.5000000000000002e-002 | AP125: 6 | AQ125: 江丰转债!
A126: 264 | B126: 110060 | C126: 天路转债! | D126: 600326 | E126: 西藏天路 | F126: 建筑 | G126: 水泥 | H126: 117.78 | I126: -8.0000000000000004e-004 | J126: -2.3e-003 | K126: 6.27 | L126: -7.9000000000000008e-003 | M126: 114.3 | N126: 7.08 | O126: 0.33000000000000002 | P126: 88.56 | Q126: 已到 | R126: 3.92年 | S126: 1.92年 | T126: 7.06 | U126: 2.6 | V126: 3.0000000000000001e-003 | W126: 0.12300000000000001 | X126: 0.109 | Y126: 58 | Z126: 1.35 | AA126: -7.8000000000000005e-003 | AB126: -1.4199999999999999e-002 | AC126: -6.3600000000000004e-002 | AD126: -6.59e-002 | AE126: 94.76 | AF126: 98.26 | AG126: 0.4 | AH126: AA | AI126: 4.0099999999999997e-002 | AJ126: =H126+100*O126 -> 150.78 | AK126: 147 | AL126: 93 | AM126: 48.7 | AN126: 80 | AO126: -6.0000000000000001e-003 | AP126: 12 | AQ126: 天路转债!
A127: 134 | B127: 128135 | C127: 洽洽转债! | D127: 2557 | E127: 洽洽食品 | F127: 食品饮料 | G127: 休闲食品 | H127: 124.5 | I127: -4.4000000000000003e-003 | J127: 2.0000000000000001e-004 | K127: 53.54 | L127: -1.04e-002 | M127: 119.9 | N127: 60.03 | O127: 0.39600000000000002 | P127: 89.19 | Q127: 已到 | R127: 4.90年 | S127: 2.90年 | T127: 13.4 | U127: 7 | V127: 4.0000000000000001e-003 | W127: 4.9000000000000002e-002 | X127: 4.4000000000000004e-002 | Y127: 271 | Z127: 6.22 | AA127: -7.8000000000000005e-003 | AB127: -1.47e-002 | AC127: -5.9200000000000003e-002 | AD127: -6.1200000000000004e-002 | AE127: 91.76 | AF127: 99.25 | AG127: 0.4 | AH127: AA | AI127: 4.0099999999999997e-002 | AJ127: =H127+100*O127 -> 164.09999999999999 | AK127: 159.8 | AL127: 186 | AM127: 60.6 | AN127: 151 | AO127: -3.9e-002 | AP127: 11 | AQ127: 洽洽转债!
A128: 120 | B128: 127025 | C128: 冀东转债! | D128: 401 | E128: 冀东水泥 | F128: 建筑 | G128: 水泥 | H128: 114.28 | I128: 0. | J128: 0. | K128: 11.84 | L128: 0. | M128: 109.9 | N128: 15.28 | O128: 0.47499999999999998 | P128: 77.49 | Q128: 已到 | R128: 4.94年 | S128: 2.94年 | T128: 17.8 | U128: 0 | V128: 0. | W128: 0.106 | X128: 8.199999999999999e-002 | Y128: 167 | Z128: 1.03 | AA128: -8.0000000000000002e-003 | AB128: -1.1699999999999999e-002 | AC128: -3.4099999999999998e-002 | AD128: -3.5699999999999996e-002 | AE128: 92.83 | AF128: 93.8 | AG128: 0.33 | AH128: AAA | AI128: 3.3099999999999997e-002 | AJ128: =H128+100*O128 -> 161.78 | AK128: 151.1 | AL128: 134 | AM128: 57.3 | AN128: 132 | AO128: 1.6e-002 | AP128: 9 | AQ128: 冀东转债!
A129: 114 | B129: 113609 | C129: 永安转债! | D129: 603776 | E129: 永安行 | F129: 城市公用 | G129: 其他 | H129: 125.02 | I129: 2.9600000000000001e-002 | J129: 1.1599999999999999e-002 | K129: 18.43 | L129: 5.9200000000000003e-002 | M129: 120.5 | N129: 16.48 | O129: 0.11800000000000001 | P129: 111.83 | Q129: 已到 | R129: 4.99年 | S129: 2.99年 | T129: 7.34 | U129: 268 | V129: 0.29299999999999998 | W129: 0.17100000000000001 | X129: 0.191 | Y129: 43 | Z129: 1.32 | AA129: -8.1000000000000013e-003 | AB129: -1.4999999999999999e-002 | AC129: -5.8600000000000006e-002 | AD129: -6.0499999999999998e-002 | AE129: 85.89 | AF129: 89.82 | AG129: 0.7 | AH129: AA- | AI129: 6.1100000000000002e-002 | AJ129: =H129+100*O129 -> 136.81999999999999 | AK129: 138.2 | AL129: 26 | AM129: 48.4 | AN129: 77 | AO129: 0.10400000000000001 | AP129: 26 | AQ129: 永安转债!
A130: 201 | B130: 128108 | C130: 蓝帆转债!! | D130: 2382 | E130: 蓝帆医疗 | F130: 医药 | G130: 医疗器械 | H130: 117.089 | I130: 1.4199999999999999e-002 | J130: -6.0999999999999995e-003 | K130: 16.08 | L130: 1.84e-002 | M130: 112.9 | N130: 18.24 | O130: 0.32799999999999996 | P130: 88.16 | Q130: 已到 | R130: 4.50年 | S130: 3.50年 | T130: 15.2 | U130: 377 | V130: 0.20899999999999999 | W130: 9.4e-002 | X130: 8.3000000000000004e-002 | Y130: 162 | Z130: 1.27 | AA130: -8.199999999999999e-003 | AB130: -1.34e-002 | AC130: -2.9100000000000001e-002 | AD130: -3.1699999999999999e-002 | AE130: 91.32 | AF130: 94.95 | AG130: 0.44 | AH130: AA | AI130: 4.0099999999999997e-002 | AJ130: =H130+100*O130 -> 149.88900000000001 | AK130: 146 | AL130: 83 | AM130: 51.1 | AN130: 97 | AO130: 7.6999999999999999e-002 | AP130: 29 | AQ130: 蓝帆转债!!
A131: 200 | B131: 127017 | C131: 万青转债 | D131: 789 | E131: 万年青 | F131: 建筑 | G131: 水泥 | H131: 122.448 | I131: -6.0999999999999995e-003 | J131: 2.0000000000000001e-004 | K131: 11.32 | L131: -1.8200000000000001e-002 | M131: 118 | N131: 13.46 | O131: 0.45600000000000002 | P131: 84.1 | Q131: 已到 | R131: 4.52年 | S131: 2.52年 | T131: 10 | U131: 2.6 | V131: 2.e-003 | W131: 0.111 | X131: 9.3000000000000013e-002 | Y131: 90 | Z131: 1.32 | AA131: -8.3000000000000001e-003 | AB131: -1.52e-002 | AC131: -6.1799999999999994e-002 | AD131: -6.4000000000000001e-002 | AE131: 94.28 | AF131: 101.29 | AG131: 0.32 | AH131: AA+ | AI131: 3.5099999999999999e-002 | AJ131: =H131+100*O131 -> 168.048 | AK131: 160.8 | AL131: 197 | AM131: 59.5 | AN131: 144 | AO131: -1.3999999999999999e-002 | AP131: 7 | AQ131: 万青转债
A132: 27 | B132: 127041 | C132: 弘亚转债! | D132: 2833 | E132: 弘亚数控 | F132: 机械装备 | G132: 专用设备 | H132: 123.499 | I132: 2.3e-003 | J132: -4.8999999999999998e-003 | K132: 31.82 | L132: -5.6000000000000008e-003 | M132: 118.75 | N132: 38.09 | O132: 0.47799999999999998 | P132: 83.54 | Q132: 51天 | R132: 4.62年 | S132: 2.62年 | T132: 6 | U132: 1 | V132: 1.e-003 | W132: 6.2e-002 | X132: 5.2000000000000005e-002 | Y132: 96 | Z132: 4.83 | AA132: -8.6e-003 | AB132: -1.55e-002 | AC132: -6.5000000000000002e-002 | AD132: -6.6600000000000006e-002 | AE132: 86.98 | AF132: 90.66 | AG132: 0.45 | AH132: AA- | AI132: 6.1100000000000002e-002 | AJ132: =H132+100*O132 -> 171.29899999999998 | AK132: 163.5 | AL132: 219 | AM132: 72.8 | AN132: 232 | AO132: 1.4999999999999999e-002 | AP132: 5 | AQ132: 弘亚转债!
A133: 186 | B133: 128116 | C133: 瑞达转债! | D133: 2961 | E133: 瑞达期货 | F133: 金融 | G133: 期货行业 | H133: 119.502 | I133: 4.0000000000000002e-004 | J133: 2.3e-003 | K133: 24.31 | L133: 7.4999999999999997e-003 | M133: 114.9 | N133: 29.55 | O133: 0.45299999999999996 | P133: 82.27 | Q133: 已到 | R133: 4.59年 | S133: 2.59年 | T133: 6.49 | U133: 3.1 | V133: 4.0000000000000001e-003 | W133: 5.9999999999999998e-002 | X133: 4.9000000000000002e-002 | Y133: 108 | Z133: 5.1 | AA133: -8.6999999999999994e-003 | AB133: -1.44e-002 | AC133: -5.1799999999999999e-002 | AD133: -5.4000000000000006e-002 | AE133: 92.8 | AF133: 96.28 | AG133: 0.37 | AH133: AA | AI133: 4.0099999999999997e-002 | AJ133: =H133+100*O133 -> 164.80199999999999 | AK133: 156.7 | AL133: 171 | AM133: 60.5 | AN133: 149 | AO133: 2.3e-002 | AP133: 17 | AQ133: 瑞达转债!
A134: 330 | B134: 113516 | C134: 苏农转债! | D134: 603323 | E134: 苏农银行 | F134: 金融 | G134: 银行行业 | H134: 115.98 | I134: -3.5999999999999999e-003 | J134: 1.7000000000000001e-003 | K134: 4.77 | L134: -6.3e-003 | M134: 113.3 | N134: 5.37 | O134: 0.30599999999999999 | P134: 88.83 | Q134: 已到 | R134: 2.68年 | S134: 无权 | T134: 12.9 | U134: 4.6 | V134: 3.0000000000000001e-003 | W134: 0.14999999999999999 | X134: 0.13300000000000001 | Y134: 86 | Z134: 0.67 | AA134: -8.8000000000000005e-003 | AB134: -1.77e-002 | AC134: 无权 | AD134: 无权 | AE134: 无权 | AF134: 103.79 | AG134: 0.3 | AH134: AA+ | AI134: 3.3799999999999997e-002 | AJ134: =H134+100*O134 -> 146.58000000000001 | AK134: 143.1 | AL134: 50 | AM134: 39.3 | AN134: 26 | AO134: -4.2999999999999997e-002 | AP134: 24 | AQ134: 苏农转债!
A135: 30 | B135: 127039 | C135: 北港转债 | D135: 582 | E135: 北部湾港 | F135: 机场高速 | G135: 港口 | H135: 118.63 | I135: -7.000000000000001e-004 | J135: -2.5999999999999999e-003 | K135: 7.76 | L135: -6.4000000000000003e-003 | M135: 113 | N135: 8.35 | O135: 0.27600000000000002 | P135: 92.93 | Q135: 39天 | R135: 5.59年 | S135: 3.59年 | T135: 30 | U135: 1.5 | V135: 0. | W135: 0.23699999999999999 | X135: 0.22 | Y135: 127 | Z135: 1.18 | AA135: -8.8000000000000005e-003 | AB135: -1.3000000000000001e-002 | AC135: -3.5900000000000001e-002 | AD135: -3.7599999999999995e-002 | AE135: 91.09 | AF135: 93.61 | AG135: 0.51 | AH135: AAA | AI135: 3.49e-002 | AJ135: =H135+100*O135 -> 146.22999999999999 | AK135: 144.3 | AL135: 64 | AM135: 50.7 | AN135: 93 | AO135: 1.4999999999999999e-002 | AP135: 6 | AQ135: 北港转债
A136: 166 | B136: 110073 | C136: 国投转债 | D136: 600061 | E136: 国投资本 | F136: 金融 | G136: 证券行业 | H136: 114.91 | I136: 4.0000000000000002e-004 | J136: -3.9000000000000003e-003 | K136: 8.1 | L136: -9.7999999999999997e-003 | M136: 110.3 | N136: 9.9 | O136: 0.40399999999999997 | P136: 81.82 | Q136: 已到 | R136: 4.66年 | S136: 无权 | T136: 80 | U136: 18 | V136: 2.e-003 | W136: 0.154 | X136: 0.126 | Y136: 520 | Z136: 1.15 | AA136: -8.8999999999999999e-003 | AB136: -1.29e-002 | AC136: 无权 | AD136: 无权 | AE136: 无权 | AF136: 94.98 | AG136: 0.35 | AH136: AAA | AI136: 3.3099999999999997e-002 | AJ136: =H136+100*O136 -> 155.31 | AK136: 148 | AL136: 104 | AM136: 53 | AN136: 105 | AO136: -1.6e-002 | AP136: 24 | AQ136: 国投转债
A137: 61 | B137: 113622 | C137: 杭叉转债! | D137: 603298 | E137: 杭叉集团 | F137: 机械装备 | G137: 通用设备 | H137: 117.93 | I137: -1.e-003 | J137: 1.6000000000000001e-003 | K137: 17.35 | L137: 1.7000000000000001e-003 | M137: 112.5 | N137: 23.08 | O137: 0.56899999999999995 | P137: 75.17 | Q137: 已到 | R137: 5.32年 | S137: 3.32年 | T137: 11.5 | U137: 26 | V137: 1.9e-002 | W137: 7.6999999999999999e-002 | X137: 5.7999999999999996e-002 | Y137: 150 | Z137: 2.85 | AA137: -9.0000000000000011e-003 | AB137: -1.32e-002 | AC137: -3.8199999999999998e-002 | AD137: -3.9800000000000002e-002 | AE137: 90.84 | AF137: 93.05 | AG137: 0.32 | AH137: AA+ | AI137: 3.6900000000000002e-002 | AJ137: =H137+100*O137 -> 174.82999999999998 | AK137: 160.7 | AL137: 196 | AM137: 67.6 | AN137: 201 | AO137: 1.e-002 | AP137: 5 | AQ137: 杭叉转债!
A138: 3 | B138: 123127 | C138: 耐普转债 | D138: 300818 | E138: 耐普矿机 | F138: 机械装备 | G138: 专用设备 | H138: 122.499 | I138: -8.0000000000000004e-004 | J138: -1.18e-002 | K138: 35.93 | L138: -1.78e-002 | M138: 116.2 | N138: 37 | O138: 0.26100000000000001 | P138: 97.11 | Q138: 5月8天 | R138: 5.92年 | S138: 3.92年 | T138: 4 | U138: 23 | V138: 4.8000000000000001e-002 | W138: 0.159 | X138: 0.154 | Y138: 25 | Z138: 2.67 | AA138: -9.1000000000000004e-003 | AB138: -1.38e-002 | AC138: -3.8900000000000004e-002 | AD138: -4.0800000000000003e-002 | AE138: 78.15 | AF138: 76.89 | AG138: 0.71 | AH138: A+ | AI138: 7.3899999999999993e-002 | AJ138: =H138+100*O138 -> 148.59899999999999 | AK138: 147.9 | AL138: 103 | AM138: 69.7 | AN138: 214 | AO138: -1.6e-002 | AP138: 2 | AQ138: 耐普转债
A139: 104 | B139: 113043 | C139: 财通转债! | D139: 601108 | E139: 财通证券 | F139: 金融 | G139: 证券行业 | H139: 115.47 | I139: -2.9999999999999997e-004 | J139: -3.4000000000000002e-003 | K139: 10.42 | L139: -1.04e-002 | M139: 110.2 | N139: 13.13 | O139: 0.45500000000000002 | P139: 79.36 | Q139: 已到 | R139: 5年13天 | S139: 无权 | T139: 38 | U139: 10 | V139: 2.e-003 | W139: 0.10199999999999999 | X139: 8.1000000000000003e-002 | Y139: 374 | Z139: 1.6 | AA139: -9.3999999999999986e-003 | AB139: -1.3100000000000001e-002 | AC139: 无权 | AD139: 无权 | AE139: 无权 | AF139: 92.97 | AG139: 0.36 | AH139: AAA | AI139: 3.49e-002 | AJ139: =H139+100*O139 -> 160.97 | AK139: 151.6 | AL139: 139 | AM139: 58.6 | AN139: 140 | AO139: 1.6e-002 | AP139: 11 | AQ139: 财通转债!
A140: 73 | B140: 113045 | C140: 环旭转债! | D140: 601231 | E140: 环旭电子 | F140: 电子 | G140: 电子产品 | H140: 117.72 | I140: -5.6999999999999993e-003 | J140: -8.5000000000000006e-003 | K140: 14.89 | L140: -4.9200000000000001e-002 | M140: 112 | N140: 19.75 | O140: 0.56100000000000005 | P140: 75.39 | Q140: 13天 | R140: 5.27年 | S140: 2.27年 | T140: 34.5 | U140: 16 | V140: 4.0000000000000001e-003 | W140: 0.105 | X140: 7.9000000000000001e-002 | Y140: 329 | Z140: 2.76 | AA140: -9.4999999999999998e-003 | AB140: -1.3600000000000001e-002 | AC140: -5.3899999999999997e-002 | AD140: -5.5999999999999994e-002 | AE140: 94.23 | AF140: 92.78 | AG140: 0.29 | AH140: AA+ | AI140: 3.6900000000000002e-002 | AJ140: =H140+100*O140 -> 173.81999999999999 | AK140: 160 | AL140: 189 | AM140: 65.8 | AN140: 185 | AO140: 1.4999999999999999e-002 | AP140: 6 | AQ140: 环旭转债!
A141: 93 | B141: 123090 | C141: 三诺转债! | D141: 300298 | E141: 三诺生物 | F141: 医药 | G141: 医疗器械 | H141: 123 | I141: -2.2000000000000001e-003 | J141: -4.0000000000000001e-003 | K141: 28 | L141: -1.7500000000000002e-002 | M141: 117.1 | N141: 35.18 | O141: 0.54500000000000004 | P141: 79.59 | Q141: 已到 | R141: 5年24天 | S141: 3年24天 | T141: 5 | U141: 15 | V141: 2.4e-002 | W141: 3.2000000000000001e-002 | X141: 2.5000000000000001e-002 | Y141: 158 | Z141: 5.84 | AA141: -9.7999999999999997e-003 | AB141: -1.5700000000000002e-002 | AC141: -5.2199999999999996e-002 | AD141: -5.4100000000000002e-002 | AE141: 90.85 | AF141: 95.52 | AG141: 0.35 | AH141: AA | AI141: 4.1900000000000007e-002 | AJ141: =H141+100*O141 -> 177.5 | AK141: 166.4 | AL141: 240 | AM141: 70.9 | AN141: 220 | AO141: 5.5999999999999994e-002 | AP141: 4 | AQ141: 三诺转债!
A142: 57 | B142: 123110 | C142: 九典转债 | D142: 300705 | E142: 九典制药 | F142: 医药 | G142: 化学制药 | H142: 128.04 | I142: -1.1299999999999999e-002 | J142: 6.3e-003 | K142: 28.38 | L142: -6.9999999999999993e-003 | M142: 121.4 | N142: 26.44 | O142: 0.193 | P142: 107.34 | Q142: 已到 | R142: 5.34年 | S142: 3.34年 | T142: 2.7 | U142: 54 | V142: 0.156 | W142: 4.0999999999999995e-002 | X142: 4.2999999999999997e-002 | Y142: 67 | Z142: 6.69 | AA142: -1.01e-002 | AB142: -1.6799999999999999e-002 | AC142: -5.7099999999999998e-002 | AD142: -5.9200000000000003e-002 | AE142: 81.53 | AF142: 83.7 | AG142: 0.71 | AH142: A+ | AI142: 7.3899999999999993e-002 | AJ142: =H142+100*O142 -> 147.34 | AK142: 148.7 | AL142: 112 | AM142: 65 | AN142: 182 | AO142: 0.17899999999999999 | AP142: 10 | AQ142: 九典转债
A143: 54 | B143: 113623 | C143: 凤21转债 | D143: 603225 | E143: 新凤鸣 | F143: 化工 | G143: 化纤 | H143: 123.6 | I143: 2.5999999999999999e-003 | J143: 6.7000000000000002e-003 | K143: 14.3 | L143: 2.1400000000000002e-002 | M143: 117.1 | N143: 16.47 | O143: 0.42399999999999999 | P143: 86.82 | Q143: 已到 | R143: 5.36年 | S143: 3.36年 | T143: 25 | U143: 65 | V143: 2.1000000000000001e-002 | W143: 0.114 | X143: 9.9000000000000005e-002 | Y143: 219 | Z143: 1.38 | AA143: -1.0200000000000001e-002 | AB143: -1.5700000000000002e-002 | AC143: -4.9200000000000001e-002 | AD143: -5.0999999999999997e-002 | AE143: 89.75 | AF143: 94.36 | AG143: 0.44 | AH143: AA | AI143: 4.1900000000000007e-002 | AJ143: =H143+100*O143 -> 166. | AK143: 160.4 | AL143: 195 | AM143: 66 | AN143: 190 | AO143: 2.4e-002 | AP143: 3 | AQ143: 凤21转债
A144: 28 | B144: 123118 | C144: 惠城转债 | D144: 300779 | E144: 惠城环保 | F144: 化工 | G144: 其他 | H144: 128.899 | I144: 3.6200000000000003e-002 | J144: 1.9099999999999999e-002 | K144: 18.71 | L144: 7.7100000000000002e-002 | M144: 121.7 | N144: 17.11 | O144: 0.17899999999999999 | P144: 109.35 | Q144: 47天 | R144: 5.61年 | S144: 3.61年 | T144: 3.2 | U144: 1252. | V144: 2.9100000000000001 | W144: 0.17100000000000001 | X144: 0.187 | Y144: 19 | Z144: 2.81 | AA144: -1.04e-002 | AB144: -1.6899999999999998e-002 | AC144: -5.4299999999999994e-002 | AD144: -5.6500000000000002e-002 | AE144: 80.2 | AF144: 82.39 | AG144: 0.72 | AH144: A+ | AI144: 7.3899999999999993e-002 | AJ144: =H144+100*O144 -> 146.79900000000001 | AK144: 148.4 | AL144: 107 | AM144: 66.1 | AN144: 193 | AO144: 0.155 | AP144: 9 | AQ144: 惠城转债
A145: 19 | B145: 127042 | C145: 嘉美转债 | D145: 2969 | E145: 嘉美包装 | F145: 造纸包装 | G145: 包装材料 | H145: 124.2 | I145: -6.4000000000000003e-003 | J145: -6.6e-003 | K145: 5.3 | L145: -2.0299999999999999e-002 | M145: 117.1 | N145: 4.87 | O145: 0.14099999999999999 | P145: 108.83 | Q145: 2月19天 | R145: 5.70年 | S145: 3.70年 | T145: 7.5 | U145: 31 | V145: 3.3000000000000002e-002 | W145: 0.14699999999999999 | X145: 0.16 | Y145: 51 | Z145: 2.33 | AA145: -1.04e-002 | AB145: -1.5600000000000001e-002 | AC145: -4.6199999999999998e-002 | AD145: -4.7800000000000002e-002 | AE145: 88.52 | AF145: 93.07 | AG145: 0.64 | AH145: AA | AI145: 4.1900000000000007e-002 | AJ145: =H145+100*O145 -> 138.30000000000001 | AK145: 139.6 | AL145: 28 | AM145: 46.5 | AN145: 63 | AO145: -7.4999999999999997e-002 | AP145: 10 | AQ145: 嘉美转债
A146: 301 | B146: 127012 | C146: 招路转债! | D146: 1965 | E146: 招商公路 | F146: 机场高速 | G146: 高速 | H146: 111.851 | I146: -1.7000000000000001e-003 | J146: 8.9999999999999998e-004 | K146: 7.14 | L146: -2.8000000000000004e-003 | M146: 107.9 | N146: 8.63 | O146: 0.35200000000000004 | P146: 82.73 | Q146: 已到 | R146: 3.32年 | S146: 1.32年 | T146: 50 | U146: 7.6 | V146: 1.e-003 | W146: 0.113 | X146: 9.4e-002 | Y146: 441 | Z146: 0.86 | AA146: -1.09e-002 | AB146: -1.5300000000000001e-002 | AC146: -6.2800000000000009e-002 | AD146: -6.480000000000001e-002 | AE146: 96.89 | AF146: 97.01 | AG146: 0.29 | AH146: AAA | AI146: 3.3099999999999997e-002 | AJ146: =H146+100*O146 -> 147.05099999999999 | AK146: 141 | AL146: 36 | AM146: 44 | AN146: 40 | AO146: 2.3e-002 | AP146: 26 | AQ146: 招路转债!
A147: 25 | B147: 113627 | C147: 太平转债! | D147: 603877 | E147: 太平鸟 | F147: 服装纺织 | G147: 服装行业 | H147: 122.35 | I147: -7.1999999999999998e-003 | J147: 3.4999999999999996e-003 | K147: 34.33 | L147: -1.44e-002 | M147: 115.1 | N147: 50.32 | O147: 0.79299999999999993 | P147: 68.22 | Q147: 55天 | R147: 5.63年 | S147: 3.63年 | T147: 8 | U147: 2 | V147: 2.e-003 | W147: 4.9000000000000002e-002 | X147: 3.3000000000000002e-002 | Y147: 164 | Z147: 4.02 | AA147: -1.1000000000000001e-002 | AB147: -1.5700000000000002e-002 | AC147: -4.3200000000000002e-002 | AD147: -4.4900000000000002e-002 | AE147: 88.77 | AF147: 91.74 | AG147: 0.26 | AH147: AA | AI147: 4.1900000000000007e-002 | AJ147: =H147+100*O147 -> 201.64999999999998 | AK147: 176.5 | AL147: 272 | AM147: 84.7 | AN147: 277 | AO147: -5.5999999999999994e-002 | AP147: 2 | AQ147: 太平转债!
A148: 98 | B148: 123088 | C148: 威唐转债! | D148: 300707 | E148: 威唐工业 | F148: 汽车 | G148: 零部件制 | H148: 128.7 | I148: 1.34e-002 | J148: 2.75e-002 | K148: 20.56 | L148: 6.3099999999999989e-002 | M148: 121.6 | N148: 20.72 | O148: 0.29699999999999999 | P148: 99.23 | Q148: 已到 | R148: 5年18天 | S148: 3年18天 | T148: 3.01 | U148: 130 | V148: 0.33799999999999997 | W148: 9.3000000000000013e-002 | X148: 9.3000000000000013e-002 | Y148: 32 | Z148: 4.59 | AA148: -1.1399999999999999e-002 | AB148: -1.8600000000000002e-002 | AC148: -6.3200000000000006e-002 | AD148: -6.5599999999999992e-002 | AE148: 83.45 | AF148: 85.66 | AG148: 0.65 | AH148: A+ | AI148: 7.3899999999999993e-002 | AJ148: =H148+100*O148 -> 158.39999999999998 | AK148: 158.2 | AL148: 178 | AM148: 72.5 | AN148: 231 | AO148: 0.10400000000000001 | AP148: 18 | AQ148: 威唐转债!
A149: 157 | B149: 113599 | C149: 嘉友转债! | D149: 603871 | E149: 嘉友国际 | F149: 交通运输 | G149: 物流业 | H149: 132.5 | I149: 6.5000000000000006e-003 | J149: -4.3e-003 | K149: 21.35 | L149: 3.3e-003 | M149: 125.6 | N149: 18.32 | O149: 0.13699999999999998 | P149: 116.54 | Q149: 已到 | R149: 4.69年 | S149: 2.69年 | T149: 7.2 | U149: 37 | V149: 3.9e-002 | W149: 0.11800000000000001 | X149: 0.13800000000000001 | Y149: 61 | Z149: 2.92 | AA149: -1.1599999999999999e-002 | AB149: -2.0400000000000001e-002 | AC149: -8.3400000000000002e-002 | AD149: -8.5500000000000007e-002 | AE149: 87.53 | AF149: 95.64 | AG149: 0.67 | AH149: AA- | AI149: 6.1100000000000002e-002 | AJ149: =H149+100*O149 -> 146.19999999999999 | AK149: 148.5 | AL149: 108 | AM149: 52.8 | AN149: 104 | AO149: 0.109 | AP149: 18 | AQ149: 嘉友转债!
A150: 34 | B150: 113050 | C150: 南银转债 | D150: 601009 | E150: 南京银行 | F150: 金融 | G150: 银行行业 | H150: 118.5 | I150: -8.0000000000000004e-004 | J150: -2.8999999999999998e-003 | K150: 9.09 | L150: -7.6e-003 | M150: 111.2 | N150: 10.1 | O150: 0.317 | P150: 90 | Q150: 24天 | R150: 5.55年 | S150: 无权 | T150: 200 | U150: 30 | V150: 1.e-003 | W150: 0.22 | X150: 0.19800000000000001 | Y150: 910 | Z150: 0.86 | AA150: -1.1599999999999999e-002 | AB150: -1.52e-002 | AC150: 无权 | AD150: 无权 | AE150: 无权 | AF150: 92.19 | AG150: 0.48 | AH150: AAA | AI150: 3.49e-002 | AJ150: =H150+100*O150 -> 150.19999999999999 | AK150: 147 | AL150: 92 | AM150: 54.8 | AN150: 120 | AO150: -4.0999999999999995e-002 | AP150: 7 | AQ150: 南银转债
A151: 266 | B151: 127014 | C151: 北方转债! | D151: 65 | E151: 北方国际 | F151: 建筑 | G151: 建筑工程 | H151: 119.65 | I151: 9.0000000000000011e-003 | J151: -1.3999999999999999e-002 | K151: 7.78 | L151: -1.2699999999999999e-002 | M151: 114.3 | N151: 8.65 | O151: 0.33000000000000002 | P151: 89.94 | Q151: 已到 | R151: 3.91年 | S151: 1.91年 | T151: 5.35 | U151: 9.3 | V151: 1.4999999999999999e-002 | W151: 8.900000000000001e-002 | X151: 8.0000000000000002e-002 | Y151: 60 | Z151: 1.01 | AA151: -1.18e-002 | AB151: -1.83e-002 | AC151: -7.0999999999999994e-002 | AD151: -7.3399999999999993e-002 | AE151: 95.75 | AF151: 100.13 | AG151: 0.39 | AH151: AA+ | AI151: 3.5099999999999999e-002 | AJ151: =H151+100*O151 -> 152.65000000000001 | AK151: 149.4 | AL151: 117 | AM151: 49.2 | AN151: 83 | AO151: 1.1000000000000001e-002 | AP151: 17 | AQ151: 北方转债!
A152: 94 | B152: 128142 | C152: 新乳转债! | D152: 2946 | E152: 新乳业 | F152: 食品饮料 | G152: 乳制品 | H152: 122.099 | I152: 5.9999999999999995e-004 | J152: -3.3e-003 | K152: 14.77 | L152: -7.4000000000000003e-003 | M152: 115.1 | N152: 18.47 | O152: 0.52700000000000002 | P152: 79.97 | Q152: 已到 | R152: 5年21天 | S152: 3年21天 | T152: 7.18 | U152: 7.8 | V152: 9.0000000000000011e-003 | W152: 5.5999999999999994e-002 | X152: 4.4999999999999998e-002 | Y152: 128 | Z152: 5.03 | AA152: -1.18e-002 | AB152: -1.7000000000000001e-002 | AC152: -5.0099999999999999e-002 | AD152: -5.21e-002 | AE152: 90.88 | AF152: 93.92 | AG152: 0.36 | AH152: AA | AI152: 4.1900000000000007e-002 | AJ152: =H152+100*O152 -> 174.79900000000001 | AK152: 164.2 | AL152: 226 | AM152: 70.3 | AN152: 217 | AO152: -5.0999999999999997e-002 | AP152: 5 | AQ152: 新乳转债!
A153: 272 | B153: 128074 | C153: 游族转债!! | D153: 2174 | E153: 游族网络 | F153: 通信互联 | G153: 互联网 | H153: 124.8 | I153: 2.2099999999999998e-002 | J153: -2.2099999999999998e-002 | K153: 16.87 | L153: 6.7000000000000004e-002 | M153: 119.3 | N153: 16.97 | O153: 0.255 | P153: 99.41 | Q153: 已到 | R153: 3.82年 | S153: 1.82年 | T153: 6.83 | U153: 205 | V153: 0.23999999999999999 | W153: 4.4000000000000004e-002 | X153: 4.4000000000000004e-002 | Y153: 155 | Z153: 2.95 | AA153: -1.1899999999999999e-002 | AB153: -2.0499999999999997e-002 | AC153: -9.35e-002 | AD153: -9.5899999999999999e-002 | AE153: 95.12 | AF153: 102.93 | AG153: 0 | AH153: AA | AI153: 4.0099999999999997e-002 | AJ153: =H153+100*O153 -> 150.30000000000001 | AK153: 150.2 | AL153: 123 | AM153: 47.3 | AN153: 68 | AO153: 0.154 | AP153: 30 | AQ153: 游族转债!!
A154: 190 | B154: 113588 | C154: 润达转债! | D154: 603108 | E154: 润达医疗 | F154: 医药 | G154: 医疗器械 | H154: 120.68 | I154: -1.6899999999999998e-002 | J154: 2.5999999999999999e-003 | K154: 12.79 | L154: -2.7400000000000001e-002 | M154: 113.9 | N154: 13.25 | O154: 0.25 | P154: 96.53 | Q154: 已到 | R154: 4.55年 | S154: 2.55年 | T154: 5.5 | U154: 16 | V154: 2.3e-002 | W154: 7.400000000000001e-002 | X154: 7.2000000000000008e-002 | Y154: 74 | Z154: 2.25 | AA154: -1.29e-002 | AB154: -1.8200000000000001e-002 | AC154: -5.57e-002 | AD154: -5.79e-002 | AE154: 93.01 | AF154: 95.58 | AG154: 0.52 | AH154: AA | AI154: 4.0099999999999997e-002 | AJ154: =H154+100*O154 -> 145.68000000000001 | AK154: 144.8 | AL154: 68 | AM154: 49.2 | AN154: 84 | AO154: 0.17499999999999999 | AP154: 12 | AQ154: 润达转债!
A155: 26 | B155: 123119 | C155: 康泰转2! | D155: 300601 | E155: 康泰生物 | F155: 医药 | G155: 生物制药 | H155: 125.99 | I155: 2.3e-003 | J155: -7.9000000000000008e-003 | K155: 113.8 | L155: -1.52e-002 | M155: 117.1 | N155: 145.33 | O155: 0.60899999999999999 | P155: 78.3 | Q155: 55天 | R155: 5.63年 | S155: 3.63年 | T155: 20 | U155: 13 | V155: 5.0000000000000001e-003 | W155: 2.6000000000000002e-002 | X155: 2.e-002 | Y155: 782 | Z155: 9.19 | AA155: -1.3100000000000001e-002 | AB155: -1.83e-002 | AC155: -5.0599999999999999e-002 | AD155: -5.2300000000000006e-002 | AE155: 88.77 | AF155: 93.33 | AG155: 0.37 | AH155: AA | AI155: 4.1900000000000007e-002 | AJ155: =H155+100*O155 -> 186.88999999999999 | AK155: 173.7 | AL155: 267 | AM155: 80.3 | AN155: 264 | AO155: 3.2000000000000001e-002 | AP155: 9 | AQ155: 康泰转2!
A156: 235 | B156: 113565 | C156: 宏辉转债 | D156: 603336 | E156: 宏辉果蔬 | F156: 农业 | G156: 农产品加 | H156: 124.5 | I156: 3.8e-003 | J156: 5.7999999999999996e-003 | K156: 7.8 | L156: 1.5600000000000001e-002 | M156: 117.8 | N156: 7.64 | O156: 0.21899999999999997 | P156: 102.09 | Q156: 已到 | R156: 4.25年 | S156: 2.25年 | T156: 2.25 | U156: 64 | V156: 0.22699999999999998 | W156: 6.6000000000000003e-002 | X156: 6.7000000000000004e-002 | Y156: 34 | Z156: 3.29 | AA156: -1.32e-002 | AB156: -2.0400000000000001e-002 | AC156: -7.3599999999999999e-002 | AD156: -7.6299999999999993e-002 | AE156: 90.04 | AF156: 92.14 | AG156: 0.62 | AH156: AA- | AI156: 6.1100000000000002e-002 | AJ156: =H156+100*O156 -> 146.40000000000001 | AK156: 146.9 | AL156: 91 | AM156: 54.8 | AN156: 119 | AO156: -5.7999999999999996e-002 | AP156: 27 | AQ156: 宏辉转债
A157: 143 | B157: 128131 | C157: 崇达转2! | D157: 2815 | E157: 崇达技术 | F157: 电子 | G157: 元器件制 | H157: 122.92 | I157: -1.4999999999999999e-002 | J157: 8.199999999999999e-003 | K157: 16.36 | L157: -1.7399999999999999e-002 | M157: 114.9 | N157: 19.38 | O157: 0.45600000000000002 | P157: 84.42 | Q157: 已到 | R157: 4.78年 | S157: 2.78年 | T157: 14 | U157: 6.8 | V157: 4.0000000000000001e-003 | W157: 9.8000000000000004e-002 | X157: 8.199999999999999e-002 | Y157: 143 | Z157: 3.33 | AA157: -1.43e-002 | AB157: -1.9699999999999999e-002 | AC157: -5.74e-002 | AD157: -5.9500000000000004e-002 | AE157: 92.19 | AF157: 95.57 | AG157: 0.39 | AH157: AA | AI157: 4.0099999999999997e-002 | AJ157: =H157+100*O157 -> 168.52000000000001 | AK157: 161.4 | AL157: 204 | AM157: 65.9 | AN157: 186 | AO157: 0. | AP157: 11 | AQ157: 崇达转2!
A158: 121 | B158: 127024 | C158: 盈峰转债! | D158: 967 | E158: 盈峰环境 | F158: 机械装备 | G158: 专用设备 | H158: 125.058 | I158: 2.2400000000000003e-002 | J158: 2.e-003 | K158: 8.24 | L158: 4.5700000000000005e-002 | M158: 116.6 | N158: 8.19 | O158: 0.24299999999999999 | P158: 100.61 | Q158: 已到 | R158: 4.94年 | S158: 2.94年 | T158: 14.8 | U158: 220 | V158: 0.12 | W158: 5.7000000000000002e-002 | X158: 5.7000000000000002e-002 | Y158: 261 | Z158: 1.59 | AA158: -1.43e-002 | AB158: -2.0099999999999996e-002 | AC158: -6.0599999999999994e-002 | AD158: -6.2400000000000004e-002 | AE158: 92.7 | AF158: 98.62 | AG158: 0.53 | AH158: AA+ | AI158: 3.5099999999999999e-002 | AJ158: =H158+100*O158 -> 149.358 | AK158: 149.5 | AL158: 118 | AM158: 50.9 | AN158: 94 | AO158: 0.19600000000000001 | AP158: 5 | AQ158: 盈峰转债!
A159: 172 | B159: 113594 | C159: 淳中转债! | D159: 603516 | E159: 淳中科技 | F159: 电子 | G159: 电子产品 | H159: 129.29 | I159: 2.2000000000000001e-003 | J159: -1.9e-003 | K159: 17.8 | L159: 1.1000000000000001e-003 | M159: 120.9 | N159: 27.84 | O159: 1.02 | P159: 63.94 | Q159: 已到 | R159: 4.65年 | S159: 2.65年 | T159: 3 | U159: 3.6 | V159: 9.0000000000000011e-003 | W159: 8.9999999999999997e-002 | X159: 5.7999999999999996e-002 | Y159: 33 | Z159: 3.42 | AA159: -1.46e-002 | AB159: -2.2200000000000001e-002 | AC159: -7.4900000000000008e-002 | AD159: -7.7300000000000008e-002 | AE159: 85.74 | AF159: 88.16 | AG159: 0.27 | AH159: A+ | AI159: 7.2099999999999997e-002 | AJ159: =H159+100*O159 -> 231.28999999999999 | AK159: 194.6 | AL159: 308 | AM159: 106.5 | AN159: 312 | AO159: 3.5000000000000003e-002 | AP159: 9 | AQ159: 淳中转债!
A160: 59 | B160: 123107 | C160: 温氏转债! | D160: 300498 | E160: 温氏股份 | F160: 农业 | G160: 畜牧业 | H160: 122.4 | I160: 1.6000000000000001e-003 | J160: -4.3e-003 | K160: 16.04 | L160: -5.6000000000000008e-003 | M160: 113 | N160: 17.62 | O160: 0.34499999999999997 | P160: 91.03 | Q160: 已到 | R160: 5.33年 | S160: 3.33年 | T160: 93 | U160: 94 | V160: 8.0000000000000002e-003 | W160: 9.0999999999999998e-002 | X160: 8.3000000000000004e-002 | Y160: 1019. | Z160: 2.9 | AA160: -1.5100000000000001e-002 | AB160: -1.9400000000000001e-002 | AC160: -4.7100000000000003e-002 | AD160: -4.8899999999999999e-002 | AE160: 91.88 | AF160: 94.43 | AG160: 0.48 | AH160: AAA | AI160: 3.49e-002 | AJ160: =H160+100*O160 -> 156.90000000000001 | AK160: 153.8 | AL160: 155 | AM160: 59.3 | AN160: 143 | AO160: -5.4000000000000006e-002 | AP160: 13 | AQ160: 温氏转债!
A161: 123 | B161: 128136 | C161: 立讯转债! | D161: 2475 | E161: 立讯精密 | F161: 电子 | G161: 元器件制 | H161: 120.82 | I161: 8.5000000000000006e-003 | J161: -1.6799999999999999e-002 | K161: 40.12 | L161: -3.9e-002 | M161: 111.8 | N161: 58.16 | O161: 0.75099999999999989 | P161: 68.98 | Q161: 已到 | R161: 4.93年 | S161: 2.93年 | T161: 30 | U161: 31 | V161: 9.0000000000000011e-003 | W161: 1.1000000000000001e-002 | X161: 6.9999999999999993e-003 | Y161: 2829. | Z161: 8.78 | AA161: -1.5800000000000002e-002 | AB161: -2.e-002 | AC161: -5.2300000000000006e-002 | AD161: -5.3699999999999998e-002 | AE161: 91.95 | AF161: 94.5 | AG161: 0.21 | AH161: AA+ | AI161: 3.5099999999999999e-002 | AJ161: =H161+100*O161 -> 195.91999999999999 | AK161: 172.7 | AL161: 265 | AM161: 78.2 | AN161: 256 | AO161: -2.2000000000000002e-002 | AP161: 14 | AQ161: 立讯转债!
A162: 14 | B162: 127044 | C162: 蒙娜转债! | D162: 2918 | E162: 蒙娜丽莎 | F162: 建筑 | G162: 其他建材 | H162: 128.279 | I162: -3.3e-003 | J162: 6.7000000000000002e-003 | K162: 24.38 | L162: 6.9999999999999993e-003 | M162: 117.1 | N162: 27.07 | O162: 0.42399999999999999 | P162: 90.06 | Q162: 2月26天 | R162: 5.72年 | S162: 3.72年 | T162: 11.7 | U162: 18 | V162: 1.2e-002 | W162: 0.11599999999999999 | X162: 0.10400000000000001 | Y162: 101 | Z162: 2.72 | AA162: -1.61e-002 | AB162: -2.12e-002 | AC162: -5.3899999999999997e-002 | AD162: -5.5500000000000001e-002 | AE162: 88.45 | AF162: 92.99 | AG162: 0.49 | AH162: AA | AI162: 4.1900000000000007e-002 | AJ162: =H162+100*O162 -> 170.679 | AK162: 166.5 | AL162: 242 | AM162: 73.5 | AN162: 235 | AO162: 0.16200000000000001 | AP162: 2 | AQ162: 蒙娜转债!
A163: 62 | B163: 127031 | C163: 洋丰转债! | D163: 902 | E163: 新洋丰 | F163: 化工 | G163: 农化 | H163: 128.16 | I163: 1.55e-002 | J163: 8.9999999999999998e-004 | K163: 16.84 | L163: 3.95e-002 | M163: 117.1 | N163: 19.94 | O163: 0.51800000000000002 | P163: 84.45 | Q163: 已到 | R163: 5.32年 | S163: 3.32年 | T163: 10 | U163: 36 | V163: 2.7999999999999997e-002 | W163: 4.5999999999999999e-002 | X163: 3.7999999999999999e-002 | Y163: 220 | Z163: 2.92 | AA163: -1.7100000000000001e-002 | AB163: -2.2599999999999999e-002 | AC163: -5.96e-002 | AD163: -6.1399999999999996e-002 | AE163: 89.89 | AF163: 94.51 | AG163: 0.42 | AH163: AA | AI163: 4.1900000000000007e-002 | AJ163: =H163+100*O163 -> 179.96000000000001 | AK163: 171.9 | AL163: 262 | AM163: 77.4 | AN163: 253 | AO163: -6.0000000000000001e-003 | AP163: 4 | AQ163: 洋丰转债!
A164: 66 | B164: 113046 | C164: 金田转债! | D164: 601609 | E164: 金田铜业 | F164: 有色金属 | G164: 铜金属 | H164: 125.92 | I164: 1.38e-002 | J164: -1.1299999999999999e-002 | K164: 9.71 | L164: 5.1999999999999998e-003 | M164: 114.9 | N164: 10.75 | O164: 0.39399999999999996 | P164: 90.33 | Q164: 已到 | R164: 5.32年 | S164: 3.32年 | T164: 15 | U164: 114 | V164: 6.0999999999999999e-002 | W164: 0.10400000000000001 | X164: 9.4e-002 | Y164: 144 | Z164: 2.04 | AA164: -1.7399999999999999e-002 | AB164: -2.2200000000000001e-002 | AC164: -5.5399999999999998e-002 | AD164: -5.7099999999999998e-002 | AE164: 91.25 | AF164: 95.11 | AG164: 0.47 | AH164: AA+ | AI164: 3.6900000000000002e-002 | AJ164: =H164+100*O164 -> 165.31999999999999 | AK164: 161.5 | AL164: 206 | AM164: 66.4 | AN164: 195 | AO164: 0.14099999999999999 | AP164: 13 | AQ164: 金田转债!
A165: 332 | B165: 128042 | C165: 凯中转债! | D165: 2823 | E165: 凯中精密 | F165: 能源电力 | G165: 电力设备 | H165: 120.8 | I165: 2.5000000000000001e-003 | J165: -8.9999999999999998e-004 | K165: 11.61 | L165: 5.1999999999999998e-003 | M165: 115.3 | N165: 12.86 | O165: 0.33799999999999997 | P165: 90.28 | Q165: 已到 | R165: 2.67年 | S165: 0.67年 | T165: 4.16 | U165: 12 | V165: 2.3e-002 | W165: 0.125 | X165: 0.113 | Y165: 33 | Z165: 2.54 | AA165: -1.7600000000000001e-002 | AB165: -2.75e-002 | AC165: -0.192 | AD165: -0.19500000000000001 | AE165: 98.61 | AF165: 104.32 | AG165: 0.31 | AH165: AA | AI165: 3.8800000000000001e-002 | AJ165: =H165+100*O165 -> 154.59999999999999 | AK165: 151.3 | AL165: 136 | AM165: 47 | AN165: 67 | AO165: 0.11599999999999999 | AP165: 24 | AQ165: 凯中转债!
A166: 268 | B166: 128079 | C166: 英联转债! | D166: 2846 | E166: 英联股份 | F166: 造纸包装 | G166: 包装材料 | H166: 125.1 | I166: -3.4000000000000002e-003 | J166: -5.3e-003 | K166: 7.34 | L166: -1.61e-002 | M166: 116.9 | N166: 8.29 | O166: 0.41299999999999998 | P166: 88.54 | Q166: 已到 | R166: 3.90年 | S166: 1.90年 | T166: 1.52 | U166: 7.8 | V166: 4.0999999999999995e-002 | W166: 6.5000000000000002e-002 | X166: 5.7999999999999996e-002 | Y166: 23 | Z166: 2.89 | AA166: -1.7600000000000001e-002 | AB166: -2.5000000000000001e-002 | AC166: -9.01e-002 | AD166: -9.2600000000000002e-002 | AE166: 89.35 | AF166: 89.6 | AG166: 0.54 | AH166: A+ | AI166: 7.2099999999999997e-002 | AJ166: =H166+100*O166 -> 166.39999999999998 | AK166: 161.7 | AL166: 209 | AM166: 72.1 | AN166: 229 | AO166: 6.9999999999999993e-003 | AP166: 16 | AQ166: 英联转债!
A167: 185 | B167: 113591 | C167: 胜达转债! | D167: 603687 | E167: 大胜达 | F167: 造纸包装 | G167: 包装用纸 | H167: 131.88 | I167: -1.21e-002 | J167: 2.0000000000000001e-004 | K167: 11.14 | L167: -1.5900000000000001e-002 | M167: 121.7 | N167: 8.76 | O167: 3.7000000000000005e-002 | P167: 127.17 | Q167: 已到 | R167: 4.59年 | S167: 2.59年 | T167: 5.19 | U167: 43 | V167: 6.2e-002 | W167: 0.113 | X167: 0.14400000000000002 | Y167: 46 | Z167: 2.64 | AA167: -1.77e-002 | AB167: -2.5499999999999998e-002 | AC167: -8.4399999999999989e-002 | AD167: -8.6599999999999996e-002 | AE167: 88.13 | AF167: 93.24 | AG167: 0.74 | AH167: AA- | AI167: 6.1100000000000002e-002 | AJ167: =H167+100*O167 -> 135.57999999999998 | AK167: 136.6 | AL167: 18 | AM167: 43.4 | AN167: 39 | AO167: 2.7999999999999997e-002 | AP167: 32 | AQ167: 胜达转债!
A168: 6 | B168: 127048 | C168: 中大转债 | D168: 2896 | E168: 中大力德 | F168: 机械装备 | G168: 通用设备 | H168: 135 | I168: -1.46e-002 | J168: -1.11e-002 | K168: 23 | L168: -3.6000000000000004e-002 | M168: 121.7 | N168: 22.1 | O168: 0.29699999999999999 | P168: 104.07 | Q168: 5月5天 | R168: 5.91年 | S168: 3.91年 | T168: 2.7 | U168: 135 | V168: 0.36599999999999999 | W168: 0.113 | X168: 0.11699999999999999 | Y168: 24 | Z168: 3.28 | AA168: -1.77e-002 | AB168: -2.3799999999999998e-002 | AC168: -6.1200000000000004e-002 | AD168: -6.3099999999999989e-002 | AE168: 78.48 | AF168: 80.61 | AG168: 0.71 | AH168: A+ | AI168: 7.3899999999999993e-002 | AJ168: =H168+100*O168 -> 164.69999999999999 | AK168: 165.9 | AL168: 238 | AM168: 85.3 | AN168: 278 | AO168: 6.2e-002 | AP168: 1 | AQ168: 中大转债
A169: 95 | B169: 128141 | C169: 旺能转债 | D169: 2034 | E169: 旺能环境 | F169: 城市公用 | G169: 三废处理 | H169: 126.2 | I169: 7.4999999999999997e-003 | J169: -3.0999999999999999e-003 | K169: 16.79 | L169: 7.1999999999999998e-003 | M169: 115.1 | N169: 15.97 | O169: 0.20000000000000001 | P169: 105.13 | Q169: 已到 | R169: 5年20天 | S169: 3年20天 | T169: 12.7 | U169: 41 | V169: 2.6000000000000002e-002 | W169: 0.17600000000000002 | X169: 0.185 | Y169: 72 | Z169: 1.43 | AA169: -1.84e-002 | AB169: -2.3599999999999999e-002 | AC169: -5.9900000000000002e-002 | AD169: -6.1900000000000004e-002 | AE169: 90.89 | AF169: 93.93 | AG169: 0.61 | AH169: AA | AI169: 4.1900000000000007e-002 | AJ169: =H169+100*O169 -> 146.19999999999999 | AK169: 147.3 | AL169: 98 | AM169: 53.3 | AN169: 108 | AO169: 3.3000000000000002e-002 | AP169: 8 | AQ169: 旺能转债
A170: 146 | B170: 128130 | C170: 景兴转债 | D170: 2067 | E170: 景兴纸业 | F170: 造纸包装 | G170: 包装用纸 | H170: 125.348 | I170: -3.4999999999999996e-003 | J170: -1.7000000000000001e-003 | K170: 3.86 | L170: -7.7000000000000002e-003 | M170: 114.8 | N170: 3.4 | O170: 0.10400000000000001 | P170: 113.53 | Q170: 已到 | R170: 4.76年 | S170: 2.76年 | T170: 9.99 | U170: 13 | V170: 1.e-002 | W170: 0.217 | X170: 0.24600000000000002 | Y170: 46 | Z170: 0.88 | AA170: -1.8600000000000002e-002 | AB170: -2.4e-002 | AC170: -6.4399999999999999e-002 | AD170: -6.6400000000000001e-002 | AE170: 92.16 | AF170: 95.55 | AG170: 0.67 | AH170: AA | AI170: 4.0099999999999997e-002 | AJ170: =H170+100*O170 -> 135.74799999999999 | AK170: 137.2 | AL170: 23 | AM170: 41.6 | AN170: 33 | AO170: 1.6e-002 | AP170: 19 | AQ170: 景兴转债
A171: 298 | B171: 110057 | C171: 现代转债 | D171: 600420 | E171: 国药现代 | F171: 医药 | G171: 化学制药 | H171: 117.49 | I171: -2.8000000000000004e-003 | J171: -3.4000000000000002e-003 | K171: 9.53 | L171: -1.24e-002 | M171: 110.3 | N171: 9.79 | O171: 0.20699999999999999 | P171: 97.34 | Q171: 已到 | R171: 3.34年 | S171: 1.34年 | T171: 16.2 | U171: 5.7 | V171: 3.0000000000000001e-003 | W171: 0.16500000000000001 | X171: 0.161 | Y171: 98 | Z171: 1.17 | AA171: -1.9099999999999999e-002 | AB171: -2.46e-002 | AC171: -8.539999999999999e-002 | AD171: -8.8599999999999998e-002 | AE171: 97.91 | AF171: 99.16 | AG171: 0.5 | AH171: AAA | AI171: 3.3099999999999997e-002 | AJ171: =H171+100*O171 -> 138.19 | AK171: 137.6 | AL171: 24 | AM171: 38.5 | AN171: 23 | AO171: 1.3999999999999999e-002 | AP171: 23 | AQ171: 现代转债
A172: 85 | B172: 113618 | C172: 美诺转债! | D172: 603538 | E172: 美诺华 | F172: 医药 | G172: 原料药 | H172: 127.82 | I172: 1.2800000000000001e-002 | J172: 5.1999999999999998e-003 | K172: 35.36 | L172: 2.9100000000000001e-002 | M172: 115.3 | N172: 37.47 | O172: 0.35399999999999998 | P172: 94.37 | Q172: 已到 | R172: 5年48天 | S172: 3年48天 | T172: 5.2 | U172: 132 | V172: 0.19600000000000001 | W172: 9.8000000000000004e-002 | X172: 9.3000000000000013e-002 | Y172: 53 | Z172: 3.13 | AA172: -2.0299999999999999e-002 | AB172: -2.5399999999999999e-002 | AC172: -6.1699999999999998e-002 | AD172: -6.3700000000000007e-002 | AE172: 85.08 | AF172: 84.91 | AG172: 0.62 | AH172: AA- | AI172: 6.2899999999999998e-002 | AJ172: =H172+100*O172 -> 163.22 | AK172: 161.3 | AL172: 200 | AM172: 76.2 | AN172: 249 | AO172: 0.14099999999999999 | AP172: 5 | AQ172: 美诺转债!
A173: 360 | B173: 128022 | C173: 众信转债! | D173: 2707 | E173: 众信旅游 | F173: 旅游餐饮 | G173: 旅游 | H173: 113.309 | I173: -1.1399999999999999e-002 | J173: 1.1399999999999999e-002 | K173: 5.71 | L173: -2.7300000000000001e-002 | M173: 108.8 | N173: 7.92 | O173: 0.57200000000000006 | P173: 72.1 | Q173: 已到 | R173: 2年4.1天 | S173: 4.1天 | T173: 4.56 | U173: 23 | V173: 4.4000000000000004e-002 | W173: 8.8000000000000009e-002 | X173: 6.3e-002 | Y173: 52 | Z173: 10.02 | AA173: -2.0400000000000001e-002 | AB173: -2.8300000000000002e-002 | AC173: -0.64200000000000002 | AD173: -0.65700000000000003 | AE173: 100.17 | AF173: 93.35 | AG173: 0 | AH173: A | AI173: 8.0799999999999997e-002 | AJ173: =H173+100*O173 -> 170.50900000000001 | AK173: 154.5 | AL173: 160 | AM173: 54.3 | AN173: 116 | AO173: 5.9999999999999998e-002 | AP173: 36 | AQ173: 众信转债!
A174: 232 | B174: 113567 | C174: 君禾转债! | D174: 603617 | E174: 君禾股份 | F174: 机械装备 | G174: 通用设备 | H174: 129.55 | I174: 1.5300000000000001e-002 | J174: 3.5999999999999999e-003 | K174: 12.81 | L174: 2.64e-002 | M174: 118.8 | N174: 11.16 | O174: 0.129 | P174: 114.78 | Q174: 已到 | R174: 4.27年 | S174: 2.27年 | T174: 2.1 | U174: 67 | V174: 0.247 | W174: 8.199999999999999e-002 | X174: 9.4e-002 | Y174: 26 | Z174: 3.64 | AA174: -2.06e-002 | AB174: -2.7999999999999997e-002 | AC174: -8.7400000000000005e-002 | AD174: -9.01e-002 | AE174: 87.97 | AF174: 88.97 | AG174: 0.71 | AH174: A+ | AI174: 7.2099999999999997e-002 | AJ174: =H174+100*O174 -> 142.45000000000002 | AK174: 144.3 | AL174: 63 | AM174: 55.3 | AN174: 124 | AO174: 0.11900000000000001 | AP174: 32 | AQ174: 君禾转债!
A175: 60 | B175: 110079 | C175: 杭银转债! | D175: 600926 | E175: 杭州银行 | F175: 金融 | G175: 银行行业 | H175: 125.6 | I175: -5.1999999999999998e-003 | J175: -2.0000000000000001e-004 | K175: 13.99 | L175: -8.5000000000000006e-003 | M175: 112.4 | N175: 12.99 | O175: 0.16600000000000001 | P175: 107.7 | Q175: 已到 | R175: 5.33年 | S175: 无权 | T175: 150 | U175: 63 | V175: 3.0000000000000001e-003 | W175: 0.18100000000000002 | X175: 0.19500000000000001 | Y175: 830 | Z175: 1.2 | AA175: -2.0899999999999998e-002 | AB175: -2.5000000000000001e-002 | AC175: 无权 | AD175: 无权 | AE175: 无权 | AF175: 93.88 | AG175: 0.64 | AH175: AAA | AI175: 3.49e-002 | AJ175: =H175+100*O175 -> 142.19999999999999 | AK175: 143.5 | AL175: 55 | AM175: 49.6 | AN175: 88 | AO175: -2.8999999999999998e-002 | AP175: 13 | AQ175: 杭银转债!
A176: 180 | B176: 110071 | C176: 湖盐转债! | D176: 600929 | E176: 雪天盐业 | F176: 食品饮料 | G176: 食品饮料 | H176: 126.52 | I176: -9.1999999999999998e-003 | J176: -1.1299999999999999e-002 | K176: 7.31 | L176: -3.0499999999999999e-002 | M176: 114.9 | N176: 6.52 | O176: 0.128 | P176: 112.12 | Q176: 已到 | R176: 4.62年 | S176: 2.62年 | T176: 7.2 | U176: 75 | V176: 8.199999999999999e-002 | W176: 0.106 | X176: 0.11800000000000001 | Y176: 68 | Z176: 2.61 | AA176: -2.1000000000000001e-002 | AB176: -2.6600000000000002e-002 | AC176: -7.0499999999999993e-002 | AD176: -7.2599999999999998e-002 | AE176: 92.78 | AF176: 96.18 | AG176: 0.67 | AH176: AA | AI176: 4.0099999999999997e-002 | AJ176: =H176+100*O176 -> 139.31999999999999 | AK176: 140.9 | AL176: 35 | AM176: 44.7 | AN176: 45 | AO176: 5.0999999999999997e-002 | AP176: 20 | AQ176: 湖盐转债!
A177: 58 | B177: 123108 | C177: 乐普转2! | D177: 300003 | E177: 乐普医疗 | F177: 医药 | G177: 医疗器械 | H177: 121.792 | I177: 1.0700000000000001e-002 | J177: -1.2699999999999999e-002 | K177: 22.27 | L177: -7.6e-003 | M177: 111.1 | N177: 29.5 | O177: 0.61299999999999999 | P177: 75.49 | Q177: 已到 | R177: 4.34年 | S177: 2.34年 | T177: 16.4 | U177: 17 | V177: 8.0000000000000002e-003 | W177: 4.0999999999999995e-002 | X177: 3.1e-002 | Y177: 402 | Z177: 3.49 | AA177: -2.12e-002 | AB177: -2.58e-002 | AC177: -6.8499999999999991e-002 | AD177: -6.9900000000000004e-002 | AE177: 93.65 | AF177: 95.85 | AG177: 0.27 | AH177: AA+ | AI177: 3.5099999999999999e-002 | AJ177: =H177+100*O177 -> 183.09199999999998 | AK177: 168.1 | AL177: 251 | AM177: 72.2 | AN177: 230 | AO177: 1.9e-002 | AP177: 12 | AQ177: 乐普转2!
A178: 20 | B178: 123122 | C178: 富瀚转债 | D178: 300613 | E178: 富瀚微 | F178: 电子 | G178: 芯片制造 | H178: 135.701 | I178: -3.6200000000000003e-002 | J178: -3.7999999999999999e-002 | K178: 167.9 | L178: -0.111 | M178: 120.3 | N178: 177.04 | O178: 0.43099999999999999 | P178: 94.84 | Q178: 2月17天 | R178: 5.69年 | S178: 3.69年 | T178: 5.81 | U178: 452 | V178: 0.56700000000000006 | W178: 2.8999999999999998e-002 | X178: 2.7000000000000003e-002 | Y178: 202 | Z178: 12.33 | AA178: -2.1299999999999999e-002 | AB178: -2.7200000000000002e-002 | AC178: -6.8000000000000005e-002 | AD178: -6.9599999999999995e-002 | AE178: 78.91 | AF178: 80.79 | AG178: 0.67 | AH178: A+ | AI178: 7.3899999999999993e-002 | AJ178: =H178+100*O178 -> 178.80099999999999 | AK178: 176.6 | AL178: 273 | AM178: 95.8 | AN178: 297 | AO178: 7.0000000000000007e-002 | AP178: 5 | AQ178: 富瀚转债
A179: 337 | B179: 110045 | C179: 海澜转债! | D179: 600398 | E179: 海澜之家 | F179: 服装纺织 | G179: 服装行业 | H179: 116.67 | I179: -2.2000000000000001e-003 | J179: -1.9e-003 | K179: 6.35 | L179: -1.24e-002 | M179: 110.3 | N179: 7.04 | O179: 0.29299999999999998 | P179: 90.2 | Q179: 已到 | R179: 2.62年 | S179: 0.62年 | T179: 29.5 | U179: 4.6 | V179: 1.e-003 | W179: 0.10800000000000001 | X179: 9.6999999999999989e-002 | Y179: 274 | Z179: 1.94 | AA179: -2.1400000000000002e-002 | AB179: -2.8399999999999998e-002 | AC179: -0.17199999999999999 | AD179: -0.17499999999999999 | AE179: 98.59 | AF179: 101.19 | AG179: 0.33 | AH179: AA+ | AI179: 3.3799999999999997e-002 | AJ179: =H179+100*O179 -> 145.97 | AK179: 143.1 | AL179: 51 | AM179: 42 | AN179: 35 | AO179: -2.2000000000000002e-002 | AP179: 44 | AQ179: 海澜转债!
A180: 242 | B180: 127015 | C180: 希望转债!! | D180: 876 | E180: 新 希 望 | F180: 农业 | G180: 畜牧业 | H180: 120.389 | I180: 3.2000000000000002e-003 | J180: -1.6000000000000001e-003 | K180: 14.75 | L180: 7.4999999999999997e-003 | M180: 110 | N180: 19.75 | O180: 0.61199999999999999 | P180: 74.68 | Q180: 已到 | R180: 4年37天 | S180: 2年37天 | T180: 9.5 | U180: 11 | V180: 1.e-002 | W180: 1.3999999999999999e-002 | X180: 1.1000000000000001e-002 | Y180: 665 | Z180: 2.18 | AA180: -2.2099999999999998e-002 | AB180: -2.6499999999999999e-002 | AC180: -6.83e-002 | AD180: -7.0400000000000004e-002 | AE180: 95.42 | AF180: 96.48 | AG180: 0.22 | AH180: AAA | AI180: 3.3099999999999997e-002 | AJ180: =H180+100*O180 -> 181.589 | AK180: 166.1 | AL180: 239 | AM180: 69.6 | AN180: 212 | AO180: -4.0000000000000001e-002 | AP180: 27 | AQ180: 希望转债!!
A181: 335 | B181: 123011 | C181: 德尔转债! | D181: 300473 | E181: 德尔股份 | F181: 汽车 | G181: 零部件制 | H181: 122.221 | I181: 8.6e-003 | J181: -1.4000000000000002e-003 | K181: 24.46 | L181: 3.1600000000000003e-002 | M181: 115.3 | N181: 31.38 | O181: 0.56799999999999995 | P181: 77.95 | Q181: 已到 | R181: 2.64年 | S181: 0.64年 | T181: 2.51 | U181: 37 | V181: 0.12 | W181: 7.5999999999999998e-002 | X181: 5.9000000000000004e-002 | Y181: 33 | Z181: 1.55 | AA181: -2.2200000000000001e-002 | AB181: -3.2199999999999999e-002 | AC181: -0.21299999999999999 | AD181: -0.21600000000000003 | AE181: 97.16 | AF181: 99.17 | AG181: 0.23 | AH181: AA- | AI181: 5.9800000000000006e-002 | AJ181: =H181+100*O181 -> 179.02100000000002 | AK181: 166.5 | AL181: 241 | AM181: 67.3 | AN181: 199 | AO181: 0.121 | AP181: 38 | AQ181: 德尔转债!
A182: 173 | B182: 127020 | C182: 中金转债 | D182: 60 | E182: 中金岭南 | F182: 有色金属 | G182: 有色行业 | H182: 125.8 | I182: 1.84e-002 | J182: -9.7000000000000003e-003 | K182: 5.02 | L182: 1.41e-002 | M182: 113.5 | N182: 4.63 | O182: 0.16 | P182: 108.42 | Q182: 已到 | R182: 4.64年 | S182: 2.64年 | T182: 34.3 | U182: 79 | V182: 1.8000000000000002e-002 | W182: 0.187 | X182: 0.20300000000000001 | Y182: 183 | Z182: 1.46 | AA182: -2.2200000000000001e-002 | AB182: -2.7200000000000002e-002 | AC182: -7.1399999999999991e-002 | AD182: -7.2800000000000004e-002 | AE182: 92.85 | AF182: 96.91 | AG182: 0.62 | AH182: AA+ | AI182: 3.5099999999999999e-002 | AJ182: =H182+100*O182 -> 141.80000000000001 | AK182: 143.2 | AL182: 52 | AM182: 46.3 | AN182: 58 | AO182: 4.4999999999999998e-002 | AP182: 20 | AQ182: 中金转债
A183: 97 | B183: 123087 | C183: 明电转债! | D183: 300739 | E183: 明阳电路 | F183: 电子 | G183: 元器件制 | H183: 136.171 | I183: -3.6000000000000004e-002 | J183: -4.0999999999999995e-003 | K183: 19.77 | L183: -5.3600000000000002e-002 | M183: 121.2 | N183: 16.32 | O183: 0.124 | P183: 121.14 | Q183: 已到 | R183: 5年18天 | S183: 4年18天 | T183: 4.19 | U183: 198 | V183: 0.34000000000000002 | W183: 7.2000000000000008e-002 | X183: 8.6999999999999994e-002 | Y183: 58 | Z183: 3.51 | AA183: -2.3300000000000001e-002 | AB183: -3.0200000000000001e-002 | AC183: -5.7099999999999998e-002 | AD183: -5.9800000000000006e-002 | AE183: 82.93 | AF183: 89.74 | AG183: 0.75 | AH183: AA- | AI183: 6.2899999999999998e-002 | AJ183: =H183+100*O183 -> 148.571 | AK183: 151.2 | AL183: 135 | AM183: 61.5 | AN183: 158 | AO183: 1.9e-002 | AP183: 19 | AQ183: 明电转债!
A184: 129 | B184: 123073 | C184: 同和转债! | D184: 300636 | E184: 同和药业 | F184: 医药 | G184: 原料药 | H184: 137.44 | I184: 4.2000000000000003e-002 | J184: 2.6200000000000001e-002 | K184: 18.8 | L184: 8.8000000000000009e-002 | M184: 121.9 | N184: 14.82 | O184: 8.3000000000000004e-002 | P184: 126.86 | Q184: 已到 | R184: 4.91年 | S184: 2.91年 | T184: 3.59 | U184: 1212. | V184: 2.3900000000000001 | W184: 9.3000000000000013e-002 | X184: 0.11800000000000001 | Y184: 39 | Z184: 4.71 | AA184: -2.46e-002 | AB184: -3.1899999999999998e-002 | AC184: -8.7100000000000011e-002 | AD184: -8.929999999999999e-002 | AE184: 84.17 | AF184: 87.25 | AG184: 0.77 | AH184: A+ | AI184: 7.2099999999999997e-002 | AJ184: =H184+100*O184 -> 145.74000000000001 | AK184: 148 | AL184: 105 | AM184: 60.8 | AN184: 153 | AO184: 0.14499999999999999 | AP184: 12 | AQ184: 同和转债!
A185: 135 | B185: 127022 | C185: 恒逸转债 | D185: 703 | E185: 恒逸石化 | F185: 化工 | G185: 化工 | H185: 122.66 | I185: -8.3999999999999995e-003 | J185: 7.4000000000000003e-003 | K185: 10.46 | L185: -1.9e-003 | M185: 108.7 | N185: 11.2 | O185: 0.313 | P185: 93.39 | Q185: 已到 | R185: 4.89年 | S185: 2.89年 | T185: 20 | U185: 34 | V185: 1.3999999999999999e-002 | W185: 5.2000000000000005e-002 | X185: 4.9000000000000002e-002 | Y185: 383 | Z185: 1.48 | AA185: -2.4799999999999999e-002 | AB185: -2.7900000000000001e-002 | AC185: -5.7500000000000002e-002 | AD185: -5.9000000000000004e-002 | AE185: 92.26 | AF185: 92.06 | AG185: 0.53 | AH185: AA+ | AI185: 3.5099999999999999e-002 | AJ185: =H185+100*O185 -> 153.96000000000001 | AK185: 151.9 | AL185: 143 | AM185: 59.7 | AN185: 145 | AO185: -8.0000000000000002e-003 | AP185: 6 | AQ185: 恒逸转债
A186: 248 | B186: 123038 | C186: 联得转债! | D186: 300545 | E186: 联得装备 | F186: 机械装备 | G186: 专用设备 | H186: 131.19 | I186: 3.0000000000000001e-003 | J186: -1.44e-002 | K186: 23.3 | L186: -1.9400000000000001e-002 | M186: 118.6 | N186: 24.07 | O186: 0.35499999999999998 | P186: 96.8 | Q186: 已到 | R186: 4年28天 | S186: 2年28天 | T186: 1.47 | U186: 42 | V186: 0.214 | W186: 3.6000000000000004e-002 | X186: 3.4000000000000002e-002 | Y186: 41 | Z186: 2.99 | AA186: -2.5000000000000001e-002 | AB186: -3.2599999999999997e-002 | AC186: -0.10000000000000001 | AD186: -0.10300000000000001 | AE186: 89.03 | AF186: 89.96 | AG186: 0.59 | AH186: A+ | AI186: 7.2099999999999997e-002 | AJ186: =H186+100*O186 -> 166.69 | AK186: 165.6 | AL186: 234 | AM186: 75.6 | AN186: 247 | AO186: -1.4999999999999999e-002 | AP186: 19 | AQ186: 联得转债!
A187: 42 | B187: 127035 | C187: 濮耐转债 | D187: 2225 | E187: 濮耐股份 | F187: 钢铁 | G187: 钢铁行业 | H187: 128.44 | I187: 1.9e-003 | J187: -5.9999999999999995e-004 | K187: 4.66 | L187: 2.2000000000000001e-003 | M187: 114.7 | N187: 4.43 | O187: 0.221 | P187: 105.19 | Q187: 4.5天 | R187: 4.49年 | S187: 2.49年 | T187: 6.26 | U187: 13 | V187: 1.6e-002 | W187: 0.13300000000000001 | X187: 0.14000000000000001 | Y187: 47 | Z187: 1.54 | AA187: -2.5399999999999999e-002 | AB187: -3.1e-002 | AC187: -7.8799999999999995e-002 | AD187: -8.1000000000000003e-002 | AE187: 93.22 | AF187: 96.5 | AG187: 0.61 | AH187: AA | AI187: 4.0099999999999997e-002 | AJ187: =H187+100*O187 -> 150.53999999999999 | AK187: 151.7 | AL187: 141 | AM187: 55.2 | AN187: 123 | AO187: 7.2999999999999995e-002 | AP187: 10 | AQ187: 濮耐转债
A188: 345 | B188: 127006 | C188: 敖东转债! | D188: 623 | E188: 吉林敖东 | F188: 金融 | G188: 证券行业 | H188: 113.9 | I188: -6.0999999999999995e-003 | J188: 4.0999999999999995e-003 | K188: 16.52 | L188: -9.5999999999999992e-003 | M188: 107.4 | N188: 20.22 | O188: 0.39399999999999996 | P188: 81.7 | Q188: 已到 | R188: 2.29年 | S188: 0.29年 | T188: 24.1 | U188: 7.9 | V188: 3.0000000000000001e-003 | W188: 0.125 | X188: 0.10199999999999999 | Y188: 192 | Z188: 0.8 | AA188: -2.5600000000000001e-002 | AB188: -3.15e-002 | AC188: -0.26300000000000001 | AD188: -0.26700000000000002 | AE188: 99.55 | AF188: 99.63 | AG188: 0.21 | AH188: AA+ | AI188: 3.3799999999999997e-002 | AJ188: =H188+100*O188 -> 153.30000000000001 | AK188: 146.1 | AL188: 84 | AM188: 46.5 | AN188: 62 | AO188: 2.e-003 | AP188: 26 | AQ188: 敖东转债!
A189: 77 | B189: 123099 | C189: 普利转债 | D189: 300630 | E189: 普利制药 | F189: 医药 | G189: 化学制药 | H189: 140.991 | I189: 3.27e-002 | J189: -2.1299999999999999e-002 | K189: 53.7 | L189: 1.6299999999999999e-002 | M189: 123.5 | N189: 46.03 | O189: 0.20899999999999999 | P189: 116.66 | Q189: 已到 | R189: 5.20年 | S189: 3.20年 | T189: 8.5 | U189: 106 | V189: 8.900000000000001e-002 | W189: 3.6000000000000004e-002 | X189: 4.2000000000000003e-002 | Y189: 235 | Z189: 9.86 | AA189: -2.5600000000000001e-002 | AB189: -3.2899999999999999e-002 | AC189: -8.7599999999999997e-002 | AD189: -8.9399999999999993e-002 | AE189: 84.74 | AF189: 90.52 | AG189: 0.71 | AH189: AA- | AI189: 6.2899999999999998e-002 | AJ189: =H189+100*O189 -> 161.89100000000002 | AK189: 165.3 | AL189: 233 | AM189: 74.8 | AN189: 241 | AO189: 4.0999999999999995e-002 | AP189: 5 | AQ189: 普利转债
A190: 86 | B190: 128143 | C190: 锋龙转债! | D190: 2931 | E190: 锋龙股份 | F190: 机械装备 | G190: 专用设备 | H190: 138.589 | I190: 4.3e-003 | J190: -2.8000000000000004e-003 | K190: 16.19 | L190: 1.9e-003 | M190: 121.7 | N190: 12.73 | O190: 8.9999999999999997e-002 | P190: 127.18 | Q190: 已到 | R190: 5年42天 | S190: 3年42天 | T190: 2.44 | U190: 41 | V190: 0.121 | W190: 7.5999999999999998e-002 | X190: 9.6000000000000002e-002 | Y190: 32 | Z190: 5.07 | AA190: -2.5699999999999997e-002 | AB190: -3.2599999999999997e-002 | AC190: -8.3100000000000007e-002 | AD190: -8.539999999999999e-002 | AE190: 83.07 | AF190: 85.34 | AG190: 0.79 | AH190: A+ | AI190: 7.3899999999999993e-002 | AJ190: =H190+100*O190 -> 147.589 | AK190: 150 | AL190: 121 | AM190: 64.7 | AN190: 179 | AO190: 7.8e-002 | AP190: 15 | AQ190: 锋龙转债!
A191: 328 | B191: 128044 | C191: 岭南转债! | D191: 2717 | E191: 岭南股份 | F191: 城市公用 | G191: 生态环境 | H191: 118.3 | I191: 1.4499999999999999e-002 | J191: -1.4800000000000001e-002 | K191: 3.32 | L191: -1.1899999999999999e-002 | M191: 110.3 | N191: 5.59 | O191: 0.99199999999999999 | P191: 59.39 | Q191: 已到 | R191: 2.71年 | S191: 0.71年 | T191: 6.59 | U191: 89 | V191: 0.114 | W191: 0.11800000000000001 | X191: 7.0000000000000007e-002 | Y191: 56 | Z191: 1.18 | AA191: -2.5899999999999999e-002 | AB191: -3.2599999999999997e-002 | AC191: -0.161 | AD191: -0.16500000000000001 | AE191: 96.75 | AF191: 94.47 | AG191: 0.02 | AH191: AA- | AI191: 5.9800000000000006e-002 | AJ191: =H191+100*O191 -> 217.5 | AK191: 177.2 | AL191: 276 | AM191: 80.5 | AN191: 266 | AO191: 5.2000000000000005e-002 | AP191: 56 | AQ191: 岭南转债!
A192: 125 | B192: 123075 | C192: 贝斯转债! | D192: 300580 | E192: 贝斯特 | F192: 汽车 | G192: 零部件制 | H192: 130.75 | I192: 1.1200000000000002e-002 | J192: -2.41e-002 | K192: 22.89 | L192: -2.1000000000000001e-002 | M192: 115.1 | N192: 23.74 | O192: 0.35600000000000004 | P192: 96.42 | Q192: 已到 | R192: 4.93年 | S192: 2.93年 | T192: 6 | U192: 19 | V192: 2.5000000000000001e-002 | W192: 0.13100000000000001 | X192: 0.126 | Y192: 46 | Z192: 2.59 | AA192: -2.6000000000000002e-002 | AB192: -3.1200000000000002e-002 | AC192: -7.3300000000000004e-002 | AD192: -7.5199999999999989e-002 | AE192: 86.2 | AF192: 86.41 | AG192: 0.61 | AH192: AA- | AI192: 6.1100000000000002e-002 | AJ192: =H192+100*O192 -> 166.34999999999999 | AK192: 165.1 | AL192: 230 | AM192: 78.7 | AN192: 259 | AO192: 2.8999999999999998e-002 | AP192: 8 | AQ192: 贝斯转债!
A193: 325 | B193: 128048 | C193: 张行转债 | D193: 2839 | E193: 张家港行 | F193: 金融 | G193: 银行行业 | H193: 121.298 | I193: -2.3999999999999998e-003 | J193: -2.8000000000000004e-003 | K193: 5.7 | L193: -1.04e-002 | M193: 112.3 | N193: 5.6 | O193: 0.192 | P193: 101.79 | Q193: 已到 | R193: 2.96年 | S193: 无权 | T193: 25 | U193: 17 | V193: 6.0000000000000001e-003 | W193: 0.24199999999999999 | X193: 0.247 | Y193: 103 | Z193: 0.89 | AA193: -2.6099999999999998e-002 | AB193: -3.3399999999999999e-002 | AC193: 无权 | AD193: 无权 | AE193: 无权 | AF193: 101.93 | AG193: 0.5 | AH193: AA+ | AI193: 3.3799999999999997e-002 | AJ193: =H193+100*O193 -> 140.49799999999999 | AK193: 140.8 | AL193: 32 | AM193: 38.9 | AN193: 25 | AO193: -2.e-002 | AP193: 11 | AQ193: 张行转债
A194: 13 | B194: 123124 | C194: 晶瑞转2! | D194: 300655 | E194: 晶瑞电材 | F194: 电子 | G194: 电子行业 | H194: 130 | I194: 0. | J194: 1.1299999999999999e-002 | K194: 44.55 | L194: 1.6899999999999998e-002 | M194: 111.2 | N194: 50.31 | O194: 0.46799999999999997 | P194: 88.55 | Q194: 2月25天 | R194: 5.72年 | S194: 3.72年 | T194: 5.23 | U194: 13 | V194: 2.e-002 | W194: 3.4000000000000002e-002 | X194: 3.1e-002 | Y194: 152 | Z194: 10.46 | AA194: -2.7300000000000001e-002 | AB194: -3.0699999999999998e-002 | AC194: -5.91e-002 | AD194: -6.0299999999999999e-002 | AE194: 77.96 | AF194: 74.4 | AG194: 0.67 | AH194: A+ | AI194: 7.3899999999999993e-002 | AJ194: =H194+100*O194 -> 176.80000000000001 | AK194: 171.4 | AL194: 261 | AM194: 93.5 | AN194: 292 | AO194: 5.2999999999999999e-002 | AP194: 5 | AQ194: 晶瑞转2!
A195: 176 | B195: 128121 | C195: 宏川转债! | D195: 2930 | E195: 宏川智慧 | F195: 交通运输 | G195: 物流业 | H195: 128.096 | I195: 6.9999999999999993e-003 | J195: 7.000000000000001e-004 | K195: 21.93 | L195: 1.06e-002 | M195: 112.9 | N195: 19.89 | O195: 0.16200000000000001 | P195: 110.26 | Q195: 已到 | R195: 4.64年 | S195: 2.64年 | T195: 6.7 | U195: 12 | V195: 1.3999999999999999e-002 | W195: 6.8000000000000005e-002 | X195: 7.4999999999999997e-002 | Y195: 98 | Z195: 4.62 | AA195: -2.7400000000000001e-002 | AB195: -3.2199999999999999e-002 | AC195: -7.4099999999999999e-002 | AD195: -7.6200000000000004e-002 | AE195: 87.7 | AF195: 86.26 | AG195: 0.73 | AH195: AA- | AI195: 6.1100000000000002e-002 | AJ195: =H195+100*O195 -> 144.29599999999999 | AK195: 145.9 | AL195: 81 | AM195: 58.2 | AN195: 137 | AO195: -4.0999999999999995e-002 | AP195: 5 | AQ195: 宏川转债!
A196: 79 | B196: 123097 | C196: 美力转债 | D196: 300611 | E196: 美力科技 | F196: 机械装备 | G196: 通用设备 | H196: 140.07 | I196: -8.9999999999999998e-004 | J196: -1.e-003 | K196: 11.58 | L196: -2.5999999999999999e-003 | M196: 121.6 | N196: 9.28 | O196: 0.122 | P196: 124.78 | Q196: 已到 | R196: 5.17年 | S196: 3.17年 | T196: 3 | U196: 183 | V196: 0.435 | W196: 0.14499999999999999 | X196: 0.18100000000000002 | Y196: 21 | Z196: 2.94 | AA196: -2.76e-002 | AB196: -3.44e-002 | AC196: -8.48e-002 | AD196: -8.6999999999999994e-002 | AE196: 82.75 | AF196: 84.95 | AG196: 0.77 | AH196: A+ | AI196: 7.3899999999999993e-002 | AJ196: =H196+100*O196 -> 152.26999999999998 | AK196: 155.4 | AL196: 163 | AM196: 70.4 | AN196: 218 | AO196: 0.14499999999999999 | AP196: 21 | AQ196: 美力转债
A197: 78 | B197: 123098 | C197: 一品转债! | D197: 300723 | E197: 一品红 | F197: 医药 | G197: 医药行业 | H197: 142.888 | I197: -2.4e-002 | J197: -3.3e-003 | K197: 33.16 | L197: -3.5499999999999997e-002 | M197: 124 | N197: 25.48 | O197: 9.8000000000000004e-002 | P197: 130.14 | Q197: 已到 | R197: 5.17年 | S197: 3.17年 | T197: 4.25 | U197: 54 | V197: 8.900000000000001e-002 | W197: 4.4999999999999998e-002 | X197: 5.7999999999999996e-002 | Y197: 96 | Z197: 5.71 | AA197: -2.76e-002 | AB197: -3.5000000000000003e-002 | AC197: -9.1899999999999996e-002 | AD197: -9.3800000000000008e-002 | AE197: 84.98 | AF197: 91.09 | AG197: 0.77 | AH197: AA- | AI197: 6.2899999999999998e-002 | AJ197: =H197+100*O197 -> 152.68800000000002 | AK197: 155.6 | AL197: 166 | AM197: 64.5 | AN197: 178 | AO197: 1.3999999999999999e-002 | AP197: 7 | AQ197: 一品转债!
A198: 56 | B198: 123109 | C198: 昌红转债! | D198: 300151 | E198: 昌红科技 | F198: 机械装备 | G198: 专用设备 | H198: 140.091 | I198: -1.2800000000000001e-002 | J198: 5.5000000000000005e-003 | K198: 37.72 | L198: -9.1999999999999998e-003 | M198: 121 | N198: 28.06 | O198: 4.2000000000000003e-002 | P198: 134.43 | Q198: 已到 | R198: 5.34年 | S198: 3.34年 | T198: 4.6 | U198: 82 | V198: 0.127 | W198: 2.4e-002 | X198: 3.3000000000000002e-002 | Y198: 190 | Z198: 18.35 | AA198: -2.76e-002 | AB198: -3.4000000000000002e-002 | AC198: -8.2299999999999998e-002 | AD198: -8.4100000000000008e-002 | AE198: 84.09 | AF198: 87.97 | AG198: 0.8 | AH198: AA- | AI198: 6.2899999999999998e-002 | AJ198: =H198+100*O198 -> 144.291 | AK198: 145.8 | AL198: 77 | AM198: 57.8 | AN198: 135 | AO198: 2.5000000000000001e-002 | AP198: 5 | AQ198: 昌红转债!
A199: 83 | B199: 113619 | C199: 世运转债! | D199: 603920 | E199: 世运电路 | F199: 电子 | G199: 元器件制 | H199: 132.87 | I199: -2.81e-002 | J199: -2.3e-003 | K199: 20.4 | L199: -5.0300000000000004e-002 | M199: 115.2 | N199: 19.92 | O199: 0.29699999999999999 | P199: 102.41 | Q199: 已到 | R199: 5年54天 | S199: 3年54天 | T199: 10 | U199: 177 | V199: 0.13200000000000001 | W199: 9.1999999999999998e-002 | X199: 9.4e-002 | Y199: 109 | Z199: 4.16 | AA199: -2.7900000000000001e-002 | AB199: -3.2899999999999999e-002 | AC199: -7.2700000000000001e-002 | AD199: -7.46e-002 | AE199: 90.64 | AF199: 93.67 | AG199: 0.6 | AH199: AA | AI199: 4.1900000000000007e-002 | AJ199: =H199+100*O199 -> 162.56999999999999 | AK199: 163.3 | AL199: 217 | AM199: 69.7 | AN199: 213 | AO199: -3.9e-002 | AP199: 6 | AQ199: 世运转债!
A200: 270 | B200: 128076 | C200: 金轮转债! | D200: 2722 | E200: 金轮股份 | F200: 机械装备 | G200: 专用设备 | H200: 127.62 | I200: -2.2099999999999998e-002 | J200: -2.5999999999999999e-003 | K200: 15.4 | L200: -3.8100000000000002e-002 | M200: 114.3 | N200: 14.66 | O200: 0.215 | P200: 105.05 | Q200: 已到 | R200: 3.88年 | S200: 1.88年 | T200: 2.14 | U200: 9.5 | V200: 3.5000000000000003e-002 | W200: 7.9000000000000001e-002 | X200: 8.3000000000000004e-002 | Y200: 27 | Z200: 1.38 | AA200: -2.8500000000000001e-002 | AB200: -3.4799999999999998e-002 | AC200: -0.10099999999999999 | AD200: -0.10300000000000001 | AE200: 91.13 | AF200: 91.2 | AG200: 0.65 | AH200: AA- | AI200: 6.1100000000000002e-002 | AJ200: =H200+100*O200 -> 149.12 | AK200: 150.2 | AL200: 124 | AM200: 59 | AN200: 141 | AO200: -1.3999999999999999e-002 | AP200: 37 | AQ200: 金轮转债!
A201: 342 | B201: 128039 | C201: 三力转债! | D201: 2224 | E201: 三 力 士 | F201: 机械装备 | G201: 专用设备 | H201: 116.99 | I201: -1.e-004 | J201: -7.000000000000001e-004 | K201: 5.03 | L201: -2.e-003 | M201: 108.8 | N201: 5.79 | O201: 0.34700000000000003 | P201: 86.87 | Q201: 已到 | R201: 2.53年 | S201: 0.53年 | T201: 2.02 | U201: 5.4 | V201: 2.3e-002 | W201: 5.5e-002 | X201: 4.8000000000000001e-002 | Y201: 37 | Z201: 1.53 | AA201: -2.87e-002 | AB201: -3.49e-002 | AC201: -0.19699999999999998 | AD201: -0.20100000000000001 | AE201: 97.54 | AF201: 94.15 | AG201: 0.38 | AH201: AA- | AI201: 5.9800000000000006e-002 | AJ201: =H201+100*O201 -> 151.69 | AK201: 147.1 | AL201: 96 | AM201: 49.6 | AN201: 87 | AO201: 2.e-002 | AP201: 29 | AQ201: 三力转债!
A202: 21 | B202: 123121 | C202: 帝尔转债! | D202: 300776 | E202: 帝尔激光 | F202: 机械装备 | G202: 专用设备 | H202: 142.5 | I202: 1.06e-002 | J202: -1.7399999999999999e-002 | K202: 205 | L202: -9.7999999999999997e-003 | M202: 121 | N202: 192.24 | O202: 0.33600000000000002 | P202: 106.64 | Q202: 2月16天 | R202: 5.69年 | S202: 3.69年 | T202: 8.4 | U202: 114 | V202: 9.6000000000000002e-002 | W202: 3.9e-002 | X202: 4.0999999999999995e-002 | Y202: 218 | Z202: 10.77 | AA202: -2.8900000000000002e-002 | AB202: -3.49e-002 | AC202: -7.9299999999999995e-002 | AD202: -8.1000000000000003e-002 | AE202: 82.34 | AF202: 86.13 | AG202: 0.69 | AH202: AA- | AI202: 6.2899999999999998e-002 | AJ202: =H202+100*O202 -> 176.09999999999999 | AK202: 178.4 | AL202: 285 | AM202: 92.2 | AN202: 288 | AO202: 0.187 | AP202: 5 | AQ202: 帝尔转债!
A203: 273 | B203: 128075 | C203: 远东转债! | D203: 2406 | E203: 远东传动 | F203: 汽车 | G203: 零部件制 | H203: 127.67 | I203: -6.5000000000000006e-003 | J203: 1.e-003 | K203: 5.89 | L203: -8.3999999999999995e-003 | M203: 114.3 | N203: 5.29 | O203: 0.14699999999999999 | P203: 111.34 | Q203: 已到 | R203: 3.82年 | S203: 1.82年 | T203: 5.44 | U203: 7.7 | V203: 1.1000000000000001e-002 | W203: 0.14800000000000002 | X203: 0.16500000000000001 | Y203: 37 | Z203: 1.12 | AA203: -2.8999999999999998e-002 | AB203: -3.5400000000000001e-002 | AC203: -0.10400000000000001 | AD203: -0.106 | AE203: 95.12 | AF203: 98.63 | AG203: 0.64 | AH203: AA | AI203: 4.0099999999999997e-002 | AJ203: =H203+100*O203 -> 142.37 | AK203: 144 | AL203: 60 | AM203: 45.4 | AN203: 50 | AO203: 1.1000000000000001e-002 | AP203: 16 | AQ203: 远东转债!
A204: 8 | B204: 127046 | C204: 百润转债 | D204: 2568 | E204: 百润股份 | F204: 食品饮料 | G204: 葡萄酒洋 | H204: 136.4 | I204: 2.e-003 | J204: -9.1999999999999998e-003 | K204: 59.9 | L204: -1.4199999999999999e-002 | M204: 115.1 | N204: 66.89 | O204: 0.52300000000000002 | P204: 89.55 | Q204: 4月16天 | R204: 5.84年 | S204: 3.84年 | T204: 11.3 | U204: 19 | V204: 1.2e-002 | W204: 2.5000000000000001e-002 | X204: 2.2000000000000002e-002 | Y204: 449 | Z204: 12.79 | AA204: -2.9100000000000001e-002 | AB204: -3.3500000000000002e-002 | AC204: -6.6799999999999998e-002 | AD204: -6.8400000000000002e-002 | AE204: 88.01 | AF204: 90.96 | AG204: 0.51 | AH204: AA | AI204: 4.1900000000000007e-002 | AJ204: =H204+100*O204 -> 188.70000000000002 | AK204: 183.2 | AL204: 291 | AM204: 92.3 | AN204: 289 | AO204: -5.7000000000000002e-002 | AP204: 3 | AQ204: 百润转债
A205: 4 | B205: 110082 | C205: 宏发转债 | D205: 600885 | E205: 宏发股份 | F205: 能源电力 | G205: 电力设备 | H205: 139.55 | I205: 6.0000000000000001e-003 | J205: -9.1999999999999998e-003 | K205: 73.11 | L205: -5.4000000000000003e-003 | M205: 117.1 | N205: 72.28 | O205: 0.38 | P205: 101.15 | Q205: 5月7天 | R205: 5.92年 | S205: 3.92年 | T205: 20 | U205: 272 | V205: 9.8000000000000004e-002 | W205: 3.7000000000000005e-002 | X205: 3.7000000000000005e-002 | Y205: 544 | Z205: 8.96 | AA205: -2.9700000000000001e-002 | AB205: -3.4500000000000003e-002 | AC205: -7.0800000000000002e-002 | AD205: -7.2300000000000003e-002 | AE205: 87.73 | AF205: 92.23 | AG205: 0.6 | AH205: AA | AI205: 4.1900000000000007e-002 | AJ205: =H205+100*O205 -> 177.55000000000001 | AK205: 178 | AL205: 280 | AM205: 85.7 | AN205: 279 | AO205: -3.7000000000000005e-002 | AP205: 2 | AQ205: 宏发转债
A206: 106 | B206: 127026 | C206: 超声转债! | D206: 823 | E206: 超声电子 | F206: 电子 | G206: 元器件制 | H206: 131.4 | I206: -5.3e-003 | J206: 2.8999999999999998e-003 | K206: 13.84 | L206: -3.5999999999999999e-003 | M206: 113.1 | N206: 12.72 | O206: 0.20800000000000002 | P206: 108.81 | Q206: 已到 | R206: 5年11天 | S206: 3年11天 | T206: 7 | U206: 38 | V206: 4.2000000000000003e-002 | W206: 9.4e-002 | X206: 0.10199999999999999 | Y206: 74 | Z206: 1.87 | AA206: -2.9900000000000003e-002 | AB206: -3.44e-002 | AC206: -7.2300000000000003e-002 | AD206: -7.4200000000000002e-002 | AE206: 90.98 | AF206: 92.4 | AG206: 0.67 | AH206: AA | AI206: 4.1900000000000007e-002 | AJ206: =H206+100*O206 -> 152.20000000000002 | AK206: 154 | AL206: 158 | AM206: 61.6 | AN206: 161 | AO206: 4.0999999999999995e-002 | AP206: 13 | AQ206: 超声转债!
A207: 211 | B207: 128106 | C207: 华统转债 | D207: 2840 | E207: 华统股份 | F207: 农业 | G207: 农产品加 | H207: 128.902 | I207: -7.000000000000001e-004 | J207: -1.2999999999999999e-003 | K207: 10.86 | L207: -2.8000000000000004e-003 | M207: 112.9 | N207: 9.37 | O207: 0.11199999999999999 | P207: 115.9 | Q207: 已到 | R207: 4.37年 | S207: 2.37年 | T207: 5.35 | U207: 7.6 | V207: 1.1000000000000001e-002 | W207: 0.11 | X207: 0.128 | Y207: 49 | Z207: 2.88 | AA207: -3.0499999999999999e-002 | AB207: -3.56e-002 | AC207: -8.4000000000000005e-002 | AD207: -8.6199999999999999e-002 | AE207: 93.69 | AF207: 95.44 | AG207: 0.72 | AH207: AA | AI207: 4.0099999999999997e-002 | AJ207: =H207+100*O207 -> 140.10199999999998 | AK207: 141.9 | AL207: 43 | AM207: 46.5 | AN207: 61 | AO207: 2.3e-002 | AP207: 11 | AQ207: 华统转债
A208: 11 | B208: 123125 | C208: 元力转债 | D208: 300174 | E208: 元力股份 | F208: 化工 | G208: 化工 | H208: 130.5 | I208: 3.9000000000000003e-003 | J208: 5.1000000000000004e-003 | K208: 18.15 | L208: 1.23e-002 | M208: 109.3 | N208: 17.61 | O208: 0.26600000000000001 | P208: 103.07 | Q208: 3月13天 | R208: 5.78年 | S208: 3.78年 | T208: 9 | U208: 23 | V208: 2.e-002 | W208: 0.159 | X208: 0.16399999999999998 | Y208: 57 | Z208: 3.23 | AA208: -3.0600000000000002e-002 | AB208: -3.3500000000000002e-002 | AC208: -5.9000000000000004e-002 | AD208: -6.0199999999999997e-002 | AE208: 80.92 | AF208: 77.24 | AG208: 0.73 | AH208: AA- | AI208: 6.2899999999999998e-002 | AJ208: =H208+100*O208 -> 157.09999999999999 | AK208: 157.9 | AL208: 177 | AM208: 77 | AN208: 251 | AO208: 8.3000000000000004e-002 | AP208: 3 | AQ208: 元力转债
A209: 179 | B209: 128119 | C209: 龙大转债! | D209: 2726 | E209: 龙大肉食 | F209: 食品饮料 | G209: 肉制品 | H209: 138.5 | I209: 5.1500000000000004e-002 | J209: 2.4900000000000002e-002 | K209: 12.11 | L209: 9.9900000000000003e-002 | M209: 119.9 | N209: 9.29 | O209: 6.2e-002 | P209: 130.36 | Q209: 已到 | R209: 4.62年 | S209: 2.62年 | T209: 9.46 | U209: 875 | V209: 0.65900000000000003 | W209: 7.2000000000000008e-002 | X209: 9.4e-002 | Y209: 131 | Z209: 3.23 | AA209: -3.1200000000000002e-002 | AB209: -3.8300000000000001e-002 | AC209: -0.10000000000000001 | AD209: -0.10099999999999999 | AE209: 92.75 | AF209: 100.32 | AG209: 0.76 | AH209: AA | AI209: 4.0099999999999997e-002 | AJ209: =H209+100*O209 -> 144.69999999999999 | AK209: 146.6 | AL209: 87 | AM209: 46.3 | AN209: 59 | AO209: 0.17899999999999999 | AP209: 8 | AQ209: 龙大转债!
A210: 370 | B210: 128014 | C210: 永东转债! | D210: 2753 | E210: 永东股份 | F210: 化工 | G210: 化工 | H210: 114.72 | I210: 7.8000000000000005e-003 | J210: -7.7000000000000002e-003 | K210: 8.99 | L210: 1.1000000000000001e-003 | M210: 109.8 | N210: 12.52 | O210: 0.59799999999999998 | P210: 71.81 | Q210: 已到 | R210: 1.39年 | S210: 回售内 | T210: 3.37 | U210: 8.6 | V210: 2.2000000000000002e-002 | W210: 0.10000000000000001 | X210: 7.2000000000000008e-002 | Y210: 34 | Z210: 1.61 | AA210: -3.15e-002 | AB210: -4.4000000000000004e-002 | AC210: 回售内 | AD210: 回售内 | AE210: 100.3 | AF210: 101.4 | AG210: 0.07 | AH210: AA- | AI210: 5.9800000000000006e-002 | AJ210: =H210+100*O210 -> 174.51999999999998 | AK210: 157.6 | AL210: 173 | AM210: 56.2 | AN210: 130 | AO210: 6.7000000000000004e-002 | AP210: 36 | AQ210: 永东转债!
A211: 216 | B211: 113575 | C211: 东时转债!! | D211: 603377 | E211: 东方时尚 | F211: 其他 | G211: 其他 | H211: 129.73 | I211: 1.4000000000000002e-003 | J211: -8.9999999999999998e-004 | K211: 8.58 | L211: 2.3e-003 | M211: 113.1 | N211: 12.15 | O211: 0.83700000000000008 | P211: 70.62 | Q211: 已到 | R211: 4.36年 | S211: 2.36年 | T211: 0.98 | U211: 25 | V211: 0.19500000000000001 | W211: 1.6e-002 | X211: 1.1000000000000001e-002 | Y211: 62 | Z211: 2.88 | AA211: -3.1600000000000003e-002 | AB211: -3.6699999999999997e-002 | AC211: -8.6300000000000002e-002 | AD211: -8.8599999999999998e-002 | AE211: 93.73 | AF211: 95.63 | AG211: 0.21 | AH211: AA | AI211: 4.0099999999999997e-002 | AJ211: =H211+100*O211 -> 213.43000000000001 | AK211: 188.8 | AL211: 298 | AM211: 93.2 | AN211: 291 | AO211: 3.6000000000000004e-002 | AP211: 13 | AQ211: 东时转债!!
A212: 53 | B212: 123112 | C212: 万讯转债! | D212: 300112 | E212: 万讯自控 | F212: 机械装备 | G212: 专用设备 | H212: 147.68 | I212: -8.8999999999999999e-003 | J212: 8.8999999999999999e-003 | K212: 12.2 | L212: 0. | M212: 124.4 | N212: 8.93 | O212: 8.1000000000000003e-002 | P212: 136.62 | Q212: 已到 | R212: 5.36年 | S212: 3.36年 | T212: 2.46 | U212: 89 | V212: 0.24399999999999999 | W212: 7.0000000000000007e-002 | X212: 9.6000000000000002e-002 | Y212: 35 | Z212: 3.21 | AA212: -3.2099999999999997e-002 | AB212: -3.9300000000000002e-002 | AC212: -9.4700000000000006e-002 | AD212: -9.6600000000000005e-002 | AE212: 84.33 | AF212: 90.36 | AG212: 0.79 | AH212: AA- | AI212: 6.2899999999999998e-002 | AJ212: =H212+100*O212 -> 155.78 | AK212: 158.7 | AL212: 182 | AM212: 68.4 | AN212: 206 | AO212: 2.7999999999999997e-002 | AP212: 14 | AQ212: 万讯转债!
A213: 41 | B213: 127036 | C213: 三花转债 | D213: 2050 | E213: 三花智控 | F213: 机械装备 | G213: 通用设备 | H213: 136.68 | I213: -6.7000000000000002e-003 | J213: 3.4000000000000002e-003 | K213: 23.22 | L213: -5.1000000000000004e-003 | M213: 114.5 | N213: 21.55 | O213: 0.26800000000000002 | P213: 107.75 | Q213: 10天 | R213: 5.51年 | S213: 3.51年 | T213: 30 | U213: 52 | V213: 1.3000000000000001e-002 | W213: 3.6000000000000004e-002 | X213: 3.9e-002 | Y213: 834 | Z213: 8.07 | AA213: -3.2099999999999997e-002 | AB213: -3.6499999999999998e-002 | AC213: -7.4400000000000008e-002 | AD213: -7.5800000000000006e-002 | AE213: 90.23 | AF213: 94.06 | AG213: 0.64 | AH213: AA+ | AI213: 3.6900000000000002e-002 | AJ213: =H213+100*O213 -> 163.48000000000002 | AK213: 165.6 | AL213: 235 | AM213: 71.5 | AN213: 225 | AO213: -3.4000000000000002e-002 | AP213: 6 | AQ213: 三花转债
A214: 246 | B214: 128090 | C214: 汽模转2 | D214: 2510 | E214: 天汽模 | F214: 汽车 | G214: 零部件制 | H214: 131.193 | I214: -3.4999999999999996e-003 | J214: 5.9999999999999995e-004 | K214: 4.57 | L214: -4.4000000000000003e-003 | M214: 114.9 | N214: 4.23 | O214: 0.214 | P214: 108.04 | Q214: 已到 | R214: 4年30天 | S214: 2年30天 | T214: 3.1 | U214: 180 | V214: 0.441 | W214: 7.2000000000000008e-002 | X214: 7.8e-002 | Y214: 43 | Z214: 2.11 | AA214: -3.2599999999999997e-002 | AB214: -3.8800000000000001e-002 | AC214: -0.10099999999999999 | AD214: -0.10400000000000001 | AE214: 90.64 | AF214: 90.71 | AG214: 0.67 | AH214: AA- | AI214: 6.1100000000000002e-002 | AJ214: =H214+100*O214 -> 152.59300000000002 | AK214: 154.3 | AL214: 159 | AM214: 63.6 | AN214: 172 | AO214: 5.0000000000000001e-003 | AP214: 29 | AQ214: 汽模转2
A215: 136 | B215: 110075 | C215: 南航转债 | D215: 600029 | E215: 南方航空 | F215: 交通运输 | G215: 航空运输 | H215: 129.37 | I215: -3.4000000000000002e-003 | J215: -4.8999999999999998e-003 | K215: 6.44 | L215: -1.38e-002 | M215: 109.8 | N215: 6.24 | O215: 0.254 | P215: 103.21 | Q215: 已到 | R215: 4.88年 | S215: 2.88年 | T215: 59 | U215: 80 | V215: 1.1000000000000001e-002 | W215: 5.4000000000000006e-002 | X215: 5.5999999999999994e-002 | Y215: 1091. | Z215: 1.48 | AA215: -3.3399999999999999e-002 | AB215: -3.6900000000000002e-002 | AC215: -7.51e-002 | AD215: -7.6299999999999993e-002 | AE215: 92.45 | AF215: 93.85 | AG215: 0.6 | AH215: AAA | AI215: 3.3099999999999997e-002 | AJ215: =H215+100*O215 -> 154.77000000000001 | AK215: 155.5 | AL215: 165 | AM215: 61.7 | AN215: 162 | AO215: -2.6000000000000002e-002 | AP215: 8 | AQ215: 南航转债
A216: 76 | B216: 123100 | C216: 朗科转债 | D216: 300543 | E216: 朗科智能 | F216: 电子 | G216: 电子产品 | H216: 140.38 | I216: -1.55e-002 | J216: 1.4999999999999999e-002 | K216: 14.65 | L216: -7.000000000000001e-004 | M216: 117.5 | N216: 11.61 | O216: 0.11199999999999999 | P216: 126.18 | Q216: 已到 | R216: 5.20年 | S216: 3.20年 | T216: 3.8 | U216: 34 | V216: 6.4000000000000001e-002 | W216: 9.6999999999999989e-002 | X216: 0.122 | Y216: 39 | Z216: 4.15 | AA216: -3.4300000000000004e-002 | AB216: -3.9800000000000002e-002 | AC216: -8.6400000000000005e-002 | AD216: -8.8200000000000001e-002 | AE216: 84.74 | AF216: 86.15 | AG216: 0.79 | AH216: AA- | AI216: 6.2899999999999998e-002 | AJ216: =H216+100*O216 -> 151.57999999999998 | AK216: 154.6 | AL216: 161 | AM216: 68.4 | AN216: 207 | AO216: 6.9999999999999993e-003 | AP216: 9 | AQ216: 朗科转债
A217: 116 | B217: 110077 | C217: 洪城转债 | D217: 600461 | E217: 洪城环境 | F217: 城市公用 | G217: 城市公用 | H217: 134.78 | I217: 1.49e-002 | J217: -7.4999999999999997e-003 | K217: 8.08 | L217: 1.e-002 | M217: 113.3 | N217: 6.71 | O217: 0.11900000000000001 | P217: 120.42 | Q217: 已到 | R217: 4.98年 | S217: 2.98年 | T217: 17.7 | U217: 56 | V217: 2.4e-002 | W217: 0.23000000000000001 | X217: 0.27699999999999997 | Y217: 77 | Z217: 1.42 | AA217: -3.4599999999999999e-002 | AB217: -3.9199999999999999e-002 | AC217: -8.4900000000000003e-002 | AD217: -8.5999999999999993e-002 | AE217: 91.6 | AF217: 95.61 | AG217: 0.74 | AH217: AA+ | AI217: 3.5099999999999999e-002 | AJ217: =H217+100*O217 -> 146.68000000000001 | AK217: 149.1 | AL217: 114 | AM217: 53.5 | AN217: 112 | AO217: -1.7000000000000001e-002 | AP217: 7 | AQ217: 洪城转债
A218: 294 | B218: 113024 | C218: 核建转债! | D218: 601611 | E218: 中国核建 | F218: 建筑 | G218: 建筑工程 | H218: 122.82 | I218: -1.1299999999999999e-002 | J218: -1.7000000000000001e-003 | K218: 9.34 | L218: -2.6099999999999998e-002 | M218: 109.3 | N218: 9.7 | O218: 0.27600000000000002 | P218: 96.29 | Q218: 已到 | R218: 3.36年 | S218: 1.36年 | T218: 30 | U218: 17 | V218: 4.0000000000000001e-003 | W218: 0.121 | X218: 0.11699999999999999 | Y218: 247 | Z218: 1.99 | AA218: -3.4799999999999998e-002 | AB218: -3.9699999999999999e-002 | AC218: -0.111 | AD218: -0.10199999999999999 | AE218: 97.85 | AF218: 98.2 | AG218: 0.5 | AH218: AAA | AI218: 3.3099999999999997e-002 | AJ218: =H218+100*O218 -> 150.41999999999999 | AK218: 149.4 | AL218: 116 | AM218: 51.1 | AN218: 99 | AO218: 4.4999999999999998e-002 | AP218: 32 | AQ218: 核建转债!
A219: 224 | B219: 123045 | C219: 雷迪转债 | D219: 300652 | E219: 雷迪克 | F219: 汽车 | G219: 零部件制 | H219: 138.3 | I219: -2.4700000000000003e-002 | J219: -6.8999999999999999e-003 | K219: 23.2 | L219: -4.2900000000000001e-002 | M219: 118.9 | N219: 19.63 | O219: 0.17000000000000001 | P219: 118.19 | Q219: 已到 | R219: 4.29年 | S219: 2.29年 | T219: 1.66 | U219: 470 | V219: 1.99 | W219: 7.5999999999999998e-002 | X219: 8.9999999999999997e-002 | Y219: 22 | Z219: 2.29 | AA219: -3.5400000000000001e-002 | AB219: -4.2699999999999995e-002 | AC219: -0.11 | AD219: -0.11199999999999999 | AE219: 87.91 | AF219: 88.9 | AG219: 0.74 | AH219: A+ | AI219: 7.2099999999999997e-002 | AJ219: =H219+100*O219 -> 155.30000000000001 | AK219: 158.4 | AL219: 179 | AM219: 69.5 | AN219: 211 | AO219: 3.4000000000000002e-002 | AP219: 34 | AQ219: 雷迪转债
A220: 155 | B220: 113600 | C220: 新星转债!! | D220: 603978 | E220: 深圳新星 | F220: 有色金属 | G220: 有色行业 | H220: 148.37 | I220: 1.44e-002 | J220: 8.6999999999999994e-003 | K220: 30.9 | L220: 3.1e-002 | M220: 125.6 | N220: 23.85 | O220: 0.14499999999999999 | P220: 129.56 | Q220: 已到 | R220: 4.71年 | S220: 2.71年 | T220: 4.53 | U220: 443 | V220: 0.65500000000000003 | W220: 8.9999999999999997e-002 | X220: 0.11599999999999999 | Y220: 50 | Z220: 3.25 | AA220: -3.5400000000000001e-002 | AB220: -4.3899999999999995e-002 | AC220: -0.11699999999999999 | AD220: -0.11900000000000001 | AE220: 87.42 | AF220: 95.52 | AG220: 0.74 | AH220: AA- | AI220: 6.1100000000000002e-002 | AJ220: =H220+100*O220 -> 162.87 | AK220: 167.2 | AL220: 247 | AM220: 71.7 | AN220: 226 | AO220: 5.5999999999999994e-002 | AP220: 26 | AQ220: 新星转债!!
A221: 5 | B221: 113630 | C221: 赛伍转债 | D221: 603212 | E221: 赛伍技术 | F221: 能源电力 | G221: 太阳能 | H221: 148.69 | I221: 5.4400000000000004e-002 | J221: 1.8700000000000001e-002 | K221: 37.55 | L221: 9.9900000000000003e-002 | M221: 120.5 | N221: 32.9 | O221: 0.30299999999999999 | P221: 114.13 | Q221: 5月6天 | R221: 5.92年 | S221: 3.92年 | T221: 7 | U221: 623 | V221: 0.59599999999999997 | W221: 4.7e-002 | X221: 5.2999999999999999e-002 | Y221: 150 | Z221: 7.54 | AA221: -3.5499999999999997e-002 | AB221: -4.1100000000000005e-002 | AC221: -8.48e-002 | AD221: -8.6400000000000005e-002 | AE221: 81.14 | AF221: 84.58 | AG221: 0.73 | AH221: AA- | AI221: 6.2899999999999998e-002 | AJ221: =H221+100*O221 -> 178.99000000000001 | AK221: 183.2 | AL221: 290 | AM221: 98.7 | AN221: 301 | AO221: 0.11900000000000001 | AP221: 2 | AQ221: 赛伍转债
A222: 91 | B222: 123091 | C222: 长海转债 | D222: 300196 | E222: 长海股份 | F222: 其他 | G222: 非金属矿 | H222: 139.15 | I222: -3.4000000000000002e-003 | J222: -2.5999999999999999e-003 | K222: 18.62 | L222: -8.5000000000000006e-003 | M222: 116.2 | N222: 16.14 | O222: 0.20600000000000002 | P222: 115.37 | Q222: 已到 | R222: 5年26天 | S222: 3年26天 | T222: 5.5 | U222: 8.8 | V222: 1.1000000000000001e-002 | W222: 7.2000000000000008e-002 | X222: 8.3000000000000004e-002 | Y222: 76 | Z222: 2.35 | AA222: -3.56e-002 | AB222: -4.0899999999999999e-002 | AC222: -8.7599999999999997e-002 | AD222: -8.9399999999999993e-002 | AE222: 90.93 | AF222: 94.78 | AG222: 0.71 | AH222: AA | AI222: 4.1900000000000007e-002 | AJ222: =H222+100*O222 -> 159.75 | AK222: 162.9 | AL222: 216 | AM222: 68.2 | AN222: 204 | AO222: 5.5999999999999994e-002 | AP222: 4 | AQ222: 长海转债
A223: 197 | B223: 123052 | C223: 飞鹿转债! | D223: 300665 | E223: 飞鹿股份 | F223: 化工 | G223: 化工 | H223: 149.2 | I223: -5.9999999999999995e-004 | J223: 3.8e-003 | K223: 9.59 | L223: 4.1999999999999997e-003 | M223: 126.8 | N223: 7.05 | O223: 9.6999999999999989e-002 | P223: 136.03 | Q223: 已到 | R223: 4.52年 | S223: 2.52年 | T223: 1.5 | U223: 69 | V223: 0.30599999999999999 | W223: 8.9999999999999997e-002 | X223: 0.12300000000000001 | Y223: 17 | Z223: 3.26 | AA223: -3.6200000000000003e-002 | AB223: -4.5400000000000003e-002 | AC223: -0.12300000000000001 | AD223: -0.126 | AE223: 87.07 | AF223: 93.35 | AG223: 0.77 | AH223: A+ | AI223: 7.2099999999999997e-002 | AJ223: =H223+100*O223 -> 158.89999999999998 | AK223: 162.4 | AL223: 211 | AM223: 69 | AN223: 209 | AO223: 4.7e-002 | AP223: 23 | AQ223: 飞鹿转债!
A224: 289 | B224: 110058 | C224: 永鼎转债! | D224: 600105 | E224: 永鼎股份 | F224: 通信互联 | G224: 通信设备 | H224: 129.26 | I224: -5.1999999999999998e-003 | J224: -1.2699999999999999e-002 | K224: 5.79 | L224: -2.53e-002 | M224: 114.3 | N224: 5.04 | O224: 0.125 | P224: 114.88 | Q224: 已到 | R224: 3.38年 | S224: 1.38年 | T224: 2.61 | U224: 215 | V224: 0.627 | W224: 3.3000000000000002e-002 | X224: 3.7999999999999999e-002 | Y224: 80 | Z224: 2.85 | AA224: -3.6400000000000002e-002 | AB224: -4.36e-002 | AC224: -0.124 | AD224: -0.126 | AE224: 93.85 | AF224: 93.92 | AG224: 0.71 | AH224: AA- | AI224: 6.1100000000000002e-002 | AJ224: =H224+100*O224 -> 141.75999999999999 | AK224: 143.6 | AL224: 58 | AM224: 49.7 | AN224: 89 | AO224: 0.14699999999999999 | AP224: 46 | AQ224: 永鼎转债!
A225: 148 | B225: 113602 | C225: 景20转债! | D225: 603228 | E225: 景旺电子 | F225: 电子 | G225: 元器件制 | H225: 134.24 | I225: -2.8999999999999998e-003 | J225: -2.3799999999999998e-002 | K225: 29.7 | L225: -4.0399999999999998e-002 | M225: 112.9 | N225: 27.4 | O225: 0.23800000000000002 | P225: 108.39 | Q225: 已到 | R225: 4.74年 | S225: 2.74年 | T225: 17.8 | U225: 45 | V225: 1.9e-002 | W225: 7.0000000000000007e-002 | X225: 7.5999999999999998e-002 | Y225: 253 | Z225: 3.75 | AA225: -3.6499999999999998e-002 | AB225: -4.1200000000000001e-002 | AC225: -8.6500000000000007e-002 | AD225: -8.8399999999999992e-002 | AE225: 92.33 | AF225: 94.05 | AG225: 0.66 | AH225: AA | AI225: 4.0099999999999997e-002 | AJ225: =H225+100*O225 -> 158.04000000000002 | AK225: 160.1 | AL225: 191 | AM225: 66 | AN225: 192 | AO225: 2.1000000000000001e-002 | AP225: 9 | AQ225: 景20转债!
A226: 64 | B226: 128145 | C226: 日丰转债 | D226: 2953 | E226: 日丰股份 | F226: 家电 | G226: 零部件制 | H226: 141.5 | I226: -9.7999999999999997e-003 | J226: 1.0700000000000001e-002 | K226: 18.63 | L226: 1.1000000000000001e-003 | M226: 115.4 | N226: 13.66 | O226: 3.7999999999999999e-002 | P226: 136.38 | Q226: 已到 | R226: 5.32年 | S226: 3.32年 | T226: 3.8 | U226: 272 | V226: 0.505 | W226: 8.4000000000000005e-002 | X226: 0.114 | Y226: 45 | Z226: 3.97 | AA226: -3.8300000000000001e-002 | AB226: -4.3200000000000002e-002 | AC226: -8.5999999999999993e-002 | AD226: -8.7799999999999989e-002 | AE226: 84.07 | AF226: 84.02 | AG226: 0.84 | AH226: AA- | AI226: 6.2899999999999998e-002 | AJ226: =H226+100*O226 -> 145.30000000000001 | AK226: 146.6 | AL226: 86 | AM226: 62.6 | AN226: 167 | AO226: 6.9000000000000006e-002 | AP226: 11 | AQ226: 日丰转债
A227: 138 | B227: 128134 | C227: 鸿路转债! | D227: 2541 | E227: 鸿路钢构 | F227: 建筑 | G227: 其他建材 | H227: 138.5 | I227: 1.0200000000000001e-002 | J227: -1.3100000000000001e-002 | K227: 48.46 | L227: -4.3e-003 | M227: 114.8 | N227: 43.51 | O227: 0.24399999999999999 | P227: 111.38 | Q227: 已到 | R227: 4.87年 | S227: 2.87年 | T227: 15.7 | U227: 11 | V227: 5.0000000000000001e-003 | W227: 6.0999999999999999e-002 | X227: 6.8000000000000005e-002 | Y227: 257 | Z227: 3.87 | AA227: -3.85e-002 | AB227: -4.36e-002 | AC227: -9.2699999999999991e-002 | AD227: -9.4499999999999987e-002 | AE227: 91.77 | AF227: 95.14 | AG227: 0.67 | AH227: AA | AI227: 4.0099999999999997e-002 | AJ227: =H227+100*O227 -> 162.90000000000001 | AK227: 165.6 | AL227: 236 | AM227: 70.5 | AN227: 219 | AO227: 3.2000000000000001e-002 | AP227: 4 | AQ227: 鸿路转债!
A228: 74 | B228: 128144 | C228: 利民转债! | D228: 2734 | E228: 利民股份 | F228: 化工 | G228: 农化 | H228: 139.812 | I228: 5.7999999999999996e-003 | J228: 1.e-004 | K228: 13.26 | L228: 8.3999999999999995e-003 | M228: 114.1 | N228: 11.5 | O228: 0.21299999999999999 | P228: 115.3 | Q228: 已到 | R228: 5.26年 | S228: 3.26年 | T228: 9.8 | U228: 168 | V228: 0.12300000000000001 | W228: 0.19800000000000001 | X228: 0.22899999999999998 | Y228: 49 | Z228: 1.96 | AA228: -3.85e-002 | AB228: -4.2999999999999997e-002 | AC228: -8.6400000000000005e-002 | AD228: -8.77e-002 | AE228: 89.47 | AF228: 92.28 | AG228: 0.71 | AH228: AA | AI228: 4.1900000000000007e-002 | AJ228: =H228+100*O228 -> 161.11200000000002 | AK228: 164.3 | AL228: 227 | AM228: 72 | AN228: 228 | AO228: 0.20000000000000001 | AP228: 6 | AQ228: 利民转债!
A229: 174 | B229: 113593 | C229: 沪工转债! | D229: 603131 | E229: 上海沪工 | F229: 机械装备 | G229: 通用设备 | H229: 144.96 | I229: -4.0999999999999995e-003 | J229: -4.5999999999999999e-003 | K229: 26.6 | L229: -1.1200000000000002e-002 | M229: 121.2 | N229: 21.12 | O229: 0.151 | P229: 125.95 | Q229: 已到 | R229: 4.64年 | S229: 2.64年 | T229: 4 | U229: 16 | V229: 2.7999999999999997e-002 | W229: 4.7e-002 | X229: 5.9999999999999998e-002 | Y229: 85 | Z229: 6.37 | AA229: -3.8599999999999995e-002 | AB229: -4.5899999999999996e-002 | AC229: -0.11 | AD229: -0.113 | AE229: 85.85 | AF229: 88.4 | AG229: 0.77 | AH229: A+ | AI229: 7.2099999999999997e-002 | AJ229: =H229+100*O229 -> 160.06 | AK229: 164 | AL229: 224 | AM229: 75.6 | AN229: 246 | AO229: 9.6000000000000002e-002 | AP229: 10 | AQ229: 沪工转债!
A230: 275 | B230: 128073 | C230: 哈尔转债! | D230: 2615 | E230: 哈尔斯 | F230: 其他 | G230: 家居用品 | H230: 127.6 | I230: -1.03e-002 | J230: 3.3e-003 | K230: 6.27 | L230: -1.1000000000000001e-002 | M230: 114.5 | N230: 5.71 | O230: 0.16200000000000001 | P230: 109.81 | Q230: 已到 | R230: 2.73年 | S230: 0.73年 | T230: 2.99 | U230: 24 | V230: 6.2e-002 | W230: 0.11599999999999999 | X230: 0.127 | Y230: 26 | Z230: 3.01 | AA230: -3.9300000000000002e-002 | AB230: -4.82e-002 | AC230: -0.23199999999999998 | AD230: -0.23399999999999999 | AE230: 96.1 | AF230: 97.87 | AG230: 0.63 | AH230: AA- | AI230: 5.9800000000000006e-002 | AJ230: =H230+100*O230 -> 143.79999999999998 | AK230: 145.4 | AL230: 74 | AM230: 47.5 | AN230: 71 | AO230: 5.7999999999999996e-002 | AP230: 37 | AQ230: 哈尔转债!
A231: 122 | B231: 128137 | C231: 洁美转债 | D231: 2859 | E231: 洁美科技 | F231: 电子 | G231: 元器件制 | H231: 142.15 | I231: -9.3999999999999986e-003 | J231: 1.9400000000000001e-002 | K231: 33.54 | L231: 1.3000000000000001e-002 | M231: 116.9 | N231: 27.63 | O231: 0.17100000000000001 | P231: 121.39 | Q231: 已到 | R231: 4.94年 | S231: 2.94年 | T231: 5.99 | U231: 24 | V231: 2.7999999999999997e-002 | W231: 4.4000000000000004e-002 | X231: 5.2999999999999999e-002 | Y231: 138 | Z231: 6.98 | AA231: -3.95e-002 | AB231: -4.5100000000000001e-002 | AC231: -9.8100000000000007e-002 | AD231: -9.9900000000000003e-002 | AE231: 86.15 | AF231: 87.71 | AG231: 0.77 | AH231: AA- | AI231: 6.1100000000000002e-002 | AJ231: =H231+100*O231 -> 159.25 | AK231: 162.9 | AL231: 215 | AM231: 75.2 | AN231: 242 | AO231: 9.5000000000000001e-002 | AP231: 5 | AQ231: 洁美转债
A232: 196 | B232: 123053 | C232: 宝通转债!! | D232: 300031 | E232: 宝通科技 | F232: 通信互联 | G232: 互联网 | H232: 144.8 | I232: -1.06e-002 | J232: 1.1200000000000002e-002 | K232: 26.13 | L232: 8.0000000000000004e-004 | M232: 120.8 | N232: 20.5 | O232: 0.13600000000000001 | P232: 127.46 | Q232: 已到 | R232: 4.52年 | S232: 2.52年 | T232: 4.99 | U232: 909 | V232: 1.25 | W232: 4.8000000000000001e-002 | X232: 6.0999999999999999e-002 | Y232: 104 | Z232: 3.28 | AA232: -4.0099999999999997e-002 | AB232: -4.7500000000000001e-002 | AC232: -0.11699999999999999 | AD232: -0.11900000000000001 | AE232: 88.6 | AF232: 92.96 | AG232: 0.76 | AH232: AA- | AI232: 6.1100000000000002e-002 | AJ232: =H232+100*O232 -> 158.40000000000001 | AK232: 162.1 | AL232: 210 | AM232: 69.2 | AN232: 210 | AO232: -3.4000000000000002e-002 | AP232: 12 | AQ232: 宝通转债!!
A233: 245 | B233: 128091 | C233: 新天转债 | D233: 2873 | E233: 新天药业 | F233: 医药 | G233: 中药 | H233: 140.951 | I233: -8.4700000000000011e-002 | J233: 6.3799999999999996e-002 | K233: 14.42 | L233: -2.7000000000000003e-002 | M233: 119.4 | N233: 11.62 | O233: 0.13600000000000001 | P233: 124.1 | Q233: 已到 | R233: 4年33天 | S233: 2年33天 | T233: 1.76 | U233: 1103. | V233: 4.2999999999999998 | W233: 7.400000000000001e-002 | X233: 9.1999999999999998e-002 | Y233: 24 | Z233: 1.94 | AA233: -4.0800000000000003e-002 | AB233: -4.8499999999999995e-002 | AC233: -0.125 | AD233: -0.128 | AE233: 89.52 | AF233: 90.59 | AG233: 0.78 | AH233: A+ | AI233: 7.2099999999999997e-002 | AJ233: =H233+100*O233 -> 154.55099999999999 | AK233: 157.8 | AL233: 175 | AM233: 67.2 | AN233: 198 | AO233: -8.4000000000000005e-002 | AP233: 21 | AQ233: 新天转债
A234: 315 | B234: 128053 | C234: 尚荣转债! | D234: 2551 | E234: 尚荣医疗 | F234: 医药 | G234: 医疗器械 | H234: 130.51 | I234: -1.32e-002 | J234: 1.32e-002 | K234: 4.85 | L234: -1.8200000000000001e-002 | M234: 114.3 | N234: 4.88 | O234: 0.313 | P234: 99.39 | Q234: 已到 | R234: 3.22年 | S234: 1.22年 | T234: 1.91 | U234: 184 | V234: 0.73599999999999999 | W234: 4.7e-002 | X234: 4.5999999999999999e-002 | Y234: 41 | Z234: 1.3 | AA234: -4.1200000000000001e-002 | AB234: -4.87e-002 | AC234: -0.14699999999999999 | AD234: -0.14999999999999999 | AE234: 97.41 | AF234: 100.99 | AG234: 0 | AH234: AA | AI234: 4.0099999999999997e-002 | AJ234: =H234+100*O234 -> 161.81 | AK234: 161.6 | AL234: 207 | AM234: 60.6 | AN234: 152 | AO234: 2.9999999999999999e-002 | AP234: 21 | AQ234: 尚荣转债!
A235: 15 | B235: 127045 | C235: 牧原转债 | D235: 2714 | E235: 牧原股份 | F235: 农业 | G235: 畜牧业 | H235: 140.9 | I235: -8.3999999999999995e-003 | J235: -7.0999999999999995e-003 | K235: 54.65 | L235: -2.2000000000000002e-002 | M235: 111.1 | N235: 47.91 | O235: 0.23499999999999999 | P235: 114.07 | Q235: 2月26天 | R235: 5.72年 | S235: 3.72年 | T235: 95.5 | U235: 61 | V235: 5.0000000000000001e-003 | W235: 3.3000000000000002e-002 | X235: 3.7999999999999999e-002 | Y235: 2876. | Z235: 5.46 | AA235: -4.1200000000000001e-002 | AB235: -4.4600000000000001e-002 | AC235: -7.8200000000000006e-002 | AD235: -7.9500000000000001e-002 | AE235: 89.43 | AF235: 90.58 | AG235: 0.71 | AH235: AA+ | AI235: 3.6900000000000002e-002 | AJ235: =H235+100*O235 -> 164.40000000000001 | AK235: 167.7 | AL235: 249 | AM235: 77.1 | AN235: 252 | AO235: -5.2999999999999999e-002 | AP235: 9 | AQ235: 牧原转债
A236: 44 | B236: 111000 | C236: 起帆转债 | D236: 605222 | E236: 起帆电缆 | F236: 能源电力 | G236: 电力设备 | H236: 151.86 | I236: -3.3e-003 | J236: -2.3e-003 | K236: 27.58 | L236: -6.8000000000000005e-003 | M236: 120.5 | N236: 20.1 | O236: 0.107 | P236: 137.21 | Q236: 2.5天 | R236: 5.49年 | S236: 3.49年 | T236: 10 | U236: 182 | V236: 0.12 | W236: 8.6999999999999994e-002 | X236: 0.11900000000000001 | Y236: 115 | Z236: 3.32 | AA236: -4.2000000000000003e-002 | AB236: -4.8000000000000001e-002 | AC236: -9.9600000000000008e-002 | AD236: -0.10099999999999999 | AE236: 83.28 | AF236: 86.81 | AG236: 0.82 | AH236: AA- | AI236: 6.2899999999999998e-002 | AJ236: =H236+100*O236 -> 162.56 | AK236: 166.5 | AL236: 243 | AM236: 79.7 | AN236: 263 | AO236: 5.5e-002 | AP236: 10 | AQ236: 起帆转债
A237: 96 | B237: 113614 | C237: 健20转债!! | D237: 603707 | E237: 健友股份 | F237: 医药 | G237: 原料药 | H237: 141.6 | I237: -9.1000000000000004e-003 | J237: 5.0000000000000001e-003 | K237: 41.45 | L237: -4.0999999999999995e-003 | M237: 114.2 | N237: 29.12 | O237: -5.0000000000000001e-003 | P237: 142.34 | Q237: 已到 | R237: 5年20天 | S237: 3年20天 | T237: 4.81 | U237: 140 | V237: 0.20499999999999999 | W237: 1.e-002 | X237: 1.3999999999999999e-002 | Y237: 504 | Z237: 11.75 | AA237: -4.24e-002 | AB237: -4.7100000000000003e-002 | AC237: -9.3000000000000013e-002 | AD237: -9.4800000000000009e-002 | AE237: 90.99 | AF237: 93.22 | AG237: 1 | AH237: AA | AI237: 4.1900000000000007e-002 | AJ237: =H237+100*O237 -> 141.09999999999999 | AK237: 140.9 | AL237: 34 | AM237: 47.6 | AN237: 73 | AO237: 1.3000000000000001e-002 | AP237: 4 | AQ237: 健20转债!!
A238: 67 | B238: 127029 | C238: 中钢转债! | D238: 928 | E238: 中钢国际 | F238: 建筑 | G238: 建筑工程 | H238: 147.97 | I238: 2.2200000000000001e-002 | J238: -1.7000000000000001e-003 | K238: 8 | L238: 2.5600000000000001e-002 | M238: 117.5 | N238: 5.79 | O238: 7.0999999999999994e-002 | P238: 138.17 | Q238: 已到 | R238: 5.31年 | S238: 3.31年 | T238: 8.2 | U238: 169 | V238: 0.14000000000000001 | W238: 8.0000000000000002e-002 | X238: 0.111 | Y238: 102 | Z238: 1.71 | AA238: -4.3099999999999999e-002 | AB238: -4.8499999999999995e-002 | AC238: -9.9499999999999991e-002 | AD238: -0.10099999999999999 | AE238: 90.89 | AF238: 97.23 | AG238: 0.8 | AH238: AA+ | AI238: 3.6900000000000002e-002 | AJ238: =H238+100*O238 -> 155.06999999999999 | AK238: 157.8 | AL238: 174 | AM238: 60.5 | AN238: 150 | AO238: 9.3000000000000013e-002 | AP238: 13 | AQ238: 中钢转债!
A239: 39 | B239: 123115 | C239: 捷捷转债 | D239: 300623 | E239: 捷捷微电 | F239: 电子 | G239: 元器件制 | H239: 150.527 | I239: -2.5000000000000001e-003 | J239: -7.0999999999999995e-003 | K239: 34.7 | L239: -1.2500000000000001e-002 | M239: 118.5 | N239: 29 | O239: 0.25800000000000001 | P239: 119.66 | Q239: 18天 | R239: 5.53年 | S239: 3.53年 | T239: 12 | U239: 146 | V239: 8.199999999999999e-002 | W239: 4.7e-002 | X239: 5.5999999999999994e-002 | Y239: 256 | Z239: 8.99 | AA239: -4.3099999999999999e-002 | AB239: -4.8499999999999995e-002 | AC239: -9.64e-002 | AD239: -9.8000000000000004e-002 | AE239: 83.07 | AF239: 85.17 | AG239: 0.76 | AH239: AA- | AI239: 6.2899999999999998e-002 | AJ239: =H239+100*O239 -> 176.327 | AK239: 181.4 | AL239: 286 | AM239: 96.2 | AN239: 299 | AO239: 7.6999999999999999e-002 | AP239: 7 | AQ239: 捷捷转债
A240: 302 | B240: 123024 | C240: 岱勒转债! | D240: 300700 | E240: 岱勒新材 | F240: 机械装备 | G240: 专用设备 | H240: 124.5 | I240: 3.2000000000000002e-003 | J240: -4.0000000000000001e-003 | K240: 13.9 | L240: -1.4000000000000002e-003 | M240: 112.5 | N240: 14.1 | O240: 0.26300000000000001 | P240: 98.58 | Q240: 已到 | R240: 2.31年 | S240: 0.31年 | T240: 2.1 | U240: 9.9 | V240: 3.7999999999999999e-002 | W240: 0.14099999999999999 | X240: 0.13900000000000001 | Y240: 15 | Z240: 3.14 | AA240: -4.3400000000000001e-002 | AB240: -5.2699999999999997e-002 | AC240: -0.41299999999999998 | AD240: -0.41700000000000004 | AE240: 98 | AF240: 96.26 | AG240: 0.52 | AH240: A+ | AI240: 7.0800000000000002e-002 | AJ240: =H240+100*O240 -> 150.80000000000001 | AK240: 150.4 | AL240: 127 | AM240: 52.4 | AN240: 103 | AO240: 5.0999999999999997e-002 | AP240: 36 | AQ240: 岱勒转债!
A241: 208 | B241: 123050 | C241: 聚飞转债! | D241: 300303 | E241: 聚飞光电 | F241: 电子 | G241: LED制 | H241: 150 | I241: -1.06e-002 | J241: 4.0000000000000002e-004 | K241: 6.36 | L241: -1.3999999999999999e-002 | M241: 123.8 | N241: 5.08 | O241: 0.19800000000000001 | P241: 125.2 | Q241: 已到 | R241: 4.38年 | S241: 2.38年 | T241: 3.75 | U241: 93 | V241: 0.16500000000000001 | W241: 4.4000000000000004e-002 | X241: 5.5e-002 | Y241: 85 | Z241: 3.07 | AA241: -4.3799999999999999e-002 | AB241: -5.2300000000000006e-002 | AC241: -0.13500000000000001 | AD241: -0.13699999999999998 | AE241: 89.35 | AF241: 96.07 | AG241: 0.73 | AH241: AA- | AI241: 6.1100000000000002e-002 | AJ241: =H241+100*O241 -> 169.80000000000001 | AK241: 174.8 | AL241: 271 | AM241: 78.7 | AN241: 260 | AO241: 2.2000000000000002e-002 | AP241: 13 | AQ241: 聚飞转债!
A242: 228 | B242: 113570 | C242: 百达转债! | D242: 603331 | E242: 百达精工 | F242: 机械装备 | G242: 机械装备 | H242: 138.94 | I242: 6.6199999999999995e-002 | J242: 1.3899999999999999e-002 | K242: 14.18 | L242: 0.10000000000000001 | M242: 114.9 | N242: 11.34 | O242: 0.111 | P242: 125.04 | Q242: 已到 | R242: 4.29年 | S242: 2.29年 | T242: 2.8 | U242: 1293. | V242: 3.2799999999999998 | W242: 0.111 | X242: 0.13900000000000001 | Y242: 25 | Z242: 3.11 | AA242: -4.4199999999999996e-002 | AB242: -5.0000000000000003e-002 | AC242: -0.114 | AD242: -0.11599999999999999 | AE242: 87.33 | AF242: 85.84 | AG242: 0.8 | AH242: A+ | AI242: 7.2099999999999997e-002 | AJ242: =H242+100*O242 -> 150.03999999999999 | AK242: 152.8 | AL242: 150 | AM242: 65.5 | AN242: 184 | AO242: 0.25600000000000001 | AP242: 31 | AQ242: 百达转债!
A243: 257 | B243: 128081 | C243: 海亮转债! | D243: 2203 | E243: 海亮股份 | F243: 有色金属 | G243: 铜金属 | H243: 137 | I243: -8.0000000000000004e-004 | J243: 3.9000000000000003e-003 | K243: 12.51 | L243: 4.0000000000000001e-003 | M243: 114.3 | N243: 9.69 | O243: 6.0999999999999999e-002 | P243: 129.1 | Q243: 已到 | R243: 3.98年 | S243: 1.98年 | T243: 30.1 | U243: 99 | V243: 2.4e-002 | W243: 0.122 | X243: 0.158 | Y243: 246 | Z243: 2.46 | AA243: -4.5199999999999997e-002 | AB243: -5.1200000000000002e-002 | AC243: -0.125 | AD243: -0.10099999999999999 | AE243: 94.52 | AF243: 98 | AG243: 0.78 | AH243: AA | AI243: 4.0099999999999997e-002 | AJ243: =H243+100*O243 -> 143.09999999999999 | AK243: 144.9 | AL243: 70 | AM243: 46.9 | AN243: 66 | AO243: 4.2999999999999997e-002 | AP243: 46 | AQ243: 海亮转债!
A244: 341 | B244: 128040 | C244: 华通转债! | D244: 2758 | E244: 浙农股份 | F244: 医药 | G244: 医药商业 | H244: 125.046 | I244: -4.0000000000000002e-004 | J244: -2.0999999999999999e-003 | K244: 10.44 | L244: -4.7999999999999996e-003 | M244: 111.3 | N244: 10.15 | O244: 0.21600000000000003 | P244: 102.86 | Q244: 已到 | R244: 2.55年 | S244: 0.55年 | T244: 2.22 | U244: 13 | V244: 4.4999999999999998e-002 | W244: 4.4000000000000004e-002 | X244: 4.4999999999999998e-002 | Y244: 51 | Z244: 1.56 | AA244: -4.5400000000000003e-002 | AB244: -5.3099999999999994e-002 | AC244: -0.27000000000000002 | AD244: -0.27399999999999997 | AE244: 99.09 | AF244: 101.19 | AG244: 0.52 | AH244: AA | AI244: 3.8800000000000001e-002 | AJ244: =H244+100*O244 -> 146.64600000000002 | AK244: 147.2 | AL244: 97 | AM244: 46 | AN244: 57 | AO244: 3.2000000000000001e-002 | AP244: 31 | AQ244: 华通转债!
A245: 259 | B245: 113549 | C245: 白电转债 | D245: 603861 | E245: 白云电器 | F245: 能源电力 | G245: 电力设备 | H245: 137.03 | I245: -1.04e-002 | J245: 3.2599999999999997e-002 | K245: 11.08 | L245: 2.9700000000000001e-002 | M245: 114.3 | N245: 9.06 | O245: 0.12 | P245: 122.3 | Q245: 已到 | R245: 3.97年 | S245: 1.97年 | T245: 8.06 | U245: 441 | V245: 0.40200000000000002 | W245: 0.16699999999999998 | X245: 0.20399999999999999 | Y245: 48 | Z245: 1.86 | AA245: -4.5400000000000003e-002 | AB245: -5.1399999999999994e-002 | AC245: -0.10000000000000001 | AD245: -0.10199999999999999 | AE245: 94.58 | AF245: 98.07 | AG245: 0.75 | AH245: AA | AI245: 4.0099999999999997e-002 | AJ245: =H245+100*O245 -> 149.03 | AK245: 151.8 | AL245: 142 | AM245: 53.7 | AN245: 113 | AO245: 0.156 | AP245: 37 | AQ245: 白电转债
A246: 249 | B246: 113030 | C246: 东风转债! | D246: 601515 | E246: 东风股份 | F246: 造纸包装 | G246: 包装材料 | H246: 141.59 | I246: -3.2000000000000002e-003 | J246: 6.0000000000000001e-003 | K246: 7.8 | L246: 3.9000000000000003e-003 | M246: 116.9 | N246: 6.4 | O246: 0.16200000000000001 | P246: 121.88 | Q246: 已到 | R246: 4年27天 | S246: 2年27天 | T246: 2.95 | U246: 136 | V246: 0.32299999999999995 | W246: 2.5000000000000001e-002 | X246: 2.9999999999999999e-002 | Y246: 120 | Z246: 2.3 | AA246: -4.6900000000000004e-002 | AB246: -5.3600000000000002e-002 | AC246: -0.10199999999999999 | AD246: -0.10400000000000001 | AE246: 94.78 | AF246: 99.96 | AG246: 0.73 | AH246: AA | AI246: 4.0099999999999997e-002 | AJ246: =H246+100*O246 -> 157.78999999999999 | AK246: 161.3 | AL246: 201 | AM246: 61.3 | AN246: 157 | AO246: 0.125 | AP246: 18 | AQ246: 东风转债!
A247: 212 | B247: 123048 | C247: 应急转债! | D247: 300527 | E247: 中船应急 | F247: 机械装备 | G247: 专用设备 | H247: 138.56 | I247: -1.5900000000000001e-002 | J247: 6.0999999999999995e-003 | K247: 9.9 | L247: -1.49e-002 | M247: 112.8 | N247: 8.88 | O247: 0.24299999999999999 | P247: 111.49 | Q247: 已到 | R247: 4.37年 | S247: 2.37年 | T247: 3.79 | U247: 314 | V247: 0.58899999999999997 | W247: 4.0000000000000001e-002 | X247: 4.4000000000000004e-002 | Y247: 95 | Z247: 3.63 | AA247: -4.6900000000000004e-002 | AB247: -5.1799999999999999e-002 | AC247: -0.109 | AD247: -0.11199999999999999 | AE247: 94.73 | AF247: 97.33 | AG247: 0.66 | AH247: AA+ | AI247: 3.5099999999999999e-002 | AJ247: =H247+100*O247 -> 162.86000000000001 | AK247: 165.6 | AL247: 237 | AM247: 68.3 | AN247: 205 | AO247: 1.4999999999999999e-002 | AP247: 16 | AQ247: 应急转债!
A248: 203 | B248: 113579 | C248: 健友转债! | D248: 603707 | E248: 健友股份 | F248: 医药 | G248: 原料药 | H248: 140.19 | I248: -7.9000000000000008e-003 | J248: 4.5999999999999999e-003 | K248: 41.45 | L248: -4.0999999999999995e-003 | M248: 113.9 | N248: 32.2 | O248: 8.900000000000001e-002 | P248: 128.73 | Q248: 已到 | R248: 4.40年 | S248: 2.40年 | T248: 5.03 | U248: 71 | V248: 0.10199999999999999 | W248: 1.e-002 | X248: 1.3000000000000001e-002 | Y248: 504 | Z248: 11.75 | AA248: -4.7e-002 | AB248: -5.2199999999999996e-002 | AC248: -0.11199999999999999 | AD248: -0.114 | AE248: 93.56 | AF248: 96.15 | AG248: 0.8 | AH248: AA | AI248: 4.0099999999999997e-002 | AJ248: =H248+100*O248 -> 149.09 | AK248: 151.7 | AL248: 140 | AM248: 55.5 | AN248: 127 | AO248: 1.3000000000000001e-002 | AP248: 9 | AQ248: 健友转债!
A249: 347 | B249: 113505 | C249: 杭电转债! | D249: 603618 | E249: 杭电股份 | F249: 能源电力 | G249: 电力设备 | H249: 123.94 | I249: 1.0800000000000001e-002 | J249: 1.1299999999999999e-002 | K249: 7.77 | L249: 3.6000000000000004e-002 | M249: 111.3 | N249: 7.08 | O249: 0.129 | P249: 109.75 | Q249: 已到 | R249: 2.27年 | S249: 0.27年 | T249: 7.5 | U249: 171 | V249: 0.183 | W249: 0.14000000000000001 | X249: 0.153 | Y249: 54 | Z249: 2.03 | AA249: -4.7100000000000003e-002 | AB249: -5.5599999999999997e-002 | AC249: -0.435 | AD249: -0.441 | AE249: 100.13 | AF249: 102.25 | AG249: 0.61 | AH249: AA | AI249: 3.8800000000000001e-002 | AJ249: =H249+100*O249 -> 136.84 | AK249: 138.1 | AL249: 25 | AM249: 35.9 | AN249: 18 | AO249: -2.8999999999999998e-002 | AP249: 45 | AQ249: 杭电转债!
A250: 343 | B250: 128036 | C250: 金农转债!! | D250: 2548 | E250: 金新农 | F250: 农业 | G250: 畜牧业 | H250: 121.963 | I250: -2.9999999999999997e-004 | J250: -2.2000000000000001e-003 | K250: 5.64 | L250: -1.23e-002 | M250: 109.3 | N250: 6.93 | O250: 0.499 | P250: 81.39 | Q250: 已到 | R250: 2.28年 | S250: 0.28年 | T250: 1.46 | U250: 7.4 | V250: 4.2000000000000003e-002 | W250: 3.7000000000000005e-002 | X250: 2.9999999999999999e-002 | Y250: 39 | Z250: 1.67 | AA250: -4.7800000000000002e-002 | AB250: -5.4900000000000004e-002 | AC250: -0.39500000000000002 | AD250: -0.40100000000000002 | AE250: 99.21 | AF250: 96 | AG250: 0.2 | AH250: AA- | AI250: 5.9800000000000006e-002 | AJ250: =H250+100*O250 -> 171.863 | AK250: 162.5 | AL250: 213 | AM250: 63.3 | AN250: 171 | AO250: -2.8999999999999998e-002 | AP250: 15 | AQ250: 金农转债!!
A251: 113 | B251: 123078 | C251: 飞凯转债!! | D251: 300398 | E251: 飞凯材料 | F251: 化工 | G251: 化工 | H251: 146.57 | I251: 7.4000000000000003e-003 | J251: 1.e-003 | K251: 19.9 | L251: 1.0700000000000001e-002 | M251: 115.2 | N251: 15.56 | O251: 0.14599999999999999 | P251: 127.89 | Q251: 已到 | R251: 5年0.1天 | S251: 3年0.1天 | T251: 8.15 | U251: 45 | V251: 3.7999999999999999e-002 | W251: 7.9000000000000001e-002 | X251: 0.10099999999999999 | Y251: 103 | Z251: 3.55 | AA251: -4.7899999999999998e-002 | AB251: -5.2900000000000003e-002 | AC251: -0.10300000000000001 | AD251: -0.10400000000000001 | AE251: 91.19 | AF251: 94.24 | AG251: 0.78 | AH251: AA | AI251: 4.1900000000000007e-002 | AJ251: =H251+100*O251 -> 161.16999999999999 | AK251: 165.2 | AL251: 232 | AM251: 71 | AN251: 221 | AO251: 4.2999999999999997e-002 | AP251: 8 | AQ251: 飞凯转债!!
A252: 213 | B252: 113576 | C252: 起步转债!! | D252: 603557 | E252: ST起步 | F252: 服装纺织 | G252: 鞋服行业 | H252: 149.76 | I252: 2.1400000000000002e-002 | J252: -1.61e-002 | K252: 5.63 | L252: 3.3000000000000002e-002 | M252: 121.3 | N252: 10.55 | O252: 1.8100000000000001 | P252: 53.36 | Q252: 已到 | R252: 4.37年 | S252: 2.37年 | T252: 2.66 | U252: 1717. | V252: 4.2300000000000004 | W252: 9.5000000000000001e-002 | X252: 5.0999999999999997e-002 | Y252: 28 | Z252: 1.86 | AA252: -4.82e-002 | AB252: -5.5899999999999998e-002 | AC252: -0.13300000000000001 | AD252: -0.13600000000000001 | AE252: 81.73 | AF252: 80.27 | AG252: 0.16 | AH252: BBB+ | AI252: 0.10210000000000001 | AJ252: =H252+100*O252 -> 330.75999999999999 | AK252: 246.2 | AL252: 338 | AM252: 164.4 | AN252: 342 | AO252: 2.1000000000000001e-002 | AP252: 37 | AQ252: 起步转债!!
A253: 194 | B253: 123054 | C253: 思特转债!! | D253: 300608 | E253: 思特奇 | F253: 通信互联 | G253: 通信设备 | H253: 151.1 | I253: -3.9000000000000003e-003 | J253: 3.0000000000000001e-003 | K253: 14.35 | L253: -1.4000000000000002e-003 | M253: 121.2 | N253: 12.63 | O253: 0.33000000000000002 | P253: 113.62 | Q253: 已到 | R253: 4.53年 | S253: 2.53年 | T253: 2.07 | U253: 902 | V253: 2.8599999999999999 | W253: 6.9000000000000006e-002 | X253: 7.8e-002 | Y253: 30 | Z253: 3.62 | AA253: -4.8499999999999995e-002 | AB253: -5.5899999999999998e-002 | AC253: -0.128 | AD253: -0.13100000000000001 | AE253: 88.87 | AF253: 93.23 | AG253: 0.68 | AH253: AA- | AI253: 6.1100000000000002e-002 | AJ253: =H253+100*O253 -> 184.09999999999999 | AK253: 188.6 | AL253: 297 | AM253: 95.3 | AN253: 296 | AO253: 0.10099999999999999 | AP253: 18 | AQ253: 思特转债!!
A254: 362 | B254: 123002 | C254: 国祯转债!! | D254: 300388 | E254: 节能国祯 | F254: 城市公用 | G254: 三废处理 | H254: 118.65 | I254: 8.8999999999999999e-003 | J254: -8.9999999999999998e-004 | K254: 7.64 | L254: 2.e-002 | M254: 108.8 | N254: 8.36 | O254: 0.29799999999999999 | P254: 91.39 | Q254: 已到 | R254: 1.99年 | S254: 回售内 | T254: 2.52 | U254: 26 | V254: 8.8000000000000009e-002 | W254: 4.7e-002 | X254: 4.2999999999999997e-002 | Y254: 53 | Z254: 1.45 | AA254: -4.87e-002 | AB254: -5.5300000000000002e-002 | AC254: 回售内 | AD254: 回售内 | AE254: 100.25 | AF254: 99.7 | AG254: 0.4 | AH254: AA | AI254: 3.8800000000000001e-002 | AJ254: =H254+100*O254 -> 148.44999999999999 | AK254: 145.9 | AL254: 79 | AM254: 45.7 | AN254: 53 | AO254: 5.0000000000000003e-002 | AP254: 17 | AQ254: 国祯转债!!
A255: 371 | B255: 113011 | C255: 光大转债 | D255: 601818 | E255: 光大银行 | F255: 金融 | G255: 银行行业 | H255: 113.95 | I255: -2.5999999999999999e-003 | J255: 1.6000000000000001e-003 | K255: 3.35 | L255: -3.0000000000000001e-003 | M255: 106.8 | N255: 3.55 | O255: 0.20800000000000002 | P255: 94.37 | Q255: 已到 | R255: 1.30年 | S255: 无权 | T255: 242 | U255: 82 | V255: 3.0000000000000001e-003 | W255: 0.13400000000000001 | X255: 0.126 | Y255: 1810. | Z255: 0.5 | AA255: -4.9200000000000001e-002 | AB255: -5.8499999999999996e-002 | AC255: 无权 | AD255: 无权 | AE255: 无权 | AF255: 102.59 | AG255: 0.33 | AH255: AAA | AI255: 3.1800000000000002e-002 | AJ255: =H255+100*O255 -> 134.75 | AK255: 133.5 | AL255: 13 | AM255: 30.9 | AN255: 4 | AO255: -2.e-003 | AP255: 14 | AQ255: 光大转债
A256: 252 | B256: 128085 | C256: 鸿达转债!! | D256: 2002 | E256: 鸿达兴业 | F256: 化工 | G256: 化工 | H256: 152 | I256: 2.29e-002 | J256: 4.8999999999999998e-003 | K256: 5.91 | L256: 2.7799999999999998e-002 | M256: 124.4 | N256: 3.91 | O256: 6.0000000000000001e-003 | P256: 151.15 | Q256: 已到 | R256: 4年19天 | S256: 2年19天 | T256: 3.43 | U256: 343 | V256: 0.65700000000000003 | W256: 1.9e-002 | X256: 2.7999999999999997e-002 | Y256: 184 | Z256: 1.78 | AA256: -4.9299999999999997e-002 | AB256: -5.8700000000000002e-002 | AC256: -0.122 | AD256: -0.124 | AE256: 73.39 | AF256: 66.59 | AG256: 1 | AH256: B | AI256: 0.1721 | AJ256: =H256+100*O256 -> 152.59999999999999 | AK256: 152.8 | AL256: 151 | AM256: 79.5 | AN256: 262 | AO256: 0.10400000000000001 | AP256: 89 | AQ256: 鸿达转债!!
A257: 291 | B257: 113026 | C257: 核能转债! | D257: 601985 | E257: 中国核电 | F257: 能源电力 | G257: 核电 | H257: 129.44 | I257: -7.9000000000000008e-003 | J257: -1.26e-002 | K257: 6.69 | L257: -2.76e-002 | M257: 109.3 | N257: 5.73 | O257: 0.109 | P257: 116.75 | Q257: 已到 | R257: 3.38年 | S257: 1.38年 | T257: 76 | U257: 95 | V257: 1.e-002 | W257: 6.5000000000000002e-002 | X257: 7.5999999999999998e-002 | Y257: 1172. | Z257: 1.81 | AA257: -4.9800000000000004e-002 | AB257: -5.45e-002 | AC257: -0.125 | AD257: -0.127 | AE257: 97.79 | AF257: 98.14 | AG257: 0.74 | AH257: AAA | AI257: 3.3099999999999997e-002 | AJ257: =H257+100*O257 -> 140.34 | AK257: 142.1 | AL257: 45 | AM257: 44 | AN257: 41 | AO257: 8.0000000000000002e-003 | AP257: 39 | AQ257: 核能转债!
A258: 350 | B258: 110043 | C258: 无锡转债! | D258: 600908 | E258: 无锡银行 | F258: 金融 | G258: 银行行业 | H258: 120.93 | I258: -1.1999999999999999e-003 | J258: -2.2000000000000001e-003 | K258: 5.62 | L258: -7.0999999999999995e-003 | M258: 108.3 | N258: 5.61 | O258: 0.20699999999999999 | P258: 100.18 | Q258: 已到 | R258: 2.18年 | S258: 无权 | T258: 29.2 | U258: 7 | V258: 2.e-003 | W258: 0.27899999999999997 | X258: 0.28000000000000003 | Y258: 105 | Z258: 0.81 | AA258: -5.0099999999999999e-002 | AB258: -5.6799999999999996e-002 | AC258: 无权 | AD258: 无权 | AE258: 无权 | AF258: 100.85 | AG258: 0.49 | AH258: AA+ | AI258: 3.3799999999999997e-002 | AJ258: =H258+100*O258 -> 141.63 | AK258: 141.7 | AL258: 42 | AM258: 40.8 | AN258: 32 | AO258: -1.7000000000000001e-002 | AP258: 22 | AQ258: 无锡转债!
A259: 23 | B259: 110081 | C259: 闻泰转债 | D259: 600745 | E259: 闻泰科技 | F259: 电子 | G259: 电子行业 | H259: 150.83 | I259: 1.e-004 | J259: -3.5999999999999999e-003 | K259: 119.33 | L259: -4.5999999999999999e-003 | M259: 111.9 | N259: 96.67 | O259: 0.222 | P259: 123.44 | Q259: 2月8天 | R259: 5.67年 | S259: 3.67年 | T259: 86 | U259: 117 | V259: 9.0000000000000011e-003 | W259: 5.7999999999999996e-002 | X259: 7.0999999999999994e-002 | Y259: 1486. | Z259: 4.73 | AA259: -5.1900000000000002e-002 | AB259: -5.5399999999999998e-002 | AC259: -9.6300000000000011e-002 | AD259: -9.74e-002 | AE259: 89.16 | AF259: 91.35 | AG259: 0.77 | AH259: AA+ | AI259: 3.6900000000000002e-002 | AJ259: =H259+100*O259 -> 173.03 | AK259: 178.2 | AL259: 283 | AM259: 86.9 | AN259: 281 | AO259: 2.e-002 | AP259: 10 | AQ259: 闻泰转债
A260: 16 | B260: 118002 | C260: 天合转债 | D260: 688599 | E260: 天合光能 | F260: 能源电力 | G260: 太阳能 | H260: 163.09 | I260: 1.0800000000000001e-002 | J260: 2.e-002 | K260: 71.62 | L260: 3.7699999999999997e-002 | M260: 120.1 | N260: 50.51 | O260: 0.14999999999999999 | P260: 141.79 | Q260: 2月26天 | R260: 5.71年 | S260: 3.71年 | T260: 52.5 | U260: 504 | V260: 5.9000000000000004e-002 | W260: 3.5000000000000003e-002 | X260: 5.0000000000000003e-002 | Y260: 1481. | Z260: 9.23 | AA260: -5.2999999999999999e-002 | AB260: -5.8499999999999996e-002 | AC260: -0.107 | AD260: -0.109 | AE260: 88.48 | AF260: 95.4 | AG260: 0.82 | AH260: AA | AI260: 4.1900000000000007e-002 | AJ260: =H260+100*O260 -> 178.09 | AK260: 184.4 | AL260: 292 | AM260: 89 | AN260: 283 | AO260: -1.7000000000000001e-002 | AP260: 7 | AQ260: 天合转债
A261: 40 | B261: 127037 | C261: 银轮转债 | D261: 2126 | E261: 银轮股份 | F261: 汽车 | G261: 零部件制 | H261: 155.2 | I261: 0. | J261: -1.34e-002 | K261: 12.8 | L261: -1.84e-002 | M261: 115.1 | N261: 10.77 | O261: 0.30599999999999999 | P261: 118.85 | Q261: 14天 | R261: 5.53年 | S261: 3.53年 | T261: 7 | U261: 16 | V261: 1.4999999999999999e-002 | W261: 6.9000000000000006e-002 | X261: 8.199999999999999e-002 | Y261: 101 | Z261: 2.4 | AA261: -5.3499999999999999e-002 | AB261: -5.7999999999999996e-002 | AC261: -0.10099999999999999 | AD261: -0.10300000000000001 | AE261: 89.15 | AF261: 92.13 | AG261: 0.73 | AH261: AA | AI261: 4.1900000000000007e-002 | AJ261: =H261+100*O261 -> 185.79999999999998 | AK261: 191.6 | AL261: 303 | AM261: 99.4 | AN261: 302 | AO261: -8.0000000000000002e-003 | AP261: 3 | AQ261: 银轮转债
A262: 236 | B262: 128097 | C262: 奥佳转债!! | D262: 2614 | E262: 奥佳华 | F262: 机械装备 | G262: 专用设备 | H262: 144.886 | I262: -1.2500000000000001e-002 | J262: -5.3e-003 | K262: 12.35 | L262: -2.3700000000000002e-002 | M262: 114.9 | N262: 10.39 | O262: 0.21899999999999997 | P262: 118.86 | Q262: 已到 | R262: 4.25年 | S262: 2.25年 | T262: 4.59 | U262: 30 | V262: 4.4999999999999998e-002 | W262: 5.9000000000000004e-002 | X262: 7.0000000000000007e-002 | Y262: 78 | Z262: 1.66 | AA262: -5.4199999999999998e-002 | AB262: -5.9900000000000002e-002 | AC262: -0.13100000000000001 | AD262: -0.13300000000000001 | AE262: 89.76 | AF262: 89.83 | AG262: 0.75 | AH262: AA- | AI262: 6.1100000000000002e-002 | AJ262: =H262+100*O262 -> 166.786 | AK262: 170.9 | AL262: 260 | AM262: 81.1 | AN262: 268 | AO262: 5.4000000000000006e-002 | AP262: 17 | AQ262: 奥佳转债!!
A263: 29 | B263: 127040 | C263: 国泰转债 | D263: 2091 | E263: 江苏国泰 | F263: 商业零售 | G263: 商业零售 | H263: 153.499 | I263: -1.3999999999999999e-002 | J263: -1.8700000000000001e-002 | K263: 12.91 | L263: -3.7999999999999999e-002 | M263: 112.5 | N263: 9.02 | O263: 7.2000000000000008e-002 | P263: 143.13 | Q263: 47天 | R263: 5.61年 | S263: 3.61年 | T263: 45.6 | U263: 345 | V263: 4.9000000000000002e-002 | W263: 0.22600000000000001 | X263: 0.32299999999999995 | Y263: 202 | Z263: 2.11 | AA263: -5.4600000000000003e-002 | AB263: -5.8299999999999998e-002 | AC263: -0.10099999999999999 | AD263: -0.10199999999999999 | AE263: 89.91 | AF263: 92.1 | AG263: 0.86 | AH263: AA+ | AI263: 3.6900000000000002e-002 | AJ263: =H263+100*O263 -> 160.69899999999998 | AK263: 163.9 | AL263: 221 | AM263: 71.8 | AN263: 227 | AO263: 4.4000000000000004e-002 | AP263: 11 | AQ263: 国泰转债
A264: 167 | B264: 128122 | C264: 兴森转债! | D264: 2436 | E264: 兴森科技 | F264: 电子 | G264: 元器件制 | H264: 138.995 | I264: 1.24e-002 | J264: -3.2000000000000002e-003 | K264: 14.29 | L264: 1.7100000000000001e-002 | M264: 113 | N264: 14.1 | O264: 0.371 | P264: 101.35 | Q264: 已到 | R264: 3.65年 | S264: 2.65年 | T264: 2.69 | U264: 144 | V264: 0.38100000000000001 | W264: 1.3000000000000001e-002 | X264: 1.3000000000000001e-002 | Y264: 213 | Z264: 5.93 | AA264: -5.57e-002 | AB264: -6.1699999999999998e-002 | AC264: -0.10000000000000001 | AD264: -0.10099999999999999 | AE264: 92.58 | AF264: 98.06 | AG264: 0.54 | AH264: AA | AI264: 4.0099999999999997e-002 | AJ264: =H264+100*O264 -> 176.095 | AK264: 176.6 | AL264: 275 | AM264: 78.6 | AN264: 258 | AO264: 2.4e-002 | AP264: 11 | AQ264: 兴森转债!
A265: 24 | B265: 118001 | C265: 金博转债 | D265: 688598 | E265: 金博股份 | F265: 能源电力 | G265: 太阳能 | H265: 167.37 | I265: 1.7600000000000001e-002 | J265: 2.64e-002 | K265: 359.35 | L265: 5.3800000000000001e-002 | M265: 121.6 | N265: 271.12 | O265: 0.26300000000000001 | P265: 132.54 | Q265: 2月3天 | R265: 5.65年 | S265: 3.65年 | T265: 6 | U265: 114 | V265: 0.114 | W265: 2.1000000000000001e-002 | X265: 2.7999999999999997e-002 | Y265: 288 | Z265: 17.5 | AA265: -5.5999999999999994e-002 | AB265: -6.2e-002 | AC265: -0.113 | AD265: -0.114 | AE265: 79.94 | AF265: 82.06 | AG265: 0.82 | AH265: A+ | AI265: 7.3899999999999993e-002 | AJ265: =H265+100*O265 -> 193.67000000000002 | AK265: 202.2 | AL265: 317 | AM265: 120.1 | AN265: 326 | AO265: 4.5999999999999999e-002 | AP265: 3 | AQ265: 金博转债
A266: 52 | B266: 113047 | C266: 旗滨转债 | D266: 601636 | E266: 旗滨集团 | F266: 建筑 | G266: 玻璃 | H266: 155.91 | I266: -1.6500000000000001e-002 | J266: -1.8e-003 | K266: 15.87 | L266: -2.46e-002 | M266: 114 | N266: 12.8 | O266: 0.25700000000000001 | P266: 123.98 | Q266: 已到 | R266: 5.36年 | S266: 3.36年 | T266: 15 | U266: 71 | V266: 2.9999999999999999e-002 | W266: 3.5000000000000003e-002 | X266: 4.4000000000000004e-002 | Y266: 426 | Z266: 3.47 | AA266: -5.74e-002 | AB266: -6.1699999999999998e-002 | AC266: -0.11 | AD266: -0.111 | AE266: 90.26 | AF266: 94.12 | AG266: 0.75 | AH266: AA+ | AI266: 3.6900000000000002e-002 | AJ266: =H266+100*O266 -> 181.60999999999999 | AK266: 187.8 | AL266: 295 | AM266: 93.7 | AN266: 294 | AO266: 1.6e-002 | AP266: 7 | AQ266: 旗滨转债
A267: 346 | B267: 127005 | C267: 长证转债! | D267: 783 | E267: 长江证券 | F267: 金融 | G267: 证券行业 | H267: 124.008 | I267: -1.5e-003 | J267: -2.8000000000000004e-003 | K267: 7.24 | L267: -8.199999999999999e-003 | M267: 108.3 | N267: 7.13 | O267: 0.221 | P267: 101.54 | Q267: 已到 | R267: 2.29年 | S267: 无权 | T267: 50 | U267: 19 | V267: 3.0000000000000001e-003 | W267: 0.125 | X267: 0.127 | Y267: 400 | Z267: 1.36 | AA267: -5.8499999999999996e-002 | AB267: -6.480000000000001e-002 | AC267: 无权 | AD267: 无权 | AE267: 无权 | AF267: 100.96 | AG267: 0.53 | AH267: AAA | AI267: 3.1800000000000002e-002 | AJ267: =H267+100*O267 -> 146.108 | AK267: 146.5 | AL267: 85 | AM267: 45.5 | AN267: 52 | AO267: -1.e-003 | AP267: 12 | AQ267: 长证转债!
A268: 184 | B268: 123057 | C268: 美联转债! | D268: 300586 | E268: 美联新材 | F268: 化工 | G268: 橡胶塑料 | H268: 155 | I268: 5.0799999999999998e-002 | J268: -1.1200000000000002e-002 | K268: 12.58 | L268: 4.9200000000000001e-002 | M268: 117.8 | N268: 9.5 | O268: 0.17100000000000001 | P268: 132.42 | Q268: 已到 | R268: 4.59年 | S268: 2.59年 | T268: 2.07 | U268: 1011. | V268: 3.1899999999999999 | W268: 3.1e-002 | X268: 4.0999999999999995e-002 | Y268: 66 | Z268: 5.52 | AA268: -5.9200000000000003e-002 | AB268: -6.5299999999999997e-002 | AC268: -0.13500000000000001 | AD268: -0.13699999999999998 | AE268: 88.22 | AF268: 90.29 | AG268: 0.81 | AH268: AA- | AI268: 6.1100000000000002e-002 | AJ268: =H268+100*O268 -> 172.09999999999999 | AK268: 177.6 | AL268: 279 | AM268: 87.3 | AN268: 282 | AO268: 9.0999999999999998e-002 | AP268: 20 | AQ268: 美联转债!
A269: 359 | B269: 128023 | C269: 亚太转债! | D269: 2284 | E269: 亚太股份 | F269: 汽车 | G269: 零部件制 | H269: 125.6 | I269: -7.0999999999999995e-003 | J269: 1.e-002 | K269: 9.55 | L269: 8.3999999999999995e-003 | M269: 111.3 | N269: 10.34 | O269: 0.35999999999999999 | P269: 92.36 | Q269: 已到 | R269: 2年7天 | S269: 7天 | T269: 9.99 | U269: 168 | V269: 0.13300000000000001 | W269: 0.14199999999999999 | X269: 0.13100000000000001 | Y269: 70 | Z269: 2.81 | AA269: -5.9299999999999999e-002 | AB269: -6.8699999999999997e-002 | AC269: <-100% | AD269: <-100% | AE269: 101.09 | AF269: 103.24 | AG269: 0.35 | AH269: AA | AI269: 3.8800000000000001e-002 | AJ269: =H269+100*O269 -> 161.59999999999999 | AK269: 158.8 | AL269: 183 | AM269: 55.6 | AN269: 128 | AO269: 0.23499999999999999 | AP269: 58 | AQ269: 亚太转债!
A270: 88 | B270: 113616 | C270: 韦尔转债! | D270: 603501 | E270: 韦尔股份 | F270: 电子 | G270: 元器件制 | H270: 155.99 | I270: -1.72e-002 | J270: -7.3000000000000001e-003 | K270: 273.33 | L270: -3.2799999999999996e-002 | M270: 114.5 | N270: 222.52 | O270: 0.27000000000000002 | P270: 122.83 | Q270: 已到 | R270: 5年31天 | S270: 3年31天 | T270: 24.3 | U270: 125 | V270: 3.3000000000000002e-002 | W270: 1.e-002 | X270: 1.3000000000000001e-002 | Y270: 2376. | Z270: 16.39 | AA270: -5.9800000000000006e-002 | AB270: -6.4500000000000002e-002 | AC270: -0.11800000000000001 | AD270: -0.11900000000000001 | AE270: 91.63 | AF270: 95.52 | AG270: 0.75 | AH270: AA+ | AI270: 3.6900000000000002e-002 | AJ270: =H270+100*O270 -> 182.99000000000001 | AK270: 189.1 | AL270: 299 | AM270: 93.6 | AN270: 293 | AO270: -6.9999999999999993e-003 | AP270: 9 | AQ270: 韦尔转债!
A271: 304 | B271: 110056 | C271: 亨通转债! | D271: 600487 | E271: 亨通光电 | F271: 通信互联 | G271: 通信设备 | H271: 140.11 | I271: 1.09e-002 | J271: -9.7999999999999997e-003 | K271: 16.46 | L271: 1.8e-003 | M271: 114.3 | N271: 14.95 | O271: 0.27300000000000002 | P271: 110.1 | Q271: 已到 | R271: 3.31年 | S271: 1.31年 | T271: 17.1 | U271: 41 | V271: 1.7000000000000001e-002 | W271: 4.4000000000000004e-002 | X271: 4.8000000000000001e-002 | Y271: 389 | Z271: 1.89 | AA271: -6.08e-002 | AB271: -6.7900000000000002e-002 | AC271: -0.17199999999999999 | AD271: -0.17399999999999999 | AE271: 97.75 | AF271: 102.23 | AG271: 0.61 | AH271: AA+ | AI271: 3.5099999999999999e-002 | AJ271: =H271+100*O271 -> 167.41000000000003 | AK271: 170.1 | AL271: 256 | AM271: 67.9 | AN271: 203 | AO271: 1.2e-002 | AP271: 24 | AQ271: 亨通转债!
A272: 100 | B272: 123085 | C272: 万顺转2!! | D272: 300057 | E272: 万顺新材 | F272: 有色金属 | G272: 铝金属 | H272: 154.45 | I272: -2.1899999999999999e-002 | J272: 1.8100000000000002e-002 | K272: 9.24 | L272: -4.3e-003 | M272: 113.3 | N272: 6.2 | O272: 3.6000000000000004e-002 | P272: 149.03 | Q272: 已到 | R272: 5年14天 | S272: 3年14天 | T272: 8.65 | U272: 102 | V272: 7.4999999999999997e-002 | W272: 0.13699999999999998 | X272: 0.20499999999999999 | Y272: 63 | Z272: 1.75 | AA272: -6.08e-002 | AB272: -6.5099999999999991e-002 | AC272: -0.115 | AD272: -0.11699999999999999 | AE272: 85.57 | AF272: 83.92 | AG272: 0.89 | AH272: AA- | AI272: 6.2899999999999998e-002 | AJ272: =H272+100*O272 -> 158.04999999999998 | AK272: 159.9 | AL272: 187 | AM272: 74.3 | AN272: 239 | AO272: 5.9999999999999998e-002 | AP272: 20 | AQ272: 万顺转2!!
A273: 349 | B273: 128035 | C273: 大族转债! | D273: 2008 | E273: 大族激光 | F273: 机械装备 | G273: 专用设备 | H273: 123.087 | I273: -1.7000000000000001e-003 | J273: -2.e-003 | K273: 44.19 | L273: -1.5800000000000002e-002 | M273: 107.4 | N273: 51.9 | O273: 0.44600000000000001 | P273: 85.14 | Q273: 已到 | R273: 2.19年 | S273: 0.19年 | T273: 23 | U273: 13 | V273: 4.0000000000000001e-003 | W273: 4.9000000000000002e-002 | X273: 4.2000000000000003e-002 | Y273: 472 | Z273: 4.44 | AA273: -6.0999999999999999e-002 | AB273: -6.6799999999999998e-002 | AC273: -0.46500000000000002 | AD273: -0.48299999999999998 | AE273: 102.56 | AF273: 99.94 | AG273: 0.23 | AH273: AA+ | AI273: 3.3799999999999997e-002 | AJ273: =H273+100*O273 -> 167.68700000000001 | AK273: 161 | AL273: 198 | AM273: 58.5 | AN273: 139 | AO273: 1.1000000000000001e-002 | AP273: 17 | AQ273: 大族转债!
A274: 269 | B274: 128078 | C274: 太极转债! | D274: 2368 | E274: 太极股份 | F274: 计算机及 | G274: 软件开发 | H274: 148.234 | I274: -1.01e-002 | J274: -1.3100000000000001e-002 | K274: 29.15 | L274: -2.3099999999999999e-002 | M274: 116.3 | N274: 22.21 | O274: 0.129 | P274: 131.25 | Q274: 已到 | R274: 3.90年 | S274: 1.90年 | T274: 9.6 | U274: 38 | V274: 2.7000000000000003e-002 | W274: 5.7000000000000002e-002 | X274: 7.4999999999999997e-002 | Y274: 169 | Z274: 5.12 | AA274: -6.13e-002 | AB274: -6.8000000000000005e-002 | AC274: -0.13 | AD274: -0.13100000000000001 | AE274: 94.83 | AF274: 100.05 | AG274: 1 | AH274: AA | AI274: 4.0099999999999997e-002 | AJ274: =H274+100*O274 -> 161.13400000000001 | AK274: 165.2 | AL274: 231 | AM274: 65.2 | AN274: 183 | AO274: -1.e-003 | AP274: 9 | AQ274: 太极转债!
A275: 107 | B275: 128140 | C275: 润建转债!! | D275: 2929 | E275: 润建股份 | F275: 通信互联 | G275: 通信设备 | H275: 158.302 | I275: 1.9e-003 | J275: 2.3999999999999998e-003 | K275: 36.59 | L275: 5.1999999999999998e-003 | M275: 115.2 | N275: 26.4 | O275: 0.14199999999999999 | P275: 138.6 | Q275: 已到 | R275: 5年10天 | S275: 3年10天 | T275: 10.9 | U275: 18 | V275: 1.e-002 | W275: 0.13200000000000001 | X275: 0.183 | Y275: 83 | Z275: 2.38 | AA275: -6.2400000000000004e-002 | AB275: -6.7199999999999996e-002 | AC275: -0.12300000000000001 | AD275: -0.124 | AE275: 91.09 | AF275: 94.13 | AG275: 0.83 | AH275: AA | AI275: 4.1900000000000007e-002 | AJ275: =H275+100*O275 -> 172.50199999999998 | AK275: 178 | AL275: 281 | AM275: 83.9 | AN275: 274 | AO275: 4.2000000000000003e-002 | AP275: 11 | AQ275: 润建转债!!
A276: 261 | B276: 110061 | C276: 川投转债! | D276: 600674 | E276: 川投能源 | F276: 能源电力 | G276: 水电 | H276: 141.83 | I276: -4.0000000000000002e-004 | J276: -8.5000000000000006e-003 | K276: 11.37 | L276: -1.1299999999999999e-002 | M276: 110.3 | N276: 9.2 | O276: 0.14800000000000002 | P276: 123.59 | Q276: 已到 | R276: 3.96年 | S276: 1.96年 | T276: 39.6 | U276: 28 | V276: 5.0000000000000001e-003 | W276: 7.9000000000000001e-002 | X276: 9.8000000000000004e-002 | Y276: 501 | Z276: 1.63 | AA276: -6.2600000000000003e-002 | AB276: -6.6900000000000001e-002 | AC276: -0.11199999999999999 | AD276: -0.113 | AE276: 95.98 | AF276: 97.2 | AG276: 0.78 | AH276: AAA | AI276: 3.3099999999999997e-002 | AJ276: =H276+100*O276 -> 156.63000000000002 | AK276: 160.1 | AL276: 190 | AM276: 62.9 | AN276: 169 | AO276: -5.2999999999999999e-002 | AP276: 12 | AQ276: 川投转债!
A277: 55 | B277: 123111 | C277: 东财转3! | D277: 300059 | E277: 东方财富 | F277: 金融 | G277: 证券行业 | H277: 157.725 | I277: -2.3999999999999998e-003 | J277: -1.9e-003 | K277: 34.73 | L277: -4.8999999999999998e-003 | M277: 110.5 | N277: 23.35 | O277: 5.9999999999999998e-002 | P277: 148.74 | Q277: 已到 | R277: 5.36年 | S277: 3.36年 | T277: 151 | U277: 387 | V277: 1.6e-002 | W277: 4.2000000000000003e-002 | X277: 6.3e-002 | Y277: 3590. | Z277: 9.21 | AA277: -6.4899999999999999e-002 | AB277: -6.8099999999999994e-002 | AC277: -0.114 | AD277: -0.114 | AE277: 89.82 | AF277: 91.21 | AG277: 0.87 | AH277: AA+ | AI277: 3.6900000000000002e-002 | AJ277: =H277+100*O277 -> 163.72499999999999 | AK277: 166.7 | AL277: 245 | AM277: 75.5 | AN277: 244 | AO277: 1.6e-002 | AP277: 26 | AQ277: 东财转3!
A278: 33 | B278: 113051 | C278: 节能转债 | D278: 601016 | E278: 节能风电 | F278: 能源电力 | G278: 风能 | H278: 167.08 | I278: -4.3e-003 | J278: -1.23e-002 | K278: 6.32 | L278: -1.8600000000000002e-002 | M278: 114.5 | N278: 4.05 | O278: 7.0999999999999994e-002 | P278: 156.05 | Q278: 28天 | R278: 5.56年 | S278: 3.56年 | T278: 30 | U278: 237 | V278: 4.7e-002 | W278: 9.5000000000000001e-002 | X278: 0.14800000000000002 | Y278: 317 | Z278: 3.07 | AA278: -6.6500000000000004e-002 | AB278: -7.0699999999999999e-002 | AC278: -0.11800000000000001 | AD278: -0.11900000000000001 | AE278: 90.05 | AF278: 93.88 | AG278: 0.89 | AH278: AA+ | AI278: 3.6900000000000002e-002 | AJ278: =H278+100*O278 -> 174.18000000000001 | AK278: 178.1 | AL278: 282 | AM278: 84.2 | AN278: 275 | AO278: -5.0000000000000003e-002 | AP278: 9 | AQ278: 节能转债
A279: 17 | B279: 127043 | C279: 川恒转债 | D279: 2895 | E279: 川恒股份 | F279: 化工 | G279: 农化 | H279: 178.607 | I279: 5.4299999999999994e-002 | J279: 3.3700000000000001e-002 | K279: 33.36 | L279: 9.9900000000000003e-002 | M279: 121 | N279: 21.02 | O279: 0.125 | P279: 158.71 | Q279: 2月23天 | R279: 5.71年 | S279: 3.71年 | T279: 11.6 | U279: 1268. | V279: 0.61799999999999999 | W279: 7.0999999999999994e-002 | X279: 0.113 | Y279: 163 | Z279: 5.15 | AA279: -6.7099999999999993e-002 | AB279: -7.2700000000000001e-002 | AC279: -0.126 | AD279: -0.127 | AE279: 82.24 | AF279: 86.03 | AG279: 0.88 | AH279: AA- | AI279: 6.2899999999999998e-002 | AJ279: =H279+100*O279 -> 191.107 | AK279: 198.5 | AL279: 312 | AM279: 112.5 | AN279: 319 | AO279: 3.2000000000000001e-002 | AP279: 6 | AQ279: 川恒转债
A280: 43 | B280: 123114 | C280: 三角转债 | D280: 300775 | E280: 三角防务 | F280: 航空航天 | G280: 航空航天 | H280: 176.18 | I280: 1.7000000000000001e-003 | J280: 3.15e-002 | K280: 47.28 | L280: 3.8699999999999998e-002 | M280: 121 | N280: 31.82 | O280: 0.18600000000000003 | P280: 148.59 | Q280: 3.5天 | R280: 5.49年 | S280: 3.49年 | T280: 9.04 | U280: 248 | V280: 0.155 | W280: 3.9e-002 | X280: 5.7000000000000002e-002 | Y280: 234 | Z280: 10.84 | AA280: -6.7299999999999999e-002 | AB280: -7.3200000000000001e-002 | AC280: -0.13100000000000001 | AD280: -0.13200000000000001 | AE280: 83.34 | AF280: 87.18 | AG280: 0.86 | AH280: AA- | AI280: 6.2899999999999998e-002 | AJ280: =H280+100*O280 -> 194.78 | AK280: 203.8 | AL280: 319 | AM280: 116.6 | AN280: 323 | AO280: -7.2000000000000008e-002 | AP280: 6 | AQ280: 三角转债
A281: 70 | B281: 123103 | C281: 震安转债! | D281: 300767 | E281: 震安科技 | F281: 化工 | G281: 橡胶塑料 | H281: 174.6 | I281: -5.1000000000000004e-003 | J281: -3.3e-003 | K281: 90.06 | L281: -9.5999999999999992e-003 | M281: 121.4 | N281: 56.89 | O281: 0.10300000000000001 | P281: 158.31 | Q281: 已到 | R281: 5.29年 | S281: 3.29年 | T281: 2.53 | U281: 99 | V281: 0.22399999999999998 | W281: 1.3999999999999999e-002 | X281: 2.2000000000000002e-002 | Y281: 182 | Z281: 15.52 | AA281: -6.7799999999999999e-002 | AB281: -7.3899999999999993e-002 | AC281: -0.13500000000000001 | AD281: -0.13699999999999998 | AE281: 82.02 | AF281: 84.07 | AG281: 0.88 | AH281: A+ | AI281: 7.3899999999999993e-002 | AJ281: =H281+100*O281 -> 184.90000000000001 | AK281: 190.9 | AL281: 301 | AM281: 106.8 | AN281: 314 | AO281: -3.1e-002 | AP281: 5 | AQ281: 震安转债!
A282: 195 | B282: 113585 | C282: 寿仙转债! | D282: 603896 | E282: 寿仙谷 | F282: 医药 | G282: 中药 | H282: 160.45 | I282: -1.24e-002 | J282: -8.0000000000000004e-004 | K282: 43.17 | L282: -1.4800000000000001e-002 | M282: 117.3 | N282: 28.38 | O282: 5.5e-002 | P282: 152.11 | Q282: 已到 | R282: 4.53年 | S282: 2.53年 | T282: 1.01 | U282: 24 | V282: 0.14999999999999999 | W282: 1.4999999999999999e-002 | X282: 2.3e-002 | Y282: 66 | Z282: 4.43 | AA282: -6.8099999999999994e-002 | AB282: -7.4099999999999999e-002 | AC282: -0.105 | AD282: -0.106 | AE282: 88.47 | AF282: 90.21 | AG282: 0.89 | AH282: AA- | AI282: 6.1100000000000002e-002 | AJ282: =H282+100*O282 -> 165.94999999999999 | AK282: 168.8 | AL282: 254 | AM282: 78.6 | AN282: 257 | AO282: -3.0000000000000001e-003 | AP282: 18 | AQ282: 寿仙转债!
A283: 361 | B283: 128021 | C283: 兄弟转债!! | D283: 2562 | E283: 兄弟科技 | F283: 医药 | G283: 原料药 | H283: 125.1 | I283: 3.4999999999999996e-003 | J283: 4.4000000000000003e-003 | K283: 4.79 | L283: 1.9099999999999999e-002 | M283: 108.8 | N283: 5.19 | O283: 0.35499999999999998 | P283: 92.29 | Q283: 已到 | R283: 2年1.1天 | S283: 1.1天 | T283: 2.65 | U283: 21 | V283: 6.3e-002 | W283: 5.2000000000000005e-002 | X283: 4.8000000000000001e-002 | Y283: 51 | Z283: 1.73 | AA283: -6.8499999999999991e-002 | AB283: -7.5899999999999995e-002 | AC283: <-100% | AD283: <-100% | AE283: 100.9 | AF283: 100.96 | AG283: 0.41 | AH283: AA | AI283: 3.8800000000000001e-002 | AJ283: =H283+100*O283 -> 160.59999999999999 | AK283: 157.9 | AL283: 176 | AM283: 56.9 | AN283: 131 | AO283: 6.8000000000000005e-002 | AP283: 18 | AQ283: 兄弟转债!!
A284: 207 | B284: 113577 | C284: 春秋转债! | D284: 603890 | E284: 春秋电子 | F284: 电子 | G284: 电子产品 | H284: 160.28 | I284: -2.1400000000000002e-002 | J284: -2.0799999999999999e-002 | K284: 13.66 | L284: -5.5300000000000002e-002 | M284: 117.7 | N284: 10.85 | O284: 0.27300000000000002 | P284: 125.9 | Q284: 已到 | R284: 4.38年 | S284: 2.38年 | T284: 1.78 | U284: 177 | V284: 0.61899999999999999 | W284: 2.9999999999999999e-002 | X284: 3.7000000000000005e-002 | Y284: 60 | Z284: 2.41 | AA284: -6.9400000000000003e-002 | AB284: -7.5800000000000006e-002 | AC284: -0.114 | AD284: -0.115 | AE284: 89.25 | AF284: 91.34 | AG284: 0.76 | AH284: AA- | AI284: 6.1100000000000002e-002 | AJ284: =H284+100*O284 -> 187.58000000000001 | AK284: 194.7 | AL284: 309 | AM284: 103.3 | AN284: 310 | AO284: 0.106 | AP284: 16 | AQ284: 春秋转债!
A285: 286 | B285: 113536 | C285: 三星转债 | D285: 603578 | E285: 三星新材 | F285: 家电 | G285: 零部件制 | H285: 147.06 | I285: -1.9e-002 | J285: 1.7299999999999999e-002 | K285: 17.9 | L285: -2.2000000000000001e-003 | M285: 114.3 | N285: 13.76 | O285: 0.13 | P285: 130.09 | Q285: 已到 | R285: 3.51年 | S285: 1.51年 | T285: 1.49 | U285: 29 | V285: 0.13 | W285: 6.5000000000000002e-002 | X285: 8.4000000000000005e-002 | Y285: 23 | Z285: 2.96 | AA285: -7.0599999999999996e-002 | AB285: -7.7100000000000002e-002 | AC285: -0.16600000000000001 | AD285: -0.16800000000000001 | AE285: 96.31 | AF285: 99.86 | AG285: 0.78 | AH285: AA | AI285: 4.0099999999999997e-002 | AJ285: =H285+100*O285 -> 160.06 | AK285: 164 | AL285: 225 | AM285: 64.2 | AN285: 175 | AO285: 3.5000000000000003e-002 | AP285: 35 | AQ285: 三星转债
A286: 9 | B286: 113629 | C286: 泉峰转债 | D286: 603982 | E286: 泉峰汽车 | F286: 汽车 | G286: 零部件制 | H286: 184.52 | I286: 2.52e-002 | J286: 4.5599999999999995e-002 | K286: 39 | L286: 7.9100000000000004e-002 | M286: 121 | N286: 23.03 | O286: 8.9999999999999997e-002 | P286: 169.34 | Q286: 3月25天 | R286: 5.80年 | S286: 3.80年 | T286: 6.2 | U286: 1836. | V286: 1.55 | W286: 7.9000000000000001e-002 | X286: 0.13400000000000001 | Y286: 79 | Z286: 4.73 | AA286: -7.1300000000000002e-002 | AB286: -7.690000000000001e-002 | AC286: -0.129 | AD286: -0.13100000000000001 | AE286: 81.79 | AF286: 85.56 | AG286: 0.89 | AH286: AA- | AI286: 6.2899999999999998e-002 | AJ286: =H286+100*O286 -> 193.52000000000001 | AK286: 199.7 | AL286: 314 | AM286: 114.1 | AN286: 321 | AO286: 0.12 | AP286: 3 | AQ286: 泉峰转债
A287: 299 | B287: 123025 | C287: 精测转债!! | D287: 300567 | E287: 精测电子 | F287: 电子 | G287: 液晶显示 | H287: 148.5 | I287: -7.000000000000001e-004 | J287: -1.9099999999999999e-002 | K287: 58.58 | L287: -2.7400000000000001e-002 | M287: 116.5 | N287: 49.37 | O287: 0.252 | P287: 118.66 | Q287: 已到 | R287: 3.33年 | S287: 1.33年 | T287: 3.09 | U287: 47 | V287: 0.10300000000000001 | W287: 1.9e-002 | X287: 2.2000000000000002e-002 | Y287: 163 | Z287: 5.04 | AA287: -7.1500000000000008e-002 | AB287: -7.9399999999999998e-002 | AC287: -0.19399999999999998 | AD287: -0.19600000000000001 | AE287: 94.15 | AF287: 96.01 | AG287: 0.72 | AH287: AA- | AI287: 6.1100000000000002e-002 | AJ287: =H287+100*O287 -> 173.69999999999999 | AK287: 178.3 | AL287: 284 | AM287: 82.3 | AN287: 272 | AO287: 4.5999999999999999e-002 | AP287: 14 | AQ287: 精测转债!!
A288: 199 | B288: 128109 | C288: 楚江转债! | D288: 2171 | E288: 楚江新材 | F288: 有色金属 | G288: 铜金属 | H288: 159.881 | I288: -3.0000000000000001e-003 | J288: -9.0000000000000011e-003 | K288: 12.28 | L288: -1.21e-002 | M288: 114.9 | N288: 8.63 | O288: 0.124 | P288: 142.29 | Q288: 已到 | R288: 4.52年 | S288: 2.52年 | T288: 18.2 | U288: 71 | V288: 2.4e-002 | W288: 0.111 | X288: 0.158 | Y288: 164 | Z288: 2.8 | AA288: -7.1800000000000003e-002 | AB288: -7.6999999999999999e-002 | AC288: -0.105 | AD288: -0.106 | AE288: 93.14 | AF288: 96.55 | AG288: 1 | AH288: AA | AI288: 4.0099999999999997e-002 | AJ288: =H288+100*O288 -> 172.28100000000001 | AK288: 177.5 | AL288: 278 | AM288: 80.9 | AN288: 267 | AO288: 7.5999999999999998e-002 | AP288: 6 | AQ288: 楚江转债!
A289: 126 | B289: 113607 | C289: 伟20转债!! | D289: 603568 | E289: 伟明环保 | F289: 城市公用 | G289: 三废处理 | H289: 165.84 | I289: 0.10000000000000001 | J289: -8.6999999999999994e-003 | K289: 36.2 | L289: 0.10000000000000001 | M289: 114.8 | N289: 21.71 | O289: -5.0000000000000001e-003 | P289: 166.74 | Q289: 已到 | R289: 4.93年 | S289: 2.93年 | T289: 9.4 | U289: 2120. | V289: 1.3899999999999999 | W289: 2.1000000000000001e-002 | X289: 3.4000000000000002e-002 | Y289: 455 | Z289: 7.35 | AA289: -7.2999999999999995e-002 | AB289: -7.7699999999999991e-002 | AC289: -0.13900000000000001 | AD289: -0.14099999999999999 | AE289: 91.54 | AF289: 94.9 | AG289: 0.91 | AH289: AA | AI289: 4.0099999999999997e-002 | AJ289: =H289+100*O289 -> 165.34 | AK289: 164.9 | AL289: 229 | AM289: 70 | AN289: 215 | AO289: 0.25900000000000001 | AP289: 11 | AQ289: 伟20转债!!
A290: 149 | B290: 113039 | C290: 嘉泽转债!! | D290: 601619 | E290: 嘉泽新能 | F290: 能源电力 | G290: 风能 | H290: 160.79 | I290: -1.3999999999999999e-002 | J290: -1.e-003 | K290: 5.18 | L290: -1.7100000000000001e-002 | M290: 112.8 | N290: 3.46 | O290: 7.400000000000001e-002 | P290: 149.71 | Q290: 已到 | R290: 4.74年 | S290: 2.74年 | T290: 2.89 | U290: 70 | V290: 0.14899999999999999 | W290: 2.3e-002 | X290: 3.5000000000000003e-002 | Y290: 125 | Z290: 2.64 | AA290: -7.3200000000000001e-002 | AB290: -7.7600000000000002e-002 | AC290: -0.14000000000000001 | AD290: -0.14099999999999999 | AE290: 92.23 | AF290: 93.96 | AG290: 0.88 | AH290: AA | AI290: 4.0099999999999997e-002 | AJ290: =H290+100*O290 -> 168.19 | AK290: 171.9 | AL290: 263 | AM290: 77.9 | AN290: 255 | AO290: -4.9000000000000002e-002 | AP290: 35 | AQ290: 嘉泽转债!!
A291: 47 | B291: 113048 | C291: 晶科转债!! | D291: 601778 | E291: 晶科科技 | F291: 能源电力 | G291: 太阳能 | H291: 175.39 | I291: 5.0300000000000004e-002 | J291: -1.2699999999999999e-002 | K291: 8.56 | L291: 4.2599999999999999e-002 | M291: 117.1 | N291: 5.46 | O291: 0.11900000000000001 | P291: 156.78 | Q291: 已到 | R291: 5.40年 | S291: 3.40年 | T291: 23 | U291: 554 | V291: 0.14000000000000001 | W291: 9.3000000000000013e-002 | X291: 0.14499999999999999 | Y291: 248 | Z291: 2.09 | AA291: -7.3200000000000001e-002 | AB291: -7.8100000000000003e-002 | AC291: -0.13300000000000001 | AD291: -0.13500000000000001 | AE291: 89.6 | AF291: 94.2 | AG291: 0.88 | AH291: AA | AI291: 4.1900000000000007e-002 | AJ291: =H291+100*O291 -> 187.28999999999999 | AK291: 194 | AL291: 307 | AM291: 99.8 | AN291: 305 | AO291: -3.2000000000000001e-002 | AP291: 15 | AQ291: 晶科转债!!
A292: 283 | B292: 113027 | C292: 华钰转债!! | D292: 601020 | E292: ST华钰 | F292: 有色金属 | G292: 锌铅镍锡 | H292: 149.95 | I292: -5.6999999999999993e-003 | J292: 7.6e-003 | K292: 13.18 | L292: 2.3e-003 | M292: 114.3 | N292: 10.17 | O292: 0.157 | P292: 129.6 | Q292: 已到 | R292: 3.55年 | S292: 1.55年 | T292: 3.11 | U292: 332 | V292: 0.70900000000000007 | W292: 4.2000000000000003e-002 | X292: 5.5e-002 | Y292: 73 | Z292: 2.82 | AA292: -7.4999999999999997e-002 | AB292: -8.14e-002 | AC292: -0.16899999999999998 | AD292: -0.17100000000000001 | AE292: 89.91 | AF292: 86.92 | AG292: 0.83 | AH292: A | AI292: 8.2100000000000006e-002 | AJ292: =H292+100*O292 -> 165.64999999999998 | AK292: 170.3 | AL292: 258 | AM292: 80.4 | AN292: 265 | AO292: -1.9e-002 | AP292: 43 | AQ292: 华钰转债!!
A293: 22 | B293: 123120 | C293: 隆华转债 | D293: 300263 | E293: 隆华科技 | F293: 机械装备 | G293: 通用设备 | H293: 187.9 | I293: -7.1999999999999998e-003 | J293: -1.e-004 | K293: 11.73 | L293: -8.5000000000000006e-003 | M293: 121.1 | N293: 7.76 | O293: 0.24299999999999999 | P293: 151.16 | Q293: 2月10天 | R293: 5.67年 | S293: 3.67年 | T293: 7.99 | U293: 65 | V293: 4.2999999999999997e-002 | W293: 7.4999999999999997e-002 | X293: 0.113 | Y293: 107 | Z293: 3.72 | AA293: -7.5800000000000006e-002 | AB293: -8.14e-002 | AC293: -0.13699999999999998 | AD293: -0.13800000000000001 | AE293: 82.58 | AF293: 86.32 | AG293: 0.87 | AH293: AA- | AI293: 6.2899999999999998e-002 | AJ293: =H293+100*O293 -> 212.20000000000002 | AK293: 224.6 | AL293: 331 | AM293: 138.3 | AN293: 335 | AO293: 1.1000000000000001e-002 | AP293: 3 | AQ293: 隆华转债
A294: 367 | B294: 113013 | C294: 国君转债! | D294: 601211 | E294: 国泰君安 | F294: 金融 | G294: 证券行业 | H294: 121.1 | I294: -2.3e-003 | J294: 1.4000000000000002e-003 | K294: 16.85 | L294: -3.0000000000000001e-003 | M294: 106.8 | N294: 18.45 | O294: 0.32600000000000001 | P294: 91.33 | Q294: 已到 | R294: 1.61年 | S294: 无权 | T294: 69.9 | U294: 20 | V294: 2.e-003 | W294: 4.7e-002 | X294: 4.2999999999999997e-002 | Y294: 1501. | Z294: 1.13 | AA294: -7.5899999999999995e-002 | AB294: -8.3100000000000007e-002 | AC294: 无权 | AD294: 无权 | AE294: 无权 | AF294: 101.61 | AG294: 0.32 | AH294: AAA | AI294: 3.1800000000000002e-002 | AJ294: =H294+100*O294 -> 153.69999999999999 | AK294: 150.9 | AL294: 132 | AM294: 49.3 | AN294: 85 | AO294: -2.e-002 | AP294: 11 | AQ294: 国君转债!
A295: 352 | B295: 128033 | C295: 迪龙转债! | D295: 2658 | E295: 雪迪龙 | F295: 城市公用 | G295: 三废处理 | H295: 128 | I295: 8.6999999999999994e-003 | J295: -1.e-003 | K295: 8.61 | L295: 1.5300000000000001e-002 | M295: 108.8 | N295: 8.56 | O295: 0.27300000000000002 | P295: 100.58 | Q295: 已到 | R295: 2年30天 | S295: 30天 | T295: 2.98 | U295: 152 | V295: 0.39899999999999997 | W295: 5.5e-002 | X295: 5.5e-002 | Y295: 54 | Z295: 2.22 | AA295: -7.6299999999999993e-002 | AB295: -8.3400000000000002e-002 | AC295: -0.90099999999999991 | AD295: -0.91000000000000003 | AE295: 100.6 | AF295: 100.66 | AG295: 0.5 | AH295: AA | AI295: 3.8800000000000001e-002 | AJ295: =H295+100*O295 -> 155.30000000000001 | AK295: 155.4 | AL295: 164 | AM295: 54.8 | AN295: 118 | AO295: 4.4000000000000004e-002 | AP295: 33 | AQ295: 迪龙转债!
A296: 231 | B296: 123043 | C296: 正元转债! | D296: 300645 | E296: 正元智慧 | F296: 计算机及 | G296: 软件开发 | H296: 171.8 | I296: 9.6500000000000002e-002 | J296: -2.6800000000000001e-002 | K296: 23.45 | L296: 8.0100000000000005e-002 | M296: 120.9 | N296: 15.38 | O296: 0.127 | P296: 152.47 | Q296: 已到 | R296: 4.27年 | S296: 2.27年 | T296: 1.66 | U296: 3357. | V296: 11.68 | W296: 5.5e-002 | X296: 8.4000000000000005e-002 | Y296: 30 | Z296: 4.52 | AA296: -8.0700000000000008e-002 | AB296: -8.8000000000000009e-002 | AC296: -0.13600000000000001 | AD296: -0.13699999999999998 | AE296: 88.03 | AF296: 90.51 | AG296: 0.87 | AH296: A+ | AI296: 7.2099999999999997e-002 | AJ296: =H296+100*O296 -> 184.5 | AK296: 191.1 | AL296: 302 | AM296: 100.6 | AN296: 307 | AO296: 0.13600000000000001 | AP296: 17 | AQ296: 正元转债!
A297: 238 | B297: 128096 | C297: 奥瑞转债!! | D297: 2701 | E297: 奥瑞金 | F297: 造纸包装 | G297: 包装材料 | H297: 165.869 | I297: -2.7999999999999997e-002 | J297: 4.3e-003 | K297: 7.07 | L297: -2.6200000000000001e-002 | M297: 115.5 | N297: 4.5 | O297: 5.5999999999999994e-002 | P297: 157.11 | Q297: 已到 | R297: 4.21年 | S297: 2.21年 | T297: 5.66 | U297: 58 | V297: 5.9999999999999998e-002 | W297: 3.3000000000000002e-002 | X297: 5.2000000000000005e-002 | Y297: 173 | Z297: 2.38 | AA297: -8.4100000000000008e-002 | AB297: -8.9800000000000005e-002 | AC297: -0.13300000000000001 | AD297: -0.13400000000000001 | AE297: 95.77 | AF297: 100.25 | AG297: 0.9 | AH297: AA+ | AI297: 3.5099999999999999e-002 | AJ297: =H297+100*O297 -> 171.46899999999999 | AK297: 174.6 | AL297: 270 | AM297: 74.4 | AN297: 240 | AO297: -3.6000000000000004e-002 | AP297: 17 | AQ297: 奥瑞转债!!
A298: 36 | B298: 127038 | C298: 国微转债 | D298: 2049 | E298: 紫光国微 | F298: 电子 | G298: 芯片制造 | H298: 185 | I298: 2.7000000000000001e-003 | J298: 6.6e-003 | K298: 205.36 | L298: 1.0700000000000001e-002 | M298: 114.5 | N298: 137.78 | O298: 0.24100000000000002 | P298: 149.05 | Q298: 20天 | R298: 5.53年 | S298: 3.53年 | T298: 15 | U298: 99 | V298: 3.6000000000000004e-002 | W298: 1.2e-002 | X298: 1.8000000000000002e-002 | Y298: 1246. | Z298: 18.96 | AA298: -8.4100000000000008e-002 | AB298: -8.8200000000000001e-002 | AC298: -0.14099999999999999 | AD298: -0.14199999999999999 | AE298: 90.15 | AF298: 93.98 | AG298: 0.87 | AH298: AA+ | AI298: 3.6900000000000002e-002 | AJ298: =H298+100*O298 -> 209.09999999999999 | AK298: 221 | AL298: 327 | AM298: 127 | AN298: 328 | AO298: -4.2999999999999997e-002 | AP298: 5 | AQ298: 国微转债
A299: 170 | B299: 123060 | C299: 苏试转债! | D299: 300416 | E299: 苏试试验 | F299: 机械装备 | G299: 专用设备 | H299: 177.63 | I299: -7.6e-003 | J299: -8.199999999999999e-003 | K299: 27.95 | L299: -1.7899999999999999e-002 | M299: 117.2 | N299: 18.28 | O299: 0.16200000000000001 | P299: 152.9 | Q299: 已到 | R299: 4.65年 | S299: 2.65年 | T299: 3.1 | U299: 66 | V299: 0.121 | W299: 4.2000000000000003e-002 | X299: 6.4000000000000001e-002 | Y299: 74 | Z299: 7.27 | AA299: -8.7100000000000011e-002 | AB299: -9.2699999999999991e-002 | AC299: -0.11699999999999999 | AD299: -0.11800000000000001 | AE299: 87.77 | AF299: 89.5 | AG299: 0.88 | AH299: AA- | AI299: 6.1100000000000002e-002 | AJ299: =H299+100*O299 -> 193.82999999999998 | AK299: 202.4 | AL299: 318 | AM299: 112.9 | AN299: 320 | AO299: 4.0999999999999995e-002 | AP299: 8 | AQ299: 苏试转债!
A300: 316 | B300: 113527 | C300: 维格转债!! | D300: 603518 | E300: 锦泓集团 | F300: 服装纺织 | G300: 服装行业 | H300: 159.45 | I300: -1.9900000000000001e-002 | J300: 5.5000000000000005e-003 | K300: 14.28 | L300: -1.72e-002 | M300: 119.5 | N300: 9.85 | O300: 0.10000000000000001 | P300: 144.97 | Q300: 已到 | R300: 3年58天 | S300: 1年58天 | T300: 2.86 | U300: 1717. | V300: 3.6899999999999999 | W300: 6.8000000000000005e-002 | X300: 9.8000000000000004e-002 | Y300: 42 | Z300: 1.74 | AA300: -8.8800000000000004e-002 | AB300: -9.820000000000001e-002 | AC300: -0.26000000000000001 | AD300: -0.26200000000000001 | AE300: 96.45 | AF300: 102.74 | AG300: 0.84 | AH300: AA | AI300: 5.0099999999999999e-002 | AJ300: =H300+100*O300 -> 169.44999999999999 | AK300: 173.9 | AL300: 268 | AM300: 71.2 | AN300: 223 | AO300: 0.17000000000000001 | AP300: 70 | AQ300: 维格转债!!
A301: 90 | B301: 113615 | C301: 金诚转债! | D301: 603979 | E301: 金诚信 | F301: 有色金属 | G301: 有色行业 | H301: 188 | I301: 2.1700000000000001e-002 | J301: -1.8e-003 | K301: 21.25 | L301: 2.1600000000000001e-002 | M301: 117.3 | N301: 12.65 | O301: 0.11900000000000001 | P301: 167.98 | Q301: 已到 | R301: 5年26天 | S301: 3年26天 | T301: 8.66 | U301: 296 | V301: 0.18100000000000002 | W301: 6.9000000000000006e-002 | X301: 0.115 | Y301: 126 | Z301: 2.55 | AA301: -9.0399999999999994e-002 | AB301: -9.5500000000000002e-002 | AC301: -0.10199999999999999 | AD301: -0.10300000000000001 | AE301: 91.02 | AF301: 95.69 | AG301: 0.92 | AH301: AA | AI301: 4.1900000000000007e-002 | AJ301: =H301+100*O301 -> 199.90000000000001 | AK301: 208 | AL301: 324 | AM301: 112.3 | AN301: 318 | AO301: 7.9000000000000001e-002 | AP301: 4 | AQ301: 金诚转债!
A302: 358 | B302: 128025 | C302: 特一转债! | D302: 2728 | E302: 特一药业 | F302: 医药 | G302: 化学制药 | H302: 131.405 | I302: 4.0000000000000002e-004 | J302: -1.1000000000000001e-002 | K302: 14.65 | L302: -1.7399999999999999e-002 | M302: 108.8 | N302: 14.05 | O302: 0.26000000000000001 | P302: 104.27 | Q302: 已到 | R302: 2年9天 | S302: 9天 | T302: 2.98 | U302: 652 | V302: 1.6699999999999999 | W302: 0.10000000000000001 | X302: 0.10400000000000001 | Y302: 30 | Z302: 2.99 | AA302: -9.0500000000000011e-002 | AB302: -9.7599999999999992e-002 | AC302: <-100% | AD302: <-100% | AE302: 100.44 | AF302: 96.95 | AG302: 0.61 | AH302: AA- | AI302: 5.9800000000000006e-002 | AJ302: =H302+100*O302 -> 157.405 | AK302: 158.5 | AL302: 181 | AM302: 58.1 | AN302: 136 | AO302: 9.0999999999999998e-002 | AP302: 48 | AQ302: 特一转债!
A303: 92 | B303: 123089 | C303: 九洲转2!! | D303: 300040 | E303: 九洲集团 | F303: 能源电力 | G303: 电力设备 | H303: 194.5 | I303: 8.8999999999999999e-003 | J303: 2.5999999999999999e-003 | K303: 10.69 | L303: 1.23e-002 | M303: 121 | N303: 5.68 | O303: 3.3000000000000002e-002 | P303: 188.2 | Q303: 已到 | R303: 5年24天 | S303: 3年24天 | T303: 3.06 | U303: 377 | V303: 0.64400000000000002 | W303: 4.9000000000000002e-002 | X303: 9.1999999999999998e-002 | Y303: 63 | Z303: 2.45 | AA303: -9.0999999999999998e-002 | AB303: -9.7200000000000009e-002 | AC303: -0.107 | AD303: -0.10800000000000001 | AE303: 85.52 | AF303: 89.47 | AG303: 0.93 | AH303: AA- | AI303: 6.2899999999999998e-002 | AJ303: =H303+100*O303 -> 197.80000000000001 | AK303: 200.8 | AL303: 315 | AM303: 111.3 | AN303: 317 | AO303: 2.e-002 | AP303: 18 | AQ303: 九洲转2!!
A304: 220 | B304: 128103 | C304: 同德转债! | D304: 2360 | E304: 同德化工 | F304: 化工 | G304: 化工 | H304: 183.3 | I304: -1.54e-002 | J304: 1.e-003 | K304: 8.8 | L304: -1.5700000000000002e-002 | M304: 121.3 | N304: 5.08 | O304: 5.7999999999999996e-002 | P304: 173.23 | Q304: 已到 | R304: 4.33年 | S304: 2.33年 | T304: 0.88 | U304: 107 | V304: 0.65400000000000003 | W304: 2.5000000000000001e-002 | X304: 4.4000000000000004e-002 | Y304: 35 | Z304: 2.63 | AA304: -9.2899999999999996e-002 | AB304: -0.10000000000000001 | AC304: -0.14400000000000002 | AD304: -0.14599999999999999 | AE304: 87.79 | AF304: 90.46 | AG304: 0.91 | AH304: A+ | AI304: 7.2099999999999997e-002 | AJ304: =H304+100*O304 -> 189.10000000000002 | AK304: 193.4 | AL304: 305 | AM304: 102.9 | AN304: 309 | AO304: 2.5000000000000001e-002 | AP304: 17 | AQ304: 同德转债!
A305: 37 | B305: 113049 | C305: 长汽转债 | D305: 601633 | E305: 长城汽车 | F305: 汽车 | G305: 乘用车 | H305: 190.57 | I305: 1.9e-003 | J305: -1.1999999999999999e-003 | K305: 58.95 | L305: 8.0000000000000004e-004 | M305: 110.5 | N305: 38.01 | O305: 0.22899999999999998 | P305: 155.09 | Q305: 20天 | R305: 5.53年 | S305: 3.53年 | T305: 35 | U305: 88 | V305: 1.3000000000000001e-002 | W305: 6.0000000000000001e-003 | X305: 1.e-002 | Y305: 5444. | Z305: 9.28 | AA305: -9.4700000000000006e-002 | AB305: -9.7699999999999995e-002 | AC305: -0.14800000000000002 | AD305: -0.14899999999999999 | AE305: 90.13 | AF305: 91.62 | AG305: 0.89 | AH305: AAA | AI305: 3.49e-002 | AJ305: =H305+100*O305 -> 213.47 | AK305: 226 | AL305: 332 | AM305: 134.4 | AN305: 332 | AO305: -4.8000000000000001e-002 | AP305: 5 | AQ305: 长汽转债
A306: 151 | B306: 128128 | C306: 齐翔转2! | D306: 2408 | E306: 齐翔腾达 | F306: 化工 | G306: 化工 | H306: 183 | I306: 3.95e-002 | J306: 1.2199999999999999e-002 | K306: 10.1 | L306: 5.5399999999999998e-002 | M306: 115 | N306: 5.69 | O306: 3.1e-002 | P306: 177.5 | Q306: 已到 | R306: 4.73年 | S306: 2.73年 | T306: 6.81 | U306: 565 | V306: 0.45399999999999996 | W306: 2.4e-002 | X306: 4.2000000000000003e-002 | Y306: 287 | Z306: 2.31 | AA306: -9.5100000000000004e-002 | AB306: -9.9900000000000003e-002 | AC306: -0.11699999999999999 | AD306: -0.11800000000000001 | AE306: 92.38 | AF306: 95.84 | AG306: 0.93 | AH306: AA | AI306: 4.0099999999999997e-002 | AJ306: =H306+100*O306 -> 186.09999999999999 | AK306: 188.5 | AL306: 296 | AM306: 92.7 | AN306: 290 | AO306: 2.5000000000000001e-002 | AP306: 28 | AQ306: 齐翔转2!
A307: 192 | B307: 128113 | C307: 比音转债! | D307: 2832 | E307: 比音勒芬 | F307: 服装纺织 | G307: 服装行业 | H307: 183.85 | I307: -7.3000000000000001e-003 | J307: -1.6000000000000001e-003 | K307: 24.62 | L307: -9.7000000000000003e-003 | M307: 116.9 | N307: 14.6 | O307: 8.9999999999999997e-002 | P307: 168.63 | Q307: 已到 | R307: 4.55年 | S307: 2.55年 | T307: 2.98 | U307: 8.9 | V307: 1.6e-002 | W307: 2.2000000000000002e-002 | X307: 3.7000000000000005e-002 | Y307: 135 | Z307: 4.58 | AA307: -9.6300000000000011e-002 | AB307: -0.10199999999999999 | AC307: -0.13 | AD307: -0.13100000000000001 | AE307: 93.03 | AF307: 98.11 | AG307: 0.92 | AH307: AA | AI307: 4.0099999999999997e-002 | AJ307: =H307+100*O307 -> 192.84999999999999 | AK307: 199.1 | AL307: 313 | AM307: 101 | AN307: 308 | AO307: -1.3999999999999999e-002 | AP307: 8 | AQ307: 比音转债!
A308: 363 | B308: 110038 | C308: 济川转债! | D308: 600566 | E308: 济川药业 | F308: 医药 | G308: 中药 | H308: 116.86 | I308: -9.4999999999999998e-003 | J308: 8.8000000000000005e-003 | K308: 18.26 | L308: -1.78e-002 | M308: 106 | N308: 23.4 | O308: 0.498 | P308: 78.03 | Q308: 已到 | R308: 0.96年 | S308: 回售内 | T308: 6.27 | U308: 109 | V308: 0.14899999999999999 | W308: 3.9e-002 | X308: 2.9999999999999999e-002 | Y308: 162 | Z308: 1.89 | AA308: -9.64e-002 | AB308: -0.107 | AC308: 回售内 | AD308: 回售内 | AE308: 101 | AF308: 102.5 | AG308: 0.04 | AH308: AA | AI308: 3.5499999999999997e-002 | AJ308: =H308+100*O308 -> 166.66 | AK308: 155.7 | AL308: 167 | AM308: 53.2 | AN308: 107 | AO308: -1.7000000000000001e-002 | AP308: 22 | AQ308: 济川转债!
A309: 271 | B309: 113545 | C309: 金能转债! | D309: 603113 | E309: 金能科技 | F309: 煤炭 | G309: 炼焦 | H309: 168.39 | I309: 1.8e-003 | J309: -1.9699999999999999e-002 | K309: 14.94 | L309: -2.1000000000000001e-002 | M309: 114.3 | N309: 10.43 | O309: 0.17600000000000002 | P309: 143.24 | Q309: 已到 | R309: 3.88年 | S309: 1.88年 | T309: 9.87 | U309: 49 | V309: 2.9999999999999999e-002 | W309: 7.6999999999999999e-002 | X309: 0.111 | Y309: 128 | Z309: 1.46 | AA309: -9.6500000000000002e-002 | AB309: -0.10199999999999999 | AC309: -0.16800000000000001 | AD309: -0.16899999999999998 | AE309: 94.91 | AF309: 98.4 | AG309: 0.86 | AH309: AA | AI309: 4.0099999999999997e-002 | AJ309: =H309+100*O309 -> 185.98999999999998 | AK309: 193.5 | AL309: 306 | AM309: 95.1 | AN309: 295 | AO309: 3.1e-002 | AP309: 13 | AQ309: 金能转债!
A310: 255 | B310: 128082 | C310: 华锋转债!! | D310: 2806 | E310: 华锋股份 | F310: 电子 | G310: 元器件制 | H310: 182.01 | I310: 0. | J310: -4.0000000000000001e-003 | K310: 16.3 | L310: -4.3e-003 | M310: 121.4 | N310: 9.13 | O310: 1.9e-002 | P310: 178.53 | Q310: 已到 | R310: 4年7天 | S310: 2年7天 | T310: 2.04 | U310: 144 | V310: 0.38600000000000001 | W310: 6.5000000000000002e-002 | X310: 0.11599999999999999 | Y310: 31 | Z310: 2.74 | AA310: -9.8100000000000007e-002 | AB310: -0.106 | AC310: -0.17000000000000001 | AD310: -0.17199999999999999 | AE310: 88.19 | AF310: 89.27 | AG310: 0.92 | AH310: A | AI310: 8.2100000000000006e-002 | AJ310: =H310+100*O310 -> 183.91 | AK310: 185.5 | AL310: 293 | AM310: 96.2 | AN310: 298 | AO310: 7.8e-002 | AP310: 50 | AQ310: 华锋转债!!
A311: 131 | B311: 123071 | C311: 天能转债!! | D311: 300569 | E311: 天能重工 | F311: 能源电力 | G311: 风能 | H311: 200 | I311: 4.9400000000000006e-002 | J311: -1.4000000000000002e-003 | K311: 15.2 | L311: 5.1200000000000002e-002 | M311: 120.7 | N311: 7.91 | O311: 4.0999999999999995e-002 | P311: 192.16 | Q311: 已到 | R311: 4.90年 | S311: 2.90年 | T311: 6.94 | U311: 1430. | V311: 1.0600000000000001 | W311: 5.7999999999999996e-002 | X311: 0.111 | Y311: 121 | Z311: 3.44 | AA311: -9.9499999999999991e-002 | AB311: -0.106 | AC311: -0.12 | AD311: -0.121 | AE311: 86.53 | AF311: 90.8 | AG311: 0.94 | AH311: AA- | AI311: 6.1100000000000002e-002 | AJ311: =H311+100*O311 -> 204.09999999999999 | AK311: 207.8 | AL311: 323 | AM311: 117 | AN311: 324 | AO311: 0.153 | AP311: 13 | AQ311: 天能转债!!
A312: 75 | B312: 118000 | C312: 嘉元转债! | D312: 688388 | E312: 嘉元科技 | F312: 电子 | G312: 电子产品 | H312: 207.96 | I312: 2.3399999999999997e-002 | J312: 1.1699999999999999e-002 | K312: 153.33 | L312: 3.7599999999999995e-002 | M312: 121 | N312: 78.74 | O312: 6.8000000000000005e-002 | P312: 194.73 | Q312: 已到 | R312: 5.24年 | S312: 3.24年 | T312: 9.79 | U312: 441 | V312: 0.214 | W312: 2.7000000000000003e-002 | X312: 5.2999999999999999e-002 | Y312: 359 | Z312: 11.98 | AA312: -9.98e-002 | AB312: -0.106 | AC312: -0.107 | AD312: -0.107 | AE312: 84.61 | AF312: 88.51 | AG312: 0.93 | AH312: AA- | AI312: 6.2899999999999998e-002 | AJ312: =H312+100*O312 -> 214.76000000000002 | AK312: 221.2 | AL312: 328 | AM312: 132.7 | AN312: 331 | AO312: 2.7000000000000003e-002 | AP312: 6 | AQ312: 嘉元转债!
A313: 81 | B313: 113621 | C313: 彤程转债! | D313: 603650 | E313: 彤程新材 | F313: 化工 | G313: 橡胶塑料 | H313: 196.73 | I313: -1.1200000000000002e-002 | J313: 5.0000000000000001e-003 | K313: 55.15 | L313: -6.7000000000000002e-003 | M313: 115.1 | N313: 32.62 | O313: 0.16399999999999998 | P313: 169.07 | Q313: 已到 | R313: 5.16年 | S313: 3.16年 | T313: 5.37 | U313: 78 | V313: 7.2999999999999995e-002 | W313: 1.6e-002 | X313: 2.7999999999999997e-002 | Y313: 328 | Z313: 12.28 | AA313: -0.10000000000000001 | AB313: -0.105 | AC313: -0.10400000000000001 | AD313: -0.105 | AE313: 90.48 | AF313: 93.51 | AG313: 0.93 | AH313: AA | AI313: 4.1900000000000007e-002 | AJ313: =H313+100*O313 -> 213.13 | AK313: 224.4 | AL313: 330 | AM313: 130.9 | AN313: 330 | AO313: -7.4999999999999997e-002 | AP313: 7 | AQ313: 彤程转债!
A314: 375 | B314: 110034 | C314: 九州转债! | D314: 600998 | E314: 九州通 | F314: 医药 | G314: 医药商业 | H314: 109.57 | I314: 5.5000000000000005e-003 | J314: -5.5000000000000005e-003 | K314: 13.89 | L314: 5.1000000000000004e-003 | M314: 108 | N314: 17.83 | O314: 0.40700000000000003 | P314: 77.9 | Q314: 已到 | R314: 49天 | S314: 回售内 | T314: 15 | U314: 30 | V314: 1.8000000000000002e-002 | W314: 5.7999999999999996e-002 | X314: 4.4999999999999998e-002 | Y314: 260 | Z314: 1.24 | AA314: -0.10199999999999999 | AB314: -0.19600000000000001 | AC314: 回售内 | AD314: 回售内 | AE314: 103 | AF314: 107.56 | AG314: 0 | AH314: AA+ | AI314: 3.0800000000000001e-002 | AJ314: =H314+100*O314 -> 150.26999999999998 | AK314: 141.2 | AL314: 37 | AM314: 33.7 | AN314: 11 | AO314: 2.3e-002 | AP314: 29 | AQ314: 九州转债!
A315: 65 | B315: 127030 | C315: 盛虹转债! | D315: 301 | E315: 东方盛虹 | F315: 化工 | G315: 化纤 | H315: 198 | I315: 3.0000000000000001e-003 | J315: 9.0000000000000011e-003 | K315: 23.2 | L315: 1.3100000000000001e-002 | M315: 112.5 | N315: 14.1 | O315: 0.20300000000000001 | P315: 164.54 | Q315: 已到 | R315: 5.32年 | S315: 3.32年 | T315: 50 | U315: 133 | V315: 1.3000000000000001e-002 | W315: 4.4999999999999998e-002 | X315: 7.2999999999999995e-002 | Y315: 1122. | Z315: 9.89 | AA315: -0.10199999999999999 | AB315: -0.106 | AC315: -0.16500000000000001 | AD315: -0.16600000000000001 | AE315: 90.87 | AF315: 93.08 | AG315: 0.92 | AH315: AA+ | AI315: 3.6900000000000002e-002 | AJ315: =H315+100*O315 -> 218.30000000000001 | AK315: 231.5 | AL315: 334 | AM315: 138.4 | AN315: 336 | AO315: 3.0000000000000001e-003 | AP315: 5 | AQ315: 盛虹转债!
A316: 31 | B316: 113626 | C316: 伯特转债 | D316: 603596 | E316: 伯特利 | F316: 汽车 | G316: 零部件制 | H316: 220.86 | I316: 3.9399999999999998e-002 | J316: 1.47e-002 | K316: 69.12 | L316: 5.7699999999999994e-002 | M316: 121.1 | N316: 36.01 | O316: 0.151 | P316: 191.95 | Q316: 39天 | R316: 5.59年 | S316: 3.59年 | T316: 9.02 | U316: 419 | V316: 0.215 | W316: 3.2000000000000001e-002 | X316: 6.0999999999999999e-002 | Y316: 282 | Z316: 8.92 | AA316: -0.10300000000000001 | AB316: -0.109 | AC316: -0.17300000000000001 | AD316: -0.17399999999999999 | AE316: 88.93 | AF316: 96.68 | AG316: 0.94 | AH316: AA | AI316: 4.1900000000000007e-002 | AJ316: =H316+100*O316 -> 235.96000000000001 | AK316: 249.8 | AL316: 340 | AM316: 153.1 | AN316: 339 | AO316: 9.8000000000000004e-002 | AP316: 3 | AQ316: 伯特转债
A317: 364 | B317: 113502 | C317: 嘉澳转债! | D317: 603822 | E317: 嘉澳环保 | F317: 化工 | G317: 化工 | H317: 136.07 | I317: 7.000000000000001e-004 | J317: 7.000000000000001e-004 | K317: 49.94 | L317: 2.e-003 | M317: 109.8 | N317: 44.64 | O317: 0.21600000000000003 | P317: 111.87 | Q317: 已到 | R317: 1.95年 | S317: 回售内 | T317: 1.84 | U317: 47 | V317: 0.188 | W317: 5.0000000000000003e-002 | X317: 5.5999999999999994e-002 | Y317: 37 | Z317: 4.41 | AA317: -0.105 | AB317: -0.113 | AC317: 回售内 | AD317: 回售内 | AE317: 100.3 | AF317: 98.12 | AG317: 0.68 | AH317: AA- | AI317: 5.9800000000000006e-002 | AJ317: =H317+100*O317 -> 157.66999999999999 | AK317: 160.3 | AL317: 193 | AM317: 60 | AN317: 148 | AO317: 0.12 | AP317: 34 | AQ317: 嘉澳转债!
A318: 260 | B318: 123035 | C318: 利德转债!! | D318: 300296 | E318: 利亚德 | F318: 电子 | G318: LED制 | H318: 178.5 | I318: -2.2400000000000003e-002 | J318: -1.6200000000000003e-002 | K318: 10.45 | L318: -4.3899999999999995e-002 | M318: 114.3 | N318: 6.96 | O318: 0.18899999999999997 | P318: 150.14 | Q318: 已到 | R318: 3.96年 | S318: 1.96年 | T318: 7.99 | U318: 331 | V318: 0.23100000000000001 | W318: 2.9999999999999999e-002 | X318: 4.4999999999999998e-002 | Y318: 266 | Z318: 3.46 | AA318: -0.10800000000000001 | AB318: -0.113 | AC318: -0.17399999999999999 | AD318: -0.17499999999999999 | AE318: 95.56 | AF318: 99.93 | AG318: 0.88 | AH318: AA+ | AI318: 3.5099999999999999e-002 | AJ318: =H318+100*O318 -> 197.40000000000001 | AK318: 206.9 | AL318: 322 | AM318: 106.9 | AN318: 315 | AO318: 3.1e-002 | AP318: 13 | AQ318: 利德转债!!
A319: 258 | B319: 113550 | C319: 常汽转债! | D319: 603035 | E319: 常熟汽饰 | F319: 汽车 | G319: 零部件制 | H319: 188.12 | I319: 2.5999999999999999e-003 | J319: 1.1899999999999999e-002 | K319: 16.03 | L319: 1.5800000000000002e-002 | M319: 120.5 | N319: 9.33 | O319: 9.5000000000000001e-002 | P319: 171.81 | Q319: 已到 | R319: 3.98年 | S319: 1.98年 | T319: 2.14 | U319: 1266. | V319: 3.1699999999999999 | W319: 3.7000000000000005e-002 | X319: 6.4000000000000001e-002 | Y319: 58 | Z319: 1.48 | AA319: -0.10800000000000001 | AB319: -0.115 | AC319: -0.184 | AD319: -0.185 | AE319: 91.17 | AF319: 95.67 | AG319: 0.92 | AH319: AA- | AI319: 6.1100000000000002e-002 | AJ319: =H319+100*O319 -> 197.62 | AK319: 204.4 | AL319: 320 | AM319: 108.8 | AN319: 316 | AO319: 0.19800000000000001 | AP319: 15 | AQ319: 常汽转债!
A320: 223 | B320: 128101 | C320: 联创转债!! | D320: 2036 | E320: 联创电子 | F320: 电子 | G320: 液晶显示 | H320: 189 | I320: -2.2099999999999998e-002 | J320: -1.3999999999999999e-002 | K320: 22.15 | L320: -3.9900000000000005e-002 | M320: 114.8 | N320: 13.72 | O320: 0.17100000000000001 | P320: 161.44 | Q320: 已到 | R320: 4.30年 | S320: 2.30年 | T320: 3 | U320: 116 | V320: 0.20399999999999999 | W320: 1.3000000000000001e-002 | X320: 2.1000000000000001e-002 | Y320: 235 | Z320: 6.03 | AA320: -0.111 | AB320: -0.11599999999999999 | AC320: -0.154 | AD320: -0.155 | AE320: 93.84 | AF320: 97.29 | AG320: 0.91 | AH320: AA | AI320: 4.0099999999999997e-002 | AJ320: =H320+100*O320 -> 206.09999999999999 | AK320: 216.6 | AL320: 325 | AM320: 119.3 | AN320: 325 | AO320: 1.9e-002 | AP320: 14 | AQ320: 联创转债!!
A321: 240 | B321: 128094 | C321: 星帅转债! | D321: 2860 | E321: 星帅尔 | F321: 家电 | G321: 零部件制 | H321: 196.772 | I321: -1.37e-002 | J321: 2.8999999999999998e-003 | K321: 26.99 | L321: -1.1399999999999999e-002 | M321: 121 | N321: 13.8 | O321: 6.0000000000000001e-003 | P321: 195.58 | Q321: 已到 | R321: 4年50天 | S321: 2年50天 | T321: 2.09 | U321: 528 | V321: 1.27 | W321: 3.7999999999999999e-002 | X321: 7.400000000000001e-002 | Y321: 55 | Z321: 4.78 | AA321: -0.113 | AB321: -0.12 | AC321: -0.17600000000000002 | AD321: -0.17699999999999999 | AE321: 88.86 | AF321: 91.42 | AG321: 0.95 | AH321: A+ | AI321: 7.2099999999999997e-002 | AJ321: =H321+100*O321 -> 197.37199999999999 | AK321: 198 | AL321: 311 | AM321: 106.5 | AN321: 313 | AO321: 0.20899999999999999 | AP321: 30 | AQ321: 星帅转债!
A322: 101 | B322: 123086 | C322: 海兰转债!! | D322: 300065 | E322: 海兰信 | F322: 电子 | G322: 电子产品 | H322: 235 | I322: -5.2000000000000005e-002 | J322: -1.e-002 | K322: 16.92 | L322: -6.4199999999999993e-002 | M322: 123.5 | N322: 7.27 | O322: 1.e-002 | P322: 232.74 | Q322: 已到 | R322: 5年14天 | S322: 3年14天 | T322: 4.83 | U322: 3794. | V322: 3.1499999999999999 | W322: 4.5999999999999999e-002 | X322: 0.107 | Y322: 105 | Z322: 6.33 | AA322: -0.122 | AB322: -0.128 | AC322: -0.13200000000000001 | AD322: -0.13300000000000001 | AE322: 85.6 | AF322: 91.43 | AG322: 0.97 | AH322: AA- | AI322: 6.2899999999999998e-002 | AJ322: =H322+100*O322 -> 236. | AK322: 237.3 | AL322: 336 | AM322: 145.8 | AN322: 337 | AO322: 0.14000000000000001 | AP322: 19 | AQ322: 海兰转债!!
A323: 214 | B323: 113034 | C323: 滨化转债! | D323: 601678 | E323: 滨化股份 | F323: 化工 | G323: 化工 | H323: 202.67 | I323: -3.4000000000000002e-003 | J323: 4.5999999999999999e-003 | K323: 8.41 | L323: 1.1999999999999999e-003 | M323: 114.8 | N323: 4.58 | O323: 0.10400000000000001 | P323: 183.62 | Q323: 已到 | R323: 4.37年 | S323: 2.37年 | T323: 4.68 | U323: 221 | V323: 0.23100000000000001 | W323: 2.7999999999999997e-002 | X323: 5.2000000000000005e-002 | Y323: 165 | Z323: 1.69 | AA323: -0.124 | AB323: -0.129 | AC323: -0.161 | AD323: -0.16200000000000001 | AE323: 93.59 | AF323: 97.03 | AG323: 0.94 | AH323: AA | AI323: 4.0099999999999997e-002 | AJ323: =H323+100*O323 -> 213.06999999999999 | AK323: 221.7 | AL323: 329 | AM323: 124.7 | AN323: 327 | AO323: 6.9000000000000006e-002 | AP323: 20 | AQ323: 滨化转债!
A324: 314 | B324: 110051 | C324: 中天转债!! | D324: 600522 | E324: 中天科技 | F324: 通信互联 | G324: 通信设备 | H324: 174.9 | I324: 1.8200000000000001e-002 | J324: -3.7000000000000002e-003 | K324: 17.52 | L324: 1.4499999999999999e-002 | M324: 113.3 | N324: 9.99 | O324: -3.0000000000000001e-003 | P324: 175.38 | Q324: 已到 | R324: 3.26年 | S324: 1.26年 | T324: 25.8 | U324: 1998. | V324: 0.44500000000000001 | W324: 4.8000000000000001e-002 | X324: 8.4000000000000005e-002 | Y324: 537 | Z324: 2.33 | AA324: -0.127 | AB324: -0.13300000000000001 | AC324: -0.27800000000000002 | AD324: -0.28000000000000003 | AE324: 97.93 | AF324: 101.51 | AG324: 1 | AH324: AA+ | AI324: 3.5099999999999999e-002 | AJ324: =H324+100*O324 -> 174.59999999999999 | AK324: 174.4 | AL324: 269 | AM324: 72.9 | AN324: 233 | AO324: 8.6999999999999994e-002 | AP324: 25 | AQ324: 中天转债!!
A325: 279 | B325: 113541 | C325: 荣晟转债!! | D325: 603165 | E325: 荣晟环保 | F325: 造纸包装 | G325: 包装用纸 | H325: 188.85 | I325: 6.3e-003 | J325: 4.6999999999999993e-003 | K325: 20.11 | L325: 1.1599999999999999e-002 | M325: 114.3 | N325: 10.84 | O325: 1.8000000000000002e-002 | P325: 185.52 | Q325: 已到 | R325: 3.65年 | S325: 1.65年 | T325: 1.63 | U325: 901 | V325: 2.8799999999999999 | W325: 3.1e-002 | X325: 5.7000000000000002e-002 | Y325: 53 | Z325: 3.06 | AA325: -0.13 | AB325: -0.13600000000000001 | AC325: -0.22899999999999998 | AD325: -0.23000000000000001 | AE325: 92.37 | AF325: 92.44 | AG325: 0.95 | AH325: AA- | AI325: 6.1100000000000002e-002 | AJ325: =H325+100*O325 -> 190.65000000000001 | AK325: 192.2 | AL325: 304 | AM325: 99.7 | AN325: 304 | AO325: 0.25700000000000001 | AP325: 40 | AQ325: 荣晟转债!!
A326: 230 | B326: 113568 | C326: 新春转债!! | D326: 603667 | E326: 五洲新春 | F326: 机械装备 | G326: 通用设备 | H326: 226.46 | I326: -4.6999999999999993e-003 | J326: -2.0999999999999999e-003 | K326: 18.07 | L326: -7.0999999999999995e-003 | M326: 124.3 | N326: 8.75 | O326: 9.6999999999999989e-002 | P326: 206.51 | Q326: 已到 | R326: 4.27年 | S326: 2.27年 | T326: 2.44 | U326: 227 | V326: 0.41700000000000004 | W326: 4.4999999999999998e-002 | X326: 9.1999999999999998e-002 | Y326: 54 | Z326: 2.89 | AA326: -0.13400000000000001 | AB326: -0.14099999999999999 | AC326: -0.187 | AD326: -0.18899999999999997 | AE326: 90.36 | AF326: 97.13 | AG326: 0.95 | AH326: AA- | AI326: 6.1100000000000002e-002 | AJ326: =H326+100*O326 -> 236.16 | AK326: 246.4 | AL326: 339 | AM326: 149.3 | AN326: 338 | AO326: 8.900000000000001e-002 | AP326: 39 | AQ326: 新春转债!!
A327: 331 | B327: 123014 | C327: 凯发转债! | D327: 300407 | E327: 凯发电气 | F327: 能源电力 | G327: 电力设备 | H327: 137 | I327: 4.5999999999999999e-003 | J327: 3.7000000000000002e-003 | K327: 8.55 | L327: 1.3000000000000001e-002 | M327: 107.5 | N327: 8.05 | O327: 0.28999999999999998 | P327: 106.21 | Q327: 已到 | R327: 1.66年 | S327: 回售内 | T327: 1.16 | U327: 18 | V327: 0.115 | W327: 4.4999999999999998e-002 | X327: 4.7e-002 | Y327: 26 | Z327: 1.89 | AA327: -0.13699999999999998 | AB327: -0.14400000000000002 | AC327: 回售内 | AD327: 回售内 | AE327: 100.25 | AF327: 96.03 | AG327: 0.63 | AH327: A+ | AI327: 7.0800000000000002e-002 | AJ327: =H327+100*O327 -> 166. | AK327: 167.8 | AL327: 250 | AM327: 67.5 | AN327: 200 | AO327: 5.9999999999999998e-002 | AP327: 15 | AQ327: 凯发转债!
A328: 373 | B328: 127003 | C328: 海印转债! | D328: 861 | E328: 海印股份 | F328: 商业零售 | G328: 商场 | H328: 118.992 | I328: 3.4500000000000003e-002 | J328: -1.9099999999999999e-002 | K328: 2.88 | L328: 9.9199999999999997e-002 | M328: 110 | N328: 2.99 | O328: 0.23499999999999999 | P328: 96.32 | Q328: 已到 | R328: 0.53年 | S328: 回售内 | T328: 6.74 | U328: 240 | V328: 0.30199999999999999 | W328: 0.10099999999999999 | X328: 9.6999999999999989e-002 | Y328: 67 | Z328: 1.83 | AA328: -0.13800000000000001 | AB328: -0.16699999999999998 | AC328: 回售内 | AD328: 回售内 | AE328: 100.33 | AF328: 107.99 | AG328: 0.16 | AH328: AA | AI328: 3.5499999999999997e-002 | AJ328: =H328+100*O328 -> 142.49200000000002 | AK328: 141.7 | AL328: 41 | AM328: 33.7 | AN328: 10 | AO328: 0.32600000000000001 | AP328: 71 | AQ328: 海印转债!
A329: 89 | B329: 123092 | C329: 天壕转债! | D329: 300332 | E329: 天壕环境 | F329: 石油天然 | G329: 天然气 | H329: 255 | I329: 5.1999999999999998e-003 | J329: 9.1999999999999998e-003 | K329: 12.98 | L329: 1.49e-002 | M329: 121.6 | N329: 5.19 | O329: 2.e-002 | P329: 250.1 | Q329: 已到 | R329: 5年27天 | S329: 3年27天 | T329: 4.17 | U329: 996 | V329: 0.93900000000000006 | W329: 3.6000000000000004e-002 | X329: 9.0999999999999998e-002 | Y329: 114 | Z329: 3.36 | AA329: -0.13800000000000001 | AB329: -0.14400000000000002 | AC329: -0.13800000000000001 | AD329: -0.13900000000000001 | AE329: 83.3 | AF329: 85.51 | AG329: 0.97 | AH329: A+ | AI329: 7.3899999999999993e-002 | AJ329: =H329+100*O329 -> 257. | AK329: 259.9 | AL329: 343 | AM329: 174.4 | AN329: 345 | AO329: 0.157 | AP329: 9 | AQ329: 天壕转债!
A330: 102 | B330: 123084 | C330: 高澜转债!! | D330: 300499 | E330: 高澜股份 | F330: 能源电力 | G330: 电力设备 | H330: 254.442 | I330: 5.6999999999999993e-003 | J330: -5.6999999999999993e-003 | K330: 20.01 | L330: 0. | M330: 121.9 | N330: 9.01 | O330: 0.14599999999999999 | P330: 222.09 | Q330: 已到 | R330: 5年13天 | S330: 3年13天 | T330: 2.54 | U330: 1049. | V330: 1.6200000000000001 | W330: 4.5999999999999999e-002 | X330: 0.10099999999999999 | Y330: 56 | Z330: 6.52 | AA330: -0.13900000000000001 | AB330: -0.14400000000000002 | AC330: -0.14000000000000001 | AD330: -0.14099999999999999 | AE330: 83.7 | AF330: 85.98 | AG330: 0.96 | AH330: A+ | AI330: 7.3899999999999993e-002 | AJ330: =H330+100*O330 -> 269.04200000000003 | AK330: 286.8 | AL330: 352 | AM330: 200.8 | AN330: 353 | AO330: 2.5000000000000001e-002 | AP330: 14 | AQ330: 高澜转债!!
A331: 306 | B331: 110055 | C331: 伊力转债!! | D331: 600197 | E331: 伊力特 | F331: 食品饮料 | G331: 白酒 | H331: 192 | I331: -6.0000000000000001e-003 | J331: -9.8999999999999991e-003 | K331: 25.51 | L331: -1.7299999999999999e-002 | M331: 114.3 | N331: 16.41 | O331: 0.23499999999999999 | P331: 155.45 | Q331: 已到 | R331: 3.30年 | S331: 1.30年 | T331: 2.44 | U331: 173 | V331: 0.37 | W331: 2.e-002 | X331: 3.1e-002 | Y331: 120 | Z331: 3.34 | AA331: -0.14800000000000002 | AB331: -0.154 | AC331: -0.30299999999999999 | AD331: -0.30499999999999999 | AE331: 97.11 | AF331: 100.69 | AG331: 0.91 | AH331: AA | AI331: 4.0099999999999997e-002 | AJ331: =H331+100*O331 -> 215.5 | AK331: 228.5 | AL331: 333 | AM331: 127.9 | AN331: 329 | AO331: 2.3e-002 | AP331: 21 | AQ331: 伊力转债!!
A332: 105 | B332: 123083 | C332: 朗新转债! | D332: 300682 | E332: 朗新科技 | F332: 计算机及 | G332: 软件开发 | H332: 253.981 | I332: -1.54e-002 | J332: 2.12e-002 | K332: 39.38 | L332: 5.8999999999999999e-003 | M332: 115.1 | N332: 15.4 | O332: -6.9999999999999993e-003 | P332: 255.71 | Q332: 已到 | R332: 5年12天 | S332: 3年12天 | T332: 6.27 | U332: 618 | V332: 0.39200000000000002 | W332: 1.4999999999999999e-002 | X332: 3.9e-002 | Y332: 409 | Z332: 7.49 | AA332: -0.14800000000000002 | AB332: -0.152 | AC332: -0.14099999999999999 | AD332: -0.14099999999999999 | AE332: 90.97 | AF332: 94.02 | AG332: 0.98 | AH332: AA | AI332: 4.1900000000000007e-002 | AJ332: =H332+100*O332 -> 253.28100000000001 | AK332: 252.2 | AL332: 341 | AM332: 158.2 | AN332: 340 | AO332: 0.124 | AP332: 6 | AQ332: 朗新转债!
A333: 372 | B333: 128013 | C333: 洪涛转债! | D333: 2325 | E333: 洪涛股份 | F333: 建筑 | G333: 装饰工程 | H333: 120.696 | I333: 5.7999999999999996e-003 | J333: -2.8999999999999998e-003 | K333: 2.7 | L333: 3.7000000000000002e-003 | M333: 108 | N333: 2.32 | O333: 3.7000000000000005e-002 | P333: 116.38 | Q333: 已到 | R333: 0.67年 | S333: 回售内 | T333: 11.4 | U333: 56 | V333: 4.0999999999999995e-002 | W333: 0.33200000000000002 | X333: 0.38700000000000001 | Y333: 34 | Z333: 1.22 | AA333: -0.153 | AB333: -0.17199999999999999 | AC333: 回售内 | AD333: 回售内 | AE333: 100.33 | AF333: 102.11 | AG333: 0.78 | AH333: A- | AI333: 8.7499999999999994e-002 | AJ333: =H333+100*O333 -> 124.396 | AK333: 125 | AL333: 2 | AM333: 22.9 | AN333: 1 | AO333: 7.4999999999999997e-002 | AP333: 100 | AQ333: 洪涛转债!
A334: 133 | B334: 123070 | C334: 鹏辉转债! | D334: 300438 | E334: 鹏辉能源 | F334: 汽车 | G334: 零部件制 | H334: 256.3 | I334: 4.7e-002 | J334: 2.07e-002 | K334: 51.25 | L334: 6.9000000000000006e-002 | M334: 114.8 | N334: 20.08 | O334: 4.0000000000000001e-003 | P334: 255.23 | Q334: 已到 | R334: 4.90年 | S334: 2.90年 | T334: 6.03 | U334: 3730. | V334: 2.3999999999999999 | W334: 2.7999999999999997e-002 | X334: 7.0999999999999994e-002 | Y334: 218 | Z334: 8.51 | AA334: -0.153 | AB334: -0.158 | AC334: -0.151 | AD334: -0.152 | AE334: 91.66 | AF334: 95.03 | AG334: 0.98 | AH334: AA | AI334: 4.0099999999999997e-002 | AJ334: =H334+100*O334 -> 256.69999999999999 | AK334: 257.4 | AL334: 342 | AM334: 162.3 | AN334: 341 | AO334: 0.18600000000000003 | AP334: 8 | AQ334: 鹏辉转债!
A335: 327 | B335: 128046 | C335: 利尔转债!! | D335: 2258 | E335: 利尔化学 | F335: 化工 | G335: 农化 | H335: 179.3 | I335: 2.2799999999999997e-002 | J335: -1.09e-002 | K335: 30.9 | L335: 1.2500000000000001e-002 | M335: 111.3 | N335: 18.42 | O335: 6.9000000000000006e-002 | P335: 167.75 | Q335: 已到 | R335: 2.89年 | S335: 0.89年 | T335: 8.08 | U335: 619 | V335: 0.43099999999999999 | W335: 5.0000000000000003e-002 | X335: 8.3000000000000004e-002 | Y335: 163 | Z335: 3.76 | AA335: -0.154 | AB335: -0.16 | AC335: -0.40799999999999997 | AD335: -0.40999999999999998 | AE335: 97.8 | AF335: 99.88 | AG335: 0.96 | AH335: AA | AI335: 3.8800000000000001e-002 | AJ335: =H335+100*O335 -> 186.20000000000002 | AK335: 190.8 | AL335: 300 | AM335: 91 | AN335: 286 | AO335: 0.18899999999999997 | AP335: 8 | AQ335: 利尔转债!!
A336: 308 | B336: 127011 | C336: 中鼎转2!! | D336: 887 | E336: 中鼎股份 | F336: 汽车 | G336: 零部件制 | H336: 200.693 | I336: 3.7100000000000001e-002 | J336: 1.2800000000000001e-002 | K336: 20.97 | L336: 5.2199999999999996e-002 | M336: 114.5 | N336: 11.39 | O336: 8.9999999999999997e-002 | P336: 184.11 | Q336: 已到 | R336: 3.28年 | S336: 1.28年 | T336: 12 | U336: 336 | V336: 0.14099999999999999 | W336: 4.7e-002 | X336: 8.5999999999999993e-002 | Y336: 256 | Z336: 2.78 | AA336: -0.16 | AB336: -0.16600000000000001 | AC336: -0.32299999999999995 | AD336: -0.32500000000000001 | AE336: 97.88 | AF336: 102.52 | AG336: 0.96 | AH336: AA+ | AI336: 3.5099999999999999e-002 | AJ336: =H336+100*O336 -> 209.69300000000001 | AK336: 217.3 | AL336: 326 | AM336: 114.8 | AN336: 322 | AO336: 0.156 | AP336: 18 | AQ336: 中鼎转2!!
A337: 262 | B337: 123034 | C337: 通光转债! | D337: 300265 | E337: 通光线缆 | F337: 通信互联 | G337: 通信设备 | H337: 230.751 | I337: -2.4300000000000002e-002 | J337: 6.7000000000000002e-003 | K337: 11.67 | L337: -2.0199999999999999e-002 | M337: 117.3 | N337: 7.95 | O337: 0.57200000000000006 | P337: 146.79 | Q337: 已到 | R337: 3.94年 | S337: 1.94年 | T337: 0.78 | U337: 813 | V337: 4.46 | W337: 1.8000000000000002e-002 | X337: 2.7000000000000003e-002 | Y337: 43 | Z337: 3.27 | AA337: -0.16 | AB337: -0.16600000000000001 | AC337: -0.23300000000000001 | AD337: -0.23399999999999999 | AE337: 88.88 | AF337: 89.62 | AG337: 0.87 | AH337: A+ | AI337: 7.2099999999999997e-002 | AJ337: =H337+100*O337 -> 287.95100000000002 | AK337: 314.7 | AL337: 357 | AM337: 225.1 | AN337: 359 | AO337: 0.10000000000000001 | AP337: 17 | AQ337: 通光转债!
A338: 153 | B338: 110074 | C338: 精达转债!! | D338: 600577 | E338: 精达股份 | F338: 电子 | G338: 电子产品 | H338: 273.15 | I338: 2.7900000000000001e-002 | J338: -1.e-003 | K338: 8.91 | L338: 2.7699999999999999e-002 | M338: 116.9 | N338: 3.73 | O338: 0.14300000000000002 | P338: 238.87 | Q338: 已到 | R338: 4.73年 | S338: 2.73年 | T338: 5.1 | U338: 210 | V338: 0.154 | W338: 2.8999999999999998e-002 | X338: 6.9000000000000006e-002 | Y338: 177 | Z338: 4.11 | AA338: -0.16699999999999998 | AB338: -0.17100000000000001 | AC338: -0.17100000000000001 | AD338: -0.17199999999999999 | AE338: 92.38 | AF338: 97.43 | AG338: 0.97 | AH338: AA | AI338: 4.0099999999999997e-002 | AJ338: =H338+100*O338 -> 287.44999999999999 | AK338: 307.4 | AL338: 356 | AM338: 210 | AN338: 356 | AO338: 1.2e-002 | AP338: 10 | AQ338: 精达转债!!
A339: 318 | B339: 123018 | C339: 溢利转债! | D339: 300381 | E339: 溢多利 | F339: 医药 | G339: 原料药 | H339: 200.35 | I339: 5.0000000000000001e-004 | J339: -9.3999999999999986e-003 | K339: 10.25 | L339: -1.1599999999999999e-002 | M339: 114.3 | N339: 8.25 | O339: 0.61299999999999999 | P339: 124.24 | Q339: 已到 | R339: 3年23天 | S339: 1年23天 | T339: 0.54 | U339: 51 | V339: 0.46899999999999997 | W339: 1.1000000000000001e-002 | X339: 1.3000000000000001e-002 | Y339: 50 | Z339: 1.69 | AA339: -0.17000000000000001 | AB339: -0.17699999999999999 | AC339: -0.38799999999999996 | AD339: -0.39000000000000001 | AE339: 95.65 | AF339: 95.72 | AG339: 0.77 | AH339: AA- | AI339: 6.1100000000000002e-002 | AJ339: =H339+100*O339 -> 261.64999999999998 | AK339: 276.5 | AL339: 346 | AM339: 180.7 | AN339: 348 | AO339: -1.4999999999999999e-002 | AP339: 10 | AQ339: 溢利转债!
A340: 141 | B340: 123067 | C340: 斯莱转债! | D340: 300382 | E340: 斯莱克 | F340: 机械装备 | G340: 专用设备 | H340: 292.444 | I340: -7.0999999999999995e-003 | J340: -9.1999999999999998e-003 | K340: 26.59 | L340: -1.66e-002 | M340: 120.8 | N340: 9.36 | O340: 2.8999999999999998e-002 | P340: 284.08 | Q340: 已到 | R340: 4.81年 | S340: 2.81年 | T340: 2.4 | U340: 252 | V340: 0.36099999999999999 | W340: 1.6e-002 | X340: 4.4999999999999998e-002 | Y340: 153 | Z340: 13.36 | AA340: -0.17100000000000001 | AB340: -0.17600000000000002 | AC340: -0.17199999999999999 | AD340: -0.17199999999999999 | AE340: 87.11 | AF340: 91.41 | AG340: 0.98 | AH340: AA- | AI340: 6.1100000000000002e-002 | AJ340: =H340+100*O340 -> 295.34399999999999 | AK340: 300.8 | AL340: 354 | AM340: 209.4 | AN340: 355 | AO340: -7.0000000000000007e-002 | AP340: 12 | AQ340: 斯莱转债!
A341: 233 | B341: 110066 | C341: 盛屯转债!! | D341: 600711 | E341: 盛屯矿业 | F341: 有色金属 | G341: 有色行业 | H341: 264.43 | I341: 1.2199999999999999e-002 | J341: 2.46e-002 | K341: 11.27 | L341: 3.78e-002 | M341: 114.9 | N341: 4.87 | O341: 0.14300000000000002 | P341: 231.42 | Q341: 已到 | R341: 4.26年 | S341: 2.26年 | T341: 3.83 | U341: 719 | V341: 0.70599999999999996 | W341: 1.2e-002 | X341: 2.8999999999999998e-002 | Y341: 310 | Z341: 2.5 | AA341: -0.17999999999999999 | AB341: -0.185 | AC341: -0.21299999999999999 | AD341: -0.214 | AE341: 94.08 | AF341: 97.54 | AG341: 0.97 | AH341: AA | AI341: 4.0099999999999997e-002 | AJ341: =H341+100*O341 -> 278.73000000000002 | AK341: 297.4 | AL341: 353 | AM341: 199.9 | AN341: 352 | AO341: 0.13200000000000001 | AP341: 29 | AQ341: 盛屯转债!!
A342: 334 | B342: 123012 | C342: 万顺转债! | D342: 300057 | E342: 万顺新材 | F342: 有色金属 | G342: 铝金属 | H342: 186.205 | I342: -1.2199999999999999e-002 | J342: 8.0000000000000002e-003 | K342: 9.24 | L342: -4.3e-003 | M342: 109.3 | N342: 5.27 | O342: 6.2e-002 | P342: 175.33 | Q342: 已到 | R342: 2.64年 | S342: 0.64年 | T342: 1.23 | U342: 191 | V342: 0.82900000000000007 | W342: 1.9e-002 | X342: 3.4000000000000002e-002 | Y342: 63 | Z342: 1.75 | AA342: -0.185 | AB342: -0.19 | AC342: -0.57100000000000006 | AD342: -0.57299999999999995 | AE342: 97.13 | AF342: 93.99 | AG342: 0.96 | AH342: AA- | AI342: 5.9800000000000006e-002 | AJ342: =H342+100*O342 -> 192.405 | AK342: 197.1 | AL342: 310 | AM342: 99.9 | AN342: 306 | AO342: 5.9999999999999998e-002 | AP342: 23 | AQ342: 万顺转债!
A343: 322 | B343: 110048 | C343: 福能转债!! | D343: 600483 | E343: 福能股份 | F343: 能源电力 | G343: 电力供应 | H343: 211.09 | I343: 8.0000000000000002e-003 | J343: -1.8700000000000001e-002 | K343: 14.26 | L343: -1.11e-002 | M343: 113.3 | N343: 7.85 | O343: 0.16200000000000001 | P343: 181.66 | Q343: 已到 | R343: 3年10天 | S343: 1年10天 | T343: 12.8 | U343: 155 | V343: 5.7999999999999996e-002 | W343: 4.7e-002 | X343: 8.5000000000000006e-002 | Y343: 273 | Z343: 3.51 | AA343: -0.18899999999999997 | AB343: -0.19500000000000001 | AC343: -0.42299999999999999 | AD343: -0.42499999999999999 | AE343: 98.7 | AF343: 102.31 | AG343: 0.96 | AH343: AA+ | AI343: 3.5099999999999999e-002 | AJ343: =H343+100*O343 -> 227.28999999999999 | AK343: 240.5 | AL343: 337 | AM343: 138.2 | AN343: 334 | AO343: -8.5000000000000006e-002 | AP343: 9 | AQ343: 福能转债!!
A344: 243 | B344: 128093 | C344: 百川转债!! | D344: 2455 | E344: 百川股份 | F344: 化工 | G344: 化工 | H344: 301.4 | I344: 5.6999999999999993e-003 | J344: 7.0999999999999995e-003 | K344: 16.05 | L344: 1.3300000000000001e-002 | M344: 129.8 | N344: 5.77 | O344: 8.4000000000000005e-002 | P344: 278.16 | Q344: 已到 | R344: 4年37天 | S344: 2年37天 | T344: 1.62 | U344: 321 | V344: 0.65599999999999992 | W344: 1.8000000000000002e-002 | X344: 4.9000000000000002e-002 | Y344: 91 | Z344: 5.13 | AA344: -0.191 | AB344: -0.19899999999999998 | AC344: -0.248 | AD344: -0.25 | AE344: 93.71 | AF344: 102.79 | AG344: 0.96 | AH344: AA- | AI344: 6.1100000000000002e-002 | AJ344: =H344+100*O344 -> 309.79999999999995 | AK344: 324.6 | AL344: 359 | AM344: 221.9 | AN344: 357 | AO344: -1.9e-002 | AP344: 40 | AQ344: 百川转债!!
A345: 305 | B345: 123022 | C345: 长信转债!! | D345: 300088 | E345: 长信科技 | F345: 通信互联 | G345: 通信设备 | H345: 237.048 | I345: -2.6600000000000002e-002 | J345: -5.1000000000000004e-003 | K345: 11.53 | L345: -3.27e-002 | M345: 114.3 | N345: 6.05 | O345: 0.24399999999999999 | P345: 190.58 | Q345: 已到 | R345: 3.30年 | S345: 1.30年 | T345: 2.57 | U345: 610 | V345: 1. | W345: 9.0000000000000011e-003 | X345: 1.7000000000000001e-002 | Y345: 283 | Z345: 3.75 | AA345: -0.20100000000000001 | AB345: -0.20699999999999999 | AC345: -0.36700000000000005 | AD345: -0.36899999999999999 | AE345: 97.08 | AF345: 100.66 | AG345: 0.97 | AH345: AA | AI345: 4.0099999999999997e-002 | AJ345: =H345+100*O345 -> 261.44799999999998 | AK345: 283.5 | AL345: 350 | AM345: 182.9 | AN345: 351 | AO345: -3.1e-002 | AP345: 11 | AQ345: 长信转债!!
A346: 285 | B346: 113537 | C346: 文灿转债!! | D346: 603348 | E346: 文灿股份 | F346: 汽车 | G346: 零部件制 | H346: 262.33 | I346: 3.8399999999999997e-002 | J346: -5.7999999999999996e-003 | K346: 47.38 | L346: 3.3399999999999999e-002 | M346: 120.7 | N346: 19.28 | O346: 6.7000000000000004e-002 | P346: 245.75 | Q346: 已到 | R346: 3.53年 | S346: 1.53年 | T346: 1.41 | U346: 437 | V346: 1.2 | W346: 1.1000000000000001e-002 | X346: 2.7999999999999997e-002 | Y346: 124 | Z346: 4.73 | AA346: -0.20100000000000001 | AB346: -0.20800000000000002 | AC346: -0.33100000000000002 | AD346: -0.33200000000000002 | AE346: 93.77 | AF346: 98.39 | AG346: 0.97 | AH346: AA- | AI346: 6.1100000000000002e-002 | AJ346: =H346+100*O346 -> 269.02999999999997 | AK346: 278.9 | AL346: 349 | AM346: 180.5 | AN346: 347 | AO346: 0.105 | AP346: 22 | AQ346: 文灿转债!!
A347: 312 | B347: 113528 | C347: 长城转债!! | D347: 603897 | E347: 长城科技 | F347: 机械装备 | G347: 专用设备 | H347: 262.27 | I347: -4.5000000000000005e-003 | J347: -3.5999999999999999e-003 | K347: 55.08 | L347: -8.3000000000000001e-003 | M347: 116.8 | N347: 22.35 | O347: 6.4000000000000001e-002 | P347: 246.44 | Q347: 已到 | R347: 3.26年 | S347: 1.26年 | T347: 4.49 | U347: 557 | V347: 0.46700000000000003 | W347: 4.4000000000000004e-002 | X347: 0.10800000000000001 | Y347: 102 | Z347: 4.81 | AA347: -0.223 | AB347: -0.23000000000000001 | AC347: -0.40899999999999997 | AD347: -0.40999999999999998 | AE347: 94.87 | AF347: 96.74 | AG347: 0.98 | AH347: AA- | AI347: 6.1100000000000002e-002 | AJ347: =H347+100*O347 -> 268.66999999999996 | AK347: 278.1 | AL347: 348 | AM347: 181.4 | AN347: 349 | AO347: 0.10000000000000001 | AP347: 32 | AQ347: 长城转债!!
A348: 340 | B348: 110044 | C348: 广电转债!! | D348: 600831 | E348: 广电网络 | F348: 传媒娱乐 | G348: 影视娱乐 | H348: 212.35 | I348: -1.9e-003 | J348: 5.0000000000000001e-004 | K348: 5.34 | L348: -7.4000000000000003e-003 | M348: 111.3 | N348: 6.87 | O348: 1.73 | P348: 77.73 | Q348: 已到 | R348: 2.58年 | S348: 0.58年 | T348: 0.71 | U348: 94 | V348: 0.621 | W348: 1.9e-002 | X348: 1.4999999999999999e-002 | Y348: 38 | Z348: 1.01 | AA348: -0.22399999999999998 | AB348: -0.23000000000000001 | AC348: -0.71499999999999997 | AD348: -0.71799999999999997 | AE348: 98.95 | AF348: 101.06 | AG348: 0.19 | AH348: AA | AI348: 3.8800000000000001e-002 | AJ348: =H348+100*O348 -> 385.35000000000002 | AK348: 347 | AL348: 360 | AM348: 245.9 | AN348: 360 | AO348: 6.9999999999999993e-003 | AP348: 9 | AQ348: 广电转债!!
A349: 202 | B349: 113582 | C349: 火炬转债! | D349: 603678 | E349: 火炬电子 | F349: 电子 | G349: 元器件制 | H349: 366.14 | I349: -1.21e-002 | J349: -1.78e-002 | K349: 74.31 | L349: -3.04e-002 | M349: 114.9 | N349: 24.99 | O349: 0.23100000000000001 | P349: 297.36 | Q349: 已到 | R349: 4.50年 | S349: 2.50年 | T349: 4.18 | U349: 26 | V349: 1.7000000000000001e-002 | W349: 1.2e-002 | X349: 3.6000000000000004e-002 | Y349: 342 | Z349: 7.7 | AA349: -0.23000000000000001 | AB349: -0.23399999999999999 | AC349: -0.223 | AD349: -0.223 | AE349: 93.22 | AF349: 96.64 | AG349: 0.98 | AH349: AA | AI349: 4.0099999999999997e-002 | AJ349: =H349+100*O349 -> 389.24000000000001 | AK349: 434.9 | AL349: 368 | AM349: 338.3 | AN349: 368 | AO349: -3.7999999999999999e-002 | AP349: 5 | AQ349: 火炬转债!
A350: 319 | B350: 113525 | C350: 台华转债!! | D350: 603055 | E350: 台华新材 | F350: 服装纺织 | G350: 纺织行业 | H350: 255.8 | I350: 1.8600000000000002e-002 | J350: -9.0000000000000011e-003 | K350: 18.7 | L350: 9.7000000000000003e-003 | M350: 114.3 | N350: 7.78 | O350: 6.4000000000000001e-002 | P350: 240.36 | Q350: 已到 | R350: 3年20天 | S350: 1年20天 | T350: 1.83 | U350: 269 | V350: 0.57200000000000006 | W350: 1.1000000000000001e-002 | X350: 2.7000000000000003e-002 | Y350: 162 | Z350: 4.54 | AA350: -0.23499999999999999 | AB350: -0.24100000000000002 | AC350: -0.47999999999999998 | AD350: -0.48200000000000004 | AE350: 98.03 | AF350: 101.65 | AG350: 0.98 | AH350: AA | AI350: 4.0099999999999997e-002 | AJ350: =H350+100*O350 -> 262.19999999999999 | AK350: 271.2 | AL350: 344 | AM350: 169.6 | AN350: 343 | AO350: 1.4999999999999999e-002 | AP350: 18 | AQ350: 台华转债!!
A351: 317 | B351: 113526 | C351: 联泰转债! | D351: 603797 | E351: 联泰环保 | F351: 城市公用 | G351: 三废处理 | H351: 258.99 | I351: 5.8999999999999999e-003 | J351: -5.8999999999999999e-003 | K351: 6.78 | L351: 0. | M351: 110.3 | N351: 5.92 | O351: 1.26 | P351: 114.53 | Q351: 已到 | R351: 3年57天 | S351: 1年57天 | T351: 1.93 | U351: 168 | V351: 0.33500000000000002 | W351: 4.9000000000000002e-002 | X351: 5.5999999999999994e-002 | Y351: 40 | Z351: 1.56 | AA351: -0.23999999999999999 | AB351: -0.24399999999999999 | AC351: -0.442 | AD351: -0.44299999999999995 | AE351: 98.26 | AF351: 99.16 | AG351: 0.69 | AH351: AA+ | AI351: 3.5099999999999999e-002 | AJ351: =H351+100*O351 -> 384.99000000000001 | AK351: 403.5 | AL351: 363 | AM351: 304.3 | AN351: 363 | AO351: 0. | AP351: 7 | AQ351: 联泰转债!
A352: 348 | B352: 113504 | C352: 艾华转债!! | D352: 603989 | E352: 艾华集团 | F352: 电子 | G352: 元器件制 | H352: 203.98 | I352: -4.8999999999999998e-003 | J352: 2.5999999999999999e-003 | K352: 42.28 | L352: -2.3999999999999998e-003 | M352: 109.3 | N352: 20.81 | O352: 4.0000000000000001e-003 | P352: 203.17 | Q352: 已到 | R352: 2.26年 | S352: 0.26年 | T352: 4.63 | U352: 103 | V352: 0.10800000000000001 | W352: 2.7000000000000003e-002 | X352: 5.5999999999999994e-002 | Y352: 169 | Z352: 5.95 | AA352: -0.245 | AB352: -0.25 | AC352: <-100% | AD352: <-100% | AE352: 100.17 | AF352: 100.46 | AG352: 0.98 | AH352: AA | AI352: 3.8800000000000001e-002 | AJ352: =H352+100*O352 -> 204.38 | AK352: 204.8 | AL352: 321 | AM352: 104.3 | AN352: 311 | AO352: 1.9e-002 | AP352: 10 | AQ352: 艾华转债!!
A353: 193 | B353: 128111 | C353: 中矿转债! | D353: 2738 | E353: 中矿资源 | F353: 有色金属 | G353: 有色行业 | H353: 437.982 | I353: -7.000000000000001e-004 | J353: -2.0000000000000001e-004 | K353: 65.82 | L353: -8.9999999999999998e-004 | M353: 124.2 | N353: 15.42 | O353: 2.6000000000000002e-002 | P353: 426.85 | Q353: 已到 | R353: 4.54年 | S353: 2.54年 | T353: 1.46 | U353: 716 | V353: 1.1100000000000001 | W353: 6.9999999999999993e-003 | X353: 2.8999999999999998e-002 | Y353: 213 | Z353: 5.72 | AA353: -0.24600000000000002 | AB353: -0.252 | AC353: -0.23199999999999998 | AD353: -0.23300000000000001 | AE353: 88.85 | AF353: 95.51 | AG353: 0.99 | AH353: AA- | AI353: 6.1100000000000002e-002 | AJ353: =H353+100*O353 -> 440.58200000000005 | AK353: 449.1 | AL353: 370 | AM353: 353.6 | AN353: 370 | AO353: 0.13500000000000001 | AP353: 10 | AQ353: 中矿转债!
A354: 329 | B354: 123015 | C354: 蓝盾转债!! | D354: 300297 | E354: 蓝盾股份 | F354: 计算机及 | G354: 软件开发 | H354: 239.6 | I354: 1.1000000000000001e-002 | J354: -1.1000000000000001e-002 | K354: 3.53 | L354: -2.8000000000000004e-003 | M354: 111.3 | N354: 5.79 | O354: 2.9300000000000002 | P354: 60.97 | Q354: 已到 | R354: 2.71年 | S354: 0.71年 | T354: 1 | U354: 1509. | V354: 6.0999999999999996 | W354: 2.3e-002 | X354: 1.3999999999999999e-002 | Y354: 44 | Z354: 2.48 | AA354: -0.249 | AB354: -0.254 | AC354: -0.66500000000000004 | AD354: -0.66700000000000004 | AE354: 92.14 | AF354: 82.15 | AG354: 0 | AH354: BBB- | AI354: 0.1208 | AJ354: =H354+100*O354 -> 532.60000000000002 | AK354: 418.2 | AL354: 365 | AM354: 326.1 | AN354: 366 | AO354: -9.0000000000000011e-003 | AP354: 14 | AQ354: 蓝盾转债!!
A355: 222 | B355: 123046 | C355: 天铁转债! | D355: 300587 | E355: 天铁股份 | F355: 铁路 | G355: 铁路设备 | H355: 399.5 | I355: 2.3999999999999998e-003 | J355: 4.1999999999999997e-003 | K355: 21.23 | L355: 6.6e-003 | M355: 117.7 | N355: 5.9 | O355: 0.11 | P355: 359.83 | Q355: 已到 | R355: 4.31年 | S355: 2.31年 | T355: 0.62 | U355: 100 | V355: 0.40200000000000002 | W355: 5.0000000000000001e-003 | X355: 1.8000000000000002e-002 | Y355: 123 | Z355: 7.22 | AA355: -0.251 | AB355: -0.255 | AC355: -0.254 | AD355: -0.254 | AE355: 89.63 | AF355: 91.73 | AG355: 0.98 | AH355: AA- | AI355: 6.1100000000000002e-002 | AJ355: =H355+100*O355 -> 410.5 | AK355: 439.2 | AL355: 369 | AM355: 347.4 | AN355: 369 | AO355: 7.9000000000000001e-002 | AP355: 13 | AQ355: 天铁转债!
A356: 369 | B356: 127004 | C356: 模塑转债!! | D356: 700 | E356: 模塑科技 | F356: 汽车 | G356: 零部件制 | H356: 173.1 | I356: -2.3e-003 | J356: 2.3e-003 | K356: 4.97 | L356: -1.e-002 | M356: 111.8 | N356: 7.24 | O356: 1.52 | P356: 68.65 | Q356: 已到 | R356: 1.51年 | S356: 回售内 | T356: 1.31 | U356: 89 | V356: 0.39299999999999996 | W356: 2.8999999999999998e-002 | X356: 2.e-002 | Y356: 46 | Z356: 2.01 | AA356: -0.253 | AB356: -0.26300000000000001 | AC356: 回售内 | AD356: 回售内 | AE356: 100.3 | AF356: 100.88 | AG356: 0 | AH356: AA- | AI356: 5.9800000000000006e-002 | AJ356: =H356+100*O356 -> 325.10000000000002 | AK356: 277.6 | AL356: 347 | AM356: 176.7 | AN356: 346 | AO356: -6.0000000000000001e-003 | AP356: 25 | AQ356: 模塑转债!!
A357: 354 | B357: 128030 | C357: 天康转债!! | D357: 2100 | E357: 天康生物 | F357: 农业 | G357: 畜牧业 | H357: 204.388 | I357: 3.0000000000000001e-003 | J357: 2.5000000000000001e-003 | K357: 9.13 | L357: 5.5000000000000005e-003 | M357: 111.3 | N357: 7.39 | O357: 0.65400000000000003 | P357: 123.55 | Q357: 已到 | R357: 2年25天 | S357: 25天 | T357: 0.88 | U357: 10 | V357: 5.7999999999999996e-002 | W357: 9.0000000000000011e-003 | X357: 1.1000000000000001e-002 | Y357: 98 | Z357: 1.75 | AA357: -0.25800000000000001 | AB357: -0.26500000000000001 | AC357: <-100% | AD357: <-100% | AE357: 100.9 | AF357: 103.05 | AG357: 1 | AH357: AA | AI357: 3.8800000000000001e-002 | AJ357: =H357+100*O357 -> 269.78800000000001 | AK357: 285.2 | AL357: 351 | AM357: 182.2 | AN357: 350 | AO357: -3.1e-002 | AP357: 9 | AQ357: 天康转债!!
A358: 293 | B358: 113534 | C358: 鼎胜转债!! | D358: 603876 | E358: 鼎胜新材 | F358: 有色金属 | G358: 小金属 | H358: 309.65 | I358: 1.2699999999999999e-002 | J358: 3.0999999999999999e-003 | K358: 45.6 | L358: 1.6e-002 | M358: 114.3 | N358: 15.18 | O358: 3.1e-002 | P358: 300.4 | Q358: 已到 | R358: 3.36年 | S358: 1.36年 | T358: 4.05 | U358: 672 | V358: 0.53600000000000003 | W358: 1.8000000000000002e-002 | X358: 5.5e-002 | Y358: 222 | Z358: 4.74 | AA358: -0.26000000000000001 | AB358: -0.26500000000000001 | AC358: -0.41299999999999998 | AD358: -0.41399999999999998 | AE358: 93.95 | AF358: 94.03 | AG358: 0.99 | AH358: AA- | AI358: 6.1100000000000002e-002 | AJ358: =H358+100*O358 -> 312.75 | AK358: 318.9 | AL358: 358 | AM358: 224.9 | AN358: 358 | AO358: 0.16500000000000001 | AP358: 28 | AQ358: 鼎胜转债!!
A359: 263 | B359: 113548 | C359: 石英转债! | D359: 603688 | E359: 石英股份 | F359: 电子 | G359: 电子产品 | H359: 406.01 | I359: -1.6200000000000003e-002 | J359: 1.5900000000000001e-002 | K359: 58.7 | L359: -2.9999999999999997e-004 | M359: 123.7 | N359: 14.93 | O359: 3.3000000000000002e-002 | P359: 393.17 | Q359: 已到 | R359: 3.92年 | S359: 1.92年 | T359: 1.2 | U359: 223 | V359: 0.45299999999999996 | W359: 6.0000000000000001e-003 | X359: 2.3e-002 | Y359: 207 | Z359: 10.09 | AA359: -0.26500000000000001 | AB359: -0.27200000000000002 | AC359: -0.318 | AD359: -0.318 | AE359: 91.66 | AF359: 98.56 | AG359: 0.99 | AH359: AA- | AI359: 6.1100000000000002e-002 | AJ359: =H359+100*O359 -> 409.31 | AK359: 418.9 | AL359: 366 | AM359: 320.3 | AN359: 365 | AO359: -9.0000000000000011e-003 | AP359: 13 | AQ359: 石英转债!
A360: 284 | B360: 123027 | C360: 蓝晓转债! | D360: 300487 | E360: 蓝晓科技 | F360: 化工 | G360: 化工 | H360: 378 | I360: 6.480000000000001e-002 | J360: 6.7000000000000002e-003 | K360: 95.2 | L360: 7.2800000000000004e-002 | M360: 118.8 | N360: 29.02 | O360: 0.152 | P360: 328.05 | Q360: 已到 | R360: 3.54年 | S360: 1.54年 | T360: 1.07 | U360: 3629. | V360: 8.6400000000000006 | W360: 5.0000000000000001e-003 | X360: 1.7000000000000001e-002 | Y360: 209 | Z360: 10.58 | AA360: -0.28300000000000003 | AB360: -0.28899999999999998 | AC360: -0.39600000000000002 | AD360: -0.39700000000000002 | AE360: 92.23 | AF360: 93.48 | AG360: 0.98 | AH360: A+ | AI360: 7.2099999999999997e-002 | AJ360: =H360+100*O360 -> 393.19999999999999 | AK360: 428 | AL360: 367 | AM360: 334.5 | AN360: 367 | AO360: 0.159 | AP360: 17 | AQ360: 蓝晓转债!
A361: 292 | B361: 113025 | C361: 明泰转债!! | D361: 601677 | E361: 明泰铝业 | F361: 有色金属 | G361: 铝金属 | H361: 352.93 | I361: -1.89e-002 | J361: 1.1599999999999999e-002 | K361: 36.18 | L361: -7.4000000000000003e-003 | M361: 114.5 | N361: 11 | O361: 7.2999999999999995e-002 | P361: 328.91 | Q361: 已到 | R361: 3.37年 | S361: 1.37年 | T361: 11 | U361: 120 | V361: 3.1e-002 | W361: 4.4000000000000004e-002 | X361: 0.14599999999999999 | Y361: 247 | Z361: 2.45 | AA361: -0.28800000000000003 | AB361: -0.29299999999999998 | AC361: -0.43799999999999994 | AD361: -0.43799999999999994 | AE361: 96.87 | AF361: 100.59 | AG361: 0.99 | AH361: AA | AI361: 4.0099999999999997e-002 | AJ361: =H361+100*O361 -> 360.23000000000002 | AK361: 377 | AL361: 361 | AM361: 276.4 | AN361: 361 | AO361: 8.5999999999999993e-002 | AP361: 19 | AQ361: 明泰转债!!
A362: 237 | B362: 128095 | C362: 恩捷转债!! | D362: 2812 | E362: 恩捷股份 | F362: 电子 | G362: 元器件制 | H362: 480 | I362: 2.1099999999999997e-002 | J362: 8.1000000000000013e-003 | K362: 265.6 | L362: 2.9500000000000002e-002 | M362: 114.9 | N362: 64.92 | O362: 0.17300000000000001 | P362: 409.12 | Q362: 已到 | R362: 4.21年 | S362: 2.21年 | T362: 4.54 | U362: 172 | V362: 7.9000000000000001e-002 | W362: 2.e-003 | X362: 8.0000000000000002e-003 | Y362: 2370. | Z362: 18.5 | AA362: -0.29199999999999998 | AB362: -0.29499999999999998 | AC362: -0.28399999999999997 | AD362: -0.28499999999999998 | AE362: 94.28 | AF362: 97.74 | AG362: 0.99 | AH362: AA | AI362: 4.0099999999999997e-002 | AJ362: =H362+100*O362 -> 497.30000000000001 | AK362: 550.9 | AL362: 373 | AM362: 453.1 | AN362: 373 | AO362: -2.2000000000000002e-002 | AP362: 13 | AQ362: 恩捷转债!!
A363: 336 | B363: 128041 | C363: 盛路转债!! | D363: 2446 | E363: 盛路通信 | F363: 通信互联 | G363: 通信设备 | H363: 290.403 | I363: -3.8e-003 | J363: 3.8e-003 | K363: 6.77 | L363: -8.8000000000000005e-003 | M363: 113.3 | N363: 6.82 | O363: 1.9299999999999999 | P363: 99.27 | Q363: 已到 | R363: 2.64年 | S363: 0.64年 | T363: 0.53 | U363: 208 | V363: 1.3500000000000001 | W363: 9.0000000000000011e-003 | X363: 9.0000000000000011e-003 | Y363: 62 | Z363: 2.01 | AA363: -0.30299999999999999 | AB363: -0.309 | AC363: -0.82599999999999996 | AD363: -0.82799999999999996 | AE363: 98.75 | AF363: 102.65 | AG363: 0 | AH363: AA | AI363: 3.8800000000000001e-002 | AJ363: =H363+100*O363 -> 483.40300000000002 | AK363: 481.5 | AL363: 371 | AM363: 378.9 | AN363: 371 | AO363: 0.161 | AP363: 11 | AQ363: 盛路转债!!
A364: 241 | B364: 123042 | C364: 银河转债!! | D364: 300619 | E364: 金银河 | F364: 机械装备 | G364: 专用设备 | H364: 511 | I364: 0.111 | J364: 2.29e-002 | K364: 122.6 | L364: 0.13500000000000001 | M364: 115.4 | N364: 24.38 | O364: 1.6e-002 | P364: 502.87 | Q364: 已到 | R364: 4年48天 | S364: 2年48天 | T364: 0.98 | U364: 11343. | V364: 22.5 | W364: 1.1000000000000001e-002 | X364: 5.2999999999999999e-002 | Y364: 93 | Z364: 17.27 | AA364: -0.30599999999999999 | AB364: -0.31 | AC364: -0.30099999999999999 | AD364: -0.30199999999999999 | AE364: 88.6 | AF364: 87.21 | AG364: 0.99 | AH364: A+ | AI364: 7.2099999999999997e-002 | AJ364: =H364+100*O364 -> 512.60000000000002 | AK364: 519.1 | AL364: 372 | AM364: 430.5 | AN364: 372 | AO364: 0.56000000000000005 | AP364: 21 | AQ364: 银河转债!!
A365: 321 | B365: 128050 | C365: 钧达转债!! | D365: 2865 | E365: 钧达股份 | F365: 汽车 | G365: 零部件制 | H365: 387.825 | I365: -1.32e-002 | J365: 1.9299999999999998e-002 | K365: 57.35 | L365: 6.0999999999999995e-003 | M365: 122.7 | N365: 14.81 | O365: 2.e-003 | P365: 387.24 | Q365: 已到 | R365: 3年13天 | S365: 1年13天 | T365: 0.65 | U365: 307 | V365: 1.21 | W365: 8.0000000000000002e-003 | X365: 3.2000000000000001e-002 | Y365: 79 | Z365: 7.52 | AA365: -0.32000000000000001 | AB365: -0.32700000000000001 | AC365: -0.59999999999999998 | AD365: -0.60099999999999998 | AE365: 96.03 | AF365: 102.94 | AG365: 1 | AH365: AA- | AI365: 6.1100000000000002e-002 | AJ365: =H365+100*O365 -> 388.02499999999998 | AK365: 388.4 | AL365: 362 | AM365: 285.5 | AN365: 362 | AO365: 0.17699999999999999 | AP365: 46 | AQ365: 钧达转债!!
A366: 333 | B366: 123013 | C366: 横河转债! | D366: 300539 | E366: 横河精密 | F366: 机械装备 | G366: 专用设备 | H366: 319.9 | I366: -9.1000000000000004e-003 | J366: 4.6999999999999993e-003 | K366: 7.75 | L366: -1.15e-002 | M366: 114 | N366: 9.04 | O366: 2.73 | P366: 85.73 | Q366: 已到 | R366: 2.66年 | S366: 0.66年 | T366: 0.38 | U366: 265 | V366: 2.1200000000000001 | W366: 2.2000000000000002e-002 | X366: 1.9e-002 | Y366: 17 | Z366: 3.49 | AA366: -0.32500000000000001 | AB366: -0.33100000000000002 | AC366: -0.83799999999999997 | AD366: -0.83999999999999997 | AE366: 96.57 | AF366: 95.38 | AG366: 0.39 | AH366: A+ | AI366: 7.0800000000000002e-002 | AJ366: =H366+100*O366 -> 592.89999999999998 | AK366: 554.1 | AL366: 374 | AM366: 457.5 | AN366: 374 | AO366: 5.5999999999999994e-002 | AP366: 12 | AQ366: 横河转债!
A367: 274 | B367: 123031 | C367: 晶瑞转债! | D367: 300655 | E367: 晶瑞电材 | F367: 电子 | G367: 电子行业 | H367: 506.412 | I367: 8.9999999999999998e-004 | J367: 1.5900000000000001e-002 | K367: 44.55 | L367: 1.6899999999999998e-002 | M367: 115.3 | N367: 10.13 | O367: 0.152 | P367: 439.78 | Q367: 已到 | R367: 3.75年 | S367: 1.75年 | T367: 0.53 | U367: 190 | V367: 0.70799999999999996 | W367: 3.0000000000000001e-003 | X367: 1.4999999999999999e-002 | Y367: 152 | Z367: 10.46 | AA367: -0.32899999999999996 | AB367: -0.33299999999999996 | AC367: -0.376 | AD367: -0.377 | AE367: 90.02 | AF367: 89.24 | AG367: 0.99 | AH367: A+ | AI367: 7.2099999999999997e-002 | AJ367: =H367+100*O367 -> 521.61199999999997 | AK367: 573 | AL367: 375 | AM367: 483 | AN367: 375 | AO367: 5.2999999999999999e-002 | AP367: 15 | AQ367: 晶瑞转债!
A368: 355 | B368: 128029 | C368: 太阳转债!! | D368: 2078 | E368: 太阳纸业 | F368: 造纸包装 | G368: 造纸行业 | H368: 168.4 | I368: 2.06e-002 | J368: -1.3600000000000001e-002 | K368: 11.49 | L368: 6.9999999999999993e-003 | M368: 107 | N368: 8.45 | O368: 0.23800000000000002 | P368: 135.98 | Q368: 已到 | R368: 1年25天 | S368: 回售内 | T368: 9.09 | U368: 92 | V368: 5.9999999999999998e-002 | W368: 2.8999999999999998e-002 | X368: 4.0000000000000001e-002 | Y368: 309 | Z368: 1.63 | AA368: -0.34799999999999998 | AB368: -0.35499999999999998 | AC368: 回售内 | AD368: 回售内 | AE368: 100.17 | AF368: 103.3 | AG368: 1 | AH368: AA+ | AI368: 3.3799999999999997e-002 | AJ368: =H368+100*O368 -> 192.20000000000002 | AK368: 200.8 | AL368: 316 | AM368: 97.5 | AN368: 300 | AO368: -2.8999999999999998e-002 | AP368: 7 | AQ368: 太阳转债!!
A369: 366 | B369: 128017 | C369: 金禾转债!! | D369: 2597 | E369: 金禾实业 | F369: 化工 | G369: 化工 | H369: 250.5 | I369: -7.6e-003 | J369: -1.47e-002 | K369: 50.1 | L369: -2.2400000000000003e-002 | M369: 107.5 | N369: 21.97 | O369: 9.9000000000000005e-002 | P369: 228.04 | Q369: 已到 | R369: 1.93年 | S369: 回售内 | T369: 5.52 | U369: 96 | V369: 7.0000000000000007e-002 | W369: 2.e-002 | X369: 4.4999999999999998e-002 | Y369: 281 | Z369: 5.41 | AA369: -0.35700000000000004 | AB369: -0.36099999999999999 | AC369: 回售内 | AD369: 回售内 | AE369: 100.25 | AF369: 99.94 | AG369: 0.99 | AH369: AA | AI369: 3.8800000000000001e-002 | AJ369: =H369+100*O369 -> 260.39999999999998 | AK369: 273 | AL369: 345 | AM369: 172.7 | AN369: 344 | AO369: 5.5999999999999994e-002 | AP369: 9 | AQ369: 金禾转债!!
A370: 365 | B370: 113016 | C370: 小康转债!! | D370: 601127 | E370: 小康股份 | F370: 汽车 | G370: 零部件制 | H370: 400.73 | I370: 6.1999999999999998e-003 | J370: 1.04e-002 | K370: 66.39 | L370: 1.67e-002 | M370: 107.8 | N370: 16.96 | O370: 2.4e-002 | P370: 391.45 | Q370: 已到 | R370: 1.94年 | S370: 回售内 | T370: 2.07 | U370: 440 | V370: 0.53299999999999992 | W370: 2.e-003 | X370: 9.0000000000000011e-003 | Y370: 903 | Z370: 12.56 | AA370: -0.47700000000000004 | AB370: -0.47999999999999998 | AC370: 回售内 | AD370: 回售内 | AE370: 100.3 | AF370: 96.39 | AG370: 1 | AH370: AA- | AI370: 5.9800000000000006e-002 | AJ370: =H370+100*O370 -> 403.13 | AK370: 410 | AL370: 364 | AM370: 309.7 | AN370: 364 | AO370: 1.3999999999999999e-002 | AP370: 34 | AQ370: 小康转债!!
A371: 374 | B371: 113009 | C371: 广汽转债! | D371: 601238 | E371: 广汽集团 | F371: 汽车 | G371: 乘用车 | H371: 126.17 | I371: 8.9999999999999998e-004 | J371: 5.4000000000000003e-003 | K371: 16.05 | L371: 6.8999999999999999e-003 | M371: 106 | N371: 13.92 | O371: 9.4e-002 | P371: 115.3 | Q371: 已到 | R371: 56天 | S371: 回售内 | T371: 25.3 | U371: 60 | V371: 1.9e-002 | W371: 1.4999999999999999e-002 | X371: 1.8000000000000002e-002 | Y371: 1662. | Z371: 1.9 | AA371: <-100% | AB371: <-100% | AC371: 回售内 | AD371: 回售内 | AE371: 100.27 | AF371: 105.54 | AG371: 0.9 | AH371: AAA | AI371: 2.8799999999999999e-002 | AJ371: =H371+100*O371 -> 135.56999999999999 | AK371: 137 | AL371: 22 | AM371: 31.5 | AN371: 7 | AO371: -5.7999999999999996e-002 | AP371: 22 | AQ371: 广汽转债!
A372: 309 | B372: 128057 | C372: 博彦转债!* | D372: 2649 | E372: 博彦科技 | F372: 计算机及 | G372: 软件开发 | H372: 146.301 | I372: 3.1099999999999999e-002 | J372: 2.e-003 | K372: 12.5 | L372: 3.3099999999999997e-002 | M372: 116.3 | N372: 8.5 | O372: -5.0000000000000001e-003 | P372: 147.06 | Q372: 已到 | R372: 3.1天 | S372: 无权 | T372: 0.44 | U372: 1006. | V372: 14.859999999999999 | W372: 6.0000000000000001e-003 | X372: 9.0000000000000011e-003 | Y372: 72 | Z372: 2.11 | AA372: <-100% | AB372: <-100% | AC372: 无权 | AD372: 无权 | AE372: 无权 | AF372: 100.69 | AG372: 1 | AH372: AA- | AI372: 5.6799999999999996e-002 | AJ372: =H372+100*O372 -> 145.80099999999999 | AK372: 145.5 | AL372: 76 | AM372: 44.9 | AN372: 47 | AO372: 6.6000000000000003e-002 | AP372: 24 | AQ372: 博彦转债!*
A373: 282 | B373: 123028 | C373: 清水转债!!* | D373: 300437 | E373: 清水源 | F373: 城市公用 | G373: 三废处理 | H373: 309.3 | I373: 4.3200000000000002e-002 | J373: 1.6500000000000001e-002 | K373: 37.32 | L373: 5.96e-002 | M373: 121 | N373: 11.84 | O373: -1.9e-002 | P373: 315.2 | Q373: 已到 | R373: 3.1天 | S373: 无权 | T373: 1.28 | U373: 7708. | V373: 18.780000000000001 | W373: 1.3999999999999999e-002 | X373: 4.4999999999999998e-002 | Y373: 90 | Z373: 6.91 | AA373: <-100% | AB373: <-100% | AC373: 无权 | AD373: 无权 | AE373: 无权 | AF373: 100.61 | AG373: 1 | AH373: A+ | AI373: 6.7799999999999999e-002 | AJ373: =H373+100*O373 -> 307.40000000000003 | AK373: 303.4 | AL373: 355 | AM373: 202.8 | AN373: 354 | AO373: -2.1000000000000001e-002 | AP373: 44 | AQ373: 清水转债!!*
A374: 139 | B374: 113603 | C374: 东缆转债!!* | D374: 603606 | E374: 东方电缆 | F374: 能源电力 | G374: 电力设备 | H374: 238.48 | I374: 4.53e-002 | J374: 9.3999999999999986e-003 | K374: 57.26 | L374: 5.4699999999999999e-002 | M374: 114.8 | N374: 23.65 | O374: -1.4999999999999999e-002 | P374: 242.11 | Q374: 已到 | R374: 3.1天 | S374: 无权 | T374: 0.82 | U374: 1938. | V374: 9.6899999999999995 | W374: 2.e-003 | X374: 5.0000000000000001e-003 | Y374: 385 | Z374: 9.78 | AA374: <-100% | AB374: <-100% | AC374: 无权 | AD374: 无权 | AE374: 无权 | AF374: 100.06 | AG374: 1 | AH374: AA | AI374: 3.5799999999999998e-002 | AJ374: =H374+100*O374 -> 236.97999999999999 | AK374: 234.8 | AL374: 335 | AM374: 134.8 | AN374: 333 | AO374: 0.106 | AP374: 7 | AQ374: 东缆转债!!*
A375: 128 | B375: 123074 | C375: 隆利转债!!* | D375: 300752 | E375: 隆利科技 | F375: 电子 | G375: 液晶显示 | H375: 153 | I375: -8.0100000000000005e-002 | J375: 2.63e-002 | K375: 26.06 | L375: -5.3699999999999998e-002 | M375: 123.6 | N375: 18.34 | O375: 7.6999999999999999e-002 | P375: 142.09 | Q375: 已到 | R375: 19天 | S375: 无权 | T375: 1.48 | U375: 586 | V375: 2.5099999999999998 | W375: 2.7999999999999997e-002 | X375: 4.0000000000000001e-002 | Y375: 53 | Z375: 5.5 | AA375: <-100% | AB375: <-100% | AC375: 无权 | AD375: 无权 | AE375: 无权 | AF375: 99.79 | AG375: 1 | AH375: AA- | AI375: 5.6799999999999996e-002 | AJ375: =H375+100*O375 -> 160.69999999999999 | AK375: 163.9 | AL375: 222 | AM375: 64.1 | AN375: 174 | AO375: -3.1e-002 | AP375: 15 | AQ375: 隆利转债!!*
A376: 109 | B376: 123081 | C376: 精研转债!!* | D376: 300709 | E376: 精研科技 | F376: 电子 | G376: 电子产品 | H376: 145.81 | I376: 1.e-004 | J376: -4.6999999999999993e-003 | K376: 49.5 | L376: -4.5999999999999999e-003 | M376: 121.3 | N376: 34.15 | O376: 6.0000000000000001e-003 | P376: 144.95 | Q376: 已到 | R376: 23天 | S376: 无权 | T376: 2.89 | U376: 81 | V376: 0.193 | W376: 4.0999999999999995e-002 | X376: 5.9000000000000004e-002 | Y376: 71 | Z376: 4.06 | AA376: <-100% | AB376: <-100% | AC376: 无权 | AD376: 无权 | AE376: 无权 | AF376: 100.08 | AG376: 1 | AH376: AA- | AI376: 5.6799999999999996e-002 | AJ376: =H376+100*O376 -> 146.41 | AK376: 146.7 | AL376: 88 | AM376: 46.6 | AN376: 65 | AO376: -6.5000000000000002e-002 | AP376: 10 | AQ376: 精研转债!!*
A378: 声明：本数据不构成任何投资建议，宁稳网不对数据的准确性及完整性做出保证，对使用者参考本数据造成的任何直接或间接损失概不负责。
A380: 来源：宁稳网，http://www.ninwin.cn，版权所有，本数据仅供【十七亩，8703】参考，请勿转发，2021-11-26 21:47:45