A1: 序号 | B1: 转债代码 | C1: 转债名称 | D1: 股票代码 | E1: 股票名称 | F1: 行业 | G1: 子行业 | H1: 转债价格 | I1: 涨跌 | J1: 日内套利 | K1: 股价 | L1: 涨跌 | M1: 剩余本息 | N1: 转股价格 | O1: 转股溢价率 | P1: 转股价值 | Q1: 距离转股日 | R1: 剩余年限 | S1: 回售年限 | T1: 转债余额 | U1: 转债成交额 | V1: 转债换手率 | W1: 余额/市值 | X1: 余额/股本 | Y1: 股票市值 | Z1: P/B | AA1: 税前收益率 | AB1: 税后收益率 | AC1: 税前回售收益 | AD1: 税后回售收益 | AE1: 回售价值 | AF1: 纯债价值 | AG1: 弹性 | AH1: 信用 | AI1: 折现率 | AJ1: 双低 | AK1: 老式双低 | AL1: 老式排名 | AM1: 新式双低 | AN1: 新式排名 | AO1: MA20乖离 | AP1: 热门度 | AQ1: 转债名称
A2: 1 | B2: 113638 | C2: N台21转 | D2: 603055 | E2: 台华新材 | F2: 服装纺织 | G2: 纺织行业 | H2: 130.26 | I2: 0.30299999999999999 | J2: 0. | K2: 16.14 | L2: -2.2400000000000003e-002 | M2: 117.1 | N2: 16.87 | O2: 0.36200000000000004 | P2: 95.67 | Q2: 5月14天 | R2: 5.93年 | S2: 3.93年 | T2: 6 | U2: 133 | V2: 0.17100000000000001 | W2: 4.2999999999999997e-002 | X2: 4.0999999999999995e-002 | Y2: 140 | Z2: 3.92 | AA2: -1.8100000000000002e-002 | AB2: -2.3e-002 | AC2: -5.4699999999999999e-002 | AD2: -5.62e-002 | AE2: 88.46 | AF2: 93.37 | AG2: 0.53 | AH2: AA | AI2: 3.9599999999999996e-002 | AJ2: =H2+100*O2 -> 166.45999999999998 | AK2: 164.8 | AL2: 207 | AM2: 71.5 | AN2: 224 | AO2: -6.0000000000000001e-003 | AP2: 1 | AQ2: N台21转
A3: 2 | B3: 123135 | C3: 泰林转债 | D3: 300813 | E3: 泰林生物 | F3: 医药 | G3: 医疗器械 | H3: 135.775 | I3: -2.7300000000000001e-002 | J3: -8.6999999999999994e-003 | K3: 75.98 | L3: -5.9500000000000004e-002 | M3: 121.5 | N3: 87.38 | O3: 0.56100000000000005 | P3: 86.95 | Q3: 5月13天 | R3: 5.93年 | S3: 3.93年 | T3: 2.1 | U3: 42 | V3: 0.14699999999999999 | W3: 5.2999999999999999e-002 | X3: 4.5999999999999999e-002 | Y3: 39 | Z3: 8.14 | AA3: -1.89e-002 | AB3: -2.4900000000000002e-002 | AC3: -6.2100000000000002e-002 | AD3: -6.4100000000000004e-002 | AE3: 79.11 | AF3: 81.39 | AG3: 0.6 | AH3: A+ | AI3: 7.1599999999999997e-002 | AJ3: =H3+100*O3 -> 191.875 | AK3: 184.6 | AL3: 303 | AM3: 103.2 | AN3: 329 | AO3: -0.17300000000000001 | AP3: 1 | AQ3: 泰林转债
A4: 3 | B4: 123134 | C4: 卡倍转债 | D4: 300863 | E4: 卡倍亿 | F4: 汽车 | G4: 零部件制 | H4: 133.7 | I4: -1.5800000000000002e-002 | J4: 8.199999999999999e-003 | K4: 77 | L4: -1.2800000000000001e-002 | M4: 121 | N4: 92.5 | O4: 0.60599999999999998 | P4: 83.24 | Q4: 5月10天 | R4: 5.93年 | S4: 3.93年 | T4: 2.79 | U4: 50 | V4: 0.13300000000000001 | W4: 6.6000000000000003e-002 | X4: 5.5e-002 | Y4: 43 | Z4: 6.72 | AA4: -1.7000000000000001e-002 | AB4: -2.29e-002 | AC4: -6.0100000000000001e-002 | AD4: -6.1799999999999994e-002 | AE4: 78.5 | AF4: 80.96 | AG4: 0.59 | AH4: A+ | AI4: 7.1599999999999997e-002 | AJ4: =H4+100*O4 -> 194.29999999999998 | AK4: 184.2 | AL4: 301 | AM4: 103.2 | AN4: 328 | AO4: -0.13200000000000001 | AP4: 1 | AQ4: 卡倍转债
A5: 4 | B5: 110084 | C5: 贵燃转债 | D5: 600903 | E5: 贵州燃气 | F5: 石油天然 | G5: 天然气 | H5: 117.84 | I5: -1.4000000000000002e-003 | J5: -4.0999999999999995e-003 | K5: 9.28 | L5: -1.0700000000000001e-002 | M5: 115.1 | N5: 10.17 | O5: 0.29100000000000004 | P5: 91.25 | Q5: 5月10天 | R5: 5.93年 | S5: 3.93年 | T5: 10 | U5: 124 | V5: 0.105 | W5: 9.5000000000000001e-002 | X5: 8.5999999999999993e-002 | Y5: 106 | Z5: 3.74 | AA5: -4.0000000000000001e-003 | AB5: -8.5000000000000006e-003 | AC5: -3.1200000000000002e-002 | AD5: -3.2799999999999996e-002 | AE5: 88.48 | AF5: 91.8 | AG5: 0.52 | AH5: AA | AI5: 3.9599999999999996e-002 | AJ5: =H5+100*O5 -> 146.94 | AK5: 144.4 | AL5: 28 | AM5: 52.6 | AN5: 72 | AO5: -4.5999999999999999e-002 | AP5: 2 | AQ5: 贵燃转债
A6: 5 | B6: 113052 | C6: 兴业转债 | D6: 601166 | E6: 兴业银行 | F6: 金融 | G6: 银行行业 | H6: 115.79 | I6: -7.8000000000000005e-003 | J6: 1.1000000000000001e-003 | K6: 21.8 | L6: -1.5800000000000002e-002 | M6: 114.4 | N6: 25.51 | O6: 0.35499999999999998 | P6: 85.46 | Q6: 5月9天 | R6: 5.93年 | S6: 无权 | T6: 500 | U6: 1741. | V6: 2.9999999999999999e-002 | W6: 0.11 | X6: 9.4e-002 | Y6: 4529. | Z6: 0.78 | AA6: -2.0999999999999999e-003 | AB6: -6.4000000000000003e-003 | AC6: 无权 | AD6: 无权 | AE6: 无权 | AF6: 94.89 | AG6: 0.42 | AH6: AAA | AI6: 3.2599999999999997e-002 | AJ6: =H6+100*O6 -> 151.29000000000002 | AK6: 146.1 | AL6: 38 | AM6: 51.2 | AN6: 62 | AO6: 8.0000000000000002e-002 | AP6: 7 | AQ6: 兴业转债
A7: 6 | B7: 113637 | C7: 华翔转债 | D7: 603112 | E7: 华翔股份 | F7: 机械装备 | G7: 专用设备 | H7: 128.77 | I7: -1.41e-002 | J7: 1.3100000000000001e-002 | K7: 13.32 | L7: -1.5e-003 | M7: 121 | N7: 12.99 | O7: 0.25600000000000001 | P7: 102.54 | Q7: 5月7天 | R7: 5.92年 | S7: 3.92年 | T7: 8 | U7: 373 | V7: 0.35899999999999999 | W7: 0.13800000000000001 | X7: 0.14099999999999999 | Y7: 58 | Z7: 2.93 | AA7: -1.0700000000000001e-002 | AB7: -1.66e-002 | AC7: -5.16e-002 | AD7: -5.33e-002 | AE7: 81.92 | AF7: 86.02 | AG7: 0.66 | AH7: AA- | AI7: 6.0599999999999994e-002 | AJ7: =H7+100*O7 -> 154.37 | AK7: 155 | AL7: 122 | AM7: 69 | AN7: 199 | AO7: 2.e-003 | AP7: 1 | AQ7: 华翔转债
A8: 7 | B8: 123133 | C8: N佩蒂转 | D8: 300673 | E8: 佩蒂股份 | F8: 食品饮料 | G8: 食品加工 | H8: 128.5 | I8: 0.28499999999999998 | J8: 0. | K8: 18.24 | L8: 2.18e-002 | M8: 120.5 | N8: 19.92 | O8: 0.40299999999999997 | P8: 91.57 | Q8: 5月7天 | R8: 5.92年 | S8: 3.92年 | T8: 7.2 | U8: 413 | V8: 0.44600000000000001 | W8: 0.156 | X8: 0.14300000000000002 | Y8: 46 | Z8: 2.78 | AA8: -1.1000000000000001e-002 | AB8: -1.6799999999999999e-002 | AC8: -5.1299999999999998e-002 | AD8: -5.2900000000000003e-002 | AE8: 81.85 | AF8: 85.65 | AG8: 0.59 | AH8: AA- | AI8: 6.0599999999999994e-002 | AJ8: =H8+100*O8 -> 168.80000000000001 | AK8: 165.4 | AL8: 210 | AM8: 79.8 | AN8: 264 | AO8: -7.0999999999999994e-002 | AP8: 1 | AQ8: N佩蒂转
A9: 8 | B9: 123132 | C9: 回盛转债 | D9: 300871 | E9: 回盛生物 | F9: 医药 | G9: 医药行业 | H9: 132.999 | I9: -1.72e-002 | J9: 7.7000000000000002e-003 | K9: 27.28 | L9: -1.52e-002 | M9: 121 | N9: 28.32 | O9: 0.38100000000000001 | P9: 96.33 | Q9: 5月2天 | R9: 5.90年 | S9: 3.90年 | T9: 7 | U9: 11 | V9: 1.2e-002 | W9: 0.154 | X9: 0.14899999999999999 | Y9: 45 | Z9: 3.12 | AA9: -1.6200000000000003e-002 | AB9: -2.2099999999999998e-002 | AC9: -5.9299999999999999e-002 | AD9: -6.0999999999999999e-002 | AE9: 81.99 | AF9: 86.09 | AG9: 0.62 | AH9: AA- | AI9: 6.0599999999999994e-002 | AJ9: =H9+100*O9 -> 171.09899999999999 | AK9: 169.7 | AL9: 244 | AM9: 83.6 | AN9: 276 | AO9: -5.5e-002 | AP9: 1 | AQ9: 回盛转债
A10: 9 | B10: 113636 | C10: 甬金转债 | D10: 603995 | E10: 甬金股份 | F10: 钢铁 | G10: 钢铁行业 | H10: 141.88 | I10: -9.1000000000000004e-003 | J10: -2.e-003 | K10: 56.61 | L10: -1.6200000000000003e-002 | M10: 120.6 | N10: 53.07 | O10: 0.33000000000000002 | P10: 106.67 | Q10: 4月26天 | R10: 5.89年 | S10: 3.89年 | T10: 10 | U10: 26 | V10: 1.8000000000000002e-002 | W10: 7.5999999999999998e-002 | X10: 8.1000000000000003e-002 | Y10: 132 | Z10: 3.84 | AA10: -2.76e-002 | AB10: -3.3399999999999999e-002 | AC10: -7.5199999999999989e-002 | AD10: -7.6700000000000004e-002 | AE10: 81.69 | AF10: 85.79 | AG10: 0.69 | AH10: AA- | AI10: 6.0599999999999994e-002 | AJ10: =H10+100*O10 -> 174.88 | AK10: 177.1 | AL10: 281 | AM10: 91.3 | AN10: 302 | AO10: -2.6000000000000002e-002 | AP10: 2 | AQ10: 甬金转债
A11: 10 | B11: 113635 | C11: 升21转债 | D11: 603305 | E11: 旭升股份 | F11: 汽车 | G11: 零部件制 | H11: 138.45 | I11: -8.199999999999999e-003 | J11: 8.0000000000000002e-003 | K11: 47.23 | L11: -4.0000000000000002e-004 | M11: 119.6 | N11: 46.37 | O11: 0.35899999999999999 | P11: 101.85 | Q11: 4月25天 | R11: 5.88年 | S11: 3.88年 | T11: 13.5 | U11: 29 | V11: 1.4999999999999999e-002 | W11: 6.4000000000000001e-002 | X11: 6.5000000000000002e-002 | Y11: 211 | Z11: 6.02 | AA11: -2.4900000000000002e-002 | AB11: -3.04e-002 | AC11: -7.0099999999999996e-002 | AD11: -7.1500000000000008e-002 | AE11: 81.6 | AF11: 85.09 | AG11: 0.66 | AH11: AA- | AI11: 6.0599999999999994e-002 | AJ11: =H11+100*O11 -> 174.34999999999999 | AK11: 175 | AL11: 271 | AM11: 90 | AN11: 296 | AO11: -1.1000000000000001e-002 | AP11: 2 | AQ11: 升21转债
A12: 11 | B12: 111002 | C12: 特纸转债 | D12: 605007 | E12: 五洲特纸 | F12: 造纸包装 | G12: 包装用纸 | H12: 156.54 | I12: -1.2999999999999999e-003 | J12: 1.1599999999999999e-002 | K12: 21.6 | L12: 1.46e-002 | M12: 117.1 | N12: 18.5 | O12: 0.34100000000000003 | P12: 116.76 | Q12: 4月23天 | R12: 5.88年 | S12: 3.88年 | T12: 6.7 | U12: 7.3 | V12: 6.9999999999999993e-003 | W12: 7.8e-002 | X12: 9.0999999999999998e-002 | Y12: 86 | Z12: 4.59 | AA12: -4.8899999999999999e-002 | AB12: -5.3600000000000002e-002 | AC12: -9.7699999999999995e-002 | AD12: -9.9100000000000008e-002 | AE12: 88.66 | AF12: 93.57 | AG12: 0.7 | AH12: AA | AI12: 3.9599999999999996e-002 | AJ12: =H12+100*O12 -> 190.63999999999999 | AK12: 196.3 | AL12: 330 | AM12: 102.7 | AN12: 327 | AO12: -6.0999999999999999e-002 | AP12: 1 | AQ12: 特纸转债
A13: 12 | B13: 113634 | C13: 珀莱转债 | D13: 603605 | E13: 珀莱雅 | F13: 化工 | G13: 日化 | H13: 131.91 | I13: 3.0000000000000001e-003 | J13: 7.000000000000001e-004 | K13: 178 | L13: 7.9000000000000008e-003 | M13: 120.1 | N13: 195.98 | O13: 0.45200000000000001 | P13: 90.83 | Q13: 4月23天 | R13: 5.88年 | S13: 3.88年 | T13: 7.52 | U13: 31 | V13: 3.1e-002 | W13: 2.1000000000000001e-002 | X13: 1.9e-002 | Y13: 358 | Z13: 13.69 | AA13: -1.61e-002 | AB13: -2.18e-002 | AC13: -5.8400000000000001e-002 | AD13: -5.9900000000000002e-002 | AE13: 88.66 | AF13: 95.96 | AG13: 0.46 | AH13: AA | AI13: 3.9599999999999996e-002 | AJ13: =H13+100*O13 -> 177.11000000000001 | AK13: 173 | AL13: 262 | AM13: 77 | AN13: 249 | AO13: -9.4e-002 | AP13: 4 | AQ13: 珀莱转债
A14: 13 | B14: 123131 | C14: 奥飞转债 | D14: 300738 | E14: 奥飞数据 | F14: 通信互联 | G14: 通信设备 | H14: 152.51 | I14: 8.0000000000000002e-003 | J14: -1.3600000000000001e-002 | K14: 25.16 | L14: -7.4999999999999997e-003 | M14: 121.7 | N14: 22.02 | O14: 0.33500000000000002 | P14: 114.26 | Q14: 4月18天 | R14: 5.86年 | S14: 3.86年 | T14: 6.35 | U14: 126 | V14: 0.129 | W14: 6.6000000000000003e-002 | X14: 7.5999999999999998e-002 | Y14: 96 | Z14: 6.82 | AA14: -3.85e-002 | AB14: -4.4400000000000002e-002 | AC14: -9.01e-002 | AD14: -9.1999999999999998e-002 | AE14: 79.43 | AF14: 81.9 | AG14: 0.75 | AH14: A+ | AI14: 7.1599999999999997e-002 | AJ14: =H14+100*O14 -> 186.00999999999999 | AK14: 190.8 | AL14: 316 | AM14: 108.9 | AN14: 334 | AO14: 9.0999999999999998e-002 | AP14: 2 | AQ14: 奥飞转债
A15: 14 | B15: 113633 | C15: 科沃转债! | D15: 603486 | E15: 科沃斯 | F15: 机械装备 | G15: 机器人及 | H15: 126.51 | I15: -9.3999999999999986e-003 | J15: 6.4000000000000003e-003 | K15: 136.47 | L15: -8.3999999999999995e-003 | M15: 115.1 | N15: 178.28 | O15: 0.65300000000000002 | P15: 76.55 | Q15: 4月15天 | R15: 5.85年 | S15: 3.85年 | T15: 10.4 | U15: 20 | V15: 1.4999999999999999e-002 | W15: 1.3000000000000001e-002 | X15: 1.e-002 | Y15: 782 | Z15: 18.49 | AA15: -1.6299999999999999e-002 | AB15: -2.07e-002 | AC15: -4.8799999999999996e-002 | AD15: -5.04e-002 | AE15: 88.73 | AF15: 92.06 | AG15: 0.36 | AH15: AA | AI15: 3.9599999999999996e-002 | AJ15: =H15+100*O15 -> 191.81 | AK15: 176.5 | AL15: 279 | AM15: 84.4 | AN15: 280 | AO15: -7.0999999999999994e-002 | AP15: 5 | AQ15: 科沃转债!
A16: 15 | B16: 118003 | C16: 华兴转债 | D16: 688001 | E16: 华兴源创 | F16: 机械装备 | G16: 专用设备 | H16: 130.91 | I16: -1.1000000000000001e-002 | J16: -1.83e-002 | K16: 34.92 | L16: -5.9999999999999998e-002 | M16: 115.1 | N16: 39.33 | O16: 0.47399999999999998 | P16: 88.79 | Q16: 4月12天 | R16: 5.85年 | S16: 3.85年 | T16: 8 | U16: 6.5 | V16: 6.0000000000000001e-003 | W16: 5.2000000000000005e-002 | X16: 4.5999999999999999e-002 | Y16: 153 | Z16: 4.52 | AA16: -2.2099999999999998e-002 | AB16: -2.6499999999999999e-002 | AC16: -5.6900000000000006e-002 | AD16: -5.8499999999999996e-002 | AE16: 88.74 | AF16: 92.07 | AG16: 0.49 | AH16: AA | AI16: 3.9599999999999996e-002 | AJ16: =H16+100*O16 -> 178.31 | AK16: 173 | AL16: 264 | AM16: 81 | AN16: 267 | AO16: -3.3000000000000002e-002 | AP16: 3 | AQ16: 华兴转债
A17: 16 | B17: 127051 | C17: 博杰转债 | D17: 2975 | E17: 博杰股份 | F17: 机械装备 | G17: 机器人及 | H17: 134.5 | I17: -2.3399999999999997e-002 | J17: 6.0000000000000001e-003 | K17: 59.82 | L17: -2.7900000000000001e-002 | M17: 121.1 | N17: 62.17 | O17: 0.39799999999999996 | P17: 96.22 | Q17: 4月1天 | R17: 5.82年 | S17: 4.82年 | T17: 5.26 | U17: 3.8 | V17: 5.0000000000000001e-003 | W17: 6.3e-002 | X17: 6.0999999999999999e-002 | Y17: 84 | Z17: 5.64 | AA17: -1.8200000000000001e-002 | AB17: -2.4199999999999999e-002 | AC17: -4.6199999999999998e-002 | AD17: -4.8399999999999999e-002 | AE17: 79.87 | AF17: 86.59 | AG17: 0.62 | AH17: AA- | AI17: 6.0599999999999994e-002 | AJ17: =H17+100*O17 -> 174.30000000000001 | AK17: 172.8 | AL17: 259 | AM17: 86.2 | AN17: 285 | AO17: -5.5999999999999994e-002 | AP17: 2 | AQ17: 博杰转债
A18: 17 | B18: 113632 | C18: 鹤21转债 | D18: 603733 | E18: 仙鹤股份 | F18: 造纸包装 | G18: 造纸行业 | H18: 134.58 | I18: -4.5000000000000005e-003 | J18: -1.5600000000000001e-002 | K18: 37.34 | L18: -3.8100000000000002e-002 | M18: 117.1 | N18: 39.09 | O18: 0.40899999999999997 | P18: 95.52 | Q18: 4月1天 | R18: 5.82年 | S18: 3.82年 | T18: 20.5 | U18: 25 | V18: 9.0000000000000011e-003 | W18: 7.8e-002 | X18: 7.400000000000001e-002 | Y18: 264 | Z18: 4.37 | AA18: -2.4e-002 | AB18: -2.8999999999999998e-002 | AC18: -6.4000000000000001e-002 | AD18: -6.5500000000000003e-002 | AE18: 88.86 | AF18: 93.78 | AG18: 0.53 | AH18: AA | AI18: 3.9599999999999996e-002 | AJ18: =H18+100*O18 -> 175.48000000000002 | AK18: 173.6 | AL18: 267 | AM18: 79.9 | AN18: 266 | AO18: -5.7000000000000002e-002 | AP18: 2 | AQ18: 鹤21转债
A19: 18 | B19: 127050 | C19: 麒麟转债 | D19: 2984 | E19: 森麒麟 | F19: 汽车 | G19: 零部件制 | H19: 136.25 | I19: -4.6999999999999993e-003 | J19: -3.0999999999999999e-003 | K19: 30.68 | L19: -1.6399999999999998e-002 | M19: 115.1 | N19: 34.85 | O19: 0.54799999999999993 | P19: 88.03 | Q19: 3月25天 | R19: 5.80年 | S19: 3.80年 | T19: 22 | U19: 4.8 | V19: 2.e-003 | W19: 0.11 | X19: 9.6999999999999989e-002 | Y19: 199 | Z19: 3.26 | AA19: -2.9100000000000001e-002 | AB19: -3.3500000000000002e-002 | AC19: -6.7099999999999993e-002 | AD19: -6.8699999999999997e-002 | AE19: 88.91 | AF19: 92.25 | AG19: 0.48 | AH19: AA | AI19: 3.9599999999999996e-002 | AJ19: =H19+100*O19 -> 191.04999999999998 | AK19: 184.5 | AL19: 302 | AM19: 92.2 | AN19: 303 | AO19: -8.8000000000000009e-002 | AP19: 3 | AQ19: 麒麟转债
A20: 19 | B20: 110083 | C20: 苏租转债 | D20: 600901 | E20: 江苏租赁 | F20: 金融 | G20: 其他 | H20: 121.3 | I20: -6.0999999999999995e-003 | J20: 3.0000000000000001e-003 | K20: 5.19 | L20: -5.6999999999999993e-003 | M20: 110.5 | N20: 5.42 | O20: 0.26700000000000002 | P20: 95.76 | Q20: 3月25天 | R20: 5.80年 | S20: 无权 | T20: 50 | U20: 12 | V20: 2.e-003 | W20: 0.32299999999999995 | X20: 0.309 | Y20: 155 | Z20: 1.13 | AA20: -1.61e-002 | AB20: -1.9400000000000001e-002 | AC20: 无权 | AD20: 无权 | AE20: 无权 | AF20: 91.94 | AG20: 0.55 | AH20: AAA | AI20: 3.2599999999999997e-002 | AJ20: =H20+100*O20 -> 148. | AK20: 146.8 | AL20: 44 | AM20: 54.9 | AN20: 86 | AO20: 8.0000000000000002e-003 | AP20: 5 | AQ20: 苏租转债
A21: 20 | B21: 123130 | C21: 设研转债 | D21: 300732 | E21: 设研院 | F21: 建筑 | G21: 建筑工程 | H21: 140 | I21: -2.29e-002 | J21: 2.3999999999999998e-003 | K21: 12.56 | L21: -3.0899999999999997e-002 | M21: 117.1 | N21: 11.24 | O21: 0.253 | P21: 111.74 | Q21: 3月25天 | R21: 5.80年 | S21: 3.80年 | T21: 3.76 | U21: 46 | V21: 8.5000000000000006e-002 | W21: 0.109 | X21: 0.122 | Y21: 35 | Z21: 1.37 | AA21: -3.0800000000000001e-002 | AB21: -3.5699999999999996e-002 | AC21: -7.3499999999999996e-002 | AD21: -7.51e-002 | AE21: 88.91 | AF21: 93.84 | AG21: 0.66 | AH21: AA | AI21: 3.9599999999999996e-002 | AJ21: =H21+100*O21 -> 165.30000000000001 | AK21: 168.3 | AL21: 233 | AM21: 74.4 | AN21: 235 | AO21: 1.9e-002 | AP21: 3 | AQ21: 设研转债
A22: 21 | B22: 111001 | C22: 山玻转债 | D22: 605006 | E22: 山东玻纤 | F22: 其他 | G22: 非金属矿 | H22: 126.7 | I22: -2.7000000000000001e-003 | J22: -5.0000000000000001e-003 | K22: 12.72 | L22: -1.32e-002 | M22: 120.1 | N22: 13.91 | O22: 0.38600000000000001 | P22: 91.45 | Q22: 3月20天 | R22: 5.79年 | S22: 3.79年 | T22: 6 | U22: 1.6 | V22: 2.e-003 | W22: 9.4e-002 | X22: 8.5999999999999993e-002 | Y22: 64 | Z22: 2.95 | AA22: -9.300000000000001e-003 | AB22: -1.52e-002 | AC22: -4.99e-002 | AD22: -5.1500000000000004e-002 | AE22: 82.22 | AF22: 85.92 | AG22: 0.58 | AH22: AA- | AI22: 6.0599999999999994e-002 | AJ22: =H22+100*O22 -> 165.30000000000001 | AK22: 162 | AL22: 182 | AM22: 76 | AN22: 244 | AO22: -7.2000000000000008e-002 | AP22: 3 | AQ22: 山玻转债
A23: 22 | B23: 113631 | C23: 皖天转债 | D23: 603689 | E23: 皖天然气 | F23: 石油天然 | G23: 天然气 | H23: 121.53 | I23: -9.7000000000000003e-003 | J23: 5.8999999999999999e-003 | K23: 10.1 | L23: -7.9000000000000008e-003 | M23: 114.5 | N23: 11.12 | O23: 0.33799999999999997 | P23: 90.83 | Q23: 3月20天 | R23: 5.79年 | S23: 3.79年 | T23: 9.3 | U23: 5.9 | V23: 5.0000000000000001e-003 | W23: 0.27399999999999997 | X23: 0.249 | Y23: 34 | Z23: 1.38 | AA23: -1.04e-002 | AB23: -1.4800000000000001e-002 | AC23: -4.1100000000000005e-002 | AD23: -4.2500000000000003e-002 | AE23: 90.09 | AF23: 94.29 | AG23: 0.48 | AH23: AA+ | AI23: 3.4599999999999999e-002 | AJ23: =H23+100*O23 -> 155.32999999999998 | AK23: 152.2 | AL23: 97 | AM23: 57.9 | AN23: 110 | AO23: -4.7e-002 | AP23: 3 | AQ23: 皖天转债
A24: 23 | B24: 123129 | C24: 锦鸡转债 | D24: 300798 | E24: 锦鸡股份 | F24: 化工 | G24: 其他 | H24: 123.712 | I24: -7.0999999999999995e-003 | J24: 8.5000000000000006e-003 | K24: 9.38 | L24: 2.0999999999999999e-003 | M24: 117.8 | N24: 9.53 | O24: 0.25700000000000001 | P24: 98.43 | Q24: 3月18天 | R24: 5.78年 | S24: 3.78年 | T24: 6 | U24: 6.3 | V24: 9.0000000000000011e-003 | W24: 0.153 | X24: 0.151 | Y24: 39 | Z24: 3.14 | AA24: -8.6e-003 | AB24: -1.3899999999999999e-002 | AC24: -4.36e-002 | AD24: -4.5400000000000003e-002 | AE24: 82.53 | AF24: 84.4 | AG24: 0.65 | AH24: AA- | AI24: 6.0599999999999994e-002 | AJ24: =H24+100*O24 -> 149.41200000000001 | AK24: 149 | AL24: 65 | AM24: 64.6 | AN24: 159 | AO24: -4.9000000000000002e-002 | AP24: 3 | AQ24: 锦鸡转债
A25: 24 | B25: 127049 | C25: 希望转2 | D25: 876 | E25: 新 希 望 | F25: 农业 | G25: 畜牧业 | H25: 143.8 | I25: -1.8100000000000002e-002 | J25: -1.8000000000000002e-002 | K25: 16.15 | L25: -5.28e-002 | M25: 111.2 | N25: 14.45 | O25: 0.28699999999999998 | P25: 111.76 | Q25: 3月16天 | R25: 5.78年 | S25: 3.78年 | T25: 81.5 | U25: 116 | V25: 1.e-002 | W25: 0.11199999999999999 | X25: 0.125 | Y25: 728 | Z25: 2.38 | AA25: -4.41e-002 | AB25: -4.7400000000000005e-002 | AC25: -8.1799999999999998e-002 | AD25: -8.3000000000000004e-002 | AE25: 90.71 | AF25: 92.64 | AG25: 0.68 | AH25: AAA | AI25: 3.2599999999999997e-002 | AJ25: =H25+100*O25 -> 172.5 | AK25: 175.8 | AL25: 275 | AM25: 83.2 | AN25: 275 | AO25: -8.0000000000000002e-003 | AP25: 8 | AQ25: 希望转2
A26: 25 | B26: 123128 | C26: 首华转债! | D26: 300483 | E26: 首华燃气 | F26: 石油天然 | G26: 天然气 | H26: 109.779 | I26: -2.0999999999999999e-003 | J26: 2.7000000000000001e-003 | K26: 15.09 | L26: 3.3e-003 | M26: 115.1 | N26: 25.02 | O26: 0.81999999999999995 | P26: 60.31 | Q26: 3月13天 | R26: 5.78年 | S26: 3.78年 | T26: 13.8 | U26: 13 | V26: 9.0000000000000011e-003 | W26: 0.34000000000000002 | X26: 0.20499999999999999 | Y26: 41 | Z26: 1.44 | AA26: 8.3999999999999995e-003 | AB26: 3.5999999999999999e-003 | AC26: -1.47e-002 | AD26: -1.6399999999999998e-002 | AE26: 89.01 | AF26: 92.34 | AG26: 0.18 | AH26: AA | AI26: 3.9599999999999996e-002 | AJ26: =H26+100*O26 -> 191.779 | AK26: 159.2 | AL26: 155 | AM26: 66.9 | AN26: 179 | AO26: -0.113 | AP26: 9 | AQ26: 首华转债!
A27: 26 | B27: 123127 | C27: 耐普转债 | D27: 300818 | E27: 耐普矿机 | F27: 机械装备 | G27: 专用设备 | H27: 131.613 | I27: 5.1000000000000004e-003 | J27: 2.7000000000000001e-003 | K27: 41.15 | L27: 1.03e-002 | M27: 116.2 | N27: 37 | O27: 0.183 | P27: 111.22 | Q27: 3月12天 | R27: 5.77年 | S27: 3.77年 | T27: 4 | U27: 95 | V27: 0.17999999999999999 | W27: 0.13900000000000001 | X27: 0.154 | Y27: 29 | Z27: 3.06 | AA27: -2.18e-002 | AB27: -2.6600000000000002e-002 | AC27: -5.79e-002 | AD27: -5.9800000000000006e-002 | AE27: 79.67 | AF27: 78.68 | AG27: 0.76 | AH27: A+ | AI27: 7.1599999999999997e-002 | AJ27: =H27+100*O27 -> 149.91300000000001 | AK27: 152 | AL27: 92 | AM27: 72.3 | AN27: 227 | AO27: -5.5e-002 | AP27: 4 | AQ27: 耐普转债
A28: 27 | B28: 110082 | C28: 宏发转债 | D28: 600885 | E28: 宏发股份 | F28: 能源电力 | G28: 电力设备 | H28: 133.66 | I28: -4.7999999999999996e-003 | J28: 3.7000000000000002e-003 | K28: 66.63 | L28: -2.2000000000000001e-003 | M28: 117.1 | N28: 72.28 | O28: 0.45000000000000001 | P28: 92.18 | Q28: 3月11天 | R28: 5.76年 | S28: 3.76年 | T28: 20 | U28: 17 | V28: 6.0000000000000001e-003 | W28: 4.0000000000000001e-002 | X28: 3.7000000000000005e-002 | Y28: 496 | Z28: 8.16 | AA28: -2.3099999999999999e-002 | AB28: -2.81e-002 | AC28: -6.3200000000000006e-002 | AD28: -6.480000000000001e-002 | AE28: 89.05 | AF28: 93.98 | AG28: 0.5 | AH28: AA | AI28: 3.9599999999999996e-002 | AJ28: =H28+100*O28 -> 178.66 | AK28: 175.1 | AL28: 272 | AM28: 81.2 | AN28: 268 | AO28: -3.3000000000000002e-002 | AP28: 5 | AQ28: 宏发转债
A29: 28 | B29: 113630 | C29: 赛伍转债 | D29: 603212 | E29: 赛伍技术 | F29: 能源电力 | G29: 太阳能 | H29: 134.31 | I29: -4.5000000000000005e-003 | J29: -7.7000000000000002e-003 | K29: 26.72 | L29: -2.4799999999999999e-002 | M29: 120.5 | N29: 32.9 | O29: 0.65400000000000003 | P29: 81.22 | Q29: 3月10天 | R29: 5.76年 | S29: 3.76年 | T29: 7 | U29: 10 | V29: 1.1000000000000001e-002 | W29: 6.5000000000000002e-002 | X29: 5.2999999999999999e-002 | Y29: 108 | Z29: 5.36 | AA29: -1.9e-002 | AB29: -2.4900000000000002e-002 | AC29: -6.3899999999999998e-002 | AD29: -6.5599999999999992e-002 | AE29: 82.6 | AF29: 86.42 | AG29: 0.49 | AH29: AA- | AI29: 6.0599999999999994e-002 | AJ29: =H29+100*O29 -> 199.71000000000001 | AK29: 187.4 | AL29: 311 | AM29: 101 | AN29: 323 | AO29: -8.900000000000001e-002 | AP29: 4 | AQ29: 赛伍转债
A30: 29 | B30: 127048 | C30: 中大转债 | D30: 2896 | E30: 中大力德 | F30: 机械装备 | G30: 通用设备 | H30: 135.69 | I30: -9.4999999999999998e-003 | J30: 1.1000000000000001e-002 | K30: 22.78 | L30: 2.2000000000000001e-003 | M30: 121.7 | N30: 22.1 | O30: 0.316 | P30: 103.08 | Q30: 3月9天 | R30: 5.76年 | S30: 3.76年 | T30: 2.7 | U30: 4.8 | V30: 1.3000000000000001e-002 | W30: 0.114 | X30: 0.11699999999999999 | Y30: 24 | Z30: 3.25 | AA30: -1.9099999999999999e-002 | AB30: -2.53e-002 | AC30: -6.4699999999999994e-002 | AD30: -6.6699999999999995e-002 | AE30: 80 | AF30: 82.49 | AG30: 0.69 | AH30: A+ | AI30: 7.1599999999999997e-002 | AJ30: =H30+100*O30 -> 167.28999999999999 | AK30: 168.3 | AL30: 234 | AM30: 85.8 | AN30: 284 | AO30: -3.2000000000000001e-002 | AP30: 3 | AQ30: 中大转债
A31: 30 | B31: 127047 | C31: 帝欧转债 | D31: 2798 | E31: 帝欧家居 | F31: 其他 | G31: 家居用品 | H31: 136.2 | I31: -2.2000000000000001e-003 | J31: -1.3999999999999999e-002 | K31: 14.4 | L31: -2.3700000000000002e-002 | M31: 120.4 | N31: 13.53 | O31: 0.28000000000000003 | P31: 106.43 | Q31: 3月7天 | R31: 5.76年 | S31: 3.76年 | T31: 15 | U31: 12 | V31: 6.0000000000000001e-003 | W31: 0.26899999999999996 | X31: 0.28699999999999998 | Y31: 56 | Z31: 1.22 | AA31: -2.1499999999999998e-002 | AB31: -2.7400000000000001e-002 | AC31: -6.7500000000000004e-002 | AD31: -6.9099999999999995e-002 | AE31: 82.52 | AF31: 86.35 | AG31: 0.68 | AH31: AA- | AI31: 6.0599999999999994e-002 | AJ31: =H31+100*O31 -> 164.19999999999999 | AK31: 166 | AL31: 216 | AM31: 79.6 | AN31: 263 | AO31: -2.9999999999999999e-002 | AP31: 4 | AQ31: 帝欧转债
A32: 31 | B32: 127046 | C32: 百润转债 | D32: 2568 | E32: 百润股份 | F32: 食品饮料 | G32: 葡萄酒洋 | H32: 130.146 | I32: -5.0000000000000001e-003 | J32: 1.8200000000000001e-002 | K32: 48.99 | L32: 4.2300000000000004e-002 | M32: 115.1 | N32: 66.89 | O32: 0.77700000000000002 | P32: 73.24 | Q32: 2月20天 | R32: 5.69年 | S32: 3.69年 | T32: 11.3 | U32: 45 | V32: 3.1e-002 | W32: 3.1e-002 | X32: 2.2000000000000002e-002 | Y32: 367 | Z32: 10.46 | AA32: -2.1700000000000001e-002 | AB32: -2.63e-002 | AC32: -5.79e-002 | AD32: -5.9500000000000004e-002 | AE32: 89.32 | AF32: 92.67 | AG32: 0.31 | AH32: AA | AI32: 3.9599999999999996e-002 | AJ32: =H32+100*O32 -> 207.846 | AK32: 187.1 | AL32: 309 | AM32: 94.4 | AN32: 307 | AO32: -0.124 | AP32: 4 | AQ32: 百润转债
A33: 32 | B33: 113629 | C33: 泉峰转债 | D33: 603982 | E33: 泉峰汽车 | F33: 汽车 | G33: 零部件制 | H33: 169.77 | I33: 3.61e-002 | J33: 1.84e-002 | K33: 33.88 | L33: 6.54e-002 | M33: 121 | N33: 23.03 | O33: 0.154 | P33: 147.11 | Q33: 59天 | R33: 5.64年 | S33: 3.64年 | T33: 6.2 | U33: 1073. | V33: 1.02 | W33: 9.0999999999999998e-002 | X33: 0.13400000000000001 | Y33: 68 | Z33: 4.11 | AA33: -5.9200000000000003e-002 | AB33: -6.5000000000000002e-002 | AC33: -0.11699999999999999 | AD33: -0.11900000000000001 | AE33: 83.24 | AF33: 87.4 | AG33: 0.83 | AH33: AA- | AI33: 6.0599999999999994e-002 | AJ33: =H33+100*O33 -> 185.17000000000002 | AK33: 192.4 | AL33: 318 | AM33: 105 | AN33: 331 | AO33: -0.19500000000000001 | AP33: 5 | AQ33: 泉峰转债
A34: 33 | B34: 123126 | C34: 瑞丰转债! | D34: 300243 | E34: 瑞丰高材 | F34: 化工 | G34: 橡胶塑料 | H34: 119.11 | I34: 3.3e-003 | J34: -1.1299999999999999e-002 | K34: 12.54 | L34: -2.0299999999999999e-002 | M34: 129.6 | N34: 17.8 | O34: 0.69099999999999995 | P34: 70.45 | Q34: 53天 | R34: 5.63年 | S34: 3.63年 | T34: 3.4 | U34: 7.1 | V34: 1.8000000000000002e-002 | W34: 0.11699999999999999 | X34: 8.199999999999999e-002 | Y34: 29 | Z34: 3.59 | AA34: 1.55e-002 | AB34: 6.8999999999999999e-003 | AC34: -2.8900000000000002e-002 | AD34: -3.2099999999999997e-002 | AE34: 82.36 | AF34: 88.85 | AG34: 0.4 | AH34: A+ | AI34: 7.1599999999999997e-002 | AJ34: =H34+100*O34 -> 188.20999999999998 | AK34: 167.8 | AL34: 231 | AM34: 78.9 | AN34: 257 | AO34: -6.3e-002 | AP34: 8 | AQ34: 瑞丰转债!
A35: 34 | B35: 123125 | C35: 元力转债 | D35: 300174 | E35: 元力股份 | F35: 化工 | G35: 化工 | H35: 121.2 | I35: -6.8999999999999999e-003 | J35: 6.5000000000000006e-003 | K35: 15.51 | L35: -5.9999999999999995e-004 | M35: 109.3 | N35: 17.61 | O35: 0.376 | P35: 88.07 | Q35: 47天 | R35: 5.62年 | S35: 3.62年 | T35: 9 | U35: 16 | V35: 1.3999999999999999e-002 | W35: 0.18600000000000003 | X35: 0.16399999999999998 | Y35: 48 | Z35: 2.76 | AA35: -1.8500000000000003e-002 | AB35: -2.1400000000000002e-002 | AC35: -4.2699999999999995e-002 | AD35: -4.4000000000000004e-002 | AE35: 82.35 | AF35: 78.91 | AG35: 0.61 | AH35: AA- | AI35: 6.0599999999999994e-002 | AJ35: =H35+100*O35 -> 158.80000000000001 | AK35: 154.3 | AL35: 115 | AM35: 72 | AN35: 225 | AO35: -5.9999999999999998e-002 | AP35: 4 | AQ35: 元力转债
A36: 35 | B36: 113628 | C36: 晨丰转债 | D36: 603685 | E36: 晨丰科技 | F36: 能源电力 | G36: 电力设备 | H36: 120.33 | I36: -5.8999999999999999e-003 | J36: 8.199999999999999e-003 | K36: 12.15 | L36: 3.3e-003 | M36: 121.7 | N36: 13.06 | O36: 0.29299999999999998 | P36: 93.03 | Q36: 36天 | R36: 5.58年 | S36: 3.58年 | T36: 4.15 | U36: 2.6 | V36: 5.0000000000000001e-003 | W36: 0.20199999999999999 | X36: 0.188 | Y36: 21 | Z36: 1.82 | AA36: 2.0999999999999999e-003 | AB36: -4.5000000000000005e-003 | AC36: -3.7000000000000005e-002 | AD36: -3.9199999999999999e-002 | AE36: 78.24 | AF36: 79.38 | AG36: 0.68 | AH36: A | AI36: 8.1600000000000006e-002 | AJ36: =H36+100*O36 -> 149.63 | AK36: 147.6 | AL36: 54 | AM36: 68.2 | AN36: 189 | AO36: -2.4e-002 | AP36: 10 | AQ36: 晨丰转债
A37: 36 | B37: 123124 | C37: 晶瑞转2! | D37: 300655 | E37: 晶瑞电材 | F37: 电子 | G37: 电子行业 | H37: 125.3 | I37: -4.6999999999999993e-003 | J37: -6.0999999999999995e-003 | K37: 35.51 | L37: -2.3599999999999999e-002 | M37: 111.2 | N37: 50.31 | O37: 0.77500000000000002 | P37: 70.58 | Q37: 29天 | R37: 5.56年 | S37: 3.56年 | T37: 5.23 | U37: 11 | V37: 1.7000000000000001e-002 | W37: 4.2999999999999997e-002 | X37: 3.1e-002 | Y37: 121 | Z37: 8.34 | AA37: -2.1499999999999998e-002 | AB37: -2.5099999999999997e-002 | AC37: -5.21e-002 | AD37: -5.3399999999999996e-002 | AE37: 79.45 | AF37: 76.1 | AG37: 0.46 | AH37: A+ | AI37: 7.1599999999999997e-002 | AJ37: =H37+100*O37 -> 202.80000000000001 | AK37: 180 | AL37: 290 | AM37: 100.6 | AN37: 322 | AO37: -0.124 | AP37: 7 | AQ37: 晶瑞转2!
A38: 37 | B38: 127044 | C38: 蒙娜转债! | D38: 2918 | E38: 蒙娜丽莎 | F38: 建筑 | G38: 其他建材 | H38: 141.494 | I38: 4.6999999999999993e-003 | J38: -2.4e-002 | K38: 26.35 | L38: -3.5900000000000001e-002 | M38: 117.1 | N38: 27.07 | O38: 0.45399999999999996 | P38: 97.34 | Q38: 30天 | R38: 5.56年 | S38: 3.56年 | T38: 11.7 | U38: 29 | V38: 1.7000000000000001e-002 | W38: 0.107 | X38: 0.10400000000000001 | Y38: 109 | Z38: 2.93 | AA38: -3.4000000000000002e-002 | AB38: -3.9100000000000003e-002 | AC38: -8.0700000000000008e-002 | AD38: -8.2299999999999998e-002 | AE38: 89.74 | AF38: 94.72 | AG38: 0.54 | AH38: AA | AI38: 3.9599999999999996e-002 | AJ38: =H38+100*O38 -> 186.89400000000001 | AK38: 185.6 | AL38: 304 | AM38: 90.9 | AN38: 300 | AO38: -1.e-003 | AP38: 3 | AQ38: 蒙娜转债!
A39: 38 | B39: 127045 | C39: 牧原转债 | D39: 2714 | E39: 牧原股份 | F39: 农业 | G39: 畜牧业 | H39: 142.99 | I39: -5.4000000000000003e-003 | J39: -2.1299999999999999e-002 | K39: 55 | L39: -3.85e-002 | M39: 111.1 | N39: 47.91 | O39: 0.24600000000000002 | P39: 114.8 | Q39: 30天 | R39: 5.56年 | S39: 3.56年 | T39: 95.5 | U39: 78 | V39: 6.0000000000000001e-003 | W39: 3.3000000000000002e-002 | X39: 3.7999999999999999e-002 | Y39: 2894. | Z39: 5.49 | AA39: -4.4900000000000002e-002 | AB39: -4.8300000000000003e-002 | AC39: -8.5000000000000006e-002 | AD39: -8.6199999999999999e-002 | AE39: 90.67 | AF39: 92.2 | AG39: 0.7 | AH39: AA+ | AI39: 3.4599999999999999e-002 | AJ39: =H39+100*O39 -> 167.59 | AK39: 171.2 | AL39: 250 | AM39: 79 | AN39: 258 | AO39: -1.e-003 | AP39: 10 | AQ39: 牧原转债
A40: 39 | B40: 118002 | C40: 天合转债 | D40: 688599 | E40: 天合光能 | F40: 能源电力 | G40: 太阳能 | H40: 158.34 | I40: 1.1999999999999999e-003 | J40: 1.38e-002 | K40: 67.07 | L40: 1.95e-002 | M40: 120.1 | N40: 50.51 | O40: 0.192 | P40: 132.79 | Q40: 30天 | R40: 5.56年 | S40: 3.56年 | T40: 52.5 | U40: 292 | V40: 3.5000000000000003e-002 | W40: 3.7999999999999999e-002 | X40: 5.0000000000000003e-002 | Y40: 1391. | Z40: 8.64 | AA40: -4.9299999999999997e-002 | AB40: -5.5e-002 | AC40: -0.105 | AD40: -0.107 | AE40: 89.77 | AF40: 97.16 | AG40: 0.77 | AH40: AA | AI40: 3.9599999999999996e-002 | AJ40: =H40+100*O40 -> 177.53999999999999 | AK40: 183.9 | AL40: 299 | AM40: 86.7 | AN40: 287 | AO40: -4.4999999999999998e-002 | AP40: 8 | AQ40: 天合转债
A41: 40 | B41: 127043 | C41: 川恒转债 | D41: 2895 | E41: 川恒股份 | F41: 化工 | G41: 农化 | H41: 147.76 | I41: 3.2000000000000002e-003 | J41: -1.4000000000000002e-003 | K41: 23.43 | L41: 2.5999999999999999e-003 | M41: 121 | N41: 21.02 | O41: 0.32600000000000001 | P41: 111.47 | Q41: 27天 | R41: 5.55年 | S41: 3.55年 | T41: 11.6 | U41: 67 | V41: 3.9e-002 | W41: 0.10099999999999999 | X41: 0.113 | Y41: 114 | Z41: 3.62 | AA41: -3.6000000000000004e-002 | AB41: -4.2099999999999999e-002 | AC41: -9.0999999999999998e-002 | AD41: -9.2699999999999991e-002 | AE41: 83.68 | AF41: 87.87 | AG41: 0.69 | AH41: AA- | AI41: 6.0599999999999994e-002 | AJ41: =H41+100*O41 -> 180.35999999999999 | AK41: 184.1 | AL41: 300 | AM41: 96.2 | AN41: 311 | AO41: -4.7e-002 | AP41: 7 | AQ41: 川恒转债
A42: 41 | B42: 123123 | C42: 江丰转债! | D42: 300666 | E42: 江丰电子 | F42: 电子 | G42: 电子行业 | H42: 133.586 | I42: 6.7000000000000002e-003 | J42: -1.44e-002 | K42: 49.1 | L42: -1.21e-002 | M42: 121.5 | N42: 51.93 | O42: 0.41299999999999998 | P42: 94.55 | Q42: 27天 | R42: 5.55年 | S42: 3.55年 | T42: 5.17 | U42: 9.1 | V42: 1.3000000000000001e-002 | W42: 4.5999999999999999e-002 | X42: 4.4000000000000004e-002 | Y42: 112 | Z42: 8.95 | AA42: -1.7299999999999999e-002 | AB42: -2.3700000000000002e-002 | AC42: -6.4699999999999994e-002 | AD42: -6.6699999999999995e-002 | AE42: 80.97 | AF42: 83.49 | AG42: 0.64 | AH42: A+ | AI42: 7.1599999999999997e-002 | AJ42: =H42+100*O42 -> 174.88600000000002 | AK42: 172.6 | AL42: 256 | AM42: 89.1 | AN42: 293 | AO42: -6.0999999999999999e-002 | AP42: 7 | AQ42: 江丰转债!
A43: 42 | B43: 127042 | C43: 嘉美转债 | D43: 2969 | E43: 嘉美包装 | F43: 造纸包装 | G43: 包装材料 | H43: 126.8 | I43: -3.0299999999999997e-002 | J43: 1.e-004 | K43: 5.68 | L43: -4.3799999999999999e-002 | M43: 117.1 | N43: 4.87 | O43: 8.6999999999999994e-002 | P43: 116.63 | Q43: 23天 | R43: 5.55年 | S43: 3.55年 | T43: 7.5 | U43: 191 | V43: 0.19899999999999998 | W43: 0.13699999999999998 | X43: 0.16 | Y43: 55 | Z43: 2.49 | AA43: -1.4499999999999999e-002 | AB43: -1.9799999999999998e-002 | AC43: -5.3399999999999996e-002 | AD43: -5.5099999999999996e-002 | AE43: 89.81 | AF43: 94.79 | AG43: 0.69 | AH43: AA | AI43: 3.9599999999999996e-002 | AJ43: =H43+100*O43 -> 135.5 | AK43: 137 | AL43: 8 | AM43: 42.2 | AN43: 19 | AO43: 1.9e-002 | AP43: 14 | AQ43: 嘉美转债
A44: 43 | B44: 123122 | C44: 富瀚转债! | D44: 300613 | E44: 富瀚微 | F44: 电子 | G44: 芯片制造 | H44: 128.407 | I44: -8.3999999999999995e-003 | J44: -1.5800000000000002e-002 | K44: 132.7 | L44: -5.04e-002 | M44: 120.3 | N44: 177.04 | O44: 0.71299999999999997 | P44: 74.95 | Q44: 21天 | R44: 5.54年 | S44: 3.54年 | T44: 5.81 | U44: 17 | V44: 2.3e-002 | W44: 3.6000000000000004e-002 | X44: 2.7000000000000003e-002 | Y44: 160 | Z44: 9.74 | AA44: -1.1899999999999999e-002 | AB44: -1.8100000000000002e-002 | AC44: -5.6600000000000004e-002 | AD44: -5.8400000000000001e-002 | AE44: 80.4 | AF44: 82.63 | AG44: 0.48 | AH44: A+ | AI44: 7.1599999999999997e-002 | AJ44: =H44+100*O44 -> 199.70699999999999 | AK44: 181.9 | AL44: 293 | AM44: 99.2 | AN44: 319 | AO44: -0.128 | AP44: 6 | AQ44: 富瀚转债!
A45: 44 | B45: 123121 | C45: 帝尔转债! | D45: 300776 | E45: 帝尔激光 | F45: 机械装备 | G45: 专用设备 | H45: 153.391 | I45: -2.1700000000000001e-002 | J45: 7.000000000000001e-004 | K45: 237 | L45: -2.7999999999999997e-002 | M45: 121 | N45: 192.24 | O45: 0.24399999999999999 | P45: 123.28 | Q45: 20天 | R45: 5.53年 | S45: 3.53年 | T45: 8.4 | U45: 137 | V45: 0.105 | W45: 3.3000000000000002e-002 | X45: 4.0999999999999995e-002 | Y45: 252 | Z45: 12.45 | AA45: -4.2699999999999995e-002 | AB45: -4.8799999999999996e-002 | AC45: -0.10099999999999999 | AD45: -0.10199999999999999 | AE45: 83.78 | AF45: 87.97 | AG45: 0.75 | AH45: AA- | AI45: 6.0599999999999994e-002 | AJ45: =H45+100*O45 -> 177.791 | AK45: 183.5 | AL45: 298 | AM45: 95.5 | AN45: 308 | AO45: 2.1000000000000001e-002 | AP45: 5 | AQ45: 帝尔转债!
A46: 45 | B46: 123120 | C46: 隆华转债 | D46: 300263 | E46: 隆华科技 | F46: 机械装备 | G46: 通用设备 | H46: 158.272 | I46: -8.3000000000000001e-003 | J46: -1.8600000000000002e-002 | K46: 9.22 | L46: -3.6600000000000001e-002 | M46: 121.1 | N46: 7.76 | O46: 0.33200000000000002 | P46: 118.81 | Q46: 14天 | R46: 5.52年 | S46: 3.52年 | T46: 7.99 | U46: 12 | V46: 1.e-002 | W46: 9.5000000000000001e-002 | X46: 0.113 | Y46: 84 | Z46: 2.92 | AA46: -4.82e-002 | AB46: -5.4299999999999994e-002 | AC46: -0.105 | AD46: -0.107 | AE46: 84.02 | AF46: 88.15 | AG46: 0.74 | AH46: AA- | AI46: 6.0599999999999994e-002 | AJ46: =H46+100*O46 -> 191.47199999999998 | AK46: 197.7 | AL46: 331 | AM46: 109.6 | AN46: 335 | AO46: -6.6000000000000003e-002 | AP46: 3 | AQ46: 隆华转债
A47: 46 | B47: 110081 | C47: 闻泰转债 | D47: 600745 | E47: 闻泰科技 | F47: 电子 | G47: 电子行业 | H47: 150.9 | I47: 2.0000000000000001e-004 | J47: -1.6e-002 | K47: 114.92 | L47: -2.1700000000000001e-002 | M47: 111.9 | N47: 96.69 | O47: 0.27000000000000002 | P47: 118.85 | Q47: 12天 | R47: 5.51年 | S47: 3.51年 | T47: 86 | U47: 164 | V47: 1.3000000000000001e-002 | W47: 5.9999999999999998e-002 | X47: 7.0999999999999994e-002 | Y47: 1432. | Z47: 4.56 | AA47: -5.3399999999999996e-002 | AB47: -5.7000000000000002e-002 | AC47: -0.10000000000000001 | AD47: -0.10099999999999999 | AE47: 90.39 | AF47: 92.97 | AG47: 0.73 | AH47: AA+ | AI47: 3.4599999999999999e-002 | AJ47: =H47+100*O47 -> 177.90000000000001 | AK47: 182.9 | AL47: 296 | AM47: 90 | AN47: 297 | AO47: -8.5000000000000006e-002 | AP47: 10 | AQ47: 闻泰转债
A48: 47 | B48: 118001 | C48: 金博转债 | D48: 688598 | E48: 金博股份 | F48: 能源电力 | G48: 太阳能 | H48: 142.13 | I48: -1.2999999999999999e-003 | J48: 3.9399999999999998e-002 | K48: 275.7 | L48: 5.6299999999999996e-002 | M48: 121.6 | N48: 271.12 | O48: 0.39799999999999996 | P48: 101.69 | Q48: 7天 | R48: 5.50年 | S48: 3.50年 | T48: 6 | U48: 165 | V48: 0.19 | W48: 2.7000000000000003e-002 | X48: 2.7999999999999997e-002 | Y48: 221 | Z48: 13.43 | AA48: -2.86e-002 | AB48: -3.49e-002 | AC48: -8.1099999999999992e-002 | AD48: -8.3100000000000007e-002 | AE48: 81.45 | AF48: 83.92 | AG48: 0.68 | AH48: A+ | AI48: 7.1599999999999997e-002 | AJ48: =H48+100*O48 -> 181.93000000000001 | AK48: 182.6 | AL48: 295 | AM48: 98.7 | AN48: 317 | AO48: -0.11199999999999999 | AP48: 4 | AQ48: 金博转债
A49: 48 | B49: 113627 | C49: 太平转债! | D49: 603877 | E49: 太平鸟 | F49: 服装纺织 | G49: 服装行业 | H49: 122.24 | I49: -3.4999999999999996e-003 | J49: 3.9000000000000003e-003 | K49: 25.82 | L49: 4.6999999999999993e-003 | M49: 115.1 | N49: 50.32 | O49: 1.3799999999999999 | P49: 51.31 | Q49: 已到 | R49: 5.48年 | S49: 3.48年 | T49: 8 | U49: 2.1 | V49: 2.e-003 | W49: 6.5000000000000002e-002 | X49: 3.3000000000000002e-002 | Y49: 123 | Z49: 3.02 | AA49: -1.11e-002 | AB49: -1.5900000000000001e-002 | AC49: -4.4699999999999997e-002 | AD49: -4.6500000000000007e-002 | AE49: 90.05 | AF49: 93.42 | AG49: 0.08 | AH49: AA | AI49: 3.9599999999999996e-002 | AJ49: =H49+100*O49 -> 260.24000000000001 | AK49: 193.2 | AL49: 320 | AM49: 99.7 | AN49: 320 | AO49: -7.8e-002 | AP49: 3 | AQ49: 太平转债!
A50: 49 | B50: 123119 | C50: 康泰转2! | D50: 300601 | E50: 康泰生物 | F50: 医药 | G50: 生物制药 | H50: 125.5 | I50: -1.1699999999999999e-002 | J50: 1.2999999999999999e-003 | K50: 84.79 | L50: -3.0200000000000001e-002 | M50: 117.1 | N50: 108.5 | O50: 0.60599999999999998 | P50: 78.15 | Q50: 已到 | R50: 5.48年 | S50: 3.48年 | T50: 20 | U50: 35 | V50: 1.3999999999999999e-002 | W50: 3.4000000000000002e-002 | X50: 2.7000000000000003e-002 | Y50: 583 | Z50: 6.84 | AA50: -1.2800000000000001e-002 | AB50: -1.8200000000000001e-002 | AC50: -5.1699999999999996e-002 | AD50: -5.3399999999999996e-002 | AE50: 90.05 | AF50: 95.04 | AG50: 0.35 | AH50: AA | AI50: 3.9599999999999996e-002 | AJ50: =H50+100*O50 -> 186.09999999999999 | AK50: 172.9 | AL50: 260 | AM50: 77.8 | AN50: 252 | AO50: -0.10400000000000001 | AP50: 10 | AQ50: 康泰转2!
A51: 50 | B51: 127041 | C51: 弘亚转债! | D51: 2833 | E51: 弘亚数控 | F51: 机械装备 | G51: 专用设备 | H51: 120.5 | I51: 3.2000000000000002e-003 | J51: -8.3000000000000001e-003 | K51: 29.1 | L51: -1.46e-002 | M51: 118.75 | N51: 38.09 | O51: 0.57700000000000007 | P51: 76.4 | Q51: 已到 | R51: 4.47年 | S51: 2.47年 | T51: 6 | U51: 3.7 | V51: 5.0000000000000001e-003 | W51: 6.8000000000000005e-002 | X51: 5.2000000000000005e-002 | Y51: 88 | Z51: 4.42 | AA51: -3.3e-003 | AB51: -1.0500000000000001e-002 | AC51: -5.9900000000000002e-002 | AD51: -6.1600000000000002e-002 | AE51: 88.38 | AF51: 92.55 | AG51: 0.35 | AH51: AA- | AI51: 5.8299999999999998e-002 | AJ51: =H51+100*O51 -> 178.20000000000002 | AK51: 164.6 | AL51: 206 | AM51: 72 | AN51: 226 | AO51: -7.6999999999999999e-002 | AP51: 5 | AQ51: 弘亚转债!
A52: 51 | B52: 123118 | C52: 惠城转债 | D52: 300779 | E52: 惠城环保 | F52: 化工 | G52: 其他 | H52: 123.6 | I52: -7.3000000000000001e-003 | J52: 9.5999999999999992e-003 | K52: 16.81 | L52: 3.5999999999999999e-003 | M52: 121.7 | N52: 17.11 | O52: 0.25800000000000001 | P52: 98.25 | Q52: 已到 | R52: 5.45年 | S52: 3.45年 | T52: 3.2 | U52: 3.1 | V52: 8.0000000000000002e-003 | W52: 0.19 | X52: 0.187 | Y52: 17 | Z52: 2.52 | AA52: -2.8999999999999998e-003 | AB52: -9.5999999999999992e-003 | AC52: -4.5499999999999999e-002 | AD52: -4.7699999999999992e-002 | AE52: 81.71 | AF52: 84.25 | AG52: 0.65 | AH52: A+ | AI52: 7.1599999999999997e-002 | AJ52: =H52+100*O52 -> 149.40000000000001 | AK52: 149 | AL52: 64 | AM52: 64.7 | AN52: 160 | AO52: -2.8999999999999998e-002 | AP52: 10 | AQ52: 惠城转债
A53: 52 | B53: 127040 | C53: 国泰转债 | D53: 2091 | E53: 江苏国泰 | F53: 商业零售 | G53: 商业零售 | H53: 145.138 | I53: 1.9e-003 | J53: -9.8999999999999991e-003 | K53: 11.89 | L53: -1.e-002 | M53: 112.5 | N53: 9.02 | O53: 0.10099999999999999 | P53: 131.82 | Q53: 已到 | R53: 5.45年 | S53: 3.45年 | T53: 44.8 | U53: 86 | V53: 1.3000000000000001e-002 | W53: 0.24100000000000002 | X53: 0.318 | Y53: 186 | Z53: 1.94 | AA53: -4.6300000000000001e-002 | AB53: -5.0099999999999999e-002 | AC53: -9.0800000000000006e-002 | AD53: -9.2200000000000004e-002 | AE53: 91.13 | AF53: 93.72 | AG53: 0.8 | AH53: AA+ | AI53: 3.4599999999999999e-002 | AJ53: =H53+100*O53 -> 155.238 | AK53: 158.5 | AL53: 150 | AM53: 64.7 | AN53: 161 | AO53: -0.113 | AP53: 11 | AQ53: 国泰转债
A54: 53 | B54: 127039 | C54: 北港转债 | D54: 582 | E54: 北部湾港 | F54: 机场高速 | G54: 港口 | H54: 123.65 | I54: -9.1999999999999998e-003 | J54: -3.0999999999999999e-003 | K54: 7.74 | L54: -2.52e-002 | M54: 113 | N54: 8.35 | O54: 0.33399999999999996 | P54: 92.69 | Q54: 已到 | R54: 5.43年 | S54: 3.43年 | T54: 30 | U54: 4.2 | V54: 1.e-003 | W54: 0.23699999999999999 | X54: 0.22 | Y54: 126 | Z54: 1.18 | AA54: -1.67e-002 | AB54: -2.0899999999999998e-002 | AC54: -4.8499999999999995e-002 | AD54: -5.0300000000000004e-002 | AE54: 92.3 | AF54: 95.23 | AG54: 0.49 | AH54: AAA | AI54: 3.2599999999999997e-002 | AJ54: =H54+100*O54 -> 157.05000000000001 | AK54: 154.6 | AL54: 118 | AM54: 59.4 | AN54: 119 | AO54: -4.4000000000000004e-002 | AP54: 6 | AQ54: 北港转债
A55: 54 | B55: 113626 | C55: 伯特转债! | D55: 603596 | E55: 伯特利 | F55: 汽车 | G55: 零部件制 | H55: 216.78 | I55: -4.9200000000000001e-002 | J55: -2.8799999999999999e-002 | K55: 74.26 | L55: -8.2100000000000006e-002 | M55: 121.1 | N55: 36.01 | O55: 5.0999999999999997e-002 | P55: 206.22 | Q55: 已到 | R55: 5.43年 | S55: 3.43年 | T55: 9.02 | U55: 359 | V55: 0.183 | W55: 2.9999999999999999e-002 | X55: 6.0999999999999999e-002 | Y55: 303 | Z55: 9.59 | AA55: -0.10300000000000001 | AB55: -0.109 | AC55: -0.10199999999999999 | AD55: -0.10300000000000001 | AE55: 90.2 | AF55: 98.44 | AG55: 0.95 | AH55: AA | AI55: 3.9599999999999996e-002 | AJ55: =H55+100*O55 -> 221.88 | AK55: 227.3 | AL55: 347 | AM55: 128.9 | AN55: 347 | AO55: 1.8000000000000002e-002 | AP55: 4 | AQ55: 伯特转债!
A56: 55 | B56: 123117 | C56: 健帆转债! | D56: 300529 | E56: 健帆生物 | F56: 医药 | G56: 医疗器械 | H56: 116.9 | I56: -5.5000000000000005e-003 | J56: -1.e-004 | K56: 49.66 | L56: -5.4100000000000002e-002 | M56: 115.1 | N56: 90.57 | O56: 1.1299999999999999 | P56: 54.83 | Q56: 已到 | R56: 5.42年 | S56: 3.42年 | T56: 10 | U56: 15 | V56: 1.3000000000000001e-002 | W56: 2.5000000000000001e-002 | X56: 1.3999999999999999e-002 | Y56: 400 | Z56: 13.11 | AA56: -2.8999999999999998e-003 | AB56: -7.9000000000000008e-003 | AC56: -3.3399999999999999e-002 | AD56: -3.5200000000000002e-002 | AE56: 90.26 | AF56: 93.64 | AG56: 0.1 | AH56: AA | AI56: 3.9599999999999996e-002 | AJ56: =H56+100*O56 -> 229.89999999999998 | AK56: 179 | AL56: 284 | AM56: 85.3 | AN56: 282 | AO56: -7.2999999999999995e-002 | AP56: 8 | AQ56: 健帆转债!
A57: 56 | B57: 113051 | C57: 节能转债! | D57: 601016 | E57: 节能风电 | F57: 能源电力 | G57: 风能 | H57: 157 | I57: 7.4999999999999997e-003 | J57: -9.0000000000000011e-003 | K57: 5.45 | L57: -1.8e-003 | M57: 114.5 | N57: 4.05 | O57: 0.16699999999999998 | P57: 134.57 | Q57: 已到 | R57: 5.41年 | S57: 3.41年 | T57: 30 | U57: 208 | V57: 4.4000000000000004e-002 | W57: 0.11 | X57: 0.14800000000000002 | Y57: 273 | Z57: 2.65 | AA57: -5.74e-002 | AB57: -6.1799999999999994e-002 | AC57: -0.109 | AD57: -0.11 | AE57: 91.27 | AF57: 95.52 | AG57: 0.8 | AH57: AA+ | AI57: 3.4599999999999999e-002 | AJ57: =H57+100*O57 -> 173.69999999999999 | AK57: 179.4 | AL57: 287 | AM57: 83.9 | AN57: 277 | AO57: -0.10199999999999999 | AP57: 9 | AQ57: 节能转债!
A58: 57 | B58: 113050 | C58: 南银转债 | D58: 601009 | E58: 南京银行 | F58: 金融 | G58: 银行行业 | H58: 122.08 | I58: -8.9999999999999998e-004 | J58: -2.5000000000000001e-003 | K58: 10.02 | L58: -6.0000000000000001e-003 | M58: 111.2 | N58: 10.1 | O58: 0.23100000000000001 | P58: 99.21 | Q58: 已到 | R58: 5.39年 | S58: 无权 | T58: 200 | U58: 99 | V58: 4.0000000000000001e-003 | W58: 0.19899999999999998 | X58: 0.19800000000000001 | Y58: 1003. | Z58: 0.95 | AA58: -1.7399999999999999e-002 | AB58: -2.1099999999999997e-002 | AC58: 无权 | AD58: 无权 | AE58: 无权 | AF58: 93.78 | AG58: 0.57 | AH58: AAA | AI58: 3.2599999999999997e-002 | AJ58: =H58+100*O58 -> 145.18000000000001 | AK58: 145 | AL58: 33 | AM58: 51.2 | AN58: 61 | AO58: 7.4999999999999997e-002 | AP58: 7 | AQ58: 南银转债
A59: 58 | B59: 113625 | C59: 江山转债! | D59: 603208 | E59: 江山欧派 | F59: 其他 | G59: 家居用品 | H59: 124.9 | I59: -2.1499999999999998e-002 | J59: 4.0999999999999995e-003 | K59: 84.47 | L59: -3.4200000000000001e-002 | M59: 124 | N59: 96.33 | O59: 0.42399999999999999 | P59: 87.69 | Q59: 已到 | R59: 5.38年 | S59: 3.38年 | T59: 5.83 | U59: 40 | V59: 5.4000000000000006e-002 | W59: 6.6000000000000003e-002 | X59: 5.7999999999999996e-002 | Y59: 89 | Z59: 4.83 | AA59: -1.4000000000000002e-003 | AB59: -8.8000000000000005e-003 | AC59: -5.0900000000000001e-002 | AD59: -5.2900000000000003e-002 | AE59: 84.52 | AF59: 90.94 | AG59: 0.51 | AH59: AA- | AI59: 6.0599999999999994e-002 | AJ59: =H59+100*O59 -> 167.30000000000001 | AK59: 162.1 | AL59: 185 | AM59: 71.2 | AN59: 221 | AO59: 0.22600000000000001 | AP59: 7 | AQ59: 江山转债!
A60: 59 | B60: 127038 | C60: 国微转债! | D60: 2049 | E60: 紫光国微 | F60: 电子 | G60: 芯片制造 | H60: 194.2 | I60: -3.4000000000000002e-003 | J60: -1.8799999999999997e-002 | K60: 216.89 | L60: -2.5000000000000001e-002 | M60: 114.5 | N60: 137.78 | O60: 0.23399999999999999 | P60: 157.42 | Q60: 已到 | R60: 5.38年 | S60: 3.38年 | T60: 14.9 | U60: 69 | V60: 2.4e-002 | W60: 1.1000000000000001e-002 | X60: 1.8000000000000002e-002 | Y60: 1316. | Z60: 20.03 | AA60: -9.4700000000000006e-002 | AB60: -9.8800000000000013e-002 | AC60: -0.158 | AD60: -0.159 | AE60: 91.36 | AF60: 95.62 | AG60: 0.89 | AH60: AA+ | AI60: 3.4599999999999999e-002 | AJ60: =H60+100*O60 -> 217.59999999999999 | AK60: 231 | AL60: 351 | AM60: 135.4 | AN60: 352 | AO60: 9.0000000000000011e-003 | AP60: 5 | AQ60: 国微转债!
A61: 60 | B61: 113049 | C61: 长汽转债 | D61: 601633 | E61: 长城汽车 | F61: 汽车 | G61: 乘用车 | H61: 144.39 | I61: -1.55e-002 | J61: 8.6e-003 | K61: 44 | L61: -9.8999999999999991e-003 | M61: 110.5 | N61: 38.01 | O61: 0.247 | P61: 115.76 | Q61: 已到 | R61: 5.38年 | S61: 3.38年 | T61: 35 | U61: 222 | V61: 4.4000000000000004e-002 | W61: 9.0000000000000011e-003 | X61: 1.e-002 | Y61: 4064. | Z61: 6.93 | AA61: -4.9100000000000005e-002 | AB61: -5.2400000000000002e-002 | AC61: -9.3100000000000002e-002 | AD61: -9.4200000000000006e-002 | AE61: 91.32 | AF61: 93.19 | AG61: 0.7 | AH61: AAA | AI61: 3.2599999999999997e-002 | AJ61: =H61+100*O61 -> 169.08999999999997 | AK61: 173 | AL61: 263 | AM61: 79.8 | AN61: 265 | AO61: -6.2e-002 | AP61: 5 | AQ61: 长汽转债
A62: 61 | B62: 123116 | C62: 万兴转债 | D62: 300624 | E62: 万兴科技 | F62: 计算机及 | G62: 软件开发 | H62: 133.48 | I62: -1.8500000000000003e-002 | J62: -6.6e-003 | K62: 48.47 | L62: -3.8699999999999998e-002 | M62: 121.4 | N62: 49.78 | O62: 0.371 | P62: 97.37 | Q62: 已到 | R62: 5.38年 | S62: 3.38年 | T62: 3.78 | U62: 50 | V62: 9.6999999999999989e-002 | W62: 5.9999999999999998e-002 | X62: 5.7999999999999996e-002 | Y62: 63 | Z62: 7.57 | AA62: -1.7899999999999999e-002 | AB62: -2.4399999999999998e-002 | AC62: -6.7799999999999999e-002 | AD62: -6.9900000000000004e-002 | AE62: 81.88 | AF62: 84.43 | AG62: 0.65 | AH62: A+ | AI62: 7.1599999999999997e-002 | AJ62: =H62+100*O62 -> 170.57999999999998 | AK62: 169.6 | AL62: 243 | AM62: 85.2 | AN62: 281 | AO62: -0.10000000000000001 | AP62: 8 | AQ62: 万兴转债
A63: 62 | B63: 123115 | C63: 捷捷转债 | D63: 300623 | E63: 捷捷微电 | F63: 电子 | G63: 元器件制 | H63: 136.81 | I63: -1.7899999999999999e-002 | J63: 2.0999999999999999e-003 | K63: 28.29 | L63: -2.5499999999999998e-002 | M63: 118.5 | N63: 29 | O63: 0.40200000000000002 | P63: 97.55 | Q63: 已到 | R63: 5.38年 | S63: 3.38年 | T63: 11.9 | U63: 14 | V63: 9.0000000000000011e-003 | W63: 5.7000000000000002e-002 | X63: 5.5999999999999994e-002 | Y63: 208 | Z63: 7.33 | AA63: -2.69e-002 | AB63: -3.2599999999999997e-002 | AC63: -7.5600000000000001e-002 | AD63: -7.7399999999999997e-002 | AE63: 84.49 | AF63: 86.95 | AG63: 0.62 | AH63: AA- | AI63: 6.0599999999999994e-002 | AJ63: =H63+100*O63 -> 177.00999999999999 | AK63: 176.1 | AL63: 276 | AM63: 89.1 | AN63: 291 | AO63: -6.2e-002 | AP63: 8 | AQ63: 捷捷转债
A64: 63 | B64: 127037 | C64: 银轮转债 | D64: 2126 | E64: 银轮股份 | F64: 汽车 | G64: 零部件制 | H64: 147.5 | I64: -1.e-002 | J64: 6.0999999999999995e-003 | K64: 12.05 | L64: -5.7999999999999996e-003 | M64: 115.1 | N64: 10.77 | O64: 0.318 | P64: 111.88 | Q64: 已到 | R64: 5.37年 | S64: 3.37年 | T64: 7 | U64: 33 | V64: 3.2000000000000001e-002 | W64: 7.2999999999999995e-002 | X64: 8.199999999999999e-002 | Y64: 95 | Z64: 2.26 | AA64: -4.5899999999999996e-002 | AB64: -5.0499999999999996e-002 | AC64: -9.5700000000000007e-002 | AD64: -9.7299999999999998e-002 | AE64: 90.41 | AF64: 93.8 | AG64: 0.67 | AH64: AA | AI64: 3.9599999999999996e-002 | AJ64: =H64+100*O64 -> 179.30000000000001 | AK64: 183.1 | AL64: 297 | AM64: 89.3 | AN64: 294 | AO64: -3.7000000000000005e-002 | AP64: 3 | AQ64: 银轮转债
A65: 64 | B65: 127036 | C65: 三花转债 | D65: 2050 | E65: 三花智控 | F65: 机械装备 | G65: 通用设备 | H65: 135.388 | I65: -1.61e-002 | J65: 3.0999999999999999e-003 | K65: 22.64 | L65: -2.1600000000000001e-002 | M65: 114.5 | N65: 21.55 | O65: 0.28899999999999998 | P65: 105.06 | Q65: 已到 | R65: 5.36年 | S65: 3.36年 | T65: 30 | U65: 40 | V65: 1.e-002 | W65: 3.7000000000000005e-002 | X65: 3.9e-002 | Y65: 813 | Z65: 7.87 | AA65: -3.1200000000000002e-002 | AB65: -3.5799999999999998e-002 | AC65: -7.51e-002 | AD65: -7.6499999999999999e-002 | AE65: 91.44 | AF65: 95.7 | AG65: 0.6 | AH65: AA+ | AI65: 3.4599999999999999e-002 | AJ65: =H65+100*O65 -> 164.28800000000001 | AK65: 165.7 | AL65: 212 | AM65: 70 | AN65: 206 | AO65: -7.400000000000001e-002 | AP65: 7 | AQ65: 三花转债
A66: 65 | B66: 127035 | C66: 濮耐转债 | D66: 2225 | E66: 濮耐股份 | F66: 钢铁 | G66: 钢铁行业 | H66: 126 | I66: -5.3e-003 | J66: 5.9999999999999995e-004 | K66: 4.32 | L66: -9.1999999999999998e-003 | M66: 114.7 | N66: 4.43 | O66: 0.29199999999999998 | P66: 97.52 | Q66: 已到 | R66: 4.34年 | S66: 2.34年 | T66: 6.26 | U66: 3.5 | V66: 4.0000000000000001e-003 | W66: 0.14300000000000002 | X66: 0.14000000000000001 | Y66: 44 | Z66: 1.43 | AA66: -2.1899999999999999e-002 | AB66: -2.7699999999999999e-002 | AC66: -7.6399999999999996e-002 | AD66: -7.8700000000000006e-002 | AE66: 94.41 | AF66: 98.2 | AG66: 0.51 | AH66: AA | AI66: 3.73e-002 | AJ66: =H66+100*O66 -> 155.19999999999999 | AK66: 154.5 | AL66: 117 | AM66: 56.3 | AN66: 99 | AO66: -3.7000000000000005e-002 | AP66: 9 | AQ66: 濮耐转债
A67: 66 | B67: 123114 | C67: 三角转债! | D67: 300775 | E67: 三角防务 | F67: 航空航天 | G67: 航空航天 | H67: 169 | I67: 1.44e-002 | J67: -4.0000000000000001e-003 | K67: 43.4 | L67: 1.2800000000000001e-002 | M67: 121 | N67: 31.82 | O67: 0.23899999999999999 | P67: 136.39 | Q67: 已到 | R67: 5.34年 | S67: 3.34年 | T67: 9.04 | U67: 64 | V67: 4.2000000000000003e-002 | W67: 4.2000000000000003e-002 | X67: 5.7000000000000002e-002 | Y67: 215 | Z67: 9.95 | AA67: -6.1799999999999994e-002 | AB67: -6.7900000000000002e-002 | AC67: -0.127 | AD67: -0.128 | AE67: 84.75 | AF67: 89 | AG67: 0.81 | AH67: AA- | AI67: 6.0599999999999994e-002 | AJ67: =H67+100*O67 -> 192.90000000000001 | AK67: 201.6 | AL67: 337 | AM67: 112.6 | AN67: 341 | AO67: -4.0999999999999995e-002 | AP67: 7 | AQ67: 三角转债!
A68: 67 | B68: 111000 | C68: 起帆转债 | D68: 605222 | E68: 起帆电缆 | F68: 能源电力 | G68: 电力设备 | H68: 138.03 | I68: -5.5000000000000005e-003 | J68: -1.1999999999999999e-003 | K68: 24.14 | L68: -9.0000000000000011e-003 | M68: 120.5 | N68: 20.1 | O68: 0.14899999999999999 | P68: 120.1 | Q68: 已到 | R68: 5.33年 | S68: 3.33年 | T68: 10 | U68: 15 | V68: 1.1000000000000001e-002 | W68: 9.9000000000000005e-002 | X68: 0.11900000000000001 | Y68: 101 | Z68: 2.91 | AA68: -2.5600000000000001e-002 | AB68: -3.1899999999999998e-002 | AC68: -7.8799999999999995e-002 | AD68: -8.0600000000000005e-002 | AE68: 84.7 | AF68: 88.62 | AG68: 0.74 | AH68: AA- | AI68: 6.0599999999999994e-002 | AJ68: =H68+100*O68 -> 152.93000000000001 | AK68: 156 | AL68: 125 | AM68: 67.3 | AN68: 183 | AO68: -4.4000000000000004e-002 | AP68: 9 | AQ68: 起帆转债
A69: 68 | B69: 127034 | C69: 绿茵转债! | D69: 2887 | E69: 绿茵生态 | F69: 城市公用 | G69: 生态环境 | H69: 108.987 | I69: -4.1999999999999997e-003 | J69: 1.9e-003 | K69: 9.64 | L69: -5.1999999999999998e-003 | M69: 119 | N69: 12.38 | O69: 0.40000000000000002 | P69: 77.87 | Q69: 已到 | R69: 5.27年 | S69: 3.27年 | T69: 7.12 | U69: 5.1 | V69: 6.9999999999999993e-003 | W69: 0.23699999999999999 | X69: 0.184 | Y69: 30 | Z69: 1.47 | AA69: 1.72e-002 | AB69: 1.0800000000000001e-002 | AC69: -1.3899999999999999e-002 | AD69: -1.61e-002 | AE69: 85.1 | AF69: 87.89 | AG69: 0.44 | AH69: AA- | AI69: 6.0599999999999994e-002 | AJ69: =H69+100*O69 -> 148.98699999999999 | AK69: 140.1 | AL69: 14 | AM69: 52.2 | AN69: 71 | AO69: -2.2000000000000002e-002 | AP69: 42 | AQ69: 绿茵转债!
A70: 69 | B70: 113624 | C70: 正川转债! | D70: 603976 | E70: 正川股份 | F70: 医药 | G70: 医药行业 | H70: 113.99 | I70: -7.7000000000000002e-003 | J70: -6.4000000000000003e-003 | K70: 31.1 | L70: -4.0099999999999997e-002 | M70: 121.6 | N70: 46.69 | O70: 0.71099999999999997 | P70: 66.61 | Q70: 已到 | R70: 5.26年 | S70: 3.26年 | T70: 4.05 | U70: 8.7 | V70: 1.9e-002 | W70: 8.5999999999999993e-002 | X70: 5.7000000000000002e-002 | Y70: 47 | Z70: 4.26 | AA70: 1.2699999999999999e-002 | AB70: 5.5000000000000005e-003 | AC70: -2.5000000000000001e-002 | AD70: -2.75e-002 | AE70: 82.79 | AF70: 85.3 | AG70: 0.35 | AH70: A+ | AI70: 7.1599999999999997e-002 | AJ70: =H70+100*O70 -> 185.08999999999997 | AK70: 161.4 | AL70: 176 | AM70: 76.1 | AN70: 245 | AO70: -8.8000000000000009e-002 | AP70: 23 | AQ70: 正川转债!
A71: 70 | B71: 113048 | C71: 晶科转债!! | D71: 601778 | E71: 晶科科技 | F71: 能源电力 | G71: 太阳能 | H71: 158.68 | I71: 9.1000000000000004e-003 | J71: -6.8999999999999999e-003 | K71: 7.12 | L71: 2.8000000000000004e-003 | M71: 117.1 | N71: 5.46 | O71: 0.217 | P71: 130.4 | Q71: 已到 | R71: 5.25年 | S71: 3.25年 | T71: 23 | U71: 136 | V71: 3.7000000000000005e-002 | W71: 0.111 | X71: 0.14499999999999999 | Y71: 206 | Z71: 1.74 | AA71: -5.7200000000000001e-002 | AB71: -6.2400000000000004e-002 | AC71: -0.115 | AD71: -0.11699999999999999 | AE71: 90.85 | AF71: 95.88 | AG71: 0.78 | AH71: AA | AI71: 3.9599999999999996e-002 | AJ71: =H71+100*O71 -> 180.38 | AK71: 187 | AL71: 308 | AM71: 91.1 | AN71: 301 | AO71: -0.109 | AP71: 14 | AQ71: 晶科转债!!
A72: 71 | B72: 123113 | C72: 仙乐转债! | D72: 300791 | E72: 仙乐健康 | F72: 食品饮料 | G72: 食品饮料 | H72: 116.808 | I72: -1.6799999999999999e-002 | J72: -1.41e-002 | K72: 39.75 | L72: -8.9800000000000005e-002 | M72: 118.5 | N72: 56.88 | O72: 0.67099999999999993 | P72: 69.88 | Q72: 已到 | R72: 5.24年 | S72: 3.24年 | T72: 10.2 | U72: 30 | V72: 2.5000000000000001e-002 | W72: 0.14300000000000002 | X72: 0.10000000000000001 | Y72: 72 | Z72: 3.09 | AA72: 2.8000000000000004e-003 | AB72: -3.4000000000000002e-003 | AC72: -3.4300000000000004e-002 | AD72: -3.6400000000000002e-002 | AE72: 85.18 | AF72: 87.66 | AG72: 0.34 | AH72: AA- | AI72: 6.0599999999999994e-002 | AJ72: =H72+100*O72 -> 183.90800000000002 | AK72: 163.7 | AL72: 198 | AM72: 76.1 | AN72: 246 | AO72: -8.4000000000000005e-002 | AP72: 6 | AQ72: 仙乐转债!
A73: 72 | B73: 127033 | C73: 中装转2! | D73: 2822 | E73: 中装建设 | F73: 建筑 | G73: 装饰工程 | H73: 123.2 | I73: -1.83e-002 | J73: 6.8999999999999999e-003 | K73: 5.83 | L73: -2.35e-002 | M73: 117.1 | N73: 6.28 | O73: 0.32700000000000001 | P73: 92.83 | Q73: 已到 | R73: 5.23年 | S73: 3.23年 | T73: 11.6 | U73: 39 | V73: 2.7000000000000003e-002 | W73: 0.27600000000000002 | X73: 0.25600000000000001 | Y73: 42 | Z73: 1.2 | AA73: -9.7999999999999997e-003 | AB73: -1.55e-002 | AC73: -5.0099999999999999e-002 | AD73: -5.2000000000000005e-002 | AE73: 90.91 | AF73: 95.95 | AG73: 0.49 | AH73: AA | AI73: 3.9599999999999996e-002 | AJ73: =H73+100*O73 -> 155.90000000000001 | AK73: 153.6 | AL73: 110 | AM73: 57.6 | AN73: 107 | AO73: -3.7000000000000005e-002 | AP73: 27 | AQ73: 中装转2!
A74: 73 | B74: 110080 | C74: 东湖转债 | D74: 600133 | E74: 东湖高新 | F74: 建筑 | G74: 建筑工程 | H74: 114.75 | I74: -2.7000000000000001e-003 | J74: 1.e-003 | K74: 5.35 | L74: -3.7000000000000002e-003 | M74: 115.1 | N74: 6.05 | O74: 0.29799999999999999 | P74: 88.43 | Q74: 已到 | R74: 5.22年 | S74: 3.22年 | T74: 15.5 | U74: 9.2 | V74: 5.0000000000000001e-003 | W74: 0.36399999999999999 | X74: 0.32200000000000001 | Y74: 43 | Z74: 0.76 | AA74: 5.9999999999999995e-004 | AB74: -4.5999999999999999e-003 | AC74: -2.9999999999999999e-002 | AD74: -3.1899999999999998e-002 | AE74: 90.95 | AF74: 94.36 | AG74: 0.46 | AH74: AA | AI74: 3.9599999999999996e-002 | AJ74: =H74+100*O74 -> 144.55000000000001 | AK74: 141.1 | AL74: 17 | AM74: 46.7 | AN74: 41 | AO74: -1.7000000000000001e-002 | AP74: 32 | AQ74: 东湖转债
A75: 74 | B75: 127032 | C75: 苏行转债 | D75: 2966 | E75: 苏州银行 | F75: 金融 | G75: 银行行业 | H75: 117.214 | I75: -8.3000000000000001e-003 | J75: 7.8000000000000005e-003 | K75: 7.03 | L75: -1.4000000000000002e-003 | M75: 115.1 | N75: 8.1 | O75: 0.35100000000000003 | P75: 86.79 | Q75: 已到 | R75: 5.22年 | S75: 无权 | T75: 50 | U75: 77 | V75: 1.3000000000000001e-002 | W75: 0.21299999999999999 | X75: 0.185 | Y75: 234 | Z75: 0.74 | AA75: -3.4999999999999996e-003 | AB75: -8.6999999999999994e-003 | AC75: 无权 | AD75: 无权 | AE75: 无权 | AF75: 97.66 | AG75: 0.4 | AH75: AAA | AI75: 3.2599999999999997e-002 | AJ75: =H75+100*O75 -> 152.31399999999999 | AK75: 147.6 | AL75: 55 | AM75: 50 | AN75: 56 | AO75: 2.6000000000000002e-002 | AP75: 10 | AQ75: 苏行转债
A76: 75 | B76: 113047 | C76: 旗滨转债! | D76: 601636 | E76: 旗滨集团 | F76: 建筑 | G76: 玻璃 | H76: 173.01 | I76: 2.12e-002 | J76: -1.29e-002 | K76: 17.75 | L76: 1.0200000000000001e-002 | M76: 114 | N76: 12.8 | O76: 0.248 | P76: 138.67 | Q76: 已到 | R76: 5.21年 | S76: 3.21年 | T76: 15 | U76: 241 | V76: 9.3000000000000013e-002 | W76: 3.1e-002 | X76: 4.4000000000000004e-002 | Y76: 477 | Z76: 3.88 | AA76: -7.7899999999999997e-002 | AB76: -8.2100000000000006e-002 | AC76: -0.14000000000000001 | AD76: -0.14099999999999999 | AE76: 91.44 | AF76: 95.73 | AG76: 0.81 | AH76: AA+ | AI76: 3.4599999999999999e-002 | AJ76: =H76+100*O76 -> 197.81 | AK76: 207.3 | AL76: 339 | AM76: 111.6 | AN76: 340 | AO76: 4.2999999999999997e-002 | AP76: 7 | AQ76: 旗滨转债!
A77: 76 | B77: 123112 | C77: 万讯转债! | D77: 300112 | E77: 万讯自控 | F77: 机械装备 | G77: 专用设备 | H77: 143.8 | I77: -1.8000000000000002e-002 | J77: 2.3199999999999998e-002 | K77: 11.37 | L77: 7.0999999999999995e-003 | M77: 124.4 | N77: 8.93 | O77: 0.129 | P77: 127.32 | Q77: 已到 | R77: 5.21年 | S77: 3.21年 | T77: 2.45 | U77: 74 | V77: 0.20899999999999999 | W77: 7.5999999999999998e-002 | X77: 9.6000000000000002e-002 | Y77: 32 | Z77: 2.99 | AA77: -2.7999999999999997e-002 | AB77: -3.5499999999999997e-002 | AC77: -9.1600000000000001e-002 | AD77: -9.3699999999999992e-002 | AE77: 85.74 | AF77: 92.22 | AG77: 0.74 | AH77: AA- | AI77: 6.0599999999999994e-002 | AJ77: =H77+100*O77 -> 156.70000000000002 | AK77: 160.3 | AL77: 160 | AM77: 68.1 | AN77: 187 | AO77: -0.14499999999999999 | AP77: 14 | AQ77: 万讯转债!
A78: 77 | B78: 113623 | C78: 凤21转债 | D78: 603225 | E78: 新凤鸣 | F78: 化工 | G78: 化纤 | H78: 126.3 | I78: -2.9100000000000001e-002 | J78: 1.3100000000000001e-002 | K78: 14.8 | L78: -3.5200000000000002e-002 | M78: 117.1 | N78: 16.47 | O78: 0.40600000000000003 | P78: 89.86 | Q78: 已到 | R78: 5.21年 | S78: 3.21年 | T78: 25 | U78: 133 | V78: 4.2000000000000003e-002 | W78: 0.11 | X78: 9.9000000000000005e-002 | Y78: 226 | Z78: 1.43 | AA78: -1.47e-002 | AB78: -2.0299999999999999e-002 | AC78: -5.7500000000000002e-002 | AD78: -5.9299999999999999e-002 | AE78: 90.99 | AF78: 96.04 | AG78: 0.45 | AH78: AA | AI78: 3.9599999999999996e-002 | AJ78: =H78+100*O78 -> 166.90000000000001 | AK78: 162.7 | AL78: 189 | AM78: 66.7 | AN78: 178 | AO78: -9.0000000000000011e-003 | AP78: 4 | AQ78: 凤21转债
A79: 78 | B79: 123111 | C79: 东财转3! | D79: 300059 | E79: 东方财富 | F79: 金融 | G79: 证券行业 | H79: 142.5 | I79: -1.5900000000000001e-002 | J79: 3.4999999999999996e-003 | K79: 33.24 | L79: -1.4499999999999999e-002 | M79: 110.5 | N79: 23.35 | O79: 1.e-003 | P79: 142.36 | Q79: 已到 | R79: 5.21年 | S79: 3.21年 | T79: 150 | U79: 1027. | V79: 4.8000000000000001e-002 | W79: 4.4000000000000004e-002 | X79: 6.2e-002 | Y79: 3446. | Z79: 8.81 | AA79: -4.82e-002 | AB79: -5.16e-002 | AC79: -9.4800000000000009e-002 | AD79: -9.5700000000000007e-002 | AE79: 91 | AF79: 92.77 | AG79: 0.85 | AH79: AA+ | AI79: 3.4599999999999999e-002 | AJ79: =H79+100*O79 -> 142.59999999999999 | AK79: 142.6 | AL79: 23 | AM79: 49.9 | AN79: 53 | AO79: -4.5999999999999999e-002 | AP79: 28 | AQ79: 东财转3!
A80: 79 | B80: 123109 | C80: 昌红转债! | D80: 300151 | E80: 昌红科技 | F80: 机械装备 | G80: 专用设备 | H80: 137.2 | I80: 1.41e-002 | J80: -3.3399999999999999e-002 | K80: 32.54 | L80: -2.75e-002 | M80: 121 | N80: 28.06 | O80: 0.183 | P80: 115.97 | Q80: 已到 | R80: 5.19年 | S80: 3.19年 | T80: 4.6 | U80: 34 | V80: 5.4000000000000006e-002 | W80: 2.7999999999999997e-002 | X80: 3.3000000000000002e-002 | Y80: 164 | Z80: 15.83 | AA80: -2.4399999999999998e-002 | AB80: -3.1e-002 | AC80: -8.0199999999999994e-002 | AD80: -8.2100000000000006e-002 | AE80: 85.49 | AF80: 89.77 | AG80: 0.7 | AH80: AA- | AI80: 6.0599999999999994e-002 | AJ80: =H80+100*O80 -> 155.5 | AK80: 158.4 | AL80: 149 | AM80: 68.7 | AN80: 196 | AO80: -0.14499999999999999 | AP80: 6 | AQ80: 昌红转债!
A81: 80 | B81: 123110 | C81: 九典转债 | D81: 300705 | E81: 九典制药 | F81: 医药 | G81: 化学制药 | H81: 135.5 | I81: -2.86e-002 | J81: -1.04e-002 | K81: 29.9 | L81: -5.4100000000000002e-002 | M81: 121.4 | N81: 26.44 | O81: 0.19800000000000001 | P81: 113.09 | Q81: 已到 | R81: 5.19年 | S81: 3.19年 | T81: 2.7 | U81: 58 | V81: 0.158 | W81: 3.7999999999999999e-002 | X81: 4.2999999999999997e-002 | Y81: 70 | Z81: 7.05 | AA81: -2.1400000000000002e-002 | AB81: -2.8199999999999999e-002 | AC81: -7.5499999999999998e-002 | AD81: -7.7699999999999991e-002 | AE81: 83.02 | AF81: 85.54 | AG81: 0.72 | AH81: A+ | AI81: 7.1599999999999997e-002 | AJ81: =H81+100*O81 -> 155.30000000000001 | AK81: 157.9 | AL81: 141 | AM81: 72.4 | AN81: 228 | AO81: -0.10099999999999999 | AP81: 10 | AQ81: 九典转债
A82: 81 | B82: 123108 | C82: 乐普转2! | D82: 300003 | E82: 乐普医疗 | F82: 医药 | G82: 医疗器械 | H82: 124.744 | I82: -1.78e-002 | J82: -1.3500000000000002e-002 | K82: 24.18 | L82: -9.5399999999999985e-002 | M82: 111.1 | N82: 29.5 | O82: 0.52200000000000002 | P82: 81.97 | Q82: 已到 | R82: 4.18年 | S82: 2.18年 | T82: 16.4 | U82: 169 | V82: 8.199999999999999e-002 | W82: 3.7999999999999999e-002 | X82: 3.1e-002 | Y82: 436 | Z82: 3.79 | AA82: -2.7699999999999999e-002 | AB82: -3.2300000000000002e-002 | AC82: -8.2200000000000009e-002 | AD82: -8.3699999999999997e-002 | AE82: 94.74 | AF82: 97.44 | AG82: 0.33 | AH82: AA+ | AI82: 3.2300000000000002e-002 | AJ82: =H82+100*O82 -> 176.94400000000002 | AK82: 167.5 | AL82: 230 | AM82: 70.1 | AN82: 207 | AO82: 2.7000000000000003e-002 | AP82: 13 | AQ82: 乐普转2!
A83: 82 | B83: 123107 | C83: 温氏转债! | D83: 300498 | E83: 温氏股份 | F83: 农业 | G83: 畜牧业 | H83: 135.73 | I83: -5.6000000000000008e-003 | J83: -2.2799999999999997e-002 | K83: 19.28 | L83: -4.41e-002 | M83: 113 | N83: 17.62 | O83: 0.23999999999999999 | P83: 109.42 | Q83: 已到 | R83: 5.18年 | S83: 3.18年 | T83: 93 | U83: 124 | V83: 1.e-002 | W83: 7.5999999999999998e-002 | X83: 8.3000000000000004e-002 | Y83: 1225. | Z83: 3.49 | AA83: -3.5400000000000001e-002 | AB83: -3.9599999999999996e-002 | AC83: -7.8299999999999995e-002 | AD83: -8.0100000000000005e-002 | AE83: 93.05 | AF83: 96 | AG83: 0.65 | AH83: AAA | AI83: 3.2599999999999997e-002 | AJ83: =H83+100*O83 -> 159.72999999999999 | AK83: 162 | AL83: 183 | AM83: 66 | AN83: 169 | AO83: -2.9999999999999999e-002 | AP83: 12 | AQ83: 温氏转债!
A84: 83 | B84: 110079 | C84: 杭银转债! | D84: 600926 | E84: 杭州银行 | F84: 金融 | G84: 银行行业 | H84: 127.49 | I84: -5.5000000000000005e-003 | J84: 1.4000000000000002e-003 | K84: 14.61 | L84: -6.0999999999999995e-003 | M84: 112.4 | N84: 12.99 | O84: 0.13400000000000001 | P84: 112.47 | Q84: 已到 | R84: 5.18年 | S84: 无权 | T84: 150 | U84: 373 | V84: 2.e-002 | W84: 0.17300000000000001 | X84: 0.19500000000000001 | Y84: 866 | Z84: 1.25 | AA84: -2.4399999999999998e-002 | AB84: -2.86e-002 | AC84: 无权 | AD84: 无权 | AE84: 无权 | AF84: 95.45 | AG84: 0.67 | AH84: AAA | AI84: 3.2599999999999997e-002 | AJ84: =H84+100*O84 -> 140.88999999999999 | AK84: 142.5 | AL84: 21 | AM84: 47.1 | AN84: 42 | AO84: 9.1999999999999998e-002 | AP84: 12 | AQ84: 杭银转债!
A85: 84 | B85: 113622 | C85: 杭叉转债! | D85: 603298 | E85: 杭叉集团 | F85: 机械装备 | G85: 通用设备 | H85: 121.24 | I85: -1.e-002 | J85: 6.5000000000000006e-003 | K85: 16.93 | L85: -1.2800000000000001e-002 | M85: 112.5 | N85: 23.08 | O85: 0.65300000000000002 | P85: 73.35 | Q85: 已到 | R85: 5.17年 | S85: 3.17年 | T85: 11.5 | U85: 5.1 | V85: 4.0000000000000001e-003 | W85: 7.8e-002 | X85: 5.7999999999999996e-002 | Y85: 147 | Z85: 2.78 | AA85: -1.46e-002 | AB85: -1.89e-002 | AC85: -4.8000000000000001e-002 | AD85: -4.9599999999999998e-002 | AE85: 92.02 | AF85: 94.63 | AG85: 0.28 | AH85: AA+ | AI85: 3.4599999999999999e-002 | AJ85: =H85+100*O85 -> 186.53999999999999 | AK85: 169.1 | AL85: 239 | AM85: 74.5 | AN85: 236 | AO85: -2.4e-002 | AP85: 5 | AQ85: 杭叉转债!
A86: 85 | B86: 127031 | C86: 洋丰转债! | D86: 902 | E86: 新洋丰 | F86: 化工 | G86: 农化 | H86: 126.5 | I86: -3.0000000000000001e-003 | J86: 7.000000000000001e-004 | K86: 16.05 | L86: -5.0000000000000001e-003 | M86: 117.1 | N86: 17.76 | O86: 0.40000000000000002 | P86: 90.37 | Q86: 已到 | R86: 5.17年 | S86: 3.17年 | T86: 10 | U86: 12 | V86: 9.0000000000000011e-003 | W86: 4.8000000000000001e-002 | X86: 4.2999999999999997e-002 | Y86: 209 | Z86: 2.78 | AA86: -1.5100000000000001e-002 | AB86: -2.0799999999999999e-002 | AC86: -5.8600000000000006e-002 | AD86: -6.0400000000000002e-002 | AE86: 91.13 | AF86: 96.18 | AG86: 0.46 | AH86: AA | AI86: 3.9599999999999996e-002 | AJ86: =H86+100*O86 -> 166.5 | AK86: 162.6 | AL86: 188 | AM86: 66.5 | AN86: 172 | AO86: -5.2000000000000005e-002 | AP86: 6 | AQ86: 洋丰转债!
A87: 86 | B87: 123106 | C87: 正丹转债! | D87: 300641 | E87: 正丹股份 | F87: 化工 | G87: 化工 | H87: 119.518 | I87: -1.1399999999999999e-002 | J87: 9.1999999999999998e-003 | K87: 6.56 | L87: -4.5999999999999999e-003 | M87: 125.5 | N87: 7.5 | O87: 0.36599999999999999 | P87: 87.47 | Q87: 已到 | R87: 5.17年 | S87: 3.17年 | T87: 3.2 | U87: 5.5 | V87: 1.3999999999999999e-002 | W87: 0.10000000000000001 | X87: 8.6999999999999994e-002 | Y87: 32 | Z87: 2.25 | AA87: 9.7000000000000003e-003 | AB87: 1.4000000000000002e-003 | AC87: -4.1700000000000001e-002 | AD87: -4.3799999999999999e-002 | AE87: 85.54 | AF87: 93.19 | AG87: 0.48 | AH87: AA- | AI87: 6.0599999999999994e-002 | AJ87: =H87+100*O87 -> 156.11799999999999 | AK87: 151.6 | AL87: 89 | AM87: 58.4 | AN87: 112 | AO87: -6.8000000000000005e-002 | AP87: 19 | AQ87: 正丹转债!
A88: 87 | B88: 128145 | C88: 日丰转债! | D88: 2953 | E88: 日丰股份 | F88: 家电 | G88: 零部件制 | H88: 135.076 | I88: -1.6000000000000001e-003 | J88: -7.1999999999999998e-003 | K88: 16 | L88: -1.1699999999999999e-002 | M88: 115.4 | N88: 13.66 | O88: 0.153 | P88: 117.13 | Q88: 已到 | R88: 5年59天 | S88: 3年59天 | T88: 3.8 | U88: 34 | V88: 6.6000000000000003e-002 | W88: 9.8000000000000004e-002 | X88: 0.114 | Y88: 39 | Z88: 3.41 | AA88: -3.0600000000000002e-002 | AB88: -3.5699999999999996e-002 | AC88: -7.690000000000001e-002 | AD88: -7.8799999999999995e-002 | AE88: 85.46 | AF88: 85.74 | AG88: 0.75 | AH88: AA- | AI88: 6.0599999999999994e-002 | AJ88: =H88+100*O88 -> 150.376 | AK88: 153 | AL88: 103 | AM88: 67.3 | AN88: 182 | AO88: -5.2000000000000005e-002 | AP88: 10 | AQ88: 日丰转债!
A89: 88 | B89: 127030 | C89: 盛虹转债! | D89: 301 | E89: 东方盛虹 | F89: 化工 | G89: 化纤 | H89: 157.8 | I89: 1.15e-002 | J89: -1.4999999999999999e-002 | K89: 17.58 | L89: -4.5000000000000005e-003 | M89: 112.5 | N89: 14.1 | O89: 0.26600000000000001 | P89: 124.68 | Q89: 已到 | R89: 5年59天 | S89: 3年59天 | T89: 50 | U89: 113 | V89: 1.3999999999999999e-002 | W89: 5.9000000000000004e-002 | X89: 7.2999999999999995e-002 | Y89: 850 | Z89: 7.49 | AA89: -6.4399999999999999e-002 | AB89: -6.83e-002 | AC89: -0.11800000000000001 | AD89: -0.11900000000000001 | AE89: 92.05 | AF89: 94.66 | AG89: 0.77 | AH89: AA+ | AI89: 3.4599999999999999e-002 | AJ89: =H89+100*O89 -> 184.40000000000001 | AK89: 190.9 | AL89: 317 | AM89: 96.3 | AN89: 312 | AO89: -0.107 | AP89: 5 | AQ89: 盛虹转债!
A90: 89 | B90: 113046 | C90: 金田转债! | D90: 601609 | E90: 金田铜业 | F90: 有色金属 | G90: 铜金属 | H90: 119.23 | I90: -8.0000000000000002e-003 | J90: 8.6999999999999994e-003 | K90: 8.36 | L90: 2.3999999999999998e-003 | M90: 114.9 | N90: 10.75 | O90: 0.53299999999999992 | P90: 77.77 | Q90: 已到 | R90: 5年59天 | S90: 3年59天 | T90: 15 | U90: 7.7 | V90: 4.0000000000000001e-003 | W90: 0.121 | X90: 9.4e-002 | Y90: 124 | Z90: 1.76 | AA90: -7.3000000000000001e-003 | AB90: -1.24e-002 | AC90: -4.2199999999999994e-002 | AD90: -4.41e-002 | AE90: 92.43 | AF90: 96.72 | AG90: 0.31 | AH90: AA+ | AI90: 3.4599999999999999e-002 | AJ90: =H90+100*O90 -> 172.53 | AK90: 160.7 | AL90: 170 | AM90: 64 | AN90: 156 | AO90: -3.1e-002 | AP90: 13 | AQ90: 金田转债!
A91: 90 | B91: 127029 | C91: 中钢转债! | D91: 928 | E91: 中钢国际 | F91: 建筑 | G91: 建筑工程 | H91: 145.333 | I91: -2.3199999999999998e-002 | J91: 1.15e-002 | K91: 7.33 | L91: -1.61e-002 | M91: 117.5 | N91: 5.79 | O91: 0.14800000000000002 | P91: 126.6 | Q91: 已到 | R91: 5年56天 | S91: 3年56天 | T91: 8.19 | U91: 60 | V91: 5.0000000000000003e-002 | W91: 8.6999999999999994e-002 | X91: 0.11 | Y91: 94 | Z91: 1.57 | AA91: -4.0999999999999995e-002 | AB91: -4.6600000000000003e-002 | AC91: -9.9000000000000005e-002 | AD91: -0.10000000000000001 | AE91: 92.07 | AF91: 98.88 | AG91: 0.73 | AH91: AA+ | AI91: 3.4599999999999999e-002 | AJ91: =H91+100*O91 -> 160.13300000000001 | AK91: 164.1 | AL91: 201 | AM91: 65.2 | AN91: 163 | AO91: -0.153 | AP91: 12 | AQ91: 中钢转债!
A92: 91 | B92: 123105 | C92: 拓尔转债! | D92: 300229 | E92: 拓尔思 | F92: 计算机及 | G92: 软件开发 | H92: 139.111 | I92: -4.8999999999999998e-003 | J92: -8.3999999999999995e-003 | K92: 11.71 | L92: -1.84e-002 | M92: 121 | N92: 9.96 | O92: 0.183 | P92: 117.57 | Q92: 已到 | R92: 5年56天 | S92: 3年56天 | T92: 8 | U92: 42 | V92: 3.7999999999999999e-002 | W92: 9.6000000000000002e-002 | X92: 0.11199999999999999 | Y92: 84 | Z92: 3.78 | AA92: -2.7200000000000002e-002 | AB92: -3.39e-002 | AC92: -8.4900000000000003e-002 | AD92: -8.6800000000000002e-002 | AE92: 85.67 | AF92: 89.96 | AG92: 0.72 | AH92: AA- | AI92: 6.0599999999999994e-002 | AJ92: =H92+100*O92 -> 157.411 | AK92: 160.7 | AL92: 168 | AM92: 70.7 | AN92: 214 | AO92: 9.9000000000000005e-002 | AP92: 8 | AQ92: 拓尔转债!
A93: 92 | B93: 123104 | C93: 卫宁转债! | D93: 300253 | E93: 卫宁健康 | F93: 计算机及 | G93: 软件开发 | H93: 128.65 | I93: 9.1000000000000004e-003 | J93: -8.3999999999999995e-003 | K93: 14.89 | L93: 2.e-003 | M93: 125.1 | N93: 17.74 | O93: 0.53299999999999992 | P93: 83.93 | Q93: 已到 | R93: 5年53天 | S93: 3年53天 | T93: 9.7 | U93: 5.8 | V93: 5.0000000000000001e-003 | W93: 2.9999999999999999e-002 | X93: 2.5000000000000001e-002 | Y93: 320 | Z93: 6.66 | AA93: -5.5000000000000005e-003 | AB93: -1.3500000000000002e-002 | AC93: -6.3799999999999996e-002 | AD93: -6.5700000000000008e-002 | AE93: 91.21 | AF93: 102.82 | AG93: 0.32 | AH93: AA | AI93: 3.9599999999999996e-002 | AJ93: =H93+100*O93 -> 181.94999999999999 | AK93: 173.4 | AL93: 265 | AM93: 70.5 | AN93: 211 | AO93: -5.0999999999999997e-002 | AP93: 5 | AQ93: 卫宁转债!
A94: 93 | B94: 123103 | C94: 震安转债! | D94: 300767 | E94: 震安科技 | F94: 化工 | G94: 橡胶塑料 | H94: 177.1 | I94: -7.3000000000000001e-003 | J94: 8.0000000000000004e-004 | K94: 90.03 | L94: -7.4000000000000003e-003 | M94: 121.4 | N94: 56.89 | O94: 0.11900000000000001 | P94: 158.25 | Q94: 已到 | R94: 5年49天 | S94: 3年49天 | T94: 2.53 | U94: 24 | V94: 5.2999999999999999e-002 | W94: 1.3999999999999999e-002 | X94: 2.2000000000000002e-002 | Y94: 182 | Z94: 15.52 | AA94: -7.2400000000000006e-002 | AB94: -7.8700000000000006e-002 | AC94: -0.14499999999999999 | AD94: -0.14699999999999999 | AE94: 83.5 | AF94: 85.91 | AG94: 0.88 | AH94: A+ | AI94: 7.1599999999999997e-002 | AJ94: =H94+100*O94 -> 189. | AK94: 195.9 | AL94: 329 | AM94: 110 | AN94: 336 | AO94: -8.5999999999999993e-002 | AP94: 5 | AQ94: 震安转债!
A95: 94 | B95: 123101 | C95: 拓斯转债! | D95: 300607 | E95: 拓斯达 | F95: 机械装备 | G95: 机器人及 | H95: 115.888 | I95: 0. | J95: 2.9999999999999997e-004 | K95: 15.5 | L95: 1.9e-003 | M95: 115.1 | N95: 26.18 | O95: 0.95700000000000007 | P95: 59.21 | Q95: 已到 | R95: 5年47天 | S95: 3年47天 | T95: 6.7 | U95: 4.5 | V95: 6.0000000000000001e-003 | W95: 0.10099999999999999 | X95: 5.9999999999999998e-002 | Y95: 66 | Z95: 2.99 | AA95: -1.4000000000000002e-003 | AB95: -6.6e-003 | AC95: -3.3700000000000001e-002 | AD95: -3.5699999999999996e-002 | AE95: 91.27 | AF95: 94.69 | AG95: 0.13 | AH95: AA | AI95: 3.9599999999999996e-002 | AJ95: =H95+100*O95 -> 211.58800000000002 | AK95: 172.6 | AL95: 255 | AM95: 77.9 | AN95: 253 | AO95: -4.2000000000000003e-002 | AP95: 10 | AQ95: 拓斯转债!
A96: 95 | B96: 113620 | C96: 傲农转债! | D96: 603363 | E96: 傲农生物 | F96: 农业 | G96: 畜牧业 | H96: 143.12 | I96: -2.5499999999999998e-002 | J96: 1.9400000000000001e-002 | K96: 16.78 | L96: -9.3999999999999986e-003 | M96: 121.1 | N96: 14.52 | O96: 0.23800000000000002 | P96: 115.56 | Q96: 已到 | R96: 5年47天 | S96: 3年47天 | T96: 10 | U96: 490 | V96: 0.33600000000000002 | W96: 8.6999999999999994e-002 | X96: 0.10099999999999999 | Y96: 115 | Z96: 5.28 | AA96: -3.2599999999999997e-002 | AB96: -3.9300000000000002e-002 | AC96: -9.4100000000000003e-002 | AD96: -9.5899999999999999e-002 | AE96: 91.27 | AF96: 99.61 | AG96: 0.65 | AH96: AA | AI96: 3.9599999999999996e-002 | AJ96: =H96+100*O96 -> 166.92000000000002 | AK96: 170.7 | AL96: 248 | AM96: 71.1 | AN96: 219 | AO96: 0.158 | AP96: 9 | AQ96: 傲农转债!
A97: 96 | B97: 113045 | C97: 环旭转债! | D97: 601231 | E97: 环旭电子 | F97: 电子 | G97: 电子产品 | H97: 119.41 | I97: -2.8000000000000004e-003 | J97: -4.7999999999999996e-003 | K97: 14.39 | L97: -3.0299999999999997e-002 | M97: 112 | N97: 19.75 | O97: 0.63900000000000001 | P97: 72.86 | Q97: 已到 | R97: 5年41天 | S97: 2年41天 | T97: 34.5 | U97: 2 | V97: 0. | W97: 0.10800000000000001 | X97: 7.9000000000000001e-002 | Y97: 318 | Z97: 2.67 | AA97: -1.26e-002 | AB97: -1.6799999999999999e-002 | AC97: -6.3299999999999995e-002 | AD97: -6.5599999999999992e-002 | AE97: 95.23 | AF97: 94.35 | AG97: 0.25 | AH97: AA+ | AI97: 3.4599999999999999e-002 | AJ97: =H97+100*O97 -> 183.31 | AK97: 166 | AL97: 215 | AM97: 70.7 | AN97: 215 | AO97: -8.199999999999999e-002 | AP97: 6 | AQ97: 环旭转债!
A98: 97 | B98: 128144 | C98: 利民转债! | D98: 2734 | E98: 利民股份 | F98: 化工 | G98: 农化 | H98: 146.69 | I98: -8.0000000000000004e-004 | J98: -1.8200000000000001e-002 | K98: 13.24 | L98: -2.7200000000000002e-002 | M98: 114.1 | N98: 11.5 | O98: 0.27399999999999997 | P98: 115.13 | Q98: 已到 | R98: 5年38天 | S98: 3年38天 | T98: 9.79 | U98: 5.7 | V98: 4.0000000000000001e-003 | W98: 0.19899999999999998 | X98: 0.22899999999999998 | Y98: 49 | Z98: 1.96 | AA98: -4.87e-002 | AB98: -5.33e-002 | AC98: -0.10199999999999999 | AD98: -0.10300000000000001 | AE98: 90.69 | AF98: 93.9 | AG98: 0.7 | AH98: AA | AI98: 3.9599999999999996e-002 | AJ98: =H98+100*O98 -> 174.09 | AK98: 178.2 | AL98: 283 | AM98: 84.3 | AN98: 279 | AO98: 2.e-003 | AP98: 5 | AQ98: 利民转债!
A99: 98 | B99: 118000 | C99: 嘉元转债! | D99: 688388 | E99: 嘉元科技 | F99: 电子 | G99: 电子产品 | H99: 187.92 | I99: 1.3600000000000001e-002 | J99: 1.2199999999999999e-002 | K99: 124.89 | L99: 2.9900000000000003e-002 | M99: 121 | N99: 78.74 | O99: 0.185 | P99: 158.61 | Q99: 已到 | R99: 5年32天 | S99: 3年32天 | T99: 9.79 | U99: 160 | V99: 8.8000000000000009e-002 | W99: 3.3000000000000002e-002 | X99: 5.2999999999999999e-002 | Y99: 292 | Z99: 9.76 | AA99: -8.4399999999999989e-002 | AB99: -9.06e-002 | AC99: -0.10099999999999999 | AD99: -0.10199999999999999 | AE99: 86.01 | AF99: 90.31 | AG99: 0.87 | AH99: AA- | AI99: 6.0599999999999994e-002 | AJ99: =H99+100*O99 -> 206.41999999999999 | AK99: 217.2 | AL99: 344 | AM99: 126.9 | AN99: 346 | AO99: 2.e-003 | AP99: 6 | AQ99: 嘉元转债!
A100: 99 | B100: 123100 | C100: 朗科转债 | D100: 300543 | E100: 朗科智能 | F100: 电子 | G100: 电子产品 | H100: 133.599 | I100: -1.04e-002 | J100: -1.9e-003 | K100: 13.18 | L100: -1.72e-002 | M100: 117.5 | N100: 11.61 | O100: 0.17699999999999999 | P100: 113.52 | Q100: 已到 | R100: 5年18天 | S100: 3年18天 | T100: 3.8 | U100: 14 | V100: 2.7000000000000003e-002 | W100: 0.107 | X100: 0.122 | Y100: 35 | Z100: 3.73 | AA100: -2.5600000000000001e-002 | AB100: -3.1400000000000004e-002 | AC100: -7.6100000000000001e-002 | AD100: -7.8100000000000003e-002 | AE100: 86.13 | AF100: 87.89 | AG100: 0.72 | AH100: AA- | AI100: 6.0599999999999994e-002 | AJ100: =H100+100*O100 -> 151.29899999999998 | AK100: 153.7 | AL100: 111 | AM100: 65.8 | AN100: 167 | AO100: -4.7e-002 | AP100: 9 | AQ100: 朗科转债
A101: 100 | B101: 123099 | C101: 普利转债 | D101: 300630 | E101: 普利制药 | F101: 医药 | G101: 化学制药 | H101: 132.458 | I101: -2.1000000000000001e-002 | J101: 1.0200000000000001e-002 | K101: 48.05 | L101: -1.7600000000000001e-002 | M101: 123.5 | N101: 46.03 | O101: 0.26899999999999996 | P101: 104.39 | Q101: 已到 | R101: 5年18天 | S101: 3年18天 | T101: 8.5 | U101: 30 | V101: 2.7000000000000003e-002 | W101: 4.0000000000000001e-002 | X101: 4.2000000000000003e-002 | Y101: 210 | Z101: 8.82 | AA101: -1.3999999999999999e-002 | AB101: -2.1700000000000001e-002 | AC101: -7.3599999999999999e-002 | AD101: -7.5600000000000001e-002 | AE101: 86.13 | AF101: 92.35 | AG101: 0.62 | AH101: AA- | AI101: 6.0599999999999994e-002 | AJ101: =H101+100*O101 -> 159.358 | AK101: 160.5 | AL101: 165 | AM101: 68.2 | AN101: 188 | AO101: -7.6999999999999999e-002 | AP101: 5 | AQ101: 普利转债
A102: 101 | B102: 123098 | C102: 一品转债! | D102: 300723 | E102: 一品红 | F102: 医药 | G102: 医药行业 | H102: 145.869 | I102: -4.0000000000000001e-003 | J102: -2.9500000000000002e-002 | K102: 29.46 | L102: -4.9100000000000005e-002 | M102: 124 | N102: 25.48 | O102: 0.26200000000000001 | P102: 115.62 | Q102: 已到 | R102: 5年6.1天 | S102: 3年6.1天 | T102: 4.24 | U102: 7.8 | V102: 1.3000000000000001e-002 | W102: 5.0000000000000003e-002 | X102: 5.7999999999999996e-002 | Y102: 85 | Z102: 5.07 | AA102: -3.2500000000000001e-002 | AB102: -4.0099999999999997e-002 | AC102: -0.10000000000000001 | AD102: -0.10199999999999999 | AE102: 86.37 | AF102: 92.92 | AG102: 0.68 | AH102: AA- | AI102: 6.0599999999999994e-002 | AJ102: =H102+100*O102 -> 172.06900000000002 | AK102: 176.1 | AL102: 277 | AM102: 83.2 | AN102: 274 | AO102: -0.126 | AP102: 7 | AQ102: 一品转债!
A103: 102 | B103: 123097 | C103: 美力转债 | D103: 300611 | E103: 美力科技 | F103: 机械装备 | G103: 通用设备 | H103: 133.35 | I103: -3.3e-003 | J103: -9.1999999999999998e-003 | K103: 10.92 | L103: -1.7100000000000001e-002 | M103: 121.6 | N103: 9.28 | O103: 0.13300000000000001 | P103: 117.67 | Q103: 已到 | R103: 5年5.1天 | S103: 3年5.1天 | T103: 3 | U103: 30 | V103: 7.4999999999999997e-002 | W103: 0.153 | X103: 0.18100000000000002 | Y103: 20 | Z103: 2.78 | AA103: -1.8700000000000001e-002 | AB103: -2.58e-002 | AC103: -7.4400000000000008e-002 | AD103: -7.6799999999999993e-002 | AE103: 84.23 | AF103: 86.78 | AG103: 0.73 | AH103: A+ | AI103: 7.1599999999999997e-002 | AJ103: =H103+100*O103 -> 146.65000000000001 | AK103: 149 | AL103: 66 | AM103: 62.2 | AN103: 137 | AO103: -4.9000000000000002e-002 | AP103: 22 | AQ103: 美力转债
A104: 103 | B104: 123096 | C104: 思创转债! | D104: 300078 | E104: 思创医惠 | F104: 通信互联 | G104: 物联网 | H104: 124.235 | I104: -6.0999999999999995e-003 | J104: 6.8000000000000005e-003 | K104: 7.65 | L104: 1.2999999999999999e-003 | M104: 124 | N104: 8.27 | O104: 0.34299999999999997 | P104: 92.5 | Q104: 已到 | R104: 5年4.1天 | S104: 3年4.1天 | T104: 8.17 | U104: 17 | V104: 1.7000000000000001e-002 | W104: 0.12300000000000001 | X104: 0.114 | Y104: 66 | Z104: 2.43 | AA104: -4.0000000000000002e-004 | AB104: -8.3999999999999995e-003 | AC104: -5.5199999999999999e-002 | AD104: -5.7300000000000004e-002 | AE104: 86.4 | AF104: 92.95 | AG104: 0.52 | AH104: AA- | AI104: 6.0599999999999994e-002 | AJ104: =H104+100*O104 -> 158.535 | AK104: 156 | AL104: 126 | AM104: 63 | AN104: 152 | AO104: 3.9e-002 | AP104: 14 | AQ104: 思创转债!
A105: 104 | B105: 113621 | C105: 彤程转债! | D105: 603650 | E105: 彤程新材 | F105: 化工 | G105: 橡胶塑料 | H105: 156.14 | I105: 5.8999999999999999e-003 | J105: -5.8999999999999999e-003 | K105: 36.9 | L105: 0. | M105: 115.1 | N105: 32.62 | O105: 0.38 | P105: 113.12 | Q105: 已到 | R105: 5年4.1天 | S105: 3年4.1天 | T105: 5.37 | U105: 18 | V105: 2.1000000000000001e-002 | W105: 2.4e-002 | X105: 2.7999999999999997e-002 | Y105: 220 | Z105: 8.21 | AA105: -6.0100000000000001e-002 | AB105: -6.4899999999999999e-002 | AC105: -0.12 | AD105: -0.121 | AE105: 91.69 | AF105: 95.13 | AG105: 0.68 | AH105: AA | AI105: 3.9599999999999996e-002 | AJ105: =H105+100*O105 -> 194.13999999999999 | AK105: 199.2 | AL105: 333 | AM105: 104 | AN105: 330 | AO105: -0.155 | AP105: 7 | AQ105: 彤程转债!
A106: 105 | B106: 113042 | C106: 上银转债! | D106: 601229 | E106: 上海银行 | F106: 金融 | G106: 银行行业 | H106: 108 | I106: -1.e-004 | J106: -1.1000000000000001e-003 | K106: 7.26 | L106: -6.8000000000000005e-003 | M106: 120.9 | N106: 10.63 | O106: 0.58099999999999996 | P106: 68.3 | Q106: 已到 | R106: 5年3.1天 | S106: 无权 | T106: 200 | U106: 220 | V106: 1.e-002 | W106: 0.19399999999999998 | X106: 0.13200000000000001 | Y106: 1031. | Z106: 0.57 | AA106: 2.35e-002 | AB106: 1.6e-002 | AC106: 无权 | AD106: 无权 | AE106: 无权 | AF106: 103.48 | AG106: 0.17 | AH106: AAA | AI106: 3.2599999999999997e-002 | AJ106: =H106+100*O106 -> 166.09999999999999 | AK106: 147.7 | AL106: 56 | AM106: 44.2 | AN106: 28 | AO106: 6.9999999999999993e-003 | AP106: 17 | AQ106: 上银转债!
A107: 106 | B107: 113619 | C107: 世运转债! | D107: 603920 | E107: 世运电路 | F107: 电子 | G107: 元器件制 | H107: 141.12 | I107: -3.3599999999999998e-002 | J107: -1.3100000000000001e-002 | K107: 21.81 | L107: -7.3499999999999996e-002 | M107: 115.2 | N107: 19.92 | O107: 0.28899999999999998 | P107: 109.49 | Q107: 已到 | R107: 4.99年 | S107: 2.99年 | T107: 10 | U107: 19 | V107: 1.3999999999999999e-002 | W107: 8.5999999999999993e-002 | X107: 9.4e-002 | Y107: 116 | Z107: 4.45 | AA107: -4.0999999999999995e-002 | AB107: -4.5999999999999999e-002 | AC107: -9.4299999999999995e-002 | AD107: -9.6099999999999991e-002 | AE107: 92.18 | AF107: 96.02 | AG107: 0.64 | AH107: AA | AI107: 3.73e-002 | AJ107: =H107+100*O107 -> 170.02000000000001 | AK107: 172.8 | AL107: 258 | AM107: 76.7 | AN107: 247 | AO107: -3.4000000000000002e-002 | AP107: 6 | AQ107: 世运转债!
A108: 107 | B108: 123093 | C108: 金陵转债! | D108: 300651 | E108: 金陵体育 | F108: 其他 | G108: 文化教育 | H108: 121.512 | I108: 1.06e-002 | J108: 1.9e-002 | K108: 34.73 | L108: 8.6999999999999994e-002 | M108: 129.3 | N108: 49.19 | O108: 0.72099999999999997 | P108: 70.6 | Q108: 已到 | R108: 4.99年 | S108: 2.99年 | T108: 2.5 | U108: 311 | V108: 1.02 | W108: 5.5999999999999994e-002 | X108: 3.9e-002 | Y108: 45 | Z108: 6.42 | AA108: 1.21e-002 | AB108: 2.5999999999999999e-003 | AC108: -4.3099999999999999e-002 | AD108: -4.6399999999999997e-002 | AE108: 85.91 | AF108: 93.08 | AG108: 0.34 | AH108: A+ | AI108: 6.93e-002 | AJ108: =H108+100*O108 -> 193.61199999999999 | AK108: 172.4 | AL108: 254 | AM108: 79.3 | AN108: 260 | AO108: 0.20600000000000002 | AP108: 12 | AQ108: 金陵转债!
A109: 108 | B109: 113618 | C109: 美诺转债! | D109: 603538 | E109: 美诺华 | F109: 医药 | G109: 原料药 | H109: 124.99 | I109: -7.9000000000000008e-003 | J109: -1.29e-002 | K109: 32.8 | L109: -3.8399999999999997e-002 | M109: 114.9 | N109: 37.23 | O109: 0.41899999999999998 | P109: 88.1 | Q109: 已到 | R109: 4.98年 | S109: 2.98年 | T109: 5.2 | U109: 11 | V109: 1.6e-002 | W109: 0.105 | X109: 9.1999999999999998e-002 | Y109: 50 | Z109: 2.9 | AA109: -1.7100000000000001e-002 | AB109: -2.23e-002 | AC109: -5.8899999999999994e-002 | AD109: -6.08e-002 | AE109: 86.65 | AF109: 87.13 | AG109: 0.54 | AH109: AA- | AI109: 5.8299999999999998e-002 | AJ109: =H109+100*O109 -> 166.88999999999999 | AK109: 161.9 | AL109: 181 | AM109: 74.8 | AN109: 238 | AO109: -6.0999999999999999e-002 | AP109: 5 | AQ109: 美诺转债!
A110: 109 | B110: 128143 | C110: 锋龙转债! | D110: 2931 | E110: 锋龙股份 | F110: 机械装备 | G110: 专用设备 | H110: 129.551 | I110: 3.4999999999999996e-003 | J110: 3.4999999999999996e-003 | K110: 14.04 | L110: 1.01e-002 | M110: 121.2 | N110: 12.73 | O110: 0.17499999999999999 | P110: 110.29 | Q110: 已到 | R110: 4.96年 | S110: 2.96年 | T110: 2.44 | U110: 4.7 | V110: 1.4999999999999999e-002 | W110: 8.6999999999999994e-002 | X110: 9.6000000000000002e-002 | Y110: 28 | Z110: 4.4 | AA110: -1.3600000000000001e-002 | AB110: -2.07e-002 | AC110: -6.8000000000000005e-002 | AD110: -7.0300000000000001e-002 | AE110: 84.6 | AF110: 87.57 | AG110: 0.69 | AH110: A+ | AI110: 6.93e-002 | AJ110: =H110+100*O110 -> 147.05099999999999 | AK110: 148.8 | AL110: 60 | AM110: 61.2 | AN110: 132 | AO110: -4.0000000000000001e-003 | AP110: 15 | AQ110: 锋龙转债!
A111: 110 | B111: 127028 | C111: 英特转债! | D111: 411 | E111: 英特集团 | F111: 医药 | G111: 医药商业 | H111: 127.001 | I111: 4.8999999999999998e-003 | J111: 1.1899999999999999e-002 | K111: 14.25 | L111: 2.6699999999999998e-002 | M111: 112.8 | N111: 13.22 | O111: 0.17800000000000002 | P111: 107.79 | Q111: 已到 | R111: 4.95年 | S111: 2.95年 | T111: 5.99 | U111: 62 | V111: 8.199999999999999e-002 | W111: 0.16500000000000001 | X111: 0.17699999999999999 | Y111: 36 | Z111: 2 | AA111: -2.41e-002 | AB111: -2.86e-002 | AC111: -6.4399999999999999e-002 | AD111: -6.6299999999999998e-002 | AE111: 93.62 | AF111: 96.64 | AG111: 0.63 | AH111: AA+ | AI111: 3.2300000000000002e-002 | AJ111: =H111+100*O111 -> 144.80100000000002 | AK111: 146.2 | AL111: 41 | AM111: 49.6 | AN111: 51 | AO111: -2.7999999999999997e-002 | AP111: 31 | AQ111: 英特转债!
A112: 111 | B112: 113616 | C112: 韦尔转债! | D112: 603501 | E112: 韦尔股份 | F112: 电子 | G112: 元器件制 | H112: 161.33 | I112: -5.1000000000000004e-003 | J112: -1.5900000000000001e-002 | K112: 285.22 | L112: -2.7400000000000001e-002 | M112: 114.3 | N112: 222.52 | O112: 0.25900000000000001 | P112: 128.18 | Q112: 已到 | R112: 4.93年 | S112: 2.93年 | T112: 24.3 | U112: 65 | V112: 1.6e-002 | W112: 1.e-002 | X112: 1.2e-002 | Y112: 2498. | Z112: 17.1 | AA112: -6.8400000000000002e-002 | AB112: -7.2999999999999995e-002 | AC112: -0.13300000000000001 | AD112: -0.13500000000000001 | AE112: 93.21 | AF112: 97.95 | AG112: 0.76 | AH112: AA+ | AI112: 3.2300000000000002e-002 | AJ112: =H112+100*O112 -> 187.23000000000002 | AK112: 194.5 | AL112: 326 | AM112: 96.5 | AN112: 313 | AO112: -2.4e-002 | AP112: 9 | AQ112: 韦尔转债!
A113: 112 | B113: 123092 | C113: 天壕转债! | D113: 300332 | E113: 天壕环境 | F113: 石油天然 | G113: 天然气 | H113: 200.675 | I113: -1.9599999999999999e-002 | J113: 6.8000000000000005e-003 | K113: 10.04 | L113: -1.38e-002 | M113: 121.1 | N113: 5.19 | O113: 3.7000000000000005e-002 | P113: 193.45 | Q113: 已到 | R113: 4.92年 | S113: 2.92年 | T113: 4.17 | U113: 98 | V113: 0.11599999999999999 | W113: 4.7e-002 | X113: 9.0999999999999998e-002 | Y113: 88 | Z113: 2.6 | AA113: -9.9299999999999999e-002 | AB113: -0.106 | AC113: -0.11900000000000001 | AD113: -0.12 | AE113: 84.82 | AF113: 87.74 | AG113: 0.94 | AH113: A+ | AI113: 6.93e-002 | AJ113: =H113+100*O113 -> 204.375 | AK113: 207.9 | AL113: 340 | AM113: 120.2 | AN113: 343 | AO113: -4.5999999999999999e-002 | AP113: 9 | AQ113: 天壕转债!
A114: 113 | B114: 113615 | C114: 金诚转债! | D114: 603979 | E114: 金诚信 | F114: 有色金属 | G114: 有色行业 | H114: 200.9 | I114: 8.1000000000000013e-003 | J114: 2.2000000000000001e-003 | K114: 21.97 | L114: 1.1000000000000001e-002 | M114: 116.9 | N114: 12.65 | O114: 0.157 | P114: 173.68 | Q114: 已到 | R114: 4.92年 | S114: 2.92年 | T114: 8.66 | U114: 85 | V114: 4.9000000000000002e-002 | W114: 6.6000000000000003e-002 | X114: 0.115 | Y114: 130 | Z114: 2.64 | AA114: -0.106 | AB114: -0.111 | AC114: -0.12 | AD114: -0.121 | AE114: 92.44 | AF114: 97.96 | AG114: 0.93 | AH114: AA | AI114: 3.73e-002 | AJ114: =H114+100*O114 -> 216.59999999999999 | AK114: 228.1 | AL114: 350 | AM114: 130.2 | AN114: 349 | AO114: 3.2000000000000001e-002 | AP114: 3 | AQ114: 金诚转债!
A115: 114 | B115: 123091 | C115: 长海转债 | D115: 300196 | E115: 长海股份 | F115: 其他 | G115: 非金属矿 | H115: 135.842 | I115: -1.3500000000000002e-002 | J115: 1.4199999999999999e-002 | K115: 17.13 | L115: 1.1999999999999999e-003 | M115: 115.9 | N115: 16.14 | O115: 0.28000000000000003 | P115: 106.13 | Q115: 已到 | R115: 4.92年 | S115: 2.92年 | T115: 5.5 | U115: 6.3 | V115: 8.0000000000000002e-003 | W115: 7.9000000000000001e-002 | X115: 8.3000000000000004e-002 | Y115: 70 | Z115: 2.16 | AA115: -3.2300000000000002e-002 | AB115: -3.7699999999999997e-002 | AC115: -8.5199999999999998e-002 | AD115: -8.7100000000000011e-002 | AE115: 92.44 | AF115: 97.13 | AG115: 0.6 | AH115: AA | AI115: 3.73e-002 | AJ115: =H115+100*O115 -> 163.84200000000001 | AK115: 165.6 | AL115: 211 | AM115: 68.4 | AN115: 191 | AO115: -2.3e-002 | AP115: 4 | AQ115: 长海转债
A116: 115 | B116: 123089 | C116: 九洲转2!! | D116: 300040 | E116: 九洲集团 | F116: 能源电力 | G116: 电力设备 | H116: 164.574 | I116: -1.2699999999999999e-002 | J116: -1.0200000000000001e-002 | K116: 8.8 | L116: -2.6499999999999999e-002 | M116: 120.6 | N116: 5.68 | O116: 6.2e-002 | P116: 154.93 | Q116: 已到 | R116: 4.91年 | S116: 2.91年 | T116: 3.06 | U116: 67 | V116: 0.13300000000000001 | W116: 5.9000000000000004e-002 | X116: 9.1999999999999998e-002 | Y116: 52 | Z116: 2.02 | AA116: -6.2400000000000004e-002 | AB116: -6.8900000000000003e-002 | AC116: -0.13800000000000001 | AD116: -0.13900000000000001 | AE116: 87.07 | AF116: 91.8 | AG116: 0.86 | AH116: AA- | AI116: 5.8299999999999998e-002 | AJ116: =H116+100*O116 -> 170.774 | AK116: 174.2 | AL116: 268 | AM116: 82.4 | AN116: 271 | AO116: -3.7999999999999999e-002 | AP116: 17 | AQ116: 九洲转2!!
A117: 116 | B117: 123090 | C117: 三诺转债! | D117: 300298 | E117: 三诺生物 | F117: 医药 | G117: 医疗器械 | H117: 121.003 | I117: 4.5000000000000005e-003 | J117: 4.0000000000000002e-004 | K117: 26.26 | L117: 1.78e-002 | M117: 116.8 | N117: 35.18 | O117: 0.621 | P117: 74.64 | Q117: 已到 | R117: 4.91年 | S117: 2.91年 | T117: 5 | U117: 16 | V117: 2.6000000000000002e-002 | W117: 3.4000000000000002e-002 | X117: 2.5000000000000001e-002 | Y117: 148 | Z117: 5.48 | AA117: -7.3000000000000001e-003 | AB117: -1.32e-002 | AC117: -5.04e-002 | AD117: -5.2300000000000006e-002 | AE117: 92.36 | AF117: 97.88 | AG117: 0.28 | AH117: AA | AI117: 3.73e-002 | AJ117: =H117+100*O117 -> 183.10300000000001 | AK117: 167.4 | AL117: 228 | AM117: 69.5 | AN117: 203 | AO117: -0.11599999999999999 | AP117: 5 | AQ117: 三诺转债!
A118: 117 | B118: 128142 | C118: 新乳转债! | D118: 2946 | E118: 新乳业 | F118: 食品饮料 | G118: 乳制品 | H118: 124.49 | I118: -1.7000000000000001e-003 | J118: 1.21e-002 | K118: 15.24 | L118: 2.8999999999999998e-002 | M118: 114.8 | N118: 18.47 | O118: 0.50900000000000001 | P118: 82.51 | Q118: 已到 | R118: 4.90年 | S118: 2.90年 | T118: 7.18 | U118: 2.2 | V118: 2.e-003 | W118: 5.4000000000000006e-002 | X118: 4.4999999999999998e-002 | Y118: 132 | Z118: 5.19 | AA118: -1.67e-002 | AB118: -2.1899999999999999e-002 | AC118: -5.9299999999999999e-002 | AD118: -6.1200000000000004e-002 | AE118: 92.39 | AF118: 96.24 | AG118: 0.36 | AH118: AA | AI118: 3.73e-002 | AJ118: =H118+100*O118 -> 175.38999999999999 | AK118: 166.5 | AL118: 219 | AM118: 70.2 | AN118: 209 | AO118: -2.1000000000000001e-002 | AP118: 5 | AQ118: 新乳转债!
A119: 118 | B119: 128141 | C119: 旺能转债 | D119: 2034 | E119: 旺能环境 | F119: 城市公用 | G119: 三废处理 | H119: 142.9 | I119: -9.7000000000000003e-003 | J119: -5.3e-003 | K119: 18.92 | L119: -2.1700000000000001e-002 | M119: 114.8 | N119: 15.97 | O119: 0.20600000000000002 | P119: 118.47 | Q119: 已到 | R119: 4.90年 | S119: 2.90年 | T119: 12.7 | U119: 59 | V119: 3.2000000000000001e-002 | W119: 0.156 | X119: 0.185 | Y119: 81 | Z119: 1.62 | AA119: -4.4400000000000002e-002 | AB119: -4.9400000000000006e-002 | AC119: -0.10099999999999999 | AD119: -0.10099999999999999 | AE119: 92.4 | AF119: 96.25 | AG119: 0.69 | AH119: AA | AI119: 3.73e-002 | AJ119: =H119+100*O119 -> 163.5 | AK119: 167.3 | AL119: 227 | AM119: 71.1 | AN119: 220 | AO119: 6.9999999999999993e-003 | AP119: 7 | AQ119: 旺能转债
A120: 119 | B120: 123087 | C120: 明电转债! | D120: 300739 | E120: 明阳电路 | F120: 电子 | G120: 元器件制 | H120: 126.32 | I120: -8.5000000000000006e-003 | J120: 1.18e-002 | K120: 16.79 | L120: 5.4000000000000003e-003 | M120: 120.8 | N120: 16.32 | O120: 0.22800000000000001 | P120: 102.88 | Q120: 已到 | R120: 4.90年 | S120: 3.90年 | T120: 4.19 | U120: 19 | V120: 3.6000000000000004e-002 | W120: 8.5000000000000006e-002 | X120: 8.6999999999999994e-002 | Y120: 49 | Z120: 2.98 | AA120: -9.300000000000001e-003 | AB120: -1.6399999999999998e-002 | AC120: -4.2199999999999994e-002 | AD120: -4.4900000000000002e-002 | AE120: 84.76 | AF120: 92.08 | AG120: 0.61 | AH120: AA- | AI120: 5.8299999999999998e-002 | AJ120: =H120+100*O120 -> 149.12 | AK120: 149.8 | AL120: 73 | AM120: 57.7 | AN120: 108 | AO120: -8.5999999999999993e-002 | AP120: 18 | AQ120: 明电转债!
A121: 120 | B121: 123088 | C121: 威唐转债! | D121: 300707 | E121: 威唐工业 | F121: 汽车 | G121: 零部件制 | H121: 125.24 | I121: -1.77e-002 | J121: -2.e-003 | K121: 17.4 | L121: -3.8699999999999998e-002 | M121: 121.1 | N121: 20.72 | O121: 0.49099999999999999 | P121: 83.98 | Q121: 已到 | R121: 4.90年 | S121: 2.90年 | T121: 3.01 | U121: 7.4 | V121: 1.9e-002 | W121: 0.11 | X121: 9.3000000000000013e-002 | Y121: 27 | Z121: 3.88 | AA121: -6.9999999999999993e-003 | AB121: -1.43e-002 | AC121: -5.91e-002 | AD121: -6.1399999999999996e-002 | AE121: 84.96 | AF121: 87.88 | AG121: 0.51 | AH121: A+ | AI121: 6.93e-002 | AJ121: =H121+100*O121 -> 174.34 | AK121: 166.5 | AL121: 221 | AM121: 78.6 | AN121: 255 | AO121: -9.6000000000000002e-002 | AP121: 18 | AQ121: 威唐转债!
A122: 121 | B122: 113044 | C122: 大秦转债! | D122: 601006 | E122: 大秦铁路 | F122: 铁路 | G122: 铁路运输 | H122: 111.54 | I122: 7.000000000000001e-004 | J122: 3.4000000000000002e-003 | K122: 6.65 | L122: 9.1000000000000004e-003 | M122: 113.9 | N122: 7.18 | O122: 0.20399999999999999 | P122: 92.62 | Q122: 已到 | R122: 4.89年 | S122: 2.89年 | T122: 320 | U122: 112 | V122: 3.0000000000000001e-003 | W122: 0.32400000000000001 | X122: 0.29999999999999999 | Y122: 989 | Z122: 0.82 | AA122: 4.4000000000000003e-003 | AB122: -8.0000000000000004e-004 | AC122: -2.3599999999999999e-002 | AD122: -2.5899999999999999e-002 | AE122: 94.75 | AF122: 98.72 | AG122: 0.45 | AH122: AAA | AI122: 3.0299999999999997e-002 | AJ122: =H122+100*O122 -> 131.94 | AK122: 130.5 | AL122: 4 | AM122: 31.7 | AN122: 4 | AO122: 2.9999999999999999e-002 | AP122: 35 | AQ122: 大秦转债!
A123: 122 | B123: 123085 | C123: 万顺转2!! | D123: 300057 | E123: 万顺新材 | F123: 有色金属 | G123: 铝金属 | H123: 150 | I123: 1.8100000000000002e-002 | J123: 1.1899999999999999e-002 | K123: 9.01 | L123: 3.44e-002 | M123: 112.9 | N123: 6.2 | O123: 3.2000000000000001e-002 | P123: 145.32 | Q123: 已到 | R123: 4.89年 | S123: 2.89年 | T123: 8.51 | U123: 112 | V123: 8.8000000000000009e-002 | W123: 0.13800000000000001 | X123: 0.20100000000000001 | Y123: 62 | Z123: 1.71 | AA123: -5.7500000000000002e-002 | AB123: -6.1799999999999994e-002 | AC123: -0.114 | AD123: -0.115 | AE123: 87.11 | AF123: 86.07 | AG123: 0.87 | AH123: AA- | AI123: 5.8299999999999998e-002 | AJ123: =H123+100*O123 -> 153.19999999999999 | AK123: 154.7 | AL123: 119 | AM123: 67.6 | AN123: 185 | AO123: -2.6000000000000002e-002 | AP123: 19 | AQ123: 万顺转2!!
A124: 123 | B124: 123086 | C124: 海兰转债!! | D124: 300065 | E124: 海兰信 | F124: 电子 | G124: 电子产品 | H124: 190.51 | I124: -3.8300000000000001e-002 | J124: 9.8999999999999991e-003 | K124: 13.11 | L124: -3.1e-002 | M124: 123.1 | N124: 7.27 | O124: 5.5999999999999994e-002 | P124: 180.33 | Q124: 已到 | R124: 4.89年 | S124: 2.89年 | T124: 4.82 | U124: 349 | V124: 0.375 | W124: 5.7999999999999996e-002 | X124: 0.105 | Y124: 83 | Z124: 4.91 | AA124: -8.6800000000000002e-002 | AB124: -9.3800000000000008e-002 | AC124: -0.114 | AD124: -0.115 | AE124: 87.14 | AF124: 93.82 | AG124: 0.91 | AH124: AA- | AI124: 5.8299999999999998e-002 | AJ124: =H124+100*O124 -> 196.10999999999999 | AK124: 200.7 | AL124: 336 | AM124: 106.9 | AN124: 332 | AO124: -0.152 | AP124: 18 | AQ124: 海兰转债!!
A125: 124 | B125: 123084 | C125: 高澜转债!! | D125: 300499 | E125: 高澜股份 | F125: 能源电力 | G125: 电力设备 | H125: 167.5 | I125: -1.6200000000000003e-002 | J125: 3.5999999999999999e-003 | K125: 13.04 | L125: -1.5100000000000001e-002 | M125: 121.4 | N125: 9.01 | O125: 0.157 | P125: 144.73 | Q125: 已到 | R125: 4.88年 | S125: 2.88年 | T125: 2.54 | U125: 83 | V125: 0.192 | W125: 6.9000000000000006e-002 | X125: 0.10099999999999999 | Y125: 37 | Z125: 4.25 | AA125: -6.5099999999999991e-002 | AB125: -7.1800000000000003e-002 | AC125: -0.14199999999999999 | AD125: -0.14400000000000002 | AE125: 85.22 | AF125: 88.21 | AG125: 0.84 | AH125: A+ | AI125: 6.93e-002 | AJ125: =H125+100*O125 -> 183.19999999999999 | AK125: 190.3 | AL125: 315 | AM125: 102.1 | AN125: 326 | AO125: -0.121 | AP125: 14 | AQ125: 高澜转债!!
A126: 125 | B126: 127027 | C126: 靖远转债! | D126: 552 | E126: 靖远煤电 | F126: 煤炭 | G126: 煤炭开采 | H126: 138.1 | I126: 2.1099999999999997e-002 | J126: -6.0000000000000001e-003 | K126: 3.81 | L126: 2.1400000000000002e-002 | M126: 114.9 | N126: 3.13 | O126: 0.13500000000000001 | P126: 121.73 | Q126: 已到 | R126: 4.88年 | S126: 2.88年 | T126: 24.3 | U126: 199 | V126: 5.9999999999999998e-002 | W126: 0.27100000000000002 | X126: 0.33000000000000002 | Y126: 90 | Z126: 1.08 | AA126: -3.7599999999999995e-002 | AB126: -4.2699999999999995e-002 | AC126: -9.11e-002 | AD126: -9.3000000000000013e-002 | AE126: 93.93 | AF126: 98.67 | AG126: 0.7 | AH126: AA+ | AI126: 3.2300000000000002e-002 | AJ126: =H126+100*O126 -> 151.59999999999999 | AK126: 154.5 | AL126: 116 | AM126: 55.8 | AN126: 93 | AO126: 4.9000000000000002e-002 | AP126: 37 | AQ126: 靖远转债!
A127: 126 | B127: 113043 | C127: 财通转债! | D127: 601108 | E127: 财通证券 | F127: 金融 | G127: 证券行业 | H127: 118.11 | I127: -1.6500000000000001e-002 | J127: 1.01e-002 | K127: 10.23 | L127: -2.0099999999999996e-002 | M127: 110 | N127: 13.13 | O127: 0.51600000000000001 | P127: 77.91 | Q127: 已到 | R127: 4.88年 | S127: 无权 | T127: 38 | U127: 45 | V127: 1.e-002 | W127: 0.10300000000000001 | X127: 8.1000000000000003e-002 | Y127: 367 | Z127: 1.57 | AA127: -1.47e-002 | AB127: -1.84e-002 | AC127: 无权 | AD127: 无权 | AE127: 无权 | AF127: 95.28 | AG127: 0.32 | AH127: AAA | AI127: 3.0299999999999997e-002 | AJ127: =H127+100*O127 -> 169.71000000000001 | AK127: 158.3 | AL127: 148 | AM127: 63 | AN127: 153 | AO127: -5.5999999999999994e-002 | AP127: 11 | AQ127: 财通转债!
A128: 127 | B128: 123083 | C128: 朗新转债! | D128: 300682 | E128: 朗新科技 | F128: 计算机及 | G128: 软件开发 | H128: 252.104 | I128: 3.0499999999999999e-002 | J128: -9.5999999999999992e-003 | K128: 37.25 | L128: 2.1400000000000002e-002 | M128: 114.8 | N128: 15.39 | O128: 4.2000000000000003e-002 | P128: 242.04 | Q128: 已到 | R128: 4.88年 | S128: 2.88年 | T128: 6.01 | U128: 435 | V128: 0.28999999999999998 | W128: 1.4999999999999999e-002 | X128: 3.7000000000000005e-002 | Y128: 389 | Z128: 7.08 | AA128: -0.151 | AB128: -0.155 | AC128: -0.151 | AD128: -0.151 | AE128: 92.48 | AF128: 96.33 | AG128: 0.98 | AH128: AA | AI128: 3.73e-002 | AJ128: =H128+100*O128 -> 256.30400000000003 | AK128: 262.2 | AL128: 362 | AM128: 165.8 | AN128: 362 | AO128: 4.0999999999999995e-002 | AP128: 7 | AQ128: 朗新转债!
A129: 128 | B129: 127026 | C129: 超声转债! | D129: 823 | E129: 超声电子 | F129: 电子 | G129: 元器件制 | H129: 130.5 | I129: -4.7999999999999996e-003 | J129: 1.7000000000000001e-003 | K129: 12.55 | L129: -5.5000000000000005e-003 | M129: 112.8 | N129: 12.72 | O129: 0.32299999999999995 | P129: 98.66 | Q129: 已到 | R129: 4.88年 | S129: 2.88年 | T129: 7 | U129: 4.5 | V129: 5.0000000000000001e-003 | W129: 0.10400000000000001 | X129: 0.10199999999999999 | Y129: 67 | Z129: 1.69 | AA129: -2.9999999999999999e-002 | AB129: -3.4500000000000003e-002 | AC129: -7.4400000000000008e-002 | AD129: -7.6200000000000004e-002 | AE129: 92.48 | AF129: 94.67 | AG129: 0.56 | AH129: AA | AI129: 3.73e-002 | AJ129: =H129+100*O129 -> 162.80000000000001 | AK129: 162.3 | AL129: 186 | AM129: 67.7 | AN129: 186 | AO129: -5.9999999999999998e-002 | AP129: 12 | AQ129: 超声转债!
A130: 129 | B130: 128140 | C130: 润建转债!! | D130: 2929 | E130: 润建股份 | F130: 通信互联 | G130: 通信设备 | H130: 162.435 | I130: -1.55e-002 | J130: -1.7000000000000001e-003 | K130: 34.52 | L130: -2.2099999999999998e-002 | M130: 114.9 | N130: 26.4 | O130: 0.24199999999999999 | P130: 130.76 | Q130: 已到 | R130: 4.87年 | S130: 2.87年 | T130: 10.9 | U130: 19 | V130: 1.1000000000000001e-002 | W130: 0.13800000000000001 | X130: 0.17999999999999999 | Y130: 79 | Z130: 2.25 | AA130: -6.9699999999999998e-002 | AB130: -7.46e-002 | AC130: -0.13600000000000001 | AD130: -0.13800000000000001 | AE130: 92.59 | AF130: 96.44 | AG130: 0.78 | AH130: AA | AI130: 3.73e-002 | AJ130: =H130+100*O130 -> 186.63499999999999 | AK130: 194.1 | AL130: 325 | AM130: 97.7 | AN130: 316 | AO130: -2.9999999999999999e-002 | AP130: 10 | AQ130: 润建转债!!
A131: 130 | B131: 123082 | C131: 北陆转债! | D131: 300016 | E131: 北陆药业 | F131: 医药 | G131: 化学制药 | H131: 122.9 | I131: 8.0000000000000004e-004 | J131: 1.2999999999999999e-003 | K131: 8.65 | L131: 3.4999999999999996e-003 | M131: 121.2 | N131: 8.81 | O131: 0.252 | P131: 98.18 | Q131: 已到 | R131: 4.87年 | S131: 2.87年 | T131: 4.99 | U131: 11 | V131: 1.7000000000000001e-002 | W131: 0.11699999999999999 | X131: 0.115 | Y131: 43 | Z131: 2.48 | AA131: -2.8999999999999998e-003 | AB131: -1.03e-002 | AC131: -5.3499999999999999e-002 | AD131: -5.5899999999999998e-002 | AE131: 85.1 | AF131: 88.09 | AG131: 0.62 | AH131: A+ | AI131: 6.93e-002 | AJ131: =H131+100*O131 -> 148.09999999999999 | AK131: 147.6 | AL131: 52 | AM131: 59.5 | AN131: 120 | AO131: -3.9e-002 | AP131: 18 | AQ131: 北陆转债!
A132: 131 | B132: 123080 | C132: 海波转债! | D132: 300517 | E132: 海波重科 | F132: 建筑 | G132: 建筑工程 | H132: 128.45 | I132: -3.1300000000000001e-002 | J132: 3.4999999999999996e-003 | K132: 12.82 | L132: -4.1900000000000007e-002 | M132: 126 | N132: 11.58 | O132: 0.16 | P132: 110.71 | Q132: 已到 | R132: 4.86年 | S132: 2.86年 | T132: 2.44 | U132: 21 | V132: 6.6000000000000003e-002 | W132: 9.9000000000000005e-002 | X132: 0.109 | Y132: 25 | Z132: 2.86 | AA132: -4.0000000000000001e-003 | AB132: -1.2800000000000001e-002 | AC132: -6.7500000000000004e-002 | AD132: -6.9800000000000001e-002 | AE132: 85.23 | AF132: 91.64 | AG132: 0.66 | AH132: A+ | AI132: 6.93e-002 | AJ132: =H132+100*O132 -> 144.44999999999999 | AK132: 146.2 | AL132: 40 | AM132: 54.5 | AN132: 82 | AO132: -3.3000000000000002e-002 | AP132: 24 | AQ132: 海波转债!
A133: 132 | B133: 113610 | C133: 灵康转债 | D133: 603669 | E133: 灵康药业 | F133: 医药 | G133: 化学制药 | H133: 122.11 | I133: -1.6000000000000001e-003 | J133: -4.5000000000000005e-003 | K133: 8.72 | L133: -1.0200000000000001e-002 | M133: 120.7 | N133: 8.61 | O133: 0.20600000000000002 | P133: 101.28 | Q133: 已到 | R133: 4.86年 | S133: 2.86年 | T133: 4.58 | U133: 12 | V133: 2.2000000000000002e-002 | W133: 7.2999999999999995e-002 | X133: 7.400000000000001e-002 | Y133: 63 | Z133: 4.57 | AA133: -2.3999999999999998e-003 | AB133: -9.7000000000000003e-003 | AC133: -5.33e-002 | AD133: -5.5399999999999998e-002 | AE133: 87.44 | AF133: 92.18 | AG133: 0.6 | AH133: AA- | AI133: 5.8299999999999998e-002 | AJ133: =H133+100*O133 -> 142.71000000000001 | AK133: 142.9 | AL133: 25 | AM133: 50.8 | AN133: 59 | AO133: -9.1999999999999998e-002 | AP133: 29 | AQ133: 灵康转债
A134: 133 | B134: 128139 | C134: 祥鑫转债! | D134: 2965 | E134: 祥鑫科技 | F134: 汽车 | G134: 零部件制 | H134: 126.499 | I134: -1.0700000000000001e-002 | J134: 1.8e-003 | K134: 23.86 | L134: -3.7900000000000003e-002 | M134: 120.6 | N134: 36.52 | O134: 0.93599999999999994 | P134: 65.33 | Q134: 已到 | R134: 4.86年 | S134: 2.86年 | T134: 6.47 | U134: 5.2 | V134: 6.0000000000000001e-003 | W134: 0.17699999999999999 | X134: 0.115 | Y134: 37 | Z134: 2.06 | AA134: -1.e-002 | AB134: -1.7100000000000001e-002 | AC134: -6.4600000000000005e-002 | AD134: -6.6600000000000006e-002 | AE134: 87.34 | AF134: 92.09 | AG134: 0.24 | AH134: AA- | AI134: 5.8299999999999998e-002 | AJ134: =H134+100*O134 -> 220.09899999999999 | AK134: 187.7 | AL134: 312 | AM134: 95.6 | AN134: 309 | AO134: -5.5999999999999994e-002 | AP134: 14 | AQ134: 祥鑫转债!
A135: 134 | B135: 123078 | C135: 飞凯转债!! | D135: 300398 | E135: 飞凯材料 | F135: 化工 | G135: 化工 | H135: 188.8 | I135: -6.0400000000000002e-002 | J135: -1.7299999999999999e-002 | K135: 26.4 | L135: -8.4900000000000003e-002 | M135: 114.9 | N135: 15.56 | O135: 0.113 | P135: 169.67 | Q135: 已到 | R135: 4.85年 | S135: 2.85年 | T135: 7.2 | U135: 1131. | V135: 0.81200000000000006 | W135: 5.2999999999999999e-002 | X135: 8.9999999999999997e-002 | Y135: 136 | Z135: 4.71 | AA135: -9.8900000000000002e-002 | AB135: -0.10400000000000001 | AC135: -0.115 | AD135: -0.11599999999999999 | AE135: 92.68 | AF135: 96.54 | AG135: 0.92 | AH135: AA | AI135: 3.73e-002 | AJ135: =H135+100*O135 -> 200.10000000000002 | AK135: 207.9 | AL135: 341 | AM135: 111.4 | AN135: 338 | AO135: -1.8000000000000002e-002 | AP135: 9 | AQ135: 飞凯转债!!
A136: 135 | B136: 113609 | C136: 永安转债! | D136: 603776 | E136: 永安行 | F136: 城市公用 | G136: 其他 | H136: 125.48 | I136: -2.9999999999999997e-004 | J136: -1.1999999999999999e-003 | K136: 18.4 | L136: -2.2000000000000001e-003 | M136: 120.1 | N136: 16.48 | O136: 0.124 | P136: 111.65 | Q136: 已到 | R136: 4.84年 | S136: 2.84年 | T136: 7.34 | U136: 61 | V136: 6.6000000000000003e-002 | W136: 0.17100000000000001 | X136: 0.191 | Y136: 43 | Z136: 1.32 | AA136: -9.1999999999999998e-003 | AB136: -1.6200000000000003e-002 | AC136: -6.2699999999999992e-002 | AD136: -6.4699999999999994e-002 | AE136: 87.37 | AF136: 91.78 | AG136: 0.68 | AH136: AA- | AI136: 5.8299999999999998e-002 | AJ136: =H136+100*O136 -> 137.88 | AK136: 139.3 | AL136: 12 | AM136: 47.5 | AN136: 43 | AO136: -9.0999999999999998e-002 | AP136: 26 | AQ136: 永安转债!
A137: 136 | B137: 123077 | C137: 汉得转债! | D137: 300170 | E137: 汉得信息 | F137: 计算机及 | G137: 软件开发 | H137: 128 | I137: 1.5900000000000001e-002 | J137: 1.8e-003 | K137: 9.27 | L137: 4.2699999999999995e-002 | M137: 125.1 | N137: 9.69 | O137: 0.33799999999999997 | P137: 95.67 | Q137: 已到 | R137: 4.84年 | S137: 2.84年 | T137: 9.37 | U137: 173 | V137: 0.14300000000000002 | W137: 0.114 | X137: 0.109 | Y137: 82 | Z137: 2.62 | AA137: -4.7999999999999996e-003 | AB137: -1.3300000000000001e-002 | AC137: -6.9000000000000006e-002 | AD137: -7.0999999999999994e-002 | AE137: 92.75 | AF137: 105.13 | AG137: 0.41 | AH137: AA | AI137: 3.73e-002 | AJ137: =H137+100*O137 -> 161.80000000000001 | AK137: 160.3 | AL137: 162 | AM137: 55.2 | AN137: 89 | AO137: 8.4000000000000005e-002 | AP137: 17 | AQ137: 汉得转债!
A138: 137 | B138: 110077 | C138: 洪城转债 | D138: 600461 | E138: 洪城环境 | F138: 城市公用 | G138: 城市公用 | H138: 140.25 | I138: -4.0000000000000002e-004 | J138: -5.0000000000000001e-003 | K138: 7.99 | L138: -7.4999999999999997e-003 | M138: 113.3 | N138: 6.71 | O138: 0.17800000000000002 | P138: 119.08 | Q138: 已到 | R138: 4.83年 | S138: 2.83年 | T138: 17.7 | U138: 5.2 | V138: 2.e-003 | W138: 0.23199999999999998 | X138: 0.27600000000000002 | Y138: 76 | Z138: 1.4 | AA138: -4.3700000000000003e-002 | AB138: -4.8399999999999999e-002 | AC138: -0.10099999999999999 | AD138: -0.10099999999999999 | AE138: 92.83 | AF138: 97.37 | AG138: 0.71 | AH138: AA+ | AI138: 3.2300000000000002e-002 | AJ138: =H138+100*O138 -> 158.05000000000001 | AK138: 161.4 | AL138: 178 | AM138: 64.1 | AN138: 157 | AO138: -3.9e-002 | AP138: 6 | AQ138: 洪城转债
A139: 138 | B139: 123076 | C139: 强力转债! | D139: 300429 | E139: 强力新材 | F139: 化工 | G139: 化工 | H139: 111.8 | I139: 1.0800000000000001e-002 | J139: -1.5600000000000001e-002 | K139: 11.73 | L139: -2.3300000000000001e-002 | M139: 118.1 | N139: 18.94 | O139: 0.80500000000000005 | P139: 61.93 | Q139: 已到 | R139: 4.82年 | S139: 2.82年 | T139: 8.5 | U139: 33 | V139: 3.5000000000000003e-002 | W139: 0.14099999999999999 | X139: 8.6999999999999994e-002 | Y139: 60 | Z139: 3.34 | AA139: 1.1599999999999999e-002 | AB139: 5.0000000000000001e-003 | AC139: -2.58e-002 | AD139: -2.7999999999999997e-002 | AE139: 87.43 | AF139: 90.33 | AG139: 0.2 | AH139: AA- | AI139: 5.8299999999999998e-002 | AJ139: =H139+100*O139 -> 192.30000000000001 | AK139: 161.7 | AL139: 180 | AM139: 71.3 | AN139: 223 | AO139: -2.9999999999999999e-002 | AP139: 23 | AQ139: 强力转债!
A140: 139 | B140: 128138 | C140: 侨银转债! | D140: 2973 | E140: 侨银股份 | F140: 城市公用 | G140: 城市公用 | H140: 118.3 | I140: -8.0000000000000004e-004 | J140: 0. | K140: 15.6 | L140: -5.6999999999999993e-003 | M140: 136.1 | N140: 25.33 | O140: 0.92099999999999993 | P140: 61.59 | Q140: 已到 | R140: 4.82年 | S140: 2.82年 | T140: 4.2 | U140: 4.3 | V140: 9.0000000000000011e-003 | W140: 6.6000000000000003e-002 | X140: 4.0999999999999995e-002 | Y140: 64 | Z140: 3.98 | AA140: 3.0099999999999998e-002 | AB140: 1.8200000000000001e-002 | AC140: -4.2500000000000003e-002 | AD140: -4.4900000000000002e-002 | AE140: 87.96 | AF140: 104.13 | AG140: 0.14 | AH140: AA- | AI140: 5.8299999999999998e-002 | AJ140: =H140+100*O140 -> 210.39999999999998 | AK140: 175 | AL140: 270 | AM140: 70.9 | AN140: 218 | AO140: -3.0000000000000001e-003 | AP140: 26 | AQ140: 侨银转债!
A141: 140 | B141: 113608 | C141: 威派转债! | D141: 603956 | E141: 威派格 | F141: 机械装备 | G141: 专用设备 | H141: 122.2 | I141: -7.4000000000000003e-003 | J141: 5.1000000000000004e-003 | K141: 17.87 | L141: -3.9000000000000003e-003 | M141: 121.1 | N141: 19.08 | O141: 0.30499999999999999 | P141: 93.66 | Q141: 已到 | R141: 4.80年 | S141: 2.80年 | T141: 4.2 | U141: 3.3 | V141: 6.0000000000000001e-003 | W141: 5.5e-002 | X141: 5.2000000000000005e-002 | Y141: 76 | Z141: 6.43 | AA141: -1.9e-003 | AB141: -9.3999999999999986e-003 | AC141: -5.3099999999999994e-002 | AD141: -5.5500000000000001e-002 | AE141: 85.53 | AF141: 88.47 | AG141: 0.58 | AH141: A+ | AI141: 6.93e-002 | AJ141: =H141+100*O141 -> 152.69999999999999 | AK141: 150.7 | AL141: 78 | AM141: 62.3 | AN141: 138 | AO141: 0. | AP141: 9 | AQ141: 威派转债!
A142: 141 | B142: 127025 | C142: 冀东转债! | D142: 401 | E142: 冀东水泥 | F142: 建筑 | G142: 水泥 | H142: 121.3 | I142: -5.6000000000000008e-003 | J142: -7.000000000000001e-004 | K142: 12.14 | L142: -1.54e-002 | M142: 109.9 | N142: 14.01 | O142: 0.40000000000000002 | P142: 86.65 | Q142: 已到 | R142: 4.79年 | S142: 2.79年 | T142: 17.8 | U142: 8.2 | V142: 4.0000000000000001e-003 | W142: 5.5e-002 | X142: 4.8000000000000001e-002 | Y142: 323 | Z142: 1.05 | AA142: -2.07e-002 | AB142: -2.4399999999999998e-002 | AC142: -5.5199999999999999e-002 | AD142: -5.6799999999999996e-002 | AE142: 94.04 | AF142: 95.48 | AG142: 0.41 | AH142: AAA | AI142: 3.0299999999999997e-002 | AJ142: =H142+100*O142 -> 161.30000000000001 | AK142: 155.9 | AL142: 124 | AM142: 60.5 | AN142: 126 | AO142: -4.0000000000000001e-003 | AP142: 8 | AQ142: 冀东转债!
A143: 142 | B143: 127024 | C143: 盈峰转债! | D143: 967 | E143: 盈峰环境 | F143: 机械装备 | G143: 专用设备 | H143: 117.801 | I143: -3.3e-003 | J143: -1.5e-003 | K143: 6.5 | L143: -1.8100000000000002e-002 | M143: 116.6 | N143: 8.19 | O143: 0.48399999999999999 | P143: 79.37 | Q143: 已到 | R143: 4.78年 | S143: 2.78年 | T143: 14.8 | U143: 4.5 | V143: 3.0000000000000001e-003 | W143: 7.0999999999999994e-002 | X143: 5.7000000000000002e-002 | Y143: 207 | Z143: 1.25 | AA143: -2.2000000000000001e-003 | AB143: -8.3000000000000001e-003 | AC143: -4.4400000000000002e-002 | AD143: -4.6300000000000001e-002 | AE143: 93.93 | AF143: 100.41 | AG143: 0.27 | AH143: AA+ | AI143: 3.2300000000000002e-002 | AJ143: =H143+100*O143 -> 166.20099999999999 | AK143: 156.2 | AL143: 129 | AM143: 55.8 | AN143: 94 | AO143: -8.5999999999999993e-002 | AP143: 6 | AQ143: 盈峰转债!
A144: 143 | B144: 128137 | C144: 洁美转债! | D144: 2859 | E144: 洁美科技 | F144: 电子 | G144: 元器件制 | H144: 149 | I144: 3.2000000000000002e-003 | J144: -8.6e-003 | K144: 33.36 | L144: -7.0999999999999995e-003 | M144: 116.9 | N144: 27.63 | O144: 0.23399999999999999 | P144: 120.74 | Q144: 已到 | R144: 4.78年 | S144: 2.78年 | T144: 5.99 | U144: 13 | V144: 1.3999999999999999e-002 | W144: 4.4000000000000004e-002 | X144: 5.2999999999999999e-002 | Y144: 137 | Z144: 6.95 | AA144: -5.0300000000000004e-002 | AB144: -5.5999999999999994e-002 | AC144: -0.11599999999999999 | AD144: -0.11699999999999999 | AE144: 87.61 | AF144: 89.62 | AG144: 0.76 | AH144: AA- | AI144: 5.8299999999999998e-002 | AJ144: =H144+100*O144 -> 172.40000000000001 | AK144: 177.3 | AL144: 282 | AM144: 87.6 | AN144: 288 | AO144: -6.6000000000000003e-002 | AP144: 5 | AQ144: 洁美转债!
A145: 144 | B145: 128136 | C145: 立讯转债! | D145: 2475 | E145: 立讯精密 | F145: 电子 | G145: 元器件制 | H145: 126.102 | I145: -8.199999999999999e-003 | J145: -4.3e-003 | K145: 47.19 | L145: -3.6699999999999997e-002 | M145: 111.8 | N145: 57.98 | O145: 0.54899999999999993 | P145: 81.39 | Q145: 已到 | R145: 4.78年 | S145: 2.78年 | T145: 30 | U145: 24 | V145: 6.0000000000000001e-003 | W145: 9.0000000000000011e-003 | X145: 6.9999999999999993e-003 | Y145: 3337. | Z145: 10.33 | AA145: -2.52e-002 | AB145: -2.9500000000000002e-002 | AC145: -6.8600000000000008e-002 | AD145: -7.0000000000000007e-002 | AE145: 93.18 | AF145: 96.22 | AG145: 0.34 | AH145: AA+ | AI145: 3.2300000000000002e-002 | AJ145: =H145+100*O145 -> 181.00200000000001 | AK145: 170.8 | AL145: 249 | AM145: 74.6 | AN145: 237 | AO145: -1.6e-002 | AP145: 14 | AQ145: 立讯转债!
A146: 145 | B146: 110076 | C146: 华海转债! | D146: 600521 | E146: 华海药业 | F146: 医药 | G146: 医药行业 | H146: 118.95 | I146: 8.1000000000000013e-003 | J146: -1.0800000000000001e-002 | K146: 22.48 | L146: -1.49e-002 | M146: 114.8 | N146: 33.85 | O146: 0.79099999999999993 | P146: 66.41 | Q146: 已到 | R146: 4.78年 | S146: 2.78年 | T146: 18.4 | U146: 29 | V146: 1.3000000000000001e-002 | W146: 5.5e-002 | X146: 3.6000000000000004e-002 | Y146: 335 | Z146: 5.11 | AA146: -7.4999999999999997e-003 | AB146: -1.3000000000000001e-002 | AC146: -4.7100000000000003e-002 | AD146: -4.9100000000000005e-002 | AE146: 92.82 | AF146: 96.69 | AG146: 0.18 | AH146: AA | AI146: 3.73e-002 | AJ146: =H146+100*O146 -> 198.05000000000001 | AK146: 171.5 | AL146: 251 | AM146: 74.8 | AN146: 239 | AO146: 2.5000000000000001e-002 | AP146: 8 | AQ146: 华海转债!
A147: 146 | B147: 123075 | C147: 贝斯转债! | D147: 300580 | E147: 贝斯特 | F147: 汽车 | G147: 零部件制 | H147: 149.595 | I147: -4.0599999999999997e-002 | J147: 1.0800000000000001e-002 | K147: 30.8 | L147: -3.7499999999999999e-002 | M147: 115.1 | N147: 23.74 | O147: 0.153 | P147: 129.74 | Q147: 已到 | R147: 4.78年 | S147: 2.78年 | T147: 6 | U147: 121 | V147: 0.13300000000000001 | W147: 9.6999999999999989e-002 | X147: 0.126 | Y147: 62 | Z147: 3.48 | AA147: -5.4299999999999994e-002 | AB147: -5.9500000000000004e-002 | AC147: -0.11699999999999999 | AD147: -0.11900000000000001 | AE147: 87.66 | AF147: 88.28 | AG147: 0.79 | AH147: AA- | AI147: 5.8299999999999998e-002 | AJ147: =H147+100*O147 -> 164.89500000000001 | AK147: 169.5 | AL147: 241 | AM147: 81.2 | AN147: 269 | AO147: 4.0999999999999995e-002 | AP147: 9 | AQ147: 贝斯转债!
A148: 147 | B148: 113606 | C148: 荣泰转债 | D148: 603579 | E148: 荣泰健康 | F148: 机械装备 | G148: 专用设备 | H148: 124.93 | I148: -4.5999999999999999e-003 | J148: 1.5e-003 | K148: 31.57 | L148: -5.6999999999999993e-003 | M148: 120.7 | N148: 32.83 | O148: 0.29899999999999999 | P148: 96.16 | Q148: 已到 | R148: 4.77年 | S148: 2.77年 | T148: 6 | U148: 4.5 | V148: 6.0000000000000001e-003 | W148: 0.13600000000000001 | X148: 0.13100000000000001 | Y148: 44 | Z148: 2.64 | AA148: -7.3000000000000001e-003 | AB148: -1.47e-002 | AC148: -6.2199999999999998e-002 | AD148: -6.4299999999999996e-002 | AE148: 87.87 | AF148: 92.64 | AG148: 0.56 | AH148: AA- | AI148: 5.8299999999999998e-002 | AJ148: =H148+100*O148 -> 154.83000000000001 | AK148: 153.7 | AL148: 112 | AM148: 61.1 | AN148: 131 | AO148: -2.7999999999999997e-002 | AP148: 11 | AQ148: 荣泰转债
A149: 148 | B149: 123073 | C149: 同和转债!! | D149: 300636 | E149: 同和药业 | F149: 医药 | G149: 原料药 | H149: 152.498 | I149: -3.1699999999999999e-002 | J149: 9.1000000000000004e-003 | K149: 21.77 | L149: -2.6800000000000001e-002 | M149: 121.9 | N149: 14.82 | O149: 3.7999999999999999e-002 | P149: 146.9 | Q149: 已到 | R149: 4.76年 | S149: 2.76年 | T149: 3.58 | U149: 98 | V149: 0.17800000000000002 | W149: 8.0000000000000002e-002 | X149: 0.11699999999999999 | Y149: 45 | Z149: 5.45 | AA149: -4.6900000000000004e-002 | AB149: -5.4100000000000002e-002 | AC149: -0.122 | AD149: -0.124 | AE149: 85.72 | AF149: 89.27 | AG149: 0.84 | AH149: A+ | AI149: 6.93e-002 | AJ149: =H149+100*O149 -> 156.298 | AK149: 158.1 | AL149: 143 | AM149: 68.8 | AN149: 197 | AO149: -9.6000000000000002e-002 | AP149: 13 | AQ149: 同和转债!!
A150: 149 | B150: 113605 | C150: 大参转债! | D150: 603233 | E150: 大参林 | F150: 医药 | G150: 医药商业 | H150: 116.25 | I150: -2.0999999999999999e-003 | J150: -1.7000000000000001e-003 | K150: 39.5 | L150: -4.4699999999999997e-002 | M150: 114.9 | N150: 69.05 | O150: 1.03 | P150: 57.2 | Q150: 已到 | R150: 4.75年 | S150: 2.75年 | T150: 14 | U150: 6.9 | V150: 4.0000000000000001e-003 | W150: 4.4999999999999998e-002 | X150: 2.6000000000000002e-002 | Y150: 312 | Z150: 5.87 | AA150: -2.5000000000000001e-003 | AB150: -8.1000000000000013e-003 | AC150: -3.9699999999999999e-002 | AD150: -4.1799999999999997e-002 | AE150: 93.02 | AF150: 96.89 | AG150: 0.09 | AH150: AA | AI150: 3.73e-002 | AJ150: =H150+100*O150 -> 219.25 | AK150: 175.3 | AL150: 273 | AM150: 78.4 | AN150: 254 | AO150: -4.8000000000000001e-002 | AP150: 8 | AQ150: 大参转债!
A151: 150 | B151: 123071 | C151: 天能转债!! | D151: 300569 | E151: 天能重工 | F151: 能源电力 | G151: 风能 | H151: 183.3 | I151: 3.3e-003 | J151: 3.8e-003 | K151: 12.38 | L151: 8.1000000000000013e-003 | M151: 120.7 | N151: 7.91 | O151: 0.17100000000000001 | P151: 156.51 | Q151: 已到 | R151: 4.75年 | S151: 2.75年 | T151: 6.94 | U151: 122 | V151: 9.5000000000000001e-002 | W151: 7.0000000000000007e-002 | X151: 0.11 | Y151: 99 | Z151: 2.8 | AA151: -8.5699999999999998e-002 | AB151: -9.2300000000000007e-002 | AC151: -0.11599999999999999 | AD151: -0.11699999999999999 | AE151: 87.99 | AF151: 92.76 | AG151: 0.87 | AH151: AA- | AI151: 5.8299999999999998e-002 | AJ151: =H151+100*O151 -> 200.40000000000001 | AK151: 210.1 | AL151: 342 | AM151: 117.3 | AN151: 342 | AO151: -0.114 | AP151: 12 | AQ151: 天能转债!!
A152: 151 | B152: 123072 | C152: 乐歌转债! | D152: 300729 | E152: 乐歌股份 | F152: 其他 | G152: 家居用品 | H152: 122.5 | I152: -3.3e-003 | J152: 2.9999999999999997e-004 | K152: 25.13 | L152: -2.75e-002 | M152: 129.1 | N152: 49.24 | O152: 1.3999999999999999 | P152: 51.04 | Q152: 已到 | R152: 4.75年 | S152: 2.75年 | T152: 1.42 | U152: 6 | V152: 3.5000000000000003e-002 | W152: 2.6000000000000002e-002 | X152: 1.3000000000000001e-002 | Y152: 55 | Z152: 3.06 | AA152: 1.15e-002 | AB152: 1.4000000000000002e-003 | AC152: -4.8499999999999995e-002 | AD152: -5.2199999999999996e-002 | AE152: 87.6 | AF152: 94.9 | AG152: 0.11 | AH152: A+ | AI152: 6.93e-002 | AJ152: =H152+100*O152 -> 262.5 | AK152: 194 | AL152: 323 | AM152: 99.1 | AN152: 318 | AO152: -0.10300000000000001 | AP152: 11 | AQ152: 乐歌转债!
A153: 152 | B153: 123070 | C153: 鹏辉转债! | D153: 300438 | E153: 鹏辉能源 | F153: 汽车 | G153: 零部件制 | H153: 231.58 | I153: -7.8000000000000005e-003 | J153: 1.6899999999999998e-002 | K153: 41.47 | L153: 9.4999999999999998e-003 | M153: 114.8 | N153: 20.08 | O153: 0.121 | P153: 206.52 | Q153: 已到 | R153: 4.74年 | S153: 2.74年 | T153: 5.99 | U153: 447 | V153: 0.316 | W153: 3.3000000000000002e-002 | X153: 6.9000000000000006e-002 | Y153: 180 | Z153: 6.88 | AA153: -0.13900000000000001 | AB153: -0.14400000000000002 | AC153: -0.151 | AD153: -0.151 | AE153: 92.94 | AF153: 96.81 | AG153: 0.97 | AH153: AA | AI153: 3.73e-002 | AJ153: =H153+100*O153 -> 243.68000000000001 | AK153: 256.6 | AL153: 357 | AM153: 159.8 | AN153: 361 | AO153: -5.9000000000000004e-002 | AP153: 8 | AQ153: 鹏辉转债!
A154: 153 | B154: 128135 | C154: 洽洽转债! | D154: 2557 | E154: 洽洽食品 | F154: 食品饮料 | G154: 休闲食品 | H154: 130.4 | I154: -5.9999999999999995e-004 | J154: 4.7999999999999996e-003 | K154: 58.12 | L154: 9.0000000000000011e-003 | M154: 119.9 | N154: 60.03 | O154: 0.34700000000000003 | P154: 96.82 | Q154: 已到 | R154: 4.74年 | S154: 2.74年 | T154: 13.4 | U154: 32 | V154: 1.8000000000000002e-002 | W154: 4.4999999999999998e-002 | X154: 4.4000000000000004e-002 | Y154: 295 | Z154: 6.75 | AA154: -1.7899999999999999e-002 | AB154: -2.4900000000000002e-002 | AC154: -7.7199999999999991e-002 | AD154: -7.9199999999999993e-002 | AE154: 93.04 | AF154: 101.11 | AG154: 0.46 | AH154: AA | AI154: 3.73e-002 | AJ154: =H154+100*O154 -> 165.10000000000002 | AK154: 164 | AL154: 199 | AM154: 62.9 | AN154: 149 | AO154: -1.6e-002 | AP154: 11 | AQ154: 洽洽转债!
A155: 154 | B155: 127022 | C155: 恒逸转债 | D155: 703 | E155: 恒逸石化 | F155: 化工 | G155: 化工 | H155: 125.9 | I155: -9.1999999999999998e-003 | J155: 3.0999999999999999e-003 | K155: 10.25 | L155: -1.2500000000000001e-002 | M155: 108.7 | N155: 11.2 | O155: 0.376 | P155: 91.52 | Q155: 已到 | R155: 4.73年 | S155: 2.73年 | T155: 20 | U155: 6.7 | V155: 3.0000000000000001e-003 | W155: 5.2999999999999999e-002 | X155: 4.9000000000000002e-002 | Y155: 376 | Z155: 1.45 | AA155: -3.1e-002 | AB155: -3.4200000000000001e-002 | AC155: -6.8900000000000003e-002 | AD155: -7.0400000000000004e-002 | AE155: 93.48 | AF155: 93.73 | AG155: 0.49 | AH155: AA+ | AI155: 3.2300000000000002e-002 | AJ155: =H155+100*O155 -> 163.5 | AK155: 160.3 | AL155: 161 | AM155: 66.6 | AN155: 175 | AO155: -3.4000000000000002e-002 | AP155: 6 | AQ155: 恒逸转债
A156: 155 | B156: 110075 | C156: 南航转债 | D156: 600029 | E156: 南方航空 | F156: 交通运输 | G156: 航空运输 | H156: 141.27 | I156: 6.0999999999999995e-003 | J156: 1.7000000000000001e-003 | K156: 7.26 | L156: 1.11e-002 | M156: 109.8 | N156: 6.24 | O156: 0.214 | P156: 116.35 | Q156: 已到 | R156: 4.73年 | S156: 2.73年 | T156: 59 | U156: 170 | V156: 2.e-002 | W156: 4.8000000000000001e-002 | X156: 5.5999999999999994e-002 | Y156: 1230. | Z156: 1.67 | AA156: -5.2499999999999998e-002 | AB156: -5.5999999999999994e-002 | AC156: -0.105 | AD156: -0.107 | AE156: 93.64 | AF156: 95.52 | AG156: 0.7 | AH156: AAA | AI156: 3.0299999999999997e-002 | AJ156: =H156+100*O156 -> 162.67000000000002 | AK156: 166.2 | AL156: 218 | AM156: 70.7 | AN156: 213 | AO156: 5.4000000000000006e-002 | AP156: 8 | AQ156: 南航转债
A157: 156 | B157: 113604 | C157: 多伦转债! | D157: 603528 | E157: 多伦科技 | F157: 计算机及 | G157: 软件开发 | H157: 110.82 | I157: -4.8999999999999998e-003 | J157: -1.e-004 | K157: 7.22 | L157: -1.6299999999999999e-002 | M157: 116.9 | N157: 10.4 | O157: 0.59599999999999997 | P157: 69.42 | Q157: 已到 | R157: 4.72年 | S157: 2.72年 | T157: 6.4 | U157: 17 | V157: 2.4e-002 | W157: 0.14099999999999999 | X157: 9.8000000000000004e-002 | Y157: 45 | Z157: 2.76 | AA157: 1.1599999999999999e-002 | AB157: 5.1999999999999998e-003 | AC157: -2.3900000000000001e-002 | AD157: -2.6099999999999998e-002 | AE157: 87.91 | AF157: 89.93 | AG157: 0.31 | AH157: AA- | AI157: 5.8299999999999998e-002 | AJ157: =H157+100*O157 -> 170.41999999999999 | AK157: 152.2 | AL157: 96 | AM157: 62.3 | AN157: 139 | AO157: 2.7999999999999997e-002 | AP157: 14 | AQ157: 多伦转债!
A158: 157 | B158: 128134 | C158: 鸿路转债! | D158: 2541 | E158: 鸿路钢构 | F158: 建筑 | G158: 其他建材 | H158: 152.219 | I158: -8.3999999999999995e-003 | J158: 2.8999999999999998e-003 | K158: 54.15 | L158: -7.3000000000000001e-003 | M158: 114.8 | N158: 43.51 | O158: 0.223 | P158: 124.45 | Q158: 已到 | R158: 4.71年 | S158: 2.71年 | T158: 15.7 | U158: 65 | V158: 2.7000000000000003e-002 | W158: 5.5e-002 | X158: 6.8000000000000005e-002 | Y158: 287 | Z158: 4.32 | AA158: -5.91e-002 | AB158: -6.4199999999999993e-002 | AC158: -0.125 | AD158: -0.127 | AE158: 93.04 | AF158: 96.92 | AG158: 0.75 | AH158: AA | AI158: 3.73e-002 | AJ158: =H158+100*O158 -> 174.51900000000001 | AK158: 180 | AL158: 289 | AM158: 83.1 | AN158: 272 | AO158: 3.3000000000000002e-002 | AP158: 4 | AQ158: 鸿路转债!
A159: 158 | B159: 128133 | C159: 奇正转债! | D159: 2287 | E159: 奇正藏药 | F159: 医药 | G159: 中药 | H159: 120.4 | I159: -1.1299999999999999e-002 | J159: -8.9999999999999998e-004 | K159: 26.14 | L159: -3.1099999999999999e-002 | M159: 116.9 | N159: 29.79 | O159: 0.37200000000000005 | P159: 87.75 | Q159: 已到 | R159: 4.67年 | S159: 2.67年 | T159: 8 | U159: 46 | V159: 4.7e-002 | W159: 5.7999999999999996e-002 | X159: 5.0999999999999997e-002 | Y159: 139 | Z159: 4.69 | AA159: -6.4000000000000003e-003 | AB159: -1.2699999999999999e-002 | AC159: -5.2699999999999997e-002 | AD159: -5.4800000000000001e-002 | AE159: 93.3 | AF159: 98.87 | AG159: 0.39 | AH159: AA | AI159: 3.73e-002 | AJ159: =H159+100*O159 -> 157.60000000000002 | AK159: 153.1 | AL159: 104 | AM159: 54.2 | AN159: 80 | AO159: -0.11199999999999999 | AP159: 20 | AQ159: 奇正转债!
A160: 159 | B160: 123067 | C160: 斯莱转债! | D160: 300382 | E160: 斯莱克 | F160: 机械装备 | G160: 专用设备 | H160: 257 | I160: -1.7399999999999999e-002 | J160: -2.81e-002 | K160: 21.19 | L160: -4.7199999999999999e-002 | M160: 120.8 | N160: 9.36 | O160: 0.13500000000000001 | P160: 226.39 | Q160: 已到 | R160: 4.65年 | S160: 2.65年 | T160: 2.4 | U160: 54 | V160: 8.6999999999999994e-002 | W160: 2.e-002 | X160: 4.4000000000000004e-002 | Y160: 123 | Z160: 10.65 | AA160: -0.152 | AB160: -0.158 | AC160: -0.17000000000000001 | AD160: -0.17100000000000001 | AE160: 88.56 | AF160: 93.36 | AG160: 0.96 | AH160: AA- | AI160: 5.8299999999999998e-002 | AJ160: =H160+100*O160 -> 270.5 | AK160: 287.6 | AL160: 367 | AM160: 194.3 | AN160: 367 | AO160: -3.6000000000000004e-002 | AP160: 11 | AQ160: 斯莱转债!
A161: 160 | B161: 128132 | C161: 交建转债! | D161: 2941 | E161: 新疆交建 | F161: 建筑 | G161: 建筑工程 | H161: 113.298 | I161: 8.3000000000000001e-003 | J161: -1.34e-002 | K161: 12.08 | L161: -3.6699999999999997e-002 | M161: 116.9 | N161: 18.53 | O161: 0.73799999999999999 | P161: 65.19 | Q161: 已到 | R161: 4.65年 | S161: 2.65年 | T161: 8.49 | U161: 38 | V161: 4.0000000000000001e-002 | W161: 0.109 | X161: 7.0999999999999994e-002 | Y161: 78 | Z161: 3.01 | AA161: 6.8999999999999999e-003 | AB161: 4.0000000000000002e-004 | AC161: -3.2199999999999999e-002 | AD161: -3.44e-002 | AE161: 93.36 | AF161: 98.94 | AG161: 0.14 | AH161: AA | AI161: 3.73e-002 | AJ161: =H161+100*O161 -> 187.09800000000001 | AK161: 161.4 | AL161: 177 | AM161: 62.5 | AN161: 142 | AO161: -1.7000000000000001e-002 | AP161: 28 | AQ161: 交建转债!
A162: 161 | B162: 128131 | C162: 崇达转2! | D162: 2815 | E162: 崇达技术 | F162: 电子 | G162: 元器件制 | H162: 126.039 | I162: 2.9999999999999997e-004 | J162: -7.7000000000000002e-003 | K162: 15.35 | L162: -2.4199999999999999e-002 | M162: 114.9 | N162: 19.38 | O162: 0.59099999999999997 | P162: 79.21 | Q162: 已到 | R162: 4.62年 | S162: 2.62年 | T162: 14 | U162: 1.8 | V162: 1.e-003 | W162: 0.10400000000000001 | X162: 8.199999999999999e-002 | Y162: 134 | Z162: 3.13 | AA162: -2.0199999999999999e-002 | AB162: -2.5699999999999997e-002 | AC162: -6.9000000000000006e-002 | AD162: -7.1099999999999997e-002 | AE162: 93.44 | AF162: 97.33 | AG162: 0.3 | AH162: AA | AI162: 3.73e-002 | AJ162: =H162+100*O162 -> 185.13900000000001 | AK162: 172.9 | AL162: 261 | AM162: 75.5 | AN162: 242 | AO162: -6.6000000000000003e-002 | AP162: 11 | AQ162: 崇达转2!
A163: 162 | B163: 123065 | C163: 宝莱转债! | D163: 300246 | E163: 宝莱特 | F163: 医药 | G163: 医疗器械 | H163: 115.8 | I163: -3.7000000000000002e-003 | J163: 1.6000000000000001e-003 | K163: 20.1 | L163: -2.4700000000000003e-002 | M163: 121 | N163: 40.14 | O163: 1.3100000000000001 | P163: 50.07 | Q163: 已到 | R163: 4.62年 | S163: 2.62年 | T163: 2.19 | U163: 13 | V163: 5.2000000000000005e-002 | W163: 7.4999999999999997e-002 | X163: 3.7000000000000005e-002 | Y163: 29 | Z163: 3.37 | AA163: 9.7999999999999997e-003 | AB163: 1.9e-003 | AC163: -3.85e-002 | AD163: -4.0999999999999995e-002 | AE163: 88.9 | AF163: 93.71 | AG163: 0.09 | AH163: AA- | AI163: 5.8299999999999998e-002 | AJ163: =H163+100*O163 -> 246.80000000000001 | AK163: 181.5 | AL163: 292 | AM163: 87.8 | AN163: 289 | AO163: -2.2000000000000002e-002 | AP163: 23 | AQ163: 宝莱转债!
A164: 163 | B164: 123064 | C164: 万孚转债! | D164: 300482 | E164: 万孚生物 | F164: 医药 | G164: 医疗器械 | H164: 116.885 | I164: -8.8999999999999999e-003 | J164: 2.7000000000000001e-003 | K164: 40.8 | L164: -6.9800000000000001e-002 | M164: 114.8 | N164: 71.65 | O164: 1.05 | P164: 56.94 | Q164: 已到 | R164: 4.61年 | S164: 2.61年 | T164: 5.99 | U164: 34 | V164: 4.9000000000000002e-002 | W164: 3.3000000000000002e-002 | X164: 1.9e-002 | Y164: 182 | Z164: 5.66 | AA164: -4.0000000000000001e-003 | AB164: -9.7000000000000003e-003 | AC164: -4.3899999999999995e-002 | AD164: -4.5999999999999999e-002 | AE164: 93.4 | AF164: 97.29 | AG164: 0.09 | AH164: AA | AI164: 3.73e-002 | AJ164: =H164+100*O164 -> 221.88499999999999 | AK164: 176.8 | AL164: 280 | AM164: 79.5 | AN164: 262 | AO164: -5.7999999999999996e-002 | AP164: 13 | AQ164: 万孚转债!
A165: 164 | B165: 128130 | C165: 景兴转债 | D165: 2067 | E165: 景兴纸业 | F165: 造纸包装 | G165: 包装用纸 | H165: 126.049 | I165: -1.3300000000000001e-002 | J165: 6.5000000000000006e-003 | K165: 3.89 | L165: -1.0200000000000001e-002 | M165: 114.8 | N165: 3.4 | O165: 0.10199999999999999 | P165: 114.41 | Q165: 已到 | R165: 4.61年 | S165: 2.61年 | T165: 9.99 | U165: 19 | V165: 1.4999999999999999e-002 | W165: 0.215 | X165: 0.24600000000000002 | Y165: 46 | Z165: 0.89 | AA165: -2.0499999999999997e-002 | AB165: -2.6000000000000002e-002 | AC165: -6.9800000000000001e-002 | AD165: -7.1800000000000003e-002 | AE165: 93.41 | AF165: 97.3 | AG165: 0.67 | AH165: AA | AI165: 3.73e-002 | AJ165: =H165+100*O165 -> 136.249 | AK165: 137.7 | AL165: 9 | AM165: 40.4 | AN165: 14 | AO165: -3.7999999999999999e-002 | AP165: 19 | AQ165: 景兴转债
A166: 165 | B166: 128129 | C166: 青农转债! | D166: 2958 | E166: 青农商行 | F166: 金融 | G166: 银行行业 | H166: 115.797 | I166: -4.0000000000000001e-003 | J166: 7.000000000000001e-004 | K166: 3.94 | L166: -7.6e-003 | M166: 112 | N166: 4.32 | O166: 0.27000000000000002 | P166: 91.2 | Q166: 已到 | R166: 4.59年 | S166: 无权 | T166: 50 | U166: 20 | V166: 4.0000000000000001e-003 | W166: 0.22800000000000001 | X166: 0.20800000000000002 | Y166: 219 | Z166: 0.77 | AA166: -7.4000000000000003e-003 | AB166: -1.21e-002 | AC166: 无权 | AD166: 无权 | AE166: 无权 | AF166: 97.88 | AG166: 0.44 | AH166: AAA | AI166: 3.0299999999999997e-002 | AJ166: =H166+100*O166 -> 142.797 | AK166: 140.4 | AL166: 15 | AM166: 42.5 | AN166: 21 | AO166: 1.e-002 | AP166: 27 | AQ166: 青农转债!
A167: 166 | B167: 113602 | C167: 景20转债! | D167: 603228 | E167: 景旺电子 | F167: 电子 | G167: 元器件制 | H167: 140.52 | I167: -1.8200000000000001e-002 | J167: 7.1999999999999998e-003 | K167: 33 | L167: -1.49e-002 | M167: 112.9 | N167: 27.4 | O167: 0.16699999999999998 | P167: 120.44 | Q167: 已到 | R167: 4.59年 | S167: 2.59年 | T167: 17.8 | U167: 58 | V167: 2.3e-002 | W167: 6.3e-002 | X167: 7.5999999999999998e-002 | Y167: 281 | Z167: 4.16 | AA167: -4.7500000000000001e-002 | AB167: -5.2199999999999996e-002 | AC167: -0.105 | AD167: -0.107 | AE167: 93.57 | AF167: 95.78 | AG167: 0.74 | AH167: AA | AI167: 3.73e-002 | AJ167: =H167+100*O167 -> 157.22 | AK167: 160.6 | AL167: 166 | AM167: 64.8 | AN167: 162 | AO167: -8.0000000000000002e-003 | AP167: 9 | AQ167: 景20转债!
A168: 167 | B168: 113039 | C168: 嘉泽转债!! | D168: 601619 | E168: 嘉泽新能 | F168: 能源电力 | G168: 风能 | H168: 152.54 | I168: -8.199999999999999e-003 | J168: -3.8e-003 | K168: 4.69 | L168: -1.47e-002 | M168: 112.8 | N168: 3.46 | O168: 0.125 | P168: 135.55 | Q168: 已到 | R168: 4.59年 | S168: 2.59年 | T168: 2.88 | U168: 65 | V168: 0.14800000000000002 | W168: 2.5000000000000001e-002 | X168: 3.4000000000000002e-002 | Y168: 114 | Z168: 2.39 | AA168: -6.480000000000001e-002 | AB168: -6.93e-002 | AC168: -0.13100000000000001 | AD168: -0.13300000000000001 | AE168: 93.47 | AF168: 95.68 | AG168: 0.82 | AH168: AA | AI168: 3.73e-002 | AJ168: =H168+100*O168 -> 165.03999999999999 | AK168: 169.5 | AL168: 242 | AM168: 73.9 | AN168: 232 | AO168: -5.2000000000000005e-002 | AP168: 32 | AQ168: 嘉泽转债!!
A169: 168 | B169: 113601 | C169: 塞力转债! | D169: 603716 | E169: 塞力医疗 | F169: 医药 | G169: 医药商业 | H169: 136.65 | I169: 5.0000000000000001e-003 | J169: 1.8700000000000001e-002 | K169: 21.31 | L169: 3.2000000000000001e-002 | M169: 120.8 | N169: 16.98 | O169: 8.900000000000001e-002 | P169: 125.5 | Q169: 已到 | R169: 4.58年 | S169: 2.58年 | T169: 5.43 | U169: 1947. | V169: 2.5600000000000001 | W169: 0.124 | X169: 0.156 | Y169: 44 | Z169: 2.87 | AA169: -2.7099999999999999e-002 | AB169: -3.4599999999999999e-002 | AC169: -9.64e-002 | AD169: -9.8599999999999993e-002 | AE169: 88.93 | AF169: 93.75 | AG169: 0.74 | AH169: AA- | AI169: 5.8299999999999998e-002 | AJ169: =H169+100*O169 -> 145.55000000000001 | AK169: 147.8 | AL169: 57 | AM169: 54.1 | AN169: 76 | AO169: 0.30099999999999999 | AP169: 39 | AQ169: 塞力转债!
A170: 169 | B170: 128128 | C170: 齐翔转2! | D170: 2408 | E170: 齐翔腾达 | F170: 化工 | G170: 化工 | H170: 173.349 | I170: -2.7900000000000001e-002 | J170: 4.5999999999999999e-003 | K170: 9.51 | L170: -2.5600000000000001e-002 | M170: 115 | N170: 5.69 | O170: 3.7000000000000005e-002 | P170: 167.14 | Q170: 已到 | R170: 4.58年 | S170: 2.58年 | T170: 6.81 | U170: 45 | V170: 3.7999999999999999e-002 | W170: 2.5000000000000001e-002 | X170: 4.2000000000000003e-002 | Y170: 270 | Z170: 2.17 | AA170: -8.72e-002 | AB170: -9.2300000000000007e-002 | AC170: -0.11699999999999999 | AD170: -0.11800000000000001 | AE170: 93.62 | AF170: 97.59 | AG170: 0.91 | AH170: AA | AI170: 3.73e-002 | AJ170: =H170+100*O170 -> 177.04899999999998 | AK170: 179.6 | AL170: 288 | AM170: 82 | AN170: 270 | AO170: -9.3000000000000013e-002 | AP170: 26 | AQ170: 齐翔转2!
A171: 170 | B171: 128127 | C171: 文科转债! | D171: 2775 | E171: 文科园林 | F171: 城市公用 | G171: 生态环境 | H171: 111.813 | I171: -1.5e-003 | J171: 5.0000000000000001e-004 | K171: 3.83 | L171: -2.5999999999999999e-003 | M171: 120.8 | N171: 4.88 | O171: 0.42499999999999999 | P171: 78.48 | Q171: 已到 | R171: 4.58年 | S171: 2.58年 | T171: 9.49 | U171: 13 | V171: 1.2e-002 | W171: 0.48299999999999998 | X171: 0.379 | Y171: 20 | Z171: 0.92 | AA171: 1.7399999999999999e-002 | AB171: 9.3999999999999986e-003 | AC171: -2.7300000000000001e-002 | AD171: -2.98e-002 | AE171: 88.94 | AF171: 93.76 | AG171: 0.38 | AH171: AA- | AI171: 5.8299999999999998e-002 | AJ171: =H171+100*O171 -> 154.31299999999999 | AK171: 145.1 | AL171: 35 | AM171: 51.4 | AN171: 64 | AO171: -9.4e-002 | AP171: 78 | AQ171: 文科转债!
A172: 171 | B172: 110074 | C172: 精达转债!! | D172: 600577 | E172: 精达股份 | F172: 电子 | G172: 电子产品 | H172: 221.44 | I172: 8.3999999999999995e-003 | J172: -2.5699999999999997e-002 | K172: 6.89 | L172: -1.8500000000000003e-002 | M172: 116.9 | N172: 3.73 | O172: 0.19899999999999998 | P172: 184.72 | Q172: 已到 | R172: 4.57年 | S172: 2.57年 | T172: 5.1 | U172: 241 | V172: 0.215 | W172: 3.7000000000000005e-002 | X172: 6.8000000000000005e-002 | Y172: 138 | Z172: 3.18 | AA172: -0.13200000000000001 | AB172: -0.13800000000000001 | AC172: -0.158 | AD172: -0.158 | AE172: 93.62 | AF172: 99.21 | AG172: 0.94 | AH172: AA | AI172: 3.73e-002 | AJ172: =H172+100*O172 -> 241.34 | AK172: 258.2 | AL172: 360 | AM172: 159 | AN172: 360 | AO172: -6.3e-002 | AP172: 10 | AQ172: 精达转债!!
A173: 172 | B173: 110072 | C173: 广汇转债! | D173: 600297 | E173: 广汇汽车 | F173: 汽车 | G173: 分销、售 | H173: 103.19 | I173: -5.1999999999999998e-003 | J173: 3.5999999999999999e-003 | K173: 2.64 | L173: -1.1200000000000002e-002 | M173: 114.3 | N173: 4.03 | O173: 0.57499999999999996 | P173: 65.51 | Q173: 已到 | R173: 4.57年 | S173: 2.57年 | T173: 33.7 | U173: 22 | V173: 6.0000000000000001e-003 | W173: 0.157 | X173: 0.10300000000000001 | Y173: 214 | Z173: 0.52 | AA173: 2.3e-002 | AB173: 1.72e-002 | AC173: -1.4000000000000002e-003 | AD173: -3.4000000000000002e-003 | AE173: 94.29 | AF173: 99.08 | AG173: 0.14 | AH173: AA+ | AI173: 3.2300000000000002e-002 | AJ173: =H173+100*O173 -> 160.69 | AK173: 140.9 | AL173: 16 | AM173: 41.8 | AN173: 17 | AO173: -2.6000000000000002e-002 | AP173: 84 | AQ173: 广汇转债!
A174: 173 | B174: 113600 | C174: 新星转债!! | D174: 603978 | E174: 深圳新星 | F174: 有色金属 | G174: 有色行业 | H174: 131.26 | I174: 3.4999999999999996e-003 | J174: -1.38e-002 | K174: 24.43 | L174: -1.8500000000000003e-002 | M174: 125.6 | N174: 23.85 | O174: 0.28100000000000003 | P174: 102.43 | Q174: 已到 | R174: 4.56年 | S174: 2.56年 | T174: 4.53 | U174: 21 | V174: 3.5000000000000003e-002 | W174: 0.11199999999999999 | X174: 0.115 | Y174: 41 | Z174: 2.57 | AA174: -9.7999999999999997e-003 | AB174: -1.89e-002 | AC174: -8.4100000000000008e-002 | AD174: -8.6300000000000002e-002 | AE174: 88.85 | AF174: 97.53 | AG174: 0.55 | AH174: AA- | AI174: 5.8299999999999998e-002 | AJ174: =H174+100*O174 -> 159.35999999999999 | AK174: 160.1 | AL174: 159 | AM174: 62.6 | AN174: 146 | AO174: -0.10300000000000001 | AP174: 23 | AQ174: 新星转债!!
A175: 174 | B175: 127021 | C175: 特发转2! | D175: 70 | E175: 特发信息 | F175: 通信互联 | G175: 通信设备 | H175: 127.99 | I175: 4.6999999999999993e-003 | J175: -2.8999999999999998e-003 | K175: 6.59 | L175: 4.5999999999999999e-003 | M175: 113 | N175: 7.33 | O175: 0.42399999999999999 | P175: 89.9 | Q175: 已到 | R175: 3.54年 | S175: 1.54年 | T175: 4.16 | U175: 1.7 | V175: 3.0000000000000001e-003 | W175: 7.4999999999999997e-002 | X175: 6.7000000000000004e-002 | Y175: 56 | Z175: 1.88 | AA175: -3.5000000000000003e-002 | AB175: -4.1299999999999996e-002 | AC175: -0.109 | AD175: -0.111 | AE175: 95.61 | AF175: 99.43 | AG175: 0.39 | AH175: AA | AI175: 3.73e-002 | AJ175: =H175+100*O175 -> 170.38999999999999 | AK175: 166.1 | AL175: 217 | AM175: 66.6 | AN175: 176 | AO175: -1.e-003 | AP175: 16 | AQ175: 特发转2!
A176: 175 | B176: 113599 | C176: 嘉友转债! | D176: 603871 | E176: 嘉友国际 | F176: 交通运输 | G176: 物流业 | H176: 135.63 | I176: 1.1699999999999999e-002 | J176: -2.4399999999999998e-002 | K176: 20.3 | L176: -2.07e-002 | M176: 125.6 | N176: 18.32 | O176: 0.22399999999999998 | P176: 110.81 | Q176: 已到 | R176: 4.53年 | S176: 2.53年 | T176: 7.2 | U176: 36 | V176: 3.7000000000000005e-002 | W176: 0.11199999999999999 | X176: 0.124 | Y176: 64 | Z176: 2.77 | AA176: -1.7100000000000001e-002 | AB176: -2.6200000000000001e-002 | AC176: -9.5899999999999999e-002 | AD176: -9.8000000000000004e-002 | AE176: 88.96 | AF176: 97.65 | AG176: 0.61 | AH176: AA- | AI176: 5.8299999999999998e-002 | AJ176: =H176+100*O176 -> 158.03 | AK176: 160.5 | AL176: 163 | AM176: 62.8 | AN176: 148 | AO176: -7.400000000000001e-002 | AP176: 17 | AQ176: 嘉友转债!
A177: 176 | B177: 113598 | C177: 法兰转债 | D177: 603966 | E177: 法兰泰克 | F177: 机械装备 | G177: 工程机械 | H177: 123.04 | I177: -7.3000000000000001e-003 | J177: 6.0999999999999995e-003 | K177: 9.34 | L177: -2.0999999999999999e-003 | M177: 120.8 | N177: 9.7 | O177: 0.27800000000000002 | P177: 96.29 | Q177: 已到 | R177: 4.52年 | S177: 2.52年 | T177: 2.75 | U177: 9.4 | V177: 2.7999999999999997e-002 | W177: 9.8000000000000004e-002 | X177: 9.4e-002 | Y177: 28 | Z177: 2.24 | AA177: -4.0999999999999995e-003 | AB177: -1.2e-002 | AC177: -6.2199999999999998e-002 | AD177: -6.4600000000000005e-002 | AE177: 89.22 | AF177: 94.05 | AG177: 0.54 | AH177: AA- | AI177: 5.8299999999999998e-002 | AJ177: =H177+100*O177 -> 150.84 | AK177: 149.8 | AL177: 74 | AM177: 55.7 | AN177: 92 | AO177: -6.4000000000000001e-002 | AP177: 13 | AQ177: 法兰转债
A178: 177 | B178: 128125 | C178: 华阳转债! | D178: 2949 | E178: 华阳国际 | F178: 建筑 | G178: 建筑工程 | H178: 120.69 | I178: 9.1000000000000004e-003 | J178: 1.1000000000000001e-002 | K178: 19.84 | L178: 5.2499999999999998e-002 | M178: 118.1 | N178: 25.39 | O178: 0.54500000000000004 | P178: 78.14 | Q178: 已到 | R178: 4.52年 | S178: 2.52年 | T178: 4.5 | U178: 170 | V178: 0.308 | W178: 0.11599999999999999 | X178: 8.9999999999999997e-002 | Y178: 39 | Z178: 2.88 | AA178: -4.8999999999999998e-003 | AB178: -1.18e-002 | AC178: -5.6299999999999996e-002 | AD178: -5.8600000000000006e-002 | AE178: 88.97 | AF178: 91.92 | AG178: 0.38 | AH178: AA- | AI178: 5.8299999999999998e-002 | AJ178: =H178+100*O178 -> 175.19 | AK178: 163.2 | AL178: 194 | AM178: 71.3 | AN178: 222 | AO178: 6.6000000000000003e-002 | AP178: 13 | AQ178: 华阳转债!
A179: 178 | B179: 113597 | C179: 佳力转债! | D179: 603912 | E179: 佳力图 | F179: 机械装备 | G179: 专用设备 | H179: 116.27 | I179: -3.8e-003 | J179: 3.7000000000000002e-003 | K179: 14.06 | L179: -7.000000000000001e-004 | M179: 124 | N179: 23.15 | O179: 0.91400000000000003 | P179: 60.73 | Q179: 已到 | R179: 4.52年 | S179: 2.52年 | T179: 3 | U179: 5.6 | V179: 1.6e-002 | W179: 9.8000000000000004e-002 | X179: 5.9999999999999998e-002 | Y179: 30 | Z179: 3.18 | AA179: 1.47e-002 | AB179: 5.6000000000000008e-003 | AC179: -4.1299999999999996e-002 | AD179: -4.4000000000000004e-002 | AE179: 89.4 | AF179: 96.55 | AG179: 0.16 | AH179: AA- | AI179: 5.8299999999999998e-002 | AJ179: =H179+100*O179 -> 207.67000000000002 | AK179: 171.8 | AL179: 252 | AM179: 75.3 | AN179: 240 | AO179: -2.7000000000000003e-002 | AP179: 21 | AQ179: 佳力转债!
A180: 179 | B180: 123063 | C180: 大禹转债 | D180: 300021 | E180: 大禹节水 | F180: 化工 | G180: 橡胶塑料 | H180: 137.2 | I180: -2.6200000000000001e-002 | J180: 1.2999999999999999e-003 | K180: 5.85 | L180: -3.6200000000000003e-002 | M180: 126.1 | N180: 4.83 | O180: 0.13300000000000001 | P180: 121.12 | Q180: 已到 | R180: 4.51年 | S180: 3.51年 | T180: 6.35 | U180: 37 | V180: 4.2000000000000003e-002 | W180: 0.13500000000000001 | X180: 0.16399999999999998 | Y180: 47 | Z180: 3.15 | AA180: -1.89e-002 | AB180: -2.8199999999999999e-002 | AC180: -6.7299999999999999e-002 | AD180: -7.0300000000000001e-002 | AE180: 86.88 | AF180: 98.22 | AG180: 0.69 | AH180: AA- | AI180: 5.8299999999999998e-002 | AJ180: =H180+100*O180 -> 150.5 | AK180: 153.3 | AL180: 106 | AM180: 55.1 | AN180: 87 | AO180: -2.e-002 | AP180: 20 | AQ180: 大禹转债
A181: 180 | B181: 128124 | C181: 科华转债! | D181: 2022 | E181: 科华生物 | F181: 医药 | G181: 生物制药 | H181: 109.01 | I181: -2.6800000000000001e-002 | J181: 1.9699999999999999e-002 | K181: 14.3 | L181: -3.5699999999999996e-002 | M181: 110 | N181: 21.31 | O181: 0.624 | P181: 67.1 | Q181: 已到 | R181: 4.51年 | S181: 2.51年 | T181: 7.38 | U181: 42 | V181: 5.2000000000000005e-002 | W181: 0.10000000000000001 | X181: 6.7000000000000004e-002 | Y181: 74 | Z181: 2.04 | AA181: 2.e-003 | AB181: -2.0999999999999999e-003 | AC181: -2.2000000000000002e-002 | AD181: -2.3900000000000001e-002 | AE181: 93.22 | AF181: 93.52 | AG181: 0.2 | AH181: AA | AI181: 3.73e-002 | AJ181: =H181+100*O181 -> 171.41 | AK181: 150.9 | AL181: 82 | AM181: 57.4 | AN181: 106 | AO181: -7.0000000000000007e-002 | AP181: 28 | AQ181: 科华转债!
A182: 181 | B182: 113596 | C182: 城地转债! | D182: 603887 | E182: 城地香江 | F182: 通信互联 | G182: 通信设备 | H182: 103.06 | I182: -1.6000000000000001e-003 | J182: 2.e-003 | K182: 10.49 | L182: 1.3500000000000002e-002 | M182: 113.1 | N182: 24.26 | O182: 1.3799999999999999 | P182: 43.24 | Q182: 已到 | R182: 4.51年 | S182: 2.51年 | T182: 12 | U182: 111 | V182: 8.9999999999999997e-002 | W182: 0.254 | X182: 0.11 | Y182: 47 | Z182: 1.26 | AA182: 2.1299999999999999e-002 | AB182: 1.5800000000000002e-002 | AC182: 1.4000000000000002e-003 | AD182: -1.1000000000000001e-003 | AE182: 88.99 | AF182: 88.07 | AG182: 0.02 | AH182: AA- | AI182: 5.8299999999999998e-002 | AJ182: =H182+100*O182 -> 241.06 | AK182: 162.9 | AL182: 190 | AM182: 73.9 | AN182: 233 | AO182: 0.23399999999999999 | AP182: 44 | AQ182: 城地转债!
A183: 182 | B183: 123062 | C183: 三超转债 | D183: 300554 | E183: 三超新材 | F183: 机械装备 | G183: 通用设备 | H183: 127.058 | I183: 2.5999999999999999e-003 | J183: 2.e-003 | K183: 17.39 | L183: 6.8999999999999999e-003 | M183: 119.2 | N183: 17.13 | O183: 0.252 | P183: 101.52 | Q183: 已到 | R183: 4.51年 | S183: 2.51年 | T183: 1.95 | U183: 13 | V183: 5.4000000000000006e-002 | W183: 0.12 | X183: 0.121 | Y183: 16 | Z183: 3.1 | AA183: -1.44e-002 | AB183: -2.1600000000000001e-002 | AC183: -7.2300000000000003e-002 | AD183: -7.4999999999999997e-002 | AE183: 85.07 | AF183: 85.23 | AG183: 0.67 | AH183: A | AI183: 7.9299999999999995e-002 | AJ183: =H183+100*O183 -> 152.25800000000001 | AK183: 152.6 | AL183: 101 | AM183: 67.4 | AN183: 184 | AO183: 3.3000000000000002e-002 | AP183: 27 | AQ183: 三超转债
A184: 183 | B184: 128123 | C184: 国光转债! | D184: 2749 | E184: 国光股份 | F184: 化工 | G184: 农化 | H184: 113.347 | I184: -1.8e-003 | J184: -1.67e-002 | K184: 9.17 | L184: -6.8099999999999994e-002 | M184: 115.7 | N184: 13.49 | O184: 0.66700000000000004 | P184: 67.98 | Q184: 已到 | R184: 4.51年 | S184: 2.51年 | T184: 3.2 | U184: 3.2 | V184: 9.0000000000000011e-003 | W184: 8.0000000000000002e-002 | X184: 5.4000000000000006e-002 | Y184: 40 | Z184: 3.04 | AA184: 4.6999999999999993e-003 | AB184: -1.6000000000000001e-003 | AC184: -3.3300000000000003e-002 | AD184: -3.5699999999999996e-002 | AE184: 89.18 | AF184: 90.14 | AG184: 0.27 | AH184: AA- | AI184: 5.8299999999999998e-002 | AJ184: =H184+100*O184 -> 180.047 | AK184: 158.7 | AL184: 152 | AM184: 68.6 | AN184: 194 | AO184: -7.2000000000000008e-002 | AP184: 15 | AQ184: 国光转债!
A185: 184 | B185: 110073 | C185: 国投转债 | D185: 600061 | E185: 国投资本 | F185: 金融 | G185: 证券行业 | H185: 115.94 | I185: -1.1599999999999999e-002 | J185: 6.4000000000000003e-003 | K185: 7.97 | L185: -1.6e-002 | M185: 110.3 | N185: 9.9 | O185: 0.44 | P185: 80.51 | Q185: 已到 | R185: 4.50年 | S185: 无权 | T185: 80 | U185: 86 | V185: 9.0000000000000011e-003 | W185: 0.156 | X185: 0.126 | Y185: 512 | Z185: 1.13 | AA185: -1.1200000000000002e-002 | AB185: -1.5300000000000001e-002 | AC185: 无权 | AD185: 无权 | AE185: 无权 | AF185: 96.61 | AG185: 0.32 | AH185: AAA | AI185: 3.0299999999999997e-002 | AJ185: =H185+100*O185 -> 159.94 | AK185: 151.4 | AL185: 86 | AM185: 54.8 | AN185: 85 | AO185: -2.4e-002 | AP185: 23 | AQ185: 国投转债
A186: 185 | B186: 128122 | C186: 兴森转债! | D186: 2436 | E186: 兴森科技 | F186: 电子 | G186: 元器件制 | H186: 132.378 | I186: -1.3500000000000002e-002 | J186: -3.7000000000000002e-003 | K186: 12.09 | L186: -5.2499999999999998e-002 | M186: 113 | N186: 14.1 | O186: 0.54400000000000004 | P186: 85.74 | Q186: 已到 | R186: 3.50年 | S186: 2.50年 | T186: 2.69 | U186: 7 | V186: 2.e-002 | W186: 1.4999999999999999e-002 | X186: 1.3000000000000001e-002 | Y186: 180 | Z186: 5.02 | AA186: -4.4800000000000006e-002 | AB186: -5.1100000000000007e-002 | AC186: -8.9399999999999993e-002 | AD186: -9.1400000000000009e-002 | AE186: 93.8 | AF186: 99.58 | AG186: 0.33 | AH186: AA | AI186: 3.73e-002 | AJ186: =H186+100*O186 -> 186.77799999999999 | AK186: 179 | AL186: 285 | AM186: 79.4 | AN186: 261 | AO186: -9.3000000000000013e-002 | AP186: 10 | AQ186: 兴森转债!
A187: 186 | B187: 113037 | C187: 紫银转债! | D187: 601860 | E187: 紫金银行 | F187: 金融 | G187: 银行行业 | H187: 110.06 | I187: -9.7999999999999997e-003 | J187: 6.0000000000000001e-003 | K187: 3.33 | L187: -1.1899999999999999e-002 | M187: 115.6 | N187: 4.05 | O187: 0.33899999999999997 | P187: 82.22 | Q187: 已到 | R187: 4.50年 | S187: 无权 | T187: 45 | U187: 122 | V187: 2.4e-002 | W187: 0.36899999999999999 | X187: 0.30299999999999999 | Y187: 122 | Z187: 0.79 | AA187: 1.1200000000000002e-002 | AB187: 4.8999999999999998e-003 | AC187: 无权 | AD187: 无权 | AE187: 无权 | AF187: 100.53 | AG187: 0.32 | AH187: AA+ | AI187: 3.2300000000000002e-002 | AJ187: =H187+100*O187 -> 143.96000000000001 | AK187: 137.9 | AL187: 10 | AM187: 37.4 | AN187: 9 | AO187: -6.0000000000000001e-003 | AP187: 30 | AQ187: 紫银转债!
A188: 187 | B188: 123061 | C188: 航新转债! | D188: 300424 | E188: 航新科技 | F188: 航空航天 | G188: 航空航天 | H188: 123.605 | I188: 8.9999999999999998e-004 | J188: 1.5e-003 | K188: 14.19 | L188: 4.1999999999999997e-003 | M188: 124.3 | N188: 14.85 | O188: 0.29399999999999998 | P188: 95.56 | Q188: 已到 | R188: 4.50年 | S188: 2.50年 | T188: 2.5 | U188: 10 | V188: 3.3000000000000002e-002 | W188: 7.2999999999999995e-002 | X188: 7.0000000000000007e-002 | Y188: 34 | Z188: 5.04 | AA188: 1.2999999999999999e-003 | AB188: -7.7000000000000002e-003 | AC188: -6.2699999999999992e-002 | AD188: -6.54e-002 | AE188: 87.38 | AF188: 92.67 | AG188: 0.55 | AH188: A+ | AI188: 6.93e-002 | AJ188: =H188+100*O188 -> 153.005 | AK188: 151.7 | AL188: 90 | AM188: 59 | AN188: 117 | AO188: -5.2000000000000005e-002 | AP188: 19 | AQ188: 航新转债!
A189: 188 | B189: 123060 | C189: 苏试转债! | D189: 300416 | E189: 苏试试验 | F189: 机械装备 | G189: 专用设备 | H189: 191.367 | I189: -1.4000000000000002e-003 | J189: 2.63e-002 | K189: 31.36 | L189: 2.75e-002 | M189: 117.2 | N189: 19.05 | O189: 0.16200000000000001 | P189: 164.62 | Q189: 已到 | R189: 4.49年 | S189: 2.49年 | T189: 3.1 | U189: 44 | V189: 7.4999999999999997e-002 | W189: 3.5000000000000003e-002 | X189: 5.7000000000000002e-002 | Y189: 89 | Z189: 8.16 | AA189: -0.105 | AB189: -0.111 | AC189: -0.14000000000000001 | AD189: -0.14099999999999999 | AE189: 89.19 | AF189: 91.37 | AG189: 0.9 | AH189: AA- | AI189: 5.8299999999999998e-002 | AJ189: =H189+100*O189 -> 207.56699999999998 | AK189: 218.1 | AL189: 345 | AM189: 126.7 | AN189: 344 | AO189: -2.7999999999999997e-002 | AP189: 7 | AQ189: 苏试转债!
A190: 189 | B190: 113595 | C190: 花王转债! | D190: 603007 | E190: ST花王 | F190: 城市公用 | G190: 生态环境 | H190: 106.01 | I190: -3.9000000000000003e-003 | J190: 1.9e-003 | K190: 3.19 | L190: -2.1499999999999998e-002 | M190: 124.8 | N190: 6.92 | O190: 1.3 | P190: 46.1 | Q190: 已到 | R190: 4.49年 | S190: 2.49年 | T190: 3.3 | U190: 29 | V190: 8.199999999999999e-002 | W190: 0.308 | X190: 0.14199999999999999 | Y190: 11 | Z190: 1 | AA190: 3.78e-002 | AB190: 2.8199999999999999e-002 | AC190: -8.199999999999999e-003 | AD190: -1.09e-002 | AE190: 77.12 | AF190: 76.14 | AG190: 0.09 | AH190: BBB- | AI190: 0.1193 | AJ190: =H190+100*O190 -> 236.00999999999999 | AK190: 165.9 | AL190: 214 | AM190: 88.8 | AN190: 290 | AO190: -5.9999999999999998e-002 | AP190: 51 | AQ190: 花王转债!
A191: 190 | B191: 113594 | C191: 淳中转债! | D191: 603516 | E191: 淳中科技 | F191: 电子 | G191: 电子产品 | H191: 135.64 | I191: 1.7000000000000001e-003 | J191: 1.3100000000000001e-002 | K191: 18.67 | L191: 2.3599999999999999e-002 | M191: 120.9 | N191: 18.23 | O191: 0.32400000000000001 | P191: 102.41 | Q191: 已到 | R191: 4.49年 | S191: 2.49年 | T191: 3 | U191: 12 | V191: 2.8999999999999998e-002 | W191: 8.5999999999999993e-002 | X191: 8.8000000000000009e-002 | Y191: 35 | Z191: 3.59 | AA191: -2.58e-002 | AB191: -3.3500000000000002e-002 | AC191: -9.5700000000000007e-002 | AD191: -9.820000000000001e-002 | AE191: 87.26 | AF191: 90.13 | AG191: 0.63 | AH191: A+ | AI191: 6.93e-002 | AJ191: =H191+100*O191 -> 168.03999999999999 | AK191: 168.9 | AL191: 238 | AM191: 78.7 | AN191: 256 | AO191: -4.9000000000000002e-002 | AP191: 9 | AQ191: 淳中转债!
A192: 191 | B192: 127020 | C192: 中金转债 | D192: 60 | E192: 中金岭南 | F192: 有色金属 | G192: 有色行业 | H192: 127.7 | I192: -1.5e-003 | J192: -8.9999999999999998e-004 | K192: 4.92 | L192: -4.0000000000000001e-003 | M192: 113.5 | N192: 4.63 | O192: 0.20199999999999999 | P192: 106.26 | Q192: 已到 | R192: 4.49年 | S192: 2.49年 | T192: 34.3 | U192: 17 | V192: 4.0000000000000001e-003 | W192: 0.191 | X192: 0.20300000000000001 | Y192: 180 | Z192: 1.43 | AA192: -2.6200000000000001e-002 | AB192: -3.1400000000000004e-002 | AC192: -8.0600000000000005e-002 | AD192: -8.2100000000000006e-002 | AE192: 94.02 | AF192: 98.6 | AG192: 0.58 | AH192: AA+ | AI192: 3.2300000000000002e-002 | AJ192: =H192+100*O192 -> 147.90000000000001 | AK192: 149.1 | AL192: 68 | AM192: 50.5 | AN192: 57 | AO192: -6.9999999999999993e-003 | AP192: 19 | AQ192: 中金转债
A193: 192 | B193: 113593 | C193: 沪工转债! | D193: 603131 | E193: 上海沪工 | F193: 机械装备 | G193: 通用设备 | H193: 143.5 | I193: -4.4000000000000003e-003 | J193: -4.0599999999999997e-002 | K193: 22.5 | L193: -6.8699999999999997e-002 | M193: 121.2 | N193: 21.12 | O193: 0.34700000000000003 | P193: 106.53 | Q193: 已到 | R193: 4.49年 | S193: 2.49年 | T193: 4 | U193: 30 | V193: 5.2999999999999999e-002 | W193: 5.5999999999999994e-002 | X193: 5.9999999999999998e-002 | Y193: 72 | Z193: 5.38 | AA193: -3.7699999999999997e-002 | AB193: -4.53e-002 | AC193: -0.113 | AD193: -0.11599999999999999 | AE193: 87.37 | AF193: 90.38 | AG193: 0.65 | AH193: A+ | AI193: 6.93e-002 | AJ193: =H193+100*O193 -> 178.19999999999999 | AK193: 180.5 | AL193: 291 | AM193: 90.1 | AN193: 299 | AO193: -0.13300000000000001 | AP193: 9 | AQ193: 沪工转债!
A194: 193 | B194: 128120 | C194: 联诚转债! | D194: 2921 | E194: 联诚精密 | F194: 汽车 | G194: 零部件制 | H194: 124.138 | I194: -8.5000000000000006e-003 | J194: -3.2000000000000002e-003 | K194: 18.57 | L194: -1.7500000000000002e-002 | M194: 117.9 | N194: 18.44 | O194: 0.23300000000000001 | P194: 100.7 | Q194: 已到 | R194: 4.48年 | S194: 2.48年 | T194: 2.6 | U194: 10 | V194: 3.2000000000000001e-002 | W194: 0.13200000000000001 | X194: 0.13300000000000001 | Y194: 20 | Z194: 2.47 | AA194: -1.1699999999999999e-002 | AB194: -1.8600000000000002e-002 | AC194: -6.5000000000000002e-002 | AD194: -6.7699999999999996e-002 | AE194: 85.22 | AF194: 84.48 | AG194: 0.67 | AH194: A | AI194: 7.9299999999999995e-002 | AJ194: =H194+100*O194 -> 147.43800000000002 | AK194: 147.6 | AL194: 51 | AM194: 62.4 | AN194: 140 | AO194: 1.2e-002 | AP194: 22 | AQ194: 联诚转债!
A195: 194 | B195: 128121 | C195: 宏川转债! | D195: 2930 | E195: 宏川智慧 | F195: 交通运输 | G195: 物流业 | H195: 129.089 | I195: 8.5000000000000006e-003 | J195: -6.1999999999999998e-003 | K195: 21.99 | L195: 3.2000000000000002e-003 | M195: 112.9 | N195: 19.89 | O195: 0.16800000000000001 | P195: 110.56 | Q195: 已到 | R195: 4.48年 | S195: 2.48年 | T195: 6.7 | U195: 21 | V195: 2.4e-002 | W195: 6.8000000000000005e-002 | X195: 7.4999999999999997e-002 | Y195: 98 | Z195: 4.63 | AA195: -2.9999999999999999e-002 | AB195: -3.5000000000000003e-002 | AC195: -8.1000000000000003e-002 | AD195: -8.3100000000000007e-002 | AE195: 89.12 | AF195: 88.06 | AG195: 0.72 | AH195: AA- | AI195: 5.8299999999999998e-002 | AJ195: =H195+100*O195 -> 145.88900000000001 | AK195: 147.6 | AL195: 53 | AM195: 58.5 | AN195: 113 | AO195: -9.8000000000000004e-002 | AP195: 7 | AQ195: 宏川转债!
A196: 195 | B196: 123059 | C196: 银信转债! | D196: 300231 | E196: 银信科技 | F196: 计算机及 | G196: 软件开发 | H196: 130.01 | I196: 1.7299999999999999e-002 | J196: -1.2199999999999999e-002 | K196: 9.83 | L196: 9.1999999999999998e-003 | M196: 123.7 | N196: 9.72 | O196: 0.28600000000000003 | P196: 101.13 | Q196: 已到 | R196: 4.48年 | S196: 2.48年 | T196: 3.91 | U196: 74 | V196: 0.14499999999999999 | W196: 8.9999999999999997e-002 | X196: 9.0999999999999998e-002 | Y196: 43 | Z196: 3.1 | AA196: -1.1299999999999999e-002 | AB196: -2.e-002 | AC196: -8.2899999999999988e-002 | AD196: -8.5199999999999998e-002 | AE196: 89.34 | AF196: 96.52 | AG196: 0.55 | AH196: AA- | AI196: 5.8299999999999998e-002 | AJ196: =H196+100*O196 -> 158.60999999999999 | AK196: 158.9 | AL196: 153 | AM196: 62.4 | AN196: 141 | AO196: 8.8000000000000009e-002 | AP196: 19 | AQ196: 银信转债!
A197: 196 | B197: 127019 | C197: 国城转债! | D197: 688 | E197: 国城矿业 | F197: 有色金属 | G197: 锌铅镍锡 | H197: 108 | I197: -1.6000000000000001e-003 | J197: 1.9e-003 | K197: 13.58 | L197: 2.2000000000000001e-003 | M197: 114.8 | N197: 21.06 | O197: 0.67500000000000004 | P197: 64.48 | Q197: 已到 | R197: 4.48年 | S197: 2.48年 | T197: 8.5 | U197: 8.9 | V197: 1.e-002 | W197: 5.5e-002 | X197: 3.5000000000000003e-002 | Y197: 154 | Z197: 6.39 | AA197: 1.3999999999999999e-002 | AB197: 8.0000000000000002e-003 | AC197: -1.6799999999999999e-002 | AD197: -1.9199999999999998e-002 | AE197: 93.85 | AF197: 97.76 | AG197: 0.15 | AH197: AA | AI197: 3.73e-002 | AJ197: =H197+100*O197 -> 175.5 | AK197: 151.5 | AL197: 88 | AM197: 53.8 | AN197: 74 | AO197: -8.0000000000000002e-003 | AP197: 51 | AQ197: 国城转债!
A198: 197 | B198: 128119 | C198: 龙大转债! | D198: 2726 | E198: 龙大美食 | F198: 食品饮料 | G198: 肉制品 | H198: 139.9 | I198: 0. | J198: -2.06e-002 | K198: 9.95 | L198: -3.6799999999999999e-002 | M198: 119.9 | N198: 9.29 | O198: 0.30599999999999999 | P198: 107.1 | Q198: 已到 | R198: 4.47年 | S198: 2.47年 | T198: 9.46 | U198: 20 | V198: 1.6e-002 | W198: 8.8000000000000009e-002 | X198: 9.4e-002 | Y198: 107 | Z198: 2.66 | AA198: -3.4500000000000003e-002 | AB198: -4.1799999999999997e-002 | AC198: -0.10800000000000001 | AD198: -0.11 | AE198: 93.97 | AF198: 102.12 | AG198: 0.56 | AH198: AA | AI198: 3.73e-002 | AJ198: =H198+100*O198 -> 170.5 | AK198: 172.7 | AL198: 257 | AM198: 70.6 | AN198: 212 | AO198: -6.2e-002 | AP198: 9 | AQ198: 龙大转债!
A199: 198 | B199: 110071 | C199: 湖盐转债! | D199: 600929 | E199: 雪天盐业 | F199: 食品饮料 | G199: 食品饮料 | H199: 133.1 | I199: -1.1000000000000001e-003 | J199: -1.9e-002 | K199: 6.88 | L199: -3.3700000000000001e-002 | M199: 114.9 | N199: 6.52 | O199: 0.26100000000000001 | P199: 105.52 | Q199: 已到 | R199: 4.46年 | S199: 2.46年 | T199: 7.2 | U199: 48 | V199: 5.0000000000000003e-002 | W199: 0.11199999999999999 | X199: 0.11800000000000001 | Y199: 64 | Z199: 2.46 | AA199: -3.3000000000000002e-002 | AB199: -3.8699999999999998e-002 | AC199: -9.2300000000000007e-002 | AD199: -9.4399999999999998e-002 | AE199: 93.99 | AF199: 97.91 | AG199: 0.6 | AH199: AA | AI199: 3.73e-002 | AJ199: =H199+100*O199 -> 159.19999999999999 | AK199: 160.7 | AL199: 169 | AM199: 62.8 | AN199: 147 | AO199: -6.8000000000000005e-002 | AP199: 19 | AQ199: 湖盐转债!
A200: 199 | B200: 113036 | C200: 宁建转债! | D200: 601789 | E200: 宁波建工 | F200: 建筑 | G200: 建筑工程 | H200: 119.98 | I200: 7.9000000000000008e-003 | J200: -9.5999999999999992e-003 | K200: 4.1 | L200: -4.8999999999999998e-003 | M200: 116.9 | N200: 4.76 | O200: 0.39299999999999996 | P200: 86.13 | Q200: 已到 | R200: 4.45年 | S200: 2.45年 | T200: 5.4 | U200: 11 | V200: 1.8000000000000002e-002 | W200: 0.13500000000000001 | X200: 0.11599999999999999 | Y200: 40 | Z200: 1.23 | AA200: -5.8999999999999999e-003 | AB200: -1.26e-002 | AC200: -5.57e-002 | AD200: -5.79e-002 | AE200: 94.03 | AF200: 99.65 | AG200: 0.36 | AH200: AA | AI200: 3.73e-002 | AJ200: =H200+100*O200 -> 159.28 | AK200: 153.8 | AL200: 114 | AM200: 54.2 | AN200: 79 | AO200: 5.5999999999999994e-002 | AP200: 14 | AQ200: 宁建转债!
A201: 200 | B201: 128118 | C201: 瀛通转债! | D201: 2861 | E201: 瀛通通讯 | F201: 电子 | G201: 电子产品 | H201: 111.981 | I201: -8.0000000000000004e-004 | J201: 1.2999999999999999e-003 | K201: 12.71 | L201: 3.2000000000000002e-003 | M201: 121.7 | N201: 21.24 | O201: 0.871 | P201: 59.84 | Q201: 已到 | R201: 4.44年 | S201: 2.44年 | T201: 3 | U201: 3.6 | V201: 1.1000000000000001e-002 | W201: 0.14999999999999999 | X201: 8.9999999999999997e-002 | Y201: 20 | Z201: 1.9 | AA201: 1.9400000000000001e-002 | AB201: 1.0800000000000001e-002 | AC201: -2.75e-002 | AD201: -3.0499999999999999e-002 | AE201: 90.04 | AF201: 95.24 | AG201: 0.16 | AH201: AA- | AI201: 5.8299999999999998e-002 | AJ201: =H201+100*O201 -> 199.08099999999999 | AK201: 164.1 | AL201: 202 | AM201: 68.9 | AN201: 198 | AO201: -9.0000000000000011e-003 | AP201: 27 | AQ201: 瀛通转债!
A202: 201 | B202: 128117 | C202: 道恩转债! | D202: 2838 | E202: 道恩股份 | F202: 化工 | G202: 橡胶塑料 | H202: 112.89 | I202: -1.e-003 | J202: -2.e-003 | K202: 15.08 | L202: -3.5799999999999998e-002 | M202: 123.1 | N202: 28.78 | O202: 1.1499999999999999 | P202: 52.4 | Q202: 已到 | R202: 4.44年 | S202: 2.44年 | T202: 3.6 | U202: 5.7 | V202: 1.3999999999999999e-002 | W202: 5.7999999999999996e-002 | X202: 3.1e-002 | Y202: 62 | Z202: 3.24 | AA202: 2.0099999999999996e-002 | AB202: 1.11e-002 | AC202: -3.3300000000000003e-002 | AD202: -3.5699999999999996e-002 | AE202: 89.35 | AF202: 96.2 | AG202: 0.08 | AH202: AA- | AI202: 5.8299999999999998e-002 | AJ202: =H202+100*O202 -> 227.88999999999999 | AK202: 173.4 | AL202: 266 | AM202: 77.2 | AN202: 250 | AO202: -9.5000000000000001e-002 | AP202: 28 | AQ202: 道恩转债!
A203: 202 | B203: 123057 | C203: 美联转债!! | D203: 300586 | E203: 美联新材 | F203: 化工 | G203: 橡胶塑料 | H203: 137.2 | I203: -1.9099999999999999e-002 | J203: 6.5000000000000006e-003 | K203: 10.81 | L203: -1.8200000000000001e-002 | M203: 117.8 | N203: 9.5 | O203: 0.20600000000000002 | P203: 113.79 | Q203: 已到 | R203: 4.44年 | S203: 2.44年 | T203: 2.07 | U203: 44 | V203: 0.154 | W203: 3.6000000000000004e-002 | X203: 4.0999999999999995e-002 | Y203: 57 | Z203: 4.74 | AA203: -3.4500000000000003e-002 | AB203: -4.1100000000000005e-002 | AC203: -0.10199999999999999 | AD203: -0.10400000000000001 | AE203: 89.64 | AF203: 92.16 | AG203: 0.69 | AH203: AA- | AI203: 5.8299999999999998e-002 | AJ203: =H203+100*O203 -> 157.79999999999998 | AK203: 160.6 | AL203: 167 | AM203: 68.4 | AN203: 192 | AO203: -0.14999999999999999 | AP203: 20 | AQ203: 美联转债!!
A204: 203 | B204: 113591 | C204: 胜达转债!! | D204: 603687 | E204: 大胜达 | F204: 造纸包装 | G204: 包装用纸 | H204: 140.03 | I204: -1.09e-002 | J204: 3.8e-003 | K204: 12.43 | L204: -8.8000000000000005e-003 | M204: 121.7 | N204: 8.76 | O204: -1.3000000000000001e-002 | P204: 141.89 | Q204: 已到 | R204: 4.44年 | S204: 2.44年 | T204: 4.9 | U204: 179 | V204: 0.26000000000000001 | W204: 9.5000000000000001e-002 | X204: 0.13500000000000001 | Y204: 52 | Z204: 2.94 | AA204: -3.1699999999999999e-002 | AB204: -3.9699999999999999e-002 | AC204: -0.109 | AD204: -0.111 | AE204: 89.54 | AF204: 95.17 | AG204: 0.8 | AH204: AA- | AI204: 5.8299999999999998e-002 | AJ204: =H204+100*O204 -> 138.72999999999999 | AK204: 138.2 | AL204: 11 | AM204: 43 | AN204: 23 | AO204: 6.7000000000000004e-002 | AP204: 35 | AQ204: 胜达转债!!
A205: 204 | B205: 128116 | C205: 瑞达转债! | D205: 2961 | E205: 瑞达期货 | F205: 金融 | G205: 期货行业 | H205: 117.36 | I205: -4.5999999999999999e-003 | J205: -8.3000000000000001e-003 | K205: 21.93 | L205: -5.0199999999999995e-002 | M205: 114.9 | N205: 29.55 | O205: 0.58099999999999996 | P205: 74.21 | Q205: 已到 | R205: 4.43年 | S205: 2.43年 | T205: 6.49 | U205: 4.1 | V205: 5.0000000000000001e-003 | W205: 6.7000000000000004e-002 | X205: 4.9000000000000002e-002 | Y205: 98 | Z205: 4.6 | AA205: -4.8999999999999998e-003 | AB205: -1.0800000000000001e-002 | AC205: -4.82e-002 | AD205: -5.0499999999999996e-002 | AE205: 94.02 | AF205: 98.01 | AG205: 0.26 | AH205: AA | AI205: 3.73e-002 | AJ205: =H205+100*O205 -> 175.45999999999998 | AK205: 160.5 | AL205: 164 | AM205: 62.5 | AN205: 144 | AO205: -8.199999999999999e-002 | AP205: 17 | AQ205: 瑞达转债!
A206: 205 | B206: 127018 | C206: 本钢转债! | D206: 761 | E206: 本钢板材 | F206: 钢铁 | G206: 炼钢 | H206: 123.628 | I206: -1.2500000000000001e-002 | J206: 6.7000000000000002e-003 | K206: 4.39 | L206: -1.5700000000000002e-002 | M206: 128 | N206: 4.55 | O206: 0.28100000000000003 | P206: 96.48 | Q206: 已到 | R206: 4.43年 | S206: 2.43年 | T206: 56.3 | U206: 29 | V206: 4.0000000000000001e-003 | W206: 0.312 | X206: 0.30099999999999999 | Y206: 180 | Z206: 0.79 | AA206: 8.1000000000000013e-003 | AB206: -2.3e-003 | AC206: -5.8700000000000002e-002 | AD206: -6.2600000000000003e-002 | AE206: 98.05 | AF206: 112.6 | AG206: 0.37 | AH206: AAA | AI206: 3.0299999999999997e-002 | AJ206: =H206+100*O206 -> 151.72800000000001 | AK206: 150.8 | AL206: 79 | AM206: 38.2 | AN206: 12 | AO206: 5.0000000000000001e-003 | AP206: 59 | AQ206: 本钢转债!
A207: 206 | B207: 113589 | C207: 天创转债! | D207: 603608 | E207: 天创时尚 | F207: 服装纺织 | G207: 鞋服行业 | H207: 105.66 | I207: -4.3e-003 | J207: 4.0999999999999995e-003 | K207: 6.11 | L207: -4.8999999999999998e-003 | M207: 114.9 | N207: 12.29 | O207: 1.1299999999999999 | P207: 49.72 | Q207: 已到 | R207: 4.42年 | S207: 2.42年 | T207: 6 | U207: 7.1 | V207: 1.1000000000000001e-002 | W207: 0.22899999999999998 | X207: 0.114 | Y207: 26 | Z207: 1.66 | AA207: 1.9599999999999999e-002 | AB207: 1.3300000000000001e-002 | AC207: -8.3999999999999995e-003 | AD207: -1.09e-002 | AE207: 94.15 | AF207: 98.06 | AG207: 0.04 | AH207: AA | AI207: 3.73e-002 | AJ207: =H207+100*O207 -> 218.65999999999997 | AK207: 161.6 | AL207: 179 | AM207: 63.5 | AN207: 155 | AO207: -6.5000000000000002e-002 | AP207: 43 | AQ207: 天创转债!
A208: 207 | B208: 123056 | C208: 雪榕转债! | D208: 300511 | E208: 雪榕生物 | F208: 农业 | G208: 种植业 | H208: 114.49 | I208: -1.2199999999999999e-002 | J208: 7.9000000000000008e-003 | K208: 7.58 | L208: -2.1899999999999999e-002 | M208: 120.7 | N208: 11.77 | O208: 0.77800000000000002 | P208: 64.4 | Q208: 已到 | R208: 4.42年 | S208: 2.42年 | T208: 5.84 | U208: 27 | V208: 4.0999999999999995e-002 | W208: 0.17399999999999999 | X208: 0.11199999999999999 | Y208: 33 | Z208: 1.87 | AA208: 1.23e-002 | AB208: 4.0999999999999995e-003 | AC208: -3.8199999999999998e-002 | AD208: -4.07e-002 | AE208: 89.64 | AF208: 94.5 | AG208: 0.2 | AH208: AA- | AI208: 5.8299999999999998e-002 | AJ208: =H208+100*O208 -> 192.28999999999999 | AK208: 164.6 | AL208: 205 | AM208: 70.1 | AN208: 208 | AO208: -5.0999999999999997e-002 | AP208: 22 | AQ208: 雪榕转债!
A209: 208 | B209: 113588 | C209: 润达转债! | D209: 603108 | E209: 润达医疗 | F209: 医药 | G209: 医疗器械 | H209: 123.21 | I209: -2.2799999999999997e-002 | J209: -1.2699999999999999e-002 | K209: 12.46 | L209: -7.4299999999999991e-002 | M209: 113.9 | N209: 13.25 | O209: 0.31 | P209: 94.04 | Q209: 已到 | R209: 4.40年 | S209: 2.40年 | T209: 5.5 | U209: 36 | V209: 5.2999999999999999e-002 | W209: 7.5999999999999998e-002 | X209: 7.2000000000000008e-002 | Y209: 72 | Z209: 2.19 | AA209: -1.8100000000000002e-002 | AB209: -2.3599999999999999e-002 | AC209: -6.6600000000000006e-002 | AD209: -6.88e-002 | AE209: 94.21 | AF209: 97.28 | AG209: 0.48 | AH209: AA | AI209: 3.73e-002 | AJ209: =H209+100*O209 -> 154.20999999999998 | AK209: 152.4 | AL209: 100 | AM209: 55.1 | AN209: 88 | AO209: -8.5999999999999993e-002 | AP209: 11 | AQ209: 润达转债!
A210: 209 | B210: 128114 | C210: 正邦转债! | D210: 2157 | E210: 正邦科技 | F210: 农业 | G210: 畜牧业 | H210: 111.442 | I210: -8.1000000000000013e-003 | J210: 1.2999999999999999e-003 | K210: 9.33 | L210: -5.1799999999999999e-002 | M210: 114.9 | N210: 14.77 | O210: 0.76400000000000001 | P210: 63.17 | Q210: 已到 | R210: 4.40年 | S210: 2.40年 | T210: 16 | U210: 63 | V210: 3.5000000000000003e-002 | W210: 5.4000000000000006e-002 | X210: 3.4000000000000002e-002 | Y210: 294 | Z210: 2.26 | AA210: 7.0999999999999995e-003 | AB210: 1.e-003 | AC210: -2.8999999999999998e-002 | AD210: -3.15e-002 | AE210: 94.21 | AF210: 98.13 | AG210: 0.13 | AH210: AA | AI210: 3.73e-002 | AJ210: =H210+100*O210 -> 187.84199999999998 | AK210: 159.7 | AL210: 156 | AM210: 61.6 | AN210: 134 | AO210: -6.5000000000000002e-002 | AP210: 25 | AQ210: 正邦转债!
A211: 210 | B211: 128113 | C211: 比音转债! | D211: 2832 | E211: 比音勒芬 | F211: 服装纺织 | G211: 服装行业 | H211: 171.788 | I211: 5.4000000000000003e-003 | J211: -2.1400000000000002e-002 | K211: 24 | L211: -1.7600000000000001e-002 | M211: 116.9 | N211: 14.6 | O211: 4.4999999999999998e-002 | P211: 164.38 | Q211: 已到 | R211: 4.39年 | S211: 2.39年 | T211: 2.98 | U211: 21 | V211: 4.0000000000000001e-002 | W211: 2.3e-002 | X211: 3.7000000000000005e-002 | Y211: 132 | Z211: 4.46 | AA211: -8.5299999999999987e-002 | AB211: -9.1199999999999989e-002 | AC211: -0.127 | AD211: -0.129 | AE211: 94.23 | AF211: 99.86 | AG211: 0.91 | AH211: AA | AI211: 3.73e-002 | AJ211: =H211+100*O211 -> 176.28800000000001 | AK211: 179.2 | AL211: 286 | AM211: 79.3 | AN211: 259 | AO211: -3.7000000000000005e-002 | AP211: 8 | AQ211: 比音转债!
A212: 211 | B212: 128111 | C212: 中矿转债! | D212: 2738 | E212: 中矿资源 | F212: 有色金属 | G212: 有色行业 | H212: 396.703 | I212: 8.3999999999999995e-003 | J212: 1.6399999999999998e-002 | K212: 57.02 | L212: 2.52e-002 | M212: 124.2 | N212: 15.45 | O212: 7.4999999999999997e-002 | P212: 369.06 | Q212: 已到 | R212: 4.38年 | S212: 2.38年 | T212: 1.45 | U212: 502 | V212: 0.8590000000000001 | W212: 8.0000000000000002e-003 | X212: 2.8999999999999998e-002 | Y212: 185 | Z212: 4.96 | AA212: -0.23600000000000002 | AB212: -0.24299999999999999 | AC212: -0.24299999999999999 | AD212: -0.24299999999999999 | AE212: 90.26 | AF212: 97.48 | AG212: 0.98 | AH212: AA- | AI212: 5.8299999999999998e-002 | AJ212: =H212+100*O212 -> 404.20299999999997 | AK212: 424.3 | AL212: 380 | AM212: 326.9 | AN212: 380 | AO212: -6.9000000000000006e-002 | AP212: 10 | AQ212: 中矿转债!
A213: 212 | B213: 123054 | C213: 思特转债!! | D213: 300608 | E213: 思特奇 | F213: 通信互联 | G213: 通信设备 | H213: 145.122 | I213: 7.8000000000000005e-003 | J213: -6.8999999999999999e-003 | K213: 15.8 | L213: 1.2999999999999999e-003 | M213: 121.2 | N213: 12.63 | O213: 0.16 | P213: 125.1 | Q213: 已到 | R213: 4.38年 | S213: 2.38年 | T213: 2.07 | U213: 584 | V213: 1.9199999999999999 | W213: 6.3e-002 | X213: 7.8e-002 | Y213: 33 | Z213: 3.98 | AA213: -4.1200000000000001e-002 | AB213: -4.8899999999999999e-002 | AC213: -0.122 | AD213: -0.125 | AE213: 90.28 | AF213: 95.15 | AG213: 0.74 | AH213: AA- | AI213: 5.8299999999999998e-002 | AJ213: =H213+100*O213 -> 161.12200000000001 | AK213: 165.1 | AL213: 208 | AM213: 70 | AN213: 205 | AO213: 6.3e-002 | AP213: 18 | AQ213: 思特转债!!
A214: 213 | B214: 113585 | C214: 寿仙转债! | D214: 603896 | E214: 寿仙谷 | F214: 医药 | G214: 中药 | H214: 191.16 | I214: -6.7000000000000002e-003 | J214: -2.9999999999999997e-004 | K214: 51.91 | L214: -7.4999999999999997e-003 | M214: 117.3 | N214: 28.38 | O214: 4.4999999999999998e-002 | P214: 182.91 | Q214: 已到 | R214: 4.38年 | S214: 2.38年 | T214: 1.01 | U214: 69 | V214: 0.36099999999999999 | W214: 1.3000000000000001e-002 | X214: 2.3e-002 | Y214: 79 | Z214: 5.33 | AA214: -0.107 | AB214: -0.113 | AC214: -0.14899999999999999 | AD214: -0.14999999999999999 | AE214: 89.87 | AF214: 92.06 | AG214: 0.94 | AH214: AA- | AI214: 5.8299999999999998e-002 | AJ214: =H214+100*O214 -> 195.66 | AK214: 199.4 | AL214: 334 | AM214: 107.3 | AN214: 333 | AO214: -8.199999999999999e-002 | AP214: 18 | AQ214: 寿仙转债!
A215: 214 | B215: 123052 | C215: 飞鹿转债! | D215: 300665 | E215: 飞鹿股份 | F215: 化工 | G215: 化工 | H215: 151.15 | I215: 7.3000000000000001e-003 | J215: 5.4000000000000003e-003 | K215: 9.96 | L215: 1.6299999999999999e-002 | M215: 126.8 | N215: 7.05 | O215: 7.0000000000000007e-002 | P215: 141.28 | Q215: 已到 | R215: 4.37年 | S215: 2.37年 | T215: 1.5 | U215: 44 | V215: 0.193 | W215: 8.6999999999999994e-002 | X215: 0.12300000000000001 | Y215: 17 | Z215: 3.38 | AA215: -4.0399999999999998e-002 | AB215: -4.99e-002 | AC215: -0.13500000000000001 | AD215: -0.10099999999999999 | AE215: 88.58 | AF215: 95.41 | AG215: 0.78 | AH215: A+ | AI215: 6.93e-002 | AJ215: =H215+100*O215 -> 158.15000000000001 | AK215: 161 | AL215: 172 | AM215: 65.6 | AN215: 166 | AO215: 2.e-003 | AP215: 24 | AQ215: 飞鹿转债!
A216: 215 | B216: 113584 | C216: 家悦转债! | D216: 603708 | E216: 家家悦 | F216: 商业零售 | G216: 超市 | H216: 108.89 | I216: -3.8e-003 | J216: 3.8e-003 | K216: 15.8 | L216: -1.2999999999999999e-003 | M216: 114.9 | N216: 37.53 | O216: 1.5900000000000001 | P216: 42.1 | Q216: 已到 | R216: 4.37年 | S216: 2.37年 | T216: 6.45 | U216: 5 | V216: 6.9999999999999993e-003 | W216: 6.7000000000000004e-002 | X216: 2.7999999999999997e-002 | Y216: 96 | Z216: 3.74 | AA216: 1.26e-002 | AB216: 6.4000000000000003e-003 | AC216: -2.0400000000000001e-002 | AD216: -2.29e-002 | AE216: 94.33 | AF216: 98.25 | AG216: 0.01 | AH216: AA | AI216: 3.73e-002 | AJ216: =H216+100*O216 -> 267.88999999999999 | AK216: 175.7 | AL216: 274 | AM216: 77.4 | AN216: 251 | AO216: -4.2000000000000003e-002 | AP216: 20 | AQ216: 家悦转债!
A217: 216 | B217: 128109 | C217: 楚江转债! | D217: 2171 | E217: 楚江新材 | F217: 有色金属 | G217: 铜金属 | H217: 160.01 | I217: -1.23e-002 | J217: -1.18e-002 | K217: 10.88 | L217: -3.2000000000000001e-002 | M217: 114.9 | N217: 8.63 | O217: 0.26899999999999996 | P217: 126.07 | Q217: 已到 | R217: 4.36年 | S217: 2.36年 | T217: 18.2 | U217: 21 | V217: 6.9999999999999993e-003 | W217: 0.126 | X217: 0.158 | Y217: 145 | Z217: 2.48 | AA217: -7.4400000000000008e-002 | AB217: -7.980000000000001e-002 | AC217: -0.114 | AD217: -0.11599999999999999 | AE217: 94.33 | AF217: 98.26 | AG217: 0.75 | AH217: AA | AI217: 3.73e-002 | AJ217: =H217+100*O217 -> 186.91 | AK217: 193.9 | AL217: 322 | AM217: 95.7 | AN217: 310 | AO217: -0.106 | AP217: 5 | AQ217: 楚江转债!
A218: 217 | B218: 127017 | C218: 万青转债 | D218: 789 | E218: 万年青 | F218: 建筑 | G218: 水泥 | H218: 130 | I218: 0. | J218: -1.1299999999999999e-002 | K218: 12.35 | L218: -2.9100000000000001e-002 | M218: 118 | N218: 13.46 | O218: 0.41700000000000004 | P218: 91.75 | Q218: 已到 | R218: 4.36年 | S218: 2.36年 | T218: 10 | U218: 7.3 | V218: 6.0000000000000001e-003 | W218: 0.10199999999999999 | X218: 9.3000000000000013e-002 | Y218: 98 | Z218: 1.44 | AA218: -2.2400000000000003e-002 | AB218: -2.9300000000000003e-002 | AC218: -8.7499999999999994e-002 | AD218: -8.9700000000000002e-002 | AE218: 95.43 | AF218: 103.01 | AG218: 0.39 | AH218: AA+ | AI218: 3.2300000000000002e-002 | AJ218: =H218+100*O218 -> 171.69999999999999 | AK218: 168.2 | AL218: 232 | AM218: 65.2 | AN218: 164 | AO218: -1.3000000000000001e-002 | AP218: 7 | AQ218: 万青转债
A219: 218 | B219: 128108 | C219: 蓝帆转债!! | D219: 2382 | E219: 蓝帆医疗 | F219: 医药 | G219: 医疗器械 | H219: 118.063 | I219: -5.4000000000000003e-003 | J219: -7.0999999999999995e-003 | K219: 15.98 | L219: -3.0299999999999997e-002 | M219: 112.9 | N219: 18.24 | O219: 0.34799999999999998 | P219: 87.61 | Q219: 已到 | R219: 4.35年 | S219: 3.35年 | T219: 15.2 | U219: 23 | V219: 1.3000000000000001e-002 | W219: 9.5000000000000001e-002 | X219: 8.3000000000000004e-002 | Y219: 161 | Z219: 1.26 | AA219: -1.0500000000000001e-002 | AB219: -1.5800000000000002e-002 | AC219: -3.27e-002 | AD219: -3.5400000000000001e-002 | AE219: 92.73 | AF219: 96.62 | AG219: 0.41 | AH219: AA | AI219: 3.73e-002 | AJ219: =H219+100*O219 -> 152.863 | AK219: 148.5 | AL219: 59 | AM219: 51.9 | AN219: 70 | AO219: -3.7000000000000005e-002 | AP219: 29 | AQ219: 蓝帆转债!!
A220: 219 | B220: 113582 | C220: 火炬转债! | D220: 603678 | E220: 火炬电子 | F220: 电子 | G220: 元器件制 | H220: 326.01 | I220: 8.3000000000000001e-003 | J220: 4.1999999999999997e-003 | K220: 62.6 | L220: 1.2800000000000001e-002 | M220: 114.9 | N220: 24.99 | O220: 0.30099999999999999 | P220: 250.5 | Q220: 已到 | R220: 4.34年 | S220: 2.34年 | T220: 4.18 | U220: 88 | V220: 6.5000000000000002e-002 | W220: 1.4999999999999999e-002 | X220: 3.6000000000000004e-002 | Y220: 288 | Z220: 6.49 | AA220: -0.21600000000000003 | AB220: -0.221 | AC220: -0.22899999999999998 | AD220: -0.23000000000000001 | AE220: 94.41 | AF220: 98.34 | AG220: 0.98 | AH220: AA | AI220: 3.73e-002 | AJ220: =H220+100*O220 -> 356.11000000000001 | AK220: 401.5 | AL220: 377 | AM220: 303.2 | AN220: 377 | AO220: -0.10300000000000001 | AP220: 5 | AQ220: 火炬转债!
A221: 220 | B221: 113579 | C221: 健友转债! | D221: 603707 | E221: 健友股份 | F221: 医药 | G221: 原料药 | H221: 136.75 | I221: -7.8000000000000005e-003 | J221: -2.5000000000000001e-003 | K221: 37.04 | L221: -1.49e-002 | M221: 113.9 | N221: 32.2 | O221: 0.18899999999999997 | P221: 115.03 | Q221: 已到 | R221: 4.25年 | S221: 2.25年 | T221: 5.03 | U221: 18 | V221: 2.6000000000000002e-002 | W221: 1.1000000000000001e-002 | X221: 1.3000000000000001e-002 | Y221: 461 | Z221: 10.5 | AA221: -4.2999999999999997e-002 | AB221: -4.8399999999999999e-002 | AC221: -0.11 | AD221: -0.11199999999999999 | AE221: 94.73 | AF221: 97.82 | AG221: 0.69 | AH221: AA | AI221: 3.73e-002 | AJ221: =H221+100*O221 -> 155.65000000000001 | AK221: 158.5 | AL221: 151 | AM221: 60.6 | AN221: 129 | AO221: -4.4000000000000004e-002 | AP221: 9 | AQ221: 健友转债!
A222: 221 | B222: 128107 | C222: 交科转债 | D222: 2061 | E222: 浙江交科 | F222: 建筑 | G222: 建筑工程 | H222: 130.299 | I222: -3.0999999999999999e-003 | J222: -7.4000000000000003e-003 | K222: 5.82 | L222: -1.6899999999999998e-002 | M222: 114.9 | N222: 5.24 | O222: 0.17300000000000001 | P222: 111.07 | Q222: 已到 | R222: 4.25年 | S222: 2.25年 | T222: 25 | U222: 44 | V222: 1.3999999999999999e-002 | W222: 0.312 | X222: 0.34700000000000003 | Y222: 80 | Z222: 0.89 | AA222: -2.98e-002 | AB222: -3.5699999999999996e-002 | AC222: -9.2100000000000015e-002 | AD222: -9.4499999999999987e-002 | AE222: 95.84 | AF222: 100.69 | AG222: 0.62 | AH222: AA+ | AI222: 3.2300000000000002e-002 | AJ222: =H222+100*O222 -> 147.59900000000002 | AK222: 149.5 | AL222: 70 | AM222: 48.8 | AN222: 48 | AO222: 1.6e-002 | AP222: 20 | AQ222: 交科转债
A223: 222 | B223: 113578 | C223: 全筑转债! | D223: 603030 | E223: 全筑股份 | F223: 建筑 | G223: 装饰工程 | H223: 107.5 | I223: -8.9999999999999998e-004 | J223: 1.8e-003 | K223: 3.61 | L223: 5.6000000000000008e-003 | M223: 117.9 | N223: 5.25 | O223: 0.56299999999999994 | P223: 68.76 | Q223: 已到 | R223: 4.24年 | S223: 2.24年 | T223: 3.84 | U223: 6.1 | V223: 1.4999999999999999e-002 | W223: 0.183 | X223: 0.126 | Y223: 21 | Z223: 0.96 | AA223: 2.2499999999999999e-002 | AB223: 1.49e-002 | AC223: -1.6200000000000003e-002 | AD223: -1.8799999999999997e-002 | AE223: 94.76 | AF223: 101.27 | AG223: 0.16 | AH223: AA | AI223: 3.73e-002 | AJ223: =H223+100*O223 -> 163.80000000000001 | AK223: 146.2 | AL223: 42 | AM223: 45 | AN223: 32 | AO223: -2.5000000000000001e-002 | AP223: 36 | AQ223: 全筑转债!
A224: 223 | B224: 113573 | C224: 纵横转债! | D224: 603602 | E224: 纵横通信 | F224: 通信互联 | G224: 通信设备 | H224: 114.6 | I224: -5.1999999999999998e-003 | J224: 5.4000000000000003e-003 | K224: 12.39 | L224: 8.0000000000000004e-004 | M224: 124.2 | N224: 18.78 | O224: 0.73699999999999999 | P224: 65.97 | Q224: 已到 | R224: 4.23年 | S224: 2.23年 | T224: 2.7 | U224: 17 | V224: 5.5e-002 | W224: 0.107 | X224: 7.0000000000000007e-002 | Y224: 25 | Z224: 3.55 | AA224: 1.9699999999999999e-002 | AB224: 9.8999999999999991e-003 | AC224: -3.9599999999999996e-002 | AD224: -4.2699999999999995e-002 | AE224: 88.84 | AF224: 94.22 | AG224: 0.23 | AH224: A+ | AI224: 6.93e-002 | AJ224: =H224+100*O224 -> 188.30000000000001 | AK224: 163.2 | AL224: 193 | AM224: 69 | AN224: 200 | AO224: 0.13300000000000001 | AP224: 31 | AQ224: 纵横转债!
A225: 224 | B225: 113577 | C225: 春秋转债! | D225: 603890 | E225: 春秋电子 | F225: 电子 | G225: 电子产品 | H225: 150.2 | I225: -3.5900000000000001e-002 | J225: 3.8e-003 | K225: 13.47 | L225: -4.3299999999999998e-002 | M225: 117.7 | N225: 10.85 | O225: 0.20999999999999999 | P225: 124.15 | Q225: 已到 | R225: 4.22年 | S225: 2.22年 | T225: 1.78 | U225: 81 | V225: 0.29999999999999999 | W225: 2.9999999999999999e-002 | X225: 3.7000000000000005e-002 | Y225: 59 | Z225: 2.38 | AA225: -5.7300000000000004e-002 | AB225: -6.3899999999999998e-002 | AC225: -0.10800000000000001 | AD225: -0.11 | AE225: 90.63 | AF225: 93.18 | AG225: 0.74 | AH225: AA- | AI225: 5.8299999999999998e-002 | AJ225: =H225+100*O225 -> 171.19999999999999 | AK225: 176.3 | AL225: 278 | AM225: 83.1 | AN225: 273 | AO225: 1.2e-002 | AP225: 15 | AQ225: 春秋转债!
A226: 225 | B226: 123050 | C226: 聚飞转债! | D226: 300303 | E226: 聚飞光电 | F226: 电子 | G226: LED制 | H226: 140.498 | I226: 1.9e-003 | J226: -1.2800000000000001e-002 | K226: 5.81 | L226: -1.6899999999999998e-002 | M226: 123.8 | N226: 5.08 | O226: 0.22800000000000001 | P226: 114.37 | Q226: 已到 | R226: 4.22年 | S226: 2.22年 | T226: 3.75 | U226: 14 | V226: 2.6000000000000002e-002 | W226: 4.8000000000000001e-002 | X226: 5.5e-002 | Y226: 78 | Z226: 2.81 | AA226: -3.0099999999999998e-002 | AB226: -3.9100000000000003e-002 | AC226: -0.12 | AD226: -0.122 | AE226: 90.73 | AF226: 98.01 | AG226: 0.64 | AH226: AA- | AI226: 5.8299999999999998e-002 | AJ226: =H226+100*O226 -> 163.298 | AK226: 166.6 | AL226: 223 | AM226: 68.6 | AN226: 195 | AO226: -7.0000000000000007e-002 | AP226: 12 | AQ226: 聚飞转债!
A227: 226 | B227: 123049 | C227: 维尔转债! | D227: 300190 | E227: 维尔利 | F227: 城市公用 | G227: 三废处理 | H227: 116.34 | I227: -1.24e-002 | J227: 9.0000000000000011e-003 | K227: 5.82 | L227: -1.0200000000000001e-002 | M227: 124.3 | N227: 7.38 | O227: 0.47499999999999998 | P227: 78.86 | Q227: 已到 | R227: 4.22年 | S227: 2.22年 | T227: 9.17 | U227: 4.4 | V227: 4.0000000000000001e-003 | W227: 0.20199999999999999 | X227: 0.159 | Y227: 45 | Z227: 1.04 | AA227: 1.6200000000000003e-002 | AB227: 6.4000000000000003e-003 | AC227: -4.5499999999999999e-002 | AD227: -4.87e-002 | AE227: 91.19 | AF227: 98.47 | AG227: 0.33 | AH227: AA- | AI227: 5.8299999999999998e-002 | AJ227: =H227+100*O227 -> 163.84 | AK227: 153.8 | AL227: 113 | AM227: 55.3 | AN227: 90 | AO227: -4.2000000000000003e-002 | AP227: 20 | AQ227: 维尔转债!
A228: 227 | B228: 110070 | C228: 凌钢转债! | D228: 600231 | E228: 凌钢股份 | F228: 钢铁 | G228: 炼钢 | H228: 129.46 | I228: -7.4000000000000003e-003 | J228: -3.4999999999999996e-003 | K228: 2.66 | L228: -2.2099999999999998e-002 | M228: 117.4 | N228: 2.69 | O228: 0.309 | P228: 98.88 | Q228: 已到 | R228: 4.22年 | S228: 2.22年 | T228: 2.17 | U228: 12 | V228: 4.2999999999999997e-002 | W228: 2.8999999999999998e-002 | X228: 2.7999999999999997e-002 | Y228: 76 | Z228: 0.81 | AA228: -2.3399999999999997e-002 | AB228: -3.04e-002 | AC228: -8.9399999999999993e-002 | AD228: -9.1999999999999998e-002 | AE228: 95.15 | AF228: 100.95 | AG228: 0.49 | AH228: AA | AI228: 3.73e-002 | AJ228: =H228+100*O228 -> 160.36000000000001 | AK228: 160 | AL228: 158 | AM228: 59.1 | AN228: 118 | AO228: -2.5000000000000001e-002 | AP228: 21 | AQ228: 凌钢转债!
A229: 228 | B229: 128106 | C229: 华统转债! | D229: 2840 | E229: 华统股份 | F229: 农业 | G229: 农产品加 | H229: 195.5 | I229: -1.7600000000000001e-002 | J229: 6.6e-003 | K229: 17.99 | L229: -1.15e-002 | M229: 112.9 | N229: 9.37 | O229: 1.8000000000000002e-002 | P229: 192 | Q229: 已到 | R229: 4.21年 | S229: 2.21年 | T229: 4.06 | U229: 365 | V229: 0.46000000000000002 | W229: 4.9000000000000002e-002 | X229: 9.5000000000000001e-002 | Y229: 82 | Z229: 4.77 | AA229: -0.124 | AB229: -0.129 | AC229: -0.16800000000000001 | AD229: -0.16899999999999998 | AE229: 94.86 | AF229: 97.09 | AG229: 0.96 | AH229: AA | AI229: 3.73e-002 | AJ229: =H229+100*O229 -> 197.30000000000001 | AK229: 199 | AL229: 332 | AM229: 101.9 | AN229: 325 | AO229: 3.7999999999999999e-002 | AP229: 13 | AQ229: 华统转债!
A230: 229 | B230: 123048 | C230: 应急转债! | D230: 300527 | E230: 中船应急 | F230: 机械装备 | G230: 专用设备 | H230: 136.315 | I230: -1.44e-002 | J230: -3.5999999999999999e-003 | K230: 9.26 | L230: -3.1400000000000004e-002 | M230: 112.8 | N230: 8.88 | O230: 0.307 | P230: 104.28 | Q230: 已到 | R230: 4.21年 | S230: 2.21年 | T230: 3.79 | U230: 34 | V230: 6.5000000000000002e-002 | W230: 4.2999999999999997e-002 | X230: 4.4000000000000004e-002 | Y230: 89 | Z230: 3.39 | AA230: -4.4800000000000006e-002 | AB230: -4.99e-002 | AC230: -0.11 | AD230: -0.11199999999999999 | AE230: 95.84 | AF230: 98.94 | AG230: 0.57 | AH230: AA+ | AI230: 3.2300000000000002e-002 | AJ230: =H230+100*O230 -> 167.01499999999999 | AK230: 168.4 | AL230: 235 | AM230: 69.4 | AN230: 201 | AO230: -9.1999999999999998e-002 | AP230: 15 | AQ230: 应急转债!
A231: 230 | B231: 113576 | C231: 起步转债!! | D231: 603557 | E231: ST起步 | F231: 服装纺织 | G231: 鞋服行业 | H231: 119.24 | I231: -7.4000000000000003e-003 | J231: 6.7000000000000002e-003 | K231: 4.69 | L231: -1.47e-002 | M231: 121.3 | N231: 10.55 | O231: 1.6799999999999999 | P231: 44.45 | Q231: 已到 | R231: 4.21年 | S231: 2.21年 | T231: 2.66 | U231: 797 | V231: 2.46 | W231: 0.114 | X231: 5.0999999999999997e-002 | Y231: 23 | Z231: 1.55 | AA231: 4.1999999999999997e-003 | AB231: -4.5000000000000005e-003 | AC231: -5.5599999999999997e-002 | AD231: -5.8700000000000002e-002 | AE231: 83.45 | AF231: 82.33 | AG231: 0.05 | AH231: BBB+ | AI231: 9.9299999999999999e-002 | AJ231: =H231+100*O231 -> 287.24000000000001 | AK231: 194 | AL231: 324 | AM231: 110.6 | AN231: 337 | AO231: -0.121 | AP231: 34 | AQ231: 起步转债!!
A232: 231 | B232: 128105 | C232: 长集转债! | D232: 2616 | E232: 长青集团 | F232: 城市公用 | G232: 三废处理 | H232: 112 | I232: 0. | J232: -2.9999999999999997e-004 | K232: 5.48 | L232: -1.8e-003 | M232: 114.9 | N232: 7.91 | O232: 0.61699999999999999 | P232: 69.28 | Q232: 已到 | R232: 4.21年 | S232: 2.21年 | T232: 8 | U232: 9.8 | V232: 1.1000000000000001e-002 | W232: 0.19699999999999998 | X232: 0.13600000000000001 | Y232: 41 | Z232: 1.63 | AA232: 6.1999999999999998e-003 | AB232: -2.0000000000000001e-004 | AC232: -3.3300000000000003e-002 | AD232: -3.6000000000000004e-002 | AE232: 94.87 | AF232: 98.82 | AG232: 0.18 | AH232: AA | AI232: 3.73e-002 | AJ232: =H232+100*O232 -> 173.69999999999999 | AK232: 154.7 | AL232: 120 | AM232: 55.9 | AN232: 95 | AO232: -7.9000000000000001e-002 | AP232: 22 | AQ232: 长集转债!
A233: 232 | B233: 113575 | C233: 东时转债!! | D233: 603377 | E233: 东方时尚 | F233: 其他 | G233: 其他 | H233: 127.62 | I233: -5.4000000000000003e-003 | J233: 2.3999999999999998e-003 | K233: 8.26 | L233: -1.78e-002 | M233: 113.1 | N233: 12.15 | O233: 0.877 | P233: 67.98 | Q233: 已到 | R233: 4.21年 | S233: 2.21年 | T233: 0.98 | U233: 17 | V233: 0.13100000000000001 | W233: 1.6e-002 | X233: 1.1000000000000001e-002 | Y233: 60 | Z233: 2.77 | AA233: -2.8900000000000002e-002 | AB233: -3.4200000000000001e-002 | AC233: -8.5299999999999987e-002 | AD233: -8.77e-002 | AE233: 94.9 | AF233: 97.28 | AG233: 0.17 | AH233: AA | AI233: 3.73e-002 | AJ233: =H233+100*O233 -> 215.31999999999999 | AK233: 187.3 | AL233: 310 | AM233: 90 | AN233: 298 | AO233: -6.7000000000000004e-002 | AP233: 14 | AQ233: 东时转债!!
A234: 233 | B234: 127016 | C234: 鲁泰转债! | D234: 726 | E234: 鲁 泰Ａ | F234: 服装纺织 | G234: 纺织行业 | H234: 116.5 | I234: -4.0999999999999995e-003 | J234: 2.0000000000000001e-004 | K234: 6.7 | L234: -1.7600000000000001e-002 | M234: 115.9 | N234: 8.71 | O234: 0.51500000000000001 | P234: 76.92 | Q234: 已到 | R234: 4.21年 | S234: 2.21年 | T234: 14 | U234: 16 | V234: 1.e-002 | W234: 0.23699999999999999 | X234: 0.182 | Y234: 59 | Z234: 0.75 | AA234: -1.2999999999999999e-003 | AB234: -7.9000000000000008e-003 | AC234: -4.9400000000000006e-002 | AD234: -5.1900000000000002e-002 | AE234: 95.95 | AF234: 101.67 | AG234: 0.22 | AH234: AA+ | AI234: 3.2300000000000002e-002 | AJ234: =H234+100*O234 -> 168. | AK234: 156.1 | AL234: 127 | AM234: 54.4 | AN234: 81 | AO234: 6.0000000000000001e-003 | AP234: 23 | AQ234: 鲁泰转债!
A235: 234 | B235: 113033 | C235: 利群转债! | D235: 601366 | E235: 利群股份 | F235: 商业零售 | G235: 商场 | H235: 114.99 | I235: 7.4000000000000003e-003 | J235: 2.9999999999999997e-004 | K235: 6.53 | L235: 1.7100000000000001e-002 | M235: 114.9 | N235: 7.01 | O235: 0.23399999999999999 | P235: 93.15 | Q235: 已到 | R235: 4.19年 | S235: 2.19年 | T235: 18 | U235: 52 | V235: 2.5000000000000001e-002 | W235: 0.32000000000000001 | X235: 0.29799999999999999 | Y235: 56 | Z235: 1.28 | AA235: -2.0000000000000001e-004 | AB235: -6.6e-003 | AC235: -4.4500000000000005e-002 | AD235: -4.7100000000000003e-002 | AE235: 94.94 | AF235: 98.89 | AG235: 0.45 | AH235: AA | AI235: 3.73e-002 | AJ235: =H235+100*O235 -> 138.38999999999999 | AK235: 136.8 | AL235: 7 | AM235: 37.9 | AN235: 11 | AO235: 4.7e-002 | AP235: 71 | AQ235: 利群转债!
A236: 235 | B236: 113574 | C236: 华体转债! | D236: 603679 | E236: 华体科技 | F236: 城市公用 | G236: 城市公用 | H236: 114.45 | I236: -3.8e-003 | J236: 3.3e-003 | K236: 13.4 | L236: -4.7599999999999996e-002 | M236: 115.9 | N236: 33.91 | O236: 1.8999999999999999 | P236: 39.52 | Q236: 已到 | R236: 4.19年 | S236: 2.19年 | T236: 2.09 | U236: 4.8 | V236: 2.e-002 | W236: 0.11 | X236: 4.2999999999999997e-002 | Y236: 19 | Z236: 2.54 | AA236: 3.0999999999999999e-003 | AB236: -3.7000000000000002e-003 | AC236: -4.0000000000000001e-002 | AD236: -4.3200000000000002e-002 | AE236: 89.07 | AF236: 88.23 | AG236: 0.01 | AH236: A+ | AI236: 6.93e-002 | AJ236: =H236+100*O236 -> 304.44999999999999 | AK236: 189.4 | AL236: 313 | AM236: 100.3 | AN236: 321 | AO236: -5.0999999999999997e-002 | AP236: 21 | AQ236: 华体转债!
A237: 236 | B237: 128103 | C237: 同德转债! | D237: 2360 | E237: 同德化工 | F237: 化工 | G237: 化工 | H237: 182 | I237: 1.1000000000000001e-003 | J237: -3.2000000000000002e-003 | K237: 8.87 | L237: -2.2000000000000001e-003 | M237: 121.3 | N237: 5.08 | O237: 4.2000000000000003e-002 | P237: 174.61 | Q237: 已到 | R237: 4.17年 | S237: 2.17年 | T237: 0.88 | U237: 65 | V237: 0.40399999999999997 | W237: 2.5000000000000001e-002 | X237: 4.2999999999999997e-002 | Y237: 36 | Z237: 2.65 | AA237: -9.4600000000000004e-002 | AB237: -0.10199999999999999 | AC237: -0.156 | AD237: -0.157 | AE237: 89.27 | AF237: 92.4 | AG237: 0.91 | AH237: A+ | AI237: 6.93e-002 | AJ237: =H237+100*O237 -> 186.19999999999999 | AK237: 189.4 | AL237: 314 | AM237: 97 | AN237: 315 | AO237: -4.2000000000000003e-002 | AP237: 18 | AQ237: 同德转债!
A238: 237 | B238: 110068 | C238: 龙净转债! | D238: 600388 | E238: 龙净环保 | F238: 城市公用 | G238: 三废处理 | H238: 112.96 | I238: -1.4499999999999999e-002 | J238: 9.5999999999999992e-003 | K238: 8.31 | L238: -1.89e-002 | M238: 114.8 | N238: 10.55 | O238: 0.434 | P238: 78.77 | Q238: 已到 | R238: 4.17年 | S238: 2.17年 | T238: 20 | U238: 12 | V238: 5.0000000000000001e-003 | W238: 0.22500000000000001 | X238: 0.17699999999999999 | Y238: 89 | Z238: 1.38 | AA238: 4.0000000000000001e-003 | AB238: -2.3999999999999998e-003 | AC238: -3.7900000000000003e-002 | AD238: -4.0500000000000001e-002 | AE238: 95.99 | AF238: 100.84 | AG238: 0.26 | AH238: AA+ | AI238: 3.2300000000000002e-002 | AJ238: =H238+100*O238 -> 156.35999999999999 | AK238: 147.2 | AL238: 47 | AM238: 46.3 | AN238: 37 | AO238: -3.3000000000000002e-002 | AP238: 41 | AQ238: 龙净转债!
A239: 238 | B239: 123046 | C239: 天铁转债! | D239: 300587 | E239: 天铁股份 | F239: 铁路 | G239: 铁路设备 | H239: 325.301 | I239: 0.10099999999999999 | J239: -2.2499999999999999e-002 | K239: 19.87 | L239: 7.9899999999999999e-002 | M239: 117.7 | N239: 6.73 | O239: 0.10199999999999999 | P239: 295.25 | Q239: 已到 | R239: 4年56天 | S239: 2年56天 | T239: 0.59 | U239: 936 | V239: 4.9500000000000002 | W239: 5.0000000000000001e-003 | X239: 1.3999999999999999e-002 | Y239: 125 | Z239: 6.76 | AA239: -0.221 | AB239: -0.22600000000000001 | AC239: -0.254 | AD239: -0.254 | AE239: 91 | AF239: 93.56 | AG239: 0.98 | AH239: AA- | AI239: 5.8299999999999998e-002 | AJ239: =H239+100*O239 -> 335.50099999999998 | AK239: 355.4 | AL239: 371 | AM239: 261.8 | AN239: 371 | AO239: 2.7000000000000003e-002 | AP239: 12 | AQ239: 天铁转债!
A240: 239 | B240: 128101 | C240: 联创转债!! | D240: 2036 | E240: 联创电子 | F240: 电子 | G240: 液晶显示 | H240: 191.903 | I240: -1.11e-002 | J240: -7.1999999999999998e-003 | K240: 21.37 | L240: -2.06e-002 | M240: 114.8 | N240: 13.72 | O240: 0.23199999999999998 | P240: 155.76 | Q240: 已到 | R240: 4年53天 | S240: 2年53天 | T240: 3 | U240: 96 | V240: 0.16500000000000001 | W240: 1.3000000000000001e-002 | X240: 2.1000000000000001e-002 | Y240: 227 | Z240: 5.82 | AA240: -0.11900000000000001 | AB240: -0.124 | AC240: -0.17100000000000001 | AD240: -0.17199999999999999 | AE240: 95 | AF240: 98.95 | AG240: 0.89 | AH240: AA | AI240: 3.73e-002 | AJ240: =H240+100*O240 -> 215.10299999999998 | AK240: 228 | AL240: 349 | AM240: 129.1 | AN240: 348 | AO240: -7.2000000000000008e-002 | AP240: 13 | AQ240: 联创转债!!
A241: 240 | B241: 123045 | C241: 雷迪转债 | D241: 300652 | E241: 雷迪克 | F241: 汽车 | G241: 零部件制 | H241: 130.399 | I241: -1.21e-002 | J241: 5.4000000000000003e-003 | K241: 20.49 | L241: -1.06e-002 | M241: 118.9 | N241: 19.63 | O241: 0.249 | P241: 104.38 | Q241: 已到 | R241: 4年49天 | S241: 2年49天 | T241: 1.66 | U241: 22 | V241: 0.10000000000000001 | W241: 8.5999999999999993e-002 | X241: 8.9999999999999997e-002 | Y241: 19 | Z241: 2.02 | AA241: -2.2599999999999999e-002 | AB241: -3.0299999999999997e-002 | AC241: -9.4399999999999998e-002 | AD241: -9.7299999999999998e-002 | AE241: 89.38 | AF241: 90.81 | AG241: 0.64 | AH241: A+ | AI241: 6.93e-002 | AJ241: =H241+100*O241 -> 155.29900000000001 | AK241: 156.4 | AL241: 131 | AM241: 65.6 | AN241: 165 | AO241: -8.5000000000000006e-002 | AP241: 33 | AQ241: 雷迪转债
A242: 241 | B242: 128100 | C242: 搜特转债! | D242: 2503 | E242: 搜于特 | F242: 服装纺织 | G242: 服装行业 | H242: 111.5 | I242: -5.6999999999999993e-003 | J242: 9.7999999999999997e-003 | K242: 1.6 | L242: 6.3e-003 | M242: 116.9 | N242: 1.62 | O242: 0.129 | P242: 98.77 | Q242: 已到 | R242: 4年49天 | S242: 2年49天 | T242: 7.99 | U242: 40 | V242: 4.4999999999999998e-002 | W242: 0.161 | X242: 0.159 | Y242: 49 | Z242: 3.28 | AA242: 1.18e-002 | AB242: 4.4000000000000003e-003 | AC242: -3.2500000000000001e-002 | AD242: -3.5299999999999998e-002 | AE242: 86.92 | AF242: 85.9 | AG242: 0.64 | AH242: A | AI242: 7.9299999999999995e-002 | AJ242: =H242+100*O242 -> 124.40000000000001 | AK242: 124.2 | AL242: 1 | AM242: 37.3 | AN242: 8 | AO242: -2.4e-002 | AP242: 93 | AQ242: 搜特转债!
A243: 242 | B243: 123044 | C243: 红相转债!! | D243: 300427 | E243: 红相股份 | F243: 能源电力 | G243: 电力设备 | H243: 116.598 | I243: -1.0500000000000001e-002 | J243: 1.0200000000000001e-002 | K243: 12.4 | L243: -1.6000000000000001e-003 | M243: 125 | N243: 18.67 | O243: 0.75599999999999989 | P243: 66.42 | Q243: 已到 | R243: 4年49天 | S243: 2年49天 | T243: 5.5 | U243: 5.6 | V243: 9.0000000000000011e-003 | W243: 0.12300000000000001 | X243: 8.199999999999999e-002 | Y243: 45 | Z243: 1.9 | AA243: 1.7500000000000002e-002 | AB243: 7.0999999999999995e-003 | AC243: -4.7100000000000003e-002 | AD243: -5.0599999999999999e-002 | AE243: 91.91 | AF243: 99.57 | AG243: 0.19 | AH243: AA- | AI243: 5.8299999999999998e-002 | AJ243: =H243+100*O243 -> 192.19799999999998 | AK243: 166.8 | AL243: 224 | AM243: 67.2 | AN243: 181 | AO243: -4.8000000000000001e-002 | AP243: 22 | AQ243: 红相转债!!
A244: 243 | B244: 110067 | C244: 华安转债! | D244: 600909 | E244: 华安证券 | F244: 金融 | G244: 证券行业 | H244: 117.08 | I244: -1.26e-002 | J244: 1.1899999999999999e-002 | K244: 5.28 | L244: -1.9e-003 | M244: 110.3 | N244: 6.22 | O244: 0.379 | P244: 84.89 | Q244: 已到 | R244: 4年49天 | S244: 无权 | T244: 28 | U244: 14 | V244: 4.0000000000000001e-003 | W244: 0.113 | X244: 9.6000000000000002e-002 | Y244: 248 | Z244: 1.33 | AA244: -1.4499999999999999e-002 | AB244: -1.9e-002 | AC244: 无权 | AD244: 无权 | AE244: 无权 | AF244: 97.67 | AG244: 0.36 | AH244: AAA | AI244: 3.0299999999999997e-002 | AJ244: =H244+100*O244 -> 154.97999999999999 | AK244: 149.3 | AL244: 69 | AM244: 51.6 | AN244: 67 | AO244: -9.0000000000000011e-003 | AP244: 25 | AQ244: 华安转债!
A245: 244 | B245: 113570 | C245: 百达转债! | D245: 603331 | E245: 百达精工 | F245: 机械装备 | G245: 机械装备 | H245: 128.18 | I245: -2.8000000000000004e-003 | J245: 1.26e-002 | K245: 12.19 | L245: 1.41e-002 | M245: 114.9 | N245: 11.34 | O245: 0.192 | P245: 107.5 | Q245: 已到 | R245: 4年48天 | S245: 2年48天 | T245: 2.8 | U245: 13 | V245: 3.6000000000000004e-002 | W245: 0.129 | X245: 0.13900000000000001 | Y245: 22 | Z245: 2.67 | AA245: -2.6699999999999998e-002 | AB245: -3.2799999999999996e-002 | AC245: -8.9999999999999997e-002 | AD245: -9.2499999999999999e-002 | AE245: 88.8 | AF245: 87.68 | AG245: 0.69 | AH245: A+ | AI245: 6.93e-002 | AJ245: =H245+100*O245 -> 147.38 | AK245: 148.9 | AL245: 62 | AM245: 60.1 | AN245: 123 | AO245: -4.4999999999999998e-002 | AP245: 31 | AQ245: 百达转债!
A246: 245 | B246: 113569 | C246: 科达转债! | D246: 603660 | E246: 苏州科达 | F246: 通信互联 | G246: 物联网 | H246: 108.28 | I246: 2.0000000000000001e-004 | J246: -2.9999999999999997e-004 | K246: 7.09 | L246: -1.4000000000000002e-003 | M246: 120.3 | N246: 14.8 | O246: 1.26 | P246: 47.91 | Q246: 已到 | R246: 4年46天 | S246: 2年46天 | T246: 5.16 | U246: 4.7 | V246: 8.0000000000000002e-003 | W246: 0.14699999999999999 | X246: 7.0999999999999994e-002 | Y246: 35 | Z246: 2.07 | AA246: 2.6499999999999999e-002 | AB246: 1.77e-002 | AC246: -1.9199999999999998e-002 | AD246: -2.2099999999999998e-002 | AE246: 91.16 | AF246: 95.76 | AG246: 0.05 | AH246: AA- | AI246: 5.8299999999999998e-002 | AJ246: =H246+100*O246 -> 234.28 | AK246: 168.7 | AL246: 236 | AM246: 72.9 | AN246: 229 | AO246: 8.0000000000000002e-003 | AP246: 40 | AQ246: 科达转债!
A247: 246 | B247: 113568 | C247: 新春转债!! | D247: 603667 | E247: 五洲新春 | F247: 机械装备 | G247: 通用设备 | H247: 178.42 | I247: -3.9000000000000003e-003 | J247: -5.1999999999999998e-003 | K247: 14.36 | L247: -1.03e-002 | M247: 124.3 | N247: 8.75 | O247: 8.6999999999999994e-002 | P247: 164.11 | Q247: 已到 | R247: 4年43天 | S247: 2年43天 | T247: 2.44 | U247: 57 | V247: 0.13300000000000001 | W247: 5.5999999999999994e-002 | X247: 9.1999999999999998e-002 | Y247: 43 | Z247: 2.3 | AA247: -8.5900000000000004e-002 | AB247: -9.4499999999999987e-002 | AC247: -0.156 | AD247: -0.158 | AE247: 91.73 | AF247: 99.05 | AG247: 0.88 | AH247: AA- | AI247: 5.8299999999999998e-002 | AJ247: =H247+100*O247 -> 187.11999999999998 | AK247: 192.7 | AL247: 319 | AM247: 93.7 | AN247: 304 | AO247: -0.115 | AP247: 35 | AQ247: 新春转债!!
A248: 247 | B248: 123043 | C248: 正元转债!* | D248: 300645 | E248: 正元智慧 | F248: 计算机及 | G248: 软件开发 | H248: 157.267 | I248: -8.5000000000000006e-003 | J248: 2.2000000000000001e-003 | K248: 23.45 | L248: -6.4000000000000003e-003 | M248: 120.9 | N248: 15.38 | O248: 3.1e-002 | P248: 152.47 | Q248: 已到 | R248: 27天 | S248: 无权 | T248: 1.64 | U248: 340 | V248: 1.3 | W248: 5.5e-002 | X248: 8.4000000000000005e-002 | Y248: 30 | Z248: 4.52 | AA248: <-100% | AB248: <-100% | AC248: 无权 | AD248: 无权 | AE248: 无权 | AF248: 100.21 | AG248: 1 | AH248: A+ | AI248: 6.3799999999999996e-002 | AJ248: =H248+100*O248 -> 160.36699999999999 | AK248: 162.1 | AL248: 184 | AM248: 61.9 | AN248: 135 | AO248: -2.e-003 | AP248: 16 | AQ248: 正元转债!*
A249: 248 | B249: 113567 | C249: 君禾转债! | D249: 603617 | E249: 君禾股份 | F249: 机械装备 | G249: 通用设备 | H249: 133.97 | I249: 1.4800000000000001e-002 | J249: -4.4000000000000003e-003 | K249: 13.27 | L249: 1.38e-002 | M249: 118.8 | N249: 10.58 | O249: 6.8000000000000005e-002 | P249: 125.43 | Q249: 已到 | R249: 4年41天 | S249: 2年41天 | T249: 2.1 | U249: 39 | V249: 0.13900000000000001 | W249: 6.0999999999999999e-002 | X249: 7.6999999999999999e-002 | Y249: 34 | Z249: 3.77 | AA249: -2.9500000000000002e-002 | AB249: -3.7100000000000001e-002 | AC249: -0.106 | AD249: -0.109 | AE249: 89.44 | AF249: 90.87 | AG249: 0.76 | AH249: A+ | AI249: 6.93e-002 | AJ249: =H249+100*O249 -> 140.77000000000001 | AK249: 142.5 | AL249: 22 | AM249: 51.6 | AN249: 68 | AO249: 3.6000000000000004e-002 | AP249: 33 | AQ249: 君禾转债!
A250: 249 | B250: 110066 | C250: 盛屯转债!! | D250: 600711 | E250: 盛屯矿业 | F250: 有色金属 | G250: 有色行业 | H250: 241.58 | I250: -2.e-003 | J250: -1.83e-002 | K250: 10.25 | L250: -2.1000000000000001e-002 | M250: 114.9 | N250: 4.87 | O250: 0.14800000000000002 | P250: 210.47 | Q250: 已到 | R250: 4年39天 | S250: 2年39天 | T250: 3.83 | U250: 187 | V250: 0.20100000000000001 | W250: 1.3999999999999999e-002 | X250: 2.8999999999999998e-002 | Y250: 282 | Z250: 2.28 | AA250: -0.16800000000000001 | AB250: -0.17300000000000001 | AC250: -0.218 | AD250: -0.21899999999999997 | AE250: 95.23 | AF250: 99.19 | AG250: 0.97 | AH250: AA | AI250: 3.73e-002 | AJ250: =H250+100*O250 -> 256.38 | AK250: 272.7 | AL250: 365 | AM250: 173.5 | AN250: 365 | AO250: -2.4e-002 | AP250: 26 | AQ250: 盛屯转债!!
A251: 250 | B251: 113566 | C251: 翔港转债! | D251: 603499 | E251: 翔港科技 | F251: 造纸包装 | G251: 包装材料 | H251: 119.05 | I251: 8.0000000000000004e-004 | J251: 3.8e-003 | K251: 8.64 | L251: 1.1699999999999999e-002 | M251: 124 | N251: 10.77 | O251: 0.48399999999999999 | P251: 80.22 | Q251: 已到 | R251: 4年37天 | S251: 2年37天 | T251: 1.61 | U251: 6.9 | V251: 3.6000000000000004e-002 | W251: 9.3000000000000013e-002 | X251: 7.400000000000001e-002 | Y251: 17 | Z251: 3.06 | AA251: 1.0200000000000001e-002 | AB251: 2.9999999999999997e-004 | AC251: -5.7999999999999996e-002 | AD251: -6.1200000000000004e-002 | AE251: 89.69 | AF251: 94.91 | AG251: 0.39 | AH251: A+ | AI251: 6.93e-002 | AJ251: =H251+100*O251 -> 167.44999999999999 | AK251: 157.9 | AL251: 139 | AM251: 63 | AN251: 150 | AO251: -7.0000000000000007e-002 | AP251: 30 | AQ251: 翔港转债!
A252: 251 | B252: 113565 | C252: 宏辉转债 | D252: 603336 | E252: 宏辉果蔬 | F252: 农业 | G252: 农产品加 | H252: 126.69 | I252: -1.3500000000000002e-002 | J252: 4.5000000000000005e-003 | K252: 7.74 | L252: -1.5300000000000001e-002 | M252: 117.8 | N252: 7.64 | O252: 0.251 | P252: 101.31 | Q252: 已到 | R252: 4年35天 | S252: 2年35天 | T252: 2.25 | U252: 78 | V252: 0.27300000000000002 | W252: 6.6000000000000003e-002 | X252: 6.7000000000000004e-002 | Y252: 34 | Z252: 3.26 | AA252: -1.8000000000000002e-002 | AB252: -2.5399999999999999e-002 | AC252: -8.5699999999999998e-002 | AD252: -8.8399999999999992e-002 | AE252: 91.4 | AF252: 93.97 | AG252: 0.59 | AH252: AA- | AI252: 5.8299999999999998e-002 | AJ252: =H252+100*O252 -> 151.78999999999999 | AK252: 152.1 | AL252: 93 | AM252: 58.1 | AN252: 111 | AO252: -6.3e-002 | AP252: 28 | AQ252: 宏辉转债
A253: 252 | B253: 128097 | C253: 奥佳转债!! | D253: 2614 | E253: 奥佳华 | F253: 机械装备 | G253: 专用设备 | H253: 142.269 | I253: -3.0000000000000001e-003 | J253: 4.7999999999999996e-003 | K253: 12.4 | L253: 2.3999999999999998e-003 | M253: 114.9 | N253: 10.39 | O253: 0.192 | P253: 119.35 | Q253: 已到 | R253: 4年34天 | S253: 2年34天 | T253: 4.59 | U253: 12 | V253: 1.8000000000000002e-002 | W253: 5.9000000000000004e-002 | X253: 7.0000000000000007e-002 | Y253: 78 | Z253: 1.66 | AA253: -5.1900000000000002e-002 | AB253: -5.79e-002 | AC253: -0.10199999999999999 | AD253: -0.10400000000000001 | AE253: 91.11 | AF253: 91.61 | AG253: 0.74 | AH253: AA- | AI253: 5.8299999999999998e-002 | AJ253: =H253+100*O253 -> 161.46899999999999 | AK253: 165.2 | AL253: 209 | AM253: 73.6 | AN253: 231 | AO253: -3.7999999999999999e-002 | AP253: 16 | AQ253: 奥佳转债!!
A254: 253 | B254: 128095 | C254: 恩捷转债!! | D254: 2812 | E254: 恩捷股份 | F254: 电子 | G254: 元器件制 | H254: 460 | I254: 1.1000000000000001e-002 | J254: -2.2599999999999999e-002 | K254: 268 | L254: -1.18e-002 | M254: 114.9 | N254: 64.92 | O254: 0.114 | P254: 412.82 | Q254: 已到 | R254: 4年20天 | S254: 2年20天 | T254: 4.54 | U254: 233 | V254: 0.11199999999999999 | W254: 2.e-003 | X254: 8.0000000000000002e-003 | Y254: 2392. | Z254: 18.66 | AA254: -0.29299999999999998 | AB254: -0.29699999999999999 | AC254: -0.30599999999999999 | AD254: -0.30599999999999999 | AE254: 95.42 | AF254: 99.38 | AG254: 0.99 | AH254: AA | AI254: 3.73e-002 | AJ254: =H254+100*O254 -> 471.39999999999998 | AK254: 507.2 | AL254: 384 | AM254: 407.8 | AN254: 384 | AO254: 7.2999999999999995e-002 | AP254: 12 | AQ254: 恩捷转债!!
A255: 254 | B255: 128096 | C255: 奥瑞转债!! | D255: 2701 | E255: 奥瑞金 | F255: 造纸包装 | G255: 包装材料 | H255: 148.346 | I255: -7.7000000000000002e-003 | J255: -1.4000000000000002e-003 | K255: 6.46 | L255: -1.0700000000000001e-002 | M255: 115.5 | N255: 4.5 | O255: 3.3000000000000002e-002 | P255: 143.56 | Q255: 已到 | R255: 4年20天 | S255: 2年20天 | T255: 5.66 | U255: 59 | V255: 7.0000000000000007e-002 | W255: 3.6000000000000004e-002 | X255: 5.0999999999999997e-002 | Y255: 158 | Z255: 2.18 | AA255: -6.1200000000000004e-002 | AB255: -6.7400000000000002e-002 | AC255: -0.11599999999999999 | AD255: -0.11800000000000001 | AE255: 96.85 | AF255: 101.87 | AG255: 0.85 | AH255: AA+ | AI255: 3.2300000000000002e-002 | AJ255: =H255+100*O255 -> 151.64600000000002 | AK255: 153.1 | AL255: 105 | AM255: 51.3 | AN255: 63 | AO255: -3.4000000000000002e-002 | AP255: 16 | AQ255: 奥瑞转债!!
A256: 255 | B256: 113563 | C256: 柳药转债! | D256: 603368 | E256: 柳药股份 | F256: 医药 | G256: 医药商业 | H256: 117.91 | I256: -1.46e-002 | J256: 4.0000000000000002e-004 | K256: 18.6 | L256: -5.3399999999999996e-002 | M256: 112.3 | N256: 23.87 | O256: 0.51300000000000001 | P256: 77.92 | Q256: 已到 | R256: 3.98年 | S256: 1.98年 | T256: 8.02 | U256: 18 | V256: 1.9e-002 | W256: 0.11900000000000001 | X256: 9.3000000000000013e-002 | Y256: 67 | Z256: 1.29 | AA256: -1.24e-002 | AB256: -1.7899999999999999e-002 | AC256: -6.2199999999999998e-002 | AD256: -6.4500000000000002e-002 | AE256: 95.06 | AF256: 97.31 | AG256: 0.27 | AH256: AA | AI256: 3.73e-002 | AJ256: =H256+100*O256 -> 169.21000000000001 | AK256: 157.9 | AL256: 140 | AM256: 60.6 | AN256: 128 | AO256: -5.0000000000000003e-002 | AP256: 18 | AQ256: 柳药转债!
A257: 256 | B257: 128094 | C257: 星帅转债! | D257: 2860 | E257: 星帅尔 | F257: 家电 | G257: 零部件制 | H257: 160.309 | I257: 1.34e-002 | J257: 3.9000000000000003e-003 | K257: 22.01 | L257: 1.95e-002 | M257: 120.3 | N257: 13.8 | O257: 5.0000000000000001e-003 | P257: 159.49 | Q257: 已到 | R257: 3.98年 | S257: 1.98年 | T257: 2.09 | U257: 185 | V257: 0.55100000000000005 | W257: 4.5999999999999999e-002 | X257: 7.400000000000001e-002 | Y257: 45 | Z257: 3.9 | AA257: -7.0800000000000002e-002 | AB257: -7.8700000000000006e-002 | AC257: -0.14300000000000002 | AD257: -0.14499999999999999 | AE257: 89.61 | AF257: 92.64 | AG257: 0.89 | AH257: A+ | AI257: 6.93e-002 | AJ257: =H257+100*O257 -> 160.809 | AK257: 161.1 | AL257: 173 | AM257: 68.5 | AN257: 193 | AO257: -6.5000000000000002e-002 | AP257: 30 | AQ257: 星帅转债!
A258: 257 | B258: 123042 | C258: 银河转债!! | D258: 300619 | E258: 金银河 | F258: 机械装备 | G258: 专用设备 | H258: 319.908 | I258: -9.1999999999999998e-003 | J258: 7.1999999999999998e-003 | K258: 65.06 | L258: -2.e-003 | M258: 114.6 | N258: 23.59 | O258: 0.16 | P258: 275.79 | Q258: 已到 | R258: 3.98年 | S258: 1.98年 | T258: 0.98 | U258: 414 | V258: 1.3100000000000001 | W258: 1.8000000000000002e-002 | X258: 4.9000000000000002e-002 | Y258: 55 | Z258: 9.16 | AA258: -0.23000000000000001 | AB258: -0.23499999999999999 | AC258: -0.27899999999999997 | AD258: -0.28000000000000003 | AE258: 89.25 | AF258: 88.24 | AG258: 0.98 | AH258: A+ | AI258: 6.93e-002 | AJ258: =H258+100*O258 -> 335.90800000000002 | AK258: 364 | AL258: 372 | AM258: 274.8 | AN258: 372 | AO258: -0.161 | AP258: 20 | AQ258: 银河转债!!
A259: 258 | B259: 127015 | C259: 希望转债!! | D259: 876 | E259: 新 希 望 | F259: 农业 | G259: 畜牧业 | H259: 126.8 | I259: -1.01e-002 | J259: -6.6e-003 | K259: 16.15 | L259: -5.28e-002 | M259: 109.6 | N259: 19.75 | O259: 0.55100000000000005 | P259: 81.77 | Q259: 已到 | R259: 3.95年 | S259: 1.95年 | T259: 9.5 | U259: 16 | V259: 1.3000000000000001e-002 | W259: 1.3000000000000001e-002 | X259: 1.1000000000000001e-002 | Y259: 728 | Z259: 2.38 | AA259: -3.6799999999999999e-002 | AB259: -4.0999999999999995e-002 | AC259: -9.7100000000000006e-002 | AD259: -9.9000000000000005e-002 | AE259: 96.04 | AF259: 97.59 | AG259: 0.32 | AH259: AAA | AI259: 3.0299999999999997e-002 | AJ259: =H259+100*O259 -> 181.90000000000001 | AK259: 171.8 | AL259: 253 | AM259: 74.2 | AN259: 234 | AO259: -8.0000000000000002e-003 | AP259: 26 | AQ259: 希望转债!!
A260: 259 | B260: 128093 | C260: 百川转债!! | D260: 2455 | E260: 百川股份 | F260: 化工 | G260: 化工 | H260: 223.1 | I260: 4.0000000000000002e-004 | J260: -1.1999999999999999e-003 | K260: 11.9 | L260: -8.0000000000000004e-004 | M260: 129 | N260: 5.77 | O260: 8.199999999999999e-002 | P260: 206.24 | Q260: 已到 | R260: 3.95年 | S260: 1.95年 | T260: 1.61 | U260: 72 | V260: 0.19899999999999998 | W260: 2.4e-002 | X260: 4.9000000000000002e-002 | Y260: 67 | Z260: 3.81 | AA260: -0.13300000000000001 | AB260: -0.14300000000000002 | AC260: -0.21899999999999997 | AD260: -0.221 | AE260: 94.28 | AF260: 103.96 | AG260: 0.94 | AH260: AA- | AI260: 5.8299999999999998e-002 | AJ260: =H260+100*O260 -> 231.29999999999998 | AK260: 240 | AL260: 353 | AM260: 136 | AN260: 353 | AO260: -9.9000000000000005e-002 | AP260: 36 | AQ260: 百川转债!!
A261: 260 | B261: 113561 | C261: 正裕转债! | D261: 603089 | E261: 正裕工业 | F261: 汽车 | G261: 零部件制 | H261: 120.83 | I261: -8.5000000000000006e-003 | J261: 7.9000000000000008e-003 | K261: 8.96 | L261: -1.1000000000000001e-003 | M261: 117.2 | N261: 10.08 | O261: 0.35899999999999999 | P261: 88.89 | Q261: 已到 | R261: 3.94年 | S261: 1.94年 | T261: 1.5 | U261: 6.5 | V261: 3.6000000000000004e-002 | W261: 7.4999999999999997e-002 | X261: 6.7000000000000004e-002 | Y261: 20 | Z261: 1.92 | AA261: -7.9000000000000008e-003 | AB261: -1.54e-002 | AC261: -7.1900000000000006e-002 | AD261: -7.4700000000000003e-002 | AE261: 89.86 | AF261: 90.53 | AG261: 0.51 | AH261: A+ | AI261: 6.93e-002 | AJ261: =H261+100*O261 -> 156.72999999999999 | AK261: 152.8 | AL261: 102 | AM261: 62.2 | AN261: 136 | AO261: -4.4000000000000004e-002 | AP261: 35 | AQ261: 正裕转债!
A262: 261 | B262: 128091 | C262: 新天转债! | D262: 2873 | E262: 新天药业 | F262: 医药 | G262: 中药 | H262: 198 | I262: -4.2599999999999999e-002 | J262: -1.7399999999999999e-002 | K262: 20.63 | L262: -6.4000000000000001e-002 | M262: 118.6 | N262: 11.62 | O262: 0.115 | P262: 177.54 | Q262: 已到 | R262: 3.94年 | S262: 1.94年 | T262: 1.55 | U262: 545 | V262: 1.75 | W262: 4.5999999999999999e-002 | X262: 8.1000000000000003e-002 | Y262: 34 | Z262: 2.78 | AA262: -0.124 | AB262: -0.13100000000000001 | AC262: -0.20000000000000001 | AD262: -0.20100000000000001 | AE262: 90.17 | AF262: 91.67 | AG262: 0.94 | AH262: A+ | AI262: 6.93e-002 | AJ262: =H262+100*O262 -> 209.5 | AK262: 218.5 | AL262: 346 | AM262: 126.8 | AN262: 345 | AO262: -4.4999999999999998e-002 | AP262: 22 | AQ262: 新天转债!
A263: 262 | B263: 128090 | C263: 汽模转2 | D263: 2510 | E263: 天汽模 | F263: 汽车 | G263: 零部件制 | H263: 126.35 | I263: -6.8000000000000005e-003 | J263: 2.5999999999999999e-003 | K263: 4.31 | L263: -6.8999999999999999e-003 | M263: 114.3 | N263: 4.23 | O263: 0.23999999999999999 | P263: 101.89 | Q263: 已到 | R263: 3.93年 | S263: 1.93年 | T263: 3.1 | U263: 18 | V263: 4.5999999999999999e-002 | W263: 7.5999999999999998e-002 | X263: 7.8e-002 | Y263: 41 | Z263: 1.99 | AA263: -2.5600000000000001e-002 | AB263: -3.1899999999999998e-002 | AC263: -9.4299999999999995e-002 | AD263: -9.6600000000000005e-002 | AE263: 91.36 | AF263: 91.86 | AG263: 0.61 | AH263: AA- | AI263: 5.8299999999999998e-002 | AJ263: =H263+100*O263 -> 150.34999999999999 | AK263: 150.8 | AL263: 80 | AM263: 58.9 | AN263: 116 | AO263: -5.5999999999999994e-002 | AP263: 28 | AQ263: 汽模转2
A264: 263 | B264: 123039 | C264: 开润转债! | D264: 300577 | E264: 开润股份 | F264: 服装纺织 | G264: 纺织行业 | H264: 118.999 | I264: 1.3600000000000001e-002 | J264: -1.67e-002 | K264: 20.73 | L264: -1.1899999999999999e-002 | M264: 120.3 | N264: 29.92 | O264: 0.71799999999999997 | P264: 69.28 | Q264: 已到 | R264: 3.93年 | S264: 1.93年 | T264: 2.22 | U264: 17 | V264: 6.6000000000000003e-002 | W264: 4.4999999999999998e-002 | X264: 3.1e-002 | Y264: 50 | Z264: 3.09 | AA264: 2.8000000000000004e-003 | AB264: -6.0999999999999995e-003 | AC264: -6.5500000000000003e-002 | AD264: -6.83e-002 | AE264: 89.96 | AF264: 93 | AG264: 0.26 | AH264: A+ | AI264: 6.93e-002 | AJ264: =H264+100*O264 -> 190.79899999999998 | AK264: 168.7 | AL264: 237 | AM264: 75.7 | AN264: 243 | AO264: -5.9999999999999998e-002 | AP264: 23 | AQ264: 开润转债!
A265: 264 | B265: 123038 | C265: 联得转债! | D265: 300545 | E265: 联得装备 | F265: 机械装备 | G265: 专用设备 | H265: 128.295 | I265: -1.6000000000000001e-003 | J265: 2.3e-003 | K265: 21.69 | L265: 1.4000000000000002e-003 | M265: 117.9 | N265: 24.07 | O265: 0.42399999999999999 | P265: 90.11 | Q265: 已到 | R265: 3.92年 | S265: 1.92年 | T265: 1.47 | U265: 5.2 | V265: 2.7000000000000003e-002 | W265: 3.7999999999999999e-002 | X265: 3.4000000000000002e-002 | Y265: 39 | Z265: 2.78 | AA265: -2.1700000000000001e-002 | AB265: -2.9399999999999999e-002 | AC265: -9.98e-002 | AD265: -0.10199999999999999 | AE265: 89.76 | AF265: 91.13 | AG265: 0.51 | AH265: A+ | AI265: 6.93e-002 | AJ265: =H265+100*O265 -> 170.69499999999999 | AK265: 166.5 | AL265: 220 | AM265: 75.3 | AN265: 241 | AO265: -5.7999999999999996e-002 | AP265: 18 | AQ265: 联得转债!
A266: 265 | B266: 113030 | C266: 东风转债! | D266: 601515 | E266: 东风股份 | F266: 造纸包装 | G266: 包装材料 | H266: 152.39 | I266: -3.7000000000000002e-003 | J266: -6.9999999999999993e-003 | K266: 7.56 | L266: -1.5600000000000001e-002 | M266: 116.3 | N266: 6.4 | O266: 0.28999999999999998 | P266: 118.12 | Q266: 已到 | R266: 3.92年 | S266: 1.92年 | T266: 2.95 | U266: 46 | V266: 0.10199999999999999 | W266: 2.5000000000000001e-002 | X266: 2.9999999999999999e-002 | Y266: 116 | Z266: 2.23 | AA266: -6.7699999999999996e-002 | AB266: -7.4299999999999991e-002 | AC266: -0.13600000000000001 | AD266: -0.13800000000000001 | AE266: 95.28 | AF266: 101 | AG266: 0.69 | AH266: AA | AI266: 3.73e-002 | AJ266: =H266+100*O266 -> 181.38999999999999 | AK266: 186.7 | AL266: 306 | AM266: 85.7 | AN266: 283 | AO266: -6.9000000000000006e-002 | AP266: 17 | AQ266: 东风转债!
A267: 266 | B267: 110064 | C267: 建工转债! | D267: 600939 | E267: 重庆建工 | F267: 建筑 | G267: 建筑工程 | H267: 122.3 | I267: -2.5999999999999999e-003 | J267: -6.4000000000000003e-003 | K267: 4.3 | L267: -2.2700000000000001e-002 | M267: 119.2 | N267: 4.53 | O267: 0.28800000000000003 | P267: 94.92 | Q267: 已到 | R267: 3.91年 | S267: 1.91年 | T267: 16.6 | U267: 26 | V267: 1.3000000000000001e-002 | W267: 0.21299999999999999 | X267: 0.20199999999999999 | Y267: 78 | Z267: 1.07 | AA267: -6.7000000000000002e-003 | AB267: -1.5100000000000001e-002 | AC267: -7.7600000000000002e-002 | AD267: -8.0500000000000002e-002 | AE267: 96.97 | AF267: 105.56 | AG267: 0.4 | AH267: AA+ | AI267: 3.2300000000000002e-002 | AJ267: =H267+100*O267 -> 151.09999999999999 | AK267: 149.7 | AL267: 71 | AM267: 44.1 | AN267: 26 | AO267: 8.0000000000000002e-003 | AP267: 47 | AQ267: 建工转债!
A268: 267 | B268: 128087 | C268: 孚日转债! | D268: 2083 | E268: 孚日股份 | F268: 服装纺织 | G268: 家纺 | H268: 126.41 | I268: 1.7000000000000001e-003 | J268: -2.9999999999999997e-004 | K268: 4.8 | L268: 2.0999999999999999e-003 | M268: 112.3 | N268: 4.5 | O268: 0.185 | P268: 106.67 | Q268: 已到 | R268: 3.90年 | S268: 1.90年 | T268: 6.5 | U268: 37 | V268: 4.4000000000000004e-002 | W268: 0.14899999999999999 | X268: 0.159 | Y268: 44 | Z268: 1.16 | AA268: -3.04e-002 | AB268: -3.5900000000000001e-002 | AC268: -9.5700000000000007e-002 | AD268: -9.8000000000000004e-002 | AE268: 91.51 | AF268: 90.4 | AG268: 0.68 | AH268: AA- | AI268: 5.8299999999999998e-002 | AJ268: =H268+100*O268 -> 144.91 | AK268: 146.2 | AL268: 39 | AM268: 54.6 | AN268: 83 | AO268: -1.e-003 | AP268: 73 | AQ268: 孚日转债!
A269: 268 | B269: 128085 | C269: 鸿达转债!! | D269: 2002 | E269: 鸿达兴业 | F269: 化工 | G269: 化工 | H269: 139.696 | I269: -4.8999999999999998e-003 | J269: 4.8999999999999998e-003 | K269: 5.37 | L269: 0. | M269: 123.8 | N269: 3.91 | O269: 1.7000000000000001e-002 | P269: 137.34 | Q269: 已到 | R269: 3.90年 | S269: 1.90年 | T269: 3.39 | U269: 63 | V269: 0.13200000000000001 | W269: 2.e-002 | X269: 2.7999999999999997e-002 | Y269: 168 | Z269: 1.61 | AA269: -3.1099999999999999e-002 | AB269: -4.0800000000000003e-002 | AC269: -0.11 | AD269: -0.11199999999999999 | AE269: 74.96 | AF269: 68.24 | AG269: 0.88 | AH269: B | AI269: 0.16930000000000001 | AJ269: =H269+100*O269 -> 141.39599999999999 | AK269: 142.1 | AL269: 18 | AM269: 67.1 | AN269: 180 | AO269: -0.10099999999999999 | AP269: 84 | AQ269: 鸿达转债!!
A270: 269 | B270: 110063 | C270: 鹰19转债 | D270: 600567 | E270: 山鹰国际 | F270: 造纸包装 | G270: 包装用纸 | H270: 121.92 | I270: -5.1000000000000004e-003 | J270: -2.2000000000000001e-003 | K270: 3.23 | L270: -1.52e-002 | M270: 115.4 | N270: 3.26 | O270: 0.23100000000000001 | P270: 99.08 | Q270: 已到 | R270: 3.89年 | S270: 1.89年 | T270: 18.4 | U270: 5.3 | V270: 2.e-003 | W270: 0.124 | X270: 0.12300000000000001 | Y270: 149 | Z270: 0.93 | AA270: -1.43e-002 | AB270: -2.1099999999999997e-002 | AC270: -8.0299999999999996e-002 | AD270: -8.2599999999999993e-002 | AE270: 96.27 | AF270: 102.2 | AG270: 0.48 | AH270: AA+ | AI270: 3.2300000000000002e-002 | AJ270: =H270+100*O270 -> 145.02000000000001 | AK270: 144.8 | AL270: 32 | AM270: 42.6 | AN270: 22 | AO270: -2.6000000000000002e-002 | AP270: 29 | AQ270: 鹰19转债
A271: 270 | B271: 128083 | C271: 新北转债! | D271: 2376 | E271: 新北洋 | F271: 电子 | G271: 电子产品 | H271: 116.4 | I271: 2.5999999999999999e-003 | J271: -1.1000000000000001e-003 | K271: 9.08 | L271: 5.5000000000000005e-003 | M271: 114.3 | N271: 11.45 | O271: 0.46799999999999997 | P271: 79.3 | Q271: 已到 | R271: 3.89年 | S271: 1.89年 | T271: 8.77 | U271: 6.1 | V271: 6.0000000000000001e-003 | W271: 0.14499999999999999 | X271: 0.115 | Y271: 60 | Z271: 1.79 | AA271: -4.7999999999999996e-003 | AB271: -1.1299999999999999e-002 | AC271: -5.91e-002 | AD271: -6.1500000000000006e-002 | AE271: 95.4 | AF271: 99.39 | AG271: 0.27 | AH271: AA | AI271: 3.73e-002 | AJ271: =H271+100*O271 -> 163.19999999999999 | AK271: 153.5 | AL271: 109 | AM271: 54.1 | AN271: 77 | AO271: -1.7000000000000001e-002 | AP271: 22 | AQ271: 新北转债!
A272: 271 | B272: 128082 | C272: 华锋转债!! | D272: 2806 | E272: 华锋股份 | F272: 电子 | G272: 元器件制 | H272: 156.202 | I272: 8.8999999999999999e-003 | J272: 3.3e-003 | K272: 13.24 | L272: 1.46e-002 | M272: 120.6 | N272: 9.13 | O272: 7.6999999999999999e-002 | P272: 145.02 | Q272: 已到 | R272: 3.87年 | S272: 1.87年 | T272: 2.04 | U272: 72 | V272: 0.22500000000000001 | W272: 8.0000000000000002e-002 | X272: 0.11599999999999999 | Y272: 25 | Z272: 2.23 | AA272: -6.6000000000000003e-002 | AB272: -7.4299999999999991e-002 | AC272: -0.14599999999999999 | AD272: -0.14800000000000002 | AE272: 88.92 | AF272: 90.43 | AG272: 0.84 | AH272: A | AI272: 7.9299999999999995e-002 | AJ272: =H272+100*O272 -> 163.90199999999999 | AK272: 167.4 | AL272: 229 | AM272: 77 | AN272: 248 | AO272: -8.8000000000000009e-002 | AP272: 46 | AQ272: 华锋转债!!
A273: 272 | B273: 110062 | C273: 烽火转债! | D273: 600498 | E273: 烽火通信 | F273: 通信互联 | G273: 通信设备 | H273: 118.8 | I273: -2.7000000000000001e-003 | J273: -8.0000000000000004e-004 | K273: 18.13 | L273: -1.3100000000000001e-002 | M273: 110.3 | N273: 22.85 | O273: 0.49700000000000005 | P273: 79.34 | Q273: 已到 | R273: 3.86年 | S273: 1.86年 | T273: 30.9 | U273: 9.2 | V273: 3.0000000000000001e-003 | W273: 0.14300000000000002 | X273: 0.114 | Y273: 215 | Z273: 1.87 | AA273: -1.9400000000000001e-002 | AB273: -2.4199999999999999e-002 | AC273: -6.93e-002 | AD273: -7.17e-002 | AE273: 96.8 | AF273: 98.51 | AG273: 0.27 | AH273: AAA | AI273: 3.0299999999999997e-002 | AJ273: =H273+100*O273 -> 168.5 | AK273: 158.3 | AL273: 147 | AM273: 59.7 | AN273: 121 | AO273: 6.9999999999999993e-003 | AP273: 18 | AQ273: 烽火转债!
A274: 273 | B274: 128081 | C274: 海亮转债! | D274: 2203 | E274: 海亮股份 | F274: 有色金属 | G274: 铜金属 | H274: 134.648 | I274: 1.7000000000000001e-003 | J274: 2.5999999999999999e-003 | K274: 12.26 | L274: 5.6999999999999993e-003 | M274: 114.3 | N274: 9.69 | O274: 6.4000000000000001e-002 | P274: 126.52 | Q274: 已到 | R274: 3.83年 | S274: 1.83年 | T274: 30.1 | U274: 43 | V274: 1.1000000000000001e-002 | W274: 0.125 | X274: 0.158 | Y274: 241 | Z274: 2.41 | AA274: -4.2599999999999999e-002 | AB274: -4.8899999999999999e-002 | AC274: -0.10400000000000001 | AD274: -0.105 | AE274: 95.6 | AF274: 99.6 | AG274: 0.76 | AH274: AA | AI274: 3.73e-002 | AJ274: =H274+100*O274 -> 141.048 | AK274: 142.8 | AL274: 24 | AM274: 43.2 | AN274: 24 | AO274: -5.0000000000000001e-003 | AP274: 43 | AQ274: 海亮转债!
A275: 274 | B275: 113550 | C275: 常汽转债! | D275: 603035 | E275: 常熟汽饰 | F275: 汽车 | G275: 零部件制 | H275: 244.06 | I275: -1.06e-002 | J275: 4.7899999999999998e-002 | K275: 20.45 | L275: 3.8599999999999995e-002 | M275: 120.5 | N275: 9.33 | O275: 0.113 | P275: 219.19 | Q275: 已到 | R275: 3.82年 | S275: 1.82年 | T275: 2.14 | U275: 564 | V275: 1.0600000000000001 | W275: 2.8999999999999998e-002 | X275: 6.4000000000000001e-002 | Y275: 74 | Z275: 1.88 | AA275: -0.17100000000000001 | AB275: -0.17800000000000002 | AC275: -0.26000000000000001 | AD275: -0.26100000000000001 | AE275: 92.48 | AF275: 97.51 | AG275: 0.97 | AH275: AA- | AI275: 5.8299999999999998e-002 | AJ275: =H275+100*O275 -> 255.36000000000001 | AK275: 268.9 | AL275: 364 | AM275: 171.4 | AN275: 364 | AO275: 7.6999999999999999e-002 | AP275: 15 | AQ275: 常汽转债!
A276: 275 | B276: 113549 | C276: 白电转债! | D276: 603861 | E276: 白云电器 | F276: 能源电力 | G276: 电力设备 | H276: 135.43 | I276: 2.23e-002 | J276: -1.9599999999999999e-002 | K276: 11.43 | L276: 3.4999999999999996e-003 | M276: 114.3 | N276: 9.06 | O276: 7.2999999999999995e-002 | P276: 126.16 | Q276: 已到 | R276: 3.81年 | S276: 1.81年 | T276: 8.05 | U276: 242 | V276: 0.223 | W276: 0.16200000000000001 | X276: 0.20399999999999999 | Y276: 50 | Z276: 1.92 | AA276: -4.4199999999999996e-002 | AB276: -5.0499999999999996e-002 | AC276: -0.107 | AD276: -0.109 | AE276: 95.66 | AF276: 99.66 | AG276: 0.77 | AH276: AA | AI276: 3.73e-002 | AJ276: =H276+100*O276 -> 142.73000000000002 | AK276: 144.7 | AL276: 31 | AM276: 45 | AN276: 33 | AO276: -1.8000000000000002e-002 | AP276: 35 | AQ276: 白电转债!
A277: 276 | B277: 123035 | C277: 利德转债!! | D277: 300296 | E277: 利亚德 | F277: 电子 | G277: LED制 | H277: 170.339 | I277: -2.9100000000000001e-002 | J277: -8.1000000000000013e-003 | K277: 10.1 | L277: -4.36e-002 | M277: 114.3 | N277: 6.96 | O277: 0.17399999999999999 | P277: 145.11 | Q277: 已到 | R277: 3.81年 | S277: 1.81年 | T277: 7.99 | U277: 57 | V277: 4.0999999999999995e-002 | W277: 3.1e-002 | X277: 4.4999999999999998e-002 | Y277: 257 | Z277: 3.34 | AA277: -0.10099999999999999 | AB277: -0.107 | AC277: -0.17899999999999999 | AD277: -0.17999999999999999 | AE277: 96.58 | AF277: 101.49 | AG277: 0.85 | AH277: AA+ | AI277: 3.2300000000000002e-002 | AJ277: =H277+100*O277 -> 187.739 | AK277: 195.6 | AL277: 327 | AM277: 94.1 | AN277: 305 | AO277: -4.0999999999999995e-002 | AP277: 13 | AQ277: 利德转债!!
A278: 277 | B278: 110061 | C278: 川投转债! | D278: 600674 | E278: 川投能源 | F278: 能源电力 | G278: 水电 | H278: 147.64 | I278: -9.300000000000001e-003 | J278: 1.1999999999999999e-003 | K278: 11.58 | L278: -1.03e-002 | M278: 110.3 | N278: 9.2 | O278: 0.17300000000000001 | P278: 125.87 | Q278: 已到 | R278: 3.80年 | S278: 1.80年 | T278: 39.6 | U278: 21 | V278: 4.0000000000000001e-003 | W278: 7.8e-002 | X278: 9.8000000000000004e-002 | Y278: 510 | Z278: 1.66 | AA278: -7.4999999999999997e-002 | AB278: -7.9399999999999998e-002 | AC278: -0.13699999999999998 | AD278: -0.13800000000000001 | AE278: 96.97 | AF278: 98.68 | AG278: 0.79 | AH278: AAA | AI278: 3.0299999999999997e-002 | AJ278: =H278+100*O278 -> 164.94 | AK278: 169.4 | AL278: 240 | AM278: 70.7 | AN278: 216 | AO278: -2.7999999999999997e-002 | AP278: 12 | AQ278: 川投转债!
A279: 278 | B279: 123034 | C279: 通光转债! | D279: 300265 | E279: 通光线缆 | F279: 通信互联 | G279: 通信设备 | H279: 202.18 | I279: -8.8999999999999999e-003 | J279: 2.e-003 | K279: 10.46 | L279: -8.5000000000000006e-003 | M279: 117.3 | N279: 7.95 | O279: 0.53700000000000003 | P279: 131.57 | Q279: 已到 | R279: 3.78年 | S279: 1.78年 | T279: 0.78 | U279: 35 | V279: 0.22399999999999998 | W279: 2.e-002 | X279: 2.7000000000000003e-002 | Y279: 38 | Z279: 2.93 | AA279: -0.13600000000000001 | AB279: -0.14199999999999999 | AC279: -0.22699999999999998 | AD279: -0.22800000000000001 | AE279: 90.29 | AF279: 91.47 | AG279: 0.8 | AH279: A+ | AI279: 6.93e-002 | AJ279: =H279+100*O279 -> 255.88 | AK279: 272.8 | AL279: 366 | AM279: 181.3 | AN279: 366 | AO279: -2.e-002 | AP279: 16 | AQ279: 通光转债!
A280: 279 | B280: 113548 | C280: 石英转债! | D280: 603688 | E280: 石英股份 | F280: 电子 | G280: 电子产品 | H280: 374.88 | I280: -6.1999999999999998e-003 | J280: -4.7999999999999996e-003 | K280: 53 | L280: -1.1200000000000002e-002 | M280: 123.7 | N280: 14.93 | O280: 5.5999999999999994e-002 | P280: 354.99 | Q280: 已到 | R280: 3.76年 | S280: 1.76年 | T280: 1.2 | U280: 145 | V280: 0.32200000000000001 | W280: 6.0000000000000001e-003 | X280: 2.3e-002 | Y280: 187 | Z280: 9.11 | AA280: -0.25900000000000001 | AB280: -0.26600000000000001 | AC280: -0.33899999999999997 | AD280: -0.34000000000000002 | AE280: 92.97 | AF280: 100.43 | AG280: 0.98 | AH280: AA- | AI280: 5.8299999999999998e-002 | AJ280: =H280+100*O280 -> 380.48000000000002 | AK280: 394.8 | AL280: 376 | AM280: 294.3 | AN280: 376 | AO280: -0.11199999999999999 | AP280: 12 | AQ280: 石英转债!
A281: 280 | B281: 110060 | C281: 天路转债! | D281: 600326 | E281: 西藏天路 | F281: 建筑 | G281: 水泥 | H281: 124.41 | I281: 1.1399999999999999e-002 | J281: -1.52e-002 | K281: 6.52 | L281: -9.1000000000000004e-003 | M281: 114.3 | N281: 7.08 | O281: 0.35100000000000003 | P281: 92.09 | Q281: 已到 | R281: 3.76年 | S281: 1.76年 | T281: 7.06 | U281: 17 | V281: 1.9e-002 | W281: 0.11800000000000001 | X281: 0.109 | Y281: 60 | Z281: 1.4 | AA281: -2.2700000000000001e-002 | AB281: -2.92e-002 | AC281: -9.4700000000000006e-002 | AD281: -9.7100000000000006e-002 | AE281: 95.83 | AF281: 99.84 | AG281: 0.42 | AH281: AA | AI281: 3.73e-002 | AJ281: =H281+100*O281 -> 159.50999999999999 | AK281: 156.7 | AL281: 134 | AM281: 56.9 | AN281: 102 | AO281: -3.0000000000000001e-003 | AP281: 12 | AQ281: 天路转债!
A282: 281 | B282: 110059 | C282: 浦发转债! | D282: 600000 | E282: 浦发银行 | F282: 金融 | G282: 银行行业 | H282: 106.72 | I282: -1.e-003 | J282: 7.000000000000001e-004 | K282: 8.76 | L282: -4.5000000000000005e-003 | M282: 116.8 | N282: 13.97 | O282: 0.70200000000000007 | P282: 62.71 | Q282: 已到 | R282: 3.76年 | S282: 无权 | T282: 500 | U282: 214 | V282: 4.0000000000000001e-003 | W282: 0.19399999999999998 | X282: 0.122 | Y282: 2571. | Z282: 0.47 | AA282: 2.5000000000000001e-002 | AB282: 1.67e-002 | AC282: 无权 | AD282: 无权 | AE282: 无权 | AF282: 104.71 | AG282: 0.08 | AH282: AAA | AI282: 3.0299999999999997e-002 | AJ282: =H282+100*O282 -> 176.92000000000002 | AK282: 150.7 | AL282: 77 | AM282: 46 | AN282: 34 | AO282: 1.6e-002 | AP282: 53 | AQ282: 浦发转债!
A283: 282 | B283: 127014 | C283: 北方转债! | D283: 65 | E283: 北方国际 | F283: 建筑 | G283: 建筑工程 | H283: 124.283 | I283: -8.1000000000000013e-003 | J283: 5.9999999999999995e-004 | K283: 8.08 | L283: -1.8200000000000001e-002 | M283: 114.3 | N283: 8.65 | O283: 0.33100000000000002 | P283: 93.41 | Q283: 已到 | R283: 3.75年 | S283: 1.75年 | T283: 5.35 | U283: 2.4 | V283: 4.0000000000000001e-003 | W283: 8.5000000000000006e-002 | X283: 8.0000000000000002e-002 | Y283: 63 | Z283: 1.05 | AA283: -2.2499999999999999e-002 | AB283: -2.9100000000000001e-002 | AC283: -9.4700000000000006e-002 | AD283: -9.7200000000000009e-002 | AE283: 96.76 | AF283: 101.67 | AG283: 0.41 | AH283: AA+ | AI283: 3.2300000000000002e-002 | AJ283: =H283+100*O283 -> 157.38300000000001 | AK283: 155.2 | AL283: 123 | AM283: 53.5 | AN283: 73 | AO283: -4.2999999999999997e-002 | AP283: 16 | AQ283: 北方转债!
A284: 283 | B284: 113546 | C284: 迪贝转债! | D284: 603320 | E284: 迪贝电气 | F284: 家电 | G284: 零部件制 | H284: 121.79 | I284: 1.1999999999999999e-003 | J284: 3.5999999999999999e-003 | K284: 12.96 | L284: 9.300000000000001e-003 | M284: 119.8 | N284: 14 | O284: 0.316 | P284: 92.57 | Q284: 已到 | R284: 3.75年 | S284: 1.75年 | T284: 2.3 | U284: 4 | V284: 1.3999999999999999e-002 | W284: 0.13600000000000001 | X284: 0.126 | Y284: 17 | Z284: 2.32 | AA284: -4.5000000000000005e-003 | AB284: -1.3500000000000002e-002 | AC284: -8.3699999999999997e-002 | AD284: -8.6500000000000007e-002 | AE284: 90.8 | AF284: 93.67 | AG284: 0.51 | AH284: A+ | AI284: 6.93e-002 | AJ284: =H284+100*O284 -> 153.39000000000001 | AK284: 151 | AL284: 84 | AM284: 57.3 | AN284: 105 | AO284: -2.7000000000000003e-002 | AP284: 37 | AQ284: 迪贝转债!
A285: 284 | B285: 128079 | C285: 英联转债! | D285: 2846 | E285: 英联股份 | F285: 造纸包装 | G285: 包装材料 | H285: 124.887 | I285: -7.000000000000001e-004 | J285: 7.000000000000001e-004 | K285: 7.61 | L285: 0. | M285: 116.9 | N285: 8.29 | O285: 0.35999999999999999 | P285: 91.8 | Q285: 已到 | R285: 3.75年 | S285: 1.75年 | T285: 1.52 | U285: 6.3 | V285: 3.3000000000000002e-002 | W285: 6.3e-002 | X285: 5.7999999999999996e-002 | Y285: 24 | Z285: 3 | AA285: -1.78e-002 | AB285: -2.5600000000000001e-002 | AC285: -9.6199999999999994e-002 | AD285: -9.8900000000000002e-002 | AE285: 90.76 | AF285: 91.44 | AG285: 0.57 | AH285: A+ | AI285: 6.93e-002 | AJ285: =H285+100*O285 -> 160.887 | AK285: 158 | AL285: 142 | AM285: 66.5 | AN285: 173 | AO285: -2.7000000000000003e-002 | AP285: 15 | AQ285: 英联转债!
A286: 285 | B286: 128078 | C286: 太极转债! | D286: 2368 | E286: 太极股份 | F286: 计算机及 | G286: 软件开发 | H286: 162 | I286: -1.52e-002 | J286: 1.7899999999999999e-002 | K286: 28.46 | L286: 3.4999999999999996e-003 | M286: 116.3 | N286: 22.21 | O286: 0.26400000000000001 | P286: 128.14 | Q286: 已到 | R286: 3.75年 | S286: 1.75年 | T286: 9.6 | U286: 34 | V286: 2.2000000000000002e-002 | W286: 5.7999999999999996e-002 | X286: 7.4999999999999997e-002 | Y286: 165 | Z286: 5 | AA286: -8.5999999999999993e-002 | AB286: -9.2799999999999994e-002 | AC286: -0.17199999999999999 | AD286: -0.17300000000000001 | AE286: 95.9 | AF286: 101.65 | AG286: 0.77 | AH286: AA | AI286: 3.73e-002 | AJ286: =H286+100*O286 -> 188.40000000000001 | AK286: 195.9 | AL286: 328 | AM286: 94.2 | AN286: 306 | AO286: 4.4000000000000004e-002 | AP286: 9 | AQ286: 太极转债!
A287: 286 | B287: 128076 | C287: 金轮转债! | D287: 2722 | E287: 金轮股份 | F287: 机械装备 | G287: 专用设备 | H287: 127.331 | I287: -3.9000000000000003e-003 | J287: 7.1999999999999998e-003 | K287: 15.39 | L287: 5.1999999999999998e-003 | M287: 114.3 | N287: 14.66 | O287: 0.21299999999999999 | P287: 104.98 | Q287: 已到 | R287: 3.73年 | S287: 1.73年 | T287: 2.14 | U287: 15 | V287: 5.2999999999999999e-002 | W287: 7.9000000000000001e-002 | X287: 8.3000000000000004e-002 | Y287: 27 | Z287: 1.38 | AA287: -2.9100000000000001e-002 | AB287: -3.56e-002 | AC287: -0.107 | AD287: -0.11 | AE287: 92.42 | AF287: 92.93 | AG287: 0.63 | AH287: AA- | AI287: 5.8299999999999998e-002 | AJ287: =H287+100*O287 -> 148.631 | AK287: 149.7 | AL287: 72 | AM287: 56.8 | AN287: 101 | AO287: -6.3e-002 | AP287: 37 | AQ287: 金轮转债!
A288: 287 | B288: 113545 | C288: 金能转债! | D288: 603113 | E288: 金能科技 | F288: 煤炭 | G288: 炼焦 | H288: 164.23 | I288: -1.6000000000000001e-003 | J288: 8.0000000000000002e-003 | K288: 14.8 | L288: 7.4999999999999997e-003 | M288: 114.3 | N288: 10.43 | O288: 0.157 | P288: 141.9 | Q288: 已到 | R288: 3.73年 | S288: 1.73年 | T288: 9.87 | U288: 22 | V288: 1.3000000000000001e-002 | W288: 7.8e-002 | X288: 0.111 | Y288: 127 | Z288: 1.45 | AA288: -9.4200000000000006e-002 | AB288: -0.10000000000000001 | AC288: -0.17800000000000002 | AD288: -0.17999999999999999 | AE288: 95.96 | AF288: 99.98 | AG288: 0.85 | AH288: AA | AI288: 3.73e-002 | AJ288: =H288+100*O288 -> 179.92999999999998 | AK288: 186.6 | AL288: 305 | AM288: 86.6 | AN288: 286 | AO288: -8.900000000000001e-002 | AP288: 13 | AQ288: 金能转债!
A289: 288 | B289: 128074 | C289: 游族转债!! | D289: 2174 | E289: 游族网络 | F289: 通信互联 | G289: 互联网 | H289: 120.15 | I289: -6.9999999999999993e-003 | J289: 2.7000000000000001e-003 | K289: 13.12 | L289: -1.6500000000000001e-002 | M289: 119.3 | N289: 16.97 | O289: 0.55399999999999994 | P289: 77.31 | Q289: 已到 | R289: 3.67年 | S289: 1.67年 | T289: 6.83 | U289: 8.9 | V289: 1.1000000000000001e-002 | W289: 5.7000000000000002e-002 | X289: 4.4000000000000004e-002 | Y289: 120 | Z289: 2.29 | AA289: -2.e-003 | AB289: -1.1000000000000001e-002 | AC289: -8.199999999999999e-002 | AD289: -8.4700000000000011e-002 | AE289: 96.17 | AF289: 100.5 | AG289: 0.26 | AH289: AA | AI289: 3.73e-002 | AJ289: =H289+100*O289 -> 175.55000000000001 | AK289: 163 | AL289: 191 | AM289: 62.5 | AN289: 143 | AO289: -9.6000000000000002e-002 | AP289: 29 | AQ289: 游族转债!!
A290: 289 | B290: 128075 | C290: 远东转债! | D290: 2406 | E290: 远东传动 | F290: 汽车 | G290: 零部件制 | H290: 128.999 | I290: -7.7000000000000002e-003 | J290: -3.8e-003 | K290: 5.89 | L290: -1.83e-002 | M290: 114.3 | N290: 5.29 | O290: 0.159 | P290: 111.34 | Q290: 已到 | R290: 3.67年 | S290: 1.67年 | T290: 5.44 | U290: 6.8 | V290: 1.e-002 | W290: 0.14800000000000002 | X290: 0.16500000000000001 | Y290: 37 | Z290: 1.12 | AA290: -3.3000000000000002e-002 | AB290: -3.9699999999999999e-002 | AC290: -0.11699999999999999 | AD290: -0.10099999999999999 | AE290: 96.17 | AF290: 100.19 | AG290: 0.63 | AH290: AA | AI290: 3.73e-002 | AJ290: =H290+100*O290 -> 144.899 | AK290: 146.7 | AL290: 43 | AM290: 46.5 | AN290: 38 | AO290: -4.4000000000000004e-002 | AP290: 16 | AQ290: 远东转债!
A291: 290 | B291: 123031 | C291: 晶瑞转债! | D291: 300655 | E291: 晶瑞电材 | F291: 电子 | G291: 电子行业 | H291: 396.5 | I291: -1.37e-002 | J291: -9.7000000000000003e-003 | K291: 35.51 | L291: -2.3599999999999999e-002 | M291: 115.3 | N291: 10.13 | O291: 0.13100000000000001 | P291: 350.54 | Q291: 已到 | R291: 3.60年 | S291: 1.60年 | T291: 0.53 | U291: 55 | V291: 0.26000000000000001 | W291: 4.0000000000000001e-003 | X291: 1.4999999999999999e-002 | Y291: 121 | Z291: 8.34 | AA291: -0.29399999999999998 | AB291: -0.29799999999999999 | AC291: -0.38700000000000001 | AD291: -0.38799999999999996 | AE291: 91.41 | AF291: 91.03 | AG291: 0.99 | AH291: A+ | AI291: 6.93e-002 | AJ291: =H291+100*O291 -> 409.60000000000002 | AK291: 442.5 | AL291: 381 | AM291: 351 | AN291: 382 | AO291: -0.124 | AP291: 15 | AQ291: 晶瑞转债!
A292: 291 | B292: 128073 | C292: 哈尔转债! | D292: 2615 | E292: 哈尔斯 | F292: 其他 | G292: 家居用品 | H292: 124.61 | I292: -9.4999999999999998e-003 | J292: 8.6e-003 | K292: 5.58 | L292: -1.8e-003 | M292: 114.5 | N292: 5.7 | O292: 0.27300000000000002 | P292: 97.89 | Q292: 已到 | R292: 2.58年 | S292: 0.58年 | T292: 2.99 | U292: 5.3 | V292: 1.3999999999999999e-002 | W292: 0.129 | X292: 0.127 | Y292: 23 | Z292: 2.68 | AA292: -3.2599999999999997e-002 | AB292: -4.2199999999999994e-002 | AC292: -0.25800000000000001 | AD292: -0.26100000000000001 | AE292: 97.18 | AF292: 99.51 | AG292: 0.46 | AH292: AA- | AI292: 5.6600000000000004e-002 | AJ292: =H292+100*O292 -> 151.91 | AK292: 151.3 | AL292: 85 | AM292: 51.8 | AN292: 69 | AO292: -1.8000000000000002e-002 | AP292: 36 | AQ292: 哈尔转债!
A293: 292 | B293: 128072 | C293: 翔鹭转债! | D293: 2842 | E293: 翔鹭钨业 | F293: 有色金属 | G293: 小金属 | H293: 112.6 | I293: 0. | J293: 1.8e-003 | K293: 9.35 | L293: 1.1899999999999999e-002 | M293: 114.5 | N293: 15.19 | O293: 0.82900000000000007 | P293: 61.55 | Q293: 已到 | R293: 3.58年 | S293: 1.58年 | T293: 3.02 | U293: 3.2 | V293: 9.0000000000000011e-003 | W293: 0.11599999999999999 | X293: 7.2000000000000008e-002 | Y293: 26 | Z293: 2.67 | AA293: 4.7999999999999996e-003 | AB293: -2.5000000000000001e-003 | AC293: -5.1100000000000007e-002 | AD293: -5.4100000000000002e-002 | AE293: 93.24 | AF293: 93.89 | AG293: 0.16 | AH293: AA- | AI293: 5.8299999999999998e-002 | AJ293: =H293+100*O293 -> 195.5 | AK293: 163.6 | AL293: 197 | AM293: 69.8 | AN293: 204 | AO293: -1.3000000000000001e-002 | AP293: 28 | AQ293: 翔鹭转债!
A294: 293 | B294: 128071 | C294: 合兴转债! | D294: 2228 | E294: 合兴包装 | F294: 造纸包装 | G294: 包装材料 | H294: 117.5 | I294: -1.4800000000000001e-002 | J294: 1.6799999999999999e-002 | K294: 3.67 | L294: 5.5000000000000005e-003 | M294: 114.3 | N294: 4.18 | O294: 0.33799999999999997 | P294: 87.8 | Q294: 已到 | R294: 3.56年 | S294: 1.56年 | T294: 3 | U294: 2.3 | V294: 6.0000000000000001e-003 | W294: 6.6000000000000003e-002 | X294: 5.7999999999999996e-002 | Y294: 45 | Z294: 1.35 | AA294: -7.9000000000000008e-003 | AB294: -1.4999999999999999e-002 | AC294: -7.4800000000000005e-002 | AD294: -7.7699999999999991e-002 | AE294: 96.53 | AF294: 100.57 | AG294: 0.36 | AH294: AA | AI294: 3.73e-002 | AJ294: =H294+100*O294 -> 151.30000000000001 | AK294: 147.2 | AL294: 48 | AM294: 46.6 | AN294: 40 | AO294: -4.0000000000000001e-003 | AP294: 25 | AQ294: 合兴转债!
A295: 294 | B295: 113542 | C295: 好客转债! | D295: 603898 | E295: 好莱客 | F295: 其他 | G295: 家居用品 | H295: 118.75 | I295: 3.2000000000000002e-003 | J295: -9.7000000000000003e-003 | K295: 11.98 | L295: -3.3099999999999997e-002 | M295: 114.3 | N295: 16.14 | O295: 0.59999999999999998 | P295: 74.23 | Q295: 已到 | R295: 3.52年 | S295: 1.52年 | T295: 6.03 | U295: 15 | V295: 2.1000000000000001e-002 | W295: 0.16200000000000001 | X295: 0.12 | Y295: 37 | Z295: 1.37 | AA295: -1.1000000000000001e-002 | AB295: -1.8200000000000001e-002 | AC295: -8.2400000000000001e-002 | AD295: -8.5299999999999987e-002 | AE295: 96.68 | AF295: 100.72 | AG295: 0.2 | AH295: AA | AI295: 3.73e-002 | AJ295: =H295+100*O295 -> 178.75 | AK295: 163.3 | AL295: 196 | AM295: 62.5 | AN295: 145 | AO295: -2.8999999999999998e-002 | AP295: 17 | AQ295: 好客转债!
A296: 295 | B296: 113541 | C296: 荣晟转债!! | D296: 603165 | E296: 荣晟环保 | F296: 造纸包装 | G296: 包装用纸 | H296: 160.52 | I296: -7.9000000000000008e-003 | J296: 9.0000000000000011e-003 | K296: 16.97 | L296: 1.1999999999999999e-003 | M296: 114.3 | N296: 10.84 | O296: 2.5000000000000001e-002 | P296: 156.55 | Q296: 已到 | R296: 3.50年 | S296: 1.50年 | T296: 1.63 | U296: 28 | V296: 0.107 | W296: 3.6000000000000004e-002 | X296: 5.7000000000000002e-002 | Y296: 45 | Z296: 2.58 | AA296: -9.4100000000000003e-002 | AB296: -0.10000000000000001 | AC296: -0.20100000000000001 | AD296: -0.20199999999999999 | AE296: 93.62 | AF296: 94.13 | AG296: 0.9 | AH296: AA- | AI296: 5.8299999999999998e-002 | AJ296: =H296+100*O296 -> 163.02000000000001 | AK296: 164.5 | AL296: 203 | AM296: 70.4 | AN296: 210 | AO296: -6.0999999999999999e-002 | AP296: 39 | AQ296: 荣晟转债!!
A297: 296 | B297: 128070 | C297: 智能转债! | D297: 2877 | E297: 智能自控 | F297: 机械装备 | G297: 通用设备 | H297: 117.4 | I297: -4.3e-003 | J297: 3.0000000000000001e-003 | K297: 7.09 | L297: -4.1999999999999997e-003 | M297: 116.8 | N297: 9.47 | O297: 0.56799999999999995 | P297: 74.87 | Q297: 已到 | R297: 3.44年 | S297: 无权 | T297: 2.3 | U297: 9.8 | V297: 3.6000000000000004e-002 | W297: 9.6999999999999989e-002 | X297: 7.2999999999999995e-002 | Y297: 24 | Z297: 3.11 | AA297: -1.5e-003 | AB297: -1.01e-002 | AC297: 无权 | AD297: 无权 | AE297: 无权 | AF297: 93.25 | AG297: 0.32 | AH297: A+ | AI297: 6.93e-002 | AJ297: =H297+100*O297 -> 174.19999999999999 | AK297: 159.9 | AL297: 157 | AM297: 66.7 | AN297: 177 | AO297: 1.9e-002 | AP297: 28 | AQ297: 智能转债!
A298: 297 | B298: 128069 | C298: 华森转债! | D298: 2907 | E298: 华森制药 | F298: 医药 | G298: 化学制药 | H298: 119.749 | I298: -2.e-002 | J298: 1.0500000000000001e-002 | K298: 15.5 | L298: -2.64e-002 | M298: 119.3 | N298: 18.01 | O298: 0.39100000000000001 | P298: 86.06 | Q298: 已到 | R298: 3.42年 | S298: 1.42年 | T298: 3 | U298: 29 | V298: 8.0000000000000002e-002 | W298: 4.8000000000000001e-002 | X298: 4.0999999999999995e-002 | Y298: 62 | Z298: 5.25 | AA298: -1.1000000000000001e-003 | AB298: -1.0800000000000001e-002 | AC298: -9.2499999999999999e-002 | AD298: -9.5500000000000002e-002 | AE298: 94.04 | AF298: 98.67 | AG298: 0.36 | AH298: AA- | AI298: 5.8299999999999998e-002 | AJ298: =H298+100*O298 -> 158.84899999999999 | AK298: 153.4 | AL298: 108 | AM298: 54.8 | AN298: 84 | AO298: -7.5999999999999998e-002 | AP298: 43 | AQ298: 华森转债!
A299: 298 | B299: 113027 | C299: 华钰转债!! | D299: 601020 | E299: ST华钰 | F299: 有色金属 | G299: 锌铅镍锡 | H299: 137.01 | I299: 4.4800000000000006e-002 | J299: -6.3e-003 | K299: 12.13 | L299: 5.0199999999999995e-002 | M299: 114.3 | N299: 10.17 | O299: 0.14899999999999999 | P299: 119.27 | Q299: 已到 | R299: 3.39年 | S299: 1.39年 | T299: 3.1 | U299: 1150. | V299: 2.6899999999999999 | W299: 4.5999999999999999e-002 | X299: 5.5e-002 | Y299: 67 | Z299: 2.59 | AA299: -5.2999999999999999e-002 | AB299: -5.9999999999999998e-002 | AC299: -0.14999999999999999 | AD299: -0.153 | AE299: 91.37 | AF299: 88.73 | AG299: 0.77 | AH299: A | AI299: 7.9299999999999995e-002 | AJ299: =H299+100*O299 -> 151.91 | AK299: 154.7 | AL299: 121 | AM299: 63.4 | AN299: 154 | AO299: -3.4000000000000002e-002 | AP299: 40 | AQ299: 华钰转债!!
A300: 299 | B300: 123027 | C300: 蓝晓转债! | D300: 300487 | E300: 蓝晓科技 | F300: 化工 | G300: 化工 | H300: 376.445 | I300: -1.9299999999999998e-002 | J300: -6.7000000000000002e-003 | K300: 100 | L300: -2.6499999999999999e-002 | M300: 118.8 | N300: 29.02 | O300: 9.1999999999999998e-002 | P300: 344.59 | Q300: 已到 | R300: 3.38年 | S300: 1.38年 | T300: 1.07 | U300: 505 | V300: 1.22 | W300: 5.0000000000000001e-003 | X300: 1.7000000000000001e-002 | Y300: 220 | Z300: 11.11 | AA300: -0.29299999999999998 | AB300: -0.29899999999999999 | AC300: -0.442 | AD300: -0.44299999999999995 | AE300: 93.6 | AF300: 95.3 | AG300: 0.98 | AH300: A+ | AI300: 6.93e-002 | AJ300: =H300+100*O300 -> 385.64499999999998 | AK300: 408.3 | AL300: 378 | AM300: 313 | AN300: 378 | AO300: 2.8999999999999998e-002 | AP300: 16 | AQ300: 蓝晓转债!
A301: 300 | B301: 113537 | C301: 文灿转债!! | D301: 603348 | E301: 文灿股份 | F301: 汽车 | G301: 零部件制 | H301: 316.66 | I301: -5.1299999999999998e-002 | J301: 4.4000000000000003e-003 | K301: 55.6 | L301: -4.7899999999999998e-002 | M301: 120.7 | N301: 19.28 | O301: 9.8000000000000004e-002 | P301: 288.38 | Q301: 已到 | R301: 3.38年 | S301: 1.38年 | T301: 1.41 | U301: 675 | V301: 1.48 | W301: 1.e-002 | X301: 2.7999999999999997e-002 | Y301: 146 | Z301: 5.56 | AA301: -0.252 | AB301: -0.25900000000000001 | AC301: -0.41100000000000003 | AD301: -0.41299999999999998 | AE301: 95.01 | AF301: 100.16 | AG301: 0.98 | AH301: AA- | AI301: 5.8299999999999998e-002 | AJ301: =H301+100*O301 -> 326.46000000000004 | AK301: 344.9 | AL301: 370 | AM301: 244.8 | AN301: 370 | AO301: -6.0999999999999999e-002 | AP301: 22 | AQ301: 文灿转债!!
A302: 301 | B302: 113535 | C302: 大业转债! | D302: 603278 | E302: 大业股份 | F302: 汽车 | G302: 零部件制 | H302: 123.06 | I302: 1.6000000000000001e-003 | J302: 4.6999999999999993e-003 | K302: 11.81 | L302: 1.6399999999999998e-002 | M302: 112.5 | N302: 12.29 | O302: 0.28100000000000003 | P302: 96.09 | Q302: 已到 | R302: 2.29年 | S302: 0.29年 | T302: 5 | U302: 16 | V302: 2.7000000000000003e-002 | W302: 0.14599999999999999 | X302: 0.14000000000000001 | Y302: 34 | Z302: 1.92 | AA302: -3.8900000000000004e-002 | AB302: -4.82e-002 | AC302: -0.40899999999999997 | AD302: -0.41399999999999998 | AE302: 99.64 | AF302: 103.94 | AG302: 0.38 | AH302: AA | AI302: 3.56e-002 | AJ302: =H302+100*O302 -> 151.16 | AK302: 150 | AL302: 75 | AM302: 46.1 | AN302: 35 | AO302: -1.1000000000000001e-002 | AP302: 46 | AQ302: 大业转债!
A303: 302 | B303: 128066 | C303: 亚泰转债! | D303: 2811 | E303: 郑中设计 | F303: 建筑 | G303: 装饰工程 | H303: 117.499 | I303: 0. | J303: -4.3e-003 | K303: 8.82 | L303: -9.0000000000000011e-003 | M303: 116.7 | N303: 9.27 | O303: 0.23499999999999999 | P303: 95.15 | Q303: 已到 | R303: 3.23年 | S303: 1.23年 | T303: 4.8 | U303: 6.6 | V303: 1.2e-002 | W303: 0.20100000000000001 | X303: 0.192 | Y303: 24 | Z303: 1.71 | AA303: -2.2000000000000001e-003 | AB303: -1.1200000000000002e-002 | AC303: -9.0500000000000011e-002 | AD303: -9.4200000000000006e-002 | AE303: 95.27 | AF303: 97.6 | AG303: 0.48 | AH303: AA- | AI303: 5.8299999999999998e-002 | AJ303: =H303+100*O303 -> 140.999 | AK303: 139.9 | AL303: 13 | AM303: 42.3 | AN303: 20 | AO303: -2.9999999999999999e-002 | AP303: 67 | AQ303: 亚泰转债!
A304: 303 | B304: 110058 | C304: 永鼎转债! | D304: 600105 | E304: 永鼎股份 | F304: 通信互联 | G304: 通信设备 | H304: 123.6 | I304: -1.06e-002 | J304: 8.0000000000000004e-004 | K304: 4.59 | L304: -2.1299999999999999e-002 | M304: 114.3 | N304: 5.04 | O304: 0.35700000000000004 | P304: 91.07 | Q304: 已到 | R304: 3.23年 | S304: 1.23年 | T304: 2.61 | U304: 11 | V304: 3.3000000000000002e-002 | W304: 4.0000000000000001e-002 | X304: 3.7000000000000005e-002 | Y304: 65 | Z304: 2.26 | AA304: -2.4399999999999998e-002 | AB304: -3.2099999999999997e-002 | AC304: -0.115 | AD304: -0.11800000000000001 | AE304: 95.05 | AF304: 95.57 | AG304: 0.46 | AH304: AA- | AI304: 5.8299999999999998e-002 | AJ304: =H304+100*O304 -> 159.30000000000001 | AK304: 156.1 | AL304: 128 | AM304: 60.6 | AN304: 127 | AO304: -0.13200000000000001 | AP304: 44 | AQ304: 永鼎转债!
A305: 304 | B305: 127013 | C305: 创维转债! | D305: 810 | E305: 创维数字 | F305: 电子 | G305: 电子产品 | H305: 141.715 | I305: -3.0600000000000002e-002 | J305: -1.9799999999999998e-002 | K305: 12.75 | L305: -8.2699999999999996e-002 | M305: 117.3 | N305: 11.29 | O305: 0.255 | P305: 112.93 | Q305: 已到 | R305: 3.23年 | S305: 1.23年 | T305: 9.78 | U305: 337 | V305: 0.24399999999999999 | W305: 7.2000000000000008e-002 | X305: 8.1000000000000003e-002 | Y305: 136 | Z305: 3.2 | AA305: -5.7999999999999996e-002 | AB305: -6.6600000000000006e-002 | AC305: -0.18899999999999997 | AD305: -0.192 | AE305: 97.73 | AF305: 104.49 | AG305: 0.61 | AH305: AA | AI305: 3.73e-002 | AJ305: =H305+100*O305 -> 167.215 | AK305: 170.5 | AL305: 247 | AM305: 66 | AN305: 168 | AO305: 8.5999999999999993e-002 | AP305: 24 | AQ305: 创维转债!
A306: 305 | B306: 113026 | C306: 核能转债!! | D306: 601985 | E306: 中国核电 | F306: 能源电力 | G306: 核电 | H306: 127.65 | I306: -1.06e-002 | J306: -2.0000000000000001e-004 | K306: 7.33 | L306: -1.0800000000000001e-002 | M306: 109.3 | N306: 5.73 | O306: -2.e-003 | P306: 127.92 | Q306: 已到 | R306: 3.23年 | S306: 1.23年 | T306: 60.3 | U306: 640 | V306: 8.199999999999999e-002 | W306: 4.7e-002 | X306: 5.9999999999999998e-002 | Y306: 1284. | Z306: 1.99 | AA306: -4.7899999999999998e-002 | AB306: -5.2900000000000003e-002 | AC306: -0.13400000000000001 | AD306: -0.13699999999999998 | AE306: 98.65 | AF306: 99.48 | AG306: 1 | AH306: AAA | AI306: 3.0299999999999997e-002 | AJ306: =H306+100*O306 -> 127.45 | AK306: 127.4 | AL306: 3 | AM306: 27.9 | AN306: 2 | AO306: -5.5e-002 | AP306: 38 | AQ306: 核能转债!!
A307: 306 | B307: 113025 | C307: 明泰转债!! | D307: 601677 | E307: 明泰铝业 | F307: 有色金属 | G307: 铝金属 | H307: 407.86 | I307: -2.1099999999999997e-002 | J307: 6.6e-003 | K307: 40.05 | L307: -1.4800000000000001e-002 | M307: 114.5 | N307: 11 | O307: 0.12 | P307: 364.09 | Q307: 已到 | R307: 3.21年 | S307: 1.21年 | T307: 11 | U307: 144 | V307: 3.2000000000000001e-002 | W307: 4.0000000000000001e-002 | X307: 0.14599999999999999 | Y307: 273 | Z307: 2.72 | AA307: -0.33100000000000002 | AB307: -0.33500000000000002 | AC307: -0.52200000000000002 | AD307: -0.52300000000000002 | AE307: 97.81 | AF307: 102.06 | AG307: 0.99 | AH307: AA | AI307: 3.73e-002 | AJ307: =H307+100*O307 -> 419.86000000000001 | AK307: 451.6 | AL307: 382 | AM307: 349.6 | AN307: 381 | AO307: -5.5e-002 | AP307: 17 | AQ307: 明泰转债!!
A308: 307 | B308: 113534 | C308: 鼎胜转债!! | D308: 603876 | E308: 鼎胜新材 | F308: 有色金属 | G308: 小金属 | H308: 246.11 | I308: -9.4999999999999998e-003 | J308: -1.61e-002 | K308: 34.62 | L308: -2.6200000000000001e-002 | M308: 114.3 | N308: 15.18 | O308: 7.9000000000000001e-002 | P308: 228.06 | Q308: 已到 | R308: 3.21年 | S308: 1.21年 | T308: 4.04 | U308: 62 | V308: 6.2e-002 | W308: 2.4e-002 | X308: 5.5e-002 | Y308: 168 | Z308: 3.6 | AA308: -0.21600000000000003 | AB308: -0.221 | AC308: -0.40799999999999997 | AD308: -0.40899999999999997 | AE308: 95.16 | AF308: 95.68 | AG308: 0.98 | AH308: AA- | AI308: 5.8299999999999998e-002 | AJ308: =H308+100*O308 -> 254.01000000000002 | AK308: 264.2 | AL308: 363 | AM308: 168.5 | AN308: 363 | AO308: -6.4000000000000001e-002 | AP308: 27 | AQ308: 鼎胜转债!!
A309: 308 | B309: 113024 | C309: 核建转债! | D309: 601611 | E309: 中国核建 | F309: 建筑 | G309: 建筑工程 | H309: 126.32 | I309: -1.2800000000000001e-002 | J309: -3.3e-003 | K309: 8.89 | L309: -4.0000000000000001e-002 | M309: 109.3 | N309: 9.7 | O309: 0.37799999999999995 | P309: 91.65 | Q309: 已到 | R309: 3.21年 | S309: 1.21年 | T309: 30 | U309: 63 | V309: 1.7000000000000001e-002 | W309: 0.127 | X309: 0.11699999999999999 | Y309: 235 | Z309: 1.89 | AA309: -4.4999999999999998e-002 | AB309: -5.0000000000000003e-002 | AC309: -0.13 | AD309: -0.13300000000000001 | AE309: 98.71 | AF309: 99.54 | AG309: 0.4 | AH309: AAA | AI309: 3.0299999999999997e-002 | AJ309: =H309+100*O309 -> 164.12 | AK309: 161 | AL309: 171 | AM309: 61.5 | AN309: 133 | AO309: -7.6999999999999999e-002 | AP309: 30 | AQ309: 核建转债!
A310: 309 | B310: 128063 | C310: 未来转债! | D310: 2631 | E310: 德尔未来 | F310: 其他 | G310: 家居用品 | H310: 120.181 | I310: 1.e-004 | J310: -3.9000000000000003e-003 | K310: 6.84 | L310: -1.72e-002 | M310: 127.5 | N310: 8.64 | O310: 0.51800000000000002 | P310: 79.17 | Q310: 已到 | R310: 3.19年 | S310: 2.19年 | T310: 6.29 | U310: 5.8 | V310: 8.0000000000000002e-003 | W310: 0.14000000000000001 | X310: 0.111 | Y310: 45 | Z310: 2.63 | AA310: 1.9299999999999998e-002 | AB310: 4.7999999999999996e-003 | AC310: -4.4699999999999997e-002 | AD310: -5.0700000000000002e-002 | AE310: 94.97 | AF310: 107.04 | AG310: 0.22 | AH310: AA- | AI310: 5.8299999999999998e-002 | AJ310: =H310+100*O310 -> 171.98099999999999 | AK310: 161.2 | AL310: 174 | AM310: 54.2 | AN310: 78 | AO310: -5.7000000000000002e-002 | AP310: 34 | AQ310: 未来转债!
A311: 310 | B311: 113532 | C311: 海环转债! | D311: 603817 | E311: 海峡环保 | F311: 城市公用 | G311: 三废处理 | H311: 114.86 | I311: 4.1999999999999997e-003 | J311: -3.8e-003 | K311: 6.17 | L311: 1.6000000000000001e-003 | M311: 112.3 | N311: 7.63 | O311: 0.41999999999999998 | P311: 80.87 | Q311: 已到 | R311: 3.19年 | S311: 1.19年 | T311: 4.59 | U311: 5 | V311: 1.e-002 | W311: 0.16500000000000001 | X311: 0.13400000000000001 | Y311: 28 | Z311: 1.53 | AA311: -7.1999999999999998e-003 | AB311: -1.41e-002 | AC311: -7.9100000000000004e-002 | AD311: -8.2699999999999996e-002 | AE311: 97.86 | AF311: 100.18 | AG311: 0.27 | AH311: AA | AI311: 3.73e-002 | AJ311: =H311+100*O311 -> 156.86000000000001 | AK311: 148.9 | AL311: 61 | AM311: 48.7 | AN311: 47 | AO311: -1.8000000000000002e-002 | AP311: 34 | AQ311: 海环转债!
A312: 311 | B312: 128062 | C312: 亚药转债! | D312: 2370 | E312: 亚太药业 | F312: 医药 | G312: 化学制药 | H312: 102.118 | I312: -9.4999999999999998e-003 | J312: 9.4999999999999998e-003 | K312: 7.71 | L312: -0.10000000000000001 | M312: 119.3 | N312: 16.25 | O312: 1.1499999999999999 | P312: 47.45 | Q312: 已到 | R312: 3.19年 | S312: 1.19年 | T312: 9.62 | U312: 106 | V312: 0.10800000000000001 | W312: 0.23300000000000001 | X312: 0.11 | Y312: 41 | Z312: 11.44 | AA312: 5.1100000000000007e-002 | AB312: 3.9900000000000005e-002 | AC312: 5.0000000000000001e-003 | AD312: 8.9999999999999998e-004 | AE312: 83.31 | AF312: 73.3 | AG312: 0 | AH312: B | AI312: 0.16930000000000001 | AJ312: =H312+100*O312 -> 217.11799999999999 | AK312: 156.8 | AL312: 135 | AM312: 73.5 | AN312: 230 | AO312: 0.24199999999999999 | AP312: 94 | AQ312: 亚药转债!
A313: 312 | B313: 110057 | C313: 现代转债 | D313: 600420 | E313: 国药现代 | F313: 医药 | G313: 化学制药 | H313: 120.23 | I313: -1.0700000000000001e-002 | J313: -2.9999999999999997e-004 | K313: 9.38 | L313: -2.3900000000000001e-002 | M313: 110.3 | N313: 9.79 | O313: 0.255 | P313: 95.81 | Q313: 已到 | R313: 3.19年 | S313: 1.19年 | T313: 16.2 | U313: 12 | V313: 6.0000000000000001e-003 | W313: 0.16800000000000001 | X313: 0.161 | Y313: 96 | Z313: 1.15 | AA313: -2.7200000000000002e-002 | AB313: -3.3000000000000002e-002 | AC313: -0.10300000000000001 | AD313: -0.106 | AE313: 98.76 | AF313: 100.5 | AG313: 0.46 | AH313: AAA | AI313: 3.0299999999999997e-002 | AJ313: =H313+100*O313 -> 145.73000000000002 | AK313: 144.6 | AL313: 30 | AM313: 44.1 | AN313: 27 | AO313: -7.2999999999999995e-002 | AP313: 23 | AQ313: 现代转债
A314: 313 | B314: 123025 | C314: 精测转债!! | D314: 300567 | E314: 精测电子 | F314: 电子 | G314: 液晶显示 | H314: 151 | I314: -9.5999999999999992e-003 | J314: -1.5100000000000001e-002 | K314: 56.87 | L314: -3.6799999999999999e-002 | M314: 116.5 | N314: 49.37 | O314: 0.311 | P314: 115.19 | Q314: 已到 | R314: 3.18年 | S314: 1.18年 | T314: 3.09 | U314: 7.5 | V314: 1.6e-002 | W314: 2.e-002 | X314: 2.2000000000000002e-002 | Y314: 158 | Z314: 4.89 | AA314: -7.980000000000001e-002 | AB314: -8.8000000000000009e-002 | AC314: -0.22899999999999998 | AD314: -0.23100000000000001 | AE314: 95.35 | AF314: 97.69 | AG314: 0.67 | AH314: AA- | AI314: 5.8299999999999998e-002 | AJ314: =H314+100*O314 -> 182.09999999999999 | AK314: 186.8 | AL314: 307 | AM314: 89.1 | AN314: 292 | AO314: -0.126 | AP314: 14 | AQ314: 精测转债!!
A315: 314 | B315: 113530 | C315: 大丰转债! | D315: 603081 | E315: 大丰实业 | F315: 建筑 | G315: 装饰工程 | H315: 117.72 | I315: -6.1999999999999998e-003 | J315: 4.4000000000000003e-003 | K315: 12.67 | L315: -1.1699999999999999e-002 | M315: 121 | N315: 16.3 | O315: 0.51400000000000001 | P315: 77.73 | Q315: 已到 | R315: 3.18年 | S315: 1.18年 | T315: 6.3 | U315: 7.7 | V315: 1.e-002 | W315: 0.122 | X315: 9.4e-002 | Y315: 52 | Z315: 2.17 | AA315: 8.8999999999999999e-003 | AB315: -2.5000000000000001e-003 | AC315: -9.6199999999999994e-002 | AD315: -9.98e-002 | AE315: 98.03 | AF315: 108 | AG315: 0.15 | AH315: AA | AI315: 3.73e-002 | AJ315: =H315+100*O315 -> 169.12 | AK315: 157.7 | AL315: 138 | AM315: 49.7 | AN315: 52 | AO315: -5.9000000000000004e-002 | AP315: 29 | AQ315: 大丰转债!
A316: 315 | B316: 127012 | C316: 招路转债! | D316: 1965 | E316: 招商公路 | F316: 机场高速 | G316: 高速 | H316: 120.33 | I316: -2.5999999999999999e-003 | J316: -3.4000000000000002e-003 | K316: 8.16 | L316: -1.3300000000000001e-002 | M316: 107.9 | N316: 8.63 | O316: 0.27300000000000002 | P316: 94.55 | Q316: 已到 | R316: 3年59天 | S316: 1年59天 | T316: 50 | U316: 9.1 | V316: 2.e-003 | W316: 9.9000000000000005e-002 | X316: 9.4e-002 | Y316: 504 | Z316: 0.98 | AA316: -3.44e-002 | AB316: -3.8800000000000001e-002 | AC316: -0.11199999999999999 | AD316: -0.114 | AE316: 97.72 | AF316: 98.32 | AG316: 0.46 | AH316: AAA | AI316: 3.0299999999999997e-002 | AJ316: =H316+100*O316 -> 147.63 | AK316: 146.1 | AL316: 37 | AM316: 47.8 | AN316: 44 | AO316: 4.0999999999999995e-002 | AP316: 25 | AQ316: 招路转债!
A317: 316 | B317: 123024 | C317: 岱勒转债! | D317: 300700 | E317: 岱勒新材 | F317: 机械装备 | G317: 专用设备 | H317: 156.1 | I317: -2.4399999999999998e-002 | J317: 5.2000000000000005e-002 | K317: 21 | L317: 3.04e-002 | M317: 112.5 | N317: 14.1 | O317: 4.8000000000000001e-002 | P317: 148.94 | Q317: 已到 | R317: 2年58天 | S317: 58天 | T317: 2.1 | U317: 1019. | V317: 3.1299999999999999 | W317: 9.3000000000000013e-002 | X317: 0.13900000000000001 | Y317: 22 | Z317: 4.75 | AA317: -0.14199999999999999 | AB317: -0.151 | AC317: <-100% | AD317: <-100% | AE317: 99.13 | AF317: 97.89 | AG317: 0.91 | AH317: A+ | AI317: 6.7599999999999993e-002 | AJ317: =H317+100*O317 -> 160.90000000000001 | AK317: 163.3 | AL317: 195 | AM317: 64.1 | AN317: 158 | AO317: 0.35200000000000004 | AP317: 36 | AQ317: 岱勒转债!
A318: 317 | B318: 123023 | C318: 迪森转债! | D318: 300335 | E318: 迪森股份 | F318: 能源电力 | G318: 电力供应 | H318: 116.095 | I318: 5.1999999999999998e-003 | J318: -4.0000000000000001e-003 | K318: 5.52 | L318: 3.5999999999999999e-003 | M318: 114.3 | N318: 6.89 | O318: 0.44900000000000001 | P318: 80.12 | Q318: 已到 | R318: 3年57天 | S318: 2年57天 | T318: 5.29 | U318: 14 | V318: 2.2000000000000002e-002 | W318: 0.25700000000000001 | X318: 0.20600000000000002 | Y318: 21 | Z318: 1.52 | AA318: -5.0000000000000001e-003 | AB318: -1.3100000000000001e-002 | AC318: -4.4400000000000002e-002 | AD318: -4.8000000000000001e-002 | AE318: 91.94 | AF318: 95.97 | AG318: 0.33 | AH318: AA- | AI318: 5.8299999999999998e-002 | AJ318: =H318+100*O318 -> 160.995 | AK318: 152.1 | AL318: 94 | AM318: 56.1 | AN318: 97 | AO318: -6.8000000000000005e-002 | AP318: 51 | AQ318: 迪森转债!
A319: 318 | B319: 110056 | C319: 亨通转债! | D319: 600487 | E319: 亨通光电 | F319: 通信互联 | G319: 通信设备 | H319: 136.02 | I319: -1.3500000000000002e-002 | J319: 2.2000000000000001e-003 | K319: 14.59 | L319: -2.6000000000000002e-002 | M319: 114.3 | N319: 14.95 | O319: 0.39399999999999996 | P319: 97.59 | Q319: 已到 | R319: 3年56天 | S319: 1年56天 | T319: 17.1 | U319: 4.7 | V319: 2.e-003 | W319: 5.0000000000000003e-002 | X319: 4.8000000000000001e-002 | Y319: 345 | Z319: 1.67 | AA319: -5.4800000000000001e-002 | AB319: -6.2199999999999998e-002 | AC319: -0.17899999999999999 | AD319: -0.182 | AE319: 98.62 | AF319: 103.63 | AG319: 0.43 | AH319: AA+ | AI319: 3.2300000000000002e-002 | AJ319: =H319+100*O319 -> 175.42000000000002 | AK319: 174.4 | AL319: 269 | AM319: 70.8 | AN319: 217 | AO319: -2.7000000000000003e-002 | AP319: 23 | AQ319: 亨通转债!
A320: 319 | B320: 123022 | C320: 长信转债!! | D320: 300088 | E320: 长信科技 | F320: 通信互联 | G320: 通信设备 | H320: 218.1 | I320: 4.0000000000000002e-004 | J320: -3.0000000000000001e-003 | K320: 11.34 | L320: -2.5999999999999999e-003 | M320: 114.3 | N320: 6.05 | O320: 0.16399999999999998 | P320: 187.44 | Q320: 已到 | R320: 3年55天 | S320: 1年55天 | T320: 2.56 | U320: 211 | V320: 0.375 | W320: 9.0000000000000011e-003 | X320: 1.7000000000000001e-002 | Y320: 278 | Z320: 3.69 | AA320: -0.188 | AB320: -0.19399999999999998 | AC320: -0.39000000000000001 | AD320: -0.39100000000000001 | AE320: 98.01 | AF320: 102.11 | AG320: 0.97 | AH320: AA | AI320: 3.73e-002 | AJ320: =H320+100*O320 -> 234.5 | AK320: 248.8 | AL320: 356 | AM320: 146.7 | AN320: 356 | AO320: -9.5000000000000001e-002 | AP320: 11 | AQ320: 长信转债!!
A321: 320 | B321: 110055 | C321: 伊力转债!! | D321: 600197 | E321: 伊力特 | F321: 食品饮料 | G321: 白酒 | H321: 198.04 | I321: 1.49e-002 | J321: -1.0800000000000001e-002 | K321: 24.68 | L321: 4.5000000000000005e-003 | M321: 114.3 | N321: 16.41 | O321: 0.317 | P321: 150.4 | Q321: 已到 | R321: 3年52天 | S321: 1年52天 | T321: 2.44 | U321: 179 | V321: 0.36899999999999999 | W321: 2.1000000000000001e-002 | X321: 3.1e-002 | Y321: 116 | Z321: 3.23 | AA321: -0.16300000000000001 | AB321: -0.16899999999999998 | AC321: -0.35700000000000004 | AD321: -0.35899999999999999 | AE321: 98.04 | AF321: 102.14 | AG321: 0.9 | AH321: AA | AI321: 3.73e-002 | AJ321: =H321+100*O321 -> 229.73999999999998 | AK321: 245.7 | AL321: 354 | AM321: 143.5 | AN321: 354 | AO321: -7.0999999999999994e-002 | AP321: 20 | AQ321: 伊力转债!!
A322: 321 | B322: 110053 | C322: 苏银转债! | D322: 600919 | E322: 江苏银行 | F322: 金融 | G322: 银行行业 | H322: 125 | I322: -4.4000000000000003e-003 | J322: 1.2999999999999999e-003 | K322: 6.81 | L322: -5.7999999999999996e-003 | M322: 118.3 | N322: 6.37 | O322: 0.16899999999999998 | P322: 106.91 | Q322: 已到 | R322: 3年51天 | S322: 无权 | T322: 200 | U322: 229 | V322: 9.0000000000000011e-003 | W322: 0.19899999999999998 | X322: 0.21299999999999999 | Y322: 1006. | Z322: 0.69 | AA322: -1.8000000000000002e-002 | AB322: -2.7900000000000001e-002 | AC322: 无权 | AD322: 无权 | AE322: 无权 | AF322: 108.07 | AG322: 0.53 | AH322: AAA | AI322: 3.0299999999999997e-002 | AJ322: =H322+100*O322 -> 141.90000000000001 | AK322: 143.1 | AL322: 27 | AM322: 35 | AN322: 7 | AO322: 9.6999999999999989e-002 | AP322: 31 | AQ322: 苏银转债!
A323: 322 | B323: 127011 | C323: 中鼎转2!! | D323: 887 | E323: 中鼎股份 | F323: 汽车 | G323: 零部件制 | H323: 196.269 | I323: -2.6000000000000002e-002 | J323: 1.7100000000000001e-002 | K323: 22.67 | L323: -9.1999999999999998e-003 | M323: 114.5 | N323: 11.39 | O323: -1.3999999999999999e-002 | P323: 199.03 | Q323: 已到 | R323: 3年45天 | S323: 1年45天 | T323: 11.7 | U323: 317 | V323: 0.13600000000000001 | W323: 4.2999999999999997e-002 | X323: 8.5000000000000006e-002 | Y323: 275 | Z323: 3.01 | AA323: -0.161 | AB323: -0.16800000000000001 | AC323: -0.35999999999999999 | AD323: -0.36099999999999999 | AE323: 98.75 | AF323: 103.92 | AG323: 0.97 | AH323: AA+ | AI323: 3.2300000000000002e-002 | AJ323: =H323+100*O323 -> 194.869 | AK323: 193.5 | AL323: 321 | AM323: 89.6 | AN323: 295 | AO323: 1.2e-002 | AP323: 18 | AQ323: 中鼎转2!!
A324: 323 | B324: 110052 | C324: 贵广转债! | D324: 600996 | E324: 贵广网络 | F324: 传媒娱乐 | G324: 影视娱乐 | H324: 118.11 | I324: -2.6000000000000002e-002 | J324: 2.5999999999999999e-003 | K324: 6.78 | L324: -9.9600000000000008e-002 | M324: 117.7 | N324: 7.94 | O324: 0.38299999999999995 | P324: 85.39 | Q324: 已到 | R324: 3年42天 | S324: 1年42天 | T324: 15.3 | U324: 336 | V324: 0.183 | W324: 0.214 | X324: 0.183 | Y324: 71 | Z324: 1.86 | AA324: -1.1000000000000001e-003 | AB324: -1.11e-002 | AC324: -0.10199999999999999 | AD324: -0.10000000000000001 | AE324: 98.96 | AF324: 106.85 | AG324: 0.23 | AH324: AA+ | AI324: 3.2300000000000002e-002 | AJ324: =H324+100*O324 -> 156.41 | AK324: 150.8 | AL324: 81 | AM324: 44 | AN324: 25 | AO324: 0.128 | AP324: 30 | AQ324: 贵广转债!
A325: 324 | B325: 113021 | C325: 中信转债! | D325: 601998 | E325: 中信银行 | F325: 金融 | G325: 银行行业 | H325: 111.5 | I325: 8.9999999999999998e-004 | J325: -1.8e-003 | K325: 4.76 | L325: -8.3000000000000001e-003 | M325: 118 | N325: 6.73 | O325: 0.57600000000000007 | P325: 70.73 | Q325: 已到 | R325: 3年41天 | S325: 无权 | T325: 400 | U325: 80 | V325: 2.e-003 | W325: 0.17199999999999999 | X325: 0.121 | Y325: 2329. | Z325: 0.47 | AA325: 1.9e-002 | AB325: 8.5000000000000006e-003 | AC325: 无权 | AD325: 无权 | AE325: 无权 | AF325: 107.88 | AG325: 0.1 | AH325: AAA | AI325: 3.0299999999999997e-002 | AJ325: =H325+100*O325 -> 169.10000000000002 | AK325: 152.3 | AL325: 98 | AM325: 44.4 | AN325: 29 | AO325: 1.9e-002 | AP325: 37 | AQ325: 中信转债!
A326: 325 | B326: 128056 | C326: 今飞转债! | D326: 2863 | E326: 今飞凯达 | F326: 汽车 | G326: 零部件制 | H326: 120.87 | I326: -6.0000000000000001e-003 | J326: 9.1000000000000004e-003 | K326: 5.59 | L326: 9.0000000000000011e-003 | M326: 120.2 | N326: 6.69 | O326: 0.44700000000000001 | P326: 83.56 | Q326: 已到 | R326: 3年37天 | S326: 1年37天 | T326: 1.72 | U326: 2.7 | V326: 1.3000000000000001e-002 | W326: 6.2e-002 | X326: 5.2000000000000005e-002 | Y326: 28 | Z326: 1.48 | AA326: -1.8e-003 | AB326: -1.3000000000000001e-002 | AC326: -0.111 | AD326: -0.115 | AE326: 95.05 | AF326: 98.18 | AG326: 0.35 | AH326: A+ | AI326: 6.93e-002 | AJ326: =H326+100*O326 -> 165.56999999999999 | AK326: 158.2 | AL326: 146 | AM326: 60 | AN326: 122 | AO326: -5.9999999999999998e-002 | AP326: 46 | AQ326: 今飞转债!
A327: 326 | B327: 128053 | C327: 尚荣转债! | D327: 2551 | E327: 尚荣医疗 | F327: 医药 | G327: 医疗器械 | H327: 135.185 | I327: -1.83e-002 | J327: -4.6999999999999993e-003 | K327: 5.26 | L327: -2.5899999999999999e-002 | M327: 114.3 | N327: 4.88 | O327: 0.254 | P327: 107.79 | Q327: 已到 | R327: 3年23天 | S327: 1年23天 | T327: 1.9 | U327: 53 | V327: 0.20600000000000002 | W327: 4.2999999999999997e-002 | X327: 4.5999999999999999e-002 | Y327: 44 | Z327: 1.41 | AA327: -5.4400000000000004e-002 | AB327: -6.2100000000000002e-002 | AC327: -0.191 | AD327: -0.19399999999999998 | AE327: 98.32 | AF327: 102.43 | AG327: 0.89 | AH327: AA | AI327: 3.73e-002 | AJ327: =H327+100*O327 -> 160.58500000000001 | AK327: 162.6 | AL327: 187 | AM327: 60.2 | AN327: 124 | AO327: -6.3e-002 | AP327: 21 | AQ327: 尚荣转债!
A328: 327 | B328: 113527 | C328: 维格转债!! | D328: 603518 | E328: 锦泓集团 | F328: 服装纺织 | G328: 服装行业 | H328: 137.76 | I328: 5.6999999999999993e-003 | J328: -3.0000000000000001e-003 | K328: 10.93 | L328: 4.5999999999999999e-003 | M328: 119.5 | N328: 9.85 | O328: 0.24100000000000002 | P328: 110.96 | Q328: 已到 | R328: 3年2.1天 | S328: 1年2.1天 | T328: 2.86 | U328: 137 | V328: 0.34200000000000003 | W328: 8.8000000000000009e-002 | X328: 9.8000000000000004e-002 | Y328: 32 | Z328: 1.33 | AA328: -4.7100000000000003e-002 | AB328: -5.7599999999999998e-002 | AC328: -0.214 | AD328: -0.217 | AE328: 97.47 | AF328: 104.33 | AG328: 0.58 | AH328: AA | AI328: 4.7300000000000002e-002 | AJ328: =H328+100*O328 -> 161.85999999999999 | AK328: 164.6 | AL328: 204 | AM328: 60.2 | AN328: 125 | AO328: -8.900000000000001e-002 | AP328: 65 | AQ328: 维格转债!!
A329: 328 | B329: 113526 | C329: 联泰转债! | D329: 603797 | E329: 联泰环保 | F329: 城市公用 | G329: 三废处理 | H329: 223.33 | I329: -1.5300000000000001e-002 | J329: 1.23e-002 | K329: 6.62 | L329: -4.5000000000000005e-003 | M329: 110.3 | N329: 5.92 | O329: 0.997 | P329: 111.82 | Q329: 已到 | R329: 3年1.1天 | S329: 1年1.1天 | T329: 1.93 | U329: 18 | V329: 4.2000000000000003e-002 | W329: 5.0000000000000003e-002 | X329: 5.5999999999999994e-002 | Y329: 39 | Z329: 1.53 | AA329: -0.21299999999999999 | AB329: -0.217 | AC329: -0.45600000000000002 | AD329: -0.45700000000000002 | AE329: 99.09 | AF329: 100.48 | AG329: 0.65 | AH329: AA+ | AI329: 3.2300000000000002e-002 | AJ329: =H329+100*O329 -> 323.03000000000003 | AK329: 334.8 | AL329: 369 | AM329: 234.4 | AN329: 369 | AO329: -3.7999999999999999e-002 | AP329: 7 | AQ329: 联泰转债!
A330: 329 | B330: 123018 | C330: 溢利转债! | D330: 300381 | E330: 溢多利 | F330: 医药 | G330: 原料药 | H330: 178.75 | I330: -9.1000000000000004e-003 | J330: -1.2800000000000001e-002 | K330: 10.68 | L330: -2.7300000000000001e-002 | M330: 113.3 | N330: 8.25 | O330: 0.38100000000000001 | P330: 129.45 | Q330: 已到 | R330: 2.91年 | S330: 0.91年 | T330: 0.54 | U330: 18 | V330: 0.185 | W330: 1.e-002 | X330: 1.3000000000000001e-002 | Y330: 52 | Z330: 1.76 | AA330: -0.14699999999999999 | AB330: -0.153 | AC330: -0.39700000000000002 | AD330: -0.39899999999999997 | AE330: 95.96 | AF330: 96.76 | AG330: 0.8 | AH330: AA- | AI330: 5.6600000000000004e-002 | AJ330: =H330+100*O330 -> 216.84999999999999 | AK330: 228 | AL330: 348 | AM330: 131.3 | AN330: 350 | AO330: -7.6999999999999999e-002 | AP330: 9 | AQ330: 溢利转债!
A331: 330 | B331: 113525 | C331: 台华转债!! | D331: 603055 | E331: 台华新材 | F331: 服装纺织 | G331: 纺织行业 | H331: 232.64 | I331: -2.4900000000000002e-002 | J331: 3.0000000000000001e-003 | K331: 16.14 | L331: -2.2400000000000003e-002 | M331: 113.3 | N331: 7.78 | O331: 0.121 | P331: 207.46 | Q331: 已到 | R331: 2.90年 | S331: 0.90年 | T331: 1.82 | U331: 46 | V331: 0.107 | W331: 1.3000000000000001e-002 | X331: 2.7000000000000003e-002 | Y331: 140 | Z331: 3.92 | AA331: -0.222 | AB331: -0.22800000000000001 | AC331: -0.52300000000000002 | AD331: -0.52500000000000002 | AE331: 98.07 | AF331: 102.52 | AG331: 0.98 | AH331: AA | AI331: 3.56e-002 | AJ331: =H331+100*O331 -> 244.73999999999998 | AK331: 257.8 | AL331: 359 | AM331: 155.3 | AN331: 357 | AO331: -6.0000000000000001e-003 | AP331: 17 | AQ331: 台华转债!!
A332: 331 | B332: 113524 | C332: 奇精转债! | D332: 603677 | E332: 奇精机械 | F332: 家电 | G332: 零部件制 | H332: 119.46 | I332: -2.9999999999999997e-004 | J332: 0. | K332: 12.3 | L332: -8.0000000000000004e-004 | M332: 116.3 | N332: 13.98 | O332: 0.35799999999999998 | P332: 87.98 | Q332: 已到 | R332: 2.89年 | S332: 0.89年 | T332: 3.3 | U332: 2.6 | V332: 6.9999999999999993e-003 | W332: 0.14000000000000001 | X332: 0.12300000000000001 | Y332: 24 | Z332: 2.32 | AA332: -9.3999999999999986e-003 | AB332: -1.9099999999999999e-002 | AC332: -0.13900000000000001 | AD332: -0.14099999999999999 | AE332: 96.04 | AF332: 99.41 | AG332: 0.37 | AH332: AA- | AI332: 5.6600000000000004e-002 | AJ332: =H332+100*O332 -> 155.25999999999999 | AK332: 150.9 | AL332: 83 | AM332: 51.5 | AN332: 65 | AO332: -3.1e-002 | AP332: 40 | AQ332: 奇精转债!
A333: 332 | B333: 128050 | C333: 钧达转债!!* | D333: 2865 | E333: 钧达股份 | F333: 汽车 | G333: 零部件制 | H333: 392 | I333: 1.2e-002 | J333: -1.2500000000000001e-002 | K333: 57.7 | L333: -5.0000000000000001e-004 | M333: 121.5 | N333: 14.81 | O333: 6.0000000000000001e-003 | P333: 389.6 | Q333: 已到 | R333: 6.1天 | S333: 无权 | T333: 0.29 | U333: 396 | V333: 3.5 | W333: 4.0000000000000001e-003 | X333: 1.3999999999999999e-002 | Y333: 79 | Z333: 7.57 | AA333: <-100% | AB333: <-100% | AC333: 无权 | AD333: 无权 | AE333: 无权 | AF333: 100.12 | AG333: 1 | AH333: AA- | AI333: 5.28e-002 | AJ333: =H333+100*O333 -> 392.60000000000002 | AK333: 394.4 | AL333: 375 | AM333: 294.3 | AN333: 375 | AO333: -9.3000000000000013e-002 | AP333: 43 | AQ333: 钧达转债!!*
A334: 333 | B334: 110048 | C334: 福能转债!! | D334: 600483 | E334: 福能股份 | F334: 能源电力 | G334: 电力供应 | H334: 218.74 | I334: 1.e-002 | J334: -8.6e-003 | K334: 13.77 | L334: 1.5e-003 | M334: 112.3 | N334: 7.85 | O334: 0.247 | P334: 175.41 | Q334: 已到 | R334: 2.87年 | S334: 0.87年 | T334: 12.8 | U334: 274 | V334: 9.6999999999999989e-002 | W334: 4.7e-002 | X334: 8.3000000000000004e-002 | Y334: 269 | Z334: 3.39 | AA334: -0.20899999999999999 | AB334: -0.215 | AC334: -0.51200000000000001 | AD334: -0.51300000000000001 | AE334: 98.66 | AF334: 103.12 | AG334: 0.96 | AH334: AA+ | AI334: 3.0600000000000002e-002 | AJ334: =H334+100*O334 -> 243.44 | AK334: 262.1 | AL334: 361 | AM334: 158.9 | AN334: 359 | AO334: -7.6999999999999999e-002 | AP334: 9 | AQ334: 福能转债!!
A335: 334 | B335: 128049 | C335: 华源转债! | D335: 2787 | E335: 华源控股 | F335: 造纸包装 | G335: 包装材料 | H335: 114 | I335: -8.5000000000000006e-003 | J335: 1.23e-002 | K335: 6.06 | L335: 1.1699999999999999e-002 | M335: 113.5 | N335: 7.37 | O335: 0.38600000000000001 | P335: 82.23 | Q335: 已到 | R335: 2.85年 | S335: 0.85年 | T335: 3.63 | U335: 8.4 | V335: 2.e-002 | W335: 0.19 | X335: 0.156 | Y335: 19 | Z335: 1.25 | AA335: -1.6000000000000001e-003 | AB335: -1.01e-002 | AC335: -0.105 | AD335: -0.10800000000000001 | AE335: 96.32 | AF335: 97.28 | AG335: 0.33 | AH335: AA- | AI335: 5.6600000000000004e-002 | AJ335: =H335+100*O335 -> 152.59999999999999 | AK335: 145.8 | AL335: 36 | AM335: 48.5 | AN335: 46 | AO335: -2.5000000000000001e-002 | AP335: 43 | AQ335: 华源转债!
A336: 335 | B336: 110047 | C336: 山鹰转债 | D336: 600567 | E336: 山鹰国际 | F336: 造纸包装 | G336: 包装用纸 | H336: 121.45 | I336: -5.6000000000000008e-003 | J336: -2.0000000000000001e-004 | K336: 3.23 | L336: -1.52e-002 | M336: 116.5 | N336: 3.3 | O336: 0.24100000000000002 | P336: 97.88 | Q336: 已到 | R336: 2.83年 | S336: 0.83年 | T336: 22.5 | U336: 7.4 | V336: 3.0000000000000001e-003 | W336: 0.151 | X336: 0.14699999999999999 | Y336: 149 | Z336: 0.93 | AA336: -1.4800000000000001e-002 | AB336: -2.4799999999999999e-002 | AC336: -0.16200000000000001 | AD336: -0.16500000000000001 | AE336: 98.83 | AF336: 107.12 | AG336: 0.38 | AH336: AA+ | AI336: 3.0600000000000002e-002 | AJ336: =H336+100*O336 -> 145.55000000000001 | AK336: 145 | AL336: 34 | AM336: 37.9 | AN336: 10 | AO336: -2.6000000000000002e-002 | AP336: 27 | AQ336: 山鹰转债
A337: 336 | B337: 128048 | C337: 张行转债 | D337: 2839 | E337: 张家港行 | F337: 金融 | G337: 银行行业 | H337: 131.499 | I337: 6.8999999999999999e-003 | J337: -6.8999999999999999e-003 | K337: 6.44 | L337: 0. | M337: 112.3 | N337: 5.6 | O337: 0.14300000000000002 | P337: 115 | Q337: 已到 | R337: 2.81年 | S337: 无权 | T337: 25 | U337: 57 | V337: 1.7000000000000001e-002 | W337: 0.215 | X337: 0.247 | Y337: 116 | Z337: 1.01 | AA337: -5.5500000000000001e-002 | AB337: -6.2899999999999998e-002 | AC337: 无权 | AD337: 无权 | AE337: 无权 | AF337: 103.33 | AG337: 0.65 | AH337: AA+ | AI337: 3.0600000000000002e-002 | AJ337: =H337+100*O337 -> 145.79900000000001 | AK337: 148 | AL337: 58 | AM337: 44.7 | AN337: 30 | AO337: 7.4999999999999997e-002 | AP337: 11 | AQ337: 张行转债
A338: 337 | B338: 113519 | C338: 长久转债! | D338: 603569 | E338: 长久物流 | F338: 交通运输 | G338: 物流业 | H338: 114.39 | I338: 3.4000000000000002e-003 | J338: -2.8000000000000004e-003 | K338: 7.26 | L338: 9.7000000000000003e-003 | M338: 118.3 | N338: 11.04 | O338: 0.7390000000000001 | P338: 65.76 | Q338: 已到 | R338: 2.79年 | S338: 0.79年 | T338: 6.97 | U338: 31 | V338: 3.9e-002 | W338: 0.17100000000000001 | X338: 0.113 | Y338: 41 | Z338: 1.92 | AA338: 1.23e-002 | AB338: 8.0000000000000004e-004 | AC338: -0.11599999999999999 | AD338: -0.11900000000000001 | AE338: 98.45 | AF338: 107.45 | AG338: 0.06 | AH338: AA | AI338: 3.56e-002 | AJ338: =H338+100*O338 -> 188.29000000000002 | AK338: 163 | AL338: 192 | AM338: 55.6 | AN338: 91 | AO338: -1.4999999999999999e-002 | AP338: 28 | AQ338: 长久转债!
A339: 338 | B339: 128046 | C339: 利尔转债!! | D339: 2258 | E339: 利尔化学 | F339: 化工 | G339: 农化 | H339: 168 | I339: -2.9999999999999999e-002 | J339: 1.23e-002 | K339: 30.63 | L339: -1.8600000000000002e-002 | M339: 111.3 | N339: 18.42 | O339: 1.e-002 | P339: 166.29 | Q339: 已到 | R339: 2.73年 | S339: 0.73年 | T339: 8.08 | U339: 106 | V339: 7.6999999999999999e-002 | W339: 5.0000000000000003e-002 | X339: 8.3000000000000004e-002 | Y339: 161 | Z339: 3.73 | AA339: -0.14199999999999999 | AB339: -0.14800000000000002 | AC339: -0.44299999999999995 | AD339: -0.44500000000000001 | AE339: 98.65 | AF339: 101.3 | AG339: 0.95 | AH339: AA | AI339: 3.56e-002 | AJ339: =H339+100*O339 -> 169. | AK339: 169.7 | AL339: 246 | AM339: 68.4 | AN339: 190 | AO339: -7.0999999999999994e-002 | AP339: 9 | AQ339: 利尔转债!!
A340: 339 | B340: 128044 | C340: 岭南转债! | D340: 2717 | E340: 岭南股份 | F340: 城市公用 | G340: 生态环境 | H340: 149.8 | I340: 0.13100000000000001 | J340: -4.53e-002 | K340: 4.54 | L340: 9.9299999999999999e-002 | M340: 110.3 | N340: 3.43 | O340: 0.13200000000000001 | P340: 132.36 | Q340: 已到 | R340: 2.56年 | S340: 0.56年 | T340: 6.59 | U340: 2534. | V340: 2.6299999999999999 | W340: 8.5999999999999993e-002 | X340: 0.114 | Y340: 76 | Z340: 1.62 | AA340: -0.114 | AB340: -0.121 | AC340: -0.45600000000000002 | AD340: -0.45899999999999996 | AE340: 97.83 | AF340: 96.04 | AG340: 0.86 | AH340: AA- | AI340: 5.6600000000000004e-002 | AJ340: =H340+100*O340 -> 163. | AK340: 167.2 | AL340: 226 | AM340: 69.4 | AN340: 202 | AO340: 0.25700000000000001 | AP340: 55 | AQ340: 岭南转债!
A341: 340 | B341: 123015 | C341: 蓝盾转债!! | D341: 300297 | E341: 蓝盾股份 | F341: 计算机及 | G341: 软件开发 | H341: 216.032 | I341: -2.3399999999999997e-002 | J341: 2.3399999999999997e-002 | K341: 3.64 | L341: -8.199999999999999e-003 | M341: 111.3 | N341: 5.79 | O341: 2.4399999999999999 | P341: 62.87 | Q341: 已到 | R341: 2.56年 | S341: 0.56年 | T341: 1 | U341: 171 | V341: 0.77400000000000002 | W341: 2.2000000000000002e-002 | X341: 1.3999999999999999e-002 | Y341: 45 | Z341: 2.56 | AA341: -0.23100000000000001 | AB341: -0.23699999999999999 | AC341: -0.753 | AD341: -0.75599999999999989 | AE341: 93.96 | AF341: 84.2 | AG341: 0 | AH341: BBB- | AI341: 0.1176 | AJ341: =H341+100*O341 -> 460.03200000000004 | AK341: 369.2 | AL341: 373 | AM341: 275.2 | AN341: 373 | AO341: 3.6000000000000004e-002 | AP341: 14 | AQ341: 蓝盾转债!!
A342: 341 | B342: 113516 | C342: 苏农转债! | D342: 603323 | E342: 苏农银行 | F342: 金融 | G342: 银行行业 | H342: 123.29 | I342: -9.1999999999999998e-003 | J342: 5.1999999999999998e-003 | K342: 5.34 | L342: -9.300000000000001e-003 | M342: 113.3 | N342: 5.37 | O342: 0.23999999999999999 | P342: 99.44 | Q342: 已到 | R342: 2.53年 | S342: 无权 | T342: 12.9 | U342: 15 | V342: 9.0000000000000011e-003 | W342: 0.13400000000000001 | X342: 0.13300000000000001 | Y342: 96 | Z342: 0.75 | AA342: -3.3399999999999999e-002 | AB342: -4.2500000000000003e-002 | AC342: 无权 | AD342: 无权 | AE342: 无权 | AF342: 105.13 | AG342: 0.44 | AH342: AA+ | AI342: 3.0600000000000002e-002 | AJ342: =H342+100*O342 -> 147.29000000000002 | AK342: 147.1 | AL342: 46 | AM342: 42 | AN342: 18 | AO342: 4.7e-002 | AP342: 23 | AQ342: 苏农转债!
A343: 342 | B343: 123014 | C343: 凯发转债! | D343: 300407 | E343: 凯发电气 | F343: 能源电力 | G343: 电力设备 | H343: 132.63 | I343: -1.1699999999999999e-002 | J343: 8.1000000000000013e-003 | K343: 8.56 | L343: -5.7999999999999996e-003 | M343: 107.5 | N343: 8.05 | O343: 0.247 | P343: 106.34 | Q343: 已到 | R343: 1.51年 | S343: 回售内 | T343: 1.16 | U343: 11 | V343: 7.400000000000001e-002 | W343: 4.4000000000000004e-002 | X343: 4.7e-002 | Y343: 26 | Z343: 1.89 | AA343: -0.13100000000000001 | AB343: -0.13900000000000001 | AC343: 回售内 | AD343: 回售内 | AE343: 100.25 | AF343: 97.48 | AG343: 0.62 | AH343: A+ | AI343: 6.7599999999999993e-002 | AJ343: =H343+100*O343 -> 157.32999999999998 | AK343: 158.9 | AL343: 154 | AM343: 58.7 | AN343: 115 | AO343: -2.9999999999999999e-002 | AP343: 16 | AQ343: 凯发转债!
A344: 343 | B344: 128042 | C344: 凯中转债! | D344: 2823 | E344: 凯中精密 | F344: 能源电力 | G344: 电力设备 | H344: 116.631 | I344: -7.4000000000000003e-003 | J344: 2.0000000000000001e-004 | K344: 9.85 | L344: -5.2900000000000003e-002 | M344: 115.3 | N344: 12.86 | O344: 0.52300000000000002 | P344: 76.59 | Q344: 已到 | R344: 2.52年 | S344: 0.52年 | T344: 4.16 | U344: 3.9 | V344: 8.0000000000000002e-003 | W344: 0.14699999999999999 | X344: 0.113 | Y344: 28 | Z344: 2.15 | AA344: -4.5999999999999999e-003 | AB344: -1.5300000000000001e-002 | AC344: -0.193 | AD344: -0.19800000000000001 | AE344: 99.4 | AF344: 105.74 | AG344: 0.14 | AH344: AA | AI344: 3.56e-002 | AJ344: =H344+100*O344 -> 168.93100000000001 | AK344: 156.7 | AL344: 133 | AM344: 50.9 | AN344: 60 | AO344: -0.10199999999999999 | AP344: 25 | AQ344: 凯中转债!
A345: 344 | B345: 123013 | C345: 横河转债! | D345: 300539 | E345: 横河精密 | F345: 机械装备 | G345: 专用设备 | H345: 282.989 | I345: 0. | J345: 9.8999999999999991e-003 | K345: 8.2 | L345: 2.3700000000000002e-002 | M345: 114 | N345: 9.04 | O345: 2.1200000000000001 | P345: 90.71 | Q345: 已到 | R345: 2.51年 | S345: 0.51年 | T345: 0.38 | U345: 102 | V345: 0.93900000000000006 | W345: 2.1000000000000001e-002 | X345: 1.9e-002 | Y345: 18 | Z345: 3.69 | AA345: -0.308 | AB345: -0.314 | AC345: -0.98099999999999998 | AD345: -0.9840000000000001 | AE345: 97.78 | AF345: 97.1 | AG345: 0.42 | AH345: A+ | AI345: 6.7599999999999993e-002 | AJ345: =H345+100*O345 -> 494.98899999999998 | AK345: 475.3 | AL345: 383 | AM345: 377.5 | AN345: 383 | AO345: 4.0000000000000001e-003 | AP345: 11 | AQ345: 横河转债!
A346: 345 | B346: 123012 | C346: 万顺转债! | D346: 300057 | E346: 万顺新材 | F346: 有色金属 | G346: 铝金属 | H346: 176.609 | I346: 2.9300000000000003e-002 | J346: 3.7000000000000002e-003 | K346: 9.01 | L346: 3.44e-002 | M346: 109.3 | N346: 5.27 | O346: 3.3000000000000002e-002 | P346: 170.97 | Q346: 已到 | R346: 2.49年 | S346: 0.49年 | T346: 1.23 | U346: 140 | V346: 0.65300000000000002 | W346: 2.e-002 | X346: 3.4000000000000002e-002 | Y346: 62 | Z346: 1.71 | AA346: -0.17800000000000002 | AB346: -0.183 | AC346: -0.66900000000000004 | AD346: -0.67200000000000004 | AE346: 98.2 | AF346: 95.54 | AG346: 0.96 | AH346: AA- | AI346: 5.6600000000000004e-002 | AJ346: =H346+100*O346 -> 179.90900000000002 | AK346: 182.3 | AL346: 294 | AM346: 84.1 | AN346: 278 | AO346: -2.6000000000000002e-002 | AP346: 23 | AQ346: 万顺转债!
A347: 346 | B347: 123011 | C347: 德尔转债! | D347: 300473 | E347: 德尔股份 | F347: 汽车 | G347: 零部件制 | H347: 120.261 | I347: -1.18e-002 | J347: 1.3600000000000001e-002 | K347: 23.11 | L347: 1.09e-002 | M347: 115.3 | N347: 31.38 | O347: 0.63300000000000001 | P347: 73.65 | Q347: 已到 | R347: 2.49年 | S347: 0.49年 | T347: 2.51 | U347: 5.3 | V347: 1.8000000000000002e-002 | W347: 8.0000000000000002e-002 | X347: 5.9000000000000004e-002 | Y347: 31 | Z347: 1.47 | AA347: -1.7100000000000001e-002 | AB347: -2.7799999999999998e-002 | AC347: -0.24600000000000002 | AD347: -0.25 | AE347: 98.23 | AF347: 100.8 | AG347: 0.16 | AH347: AA- | AI347: 5.6600000000000004e-002 | AJ347: =H347+100*O347 -> 183.56099999999998 | AK347: 166.9 | AL347: 225 | AM347: 66.1 | AN347: 170 | AO347: -2.9999999999999999e-002 | AP347: 37 | AQ347: 德尔转债!
A348: 347 | B348: 128041 | C348: 盛路转债!! | D348: 2446 | E348: 盛路通信 | F348: 通信互联 | G348: 通信设备 | H348: 253 | I348: 1.1599999999999999e-002 | J348: -7.8000000000000005e-003 | K348: 5.91 | L348: 1.2e-002 | M348: 113.3 | N348: 6.82 | O348: 1.9199999999999999 | P348: 86.66 | Q348: 已到 | R348: 2.48年 | S348: 0.48年 | T348: 0.53 | U348: 665 | V348: 4.8700000000000001 | W348: 1.e-002 | X348: 9.0000000000000011e-003 | Y348: 54 | Z348: 1.75 | AA348: -0.28000000000000003 | AB348: -0.28600000000000003 | AC348: -0.95499999999999996 | AD348: -0.95700000000000007 | AE348: 99.52 | AF348: 103.48 | AG348: 0.32 | AH348: AA | AI348: 3.56e-002 | AJ348: =H348+100*O348 -> 445. | AK348: 419.3 | AL348: 379 | AM348: 315.9 | AN348: 379 | AO348: -9.0000000000000011e-003 | AP348: 10 | AQ348: 盛路转债!!
A349: 348 | B349: 110045 | C349: 海澜转债! | D349: 600398 | E349: 海澜之家 | F349: 服装纺织 | G349: 服装行业 | H349: 116.19 | I349: -1.e-004 | J349: -5.1000000000000004e-003 | K349: 6.34 | L349: -1.7100000000000001e-002 | M349: 110.3 | N349: 7.04 | O349: 0.28999999999999998 | P349: 90.06 | Q349: 已到 | R349: 2.47年 | S349: 0.47年 | T349: 29.5 | U349: 30 | V349: 9.0000000000000011e-003 | W349: 0.10800000000000001 | X349: 9.6999999999999989e-002 | Y349: 274 | Z349: 1.94 | AA349: -2.1099999999999997e-002 | AB349: -2.8500000000000001e-002 | AC349: -0.21100000000000002 | AD349: -0.215 | AE349: 99.29 | AF349: 102.48 | AG349: 0.31 | AH349: AA+ | AI349: 3.0600000000000002e-002 | AJ349: =H349+100*O349 -> 145.19 | AK349: 142.3 | AL349: 19 | AM349: 39.8 | AN349: 13 | AO349: -2.2000000000000002e-002 | AP349: 42 | AQ349: 海澜转债!
A350: 349 | B350: 123010 | C350: 博世转债! | D350: 300422 | E350: 博世科 | F350: 城市公用 | G350: 三废处理 | H350: 114.35 | I350: -5.6999999999999993e-003 | J350: 2.5000000000000001e-003 | K350: 8.96 | L350: -1.21e-002 | M350: 111.3 | N350: 11.26 | O350: 0.43700000000000006 | P350: 79.57 | Q350: 已到 | R350: 2.45年 | S350: 0.45年 | T350: 4.3 | U350: 3.5 | V350: 6.9999999999999993e-003 | W350: 9.5000000000000001e-002 | X350: 7.5999999999999998e-002 | Y350: 45 | Z350: 1.4 | AA350: -1.1200000000000002e-002 | AB350: -1.95e-002 | AC350: -0.187 | AD350: -0.192 | AE350: 98.42 | AF350: 97.5 | AG350: 0.26 | AH350: AA- | AI350: 5.6600000000000004e-002 | AJ350: =H350+100*O350 -> 158.05000000000001 | AK350: 149.1 | AL350: 67 | AM350: 50.7 | AN350: 58 | AO350: 0. | AP350: 34 | AQ350: 博世转债!
A351: 350 | B351: 127007 | C351: 湖广转债!! | D351: 665 | E351: 湖北广电 | F351: 传媒娱乐 | G351: 影视娱乐 | H351: 203 | I351: -3.7900000000000003e-002 | J351: -5.0300000000000004e-002 | K351: 11.2 | L351: -9.0200000000000002e-002 | M351: 111.3 | N351: 5.58 | O351: 1.1000000000000001e-002 | P351: 200.72 | Q351: 已到 | R351: 2.43年 | S351: 0.43年 | T351: 4.25 | U351: 10265. | V351: 11.109999999999999 | W351: 3.7000000000000005e-002 | X351: 7.4999999999999997e-002 | Y351: 114 | Z351: 1.94 | AA351: -0.222 | AB351: -0.22800000000000001 | AC351: -0.871 | AD351: -0.87400000000000011 | AE351: 99.99 | AF351: 103.58 | AG351: 0.98 | AH351: AA+ | AI351: 3.0600000000000002e-002 | AJ351: =H351+100*O351 -> 204.09999999999999 | AK351: 205.3 | AL351: 338 | AM351: 101.7 | AN351: 324 | AO351: 0.34100000000000003 | AP351: 32 | AQ351: 湖广转债!!
A352: 351 | B352: 110044 | C352: 广电转债!! | D352: 600831 | E352: 广电网络 | F352: 传媒娱乐 | G352: 影视娱乐 | H352: 204.04 | I352: -2.5999999999999999e-003 | J352: -6.6e-003 | K352: 6.46 | L352: -2.4199999999999999e-002 | M352: 111.3 | N352: 6.87 | O352: 1.1699999999999999 | P352: 94.03 | Q352: 已到 | R352: 2.43年 | S352: 0.43年 | T352: 0.71 | U352: 306 | V352: 2.0899999999999999 | W352: 1.4999999999999999e-002 | X352: 1.4999999999999999e-002 | Y352: 46 | Z352: 1.22 | AA352: -0.22399999999999998 | AB352: -0.23000000000000001 | AC352: -0.88 | AD352: -0.88300000000000001 | AE352: 99.71 | AF352: 102.4 | AG352: 0.38 | AH352: AA | AI352: 3.56e-002 | AJ352: =H352+100*O352 -> 321.03999999999996 | AK352: 314 | AL352: 368 | AM352: 211.7 | AN352: 368 | AO352: 4.4999999999999998e-002 | AP352: 9 | AQ352: 广电转债!!
A353: 352 | B353: 128040 | C353: 华通转债! | D353: 2758 | E353: 浙农股份 | F353: 医药 | G353: 医药商业 | H353: 129.72 | I353: 3.3e-003 | J353: -3.3e-003 | K353: 11.25 | L353: 0. | M353: 111.3 | N353: 10.03 | O353: 0.157 | P353: 112.16 | Q353: 已到 | R353: 2.39年 | S353: 0.39年 | T353: 2.22 | U353: 17 | V353: 5.9000000000000004e-002 | W353: 3.9e-002 | X353: 4.4000000000000004e-002 | Y353: 56 | Z353: 1.68 | AA353: -6.3099999999999989e-002 | AB353: -7.0999999999999994e-002 | AC353: -0.40500000000000003 | AD353: -0.40999999999999998 | AE353: 99.84 | AF353: 102.53 | AG353: 0.63 | AH353: AA | AI353: 3.56e-002 | AJ353: =H353+100*O353 -> 145.41999999999999 | AK353: 147.3 | AL353: 49 | AM353: 44.8 | AN353: 31 | AO353: -4.0999999999999995e-002 | AP353: 32 | AQ353: 华通转债!
A354: 353 | B354: 128039 | C354: 三力转债! | D354: 2224 | E354: 三 力 士 | F354: 机械装备 | G354: 专用设备 | H354: 122.731 | I354: 3.7000000000000002e-003 | J354: -6.3e-003 | K354: 5.39 | L354: -5.5000000000000005e-003 | M354: 108.8 | N354: 5.79 | O354: 0.318 | P354: 93.09 | Q354: 已到 | R354: 2.38年 | S354: 0.38年 | T354: 2.02 | U354: 20 | V354: 8.0000000000000002e-002 | W354: 5.0999999999999997e-002 | X354: 4.8000000000000001e-002 | Y354: 39 | Z354: 1.64 | AA354: -5.0199999999999995e-002 | AB354: -5.6600000000000004e-002 | AC354: -0.33600000000000002 | AD354: -0.34000000000000002 | AE354: 98.58 | AF354: 95.67 | AG354: 0.45 | AH354: AA- | AI354: 5.6600000000000004e-002 | AJ354: =H354+100*O354 -> 154.53100000000001 | AK354: 152.4 | AL354: 99 | AM354: 53.8 | AN354: 75 | AO354: 0. | AP354: 30 | AQ354: 三力转债!
A355: 354 | B355: 128036 | C355: 金农转债!! | D355: 2548 | E355: 金新农 | F355: 农业 | G355: 畜牧业 | H355: 129.068 | I355: -3.8300000000000001e-002 | J355: 1.9699999999999999e-002 | K355: 6.35 | L355: -4.2199999999999994e-002 | M355: 109.3 | N355: 6.93 | O355: 0.40899999999999997 | P355: 91.63 | Q355: 已到 | R355: 2年46天 | S355: 46天 | T355: 1.46 | U355: 35 | V355: 0.183 | W355: 3.3000000000000002e-002 | X355: 2.9999999999999999e-002 | Y355: 44 | Z355: 1.88 | AA355: -7.6600000000000001e-002 | AB355: -8.3900000000000002e-002 | AC355: -0.78000000000000003 | AD355: -0.78900000000000003 | AE355: 100.19 | AF355: 97.47 | AG355: 0.44 | AH355: AA- | AI355: 5.6600000000000004e-002 | AJ355: =H355+100*O355 -> 169.96800000000002 | AK355: 166.5 | AL355: 222 | AM355: 66.3 | AN355: 171 | AO355: 4.0000000000000001e-003 | AP355: 16 | AQ355: 金农转债!!
A356: 355 | B356: 128037 | C356: 岩土转债! | D356: 2542 | E356: 中化岩土 | F356: 建筑 | G356: 建筑工程 | H356: 118.9 | I356: -5.0000000000000001e-003 | J356: -1.e-003 | K356: 2.89 | L356: -1.7000000000000001e-002 | M356: 111.3 | N356: 3.1 | O356: 0.27500000000000002 | P356: 93.23 | Q356: 已到 | R356: 2年52天 | S356: 52天 | T356: 5.99 | U356: 16 | V356: 2.2000000000000002e-002 | W356: 0.115 | X356: 0.107 | Y356: 52 | Z356: 1.32 | AA356: -3.1e-002 | AB356: -4.0199999999999993e-002 | AC356: -0.503 | AD356: -0.51300000000000001 | AE356: 100.71 | AF356: 103.42 | AG356: 0.35 | AH356: AA | AI356: 3.56e-002 | AJ356: =H356+100*O356 -> 146.40000000000001 | AK356: 144.6 | AL356: 29 | AM356: 41.2 | AN356: 16 | AO356: -2.7000000000000003e-002 | AP356: 54 | AQ356: 岩土转债!
A357: 356 | B357: 127006 | C357: 敖东转债! | D357: 623 | E357: 吉林敖东 | F357: 金融 | G357: 证券行业 | H357: 122.3 | I357: -1.01e-002 | J357: 1.2999999999999999e-003 | K357: 17.49 | L357: -3.32e-002 | M357: 107.4 | N357: 20.22 | O357: 0.41399999999999998 | P357: 86.5 | Q357: 已到 | R357: 2年50天 | S357: 50天 | T357: 24.1 | U357: 12 | V357: 4.0000000000000001e-003 | W357: 0.11800000000000001 | X357: 0.10199999999999999 | Y357: 203 | Z357: 0.84 | AA357: -5.9800000000000006e-002 | AB357: -6.5799999999999997e-002 | AC357: -0.61599999999999999 | AD357: -0.622 | AE357: 100.15 | AF357: 100.79 | AG357: 0.26 | AH357: AA+ | AI357: 3.0600000000000002e-002 | AJ357: =H357+100*O357 -> 163.69999999999999 | AK357: 158.1 | AL357: 144 | AM357: 57.3 | AN357: 104 | AO357: -3.2000000000000001e-002 | AP357: 25 | AQ357: 敖东转债!
A358: 357 | B358: 127005 | C358: 长证转债! | D358: 783 | E358: 长江证券 | F358: 金融 | G358: 证券行业 | H358: 127 | I358: -6.3e-003 | J358: 2.7000000000000001e-003 | K358: 7.31 | L358: -6.8000000000000005e-003 | M358: 108.3 | N358: 7.13 | O358: 0.23899999999999999 | P358: 102.52 | Q358: 已到 | R358: 2年49天 | S358: 无权 | T358: 50 | U358: 20 | V358: 3.0000000000000001e-003 | W358: 0.124 | X358: 0.127 | Y358: 404 | Z358: 1.37 | AA358: -7.3300000000000004e-002 | AB358: -7.980000000000001e-002 | AC358: 无权 | AD358: 无权 | AE358: 无权 | AF358: 102.1 | AG358: 0.53 | AH358: AAA | AI358: 2.86e-002 | AJ358: =H358+100*O358 -> 150.90000000000001 | AK358: 151.5 | AL358: 87 | AM358: 49.4 | AN358: 49 | AO358: -2.1000000000000001e-002 | AP358: 11 | AQ358: 长证转债!
A359: 358 | B359: 113505 | C359: 杭电转债! | D359: 603618 | E359: 杭电股份 | F359: 能源电力 | G359: 电力设备 | H359: 123.68 | I359: -1.1399999999999999e-002 | J359: 8.1000000000000013e-003 | K359: 6.65 | L359: -8.8999999999999999e-003 | M359: 111.3 | N359: 7.08 | O359: 0.317 | P359: 93.93 | Q359: 已到 | R359: 2年43天 | S359: 43天 | T359: 7.5 | U359: 8.3 | V359: 9.0000000000000011e-003 | W359: 0.16300000000000001 | X359: 0.153 | Y359: 46 | Z359: 1.74 | AA359: -4.9500000000000002e-002 | AB359: -5.8700000000000002e-002 | AC359: -0.67400000000000004 | AD359: -0.68400000000000005 | AE359: 100.8 | AF359: 103.51 | AG359: 0.36 | AH359: AA | AI359: 3.56e-002 | AJ359: =H359+100*O359 -> 155.38 | AK359: 153.4 | AL359: 107 | AM359: 49.9 | AN359: 55 | AO359: -6.4000000000000001e-002 | AP359: 42 | AQ359: 杭电转债!
A360: 359 | B360: 113504 | C360: 艾华转债!! | D360: 603989 | E360: 艾华集团 | F360: 电子 | G360: 元器件制 | H360: 192.77 | I360: -1.9400000000000001e-002 | J360: 1.5100000000000001e-002 | K360: 35.86 | L360: -4.4000000000000003e-003 | M360: 109.3 | N360: 20.81 | O360: 0.11900000000000001 | P360: 172.32 | Q360: 已到 | R360: 2年39天 | S360: 39天 | T360: 4.63 | U360: 8.7 | V360: 1.e-002 | W360: 3.2000000000000001e-002 | X360: 5.5e-002 | Y360: 144 | Z360: 5.05 | AA360: -0.23999999999999999 | AB360: -0.245 | AC360: <-100% | AD360: <-100% | AE360: 100.84 | AF360: 101.69 | AG360: 0.97 | AH360: AA | AI360: 3.56e-002 | AJ360: =H360+100*O360 -> 204.67000000000002 | AK360: 213.2 | AL360: 343 | AM360: 111.5 | AN360: 339 | AO360: -5.2999999999999999e-002 | AP360: 10 | AQ360: 艾华转债!!
A361: 360 | B361: 128035 | C361: 大族转债! | D361: 2008 | E361: 大族激光 | F361: 机械装备 | G361: 专用设备 | H361: 130.66 | I361: -4.0999999999999995e-003 | J361: -1.4000000000000002e-003 | K361: 47.55 | L361: -1.61e-002 | M361: 107.4 | N361: 51.9 | O361: 0.42599999999999999 | P361: 91.62 | Q361: 已到 | R361: 2年15天 | S361: 15天 | T361: 23 | U361: 14 | V361: 5.0000000000000001e-003 | W361: 4.4999999999999998e-002 | X361: 4.2000000000000003e-002 | Y361: 507 | Z361: 4.78 | AA361: -9.2799999999999994e-002 | AB361: -9.8800000000000013e-002 | AC361: <-100% | AD361: <-100% | AE361: 103.16 | AF361: 101.08 | AG361: 0.34 | AH361: AA+ | AI361: 3.0600000000000002e-002 | AJ361: =H361+100*O361 -> 173.25999999999999 | AK361: 169.7 | AL361: 245 | AM361: 66.5 | AN361: 174 | AO361: -5.2999999999999999e-002 | AP361: 17 | AQ361: 大族转债!
A362: 361 | B362: 110043 | C362: 无锡转债! | D362: 600908 | E362: 无锡银行 | F362: 金融 | G362: 银行行业 | H362: 125.64 | I362: -6.6e-003 | J362: 3.7000000000000002e-003 | K362: 6.07 | L362: -4.8999999999999998e-003 | M362: 108.3 | N362: 5.61 | O362: 0.161 | P362: 108.2 | Q362: 已到 | R362: 2年8天 | S362: 无权 | T362: 29.2 | U362: 54 | V362: 1.4999999999999999e-002 | W362: 0.25900000000000001 | X362: 0.28000000000000003 | Y362: 113 | Z362: 0.88 | AA362: -7.1800000000000003e-002 | AB362: -7.8799999999999995e-002 | AC362: 无权 | AD362: 无权 | AE362: 无权 | AF362: 101.99 | AG362: 0.59 | AH362: AA+ | AI362: 3.0600000000000002e-002 | AJ362: =H362+100*O362 -> 141.74000000000001 | AK362: 143.1 | AL362: 26 | AM362: 41.1 | AN362: 15 | AO362: 4.4000000000000004e-002 | AP362: 20 | AQ362: 无锡转债!
A363: 362 | B363: 128034 | C363: 江银转债! | D363: 2807 | E363: 江阴银行 | F363: 金融 | G363: 银行行业 | H363: 115.125 | I363: -1.1000000000000001e-002 | J363: 8.3000000000000001e-003 | K363: 4.05 | L363: -7.4000000000000003e-003 | M363: 108.3 | N363: 4.32 | O363: 0.22800000000000001 | P363: 93.75 | Q363: 已到 | R363: 2年4.1天 | S363: 无权 | T363: 17.6 | U363: 62 | V363: 2.9999999999999999e-002 | W363: 0.20000000000000001 | X363: 0.187 | Y363: 88 | Z363: 0.73 | AA363: -3.04e-002 | AB363: -3.78e-002 | AC363: 无权 | AD363: 无权 | AE363: 无权 | AF363: 102.03 | AG363: 0.37 | AH363: AA+ | AI363: 3.0600000000000002e-002 | AJ363: =H363+100*O363 -> 137.92500000000001 | AK363: 136.5 | AL363: 6 | AM363: 34.5 | AN363: 6 | AO363: 3.7999999999999999e-002 | AP363: 29 | AQ363: 江银转债!
A364: 363 | B364: 128033 | C364: 迪龙转债! | D364: 2658 | E364: 雪迪龙 | F364: 城市公用 | G364: 三废处理 | H364: 128.44 | I364: -3.0600000000000002e-002 | J364: -2.1400000000000002e-002 | K364: 9.11 | L364: -8.900000000000001e-002 | M364: 107.5 | N364: 8.56 | O364: 0.20699999999999999 | P364: 106.43 | Q364: 已到 | R364: 1.93年 | S364: 回售内 | T364: 2.98 | U364: 576 | V364: 1.49 | W364: 5.2000000000000005e-002 | X364: 5.5e-002 | Y364: 57 | Z364: 2.35 | AA364: -8.8699999999999987e-002 | AB364: -9.5299999999999996e-002 | AC364: 回售内 | AD364: 回售内 | AE364: 100.25 | AF364: 100.54 | AG364: 0.58 | AH364: AA | AI364: 3.56e-002 | AJ364: =H364+100*O364 -> 149.13999999999999 | AK364: 150.5 | AL364: 76 | AM364: 49.9 | AN364: 54 | AO364: 4.0000000000000001e-002 | AP364: 33 | AQ364: 迪龙转债!
A365: 364 | B365: 113017 | C365: 吉视转债! | D365: 601929 | E365: 吉视传媒 | F365: 传媒娱乐 | G365: 影视娱乐 | H365: 154.05 | I365: -1.4199999999999999e-002 | J365: 7.4800000000000005e-002 | K365: 3.58 | L365: 6.2300000000000001e-002 | M365: 107.5 | N365: 2.23 | O365: -4.0000000000000001e-002 | P365: 160.54 | Q365: 已到 | R365: 1.93年 | S365: 回售内 | T365: 14.6 | U365: 7994. | V365: 3.3599999999999999 | W365: 0.13100000000000001 | X365: 0.20999999999999999 | Y365: 111 | Z365: 1.67 | AA365: -0.17100000000000001 | AB365: -0.17699999999999999 | AC365: 回售内 | AD365: 回售内 | AE365: 100.25 | AF365: 101.47 | AG365: 0.97 | AH365: AA+ | AI365: 3.0600000000000002e-002 | AJ365: =H365+100*O365 -> 150.05000000000001 | AK365: 147.6 | AL365: 50 | AM365: 46.1 | AN365: 36 | AO365: 0.47700000000000004 | AP365: 70 | AQ365: 吉视转债!
A366: 365 | B366: 128030 | C366: 天康转债!! | D366: 2100 | E366: 天康生物 | F366: 农业 | G366: 畜牧业 | H366: 194.288 | I366: 1.e-003 | J366: -3.7900000000000003e-002 | K366: 10.41 | L366: -4.0599999999999997e-002 | M366: 109.8 | N366: 7.4 | O366: 0.38100000000000001 | P366: 140.68 | Q366: 已到 | R366: 1.92年 | S366: 回售内 | T366: 0.87 | U366: 16 | V366: 9.6000000000000002e-002 | W366: 6.0000000000000001e-003 | X366: 9.0000000000000011e-003 | Y366: 141 | Z366: 1.99 | AA366: -0.25900000000000001 | AB366: -0.26600000000000001 | AC366: 回售内 | AD366: 回售内 | AE366: 100.3 | AF366: 102.74 | AG366: 0.91 | AH366: AA | AI366: 3.56e-002 | AJ366: =H366+100*O366 -> 232.38800000000001 | AK366: 247.9 | AL366: 355 | AM366: 145.2 | AN366: 355 | AO366: -7.0999999999999994e-002 | AP366: 9 | AQ366: 天康转债!!
A367: 366 | B367: 128029 | C367: 太阳转债!! | D367: 2078 | E367: 太阳纸业 | F367: 造纸包装 | G367: 造纸行业 | H367: 171 | I367: 0. | J367: 1.6000000000000001e-003 | K367: 12 | L367: 1.7000000000000001e-003 | M367: 106 | N367: 8.45 | O367: 0.20399999999999999 | P367: 142.01 | Q367: 已到 | R367: 0.92年 | S367: 回售内 | T367: 9.09 | U367: 32 | V367: 2.1000000000000001e-002 | W367: 2.7999999999999997e-002 | X367: 4.0000000000000001e-002 | Y367: 322 | Z367: 1.7 | AA367: -0.41899999999999998 | AB367: -0.42700000000000005 | AC367: 回售内 | AD367: 回售内 | AE367: 100.25 | AF367: 103.35 | AG367: 0.98 | AH367: AA+ | AI367: 2.7999999999999997e-002 | AJ367: =H367+100*O367 -> 191.40000000000001 | AK367: 200 | AL367: 335 | AM367: 96.6 | AN367: 314 | AO367: 3.1e-002 | AP367: 7 | AQ367: 太阳转债!!
A368: 367 | B368: 123004 | C368: 铁汉转债! | D368: 300197 | E368: 节能铁汉 | F368: 城市公用 | G368: 生态环境 | H368: 112.047 | I368: 4.0000000000000002e-004 | J368: -4.0000000000000002e-004 | K368: 2.94 | L368: 0. | M368: 107.5 | N368: 3.82 | O368: 0.45600000000000002 | P368: 76.96 | Q368: 已到 | R368: 1.90年 | S368: 回售内 | T368: 8.03 | U368: 7.7 | V368: 9.0000000000000011e-003 | W368: 9.6999999999999989e-002 | X368: 7.400000000000001e-002 | Y368: 83 | Z368: 1.3 | AA368: -2.1700000000000001e-002 | AB368: -2.8900000000000002e-002 | AC368: 回售内 | AD368: 回售内 | AE368: 100.25 | AF368: 100.62 | AG368: 0.11 | AH368: AA | AI368: 3.56e-002 | AJ368: =H368+100*O368 -> 157.64699999999999 | AK368: 147.1 | AL368: 45 | AM368: 46.5 | AN368: 39 | AO368: 9.0000000000000011e-003 | AP368: 51 | AQ368: 铁汉转债!
A369: 368 | B369: 128026 | C369: 众兴转债! | D369: 2772 | E369: 众兴菌业 | F369: 农业 | G369: 种植业 | H369: 113 | I369: -4.7999999999999996e-003 | J369: 4.7999999999999996e-003 | K369: 7.89 | L369: -4.7100000000000003e-002 | M369: 107.8 | N369: 11.36 | O369: 0.627 | P369: 69.45 | Q369: 已到 | R369: 1.89年 | S369: 回售内 | T369: 4.09 | U369: 11 | V369: 2.3e-002 | W369: 0.127 | X369: 8.8000000000000009e-002 | Y369: 32 | Z369: 1.07 | AA369: -2.4799999999999999e-002 | AB369: -3.2300000000000002e-002 | AC369: 回售内 | AD369: 回售内 | AE369: 100.3 | AF369: 97.24 | AG369: 0 | AH369: AA- | AI369: 5.6600000000000004e-002 | AJ369: =H369+100*O369 -> 175.69999999999999 | AK369: 156.5 | AL369: 132 | AM369: 56.2 | AN369: 98 | AO369: -7.0999999999999994e-002 | AP369: 59 | AQ369: 众兴转债!
A370: 369 | B370: 128025 | C370: 特一转债! | D370: 2728 | E370: 特一药业 | F370: 医药 | G370: 化学制药 | H370: 137.515 | I370: -1.7100000000000001e-002 | J370: -1.1000000000000001e-003 | K370: 16.13 | L370: -2.4199999999999999e-002 | M370: 107.5 | N370: 13.8 | O370: 0.17699999999999999 | P370: 116.88 | Q370: 已到 | R370: 1.87年 | S370: 回售内 | T370: 2.98 | U370: 129 | V370: 0.315 | W370: 8.3000000000000004e-002 | X370: 9.6999999999999989e-002 | Y370: 36 | Z370: 3.29 | AA370: -0.124 | AB370: -0.13100000000000001 | AC370: 回售内 | AD370: 回售内 | AE370: 100.25 | AF370: 97.05 | AG370: 0.75 | AH370: AA- | AI370: 5.6600000000000004e-002 | AJ370: =H370+100*O370 -> 155.21499999999997 | AK370: 158.1 | AL370: 145 | AM370: 57.9 | AN370: 109 | AO370: -5.9000000000000004e-002 | AP370: 47 | AQ370: 特一转债!
A371: 370 | B371: 128023 | C371: 亚太转债! | D371: 2284 | E371: 亚太股份 | F371: 汽车 | G371: 零部件制 | H371: 130 | I371: -1.26e-002 | J371: -2.3999999999999998e-003 | K371: 9.73 | L371: -4.2300000000000004e-002 | M371: 109.8 | N371: 10.34 | O371: 0.38200000000000001 | P371: 94.1 | Q371: 已到 | R371: 1.87年 | S371: 回售内 | T371: 9.99 | U371: 37 | V371: 2.8999999999999998e-002 | W371: 0.13900000000000001 | X371: 0.13100000000000001 | Y371: 72 | Z371: 2.86 | AA371: -8.72e-002 | AB371: -9.5899999999999999e-002 | AC371: 回售内 | AD371: 回售内 | AE371: 100.3 | AF371: 102.92 | AG371: 0.35 | AH371: AA | AI371: 3.56e-002 | AJ371: =H371+100*O371 -> 168.19999999999999 | AK371: 165.9 | AL371: 213 | AM371: 63 | AN371: 151 | AO371: -6.9000000000000006e-002 | AP371: 52 | AQ371: 亚太转债!
A372: 371 | B372: 128022 | C372: 众信转债! | D372: 2707 | E372: 众信旅游 | F372: 旅游餐饮 | G372: 旅游 | H372: 118.95 | I372: 1.47e-002 | J372: -1.e-003 | K372: 6.46 | L372: 5.5599999999999997e-002 | M372: 107.5 | N372: 7.92 | O372: 0.45799999999999996 | P372: 81.57 | Q372: 已到 | R372: 1.86年 | S372: 回售内 | T372: 4.55 | U372: 396 | V372: 0.70900000000000007 | W372: 7.8e-002 | X372: 6.3e-002 | Y372: 59 | Z372: 11.33 | AA372: -5.3399999999999996e-002 | AB372: -6.0499999999999998e-002 | AC372: 回售内 | AD372: 回售内 | AE372: 100.25 | AF372: 93.67 | AG372: 0.25 | AH372: A | AI372: 7.7600000000000002e-002 | AJ372: =H372+100*O372 -> 164.75 | AK372: 156.3 | AL372: 130 | AM372: 56.1 | AN372: 96 | AO372: 0.10099999999999999 | AP372: 39 | AQ372: 众信转债!
A373: 372 | B373: 128021 | C373: 兄弟转债!! | D373: 2562 | E373: 兄弟科技 | F373: 医药 | G373: 原料药 | H373: 127.776 | I373: -9.4999999999999998e-003 | J373: 9.4999999999999998e-003 | K373: 5.09 | L373: -9.7000000000000003e-003 | M373: 107.5 | N373: 5.19 | O373: 0.30299999999999999 | P373: 98.07 | Q373: 已到 | R373: 1.85年 | S373: 回售内 | T373: 2.65 | U373: 8.3 | V373: 2.4e-002 | W373: 4.9000000000000002e-002 | X373: 4.8000000000000001e-002 | Y373: 54 | Z373: 1.84 | AA373: -8.9800000000000005e-002 | AB373: -9.6600000000000005e-002 | AC373: 回售内 | AD373: 回售内 | AE373: 100.25 | AF373: 100.82 | AG373: 0 | AH373: AA | AI373: 3.56e-002 | AJ373: =H373+100*O373 -> 158.07599999999999 | AK373: 157.5 | AL373: 136 | AM373: 56.7 | AN373: 100 | AO373: -1.9e-002 | AP373: 19 | AQ373: 兄弟转债!!
A374: 373 | B374: 123002 | C374: 国祯转债!! | D374: 300388 | E374: 节能国祯 | F374: 城市公用 | G374: 三废处理 | H374: 119.806 | I374: -1.1999999999999999e-003 | J374: 2.9999999999999997e-004 | K374: 7.58 | L374: -2.5999999999999999e-003 | M374: 107.5 | N374: 8.36 | O374: 0.32100000000000001 | P374: 90.67 | Q374: 已到 | R374: 1.84年 | S374: 回售内 | T374: 2.52 | U374: 4.8 | V374: 1.6e-002 | W374: 4.8000000000000001e-002 | X374: 4.2999999999999997e-002 | Y374: 53 | Z374: 1.44 | AA374: -5.7699999999999994e-002 | AB374: -6.480000000000001e-002 | AC374: 回售内 | AD374: 回售内 | AE374: 100.25 | AF374: 100.85 | AG374: 0.36 | AH374: AA | AI374: 3.56e-002 | AJ374: =H374+100*O374 -> 151.90600000000001 | AK374: 148.9 | AL374: 63 | AM374: 48.1 | AN374: 45 | AO374: -2.7000000000000003e-002 | AP374: 19 | AQ374: 国祯转债!!
A375: 374 | B375: 110038 | C375: 济川转债! | D375: 600566 | E375: 济川药业 | F375: 医药 | G375: 中药 | H375: 138.23 | I375: 5.8999999999999999e-003 | J375: -1.34e-002 | K375: 26.3 | L375: -1.0500000000000001e-002 | M375: 106 | N375: 23.4 | O375: 0.23000000000000001 | P375: 112.39 | Q375: 已到 | R375: 0.81年 | S375: 回售内 | T375: 6.27 | U375: 105 | V375: 0.12300000000000001 | W375: 2.7000000000000003e-002 | X375: 2.9999999999999999e-002 | Y375: 234 | Z375: 2.73 | AA375: -0.28000000000000003 | AB375: -0.28999999999999998 | AC375: 回售内 | AD375: 回售内 | AE375: 101 | AF375: 103.25 | AG375: 0.71 | AH375: AA | AI375: 3.3000000000000002e-002 | AJ375: =H375+100*O375 -> 161.22999999999999 | AK375: 164.1 | AL375: 200 | AM375: 60.8 | AN375: 130 | AO375: -4.7e-002 | AP375: 24 | AQ375: 济川转债!
A376: 375 | B376: 113502 | C376: 嘉澳转债! | D376: 603822 | E376: 嘉澳环保 | F376: 化工 | G376: 化工 | H376: 132.04 | I376: -2.6099999999999998e-002 | J376: -2.9999999999999997e-004 | K376: 47.58 | L376: -4.4199999999999996e-002 | M376: 109.8 | N376: 44.64 | O376: 0.23899999999999999 | P376: 106.59 | Q376: 已到 | R376: 1.80年 | S376: 回售内 | T376: 1.84 | U376: 13 | V376: 5.4000000000000006e-002 | W376: 5.2999999999999999e-002 | X376: 5.5999999999999994e-002 | Y376: 35 | Z376: 4.2 | AA376: -9.820000000000001e-002 | AB376: -0.107 | AC376: 回售内 | AD376: 回售内 | AE376: 100.3 | AF376: 99.53 | AG376: 0.6 | AH376: AA- | AI376: 5.6600000000000004e-002 | AJ376: =H376+100*O376 -> 155.94 | AK376: 157.5 | AL376: 137 | AM376: 57.2 | AN376: 103 | AO376: 5.9000000000000004e-002 | AP376: 32 | AQ376: 嘉澳转债!
A377: 376 | B377: 113016 | C377: 小康转债!! | D377: 601127 | E377: 小康股份 | F377: 汽车 | G377: 零部件制 | H377: 339.89 | I377: -1.3999999999999999e-002 | J377: -2.0199999999999999e-002 | K377: 49.94 | L377: -3.44e-002 | M377: 107.8 | N377: 16.96 | O377: 0.154 | P377: 294.46 | Q377: 已到 | R377: 1.79年 | S377: 回售内 | T377: 2.07 | U377: 460 | V377: 0.64900000000000002 | W377: 3.0000000000000001e-003 | X377: 9.0000000000000011e-003 | Y377: 679 | Z377: 9.45 | AA377: -0.46600000000000003 | AB377: -0.46999999999999997 | AC377: 回售内 | AD377: 回售内 | AE377: 100.3 | AF377: 97.78 | AG377: 0.99 | AH377: AA- | AI377: 5.6600000000000004e-002 | AJ377: =H377+100*O377 -> 355.28999999999996 | AK377: 385.3 | AL377: 374 | AM377: 285 | AN377: 374 | AO377: -8.4000000000000005e-002 | AP377: 32 | AQ377: 小康转债!!
A378: 377 | B378: 128017 | C378: 金禾转债!! | D378: 2597 | E378: 金禾实业 | F378: 化工 | G378: 化工 | H378: 212 | I378: 9.7999999999999997e-003 | J378: -1.49e-002 | K378: 42 | L378: -5.1999999999999998e-003 | M378: 107.5 | N378: 21.97 | O378: 0.109 | P378: 191.17 | Q378: 已到 | R378: 1.78年 | S378: 回售内 | T378: 5.52 | U378: 94 | V378: 8.0000000000000002e-002 | W378: 2.3e-002 | X378: 4.4999999999999998e-002 | Y378: 236 | Z378: 4.53 | AA378: -0.32000000000000001 | AB378: -0.32500000000000001 | AC378: 回售内 | AD378: 回售内 | AE378: 100.25 | AF378: 101.08 | AG378: 0.99 | AH378: AA | AI378: 3.56e-002 | AJ378: =H378+100*O378 -> 222.90000000000001 | AK378: 232.8 | AL378: 352 | AM378: 131.8 | AN378: 351 | AO378: -7.5999999999999998e-002 | AP378: 9 | AQ378: 金禾转债!!
A379: 378 | B379: 113013 | C379: 国君转债! | D379: 601211 | E379: 国泰君安 | F379: 金融 | G379: 证券行业 | H379: 125.83 | I379: -1.6000000000000001e-003 | J379: -2.5000000000000001e-003 | K379: 18.37 | L379: -9.1999999999999998e-003 | M379: 106.8 | N379: 18.45 | O379: 0.26400000000000001 | P379: 99.57 | Q379: 已到 | R379: 1.45年 | S379: 无权 | T379: 69.9 | U379: 77 | V379: 9.0000000000000011e-003 | W379: 4.2999999999999997e-002 | X379: 4.2999999999999997e-002 | Y379: 1636. | Z379: 1.23 | AA379: -0.10800000000000001 | AB379: -0.115 | AC379: 无权 | AD379: 无权 | AE379: 无权 | AF379: 102.56 | AG379: 0.45 | AH379: AAA | AI379: 2.86e-002 | AJ379: =H379+100*O379 -> 152.22999999999999 | AK379: 152.1 | AL379: 95 | AM379: 49.5 | AN379: 50 | AO379: 3.7999999999999999e-002 | AP379: 11 | AQ379: 国君转债!
A380: 379 | B380: 128015 | C380: 久其转债!! | D380: 2279 | E380: 久其软件 | F380: 计算机及 | G380: 软件开发 | H380: 113.501 | I380: -1.6000000000000001e-003 | J380: 2.8000000000000004e-003 | K380: 5.24 | L380: 1.1599999999999999e-002 | M380: 109.5 | N380: 6.97 | O380: 0.51000000000000001 | P380: 75.18 | Q380: 已到 | R380: 1.38年 | S380: 回售内 | T380: 7.79 | U380: 33 | V380: 3.7000000000000005e-002 | W380: 0.20899999999999999 | X380: 0.157 | Y380: 37 | Z380: 4.65 | AA380: -2.6000000000000002e-002 | AB380: -3.8399999999999997e-002 | AC380: 回售内 | AD380: 回售内 | AE380: 100.25 | AF380: 100.17 | AG380: 0.11 | AH380: A+ | AI380: 6.7599999999999993e-002 | AJ380: =H380+100*O380 -> 164.501 | AK380: 151.8 | AL380: 91 | AM380: 51.6 | AN380: 66 | AO380: 7.9000000000000001e-002 | AP380: 72 | AQ380: 久其转债!!
A381: 380 | B381: 127004 | C381: 模塑转债!! | D381: 700 | E381: 模塑科技 | F381: 汽车 | G381: 零部件制 | H381: 161.449 | I381: -2.0999999999999999e-003 | J381: 2.0999999999999999e-003 | K381: 4.79 | L381: 0. | M381: 111.8 | N381: 7.24 | O381: 1.4399999999999999 | P381: 66.16 | Q381: 已到 | R381: 1.36年 | S381: 回售内 | T381: 1.31 | U381: 45 | V381: 0.20999999999999999 | W381: 2.9999999999999999e-002 | X381: 2.e-002 | Y381: 44 | Z381: 1.93 | AA381: -0.23899999999999999 | AB381: -0.251 | AC381: 回售内 | AD381: 回售内 | AE381: 100.3 | AF381: 101.15 | AG381: 0 | AH381: AA- | AI381: 5.6600000000000004e-002 | AJ381: =H381+100*O381 -> 305.44900000000001 | AK381: 256.7 | AL381: 358 | AM381: 155.6 | AN381: 358 | AO381: -5.2999999999999999e-002 | AP381: 24 | AQ381: 模塑转债!!
A382: 381 | B382: 128014 | C382: 永东转债! | D382: 2753 | E382: 永东股份 | F382: 化工 | G382: 化工 | H382: 117.757 | I382: -3.7000000000000002e-003 | J382: 4.3e-003 | K382: 9.29 | L382: 7.6e-003 | M382: 109.8 | N382: 12.52 | O382: 0.58700000000000008 | P382: 74.2 | Q382: 已到 | R382: 1.23年 | S382: 回售内 | T382: 3.37 | U382: 3.9 | V382: 1.e-002 | W382: 9.6999999999999989e-002 | X382: 7.2000000000000008e-002 | Y382: 35 | Z382: 1.67 | AA382: -5.5899999999999998e-002 | AB382: -6.9599999999999995e-002 | AC382: 回售内 | AD382: 回售内 | AE382: 100.3 | AF382: 102.69 | AG382: 0.07 | AH382: AA- | AI382: 5.6600000000000004e-002 | AJ382: =H382+100*O382 -> 176.45700000000002 | AK382: 161.3 | AL382: 175 | AM382: 58.6 | AN382: 114 | AO382: -5.2000000000000005e-002 | AP382: 38 | AQ382: 永东转债!
A383: 382 | B383: 113011 | C383: 光大转债 | D383: 601818 | E383: 光大银行 | F383: 金融 | G383: 银行行业 | H383: 115 | I383: 0. | J383: -3.0999999999999999e-003 | K383: 3.42 | L383: -8.6999999999999994e-003 | M383: 106.8 | N383: 3.55 | O383: 0.19399999999999998 | P383: 96.34 | Q383: 已到 | R383: 1年54天 | S383: 无权 | T383: 242 | U383: 310 | V383: 1.1000000000000001e-002 | W383: 0.13100000000000001 | X383: 0.126 | Y383: 1848. | Z383: 0.51 | AA383: -6.3299999999999995e-002 | AB383: -7.3599999999999999e-002 | AC383: 无权 | AD383: 无权 | AE383: 无权 | AF383: 103.45 | AG383: 0.35 | AH383: AAA | AI383: 2.86e-002 | AJ383: =H383+100*O383 -> 134.40000000000001 | AK383: 133.7 | AL383: 5 | AM383: 30.2 | AN383: 3 | AO383: 1.3999999999999999e-002 | AP383: 18 | AQ383: 光大转债
A384: 383 | B384: 128013 | C384: 洪涛转债! | D384: 2325 | E384: 洪涛股份 | F384: 建筑 | G384: 装饰工程 | H384: 121.362 | I384: -6.8999999999999999e-003 | J384: -1.8e-003 | K384: 2.69 | L384: -1.1000000000000001e-002 | M384: 108 | N384: 2.31 | O384: 4.2000000000000003e-002 | P384: 116.45 | Q384: 已到 | R384: 0.52年 | S384: 回售内 | T384: 10.6 | U384: 43 | V384: 3.4000000000000002e-002 | W384: 0.29799999999999999 | X384: 0.34600000000000003 | Y384: 36 | Z384: 1.21 | AA384: -0.20300000000000001 | AB384: -0.22500000000000001 | AC384: 回售内 | AD384: 回售内 | AE384: 100.33 | AF384: 103.55 | AG384: 0.79 | AH384: A- | AI384: 8.5000000000000006e-002 | AJ384: =H384+100*O384 -> 125.562 | AK384: 126.3 | AL384: 2 | AM384: 22.7 | AN384: 1 | AO384: -5.5999999999999994e-002 | AP384: 100 | AQ384: 洪涛转债!
A385: 384 | B385: 127003 | C385: 海印转债! | D385: 861 | E385: 海印股份 | F385: 商业零售 | G385: 商场 | H385: 117.33 | I385: 4.0999999999999995e-003 | J385: -3.7000000000000002e-003 | K385: 2.76 | L385: 7.3000000000000001e-003 | M385: 110 | N385: 2.99 | O385: 0.27100000000000002 | P385: 92.31 | Q385: 已到 | R385: 0.38年 | S385: 回售内 | T385: 6.74 | U385: 29 | V385: 3.7000000000000005e-002 | W385: 0.105 | X385: 9.6999999999999989e-002 | Y385: 64 | Z385: 1.75 | AA385: -0.158 | AB385: -0.19800000000000001 | AC385: 回售内 | AD385: 回售内 | AE385: 100.33 | AF385: 108.71 | AG385: 0.05 | AH385: AA | AI385: 3.1899999999999998e-002 | AJ385: =H385+100*O385 -> 144.43000000000001 | AK385: 142.4 | AL385: 20 | AM385: 33.6 | AN385: 5 | AO385: -0.11199999999999999 | AP385: 75 | AQ385: 海印转债!