A1: 序号 | B1: 转债代码 | C1: 转债名称 | D1: 股票代码 | E1: 股票名称 | F1: 行业 | G1: 子行业 | H1: 转债价格 | I1: 涨跌 | J1: 日内套利 | K1: 股价 | L1: 涨跌 | M1: 剩余本息 | N1: 转股价格 | O1: 转股溢价率 | P1: 转股价值 | Q1: 距离转股日 | R1: 剩余年限 | S1: 回售年限 | T1: 转债余额 | U1: 转债成交额 | V1: 转债换手率 | W1: 余额/市值 | X1: 余额/股本 | Y1: 股票市值 | Z1: P/B | AA1: 税前收益率 | AB1: 税后收益率 | AC1: 税前回售收益 | AD1: 税后回售收益 | AE1: 回售价值 | AF1: 纯债价值 | AG1: 弹性 | AH1: 信用 | AI1: 折现率 | AJ1: 双低 | AK1: 老式双低 | AL1: 老式排名 | AM1: 新式双低 | AN1: 新式排名 | AO1: MA20乖离 | AP1: 热门度 | AQ1: 转债名称
A2: 281 | B2: 128062 | C2: 亚药转债! | D2: 2370 | E2: 亚太药业 | F2: 医药 | G2: 化学制药 | H2: 79.7 | I2: 4.0000000000000002e-004 | J2: -4.0000000000000002e-004 | K2: 4.82 | L2: -1.43e-002 | M2: 119.3 | N2: 16.25 | O2: 1.6899999999999999 | P2: 29.66 | Q2: 转股中 | R2: 3.73年 | S2: 1.73年 | T2: 9.63 | U2: 6.8 | V2: 9.0000000000000011e-003 | W2: 0.37200000000000005 | X2: 0.11 | Y2: 26 | Z2: 5.98 | AA2: 0.11699999999999999 | AB2: 0.106 | AC2: 0.14499999999999999 | AD2: 0.14099999999999999 | AE2: 79.8 | AF2: 72.98 | AG2: 0 | AH2: BB | AI2: 0.1439 | AJ2: =H2+100*O2 -> 248.69999999999999 | AK2: 129.7 | AL2: 119 | AM2: 49.9 | AN2: 241 | AO2: 2.e-002 | AP2: 84 | AQ2: 亚药转债!
A3: 204 | B3: 128100 | C3: 搜特转债! | D3: 2503 | E3: 搜于特 | F3: 服装纺织 | G3: 服装行业 | H3: 77.899 | I3: -1.1999999999999999e-003 | J3: 4.6999999999999993e-003 | K3: 1.52 | L3: 2.7000000000000003e-002 | M3: 116.9 | N3: 2.9 | O3: 0.48599999999999999 | P3: 52.41 | Q3: 转股中 | R3: 4.67年 | S3: 2.67年 | T3: 7.99 | U3: 16 | V3: 2.6000000000000002e-002 | W3: 0.17000000000000001 | X3: 8.900000000000001e-002 | Y3: 47 | Z3: 1.4 | AA3: 9.2799999999999994e-002 | AB3: 8.539999999999999e-002 | AC3: 0.106 | AD3: 0.10300000000000001 | AE3: 82.42 | AF3: 80.85 | AG3: 0.13 | AH3: A | AI3: 8.3900000000000002e-002 | AJ3: =H3+100*O3 -> 126.499 | AK3: 103.4 | AL3: 1 | AM3: 21 | AN3: 9 | AO3: -3.7000000000000005e-002 | AP3: 66 | AQ3: 搜特转债!
A4: 147 | B4: 113595 | C4: 花王转债! | D4: 603007 | E4: ST花王 | F4: 城市公用 | G4: 生态环境 | H4: 85.86 | I4: 5.0000000000000001e-004 | J4: 2.5000000000000001e-003 | K4: 3.66 | L4: 1.67e-002 | M4: 125.3 | N4: 6.92 | O4: 0.623 | P4: 52.89 | Q4: 转股中 | R4: 5年11天 | S4: 3年12天 | T4: 3.3 | U4: 4 | V4: 1.3999999999999999e-002 | W4: 0.26800000000000002 | X4: 0.14199999999999999 | Y4: 12 | Z4: 1.07 | AA4: 8.0100000000000005e-002 | AB4: 7.0699999999999999e-002 | AC4: 6.3399999999999998e-002 | AD4: 6.0499999999999998e-002 | AE4: 80.56 | AF4: 83.94 | AG4: 0.18 | AH4: A | AI4: 8.5099999999999995e-002 | AJ4: =H4+100*O4 -> 148.16 | AK4: 118.8 | AL4: 18 | AM4: 34.9 | AN4: 100 | AO4: 8.6999999999999994e-002 | AP4: 42 | AQ4: 花王转债!
A5: 191 | B5: 113576 | C5: 起步转债!! | D5: 603557 | E5: ST起步 | F5: 服装纺织 | G5: 鞋服行业 | H5: 92.03 | I5: -1.0500000000000001e-002 | J5: -1.1000000000000001e-003 | K5: 6 | L5: -5.0599999999999999e-002 | M5: 121.3 | N5: 10.55 | O5: 0.61799999999999999 | P5: 56.87 | Q5: 转股中 | R5: 4.75年 | S5: 2.75年 | T5: 2.66 | U5: 14 | V5: 5.7000000000000002e-002 | W5: 8.900000000000001e-002 | X5: 5.0999999999999997e-002 | Y5: 30 | Z5: 1.9 | AA5: 6.13e-002 | AB5: 5.2999999999999999e-002 | AC5: 4.4000000000000004e-002 | AD5: 4.0999999999999995e-002 | AE5: 82.59 | AF5: 83.5 | AG5: 0.23 | AH5: A | AI5: 8.3900000000000002e-002 | AJ5: =H5+100*O5 -> 153.82999999999998 | AK5: 127.2 | AL5: 83 | AM5: 43.7 | AN5: 192 | AO5: 0.13900000000000001 | AP5: 34 | AQ5: 起步转债!!
A6: 89 | B6: 128138 | C6: 侨银转债! | D6: 2973 | E6: 侨银股份 | F6: 城市公用 | G6: 城市公用 | H6: 103.248 | I6: 2.3999999999999998e-003 | J6: -1.6000000000000001e-003 | K6: 16.02 | L6: 4.4000000000000003e-003 | M6: 136.5 | N6: 25.33 | O6: 0.63300000000000001 | P6: 63.25 | Q6: 转股中 | R6: 5.36年 | S6: 3.36年 | T6: 4.2 | U6: 3.2 | V6: 6.9999999999999993e-003 | W6: 6.4000000000000001e-002 | X6: 4.0999999999999995e-002 | Y6: 65 | Z6: 4.35 | AA6: 5.4600000000000003e-002 | AB6: 4.3499999999999997e-002 | AC6: 3.2000000000000002e-003 | AD6: 8.0000000000000004e-004 | AE6: 84.08 | AF6: 98.52 | AG6: 0.19 | AH6: AA- | AI6: 6.4100000000000004e-002 | AJ6: =H6+100*O6 -> 166.548 | AK6: 143.3 | AL6: 253 | AM6: 44.7 | AN6: 205 | AO6: -1.6e-002 | AP6: 13 | AQ6: 侨银转债!
A7: 163 | B7: 127018 | C7: 本钢转债! | D7: 761 | E7: 本钢板材 | F7: 钢铁 | G7: 炼钢 | H7: 100.202 | I7: 9.5999999999999992e-003 | J7: 3.2000000000000002e-003 | K7: 4.36 | L7: 3.32e-002 | M7: 128 | N7: 5.03 | O7: 0.156 | P7: 86.68 | Q7: 转股中 | R7: 4.97年 | S7: 2.97年 | T7: 67.5 | U7: 73 | V7: 1.1000000000000001e-002 | W7: 0.39899999999999997 | X7: 0.34499999999999997 | Y7: 169 | Z7: 0.82 | AA7: 5.2000000000000005e-002 | AB7: 4.2099999999999999e-002 | AC7: 1.78e-002 | AD7: 1.41e-002 | AE7: 91.81 | AF7: 102.58 | AG7: 0.39 | AH7: AAA | AI7: 4.6900000000000004e-002 | AJ7: =H7+100*O7 -> 115.80199999999999 | AK7: 113.7 | AL7: 9 | AM7: 11.1 | AN7: 2 | AO7: 1.1000000000000001e-002 | AP7: 65 | AQ7: 本钢转债!
A8: 279 | B8: 128063 | C8: 未来转债! | D8: 2631 | E8: 德尔未来 | F8: 其他 | G8: 家居用品 | H8: 106.669 | I8: 8.9999999999999998e-004 | J8: -2.5000000000000001e-003 | K8: 6.15 | L8: -8.1000000000000013e-003 | M8: 127.5 | N8: 8.6 | O8: 0.49200000000000005 | P8: 71.51 | Q8: 转股中 | R8: 3.73年 | S8: 2.73年 | T8: 6.3 | U8: 1.3 | V8: 2.e-003 | W8: 0.154 | X8: 0.11 | Y8: 41 | Z8: 2.43 | AA8: 5.04e-002 | AB8: 3.7499999999999999e-002 | AC8: 5.0000000000000001e-003 | AD8: -4.0000000000000002e-004 | AE8: 90.98 | AF8: 102.2 | AG8: 0.2 | AH8: AA- | AI8: 6.2899999999999998e-002 | AJ8: =H8+100*O8 -> 155.869 | AK8: 141.8 | AL8: 242 | AM8: 39.6 | AN8: 149 | AO8: -1.3000000000000001e-002 | AP8: 31 | AQ8: 未来转债!
A9: 154 | B9: 127019 | C9: 国城转债! | D9: 688 | E9: 国城矿业 | F9: 有色金属 | G9: 锌铅镍锡 | H9: 90.471 | I9: 2.5000000000000001e-003 | J9: -1.6000000000000001e-003 | K9: 9.05 | L9: 3.4300000000000004e-002 | M9: 115.1 | N9: 21.06 | O9: 1.1100000000000001 | P9: 42.97 | Q9: 转股中 | R9: 5年5.1天 | S9: 3年6.1天 | T9: 8.5 | U9: 8.3 | V9: 1.1000000000000001e-002 | W9: 8.3000000000000004e-002 | X9: 3.5000000000000003e-002 | Y9: 103 | Z9: 4.44 | AA9: 5.0199999999999995e-002 | AB9: 4.4400000000000002e-002 | AC9: 4.4000000000000004e-002 | AD9: 4.1599999999999998e-002 | AE9: 90.71 | AF9: 93.55 | AG9: 0.03 | AH9: AA | AI9: 4.3099999999999999e-002 | AJ9: =H9+100*O9 -> 201.471 | AK9: 138 | AL9: 207 | AM9: 44.4 | AN9: 201 | AO9: 1.9e-002 | AP9: 41 | AQ9: 国城转债!
A10: 313 | B10: 128044 | C10: 岭南转债! | D10: 2717 | E10: 岭南股份 | F10: 城市公用 | G10: 生态环境 | H10: 96.051 | I10: 1.6000000000000001e-003 | J10: -1.4000000000000002e-003 | K10: 2.99 | L10: 2.0499999999999997e-002 | M10: 111.3 | N10: 5.91 | O10: 0.89900000000000002 | P10: 50.59 | Q10: 转股中 | R10: 3年35天 | S10: 1年36天 | T10: 6.59 | U10: 11 | V10: 1.7000000000000001e-002 | W10: 0.14400000000000002 | X10: 7.2999999999999995e-002 | Y10: 46 | Z10: 1.05 | AA10: 4.99e-002 | AB10: 4.2599999999999999e-002 | AC10: 5.5800000000000002e-002 | AD10: 5.1100000000000007e-002 | AE10: 95.25 | AF10: 92.55 | AG10: 0.01 | AH10: AA- | AI10: 6.2899999999999998e-002 | AJ10: =H10+100*O10 -> 185.95100000000002 | AK10: 141.5 | AL10: 237 | AM10: 46.3 | AN10: 213 | AO10: -2.3e-002 | AP10: 47 | AQ10: 岭南转债!
A11: 209 | B11: 113569 | C11: 科达转债! | D11: 603660 | E11: 苏州科达 | F11: 通信互联 | G11: 物联网 | H11: 96.98 | I11: 8.9999999999999998e-004 | J11: -8.9999999999999998e-004 | K11: 6.86 | L11: 0. | M11: 120.3 | N11: 14.8 | O11: 1.0900000000000001 | P11: 46.35 | Q11: 转股中 | R11: 4.66年 | S11: 2.67年 | T11: 5.16 | U11: 1.8 | V11: 4.0000000000000001e-003 | W11: 0.152 | X11: 7.0999999999999994e-002 | Y11: 34 | Z11: 1.9 | AA11: 4.8300000000000003e-002 | AB11: 4.0300000000000002e-002 | AC11: 2.4e-002 | AD11: 2.1299999999999999e-002 | AE11: 87.35 | AF11: 91.06 | AG11: 0.06 | AH11: AA- | AI11: 6.2899999999999998e-002 | AJ11: =H11+100*O11 -> 205.98000000000002 | AK11: 147.6 | AL11: 275 | AM11: 56.5 | AN11: 270 | AO11: -1.7000000000000001e-002 | AP11: 27 | AQ11: 科达转债!
A12: 366 | B12: 127003 | C12: 海印转债! | D12: 861 | E12: 海印股份 | F12: 商业零售 | G12: 商场 | H12: 105.415 | I12: 1.5e-003 | J12: -1.4000000000000002e-003 | K12: 2.07 | L12: 1.47e-002 | M12: 110 | N12: 3 | O12: 0.52800000000000002 | P12: 69 | Q12: 转股中 | R12: 0.92年 | S12: 回售内 | T12: 6.74 | U12: 5.1 | V12: 6.9999999999999993e-003 | W12: 0.14000000000000001 | X12: 9.6999999999999989e-002 | Y12: 48 | Z12: 1.26 | AA12: 4.7599999999999996e-002 | AB12: 2.6800000000000001e-002 | AC12: 回售内 | AD12: 回售内 | AE12: 100.33 | AF12: 106.45 | AG12: 0.01 | AH12: AA | AI12: 3.6499999999999998e-002 | AJ12: =H12+100*O12 -> 158.215 | AK12: 141.8 | AL12: 243 | AM12: 35.4 | AN12: 106 | AO12: -6.0000000000000001e-003 | AP12: 69 | AQ12: 海印转债!
A13: 284 | B13: 113530 | C13: 大丰转债! | D13: 603081 | E13: 大丰实业 | F13: 建筑 | G13: 装饰工程 | H13: 102.69 | I13: 2.8000000000000004e-003 | J13: -2.5000000000000001e-003 | K13: 10.84 | L13: 3.7000000000000002e-003 | M13: 121 | N13: 16.49 | O13: 0.56200000000000006 | P13: 65.74 | Q13: 转股中 | R13: 3.71年 | S13: 1.72年 | T13: 6.3 | U13: 2.1 | V13: 3.0000000000000001e-003 | W13: 0.14499999999999999 | X13: 9.5000000000000001e-002 | Y13: 44 | Z13: 1.96 | AA13: 4.6100000000000002e-002 | AB13: 3.5900000000000001e-002 | AC13: 1.1999999999999999e-003 | AD13: -1.9e-003 | AE13: 95.32 | AF13: 104.2 | AG13: 0.09 | AH13: AA | AI13: 4.1900000000000007e-002 | AJ13: =H13+100*O13 -> 158.88999999999999 | AK13: 139.6 | AL13: 226 | AM13: 35.4 | AN13: 107 | AO13: -2.8999999999999998e-002 | AP13: 32 | AQ13: 大丰转债!
A14: 265 | B14: 123028 | C14: 清水转债! | D14: 300437 | E14: 清水源 | F14: 城市公用 | G14: 三废处理 | H14: 101.95 | I14: 9.4999999999999998e-003 | J14: 5.8999999999999999e-003 | K14: 9.25 | L14: 3.9300000000000002e-002 | M14: 121 | N14: 11.84 | O14: 0.30499999999999999 | P14: 78.12 | Q14: 转股中 | R14: 3.94年 | S14: 1.95年 | T14: 4.55 | U14: 14 | V14: 2.8999999999999998e-002 | W14: 0.222 | X14: 0.17399999999999999 | Y14: 20 | Z14: 1.84 | AA14: 4.5499999999999999e-002 | AB14: 3.5799999999999998e-002 | AC14: 9.1999999999999998e-003 | AD14: 5.5000000000000005e-003 | AE14: 89.52 | AF14: 91.97 | AG14: 0.39 | AH14: A+ | AI14: 7.3899999999999993e-002 | AJ14: =H14+100*O14 -> 132.44999999999999 | AK14: 125.8 | AL14: 69 | AM14: 33.8 | AN14: 88 | AO14: 5.0000000000000003e-002 | AP14: 51 | AQ14: 清水转债!
A15: 139 | B15: 113596 | C15: 城地转债! | D15: 603887 | E15: 城地香江 | F15: 通信互联 | G15: 通信设备 | H15: 91.4 | I15: 2.0999999999999999e-003 | J15: -2.0999999999999999e-003 | K15: 9.9 | L15: 0. | M15: 113.5 | N15: 24.26 | O15: 1.24 | P15: 40.81 | Q15: 转股中 | R15: 5年18天 | S15: 3年19天 | T15: 12 | U15: 6.9 | V15: 6.0000000000000001e-003 | W15: 0.26899999999999996 | X15: 0.11 | Y15: 45 | Z15: 0.98 | AA15: 4.4900000000000002e-002 | AB15: 3.9599999999999996e-002 | AC15: 4.0899999999999999e-002 | AD15: 3.8399999999999997e-002 | AE15: 85.22 | AF15: 83.54 | AG15: 0.03 | AH15: AA- | AI15: 6.4100000000000004e-002 | AJ15: =H15+100*O15 -> 215.40000000000001 | AK15: 142 | AL15: 245 | AM15: 56.8 | AN15: 274 | AO15: -0.124 | AP15: 25 | AQ15: 城地转债!
A16: 130 | B16: 110072 | C16: 广汇转债! | D16: 600297 | E16: 广汇汽车 | F16: 汽车 | G16: 分销、售 | H16: 91.94 | I16: 2.0999999999999999e-003 | J16: -2.0999999999999999e-003 | K16: 2.94 | L16: 0. | M16: 114.5 | N16: 4.03 | O16: 0.26000000000000001 | P16: 72.95 | Q16: 转股中 | R16: 5年39天 | S16: 3年40天 | T16: 33.7 | U16: 44 | V16: 1.3999999999999999e-002 | W16: 0.14099999999999999 | X16: 0.10300000000000001 | Y16: 238 | Z16: 0.59 | AA16: 4.4600000000000001e-002 | AB16: 3.9199999999999999e-002 | AC16: 3.5499999999999997e-002 | AD16: 3.3599999999999998e-002 | AE16: 90.63 | AF16: 93.97 | AG16: 0.28 | AH16: AA+ | AI16: 4.0099999999999997e-002 | AJ16: =H16+100*O16 -> 117.94 | AK16: 110.9 | AL16: 5 | AM16: 17 | AN16: 4 | AO16: 3.7999999999999999e-002 | AP16: 60 | AQ16: 广汇转债!
A17: 230 | B17: 110064 | C17: 建工转债! | D17: 600939 | E17: 重庆建工 | F17: 建筑 | G17: 建筑工程 | H17: 99.3 | I17: 5.6000000000000008e-003 | J17: -1.5e-003 | K17: 3.46 | L17: 1.7600000000000001e-002 | M17: 119.8 | N17: 4.57 | O17: 0.312 | P17: 75.71 | Q17: 转股中 | R17: 4.45年 | S17: 2.45年 | T17: 16.6 | U17: 9.6 | V17: 6.0000000000000001e-003 | W17: 0.26400000000000001 | X17: 0.20000000000000001 | Y17: 63 | Z17: 0.89 | AA17: 4.4199999999999996e-002 | AB17: 3.6000000000000004e-002 | AC17: 1.8500000000000003e-002 | AD17: 1.54e-002 | AE17: 94.34 | AF17: 101.52 | AG17: 0.23 | AH17: AA+ | AI17: 3.8900000000000004e-002 | AJ17: =H17+100*O17 -> 130.5 | AK17: 122.9 | AL17: 43 | AM17: 21.4 | AN17: 11 | AO17: -1.6e-002 | AP17: 45 | AQ17: 建工转债!
A18: 311 | B18: 113519 | C18: 长久转债! | D18: 603569 | E18: 长久物流 | F18: 交通运输 | G18: 物流业 | H18: 103.69 | I18: 0. | J18: 0. | K18: 6.96 | L18: 0. | M18: 119.3 | N18: 11.04 | O18: 0.64500000000000002 | P18: 63.04 | Q18: 转股中 | R18: 3.33年 | S18: 1.33年 | T18: 6.97 | U18: 2.8 | V18: 4.0000000000000001e-003 | W18: 0.17899999999999999 | X18: 0.113 | Y18: 39 | Z18: 1.78 | AA18: 4.3899999999999995e-002 | AB18: 3.3300000000000003e-002 | AC18: -5.7999999999999996e-003 | AD18: -9.3999999999999986e-003 | AE18: 96.72 | AF18: 104.34 | AG18: 0.07 | AH18: AA | AI18: 4.1900000000000007e-002 | AJ18: =H18+100*O18 -> 168.19 | AK18: 144.3 | AL18: 257 | AM18: 40 | AN18: 153 | AO18: -7.4999999999999997e-002 | AP18: 20 | AQ18: 长久转债!
A19: 128 | B19: 128127 | C19: 文科转债! | D19: 2775 | E19: 文科园林 | F19: 城市公用 | G19: 生态环境 | H19: 98.001 | I19: 2.2000000000000001e-003 | J19: 1.5e-003 | K19: 4.3 | L19: 6.9999999999999993e-003 | M19: 121.3 | N19: 4.88 | O19: 0.11199999999999999 | P19: 88.11 | Q19: 转股中 | R19: 5年41天 | S19: 3年42天 | T19: 9.5 | U19: 11 | V19: 1.1000000000000001e-002 | W19: 0.43099999999999999 | X19: 0.38 | Y19: 22 | Z19: 0.93 | AA19: 4.3700000000000003e-002 | AB19: 3.61e-002 | AC19: 1.9199999999999998e-002 | AD19: 1.66e-002 | AE19: 85.24 | AF19: 88.98 | AG19: 0.53 | AH19: AA- | AI19: 6.4100000000000004e-002 | AJ19: =H19+100*O19 -> 109.20100000000001 | AK19: 107.9 | AL19: 2 | AM19: 18.9 | AN19: 7 | AO19: -1.3000000000000001e-002 | AP19: 51 | AQ19: 文科转债!
A20: 184 | B20: 113573 | C20: 纵横转债! | D20: 603602 | E20: 纵横通信 | F20: 通信互联 | G20: 通信设备 | H20: 102.05 | I20: 3.4999999999999996e-003 | J20: -3.3e-003 | K20: 10.26 | L20: 2.e-003 | M20: 124.2 | N20: 18.78 | O20: 0.86799999999999999 | P20: 54.63 | Q20: 转股中 | R20: 4.77年 | S20: 2.77年 | T20: 2.7 | U20: 1.2 | V20: 4.0000000000000001e-003 | W20: 0.129 | X20: 7.0000000000000007e-002 | Y20: 21 | Z20: 2.95 | AA20: 4.2999999999999997e-002 | AB20: 3.4000000000000002e-002 | AC20: 6.8999999999999999e-003 | AD20: 4.1999999999999997e-003 | AE20: 84.62 | AF20: 89.07 | AG20: 0.14 | AH20: A+ | AI20: 7.3899999999999993e-002 | AJ20: =H20+100*O20 -> 188.84999999999999 | AK20: 149.5 | AL20: 281 | AM20: 60.4 | AN20: 288 | AO20: -3.6000000000000004e-002 | AP20: 24 | AQ20: 纵横转债!
A21: 360 | B21: 128015 | C21: 久其转债! | D21: 2279 | E21: 久其软件 | F21: 计算机及 | G21: 软件开发 | H21: 101.13 | I21: 7.000000000000001e-004 | J21: -1.6000000000000001e-003 | K21: 5.14 | L21: -1.5300000000000001e-002 | M21: 109.5 | N21: 6.97 | O21: 0.371 | P21: 73.74 | Q21: 转股中 | R21: 1.92年 | S21: 回售内 | T21: 7.8 | U21: 7.3 | V21: 9.0000000000000011e-003 | W21: 0.21299999999999999 | X21: 0.157 | Y21: 37 | Z21: 4.25 | AA21: 4.2699999999999995e-002 | AB21: 3.3099999999999997e-002 | AC21: 回售内 | AD21: 回售内 | AE21: 100.25 | AF21: 95.88 | AG21: 0.06 | AH21: A+ | AI21: 7.2400000000000006e-002 | AJ21: =H21+100*O21 -> 138.22999999999999 | AK21: 128.5 | AL21: 99 | AM21: 28.3 | AN21: 38 | AO21: -3.1e-002 | AP21: 65 | AQ21: 久其转债!
A22: 164 | B22: 113589 | C22: 天创转债! | D22: 603608 | E22: 天创时尚 | F22: 服装纺织 | G22: 鞋服行业 | H22: 93.91 | I22: 4.0000000000000002e-004 | J22: 2.9999999999999997e-004 | K22: 6.29 | L22: 1.1299999999999999e-002 | M22: 114.9 | N22: 12.29 | O22: 0.83499999999999996 | P22: 51.18 | Q22: 转股中 | R22: 4.96年 | S22: 2.96年 | T22: 6 | U22: 4.6 | V22: 8.0000000000000002e-003 | W22: 0.222 | X22: 0.114 | Y22: 27 | Z22: 1.66 | AA22: 4.2300000000000004e-002 | AB22: 3.6600000000000001e-002 | AC22: 3.15e-002 | AD22: 2.9300000000000003e-002 | AE22: 91.05 | AF22: 94.1 | AG22: 0.07 | AH22: AA | AI22: 4.1900000000000007e-002 | AJ22: =H22+100*O22 -> 177.41 | AK22: 136.6 | AL22: 197 | AM22: 42.5 | AN22: 180 | AO22: -2.9999999999999999e-002 | AP22: 28 | AQ22: 天创转债!
A23: 294 | B23: 110052 | C23: 贵广转债! | D23: 600996 | E23: 贵广网络 | F23: 传媒娱乐 | G23: 影视娱乐 | H23: 101.56 | I23: 1.e-004 | J23: -5.9999999999999995e-004 | K23: 5.07 | L23: -5.8999999999999999e-003 | M23: 117.7 | N23: 7.94 | O23: 0.59099999999999997 | P23: 63.85 | Q23: 转股中 | R23: 3.65年 | S23: 1.66年 | T23: 15.3 | U23: 1.5 | V23: 1.e-003 | W23: 0.28600000000000003 | X23: 0.183 | Y23: 53 | Z23: 1.26 | AA23: 4.2099999999999999e-002 | AB23: 3.3099999999999997e-002 | AC23: 8.0000000000000002e-003 | AD23: 4.6999999999999993e-003 | AE23: 96.17 | AF23: 102.67 | AG23: 0.08 | AH23: AA+ | AI23: 3.8900000000000004e-002 | AJ23: =H23+100*O23 -> 160.66 | AK23: 139.3 | AL23: 222 | AM23: 36.6 | AN23: 119 | AO23: 2.4e-002 | AP23: 18 | AQ23: 贵广转债!
A24: 341 | B24: 113017 | C24: 吉视转债! | D24: 601929 | E24: 吉视传媒 | F24: 传媒娱乐 | G24: 影视娱乐 | H24: 98.53 | I24: 8.9999999999999998e-004 | J24: -5.0000000000000001e-004 | K24: 1.81 | L24: 1.1200000000000002e-002 | M24: 108.8 | N24: 2.95 | O24: 0.60599999999999998 | P24: 61.36 | Q24: 转股中 | R24: 2.47年 | S24: 0.47年 | T24: 15.6 | U24: 25 | V24: 1.6e-002 | W24: 0.27699999999999997 | X24: 0.17000000000000001 | Y24: 56 | Z24: 0.85 | AA24: 4.1700000000000001e-002 | AB24: 3.4599999999999999e-002 | AC24: 4.8799999999999996e-002 | AD24: 4.3799999999999999e-002 | AE24: 99.22 | AF24: 99.51 | AG24: 0.04 | AH24: AA+ | AI24: 3.7400000000000003e-002 | AJ24: =H24+100*O24 -> 159.13 | AK24: 135.7 | AL24: 186 | AM24: 36.2 | AN24: 115 | AO24: -2.6000000000000002e-002 | AP24: 65 | AQ24: 吉视转债!
A25: 131 | B25: 113600 | C25: 新星转债! | D25: 603978 | E25: 深圳新星 | F25: 有色金属 | G25: 有色行业 | H25: 102.76 | I25: 8.1000000000000013e-003 | J25: -5.8999999999999999e-003 | K25: 19.46 | L25: 5.1999999999999998e-003 | M25: 126 | N25: 23.85 | O25: 0.25900000000000001 | P25: 81.59 | Q25: 转股中 | R25: 5年34天 | S25: 3年35天 | T25: 5.95 | U25: 8.7 | V25: 1.3999999999999999e-002 | W25: 0.191 | X25: 0.156 | Y25: 31 | Z25: 2.03 | AA25: 4.1700000000000001e-002 | AB25: 3.2799999999999996e-002 | AC25: 3.4999999999999996e-003 | AD25: 1.1000000000000001e-003 | AE25: 85.06 | AF25: 92.45 | AG25: 0.43 | AH25: AA- | AI25: 6.4100000000000004e-002 | AJ25: =H25+100*O25 -> 128.66 | AK25: 123.9 | AL25: 54 | AM25: 31.5 | AN25: 63 | AO25: 6.7000000000000004e-002 | AP25: 22 | AQ25: 新星转债!
A26: 118 | B26: 128132 | C26: 交建转债! | D26: 2941 | E26: 新疆交建 | F26: 建筑 | G26: 建筑工程 | H26: 95.855 | I26: -7.000000000000001e-004 | J26: 1.2999999999999999e-003 | K26: 10.61 | L26: 5.6999999999999993e-003 | M26: 117.3 | N26: 18.57 | O26: 0.67799999999999994 | P26: 57.14 | Q26: 转股中 | R26: 5.18年 | S26: 3.19年 | T26: 8.5 | U26: 2.6 | V26: 3.0000000000000001e-003 | W26: 0.124 | X26: 7.0999999999999994e-002 | Y26: 68 | Z26: 2.82 | AA26: 4.0599999999999997e-002 | AB26: 3.4300000000000004e-002 | AC26: 2.4300000000000002e-002 | AD26: 2.2000000000000002e-002 | AE26: 90.25 | AF26: 94.69 | AG26: 0.1 | AH26: AA | AI26: 4.3099999999999999e-002 | AJ26: =H26+100*O26 -> 163.655 | AK26: 134.6 | AL26: 174 | AM26: 39.9 | AN26: 150 | AO26: -1.1000000000000001e-002 | AP26: 19 | AQ26: 交建转债!
A27: 159 | B27: 128117 | C27: 道恩转债! | D27: 2838 | E27: 道恩股份 | F27: 化工 | G27: 橡胶塑料 | H27: 101.405 | I27: 1.5e-003 | J27: -3.7000000000000002e-003 | K27: 17.19 | L27: -1.21e-002 | M27: 123.1 | N27: 28.83 | O27: 0.70099999999999996 | P27: 59.63 | Q27: 转股中 | R27: 4.98年 | S27: 2.98年 | T27: 3.6 | U27: 2.6 | V27: 6.9999999999999993e-003 | W27: 5.0999999999999997e-002 | X27: 3.1e-002 | Y27: 70 | Z27: 3.69 | AA27: 4.0399999999999998e-002 | AB27: 3.2199999999999999e-002 | AC27: 6.4000000000000003e-003 | AD27: 4.1999999999999997e-003 | AE27: 85.5 | AF27: 91.35 | AG27: 0.18 | AH27: AA- | AI27: 6.2899999999999998e-002 | AJ27: =H27+100*O27 -> 171.505 | AK27: 143.2 | AL27: 252 | AM27: 51.8 | AN27: 254 | AO27: -4.2000000000000003e-002 | AP27: 22 | AQ27: 道恩转债!
A28: 126 | B28: 113601 | C28: 塞力转债! | D28: 603716 | E28: 塞力医疗 | F28: 医药 | G28: 医药商业 | H28: 101.23 | I28: 2.3999999999999998e-003 | J28: 3.7000000000000002e-003 | K28: 13.67 | L28: 1.3300000000000001e-002 | M28: 121.3 | N28: 16.98 | O28: 0.25700000000000001 | P28: 80.51 | Q28: 转股中 | R28: 5年42天 | S28: 3年43天 | T28: 5.43 | U28: 5.6 | V28: 1.e-002 | W28: 0.19399999999999998 | X28: 0.156 | Y28: 28 | Z28: 1.79 | AA28: 3.6900000000000002e-002 | AB28: 2.9399999999999999e-002 | AC28: 9.0000000000000011e-003 | AD28: 6.5000000000000006e-003 | AE28: 85.23 | AF28: 88.97 | AG28: 0.45 | AH28: AA- | AI28: 6.4100000000000004e-002 | AJ28: =H28+100*O28 -> 126.93000000000001 | AK28: 122 | AL28: 37 | AM28: 33 | AN28: 80 | AO28: -2.6000000000000002e-002 | AP28: 38 | AQ28: 塞力转债!
A29: 86 | B29: 123077 | C29: 汉得转债! | D29: 300170 | E29: 汉得信息 | F29: 计算机及 | G29: 软件开发 | H29: 103.83 | I29: 8.9999999999999998e-004 | J29: -2.7000000000000001e-003 | K29: 7.49 | L29: -6.6e-003 | M29: 125.5 | N29: 9.69 | O29: 0.34299999999999997 | P29: 77.3 | Q29: 转股中 | R29: 5.37年 | S29: 3.38年 | T29: 9.37 | U29: 3.3 | V29: 3.0000000000000001e-003 | W29: 0.14199999999999999 | X29: 0.109 | Y29: 66 | Z29: 2.09 | AA29: 3.6600000000000001e-002 | AB29: 2.8399999999999998e-002 | AC29: 0. | AD29: -2.0999999999999999e-003 | AE29: 89.56 | AF29: 100.48 | AG29: 0.28 | AH29: AA | AI29: 4.3099999999999999e-002 | AJ29: =H29+100*O29 -> 138.13 | AK29: 130.4 | AL29: 125 | AM29: 29.9 | AN29: 44 | AO29: -1.3999999999999999e-002 | AP29: 14 | AQ29: 汉得转债!
A30: 206 | B30: 123044 | C30: 红相转债!! | D30: 300427 | E30: 红相股份 | F30: 能源电力 | G30: 电力设备 | H30: 106.388 | I30: 1.43e-002 | J30: -5.0000000000000001e-003 | K30: 13.6 | L30: 2.9500000000000002e-002 | M30: 125 | N30: 18.67 | O30: 0.46000000000000002 | P30: 72.84 | Q30: 转股中 | R30: 4.67年 | S30: 2.67年 | T30: 5.5 | U30: 31 | V30: 5.2999999999999999e-002 | W30: 0.11199999999999999 | X30: 8.199999999999999e-002 | Y30: 49 | Z30: 2.09 | AA30: 3.6000000000000004e-002 | AB30: 2.6699999999999998e-002 | AC30: -6.3e-003 | AD30: -9.3999999999999986e-003 | AE30: 88.06 | AF30: 94.69 | AG30: 0.31 | AH30: AA- | AI30: 6.2899999999999998e-002 | AJ30: =H30+100*O30 -> 152.38800000000001 | AK30: 139.9 | AL30: 227 | AM30: 45.2 | AN30: 207 | AO30: 3.0000000000000001e-003 | AP30: 20 | AQ30: 红相转债!!
A31: 270 | B31: 113535 | C31: 大业转债! | D31: 603278 | E31: 大业股份 | F31: 汽车 | G31: 零部件制 | H31: 101.93 | I31: 7.3000000000000001e-003 | J31: -4.4000000000000003e-003 | K31: 8.77 | L31: 2.1000000000000001e-002 | M31: 112.5 | N31: 12.29 | O31: 0.42799999999999999 | P31: 71.36 | Q31: 转股中 | R31: 2.83年 | S31: 0.83年 | T31: 5 | U31: 3 | V31: 6.0000000000000001e-003 | W31: 0.19600000000000001 | X31: 0.14000000000000001 | Y31: 25 | Z31: 1.48 | AA31: 3.5900000000000001e-002 | AB31: 2.75e-002 | AC31: -6.7000000000000002e-003 | AD31: -9.1000000000000004e-003 | AE31: 97.33 | AF31: 100.69 | AG31: 0.14 | AH31: AA | AI31: 4.0399999999999998e-002 | AJ31: =H31+100*O31 -> 144.73000000000002 | AK31: 132.5 | AL31: 156 | AM31: 31.8 | AN31: 70 | AO31: 4.8000000000000001e-002 | AP31: 48 | AQ31: 大业转债!
A32: 83 | B32: 128139 | C32: 祥鑫转债! | D32: 2965 | E32: 祥鑫科技 | F32: 汽车 | G32: 零部件制 | H32: 100.612 | I32: -1.e-003 | J32: -1.15e-002 | K32: 26.26 | L32: -3.4200000000000001e-002 | M32: 121 | N32: 36.96 | O32: 0.41600000000000004 | P32: 71.05 | Q32: 转股中 | R32: 5.39年 | S32: 3.40年 | T32: 6.47 | U32: 27 | V32: 4.2000000000000003e-002 | W32: 0.16300000000000001 | X32: 0.11599999999999999 | Y32: 40 | Z32: 2.24 | AA32: 3.5499999999999997e-002 | AB32: 2.8500000000000001e-002 | AC32: 9.1999999999999998e-003 | AD32: 6.9999999999999993e-003 | AE32: 83.48 | AF32: 87.16 | AG32: 0.36 | AH32: AA- | AI32: 6.4100000000000004e-002 | AJ32: =H32+100*O32 -> 142.21199999999999 | AK32: 130.2 | AL32: 124 | AM32: 43 | AN32: 185 | AO32: 5.5e-002 | AP32: 14 | AQ32: 祥鑫转债!
A33: 232 | B33: 128085 | C33: 鸿达转债! | D33: 2002 | E33: 鸿达兴业 | F33: 化工 | G33: 化工 | H33: 107 | I33: 1.8200000000000001e-002 | J33: 2.0499999999999997e-002 | K33: 4.03 | L33: 4.4000000000000004e-002 | M33: 124.4 | N33: 3.91 | O33: 3.7999999999999999e-002 | P33: 103.07 | Q33: 转股中 | R33: 4.44年 | S33: 2.44年 | T33: 7.78 | U33: 39 | V33: 4.7e-002 | W33: 6.4000000000000001e-002 | X33: 6.6000000000000003e-002 | Y33: 121 | Z33: 1.38 | AA33: 3.5299999999999998e-002 | AB33: 2.5699999999999997e-002 | AC33: -1.1299999999999999e-002 | AD33: -1.4199999999999999e-002 | AE33: 68.76 | AF33: 62.22 | AG33: 0.88 | AH33: B | AI33: 0.1739 | AJ33: =H33+100*O33 -> 110.8 | AK33: 110.9 | AL33: 6 | AM33: 42.2 | AN33: 177 | AO33: 1.2e-002 | AP33: 100 | AQ33: 鸿达转债!
A34: 287 | B34: 123023 | C34: 迪森转债! | D34: 300335 | E34: 迪森股份 | F34: 能源电力 | G34: 电力供应 | H34: 100.91 | I34: 1.6299999999999999e-002 | J34: -2.3e-003 | K34: 5.36 | L34: 3.8800000000000001e-002 | M34: 114.3 | N34: 6.89 | O34: 0.29699999999999999 | P34: 77.79 | Q34: 转股中 | R34: 3.69年 | S34: 2.70年 | T34: 5.29 | U34: 30 | V34: 5.7000000000000002e-002 | W34: 0.26500000000000001 | X34: 0.20600000000000002 | Y34: 20 | Z34: 1.43 | AA34: 3.5000000000000003e-002 | AB34: 2.7699999999999999e-002 | AC34: 1.29e-002 | AD34: 9.7000000000000003e-003 | AE34: 88.09 | AF34: 91.64 | AG34: 0.36 | AH34: AA- | AI34: 6.2899999999999998e-002 | AJ34: =H34+100*O34 -> 130.60999999999999 | AK34: 124 | AL34: 57 | AM34: 32.4 | AN34: 75 | AO34: 6.4000000000000001e-002 | AP34: 50 | AQ34: 迪森转债!
A35: 264 | B35: 128069 | C35: 华森转债! | D35: 2907 | E35: 华森制药 | F35: 医药 | G35: 化学制药 | H35: 104.52 | I35: 2.e-003 | J35: 1.8e-003 | K35: 12.86 | L35: 1.4999999999999999e-002 | M35: 119.3 | N35: 18.01 | O35: 0.46399999999999997 | P35: 71.4 | Q35: 转股中 | R35: 3.96年 | S35: 1.96年 | T35: 3 | U35: 4.3 | V35: 1.3999999999999999e-002 | W35: 5.7999999999999996e-002 | X35: 4.0999999999999995e-002 | Y35: 52 | Z35: 4.54 | AA35: 3.4599999999999999e-002 | AB35: 2.58e-002 | AC35: -7.8000000000000005e-003 | AD35: -1.04e-002 | AE35: 90.38 | AF35: 94.1 | AG35: 0.25 | AH35: AA- | AI35: 6.2899999999999998e-002 | AJ35: =H35+100*O35 -> 150.91999999999999 | AK35: 137.6 | AL35: 205 | AM35: 43.5 | AN35: 189 | AO35: -3.3000000000000002e-002 | AP35: 44 | AQ35: 华森转债!
A36: 266 | B36: 113027 | C36: 华钰转债!! | D36: 601020 | E36: ST华钰 | F36: 有色金属 | G36: 锌铅镍锡 | H36: 100.34 | I36: 2.4e-002 | J36: -3.0999999999999999e-003 | K36: 7.84 | L36: 4.9500000000000002e-002 | M36: 114.3 | N36: 10.17 | O36: 0.30199999999999999 | P36: 77.09 | Q36: 转股中 | R36: 3.93年 | S36: 1.93年 | T36: 3.25 | U36: 41 | V36: 0.125 | W36: 7.4999999999999997e-002 | X36: 5.7999999999999996e-002 | Y36: 43 | Z36: 1.75 | AA36: 3.4300000000000004e-002 | AB36: 2.75e-002 | AC36: 1.1699999999999999e-002 | AD36: 9.0000000000000011e-003 | AE36: 86.91 | AF36: 83.77 | AG36: 0.42 | AH36: A | AI36: 8.3900000000000002e-002 | AJ36: =H36+100*O36 -> 130.53999999999999 | AK36: 123.6 | AL36: 49 | AM36: 36.7 | AN36: 122 | AO36: 8.5000000000000006e-002 | AP36: 47 | AQ36: 华钰转债!!
A37: 158 | B37: 128118 | C37: 瀛通转债! | D37: 2861 | E37: 瀛通通讯 | F37: 电子 | G37: 电子产品 | H37: 103.46 | I37: 1.2999999999999999e-003 | J37: 8.9999999999999998e-004 | K37: 14.28 | L37: 7.8000000000000005e-003 | M37: 121.7 | N37: 21.12 | O37: 0.53000000000000003 | P37: 67.61 | Q37: 转股中 | R37: 4.98年 | S37: 2.98年 | T37: 3 | U37: 2.5 | V37: 8.0000000000000002e-003 | W37: 0.13300000000000001 | X37: 8.9999999999999997e-002 | Y37: 23 | Z37: 1.62 | AA37: 3.39e-002 | AB37: 2.6099999999999998e-002 | AC37: 2.3e-003 | AD37: -2.9999999999999997e-004 | AE37: 86.16 | AF37: 90.44 | AG37: 0.29 | AH37: AA- | AI37: 6.2899999999999998e-002 | AJ37: =H37+100*O37 -> 156.45999999999998 | AK37: 139.3 | AL37: 223 | AM37: 48.9 | AN37: 234 | AO37: -6.7000000000000004e-002 | AP37: 17 | AQ37: 瀛通转债!
A38: 308 | B38: 128049 | C38: 华源转债! | D38: 2787 | E38: 华源控股 | F38: 造纸包装 | G38: 包装材料 | H38: 102.635 | I38: 1.06e-002 | J38: -7.8000000000000005e-003 | K38: 5.57 | L38: 9.1000000000000004e-003 | M38: 114.5 | N38: 7.37 | O38: 0.35799999999999998 | P38: 75.58 | Q38: 转股中 | R38: 3.38年 | S38: 1.39年 | T38: 3.63 | U38: 1.2 | V38: 3.0000000000000001e-003 | W38: 0.20600000000000002 | X38: 0.156 | Y38: 18 | Z38: 1.18 | AA38: 3.3599999999999998e-002 | AB38: 2.5499999999999998e-002 | AC38: 1.2999999999999999e-003 | AD38: -2.3e-003 | AE38: 93.62 | AF38: 93.55 | AG38: 0.31 | AH38: AA- | AI38: 6.2899999999999998e-002 | AJ38: =H38+100*O38 -> 138.435 | AK38: 129.7 | AL38: 117 | AM38: 36.1 | AN38: 112 | AO38: -1.7000000000000001e-002 | AP38: 43 | AQ38: 华源转债!
A39: 324 | B39: 127007 | C39: 湖广转债! | D39: 665 | E39: 湖北广电 | F39: 传媒娱乐 | G39: 影视娱乐 | H39: 101.1 | I39: 3.2000000000000002e-003 | J39: -1.5e-003 | K39: 3.94 | L39: 1.29e-002 | M39: 111.3 | N39: 5.58 | O39: 0.43200000000000005 | P39: 70.61 | Q39: 转股中 | R39: 2.97年 | S39: 0.97年 | T39: 12.2 | U39: 2.7 | V39: 2.e-003 | W39: 0.314 | X39: 0.222 | Y39: 39 | Z39: 0.67 | AA39: 3.3399999999999999e-002 | AB39: 2.6099999999999998e-002 | AC39: 6.0999999999999995e-003 | AD39: 3.0000000000000001e-003 | AE39: 97.65 | AF39: 99.96 | AG39: 0.13 | AH39: AA+ | AI39: 3.7400000000000003e-002 | AJ39: =H39+100*O39 -> 144.30000000000001 | AK39: 131.6 | AL39: 139 | AM39: 31.6 | AN39: 66 | AO39: -3.2000000000000001e-002 | AP39: 17 | AQ39: 湖广转债!
A40: 174 | B40: 113584 | C40: 家悦转债! | D40: 603708 | E40: 家家悦 | F40: 商业零售 | G40: 超市 | H40: 98.19 | I40: 5.9999999999999995e-004 | J40: -8.0000000000000004e-004 | K40: 16.29 | L40: -7.9000000000000008e-003 | M40: 114.9 | N40: 37.53 | O40: 1.26 | P40: 43.41 | Q40: 转股中 | R40: 4.90年 | S40: 2.91年 | T40: 6.45 | U40: 2.4 | V40: 4.0000000000000001e-003 | W40: 6.5000000000000002e-002 | X40: 2.7999999999999997e-002 | Y40: 99 | Z40: 3.52 | AA40: 3.32e-002 | AB40: 2.75e-002 | AC40: 1.7100000000000001e-002 | AD40: 1.49e-002 | AE40: 91.24 | AF40: 94.3 | AG40: 0.02 | AH40: AA | AI40: 4.1900000000000007e-002 | AJ40: =H40+100*O40 -> 224.19 | AK40: 153 | AL40: 288 | AM40: 58.7 | AN40: 283 | AO40: -6.8000000000000005e-002 | AP40: 13 | AQ40: 家悦转债!
A41: 320 | B41: 123011 | C41: 德尔转债! | D41: 300473 | E41: 德尔股份 | F41: 汽车 | G41: 零部件制 | H41: 105.661 | I41: -8.0000000000000004e-004 | J41: -5.0000000000000001e-003 | K41: 22.91 | L41: -2.63e-002 | M41: 116.3 | N41: 31.38 | O41: 0.44700000000000001 | P41: 73.01 | Q41: 转股中 | R41: 3年8天 | S41: 1年9天 | T41: 2.51 | U41: 9.1 | V41: 3.5000000000000003e-002 | W41: 8.1000000000000003e-002 | X41: 5.9000000000000004e-002 | Y41: 31 | Z41: 1.4 | AA41: 3.3000000000000002e-002 | AB41: 2.3e-002 | AC41: -2.3e-002 | AD41: -2.75e-002 | AE41: 95.68 | AF41: 97.13 | AG41: 0.22 | AH41: AA- | AI41: 6.2899999999999998e-002 | AJ41: =H41+100*O41 -> 150.36099999999999 | AK41: 138.3 | AL41: 211 | AM41: 41.2 | AN41: 165 | AO41: 7.8e-002 | AP41: 42 | AQ41: 德尔转债!
A42: 153 | B42: 123059 | C42: 银信转债! | D42: 300231 | E42: 银信科技 | F42: 计算机及 | G42: 软件开发 | H42: 106.19 | I42: 2.8999999999999998e-003 | J42: -8.3999999999999995e-003 | K42: 7.9 | L42: -1.2500000000000001e-002 | M42: 124.1 | N42: 9.72 | O42: 0.307 | P42: 81.28 | Q42: 转股中 | R42: 5年5.1天 | S42: 3年6.1天 | T42: 3.91 | U42: 6.2 | V42: 1.4999999999999999e-002 | W42: 0.11199999999999999 | X42: 9.0999999999999998e-002 | Y42: 35 | Z42: 2.56 | AA42: 3.2300000000000002e-002 | AB42: 2.3900000000000001e-002 | AC42: -6.5000000000000006e-003 | AD42: -9.0000000000000011e-003 | AE42: 85.57 | AF42: 91.53 | AG42: 0.44 | AH42: AA- | AI42: 6.4100000000000004e-002 | AJ42: =H42+100*O42 -> 136.88999999999999 | AK42: 131.1 | AL42: 132 | AM42: 39.6 | AN42: 147 | AO42: -2.4e-002 | AP42: 17 | AQ42: 银信转债!
A43: 39 | B43: 113620 | C43: 傲农转债! | D43: 603363 | E43: 傲农生物 | F43: 农业 | G43: 畜牧业 | H43: 101.66 | I43: 4.7999999999999996e-003 | J43: -1.5e-003 | K43: 9.68 | L43: 1.5700000000000002e-002 | M43: 121.1 | N43: 14.51 | O43: 0.52400000000000002 | P43: 66.71 | Q43: 2月9天 | R43: 5.67年 | S43: 3.67年 | T43: 10 | U43: 11 | V43: 1.1000000000000001e-002 | W43: 0.151 | X43: 0.10099999999999999 | Y43: 66 | Z43: 2.25 | AA43: 3.1899999999999998e-002 | AB43: 2.53e-002 | AC43: 5.0000000000000001e-003 | AD43: 3.0999999999999999e-003 | AE43: 88.24 | AF43: 95.74 | AG43: 0.21 | AH43: AA | AI43: 4.3099999999999999e-002 | AJ43: =H43+100*O43 -> 154.06 | AK43: 136.6 | AL43: 195 | AM43: 40.9 | AN43: 160 | AO43: -2.5000000000000001e-002 | AP43: 6 | AQ43: 傲农转债!
A44: 195 | B44: 127016 | C44: 鲁泰转债! | D44: 726 | E44: 鲁 泰Ａ | F44: 服装纺织 | G44: 纺织行业 | H44: 100.259 | I44: 2.5999999999999999e-003 | J44: -2.8999999999999998e-003 | K44: 6.05 | L44: -1.7000000000000001e-003 | M44: 115.9 | N44: 8.71 | O44: 0.44299999999999995 | P44: 69.46 | Q44: 转股中 | R44: 4.75年 | S44: 2.75年 | T44: 14 | U44: 2.1 | V44: 1.e-003 | W44: 0.26200000000000001 | X44: 0.182 | Y44: 53 | Z44: 0.67 | AA44: 3.1600000000000003e-002 | AB44: 2.5399999999999999e-002 | AC44: 1.0700000000000001e-002 | AD44: 8.3999999999999995e-003 | AE44: 92.6 | AF44: 97.02 | AG44: 0.19 | AH44: AA+ | AI44: 3.8900000000000004e-002 | AJ44: =H44+100*O44 -> 144.559 | AK44: 131.1 | AL44: 131 | AM44: 34 | AN44: 89 | AO44: -2.e-003 | AP44: 21 | AQ44: 鲁泰转债!
A45: 246 | B45: 110059 | C45: 浦发转债! | D45: 600000 | E45: 浦发银行 | F45: 金融 | G45: 银行行业 | H45: 103.35 | I45: -5.0000000000000001e-004 | J45: 0. | K45: 9.91 | L45: -3.0000000000000001e-003 | M45: 117.6 | N45: 14.45 | O45: 0.50700000000000001 | P45: 68.58 | Q45: 转股中 | R45: 4.30年 | S45: 无权 | T45: 500 | U45: 204 | V45: 4.0000000000000001e-003 | W45: 0.17199999999999999 | X45: 0.11800000000000001 | Y45: 2909. | Z45: 0.54 | AA45: 3.15e-002 | AB45: 2.3799999999999998e-002 | AC45: 无权 | AD45: 无权 | AE45: 无权 | AF45: 101.11 | AG45: 0.16 | AH45: AAA | AI45: 3.6900000000000002e-002 | AJ45: =H45+100*O45 -> 154.05000000000001 | AK45: 138.1 | AL45: 209 | AM45: 37 | AN45: 126 | AO45: -1.2e-002 | AP45: 61 | AQ45: 浦发转债!
A46: 258 | B46: 128072 | C46: 翔鹭转债! | D46: 2842 | E46: 翔鹭钨业 | F46: 有色金属 | G46: 小金属 | H46: 101.661 | I46: 1.06e-002 | J46: 1.e-003 | K46: 9.88 | L46: 4.99e-002 | M46: 115.1 | N46: 15.34 | O46: 0.57799999999999996 | P46: 64.41 | Q46: 转股中 | R46: 4年41天 | S46: 2年42天 | T46: 3.02 | U46: 25 | V46: 8.3000000000000004e-002 | W46: 0.11199999999999999 | X46: 7.2000000000000008e-002 | Y46: 27 | Z46: 2.9 | AA46: 3.1400000000000004e-002 | AB46: 2.4500000000000001e-002 | AC46: 7.7000000000000002e-003 | AD46: 4.6999999999999993e-003 | AE46: 90.14 | AF46: 90.08 | AG46: 0.23 | AH46: AA- | AI46: 6.2899999999999998e-002 | AJ46: =H46+100*O46 -> 159.46100000000001 | AK46: 138.9 | AL46: 218 | AM46: 48.8 | AN46: 233 | AO46: 8.900000000000001e-002 | AP46: 29 | AQ46: 翔鹭转债!
A47: 49 | B47: 113042 | C47: 上银转债! | D47: 601229 | E47: 上海银行 | F47: 金融 | G47: 银行行业 | H47: 102.5 | I47: -1.4000000000000002e-003 | J47: -4.7999999999999996e-003 | K47: 7.56 | L47: -2.4500000000000001e-002 | M47: 120.9 | N47: 10.63 | O47: 0.441 | P47: 71.12 | Q47: 20天 | R47: 5.55年 | S47: 无权 | T47: 200 | U47: 104 | V47: 5.0000000000000001e-003 | W47: 0.18600000000000003 | X47: 0.13200000000000001 | Y47: 1074. | Z47: 0.62 | AA47: 3.1099999999999999e-002 | AB47: 2.4300000000000002e-002 | AC47: 无权 | AD47: 无权 | AE47: 无权 | AF47: 98.83 | AG47: 0.25 | AH47: AAA | AI47: 3.8100000000000002e-002 | AJ47: =H47+100*O47 -> 146.59999999999999 | AK47: 133.9 | AL47: 167 | AM47: 35 | AN47: 102 | AO47: -7.5999999999999998e-002 | AP47: 11 | AQ47: 上银转债!
A48: 135 | B48: 128125 | C48: 华阳转债! | D48: 2949 | E48: 华阳国际 | F48: 建筑 | G48: 建筑工程 | H48: 102.047 | I48: -7.000000000000001e-004 | J48: -2.8000000000000004e-003 | K48: 16.27 | L48: -1.2699999999999999e-002 | M48: 118.5 | N48: 25.39 | O48: 0.59200000000000008 | P48: 64.08 | Q48: 转股中 | R48: 5年20天 | S48: 3年21天 | T48: 4.5 | U48: 0.7 | V48: 2.e-003 | W48: 0.14099999999999999 | X48: 8.9999999999999997e-002 | Y48: 32 | Z48: 2.5 | AA48: 3.0699999999999998e-002 | AB48: 2.4e-002 | AC48: 5.5000000000000005e-003 | AD48: 3.0999999999999999e-003 | AE48: 85.19 | AF48: 87.17 | AG48: 0.27 | AH48: AA- | AI48: 6.4100000000000004e-002 | AJ48: =H48+100*O48 -> 161.24700000000001 | AK48: 140 | AL48: 230 | AM48: 52.8 | AN48: 257 | AO48: -3.9e-002 | AP48: 8 | AQ48: 华阳转债!
A49: 271 | B49: 128066 | C49: 亚泰转债! | D49: 2811 | E49: 郑中设计 | F49: 建筑 | G49: 装饰工程 | H49: 104.4 | I49: 4.4000000000000003e-003 | J49: -6.6e-003 | K49: 8.17 | L49: -4.8999999999999998e-003 | M49: 116.7 | N49: 9.27 | O49: 0.185 | P49: 88.13 | Q49: 转股中 | R49: 3.77年 | S49: 1.77年 | T49: 4.8 | U49: 2.1 | V49: 4.0000000000000001e-003 | W49: 0.217 | X49: 0.192 | Y49: 22 | Z49: 1.49 | AA49: 3.0600000000000002e-002 | AB49: 2.2400000000000003e-002 | AC49: -6.8000000000000005e-003 | AD49: -9.8999999999999991e-003 | AE49: 91.63 | AF49: 93.16 | AG49: 0.45 | AH49: AA- | AI49: 6.2899999999999998e-002 | AJ49: =H49+100*O49 -> 122.90000000000001 | AK49: 120.7 | AL49: 29 | AM49: 27.5 | AN49: 35 | AO49: 6.0000000000000001e-003 | AP49: 60 | AQ49: 亚泰转债!
A50: 12 | B50: 113624 | C50: 正川转债! | D50: 603976 | E50: 正川股份 | F50: 医药 | G50: 医药行业 | H50: 102.46 | I50: 1.e-004 | J50: -3.9000000000000003e-003 | K50: 36.33 | L50: -7.0999999999999995e-003 | M50: 121.6 | N50: 46.69 | O50: 0.317 | P50: 77.81 | Q50: 4月2天 | R50: 5.80年 | S50: 3.80年 | T50: 4.05 | U50: 11 | V50: 2.6000000000000002e-002 | W50: 7.400000000000001e-002 | X50: 5.7000000000000002e-002 | Y50: 55 | Z50: 5.21 | AA50: 3.0600000000000002e-002 | AB50: 2.4e-002 | AC50: 5.3e-003 | AD50: 3.0000000000000001e-003 | AE50: 78.74 | AF50: 80.67 | AG50: 0.53 | AH50: A+ | AI50: 7.51e-002 | AJ50: =H50+100*O50 -> 134.16 | AK50: 127.1 | AL50: 80 | AM50: 46.4 | AN50: 216 | AO50: -5.2999999999999999e-002 | AP50: 12 | AQ50: 正川转债!
A51: 161 | B51: 113591 | C51: 胜达转债! | D51: 603687 | E51: 大胜达 | F51: 造纸包装 | G51: 包装用纸 | H51: 105.09 | I51: 1.7000000000000001e-003 | J51: 1.6000000000000001e-003 | K51: 7.83 | L51: 6.4000000000000003e-003 | M51: 121.7 | N51: 8.76 | O51: 0.17600000000000002 | P51: 89.38 | Q51: 转股中 | R51: 4.98年 | S51: 2.98年 | T51: 5.5 | U51: 3.9 | V51: 6.9999999999999993e-003 | W51: 0.17100000000000001 | X51: 0.153 | Y51: 32 | Z51: 1.86 | AA51: 3.0499999999999999e-002 | AB51: 2.2799999999999997e-002 | AC51: -4.5000000000000005e-003 | AD51: -6.7000000000000002e-003 | AE51: 85.68 | AF51: 90.38 | AG51: 0.52 | AH51: AA- | AI51: 6.2899999999999998e-002 | AJ51: =H51+100*O51 -> 122.69 | AK51: 120.8 | AL51: 30 | AM51: 30.4 | AN51: 50 | AO51: -1.1000000000000001e-002 | AP51: 29 | AQ51: 胜达转债!
A52: 323 | B52: 123010 | C52: 博世转债! | D52: 300422 | E52: 博世科 | F52: 城市公用 | G52: 三废处理 | H52: 101.95 | I52: 2.1000000000000001e-002 | J52: 7.0999999999999995e-003 | K52: 9.37 | L52: 9.849999999999999e-002 | M52: 111.3 | N52: 12.15 | O52: 0.32200000000000001 | P52: 77.12 | Q52: 转股中 | R52: 2.99年 | S52: 0.99年 | T52: 4.3 | U52: 585 | V52: 1.28 | W52: 0.113 | X52: 8.6999999999999994e-002 | Y52: 38 | Z52: 1.57 | AA52: 3.0200000000000001e-002 | AB52: 2.3e-002 | AC52: -1.2999999999999999e-003 | AD52: -4.3e-003 | AE52: 95.04 | AF52: 93.39 | AG52: 0.29 | AH52: AA- | AI52: 6.1399999999999996e-002 | AJ52: =H52+100*O52 -> 134.15000000000001 | AK52: 126.8 | AL52: 76 | AM52: 31.7 | AN52: 69 | AO52: 9.4e-002 | AP52: 31 | AQ52: 博世转债!
A53: 183 | B53: 113578 | C53: 全筑转债! | D53: 603030 | E53: 全筑股份 | F53: 建筑 | G53: 装饰工程 | H53: 102.55 | I53: 5.1999999999999998e-003 | J53: -4.4000000000000003e-003 | K53: 4.47 | L53: 2.2000000000000001e-003 | M53: 117.9 | N53: 5.4 | O53: 0.23899999999999999 | P53: 82.78 | Q53: 转股中 | R53: 4.78年 | S53: 2.78年 | T53: 3.84 | U53: 5.7 | V53: 1.4999999999999999e-002 | W53: 0.16 | X53: 0.13200000000000001 | Y53: 24 | Z53: 1.06 | AA53: 3.0200000000000001e-002 | AB53: 2.3300000000000001e-002 | AC53: 2.8000000000000004e-003 | AD53: 5.9999999999999995e-004 | AE53: 91.71 | AF53: 97.26 | AG53: 0.36 | AH53: AA | AI53: 4.1900000000000007e-002 | AJ53: =H53+100*O53 -> 126.44999999999999 | AK53: 122.3 | AL53: 38 | AM53: 25.1 | AN53: 22 | AO53: 1.3000000000000001e-002 | AP53: 21 | AQ53: 全筑转债!
A54: 295 | B54: 113021 | C54: 中信转债! | D54: 601998 | E54: 中信银行 | F54: 金融 | G54: 银行行业 | H54: 106.22 | I54: 2.0000000000000001e-004 | J54: -1.1000000000000001e-003 | K54: 5.05 | L54: -5.8999999999999999e-003 | M54: 118 | N54: 6.98 | O54: 0.46799999999999997 | P54: 72.35 | Q54: 转股中 | R54: 3.65年 | S54: 无权 | T54: 400 | U54: 51 | V54: 1.e-003 | W54: 0.16200000000000001 | X54: 0.11699999999999999 | Y54: 2471. | Z54: 0.51 | AA54: 3.0099999999999998e-002 | AB54: 2.1000000000000001e-002 | AC54: 无权 | AD54: 无权 | AE54: 无权 | AF54: 103.78 | AG54: 0.16 | AH54: AAA | AI54: 3.6900000000000002e-002 | AJ54: =H54+100*O54 -> 153.01999999999998 | AK54: 140.1 | AL54: 231 | AM54: 36.3 | AN54: 117 | AO54: -1.7000000000000001e-002 | AP54: 43 | AQ54: 中信转债!
A55: 157 | B55: 113036 | C55: 宁建转债! | D55: 601789 | E55: 宁波建工 | F55: 建筑 | G55: 建筑工程 | H55: 101.13 | I55: 3.0000000000000001e-003 | J55: -1.4000000000000002e-003 | K55: 3.61 | L55: 5.6000000000000008e-003 | M55: 116.9 | N55: 4.76 | O55: 0.33299999999999996 | P55: 75.84 | Q55: 转股中 | R55: 4.99年 | S55: 2.99年 | T55: 5.4 | U55: 4.7 | V55: 9.0000000000000011e-003 | W55: 0.153 | X55: 0.11599999999999999 | Y55: 35 | Z55: 1.12 | AA55: 2.9999999999999999e-002 | AB55: 2.3799999999999998e-002 | AC55: 7.0999999999999995e-003 | AD55: 5.0000000000000001e-003 | AE55: 90.92 | AF55: 95.6 | AG55: 0.29 | AH55: AA | AI55: 4.1900000000000007e-002 | AJ55: =H55+100*O55 -> 134.43000000000001 | AK55: 126.4 | AL55: 73 | AM55: 30.8 | AN55: 55 | AO55: -4.4000000000000004e-002 | AP55: 9 | AQ55: 宁建转债!
A56: 280 | B56: 113532 | C56: 海环转债! | D56: 603817 | E56: 海峡环保 | F56: 城市公用 | G56: 三废处理 | H56: 100.9 | I56: 2.3999999999999998e-003 | J56: 1.e-003 | K56: 5.64 | L56: 1.44e-002 | M56: 112.3 | N56: 7.63 | O56: 0.36499999999999999 | P56: 73.92 | Q56: 转股中 | R56: 3.73年 | S56: 1.73年 | T56: 4.59 | U56: 2.5 | V56: 6.0000000000000001e-003 | W56: 0.18100000000000002 | X56: 0.13400000000000001 | Y56: 25 | Z56: 1.43 | AA56: 2.9700000000000001e-002 | AB56: 2.3399999999999997e-002 | AC56: 9.8999999999999991e-003 | AD56: 6.9999999999999993e-003 | AE56: 95.15 | AF56: 96.64 | AG56: 0.23 | AH56: AA | AI56: 4.1900000000000007e-002 | AJ56: =H56+100*O56 -> 137.40000000000001 | AK56: 127.9 | AL56: 92 | AM56: 31.2 | AN56: 61 | AO56: 3.0000000000000001e-003 | AP56: 26 | AQ56: 海环转债!
A57: 88 | B57: 123076 | C57: 强力转债! | D57: 300429 | E57: 强力新材 | F57: 化工 | G57: 化工 | H57: 101.711 | I57: 7.7000000000000002e-003 | J57: -5.7999999999999996e-003 | K57: 13.45 | L57: 5.1999999999999998e-003 | M57: 118.5 | N57: 18.94 | O57: 0.43200000000000005 | P57: 71.01 | Q57: 转股中 | R57: 5.36年 | S57: 3.36年 | T57: 8.5 | U57: 11 | V57: 1.3000000000000001e-002 | W57: 0.12300000000000001 | X57: 8.6999999999999994e-002 | Y57: 69 | Z57: 3.92 | AA57: 2.9500000000000002e-002 | AB57: 2.3199999999999998e-002 | AC57: 5.8999999999999999e-003 | AD57: 3.8e-003 | AE57: 83.58 | AF57: 85.52 | AG57: 0.37 | AH57: AA- | AI57: 6.4100000000000004e-002 | AJ57: =H57+100*O57 -> 144.911 | AK57: 132.4 | AL57: 153 | AM57: 46.9 | AN57: 223 | AO57: 5.2000000000000005e-002 | AP57: 16 | AQ57: 强力转债!
A58: 214 | B58: 113566 | C58: 翔港转债! | D58: 603499 | E58: 翔港科技 | F58: 造纸包装 | G58: 包装材料 | H58: 108.83 | I58: 1.2999999999999999e-003 | J58: 5.9999999999999995e-004 | K58: 7.7 | L58: 5.1999999999999998e-003 | M58: 124 | N58: 10.77 | O58: 0.52200000000000002 | P58: 71.49 | Q58: 转股中 | R58: 4.64年 | S58: 2.64年 | T58: 1.61 | U58: 1 | V58: 6.0000000000000001e-003 | W58: 0.10400000000000001 | X58: 7.400000000000001e-002 | Y58: 15 | Z58: 2.73 | AA58: 2.92e-002 | AB58: 2.0199999999999999e-002 | AC58: -1.5700000000000002e-002 | AD58: -1.8500000000000003e-002 | AE58: 85.48 | AF58: 89.78 | AG58: 0.36 | AH58: A+ | AI58: 7.3899999999999993e-002 | AJ58: =H58+100*O58 -> 161.03 | AK58: 146.2 | AL58: 266 | AM58: 56.4 | AN58: 268 | AO58: 0. | AP58: 28 | AQ58: 翔港转债!
A59: 248 | B59: 113546 | C59: 迪贝转债! | D59: 603320 | E59: 迪贝电气 | F59: 家电 | G59: 零部件制 | H59: 106.97 | I59: 3.8e-003 | J59: -4.0000000000000002e-004 | K59: 11.89 | L59: 6.8000000000000005e-003 | M59: 120.6 | N59: 14 | O59: 0.26000000000000001 | P59: 84.93 | Q59: 转股中 | R59: 4.29年 | S59: 2.29年 | T59: 2.3 | U59: 1.8 | V59: 6.9999999999999993e-003 | W59: 0.14899999999999999 | X59: 0.126 | Y59: 15 | Z59: 2.23 | AA59: 2.9100000000000001e-002 | AB59: 2.0499999999999997e-002 | AC59: -1.18e-002 | AD59: -1.49e-002 | AE59: 87.45 | AF59: 89.51 | AG59: 0.49 | AH59: A+ | AI59: 7.3899999999999993e-002 | AJ59: =H59+100*O59 -> 132.97 | AK59: 129 | AL59: 106 | AM59: 39.5 | AN59: 146 | AO59: 5.0000000000000003e-002 | AP59: 38 | AQ59: 迪贝转债!
A60: 172 | B60: 123053 | C60: 宝通转债! | D60: 300031 | E60: 宝通科技 | F60: 通信互联 | G60: 互联网 | H60: 105.25 | I60: -5.4000000000000003e-003 | J60: 2.8999999999999998e-003 | K60: 15.54 | L60: -6.4000000000000003e-003 | M60: 120.8 | N60: 20.5 | O60: 0.38799999999999996 | P60: 75.8 | Q60: 转股中 | R60: 4.90年 | S60: 2.91年 | T60: 5 | U60: 11 | V60: 2.e-002 | W60: 8.1000000000000003e-002 | X60: 6.0999999999999999e-002 | Y60: 62 | Z60: 2.01 | AA60: 2.9100000000000001e-002 | AB60: 2.1499999999999998e-002 | AC60: -4.7999999999999996e-003 | AD60: -7.0999999999999995e-003 | AE60: 86.14 | AF60: 90.13 | AG60: 0.39 | AH60: AA- | AI60: 6.2899999999999998e-002 | AJ60: =H60+100*O60 -> 144.05000000000001 | AK60: 134.7 | AL60: 177 | AM60: 44.6 | AN60: 204 | AO60: -4.9000000000000002e-002 | AP60: 10 | AQ60: 宝通转债!
A61: 165 | B61: 123056 | C61: 雪榕转债! | D61: 300511 | E61: 雪榕生物 | F61: 农业 | G61: 种植业 | H61: 104.969 | I61: 9.4999999999999998e-003 | J61: -9.1000000000000004e-003 | K61: 8.06 | L61: 1.1999999999999999e-003 | M61: 120.7 | N61: 11.77 | O61: 0.53299999999999992 | P61: 68.48 | Q61: 转股中 | R61: 4.96年 | S61: 2.96年 | T61: 5.84 | U61: 2.8 | V61: 5.0000000000000001e-003 | W61: 0.16399999999999998 | X61: 0.11199999999999999 | Y61: 36 | Z61: 1.72 | AA61: 2.9100000000000001e-002 | AB61: 2.1700000000000001e-002 | AC61: -4.1999999999999997e-003 | AD61: -6.4000000000000003e-003 | AE61: 85.78 | AF61: 89.75 | AG61: 0.29 | AH61: AA- | AI61: 6.2899999999999998e-002 | AJ61: =H61+100*O61 -> 158.26899999999998 | AK61: 141.5 | AL61: 236 | AM61: 51.7 | AN61: 251 | AO61: -2.2000000000000002e-002 | AP61: 16 | AQ61: 雪榕转债!
A62: 133 | B62: 113599 | C62: 嘉友转债! | D62: 603871 | E62: 嘉友国际 | F62: 交通运输 | G62: 物流业 | H62: 109.38 | I62: 1.7000000000000001e-003 | J62: -3.9000000000000003e-003 | K62: 16.24 | L62: -4.3e-003 | M62: 126 | N62: 18.32 | O62: 0.23399999999999999 | P62: 88.65 | Q62: 转股中 | R62: 5年26天 | S62: 3年27天 | T62: 7.2 | U62: 2.7 | V62: 3.0000000000000001e-003 | W62: 0.155 | X62: 0.13800000000000001 | Y62: 46 | Z62: 1.66 | AA62: 2.8900000000000002e-002 | AB62: 2.0099999999999996e-002 | AC62: -1.5800000000000002e-002 | AD62: -1.8100000000000002e-002 | AE62: 85.17 | AF62: 92.57 | AG62: 0.5 | AH62: AA- | AI62: 6.4100000000000004e-002 | AJ62: =H62+100*O62 -> 132.78 | AK62: 130.1 | AL62: 123 | AM62: 37.5 | AN62: 132 | AO62: -5.9999999999999998e-002 | AP62: 19 | AQ62: 嘉友转债!
A63: 227 | B63: 123039 | C63: 开润转债! | D63: 300577 | E63: 开润股份 | F63: 服装纺织 | G63: 纺织行业 | H63: 106.9 | I63: 3.3e-003 | J63: -3.0000000000000001e-003 | K63: 20.43 | L63: 1.e-003 | M63: 121 | N63: 29.9 | O63: 0.56499999999999995 | P63: 68.33 | Q63: 转股中 | R63: 4.46年 | S63: 2.47年 | T63: 2.22 | U63: 1 | V63: 4.0000000000000001e-003 | W63: 4.4999999999999998e-002 | X63: 3.1e-002 | Y63: 49 | Z63: 3.2 | AA63: 2.8799999999999999e-002 | AB63: 2.0400000000000001e-002 | AC63: -1.0200000000000001e-002 | AD63: -1.32e-002 | AE63: 86.47 | AF63: 88.71 | AG63: 0.31 | AH63: A+ | AI63: 7.3899999999999993e-002 | AJ63: =H63+100*O63 -> 163.40000000000001 | AK63: 145.5 | AL63: 262 | AM63: 56.8 | AN63: 273 | AO63: -4.0000000000000001e-002 | AP63: 23 | AQ63: 开润转债!
A64: 66 | B64: 123088 | C64: 威唐转债! | D64: 300707 | E64: 威唐工业 | F64: 汽车 | G64: 零部件制 | H64: 104.592 | I64: 4.7999999999999996e-003 | J64: -5.5000000000000005e-003 | K64: 16.82 | L64: -1.1999999999999999e-003 | M64: 121.6 | N64: 20.72 | O64: 0.28800000000000003 | P64: 81.18 | Q64: 转股中 | R64: 5.43年 | S64: 3.44年 | T64: 3.01 | U64: 5.5 | V64: 1.7000000000000001e-002 | W64: 0.114 | X64: 9.3000000000000013e-002 | Y64: 26 | Z64: 3.83 | AA64: 2.8799999999999999e-002 | AB64: 2.1700000000000001e-002 | AC64: 0. | AD64: -2.3999999999999998e-003 | AE64: 80.86 | AF64: 82.85 | AG64: 0.54 | AH64: A+ | AI64: 7.51e-002 | AJ64: =H64+100*O64 -> 133.392 | AK64: 128 | AL64: 94 | AM64: 45.2 | AN64: 206 | AO64: 1.6e-002 | AP64: 14 | AQ64: 威唐转债!
A65: 196 | B65: 113033 | C65: 利群转债! | D65: 601366 | E65: 利群股份 | F65: 商业零售 | G65: 商场 | H65: 100.77 | I65: 5.6999999999999993e-003 | J65: -3.4999999999999996e-003 | K65: 6.28 | L65: 4.7999999999999996e-003 | M65: 114.9 | N65: 7.01 | O65: 0.125 | P65: 89.59 | Q65: 转股中 | R65: 4.73年 | S65: 2.73年 | T65: 18 | U65: 20 | V65: 1.1000000000000001e-002 | W65: 0.33299999999999996 | X65: 0.29799999999999999 | Y65: 54 | Z65: 1.16 | AA65: 2.87e-002 | AB65: 2.2799999999999997e-002 | AC65: 9.0000000000000011e-003 | AD65: 6.7000000000000002e-003 | AE65: 91.91 | AF65: 94.99 | AG65: 0.46 | AH65: AA | AI65: 4.1900000000000007e-002 | AJ65: =H65+100*O65 -> 113.27 | AK65: 112 | AL65: 8 | AM65: 17 | AN65: 5 | AO65: 4.0000000000000001e-003 | AP65: 60 | AQ65: 利群转债!
A66: 187 | B66: 123049 | C66: 维尔转债 | D66: 300190 | E66: 维尔利 | F66: 城市公用 | G66: 三废处理 | H66: 109.115 | I66: 1.1399999999999999e-002 | J66: -3.7000000000000002e-003 | K66: 6.78 | L66: 1.4999999999999999e-002 | M66: 124.3 | N66: 7.38 | O66: 0.188 | P66: 91.87 | Q66: 转股中 | R66: 4.76年 | S66: 2.76年 | T66: 9.17 | U66: 24 | V66: 2.4e-002 | W66: 0.17300000000000001 | X66: 0.159 | Y66: 53 | Z66: 1.22 | AA66: 2.8399999999999998e-002 | AB66: 1.95e-002 | AC66: -1.5700000000000002e-002 | AD66: -1.84e-002 | AE66: 87.34 | AF66: 93.6 | AG66: 0.51 | AH66: AA- | AI66: 6.2899999999999998e-002 | AJ66: =H66+100*O66 -> 127.91499999999999 | AK66: 126.4 | AL66: 72 | AM66: 32.8 | AN66: 79 | AO66: 3.1e-002 | AP66: 17 | AQ66: 维尔转债
A67: 273 | B67: 127013 | C67: 创维转债! | D67: 810 | E67: 创维数字 | F67: 电子 | G67: 电子产品 | H67: 105.96 | I67: 4.6999999999999993e-003 | J67: -4.0000000000000002e-004 | K67: 8.64 | L67: 2.0099999999999996e-002 | M67: 117.3 | N67: 11.29 | O67: 0.38500000000000001 | P67: 76.53 | Q67: 转股中 | R67: 3.76年 | S67: 1.77年 | T67: 9.78 | U67: 6.9 | V67: 6.9999999999999993e-003 | W67: 0.106 | X67: 8.1000000000000003e-002 | Y67: 92 | Z67: 2.18 | AA67: 2.7900000000000001e-002 | AB67: 1.95e-002 | AC67: -1.5600000000000001e-002 | AD67: -1.84e-002 | AE67: 95.01 | AF67: 100.78 | AG67: 0.22 | AH67: AA | AI67: 4.1900000000000007e-002 | AJ67: =H67+100*O67 -> 144.45999999999998 | AK67: 135.4 | AL67: 181 | AM67: 34.6 | AN67: 96 | AO67: -1.6e-002 | AP67: 23 | AQ67: 创维转债!
A68: 136 | B68: 113597 | C68: 佳力转债! | D68: 603912 | E68: 佳力图 | F68: 机械装备 | G68: 专用设备 | H68: 108.94 | I68: -2.0000000000000001e-004 | J68: 0. | K68: 16.74 | L68: -5.9999999999999995e-004 | M68: 124.5 | N68: 23.15 | O68: 0.50700000000000001 | P68: 72.31 | Q68: 转股中 | R68: 5年20天 | S68: 3年21天 | T68: 3 | U68: 31 | V68: 9.6000000000000002e-002 | W68: 8.3000000000000004e-002 | X68: 5.9999999999999998e-002 | Y68: 36 | Z68: 3.91 | AA68: 2.7400000000000001e-002 | AB68: 1.9e-002 | AC68: -1.32e-002 | AD68: -1.5800000000000002e-002 | AE68: 85.7 | AF68: 91.65 | AG68: 0.34 | AH68: AA- | AI68: 6.4100000000000004e-002 | AJ68: =H68+100*O68 -> 159.63999999999999 | AK68: 145.6 | AL68: 263 | AM68: 53.9 | AN68: 262 | AO68: 4.7e-002 | AP68: 16 | AQ68: 佳力转债!
A69: 317 | B69: 128042 | C69: 凯中转债! | D69: 2823 | E69: 凯中精密 | F69: 能源电力 | G69: 电力设备 | H69: 107.4 | I69: 3.4000000000000002e-003 | J69: -7.3000000000000001e-003 | K69: 10.59 | L69: -1.5800000000000002e-002 | M69: 116.3 | N69: 12.86 | O69: 0.30399999999999999 | P69: 82.35 | Q69: 转股中 | R69: 3年20天 | S69: 1年21天 | T69: 4.16 | U69: 2 | V69: 4.0000000000000001e-003 | W69: 0.13699999999999998 | X69: 0.113 | Y69: 30 | Z69: 2.24 | AA69: 2.7000000000000003e-002 | AB69: 1.72e-002 | AC69: -3.5499999999999997e-002 | AD69: -3.9800000000000002e-002 | AE69: 97.82 | AF69: 102.88 | AG69: 0.25 | AH69: AA | AI69: 4.1900000000000007e-002 | AJ69: =H69+100*O69 -> 137.80000000000001 | AK69: 132.5 | AL69: 154 | AM69: 29.6 | AN69: 43 | AO69: 8.0000000000000002e-003 | AP69: 26 | AQ69: 凯中转债!
A70: 162 | B70: 128116 | C70: 瑞达转债! | D70: 2961 | E70: 瑞达期货 | F70: 金融 | G70: 期货行业 | H70: 101.18 | I70: 1.8e-003 | J70: -1.5e-003 | K70: 20.43 | L70: 1.e-003 | M70: 114.9 | N70: 29.55 | O70: 0.46299999999999997 | P70: 69.14 | Q70: 转股中 | R70: 4.97年 | S70: 2.97年 | T70: 6.5 | U70: 3.5 | V70: 5.0000000000000001e-003 | W70: 7.0999999999999994e-002 | X70: 4.9000000000000002e-002 | Y70: 91 | Z70: 4.64 | AA70: 2.64e-002 | AB70: 2.0799999999999999e-002 | AC70: 6.7000000000000002e-003 | AD70: 4.6999999999999993e-003 | AE70: 90.91 | AF70: 94.04 | AG70: 0.24 | AH70: AA | AI70: 4.1900000000000007e-002 | AJ70: =H70+100*O70 -> 147.48000000000002 | AK70: 133.2 | AL70: 159 | AM70: 39.2 | AN70: 143 | AO70: -5.4000000000000006e-002 | AP70: 18 | AQ70: 瑞达转债!
A71: 71 | B71: 127027 | C71: 靖远转债! | D71: 552 | E71: 靖远煤电 | F71: 煤炭 | G71: 煤炭开采 | H71: 100.46 | I71: 5.6000000000000008e-003 | J71: 6.3e-003 | K71: 2.88 | L71: 2.4900000000000002e-002 | M71: 115.3 | N71: 3.23 | O71: 0.127 | P71: 89.16 | Q71: 转股中 | R71: 5.42年 | S71: 3.42年 | T71: 28 | U71: 29 | V71: 1.e-002 | W71: 0.42499999999999999 | X71: 0.379 | Y71: 66 | Z71: 0.82 | AA71: 2.63e-002 | AB71: 2.1000000000000001e-002 | AC71: 9.300000000000001e-003 | AD71: 7.1999999999999998e-003 | AE71: 90.28 | AF71: 93.58 | AG71: 0.48 | AH71: AA+ | AI71: 4.0099999999999997e-002 | AJ71: =H71+100*O71 -> 113.16 | AK71: 111.8 | AL71: 7 | AM71: 18.2 | AN71: 6 | AO71: -3.7000000000000005e-002 | AP71: 42 | AQ71: 靖远转债!
A72: 304 | B72: 113524 | C72: 奇精转债! | D72: 603677 | E72: 奇精机械 | F72: 家电 | G72: 零部件制 | H72: 107.78 | I72: 1.2999999999999999e-003 | J72: -4.8999999999999998e-003 | K72: 11.73 | L72: -9.300000000000001e-003 | M72: 117.3 | N72: 13.98 | O72: 0.28499999999999998 | P72: 83.91 | Q72: 转股中 | R72: 3.43年 | S72: 1.43年 | T72: 3.3 | U72: 3.8 | V72: 1.1000000000000001e-002 | W72: 0.14599999999999999 | X72: 0.12300000000000001 | Y72: 23 | Z72: 2.3 | AA72: 2.5499999999999998e-002 | AB72: 1.6299999999999999e-002 | AC72: -2.9399999999999999e-002 | AD72: -3.27e-002 | AE72: 93.32 | AF72: 95.55 | AG72: 0.38 | AH72: AA- | AI72: 6.2899999999999998e-002 | AJ72: =H72+100*O72 -> 136.28 | AK72: 131.7 | AL72: 141 | AM72: 36.1 | AN72: 113 | AO72: 3.7999999999999999e-002 | AP72: 43 | AQ72: 奇精转债!
A73: 141 | B73: 128123 | C73: 国光转债! | D73: 2749 | E73: 国光股份 | F73: 化工 | G73: 农化 | H73: 102.659 | I73: 3.4999999999999996e-003 | J73: -3.4999999999999996e-003 | K73: 9.01 | L73: 0. | M73: 116.2 | N73: 13.48 | O73: 0.53600000000000003 | P73: 66.84 | Q73: 转股中 | R73: 5年17天 | S73: 3年18天 | T73: 3.2 | U73: 1 | V73: 3.0000000000000001e-003 | W73: 8.1000000000000003e-002 | X73: 5.4000000000000006e-002 | Y73: 39 | Z73: 3.15 | AA73: 2.5499999999999998e-002 | AB73: 1.95e-002 | AC73: 4.5000000000000005e-003 | AD73: 2.e-003 | AE73: 85.5 | AF73: 85.6 | AG73: 0.32 | AH73: AA- | AI73: 6.4100000000000004e-002 | AJ73: =H73+100*O73 -> 156.25900000000001 | AK73: 138.5 | AL73: 214 | AM73: 52.9 | AN73: 258 | AO73: -2.6000000000000002e-002 | AP73: 12 | AQ73: 国光转债!
A74: 346 | B74: 123004 | C74: 铁汉转债! | D74: 300197 | E74: 节能铁汉 | F74: 城市公用 | G74: 生态环境 | H74: 102.44 | I74: 7.9000000000000008e-003 | J74: -3.0000000000000001e-003 | K74: 3.06 | L74: 2.3399999999999997e-002 | M74: 108.8 | N74: 3.82 | O74: 0.27899999999999997 | P74: 80.1 | Q74: 转股中 | R74: 2.44年 | S74: 0.44年 | T74: 8.03 | U74: 6.5 | V74: 8.0000000000000002e-003 | W74: 9.3000000000000013e-002 | X74: 7.400000000000001e-002 | Y74: 86 | Z74: 1.32 | AA74: 2.5399999999999999e-002 | AB74: 1.84e-002 | AC74: -1.4199999999999999e-002 | AD74: -1.9199999999999998e-002 | AE74: 99.13 | AF74: 98.92 | AG74: 0.21 | AH74: AA | AI74: 4.0399999999999998e-002 | AJ74: =H74+100*O74 -> 130.34 | AK74: 124.8 | AL74: 59 | AM74: 25.6 | AN74: 24 | AO74: -1.e-002 | AP74: 44 | AQ74: 铁汉转债!
A75: 47 | B75: 123096 | C75: 思创转债! | D75: 300078 | E75: 思创医惠 | F75: 通信互联 | G75: 物联网 | H75: 108.156 | I75: 5.1999999999999998e-003 | J75: 5.3e-003 | K75: 7.52 | L75: 1.9e-002 | M75: 124 | N75: 8.27 | O75: 0.18899999999999997 | P75: 90.93 | Q75: 24天 | R75: 5.55年 | S75: 3.55年 | T75: 8.17 | U75: 6.4 | V75: 6.9999999999999993e-003 | W75: 0.125 | X75: 0.114 | Y75: 65 | Z75: 2.19 | AA75: 2.5399999999999999e-002 | AB75: 1.8000000000000002e-002 | AC75: -1.0800000000000001e-002 | AD75: -1.2800000000000001e-002 | AE75: 82.69 | AF75: 88.45 | AG75: 0.55 | AH75: AA- | AI75: 6.4100000000000004e-002 | AJ75: =H75+100*O75 -> 127.05600000000001 | AK75: 125.4 | AL75: 68 | AM75: 36.9 | AN75: 125 | AO75: 3.9e-002 | AP75: 6 | AQ75: 思创转债!
A76: 272 | B76: 110058 | C76: 永鼎转债! | D76: 600105 | E76: 永鼎股份 | F76: 通信互联 | G76: 通信设备 | H76: 104.49 | I76: 1.1000000000000001e-003 | J76: -4.4000000000000003e-003 | K76: 3.73 | L76: -1.06e-002 | M76: 114.3 | N76: 5.04 | O76: 0.41200000000000003 | P76: 74.01 | Q76: 转股中 | R76: 3.77年 | S76: 1.77年 | T76: 2.61 | U76: 12 | V76: 4.4000000000000004e-002 | W76: 5.0999999999999997e-002 | X76: 3.7999999999999999e-002 | Y76: 52 | Z76: 1.85 | AA76: 2.46e-002 | AB76: 1.7500000000000002e-002 | AC76: -8.3999999999999995e-003 | AD76: -1.1200000000000002e-002 | AE76: 91.43 | AF76: 91.22 | AG76: 0.32 | AH76: AA- | AI76: 6.2899999999999998e-002 | AJ76: =H76+100*O76 -> 145.69 | AK76: 135 | AL76: 180 | AM76: 43.5 | AN76: 190 | AO76: -4.2999999999999997e-002 | AP76: 47 | AQ76: 永鼎转债!
A77: 78 | B77: 123081 | C77: 精研转债! | D77: 300709 | E77: 精研科技 | F77: 电子 | G77: 电子产品 | H77: 106.7 | I77: 2.8000000000000004e-003 | J77: 2.0000000000000001e-004 | K77: 39.99 | L77: 7.3000000000000001e-003 | M77: 121.3 | N77: 53.4 | O77: 0.42499999999999999 | P77: 74.89 | Q77: 转股中 | R77: 5.40年 | S77: 3.40年 | T77: 5.7 | U77: 6 | V77: 1.e-002 | W77: 0.10300000000000001 | X77: 7.6999999999999999e-002 | Y77: 55 | Z77: 2.91 | AA77: 2.46e-002 | AB77: 1.7600000000000001e-002 | AC77: -6.6e-003 | AD77: -8.8999999999999999e-003 | AE77: 83.69 | AF77: 87.37 | AG77: 0.42 | AH77: AA- | AI77: 6.4100000000000004e-002 | AJ77: =H77+100*O77 -> 149.19999999999999 | AK77: 138.5 | AL77: 215 | AM77: 51.1 | AN77: 248 | AO77: 3.6000000000000004e-002 | AP77: 8 | AQ77: 精研转债!
A78: 297 | B78: 128056 | C78: 今飞转债! | D78: 2863 | E78: 今飞凯达 | F78: 汽车 | G78: 零部件制 | H78: 110.4 | I78: 5.0000000000000001e-003 | J78: -3.0999999999999999e-003 | K78: 4.98 | L78: 6.0999999999999995e-003 | M78: 120.2 | N78: 6.69 | O78: 0.48299999999999998 | P78: 74.44 | Q78: 转股中 | R78: 3.64年 | S78: 1.64年 | T78: 1.72 | U78: 4 | V78: 2.1000000000000001e-002 | W78: 6.9000000000000006e-002 | X78: 5.2000000000000005e-002 | Y78: 25 | Z78: 1.33 | AA78: 2.4199999999999999e-002 | AB78: 1.43e-002 | AC78: -3.61e-002 | AD78: -3.95e-002 | AE78: 90.98 | AF78: 93.26 | AG78: 0.31 | AH78: A+ | AI78: 7.3899999999999993e-002 | AJ78: =H78+100*O78 -> 158.69999999999999 | AK78: 146.4 | AL78: 267 | AM78: 53.1 | AN78: 260 | AO78: -1.4999999999999999e-002 | AP78: 53 | AQ78: 今飞转债!
A79: 144 | B79: 113037 | C79: 紫银转债! | D79: 601860 | E79: 紫金银行 | F79: 金融 | G79: 银行行业 | H79: 103.09 | I79: 1.7000000000000001e-003 | J79: -8.9999999999999998e-004 | K79: 3.54 | L79: 2.8000000000000004e-003 | M79: 115.8 | N79: 4.65 | O79: 0.35399999999999998 | P79: 76.13 | Q79: 转股中 | R79: 5年13天 | S79: 无权 | T79: 45 | U79: 21 | V79: 5.0000000000000001e-003 | W79: 0.34700000000000003 | X79: 0.26400000000000001 | Y79: 130 | Z79: 0.88 | AA79: 2.3900000000000001e-002 | AB79: 1.8100000000000002e-002 | AC79: 无权 | AD79: 无权 | AE79: 无权 | AF79: 95.42 | AG79: 0.31 | AH79: AA+ | AI79: 4.0099999999999997e-002 | AJ79: =H79+100*O79 -> 138.49000000000001 | AK79: 130.1 | AL79: 122 | AM79: 34.6 | AN79: 97 | AO79: -3.3000000000000002e-002 | AP79: 21 | AQ79: 紫银转债!
A80: 199 | B80: 110068 | C80: 龙净转债! | D80: 600388 | E80: 龙净环保 | F80: 城市公用 | G80: 三废处理 | H80: 102.96 | I80: 7.4000000000000003e-003 | J80: -4.5000000000000005e-003 | K80: 8.71 | L80: 8.1000000000000013e-003 | M80: 114.8 | N80: 10.55 | O80: 0.247 | P80: 82.56 | Q80: 转股中 | R80: 4.70年 | S80: 2.71年 | T80: 20 | U80: 30 | V80: 1.3999999999999999e-002 | W80: 0.215 | X80: 0.17699999999999999 | Y80: 93 | Z80: 1.53 | AA80: 2.3799999999999998e-002 | AB80: 1.8000000000000002e-002 | AC80: 1.1999999999999999e-003 | AD80: -1.1000000000000001e-003 | AE80: 92.65 | AF80: 96.25 | AG80: 0.36 | AH80: AA+ | AI80: 3.8900000000000004e-002 | AJ80: =H80+100*O80 -> 127.66 | AK80: 123.4 | AL80: 46 | AM80: 27.1 | AN80: 34 | AO80: 2.2000000000000002e-002 | AP80: 33 | AQ80: 龙净转债!
A81: 234 | B81: 128083 | C81: 新北转债! | D81: 2376 | E81: 新北洋 | F81: 电子 | G81: 电子产品 | H81: 103.981 | I81: 2.2000000000000001e-003 | J81: 7.0999999999999995e-003 | K81: 9.19 | L81: 2.7999999999999997e-002 | M81: 114.9 | N81: 11.45 | O81: 0.29600000000000004 | P81: 80.26 | Q81: 转股中 | R81: 4.42年 | S81: 2.43年 | T81: 8.77 | U81: 6.1 | V81: 6.9999999999999993e-003 | W81: 0.14300000000000002 | X81: 0.115 | Y81: 61 | Z81: 1.77 | AA81: 2.3300000000000001e-002 | AB81: 1.7000000000000001e-002 | AC81: -2.2000000000000001e-003 | AD81: -4.6999999999999993e-003 | AE81: 93.06 | AF81: 96.18 | AG81: 0.33 | AH81: AA | AI81: 4.1900000000000007e-002 | AJ81: =H81+100*O81 -> 133.58099999999999 | AK81: 127.7 | AL81: 90 | AM81: 31.5 | AN81: 64 | AO81: 3.0000000000000001e-003 | AP81: 19 | AQ81: 新北转债!
A82: 148 | B82: 113594 | C82: 淳中转债! | D82: 603516 | E82: 淳中科技 | F82: 电子 | G82: 电子产品 | H82: 108.54 | I82: 3.0999999999999999e-003 | J82: 3.2000000000000002e-003 | K82: 20.99 | L82: 1.3999999999999999e-002 | M82: 121.4 | N82: 27.84 | O82: 0.44 | P82: 75.4 | Q82: 转股中 | R82: 5年11天 | S82: 3年12天 | T82: 3 | U82: 2.2 | V82: 6.9999999999999993e-003 | W82: 7.6999999999999999e-002 | X82: 5.7999999999999996e-002 | Y82: 39 | Z82: 2.86 | AA82: 2.3099999999999999e-002 | AB82: 1.5600000000000001e-002 | AC82: -1.1699999999999999e-002 | AD82: -1.44e-002 | AE82: 83.23 | AF82: 85.15 | AG82: 0.45 | AH82: A+ | AI82: 7.51e-002 | AJ82: =H82+100*O82 -> 152.54000000000002 | AK82: 141.7 | AL82: 241 | AM82: 56.5 | AN82: 269 | AO82: -1.e-002 | AP82: 8 | AQ82: 淳中转债!
A83: 151 | B83: 128120 | C83: 联诚转债! | D83: 2921 | E83: 联诚精密 | F83: 汽车 | G83: 零部件制 | H83: 105.968 | I83: 4.4000000000000003e-003 | J83: -3.7000000000000002e-003 | K83: 15.67 | L83: 1.2999999999999999e-003 | M83: 118.4 | N83: 18.44 | O83: 0.247 | P83: 84.98 | Q83: 转股中 | R83: 5年7天 | S83: 3年8天 | T83: 2.6 | U83: 2.9 | V83: 1.1000000000000001e-002 | W83: 0.156 | X83: 0.13300000000000001 | Y83: 17 | Z83: 1.61 | AA83: 2.29e-002 | AB83: 1.6299999999999999e-002 | AC83: -4.1999999999999997e-003 | AD83: -6.9999999999999993e-003 | AE83: 80.91 | AF83: 79.47 | AG83: 0.61 | AH83: A | AI83: 8.5099999999999995e-002 | AJ83: =H83+100*O83 -> 130.66800000000001 | AK83: 127 | AL83: 78 | AM83: 46 | AN83: 211 | AO83: 3.0000000000000001e-003 | AP83: 21 | AQ83: 联诚转债!
A84: 79 | B84: 123080 | C84: 海波转债! | D84: 300517 | E84: 海波重科 | F84: 建筑 | G84: 建筑工程 | H84: 112.5 | I84: 8.5000000000000006e-003 | J84: -5.1000000000000004e-003 | K84: 11.72 | L84: 5.1000000000000004e-003 | M84: 126.5 | N84: 11.58 | O84: 0.11199999999999999 | P84: 101.21 | Q84: 转股中 | R84: 5.40年 | S84: 3.40年 | T84: 2.45 | U84: 12 | V84: 4.2999999999999997e-002 | W84: 0.109 | X84: 0.11 | Y84: 23 | Z84: 1.51 | AA84: 2.2499999999999999e-002 | AB84: 1.4199999999999999e-002 | AC84: -2.0299999999999999e-002 | AD84: -2.2700000000000001e-002 | AE84: 81.13 | AF84: 86.39 | AG84: 0.66 | AH84: A+ | AI84: 7.51e-002 | AJ84: =H84+100*O84 -> 123.7 | AK84: 123.8 | AL84: 52 | AM84: 37.4 | AN84: 131 | AO84: 2.3e-002 | AP84: 21 | AQ84: 海波转债!
A85: 365 | B85: 128013 | C85: 洪涛转债! | D85: 2325 | E85: 洪涛股份 | F85: 建筑 | G85: 装饰工程 | H85: 107.299 | I85: 2.8000000000000004e-003 | J85: -4.0000000000000002e-004 | K85: 2.45 | L85: 4.0999999999999995e-003 | M85: 109.8 | N85: 2.32 | O85: 1.6e-002 | P85: 105.6 | Q85: 转股中 | R85: 1年20天 | S85: 回售内 | T85: 11.5 | U85: 15 | V85: 1.2e-002 | W85: 0.371 | X85: 0.39200000000000002 | Y85: 31 | Z85: 1.14 | AA85: 2.2400000000000003e-002 | AB85: 4.7999999999999996e-003 | AC85: 回售内 | AD85: 回售内 | AE85: 100.3 | AF85: 100.18 | AG85: 0.58 | AH85: A- | AI85: 9.2399999999999996e-002 | AJ85: =H85+100*O85 -> 108.899 | AK85: 109 | AL85: 3 | AM85: 8.7 | AN85: 1 | AO85: -1.e-003 | AP85: 92 | AQ85: 洪涛转债!
A86: 334 | B86: 113505 | C86: 杭电转债! | D86: 603618 | E86: 杭电股份 | F86: 能源电力 | G86: 电力设备 | H86: 105.05 | I86: 8.3999999999999995e-003 | J86: -2.7000000000000001e-003 | K86: 6.19 | L86: 1.8100000000000002e-002 | M86: 111.3 | N86: 7.08 | O86: 0.20199999999999999 | P86: 87.43 | Q86: 转股中 | R86: 2.66年 | S86: 0.66年 | T86: 7.5 | U86: 7.7 | V86: 1.e-002 | W86: 0.17499999999999999 | X86: 0.153 | Y86: 43 | Z86: 1.59 | AA86: 2.2400000000000003e-002 | AB86: 1.43e-002 | AC86: -3.7499999999999999e-002 | AD86: -4.1599999999999998e-002 | AE86: 98.54 | AF86: 100.36 | AG86: 0.31 | AH86: AA | AI86: 4.0399999999999998e-002 | AJ86: =H86+100*O86 -> 125.25 | AK86: 122.7 | AL86: 40 | AM86: 22.3 | AN86: 15 | AO86: -4.2999999999999997e-002 | AP86: 44 | AQ86: 杭电转债!
A87: 150 | B87: 113593 | C87: 沪工转债! | D87: 603131 | E87: 上海沪工 | F87: 机械装备 | G87: 通用设备 | H87: 109.17 | I87: 6.0000000000000001e-003 | J87: 7.7000000000000002e-003 | K87: 17.68 | L87: 2.5499999999999998e-002 | M87: 121.6 | N87: 21.12 | O87: 0.30399999999999999 | P87: 83.71 | Q87: 转股中 | R87: 5年10天 | S87: 3年11天 | T87: 4 | U87: 3.4 | V87: 8.0000000000000002e-003 | W87: 7.0999999999999994e-002 | X87: 5.9999999999999998e-002 | Y87: 56 | Z87: 4.27 | AA87: 2.2200000000000001e-002 | AB87: 1.46e-002 | AC87: -1.34e-002 | AD87: -1.61e-002 | AE87: 83.24 | AF87: 85.28 | AG87: 0.54 | AH87: A+ | AI87: 7.51e-002 | AJ87: =H87+100*O87 -> 139.56999999999999 | AK87: 134.6 | AL87: 176 | AM87: 49.3 | AN87: 237 | AO87: 3.3000000000000002e-002 | AP87: 10 | AQ87: 沪工转债!
A88: 362 | B88: 128014 | C88: 永东转债! | D88: 2753 | E88: 永东股份 | F88: 化工 | G88: 化工 | H88: 105.67 | I88: 3.9000000000000003e-003 | J88: 5.9999999999999995e-004 | K88: 9.57 | L88: 2.8999999999999998e-002 | M88: 109.8 | N88: 12.52 | O88: 0.38200000000000001 | P88: 76.44 | Q88: 转股中 | R88: 1.77年 | S88: 回售内 | T88: 3.37 | U88: 2.2 | V88: 6.0000000000000001e-003 | W88: 9.4e-002 | X88: 7.2000000000000008e-002 | Y88: 36 | Z88: 1.81 | AA88: 2.2099999999999998e-002 | AB88: 1.1599999999999999e-002 | AC88: 回售内 | AD88: 回售内 | AE88: 100.3 | AF88: 98.89 | AG88: 0.16 | AH88: AA- | AI88: 6.1399999999999996e-002 | AJ88: =H88+100*O88 -> 143.87 | AK88: 134.9 | AL88: 179 | AM88: 34.6 | AN88: 95 | AO88: 7.2000000000000008e-002 | AP88: 37 | AQ88: 永东转债!
A89: 349 | B89: 128023 | C89: 亚太转债! | D89: 2284 | E89: 亚太股份 | F89: 汽车 | G89: 零部件制 | H89: 105.689 | I89: 2.3e-003 | J89: 2.8000000000000004e-003 | K89: 8.27 | L89: 2.4799999999999999e-002 | M89: 111.3 | N89: 10.34 | O89: 0.32100000000000001 | P89: 79.98 | Q89: 转股中 | R89: 2.41年 | S89: 0.41年 | T89: 9.99 | U89: 14 | V89: 1.3000000000000001e-002 | W89: 0.16399999999999998 | X89: 0.13100000000000001 | Y89: 61 | Z89: 2.45 | AA89: 2.2099999999999998e-002 | AB89: 1.3300000000000001e-002 | AC89: -6.3700000000000007e-002 | AD89: -6.9400000000000003e-002 | AE89: 99.53 | AF89: 101.36 | AG89: 0.2 | AH89: AA | AI89: 4.0399999999999998e-002 | AJ89: =H89+100*O89 -> 137.78899999999999 | AK89: 131.4 | AL89: 135 | AM89: 30 | AN89: 45 | AO89: -1.1000000000000001e-002 | AP89: 66 | AQ89: 亚太转债!
A90: 134 | B90: 113598 | C90: 法兰转债 | D90: 603966 | E90: 法兰泰克 | F90: 机械装备 | G90: 工程机械 | H90: 109 | I90: 3.4999999999999996e-003 | J90: -3.4999999999999996e-003 | K90: 11.91 | L90: 0. | M90: 121.2 | N90: 13.88 | O90: 0.27000000000000002 | P90: 85.81 | Q90: 转股中 | R90: 5年21天 | S90: 3年22天 | T90: 2.75 | U90: 2.2 | V90: 6.9999999999999993e-003 | W90: 0.10800000000000001 | X90: 9.1999999999999998e-002 | Y90: 26 | Z90: 2.19 | AA90: 2.1700000000000001e-002 | AB90: 1.43e-002 | AC90: -1.43e-002 | AD90: -1.67e-002 | AE90: 85.43 | AF90: 89.19 | AG90: 0.51 | AH90: AA- | AI90: 6.4100000000000004e-002 | AJ90: =H90+100*O90 -> 136. | AK90: 132.2 | AL90: 149 | AM90: 43 | AN90: 184 | AO90: -2.2000000000000002e-002 | AP90: 11 | AQ90: 法兰转债
A91: 215 | B91: 113565 | C91: 宏辉转债 | D91: 603336 | E91: 宏辉果蔬 | F91: 农业 | G91: 农产品加 | H91: 106.93 | I91: 1.4000000000000002e-003 | J91: -7.4000000000000003e-003 | K91: 6.6 | L91: -1.2e-002 | M91: 117.8 | N91: 7.64 | O91: 0.23800000000000002 | P91: 86.39 | Q91: 转股中 | R91: 4.63年 | S91: 2.64年 | T91: 2.25 | U91: 9.1 | V91: 3.7999999999999999e-002 | W91: 7.8e-002 | X91: 6.7000000000000004e-002 | Y91: 29 | Z91: 2.13 | AA91: 2.1600000000000001e-002 | AB91: 1.46e-002 | AC91: -1.09e-002 | AD91: -1.3500000000000002e-002 | AE91: 87.59 | AF91: 89.37 | AG91: 0.5 | AH91: AA- | AI91: 6.2899999999999998e-002 | AJ91: =H91+100*O91 -> 130.73000000000002 | AK91: 127.5 | AL91: 86 | AM91: 38.1 | AN91: 136 | AO91: -8.1000000000000003e-002 | AP91: 25 | AQ91: 宏辉转债
A92: 288 | B92: 110056 | C92: 亨通转债! | D92: 600487 | E92: 亨通光电 | F92: 通信互联 | G92: 通信设备 | H92: 105.9 | I92: 3.9000000000000003e-003 | J92: 7.000000000000001e-004 | K92: 12.05 | L92: 1.77e-002 | M92: 114.3 | N92: 15.01 | O92: 0.31900000000000001 | P92: 80.28 | Q92: 转股中 | R92: 3.69年 | S92: 1.69年 | T92: 17.1 | U92: 4.7 | V92: 3.0000000000000001e-003 | W92: 5.9999999999999998e-002 | X92: 4.8000000000000001e-002 | Y92: 285 | Z92: 1.42 | AA92: 2.1299999999999999e-002 | AB92: 1.41e-002 | AC92: -1.6e-002 | AD92: -1.8799999999999997e-002 | AE92: 95.81 | AF92: 99.54 | AG92: 0.26 | AH92: AA+ | AI92: 3.8900000000000004e-002 | AJ92: =H92+100*O92 -> 137.80000000000001 | AK92: 131.5 | AL92: 138 | AM92: 32 | AN92: 72 | AO92: 4.7e-002 | AP92: 28 | AQ92: 亨通转债!
A93: 197 | B93: 113574 | C93: 华体转债! | D93: 603679 | E93: 华体科技 | F93: 城市公用 | G93: 城市公用 | H93: 105.17 | I93: -3.0000000000000001e-003 | J93: 1.2999999999999999e-003 | K93: 16.04 | L93: -3.78e-002 | M93: 115.9 | N93: 33.91 | O93: 1.22 | P93: 47.3 | Q93: 转股中 | R93: 4.72年 | S93: 2.73年 | T93: 2.09 | U93: 3.2 | V93: 1.4999999999999999e-002 | W93: 9.0999999999999998e-002 | X93: 4.2999999999999997e-002 | Y93: 23 | Z93: 2.95 | AA93: 2.1299999999999999e-002 | AB93: 1.5100000000000001e-002 | AC93: -3.7000000000000002e-003 | AD93: -6.4000000000000003e-003 | AE93: 84.86 | AF93: 83.43 | AG93: 0.04 | AH93: A+ | AI93: 7.3899999999999993e-002 | AJ93: =H93+100*O93 -> 227.17000000000002 | AK93: 163 | AL93: 314 | AM93: 78.2 | AN93: 321 | AO93: -8.900000000000001e-002 | AP93: 18 | AQ93: 华体转债!
A94: 112 | B94: 113604 | C94: 多伦转债! | D94: 603528 | E94: 多伦科技 | F94: 计算机及 | G94: 软件开发 | H94: 105.34 | I94: 1.47e-002 | J94: -1.e-002 | K94: 8.45 | L94: 9.5999999999999992e-003 | M94: 117.3 | N94: 10.4 | O94: 0.29600000000000004 | P94: 81.25 | Q94: 转股中 | R94: 5.26年 | S94: 3.26年 | T94: 6.4 | U94: 5.7 | V94: 9.0000000000000011e-003 | W94: 0.121 | X94: 9.8000000000000004e-002 | Y94: 53 | Z94: 3.18 | AA94: 2.1099999999999997e-002 | AB94: 1.5100000000000001e-002 | AC94: -4.3e-003 | AD94: -6.5000000000000006e-003 | AE94: 84.08 | AF94: 85.19 | AG94: 0.5 | AH94: AA- | AI94: 6.4100000000000004e-002 | AJ94: =H94+100*O94 -> 134.94 | AK94: 129.4 | AL94: 111 | AM94: 44.2 | AN94: 197 | AO94: -3.2000000000000001e-002 | AP94: 7 | AQ94: 多伦转债!
A95: 332 | B95: 127006 | C95: 敖东转债! | D95: 623 | E95: 吉林敖东 | F95: 金融 | G95: 证券行业 | H95: 101.65 | I95: 2.7000000000000001e-003 | J95: -2.0999999999999999e-003 | K95: 15.04 | L95: 4.0000000000000001e-003 | M95: 107.4 | N95: 20.22 | O95: 0.36700000000000005 | P95: 74.38 | Q95: 转股中 | R95: 2.67年 | S95: 0.68年 | T95: 24.1 | U95: 8 | V95: 3.0000000000000001e-003 | W95: 0.13800000000000001 | X95: 0.10199999999999999 | Y95: 175 | Z95: 0.76 | AA95: 2.1000000000000001e-002 | AB95: 1.5600000000000001e-002 | AC95: -6.8000000000000005e-003 | AD95: -9.300000000000001e-003 | AE95: 97.99 | AF95: 97.46 | AG95: 0.15 | AH95: AA+ | AI95: 3.7400000000000003e-002 | AJ95: =H95+100*O95 -> 138.35000000000002 | AK95: 128.9 | AL95: 103 | AM95: 30.9 | AN95: 57 | AO95: -2.2000000000000002e-002 | AP95: 27 | AQ95: 敖东转债!
A96: 231 | B96: 128087 | C96: 孚日转债! | D96: 2083 | E96: 孚日股份 | F96: 服装纺织 | G96: 家纺 | H96: 103.282 | I96: 3.7000000000000002e-003 | J96: 5.9999999999999995e-004 | K96: 4.34 | L96: 6.9999999999999993e-003 | M96: 112.9 | N96: 4.5 | O96: 7.0999999999999994e-002 | P96: 96.44 | Q96: 转股中 | R96: 4.44年 | S96: 2.44年 | T96: 6.5 | U96: 8.5 | V96: 1.3000000000000001e-002 | W96: 0.16500000000000001 | X96: 0.159 | Y96: 39 | Z96: 1.09 | AA96: 2.07e-002 | AB96: 1.52e-002 | AC96: 4.0000000000000002e-004 | AD96: -2.0999999999999999e-003 | AE96: 88.34 | AF96: 86.62 | AG96: 0.63 | AH96: AA- | AI96: 6.2899999999999998e-002 | AJ96: =H96+100*O96 -> 110.38199999999999 | AK96: 110.1 | AL96: 4 | AM96: 21.8 | AN96: 14 | AO96: 1.e-002 | AP96: 66 | AQ96: 孚日转债!
A97: 77 | B97: 123082 | C97: 北陆转债! | D97: 300016 | E97: 北陆药业 | F97: 医药 | G97: 化学制药 | H97: 109.461 | I97: 2.3999999999999998e-003 | J97: 3.0000000000000001e-003 | K97: 8.74 | L97: 8.1000000000000013e-003 | M97: 121.7 | N97: 8.81 | O97: 0.10300000000000001 | P97: 99.21 | Q97: 转股中 | R97: 5.41年 | S97: 3.41年 | T97: 5 | U97: 28 | V97: 5.0999999999999997e-002 | W97: 0.11599999999999999 | X97: 0.115 | Y97: 43 | Z97: 2.6 | AA97: 2.0299999999999999e-002 | AB97: 1.32e-002 | AC97: -1.2699999999999999e-002 | AD97: -1.5100000000000001e-002 | AE97: 81 | AF97: 83.05 | AG97: 0.67 | AH97: A+ | AI97: 7.51e-002 | AJ97: =H97+100*O97 -> 119.761 | AK97: 119.7 | AL97: 22 | AM97: 36.7 | AN97: 121 | AO97: -6.4000000000000001e-002 | AP97: 13 | AQ97: 北陆转债!
A98: 120 | B98: 123065 | C98: 宝莱转债! | D98: 300246 | E98: 宝莱特 | F98: 医药 | G98: 医疗器械 | H98: 109.75 | I98: 5.0000000000000001e-004 | J98: -1.5e-003 | K98: 19.34 | L98: -1.0700000000000001e-002 | M98: 121.4 | N98: 40.14 | O98: 1.28 | P98: 48.18 | Q98: 转股中 | R98: 5年56天 | S98: 3年57天 | T98: 2.19 | U98: 18 | V98: 7.4999999999999997e-002 | W98: 7.6999999999999999e-002 | X98: 3.7000000000000005e-002 | Y98: 28 | Z98: 3.18 | AA98: 2.0199999999999999e-002 | AB98: 1.29e-002 | AC98: -1.5300000000000001e-002 | AD98: -1.78e-002 | AE98: 85.08 | AF98: 88.81 | AG98: 0.1 | AH98: AA- | AI98: 6.4100000000000004e-002 | AJ98: =H98+100*O98 -> 237.75 | AK98: 171.3 | AL98: 324 | AM98: 82.5 | AN98: 325 | AO98: 5.0000000000000001e-003 | AP98: 18 | AQ98: 宝莱转债!
A99: 132 | B99: 127021 | C99: 特发转2! | D99: 70 | E99: 特发信息 | F99: 通信互联 | G99: 通信设备 | H99: 104.6 | I99: -4.5999999999999999e-003 | J99: 2.3999999999999998e-003 | K99: 7.97 | L99: -1.6e-002 | M99: 113.3 | N99: 12.33 | O99: 0.61799999999999999 | P99: 64.64 | Q99: 转股中 | R99: 4年28天 | S99: 2年29天 | T99: 5.5 | U99: 3.2 | V99: 6.0000000000000001e-003 | W99: 8.3000000000000004e-002 | X99: 5.4000000000000006e-002 | Y99: 66 | Z99: 2.24 | AA99: 2.0099999999999996e-002 | AB99: 1.3999999999999999e-002 | AC99: -1.1000000000000001e-002 | AD99: -1.2800000000000001e-002 | AE99: 93.12 | AF99: 96.06 | AG99: 0.14 | AH99: AA | AI99: 4.1900000000000007e-002 | AJ99: =H99+100*O99 -> 166.39999999999998 | AK99: 144.6 | AL99: 258 | AM99: 48.5 | AN99: 231 | AO99: -6.9999999999999993e-003 | AP99: 12 | AQ99: 特发转2!
A100: 67 | B100: 113044 | C100: 大秦转债! | D100: 601006 | E100: 大秦铁路 | F100: 铁路 | G100: 铁路运输 | H100: 102.99 | I100: -1.1999999999999999e-003 | J100: -2.2000000000000001e-003 | K100: 6.04 | L100: -8.199999999999999e-003 | M100: 114.1 | N100: 7.18 | O100: 0.22399999999999998 | P100: 84.12 | Q100: 转股中 | R100: 5.43年 | S100: 3.43年 | T100: 320 | U100: 80 | V100: 2.e-003 | W100: 0.35600000000000004 | X100: 0.29999999999999999 | Y100: 898 | Z100: 0.74 | AA100: 1.9400000000000001e-002 | AB100: 1.46e-002 | AC100: 2.5999999999999999e-003 | AD100: 4.0000000000000002e-004 | AE100: 90.95 | AF100: 93.51 | AG100: 0.41 | AH100: AAA | AI100: 3.8100000000000002e-002 | AJ100: =H100+100*O100 -> 125.38999999999999 | AK100: 121.9 | AL100: 35 | AM100: 28.3 | AN100: 40 | AO100: -7.5999999999999998e-002 | AP100: 15 | AQ100: 大秦转债!
A101: 251 | B101: 128076 | C101: 金轮转债! | D101: 2722 | E101: 金轮股份 | F101: 机械装备 | G101: 专用设备 | H101: 106.1 | I101: -1.4000000000000002e-003 | J101: 3.3e-003 | K101: 12.33 | L101: 4.0999999999999995e-003 | M101: 114.9 | N101: 14.66 | O101: 0.26100000000000001 | P101: 84.11 | Q101: 转股中 | R101: 4.26年 | S101: 2.27年 | T101: 2.14 | U101: 2.4 | V101: 1.1000000000000001e-002 | W101: 9.9000000000000005e-002 | X101: 8.3000000000000004e-002 | Y101: 22 | Z101: 1.14 | AA101: 1.9299999999999998e-002 | AB101: 1.2800000000000001e-002 | AC101: -1.0700000000000001e-002 | AD101: -1.3300000000000001e-002 | AE101: 89.29 | AF101: 89.09 | AG101: 0.47 | AH101: AA- | AI101: 6.2899999999999998e-002 | AJ101: =H101+100*O101 -> 132.19999999999999 | AK101: 128.1 | AL101: 96 | AM101: 38.8 | AN101: 139 | AO101: -1.3000000000000001e-002 | AP101: 40 | AQ101: 金轮转债!
A102: 277 | B102: 113024 | C102: 核建转债! | D102: 601611 | E102: 中国核建 | F102: 建筑 | G102: 建筑工程 | H102: 101.93 | I102: 8.0000000000000004e-004 | J102: 0. | K102: 7 | L102: 4.3e-003 | M102: 109.3 | N102: 9.76 | O102: 0.42100000000000004 | P102: 71.72 | Q102: 转股中 | R102: 3.75年 | S102: 1.75年 | T102: 30 | U102: 5.2 | V102: 2.e-003 | W102: 0.16200000000000001 | X102: 0.11599999999999999 | Y102: 185 | Z102: 1.57 | AA102: 1.9199999999999998e-002 | AB102: 1.44e-002 | AC102: 4.5000000000000005e-003 | AD102: 1.6000000000000001e-003 | AE102: 95.96 | AF102: 95.68 | AG102: 0.19 | AH102: AAA | AI102: 3.6900000000000002e-002 | AJ102: =H102+100*O102 -> 144.03 | AK102: 132.1 | AL102: 148 | AM102: 36.2 | AN102: 114 | AO102: -2.6000000000000002e-002 | AP102: 36 | AQ102: 核建转债!
A103: 51 | B103: 113619 | C103: 世运转债! | D103: 603920 | E103: 世运电路 | F103: 电子 | G103: 元器件制 | H103: 103.94 | I103: -8.0000000000000004e-004 | J103: 2.3e-003 | K103: 13.52 | L103: 6.0000000000000001e-003 | M103: 115.2 | N103: 19.92 | O103: 0.53100000000000003 | P103: 67.87 | Q103: 17天 | R103: 5.53年 | S103: 3.53年 | T103: 10 | U103: 25 | V103: 2.4e-002 | W103: 0.13900000000000001 | X103: 9.4e-002 | Y103: 72 | Z103: 2.03 | AA103: 1.9099999999999999e-002 | AB103: 1.41e-002 | AC103: -5.9999999999999995e-004 | AD103: -2.5999999999999999e-003 | AE103: 88.84 | AF103: 91.62 | AG103: 0.25 | AH103: AA | AI103: 4.3099999999999999e-002 | AJ103: =H103+100*O103 -> 157.03999999999999 | AK103: 140 | AL103: 229 | AM103: 48.4 | AN103: 230 | AO103: -3.5000000000000003e-002 | AP103: 5 | AQ103: 世运转债!
A104: 11 | B104: 127034 | C104: 绿茵转债 | D104: 2887 | E104: 绿茵生态 | F104: 城市公用 | G104: 生态环境 | H104: 106.88 | I104: 2.5000000000000001e-003 | J104: 1.9e-002 | K104: 12.16 | L104: 3.3099999999999997e-002 | M104: 119 | N104: 12.38 | O104: 8.8000000000000009e-002 | P104: 98.22 | Q104: 4月5天 | R104: 5.81年 | S104: 3.81年 | T104: 7.12 | U104: 213 | V104: 0.28199999999999997 | W104: 0.188 | X104: 0.184 | Y104: 38 | Z104: 1.77 | AA104: 1.9e-002 | AB104: 1.32e-002 | AC104: -7.0999999999999995e-003 | AD104: -9.0000000000000011e-003 | AE104: 81.38 | AF104: 83.56 | AG104: 0.65 | AH104: AA- | AI104: 6.4100000000000004e-002 | AJ104: =H104+100*O104 -> 115.67999999999999 | AK104: 115.5 | AL104: 10 | AM104: 32 | AN104: 71 | AO104: 0.128 | AP104: 16 | AQ104: 绿茵转债
A105: 350 | B105: 128022 | C105: 众信转债! | D105: 2707 | E105: 众信旅游 | F105: 旅游餐饮 | G105: 旅游 | H105: 104.1 | I105: 1.9e-003 | J105: -1.8e-003 | K105: 5.27 | L105: 5.6999999999999993e-003 | M105: 108.8 | N105: 7.92 | O105: 0.56399999999999995 | P105: 66.54 | Q105: 转股中 | R105: 2.40年 | S105: 0.40年 | T105: 4.56 | U105: 11 | V105: 2.2000000000000002e-002 | W105: 9.5000000000000001e-002 | X105: 6.3e-002 | Y105: 48 | Z105: 7.15 | AA105: 1.89e-002 | AB105: 1.18e-002 | AC105: -4.3200000000000002e-002 | AD105: -4.8300000000000003e-002 | AE105: 97.13 | AF105: 90.28 | AG105: 0.01 | AH105: A | AI105: 8.2400000000000001e-002 | AJ105: =H105+100*O105 -> 160.5 | AK105: 141.7 | AL105: 240 | AM105: 44.5 | AN105: 203 | AO105: -8.6999999999999994e-002 | AP105: 31 | AQ105: 众信转债!
A106: 259 | B106: 128071 | C106: 合兴转债! | D106: 2228 | E106: 合兴包装 | F106: 造纸包装 | G106: 包装材料 | H106: 106.595 | I106: -1.e-004 | J106: 1.e-004 | K106: 3.58 | L106: 0. | M106: 114.8 | N106: 4.18 | O106: 0.245 | P106: 85.65 | Q106: 转股中 | R106: 4年37天 | S106: 2年38天 | T106: 3 | U106: 2.5 | V106: 8.0000000000000002e-003 | W106: 6.8000000000000005e-002 | X106: 5.7999999999999996e-002 | Y106: 44 | Z106: 1.28 | AA106: 1.8600000000000002e-002 | AB106: 1.2e-002 | AC106: -1.3899999999999999e-002 | AD106: -1.67e-002 | AE106: 94.2 | AF106: 97.36 | AG106: 0.38 | AH106: AA | AI106: 4.1900000000000007e-002 | AJ106: =H106+100*O106 -> 131.095 | AK106: 127.5 | AL106: 87 | AM106: 30.2 | AN106: 47 | AO106: -4.2999999999999997e-002 | AP106: 24 | AQ106: 合兴转债!
A107: 90 | B107: 113608 | C107: 威派转债! | D107: 603956 | E107: 威派格 | F107: 机械装备 | G107: 专用设备 | H107: 110.53 | I107: 2.9999999999999997e-004 | J107: 2.46e-002 | K107: 18.28 | L107: 3.7999999999999999e-002 | M107: 121.6 | N107: 19.08 | O107: 0.154 | P107: 95.81 | Q107: 转股中 | R107: 5.33年 | S107: 3.34年 | T107: 4.2 | U107: 11 | V107: 2.3e-002 | W107: 5.4000000000000006e-002 | X107: 5.2000000000000005e-002 | Y107: 78 | Z107: 6.73 | AA107: 1.8500000000000003e-002 | AB107: 1.1399999999999999e-002 | AC107: -1.5800000000000002e-002 | AD107: -1.83e-002 | AE107: 81.44 | AF107: 83.44 | AG107: 0.65 | AH107: A+ | AI107: 7.51e-002 | AJ107: =H107+100*O107 -> 125.93000000000001 | AK107: 125.3 | AL107: 65 | AM107: 41.8 | AN107: 170 | AO107: 2.4e-002 | AP107: 7 | AQ107: 威派转债!
A108: 137 | B108: 123063 | C108: 大禹转债 | D108: 300021 | E108: 大禹节水 | F108: 化工 | G108: 橡胶塑料 | H108: 115.774 | I108: 6.5000000000000006e-003 | J108: -1.01e-002 | K108: 5.16 | L108: -5.7999999999999996e-003 | M108: 126.5 | N108: 4.83 | O108: 8.4000000000000005e-002 | P108: 106.83 | Q108: 转股中 | R108: 5年18天 | S108: 4年19天 | T108: 6.35 | U108: 15 | V108: 2.e-002 | W108: 0.154 | X108: 0.16399999999999998 | Y108: 41 | Z108: 2.71 | AA108: 1.8100000000000002e-002 | AB108: 9.300000000000001e-003 | AC108: -1.8799999999999997e-002 | AD108: -2.1899999999999999e-002 | AE108: 82.77 | AF108: 93.12 | AG108: 0.63 | AH108: AA- | AI108: 6.4100000000000004e-002 | AJ108: =H108+100*O108 -> 124.17400000000001 | AK108: 124.7 | AL108: 58 | AM108: 31.6 | AN108: 65 | AO108: 6.0000000000000001e-003 | AP108: 18 | AQ108: 大禹转债
A109: 256 | B109: 128073 | C109: 哈尔转债! | D109: 2615 | E109: 哈尔斯 | F109: 其他 | G109: 家居用品 | H109: 109.35 | I109: 2.2000000000000001e-003 | J109: -7.000000000000001e-004 | K109: 4.86 | L109: 4.0999999999999995e-003 | M109: 115.3 | N109: 5.7 | O109: 0.28199999999999997 | P109: 85.26 | Q109: 转股中 | R109: 3年43天 | S109: 1年44天 | T109: 2.99 | U109: 3.9 | V109: 1.2e-002 | W109: 0.14899999999999999 | X109: 0.127 | Y109: 20 | Z109: 2.56 | AA109: 1.7399999999999999e-002 | AB109: 8.5000000000000006e-003 | AC109: -5.2699999999999997e-002 | AD109: -5.5599999999999997e-002 | AE109: 94.41 | AF109: 95.63 | AG109: 0.38 | AH109: AA- | AI109: 6.2899999999999998e-002 | AJ109: =H109+100*O109 -> 137.54999999999998 | AK109: 133.4 | AL109: 164 | AM109: 37.8 | AN109: 134 | AO109: 3.1e-002 | AP109: 39 | AQ109: 哈尔转债!
A110: 70 | B110: 123084 | C110: 高澜转债! | D110: 300499 | E110: 高澜股份 | F110: 能源电力 | G110: 电力设备 | H110: 111.31 | I110: 1.9e-003 | J110: -1.1000000000000001e-003 | K110: 8.88 | L110: 1.1000000000000001e-003 | M110: 121.9 | N110: 9 | O110: 0.128 | P110: 98.67 | Q110: 转股中 | R110: 5.42年 | S110: 3.42年 | T110: 2.8 | U110: 3.9 | V110: 1.2e-002 | W110: 0.113 | X110: 0.11199999999999999 | Y110: 25 | Z110: 2.95 | AA110: 1.7299999999999999e-002 | AB110: 1.03e-002 | AC110: -1.6799999999999999e-002 | AD110: -1.9299999999999998e-002 | AE110: 81.11 | AF110: 83.16 | AG110: 0.67 | AH110: A+ | AI110: 7.51e-002 | AJ110: =H110+100*O110 -> 124.11 | AK110: 124 | AL110: 55 | AM110: 40.8 | AN110: 157 | AO110: 5.2000000000000005e-002 | AP110: 13 | AQ110: 高澜转债!
A111: 69 | B111: 123086 | C111: 海兰转债! | D111: 300065 | E111: 海兰信 | F111: 电子 | G111: 电子产品 | H111: 112.8 | I111: 9.8999999999999991e-003 | J111: -9.8999999999999991e-003 | K111: 11.24 | L111: 0. | M111: 123.5 | N111: 10.9 | O111: 9.4e-002 | P111: 103.12 | Q111: 转股中 | R111: 5.42年 | S111: 3.42年 | T111: 7.29 | U111: 16 | V111: 1.9e-002 | W111: 0.16300000000000001 | X111: 0.16800000000000001 | Y111: 45 | Z111: 3.01 | AA111: 1.72e-002 | AB111: 9.7999999999999997e-003 | AC111: -2.3e-002 | AD111: -2.5000000000000001e-002 | AE111: 83.27 | AF111: 88.77 | AG111: 0.64 | AH111: AA- | AI111: 6.4100000000000004e-002 | AJ111: =H111+100*O111 -> 122.2 | AK111: 122.5 | AL111: 39 | AM111: 33.7 | AN111: 85 | AO111: 5.0000000000000001e-003 | AP111: 18 | AQ111: 海兰转债!
A112: 212 | B112: 113567 | C112: 君禾转债! | D112: 603617 | E112: 君禾股份 | F112: 机械装备 | G112: 通用设备 | H112: 109.99 | I112: 1.0500000000000001e-002 | J112: -1.2199999999999999e-002 | K112: 10.4 | L112: -2.8999999999999998e-003 | M112: 118.8 | N112: 11.16 | O112: 0.17999999999999999 | P112: 93.19 | Q112: 转股中 | R112: 4.65年 | S112: 2.65年 | T112: 2.1 | U112: 4 | V112: 1.7000000000000001e-002 | W112: 0.10099999999999999 | X112: 9.4e-002 | Y112: 21 | Z112: 2.93 | AA112: 1.7100000000000001e-002 | AB112: 9.8999999999999991e-003 | AC112: -2.e-002 | AD112: -2.2599999999999999e-002 | AE112: 85.24 | AF112: 85.95 | AG112: 0.6 | AH112: A+ | AI112: 7.3899999999999993e-002 | AJ112: =H112+100*O112 -> 127.98999999999999 | AK112: 126.8 | AL112: 77 | AM112: 40.8 | AN112: 158 | AO112: 3.7999999999999999e-002 | AP112: 33 | AQ112: 君禾转债!
A113: 34 | B113: 123105 | C113: 拓尔转债! | D113: 300229 | E113: 拓尔思 | F113: 计算机及 | G113: 软件开发 | H113: 110.151 | I113: -6.0999999999999995e-003 | J113: -4.5999999999999999e-003 | K113: 8.74 | L113: -1.9099999999999999e-002 | M113: 121 | N113: 9.93 | O113: 0.251 | P113: 88.02 | Q113: 2月18天 | R113: 5.69年 | S113: 3.69年 | T113: 8 | U113: 8.8 | V113: 1.e-002 | W113: 0.128 | X113: 0.11199999999999999 | Y113: 63 | Z113: 2.87 | AA113: 1.7000000000000001e-002 | AB113: 1.0500000000000001e-002 | AC113: -1.5100000000000001e-002 | AD113: -1.7000000000000001e-002 | AE113: 81.96 | AF113: 85.57 | AG113: 0.56 | AH113: AA- | AI113: 6.4100000000000004e-002 | AJ113: =H113+100*O113 -> 135.251 | AK113: 132.3 | AL113: 150 | AM113: 46.7 | AN113: 220 | AO113: -3.5000000000000003e-002 | AP113: 6 | AQ113: 拓尔转债!
A114: 15 | B114: 127033 | C114: 中装转2 | D114: 2822 | E114: 中装建设 | F114: 建筑 | G114: 装饰工程 | H114: 106.5 | I114: 8.9999999999999998e-004 | J114: -8.9999999999999998e-004 | K114: 5.85 | L114: 0. | M114: 117.1 | N114: 6.28 | O114: 0.14300000000000002 | P114: 93.15 | Q114: 3月15天 | R114: 5.77年 | S114: 3.77年 | T114: 11.6 | U114: 15 | V114: 1.2e-002 | W114: 0.27500000000000002 | X114: 0.25600000000000001 | Y114: 42 | Z114: 1.25 | AA114: 1.6899999999999998e-002 | AB114: 1.15e-002 | AC114: -6.9999999999999993e-003 | AD114: -8.8000000000000005e-003 | AE114: 87.87 | AF114: 92.19 | AG114: 0.53 | AH114: AA | AI114: 4.3099999999999999e-002 | AJ114: =H114+100*O114 -> 120.8 | AK114: 119.8 | AL114: 25 | AM114: 27.7 | AN114: 36 | AO114: 1.2e-002 | AP114: 24 | AQ114: 中装转2
A115: 65 | B115: 123087 | C115: 明电转债! | D115: 300739 | E115: 明阳电路 | F115: 电子 | G115: 元器件制 | H115: 111 | I115: 4.3e-003 | J115: -4.3e-003 | K115: 16.7 | L115: 0. | M115: 121.2 | N115: 16.32 | O115: 8.5000000000000006e-002 | P115: 102.33 | Q115: 转股中 | R115: 5.43年 | S115: 4.44年 | T115: 6.73 | U115: 32 | V115: 4.2999999999999997e-002 | W115: 0.14400000000000002 | X115: 0.14800000000000002 | Y115: 47 | Z115: 3.3 | AA115: 1.67e-002 | AB115: 9.7999999999999997e-003 | AC115: -8.6999999999999994e-003 | AD115: -1.1399999999999999e-002 | AE115: 80.59 | AF115: 87.13 | AG115: 0.65 | AH115: AA- | AI115: 6.4100000000000004e-002 | AJ115: =H115+100*O115 -> 119.5 | AK115: 119.7 | AL115: 21 | AM115: 32.5 | AN115: 76 | AO115: 5.2999999999999999e-002 | AP115: 18 | AQ115: 明电转债!
A116: 208 | B116: 113570 | C116: 百达转债! | D116: 603331 | E116: 百达精工 | F116: 机械装备 | G116: 机械装备 | H116: 106.55 | I116: 2.2000000000000001e-003 | J116: -9.1999999999999998e-003 | K116: 10.14 | L116: -1.1699999999999999e-002 | M116: 114.9 | N116: 11.34 | O116: 0.192 | P116: 89.42 | Q116: 转股中 | R116: 4.67年 | S116: 2.67年 | T116: 2.8 | U116: 1.2 | V116: 4.0000000000000001e-003 | W116: 0.155 | X116: 0.13900000000000001 | Y116: 18 | Z116: 2.15 | AA116: 1.66e-002 | AB116: 1.0800000000000001e-002 | AC116: -1.06e-002 | AD116: -1.29e-002 | AE116: 84.61 | AF116: 82.93 | AG116: 0.6 | AH116: A+ | AI116: 7.3899999999999993e-002 | AJ116: =H116+100*O116 -> 125.75 | AK116: 123.7 | AL116: 51 | AM116: 39.1 | AN116: 141 | AO116: 4.0000000000000001e-003 | AP116: 32 | AQ116: 百达转债!
A117: 119 | B117: 128131 | C117: 崇达转2! | D117: 2815 | E117: 崇达技术 | F117: 电子 | G117: 元器件制 | H117: 106.38 | I117: 1.8600000000000002e-002 | J117: -1.09e-002 | K117: 13.21 | L117: 3.3599999999999998e-002 | M117: 115.2 | N117: 19.38 | O117: 0.56100000000000005 | P117: 68.16 | Q117: 转股中 | R117: 5年59天 | S117: 3.16年 | T117: 14 | U117: 13 | V117: 9.0000000000000011e-003 | W117: 0.121 | X117: 8.199999999999999e-002 | Y117: 116 | Z117: 2.76 | AA117: 1.5900000000000001e-002 | AB117: 1.0500000000000001e-002 | AC117: -7.7000000000000002e-003 | AD117: -9.7999999999999997e-003 | AE117: 90.24 | AF117: 93.07 | AG117: 0.23 | AH117: AA | AI117: 4.3099999999999999e-002 | AJ117: =H117+100*O117 -> 162.48000000000002 | AK117: 144.6 | AL117: 259 | AM117: 51.5 | AN117: 250 | AO117: 7.2999999999999995e-002 | AP117: 10 | AQ117: 崇达转2!
A118: 81 | B118: 113610 | C118: 灵康转债 | D118: 603669 | E118: 灵康药业 | F118: 医药 | G118: 化学制药 | H118: 111.58 | I118: 1.43e-002 | J118: 1.04e-002 | K118: 9.03 | L118: 3.6699999999999997e-002 | M118: 121.1 | N118: 8.61 | O118: 6.4000000000000001e-002 | P118: 104.88 | Q118: 转股中 | R118: 5.39年 | S118: 3.40年 | T118: 5.25 | U118: 35 | V118: 5.9000000000000004e-002 | W118: 8.1000000000000003e-002 | X118: 8.5000000000000006e-002 | Y118: 64 | Z118: 4.58 | AA118: 1.5600000000000001e-002 | AB118: 8.8000000000000005e-003 | AC118: -1.9699999999999999e-002 | AD118: -2.18e-002 | AE118: 83.57 | AF118: 87.25 | AG118: 0.67 | AH118: AA- | AI118: 6.4100000000000004e-002 | AJ118: =H118+100*O118 -> 117.98 | AK118: 118.3 | AL118: 15 | AM118: 31 | AN118: 58 | AO118: 8.1000000000000003e-002 | AP118: 27 | AQ118: 灵康转债
A119: 224 | B119: 113561 | C119: 正裕转债! | D119: 603089 | E119: 正裕工业 | F119: 汽车 | G119: 零部件制 | H119: 110.34 | I119: 3.5999999999999999e-003 | J119: 2.0199999999999999e-002 | K119: 9.24 | L119: 4.0500000000000001e-002 | M119: 118 | N119: 10.08 | O119: 0.20399999999999999 | P119: 91.67 | Q119: 转股中 | R119: 4.48年 | S119: 2.48年 | T119: 1.5 | U119: 14 | V119: 8.5000000000000006e-002 | W119: 7.2999999999999995e-002 | X119: 6.7000000000000004e-002 | Y119: 21 | Z119: 1.93 | AA119: 1.55e-002 | AB119: 8.3000000000000001e-003 | AC119: -2.18e-002 | AD119: -2.4700000000000003e-002 | AE119: 86.47 | AF119: 86.46 | AG119: 0.59 | AH119: A+ | AI119: 7.3899999999999993e-002 | AJ119: =H119+100*O119 -> 130.74000000000001 | AK119: 129 | AL119: 107 | AM119: 42.5 | AN119: 181 | AO119: 5.4000000000000006e-002 | AP119: 35 | AQ119: 正裕转债!
A120: 54 | B120: 128143 | C120: 锋龙转债! | D120: 2931 | E120: 锋龙股份 | F120: 机械装备 | G120: 专用设备 | H120: 112.1 | I120: 5.5000000000000005e-003 | J120: -7.6e-003 | K120: 12.58 | L120: -3.2000000000000002e-003 | M120: 121.7 | N120: 12.73 | O120: 0.13400000000000001 | P120: 98.82 | Q120: 5.1天 | R120: 5.50年 | S120: 3.50年 | T120: 2.45 | U120: 4.8 | V120: 1.8000000000000002e-002 | W120: 9.8000000000000004e-002 | X120: 9.6999999999999989e-002 | Y120: 25 | Z120: 2.85 | AA120: 1.54e-002 | AB120: 8.5000000000000006e-003 | AC120: -1.89e-002 | AD120: -2.12e-002 | AE120: 80.49 | AF120: 82.52 | AG120: 0.67 | AH120: A+ | AI120: 7.51e-002 | AJ120: =H120+100*O120 -> 125.5 | AK120: 125.4 | AL120: 67 | AM120: 42.9 | AN120: 183 | AO120: -9.5000000000000001e-002 | AP120: 12 | AQ120: 锋龙转债!
A121: 8 | B121: 127035 | C121: 濮耐转债 | D121: 2225 | E121: 濮耐股份 | F121: 钢铁 | G121: 钢铁行业 | H121: 106.65 | I121: -1.1999999999999999e-003 | J121: 1.1999999999999999e-003 | K121: 4.18 | L121: 0. | M121: 114.7 | N121: 4.43 | O121: 0.13 | P121: 94.36 | Q121: 4月25天 | R121: 4.88年 | S121: 2.88年 | T121: 6.26 | U121: 8.6 | V121: 1.3000000000000001e-002 | W121: 0.14800000000000002 | X121: 0.14000000000000001 | Y121: 42 | Z121: 1.39 | AA121: 1.5300000000000001e-002 | AB121: 9.7999999999999997e-003 | AC121: -1.0200000000000001e-002 | AD121: -1.23e-002 | AE121: 91.34 | AF121: 94.26 | AG121: 0.52 | AH121: AA | AI121: 4.1900000000000007e-002 | AJ121: =H121+100*O121 -> 119.65000000000001 | AK121: 118.9 | AL121: 19 | AM121: 24.7 | AN121: 20 | AO121: -1.9e-002 | AP121: 8 | AQ121: 濮耐转债
A122: 167 | B122: 128114 | C122: 正邦转债! | D122: 2157 | E122: 正邦科技 | F122: 农业 | G122: 畜牧业 | H122: 106.81 | I122: 2.e-003 | J122: -8.9999999999999998e-004 | K122: 11.4 | L122: 3.4999999999999996e-003 | M122: 114.9 | N122: 14.76 | O122: 0.38299999999999995 | P122: 77.24 | Q122: 转股中 | R122: 4.94年 | S122: 2.94年 | T122: 16 | U122: 27 | V122: 1.6e-002 | W122: 4.4000000000000004e-002 | X122: 3.4000000000000002e-002 | Y122: 359 | Z122: 1.53 | AA122: 1.52e-002 | AB122: 9.7000000000000003e-003 | AC122: -1.0500000000000001e-002 | AD122: -1.26e-002 | AE122: 91.93 | AF122: 95.5 | AG122: 0.31 | AH122: AA+ | AI122: 3.8900000000000004e-002 | AJ122: =H122+100*O122 -> 145.11000000000001 | AK122: 136.4 | AL122: 191 | AM122: 40.9 | AN122: 161 | AO122: -1.4999999999999999e-002 | AP122: 17 | AQ122: 正邦转债!
A123: 315 | B123: 113516 | C123: 苏农转债! | D123: 603323 | E123: 苏农银行 | F123: 金融 | G123: 银行行业 | H123: 109.36 | I123: -2.6200000000000001e-002 | J123: 2.75e-002 | K123: 4.63 | L123: 4.3e-003 | M123: 114.3 | N123: 5.37 | O123: 0.26800000000000002 | P123: 86.22 | Q123: 转股中 | R123: 3年23天 | S123: 无权 | T123: 12.9 | U123: 27 | V123: 1.9e-002 | W123: 0.154 | X123: 0.13300000000000001 | Y123: 83 | Z123: 0.68 | AA123: 1.49e-002 | AB123: 6.3e-003 | AC123: 无权 | AD123: 无权 | AE123: 无权 | AF123: 101.96 | AG123: 0.31 | AH123: AA+ | AI123: 3.8900000000000004e-002 | AJ123: =H123+100*O123 -> 136.16 | AK123: 132.5 | AL123: 155 | AM123: 30.5 | AN123: 52 | AO123: 5.0999999999999997e-002 | AP123: 28 | AQ123: 苏农转债!
A124: 16 | B124: 110080 | C124: 东湖转债 | D124: 600133 | E124: 东湖高新 | F124: 建筑 | G124: 建筑工程 | H124: 105.84 | I124: -5.0000000000000001e-004 | J124: -5.0000000000000001e-004 | K124: 5.75 | L124: -1.7000000000000001e-003 | M124: 115.1 | N124: 6.05 | O124: 0.114 | P124: 95.04 | Q124: 3月9天 | R124: 5.76年 | S124: 3.76年 | T124: 15.5 | U124: 12 | V124: 6.9999999999999993e-003 | W124: 0.33899999999999997 | X124: 0.32200000000000001 | Y124: 46 | Z124: 0.84 | AA124: 1.49e-002 | AB124: 1.01e-002 | AC124: -5.5000000000000005e-003 | AD124: -7.1999999999999998e-003 | AE124: 87.91 | AF124: 90.67 | AG124: 0.56 | AH124: AA | AI124: 4.3099999999999999e-002 | AJ124: =H124+100*O124 -> 117.24000000000001 | AK124: 116.6 | AL124: 11 | AM124: 26 | AN124: 26 | AO124: -3.1e-002 | AP124: 21 | AQ124: 东湖转债
A125: 10 | B125: 111000 | C125: 起帆转债 | D125: 605222 | E125: 起帆电缆 | F125: 能源电力 | G125: 电力设备 | H125: 110.63 | I125: 5.6000000000000008e-003 | J125: -2.3999999999999998e-003 | K125: 20.51 | L125: 4.8999999999999998e-003 | M125: 120.5 | N125: 20.53 | O125: 0.107 | P125: 99.9 | Q125: 4月23天 | R125: 5.87年 | S125: 3.87年 | T125: 10 | U125: 21 | V125: 1.9e-002 | W125: 0.122 | X125: 0.122 | Y125: 82 | Z125: 2.81 | AA125: 1.49e-002 | AB125: 8.8000000000000005e-003 | AC125: -1.5700000000000002e-002 | AD125: -1.7500000000000002e-002 | AE125: 80.98 | AF125: 84.24 | AG125: 0.66 | AH125: AA- | AI125: 6.4100000000000004e-002 | AJ125: =H125+100*O125 -> 121.33 | AK125: 121.4 | AL125: 32 | AM125: 37.1 | AN125: 127 | AO125: 2.4e-002 | AP125: 7 | AQ125: 起帆转债
A126: 351 | B126: 128021 | C126: 兄弟转债!! | D126: 2562 | E126: 兄弟科技 | F126: 医药 | G126: 原料药 | H126: 105.186 | I126: -8.9999999999999998e-004 | J126: 8.9999999999999998e-004 | K126: 3.95 | L126: 0. | M126: 108.8 | N126: 5.19 | O126: 0.38200000000000001 | P126: 76.11 | Q126: 转股中 | R126: 2.39年 | S126: 0.39年 | T126: 2.65 | U126: 9.9 | V126: 3.6000000000000004e-002 | W126: 6.3e-002 | X126: 4.8000000000000001e-002 | Y126: 42 | Z126: 1.42 | AA126: 1.4499999999999999e-002 | AB126: 7.4000000000000003e-003 | AC126: -6.1600000000000002e-002 | AD126: -6.6699999999999995e-002 | AE126: 99.35 | AF126: 99.13 | AG126: 0.08 | AH126: AA | AI126: 4.0399999999999998e-002 | AJ126: =H126+100*O126 -> 143.38600000000002 | AK126: 134.3 | AL126: 171 | AM126: 34.9 | AN126: 101 | AO126: -7.9000000000000001e-002 | AP126: 15 | AQ126: 兄弟转债!!
A127: 52 | B127: 123093 | C127: 金陵转债 | D127: 300651 | E127: 金陵体育 | F127: 其他 | G127: 文化教育 | H127: 119.888 | I127: -2.9999999999999997e-004 | J127: 8.3999999999999995e-003 | K127: 41.22 | L127: 1.5300000000000001e-002 | M127: 129.3 | N127: 49.19 | O127: 0.43099999999999999 | P127: 83.8 | Q127: 17天 | R127: 5.53年 | S127: 3.53年 | T127: 2.5 | U127: 32 | V127: 0.106 | W127: 4.7e-002 | X127: 3.9e-002 | Y127: 53 | Z127: 7.69 | AA127: 1.4199999999999999e-002 | AB127: 5.4000000000000003e-003 | AC127: -3.2199999999999999e-002 | AD127: -3.5299999999999998e-002 | AE127: 81.71 | AF127: 87.68 | AG127: 0.53 | AH127: A+ | AI127: 7.51e-002 | AJ127: =H127+100*O127 -> 162.988 | AK127: 156 | AL127: 298 | AM127: 68.3 | AN127: 304 | AO127: -2.1000000000000001e-002 | AP127: 6 | AQ127: 金陵转债
A128: 32 | B128: 113046 | C128: 金田转债 | D128: 601609 | E128: 金田铜业 | F128: 有色金属 | G128: 铜金属 | H128: 106.18 | I128: 2.2599999999999999e-002 | J128: -9.5999999999999992e-003 | K128: 9.22 | L128: 2.8999999999999998e-002 | M128: 114.9 | N128: 10.75 | O128: 0.23800000000000002 | P128: 85.77 | Q128: 2月20天 | R128: 5.70年 | S128: 3.70年 | T128: 15 | U128: 88 | V128: 5.5999999999999994e-002 | W128: 0.11 | X128: 9.4e-002 | Y128: 136 | Z128: 1.97 | AA128: 1.4199999999999999e-002 | AB128: 9.3999999999999986e-003 | AC128: -6.8999999999999999e-003 | AD128: -8.6e-003 | AE128: 88.92 | AF128: 92.18 | AG128: 0.45 | AH128: AA+ | AI128: 4.0099999999999997e-002 | AJ128: =H128+100*O128 -> 129.98000000000002 | AK128: 126.6 | AL128: 74 | AM128: 34.4 | AN128: 93 | AO128: 4.7e-002 | AP128: 11 | AQ128: 金田转债
A129: 261 | B129: 113542 | C129: 好客转债 | D129: 603898 | E129: 好莱客 | F129: 其他 | G129: 家居用品 | H129: 108.72 | I129: -3.4000000000000002e-003 | J129: -1.e-003 | K129: 13.53 | L129: -1.24e-002 | M129: 114.9 | N129: 16.14 | O129: 0.29699999999999999 | P129: 83.83 | Q129: 转股中 | R129: 4年22天 | S129: 2年23天 | T129: 6.03 | U129: 15 | V129: 2.4e-002 | W129: 0.14300000000000002 | X129: 0.12 | Y129: 42 | Z129: 1.64 | AA129: 1.3999999999999999e-002 | AB129: 7.3000000000000001e-003 | AC129: -2.2499999999999999e-002 | AD129: -2.5399999999999999e-002 | AE129: 94.46 | AF129: 97.62 | AG129: 0.35 | AH129: AA | AI129: 4.1900000000000007e-002 | AJ129: =H129+100*O129 -> 138.41999999999999 | AK129: 133.6 | AL129: 165 | AM129: 36 | AN129: 110 | AO129: -4.0999999999999995e-002 | AP129: 17 | AQ129: 好客转债
A130: 219 | B130: 113563 | C130: 柳药转债! | D130: 603368 | E130: 柳药股份 | F130: 医药 | G130: 医药商业 | H130: 106.31 | I130: 2.5000000000000001e-003 | J130: -1.e-004 | K130: 19.82 | L130: 6.0999999999999995e-003 | M130: 112.9 | N130: 23.87 | O130: 0.28000000000000003 | P130: 83.03 | Q130: 转股中 | R130: 4.52年 | S130: 2.52年 | T130: 8.02 | U130: 1.9 | V130: 2.e-003 | W130: 0.11199999999999999 | X130: 9.3000000000000013e-002 | Y130: 72 | Z130: 1.39 | AA130: 1.37e-002 | AB130: 8.3999999999999995e-003 | AC130: -1.04e-002 | AD130: -1.2800000000000001e-002 | AE130: 92.69 | AF130: 94.14 | AG130: 0.38 | AH130: AA | AI130: 4.1900000000000007e-002 | AJ130: =H130+100*O130 -> 134.31 | AK130: 129.6 | AL130: 115 | AM130: 35.5 | AN130: 108 | AO130: 1.e-002 | AP130: 17 | AQ130: 柳药转债!
A131: 95 | B131: 110076 | C131: 华海转债! | D131: 600521 | E131: 华海药业 | F131: 医药 | G131: 医药行业 | H131: 107.35 | I131: 1.5e-003 | J131: 1.e-004 | K131: 20.38 | L131: 1.09e-002 | M131: 115.1 | N131: 34.46 | O131: 0.81499999999999995 | P131: 59.14 | Q131: 转股中 | R131: 5.32年 | S131: 3.32年 | T131: 18.4 | U131: 4.5 | V131: 2.e-003 | W131: 6.2e-002 | X131: 3.7000000000000005e-002 | Y131: 296 | Z131: 4.55 | AA131: 1.34e-002 | AB131: 8.3000000000000001e-003 | AC131: -1.0200000000000001e-002 | AD131: -1.2199999999999999e-002 | AE131: 89.56 | AF131: 92.37 | AG131: 0.15 | AH131: AA | AI131: 4.3099999999999999e-002 | AJ131: =H131+100*O131 -> 188.84999999999999 | AK131: 155.6 | AL131: 297 | AM131: 63.2 | AN131: 299 | AO131: -5.0000000000000001e-003 | AP131: 7 | AQ131: 华海转债!
A132: 92 | B132: 127024 | C132: 盈峰转债 | D132: 967 | E132: 盈峰环境 | F132: 机械装备 | G132: 专用设备 | H132: 109 | I132: 8.3000000000000001e-003 | J132: -7.8000000000000005e-003 | K132: 6.6 | L132: 1.5e-003 | M132: 116.8 | N132: 8.19 | O132: 0.35299999999999998 | P132: 80.59 | Q132: 转股中 | R132: 5.32年 | S132: 3.32年 | T132: 14.8 | U132: 3.6 | V132: 2.e-003 | W132: 7.0999999999999994e-002 | X132: 5.7000000000000002e-002 | Y132: 209 | Z132: 1.24 | AA132: 1.3300000000000001e-002 | AB132: 7.6e-003 | AC132: -1.54e-002 | AD132: -1.72e-002 | AE132: 90.15 | AF132: 95.09 | AG132: 0.35 | AH132: AA+ | AI132: 4.0099999999999997e-002 | AJ132: =H132+100*O132 -> 144.30000000000001 | AK132: 137.4 | AL132: 203 | AM132: 42.3 | AN132: 178 | AO132: -7.0999999999999994e-002 | AP132: 5 | AQ132: 盈峰转债
A133: 186 | B133: 123050 | C133: 聚飞转债 | D133: 300303 | E133: 聚飞光电 | F133: 电子 | G133: LED制 | H133: 116.5 | I133: 2.5999999999999999e-003 | J133: -2.5999999999999999e-003 | K133: 5.15 | L133: 0. | M133: 123.8 | N133: 5.08 | O133: 0.14899999999999999 | P133: 101.38 | Q133: 转股中 | R133: 4.76年 | S133: 2.76年 | T133: 7.05 | U133: 25 | V133: 3.1e-002 | W133: 0.107 | X133: 0.109 | Y133: 66 | Z133: 2.68 | AA133: 1.3100000000000001e-002 | AB133: 4.5999999999999999e-003 | AC133: -3.9199999999999999e-002 | AD133: -4.1500000000000002e-002 | AE133: 86.9 | AF133: 93.16 | AG133: 0.59 | AH133: AA- | AI133: 6.2899999999999998e-002 | AJ133: =H133+100*O133 -> 131.40000000000001 | AK133: 131.6 | AL133: 140 | AM133: 38.5 | AN133: 138 | AO133: -6.0000000000000001e-003 | AP133: 11 | AQ133: 聚飞转债
A134: 166 | B134: 113588 | C134: 润达转债! | D134: 603108 | E134: 润达医疗 | F134: 医药 | G134: 医疗器械 | H134: 106.99 | I134: 2.0999999999999999e-003 | J134: -8.3999999999999995e-003 | K134: 10.62 | L134: -1.7600000000000001e-002 | M134: 113.9 | N134: 13.36 | O134: 0.34600000000000003 | P134: 79.49 | Q134: 转股中 | R134: 4.94年 | S134: 2.94年 | T134: 5.5 | U134: 1.6 | V134: 3.0000000000000001e-003 | W134: 8.900000000000001e-002 | X134: 7.0999999999999994e-002 | Y134: 62 | Z134: 1.93 | AA134: 1.3000000000000001e-002 | AB134: 7.8000000000000005e-003 | AC134: -1.1000000000000001e-002 | AD134: -1.3100000000000001e-002 | AE134: 91.12 | AF134: 93.36 | AG134: 0.36 | AH134: AA | AI134: 4.1900000000000007e-002 | AJ134: =H134+100*O134 -> 141.59 | AK134: 134.5 | AL134: 173 | AM134: 41.1 | AN134: 164 | AO134: -3.7000000000000005e-002 | AP134: 10 | AQ134: 润达转债!
A135: 263 | B135: 128070 | C135: 智能转债! | D135: 2877 | E135: 智能自控 | F135: 机械装备 | G135: 通用设备 | H135: 111.113 | I135: -1.4000000000000002e-003 | J135: 1.9e-003 | K135: 6.63 | L135: 1.5e-003 | M135: 116.8 | N135: 9.47 | O135: 0.58700000000000008 | P135: 70.01 | Q135: 转股中 | R135: 3.98年 | S135: 无权 | T135: 2.3 | U135: 40 | V135: 0.157 | W135: 0.10400000000000001 | X135: 7.2999999999999995e-002 | Y135: 22 | Z135: 2.99 | AA135: 1.29e-002 | AB135: 5.3e-003 | AC135: 无权 | AD135: 无权 | AE135: 无权 | AF135: 88.45 | AG135: 0.33 | AH135: A+ | AI135: 7.3899999999999993e-002 | AJ135: =H135+100*O135 -> 169.81300000000002 | AK135: 152.2 | AL135: 286 | AM135: 63.8 | AN135: 301 | AO135: 0. | AP135: 29 | AQ135: 智能转债!
A136: 247 | B136: 127014 | C136: 北方转债! | D136: 65 | E136: 北方国际 | F136: 建筑 | G136: 建筑工程 | H136: 109.241 | I136: 7.8000000000000005e-003 | J136: -6.7000000000000002e-003 | K136: 8.07 | L136: 2.5000000000000001e-003 | M136: 115.1 | N136: 8.65 | O136: 0.17100000000000001 | P136: 93.29 | Q136: 转股中 | R136: 4.29年 | S136: 2.29年 | T136: 5.35 | U136: 14 | V136: 2.4e-002 | W136: 8.5999999999999993e-002 | X136: 8.0000000000000002e-002 | Y136: 62 | Z136: 1.12 | AA136: 1.2500000000000001e-002 | AB136: 6.0999999999999995e-003 | AC136: -2.1600000000000001e-002 | AD136: -2.4300000000000002e-002 | AE136: 94.43 | AF136: 98.08 | AG136: 0.46 | AH136: AA+ | AI136: 3.8900000000000004e-002 | AJ136: =H136+100*O136 -> 126.34100000000001 | AK136: 125.2 | AL136: 64 | AM136: 27.1 | AN136: 33 | AO136: 8.0000000000000002e-003 | AP136: 19 | AQ136: 北方转债!
A137: 176 | B137: 123051 | C137: 今天转债 | D137: 300532 | E137: 今天国际 | F137: 计算机及 | G137: 软件开发 | H137: 115.29 | I137: 5.8999999999999999e-003 | J137: 6.0000000000000001e-003 | K137: 8.84 | L137: 1.84e-002 | M137: 122.3 | N137: 8.7 | O137: 0.13500000000000001 | P137: 101.61 | Q137: 转股中 | R137: 4.90年 | S137: 2.90年 | T137: 2.8 | U137: 11 | V137: 3.3000000000000002e-002 | W137: 0.11599999999999999 | X137: 0.11800000000000001 | Y137: 24 | Z137: 3.1 | AA137: 1.24e-002 | AB137: 4.5999999999999999e-003 | AC137: -3.2599999999999997e-002 | AD137: -3.5200000000000002e-002 | AE137: 83.92 | AF137: 86.93 | AG137: 0.65 | AH137: A+ | AI137: 7.3899999999999993e-002 | AJ137: =H137+100*O137 -> 128.79000000000002 | AK137: 129 | AL137: 104 | AM137: 42 | AN137: 175 | AO137: 2.e-003 | AP137: 18 | AQ137: 今天转债
A138: 145 | B138: 123061 | C138: 航新转债! | D138: 300424 | E138: 航新科技 | F138: 航空航天 | G138: 航空航天 | H138: 117.49 | I138: -1.06e-002 | J138: -8.5000000000000006e-003 | K138: 15.38 | L138: -2.8999999999999998e-002 | M138: 124.8 | N138: 14.85 | O138: 0.13400000000000001 | P138: 103.57 | Q138: 转股中 | R138: 5年12天 | S138: 3年13天 | T138: 2.5 | U138: 116 | V138: 0.39600000000000002 | W138: 6.8000000000000005e-002 | X138: 7.0000000000000007e-002 | Y138: 37 | Z138: 5.53 | AA138: 1.24e-002 | AB138: 4.0000000000000001e-003 | AC138: -3.5799999999999998e-002 | AD138: -3.8399999999999997e-002 | AE138: 83.34 | AF138: 87.53 | AG138: 0.66 | AH138: A+ | AI138: 7.51e-002 | AJ138: =H138+100*O138 -> 130.88999999999999 | AK138: 131.4 | AL138: 136 | AM138: 43.9 | AN138: 194 | AO138: -1.6e-002 | AP138: 17 | AQ138: 航新转债!
A139: 156 | B139: 110071 | C139: 湖盐转债! | D139: 600929 | E139: 雪天盐业 | F139: 食品饮料 | G139: 食品饮料 | H139: 108.53 | I139: 1.0500000000000001e-002 | J139: -3.3e-003 | K139: 6.48 | L139: 1.2500000000000001e-002 | M139: 115.2 | N139: 6.52 | O139: 9.1999999999999998e-002 | P139: 99.39 | Q139: 转股中 | R139: 5年0.1天 | S139: 3年1.1天 | T139: 7.2 | U139: 27 | V139: 3.5000000000000003e-002 | W139: 0.11900000000000001 | X139: 0.11800000000000001 | Y139: 60 | Z139: 2.24 | AA139: 1.2199999999999999e-002 | AB139: 6.7000000000000002e-003 | AC139: -1.44e-002 | AD139: -1.66e-002 | AE139: 90.85 | AF139: 93.7 | AG139: 0.58 | AH139: AA | AI139: 4.3099999999999999e-002 | AJ139: =H139+100*O139 -> 117.73 | AK139: 117.7 | AL139: 13 | AM139: 24 | AN139: 18 | AO139: 8.0000000000000002e-003 | AP139: 23 | AQ139: 湖盐转债!
A140: 353 | B140: 110038 | C140: 济川转债! | D140: 600566 | E140: 济川药业 | F140: 医药 | G140: 中药 | H140: 105.82 | I140: -2.0000000000000001e-004 | J140: -2.0000000000000001e-004 | K140: 16.86 | L140: -1.06e-002 | M140: 107.5 | N140: 23.4 | O140: 0.46899999999999997 | P140: 72.05 | Q140: 转股中 | R140: 1.35年 | S140: 回售内 | T140: 6.28 | U140: 0.6 | V140: 1.e-003 | W140: 4.2000000000000003e-002 | X140: 2.9999999999999999e-002 | Y140: 150 | Z140: 1.85 | AA140: 1.1899999999999999e-002 | AB140: 1.2999999999999999e-003 | AC140: 回售内 | AD140: 回售内 | AE140: 100.25 | AF140: 101.97 | AG140: 0.04 | AH140: AA | AI140: 4.0399999999999998e-002 | AJ140: =H140+100*O140 -> 152.72 | AK140: 139.6 | AL140: 225 | AM140: 37.6 | AN140: 133 | AO140: -4.9000000000000002e-002 | AP140: 23 | AQ140: 济川转债!
A141: 331 | B141: 128037 | C141: 岩土转债! | D141: 2542. | E141: 中化岩土 | F141: 建筑 | G141: 建筑工程 | H141: 107.866 | I141: 5.6999999999999993e-003 | J141: -1.4000000000000002e-003 | K141: 2.95 | L141: 1.03e-002 | M141: 111.3 | N141: 3.1 | O141: 0.13400000000000001 | P141: 95.16 | Q141: 转股中 | R141: 2.68年 | S141: 0.68年 | T141: 5.99 | U141: 8.1 | V141: 1.3000000000000001e-002 | W141: 0.11199999999999999 | X141: 0.107 | Y141: 53 | Z141: 1.34 | AA141: 1.1899999999999999e-002 | AB141: 4.0999999999999995e-003 | AC141: -6.6100000000000006e-002 | AD141: -7.0000000000000007e-002 | AE141: 98.44 | AF141: 100.26 | AG141: 0.43 | AH141: AA | AI141: 4.0399999999999998e-002 | AJ141: =H141+100*O141 -> 121.26600000000001 | AK141: 120.6 | AL141: 27 | AM141: 20.3 | AN141: 8 | AO141: -2.6000000000000002e-002 | AP141: 50 | AQ141: 岩土转债!
A142: 177 | B142: 127017 | C142: 万青转债 | D142: 789 | E142: 万年青 | F142: 建筑 | G142: 水泥 | H142: 111.478 | I142: -4.6999999999999993e-003 | J142: 2.7000000000000001e-003 | K142: 11.46 | L142: -5.1999999999999998e-003 | M142: 118 | N142: 13.46 | O142: 0.309 | P142: 85.14 | Q142: 转股中 | R142: 4.90年 | S142: 2.90年 | T142: 10 | U142: 3.7 | V142: 3.0000000000000001e-003 | W142: 0.109 | X142: 9.3000000000000013e-002 | Y142: 91 | Z142: 1.39 | AA142: 1.1899999999999999e-002 | AB142: 5.4000000000000003e-003 | AC142: -2.46e-002 | AD142: -2.6600000000000002e-002 | AE142: 92 | AF142: 98.21 | AG142: 0.37 | AH142: AA+ | AI142: 3.8900000000000004e-002 | AJ142: =H142+100*O142 -> 142.37799999999999 | AK142: 137.8 | AL142: 206 | AM142: 39.6 | AN142: 148 | AO142: -1.9e-002 | AP142: 9 | AQ142: 万青转债
A143: 115 | B143: 128133 | C143: 奇正转债! | D143: 2287 | E143: 奇正藏药 | F143: 医药 | G143: 中药 | H143: 110.44 | I143: 4.8999999999999998e-003 | J143: 8.9999999999999998e-004 | K143: 27.56 | L143: 1.1699999999999999e-002 | M143: 117.3 | N143: 29.78 | O143: 0.193 | P143: 92.55 | Q143: 转股中 | R143: 5.20年 | S143: 3.21年 | T143: 8 | U143: 11 | V143: 1.3000000000000001e-002 | W143: 5.5e-002 | X143: 5.0999999999999997e-002 | Y143: 146 | Z143: 5.64 | AA143: 1.1899999999999999e-002 | AB143: 5.8999999999999999e-003 | AC143: -1.84e-002 | AD143: -2.0499999999999997e-002 | AE143: 90.18 | AF143: 94.61 | AG143: 0.5 | AH143: AA | AI143: 4.3099999999999999e-002 | AJ143: =H143+100*O143 -> 129.74000000000001 | AK143: 128.3 | AL143: 97 | AM143: 33.7 | AN143: 86 | AO143: 4.9000000000000002e-002 | AP143: 16 | AQ143: 奇正转债!
A144: 182 | B144: 128107 | C144: 交科转债 | D144: 2061 | E144: 浙江交科 | F144: 建筑 | G144: 建筑工程 | H144: 108.802 | I144: 5.6999999999999993e-003 | J144: -1.5e-003 | K144: 5.3 | L144: 7.6e-003 | M144: 114.9 | N144: 5.36 | O144: 0.10000000000000001 | P144: 98.88 | Q144: 转股中 | R144: 4.78年 | S144: 2.79年 | T144: 25 | U144: 10 | V144: 4.0000000000000001e-003 | W144: 0.34299999999999997 | X144: 0.33899999999999997 | Y144: 73 | Z144: 0.85 | AA144: 1.1699999999999999e-002 | AB144: 6.0000000000000001e-003 | AC144: -1.72e-002 | AD144: -1.9400000000000001e-002 | AE144: 92.47 | AF144: 96.06 | AG144: 0.54 | AH144: AA+ | AI144: 3.8900000000000004e-002 | AJ144: =H144+100*O144 -> 118.80200000000001 | AK144: 118.7 | AL144: 17 | AM144: 22.7 | AN144: 16 | AO144: -1.1000000000000001e-002 | AP144: 18 | AQ144: 交科转债
A145: 100 | B145: 123073 | C145: 同和转债! | D145: 300636 | E145: 同和药业 | F145: 医药 | G145: 原料药 | H145: 115.307 | I145: 1.15e-002 | J145: 7.8000000000000005e-003 | K145: 15.29 | L145: 2.8199999999999999e-002 | M145: 122.4 | N145: 14.82 | O145: 0.11800000000000001 | P145: 103.17 | Q145: 转股中 | R145: 5.30年 | S145: 3.30年 | T145: 3.59 | U145: 3.3 | V145: 8.0000000000000002e-003 | W145: 0.114 | X145: 0.11800000000000001 | Y145: 31 | Z145: 2.5 | AA145: 1.1599999999999999e-002 | AB145: 4.3e-003 | AC145: -2.81e-002 | AD145: -3.0600000000000002e-002 | AE145: 81.64 | AF145: 84.21 | AG145: 0.68 | AH145: A+ | AI145: 7.51e-002 | AJ145: =H145+100*O145 -> 127.107 | AK145: 127.4 | AL145: 85 | AM145: 43.2 | AN145: 187 | AO145: -5.5e-002 | AP145: 11 | AQ145: 同和转债!
A146: 245 | B146: 110060 | C146: 天路转债! | D146: 600326 | E146: 西藏天路 | F146: 建筑 | G146: 水泥 | H146: 109.5 | I146: 8.9999999999999998e-004 | J146: -2.0000000000000001e-004 | K146: 6.84 | L146: 1.5e-003 | M146: 114.9 | N146: 7.16 | O146: 0.14599999999999999 | P146: 95.53 | Q146: 转股中 | R146: 4.30年 | S146: 2.30年 | T146: 7.06 | U146: 3.4 | V146: 4.0000000000000001e-003 | W146: 0.11199999999999999 | X146: 0.107 | Y146: 63 | Z146: 1.49 | AA146: 1.15e-002 | AB146: 5.1999999999999998e-003 | AC146: -2.3199999999999998e-002 | AD146: -2.58e-002 | AE146: 93.53 | AF146: 96.66 | AG146: 0.5 | AH146: AA | AI146: 4.1900000000000007e-002 | AJ146: =H146+100*O146 -> 124.09999999999999 | AK146: 123.5 | AL146: 48 | AM146: 26.8 | AN146: 30 | AO146: 2.e-003 | AP146: 13 | AQ146: 天路转债!
A147: 193 | B147: 128105 | C147: 长集转债! | D147: 2616. | E147: 长青集团 | F147: 城市公用 | G147: 三废处理 | H147: 109 | I147: 2.3e-003 | J147: -3.5999999999999999e-003 | K147: 7.23 | L147: -2.8000000000000004e-003 | M147: 114.9 | N147: 7.91 | O147: 0.193 | P147: 91.4 | Q147: 转股中 | R147: 4.75年 | S147: 2.75年 | T147: 8 | U147: 24 | V147: 2.7000000000000003e-002 | W147: 0.14899999999999999 | X147: 0.13600000000000001 | Y147: 54 | Z147: 2.01 | AA147: 1.1399999999999999e-002 | AB147: 5.6999999999999993e-003 | AC147: -1.8000000000000002e-002 | AD147: -2.0199999999999999e-002 | AE147: 91.83 | AF147: 94.91 | AG147: 0.48 | AH147: AA | AI147: 4.1900000000000007e-002 | AJ147: =H147+100*O147 -> 128.30000000000001 | AK147: 126.6 | AL147: 75 | AM147: 31.7 | AN147: 68 | AO147: 3.1e-002 | AP147: 17 | AQ147: 长集转债!
A148: 96 | B148: 123075 | C148: 贝斯转债! | D148: 300580 | E148: 贝斯特 | F148: 汽车 | G148: 零部件制 | H148: 108.9 | I148: 1.0200000000000001e-002 | J148: 2.5999999999999999e-003 | K148: 20.1 | L148: 2.3399999999999997e-002 | M148: 115.5 | N148: 23.74 | O148: 0.28600000000000003 | P148: 84.67 | Q148: 转股中 | R148: 5.32年 | S148: 3.32年 | T148: 6 | U148: 6 | V148: 9.0000000000000011e-003 | W148: 0.14899999999999999 | X148: 0.126 | Y148: 40 | Z148: 2.33 | AA148: 1.1399999999999999e-002 | AB148: 6.0999999999999995e-003 | AC148: -1.37e-002 | AD148: -1.5800000000000002e-002 | AE148: 83.82 | AF148: 83.61 | AG148: 0.55 | AH148: AA- | AI148: 6.4100000000000004e-002 | AJ148: =H148+100*O148 -> 137.5 | AK148: 133.1 | AL148: 158 | AM148: 49.3 | AN148: 236 | AO148: 3.2000000000000001e-002 | AP148: 8 | AQ148: 贝斯转债!
A149: 2 | B149: 113625 | C149: 江山转债 | D149: 603208 | E149: 江山欧派 | F149: 其他 | G149: 家居用品 | H149: 116.07 | I149: -8.9999999999999998e-004 | J149: 1.78e-002 | K149: 93.75 | L149: 2.7200000000000002e-002 | M149: 124 | N149: 97.55 | O149: 0.20800000000000002 | P149: 96.1 | Q149: 5月12天 | R149: 5.92年 | S149: 3.92年 | T149: 5.83 | U149: 8.8 | V149: 1.3000000000000001e-002 | W149: 5.9000000000000004e-002 | X149: 5.7000000000000002e-002 | Y149: 98 | Z149: 5.86 | AA149: 1.1399999999999999e-002 | AB149: 4.5999999999999999e-003 | AC149: -2.69e-002 | AD149: -2.87e-002 | AE149: 80.8 | AF149: 86.43 | AG149: 0.62 | AH149: AA- | AI149: 6.4100000000000004e-002 | AJ149: =H149+100*O149 -> 136.87 | AK149: 136 | AL149: 189 | AM149: 49.6 | AN149: 238 | AO149: -1.7000000000000001e-002 | AP149: 2 | AQ149: 江山转债
A150: 338 | B150: 128034 | C150: 江银转债! | D150: 2807 | E150: 江阴银行 | F150: 金融 | G150: 银行行业 | H150: 105.365 | I150: 0. | J150: 0. | K150: 3.93 | L150: 0. | M150: 108.3 | N150: 4.32 | O150: 0.158 | P150: 90.97 | Q150: 转股中 | R150: 2.55年 | S150: 无权 | T150: 17.6 | U150: 7.1 | V150: 4.0000000000000001e-003 | W150: 0.20600000000000002 | X150: 0.187 | Y150: 85 | Z150: 0.71 | AA150: 1.1000000000000001e-002 | AB150: 4.7999999999999996e-003 | AC150: 无权 | AD150: 无权 | AE150: 无权 | AF150: 98.73 | AG150: 0.39 | AH150: AA+ | AI150: 3.7400000000000003e-002 | AJ150: =H150+100*O150 -> 121.16499999999999 | AK150: 119.8 | AL150: 23 | AM150: 21 | AN150: 10 | AO150: -5.0000000000000001e-003 | AP150: 25 | AQ150: 江银转债!
A151: 123 | B151: 128129 | C151: 青农转债! | D151: 2958 | E151: 青农商行 | F151: 金融 | G151: 银行行业 | H151: 106.156 | I151: 1.5e-003 | J151: -2.0000000000000001e-004 | K151: 4.09 | L151: 2.5000000000000001e-003 | M151: 112.2 | N151: 4.32 | O151: 0.121 | P151: 94.68 | Q151: 转股中 | R151: 5年46天 | S151: 无权 | T151: 50 | U151: 38 | V151: 6.9999999999999993e-003 | W151: 0.22 | X151: 0.20800000000000002 | Y151: 227 | Z151: 0.83 | AA151: 1.1000000000000001e-002 | AB151: 6.6e-003 | AC151: 无权 | AD151: 无权 | AE151: 无权 | AF151: 92.91 | AG151: 0.53 | AH151: AAA | AI151: 3.8100000000000002e-002 | AJ151: =H151+100*O151 -> 118.256 | AK151: 117.6 | AL151: 12 | AM151: 24.7 | AN151: 21 | AO151: -4.5999999999999999e-002 | AP151: 15 | AQ151: 青农转债!
A152: 342 | B152: 110041 | C152: 蒙电转债! | D152: 600863 | E152: 内蒙华电 | F152: 能源电力 | G152: 电力供应 | H152: 106.47 | I152: 1.1999999999999999e-003 | J152: 5.1999999999999998e-003 | K152: 2.33 | L152: 1.7500000000000002e-002 | M152: 109.3 | N152: 2.56 | O152: 0.17000000000000001 | P152: 91.02 | Q152: 转股中 | R152: 2.46年 | S152: 0.46年 | T152: 18.7 | U152: 4 | V152: 2.e-003 | W152: 0.13800000000000001 | X152: 0.126 | Y152: 135 | Z152: 1.16 | AA152: 1.09e-002 | AB152: 3.8e-003 | AC152: -6.9900000000000004e-002 | AD152: -7.51e-002 | AE152: 99.63 | AF152: 100.51 | AG152: 0.37 | AH152: AAA | AI152: 3.5400000000000001e-002 | AJ152: =H152+100*O152 -> 123.47 | AK152: 121.9 | AL152: 36 | AM152: 21.4 | AN152: 12 | AO152: -2.e-002 | AP152: 11 | AQ152: 蒙电转债!
A153: 41 | B153: 128144 | C153: 利民转债! | D153: 2734 | E153: 利民股份 | F153: 化工 | G153: 农化 | H153: 107.5 | I153: 9.0000000000000011e-003 | J153: -4.7999999999999996e-003 | K153: 11.59 | L153: 9.5999999999999992e-003 | M153: 114.1 | N153: 13.98 | O153: 0.29699999999999999 | P153: 82.9 | Q153: 58天 | R153: 5.64年 | S153: 3.64年 | T153: 9.8 | U153: 2.8 | V153: 3.0000000000000001e-003 | W153: 0.22699999999999998 | X153: 0.188 | Y153: 43 | Z153: 1.57 | AA153: 1.0800000000000001e-002 | AB153: 6.1999999999999998e-003 | AC153: -1.1599999999999999e-002 | AD153: -1.3000000000000001e-002 | AE153: 87.68 | AF153: 90.25 | AG153: 0.43 | AH153: AA | AI153: 4.3099999999999999e-002 | AJ153: =H153+100*O153 -> 137.19999999999999 | AK153: 132.1 | AL153: 147 | AM153: 41.8 | AN153: 172 | AO153: -2.e-002 | AP153: 5 | AQ153: 利民转债!
A154: 138 | B154: 128124 | C154: 科华转债! | D154: 2022 | E154: 科华生物 | F154: 医药 | G154: 生物制药 | H154: 104.77 | I154: 6.3e-003 | J154: -2.2000000000000001e-003 | K154: 17.23 | L154: 1.e-002 | M154: 110.3 | N154: 21.51 | O154: 0.308 | P154: 80.1 | Q154: 转股中 | R154: 5年18天 | S154: 3年19天 | T154: 7.38 | U154: 2.7 | V154: 3.0000000000000001e-003 | W154: 8.3000000000000004e-002 | X154: 6.7000000000000004e-002 | Y154: 89 | Z154: 2.66 | AA154: 1.04e-002 | AB154: 6.6e-003 | AC154: -5.1999999999999998e-003 | AD154: -6.9999999999999993e-003 | AE154: 90.08 | AF154: 89.48 | AG154: 0.41 | AH154: AA | AI154: 4.3099999999999999e-002 | AJ154: =H154+100*O154 -> 135.56999999999999 | AK154: 129.4 | AL154: 112 | AM154: 39.4 | AN154: 145 | AO154: -1.6e-002 | AP154: 20 | AQ154: 科华转债!
A155: 110 | B155: 123068 | C155: 弘信转债 | D155: 300657 | E155: 弘信电子 | F155: 电子 | G155: 元器件制 | H155: 114.9 | I155: 3.39e-002 | J155: -2.4900000000000002e-002 | K155: 18.62 | L155: 1.4199999999999999e-002 | M155: 121.2 | N155: 18.45 | O155: 0.13900000000000001 | P155: 100.92 | Q155: 转股中 | R155: 5.27年 | S155: 3.27年 | T155: 5.7 | U155: 61 | V155: 9.5000000000000001e-002 | W155: 8.9999999999999997e-002 | X155: 8.9999999999999997e-002 | Y155: 64 | Z155: 4.53 | AA155: 1.04e-002 | AB155: 3.4000000000000002e-003 | AC155: -2.86e-002 | AD155: -3.0800000000000001e-002 | AE155: 84.34 | AF155: 88.04 | AG155: 0.64 | AH155: AA- | AI155: 6.4100000000000004e-002 | AJ155: =H155+100*O155 -> 128.80000000000001 | AK155: 128.9 | AL155: 102 | AM155: 40.8 | AN155: 159 | AO155: 0.122 | AP155: 8 | AQ155: 弘信转债
A156: 239 | B156: 113549 | C156: 白电转债 | D156: 603861 | E156: 白云电器 | F156: 能源电力 | G156: 电力设备 | H156: 109.9 | I156: 1.8500000000000003e-002 | J156: -1.11e-002 | K156: 8.7 | L156: 1.3999999999999999e-002 | M156: 114.8 | N156: 8.88 | O156: 0.122 | P156: 97.97 | Q156: 转股中 | R156: 4.35年 | S156: 2.35年 | T156: 8.8 | U156: 46 | V156: 4.7e-002 | W156: 0.22899999999999998 | X156: 0.22399999999999998 | Y156: 38 | Z156: 1.49 | AA156: 1.03e-002 | AB156: 4.0999999999999995e-003 | AC156: -2.4500000000000001e-002 | AD156: -2.7000000000000003e-002 | AE156: 93.24 | AF156: 96.37 | AG156: 0.53 | AH156: AA | AI156: 4.1900000000000007e-002 | AJ156: =H156+100*O156 -> 122.10000000000001 | AK156: 121.8 | AL156: 34 | AM156: 25.5 | AN156: 23 | AO156: 7.0999999999999994e-002 | AP156: 40 | AQ156: 白电转债
A157: 107 | B157: 128135 | C157: 洽洽转债! | D157: 2557 | E157: 洽洽食品 | F157: 食品饮料 | G157: 休闲食品 | H157: 113.99 | I157: 4.1999999999999997e-003 | J157: -8.0000000000000004e-004 | K157: 40.75 | L157: 1.72e-002 | M157: 120.2 | N157: 60.03 | O157: 0.67900000000000005 | P157: 67.88 | Q157: 转股中 | R157: 5.28年 | S157: 3.28年 | T157: 13.4 | U157: 3.5 | V157: 2.e-003 | W157: 6.5000000000000002e-002 | X157: 4.4000000000000004e-002 | Y157: 207 | Z157: 4.84 | AA157: 1.03e-002 | AB157: 3.5999999999999999e-003 | AC157: -2.7300000000000001e-002 | AD157: -2.9300000000000003e-002 | AE157: 89.79 | AF157: 96.6 | AG157: 0.2 | AH157: AA | AI157: 4.3099999999999999e-002 | AJ157: =H157+100*O157 -> 181.88999999999999 | AK157: 160.1 | AL157: 306 | AM157: 63.5 | AN157: 300 | AO157: -8.1000000000000003e-002 | AP157: 11 | AQ157: 洽洽转债!
A158: 19 | B158: 123112 | C158: 万讯转债 | D158: 300112 | E158: 万讯自控 | F158: 机械装备 | G158: 专用设备 | H158: 117.502 | I158: 1.8200000000000001e-002 | J158: 6.5000000000000006e-003 | K158: 9.42 | L158: 3.7400000000000003e-002 | M158: 124.4 | N158: 8.93 | O158: 0.114 | P158: 105.49 | Q158: 3月7天 | R158: 5.75年 | S158: 3.75年 | T158: 2.46 | U158: 44 | V158: 0.151 | W158: 9.0999999999999998e-002 | X158: 9.6000000000000002e-002 | Y158: 27 | Z158: 2.52 | AA158: 1.0200000000000001e-002 | AB158: 3.0000000000000001e-003 | AC158: -3.0200000000000001e-002 | AD158: -3.2199999999999999e-002 | AE158: 82.01 | AF158: 87.7 | AG158: 0.66 | AH158: AA- | AI158: 6.4100000000000004e-002 | AJ158: =H158+100*O158 -> 128.90199999999999 | AK158: 129.5 | AL158: 114 | AM158: 41.8 | AN158: 171 | AO158: 5.7999999999999996e-002 | AP158: 11 | AQ158: 万讯转债
A159: 327 | B159: 128039 | C159: 三力转债! | D159: 2224 | E159: 三 力 士 | F159: 机械装备 | G159: 专用设备 | H159: 105.799 | I159: 5.5000000000000005e-003 | J159: -2.5999999999999999e-003 | K159: 4.76 | L159: 8.5000000000000006e-003 | M159: 108.8 | N159: 5.79 | O159: 0.28699999999999998 | P159: 82.21 | Q159: 转股中 | R159: 2.91年 | S159: 0.92年 | T159: 2.03 | U159: 3.1 | V159: 1.3999999999999999e-002 | W159: 5.7999999999999996e-002 | X159: 4.8000000000000001e-002 | Y159: 35 | Z159: 1.51 | AA159: 9.7999999999999997e-003 | AB159: 4.0999999999999995e-003 | AC159: -3.73e-002 | AD159: -4.0000000000000001e-002 | AE159: 95.22 | AF159: 91.67 | AG159: 0.34 | AH159: AA- | AI159: 6.1399999999999996e-002 | AJ159: =H159+100*O159 -> 134.499 | AK159: 129.4 | AL159: 110 | AM159: 34.2 | AN159: 90 | AO159: 2.e-003 | AP159: 28 | AQ159: 三力转债!
A160: 326 | B160: 128040 | C160: 华通转债! | D160: 2758 | E160: 浙农股份 | F160: 医药 | G160: 医药商业 | H160: 108.199 | I160: 2.3999999999999998e-003 | J160: -1.5e-003 | K160: 9.44 | L160: 2.0999999999999999e-003 | M160: 111.3 | N160: 10.15 | O160: 0.16300000000000001 | P160: 93 | Q160: 转股中 | R160: 2.93年 | S160: 0.93年 | T160: 2.22 | U160: 6.7 | V160: 2.7999999999999997e-002 | W160: 4.8000000000000001e-002 | X160: 4.4999999999999998e-002 | Y160: 46 | Z160: 1.53 | AA160: 9.7999999999999997e-003 | AB160: 2.7000000000000001e-003 | AC160: -5.4100000000000002e-002 | AD160: -5.7099999999999998e-002 | AE160: 97.48 | AF160: 99.27 | AG160: 0.42 | AH160: AA | AI160: 4.0399999999999998e-002 | AJ160: =H160+100*O160 -> 124.499 | AK160: 123.4 | AL160: 47 | AM160: 24.1 | AN160: 19 | AO160: -1.2e-002 | AP160: 31 | AQ160: 华通转债!
A161: 22 | B161: 123109 | C161: 昌红转债 | D161: 300151 | E161: 昌红科技 | F161: 机械装备 | G161: 专用设备 | H161: 114.675 | I161: -1.5700000000000002e-002 | J161: -1.6e-002 | K161: 24.03 | L161: -5.8799999999999998e-002 | M161: 121 | N161: 28.06 | O161: 0.33899999999999997 | P161: 85.64 | Q161: 3月1天 | R161: 5.73年 | S161: 3.73年 | T161: 4.6 | U161: 20 | V161: 3.7999999999999999e-002 | W161: 3.7999999999999999e-002 | X161: 3.3000000000000002e-002 | Y161: 121 | Z161: 11.29 | AA161: 9.5999999999999992e-003 | AB161: 3.3e-003 | AC161: -2.52e-002 | AD161: -2.7000000000000003e-002 | AE161: 81.78 | AF161: 85.38 | AG161: 0.54 | AH161: AA- | AI161: 6.4100000000000004e-002 | AJ161: =H161+100*O161 -> 148.57499999999999 | AK161: 143.7 | AL161: 256 | AM161: 58.3 | AN161: 280 | AO161: -0.122 | AP161: 3 | AQ161: 昌红转债
A162: 74 | B162: 127026 | C162: 超声转债! | D162: 823. | E162: 超声电子 | F162: 电子 | G162: 元器件制 | H162: 107.53 | I162: 5.0000000000000001e-003 | J162: 6.1999999999999998e-003 | K162: 11.48 | L162: 2.1400000000000002e-002 | M162: 113.1 | N162: 12.72 | O162: 0.191 | P162: 90.25 | Q162: 转股中 | R162: 5.41年 | S162: 3.42年 | T162: 7 | U162: 24 | V162: 3.2000000000000001e-002 | W162: 0.114 | X162: 0.10199999999999999 | Y162: 62 | Z162: 1.61 | AA162: 9.4999999999999998e-003 | AB162: 5.1000000000000004e-003 | AC162: -1.04e-002 | AD162: -1.23e-002 | AE162: 89.19 | AF162: 90.39 | AG162: 0.52 | AH162: AA | AI162: 4.3099999999999999e-002 | AJ162: =H162+100*O162 -> 126.63 | AK162: 124.8 | AL162: 61 | AM162: 34.4 | AN162: 94 | AO162: 4.5999999999999999e-002 | AP162: 11 | AQ162: 超声转债!
A163: 236 | B163: 110062 | C163: 烽火转债! | D163: 600498 | E163: 烽火通信 | F163: 通信互联 | G163: 通信设备 | H163: 106.49 | I163: 2.7000000000000001e-003 | J163: -1.2999999999999999e-003 | K163: 17.54 | L163: 5.1999999999999998e-003 | M163: 110.8 | N163: 22.93 | O163: 0.39200000000000002 | P163: 76.49 | Q163: 转股中 | R163: 4.40年 | S163: 2.40年 | T163: 30.9 | U163: 8.5 | V163: 3.0000000000000001e-003 | W163: 0.156 | X163: 0.11900000000000001 | Y163: 198 | Z163: 1.84 | AA163: 9.1999999999999998e-003 | AB163: 4.5999999999999999e-003 | AC163: -1.1899999999999999e-002 | AD163: -1.44e-002 | AE163: 94.21 | AF163: 94.79 | AG163: 0.29 | AH163: AAA | AI163: 3.6900000000000002e-002 | AJ163: =H163+100*O163 -> 145.69 | AK163: 136.5 | AL163: 194 | AM163: 41.7 | AN163: 168 | AO163: -4.2999999999999997e-002 | AP163: 18 | AQ163: 烽火转债!
A164: 76 | B164: 128140 | C164: 润建转债! | D164: 2929 | E164: 润建股份 | F164: 通信互联 | G164: 通信设备 | H164: 109.783 | I164: 1.4000000000000002e-003 | J164: -5.7999999999999996e-003 | K164: 25.57 | L164: -7.8000000000000005e-003 | M164: 115.2 | N164: 26.4 | O164: 0.13300000000000001 | P164: 96.86 | Q164: 转股中 | R164: 5.41年 | S164: 3.41年 | T164: 10.9 | U164: 2 | V164: 2.e-003 | W164: 0.193 | X164: 0.187 | Y164: 56 | Z164: 1.79 | AA164: 9.1000000000000004e-003 | AB164: 4.0000000000000001e-003 | AC164: -1.5900000000000001e-002 | AD164: -1.7899999999999999e-002 | AE164: 89.29 | AF164: 92.09 | AG164: 0.56 | AH164: AA | AI164: 4.3099999999999999e-002 | AJ164: =H164+100*O164 -> 123.083 | AK164: 122.7 | AL164: 42 | AM164: 30.6 | AN164: 53 | AO164: 1.e-003 | AP164: 13 | AQ164: 润建转债!
A165: 35 | B165: 123104 | C165: 卫宁转债 | D165: 300253 | E165: 卫宁健康 | F165: 计算机及 | G165: 软件开发 | H165: 118.967 | I165: -2.9999999999999997e-004 | J165: -3.7000000000000002e-003 | K165: 16.2 | L165: -9.1999999999999998e-003 | M165: 125.1 | N165: 17.74 | O165: 0.30299999999999999 | P165: 91.32 | Q165: 2月15天 | R165: 5.68年 | S165: 3.69年 | T165: 9.7 | U165: 18 | V165: 1.6e-002 | W165: 2.7999999999999997e-002 | X165: 2.6000000000000002e-002 | Y165: 347 | Z165: 7.59 | AA165: 9.0000000000000011e-003 | AB165: 1.7000000000000001e-003 | AC165: -3.5499999999999997e-002 | AD165: -3.7200000000000004e-002 | AE165: 88.18 | AF165: 98.82 | AG165: 0.44 | AH165: AA | AI165: 4.3099999999999999e-002 | AJ165: =H165+100*O165 -> 149.267 | AK165: 146.6 | AL165: 269 | AM165: 47.8 | AN165: 227 | AO165: 1.4999999999999999e-002 | AP165: 4 | AQ165: 卫宁转债
A166: 229 | B166: 113030 | C166: 东风转债! | D166: 601515 | E166: 东风股份 | F166: 造纸包装 | G166: 包装材料 | H166: 112.46 | I166: 3.8e-003 | J166: -3.0000000000000001e-003 | K166: 6.2 | L166: 1.6000000000000001e-003 | M166: 116.9 | N166: 6.45 | O166: 0.17000000000000001 | P166: 96.12 | Q166: 转股中 | R166: 4.46年 | S166: 2.46年 | T166: 2.95 | U166: 6.4 | V166: 1.9e-002 | W166: 3.6000000000000004e-002 | X166: 3.4000000000000002e-002 | Y166: 83 | Z166: 1.8 | AA166: 8.8999999999999999e-003 | AB166: 2.0999999999999999e-003 | AC166: -3.1800000000000002e-002 | AD166: -3.4200000000000001e-002 | AE166: 92.93 | AF166: 97.71 | AG166: 0.49 | AH166: AA | AI166: 4.1900000000000007e-002 | AJ166: =H166+100*O166 -> 129.45999999999998 | AK166: 128.8 | AL166: 101 | AM166: 31.1 | AN166: 59 | AO166: -2.9999999999999999e-002 | AP166: 17 | AQ166: 东风转债!
A167: 55 | B167: 127028 | C167: 英特转债! | D167: 411 | E167: 英特集团 | F167: 医药 | G167: 医药商业 | H167: 107.931 | I167: -1.7000000000000001e-003 | J167: -6.1999999999999998e-003 | K167: 12.87 | L167: -1.38e-002 | M167: 113.1 | N167: 13.4 | O167: 0.124 | P167: 96.04 | Q167: 2.1天 | R167: 5.49年 | S167: 3.49年 | T167: 6 | U167: 8.1 | V167: 1.3000000000000001e-002 | W167: 0.187 | X167: 0.17999999999999999 | Y167: 32 | Z167: 1.88 | AA167: 8.6999999999999994e-003 | AB167: 4.3e-003 | AC167: -1.1200000000000002e-002 | AD167: -1.3100000000000001e-002 | AE167: 89.83 | AF167: 91.51 | AG167: 0.57 | AH167: AA+ | AI167: 4.0099999999999997e-002 | AJ167: =H167+100*O167 -> 120.331 | AK167: 119.8 | AL167: 24 | AM167: 28.3 | AN167: 39 | AO167: -3.1e-002 | AP167: 21 | AQ167: 英特转债!
A168: 25 | B168: 123107 | C168: 温氏转债! | D168: 300498 | E168: 温氏股份 | F168: 农业 | G168: 畜牧业 | H168: 107.65 | I168: 5.0000000000000001e-004 | J168: 3.0999999999999999e-003 | K168: 13.97 | L168: 9.3999999999999986e-003 | M168: 113 | N168: 17.62 | O168: 0.35799999999999998 | P168: 79.28 | Q168: 3月1天 | R168: 5.72年 | S168: 3.72年 | T168: 93 | U168: 24 | V168: 2.e-003 | W168: 0.10400000000000001 | X168: 8.3000000000000004e-002 | Y168: 890 | Z168: 1.93 | AA168: 8.6999999999999994e-003 | AB168: 4.5000000000000005e-003 | AC168: -1.01e-002 | AD168: -1.18e-002 | AE168: 89.6 | AF168: 91.58 | AG168: 0.38 | AH168: AAA | AI168: 3.8100000000000002e-002 | AJ168: =H168+100*O168 -> 143.44999999999999 | AK168: 136 | AL168: 188 | AM168: 44.4 | AN168: 202 | AO168: -8.0000000000000002e-003 | AP168: 9 | AQ168: 温氏转债!
A169: 310 | B169: 128048 | C169: 张行转债 | D169: 2839 | E169: 张家港行 | F169: 金融 | G169: 银行行业 | H169: 110.471 | I169: -2.9999999999999997e-004 | J169: -2.2000000000000001e-003 | K169: 5.26 | L169: -5.6999999999999993e-003 | M169: 113.3 | N169: 5.6 | O169: 0.17600000000000002 | P169: 93.93 | Q169: 转股中 | R169: 3.34年 | S169: 无权 | T169: 25 | U169: 0.6 | V169: 0. | W169: 0.26300000000000001 | X169: 0.247 | Y169: 95 | Z169: 0.85 | AA169: 7.7000000000000002e-003 | AB169: 5.0000000000000001e-004 | AC169: 无权 | AD169: 无权 | AE169: 无权 | AF169: 99.99 | AG169: 0.44 | AH169: AA+ | AI169: 3.8900000000000004e-002 | AJ169: =H169+100*O169 -> 128.071 | AK169: 127 | AL169: 79 | AM169: 27 | AN169: 32 | AO169: -4.0000000000000001e-002 | AP169: 11 | AQ169: 张行转债
A170: 274 | B170: 113026 | C170: 核能转债! | D170: 601985 | E170: 中国核电 | F170: 能源电力 | G170: 核电 | H170: 106.24 | I170: 1.1000000000000001e-003 | J170: -4.0000000000000001e-003 | K170: 4.95 | L170: -8.0000000000000002e-003 | M170: 109.3 | N170: 5.86 | O170: 0.25800000000000001 | P170: 84.47 | Q170: 转股中 | R170: 3.76年 | S170: 1.77年 | T170: 78 | U170: 5.7 | V170: 1.e-003 | W170: 8.9999999999999997e-002 | X170: 7.5999999999999998e-002 | Y170: 864 | Z170: 1.4 | AA170: 7.7000000000000002e-003 | AB170: 3.0000000000000001e-003 | AC170: -1.7000000000000001e-002 | AD170: -1.9799999999999998e-002 | AE170: 95.89 | AF170: 95.61 | AG170: 0.35 | AH170: AAA | AI170: 3.6900000000000002e-002 | AJ170: =H170+100*O170 -> 132.03999999999999 | AK170: 128 | AL170: 95 | AM170: 32.1 | AN170: 73 | AO170: -2.2000000000000002e-002 | AP170: 42 | AQ170: 核能转债!
A171: 29 | B171: 123106 | C171: 正丹转债! | D171: 300641 | E171: 正丹股份 | F171: 化工 | G171: 化工 | H171: 120.5 | I171: 1.9199999999999998e-002 | J171: -5.1000000000000004e-003 | K171: 8.5 | L171: 2.0400000000000001e-002 | M171: 125.5 | N171: 7.5 | O171: 6.3e-002 | P171: 113.33 | Q171: 2月23天 | R171: 5.70年 | S171: 3.71年 | T171: 3.2 | U171: 135 | V171: 0.35100000000000003 | W171: 7.6999999999999999e-002 | X171: 8.6999999999999994e-002 | Y171: 42 | Z171: 2.99 | AA171: 7.3000000000000001e-003 | AB171: -1.e-004 | AC171: -3.7999999999999999e-002 | AD171: -3.9800000000000002e-002 | AE171: 81.82 | AF171: 88.63 | AG171: 0.69 | AH171: AA- | AI171: 6.4100000000000004e-002 | AJ171: =H171+100*O171 -> 126.8 | AK171: 127.7 | AL171: 89 | AM171: 39 | AN171: 140 | AO171: 0.10400000000000001 | AP171: 13 | AQ171: 正丹转债!
A172: 46 | B172: 123097 | C172: 美力转债 | D172: 300611 | E172: 美力科技 | F172: 机械装备 | G172: 通用设备 | H172: 116.927 | I172: 5.3e-003 | J172: -1.7000000000000001e-003 | K172: 10.45 | L172: 4.7999999999999996e-003 | M172: 121.6 | N172: 9.28 | O172: 3.7999999999999999e-002 | P172: 112.61 | Q172: 24天 | R172: 5.55年 | S172: 3.55年 | T172: 3 | U172: 11 | V172: 2.9999999999999999e-002 | W172: 0.16 | X172: 0.18100000000000002 | Y172: 19 | Z172: 2.81 | AA172: 7.1999999999999998e-003 | AB172: 5.9999999999999995e-004 | AC172: -2.98e-002 | AD172: -3.2099999999999997e-002 | AE172: 80.18 | AF172: 82.14 | AG172: 0.73 | AH172: A+ | AI172: 7.51e-002 | AJ172: =H172+100*O172 -> 120.727 | AK172: 121.2 | AL172: 31 | AM172: 39.1 | AN172: 142 | AO172: 4.2999999999999997e-002 | AP172: 19 | AQ172: 美力转债
A173: 160 | B173: 123057 | C173: 美联转债! | D173: 300586 | E173: 美联新材 | F173: 化工 | G173: 橡胶塑料 | H173: 113.896 | I173: -3.9000000000000003e-003 | J173: -6.7000000000000002e-003 | K173: 9.15 | L173: -1.8200000000000001e-002 | M173: 117.8 | N173: 9.91 | O173: 0.23399999999999999 | P173: 92.33 | Q173: 转股中 | R173: 4.98年 | S173: 2.98年 | T173: 2.07 | U173: 31 | V173: 0.13400000000000001 | W173: 4.2999999999999997e-002 | X173: 4.0000000000000001e-002 | Y173: 48 | Z173: 5.62 | AA173: 6.8999999999999999e-003 | AB173: 5.9999999999999995e-004 | AC173: -2.9600000000000001e-002 | AD173: -3.1699999999999999e-002 | AE173: 85.77 | AF173: 87.52 | AG173: 0.58 | AH173: AA- | AI173: 6.2899999999999998e-002 | AJ173: =H173+100*O173 -> 137.29599999999999 | AK173: 135.5 | AL173: 182 | AM173: 47.9 | AN173: 229 | AO173: 5.4000000000000006e-002 | AP173: 20 | AQ173: 美联转债!
A174: 226 | B174: 128090 | C174: 汽模转2 | D174: 2510 | E174: 天汽模 | F174: 汽车 | G174: 零部件制 | H174: 111.599 | I174: 7.000000000000001e-004 | J174: -5.1000000000000004e-003 | K174: 4.21 | L174: -7.0999999999999995e-003 | M174: 114.9 | N174: 4.23 | O174: 0.121 | P174: 99.53 | Q174: 转股中 | R174: 4.47年 | S174: 2.47年 | T174: 3.1 | U174: 21 | V174: 5.9999999999999998e-002 | W174: 7.8e-002 | X174: 7.8e-002 | Y174: 40 | Z174: 1.97 | AA174: 6.7000000000000002e-003 | AB174: 7.000000000000001e-004 | AC174: -2.8799999999999999e-002 | AD174: -3.1200000000000002e-002 | AE174: 88.19 | AF174: 88 | AG174: 0.63 | AH174: AA- | AI174: 6.2899999999999998e-002 | AJ174: =H174+100*O174 -> 123.699 | AK174: 123.7 | AL174: 50 | AM174: 35.5 | AN174: 109 | AO174: 2.5000000000000001e-002 | AP174: 29 | AQ174: 汽模转2
A175: 38 | B175: 123101 | C175: 拓斯转债! | D175: 300607 | E175: 拓斯达 | F175: 机械装备 | G175: 机器人及 | H175: 111.022 | I175: 9.300000000000001e-003 | J175: -1.5600000000000001e-002 | K175: 19.74 | L175: -1.84e-002 | M175: 115.1 | N175: 26.19 | O175: 0.47299999999999998 | P175: 75.37 | Q175: 2月9天 | R175: 5.67年 | S175: 3.67年 | T175: 6.7 | U175: 10 | V175: 1.3999999999999999e-002 | W175: 8.0000000000000002e-002 | X175: 5.9999999999999998e-002 | Y175: 84 | Z175: 2.34 | AA175: 6.5000000000000006e-003 | AB175: 1.7000000000000001e-003 | AC175: -1.8000000000000002e-002 | AD175: -1.9799999999999998e-002 | AE175: 88.24 | AF175: 91.01 | AG175: 0.34 | AH175: AA | AI175: 4.3099999999999999e-002 | AJ175: =H175+100*O175 -> 158.322 | AK175: 146.7 | AL175: 270 | AM175: 55.7 | AN175: 266 | AO175: -0.371 | AP175: 4 | AQ175: 拓斯转债!
A176: 207 | B176: 110067 | C176: 华安转债! | D176: 600909 | E176: 华安证券 | F176: 金融 | G176: 证券行业 | H176: 107.27 | I176: 1.1200000000000002e-002 | J176: -1.04e-002 | K176: 5.34 | L176: 1.9e-003 | M176: 110.3 | N176: 6.22 | O176: 0.249 | P176: 85.85 | Q176: 转股中 | R176: 4.67年 | S176: 无权 | T176: 28 | U176: 26 | V176: 9.0000000000000011e-003 | W176: 0.11199999999999999 | X176: 9.6000000000000002e-002 | Y176: 251 | Z176: 1.35 | AA176: 6.0999999999999995e-003 | AB176: 1.9e-003 | AC176: 无权 | AD176: 无权 | AE176: 无权 | AF176: 93.32 | AG176: 0.42 | AH176: AAA | AI176: 3.6900000000000002e-002 | AJ176: =H176+100*O176 -> 132.16999999999999 | AK176: 128.7 | AL176: 100 | AM176: 35.4 | AN176: 105 | AO176: -3.9e-002 | AP176: 26 | AQ176: 华安转债!
A177: 91 | B177: 127025 | C177: 冀东转债! | D177: 401 | E177: 冀东水泥 | F177: 建筑 | G177: 水泥 | H177: 106.875 | I177: -2.9999999999999997e-004 | J177: -2.9999999999999997e-004 | K177: 12.19 | L177: -1.6000000000000001e-003 | M177: 110.1 | N177: 15.28 | O177: 0.34000000000000002 | P177: 79.78 | Q177: 转股中 | R177: 5.32年 | S177: 3.33年 | T177: 17.8 | U177: 1 | V177: 1.e-003 | W177: 0.10300000000000001 | X177: 8.199999999999999e-002 | Y177: 172 | Z177: 1.16 | AA177: 5.6999999999999993e-003 | AB177: 2.0999999999999999e-003 | AC177: -1.1000000000000001e-002 | AD177: -1.26e-002 | AE177: 90.34 | AF177: 90.51 | AG177: 0.39 | AH177: AAA | AI177: 3.8100000000000002e-002 | AJ177: =H177+100*O177 -> 140.875 | AK177: 134 | AL177: 169 | AM177: 43.5 | AN177: 188 | AO177: -2.7999999999999997e-002 | AP177: 9 | AQ177: 冀东转债!
A178: 99 | B178: 123074 | C178: 隆利转债! | D178: 300752 | E178: 隆利科技 | F178: 电子 | G178: 液晶显示 | H178: 120.509 | I178: -4.0999999999999995e-003 | J178: -3.4999999999999996e-003 | K178: 19.72 | L178: -1.15e-002 | M178: 124 | N178: 18.33 | O178: 0.12 | P178: 107.58 | Q178: 转股中 | R178: 5.30年 | S178: 3.31年 | T178: 3.24 | U178: 187 | V178: 0.47799999999999998 | W178: 8.5000000000000006e-002 | X178: 9.1999999999999998e-002 | Y178: 38 | Z178: 2.74 | AA178: 5.5000000000000005e-003 | AB178: -2.0999999999999999e-003 | AC178: -4.2099999999999999e-002 | AD178: -4.4199999999999996e-002 | AE178: 83.95 | AF178: 89.8 | AG178: 0.66 | AH178: AA- | AI178: 6.4100000000000004e-002 | AJ178: =H178+100*O178 -> 132.50900000000001 | AK178: 133.4 | AL178: 163 | AM178: 43.6 | AN178: 191 | AO178: 0.105 | AP178: 14 | AQ178: 隆利转债!
A179: 72 | B179: 113043 | C179: 财通转债! | D179: 601108 | E179: 财通证券 | F179: 金融 | G179: 证券行业 | H179: 107 | I179: 6.8999999999999999e-003 | J179: -6.8999999999999999e-003 | K179: 10.16 | L179: 0. | M179: 110.2 | N179: 13.13 | O179: 0.38299999999999995 | P179: 77.38 | Q179: 转股中 | R179: 5.42年 | S179: 无权 | T179: 38 | U179: 30 | V179: 6.9999999999999993e-003 | W179: 0.10400000000000001 | X179: 8.1000000000000003e-002 | Y179: 365 | Z179: 1.59 | AA179: 5.5000000000000005e-003 | AB179: 2.e-003 | AC179: 无权 | AD179: 无权 | AE179: 无权 | AF179: 90.25 | AG179: 0.38 | AH179: AAA | AI179: 3.8100000000000002e-002 | AJ179: =H179+100*O179 -> 145.30000000000001 | AK179: 136.6 | AL179: 196 | AM179: 46.4 | AN179: 215 | AO179: -2.e-002 | AP179: 10 | AQ179: 财通转债!
A180: 189 | B180: 128106 | C180: 华统转债 | D180: 2840 | E180: 华统股份 | F180: 农业 | G180: 农产品加 | H180: 110.31 | I180: -1.e-004 | J180: -1.7000000000000001e-003 | K180: 8.72 | L180: -3.4000000000000002e-003 | M180: 112.9 | N180: 9.37 | O180: 0.185 | P180: 93.06 | Q180: 转股中 | R180: 4.75年 | S180: 2.75年 | T180: 5.35 | U180: 6.1 | V180: 1.e-002 | W180: 0.13699999999999998 | X180: 0.128 | Y180: 39 | Z180: 2.22 | AA180: 5.0000000000000001e-003 | AB180: 0. | AC180: -2.2099999999999998e-002 | AD180: -2.4300000000000002e-002 | AE180: 91.82 | AF180: 93.25 | AG180: 0.52 | AH180: AA | AI180: 4.1900000000000007e-002 | AJ180: =H180+100*O180 -> 128.81 | AK180: 127.6 | AL180: 88 | AM180: 34.3 | AN180: 92 | AO180: -4.2000000000000003e-002 | AP180: 8 | AQ180: 华统转债
A181: 104 | B181: 123071 | C181: 天能转债! | D181: 300569 | E181: 天能重工 | F181: 能源电力 | G181: 风能 | H181: 118.224 | I181: 1.41e-002 | J181: -1.32e-002 | K181: 8.4 | L181: 1.1999999999999999e-003 | M181: 121.1 | N181: 7.73 | O181: 8.8000000000000009e-002 | P181: 108.67 | Q181: 转股中 | R181: 5.28年 | S181: 3.29年 | T181: 7 | U181: 9.4 | V181: 1.1000000000000001e-002 | W181: 0.12300000000000001 | X181: 0.13300000000000001 | Y181: 57 | Z181: 1.41 | AA181: 4.6999999999999993e-003 | AB181: -2.2000000000000001e-003 | AC181: -3.6799999999999999e-002 | AD181: -3.8900000000000004e-002 | AE181: 84.15 | AF181: 87.85 | AG181: 0.69 | AH181: AA- | AI181: 6.4100000000000004e-002 | AJ181: =H181+100*O181 -> 127.024 | AK181: 127.8 | AL181: 91 | AM181: 39.9 | AN181: 152 | AO181: -5.9000000000000004e-002 | AP181: 14 | AQ181: 天能转债!
A182: 222 | B182: 127015 | C182: 希望转债!! | D182: 876 | E182: 新 希 望 | F182: 农业 | G182: 畜牧业 | H182: 107.8 | I182: 4.3e-003 | J182: -2.5000000000000001e-003 | K182: 13.65 | L182: 1.04e-002 | M182: 110 | N182: 19.75 | O182: 0.56000000000000005 | P182: 69.11 | Q182: 转股中 | R182: 4.49年 | S182: 2.49年 | T182: 9.5 | U182: 9.5 | V182: 9.0000000000000011e-003 | W182: 1.4999999999999999e-002 | X182: 1.1000000000000001e-002 | Y182: 615 | Z182: 1.66 | AA182: 4.5999999999999999e-003 | AB182: 4.0000000000000002e-004 | AC182: -1.83e-002 | AD182: -2.0299999999999999e-002 | AE182: 93.32 | AF182: 93.75 | AG182: 0.18 | AH182: AAA | AI182: 3.6900000000000002e-002 | AJ182: =H182+100*O182 -> 163.80000000000001 | AK182: 146.5 | AL182: 268 | AM182: 52.7 | AN182: 256 | AO182: -2.9999999999999999e-002 | AP182: 26 | AQ182: 希望转债!!
A183: 57 | B183: 123092 | C183: 天壕转债 | D183: 300332 | E183: 天壕环境 | F183: 石油天然 | G183: 天然气 | H183: 118.78 | I183: 7.000000000000001e-004 | J183: 9.5999999999999992e-003 | K183: 5.85 | L183: 1.3899999999999999e-002 | M183: 121.6 | N183: 5.2 | O183: 5.5999999999999994e-002 | P183: 112.5 | Q183: 转股中 | R183: 5.46年 | S183: 3.46年 | T183: 4.23 | U183: 9.4 | V183: 1.9e-002 | W183: 8.199999999999999e-002 | X183: 9.1999999999999998e-002 | Y183: 51 | Z183: 1.53 | AA183: 4.4000000000000003e-003 | AB183: -2.3999999999999998e-003 | AC183: -3.4799999999999998e-002 | AD183: -3.7100000000000001e-002 | AE183: 80.72 | AF183: 82.7 | AG183: 0.74 | AH183: A+ | AI183: 7.51e-002 | AJ183: =H183+100*O183 -> 124.38 | AK183: 125.1 | AL183: 63 | AM183: 42.4 | AN183: 179 | AO183: 7.8e-002 | AP183: 8 | AQ183: 天壕转债
A184: 142 | B184: 110073 | C184: 国投转债 | D184: 600061 | E184: 国投资本 | F184: 金融 | G184: 证券行业 | H184: 108.18 | I184: 1.06e-002 | J184: -6.7000000000000002e-003 | K184: 7.98 | L184: 1.01e-002 | M184: 110.5 | N184: 9.9 | O184: 0.34200000000000003 | P184: 80.61 | Q184: 转股中 | R184: 5年14天 | S184: 无权 | T184: 80 | U184: 22 | V184: 3.0000000000000001e-003 | W184: 0.156 | X184: 0.126 | Y184: 513 | Z184: 0.78 | AA184: 4.3e-003 | AB184: 4.0000000000000002e-004 | AC184: 无权 | AD184: 无权 | AE184: 无权 | AF184: 91.76 | AG184: 0.38 | AH184: AAA | AI184: 3.8100000000000002e-002 | AJ184: =H184+100*O184 -> 142.38 | AK184: 135.8 | AL184: 187 | AM184: 44 | AN184: 195 | AO184: -0.17000000000000001 | AP184: 23 | AQ184: 国投转债
A185: 63 | B185: 128141 | C185: 旺能转债 | D185: 2034 | E185: 旺能环境 | F185: 城市公用 | G185: 三废处理 | H185: 113.12 | I185: 7.3000000000000001e-003 | J185: 8.5000000000000006e-003 | K185: 16.12 | L185: 2.6099999999999998e-002 | M185: 115.1 | N185: 15.97 | O185: 0.121 | P185: 100.94 | Q185: 转股中 | R185: 5.44年 | S185: 3.44年 | T185: 14 | U185: 14 | V185: 9.0000000000000011e-003 | W185: 0.20600000000000002 | X185: 0.20800000000000002 | Y185: 68 | Z185: 1.43 | AA185: 3.3e-003 | AB185: -1.7000000000000001e-003 | AC185: -2.4300000000000002e-002 | AD185: -2.6099999999999998e-002 | AE185: 89.09 | AF185: 91.89 | AG185: 0.6 | AH185: AA | AI185: 4.3099999999999999e-002 | AJ185: =H185+100*O185 -> 125.22 | AK185: 125.3 | AL185: 66 | AM185: 33.4 | AN185: 82 | AO185: -4.0000000000000001e-003 | AP185: 6 | AQ185: 旺能转债
A186: 13 | B186: 113048 | C186: 晶科转债! | D186: 601778 | E186: 晶科科技 | F186: 能源电力 | G186: 太阳能 | H186: 115.13 | I186: 3.6299999999999999e-002 | J186: 1.24e-002 | K186: 5.78 | L186: 7.6399999999999996e-002 | M186: 117.1 | N186: 5.48 | O186: 9.1999999999999998e-002 | P186: 105.47 | Q186: 3月22天 | R186: 5.79年 | S186: 3.79年 | T186: 30 | U186: 161 | V186: 4.7e-002 | W186: 0.188 | X186: 0.19800000000000001 | Y186: 160 | Z186: 1.47 | AA186: 3.0000000000000001e-003 | AB186: -2.2000000000000001e-003 | AC186: -2.6499999999999999e-002 | AD186: -2.8199999999999999e-002 | AE186: 87.8 | AF186: 92.12 | AG186: 0.64 | AH186: AA | AI186: 4.3099999999999999e-002 | AJ186: =H186+100*O186 -> 124.33 | AK186: 124.8 | AL186: 60 | AM186: 32.7 | AN186: 78 | AO186: 7.4999999999999997e-002 | AP186: 7 | AQ186: 晶科转债!
A187: 253 | B187: 128074 | C187: 游族转债!! | D187: 2174 | E187: 游族网络 | F187: 通信互联 | G187: 互联网 | H187: 118.6 | I187: 1.4999999999999999e-002 | J187: -1.4999999999999999e-002 | K187: 16.3 | L187: 2.1899999999999999e-002 | M187: 119.9 | N187: 16.97 | O187: 0.23499999999999999 | P187: 96.05 | Q187: 转股中 | R187: 4.21年 | S187: 2.21年 | T187: 6.83 | U187: 351 | V187: 0.42399999999999999 | W187: 4.5999999999999999e-002 | X187: 4.4000000000000004e-002 | Y187: 149 | Z187: 2.92 | AA187: 2.5999999999999999e-003 | AB187: -5.5000000000000005e-003 | AC187: -5.67e-002 | AD187: -5.9200000000000003e-002 | AE187: 93.9 | AF187: 101.25 | AG187: 0 | AH187: AA | AI187: 4.1900000000000007e-002 | AJ187: =H187+100*O187 -> 142.09999999999999 | AK187: 141.1 | AL187: 235 | AM187: 39.9 | AN187: 151 | AO187: -4.9000000000000002e-002 | AP187: 27 | AQ187: 游族转债!!
A188: 17 | B188: 127032 | C188: 苏行转债 | D188: 2966 | E188: 苏州银行 | F188: 金融 | G188: 银行行业 | H188: 113.4 | I188: 2.7000000000000001e-003 | J188: -2.7000000000000001e-003 | K188: 7.65 | L188: 0. | M188: 115.1 | N188: 8.1 | O188: 0.20100000000000001 | P188: 94.44 | Q188: 3月11天 | R188: 5.76年 | S188: 无权 | T188: 50 | U188: 35 | V188: 6.0000000000000001e-003 | W188: 0.19600000000000001 | X188: 0.185 | Y188: 255 | Z188: 0.83 | AA188: 2.5999999999999999e-003 | AB188: -2.0999999999999999e-003 | AC188: 无权 | AD188: 无权 | AE188: 无权 | AF188: 93.14 | AG188: 0.52 | AH188: AAA | AI188: 3.8100000000000002e-002 | AJ188: =H188+100*O188 -> 133.5 | AK188: 132.4 | AL188: 151 | AM188: 39.2 | AN188: 144 | AO188: -2.e-003 | AP188: 7 | AQ188: 苏行转债
A189: 237 | B189: 128081 | C189: 海亮转债! | D189: 2203 | E189: 海亮股份 | F189: 有色金属 | G189: 铜金属 | H189: 113.701 | I189: 1.72e-002 | J189: -1.e-003 | K189: 10.6 | L189: 2.5099999999999997e-002 | M189: 114.9 | N189: 9.69 | O189: 3.9e-002 | P189: 109.39 | Q189: 转股中 | R189: 4.37年 | S189: 2.37年 | T189: 30.1 | U189: 37 | V189: 1.1000000000000001e-002 | W189: 0.14400000000000002 | X189: 0.158 | Y189: 208 | Z189: 2.19 | AA189: 2.5000000000000001e-003 | AB189: -3.7000000000000002e-003 | AC189: -3.7100000000000001e-002 | AD189: -3.9599999999999996e-002 | AE189: 93.28 | AF189: 96.4 | AG189: 0.64 | AH189: AA | AI189: 4.1900000000000007e-002 | AJ189: =H189+100*O189 -> 117.601 | AK189: 118 | AL189: 14 | AM189: 21.6 | AN189: 13 | AO189: 2.7999999999999997e-002 | AP189: 51 | AQ189: 海亮转债!
A190: 152 | B190: 128121 | C190: 宏川转债! | D190: 2930 | E190: 宏川智慧 | F190: 交通运输 | G190: 物流业 | H190: 112 | I190: 3.1800000000000002e-002 | J190: 6.7000000000000002e-003 | K190: 17.45 | L190: 6.6600000000000006e-002 | M190: 113.3 | N190: 19.92 | O190: 0.27899999999999997 | P190: 87.6 | Q190: 转股中 | R190: 5年7天 | S190: 3年8天 | T190: 6.7 | U190: 50 | V190: 6.6000000000000003e-002 | W190: 8.5999999999999993e-002 | X190: 7.5999999999999998e-002 | Y190: 78 | Z190: 3.74 | AA190: 2.3999999999999998e-003 | AB190: -2.5000000000000001e-003 | AC190: -2.3799999999999998e-002 | AD190: -2.6000000000000002e-002 | AE190: 85.35 | AF190: 83.54 | AG190: 0.58 | AH190: AA- | AI190: 6.4100000000000004e-002 | AJ190: =H190+100*O190 -> 139.90000000000001 | AK190: 136.4 | AL190: 192 | AM190: 51 | AN190: 246 | AO190: 7.400000000000001e-002 | AP190: 5 | AQ190: 宏川转债!
A191: 286 | B191: 123024 | C191: 岱勒转债! | D191: 300700 | E191: 岱勒新材 | F191: 机械装备 | G191: 专用设备 | H191: 111.8 | I191: 2.8000000000000004e-003 | J191: -5.0000000000000001e-004 | K191: 13.41 | L191: 4.5000000000000005e-003 | M191: 112.5 | N191: 14.1 | O191: 0.17600000000000002 | P191: 95.11 | Q191: 转股中 | R191: 2.70年 | S191: 0.70年 | T191: 2.1 | U191: 4.2 | V191: 1.8000000000000002e-002 | W191: 0.14599999999999999 | X191: 0.13900000000000001 | Y191: 14 | Z191: 2.28 | AA191: 2.3e-003 | AB191: -6.0999999999999995e-003 | AC191: -0.111 | AD191: -0.114 | AE191: 95.32 | AF191: 93.37 | AG191: 0.51 | AH191: A+ | AI191: 7.2400000000000006e-002 | AJ191: =H191+100*O191 -> 129.40000000000001 | AK191: 128.5 | AL191: 98 | AM191: 33.2 | AN191: 81 | AO191: 2.3e-002 | AP191: 36 | AQ191: 岱勒转债!
A192: 203 | B192: 123045 | C192: 雷迪转债 | D192: 300652 | E192: 雷迪克 | F192: 汽车 | G192: 零部件制 | H192: 117.7 | I192: 9.3999999999999986e-003 | J192: 9.300000000000001e-003 | K192: 20.31 | L192: 2.7799999999999998e-002 | M192: 118.9 | N192: 19.63 | O192: 0.13800000000000001 | P192: 103.46 | Q192: 转股中 | R192: 4.67年 | S192: 2.67年 | T192: 1.66 | U192: 129 | V192: 0.65200000000000002 | W192: 8.6999999999999994e-002 | X192: 8.9999999999999997e-002 | Y192: 19 | Z192: 2.01 | AA192: 2.2000000000000001e-003 | AB192: -4.7999999999999996e-003 | AC192: -4.2800000000000005e-002 | AD192: -4.5400000000000003e-002 | AE192: 85.17 | AF192: 85.89 | AG192: 0.67 | AH192: A+ | AI192: 7.3899999999999993e-002 | AJ192: =H192+100*O192 -> 131.5 | AK192: 131.9 | AL192: 144 | AM192: 46 | AN192: 210 | AO192: 3.2000000000000001e-002 | AP192: 33 | AQ192: 雷迪转债
A193: 155 | B193: 128119 | C193: 龙大转债! | D193: 2726 | E193: 龙大肉食 | F193: 食品饮料 | G193: 肉制品 | H193: 118.91 | I193: -4.5000000000000005e-003 | J193: -2.e-003 | K193: 9.89 | L193: -1.1000000000000001e-002 | M193: 120.2 | N193: 9.38 | O193: 0.128 | P193: 105.44 | Q193: 转股中 | R193: 5年3.1天 | S193: 3年4.1天 | T193: 9.46 | U193: 14 | V193: 1.2e-002 | W193: 9.6000000000000002e-002 | X193: 0.10099999999999999 | Y193: 99 | Z193: 2.84 | AA193: 2.2000000000000001e-003 | AB193: -4.6999999999999993e-003 | AC193: -4.2599999999999999e-002 | AD193: -4.4600000000000001e-002 | AE193: 90.82 | AF193: 97.72 | AG193: 0.59 | AH193: AA | AI193: 4.3099999999999999e-002 | AJ193: =H193+100*O193 -> 131.71000000000001 | AK193: 132.4 | AL193: 152 | AM193: 34.7 | AN193: 98 | AO193: -7.2999999999999995e-002 | AP193: 8 | AQ193: 龙大转债!
A194: 282 | B194: 110057 | C194: 现代转债 | D194: 600420 | E194: 国药现代 | F194: 医药 | G194: 化学制药 | H194: 109.5 | I194: 3.4999999999999996e-003 | J194: -7.000000000000001e-004 | K194: 9.39 | L194: 5.4000000000000003e-003 | M194: 110.3 | N194: 9.79 | O194: 0.14199999999999999 | P194: 95.91 | Q194: 转股中 | R194: 3.73年 | S194: 1.73年 | T194: 16.2 | U194: 25 | V194: 1.3999999999999999e-002 | W194: 0.16800000000000001 | X194: 0.161 | Y194: 96 | Z194: 1.19 | AA194: 2.e-003 | AB194: -3.0999999999999999e-003 | AC194: -3.3000000000000002e-002 | AD194: -3.5699999999999996e-002 | AE194: 96.03 | AF194: 96.62 | AG194: 0.51 | AH194: AAA | AI194: 3.6900000000000002e-002 | AJ194: =H194+100*O194 -> 123.7 | AK194: 123.1 | AL194: 45 | AM194: 26.5 | AN194: 28 | AO194: -5.0000000000000003e-002 | AP194: 23 | AQ194: 现代转债
A195: 30 | B195: 128145 | C195: 日丰转债 | D195: 2953 | E195: 日丰股份 | F195: 家电 | G195: 零部件制 | H195: 114.296 | I195: 3.3e-003 | J195: 5.7999999999999996e-003 | K195: 14.3 | L195: 1.2699999999999999e-002 | M195: 115.4 | N195: 13.66 | O195: 9.1999999999999998e-002 | P195: 104.69 | Q195: 2月20天 | R195: 5.70年 | S195: 3.70年 | T195: 3.8 | U195: 4.6 | V195: 1.1000000000000001e-002 | W195: 0.109 | X195: 0.114 | Y195: 35 | Z195: 2.33 | AA195: 1.7000000000000001e-003 | AB195: -3.0999999999999999e-003 | AC195: -2.4900000000000002e-002 | AD195: -2.6699999999999998e-002 | AE195: 81.76 | AF195: 81.55 | AG195: 0.71 | AH195: AA- | AI195: 6.4100000000000004e-002 | AJ195: =H195+100*O195 -> 123.49600000000001 | AK195: 123.9 | AL195: 53 | AM195: 42.2 | AN195: 176 | AO195: -1.4999999999999999e-002 | AP195: 6 | AQ195: 日丰转债
A196: 122 | B196: 128130 | C196: 景兴转债 | D196: 2067 | E196: 景兴纸业 | F196: 造纸包装 | G196: 包装用纸 | H196: 114.259 | I196: 1.2699999999999999e-002 | J196: -5.5000000000000005e-003 | K196: 3.72 | L196: 1.09e-002 | M196: 115.1 | N196: 3.4 | O196: 4.4000000000000004e-002 | P196: 109.41 | Q196: 转股中 | R196: 5年52天 | S196: 3年53天 | T196: 10.7 | U196: 8.3 | V196: 6.9999999999999993e-003 | W196: 0.24399999999999999 | X196: 0.26700000000000002 | Y196: 44 | Z196: 0.88 | AA196: 1.5e-003 | AB196: -3.8e-003 | AC196: -2.9399999999999999e-002 | AD196: -3.1400000000000004e-002 | AE196: 90.21 | AF196: 93.05 | AG196: 0.66 | AH196: AA | AI196: 4.3099999999999999e-002 | AJ196: =H196+100*O196 -> 118.65900000000001 | AK196: 119.1 | AL196: 20 | AM196: 26.1 | AN196: 27 | AO196: -1.2e-002 | AP196: 15 | AQ196: 景兴转债
A197: 102 | B197: 113605 | C197: 大参转债! | D197: 603233 | E197: 大参林 | F197: 医药 | G197: 医药商业 | H197: 114.39 | I197: -2.3e-003 | J197: -1.9e-003 | K197: 46.9 | L197: -1.8200000000000001e-002 | M197: 115.2 | N197: 69.09 | O197: 0.68500000000000005 | P197: 67.88 | Q197: 转股中 | R197: 5.29年 | S197: 3.29年 | T197: 14.1 | U197: 7.9 | V197: 5.0000000000000001e-003 | W197: 3.7999999999999999e-002 | X197: 2.6000000000000002e-002 | Y197: 371 | Z197: 5.77 | AA197: 1.4000000000000002e-003 | AB197: -3.8e-003 | AC197: -2.8199999999999999e-002 | AD197: -3.0200000000000001e-002 | AE197: 89.77 | AF197: 92.58 | AG197: 0.23 | AH197: AA | AI197: 4.3099999999999999e-002 | AJ197: =H197+100*O197 -> 182.88999999999999 | AK197: 160.9 | AL197: 308 | AM197: 68.3 | AN197: 305 | AO197: -8.8000000000000009e-002 | AP197: 7 | AQ197: 大参转债!
A198: 173 | B198: 123052 | C198: 飞鹿转债 | D198: 300665 | E198: 飞鹿股份 | F198: 化工 | G198: 化工 | H198: 126.037 | I198: 8.3000000000000001e-003 | J198: 4.5999999999999999e-003 | K198: 8.52 | L198: 1.7899999999999999e-002 | M198: 126.8 | N198: 7.05 | O198: 4.2999999999999997e-002 | P198: 120.85 | Q198: 转股中 | R198: 4.90年 | S198: 2.91年 | T198: 1.51 | U198: 18 | V198: 9.4e-002 | W198: 0.10300000000000001 | X198: 0.124 | Y198: 15 | Z198: 2.22 | AA198: 1.2999999999999999e-003 | AB198: -7.7000000000000002e-003 | AC198: -5.91e-002 | AD198: -6.1799999999999994e-002 | AE198: 84.33 | AF198: 90.15 | AG198: 0.72 | AH198: A+ | AI198: 7.3899999999999993e-002 | AJ198: =H198+100*O198 -> 130.33700000000002 | AK198: 131.2 | AL198: 133 | AM198: 41.1 | AN198: 163 | AO198: -2.8999999999999998e-002 | AP198: 17 | AQ198: 飞鹿转债
A199: 27 | B199: 113622 | C199: 杭叉转债! | D199: 603298 | E199: 杭叉集团 | F199: 机械装备 | G199: 通用设备 | H199: 111.88 | I199: 1.e-003 | J199: -1.01e-002 | K199: 16.38 | L199: -3.0200000000000001e-002 | M199: 112.5 | N199: 23.08 | O199: 0.57600000000000007 | P199: 70.97 | Q199: 3月1天 | R199: 5.71年 | S199: 3.71年 | T199: 11.5 | U199: 1.3 | V199: 1.e-003 | W199: 8.1000000000000003e-002 | X199: 5.7999999999999996e-002 | Y199: 142 | Z199: 2.76 | AA199: 1.e-003 | AB199: -3.0000000000000001e-003 | AC199: -2.12e-002 | AD199: -2.2700000000000001e-002 | AE199: 88.52 | AF199: 90.18 | AG199: 0.3 | AH199: AA+ | AI199: 4.0099999999999997e-002 | AJ199: =H199+100*O199 -> 169.48000000000002 | AK199: 152.8 | AL199: 287 | AM199: 62.6 | AN199: 296 | AO199: -9.4e-002 | AP199: 4 | AQ199: 杭叉转债!
A200: 309 | B200: 110047 | C200: 山鹰转债 | D200: 600567 | E200: 山鹰国际 | F200: 造纸包装 | G200: 包装用纸 | H200: 117.23 | I200: 1.e-003 | J200: 1.1200000000000002e-002 | K200: 3.4 | L200: 2.41e-002 | M200: 117.5 | N200: 3.3 | O200: 0.13800000000000001 | P200: 103.03 | Q200: 转股中 | R200: 3.37年 | S200: 1.37年 | T200: 22.5 | U200: 16 | V200: 6.0000000000000001e-003 | W200: 0.14300000000000002 | X200: 0.14699999999999999 | Y200: 157 | Z200: 1.01 | AA200: 7.000000000000001e-004 | AB200: -8.3999999999999995e-003 | AC200: -8.2400000000000001e-002 | AD200: -8.5600000000000009e-002 | AE200: 97.03 | AF200: 103.6 | AG200: 0.51 | AH200: AA+ | AI200: 3.8900000000000004e-002 | AJ200: =H200+100*O200 -> 131.03 | AK200: 131.4 | AL200: 137 | AM200: 27.8 | AN200: 37 | AO200: -1.7000000000000001e-002 | AP200: 30 | AQ200: 山鹰转债
A201: 14 | B201: 123113 | C201: 仙乐转债 | D201: 300791 | E201: 仙乐健康 | F201: 食品饮料 | G201: 食品饮料 | H201: 118.05 | I201: 1.2999999999999999e-003 | J201: 2.1299999999999999e-002 | K201: 49.4 | L201: 3.9599999999999996e-002 | M201: 118.5 | N201: 56.92 | O201: 0.35999999999999999 | P201: 86.79 | Q201: 3月18天 | R201: 5.78年 | S201: 3.78年 | T201: 10.3 | U201: 4.4 | V201: 4.0000000000000001e-003 | W201: 0.115 | X201: 0.10000000000000001 | Y201: 89 | Z201: 2.64 | AA201: 7.000000000000001e-004 | AB201: -4.8999999999999998e-003 | AC201: -3.2300000000000002e-002 | AD201: -3.4000000000000002e-002 | AE201: 81.46 | AF201: 83.35 | AG201: 0.57 | AH201: AA- | AI201: 6.4100000000000004e-002 | AJ201: =H201+100*O201 -> 154.05000000000001 | AK201: 149.3 | AL201: 279 | AM201: 66 | AN201: 303 | AO201: -2.5000000000000001e-002 | AP201: 2 | AQ201: 仙乐转债
A202: 285 | B202: 127012 | C202: 招路转债! | D202: 1965 | E202: 招商公路 | F202: 机场高速 | G202: 高速 | H202: 107.73 | I202: 2.0999999999999999e-003 | J202: -7.000000000000001e-004 | K202: 7.23 | L202: 4.1999999999999997e-003 | M202: 107.9 | N202: 8.63 | O202: 0.28600000000000003 | P202: 83.78 | Q202: 转股中 | R202: 3.70年 | S202: 1.70年 | T202: 50 | U202: 1.1 | V202: 0. | W202: 0.11199999999999999 | X202: 9.4e-002 | Y202: 447 | Z202: 0.89 | AA202: 4.0000000000000002e-004 | AB202: -3.5999999999999999e-003 | AC202: -3.0800000000000001e-002 | AD202: -3.2400000000000005e-002 | AE202: 95.03 | AF202: 94.52 | AG202: 0.34 | AH202: AAA | AI202: 3.6900000000000002e-002 | AJ202: =H202+100*O202 -> 136.33000000000001 | AK202: 131.7 | AL202: 142 | AM202: 36.7 | AN202: 120 | AO202: -3.6000000000000004e-002 | AP202: 30 | AQ202: 招路转债!
A203: 188 | B203: 110070 | C203: 凌钢转债! | D203: 600231 | E203: 凌钢股份 | F203: 钢铁 | G203: 炼钢 | H203: 117.21 | I203: 1.7600000000000001e-002 | J203: 1.2500000000000001e-002 | K203: 2.95 | L203: 4.9800000000000004e-002 | M203: 117.4 | N203: 2.75 | O203: 9.3000000000000013e-002 | P203: 107.27 | Q203: 转股中 | R203: 4.76年 | S203: 2.76年 | T203: 2.17 | U203: 35 | V203: 0.13600000000000001 | W203: 2.6000000000000002e-002 | X203: 2.7999999999999997e-002 | Y203: 84 | Z203: 0.97 | AA203: 2.9999999999999997e-004 | AB203: -6.0999999999999995e-003 | AC203: -4.1200000000000001e-002 | AD203: -4.3499999999999997e-002 | AE203: 92.1 | AF203: 96.96 | AG203: 0.6 | AH203: AA | AI203: 4.1900000000000007e-002 | AJ203: =H203+100*O203 -> 126.50999999999999 | AK203: 127.1 | AL203: 81 | AM203: 30.2 | AN203: 48 | AO203: 3.5000000000000003e-002 | AP203: 22 | AQ203: 凌钢转债!
A204: 121 | B204: 123064 | C204: 万孚转债! | D204: 300482 | E204: 万孚生物 | F204: 医药 | G204: 医疗器械 | H204: 115.1 | I204: 1.8e-003 | J204: -8.9999999999999998e-004 | K204: 57.9 | L204: 2.3999999999999998e-003 | M204: 115.1 | N204: 71.64 | O204: 0.42399999999999999 | P204: 80.82 | Q204: 转股中 | R204: 5年53天 | S204: 3年54天 | T204: 5.99 | U204: 5.4 | V204: 8.0000000000000002e-003 | W204: 2.3e-002 | X204: 1.9e-002 | Y204: 258 | Z204: 6.82 | AA204: 0. | AB204: -5.1999999999999998e-003 | AC204: -3.15e-002 | AD204: -3.3500000000000002e-002 | AE204: 90.2 | AF204: 93.03 | AG204: 0.39 | AH204: AA | AI204: 4.3099999999999999e-002 | AJ204: =H204+100*O204 -> 157.5 | AK204: 149.4 | AL204: 280 | AM204: 56.3 | AN204: 267 | AO204: -0.106 | AP204: 10 | AQ204: 万孚转债!
A205: 85 | B205: 113609 | C205: 永安转债! | D205: 603776 | E205: 永安行 | F205: 城市公用 | G205: 其他 | H205: 120.7 | I205: 2.0499999999999997e-002 | J205: -6.8000000000000005e-003 | K205: 19.9 | L205: 1.7899999999999999e-002 | M205: 120.5 | N205: 16.48 | O205: 0. | P205: 120.75 | Q205: 转股中 | R205: 5.38年 | S205: 3.38年 | T205: 7.4 | U205: 424 | V205: 0.47600000000000003 | W205: 0.16200000000000001 | X205: 0.19500000000000001 | Y205: 46 | Z205: 1.19 | AA205: -2.9999999999999997e-004 | AB205: -6.8000000000000005e-003 | AC205: -4.2000000000000003e-002 | AD205: -4.3899999999999995e-002 | AE205: 83.51 | AF205: 86.88 | AG205: 0.77 | AH205: AA- | AI205: 6.4100000000000004e-002 | AJ205: =H205+100*O205 -> 120.7 | AK205: 120.6 | AL205: 28 | AM205: 33.8 | AN205: 87 | AO205: 4.0000000000000001e-002 | AP205: 22 | AQ205: 永安转债!
A206: 220 | B206: 128094 | C206: 星帅转债 | D206: 2860 | E206: 星帅尔 | F206: 家电 | G206: 零部件制 | H206: 121.5 | I206: 1.46e-002 | J206: -3.5999999999999999e-003 | K206: 16.55 | L206: 1.47e-002 | M206: 121 | N206: 13.8 | O206: 1.3000000000000001e-002 | P206: 119.93 | Q206: 转股中 | R206: 4.52年 | S206: 2.52年 | T206: 2.54 | U206: 14 | V206: 4.4999999999999998e-002 | W206: 7.5999999999999998e-002 | X206: 9.1999999999999998e-002 | Y206: 33 | Z206: 3.23 | AA206: -8.9999999999999998e-004 | AB206: -8.8000000000000005e-003 | AC206: -5.6500000000000002e-002 | AD206: -5.9200000000000003e-002 | AE206: 86.12 | AF206: 88.34 | AG206: 0.75 | AH206: A+ | AI206: 7.3899999999999993e-002 | AJ206: =H206+100*O206 -> 122.8 | AK206: 123.1 | AL206: 44 | AM206: 34.7 | AN206: 99 | AO206: 3.0000000000000001e-003 | AP206: 30 | AQ206: 星帅转债
A207: 105 | B207: 123072 | C207: 乐歌转债! | D207: 300729 | E207: 乐歌股份 | F207: 其他 | G207: 家居用品 | H207: 130.201 | I207: 8.9999999999999998e-004 | J207: -7.000000000000001e-004 | K207: 24.04 | L207: 2.0999999999999999e-003 | M207: 129.6 | N207: 56.12 | O207: 2.04 | P207: 42.84 | Q207: 转股中 | R207: 5.28年 | S207: 3.29年 | T207: 1.42 | U207: 102 | V207: 0.54799999999999993 | W207: 3.3000000000000002e-002 | X207: 1.3999999999999999e-002 | Y207: 43 | Z207: 3.26 | AA207: -8.9999999999999998e-004 | AB207: -9.8999999999999991e-003 | AC207: -5.6900000000000006e-002 | AD207: -6.0199999999999997e-002 | AE207: 83.44 | AF207: 89.52 | AG207: 0.06 | AH207: A+ | AI207: 7.51e-002 | AJ207: =H207+100*O207 -> 334.20100000000002 | AK207: 217.6 | AL207: 345 | AM207: 128 | AN207: 348 | AO207: -2.7000000000000003e-002 | AP207: 8 | AQ207: 乐歌转债!
A208: 26 | B208: 110079 | C208: 杭银转债 | D208: 600926 | E208: 杭州银行 | F208: 金融 | G208: 银行行业 | H208: 113.18 | I208: 1.e-004 | J208: -1.3000000000000001e-002 | K208: 13.96 | L208: -2.9900000000000003e-002 | M208: 112.4 | N208: 16.71 | O208: 0.35499999999999998 | P208: 83.54 | Q208: 3月1天 | R208: 5.72年 | S208: 3.72年 | T208: 150 | U208: 126 | V208: 6.9999999999999993e-003 | W208: 0.18100000000000002 | X208: 0.151 | Y208: 828 | Z208: 1.25 | AA208: -1.1999999999999999e-003 | AB208: -5.1999999999999998e-003 | AC208: -2.4300000000000002e-002 | AD208: -2.5699999999999997e-002 | AE208: 89.06 | AF208: 91.05 | AG208: 0.43 | AH208: AAA | AI208: 3.8100000000000002e-002 | AJ208: =H208+100*O208 -> 148.68000000000001 | AK208: 142.8 | AL208: 247 | AM208: 51.8 | AN208: 252 | AO208: -5.7000000000000002e-002 | AP208: 11 | AQ208: 杭银转债
A209: 114 | B209: 113603 | C209: 东缆转债! | D209: 603606 | E209: 东方电缆 | F209: 能源电力 | G209: 电力设备 | H209: 115.89 | I209: 1.03e-002 | J209: 1.04e-002 | K209: 21.34 | L209: 4.2000000000000003e-002 | M209: 115.1 | N209: 23.65 | O209: 0.28399999999999997 | P209: 90.23 | Q209: 转股中 | R209: 5.21年 | S209: 3.21年 | T209: 8 | U209: 32 | V209: 3.4000000000000002e-002 | W209: 5.7000000000000002e-002 | X209: 5.2000000000000005e-002 | Y209: 140 | Z209: 4.18 | AA209: -1.2999999999999999e-003 | AB209: -6.5000000000000006e-003 | AC209: -3.2899999999999999e-002 | AD209: -3.49e-002 | AE209: 89.96 | AF209: 92.79 | AG209: 0.49 | AH209: AA | AI209: 4.3099999999999999e-002 | AJ209: =H209+100*O209 -> 144.28999999999999 | AK209: 141.5 | AL209: 238 | AM209: 48.8 | AN209: 232 | AO209: 7.9000000000000001e-002 | AP209: 7 | AQ209: 东缆转债!
A210: 250 | B210: 128078 | C210: 太极转债! | D210: 2368 | E210: 太极股份 | F210: 计算机及 | G210: 软件开发 | H210: 117.7 | I210: 1.3300000000000001e-002 | J210: -1.3300000000000001e-002 | K210: 21.62 | L210: 3.9399999999999998e-002 | M210: 116.9 | N210: 22.4 | O210: 0.21899999999999997 | P210: 96.52 | Q210: 转股中 | R210: 4.28年 | S210: 2.29年 | T210: 9.6 | U210: 94 | V210: 8.3000000000000004e-002 | W210: 7.6999999999999999e-002 | X210: 7.400000000000001e-002 | Y210: 125 | Z210: 3.74 | AA210: -1.6000000000000001e-003 | AB210: -8.5000000000000006e-003 | AC210: -5.2000000000000005e-002 | AD210: -5.45e-002 | AE210: 93.61 | AF210: 98.42 | AG210: 0 | AH210: AA | AI210: 4.1900000000000007e-002 | AJ210: =H210+100*O210 -> 139.59999999999999 | AK210: 138.9 | AL210: 216 | AM210: 40.5 | AN210: 155 | AO210: 2.8999999999999998e-002 | AP210: 10 | AQ210: 太极转债!
A211: 4 | B211: 123116 | C211: 万兴转债 | D211: 300624 | E211: 万兴科技 | F211: 计算机及 | G211: 软件开发 | H211: 122.5 | I211: -4.8999999999999998e-003 | J211: -5.8999999999999999e-003 | K211: 54.87 | L211: -1.4499999999999999e-002 | M211: 121.4 | N211: 49.78 | O211: 0.111 | P211: 110.22 | Q211: 5月10天 | R211: 5.92年 | S211: 3.92年 | T211: 3.79 | U211: 46 | V211: 9.9000000000000005e-002 | W211: 5.2999999999999999e-002 | X211: 5.9000000000000004e-002 | Y211: 71 | Z211: 8.02 | AA211: -1.6000000000000001e-003 | AB211: -7.7000000000000002e-003 | AC211: -3.8900000000000004e-002 | AD211: -4.0800000000000003e-002 | AE211: 77.84 | AF211: 79.82 | AG211: 0.74 | AH211: A+ | AI211: 7.51e-002 | AJ211: =H211+100*O211 -> 133.59999999999999 | AK211: 134.8 | AL211: 178 | AM211: 55 | AN211: 263 | AO211: -0.113 | AP211: 3 | AQ211: 万兴转债
A212: 235 | B212: 128082 | C212: 华锋转债! | D212: 2806 | E212: 华锋股份 | F212: 电子 | G212: 元器件制 | H212: 122.3 | I212: 1.47e-002 | J212: -4.3e-003 | K212: 11.13 | L212: 1.37e-002 | M212: 121.4 | N212: 9.13 | O212: 3.0000000000000001e-003 | P212: 121.91 | Q212: 转股中 | R212: 4.40年 | S212: 2.41年 | T212: 3.11 | U212: 77 | V212: 0.20300000000000001 | W212: 0.155 | X212: 0.18899999999999997 | Y212: 20 | Z212: 2.02 | AA212: -1.7000000000000001e-003 | AB212: -1.e-002 | AC212: -6.0100000000000001e-002 | AD212: -6.3200000000000006e-002 | AE212: 85.18 | AF212: 85.98 | AG212: 0.76 | AH212: A | AI212: 8.3900000000000002e-002 | AJ212: =H212+100*O212 -> 122.59999999999999 | AK212: 122.7 | AL212: 41 | AM212: 36.7 | AN212: 123 | AO212: 9.4e-002 | AP212: 54 | AQ212: 华锋转债!
A213: 62 | B213: 128142 | C213: 新乳转债 | D213: 2946 | E213: 新乳业 | F213: 食品饮料 | G213: 乳制品 | H213: 116.21 | I213: -8.0000000000000002e-003 | J213: 8.8999999999999999e-003 | K213: 13.79 | L213: 2.8999999999999998e-003 | M213: 115.1 | N213: 18.47 | O213: 0.55600000000000005 | P213: 74.66 | Q213: 转股中 | R213: 5.44年 | S213: 3.44年 | T213: 7.18 | U213: 3.9 | V213: 5.0000000000000001e-003 | W213: 5.9999999999999998e-002 | X213: 4.4999999999999998e-002 | Y213: 120 | Z213: 4.6 | AA213: -1.8e-003 | AB213: -6.7000000000000002e-003 | AC213: -3.1600000000000003e-002 | AD213: -3.3399999999999999e-002 | AE213: 89.08 | AF213: 91.88 | AG213: 0.32 | AH213: AA | AI213: 4.3099999999999999e-002 | AJ213: =H213+100*O213 -> 171.81 | AK213: 157.8 | AL213: 301 | AM213: 65.9 | AN213: 302 | AO213: -0.10400000000000001 | AP213: 4 | AQ213: 新乳转债
A214: 44 | B214: 123099 | C214: 普利转债 | D214: 300630 | E214: 普利制药 | F214: 医药 | G214: 化学制药 | H214: 124.8 | I214: 4.7999999999999996e-003 | J214: -7.0999999999999995e-003 | K214: 47.84 | L214: -3.4999999999999996e-003 | M214: 123.5 | N214: 46.03 | O214: 0.20100000000000001 | P214: 103.93 | Q214: 45天 | R214: 5.59年 | S214: 3.59年 | T214: 8.5 | U214: 6.3 | V214: 6.0000000000000001e-003 | W214: 4.0999999999999995e-002 | X214: 4.2000000000000003e-002 | Y214: 209 | Z214: 9.58 | AA214: -1.9e-003 | AB214: -8.8999999999999999e-003 | AC214: -4.82e-002 | AD214: -5.0000000000000003e-002 | AE214: 82.42 | AF214: 87.87 | AG214: 0.65 | AH214: AA- | AI214: 6.4100000000000004e-002 | AJ214: =H214+100*O214 -> 144.90000000000001 | AK214: 145.7 | AL214: 264 | AM214: 57.8 | AN214: 278 | AO214: -5.7000000000000002e-002 | AP214: 4 | AQ214: 普利转债
A215: 149 | B215: 127020 | C215: 中金转债 | D215: 60 | E215: 中金岭南 | F215: 有色金属 | G215: 有色行业 | H215: 114.9 | I215: 3.2799999999999996e-002 | J215: -3.7000000000000002e-003 | K215: 4.81 | L215: 4.7899999999999998e-002 | M215: 113.7 | N215: 4.63 | O215: 0.106 | P215: 103.89 | Q215: 转股中 | R215: 5年10天 | S215: 3年11天 | T215: 38 | U215: 95 | V215: 2.2000000000000002e-002 | W215: 0.221 | X215: 0.23000000000000001 | Y215: 172 | Z215: 1.44 | AA215: -2.0999999999999999e-003 | AB215: -6.9999999999999993e-003 | AC215: -3.5400000000000001e-002 | AD215: -3.6799999999999999e-002 | AE215: 90.43 | AF215: 93.57 | AG215: 0.61 | AH215: AA+ | AI215: 4.0099999999999997e-002 | AJ215: =H215+100*O215 -> 125.5 | AK215: 125.9 | AL215: 71 | AM215: 32.3 | AN215: 74 | AO215: 6.0999999999999999e-002 | AP215: 14 | AQ215: 中金转债
A216: 98 | B216: 113606 | C216: 荣泰转债 | D216: 603579 | E216: 荣泰健康 | F216: 机械装备 | G216: 专用设备 | H216: 122.75 | I216: -6.5000000000000006e-003 | J216: -1.e-002 | K216: 37.24 | L216: -2.3099999999999999e-002 | M216: 121.2 | N216: 32.83 | O216: 8.199999999999999e-002 | P216: 113.43 | Q216: 转股中 | R216: 5.31年 | S216: 3.31年 | T216: 6 | U216: 10 | V216: 1.3999999999999999e-002 | W216: 0.115 | X216: 0.13100000000000001 | Y216: 52 | Z216: 3.11 | AA216: -2.3999999999999998e-003 | AB216: -9.1999999999999998e-003 | AC216: -4.6699999999999998e-002 | AD216: -4.8799999999999996e-002 | AE216: 84.13 | AF216: 87.82 | AG216: 0.71 | AH216: AA- | AI216: 6.4100000000000004e-002 | AJ216: =H216+100*O216 -> 130.94999999999999 | AK216: 132.1 | AL216: 146 | AM216: 44.2 | AN216: 198 | AO216: -9.0000000000000011e-003 | AP216: 10 | AQ216: 荣泰转债
A217: 140 | B217: 123062 | C217: 三超转债 | D217: 300554 | E217: 三超新材 | F217: 机械装备 | G217: 通用设备 | H217: 121.3 | I217: 0. | J217: -1.0500000000000001e-002 | K217: 19.75 | L217: -1.3500000000000002e-002 | M217: 119.7 | N217: 17.13 | O217: 5.2000000000000005e-002 | P217: 115.29 | Q217: 转股中 | R217: 5年17天 | S217: 3年18天 | T217: 1.95 | U217: 100 | V217: 0.42200000000000004 | W217: 0.105 | X217: 0.121 | Y217: 18 | Z217: 3.53 | AA217: -2.7000000000000001e-003 | AB217: -9.3999999999999986e-003 | AC217: -4.5499999999999999e-002 | AD217: -4.8000000000000001e-002 | AE217: 80.75 | AF217: 80.16 | AG217: 0.78 | AH217: A | AI217: 8.5099999999999995e-002 | AJ217: =H217+100*O217 -> 126.5 | AK217: 127.3 | AL217: 84 | AM217: 46.6 | AN217: 217 | AO217: 9.3000000000000013e-002 | AP217: 23 | AQ217: 三超转债
A218: 210 | B218: 113568 | C218: 新春转债! | D218: 603667 | E218: 五洲新春 | F218: 机械装备 | G218: 通用设备 | H218: 125.92 | I218: 1.7899999999999999e-002 | J218: -1.4000000000000002e-003 | K218: 11.11 | L218: 2.2099999999999998e-002 | M218: 124.3 | N218: 8.75 | O218: -8.0000000000000002e-003 | P218: 126.97 | Q218: 转股中 | R218: 4.66年 | S218: 2.66年 | T218: 3.3 | U218: 160 | V218: 0.38700000000000001 | W218: 0.10099999999999999 | X218: 0.129 | Y218: 32 | Z218: 1.83 | AA218: -2.8000000000000004e-003 | AB218: -1.15e-002 | AC218: -6.54e-002 | AD218: -6.8000000000000005e-002 | AE218: 87.9 | AF218: 94.2 | AG218: 0.75 | AH218: AA- | AI218: 6.2899999999999998e-002 | AJ218: =H218+100*O218 -> 125.12 | AK218: 124.9 | AL218: 62 | AM218: 30.7 | AN218: 54 | AO218: 0.183 | AP218: 49 | AQ218: 新春转债!
A219: 233 | B219: 110063 | C219: 鹰19转债 | D219: 600567 | E219: 山鹰国际 | F219: 造纸包装 | G219: 包装用纸 | H219: 117.52 | I219: -1.4000000000000002e-003 | J219: 1.54e-002 | K219: 3.4 | L219: 2.41e-002 | M219: 115.9 | N219: 3.26 | O219: 0.127 | P219: 104.29 | Q219: 转股中 | R219: 4.43年 | S219: 2.43年 | T219: 18.5 | U219: 9.8 | V219: 5.0000000000000001e-003 | W219: 0.11800000000000001 | X219: 0.12300000000000001 | Y219: 157 | Z219: 1.01 | AA219: -3.2000000000000002e-003 | AB219: -9.4999999999999998e-003 | AC219: -4.9100000000000005e-002 | AD219: -5.1299999999999998e-002 | AE219: 93.58 | AF219: 98.2 | AG219: 0.58 | AH219: AA+ | AI219: 3.8900000000000004e-002 | AJ219: =H219+100*O219 -> 130.22 | AK219: 130.7 | AL219: 130 | AM219: 32.5 | AN219: 77 | AO219: -1.7000000000000001e-002 | AP219: 33 | AQ219: 鹰19转债
A220: 354 | B220: 113502 | C220: 嘉澳转债! | D220: 603822 | E220: 嘉澳环保 | F220: 化工 | G220: 化工 | H220: 112.27 | I220: -2.8999999999999998e-003 | J220: 2.3e-003 | K220: 28.16 | L220: -2.5899999999999999e-002 | M220: 111.3 | N220: 44.64 | O220: 0.78000000000000003 | P220: 63.08 | Q220: 转股中 | R220: 2.34年 | S220: 0.34年 | T220: 1.85 | U220: 8.9 | V220: 4.2999999999999997e-002 | W220: 8.900000000000001e-002 | X220: 5.5999999999999994e-002 | Y220: 21 | Z220: 2.58 | AA220: -3.8e-003 | AB220: -1.26e-002 | AC220: -0.19600000000000001 | AD220: -0.20300000000000001 | AE220: 98.79 | AF220: 97.08 | AG220: 0.02 | AH220: AA- | AI220: 6.1399999999999996e-002 | AJ220: =H220+100*O220 -> 190.26999999999998 | AK220: 161.5 | AL220: 310 | AM220: 62.7 | AN220: 297 | AO220: 1.3000000000000001e-002 | AP220: 36 | AQ220: 嘉澳转债!
A221: 303 | B221: 113525 | C221: 台华转债! | D221: 603055 | E221: 台华新材 | F221: 服装纺织 | G221: 纺织行业 | H221: 115.78 | I221: -2.1600000000000001e-002 | J221: 1.15e-002 | K221: 7.37 | L221: -2.2499999999999999e-002 | M221: 114.3 | N221: 7.78 | O221: 0.222 | P221: 94.73 | Q221: 转股中 | R221: 3.44年 | S221: 1.44年 | T221: 4.69 | U221: 33 | V221: 5.9999999999999998e-002 | W221: 7.6999999999999999e-002 | X221: 7.2999999999999995e-002 | Y221: 61 | Z221: 2.02 | AA221: -3.8e-003 | AB221: -1.1200000000000002e-002 | AC221: -7.1900000000000006e-002 | AD221: -7.4900000000000008e-002 | AE221: 96.29 | AF221: 99.53 | AG221: 0.45 | AH221: AA | AI221: 4.1900000000000007e-002 | AJ221: =H221+100*O221 -> 137.97999999999999 | AK221: 136.8 | AL221: 199 | AM221: 37.3 | AN221: 129 | AO221: 0.113 | AP221: 19 | AQ221: 台华转债!
A222: 180 | B222: 113579 | C222: 健友转债! | D222: 603707 | E222: 健友股份 | F222: 医药 | G222: 原料药 | H222: 116 | I222: -2.0000000000000001e-004 | J222: 1.1999999999999999e-003 | K222: 38.31 | L222: 2.0999999999999999e-003 | M222: 113.9 | N222: 42.01 | O222: 0.27200000000000002 | P222: 91.19 | Q222: 转股中 | R222: 4.79年 | S222: 2.79年 | T222: 5.03 | U222: 2 | V222: 3.0000000000000001e-003 | W222: 1.3999999999999999e-002 | X222: 1.3000000000000001e-002 | Y222: 359 | Z222: 9.3 | AA222: -3.9000000000000003e-003 | AB222: -9.1000000000000004e-003 | AC222: -3.8399999999999997e-002 | AD222: -4.0500000000000001e-002 | AE222: 91.68 | AF222: 93.94 | AG222: 0.49 | AH222: AA | AI222: 4.1900000000000007e-002 | AJ222: =H222+100*O222 -> 143.19999999999999 | AK222: 140.8 | AL222: 234 | AM222: 46.9 | AN222: 222 | AO222: -7.2999999999999995e-002 | AP222: 9 | AQ222: 健友转债!
A223: 298 | B223: 110051 | C223: 中天转债! | D223: 600522 | E223: 中天科技 | F223: 通信互联 | G223: 通信设备 | H223: 114.92 | I223: 7.7000000000000002e-003 | J223: -4.5000000000000005e-003 | K223: 9.97 | L223: 6.0999999999999995e-003 | M223: 113.3 | N223: 9.99 | O223: 0.152 | P223: 99.8 | Q223: 转股中 | R223: 3.64年 | S223: 1.64年 | T223: 39.6 | U223: 16 | V223: 3.0000000000000001e-003 | W223: 0.13 | X223: 0.129 | Y223: 306 | Z223: 1.31 | AA223: -4.0000000000000001e-003 | AB223: -1.0500000000000001e-002 | AC223: -6.0199999999999997e-002 | AD223: -6.3e-002 | AE223: 96 | AF223: 98.86 | AG223: 0.53 | AH223: AA+ | AI223: 3.8900000000000004e-002 | AJ223: =H223+100*O223 -> 130.12 | AK223: 130 | AL223: 121 | AM223: 31.2 | AN223: 60 | AO223: 1.e-002 | AP223: 23 | AQ223: 中天转债!
A224: 228 | B224: 123038 | C224: 联得转债! | D224: 300545 | E224: 联得装备 | F224: 机械装备 | G224: 专用设备 | H224: 120.75 | I224: -2.9999999999999997e-004 | J224: -7.4000000000000003e-003 | K224: 24.7 | L224: -1.1599999999999999e-002 | M224: 118.6 | N224: 24.07 | O224: 0.17699999999999999 | P224: 102.62 | Q224: 转股中 | R224: 4.46年 | S224: 2.46年 | T224: 1.47 | U224: 25 | V224: 0.13900000000000001 | W224: 3.4000000000000002e-002 | X224: 3.4000000000000002e-002 | Y224: 44 | Z224: 4.54 | AA224: -4.0999999999999995e-003 | AB224: -1.1299999999999999e-002 | AC224: -5.6299999999999996e-002 | AD224: -5.8899999999999994e-002 | AE224: 86.29 | AF224: 86.94 | AG224: 0.66 | AH224: A+ | AI224: 7.3899999999999993e-002 | AJ224: =H224+100*O224 -> 138.44999999999999 | AK224: 138.9 | AL224: 217 | AM224: 51.9 | AN224: 255 | AO224: 6.9000000000000006e-002 | AP224: 18 | AQ224: 联得转债!
A225: 28 | B225: 127031 | C225: 洋丰转债! | D225: 902 | E225: 新洋丰 | F225: 化工 | G225: 农化 | H225: 120 | I225: 5.3699999999999998e-002 | J225: -1.0500000000000001e-002 | K225: 16.86 | L225: 9.98e-002 | M225: 117.1 | N225: 19.94 | O225: 0.41899999999999998 | P225: 84.55 | Q225: 3月1天 | R225: 5.71年 | S225: 3.71年 | T225: 10 | U225: 209 | V225: 0.17199999999999999 | W225: 4.4999999999999998e-002 | X225: 3.7999999999999999e-002 | Y225: 220 | Z225: 3.03 | AA225: -4.3e-003 | AB225: -9.5999999999999992e-003 | AC225: -3.7499999999999999e-002 | AD225: -3.9199999999999999e-002 | AE225: 88.09 | AF225: 92.43 | AG225: 0.43 | AH225: AA | AI225: 4.3099999999999999e-002 | AJ225: =H225+100*O225 -> 161.90000000000001 | AK225: 155.4 | AL225: 296 | AM225: 63 | AN225: 298 | AO225: 0.111 | AP225: 3 | AQ225: 洋丰转债!
A226: 61 | B226: 123090 | C226: 三诺转债 | D226: 300298 | E226: 三诺生物 | F226: 医药 | G226: 医疗器械 | H226: 119.995 | I226: -1.03e-002 | J226: 8.6999999999999994e-003 | K226: 29.83 | L226: -3.7000000000000002e-003 | M226: 117.1 | N226: 35.15 | O226: 0.41399999999999998 | P226: 84.86 | Q226: 转股中 | R226: 5.45年 | S226: 3.45年 | T226: 5 | U226: 4.5 | V226: 8.0000000000000002e-003 | W226: 2.9999999999999999e-002 | X226: 2.5000000000000001e-002 | Y226: 169 | Z226: 6.32 | AA226: -4.5000000000000005e-003 | AB226: -1.e-002 | AC226: -4.0099999999999997e-002 | AD226: -4.1900000000000007e-002 | AE226: 89.05 | AF226: 93.44 | AG226: 0.43 | AH226: AA | AI226: 4.3099999999999999e-002 | AJ226: =H226+100*O226 -> 161.39500000000001 | AK226: 155.1 | AL226: 293 | AM226: 61.7 | AN226: 293 | AO226: -1.3000000000000001e-002 | AP226: 3 | AQ226: 三诺转债
A227: 293 | B227: 128057 | C227: 博彦转债 | D227: 2649 | E227: 博彦科技 | F227: 计算机及 | G227: 软件开发 | H227: 118.36 | I227: 5.0000000000000001e-004 | J227: -5.0000000000000001e-004 | K227: 9.92 | L227: 0. | M227: 116.3 | N227: 8.5 | O227: 1.3999999999999999e-002 | P227: 116.71 | Q227: 转股中 | R227: 3.65年 | S227: 1.66年 | T227: 5.04 | U227: 35 | V227: 5.9000000000000004e-002 | W227: 9.5000000000000001e-002 | X227: 0.111 | Y227: 53 | Z227: 1.74 | AA227: -4.8999999999999998e-003 | AB227: -1.2699999999999999e-002 | AC227: -7.4999999999999997e-002 | AD227: -7.7699999999999991e-002 | AE227: 92.07 | AF227: 93.47 | AG227: 0.73 | AH227: AA- | AI227: 6.2899999999999998e-002 | AJ227: =H227+100*O227 -> 119.76000000000001 | AK227: 120 | AL227: 26 | AM227: 26.5 | AN227: 29 | AO227: -3.1e-002 | AP227: 25 | AQ227: 博彦转债
A228: 225 | B228: 128091 | C228: 新天转债 | D228: 2873 | E228: 新天药业 | F228: 医药 | G228: 中药 | H228: 122 | I228: 3.3e-003 | J228: 3.4999999999999996e-003 | K228: 17.51 | L228: 9.7999999999999997e-003 | M228: 119.4 | N228: 16.39 | O228: 0.14199999999999999 | P228: 106.83 | Q228: 转股中 | R228: 4.47年 | S228: 2.48年 | T228: 1.76 | U228: 40 | V228: 0.185 | W228: 8.5999999999999993e-002 | X228: 9.1999999999999998e-002 | Y228: 21 | Z228: 2.52 | AA228: -4.8999999999999998e-003 | AB228: -1.24e-002 | AC228: -5.7699999999999994e-002 | AD228: -6.0599999999999994e-002 | AE228: 86.77 | AF228: 87.54 | AG228: 0.69 | AH228: A+ | AI228: 7.3899999999999993e-002 | AJ228: =H228+100*O228 -> 136.19999999999999 | AK228: 137.2 | AL228: 202 | AM228: 49.6 | AN228: 239 | AO228: -4.2999999999999997e-002 | AP228: 18 | AQ228: 新天转债
A229: 269 | B229: 113536 | C229: 三星转债 | D229: 603578 | E229: 三星新材 | F229: 家电 | G229: 零部件制 | H229: 116.57 | I229: 3.7000000000000002e-003 | J229: 2.9999999999999997e-004 | K229: 14.01 | L229: 7.1999999999999998e-003 | M229: 114.3 | N229: 13.76 | O229: 0.14499999999999999 | P229: 101.82 | Q229: 转股中 | R229: 3.89年 | S229: 1.89年 | T229: 1.49 | U229: 4.6 | V229: 2.6000000000000002e-002 | W229: 8.3000000000000004e-002 | X229: 8.4000000000000005e-002 | Y229: 18 | Z229: 1.72 | AA229: -5.1000000000000004e-003 | AB229: -1.1699999999999999e-002 | AC229: -5.96e-002 | AD229: -6.2e-002 | AE229: 94.52 | AF229: 97.71 | AG229: 0.55 | AH229: AA | AI229: 4.1900000000000007e-002 | AJ229: =H229+100*O229 -> 131.06999999999999 | AK229: 131.3 | AL229: 134 | AM229: 33.6 | AN229: 84 | AO229: -3.3000000000000002e-002 | AP229: 34 | AQ229: 三星转债
A230: 352 | B230: 123002 | C230: 国祯转债!! | D230: 300388 | E230: 节能国祯 | F230: 城市公用 | G230: 三废处理 | H230: 110.178 | I230: 1.0800000000000001e-002 | J230: -4.0999999999999995e-003 | K230: 7.6 | L230: 1.6e-002 | M230: 108.8 | N230: 8.36 | O230: 0.21199999999999999 | P230: 90.91 | Q230: 转股中 | R230: 2.38年 | S230: 0.38年 | T230: 2.52 | U230: 1.6 | V230: 6.0000000000000001e-003 | W230: 4.7e-002 | X230: 4.2999999999999997e-002 | Y230: 53 | Z230: 1.44 | AA230: -5.4000000000000003e-003 | AB230: -1.2199999999999999e-002 | AC230: -0.153 | AD230: -0.158 | AE230: 99.39 | AF230: 99.17 | AG230: 0.42 | AH230: AA | AI230: 4.0399999999999998e-002 | AJ230: =H230+100*O230 -> 131.37799999999999 | AK230: 129.4 | AL230: 113 | AM230: 30.1 | AN230: 46 | AO230: -2.4e-002 | AP230: 15 | AQ230: 国祯转债!!
A231: 190 | B231: 123048 | C231: 应急转债! | D231: 300527 | E231: 中船应急 | F231: 机械装备 | G231: 专用设备 | H231: 115.8 | I231: 4.3e-003 | J231: -1.34e-002 | K231: 9.07 | L231: -1.52e-002 | M231: 112.8 | N231: 8.9 | O231: 0.13600000000000001 | P231: 101.91 | Q231: 转股中 | R231: 4.75年 | S231: 2.75年 | T231: 3.79 | U231: 23 | V231: 5.2000000000000005e-002 | W231: 4.2999999999999997e-002 | X231: 4.4000000000000004e-002 | Y231: 87 | Z231: 3.28 | AA231: -5.6000000000000008e-003 | AB231: -1.0500000000000001e-002 | AC231: -3.8599999999999995e-002 | AD231: -4.07e-002 | AE231: 92.49 | AF231: 94.41 | AG231: 0.6 | AH231: AA+ | AI231: 3.8900000000000004e-002 | AJ231: =H231+100*O231 -> 129.40000000000001 | AK231: 129.7 | AL231: 116 | AM231: 35.3 | AN231: 104 | AO231: -3.5000000000000003e-002 | AP231: 16 | AQ231: 应急转债!
A232: 40 | B232: 113045 | C232: 环旭转债! | D232: 601231 | E232: 环旭电子 | F232: 电子 | G232: 电子产品 | H232: 115.65 | I232: -3.7000000000000002e-003 | J232: -3.4000000000000002e-003 | K232: 16.3 | L232: -1.7500000000000002e-002 | M232: 112 | N232: 19.75 | O232: 0.40100000000000002 | P232: 82.53 | Q232: 5月4天 | R232: 5.65年 | S232: 2.65年 | T232: 34.5 | U232: 15 | V232: 4.0000000000000001e-003 | W232: 9.6000000000000002e-002 | X232: 7.9000000000000001e-002 | Y232: 360 | Z232: 2.91 | AA232: -5.6999999999999993e-003 | AB232: -9.5999999999999992e-003 | AC232: -4.0599999999999997e-002 | AD232: -4.2500000000000003e-002 | AE232: 92.12 | AF232: 89.93 | AG232: 0.41 | AH232: AA+ | AI232: 4.0099999999999997e-002 | AJ232: =H232+100*O232 -> 155.75 | AK232: 148.8 | AL232: 276 | AM232: 56.7 | AN232: 271 | AO232: 9.0000000000000011e-003 | AP232: 4 | AQ232: 环旭转债!
A233: 125 | B233: 113039 | C233: 嘉泽转债! | D233: 601619 | E233: 嘉泽新能 | F233: 能源电力 | G233: 风能 | H233: 117.07 | I233: 1.47e-002 | J233: 3.9000000000000003e-003 | K233: 3.89 | L233: 2.64e-002 | M233: 113.1 | N233: 3.46 | O233: 4.0999999999999995e-002 | P233: 112.43 | Q233: 转股中 | R233: 5年45天 | S233: 3年46天 | T233: 5.41 | U233: 167 | V233: 0.26400000000000001 | W233: 5.9000000000000004e-002 | X233: 6.6000000000000003e-002 | Y233: 92 | Z233: 2.26 | AA233: -6.8000000000000005e-003 | AB233: -1.1399999999999999e-002 | AC233: -3.6799999999999999e-002 | AD233: -3.8699999999999998e-002 | AE233: 90.29 | AF233: 91.51 | AG233: 0.71 | AH233: AA | AI233: 4.3099999999999999e-002 | AJ233: =H233+100*O233 -> 121.16999999999999 | AK233: 121.7 | AL233: 33 | AM233: 30.2 | AN233: 49 | AO233: 1.1000000000000001e-002 | AP233: 33 | AQ233: 嘉泽转债!
A234: 291 | B234: 110053 | C234: 苏银转债! | D234: 600919 | E234: 江苏银行 | F234: 金融 | G234: 银行行业 | H234: 121.49 | I234: -1.2999999999999999e-003 | J234: -5.1999999999999998e-003 | K234: 6.84 | L234: -1.1599999999999999e-002 | M234: 118.3 | N234: 6.37 | O234: 0.13100000000000001 | P234: 107.38 | Q234: 转股中 | R234: 3.68年 | S234: 无权 | T234: 200 | U234: 183 | V234: 8.0000000000000002e-003 | W234: 0.19800000000000001 | X234: 0.21299999999999999 | Y234: 1010. | Z234: 0.72 | AA234: -7.4000000000000003e-003 | AB234: -1.6e-002 | AC234: 无权 | AD234: 无权 | AE234: 无权 | AF234: 103.95 | AG234: 0.57 | AH234: AAA | AI234: 3.6900000000000002e-002 | AJ234: =H234+100*O234 -> 134.59 | AK234: 135.6 | AL234: 184 | AM234: 31.7 | AN234: 67 | AO234: -5.5999999999999994e-002 | AP234: 37 | AQ234: 苏银转债!
A235: 185 | B235: 113577 | C235: 春秋转债! | D235: 603890 | E235: 春秋电子 | F235: 电子 | G235: 电子产品 | H235: 122.05 | I235: 3.3e-003 | J235: -9.5999999999999992e-003 | K235: 12.35 | L235: -8.8000000000000005e-003 | M235: 117.7 | N235: 10.86 | O235: 7.2999999999999995e-002 | P235: 113.72 | Q235: 转股中 | R235: 4.76年 | S235: 2.76年 | T235: 1.78 | U235: 3.4 | V235: 1.6e-002 | W235: 3.7000000000000005e-002 | X235: 4.2000000000000003e-002 | Y235: 48 | Z235: 2.55 | AA235: -7.7000000000000002e-003 | AB235: -1.4199999999999999e-002 | AC235: -5.4800000000000001e-002 | AD235: -5.6900000000000006e-002 | AE235: 86.8 | AF235: 88.57 | AG235: 0.71 | AH235: AA- | AI235: 6.2899999999999998e-002 | AJ235: =H235+100*O235 -> 129.34999999999999 | AK235: 130.4 | AL235: 126 | AM235: 41.8 | AN235: 169 | AO235: -3.7999999999999999e-002 | AP235: 14 | AQ235: 春秋转债!
A236: 45 | B236: 123098 | C236: 一品转债 | D236: 300723 | E236: 一品红 | F236: 医药 | G236: 医药行业 | H236: 130.69 | I236: 1.01e-002 | J236: -1.2999999999999999e-003 | K236: 30.84 | L236: 1.18e-002 | M236: 124 | N236: 25.45 | O236: 7.8e-002 | P236: 121.18 | Q236: 25天 | R236: 5.55年 | S236: 3.56年 | T236: 4.8 | U236: 14 | V236: 2.2000000000000002e-002 | W236: 5.4000000000000006e-002 | X236: 6.5000000000000002e-002 | Y236: 89 | Z236: 3.2 | AA236: -9.5999999999999992e-003 | AB236: -1.67e-002 | AC236: -6.0199999999999997e-002 | AD236: -6.2e-002 | AE236: 82.66 | AF236: 88.42 | AG236: 0.74 | AH236: AA- | AI236: 6.4100000000000004e-002 | AJ236: =H236+100*O236 -> 138.49000000000001 | AK236: 140.2 | AL236: 232 | AM236: 51.8 | AN236: 253 | AO236: 9.0999999999999998e-002 | AP236: 4 | AQ236: 一品转债
A237: 358 | B237: 113014 | C237: 林洋转债! | D237: 601222 | E237: XD林洋能 | F237: 能源电力 | G237: 电力设备 | H237: 111.9 | I237: 1.1999999999999999e-003 | J237: 5.4000000000000003e-003 | K237: 8.27 | L237: 1.3500000000000002e-002 | M237: 109.3 | N237: 8.44 | O237: 0.14199999999999999 | P237: 97.99 | Q237: 转股中 | R237: 2.30年 | S237: 0.30年 | T237: 30 | U237: 50 | V237: 1.4999999999999999e-002 | W237: 0.20699999999999999 | X237: 0.20300000000000001 | Y237: 145 | Z237: 1.39 | AA237: -1.04e-002 | AB237: -1.78e-002 | AC237: -0.20600000000000002 | AD237: -0.21299999999999999 | AE237: 99.94 | AF237: 99.96 | AG237: 0.49 | AH237: AA | AI237: 4.0399999999999998e-002 | AJ237: =H237+100*O237 -> 126.10000000000001 | AK237: 125.8 | AL237: 70 | AM237: 25.9 | AN237: 25 | AO237: 5.9000000000000004e-002 | AP237: 30 | AQ237: 林洋转债!
A238: 87 | B238: 110077 | C238: 洪城转债 | D238: 600461 | E238: XD洪城环 | F238: 城市公用 | G238: 城市公用 | H238: 120.11 | I238: 1.7399999999999999e-002 | J238: 9.1999999999999998e-003 | K238: 7.14 | L238: 4.0800000000000003e-002 | M238: 113.5 | N238: 6.71 | O238: 0.129 | P238: 106.41 | Q238: 转股中 | R238: 5.36年 | S238: 3.37年 | T238: 18 | U238: 63 | V238: 2.9999999999999999e-002 | W238: 0.26600000000000001 | X238: 0.28300000000000003 | Y238: 68 | Z238: 1.26 | AA238: -1.06e-002 | AB238: -1.5100000000000001e-002 | AC238: -4.4800000000000006e-002 | AD238: -4.5899999999999996e-002 | AE238: 89.06 | AF238: 92.16 | AG238: 0.65 | AH238: AA+ | AI238: 4.0099999999999997e-002 | AJ238: =H238+100*O238 -> 133.00999999999999 | AK238: 133.8 | AL238: 166 | AM238: 41.7 | AN238: 167 | AO238: -3.7000000000000005e-002 | AP238: 6 | AQ238: 洪城转债
A239: 6 | B239: 127037 | C239: N银轮转 | D239: 2126 | E239: 银轮股份 | F239: 汽车 | G239: 零部件制 | H239: 122.6 | I239: 0.22600000000000001 | J239: 0. | K239: 10.1 | L239: 3.0000000000000001e-003 | M239: 115.1 | N239: 10.77 | O239: 0.307 | P239: 93.78 | Q239: 5月5天 | R239: 5.91年 | S239: 3.91年 | T239: 7 | U239: 882 | V239: 1.03 | W239: 8.6999999999999994e-002 | X239: 8.199999999999999e-002 | Y239: 80 | Z239: 1.95 | AA239: -1.0800000000000001e-002 | AB239: -1.5300000000000001e-002 | AC239: -4.07e-002 | AD239: -4.2300000000000004e-002 | AE239: 87.34 | AF239: 90.08 | AG239: 0.55 | AH239: AA | AI239: 4.3099999999999999e-002 | AJ239: =H239+100*O239 -> 153.29999999999998 | AK239: 151.4 | AL239: 285 | AM239: 61.3 | AN239: 291 | AO239: -2.9999999999999999e-002 | AP239: 1 | AQ239: N银轮转
A240: 97 | B240: 113607 | C240: 伟20转债! | D240: 603568 | E240: 伟明环保 | F240: 城市公用 | G240: 三废处理 | H240: 122.01 | I240: 2.0000000000000001e-004 | J240: -6.1999999999999998e-003 | K240: 24.94 | L240: -8.3000000000000001e-003 | M240: 115.1 | N240: 21.71 | O240: 6.2e-002 | P240: 114.88 | Q240: 转股中 | R240: 5.32年 | S240: 3.32年 | T240: 12 | U240: 12 | V240: 8.0000000000000002e-003 | W240: 3.7999999999999999e-002 | X240: 4.4000000000000004e-002 | Y240: 313 | Z240: 5.61 | AA240: -1.11e-002 | AB240: -1.61e-002 | AC240: -4.6199999999999998e-002 | AD240: -4.8099999999999997e-002 | AE240: 89.56 | AF240: 92.37 | AG240: 0.71 | AH240: AA | AI240: 4.3099999999999999e-002 | AJ240: =H240+100*O240 -> 128.21000000000001 | AK240: 129.1 | AL240: 109 | AM240: 36.8 | AN240: 124 | AO240: 9.8000000000000004e-002 | AP240: 6 | AQ240: 伟20转债!
A241: 178 | B241: 128108 | C241: 蓝帆转债! | D241: 2382 | E241: 蓝帆医疗 | F241: 医药 | G241: 医疗器械 | H241: 119.25 | I241: 1.61e-002 | J241: -6.8999999999999999e-003 | K241: 19.97 | L241: 1.37e-002 | M241: 112.9 | N241: 18.24 | O241: 8.900000000000001e-002 | P241: 109.48 | Q241: 转股中 | R241: 4.88年 | S241: 3.89年 | T241: 15.3 | U241: 46 | V241: 2.5000000000000001e-002 | W241: 7.5999999999999998e-002 | X241: 8.3000000000000004e-002 | Y241: 201 | Z241: 1.68 | AA241: -1.1299999999999999e-002 | AB241: -1.6e-002 | AC241: -3.0800000000000001e-002 | AD241: -3.3099999999999997e-002 | AE241: 89.33 | AF241: 92.75 | AG241: 0.67 | AH241: AA | AI241: 4.1900000000000007e-002 | AJ241: =H241+100*O241 -> 128.15000000000001 | AK241: 129 | AL241: 108 | AM241: 36.3 | AN241: 116 | AO241: -1.3000000000000001e-002 | AP241: 26 | AQ241: 蓝帆转债!
A242: 64 | B242: 113614 | C242: 健20转债! | D242: 603707 | E242: 健友股份 | F242: 医药 | G242: 原料药 | H242: 121.39 | I242: -3.4000000000000002e-003 | J242: 4.6999999999999993e-003 | K242: 38.31 | L242: 2.0999999999999999e-003 | M242: 114.2 | N242: 38 | O242: 0.20399999999999999 | P242: 100.82 | Q242: 转股中 | R242: 5.44年 | S242: 3.44年 | T242: 7.8 | U242: 2.6 | V242: 3.0000000000000001e-003 | W242: 2.2000000000000002e-002 | X242: 2.2000000000000002e-002 | Y242: 359 | Z242: 9.3 | AA242: -1.1399999999999999e-002 | AB242: -1.6e-002 | AC242: -4.3099999999999999e-002 | AD242: -4.4900000000000002e-002 | AE242: 89.19 | AF242: 91.19 | AG242: 0.62 | AH242: AA | AI242: 4.3099999999999999e-002 | AJ242: =H242+100*O242 -> 141.78999999999999 | AK242: 142 | AL242: 244 | AM242: 50.8 | AN242: 244 | AO242: -7.2999999999999995e-002 | AP242: 3 | AQ242: 健20转债!
A243: 1 | B243: 113050 | C243: 南银转债 | D243: 601009 | E243: 南京银行 | F243: 金融 | G243: 银行行业 | H243: 119 | I243: -3.0000000000000001e-003 | J243: -1.5700000000000002e-002 | K243: 10.26 | L243: -3.0200000000000001e-002 | M243: 111.2 | N243: 10.1 | O243: 0.17100000000000001 | P243: 101.58 | Q243: 5月15天 | R243: 5.93年 | S243: 无权 | T243: 200 | U243: 431 | V243: 1.8000000000000002e-002 | W243: 0.19500000000000001 | X243: 0.19800000000000001 | Y243: 1027. | Z243: 1.02 | AA243: -1.15e-002 | AB243: -1.49e-002 | AC243: 无权 | AD243: 无权 | AE243: 无权 | AF243: 89.35 | AG243: 0.62 | AH243: AAA | AI243: 3.8100000000000002e-002 | AJ243: =H243+100*O243 -> 136.09999999999999 | AK243: 136.4 | AL243: 193 | AM243: 47.1 | AN243: 224 | AO243: -2.3e-002 | AP243: 3 | AQ243: 南银转债
A244: 322 | B244: 110045 | C244: 海澜转债! | D244: 600398 | E244: 海澜之家 | F244: 服装纺织 | G244: 服装行业 | H244: 115.15 | I244: -5.5000000000000005e-003 | J244: 4.0000000000000002e-004 | K244: 7.08 | L244: -9.7999999999999997e-003 | M244: 111.1 | N244: 7.04 | O244: 0.14499999999999999 | P244: 100.57 | Q244: 转股中 | R244: 3年3.1天 | S244: 1年4.1天 | T244: 29.5 | U244: 25 | V244: 6.9999999999999993e-003 | W244: 9.6000000000000002e-002 | X244: 9.6999999999999989e-002 | Y244: 306 | Z244: 2.18 | AA244: -1.2e-002 | AB244: -1.8700000000000001e-002 | AC244: -9.849999999999999e-002 | AD244: -0.10099999999999999 | AE244: 97.57 | AF244: 99.24 | AG244: 0.52 | AH244: AA+ | AI244: 3.8900000000000004e-002 | AJ244: =H244+100*O244 -> 129.65000000000001 | AK244: 129.7 | AL244: 118 | AM244: 30.5 | AN244: 51 | AO244: -1.4999999999999999e-002 | AP244: 51 | AQ244: 海澜转债!
A245: 336 | B245: 128035 | C245: 大族转债! | D245: 2008 | E245: 大族激光 | F245: 机械装备 | G245: 专用设备 | H245: 111.008 | I245: -2.e-003 | J245: 1.1999999999999999e-003 | K245: 39.02 | L245: -9.5999999999999992e-003 | M245: 107.4 | N245: 51.9 | O245: 0.47700000000000004 | P245: 75.18 | Q245: 转股中 | R245: 2.58年 | S245: 0.58年 | T245: 23 | U245: 5.2 | V245: 2.e-003 | W245: 5.5e-002 | X245: 4.2000000000000003e-002 | Y245: 416 | Z245: 4.33 | AA245: -1.29e-002 | AB245: -1.8200000000000001e-002 | AC245: -8.5999999999999993e-002 | AD245: -9.5000000000000001e-002 | AE245: 100.99 | AF245: 97.8 | AG245: 0.08 | AH245: AA+ | AI245: 3.7400000000000003e-002 | AJ245: =H245+100*O245 -> 158.708 | AK245: 146.8 | AL245: 272 | AM245: 45.8 | AN245: 209 | AO245: 1.4999999999999999e-002 | AP245: 19 | AQ245: 大族转债!
A246: 175 | B246: 128109 | C246: 楚江转债 | D246: 2171 | E246: 楚江新材 | F246: 有色金属 | G246: 铜金属 | H246: 122.3 | I246: 7.4000000000000003e-003 | J246: 1.1599999999999999e-002 | K246: 9.16 | L246: 3.04e-002 | M246: 114.9 | N246: 8.63 | O246: 0.152 | P246: 106.14 | Q246: 转股中 | R246: 4.90年 | S246: 2.90年 | T246: 18.3 | U246: 40 | V246: 1.8000000000000002e-002 | W246: 0.14999999999999999 | X246: 0.159 | Y246: 122 | Z246: 2.15 | AA246: -1.29e-002 | AB246: -1.8200000000000001e-002 | AC246: -5.3600000000000002e-002 | AD246: -5.5500000000000001e-002 | AE246: 91.25 | AF246: 94.31 | AG246: 0.63 | AH246: AA | AI246: 4.1900000000000007e-002 | AJ246: =H246+100*O246 -> 137.5 | AK246: 138.5 | AL246: 213 | AM246: 44.1 | AN246: 196 | AO246: 5.9000000000000004e-002 | AP246: 6 | AQ246: 楚江转债
A247: 68 | B247: 123085 | C247: 万顺转2! | D247: 300057 | E247: 万顺新材 | F247: 有色金属 | G247: 铝金属 | H247: 121.5 | I247: -2.3e-002 | J247: 1.11e-002 | K247: 6.98 | L247: -1.55e-002 | M247: 113.3 | N247: 6.2 | O247: 7.9000000000000001e-002 | P247: 112.58 | Q247: 转股中 | R247: 5.42年 | S247: 3.42年 | T247: 9 | U247: 70 | V247: 6.4000000000000001e-002 | W247: 0.191 | X247: 0.215 | Y247: 47 | Z247: 1.33 | AA247: -1.3100000000000001e-002 | AB247: -1.7399999999999999e-002 | AC247: -4.3299999999999998e-002 | AD247: -4.5199999999999997e-002 | AE247: 83.24 | AF247: 81.48 | AG247: 0.77 | AH247: AA- | AI247: 6.4100000000000004e-002 | AJ247: =H247+100*O247 -> 129.40000000000001 | AK247: 130.4 | AL247: 127 | AM247: 47.2 | AN247: 225 | AO247: 0.158 | AP247: 25 | AQ247: 万顺转2!
A248: 73 | B248: 123083 | C248: 朗新转债 | D248: 300682 | E248: 朗新科技 | F248: 计算机及 | G248: 软件开发 | H248: 123.517 | I248: -8.0000000000000002e-003 | J248: -6.3e-003 | K248: 16.8 | L248: -2.1499999999999998e-002 | M248: 115.1 | N248: 15.45 | O248: 0.13600000000000001 | P248: 108.74 | Q248: 转股中 | R248: 5.42年 | S248: 3.42年 | T248: 8 | U248: 6.5 | V248: 6.9999999999999993e-003 | W248: 4.7e-002 | X248: 5.0999999999999997e-002 | Y248: 172 | Z248: 3.26 | AA248: -1.32e-002 | AB248: -1.8000000000000002e-002 | AC248: -4.82e-002 | AD248: -5.0000000000000003e-002 | AE248: 89.18 | AF248: 91.98 | AG248: 0.67 | AH248: AA | AI248: 4.3099999999999999e-002 | AJ248: =H248+100*O248 -> 137.11699999999999 | AK248: 138.3 | AL248: 210 | AM248: 46.3 | AN248: 214 | AO248: -2.8999999999999998e-002 | AP248: 5 | AQ248: 朗新转债
A249: 53 | B249: 113618 | C249: 美诺转债! | D249: 603538 | E249: 美诺华 | F249: 医药 | G249: 原料药 | H249: 123.98 | I249: -2.8000000000000004e-003 | J249: 5.3e-003 | K249: 40.64 | L249: 3.4999999999999996e-003 | M249: 115.3 | N249: 37.47 | O249: 0.14300000000000002 | P249: 108.46 | Q249: 11天 | R249: 5.52年 | S249: 3.52年 | T249: 5.2 | U249: 30 | V249: 4.7e-002 | W249: 8.5999999999999993e-002 | X249: 9.3000000000000013e-002 | Y249: 61 | Z249: 3.83 | AA249: -1.3300000000000001e-002 | AB249: -1.8100000000000002e-002 | AC249: -4.7500000000000001e-002 | AD249: -4.9299999999999997e-002 | AE249: 82.76 | AF249: 82.43 | AG249: 0.73 | AH249: AA- | AI249: 6.4100000000000004e-002 | AJ249: =H249+100*O249 -> 138.28 | AK249: 139.5 | AL249: 224 | AM249: 56.7 | AN249: 272 | AO249: -9.5000000000000001e-002 | AP249: 5 | AQ249: 美诺转债!
A250: 337 | B250: 110043 | C250: 无锡转债! | D250: 600908 | E250: 无锡银行 | F250: 金融 | G250: 银行行业 | H250: 112.07 | I250: 2.5999999999999999e-003 | J250: -7.8000000000000005e-003 | K250: 5.44 | L250: -1.09e-002 | M250: 108.3 | N250: 5.61 | O250: 0.156 | P250: 96.97 | Q250: 转股中 | R250: 2.56年 | S250: 无权 | T250: 29.2 | U250: 73 | V250: 2.2000000000000002e-002 | W250: 0.28800000000000003 | X250: 0.28000000000000003 | Y250: 101 | Z250: 0.82 | AA250: -1.34e-002 | AB250: -1.9400000000000001e-002 | AC250: 无权 | AD250: 无权 | AE250: 无权 | AF250: 98.69 | AG250: 0.48 | AH250: AA+ | AI250: 3.7400000000000003e-002 | AJ250: =H250+100*O250 -> 127.66999999999999 | AK250: 127.2 | AL250: 82 | AM250: 28.5 | AN250: 42 | AO250: -5.7000000000000002e-002 | AP250: 23 | AQ250: 无锡转债!
A251: 75 | B251: 113612 | C251: 永冠转债 | D251: 603681 | E251: 永冠新材 | F251: 化工 | G251: 其他 | H251: 130.28 | I251: 1.3000000000000001e-002 | J251: -1.21e-002 | K251: 25.22 | L251: 1.1999999999999999e-003 | M251: 121.2 | N251: 20.59 | O251: 6.4000000000000001e-002 | P251: 122.49 | Q251: 转股中 | R251: 5.41年 | S251: 3.42年 | T251: 5.2 | U251: 7.8 | V251: 1.2e-002 | W251: 0.124 | X251: 0.152 | Y251: 42 | Z251: 2.67 | AA251: -1.3500000000000002e-002 | AB251: -2.0099999999999996e-002 | AC251: -6.13e-002 | AD251: -6.3200000000000006e-002 | AE251: 83.57 | AF251: 87.24 | AG251: 0.77 | AH251: AA- | AI251: 6.4100000000000004e-002 | AJ251: =H251+100*O251 -> 136.68000000000001 | AK251: 138.1 | AL251: 208 | AM251: 50.8 | AN251: 245 | AO251: 6.0000000000000001e-003 | AP251: 6 | AQ251: 永冠转债
A252: 94 | B252: 128136 | C252: 立讯转债! | D252: 2475 | E252: 立讯精密 | F252: 电子 | G252: 元器件制 | H252: 120.3 | I252: 7.4000000000000003e-003 | J252: -1.06e-002 | K252: 46.27 | L252: -8.3999999999999995e-003 | M252: 111.9 | N252: 58.25 | O252: 0.51400000000000001 | P252: 79.43 | Q252: 转股中 | R252: 5.32年 | S252: 3.32年 | T252: 30 | U252: 62 | V252: 1.7000000000000001e-002 | W252: 9.0000000000000011e-003 | X252: 6.9999999999999993e-003 | Y252: 3255. | Z252: 11.26 | AA252: -1.37e-002 | AB252: -1.77e-002 | AC252: -4.53e-002 | AD252: -4.6500000000000007e-002 | AE252: 89.32 | AF252: 91.01 | AG252: 0.38 | AH252: AA+ | AI252: 4.0099999999999997e-002 | AJ252: =H252+100*O252 -> 171.69999999999999 | AK252: 161.2 | AL252: 309 | AM252: 70.2 | AN252: 307 | AO252: 6.3e-002 | AP252: 13 | AQ252: 立讯转债!
A253: 218 | B253: 128096 | C253: 奥瑞转债!! | D253: 2701 | E253: 奥瑞金 | F253: 造纸包装 | G253: 包装材料 | H253: 123.099 | I253: 1.32e-002 | J253: -3.8e-003 | K253: 5.08 | L253: 1.3999999999999999e-002 | M253: 115.5 | N253: 4.5 | O253: 8.9999999999999997e-002 | P253: 112.89 | Q253: 转股中 | R253: 4.59年 | S253: 2.59年 | T253: 6.74 | U253: 2.6 | V253: 3.0000000000000001e-003 | W253: 5.5e-002 | X253: 6.2e-002 | Y253: 123 | Z253: 1.83 | AA253: -1.41e-002 | AB253: -1.9900000000000001e-002 | AC253: -6.0400000000000002e-002 | AD253: -6.2800000000000009e-002 | AE253: 93.56 | AF253: 97.32 | AG253: 0.68 | AH253: AA+ | AI253: 3.8900000000000004e-002 | AJ253: =H253+100*O253 -> 132.09899999999999 | AK253: 133.3 | AL253: 160 | AM253: 36 | AN253: 111 | AO253: -4.0000000000000001e-003 | AP253: 18 | AQ253: 奥瑞转债!!
A254: 205 | B254: 113572 | C254: 三祥转债! | D254: 603663 | E254: 三祥新材 | F254: 其他 | G254: 其他 | H254: 121.11 | I254: 1.8100000000000002e-002 | J254: -5.1999999999999998e-003 | K254: 15.71 | L254: 1.6799999999999999e-002 | M254: 112.8 | N254: 14.09 | O254: 8.5999999999999993e-002 | P254: 111.5 | Q254: 转股中 | R254: 4.67年 | S254: 2.67年 | T254: 1.69 | U254: 27 | V254: 0.13 | W254: 5.5999999999999994e-002 | X254: 6.2e-002 | Y254: 30 | Z254: 4.72 | AA254: -1.54e-002 | AB254: -2.0199999999999999e-002 | AC254: -5.4800000000000001e-002 | AD254: -5.6900000000000006e-002 | AE254: 84.5 | AF254: 81.38 | AG254: 0.76 | AH254: A+ | AI254: 7.3899999999999993e-002 | AJ254: =H254+100*O254 -> 129.71000000000001 | AK254: 130.7 | AL254: 129 | AM254: 46.2 | AN254: 212 | AO254: 5.7999999999999996e-002 | AP254: 19 | AQ254: 三祥转债!
A255: 143 | B255: 128122 | C255: 兴森转债! | D255: 2436 | E255: 兴森科技 | F255: 电子 | G255: 元器件制 | H255: 120.64 | I255: -1.4199999999999999e-002 | J255: 2.2200000000000001e-002 | K255: 12.42 | L255: 1.9699999999999999e-002 | M255: 113.3 | N255: 14.1 | O255: 0.37 | P255: 88.09 | Q255: 转股中 | R255: 4年13天 | S255: 3年14天 | T255: 2.69 | U255: 49 | V255: 0.151 | W255: 1.4999999999999999e-002 | X255: 1.3000000000000001e-002 | Y255: 185 | Z255: 5.76 | AA255: -1.5600000000000001e-002 | AB255: -2.1400000000000002e-002 | AC255: -4.6699999999999998e-002 | AD255: -4.87e-002 | AE255: 90.98 | AF255: 96.22 | AG255: 0.41 | AH255: AA | AI255: 4.1900000000000007e-002 | AJ255: =H255+100*O255 -> 157.63999999999999 | AK255: 153.2 | AL255: 289 | AM255: 57 | AN255: 276 | AO255: 0.157 | AP255: 13 | AQ255: 兴森转债!
A256: 59 | B256: 123091 | C256: 长海转债 | D256: 300196 | E256: 长海股份 | F256: 其他 | G256: 非金属矿 | H256: 126.52 | I256: 1.8e-003 | J256: -5.1999999999999998e-003 | K256: 17.76 | L256: -5.0000000000000001e-003 | M256: 116.2 | N256: 16.14 | O256: 0.14999999999999999 | P256: 110.04 | Q256: 转股中 | R256: 5.46年 | S256: 3.46年 | T256: 5.5 | U256: 4.3 | V256: 6.0000000000000001e-003 | W256: 7.5999999999999998e-002 | X256: 8.3000000000000004e-002 | Y256: 73 | Z256: 2.44 | AA256: -1.5800000000000002e-002 | AB256: -2.0899999999999998e-002 | AC256: -5.3800000000000001e-002 | AD256: -5.5599999999999997e-002 | AE256: 89.13 | AF256: 92.72 | AG256: 0.68 | AH256: AA | AI256: 4.3099999999999999e-002 | AJ256: =H256+100*O256 -> 141.51999999999998 | AK256: 143 | AL256: 248 | AM256: 50.3 | AN256: 243 | AO256: 7.0000000000000007e-002 | AP256: 3 | AQ256: 长海转债
A257: 93 | B257: 128137 | C257: 洁美转债 | D257: 2859 | E257: 洁美科技 | F257: 电子 | G257: 元器件制 | H257: 127.6 | I257: -9.8999999999999991e-003 | J257: -2.1099999999999997e-002 | K257: 31 | L257: -4.1700000000000001e-002 | M257: 117.3 | N257: 27.63 | O257: 0.13699999999999998 | P257: 112.2 | Q257: 转股中 | R257: 5.32年 | S257: 3.32年 | T257: 6 | U257: 18 | V257: 2.3e-002 | W257: 4.7e-002 | X257: 5.2999999999999999e-002 | Y257: 127 | Z257: 6.91 | AA257: -1.6e-002 | AB257: -2.1499999999999998e-002 | AC257: -5.7999999999999996e-002 | AD257: -5.9800000000000006e-002 | AE257: 83.77 | AF257: 84.87 | AG257: 0.74 | AH257: AA- | AI257: 6.4100000000000004e-002 | AJ257: =H257+100*O257 -> 141.29999999999998 | AK257: 143 | AL257: 249 | AM257: 58.1 | AN257: 279 | AO257: 1.3000000000000001e-002 | AP257: 4 | AQ257: 洁美转债
A258: 254 | B258: 128075 | C258: 远东转债! | D258: 2406 | E258: 远东传动 | F258: 汽车 | G258: 零部件制 | H258: 123 | I258: 1.5300000000000001e-002 | J258: 1.5e-003 | K258: 6.76 | L258: 2.2700000000000001e-002 | M258: 114.9 | N258: 5.54 | O258: 8.0000000000000002e-003 | P258: 122.02 | Q258: 转股中 | R258: 4.21年 | S258: 2.21年 | T258: 5.44 | U258: 26 | V258: 3.9e-002 | W258: 0.129 | X258: 0.157 | Y258: 42 | Z258: 1.27 | AA258: -1.6399999999999998e-002 | AB258: -2.2599999999999999e-002 | AC258: -7.1199999999999999e-002 | AD258: -7.3700000000000002e-002 | AE258: 93.9 | AF258: 97.04 | AG258: 0.74 | AH258: AA | AI258: 4.1900000000000007e-002 | AJ258: =H258+100*O258 -> 123.8 | AK258: 124 | AL258: 56 | AM258: 26.9 | AN258: 31 | AO258: 4.7e-002 | AP258: 14 | AQ258: 远东转债!
A259: 60 | B259: 123089 | C259: 九洲转2! | D259: 300040 | E259: 九洲集团 | F259: 能源电力 | G259: 电力设备 | H259: 133.251 | I259: -2.7400000000000001e-002 | J259: -2.0000000000000001e-004 | K259: 10.92 | L259: -3.3599999999999998e-002 | M259: 121 | N259: 8 | O259: -2.4e-002 | P259: 136.5 | Q259: 转股中 | R259: 5.45年 | S259: 3.45年 | T259: 5 | U259: 416 | V259: 0.624 | W259: 0.12 | X259: 0.16399999999999998 | Y259: 42 | Z259: 1.86 | AA259: -1.7899999999999999e-002 | AB259: -2.4300000000000002e-002 | AC259: -6.7000000000000004e-002 | AD259: -6.88e-002 | AE259: 83.2 | AF259: 86.86 | AG259: 0.82 | AH259: AA- | AI259: 6.4100000000000004e-002 | AJ259: =H259+100*O259 -> 130.851 | AK259: 130 | AL259: 120 | AM259: 43.1 | AN259: 186 | AO259: 0.14099999999999999 | AP259: 20 | AQ259: 九洲转2!
A260: 111 | B260: 110075 | C260: 南航转债 | D260: 600029 | E260: 南方航空 | F260: 交通运输 | G260: 航空运输 | H260: 120.89 | I260: 3.2000000000000002e-003 | J260: 8.199999999999999e-003 | K260: 5.89 | L260: 2.0799999999999999e-002 | M260: 110 | N260: 6.24 | O260: 0.28100000000000003 | P260: 94.39 | Q260: 转股中 | R260: 5.27年 | S260: 3.27年 | T260: 59 | U260: 76 | V260: 1.1000000000000001e-002 | W260: 5.9000000000000004e-002 | X260: 5.5999999999999994e-002 | Y260: 998 | Z260: 1.38 | AA260: -1.8000000000000002e-002 | AB260: -2.1400000000000002e-002 | AC260: -4.7800000000000002e-002 | AD260: -4.9000000000000002e-002 | AE260: 90 | AF260: 90.57 | AG260: 0.55 | AH260: AAA | AI260: 3.8100000000000002e-002 | AJ260: =H260+100*O260 -> 148.99000000000001 | AK260: 147.4 | AL260: 273 | AM260: 56.8 | AN260: 275 | AO260: -3.2000000000000001e-002 | AP260: 7 | AQ260: 南航转债
A261: 368 | B261: 110034 | C261: 九州转债! | D261: 600998 | E261: 九州通 | F261: 医药 | G261: 医药商业 | H261: 109.05 | I261: 1.9e-003 | J261: -1.9e-003 | K261: 14.89 | L261: 4.0000000000000001e-003 | M261: 108 | N261: 17.83 | O261: 0.30599999999999999 | P261: 83.51 | Q261: 转股中 | R261: 0.52年 | S261: 回售内 | T261: 15 | U261: 13 | V261: 8.0000000000000002e-003 | W261: 5.4000000000000006e-002 | X261: 4.4999999999999998e-002 | Y261: 279 | Z261: 1.38 | AA261: -1.84e-002 | AB261: -4.6199999999999998e-002 | AC261: 回售内 | AD261: 回售内 | AE261: 103 | AF261: 106.16 | AG261: 0.02 | AH261: AA+ | AI261: 3.3500000000000002e-002 | AJ261: =H261+100*O261 -> 139.65000000000001 | AK261: 134.6 | AL261: 175 | AM261: 28.4 | AN261: 41 | AO261: -3.4000000000000002e-002 | AP261: 24 | AQ261: 九州转债!
A262: 262 | B262: 113541 | C262: 荣晟转债! | D262: 603165 | E262: 荣晟环保 | F262: 造纸包装 | G262: 包装用纸 | H262: 124 | I262: 1.8e-003 | J262: -7.4999999999999997e-003 | K262: 12.9 | L262: -7.7000000000000002e-003 | M262: 115 | N262: 10.84 | O262: 4.2000000000000003e-002 | P262: 119 | Q262: 转股中 | R262: 4年13天 | S262: 2年14天 | T262: 1.63 | U262: 4.7 | V262: 2.3e-002 | W262: 4.8000000000000001e-002 | X262: 5.7000000000000002e-002 | Y262: 34 | Z262: 1.93 | AA262: -1.89e-002 | AB262: -2.53e-002 | AC262: -7.9600000000000004e-002 | AD262: -8.2299999999999998e-002 | AE262: 90.64 | AF262: 90.44 | AG262: 0.74 | AH262: AA- | AI262: 6.2899999999999998e-002 | AJ262: =H262+100*O262 -> 128.19999999999999 | AK262: 129 | AL262: 105 | AM262: 38.4 | AN262: 137 | AO262: -2.2000000000000002e-002 | AP262: 42 | AQ262: 荣晟转债!
A263: 124 | B263: 113602 | C263: 景20转债! | D263: 603228 | E263: 景旺电子 | F263: 电子 | G263: 元器件制 | H263: 124.85 | I263: -2.0000000000000001e-004 | J263: 1.8799999999999997e-002 | K263: 28.2 | L263: 2.92e-002 | M263: 113.3 | N263: 27.4 | O263: 0.21299999999999999 | P263: 102.92 | Q263: 转股中 | R263: 5年45天 | S263: 3年46天 | T263: 17.8 | U263: 229 | V263: 0.106 | W263: 7.400000000000001e-002 | X263: 7.5999999999999998e-002 | Y263: 241 | Z263: 3.7 | AA263: -1.9099999999999999e-002 | AB263: -2.3700000000000002e-002 | AC263: -5.5099999999999996e-002 | AD263: -5.7099999999999998e-002 | AE263: 90.48 | AF263: 91.7 | AG263: 0.63 | AH263: AA | AI263: 4.3099999999999999e-002 | AJ263: =H263+100*O263 -> 146.15000000000001 | AK263: 146.8 | AL263: 271 | AM263: 55.1 | AN263: 264 | AO263: 9.6000000000000002e-002 | AP263: 9 | AQ263: 景20转债!
A264: 84 | B264: 123078 | C264: 飞凯转债! | D264: 300398 | E264: 飞凯材料 | F264: 化工 | G264: 化工 | H264: 128.049 | I264: 1.9e-003 | J264: 4.5000000000000005e-003 | K264: 19.09 | L264: 8.5000000000000006e-003 | M264: 115.2 | N264: 15.56 | O264: 4.4000000000000004e-002 | P264: 122.69 | Q264: 转股中 | R264: 5.38年 | S264: 3.39年 | T264: 8.15 | U264: 42 | V264: 4.0999999999999995e-002 | W264: 8.3000000000000004e-002 | X264: 0.10199999999999999 | Y264: 99 | Z264: 3.67 | AA264: -1.9799999999999998e-002 | AB264: -2.4700000000000003e-002 | AC264: -5.8099999999999999e-002 | AD264: -5.9900000000000002e-002 | AE264: 89.4 | AF264: 92.2 | AG264: 0.76 | AH264: AA | AI264: 4.3099999999999999e-002 | AJ264: =H264+100*O264 -> 132.44900000000001 | AK264: 133.4 | AL264: 162 | AM264: 41.2 | AN264: 166 | AO264: 7.0000000000000007e-002 | AP264: 8 | AQ264: 飞凯转债!
A265: 348 | B265: 128025 | C265: 特一转债! | D265: 2728 | E265: 特一药业 | F265: 医药 | G265: 化学制药 | H265: 114.65 | I265: 1.2999999999999999e-003 | J265: 2.e-003 | K265: 13.18 | L265: 6.8999999999999999e-003 | M265: 108.8 | N265: 14.05 | O265: 0.222 | P265: 93.81 | Q265: 转股中 | R265: 2.41年 | S265: 0.41年 | T265: 2.98 | U265: 40 | V265: 0.11699999999999999 | W265: 0.111 | X265: 0.10400000000000001 | Y265: 27 | Z265: 2.51 | AA265: -2.18e-002 | AB265: -2.8399999999999998e-002 | AC265: -0.20899999999999999 | AD265: -0.21299999999999999 | AE265: 98.13 | AF265: 94.46 | AG265: 0.48 | AH265: AA- | AI265: 6.1399999999999996e-002 | AJ265: =H265+100*O265 -> 136.84999999999999 | AK265: 135.5 | AL265: 183 | AM265: 37.4 | AN265: 130 | AO265: -6.2e-002 | AP265: 49 | AQ265: 特一转债!
A266: 20 | B266: 113623 | C266: 凤21转债 | D266: 603225 | E266: 新凤鸣 | F266: 化工 | G266: 化纤 | H266: 132.94 | I266: 1.3100000000000001e-002 | J266: 1.e-004 | K266: 20.91 | L266: 1.7000000000000001e-002 | M266: 117.1 | N266: 16.47 | O266: 4.7e-002 | P266: 126.96 | Q266: 3月7天 | R266: 5.75年 | S266: 3.75年 | T266: 25 | U266: 15 | V266: 5.0000000000000001e-003 | W266: 8.5000000000000006e-002 | X266: 0.10800000000000001 | Y266: 293 | Z266: 2.4 | AA266: -2.2200000000000001e-002 | AB266: -2.7200000000000002e-002 | AC266: -6.2100000000000002e-002 | AD266: -6.3700000000000007e-002 | AE266: 87.95 | AF266: 92.28 | AG266: 0.77 | AH266: AA | AI266: 4.3099999999999999e-002 | AJ266: =H266+100*O266 -> 137.63999999999999 | AK266: 138.9 | AL266: 219 | AM266: 46.6 | AN266: 218 | AO266: 5.7000000000000002e-002 | AP266: 3 | AQ266: 凤21转债
A267: 24 | B267: 123108 | C267: 乐普转2 | D267: 300003 | E267: 乐普医疗 | F267: 医药 | G267: 医疗器械 | H267: 123.54 | I267: -4.0999999999999995e-003 | J267: 8.9999999999999998e-004 | K267: 28.6 | L267: -5.8999999999999999e-003 | M267: 111.1 | N267: 29.5 | O267: 0.27399999999999997 | P267: 96.95 | Q267: 3月1天 | R267: 4.72年 | S267: 2.72年 | T267: 16.4 | U267: 21 | V267: 1.e-002 | W267: 3.2000000000000001e-002 | X267: 3.1e-002 | Y267: 516 | Z267: 4.85 | AA267: -2.2499999999999999e-002 | AB267: -2.6600000000000002e-002 | AC267: -6.4199999999999993e-002 | AD267: -6.5500000000000003e-002 | AE267: 91.44 | AF267: 92.98 | AG267: 0.55 | AH267: AA+ | AI267: 3.8900000000000004e-002 | AJ267: =H267+100*O267 -> 150.94 | AK267: 150.1 | AL267: 284 | AM267: 57.1 | AN267: 277 | AO267: -7.9000000000000001e-002 | AP267: 8 | AQ267: 乐普转2
A268: 296 | B268: 113528 | C268: 长城转债! | D268: 603897 | E268: 长城科技 | F268: 机械装备 | G268: 专用设备 | H268: 127.36 | I268: 3.6799999999999999e-002 | J268: 1.4199999999999999e-002 | K268: 27.18 | L268: 7.1800000000000003e-002 | M268: 116.8 | N268: 23.35 | O268: 9.4e-002 | P268: 116.4 | Q268: 转股中 | R268: 3.64年 | S268: 1.64年 | T268: 6.34 | U268: 101 | V268: 0.127 | W268: 0.13100000000000001 | X268: 0.152 | Y268: 48 | Z268: 2.48 | AA268: -2.4e-002 | AB268: -3.1800000000000002e-002 | AC268: -0.111 | AD268: -0.114 | AE268: 92.44 | AF268: 93.98 | AG268: 0.71 | AH268: AA- | AI268: 6.2899999999999998e-002 | AJ268: =H268+100*O268 -> 136.75999999999999 | AK268: 138.3 | AL268: 212 | AM268: 44.3 | AN268: 200 | AO268: 0.156 | AP268: 38 | AQ268: 长城转债!
A269: 113 | B269: 128134 | C269: 鸿路转债! | D269: 2541 | E269: 鸿路钢构 | F269: 建筑 | G269: 其他 | H269: 130.69 | I269: -3.0999999999999999e-003 | J269: -1.9299999999999998e-002 | K269: 55.7 | L269: -2.7900000000000001e-002 | M269: 115.1 | N269: 43.51 | O269: 2.1000000000000001e-002 | P269: 128.02 | Q269: 转股中 | R269: 5.25年 | S269: 3.25年 | T269: 15.8 | U269: 99 | V269: 4.8000000000000001e-002 | W269: 5.4000000000000006e-002 | X269: 6.9000000000000006e-002 | Y269: 292 | Z269: 5.02 | AA269: -2.4300000000000002e-002 | AB269: -2.92e-002 | AC269: -6.6199999999999995e-002 | AD269: -6.8000000000000005e-002 | AE269: 89.81 | AF269: 92.63 | AG269: 0.8 | AH269: AA | AI269: 4.3099999999999999e-002 | AJ269: =H269+100*O269 -> 132.78999999999999 | AK269: 133.4 | AL269: 161 | AM269: 40.7 | AN269: 156 | AO269: -3.5000000000000003e-002 | AP269: 4 | AQ269: 鸿路转债!
A270: 333 | B270: 127005 | C270: 长证转债! | D270: 783 | E270: 长江证券 | F270: 金融 | G270: 证券行业 | H270: 115.67 | I270: 1.01e-002 | J270: -9.3999999999999986e-003 | K270: 7.09 | L270: 1.4000000000000002e-003 | M270: 108.3 | N270: 7.28 | O270: 0.188 | P270: 97.39 | Q270: 转股中 | R270: 2.67年 | S270: 无权 | T270: 50 | U270: 50 | V270: 9.0000000000000011e-003 | W270: 0.127 | X270: 0.124 | Y270: 392 | Z270: 1.36 | AA270: -2.4700000000000003e-002 | AB270: -3.0299999999999997e-002 | AC270: 无权 | AD270: 无权 | AE270: 无权 | AF270: 98.84 | AG270: 0.49 | AH270: AAA | AI270: 3.5400000000000001e-002 | AJ270: =H270+100*O270 -> 134.47 | AK270: 133.9 | AL270: 168 | AM270: 35.1 | AN270: 103 | AO270: -2.1000000000000001e-002 | AP270: 13 | AQ270: 长证转债!
A271: 108 | B271: 127022 | C271: 恒逸转债 | D271: 703 | E271: 恒逸石化 | F271: 化工 | G271: 化工 | H271: 126.425 | I271: 1.1399999999999999e-002 | J271: -1.9e-003 | K271: 12.75 | L271: 1.2699999999999999e-002 | M271: 108.9 | N271: 11.2 | O271: 0.111 | P271: 113.84 | Q271: 转股中 | R271: 5.27年 | S271: 3.27年 | T271: 20 | U271: 35 | V271: 1.3999999999999999e-002 | W271: 4.2999999999999997e-002 | X271: 4.8000000000000001e-002 | Y271: 469 | Z271: 1.89 | AA271: -2.8300000000000002e-002 | AB271: -3.1300000000000001e-002 | AC271: -5.91e-002 | AD271: -6.0499999999999998e-002 | AE271: 89.75 | AF271: 88.8 | AG271: 0.75 | AH271: AA+ | AI271: 4.0099999999999997e-002 | AJ271: =H271+100*O271 -> 137.52500000000001 | AK271: 139 | AL271: 220 | AM271: 49.3 | AN271: 235 | AO271: 3.2000000000000001e-002 | AP271: 6 | AQ271: 恒逸转债
A272: 223 | B272: 128093 | C272: 百川转债! | D272: 2455 | E272: 百川股份 | F272: 化工 | G272: 化工 | H272: 147.22 | I272: 3.3799999999999997e-002 | J272: 1.7000000000000001e-003 | K272: 8.6 | L272: 4.3700000000000003e-002 | M272: 129.8 | N272: 5.77 | O272: -1.2e-002 | P272: 149.05 | Q272: 转股中 | R272: 4.49年 | S272: 2.49年 | T272: 3.33 | U272: 580 | V272: 1.1899999999999999 | W272: 7.2999999999999995e-002 | X272: 0.109 | Y272: 46 | Z272: 3.27 | AA272: -2.86e-002 | AB272: -3.8900000000000004e-002 | AC272: -0.114 | AD272: -0.11800000000000001 | AE272: 91.18 | AF272: 99.73 | AG272: 0.81 | AH272: AA- | AI272: 6.2899999999999998e-002 | AJ272: =H272+100*O272 -> 146.02000000000001 | AK272: 145.4 | AL272: 261 | AM272: 45.7 | AN272: 208 | AO272: 0.14000000000000001 | AP272: 47 | AQ272: 百川转债!
A273: 299 | B273: 128053 | C273: 尚荣转债! | D273: 2551 | E273: 尚荣医疗 | F273: 医药 | G273: 医疗器械 | H273: 126.943 | I273: 8.9999999999999998e-004 | J273: 4.3e-003 | K273: 5.29 | L273: 5.6999999999999993e-003 | M273: 114.3 | N273: 4.89 | O273: 0.17300000000000001 | P273: 108.18 | Q273: 转股中 | R273: 3.60年 | S273: 1.60年 | T273: 1.91 | U273: 21 | V273: 8.900000000000001e-002 | W273: 4.4000000000000004e-002 | X273: 4.8000000000000001e-002 | Y273: 43 | Z273: 1.42 | AA273: -2.92e-002 | AB273: -3.6000000000000004e-002 | AC273: -0.113 | AD273: -0.11599999999999999 | AE273: 95.65 | AF273: 98.87 | AG273: 0.92 | AH273: AA | AI273: 4.1900000000000007e-002 | AJ273: =H273+100*O273 -> 144.24299999999999 | AK273: 145.7 | AL273: 265 | AM273: 46.8 | AN273: 221 | AO273: -3.9e-002 | AP273: 25 | AQ273: 尚荣转债!
A274: 249 | B274: 128079 | C274: 英联转债! | D274: 2846 | E274: 英联股份 | F274: 造纸包装 | G274: 包装材料 | H274: 133.069 | I274: -6.0999999999999995e-003 | J274: 6.0999999999999995e-003 | K274: 8.59 | L274: 1.1999999999999999e-003 | M274: 117.5 | N274: 8.29 | O274: 0.28399999999999997 | P274: 103.62 | Q274: 转股中 | R274: 4.28年 | S274: 2.29年 | T274: 1.52 | U274: 27 | V274: 0.13200000000000001 | W274: 5.5999999999999994e-002 | X274: 5.7999999999999996e-002 | Y274: 27 | Z274: 3.55 | AA274: -2.92e-002 | AB274: -3.61e-002 | AC274: -9.7799999999999998e-002 | AD274: -0.10000000000000001 | AE274: 87.22 | AF274: 87.2 | AG274: 0 | AH274: A+ | AI274: 7.3899999999999993e-002 | AJ274: =H274+100*O274 -> 161.46899999999999 | AK274: 162.5 | AL274: 313 | AM274: 75.3 | AN274: 317 | AO274: 1.8000000000000002e-002 | AP274: 18 | AQ274: 英联转债!
A275: 292 | B275: 127011 | C275: 中鼎转2! | D275: 887 | E275: 中鼎股份 | F275: 汽车 | G275: 零部件制 | H275: 127.5 | I275: 2.7400000000000001e-002 | J275: 6.1999999999999998e-003 | K275: 12.82 | L275: 5.1699999999999996e-002 | M275: 114.5 | N275: 11.39 | O275: 0.13300000000000001 | P275: 112.55 | Q275: 转股中 | R275: 3.66年 | S275: 1.66年 | T275: 12 | U275: 83 | V275: 5.4000000000000006e-002 | W275: 7.6999999999999999e-002 | X275: 8.5999999999999993e-002 | Y275: 157 | Z275: 1.75 | AA275: -2.9500000000000002e-002 | AB275: -3.6200000000000003e-002 | AC275: -0.111 | AD275: -0.114 | AE275: 95.95 | AF275: 99.84 | AG275: 0.65 | AH275: AA+ | AI275: 3.8900000000000004e-002 | AJ275: =H275+100*O275 -> 140.80000000000001 | AK275: 142.4 | AL275: 246 | AM275: 42.6 | AN275: 182 | AO275: 8.5999999999999993e-002 | AP275: 21 | AQ275: 中鼎转2!
A276: 7 | B276: 127036 | C276: 三花转债 | D276: 2050 | E276: 三花智控 | F276: 机械装备 | G276: 通用设备 | H276: 136.35 | I276: -1.3000000000000001e-002 | J276: 3.4000000000000002e-003 | K276: 23.75 | L276: -1.41e-002 | M276: 114.5 | N276: 21.55 | O276: 0.23699999999999999 | P276: 110.21 | Q276: 5月1天 | R276: 5.89年 | S276: 3.90年 | T276: 30 | U276: 146 | V276: 3.5000000000000003e-002 | W276: 3.5000000000000003e-002 | X276: 3.9e-002 | Y276: 853 | Z276: 8.17 | AA276: -2.9600000000000001e-002 | AB276: -3.3799999999999997e-002 | AC276: -6.7000000000000004e-002 | AD276: -6.83e-002 | AE276: 87.88 | AF276: 91.11 | AG276: 0.68 | AH276: AA+ | AI276: 4.0099999999999997e-002 | AJ276: =H276+100*O276 -> 160.04999999999998 | AK276: 162.5 | AL276: 312 | AM276: 71.4 | AN276: 312 | AO276: 6.0999999999999999e-002 | AP276: 4 | AQ276: 三花转债
A277: 9 | B277: 123114 | C277: 三角转债 | D277: 300775 | E277: 三角防务 | F277: 航空航天 | G277: 航空航天 | H277: 144 | I277: 3.4999999999999996e-003 | J277: -4.53e-002 | K277: 37.32 | L277: -5.57e-002 | M277: 121 | N277: 31.82 | O277: 0.22800000000000001 | P277: 117.28 | Q277: 4月24天 | R277: 5.87年 | S277: 3.88年 | T277: 9.04 | U277: 129 | V277: 9.9000000000000005e-002 | W277: 4.9000000000000002e-002 | X277: 5.7000000000000002e-002 | Y277: 185 | Z277: 9.24 | AA277: -2.9700000000000001e-002 | AB277: -3.5499999999999997e-002 | AC277: -7.8100000000000003e-002 | AD277: -7.9699999999999993e-002 | AE277: 81.03 | AF277: 84.6 | AG277: 0.75 | AH277: AA- | AI277: 6.4100000000000004e-002 | AJ277: =H277+100*O277 -> 166.80000000000001 | AK277: 170.7 | AL277: 322 | AM277: 86.1 | AN277: 329 | AO277: 1.e-003 | AP277: 3 | AQ277: 三角转债
A278: 194 | B278: 113575 | C278: 东时转债!! | D278: 603377 | E278: 东方时尚 | F278: 其他 | G278: 其他 | H278: 131.07 | I278: 5.0000000000000001e-004 | J278: -5.0000000000000001e-004 | K278: 9.75 | L278: 0. | M278: 113.1 | N278: 12.15 | O278: 0.63300000000000001 | P278: 80.25 | Q278: 转股中 | R278: 4.75年 | S278: 2.75年 | T278: 0.98 | U278: 15 | V278: 0.115 | W278: 1.3999999999999999e-002 | X278: 1.1000000000000001e-002 | Y278: 71 | Z278: 2.84 | AA278: -3.1099999999999999e-002 | AB278: -3.5900000000000001e-002 | AC278: -7.85e-002 | AD278: -8.0500000000000002e-002 | AE278: 91.86 | AF278: 93.43 | AG278: 0.36 | AH278: AA | AI278: 4.1900000000000007e-002 | AJ278: =H278+100*O278 -> 194.37 | AK278: 181.9 | AL278: 332 | AM278: 88.5 | AN278: 331 | AO278: -5.7999999999999996e-002 | AP278: 14 | AQ278: 东时转债!!
A279: 109 | B279: 123069 | C279: 金诺转债! | D279: 300505 | E279: 川金诺 | F279: 化工 | G279: 农化 | H279: 148.5 | I279: 0.13100000000000001 | J279: 3.4799999999999998e-002 | K279: 28.13 | L279: 0.20000000000000001 | M279: 126 | N279: 19.15 | O279: 1.1000000000000001e-002 | P279: 146.89 | Q279: 转股中 | R279: 5.27年 | S279: 3.27年 | T279: 3.68 | U279: 2612. | V279: 4.9100000000000001 | W279: 0.10000000000000001 | X279: 0.14699999999999999 | Y279: 37 | Z279: 3.88 | AA279: -3.1300000000000001e-002 | AB279: -3.9e-002 | AC279: -9.9499999999999991e-002 | AD279: -0.10099999999999999 | AE279: 84.14 | AF279: 91.44 | AG279: 0.83 | AH279: AA- | AI279: 6.4100000000000004e-002 | AJ279: =H279+100*O279 -> 149.59999999999999 | AK279: 150.1 | AL279: 283 | AM279: 58.7 | AN279: 282 | AO279: 0.43099999999999999 | AP279: 19 | AQ279: 金诺转债!
A280: 359 | B280: 113013 | C280: 国君转债! | D280: 601211 | E280: 国泰君安 | F280: 金融 | G280: 证券行业 | H280: 113.79 | I280: 1.78e-002 | J280: -1.6399999999999998e-002 | K280: 16.65 | L280: 4.7999999999999996e-003 | M280: 106.8 | N280: 19.01 | O280: 0.29899999999999999 | P280: 87.59 | Q280: 转股中 | R280: 1.99年 | S280: 无权 | T280: 69.9 | U280: 48 | V280: 6.0000000000000001e-003 | W280: 4.7e-002 | X280: 4.0999999999999995e-002 | Y280: 1483. | Z280: 1.14 | AA280: -3.15e-002 | AB280: -3.7699999999999997e-002 | AC280: 无权 | AD280: 无权 | AE280: 无权 | AF280: 99.7 | AG280: 0.29 | AH280: AAA | AI280: 3.5400000000000001e-002 | AJ280: =H280+100*O280 -> 143.69 | AK280: 140 | AL280: 228 | AM280: 40.3 | AN280: 154 | AO280: -1.4999999999999999e-002 | AP280: 12 | AQ280: 国君转债!
A281: 202 | B281: 128101 | C281: 联创转债! | D281: 2036 | E281: 联创电子 | F281: 电子 | G281: 液晶显示 | H281: 133.1 | I281: 2.3099999999999999e-002 | J281: 2.0299999999999999e-002 | K281: 15.36 | L281: 6.4399999999999999e-002 | M281: 114.8 | N281: 13.72 | O281: 0.18899999999999997 | P281: 111.95 | Q281: 转股中 | R281: 4.68年 | S281: 2.69年 | T281: 3 | U281: 297 | V281: 0.73799999999999999 | W281: 1.8000000000000002e-002 | X281: 2.1000000000000001e-002 | Y281: 163 | Z281: 4.43 | AA281: -3.1600000000000003e-002 | AB281: -3.7000000000000005e-002 | AC281: -8.5600000000000009e-002 | AD281: -8.7499999999999994e-002 | AE281: 91.98 | AF281: 95.07 | AG281: 0.67 | AH281: AA | AI281: 4.1900000000000007e-002 | AJ281: =H281+100*O281 -> 152. | AK281: 154.2 | AL281: 290 | AM281: 59.2 | AN281: 284 | AO281: 0.20699999999999999 | AP281: 15 | AQ281: 联创转债!
A282: 330 | B282: 128036 | C282: 金农转债!! | D282: 2548 | E282: 金新农 | F282: 农业 | G282: 畜牧业 | H282: 118.98 | I282: 1.9e-003 | J282: -2.0000000000000001e-004 | K282: 5.63 | L282: 7.1999999999999998e-003 | M282: 109.3 | N282: 6.93 | O282: 0.46500000000000002 | P282: 81.24 | Q282: 转股中 | R282: 2.66年 | S282: 0.67年 | T282: 1.46 | U282: 10 | V282: 5.7999999999999996e-002 | W282: 3.7999999999999999e-002 | X282: 2.9999999999999999e-002 | Y282: 39 | Z282: 1.49 | AA282: -3.1800000000000002e-002 | AB282: -3.7999999999999999e-002 | AC282: -0.17699999999999999 | AD282: -0.18100000000000002 | AE282: 96.89 | AF282: 93.5 | AG282: 0.24 | AH282: AA- | AI282: 6.1399999999999996e-002 | AJ282: =H282+100*O282 -> 165.48000000000002 | AK282: 156.7 | AL282: 299 | AM282: 59.8 | AN282: 286 | AO282: -1.2e-002 | AP282: 16 | AQ282: 金农转债!!
A283: 106 | B283: 123070 | C283: 鹏辉转债 | D283: 300438 | E283: 鹏辉能源 | F283: 汽车 | G283: 零部件制 | H283: 136.349 | I283: 4.7199999999999999e-002 | J283: 3.1400000000000004e-002 | K283: 27.27 | L283: 9.3900000000000011e-002 | M283: 115.1 | N283: 20.06 | O283: 3.0000000000000001e-003 | P283: 135.94 | Q283: 转股中 | R283: 5.28年 | S283: 3.28年 | T283: 8.9 | U283: 1393. | V283: 1.1299999999999999 | W283: 7.8e-002 | X283: 0.106 | Y283: 114 | Z283: 4.84 | AA283: -3.2099999999999997e-002 | AB283: -3.7000000000000005e-002 | AC283: -7.7100000000000002e-002 | AD283: -7.8899999999999998e-002 | AE283: 89.69 | AF283: 92.51 | AG283: 0.84 | AH283: AA | AI283: 4.3099999999999999e-002 | AJ283: =H283+100*O283 -> 136.649 | AK283: 136.8 | AL283: 198 | AM283: 44.2 | AN283: 199 | AO283: 0.20199999999999999 | AP283: 5 | AQ283: 鹏辉转债
A284: 82 | B284: 123079 | C284: 运达转债 | D284: 300772 | E284: 运达股份 | F284: 能源电力 | G284: 风能 | H284: 137.538 | I284: 1.15e-002 | J284: -2.18e-002 | K284: 19.95 | L284: -1.29e-002 | M284: 115.1 | N284: 15.12 | O284: 4.2000000000000003e-002 | P284: 131.94 | Q284: 转股中 | R284: 5.39年 | S284: 3.40年 | T284: 5.77 | U284: 94 | V284: 0.11900000000000001 | W284: 9.6000000000000002e-002 | X284: 0.126 | Y284: 60 | Z284: 3.47 | AA284: -3.3000000000000002e-002 | AB284: -3.7699999999999997e-002 | AC284: -7.6999999999999999e-002 | AD284: -7.8700000000000006e-002 | AE284: 89.26 | AF284: 92.06 | AG284: 0.81 | AH284: AA | AI284: 4.3099999999999999e-002 | AJ284: =H284+100*O284 -> 141.738 | AK284: 143.1 | AL284: 251 | AM284: 51.1 | AN284: 247 | AO284: 0.11699999999999999 | AP284: 4 | AQ284: 运达转债
A285: 171 | B285: 113585 | C285: 寿仙转债! | D285: 603896 | E285: 寿仙谷 | F285: 医药 | G285: 中药 | H285: 138.22 | I285: -6.9999999999999993e-003 | J285: 5.0000000000000001e-003 | K285: 38.59 | L285: -2.3e-003 | M285: 117.3 | N285: 28.38 | O285: 1.7000000000000001e-002 | P285: 135.98 | Q285: 转股中 | R285: 4.92年 | S285: 2.92年 | T285: 1.26 | U285: 28 | V285: 0.159 | W285: 2.1000000000000001e-002 | X285: 2.8999999999999998e-002 | Y285: 59 | Z285: 4.18 | AA285: -3.3399999999999999e-002 | AB285: -3.9300000000000002e-002 | AC285: -8.9800000000000005e-002 | AD285: -9.1799999999999993e-002 | AE285: 86.02 | AF285: 87.45 | AG285: 0.84 | AH285: AA- | AI285: 6.2899999999999998e-002 | AJ285: =H285+100*O285 -> 139.91999999999999 | AK285: 140.5 | AL285: 233 | AM285: 53 | AN285: 259 | AO285: 1.3000000000000001e-002 | AP285: 11 | AQ285: 寿仙转债!
A286: 42 | B286: 118000 | C286: 嘉元转债 | D286: 688388 | E286: 嘉元科技 | F286: 电子 | G286: 电子产品 | H286: 146.11 | I286: 4.4000000000000003e-003 | J286: 8.0000000000000002e-003 | K286: 105.5 | L286: 1.54e-002 | M286: 121 | N286: 78.74 | O286: 8.9999999999999997e-002 | P286: 133.99 | Q286: 54天 | R286: 5.62年 | S286: 3.63年 | T286: 12.4 | U286: 82 | V286: 4.4999999999999998e-002 | W286: 5.0999999999999997e-002 | X286: 6.8000000000000005e-002 | Y286: 244 | Z286: 8.95 | AA286: -3.3599999999999998e-002 | AB286: -3.9599999999999996e-002 | AC286: -8.6599999999999996e-002 | AD286: -8.8300000000000003e-002 | AE286: 82.29 | AF286: 85.92 | AG286: 0.81 | AH286: AA- | AI286: 6.4100000000000004e-002 | AJ286: =H286+100*O286 -> 155.11000000000001 | AK286: 158.2 | AL286: 302 | AM286: 72.3 | AN286: 313 | AO286: 0.16399999999999998 | AP286: 4 | AQ286: 嘉元转债
A287: 37 | B287: 123103 | C287: 震安转债 | D287: 300767 | E287: 震安科技 | F287: 化工 | G287: 橡胶塑料 | H287: 149.14 | I287: -4.41e-002 | J287: 1.3100000000000001e-002 | K287: 79.98 | L287: -3.6799999999999999e-002 | M287: 121.4 | N287: 56.89 | O287: 6.0999999999999999e-002 | P287: 140.59 | Q287: 2月13天 | R287: 5.67年 | S287: 3.67年 | T287: 2.85 | U287: 92 | V287: 0.215 | W287: 1.8000000000000002e-002 | X287: 2.5000000000000001e-002 | Y287: 161 | Z287: 10.11 | AA287: -3.6299999999999999e-002 | AB287: -4.24e-002 | AC287: -8.9200000000000002e-002 | AD287: -9.11e-002 | AE287: 79.45 | AF287: 81.29 | AG287: 0.84 | AH287: A+ | AI287: 7.51e-002 | AJ287: =H287+100*O287 -> 155.23999999999998 | AK287: 157.7 | AL287: 300 | AM287: 76.4 | AN287: 320 | AO287: 2.e-002 | AP287: 4 | AQ287: 震安转债
A288: 146 | B288: 123060 | C288: 苏试转债 | D288: 300416 | E288: 苏试试验 | F288: 机械装备 | G288: 专用设备 | H288: 141.506 | I288: -5.1999999999999998e-003 | J288: -5.0000000000000001e-003 | K288: 25.2 | L288: -1.2199999999999999e-002 | M288: 117.6 | N288: 18.28 | O288: 2.6000000000000002e-002 | P288: 137.86 | Q288: 转股中 | R288: 5年11天 | S288: 3年12天 | T288: 3.1 | U288: 66 | V288: 0.14999999999999999 | W288: 4.7e-002 | X288: 6.4000000000000001e-002 | Y288: 66 | Z288: 5.49 | AA288: -3.6799999999999999e-002 | AB288: -4.2599999999999999e-002 | AC288: -9.2899999999999996e-002 | AD288: -9.4800000000000009e-002 | AE288: 85.42 | AF288: 86.66 | AG288: 0.84 | AH288: AA- | AI288: 6.4100000000000004e-002 | AJ288: =H288+100*O288 -> 144.10599999999999 | AK288: 145.2 | AL288: 260 | AM288: 58.5 | AN288: 281 | AO288: 0.111 | AP288: 9 | AQ288: 苏试转债
A289: 240 | B289: 123035 | C289: 利德转债! | D289: 300296 | E289: 利亚德 | F289: 电子 | G289: LED制 | H289: 135.29 | I289: -1.5e-003 | J289: 5.0000000000000001e-003 | K289: 8.46 | L289: 4.7999999999999996e-003 | M289: 115.1 | N289: 6.96 | O289: 0.113 | P289: 121.55 | Q289: 转股中 | R289: 4.35年 | S289: 2.35年 | T289: 8 | U289: 29 | V289: 2.7000000000000003e-002 | W289: 3.7000000000000005e-002 | X289: 4.4999999999999998e-002 | Y289: 215 | Z289: 2.95 | AA289: -3.7200000000000004e-002 | AB289: -4.3099999999999999e-002 | AC289: -0.10099999999999999 | AD289: -0.10300000000000001 | AE289: 94.22 | AF289: 97.87 | AG289: 0.73 | AH289: AA+ | AI289: 3.8900000000000004e-002 | AJ289: =H289+100*O289 -> 146.59 | AK289: 149 | AL289: 277 | AM289: 51.2 | AN289: 249 | AO289: 5.9999999999999998e-002 | AP289: 14 | AQ289: 利德转债!
A290: 5 | B290: 123115 | C290: 捷捷转债 | D290: 300623 | E290: 捷捷微电 | F290: 电子 | G290: 元器件制 | H290: 148.2 | I290: 3.2799999999999996e-002 | J290: -5.3e-003 | K290: 36 | L290: 3.4799999999999998e-002 | M290: 118.5 | N290: 29 | O290: 0.19399999999999998 | P290: 124.14 | Q290: 5月9天 | R290: 5.91年 | S290: 3.92年 | T290: 12 | U290: 163 | V290: 9.4e-002 | W290: 4.4999999999999998e-002 | X290: 5.5999999999999994e-002 | Y290: 265 | Z290: 6.8 | AA290: -3.7699999999999997e-002 | AB290: -4.2800000000000005e-002 | AC290: -8.4100000000000008e-002 | AD290: -8.5600000000000009e-002 | AE290: 80.77 | AF290: 82.64 | AG290: 0.79 | AH290: AA- | AI290: 6.4100000000000004e-002 | AJ290: =H290+100*O290 -> 167.59999999999999 | AK290: 172.3 | AL290: 325 | AM290: 89.6 | AN290: 333 | AO290: 4.0999999999999995e-002 | AP290: 3 | AQ290: 捷捷转债
A291: 101 | B291: 127023 | C291: 华菱转2!* | D291: 932 | E291: 华菱钢铁 | F291: 钢铁 | G291: 炼钢 | H291: 135 | I291: 2.8300000000000002e-002 | J291: 2.3e-003 | K291: 6.74 | L291: 3.0600000000000002e-002 | M291: 110.1 | N291: 4.97 | O291: -5.0000000000000001e-003 | P291: 135.61 | Q291: 转股中 | R291: 5.29年 | S291: 4.29年 | T291: 13.1 | U291: 499 | V291: 0.28600000000000003 | W291: 2.9999999999999999e-002 | X291: 4.0000000000000001e-002 | Y291: 444 | Z291: 1.18 | AA291: -3.8399999999999997e-002 | AB291: -4.1599999999999998e-002 | AC291: -5.6500000000000002e-002 | AD291: -5.8200000000000002e-002 | AE291: 88.58 | AF291: 90.63 | AG291: 1 | AH291: AAA | AI291: 3.8100000000000002e-002 | AJ291: =H291+100*O291 -> 134.5 | AK291: 134.4 | AL291: 172 | AM291: 43.8 | AN291: 193 | AO291: 1.7000000000000001e-002 | AP291: 11 | AQ291: 华菱转2!*
A292: 364 | B292: 113011 | C292: 光大转债 | D292: 601818 | E292: 光大银行 | F292: 金融 | G292: 银行行业 | H292: 114.15 | I292: -2.2000000000000001e-003 | J292: -2.3999999999999998e-003 | K292: 3.62 | L292: -1.09e-002 | M292: 106.8 | N292: 3.76 | O292: 0.18600000000000003 | P292: 96.28 | Q292: 转股中 | R292: 1.69年 | S292: 无权 | T292: 242 | U292: 154 | V292: 6.0000000000000001e-003 | W292: 0.124 | X292: 0.11900000000000001 | Y292: 1956. | Z292: 0.55 | AA292: -3.9e-002 | AB292: -4.6300000000000001e-002 | AC292: 无权 | AD292: 无权 | AE292: 无权 | AF292: 100.77 | AG292: 0.42 | AH292: AAA | AI292: 3.5400000000000001e-002 | AJ292: =H292+100*O292 -> 132.75 | AK292: 132 | AL292: 145 | AM292: 31.3 | AN292: 62 | AO292: -4.0999999999999995e-002 | AP292: 13 | AQ292: 光大转债
A293: 241 | B293: 110061 | C293: 川投转债 | D293: 600674 | E293: 川投能源 | F293: 能源电力 | G293: 水电 | H293: 131.36 | I293: -3.7000000000000002e-003 | J293: 1.3100000000000001e-002 | K293: 12.42 | L293: 1.1399999999999999e-002 | M293: 110.8 | N293: 9.58 | O293: 1.3000000000000001e-002 | P293: 129.65 | Q293: 转股中 | R293: 4.34年 | S293: 2.34年 | T293: 39.6 | U293: 38 | V293: 6.9999999999999993e-003 | W293: 7.2000000000000008e-002 | X293: 9.4e-002 | Y293: 547 | Z293: 1.9 | AA293: -3.9199999999999999e-002 | AB293: -4.3499999999999997e-002 | AC293: -9.2100000000000015e-002 | AD293: -9.4299999999999995e-002 | AE293: 94.41 | AF293: 94.99 | AG293: 0.82 | AH293: AAA | AI293: 3.6900000000000002e-002 | AJ293: =H293+100*O293 -> 132.66000000000003 | AK293: 133.1 | AL293: 157 | AM293: 38.1 | AN293: 135 | AO293: 2.9999999999999999e-002 | AP293: 14 | AQ293: 川投转债
A294: 355 | B294: 128018 | C294: 时达转债! | D294: 2527 | E294: 新时达 | F294: 机械装备 | G294: 机器人及 | H294: 119.997 | I294: 2.5000000000000001e-003 | J294: 7.1999999999999998e-003 | K294: 8.09 | L294: 1.5100000000000001e-002 | M294: 109.3 | N294: 7.4 | O294: 9.8000000000000004e-002 | P294: 109.32 | Q294: 转股中 | R294: 2.33年 | S294: 0.33年 | T294: 4.04 | U294: 38 | V294: 7.8e-002 | W294: 8.0000000000000002e-002 | X294: 8.8000000000000009e-002 | Y294: 50 | Z294: 1.91 | AA294: -4.0000000000000001e-002 | AB294: -4.7e-002 | AC294: -0.32500000000000001 | AD294: -0.33100000000000002 | AE294: 99.83 | AF294: 99.85 | AG294: 0.65 | AH294: AA | AI294: 4.0399999999999998e-002 | AJ294: =H294+100*O294 -> 129.797 | AK294: 130.7 | AL294: 128 | AM294: 30.8 | AN294: 56 | AO294: 8.5000000000000006e-002 | AP294: 35 | AQ294: 时达转债!
A295: 33 | B295: 127029 | C295: 中钢转债 | D295: 928 | E295: 中钢国际 | F295: 建筑 | G295: 建筑工程 | H295: 147.873 | I295: -2.5000000000000001e-003 | J295: -1.5700000000000002e-002 | K295: 9.4 | L295: -2.0799999999999999e-002 | M295: 117.5 | N295: 5.89 | O295: -7.2999999999999995e-002 | P295: 159.59 | Q295: 2月20天 | R295: 5.69年 | S295: 3.69年 | T295: 9.6 | U295: 215 | V295: 0.152 | W295: 8.1000000000000003e-002 | X295: 0.13 | Y295: 118 | Z295: 2.05 | AA295: -4.0099999999999997e-002 | AB295: -4.5100000000000001e-002 | AC295: -8.9800000000000005e-002 | AD295: -9.11e-002 | AE295: 88.58 | AF295: 94.24 | AG295: 0.88 | AH295: AA+ | AI295: 4.0099999999999997e-002 | AJ295: =H295+100*O295 -> 140.57299999999998 | AK295: 136.2 | AL295: 190 | AM295: 41.9 | AN295: 174 | AO295: -1.7000000000000001e-002 | AP295: 9 | AQ295: 中钢转债
A296: 103 | B296: 113040 | C296: 星宇转债!* | D296: 601799 | E296: 星宇股份 | F296: 汽车 | G296: 零部件制 | H296: 138.16 | I296: 1.1899999999999999e-002 | J296: -2.9999999999999997e-004 | K296: 217.5 | L296: 1.1599999999999999e-002 | M296: 111.5 | N296: 156.7 | O296: -5.0000000000000001e-003 | P296: 138.8 | Q296: 转股中 | R296: 5.29年 | S296: 3.29年 | T296: 12.3 | U296: 265 | V296: 0.158 | W296: 2.e-002 | X296: 2.7999999999999997e-002 | Y296: 602 | Z296: 9.93 | AA296: -4.0199999999999993e-002 | AB296: -4.3899999999999995e-002 | AC296: -8.3900000000000002e-002 | AD296: -8.4900000000000003e-002 | AE296: 89.34 | AF296: 90.82 | AG296: 1 | AH296: AA+ | AI296: 4.0099999999999997e-002 | AJ296: =H296+100*O296 -> 137.66 | AK296: 137.5 | AL296: 204 | AM296: 46.7 | AN296: 219 | AO296: -1.e-003 | AP296: 5 | AQ296: 星宇转债!*
A297: 117 | B297: 123066 | C297: 赛意转债! | D297: 300687 | E297: 赛意信息 | F297: 计算机及 | G297: 软件开发 | H297: 151.8 | I297: -2.69e-002 | J297: -3.9000000000000003e-003 | K297: 20.78 | L297: -3.6200000000000003e-002 | M297: 121.4 | N297: 14.01 | O297: 2.3e-002 | P297: 148.32 | Q297: 转股中 | R297: 5.19年 | S297: 3.19年 | T297: 2.43 | U297: 100 | V297: 0.26700000000000002 | W297: 3.3000000000000002e-002 | X297: 4.9000000000000002e-002 | Y297: 73 | Z297: 4.59 | AA297: -4.2999999999999997e-002 | AB297: -4.9599999999999998e-002 | AC297: -0.105 | AD297: -0.106 | AE297: 82.06 | AF297: 84.14 | AG297: 0.85 | AH297: A+ | AI297: 7.51e-002 | AJ297: =H297+100*O297 -> 154.10000000000002 | AK297: 155.3 | AL297: 295 | AM297: 71.1 | AN297: 311 | AO297: -1.3000000000000001e-002 | AP297: 9 | AQ297: 赛意转债!
A298: 43 | B298: 123100 | C298: 朗科转债 | D298: 300543 | E298: 朗科智能 | F298: 电子 | G298: 电子产品 | H298: 149.54 | I298: 4.5700000000000005e-002 | J298: 3.5799999999999998e-002 | K298: 18.12 | L298: 9.1600000000000001e-002 | M298: 117.5 | N298: 11.61 | O298: -4.2000000000000003e-002 | P298: 156.07 | Q298: 44天 | R298: 5.59年 | S298: 3.59年 | T298: 3.8 | U298: 1533. | V298: 2.6000000000000001 | W298: 7.8e-002 | X298: 0.122 | Y298: 49 | Z298: 3.99 | AA298: -4.2999999999999997e-002 | AB298: -4.8099999999999997e-002 | AC298: -9.3299999999999994e-002 | AD298: -9.4899999999999998e-002 | AE298: 82.42 | AF298: 83.63 | AG298: 0.89 | AH298: AA- | AI298: 6.4100000000000004e-002 | AJ298: =H298+100*O298 -> 145.34 | AK298: 143 | AL298: 250 | AM298: 59.4 | AN298: 285 | AO298: 0.21299999999999999 | AP298: 9 | AQ298: 朗科转债
A299: 23 | B299: 123110 | C299: 九典转债 | D299: 300705 | E299: 九典制药 | F299: 医药 | G299: 化学制药 | H299: 155.426 | I299: -6.3e-003 | J299: 7.3000000000000001e-003 | K299: 41.35 | L299: 1.1999999999999999e-003 | M299: 121.4 | N299: 26.44 | O299: -6.0000000000000001e-003 | P299: 156.39 | Q299: 3月1天 | R299: 5.73年 | S299: 3.73年 | T299: 2.7 | U299: 87 | V299: 0.20600000000000002 | W299: 2.7999999999999997e-002 | X299: 4.4000000000000004e-002 | Y299: 97 | Z299: 11 | AA299: -4.2999999999999997e-002 | AB299: -4.8899999999999999e-002 | AC299: -9.7899999999999987e-002 | AD299: -9.9700000000000011e-002 | AE299: 78.98 | AF299: 80.92 | AG299: 0.88 | AH299: A+ | AI299: 7.51e-002 | AJ299: =H299+100*O299 -> 154.82599999999999 | AK299: 154.5 | AL299: 291 | AM299: 73.5 | AN299: 314 | AO299: 0.13600000000000001 | AP299: 5 | AQ299: 九典转债
A300: 58 | B300: 113615 | C300: 金诚转债 | D300: 603979 | E300: 金诚信 | F300: 有色金属 | G300: 有色行业 | H300: 149.79 | I300: 3.2000000000000001e-002 | J300: 8.6e-003 | K300: 19.03 | L300: 4.6199999999999998e-002 | M300: 117.3 | N300: 12.65 | O300: -4.0000000000000001e-003 | P300: 150.43 | Q300: 转股中 | R300: 5.46年 | S300: 3.46年 | T300: 10 | U300: 181 | V300: 0.122 | W300: 8.9999999999999997e-002 | X300: 0.13500000000000001 | Y300: 111 | Z300: 2.39 | AA300: -4.4600000000000001e-002 | AB300: -4.9800000000000004e-002 | AC300: -9.7100000000000006e-002 | AD300: -9.8699999999999996e-002 | AE300: 89.23 | AF300: 93.61 | AG300: 0.88 | AH300: AA | AI300: 4.3099999999999999e-002 | AJ300: =H300+100*O300 -> 149.38999999999999 | AK300: 149.1 | AL300: 278 | AM300: 55.5 | AN300: 265 | AO300: 6.9000000000000006e-002 | AP300: 3 | AQ300: 金诚转债
A301: 221 | B301: 123042 | C301: 银河转债! | D301: 300619 | E301: 金银河 | F301: 机械装备 | G301: 专用设备 | H301: 141.849 | I301: -2.8999999999999998e-003 | J301: 2.4900000000000002e-002 | K301: 26.81 | L301: 3.04e-002 | M301: 115.4 | N301: 24.38 | O301: 0.28999999999999998 | P301: 109.97 | Q301: 转股中 | R301: 4.52年 | S301: 2.52年 | T301: 1.67 | U301: 399 | V301: 1.6699999999999999 | W301: 8.3000000000000004e-002 | X301: 9.1999999999999998e-002 | Y301: 20 | Z301: 4.1 | AA301: -4.5599999999999995e-002 | AB301: -5.1200000000000002e-002 | AC301: -0.11 | AD301: -0.11199999999999999 | AE301: 85.87 | AF301: 84.28 | AG301: 0.72 | AH301: A+ | AI301: 7.3899999999999993e-002 | AJ301: =H301+100*O301 -> 170.84899999999999 | AK301: 173.7 | AL301: 326 | AM301: 87.9 | AN301: 330 | AO301: 0.13300000000000001 | AP301: 22 | AQ301: 银河转债!
A302: 3 | B302: 113049 | C302: 长汽转债 | D302: 601633 | E302: 长城汽车 | F302: 汽车 | G302: 乘用车 | H302: 148.02 | I302: 4.1900000000000007e-002 | J302: 2.4300000000000002e-002 | K302: 49.13 | L302: 8.2400000000000001e-002 | M302: 110.5 | N302: 38.39 | O302: 0.157 | P302: 127.98 | Q302: 5月11天 | R302: 5.92年 | S302: 3.92年 | T302: 35 | U302: 1792. | V302: 0.34700000000000003 | W302: 8.0000000000000002e-003 | X302: 1.e-002 | Y302: 4526. | Z302: 7.97 | AA302: -4.87e-002 | AB302: -5.1699999999999996e-002 | AC302: -8.6899999999999991e-002 | AD302: -8.7799999999999989e-002 | AE302: 87.83 | AF302: 88.79 | AG302: 0.8 | AH302: AAA | AI302: 3.8100000000000002e-002 | AJ302: =H302+100*O302 -> 163.72 | AK302: 168.1 | AL302: 317 | AM302: 79.3 | AN302: 323 | AO302: 0.124 | AP302: 2 | AQ302: 长汽转债
A303: 211 | B303: 123043 | C303: 正元转债 | D303: 300645 | E303: 正元智慧 | F303: 计算机及 | G303: 软件开发 | H303: 152.435 | I303: -2.1600000000000001e-002 | J303: 2.7000000000000001e-003 | K303: 17.13 | L303: -2.6699999999999998e-002 | M303: 120.9 | N303: 15.38 | O303: 0.36899999999999999 | P303: 111.38 | Q303: 转股中 | R303: 4.65年 | S303: 2.66年 | T303: 1.66 | U303: 232 | V303: 0.90300000000000002 | W303: 7.5999999999999998e-002 | X303: 8.5000000000000006e-002 | Y303: 22 | Z303: 3.39 | AA303: -4.9599999999999998e-002 | AB303: -5.67e-002 | AC303: -0.126 | AD303: -0.128 | AE303: 85.29 | AF303: 87.44 | AG303: 0.71 | AH303: A+ | AI303: 7.3899999999999993e-002 | AJ303: =H303+100*O303 -> 189.33500000000001 | AK303: 193.5 | AL303: 338 | AM303: 106.1 | AN303: 342 | AO303: -3.0000000000000001e-003 | AP303: 18 | AQ303: 正元转债
A304: 283 | B304: 123025 | C304: 精测转债!! | D304: 300567 | E304: 精测电子 | F304: 电子 | G304: 液晶显示 | H304: 141.016 | I304: -6.8999999999999999e-003 | J304: 4.0000000000000001e-002 | K304: 68.41 | L304: 3.9300000000000002e-002 | M304: 116.5 | N304: 49.37 | O304: 1.8000000000000002e-002 | P304: 138.57 | Q304: 转股中 | R304: 3.72年 | S304: 1.72年 | T304: 3.09 | U304: 1172. | V304: 2.6200000000000001 | W304: 1.6e-002 | X304: 2.2000000000000002e-002 | Y304: 190 | Z304: 9.58 | AA304: -5.0900000000000001e-002 | AB304: -5.8200000000000002e-002 | AC304: -0.128 | AD304: -0.13 | AE304: 91.73 | AF304: 93.26 | AG304: 0.84 | AH304: AA- | AI304: 6.2899999999999998e-002 | AJ304: =H304+100*O304 -> 142.816 | AK304: 143.5 | AL304: 254 | AM304: 50.2 | AN304: 242 | AO304: 0.20100000000000001 | AP304: 16 | AQ304: 精测转债!!
A305: 21 | B305: 123111 | C305: 东财转3 | D305: 300059 | E305: 东方财富 | F305: 金融 | G305: 证券行业 | H305: 149.4 | I305: 1.2e-002 | J305: -4.3e-003 | K305: 31.49 | L305: 9.300000000000001e-003 | M305: 110.5 | N305: 23.35 | O305: 0.10800000000000001 | P305: 134.86 | Q305: 3月6天 | R305: 5.74年 | S305: 3.75年 | T305: 158 | U305: 700 | V305: 2.9999999999999999e-002 | W305: 4.9000000000000002e-002 | X305: 6.5000000000000002e-002 | Y305: 3255. | Z305: 7.73 | AA305: -5.16e-002 | AB305: -5.4699999999999999e-002 | AC305: -9.3299999999999994e-002 | AD305: -9.4100000000000003e-002 | AE305: 87.52 | AF305: 88.38 | AG305: 0.83 | AH305: AA+ | AI305: 4.0099999999999997e-002 | AJ305: =H305+100*O305 -> 160.20000000000002 | AK305: 163.9 | AL305: 315 | AM305: 75.6 | AN305: 318 | AO305: 2.e-002 | AP305: 18 | AQ305: 东财转3
A306: 243 | B306: 123033 | C306: 金力转债! | D306: 300748 | E306: 金力永磁 | F306: 电子 | G306: 元器件制 | H306: 152 | I306: 5.3899999999999997e-002 | J306: -1.7299999999999999e-002 | K306: 37.75 | L306: 4.2199999999999994e-002 | M306: 121.5 | N306: 25.3 | O306: 1.9e-002 | P306: 149.21 | Q306: 转股中 | R306: 4.31年 | S306: 2.32年 | T306: 4.07 | U306: 3565. | V306: 5.7300000000000004 | W306: 1.6e-002 | X306: 2.3e-002 | Y306: 261 | Z306: 7.77 | AA306: -5.2000000000000005e-002 | AB306: -5.9800000000000006e-002 | AC306: -0.10300000000000001 | AD306: -0.105 | AE306: 90.48 | AF306: 94.17 | AG306: 0.87 | AH306: AA- | AI306: 6.2899999999999998e-002 | AJ306: =H306+100*O306 -> 153.90000000000001 | AK306: 154.8 | AL306: 292 | AM306: 60.6 | AN306: 289 | AO306: 0.28899999999999998 | AP306: 27 | AQ306: 金力转债!
A307: 278 | B307: 128064 | C307: 司尔转债! | D307: 2538 | E307: 司尔特 | F307: 化工 | G307: 农化 | H307: 139.985 | I307: 6.0499999999999998e-002 | J307: -1.9e-003 | K307: 8.19 | L307: 6.7799999999999999e-002 | M307: 114.3 | N307: 5.82 | O307: -5.0000000000000001e-003 | P307: 140.72 | Q307: 转股中 | R307: 3.75年 | S307: 1.75年 | T307: 7.88 | U307: 583 | V307: 0.53500000000000003 | W307: 0.13400000000000001 | X307: 0.188 | Y307: 59 | Z307: 1.47 | AA307: -5.3499999999999999e-002 | AB307: -5.9800000000000006e-002 | AC307: -0.124 | AD307: -0.125 | AE307: 95.09 | AF307: 98.29 | AG307: 0.86 | AH307: AA | AI307: 4.1900000000000007e-002 | AJ307: =H307+100*O307 -> 139.48500000000001 | AK307: 139.2 | AL307: 221 | AM307: 41 | AN307: 162 | AO307: 0.193 | AP307: 44 | AQ307: 司尔转债!
A308: 307 | B308: 110048 | C308: 福能转债!! | D308: 600483 | E308: 福能股份 | F308: 能源电力 | G308: 电力供应 | H308: 136.52 | I308: 2.06e-002 | J308: -8.199999999999999e-003 | K308: 10.67 | L308: 1.52e-002 | M308: 113.3 | N308: 8.12 | O308: 3.9e-002 | P308: 131.4 | Q308: 转股中 | R308: 3.41年 | S308: 1.41年 | T308: 19.5 | U308: 43 | V308: 1.6e-002 | W308: 9.8000000000000004e-002 | X308: 0.128 | Y308: 199 | Z308: 1.21 | AA308: -5.4199999999999998e-002 | AB308: -6.0599999999999994e-002 | AC308: -0.14599999999999999 | AD308: -0.14800000000000002 | AE308: 96.84 | AF308: 99.73 | AG308: 0.82 | AH308: AA+ | AI308: 3.8900000000000004e-002 | AJ308: =H308+100*O308 -> 140.42000000000002 | AK308: 141.6 | AL308: 239 | AM308: 41.9 | AN308: 173 | AO308: -1.6e-002 | AP308: 9 | AQ308: 福能转债!!
A309: 347 | B309: 128026 | C309: 众兴转债! | D309: 2772 | E309: 众兴菌业 | F309: 农业 | G309: 种植业 | H309: 125.027 | I309: -5.5e-002 | J309: 1.95e-002 | K309: 13.44 | L309: -4.5499999999999999e-002 | M309: 109.3 | N309: 11.36 | O309: 5.7000000000000002e-002 | P309: 118.31 | Q309: 转股中 | R309: 2.43年 | S309: 0.43年 | T309: 4.55 | U309: 380 | V309: 0.66099999999999992 | W309: 8.3000000000000004e-002 | X309: 9.9000000000000005e-002 | Y309: 55 | Z309: 1.92 | AA309: -5.4699999999999999e-002 | AB309: -6.13e-002 | AC309: -0.32600000000000001 | AD309: -0.33100000000000002 | AE309: 98.26 | AF309: 94.82 | AG309: 0.78 | AH309: AA- | AI309: 6.1399999999999996e-002 | AJ309: =H309+100*O309 -> 130.727 | AK309: 131.7 | AL309: 143 | AM309: 33.5 | AN309: 83 | AO309: 8.6999999999999994e-002 | AP309: 57 | AQ309: 众兴转债!
A310: 312 | B310: 128046 | C310: 利尔转债!! | D310: 2258 | E310: 利尔化学 | F310: 化工 | G310: 农化 | H310: 134.5 | I310: -2.2000000000000001e-003 | J310: 8.3999999999999995e-003 | K310: 24.57 | L310: 6.0999999999999995e-003 | M310: 112.3 | N310: 18.42 | O310: 8.0000000000000002e-003 | P310: 133.39 | Q310: 转股中 | R310: 3.27年 | S310: 1.27年 | T310: 8.35 | U310: 62 | V310: 5.5e-002 | W310: 6.5000000000000002e-002 | X310: 8.5999999999999993e-002 | Y310: 129 | Z310: 3.31 | AA310: -5.4699999999999999e-002 | AB310: -6.0899999999999996e-002 | AC310: -0.156 | AD310: -0.158 | AE310: 96.95 | AF310: 98.47 | AG310: 1 | AH310: AA | AI310: 4.1900000000000007e-002 | AJ310: =H310+100*O310 -> 135.30000000000001 | AK310: 135.6 | AL310: 185 | AM310: 37.1 | AN310: 128 | AO310: 1.e-002 | AP310: 9 | AQ310: 利尔转债!!
A311: 36 | B311: 123102 | C311: 华自转债 | D311: 300490 | E311: 华自科技 | F311: 机械装备 | G311: 机器人及 | H311: 173.698 | I311: 1.1000000000000001e-003 | J311: 1.8000000000000002e-002 | K311: 19.47 | L311: 2.0400000000000001e-002 | M311: 126.9 | N311: 9.26 | O311: -0.17399999999999999 | P311: 210.26 | Q311: 2月11天 | R311: 5.67年 | S311: 3.67年 | T311: 6.7 | U311: 1760. | V311: 1.51 | W311: 0.13400000000000001 | X311: 0.28199999999999997 | Y311: 50 | Z311: 2.85 | AA311: -5.4900000000000004e-002 | AB311: -6.2e-002 | AC311: -0.11900000000000001 | AD311: -0.121 | AE311: 82.92 | AF311: 89.96 | AG311: 0.93 | AH311: AA- | AI311: 6.4100000000000004e-002 | AJ311: =H311+100*O311 -> 156.298 | AK311: 137.1 | AL311: 201 | AM311: 47.2 | AN311: 226 | AO311: 0.29600000000000004 | AP311: 19 | AQ311: 华自转债
A312: 306 | B312: 128050 | C312: 钧达转债!! | D312: 2865 | E312: 钧达股份 | F312: 汽车 | G312: 零部件制 | H312: 149.65 | I312: -1.6799999999999999e-002 | J312: 1.32e-002 | K312: 22.12 | L312: -3.5999999999999999e-003 | M312: 122.7 | N312: 14.8 | O312: 1.e-003 | P312: 149.46 | Q312: 转股中 | R312: 3.42年 | S312: 1.42年 | T312: 1.4 | U312: 591 | V312: 2.6899999999999999 | W312: 4.8000000000000001e-002 | X312: 7.0999999999999994e-002 | Y312: 29 | Z312: 2.74 | AA312: -5.74e-002 | AB312: -6.7699999999999996e-002 | AC312: -0.184 | AD312: -0.18600000000000003 | AE312: 93.61 | AF312: 100.04 | AG312: 1 | AH312: AA- | AI312: 6.2899999999999998e-002 | AJ312: =H312+100*O312 -> 149.75 | AK312: 149.8 | AL312: 282 | AM312: 49.8 | AN312: 240 | AO312: 0.114 | AP312: 50 | AQ312: 钧达转债!!
A313: 127 | B313: 128128 | C313: 齐翔转2! | D313: 2408 | E313: 齐翔腾达 | F313: 化工 | G313: 化工 | H313: 155.3 | I313: 4.2900000000000001e-002 | J313: -3.9000000000000003e-003 | K313: 12.38 | L313: 4.3799999999999999e-002 | M313: 115.3 | N313: 7.97 | O313: 0. | P313: 155.33 | Q313: 转股中 | R313: 5年41天 | S313: 3年42天 | T313: 9.42 | U313: 145 | V313: 0.10000000000000001 | W313: 3.7999999999999999e-002 | X313: 5.9000000000000004e-002 | Y313: 247 | Z313: 2.27 | AA313: -5.7599999999999998e-002 | AB313: -6.2400000000000004e-002 | AC313: -0.114 | AD313: -0.11599999999999999 | AE313: 90.44 | AF313: 93.34 | AG313: 0.89 | AH313: AA | AI313: 4.3099999999999999e-002 | AJ313: =H313+100*O313 -> 155.30000000000001 | AK313: 155.3 | AL313: 294 | AM313: 61.9 | AN313: 294 | AO313: 7.0000000000000007e-002 | AP313: 33 | AQ313: 齐翔转2!
A314: 56 | B314: 113616 | C314: 韦尔转债 | D314: 603501 | E314: 韦尔股份 | F314: 电子 | G314: 元器件制 | H314: 158.48 | I314: -1.26e-002 | J314: -2.5000000000000001e-003 | K314: 329.15 | L314: -1.7500000000000002e-002 | M314: 114.5 | N314: 222.52 | O314: 7.0999999999999994e-002 | P314: 147.92 | Q314: 转股中 | R314: 5.47年 | S314: 3.47年 | T314: 24.4 | U314: 326 | V314: 8.4000000000000005e-002 | W314: 9.0000000000000011e-003 | X314: 1.3000000000000001e-002 | Y314: 2859. | Z314: 22.97 | AA314: -5.8499999999999996e-002 | AB314: -6.2800000000000009e-002 | AC314: -0.109 | AD314: -0.11 | AE314: 89.35 | AF314: 92.65 | AG314: 0.87 | AH314: AA+ | AI314: 4.0099999999999997e-002 | AJ314: =H314+100*O314 -> 165.57999999999998 | AK314: 169 | AL314: 319 | AM314: 76.4 | AN314: 319 | AO314: 9.4e-002 | AP314: 9 | AQ314: 韦尔转债
A315: 168 | B315: 128113 | C315: 比音转债! | D315: 2832 | E315: 比音勒芬 | F315: 服装纺织 | G315: 服装行业 | H315: 157.532 | I315: -6.9000000000000006e-002 | J315: 3.0600000000000002e-002 | K315: 22.88 | L315: -4.2699999999999995e-002 | M315: 116.9 | N315: 14.6 | O315: 5.0000000000000001e-003 | P315: 156.71 | Q315: 转股中 | R315: 4.93年 | S315: 2.93年 | T315: 3.03 | U315: 86 | V315: 0.17800000000000002 | W315: 2.4e-002 | X315: 3.7999999999999999e-002 | Y315: 126 | Z315: 4.73 | AA315: -5.96e-002 | AB315: -6.5099999999999991e-002 | AC315: -0.125 | AD315: -0.127 | AE315: 91.14 | AF315: 95.83 | AG315: 0.9 | AH315: AA | AI315: 4.1900000000000007e-002 | AJ315: =H315+100*O315 -> 158.03200000000001 | AK315: 158.4 | AL315: 303 | AM315: 62.5 | AN315: 295 | AO315: -6.8000000000000005e-002 | AP315: 9 | AQ315: 比音转债!
A316: 48 | B316: 113621 | C316: 彤程转债 | D316: 603650 | E316: 彤程新材 | F316: 化工 | G316: 橡胶塑料 | H316: 161.69 | I316: -2.e-003 | J316: 1.4499999999999999e-002 | K316: 52.5 | L316: 1.37e-002 | M316: 115.1 | N316: 32.62 | O316: 5.0000000000000001e-003 | P316: 160.94 | Q316: 24天 | R316: 5.55年 | S316: 3.55年 | T316: 8 | U316: 600 | V316: 0.46600000000000003 | W316: 2.6000000000000002e-002 | X316: 4.2000000000000003e-002 | Y316: 308 | Z316: 11.94 | AA316: -6.0299999999999999e-002 | AB316: -6.4699999999999994e-002 | AC316: -0.11 | AD316: -0.111 | AE316: 88.68 | AF316: 91.47 | AG316: 0.91 | AH316: AA | AI316: 4.3099999999999999e-002 | AJ316: =H316+100*O316 -> 162.19 | AK316: 162.4 | AL316: 311 | AM316: 71 | AN316: 310 | AO316: 0.13400000000000001 | AP316: 5 | AQ316: 彤程转债
A317: 198 | B317: 128103 | C317: 同德转债! | D317: 2360 | E317: 同德化工 | F317: 化工 | G317: 化工 | H317: 164.99 | I317: 7.000000000000001e-004 | J317: 1.8e-003 | K317: 8.19 | L317: 2.3999999999999998e-003 | M317: 121.3 | N317: 5.08 | O317: 2.3e-002 | P317: 161.22 | Q317: 转股中 | R317: 4.71年 | S317: 2.71年 | T317: 1.09 | U317: 53 | V317: 0.29499999999999998 | W317: 3.3000000000000002e-002 | X317: 5.4000000000000006e-002 | Y317: 33 | Z317: 2.55 | AA317: -6.4500000000000002e-002 | AB317: -7.1399999999999991e-002 | AC317: -0.14599999999999999 | AD317: -0.10000000000000001 | AE317: 85.05 | AF317: 87.38 | AG317: 1 | AH317: A+ | AI317: 7.3899999999999993e-002 | AJ317: =H317+100*O317 -> 167.29000000000002 | AK317: 168.8 | AL317: 318 | AM317: 81.4 | AN317: 324 | AO317: 7.8e-002 | AP317: 13 | AQ317: 同德转债!
A318: 329 | B318: 113508 | C318: 新凤转债! | D318: 603225 | E318: 新凤鸣 | F318: 服装纺织 | G318: 纺织行业 | H318: 133.85 | I318: 2.4e-002 | J318: -9.4999999999999998e-003 | K318: 20.91 | L318: 1.7000000000000001e-002 | M318: 111.3 | N318: 15.65 | O318: 2.e-003 | P318: 133.61 | Q318: 转股中 | R318: 2.79年 | S318: 0.80年 | T318: 20.4 | U318: 166 | V318: 6.2e-002 | W318: 7.0000000000000007e-002 | X318: 9.3000000000000013e-002 | Y318: 293 | Z318: 2.4 | AA318: -6.4699999999999994e-002 | AB318: -7.1500000000000008e-002 | AC318: -0.25 | AD318: -0.253 | AE318: 98 | AF318: 99.8 | AG318: 0.85 | AH318: AA | AI318: 4.0399999999999998e-002 | AJ318: =H318+100*O318 -> 134.04999999999998 | AK318: 134.1 | AL318: 170 | AM318: 34.3 | AN318: 91 | AO318: 5.7000000000000002e-002 | AP318: 22 | AQ318: 新凤转债!
A319: 18 | B319: 113047 | C319: 旗滨转债 | D319: 601636 | E319: 旗滨集团 | F319: 建筑 | G319: 玻璃 | H319: 171.23 | I319: 5.9999999999999995e-004 | J319: -1.1000000000000001e-002 | K319: 18.89 | L319: -1.2e-002 | M319: 114 | N319: 12.8 | O319: 0.16 | P319: 147.58 | Q319: 3月8天 | R319: 5.75年 | S319: 3.75年 | T319: 15 | U319: 140 | V319: 5.5999999999999994e-002 | W319: 2.9999999999999999e-002 | X319: 4.4000000000000004e-002 | Y319: 507 | Z319: 4.88 | AA319: -6.9099999999999995e-002 | AB319: -7.2999999999999995e-002 | AC319: -0.11800000000000001 | AD319: -0.11900000000000001 | AE319: 87.95 | AF319: 91.2 | AG319: 0.86 | AH319: AA+ | AI319: 4.0099999999999997e-002 | AJ319: =H319+100*O319 -> 187.22999999999999 | AK319: 194.9 | AL319: 341 | AM319: 103.7 | AN319: 340 | AO319: 4.4000000000000004e-002 | AP319: 5 | AQ319: 旗滨转债
A320: 31 | B320: 127030 | C320: 盛虹转债 | D320: 301 | E320: 东方盛虹 | F320: 化工 | G320: 化纤 | H320: 168.697 | I320: 4.8000000000000001e-002 | J320: 3.5999999999999999e-003 | K320: 22.28 | L320: 5.6900000000000006e-002 | M320: 112.5 | N320: 14.1 | O320: 6.8000000000000005e-002 | P320: 158.01 | Q320: 2月20天 | R320: 5.70年 | S320: 3.70年 | T320: 50 | U320: 337 | V320: 4.0999999999999995e-002 | W320: 4.5999999999999999e-002 | X320: 7.2999999999999995e-002 | Y320: 1077. | Z320: 5.94 | AA320: -6.9500000000000006e-002 | AB320: -7.2999999999999995e-002 | AC320: -0.11599999999999999 | AD320: -0.11699999999999999 | AE320: 88.55 | AF320: 90.21 | AG320: 0.91 | AH320: AA+ | AI320: 4.0099999999999997e-002 | AJ320: =H320+100*O320 -> 175.49700000000001 | AK320: 179.4 | AL320: 330 | AM320: 89.2 | AN320: 332 | AO320: 0.223 | AP320: 4 | AQ320: 盛虹转债
A321: 289 | B321: 123022 | C321: 长信转债!! | D321: 300088 | E321: 长信科技 | F321: 通信互联 | G321: 通信设备 | H321: 150 | I321: 1.21e-002 | J321: -1.9e-003 | K321: 8.54 | L321: 1.18e-002 | M321: 114.3 | N321: 6.05 | O321: 6.3e-002 | P321: 141.16 | Q321: 转股中 | R321: 3.69年 | S321: 1.69年 | T321: 2.57 | U321: 56 | V321: 0.14499999999999999 | W321: 1.2e-002 | X321: 1.7000000000000001e-002 | Y321: 210 | Z321: 2.9 | AA321: -7.22e-002 | AB321: -7.8399999999999997e-002 | AC321: -0.153 | AD321: -0.155 | AE321: 95.31 | AF321: 98.52 | AG321: 0.87 | AH321: AA | AI321: 4.1900000000000007e-002 | AJ321: =H321+100*O321 -> 156.30000000000001 | AK321: 158.8 | AL321: 304 | AM321: 60.3 | AN321: 287 | AO321: 4.2999999999999997e-002 | AP321: 12 | AQ321: 长信转债!!
A322: 319 | B322: 123012 | C322: 万顺转债! | D322: 300057 | E322: 万顺新材 | F322: 有色金属 | G322: 铝金属 | H322: 138 | I322: -1.4499999999999999e-002 | J322: 1.4000000000000002e-003 | K322: 6.98 | L322: -1.55e-002 | M322: 110.3 | N322: 5.27 | O322: 4.2000000000000003e-002 | P322: 132.45 | Q322: 转股中 | R322: 3年10天 | S322: 1年11天 | T322: 1.29 | U322: 223 | V322: 1.26 | W322: 2.7000000000000003e-002 | X322: 3.6000000000000004e-002 | Y322: 47 | Z322: 1.33 | AA322: -7.2800000000000004e-002 | AB322: -7.8399999999999997e-002 | AC322: -0.20999999999999999 | AD322: -0.21299999999999999 | AE322: 95.65 | AF322: 92.11 | AG322: 0.84 | AH322: AA- | AI322: 6.2899999999999998e-002 | AJ322: =H322+100*O322 -> 142.19999999999999 | AK322: 143.6 | AL322: 255 | AM322: 47.9 | AN322: 228 | AO322: 0.158 | AP322: 21 | AQ322: 万顺转债!
A323: 238 | B323: 113550 | C323: 常汽转债! | D323: 603035 | E323: 常熟汽饰 | F323: 汽车 | G323: 零部件制 | H323: 167.78 | I323: 1.2999999999999999e-003 | J323: 4.8999999999999998e-003 | K323: 13.99 | L323: 7.1999999999999998e-003 | M323: 121.3 | N323: 9.33 | O323: 0.11900000000000001 | P323: 149.95 | Q323: 转股中 | R323: 4.36年 | S323: 2.36年 | T323: 2.15 | U323: 173 | V323: 0.47600000000000003 | W323: 4.2999999999999997e-002 | X323: 6.4000000000000001e-002 | Y323: 50 | Z323: 1.31 | AA323: -7.3200000000000001e-002 | AB323: -8.0700000000000008e-002 | AC323: -0.124 | AD323: -0.125 | AE323: 89.51 | AF323: 93.62 | AG323: 0.86 | AH323: AA- | AI323: 6.2899999999999998e-002 | AJ323: =H323+100*O323 -> 179.68000000000001 | AK323: 185.6 | AL323: 335 | AM323: 92 | AN323: 334 | AO323: -0.10000000000000001 | AP323: 17 | AQ323: 常汽转债!
A324: 170 | B324: 123054 | C324: 思特转债!! | D324: 300608 | E324: 思特奇 | F324: 通信互联 | G324: 通信设备 | H324: 176.88 | I324: -2.e-002 | J324: -2.4700000000000003e-002 | K324: 18.04 | L324: -5.3499999999999999e-002 | M324: 121.2 | N324: 12.63 | O324: 0.23800000000000002 | P324: 142.83 | Q324: 转股中 | R324: 4.92年 | S324: 2.92年 | T324: 2.08 | U324: 2150. | V324: 5.75 | W324: 5.5e-002 | X324: 7.8e-002 | Y324: 38 | Z324: 3.71 | AA324: -7.5300000000000006e-002 | AB324: -8.1900000000000001e-002 | AC324: -0.10000000000000001 | AD324: -0.10199999999999999 | AE324: 86.41 | AF324: 90.38 | AG324: 0.83 | AH324: AA- | AI324: 6.2899999999999998e-002 | AJ324: =H324+100*O324 -> 200.68000000000001 | AK324: 210.9 | AL324: 344 | AM324: 120.5 | AN324: 344 | AO324: -6.6000000000000003e-002 | AP324: 20 | AQ324: 思特转债!!
A325: 305 | B325: 128051 | C325: 光华转债! | D325: 2741 | E325: 光华科技 | F325: 电子 | G325: 元器件制 | H325: 149.509 | I325: 4.41e-002 | J325: -1.5e-003 | K325: 19.28 | L325: 4.7300000000000002e-002 | M325: 114.8 | N325: 12.72 | O325: -1.3999999999999999e-002 | P325: 151.57 | Q325: 转股中 | R325: 3.43年 | S325: 1.43年 | T325: 2.11 | U325: 785 | V325: 2.5 | W325: 2.8999999999999998e-002 | X325: 4.4000000000000004e-002 | Y325: 73 | Z325: 5.83 | AA325: -7.5499999999999998e-002 | AB325: -8.2400000000000001e-002 | AC325: -0.18100000000000002 | AD325: -0.184 | AE325: 93.63 | AF325: 93.56 | AG325: 0.9 | AH325: AA- | AI325: 6.2899999999999998e-002 | AJ325: =H325+100*O325 -> 148.10899999999998 | AK325: 147.4 | AL325: 274 | AM325: 53.8 | AN325: 261 | AO325: 0.221 | AP325: 27 | AQ325: 光华转债!
A326: 116 | B326: 123067 | C326: 斯莱转债 | D326: 300382 | E326: 斯莱克 | F326: 机械装备 | G326: 专用设备 | H326: 183.671 | I326: 2.4700000000000003e-002 | J326: -3.0800000000000001e-002 | K326: 16.19 | L326: -6.7000000000000002e-003 | M326: 121.2 | N326: 9.36 | O326: 6.2e-002 | P326: 172.97 | Q326: 转股中 | R326: 5.19年 | S326: 3.19年 | T326: 3.88 | U326: 194 | V326: 0.27800000000000002 | W326: 4.2000000000000003e-002 | X326: 7.2999999999999995e-002 | Y326: 91 | Z326: 8.8 | AA326: -7.8399999999999997e-002 | AB326: -8.4600000000000009e-002 | AC326: -0.152 | AD326: -0.153 | AE326: 84.74 | AF326: 88.46 | AG326: 0.91 | AH326: AA- | AI326: 6.4100000000000004e-002 | AJ326: =H326+100*O326 -> 189.87099999999998 | AK326: 194.4 | AL326: 339 | AM326: 105.9 | AN326: 341 | AO326: 0.20100000000000001 | AP326: 12 | AQ326: 斯莱转债
A327: 340 | B327: 128033 | C327: 迪龙转债! | D327: 2658 | E327: 雪迪龙 | F327: 城市公用 | G327: 三废处理 | H327: 133.7 | I327: -1.5800000000000002e-002 | J327: 7.4000000000000003e-003 | K327: 9.3 | L327: -1.38e-002 | M327: 108.8 | N327: 8.71 | O327: 0.252 | P327: 106.77 | Q327: 转股中 | R327: 2.47年 | S327: 0.47年 | T327: 2.98 | U327: 247 | V327: 0.61399999999999999 | W327: 5.0999999999999997e-002 | X327: 5.4000000000000006e-002 | Y327: 59 | Z327: 2.46 | AA327: -8.1199999999999994e-002 | AB327: -8.7100000000000011e-002 | AC327: -0.39500000000000002 | AD327: -0.39799999999999996 | AE327: 99.04 | AF327: 98.82 | AG327: 0.61 | AH327: AA | AI327: 4.0399999999999998e-002 | AJ327: =H327+100*O327 -> 158.89999999999998 | AK327: 160.6 | AL327: 307 | AM327: 61.6 | AN327: 292 | AO327: -6.0000000000000001e-003 | AP327: 35 | AQ327: 迪龙转债!
A328: 252 | B328: 113545 | C328: 金能转债! | D328: 603113 | E328: 金能科技 | F328: 煤炭 | G328: 炼焦 | H328: 163.89 | I328: 4.0000000000000002e-004 | J328: -1.2699999999999999e-002 | K328: 16.76 | L328: -1.3500000000000002e-002 | M328: 114.9 | N328: 10.43 | O328: 2.e-002 | P328: 160.69 | Q328: 转股中 | R328: 4.26年 | S328: 2.27年 | T328: 10.2 | U328: 103 | V328: 6.2e-002 | W328: 7.0999999999999994e-002 | X328: 0.115 | Y328: 143 | Z328: 1.72 | AA328: -8.1300000000000011e-002 | AB328: -8.6800000000000002e-002 | AC328: -0.127 | AD328: -0.128 | AE328: 93.68 | AF328: 96.82 | AG328: 0.91 | AH328: AA | AI328: 4.1900000000000007e-002 | AJ328: =H328+100*O328 -> 165.88999999999999 | AK328: 167.1 | AL328: 316 | AM328: 70.3 | AN328: 308 | AO328: -7.2999999999999995e-002 | AP328: 16 | AQ328: 金能转债!
A329: 213 | B329: 110066 | C329: 盛屯转债!! | D329: 600711 | E329: 盛屯矿业 | F329: 有色金属 | G329: 有色行业 | H329: 172.81 | I329: 5.4199999999999998e-002 | J329: 3.0299999999999997e-002 | K329: 8.56 | L329: 9.0399999999999994e-002 | M329: 114.9 | N329: 4.88 | O329: -1.4999999999999999e-002 | P329: 175.41 | Q329: 转股中 | R329: 4.64年 | S329: 2.65年 | T329: 5.22 | U329: 1869. | V329: 2.0800000000000001 | W329: 2.3e-002 | X329: 4.0000000000000001e-002 | Y329: 230 | Z329: 2.05 | AA329: -8.5500000000000007e-002 | AB329: -9.0500000000000011e-002 | AC329: -0.11199999999999999 | AD329: -0.114 | AE329: 92.22 | AF329: 95.31 | AG329: 0.93 | AH329: AA | AI329: 4.1900000000000007e-002 | AJ329: =H329+100*O329 -> 171.31 | AK329: 170.2 | AL329: 320 | AM329: 74.9 | AN329: 316 | AO329: 0.17800000000000002 | AP329: 32 | AQ329: 盛屯转债!!
A330: 192 | B330: 113034 | C330: 滨化转债! | D330: 601678 | E330: 滨化股份 | F330: 化工 | G330: 化工 | H330: 174.5 | I330: 2.29e-002 | J330: -4.8999999999999998e-003 | K330: 7.84 | L330: 1.95e-002 | M330: 114.8 | N330: 4.58 | O330: 1.9e-002 | P330: 171.18 | Q330: 转股中 | R330: 4.75年 | S330: 2.75年 | T330: 4.74 | U330: 70 | V330: 8.5999999999999993e-002 | W330: 3.1e-002 | X330: 5.2999999999999999e-002 | Y330: 153 | Z330: 1.71 | AA330: -8.5600000000000009e-002 | AB330: -9.0500000000000011e-002 | AC330: -0.10800000000000001 | AD330: -0.109 | AE330: 91.72 | AF330: 94.8 | AG330: 0.93 | AH330: AA | AI330: 4.1900000000000007e-002 | AJ330: =H330+100*O330 -> 176.40000000000001 | AK330: 177.8 | AL330: 329 | AM330: 83 | AN330: 326 | AO330: 9.3000000000000013e-002 | AP330: 23 | AQ330: 滨化转债!
A331: 244 | B331: 113548 | C331: 石英转债! | D331: 603688 | E331: 石英股份 | F331: 电子 | G331: 电子产品 | H331: 182.41 | I331: 4.8099999999999997e-002 | J331: -3.2000000000000002e-003 | K331: 25.89 | L331: 4.9500000000000002e-002 | M331: 124.4 | N331: 14.93 | O331: 5.2000000000000005e-002 | P331: 173.41 | Q331: 转股中 | R331: 4.30年 | S331: 2.30年 | T331: 1.23 | U331: 196 | V331: 0.89599999999999991 | W331: 1.3000000000000001e-002 | X331: 2.3e-002 | Y331: 91 | Z331: 4.63 | AA331: -8.6899999999999991e-002 | AB331: -9.5199999999999993e-002 | AC331: -0.14499999999999999 | AD331: -0.14599999999999999 | AE331: 89.9 | AF331: 96.33 | AG331: 0.91 | AH331: AA- | AI331: 6.2899999999999998e-002 | AJ331: =H331+100*O331 -> 187.60999999999999 | AK331: 191.4 | AL331: 337 | AM331: 95.1 | AN331: 337 | AO331: 0.11699999999999999 | AP331: 13 | AQ331: 石英转债!
A332: 242 | B332: 123034 | C332: 通光转债! | D332: 300265 | E332: 通光线缆 | F332: 通信互联 | G332: 通信设备 | H332: 175 | I332: 1.e-004 | J332: 2.3999999999999998e-003 | K332: 8.96 | L332: 3.4000000000000002e-003 | M332: 118 | N332: 7.95 | O332: 0.55299999999999994 | P332: 112.7 | Q332: 转股中 | R332: 4.32年 | S332: 2.32年 | T332: 0.78 | U332: 35 | V332: 0.25900000000000001 | W332: 2.4e-002 | X332: 2.7000000000000003e-002 | Y332: 33 | Z332: 2.51 | AA332: -8.8699999999999987e-002 | AB332: -9.5000000000000001e-002 | AC332: -0.13699999999999998 | AD332: -0.13800000000000001 | AE332: 86.85 | AF332: 87.31 | AG332: 0.72 | AH332: A+ | AI332: 7.3899999999999993e-002 | AJ332: =H332+100*O332 -> 230.30000000000001 | AK332: 237.3 | AL332: 352 | AM332: 150 | AN332: 353 | AO332: -2.e-002 | AP332: 20 | AQ332: 通光转债!
A333: 80 | B333: 113611 | C333: 福20转债! | D333: 603806 | E333: 福斯特 | F333: 能源电力 | G333: 太阳能 | H333: 184.13 | I333: -2.5600000000000001e-002 | J333: 1.6000000000000001e-003 | K333: 112.8 | L333: -2.4e-002 | M333: 111.85 | N333: 61.03 | O333: -4.0000000000000001e-003 | P333: 184.83 | Q333: 转股中 | R333: 5.39年 | S333: 3.40年 | T333: 9.15 | U333: 365 | V333: 0.218 | W333: 9.0000000000000011e-003 | X333: 1.6e-002 | Y333: 1048. | Z333: 9.48 | AA333: -8.929999999999999e-002 | AB333: -9.2699999999999991e-002 | AC333: -0.14599999999999999 | AD333: -0.14699999999999999 | AE333: 88.41 | AF333: 89.38 | AG333: 1 | AH333: AA | AI333: 4.3099999999999999e-002 | AJ333: =H333+100*O333 -> 183.72999999999999 | AK333: 183.4 | AL333: 334 | AM333: 94.1 | AN333: 335 | AO333: 0.13500000000000001 | AP333: 5 | AQ333: 福20转债!
A334: 268 | B334: 113537 | C334: 文灿转债!! | D334: 603348 | E334: 文灿股份 | F334: 汽车 | G334: 零部件制 | H334: 173.16 | I334: -1.9400000000000001e-002 | J334: -2.5999999999999999e-003 | K334: 31.81 | L334: -2.4199999999999999e-002 | M334: 120.7 | N334: 19.28 | O334: 5.0000000000000003e-002 | P334: 164.99 | Q334: 转股中 | R334: 3.92年 | S334: 1.92年 | T334: 1.41 | U334: 166 | V334: 0.67700000000000005 | W334: 1.7000000000000001e-002 | X334: 2.7999999999999997e-002 | Y334: 83 | Z334: 3.2 | AA334: -8.9600000000000013e-002 | AB334: -9.7500000000000003e-002 | AC334: -0.16899999999999998 | AD334: -0.17100000000000001 | AE334: 91.33 | AF334: 95.54 | AG334: 0.91 | AH334: AA- | AI334: 6.2899999999999998e-002 | AJ334: =H334+100*O334 -> 178.16 | AK334: 181.3 | AL334: 331 | AM334: 85.8 | AN334: 328 | AO334: -2.7999999999999997e-002 | AP334: 24 | AQ334: 文灿转债!!
A335: 316 | B335: 123014 | C335: 凯发转债! | D335: 300407 | E335: 凯发电气 | F335: 能源电力 | G335: 电力设备 | H335: 133.9 | I335: -1.0200000000000001e-002 | J335: 5.3e-003 | K335: 7.5 | L335: -1.06e-002 | M335: 108.5 | N335: 8.05 | O335: 0.43700000000000006 | P335: 93.17 | Q335: 转股中 | R335: 2年18天 | S335: 18天 | T335: 1.16 | U335: 50 | V335: 0.316 | W335: 5.0999999999999997e-002 | X335: 4.7e-002 | Y335: 23 | Z335: 1.67 | AA335: -9.8900000000000002e-002 | AB335: -0.106 | AC335: -1.2270000000000001 | AD335: -1.2350000000000001 | AE335: 99.74 | AF335: 94.24 | AG335: 0.47 | AH335: A+ | AI335: 7.2400000000000006e-002 | AJ335: =H335+100*O335 -> 177.60000000000002 | AK335: 174.6 | AL335: 327 | AM335: 74.9 | AN335: 315 | AO335: 4.0999999999999995e-002 | AP335: 15 | AQ335: 凯发转债!
A336: 50 | B336: 123094 | C336: 星源转2! | D336: 300568 | E336: 星源材质 | F336: 电子 | G336: 电子行业 | H336: 222.9 | I336: 7.6799999999999993e-002 | J336: 5.62e-002 | K336: 48.25 | L336: 0.13699999999999998 | M336: 117.3 | N336: 19.64 | O336: -9.3000000000000013e-002 | P336: 245.67 | Q336: 17天 | R336: 5.53年 | S336: 3.53年 | T336: 10 | U336: 2304. | V336: 1.04 | W336: 2.8999999999999998e-002 | X336: 7.0999999999999994e-002 | Y336: 346 | Z336: 7.16 | AA336: -0.111 | AB336: -0.11599999999999999 | AC336: -0.10000000000000001 | AD336: -0.10099999999999999 | AE336: 88.94 | AF336: 93.31 | AG336: 0.97 | AH336: AA | AI336: 4.3099999999999999e-002 | AJ336: =H336+100*O336 -> 213.59999999999999 | AK336: 200.1 | AL336: 343 | AM336: 106.8 | AN336: 343 | AO336: 5.4000000000000006e-002 | AP336: 5 | AQ336: 星源转2!
A337: 363 | B337: 113012 | C337: 骆驼转债! | D337: 601311 | E337: 骆驼股份 | F337: 汽车 | G337: 零部件制 | H337: 130.3 | I337: 1.84e-002 | J337: 1.7000000000000001e-003 | K337: 12.45 | L337: 2.3799999999999998e-002 | M337: 106.5 | N337: 10.06 | O337: 5.2999999999999999e-002 | P337: 123.76 | Q337: 转股中 | R337: 1.71年 | S337: 回售内 | T337: 5.09 | U337: 50 | V337: 7.5999999999999998e-002 | W337: 3.6000000000000004e-002 | X337: 4.4999999999999998e-002 | Y337: 140 | Z337: 1.84 | AA337: -0.11199999999999999 | AB337: -0.11900000000000001 | AC337: 回售内 | AD337: 回售内 | AE337: 100.25 | AF337: 99.6 | AG337: 0.84 | AH337: AA | AI337: 4.0399999999999998e-002 | AJ337: =H337+100*O337 -> 135.60000000000002 | AK337: 136.8 | AL337: 200 | AM337: 36.6 | AN337: 118 | AO337: 0.105 | AP337: 16 | AQ337: 骆驼转债!
A338: 260 | B338: 113543 | C338: 欧派转债!* | D338: 603833 | E338: 欧派家居 | F338: 其他 | G338: 家居用品 | H338: 185.1 | I338: -2.e-002 | J338: 1.1699999999999999e-002 | K338: 132.5 | L338: -8.199999999999999e-003 | M338: 114.9 | N338: 70.49 | O338: -1.4999999999999999e-002 | P338: 187.97 | Q338: 转股中 | R338: 4年37天 | S338: 3年38天 | T338: 0.31 | U338: 100 | V338: 1.76 | W338: 0. | X338: 1.e-003 | Y338: 803 | Z338: 6.59 | AA338: -0.11199999999999999 | AB338: -0.11699999999999999 | AC338: -0.156 | AD338: -0.158 | AE338: 92.24 | AF338: 97.46 | AG338: 1 | AH338: AA | AI338: 4.1900000000000007e-002 | AJ338: =H338+100*O338 -> 183.59999999999999 | AK338: 182.2 | AL338: 333 | AM338: 84.8 | AN338: 327 | AO338: -9.0999999999999998e-002 | AP338: 12 | AQ338: 欧派转债!*
A339: 290 | B339: 110055 | C339: 伊力转债!! | D339: 600197 | E339: 伊力特 | F339: 食品饮料 | G339: 白酒 | H339: 177.81 | I339: -3.5499999999999997e-002 | J339: -1.06e-002 | K339: 27.1 | L339: -4.9800000000000004e-002 | M339: 114.3 | N339: 16.81 | O339: 0.10300000000000001 | P339: 161.21 | Q339: 转股中 | R339: 3.68年 | S339: 1.68年 | T339: 2.44 | U339: 434 | V339: 0.996 | W339: 1.9e-002 | X339: 3.1e-002 | Y339: 128 | Z339: 3.56 | AA339: -0.115 | AB339: -0.121 | AC339: -0.20699999999999999 | AD339: -0.20899999999999999 | AE339: 95.34 | AF339: 98.55 | AG339: 0.93 | AH339: AA | AI339: 4.1900000000000007e-002 | AJ339: =H339+100*O339 -> 188.11000000000001 | AK339: 194.4 | AL339: 340 | AM339: 95.9 | AN339: 338 | AO339: -0.125 | AP339: 22 | AQ339: 伊力转债!!
A340: 201 | B340: 123046 | C340: 天铁转债! | D340: 300587 | E340: 天铁股份 | F340: 铁路 | G340: 铁路设备 | H340: 212.666 | I340: -6.7000000000000002e-003 | J340: -5.0000000000000001e-003 | K340: 12.11 | L340: -1.2199999999999999e-002 | M340: 117.7 | N340: 5.9 | O340: 3.6000000000000004e-002 | P340: 205.25 | Q340: 转股中 | R340: 4.69年 | S340: 2.69年 | T340: 0.62 | U340: 65 | V340: 0.48499999999999999 | W340: 9.0000000000000011e-003 | X340: 1.8000000000000002e-002 | Y340: 70 | Z340: 2.54 | AA340: -0.12 | AB340: -0.126 | AC340: -0.14199999999999999 | AD340: -0.14300000000000002 | AE340: 87.18 | AF340: 88.96 | AG340: 0.96 | AH340: AA- | AI340: 6.2899999999999998e-002 | AJ340: =H340+100*O340 -> 216.26599999999999 | AK340: 220.1 | AL340: 347 | AM340: 131.1 | AN340: 350 | AO340: -0.42700000000000005 | AP340: 14 | AQ340: 天铁转债!
A341: 276 | B341: 113534 | C341: 鼎胜转债!! | D341: 603876 | E341: 鼎胜新材 | F341: 有色金属 | G341: 小金属 | H341: 185.77 | I341: -5.7099999999999998e-002 | J341: 3.0000000000000001e-003 | K341: 28.2 | L341: -5.62e-002 | M341: 114.3 | N341: 15.18 | O341: 0. | P341: 185.77 | Q341: 转股中 | R341: 3.75年 | S341: 1.75年 | T341: 4.45 | U341: 603 | V341: 0.73799999999999999 | W341: 3.3000000000000002e-002 | X341: 6.0999999999999999e-002 | Y341: 136 | Z341: 3.38 | AA341: -0.12300000000000001 | AB341: -0.129 | AC341: -0.20999999999999999 | AD341: -0.21100000000000002 | AE341: 91.53 | AF341: 91.33 | AG341: 0.96 | AH341: AA- | AI341: 6.2899999999999998e-002 | AJ341: =H341+100*O341 -> 185.77000000000001 | AK341: 185.8 | AL341: 336 | AM341: 94.2 | AN341: 336 | AO341: 5.2000000000000005e-002 | AP341: 34 | AQ341: 鼎胜转债!!
A342: 129 | B342: 110074 | C342: 精达转债!! | D342: 600577 | E342: 精达股份 | F342: 电子 | G342: 电子产品 | H342: 228.79 | I342: 0.111 | J342: -1.3000000000000001e-002 | K342: 8.42 | L342: 0.10099999999999999 | M342: 117.3 | N342: 3.73 | O342: 1.3999999999999999e-002 | P342: 225.74 | Q342: 转股中 | R342: 5年40天 | S342: 3年41天 | T342: 6.52 | U342: 1699. | V342: 1.1699999999999999 | W342: 4.0000000000000001e-002 | X342: 8.9999999999999997e-002 | Y342: 164 | Z342: 4.26 | AA342: -0.124 | AB342: -0.129 | AC342: -0.125 | AD342: -0.125 | AE342: 90.53 | AF342: 94.98 | AG342: 0.97 | AH342: AA | AI342: 4.3099999999999999e-002 | AJ342: =H342+100*O342 -> 230.19 | AK342: 231.8 | AL342: 351 | AM342: 136.9 | AN342: 351 | AO342: 0.32299999999999995 | AP342: 12 | AQ342: 精达转债!!
A343: 257 | B343: 123030 | C343: 九洲转债! | D343: 300040 | E343: 九洲集团 | F343: 能源电力 | G343: 电力设备 | H343: 209 | I343: -7.0699999999999999e-002 | J343: 3.8900000000000004e-002 | K343: 10.92 | L343: -3.3599999999999998e-002 | M343: 120 | N343: 5.65 | O343: 8.1000000000000003e-002 | P343: 193.27 | Q343: 转股中 | R343: 4年41天 | S343: 2年42天 | T343: 0.97 | U343: 1761. | V343: 8.4800000000000004 | W343: 2.3e-002 | X343: 4.4999999999999998e-002 | Y343: 42 | Z343: 1.86 | AA343: -0.128 | AB343: -0.13500000000000001 | AC343: -0.191 | AD343: -0.192 | AE343: 90.22 | AF343: 93.91 | AG343: 0.94 | AH343: AA- | AI343: 6.2899999999999998e-002 | AJ343: =H343+100*O343 -> 217.09999999999999 | AK343: 224.7 | AL343: 350 | AM343: 130.8 | AN343: 349 | AO343: 0.14099999999999999 | AP343: 24 | AQ343: 九洲转债!
A344: 216 | B344: 128097 | C344: 奥佳转债! | D344: 2614 | E344: 奥佳华 | F344: 机械装备 | G344: 专用设备 | H344: 215.799 | I344: -5.04e-002 | J344: 9.5999999999999992e-003 | K344: 22 | L344: -4.2199999999999994e-002 | M344: 114.9 | N344: 10.39 | O344: 1.9e-002 | P344: 211.74 | Q344: 转股中 | R344: 4.63年 | S344: 2.63年 | T344: 4.6 | U344: 74 | V344: 7.400000000000001e-002 | W344: 3.3000000000000002e-002 | X344: 7.0000000000000007e-002 | Y344: 139 | Z344: 3 | AA344: -0.129 | AB344: -0.13400000000000001 | AC344: -0.14899999999999999 | AD344: -0.14999999999999999 | AE344: 92.28 | AF344: 95.37 | AG344: 0.97 | AH344: AA | AI344: 4.1900000000000007e-002 | AJ344: =H344+100*O344 -> 217.69900000000001 | AK344: 219.9 | AL344: 346 | AM344: 124.5 | AN344: 345 | AO344: 1.3000000000000001e-002 | AP344: 20 | AQ344: 奥佳转债!
A345: 335 | B345: 113504 | C345: 艾华转债!! | D345: 603989 | E345: 艾华集团 | F345: 电子 | G345: 元器件制 | H345: 158.33 | I345: -5.3e-003 | J345: -1.e-003 | K345: 32.7 | L345: -6.7000000000000002e-003 | M345: 109.3 | N345: 20.81 | O345: 8.0000000000000002e-003 | P345: 157.14 | Q345: 转股中 | R345: 2.64年 | S345: 0.65年 | T345: 4.9 | U345: 24 | V345: 3.1e-002 | W345: 3.7999999999999999e-002 | X345: 5.9000000000000004e-002 | Y345: 131 | Z345: 4.85 | AA345: -0.13200000000000001 | AB345: -0.13800000000000001 | AC345: -0.44900000000000001 | AD345: -0.45100000000000001 | AE345: 98.58 | AF345: 98.6 | AG345: 0.95 | AH345: AA | AI345: 4.0399999999999998e-002 | AJ345: =H345+100*O345 -> 159.13000000000002 | AK345: 159.5 | AL345: 305 | AM345: 60.9 | AN345: 290 | AO345: 5.4000000000000006e-002 | AP345: 9 | AQ345: 艾华转债!!
A346: 181 | B346: 113580 | C346: 康隆转债! | D346: 603665 | E346: 康隆达 | F346: 服装纺织 | G346: 服装行业 | H346: 241.08 | I346: 5.7999999999999996e-003 | J346: -7.3000000000000001e-003 | K346: 14.22 | L346: -2.8000000000000004e-003 | M346: 120.8 | N346: 15.51 | O346: 1.6299999999999999 | P346: 91.68 | Q346: 转股中 | R346: 4.79年 | S346: 2.79年 | T346: 0.41 | U346: 76 | V346: 0.7659999999999999 | W346: 1.8000000000000002e-002 | X346: 1.7000000000000001e-002 | Y346: 23 | Z346: 2.07 | AA346: -0.13699999999999998 | AB346: -0.14300000000000002 | AC346: -0.152 | AD346: -0.153 | AE346: 86.77 | AF346: 90.78 | AG346: 0.54 | AH346: AA- | AI346: 6.2899999999999998e-002 | AJ346: =H346+100*O346 -> 404.08000000000004 | AK346: 390.5 | AL346: 361 | AM346: 299.7 | AN346: 362 | AO346: -2.7999999999999997e-002 | AP346: 9 | AQ346: 康隆转债!
A347: 200 | B347: 123047 | C347: 久吾转债! | D347: 300631 | E347: 久吾高科 | F347: 机械装备 | G347: 专用设备 | H347: 266.01 | I347: 3.1e-002 | J347: -1.7299999999999999e-002 | K347: 44 | L347: 1.43e-002 | M347: 129.6 | N347: 17.43 | O347: 5.4000000000000006e-002 | P347: 252.44 | Q347: 转股中 | R347: 4.69年 | S347: 2.70年 | T347: 1.58 | U347: 6846. | V347: 16.170000000000002 | W347: 3.3000000000000002e-002 | X347: 8.4000000000000005e-002 | Y347: 48 | Z347: 5.78 | AA347: -0.14499999999999999 | AB347: -0.153 | AC347: -0.16899999999999998 | AD347: -0.17000000000000001 | AE347: 86.32 | AF347: 93.64 | AG347: 0.96 | AH347: A+ | AI347: 7.3899999999999993e-002 | AJ347: =H347+100*O347 -> 271.40999999999997 | AK347: 279.6 | AL347: 356 | AM347: 185.9 | AN347: 356 | AO347: 0.69099999999999995 | AP347: 23 | AQ347: 久吾转债!
A348: 369 | B348: 110033 | C348: 国贸转债! | D348: 600755 | E348: 厦门国贸 | F348: 交通运输 | G348: 交通运输 | H348: 117.01 | I348: -7.3000000000000001e-003 | J348: 3.4000000000000002e-003 | K348: 7.76 | L348: -5.1000000000000004e-003 | M348: 108 | N348: 6.72 | O348: 1.3000000000000001e-002 | P348: 115.48 | Q348: 转股中 | R348: 0.49年 | S348: 回售内 | T348: 11.7 | U348: 20 | V348: 1.3999999999999999e-002 | W348: 7.6999999999999999e-002 | X348: 8.900000000000001e-002 | Y348: 151 | Z348: 0.94 | AA348: -0.14999999999999999 | AB348: -0.17499999999999999 | AC348: 回售内 | AD348: 回售内 | AE348: 100.33 | AF348: 106.51 | AG348: 0.75 | AH348: AAA | AI348: 2.86e-002 | AJ348: =H348+100*O348 -> 118.31 | AK348: 118.5 | AL348: 16 | AM348: 12 | AN348: 3 | AO348: -3.3000000000000002e-002 | AP348: 20 | AQ348: 国贸转债!
A349: 275 | B349: 113025 | C349: 明泰转债!! | D349: 601677 | E349: 明泰铝业 | F349: 有色金属 | G349: 铝金属 | H349: 216.27 | I349: 1.7299999999999999e-002 | J349: -3.9000000000000003e-003 | K349: 22.87 | L349: 1.37e-002 | M349: 114.5 | N349: 11 | O349: 4.0000000000000001e-002 | P349: 207.91 | Q349: 转股中 | R349: 3.75年 | S349: 1.75年 | T349: 11 | U349: 168 | V349: 7.2000000000000008e-002 | W349: 7.0000000000000007e-002 | X349: 0.14599999999999999 | Y349: 156 | Z349: 1.73 | AA349: -0.158 | AB349: -0.16399999999999998 | AC349: -0.247 | AD349: -0.248 | AE349: 95.09 | AF349: 98.45 | AG349: 0.97 | AH349: AA | AI349: 4.1900000000000007e-002 | AJ349: =H349+100*O349 -> 220.27000000000001 | AK349: 224.6 | AL349: 349 | AM349: 126.2 | AN349: 347 | AO349: 0.14800000000000002 | AP349: 23 | AQ349: 明泰转债!!
A350: 357 | B350: 128017 | C350: 金禾转债!! | D350: 2597 | E350: 金禾实业 | F350: 化工 | G350: 化工 | H350: 163.819 | I350: 4.4800000000000006e-002 | J350: 1.66e-002 | K350: 34.5 | L350: 6.480000000000001e-002 | M350: 108.8 | N350: 21.97 | O350: 4.2999999999999997e-002 | P350: 157.03 | Q350: 转股中 | R350: 2.32年 | S350: 0.32年 | T350: 5.52 | U350: 103 | V350: 0.11599999999999999 | W350: 2.8999999999999998e-002 | X350: 4.4999999999999998e-002 | Y350: 194 | Z350: 3.86 | AA350: -0.16399999999999998 | AB350: -0.17000000000000001 | AC350: -0.83400000000000007 | AD350: -0.83700000000000008 | AE350: 99.64 | AF350: 99.42 | AG350: 0.95 | AH350: AA | AI350: 4.0399999999999998e-002 | AJ350: =H350+100*O350 -> 168.119 | AK350: 170.6 | AL350: 321 | AM350: 71 | AN350: 309 | AO350: 4.2999999999999997e-002 | AP350: 10 | AQ350: 金禾转债!!
A351: 302 | B351: 123018 | C351: 溢利转债! | D351: 300381 | E351: 溢多利 | F351: 医药 | G351: 原料药 | H351: 215.13 | I351: 1.1200000000000002e-002 | J351: -1.1899999999999999e-002 | K351: 9.17 | L351: -1.1000000000000001e-003 | M351: 114.3 | N351: 8.32 | O351: 0.95200000000000007 | P351: 110.22 | Q351: 转股中 | R351: 3.45年 | S351: 1.45年 | T351: 0.54 | U351: 28 | V351: 0.23899999999999999 | W351: 1.2e-002 | X351: 1.3000000000000001e-002 | Y351: 45 | Z351: 1.49 | AA351: -0.17000000000000001 | AB351: -0.17600000000000002 | AC351: -0.30299999999999999 | AD351: -0.30399999999999999 | AE351: 93.23 | AF351: 93.02 | AG351: 0.68 | AH351: AA- | AI351: 6.2899999999999998e-002 | AJ351: =H351+100*O351 -> 310.32999999999998 | AK351: 320 | AL351: 357 | AM351: 226.8 | AN351: 358 | AO351: -3.5000000000000003e-002 | AP351: 11 | AQ351: 溢利转债!
A352: 339 | B352: 123007 | C352: 道氏转债! | D352: 300409 | E352: 道氏技术 | F352: 建筑 | G352: 建筑行业 | H352: 178.7 | I352: 2.1700000000000001e-002 | J352: 1.0200000000000001e-002 | K352: 26.15 | L352: 3.2799999999999996e-002 | M352: 110.3 | N352: 14.5 | O352: -9.0000000000000011e-003 | P352: 180.34 | Q352: 转股中 | R352: 2.47年 | S352: 0.47年 | T352: 1.99 | U352: 1091. | V352: 3.0899999999999999 | W352: 1.3999999999999999e-002 | X352: 2.4e-002 | Y352: 147 | Z352: 3.95 | AA352: -0.17999999999999999 | AB352: -0.18600000000000003 | AC352: -0.70099999999999996 | AD352: -0.70400000000000007 | AE352: 98.02 | AF352: 95.46 | AG352: 0.97 | AH352: AA- | AI352: 6.1399999999999996e-002 | AJ352: =H352+100*O352 -> 177.79999999999998 | AK352: 177.1 | AL352: 328 | AM352: 79 | AN352: 322 | AO352: 0.33399999999999996 | AP352: 23 | AQ352: 道氏转债!
A353: 344 | B353: 128030 | C353: 天康转债!! | D353: 2100 | E353: 天康生物 | F353: 农业 | G353: 畜牧业 | H353: 182.388 | I353: 2.5899999999999999e-002 | J353: -1.2999999999999999e-003 | K353: 8.71 | L353: 2.4700000000000003e-002 | M353: 111.3 | N353: 7.39 | O353: 0.54700000000000004 | P353: 117.86 | Q353: 转股中 | R353: 2.46年 | S353: 0.46年 | T353: 0.89 | U353: 40 | V353: 0.245 | W353: 9.0000000000000011e-003 | X353: 1.1000000000000001e-002 | Y353: 94 | Z353: 1.43 | AA353: -0.185 | AB353: -0.191 | AC353: -0.73999999999999999 | AD353: -0.74299999999999999 | AE353: 99.33 | AF353: 101.17 | AG353: 1 | AH353: AA | AI353: 4.0399999999999998e-002 | AJ353: =H353+100*O353 -> 237.08800000000002 | AK353: 246.9 | AL353: 353 | AM353: 145.7 | AN353: 352 | AO353: -6.9999999999999993e-003 | AP353: 11 | AQ353: 天康转债!!
A354: 179 | B354: 113582 | C354: 火炬转债! | D354: 603678 | E354: XD火炬电 | F354: 电子 | G354: 元器件制 | H354: 311.7 | I354: 2.5000000000000001e-003 | J354: -1.1699999999999999e-002 | K354: 75.75 | L354: -9.3999999999999986e-003 | M354: 114.9 | N354: 24.99 | O354: 2.7999999999999997e-002 | P354: 303.12 | Q354: 转股中 | R354: 4.88年 | S354: 2.88年 | T354: 4.18 | U354: 232 | V354: 0.17600000000000002 | W354: 1.2e-002 | X354: 3.6000000000000004e-002 | Y354: 348 | Z354: 8.57 | AA354: -0.187 | AB354: -0.191 | AC354: -0.17100000000000001 | AD354: -0.17199999999999999 | AE354: 91.33 | AF354: 94.4 | AG354: 0.98 | AH354: AA | AI354: 4.1900000000000007e-002 | AJ354: =H354+100*O354 -> 314.5 | AK354: 320.3 | AL354: 358 | AM354: 225.9 | AN354: 357 | AO354: 0.16200000000000001 | AP354: 6 | AQ354: 火炬转债!
A355: 361 | B355: 127004 | C355: 模塑转债!! | D355: 700 | E355: 模塑科技 | F355: 汽车 | G355: 零部件制 | H355: 170.11 | I355: 2.5399999999999999e-002 | J355: -2.1099999999999997e-002 | K355: 5.9 | L355: 4.24e-002 | M355: 111.8 | N355: 7.46 | O355: 1.1499999999999999 | P355: 79.09 | Q355: 转股中 | R355: 1.90年 | S355: 回售内 | T355: 1.32 | U355: 524 | V355: 2.2799999999999998 | W355: 2.4e-002 | X355: 1.9e-002 | Y355: 54 | Z355: 1.94 | AA355: -0.20000000000000001 | AB355: -0.20800000000000002 | AC355: 回售内 | AD355: 回售内 | AE355: 100.3 | AF355: 98.6 | AG355: 0.1 | AH355: AA- | AI355: 6.1399999999999996e-002 | AJ355: =H355+100*O355 -> 285.11000000000001 | AK355: 261.1 | AL355: 354 | AM355: 160.8 | AN355: 354 | AO355: 5.5999999999999994e-002 | AP355: 30 | AQ355: 模塑转债!!
A356: 314 | B356: 123015 | C356: 蓝盾转债!! | D356: 300297 | E356: 蓝盾股份 | F356: 计算机及 | G356: 软件开发 | H356: 221.5 | I356: -6.3e-003 | J356: -1.8e-003 | K356: 4.27 | L356: -2.5099999999999997e-002 | M356: 112.3 | N356: 5.79 | O356: 2. | P356: 73.75 | Q356: 转股中 | R356: 3年34天 | S356: 1年35天 | T356: 1 | U356: 162 | V356: 0.72400000000000009 | W356: 1.9e-002 | X356: 1.3999999999999999e-002 | Y356: 53 | Z356: 2.05 | AA356: -0.20000000000000001 | AB356: -0.20499999999999999 | AC356: -0.41499999999999998 | AD356: -0.41600000000000004 | AE356: 88.86 | AF356: 78.95 | AG356: 0.32 | AH356: BBB- | AI356: 0.12390000000000001 | AJ356: =H356+100*O356 -> 421.5 | AK356: 369.3 | AL356: 359 | AM356: 280.4 | AN356: 359 | AO356: -2.3e-002 | AP356: 16 | AQ356: 蓝盾转债!!
A357: 300 | B357: 113527 | C357: 维格转债!! | D357: 603518 | E357: 锦泓集团 | F357: 服装纺织 | G357: 服装行业 | H357: 266.8 | I357: 4.8499999999999995e-002 | J357: -1.37e-002 | K357: 26.28 | L357: 3.5499999999999997e-002 | M357: 119.5 | N357: 9.85 | O357: 0. | P357: 266.8 | Q357: 转股中 | R357: 3.55年 | S357: 1.55年 | T357: 3.72 | U357: 2599. | V357: 2.6400000000000001 | W357: 5.0000000000000003e-002 | X357: 0.13200000000000001 | Y357: 75 | Z357: 3.46 | AA357: -0.20499999999999999 | AB357: -0.21199999999999999 | AC357: -0.33299999999999996 | AD357: -0.33399999999999996 | AE357: 94.37 | AF357: 100.22 | AG357: 0.98 | AH357: AA | AI357: 5.1900000000000002e-002 | AJ357: =H357+100*O357 -> 266.80000000000001 | AK357: 266.8 | AL357: 355 | AM357: 166.6 | AN357: 355 | AO357: 0.214 | AP357: 84 | AQ357: 维格转债!!
A358: 367 | B358: 113009 | C358: 广汽转债! | D358: 601238 | E358: 广汽集团 | F358: 汽车 | G358: 乘用车 | H358: 120.66 | I358: 4.3799999999999999e-002 | J358: 1.6000000000000001e-003 | K358: 15.84 | L358: 6.0199999999999997e-002 | M358: 106 | N358: 13.97 | O358: 6.4000000000000001e-002 | P358: 113.39 | Q358: 转股中 | R358: 0.54年 | S358: 回售内 | T358: 25.5 | U358: 472 | V358: 0.157 | W358: 1.6e-002 | X358: 1.8000000000000002e-002 | Y358: 1640. | Z358: 1.89 | AA358: -0.21299999999999999 | AB358: -0.23000000000000001 | AC358: 回售内 | AD358: 回售内 | AE358: 100.27 | AF358: 104.24 | AG358: 0.75 | AH358: AAA | AI358: 3.15e-002 | AJ358: =H358+100*O358 -> 127.06 | AK358: 127.9 | AL358: 93 | AM358: 23.7 | AN358: 17 | AO358: 0.24199999999999999 | AP358: 15 | AQ358: 广汽转债!
A359: 328 | B359: 113509 | C359: 新泉转债!! | D359: 603179 | E359: 新泉股份 | F359: 汽车 | G359: 零部件制 | H359: 219.85 | I359: 9.7999999999999997e-003 | J359: 2.0299999999999999e-002 | K359: 32.98 | L359: 3.0600000000000002e-002 | M359: 109.3 | N359: 15.25 | O359: 1.7000000000000001e-002 | P359: 216.26 | Q359: 转股中 | R359: 2.90年 | S359: 0.90年 | T359: 0.78 | U359: 109 | V359: 0.64400000000000002 | W359: 6.0000000000000001e-003 | X359: 1.3999999999999999e-002 | Y359: 122 | Z359: 3.44 | AA359: -0.21600000000000003 | AB359: -0.22 | AC359: -0.498 | AD359: -0.5 | AE359: 97.58 | AF359: 97.6 | AG359: 0.98 | AH359: AA | AI359: 4.0399999999999998e-002 | AJ359: =H359+100*O359 -> 221.54999999999998 | AK359: 223.4 | AL359: 348 | AM359: 125.8 | AN359: 346 | AO359: 1.2e-002 | AP359: 13 | AQ359: 新泉转债!!
A360: 343 | B360: 128032 | C360: 双环转债!!* | D360: 2472 | E360: 双环传动 | F360: 机械装备 | G360: 通用设备 | H360: 198.58 | I360: 0.107 | J360: -7.3000000000000001e-003 | K360: 19.49 | L360: 9.9900000000000003e-002 | M360: 109.3 | N360: 9.87 | O360: 6.0000000000000001e-003 | P360: 197.47 | Q360: 转股中 | R360: 2.46年 | S360: 0.46年 | T360: 1.89 | U360: 1393. | V360: 3.8199999999999998 | W360: 1.3000000000000001e-002 | X360: 2.5000000000000001e-002 | Y360: 148 | Z360: 3.83 | AA360: -0.218 | AB360: -0.223 | AC360: -0.80500000000000005 | AD360: -0.80799999999999994 | AE360: 99.3 | AF360: 99.32 | AG360: 1 | AH360: AA | AI360: 4.0399999999999998e-002 | AJ360: =H360+100*O360 -> 199.18000000000001 | AK360: 199.7 | AL360: 342 | AM360: 100.4 | AN360: 339 | AO360: 0.34200000000000003 | AP360: 37 | AQ360: 双环转债!!*
A361: 301 | B361: 113526 | C361: 联泰转债! | D361: 603797 | E361: 联泰环保 | F361: 城市公用 | G361: 三废处理 | H361: 261.36 | I361: 5.9999999999999995e-004 | J361: 7.6e-003 | K361: 7.3 | L361: 1.11e-002 | M361: 110.3 | N361: 6.11 | O361: 1.1899999999999999 | P361: 119.48 | Q361: 转股中 | R361: 3.54年 | S361: 1.54年 | T361: 1.93 | U361: 56 | V361: 0.11 | W361: 4.4999999999999998e-002 | X361: 5.4000000000000006e-002 | Y361: 43 | Z361: 1.92 | AA361: -0.21899999999999997 | AB361: -0.223 | AC361: -0.32899999999999996 | AD361: -0.33000000000000002 | AE361: 96.36 | AF361: 96.61 | AG361: 0.74 | AH361: AA+ | AI361: 3.8900000000000004e-002 | AJ361: =H361+100*O361 -> 380.36000000000001 | AK361: 403.2 | AL361: 363 | AM361: 306.6 | AN361: 363 | AO361: -2.7999999999999997e-002 | AP361: 9 | AQ361: 联泰转债!
A362: 169 | B362: 128111 | C362: 中矿转债! | D362: 2738 | E362: 中矿资源 | F362: 有色金属 | G362: 有色行业 | H362: 418.023 | I362: 7.8299999999999995e-002 | J362: 2.0099999999999996e-002 | K362: 60.4 | L362: 0.10000000000000001 | M362: 124.2 | N362: 15.42 | O362: 6.7000000000000004e-002 | P362: 391.7 | Q362: 转股中 | R362: 4.92年 | S362: 2.92年 | T362: 1.52 | U362: 2408. | V362: 3.8700000000000001 | W362: 8.0000000000000002e-003 | X362: 3.1e-002 | Y362: 195 | Z362: 5.69 | AA362: -0.221 | AB362: -0.22699999999999998 | AC362: -0.19 | AD362: -0.191 | AE362: 86.39 | AF362: 92.59 | AG362: 0.98 | AH362: AA- | AI362: 6.2899999999999998e-002 | AJ362: =H362+100*O362 -> 424.72300000000001 | AK362: 444.3 | AL362: 366 | AM362: 351.8 | AN362: 367 | AO362: 0.34999999999999998 | AP362: 9 | AQ362: 中矿转债!
A363: 325 | B363: 110044 | C363: 广电转债!! | D363: 600831 | E363: 广电网络 | F363: 传媒娱乐 | G363: 影视娱乐 | H363: 237.92 | I363: 2.0999999999999999e-003 | J363: -2.0000000000000001e-004 | K363: 5.64 | L363: 7.0999999999999995e-003 | M363: 111.3 | N363: 6.9 | O363: 1.9099999999999999 | P363: 81.74 | Q363: 转股中 | R363: 2.96年 | S363: 0.97年 | T363: 0.71 | U363: 31 | V363: 0.184 | W363: 1.8000000000000002e-002 | X363: 1.3999999999999999e-002 | Y363: 40 | Z363: 1.07 | AA363: -0.22800000000000001 | AB363: -0.23300000000000001 | AC363: -0.498 | AD363: -0.499 | AE363: 97.34 | AF363: 99.13 | AG363: 0.28 | AH363: AA | AI363: 4.0399999999999998e-002 | AJ363: =H363+100*O363 -> 428.91999999999996 | AK363: 394.1 | AL363: 362 | AM363: 295 | AN363: 361 | AO363: -4.4000000000000004e-002 | AP363: 10 | AQ363: 广电转债!!
A364: 345 | B364: 128029 | C364: 太阳转债!! | D364: 2078 | E364: 太阳纸业 | F364: 造纸包装 | G364: 造纸行业 | H364: 158.8 | I364: -1.43e-002 | J364: 7.9000000000000008e-003 | K364: 12.41 | L364: -6.4000000000000003e-003 | M364: 107 | N364: 8.45 | O364: 8.1000000000000003e-002 | P364: 146.86 | Q364: 转股中 | R364: 1.46年 | S364: 回售内 | T364: 9.09 | U364: 92 | V364: 6.4000000000000001e-002 | W364: 2.7999999999999997e-002 | X364: 4.0999999999999995e-002 | Y364: 326 | Z364: 1.91 | AA364: -0.23899999999999999 | AB364: -0.24600000000000002 | AC364: 回售内 | AD364: 回售内 | AE364: 100.17 | AF364: 101.47 | AG364: 1 | AH364: AA+ | AI364: 3.7400000000000003e-002 | AJ364: =H364+100*O364 -> 166.90000000000001 | AK364: 170.7 | AL364: 323 | AM364: 69.3 | AN364: 306 | AO364: -7.4999999999999997e-002 | AP364: 7 | AQ364: 太阳转债!!
A365: 217 | B365: 128095 | C365: 恩捷转债!! | D365: 2812 | E365: 恩捷股份 | F365: 电子 | G365: 元器件制 | H365: 403.564 | I365: 5.6500000000000002e-002 | J365: -2.7699999999999999e-002 | K365: 249.07 | L365: 2.9100000000000001e-002 | M365: 114.9 | N365: 64.92 | O365: 5.2000000000000005e-002 | P365: 383.66 | Q365: 转股中 | R365: 4.59年 | S365: 2.59年 | T365: 4.54 | U365: 901 | V365: 0.51500000000000001 | W365: 2.e-003 | X365: 8.0000000000000002e-003 | Y365: 2221. | Z365: 19.19 | AA365: -0.24199999999999999 | AB365: -0.24600000000000002 | AC365: -0.22 | AD365: -0.221 | AE365: 92.42 | AF365: 95.52 | AG365: 0.99 | AH365: AA | AI365: 4.1900000000000007e-002 | AJ365: =H365+100*O365 -> 408.76400000000001 | AK365: 423.5 | AL365: 365 | AM365: 328 | AN365: 365 | AO365: 0.19500000000000001 | AP365: 15 | AQ365: 恩捷转债!!
A366: 267 | B366: 123027 | C366: 蓝晓转债! | D366: 300487 | E366: 蓝晓科技 | F366: 化工 | G366: 化工 | H366: 348.624 | I366: 1.5900000000000001e-002 | J366: 1.3999999999999999e-002 | K366: 92.1 | L366: 3.04e-002 | M366: 118.8 | N366: 29.02 | O366: 9.8000000000000004e-002 | P366: 317.37 | Q366: 转股中 | R366: 3.92年 | S366: 1.92年 | T366: 1.07 | U366: 1328. | V366: 3.52 | W366: 5.0000000000000001e-003 | X366: 1.7000000000000001e-002 | Y366: 202 | Z366: 10.96 | AA366: -0.24399999999999999 | AB366: -0.249 | AC366: -0.29899999999999999 | AD366: -0.29899999999999999 | AE366: 89.48 | AF366: 90.42 | AG366: 0.98 | AH366: A+ | AI366: 7.3899999999999993e-002 | AJ366: =H366+100*O366 -> 358.42400000000004 | AK366: 379.9 | AL366: 360 | AM366: 289.5 | AN366: 360 | AO366: 0.20600000000000002 | AP366: 19 | AQ366: 蓝晓转债!
A367: 321 | B367: 128041 | C367: 盛路转债!! | D367: 2446 | E367: 盛路通信 | F367: 通信互联 | G367: 通信设备 | H367: 273.5 | I367: 7.3000000000000001e-003 | J367: -1.32e-002 | K367: 6.35 | L367: -1.24e-002 | M367: 114.3 | N367: 6.82 | O367: 1.9399999999999999 | P367: 93.11 | Q367: 转股中 | R367: 3年7天 | S367: 1年8天 | T367: 0.53 | U367: 123 | V367: 0.84599999999999997 | W367: 9.0000000000000011e-003 | X367: 9.0000000000000011e-003 | Y367: 58 | Z367: 1.88 | AA367: -0.255 | AB367: -0.26000000000000001 | AC367: -0.51700000000000002 | AD367: -0.51800000000000002 | AE367: 97.96 | AF367: 101.26 | AG367: 0.47 | AH367: AA | AI367: 4.1900000000000007e-002 | AJ367: =H367+100*O367 -> 467.5 | AK367: 453.9 | AL367: 368 | AM367: 352.6 | AN367: 368 | AO367: -2.6000000000000002e-002 | AP367: 12 | AQ367: 盛路转债!!
A368: 255 | B368: 123031 | C368: 晶瑞转债! | D368: 300655 | E368: 晶瑞股份 | F368: 化工 | G368: 化工 | H368: 398.064 | I368: 3.6400000000000002e-002 | J368: 2.63e-002 | K368: 39.76 | L368: 6.3399999999999998e-002 | M368: 115.8 | N368: 10.13 | O368: 1.3999999999999999e-002 | P368: 392.5 | Q368: 转股中 | R368: 4年50天 | S368: 2年51天 | T368: 0.53 | U368: 2901. | V368: 13.5 | W368: 4.0000000000000001e-003 | X368: 1.6e-002 | Y368: 135 | Z368: 5.65 | AA368: -0.26100000000000001 | AB368: -0.26600000000000001 | AC368: -0.27800000000000002 | AD368: -0.27899999999999997 | AE368: 87.8 | AF368: 86.77 | AG368: 0.99 | AH368: A+ | AI368: 7.3899999999999993e-002 | AJ368: =H368+100*O368 -> 399.464 | AK368: 403.6 | AL368: 364 | AM368: 315.8 | AN368: 364 | AO368: 0.29600000000000004 | AP368: 16 | AQ368: 晶瑞转债!
A369: 318 | B369: 123013 | C369: 横河转债! | D369: 300539 | E369: 横河精密 | F369: 机械装备 | G369: 专用设备 | H369: 368 | I369: 3.0800000000000001e-002 | J369: -4.0800000000000003e-002 | K369: 8.2 | L369: -2.0299999999999999e-002 | M369: 115.2 | N369: 9.04 | O369: 3.0600000000000001 | P369: 90.71 | Q369: 转股中 | R369: 3年16天 | S369: 1年17天 | T369: 0.38 | U369: 1224. | V369: 8.6199999999999992 | W369: 2.1000000000000001e-002 | X369: 1.9e-002 | Y369: 18 | Z369: 3.67 | AA369: -0.32200000000000001 | AB369: -0.32700000000000001 | AC369: -0.58200000000000007 | AD369: -0.58299999999999996 | AE369: 94.92 | AF369: 93.29 | AG369: 0.49 | AH369: A+ | AI369: 7.3899999999999993e-002 | AJ369: =H369+100*O369 -> 674. | AK369: 645.3 | AL369: 369 | AM369: 550.4 | AN369: 369 | AO369: 4.0000000000000001e-002 | AP369: 13 | AQ369: 横河转债!
A370: 356 | B370: 113016 | C370: 小康转债!! | D370: 601127 | E370: 小康股份 | F370: 汽车 | G370: 零部件制 | H370: 422.15 | I370: 1.6299999999999999e-002 | J370: 3.6400000000000002e-002 | K370: 66.95 | L370: 5.3200000000000004e-002 | M370: 109.3 | N370: 16.96 | O370: 6.9000000000000006e-002 | P370: 394.75 | Q370: 转股中 | R370: 2.33年 | S370: 0.33年 | T370: 2.39 | U370: 2697. | V370: 2.6499999999999999 | W370: 3.0000000000000001e-003 | X370: 1.e-002 | Y370: 909 | Z370: 18.45 | AA370: -0.41899999999999998 | AB370: -0.42200000000000004 | AC370: -1.611 | AD370: -1.6130000000000002 | AE370: 98.85 | AF370: 95.4 | AG370: 0.99 | AH370: AA- | AI370: 6.1399999999999996e-002 | AJ370: =H370+100*O370 -> 429.04999999999995 | AK370: 449.5 | AL370: 367 | AM370: 350.7 | AN370: 366 | AO370: -2.9999999999999999e-002 | AP370: 40 | AQ370: 小康转债!!