A1: 序号 | B1: 转债代码 | C1: 转债名称 | D1: 股票代码 | E1: 股票名称 | F1: 行业 | G1: 子行业 | H1: 转债价格 | I1: 涨跌 | J1: 日内套利 | K1: 股价 | L1: 涨跌 | M1: 剩余本息 | N1: 转股价格 | O1: 转股溢价率 | P1: 转股价值 | Q1: 距离转股日 | R1: 剩余年限 | S1: 回售年限 | T1: 转债余额 | U1: 转债成交额 | V1: 转债换手率 | W1: 余额/市值 | X1: 余额/股本 | Y1: 股票市值 | Z1: P/B | AA1: 税前收益率 | AB1: 税后收益率 | AC1: 税前回售收益 | AD1: 税后回售收益 | AE1: 回售价值 | AF1: 纯债价值 | AG1: 弹性 | AH1: 信用 | AI1: 折现率 | AJ1: 双低 | AK1: 老式双低 | AL1: 老式排名 | AM1: 新式双低 | AN1: 新式排名 | AO1: MA20乖离 | AP1: 热门度 | AQ1: 转债名称
A2: 277 | B2: 128062 | C2: 亚药转债! | D2: 2370 | E2: 亚太药业 | F2: 医药 | G2: 化学制药 | H2: 79.755 | I2: -2.8000000000000004e-003 | J2: 2.8000000000000004e-003 | K2: 4.29 | L2: -2.5000000000000001e-002 | M2: 119.3 | N2: 16.25 | O2: 2.02 | P2: 26.4 | Q2: 转股中 | R2: 3.81年 | S2: 1.81年 | T2: 9.63 | U2: 12 | V2: 1.4999999999999999e-002 | W2: 0.41799999999999998 | X2: 0.11 | Y2: 23 | Z2: 5.32 | AA2: 0.114 | AB2: 0.10400000000000001 | AC2: 0.13800000000000001 | AD2: 0.13500000000000001 | AE2: 81.59 | AF2: 76.82 | AG2: 0 | AH2: BB | AI2: 0.12509999999999999 | AJ2: =H2+100*O2 -> 281.755 | AK2: 133.1 | AL2: 175 | AM2: 51.5 | AN2: 254 | AO2: 2.4e-002 | AP2: 84 | AQ2: 亚药转债!
A3: 139 | B3: 113595 | C3: 花王转债! | D3: 603007 | E3: ST花王 | F3: 城市公用 | G3: 生态环境 | H3: 87.32 | I3: 1.7000000000000001e-003 | J3: -2.8000000000000004e-003 | K3: 3.32 | L3: -1.4800000000000001e-002 | M3: 125.3 | N3: 6.93 | O3: 0.82299999999999995 | P3: 47.91 | Q3: 转股中 | R3: 5年39天 | S3: 3年40天 | T3: 3.3 | U3: 4 | V3: 1.3999999999999999e-002 | W3: 0.29600000000000004 | X3: 0.14199999999999999 | Y3: 11 | Z3: 0.97 | AA3: 7.5199999999999989e-002 | AB3: 6.6000000000000003e-002 | AC3: 5.6299999999999996e-002 | AD3: 5.3499999999999999e-002 | AE3: 84.99 | AF3: 91.45 | AG3: 0.07 | AH3: AA- | AI3: 6.5199999999999994e-002 | AJ3: =H3+100*O3 -> 169.62 | AK3: 126.7 | AL3: 105 | AM3: 35.3 | AN3: 119 | AO3: 5.9000000000000004e-002 | AP3: 43 | AQ3: 花王转债!
A4: 197 | B4: 128100 | C4: 搜特转债! | D4: 2503 | E4: 搜于特 | F4: 服装纺织 | G4: 服装行业 | H4: 83.919 | I4: -5.3e-003 | J4: 5.3e-003 | K4: 1.66 | L4: 0. | M4: 116.9 | N4: 2.9 | O4: 0.46600000000000003 | P4: 57.24 | Q4: 转股中 | R4: 4.75年 | S4: 2.75年 | T4: 7.99 | U4: 16 | V4: 2.3e-002 | W4: 0.156 | X4: 8.900000000000001e-002 | Y4: 51 | Z4: 1.53 | AA4: 7.3800000000000004e-002 | AB4: 6.6799999999999998e-002 | AC4: 7.4900000000000008e-002 | AD4: 7.2300000000000003e-002 | AE4: 91.52 | AF4: 96.04 | AG4: 0.1 | AH4: AA | AI4: 4.3099999999999999e-002 | AJ4: =H4+100*O4 -> 130.51900000000001 | AK4: 110.6 | AL4: 6 | AM4: 14.6 | AN4: 4 | AO4: -2.7999999999999997e-002 | AP4: 65 | AQ4: 搜特转债!
A5: 184 | B5: 113576 | C5: 起步转债!! | D5: 603557 | E5: ST起步 | F5: 服装纺织 | G5: 鞋服行业 | H5: 93.35 | I5: -5.9999999999999995e-004 | J5: -1.8e-003 | K5: 4.92 | L5: -2.3799999999999998e-002 | M5: 121.3 | N5: 10.55 | O5: 1. | P5: 46.64 | Q5: 转股中 | R5: 4.83年 | S5: 2.83年 | T5: 2.66 | U5: 20 | V5: 8.0000000000000002e-002 | W5: 0.109 | X5: 5.0999999999999997e-002 | Y5: 24 | Z5: 1.56 | AA5: 5.7099999999999998e-002 | AB5: 4.8899999999999999e-002 | AC5: 3.7900000000000003e-002 | AD5: 3.49e-002 | AE5: 81.81 | AF5: 82.55 | AG5: 0.1 | AH5: A | AI5: 8.5099999999999995e-002 | AJ5: =H5+100*O5 -> 193.34999999999999 | AK5: 140.1 | AL5: 237 | AM5: 57.5 | AN5: 286 | AO5: -8.0000000000000002e-003 | AP5: 33 | AQ5: 起步转债!!
A6: 80 | B6: 128138 | C6: 侨银转债! | D6: 2973 | E6: 侨银股份 | F6: 城市公用 | G6: 城市公用 | H6: 103.065 | I6: -1.2999999999999999e-003 | J6: 1.6000000000000001e-003 | K6: 17.11 | L6: 1.1999999999999999e-003 | M6: 136.5 | N6: 25.33 | O6: 0.52600000000000002 | P6: 67.55 | Q6: 转股中 | R6: 5.43年 | S6: 3.44年 | T6: 4.2 | U6: 6.3 | V6: 1.4999999999999999e-002 | W6: 5.9999999999999998e-002 | X6: 4.0999999999999995e-002 | Y6: 70 | Z6: 4.64 | AA6: 5.4199999999999998e-002 | AB6: 4.3200000000000002e-002 | AC6: 3.7000000000000002e-003 | AD6: 1.2999999999999999e-003 | AE6: 83.38 | AF6: 97.52 | AG6: 0.24 | AH6: AA- | AI6: 6.5199999999999994e-002 | AJ6: =H6+100*O6 -> 155.66499999999999 | AK6: 138.6 | AL6: 229 | AM6: 41.1 | AN6: 181 | AO6: 1.9e-002 | AP6: 12 | AQ6: 侨银转债!
A7: 275 | B7: 128063 | C7: 未来转债! | D7: 2631 | E7: 德尔未来 | F7: 其他 | G7: 家居用品 | H7: 105.45 | I7: 9.0000000000000011e-003 | J7: -5.4000000000000003e-003 | K7: 6.27 | L7: 1.6200000000000003e-002 | M7: 127.5 | N7: 8.6 | O7: 0.44600000000000001 | P7: 72.91 | Q7: 转股中 | R7: 3.81年 | S7: 2.81年 | T7: 6.3 | U7: 8.3 | V7: 1.2e-002 | W7: 0.151 | X7: 0.11 | Y7: 42 | Z7: 2.48 | AA7: 5.2600000000000001e-002 | AB7: 3.9900000000000005e-002 | AC7: 8.8000000000000005e-003 | AD7: 3.4999999999999996e-003 | AE7: 90.26 | AF7: 101.3 | AG7: 0.22 | AH7: AA- | AI7: 6.4100000000000004e-002 | AJ7: =H7+100*O7 -> 150.05000000000001 | AK7: 138 | AL7: 224 | AM7: 36.7 | AN7: 135 | AO7: 3.4000000000000002e-002 | AP7: 32 | AQ7: 未来转债!
A8: 261 | B8: 123028 | C8: 清水转债! | D8: 300437 | E8: 清水源 | F8: 城市公用 | G8: 三废处理 | H8: 100.119 | I8: -5.9999999999999995e-004 | J8: -1.e-004 | K8: 8.87 | L8: -2.2000000000000001e-003 | M8: 121.8 | N8: 11.84 | O8: 0.33600000000000002 | P8: 74.92 | Q8: 转股中 | R8: 4年7天 | S8: 2年8天 | T8: 4.55 | U8: 6.6 | V8: 1.4999999999999999e-002 | W8: 0.23199999999999998 | X8: 0.17399999999999999 | Y8: 20 | Z8: 1.77 | AA8: 5.16e-002 | AB8: 4.1500000000000002e-002 | AC8: 2.1099999999999997e-002 | AD8: 1.67e-002 | AE8: 91.62 | AF8: 95.62 | AG8: 0.31 | AH8: AA- | AI8: 6.4100000000000004e-002 | AJ8: =H8+100*O8 -> 133.71899999999999 | AK8: 125.3 | AL8: 93 | AM8: 29.7 | AN8: 60 | AO8: 4.0000000000000001e-003 | AP8: 52 | AQ8: 清水转债!
A9: 156 | B9: 127018 | C9: 本钢转债! | D9: 761 | E9: 本钢板材 | F9: 钢铁 | G9: 炼钢 | H9: 101.075 | I9: 2.9999999999999997e-004 | J9: 1.43e-002 | K9: 4.48 | L9: 3.4599999999999999e-002 | M9: 128.6 | N9: 5.03 | O9: 0.13500000000000001 | P9: 89.07 | Q9: 转股中 | R9: 5年17天 | S9: 3年18天 | T9: 67.5 | U9: 70 | V9: 1.e-002 | W9: 0.38900000000000001 | X9: 0.34600000000000003 | Y9: 174 | Z9: 0.84 | AA9: 5.0599999999999999e-002 | AB9: 4.0599999999999997e-002 | AC9: 1.6500000000000001e-002 | AD9: 1.2500000000000001e-002 | AE9: 91.45 | AF9: 101.73 | AG9: 0.42 | AH9: AAA | AI9: 4.9200000000000001e-002 | AJ9: =H9+100*O9 -> 114.575 | AK9: 113.1 | AL9: 10 | AM9: 11.4 | AN9: 3 | AO9: 3.3000000000000002e-002 | AP9: 63 | AQ9: 本钢转债!
A10: 362 | B10: 127003 | C10: 海印转债! | D10: 861 | E10: 海印股份 | F10: 商业零售 | G10: 商场 | H10: 104.96 | I10: 0. | J10: 0. | K10: 2.12 | L10: 0. | M10: 110 | N10: 3 | O10: 0.48499999999999999 | P10: 70.67 | Q10: 转股中 | R10: 0.99年 | S10: 回售内 | T10: 6.74 | U10: 5.4 | V10: 8.0000000000000002e-003 | W10: 0.13699999999999998 | X10: 9.6999999999999989e-002 | Y10: 49 | Z10: 1.29 | AA10: 4.8399999999999999e-002 | AB10: 2.92e-002 | AC10: 回售内 | AD10: 回售内 | AE10: 100.33 | AF10: 106.06 | AG10: 0.01 | AH10: AA | AI10: 3.7499999999999999e-002 | AJ10: =H10+100*O10 -> 153.45999999999998 | AK10: 139.3 | AL10: 232 | AM10: 33.2 | AN10: 102 | AO10: -4.2000000000000003e-002 | AP10: 71 | AQ10: 海印转债!
A11: 290 | B11: 110052 | C11: 贵广转债! | D11: 600996 | E11: 贵广网络 | F11: 传媒娱乐 | G11: 影视娱乐 | H11: 99.53 | I11: -1.9e-003 | J11: 1.7000000000000001e-003 | K11: 4.64 | L11: -4.3e-003 | M11: 117.7 | N11: 7.94 | O11: 0.70299999999999996 | P11: 58.44 | Q11: 转股中 | R11: 3.73年 | S11: 1.73年 | T11: 15.3 | U11: 41 | V11: 2.7000000000000003e-002 | W11: 0.313 | X11: 0.183 | Y11: 49 | Z11: 1.16 | AA11: 4.6900000000000004e-002 | AB11: 3.8100000000000002e-002 | AC11: 1.8500000000000003e-002 | AD11: 1.5300000000000001e-002 | AE11: 95.68 | AF11: 101.94 | AG11: 0.05 | AH11: AA+ | AI11: 4.0099999999999997e-002 | AJ11: =H11+100*O11 -> 169.82999999999998 | AK11: 140.6 | AL11: 243 | AM11: 38.7 | AN11: 157 | AO11: 6.0000000000000001e-003 | AP11: 18 | AQ11: 贵广转债!
A12: 202 | B12: 113569 | C12: 科达转债! | D12: 603660 | E12: 苏州科达 | F12: 通信互联 | G12: 物联网 | H12: 97.73 | I12: 3.4000000000000002e-003 | J12: -4.4000000000000003e-003 | K12: 7.09 | L12: -1.3899999999999999e-002 | M12: 120.3 | N12: 14.8 | O12: 1.04 | P12: 47.91 | Q12: 转股中 | R12: 4.74年 | S12: 2.74年 | T12: 5.16 | U12: 4 | V12: 8.0000000000000002e-003 | W12: 0.14599999999999999 | X12: 7.0000000000000007e-002 | Y12: 35 | Z12: 1.96 | AA12: 4.58e-002 | AB12: 3.7900000000000003e-002 | AC12: 2.06e-002 | AD12: 1.8100000000000002e-002 | AE12: 86.66 | AF12: 90.16 | AG12: 0.07 | AH12: AA- | AI12: 6.4100000000000004e-002 | AJ12: =H12+100*O12 -> 201.73000000000002 | AK12: 147.6 | AL12: 283 | AM12: 57.4 | AN12: 284 | AO12: 1.7000000000000001e-002 | AP12: 27 | AQ12: 科达转债!
A13: 177 | B13: 113573 | C13: 纵横转债! | D13: 603602 | E13: 纵横通信 | F13: 通信互联 | G13: 通信设备 | H13: 101.13 | I13: 2.3e-003 | J13: -5.4000000000000003e-003 | K13: 10.87 | L13: -1.6299999999999999e-002 | M13: 124.2 | N13: 18.78 | O13: 0.747 | P13: 57.88 | Q13: 转股中 | R13: 4.85年 | S13: 2.85年 | T13: 2.7 | U13: 7 | V13: 2.5000000000000001e-002 | W13: 0.122 | X13: 7.0000000000000007e-002 | Y13: 22 | Z13: 3.12 | AA13: 4.4299999999999999e-002 | AB13: 3.5400000000000001e-002 | AC13: 9.7999999999999997e-003 | AD13: 7.0999999999999995e-003 | AE13: 83.88 | AF13: 88.12 | AG13: 0.19 | AH13: A+ | AI13: 7.51e-002 | AJ13: =H13+100*O13 -> 175.82999999999998 | AK13: 144.4 | AL13: 267 | AM13: 56.3 | AN13: 279 | AO13: 4.0000000000000001e-002 | AP13: 24 | AQ13: 纵横转债!
A14: 122 | B14: 110072 | C14: 广汇转债! | D14: 600297 | E14: 广汇汽车 | F14: 汽车 | G14: 分销、售 | H14: 91.91 | I14: -1.e-003 | J14: 1.e-003 | K14: 2.8 | L14: 0. | M14: 114.5 | N14: 4.03 | O14: 0.32299999999999995 | P14: 69.48 | Q14: 转股中 | R14: 5.18年 | S14: 3.19年 | T14: 33.7 | U14: 25 | V14: 8.0000000000000002e-003 | W14: 0.14800000000000002 | X14: 0.10300000000000001 | Y14: 227 | Z14: 0.56 | AA14: 4.4000000000000004e-002 | AB14: 3.8699999999999998e-002 | AC14: 3.4799999999999998e-002 | AD14: 3.2899999999999999e-002 | AE14: 90.04 | AF14: 93.19 | AG14: 0.24 | AH14: AA+ | AI14: 4.1200000000000001e-002 | AJ14: =H14+100*O14 -> 124.20999999999999 | AK14: 114.3 | AL14: 13 | AM14: 21.2 | AN14: 15 | AO14: -2.9999999999999999e-002 | AP14: 57 | AQ14: 广汇转债!
A15: 146 | B15: 127019 | C15: 国城转债! | D15: 688 | E15: 国城矿业 | F15: 有色金属 | G15: 锌铅镍锡 | H15: 92.931 | I15: -1.4000000000000002e-003 | J15: 1.1000000000000001e-003 | K15: 9.06 | L15: -9.7999999999999997e-003 | M15: 115.1 | N15: 21.07 | O15: 1.1599999999999999 | P15: 43 | Q15: 转股中 | R15: 5年33天 | S15: 3年34天 | T15: 8.5 | U15: 5.5 | V15: 6.9999999999999993e-003 | W15: 8.199999999999999e-002 | X15: 3.5000000000000003e-002 | Y15: 103 | Z15: 4.44 | AA15: 4.3799999999999999e-002 | AB15: 3.8100000000000002e-002 | AC15: 3.4300000000000004e-002 | AD15: 3.2000000000000001e-002 | AE15: 90.11 | AF15: 92.76 | AG15: 0.03 | AH15: AA | AI15: 4.4199999999999996e-002 | AJ15: =H15+100*O15 -> 208.93099999999998 | AK15: 142.9 | AL15: 258 | AM15: 50.1 | AN15: 244 | AO15: -3.3000000000000002e-002 | AP15: 41 | AQ15: 国城转债!
A16: 131 | B16: 113596 | C16: 城地转债! | D16: 603887 | E16: 城地香江 | F16: 通信互联 | G16: 通信设备 | H16: 91.55 | I16: -8.9999999999999998e-004 | J16: -7.000000000000001e-004 | K16: 13.16 | L16: -3.1600000000000003e-002 | M16: 113.5 | N16: 29.21 | O16: 1.03 | P16: 45.05 | Q16: 转股中 | R16: 5年46天 | S16: 3年47天 | T16: 12 | U16: 26 | V16: 2.4e-002 | W16: 0.24299999999999999 | X16: 0.109 | Y16: 49 | Z16: 1.3 | AA16: 4.3799999999999999e-002 | AB16: 3.8599999999999995e-002 | AC16: 3.9399999999999998e-002 | AD16: 3.7000000000000005e-002 | AE16: 84.53 | AF16: 82.72 | AG16: 0.05 | AH16: AA- | AI16: 6.5199999999999994e-002 | AJ16: =H16+100*O16 -> 194.55000000000001 | AK16: 138 | AL16: 226 | AM16: 53.5 | AN16: 265 | AO16: 9.5000000000000001e-002 | AP16: 24 | AQ16: 城地转债!
A17: 280 | B17: 113530 | C17: 大丰转债! | D17: 603081 | E17: 大丰实业 | F17: 建筑 | G17: 装饰工程 | H17: 103.23 | I17: 1.6000000000000001e-003 | J17: -2.9999999999999997e-004 | K17: 11.36 | L17: 9.7999999999999997e-003 | M17: 121 | N17: 16.49 | O17: 0.498 | P17: 68.89 | Q17: 转股中 | R17: 3.79年 | S17: 1.79年 | T17: 6.3 | U17: 1.1 | V17: 2.e-003 | W17: 0.13800000000000001 | X17: 9.5000000000000001e-002 | Y17: 46 | Z17: 2.05 | AA17: 4.36e-002 | AB17: 3.3700000000000001e-002 | AC17: -1.6000000000000001e-003 | AD17: -4.5000000000000005e-003 | AE17: 94.81 | AF17: 103.43 | AG17: 0.12 | AH17: AA | AI17: 4.3099999999999999e-002 | AJ17: =H17+100*O17 -> 153.03 | AK17: 137.6 | AL17: 220 | AM17: 34.1 | AN17: 113 | AO17: -2.4e-002 | AP17: 33 | AQ17: 大丰转债!
A18: 123 | B18: 113600 | C18: 新星转债! | D18: 603978 | E18: 深圳新星 | F18: 有色金属 | G18: 有色行业 | H18: 101.53 | I18: -4.8999999999999998e-003 | J18: -1.89e-002 | K18: 18.96 | L18: -5.67e-002 | M18: 126 | N18: 23.85 | O18: 0.27699999999999997 | P18: 79.5 | Q18: 转股中 | R18: 5.17年 | S18: 3.17年 | T18: 5.95 | U18: 51 | V18: 8.4000000000000005e-002 | W18: 0.19600000000000001 | X18: 0.156 | Y18: 30 | Z18: 1.98 | AA18: 4.36e-002 | AB18: 3.4799999999999998e-002 | AC18: 7.0999999999999995e-003 | AD18: 4.7999999999999996e-003 | AE18: 84.37 | AF18: 91.53 | AG18: 0.42 | AH18: AA- | AI18: 6.5199999999999994e-002 | AJ18: =H18+100*O18 -> 129.22999999999999 | AK18: 123.6 | AL18: 72 | AM18: 32 | AN18: 88 | AO18: 0.113 | AP18: 22 | AQ18: 新星转债!
A19: 337 | B19: 113017 | C19: 吉视转债! | D19: 601929 | E19: 吉视传媒 | F19: 传媒娱乐 | G19: 影视娱乐 | H19: 97.79 | I19: 2.e-003 | J19: -7.000000000000001e-004 | K19: 1.93 | L19: 2.12e-002 | M19: 108.8 | N19: 2.95 | O19: 0.495 | P19: 65.42 | Q19: 转股中 | R19: 2.55年 | S19: 0.55年 | T19: 15.6 | U19: 29 | V19: 1.9e-002 | W19: 0.26000000000000001 | X19: 0.17000000000000001 | Y19: 60 | Z19: 0.91 | AA19: 4.3499999999999997e-002 | AB19: 3.6600000000000001e-002 | AC19: 5.4600000000000003e-002 | AD19: 5.0000000000000003e-002 | AE19: 98.86 | AF19: 98.97 | AG19: 0.06 | AH19: AA+ | AI19: 3.85e-002 | AJ19: =H19+100*O19 -> 147.29000000000002 | AK19: 130.2 | AL19: 136 | AM19: 31.2 | AN19: 77 | AO19: 1.3000000000000001e-002 | AP19: 64 | AQ19: 吉视转债!
A20: 266 | B20: 113535 | C20: 大业转债! | D20: 603278 | E20: 大业股份 | F20: 汽车 | G20: 零部件制 | H20: 99.81 | I20: -4.0000000000000002e-004 | J20: -1.5e-003 | K20: 8.44 | L20: -1.6299999999999999e-002 | M20: 112.5 | N20: 12.4 | O20: 0.46600000000000003 | P20: 68.06 | Q20: 转股中 | R20: 2.91年 | S20: 0.91年 | T20: 5 | U20: 3.6 | V20: 6.9999999999999993e-003 | W20: 0.20399999999999999 | X20: 0.13900000000000001 | Y20: 24 | Z20: 1.43 | AA20: 4.2500000000000003e-002 | AB20: 3.4300000000000004e-002 | AC20: 1.34e-002 | AD20: 1.11e-002 | AE20: 96.92 | AF20: 100.08 | AG20: 0.11 | AH20: AA | AI20: 4.1500000000000002e-002 | AJ20: =H20+100*O20 -> 146.41 | AK20: 131.6 | AL20: 153 | AM20: 31.5 | AN20: 81 | AO20: -1.3000000000000001e-002 | AP20: 48 | AQ20: 大业转债!
A21: 225 | B21: 110064 | C21: 建工转债! | D21: 600939 | E21: 重庆建工 | F21: 建筑 | G21: 建筑工程 | H21: 99.81 | I21: 4.0000000000000002e-004 | J21: -1.9e-003 | K21: 3.6 | L21: -5.5000000000000005e-003 | M21: 119.8 | N21: 4.57 | O21: 0.26700000000000002 | P21: 78.77 | Q21: 转股中 | R21: 4.52年 | S21: 2.53年 | T21: 16.6 | U21: 14 | V21: 8.0000000000000002e-003 | W21: 0.254 | X21: 0.20000000000000001 | Y21: 65 | Z21: 0.93 | AA21: 4.2199999999999994e-002 | AB21: 3.4099999999999998e-002 | AC21: 1.6e-002 | AD21: 1.3000000000000001e-002 | AE21: 93.77 | AF21: 100.71 | AG21: 0.27 | AH21: AA+ | AI21: 4.0099999999999997e-002 | AJ21: =H21+100*O21 -> 126.51000000000001 | AK21: 120.8 | AL21: 41 | AM21: 20.1 | AN21: 11 | AO21: -3.0000000000000001e-003 | AP21: 44 | AQ21: 建工转债!
A22: 309 | B22: 128044 | C22: 岭南转债! | D22: 2717 | E22: 岭南股份 | F22: 城市公用 | G22: 生态环境 | H22: 98.4 | I22: 1.e-004 | J22: -4.0000000000000002e-004 | K22: 3.18 | L22: -9.300000000000001e-003 | M22: 111.3 | N22: 5.91 | O22: 0.82900000000000007 | P22: 53.81 | Q22: 转股中 | R22: 3.17年 | S22: 1.18年 | T22: 6.59 | U22: 18 | V22: 2.7999999999999997e-002 | W22: 0.13600000000000001 | X22: 7.2999999999999995e-002 | Y22: 49 | Z22: 1.12 | AA22: 4.0500000000000001e-002 | AB22: 3.3500000000000002e-002 | AC22: 3.3500000000000002e-002 | AD22: 2.92e-002 | AE22: 97.2 | AF22: 97.64 | AG22: 0.03 | AH22: AA | AI22: 4.3099999999999999e-002 | AJ22: =H22+100*O22 -> 181.30000000000001 | AK22: 143 | AL22: 260 | AM22: 45.3 | AN22: 215 | AO22: -3.5000000000000003e-002 | AP22: 45 | AQ22: 岭南转债!
A23: 152 | B23: 128117 | C23: 道恩转债! | D23: 2838 | E23: 道恩股份 | F23: 化工 | G23: 橡胶塑料 | H23: 101.6 | I23: 4.0000000000000001e-003 | J23: -8.8999999999999999e-003 | K23: 18.35 | L23: -2.0299999999999999e-002 | M23: 123.5 | N23: 28.83 | O23: 0.59599999999999997 | P23: 63.65 | Q23: 转股中 | R23: 5年20天 | S23: 3年21天 | T23: 3.6 | U23: 5.2 | V23: 1.3999999999999999e-002 | W23: 4.8000000000000001e-002 | X23: 3.1e-002 | Y23: 75 | Z23: 3.94 | AA23: 4.0199999999999993e-002 | AB23: 3.2000000000000001e-002 | AC23: 6.8999999999999999e-003 | AD23: 4.5000000000000005e-003 | AE23: 84.91 | AF23: 90.36 | AG23: 0.24 | AH23: AA- | AI23: 6.5199999999999994e-002 | AJ23: =H23+100*O23 -> 161.19999999999999 | AK23: 139.6 | AL23: 234 | AM23: 49.2 | AN23: 241 | AO23: -1.4999999999999999e-002 | AP23: 21 | AQ23: 道恩转债!
A24: 120 | B24: 128127 | C24: 文科转债! | D24: 2775 | E24: 文科园林 | F24: 城市公用 | G24: 生态环境 | H24: 99.37 | I24: 4.0999999999999995e-003 | J24: 2.3e-003 | K24: 4.44 | L24: 1.1399999999999999e-002 | M24: 121.3 | N24: 4.88 | O24: 9.1999999999999998e-002 | P24: 90.98 | Q24: 转股中 | R24: 5.19年 | S24: 3.19年 | T24: 9.5 | U24: 18 | V24: 1.9e-002 | W24: 0.41700000000000004 | X24: 0.38 | Y24: 23 | Z24: 0.96 | AA24: 4.0099999999999997e-002 | AB24: 3.27e-002 | AC24: 1.4499999999999999e-002 | AD24: 1.2e-002 | AE24: 84.55 | AF24: 88.1 | AG24: 0.56 | AH24: AA- | AI24: 6.5199999999999994e-002 | AJ24: =H24+100*O24 -> 108.57000000000001 | AK24: 107.8 | AL24: 1 | AM24: 19.7 | AN24: 10 | AO24: 6.0000000000000001e-003 | AP24: 48 | AQ24: 文科转债!
A25: 343 | B25: 128026 | C25: 众兴转债! | D25: 2772 | E25: 众兴菌业 | F25: 农业 | G25: 种植业 | H25: 99.237 | I25: 4.0000000000000002e-004 | J25: -5.0000000000000001e-004 | K25: 7.81 | L25: -2.5999999999999999e-003 | M25: 109.3 | N25: 11.36 | O25: 0.44299999999999995 | P25: 68.75 | Q25: 转股中 | R25: 2.51年 | S25: 0.51年 | T25: 9.19 | U25: 6.9 | V25: 8.0000000000000002e-003 | W25: 0.32000000000000001 | X25: 0.22 | Y25: 29 | Z25: 1.12 | AA25: 4.0000000000000001e-002 | AB25: 3.27e-002 | AC25: 3.8699999999999998e-002 | AD25: 3.32e-002 | AE25: 97.74 | AF25: 94.15 | AG25: 0.06 | AH25: AA- | AI25: 6.25e-002 | AJ25: =H25+100*O25 -> 143.53699999999998 | AK25: 129.7 | AL25: 131 | AM25: 32 | AN25: 87 | AO25: -1.2e-002 | AP25: 62 | AQ25: 众兴转债!
A26: 316 | B26: 123011 | C26: 德尔转债! | D26: 300473 | E26: 德尔股份 | F26: 汽车 | G26: 零部件制 | H26: 103.556 | I26: -4.0000000000000002e-004 | J26: -2.7000000000000001e-003 | K26: 19.95 | L26: -2.4e-002 | M26: 116.3 | N26: 31.38 | O26: 0.629 | P26: 63.58 | Q26: 转股中 | R26: 3年36天 | S26: 1年37天 | T26: 2.51 | U26: 9.7 | V26: 3.7000000000000005e-002 | W26: 9.3000000000000013e-002 | X26: 5.9000000000000004e-002 | Y26: 27 | Z26: 1.22 | AA26: 3.9e-002 | AB26: 2.92e-002 | AC26: -5.7999999999999996e-003 | AD26: -1.01e-002 | AE26: 95.1 | AF26: 96.35 | AG26: 0.13 | AH26: AA- | AI26: 6.4100000000000004e-002 | AJ26: =H26+100*O26 -> 166.45599999999999 | AK26: 143.5 | AL26: 262 | AM26: 47.2 | AN26: 227 | AO26: -4.4999999999999998e-002 | AP26: 41 | AQ26: 德尔转债!
A27: 307 | B27: 113519 | C27: 长久转债! | D27: 603569 | E27: XD长久物 | F27: 交通运输 | G27: 物流业 | H27: 105 | I27: 1.1999999999999999e-003 | J27: -2.3999999999999998e-003 | K27: 7.54 | L27: -1.0500000000000001e-002 | M27: 119.3 | N27: 11.04 | O27: 0.53700000000000003 | P27: 68.3 | Q27: 转股中 | R27: 3.41年 | S27: 1.41年 | T27: 6.97 | U27: 4.3 | V27: 6.0000000000000001e-003 | W27: 0.16500000000000001 | X27: 0.113 | Y27: 42 | Z27: 1.93 | AA27: 3.9e-002 | AB27: 2.87e-002 | AC27: -1.3500000000000002e-002 | AD27: -1.6899999999999998e-002 | AE27: 96.25 | AF27: 103.62 | AG27: 0.11 | AH27: AA | AI27: 4.3099999999999999e-002 | AJ27: =H27+100*O27 -> 158.69999999999999 | AK27: 141.7 | AL27: 250 | AM27: 38.1 | AN27: 147 | AO27: -3.1e-002 | AP27: 20 | AQ27: 长久转债!
A28: 110 | B28: 128132 | C28: 交建转债! | D28: 2941 | E28: 新疆交建 | F28: 建筑 | G28: 建筑工程 | H28: 96.33 | I28: -2.0000000000000001e-004 | J28: -2.3e-003 | K28: 10.91 | L28: -2.06e-002 | M28: 117.3 | N28: 18.57 | O28: 0.64000000000000001 | P28: 58.75 | Q28: 转股中 | R28: 5.26年 | S28: 3.26年 | T28: 8.5 | U28: 19 | V28: 2.3e-002 | W28: 0.121 | X28: 7.0999999999999994e-002 | Y28: 70 | Z28: 2.9 | AA28: 3.9e-002 | AB28: 3.2799999999999996e-002 | AC28: 2.23e-002 | AD28: 2.e-002 | AE28: 89.64 | AF28: 93.87 | AG28: 0.12 | AH28: AA | AI28: 4.4199999999999996e-002 | AJ28: =H28+100*O28 -> 160.32999999999998 | AK28: 133.9 | AL28: 183 | AM28: 40 | AN28: 173 | AO28: -9.0000000000000011e-003 | AP28: 19 | AQ28: 交建转债!
A29: 262 | B29: 113027 | C29: 华钰转债!! | D29: 601020 | E29: ST华钰 | F29: 有色金属 | G29: 锌铅镍锡 | H29: 99.12 | I29: -2.9999999999999997e-004 | J29: 3.8e-003 | K29: 7.4 | L29: 9.4999999999999998e-003 | M29: 114.9 | N29: 10.17 | O29: 0.36200000000000004 | P29: 72.76 | Q29: 转股中 | R29: 4年2.1天 | S29: 2年3.1天 | T29: 3.25 | U29: 30 | V29: 9.1999999999999998e-002 | W29: 7.9000000000000001e-002 | X29: 5.7999999999999996e-002 | Y29: 41 | Z29: 1.65 | AA29: 3.85e-002 | AB29: 3.1400000000000004e-002 | AC29: 1.9900000000000001e-002 | AD29: 1.67e-002 | AE29: 86.77 | AF29: 83.49 | AG29: 0.37 | AH29: A | AI29: 8.5099999999999995e-002 | AJ29: =H29+100*O29 -> 135.31999999999999 | AK29: 125.5 | AL29: 95 | AM29: 38.7 | AN29: 158 | AO29: 6.3e-002 | AP29: 46 | AQ29: 华钰转债!!
A30: 151 | B30: 128118 | C30: 瀛通转债! | D30: 2861 | E30: 瀛通通讯 | F30: 电子 | G30: 电子产品 | H30: 101.402 | I30: 5.0000000000000001e-003 | J30: -1.8200000000000001e-002 | K30: 15.05 | L30: -3.8300000000000001e-002 | M30: 122.1 | N30: 21.12 | O30: 0.42299999999999999 | P30: 71.26 | Q30: 转股中 | R30: 5年20天 | S30: 3年21天 | T30: 3 | U30: 5.3 | V30: 1.8000000000000002e-002 | W30: 0.126 | X30: 8.9999999999999997e-002 | Y30: 24 | Z30: 1.71 | AA30: 3.8399999999999997e-002 | AB30: 3.0499999999999999e-002 | AC30: 9.7999999999999997e-003 | AD30: 6.9999999999999993e-003 | AE30: 85.57 | AF30: 89.47 | AG30: 0.35 | AH30: AA- | AI30: 6.5199999999999994e-002 | AJ30: =H30+100*O30 -> 143.702 | AK30: 131.5 | AL30: 152 | AM30: 42.1 | AN30: 190 | AO30: -4.0000000000000001e-002 | AP30: 15 | AQ30: 瀛通转债!
A31: 74 | B31: 128139 | C31: 祥鑫转债! | D31: 2965 | E31: 祥鑫科技 | F31: 汽车 | G31: 零部件制 | H31: 99.23 | I31: 3.4999999999999996e-003 | J31: -6.0000000000000001e-003 | K31: 24.3 | L31: -8.199999999999999e-003 | M31: 121 | N31: 36.96 | O31: 0.50900000000000001 | P31: 65.75 | Q31: 转股中 | R31: 5.47年 | S31: 3.47年 | T31: 6.47 | U31: 1.8 | V31: 3.0000000000000001e-003 | W31: 0.17699999999999999 | X31: 0.11599999999999999 | Y31: 37 | Z31: 2.07 | AA31: 3.7699999999999997e-002 | AB31: 3.0800000000000001e-002 | AC31: 1.29e-002 | AD31: 1.0800000000000001e-002 | AE31: 82.77 | AF31: 86.26 | AG31: 0.3 | AH31: AA- | AI31: 6.5199999999999994e-002 | AJ31: =H31+100*O31 -> 150.13 | AK31: 132.7 | AL31: 170 | AM31: 46.4 | AN31: 224 | AO31: -4.0000000000000001e-003 | AP31: 13 | AQ31: 祥鑫转债!
A32: 57 | B32: 123088 | C32: 威唐转债! | D32: 300707 | E32: 威唐工业 | F32: 汽车 | G32: 零部件制 | H32: 99.813 | I32: 6.1999999999999998e-003 | J32: -4.5999999999999999e-003 | K32: 16 | L32: 3.0999999999999999e-003 | M32: 121.6 | N32: 20.72 | O32: 0.29299999999999998 | P32: 77.22 | Q32: 10天 | R32: 5.51年 | S32: 3.51年 | T32: 3.01 | U32: 8.3 | V32: 2.7999999999999997e-002 | W32: 0.12 | X32: 9.3000000000000013e-002 | Y32: 25 | Z32: 3.64 | AA32: 3.7400000000000003e-002 | AB32: 3.0299999999999997e-002 | AC32: 1.3000000000000001e-002 | AD32: 1.0500000000000001e-002 | AE32: 80.12 | AF32: 81.94 | AG32: 0.52 | AH32: A+ | AI32: 7.6200000000000004e-002 | AJ32: =H32+100*O32 -> 129.113 | AK32: 122.4 | AL32: 58 | AM32: 40.5 | AN32: 177 | AO32: 7.0000000000000007e-002 | AP32: 12 | AQ32: 威唐转债!
A33: 157 | B33: 113589 | C33: 天创转债! | D33: 603608 | E33: 天创时尚 | F33: 服装纺织 | G33: 鞋服行业 | H33: 96.62 | I33: -3.2000000000000002e-003 | J33: 4.0000000000000002e-004 | K33: 7.04 | L33: -2.4900000000000002e-002 | M33: 115.3 | N33: 12.44 | O33: 0.70700000000000007 | P33: 56.59 | Q33: 转股中 | R33: 5年12天 | S33: 3年13天 | T33: 6 | U33: 11 | V33: 1.9e-002 | W33: 0.19899999999999998 | X33: 0.11199999999999999 | Y33: 30 | Z33: 1.86 | AA33: 3.6499999999999998e-002 | AB33: 3.0800000000000001e-002 | AC33: 2.29e-002 | AD33: 2.0499999999999997e-002 | AE33: 90.53 | AF33: 93.19 | AG33: 0.11 | AH33: AA | AI33: 4.4199999999999996e-002 | AJ33: =H33+100*O33 -> 167.31999999999999 | AK33: 136.6 | AL33: 212 | AM33: 43.5 | AN33: 199 | AO33: 5.0000000000000001e-003 | AP33: 27 | AQ33: 天创转债!
A34: 260 | B34: 128069 | C34: 华森转债! | D34: 2907 | E34: 华森制药 | F34: 医药 | G34: 化学制药 | H34: 104.239 | I34: 2.3e-003 | J34: -7.8000000000000005e-003 | K34: 12.84 | L34: -2.1299999999999999e-002 | M34: 120 | N34: 18.04 | O34: 0.46500000000000002 | P34: 71.18 | Q34: 转股中 | R34: 4年12天 | S34: 2年13天 | T34: 3 | U34: 14 | V34: 4.4000000000000004e-002 | W34: 5.7999999999999996e-002 | X34: 4.0999999999999995e-002 | Y34: 52 | Z34: 4.54 | AA34: 3.6400000000000002e-002 | AB34: 2.7400000000000001e-002 | AC34: -3.3e-003 | AD34: -6.4000000000000003e-003 | AE34: 90.43 | AF34: 93.95 | AG34: 0.26 | AH34: AA- | AI34: 6.4100000000000004e-002 | AJ34: =H34+100*O34 -> 150.739 | AK34: 137.3 | AL34: 218 | AM34: 43.4 | AN34: 198 | AO34: -5.0000000000000001e-003 | AP34: 45 | AQ34: 华森转债!
A35: 361 | B35: 128013 | C35: 洪涛转债! | D35: 2325 | E35: 洪涛股份 | F35: 建筑 | G35: 装饰工程 | H35: 105.538 | I35: 3.0999999999999999e-003 | J35: 4.7999999999999996e-003 | K35: 2.35 | L35: 1.7299999999999999e-002 | M35: 109.8 | N35: 2.32 | O35: 4.2000000000000003e-002 | P35: 101.29 | Q35: 转股中 | R35: 1年48天 | S35: 回售内 | T35: 11.6 | U35: 18 | V35: 1.4999999999999999e-002 | W35: 0.39200000000000002 | X35: 0.39700000000000002 | Y35: 30 | Z35: 1.09 | AA35: 3.61e-002 | AB35: 1.95e-002 | AC35: 回售内 | AD35: 回售内 | AE35: 100.3 | AF35: 102.63 | AG35: 0.46 | AH35: AA- | AI35: 6.25e-002 | AJ35: =H35+100*O35 -> 109.738 | AK35: 109.8 | AL35: 4 | AM35: 7.2 | AN35: 1 | AO35: 9.0000000000000011e-003 | AP35: 91 | AQ35: 洪涛转债!
A36: 77 | B36: 123077 | C36: 汉得转债! | D36: 300170 | E36: 汉得信息 | F36: 计算机及 | G36: 软件开发 | H36: 103.98 | I36: -5.0000000000000001e-003 | J36: 5.0000000000000001e-004 | K36: 7.71 | L36: -1.41e-002 | M36: 125.5 | N36: 9.69 | O36: 0.307 | P36: 79.57 | Q36: 转股中 | R36: 5.45年 | S36: 3.45年 | T36: 9.37 | U36: 21 | V36: 2.2000000000000002e-002 | W36: 0.13699999999999998 | X36: 0.109 | Y36: 68 | Z36: 2.15 | AA36: 3.5799999999999998e-002 | AB36: 2.7699999999999999e-002 | AC36: -4.0000000000000002e-004 | AD36: -2.3999999999999998e-003 | AE36: 88.94 | AF36: 99.59 | AG36: 0.32 | AH36: AA | AI36: 4.4199999999999996e-002 | AJ36: =H36+100*O36 -> 134.68000000000001 | AK36: 128.4 | AL36: 123 | AM36: 28.8 | AN36: 48 | AO36: 9.9000000000000005e-002 | AP36: 14 | AQ36: 汉得转债!
A37: 300 | B37: 113524 | C37: 奇精转债! | D37: 603677 | E37: 奇精机械 | F37: 家电 | G37: 零部件制 | H37: 103.95 | I37: 3.0999999999999999e-003 | J37: 1.4000000000000002e-003 | K37: 11.27 | L37: 1.26e-002 | M37: 117.3 | N37: 13.98 | O37: 0.28899999999999998 | P37: 80.62 | Q37: 转股中 | R37: 3.51年 | S37: 1.51年 | T37: 3.3 | U37: 4.1 | V37: 1.2e-002 | W37: 0.152 | X37: 0.12300000000000001 | Y37: 22 | Z37: 2.21 | AA37: 3.5699999999999996e-002 | AB37: 2.6699999999999998e-002 | AC37: -6.7000000000000002e-003 | AD37: -9.8999999999999991e-003 | AE37: 92.71 | AF37: 94.74 | AG37: 0.35 | AH37: AA- | AI37: 6.4100000000000004e-002 | AJ37: =H37+100*O37 -> 132.84999999999999 | AK37: 127.3 | AL37: 113 | AM37: 32.5 | AN37: 94 | AO37: 4.4999999999999998e-002 | AP37: 44 | AQ37: 奇精转债!
A38: 283 | B38: 123023 | C38: 迪森转债! | D38: 300335 | E38: 迪森股份 | F38: 能源电力 | G38: 电力供应 | H38: 100.43 | I38: 2.9999999999999997e-004 | J38: 2.7000000000000001e-003 | K38: 4.95 | L38: 1.43e-002 | M38: 114.3 | N38: 6.89 | O38: 0.39799999999999996 | P38: 71.84 | Q38: 转股中 | R38: 3.77年 | S38: 2.77年 | T38: 5.29 | U38: 4.6 | V38: 9.0000000000000011e-003 | W38: 0.28699999999999998 | X38: 0.20600000000000002 | Y38: 18 | Z38: 1.32 | AA38: 3.56e-002 | AB38: 2.8399999999999998e-002 | AC38: 1.43e-002 | AD38: 1.11e-002 | AE38: 92.59 | AF38: 97.77 | AG38: 0.21 | AH38: AA | AI38: 4.3099999999999999e-002 | AJ38: =H38+100*O38 -> 140.23000000000002 | AK38: 129 | AL38: 126 | AM38: 31.2 | AN38: 78 | AO38: 9.0000000000000011e-003 | AP38: 50 | AQ38: 迪森转债!
A39: 118 | B39: 113601 | C39: 塞力转债! | D39: 603716 | E39: 塞力医疗 | F39: 医药 | G39: 医药商业 | H39: 101.7 | I39: 2.8999999999999998e-003 | J39: 2.9999999999999997e-004 | K39: 14.42 | L39: 6.3e-003 | M39: 121.3 | N39: 16.98 | O39: 0.19800000000000001 | P39: 84.92 | Q39: 转股中 | R39: 5.19年 | S39: 3.19年 | T39: 5.43 | U39: 14 | V39: 2.5000000000000001e-002 | W39: 0.184 | X39: 0.156 | Y39: 30 | Z39: 1.89 | AA39: 3.5400000000000001e-002 | AB39: 2.7999999999999997e-002 | AC39: 7.4000000000000003e-003 | AD39: 4.8999999999999998e-003 | AE39: 84.53 | AF39: 88.08 | AG39: 0.51 | AH39: AA- | AI39: 6.5199999999999994e-002 | AJ39: =H39+100*O39 -> 121.5 | AK39: 118.5 | AL39: 28 | AM39: 30.4 | AN39: 68 | AO39: 6.3e-002 | AP39: 38 | AQ39: 塞力转债!
A40: 199 | B40: 123044 | C40: 红相转债!! | D40: 300427 | E40: 红相股份 | F40: 能源电力 | G40: 电力设备 | H40: 106.52 | I40: 6.8000000000000005e-003 | J40: -1.6799999999999999e-002 | K40: 13.75 | L40: -3.0299999999999997e-002 | M40: 125 | N40: 18.67 | O40: 0.44600000000000001 | P40: 73.65 | Q40: 转股中 | R40: 4.75年 | S40: 2.75年 | T40: 5.5 | U40: 14 | V40: 2.5000000000000001e-002 | W40: 0.111 | X40: 8.199999999999999e-002 | Y40: 50 | Z40: 2.11 | AA40: 3.5099999999999999e-002 | AB40: 2.5899999999999999e-002 | AC40: -6.6e-003 | AD40: -9.4999999999999998e-003 | AE40: 87.37 | AF40: 93.75 | AG40: 0.33 | AH40: AA- | AI40: 6.4100000000000004e-002 | AJ40: =H40+100*O40 -> 151.12 | AK40: 139.4 | AL40: 233 | AM40: 45.6 | AN40: 219 | AO40: 6.9000000000000006e-002 | AP40: 20 | AQ40: 红相转债!!
A41: 227 | B41: 128085 | C41: 鸿达转债! | D41: 2002 | E41: 鸿达兴业 | F41: 化工 | G41: 化工 | H41: 106.888 | I41: -1.9400000000000001e-002 | J41: -1.4499999999999999e-002 | K41: 4.1 | L41: -3.9800000000000002e-002 | M41: 124.4 | N41: 3.92 | O41: 2.2000000000000002e-002 | P41: 104.59 | Q41: 转股中 | R41: 4.51年 | S41: 2.52年 | T41: 7.78 | U41: 75 | V41: 8.900000000000001e-002 | W41: 6.3e-002 | X41: 6.6000000000000003e-002 | Y41: 123 | Z41: 1.41 | AA41: 3.5000000000000003e-002 | AB41: 2.5499999999999998e-002 | AC41: -1.06e-002 | AD41: -1.34e-002 | AE41: 70.88 | AF41: 65.96 | AG41: 0.85 | AH41: B | AI41: 0.15509999999999999 | AJ41: =H41+100*O41 -> 109.08800000000001 | AK41: 109.2 | AL41: 3 | AM41: 38.3 | AN41: 150 | AO41: -2.3e-002 | AP41: 100 | AQ41: 鸿达转债!
A42: 304 | B42: 128049 | C42: 华源转债! | D42: 2787 | E42: 华源控股 | F42: 造纸包装 | G42: 包装材料 | H42: 101.96 | I42: 8.9999999999999998e-004 | J42: -5.1000000000000004e-003 | K42: 5.8 | L42: -1.1899999999999999e-002 | M42: 114.5 | N42: 7.37 | O42: 0.29600000000000004 | P42: 78.7 | Q42: 转股中 | R42: 3.46年 | S42: 1.46年 | T42: 3.63 | U42: 2 | V42: 5.0000000000000001e-003 | W42: 0.19800000000000001 | X42: 0.156 | Y42: 18 | Z42: 1.23 | AA42: 3.4799999999999998e-002 | AB42: 2.69e-002 | AC42: 5.3e-003 | AD42: 1.9e-003 | AE42: 93.01 | AF42: 92.76 | AG42: 0.35 | AH42: AA- | AI42: 6.4100000000000004e-002 | AJ42: =H42+100*O42 -> 131.56 | AK42: 125.2 | AL42: 92 | AM42: 32.2 | AN42: 89 | AO42: 6.9999999999999993e-003 | AP42: 44 | AQ42: 华源转债!
A43: 176 | B43: 113578 | C43: 全筑转债! | D43: 603030 | E43: 全筑股份 | F43: 建筑 | G43: 装饰工程 | H43: 100.2 | I43: 1.7000000000000001e-003 | J43: -8.9999999999999998e-004 | K43: 4.46 | L43: 2.2000000000000001e-003 | M43: 117.9 | N43: 5.43 | O43: 0.22 | P43: 82.14 | Q43: 转股中 | R43: 4.85年 | S43: 2.86年 | T43: 3.84 | U43: 21 | V43: 5.2999999999999999e-002 | W43: 0.16 | X43: 0.13100000000000001 | Y43: 24 | Z43: 1.05 | AA43: 3.4700000000000002e-002 | AB43: 2.7900000000000001e-002 | AC43: 1.0500000000000001e-002 | AD43: 8.3000000000000001e-003 | AE43: 91.11 | AF43: 96.42 | AG43: 0.36 | AH43: AA | AI43: 4.3099999999999999e-002 | AJ43: =H43+100*O43 -> 122.2 | AK43: 118.3 | AL43: 27 | AM43: 21.8 | AN43: 18 | AO43: 1.8000000000000002e-002 | AP43: 20 | AQ43: 全筑转债!
A44: 319 | B44: 123010 | C44: 博世转债! | D44: 300422 | E44: 博世科 | F44: 城市公用 | G44: 三废处理 | H44: 101.43 | I44: 4.0000000000000001e-003 | J44: -6.1999999999999998e-003 | K44: 8.54 | L44: -1.2699999999999999e-002 | M44: 112.3 | N44: 12.2 | O44: 0.44900000000000001 | P44: 70 | Q44: 转股中 | R44: 3年23天 | S44: 1年24天 | T44: 4.3 | U44: 2.6 | V44: 6.0000000000000001e-003 | W44: 0.124 | X44: 8.6999999999999994e-002 | Y44: 35 | Z44: 1.43 | AA44: 3.4599999999999999e-002 | AB44: 2.6800000000000001e-002 | AC44: 1.11e-002 | AD44: 6.5000000000000006e-003 | AE44: 95.31 | AF44: 93.25 | AG44: 0.17 | AH44: AA- | AI44: 6.4100000000000004e-002 | AJ44: =H44+100*O44 -> 146.33000000000001 | AK44: 132.9 | AL44: 172 | AM44: 37.6 | AN44: 144 | AO44: 1.e-003 | AP44: 30 | AQ44: 博世转债!
A45: 356 | B45: 128015 | C45: 久其转债! | D45: 2279 | E45: 久其软件 | F45: 计算机及 | G45: 软件开发 | H45: 102.43 | I45: 1.1999999999999999e-003 | J45: 1.09e-002 | K45: 5.85 | L45: 4.0899999999999999e-002 | M45: 109.5 | N45: 6.97 | O45: 0.22 | P45: 83.93 | Q45: 转股中 | R45: 1.99年 | S45: 回售内 | T45: 7.8 | U45: 341 | V45: 0.42399999999999999 | W45: 0.187 | X45: 0.157 | Y45: 42 | Z45: 4.83 | AA45: 3.4300000000000004e-002 | AB45: 2.52e-002 | AC45: 回售内 | AD45: 回售内 | AE45: 100.25 | AF45: 95.17 | AG45: 0.3 | AH45: A+ | AI45: 7.3499999999999996e-002 | AJ45: =H45+100*O45 -> 124.43000000000001 | AK45: 120.9 | AL45: 42 | AM45: 20.7 | AN45: 13 | AO45: 0.183 | AP45: 66 | AQ45: 久其转债!
A46: 253 | B46: 128072 | C46: 翔鹭转债! | D46: 2842 | E46: 翔鹭钨业 | F46: 有色金属 | G46: 小金属 | H46: 100.238 | I46: 2.2000000000000001e-003 | J46: -3.4000000000000002e-003 | K46: 9.25 | L46: -6.4000000000000003e-003 | M46: 115.1 | N46: 15.34 | O46: 0.66200000000000003 | P46: 60.3 | Q46: 转股中 | R46: 4.19年 | S46: 2.19年 | T46: 3.02 | U46: 3.2 | V46: 1.1000000000000001e-002 | W46: 0.11900000000000001 | X46: 7.2000000000000008e-002 | Y46: 25 | Z46: 2.71 | AA46: 3.4300000000000004e-002 | AB46: 2.75e-002 | AC46: 1.3500000000000002e-002 | AD46: 1.06e-002 | AE46: 89.49 | AF46: 89.25 | AG46: 0.19 | AH46: AA- | AI46: 6.4100000000000004e-002 | AJ46: =H46+100*O46 -> 166.43799999999999 | AK46: 140.2 | AL46: 239 | AM46: 50.7 | AN46: 249 | AO46: -2.4e-002 | AP46: 29 | AQ46: 翔鹭转债!
A47: 243 | B47: 113546 | C47: 迪贝转债! | D47: 603320 | E47: 迪贝电气 | F47: 家电 | G47: 零部件制 | H47: 104.82 | I47: 3.4000000000000002e-003 | J47: -2.5000000000000001e-003 | K47: 11.38 | L47: 1.8e-003 | M47: 120.6 | N47: 14 | O47: 0.28999999999999998 | P47: 81.29 | Q47: 转股中 | R47: 4.36年 | S47: 2.37年 | T47: 2.3 | U47: 0.9 | V47: 4.0000000000000001e-003 | W47: 0.155 | X47: 0.126 | Y47: 15 | Z47: 2.13 | AA47: 3.3399999999999999e-002 | AB47: 2.4900000000000002e-002 | AC47: -3.4000000000000002e-003 | AD47: -6.4000000000000003e-003 | AE47: 86.73 | AF47: 88.6 | AG47: 0.46 | AH47: A+ | AI47: 7.51e-002 | AJ47: =H47+100*O47 -> 133.81999999999999 | AK47: 128.4 | AL47: 122 | AM47: 39.8 | AN47: 169 | AO47: 1.8000000000000002e-002 | AP47: 39 | AQ47: 迪贝转债!
A48: 207 | B48: 113566 | C48: 翔港转债! | D48: 603499 | E48: 翔港科技 | F48: 造纸包装 | G48: 包装材料 | H48: 106.91 | I48: -2.3999999999999998e-003 | J48: 8.9999999999999998e-004 | K48: 7.94 | L48: -3.8e-003 | M48: 124 | N48: 10.77 | O48: 0.45000000000000001 | P48: 73.72 | Q48: 转股中 | R48: 4.72年 | S48: 2.72年 | T48: 1.61 | U48: 2.6 | V48: 1.4999999999999999e-002 | W48: 0.10099999999999999 | X48: 7.400000000000001e-002 | Y48: 16 | Z48: 2.82 | AA48: 3.27e-002 | AB48: 2.3799999999999998e-002 | AC48: -9.1000000000000004e-003 | AD48: -1.18e-002 | AE48: 84.74 | AF48: 88.83 | AG48: 0.39 | AH48: A+ | AI48: 7.51e-002 | AJ48: =H48+100*O48 -> 151.91 | AK48: 140.1 | AL48: 238 | AM48: 51.3 | AN48: 253 | AO48: -9.0000000000000011e-003 | AP48: 28 | AQ48: 翔港转债!
A49: 79 | B49: 123076 | C49: 强力转债! | D49: 300429 | E49: 强力新材 | F49: 化工 | G49: 化工 | H49: 99.966 | I49: -2.0000000000000001e-004 | J49: -1.0800000000000001e-002 | K49: 11.79 | L49: -4.07e-002 | M49: 118.5 | N49: 18.94 | O49: 0.60599999999999998 | P49: 62.25 | Q49: 转股中 | R49: 5.44年 | S49: 3.44年 | T49: 8.5 | U49: 5.6 | V49: 6.9999999999999993e-003 | W49: 0.14000000000000001 | X49: 8.6999999999999994e-002 | Y49: 61 | Z49: 3.44 | AA49: 3.2400000000000005e-002 | AB49: 2.6200000000000001e-002 | AC49: 1.0700000000000001e-002 | AD49: 8.6e-003 | AE49: 82.88 | AF49: 84.65 | AG49: 0.27 | AH49: AA- | AI49: 6.5199999999999994e-002 | AJ49: =H49+100*O49 -> 160.566 | AK49: 137.7 | AL49: 221 | AM49: 53 | AN49: 264 | AO49: 1.4999999999999999e-002 | AP49: 15 | AQ49: 强力转债!
A50: 30 | B50: 113620 | C50: 傲农转债! | D50: 603363 | E50: 傲农生物 | F50: 农业 | G50: 畜牧业 | H50: 101.61 | I50: -1.9e-003 | J50: -3.4000000000000002e-003 | K50: 10.01 | L50: -2.1499999999999998e-002 | M50: 121.1 | N50: 14.51 | O50: 0.47299999999999998 | P50: 68.99 | Q50: 3月7天 | R50: 5.74年 | S50: 3.75年 | T50: 10 | U50: 6 | V50: 6.0000000000000001e-003 | W50: 0.14599999999999999 | X50: 0.10099999999999999 | Y50: 69 | Z50: 2.32 | AA50: 3.1600000000000003e-002 | AB50: 2.5000000000000001e-002 | AC50: 5.0000000000000001e-003 | AD50: 3.2000000000000002e-003 | AE50: 87.6 | AF50: 94.86 | AG50: 0.24 | AH50: AA | AI50: 4.4199999999999996e-002 | AJ50: =H50+100*O50 -> 148.91 | AK50: 134.2 | AL50: 185 | AM50: 39.4 | AN50: 166 | AO50: -7.2999999999999995e-002 | AP50: 5 | AQ50: 傲农转债!
A51: 69 | B51: 123081 | C51: 精研转债! | D51: 300709 | E51: 精研科技 | F51: 电子 | G51: 电子产品 | H51: 102.7 | I51: -1.9e-003 | J51: -1.6e-002 | K51: 35.72 | L51: -5.4000000000000006e-002 | M51: 121.3 | N51: 53.4 | O51: 0.53500000000000003 | P51: 66.89 | Q51: 转股中 | R51: 5.48年 | S51: 3.48年 | T51: 5.7 | U51: 6.3 | V51: 1.1000000000000001e-002 | W51: 0.115 | X51: 7.6999999999999999e-002 | Y51: 50 | Z51: 2.6 | AA51: 3.15e-002 | AB51: 2.46e-002 | AC51: 4.0999999999999995e-003 | AD51: 1.8e-003 | AE51: 82.99 | AF51: 86.47 | AG51: 0.33 | AH51: AA- | AI51: 6.5199999999999994e-002 | AJ51: =H51+100*O51 -> 156.19999999999999 | AK51: 138.5 | AL51: 227 | AM51: 52 | AN51: 260 | AO51: -2.7999999999999997e-002 | AP51: 8 | AQ51: 精研转债!
A52: 158 | B52: 123056 | C52: 雪榕转债! | D52: 300511 | E52: 雪榕生物 | F52: 农业 | G52: 种植业 | H52: 103.99 | I52: -1.e-004 | J52: -7.1999999999999998e-003 | K52: 8.47 | L52: -2.0799999999999999e-002 | M52: 121.1 | N52: 11.77 | O52: 0.44500000000000001 | P52: 71.96 | Q52: 转股中 | R52: 5年12天 | S52: 3年13天 | T52: 5.84 | U52: 3.9 | V52: 6.0000000000000001e-003 | W52: 0.156 | X52: 0.11199999999999999 | Y52: 37 | Z52: 1.81 | AA52: 3.1400000000000004e-002 | AB52: 2.3900000000000001e-002 | AC52: 1.e-004 | AD52: -2.3e-003 | AE52: 85.19 | AF52: 88.78 | AG52: 0.35 | AH52: AA- | AI52: 6.5199999999999994e-002 | AJ52: =H52+100*O52 -> 148.49000000000001 | AK52: 136 | AL52: 202 | AM52: 47.2 | AN52: 228 | AO52: -4.4000000000000004e-002 | AP52: 16 | AQ52: 雪榕转债!
A53: 241 | B53: 110059 | C53: 浦发转债! | D53: 600000 | E53: 浦发银行 | F53: 金融 | G53: 银行行业 | H53: 103.2 | I53: -5.0000000000000001e-004 | J53: -5.9999999999999995e-004 | K53: 10.17 | L53: -5.8999999999999999e-003 | M53: 117.6 | N53: 14.45 | O53: 0.46600000000000003 | P53: 70.38 | Q53: 转股中 | R53: 4.38年 | S53: 无权 | T53: 500 | U53: 176 | V53: 3.0000000000000001e-003 | W53: 0.16699999999999998 | X53: 0.11800000000000001 | Y53: 2985. | Z53: 0.55 | AA53: 3.1200000000000002e-002 | AB53: 2.3700000000000002e-002 | AC53: 无权 | AD53: 无权 | AE53: 无权 | AF53: 100.33 | AG53: 0.19 | AH53: AAA | AI53: 3.8100000000000002e-002 | AJ53: =H53+100*O53 -> 149.80000000000001 | AK53: 136 | AL53: 203 | AM53: 35.7 | AN53: 125 | AO53: -5.0000000000000001e-003 | AP53: 63 | AQ53: 浦发转债!
A54: 267 | B54: 128066 | C54: 亚泰转债! | D54: 2811 | E54: 郑中设计 | F54: 建筑 | G54: 装饰工程 | H54: 104.1 | I54: 8.6999999999999994e-003 | J54: 5.0000000000000001e-004 | K54: 8.73 | L54: 1.8700000000000001e-002 | M54: 116.7 | N54: 9.67 | O54: 0.153 | P54: 90.28 | Q54: 转股中 | R54: 3.85年 | S54: 1.85年 | T54: 4.8 | U54: 12 | V54: 2.4e-002 | W54: 0.20399999999999999 | X54: 0.184 | Y54: 24 | Z54: 1.59 | AA54: 3.0699999999999998e-002 | AB54: 2.2799999999999997e-002 | AC54: -5.1000000000000004e-003 | AD54: -8.1000000000000013e-003 | AE54: 91 | AF54: 92.33 | AG54: 0.5 | AH54: AA- | AI54: 6.4100000000000004e-002 | AJ54: =H54+100*O54 -> 119.39999999999999 | AK54: 117.9 | AL54: 24 | AM54: 25.6 | AN54: 32 | AO54: 3.2000000000000001e-002 | AP54: 61 | AQ54: 亚泰转债!
A55: 180 | B55: 123049 | C55: 维尔转债 | D55: 300190 | E55: 维尔利 | F55: 城市公用 | G55: 三废处理 | H55: 107.8 | I55: -3.7000000000000002e-003 | J55: 9.1000000000000004e-003 | K55: 6.78 | L55: 1.04e-002 | M55: 124.3 | N55: 7.38 | O55: 0.17300000000000001 | P55: 91.87 | Q55: 转股中 | R55: 4.84年 | S55: 2.84年 | T55: 9.17 | U55: 9.4 | V55: 9.0000000000000011e-003 | W55: 0.17300000000000001 | X55: 0.159 | Y55: 53 | Z55: 1.22 | AA55: 3.0600000000000002e-002 | AB55: 2.18e-002 | AC55: -1.1299999999999999e-002 | AD55: -1.3899999999999999e-002 | AE55: 86.65 | AF55: 92.67 | AG55: 0.52 | AH55: AA- | AI55: 6.4100000000000004e-002 | AJ55: =H55+100*O55 -> 125.09999999999999 | AK55: 123.7 | AL55: 74 | AM55: 31.1 | AN55: 75 | AO55: 0. | AP55: 17 | AQ55: 维尔转债
A56: 128 | B56: 113597 | C56: 佳力转债! | D56: 603912 | E56: 佳力图 | F56: 机械装备 | G56: 专用设备 | H56: 107.19 | I56: -3.0999999999999999e-003 | J56: -1.11e-002 | K56: 15.47 | L56: -5.1500000000000004e-002 | M56: 124.5 | N56: 23.4 | O56: 0.621 | P56: 66.11 | Q56: 转股中 | R56: 5年48天 | S56: 3年49天 | T56: 3 | U56: 105 | V56: 0.32600000000000001 | W56: 8.900000000000001e-002 | X56: 5.9000000000000004e-002 | Y56: 34 | Z56: 3.61 | AA56: 3.0299999999999997e-002 | AB56: 2.2000000000000002e-002 | AC56: -8.0000000000000002e-003 | AD56: -1.0500000000000001e-002 | AE56: 85.01 | AF56: 90.74 | AG56: 0.27 | AH56: AA- | AI56: 6.5199999999999994e-002 | AJ56: =H56+100*O56 -> 169.28999999999999 | AK56: 148.3 | AL56: 284 | AM56: 57.5 | AN56: 287 | AO56: -1.2e-002 | AP56: 14 | AQ56: 佳力转债!
A57: 291 | B57: 113021 | C57: 中信转债! | D57: 601998 | E57: 中信银行 | F57: 金融 | G57: 银行行业 | H57: 105.93 | I57: 1.e-004 | J57: -8.0000000000000004e-004 | K57: 5.24 | L57: -3.8e-003 | M57: 118 | N57: 6.98 | O57: 0.41100000000000003 | P57: 75.07 | Q57: 转股中 | R57: 3.73年 | S57: 无权 | T57: 400 | U57: 42 | V57: 1.e-003 | W57: 0.156 | X57: 0.11699999999999999 | Y57: 2564. | Z57: 0.53 | AA57: 3.0200000000000001e-002 | AB57: 2.1400000000000002e-002 | AC57: 无权 | AD57: 无权 | AE57: 无权 | AF57: 103.06 | AG57: 0.2 | AH57: AAA | AI57: 3.8100000000000002e-002 | AJ57: =H57+100*O57 -> 147.03 | AK57: 136.8 | AL57: 213 | AM57: 33.7 | AN57: 109 | AO57: -6.0000000000000001e-003 | AP57: 44 | AQ57: 中信转债!
A58: 276 | B58: 113532 | C58: 海环转债! | D58: 603817 | E58: 海峡环保 | F58: 城市公用 | G58: 三废处理 | H58: 100.55 | I58: -1.e-004 | J58: 1.e-003 | K58: 5.81 | L58: 3.4999999999999996e-003 | M58: 112.3 | N58: 7.63 | O58: 0.32000000000000001 | P58: 76.15 | Q58: 转股中 | R58: 3.81年 | S58: 1.81年 | T58: 4.59 | U58: 4 | V58: 9.0000000000000011e-003 | W58: 0.17499999999999999 | X58: 0.13400000000000001 | Y58: 26 | Z58: 1.47 | AA58: 2.9999999999999999e-002 | AB58: 2.3799999999999998e-002 | AC58: 1.1299999999999999e-002 | AD58: 8.5000000000000006e-003 | AE58: 94.64 | AF58: 95.92 | AG58: 0.26 | AH58: AA | AI58: 4.3099999999999999e-002 | AJ58: =H58+100*O58 -> 132.55000000000001 | AK58: 125 | AL58: 87 | AM58: 29 | AN58: 53 | AO58: -1.8000000000000002e-002 | AP58: 26 | AQ58: 海环转债!
A59: 189 | B59: 113033 | C59: 利群转债! | D59: 601366 | E59: 利群股份 | F59: 商业零售 | G59: 商场 | H59: 99.96 | I59: 0. | J59: -7.000000000000001e-004 | K59: 6.21 | L59: -1.6000000000000001e-003 | M59: 114.9 | N59: 7.01 | O59: 0.128 | P59: 88.59 | Q59: 转股中 | R59: 4.80年 | S59: 2.81年 | T59: 18 | U59: 7.3 | V59: 4.0000000000000001e-003 | W59: 0.33700000000000002 | X59: 0.29799999999999999 | Y59: 53 | Z59: 1.15 | AA59: 2.9999999999999999e-002 | AB59: 2.4199999999999999e-002 | AC59: 1.1599999999999999e-002 | AD59: 9.300000000000001e-003 | AE59: 91.31 | AF59: 94.18 | AG59: 0.45 | AH59: AA | AI59: 4.3099999999999999e-002 | AJ59: =H59+100*O59 -> 112.75999999999999 | AK59: 111.3 | AL59: 7 | AM59: 17.1 | AN59: 6 | AO59: -2.e-003 | AP59: 57 | AQ59: 利群转债!
A60: 188 | B60: 127016 | C60: 鲁泰转债! | D60: 726 | E60: 鲁 泰Ａ | F60: 服装纺织 | G60: 纺织行业 | H60: 100.8 | I60: 1.1000000000000001e-003 | J60: 0. | K60: 6.28 | L60: 4.7999999999999996e-003 | M60: 115.9 | N60: 8.76 | O60: 0.40600000000000003 | P60: 71.69 | Q60: 转股中 | R60: 4.82年 | S60: 2.83年 | T60: 14 | U60: 5.8 | V60: 4.0000000000000001e-003 | W60: 0.253 | X60: 0.18100000000000002 | Y60: 55 | Z60: 0.7 | AA60: 2.9900000000000003e-002 | AB60: 2.3799999999999998e-002 | AC60: 8.6e-003 | AD60: 6.4000000000000003e-003 | AE60: 92.01 | AF60: 96.21 | AG60: 0.22 | AH60: AA+ | AI60: 4.0099999999999997e-002 | AJ60: =H60+100*O60 -> 141.40000000000001 | AK60: 129.9 | AL60: 133 | AM60: 33.7 | AN60: 108 | AO60: 1.e-003 | AP60: 22 | AQ60: 鲁泰转债!
A61: 342 | B61: 123004 | C61: 铁汉转债! | D61: 300197 | E61: 节能铁汉 | F61: 城市公用 | G61: 生态环境 | H61: 101.193 | I61: 6.4000000000000003e-003 | J61: -2.9999999999999997e-004 | K61: 3.12 | L61: 2.63e-002 | M61: 108.8 | N61: 3.82 | O61: 0.23899999999999999 | P61: 81.68 | Q61: 转股中 | R61: 2.52年 | S61: 0.52年 | T61: 8.03 | U61: 26 | V61: 3.2000000000000001e-002 | W61: 9.0999999999999998e-002 | X61: 7.400000000000001e-002 | Y61: 88 | Z61: 1.34 | AA61: 2.9600000000000001e-002 | AB61: 2.2799999999999997e-002 | AC61: 5.1999999999999998e-003 | AD61: 7.000000000000001e-004 | AE61: 98.76 | AF61: 98.36 | AG61: 0.23 | AH61: AA | AI61: 4.1500000000000002e-002 | AJ61: =H61+100*O61 -> 125.09299999999999 | AK61: 120.7 | AL61: 39 | AM61: 22 | AN61: 19 | AO61: 3.6000000000000004e-002 | AP61: 45 | AQ61: 铁汉转债!
A62: 3 | B62: 113624 | C62: 正川转债 | D62: 603976 | E62: 正川股份 | F62: 医药 | G62: 医药行业 | H62: 102.8 | I62: -4.5000000000000005e-003 | J62: -6.6e-003 | K62: 39.26 | L62: -1.83e-002 | M62: 121.6 | N62: 46.69 | O62: 0.223 | P62: 84.09 | Q62: 5月0天 | R62: 5.88年 | S62: 3.88年 | T62: 4.05 | U62: 22 | V62: 5.2999999999999999e-002 | W62: 6.8000000000000005e-002 | X62: 5.7000000000000002e-002 | Y62: 59 | Z62: 5.63 | AA62: 2.9600000000000001e-002 | AB62: 2.3099999999999999e-002 | AC62: 4.4000000000000003e-003 | AD62: 2.0999999999999999e-003 | AE62: 77.99 | AF62: 79.76 | AG62: 0.61 | AH62: A+ | AI62: 7.6200000000000004e-002 | AJ62: =H62+100*O62 -> 125.09999999999999 | AK62: 121.5 | AL62: 51 | AM62: 41.8 | AN62: 186 | AO62: -0.127 | AP62: 5 | AQ62: 正川转债
A63: 56 | B63: 123087 | C63: 明电转债! | D63: 300739 | E63: 明阳电路 | F63: 电子 | G63: 元器件制 | H63: 103.6 | I63: -1.6200000000000003e-002 | J63: -6.5000000000000006e-003 | K63: 14.63 | L63: -4.0000000000000001e-002 | M63: 121.2 | N63: 16.32 | O63: 0.156 | P63: 89.64 | Q63: 10天 | R63: 5.51年 | S63: 4.51年 | T63: 6.73 | U63: 19 | V63: 2.7999999999999997e-002 | W63: 0.16500000000000001 | X63: 0.14800000000000002 | Y63: 41 | Z63: 2.89 | AA63: 2.9500000000000002e-002 | AB63: 2.2700000000000001e-002 | AC63: 6.4000000000000003e-003 | AD63: 3.7000000000000002e-003 | AE63: 79.83 | AF63: 86.24 | AG63: 0.57 | AH63: AA- | AI63: 6.5199999999999994e-002 | AJ63: =H63+100*O63 -> 119.19999999999999 | AK63: 117.6 | AL63: 22 | AM63: 31.3 | AN63: 80 | AO63: 5.0000000000000001e-003 | AP63: 14 | AQ63: 明电转债!
A64: 40 | B64: 113042 | C64: 上银转债! | D64: 601229 | E64: 上海银行 | F64: 金融 | G64: 银行行业 | H64: 103.21 | I64: 8.9999999999999998e-004 | J64: -7.4000000000000003e-003 | K64: 8.25 | L64: -2.2499999999999999e-002 | M64: 120.9 | N64: 11.03 | O64: 0.38 | P64: 74.8 | Q64: 48天 | R64: 5.62年 | S64: 无权 | T64: 200 | U64: 106 | V64: 5.0000000000000001e-003 | W64: 0.17100000000000001 | X64: 0.128 | Y64: 1172. | Z64: 0.67 | AA64: 2.9399999999999999e-002 | AB64: 2.2599999999999999e-002 | AC64: 无权 | AD64: 无权 | AE64: 无权 | AF64: 97.98 | AG64: 0.29 | AH64: AAA | AI64: 3.9199999999999999e-002 | AJ64: =H64+100*O64 -> 141.20999999999998 | AK64: 131.6 | AL64: 156 | AM64: 33.6 | AN64: 107 | AO64: -2.3e-002 | AP64: 12 | AQ64: 上银转债!
A65: 327 | B65: 128037 | C65: 岩土转债! | D65: 2542 | E65: 中化岩土 | F65: 建筑 | G65: 建筑工程 | H65: 102.95 | I65: -8.0000000000000004e-004 | J65: 8.0000000000000004e-004 | K65: 2.99 | L65: -6.6e-003 | M65: 111.3 | N65: 7.99 | O65: 1.75 | P65: 37.42 | Q65: 转股中 | R65: 2.76年 | S65: 0.76年 | T65: 5.99 | U65: 10 | V65: 1.7000000000000001e-002 | W65: 0.111 | X65: 4.2000000000000003e-002 | Y65: 54 | Z65: 1.36 | AA65: 2.9100000000000001e-002 | AB65: 2.1299999999999999e-002 | AC65: -1.21e-002 | AD65: -1.5900000000000001e-002 | AE65: 98.05 | AF65: 99.67 | AG65: 0 | AH65: AA | AI65: 4.1500000000000002e-002 | AJ65: =H65+100*O65 -> 277.94999999999999 | AK65: 168.5 | AL65: 324 | AM65: 68.8 | AN65: 315 | AO65: 1.6e-002 | AP65: 49 | AQ65: 岩土转债!
A66: 167 | B66: 113584 | C66: 家悦转债! | D66: 603708 | E66: 家家悦 | F66: 商业零售 | G66: 超市 | H66: 100 | I66: 1.5e-003 | J66: -2.7000000000000001e-003 | K66: 18.58 | L66: -2.6200000000000001e-002 | M66: 114.9 | N66: 37.97 | O66: 1.04 | P66: 48.93 | Q66: 转股中 | R66: 4.98年 | S66: 2.98年 | T66: 6.45 | U66: 3.8 | V66: 6.0000000000000001e-003 | W66: 5.7000000000000002e-002 | X66: 2.7999999999999997e-002 | Y66: 113 | Z66: 4.02 | AA66: 2.8799999999999999e-002 | AB66: 2.3199999999999998e-002 | AC66: 1.0800000000000001e-002 | AD66: 8.6e-003 | AE66: 90.63 | AF66: 93.48 | AG66: 0.05 | AH66: AA | AI66: 4.3099999999999999e-002 | AJ66: =H66+100*O66 -> 204. | AK66: 151.1 | AL66: 295 | AM66: 57.6 | AN66: 288 | AO66: -1.1000000000000001e-002 | AP66: 13 | AQ66: 家悦转债!
A67: 269 | B67: 127013 | C67: 创维转债! | D67: 810 | E67: 创维数字 | F67: 电子 | G67: 电子产品 | H67: 105.502 | I67: -7.0999999999999995e-003 | J67: 1.7000000000000001e-003 | K67: 8.88 | L67: -2.2000000000000002e-002 | M67: 117.3 | N67: 11.29 | O67: 0.34100000000000003 | P67: 78.65 | Q67: 转股中 | R67: 3.84年 | S67: 1.84年 | T67: 9.78 | U67: 6.5 | V67: 6.0000000000000001e-003 | W67: 0.10400000000000001 | X67: 8.1000000000000003e-002 | Y67: 94 | Z67: 2.24 | AA67: 2.8500000000000001e-002 | AB67: 2.0299999999999999e-002 | AC67: -1.29e-002 | AD67: -1.5600000000000001e-002 | AE67: 94.49 | AF67: 100.03 | AG67: 0.25 | AH67: AA | AI67: 4.3099999999999999e-002 | AJ67: =H67+100*O67 -> 139.602 | AK67: 132.4 | AL67: 166 | AM67: 32.3 | AN67: 91 | AO67: 3.7000000000000005e-002 | AP67: 23 | AQ67: 创维转债!
A68: 150 | B68: 113036 | C68: 宁建转债! | D68: 601789 | E68: 宁波建工 | F68: 建筑 | G68: 建筑工程 | H68: 102.06 | I68: 3.5999999999999999e-003 | J68: 9.4999999999999998e-003 | K68: 3.91 | L68: 3.7100000000000001e-002 | M68: 117.3 | N68: 4.86 | O68: 0.26899999999999996 | P68: 80.45 | Q68: 转股中 | R68: 5年24天 | S68: 3年25天 | T68: 5.4 | U68: 39 | V68: 7.0000000000000007e-002 | W68: 0.14099999999999999 | X68: 0.114 | Y68: 38 | Z68: 1.22 | AA68: 2.8500000000000001e-002 | AB68: 2.2200000000000001e-002 | AC68: 5.3e-003 | AD68: 3.0000000000000001e-003 | AE68: 90.4 | AF68: 94.66 | AG68: 0.35 | AH68: AA | AI68: 4.4199999999999996e-002 | AJ68: =H68+100*O68 -> 128.96000000000001 | AK68: 123.7 | AL68: 73 | AM68: 29 | AN68: 52 | AO68: 2.9999999999999999e-002 | AP68: 9 | AQ68: 宁建转债!
A69: 293 | B69: 128056 | C69: 今飞转债! | D69: 2863 | E69: 今飞凯达 | F69: 汽车 | G69: 零部件制 | H69: 108.545 | I69: 4.3e-003 | J69: -2.8999999999999998e-003 | K69: 5.17 | L69: 3.9000000000000003e-003 | M69: 120.2 | N69: 6.7 | O69: 0.40700000000000003 | P69: 77.16 | Q69: 转股中 | R69: 3.72年 | S69: 1.72年 | T69: 1.72 | U69: 7.9 | V69: 4.2000000000000003e-002 | W69: 6.7000000000000004e-002 | X69: 5.2000000000000005e-002 | Y69: 26 | Z69: 1.39 | AA69: 2.8399999999999998e-002 | AB69: 1.8700000000000001e-002 | AC69: -2.58e-002 | AD69: -2.92e-002 | AE69: 90.29 | AF69: 92.37 | AG69: 0.36 | AH69: A+ | AI69: 7.51e-002 | AJ69: =H69+100*O69 -> 149.245 | AK69: 139.9 | AL69: 236 | AM69: 47.6 | AN69: 229 | AO69: 1.e-002 | AP69: 53 | AQ69: 今飞转债!
A70: 127 | B70: 128125 | C70: 华阳转债! | D70: 2949 | E70: 华阳国际 | F70: 建筑 | G70: 建筑工程 | H70: 103.001 | I70: -1.9e-003 | J70: 0. | K70: 17.13 | L70: -5.7999999999999996e-003 | M70: 118.5 | N70: 25.39 | O70: 0.52700000000000002 | P70: 67.47 | Q70: 转股中 | R70: 5年48天 | S70: 3年49天 | T70: 4.5 | U70: 1.2 | V70: 3.0000000000000001e-003 | W70: 0.13400000000000001 | X70: 8.9999999999999997e-002 | Y70: 34 | Z70: 2.63 | AA70: 2.8300000000000002e-002 | AB70: 2.1700000000000001e-002 | AC70: 2.5000000000000001e-003 | AD70: 2.0000000000000001e-004 | AE70: 84.5 | AF70: 86.3 | AG70: 0.33 | AH70: AA- | AI70: 6.5199999999999994e-002 | AJ70: =H70+100*O70 -> 155.70100000000002 | AK70: 138.5 | AL70: 228 | AM70: 52.2 | AN70: 262 | AO70: -5.4000000000000006e-002 | AP70: 7 | AQ70: 华阳转债!
A71: 192 | B71: 110068 | C71: 龙净转债! | D71: 600388 | E71: 龙净环保 | F71: 城市公用 | G71: 三废处理 | H71: 100.91 | I71: 7.3000000000000001e-003 | J71: -2.3999999999999998e-003 | K71: 8.7 | L71: 1.3999999999999999e-002 | M71: 114.8 | N71: 10.73 | O71: 0.245 | P71: 81.08 | Q71: 转股中 | R71: 4.78年 | S71: 2.78年 | T71: 20 | U71: 15 | V71: 6.9999999999999993e-003 | W71: 0.215 | X71: 0.17399999999999999 | Y71: 93 | Z71: 1.53 | AA71: 2.7799999999999998e-002 | AB71: 2.2099999999999998e-002 | AC71: 8.0000000000000002e-003 | AD71: 5.7999999999999996e-003 | AE71: 92.07 | AF71: 95.45 | AG71: 0.35 | AH71: AA+ | AI71: 4.0099999999999997e-002 | AJ71: =H71+100*O71 -> 125.41 | AK71: 120.7 | AL71: 40 | AM71: 25.3 | AN71: 29 | AO71: 4.0000000000000001e-003 | AP71: 33 | AQ71: 龙净转债!
A72: 154 | B72: 113591 | C72: 胜达转债! | D72: 603687 | E72: XD大胜达 | F72: 造纸包装 | G72: 包装用纸 | H72: 106.8 | I72: -4.0999999999999995e-003 | J72: 9.1000000000000004e-003 | K72: 8.48 | L72: 8.3000000000000001e-003 | M72: 122.2 | N72: 8.76 | O72: 0.10300000000000001 | P72: 96.8 | Q72: 转股中 | R72: 5年19天 | S72: 3年20天 | T72: 5.5 | U72: 12 | V72: 2.1000000000000001e-002 | W72: 0.158 | X72: 0.153 | Y72: 35 | Z72: 2.02 | AA72: 2.7699999999999999e-002 | AB72: 1.9900000000000001e-002 | AC72: -7.9000000000000008e-003 | AD72: -1.04e-002 | AE72: 85.19 | AF72: 89.5 | AG72: 0.6 | AH72: AA- | AI72: 6.5199999999999994e-002 | AJ72: =H72+100*O72 -> 117.09999999999999 | AK72: 116.8 | AL72: 16 | AM72: 27.3 | AN72: 42 | AO72: 1.6e-002 | AP72: 27 | AQ72: 胜达转债!
A73: 101 | B73: 123069 | C73: 金诺转债! | D73: 300505 | E73: 川金诺 | F73: 化工 | G73: 农化 | H73: 109.17 | I73: 5.8700000000000002e-002 | J73: -1.3600000000000001e-002 | K73: 17.56 | L73: 8.4000000000000005e-002 | M73: 126 | N73: 19.15 | O73: 0.191 | P73: 91.7 | Q73: 转股中 | R73: 5.35年 | S73: 3.35年 | T73: 3.68 | U73: 1148. | V73: 2.8300000000000001 | W73: 0.16 | X73: 0.14699999999999999 | Y73: 23 | Z73: 2.42 | AA73: 2.7699999999999999e-002 | AB73: 1.9400000000000001e-002 | AC73: -1.41e-002 | AD73: -1.6200000000000003e-002 | AE73: 83.44 | AF73: 90.52 | AG73: 0.54 | AH73: AA- | AI73: 6.5199999999999994e-002 | AJ73: =H73+100*O73 -> 128.27000000000001 | AK73: 126.6 | AL73: 103 | AM73: 36.1 | AN73: 128 | AO73: 0.245 | AP73: 18 | AQ73: 金诺转债!
A74: 313 | B74: 128042 | C74: 凯中转债! | D74: 2823 | E74: 凯中精密 | F74: 能源电力 | G74: 电力设备 | H74: 106.999 | I74: 2.3e-003 | J74: -3.5999999999999999e-003 | K74: 10.16 | L74: -5.8999999999999999e-003 | M74: 116.3 | N74: 12.86 | O74: 0.35399999999999998 | P74: 79 | Q74: 转股中 | R74: 3年48天 | S74: 1年49天 | T74: 4.16 | U74: 1.2 | V74: 3.0000000000000001e-003 | W74: 0.14199999999999999 | X74: 0.113 | Y74: 29 | Z74: 2.15 | AA74: 2.76e-002 | AB74: 1.8000000000000002e-002 | AC74: -3.0600000000000002e-002 | AD74: -3.4700000000000002e-002 | AE74: 97.37 | AF74: 102.19 | AG74: 0.22 | AH74: AA | AI74: 4.3099999999999999e-002 | AJ74: =H74+100*O74 -> 142.399 | AK74: 135 | AL74: 195 | AM74: 32.8 | AN74: 97 | AO74: 3.0000000000000001e-003 | AP74: 26 | AQ74: 凯中转债!
A75: 61 | B75: 123084 | C75: 高澜转债! | D75: 300499 | E75: 高澜股份 | F75: 能源电力 | G75: 电力设备 | H75: 105.4 | I75: 4.5000000000000005e-003 | J75: -6.8000000000000005e-003 | K75: 8.07 | L75: -3.7000000000000002e-003 | M75: 121.9 | N75: 9 | O75: 0.17499999999999999 | P75: 89.67 | Q75: 5.1天 | R75: 5.50年 | S75: 3.50年 | T75: 2.8 | U75: 9.6 | V75: 3.3000000000000002e-002 | W75: 0.125 | X75: 0.11199999999999999 | Y75: 22 | Z75: 2.68 | AA75: 2.75e-002 | AB75: 2.0400000000000001e-002 | AC75: -1.5e-003 | AD75: -4.0000000000000001e-003 | AE75: 80.36 | AF75: 82.25 | AG75: 0.62 | AH75: A+ | AI75: 7.6200000000000004e-002 | AJ75: =H75+100*O75 -> 122.90000000000001 | AK75: 121.1 | AL75: 45 | AM75: 38.9 | AN75: 160 | AO75: 2.7000000000000003e-002 | AP75: 12 | AQ75: 高澜转债!
A76: 358 | B76: 128014 | C76: 永东转债! | D76: 2753 | E76: 永东股份 | F76: 化工 | G76: 化工 | H76: 104.5 | I76: 3.4000000000000002e-003 | J76: -4.0000000000000001e-003 | K76: 8.77 | L76: -1.24e-002 | M76: 109.8 | N76: 12.52 | O76: 0.49200000000000005 | P76: 70.05 | Q76: 转股中 | R76: 1.85年 | S76: 回售内 | T76: 3.37 | U76: 3.1 | V76: 9.0000000000000011e-003 | W76: 0.10199999999999999 | X76: 7.2000000000000008e-002 | Y76: 33 | Z76: 1.66 | AA76: 2.7400000000000001e-002 | AB76: 1.7299999999999999e-002 | AC76: 回售内 | AD76: 回售内 | AE76: 100.3 | AF76: 98.26 | AG76: 0.05 | AH76: AA- | AI76: 6.25e-002 | AJ76: =H76+100*O76 -> 153.69999999999999 | AK76: 139 | AL76: 231 | AM76: 38.7 | AN76: 156 | AO76: 1.3999999999999999e-002 | AP76: 37 | AQ76: 永东转债!
A77: 38 | B77: 123096 | C77: 思创转债! | D77: 300078 | E77: 思创医惠 | F77: 通信互联 | G77: 物联网 | H77: 106.999 | I77: 0. | J77: 5.1999999999999998e-003 | K77: 7.07 | L77: 1.e-002 | M77: 124 | N77: 8.27 | O77: 0.252 | P77: 85.49 | Q77: 52天 | R77: 5.62年 | S77: 3.63年 | T77: 8.17 | U77: 13 | V77: 1.4999999999999999e-002 | W77: 0.13300000000000001 | X77: 0.114 | Y77: 61 | Z77: 2.06 | AA77: 2.7099999999999999e-002 | AB77: 1.9699999999999999e-002 | AC77: -7.7000000000000002e-003 | AD77: -9.7000000000000003e-003 | AE77: 81.98 | AF77: 87.53 | AG77: 0.52 | AH77: AA- | AI77: 6.5199999999999994e-002 | AJ77: =H77+100*O77 -> 132.19899999999998 | AK77: 128.5 | AL77: 124 | AM77: 41 | AN77: 179 | AO77: 3.1e-002 | AP77: 5 | AQ77: 思创转债!
A78: 145 | B78: 123059 | C78: 银信转债! | D78: 300231 | E78: 银信科技 | F78: 计算机及 | G78: 软件开发 | H78: 108.776 | I78: -1.11e-002 | J78: 5.7999999999999996e-003 | K78: 8.41 | L78: -1.06e-002 | M78: 124.1 | N78: 9.72 | O78: 0.25700000000000001 | P78: 86.52 | Q78: 转股中 | R78: 5年33天 | S78: 3年34天 | T78: 3.91 | U78: 76 | V78: 0.17499999999999999 | W78: 0.105 | X78: 9.0999999999999998e-002 | Y78: 37 | Z78: 2.73 | AA78: 2.6800000000000001e-002 | AB78: 1.8600000000000002e-002 | AC78: -1.38e-002 | AD78: -1.61e-002 | AE78: 84.88 | AF78: 90.63 | AG78: 0.5 | AH78: AA- | AI78: 6.5199999999999994e-002 | AJ78: =H78+100*O78 -> 134.476 | AK78: 131 | AL78: 149 | AM78: 40.4 | AN78: 174 | AO78: 9.5000000000000001e-002 | AP78: 15 | AQ78: 银信转债!
A79: 129 | B79: 123063 | C79: 大禹转债 | D79: 300021 | E79: 大禹节水 | F79: 化工 | G79: 橡胶塑料 | H79: 110.799 | I79: 3.5999999999999999e-003 | J79: -6.0999999999999995e-003 | K79: 4.89 | L79: -4.0999999999999995e-003 | M79: 126.5 | N79: 4.84 | O79: 9.6999999999999989e-002 | P79: 101.03 | Q79: 转股中 | R79: 5年46天 | S79: 4年47天 | T79: 6.38 | U79: 4 | V79: 6.0000000000000001e-003 | W79: 0.16399999999999998 | X79: 0.16500000000000001 | Y79: 39 | Z79: 2.57 | AA79: 2.6800000000000001e-002 | AB79: 1.8000000000000002e-002 | AC79: -8.199999999999999e-003 | AD79: -1.1299999999999999e-002 | AE79: 82.02 | AF79: 92.2 | AG79: 0.6 | AH79: AA- | AI79: 6.5199999999999994e-002 | AJ79: =H79+100*O79 -> 120.49900000000001 | AK79: 120.6 | AL79: 37 | AM79: 28.4 | AN79: 46 | AO79: -2.6000000000000002e-002 | AP79: 17 | AQ79: 大禹转债
A80: 220 | B80: 123039 | C80: 开润转债! | D80: 300577 | E80: 开润股份 | F80: 服装纺织 | G80: 纺织行业 | H80: 107.71 | I80: -1.8e-003 | J80: -1.0500000000000001e-002 | K80: 21.45 | L80: -3.4200000000000001e-002 | M80: 121 | N80: 29.9 | O80: 0.501 | P80: 71.74 | Q80: 转股中 | R80: 4.54年 | S80: 2.54年 | T80: 2.22 | U80: 0.9 | V80: 4.0000000000000001e-003 | W80: 4.2999999999999997e-002 | X80: 3.1e-002 | Y80: 52 | Z80: 3.36 | AA80: 2.6600000000000002e-002 | AB80: 1.83e-002 | AC80: -1.2699999999999999e-002 | AD80: -1.5600000000000001e-002 | AE80: 85.75 | AF80: 87.79 | AG80: 0.36 | AH80: A+ | AI80: 7.51e-002 | AJ80: =H80+100*O80 -> 157.81 | AK80: 143.7 | AL80: 264 | AM80: 55.9 | AN80: 275 | AO80: -2.7999999999999997e-002 | AP80: 23 | AQ80: 开润转债!
A81: 70 | B81: 123080 | C81: 海波转债! | D81: 300517 | E81: 海波重科 | F81: 建筑 | G81: 建筑工程 | H81: 109.901 | I81: 2.7000000000000001e-003 | J81: 1.1000000000000001e-002 | K81: 12.07 | L81: 2.0299999999999999e-002 | M81: 126.5 | N81: 11.58 | O81: 5.4000000000000006e-002 | P81: 104.23 | Q81: 转股中 | R81: 5.47年 | S81: 3.48年 | T81: 2.45 | U81: 5.8 | V81: 2.1000000000000001e-002 | W81: 0.106 | X81: 0.11 | Y81: 23 | Z81: 1.55 | AA81: 2.6600000000000002e-002 | AB81: 1.84e-002 | AC81: -1.3500000000000002e-002 | AD81: -1.5900000000000001e-002 | AE81: 80.39 | AF81: 85.44 | AG81: 0.68 | AH81: A+ | AI81: 7.6200000000000004e-002 | AJ81: =H81+100*O81 -> 115.301 | AK81: 115.6 | AL81: 15 | AM81: 30.1 | AN81: 63 | AO81: -0.33500000000000002 | AP81: 19 | AQ81: 海波转债!
A82: 125 | B82: 113599 | C82: 嘉友转债! | D82: 603871 | E82: 嘉友国际 | F82: 交通运输 | G82: 物流业 | H82: 110.46 | I82: -4.8999999999999998e-003 | J82: 6.3e-003 | K82: 24.71 | L82: 2.3999999999999998e-003 | M82: 126 | N82: 24.82 | O82: 0.11 | P82: 99.56 | Q82: 转股中 | R82: 5年54天 | S82: 3年55天 | T82: 7.2 | U82: 13 | V82: 1.6e-002 | W82: 0.13300000000000001 | X82: 0.13200000000000001 | Y82: 54 | Z82: 2.53 | AA82: 2.64e-002 | AB82: 1.78e-002 | AC82: -1.84e-002 | AD82: -2.06e-002 | AE82: 84.48 | AF82: 91.65 | AG82: 0.59 | AH82: AA- | AI82: 6.5199999999999994e-002 | AJ82: =H82+100*O82 -> 121.45999999999999 | AK82: 121.4 | AL82: 49 | AM82: 29.7 | AN82: 61 | AO82: 2.9999999999999999e-002 | AP82: 20 | AQ82: 嘉友转债!
A83: 72 | B83: 113610 | C83: 灵康转债 | D83: 603669 | E83: 灵康药业 | F83: 医药 | G83: 化学制药 | H83: 105.33 | I83: -6.7000000000000002e-003 | J83: -7.000000000000001e-004 | K83: 8.05 | L83: -1.23e-002 | M83: 121.1 | N83: 8.61 | O83: 0.127 | P83: 93.5 | Q83: 转股中 | R83: 5.47年 | S83: 3.47年 | T83: 5.25 | U83: 15 | V83: 2.6000000000000002e-002 | W83: 9.0999999999999998e-002 | X83: 8.5000000000000006e-002 | Y83: 57 | Z83: 4.08 | AA83: 2.64e-002 | AB83: 1.95e-002 | AC83: -3.4999999999999996e-003 | AD83: -5.6000000000000008e-003 | AE83: 82.87 | AF83: 86.35 | AG83: 0.6 | AH83: AA- | AI83: 6.5199999999999994e-002 | AJ83: =H83+100*O83 -> 118.03 | AK83: 117.2 | AL83: 18 | AM83: 30.8 | AN83: 73 | AO83: -9.1999999999999998e-002 | AP83: 24 | AQ83: 灵康转债
A84: 155 | B84: 128116 | C84: 瑞达转债! | D84: 2961 | E84: 瑞达期货 | F84: 金融 | G84: 期货行业 | H84: 101.499 | I84: 5.5000000000000005e-003 | J84: 6.9999999999999993e-003 | K84: 22.58 | L84: 3.7200000000000004e-002 | M84: 115.3 | N84: 29.55 | O84: 0.32799999999999996 | P84: 76.41 | Q84: 转股中 | R84: 5年17天 | S84: 3年18天 | T84: 6.5 | U84: 12 | V84: 1.9e-002 | W84: 6.5000000000000002e-002 | X84: 4.9000000000000002e-002 | Y84: 100 | Z84: 5.12 | AA84: 2.6099999999999998e-002 | AB84: 2.0499999999999997e-002 | AC84: 6.8000000000000005e-003 | AD84: 4.5000000000000005e-003 | AE84: 90.39 | AF84: 93.12 | AG84: 0.34 | AH84: AA | AI84: 4.4199999999999996e-002 | AJ84: =H84+100*O84 -> 134.29899999999998 | AK84: 126.6 | AL84: 102 | AM84: 33.5 | AN84: 103 | AO84: 9.1999999999999998e-002 | AP84: 18 | AQ84: 瑞达转债!
A85: 102 | B85: 123068 | C85: 弘信转债 | D85: 300657 | E85: 弘信电子 | F85: 电子 | G85: 元器件制 | H85: 105.94 | I85: -9.7999999999999997e-003 | J85: -2.3999999999999998e-003 | K85: 15.99 | L85: -2.2599999999999999e-002 | M85: 121.2 | N85: 18.45 | O85: 0.222 | P85: 86.67 | Q85: 转股中 | R85: 5.34年 | S85: 3.35年 | T85: 5.7 | U85: 13 | V85: 2.1000000000000001e-002 | W85: 0.10400000000000001 | X85: 8.9999999999999997e-002 | Y85: 55 | Z85: 3.89 | AA85: 2.6099999999999998e-002 | AB85: 1.9e-002 | AC85: -5.0000000000000001e-003 | AD85: -7.1999999999999998e-003 | AE85: 83.63 | AF85: 87.15 | AG85: 0.54 | AH85: AA- | AI85: 6.5199999999999994e-002 | AJ85: =H85+100*O85 -> 128.13999999999999 | AK85: 125.2 | AL85: 91 | AM85: 38.1 | AN85: 146 | AO85: 0. | AP85: 8 | AQ85: 弘信转债
A86: 142 | B86: 113593 | C86: 沪工转债! | D86: 603131 | E86: 上海沪工 | F86: 机械装备 | G86: 通用设备 | H86: 107.14 | I86: -7.1999999999999998e-003 | J86: -1.1599999999999999e-002 | K86: 17.22 | L86: -3.5799999999999998e-002 | M86: 121.6 | N86: 21.12 | O86: 0.314 | P86: 81.53 | Q86: 转股中 | R86: 5年38天 | S86: 3年39天 | T86: 4 | U86: 6.2 | V86: 1.3999999999999999e-002 | W86: 7.2999999999999995e-002 | X86: 5.9999999999999998e-002 | Y86: 55 | Z86: 4.16 | AA86: 2.5699999999999997e-002 | AB86: 1.8200000000000001e-002 | AC86: -7.4000000000000003e-003 | AD86: -1.01e-002 | AE86: 82.51 | AF86: 84.38 | AG86: 0.53 | AH86: A+ | AI86: 7.6200000000000004e-002 | AJ86: =H86+100*O86 -> 138.53999999999999 | AK86: 132.7 | AL86: 171 | AM86: 48.4 | AN86: 234 | AO86: -4.7e-002 | AP86: 10 | AQ86: 沪工转债!
A87: 20 | B87: 123106 | C87: 正丹转债! | D87: 300641 | E87: 正丹股份 | F87: 化工 | G87: 化工 | H87: 108.762 | I87: -5.5000000000000005e-003 | J87: -8.3999999999999995e-003 | K87: 7.24 | L87: -2.29e-002 | M87: 125.5 | N87: 7.52 | O87: 0.13 | P87: 96.28 | Q87: 3月21天 | R87: 5.78年 | S87: 3.78年 | T87: 3.2 | U87: 22 | V87: 6.3e-002 | W87: 8.9999999999999997e-002 | X87: 8.6999999999999994e-002 | Y87: 35 | Z87: 2.54 | AA87: 2.5499999999999998e-002 | AB87: 1.8000000000000002e-002 | AC87: -1.18e-002 | AD87: -1.3600000000000001e-002 | AE87: 81.11 | AF87: 87.69 | AG87: 0.6 | AH87: AA- | AI87: 6.5199999999999994e-002 | AJ87: =H87+100*O87 -> 121.762 | AK87: 121.2 | AL87: 48 | AM87: 33.6 | AN87: 104 | AO87: 6.7000000000000004e-002 | AP87: 10 | AQ87: 正丹转债!
A88: 112 | B88: 123065 | C88: 宝莱转债! | D88: 300246 | E88: 宝莱特 | F88: 医药 | G88: 医疗器械 | H88: 106.79 | I88: 3.7000000000000002e-003 | J88: -3.0999999999999999e-003 | K88: 19.38 | L88: 6.1999999999999998e-003 | M88: 121.4 | N88: 40.54 | O88: 1.23 | P88: 47.8 | Q88: 转股中 | R88: 5.23年 | S88: 3.23年 | T88: 2.19 | U88: 16 | V88: 6.9000000000000006e-002 | W88: 7.6999999999999999e-002 | X88: 3.7000000000000005e-002 | Y88: 28 | Z88: 3.19 | AA88: 2.5399999999999999e-002 | AB88: 1.8100000000000002e-002 | AC88: -6.8999999999999999e-003 | AD88: -9.3999999999999986e-003 | AE88: 84.38 | AF88: 87.92 | AG88: 0.1 | AH88: AA- | AI88: 6.5199999999999994e-002 | AJ88: =H88+100*O88 -> 229.79000000000002 | AK88: 165.8 | AL88: 322 | AM88: 77.9 | AN88: 326 | AO88: 1.6e-002 | AP88: 17 | AQ88: 宝莱转债!
A89: 6 | B89: 127033 | C89: 中装转2 | D89: 2822 | E89: 中装建设 | F89: 建筑 | G89: 装饰工程 | H89: 101.55 | I89: 1.4000000000000002e-003 | J89: 4.0000000000000002e-004 | K89: 5.76 | L89: 3.4999999999999996e-003 | M89: 117.1 | N89: 6.33 | O89: 0.11599999999999999 | P89: 91 | Q89: 4月13天 | R89: 5.84年 | S89: 3.85年 | T89: 11.6 | U89: 26 | V89: 2.2000000000000002e-002 | W89: 0.27899999999999997 | X89: 0.254 | Y89: 42 | Z89: 1.23 | AA89: 2.5099999999999997e-002 | AB89: 1.9799999999999998e-002 | AC89: 5.0000000000000001e-003 | AD89: 3.3e-003 | AE89: 87.22 | AF89: 91.34 | AG89: 0.52 | AH89: AA | AI89: 4.4199999999999996e-002 | AJ89: =H89+100*O89 -> 113.14999999999999 | AK89: 112.1 | AL89: 9 | AM89: 20.8 | AN89: 14 | AO89: -8.0000000000000002e-003 | AP89: 17 | AQ89: 中装转2
A90: 165 | B90: 123053 | C90: 宝通转债! | D90: 300031 | E90: 宝通科技 | F90: 通信互联 | G90: 互联网 | H90: 107.301 | I90: -2.92e-002 | J90: -2.2000000000000001e-003 | K90: 16.68 | L90: -7.1300000000000002e-002 | M90: 120.8 | N90: 20.8 | O90: 0.33799999999999997 | P90: 80.19 | Q90: 转股中 | R90: 4.98年 | S90: 2.98年 | T90: 5 | U90: 23 | V90: 4.2999999999999997e-002 | W90: 7.5999999999999998e-002 | X90: 6.0999999999999999e-002 | Y90: 66 | Z90: 2.15 | AA90: 2.46e-002 | AB90: 1.72e-002 | AC90: -1.0800000000000001e-002 | AD90: -1.3100000000000001e-002 | AE90: 85.44 | AF90: 89.21 | AG90: 0.44 | AH90: AA- | AI90: 6.4100000000000004e-002 | AJ90: =H90+100*O90 -> 141.101 | AK90: 134.4 | AL90: 188 | AM90: 45.2 | AN90: 214 | AO90: -5.0999999999999997e-002 | AP90: 9 | AQ90: 宝通转债!
A91: 136 | B91: 113037 | C91: 紫银转债 | D91: 601860 | E91: 紫金银行 | F91: 金融 | G91: 银行行业 | H91: 102.58 | I91: 1.8e-003 | J91: -8.0000000000000004e-004 | K91: 3.86 | L91: 2.5999999999999999e-003 | M91: 115.8 | N91: 4.75 | O91: 0.26200000000000001 | P91: 81.26 | Q91: 转股中 | R91: 5年41天 | S91: 无权 | T91: 45 | U91: 40 | V91: 9.0000000000000011e-003 | W91: 0.318 | X91: 0.25900000000000001 | Y91: 141 | Z91: 0.96 | AA91: 2.4500000000000001e-002 | AB91: 1.8799999999999997e-002 | AC91: 无权 | AD91: 无权 | AE91: 无权 | AF91: 94.63 | AG91: 0.38 | AH91: AA+ | AI91: 4.1200000000000001e-002 | AJ91: =H91+100*O91 -> 128.78 | AK91: 123.9 | AL91: 78 | AM91: 29.3 | AN91: 56 | AO91: 5.0000000000000001e-003 | AP91: 19 | AQ91: 紫银转债
A92: 2 | B92: 127034 | C92: 绿茵转债 | D92: 2887 | E92: 绿茵生态 | F92: 城市公用 | G92: 生态环境 | H92: 103.78 | I92: 5.0000000000000001e-004 | J92: 1.e-004 | K92: 11.07 | L92: 8.9999999999999998e-004 | M92: 119 | N92: 12.38 | O92: 0.161 | P92: 89.42 | Q92: 5月3天 | R92: 5.88年 | S92: 3.89年 | T92: 7.12 | U92: 22 | V92: 2.8999999999999998e-002 | W92: 0.20600000000000002 | X92: 0.184 | Y92: 35 | Z92: 1.61 | AA92: 2.4e-002 | AB92: 1.8200000000000001e-002 | AC92: 2.9999999999999997e-004 | AD92: -1.5e-003 | AE92: 80.65 | AF92: 82.67 | AG92: 0.6 | AH92: AA- | AI92: 6.5199999999999994e-002 | AJ92: =H92+100*O92 -> 119.88 | AK92: 118.1 | AL92: 26 | AM92: 35.5 | AN92: 121 | AO92: -3.6000000000000004e-002 | AP92: 9 | AQ92: 绿茵转债
A93: 143 | B93: 128120 | C93: 联诚转债! | D93: 2921 | E93: 联诚精密 | F93: 汽车 | G93: 零部件制 | H93: 105.28 | I93: 4.5999999999999999e-003 | J93: -3.8e-003 | K93: 15.86 | L93: 1.2999999999999999e-003 | M93: 118.4 | N93: 18.44 | O93: 0.22399999999999998 | P93: 86.01 | Q93: 转股中 | R93: 5年35天 | S93: 3年36天 | T93: 2.6 | U93: 2.7 | V93: 1.e-002 | W93: 0.155 | X93: 0.13300000000000001 | Y93: 17 | Z93: 1.63 | AA93: 2.3900000000000001e-002 | AB93: 1.7299999999999999e-002 | AC93: -2.0999999999999999e-003 | AD93: -4.7999999999999996e-003 | AE93: 80.14 | AF93: 78.58 | AG93: 0.63 | AH93: A | AI93: 8.6199999999999999e-002 | AJ93: =H93+100*O93 -> 127.68000000000001 | AK93: 124.6 | AL93: 83 | AM93: 44.4 | AN93: 205 | AO93: -4.0000000000000001e-003 | AP93: 20 | AQ93: 联诚转债!
A94: 91 | B94: 123074 | C94: 隆利转债! | D94: 300752 | E94: 隆利科技 | F94: 电子 | G94: 液晶显示 | H94: 109.5 | I94: -6.3e-003 | J94: -1.37e-002 | K94: 15.91 | L94: -3.8100000000000002e-002 | M94: 124 | N94: 18.33 | O94: 0.26200000000000001 | P94: 86.8 | Q94: 转股中 | R94: 5.38年 | S94: 3.38年 | T94: 3.24 | U94: 19 | V94: 5.4000000000000006e-002 | W94: 0.106 | X94: 9.1999999999999998e-002 | Y94: 31 | Z94: 2.21 | AA94: 2.3900000000000001e-002 | AB94: 1.6200000000000003e-002 | AC94: -1.4800000000000001e-002 | AD94: -1.6799999999999999e-002 | AE94: 83.25 | AF94: 88.89 | AG94: 0.53 | AH94: AA- | AI94: 6.5199999999999994e-002 | AJ94: =H94+100*O94 -> 135.69999999999999 | AK94: 132.2 | AL94: 163 | AM94: 43.3 | AN94: 197 | AO94: -0.27899999999999997 | AP94: 14 | AQ94: 隆利转债!
A95: 229 | B95: 128083 | C95: 新北转债! | D95: 2376 | E95: 新北洋 | F95: 电子 | G95: 电子产品 | H95: 103.586 | I95: -2.3999999999999998e-003 | J95: 1.e-004 | K95: 9.17 | L95: -6.5000000000000006e-003 | M95: 114.9 | N95: 11.45 | O95: 0.29299999999999998 | P95: 80.09 | Q95: 转股中 | R95: 4.50年 | S95: 2.50年 | T95: 8.77 | U95: 2.3 | V95: 2.e-003 | W95: 0.14400000000000002 | X95: 0.115 | Y95: 61 | Z95: 1.76 | AA95: 2.3799999999999998e-002 | AB95: 1.7600000000000001e-002 | AC95: -7.000000000000001e-004 | AD95: -3.2000000000000002e-003 | AE95: 92.49 | AF95: 95.39 | AG95: 0.34 | AH95: AA | AI95: 4.3099999999999999e-002 | AJ95: =H95+100*O95 -> 132.886 | AK95: 127.1 | AL95: 111 | AM95: 31.7 | AN95: 84 | AO95: 2.e-003 | AP95: 19 | AQ95: 新北转债!
A96: 190 | B96: 113574 | C96: 华体转债! | D96: 603679 | E96: 华体科技 | F96: 城市公用 | G96: 城市公用 | H96: 103.78 | I96: 1.e-003 | J96: -3.4999999999999996e-003 | K96: 18.87 | L96: -1.67e-002 | M96: 115.9 | N96: 33.91 | O96: 0.86499999999999999 | P96: 55.65 | Q96: 转股中 | R96: 4.80年 | S96: 2.80年 | T96: 2.09 | U96: 2 | V96: 9.0000000000000011e-003 | W96: 7.8e-002 | X96: 4.2999999999999997e-002 | Y96: 27 | Z96: 3.47 | AA96: 2.3799999999999998e-002 | AB96: 1.77e-002 | AC96: 1.e-003 | AD96: -1.7000000000000001e-003 | AE96: 84.12 | AF96: 82.54 | AG96: 0.16 | AH96: A+ | AI96: 7.51e-002 | AJ96: =H96+100*O96 -> 190.28 | AK96: 151.9 | AL96: 296 | AM96: 67.8 | AN96: 312 | AO96: -1.e-003 | AP96: 18 | AQ96: 华体转债!
A97: 59 | B97: 123085 | C97: 万顺转2! | D97: 300057 | E97: 万顺新材 | F97: 有色金属 | G97: 铝金属 | H97: 99.827 | I97: 1.e-004 | J97: -4.3e-003 | K97: 5.06 | L97: -7.8000000000000005e-003 | M97: 113.3 | N97: 6.2 | O97: 0.223 | P97: 81.61 | Q97: 6.1天 | R97: 5.50年 | S97: 3.50年 | T97: 9 | U97: 14 | V97: 1.6e-002 | W97: 0.26400000000000001 | X97: 0.215 | Y97: 34 | Z97: 0.96 | AA97: 2.3799999999999998e-002 | AB97: 1.9199999999999998e-002 | AC97: 1.0800000000000001e-002 | AD97: 8.8000000000000005e-003 | AE97: 82.54 | AF97: 80.64 | AG97: 0.54 | AH97: AA- | AI97: 6.5199999999999994e-002 | AJ97: =H97+100*O97 -> 122.127 | AK97: 118 | AL97: 25 | AM97: 35.5 | AN97: 122 | AO97: 4.5999999999999999e-002 | AP97: 24 | AQ97: 万顺转2!
A98: 311 | B98: 113516 | C98: 苏农转债! | D98: 603323 | E98: 苏农银行 | F98: 金融 | G98: 银行行业 | H98: 106.39 | I98: 5.9999999999999995e-004 | J98: -1.1999999999999999e-003 | K98: 4.36 | L98: -2.3e-003 | M98: 114.3 | N98: 5.37 | O98: 0.31 | P98: 81.19 | Q98: 转股中 | R98: 3年51天 | S98: 无权 | T98: 12.9 | U98: 0.9 | V98: 1.e-003 | W98: 0.16399999999999998 | X98: 0.13300000000000001 | Y98: 79 | Z98: 0.64 | AA98: 2.3599999999999999e-002 | AB98: 1.5100000000000001e-002 | AC98: 无权 | AD98: 无权 | AE98: 无权 | AF98: 101.3 | AG98: 0.26 | AH98: AA+ | AI98: 4.0099999999999997e-002 | AJ98: =H98+100*O98 -> 137.38999999999999 | AK98: 131.6 | AL98: 154 | AM98: 30.3 | AN98: 65 | AO98: -3.6000000000000004e-002 | AP98: 29 | AQ98: 苏农转债!
A99: 62 | B99: 127027 | C99: 靖远转债! | D99: 552 | E99: 靖远煤电 | F99: 煤炭 | G99: 煤炭开采 | H99: 101.7 | I99: 4.7999999999999996e-003 | J99: -3.0999999999999999e-003 | K99: 3.07 | L99: 3.3e-003 | M99: 115.3 | N99: 3.23 | O99: 7.0000000000000007e-002 | P99: 95.05 | Q99: 5.1天 | R99: 5.50年 | S99: 3.50年 | T99: 28 | U99: 54 | V99: 1.9e-002 | W99: 0.39899999999999997 | X99: 0.379 | Y99: 70 | Z99: 0.88 | AA99: 2.3599999999999999e-002 | AB99: 1.84e-002 | AC99: 5.6999999999999993e-003 | AD99: 3.5999999999999999e-003 | AE99: 89.66 | AF99: 92.76 | AG99: 0.53 | AH99: AA+ | AI99: 4.1200000000000001e-002 | AJ99: =H99+100*O99 -> 108.7 | AK99: 108.4 | AL99: 2 | AM99: 15.6 | AN99: 5 | AO99: 1.6e-002 | AP99: 38 | AQ99: 靖远转债!
A100: 111 | B100: 128131 | C100: 崇达转2! | D100: 2815 | E100: 崇达技术 | F100: 电子 | G100: 元器件制 | H100: 102.31 | I100: 3.0000000000000001e-003 | J100: -3.9000000000000003e-003 | K100: 12.07 | L100: -4.8999999999999998e-003 | M100: 115.2 | N100: 19.38 | O100: 0.64300000000000002 | P100: 62.28 | Q100: 转股中 | R100: 5.24年 | S100: 3.24年 | T100: 14 | U100: 1 | V100: 1.e-003 | W100: 0.13200000000000001 | X100: 8.199999999999999e-002 | Y100: 106 | Z100: 2.53 | AA100: 2.3399999999999997e-002 | AB100: 1.8000000000000002e-002 | AC100: 4.0000000000000001e-003 | AD100: 1.9e-003 | AE100: 89.63 | AF100: 92.26 | AG100: 0.17 | AH100: AA | AI100: 4.4199999999999996e-002 | AJ100: =H100+100*O100 -> 166.61000000000001 | AK100: 142.3 | AL100: 257 | AM100: 50.1 | AN100: 243 | AO100: 2.7999999999999997e-002 | AP100: 9 | AQ100: 崇达转2!
A101: 246 | B101: 128076 | C101: 金轮转债! | D101: 2722 | E101: 金轮股份 | F101: 机械装备 | G101: 专用设备 | H101: 104.205 | I101: -1.8e-003 | J101: -3.4999999999999996e-003 | K101: 11.95 | L101: -1.1599999999999999e-002 | M101: 114.9 | N101: 14.66 | O101: 0.27800000000000002 | P101: 81.51 | Q101: 转股中 | R101: 4.34年 | S101: 2.34年 | T101: 2.14 | U101: 3.5 | V101: 1.6e-002 | W101: 0.10199999999999999 | X101: 8.3000000000000004e-002 | Y101: 21 | Z101: 1.11 | AA101: 2.3199999999999998e-002 | AB101: 1.6899999999999998e-002 | AC101: -3.0999999999999999e-003 | AD101: -5.7999999999999996e-003 | AE101: 88.63 | AF101: 88.26 | AG101: 0.45 | AH101: AA- | AI101: 6.4100000000000004e-002 | AJ101: =H101+100*O101 -> 132.005 | AK101: 126.9 | AL101: 109 | AM101: 38.3 | AN101: 149 | AO101: -6.9999999999999993e-003 | AP101: 41 | AQ101: 金轮转债!
A102: 268 | B102: 110058 | C102: 永鼎转债! | D102: 600105 | E102: 永鼎股份 | F102: 通信互联 | G102: 通信设备 | H102: 104.87 | I102: -1.84e-002 | J102: -2.0000000000000001e-004 | K102: 4.02 | L102: -6.2899999999999998e-002 | M102: 114.3 | N102: 5.04 | O102: 0.315 | P102: 79.76 | Q102: 转股中 | R102: 3.84年 | S102: 1.85年 | T102: 2.61 | U102: 170 | V102: 0.61299999999999999 | W102: 4.7e-002 | X102: 3.7999999999999999e-002 | Y102: 56 | Z102: 1.99 | AA102: 2.3099999999999999e-002 | AB102: 1.6200000000000003e-002 | AC102: -9.8999999999999991e-003 | AD102: -1.26e-002 | AE102: 94.48 | AF102: 97.47 | AG102: 0.3 | AH102: AA | AI102: 4.3099999999999999e-002 | AJ102: =H102+100*O102 -> 136.37 | AK102: 130 | AL102: 134 | AM102: 32.5 | AN102: 93 | AO102: 0.12 | AP102: 47 | AQ102: 永鼎转债!
A103: 284 | B103: 110056 | C103: 亨通转债! | D103: 600487 | E103: 亨通光电 | F103: 通信互联 | G103: 通信设备 | H103: 105.11 | I103: -7.6e-003 | J103: -4.1999999999999997e-003 | K103: 11.52 | L103: -5.1100000000000007e-002 | M103: 114.3 | N103: 15.01 | O103: 0.37 | P103: 76.75 | Q103: 转股中 | R103: 3.77年 | S103: 1.77年 | T103: 17.1 | U103: 5.9 | V103: 3.0000000000000001e-003 | W103: 6.3e-002 | X103: 4.8000000000000001e-002 | Y103: 272 | Z103: 1.35 | AA103: 2.29e-002 | AB103: 1.5900000000000001e-002 | AC103: -1.15e-002 | AD103: -1.43e-002 | AE103: 95.32 | AF103: 98.83 | AG103: 0.23 | AH103: AA+ | AI103: 4.0099999999999997e-002 | AJ103: =H103+100*O103 -> 142.11000000000001 | AK103: 133.5 | AL103: 181 | AM103: 34.6 | AN103: 115 | AO103: -2.9999999999999999e-002 | AP103: 28 | AQ103: 亨通转债!
A104: 234 | B104: 113549 | C104: 白电转债 | D104: 603861 | E104: 白云电器 | F104: 能源电力 | G104: 电力设备 | H104: 104.04 | I104: 0. | J104: -4.5000000000000005e-003 | K104: 8.05 | L104: -9.7999999999999997e-003 | M104: 114.8 | N104: 8.88 | O104: 0.14800000000000002 | P104: 90.65 | Q104: 转股中 | R104: 4.43年 | S104: 2.43年 | T104: 8.8 | U104: 5.8 | V104: 6.0000000000000001e-003 | W104: 0.247 | X104: 0.22399999999999998 | Y104: 36 | Z104: 1.38 | AA104: 2.29e-002 | AB104: 1.67e-002 | AC104: -2.8000000000000004e-003 | AD104: -5.1999999999999998e-003 | AE104: 92.68 | AF104: 95.59 | AG104: 0.46 | AH104: AA | AI104: 4.3099999999999999e-002 | AJ104: =H104+100*O104 -> 118.84 | AK104: 117.4 | AL104: 19 | AM104: 21.8 | AN104: 17 | AO104: 8.0000000000000002e-003 | AP104: 40 | AQ104: 白电转债
A105: 133 | B105: 128123 | C105: 国光转债! | D105: 2749 | E105: 国光股份 | F105: 化工 | G105: 农化 | H105: 103.902 | I105: -1.8e-003 | J105: -2.5999999999999999e-003 | K105: 9.63 | L105: -1.1299999999999999e-002 | M105: 116.2 | N105: 13.48 | O105: 0.45399999999999996 | P105: 71.44 | Q105: 转股中 | R105: 5年45天 | S105: 3年46天 | T105: 3.2 | U105: 1.4 | V105: 4.0000000000000001e-003 | W105: 7.5999999999999998e-002 | X105: 5.4000000000000006e-002 | Y105: 42 | Z105: 3.37 | AA105: 2.2599999999999999e-002 | AB105: 1.6799999999999999e-002 | AC105: 7.000000000000001e-004 | AD105: -1.8e-003 | AE105: 84.81 | AF105: 84.76 | AG105: 0.39 | AH105: AA- | AI105: 6.5199999999999994e-002 | AJ105: =H105+100*O105 -> 149.30199999999999 | AK105: 136.4 | AL105: 208 | AM105: 51.6 | AN105: 255 | AO105: -2.8999999999999998e-002 | AP105: 11 | AQ105: 国光转债!
A106: 81 | B106: 113608 | C106: 威派转债! | D106: 603956 | E106: 威派格 | F106: 机械装备 | G106: 专用设备 | H106: 108.09 | I106: 8.0000000000000004e-004 | J106: 4.1999999999999997e-003 | K106: 17.04 | L106: 8.3000000000000001e-003 | M106: 121.6 | N106: 19.08 | O106: 0.20999999999999999 | P106: 89.31 | Q106: 转股中 | R106: 5.41年 | S106: 3.41年 | T106: 4.2 | U106: 2.7 | V106: 6.0000000000000001e-003 | W106: 5.7999999999999996e-002 | X106: 5.2000000000000005e-002 | Y106: 73 | Z106: 6.27 | AA106: 2.2499999999999999e-002 | AB106: 1.55e-002 | AC106: -9.1999999999999998e-003 | AD106: -1.1699999999999999e-002 | AE106: 80.7 | AF106: 82.53 | AG106: 0.61 | AH106: A+ | AI106: 7.6200000000000004e-002 | AJ106: =H106+100*O106 -> 129.09 | AK106: 126.9 | AL106: 108 | AM106: 44.3 | AN106: 204 | AO106: 3.3000000000000002e-002 | AP106: 7 | AQ106: 威派转债!
A107: 42 | B107: 113619 | C107: 世运转债! | D107: 603920 | E107: 世运电路 | F107: 电子 | G107: 元器件制 | H107: 101.9 | I107: -1.e-003 | J107: -1.4000000000000002e-003 | K107: 16.63 | L107: -1.1899999999999999e-002 | M107: 115.2 | N107: 26.5 | O107: 0.624 | P107: 62.75 | Q107: 45天 | R107: 5.61年 | S107: 3.61年 | T107: 10 | U107: 1.5 | V107: 1.e-003 | W107: 0.14699999999999999 | X107: 9.1999999999999998e-002 | Y107: 68 | Z107: 2.5 | AA107: 2.2499999999999999e-002 | AB107: 1.7500000000000002e-002 | AC107: 4.6999999999999993e-003 | AD107: 2.8000000000000004e-003 | AE107: 88.2 | AF107: 90.8 | AG107: 0.2 | AH107: AA | AI107: 4.4199999999999996e-002 | AJ107: =H107+100*O107 -> 164.30000000000001 | AK107: 141 | AL107: 245 | AM107: 50.2 | AN107: 245 | AO107: 3.9e-002 | AP107: 5 | AQ107: 世运转债!
A108: 10 | B108: 123112 | C108: 万讯转债 | D108: 300112 | E108: 万讯自控 | F108: 机械装备 | G108: 专用设备 | H108: 109.7 | I108: 3.4999999999999996e-003 | J108: -7.8000000000000005e-003 | K108: 8.54 | L108: -6.9999999999999993e-003 | M108: 124.4 | N108: 8.93 | O108: 0.14699999999999999 | P108: 95.63 | Q108: 4月5天 | R108: 5.82年 | S108: 3.82年 | T108: 2.46 | U108: 8.9 | V108: 3.3000000000000002e-002 | W108: 0.10099999999999999 | X108: 9.6000000000000002e-002 | Y108: 24 | Z108: 2.28 | AA108: 2.23e-002 | AB108: 1.5100000000000001e-002 | AC108: -1.26e-002 | AD108: -1.47e-002 | AE108: 81.29 | AF108: 86.78 | AG108: 0.61 | AH108: AA- | AI108: 6.5199999999999994e-002 | AJ108: =H108+100*O108 -> 124.40000000000001 | AK108: 123.8 | AL108: 76 | AM108: 37 | AN108: 139 | AO108: 2.5000000000000001e-002 | AP108: 9 | AQ108: 万讯转债
A109: 345 | B109: 128023 | C109: 亚太转债! | D109: 2284 | E109: 亚太股份 | F109: 汽车 | G109: 零部件制 | H109: 105.5 | I109: -8.5000000000000006e-003 | J109: 6.6e-003 | K109: 7.88 | L109: -1.1299999999999999e-002 | M109: 111.3 | N109: 10.34 | O109: 0.38400000000000001 | P109: 76.21 | Q109: 转股中 | R109: 2.48年 | S109: 0.48年 | T109: 9.99 | U109: 108 | V109: 0.10099999999999999 | W109: 0.17199999999999999 | X109: 0.13100000000000001 | Y109: 58 | Z109: 2.33 | AA109: 2.2200000000000001e-002 | AB109: 1.3600000000000001e-002 | AC109: -5.3699999999999998e-002 | AD109: -5.8899999999999994e-002 | AE109: 99.16 | AF109: 100.8 | AG109: 0.16 | AH109: AA | AI109: 4.1500000000000002e-002 | AJ109: =H109+100*O109 -> 143.90000000000001 | AK109: 134.8 | AL109: 191 | AM109: 34 | AN109: 111 | AO109: 7.6999999999999999e-002 | AP109: 68 | AQ109: 亚太转债!
A110: 346 | B110: 128022 | C110: 众信转债! | D110: 2707 | E110: 众信旅游 | F110: 旅游餐饮 | G110: 旅游 | H110: 103.24 | I110: -5.9999999999999995e-004 | J110: -1.9e-003 | K110: 5.8 | L110: -2.3599999999999999e-002 | M110: 108.8 | N110: 7.92 | O110: 0.40999999999999998 | P110: 73.23 | Q110: 转股中 | R110: 2.47年 | S110: 0.47年 | T110: 4.56 | U110: 3.4 | V110: 6.9999999999999993e-003 | W110: 8.6999999999999994e-002 | X110: 6.4000000000000001e-002 | Y110: 53 | Z110: 7.87 | AA110: 2.18e-002 | AB110: 1.49e-002 | AC110: -2.5499999999999998e-002 | AD110: -3.0200000000000001e-002 | AE110: 97.69 | AF110: 93.87 | AG110: 0.11 | AH110: AA- | AI110: 6.25e-002 | AJ110: =H110+100*O110 -> 144.24000000000001 | AK110: 133.2 | AL110: 180 | AM110: 35.6 | AN110: 123 | AO110: 2.3e-002 | AP110: 30 | AQ110: 众信转债!
A111: 205 | B111: 113567 | C111: 君禾转债! | D111: 603617 | E111: 君禾股份 | F111: 机械装备 | G111: 通用设备 | H111: 107.56 | I111: 3.3e-003 | J111: -2.7000000000000001e-003 | K111: 9.85 | L111: 1.e-003 | M111: 118.8 | N111: 11.16 | O111: 0.21899999999999997 | P111: 88.26 | Q111: 转股中 | R111: 4.73年 | S111: 2.73年 | T111: 2.1 | U111: 1.5 | V111: 6.0000000000000001e-003 | W111: 0.107 | X111: 9.4e-002 | Y111: 20 | Z111: 2.78 | AA111: 2.1700000000000001e-002 | AB111: 1.46e-002 | AC111: -1.18e-002 | AD111: -1.44e-002 | AE111: 84.5 | AF111: 85.05 | AG111: 0.57 | AH111: A+ | AI111: 7.51e-002 | AJ111: =H111+100*O111 -> 129.46000000000001 | AK111: 126.9 | AL111: 107 | AM111: 41.8 | AN111: 188 | AO111: -1.4999999999999999e-002 | AP111: 34 | AQ111: 君禾转债!
A112: 226 | B112: 128087 | C112: 孚日转债! | D112: 2083 | E112: 孚日股份 | F112: 服装纺织 | G112: 家纺 | H112: 102.797 | I112: 3.0999999999999999e-003 | J112: -3.0999999999999999e-003 | K112: 4.23 | L112: 0. | M112: 112.9 | N112: 4.5 | O112: 9.4e-002 | P112: 94 | Q112: 转股中 | R112: 4.52年 | S112: 2.52年 | T112: 6.5 | U112: 9.7 | V112: 1.3999999999999999e-002 | W112: 0.16899999999999998 | X112: 0.159 | Y112: 38 | Z112: 1.06 | AA112: 2.1400000000000002e-002 | AB112: 1.6e-002 | AC112: 2.2000000000000001e-003 | AD112: -2.9999999999999997e-004 | AE112: 92.43 | AF112: 93.68 | AG112: 0.52 | AH112: AA | AI112: 4.3099999999999999e-002 | AJ112: =H112+100*O112 -> 112.197 | AK112: 111.6 | AL112: 8 | AM112: 17.9 | AN112: 7 | AO112: 8.0000000000000002e-003 | AP112: 63 | AQ112: 孚日转债!
A113: 124 | B113: 127021 | C113: 特发转2! | D113: 70 | E113: 特发信息 | F113: 通信互联 | G113: 通信设备 | H113: 103.9 | I113: 2.8999999999999998e-003 | J113: -5.1999999999999998e-003 | K113: 7.63 | L113: -1.9299999999999998e-002 | M113: 113.3 | N113: 12.33 | O113: 0.67900000000000005 | P113: 61.88 | Q113: 转股中 | R113: 4年56天 | S113: 2年57天 | T113: 5.5 | U113: 6.3 | V113: 1.1000000000000001e-002 | W113: 8.6999999999999994e-002 | X113: 5.4000000000000006e-002 | Y113: 63 | Z113: 2.15 | AA113: 2.1299999999999999e-002 | AB113: 1.54e-002 | AC113: -7.8000000000000005e-003 | AD113: -9.4999999999999998e-003 | AE113: 92.58 | AF113: 95.31 | AG113: 0.12 | AH113: AA | AI113: 4.3099999999999999e-002 | AJ113: =H113+100*O113 -> 171.80000000000001 | AK113: 145.9 | AL113: 276 | AM113: 50.6 | AN113: 247 | AO113: 2.2000000000000002e-002 | AP113: 11 | AQ113: 特发转2!
A114: 60 | B114: 123086 | C114: 海兰转债! | D114: 300065 | E114: 海兰信 | F114: 电子 | G114: 电子产品 | H114: 110.248 | I114: 0. | J114: 1.7000000000000001e-003 | K114: 11.09 | L114: 2.7000000000000001e-003 | M114: 123.5 | N114: 10.88 | O114: 8.199999999999999e-002 | P114: 101.93 | Q114: 6.1天 | R114: 5.50年 | S114: 3.50年 | T114: 7.3 | U114: 24 | V114: 2.9999999999999999e-002 | W114: 0.16500000000000001 | X114: 0.16899999999999998 | Y114: 44 | Z114: 2.97 | AA114: 2.1299999999999999e-002 | AB114: 1.3899999999999999e-002 | AC114: -1.6399999999999998e-002 | AD114: -1.83e-002 | AE114: 82.56 | AF114: 87.86 | AG114: 0.64 | AH114: AA- | AI114: 6.5199999999999994e-002 | AJ114: =H114+100*O114 -> 118.44800000000001 | AK114: 118.6 | AL114: 29 | AM114: 30.7 | AN114: 71 | AO114: 5.5e-002 | AP114: 16 | AQ114: 海兰转债!
A115: 126 | B115: 113598 | C115: 法兰转债 | D115: 603966 | E115: 法兰泰克 | F115: 机械装备 | G115: 工程机械 | H115: 109.12 | I115: 5.3e-003 | J115: -1.4000000000000002e-003 | K115: 12.48 | L115: 7.3000000000000001e-003 | M115: 121.2 | N115: 13.88 | O115: 0.214 | P115: 89.91 | Q115: 转股中 | R115: 5年49天 | S115: 3年50天 | T115: 2.75 | U115: 11 | V115: 3.6000000000000004e-002 | W115: 0.10300000000000001 | X115: 9.1999999999999998e-002 | Y115: 27 | Z115: 2.3 | AA115: 2.1099999999999997e-002 | AB115: 1.3899999999999999e-002 | AC115: -1.43e-002 | AD115: -1.66e-002 | AE115: 84.74 | AF115: 88.31 | AG115: 0.55 | AH115: AA- | AI115: 6.5199999999999994e-002 | AJ115: =H115+100*O115 -> 130.52000000000001 | AK115: 128.3 | AL115: 121 | AM115: 40 | AN115: 172 | AO115: -3.7999999999999999e-002 | AP115: 11 | AQ115: 法兰转债
A116: 23 | B116: 113046 | C116: 金田转债 | D116: 601609 | E116: 金田铜业 | F116: 有色金属 | G116: 铜金属 | H116: 102.08 | I116: 8.0000000000000004e-004 | J116: 1.e-004 | K116: 9.05 | L116: 2.2000000000000001e-003 | M116: 114.9 | N116: 10.95 | O116: 0.23499999999999999 | P116: 82.65 | Q116: 3月18天 | R116: 5.78年 | S116: 3.78年 | T116: 15 | U116: 11 | V116: 6.9999999999999993e-003 | W116: 0.11199999999999999 | X116: 9.3000000000000013e-002 | Y116: 134 | Z116: 1.93 | AA116: 2.1000000000000001e-002 | AB116: 1.6299999999999999e-002 | AC116: 3.3e-003 | AD116: 1.6000000000000001e-003 | AE116: 88.29 | AF116: 91.36 | AG116: 0.42 | AH116: AA+ | AI116: 4.1200000000000001e-002 | AJ116: =H116+100*O116 -> 125.58 | AK116: 121.5 | AL116: 50 | AM116: 30.2 | AN116: 64 | AO116: -1.3000000000000001e-002 | AP116: 10 | AQ116: 金田转债
A117: 320 | B117: 127007 | C117: 湖广转债! | D117: 665 | E117: 湖北广电 | F117: 传媒娱乐 | G117: 影视娱乐 | H117: 105.8 | I117: 4.2500000000000003e-002 | J117: -1.6200000000000003e-002 | K117: 4.52 | L117: 9.98e-002 | M117: 112.3 | N117: 5.58 | O117: 0.30599999999999999 | P117: 81 | Q117: 转股中 | R117: 3年16天 | S117: 1年17天 | T117: 12.2 | U117: 123 | V117: 9.6000000000000002e-002 | W117: 0.27399999999999997 | X117: 0.222 | Y117: 44 | Z117: 0.76 | AA117: 2.0199999999999999e-002 | AB117: 1.26e-002 | AC117: -2.3700000000000002e-002 | AD117: -2.81e-002 | AE117: 98.07 | AF117: 99.91 | AG117: 0.26 | AH117: AA+ | AI117: 4.0099999999999997e-002 | AJ117: =H117+100*O117 -> 136.40000000000001 | AK117: 130.6 | AL117: 146 | AM117: 30.7 | AN117: 70 | AO117: 0.11199999999999999 | AP117: 17 | AQ117: 湖广转债!
A118: 186 | B118: 128105 | C118: 长集转债! | D118: 2616. | E118: 长青集团 | F118: 城市公用 | G118: 三废处理 | H118: 104.6 | I118: -1.2699999999999999e-002 | J118: 3.8e-003 | K118: 6.98 | L118: -1.9699999999999999e-002 | M118: 114.9 | N118: 7.91 | O118: 0.185 | P118: 88.24 | Q118: 转股中 | R118: 4.82年 | S118: 2.83年 | T118: 8 | U118: 96 | V118: 0.114 | W118: 0.154 | X118: 0.13600000000000001 | Y118: 52 | Z118: 1.94 | AA118: 2.e-002 | AB118: 1.43e-002 | AC118: -3.9000000000000003e-003 | AD118: -6.0999999999999995e-003 | AE118: 91.23 | AF118: 94.1 | AG118: 0.45 | AH118: AA | AI118: 4.3099999999999999e-002 | AJ118: =H118+100*O118 -> 123.09999999999999 | AK118: 121 | AL118: 43 | AM118: 26.9 | AN118: 38 | AO118: 5.0999999999999997e-002 | AP118: 16 | AQ118: 长集转债!
A119: 137 | B119: 123061 | C119: 航新转债! | D119: 300424 | E119: 航新科技 | F119: 航空航天 | G119: 航空航天 | H119: 113.111 | I119: -1.9e-002 | J119: -9.7999999999999997e-003 | K119: 14.6 | L119: -4.5100000000000001e-002 | M119: 124.8 | N119: 14.86 | O119: 0.151 | P119: 98.25 | Q119: 转股中 | R119: 5年40天 | S119: 3年41天 | T119: 2.5 | U119: 150 | V119: 0.52400000000000002 | W119: 7.0999999999999994e-002 | X119: 7.0000000000000007e-002 | Y119: 35 | Z119: 5.25 | AA119: 1.9900000000000001e-002 | AB119: 1.1599999999999999e-002 | AC119: -2.35e-002 | AD119: -2.6200000000000001e-002 | AE119: 82.61 | AF119: 86.61 | AG119: 0.64 | AH119: A+ | AI119: 7.6200000000000004e-002 | AJ119: =H119+100*O119 -> 128.21100000000001 | AK119: 128 | AL119: 116 | AM119: 41.4 | AN119: 184 | AO119: 6.0000000000000001e-003 | AP119: 16 | AQ119: 航新转债!
A120: 201 | B120: 113570 | C120: 百达转债! | D120: 603331 | E120: 百达精工 | F120: 机械装备 | G120: 机械装备 | H120: 104.99 | I120: 1.e-003 | J120: -4.5999999999999999e-003 | K120: 10.16 | L120: -5.8999999999999999e-003 | M120: 114.9 | N120: 11.54 | O120: 0.193 | P120: 88.04 | Q120: 转股中 | R120: 4.75年 | S120: 2.75年 | T120: 2.8 | U120: 1.6 | V120: 6.0000000000000001e-003 | W120: 0.154 | X120: 0.13600000000000001 | Y120: 18 | Z120: 2.16 | AA120: 1.9599999999999999e-002 | AB120: 1.38e-002 | AC120: -5.1999999999999998e-003 | AD120: -7.4999999999999997e-003 | AE120: 83.88 | AF120: 82.05 | AG120: 0.6 | AH120: A+ | AI120: 7.51e-002 | AJ120: =H120+100*O120 -> 124.28999999999999 | AK120: 121.9 | AL120: 56 | AM120: 38.1 | AN120: 145 | AO120: 1.3000000000000001e-002 | AP120: 33 | AQ120: 百达转债!
A121: 330 | B121: 113505 | C121: 杭电转债! | D121: 603618 | E121: 杭电股份 | F121: 能源电力 | G121: 电力设备 | H121: 105.72 | I121: 5.3e-003 | J121: -6.6e-003 | K121: 6.56 | L121: -3.0000000000000001e-003 | M121: 111.3 | N121: 7.08 | O121: 0.14099999999999999 | P121: 92.66 | Q121: 转股中 | R121: 2.73年 | S121: 0.73年 | T121: 7.5 | U121: 17 | V121: 2.1000000000000001e-002 | W121: 0.16500000000000001 | X121: 0.153 | Y121: 45 | Z121: 1.68 | AA121: 1.9299999999999998e-002 | AB121: 1.15e-002 | AC121: -4.1200000000000001e-002 | AD121: -4.4900000000000002e-002 | AE121: 98.15 | AF121: 99.77 | AG121: 0.4 | AH121: AA | AI121: 4.1500000000000002e-002 | AJ121: =H121+100*O121 -> 119.81999999999999 | AK121: 118.8 | AL121: 31 | AM121: 19 | AN121: 9 | AO121: 4.2999999999999997e-002 | AP121: 43 | AQ121: 杭电转债!
A122: 259 | B122: 128070 | C122: 智能转债! | D122: 2877 | E122: 智能自控 | F122: 机械装备 | G122: 通用设备 | H122: 109.092 | I122: -2.7000000000000001e-003 | J122: -1.6000000000000001e-003 | K122: 6.54 | L122: -1.3600000000000001e-002 | M122: 117.6 | N122: 9.51 | O122: 0.58599999999999997 | P122: 68.77 | Q122: 转股中 | R122: 4年20天 | S122: 无权 | T122: 2.3 | U122: 44 | V122: 0.17300000000000001 | W122: 0.106 | X122: 7.2999999999999995e-002 | Y122: 22 | Z122: 2.94 | AA122: 1.9199999999999998e-002 | AB122: 1.1299999999999999e-002 | AC122: 无权 | AD122: 无权 | AE122: 无权 | AF122: 88.38 | AG122: 0.32 | AH122: A+ | AI122: 7.51e-002 | AJ122: =H122+100*O122 -> 167.69200000000001 | AK122: 149.4 | AL122: 288 | AM122: 61 | AN122: 297 | AO122: 5.0000000000000001e-003 | AP122: 30 | AQ122: 智能转债!
A123: 153 | B123: 123057 | C123: 美联转债! | D123: 300586 | E123: 美联新材 | F123: 化工 | G123: 橡胶塑料 | H123: 107.65 | I123: 5.4000000000000003e-003 | J123: -1.32e-002 | K123: 8.16 | L123: -1.5700000000000002e-002 | M123: 118.2 | N123: 9.91 | O123: 0.307 | P123: 82.34 | Q123: 转股中 | R123: 5年19天 | S123: 3年20天 | T123: 2.07 | U123: 13 | V123: 5.7000000000000002e-002 | W123: 5.5999999999999994e-002 | X123: 4.5999999999999999e-002 | Y123: 37 | Z123: 5.02 | AA123: 1.9099999999999999e-002 | AB123: 1.26e-002 | AC123: -1.04e-002 | AD123: -1.2800000000000001e-002 | AE123: 85.18 | AF123: 86.59 | AG123: 0.5 | AH123: AA- | AI123: 6.5199999999999994e-002 | AJ123: =H123+100*O123 -> 138.34999999999999 | AK123: 133 | AL123: 173 | AM123: 46.4 | AN123: 223 | AO123: 1.e-002 | AP123: 19 | AQ123: 美联转债!
A124: 251 | B124: 128073 | C124: 哈尔转债! | D124: 2615 | E124: 哈尔斯 | F124: 其他 | G124: 家居用品 | H124: 108.699 | I124: 1.0200000000000001e-002 | J124: -6.1999999999999998e-003 | K124: 4.8 | L124: 1.0500000000000001e-002 | M124: 115.3 | N124: 5.7 | O124: 0.29100000000000004 | P124: 84.21 | Q124: 转股中 | R124: 3.19年 | S124: 1.20年 | T124: 2.99 | U124: 41 | V124: 0.126 | W124: 0.151 | X124: 0.127 | Y124: 20 | Z124: 2.52 | AA124: 1.89e-002 | AB124: 1.0200000000000001e-002 | AC124: -4.5599999999999995e-002 | AD124: -4.8300000000000003e-002 | AE124: 93.82 | AF124: 94.85 | AG124: 0.38 | AH124: AA- | AI124: 6.4100000000000004e-002 | AJ124: =H124+100*O124 -> 137.79900000000001 | AK124: 133.2 | AL124: 177 | AM124: 38.3 | AN124: 151 | AO124: 2.2000000000000002e-002 | AP124: 40 | AQ124: 哈尔转债!
A125: 7 | B125: 110080 | C125: 东湖转债 | D125: 600133 | E125: 东湖高新 | F125: 建筑 | G125: 建筑工程 | H125: 103.79 | I125: -2.3999999999999998e-003 | J125: -5.0000000000000001e-004 | K125: 5.99 | L125: -5.0000000000000001e-003 | M125: 115.1 | N125: 6.16 | O125: 6.7000000000000004e-002 | P125: 97.24 | Q125: 4月7天 | R125: 5.83年 | S125: 3.84年 | T125: 15.5 | U125: 26 | V125: 1.6e-002 | W125: 0.32500000000000001 | X125: 0.316 | Y125: 48 | Z125: 0.88 | AA125: 1.8200000000000001e-002 | AB125: 1.34e-002 | AC125: -4.0000000000000002e-004 | AD125: -2.2000000000000001e-003 | AE125: 87.26 | AF125: 89.83 | AG125: 0.59 | AH125: AA | AI125: 4.4199999999999996e-002 | AJ125: =H125+100*O125 -> 110.49000000000001 | AK125: 110.3 | AL125: 5 | AM125: 20.5 | AN125: 12 | AO125: 2.e-003 | AP125: 16 | AQ125: 东湖转债
A126: 160 | B126: 128114 | C126: 正邦转债 | D126: 2157 | E126: 正邦科技 | F126: 农业 | G126: 畜牧业 | H126: 105.808 | I126: 1.e-004 | J126: -3.0999999999999999e-003 | K126: 11.91 | L126: -8.3000000000000001e-003 | M126: 115.3 | N126: 14.76 | O126: 0.311 | P126: 80.69 | Q126: 转股中 | R126: 5年5.1天 | S126: 3年6.1天 | T126: 16 | U126: 9.3 | V126: 6.0000000000000001e-003 | W126: 4.2999999999999997e-002 | X126: 3.4000000000000002e-002 | Y126: 375 | Z126: 1.6 | AA126: 1.77e-002 | AB126: 1.2e-002 | AC126: -6.0999999999999995e-003 | AD126: -8.3999999999999995e-003 | AE126: 91.42 | AF126: 94.59 | AG126: 0.36 | AH126: AA+ | AI126: 4.1200000000000001e-002 | AJ126: =H126+100*O126 -> 136.90800000000002 | AK126: 130.9 | AL126: 148 | AM126: 36.3 | AN126: 130 | AO126: -9.1999999999999998e-002 | AP126: 16 | AQ126: 正邦转债
A127: 217 | B127: 113561 | C127: 正裕转债! | D127: 603089 | E127: 正裕工业 | F127: 汽车 | G127: 零部件制 | H127: 109.21 | I127: 1.6000000000000001e-003 | J127: -5.3e-003 | K127: 8.83 | L127: -6.7000000000000002e-003 | M127: 118 | N127: 10.08 | O127: 0.247 | P127: 87.6 | Q127: 转股中 | R127: 4.55年 | S127: 2.56年 | T127: 1.5 | U127: 12 | V127: 7.2999999999999995e-002 | W127: 7.5999999999999998e-002 | X127: 6.7000000000000004e-002 | Y127: 20 | Z127: 1.85 | AA127: 1.7600000000000001e-002 | AB127: 1.04e-002 | AC127: -1.7399999999999999e-002 | AD127: -2.0299999999999999e-002 | AE127: 85.74 | AF127: 85.56 | AG127: 0.56 | AH127: A+ | AI127: 7.51e-002 | AJ127: =H127+100*O127 -> 133.91 | AK127: 130.8 | AL127: 147 | AM127: 45.1 | AN127: 210 | AO127: -5.9000000000000004e-002 | AP127: 35 | AQ127: 正裕转债!
A128: 58 | B128: 113044 | C128: 大秦转债! | D128: 601006 | E128: 大秦铁路 | F128: 铁路 | G128: 铁路运输 | H128: 103.91 | I128: -2.0999999999999999e-003 | J128: -1.55e-002 | K128: 6.46 | L128: -4.1500000000000002e-002 | M128: 114.1 | N128: 7.66 | O128: 0.23199999999999998 | P128: 84.33 | Q128: 7天 | R128: 5.51年 | S128: 3.51年 | T128: 320 | U128: 323 | V128: 1.e-002 | W128: 0.33299999999999996 | X128: 0.28100000000000003 | Y128: 960 | Z128: 0.8 | AA128: 1.7500000000000002e-002 | AB128: 1.2699999999999999e-002 | AC128: 1.e-004 | AD128: -2.e-003 | AE128: 90.34 | AF128: 92.72 | AG128: 0.42 | AH128: AAA | AI128: 3.9199999999999999e-002 | AJ128: =H128+100*O128 -> 127.11 | AK128: 123.5 | AL128: 71 | AM128: 30.8 | AN128: 72 | AO128: -6.5000000000000002e-002 | AP128: 15 | AQ128: 大秦转债!
A129: 242 | B129: 127014 | C129: 北方转债! | D129: 65 | E129: 北方国际 | F129: 建筑 | G129: 建筑工程 | H129: 107.05 | I129: 3.2000000000000002e-003 | J129: -1.6000000000000001e-003 | K129: 7.7 | L129: 3.9000000000000003e-003 | M129: 115.1 | N129: 8.75 | O129: 0.21600000000000003 | P129: 88 | Q129: 转股中 | R129: 4.37年 | S129: 2.37年 | T129: 5.35 | U129: 4.3 | V129: 8.0000000000000002e-003 | W129: 8.9999999999999997e-002 | X129: 7.9000000000000001e-002 | Y129: 59 | Z129: 1.07 | AA129: 1.7100000000000001e-002 | AB129: 1.0800000000000001e-002 | AC129: -1.3000000000000001e-002 | AD129: -1.5700000000000002e-002 | AE129: 93.88 | AF129: 97.31 | AG129: 0.41 | AH129: AA+ | AI129: 4.0099999999999997e-002 | AJ129: =H129+100*O129 -> 128.65000000000001 | AK129: 126.1 | AL129: 101 | AM129: 28.8 | AN129: 47 | AO129: -6.9999999999999993e-003 | AP129: 19 | AQ129: 北方转债!
A130: 107 | B130: 128133 | C130: 奇正转债! | D130: 2287 | E130: 奇正藏药 | F130: 医药 | G130: 中药 | H130: 107.461 | I130: -1.49e-002 | J130: -2.7000000000000001e-003 | K130: 25.44 | L130: -4.1799999999999997e-002 | M130: 117.3 | N130: 30.12 | O130: 0.27200000000000002 | P130: 84.46 | Q130: 转股中 | R130: 5.28年 | S130: 3.28年 | T130: 8 | U130: 8.3 | V130: 1.e-002 | W130: 5.9000000000000004e-002 | X130: 5.0000000000000003e-002 | Y130: 135 | Z130: 5.21 | AA130: 1.7100000000000001e-002 | AB130: 1.1200000000000002e-002 | AC130: -1.01e-002 | AD130: -1.2199999999999999e-002 | AE130: 89.57 | AF130: 93.79 | AG130: 0.42 | AH130: AA | AI130: 4.4199999999999996e-002 | AJ130: =H130+100*O130 -> 134.661 | AK130: 130.5 | AL130: 143 | AM130: 36.7 | AN130: 133 | AO130: -4.8000000000000001e-002 | AP130: 15 | AQ130: 奇正转债!
A131: 140 | B131: 113594 | C131: 淳中转债! | D131: 603516 | E131: 淳中科技 | F131: 电子 | G131: 电子产品 | H131: 111.63 | I131: -4.6999999999999993e-003 | J131: -1.1200000000000002e-002 | K131: 21.88 | L131: -3.1899999999999998e-002 | M131: 121.4 | N131: 27.84 | O131: 0.41999999999999998 | P131: 78.59 | Q131: 转股中 | R131: 5年39天 | S131: 3年40天 | T131: 3 | U131: 1.3 | V131: 4.0000000000000001e-003 | W131: 7.2999999999999995e-002 | X131: 5.7999999999999996e-002 | Y131: 41 | Z131: 2.98 | AA131: 1.7000000000000001e-002 | AB131: 9.5999999999999992e-003 | AC131: -2.e-002 | AD131: -2.2599999999999999e-002 | AE131: 82.49 | AF131: 84.25 | AG131: 0.5 | AH131: A+ | AI131: 7.6200000000000004e-002 | AJ131: =H131+100*O131 -> 153.63 | AK131: 144.7 | AL131: 269 | AM131: 60.4 | AN131: 295 | AO131: -2.e-002 | AP131: 9 | AQ131: 淳中转债!
A132: 255 | B132: 128071 | C132: 合兴转债! | D132: 2228 | E132: 合兴包装 | F132: 造纸包装 | G132: 包装材料 | H132: 107.299 | I132: 0. | J132: 0. | K132: 3.75 | L132: 0. | M132: 114.8 | N132: 4.28 | O132: 0.22500000000000001 | P132: 87.62 | Q132: 转股中 | R132: 4.18年 | S132: 2.18年 | T132: 3 | U132: 3.2 | V132: 1.e-002 | W132: 6.5000000000000002e-002 | X132: 5.7000000000000002e-002 | Y132: 46 | Z132: 1.34 | AA132: 1.66e-002 | AB132: 1.01e-002 | AC132: -1.6200000000000003e-002 | AD132: -1.89e-002 | AE132: 93.66 | AF132: 96.6 | AG132: 0.41 | AH132: AA | AI132: 4.3099999999999999e-002 | AJ132: =H132+100*O132 -> 129.79900000000001 | AK132: 127 | AL132: 110 | AM132: 30.4 | AN132: 67 | AO132: -1.4999999999999999e-002 | AP132: 24 | AQ132: 合兴转债!
A133: 169 | B133: 123051 | C133: 今天转债 | D133: 300532 | E133: 今天国际 | F133: 计算机及 | G133: 软件开发 | H133: 113.052 | I133: -4.0000000000000002e-004 | J133: -1.1899999999999999e-002 | K133: 8.78 | L133: -1.9e-002 | M133: 122.3 | N133: 8.7 | O133: 0.12 | P133: 100.92 | Q133: 转股中 | R133: 4.98年 | S133: 2.98年 | T133: 2.8 | U133: 18 | V133: 5.7000000000000002e-002 | W133: 0.11699999999999999 | X133: 0.11800000000000001 | Y133: 24 | Z133: 3.08 | AA133: 1.6299999999999999e-002 | AB133: 8.5000000000000006e-003 | AC133: -2.5699999999999997e-002 | AD133: -2.8199999999999999e-002 | AE133: 83.18 | AF133: 85.98 | AG133: 0.65 | AH133: A+ | AI133: 7.51e-002 | AJ133: =H133+100*O133 -> 125.05200000000001 | AK133: 125.2 | AL133: 90 | AM133: 39.2 | AN133: 164 | AO133: 1.e-002 | AP133: 17 | AQ133: 今天转债
A134: 273 | B134: 113024 | C134: 核建转债! | D134: 601611 | E134: 中国核建 | F134: 建筑 | G134: 建筑工程 | H134: 103.05 | I134: -1.8e-003 | J134: 2.9999999999999997e-004 | K134: 7.18 | L134: -6.8999999999999999e-003 | M134: 109.3 | N134: 9.76 | O134: 0.40100000000000002 | P134: 73.57 | Q134: 转股中 | R134: 3.82年 | S134: 1.82年 | T134: 30 | U134: 11 | V134: 3.0000000000000001e-003 | W134: 0.157 | X134: 0.11599999999999999 | Y134: 190 | Z134: 1.61 | AA134: 1.5800000000000002e-002 | AB134: 1.11e-002 | AC134: -1.1999999999999999e-003 | AD134: -4.0000000000000001e-003 | AE134: 95.47 | AF134: 95 | AG134: 0.22 | AH134: AAA | AI134: 3.8100000000000002e-002 | AJ134: =H134+100*O134 -> 143.15000000000001 | AK134: 132.5 | AL134: 169 | AM134: 37.1 | AN134: 141 | AO134: -1.6e-002 | AP134: 37 | AQ134: 核建转债!
A135: 208 | B135: 113565 | C135: 宏辉转债 | D135: 603336 | E135: 宏辉果蔬 | F135: 农业 | G135: 农产品加 | H135: 109.66 | I135: -4.8999999999999998e-003 | J135: -4.7999999999999996e-003 | K135: 7.39 | L135: -1.6e-002 | M135: 117.8 | N135: 7.64 | O135: 0.13400000000000001 | P135: 96.73 | Q135: 转股中 | R135: 4.71年 | S135: 2.71年 | T135: 2.25 | U135: 10 | V135: 4.2000000000000003e-002 | W135: 7.0000000000000007e-002 | X135: 6.7000000000000004e-002 | Y135: 32 | Z135: 2.38 | AA135: 1.5600000000000001e-002 | AB135: 8.8999999999999999e-003 | AC135: -1.9400000000000001e-002 | AD135: -2.18e-002 | AE135: 86.9 | AF135: 88.49 | AG135: 0.61 | AH135: AA- | AI135: 6.4100000000000004e-002 | AJ135: =H135+100*O135 -> 123.06 | AK135: 122.6 | AL135: 61 | AM135: 34.1 | AN135: 112 | AO135: -2.9999999999999999e-002 | AP135: 24 | AQ135: 宏辉转债
A136: 37 | B136: 123097 | C136: 美力转债 | D136: 300611 | E136: 美力科技 | F136: 机械装备 | G136: 通用设备 | H136: 111.78 | I136: 1.18e-002 | J136: -2.2000000000000001e-003 | K136: 9.8 | L136: 1.34e-002 | M136: 121.6 | N136: 9.34 | O136: 6.5000000000000002e-002 | P136: 104.93 | Q136: 52天 | R136: 5.63年 | S136: 3.63年 | T136: 3 | U136: 9.3 | V136: 2.7999999999999997e-002 | W136: 0.17100000000000001 | X136: 0.17899999999999999 | Y136: 18 | Z136: 2.64 | AA136: 1.54e-002 | AB136: 8.6999999999999994e-003 | AC136: -1.7500000000000002e-002 | AD136: -1.9799999999999998e-002 | AE136: 79.43 | AF136: 81.23 | AG136: 0.71 | AH136: A+ | AI136: 7.6200000000000004e-002 | AJ136: =H136+100*O136 -> 118.28 | AK136: 118.6 | AL136: 30 | AM136: 37.4 | AN136: 143 | AO136: 5.5999999999999994e-002 | AP136: 16 | AQ136: 美力转债
A137: 179 | B137: 123050 | C137: 聚飞转债 | D137: 300303 | E137: 聚飞光电 | F137: 电子 | G137: LED制 | H137: 115.301 | I137: 1.2999999999999999e-003 | J137: -1.55e-002 | K137: 4.96 | L137: -2.5499999999999998e-002 | M137: 123.8 | N137: 5.18 | O137: 0.20399999999999999 | P137: 95.75 | Q137: 转股中 | R137: 4.84年 | S137: 2.84年 | T137: 7.05 | U137: 8.6 | V137: 1.1000000000000001e-002 | W137: 0.111 | X137: 0.106 | Y137: 63 | Z137: 2.58 | AA137: 1.5100000000000001e-002 | AB137: 6.7000000000000002e-003 | AC137: -3.49e-002 | AD137: -3.7100000000000001e-002 | AE137: 86.2 | AF137: 92.23 | AG137: 0.55 | AH137: AA- | AI137: 6.4100000000000004e-002 | AJ137: =H137+100*O137 -> 135.70099999999999 | AK137: 134.8 | AL137: 193 | AM137: 42.6 | AN137: 195 | AO137: 1.7000000000000001e-002 | AP137: 11 | AQ137: 聚飞转债
A138: 65 | B138: 127026 | C138: 超声转债! | D138: 823 | E138: 超声电子 | F138: 电子 | G138: 元器件制 | H138: 104.5 | I138: -7.4999999999999997e-003 | J138: -5.3e-003 | K138: 10.62 | L138: -2.8399999999999998e-002 | M138: 113.1 | N138: 12.72 | O138: 0.252 | P138: 83.49 | Q138: 3.1天 | R138: 5.49年 | S138: 3.49年 | T138: 7 | U138: 2.6 | V138: 4.0000000000000001e-003 | W138: 0.12300000000000001 | X138: 0.10199999999999999 | Y138: 57 | Z138: 1.49 | AA138: 1.4800000000000001e-002 | AB138: 1.03e-002 | AC138: -2.3999999999999998e-003 | AD138: -4.3e-003 | AE138: 88.56 | AF138: 89.59 | AG138: 0.45 | AH138: AA | AI138: 4.4199999999999996e-002 | AJ138: =H138+100*O138 -> 129.69999999999999 | AK138: 125.5 | AL138: 96 | AM138: 35.9 | AN138: 127 | AO138: 2.e-003 | AP138: 11 | AQ138: 超声转债!
A139: 328 | B139: 127006 | C139: 敖东转债! | D139: 623 | E139: 吉林敖东 | F139: 金融 | G139: 证券行业 | H139: 103.248 | I139: 8.0000000000000004e-004 | J139: -3.2000000000000002e-003 | K139: 15.64 | L139: -1.26e-002 | M139: 107.4 | N139: 20.42 | O139: 0.34799999999999998 | P139: 76.59 | Q139: 转股中 | R139: 2.75年 | S139: 0.75年 | T139: 24.1 | U139: 3.1 | V139: 1.e-003 | W139: 0.13200000000000001 | X139: 0.10099999999999999 | Y139: 182 | Z139: 0.79 | AA139: 1.46e-002 | AB139: 9.3999999999999986e-003 | AC139: -2.3e-002 | AD139: -2.52e-002 | AE139: 97.62 | AF139: 96.9 | AG139: 0.19 | AH139: AA+ | AI139: 3.85e-002 | AJ139: =H139+100*O139 -> 138.048 | AK139: 129.9 | AL139: 132 | AM139: 32.3 | AN139: 90 | AO139: 2.e-003 | AP139: 26 | AQ139: 敖东转债!
A140: 282 | B140: 123024 | C140: 岱勒转债! | D140: 300700 | E140: 岱勒新材 | F140: 机械装备 | G140: 专用设备 | H140: 108.23 | I140: 1.04e-002 | J140: -6.6e-003 | K140: 13.05 | L140: 7.7000000000000002e-003 | M140: 112.5 | N140: 14.1 | O140: 0.16899999999999998 | P140: 92.55 | Q140: 转股中 | R140: 2.77年 | S140: 0.78年 | T140: 2.1 | U140: 16 | V140: 6.9000000000000006e-002 | W140: 0.14999999999999999 | X140: 0.13900000000000001 | Y140: 14 | Z140: 2.22 | AA140: 1.4199999999999999e-002 | AB140: 5.8999999999999999e-003 | AC140: -6.8400000000000002e-002 | AD140: -7.0900000000000005e-002 | AE140: 94.72 | AF140: 92.61 | AG140: 0.5 | AH140: A+ | AI140: 7.3499999999999996e-002 | AJ140: =H140+100*O140 -> 125.13 | AK140: 123.9 | AL140: 79 | AM140: 29.2 | AN140: 55 | AO140: -8.6999999999999994e-002 | AP140: 35 | AQ140: 岱勒转债!
A141: 104 | B141: 113604 | C141: 多伦转债! | D141: 603528 | E141: XD多伦科 | F141: 计算机及 | G141: 软件开发 | H141: 109 | I141: -3.9599999999999996e-002 | J141: -1.4999999999999999e-002 | K141: 8.91 | L141: -0.10000000000000001 | M141: 117.3 | N141: 10.4 | O141: 0.27200000000000002 | P141: 85.67 | Q141: 转股中 | R141: 5.34年 | S141: 3.34年 | T141: 6.4 | U141: 17 | V141: 2.4e-002 | W141: 0.115 | X141: 9.8000000000000004e-002 | Y141: 56 | Z141: 3.36 | AA141: 1.41e-002 | AB141: 8.3000000000000001e-003 | AC141: -1.3999999999999999e-002 | AD141: -1.6e-002 | AE141: 83.38 | AF141: 84.32 | AG141: 0.55 | AH141: AA- | AI141: 6.5199999999999994e-002 | AJ141: =H141+100*O141 -> 136.19999999999999 | AK141: 132.3 | AL141: 164 | AM141: 48 | AN141: 230 | AO141: -7.0000000000000007e-002 | AP141: 7 | AQ141: 多伦转债!
A142: 203 | B142: 113568 | C142: 新春转债! | D142: 603667 | E142: 五洲新春 | F142: 机械装备 | G142: 通用设备 | H142: 116.53 | I142: 3.2199999999999999e-002 | J142: -2.1299999999999999e-002 | K142: 9.84 | L142: 1.6500000000000001e-002 | M142: 124.3 | N142: 8.91 | O142: 5.5e-002 | P142: 110.44 | Q142: 转股中 | R142: 4.73年 | S142: 2.73年 | T142: 3.3 | U142: 208 | V142: 0.54000000000000004 | W142: 0.115 | X142: 0.127 | Y142: 29 | Z142: 1.62 | AA142: 1.3999999999999999e-002 | AB142: 5.3e-003 | AC142: -3.8100000000000002e-002 | AD142: -4.0800000000000003e-002 | AE142: 87.21 | AF142: 93.27 | AG142: 0.66 | AH142: AA- | AI142: 6.4100000000000004e-002 | AJ142: =H142+100*O142 -> 122.03 | AK142: 122.6 | AL142: 63 | AM142: 29.3 | AN142: 57 | AO142: 0.10400000000000001 | AP142: 50 | AQ142: 新春转债!
A143: 135 | B143: 128122 | C143: 兴森转债! | D143: 2436 | E143: 兴森科技 | F143: 电子 | G143: 元器件制 | H143: 107.062 | I143: -1.3300000000000001e-002 | J143: 7.1999999999999998e-003 | K143: 9.82 | L143: -3.0600000000000002e-002 | M143: 113.3 | N143: 14.1 | O143: 0.53700000000000003 | P143: 69.65 | Q143: 转股中 | R143: 4年41天 | S143: 3年42天 | T143: 2.69 | U143: 6.3 | V143: 2.2000000000000002e-002 | W143: 1.8000000000000002e-002 | X143: 1.3000000000000001e-002 | Y143: 146 | Z143: 4.55 | AA143: 1.3999999999999999e-002 | AB143: 8.1000000000000013e-003 | AC143: -9.8999999999999991e-003 | AD143: -1.21e-002 | AE143: 90.36 | AF143: 95.47 | AG143: 0.2 | AH143: AA | AI143: 4.3099999999999999e-002 | AJ143: =H143+100*O143 -> 160.762 | AK143: 144.5 | AL143: 268 | AM143: 49 | AN143: 238 | AO143: 3.6000000000000004e-002 | AP143: 12 | AQ143: 兴森转债!
A144: 4 | B144: 113048 | C144: 晶科转债! | D144: 601778 | E144: 晶科科技 | F144: 能源电力 | G144: 太阳能 | H144: 108.1 | I144: 9.7000000000000003e-003 | J144: -4.3e-003 | K144: 5.51 | L144: 1.29e-002 | M144: 117.1 | N144: 6.75 | O144: 0.32400000000000001 | P144: 81.63 | Q144: 4月20天 | R144: 5.86年 | S144: 3.87年 | T144: 30 | U144: 72 | V144: 2.2000000000000002e-002 | W144: 0.19699999999999998 | X144: 0.161 | Y144: 152 | Z144: 1.4 | AA144: 1.3999999999999999e-002 | AB144: 8.6999999999999994e-003 | AC144: -1.06e-002 | AD144: -1.23e-002 | AE144: 87.14 | AF144: 91.26 | AG144: 0.42 | AH144: AA | AI144: 4.4199999999999996e-002 | AJ144: =H144+100*O144 -> 140.5 | AK144: 134.6 | AL144: 189 | AM144: 43.3 | AN144: 196 | AO144: 9.0000000000000011e-003 | AP144: 5 | AQ144: 晶科转债!
A145: 67 | B145: 128140 | C145: 润建转债! | D145: 2929. | E145: 润建股份 | F145: 通信互联 | G145: 通信设备 | H145: 106.973 | I145: -1.1999999999999999e-003 | J145: -5.6999999999999993e-003 | K145: 24.38 | L145: -1.3000000000000001e-002 | M145: 115.2 | N145: 26.4 | O145: 0.158 | P145: 92.35 | Q145: 转股中 | R145: 5.49年 | S145: 3.49年 | T145: 10.9 | U145: 6.3 | V145: 5.0000000000000001e-003 | W145: 0.20300000000000001 | X145: 0.187 | Y145: 54 | Z145: 1.7 | AA145: 1.38e-002 | AB145: 8.8000000000000005e-003 | AC145: -8.5000000000000006e-003 | AD145: -1.0500000000000001e-002 | AE145: 88.66 | AF145: 91.27 | AG145: 0.53 | AH145: AA | AI145: 4.4199999999999996e-002 | AJ145: =H145+100*O145 -> 122.773 | AK145: 121.6 | AL145: 52 | AM145: 30.3 | AN145: 66 | AO145: 3.6000000000000004e-002 | AP145: 13 | AQ145: 润建转债!
A146: 354 | B146: 113014 | C146: 林洋转债! | D146: 601222 | E146: 林洋能源 | F146: 能源电力 | G146: 电力设备 | H146: 105.99 | I146: 4.0999999999999995e-003 | J146: 2.3e-003 | K146: 7.45 | L146: 2.0499999999999997e-002 | M146: 109.3 | N146: 8.54 | O146: 0.215 | P146: 87.24 | Q146: 转股中 | R146: 2.38年 | S146: 0.38年 | T146: 30 | U146: 261 | V146: 8.0000000000000002e-002 | W146: 0.23000000000000001 | X146: 0.20100000000000001 | Y146: 130 | Z146: 1.25 | AA146: 1.3300000000000001e-002 | AB146: 5.7999999999999996e-003 | AC146: -7.17e-002 | AD146: -7.7699999999999991e-002 | AE146: 99.58 | AF146: 99.41 | AG146: 0.31 | AH146: AA | AI146: 4.1500000000000002e-002 | AJ146: =H146+100*O146 -> 127.48999999999999 | AK146: 124.7 | AL146: 84 | AM146: 25.2 | AN146: 28 | AO146: 0.10400000000000001 | AP146: 30 | AQ146: 林洋转债!
A147: 159 | B147: 113588 | C147: 润达转债! | D147: 603108 | E147: 润达医疗 | F147: 医药 | G147: 医疗器械 | H147: 107.1 | I147: -1.95e-002 | J147: 1.0500000000000001e-002 | K147: 11.38 | L147: -2.07e-002 | M147: 114.2 | N147: 13.36 | O147: 0.25700000000000001 | P147: 85.18 | Q147: 转股中 | R147: 5年5.1天 | S147: 3年6.1天 | T147: 5.5 | U147: 3.8 | V147: 6.0000000000000001e-003 | W147: 8.3000000000000004e-002 | X147: 7.0999999999999994e-002 | Y147: 66 | Z147: 2.07 | AA147: 1.32e-002 | AB147: 7.9000000000000008e-003 | AC147: -1.0200000000000001e-002 | AD147: -1.24e-002 | AE147: 90.5 | AF147: 92.36 | AG147: 0.44 | AH147: AA | AI147: 4.4199999999999996e-002 | AJ147: =H147+100*O147 -> 132.79999999999998 | AK147: 129 | AL147: 127 | AM147: 36.7 | AN147: 132 | AO147: 2.e-003 | AP147: 10 | AQ147: 润达转债!
A148: 149 | B148: 110071 | C148: 湖盐转债! | D148: 600929 | E148: 雪天盐业 | F148: 食品饮料 | G148: 食品饮料 | H148: 107.91 | I148: 4.0000000000000002e-004 | J148: -2.2000000000000001e-003 | K148: 6.4 | L148: -3.0999999999999999e-003 | M148: 115.2 | N148: 6.52 | O148: 9.9000000000000005e-002 | P148: 98.16 | Q148: 转股中 | R148: 5年28天 | S148: 3年29天 | T148: 7.2 | U148: 5.8 | V148: 8.0000000000000002e-003 | W148: 0.12300000000000001 | X148: 0.12 | Y148: 59 | Z148: 2.21 | AA148: 1.32e-002 | AB148: 7.8000000000000005e-003 | AC148: -1.23e-002 | AD148: -1.4499999999999999e-002 | AE148: 90.25 | AF148: 92.91 | AG148: 0.57 | AH148: AA | AI148: 4.4199999999999996e-002 | AJ148: =H148+100*O148 -> 117.81 | AK148: 117.7 | AL148: 23 | AM148: 24.7 | AN148: 27 | AO148: 1.3000000000000001e-002 | AP148: 20 | AQ148: 湖盐转债!
A149: 299 | B149: 113525 | C149: 台华转债! | D149: 603055 | E149: 台华新材 | F149: 服装纺织 | G149: 纺织行业 | H149: 109.42 | I149: 1.38e-002 | J149: -1.06e-002 | K149: 6.29 | L149: 1.1299999999999999e-002 | M149: 114.3 | N149: 7.78 | O149: 0.35299999999999998 | P149: 80.85 | Q149: 转股中 | R149: 3.52年 | S149: 1.52年 | T149: 4.69 | U149: 1.9 | V149: 4.0000000000000001e-003 | W149: 8.9999999999999997e-002 | X149: 7.2999999999999995e-002 | Y149: 52 | Z149: 1.72 | AA149: 1.2699999999999999e-002 | AB149: 5.3e-003 | AC149: -3.6699999999999997e-002 | AD149: -3.9699999999999999e-002 | AE149: 95.8 | AF149: 98.83 | AG149: 0.29 | AH149: AA | AI149: 4.3099999999999999e-002 | AJ149: =H149+100*O149 -> 144.72 | AK149: 138 | AL149: 223 | AM149: 39.2 | AN149: 162 | AO149: 3.5000000000000003e-002 | AP149: 20 | AQ149: 台华转债!
A150: 117 | B150: 113039 | C150: 嘉泽转债! | D150: 601619 | E150: XD嘉泽新 | F150: 能源电力 | G150: 风能 | H150: 106.19 | I150: 6.8000000000000005e-003 | J150: 2.9999999999999997e-004 | K150: 3.43 | L150: 1.18e-002 | M150: 113.1 | N150: 3.46 | O150: 7.0999999999999994e-002 | P150: 99.13 | Q150: 转股中 | R150: 5.20年 | S150: 3.20年 | T150: 11.8 | U150: 14 | V150: 1.1000000000000001e-002 | W150: 0.159 | X150: 0.157 | Y150: 75 | Z150: 1.99 | AA150: 1.24e-002 | AB150: 7.8000000000000005e-003 | AC150: -7.4000000000000003e-003 | AD150: -9.3999999999999986e-003 | AE150: 89.68 | AF150: 90.73 | AG150: 0.6 | AH150: AA | AI150: 4.4199999999999996e-002 | AJ150: =H150+100*O150 -> 113.28999999999999 | AK150: 113.2 | AL150: 11 | AM150: 22.5 | AN150: 22 | AO150: -8.0000000000000002e-003 | AP150: 35 | AQ150: 嘉泽转债!
A151: 48 | B151: 123092 | C151: 天壕转债 | D151: 300332 | E151: 天壕环境 | F151: 石油天然 | G151: 天然气 | H151: 113.801 | I151: -1.3000000000000001e-002 | J151: -7.4000000000000003e-003 | K151: 5.45 | L151: -2.8500000000000001e-002 | M151: 121.6 | N151: 5.2 | O151: 8.5999999999999993e-002 | P151: 104.81 | Q151: 19天 | R151: 5.53年 | S151: 3.54年 | T151: 4.23 | U151: 3.7 | V151: 8.0000000000000002e-003 | W151: 8.8000000000000009e-002 | X151: 9.1999999999999998e-002 | Y151: 48 | Z151: 1.42 | AA151: 1.23e-002 | AB151: 5.6000000000000008e-003 | AC151: -2.2700000000000001e-002 | AD151: -2.5000000000000001e-002 | AE151: 79.97 | AF151: 81.79 | AG151: 0.71 | AH151: A+ | AI151: 7.6200000000000004e-002 | AJ151: =H151+100*O151 -> 122.401 | AK151: 122.8 | AL151: 65 | AM151: 41 | AN151: 180 | AO151: 5.9000000000000004e-002 | AP151: 7 | AQ151: 天壕转债
A152: 349 | B152: 110038 | C152: 济川转债! | D152: 600566 | E152: 济川药业 | F152: 医药 | G152: 中药 | H152: 105.67 | I152: 0. | J152: -4.0000000000000002e-004 | K152: 18.01 | L152: -6.0999999999999995e-003 | M152: 107.5 | N152: 23.4 | O152: 0.373 | P152: 76.97 | Q152: 转股中 | R152: 1.42年 | S152: 回售内 | T152: 6.28 | U152: 1.7 | V152: 3.0000000000000001e-003 | W152: 3.9e-002 | X152: 2.9999999999999999e-002 | Y152: 160 | Z152: 1.97 | AA152: 1.2199999999999999e-002 | AB152: 2.2000000000000001e-003 | AC152: 回售内 | AD152: 回售内 | AE152: 100.25 | AF152: 101.51 | AG152: 0.07 | AH152: AA | AI152: 4.1500000000000002e-002 | AJ152: =H152+100*O152 -> 142.97 | AK152: 134.4 | AL152: 187 | AM152: 32.9 | AN152: 98 | AO152: -3.6000000000000004e-002 | AP152: 23 | AQ152: 济川转债!
A153: 132 | B153: 123062 | C153: 三超转债 | D153: 300554 | E153: 三超新材 | F153: 机械装备 | G153: 通用设备 | H153: 112.65 | I153: 7.4000000000000003e-003 | J153: 1.3100000000000001e-002 | K153: 17.21 | L153: 2.87e-002 | M153: 119.7 | N153: 17.13 | O153: 0.121 | P153: 100.47 | Q153: 转股中 | R153: 5年45天 | S153: 3年46天 | T153: 1.95 | U153: 61 | V153: 0.27800000000000002 | W153: 0.121 | X153: 0.121 | Y153: 16 | Z153: 3.07 | AA153: 1.2199999999999999e-002 | AB153: 5.4000000000000003e-003 | AC153: -2.2499999999999999e-002 | AD153: -2.5099999999999997e-002 | AE153: 79.99 | AF153: 79.25 | AG153: 0.72 | AH153: A | AI153: 8.6199999999999999e-002 | AJ153: =H153+100*O153 -> 124.75 | AK153: 124.8 | AL153: 85 | AM153: 44.8 | AN153: 209 | AO153: 4.0000000000000001e-003 | AP153: 20 | AQ153: 三超转债
A154: 25 | B154: 123105 | C154: 拓尔转债! | D154: 300229 | E154: 拓尔思 | F154: 计算机及 | G154: 软件开发 | H154: 113.012 | I154: -6.0999999999999995e-003 | J154: -9.0000000000000011e-003 | K154: 9.48 | L154: -2.3700000000000002e-002 | M154: 121 | N154: 9.93 | O154: 0.184 | P154: 95.47 | Q154: 3月16天 | R154: 5.77年 | S154: 3.77年 | T154: 8 | U154: 19 | V154: 2.e-002 | W154: 0.11800000000000001 | X154: 0.11199999999999999 | Y154: 68 | Z154: 3.12 | AA154: 1.21e-002 | AB154: 5.7999999999999996e-003 | AC154: -2.1299999999999999e-002 | AD154: -2.3099999999999999e-002 | AE154: 81.24 | AF154: 84.67 | AG154: 0.63 | AH154: AA- | AI154: 6.5199999999999994e-002 | AJ154: =H154+100*O154 -> 131.41200000000001 | AK154: 130.6 | AL154: 144 | AM154: 45.9 | AN154: 221 | AO154: 5.2999999999999999e-002 | AP154: 5 | AQ154: 拓尔转债!
A155: 257 | B155: 113542 | C155: 好客转债 | D155: 603898 | E155: 好莱客 | F155: 其他 | G155: 家居用品 | H155: 109.64 | I155: -1.23e-002 | J155: 8.8000000000000005e-003 | K155: 14.1 | L155: -8.3999999999999995e-003 | M155: 114.9 | N155: 16.14 | O155: 0.255 | P155: 87.36 | Q155: 转股中 | R155: 4年50天 | S155: 2年51天 | T155: 6.03 | U155: 12 | V155: 1.8000000000000002e-002 | W155: 0.13699999999999998 | X155: 0.12 | Y155: 44 | Z155: 1.7 | AA155: 1.1599999999999999e-002 | AB155: 5.1000000000000004e-003 | AC155: -2.5399999999999999e-002 | AD155: -2.81e-002 | AE155: 93.92 | AF155: 96.87 | AG155: 0.4 | AH155: AA | AI155: 4.3099999999999999e-002 | AJ155: =H155+100*O155 -> 135.13999999999999 | AK155: 131.9 | AL155: 159 | AM155: 35.1 | AN155: 116 | AO155: -3.1e-002 | AP155: 17 | AQ155: 好客转债
A156: 338 | B156: 110041 | C156: 蒙电转债! | D156: 600863 | E156: 内蒙华电 | F156: 能源电力 | G156: 电力供应 | H156: 106.24 | I156: -7.000000000000001e-004 | J156: 2.2000000000000001e-003 | K156: 2.42 | L156: 4.0999999999999995e-003 | M156: 109.3 | N156: 2.69 | O156: 0.18100000000000002 | P156: 89.96 | Q156: 转股中 | R156: 2.53年 | S156: 0.53年 | T156: 18.7 | U156: 3.9 | V156: 2.e-003 | W156: 0.13300000000000001 | X156: 0.12 | Y156: 141 | Z156: 1.2 | AA156: 1.15e-002 | AB156: 4.5000000000000005e-003 | AC156: -5.9500000000000004e-002 | AD156: -6.4199999999999993e-002 | AE156: 99.29 | AF156: 99.98 | AG156: 0.36 | AH156: AAA | AI156: 3.6499999999999998e-002 | AJ156: =H156+100*O156 -> 124.34 | AK156: 122.5 | AL156: 60 | AM156: 22.5 | AN156: 23 | AO156: -3.0000000000000001e-003 | AP156: 11 | AQ156: 蒙电转债!
A157: 230 | B157: 128082 | C157: 华锋转债! | D157: 2806 | E157: 华锋股份 | F157: 电子 | G157: 元器件制 | H157: 115.501 | I157: -7.3000000000000001e-003 | J157: -9.8999999999999991e-003 | K157: 10.03 | L157: -2.53e-002 | M157: 121.4 | N157: 9.13 | O157: 5.0999999999999997e-002 | P157: 109.86 | Q157: 转股中 | R157: 4.48年 | S157: 2.48年 | T157: 3.12 | U157: 22 | V157: 5.9999999999999998e-002 | W157: 0.17300000000000001 | X157: 0.19 | Y157: 18 | Z157: 1.82 | AA157: 1.15e-002 | AB157: 3.2000000000000002e-003 | AC157: -3.7599999999999995e-002 | AD157: -4.07e-002 | AE157: 86.48 | AF157: 88.53 | AG157: 0.68 | AH157: A+ | AI157: 7.51e-002 | AJ157: =H157+100*O157 -> 120.601 | AK157: 121.1 | AL157: 46 | AM157: 32.6 | AN157: 95 | AO157: -6.6000000000000003e-002 | AP157: 55 | AQ157: 华锋转债!
A158: 240 | B158: 110060 | C158: 天路转债! | D158: 600326 | E158: 西藏天路 | F158: 建筑 | G158: 水泥 | H158: 109.5 | I158: -5.0000000000000001e-004 | J158: -2.5000000000000001e-003 | K158: 6.87 | L158: -5.7999999999999996e-003 | M158: 114.9 | N158: 7.16 | O158: 0.14099999999999999 | P158: 95.95 | Q158: 转股中 | R158: 4.38年 | S158: 2.38年 | T158: 7.06 | U158: 12 | V158: 1.6e-002 | W158: 0.11199999999999999 | X158: 0.107 | Y158: 63 | Z158: 1.49 | AA158: 1.1299999999999999e-002 | AB158: 5.1000000000000004e-003 | AC158: -2.2499999999999999e-002 | AD158: -2.5000000000000001e-002 | AE158: 92.97 | AF158: 95.89 | AG158: 0.52 | AH158: AA | AI158: 4.3099999999999999e-002 | AJ158: =H158+100*O158 -> 123.59999999999999 | AK158: 123.1 | AL158: 68 | AM158: 27.2 | AN158: 41 | AO158: -3.9e-002 | AP158: 13 | AQ158: 天路转债!
A159: 219 | B159: 128090 | C159: 汽模转2 | D159: 2510 | E159: 天汽模 | F159: 汽车 | G159: 零部件制 | H159: 109.299 | I159: 2.e-003 | J159: -3.3e-003 | K159: 4.1 | L159: -2.3999999999999998e-003 | M159: 114.9 | N159: 4.21 | O159: 0.122 | P159: 97.39 | Q159: 转股中 | R159: 4.54年 | S159: 2.55年 | T159: 3.1 | U159: 12 | V159: 3.7000000000000005e-002 | W159: 8.0000000000000002e-002 | X159: 7.8e-002 | Y159: 39 | Z159: 1.92 | AA159: 1.1299999999999999e-002 | AB159: 5.3e-003 | AC159: -2.0400000000000001e-002 | AD159: -2.2799999999999997e-002 | AE159: 92.33 | AF159: 95.22 | AG159: 0.53 | AH159: AA | AI159: 4.3099999999999999e-002 | AJ159: =H159+100*O159 -> 121.49900000000001 | AK159: 121.2 | AL159: 47 | AM159: 26 | AN159: 35 | AO159: 1.e-003 | AP159: 28 | AQ159: 汽模转2
A160: 88 | B160: 123075 | C160: 贝斯转债! | D160: 300580 | E160: 贝斯特 | F160: 汽车 | G160: 零部件制 | H160: 108.91 | I160: 9.300000000000001e-003 | J160: -1.8200000000000001e-002 | K160: 19.12 | L160: -1.7000000000000001e-002 | M160: 115.5 | N160: 23.74 | O160: 0.35200000000000004 | P160: 80.54 | Q160: 转股中 | R160: 5.39年 | S160: 3.39年 | T160: 6 | U160: 14 | V160: 2.1000000000000001e-002 | W160: 0.157 | X160: 0.126 | Y160: 38 | Z160: 2.22 | AA160: 1.1200000000000002e-002 | AB160: 6.0000000000000001e-003 | AC160: -1.34e-002 | AD160: -1.55e-002 | AE160: 83.12 | AF160: 82.76 | AG160: 0.53 | AH160: AA- | AI160: 6.5199999999999994e-002 | AJ160: =H160+100*O160 -> 144.11000000000001 | AK160: 137.3 | AL160: 216 | AM160: 54.2 | AN160: 269 | AO160: -1.1000000000000001e-002 | AP160: 8 | AQ160: 贝斯转债!
A161: 232 | B161: 128081 | C161: 海亮转债! | D161: 2203. | E161: 海亮股份 | F161: 有色金属 | G161: 铜金属 | H161: 109.718 | I161: 2.0000000000000001e-004 | J161: 5.3e-003 | K161: 10.32 | L161: 8.8000000000000005e-003 | M161: 114.9 | N161: 9.76 | O161: 3.7999999999999999e-002 | P161: 105.74 | Q161: 转股中 | R161: 4.44年 | S161: 2.45年 | T161: 30.1 | U161: 33 | V161: 1.e-002 | W161: 0.14899999999999999 | X161: 0.157 | Y161: 202 | Z161: 2.13 | AA161: 1.06e-002 | AB161: 4.5999999999999999e-003 | AC161: -2.2700000000000001e-002 | AD161: -2.5099999999999997e-002 | AE161: 92.71 | AF161: 95.62 | AG161: 0.62 | AH161: AA | AI161: 4.3099999999999999e-002 | AJ161: =H161+100*O161 -> 113.518 | AK161: 113.7 | AL161: 12 | AM161: 18.1 | AN161: 8 | AO161: 6.0000000000000001e-003 | AP161: 53 | AQ161: 海亮转债!
A162: 96 | B162: 123071 | C162: 天能转债! | D162: 300569 | E162: 天能重工 | F162: 能源电力 | G162: 风能 | H162: 114.6 | I162: 2.9999999999999997e-004 | J162: -1.49e-002 | K162: 14.18 | L162: -2.1400000000000002e-002 | M162: 121.1 | N162: 13.4 | O162: 8.3000000000000004e-002 | P162: 105.82 | Q162: 转股中 | R162: 5.36年 | S162: 3.36年 | T162: 7 | U162: 5.6 | V162: 6.9999999999999993e-003 | W162: 0.12300000000000001 | X162: 0.13100000000000001 | Y162: 57 | Z162: 2.39 | AA162: 1.06e-002 | AB162: 3.7000000000000002e-003 | AC162: -2.7300000000000001e-002 | AD162: -2.9399999999999999e-002 | AE162: 83.44 | AF162: 86.96 | AG162: 0.68 | AH162: AA- | AI162: 6.5199999999999994e-002 | AJ162: =H162+100*O162 -> 122.89999999999999 | AK162: 123.4 | AL162: 70 | AM162: 36.4 | AN162: 131 | AO162: 2.7000000000000003e-002 | AP162: 13 | AQ162: 天能转债!
A163: 222 | B163: 113030 | C163: 东风转债! | D163: 601515 | E163: 东风股份 | F163: 造纸包装 | G163: 包装材料 | H163: 111.76 | I163: -4.7999999999999996e-003 | J163: 5.6999999999999993e-003 | K163: 6.43 | L163: 1.6000000000000001e-003 | M163: 116.9 | N163: 6.45 | O163: 0.121 | P163: 99.69 | Q163: 转股中 | R163: 4.53年 | S163: 2.54年 | T163: 2.95 | U163: 12 | V163: 3.7000000000000005e-002 | W163: 3.4000000000000002e-002 | X163: 3.4000000000000002e-002 | Y163: 86 | Z163: 1.86 | AA163: 1.0200000000000001e-002 | AB163: 3.4999999999999996e-003 | AC163: -2.86e-002 | AD163: -3.0899999999999997e-002 | AE163: 92.36 | AF163: 96.91 | AG163: 0.54 | AH163: AA | AI163: 4.3099999999999999e-002 | AJ163: =H163+100*O163 -> 123.86 | AK163: 123.8 | AL163: 77 | AM163: 26.9 | AN163: 40 | AO163: -3.6000000000000004e-002 | AP163: 17 | AQ163: 东风转债!
A164: 221 | B164: 123038 | C164: 联得转债! | D164: 300545 | E164: 联得装备 | F164: 机械装备 | G164: 专用设备 | H164: 113.37 | I164: 2.3e-003 | J164: -5.6999999999999993e-003 | K164: 21.39 | L164: -6.0000000000000001e-003 | M164: 118.6 | N164: 24.07 | O164: 0.27600000000000002 | P164: 88.87 | Q164: 转股中 | R164: 4.54年 | S164: 2.54年 | T164: 1.47 | U164: 12 | V164: 7.2000000000000008e-002 | W164: 3.9e-002 | X164: 3.4000000000000002e-002 | Y164: 38 | Z164: 3.93 | AA164: 1.0200000000000001e-002 | AB164: 3.0000000000000001e-003 | AC164: -3.2199999999999999e-002 | AD164: -3.4799999999999998e-002 | AE164: 85.56 | AF164: 86.04 | AG164: 0.56 | AH164: A+ | AI164: 7.51e-002 | AJ164: =H164+100*O164 -> 140.97 | AK164: 137.9 | AL164: 222 | AM164: 51.8 | AN164: 259 | AO164: 1.2e-002 | AP164: 19 | AQ164: 联得转债!
A165: 16 | B165: 123107 | C165: 温氏转债! | D165: 300498 | E165: 温氏股份 | F165: 农业 | G165: 畜牧业 | H165: 106.65 | I165: 5.0000000000000001e-003 | J165: -7.6e-003 | K165: 14.27 | L165: -6.3e-003 | M165: 113 | N165: 17.82 | O165: 0.33200000000000002 | P165: 80.08 | Q165: 3月29天 | R165: 5.79年 | S165: 3.80年 | T165: 93 | U165: 59 | V165: 6.0000000000000001e-003 | W165: 0.10199999999999999 | X165: 8.199999999999999e-002 | Y165: 909 | Z165: 1.97 | AA165: 1.0200000000000001e-002 | AB165: 6.0999999999999995e-003 | AC165: -7.6e-003 | AD165: -9.300000000000001e-003 | AE165: 88.97 | AF165: 90.77 | AG165: 0.4 | AH165: AAA | AI165: 3.9199999999999999e-002 | AJ165: =H165+100*O165 -> 139.85000000000002 | AK165: 133.2 | AL165: 179 | AM165: 42.4 | AN165: 193 | AO165: 8.0000000000000002e-003 | AP165: 9 | AQ165: 温氏转债!
A166: 334 | B166: 128034 | C166: 江银转债! | D166: 2807 | E166: 江阴银行 | F166: 金融 | G166: 银行行业 | H166: 105.541 | I166: 2.0000000000000001e-004 | J166: -4.3e-003 | K166: 3.95 | L166: -1.e-002 | M166: 108.3 | N166: 4.32 | O166: 0.154 | P166: 91.44 | Q166: 转股中 | R166: 2.63年 | S166: 无权 | T166: 17.6 | U166: 7.1 | V166: 4.0000000000000001e-003 | W166: 0.20499999999999999 | X166: 0.187 | Y166: 86 | Z166: 0.72 | AA166: 1.e-002 | AB166: 4.0000000000000001e-003 | AC166: 无权 | AD166: 无权 | AE166: 无权 | AF166: 98.18 | AG166: 0.4 | AH166: AA+ | AI166: 3.85e-002 | AJ166: =H166+100*O166 -> 120.941 | AK166: 119.6 | AL166: 32 | AM166: 21.5 | AN166: 16 | AO166: -2.5000000000000001e-002 | AP166: 25 | AQ166: 江银转债!
A167: 196 | B167: 123045 | C167: 雷迪转债 | D167: 300652 | E167: 雷迪克 | F167: 汽车 | G167: 零部件制 | H167: 113.512 | I167: -5.0000000000000001e-004 | J167: -2.3999999999999998e-003 | K167: 19.3 | L167: -4.5999999999999999e-003 | M167: 118.9 | N167: 20.13 | O167: 0.184 | P167: 95.88 | Q167: 转股中 | R167: 4.75年 | S167: 2.75年 | T167: 1.66 | U167: 20 | V167: 0.10400000000000001 | W167: 9.1999999999999998e-002 | X167: 8.8000000000000009e-002 | Y167: 18 | Z167: 1.91 | AA167: 1.e-002 | AB167: 3.0000000000000001e-003 | AC167: -2.9600000000000001e-002 | AD167: -3.2199999999999999e-002 | AE167: 84.44 | AF167: 84.98 | AG167: 0.63 | AH167: A+ | AI167: 7.51e-002 | AJ167: =H167+100*O167 -> 131.91200000000001 | AK167: 131.1 | AL167: 151 | AM167: 46.2 | AN167: 222 | AO167: 6.2e-002 | AP167: 34 | AQ167: 雷迪转债
A168: 306 | B168: 128048 | C168: 张行转债 | D168: 2839 | E168: 张家港行 | F168: 金融 | G168: 银行行业 | H168: 109.602 | I168: -8.5000000000000006e-003 | J168: 2.5999999999999999e-003 | K168: 5.55 | L168: -1.2500000000000001e-002 | M168: 113.3 | N168: 5.76 | O168: 0.13699999999999998 | P168: 96.35 | Q168: 转股中 | R168: 3.42年 | S168: 无权 | T168: 25 | U168: 42 | V168: 1.4999999999999999e-002 | W168: 0.249 | X168: 0.23999999999999999 | Y168: 100 | Z168: 0.9 | AA168: 9.8999999999999991e-003 | AB168: 2.8000000000000004e-003 | AC168: 无权 | AD168: 无权 | AE168: 无权 | AF168: 99.32 | AG168: 0.48 | AH168: AA+ | AI168: 4.0099999999999997e-002 | AJ168: =H168+100*O168 -> 123.30200000000001 | AK168: 122.8 | AL168: 66 | AM168: 23.5 | AN168: 25 | AO168: -1.7000000000000001e-002 | AP168: 12 | AQ168: 张行转债
A169: 87 | B169: 110076 | C169: 华海转债! | D169: 600521 | E169: XD华海药 | F169: 医药 | G169: 医药行业 | H169: 109.24 | I169: 5.9999999999999995e-004 | J169: -2.0000000000000001e-004 | K169: 20.95 | L169: 2.3999999999999998e-003 | M169: 115.1 | N169: 34.46 | O169: 0.79700000000000004 | P169: 60.8 | Q169: 转股中 | R169: 5.39年 | S169: 3.39年 | T169: 18.4 | U169: 0.7 | V169: 0. | W169: 5.9999999999999998e-002 | X169: 3.7000000000000005e-002 | Y169: 305 | Z169: 4.67 | AA169: 9.8999999999999991e-003 | AB169: 4.7999999999999996e-003 | AC169: -1.49e-002 | AD169: -1.6799999999999999e-002 | AE169: 88.94 | AF169: 91.56 | AG169: 0.17 | AH169: AA | AI169: 4.4199999999999996e-002 | AJ169: =H169+100*O169 -> 188.94 | AK169: 157.7 | AL169: 311 | AM169: 66.1 | AN169: 311 | AO169: 9.0000000000000011e-003 | AP169: 7 | AQ169: 华海转债!
A170: 323 | B170: 128039 | C170: 三力转债! | D170: 2224 | E170: 三 力 士 | F170: 机械装备 | G170: 专用设备 | H170: 105.785 | I170: 8.3999999999999995e-003 | J170: -5.4000000000000003e-003 | K170: 4.84 | L170: 8.3000000000000001e-003 | M170: 108.8 | N170: 5.81 | O170: 0.27000000000000002 | P170: 83.3 | Q170: 转股中 | R170: 2.99年 | S170: 0.99年 | T170: 2.03 | U170: 6.3 | V170: 2.8999999999999998e-002 | W170: 5.7000000000000002e-002 | X170: 4.8000000000000001e-002 | Y170: 35 | Z170: 1.53 | AA170: 9.5999999999999992e-003 | AB170: 4.0000000000000001e-003 | AC170: -3.4700000000000002e-002 | AD170: -3.73e-002 | AE170: 94.68 | AF170: 90.97 | AG170: 0.36 | AH170: AA- | AI170: 6.25e-002 | AJ170: =H170+100*O170 -> 132.785 | AK170: 128.3 | AL170: 120 | AM170: 33.6 | AN170: 106 | AO170: -2.e-003 | AP170: 28 | AQ170: 三力转债!
A171: 292 | B171: 113528 | C171: 长城转债! | D171: 603897 | E171: 长城科技 | F171: 机械装备 | G171: 专用设备 | H171: 112.8 | I171: 3.3300000000000003e-002 | J171: 2.0499999999999997e-002 | K171: 22.28 | L171: 0.10000000000000001 | M171: 116.8 | N171: 23.35 | O171: 0.182 | P171: 95.42 | Q171: 转股中 | R171: 3.72年 | S171: 1.72年 | T171: 6.34 | U171: 235 | V171: 0.32899999999999996 | W171: 0.159 | X171: 0.152 | Y171: 40 | Z171: 2.03 | AA171: 9.5999999999999992e-003 | AB171: 1.5e-003 | AC171: -4.6699999999999998e-002 | AD171: -4.9800000000000004e-002 | AE171: 91.82 | AF171: 93.16 | AG171: 0.54 | AH171: AA- | AI171: 6.4100000000000004e-002 | AJ171: =H171+100*O171 -> 131. | AK171: 130.2 | AL171: 137 | AM171: 37 | AN171: 140 | AO171: 0.17100000000000001 | AP171: 39 | AQ171: 长城转债!
A172: 29 | B172: 123101 | C172: 拓斯转债! | D172: 300607 | E172: 拓斯达 | F172: 机械装备 | G172: 机器人及 | H172: 109.099 | I172: -2.5000000000000001e-003 | J172: -7.6e-003 | K172: 32.26 | L172: -2.7699999999999999e-002 | M172: 115.1 | N172: 42.25 | O172: 0.42899999999999999 | P172: 76.36 | Q172: 3月7天 | R172: 5.74年 | S172: 3.75年 | T172: 6.7 | U172: 1.6 | V172: 2.e-003 | W172: 7.8e-002 | X172: 5.9999999999999998e-002 | Y172: 86 | Z172: 3.82 | AA172: 9.4999999999999998e-003 | AB172: 4.7999999999999996e-003 | AC172: -1.32e-002 | AD172: -1.4999999999999999e-002 | AE172: 87.6 | AF172: 90.18 | AG172: 0.37 | AH172: AA | AI172: 4.4199999999999996e-002 | AJ172: =H172+100*O172 -> 151.999 | AK172: 141.8 | AL172: 252 | AM172: 51.7 | AN172: 258 | AO172: -3.0000000000000001e-003 | AP172: 4 | AQ172: 拓斯转债!
A173: 130 | B173: 128124 | C173: 科华转债! | D173: 2022 | E173: 科华生物 | F173: 医药 | G173: 生物制药 | H173: 105.208 | I173: -2.0000000000000001e-004 | J173: -2.3999999999999998e-003 | K173: 17.47 | L173: -6.3e-003 | M173: 110.3 | N173: 21.51 | O173: 0.29499999999999998 | P173: 81.22 | Q173: 转股中 | R173: 5年46天 | S173: 3年47天 | T173: 7.38 | U173: 6.4 | V173: 8.0000000000000002e-003 | W173: 8.199999999999999e-002 | X173: 6.7000000000000004e-002 | Y173: 90 | Z173: 2.7 | AA173: 9.3999999999999986e-003 | AB173: 5.6000000000000008e-003 | AC173: -6.3e-003 | AD173: -8.1000000000000013e-003 | AE173: 89.48 | AF173: 88.72 | AG173: 0.42 | AH173: AA | AI173: 4.4199999999999996e-002 | AJ173: =H173+100*O173 -> 134.708 | AK173: 129.2 | AL173: 128 | AM173: 39.7 | AN173: 168 | AO173: -5.5e-002 | AP173: 19 | AQ173: 科华转债!
A174: 175 | B174: 128107 | C174: 交科转债 | D174: 2061 | E174: 浙江交科 | F174: 建筑 | G174: 建筑工程 | H174: 110.415 | I174: 4.0999999999999995e-003 | J174: 1.03e-002 | K174: 5.54 | L174: 2.4e-002 | M174: 114.9 | N174: 5.36 | O174: 6.8000000000000005e-002 | P174: 103.36 | Q174: 转股中 | R174: 4.86年 | S174: 2.86年 | T174: 25 | U174: 51 | V174: 1.8000000000000002e-002 | W174: 0.32799999999999996 | X174: 0.33899999999999997 | Y174: 76 | Z174: 0.89 | AA174: 8.3999999999999995e-003 | AB174: 2.8000000000000004e-003 | AC174: -2.1600000000000001e-002 | AD174: -2.3700000000000002e-002 | AE174: 91.88 | AF174: 95.25 | AG174: 0.6 | AH174: AA+ | AI174: 4.0099999999999997e-002 | AJ174: =H174+100*O174 -> 117.215 | AK174: 117.5 | AL174: 20 | AM174: 22.2 | AN174: 21 | AO174: 3.3000000000000002e-002 | AP174: 16 | AQ174: 交科转债
A175: 215 | B175: 127015 | C175: 希望转债!! | D175: 876 | E175: 新 希 望 | F175: 农业 | G175: 畜牧业 | H175: 106.1 | I175: -2.8000000000000004e-003 | J175: -1.1000000000000001e-003 | K175: 13.91 | L175: -1.9699999999999999e-002 | M175: 110 | N175: 19.75 | O175: 0.50600000000000001 | P175: 70.43 | Q175: 转股中 | R175: 4.56年 | S175: 2.56年 | T175: 9.5 | U175: 9.6 | V175: 1.e-002 | W175: 1.4999999999999999e-002 | X175: 1.1000000000000001e-002 | Y175: 627 | Z175: 1.69 | AA175: 8.1000000000000013e-003 | AB175: 3.9000000000000003e-003 | AC175: -1.21e-002 | AD175: -1.3899999999999999e-002 | AE175: 92.77 | AF175: 93.01 | AG175: 0.2 | AH175: AAA | AI175: 3.8100000000000002e-002 | AJ175: =H175+100*O175 -> 156.69999999999999 | AK175: 141.8 | AL175: 251 | AM175: 48.8 | AN175: 235 | AO175: -9.1999999999999998e-002 | AP175: 27 | AQ175: 希望转债!!
A176: 216 | B176: 128093 | C176: 百川转债! | D176: 2455 | E176: 百川股份 | F176: 化工 | G176: 化工 | H176: 125.399 | I176: 3.2500000000000001e-002 | J176: 6.8999999999999999e-003 | K176: 7.22 | L176: 5.5599999999999997e-002 | M176: 129.8 | N176: 5.77 | O176: 2.e-003 | P176: 125.13 | Q176: 转股中 | R176: 4.56年 | S176: 2.56年 | T176: 4 | U176: 359 | V176: 0.71400000000000008 | W176: 0.106 | X176: 0.13300000000000001 | Y176: 38 | Z176: 2.75 | AA176: 7.9000000000000008e-003 | AB176: -2.8000000000000004e-003 | AC176: -5.7800000000000004e-002 | AD176: -6.2100000000000002e-002 | AE176: 90.48 | AF176: 98.77 | AG176: 0.71 | AH176: AA- | AI176: 6.4100000000000004e-002 | AJ176: =H176+100*O176 -> 125.599 | AK176: 125.7 | AL176: 97 | AM176: 26.9 | AN176: 39 | AO176: 2.6000000000000002e-002 | AP176: 49 | AQ176: 百川转债!
A177: 32 | B177: 128144 | C177: 利民转债 | D177: 2734 | E177: 利民股份 | F177: 化工 | G177: 农化 | H177: 109.3 | I177: 0. | J177: -4.0000000000000001e-003 | K177: 12.24 | L177: -8.1000000000000013e-003 | M177: 114.1 | N177: 13.98 | O177: 0.248 | P177: 87.55 | Q177: 2月26天 | R177: 5.72年 | S177: 3.72年 | T177: 9.8 | U177: 1.9 | V177: 2.e-003 | W177: 0.215 | X177: 0.188 | Y177: 46 | Z177: 1.66 | AA177: 7.7000000000000002e-003 | AB177: 3.2000000000000002e-003 | AC177: -1.5600000000000001e-002 | AD177: -1.7000000000000001e-002 | AE177: 87.05 | AF177: 89.43 | AG177: 0.49 | AH177: AA | AI177: 4.4199999999999996e-002 | AJ177: =H177+100*O177 -> 134.09999999999999 | AK177: 131 | AL177: 150 | AM177: 41.6 | AN177: 185 | AO177: -2.6000000000000002e-002 | AP177: 5 | AQ177: 利民转债
A178: 347 | B178: 128021 | C178: 兄弟转债!! | D178: 2562 | E178: 兄弟科技 | F178: 医药 | G178: 原料药 | H178: 106.83 | I178: -1.e-004 | J178: -1.2999999999999999e-003 | K178: 4.48 | L178: -4.4000000000000003e-003 | M178: 108.8 | N178: 5.19 | O178: 0.23800000000000002 | P178: 86.32 | Q178: 转股中 | R178: 2.47年 | S178: 0.47年 | T178: 2.65 | U178: 3.4 | V178: 1.2e-002 | W178: 5.5999999999999994e-002 | X178: 4.8000000000000001e-002 | Y178: 48 | Z178: 1.61 | AA178: 7.6e-003 | AB178: 8.0000000000000004e-004 | AC178: -7.7300000000000008e-002 | AD178: -8.1699999999999995e-002 | AE178: 98.98 | AF178: 98.58 | AG178: 0.32 | AH178: AA | AI178: 4.1500000000000002e-002 | AJ178: =H178+100*O178 -> 130.63 | AK178: 127.3 | AL178: 114 | AM178: 28.4 | AN178: 45 | AO178: -1.3999999999999999e-002 | AP178: 14 | AQ178: 兄弟转债!!
A179: 68 | B179: 123082 | C179: 北陆转债! | D179: 300016 | E179: 北陆药业 | F179: 医药 | G179: 化学制药 | H179: 116.861 | I179: -1.47e-002 | J179: 2.8999999999999998e-003 | K179: 9.95 | L179: -1.5800000000000002e-002 | M179: 121.7 | N179: 8.8 | O179: 3.4000000000000002e-002 | P179: 113.07 | Q179: 转股中 | R179: 5.49年 | S179: 3.49年 | T179: 5 | U179: 13 | V179: 2.3e-002 | W179: 0.10199999999999999 | X179: 0.115 | Y179: 49 | Z179: 2.96 | AA179: 7.6e-003 | AB179: 8.0000000000000004e-004 | AC179: -3.0099999999999998e-002 | AD179: -3.2400000000000005e-002 | AE179: 80.26 | AF179: 82.14 | AG179: 0.75 | AH179: A+ | AI179: 7.6200000000000004e-002 | AJ179: =H179+100*O179 -> 120.26100000000001 | AK179: 120.7 | AL179: 38 | AM179: 38.5 | AN179: 153 | AO179: -6.9999999999999993e-003 | AP179: 10 | AQ179: 北陆转债!
A180: 231 | B180: 110062 | C180: 烽火转债! | D180: 600498 | E180: 烽火通信 | F180: 通信互联 | G180: 通信设备 | H180: 107.34 | I180: -5.3e-003 | J180: 1.e-003 | K180: 18.59 | L180: -1.2199999999999999e-002 | M180: 110.8 | N180: 22.93 | O180: 0.32400000000000001 | P180: 81.07 | Q180: 转股中 | R180: 4.47年 | S180: 2.48年 | T180: 30.9 | U180: 8.2 | V180: 2.e-003 | W180: 0.14699999999999999 | X180: 0.11900000000000001 | Y180: 210 | Z180: 1.95 | AA180: 7.3000000000000001e-003 | AB180: 2.7000000000000001e-003 | AC180: -1.4499999999999999e-002 | AD180: -1.6899999999999998e-002 | AE180: 93.67 | AF180: 94.05 | AG180: 0.35 | AH180: AAA | AI180: 3.8100000000000002e-002 | AJ180: =H180+100*O180 -> 139.74000000000001 | AK180: 133.6 | AL180: 182 | AM180: 39.6 | AN180: 167 | AO180: 3.7999999999999999e-002 | AP180: 19 | AQ180: 烽火转债!
A181: 170 | B181: 127017 | C181: 万青转债 | D181: 789 | E181: 万年青 | F181: 建筑 | G181: 水泥 | H181: 113.854 | I181: -6.5000000000000006e-003 | J181: -5.6999999999999993e-003 | K181: 12.17 | L181: -2.7999999999999997e-002 | M181: 118 | N181: 13.46 | O181: 0.25900000000000001 | P181: 90.42 | Q181: 转股中 | R181: 4.98年 | S181: 2.98年 | T181: 10 | U181: 1.4 | V181: 1.e-003 | W181: 0.10300000000000001 | X181: 9.3000000000000013e-002 | Y181: 97 | Z181: 1.48 | AA181: 7.3000000000000001e-003 | AB181: 1.e-003 | AC181: -3.0600000000000002e-002 | AD181: -3.2500000000000001e-002 | AE181: 91.4 | AF181: 97.37 | AG181: 0.44 | AH181: AA+ | AI181: 4.0099999999999997e-002 | AJ181: =H181+100*O181 -> 139.75399999999999 | AK181: 137.3 | AL181: 217 | AM181: 39.9 | AN181: 171 | AO181: -8.5000000000000006e-002 | AP181: 9 | AQ181: 万青转债
A182: 90 | B182: 113606 | C182: 荣泰转债 | D182: 603579 | E182: 荣泰健康 | F182: 机械装备 | G182: 专用设备 | H182: 116.67 | I182: -8.9999999999999998e-004 | J182: -6.4000000000000003e-003 | K182: 35.05 | L182: -1.0700000000000001e-002 | M182: 121.2 | N182: 33.32 | O182: 0.109 | P182: 105.19 | Q182: 转股中 | R182: 5.38年 | S182: 3.39年 | T182: 6 | U182: 8.9 | V182: 1.3000000000000001e-002 | W182: 0.122 | X182: 0.129 | Y182: 49 | Z182: 2.93 | AA182: 7.3000000000000001e-003 | AB182: 5.0000000000000001e-004 | AC182: -3.1899999999999998e-002 | AD182: -3.4000000000000002e-002 | AE182: 83.42 | AF182: 86.93 | AG182: 0.68 | AH182: AA- | AI182: 6.5199999999999994e-002 | AJ182: =H182+100*O182 -> 127.57000000000001 | AK182: 128.1 | AL182: 118 | AM182: 41.2 | AN182: 182 | AO182: -1.3999999999999999e-002 | AP182: 10 | AQ182: 荣泰转债
A183: 46 | B183: 127028 | C183: 英特转债! | D183: 411 | E183: 英特集团 | F183: 医药 | G183: 医药商业 | H183: 108.66 | I183: -8.6999999999999994e-003 | J183: -3.9000000000000003e-003 | K183: 13.47 | L183: -2.0400000000000001e-002 | M183: 113.1 | N183: 13.4 | O183: 8.1000000000000003e-002 | P183: 100.52 | Q183: 30天 | R183: 5.57年 | S183: 3.57年 | T183: 6 | U183: 28 | V183: 4.2000000000000003e-002 | W183: 0.17899999999999999 | X183: 0.17999999999999999 | Y183: 34 | Z183: 1.97 | AA183: 7.3000000000000001e-003 | AB183: 3.0000000000000001e-003 | AC183: -1.2800000000000001e-002 | AD183: -1.46e-002 | AE183: 89.21 | AF183: 90.71 | AG183: 0.62 | AH183: AA+ | AI183: 4.1200000000000001e-002 | AJ183: =H183+100*O183 -> 116.75999999999999 | AK183: 116.8 | AL183: 17 | AM183: 26.1 | AN183: 36 | AO183: -6.8000000000000005e-002 | AP183: 19 | AQ183: 英特转债!
A184: 99 | B184: 128135 | C184: 洽洽转债! | D184: 2557 | E184: 洽洽食品 | F184: 食品饮料 | G184: 休闲食品 | H184: 116 | I184: -9.5999999999999992e-003 | J184: 1.7000000000000001e-003 | K184: 46.88 | L184: -2.46e-002 | M184: 120.2 | N184: 60.03 | O184: 0.48499999999999999 | P184: 78.09 | Q184: 转股中 | R184: 5.36年 | S184: 3.36年 | T184: 13.4 | U184: 15 | V184: 1.e-002 | W184: 5.5999999999999994e-002 | X184: 4.4000000000000004e-002 | Y184: 238 | Z184: 5.56 | AA184: 6.8000000000000005e-003 | AB184: 2.9999999999999997e-004 | AC184: -3.1600000000000003e-002 | AD184: -3.3500000000000002e-002 | AE184: 89.17 | AF184: 95.76 | AG184: 0.32 | AH184: AA | AI184: 4.4199999999999996e-002 | AJ184: =H184+100*O184 -> 164.5 | AK184: 153.9 | AL184: 302 | AM184: 58.1 | AN184: 290 | AO184: -9.6999999999999989e-002 | AP184: 11 | AQ184: 洽洽转债!
A185: 212 | B185: 113563 | C185: 柳药转债! | D185: 603368 | E185: 柳药股份 | F185: 医药 | G185: 医药商业 | H185: 109.55 | I185: -4.0000000000000001e-003 | J185: -2.5000000000000001e-003 | K185: 19.64 | L185: -1.7000000000000001e-002 | M185: 112.9 | N185: 23.87 | O185: 0.33100000000000002 | P185: 82.28 | Q185: 转股中 | R185: 4.60年 | S185: 2.60年 | T185: 8.02 | U185: 0.4 | V185: 1.e-003 | W185: 0.113 | X185: 9.3000000000000013e-002 | Y185: 71 | Z185: 1.38 | AA185: 6.7000000000000002e-003 | AB185: 1.5e-003 | AC185: -2.0899999999999998e-002 | AD185: -2.3199999999999998e-002 | AE185: 92.11 | AF185: 93.36 | AG185: 0.38 | AH185: AA | AI185: 4.3099999999999999e-002 | AJ185: =H185+100*O185 -> 142.65000000000001 | AK185: 136.8 | AL185: 214 | AM185: 43.5 | AN185: 200 | AO185: -5.0999999999999997e-002 | AP185: 17 | AQ185: 柳药转债!
A186: 92 | B186: 123073 | C186: 同和转债! | D186: 300636 | E186: 同和药业 | F186: 医药 | G186: 原料药 | H186: 118.277 | I186: -1.24e-002 | J186: -6.0000000000000001e-003 | K186: 16.72 | L186: -2.5099999999999997e-002 | M186: 122.4 | N186: 14.82 | O186: 4.8000000000000001e-002 | P186: 112.82 | Q186: 转股中 | R186: 5.37年 | S186: 3.38年 | T186: 3.59 | U186: 4.7 | V186: 1.1000000000000001e-002 | W186: 0.10400000000000001 | X186: 0.11800000000000001 | Y186: 34 | Z186: 2.74 | AA186: 6.5000000000000006e-003 | AB186: -5.9999999999999995e-004 | AC186: -3.4599999999999999e-002 | AD186: -3.6900000000000002e-002 | AE186: 80.9 | AF186: 83.29 | AG186: 0.74 | AH186: A+ | AI186: 7.6200000000000004e-002 | AJ186: =H186+100*O186 -> 123.077 | AK186: 123.7 | AL186: 75 | AM186: 40.4 | AN186: 176 | AO186: -7.6999999999999999e-002 | AP186: 11 | AQ186: 同和转债!
A187: 270 | B187: 113026 | C187: 核能转债! | D187: 601985 | E187: 中国核电 | F187: 能源电力 | G187: 核电 | H187: 106.85 | I187: -2.8000000000000004e-003 | J187: 4.4000000000000003e-003 | K187: 5.1 | L187: 3.9000000000000003e-003 | M187: 109.3 | N187: 5.86 | O187: 0.22800000000000001 | P187: 87.03 | Q187: 转股中 | R187: 3.84年 | S187: 1.84年 | T187: 78 | U187: 58 | V187: 6.9999999999999993e-003 | W187: 8.8000000000000009e-002 | X187: 7.5999999999999998e-002 | Y187: 890 | Z187: 1.44 | AA187: 6.0000000000000001e-003 | AB187: 1.5e-003 | AC187: -1.9199999999999998e-002 | AD187: -2.18e-002 | AE187: 95.41 | AF187: 94.93 | AG187: 0.41 | AH187: AAA | AI187: 3.8100000000000002e-002 | AJ187: =H187+100*O187 -> 129.65000000000001 | AK187: 126.7 | AL187: 104 | AM187: 31.3 | AN187: 79 | AO187: -2.5000000000000001e-002 | AP187: 44 | AQ187: 核能转债!
A188: 144 | B188: 128121 | C188: 宏川转债! | D188: 2930 | E188: 宏川智慧 | F188: 交通运输 | G188: 物流业 | H188: 110.2 | I188: -7.3000000000000001e-003 | J188: 6.0999999999999995e-003 | K188: 15.85 | L188: -2.5000000000000001e-003 | M188: 113.3 | N188: 20.24 | O188: 0.40700000000000003 | P188: 78.31 | Q188: 转股中 | R188: 5年35天 | S188: 3年36天 | T188: 6.7 | U188: 1.4 | V188: 2.e-003 | W188: 9.5000000000000001e-002 | X188: 7.400000000000001e-002 | Y188: 70 | Z188: 3.4 | AA188: 5.6000000000000008e-003 | AB188: 8.0000000000000004e-004 | AC188: -1.83e-002 | AD188: -2.0499999999999997e-002 | AE188: 84.66 | AF188: 82.72 | AG188: 0.47 | AH188: AA- | AI188: 6.5199999999999994e-002 | AJ188: =H188+100*O188 -> 150.90000000000001 | AK188: 142.1 | AL188: 256 | AM188: 57.4 | AN188: 285 | AO188: 1.7000000000000001e-002 | AP188: 5 | AQ188: 宏川转债!
A189: 26 | B189: 123104 | C189: 卫宁转债 | D189: 300253 | E189: 卫宁健康 | F189: 计算机及 | G189: 软件开发 | H189: 121.463 | I189: 8.0000000000000002e-003 | J189: 2.5000000000000001e-003 | K189: 16.11 | L189: 2.4199999999999999e-002 | M189: 125.1 | N189: 17.76 | O189: 0.33899999999999997 | P189: 90.71 | Q189: 3月13天 | R189: 5.76年 | S189: 3.76年 | T189: 9.7 | U189: 19 | V189: 1.6e-002 | W189: 2.7999999999999997e-002 | X189: 2.6000000000000002e-002 | Y189: 345 | Z189: 7.55 | AA189: 5.1999999999999998e-003 | AB189: -2.e-003 | AC189: -4.0000000000000001e-002 | AD189: -4.1599999999999998e-002 | AE189: 87.54 | AF189: 97.91 | AG189: 0.44 | AH189: AA | AI189: 4.4199999999999996e-002 | AJ189: =H189+100*O189 -> 155.363 | AK189: 152.2 | AL189: 299 | AM189: 54.3 | AN189: 270 | AO189: 2.6000000000000002e-002 | AP189: 4 | AQ189: 卫宁转债
A190: 43 | B190: 123093 | C190: 金陵转债 | D190: 300651 | E190: 金陵体育 | F190: 其他 | G190: 文化教育 | H190: 125.988 | I190: 3.9000000000000003e-003 | J190: 1.6500000000000001e-002 | K190: 43.59 | L190: 3.49e-002 | M190: 129.3 | N190: 49.19 | O190: 0.42200000000000004 | P190: 88.62 | Q190: 45天 | R190: 5.61年 | S190: 3.61年 | T190: 2.5 | U190: 159 | V190: 0.5 | W190: 4.4999999999999998e-002 | X190: 3.9e-002 | Y190: 56 | Z190: 8.14 | AA190: 4.7999999999999996e-003 | AB190: -3.7000000000000002e-003 | AC190: -4.4299999999999999e-002 | AD190: -4.7300000000000002e-002 | AE190: 80.95 | AF190: 86.72 | AG190: 0.58 | AH190: A+ | AI190: 7.6200000000000004e-002 | AJ190: =H190+100*O190 -> 168.18799999999999 | AK190: 163.4 | AL190: 315 | AM190: 76.6 | AN190: 323 | AO190: 1.3999999999999999e-002 | AP190: 6 | AQ190: 金陵转债
A191: 27 | B191: 123102 | C191: 华自转债 | D191: 300490 | E191: 华自科技 | F191: 机械装备 | G191: 机器人及 | H191: 123.5 | I191: -4.8499999999999995e-002 | J191: -3.2899999999999999e-002 | K191: 11.52 | L191: -0.109 | M191: 126.9 | N191: 9.26 | O191: -6.9999999999999993e-003 | P191: 124.41 | Q191: 3月9天 | R191: 5.75年 | S191: 3.75年 | T191: 6.7 | U191: 170 | V191: 0.20100000000000001 | W191: 0.22699999999999998 | X191: 0.28199999999999997 | Y191: 30 | Z191: 1.69 | AA191: 4.7999999999999996e-003 | AB191: -2.8999999999999998e-003 | AC191: -4.0999999999999995e-002 | AD191: -4.3299999999999998e-002 | AE191: 82.19 | AF191: 89.01 | AG191: 0.75 | AH191: AA- | AI191: 6.5199999999999994e-002 | AJ191: =H191+100*O191 -> 122.8 | AK191: 122.6 | AL191: 62 | AM191: 33.6 | AN191: 105 | AO191: 3.2000000000000001e-002 | AP191: 18 | AQ191: 华自转债
A192: 115 | B192: 128129 | C192: 青农转债! | D192: 2958 | E192: 青农商行 | F192: 金融 | G192: 银行行业 | H192: 109.7 | I192: -4.5000000000000005e-003 | J192: -7.000000000000001e-004 | K192: 4.4 | L192: -9.0000000000000011e-003 | M192: 112.2 | N192: 4.47 | O192: 0.114 | P192: 98.43 | Q192: 转股中 | R192: 5.20年 | S192: 无权 | T192: 50 | U192: 30 | V192: 5.0000000000000001e-003 | W192: 0.20499999999999999 | X192: 0.20100000000000001 | Y192: 244 | Z192: 0.89 | AA192: 4.4000000000000003e-003 | AB192: 1.e-004 | AC192: 无权 | AD192: 无权 | AE192: 无权 | AF192: 92.15 | AG192: 0.58 | AH192: AAA | AI192: 3.9199999999999999e-002 | AJ192: =H192+100*O192 -> 121.10000000000001 | AK192: 121 | AL192: 44 | AM192: 28.8 | AN192: 49 | AO192: -6.0000000000000001e-003 | AP192: 14 | AQ192: 青农转债!
A193: 248 | B193: 128074 | C193: 游族转债!! | D193: 2174 | E193: 游族网络 | F193: 通信互联 | G193: 互联网 | H193: 117.88 | I193: -9.7999999999999997e-003 | J193: 9.7999999999999997e-003 | K193: 16.98 | L193: -3.4700000000000002e-002 | M193: 119.9 | N193: 16.97 | O193: 0.17800000000000002 | P193: 100.06 | Q193: 转股中 | R193: 4.28年 | S193: 2.29年 | T193: 6.83 | U193: 123 | V193: 0.153 | W193: 4.4000000000000004e-002 | X193: 4.4000000000000004e-002 | Y193: 156 | Z193: 3.04 | AA193: 4.0999999999999995e-003 | AB193: -4.0000000000000001e-003 | AC193: -5.2600000000000001e-002 | AD193: -5.5e-002 | AE193: 93.34 | AF193: 100.45 | AG193: 0 | AH193: AA | AI193: 4.3099999999999999e-002 | AJ193: =H193+100*O193 -> 135.68000000000001 | AK193: 135.7 | AL193: 199 | AM193: 35.3 | AN193: 118 | AO193: 3.0000000000000001e-003 | AP193: 26 | AQ193: 游族转债!!
A194: 166 | B194: 123052 | C194: 飞鹿转债 | D194: 300665 | E194: 飞鹿股份 | F194: 化工 | G194: 化工 | H194: 124.6 | I194: -2.7000000000000001e-003 | J194: 2.0000000000000001e-004 | K194: 8.68 | L194: -3.4000000000000002e-003 | M194: 126.8 | N194: 7.05 | O194: 1.2e-002 | P194: 123.12 | Q194: 转股中 | R194: 4.98年 | S194: 2.98年 | T194: 1.53 | U194: 13 | V194: 6.8000000000000005e-002 | W194: 0.10199999999999999 | X194: 0.125 | Y194: 15 | Z194: 2.26 | AA194: 3.5999999999999999e-003 | AB194: -5.1999999999999998e-003 | AC194: -5.4199999999999998e-002 | AD194: -5.6799999999999996e-002 | AE194: 83.58 | AF194: 89.18 | AG194: 0.74 | AH194: A+ | AI194: 7.51e-002 | AJ194: =H194+100*O194 -> 125.8 | AK194: 126.1 | AL194: 100 | AM194: 36.9 | AN194: 137 | AO194: -0.16500000000000001 | AP194: 16 | AQ194: 飞鹿转债
A195: 63 | B195: 113043 | C195: 财通转债! | D195: 601108 | E195: 财通证券 | F195: 金融 | G195: 证券行业 | H195: 108.1 | I195: 0. | J195: -5.7999999999999996e-003 | K195: 10.71 | L195: -1.38e-002 | M195: 110.2 | N195: 13.13 | O195: 0.32500000000000001 | P195: 81.57 | Q195: 5.1天 | R195: 5.50年 | S195: 无权 | T195: 38 | U195: 49 | V195: 1.2e-002 | W195: 9.9000000000000005e-002 | X195: 8.1000000000000003e-002 | Y195: 384 | Z195: 1.68 | AA195: 3.5999999999999999e-003 | AB195: 1.e-004 | AC195: 无权 | AD195: 无权 | AE195: 无权 | AF195: 89.47 | AG195: 0.42 | AH195: AAA | AI195: 3.9199999999999999e-002 | AJ195: =H195+100*O195 -> 140.59999999999999 | AK195: 134.6 | AL195: 190 | AM195: 45.2 | AN195: 212 | AO195: -2.7000000000000003e-002 | AP195: 10 | AQ195: 财通转债!
A196: 182 | B196: 128106 | C196: 华统转债 | D196: 2840 | E196: 华统股份 | F196: 农业 | G196: 农产品加 | H196: 111.135 | I196: -6.8000000000000005e-003 | J196: 4.3e-003 | K196: 9.61 | L196: -4.0999999999999995e-003 | M196: 112.9 | N196: 9.4 | O196: 8.6999999999999994e-002 | P196: 102.23 | Q196: 转股中 | R196: 4.83年 | S196: 2.83年 | T196: 5.35 | U196: 4.3 | V196: 6.9999999999999993e-003 | W196: 0.124 | X196: 0.127 | Y196: 43 | Z196: 2.44 | AA196: 3.3e-003 | AB196: -1.5e-003 | AC196: -2.4e-002 | AD196: -2.6099999999999998e-002 | AE196: 91.22 | AF196: 92.45 | AG196: 0.62 | AH196: AA | AI196: 4.3099999999999999e-002 | AJ196: =H196+100*O196 -> 119.83500000000001 | AK196: 120 | AL196: 35 | AM196: 27.6 | AN196: 43 | AO196: -4.0000000000000001e-002 | AP196: 9 | AQ196: 华统转债
A197: 13 | B197: 123109 | C197: 昌红转债 | D197: 300151 | E197: 昌红科技 | F197: 机械装备 | G197: 专用设备 | H197: 119.002 | I197: -8.3000000000000001e-003 | J197: -1.6000000000000001e-003 | K197: 28.59 | L197: -1.4800000000000001e-002 | M197: 121 | N197: 28.06 | O197: 0.16800000000000001 | P197: 101.89 | Q197: 3月29天 | R197: 5.80年 | S197: 3.81年 | T197: 4.6 | U197: 5.5 | V197: 1.e-002 | W197: 3.2000000000000001e-002 | X197: 3.3000000000000002e-002 | Y197: 144 | Z197: 13.44 | AA197: 2.8999999999999998e-003 | AB197: -3.3e-003 | AC197: -3.3799999999999997e-002 | AD197: -3.56e-002 | AE197: 81.06 | AF197: 84.48 | AG197: 0.67 | AH197: AA- | AI197: 6.5199999999999994e-002 | AJ197: =H197+100*O197 -> 135.80199999999999 | AK197: 136.1 | AL197: 206 | AM197: 51.6 | AN197: 257 | AO197: -2.4e-002 | AP197: 4 | AQ197: 昌红转债
A198: 54 | B198: 128141 | C198: 旺能转债 | D198: 2034 | E198: 旺能环境 | F198: 城市公用 | G198: 三废处理 | H198: 113.576 | I198: 7.000000000000001e-004 | J198: -5.6000000000000008e-003 | K198: 17.11 | L198: -7.4999999999999997e-003 | M198: 115.1 | N198: 15.97 | O198: 5.9999999999999998e-002 | P198: 107.14 | Q198: 12天 | R198: 5.52年 | S198: 3.52年 | T198: 14 | U198: 19 | V198: 1.2e-002 | W198: 0.19399999999999998 | X198: 0.20800000000000002 | Y198: 72 | Z198: 1.52 | AA198: 2.5000000000000001e-003 | AB198: -2.3999999999999998e-003 | AC198: -2.4799999999999999e-002 | AD198: -2.6600000000000002e-002 | AE198: 88.47 | AF198: 91.07 | AG198: 0.65 | AH198: AA | AI198: 4.4199999999999996e-002 | AJ198: =H198+100*O198 -> 119.57599999999999 | AK198: 120 | AL198: 34 | AM198: 28.9 | AN198: 50 | AO198: -5.2999999999999999e-002 | AP198: 6 | AQ198: 旺能转债
A199: 45 | B199: 128143 | C199: 锋龙转债! | D199: 2931 | E199: 锋龙股份 | F199: 机械装备 | G199: 专用设备 | H199: 120.074 | I199: -1.43e-002 | J199: 4.1999999999999997e-003 | K199: 15.27 | L199: -1.29e-002 | M199: 121.7 | N199: 12.73 | O199: 1.e-003 | P199: 119.95 | Q199: 33天 | R199: 5.58年 | S199: 3.58年 | T199: 2.45 | U199: 77 | V199: 0.26000000000000001 | W199: 8.1000000000000003e-002 | X199: 9.6999999999999989e-002 | Y199: 30 | Z199: 3.46 | AA199: 2.5000000000000001e-003 | AB199: -4.1999999999999997e-003 | AC199: -3.6499999999999998e-002 | AD199: -3.8699999999999998e-002 | AE199: 79.74 | AF199: 81.61 | AG199: 0.78 | AH199: A+ | AI199: 7.6200000000000004e-002 | AJ199: =H199+100*O199 -> 120.17399999999999 | AK199: 120.2 | AL199: 36 | AM199: 38.6 | AN199: 154 | AO199: -9.6000000000000002e-002 | AP199: 10 | AQ199: 锋龙转债!
A200: 21 | B200: 128145 | C200: 日丰转债 | D200: 2953 | E200: 日丰股份 | F200: 家电 | G200: 零部件制 | H200: 113.988 | I200: -1.1000000000000001e-003 | J200: -5.8999999999999999e-003 | K200: 14.5 | L200: -9.5999999999999992e-003 | M200: 115.4 | N200: 13.66 | O200: 7.400000000000001e-002 | P200: 106.15 | Q200: 3月18天 | R200: 5.78年 | S200: 3.78年 | T200: 3.8 | U200: 4.7 | V200: 1.1000000000000001e-002 | W200: 0.10800000000000001 | X200: 0.114 | Y200: 35 | Z200: 2.36 | AA200: 2.2000000000000001e-003 | AB200: -2.5999999999999999e-003 | AC200: -2.3799999999999998e-002 | AD200: -2.5600000000000001e-002 | AE200: 81.04 | AF200: 80.69 | AG200: 0.73 | AH200: AA- | AI200: 6.5199999999999994e-002 | AJ200: =H200+100*O200 -> 121.38800000000001 | AK200: 121.8 | AL200: 54 | AM200: 40.8 | AN200: 178 | AO200: -0.20300000000000001 | AP200: 5 | AQ200: 日丰转债
A201: 97 | B201: 123072 | C201: 乐歌转债! | D201: 300729 | E201: 乐歌股份 | F201: 其他 | G201: 家居用品 | H201: 128.179 | I201: -7.000000000000001e-004 | J201: -2.2000000000000001e-003 | K201: 25.73 | L201: -3.0499999999999999e-002 | M201: 129.6 | N201: 56.12 | O201: 1.8 | P201: 45.85 | Q201: 转股中 | R201: 5.36年 | S201: 3.36年 | T201: 1.42 | U201: 62 | V201: 0.33700000000000002 | W201: 3.1e-002 | X201: 1.3999999999999999e-002 | Y201: 46 | Z201: 3.49 | AA201: 2.0999999999999999e-003 | AB201: -6.8000000000000005e-003 | AC201: -5.1399999999999994e-002 | AD201: -5.4699999999999999e-002 | AE201: 82.68 | AF201: 88.55 | AG201: 0.09 | AH201: A+ | AI201: 7.6200000000000004e-002 | AJ201: =H201+100*O201 -> 308.17899999999997 | AK201: 210.5 | AL201: 344 | AM201: 122 | AN201: 348 | AO201: -0.12300000000000001 | AP201: 8 | AQ201: 乐歌转债!
A202: 5 | B202: 123113 | C202: 仙乐转债 | D202: 300791 | E202: 仙乐健康 | F202: 食品饮料 | G202: 食品饮料 | H202: 117.06 | I202: -2.8999999999999998e-003 | J202: -2.5499999999999998e-002 | K202: 47.65 | L202: -5.04e-002 | M202: 118.5 | N202: 56.92 | O202: 0.39799999999999996 | P202: 83.71 | Q202: 4月16天 | R202: 5.85年 | S202: 3.85年 | T202: 10.3 | U202: 12 | V202: 1.e-002 | W202: 0.12 | X202: 0.10000000000000001 | Y202: 86 | Z202: 2.55 | AA202: 2.0999999999999999e-003 | AB202: -3.4000000000000002e-003 | AC202: -2.9600000000000001e-002 | AD202: -3.1400000000000004e-002 | AE202: 80.74 | AF202: 82.46 | AG202: 0.56 | AH202: AA- | AI202: 6.5199999999999994e-002 | AJ202: =H202+100*O202 -> 156.86000000000001 | AK202: 150.4 | AL202: 292 | AM202: 67.9 | AN202: 313 | AO202: -0.36200000000000004 | AP202: 2 | AQ202: 仙乐转债
A203: 134 | B203: 110073 | C203: 国投转债 | D203: 600061 | E203: 国投资本 | F203: 金融 | G203: 证券行业 | H203: 109.6 | I203: -7.9000000000000008e-003 | J203: -7.9000000000000008e-003 | K203: 13.57 | L203: -3.2099999999999997e-002 | M203: 110.5 | N203: 15.25 | O203: 0.23199999999999998 | P203: 88.98 | Q203: 转股中 | R203: 5年42天 | S203: 无权 | T203: 80 | U203: 50 | V203: 6.0000000000000001e-003 | W203: 0.13900000000000001 | X203: 0.124 | Y203: 574 | Z203: 1.32 | AA203: 1.6000000000000001e-003 | AB203: -2.2000000000000001e-003 | AC203: 无权 | AD203: 无权 | AE203: 无权 | AF203: 91.01 | AG203: 0.49 | AH203: AAA | AI203: 3.9199999999999999e-002 | AJ203: =H203+100*O203 -> 132.79999999999998 | AK203: 130.2 | AL203: 138 | AM203: 39.2 | AN203: 165 | AO203: 0. | AP203: 23 | AQ203: 国投转债
A204: 83 | B204: 127024 | C204: 盈峰转债 | D204: 967 | E204: 盈峰环境 | F204: 机械装备 | G204: 专用设备 | H204: 116 | I204: 0. | J204: 0. | K204: 7.81 | L204: 0. | M204: 116.8 | N204: 8.31 | O204: 0.23399999999999999 | P204: 93.98 | Q204: 转股中 | R204: 5.40年 | S204: 3.40年 | T204: 14.8 | U204: 2.9 | V204: 2.e-003 | W204: 5.9999999999999998e-002 | X204: 5.5999999999999994e-002 | Y204: 247 | Z204: 1.47 | AA204: 1.2999999999999999e-003 | AB204: -4.1999999999999997e-003 | AC204: -3.2199999999999999e-002 | AD204: -3.39e-002 | AE204: 89.55 | AF204: 94.27 | AG204: 0.51 | AH204: AA+ | AI204: 4.1200000000000001e-002 | AJ204: =H204+100*O204 -> 139.40000000000001 | AK204: 138 | AL204: 225 | AM204: 43.7 | AN204: 202 | AO204: -2.2000000000000002e-002 | AP204: 5 | AQ204: 盈峰转债
A205: 141 | B205: 127020 | C205: 中金转债 | D205: 60 | E205: 中金岭南 | F205: 有色金属 | G205: 有色行业 | H205: 113.087 | I205: -1.4000000000000002e-003 | J205: 2.7000000000000001e-003 | K205: 4.76 | L205: 2.0999999999999999e-003 | M205: 113.7 | N205: 4.71 | O205: 0.11900000000000001 | P205: 101.06 | Q205: 转股中 | R205: 5年38天 | S205: 3年39天 | T205: 38 | U205: 10 | V205: 2.e-003 | W205: 0.22399999999999998 | X205: 0.22600000000000001 | Y205: 170 | Z205: 1.42 | AA205: 1.1000000000000001e-003 | AB205: -3.8e-003 | AC205: -2.9900000000000003e-002 | AD205: -3.1300000000000001e-002 | AE205: 89.85 | AF205: 92.79 | AG205: 0.59 | AH205: AA+ | AI205: 4.1200000000000001e-002 | AJ205: =H205+100*O205 -> 124.98700000000001 | AK205: 125.1 | AL205: 88 | AM205: 32.3 | AN205: 92 | AO205: -1.4999999999999999e-002 | AP205: 14 | AQ205: 中金转债
A206: 19 | B206: 127031 | C206: 洋丰转债! | D206: 902 | E206: 新洋丰 | F206: 化工 | G206: 农化 | H206: 116.531 | I206: -8.3000000000000001e-003 | J206: 2.3e-003 | K206: 15.71 | L206: -1.5700000000000002e-002 | M206: 117.1 | N206: 19.94 | O206: 0.47899999999999998 | P206: 78.79 | Q206: 3月29天 | R206: 5.78年 | S206: 3.79年 | T206: 10 | U206: 18 | V206: 1.4999999999999999e-002 | W206: 4.9000000000000002e-002 | X206: 3.7999999999999999e-002 | Y206: 205 | Z206: 2.82 | AA206: 8.9999999999999998e-004 | AB206: -4.3e-003 | AC206: -2.9500000000000002e-002 | AD206: -3.1200000000000002e-002 | AE206: 87.44 | AF206: 91.58 | AG206: 0.38 | AH206: AA | AI206: 4.4199999999999996e-002 | AJ206: =H206+100*O206 -> 164.43100000000001 | AK206: 154.3 | AL206: 305 | AM206: 62.7 | AN206: 301 | AO206: 6.4000000000000001e-002 | AP206: 3 | AQ206: 洋丰转债!
A207: 181 | B207: 110070 | C207: 凌钢转债! | D207: 600231 | E207: 凌钢股份 | F207: 钢铁 | G207: 炼钢 | H207: 116.96 | I207: 1.9199999999999998e-002 | J207: -6.4000000000000003e-003 | K207: 2.97 | L207: 2.06e-002 | M207: 117.4 | N207: 2.75 | O207: 8.3000000000000004e-002 | P207: 108 | Q207: 转股中 | R207: 4.84年 | S207: 2.84年 | T207: 2.17 | U207: 40 | V207: 0.159 | W207: 2.6000000000000002e-002 | X207: 2.7999999999999997e-002 | Y207: 84 | Z207: 0.98 | AA207: 8.0000000000000004e-004 | AB207: -5.5000000000000005e-003 | AC207: -3.95e-002 | AD207: -4.1700000000000001e-002 | AE207: 91.49 | AF207: 96.13 | AG207: 0.62 | AH207: AA | AI207: 4.3099999999999999e-002 | AJ207: =H207+100*O207 -> 125.25999999999999 | AK207: 125.9 | AL207: 99 | AM207: 29.8 | AN207: 62 | AO207: -8.0000000000000002e-003 | AP207: 21 | AQ207: 凌钢转债!
A208: 106 | B208: 113603 | C208: 东缆转债! | D208: 603606 | E208: 东方电缆 | F208: 能源电力 | G208: 电力设备 | H208: 114.86 | I208: -1.5e-003 | J208: -5.3e-003 | K208: 19.24 | L208: -1.6899999999999998e-002 | M208: 115.1 | N208: 23.65 | O208: 0.41200000000000003 | P208: 81.35 | Q208: 转股中 | R208: 5.29年 | S208: 3.29年 | T208: 8 | U208: 4.6 | V208: 5.0000000000000001e-003 | W208: 6.4000000000000001e-002 | X208: 5.2000000000000005e-002 | Y208: 126 | Z208: 3.77 | AA208: 4.0000000000000002e-004 | AB208: -4.6999999999999993e-003 | AC208: -2.9700000000000001e-002 | AD208: -3.1600000000000003e-002 | AE208: 89.35 | AF208: 91.98 | AG208: 0.4 | AH208: AA | AI208: 4.4199999999999996e-002 | AJ208: =H208+100*O208 -> 156.06 | AK208: 148.4 | AL208: 285 | AM208: 56.4 | AN208: 281 | AO208: -3.7999999999999999e-002 | AP208: 7 | AQ208: 东缆转债!
A209: 348 | B209: 123002 | C209: 国祯转债!! | D209: 300388 | E209: 节能国祯 | F209: 城市公用 | G209: 三废处理 | H209: 108.8 | I209: -3.7000000000000002e-003 | J209: 4.8999999999999998e-003 | K209: 8.05 | L209: 2.5000000000000001e-003 | M209: 108.8 | N209: 8.48 | O209: 0.14599999999999999 | P209: 94.93 | Q209: 转股中 | R209: 2.45年 | S209: 0.45年 | T209: 2.52 | U209: 10 | V209: 3.7999999999999999e-002 | W209: 4.4999999999999998e-002 | X209: 4.2999999999999997e-002 | Y209: 56 | Z209: 1.53 | AA209: 0. | AB209: -6.7000000000000002e-003 | AC209: -0.113 | AD209: -0.11800000000000001 | AE209: 99.02 | AF209: 98.62 | AG209: 0.5 | AH209: AA | AI209: 4.1500000000000002e-002 | AJ209: =H209+100*O209 -> 123.39999999999999 | AK209: 122.7 | AL209: 64 | AM209: 23.6 | AN209: 26 | AO209: -1.1000000000000001e-002 | AP209: 15 | AQ209: 国祯转债!!
A210: 200 | B210: 110067 | C210: 华安转债! | D210: 600909 | E210: 华安证券 | F210: 金融 | G210: 证券行业 | H210: 110.55 | I210: -1.29e-002 | J210: -1.1299999999999999e-002 | K210: 5.79 | L210: -4.7699999999999992e-002 | M210: 110.3 | N210: 6.22 | O210: 0.188 | P210: 93.09 | Q210: 转股中 | R210: 4.75年 | S210: 无权 | T210: 28 | U210: 29 | V210: 9.0000000000000011e-003 | W210: 0.10300000000000001 | X210: 9.6000000000000002e-002 | Y210: 272 | Z210: 1.47 | AA210: -5.0000000000000001e-004 | AB210: -4.5000000000000005e-003 | AC210: 无权 | AD210: 无权 | AE210: 无权 | AF210: 92.56 | AG210: 0.51 | AH210: AAA | AI210: 3.8100000000000002e-002 | AJ210: =H210+100*O210 -> 129.34999999999999 | AK210: 128 | AL210: 117 | AM210: 35.5 | AN210: 120 | AO210: -6.4000000000000001e-002 | AP210: 26 | AQ210: 华安转债!
A211: 82 | B211: 127025 | C211: 冀东转债 | D211: 401 | E211: 冀东水泥 | F211: 建筑 | G211: 水泥 | H211: 110.4 | I211: -2.5999999999999999e-003 | J211: 5.5000000000000005e-003 | K211: 13.07 | L211: 6.1999999999999998e-003 | M211: 110.1 | N211: 15.28 | O211: 0.29100000000000004 | P211: 85.54 | Q211: 转股中 | R211: 5.40年 | S211: 3.40年 | T211: 17.8 | U211: 11 | V211: 6.0000000000000001e-003 | W211: 9.6000000000000002e-002 | X211: 8.199999999999999e-002 | Y211: 185 | Z211: 1.24 | AA211: -5.0000000000000001e-004 | AB211: -4.0000000000000001e-003 | AC211: -1.9799999999999998e-002 | AD211: -2.1299999999999999e-002 | AE211: 89.75 | AF211: 89.74 | AG211: 0.47 | AH211: AAA | AI211: 3.9199999999999999e-002 | AJ211: =H211+100*O211 -> 139.5 | AK211: 135.3 | AL211: 196 | AM211: 45.5 | AN211: 217 | AO211: -5.2999999999999999e-002 | AP211: 10 | AQ211: 冀东转债
A212: 8 | B212: 127032 | C212: 苏行转债 | D212: 2966 | E212: 苏州银行 | F212: 金融 | G212: 银行行业 | H212: 115.9 | I212: -1.15e-002 | J212: 1.e-003 | K212: 7.9 | L212: -1.8600000000000002e-002 | M212: 115.1 | N212: 8.1 | O212: 0.188 | P212: 97.53 | Q212: 4月9天 | R212: 5.83年 | S212: 无权 | T212: 50 | U212: 45 | V212: 8.0000000000000002e-003 | W212: 0.19 | X212: 0.185 | Y212: 263 | Z212: 0.86 | AA212: -1.1999999999999999e-003 | AB212: -5.7999999999999996e-003 | AC212: 无权 | AD212: 无权 | AE212: 无权 | AF212: 92.31 | AG212: 0.56 | AH212: AAA | AI212: 3.9199999999999999e-002 | AJ212: =H212+100*O212 -> 134.70000000000002 | AK212: 134.3 | AL212: 186 | AM212: 42 | AN212: 189 | AO212: 2.3e-002 | AP212: 7 | AQ212: 苏行转债
A213: 213 | B213: 128094 | C213: 星帅转债 | D213: 2860 | E213: 星帅尔 | F213: 家电 | G213: 零部件制 | H213: 122.1 | I213: -4.8999999999999998e-003 | J213: 1.1699999999999999e-002 | K213: 16.88 | L213: 9.0000000000000011e-003 | M213: 121 | N213: 13.8 | O213: -2.e-003 | P213: 122.32 | Q213: 转股中 | R213: 4.60年 | S213: 2.60年 | T213: 2.71 | U213: 8 | V213: 2.4e-002 | W213: 8.0000000000000002e-002 | X213: 9.8000000000000004e-002 | Y213: 34 | Z213: 3.3 | AA213: -2.e-003 | AB213: -9.7999999999999997e-003 | AC213: -5.67e-002 | AD213: -5.9200000000000003e-002 | AE213: 85.39 | AF213: 87.42 | AG213: 0.76 | AH213: A+ | AI213: 7.51e-002 | AJ213: =H213+100*O213 -> 121.89999999999999 | AK213: 121.9 | AL213: 55 | AM213: 34.5 | AN213: 114 | AO213: 6.0000000000000001e-003 | AP213: 29 | AQ213: 星帅转债
A214: 116 | B214: 113602 | C214: 景20转债! | D214: 603228 | E214: 景旺电子 | F214: 电子 | G214: 元器件制 | H214: 114.6 | I214: -1.7000000000000001e-003 | J214: -8.3999999999999995e-003 | K214: 25.14 | L214: -1.9099999999999999e-002 | M214: 113.3 | N214: 27.4 | O214: 0.249 | P214: 91.75 | Q214: 转股中 | R214: 5.20年 | S214: 3.20年 | T214: 17.8 | U214: 9.1 | V214: 4.0000000000000001e-003 | W214: 8.3000000000000004e-002 | X214: 7.5999999999999998e-002 | Y214: 215 | Z214: 3.3 | AA214: -2.2000000000000001e-003 | AB214: -6.8999999999999999e-003 | AC214: -2.92e-002 | AD214: -3.1300000000000001e-002 | AE214: 89.87 | AF214: 90.92 | AG214: 0.53 | AH214: AA | AI214: 4.4199999999999996e-002 | AJ214: =H214+100*O214 -> 139.5 | AK214: 137.4 | AL214: 219 | AM214: 46.5 | AN214: 225 | AO214: -1.e-002 | AP214: 10 | AQ214: 景20转债!
A215: 94 | B215: 113605 | C215: 大参转债 | D215: 603233 | E215: 大参林 | F215: 医药 | G215: 医药商业 | H215: 116.79 | I215: -1.18e-002 | J215: -8.6e-003 | K215: 53.57 | L215: -5.7999999999999996e-002 | M215: 115.2 | N215: 69.09 | O215: 0.50600000000000001 | P215: 77.54 | Q215: 转股中 | R215: 5.36年 | S215: 3.36年 | T215: 14.1 | U215: 27 | V215: 1.7000000000000001e-002 | W215: 3.3000000000000002e-002 | X215: 2.6000000000000002e-002 | Y215: 423 | Z215: 6.59 | AA215: -2.5999999999999999e-003 | AB215: -7.6e-003 | AC215: -3.3399999999999999e-002 | AD215: -3.5299999999999998e-002 | AE215: 89.15 | AF215: 91.77 | AG215: 0.35 | AH215: AA | AI215: 4.4199999999999996e-002 | AJ215: =H215+100*O215 -> 167.39000000000001 | AK215: 156 | AL215: 309 | AM215: 64.3 | AN215: 304 | AO215: -0.249 | AP215: 6 | AQ215: 大参转债
A216: 31 | B216: 113045 | C216: 环旭转债! | D216: 601231 | E216: 环旭电子 | F216: 电子 | G216: 电子产品 | H216: 113.7 | I216: -2.8000000000000004e-003 | J216: -1.1399999999999999e-002 | K216: 15.25 | L216: -4.0899999999999999e-002 | M216: 112 | N216: 19.75 | O216: 0.47299999999999998 | P216: 77.22 | Q216: 6月2天 | R216: 5.73年 | S216: 2.73年 | T216: 34.5 | U216: 3.8 | V216: 1.e-003 | W216: 0.10199999999999999 | X216: 7.9000000000000001e-002 | Y216: 337 | Z216: 2.72 | AA216: -2.7000000000000001e-003 | AB216: -6.5000000000000006e-003 | AC216: -3.39e-002 | AD216: -3.5799999999999998e-002 | AE216: 91.56 | AF216: 89.13 | AG216: 0.35 | AH216: AA+ | AI216: 4.1200000000000001e-002 | AJ216: =H216+100*O216 -> 161. | AK216: 150.2 | AL216: 291 | AM216: 58.6 | AN216: 291 | AO216: -4.4000000000000004e-002 | AP216: 4 | AQ216: 环旭转债!
A217: 76 | B217: 113609 | C217: 永安转债! | D217: 603776 | E217: DR永安行 | F217: 城市公用 | G217: 其他 | H217: 122.37 | I217: -2.3e-003 | J217: -9.4999999999999998e-003 | K217: 20.2 | L217: -1.5100000000000001e-002 | M217: 120.5 | N217: 16.48 | O217: -2.e-003 | P217: 122.57 | Q217: 转股中 | R217: 5.45年 | S217: 3.45年 | T217: 7.89 | U217: 131 | V217: 0.13400000000000001 | W217: 0.20300000000000001 | X217: 0.249 | Y217: 39 | Z217: 1.21 | AA217: -2.8999999999999998e-003 | AB217: -9.300000000000001e-003 | AC217: -4.4699999999999997e-002 | AD217: -4.6600000000000003e-002 | AE217: 82.81 | AF217: 85.99 | AG217: 0.78 | AH217: AA- | AI217: 6.5199999999999994e-002 | AJ217: =H217+100*O217 -> 122.17 | AK217: 122.2 | AL217: 57 | AM217: 36.2 | AN217: 129 | AO217: -0.20600000000000002 | AP217: 21 | AQ217: 永安转债!
A218: 238 | B218: 123033 | C218: 金力转债! | D218: 300748 | E218: 金力永磁 | F218: 电子 | G218: 元器件制 | H218: 123.122 | I218: 3.4000000000000002e-003 | J218: -1.32e-002 | K218: 25.96 | L218: -1.5900000000000001e-002 | M218: 121.5 | N218: 25.3 | O218: 0.20000000000000001 | P218: 102.61 | Q218: 转股中 | R218: 4.39年 | S218: 2.39年 | T218: 4.34 | U218: 16 | V218: 2.9999999999999999e-002 | W218: 2.4e-002 | X218: 2.5000000000000001e-002 | Y218: 179 | Z218: 5.34 | AA218: -3.0999999999999999e-003 | AB218: -1.1399999999999999e-002 | AC218: -6.1200000000000004e-002 | AD218: -6.4600000000000005e-002 | AE218: 89.81 | AF218: 93.28 | AG218: 0.61 | AH218: AA- | AI218: 6.4100000000000004e-002 | AJ218: =H218+100*O218 -> 143.12200000000001 | AK218: 143.6 | AL218: 263 | AM218: 50.4 | AN218: 246 | AO218: 1.6e-002 | AP218: 27 | AQ218: 金力转债!
A219: 183 | B219: 123048 | C219: 应急转债! | D219: 300527 | E219: 中船应急 | F219: 机械装备 | G219: 专用设备 | H219: 114.531 | I219: -7.3000000000000001e-003 | J219: -3.2000000000000002e-003 | K219: 9.22 | L219: -1.7100000000000001e-002 | M219: 112.8 | N219: 8.9 | O219: 0.106 | P219: 103.6 | Q219: 转股中 | R219: 4.83年 | S219: 2.83年 | T219: 3.8 | U219: 27 | V219: 6.3e-002 | W219: 4.2999999999999997e-002 | X219: 4.4000000000000004e-002 | Y219: 89 | Z219: 3.34 | AA219: -3.2000000000000002e-003 | AB219: -8.0000000000000002e-003 | AC219: -3.4099999999999998e-002 | AD219: -3.61e-002 | AE219: 91.9 | AF219: 93.62 | AG219: 0.61 | AH219: AA+ | AI219: 4.0099999999999997e-002 | AJ219: =H219+100*O219 -> 125.131 | AK219: 125.5 | AL219: 94 | AM219: 31.8 | AN219: 86 | AO219: 2.7000000000000003e-002 | AP219: 16 | AQ219: 应急转债!
A220: 35 | B220: 123099 | C220: 普利转债 | D220: 300630 | E220: 普利制药 | F220: 医药 | G220: 化学制药 | H220: 126 | I220: -1.72e-002 | J220: 1.8100000000000002e-002 | K220: 51.31 | L220: 1.4000000000000002e-003 | M220: 123.5 | N220: 46.22 | O220: 0.13500000000000001 | P220: 111.01 | Q220: 2月13天 | R220: 5.66年 | S220: 3.67年 | T220: 8.5 | U220: 8.1 | V220: 8.0000000000000002e-003 | W220: 3.7999999999999999e-002 | X220: 4.2000000000000003e-002 | Y220: 224 | Z220: 10.27 | AA220: -3.5999999999999999e-003 | AB220: -1.0500000000000001e-002 | AC220: -4.9599999999999998e-002 | AD220: -5.1399999999999994e-002 | AE220: 81.71 | AF220: 86.95 | AG220: 0.7 | AH220: AA- | AI220: 6.5199999999999994e-002 | AJ220: =H220+100*O220 -> 139.5 | AK220: 141 | AL220: 244 | AM220: 54 | AN220: 268 | AO220: -2.e-003 | AP220: 4 | AQ220: 普利转债
A221: 36 | B221: 123098 | C221: 一品转债 | D221: 300723 | E221: 一品红 | F221: 医药 | G221: 医药行业 | H221: 126.726 | I221: -1.4000000000000002e-003 | J221: -1.2e-002 | K221: 25.6 | L221: -2.1400000000000002e-002 | M221: 124 | N221: 25.45 | O221: 0.26000000000000001 | P221: 100.59 | Q221: 53天 | R221: 5.63年 | S221: 3.63年 | T221: 4.8 | U221: 4.4 | V221: 6.9999999999999993e-003 | W221: 6.5000000000000002e-002 | X221: 6.5000000000000002e-002 | Y221: 74 | Z221: 2.65 | AA221: -3.9000000000000003e-003 | AB221: -1.1000000000000001e-002 | AC221: -5.1299999999999998e-002 | AD221: -5.3099999999999994e-002 | AE221: 81.95 | AF221: 87.5 | AG221: 0.63 | AH221: AA- | AI221: 6.5199999999999994e-002 | AJ221: =H221+100*O221 -> 152.726 | AK221: 152.9 | AL221: 300 | AM221: 65.4 | AN221: 307 | AO221: -5.9000000000000004e-002 | AP221: 3 | AQ221: 一品转债
A222: 78 | B222: 110077 | C222: 洪城转债 | D222: 600461 | E222: 洪城环境 | F222: 城市公用 | G222: 城市公用 | H222: 116.07 | I222: -7.4000000000000003e-003 | J222: 2.8999999999999998e-002 | K222: 7.7 | L222: 3.2199999999999999e-002 | M222: 113.5 | N222: 7.13 | O222: 7.4999999999999997e-002 | P222: 107.99 | Q222: 转股中 | R222: 5.44年 | S222: 3.44年 | T222: 18 | U222: 30 | V222: 1.3999999999999999e-002 | W222: 0.247 | X222: 0.26600000000000001 | Y222: 73 | Z222: 1.36 | AA222: -4.1999999999999997e-003 | AB222: -8.6e-003 | AC222: -3.4700000000000002e-002 | AD222: -3.5799999999999998e-002 | AE222: 88.46 | AF222: 91.36 | AG222: 0.67 | AH222: AA+ | AI222: 4.1200000000000001e-002 | AJ222: =H222+100*O222 -> 123.56999999999999 | AK222: 124.1 | AL222: 80 | AM222: 32.8 | AN222: 96 | AO222: 2.7000000000000003e-002 | AP222: 6 | AQ222: 洪城转债
A223: 218 | B223: 128091 | C223: 新天转债 | D223: 2873 | E223: 新天药业 | F223: 医药 | G223: 中药 | H223: 121.72 | I223: 8.6e-003 | J223: -2.5999999999999999e-003 | K223: 18.21 | L223: 8.3000000000000001e-003 | M223: 119.4 | N223: 16.39 | O223: 9.6000000000000002e-002 | P223: 111.1 | Q223: 转股中 | R223: 4.55年 | S223: 2.55年 | T223: 1.76 | U223: 76 | V223: 0.35100000000000003 | W223: 8.199999999999999e-002 | X223: 9.1999999999999998e-002 | Y223: 21 | Z223: 2.62 | AA223: -4.3e-003 | AB223: -1.1699999999999999e-002 | AC223: -5.5300000000000002e-002 | AD223: -5.8099999999999999e-002 | AE223: 86.04 | AF223: 86.64 | AG223: 0.73 | AH223: A+ | AI223: 7.51e-002 | AJ223: =H223+100*O223 -> 131.31999999999999 | AK223: 132.3 | AL223: 165 | AM223: 45.7 | AN223: 220 | AO223: 1.4999999999999999e-002 | AP223: 18 | AQ223: 新天转债
A224: 114 | B224: 128130 | C224: 景兴转债 | D224: 2067 | E224: 景兴纸业 | F224: 造纸包装 | G224: 包装用纸 | H224: 117.89 | I224: 3.4000000000000002e-003 | J224: 3.8e-003 | K224: 4.02 | L224: 1.01e-002 | M224: 115.1 | N224: 3.4 | O224: -3.0000000000000001e-003 | P224: 118.24 | Q224: 转股中 | R224: 5.22年 | S224: 3.22年 | T224: 10.7 | U224: 9.4 | V224: 8.0000000000000002e-003 | W224: 0.22899999999999998 | X224: 0.27100000000000002 | Y224: 47 | Z224: 0.95 | AA224: -4.6999999999999993e-003 | AB224: -9.7999999999999997e-003 | AC224: -3.7699999999999997e-002 | AD224: -3.9599999999999996e-002 | AE224: 89.61 | AF224: 92.25 | AG224: 0.72 | AH224: AA | AI224: 4.4199999999999996e-002 | AJ224: =H224+100*O224 -> 117.59 | AK224: 117.5 | AL224: 21 | AM224: 25.3 | AN224: 30 | AO224: 2.2000000000000002e-002 | AP224: 14 | AQ224: 景兴转债
A225: 75 | B225: 123078 | C225: 飞凯转债! | D225: 300398 | E225: 飞凯材料 | F225: 化工 | G225: 化工 | H225: 118.18 | I225: -1.5100000000000001e-002 | J225: -4.6999999999999993e-003 | K225: 16.46 | L225: -3.0600000000000002e-002 | M225: 115.2 | N225: 15.56 | O225: 0.11699999999999999 | P225: 105.78 | Q225: 转股中 | R225: 5.46年 | S225: 3.46年 | T225: 8.2 | U225: 22 | V225: 2.3e-002 | W225: 9.6999999999999989e-002 | X225: 0.10199999999999999 | Y225: 85 | Z225: 3.16 | AA225: -4.7999999999999996e-003 | AB225: -9.7000000000000003e-003 | AC225: -3.5699999999999996e-002 | AD225: -3.7499999999999999e-002 | AE225: 88.77 | AF225: 91.38 | AG225: 0.64 | AH225: AA | AI225: 4.4199999999999996e-002 | AJ225: =H225+100*O225 -> 129.88 | AK225: 130.6 | AL225: 145 | AM225: 39.2 | AN225: 163 | AO225: 5.2000000000000005e-002 | AP225: 8 | AQ225: 飞凯转债!
A226: 17 | B226: 110079 | C226: 杭银转债 | D226: 600926 | E226: 杭州银行 | F226: 金融 | G226: 银行行业 | H226: 115.62 | I226: -2.8000000000000004e-003 | J226: -1.8e-003 | K226: 15.35 | L226: -9.0000000000000011e-003 | M226: 112.4 | N226: 17.06 | O226: 0.28499999999999998 | P226: 89.98 | Q226: 3月29天 | R226: 5.79年 | S226: 3.80年 | T226: 150 | U226: 152 | V226: 9.0000000000000011e-003 | W226: 0.16500000000000001 | X226: 0.14800000000000002 | Y226: 910 | Z226: 1.38 | AA226: -4.8999999999999998e-003 | AB226: -8.8000000000000005e-003 | AC226: -2.9100000000000001e-002 | AD226: -3.0499999999999999e-002 | AE226: 88.44 | AF226: 90.24 | AG226: 0.51 | AH226: AAA | AI226: 3.9199999999999999e-002 | AJ226: =H226+100*O226 -> 144.12 | AK226: 141.3 | AL226: 246 | AM226: 51 | AN226: 251 | AO226: -6.7000000000000004e-002 | AP226: 11 | AQ226: 杭银转债
A227: 305 | B227: 110047 | C227: 山鹰转债 | D227: 600567 | E227: 山鹰国际 | F227: 造纸包装 | G227: 包装用纸 | H227: 119.55 | I227: -2.8999999999999998e-003 | J227: -2.0000000000000001e-004 | K227: 3.56 | L227: -5.6000000000000008e-003 | M227: 117.5 | N227: 3.34 | O227: 0.122 | P227: 106.59 | Q227: 转股中 | R227: 3.44年 | S227: 1.45年 | T227: 22.5 | U227: 3.8 | V227: 1.e-003 | W227: 0.13699999999999998 | X227: 0.14599999999999999 | Y227: 164 | Z227: 1.06 | AA227: -5.1000000000000004e-003 | AB227: -1.3899999999999999e-002 | AC227: -8.9800000000000005e-002 | AD227: -9.2799999999999994e-002 | AE227: 96.57 | AF227: 102.9 | AG227: 0.55 | AH227: AA+ | AI227: 4.0099999999999997e-002 | AJ227: =H227+100*O227 -> 131.75 | AK227: 132.5 | AL227: 168 | AM227: 29.6 | AN227: 59 | AO227: -4.7e-002 | AP227: 31 | AQ227: 山鹰转债
A228: 281 | B228: 127012 | C228: 招路转债! | D228: 1965 | E228: 招商公路 | F228: 机场高速 | G228: 高速 | H228: 109.999 | I228: 5.9999999999999995e-004 | J228: -1.1000000000000001e-003 | K228: 7.89 | L228: -1.2999999999999999e-003 | M228: 107.9 | N228: 8.81 | O228: 0.22800000000000001 | P228: 89.56 | Q228: 转股中 | R228: 3.78年 | S228: 1.78年 | T228: 50 | U228: 8.1 | V228: 1.e-003 | W228: 0.10300000000000001 | X228: 9.1999999999999998e-002 | Y228: 487 | Z228: 0.98 | AA228: -5.1000000000000004e-003 | AB228: -9.1000000000000004e-003 | AC228: -3.9900000000000005e-002 | AD228: -4.1500000000000002e-002 | AE228: 94.55 | AF228: 93.85 | AG228: 0.44 | AH228: AAA | AI228: 3.8100000000000002e-002 | AJ228: =H228+100*O228 -> 132.79900000000001 | AK228: 130.4 | AL228: 142 | AM228: 35.9 | AN228: 126 | AO228: -1.2e-002 | AP228: 31 | AQ228: 招路转债!
A229: 249 | B229: 128075 | C229: 远东转债! | D229: 2406 | E229: 远东传动 | F229: 汽车 | G229: 零部件制 | H229: 117.499 | I229: -9.8999999999999991e-003 | J229: 2.9999999999999997e-004 | K229: 6.27 | L229: -1.4199999999999999e-002 | M229: 114.9 | N229: 5.54 | O229: 3.7999999999999999e-002 | P229: 113.18 | Q229: 转股中 | R229: 4.28年 | S229: 2.29年 | T229: 5.44 | U229: 3 | V229: 5.0000000000000001e-003 | W229: 0.13900000000000001 | X229: 0.157 | Y229: 39 | Z229: 1.18 | AA229: -5.3e-003 | AB229: -1.15e-002 | AC229: -5.1299999999999998e-002 | AD229: -5.3800000000000001e-002 | AE229: 93.34 | AF229: 96.27 | AG229: 0.68 | AH229: AA | AI229: 4.3099999999999999e-002 | AJ229: =H229+100*O229 -> 121.29899999999999 | AK229: 121.8 | AL229: 53 | AM229: 25.5 | AN229: 31 | AO229: 1.4999999999999999e-002 | AP229: 14 | AQ229: 远东转债!
A230: 52 | B230: 123090 | C230: 三诺转债 | D230: 300298 | E230: 三诺生物 | F230: 医药 | G230: 医疗器械 | H230: 120.5 | I230: 1.09e-002 | J230: -2.9999999999999997e-004 | K230: 30.63 | L230: 2.3e-002 | M230: 117.1 | N230: 35.15 | O230: 0.38299999999999995 | P230: 87.14 | Q230: 14天 | R230: 5.53年 | S230: 3.53年 | T230: 5 | U230: 4.4 | V230: 6.9999999999999993e-003 | W230: 2.8999999999999998e-002 | X230: 2.5000000000000001e-002 | Y230: 173 | Z230: 6.49 | AA230: -5.3e-003 | AB230: -1.06e-002 | AC230: -4.0399999999999998e-002 | AD230: -4.2099999999999999e-002 | AE230: 88.42 | AF230: 92.6 | AG230: 0.46 | AH230: AA | AI230: 4.4199999999999996e-002 | AJ230: =H230+100*O230 -> 158.80000000000001 | AK230: 153.9 | AL230: 301 | AM230: 61.3 | AN230: 299 | AO230: -3.7000000000000005e-002 | AP230: 3 | AQ230: 三诺转债
A231: 168 | B231: 128109 | C231: 楚江转债 | D231: 2171 | E231: 楚江新材 | F231: 有色金属 | G231: 铜金属 | H231: 117.98 | I231: -5.1000000000000004e-003 | J231: -1.2999999999999999e-003 | K231: 8.24 | L231: -1.2e-002 | M231: 114.9 | N231: 8.63 | O231: 0.23600000000000002 | P231: 95.48 | Q231: 转股中 | R231: 4.98年 | S231: 2.98年 | T231: 18.3 | U231: 3.6 | V231: 2.e-003 | W231: 0.16699999999999998 | X231: 0.159 | Y231: 110 | Z231: 1.94 | AA231: -5.4000000000000003e-003 | AB231: -1.0700000000000001e-002 | AC231: -4.1299999999999996e-002 | AD231: -4.3299999999999998e-002 | AE231: 90.64 | AF231: 93.49 | AG231: 0.53 | AH231: AA | AI231: 4.3099999999999999e-002 | AJ231: =H231+100*O231 -> 141.58000000000001 | AK231: 140.5 | AL231: 242 | AM231: 47 | AN231: 226 | AO231: 2.3e-002 | AP231: 6 | AQ231: 楚江转债
A232: 66 | B232: 113612 | C232: 永冠转债 | D232: 603681 | E232: 永冠新材 | F232: 化工 | G232: 其他 | H232: 124.95 | I232: -1.3500000000000002e-002 | J232: 3.0000000000000001e-003 | K232: 25.6 | L232: -1.3500000000000002e-002 | M232: 121.2 | N232: 20.79 | O232: 1.4999999999999999e-002 | P232: 123.14 | Q232: 3.1天 | R232: 5.49年 | S232: 3.49年 | T232: 5.2 | U232: 13 | V232: 2.e-002 | W232: 0.122 | X232: 0.14999999999999999 | Y232: 43 | Z232: 2.71 | AA232: -5.6000000000000008e-003 | AB232: -1.2199999999999999e-002 | AC232: -4.9100000000000005e-002 | AD232: -5.1100000000000007e-002 | AE232: 82.86 | AF232: 86.35 | AG232: 0.78 | AH232: AA- | AI232: 6.5199999999999994e-002 | AJ232: =H232+100*O232 -> 126.45 | AK232: 126.8 | AL232: 106 | AM232: 40.4 | AN232: 175 | AO232: 1.1000000000000001e-002 | AP232: 6 | AQ232: 永冠转债
A233: 89 | B233: 113607 | C233: 伟20转债! | D233: 603568 | E233: 伟明环保 | F233: 城市公用 | G233: 三废处理 | H233: 118.84 | I233: 1.1999999999999999e-003 | J233: -1.3300000000000001e-002 | K233: 22.35 | L233: -1.9699999999999999e-002 | M233: 115.1 | N233: 22.01 | O233: 0.17000000000000001 | P233: 101.54 | Q233: 转股中 | R233: 5.39年 | S233: 3.39年 | T233: 12 | U233: 1.5 | V233: 1.e-003 | W233: 4.2999999999999997e-002 | X233: 4.2999999999999997e-002 | Y233: 281 | Z233: 5.03 | AA233: -6.0000000000000001e-003 | AB233: -1.1000000000000001e-002 | AC233: -3.8100000000000002e-002 | AD233: -3.9900000000000005e-002 | AE233: 88.94 | AF233: 91.56 | AG233: 0.61 | AH233: AA | AI233: 4.4199999999999996e-002 | AJ233: =H233+100*O233 -> 135.84 | AK233: 136.1 | AL233: 207 | AM233: 44.6 | AN233: 206 | AO233: -4.2999999999999997e-002 | AP233: 5 | AQ233: 伟20转债!
A234: 195 | B234: 128101 | C234: 联创转债! | D234: 2036 | E234: 联创电子 | F234: 电子 | G234: 液晶显示 | H234: 118.159 | I234: -7.3000000000000001e-003 | J234: -2.0299999999999999e-002 | K234: 11.77 | L234: -6.59e-002 | M234: 114.8 | N234: 13.72 | O234: 0.377 | P234: 85.79 | Q234: 转股中 | R234: 4.76年 | S234: 2.76年 | T234: 3 | U234: 37 | V234: 0.105 | W234: 2.4e-002 | X234: 2.1000000000000001e-002 | Y234: 125 | Z234: 3.39 | AA234: -6.0999999999999995e-003 | AB234: -1.1599999999999999e-002 | AC234: -4.5199999999999997e-002 | AD234: -4.7199999999999999e-002 | AE234: 91.38 | AF234: 94.26 | AG234: 0.42 | AH234: AA | AI234: 4.3099999999999999e-002 | AJ234: =H234+100*O234 -> 155.85900000000001 | AK234: 150.5 | AL234: 293 | AM234: 56.3 | AN234: 280 | AO234: -1.1000000000000001e-002 | AP234: 16 | AQ234: 联创转债!
A235: 51 | B235: 123089 | C235: 九洲转2! | D235: 300040 | E235: 九洲集团 | F235: 能源电力 | G235: 电力设备 | H235: 125.56 | I235: 1.7500000000000002e-002 | J235: 9.5999999999999992e-003 | K235: 10.26 | L235: 3.4300000000000004e-002 | M235: 121 | N235: 8 | O235: -2.1000000000000001e-002 | P235: 128.25 | Q235: 14天 | R235: 5.53年 | S235: 3.53年 | T235: 5 | U235: 149 | V235: 0.23699999999999999 | W235: 0.128 | X235: 0.16399999999999998 | Y235: 39 | Z235: 1.75 | AA235: -6.8000000000000005e-003 | AB235: -1.32e-002 | AC235: -5.0300000000000004e-002 | AD235: -5.2199999999999996e-002 | AE235: 82.49 | AF235: 85.97 | AG235: 0.79 | AH235: AA- | AI235: 6.5199999999999994e-002 | AJ235: =H235+100*O235 -> 123.46000000000001 | AK235: 122.9 | AL235: 67 | AM235: 36.9 | AN235: 138 | AO235: 0.121 | AP235: 20 | AQ235: 九洲转2!
A236: 85 | B236: 128136 | C236: 立讯转债! | D236: 2475 | E236: 立讯精密 | F236: 电子 | G236: 元器件制 | H236: 116.199 | I236: -6.8000000000000005e-003 | J236: -1.1999999999999999e-003 | K236: 39 | L236: -3.4200000000000001e-002 | M236: 111.9 | N236: 58.36 | O236: 0.7390000000000001 | P236: 66.83 | Q236: 转股中 | R236: 5.39年 | S236: 3.40年 | T236: 30 | U236: 11 | V236: 3.0000000000000001e-003 | W236: 1.1000000000000001e-002 | X236: 6.9999999999999993e-003 | Y236: 2744. | Z236: 9.49 | AA236: -6.9999999999999993e-003 | AB236: -1.1000000000000001e-002 | AC236: -3.49e-002 | AD236: -3.6200000000000003e-002 | AE236: 88.72 | AF236: 90.23 | AG236: 0.23 | AH236: AA+ | AI236: 4.1200000000000001e-002 | AJ236: =H236+100*O236 -> 190.09899999999999 | AK236: 165.6 | AL236: 321 | AM236: 75.3 | AN236: 322 | AO236: 2.7999999999999997e-002 | AP236: 12 | AQ236: 立讯转债!
A237: 34 | B237: 123100 | C237: 朗科转债 | D237: 300543 | E237: 朗科智能 | F237: 电子 | G237: 电子产品 | H237: 122.28 | I237: -1.3899999999999999e-002 | J237: 4.3e-003 | K237: 13.55 | L237: -1.24e-002 | M237: 117.5 | N237: 11.61 | O237: 4.8000000000000001e-002 | P237: 116.71 | Q237: 2月12天 | R237: 5.66年 | S237: 3.67年 | T237: 3.8 | U237: 15 | V237: 3.3000000000000002e-002 | W237: 0.105 | X237: 0.122 | Y237: 36 | Z237: 2.98 | AA237: -7.0999999999999995e-003 | AB237: -1.2500000000000001e-002 | AC237: -4.2099999999999999e-002 | AD237: -4.3899999999999995e-002 | AE237: 81.71 | AF237: 82.75 | AG237: 0.77 | AH237: AA- | AI237: 6.5199999999999994e-002 | AJ237: =H237+100*O237 -> 127.08 | AK237: 127.9 | AL237: 115 | AM237: 45.1 | AN237: 211 | AO237: -4.0000000000000001e-002 | AP237: 8 | AQ237: 朗科转债
A238: 278 | B238: 110057 | C238: 现代转债 | D238: 600420 | E238: 国药现代 | F238: 医药 | G238: 化学制药 | H238: 113.31 | I238: -3.0999999999999999e-003 | J238: -2.7000000000000001e-003 | K238: 10.06 | L238: -9.7999999999999997e-003 | M238: 110.3 | N238: 9.89 | O238: 0.114 | P238: 101.72 | Q238: 转股中 | R238: 3.80年 | S238: 1.81年 | T238: 16.2 | U238: 6.3 | V238: 3.0000000000000001e-003 | W238: 0.156 | X238: 0.159 | Y238: 103 | Z238: 1.28 | AA238: -7.1999999999999998e-003 | AB238: -1.21e-002 | AC238: -4.8499999999999995e-002 | AD238: -5.1100000000000007e-002 | AE238: 95.54 | AF238: 95.93 | AG238: 0.59 | AH238: AAA | AI238: 3.8100000000000002e-002 | AJ238: =H238+100*O238 -> 124.71000000000001 | AK238: 124.9 | AL238: 86 | AM238: 29 | AN238: 51 | AO238: -7.4999999999999997e-002 | AP238: 24 | AQ238: 现代转债
A239: 265 | B239: 113536 | C239: 三星转债 | D239: 603578 | E239: 三星新材 | F239: 家电 | G239: 零部件制 | H239: 117.58 | I239: -3.4000000000000002e-003 | J239: -2.8999999999999998e-003 | K239: 15.14 | L239: -9.7999999999999997e-003 | M239: 114.3 | N239: 13.76 | O239: 6.9000000000000006e-002 | P239: 110.03 | Q239: 转股中 | R239: 3.97年 | S239: 1.97年 | T239: 1.49 | U239: 5.4 | V239: 3.1e-002 | W239: 7.6999999999999999e-002 | X239: 8.4000000000000005e-002 | Y239: 19 | Z239: 1.86 | AA239: -7.1999999999999998e-003 | AB239: -1.3600000000000001e-002 | AC239: -6.13e-002 | AD239: -6.3600000000000004e-002 | AE239: 93.99 | AF239: 96.96 | AG239: 0.64 | AH239: AA | AI239: 4.3099999999999999e-002 | AJ239: =H239+100*O239 -> 124.48 | AK239: 125.1 | AL239: 89 | AM239: 28.2 | AN239: 44 | AO239: -0.17699999999999999 | AP239: 35 | AQ239: 三星转债
A240: 18 | B240: 113622 | C240: 杭叉转债! | D240: 603298 | E240: 杭叉集团 | F240: 机械装备 | G240: 通用设备 | H240: 117.7 | I240: 4.0000000000000002e-004 | J240: -6.1999999999999998e-003 | K240: 18.67 | L240: -1.37e-002 | M240: 112.5 | N240: 23.08 | O240: 0.45500000000000002 | P240: 80.89 | Q240: 3月29天 | R240: 5.78年 | S240: 3.79年 | T240: 11.5 | U240: 2.3 | V240: 2.e-003 | W240: 7.0999999999999994e-002 | X240: 5.7999999999999996e-002 | Y240: 162 | Z240: 3.15 | AA240: -7.9000000000000008e-003 | AB240: -1.18e-002 | AC240: -3.3300000000000003e-002 | AD240: -3.4700000000000002e-002 | AE240: 87.89 | AF240: 89.37 | AG240: 0.42 | AH240: AA+ | AI240: 4.1200000000000001e-002 | AJ240: =H240+100*O240 -> 163.19999999999999 | AK240: 154.5 | AL240: 307 | AM240: 65.1 | AN240: 305 | AO240: -4.2999999999999997e-002 | AP240: 4 | AQ240: 杭叉转债!
A241: 198 | B241: 113572 | C241: 三祥转债! | D241: 603663 | E241: 三祥新材 | F241: 其他 | G241: 其他 | H241: 117.08 | I241: -4.1999999999999997e-003 | J241: -7.0999999999999995e-003 | K241: 14.78 | L241: -1.5300000000000001e-002 | M241: 112.8 | N241: 14.09 | O241: 0.11599999999999999 | P241: 104.9 | Q241: 转股中 | R241: 4.75年 | S241: 2.75年 | T241: 1.69 | U241: 3.8 | V241: 1.9e-002 | W241: 5.9000000000000004e-002 | X241: 6.2e-002 | Y241: 28 | Z241: 4.45 | AA241: -8.0000000000000002e-003 | AB241: -1.2800000000000001e-002 | AC241: -4.2300000000000004e-002 | AD241: -4.4299999999999999e-002 | AE241: 83.77 | AF241: 80.52 | AG241: 0.73 | AH241: A+ | AI241: 7.51e-002 | AJ241: =H241+100*O241 -> 128.68000000000001 | AK241: 129.3 | AL241: 129 | AM241: 45.5 | AN241: 216 | AO241: 8.0000000000000002e-003 | AP241: 19 | AQ241: 三祥转债!
A242: 178 | B242: 113577 | C242: 春秋转债! | D242: 603890 | E242: 春秋电子 | F242: 电子 | G242: 电子产品 | H242: 122.28 | I242: -3.8e-003 | J242: -1.2699999999999999e-002 | K242: 12.44 | L242: -2.2799999999999997e-002 | M242: 117.7 | N242: 10.86 | O242: 6.7000000000000004e-002 | P242: 114.55 | Q242: 转股中 | R242: 4.84年 | S242: 2.84年 | T242: 1.78 | U242: 2.4 | V242: 1.1000000000000001e-002 | W242: 3.7000000000000005e-002 | X242: 4.2000000000000003e-002 | Y242: 49 | Z242: 2.57 | AA242: -8.0000000000000002e-003 | AB242: -1.43e-002 | AC242: -5.4000000000000006e-002 | AD242: -5.6100000000000004e-002 | AE242: 86.11 | AF242: 87.69 | AG242: 0.72 | AH242: AA- | AI242: 6.4100000000000004e-002 | AJ242: =H242+100*O242 -> 128.97999999999999 | AK242: 130 | AL242: 135 | AM242: 42.3 | AN242: 192 | AO242: -1.1000000000000001e-002 | AP242: 14 | AQ242: 春秋转债!
A243: 84 | B243: 128137 | C243: 洁美转债 | D243: 2859 | E243: 洁美科技 | F243: 电子 | G243: 元器件制 | H243: 123.011 | I243: 1.1999999999999999e-003 | J243: 7.9000000000000008e-003 | K243: 28.72 | L243: 1.3100000000000001e-002 | M243: 117.3 | N243: 27.63 | O243: 0.183 | P243: 103.94 | Q243: 转股中 | R243: 5.40年 | S243: 3.40年 | T243: 6 | U243: 2.9 | V243: 4.0000000000000001e-003 | W243: 5.0999999999999997e-002 | X243: 5.2999999999999999e-002 | Y243: 118 | Z243: 6.4 | AA243: -8.8999999999999999e-003 | AB243: -1.4499999999999999e-002 | AC243: -4.6900000000000004e-002 | AD243: -4.8799999999999996e-002 | AE243: 83.07 | AF243: 84 | AG243: 0.7 | AH243: AA- | AI243: 6.5199999999999994e-002 | AJ243: =H243+100*O243 -> 141.31100000000001 | AK243: 142.1 | AL243: 255 | AM243: 58.1 | AN243: 289 | AO243: 1.4999999999999999e-002 | AP243: 4 | AQ243: 洁美转债
A244: 294 | B244: 110051 | C244: 中天转债! | D244: 600522 | E244: 中天科技 | F244: 通信互联 | G244: 通信设备 | H244: 117.12 | I244: -1.6899999999999998e-002 | J244: -5.6000000000000008e-003 | K244: 9.93 | L244: -4.24e-002 | M244: 113.3 | N244: 9.99 | O244: 0.17800000000000002 | P244: 99.4 | Q244: 转股中 | R244: 3.72年 | S244: 1.72年 | T244: 39.6 | U244: 36 | V244: 8.0000000000000002e-003 | W244: 0.13 | X244: 0.129 | Y244: 304 | Z244: 1.3 | AA244: -9.0000000000000011e-003 | AB244: -1.54e-002 | AC244: -6.7299999999999999e-002 | AD244: -6.9900000000000004e-002 | AE244: 95.51 | AF244: 98.16 | AG244: 0.53 | AH244: AA+ | AI244: 4.0099999999999997e-002 | AJ244: =H244+100*O244 -> 134.92000000000002 | AK244: 134.8 | AL244: 192 | AM244: 36.7 | AN244: 134 | AO244: -3.3000000000000002e-002 | AP244: 24 | AQ244: 中天转债!
A245: 318 | B245: 110045 | C245: 海澜转债! | D245: 600398 | E245: 海澜之家 | F245: 服装纺织 | G245: 服装行业 | H245: 114.33 | I245: 1.3000000000000001e-002 | J245: -1.3000000000000001e-002 | K245: 7.61 | L245: 0. | M245: 111.1 | N245: 7.3 | O245: 9.6999999999999989e-002 | P245: 104.25 | Q245: 转股中 | R245: 3年31天 | S245: 1年32天 | T245: 29.5 | U245: 35 | V245: 1.e-002 | W245: 8.9999999999999997e-002 | X245: 9.4e-002 | Y245: 329 | Z245: 2.35 | AA245: -9.3999999999999986e-003 | AB245: -1.5900000000000001e-002 | AC245: -8.7499999999999994e-002 | AD245: -9.0299999999999991e-002 | AE245: 97.15 | AF245: 98.61 | AG245: 0.58 | AH245: AA+ | AI245: 4.0099999999999997e-002 | AJ245: =H245+100*O245 -> 124.03 | AK245: 124.4 | AL245: 82 | AM245: 25.8 | AN245: 34 | AO245: 5.2000000000000005e-002 | AP245: 53 | AQ245: 海澜转债!
A246: 228 | B246: 110063 | C246: 鹰19转债 | D246: 600567 | E246: 山鹰国际 | F246: 造纸包装 | G246: 包装用纸 | H246: 121 | I246: 0. | J246: -3.4999999999999996e-003 | K246: 3.56 | L246: -5.6000000000000008e-003 | M246: 115.9 | N246: 3.3 | O246: 0.122 | P246: 107.88 | Q246: 转股中 | R246: 4.50年 | S246: 2.51年 | T246: 18.5 | U246: 1 | V246: 0. | W246: 0.11199999999999999 | X246: 0.121 | Y246: 164 | Z246: 1.06 | AA246: -9.7000000000000003e-003 | AB246: -1.5800000000000002e-002 | AC246: -5.8099999999999999e-002 | AD246: -6.0299999999999999e-002 | AE246: 93.02 | AF246: 97.42 | AG246: 0.62 | AH246: AA+ | AI246: 4.0099999999999997e-002 | AJ246: =H246+100*O246 -> 133.19999999999999 | AK246: 134.1 | AL246: 184 | AM246: 36.7 | AN246: 136 | AO246: -4.7e-002 | AP246: 35 | AQ246: 鹰19转债
A247: 245 | B247: 128078 | C247: 太极转债! | D247: 2368 | E247: 太极股份 | F247: 计算机及 | G247: 软件开发 | H247: 121.98 | I247: -3.8e-003 | J247: 3.8e-003 | K247: 22 | L247: -2.6499999999999999e-002 | M247: 116.9 | N247: 22.4 | O247: 0.24199999999999999 | P247: 98.21 | Q247: 转股中 | R247: 4.36年 | S247: 2.36年 | T247: 9.6 | U247: 17 | V247: 1.4999999999999999e-002 | W247: 7.4999999999999997e-002 | X247: 7.400000000000001e-002 | Y247: 128 | Z247: 3.8 | AA247: -9.8999999999999991e-003 | AB247: -1.66e-002 | AC247: -6.3899999999999998e-002 | AD247: -6.6199999999999995e-002 | AE247: 93.04 | AF247: 97.63 | AG247: 0 | AH247: AA | AI247: 4.3099999999999999e-002 | AJ247: =H247+100*O247 -> 146.18000000000001 | AK247: 145.7 | AL247: 275 | AM247: 48.1 | AN247: 231 | AO247: 4.9000000000000002e-002 | AP247: 10 | AQ247: 太极转债!
A248: 171 | B248: 128108 | C248: 蓝帆转债! | D248: 2382 | E248: 蓝帆医疗 | F248: 医药 | G248: 医疗器械 | H248: 118.522 | I248: 5.9999999999999995e-004 | J248: 6.5000000000000006e-003 | K248: 19.8 | L248: 1.0200000000000001e-002 | M248: 112.9 | N248: 17.79 | O248: 6.5000000000000002e-002 | P248: 111.3 | Q248: 转股中 | R248: 4.96年 | S248: 3.96年 | T248: 15.3 | U248: 35 | V248: 2.e-002 | W248: 7.400000000000001e-002 | X248: 8.199999999999999e-002 | Y248: 207 | Z248: 1.67 | AA248: -9.8999999999999991e-003 | AB248: -1.46e-002 | AC248: -2.8799999999999999e-002 | AD248: -3.1099999999999999e-002 | AE248: 88.63 | AF248: 91.94 | AG248: 0.69 | AH248: AA | AI248: 4.3099999999999999e-002 | AJ248: =H248+100*O248 -> 125.02200000000001 | AK248: 125.7 | AL248: 98 | AM248: 33.8 | AN248: 110 | AO248: -5.9000000000000004e-002 | AP248: 25 | AQ248: 蓝帆转债!
A249: 53 | B249: 128142 | C249: 新乳转债 | D249: 2946 | E249: 新乳业 | F249: 食品饮料 | G249: 乳制品 | H249: 121.63 | I249: -2.0000000000000001e-004 | J249: -3.0999999999999999e-003 | K249: 16.55 | L249: -6.6e-003 | M249: 115.1 | N249: 18.54 | O249: 0.36299999999999999 | P249: 89.27 | Q249: 13天 | R249: 5.52年 | S249: 3.52年 | T249: 7.18 | U249: 1 | V249: 1.e-003 | W249: 5.0000000000000003e-002 | X249: 4.4999999999999998e-002 | Y249: 144 | Z249: 5.52 | AA249: -1.01e-002 | AB249: -1.49e-002 | AC249: -4.2900000000000001e-002 | AD249: -4.4699999999999997e-002 | AE249: 88.46 | AF249: 91.06 | AG249: 0.5 | AH249: AA | AI249: 4.4199999999999996e-002 | AJ249: =H249+100*O249 -> 157.93000000000001 | AK249: 154 | AL249: 303 | AM249: 62.9 | AN249: 302 | AO249: -7.0999999999999994e-002 | AP249: 4 | AQ249: 新乳转债
A250: 33 | B250: 118000 | C250: 嘉元转债 | D250: 688388 | E250: 嘉元科技 | F250: 电子 | G250: 电子产品 | H250: 128.05 | I250: -1.83e-002 | J250: -7.4000000000000003e-003 | K250: 86.98 | L250: -3.6600000000000001e-002 | M250: 121 | N250: 78.74 | O250: 0.159 | P250: 110.46 | Q250: 2月22天 | R250: 5.70年 | S250: 3.70年 | T250: 12.4 | U250: 24 | V250: 1.4999999999999999e-002 | W250: 6.2e-002 | X250: 6.8000000000000005e-002 | Y250: 201 | Z250: 7.38 | AA250: -1.01e-002 | AB250: -1.6200000000000003e-002 | AC250: -5.2999999999999999e-002 | AD250: -5.4699999999999999e-002 | AE250: 81.58 | AF250: 85.02 | AG250: 0.7 | AH250: AA- | AI250: 6.5199999999999994e-002 | AJ250: =H250+100*O250 -> 143.95000000000002 | AK250: 145.6 | AL250: 273 | AM250: 60.6 | AN250: 296 | AO250: 0.11800000000000001 | AP250: 4 | AQ250: 嘉元转债
A251: 50 | B251: 123091 | C251: 长海转债 | D251: 300196 | E251: 长海股份 | F251: 其他 | G251: 非金属矿 | H251: 123 | I251: -6.6e-003 | J251: -1.3000000000000001e-002 | K251: 16.41 | L251: -3.1899999999999998e-002 | M251: 116.2 | N251: 16.14 | O251: 0.20999999999999999 | P251: 101.67 | Q251: 18天 | R251: 5.53年 | S251: 3.53年 | T251: 5.5 | U251: 14 | V251: 2.e-002 | W251: 8.199999999999999e-002 | X251: 8.3000000000000004e-002 | Y251: 67 | Z251: 2.26 | AA251: -1.04e-002 | AB251: -1.55e-002 | AC251: -4.5400000000000003e-002 | AD251: -4.7199999999999999e-002 | AE251: 88.5 | AF251: 91.89 | AG251: 0.61 | AH251: AA | AI251: 4.4199999999999996e-002 | AJ251: =H251+100*O251 -> 144. | AK251: 144.3 | AL251: 266 | AM251: 52.4 | AN251: 263 | AO251: -5.7000000000000002e-002 | AP251: 3 | AQ251: 长海转债
A252: 302 | B252: 128050 | C252: 钧达转债!! | D252: 2865 | E252: 钧达股份 | F252: 汽车 | G252: 零部件制 | H252: 127.25 | I252: 2.e-002 | J252: 1.7299999999999999e-002 | K252: 18.38 | L252: 3.7200000000000004e-002 | M252: 122.7 | N252: 14.8 | O252: 2.5000000000000001e-002 | P252: 124.19 | Q252: 转股中 | R252: 3.50年 | S252: 1.50年 | T252: 1.41 | U252: 83 | V252: 0.46000000000000002 | W252: 5.7999999999999996e-002 | X252: 7.2000000000000008e-002 | Y252: 24 | Z252: 2.27 | AA252: -1.06e-002 | AB252: -2.1299999999999999e-002 | AC252: -0.105 | AD252: -0.10800000000000001 | AE252: 93 | AF252: 99.19 | AG252: 1 | AH252: AA- | AI252: 6.4100000000000004e-002 | AJ252: =H252+100*O252 -> 129.75 | AK252: 130.3 | AL252: 139 | AM252: 31.1 | AN252: 76 | AO252: -3.0000000000000001e-003 | AP252: 51 | AQ252: 钧达转债!!
A253: 113 | B253: 123064 | C253: 万孚转债! | D253: 300482 | E253: 万孚生物 | F253: 医药 | G253: 医疗器械 | H253: 121.915 | I253: -2.8999999999999998e-003 | J253: 2.3e-003 | K253: 69.95 | L253: -1.1000000000000001e-003 | M253: 115.1 | N253: 71.64 | O253: 0.249 | P253: 97.64 | Q253: 转股中 | R253: 5.22年 | S253: 3.22年 | T253: 5.99 | U253: 2 | V253: 3.0000000000000001e-003 | W253: 1.9e-002 | X253: 1.9e-002 | Y253: 311 | Z253: 8.24 | AA253: -1.1200000000000002e-002 | AB253: -1.6200000000000003e-002 | AC253: -4.7300000000000002e-002 | AD253: -4.9100000000000005e-002 | AE253: 89.59 | AF253: 92.24 | AG253: 0.57 | AH253: AA | AI253: 4.4199999999999996e-002 | AJ253: =H253+100*O253 -> 146.815 | AK253: 146.2 | AL253: 277 | AM253: 54 | AN253: 267 | AO253: -0.124 | AP253: 11 | AQ253: 万孚转债!
A254: 235 | B254: 123035 | C254: 利德转债! | D254: 300296 | E254: 利亚德 | F254: 电子 | G254: LED制 | H254: 121.142 | I254: 1.1000000000000001e-003 | J254: -9.0000000000000011e-003 | K254: 7.14 | L254: -1.38e-002 | M254: 115.1 | N254: 6.96 | O254: 0.18100000000000002 | P254: 102.59 | Q254: 转股中 | R254: 4.42年 | S254: 2.43年 | T254: 8 | U254: 1.6 | V254: 2.e-003 | W254: 4.4000000000000004e-002 | X254: 4.4999999999999998e-002 | Y254: 182 | Z254: 2.49 | AA254: -1.1699999999999999e-002 | AB254: -1.77e-002 | AC254: -5.9200000000000003e-002 | AD254: -6.1600000000000002e-002 | AE254: 93.67 | AF254: 97.09 | AG254: 0.57 | AH254: AA+ | AI254: 4.0099999999999997e-002 | AJ254: =H254+100*O254 -> 139.24199999999999 | AK254: 139.7 | AL254: 235 | AM254: 42.6 | AN254: 194 | AO254: 5.0000000000000001e-003 | AP254: 14 | AQ254: 利德转债!
A255: 274 | B255: 128064 | C255: 司尔转债! | D255: 2538 | E255: 司尔特 | F255: 化工 | G255: 农化 | H255: 119.499 | I255: -9.1000000000000004e-003 | J255: 6.9999999999999993e-003 | K255: 6.94 | L255: -2.8999999999999998e-003 | M255: 114.3 | N255: 5.82 | O255: 2.e-003 | P255: 119.24 | Q255: 转股中 | R255: 3.82年 | S255: 1.82年 | T255: 8 | U255: 62 | V255: 6.3e-002 | W255: 0.16 | X255: 0.191 | Y255: 50 | Z255: 1.24 | AA255: -1.18e-002 | AB255: -1.84e-002 | AC255: -7.3300000000000004e-002 | AD255: -7.5700000000000003e-002 | AE255: 94.57 | AF255: 97.56 | AG255: 0.73 | AH255: AA | AI255: 4.3099999999999999e-002 | AJ255: =H255+100*O255 -> 119.699 | AK255: 119.8 | AL255: 33 | AM255: 22.2 | AN255: 20 | AO255: 9.6000000000000002e-002 | AP255: 45 | AQ255: 司尔转债!
A256: 108 | B256: 123067 | C256: 斯莱转债 | D256: 300382 | E256: 斯莱克 | F256: 机械装备 | G256: 专用设备 | H256: 129 | I256: -3.7200000000000004e-002 | J256: 3.7000000000000002e-003 | K256: 11.47 | L256: -4.4199999999999996e-002 | M256: 121.2 | N256: 9.38 | O256: 5.5e-002 | P256: 122.28 | Q256: 转股中 | R256: 5.27年 | S256: 3.27年 | T256: 3.88 | U256: 114 | V256: 0.223 | W256: 5.9999999999999998e-002 | X256: 7.2999999999999995e-002 | Y256: 65 | Z256: 6.24 | AA256: -1.2e-002 | AB256: -1.8700000000000001e-002 | AC256: -6.1100000000000002e-002 | AD256: -6.3200000000000006e-002 | AE256: 84.04 | AF256: 87.57 | AG256: 0.76 | AH256: AA- | AI256: 6.5199999999999994e-002 | AJ256: =H256+100*O256 -> 134.5 | AK256: 135.7 | AL256: 200 | AM256: 48.1 | AN256: 232 | AO256: 7.8e-002 | AP256: 13 | AQ256: 斯莱转债
A257: 73 | B257: 123079 | C257: 运达转债 | D257: 300772 | E257: 运达股份 | F257: 能源电力 | G257: 风能 | H257: 122.799 | I257: 2.3e-003 | J257: -2.1400000000000002e-002 | K257: 16.68 | L257: -2.7999999999999997e-002 | M257: 115.1 | N257: 15.12 | O257: 0.113 | P257: 110.32 | Q257: 转股中 | R257: 5.47年 | S257: 3.47年 | T257: 5.77 | U257: 4.9 | V257: 6.9999999999999993e-003 | W257: 0.115 | X257: 0.126 | Y257: 50 | Z257: 2.9 | AA257: -1.2e-002 | AB257: -1.6799999999999999e-002 | AC257: -4.5999999999999999e-002 | AD257: -4.7699999999999992e-002 | AE257: 88.63 | AF257: 91.25 | AG257: 0.68 | AH257: AA | AI257: 4.4199999999999996e-002 | AJ257: =H257+100*O257 -> 134.09900000000002 | AK257: 135.3 | AL257: 197 | AM257: 44 | AN257: 203 | AO257: 3.1e-002 | AP257: 4 | AQ257: 运达转债
A258: 211 | B258: 128096 | C258: 奥瑞转债!! | D258: 2701 | E258: 奥瑞金 | F258: 造纸包装 | G258: 包装材料 | H258: 122.514 | I258: -1.5100000000000001e-002 | J258: 3.2000000000000002e-003 | K258: 5.1 | L258: -1.7299999999999999e-002 | M258: 115.5 | N258: 4.5 | O258: 8.1000000000000003e-002 | P258: 113.33 | Q258: 转股中 | R258: 4.67年 | S258: 2.67年 | T258: 6.79 | U258: 4.6 | V258: 6.0000000000000001e-003 | W258: 5.5e-002 | X258: 6.2e-002 | Y258: 123 | Z258: 1.84 | AA258: -1.2800000000000001e-002 | AB258: -1.8600000000000002e-002 | AC258: -5.7200000000000001e-002 | AD258: -5.96e-002 | AE258: 92.99 | AF258: 96.52 | AG258: 0.68 | AH258: AA+ | AI258: 4.0099999999999997e-002 | AJ258: =H258+100*O258 -> 130.614 | AK258: 131.7 | AL258: 157 | AM258: 35.2 | AN258: 117 | AO258: -5.0000000000000003e-002 | AP258: 19 | AQ258: 奥瑞转债!!
A259: 98 | B259: 123070 | C259: 鹏辉转债 | D259: 300438 | E259: 鹏辉能源 | F259: 汽车 | G259: 零部件制 | H259: 123.19 | I259: -1.84e-002 | J259: -2.4e-002 | K259: 22.05 | L259: -6.1699999999999998e-002 | M259: 115.1 | N259: 20.06 | O259: 0.121 | P259: 109.92 | Q259: 转股中 | R259: 5.36年 | S259: 3.36年 | T259: 8.9 | U259: 88 | V259: 8.0000000000000002e-002 | W259: 9.6000000000000002e-002 | X259: 0.106 | Y259: 93 | Z259: 3.91 | AA259: -1.2800000000000001e-002 | AB259: -1.77e-002 | AC259: -4.8300000000000003e-002 | AD259: -5.0099999999999999e-002 | AE259: 89.08 | AF259: 91.7 | AG259: 0.69 | AH259: AA | AI259: 4.4199999999999996e-002 | AJ259: =H259+100*O259 -> 135.28999999999999 | AK259: 136.5 | AL259: 210 | AM259: 44.8 | AN259: 208 | AO259: 8.5999999999999993e-002 | AP259: 4 | AQ259: 鹏辉转债
A260: 1 | B260: 123114 | C260: N三角转 | D260: 300775 | E260: 三角防务 | F260: 航空航天 | G260: 航空航天 | H260: 130.9 | I260: 0.309 | J260: 0. | K260: 36.6 | L260: -2.8399999999999998e-002 | M260: 121 | N260: 31.82 | O260: 0.13800000000000001 | P260: 115.02 | Q260: 5月22天 | R260: 5.95年 | S260: 3.95年 | T260: 9.04 | U260: 227 | V260: 0.193 | W260: 5.0000000000000003e-002 | X260: 5.7000000000000002e-002 | Y260: 181 | Z260: 9.06 | AA260: -1.34e-002 | AB260: -1.9199999999999998e-002 | AC260: -5.4900000000000004e-002 | AD260: -5.6600000000000004e-002 | AE260: 80.31 | AF260: 83.69 | AG260: 0.74 | AH260: AA- | AI260: 6.5199999999999994e-002 | AJ260: =H260+100*O260 -> 144.70000000000002 | AK260: 146.8 | AL260: 279 | AM260: 63.1 | AN260: 303 | AO260: 5.2999999999999999e-002 | AP260: 1 | AQ260: N三角转
A261: 173 | B261: 113579 | C261: 健友转债! | D261: 603707 | E261: 健友股份 | F261: 医药 | G261: 原料药 | H261: 121.56 | I261: -1.7600000000000001e-002 | J261: 3.0000000000000001e-003 | K261: 43.89 | L261: -2.3099999999999999e-002 | M261: 113.9 | N261: 42.05 | O261: 0.16500000000000001 | P261: 104.38 | Q261: 转股中 | R261: 4.86年 | S261: 2.87年 | T261: 5.03 | U261: 3.3 | V261: 5.0000000000000001e-003 | W261: 1.2e-002 | X261: 1.3000000000000001e-002 | Y261: 410 | Z261: 10.66 | AA261: -1.3500000000000002e-002 | AB261: -1.8600000000000002e-002 | AC261: -5.2300000000000006e-002 | AD261: -5.4299999999999994e-002 | AE261: 91.08 | AF261: 93.13 | AG261: 0.63 | AH261: AA | AI261: 4.3099999999999999e-002 | AJ261: =H261+100*O261 -> 138.06 | AK261: 138.7 | AL261: 230 | AM261: 45.6 | AN261: 218 | AO261: 2.6000000000000002e-002 | AP261: 9 | AQ261: 健友转债!
A262: 288 | B262: 127011 | C262: 中鼎转2! | D262: 887 | E262: 中鼎股份 | F262: 汽车 | G262: 零部件制 | H262: 120.529 | I262: -1.3300000000000001e-002 | J262: 2.8999999999999998e-003 | K262: 11.92 | L262: -1.8100000000000002e-002 | M262: 114.5 | N262: 11.39 | O262: 0.152 | P262: 104.65 | Q262: 转股中 | R262: 3.74年 | S262: 1.74年 | T262: 12 | U262: 34 | V262: 2.3e-002 | W262: 8.199999999999999e-002 | X262: 8.5999999999999993e-002 | Y262: 146 | Z262: 1.63 | AA262: -1.3899999999999999e-002 | AB262: -2.07e-002 | AC262: -8.0399999999999985e-002 | AD262: -8.3000000000000004e-002 | AE262: 95.46 | AF262: 99.13 | AG262: 0.57 | AH262: AA+ | AI262: 4.0099999999999997e-002 | AJ262: =H262+100*O262 -> 135.72899999999998 | AK262: 136.4 | AL262: 209 | AM262: 37.3 | AN262: 142 | AO262: 4.9000000000000002e-002 | AP262: 22 | AQ262: 中鼎转2!
A263: 148 | B263: 128119 | C263: 龙大转债! | D263: 2726 | E263: 龙大肉食 | F263: 食品饮料 | G263: 肉制品 | H263: 129.018 | I263: 8.8999999999999999e-003 | J263: -8.3000000000000001e-003 | K263: 11.78 | L263: 8.0000000000000004e-004 | M263: 120.2 | N263: 9.38 | O263: 2.7000000000000003e-002 | P263: 125.59 | Q263: 转股中 | R263: 5年31天 | S263: 3年32天 | T263: 9.46 | U263: 13 | V263: 1.1000000000000001e-002 | W263: 8.0000000000000002e-002 | X263: 0.10099999999999999 | Y263: 118 | Z263: 3.38 | AA263: -1.41e-002 | AB263: -2.07e-002 | AC263: -6.5500000000000003e-002 | AD263: -6.7400000000000002e-002 | AE263: 90.22 | AF263: 96.89 | AG263: 0.75 | AH263: AA | AI263: 4.4199999999999996e-002 | AJ263: =H263+100*O263 -> 131.71799999999999 | AK263: 132.4 | AL263: 167 | AM263: 35.6 | AN263: 124 | AO263: 1.1000000000000001e-002 | AP263: 9 | AQ263: 龙大转债!
A264: 287 | B264: 110053 | C264: 苏银转债! | D264: 600919 | E264: 江苏银行 | F264: 金融 | G264: 银行行业 | H264: 124.79 | I264: 4.7999999999999996e-003 | J264: -6.4000000000000003e-003 | K264: 7.67 | L264: -2.5999999999999999e-003 | M264: 118.3 | N264: 6.69 | O264: 8.8000000000000009e-002 | P264: 114.65 | Q264: 转股中 | R264: 3.75年 | S264: 无权 | T264: 200 | U264: 165 | V264: 6.9999999999999993e-003 | W264: 0.17699999999999999 | X264: 0.20199999999999999 | Y264: 1133. | Z264: 0.81 | AA264: -1.4499999999999999e-002 | AB264: -2.2799999999999997e-002 | AC264: 无权 | AD264: 无权 | AE264: 无权 | AF264: 103.22 | AG264: 0.64 | AH264: AAA | AI264: 3.8100000000000002e-002 | AJ264: =H264+100*O264 -> 133.59 | AK264: 134.9 | AL264: 194 | AM264: 31.7 | AN264: 85 | AO264: 1.3000000000000001e-002 | AP264: 39 | AQ264: 苏银转债!
A265: 289 | B265: 128057 | C265: 博彦转债 | D265: 2649 | E265: 博彦科技 | F265: 计算机及 | G265: 软件开发 | H265: 122.9 | I265: 5.3e-003 | J265: 7.000000000000001e-004 | K265: 10.33 | L265: 7.8000000000000005e-003 | M265: 116.3 | N265: 8.5 | O265: 1.1000000000000001e-002 | P265: 121.53 | Q265: 转股中 | R265: 3.73年 | S265: 1.73年 | T265: 5.07 | U265: 21 | V265: 3.4000000000000002e-002 | W265: 9.1999999999999998e-002 | X265: 0.11199999999999999 | Y265: 55 | Z265: 1.81 | AA265: -1.49e-002 | AB265: -2.2499999999999999e-002 | AC265: -9.0399999999999994e-002 | AD265: -9.2899999999999996e-002 | AE265: 91.44 | AF265: 92.65 | AG265: 0.77 | AH265: AA- | AI265: 6.4100000000000004e-002 | AJ265: =H265+100*O265 -> 124. | AK265: 124.3 | AL265: 81 | AM265: 31.6 | AN265: 82 | AO265: 7.0000000000000007e-002 | AP265: 25 | AQ265: 博彦转债
A266: 14 | B266: 123110 | C266: 九典转债 | D266: 300705 | E266: 九典制药 | F266: 医药 | G266: 化学制药 | H266: 132.455 | I266: -9.300000000000001e-003 | J266: -1.1399999999999999e-002 | K266: 32.97 | L266: -2.6000000000000002e-002 | M266: 121.4 | N266: 26.44 | O266: 6.2e-002 | P266: 124.7 | Q266: 3月29天 | R266: 5.80年 | S266: 3.81年 | T266: 2.7 | U266: 79 | V266: 0.218 | W266: 3.5000000000000003e-002 | X266: 4.4000000000000004e-002 | Y266: 77 | Z266: 8.77 | AA266: -1.52e-002 | AB266: -2.1299999999999999e-002 | AC266: -5.8700000000000002e-002 | AD266: -6.0599999999999994e-002 | AE266: 78.23 | AF266: 80.01 | AG266: 0.8 | AH266: A+ | AI266: 7.6200000000000004e-002 | AJ266: =H266+100*O266 -> 138.655 | AK266: 140.2 | AL266: 240 | AM266: 60.2 | AN266: 293 | AO266: 8.1000000000000003e-002 | AP266: 5 | AQ266: 九典转债
A267: 335 | B267: 123007 | C267: 道氏转债! | D267: 300409 | E267: 道氏技术 | F267: 建筑 | G267: 建筑行业 | H267: 114.7 | I267: 1.7899999999999999e-002 | J267: 2.98e-002 | K267: 15.39 | L267: 7.3200000000000001e-002 | M267: 110.3 | N267: 14.5 | O267: 8.1000000000000003e-002 | P267: 106.14 | Q267: 转股中 | R267: 2.55年 | S267: 0.55年 | T267: 3.04 | U267: 96 | V267: 0.27699999999999997 | W267: 3.6000000000000004e-002 | X267: 3.7999999999999999e-002 | Y267: 85 | Z267: 2.32 | AA267: -1.55e-002 | AB267: -2.2799999999999997e-002 | AC267: -0.16399999999999998 | AD267: -0.16800000000000001 | AE267: 97.5 | AF267: 94.77 | AG267: 0.65 | AH267: AA- | AI267: 6.25e-002 | AJ267: =H267+100*O267 -> 122.8 | AK267: 123.3 | AL267: 69 | AM267: 25.8 | AN267: 33 | AO267: 0.107 | AP267: 23 | AQ267: 道氏转债!
A268: 11 | B268: 113623 | C268: 凤21转债 | D268: 603225 | E268: 新凤鸣 | F268: 化工 | G268: 化纤 | H268: 128.1 | I268: -5.5000000000000005e-003 | J268: -1.29e-002 | K268: 20.42 | L268: -2.4399999999999998e-002 | M268: 117.1 | N268: 16.6 | O268: 4.0999999999999995e-002 | P268: 123.01 | Q268: 4月5天 | R268: 5.82年 | S268: 3.82年 | T268: 25 | U268: 5 | V268: 2.e-003 | W268: 8.6999999999999994e-002 | X268: 0.107 | Y268: 286 | Z268: 2.34 | AA268: -1.55e-002 | AB268: -2.06e-002 | AC268: -5.2199999999999996e-002 | AD268: -5.3699999999999998e-002 | AE268: 87.3 | AF268: 91.43 | AG268: 0.75 | AH268: AA | AI268: 4.4199999999999996e-002 | AJ268: =H268+100*O268 -> 132.19999999999999 | AK268: 133.2 | AL268: 178 | AM268: 41.8 | AN268: 187 | AO268: 6.5000000000000002e-002 | AP268: 3 | AQ268: 凤21转债
A269: 351 | B269: 128018 | C269: 时达转债! | D269: 2527 | E269: 新时达 | F269: 机械装备 | G269: 机器人及 | H269: 113.601 | I269: -2.75e-002 | J269: -7.000000000000001e-004 | K269: 7.18 | L269: -5.9000000000000004e-002 | M269: 109.3 | N269: 7.42 | O269: 0.17399999999999999 | P269: 96.77 | Q269: 转股中 | R269: 2.41年 | S269: 0.41年 | T269: 4.04 | U269: 8.9 | V269: 1.9e-002 | W269: 9.0999999999999998e-002 | X269: 8.8000000000000009e-002 | Y269: 45 | Z269: 1.69 | AA269: -1.6200000000000003e-002 | AB269: -2.3199999999999998e-002 | AC269: -0.192 | AD269: -0.19699999999999998 | AE269: 99.47 | AF269: 99.3 | AG269: 0.48 | AH269: AA | AI269: 4.1500000000000002e-002 | AJ269: =H269+100*O269 -> 131.001 | AK269: 130.4 | AL269: 141 | AM269: 31 | AN269: 74 | AO269: -3.0000000000000001e-003 | AP269: 36 | AQ269: 时达转债!
A270: 138 | B270: 123060 | C270: 苏试转债 | D270: 300416 | E270: 苏试试验 | F270: 机械装备 | G270: 专用设备 | H270: 127.6 | I270: 3.7000000000000002e-003 | J270: 2.0000000000000001e-004 | K270: 20.72 | L270: 5.3e-003 | M270: 117.6 | N270: 18.28 | O270: 0.126 | P270: 113.35 | Q270: 转股中 | R270: 5年39天 | S270: 3年40天 | T270: 3.1 | U270: 23 | V270: 5.7000000000000002e-002 | W270: 5.7000000000000002e-002 | X270: 6.4000000000000001e-002 | Y270: 55 | Z270: 4.51 | AA270: -1.6200000000000003e-002 | AB270: -2.2099999999999998e-002 | AC270: -6.13e-002 | AD270: -6.3399999999999998e-002 | AE270: 84.73 | AF270: 85.81 | AG270: 0.74 | AH270: AA- | AI270: 6.5199999999999994e-002 | AJ270: =H270+100*O270 -> 140.19999999999999 | AK270: 141.9 | AL270: 253 | AM270: 56 | AN270: 276 | AO270: 8.900000000000001e-002 | AP270: 8 | AQ270: 苏试转债
A271: 350 | B271: 113502 | C271: 嘉澳转债! | D271: 603822 | E271: 嘉澳环保 | F271: 化工 | G271: 化工 | H271: 115.93 | I271: 6.8000000000000005e-003 | J271: -3.4999999999999996e-003 | K271: 30.25 | L271: 4.6399999999999997e-002 | M271: 111.3 | N271: 44.79 | O271: 0.71700000000000008 | P271: 67.54 | Q271: 转股中 | R271: 2.42年 | S271: 0.42年 | T271: 1.85 | U271: 164 | V271: 0.7609999999999999 | W271: 8.3000000000000004e-002 | X271: 5.5999999999999994e-002 | Y271: 22 | Z271: 2.77 | AA271: -1.7000000000000001e-002 | AB271: -2.5399999999999999e-002 | AC271: -0.22 | AD271: -0.22600000000000001 | AE271: 98.28 | AF271: 96.4 | AG271: 0.07 | AH271: AA- | AI271: 6.25e-002 | AJ271: =H271+100*O271 -> 187.63 | AK271: 164.3 | AL271: 318 | AM271: 66 | AN271: 310 | AO271: 0.27600000000000002 | AP271: 36 | AQ271: 嘉澳转债!
A272: 332 | B272: 128035 | C272: 大族转债! | D272: 2008 | E272: 大族激光 | F272: 机械装备 | G272: 专用设备 | H272: 112.453 | I272: -6.6e-003 | J272: 5.6999999999999993e-003 | K272: 37.74 | L272: -1.7399999999999999e-002 | M272: 107.4 | N272: 51.9 | O272: 0.54600000000000004 | P272: 72.72 | Q272: 转股中 | R272: 2.66年 | S272: 0.66年 | T272: 23 | U272: 18 | V272: 6.9999999999999993e-003 | W272: 5.7000000000000002e-002 | X272: 4.2000000000000003e-002 | Y272: 403 | Z272: 4.19 | AA272: -1.7299999999999999e-002 | AB272: -2.2499999999999999e-002 | AC272: -9.2699999999999991e-002 | AD272: -0.10400000000000001 | AE272: 100.62 | AF272: 97.25 | AG272: 0.05 | AH272: AA+ | AI272: 3.85e-002 | AJ272: =H272+100*O272 -> 167.053 | AK272: 152.2 | AL272: 298 | AM272: 51.6 | AN272: 256 | AO272: 2.1000000000000001e-002 | AP272: 19 | AQ272: 大族转债!
A273: 44 | B273: 113618 | C273: 美诺转债! | D273: 603538 | E273: 美诺华 | F273: 医药 | G273: 原料药 | H273: 126.9 | I273: -3.2899999999999999e-002 | J273: -7.4000000000000003e-003 | K273: 44.29 | L273: -5.16e-002 | M273: 115.3 | N273: 37.47 | O273: 7.400000000000001e-002 | P273: 118.2 | Q273: 39天 | R273: 5.59年 | S273: 3.59年 | T273: 5.2 | U273: 131 | V273: 0.19600000000000001 | W273: 7.8e-002 | X273: 9.3000000000000013e-002 | Y273: 66 | Z273: 4.18 | AA273: -1.7299999999999999e-002 | AB273: -2.2000000000000002e-002 | AC273: -5.2499999999999998e-002 | AD273: -5.4199999999999998e-002 | AE273: 82.05 | AF273: 81.57 | AG273: 0.78 | AH273: AA- | AI273: 6.5199999999999994e-002 | AJ273: =H273+100*O273 -> 134.30000000000001 | AK273: 135.6 | AL273: 198 | AM273: 53.5 | AN273: 266 | AO273: 0.113 | AP273: 5 | AQ273: 美诺转债!
A274: 301 | B274: 128051 | C274: 光华转债! | D274: 2741 | E274: 光华科技 | F274: 电子 | G274: 元器件制 | H274: 122.1 | I274: -1.6e-002 | J274: 5.0000000000000001e-004 | K274: 15.48 | L274: -2.0299999999999999e-002 | M274: 114.8 | N274: 12.72 | O274: 3.0000000000000001e-003 | P274: 121.7 | Q274: 转股中 | R274: 3.51年 | S274: 1.51年 | T274: 2.27 | U274: 30 | V274: 0.106 | W274: 3.9e-002 | X274: 4.8000000000000001e-002 | Y274: 58 | Z274: 4.68 | AA274: -1.78e-002 | AB274: -2.5099999999999997e-002 | AC274: -9.6500000000000002e-002 | AD274: -9.9700000000000011e-002 | AE274: 93.02 | AF274: 92.77 | AG274: 0.77 | AH274: AA- | AI274: 6.4100000000000004e-002 | AJ274: =H274+100*O274 -> 122.39999999999999 | AK274: 122.5 | AL274: 59 | AM274: 29.5 | AN274: 58 | AO274: 2.3e-002 | AP274: 27 | AQ274: 光华转债!
A275: 64 | B275: 123083 | C275: 朗新转债 | D275: 300682 | E275: 朗新科技 | F275: 计算机及 | G275: 软件开发 | H275: 127.438 | I275: -1.5900000000000001e-002 | J275: -8.8000000000000005e-003 | K275: 17.71 | L275: -3.44e-002 | M275: 115.1 | N275: 15.45 | O275: 0.11199999999999999 | P275: 114.63 | Q275: 4.1天 | R275: 5.49年 | S275: 3.50年 | T275: 8 | U275: 23 | V275: 2.2000000000000002e-002 | W275: 4.4000000000000004e-002 | X275: 5.0999999999999997e-002 | Y275: 181 | Z275: 3.43 | AA275: -1.8700000000000001e-002 | AB275: -2.3399999999999997e-002 | AC275: -5.5399999999999998e-002 | AD275: -5.7099999999999998e-002 | AE275: 88.55 | AF275: 91.16 | AG275: 0.72 | AH275: AA | AI275: 4.4199999999999996e-002 | AJ275: =H275+100*O275 -> 138.63800000000001 | AK275: 140.2 | AL275: 241 | AM275: 49.1 | AN275: 239 | AO275: 2.9999999999999999e-002 | AP275: 5 | AQ275: 朗新转债
A276: 105 | B276: 128134 | C276: 鸿路转债! | D276: 2541 | E276: 鸿路钢构 | F276: 建筑 | G276: 其他 | H276: 128.42 | I276: -1.44e-002 | J276: 1.09e-002 | K276: 54.49 | L276: -4.4000000000000003e-003 | M276: 115.1 | N276: 43.51 | O276: 2.5000000000000001e-002 | P276: 125.24 | Q276: 转股中 | R276: 5.33年 | S276: 3.33年 | T276: 18.8 | U276: 25 | V276: 1.e-002 | W276: 6.6000000000000003e-002 | X276: 8.199999999999999e-002 | Y276: 285 | Z276: 4.91 | AA276: -2.07e-002 | AB276: -2.5600000000000001e-002 | AC276: -6.0100000000000001e-002 | AD276: -6.1799999999999994e-002 | AE276: 89.19 | AF276: 91.82 | AG276: 0.79 | AH276: AA | AI276: 4.4199999999999996e-002 | AJ276: =H276+100*O276 -> 130.91999999999999 | AK276: 131.6 | AL276: 155 | AM276: 39.8 | AN276: 170 | AO276: 3.7999999999999999e-002 | AP276: 4 | AQ276: 鸿路转债!
A277: 333 | B277: 110043 | C277: 无锡转债! | D277: 600908 | E277: 无锡银行 | F277: 金融 | G277: 银行行业 | H277: 114.58 | I277: -2.1499999999999998e-002 | J277: 1.32e-002 | K277: 5.9 | L277: -1.4999999999999999e-002 | M277: 108.3 | N277: 5.79 | O277: 0.124 | P277: 101.9 | Q277: 转股中 | R277: 2.64年 | S277: 无权 | T277: 29.2 | U277: 196 | V277: 5.7999999999999996e-002 | W277: 0.26600000000000001 | X277: 0.27100000000000002 | Y277: 110 | Z277: 0.89 | AA277: -2.1400000000000002e-002 | AB277: -2.7099999999999999e-002 | AC277: 无权 | AD277: 无权 | AE277: 无权 | AF277: 98.14 | AG277: 0.55 | AH277: AA+ | AI277: 3.85e-002 | AJ277: =H277+100*O277 -> 126.98 | AK277: 127.3 | AL277: 112 | AM277: 29.1 | AN277: 54 | AO277: -2.7999999999999997e-002 | AP277: 24 | AQ277: 无锡转债!
A278: 55 | B278: 113614 | C278: 健20转债! | D278: 603707 | E278: 健友股份 | F278: 医药 | G278: 原料药 | H278: 128.5 | I278: -5.0000000000000001e-003 | J278: -1.21e-002 | K278: 43.89 | L278: -2.3099999999999999e-002 | M278: 114.2 | N278: 38.04 | O278: 0.114 | P278: 115.38 | Q278: 12天 | R278: 5.52年 | S278: 3.52年 | T278: 7.8 | U278: 1.3 | V278: 1.e-003 | W278: 1.9e-002 | X278: 2.2000000000000002e-002 | Y278: 410 | Z278: 10.66 | AA278: -2.1499999999999998e-002 | AB278: -2.6000000000000002e-002 | AC278: -5.7000000000000002e-002 | AD278: -5.8700000000000002e-002 | AE278: 88.56 | AF278: 90.38 | AG278: 0.74 | AH278: AA | AI278: 4.4199999999999996e-002 | AJ278: =H278+100*O278 -> 139.90000000000001 | AK278: 141.6 | AL278: 249 | AM278: 51.2 | AN278: 252 | AO278: 2.6000000000000002e-002 | AP278: 3 | AQ278: 健20转债!
A279: 164 | B279: 113585 | C279: 寿仙转债! | D279: 603896 | E279: 寿仙谷 | F279: 医药 | G279: 中药 | H279: 130.89 | I279: 1.1999999999999999e-003 | J279: -2.3e-003 | K279: 37.3 | L279: -1.2999999999999999e-003 | M279: 117.3 | N279: 28.68 | O279: 6.0000000000000001e-003 | P279: 130.06 | Q279: 转股中 | R279: 4.99年 | S279: 2.99年 | T279: 1.48 | U279: 16 | V279: 8.1000000000000003e-002 | W279: 2.7000000000000003e-002 | X279: 3.4000000000000002e-002 | Y279: 56 | Z279: 4.04 | AA279: -2.2099999999999998e-002 | AB279: -2.7999999999999997e-002 | AC279: -7.1800000000000003e-002 | AD279: -7.3700000000000002e-002 | AE279: 85.31 | AF279: 86.56 | AG279: 0.82 | AH279: AA- | AI279: 6.4100000000000004e-002 | AJ279: =H279+100*O279 -> 131.48999999999998 | AK279: 131.7 | AL279: 158 | AM279: 45.2 | AN279: 213 | AO279: -1.1000000000000001e-002 | AP279: 10 | AQ279: 寿仙转债!
A280: 364 | B280: 110034 | C280: 九州转债! | D280: 600998 | E280: 九州通 | F280: 医药 | G280: 医药商业 | H280: 109.51 | I280: -2.0000000000000001e-004 | J280: -8.0000000000000004e-004 | K280: 16.53 | L280: -1.2e-002 | M280: 108 | N280: 18.32 | O280: 0.214 | P280: 90.23 | Q280: 转股中 | R280: 0.60年 | S280: 回售内 | T280: 15 | U280: 8.5 | V280: 5.0000000000000001e-003 | W280: 4.8000000000000001e-002 | X280: 4.4000000000000004e-002 | Y280: 310 | Z280: 1.53 | AA280: -2.3e-002 | AB280: -4.7100000000000003e-002 | AC280: 回售内 | AD280: 回售内 | AE280: 103 | AF280: 105.83 | AG280: 0.08 | AH280: AA+ | AI280: 3.4500000000000003e-002 | AJ280: =H280+100*O280 -> 130.91 | AK280: 128.8 | AL280: 125 | AM280: 23 | AN280: 24 | AO280: -2.3e-002 | AP280: 24 | AQ280: 九州转债!
A281: 326 | B281: 128036 | C281: 金农转债!! | D281: 2548 | E281: 金新农 | F281: 农业 | G281: 畜牧业 | H281: 116.62 | I281: -7.4999999999999997e-003 | J281: 1.1999999999999999e-003 | K281: 5.73 | L281: -2.2200000000000001e-002 | M281: 109.3 | N281: 6.96 | O281: 0.41700000000000004 | P281: 82.33 | Q281: 转股中 | R281: 2.74年 | S281: 0.74年 | T281: 1.46 | U281: 10 | V281: 6.0999999999999999e-002 | W281: 3.7000000000000005e-002 | X281: 2.9999999999999999e-002 | Y281: 40 | Z281: 1.52 | AA281: -2.3700000000000002e-002 | AB281: -2.98e-002 | AC281: -0.14199999999999999 | AD281: -0.14499999999999999 | AE281: 96.36 | AF281: 92.82 | AG281: 0.28 | AH281: AA- | AI281: 6.25e-002 | AJ281: =H281+100*O281 -> 158.31999999999999 | AK281: 150.9 | AL281: 294 | AM281: 54.6 | AN281: 272 | AO281: -4.7e-002 | AP281: 16 | AQ281: 金农转债!!
A282: 103 | B282: 110075 | C282: 南航转债 | D282: 600029 | E282: 南方航空 | F282: 交通运输 | G282: 航空运输 | H282: 125.13 | I282: -9.1000000000000004e-003 | J282: 5.1999999999999998e-003 | K282: 6.27 | L282: -6.3e-003 | M282: 110 | N282: 6.24 | O282: 0.245 | P282: 100.48 | Q282: 转股中 | R282: 5.34年 | S282: 3.35年 | T282: 160 | U282: 12 | V282: 1.e-003 | W282: 0.16600000000000001 | X282: 0.16699999999999998 | Y282: 961 | Z282: 1.47 | AA282: -2.41e-002 | AB282: -2.7400000000000001e-002 | AC282: -5.62e-002 | AD282: -5.7300000000000004e-002 | AE282: 89.41 | AF282: 89.81 | AG282: 0.61 | AH282: AAA | AI282: 3.9199999999999999e-002 | AJ282: =H282+100*O282 -> 149.63 | AK282: 149.8 | AL282: 290 | AM282: 60 | AN282: 292 | AO282: -3.7999999999999999e-002 | AP282: 7 | AQ282: 南航转债
A283: 279 | B283: 123025 | C283: 精测转债!! | D283: 300567 | E283: 精测电子 | F283: 电子 | G283: 液晶显示 | H283: 127.81 | I283: -1.38e-002 | J283: -1.18e-002 | K283: 52.67 | L283: -3.9699999999999999e-002 | M283: 116.5 | N283: 49.37 | O283: 0.19800000000000001 | P283: 106.68 | Q283: 转股中 | R283: 3.79年 | S283: 1.80年 | T283: 3.09 | U283: 11 | V283: 2.7999999999999997e-002 | W283: 2.1000000000000001e-002 | X283: 2.3e-002 | Y283: 146 | Z283: 7.38 | AA283: -2.4500000000000001e-002 | AB283: -3.1899999999999998e-002 | AC283: -0.105 | AD283: -0.10800000000000001 | AE283: 91.1 | AF283: 92.44 | AG283: 0.65 | AH283: AA- | AI283: 6.4100000000000004e-002 | AJ283: =H283+100*O283 -> 147.61000000000001 | AK283: 148.9 | AL283: 287 | AM283: 56.5 | AN283: 282 | AO283: -1.3000000000000001e-002 | AP283: 16 | AQ283: 精测转债!!
A284: 39 | B284: 113621 | C284: 彤程转债 | D284: 603650 | E284: 彤程新材 | F284: 化工 | G284: 橡胶塑料 | H284: 132.92 | I284: -5.04e-002 | J284: -2.8300000000000002e-002 | K284: 40.57 | L284: -0.10000000000000001 | M284: 115.1 | N284: 32.62 | O284: 6.9000000000000006e-002 | P284: 124.37 | Q284: 52天 | R284: 5.62年 | S284: 3.63年 | T284: 8 | U284: 356 | V284: 0.33299999999999996 | W284: 3.4000000000000002e-002 | X284: 4.2000000000000003e-002 | Y284: 238 | Z284: 9.22 | AA284: -2.5699999999999997e-002 | AB284: -3.0299999999999997e-002 | AC284: -6.4000000000000001e-002 | AD284: -6.5700000000000008e-002 | AE284: 88.05 | AF284: 90.64 | AG284: 0.79 | AH284: AA | AI284: 4.4199999999999996e-002 | AJ284: =H284+100*O284 -> 139.81999999999999 | AK284: 141.5 | AL284: 247 | AM284: 50.8 | AN284: 250 | AO284: 9.6000000000000002e-002 | AP284: 4 | AQ284: 彤程转债
A285: 15 | B285: 123108 | C285: 乐普转2 | D285: 300003 | E285: 乐普医疗 | F285: 医药 | G285: 医疗器械 | H285: 126.22 | I285: 9.0000000000000011e-003 | J285: -7.6e-003 | K285: 30.93 | L285: 2.3e-003 | M285: 111.1 | N285: 29.73 | O285: 0.21299999999999999 | P285: 104.04 | Q285: 3月29天 | R285: 4.80年 | S285: 2.80年 | T285: 16.4 | U285: 25 | V285: 1.2e-002 | W285: 2.8999999999999998e-002 | X285: 3.1e-002 | Y285: 558 | Z285: 5.25 | AA285: -2.6499999999999999e-002 | AB285: -3.0600000000000002e-002 | AC285: -6.9400000000000003e-002 | AD285: -7.0599999999999996e-002 | AE285: 90.86 | AF285: 92.2 | AG285: 0.62 | AH285: AA+ | AI285: 4.0099999999999997e-002 | AJ285: =H285+100*O285 -> 147.52000000000001 | AK285: 148.4 | AL285: 286 | AM285: 56.2 | AN285: 277 | AO285: -4.0999999999999995e-002 | AP285: 8 | AQ285: 乐普转2
A286: 258 | B286: 113541 | C286: 荣晟转债! | D286: 603165 | E286: 荣晟环保 | F286: 造纸包装 | G286: 包装用纸 | H286: 128.39 | I286: -9.3999999999999986e-003 | J286: 7.7000000000000002e-003 | K286: 13.94 | L286: -2.0999999999999999e-003 | M286: 115 | N286: 10.84 | O286: -2.e-003 | P286: 128.6 | Q286: 转股中 | R286: 4年41天 | S286: 2年42天 | T286: 1.63 | U286: 24 | V286: 0.115 | W286: 4.4999999999999998e-002 | X286: 5.7000000000000002e-002 | Y286: 37 | Z286: 2.09 | AA286: -2.7000000000000003e-002 | AB286: -3.32e-002 | AC286: -9.11e-002 | AD286: -9.3699999999999992e-002 | AE286: 89.99 | AF286: 89.61 | AG286: 0.8 | AH286: AA- | AI286: 6.4100000000000004e-002 | AJ286: =H286+100*O286 -> 128.19 | AK286: 128.2 | AL286: 119 | AM286: 38.2 | AN286: 148 | AO286: -8.0000000000000002e-003 | AP286: 43 | AQ286: 荣晟转债!
A287: 193 | B287: 123047 | C287: 久吾转债 | D287: 300631 | E287: 久吾高科 | F287: 机械装备 | G287: 专用设备 | H287: 147.36 | I287: -3.6900000000000002e-002 | J287: -5.1000000000000004e-003 | K287: 22.84 | L287: -5.62e-002 | M287: 129.6 | N287: 17.43 | O287: 0.125 | P287: 131.04 | Q287: 转股中 | R287: 4.77年 | S287: 2.77年 | T287: 1.99 | U287: 411 | V287: 1.3899999999999999 | W287: 8.0000000000000002e-002 | X287: 0.105 | Y287: 25 | Z287: 3 | AA287: -2.7200000000000002e-002 | AB287: -3.6799999999999999e-002 | AC287: -0.107 | AD287: -0.11 | AE287: 85.57 | AF287: 92.65 | AG287: 0.75 | AH287: A+ | AI287: 7.51e-002 | AJ287: =H287+100*O287 -> 159.86000000000001 | AK287: 163.7 | AL287: 317 | AM287: 71 | AN287: 318 | AO287: 3.7000000000000005e-002 | AP287: 22 | AQ287: 久吾转债
A288: 315 | B288: 123012 | C288: 万顺转债! | D288: 300057 | E288: 万顺新材 | F288: 有色金属 | G288: 铝金属 | H288: 120.85 | I288: 1.1200000000000002e-002 | J288: -1.5600000000000001e-002 | K288: 5.06 | L288: -7.8000000000000005e-003 | M288: 110.3 | N288: 5.27 | O288: 0.25900000000000001 | P288: 96.02 | Q288: 转股中 | R288: 3年38天 | S288: 1年39天 | T288: 1.29 | U288: 93 | V288: 0.59899999999999998 | W288: 3.7999999999999999e-002 | X288: 3.6000000000000004e-002 | Y288: 34 | Z288: 0.96 | AA288: -2.9600000000000001e-002 | AB288: -3.5499999999999997e-002 | AC288: -0.114 | AD288: -0.11699999999999999 | AE288: 95.06 | AF288: 91.37 | AG288: 0.56 | AH288: AA- | AI288: 6.4100000000000004e-002 | AJ288: =H288+100*O288 -> 146.75 | AK288: 145.7 | AL288: 274 | AM288: 50.6 | AN288: 248 | AO288: 4.5999999999999999e-002 | AP288: 20 | AQ288: 万顺转债!
A289: 355 | B289: 113013 | C289: 国君转债! | D289: 601211 | E289: 国泰君安 | F289: 金融 | G289: 证券行业 | H289: 115.18 | I289: -1.2699999999999999e-002 | J289: 3.2000000000000002e-003 | K289: 16.8 | L289: -2.9999999999999999e-002 | M289: 108.3 | N289: 19.01 | O289: 0.30299999999999999 | P289: 88.37 | Q289: 转股中 | R289: 2年26天 | S289: 无权 | T289: 69.9 | U289: 20 | V289: 2.e-003 | W289: 4.7e-002 | X289: 4.0999999999999995e-002 | Y289: 1497. | Z289: 1.15 | AA289: -2.9900000000000003e-002 | AB289: -3.7100000000000001e-002 | AC289: 无权 | AD289: 无权 | AE289: 无权 | AF289: 100.71 | AG289: 0.31 | AH289: AAA | AI289: 3.6499999999999998e-002 | AJ289: =H289+100*O289 -> 145.48000000000002 | AK289: 142 | AL289: 254 | AM289: 41.3 | AN289: 183 | AO289: -2.8999999999999998e-002 | AP289: 13 | AQ289: 国君转债!
A290: 100 | B290: 127022 | C290: 恒逸转债 | D290: 703 | E290: 恒逸石化 | F290: 化工 | G290: 化工 | H290: 128.03 | I290: -9.1000000000000004e-003 | J290: -4.5000000000000005e-003 | K290: 12.9 | L290: -1.83e-002 | M290: 108.9 | N290: 11.5 | O290: 0.14099999999999999 | P290: 112.17 | Q290: 转股中 | R290: 5.35年 | S290: 3.35年 | T290: 20 | U290: 15 | V290: 6.0000000000000001e-003 | W290: 4.2000000000000003e-002 | X290: 4.7e-002 | Y290: 475 | Z290: 1.92 | AA290: -3.0200000000000001e-002 | AB290: -3.32e-002 | AC290: -6.1200000000000004e-002 | AD290: -6.2600000000000003e-002 | AE290: 89.15 | AF290: 88.04 | AG290: 0.74 | AH290: AA+ | AI290: 4.1200000000000001e-002 | AJ290: =H290+100*O290 -> 142.13 | AK290: 143.9 | AL290: 265 | AM290: 54.7 | AN290: 273 | AO290: 1.1000000000000001e-002 | AP290: 6 | AQ290: 恒逸转债
A291: 119 | B291: 128128 | C291: 齐翔转2! | D291: 2408 | E291: 齐翔腾达 | F291: 化工 | G291: 化工 | H291: 135.53 | I291: -1.18e-002 | J291: -5.9999999999999995e-004 | K291: 11.1 | L291: -1.5100000000000001e-002 | M291: 115.3 | N291: 8.22 | O291: 4.0000000000000001e-003 | P291: 135.04 | Q291: 转股中 | R291: 5.19年 | S291: 3.19年 | T291: 10.7 | U291: 35 | V291: 2.4e-002 | W291: 5.0000000000000003e-002 | X291: 6.7000000000000004e-002 | Y291: 214 | Z291: 2.03 | AA291: -3.1200000000000002e-002 | AB291: -3.6200000000000003e-002 | AC291: -7.7199999999999991e-002 | AD291: -7.9100000000000004e-002 | AE291: 89.83 | AF291: 92.54 | AG291: 0.82 | AH291: AA | AI291: 4.4199999999999996e-002 | AJ291: =H291+100*O291 -> 135.93000000000001 | AK291: 136 | AL291: 204 | AM291: 43.5 | AN291: 201 | AO291: 4.0000000000000001e-003 | AP291: 36 | AQ291: 齐翔转2!
A292: 344 | B292: 128025 | C292: 特一转债! | D292: 2728 | E292: 特一药业 | F292: 医药 | G292: 化学制药 | H292: 118 | I292: -2.4799999999999999e-002 | J292: 3.4999999999999996e-003 | K292: 14.04 | L292: -3.7000000000000005e-002 | M292: 108.8 | N292: 14.05 | O292: 0.18100000000000002 | P292: 99.93 | Q292: 转股中 | R292: 2.49年 | S292: 0.49年 | T292: 2.98 | U292: 152 | V292: 0.42599999999999999 | W292: 0.10400000000000001 | X292: 0.10400000000000001 | Y292: 29 | Z292: 2.68 | AA292: -3.2599999999999997e-002 | AB292: -3.8900000000000004e-002 | AC292: -0.222 | AD292: -0.22600000000000001 | AE292: 97.61 | AF292: 93.79 | AG292: 0.57 | AH292: AA- | AI292: 6.25e-002 | AJ292: =H292+100*O292 -> 136.09999999999999 | AK292: 136.1 | AL292: 205 | AM292: 38.5 | AN292: 152 | AO292: -0.13300000000000001 | AP292: 50 | AQ292: 特一转债!
A293: 187 | B293: 113575 | C293: 东时转债!! | D293: 603377 | E293: 东方时尚 | F293: 其他 | G293: 其他 | H293: 132.45 | I293: -3.8e-003 | J293: 3.4000000000000002e-003 | K293: 11.8 | L293: -8.0000000000000004e-004 | M293: 113.1 | N293: 14.56 | O293: 0.63400000000000001 | P293: 81.04 | Q293: 转股中 | R293: 4.82年 | S293: 2.83年 | T293: 0.98 | U293: 32 | V293: 0.245 | W293: 1.3999999999999999e-002 | X293: 1.1000000000000001e-002 | Y293: 72 | Z293: 3.44 | AA293: -3.2799999999999996e-002 | AB293: -3.7400000000000003e-002 | AC293: -7.980000000000001e-002 | AD293: -8.1799999999999998e-002 | AE293: 91.26 | AF293: 92.63 | AG293: 0.38 | AH293: AA | AI293: 4.3099999999999999e-002 | AJ293: =H293+100*O293 -> 195.84999999999999 | AK293: 183.9 | AL293: 334 | AM293: 91.2 | AN293: 333 | AO293: 6.4000000000000001e-002 | AP293: 15 | AQ293: 东时转债!!
A294: 363 | B294: 113009 | C294: 广汽转债! | D294: 601238 | E294: 广汽集团 | F294: 汽车 | G294: 乘用车 | H294: 108.27 | I294: 1.e-002 | J294: -7.4999999999999997e-003 | K294: 12.03 | L294: 4.4299999999999999e-002 | M294: 106 | N294: 13.97 | O294: 0.25700000000000001 | P294: 86.11 | Q294: 转股中 | R294: 0.62年 | S294: 回售内 | T294: 25.5 | U294: 37 | V294: 1.3000000000000001e-002 | W294: 2.e-002 | X294: 1.8000000000000002e-002 | Y294: 1245. | Z294: 1.44 | AA294: -3.3799999999999997e-002 | AB294: -5.1500000000000004e-002 | AC294: 回售内 | AD294: 回售内 | AE294: 100.27 | AF294: 103.93 | AG294: 0.06 | AH294: AAA | AI294: 3.2500000000000001e-002 | AJ294: =H294+100*O294 -> 133.97 | AK294: 130.4 | AL294: 140 | AM294: 26.5 | AN294: 37 | AO294: 1.3999999999999999e-002 | AP294: 15 | AQ294: 广汽转债!
A295: 22 | B295: 127030 | C295: 盛虹转债 | D295: 301 | E295: 东方盛虹 | F295: 化工 | G295: 化纤 | H295: 137 | I295: -3.5200000000000002e-002 | J295: 8.8999999999999999e-003 | K295: 16.91 | L295: -3.4799999999999998e-002 | M295: 112.5 | N295: 14.2 | O295: 0.14999999999999999 | P295: 119.08 | Q295: 3月18天 | R295: 5.78年 | S295: 3.78年 | T295: 50 | U295: 48 | V295: 6.9999999999999993e-003 | W295: 6.0999999999999999e-002 | X295: 7.2999999999999995e-002 | Y295: 818 | Z295: 4.51 | AA295: -3.4000000000000002e-002 | AB295: -3.7699999999999997e-002 | AC295: -7.0099999999999996e-002 | AD295: -7.1399999999999991e-002 | AE295: 87.92 | AF295: 89.4 | AG295: 0.75 | AH295: AA+ | AI295: 4.1200000000000001e-002 | AJ295: =H295+100*O295 -> 152. | AK295: 154.9 | AL295: 308 | AM295: 65.5 | AN295: 308 | AO295: -3.1e-002 | AP295: 4 | AQ295: 盛虹转债
A296: 329 | B296: 127005 | C296: 长证转债! | D296: 783 | E296: 长江证券 | F296: 金融 | G296: 证券行业 | H296: 118.99 | I296: -1.5800000000000002e-002 | J296: 5.5000000000000005e-003 | K296: 7.36 | L296: -1.8700000000000001e-002 | M296: 108.3 | N296: 7.28 | O296: 0.17699999999999999 | P296: 101.1 | Q296: 转股中 | R296: 2.75年 | S296: 无权 | T296: 50 | U296: 30 | V296: 5.0000000000000001e-003 | W296: 0.12300000000000001 | X296: 0.124 | Y296: 407 | Z296: 1.41 | AA296: -3.4200000000000001e-002 | AB296: -3.95e-002 | AC296: 无权 | AD296: 无权 | AE296: 无权 | AF296: 98.29 | AG296: 0.55 | AH296: AAA | AI296: 3.6499999999999998e-002 | AJ296: =H296+100*O296 -> 136.69 | AK296: 136.9 | AL296: 215 | AM296: 38.6 | AN296: 155 | AO296: -2.7999999999999997e-002 | AP296: 14 | AQ296: 长证转债!
A297: 322 | B297: 128040 | C297: 华通转债! | D297: 2758 | E297: 浙农股份 | F297: 医药 | G297: 医药商业 | H297: 124.4 | I297: 0.153 | J297: -9.1600000000000001e-002 | K297: 10.48 | L297: 9.9700000000000011e-002 | M297: 112.3 | N297: 10.15 | O297: 0.20499999999999999 | P297: 103.25 | Q297: 转股中 | R297: 3年2.1天 | S297: 1年3.1天 | T297: 2.22 | U297: 2896. | V297: 10.27 | W297: 4.2999999999999997e-002 | X297: 4.4999999999999998e-002 | Y297: 51 | Z297: 1.7 | AA297: -3.4200000000000001e-002 | AB297: -4.1299999999999996e-002 | AC297: -0.14599999999999999 | AD297: -0.14899999999999999 | AE297: 95.65 | AF297: 93.59 | AG297: 0.61 | AH297: AA- | AI297: 6.4100000000000004e-002 | AJ297: =H297+100*O297 -> 144.90000000000001 | AK297: 145.5 | AL297: 272 | AM297: 49.9 | AN297: 242 | AO297: 7.0000000000000007e-002 | AP297: 31 | AQ297: 华通转债!
A298: 214 | B298: 123042 | C298: 银河转债! | D298: 300619 | E298: 金银河 | F298: 机械装备 | G298: 专用设备 | H298: 135.2 | I298: 7.3000000000000001e-003 | J298: 1.1399999999999999e-002 | K298: 22.1 | L298: 3.0800000000000001e-002 | M298: 115.4 | N298: 24.4 | O298: 0.49299999999999999 | P298: 90.57 | Q298: 转股中 | R298: 4.59年 | S298: 2.59年 | T298: 1.67 | U298: 243 | V298: 1.0700000000000001 | W298: 0.10099999999999999 | X298: 9.1999999999999998e-002 | Y298: 17 | Z298: 3.38 | AA298: -3.4599999999999999e-002 | AB298: -4.0199999999999993e-002 | AC298: -9.2399999999999996e-002 | AD298: -9.4600000000000004e-002 | AE298: 85.14 | AF298: 83.4 | AG298: 0.61 | AH298: A+ | AI298: 7.51e-002 | AJ298: =H298+100*O298 -> 184.5 | AK298: 179.8 | AL298: 332 | AM298: 94.7 | AN298: 335 | AO298: 0.114 | AP298: 22 | AQ298: 银河转债!
A299: 236 | B299: 110061 | C299: 川投转债 | D299: 600674 | E299: 川投能源 | F299: 能源电力 | G299: 水电 | H299: 129.15 | I299: -4.8999999999999998e-003 | J299: 6.3e-003 | K299: 12 | L299: 1.7000000000000001e-003 | M299: 110.8 | N299: 9.58 | O299: 3.1e-002 | P299: 125.26 | Q299: 转股中 | R299: 4.42年 | S299: 2.42年 | T299: 39.6 | U299: 14 | V299: 3.0000000000000001e-003 | W299: 7.4999999999999997e-002 | X299: 9.4e-002 | Y299: 529 | Z299: 1.84 | AA299: -3.4700000000000002e-002 | AB299: -3.9e-002 | AC299: -8.3400000000000002e-002 | AD299: -8.5600000000000009e-002 | AE299: 93.87 | AF299: 94.25 | AG299: 0.8 | AH299: AAA | AI299: 3.8100000000000002e-002 | AJ299: =H299+100*O299 -> 132.25 | AK299: 133 | AL299: 174 | AM299: 38.8 | AN299: 159 | AO299: 1.6e-002 | AP299: 15 | AQ299: 川投转债
A300: 295 | B300: 128053 | C300: 尚荣转债! | D300: 2551 | E300: 尚荣医疗 | F300: 医药 | G300: 医疗器械 | H300: 130.444 | I300: -2.2000000000000001e-003 | J300: -8.3999999999999995e-003 | K300: 5.57 | L300: -1.0700000000000001e-002 | M300: 114.3 | N300: 4.89 | O300: 0.14499999999999999 | P300: 113.91 | Q300: 转股中 | R300: 3.68年 | S300: 1.68年 | T300: 1.91 | U300: 37 | V300: 0.14899999999999999 | W300: 4.2000000000000003e-002 | X300: 4.8000000000000001e-002 | Y300: 46 | Z300: 1.49 | AA300: -3.5900000000000001e-002 | AB300: -4.2500000000000003e-002 | AC300: -0.10300000000000001 | AD300: -0.105 | AE300: 95.15 | AF300: 98.15 | AG300: 0.99 | AH300: AA | AI300: 4.3099999999999999e-002 | AJ300: =H300+100*O300 -> 144.94399999999999 | AK300: 147 | AL300: 281 | AM300: 48.8 | AN300: 236 | AO300: -5.2000000000000005e-002 | AP300: 25 | AQ300: 尚荣转债!
A301: 49 | B301: 113615 | C301: 金诚转债 | D301: 603979 | E301: 金诚信 | F301: 有色金属 | G301: 有色行业 | H301: 143.49 | I301: 2.4700000000000003e-002 | J301: 7.000000000000001e-004 | K301: 17.98 | L301: 2.98e-002 | M301: 117.3 | N301: 12.65 | O301: 1.e-002 | P301: 142.13 | Q301: 18天 | R301: 5.53年 | S301: 3.53年 | T301: 10 | U301: 68 | V301: 4.8000000000000001e-002 | W301: 9.5000000000000001e-002 | X301: 0.13500000000000001 | Y301: 105 | Z301: 2.26 | AA301: -3.6400000000000002e-002 | AB301: -4.1599999999999998e-002 | AC301: -8.4499999999999992e-002 | AD301: -8.6199999999999999e-002 | AE301: 88.59 | AF301: 92.77 | AG301: 0.85 | AH301: AA | AI301: 4.4199999999999996e-002 | AJ301: =H301+100*O301 -> 144.49000000000001 | AK301: 144.8 | AL301: 270 | AM301: 52.1 | AN301: 261 | AO301: 8.9999999999999997e-002 | AP301: 3 | AQ301: 金诚转债
A302: 121 | B302: 110074 | C302: 精达转债! | D302: 600577 | E302: 精达股份 | F302: 电子 | G302: 电子产品 | H302: 142.32 | I302: -5.3800000000000001e-002 | J302: 4.4000000000000003e-003 | K302: 5.27 | L302: -5.8899999999999994e-002 | M302: 117.3 | N302: 3.73 | O302: 6.9999999999999993e-003 | P302: 141.29 | Q302: 转股中 | R302: 5.19年 | S302: 3.19年 | T302: 7.41 | U302: 231 | V302: 0.21899999999999997 | W302: 7.2999999999999995e-002 | X302: 0.10300000000000001 | Y302: 101 | Z302: 2.67 | AA302: -3.73e-002 | AB302: -4.2800000000000005e-002 | AC302: -9.06e-002 | AD302: -9.2399999999999996e-002 | AE302: 89.93 | AF302: 94.17 | AG302: 0.84 | AH302: AA | AI302: 4.4199999999999996e-002 | AJ302: =H302+100*O302 -> 143.01999999999998 | AK302: 143.4 | AL302: 261 | AM302: 49.2 | AN302: 240 | AO302: 2.8999999999999998e-002 | AP302: 12 | AQ302: 精达转债!
A303: 28 | B303: 123103 | C303: 震安转债 | D303: 300767 | E303: 震安科技 | F303: 化工 | G303: 橡胶塑料 | H303: 151.93 | I303: -2.6699999999999998e-002 | J303: 2.1600000000000001e-002 | K303: 74.39 | L303: -6.3e-003 | M303: 121.4 | N303: 56.89 | O303: 0.16200000000000001 | P303: 130.76 | Q303: 3月11天 | R303: 5.75年 | S303: 3.75年 | T303: 2.85 | U303: 59 | V303: 0.13500000000000001 | W303: 2.7000000000000003e-002 | X303: 3.5000000000000003e-002 | Y303: 107 | Z303: 9.41 | AA303: -3.9e-002 | AB303: -4.4999999999999998e-002 | AC303: -9.1799999999999993e-002 | AD303: -9.3699999999999992e-002 | AE303: 78.7 | AF303: 80.37 | AG303: 0.82 | AH303: A+ | AI303: 7.6200000000000004e-002 | AJ303: =H303+100*O303 -> 168.13 | AK303: 173.1 | AL303: 326 | AM303: 92.7 | AN303: 334 | AO303: -0.32299999999999995 | AP303: 3 | AQ303: 震安转债
A304: 109 | B304: 123066 | C304: 赛意转债! | D304: 300687 | E304: 赛意信息 | F304: 计算机及 | G304: 软件开发 | H304: 149.2 | I304: -2.3599999999999999e-002 | J304: -3.7000000000000002e-003 | K304: 20.52 | L304: -3.2099999999999997e-002 | M304: 121.4 | N304: 14.01 | O304: 1.9e-002 | P304: 146.47 | Q304: 转股中 | R304: 5.26年 | S304: 3.27年 | T304: 2.64 | U304: 1283. | V304: 3.2000000000000002 | W304: 3.7000000000000005e-002 | X304: 5.4000000000000006e-002 | Y304: 72 | Z304: 4.53 | AA304: -3.9199999999999999e-002 | AB304: -4.5700000000000005e-002 | AC304: -9.9900000000000003e-002 | AD304: -0.10199999999999999 | AE304: 81.33 | AF304: 83.24 | AG304: 0.85 | AH304: A+ | AI304: 7.6200000000000004e-002 | AJ304: =H304+100*O304 -> 151.09999999999999 | AK304: 151.9 | AL304: 297 | AM304: 68.7 | AN304: 314 | AO304: -0.158 | AP304: 8 | AQ304: 赛意转债!
A305: 41 | B305: 123094 | C305: 星源转2! | D305: 300568 | E305: 星源材质 | F305: 电子 | G305: 电子行业 | H305: 147.2 | I305: 1.8700000000000001e-002 | J305: -2.9999999999999997e-004 | K305: 46.47 | L305: 2.1299999999999999e-002 | M305: 117.3 | N305: 31.53 | O305: -1.e-003 | P305: 147.38 | Q305: 45天 | R305: 5.61年 | S305: 3.61年 | T305: 10 | U305: 305 | V305: 0.20800000000000002 | W305: 4.8000000000000001e-002 | X305: 7.0999999999999994e-002 | Y305: 209 | Z305: 6.89 | AA305: -4.0399999999999998e-002 | AB305: -4.5400000000000003e-002 | AC305: -8.900000000000001e-002 | AD305: -9.0700000000000003e-002 | AE305: 88.3 | AF305: 92.47 | AG305: 0.86 | AH305: AA | AI305: 4.4199999999999996e-002 | AJ305: =H305+100*O305 -> 147.09999999999999 | AK305: 147 | AL305: 282 | AM305: 54.5 | AN305: 271 | AO305: 0.17100000000000001 | AP305: 4 | AQ305: 星源转2!
A306: 95 | B306: 113040 | C306: 星宇转债 | D306: 601799 | E306: 星宇股份 | F306: 汽车 | G306: 零部件制 | H306: 139.06 | I306: 7.4999999999999997e-003 | J306: -3.5999999999999999e-003 | K306: 209.77 | L306: 4.7999999999999996e-003 | M306: 111.5 | N306: 158 | O306: 4.7e-002 | P306: 132.77 | Q306: 转股中 | R306: 5.36年 | S306: 3.36年 | T306: 15 | U306: 29 | V306: 1.3999999999999999e-002 | W306: 2.6000000000000002e-002 | X306: 3.4000000000000002e-002 | Y306: 579 | Z306: 9.58 | AA306: -4.0800000000000003e-002 | AB306: -4.4500000000000005e-002 | AC306: -8.3800000000000013e-002 | AD306: -8.4900000000000003e-002 | AE306: 88.74 | AF306: 90.05 | AG306: 0.83 | AH306: AA+ | AI306: 4.1200000000000001e-002 | AJ306: =H306+100*O306 -> 143.75999999999999 | AK306: 145.4 | AL306: 271 | AM306: 55.3 | AN306: 274 | AO306: 8.199999999999999e-002 | AP306: 5 | AQ306: 星宇转债
A307: 204 | B307: 123043 | C307: 正元转债 | D307: 300645 | E307: 正元智慧 | F307: 计算机及 | G307: 软件开发 | H307: 147.577 | I307: 1.7399999999999999e-002 | J307: -1.4800000000000001e-002 | K307: 16.41 | L307: 3.7000000000000002e-003 | M307: 120.9 | N307: 15.38 | O307: 0.38299999999999995 | P307: 106.7 | Q307: 转股中 | R307: 4.73年 | S307: 2.73年 | T307: 1.66 | U307: 1485. | V307: 5.8399999999999999 | W307: 7.9000000000000001e-002 | X307: 8.5000000000000006e-002 | Y307: 21 | Z307: 3.25 | AA307: -4.2099999999999999e-002 | AB307: -4.9200000000000001e-002 | AC307: -0.113 | AD307: -0.115 | AE307: 84.55 | AF307: 86.52 | AG307: 0.69 | AH307: A+ | AI307: 7.51e-002 | AJ307: =H307+100*O307 -> 185.87700000000001 | AK307: 188.5 | AL307: 336 | AM307: 101.9 | AN307: 339 | AO307: -1.2e-002 | AP307: 18 | AQ307: 正元转债
A308: 223 | B308: 110065 | C308: 淮矿转债!!* | D308: 600985 | E308: 淮北矿业 | F308: 煤炭 | G308: 煤炭开采 | H308: 136.41 | I308: 5.1999999999999998e-003 | J308: 1.5e-003 | K308: 11.88 | L308: 6.8000000000000005e-003 | M308: 110.8 | N308: 8.68 | O308: -3.0000000000000001e-003 | P308: 136.87 | Q308: 转股中 | R308: 4.53年 | S308: 2.53年 | T308: 12.6 | U308: 438 | V308: 0.255 | W308: 4.5999999999999999e-002 | X308: 6.3e-002 | Y308: 272 | Z308: 1.16 | AA308: -4.5599999999999995e-002 | AB308: -4.9699999999999994e-002 | AC308: -9.8599999999999993e-002 | AD308: -0.10099999999999999 | AE308: 93.46 | AF308: 93.85 | AG308: 1 | AH308: AAA | AI308: 3.8100000000000002e-002 | AJ308: =H308+100*O308 -> 136.10999999999999 | AK308: 136 | AL308: 201 | AM308: 42.1 | AN308: 191 | AO308: 1.4999999999999999e-002 | AP308: 19 | AQ308: 淮矿转债!!*
A309: 9 | B309: 113047 | C309: 旗滨转债 | D309: 601636 | E309: 旗滨集团 | F309: 建筑 | G309: 玻璃 | H309: 149.14 | I309: -1.5700000000000002e-002 | J309: -5.6999999999999993e-003 | K309: 17.7 | L309: -2.64e-002 | M309: 114 | N309: 13.15 | O309: 0.10800000000000001 | P309: 134.6 | Q309: 4月6天 | R309: 5.82年 | S309: 3.83年 | T309: 15 | U309: 37 | V309: 1.7000000000000001e-002 | W309: 3.2000000000000001e-002 | X309: 4.2000000000000003e-002 | Y309: 475 | Z309: 4.58 | AA309: -4.5599999999999995e-002 | AB309: -4.9599999999999998e-002 | AC309: -8.9999999999999997e-002 | AD309: -9.0999999999999998e-002 | AE309: 87.31 | AF309: 90.38 | AG309: 0.81 | AH309: AA+ | AI309: 4.1200000000000001e-002 | AJ309: =H309+100*O309 -> 159.94 | AK309: 163.7 | AL309: 316 | AM309: 73.3 | AN309: 320 | AO309: 7.5999999999999998e-002 | AP309: 5 | AQ309: 旗滨转债
A310: 303 | B310: 110048 | C310: 福能转债! | D310: 600483 | E310: 福能股份 | F310: 能源电力 | G310: 电力供应 | H310: 133.02 | I310: -3.8e-003 | J310: 7.7000000000000002e-003 | K310: 10.89 | L310: 4.5999999999999999e-003 | M310: 113.3 | N310: 8.12 | O310: -8.0000000000000002e-003 | P310: 134.11 | Q310: 转股中 | R310: 3.49年 | S310: 1.49年 | T310: 20.4 | U310: 113 | V310: 4.0999999999999995e-002 | W310: 0.105 | X310: 0.14000000000000001 | Y310: 194 | Z310: 1.23 | AA310: -4.58e-002 | AB310: -5.2199999999999996e-002 | AC310: -0.127 | AD310: -0.129 | AE310: 96.37 | AF310: 99.05 | AG310: 0.84 | AH310: AA+ | AI310: 4.0099999999999997e-002 | AJ310: =H310+100*O310 -> 132.22 | AK310: 131.9 | AL310: 160 | AM310: 32.9 | AN310: 99 | AO310: 6.2e-002 | AP310: 9 | AQ310: 福能转债!
A311: 244 | B311: 128079 | C311: 英联转债! | D311: 2846 | E311: 英联股份 | F311: 造纸包装 | G311: 包装材料 | H311: 144.5 | I311: 3.3599999999999998e-002 | J311: -3.3599999999999998e-002 | K311: 8.24 | L311: 0. | M311: 117.5 | N311: 8.29 | O311: 0.45399999999999996 | P311: 99.4 | Q311: 转股中 | R311: 4.36年 | S311: 2.36年 | T311: 1.52 | U311: 444 | V311: 2.04 | W311: 5.7999999999999996e-002 | X311: 5.7999999999999996e-002 | Y311: 26 | Z311: 3.4 | AA311: -4.7300000000000002e-002 | AB311: -5.3800000000000001e-002 | AC311: -0.12300000000000001 | AD311: -0.125 | AE311: 86.5 | AF311: 86.32 | AG311: 0 | AH311: A+ | AI311: 7.51e-002 | AJ311: =H311+100*O311 -> 189.90000000000001 | AK311: 189.6 | AL311: 337 | AM311: 103.1 | AN311: 340 | AO311: -5.0000000000000001e-003 | AP311: 18 | AQ311: 英联转债!
A312: 24 | B312: 127029 | C312: 中钢转债 | D312: 928 | E312: 中钢国际 | F312: 建筑 | G312: 建筑工程 | H312: 154.9 | I312: 1.1699999999999999e-002 | J312: 1.1699999999999999e-002 | K312: 9.91 | L312: 2.5899999999999999e-002 | M312: 117.5 | N312: 5.89 | O312: -7.9000000000000001e-002 | P312: 168.25 | Q312: 3月18天 | R312: 5.77年 | S312: 3.77年 | T312: 9.6 | U312: 528 | V312: 0.35499999999999998 | W312: 7.6999999999999999e-002 | X312: 0.13 | Y312: 125 | Z312: 2.16 | AA312: -4.7400000000000005e-002 | AB312: -5.2300000000000006e-002 | AC312: -9.8900000000000002e-002 | AD312: -0.10000000000000001 | AE312: 87.95 | AF312: 93.39 | AG312: 0.9 | AH312: AA+ | AI312: 4.1200000000000001e-002 | AJ312: =H312+100*O312 -> 147. | AK312: 141.5 | AL312: 248 | AM312: 48.2 | AN312: 233 | AO312: -9.3000000000000013e-002 | AP312: 8 | AQ312: 中钢转债
A313: 239 | B313: 113548 | C313: 石英转债! | D313: 603688 | E313: 石英股份 | F313: 电子 | G313: 电子产品 | H313: 154.01 | I313: -6.0999999999999995e-003 | J313: 8.9999999999999998e-004 | K313: 22.46 | L313: -6.1999999999999998e-003 | M313: 124.4 | N313: 14.93 | O313: 2.4e-002 | P313: 150.44 | Q313: 转股中 | R313: 4.38年 | S313: 2.38年 | T313: 1.23 | U313: 104 | V313: 0.54899999999999993 | W313: 1.4999999999999999e-002 | X313: 2.3e-002 | Y313: 79 | Z313: 4.02 | AA313: -4.8600000000000004e-002 | AB313: -5.7300000000000004e-002 | AC313: -0.10300000000000001 | AD313: -0.105 | AE313: 89.23 | AF313: 95.42 | AG313: 0.85 | AH313: AA- | AI313: 6.4100000000000004e-002 | AJ313: =H313+100*O313 -> 156.41 | AK313: 157.6 | AL313: 310 | AM313: 62.2 | AN313: 300 | AO313: 0.183 | AP313: 13 | AQ313: 石英转债!
A314: 272 | B314: 113534 | C314: 鼎胜转债! | D314: 603876 | E314: 鼎胜新材 | F314: 有色金属 | G314: 小金属 | H314: 138.79 | I314: 8.72e-002 | J314: -8.6e-003 | K314: 21.4 | L314: 9.0700000000000003e-002 | M314: 114.3 | N314: 15.18 | O314: -1.4999999999999999e-002 | P314: 140.97 | Q314: 转股中 | R314: 3.82年 | S314: 1.83年 | T314: 11.4 | U314: 2583. | V314: 1.6399999999999999 | W314: 0.12300000000000001 | X314: 0.17300000000000001 | Y314: 93 | Z314: 2.56 | AA314: -5.0300000000000004e-002 | AB314: -5.6500000000000002e-002 | AC314: -0.114 | AD314: -0.11599999999999999 | AE314: 94.56 | AF314: 97.55 | AG314: 0.87 | AH314: AA | AI314: 4.3099999999999999e-002 | AJ314: =H314+100*O314 -> 137.28999999999999 | AK314: 136.6 | AL314: 211 | AM314: 39.1 | AN314: 161 | AO314: 0.39600000000000002 | AP314: 36 | AQ314: 鼎胜转债!
A315: 360 | B315: 113011 | C315: 光大转债 | D315: 601818 | E315: 光大银行 | F315: 金融 | G315: 银行行业 | H315: 116.93 | I315: -2.0000000000000001e-004 | J315: 1.6000000000000001e-003 | K315: 3.83 | L315: 2.5999999999999999e-003 | M315: 106.8 | N315: 3.76 | O315: 0.14800000000000002 | P315: 101.86 | Q315: 转股中 | R315: 1.76年 | S315: 无权 | T315: 242 | U315: 138 | V315: 5.0000000000000001e-003 | W315: 0.11699999999999999 | X315: 0.11900000000000001 | Y315: 2069. | Z315: 0.58 | AA315: -5.0499999999999996e-002 | AB315: -5.74e-002 | AC315: 无权 | AD315: 无权 | AE315: 无权 | AF315: 100.32 | AG315: 0.53 | AH315: AAA | AI315: 3.6499999999999998e-002 | AJ315: =H315+100*O315 -> 131.73000000000002 | AK315: 132 | AL315: 162 | AM315: 31.7 | AN315: 83 | AO315: -3.0000000000000001e-003 | AP315: 13 | AQ315: 光大转债
A316: 12 | B316: 123111 | C316: 东财转3 | D316: 300059 | E316: 东方财富 | F316: 金融 | G316: 证券行业 | H316: 149.8 | I316: 1.7000000000000001e-003 | J316: 4.0000000000000002e-004 | K316: 31.37 | L316: 2.5999999999999999e-003 | M316: 110.5 | N316: 23.35 | O316: 0.115 | P316: 134.35 | Q316: 4月4天 | R316: 5.82年 | S316: 3.82年 | T316: 158 | U316: 677 | V316: 2.8999999999999998e-002 | W316: 4.9000000000000002e-002 | X316: 6.5000000000000002e-002 | Y316: 3242. | Z316: 7.7 | AA316: -5.1399999999999994e-002 | AB316: -5.45e-002 | AC316: -9.2200000000000004e-002 | AD316: -9.3000000000000013e-002 | AE316: 86.89 | AF316: 87.58 | AG316: 0.83 | AH316: AA+ | AI316: 4.1200000000000001e-002 | AJ316: =H316+100*O316 -> 161.30000000000001 | AK316: 165.3 | AL316: 320 | AM316: 77.7 | AN316: 325 | AO316: -5.2000000000000005e-002 | AP316: 16 | AQ316: 东财转3
A317: 93 | B317: 127023 | C317: 华菱转2! | D317: 932 | E317: 华菱钢铁 | F317: 钢铁 | G317: 炼钢 | H317: 146 | I317: 2.8199999999999999e-002 | J317: 7.8000000000000005e-003 | K317: 7.21 | L317: 3.5900000000000001e-002 | M317: 110.1 | N317: 4.97 | O317: 6.0000000000000001e-003 | P317: 145.07 | Q317: 转股中 | R317: 5.36年 | S317: 4.37年 | T317: 20.7 | U317: 242 | V317: 8.0000000000000002e-002 | W317: 4.7e-002 | X317: 6.8000000000000005e-002 | Y317: 442 | Z317: 1.26 | AA317: -5.1900000000000002e-002 | AB317: -5.5099999999999996e-002 | AC317: -7.1900000000000006e-002 | AD317: -7.3499999999999996e-002 | AE317: 87.91 | AF317: 89.86 | AG317: 1 | AH317: AAA | AI317: 3.9199999999999999e-002 | AJ317: =H317+100*O317 -> 146.59999999999999 | AK317: 146.9 | AL317: 280 | AM317: 57.1 | AN317: 283 | AO317: 4.2999999999999997e-002 | AP317: 12 | AQ317: 华菱转2!
A318: 325 | B318: 113508 | C318: 新凤转债! | D318: 603225 | E318: 新凤鸣 | F318: 服装纺织 | G318: 纺织行业 | H318: 129.54 | I318: -1.11e-002 | J318: -8.8999999999999999e-003 | K318: 20.42 | L318: -2.4399999999999998e-002 | M318: 111.3 | N318: 15.78 | O318: 1.e-003 | P318: 129.4 | Q318: 转股中 | R318: 2.87年 | S318: 0.87年 | T318: 20.6 | U318: 48 | V318: 1.8000000000000002e-002 | W318: 7.2000000000000008e-002 | X318: 9.3000000000000013e-002 | Y318: 286 | Z318: 2.34 | AA318: -5.2199999999999996e-002 | AB318: -5.8799999999999998e-002 | AC318: -0.20499999999999999 | AD318: -0.20800000000000002 | AE318: 97.59 | AF318: 99.2 | AG318: 0.82 | AH318: AA | AI318: 4.1500000000000002e-002 | AJ318: =H318+100*O318 -> 129.63999999999999 | AK318: 129.7 | AL318: 130 | AM318: 30.5 | AN318: 69 | AO318: 6.5000000000000002e-002 | AP318: 22 | AQ318: 新凤转债!
A319: 47 | B319: 113616 | C319: 韦尔转债 | D319: 603501 | E319: 韦尔股份 | F319: 电子 | G319: 元器件制 | H319: 154.1 | I319: 7.1999999999999998e-003 | J319: 4.8999999999999998e-003 | K319: 289.47 | L319: 1.5100000000000001e-002 | M319: 114.5 | N319: 222.83 | O319: 0.18600000000000003 | P319: 129.91 | Q319: 24天 | R319: 5.55年 | S319: 3.55年 | T319: 24.4 | U319: 116 | V319: 3.1e-002 | W319: 1.e-002 | X319: 1.3000000000000001e-002 | Y319: 2513. | Z319: 20.2 | AA319: -5.28e-002 | AB319: -5.7099999999999998e-002 | AC319: -0.10000000000000001 | AD319: -0.10199999999999999 | AE319: 88.74 | AF319: 91.84 | AG319: 0.8 | AH319: AA+ | AI319: 4.1200000000000001e-002 | AJ319: =H319+100*O319 -> 172.69999999999999 | AK319: 178.3 | AL319: 330 | AM319: 86.5 | AN319: 331 | AO319: 1.3999999999999999e-002 | AP319: 8 | AQ319: 韦尔转债
A320: 71 | B320: 113611 | C320: 福20转债 | D320: 603806 | E320: 福斯特 | F320: 能源电力 | G320: 太阳能 | H320: 150.88 | I320: 2.5000000000000001e-002 | J320: 6.3500000000000001e-002 | K320: 92.79 | L320: 0.10000000000000001 | M320: 111.85 | N320: 61.03 | O320: -8.0000000000000002e-003 | P320: 152.04 | Q320: 转股中 | R320: 5.47年 | S320: 3.47年 | T320: 17 | U320: 546 | V320: 0.214 | W320: 2.e-002 | X320: 2.9999999999999999e-002 | Y320: 857 | Z320: 7.8 | AA320: -5.3899999999999997e-002 | AB320: -5.7500000000000002e-002 | AC320: -0.10099999999999999 | AD320: -0.10199999999999999 | AE320: 87.79 | AF320: 88.59 | AG320: 0.88 | AH320: AA | AI320: 4.4199999999999996e-002 | AJ320: =H320+100*O320 -> 150.07999999999998 | AK320: 149.7 | AL320: 289 | AM320: 61.1 | AN320: 298 | AO320: 0.14999999999999999 | AP320: 5 | AQ320: 福20转债
A321: 285 | B321: 123022 | C321: 长信转债!! | D321: 300088 | E321: 长信科技 | F321: 通信互联 | G321: 通信设备 | H321: 141 | I321: -2.7099999999999999e-002 | J321: -9.7000000000000003e-003 | K321: 7.87 | L321: -4.6100000000000002e-002 | M321: 114.3 | N321: 6.15 | O321: 0.10199999999999999 | P321: 127.97 | Q321: 转股中 | R321: 3.76年 | S321: 1.77年 | T321: 2.57 | U321: 15 | V321: 4.0999999999999995e-002 | W321: 1.3000000000000001e-002 | X321: 1.7000000000000001e-002 | Y321: 193 | Z321: 2.68 | AA321: -5.5099999999999996e-002 | AB321: -6.1399999999999996e-002 | AC321: -0.125 | AD321: -0.126 | AE321: 94.8 | AF321: 97.8 | AG321: 0.8 | AH321: AA | AI321: 4.3099999999999999e-002 | AJ321: =H321+100*O321 -> 151.19999999999999 | AK321: 154 | AL321: 304 | AM321: 56.2 | AN321: 278 | AO321: -2.9999999999999999e-002 | AP321: 12 | AQ321: 长信转债!!
A322: 185 | B322: 113034 | C322: 滨化转债! | D322: 601678 | E322: 滨化股份 | F322: 化工 | G322: 化工 | H322: 154.02 | I322: 1.3000000000000001e-002 | J322: -6.6e-003 | K322: 7.04 | L322: 7.1999999999999998e-003 | M322: 114.8 | N322: 4.58 | O322: 2.e-003 | P322: 153.71 | Q322: 转股中 | R322: 4.83年 | S322: 2.83年 | T322: 6 | U322: 83 | V322: 8.900000000000001e-002 | W322: 4.4000000000000004e-002 | X322: 6.8000000000000005e-002 | Y322: 136 | Z322: 1.54 | AA322: -5.9999999999999998e-002 | AB322: -6.4899999999999999e-002 | AC322: -0.124 | AD322: -0.125 | AE322: 91.12 | AF322: 93.99 | AG322: 0.89 | AH322: AA | AI322: 4.3099999999999999e-002 | AJ322: =H322+100*O322 -> 154.22 | AK322: 154.3 | AL322: 306 | AM322: 60.3 | AN322: 294 | AO322: 1.9e-002 | AP322: 24 | AQ322: 滨化转债!
A323: 161 | B323: 128113 | C323: 比音转债! | D323: 2832 | E323: 比音勒芬 | F323: 服装纺织 | G323: 服装行业 | H323: 159.02 | I323: -1.5700000000000002e-002 | J323: -2.3999999999999998e-003 | K323: 23.53 | L323: -2.e-002 | M323: 117.3 | N323: 14.9 | O323: 6.9999999999999993e-003 | P323: 157.92 | Q323: 转股中 | R323: 5年3.1天 | S323: 3年4.1天 | T323: 3.58 | U323: 34 | V323: 5.9000000000000004e-002 | W323: 2.7999999999999997e-002 | X323: 4.4000000000000004e-002 | Y323: 128 | Z323: 4.86 | AA323: -5.9999999999999998e-002 | AB323: -6.5500000000000003e-002 | AC323: -0.124 | AD323: -0.126 | AE323: 90.62 | AF323: 94.9 | AG323: 0.9 | AH323: AA | AI323: 4.4199999999999996e-002 | AJ323: =H323+100*O323 -> 159.72 | AK323: 160.1 | AL323: 314 | AM323: 65.2 | AN323: 306 | AO323: 5.5e-002 | AP323: 9 | AQ323: 比音转债!
A324: 224 | B324: 113559 | C324: 永创转债!! | D324: 603901 | E324: 永创智能 | F324: 机械装备 | G324: 专用设备 | H324: 159.27 | I324: -2.2599999999999999e-002 | J324: -9.300000000000001e-003 | K324: 16.35 | L324: -3.2000000000000001e-002 | M324: 118.3 | N324: 10.32 | O324: 5.0000000000000001e-003 | P324: 158.43 | Q324: 转股中 | R324: 4.53年 | S324: 2.53年 | T324: 2.16 | U324: 155 | V324: 0.45100000000000001 | W324: 2.9999999999999999e-002 | X324: 4.8000000000000001e-002 | Y324: 72 | Z324: 4.93 | AA324: -6.4899999999999999e-002 | AB324: -7.1199999999999999e-002 | AC324: -0.10199999999999999 | AD324: -0.10300000000000001 | AE324: 88.46 | AF324: 89.93 | AG324: 1 | AH324: AA- | AI324: 6.4100000000000004e-002 | AJ324: =H324+100*O324 -> 159.77000000000001 | AK324: 160.1 | AL324: 313 | AM324: 70.2 | AN324: 316 | AO324: 5.7999999999999996e-002 | AP324: 17 | AQ324: 永创转债!!
A325: 147 | B325: 123058 | C325: 欣旺转债 | D325: 300207 | E325: 欣旺达 | F325: 电子 | G325: 电子产品 | H325: 163.5 | I325: 1.4999999999999999e-002 | J325: -5.4000000000000003e-003 | K325: 34.4 | L325: 1.06e-002 | M325: 116.3 | N325: 21.17 | O325: 6.0000000000000001e-003 | P325: 162.49 | Q325: 转股中 | R325: 5年32天 | S325: 3年33天 | T325: 9.15 | U325: 836 | V325: 0.55000000000000004 | W325: 1.7000000000000001e-002 | X325: 2.7000000000000003e-002 | Y325: 541 | Z325: 7.75 | AA325: -6.59e-002 | AB325: -7.0999999999999994e-002 | AC325: -0.128 | AD325: -0.13 | AE325: 90.31 | AF325: 93.77 | AG325: 0.91 | AH325: AA | AI325: 4.4199999999999996e-002 | AJ325: =H325+100*O325 -> 164.09999999999999 | AK325: 164.5 | AL325: 319 | AM325: 70.7 | AN325: 317 | AO325: 0.217 | AP325: 7 | AQ325: 欣旺转债
A326: 308 | B326: 128046 | C326: 利尔转债!! | D326: 2258 | E326: 利尔化学 | F326: 化工 | G326: 农化 | H326: 142.6 | I326: -9.7000000000000003e-003 | J326: -2.3e-003 | K326: 25.51 | L326: -1.2e-002 | M326: 112.3 | N326: 18.42 | O326: 2.9999999999999999e-002 | P326: 138.49 | Q326: 转股中 | R326: 3.35年 | S326: 1.35年 | T326: 8.47 | U326: 44 | V326: 3.6000000000000004e-002 | W326: 6.3e-002 | X326: 8.8000000000000009e-002 | Y326: 134 | Z326: 3.44 | AA326: -7.0099999999999996e-002 | AB326: -7.6100000000000001e-002 | AC326: -0.17399999999999999 | AD326: -0.17600000000000002 | AE326: 96.48 | AF326: 97.79 | AG326: 1 | AH326: AA | AI326: 4.3099999999999999e-002 | AJ326: =H326+100*O326 -> 145.59999999999999 | AK326: 146.7 | AL326: 278 | AM326: 48.9 | AN326: 237 | AO326: 7.6999999999999999e-002 | AP326: 9 | AQ326: 利尔转债!!
A327: 233 | B327: 113550 | C327: 常汽转债! | D327: 603035 | E327: 常熟汽饰 | F327: 汽车 | G327: 零部件制 | H327: 168.17 | I327: -5.8999999999999999e-003 | J327: -2.0999999999999999e-003 | K327: 15.74 | L327: -8.8000000000000005e-003 | M327: 121.3 | N327: 9.33 | O327: -3.0000000000000001e-003 | P327: 168.7 | Q327: 转股中 | R327: 4.44年 | S327: 2.44年 | T327: 2.72 | U327: 983 | V327: 2.1200000000000001 | W327: 4.9000000000000002e-002 | X327: 8.3000000000000004e-002 | Y327: 55 | Z327: 1.47 | AA327: -7.2499999999999995e-002 | AB327: -7.980000000000001e-002 | AC327: -0.11900000000000001 | AD327: -0.12 | AE327: 88.83 | AF327: 92.73 | AG327: 0.91 | AH327: AA- | AI327: 6.4100000000000004e-002 | AJ327: =H327+100*O327 -> 167.86999999999998 | AK327: 167.6 | AL327: 323 | AM327: 74.9 | AN327: 321 | AO327: 4.2000000000000003e-002 | AP327: 16 | AQ327: 常汽转债!
A328: 359 | B328: 113012 | C328: 骆驼转债! | D328: 601311 | E328: 骆驼股份 | F328: 汽车 | G328: 零部件制 | H328: 121.71 | I328: -6.4000000000000003e-003 | J328: -5.7999999999999996e-003 | K328: 11.09 | L328: -1.77e-002 | M328: 106.5 | N328: 10.06 | O328: 0.10400000000000001 | P328: 110.24 | Q328: 转股中 | R328: 1.78年 | S328: 回售内 | T328: 5.09 | U328: 11 | V328: 1.7000000000000001e-002 | W328: 4.0999999999999995e-002 | X328: 4.4999999999999998e-002 | Y328: 124 | Z328: 1.64 | AA328: -7.2599999999999998e-002 | AB328: -7.8899999999999998e-002 | AC328: 回售内 | AD328: 回售内 | AE328: 100.25 | AF328: 99.11 | AG328: 0.69 | AH328: AA | AI328: 4.1500000000000002e-002 | AJ328: =H328+100*O328 -> 132.10999999999999 | AK328: 133.2 | AL328: 176 | AM328: 32.9 | AN328: 100 | AO328: -7.5999999999999998e-002 | AP328: 16 | AQ328: 骆驼转债!
A329: 163 | B329: 123054 | C329: 思特转债! | D329: 300608 | E329: 思特奇 | F329: 通信互联 | G329: 通信设备 | H329: 177.03 | I329: 9.2799999999999994e-002 | J329: 7.6200000000000004e-002 | K329: 18.3 | L329: 0.20000000000000001 | M329: 121.2 | N329: 12.63 | O329: 0.222 | P329: 144.89 | Q329: 转股中 | R329: 4.99年 | S329: 2.997年 | T329: 2.71 | U329: 8671. | V329: 17.449999999999999 | W329: 7.2000000000000008e-002 | X329: 0.105 | Y329: 37 | Z329: 3.76 | AA329: -7.4400000000000008e-002 | AB329: -8.0799999999999997e-002 | AC329: -0.151 | AD329: -0.153 | AE329: 85.7 | AF329: 89.47 | AG329: 0.84 | AH329: AA- | AI329: 6.4100000000000004e-002 | AJ329: =H329+100*O329 -> 199.22999999999999 | AK329: 209.2 | AL329: 343 | AM329: 119.7 | AN329: 345 | AO329: 0.60299999999999998 | AP329: 21 | AQ329: 思特转债!
A330: 191 | B330: 128103 | C330: 同德转债! | D330: 2360 | E330: 同德化工 | F330: 化工 | G330: 化工 | H330: 174.521 | I330: 3.39e-002 | J330: -5.57e-002 | K330: 7.17 | L330: -2.18e-002 | M330: 121.3 | N330: 5.08 | O330: 0.23600000000000002 | P330: 141.14 | Q330: 转股中 | R330: 4.79年 | S330: 2.79年 | T330: 1.09 | U330: 320 | V330: 1.6899999999999999 | W330: 3.7999999999999999e-002 | X330: 5.4000000000000006e-002 | Y330: 29 | Z330: 2.23 | AA330: -7.46e-002 | AB330: -8.1300000000000011e-002 | AC330: -0.105 | AD330: -0.106 | AE330: 84.31 | AF330: 86.45 | AG330: 1 | AH330: A+ | AI330: 7.51e-002 | AJ330: =H330+100*O330 -> 198.12099999999998 | AK330: 207.9 | AL330: 342 | AM330: 121.4 | AN330: 347 | AO330: -5.2000000000000005e-002 | AP330: 13 | AQ330: 同德转债!
A331: 264 | B331: 113537 | C331: 文灿转债!! | D331: 603348 | E331: 文灿股份 | F331: 汽车 | G331: 零部件制 | H331: 163.62 | I331: -4.0999999999999995e-002 | J331: -1.3100000000000001e-002 | K331: 30.03 | L331: -6.1600000000000002e-002 | M331: 120.7 | N331: 19.43 | O331: 5.9000000000000004e-002 | P331: 154.55 | Q331: 转股中 | R331: 3.99年 | S331: 1.997年 | T331: 1.44 | U331: 166 | V331: 0.70200000000000007 | W331: 1.8000000000000002e-002 | X331: 2.7999999999999997e-002 | Y331: 78 | Z331: 3.02 | AA331: -7.4700000000000003e-002 | AB331: -8.2599999999999993e-002 | AC331: -0.14699999999999999 | AD331: -0.14899999999999999 | AE331: 90.68 | AF331: 94.68 | AG331: 0.88 | AH331: AA- | AI331: 6.4100000000000004e-002 | AJ331: =H331+100*O331 -> 169.52000000000001 | AK331: 172.7 | AL331: 325 | AM331: 78 | AN331: 327 | AO331: 8.900000000000001e-002 | AP331: 24 | AQ331: 文灿转债!!
A332: 206 | B332: 110066 | C332: 盛屯转债!! | D332: 600711 | E332: 盛屯矿业 | F332: 有色金属 | G332: 有色行业 | H332: 166.84 | I332: 1.9e-003 | J332: 4.0000000000000001e-003 | K332: 7.63 | L332: 6.6e-003 | M332: 114.9 | N332: 4.88 | O332: 6.7000000000000004e-002 | P332: 156.35 | Q332: 转股中 | R332: 4.72年 | S332: 2.72年 | T332: 5.22 | U332: 169 | V332: 0.193 | W332: 2.6000000000000002e-002 | X332: 4.0000000000000001e-002 | Y332: 204 | Z332: 1.82 | AA332: -7.7199999999999991e-002 | AB332: -8.2100000000000006e-002 | AC332: -0.10199999999999999 | AD332: -0.10300000000000001 | AE332: 91.63 | AF332: 94.51 | AG332: 0.9 | AH332: AA | AI332: 4.3099999999999999e-002 | AJ332: =H332+100*O332 -> 173.53999999999999 | AK332: 177.3 | AL332: 329 | AM332: 82.8 | AN332: 329 | AO332: -2.6000000000000002e-002 | AP332: 34 | AQ332: 盛屯转债!!
A333: 339 | B333: 128032 | C333: 双环转债! | D333: 2472 | E333: 双环传动 | F333: 机械装备 | G333: 通用设备 | H333: 134.485 | I333: 4.0199999999999993e-002 | J333: 1.72e-002 | K333: 13.52 | L333: 6.4600000000000005e-002 | M333: 109.3 | N333: 9.87 | O333: -1.8000000000000002e-002 | P333: 136.98 | Q333: 转股中 | R333: 2.54年 | S333: 0.54年 | T333: 8.98 | U333: 472 | V333: 0.39299999999999996 | W333: 9.6000000000000002e-002 | X333: 0.13200000000000001 | Y333: 93 | Z333: 2.66 | AA333: -7.9600000000000004e-002 | AB333: -8.5699999999999998e-002 | AC333: -0.35600000000000004 | AD333: -0.35999999999999999 | AE333: 98.93 | AF333: 98.76 | AG333: 0.89 | AH333: AA | AI333: 4.1500000000000002e-002 | AJ333: =H333+100*O333 -> 132.685 | AK333: 132 | AL333: 161 | AM333: 33.1 | AN333: 101 | AO333: 8.6999999999999994e-002 | AP333: 38 | AQ333: 双环转债!
A334: 86 | B334: 113041 | C334: 紫金转债!* | D334: 601899 | E334: 紫金矿业 | F334: 有色金属 | G334: 贵金属 | H334: 157.55 | I334: -2.e-003 | J334: -4.4000000000000003e-003 | K334: 11 | L334: -6.3e-003 | M334: 108 | N334: 7 | O334: 3.0000000000000001e-003 | P334: 157.14 | Q334: 转股中 | R334: 4.39年 | S334: 2.40年 | T334: 42.4 | U334: 1277. | V334: 0.191 | W334: 1.4999999999999999e-002 | X334: 2.4e-002 | Y334: 2811. | Z334: 5.22 | AA334: -8.2899999999999988e-002 | AB334: -8.5900000000000004e-002 | AC334: -0.113 | AD334: -0.114 | AE334: 92.1 | AF334: 91.76 | AG334: 1 | AH334: AAA | AI334: 3.8100000000000002e-002 | AJ334: =H334+100*O334 -> 157.85000000000002 | AK334: 158 | AL334: 312 | AM334: 65.9 | AN334: 309 | AO334: -1.1000000000000001e-002 | AP334: 9 | AQ334: 紫金转债!*
A335: 331 | B335: 113504 | C335: 艾华转债!! | D335: 603989 | E335: 艾华集团 | F335: 电子 | G335: 元器件制 | H335: 142.62 | I335: -1.3899999999999999e-002 | J335: -2.3999999999999998e-003 | K335: 30.08 | L335: -1.8000000000000002e-002 | M335: 109.3 | N335: 21.13 | O335: 2.e-003 | P335: 142.36 | Q335: 转股中 | R335: 2.72年 | S335: 0.72年 | T335: 4.95 | U335: 19 | V335: 2.6000000000000002e-002 | W335: 4.0999999999999995e-002 | X335: 5.9000000000000004e-002 | Y335: 120 | Z335: 4.46 | AA335: -9.4399999999999998e-002 | AB335: -9.9900000000000003e-002 | AC335: -0.32600000000000001 | AD335: -0.32899999999999996 | AE335: 98.19 | AF335: 98.02 | AG335: 0.91 | AH335: AA | AI335: 4.1500000000000002e-002 | AJ335: =H335+100*O335 -> 142.81999999999999 | AK335: 142.9 | AL335: 259 | AM335: 44.7 | AN335: 207 | AO335: 2.1000000000000001e-002 | AP335: 9 | AQ335: 艾华转债!!
A336: 237 | B336: 123034 | C336: 通光转债! | D336: 300265 | E336: 通光线缆 | F336: 通信互联 | G336: 通信设备 | H336: 181.832 | I336: 5.9999999999999995e-004 | J336: 1.e-003 | K336: 9.17 | L336: 2.2000000000000001e-003 | M336: 118 | N336: 7.97 | O336: 0.57999999999999996 | P336: 115.06 | Q336: 转股中 | R336: 4.40年 | S336: 2.40年 | T336: 0.78 | U336: 48 | V336: 0.33899999999999997 | W336: 2.3e-002 | X336: 2.7000000000000003e-002 | Y336: 33 | Z336: 2.57 | AA336: -9.5199999999999993e-002 | AB336: -0.10099999999999999 | AC336: -0.13800000000000001 | AD336: -0.14000000000000001 | AE336: 86.13 | AF336: 86.42 | AG336: 0.74 | AH336: A+ | AI336: 7.51e-002 | AJ336: =H336+100*O336 -> 239.83199999999999 | AK336: 248.6 | AL336: 349 | AM336: 162.2 | AN336: 350 | AO336: 4.0999999999999995e-002 | AP336: 21 | AQ336: 通光转债!
A337: 365 | B337: 110033 | C337: 国贸转债! | D337: 600755 | E337: 厦门国贸 | F337: 交通运输 | G337: 交通运输 | H337: 114.35 | I337: 2.0799999999999999e-002 | J337: 2.81e-002 | K337: 8.21 | L337: 6.7599999999999993e-002 | M337: 108 | N337: 7.18 | O337: 0. | P337: 114.35 | Q337: 转股中 | R337: 0.57年 | S337: 回售内 | T337: 12.1 | U337: 338 | V337: 0.24399999999999999 | W337: 7.5999999999999998e-002 | X337: 8.6999999999999994e-002 | Y337: 160 | Z337: 0.99 | AA337: -9.5399999999999985e-002 | AB337: -0.11900000000000001 | AC337: 回售内 | AD337: 回售内 | AE337: 100.33 | AF337: 106.05 | AG337: 0.72 | AH337: AAA | AI337: 3.2500000000000001e-002 | AJ337: =H337+100*O337 -> 114.34999999999999 | AK337: 114.4 | AL337: 14 | AM337: 8.3 | AN337: 2 | AO337: 0.11900000000000001 | AP337: 18 | AQ337: 国贸转债!
A338: 209 | B338: 128097 | C338: 奥佳转债! | D338: 2614 | E338: 奥佳华 | F338: 机械装备 | G338: 专用设备 | H338: 185.579 | I338: -1.e-004 | J338: -4.0000000000000002e-004 | K338: 19.35 | L338: -5.0000000000000001e-004 | M338: 114.9 | N338: 10.39 | O338: -4.0000000000000001e-003 | P338: 186.24 | Q338: 转股中 | R338: 4.71年 | S338: 2.71年 | T338: 4.97 | U338: 81 | V338: 8.8000000000000009e-002 | W338: 4.0999999999999995e-002 | X338: 7.5999999999999998e-002 | Y338: 121 | Z338: 2.64 | AA338: -9.8299999999999998e-002 | AB338: -0.10300000000000001 | AC338: -0.121 | AD338: -0.122 | AE338: 91.69 | AF338: 94.56 | AG338: 0.95 | AH338: AA | AI338: 4.3099999999999999e-002 | AJ338: =H338+100*O338 -> 185.179 | AK338: 184.9 | AL338: 335 | AM338: 90.4 | AN338: 332 | AO338: 0.126 | AP338: 21 | AQ338: 奥佳转债!
A339: 336 | B339: 128033 | C339: 迪龙转债! | D339: 2658 | E339: 雪迪龙 | F339: 城市公用 | G339: 三废处理 | H339: 144.85 | I339: 5.8999999999999999e-003 | J339: 1.6799999999999999e-002 | K339: 9.88 | L339: 3.2400000000000005e-002 | M339: 108.8 | N339: 8.71 | O339: 0.27699999999999997 | P339: 113.43 | Q339: 转股中 | R339: 2.55年 | S339: 0.55年 | T339: 2.98 | U339: 1097. | V339: 2.48 | W339: 4.8000000000000001e-002 | X339: 5.4000000000000006e-002 | Y339: 62 | Z339: 2.61 | AA339: -0.10800000000000001 | AB339: -0.113 | AC339: -0.434 | AD339: -0.43700000000000006 | AE339: 98.66 | AF339: 98.26 | AG339: 0.7 | AH339: AA | AI339: 4.1500000000000002e-002 | AJ339: =H339+100*O339 -> 172.54999999999998 | AK339: 176.3 | AL339: 328 | AM339: 77.6 | AN339: 324 | AO339: -7.8e-002 | AP339: 35 | AQ339: 迪龙转债!
A340: 271 | B340: 113025 | C340: 明泰转债!! | D340: 601677 | E340: 明泰铝业 | F340: 有色金属 | G340: 铝金属 | H340: 179 | I340: 2.3999999999999998e-003 | J340: 3.5999999999999999e-003 | K340: 19.2 | L340: 6.3e-003 | M340: 114.5 | N340: 11 | O340: 2.6000000000000002e-002 | P340: 174.55 | Q340: 转股中 | R340: 3.83年 | S340: 1.83年 | T340: 11 | U340: 51 | V340: 2.6000000000000002e-002 | W340: 8.4000000000000005e-002 | X340: 0.14599999999999999 | Y340: 131 | Z340: 1.45 | AA340: -0.11199999999999999 | AB340: -0.11800000000000001 | AC340: -0.19 | AD340: -0.191 | AE340: 94.58 | AF340: 97.71 | AG340: 0.95 | AH340: AA | AI340: 4.3099999999999999e-002 | AJ340: =H340+100*O340 -> 181.59999999999999 | AK340: 183.5 | AL340: 333 | AM340: 85.7 | AN340: 330 | AO340: 2.7999999999999997e-002 | AP340: 24 | AQ340: 明泰转债!!
A341: 247 | B341: 113545 | C341: 金能转债! | D341: 603113 | E341: 金能科技 | F341: 煤炭 | G341: 炼焦 | H341: 191.53 | I341: 2.0099999999999996e-002 | J341: -3.4999999999999996e-003 | K341: 19.88 | L341: 1.7399999999999999e-002 | M341: 114.9 | N341: 10.43 | O341: 5.0000000000000001e-003 | P341: 190.6 | Q341: 转股中 | R341: 4.34年 | S341: 2.34年 | T341: 10.2 | U341: 155 | V341: 8.0000000000000002e-002 | W341: 5.9999999999999998e-002 | X341: 0.115 | Y341: 169 | Z341: 2.04 | AA341: -0.113 | AB341: -0.11800000000000001 | AC341: -0.153 | AD341: -0.154 | AE341: 93.12 | AF341: 96.04 | AG341: 0.95 | AH341: AA | AI341: 4.3099999999999999e-002 | AJ341: =H341+100*O341 -> 192.03 | AK341: 192.5 | AL341: 338 | AM341: 96.4 | AN341: 337 | AO341: 4.7e-002 | AP341: 17 | AQ341: 金能转债!
A342: 252 | B342: 123030 | C342: 九洲转债! | D342: 300040 | E342: 九洲集团 | F342: 能源电力 | G342: 电力设备 | H342: 197.106 | I342: 1.1599999999999999e-002 | J342: 2.0199999999999999e-002 | K342: 10.26 | L342: 3.4300000000000004e-002 | M342: 120 | N342: 5.65 | O342: 8.5000000000000006e-002 | P342: 181.59 | Q342: 转股中 | R342: 4.19年 | S342: 2.19年 | T342: 0.97 | U342: 727 | V342: 3.7799999999999998 | W342: 2.5000000000000001e-002 | X342: 4.4999999999999998e-002 | Y342: 39 | Z342: 1.75 | AA342: -0.114 | AB342: -0.12 | AC342: -0.17199999999999999 | AD342: -0.17300000000000001 | AE342: 89.56 | AF342: 93.04 | AG342: 0.93 | AH342: AA- | AI342: 6.4100000000000004e-002 | AJ342: =H342+100*O342 -> 205.60599999999999 | AK342: 212.6 | AL342: 345 | AM342: 119.6 | AN342: 344 | AO342: 0.121 | AP342: 25 | AQ342: 九洲转债!
A343: 194 | B343: 123046 | C343: 天铁转债! | D343: 300587 | E343: 天铁股份 | F343: 铁路 | G343: 铁路设备 | H343: 207.65 | I343: 9.7000000000000003e-003 | J343: 6.0000000000000001e-003 | K343: 21.04 | L343: 1.6399999999999998e-002 | M343: 117.7 | N343: 10.12 | O343: -1.e-003 | P343: 207.91 | Q343: 转股中 | R343: 4.77年 | S343: 2.77年 | T343: 0.77 | U343: 269 | V343: 1.6799999999999999 | W343: 1.1000000000000001e-002 | X343: 2.2000000000000002e-002 | Y343: 72 | Z343: 4.42 | AA343: -0.114 | AB343: -0.11900000000000001 | AC343: -0.13400000000000001 | AD343: -0.13500000000000001 | AE343: 86.49 | AF343: 88.08 | AG343: 0.96 | AH343: AA- | AI343: 6.4100000000000004e-002 | AJ343: =H343+100*O343 -> 207.55000000000001 | AK343: 207.4 | AL343: 341 | AM343: 119.3 | AN343: 342 | AO343: 0.16 | AP343: 12 | AQ343: 天铁转债!
A344: 296 | B344: 113527 | C344: 维格转债!! | D344: 603518 | E344: 锦泓集团 | F344: 服装纺织 | G344: 服装行业 | H344: 192.73 | I344: -4.0800000000000003e-002 | J344: -5.1999999999999998e-003 | K344: 18.84 | L344: -4.8499999999999995e-002 | M344: 119.5 | N344: 9.85 | O344: 8.0000000000000002e-003 | P344: 191.27 | Q344: 转股中 | R344: 3.62年 | S344: 1.62年 | T344: 4.62 | U344: 632 | V344: 0.70400000000000007 | W344: 8.6999999999999994e-002 | X344: 0.16699999999999998 | Y344: 53 | Z344: 2.48 | AA344: -0.125 | AB344: -0.13300000000000001 | AC344: -0.23899999999999999 | AD344: -0.24100000000000002 | AE344: 93.81 | AF344: 99.43 | AG344: 0.95 | AH344: AA | AI344: 5.3099999999999994e-002 | AJ344: =H344+100*O344 -> 193.53 | AK344: 194.2 | AL344: 339 | AM344: 94.8 | AN344: 336 | AO344: -7.2000000000000008e-002 | AP344: 88 | AQ344: 维格转债!!
A345: 286 | B345: 110055 | C345: 伊力转债!! | D345: 600197 | E345: 伊力特 | F345: 食品饮料 | G345: 白酒 | H345: 188.56 | I345: -6.1999999999999998e-003 | J345: -2.1600000000000001e-002 | K345: 30.37 | L345: -2.9100000000000001e-002 | M345: 114.3 | N345: 16.81 | O345: 4.4000000000000004e-002 | P345: 180.67 | Q345: 转股中 | R345: 3.76年 | S345: 1.76年 | T345: 2.47 | U345: 1081. | V345: 2.3100000000000001 | W345: 1.7000000000000001e-002 | X345: 3.1e-002 | Y345: 143 | Z345: 3.99 | AA345: -0.127 | AB345: -0.13200000000000001 | AC345: -0.21299999999999999 | AD345: -0.214 | AE345: 94.83 | AF345: 97.83 | AG345: 0.96 | AH345: AA | AI345: 4.3099999999999999e-002 | AJ345: =H345+100*O345 -> 192.96000000000001 | AK345: 196.5 | AL345: 340 | AM345: 98.6 | AN345: 338 | AO345: 1.8000000000000002e-002 | AP345: 23 | AQ345: 伊力转债!!
A346: 256 | B346: 113543 | C346: 欧派转债! | D346: 603833 | E346: 欧派家居 | F346: 其他 | G346: 家居用品 | H346: 215.91 | I346: -3.2000000000000002e-003 | J346: -5.1000000000000004e-003 | K346: 150.68 | L346: -8.6e-003 | M346: 114.9 | N346: 70.49 | O346: 1.e-002 | P346: 213.76 | Q346: 转股中 | R346: 4.18年 | S346: 3.18年 | T346: 3.46 | U346: 23 | V346: 2.9999999999999999e-002 | W346: 4.0000000000000001e-003 | X346: 8.0000000000000002e-003 | Y346: 911 | Z346: 7.49 | AA346: -0.14199999999999999 | AB346: -0.14699999999999999 | AC346: -0.113 | AD346: -0.114 | AE346: 91.6 | AF346: 96.7 | AG346: 0.97 | AH346: AA | AI346: 4.3099999999999999e-002 | AJ346: =H346+100*O346 -> 216.91 | AK346: 218.1 | AL346: 348 | AM346: 121.4 | AN346: 346 | AO346: -2.1000000000000001e-002 | AP346: 13 | AQ346: 欧派转债!
A347: 312 | B347: 123014 | C347: 凯发转债! | D347: 300407 | E347: 凯发电气 | F347: 能源电力 | G347: 电力设备 | H347: 151.5 | I347: 7.3300000000000004e-002 | J347: -7.2900000000000006e-002 | K347: 6.88 | L347: 1.5e-003 | M347: 108.5 | N347: 8.05 | O347: 0.77300000000000002 | P347: 85.47 | Q347: 转股中 | R347: 2年46天 | S347: 46天 | T347: 1.16 | U347: 1496. | V347: 8.6799999999999997 | W347: 5.5e-002 | X347: 4.7e-002 | Y347: 21 | Z347: 1.54 | AA347: -0.14699999999999999 | AB347: -0.153 | AC347: -1.22 | AD347: -1.2250000000000001 | AE347: 99.18 | AF347: 93.54 | AG347: 0.33 | AH347: A+ | AI347: 7.3499999999999996e-002 | AJ347: =H347+100*O347 -> 228.80000000000001 | AK347: 217.5 | AL347: 347 | AM347: 118.4 | AN347: 341 | AO347: 2.8999999999999998e-002 | AP347: 16 | AQ347: 凯发转债!
A348: 174 | B348: 113580 | C348: 康隆转债! | D348: 603665 | E348: 康隆达 | F348: 服装纺织 | G348: 服装行业 | H348: 264.17 | I348: -1.e-002 | J348: -1.5e-003 | K348: 15.23 | L348: -1.9299999999999998e-002 | M348: 120.8 | N348: 15.51 | O348: 1.6899999999999999 | P348: 98.19 | Q348: 转股中 | R348: 4.86年 | S348: 2.87年 | T348: 0.41 | U348: 53 | V348: 0.48799999999999999 | W348: 1.7000000000000001e-002 | X348: 1.7000000000000001e-002 | Y348: 24 | Z348: 2.21 | AA348: -0.151 | AB348: -0.157 | AC348: -0.156 | AD348: -0.157 | AE348: 86.07 | AF348: 89.87 | AG348: 0.6 | AH348: AA- | AI348: 6.4100000000000004e-002 | AJ348: =H348+100*O348 -> 433.17000000000002 | AK348: 430.1 | AL348: 361 | AM348: 340.3 | AN348: 361 | AO348: 1.3999999999999999e-002 | AP348: 9 | AQ348: 康隆转债!
A349: 172 | B349: 113582 | C349: 火炬转债! | D349: 603678 | E349: 火炬电子 | F349: 电子 | G349: 元器件制 | H349: 256.05 | I349: -2.8999999999999998e-002 | J349: -7.4999999999999997e-003 | K349: 59.39 | L349: -3.7400000000000003e-002 | M349: 114.9 | N349: 25.33 | O349: 9.1999999999999998e-002 | P349: 234.47 | Q349: 转股中 | R349: 4.96年 | S349: 2.96年 | T349: 4.18 | U349: 112 | V349: 0.105 | W349: 1.4999999999999999e-002 | X349: 3.6000000000000004e-002 | Y349: 273 | Z349: 6.72 | AA349: -0.151 | AB349: -0.155 | AC349: -0.14699999999999999 | AD349: -0.14699999999999999 | AE349: 90.72 | AF349: 93.57 | AG349: 0.98 | AH349: AA | AI349: 4.3099999999999999e-002 | AJ349: =H349+100*O349 -> 265.25 | AK349: 277.6 | AL349: 351 | AM349: 184.1 | AN349: 351 | AO349: -2.2000000000000002e-002 | AP349: 6 | AQ349: 火炬转债!
A350: 162 | B350: 128111 | C350: 中矿转债! | D350: 2738 | E350: 中矿资源 | F350: 有色金属 | G350: 有色行业 | H350: 278.4 | I350: -6.0999999999999995e-003 | J350: -3.8e-003 | K350: 43.1 | L350: -1.01e-002 | M350: 124.7 | N350: 15.47 | O350: -1.e-003 | P350: 278.6 | Q350: 转股中 | R350: 4.997年 | S350: 3年0.1天 | T350: 1.66 | U350: 425 | V350: 0.91599999999999993 | W350: 1.2e-002 | X350: 3.3000000000000002e-002 | Y350: 139 | Z350: 4.06 | AA350: -0.151 | AB350: -0.158 | AC350: -0.152 | AD350: -0.152 | AE350: 85.69 | AF350: 91.65 | AG350: 0.98 | AH350: AA- | AI350: 6.4100000000000004e-002 | AJ350: =H350+100*O350 -> 278.29999999999995 | AK350: 278.2 | AL350: 352 | AM350: 186.5 | AN350: 352 | AO350: 0.12 | AP350: 9 | AQ350: 中矿转债!
A351: 353 | B351: 128017 | C351: 金禾转债!! | D351: 2597 | E351: 金禾实业 | F351: 化工 | G351: 化工 | H351: 165.2 | I351: -5.0700000000000002e-002 | J351: -1.9599999999999999e-002 | K351: 33.41 | L351: -7.4999999999999997e-002 | M351: 108.8 | N351: 21.97 | O351: 8.5999999999999993e-002 | P351: 152.07 | Q351: 转股中 | R351: 2.39年 | S351: 0.39年 | T351: 5.52 | U351: 84 | V351: 9.0999999999999998e-002 | W351: 2.8999999999999998e-002 | X351: 4.4999999999999998e-002 | Y351: 187 | Z351: 3.74 | AA351: -0.16200000000000001 | AB351: -0.16800000000000001 | AC351: -0.72299999999999998 | AD351: -0.72599999999999998 | AE351: 99.28 | AF351: 98.87 | AG351: 0.94 | AH351: AA | AI351: 4.1500000000000002e-002 | AJ351: =H351+100*O351 -> 173.79999999999998 | AK351: 178.3 | AL351: 331 | AM351: 79.1 | AN351: 328 | AO351: -3.9e-002 | AP351: 10 | AQ351: 金禾转债!!
A352: 298 | B352: 123018 | C352: 溢利转债! | D352: 300381 | E352: 溢多利 | F352: 医药 | G352: 原料药 | H352: 227.85 | I352: 1.2699999999999999e-002 | J352: -2.5899999999999999e-002 | K352: 9.4 | L352: -1.8799999999999997e-002 | M352: 114.3 | N352: 8.32 | O352: 1.02 | P352: 112.98 | Q352: 转股中 | R352: 3.52年 | S352: 1.53年 | T352: 0.54 | U352: 152 | V352: 1.23 | W352: 1.2e-002 | X352: 1.3000000000000001e-002 | Y352: 46 | Z352: 1.53 | AA352: -0.17999999999999999 | AB352: -0.18600000000000003 | AC352: -0.30099999999999999 | AD352: -0.30299999999999999 | AE352: 92.62 | AF352: 92.23 | AG352: 0.71 | AH352: AA- | AI352: 6.4100000000000004e-002 | AJ352: =H352+100*O352 -> 329.85000000000002 | AK352: 342.7 | AL352: 356 | AM352: 250.1 | AN352: 356 | AO352: 1.6e-002 | AP352: 12 | AQ352: 溢利转债!
A353: 357 | B353: 127004 | C353: 模塑转债!! | D353: 700 | E353: 模塑科技 | F353: 汽车 | G353: 零部件制 | H353: 165.8 | I353: -1.01e-002 | J353: 1.01e-002 | K353: 5.46 | L353: -5.04e-002 | M353: 111.8 | N353: 7.46 | O353: 1.27 | P353: 73.19 | Q353: 转股中 | R353: 1.98年 | S353: 回售内 | T353: 1.32 | U353: 52 | V353: 0.23399999999999999 | W353: 2.6000000000000002e-002 | X353: 1.9e-002 | Y353: 50 | Z353: 1.8 | AA353: -0.182 | AB353: -0.191 | AC353: 回售内 | AD353: 回售内 | AE353: 100.3 | AF353: 99.31 | AG353: 0 | AH353: AA | AI353: 4.1500000000000002e-002 | AJ353: =H353+100*O353 -> 292.80000000000001 | AK353: 258.4 | AL353: 350 | AM353: 158.1 | AN353: 349 | AO353: -4.0000000000000001e-002 | AP353: 31 | AQ353: 模塑转债!!
A354: 210 | B354: 128095 | C354: 恩捷转债!! | D354: 2812 | E354: 恩捷股份 | F354: 电子 | G354: 元器件制 | H354: 296.039 | I354: 7.3399999999999993e-002 | J354: -9.1999999999999998e-003 | K354: 191.21 | L354: 6.5199999999999994e-002 | M354: 114.9 | N354: 64.92 | O354: 5.0000000000000001e-003 | P354: 294.53 | Q354: 转股中 | R354: 4.67年 | S354: 2.67年 | T354: 5.71 | U354: 1327. | V354: 0.79299999999999993 | W354: 3.0000000000000001e-003 | X354: 1.e-002 | Y354: 1698. | Z354: 14.73 | AA354: -0.18600000000000003 | AB354: -0.19 | AC354: -0.185 | AD354: -0.185 | AE354: 91.84 | AF354: 94.72 | AG354: 0.98 | AH354: AA | AI354: 4.3099999999999999e-002 | AJ354: =H354+100*O354 -> 296.53899999999999 | AK354: 297.5 | AL354: 353 | AM354: 202.8 | AN354: 353 | AO354: 0.20800000000000002 | AP354: 15 | AQ354: 恩捷转债!!
A355: 250 | B355: 123031 | C355: 晶瑞转债! | D355: 300655 | E355: 晶瑞股份 | F355: 化工 | G355: 化工 | H355: 275.6 | I355: -4.5400000000000003e-002 | J355: 3.4999999999999996e-003 | K355: 25.18 | L355: -4.2900000000000001e-002 | M355: 115.8 | N355: 10.13 | O355: 0.109 | P355: 248.57 | Q355: 转股中 | R355: 4.21年 | S355: 2.22年 | T355: 0.63 | U355: 336 | V355: 1.9099999999999999 | W355: 6.9999999999999993e-003 | X355: 1.8000000000000002e-002 | Y355: 86 | Z355: 3.58 | AA355: -0.18899999999999997 | AB355: -0.193 | AC355: -0.22500000000000001 | AD355: -0.22500000000000001 | AE355: 87.09 | AF355: 85.91 | AG355: 0.98 | AH355: A+ | AI355: 7.51e-002 | AJ355: =H355+100*O355 -> 286.5 | AK355: 302.6 | AL355: 354 | AM355: 215.5 | AN355: 354 | AO355: 5.2000000000000005e-002 | AP355: 16 | AQ355: 晶瑞转债!
A356: 310 | B356: 123015 | C356: 蓝盾转债!! | D356: 300297 | E356: 蓝盾股份 | F356: 计算机及 | G356: 软件开发 | H356: 230 | I356: 8.8000000000000005e-003 | J356: 9.300000000000001e-003 | K356: 4.54 | L356: 7.0800000000000002e-002 | M356: 112.3 | N356: 5.79 | O356: 1.9299999999999999 | P356: 78.41 | Q356: 转股中 | R356: 3.17年 | S356: 1.17年 | T356: 1 | U356: 1069. | V356: 4.5700000000000003 | W356: 1.8000000000000002e-002 | X356: 1.3999999999999999e-002 | Y356: 57 | Z356: 2.17 | AA356: -0.20499999999999999 | AB356: -0.20999999999999999 | AC356: -0.40000000000000002 | AD356: -0.40100000000000002 | AE356: 94.68 | AF356: 92.64 | AG356: 0.26 | AH356: AA- | AI356: 6.4100000000000004e-002 | AJ356: =H356+100*O356 -> 423. | AK356: 381.6 | AL356: 358 | AM356: 286.9 | AN356: 357 | AO356: 0.25600000000000001 | AP356: 17 | AQ356: 蓝盾转债!!
A357: 263 | B357: 123027 | C357: 蓝晓转债! | D357: 300487 | E357: 蓝晓科技 | F357: 化工 | G357: 化工 | H357: 301.288 | I357: -4.1399999999999999e-002 | J357: 3.2000000000000002e-003 | K357: 64.9 | L357: -3.95e-002 | M357: 119.5 | N357: 29.22 | O357: 0.35600000000000004 | P357: 222.11 | Q357: 转股中 | R357: 3.997年 | S357: 2年0.1天 | T357: 1.07 | U357: 210 | V357: 0.64900000000000002 | W357: 8.0000000000000002e-003 | X357: 1.7000000000000001e-002 | Y357: 143 | Z357: 7.73 | AA357: -0.21100000000000002 | AB357: -0.217 | AC357: -0.26600000000000001 | AD357: -0.26700000000000002 | AE357: 88.77 | AF357: 89.53 | AG357: 0.97 | AH357: A+ | AI357: 7.51e-002 | AJ357: =H357+100*O357 -> 336.88800000000003 | AK357: 380.5 | AL357: 357 | AM357: 290.9 | AN357: 358 | AO357: -2.9999999999999999e-002 | AP357: 19 | AQ357: 蓝晓转债!
A358: 324 | B358: 113509 | C358: 新泉转债!! | D358: 603179 | E358: 新泉股份 | F358: 汽车 | G358: 零部件制 | H358: 221.48 | I358: -8.9999999999999998e-004 | J358: 1.6e-002 | K358: 34.5 | L358: 1.5300000000000001e-002 | M358: 109.3 | N358: 15.25 | O358: -2.1000000000000001e-002 | P358: 226.23 | Q358: 转股中 | R358: 2.98年 | S358: 0.98年 | T358: 0.84 | U358: 149 | V358: 0.80700000000000005 | W358: 6.9999999999999993e-003 | X358: 1.4999999999999999e-002 | Y358: 127 | Z358: 3.59 | AA358: -0.21299999999999999 | AB358: -0.217 | AC358: -0.46399999999999997 | AD358: -0.46500000000000002 | AE358: 97.17 | AF358: 97 | AG358: 0.98 | AH358: AA | AI358: 4.1500000000000002e-002 | AJ358: =H358+100*O358 -> 219.38 | AK358: 216.7 | AL358: 346 | AM358: 119.6 | AN358: 343 | AO358: 0.16399999999999998 | AP358: 12 | AQ358: 新泉转债!!
A359: 297 | B359: 113526 | C359: 联泰转债! | D359: 603797 | E359: 联泰环保 | F359: 城市公用 | G359: 三废处理 | H359: 273.03 | I359: -1.9699999999999999e-002 | J359: 1.47e-002 | K359: 7.71 | L359: -6.4000000000000003e-003 | M359: 110.3 | N359: 6.11 | O359: 1.1599999999999999 | P359: 126.19 | Q359: 转股中 | R359: 3.62年 | S359: 1.62年 | T359: 1.93 | U359: 106 | V359: 0.19800000000000001 | W359: 5.5999999999999994e-002 | X359: 7.0000000000000007e-002 | Y359: 35 | Z359: 2.03 | AA359: -0.22399999999999998 | AB359: -0.22800000000000001 | AC359: -0.32100000000000001 | AD359: -0.32200000000000001 | AE359: 95.88 | AF359: 95.94 | AG359: 0.79 | AH359: AA+ | AI359: 4.0099999999999997e-002 | AJ359: =H359+100*O359 -> 389.02999999999997 | AK359: 419.9 | AL359: 360 | AM359: 323.9 | AN359: 360 | AO359: 4.0000000000000001e-003 | AP359: 9 | AQ359: 联泰转债!
A360: 321 | B360: 110044 | C360: 广电转债!! | D360: 600831 | E360: 广电网络 | F360: 传媒娱乐 | G360: 影视娱乐 | H360: 250.58 | I360: 1.5e-003 | J360: 8.6e-003 | K360: 6.34 | L360: 2.4199999999999999e-002 | M360: 112.3 | N360: 6.9 | O360: 1.73 | P360: 91.88 | Q360: 转股中 | R360: 3年15天 | S360: 1年16天 | T360: 0.71 | U360: 224 | V360: 1.25 | W360: 1.6e-002 | X360: 1.3999999999999999e-002 | Y360: 45 | Z360: 1.2 | AA360: -0.23499999999999999 | AB360: -0.23999999999999999 | AC360: -0.47899999999999998 | AD360: -0.47999999999999998 | AE360: 97.74 | AF360: 99.07 | AG360: 0.42 | AH360: AA | AI360: 4.3099999999999999e-002 | AJ360: =H360+100*O360 -> 423.58000000000004 | AK360: 409.3 | AL360: 359 | AM360: 310.2 | AN360: 359 | AO360: 8.0000000000000002e-003 | AP360: 11 | AQ360: 广电转债!!
A361: 341 | B361: 128029 | C361: 太阳转债!! | D361: 2078 | E361: 太阳纸业 | F361: 造纸包装 | G361: 造纸行业 | H361: 165 | I361: -2.8999999999999998e-002 | J361: 5.6999999999999993e-003 | K361: 13.39 | L361: -2.3300000000000001e-002 | M361: 107 | N361: 8.55 | O361: 5.4000000000000006e-002 | P361: 156.61 | Q361: 转股中 | R361: 1.53年 | S361: 回售内 | T361: 9.09 | U361: 68 | V361: 4.4999999999999998e-002 | W361: 2.6000000000000002e-002 | X361: 4.0000000000000001e-002 | Y361: 351 | Z361: 2.06 | AA361: -0.247 | AB361: -0.254 | AC361: 回售内 | AD361: 回售内 | AE361: 100.17 | AF361: 101.02 | AG361: 1 | AH361: AA+ | AI361: 3.85e-002 | AJ361: =H361+100*O361 -> 170.40000000000001 | AK361: 173.4 | AL361: 327 | AM361: 72.4 | AN361: 319 | AO361: -8.6999999999999994e-002 | AP361: 7 | AQ361: 太阳转债!!
A362: 340 | B362: 128030 | C362: 天康转债!! | D362: 2100 | E362: 天康生物 | F362: 农业 | G362: 畜牧业 | H362: 227.555 | I362: 2.0000000000000001e-004 | J362: -6.7000000000000002e-003 | K362: 9.18 | L362: -6.5000000000000006e-003 | M362: 111.3 | N362: 7.39 | O362: 0.83200000000000007 | P362: 124.22 | Q362: 转股中 | R362: 2.53年 | S362: 0.53年 | T362: 0.94 | U362: 8.1 | V362: 3.7999999999999999e-002 | W362: 9.0000000000000011e-003 | X362: 1.2e-002 | Y362: 99 | Z362: 1.51 | AA362: -0.249 | AB362: -0.255 | AC362: -0.81700000000000006 | AD362: -0.81900000000000006 | AE362: 98.96 | AF362: 100.6 | AG362: 1 | AH362: AA | AI362: 4.1500000000000002e-002 | AJ362: =H362+100*O362 -> 310.755 | AK362: 330.9 | AL362: 355 | AM362: 230.3 | AN362: 355 | AO362: -4.9000000000000002e-002 | AP362: 11 | AQ362: 天康转债!!
A363: 317 | B363: 128041 | C363: 盛路转债!! | D363: 2446 | E363: 盛路通信 | F363: 通信互联 | G363: 通信设备 | H363: 280.71 | I363: -1.37e-002 | J363: -2.2000000000000001e-003 | K363: 5.99 | L363: -4.0099999999999997e-002 | M363: 114.3 | N363: 6.82 | O363: 2.2000000000000002 | P363: 87.83 | Q363: 转股中 | R363: 3年35天 | S363: 1年36天 | T363: 0.53 | U363: 37 | V363: 0.245 | W363: 1.e-002 | X363: 9.0000000000000011e-003 | Y363: 54 | Z363: 1.77 | AA363: -0.255 | AB363: -0.26100000000000001 | AC363: -0.48899999999999999 | AD363: -0.48999999999999999 | AE363: 97.51 | AF363: 100.59 | AG363: 0.4 | AH363: AA | AI363: 4.3099999999999999e-002 | AJ363: =H363+100*O363 -> 500.71000000000004 | AK363: 473.6 | AL363: 363 | AM363: 373 | AN363: 363 | AO363: 4.0000000000000001e-003 | AP363: 12 | AQ363: 盛路转债!!
A364: 314 | B364: 123013 | C364: 横河转债! | D364: 300539 | E364: 横河精密 | F364: 机械装备 | G364: 专用设备 | H364: 357.398 | I364: -2.0999999999999999e-003 | J364: -1.6000000000000001e-003 | K364: 7.55 | L364: -9.1999999999999998e-003 | M364: 115.2 | N364: 9.13 | O364: 3.3199999999999998 | P364: 82.69 | Q364: 转股中 | R364: 3年44天 | S364: 1年45天 | T364: 0.38 | U364: 25 | V364: 0.185 | W364: 2.3e-002 | X364: 1.9e-002 | Y364: 17 | Z364: 3.38 | AA364: -0.309 | AB364: -0.314 | AC364: -0.53700000000000003 | AD364: -0.53799999999999992 | AE364: 94.26 | AF364: 92.47 | AG364: 0.41 | AH364: A+ | AI364: 7.51e-002 | AJ364: =H364+100*O364 -> 689.39800000000002 | AK364: 632.1 | AL364: 364 | AM364: 537.8 | AN364: 364 | AO364: 6.0000000000000001e-003 | AP364: 14 | AQ364: 横河转债!
A365: 254 | B365: 123029 | C365: 英科转债! | D365: 300677 | E365: 英科医疗 | F365: 医药 | G365: 医疗器械 | H365: 1213 | I365: 6.6e-003 | J365: -1.7000000000000001e-003 | K365: 100.6 | L365: 5.0000000000000001e-003 | M365: 138.2 | N365: 8.32 | O365: 3.0000000000000001e-003 | P365: 1209.13 | Q365: 转股中 | R365: 4.18年 | S365: 2.18年 | T365: 0.33 | U365: 325 | V365: 0.80200000000000005 | W365: 1.e-003 | X365: 1.1000000000000001e-002 | Y365: 365 | Z365: 2.7 | AA365: -0.41100000000000003 | AB365: -0.41700000000000004 | AC365: -0.33600000000000002 | AD365: -0.33600000000000002 | AE365: 97.37 | AF365: 116.64 | AG365: 0.99 | AH365: AA | AI365: 4.3099999999999999e-002 | AJ365: =H365+100*O365 -> 1213.3 | AK365: 1216.9000000000001 | AL365: 365 | AM365: 1100.2 | AN365: 365 | AO365: -0.21899999999999997 | AP365: 16 | AQ365: 英科转债!
A366: 352 | B366: 113016 | C366: 小康转债!! | D366: 601127 | E366: 小康股份 | F366: 汽车 | G366: 零部件制 | H366: 448.72 | I366: 0.16500000000000001 | J366: -6.5500000000000003e-002 | K366: 67.32 | L366: 0.10000000000000001 | M366: 109.3 | N366: 15.7 | O366: 4.5999999999999999e-002 | P366: 428.79 | Q366: 转股中 | R366: 2.41年 | S366: 0.41年 | T366: 2.92 | U366: 8540. | V366: 6.9299999999999997 | W366: 3.0000000000000001e-003 | X366: 1.3999999999999999e-002 | Y366: 874 | Z366: 18.55 | AA366: -0.41799999999999998 | AB366: -0.42100000000000004 | AC366: -1.411 | AD366: -1.4119999999999999 | AE366: 99.47 | AF366: 99.3 | AG366: 0.99 | AH366: AA | AI366: 4.1500000000000002e-002 | AJ366: =H366+100*O366 -> 453.32000000000005 | AK366: 468.7 | AL366: 362 | AM366: 369.2 | AN366: 362 | AO366: 0.14000000000000001 | AP366: 42 | AQ366: 小康转债!!