A1: 序号 | B1: 转债代码 | C1: 转债名称 | D1: 股票代码 | E1: 股票名称 | F1: 行业 | G1: 子行业 | H1: 转债价格 | I1: 涨跌 | J1: 日内套利 | K1: 股价 | L1: 涨跌 | M1: 剩余本息 | N1: 转股价格 | O1: 转股溢价率 | P1: 转股价值 | Q1: 距离转股日 | R1: 剩余年限 | S1: 回售年限 | T1: 转债余额 | U1: 转债成交额 | V1: 转债换手率 | W1: 余额/市值 | X1: 余额/股本 | Y1: 股票市值 | Z1: P/B | AA1: 税前收益率 | AB1: 税后收益率 | AC1: 税前回售收益 | AD1: 税后回售收益 | AE1: 回售价值 | AF1: 纯债价值 | AG1: 弹性 | AH1: 信用 | AI1: 折现率 | AJ1: 双低 | AK1: 老式双低 | AL1: 老式排名 | AM1: 新式双低 | AN1: 新式排名 | AO1: MA20乖离 | AP1: 热门度 | AQ1: 转债名称
A2: 247 | B2: 128062 | C2: 亚药转债! | D2: 2370 | E2: 亚太药业 | F2: 医药 | G2: 化学制药 | H2: 67.796 | I2: -1.2999999999999999e-003 | J2: 1.2999999999999999e-003 | K2: 3.43 | L2: 1.4800000000000001e-002 | M2: 119.8 | N2: 16.25 | O2: 2.21 | P2: 21.11 | Q2: 转股中 | R2: 4年56天 | S2: 2年56天 | T2: 9.63 | U2: 65 | V2: 9.9000000000000005e-002 | W2: 0.52300000000000002 | X2: 0.11 | Y2: 18 | Z2: 5.72 | AA2: 0.151 | AB2: 0.14000000000000001 | AC2: 0.20199999999999999 | AD2: 0.19800000000000001 | AE2: 83.76 | AF2: 82.63 | AG2: 0 | AH2: A- | AI2: 9.5700000000000007e-002 | AJ2: =H2+100*O2 -> 288.79599999999999 | AK2: 114.5 | AL2: 120 | AM2: 30.7 | AN2: 189 | AO2: -0.114 | AP2: 87 | AQ2: 亚药转债!
A3: 266 | B3: 113527 | C3: 维格转债! | D3: 603518 | E3: 锦泓集团 | F3: 服装纺织 | G3: 服装行业 | H3: 76.71 | I3: -1.6e-002 | J3: 1.61e-002 | K3: 4.21 | L3: 2.3999999999999998e-003 | M3: 119.5 | N3: 9.85 | O3: 0.79500000000000004 | P3: 42.74 | Q3: 转股中 | R3: 3.97年 | S3: 1.97年 | T3: 7.46 | U3: 4.3 | V3: 6.9999999999999993e-003 | W3: 0.70200000000000007 | X3: 0.29999999999999999 | Y3: 11 | Z3: 0.67 | AA3: 0.121 | AB3: 0.111 | AC3: 0.14800000000000002 | AD3: 0.14499999999999999 | AE3: 92.04 | AF3: 97.45 | AG3: 0.01 | AH3: AA | AI3: 5.3699999999999998e-002 | AJ3: =H3+100*O3 -> 156.20999999999998 | AK3: 110.7 | AL3: 87 | AM3: 13.2 | AN3: 42 | AO3: -9.0999999999999998e-002 | AP3: 100 | AQ3: 维格转债!
A4: 114 | B4: 127018 | C4: 本钢转债! | D4: 761 | E4: 本钢板材 | F4: 钢铁 | G4: 炼钢 | H4: 73.801 | I4: -1.3100000000000001e-002 | J4: 1.3100000000000001e-002 | K4: 2.81 | L4: 0. | M4: 128.6 | N4: 5.03 | O4: 0.32100000000000001 | P4: 55.86 | Q4: 转股中 | R4: 5.40年 | S4: 3.40年 | T4: 68 | U4: 158 | V4: 3.2000000000000001e-002 | W4: 0.624 | X4: 0.34899999999999998 | Y4: 109 | Z4: 0.55 | AA4: 0.11199999999999999 | AB4: 0.10199999999999999 | AC4: 0.11 | AD4: 0.106 | AE4: 89.7 | AF4: 99.64 | AG4: 0.08 | AH4: AAA | AI4: 5.0000000000000003e-002 | AJ4: =H4+100*O4 -> 105.90100000000001 | AK4: 91.7 | AL4: 3 | AM4: -7.9 | AN4: 2 | AO4: -6.5000000000000002e-002 | AP4: 47 | AQ4: 本钢转债!
A5: 230 | B5: 123028 | C5: 清水转债! | D5: 300437 | E5: 清水源 | F5: 城市公用 | G5: 三废处理 | H5: 81.2 | I5: 8.6999999999999994e-003 | J5: -9.3999999999999986e-003 | K5: 6.73 | L5: -7.4000000000000003e-003 | M5: 121.8 | N5: 11.84 | O5: 0.42899999999999999 | P5: 56.84 | Q5: 转股中 | R5: 4.37年 | S5: 2.37年 | T5: 4.56 | U5: 16 | V5: 4.2999999999999997e-002 | W5: 0.30599999999999999 | X5: 0.17399999999999999 | Y5: 15 | Z5: 0.95 | AA5: 0.10000000000000001 | AB5: 9.0399999999999994e-002 | AC5: 0.107 | AD5: 0.10300000000000001 | AE5: 89.55 | AF5: 93.35 | AG5: 0.1 | AH5: AA- | AI5: 6.4699999999999994e-002 | AJ5: =H5+100*O5 -> 124.09999999999999 | AK5: 105.6 | AL5: 42 | AM5: 12.2 | AN5: 35 | AO5: -0.218 | AP5: 54 | AQ5: 清水转债!
A6: 335 | B6: 128013 | C6: 洪涛转债! | D6: 2325 | E6: 洪涛股份 | F6: 建筑 | G6: 装饰工程 | H6: 95.743 | I6: -3.4999999999999996e-003 | J6: 3.4999999999999996e-003 | K6: 2.14 | L6: -4.6999999999999993e-003 | M6: 109.8 | N6: 3.1 | O6: 0.38700000000000001 | P6: 69.03 | Q6: 转股中 | R6: 1.48年 | S6: 回售内 | T6: 12 | U6: 6.6 | V6: 6.0000000000000001e-003 | W6: 0.44799999999999995 | X6: 0.309 | Y6: 27 | Z6: 0.9 | AA6: 9.8400000000000001e-002 | AB6: 8.4700000000000011e-002 | AC6: 回售内 | AD6: 回售内 | AE6: 100.3 | AF6: 100.42 | AG6: 0 | AH6: AA- | AI6: 6.3099999999999989e-002 | AJ6: =H6+100*O6 -> 134.44299999999998 | AK6: 122.5 | AL6: 187 | AM6: 22 | AN6: 104 | AO6: -4.2999999999999997e-002 | AP6: 94 | AQ6: 洪涛转债!
A7: 195 | B7: 128085 | C7: 鸿达转债! | D7: 2002 | E7: 鸿达兴业 | F7: 化工 | G7: 化工 | H7: 80.8 | I7: -2.5000000000000001e-003 | J7: 2.5000000000000001e-003 | K7: 3.16 | L7: 0. | M7: 124.4 | N7: 3.92 | O7: 2.e-003 | P7: 80.61 | Q7: 转股中 | R7: 4.86年 | S7: 2.86年 | T7: 18.3 | U7: 305 | V7: 0.20399999999999999 | W7: 0.223 | X7: 0.17999999999999999 | Y7: 82 | Z7: 1.15 | AA7: 9.5000000000000001e-002 | AB7: 8.5500000000000007e-002 | AC7: 8.7499999999999994e-002 | AD7: 8.4600000000000009e-002 | AE7: 72.86 | AF7: 70.87 | AG7: 0.67 | AH7: BB | AI7: 0.12570000000000001 | AJ7: =H7+100*O7 -> 81. | AK7: 81 | AL7: 1 | AM7: 8.1 | AN7: 15 | AO7: 3.1e-002 | AP7: 98 | AQ7: 鸿达转债!
A8: 163 | B8: 128100 | C8: 搜特转债! | D8: 2503 | E8: 搜于特 | F8: 服装纺织 | G8: 服装行业 | H8: 75.3 | I8: 4.6999999999999993e-003 | J8: -2.7000000000000001e-003 | K8: 1.61 | L8: 2.5499999999999998e-002 | M8: 117.3 | N8: 2.9 | O8: 0.35600000000000004 | P8: 55.52 | Q8: 转股中 | R8: 5年35天 | S8: 3年35天 | T8: 8 | U8: 63 | V8: 0.10300000000000001 | W8: 0.161 | X8: 8.900000000000001e-002 | Y8: 50 | Z8: 0.9 | AA8: 9.3100000000000002e-002 | AB8: 8.6099999999999996e-002 | AC8: 0.105 | AD8: 0.10199999999999999 | AE8: 90.06 | AF8: 94.18 | AG8: 0.08 | AH8: AA | AI8: 4.4999999999999998e-002 | AJ8: =H8+100*O8 -> 110.90000000000001 | AK8: 95.1 | AL8: 5 | AM8: 0.9 | AN8: 3 | AO8: -0.26100000000000001 | AP8: 49 | AQ8: 搜特转债!
A9: 77 | B9: 110072 | C9: 广汇转债! | D9: 600297 | E9: 广汇汽车 | F9: 汽车 | G9: 分销、售 | H9: 70.86 | I9: -7.8000000000000005e-003 | J9: 6.7000000000000002e-003 | K9: 2.39 | L9: -8.3000000000000001e-003 | M9: 114.5 | N9: 4.03 | O9: 0.19500000000000001 | P9: 59.31 | Q9: 19天 | R9: 5.53年 | S9: 3.53年 | T9: 33.7 | U9: 55 | V9: 2.3e-002 | W9: 0.17399999999999999 | X9: 0.10300000000000001 | Y9: 194 | Z9: 0.49 | AA9: 9.2200000000000004e-002 | AB9: 8.6699999999999999e-002 | AC9: 0.107 | AD9: 0.105 | AE9: 88.23 | AF9: 91.03 | AG9: 0.13 | AH9: AA+ | AI9: 4.2999999999999997e-002 | AJ9: =H9+100*O9 -> 90.359999999999999 | AK9: 82.4 | AL9: 2 | AM9: -8.6 | AN9: 1 | AO9: -8.4000000000000005e-002 | AP9: 34 | AQ9: 广汇转债!
A10: 280 | B10: 113519 | C10: 长久转债! | D10: 603569 | E10: 长久物流 | F10: 交通运输 | G10: 物流业 | H10: 86.38 | I10: -4.6300000000000001e-002 | J10: 4.5899999999999996e-002 | K10: 6.51 | L10: -7.6e-003 | M10: 119.3 | N10: 11.15 | O10: 0.47899999999999998 | P10: 58.39 | Q10: 转股中 | R10: 3.75年 | S10: 1.75年 | T10: 6.97 | U10: 27 | V10: 4.4000000000000004e-002 | W10: 0.191 | X10: 0.11199999999999999 | Y10: 36 | Z10: 1.71 | AA10: 9.1600000000000001e-002 | AB10: 8.1600000000000006e-002 | AC10: 9.5600000000000004e-002 | AD10: 9.2300000000000007e-002 | AE10: 94.75 | AF10: 101.89 | AG10: 0.04 | AH10: AA | AI10: 4.3700000000000003e-002 | AJ10: =H10+100*O10 -> 134.28 | AK10: 114.4 | AL10: 119 | AM10: 12.5 | AN10: 37 | AO10: -6.7000000000000004e-002 | AP10: 18 | AQ10: 长久转债!
A11: 282 | B11: 128044 | C11: 岭南转债! | D11: 2717 | E11: 岭南股份 | F11: 城市公用 | G11: 生态环境 | H11: 83.225 | I11: -6.8999999999999999e-003 | J11: 6.8999999999999999e-003 | K11: 2.86 | L11: 6.9999999999999993e-003 | M11: 111.3 | N11: 5.91 | O11: 0.71999999999999997 | P11: 48.39 | Q11: 转股中 | R11: 3.52年 | S11: 1.52年 | T11: 6.59 | U11: 8 | V11: 1.3999999999999999e-002 | W11: 0.151 | X11: 7.2999999999999995e-002 | Y11: 44 | Z11: 0.89 | AA11: 8.8000000000000009e-002 | AB11: 8.1199999999999994e-002 | AC11: 0.13500000000000001 | AD11: 0.13100000000000001 | AE11: 95.7 | AF11: 96.03 | AG11: 0.01 | AH11: AA | AI11: 4.3700000000000003e-002 | AJ11: =H11+100*O11 -> 155.22499999999999 | AK11: 118.1 | AL11: 154 | AM11: 22 | AN11: 103 | AO11: -6.4000000000000001e-002 | AP11: 37 | AQ11: 岭南转债!
A12: 168 | B12: 113569 | C12: 科达转债! | D12: 603660 | E12: 苏州科达 | F12: 通信互联 | G12: 物联网 | H12: 79.67 | I12: -1.3899999999999999e-002 | J12: 1.3300000000000001e-002 | K12: 6.44 | L12: -1.9799999999999998e-002 | M12: 120.7 | N12: 14.84 | O12: 0.83599999999999997 | P12: 43.4 | Q12: 转股中 | R12: 5年32天 | S12: 3年32天 | T12: 5.16 | U12: 5.3 | V12: 1.3000000000000001e-002 | W12: 0.16 | X12: 7.0000000000000007e-002 | Y12: 32 | Z12: 1.88 | AA12: 8.72e-002 | AB12: 7.9299999999999995e-002 | AC12: 8.6699999999999999e-002 | AD12: 8.3800000000000013e-002 | AE12: 84.73 | AF12: 87.85 | AG12: 0.03 | AH12: AA- | AI12: 6.6000000000000003e-002 | AJ12: =H12+100*O12 -> 163.26999999999998 | AK12: 115.9 | AL12: 133 | AM12: 28.1 | AN12: 165 | AO12: -8.199999999999999e-002 | AP12: 24 | AQ12: 科达转债!
A13: 336 | B13: 127003 | C13: 海印转债! | D13: 861 | E13: 海印股份 | F13: 商业零售 | G13: 商场 | H13: 100.15 | I13: 1.6000000000000001e-003 | J13: -1.6000000000000001e-003 | K13: 1.99 | L13: -5.0000000000000001e-003 | M13: 111.8 | N13: 3 | O13: 0.51000000000000001 | P13: 66.33 | Q13: 转股中 | R13: 1.34年 | S13: 回售内 | T13: 6.74 | U13: 6.6 | V13: 1.e-002 | W13: 0.14599999999999999 | X13: 9.6999999999999989e-002 | Y13: 46 | Z13: 1.17 | AA13: 8.6899999999999991e-002 | AB13: 6.93e-002 | AC13: 回售内 | AD13: 回售内 | AE13: 100.3 | AF13: 105.87 | AG13: 0.01 | AH13: AA | AI13: 4.2099999999999999e-002 | AJ13: =H13+100*O13 -> 151.15000000000001 | AK13: 134 | AL13: 255 | AM13: 28.1 | AN13: 166 | AO13: -0.16500000000000001 | AP13: 76 | AQ13: 海印转债!
A14: 245 | B14: 128063 | C14: 未来转债 | D14: 2631 | E14: 德尔未来 | F14: 其他 | G14: 家居用品 | H14: 92.65 | I14: -2.6800000000000001e-002 | J14: 2.52e-002 | K14: 5.49 | L14: -1.61e-002 | M14: 128.2 | N14: 8.63 | O14: 0.45600000000000002 | P14: 63.62 | Q14: 转股中 | R14: 4年57天 | S14: 3年57天 | T14: 6.3 | U14: 6.4 | V14: 1.1000000000000001e-002 | W14: 0.17199999999999999 | X14: 0.11 | Y14: 37 | Z14: 2.08 | AA14: 8.4100000000000008e-002 | AB14: 7.1599999999999997e-002 | AC14: 5.1100000000000007e-002 | AD14: 4.5499999999999999e-002 | AE14: 88.86 | AF14: 99.6 | AG14: 0.1 | AH14: AA- | AI14: 6.4699999999999994e-002 | AJ14: =H14+100*O14 -> 138.25 | AK14: 121.7 | AL14: 181 | AM14: 22.1 | AN14: 105 | AO14: -0.183 | AP14: 35 | AQ14: 未来转债
A15: 103 | B15: 127019 | C15: 国城转债! | D15: 688 | E15: 国城矿业 | F15: 有色金属 | G15: 锌铅镍锡 | H15: 76 | I15: -7.4000000000000003e-003 | J15: 7.3000000000000001e-003 | K15: 8.22 | L15: -8.3999999999999995e-003 | M15: 115.1 | N15: 21.07 | O15: 0.94799999999999995 | P15: 39.01 | Q15: 转股中 | R15: 5.44年 | S15: 3.44年 | T15: 8.5 | U15: 4.5 | V15: 6.9999999999999993e-003 | W15: 9.0999999999999998e-002 | X15: 3.5000000000000003e-002 | Y15: 93 | Z15: 4.23 | AA15: 8.1000000000000003e-002 | AB15: 7.5300000000000006e-002 | AC15: 9.06e-002 | AD15: 8.8300000000000003e-002 | AE15: 88.52 | AF15: 91 | AG15: 0.01 | AH15: AA | AI15: 4.4999999999999998e-002 | AJ15: =H15+100*O15 -> 170.80000000000001 | AK15: 113 | AL15: 103 | AM15: 22 | AN15: 102 | AO15: -5.7000000000000002e-002 | AP15: 33 | AQ15: 国城转债!
A16: 289 | B16: 123011 | C16: 德尔转债! | D16: 300473 | E16: 德尔股份 | F16: 汽车 | G16: 零部件制 | H16: 89.62 | I16: 2.0000000000000001e-004 | J16: 0. | K16: 16.45 | L16: 1.1699999999999999e-002 | M16: 116.3 | N16: 34.54 | O16: 0.88200000000000001 | P16: 47.63 | Q16: 转股中 | R16: 3.45年 | S16: 1.45年 | T16: 2.51 | U16: 2.5 | V16: 1.1000000000000001e-002 | W16: 0.13400000000000001 | X16: 6.4000000000000001e-002 | Y16: 19 | Z16: 0.84 | AA16: 8.0199999999999994e-002 | AB16: 7.0900000000000005e-002 | AC16: 8.9600000000000013e-002 | AD16: 8.5699999999999998e-002 | AE16: 92.99 | AF16: 94.11 | AG16: 0.01 | AH16: AA- | AI16: 6.4699999999999994e-002 | AJ16: =H16+100*O16 -> 177.81999999999999 | AK16: 131.6 | AL16: 242 | AM16: 37.5 | AN16: 231 | AO16: -0.13 | AP16: 41 | AQ16: 德尔转债!
A17: 250 | B17: 113530 | C17: 大丰转债! | D17: 603081 | E17: 大丰实业 | F17: 建筑 | G17: 装饰工程 | H17: 89.37 | I17: -1.29e-002 | J17: 1.2699999999999999e-002 | K17: 10.86 | L17: -2.8000000000000004e-003 | M17: 121.6 | N17: 16.64 | O17: 0.36899999999999999 | P17: 65.26 | Q17: 转股中 | R17: 4年50天 | S17: 2年50天 | T17: 6.3 | U17: 4.9 | V17: 9.0000000000000011e-003 | W17: 0.14400000000000002 | X17: 9.4e-002 | Y17: 44 | Z17: 2.12 | AA17: 7.9199999999999993e-002 | AB17: 6.93e-002 | AC17: 6.6699999999999995e-002 | AD17: 6.3299999999999995e-002 | AE17: 93.91 | AF17: 102.28 | AG17: 0.09 | AH17: AA | AI17: 4.3700000000000003e-002 | AJ17: =H17+100*O17 -> 126.27000000000001 | AK17: 113.5 | AL17: 109 | AM17: 11.2 | AN17: 28 | AO17: 3.5000000000000003e-002 | AP17: 33 | AQ17: 大丰转债!
A18: 235 | B18: 113535 | C18: 大业转债! | D18: 603278 | E18: 大业股份 | F18: 汽车 | G18: 零部件制 | H18: 88.6 | I18: -1.15e-002 | J18: 1.1299999999999999e-002 | K18: 7.25 | L18: -4.0999999999999995e-003 | M18: 113.1 | N18: 12.4 | O18: 0.51500000000000001 | P18: 58.47 | Q18: 转股中 | R18: 3.26年 | S18: 1.26年 | T18: 5 | U18: 3.6 | V18: 8.0000000000000002e-003 | W18: 0.23800000000000002 | X18: 0.13900000000000001 | Y18: 21 | Z18: 1.28 | AA18: 7.9100000000000004e-002 | AB18: 7.0999999999999994e-002 | AC18: 0.10400000000000001 | AD18: 0.10099999999999999 | AE18: 95.88 | AF18: 98.6 | AG18: 0.05 | AH18: AA | AI18: 4.3700000000000003e-002 | AJ18: =H18+100*O18 -> 140.09999999999999 | AK18: 118.7 | AL18: 163 | AM18: 20.1 | AN18: 80 | AO18: -3.3000000000000002e-002 | AP18: 50 | AQ18: 大业转债!
A19: 78 | B19: 113600 | C19: 新星转债! | D19: 603978 | E19: 深圳新星 | F19: 有色金属 | G19: 有色行业 | H19: 83.88 | I19: -5.9999999999999995e-004 | J19: -2.e-003 | K19: 15.83 | L19: -1.1200000000000002e-002 | M19: 126 | N19: 23.85 | O19: 0.26400000000000001 | P19: 66.37 | Q19: 14天 | R19: 5.52年 | S19: 3.52年 | T19: 5.95 | U19: 11 | V19: 2.2000000000000002e-002 | W19: 0.23499999999999999 | X19: 0.156 | Y19: 25 | Z19: 1.66 | AA19: 7.8200000000000006e-002 | AB19: 6.9500000000000006e-002 | AC19: 6.0499999999999998e-002 | AD19: 5.8200000000000002e-002 | AE19: 82.31 | AF19: 89.18 | AG19: 0.23 | AH19: AA- | AI19: 6.6000000000000003e-002 | AJ19: =H19+100*O19 -> 110.28 | AK19: 101.4 | AL19: 22 | AM19: 12.2 | AN19: 34 | AO19: -4.0000000000000001e-003 | AP19: 13 | AQ19: 新星转债!
A20: 300 | B20: 128037 | C20: 岩土转债! | D20: 2542 | E20: 中化岩土 | F20: 建筑 | G20: 建筑工程 | H20: 89.4 | I20: -1.6500000000000001e-002 | J20: 1.6500000000000001e-002 | K20: 2.52 | L20: 0. | M20: 112.3 | N20: 7.99 | O20: 1.8300000000000001 | P20: 31.54 | Q20: 转股中 | R20: 3年38天 | S20: 1年38天 | T20: 5.99 | U20: 7.2 | V20: 1.3000000000000001e-002 | W20: 0.13200000000000001 | X20: 4.2000000000000003e-002 | Y20: 46 | Z20: 1.12 | AA20: 7.8100000000000003e-002 | AB20: 6.9900000000000004e-002 | AC20: 0.11800000000000001 | AD20: 0.11199999999999999 | AE20: 97.42 | AF20: 98.63 | AG20: 0 | AH20: AA | AI20: 4.3700000000000003e-002 | AJ20: =H20+100*O20 -> 272.39999999999998 | AK20: 147.3 | AL20: 290 | AM20: 48.6 | AN20: 279 | AO20: -0.122 | AP20: 49 | AQ20: 岩土转债!
A21: 237 | B21: 110058 | C21: 永鼎转债! | D21: 600105 | E21: 永鼎股份 | F21: 通信互联 | G21: 通信设备 | H21: 84.5 | I21: -2.1099999999999997e-002 | J21: 2.0299999999999999e-002 | K21: 2.84 | L21: -1.3899999999999999e-002 | M21: 114.9 | N21: 5.04 | O21: 0.5 | P21: 56.35 | Q21: 转股中 | R21: 4.19年 | S21: 2.19年 | T21: 2.61 | U21: 47 | V21: 0.20899999999999999 | W21: 6.7000000000000004e-002 | X21: 3.7999999999999999e-002 | Y21: 39 | Z21: 1.39 | AA21: 7.7899999999999997e-002 | AB21: 7.0699999999999999e-002 | AC21: 9.0500000000000011e-002 | AD21: 8.72e-002 | AE21: 93.59 | AF21: 96.42 | AG21: 0.06 | AH21: AA | AI21: 4.3700000000000003e-002 | AJ21: =H21+100*O21 -> 134.5 | AK21: 112.7 | AL21: 98 | AM21: 16.2 | AN21: 63 | AO21: -7.2999999999999995e-002 | AP21: 51 | AQ21: 永鼎转债!
A22: 236 | B22: 128066 | C22: 亚泰转债! | D22: 2811 | E22: 郑中设计 | F22: 建筑 | G22: 装饰工程 | H22: 86.8 | I22: -3.4000000000000002e-003 | J22: 4.1999999999999997e-003 | K22: 7.13 | L22: 2.8000000000000004e-003 | M22: 117.5 | N22: 9.67 | O22: 0.17699999999999999 | P22: 73.73 | Q22: 转股中 | R22: 4.20年 | S22: 2.20年 | T22: 4.8 | U22: 3.6 | V22: 9.0000000000000011e-003 | W22: 0.249 | X22: 0.184 | Y22: 19 | Z22: 1.31 | AA22: 7.690000000000001e-002 | AB22: 6.8600000000000008e-002 | AC22: 8.0100000000000005e-002 | AD22: 7.6399999999999996e-002 | AE22: 89.74 | AF22: 90.93 | AG22: 0.28 | AH22: AA- | AI22: 6.4699999999999994e-002 | AJ22: =H22+100*O22 -> 104.5 | AK22: 99.9 | AL22: 17 | AM22: 8.9 | AN22: 19 | AO22: -9.1999999999999998e-002 | AP22: 61 | AQ22: 亚泰转债!
A23: 96 | B23: 113595 | C23: 花王转债! | D23: 603007 | E23: 花王股份 | F23: 城市公用 | G23: 生态环境 | H23: 84.42 | I23: -1.5e-003 | J23: -5.1000000000000004e-003 | K23: 4.79 | L23: -2.4399999999999998e-002 | M23: 125.3 | N23: 6.93 | O23: 0.221 | P23: 69.12 | Q23: 转股中 | R23: 5.46年 | S23: 3.46年 | T23: 3.3 | U23: 4.8 | V23: 1.7000000000000001e-002 | W23: 0.20499999999999999 | X23: 0.14199999999999999 | Y23: 16 | Z23: 1.45 | AA23: 7.690000000000001e-002 | AB23: 6.83e-002 | AC23: 6.0700000000000004e-002 | AD23: 5.8099999999999999e-002 | AE23: 82.93 | AF23: 89.11 | AG23: 0.27 | AH23: AA- | AI23: 6.6000000000000003e-002 | AJ23: =H23+100*O23 -> 106.52000000000001 | AK23: 99.7 | AL23: 16 | AM23: 10.6 | AN23: 26 | AO23: -3.2000000000000001e-002 | AP23: 34 | AQ23: 花王转债!
A24: 242 | B24: 113534 | C24: 鼎胜转债! | D24: 603876 | E24: 鼎胜新材 | F24: 有色金属 | G24: 小金属 | H24: 84.97 | I24: -8.6e-003 | J24: 2.7000000000000001e-003 | K24: 10.92 | L24: -3.1099999999999999e-002 | M24: 114.9 | N24: 15.18 | O24: 0.18100000000000002 | P24: 71.94 | Q24: 转股中 | R24: 4.17年 | S24: 2.17年 | T24: 12 | U24: 13 | V24: 1.3000000000000001e-002 | W24: 0.253 | X24: 0.182 | Y24: 47 | Z24: 1.32 | AA24: 7.6799999999999993e-002 | AB24: 6.9599999999999995e-002 | AC24: 8.8599999999999998e-002 | AD24: 8.5299999999999987e-002 | AE24: 93.66 | AF24: 96.49 | AG24: 0.19 | AH24: AA | AI24: 4.3700000000000003e-002 | AJ24: =H24+100*O24 -> 103.06999999999999 | AK24: 98 | AL24: 12 | AM24: 1.5 | AN24: 4 | AO24: -0.14599999999999999 | AP24: 34 | AQ24: 鼎胜转债!
A25: 116 | B25: 113589 | C25: 天创转债! | D25: 603608 | E25: 天创时尚 | F25: 服装纺织 | G25: 鞋服行业 | H25: 78.67 | I25: 1.9e-003 | J25: -2.e-003 | K25: 5.07 | L25: -5.8999999999999999e-003 | M25: 115.3 | N25: 12.44 | O25: 0.93000000000000005 | P25: 40.76 | Q25: 转股中 | R25: 5.38年 | S25: 3.38年 | T25: 6 | U25: 3.5 | V25: 6.9999999999999993e-003 | W25: 0.27600000000000002 | X25: 0.11199999999999999 | Y25: 22 | Z25: 1.02 | AA25: 7.5300000000000006e-002 | AB25: 6.9500000000000006e-002 | AC25: 8.2200000000000009e-002 | AD25: 7.980000000000001e-002 | AE25: 88.94 | AF25: 91.43 | AG25: 0.02 | AH25: AA | AI25: 4.4999999999999998e-002 | AJ25: =H25+100*O25 -> 171.67000000000002 | AK25: 116.6 | AL25: 142 | AM25: 25.2 | AN25: 134 | AO25: -0.13300000000000001 | AP25: 19 | AQ25: 天创转债!
A26: 253 | B26: 123023 | C26: 迪森转债! | D26: 300335 | E26: 迪森股份 | F26: 能源电力 | G26: 电力供应 | H26: 85.83 | I26: 9.4999999999999998e-003 | J26: -1.03e-002 | K26: 4.17 | L26: -9.4999999999999998e-003 | M26: 114.9 | N26: 7.04 | O26: 0.44900000000000001 | P26: 59.23 | Q26: 转股中 | R26: 4年43天 | S26: 3年43天 | T26: 5.29 | U26: 4.3 | V26: 9.0000000000000011e-003 | W26: 0.34000000000000002 | X26: 0.20100000000000001 | Y26: 16 | Z26: 1.12 | AA26: 7.5199999999999989e-002 | AB26: 6.7900000000000002e-002 | AC26: 6.5199999999999994e-002 | AD26: 6.1699999999999998e-002 | AE26: 91.67 | AF26: 96.72 | AG26: 0.09 | AH26: AA | AI26: 4.3700000000000003e-002 | AJ26: =H26+100*O26 -> 130.72999999999999 | AK26: 112.4 | AL26: 95 | AM26: 15.7 | AN26: 60 | AO26: -0.11699999999999999 | AP26: 57 | AQ26: 迪森转债!
A27: 330 | B27: 128015 | C27: 久其转债! | D27: 2279 | E27: 久其软件 | F27: 计算机及 | G27: 软件开发 | H27: 93.84 | I27: -1.7000000000000001e-003 | J27: 1.7000000000000001e-003 | K27: 4.07 | L27: 2.5000000000000001e-003 | M27: 110.8 | N27: 9.48 | O27: 1.1899999999999999 | P27: 42.93 | Q27: 转股中 | R27: 2.34年 | S27: 0.34年 | T27: 7.8 | U27: 15 | V27: 2.e-002 | W27: 0.26899999999999996 | X27: 0.11599999999999999 | Y27: 29 | Z27: 4.1 | AA27: 7.4999999999999997e-002 | AB27: 6.5599999999999992e-002 | AC27: 0.17100000000000001 | AD27: 0.16300000000000001 | AE27: 97.97 | AF27: 94.02 | AG27: 0 | AH27: A+ | AI27: 7.4099999999999999e-002 | AJ27: =H27+100*O27 -> 212.84 | AK27: 144.7 | AL27: 284 | AM27: 46.8 | AN27: 269 | AO27: -5.5e-002 | AP27: 64 | AQ27: 久其转债!
A28: 194 | B28: 128087 | C28: 孚日转债! | D28: 2083 | E28: 孚日股份 | F28: 服装纺织 | G28: 家纺 | H28: 80.8 | I28: -2.5000000000000001e-003 | J28: 2.0999999999999999e-003 | K28: 3.94 | L28: -2.5000000000000001e-003 | M28: 112.9 | N28: 6.3 | O28: 0.29199999999999998 | P28: 62.54 | Q28: 转股中 | R28: 4.86年 | S28: 2.86年 | T28: 6.5 | U28: 4.8 | V28: 9.0000000000000011e-003 | W28: 0.182 | X28: 0.114 | Y28: 36 | Z28: 0.95 | AA28: 7.2700000000000001e-002 | AB28: 6.7199999999999996e-002 | AC28: 8.5600000000000009e-002 | AD28: 8.3100000000000007e-002 | AE28: 90.94 | AF28: 92.06 | AG28: 0.14 | AH28: AA | AI28: 4.3700000000000003e-002 | AJ28: =H28+100*O28 -> 110. | AK28: 99.1 | AL28: 13 | AM28: 7 | AN28: 11 | AO28: -5.0999999999999997e-002 | AP28: 52 | AQ28: 孚日转债!
A29: 310 | B29: 113017 | C29: 吉视转债! | D29: 601929 | E29: 吉视传媒 | F29: 传媒娱乐 | G29: 影视娱乐 | H29: 89.29 | I29: -5.3e-003 | J29: 5.3e-003 | K29: 1.63 | L29: 0. | M29: 108.8 | N29: 2.95 | O29: 0.61599999999999999 | P29: 55.25 | Q29: 转股中 | R29: 2.89年 | S29: 0.89年 | T29: 15.6 | U29: 10 | V29: 6.9999999999999993e-003 | W29: 0.307 | X29: 0.17000000000000001 | Y29: 51 | Z29: 0.77 | AA29: 7.1800000000000003e-002 | AB29: 6.5500000000000003e-002 | AC29: 0.13 | AD29: 0.126 | AE29: 97.42 | AF29: 97.26 | AG29: 0.01 | AH29: AA+ | AI29: 4.0099999999999997e-002 | AJ29: =H29+100*O29 -> 150.89000000000001 | AK29: 123.3 | AL29: 192 | AM29: 25.9 | AN29: 144 | AO29: -0.10800000000000001 | AP29: 59 | AQ29: 吉视转债!
A30: 169 | B30: 113568 | C30: 新春转债! | D30: 603667 | E30: 五洲新春 | F30: 机械装备 | G30: 通用设备 | H30: 89 | I30: 7.000000000000001e-004 | J30: 5.3e-003 | K30: 6.68 | L30: 1.83e-002 | M30: 124.8 | N30: 8.91 | O30: 0.187 | P30: 74.97 | Q30: 转股中 | R30: 5年29天 | S30: 3年29天 | T30: 3.3 | U30: 6.2 | V30: 2.1000000000000001e-002 | W30: 0.16899999999999998 | X30: 0.127 | Y30: 20 | Z30: 1.13 | AA30: 7.0699999999999999e-002 | AB30: 6.1699999999999998e-002 | AC30: 5.2199999999999996e-002 | AD30: 4.9000000000000002e-002 | AE30: 85.36 | AF30: 90.97 | AG30: 0.32 | AH30: AA- | AI30: 6.6000000000000003e-002 | AJ30: =H30+100*O30 -> 107.7 | AK30: 103 | AL30: 29 | AM30: 12.1 | AN30: 33 | AO30: -3.5000000000000003e-002 | AP30: 49 | AQ30: 新春转债!
A31: 317 | B31: 128026 | C31: 众兴转债! | D31: 2772 | E31: 众兴菌业 | F31: 农业 | G31: 种植业 | H31: 90.3 | I31: -2.7699999999999999e-002 | J31: 2.5899999999999999e-002 | K31: 7.87 | L31: -3.2000000000000001e-002 | M31: 109.3 | N31: 11.45 | O31: 0.314 | P31: 68.73 | Q31: 转股中 | R31: 2.85年 | S31: 0.85年 | T31: 9.19 | U31: 20 | V31: 2.4e-002 | W31: 0.318 | X31: 0.218 | Y31: 29 | Z31: 1.18 | AA31: 7.0400000000000004e-002 | AB31: 6.3700000000000007e-002 | AC31: 0.125 | AD31: 0.121 | AE31: 95.66 | AF31: 92.06 | AG31: 0.06 | AH31: AA- | AI31: 6.3099999999999989e-002 | AJ31: =H31+100*O31 -> 121.69999999999999 | AK31: 111.9 | AL31: 91 | AM31: 16.2 | AN31: 62 | AO31: -0.13 | AP31: 60 | AQ31: 众兴转债!
A32: 229 | B32: 128069 | C32: 华森转债! | D32: 2907 | E32: 华森制药 | F32: 医药 | G32: 化学制药 | H32: 89.79 | I32: -1.4499999999999999e-002 | J32: 1.7299999999999999e-002 | K32: 10.69 | L32: 2.7900000000000001e-002 | M32: 120 | N32: 18.04 | O32: 0.51500000000000001 | P32: 59.26 | Q32: 转股中 | R32: 4.38年 | S32: 2.38年 | T32: 3 | U32: 6.8 | V32: 2.5000000000000001e-002 | W32: 7.0000000000000007e-002 | X32: 4.0999999999999995e-002 | Y32: 43 | Z32: 4 | AA32: 7.0000000000000007e-002 | AB32: 6.13e-002 | AC32: 5.8099999999999999e-002 | AD32: 5.5099999999999996e-002 | AE32: 88.39 | AF32: 91.71 | AG32: 0.1 | AH32: AA- | AI32: 6.4699999999999994e-002 | AJ32: =H32+100*O32 -> 141.29000000000002 | AK32: 120.3 | AL32: 172 | AM32: 28.6 | AN32: 172 | AO32: -9.0999999999999998e-002 | AP32: 46 | AQ32: 华森转债!
A33: 328 | B33: 113014 | C33: 林洋转债! | D33: 601222 | E33: 林洋能源 | F33: 能源电力 | G33: 电力设备 | H33: 91.22 | I33: -1.6000000000000001e-003 | J33: -1.6000000000000001e-003 | K33: 5.71 | L33: -4.99e-002 | M33: 109.3 | N33: 8.54 | O33: 0.36399999999999999 | P33: 66.86 | Q33: 转股中 | R33: 2.72年 | S33: 0.72年 | T33: 30 | U33: 74 | V33: 2.7000000000000003e-002 | W33: 0.29999999999999999 | X33: 0.20100000000000001 | Y33: 100 | Z33: 0.96 | AA33: 6.9900000000000004e-002 | AB33: 6.2800000000000009e-002 | AC33: 0.13200000000000001 | AD33: 0.127 | AE33: 98.14 | AF33: 97.87 | AG33: 0.06 | AH33: AA | AI33: 4.2099999999999999e-002 | AJ33: =H33+100*O33 -> 127.62 | AK33: 115.6 | AL33: 131 | AM33: 17.4 | AN33: 66 | AO33: -0.28600000000000003 | AP33: 26 | AQ33: 林洋转债!
A34: 199 | B34: 128082 | C34: 华锋转债! | D34: 2806 | E34: 华锋股份 | F34: 电子 | G34: 元器件制 | H34: 88.36 | I34: 4.0999999999999995e-003 | J34: -5.6000000000000008e-003 | K34: 8.09 | L34: -4.8999999999999998e-003 | M34: 121.4 | N34: 11.71 | O34: 0.27899999999999997 | P34: 69.09 | Q34: 转股中 | R34: 4.83年 | S34: 2.83年 | T34: 3.45 | U34: 1.7 | V34: 5.0000000000000001e-003 | W34: 0.24199999999999999 | X34: 0.16699999999999998 | Y34: 14 | Z34: 1.14 | AA34: 6.9800000000000001e-002 | AB34: 6.1399999999999996e-002 | AC34: 5.8299999999999998e-002 | AD34: 5.5099999999999996e-002 | AE34: 84.21 | AF34: 86.1 | AG34: 0.31 | AH34: A+ | AI34: 7.5700000000000003e-002 | AJ34: =H34+100*O34 -> 116.25999999999999 | AK34: 107.6 | AL34: 60 | AM34: 21.5 | AN34: 97 | AO34: -0.18600000000000003 | AP34: 59 | AQ34: 华锋转债!
A35: 319 | B35: 128023 | C35: 亚太转债! | D35: 2284 | E35: 亚太股份 | F35: 汽车 | G35: 零部件制 | H35: 92.3 | I35: -7.6e-003 | J35: 7.6e-003 | K35: 5.04 | L35: 0. | M35: 111.3 | N35: 10.34 | O35: 0.89400000000000002 | P35: 48.74 | Q35: 转股中 | R35: 2.83年 | S35: 0.83年 | T35: 9.99 | U35: 2.1 | V35: 2.e-003 | W35: 0.26899999999999996 | X35: 0.13100000000000001 | Y35: 37 | Z35: 1.53 | AA35: 6.9599999999999995e-002 | AB35: 6.1500000000000006e-002 | AC35: 0.10400000000000001 | AD35: 9.9900000000000003e-002 | AE35: 97.72 | AF35: 99.23 | AG35: 0.01 | AH35: AA | AI35: 4.2099999999999999e-002 | AJ35: =H35+100*O35 -> 181.69999999999999 | AK35: 135.9 | AL35: 264 | AM35: 36.6 | AN35: 225 | AO35: -9.0999999999999998e-002 | AP35: 67 | AQ35: 亚太转债!
A36: 286 | B36: 128042 | C36: 凯中转债! | D36: 2823 | E36: 凯中精密 | F36: 能源电力 | G36: 电力设备 | H36: 92.5 | I36: -1.6200000000000003e-002 | J36: 1.3899999999999999e-002 | K36: 9.27 | L36: -1.5900000000000001e-002 | M36: 116.3 | N36: 12.96 | O36: 0.29299999999999998 | P36: 71.53 | Q36: 转股中 | R36: 3.48年 | S36: 1.48年 | T36: 4.16 | U36: 1.4 | V36: 4.0000000000000001e-003 | W36: 0.156 | X36: 0.11199999999999999 | Y36: 27 | Z36: 1.97 | AA36: 6.9400000000000003e-002 | AB36: 6.0299999999999999e-002 | AC36: 6.6799999999999998e-002 | AD36: 6.3200000000000006e-002 | AE36: 95.87 | AF36: 100.51 | AG36: 0.14 | AH36: AA | AI36: 4.3700000000000003e-002 | AJ36: =H36+100*O36 -> 121.8 | AK36: 113.5 | AL36: 108 | AM36: 13 | AN36: 39 | AO36: -4.7e-002 | AP36: 30 | AQ36: 凯中转债!
A37: 262 | B37: 113528 | C37: 长城转债! | D37: 603897 | E37: 长城科技 | F37: 机械装备 | G37: 专用设备 | H37: 90.22 | I37: -7.6e-003 | J37: 1.21e-002 | K37: 15.9 | L37: 2.2499999999999999e-002 | M37: 117.6 | N37: 23.45 | O37: 0.33100000000000002 | P37: 67.8 | Q37: 转股中 | R37: 4年24天 | S37: 2年24天 | T37: 6.34 | U37: 2.2 | V37: 4.0000000000000001e-003 | W37: 0.22399999999999998 | X37: 0.152 | Y37: 28 | Z37: 1.55 | AA37: 6.93e-002 | AB37: 6.08e-002 | AC37: 6.6500000000000004e-002 | AD37: 6.2600000000000003e-002 | AE37: 90.55 | AF37: 91.76 | AG37: 0.2 | AH37: AA- | AI37: 6.4699999999999994e-002 | AJ37: =H37+100*O37 -> 123.31999999999999 | AK37: 112.6 | AL37: 97 | AM37: 20.9 | AN37: 90 | AO37: -2.e-002 | AP37: 44 | AQ37: 长城转债!
A38: 126 | B38: 123054 | C38: 思特转债! | D38: 300608 | E38: 思特奇 | F38: 通信互联 | G38: 通信设备 | H38: 85.999 | I38: -1.2800000000000001e-002 | J38: 1.1000000000000001e-002 | K38: 10.24 | L38: -8.6999999999999994e-003 | M38: 121.7 | N38: 16.49 | O38: 0.38500000000000001 | P38: 62.1 | Q38: 转股中 | R38: 5.34年 | S38: 3.34年 | T38: 2.71 | U38: 4.7 | V38: 2.e-002 | W38: 0.16800000000000001 | X38: 0.10400000000000001 | Y38: 16 | Z38: 2.13 | AA38: 6.8900000000000003e-002 | AB38: 6.1200000000000004e-002 | AC38: 5.8200000000000002e-002 | AD38: 5.5399999999999998e-002 | AE38: 83.85 | AF38: 87.23 | AG38: 0.2 | AH38: AA- | AI38: 6.6000000000000003e-002 | AJ38: =H38+100*O38 -> 124.499 | AK38: 109.9 | AL38: 83 | AM38: 22.7 | AN38: 116 | AO38: -0.106 | AP38: 19 | AQ38: 思特转债!
A39: 109 | B39: 128118 | C39: 瀛通转债! | D39: 2861 | E39: 瀛通通讯 | F39: 电子 | G39: 电子产品 | H39: 85.95 | I39: 2.9999999999999997e-004 | J39: -2.e-003 | K39: 16.32 | L39: -1.03e-002 | M39: 122.1 | N39: 27.53 | O39: 0.45000000000000001 | P39: 59.28 | Q39: 转股中 | R39: 5.40年 | S39: 3.40年 | T39: 3 | U39: 10 | V39: 3.9e-002 | W39: 0.151 | X39: 8.900000000000001e-002 | Y39: 20 | Z39: 1.87 | AA39: 6.8900000000000003e-002 | AB39: 6.1100000000000002e-002 | AC39: 5.7300000000000004e-002 | AD39: 5.45e-002 | AE39: 83.49 | AF39: 87.18 | AG39: 0.17 | AH39: AA- | AI39: 6.6000000000000003e-002 | AJ39: =H39+100*O39 -> 130.94999999999999 | AK39: 112.6 | AL39: 96 | AM39: 25.4 | AN39: 140 | AO39: -8.900000000000001e-002 | AP39: 10 | AQ39: 瀛通转债!
A40: 88 | B40: 113596 | C40: 城地转债! | D40: 603887 | E40: 城地香江 | F40: 通信互联 | G40: 通信设备 | H40: 79.49 | I40: -2.0099999999999996e-002 | J40: 1.9299999999999998e-002 | K40: 13.83 | L40: -1.21e-002 | M40: 113.5 | N40: 29.21 | O40: 0.67900000000000005 | P40: 47.35 | Q40: 转股中 | R40: 5.48年 | S40: 3.48年 | T40: 12 | U40: 15 | V40: 1.6e-002 | W40: 0.23100000000000001 | X40: 0.109 | Y40: 52 | Z40: 1.43 | AA40: 6.88e-002 | AB40: 6.3700000000000007e-002 | AC40: 7.6999999999999999e-002 | AD40: 7.46e-002 | AE40: 82.48 | AF40: 80.59 | AG40: 0.07 | AH40: AA- | AI40: 6.6000000000000003e-002 | AJ40: =H40+100*O40 -> 147.38999999999999 | AK40: 111.6 | AL40: 90 | AM40: 29.2 | AN40: 178 | AO40: -0.11699999999999999 | AP40: 14 | AQ40: 城地转债!
A41: 32 | B41: 123077 | C41: 汉得转债! | D41: 300170 | E41: 汉得信息 | F41: 计算机及 | G41: 软件开发 | H41: 86.059 | I41: -9.7000000000000003e-003 | J41: 5.3e-003 | K41: 6.4 | L41: -2.7400000000000001e-002 | M41: 125.5 | N41: 9.72 | O41: 0.307 | P41: 65.84 | Q41: 3月21天 | R41: 5.80年 | S41: 3.80年 | T41: 9.37 | U41: 20 | V41: 2.4e-002 | W41: 0.16600000000000001 | X41: 0.109 | Y41: 57 | Z41: 1.78 | AA41: 6.8499999999999991e-002 | AB41: 6.0599999999999994e-002 | AC41: 4.9000000000000002e-002 | AD41: 4.6900000000000004e-002 | AE41: 87.35 | AF41: 97.67 | AG41: 0.16 | AH41: AA | AI41: 4.4999999999999998e-002 | AJ41: =H41+100*O41 -> 116.759 | AK41: 106.3 | AL41: 49 | AM41: 8.6 | AN41: 17 | AO41: -0.11699999999999999 | AP41: 8 | AQ41: 汉得转债!
A42: 320 | B42: 128022 | C42: 众信转债! | D42: 2707 | E42: 众信旅游 | F42: 旅游餐饮 | G42: 旅游 | H42: 90.709 | I42: -1.4199999999999999e-002 | J42: 1.43e-002 | K42: 5.14 | L42: 4.2599999999999999e-002 | M42: 108.8 | N42: 7.92 | O42: 0.39799999999999996 | P42: 64.9 | Q42: 转股中 | R42: 2.82年 | S42: 0.82年 | T42: 4.56 | U42: 29 | V42: 7.0000000000000007e-002 | W42: 9.8000000000000004e-002 | X42: 6.4000000000000001e-002 | Y42: 47 | Z42: 2.19 | AA42: 6.7599999999999993e-002 | AB42: 6.1200000000000004e-002 | AC42: 0.122 | AD42: 0.11800000000000001 | AE42: 95.62 | AF42: 91.78 | AG42: 0 | AH42: AA- | AI42: 6.3099999999999989e-002 | AJ42: =H42+100*O42 -> 130.50900000000001 | AK42: 116.5 | AL42: 141 | AM42: 20.9 | AN42: 91 | AO42: 7.4999999999999997e-002 | AP42: 29 | AQ42: 众信转债!
A43: 75 | B43: 128127 | C43: 文科转债! | D43: 2775 | E43: 文科园林 | F43: 城市公用 | G43: 生态环境 | H43: 85.36 | I43: -7.9000000000000008e-003 | J43: 5.0000000000000001e-003 | K43: 4.08 | L43: -7.3000000000000001e-003 | M43: 121.3 | N43: 5.37 | O43: 0.12300000000000001 | P43: 75.98 | Q43: 24天 | R43: 5.54年 | S43: 3.54年 | T43: 9.5 | U43: 6.8 | V43: 8.0000000000000002e-003 | W43: 0.45399999999999996 | X43: 0.34499999999999997 | Y43: 21 | Z43: 0.79 | AA43: 6.7099999999999993e-002 | AB43: 5.9800000000000006e-002 | AC43: 5.6100000000000004e-002 | AD43: 5.3600000000000002e-002 | AE43: 82.49 | AF43: 85.84 | AG43: 0.4 | AH43: AA- | AI43: 6.6000000000000003e-002 | AJ43: =H43+100*O43 -> 97.659999999999997 | AK43: 94.7 | AL43: 4 | AM43: 8.9 | AN43: 18 | AO43: -8.1000000000000003e-002 | AP43: 29 | AQ43: 文科转债!
A44: 165 | B44: 123044 | C44: 红相转债! | D44: 300427 | E44: 红相股份 | F44: 能源电力 | G44: 电力设备 | H44: 91 | I44: -0.16899999999999998 | J44: 0.107 | K44: 14.46 | L44: -0.17800000000000002 | M44: 125.5 | N44: 18.8 | O44: 0.183 | P44: 76.91 | Q44: 转股中 | R44: 5年35天 | S44: 3年35天 | T44: 5.5 | U44: 372 | V44: 0.73099999999999998 | W44: 0.106 | X44: 8.1000000000000003e-002 | Y44: 52 | Z44: 2.28 | AA44: 6.7000000000000004e-002 | AB44: 5.7800000000000004e-002 | AC44: 4.5499999999999999e-002 | AD44: 4.2300000000000004e-002 | AE44: 85.51 | AF44: 91.44 | AG44: 0.35 | AH44: AA- | AI44: 6.6000000000000003e-002 | AJ44: =H44+100*O44 -> 109.3 | AK44: 105.1 | AL44: 38 | AM44: 13.6 | AN44: 43 | AO44: -0.312 | AP44: 16 | AQ44: 红相转债!
A45: 220 | B45: 128073 | C45: 哈尔转债! | D45: 2615 | E45: 哈尔斯 | F45: 其他 | G45: 家居用品 | H45: 92 | I45: -1.0800000000000001e-002 | J45: 8.3000000000000001e-003 | K45: 3.59 | L45: -2.18e-002 | M45: 115.3 | N45: 5.7 | O45: 0.46100000000000002 | P45: 62.98 | Q45: 转股中 | R45: 3.54年 | S45: 1.54年 | T45: 2.99 | U45: 9.9 | V45: 3.6000000000000004e-002 | W45: 0.20199999999999999 | X45: 0.127 | Y45: 15 | Z45: 1.85 | AA45: 6.6799999999999998e-002 | AB45: 5.8499999999999996e-002 | AC45: 6.3e-002 | AD45: 6.0400000000000002e-002 | AE45: 91.74 | AF45: 92.64 | AG45: 0.11 | AH45: AA- | AI45: 6.4699999999999994e-002 | AJ45: =H45+100*O45 -> 138.09999999999999 | AK45: 121 | AL45: 176 | AM45: 28.4 | AN45: 169 | AO45: -8.9999999999999997e-002 | AP45: 40 | AQ45: 哈尔转债!
A46: 212 | B46: 113546 | C46: 迪贝转债! | D46: 603320 | E46: 迪贝电气 | F46: 家电 | G46: 零部件制 | H46: 89.63 | I46: 6.8999999999999999e-003 | J46: -7.3000000000000001e-003 | K46: 9.02 | L46: -2.2000000000000001e-003 | M46: 120.6 | N46: 14.1 | O46: 0.40100000000000002 | P46: 63.97 | Q46: 转股中 | R46: 4.71年 | S46: 2.71年 | T46: 2.3 | U46: 1.3 | V46: 6.0000000000000001e-003 | W46: 0.19600000000000001 | X46: 0.125 | Y46: 12 | Z46: 1.76 | AA46: 6.6500000000000004e-002 | AB46: 5.8299999999999998e-002 | AC46: 5.3399999999999996e-002 | AD46: 5.0499999999999996e-002 | AE46: 84.45 | AF46: 86.18 | AG46: 0.22 | AH46: A+ | AI46: 7.5700000000000003e-002 | AJ46: =H46+100*O46 -> 129.72999999999999 | AK46: 115.3 | AL46: 129 | AM46: 29.1 | AN46: 177 | AO46: -8.9999999999999997e-002 | AP46: 44 | AQ46: 迪贝转债!
A47: 215 | B47: 128076 | C47: 金轮转债! | D47: 2722 | E47: 金轮股份 | F47: 机械装备 | G47: 专用设备 | H47: 85.5 | I47: -4.7999999999999996e-003 | J47: 4.5999999999999999e-003 | K47: 9.01 | L47: -1.1000000000000001e-003 | M47: 114.9 | N47: 14.76 | O47: 0.40100000000000002 | P47: 61.04 | Q47: 转股中 | R47: 4.69年 | S47: 2.69年 | T47: 2.14 | U47: 2.8 | V47: 1.4999999999999999e-002 | W47: 0.13500000000000001 | X47: 8.3000000000000004e-002 | Y47: 16 | Z47: 0.86 | AA47: 6.6400000000000001e-002 | AB47: 6.0100000000000001e-002 | AC47: 6.9599999999999995e-002 | AD47: 6.6900000000000001e-002 | AE47: 86.61 | AF47: 86.15 | AG47: 0.16 | AH47: AA- | AI47: 6.4699999999999994e-002 | AJ47: =H47+100*O47 -> 125.59999999999999 | AK47: 110 | AL47: 84 | AM47: 23.3 | AN47: 123 | AO47: -0.13300000000000001 | AP47: 44 | AQ47: 金轮转债!
A48: 271 | B48: 113524 | C48: 奇精转债! | D48: 603677 | E48: 奇精机械 | F48: 家电 | G48: 零部件制 | H48: 92.1 | I48: -8.5000000000000006e-003 | J48: 1.54e-002 | K48: 10.96 | L48: 2.81e-002 | M48: 117.3 | N48: 14.08 | O48: 0.183 | P48: 77.84 | Q48: 转股中 | R48: 3.86年 | S48: 1.86年 | T48: 3.3 | U48: 3 | V48: 1.e-002 | W48: 0.157 | X48: 0.122 | Y48: 21 | Z48: 2.2 | AA48: 6.6000000000000003e-002 | AB48: 5.74e-002 | AC48: 5.6299999999999996e-002 | AD48: 5.33e-002 | AE48: 94.34 | AF48: 99.75 | AG48: 0.24 | AH48: AA | AI48: 4.3700000000000003e-002 | AJ48: =H48+100*O48 -> 110.39999999999999 | AK48: 106.4 | AL48: 51 | AM48: 6.6 | AN48: 10 | AO48: 8.0000000000000002e-003 | AP48: 48 | AQ48: 奇精转债!
A49: 31 | B49: 113609 | C49: 永安转债! | D49: 603776 | E49: 永安行 | F49: 城市公用 | G49: 其他 | H49: 84.26 | I49: -9.1000000000000004e-003 | J49: 1.1399999999999999e-002 | K49: 14.09 | L49: 7.0999999999999995e-003 | M49: 120.5 | N49: 20.34 | O49: 0.21600000000000003 | P49: 69.27 | Q49: 3月25天 | R49: 5.80年 | S49: 3.80年 | T49: 8.86 | U49: 31 | V49: 4.0000000000000001e-002 | W49: 0.33500000000000002 | X49: 0.23199999999999998 | Y49: 26 | Z49: 0.95 | AA49: 6.4899999999999999e-002 | AB49: 5.8200000000000002e-002 | AC49: 5.4600000000000003e-002 | AD49: 5.2499999999999998e-002 | AE49: 80.78 | AF49: 83.76 | AG49: 0.32 | AH49: AA- | AI49: 6.6000000000000003e-002 | AJ49: =H49+100*O49 -> 105.86000000000001 | AK49: 99.2 | AL49: 14 | AM49: 15.5 | AN49: 58 | AO49: -8.5000000000000006e-002 | AP49: 7 | AQ49: 永安转债!
A50: 13 | B50: 123088 | C50: 威唐转债! | D50: 300707 | E50: 威唐工业 | F50: 汽车 | G50: 零部件制 | H50: 84.9 | I50: 2.3999999999999998e-003 | J50: 6.4000000000000003e-003 | K50: 13.02 | L50: 3.0099999999999998e-002 | M50: 121.6 | N50: 20.75 | O50: 0.35299999999999998 | P50: 62.75 | Q50: 4月16天 | R50: 5.86年 | S50: 3.86年 | T50: 3.01 | U50: 14 | V50: 5.2999999999999999e-002 | W50: 0.14699999999999999 | X50: 9.1999999999999998e-002 | Y50: 20 | Z50: 3.01 | AA50: 6.480000000000001e-002 | AB50: 5.7800000000000004e-002 | AC50: 5.3800000000000001e-002 | AD50: 5.1399999999999994e-002 | AE50: 77.87 | AF50: 79.53 | AG50: 0.29 | AH50: A+ | AI50: 7.6999999999999999e-002 | AJ50: =H50+100*O50 -> 120.2 | AK50: 107.1 | AL50: 54 | AM50: 27.5 | AN50: 155 | AO50: -7.8e-002 | AP50: 4 | AQ50: 威唐转债!
A51: 324 | B51: 113502 | C51: 嘉澳转债! | D51: 603822 | E51: 嘉澳环保 | F51: 化工 | G51: 化工 | H51: 94.17 | I51: -3.7000000000000002e-003 | J51: 3.7000000000000002e-003 | K51: 15.58 | L51: -3.8300000000000001e-002 | M51: 111.3 | N51: 44.79 | O51: 1.71 | P51: 34.78 | Q51: 转股中 | R51: 2.76年 | S51: 0.76年 | T51: 1.85 | U51: 1.5 | V51: 9.0000000000000011e-003 | W51: 0.16200000000000001 | X51: 5.5999999999999994e-002 | Y51: 11 | Z51: 1.52 | AA51: 6.3500000000000001e-002 | AB51: 5.5300000000000002e-002 | AC51: 8.7799999999999989e-002 | AD51: 8.3599999999999994e-002 | AE51: 96.19 | AF51: 94.26 | AG51: 0 | AH51: AA- | AI51: 6.3099999999999989e-002 | AJ51: =H51+100*O51 -> 265.17000000000002 | AK51: 153.6 | AL51: 301 | AM51: 57.4 | AN51: 294 | AO51: -0.10199999999999999 | AP51: 34 | AQ51: 嘉澳转债!
A52: 173 | B52: 113566 | C52: 翔港转债! | D52: 603499 | E52: 翔港科技 | F52: 造纸包装 | G52: 包装材料 | H52: 91.91 | I52: -2.53e-002 | J52: 3.1200000000000002e-002 | K52: 7.2 | L52: 2.1299999999999999e-002 | M52: 124.5 | N52: 10.77 | O52: 0.375 | P52: 66.85 | Q52: 转股中 | R52: 5年23天 | S52: 3年23天 | T52: 1.61 | U52: 42 | V52: 0.28000000000000003 | W52: 0.111 | X52: 7.400000000000001e-002 | Y52: 15 | Z52: 2.53 | AA52: 6.3500000000000001e-002 | AB52: 5.4600000000000003e-002 | AC52: 4.1700000000000001e-002 | AD52: 3.8699999999999998e-002 | AE52: 82.69 | AF52: 86.36 | AG52: 0.27 | AH52: A+ | AI52: 7.6999999999999999e-002 | AJ52: =H52+100*O52 -> 129.41 | AK52: 117 | AL52: 146 | AM52: 30.6 | AN52: 188 | AO52: -5.9999999999999998e-002 | AP52: 28 | AQ52: 翔港转债!
A53: 217 | B53: 128074 | C53: 游族转债!! | D53: 2174 | E53: 游族网络 | F53: 通信互联 | G53: 互联网 | H53: 90.751 | I53: -1.6299999999999999e-002 | J53: 1.84e-002 | K53: 10.21 | L53: 2.41e-002 | M53: 119.9 | N53: 16.97 | O53: 0.50800000000000001 | P53: 60.16 | Q53: 转股中 | R53: 4.63年 | S53: 2.63年 | T53: 6.83 | U53: 55 | V53: 8.6999999999999994e-002 | W53: 7.2999999999999995e-002 | X53: 4.4000000000000004e-002 | Y53: 94 | Z53: 1.65 | AA53: 6.3299999999999995e-002 | AB53: 5.5199999999999999e-002 | AC53: 4.82e-002 | AD53: 4.5700000000000005e-002 | AE53: 91.85 | AF53: 93.25 | AG53: 0.09 | AH53: AA | AI53: 4.3700000000000003e-002 | AJ53: =H53+100*O53 -> 141.55099999999999 | AK53: 121.3 | AL53: 178 | AM53: 28.1 | AN53: 163 | AO53: -0.191 | AP53: 24 | AQ53: 游族转债!!
A54: 318 | B54: 128025 | C54: 特一转债! | D54: 2728 | E54: 特一药业 | F54: 医药 | G54: 化学制药 | H54: 91.8 | I54: -2.0799999999999999e-002 | J54: 2.1000000000000001e-002 | K54: 9.93 | L54: 5.1000000000000004e-003 | M54: 108.8 | N54: 14.7 | O54: 0.35899999999999999 | P54: 67.55 | Q54: 转股中 | R54: 2.83年 | S54: 0.83年 | T54: 2.99 | U54: 5.7 | V54: 2.1000000000000001e-002 | W54: 0.14800000000000002 | X54: 0.10000000000000001 | Y54: 20 | Z54: 2 | AA54: 6.2699999999999992e-002 | AB54: 5.6399999999999999e-002 | AC54: 0.107 | AD54: 0.10300000000000001 | AE54: 95.54 | AF54: 91.71 | AG54: 0.03 | AH54: AA- | AI54: 6.3099999999999989e-002 | AJ54: =H54+100*O54 -> 127.69999999999999 | AK54: 116 | AL54: 134 | AM54: 20.5 | AN54: 85 | AO54: -7.2000000000000008e-002 | AP54: 51 | AQ54: 特一转债!
A55: 292 | B55: 123010 | C55: 博世转债! | D55: 300422 | E55: 博世科 | F55: 城市公用 | G55: 三废处理 | H55: 91.67 | I55: -7.7000000000000002e-003 | J55: 6.3e-003 | K55: 8.59 | L55: -9.1999999999999998e-003 | M55: 112.3 | N55: 12.2 | O55: 0.30199999999999999 | P55: 70.41 | Q55: 转股中 | R55: 3.41年 | S55: 1.41年 | T55: 4.3 | U55: 5.4 | V55: 1.3999999999999999e-002 | W55: 0.12300000000000001 | X55: 8.6999999999999994e-002 | Y55: 35 | Z55: 1.47 | AA55: 6.2699999999999992e-002 | AB55: 5.5399999999999998e-002 | AC55: 7.6100000000000001e-002 | AD55: 7.22e-002 | AE55: 93.2 | AF55: 91.09 | AG55: 0.15 | AH55: AA- | AI55: 6.4699999999999994e-002 | AJ55: =H55+100*O55 -> 121.87 | AK55: 112.9 | AL55: 102 | AM55: 19.7 | AN55: 77 | AO55: -9.5000000000000001e-002 | AP55: 32 | AQ55: 博世转债!
A56: 149 | B56: 113576 | C56: 起步转债!! | D56: 603557 | E56: 起步股份 | F56: 服装纺织 | G56: 鞋服行业 | H56: 89.65 | I56: -2.8000000000000004e-003 | J56: 1.6000000000000001e-003 | K56: 6.69 | L56: -5.8999999999999999e-003 | M56: 121.8 | N56: 10.55 | O56: 0.41399999999999998 | P56: 63.41 | Q56: 转股中 | R56: 5.18年 | S56: 3.18年 | T56: 2.66 | U56: 18 | V56: 7.5999999999999998e-002 | W56: 8.0000000000000002e-002 | X56: 5.0999999999999997e-002 | Y56: 33 | Z56: 1.97 | AA56: 6.2699999999999992e-002 | AB56: 5.4800000000000001e-002 | AC56: 4.8300000000000003e-002 | AD56: 4.53e-002 | AE56: 84.84 | AF56: 88.26 | AG56: 0.2 | AH56: AA- | AI56: 6.6000000000000003e-002 | AJ56: =H56+100*O56 -> 131.05000000000001 | AK56: 115.9 | AL56: 132 | AM56: 27.6 | AN56: 156 | AO56: -0.114 | AP56: 27 | AQ56: 起步转债!!
A57: 183 | B57: 128093 | C57: 百川转债! | D57: 2455 | E57: 百川股份 | F57: 化工 | G57: 化工 | H57: 97.5 | I57: 4.0599999999999997e-002 | J57: 1.06e-002 | K57: 5.48 | L57: 0.10000000000000001 | M57: 129.8 | N57: 5.87 | O57: 4.4000000000000004e-002 | P57: 93.36 | Q57: 转股中 | R57: 4.91年 | S57: 2.91年 | T57: 5.2 | U57: 555 | V57: 1.0700000000000001 | W57: 0.184 | X57: 0.17100000000000001 | Y57: 28 | Z57: 2.19 | AA57: 6.2199999999999998e-002 | AB57: 5.1399999999999994e-002 | AC57: 3.0800000000000001e-002 | AD57: 2.63e-002 | AE57: 88.41 | AF57: 96.4 | AG57: 0.51 | AH57: AA- | AI57: 6.4699999999999994e-002 | AJ57: =H57+100*O57 -> 101.90000000000001 | AK57: 101.6 | AL57: 23 | AM57: 5.2 | AN57: 8 | AO57: 6.4000000000000001e-002 | AP57: 48 | AQ57: 百川转债!
A58: 239 | B58: 127013 | C58: 创维转债! | D58: 810 | E58: 创维数字 | F58: 电子 | G58: 电子产品 | H58: 92.1 | I58: 8.9999999999999998e-004 | J58: -1.6000000000000001e-003 | K58: 6.75 | L58: -1.32e-002 | M58: 117.9 | N58: 11.39 | O58: 0.55399999999999994 | P58: 59.26 | Q58: 转股中 | R58: 4.19年 | S58: 2.19年 | T58: 9.78 | U58: 14 | V58: 1.4999999999999999e-002 | W58: 0.13600000000000001 | X58: 8.1000000000000003e-002 | Y58: 72 | Z58: 1.85 | AA58: 6.2100000000000002e-002 | AB58: 5.3899999999999997e-002 | AC58: 5.0999999999999997e-002 | AD58: 4.7899999999999998e-002 | AE58: 93.6 | AF58: 98.93 | AG58: 0.06 | AH58: AA | AI58: 4.3700000000000003e-002 | AJ58: =H58+100*O58 -> 147.5 | AK58: 124.9 | AL58: 201 | AM58: 26 | AN58: 145 | AO58: -0.11900000000000001 | AP58: 24 | AQ58: 创维转债!
A59: 275 | B59: 128049 | C59: 华源转债! | D59: 2787 | E59: 华源控股 | F59: 造纸包装 | G59: 包装材料 | H59: 91.609 | I59: 4.5000000000000005e-003 | J59: -1.15e-002 | K59: 5.64 | L59: -2.2499999999999999e-002 | M59: 114.5 | N59: 7.42 | O59: 0.20499999999999999 | P59: 76.01 | Q59: 转股中 | R59: 3.81年 | S59: 1.81年 | T59: 3.63 | U59: 2.1 | V59: 6.0000000000000001e-003 | W59: 0.20399999999999999 | X59: 0.155 | Y59: 18 | Z59: 1.19 | AA59: 6.1500000000000006e-002 | AB59: 5.4000000000000006e-002 | AC59: 6.0700000000000004e-002 | AD59: 5.7699999999999994e-002 | AE59: 90.94 | AF59: 90.59 | AG59: 0.31 | AH59: AA- | AI59: 6.4699999999999994e-002 | AJ59: =H59+100*O59 -> 112.10899999999999 | AK59: 107.2 | AL59: 56 | AM59: 16.3 | AN59: 64 | AO59: -6.7000000000000004e-002 | AP59: 51 | AQ59: 华源转债!
A60: 303 | B60: 113505 | C60: 杭电转债! | D60: 603618 | E60: 杭电股份 | F60: 能源电力 | G60: 电力设备 | H60: 93.99 | I60: -2.8399999999999998e-002 | J60: 9.1999999999999998e-003 | K60: 5.84 | L60: -7.1500000000000008e-002 | M60: 112.3 | N60: 7.14 | O60: 0.14899999999999999 | P60: 81.79 | Q60: 转股中 | R60: 3年29天 | S60: 1年29天 | T60: 7.5 | U60: 9.8 | V60: 1.3999999999999999e-002 | W60: 0.18600000000000003 | X60: 0.152 | Y60: 40 | Z60: 1.59 | AA60: 6.0999999999999999e-002 | AB60: 5.2900000000000003e-002 | AC60: 7.5399999999999995e-002 | AD60: 7.0499999999999993e-002 | AE60: 97.52 | AF60: 98.74 | AG60: 0.27 | AH60: AA | AI60: 4.3700000000000003e-002 | AJ60: =H60+100*O60 -> 108.88999999999999 | AK60: 106.2 | AL60: 46 | AM60: 7.5 | AN60: 13 | AO60: -0.10800000000000001 | AP60: 40 | AQ60: 杭电转债!
A61: 85 | B61: 113597 | C61: 佳力转债! | D61: 603912 | E61: 佳力图 | F61: 机械装备 | G61: 专用设备 | H61: 90.73 | I61: 1.1000000000000001e-003 | J61: -1.6000000000000001e-003 | K61: 11.93 | L61: -5.7999999999999996e-003 | M61: 124.5 | N61: 23.4 | O61: 0.78000000000000003 | P61: 50.98 | Q61: 转股中 | R61: 5.48年 | S61: 3.48年 | T61: 3 | U61: 4.2 | V61: 1.4999999999999999e-002 | W61: 0.11599999999999999 | X61: 5.9000000000000004e-002 | Y61: 26 | Z61: 2.98 | AA61: 6.0899999999999996e-002 | AB61: 5.2699999999999997e-002 | AC61: 3.9800000000000002e-002 | AD61: 3.7200000000000004e-002 | AE61: 82.94 | AF61: 88.41 | AG61: 0.08 | AH61: AA- | AI61: 6.6000000000000003e-002 | AJ61: =H61+100*O61 -> 168.73000000000002 | AK61: 130.5 | AL61: 233 | AM61: 42.1 | AN61: 251 | AO61: -8.4000000000000005e-002 | AP61: 9 | AQ61: 佳力转债!
A62: 25 | B62: 123080 | C62: 海波转债! | D62: 300517 | E62: 海波重科 | F62: 建筑 | G62: 建筑工程 | H62: 90.604 | I62: -4.3e-003 | J62: -1.04e-002 | K62: 16.84 | L62: -2.9399999999999999e-002 | M62: 126.5 | N62: 20.91 | O62: 0.125 | P62: 80.54 | Q62: 4月3天 | R62: 5.82年 | S62: 3.82年 | T62: 2.45 | U62: 9.7 | V62: 4.2999999999999997e-002 | W62: 0.13600000000000001 | X62: 0.11 | Y62: 18 | Z62: 2.35 | AA62: 6.0400000000000002e-002 | AB62: 5.2199999999999996e-002 | AC62: 3.73e-002 | AD62: 3.4799999999999998e-002 | AE62: 78.14 | AF62: 82.94 | AG62: 0.5 | AH62: A+ | AI62: 7.6999999999999999e-002 | AJ62: =H62+100*O62 -> 103.104 | AK62: 100.7 | AL62: 21 | AM62: 17.7 | AN62: 69 | AO62: 1.1000000000000001e-002 | AP62: 6 | AQ62: 海波转债!
A63: 102 | B63: 123059 | C63: 银信转债! | D63: 300231 | E63: 银信科技 | F63: 计算机及 | G63: 软件开发 | H63: 90.911 | I63: -3.0000000000000001e-003 | J63: -1.0200000000000001e-002 | K63: 7.33 | L63: -3.8100000000000002e-002 | M63: 124.1 | N63: 9.91 | O63: 0.22899999999999998 | P63: 73.97 | Q63: 转股中 | R63: 5.44年 | S63: 3.44年 | T63: 3.91 | U63: 11 | V63: 3.1e-002 | W63: 0.121 | X63: 8.900000000000001e-002 | Y63: 32 | Z63: 2.46 | AA63: 6.0199999999999997e-002 | AB63: 5.21e-002 | AC63: 3.85e-002 | AD63: 3.61e-002 | AE63: 82.82 | AF63: 88.31 | AG63: 0.35 | AH63: AA- | AI63: 6.6000000000000003e-002 | AJ63: =H63+100*O63 -> 113.81100000000001 | AK63: 107.9 | AL63: 63 | AM63: 19.5 | AN63: 76 | AO63: -0.11 | AP63: 14 | AQ63: 银信转债!
A64: 193 | B64: 113557 | C64: 森特转债 | D64: 603098 | E64: 森特股份 | F64: 建筑 | G64: 建筑工程 | H64: 91.45 | I64: -3.2000000000000002e-003 | J64: 7.000000000000001e-004 | K64: 8.18 | L64: -6.0999999999999995e-003 | M64: 120.3 | N64: 10.11 | O64: 0.13 | P64: 80.91 | Q64: 转股中 | R64: 4.87年 | S64: 2.87年 | T64: 6 | U64: 11 | V64: 1.9e-002 | W64: 0.153 | X64: 0.124 | Y64: 39 | Z64: 1.89 | AA64: 5.9200000000000003e-002 | AB64: 5.1399999999999994e-002 | AC64: 4.2500000000000003e-002 | AD64: 4.0000000000000001e-002 | AE64: 85.85 | AF64: 89.2 | AG64: 0.41 | AH64: AA- | AI64: 6.4699999999999994e-002 | AJ64: =H64+100*O64 -> 104.45 | AK64: 102 | AL64: 25 | AM64: 12.8 | AN64: 38 | AO64: 1.e-003 | AP64: 40 | AQ64: 森特转债
A65: 34 | B65: 123076 | C65: 强力转债! | D65: 300429 | E65: 强力新材 | F65: 化工 | G65: 化工 | H65: 85.554 | I65: -2.8000000000000004e-003 | J65: -7.000000000000001e-004 | K65: 10.65 | L65: -2.29e-002 | M65: 118.5 | N65: 18.98 | O65: 0.52500000000000002 | P65: 56.11 | Q65: 3月19天 | R65: 5.79年 | S65: 3.79年 | T65: 8.5 | U65: 11 | V65: 1.4999999999999999e-002 | W65: 0.155 | X65: 8.6999999999999994e-002 | Y65: 55 | Z65: 3.17 | AA65: 5.91e-002 | AB65: 5.2999999999999999e-002 | AC65: 5.0700000000000002e-002 | AD65: 4.8600000000000004e-002 | AE65: 80.85 | AF65: 82.46 | AG65: 0.16 | AH65: AA- | AI65: 6.6000000000000003e-002 | AJ65: =H65+100*O65 -> 138.054 | AK65: 115 | AL65: 126 | AM65: 32.5 | AN65: 201 | AO65: -0.14599999999999999 | AP65: 10 | AQ65: 强力转债!
A66: 263 | B66: 128056 | C66: 今飞转债! | D66: 2863 | E66: 今飞凯达 | F66: 汽车 | G66: 零部件制 | H66: 96.5 | I66: -5.1999999999999998e-003 | J66: 4.0999999999999995e-003 | K66: 4.83 | L66: -4.0999999999999995e-003 | M66: 121 | N66: 6.7 | O66: 0.33899999999999997 | P66: 72.09 | Q66: 转股中 | R66: 4年23天 | S66: 2年23天 | T66: 1.72 | U66: 12 | V66: 7.400000000000001e-002 | W66: 7.0999999999999994e-002 | X66: 5.0999999999999997e-002 | Y66: 24 | Z66: 1.63 | AA66: 5.8899999999999994e-002 | AB66: 4.9200000000000001e-002 | AC66: 3.5400000000000001e-002 | AD66: 3.1600000000000003e-002 | AE66: 88.75 | AF66: 90.69 | AG66: 0.27 | AH66: A+ | AI66: 7.5700000000000003e-002 | AJ66: =H66+100*O66 -> 130.40000000000001 | AK66: 120.9 | AL66: 175 | AM66: 30.2 | AN66: 184 | AO66: -5.0999999999999997e-002 | AP66: 58 | AQ66: 今飞转债!
A67: 222 | B67: 128072 | C67: 翔鹭转债! | D67: 2842 | E67: 翔鹭钨业 | F67: 有色金属 | G67: 小金属 | H67: 89.273 | I67: 1.2999999999999999e-003 | J67: -5.6999999999999993e-003 | K67: 8.04 | L67: -5.74e-002 | M67: 115.1 | N67: 15.34 | O67: 0.70299999999999996 | P67: 52.41 | Q67: 转股中 | R67: 4.54年 | S67: 2.54年 | T67: 3.02 | U67: 1.8 | V67: 6.9999999999999993e-003 | W67: 0.13699999999999998 | X67: 7.2000000000000008e-002 | Y67: 22 | Z67: 2.42 | AA67: 5.8899999999999994e-002 | AB67: 5.2300000000000006e-002 | AC67: 5.6600000000000004e-002 | AD67: 5.3800000000000001e-002 | AE67: 87.46 | AF67: 87.12 | AG67: 0.08 | AH67: AA- | AI67: 6.4699999999999994e-002 | AJ67: =H67+100*O67 -> 159.57299999999998 | AK67: 126.1 | AL67: 207 | AM67: 38.7 | AN67: 235 | AO67: -0.106 | AP67: 28 | AQ67: 翔鹭转债!
A68: 142 | B68: 113573 | C68: 纵横转债! | D68: 603602 | E68: 纵横通信 | F68: 通信互联 | G68: 通信设备 | H68: 93.53 | I68: -8.1000000000000013e-003 | J68: 7.3000000000000001e-003 | K68: 9.93 | L68: -8.0000000000000002e-003 | M68: 124.7 | N68: 18.81 | O68: 0.77200000000000002 | P68: 52.79 | Q68: 转股中 | R68: 5.20年 | S68: 3.20年 | T68: 2.7 | U68: 2.8 | V68: 1.1000000000000001e-002 | W68: 0.13300000000000001 | X68: 7.0000000000000007e-002 | Y68: 20 | Z68: 3 | AA68: 5.8400000000000001e-002 | AB68: 4.9800000000000004e-002 | AC68: 3.44e-002 | AD68: 3.15e-002 | AE68: 81.81 | AF68: 85.65 | AG68: 0.1 | AH68: A+ | AI68: 7.6999999999999999e-002 | AJ68: =H68+100*O68 -> 170.73000000000002 | AK68: 134.3 | AL68: 257 | AM68: 48.6 | AN68: 278 | AO68: -0.106 | AP68: 21 | AQ68: 纵横转债!
A69: 260 | B69: 110052 | C69: 贵广转债! | D69: 600996 | E69: 贵广网络 | F69: 传媒娱乐 | G69: 影视娱乐 | H69: 94.68 | I69: -3.4000000000000002e-003 | J69: 2.8999999999999998e-003 | K69: 4.52 | L69: -1.09e-002 | M69: 118.5 | N69: 7.94 | O69: 0.66299999999999992 | P69: 56.93 | Q69: 转股中 | R69: 4年28天 | S69: 2年28天 | T69: 15.3 | U69: 3.1 | V69: 2.e-003 | W69: 0.32100000000000001 | X69: 0.183 | Y69: 48 | Z69: 1.05 | AA69: 5.8099999999999999e-002 | AB69: 4.9400000000000006e-002 | AC69: 4.2599999999999999e-002 | AD69: 3.9e-002 | AE69: 94.86 | AF69: 100.73 | AG69: 0.04 | AH69: AA+ | AI69: 4.1700000000000001e-002 | AJ69: =H69+100*O69 -> 160.98000000000002 | AK69: 132.4 | AL69: 248 | AM69: 31.7 | AN69: 197 | AO69: -0.10199999999999999 | AP69: 19 | AQ69: 贵广转债!
A70: 309 | B70: 128033 | C70: 迪龙转债! | D70: 2658 | E70: 雪迪龙 | F70: 城市公用 | G70: 三废处理 | H70: 92.7 | I70: -1.9299999999999998e-002 | J70: 1.9299999999999998e-002 | K70: 4.79 | L70: -6.1999999999999998e-003 | M70: 108.8 | N70: 8.83 | O70: 0.70900000000000007 | P70: 54.25 | Q70: 转股中 | R70: 2.89年 | S70: 0.89年 | T70: 5.2 | U70: 6.4 | V70: 1.3000000000000001e-002 | W70: 0.17899999999999999 | X70: 9.6999999999999989e-002 | Y70: 29 | Z70: 1.43 | AA70: 5.7800000000000004e-002 | AB70: 5.16e-002 | AC70: 9.0299999999999991e-002 | AD70: 8.7100000000000011e-002 | AE70: 97.23 | AF70: 96.73 | AG70: 0.01 | AH70: AA | AI70: 4.2099999999999999e-002 | AJ70: =H70+100*O70 -> 163.60000000000002 | AK70: 131.2 | AL70: 238 | AM70: 33.9 | AN70: 208 | AO70: -0.111 | AP70: 38 | AQ70: 迪龙转债!
A71: 332 | B71: 128014 | C71: 永东转债! | D71: 2753 | E71: 永东股份 | F71: 化工 | G71: 化工 | H71: 98.72 | I71: -9.5999999999999992e-003 | J71: 9.5999999999999992e-003 | K71: 7.31 | L71: -1.4800000000000001e-002 | M71: 111.3 | N71: 12.6 | O71: 0.70200000000000007 | P71: 58.02 | Q71: 转股中 | R71: 2.20年 | S71: 0.20年 | T71: 3.37 | U71: 9.2 | V71: 2.7999999999999997e-002 | W71: 0.12300000000000001 | X71: 7.0999999999999994e-002 | Y71: 27 | Z71: 1.56 | AA71: 5.74e-002 | AB71: 4.7199999999999999e-002 | AC71: 8.9399999999999993e-002 | AD71: 7.8600000000000003e-002 | AE71: 99.59 | AF71: 97.58 | AG71: 0 | AH71: AA- | AI71: 6.3099999999999989e-002 | AJ71: =H71+100*O71 -> 168.92000000000002 | AK71: 139.4 | AL71: 280 | AM71: 39.8 | AN71: 240 | AO71: -0.11800000000000001 | AP71: 40 | AQ71: 永东转债!
A72: 59 | B72: 113604 | C72: 多伦转债! | D72: 603528 | E72: 多伦科技 | F72: 计算机及 | G72: 软件开发 | H72: 85.96 | I72: -4.4600000000000001e-002 | J72: 3.6000000000000004e-002 | K72: 6.86 | L72: -2.8300000000000002e-002 | M72: 117.3 | N72: 10.44 | O72: 0.308 | P72: 65.71 | Q72: 2月13天 | R72: 5.69年 | S72: 3.69年 | T72: 6.4 | U72: 11 | V72: 1.9e-002 | W72: 0.14899999999999999 | X72: 9.8000000000000004e-002 | Y72: 43 | Z72: 2.66 | AA72: 5.7300000000000004e-002 | AB72: 5.1500000000000004e-002 | AC72: 5.0700000000000002e-002 | AD72: 4.8600000000000004e-002 | AE72: 81.35 | AF72: 82.15 | AG72: 0.3 | AH72: AA- | AI72: 6.6000000000000003e-002 | AJ72: =H72+100*O72 -> 116.75999999999999 | AK72: 106.2 | AL72: 47 | AM72: 24.1 | AN72: 125 | AO72: -0.14000000000000001 | AP72: 4 | AQ72: 多伦转债!
A73: 316 | B73: 123004 | C73: 铁汉转债! | D73: 300197 | E73: 铁汉生态 | F73: 城市公用 | G73: 生态环境 | H73: 93 | I73: -1.54e-002 | J73: 1.3500000000000002e-002 | K73: 2.82 | L73: -2.0799999999999999e-002 | M73: 108.8 | N73: 3.98 | O73: 0.313 | P73: 70.85 | Q73: 转股中 | R73: 2.87年 | S73: 0.87年 | T73: 8.03 | U73: 9.9 | V73: 1.3000000000000001e-002 | W73: 0.10099999999999999 | X73: 7.0999999999999994e-002 | Y73: 80 | Z73: 1.28 | AA73: 5.7099999999999998e-002 | AB73: 5.0900000000000001e-002 | AC73: 8.9099999999999999e-002 | AD73: 8.5900000000000004e-002 | AE73: 97.33 | AF73: 96.83 | AG73: 0.09 | AH73: AA | AI73: 4.2099999999999999e-002 | AJ73: =H73+100*O73 -> 124.3 | AK73: 115.1 | AL73: 127 | AM73: 17.8 | AN73: 70 | AO73: -4.0999999999999995e-002 | AP73: 45 | AQ73: 铁汉转债!
A74: 76 | B74: 110074 | C74: 精达转债! | D74: 600577 | E74: 精达股份 | F74: 电子 | G74: 电子产品 | H74: 86.84 | I74: -1.9900000000000001e-002 | J74: 1.7899999999999999e-002 | K74: 2.7 | L74: -7.4000000000000003e-003 | M74: 117.3 | N74: 3.75 | O74: 0.20600000000000002 | P74: 72 | Q74: 20天 | R74: 5.54年 | S74: 3.54年 | T74: 7.87 | U74: 18 | V74: 2.5000000000000001e-002 | W74: 0.152 | X74: 0.109 | Y74: 52 | Z74: 1.47 | AA74: 5.7000000000000002e-002 | AB74: 5.0999999999999997e-002 | AC74: 4.99e-002 | AD74: 4.7699999999999992e-002 | AE74: 88.34 | AF74: 92.38 | AG74: 0.27 | AH74: AA | AI74: 4.4999999999999998e-002 | AJ74: =H74+100*O74 -> 107.44 | AK74: 101.7 | AL74: 24 | AM74: 9.3 | AN74: 21 | AO74: -8.3000000000000004e-002 | AP74: 9 | AQ74: 精达转债!
A75: 73 | B75: 113601 | C75: 塞力转债 | D75: 603716 | E75: 塞力医疗 | F75: 医药 | G75: 医药商业 | H75: 89.99 | I75: -3.8e-003 | J75: 1.5600000000000001e-002 | K75: 14.15 | L75: 2.3900000000000001e-002 | M75: 121.3 | N75: 16.98 | O75: 8.0000000000000002e-002 | P75: 83.33 | Q75: 22天 | R75: 5.54年 | S75: 3.54年 | T75: 5.43 | U75: 11 | V75: 2.3e-002 | W75: 0.187 | X75: 0.156 | Y75: 29 | Z75: 1.91 | AA75: 5.67e-002 | AB75: 4.9500000000000002e-002 | AC75: 4.0899999999999999e-002 | AD75: 3.85e-002 | AE75: 82.48 | AF75: 85.82 | AG75: 0.5 | AH75: AA- | AI75: 6.6000000000000003e-002 | AJ75: =H75+100*O75 -> 97.989999999999995 | AK75: 96.6 | AL75: 9 | AM75: 10.8 | AN75: 27 | AO75: -5.4000000000000006e-002 | AP75: 30 | AQ75: 塞力转债
A76: 252 | B76: 123024 | C76: 岱勒转债! | D76: 300700 | E76: 岱勒新材 | F76: 机械装备 | G76: 专用设备 | H76: 95.421 | I76: -6.0000000000000001e-003 | J76: 4.3e-003 | K76: 15.24 | L76: -4.5999999999999999e-003 | M76: 113 | N76: 18.33 | O76: 0.14800000000000002 | P76: 83.14 | Q76: 转股中 | R76: 3年44天 | S76: 1年44天 | T76: 2.1 | U76: 9.6 | V76: 4.7e-002 | W76: 0.16699999999999998 | X76: 0.13900000000000001 | Y76: 13 | Z76: 2.54 | AA76: 5.6500000000000002e-002 | AB76: 4.8399999999999999e-002 | AC76: 5.1500000000000004e-002 | AD76: 4.8600000000000004e-002 | AE76: 92.68 | AF76: 90.28 | AG76: 0.37 | AH76: A+ | AI76: 7.5700000000000003e-002 | AJ76: =H76+100*O76 -> 110.221 | AK76: 107.7 | AL76: 61 | AM76: 15 | AN76: 54 | AO76: -9.6999999999999989e-002 | AP76: 35 | AQ76: 岱勒转债!
A77: 7 | B77: 123089 | C77: 九洲转2! | D77: 300040 | E77: 九洲集团 | F77: 能源电力 | G77: 电力设备 | H77: 88.2 | I77: 1.7000000000000001e-003 | J77: 1.6000000000000001e-003 | K77: 5.85 | L77: 8.6e-003 | M77: 121 | N77: 8 | O77: 0.20600000000000002 | P77: 73.12 | Q77: 4月20天 | R77: 5.88年 | S77: 3.88年 | T77: 5 | U77: 12 | V77: 2.7000000000000003e-002 | W77: 0.22500000000000001 | X77: 0.16399999999999998 | Y77: 22 | Z77: 1.02 | AA77: 5.6399999999999999e-002 | AB77: 4.9800000000000004e-002 | AC77: 4.1799999999999997e-002 | AD77: 3.9800000000000002e-002 | AE77: 80.46 | AF77: 83.73 | AG77: 0.39 | AH77: AA- | AI77: 6.6000000000000003e-002 | AJ77: =H77+100*O77 -> 108.80000000000001 | AK77: 103.3 | AL77: 31 | AM77: 19.5 | AN77: 75 | AO77: -0.106 | AP77: 5 | AQ77: 九洲转2!
A78: 141 | B78: 113578 | C78: 全筑转债! | D78: 603030 | E78: 全筑股份 | F78: 建筑 | G78: 装饰工程 | H78: 89.49 | I78: -3.8e-003 | J78: 1.03e-002 | K78: 4.09 | L78: 2.2499999999999999e-002 | M78: 118.3 | N78: 5.43 | O78: 0.188 | P78: 75.32 | Q78: 转股中 | R78: 5.20年 | S78: 3.20年 | T78: 3.84 | U78: 19 | V78: 5.5e-002 | W78: 0.17399999999999999 | X78: 0.13100000000000001 | Y78: 22 | Z78: 0.99 | AA78: 5.6299999999999996e-002 | AB78: 4.9599999999999998e-002 | AC78: 4.5499999999999999e-002 | AD78: 4.3099999999999999e-002 | AE78: 89.64 | AF78: 94.53 | AG78: 0.29 | AH78: AA | AI78: 4.4999999999999998e-002 | AJ78: =H78+100*O78 -> 108.28999999999999 | AK78: 103.7 | AL78: 34 | AM78: 9.1 | AN78: 20 | AO78: -5.7999999999999996e-002 | AP78: 16 | AQ78: 全筑转债!
A79: 228 | B79: 128070 | C79: 智能转债! | D79: 2877 | E79: 智能自控 | F79: 机械装备 | G79: 通用设备 | H79: 93 | I79: -3.1300000000000001e-002 | J79: 3.0499999999999999e-002 | K79: 6.16 | L79: -3.2000000000000002e-003 | M79: 117.6 | N79: 9.51 | O79: 0.436 | P79: 64.77 | Q79: 转股中 | R79: 4.40年 | S79: 无权 | T79: 2.3 | U79: 35 | V79: 0.161 | W79: 0.11199999999999999 | X79: 7.2999999999999995e-002 | Y79: 20 | Z79: 2.87 | AA79: 5.62e-002 | AB79: 4.8499999999999995e-002 | AC79: 无权 | AD79: 无权 | AE79: 无权 | AF79: 85.97 | AG79: 0.23 | AH79: A+ | AI79: 7.5700000000000003e-002 | AJ79: =H79+100*O79 -> 136.59999999999999 | AK79: 121.2 | AL79: 177 | AM79: 35.3 | AN79: 214 | AO79: -9.5000000000000001e-002 | AP79: 32 | AQ79: 智能转债!
A80: 110 | B80: 128117 | C80: 道恩转债 | D80: 2838 | E80: 道恩股份 | F80: 化工 | G80: 橡胶塑料 | H80: 92.5 | I80: -4.07e-002 | J80: 2.7200000000000002e-002 | K80: 22.16 | L80: -3.61e-002 | M80: 123.5 | N80: 29.03 | O80: 0.21199999999999999 | P80: 76.33 | Q80: 转股中 | R80: 5.40年 | S80: 3.40年 | T80: 3.6 | U80: 32 | V80: 9.5000000000000001e-002 | W80: 4.0000000000000001e-002 | X80: 2.9999999999999999e-002 | Y80: 90 | Z80: 5.24 | AA80: 5.6100000000000004e-002 | AB80: 4.82e-002 | AC80: 3.3300000000000003e-002 | AD80: 3.1e-002 | AE80: 82.86 | AF80: 88.04 | AG80: 0.37 | AH80: AA- | AI80: 6.6000000000000003e-002 | AJ80: =H80+100*O80 -> 113.7 | AK80: 108.7 | AL80: 71 | AM80: 20.6 | AN80: 87 | AO80: -0.158 | AP80: 18 | AQ80: 道恩转债
A81: 2 | B81: 128143 | C81: 锋龙转债 | D81: 2931 | E81: 锋龙股份 | F81: 机械装备 | G81: 专用设备 | H81: 89 | I81: -3.3599999999999998e-002 | J81: 1.32e-002 | K81: 13.62 | L81: -4.1500000000000002e-002 | M81: 121.7 | N81: 17.97 | O81: 0.17399999999999999 | P81: 75.79 | Q81: 5月9天 | R81: 5.92年 | S81: 3.92年 | T81: 2.45 | U81: 55 | V81: 0.24299999999999999 | W81: 0.126 | X81: 9.6000000000000002e-002 | Y81: 19 | Z81: 3.36 | AA81: 5.5500000000000001e-002 | AB81: 4.87e-002 | AC81: 4.0800000000000003e-002 | AD81: 3.8399999999999997e-002 | AE81: 77.51 | AF81: 79.21 | AG81: 0.49 | AH81: A+ | AI81: 7.6999999999999999e-002 | AJ81: =H81+100*O81 -> 106.40000000000001 | AK81: 102.2 | AL81: 26 | AM81: 23 | AN81: 119 | AO81: -0.107 | AP81: 3 | AQ81: 锋龙转债
A82: 171 | B82: 113567 | C82: 君禾转债! | D82: 603617 | E82: 君禾股份 | F82: 机械装备 | G82: 通用设备 | H82: 91.6 | I82: -4.58e-002 | J82: 3.95e-002 | K82: 9.15 | L82: -1.29e-002 | M82: 119.3 | N82: 11.46 | O82: 0.14699999999999999 | P82: 79.84 | Q82: 转股中 | R82: 5年27天 | S82: 3年27天 | T82: 2.1 | U82: 13 | V82: 6.5000000000000002e-002 | W82: 0.115 | X82: 9.1999999999999998e-002 | Y82: 18 | Z82: 2.83 | AA82: 5.4900000000000004e-002 | AB82: 4.7699999999999992e-002 | AC82: 4.2000000000000003e-002 | AD82: 3.9100000000000003e-002 | AE82: 82.44 | AF82: 82.7 | AG82: 0.49 | AH82: A+ | AI82: 7.6999999999999999e-002 | AJ82: =H82+100*O82 -> 106.3 | AK82: 103.4 | AL82: 32 | AM82: 20.7 | AN82: 89 | AO82: -4.4000000000000004e-002 | AP82: 36 | AQ82: 君禾转债!
A83: 81 | B83: 113599 | C83: 嘉友转债! | D83: 603871 | E83: 嘉友国际 | F83: 交通运输 | G83: 物流业 | H83: 94.48 | I83: 1.8100000000000002e-002 | J83: 2.7300000000000001e-002 | K83: 20.81 | L83: 9.9900000000000003e-002 | M83: 126 | N83: 24.82 | O83: 0.127 | P83: 83.84 | Q83: 13天 | R83: 5.50年 | S83: 3.50年 | T83: 7.2 | U83: 121 | V83: 0.17499999999999999 | W83: 0.158 | X83: 0.13200000000000001 | Y83: 46 | Z83: 2.29 | AA83: 5.4900000000000004e-002 | AB83: 4.6500000000000007e-002 | AC83: 2.6600000000000002e-002 | AD83: 2.4399999999999998e-002 | AE83: 82.43 | AF83: 89.3 | AG83: 0.45 | AH83: AA- | AI83: 6.6000000000000003e-002 | AJ83: =H83+100*O83 -> 107.18000000000001 | AK83: 105.1 | AL83: 39 | AM83: 15.8 | AN83: 61 | AO83: 5.2999999999999999e-002 | AP83: 16 | AQ83: 嘉友转债!
A84: 35 | B84: 128138 | C84: 侨银转债! | D84: 2973 | E84: 侨银股份 | F84: 城市公用 | G84: 城市公用 | H84: 100.82 | I84: -1.4499999999999999e-002 | J84: 4.6999999999999993e-003 | K84: 20.7 | L84: -2.7300000000000001e-002 | M84: 136.5 | N84: 25.43 | O84: 0.23899999999999999 | P84: 81.4 | Q84: 3月18天 | R84: 5.78年 | S84: 3.78年 | T84: 4.2 | U84: 2.8 | V84: 6.0000000000000001e-003 | W84: 5.0000000000000003e-002 | X84: 4.0000000000000001e-002 | Y84: 85 | Z84: 6.34 | AA84: 5.4900000000000004e-002 | AB84: 4.4500000000000005e-002 | AC84: 9.0000000000000011e-003 | AD84: 6.8000000000000005e-003 | AE84: 81.33 | AF84: 94.99 | AG84: 0.36 | AH84: AA- | AI84: 6.6000000000000003e-002 | AJ84: =H84+100*O84 -> 124.72 | AK84: 120.2 | AL84: 170 | AM84: 25.2 | AN84: 136 | AO84: -3.7000000000000005e-002 | AP84: 5 | AQ84: 侨银转债!
A85: 100 | B85: 128120 | C85: 联诚转债! | D85: 2921 | E85: 联诚精密 | F85: 汽车 | G85: 零部件制 | H85: 89.167 | I85: -8.0000000000000002e-003 | J85: 4.0000000000000001e-003 | K85: 16.85 | L85: -1.e-002 | M85: 118.4 | N85: 24.37 | O85: 0.28999999999999998 | P85: 69.14 | Q85: 转股中 | R85: 5.45年 | S85: 3.45年 | T85: 2.6 | U85: 1.5 | V85: 6.0000000000000001e-003 | W85: 0.18899999999999997 | X85: 0.13100000000000001 | Y85: 14 | Z85: 1.84 | AA85: 5.4800000000000001e-002 | AB85: 4.8300000000000003e-002 | AC85: 4.5700000000000005e-002 | AD85: 4.2999999999999997e-002 | AE85: 77.68 | AF85: 76.05 | AG85: 0.4 | AH85: A | AI85: 8.6999999999999994e-002 | AJ85: =H85+100*O85 -> 118.167 | AK85: 109.2 | AL85: 75 | AM85: 31.5 | AN85: 195 | AO85: -8.6999999999999994e-002 | AP85: 18 | AQ85: 联诚转债!
A86: 145 | B86: 123049 | C86: 维尔转债 | D86: 300190 | E86: 维尔利 | F86: 城市公用 | G86: 三废处理 | H86: 95.334 | I86: -1.7000000000000001e-003 | J86: 1.3999999999999999e-002 | K86: 6.46 | L86: 2.5399999999999999e-002 | M86: 124.8 | N86: 7.48 | O86: 0.10400000000000001 | P86: 86.36 | Q86: 转股中 | R86: 5.18年 | S86: 3.18年 | T86: 9.17 | U86: 16 | V86: 1.9e-002 | W86: 0.182 | X86: 0.157 | Y86: 50 | Z86: 1.2 | AA86: 5.4699999999999999e-002 | AB86: 4.6100000000000002e-002 | AC86: 2.8799999999999999e-002 | AD86: 2.5899999999999999e-002 | AE86: 84.79 | AF86: 90.37 | AG86: 0.48 | AH86: AA- | AI86: 6.6000000000000003e-002 | AJ86: =H86+100*O86 -> 105.73400000000001 | AK86: 104.3 | AL86: 35 | AM86: 13.9 | AN86: 45 | AO86: -6.0999999999999999e-002 | AP86: 15 | AQ86: 维尔转债
A87: 159 | B87: 123047 | C87: 久吾转债 | D87: 300631 | E87: 久吾高科 | F87: 机械装备 | G87: 专用设备 | H87: 100.177 | I87: -1.3999999999999999e-002 | J87: 8.9999999999999998e-004 | K87: 14.77 | L87: -2.8300000000000002e-002 | M87: 130.1 | N87: 17.61 | O87: 0.19399999999999998 | P87: 83.87 | Q87: 转股中 | R87: 5年43天 | S87: 3年43天 | T87: 1.99 | U87: 9.3 | V87: 4.7e-002 | W87: 0.124 | X87: 0.10400000000000001 | Y87: 16 | Z87: 2.21 | AA87: 5.4100000000000002e-002 | AB87: 4.3799999999999999e-002 | AC87: 1.7899999999999999e-002 | AD87: 1.4199999999999999e-002 | AE87: 83.47 | AF87: 90.05 | AG87: 0.46 | AH87: A+ | AI87: 7.6999999999999999e-002 | AJ87: =H87+100*O87 -> 119.577 | AK87: 116.5 | AL87: 138 | AM87: 26.4 | AN87: 149 | AO87: -7.4999999999999997e-002 | AP87: 23 | AQ87: 久吾转债
A88: 17 | B88: 127027 | C88: 靖远转债 | D88: 552 | E88: 靖远煤电 | F88: 煤炭 | G88: 煤炭开采 | H88: 85.55 | I88: -1.3899999999999999e-002 | J88: 3.4999999999999996e-003 | K88: 2.5 | L88: -3.1e-002 | M88: 115.3 | N88: 3.33 | O88: 0.14000000000000001 | P88: 75.08 | Q88: 4月11天 | R88: 5.85年 | S88: 3.85年 | T88: 28 | U88: 92 | V88: 3.7999999999999999e-002 | W88: 0.48999999999999999 | X88: 0.36799999999999999 | Y88: 57 | Z88: 0.72 | AA88: 5.3399999999999996e-002 | AB88: 4.8300000000000003e-002 | AC88: 4.99e-002 | AD88: 4.7800000000000002e-002 | AE88: 87.81 | AF88: 90.57 | AG88: 0.34 | AH88: AA+ | AI88: 4.2999999999999997e-002 | AJ88: =H88+100*O88 -> 99.549999999999997 | AK88: 96 | AL88: 7 | AM88: 5.5 | AN88: 9 | AO88: -0.10800000000000001 | AP88: 10 | AQ88: 靖远转债
A89: 192 | B89: 110064 | C89: 建工转债! | D89: 600939 | E89: 重庆建工 | F89: 建筑 | G89: 建筑工程 | H89: 93.6 | I89: -3.2000000000000002e-003 | J89: 3.2000000000000002e-003 | K89: 3.24 | L89: 0. | M89: 119.8 | N89: 4.57 | O89: 0.32000000000000001 | P89: 70.9 | Q89: 转股中 | R89: 4.87年 | S89: 2.87年 | T89: 16.6 | U89: 13 | V89: 8.0000000000000002e-003 | W89: 0.28199999999999997 | X89: 0.20000000000000001 | Y89: 59 | Z89: 0.85 | AA89: 5.3200000000000004e-002 | AB89: 4.5599999999999995e-002 | AC89: 3.61e-002 | AD89: 3.3300000000000003e-002 | AE89: 92.08 | AF89: 98.61 | AG89: 0.19 | AH89: AA+ | AI89: 4.1700000000000001e-002 | AJ89: =H89+100*O89 -> 125.59999999999999 | AK89: 116.3 | AL89: 137 | AM89: 17.7 | AN89: 68 | AO89: -7.2000000000000008e-002 | AP89: 48 | AQ89: 建工转债!
A90: 201 | B90: 128081 | C90: 海亮转债! | D90: 2203 | E90: 海亮股份 | F90: 有色金属 | G90: 铜金属 | H90: 90.212 | I90: -1.78e-002 | J90: 1.5900000000000001e-002 | K90: 8.1 | L90: -4.8999999999999998e-003 | M90: 114.9 | N90: 9.76 | O90: 8.6999999999999994e-002 | P90: 82.99 | Q90: 转股中 | R90: 4.79年 | S90: 2.79年 | T90: 31.5 | U90: 70 | V90: 2.4e-002 | W90: 0.19899999999999998 | X90: 0.16500000000000001 | Y90: 158 | Z90: 1.75 | AA90: 5.28e-002 | AB90: 4.6799999999999994e-002 | AC90: 4.7599999999999996e-002 | AD90: 4.5199999999999997e-002 | AE90: 91.22 | AF90: 93.97 | AG90: 0.38 | AH90: AA | AI90: 4.3700000000000003e-002 | AJ90: =H90+100*O90 -> 98.912000000000006 | AK90: 97.4 | AL90: 11 | AM90: 3.5 | AN90: 6 | AO90: 2.5000000000000001e-002 | AP90: 50 | AQ90: 海亮转债!
A91: 112 | B91: 113591 | C91: 胜达转债! | D91: 603687 | E91: 大胜达 | F91: 造纸包装 | G91: 包装用纸 | H91: 93.14 | I91: -1.95e-002 | J91: -2.0099999999999996e-002 | K91: 8.37 | L91: -9.1199999999999989e-002 | M91: 122.2 | N91: 10.46 | O91: 0.16399999999999998 | P91: 80.02 | Q91: 转股中 | R91: 5.40年 | S91: 3.40年 | T91: 5.5 | U91: 14 | V91: 2.7999999999999997e-002 | W91: 0.16 | X91: 0.128 | Y91: 34 | Z91: 2.21 | AA91: 5.28e-002 | AB91: 4.5199999999999997e-002 | AC91: 3.2099999999999997e-002 | AD91: 2.9700000000000001e-002 | AE91: 83.13 | AF91: 87.21 | AG91: 0.43 | AH91: AA- | AI91: 6.6000000000000003e-002 | AJ91: =H91+100*O91 -> 109.53999999999999 | AK91: 106.3 | AL91: 48 | AM91: 19.1 | AN91: 72 | AO91: -8.900000000000001e-002 | AP91: 21 | AQ91: 胜达转债!
A92: 56 | B92: 123069 | C92: 金诺转债! | D92: 300505 | E92: 川金诺 | F92: 化工 | G92: 农化 | H92: 94.507 | I92: 1.e-004 | J92: 5.5000000000000005e-003 | K92: 16.58 | L92: 1.1000000000000001e-002 | M92: 126 | N92: 19.15 | O92: 9.1999999999999998e-002 | P92: 86.58 | Q92: 2月16天 | R92: 5.69年 | S92: 3.69年 | T92: 3.68 | U92: 20 | V92: 5.7000000000000002e-002 | W92: 0.17000000000000001 | X92: 0.14699999999999999 | Y92: 22 | Z92: 2.26 | AA92: 5.28e-002 | AB92: 4.4800000000000006e-002 | AC92: 2.5099999999999997e-002 | AD92: 2.3099999999999999e-002 | AE92: 81.4 | AF92: 88.18 | AG92: 0.51 | AH92: AA- | AI92: 6.6000000000000003e-002 | AJ92: =H92+100*O92 -> 103.70700000000001 | AK92: 102.4 | AL92: 27 | AM92: 14.3 | AN92: 47 | AO92: 5.9999999999999998e-002 | AP92: 13 | AQ92: 金诺转债!
A93: 203 | B93: 113549 | C93: 白电转债 | D93: 603861 | E93: 白云电器 | F93: 能源电力 | G93: 电力设备 | H93: 90.42 | I93: -9.1000000000000004e-003 | J93: 1.9900000000000001e-002 | K93: 7.49 | L93: 2.7400000000000001e-002 | M93: 114.8 | N93: 8.88 | O93: 7.2000000000000008e-002 | P93: 84.35 | Q93: 转股中 | R93: 4.78年 | S93: 2.78年 | T93: 8.8 | U93: 14 | V93: 1.7000000000000001e-002 | W93: 0.26600000000000001 | X93: 0.22399999999999998 | Y93: 33 | Z93: 1.41 | AA93: 5.2300000000000006e-002 | AB93: 4.6199999999999998e-002 | AC93: 4.6699999999999998e-002 | AD93: 4.4299999999999999e-002 | AE93: 91.18 | AF93: 93.94 | AG93: 0.4 | AH93: AA | AI93: 4.3700000000000003e-002 | AJ93: =H93+100*O93 -> 97.620000000000005 | AK93: 96.5 | AL93: 8 | AM93: 2.6 | AN93: 5 | AO93: -1.e-002 | AP93: 33 | AQ93: 白电转债
A94: 167 | B94: 113570 | C94: 百达转债 | D94: 603331 | E94: 百达精工 | F94: 机械装备 | G94: 机械装备 | H94: 89.58 | I94: -1.0700000000000001e-002 | J94: -1.e-004 | K94: 8.33 | L94: -2.7999999999999997e-002 | M94: 115.3 | N94: 11.54 | O94: 0.24100000000000002 | P94: 72.18 | Q94: 转股中 | R94: 5年34天 | S94: 3年34天 | T94: 2.8 | U94: 1.9 | V94: 6.9999999999999993e-003 | W94: 0.188 | X94: 0.13600000000000001 | Y94: 15 | Z94: 1.92 | AA94: 5.2000000000000005e-002 | AB94: 4.6100000000000002e-002 | AC94: 4.6799999999999994e-002 | AD94: 4.4299999999999999e-002 | AE94: 81.74 | AF94: 79.7 | AG94: 0.39 | AH94: A+ | AI94: 7.6999999999999999e-002 | AJ94: =H94+100*O94 -> 113.68000000000001 | AK94: 107 | AL94: 53 | AM94: 25.2 | AN94: 135 | AO94: -0.14699999999999999 | AP94: 35 | AQ94: 百达转债
A95: 51 | B95: 123071 | C95: 天能转债! | D95: 300569 | E95: 天能重工 | F95: 能源电力 | G95: 风能 | H95: 91.244 | I95: -1.38e-002 | J95: 1.0700000000000001e-002 | K95: 12.45 | L95: -1.43e-002 | M95: 121.1 | N95: 20.05 | O95: 0.46899999999999997 | P95: 62.09 | Q95: 2月21天 | R95: 5.71年 | S95: 3.71年 | T95: 7 | U95: 10 | V95: 1.6e-002 | W95: 0.14300000000000002 | X95: 8.900000000000001e-002 | Y95: 49 | Z95: 2.21 | AA95: 5.1900000000000002e-002 | AB95: 4.5100000000000001e-002 | AC95: 3.4700000000000002e-002 | AD95: 3.2599999999999997e-002 | AE95: 81.4 | AF95: 84.71 | AG95: 0.22 | AH95: AA- | AI95: 6.6000000000000003e-002 | AJ95: =H95+100*O95 -> 138.14400000000001 | AK95: 120.4 | AL95: 173 | AM95: 35.7 | AN95: 216 | AO95: -0.10800000000000001 | AP95: 8 | AQ95: 天能转债!
A96: 65 | B96: 128132 | C96: 交建转债! | D96: 2941 | E96: 新疆交建 | F96: 建筑 | G96: 建筑工程 | H96: 89 | I96: 0. | J96: -4.0000000000000002e-004 | K96: 9.31 | L96: -7.4999999999999997e-003 | M96: 117.3 | N96: 18.57 | O96: 0.77500000000000002 | P96: 50.13 | Q96: 45天 | R96: 5.61年 | S96: 3.61年 | T96: 8.5 | U96: 3.2 | V96: 4.0000000000000001e-003 | W96: 0.14199999999999999 | X96: 7.0999999999999994e-002 | Y96: 60 | Z96: 2.48 | AA96: 5.1500000000000004e-002 | AB96: 4.5599999999999995e-002 | AC96: 4.2000000000000003e-002 | AD96: 3.9900000000000005e-002 | AE96: 88.05 | AF96: 92.08 | AG96: 0.05 | AH96: AA | AI96: 4.4999999999999998e-002 | AJ96: =H96+100*O96 -> 166.5 | AK96: 127.9 | AL96: 214 | AM96: 35.8 | AN96: 218 | AO96: -0.124 | AP96: 13 | AQ96: 交建转债!
A97: 146 | B97: 110070 | C97: 凌钢转债! | D97: 600231 | E97: 凌钢股份 | F97: 钢铁 | G97: 炼钢 | H97: 91.43 | I97: 1.44e-002 | J97: -9.5999999999999992e-003 | K97: 2.18 | L97: 1.3999999999999999e-002 | M97: 117.8 | N97: 2.75 | O97: 0.153 | P97: 79.27 | Q97: 转股中 | R97: 5.18年 | S97: 3.18年 | T97: 2.89 | U97: 20 | V97: 7.4999999999999997e-002 | W97: 4.8000000000000001e-002 | X97: 3.7999999999999999e-002 | Y97: 60 | Z97: 0.75 | AA97: 5.1299999999999998e-002 | AB97: 4.4800000000000006e-002 | AC97: 4.0099999999999997e-002 | AD97: 3.7499999999999999e-002 | AE97: 90.02 | AF97: 94.25 | AG97: 0.35 | AH97: AA | AI97: 4.4999999999999998e-002 | AJ97: =H97+100*O97 -> 106.73 | AK97: 103.6 | AL97: 33 | AM97: 9.3 | AN97: 22 | AO97: -3.5000000000000003e-002 | AP97: 20 | AQ97: 凌钢转债!
A98: 16 | B98: 123084 | C98: 高澜转债! | D98: 300499 | E98: 高澜股份 | F98: 能源电力 | G98: 电力设备 | H98: 91.641 | I98: -1.1999999999999999e-003 | J98: -1.8500000000000003e-002 | K98: 8.56 | L98: -4.1399999999999999e-002 | M98: 121.9 | N98: 11.36 | O98: 0.21600000000000003 | P98: 75.35 | Q98: 4月11天 | R98: 5.85年 | S98: 3.85年 | T98: 2.8 | U98: 4.6 | V98: 1.8000000000000002e-002 | W98: 0.11800000000000001 | X98: 8.900000000000001e-002 | Y98: 24 | Z98: 3.05 | AA98: 5.1200000000000002e-002 | AB98: 4.4299999999999999e-002 | AC98: 3.4500000000000003e-002 | AD98: 3.2000000000000001e-002 | AE98: 78.12 | AF98: 79.83 | AG98: 0.48 | AH98: A+ | AI98: 7.6999999999999999e-002 | AJ98: =H98+100*O98 -> 113.24100000000001 | AK98: 107.9 | AL98: 65 | AM98: 28.1 | AN98: 167 | AO98: -6.7000000000000004e-002 | AP98: 5 | AQ98: 高澜转债!
A99: 108 | B99: 113036 | C99: 宁建转债! | D99: 601789 | E99: 宁波建工 | F99: 建筑 | G99: 建筑工程 | H99: 90.05 | I99: -3.1699999999999999e-002 | J99: 3.32e-002 | K99: 3.51 | L99: 5.6999999999999993e-003 | M99: 117.3 | N99: 4.86 | O99: 0.247 | P99: 72.22 | Q99: 转股中 | R99: 5.41年 | S99: 3.41年 | T99: 5.4 | U99: 15 | V99: 3.1e-002 | W99: 0.158 | X99: 0.114 | Y99: 34 | Z99: 1.15 | AA99: 5.1100000000000007e-002 | AB99: 4.4999999999999998e-002 | AC99: 4.0899999999999999e-002 | AD99: 3.8699999999999998e-002 | AE99: 88.81 | AF99: 92.87 | AG99: 0.26 | AH99: AA | AI99: 4.4999999999999998e-002 | AJ99: =H99+100*O99 -> 114.75 | AK99: 107.9 | AL99: 64 | AM99: 15 | AN99: 53 | AO99: -6.4000000000000001e-002 | AP99: 8 | AQ99: 宁建转债!
A100: 151 | B100: 128105 | C100: 长集转债 | D100: 2616 | E100: 长青集团 | F100: 城市公用 | G100: 三废处理 | H100: 89.7 | I100: -3.5499999999999997e-002 | J100: 2.7699999999999999e-002 | K100: 6.49 | L100: -2.1099999999999997e-002 | M100: 115.3 | N100: 8.11 | O100: 0.121 | P100: 80.02 | Q100: 转股中 | R100: 5.17年 | S100: 3.17年 | T100: 8 | U100: 29 | V100: 4.0000000000000001e-002 | W100: 0.16600000000000001 | X100: 0.13300000000000001 | Y100: 48 | Z100: 1.91 | AA100: 5.0900000000000001e-002 | AB100: 4.5100000000000001e-002 | AC100: 4.5199999999999997e-002 | AD100: 4.2800000000000005e-002 | AE100: 89.76 | AF100: 92.27 | AG100: 0.37 | AH100: AA | AI100: 4.4999999999999998e-002 | AJ100: =H100+100*O100 -> 101.8 | AK100: 99.4 | AL100: 15 | AM100: 7.1 | AN100: 12 | AO100: -7.8e-002 | AP100: 10 | AQ100: 长集转债
A101: 293 | B101: 127007 | C101: 湖广转债! | D101: 665 | E101: 湖北广电 | F101: 传媒娱乐 | G101: 影视娱乐 | H101: 95.392 | I101: -4.7999999999999996e-003 | J101: 4.3e-003 | K101: 3.58 | L101: -5.6000000000000008e-003 | M101: 112.3 | N101: 5.58 | O101: 0.48700000000000004 | P101: 64.16 | Q101: 转股中 | R101: 3.39年 | S101: 1.39年 | T101: 12.2 | U101: 6.2 | V101: 5.0000000000000001e-003 | W101: 0.34600000000000003 | X101: 0.222 | Y101: 35 | Z101: 0.54 | AA101: 5.04e-002 | AB101: 4.3200000000000002e-002 | AC101: 4.9599999999999998e-002 | AD101: 4.58e-002 | AE101: 96.51 | AF101: 98.05 | AG101: 0.09 | AH101: AA+ | AI101: 4.1700000000000001e-002 | AJ101: =H101+100*O101 -> 144.09199999999998 | AK101: 126.6 | AL101: 210 | AM101: 28.6 | AN101: 171 | AO101: -0.16600000000000001 | AP101: 19 | AQ101: 湖广转债!
A102: 111 | B102: 123057 | C102: 美联转债! | D102: 300586 | E102: 美联新材 | F102: 化工 | G102: 橡胶塑料 | H102: 91.2 | I102: -2.5899999999999999e-002 | J102: 1.52e-002 | K102: 7.25 | L102: -2.8199999999999999e-002 | M102: 118.2 | N102: 9.91 | O102: 0.247 | P102: 73.16 | Q102: 转股中 | R102: 5.40年 | S102: 3.40年 | T102: 2.07 | U102: 17 | V102: 8.9999999999999997e-002 | W102: 6.3e-002 | X102: 4.5999999999999999e-002 | Y102: 33 | Z102: 4.45 | AA102: 5.04e-002 | AB102: 4.4000000000000004e-002 | AC102: 3.8300000000000001e-002 | AD102: 3.5900000000000001e-002 | AE102: 83.12 | AF102: 84.37 | AG102: 0.38 | AH102: AA- | AI102: 6.6000000000000003e-002 | AJ102: =H102+100*O102 -> 115.90000000000001 | AK102: 109.2 | AL102: 76 | AM102: 24.9 | AN102: 130 | AO102: -9.8000000000000004e-002 | AP102: 13 | AQ102: 美联转债!
A103: 29 | B103: 128139 | C103: 祥鑫转债! | D103: 2965 | E103: 祥鑫科技 | F103: 汽车 | G103: 零部件制 | H103: 91.9 | I103: 6.1999999999999998e-003 | J103: 4.7999999999999996e-003 | K103: 29.6 | L103: 2.3900000000000001e-002 | M103: 121 | N103: 37.28 | O103: 0.157 | P103: 79.4 | Q103: 4月2天 | R103: 5.82年 | S103: 3.82年 | T103: 6.47 | U103: 13 | V103: 2.2000000000000002e-002 | W103: 0.14499999999999999 | X103: 0.115 | Y103: 45 | Z103: 2.63 | AA103: 4.9400000000000006e-002 | AB103: 4.2699999999999995e-002 | AC103: 3.1600000000000003e-002 | AD103: 2.9600000000000001e-002 | AE103: 80.74 | AF103: 84.03 | AG103: 0.46 | AH103: AA- | AI103: 6.6000000000000003e-002 | AJ103: =H103+100*O103 -> 107.60000000000001 | AK103: 104.4 | AL103: 36 | AM103: 20.4 | AN103: 83 | AO103: 1.6e-002 | AP103: 6 | AQ103: 祥鑫转债!
A104: 117 | B104: 123056 | C104: 雪榕转债 | D104: 300511 | E104: 雪榕生物 | F104: 农业 | G104: 种植业 | H104: 94 | I104: -1.7500000000000002e-002 | J104: 2.5999999999999999e-003 | K104: 9.35 | L104: -3.5099999999999999e-002 | M104: 121.1 | N104: 11.89 | O104: 0.19500000000000001 | P104: 78.64 | Q104: 转股中 | R104: 5.38年 | S104: 3.38年 | T104: 5.85 | U104: 24 | V104: 4.2999999999999997e-002 | W104: 0.14199999999999999 | X104: 0.111 | Y104: 41 | Z104: 2.16 | AA104: 4.9299999999999997e-002 | AB104: 4.2099999999999999e-002 | AC104: 2.9300000000000003e-002 | AD104: 2.69e-002 | AE104: 83.13 | AF104: 86.51 | AG104: 0.42 | AH104: AA- | AI104: 6.6000000000000003e-002 | AJ104: =H104+100*O104 -> 113.5 | AK104: 109.4 | AL104: 78 | AM104: 22.9 | AN104: 118 | AO104: -0.14699999999999999 | AP104: 13 | AQ104: 雪榕转债
A105: 184 | B105: 113561 | C105: 正裕转债! | D105: 603089 | E105: 正裕工业 | F105: 汽车 | G105: 零部件制 | H105: 93.89 | I105: -8.8000000000000005e-003 | J105: 3.7000000000000002e-003 | K105: 7.14 | L105: -1.52e-002 | M105: 118 | N105: 10.23 | O105: 0.34499999999999997 | P105: 69.79 | Q105: 转股中 | R105: 4.90年 | S105: 2.90年 | T105: 1.5 | U105: 2.2 | V105: 1.4999999999999999e-002 | W105: 9.4e-002 | X105: 6.6000000000000003e-002 | Y105: 16 | Z105: 1.71 | AA105: 4.8899999999999999e-002 | AB105: 4.1900000000000007e-002 | AC105: 3.4799999999999998e-002 | AD105: 3.2000000000000001e-002 | AE105: 83.48 | AF105: 83.21 | AG105: 0.33 | AH105: A+ | AI105: 7.5700000000000003e-002 | AJ105: =H105+100*O105 -> 128.38999999999999 | AK105: 118 | AL105: 153 | AM105: 34.5 | AN105: 209 | AO105: -0.11900000000000001 | AP105: 34 | AQ105: 正裕转债!
A106: 43 | B106: 123075 | C106: 贝斯转债! | D106: 300580 | E106: 贝斯特 | F106: 汽车 | G106: 零部件制 | H106: 88.3 | I106: -4.5400000000000003e-002 | J106: 3.0299999999999997e-002 | K106: 16.98 | L106: -3.85e-002 | M106: 115.5 | N106: 23.99 | O106: 0.248 | P106: 70.78 | Q106: 3月0天 | R106: 5.74年 | S106: 3.74年 | T106: 6 | U106: 64 | V106: 0.11900000000000001 | W106: 0.17699999999999999 | X106: 0.125 | Y106: 34 | Z106: 2.11 | AA106: 4.8899999999999999e-002 | AB106: 4.36e-002 | AC106: 4.2800000000000005e-002 | AD106: 4.07e-002 | AE106: 81.09 | AF106: 80.62 | AG106: 0.39 | AH106: AA- | AI106: 6.6000000000000003e-002 | AJ106: =H106+100*O106 -> 113.09999999999999 | AK106: 105.8 | AL106: 44 | AM106: 24.7 | AN106: 128 | AO106: -8.5999999999999993e-002 | AP106: 5 | AQ106: 贝斯转债!
A107: 86 | B107: 123063 | C107: 大禹转债 | D107: 300021 | E107: 大禹节水 | F107: 化工 | G107: 橡胶塑料 | H107: 98 | I107: -2.3999999999999998e-003 | J107: 4.7999999999999996e-003 | K107: 4.47 | L107: 4.5000000000000005e-003 | M107: 126.5 | N107: 4.94 | O107: 8.3000000000000004e-002 | P107: 90.49 | Q107: 转股中 | R107: 5.48年 | S107: 4.48年 | T107: 6.38 | U107: 8.3 | V107: 1.3000000000000001e-002 | W107: 0.17899999999999999 | X107: 0.16200000000000001 | Y107: 36 | Z107: 2.47 | AA107: 4.8799999999999996e-002 | AB107: 4.0300000000000002e-002 | AC107: 1.95e-002 | AD107: 1.6500000000000001e-002 | AE107: 79.97 | AF107: 89.84 | AG107: 0.54 | AH107: AA- | AI107: 6.6000000000000003e-002 | AJ107: =H107+100*O107 -> 106.3 | AK107: 105.5 | AL107: 41 | AM107: 15.7 | AN107: 59 | AO107: -7.8e-002 | AP107: 15 | AQ107: 大禹转债
A108: 246 | B108: 113532 | C108: 海环转债! | D108: 603817 | E108: 海峡环保 | F108: 城市公用 | G108: 三废处理 | H108: 93.1 | I108: -6.8000000000000005e-003 | J108: 5.8999999999999999e-003 | K108: 5.09 | L108: -5.8999999999999999e-003 | M108: 112.9 | N108: 7.69 | O108: 0.40700000000000003 | P108: 66.19 | Q108: 转股中 | R108: 4年56天 | S108: 2年56天 | T108: 4.6 | U108: 8 | V108: 1.9e-002 | W108: 0.20100000000000001 | X108: 0.13300000000000001 | Y108: 23 | Z108: 1.34 | AA108: 4.8600000000000004e-002 | AB108: 4.2500000000000003e-002 | AC108: 4.6799999999999994e-002 | AD108: 4.3700000000000003e-002 | AE108: 93.74 | AF108: 94.9 | AG108: 0.15 | AH108: AA | AI108: 4.3700000000000003e-002 | AJ108: =H108+100*O108 -> 133.80000000000001 | AK108: 120 | AL108: 167 | AM108: 25.1 | AN108: 133 | AO108: -8.6999999999999994e-002 | AP108: 26 | AQ108: 海环转债!
A109: 270 | B109: 113525 | C109: 台华转债! | D109: 603055 | E109: 台华新材 | F109: 服装纺织 | G109: 纺织行业 | H109: 95.5 | I109: 0. | J109: -1.4000000000000002e-003 | K109: 5.01 | L109: -1.38e-002 | M109: 114.3 | N109: 7.83 | O109: 0.49299999999999999 | P109: 63.98 | Q109: 转股中 | R109: 3.86年 | S109: 1.86年 | T109: 4.69 | U109: 11 | V109: 2.4e-002 | W109: 0.113 | X109: 7.2000000000000008e-002 | Y109: 42 | Z109: 1.46 | AA109: 4.8499999999999995e-002 | AB109: 4.1399999999999999e-002 | AC109: 3.7200000000000004e-002 | AD109: 3.44e-002 | AE109: 94.31 | AF109: 97.18 | AG109: 0.1 | AH109: AA | AI109: 4.3700000000000003e-002 | AJ109: =H109+100*O109 -> 144.80000000000001 | AK109: 127 | AL109: 212 | AM109: 29.8 | AN109: 181 | AO109: -5.7999999999999996e-002 | AP109: 22 | AQ109: 台华转债!
A110: 67 | B110: 123065 | C110: 宝莱转债! | D110: 300246 | E110: 宝莱特 | F110: 医药 | G110: 医疗器械 | H110: 93.8 | I110: -2.3e-002 | J110: 1.9e-002 | K110: 22.28 | L110: -2.75e-002 | M110: 121.4 | N110: 40.54 | O110: 0.70700000000000007 | P110: 54.96 | Q110: 34天 | R110: 5.58年 | S110: 3.58年 | T110: 2.19 | U110: 39 | V110: 0.185 | W110: 6.7000000000000004e-002 | X110: 3.7000000000000005e-002 | Y110: 33 | Z110: 3.91 | AA110: 4.8399999999999999e-002 | AB110: 4.1299999999999996e-002 | AC110: 2.9100000000000001e-002 | AD110: 2.6699999999999998e-002 | AE110: 82.33 | AF110: 85.66 | AG110: 0.14 | AH110: AA- | AI110: 6.6000000000000003e-002 | AJ110: =H110+100*O110 -> 164.5 | AK110: 132.6 | AL110: 250 | AM110: 47 | AN110: 272 | AO110: -0.16600000000000001 | AP110: 12 | AQ110: 宝莱转债!
A111: 231 | B111: 113027 | C111: 华钰转债!! | D111: 601020 | E111: 华钰矿业 | F111: 有色金属 | G111: 锌铅镍锡 | H111: 94.07 | I111: -5.74e-002 | J111: 4.7500000000000001e-002 | K111: 7.56 | L111: -3.0800000000000001e-002 | M111: 114.9 | N111: 10.17 | O111: 0.26500000000000001 | P111: 74.34 | Q111: 转股中 | R111: 4.35年 | S111: 2.35年 | T111: 3.25 | U111: 9.3 | V111: 2.8999999999999998e-002 | W111: 7.6999999999999999e-002 | X111: 5.7999999999999996e-002 | Y111: 42 | Z111: 1.73 | AA111: 4.8099999999999997e-002 | AB111: 4.1399999999999999e-002 | AC111: 3.8699999999999998e-002 | AD111: 3.5799999999999998e-002 | AE111: 88.44 | AF111: 87.97 | AG111: 0.32 | AH111: AA- | AI111: 6.4699999999999994e-002 | AJ111: =H111+100*O111 -> 120.56999999999999 | AK111: 113.8 | AL111: 114 | AM111: 25.4 | AN111: 138 | AO111: -0.127 | AP111: 45 | AQ111: 华钰转债!!
A112: 129 | B112: 123053 | C112: 宝通转债! | D112: 300031 | E112: 宝通科技 | F112: 通信互联 | G112: 互联网 | H112: 94.995 | I112: -2.2799999999999997e-002 | J112: 2.1000000000000001e-002 | K112: 15.12 | L112: -5.3e-003 | M112: 121.3 | N112: 20.8 | O112: 0.307 | P112: 72.69 | Q112: 转股中 | R112: 5.33年 | S112: 3.33年 | T112: 5 | U112: 11 | V112: 2.3e-002 | W112: 8.3000000000000004e-002 | X112: 6.0999999999999999e-002 | Y112: 60 | Z112: 2.09 | AA112: 4.8099999999999997e-002 | AB112: 4.07e-002 | AC112: 2.7200000000000002e-002 | AD112: 2.4700000000000003e-002 | AE112: 83.6 | AF112: 86.99 | AG112: 0.34 | AH112: AA- | AI112: 6.6000000000000003e-002 | AJ112: =H112+100*O112 -> 125.69500000000001 | AK112: 117.3 | AL112: 150 | AM112: 30.3 | AN112: 185 | AO112: -0.113 | AP112: 8 | AQ112: 宝通转债!
A113: 36 | B113: 113608 | C113: 威派转债! | D113: 603956 | E113: 威派格 | F113: 机械装备 | G113: 专用设备 | H113: 93.34 | I113: -6.9999999999999993e-003 | J113: 7.6e-003 | K113: 14.06 | L113: 1.4000000000000002e-003 | M113: 121.6 | N113: 19.24 | O113: 0.27699999999999997 | P113: 73.08 | Q113: 3月7天 | R113: 5.76年 | S113: 3.76年 | T113: 4.2 | U113: 2 | V113: 5.0000000000000001e-003 | W113: 7.0000000000000007e-002 | X113: 5.0999999999999997e-002 | Y113: 60 | Z113: 5.25 | AA113: 4.8099999999999997e-002 | AB113: 4.1200000000000001e-002 | AC113: 2.98e-002 | AD113: 2.7400000000000001e-002 | AE113: 78.45 | AF113: 80.12 | AG113: 0.43 | AH113: A+ | AI113: 7.6999999999999999e-002 | AJ113: =H113+100*O113 -> 121.03999999999999 | AK113: 113.6 | AL113: 113 | AM113: 33.5 | AN113: 206 | AO113: -2.2000000000000002e-002 | AP113: 6 | AQ113: 威派转债!
A114: 27 | B114: 113610 | C114: 灵康转债 | D114: 603669 | E114: 灵康药业 | F114: 医药 | G114: 化学制药 | H114: 92.62 | I114: 4.0000000000000002e-004 | J114: -1.7100000000000001e-002 | K114: 7.46 | L114: -3.1200000000000002e-002 | M114: 121.1 | N114: 8.81 | O114: 9.4e-002 | P114: 84.68 | Q114: 4月2天 | R114: 5.82年 | S114: 3.82年 | T114: 5.25 | U114: 11 | V114: 2.3e-002 | W114: 9.9000000000000005e-002 | X114: 8.4000000000000005e-002 | Y114: 53 | Z114: 3.9 | AA114: 4.8099999999999997e-002 | AB114: 4.1500000000000002e-002 | AC114: 2.98e-002 | AD114: 2.7799999999999998e-002 | AE114: 80.83 | AF114: 84.12 | AG114: 0.54 | AH114: AA- | AI114: 6.6000000000000003e-002 | AJ114: =H114+100*O114 -> 102.02000000000001 | AK114: 100.6 | AL114: 20 | AM114: 16.4 | AN114: 65 | AO114: -8.1000000000000003e-002 | AP114: 10 | AQ114: 灵康转债
A115: 79 | B115: 127021 | C115: 特发转2! | D115: 70 | E115: 特发信息 | F115: 通信互联 | G115: 通信设备 | H115: 92.1 | I115: -7.4999999999999997e-003 | J115: 6.4000000000000003e-003 | K115: 6.89 | L115: -1.7100000000000001e-002 | M115: 113.3 | N115: 12.33 | O115: 0.64800000000000002 | P115: 55.88 | Q115: 8天 | R115: 4.50年 | S115: 2.50年 | T115: 5.5 | U115: 13 | V115: 2.6000000000000002e-002 | W115: 9.8000000000000004e-002 | X115: 5.5e-002 | Y115: 56 | Z115: 1.98 | AA115: 4.7699999999999992e-002 | AB115: 4.2000000000000003e-002 | AC115: 3.9399999999999998e-002 | AD115: 3.78e-002 | AE115: 91.1 | AF115: 93.68 | AG115: 0.07 | AH115: AA | AI115: 4.3700000000000003e-002 | AJ115: =H115+100*O115 -> 156.89999999999998 | AK115: 128.3 | AL115: 216 | AM115: 34.6 | AN115: 210 | AO115: -0.151 | AP115: 8 | AQ115: 特发转2!
A116: 162 | B116: 123045 | C116: 雷迪转债 | D116: 300652 | E116: 雷迪克 | F116: 汽车 | G116: 零部件制 | H116: 95.2 | I116: -3.1e-002 | J116: 3.3300000000000003e-002 | K116: 15.39 | L116: 5.1999999999999998e-003 | M116: 119.4 | N116: 20.13 | O116: 0.245 | P116: 76.45 | Q116: 转股中 | R116: 5年35天 | S116: 3年35天 | T116: 1.66 | U116: 47 | V116: 0.28499999999999998 | W116: 0.115 | X116: 8.8000000000000009e-002 | Y116: 14 | Z116: 1.7 | AA116: 4.6699999999999998e-002 | AB116: 3.95e-002 | AC116: 2.9600000000000001e-002 | AD116: 2.6699999999999998e-002 | AE116: 82.38 | AF116: 82.64 | AG116: 0.44 | AH116: A+ | AI116: 7.6999999999999999e-002 | AJ116: =H116+100*O116 -> 119.7 | AK116: 113.9 | AL116: 117 | AM116: 31.3 | AN116: 193 | AO116: -0.105 | AP116: 35 | AQ116: 雷迪转债
A117: 57 | B117: 123068 | C117: 弘信转债 | D117: 300657 | E117: 弘信电子 | F117: 电子 | G117: 元器件制 | H117: 94 | I117: -2.8900000000000002e-002 | J117: 4.5000000000000005e-003 | K117: 14.83 | L117: -5.2400000000000002e-002 | M117: 121.2 | N117: 18.45 | O117: 0.16899999999999998 | P117: 80.38 | Q117: 2月15天 | R117: 5.69年 | S117: 3.69年 | T117: 5.7 | U117: 12 | V117: 2.1000000000000001e-002 | W117: 0.11199999999999999 | X117: 8.9999999999999997e-002 | Y117: 51 | Z117: 3.47 | AA117: 4.6699999999999998e-002 | AB117: 3.9800000000000002e-002 | AC117: 2.7099999999999999e-002 | AD117: 2.5000000000000001e-002 | AE117: 81.59 | AF117: 84.9 | AG117: 0.47 | AH117: AA- | AI117: 6.6000000000000003e-002 | AJ117: =H117+100*O117 -> 110.90000000000001 | AK117: 107.6 | AL117: 59 | AM117: 22.7 | AN117: 117 | AO117: -8.3000000000000004e-002 | AP117: 6 | AQ117: 弘信转债
A118: 254 | B118: 110056 | C118: 亨通转债! | D118: 600487 | E118: 亨通光电 | F118: 通信互联 | G118: 通信设备 | H118: 95.73 | I118: 3.2000000000000002e-003 | J118: 1.21e-002 | K118: 11.92 | L118: 5.5800000000000002e-002 | M118: 114.8 | N118: 15.01 | O118: 0.20499999999999999 | P118: 79.41 | Q118: 转股中 | R118: 4年42天 | S118: 2年42天 | T118: 17.1 | U118: 88 | V118: 5.2999999999999999e-002 | W118: 6.0999999999999999e-002 | X118: 4.8000000000000001e-002 | Y118: 282 | Z118: 1.54 | AA118: 4.6100000000000002e-002 | AB118: 3.9199999999999999e-002 | AC118: 3.4300000000000004e-002 | AD118: 3.1300000000000001e-002 | AE118: 94.2 | AF118: 97.38 | AG118: 0.27 | AH118: AA+ | AI118: 4.1700000000000001e-002 | AJ118: =H118+100*O118 -> 116.23 | AK118: 112 | AL118: 93 | AM118: 14.7 | AN118: 50 | AO118: -9.8000000000000004e-002 | AP118: 31 | AQ118: 亨通转债!
A119: 94 | B119: 123061 | C119: 航新转债 | D119: 300424 | E119: 航新科技 | F119: 航空航天 | G119: 航空航天 | H119: 98.2 | I119: -2.9600000000000001e-002 | J119: 2.8799999999999999e-002 | K119: 11.82 | L119: -1.7000000000000001e-003 | M119: 124.8 | N119: 14.86 | O119: 0.23499999999999999 | P119: 79.54 | Q119: 转股中 | R119: 5.46年 | S119: 3.46年 | T119: 2.5 | U119: 24 | V119: 9.6999999999999989e-002 | W119: 8.8000000000000009e-002 | X119: 7.0000000000000007e-002 | Y119: 28 | Z119: 2.6 | AA119: 4.5999999999999999e-002 | AB119: 3.7900000000000003e-002 | AC119: 1.8100000000000002e-002 | AD119: 1.55e-002 | AE119: 80.32 | AF119: 84.09 | AG119: 0.47 | AH119: A+ | AI119: 7.6999999999999999e-002 | AJ119: =H119+100*O119 -> 121.7 | AK119: 116.9 | AL119: 144 | AM119: 32.8 | AN119: 203 | AO119: -0.23899999999999999 | AP119: 11 | AQ119: 航新转债
A120: 130 | B120: 123052 | C120: 飞鹿转债 | D120: 300665 | E120: 飞鹿股份 | F120: 化工 | G120: 化工 | H120: 100.921 | I120: -4.2199999999999994e-002 | J120: 2.12e-002 | K120: 9.11 | L120: -3.6000000000000004e-002 | M120: 127.3 | N120: 9.9 | O120: 9.6999999999999989e-002 | P120: 92.02 | Q120: 转股中 | R120: 5.33年 | S120: 3.33年 | T120: 1.77 | U120: 25 | V120: 0.13800000000000001 | W120: 0.16 | X120: 0.14699999999999999 | Y120: 11 | Z120: 2.35 | AA120: 4.5700000000000005e-002 | AB120: 3.6799999999999999e-002 | AC120: 1.2199999999999999e-002 | AD120: 9.1999999999999998e-003 | AE120: 81.5 | AF120: 86.65 | AG120: 0.58 | AH120: A+ | AI120: 7.6999999999999999e-002 | AJ120: =H120+100*O120 -> 110.62100000000001 | AK120: 109.8 | AL120: 82 | AM120: 23.2 | AN120: 121 | AO120: -9.1999999999999998e-002 | AP120: 14 | AQ120: 飞鹿转债
A121: 113 | B121: 128116 | C121: 瑞达转债! | D121: 2961 | E121: 瑞达期货 | F121: 金融 | G121: 期货行业 | H121: 91.334 | I121: -5.6000000000000008e-003 | J121: -3.0999999999999999e-003 | K121: 20.6 | L121: -3.4200000000000001e-002 | M121: 115.3 | N121: 29.82 | O121: 0.32200000000000001 | P121: 69.08 | Q121: 转股中 | R121: 5.40年 | S121: 3.40年 | T121: 6.5 | U121: 8.3 | V121: 1.3999999999999999e-002 | W121: 7.0999999999999994e-002 | X121: 4.9000000000000002e-002 | Y121: 92 | Z121: 5.21 | AA121: 4.5100000000000001e-002 | AB121: 3.9599999999999996e-002 | AC121: 3.6699999999999997e-002 | AD121: 3.4500000000000003e-002 | AE121: 88.81 | AF121: 91.36 | AG121: 0.25 | AH121: AA | AI121: 4.4999999999999998e-002 | AJ121: =H121+100*O121 -> 123.53400000000001 | AK121: 113.6 | AL121: 112 | AM121: 22.2 | AN121: 108 | AO121: -6.6000000000000003e-002 | AP121: 15 | AQ121: 瑞达转债!
A122: 97 | B122: 113594 | C122: 淳中转债! | D122: 603516 | E122: 淳中科技 | F122: 电子 | G122: 电子产品 | H122: 96 | I122: -1.44e-002 | J122: 6.5000000000000006e-003 | K122: 27.6 | L122: -2.1600000000000001e-002 | M122: 121.4 | N122: 39.37 | O122: 0.36899999999999999 | P122: 70.1 | Q122: 转股中 | R122: 5.46年 | S122: 3.46年 | T122: 3 | U122: 2.8 | V122: 1.e-002 | W122: 8.199999999999999e-002 | X122: 5.7000000000000002e-002 | Y122: 37 | Z122: 4.09 | AA122: 4.4999999999999998e-002 | AB122: 3.7900000000000003e-002 | AC122: 2.4199999999999999e-002 | AD122: 2.1600000000000001e-002 | AE122: 80.21 | AF122: 81.8 | AG122: 0.36 | AH122: A+ | AI122: 7.6999999999999999e-002 | AJ122: =H122+100*O122 -> 132.90000000000001 | AK122: 121.9 | AL122: 184 | AM122: 40.1 | AN122: 242 | AO122: -7.9000000000000001e-002 | AP122: 7 | AQ122: 淳中转债!
A123: 12 | B123: 123087 | C123: 明电转债! | D123: 300739 | E123: 明阳电路 | F123: 电子 | G123: 元器件制 | H123: 94.45 | I123: -5.6999999999999993e-003 | J123: -1.8e-003 | K123: 14.55 | L123: -3.5099999999999999e-002 | M123: 121.2 | N123: 24.23 | O123: 0.57299999999999995 | P123: 60.05 | Q123: 4月16天 | R123: 5.86年 | S123: 4.86年 | T123: 6.73 | U123: 11 | V123: 1.7000000000000001e-002 | W123: 0.16600000000000001 | X123: 9.9000000000000005e-002 | Y123: 41 | Z123: 2.96 | AA123: 4.4400000000000002e-002 | AB123: 3.78e-002 | AC123: 2.5000000000000001e-002 | AD123: 2.23e-002 | AE123: 77.81 | AF123: 84 | AG123: 0.21 | AH123: AA- | AI123: 6.6000000000000003e-002 | AJ123: =H123+100*O123 -> 151.75 | AK123: 128.9 | AL123: 222 | AM123: 44.9 | AN123: 260 | AO123: -0.14499999999999999 | AP123: 3 | AQ123: 明电转债!
A124: 156 | B124: 113574 | C124: 华体转债! | D124: 603679 | E124: 华体科技 | F124: 城市公用 | G124: 城市公用 | H124: 93.81 | I124: -7.6e-003 | J124: 7.6e-003 | K124: 17.22 | L124: -5.9999999999999995e-004 | M124: 116.4 | N124: 33.99 | O124: 0.85199999999999998 | P124: 50.66 | Q124: 转股中 | R124: 5年54天 | S124: 3年54天 | T124: 2.09 | U124: 2.4 | V124: 1.2e-002 | W124: 8.5000000000000006e-002 | X124: 4.2999999999999997e-002 | Y124: 25 | Z124: 3.36 | AA124: 4.4000000000000004e-002 | AB124: 3.78e-002 | AC124: 3.3799999999999997e-002 | AD124: 3.0899999999999997e-002 | AE124: 82.06 | AF124: 80.27 | AG124: 0.07 | AH124: A+ | AI124: 7.6999999999999999e-002 | AJ124: =H124+100*O124 -> 179.00999999999999 | AK124: 137 | AL124: 267 | AM124: 54.9 | AN124: 286 | AO124: -0.158 | AP124: 15 | AQ124: 华体转债!
A125: 24 | B125: 123081 | C125: 精研转债! | D125: 300709 | E125: 精研科技 | F125: 电子 | G125: 电子产品 | H125: 95 | I125: -2.0499999999999997e-002 | J125: 2.0499999999999997e-002 | K125: 41.55 | L125: 0. | M125: 121.3 | N125: 64.28 | O125: 0.46999999999999997 | P125: 64.64 | Q125: 4月4天 | R125: 5.83年 | S125: 3.83年 | T125: 5.7 | U125: 22 | V125: 4.0000000000000001e-002 | W125: 0.11900000000000001 | X125: 7.6999999999999999e-002 | Y125: 48 | Z125: 3.19 | AA125: 4.3700000000000003e-002 | AB125: 3.7100000000000001e-002 | AC125: 2.3700000000000002e-002 | AD125: 2.1499999999999998e-002 | AE125: 80.95 | AF125: 84.23 | AG125: 0.27 | AH125: AA- | AI125: 6.6000000000000003e-002 | AJ125: =H125+100*O125 -> 142. | AK125: 125.4 | AL125: 202 | AM125: 41.1 | AN125: 245 | AO125: -0.16399999999999998 | AP125: 3 | AQ125: 精研转债!
A126: 153 | B126: 127016 | C126: 鲁泰转债! | D126: 726 | E126: 鲁 泰Ａ | F126: 服装纺织 | G126: 纺织行业 | H126: 93.6 | I126: 5.3e-003 | J126: -1.7000000000000001e-003 | K126: 6.3 | L126: 1.61e-002 | M126: 116.2 | N126: 8.91 | O126: 0.32400000000000001 | P126: 70.71 | Q126: 转股中 | R126: 5.17年 | S126: 3.17年 | T126: 14 | U126: 8.3 | V126: 6.0000000000000001e-003 | W126: 0.25900000000000001 | X126: 0.183 | Y126: 54 | Z126: 0.7 | AA126: 4.36e-002 | AB126: 3.7599999999999995e-002 | AC126: 3.15e-002 | AD126: 2.92e-002 | AE126: 90.23 | AF126: 93.87 | AG126: 0.22 | AH126: AA+ | AI126: 4.2999999999999997e-002 | AJ126: =H126+100*O126 -> 126. | AK126: 116.5 | AL126: 139 | AM126: 22.6 | AN126: 115 | AO126: 2.2000000000000002e-002 | AP126: 23 | AQ126: 鲁泰转债!
A127: 4 | B127: 123092 | C127: 天壕转债 | D127: 300332 | E127: 天壕环境 | F127: 石油天然 | G127: 天然气 | H127: 95.275 | I127: 7.1999999999999998e-003 | J127: -1.09e-002 | K127: 4.04 | L127: -7.4000000000000003e-003 | M127: 121.6 | N127: 5.2 | O127: 0.22600000000000001 | P127: 77.69 | Q127: 4月25天 | R127: 5.88年 | S127: 3.88年 | T127: 4.23 | U127: 6.5 | V127: 1.6e-002 | W127: 0.11900000000000001 | X127: 9.1999999999999998e-002 | Y127: 36 | Z127: 1.03 | AA127: 4.3299999999999998e-002 | AB127: 3.6600000000000001e-002 | AC127: 2.3599999999999999e-002 | AD127: 2.1299999999999999e-002 | AE127: 77.73 | AF127: 79.39 | AG127: 0.5 | AH127: A+ | AI127: 7.6999999999999999e-002 | AJ127: =H127+100*O127 -> 117.875 | AK127: 112.9 | AL127: 99 | AM127: 33.5 | AN127: 205 | AO127: -0.14000000000000001 | AP127: 3 | AQ127: 天壕转债
A128: 187 | B128: 123039 | C128: 开润转债! | D128: 300577 | E128: 开润股份 | F128: 服装纺织 | G128: 纺织行业 | H128: 98.888 | I128: -2.5999999999999999e-003 | J128: -1.7000000000000001e-003 | K128: 21.6 | L128: -1.77e-002 | M128: 121 | N128: 32.87 | O128: 0.505 | P128: 65.71 | Q128: 转股中 | R128: 4.89年 | S128: 2.89年 | T128: 2.22 | U128: 2.3 | V128: 1.e-002 | W128: 4.2999999999999997e-002 | X128: 2.7999999999999997e-002 | Y128: 52 | Z128: 5.63 | AA128: 4.3099999999999999e-002 | AB128: 3.5299999999999998e-002 | AC128: 1.7100000000000001e-002 | AD128: 1.44e-002 | AE128: 83.49 | AF128: 85.38 | AG128: 0.24 | AH128: A+ | AI128: 7.5700000000000003e-002 | AJ128: =H128+100*O128 -> 149.38800000000001 | AK128: 132.1 | AL128: 247 | AM128: 46.7 | AN128: 268 | AO128: -8.5999999999999993e-002 | AP128: 25 | AQ128: 开润转债!
A129: 22 | B129: 128140 | C129: 润建转债! | D129: 2929 | E129: 润建股份 | F129: 通信互联 | G129: 通信设备 | H129: 90.701 | I129: -4.0000000000000002e-004 | J129: 1.7000000000000001e-002 | K129: 21.61 | L129: 3.8900000000000004e-002 | M129: 115.2 | N129: 26.55 | O129: 0.114 | P129: 81.39 | Q129: 4月6天 | R129: 5.84年 | S129: 3.84年 | T129: 10.9 | U129: 9.1 | V129: 9.0000000000000011e-003 | W129: 0.22800000000000001 | X129: 0.18600000000000003 | Y129: 48 | Z129: 1.61 | AA129: 4.2599999999999999e-002 | AB129: 3.7599999999999995e-002 | AC129: 3.4300000000000004e-002 | AD129: 3.2400000000000005e-002 | AE129: 87.08 | AF129: 89.52 | AG129: 0.43 | AH129: AA | AI129: 4.4999999999999998e-002 | AJ129: =H129+100*O129 -> 102.101 | AK129: 100 | AL129: 18 | AM129: 10.5 | AN129: 24 | AO129: -5.0999999999999997e-002 | AP129: 6 | AQ129: 润建转债!
A130: 133 | B130: 123051 | C130: 今天转债 | D130: 300532 | E130: 今天国际 | F130: 计算机及 | G130: 软件开发 | H130: 99.3 | I130: -1.38e-002 | J130: 1.e-004 | K130: 8.22 | L130: -2.1400000000000002e-002 | M130: 122.8 | N130: 8.8 | O130: 6.3e-002 | P130: 93.41 | Q130: 转股中 | R130: 5.33年 | S130: 3.33年 | T130: 2.8 | U130: 5.1 | V130: 1.8000000000000002e-002 | W130: 0.125 | X130: 0.11599999999999999 | Y130: 22 | Z130: 2.82 | AA130: 4.1700000000000001e-002 | AB130: 3.4000000000000002e-002 | AC130: 1.55e-002 | AD130: 1.2800000000000001e-002 | AE130: 81.11 | AF130: 83.57 | AG130: 0.64 | AH130: A+ | AI130: 7.6999999999999999e-002 | AJ130: =H130+100*O130 -> 105.59999999999999 | AK130: 105.2 | AL130: 40 | AM130: 21.6 | AN130: 99 | AO130: -8.3000000000000004e-002 | AP130: 14 | AQ130: 今天转债
A131: 15 | B131: 123085 | C131: 万顺转2! | D131: 300057 | E131: 万顺新材 | F131: 有色金属 | G131: 铝金属 | H131: 89.699 | I131: 7.9000000000000008e-003 | J131: -1.6399999999999998e-002 | K131: 4.09 | L131: -2.8500000000000001e-002 | M131: 113.3 | N131: 6.24 | O131: 0.36899999999999999 | P131: 65.54 | Q131: 4月12天 | R131: 5.85年 | S131: 3.85年 | T131: 9 | U131: 169 | V131: 0.21199999999999999 | W131: 0.32600000000000001 | X131: 0.214 | Y131: 28 | Z131: 0.81 | AA131: 4.1599999999999998e-002 | AB131: 3.7100000000000001e-002 | AC131: 3.7400000000000003e-002 | AD131: 3.5400000000000001e-002 | AE131: 80.51 | AF131: 78.55 | AG131: 0.3 | AH131: AA- | AI131: 6.6000000000000003e-002 | AJ131: =H131+100*O131 -> 126.59899999999999 | AK131: 113.9 | AL131: 116 | AM131: 33.3 | AN131: 204 | AO131: -0.107 | AP131: 5 | AQ131: 万顺转2!
A132: 74 | B132: 128128 | C132: 齐翔转2 | D132: 2408 | E132: 齐翔腾达 | F132: 化工 | G132: 化工 | H132: 92.6 | I132: -3.6299999999999999e-002 | J132: 1.83e-002 | K132: 7.38 | L132: -3.5299999999999998e-002 | M132: 115.3 | N132: 8.22 | O132: 3.1e-002 | P132: 89.78 | Q132: 21天 | R132: 5.54年 | S132: 3.54年 | T132: 29.9 | U132: 123 | V132: 4.4000000000000004e-002 | W132: 0.22800000000000001 | X132: 0.20499999999999999 | Y132: 131 | Z132: 1.6 | AA132: 4.1200000000000001e-002 | AB132: 3.5900000000000001e-002 | AC132: 3.1400000000000004e-002 | AD132: 2.9300000000000003e-002 | AE132: 88.25 | AF132: 90.78 | AG132: 0.51 | AH132: AA | AI132: 4.4999999999999998e-002 | AJ132: =H132+100*O132 -> 95.699999999999989 | AK132: 95.4 | AL132: 6 | AM132: 4.6 | AN132: 7 | AO132: -0.182 | AP132: 39 | AQ132: 齐翔转2
A133: 189 | B133: 113030 | C133: 东风转债! | D133: 601515 | E133: 东风股份 | F133: 造纸包装 | G133: 包装材料 | H133: 96.81 | I133: -4.4900000000000002e-002 | J133: 3.4000000000000002e-002 | K133: 5.84 | L133: -2.6699999999999998e-002 | M133: 116.9 | N133: 6.75 | O133: 0.11900000000000001 | P133: 86.52 | Q133: 转股中 | R133: 4.88年 | S133: 2.88年 | T133: 2.95 | U133: 22 | V133: 7.4999999999999997e-002 | W133: 3.7999999999999999e-002 | X133: 3.3000000000000002e-002 | Y133: 78 | Z133: 1.87 | AA133: 4.0099999999999997e-002 | AB133: 3.3700000000000001e-002 | AC133: 2.2000000000000002e-002 | AD133: 1.9799999999999998e-002 | AE133: 90.86 | AF133: 95.23 | AG133: 0.41 | AH133: AA | AI133: 4.3700000000000003e-002 | AJ133: =H133+100*O133 -> 108.71000000000001 | AK133: 107.1 | AL133: 55 | AM133: 11.9 | AN133: 31 | AO133: 2.5000000000000001e-002 | AP133: 17 | AQ133: 东风转债!
A134: 158 | B134: 110068 | C134: 龙净转债! | D134: 600388 | E134: 龙净环保 | F134: 城市公用 | G134: 三废处理 | H134: 94.39 | I134: -6.0999999999999995e-003 | J134: 2.5000000000000001e-003 | K134: 8.09 | L134: -1.2199999999999999e-002 | M134: 115 | N134: 10.73 | O134: 0.252 | P134: 75.4 | Q134: 转股中 | R134: 5年47天 | S134: 3年47天 | T134: 20 | U134: 23 | V134: 1.2e-002 | W134: 0.23100000000000001 | X134: 0.17399999999999999 | Y134: 86 | Z134: 1.5 | AA134: 4.0000000000000001e-002 | AB134: 3.44e-002 | AC134: 2.86e-002 | AD134: 2.64e-002 | AE134: 90.2 | AF134: 93.04 | AG134: 0.3 | AH134: AA+ | AI134: 4.2999999999999997e-002 | AJ134: =H134+100*O134 -> 119.59 | AK134: 113.4 | AL134: 107 | AM134: 20.3 | AN134: 81 | AO134: -5.9999999999999998e-002 | AP134: 30 | AQ134: 龙净转债!
A135: 291 | B135: 110045 | C135: 海澜转债! | D135: 600398 | E135: 海澜之家 | F135: 服装纺织 | G135: 服装行业 | H135: 97.4 | I135: 7.6e-003 | J135: -7.6e-003 | K135: 6.58 | L135: 0. | M135: 111.1 | N135: 11.75 | O135: 0.7390000000000001 | P135: 56 | Q135: 转股中 | R135: 3.43年 | S135: 1.43年 | T135: 29.5 | U135: 28 | V135: 1.e-002 | W135: 0.10400000000000001 | X135: 5.7999999999999996e-002 | Y135: 284 | Z135: 2.24 | AA135: 3.9699999999999999e-002 | AB135: 3.3399999999999999e-002 | AC135: 2.9600000000000001e-002 | AD135: 2.7000000000000003e-002 | AE135: 95.61 | AF135: 96.76 | AG135: 0.03 | AH135: AA+ | AI135: 4.1700000000000001e-002 | AJ135: =H135+100*O135 -> 171.30000000000001 | AK135: 138.8 | AL135: 278 | AM135: 42 | AN135: 250 | AO135: 1.e-003 | AP135: 60 | AQ135: 海澜转债!
A136: 276 | B136: 110047 | C136: 山鹰转债 | D136: 600567 | E136: 山鹰国际 | F136: 造纸包装 | G136: 包装用纸 | H136: 101.65 | I136: -6.5000000000000006e-003 | J136: 6.5000000000000006e-003 | K136: 3.02 | L136: 0. | M136: 117.5 | N136: 3.34 | O136: 0.124 | P136: 90.42 | Q136: 转股中 | R136: 3.79年 | S136: 1.79年 | T136: 23 | U136: 45 | V136: 1.9e-002 | W136: 0.16600000000000001 | X136: 0.14999999999999999 | Y136: 139 | Z136: 0.94 | AA136: 3.9699999999999999e-002 | AB136: 3.1200000000000002e-002 | AC136: 6.0000000000000001e-003 | AD136: 3.0999999999999999e-003 | AE136: 94.98 | AF136: 100.92 | AG136: 0.39 | AH136: AA+ | AI136: 4.1700000000000001e-002 | AJ136: =H136+100*O136 -> 114.05000000000001 | AK136: 112.9 | AL136: 100 | AM136: 12 | AN136: 32 | AO136: -3.7000000000000005e-002 | AP136: 35 | AQ136: 山鹰转债
A137: 272 | B137: 128051 | C137: 光华转债! | D137: 2741 | E137: 光华科技 | F137: 电子 | G137: 元器件制 | H137: 99.105 | I137: -8.0000000000000002e-003 | J137: 8.0000000000000002e-003 | K137: 12.09 | L137: 0. | M137: 114.8 | N137: 12.72 | O137: 4.2999999999999997e-002 | P137: 95.05 | Q137: 转股中 | R137: 3.86年 | S137: 1.86年 | T137: 2.48 | U137: 6.9 | V137: 2.7999999999999997e-002 | W137: 5.5e-002 | X137: 5.2000000000000005e-002 | Y137: 45 | Z137: 3.74 | AA137: 3.9699999999999999e-002 | AB137: 3.2400000000000005e-002 | AC137: 2.e-002 | AD137: 1.6899999999999998e-002 | AE137: 90.94 | AF137: 90.59 | AG137: 0.58 | AH137: AA- | AI137: 6.4699999999999994e-002 | AJ137: =H137+100*O137 -> 103.405 | AK137: 103.2 | AL137: 30 | AM137: 12.2 | AN137: 36 | AO137: -7.2000000000000008e-002 | AP137: 26 | AQ137: 光华转债!
A138: 131 | B138: 113584 | C138: 家悦转债! | D138: 603708 | E138: 家家悦 | F138: 商业零售 | G138: 超市 | H138: 94.08 | I138: -4.4999999999999998e-002 | J138: 4.3700000000000003e-002 | K138: 19.74 | L138: -2.0799999999999999e-002 | M138: 115.3 | N138: 37.97 | O138: 0.81000000000000005 | P138: 51.99 | Q138: 转股中 | R138: 5.33年 | S138: 3.33年 | T138: 6.45 | U138: 16 | V138: 2.6000000000000002e-002 | W138: 5.4000000000000006e-002 | X138: 2.7999999999999997e-002 | Y138: 120 | Z138: 4 | AA138: 3.9699999999999999e-002 | AB138: 3.4300000000000004e-002 | AC138: 2.8799999999999999e-002 | AD138: 2.6600000000000002e-002 | AE138: 89.14 | AF138: 91.64 | AG138: 0.06 | AH138: AA | AI138: 4.4999999999999998e-002 | AJ138: =H138+100*O138 -> 175.07999999999998 | AK138: 136.2 | AL138: 265 | AM138: 44.5 | AN138: 258 | AO138: -8.5000000000000006e-002 | AP138: 7 | AQ138: 家悦转债!
A139: 72 | B139: 113039 | C139: 嘉泽转债! | D139: 601619 | E139: 嘉泽新能 | F139: 能源电力 | G139: 风能 | H139: 91.52 | I139: -1.77e-002 | J139: 4.0000000000000001e-003 | K139: 3.06 | L139: -2.86e-002 | M139: 113.1 | N139: 3.57 | O139: 6.8000000000000005e-002 | P139: 85.71 | Q139: 24天 | R139: 5.55年 | S139: 3.55年 | T139: 13 | U139: 117 | V139: 9.8000000000000004e-002 | W139: 0.20499999999999999 | X139: 0.17600000000000002 | Y139: 63 | Z139: 1.85 | AA139: 3.9599999999999996e-002 | AB139: 3.5099999999999999e-002 | AC139: 3.4200000000000001e-002 | AD139: 3.2199999999999999e-002 | AE139: 88.1 | AF139: 89 | AG139: 0.48 | AH139: AA | AI139: 4.4999999999999998e-002 | AJ139: =H139+100*O139 -> 98.319999999999993 | AK139: 97.3 | AL139: 10 | AM139: 8.3 | AN139: 16 | AO139: -0.10199999999999999 | AP139: 19 | AQ139: 嘉泽转债!
A140: 20 | B140: 127026 | C140: 超声转债 | D140: 823 | E140: 超声电子 | F140: 电子 | G140: 元器件制 | H140: 90.5 | I140: -1.52e-002 | J140: 1.0500000000000001e-002 | K140: 9.17 | L140: -1.4999999999999999e-002 | M140: 113.1 | N140: 12.85 | O140: 0.26800000000000002 | P140: 71.36 | Q140: 4月9天 | R140: 5.84年 | S140: 3.84年 | T140: 7 | U140: 11 | V140: 1.7000000000000001e-002 | W140: 0.14199999999999999 | X140: 0.10099999999999999 | Y140: 49 | Z140: 1.34 | AA140: 3.9599999999999996e-002 | AB140: 3.5299999999999998e-002 | AC140: 3.4599999999999999e-002 | AD140: 3.27e-002 | AE140: 86.98 | AF140: 87.87 | AG140: 0.32 | AH140: AA | AI140: 4.4999999999999998e-002 | AJ140: =H140+100*O140 -> 117.3 | AK140: 109.6 | AL140: 81 | AM140: 21.8 | AN140: 100 | AO140: -0.13800000000000001 | AP140: 4 | AQ140: 超声转债
A141: 175 | B141: 113565 | C141: 宏辉转债 | D141: 603336 | E141: 宏辉果蔬 | F141: 农业 | G141: 农产品加 | H141: 97.7 | I141: -3.5400000000000001e-002 | J141: 1.6e-002 | K141: 8.77 | L141: -3.5200000000000002e-002 | M141: 118.2 | N141: 10 | O141: 0.114 | P141: 87.7 | Q141: 转股中 | R141: 5年21天 | S141: 3年21天 | T141: 2.25 | U141: 49 | V141: 0.21600000000000003 | W141: 7.5999999999999998e-002 | X141: 6.7000000000000004e-002 | Y141: 30 | Z141: 3.11 | AA141: 3.9300000000000002e-002 | AB141: 3.2599999999999997e-002 | AC141: 2.0199999999999999e-002 | AD141: 1.7600000000000001e-002 | AE141: 84.97 | AF141: 86.24 | AG141: 0.55 | AH141: AA- | AI141: 6.6000000000000003e-002 | AJ141: =H141+100*O141 -> 109.10000000000001 | AK141: 107.7 | AL141: 62 | AM141: 21.5 | AN141: 95 | AO141: -0.11199999999999999 | AP141: 23 | AQ141: 宏辉转债
A142: 211 | B142: 127014 | C142: 北方转债 | D142: 65 | E142: 北方国际 | F142: 建筑 | G142: 建筑工程 | H142: 96.5 | I142: -8.3000000000000001e-003 | J142: 8.6999999999999994e-003 | K142: 6.37 | L142: 1.6000000000000001e-003 | M142: 115.1 | N142: 8.75 | O142: 0.32600000000000001 | P142: 72.8 | Q142: 转股中 | R142: 4.72年 | S142: 2.72年 | T142: 5.78 | U142: 4.5 | V142: 8.0000000000000002e-003 | W142: 0.11800000000000001 | X142: 8.5999999999999993e-002 | Y142: 49 | Z142: 0.92 | AA142: 3.8900000000000004e-002 | AB142: 3.2799999999999996e-002 | AC142: 2.52e-002 | AD142: 2.2700000000000001e-002 | AE142: 92.21 | AF142: 95.31 | AG142: 0.24 | AH142: AA+ | AI142: 4.1700000000000001e-002 | AJ142: =H142+100*O142 -> 129.09999999999999 | AK142: 120.2 | AL142: 169 | AM142: 24.9 | AN142: 131 | AO142: -9.8000000000000004e-002 | AP142: 17 | AQ142: 北方转债
A143: 99 | B143: 113593 | C143: 沪工转债 | D143: 603131 | E143: 上海沪工 | F143: 机械装备 | G143: 通用设备 | H143: 99.26 | I143: -7.6299999999999993e-002 | J143: 5.8899999999999994e-002 | K143: 19.31 | L143: -2.7699999999999999e-002 | M143: 121.6 | N143: 21.32 | O143: 9.6000000000000002e-002 | P143: 90.57 | Q143: 转股中 | R143: 5.45年 | S143: 3.45年 | T143: 4 | U143: 32 | V143: 7.8e-002 | W143: 6.5000000000000002e-002 | X143: 5.9000000000000004e-002 | Y143: 61 | Z143: 4.98 | AA143: 3.8800000000000001e-002 | AB143: 3.1699999999999999e-002 | AC143: 1.47e-002 | AD143: 1.2199999999999999e-002 | AE143: 80.22 | AF143: 81.93 | AG143: 0.63 | AH143: A+ | AI143: 7.6999999999999999e-002 | AJ143: =H143+100*O143 -> 108.86 | AK143: 107.9 | AL143: 66 | AM143: 26 | AN143: 146 | AO143: -0.19 | AP143: 8 | AQ143: 沪工转债
A144: 106 | B144: 110071 | C144: 湖盐转债! | D144: 600929 | E144: 雪天盐业 | F144: 食品饮料 | G144: 食品饮料 | H144: 94.11 | I144: 8.6999999999999994e-003 | J144: -1.5300000000000001e-002 | K144: 4.88 | L144: -2.2000000000000002e-002 | M144: 115.2 | N144: 6.6 | O144: 0.27300000000000002 | P144: 73.94 | Q144: 转股中 | R144: 5.43年 | S144: 3.43年 | T144: 7.2 | U144: 6.8 | V144: 1.e-002 | W144: 0.161 | X144: 0.11900000000000001 | Y144: 45 | Z144: 1.76 | AA144: 3.8699999999999998e-002 | AB144: 3.3399999999999999e-002 | AC144: 2.7699999999999999e-002 | AD144: 2.5499999999999998e-002 | AE144: 88.67 | AF144: 91.15 | AG144: 0.3 | AH144: AA | AI144: 4.4999999999999998e-002 | AJ144: =H144+100*O144 -> 121.41 | AK144: 114.3 | AL144: 118 | AM144: 23.1 | AN144: 120 | AO144: -5.7000000000000002e-002 | AP144: 15 | AQ144: 湖盐转债!
A145: 45 | B145: 113606 | C145: 荣泰转债 | D145: 603579 | E145: 荣泰健康 | F145: 机械装备 | G145: 专用设备 | H145: 98.01 | I145: -6.7000000000000002e-003 | J145: 2.2499999999999999e-002 | K145: 27.38 | L145: 3.2000000000000001e-002 | M145: 121.2 | N145: 33.32 | O145: 0.193 | P145: 82.17 | Q145: 2月29天 | R145: 5.73年 | S145: 3.73年 | T145: 6 | U145: 75 | V145: 0.12300000000000001 | W145: 0.157 | X145: 0.129 | Y145: 38 | Z145: 2.42 | AA145: 3.8599999999999995e-002 | AB145: 3.1899999999999998e-002 | AC145: 1.5800000000000002e-002 | AD145: 1.37e-002 | AE145: 81.38 | AF145: 84.69 | AG145: 0.49 | AH145: AA- | AI145: 6.6000000000000003e-002 | AJ145: =H145+100*O145 -> 117.31 | AK145: 113.8 | AL145: 115 | AM145: 29.2 | AN145: 179 | AO145: -2.2000000000000002e-002 | AP145: 8 | AQ145: 荣泰转债
A146: 244 | B146: 128064 | C146: 司尔转债! | D146: 2538 | E146: 司尔特 | F146: 化工 | G146: 农化 | H146: 98.9 | I146: -1.67e-002 | J146: 8.8999999999999999e-003 | K146: 5.43 | L146: -1.8100000000000002e-002 | M146: 114.9 | N146: 6.07 | O146: 0.106 | P146: 89.46 | Q146: 转股中 | R146: 4.17年 | S146: 2.17年 | T146: 8 | U146: 13 | V146: 1.6e-002 | W146: 0.20499999999999999 | X146: 0.184 | Y146: 39 | Z146: 1.02 | AA146: 3.7400000000000003e-002 | AB146: 3.0600000000000002e-002 | AC146: 1.95e-002 | AD146: 1.6500000000000001e-002 | AE146: 93.67 | AF146: 96.51 | AG146: 0.43 | AH146: AA | AI146: 4.3700000000000003e-002 | AJ146: =H146+100*O146 -> 109.5 | AK146: 108.3 | AL146: 69 | AM146: 11.8 | AN146: 30 | AO146: -1.6e-002 | AP146: 54 | AQ146: 司尔转债!
A147: 84 | B147: 128125 | C147: 华阳转债! | D147: 2949 | E147: 华阳国际 | F147: 建筑 | G147: 建筑工程 | H147: 97.3 | I147: -9.3999999999999986e-003 | J147: 1.6299999999999999e-002 | K147: 18.2 | L147: 2.0199999999999999e-002 | M147: 118.5 | N147: 25.79 | O147: 0.379 | P147: 70.57 | Q147: 转股中 | R147: 5.48年 | S147: 3.48年 | T147: 4.5 | U147: 4.9 | V147: 1.1000000000000001e-002 | W147: 0.126 | X147: 8.900000000000001e-002 | Y147: 36 | Z147: 2.93 | AA147: 3.7400000000000003e-002 | AB147: 3.1099999999999999e-002 | AC147: 1.8200000000000001e-002 | AD147: 1.6e-002 | AE147: 82.45 | AF147: 84.09 | AG147: 0.34 | AH147: AA- | AI147: 6.6000000000000003e-002 | AJ147: =H147+100*O147 -> 135.19999999999999 | AK147: 124 | AL147: 197 | AM147: 39.9 | AN147: 241 | AO147: -0.10099999999999999 | AP147: 5 | AQ147: 华阳转债!
A148: 326 | B148: 113016 | C148: 小康转债! | D148: 601127 | E148: 小康股份 | F148: 汽车 | G148: 零部件制 | H148: 98.99 | I148: -1.2500000000000001e-002 | J148: -4.8999999999999998e-003 | K148: 13.32 | L148: -5.67e-002 | M148: 109.3 | N148: 15.7 | O148: 0.16699999999999998 | P148: 84.84 | Q148: 转股中 | R148: 2.75年 | S148: 0.75年 | T148: 5.76 | U148: 133 | V148: 0.23000000000000001 | W148: 3.4000000000000002e-002 | X148: 2.8999999999999998e-002 | Y148: 170 | Z148: 2.9 | AA148: 3.73e-002 | AB148: 3.0600000000000002e-002 | AC148: 3.1099999999999999e-002 | AD148: 2.7099999999999999e-002 | AE148: 98.03 | AF148: 97.76 | AG148: 0.31 | AH148: AA | AI148: 4.2099999999999999e-002 | AJ148: =H148+100*O148 -> 115.69 | AK148: 113.1 | AL148: 106 | AM148: 15.1 | AN148: 56 | AO148: -0.13300000000000001 | AP148: 50 | AQ148: 小康转债!
A149: 47 | B149: 123073 | C149: 同和转债! | D149: 300636 | E149: 同和药业 | F149: 医药 | G149: 原料药 | H149: 99.698 | I149: -4.3e-003 | J149: -3.56e-002 | K149: 21.37 | L149: -6.3500000000000001e-002 | M149: 122.4 | N149: 23.8 | O149: 0.11 | P149: 89.79 | Q149: 2月27天 | R149: 5.72年 | S149: 3.72年 | T149: 3.6 | U149: 10 | V149: 2.8999999999999998e-002 | W149: 0.13100000000000001 | X149: 0.11800000000000001 | Y149: 27 | Z149: 3.64 | AA149: 3.73e-002 | AB149: 3.0299999999999997e-002 | AC149: 1.2500000000000001e-002 | AD149: 1.0200000000000001e-002 | AE149: 78.65 | AF149: 80.86 | AG149: 0.63 | AH149: A+ | AI149: 7.6999999999999999e-002 | AJ149: =H149+100*O149 -> 110.69799999999999 | AK149: 109.6 | AL149: 80 | AM149: 28.7 | AN149: 176 | AO149: -3.7999999999999999e-002 | AP149: 8 | AQ149: 同和转债!
A150: 92 | B150: 128122 | C150: 兴森转债! | D150: 2436 | E150: 兴森科技 | F150: 电子 | G150: 元器件制 | H150: 96.6 | I150: -7.1999999999999998e-003 | J150: 3.8e-003 | K150: 7.93 | L150: -5.0300000000000004e-002 | M150: 113.3 | N150: 14.18 | O150: 0.72699999999999998 | P150: 55.92 | Q150: 转股中 | R150: 4.46年 | S150: 3.46年 | T150: 2.69 | U150: 8.2 | V150: 3.2000000000000001e-002 | W150: 2.3e-002 | X150: 1.3000000000000001e-002 | Y150: 118 | Z150: 3.74 | AA150: 3.6900000000000002e-002 | AB150: 3.1200000000000002e-002 | AC150: 1.9699999999999999e-002 | AD150: 1.77e-002 | AE150: 88.86 | AF150: 93.84 | AG150: 0.07 | AH150: AA | AI150: 4.3700000000000003e-002 | AJ150: =H150+100*O150 -> 169.30000000000001 | AK150: 137.3 | AL150: 270 | AM150: 43.4 | AN150: 257 | AO150: -0.16800000000000001 | AP150: 10 | AQ150: 兴森转债!
A151: 23 | B151: 123082 | C151: 北陆转债! | D151: 300016 | E151: 北陆药业 | F151: 医药 | G151: 化学制药 | H151: 99.11 | I151: -2.9999999999999997e-004 | J151: -2.5999999999999999e-003 | K151: 8.01 | L151: -7.4000000000000003e-003 | M151: 121.7 | N151: 11.41 | O151: 0.41200000000000003 | P151: 70.2 | Q151: 4月6天 | R151: 5.84年 | S151: 3.84年 | T151: 5 | U151: 3.1 | V151: 6.0000000000000001e-003 | W151: 0.126 | X151: 8.900000000000001e-002 | Y151: 40 | Z151: 2.5 | AA151: 3.6600000000000001e-002 | AB151: 2.9900000000000003e-002 | AC151: 1.38e-002 | AD151: 1.15e-002 | AE151: 78.01 | AF151: 79.73 | AG151: 0.4 | AH151: A+ | AI151: 7.6999999999999999e-002 | AJ151: =H151+100*O151 -> 140.31 | AK151: 128 | AL151: 215 | AM151: 48.3 | AN151: 276 | AO151: -8.900000000000001e-002 | AP151: 6 | AQ151: 北陆转债!
A152: 66 | B152: 128131 | C152: 崇达转2! | D152: 2815 | E152: 崇达技术 | F152: 电子 | G152: 元器件制 | H152: 94.7 | I152: 3.4999999999999996e-003 | J152: -6.8999999999999999e-003 | K152: 11.64 | L152: -2.5899999999999999e-002 | M152: 115.2 | N152: 19.54 | O152: 0.58999999999999997 | P152: 59.57 | Q152: 34天 | R152: 5.59年 | S152: 3.59年 | T152: 14 | U152: 12 | V152: 9.0000000000000011e-003 | W152: 0.13600000000000001 | X152: 8.1000000000000003e-002 | Y152: 103 | Z152: 2.57 | AA152: 3.6400000000000002e-002 | AB152: 3.1200000000000002e-002 | AC152: 2.4700000000000003e-002 | AD152: 2.2700000000000001e-002 | AE152: 88.04 | AF152: 90.51 | AG152: 0.13 | AH152: AA | AI152: 4.4999999999999998e-002 | AJ152: =H152+100*O152 -> 153.69999999999999 | AK152: 129.8 | AL152: 229 | AM152: 39.3 | AN152: 238 | AO152: -0.11900000000000001 | AP152: 5 | AQ152: 崇达转2!
A153: 63 | B153: 123067 | C153: 斯莱转债 | D153: 300382 | E153: 斯莱克 | F153: 机械装备 | G153: 专用设备 | H153: 99.595 | I153: -5.6299999999999996e-002 | J153: 8.3000000000000001e-003 | K153: 8.49 | L153: -8.2200000000000009e-002 | M153: 121.2 | N153: 9.38 | O153: 0.10000000000000001 | P153: 90.51 | Q153: 46天 | R153: 5.61年 | S153: 3.61年 | T153: 3.88 | U153: 12 | V153: 3.1e-002 | W153: 8.1000000000000003e-002 | X153: 7.2999999999999995e-002 | Y153: 48 | Z153: 4.7 | AA153: 3.6400000000000002e-002 | AB153: 2.9600000000000001e-002 | AC153: 1.1899999999999999e-002 | AD153: 9.7999999999999997e-003 | AE153: 81.99 | AF153: 85.32 | AG153: 0.58 | AH153: AA- | AI153: 6.6000000000000003e-002 | AJ153: =H153+100*O153 -> 109.595 | AK153: 108.7 | AL153: 72 | AM153: 23.4 | AN153: 124 | AO153: 6.9999999999999993e-003 | AP153: 14 | AQ153: 斯莱转债
A154: 296 | B154: 128039 | C154: 三力转债! | D154: 2224 | E154: 三 力 士 | F154: 机械装备 | G154: 专用设备 | H154: 97.715 | I154: -1.4999999999999999e-002 | J154: -2.5000000000000001e-003 | K154: 5.26 | L154: -3.49e-002 | M154: 109.8 | N154: 5.81 | O154: 7.9000000000000001e-002 | P154: 90.53 | Q154: 转股中 | R154: 3.34年 | S154: 1.34年 | T154: 2.03 | U154: 8.5 | V154: 4.2999999999999997e-002 | W154: 5.2999999999999999e-002 | X154: 4.8000000000000001e-002 | Y154: 38 | Z154: 1.64 | AA154: 3.6299999999999999e-002 | AB154: 3.0499999999999999e-002 | AC154: 3.2899999999999999e-002 | AD154: 2.9399999999999999e-002 | AE154: 93.41 | AF154: 89.44 | AG154: 0.5 | AH154: AA- | AI154: 6.4699999999999994e-002 | AJ154: =H154+100*O154 -> 105.61500000000001 | AK154: 104.9 | AL154: 37 | AM154: 11.5 | AN154: 29 | AO154: -3.1e-002 | AP154: 25 | AQ154: 三力转债!
A155: 325 | B155: 128018 | C155: 时达转债! | D155: 2527 | E155: 新时达 | F155: 机械装备 | G155: 机器人及 | H155: 99.3 | I155: 4.7999999999999996e-003 | J155: -3.8e-003 | K155: 5.21 | L155: 9.7000000000000003e-003 | M155: 109.3 | N155: 7.42 | O155: 0.41399999999999998 | P155: 70.22 | Q155: 转股中 | R155: 2.75年 | S155: 0.75年 | T155: 8.8 | U155: 5.1 | V155: 6.0000000000000001e-003 | W155: 0.27200000000000002 | X155: 0.191 | Y155: 32 | Z155: 1.27 | AA155: 3.61e-002 | AB155: 2.9500000000000002e-002 | AC155: 2.76e-002 | AD155: 2.3599999999999999e-002 | AE155: 98.03 | AF155: 97.76 | AG155: 0.1 | AH155: AA | AI155: 4.2099999999999999e-002 | AJ155: =H155+100*O155 -> 140.69999999999999 | AK155: 128.4 | AL155: 217 | AM155: 30.4 | AN155: 186 | AO155: -4.4000000000000004e-002 | AP155: 41 | AQ155: 时达转债!
A156: 155 | B156: 113033 | C156: 利群转债! | D156: 601366 | E156: 利群股份 | F156: 商业零售 | G156: 商场 | H156: 96.53 | I156: -1.38e-002 | J156: 6.6e-003 | K156: 6.5 | L156: -1.37e-002 | M156: 115.3 | N156: 7.01 | O156: 4.0999999999999995e-002 | P156: 92.72 | Q156: 转股中 | R156: 5年55天 | S156: 3年55天 | T156: 18 | U156: 10 | V156: 6.0000000000000001e-003 | W156: 0.32200000000000001 | X156: 0.29799999999999999 | Y156: 56 | Z156: 1.25 | AA156: 3.5900000000000001e-002 | AB156: 3.0200000000000001e-002 | AC156: 2.2400000000000003e-002 | AD156: 2.e-002 | AE156: 89.85 | AF156: 92.36 | AG156: 0.53 | AH156: AA | AI156: 4.4999999999999998e-002 | AJ156: =H156+100*O156 -> 100.63 | AK156: 100.3 | AL156: 19 | AM156: 8 | AN156: 14 | AO156: -3.7000000000000005e-002 | AP156: 41 | AQ156: 利群转债!
A157: 323 | B157: 110038 | C157: 济川转债! | D157: 600566 | E157: 济川药业 | F157: 医药 | G157: 中药 | H157: 101.17 | I157: 5.9999999999999995e-004 | J157: -1.7000000000000001e-003 | K157: 18.96 | L157: -8.3999999999999995e-003 | M157: 107.5 | N157: 23.85 | O157: 0.27300000000000002 | P157: 79.5 | Q157: 转股中 | R157: 1.77年 | S157: 回售内 | T157: 6.28 | U157: 5.9 | V157: 9.0000000000000011e-003 | W157: 3.7000000000000005e-002 | X157: 2.9999999999999999e-002 | Y157: 168 | Z157: 2.29 | AA157: 3.5200000000000002e-002 | AB157: 2.69e-002 | AC157: 回售内 | AD157: 回售内 | AE157: 100.25 | AF157: 99.99 | AG157: 0.13 | AH157: AA | AI157: 4.2099999999999999e-002 | AJ157: =H157+100*O157 -> 128.47 | AK157: 122.8 | AL157: 189 | AM157: 22.6 | AN157: 114 | AO157: -3.3000000000000002e-002 | AP157: 22 | AQ157: 济川转债!
A158: 21 | B158: 113612 | C158: 永冠转债 | D158: 603681 | E158: 永冠新材 | F158: 化工 | G158: 其他 | H158: 99.83 | I158: -1.72e-002 | J158: -2.2000000000000001e-003 | K158: 19.4 | L158: -3.0499999999999999e-002 | M158: 121.2 | N158: 20.79 | O158: 7.0000000000000007e-002 | P158: 93.31 | Q158: 4月9天 | R158: 5.84年 | S158: 3.84年 | T158: 5.2 | U158: 10 | V158: 2.e-002 | W158: 0.161 | X158: 0.14999999999999999 | Y158: 32 | Z158: 2.19 | AA158: 3.4500000000000003e-002 | AB158: 2.7999999999999997e-002 | AC158: 1.0700000000000001e-002 | AD158: 8.6e-003 | AE158: 80.83 | AF158: 84.11 | AG158: 0.64 | AH158: AA- | AI158: 6.6000000000000003e-002 | AJ158: =H158+100*O158 -> 106.83 | AK158: 106.3 | AL158: 50 | AM158: 22.2 | AN158: 110 | AO158: -1.e-002 | AP158: 3 | AQ158: 永冠转债
A159: 224 | B159: 128071 | C159: 合兴转债! | D159: 2228 | E159: 合兴包装 | F159: 造纸包装 | G159: 包装材料 | H159: 99.01 | I159: -4.0599999999999997e-002 | J159: 2.7799999999999998e-002 | K159: 3.85 | L159: -2.7799999999999998e-002 | M159: 114.8 | N159: 4.28 | O159: 0.10099999999999999 | P159: 89.95 | Q159: 转股中 | R159: 4.53年 | S159: 2.53年 | T159: 3 | U159: 6.2 | V159: 2.1000000000000001e-002 | W159: 6.3e-002 | X159: 5.7000000000000002e-002 | Y159: 48 | Z159: 1.43 | AA159: 3.39e-002 | AB159: 2.7699999999999999e-002 | AC159: 1.6e-002 | AD159: 1.3600000000000001e-002 | AE159: 92.16 | AF159: 94.95 | AG159: 0.46 | AH159: AA | AI159: 4.3700000000000003e-002 | AJ159: =H159+100*O159 -> 109.11 | AK159: 108.1 | AL159: 68 | AM159: 13.1 | AN159: 41 | AO159: -1.2e-002 | AP159: 26 | AQ159: 合兴转债!
A160: 188 | B160: 123038 | C160: 联得转债! | D160: 300545 | E160: 联得装备 | F160: 机械装备 | G160: 专用设备 | H160: 101.253 | I160: -6.0700000000000004e-002 | J160: 2.41e-002 | K160: 21.18 | L160: -6.9400000000000003e-002 | M160: 118.6 | N160: 25.29 | O160: 0.20899999999999999 | P160: 83.75 | Q160: 转股中 | R160: 4.89年 | S160: 2.89年 | T160: 1.47 | U160: 25 | V160: 0.159 | W160: 4.7e-002 | X160: 4.0000000000000001e-002 | Y160: 31 | Z160: 4.04 | AA160: 3.3599999999999998e-002 | AB160: 2.6600000000000002e-002 | AC160: 8.3999999999999995e-003 | AD160: 5.8999999999999999e-003 | AE160: 83.31 | AF160: 83.67 | AG160: 0.53 | AH160: A+ | AI160: 7.5700000000000003e-002 | AJ160: =H160+100*O160 -> 122.15299999999999 | AK160: 118.8 | AL160: 164 | AM160: 35.1 | AN160: 213 | AO160: -0.106 | AP160: 18 | AQ160: 联得转债!
A161: 30 | B161: 123078 | C161: 飞凯转债 | D161: 300398 | E161: 飞凯材料 | F161: 化工 | G161: 化工 | H161: 95.52 | I161: -3.0999999999999999e-003 | J161: 1.7000000000000001e-003 | K161: 14.11 | L161: -4.1999999999999997e-003 | M161: 115.2 | N161: 19.34 | O161: 0.309 | P161: 72.96 | Q161: 3月28天 | R161: 5.81年 | S161: 3.81年 | T161: 8.25 | U161: 19 | V161: 2.4e-002 | W161: 0.113 | X161: 8.3000000000000004e-002 | Y161: 73 | Z161: 2.81 | AA161: 3.3399999999999999e-002 | AB161: 2.8500000000000001e-002 | AC161: 2.1099999999999997e-002 | AD161: 1.9199999999999998e-002 | AE161: 87.19 | AF161: 89.63 | AG161: 0.32 | AH161: AA | AI161: 4.4999999999999998e-002 | AJ161: =H161+100*O161 -> 126.41999999999999 | AK161: 118.1 | AL161: 155 | AM161: 28.5 | AN161: 170 | AO161: -0.151 | AP161: 6 | AQ161: 飞凯转债
A162: 210 | B162: 110059 | C162: 浦发转债! | D162: 600000 | E162: 浦发银行 | F162: 金融 | G162: 银行行业 | H162: 101.44 | I162: 2.3999999999999998e-003 | J162: 7.9000000000000008e-003 | K162: 10.72 | L162: 4.2800000000000005e-002 | M162: 117.6 | N162: 14.45 | O162: 0.36700000000000005 | P162: 74.19 | Q162: 转股中 | R162: 4.73年 | S162: 无权 | T162: 500 | U162: 605 | V162: 1.2e-002 | W162: 0.159 | X162: 0.11800000000000001 | Y162: 3147. | Z162: 0.62 | AA162: 3.27e-002 | AB162: 2.5699999999999997e-002 | AC162: 无权 | AD162: 无权 | AE162: 无权 | AF162: 98.77 | AG162: 0.24 | AH162: AAA | AI162: 3.8699999999999998e-002 | AJ162: =H162+100*O162 -> 138.13999999999999 | AK162: 128.7 | AL162: 220 | AM162: 29.9 | AN162: 182 | AO162: 7.8e-002 | AP162: 75 | AQ162: 浦发转债!
A163: 207 | B163: 123033 | C163: 金力转债! | D163: 300748 | E163: 金力永磁 | F163: 电子 | G163: 元器件制 | H163: 104.95 | I163: -3.8100000000000002e-002 | J163: 7.1999999999999998e-003 | K163: 31.72 | L163: -8.539999999999999e-002 | M163: 121.5 | N163: 40.68 | O163: 0.34600000000000003 | P163: 77.97 | Q163: 转股中 | R163: 4.74年 | S163: 2.74年 | T163: 4.35 | U163: 13 | V163: 2.7000000000000003e-002 | W163: 3.2000000000000001e-002 | X163: 2.5000000000000001e-002 | Y163: 137 | Z163: 9.82 | AA163: 3.2300000000000002e-002 | AB163: 2.41e-002 | AC163: 2.0000000000000001e-004 | AD163: -3.2000000000000002e-003 | AE163: 87.76 | AF163: 91.05 | AG163: 0.36 | AH163: AA- | AI163: 6.4699999999999994e-002 | AJ163: =H163+100*O163 -> 139.55000000000001 | AK163: 131.9 | AL163: 245 | AM163: 40.9 | AN163: 244 | AO163: -0.159 | AP163: 28 | AQ163: 金力转债!
A164: 198 | B164: 128083 | C164: 新北转债! | D164: 2376 | E164: 新北洋 | F164: 电子 | G164: 电子产品 | H164: 98.79 | I164: -7.0999999999999995e-003 | J164: 1.9400000000000001e-002 | K164: 9.89 | L164: 3.0200000000000001e-002 | M164: 114.9 | N164: 11.7 | O164: 0.16899999999999998 | P164: 84.53 | Q164: 转股中 | R164: 4.85年 | S164: 2.85年 | T164: 8.77 | U164: 16 | V164: 1.8000000000000002e-002 | W164: 0.13300000000000001 | X164: 0.113 | Y164: 66 | Z164: 1.95 | AA164: 3.2199999999999999e-002 | AB164: 2.6499999999999999e-002 | AC164: 1.54e-002 | AD164: 1.3100000000000001e-002 | AE164: 90.99 | AF164: 93.74 | AG164: 0.4 | AH164: AA | AI164: 4.3700000000000003e-002 | AJ164: =H164+100*O164 -> 115.69 | AK164: 113.1 | AL164: 105 | AM164: 19.3 | AN164: 73 | AO164: 2.9999999999999999e-002 | AP164: 19 | AQ164: 新北转债!
A165: 138 | B165: 113579 | C165: 健友转债! | D165: 603707 | E165: 健友股份 | F165: 医药 | G165: 原料药 | H165: 97.13 | I165: -8.0100000000000005e-002 | J165: 8.2799999999999999e-002 | K165: 31.51 | L165: 8.6e-003 | M165: 114.2 | N165: 42.05 | O165: 0.29600000000000004 | P165: 74.93 | Q165: 转股中 | R165: 5.21年 | S165: 3.21年 | T165: 5.03 | U165: 107 | V165: 0.19399999999999998 | W165: 1.7000000000000001e-002 | X165: 1.3000000000000001e-002 | Y165: 294 | Z165: 8.59 | AA165: 3.2199999999999999e-002 | AB165: 2.7000000000000003e-002 | AC165: 1.9799999999999998e-002 | AD165: 1.7500000000000002e-002 | AE165: 89.51 | AF165: 91.22 | AG165: 0.31 | AH165: AA | AI165: 4.4999999999999998e-002 | AJ165: =H165+100*O165 -> 126.73 | AK165: 119.3 | AL165: 166 | AM165: 28.1 | AN165: 168 | AO165: -3.7000000000000005e-002 | AP165: 8 | AQ165: 健友转债!
A166: 261 | B166: 113021 | C166: 中信转债! | D166: 601998 | E166: 中信银行 | F166: 金融 | G166: 银行行业 | H166: 105.15 | I166: 5.0000000000000001e-004 | J166: 7.4999999999999997e-003 | K166: 5.39 | L166: 3.4500000000000003e-002 | M166: 118.8 | N166: 6.98 | O166: 0.36200000000000004 | P166: 77.22 | Q166: 转股中 | R166: 4年27天 | S166: 无权 | T166: 400 | U166: 66 | V166: 2.e-003 | W166: 0.152 | X166: 0.11699999999999999 | Y166: 2638. | Z166: 0.58 | AA166: 3.15e-002 | AB166: 2.29e-002 | AC166: 无权 | AD166: 无权 | AE166: 无权 | AF166: 102.29 | AG166: 0.23 | AH166: AAA | AI166: 3.8699999999999998e-002 | AJ166: =H166+100*O166 -> 141.35000000000002 | AK166: 133.1 | AL166: 252 | AM166: 30.8 | AN166: 190 | AO166: 4.2000000000000003e-002 | AP166: 51 | AQ166: 中信转债!
A167: 322 | B167: 123002 | C167: 国祯转债!! | D167: 300388 | E167: 节能国祯 | F167: 城市公用 | G167: 三废处理 | H167: 100 | I167: -3.4999999999999996e-003 | J167: -3.0000000000000001e-003 | K167: 7.43 | L167: -1.8500000000000003e-002 | M167: 108.8 | N167: 8.48 | O167: 0.14099999999999999 | P167: 87.62 | Q167: 转股中 | R167: 2.80年 | S167: 0.80年 | T167: 2.52 | U167: 21 | V167: 8.1000000000000003e-002 | W167: 4.9000000000000002e-002 | X167: 4.2999999999999997e-002 | Y167: 52 | Z167: 1.37 | AA167: 3.1e-002 | AB167: 2.4900000000000002e-002 | AC167: 1.61e-002 | AD167: 1.29e-002 | AE167: 97.59 | AF167: 97.09 | AG167: 0.35 | AH167: AA | AI167: 4.2099999999999999e-002 | AJ167: =H167+100*O167 -> 114.09999999999999 | AK167: 112.4 | AL167: 94 | AM167: 14.8 | AN167: 51 | AO167: -0.13699999999999998 | AP167: 15 | AQ167: 国祯转债!!
A168: 234 | B168: 113536 | C168: 三星转债 | D168: 603578 | E168: 三星新材 | F168: 家电 | G168: 零部件制 | H168: 100.91 | I168: -1.0700000000000001e-002 | J168: 2.8000000000000004e-003 | K168: 18.18 | L168: -1.6200000000000003e-002 | M168: 114.8 | N168: 19.54 | O168: 8.5000000000000006e-002 | P168: 93.04 | Q168: 转股中 | R168: 4.32年 | S168: 2.32年 | T168: 1.49 | U168: 4.6 | V168: 2.9999999999999999e-002 | W168: 8.900000000000001e-002 | X168: 8.3000000000000004e-002 | Y168: 17 | Z168: 2.39 | AA168: 3.1e-002 | AB168: 2.4500000000000001e-002 | AC168: 9.5999999999999992e-003 | AD168: 6.8999999999999999e-003 | AE168: 93 | AF168: 95.81 | AG168: 0.49 | AH168: AA | AI168: 4.3700000000000003e-002 | AJ168: =H168+100*O168 -> 109.41 | AK168: 108.8 | AL168: 73 | AM168: 13 | AN168: 40 | AO168: -0.105 | AP168: 38 | AQ168: 三星转债
A169: 301 | B169: 127006 | C169: 敖东转债! | D169: 623 | E169: 吉林敖东 | F169: 金融 | G169: 证券行业 | H169: 98.599 | I169: -2.8999999999999998e-003 | J169: 3.4000000000000002e-003 | K169: 15.05 | L169: 2.7000000000000001e-003 | M169: 108 | N169: 20.42 | O169: 0.33799999999999997 | P169: 73.7 | Q169: 转股中 | R169: 3年36天 | S169: 1年36天 | T169: 24.1 | U169: 16 | V169: 6.9999999999999993e-003 | W169: 0.13800000000000001 | X169: 0.10099999999999999 | Y169: 175 | Z169: 0.77 | AA169: 3.0299999999999997e-002 | AB169: 2.52e-002 | AC169: 2.4700000000000003e-002 | AD169: 2.2000000000000002e-002 | AE169: 96.58 | AF169: 95.34 | AG169: 0.16 | AH169: AA+ | AI169: 4.1700000000000001e-002 | AJ169: =H169+100*O169 -> 132.399 | AK169: 123.5 | AL169: 193 | AM169: 26.9 | AN169: 153 | AO169: -5.7000000000000002e-002 | AP169: 26 | AQ169: 敖东转债!
A170: 209 | B170: 110060 | C170: 天路转债! | D170: 600326 | E170: 西藏天路 | F170: 建筑 | G170: 水泥 | H170: 100.15 | I170: -6.4000000000000003e-003 | J170: 3.0999999999999999e-003 | K170: 6.13 | L170: -8.1000000000000013e-003 | M170: 114.9 | N170: 7.16 | O170: 0.17000000000000001 | P170: 85.61 | Q170: 转股中 | R170: 4.73年 | S170: 2.73年 | T170: 7.06 | U170: 8.7 | V170: 1.2e-002 | W170: 0.125 | X170: 0.107 | Y170: 56 | Z170: 1.51 | AA170: 3.0099999999999998e-002 | AB170: 2.4199999999999999e-002 | AC170: 1.1200000000000002e-002 | AD170: 8.8999999999999999e-003 | AE170: 91.47 | AF170: 94.24 | AG170: 0.41 | AH170: AA | AI170: 4.3700000000000003e-002 | AJ170: =H170+100*O170 -> 117.15000000000001 | AK170: 114.7 | AL170: 125 | AM170: 20.4 | AN170: 84 | AO170: -9.3000000000000013e-002 | AP170: 13 | AQ170: 天路转债!
A171: 174 | B171: 113564 | C171: 天目转债 | D171: 603136 | E171: 天目湖 | F171: 旅游餐饮 | G171: 旅游 | H171: 109.66 | I171: -6.6e-003 | J171: 6.7199999999999996e-002 | K171: 24.55 | L171: 8.8699999999999987e-002 | M171: 126.7 | N171: 23.1 | O171: 3.2000000000000001e-002 | P171: 106.28 | Q171: 转股中 | R171: 5年23天 | S171: 3年23天 | T171: 2.87 | U171: 98 | V171: 0.30299999999999999 | W171: 0.10000000000000001 | X171: 0.107 | Y171: 29 | Z171: 3.06 | AA171: 2.9700000000000001e-002 | AB171: 2.06e-002 | AC171: -1.47e-002 | AD171: -1.7399999999999999e-002 | AE171: 85.37 | AF171: 92.42 | AG171: 0.68 | AH171: AA- | AI171: 6.6000000000000003e-002 | AJ171: =H171+100*O171 -> 112.86 | AK171: 113 | AL171: 104 | AM171: 20.6 | AN171: 86 | AO171: 0.10800000000000001 | AP171: 14 | AQ171: 天目转债
A172: 186 | B172: 128090 | C172: 汽模转2 | D172: 2510 | E172: 天汽模 | F172: 汽车 | G172: 零部件制 | H172: 99.89 | I172: 3.4000000000000002e-003 | J172: 5.0000000000000001e-004 | K172: 3.88 | L172: 7.8000000000000005e-003 | M172: 114.9 | N172: 4.21 | O172: 8.4000000000000005e-002 | P172: 92.16 | Q172: 转股中 | R172: 4.89年 | S172: 2.89年 | T172: 3.1 | U172: 45 | V172: 0.14499999999999999 | W172: 8.4000000000000005e-002 | X172: 7.6999999999999999e-002 | Y172: 37 | Z172: 1.34 | AA172: 2.9600000000000001e-002 | AB172: 2.3900000000000001e-002 | AC172: 1.15e-002 | AD172: 9.1999999999999998e-003 | AE172: 90.83 | AF172: 93.58 | AG172: 0.51 | AH172: AA | AI172: 4.3700000000000003e-002 | AJ172: =H172+100*O172 -> 108.29000000000001 | AK172: 107.6 | AL172: 58 | AM172: 14 | AN172: 46 | AO172: -0.109 | AP172: 27 | AQ172: 汽模转2
A173: 89 | B173: 123062 | C173: 三超转债 | D173: 300554 | E173: 三超新材 | F173: 机械装备 | G173: 通用设备 | H173: 102.4 | I173: -3.9399999999999998e-002 | J173: 1.5100000000000001e-002 | K173: 17.03 | L173: -3.1800000000000002e-002 | M173: 119.7 | N173: 17.17 | O173: 3.2000000000000001e-002 | P173: 99.18 | Q173: 转股中 | R173: 5.47年 | S173: 3.47年 | T173: 1.95 | U173: 254 | V173: 1.22 | W173: 0.122 | X173: 0.121 | Y173: 16 | Z173: 3.05 | AA173: 2.9600000000000001e-002 | AB173: 2.3099999999999999e-002 | AC173: 6.0000000000000001e-003 | AD173: 3.4999999999999996e-003 | AE173: 77.53 | AF173: 76.71 | AG173: 0.76 | AH173: A | AI173: 8.6999999999999994e-002 | AJ173: =H173+100*O173 -> 105.60000000000001 | AK173: 105.6 | AL173: 43 | AM173: 28.1 | AN173: 164 | AO173: -7.0000000000000007e-002 | AP173: 15 | AQ173: 三超转债
A174: 284 | B174: 113516 | C174: 苏农转债! | D174: 603323 | E174: 苏农银行 | F174: 金融 | G174: 银行行业 | H174: 103.5 | I174: 1.5700000000000002e-002 | J174: 3.2000000000000002e-003 | K174: 4.8 | L174: 5.2600000000000001e-002 | M174: 114.3 | N174: 5.52 | O174: 0.19 | P174: 86.96 | Q174: 转股中 | R174: 3.49年 | S174: 无权 | T174: 12.9 | U174: 90 | V174: 6.6000000000000003e-002 | W174: 0.14899999999999999 | X174: 0.13 | Y174: 87 | Z174: 0.73 | AA174: 2.9399999999999999e-002 | AB174: 2.18e-002 | AC174: 无权 | AD174: 无权 | AE174: 无权 | AF174: 99.4 | AG174: 0.36 | AH174: AA+ | AI174: 4.1700000000000001e-002 | AJ174: =H174+100*O174 -> 122.5 | AK174: 120 | AL174: 168 | AM174: 20.6 | AN174: 88 | AO174: 1.2e-002 | AP174: 34 | AQ174: 苏农转债!
A175: 90 | B175: 128123 | C175: 国光转债! | D175: 2749 | E175: 国光股份 | F175: 化工 | G175: 农化 | H175: 99.5 | I175: 4.0000000000000001e-003 | J175: -2.0999999999999999e-003 | K175: 9.79 | L175: 5.1000000000000004e-003 | M175: 116.2 | N175: 13.7 | O175: 0.39200000000000002 | P175: 71.46 | Q175: 转股中 | R175: 5.47年 | S175: 3.47年 | T175: 3.2 | U175: 3.4 | V175: 1.1000000000000001e-002 | W175: 7.5999999999999998e-002 | X175: 5.4000000000000006e-002 | Y175: 42 | Z175: 3.43 | AA175: 2.9399999999999999e-002 | AB175: 2.3900000000000001e-002 | AC175: 1.2699999999999999e-002 | AD175: 1.04e-002 | AE175: 82.75 | AF175: 82.58 | AG175: 0.37 | AH175: AA- | AI175: 6.6000000000000003e-002 | AJ175: =H175+100*O175 -> 138.69999999999999 | AK175: 127.5 | AL175: 213 | AM175: 44.8 | AN175: 259 | AO175: -3.9e-002 | AP175: 9 | AQ175: 国光转债!
A176: 197 | B176: 110063 | C176: 鹰19转债 | D176: 600567 | E176: 山鹰国际 | F176: 造纸包装 | G176: 包装用纸 | H176: 101 | I176: -1.4800000000000001e-002 | J176: 1.4800000000000001e-002 | K176: 3.02 | L176: 0. | M176: 115.9 | N176: 3.3 | O176: 0.10400000000000001 | P176: 91.52 | Q176: 转股中 | R176: 4.85年 | S176: 2.85年 | T176: 18.6 | U176: 13 | V176: 6.9999999999999993e-003 | W176: 0.13400000000000001 | X176: 0.12300000000000001 | Y176: 139 | Z176: 0.94 | AA176: 2.9300000000000003e-002 | AB176: 2.3199999999999998e-002 | AC176: 7.3000000000000001e-003 | AD176: 5.1999999999999998e-003 | AE176: 91.34 | AF176: 95.39 | AG176: 0.47 | AH176: AA+ | AI176: 4.1700000000000001e-002 | AJ176: =H176+100*O176 -> 111.40000000000001 | AK176: 110.5 | AL176: 85 | AM176: 15.1 | AN176: 55 | AO176: -3.7000000000000005e-002 | AP176: 41 | AQ176: 鹰19转债
A177: 87 | B177: 128124 | C177: 科华转债! | D177: 2022 | E177: 科华生物 | F177: 医药 | G177: 生物制药 | H177: 95 | I177: -1.e-004 | J177: -3.2000000000000002e-003 | K177: 15.21 | L177: -1.11e-002 | M177: 110.3 | N177: 21.51 | O177: 0.34299999999999997 | P177: 70.71 | Q177: 转股中 | R177: 5.48年 | S177: 3.48年 | T177: 7.38 | U177: 3.7 | V177: 5.0000000000000001e-003 | W177: 9.4e-002 | X177: 6.7000000000000004e-002 | Y177: 78 | Z177: 2.72 | AA177: 2.81e-002 | AB177: 2.4399999999999998e-002 | AC177: 2.2799999999999997e-002 | AD177: 2.1099999999999997e-002 | AE177: 87.91 | AF177: 87.03 | AG177: 0.29 | AH177: AA | AI177: 4.4999999999999998e-002 | AJ177: =H177+100*O177 -> 129.30000000000001 | AK177: 119.3 | AL177: 165 | AM177: 31.4 | AN177: 194 | AO177: -9.6000000000000002e-002 | AP177: 15 | AQ177: 科华转债!
A178: 148 | B178: 123048 | C178: 应急转债! | D178: 300527 | E178: 中船应急 | F178: 机械装备 | G178: 专用设备 | H178: 98.51 | I178: -4.8999999999999998e-003 | J178: 3.8e-003 | K178: 7.67 | L178: -2.5999999999999999e-003 | M178: 113.1 | N178: 8.9 | O178: 0.14300000000000002 | P178: 86.18 | Q178: 转股中 | R178: 5.18年 | S178: 3.18年 | T178: 3.8 | U178: 46 | V178: 0.121 | W178: 5.0999999999999997e-002 | X178: 4.4000000000000004e-002 | Y178: 74 | Z178: 2.97 | AA178: 2.76e-002 | AB178: 2.2799999999999997e-002 | AC178: 1.5300000000000001e-002 | AD178: 1.32e-002 | AE178: 90.12 | AF178: 91.35 | AG178: 0.46 | AH178: AA+ | AI178: 4.2999999999999997e-002 | AJ178: =H178+100*O178 -> 112.81 | AK178: 110.8 | AL178: 88 | AM178: 19.5 | AN178: 74 | AO178: -0.14099999999999999 | AP178: 16 | AQ178: 应急转债!
A179: 161 | B179: 128101 | C179: 联创转债! | D179: 2036 | E179: 联创电子 | F179: 电子 | G179: 液晶显示 | H179: 100.6 | I179: -7.4999999999999997e-003 | J179: -1.4000000000000002e-003 | K179: 9.77 | L179: -3.6499999999999998e-002 | M179: 115.1 | N179: 13.86 | O179: 0.42700000000000005 | P179: 70.49 | Q179: 转股中 | R179: 5年39天 | S179: 3年39天 | T179: 3 | U179: 13 | V179: 4.0999999999999995e-002 | W179: 2.8999999999999998e-002 | X179: 2.1000000000000001e-002 | Y179: 102 | Z179: 3.47 | AA179: 2.7300000000000001e-002 | AB179: 2.1700000000000001e-002 | AC179: 9.1000000000000004e-003 | AD179: 6.8999999999999999e-003 | AE179: 89.82 | AF179: 92.34 | AG179: 0.24 | AH179: AA | AI179: 4.4999999999999998e-002 | AJ179: =H179+100*O179 -> 143.30000000000001 | AK179: 130.7 | AL179: 235 | AM179: 38.4 | AN179: 234 | AO179: -8.900000000000001e-002 | AP179: 16 | AQ179: 联创转债!
A180: 259 | B180: 128057 | C180: 博彦转债 | D180: 2649 | E180: 博彦科技 | F180: 计算机及 | G180: 软件开发 | H180: 105.5 | I180: 5.6999999999999993e-003 | J180: -2.4500000000000001e-002 | K180: 8.5 | L180: -3.0800000000000001e-002 | M180: 117.1 | N180: 8.72 | O180: 8.199999999999999e-002 | P180: 97.48 | Q180: 转股中 | R180: 4年28天 | S180: 2年28天 | T180: 5.1 | U180: 9 | V180: 1.7000000000000001e-002 | W180: 0.113 | X180: 0.11 | Y180: 45 | Z180: 1.59 | AA180: 2.6499999999999999e-002 | AB180: 1.8799999999999997e-002 | AC180: -8.199999999999999e-003 | AD180: -1.1299999999999999e-002 | AE180: 90.19 | AF180: 91.26 | AG180: 0.61 | AH180: AA- | AI180: 6.4699999999999994e-002 | AJ180: =H180+100*O180 -> 113.7 | AK180: 113.5 | AL180: 110 | AM180: 22.3 | AN180: 111 | AO180: -5.4000000000000006e-002 | AP180: 28 | AQ180: 博彦转债
A181: 19 | B181: 123083 | C181: 朗新转债 | D181: 300682 | E181: 朗新科技 | F181: 计算机及 | G181: 软件开发 | H181: 99.1 | I181: -9.0000000000000011e-003 | J181: 1.1699999999999999e-002 | K181: 12.61 | L181: 6.4000000000000003e-003 | M181: 115.1 | N181: 15.57 | O181: 0.22399999999999998 | P181: 80.99 | Q181: 4月10天 | R181: 5.84年 | S181: 3.84年 | T181: 8 | U181: 10 | V181: 1.3000000000000001e-002 | W181: 6.2e-002 | X181: 5.0000000000000003e-002 | Y181: 129 | Z181: 2.7 | AA181: 2.64e-002 | AB181: 2.1600000000000001e-002 | AC181: 1.1200000000000002e-002 | AD181: 9.3999999999999986e-003 | AE181: 86.97 | AF181: 89.4 | AG181: 0.42 | AH181: AA | AI181: 4.4999999999999998e-002 | AJ181: =H181+100*O181 -> 121.5 | AK181: 117.2 | AL181: 148 | AM181: 27.8 | AN181: 159 | AO181: -6.9000000000000006e-002 | AP181: 3 | AQ181: 朗新转债
A182: 311 | B182: 110041 | C182: 蒙电转债! | D182: 600863 | E182: 内蒙华电 | F182: 能源电力 | G182: 电力供应 | H182: 101.59 | I182: 0. | J182: -3.4000000000000002e-003 | K182: 2.19 | L182: -1.3500000000000002e-002 | M182: 109.3 | N182: 2.69 | O182: 0.248 | P182: 81.41 | Q182: 转股中 | R182: 2.88年 | S182: 0.88年 | T182: 18.7 | U182: 7.1 | V182: 4.0000000000000001e-003 | W182: 0.14699999999999999 | X182: 0.12 | Y182: 127 | Z182: 1.08 | AA182: 2.6200000000000001e-002 | AB182: 1.9900000000000001e-002 | AC182: 2.e-003 | AD182: -1.4000000000000002e-003 | AE182: 98.01 | AF182: 98.59 | AG182: 0.25 | AH182: AAA | AI182: 3.7100000000000001e-002 | AJ182: =H182+100*O182 -> 126.39 | AK182: 121.8 | AL182: 183 | AM182: 23.2 | AN182: 122 | AO182: -8.4000000000000005e-002 | AP182: 10 | AQ182: 蒙电转债!
A183: 144 | B183: 123050 | C183: 聚飞转债 | D183: 300303 | E183: 聚飞光电 | F183: 电子 | G183: LED制 | H183: 108.94 | I183: -4.1999999999999997e-003 | J183: -2.5999999999999999e-003 | K183: 4.75 | L183: -1.2500000000000001e-002 | M183: 124.2 | N183: 5.18 | O183: 0.188 | P183: 91.7 | Q183: 转股中 | R183: 5.19年 | S183: 3.19年 | T183: 7.05 | U183: 15 | V183: 2.e-002 | W183: 0.11599999999999999 | X183: 0.106 | Y183: 61 | Z183: 2.62 | AA183: 2.6200000000000001e-002 | AB183: 1.8100000000000002e-002 | AC183: -1.3600000000000001e-002 | AD183: -1.5900000000000001e-002 | AE183: 84.26 | AF183: 89.84 | AG183: 0.55 | AH183: AA- | AI183: 6.6000000000000003e-002 | AJ183: =H183+100*O183 -> 127.73999999999999 | AK183: 126.2 | AL183: 208 | AM183: 36.3 | AN183: 223 | AO183: -0.11199999999999999 | AP183: 12 | AQ183: 聚飞转债
A184: 119 | B184: 113588 | C184: 润达转债! | D184: 603108 | E184: 润达医疗 | F184: 医药 | G184: 医疗器械 | H184: 99.98 | I184: -1.2e-002 | J184: 3.1800000000000002e-002 | K184: 10.91 | L184: 4.8000000000000001e-002 | M184: 114.2 | N184: 13.36 | O184: 0.22399999999999998 | P184: 81.66 | Q184: 转股中 | R184: 5.36年 | S184: 3.36年 | T184: 5.5 | U184: 20 | V184: 3.5000000000000003e-002 | W184: 8.6999999999999994e-002 | X184: 7.0999999999999994e-002 | Y184: 63 | Z184: 2.11 | AA184: 2.5600000000000001e-002 | AB184: 2.06e-002 | AC184: 1.0500000000000001e-002 | AD184: 8.3999999999999995e-003 | AE184: 88.92 | AF184: 90.62 | AG184: 0.41 | AH184: AA | AI184: 4.4999999999999998e-002 | AJ184: =H184+100*O184 -> 122.38 | AK184: 118.3 | AL184: 157 | AM184: 27.7 | AN184: 157 | AO184: -6.8000000000000005e-002 | AP184: 9 | AQ184: 润达转债!
A185: 227 | B185: 113541 | C185: 荣晟转债! | D185: 603165 | E185: 荣晟环保 | F185: 造纸包装 | G185: 包装用纸 | H185: 103.01 | I185: -2.18e-002 | J185: 1.38e-002 | K185: 11.9 | L185: -1.1599999999999999e-002 | M185: 115 | N185: 11.54 | O185: -1.e-003 | P185: 103.12 | Q185: 转股中 | R185: 4.46年 | S185: 2.46年 | T185: 2.72 | U185: 37 | V185: 0.13100000000000001 | W185: 8.9999999999999997e-002 | X185: 9.3000000000000013e-002 | Y185: 30 | Z185: 1.96 | AA185: 2.5499999999999998e-002 | AB185: 1.9299999999999998e-002 | AC185: 1.8e-003 | AD185: -8.0000000000000004e-004 | AE185: 87.95 | AF185: 87.48 | AG185: 0.69 | AH185: AA- | AI185: 6.4699999999999994e-002 | AJ185: =H185+100*O185 -> 102.91000000000001 | AK185: 102.9 | AL185: 28 | AM185: 15 | AN185: 52 | AO185: -5.2000000000000005e-002 | AP185: 48 | AQ185: 荣晟转债!
A186: 93 | B186: 113037 | C186: 紫银转债 | D186: 601860 | E186: 紫金银行 | F186: 金融 | G186: 银行行业 | H186: 101.19 | I186: 1.e-002 | J186: 3.8e-003 | K186: 3.9 | L186: 3.4500000000000003e-002 | M186: 115.8 | N186: 4.75 | O186: 0.23199999999999998 | P186: 82.11 | Q186: 转股中 | R186: 5.46年 | S186: 无权 | T186: 45 | U186: 65 | V186: 1.3999999999999999e-002 | W186: 0.315 | X186: 0.25900000000000001 | Y186: 143 | Z186: 1.01 | AA186: 2.5499999999999998e-002 | AB186: 2.0199999999999999e-002 | AC186: 无权 | AD186: 无权 | AE186: 无权 | AF186: 92.45 | AG186: 0.4 | AH186: AA+ | AI186: 4.2999999999999997e-002 | AJ186: =H186+100*O186 -> 124.39 | AK186: 120.3 | AL186: 171 | AM186: 27.8 | AN186: 160 | AO186: -2.5000000000000001e-002 | AP186: 17 | AQ186: 紫银转债
A187: 257 | B187: 110053 | C187: 苏银转债! | D187: 600919 | E187: 江苏银行 | F187: 金融 | G187: 银行行业 | H187: 107.8 | I187: 5.6000000000000008e-003 | J187: 3.7000000000000002e-003 | K187: 5.78 | L187: 2.6600000000000002e-002 | M187: 119.1 | N187: 6.69 | O187: 0.248 | P187: 86.4 | Q187: 转股中 | R187: 4年37天 | S187: 无权 | T187: 200 | U187: 167 | V187: 8.0000000000000002e-003 | W187: 0.23399999999999999 | X187: 0.20199999999999999 | Y187: 854 | Z187: 0.56 | AA187: 2.5399999999999999e-002 | AB187: 1.6899999999999998e-002 | AC187: 无权 | AD187: 无权 | AE187: 无权 | AF187: 102.45 | AG187: 0.35 | AH187: AAA | AI187: 3.8699999999999998e-002 | AJ187: =H187+100*O187 -> 132.59999999999999 | AK187: 129.2 | AL187: 225 | AM187: 26.7 | AN187: 152 | AO187: 5.2999999999999999e-002 | AP187: 45 | AQ187: 苏银转债!
A188: 179 | B188: 113563 | C188: 柳药转债 | D188: 603368 | E188: 柳药股份 | F188: 医药 | G188: 医药商业 | H188: 100 | I188: -6.9999999999999993e-003 | J188: 6.5000000000000006e-003 | K188: 20.29 | L188: -1.5e-003 | M188: 112.9 | N188: 24.47 | O188: 0.20600000000000002 | P188: 82.92 | Q188: 转股中 | R188: 4.95年 | S188: 2.95年 | T188: 8.02 | U188: 6.2 | V188: 8.0000000000000002e-003 | W188: 0.109 | X188: 8.9999999999999997e-002 | Y188: 74 | Z188: 1.53 | AA188: 2.53e-002 | AB188: 2.0400000000000001e-002 | AC188: 1.09e-002 | AD188: 8.6999999999999994e-003 | AE188: 90.62 | AF188: 91.74 | AG188: 0.41 | AH188: AA | AI188: 4.3700000000000003e-002 | AJ188: =H188+100*O188 -> 120.59999999999999 | AK188: 117.1 | AL188: 147 | AM188: 25.3 | AN188: 137 | AO188: -3.1e-002 | AP188: 17 | AQ188: 柳药转债
A189: 140 | B189: 128107 | C189: 交科转债 | D189: 2061 | E189: 浙江交科 | F189: 建筑 | G189: 建筑工程 | H189: 101.5 | I189: -1.4499999999999999e-002 | J189: 8.199999999999999e-003 | K189: 5.07 | L189: -1.1699999999999999e-002 | M189: 115.3 | N189: 5.36 | O189: 7.2999999999999995e-002 | P189: 94.59 | Q189: 转股中 | R189: 5.21年 | S189: 3.21年 | T189: 25 | U189: 27 | V189: 1.1000000000000001e-002 | W189: 0.35799999999999998 | X189: 0.33899999999999997 | Y189: 70 | Z189: 0.87 | AA189: 2.53e-002 | AB189: 1.9799999999999998e-002 | AC189: 6.7000000000000002e-003 | AD189: 4.5000000000000005e-003 | AE189: 90.19 | AF189: 93.03 | AG189: 0.54 | AH189: AA+ | AI189: 4.2999999999999997e-002 | AJ189: =H189+100*O189 -> 108.8 | AK189: 108.4 | AL189: 70 | AM189: 15.4 | AN189: 57 | AO189: 2.e-003 | AP189: 16 | AQ189: 交科转债
A190: 191 | B190: 113559 | C190: 永创转债! | D190: 603901 | E190: 永创智能 | F190: 机械装备 | G190: 专用设备 | H190: 105.09 | I190: 1.83e-002 | J190: 4.4999999999999998e-002 | K190: 9.97 | L190: 0.10000000000000001 | M190: 118.3 | N190: 10.32 | O190: 8.8000000000000009e-002 | P190: 96.61 | Q190: 转股中 | R190: 4.88年 | S190: 2.88年 | T190: 5.1 | U190: 152 | V190: 0.27699999999999997 | W190: 0.11599999999999999 | X190: 0.11199999999999999 | Y190: 44 | Z190: 3.17 | AA190: 2.52e-002 | AB190: 1.83e-002 | AC190: -2.2000000000000001e-003 | AD190: -5.0000000000000001e-003 | AE190: 86.44 | AF190: 87.78 | AG190: 0.63 | AH190: AA- | AI190: 6.4699999999999994e-002 | AJ190: =H190+100*O190 -> 113.89 | AK190: 113.6 | AL190: 111 | AM190: 25.8 | AN190: 143 | AO190: 0.11800000000000001 | AP190: 22 | AQ190: 永创转债!
A191: 180 | B191: 128094 | C191: 星帅转债 | D191: 2860 | E191: 星帅尔 | F191: 家电 | G191: 零部件制 | H191: 107.299 | I191: -1.3000000000000001e-002 | J191: 1.5e-003 | K191: 15.02 | L191: -1.5100000000000001e-002 | M191: 121 | N191: 13.95 | O191: -3.0000000000000001e-003 | P191: 107.67 | Q191: 转股中 | R191: 4.95年 | S191: 2.95年 | T191: 2.8 | U191: 23 | V191: 7.5999999999999998e-002 | W191: 9.4e-002 | X191: 0.10099999999999999 | Y191: 30 | Z191: 3.21 | AA191: 2.5099999999999997e-002 | AB191: 1.7600000000000001e-002 | AC191: -9.7999999999999997e-003 | AD191: -1.23e-002 | AE191: 83.14 | AF191: 85.02 | AG191: 0.76 | AH191: A+ | AI191: 7.5700000000000003e-002 | AJ191: =H191+100*O191 -> 106.99900000000001 | AK191: 106.9 | AL191: 52 | AM191: 21.9 | AN191: 101 | AO191: 1.e-003 | AP191: 33 | AQ191: 星帅转债
A192: 52 | B192: 123072 | C192: 乐歌转债! | D192: 300729 | E192: 乐歌股份 | F192: 其他 | G192: 家居用品 | H192: 113.001 | I192: -4.9500000000000002e-002 | J192: 4.6300000000000001e-002 | K192: 34.26 | L192: -3.8699999999999998e-002 | M192: 129.6 | N192: 73.13 | O192: 1.4099999999999999 | P192: 46.85 | Q192: 2月21天 | R192: 5.71年 | S192: 3.71年 | T192: 1.42 | U192: 120 | V192: 0.72499999999999998 | W192: 2.9999999999999999e-002 | X192: 1.3999999999999999e-002 | Y192: 48 | Z192: 4.99 | AA192: 2.5000000000000001e-002 | AB192: 1.6299999999999999e-002 | AC192: -1.49e-002 | AD192: -1.8100000000000002e-002 | AE192: 80.38 | AF192: 85.97 | AG192: 0.08 | AH192: A+ | AI192: 7.6999999999999999e-002 | AJ192: =H192+100*O192 -> 254.001 | AK192: 179.2 | AL192: 314 | AM192: 93.2 | AN192: 314 | AO192: -0.111 | AP192: 6 | AQ192: 乐歌转债!
A193: 341 | B193: 110031 | C193: 航信转债!! | D193: 600271 | E193: 航天信息 | F193: 计算机及 | G193: 软件开发 | H193: 106.09 | I193: 8.0000000000000004e-004 | J193: -8.0000000000000004e-004 | K193: 10.36 | L193: -1.89e-002 | M193: 107 | N193: 21.56 | O193: 1.21 | P193: 48.05 | Q193: 转股中 | R193: 0.35年 | S193: 回售内 | T193: 24 | U193: 19 | V193: 6.9999999999999993e-003 | W193: 0.125 | X193: 5.9999999999999998e-002 | Y193: 192 | Z193: 1.67 | AA193: 2.4900000000000002e-002 | AB193: -1.32e-002 | AC193: 回售内 | AD193: 回售内 | AE193: 100.27 | AF193: 105.8 | AG193: 0 | AH193: AAA | AI193: 3.2899999999999999e-002 | AJ193: =H193+100*O193 -> 227.09 | AK193: 164.1 | AL193: 307 | AM193: 58.3 | AN193: 297 | AO193: -0.16 | AP193: 15 | AQ193: 航信转债!!
A194: 14 | B194: 113044 | C194: 大秦转债! | D194: 601006 | E194: 大秦铁路 | F194: 铁路 | G194: 铁路运输 | H194: 99.54 | I194: 1.4000000000000002e-003 | J194: 5.9999999999999995e-004 | K194: 6.41 | L194: 4.6999999999999993e-003 | M194: 114.1 | N194: 7.66 | O194: 0.19 | P194: 83.68 | Q194: 4月13天 | R194: 5.86年 | S194: 3.86年 | T194: 320 | U194: 328 | V194: 1.e-002 | W194: 0.33600000000000002 | X194: 0.28100000000000003 | Y194: 953 | Z194: 0.82 | AA194: 2.4e-002 | AB194: 1.95e-002 | AC194: 1.09e-002 | AD194: 8.8999999999999999e-003 | AE194: 88.87 | AF194: 91.08 | AG194: 0.43 | AH194: AAA | AI194: 4.0000000000000001e-002 | AJ194: =H194+100*O194 -> 118.54000000000001 | AK194: 115.4 | AL194: 130 | AM194: 24.3 | AN194: 127 | AO194: -1.3000000000000001e-002 | AP194: 10 | AQ194: 大秦转债!
A195: 62 | B195: 128133 | C195: 奇正转债! | D195: 2287 | E195: 奇正藏药 | F195: 医药 | G195: 中药 | H195: 103.012 | I195: -7.6e-003 | J195: -6.3e-003 | K195: 23.08 | L195: -4.2300000000000004e-002 | M195: 117.3 | N195: 30.12 | O195: 0.34399999999999997 | P195: 76.63 | Q195: 51天 | R195: 5.63年 | S195: 3.63年 | T195: 8 | U195: 12 | V195: 1.3999999999999999e-002 | W195: 6.5000000000000002e-002 | X195: 5.0000000000000003e-002 | Y195: 122 | Z195: 5.09 | AA195: 2.3799999999999998e-002 | AB195: 1.8200000000000001e-002 | AC195: 2.e-003 | AD195: 1.e-004 | AE195: 87.98 | AF195: 92 | AG195: 0.33 | AH195: AA | AI195: 4.4999999999999998e-002 | AJ195: =H195+100*O195 -> 137.41200000000001 | AK195: 129.4 | AL195: 226 | AM195: 37.4 | AN195: 230 | AO195: -0.18899999999999997 | AP195: 12 | AQ195: 奇正转债!
A196: 308 | B196: 123007 | C196: 道氏转债! | D196: 300409 | E196: 道氏技术 | F196: 建筑 | G196: 建筑行业 | H196: 103.22 | I196: -5.0599999999999999e-002 | J196: 1.78e-002 | K196: 15.04 | L196: -5.1699999999999996e-002 | M196: 110.3 | N196: 14.95 | O196: 2.6000000000000002e-002 | P196: 100.6 | Q196: 转股中 | R196: 2.89年 | S196: 0.89年 | T196: 3.04 | U196: 40 | V196: 0.124 | W196: 4.4000000000000004e-002 | X196: 4.4000000000000004e-002 | Y196: 69 | Z196: 2.86 | AA196: 2.3599999999999999e-002 | AB196: 1.6799999999999999e-002 | AC196: -1.3000000000000001e-002 | AD196: -1.6299999999999999e-002 | AE196: 95.42 | AF196: 92.66 | AG196: 0.63 | AH196: AA- | AI196: 6.3099999999999989e-002 | AJ196: =H196+100*O196 -> 105.81999999999999 | AK196: 105.8 | AL196: 45 | AM196: 10.4 | AN196: 23 | AO196: 1.1000000000000001e-002 | AP196: 22 | AQ196: 道氏转债!
A197: 214 | B197: 128078 | C197: 太极转债! | D197: 2368 | E197: 太极股份 | F197: 计算机及 | G197: 软件开发 | H197: 104.98 | I197: -3.95e-002 | J197: 1.9199999999999998e-002 | K197: 20.85 | L197: -3.61e-002 | M197: 116.9 | N197: 22.4 | O197: 0.128 | P197: 93.08 | Q197: 转股中 | R197: 4.71年 | S197: 2.71年 | T197: 9.6 | U197: 20 | V197: 2.e-002 | W197: 7.9000000000000001e-002 | X197: 7.400000000000001e-002 | Y197: 121 | Z197: 3.93 | AA197: 2.3599999999999999e-002 | AB197: 1.7000000000000001e-002 | AC197: -5.3e-003 | AD197: -7.6e-003 | AE197: 91.55 | AF197: 95.95 | AG197: 0.56 | AH197: AA | AI197: 4.3700000000000003e-002 | AJ197: =H197+100*O197 -> 117.78 | AK197: 116.9 | AL197: 145 | AM197: 20.9 | AN197: 92 | AO197: -0.20499999999999999 | AP197: 12 | AQ197: 太极转债!
A198: 1 | B198: 113618 | C198: 美诺转债! | D198: 603538 | E198: 美诺华 | F198: 医药 | G198: 原料药 | H198: 100.69 | I198: -1.5800000000000002e-002 | J198: -9.7999999999999997e-003 | K198: 29.99 | L198: -4.8799999999999996e-002 | M198: 115.3 | N198: 37.47 | O198: 0.25800000000000001 | P198: 80.04 | Q198: 5月15天 | R198: 5.94年 | S198: 3.94年 | T198: 5.2 | U198: 174 | V198: 0.33000000000000002 | W198: 0.11599999999999999 | X198: 9.3000000000000013e-002 | Y198: 45 | Z198: 2.95 | AA198: 2.35e-002 | AB198: 1.8700000000000001e-002 | AC198: 7.4999999999999997e-003 | AD198: 5.6999999999999993e-003 | AE198: 80.03 | AF198: 79.45 | AG198: 0.53 | AH198: AA- | AI198: 6.6000000000000003e-002 | AJ198: =H198+100*O198 -> 126.48999999999999 | AK198: 121.3 | AL198: 179 | AM198: 41.3 | AN198: 246 | AO198: -8.6999999999999994e-002 | AP198: 1 | AQ198: 美诺转债!
A199: 248 | B199: 110057 | C199: 现代转债 | D199: 600420 | E199: 现代制药 | F199: 医药 | G199: 化学制药 | H199: 101.01 | I199: -6.8000000000000005e-003 | J199: 1.15e-002 | K199: 8.38 | L199: 1.21e-002 | M199: 110.8 | N199: 9.89 | O199: 0.192 | P199: 84.73 | Q199: 转股中 | R199: 4年55天 | S199: 2年55天 | T199: 16.2 | U199: 34 | V199: 2.1000000000000001e-002 | W199: 0.188 | X199: 0.159 | Y199: 86 | Z199: 1.1 | AA199: 2.3e-002 | AB199: 1.8000000000000002e-002 | AC199: 9.7999999999999997e-003 | AD199: 6.9999999999999993e-003 | AE199: 94.69 | AF199: 94.97 | AG199: 0.39 | AH199: AAA | AI199: 3.8699999999999998e-002 | AJ199: =H199+100*O199 -> 120.21000000000001 | AK199: 117.3 | AL199: 149 | AM199: 22.3 | AN199: 112 | AO199: -5.5e-002 | AP199: 24 | AQ199: 现代转债
A200: 132 | B200: 128109 | C200: 楚江转债 | D200: 2171 | E200: 楚江新材 | F200: 有色金属 | G200: 铜金属 | H200: 102.454 | I200: -2.3999999999999998e-003 | J200: 1.2999999999999999e-003 | K200: 7.19 | L200: -2.8000000000000004e-003 | M200: 115.3 | N200: 8.73 | O200: 0.24399999999999999 | P200: 82.36 | Q200: 转股中 | R200: 5.33年 | S200: 3.33年 | T200: 18.3 | U200: 28 | V200: 1.4999999999999999e-002 | W200: 0.191 | X200: 0.157 | Y200: 96 | Z200: 1.74 | AA200: 2.29e-002 | AB200: 1.7600000000000001e-002 | AC200: 3.8e-003 | AD200: 1.6000000000000001e-003 | AE200: 89.15 | AF200: 91.65 | AG200: 0.41 | AH200: AA | AI200: 4.4999999999999998e-002 | AJ200: =H200+100*O200 -> 126.85399999999998 | AK200: 122.5 | AL200: 188 | AM200: 30.9 | AN200: 191 | AO200: -0.11599999999999999 | AP200: 6 | AQ200: 楚江转债
A201: 243 | B201: 113024 | C201: 核建转债! | D201: 601611 | E201: 中国核建 | F201: 建筑 | G201: 建筑工程 | H201: 100.2 | I201: -7.000000000000001e-004 | J201: -5.1000000000000004e-003 | K201: 6.63 | L201: -3.7699999999999997e-002 | M201: 109.7 | N201: 9.76 | O201: 0.47499999999999998 | P201: 67.93 | Q201: 转股中 | R201: 4.17年 | S201: 2.17年 | T201: 30 | U201: 25 | V201: 8.0000000000000002e-003 | W201: 0.17100000000000001 | X201: 0.11599999999999999 | Y201: 176 | Z201: 1.63 | AA201: 2.2400000000000003e-002 | AB201: 1.7899999999999999e-002 | AC201: 1.2800000000000001e-002 | AD201: 1.01e-002 | AE201: 94.52 | AF201: 93.95 | AG201: 0.15 | AH201: AAA | AI201: 3.8699999999999998e-002 | AJ201: =H201+100*O201 -> 147.69999999999999 | AK201: 132.5 | AL201: 249 | AM201: 37.9 | AN201: 232 | AO201: -0.16699999999999998 | AP201: 44 | AQ201: 核建转债!
A202: 202 | B202: 113550 | C202: 常汽转债! | D202: 603035 | E202: 常熟汽饰 | F202: 汽车 | G202: 零部件制 | H202: 109.57 | I202: -4.7800000000000002e-002 | J202: 1.7600000000000001e-002 | K202: 10.45 | L202: -4.2199999999999994e-002 | M202: 121.3 | N202: 9.65 | O202: 1.2e-002 | P202: 108.29 | Q202: 转股中 | R202: 4.78年 | S202: 2.78年 | T202: 3.78 | U202: 31 | V202: 7.2000000000000008e-002 | W202: 0.105 | X202: 0.114 | Y202: 36 | Z202: 1.05 | AA202: 2.2000000000000002e-002 | AB202: 1.41e-002 | AC202: -1.7000000000000001e-002 | AD202: -1.9699999999999999e-002 | AE202: 86.81 | AF202: 90.51 | AG202: 0.72 | AH202: AA- | AI202: 6.4699999999999994e-002 | AJ202: =H202+100*O202 -> 110.77 | AK202: 110.8 | AL202: 89 | AM202: 20.3 | AN202: 82 | AO202: -0.14300000000000002 | AP202: 15 | AQ202: 常汽转债!
A203: 170 | B203: 123043 | C203: 正元转债 | D203: 300645 | E203: 正元智慧 | F203: 计算机及 | G203: 软件开发 | H203: 109.1 | I203: -4.3099999999999999e-002 | J203: 2.3799999999999998e-002 | K203: 14.25 | L203: -3.0600000000000002e-002 | M203: 121.4 | N203: 15.41 | O203: 0.17999999999999999 | P203: 92.47 | Q203: 转股中 | R203: 5年28天 | S203: 3年28天 | T203: 1.66 | U203: 171 | V203: 0.91700000000000004 | W203: 9.0999999999999998e-002 | X203: 8.5000000000000006e-002 | Y203: 18 | Z203: 2.94 | AA203: 2.18e-002 | AB203: 1.44e-002 | AC203: -1.32e-002 | AD203: -1.5800000000000002e-002 | AE203: 82.49 | AF203: 84.13 | AG203: 0.63 | AH203: A+ | AI203: 7.6999999999999999e-002 | AJ203: =H203+100*O203 -> 127.09999999999999 | AK203: 125.7 | AL203: 204 | AM203: 41.6 | AN203: 248 | AO203: -4.0000000000000001e-003 | AP203: 18 | AQ203: 正元转债
A204: 200 | B204: 110062 | C204: 烽火转债 | D204: 600498 | E204: 烽火通信 | F204: 通信互联 | G204: 通信设备 | H204: 100.11 | I204: -7.0999999999999995e-003 | J204: 3.0999999999999999e-003 | K204: 18.08 | L204: -1.7899999999999999e-002 | M204: 110.8 | N204: 25.65 | O204: 0.41999999999999998 | P204: 70.49 | Q204: 转股中 | R204: 4.82年 | S204: 2.82年 | T204: 30.9 | U204: 19 | V204: 6.0000000000000001e-003 | W204: 0.14599999999999999 | X204: 0.10300000000000001 | Y204: 212 | Z204: 1.99 | AA204: 2.1700000000000001e-002 | AB204: 1.7399999999999999e-002 | AC204: 1.06e-002 | AD204: 8.3999999999999995e-003 | AE204: 92.31 | AF204: 92.58 | AG204: 0.23 | AH204: AAA | AI204: 3.8699999999999998e-002 | AJ204: =H204+100*O204 -> 142.11000000000001 | AK204: 129.7 | AL204: 228 | AM204: 37.2 | AN204: 228 | AO204: -0.19399999999999998 | AP204: 20 | AQ204: 烽火转债
A205: 134 | B205: 127017 | C205: 万青转债 | D205: 789 | E205: 万年青 | F205: 建筑 | G205: 水泥 | H205: 106.009 | I205: 1.4000000000000002e-003 | J205: 3.3e-003 | K205: 11.48 | L205: 1.32e-002 | M205: 118.4 | N205: 14.16 | O205: 0.308 | P205: 81.07 | Q205: 转股中 | R205: 5.32年 | S205: 3.32年 | T205: 10 | U205: 32 | V205: 2.9999999999999999e-002 | W205: 0.109 | X205: 8.900000000000001e-002 | Y205: 92 | Z205: 1.65 | AA205: 2.1400000000000002e-002 | AB205: 1.52e-002 | AC205: -6.3e-003 | AD205: -8.3000000000000001e-003 | AE205: 89.7 | AF205: 95.05 | AG205: 0.35 | AH205: AA+ | AI205: 4.2999999999999997e-002 | AJ205: =H205+100*O205 -> 136.809 | AK205: 130.9 | AL205: 237 | AM205: 35.9 | AN205: 219 | AO205: -9.6000000000000002e-002 | AP205: 8 | AQ205: 万青转债
A206: 185 | B206: 128091 | C206: 新天转债 | D206: 2873 | E206: 新天药业 | F206: 医药 | G206: 中药 | H206: 108.01 | I206: -2.7000000000000001e-003 | J206: -3.2000000000000002e-003 | K206: 15.16 | L206: -9.1999999999999998e-003 | M206: 119.4 | N206: 16.39 | O206: 0.16800000000000001 | P206: 92.5 | Q206: 转股中 | R206: 4.90年 | S206: 2.90年 | T206: 1.76 | U206: 52 | V206: 0.26700000000000002 | W206: 9.9000000000000005e-002 | X206: 9.1999999999999998e-002 | Y206: 18 | Z206: 2.35 | AA206: 2.12e-002 | AB206: 1.41e-002 | AC206: -1.09e-002 | AD206: -1.37e-002 | AE206: 83.77 | AF206: 84.26 | AG206: 0.64 | AH206: A+ | AI206: 7.5700000000000003e-002 | AJ206: =H206+100*O206 -> 124.81 | AK206: 123.5 | AL206: 194 | AM206: 39.3 | AN206: 237 | AO206: -2.4e-002 | AP206: 17 | AQ206: 新天转债
A207: 10 | B207: 128141 | C207: 旺能转债 | D207: 2034 | E207: 旺能环境 | F207: 城市公用 | G207: 三废处理 | H207: 102.151 | I207: -1.21e-002 | J207: 1.4999999999999999e-002 | K207: 15.64 | L207: 5.1000000000000004e-003 | M207: 115.1 | N207: 16.47 | O207: 7.5999999999999998e-002 | P207: 94.96 | Q207: 4月18天 | R207: 5.86年 | S207: 3.86年 | T207: 14 | U207: 28 | V207: 1.9e-002 | W207: 0.21199999999999999 | X207: 0.20199999999999999 | Y207: 66 | Z207: 1.48 | AA207: 2.0899999999999998e-002 | AB207: 1.6200000000000003e-002 | AC207: 3.4999999999999996e-003 | AD207: 1.8e-003 | AE207: 86.88 | AF207: 89.32 | AG207: 0.57 | AH207: AA | AI207: 4.4999999999999998e-002 | AJ207: =H207+100*O207 -> 109.75099999999999 | AK207: 109.3 | AL207: 77 | AM207: 20 | AN207: 79 | AO207: -1.e-003 | AP207: 2 | AQ207: 旺能转债
A208: 321 | B208: 128021 | C208: 兄弟转债!! | D208: 2562 | E208: 兄弟科技 | F208: 医药 | G208: 原料药 | H208: 102.8 | I208: -1.9e-003 | J208: 8.9999999999999998e-004 | K208: 4.86 | L208: -2.0999999999999999e-003 | M208: 108.8 | N208: 5.19 | O208: 9.8000000000000004e-002 | P208: 93.64 | Q208: 转股中 | R208: 2.81年 | S208: 0.81年 | T208: 2.65 | U208: 4 | V208: 1.4999999999999999e-002 | W208: 5.0999999999999997e-002 | X208: 4.8000000000000001e-002 | Y208: 52 | Z208: 1.89 | AA208: 2.07e-002 | AB208: 1.46e-002 | AC208: -1.2500000000000001e-002 | AD208: -1.55e-002 | AE208: 97.55 | AF208: 97.05 | AG208: 0.5 | AH208: AA | AI208: 4.2099999999999999e-002 | AJ208: =H208+100*O208 -> 112.59999999999999 | AK208: 112 | AL208: 92 | AM208: 14.4 | AN208: 48 | AO208: -3.4000000000000002e-002 | AP208: 14 | AQ208: 兄弟转债!!
A209: 213 | B209: 128079 | C209: 英联转债! | D209: 2846 | E209: 英联股份 | F209: 造纸包装 | G209: 包装材料 | H209: 107.151 | I209: -4.6399999999999997e-002 | J209: 4.4400000000000002e-002 | K209: 13.6 | L209: -2.4399999999999998e-002 | M209: 117.5 | N209: 13.41 | O209: 5.7000000000000002e-002 | P209: 101.42 | Q209: 转股中 | R209: 4.71年 | S209: 2.71年 | T209: 1.53 | U209: 59 | V209: 0.34600000000000003 | W209: 5.7000000000000002e-002 | X209: 5.7000000000000002e-002 | Y209: 27 | Z209: 3.53 | AA209: 2.0199999999999999e-002 | AB209: 1.3500000000000002e-002 | AC209: -1.15e-002 | AD209: -1.3999999999999999e-002 | AE209: 84.23 | AF209: 83.95 | AG209: 0.08 | AH209: A+ | AI209: 7.5700000000000003e-002 | AJ209: =H209+100*O209 -> 112.851 | AK209: 112.9 | AL209: 101 | AM209: 28.7 | AN209: 175 | AO209: 2.7000000000000003e-002 | AP209: 20 | AQ209: 英联转债!
A210: 295 | B210: 128040 | C210: 华通转债! | D210: 2758 | E210: 浙农股份 | F210: 医药 | G210: 医药商业 | H210: 105.228 | I210: 1.9e-002 | J210: -1.46e-002 | K210: 10.66 | L210: 6.6e-003 | M210: 112.3 | N210: 10.33 | O210: 2.e-002 | P210: 103.19 | Q210: 转股中 | R210: 3.35年 | S210: 1.35年 | T210: 2.22 | U210: 7.8 | V210: 3.4000000000000002e-002 | W210: 4.2999999999999997e-002 | X210: 4.4000000000000004e-002 | Y210: 52 | Z210: 3.53 | AA210: 2.e-002 | AB210: 1.3100000000000001e-002 | AC210: -1.54e-002 | AD210: -1.89e-002 | AE210: 93.54 | AF210: 91.42 | AG210: 0.66 | AH210: AA- | AI210: 6.4699999999999994e-002 | AJ210: =H210+100*O210 -> 107.22799999999999 | AK210: 107.3 | AL210: 57 | AM210: 13.7 | AN210: 44 | AO210: 0. | AP210: 31 | AQ210: 华通转债!
A211: 204 | B211: 123035 | C211: 利德转债! | D211: 300296 | E211: 利亚德 | F211: 电子 | G211: LED制 | H211: 104.9 | I211: -1.54e-002 | J211: 2.3999999999999998e-003 | K211: 6.12 | L211: -3.0099999999999998e-002 | M211: 115.1 | N211: 6.98 | O211: 0.19600000000000001 | P211: 87.68 | Q211: 转股中 | R211: 4.77年 | S211: 2.77年 | T211: 8 | U211: 30 | V211: 3.6000000000000004e-002 | W211: 5.0999999999999997e-002 | X211: 4.4999999999999998e-002 | Y211: 156 | Z211: 1.82 | AA211: 2.e-002 | AB211: 1.4199999999999999e-002 | AC211: -4.3e-003 | AD211: -6.6e-003 | AE211: 92 | AF211: 95.09 | AG211: 0.43 | AH211: AA+ | AI211: 4.1700000000000001e-002 | AJ211: =H211+100*O211 -> 124.5 | AK211: 122.1 | AL211: 185 | AM211: 27 | AN211: 154 | AO211: -1.3999999999999999e-002 | AP211: 16 | AQ211: 利德转债!
A212: 258 | B212: 127011 | C212: 中鼎转2! | D212: 887 | E212: 中鼎股份 | F212: 汽车 | G212: 零部件制 | H212: 106.7 | I212: -2.1099999999999997e-002 | J212: 1.8700000000000001e-002 | K212: 9.66 | L212: -7.1999999999999998e-003 | M212: 115.2 | N212: 11.59 | O212: 0.28000000000000003 | P212: 83.35 | Q212: 转股中 | R212: 4年31天 | S212: 2年31天 | T212: 12 | U212: 37 | V212: 2.7999999999999997e-002 | W212: 0.10199999999999999 | X212: 8.5000000000000006e-002 | Y212: 118 | Z212: 1.35 | AA212: 1.9400000000000001e-002 | AB212: 1.2500000000000001e-002 | AC212: -1.3500000000000002e-002 | AD212: -1.6500000000000001e-002 | AE212: 94.55 | AF212: 97.88 | AG212: 0.34 | AH212: AA+ | AI212: 4.1700000000000001e-002 | AJ212: =H212+100*O212 -> 134.70000000000002 | AK212: 130.1 | AL212: 230 | AM212: 32.2 | AN212: 199 | AO212: -9.5000000000000001e-002 | AP212: 26 | AQ212: 中鼎转2!
A213: 70 | B213: 128129 | C213: 青农转债 | D213: 2958 | E213: 青农商行 | F213: 金融 | G213: 银行行业 | H213: 101 | I213: 1.5100000000000001e-002 | J213: 2.5999999999999999e-003 | K213: 4.61 | L213: 4.5400000000000003e-002 | M213: 112.2 | N213: 5.74 | O213: 0.25800000000000001 | P213: 80.31 | Q213: 24天 | R213: 5.55年 | S213: 无权 | T213: 50 | U213: 124 | V213: 2.5000000000000001e-002 | W213: 0.19500000000000001 | X213: 0.157 | Y213: 256 | Z213: 0.99 | AA213: 1.9400000000000001e-002 | AB213: 1.5300000000000001e-002 | AC213: 无权 | AD213: 无权 | AE213: 无权 | AF213: 90.54 | AG213: 0.39 | AH213: AAA | AI213: 4.0000000000000001e-002 | AJ213: =H213+100*O213 -> 126.8 | AK213: 121.7 | AL213: 182 | AM213: 31.1 | AN213: 192 | AO213: -1.7000000000000001e-002 | AP213: 12 | AQ213: 青农转债
A214: 264 | B214: 110051 | C214: 中天转债! | D214: 600522 | E214: 中天科技 | F214: 通信互联 | G214: 通信设备 | H214: 105.59 | I214: -3.2500000000000001e-002 | J214: 2.41e-002 | K214: 9.37 | L214: -1.78e-002 | M214: 113.9 | N214: 10.09 | O214: 0.13699999999999998 | P214: 92.86 | Q214: 转股中 | R214: 4年23天 | S214: 2年23天 | T214: 39.6 | U214: 112 | V214: 2.6000000000000002e-002 | W214: 0.13800000000000001 | X214: 0.128 | Y214: 287 | Z214: 1.31 | AA214: 1.9199999999999998e-002 | AB214: 1.29e-002 | AC214: -9.4999999999999998e-003 | AD214: -1.24e-002 | AE214: 94.5 | AF214: 96.84 | AG214: 0.47 | AH214: AA+ | AI214: 4.1700000000000001e-002 | AJ214: =H214+100*O214 -> 119.29000000000001 | AK214: 118.3 | AL214: 158 | AM214: 21.5 | AN214: 96 | AO214: -0.14199999999999999 | AP214: 26 | AQ214: 中天转债!
A215: 33 | B215: 110077 | C215: 洪城转债 | D215: 600461 | E215: 洪城水业 | F215: 城市公用 | G215: 城市公用 | H215: 101.84 | I215: -8.9999999999999998e-004 | J215: -4.0999999999999995e-003 | K215: 5.85 | L215: -1.18e-002 | M215: 113.5 | N215: 7.13 | O215: 0.24100000000000002 | P215: 82.05 | Q215: 3月20天 | R215: 5.79年 | S215: 3.79年 | T215: 18 | U215: 13 | V215: 6.9999999999999993e-003 | W215: 0.32500000000000001 | X215: 0.26600000000000001 | Y215: 55 | Z215: 1.1 | AA215: 1.9099999999999999e-002 | AB215: 1.4800000000000001e-002 | AC215: 1.e-003 | AD215: -1.e-004 | AE215: 86.64 | AF215: 89.2 | AG215: 0.42 | AH215: AA+ | AI215: 4.2999999999999997e-002 | AJ215: =H215+100*O215 -> 125.94 | AK215: 121.6 | AL215: 180 | AM215: 32.4 | AN215: 200 | AO215: -8.3000000000000004e-002 | AP215: 5 | AQ215: 洪城转债
A216: 240 | B216: 113026 | C216: 核能转债! | D216: 601985 | E216: 中国核电 | F216: 能源电力 | G216: 核电 | H216: 101.7 | I216: 2.3999999999999998e-003 | J216: -3.7000000000000002e-003 | K216: 4.7 | L216: -4.1999999999999997e-003 | M216: 109.8 | N216: 5.86 | O216: 0.26800000000000002 | P216: 80.2 | Q216: 转股中 | R216: 4.19年 | S216: 2.19年 | T216: 78 | U216: 57 | V216: 6.9999999999999993e-003 | W216: 9.5000000000000001e-002 | X216: 7.5999999999999998e-002 | Y216: 820 | Z216: 1.4 | AA216: 1.89e-002 | AB216: 1.43e-002 | AC216: 6.7000000000000002e-003 | AD216: 3.9000000000000003e-003 | AE216: 94.55 | AF216: 93.98 | AG216: 0.32 | AH216: AAA | AI216: 3.8699999999999998e-002 | AJ216: =H216+100*O216 -> 128.5 | AK216: 123.2 | AL216: 190 | AM216: 28.6 | AN216: 173 | AO216: -7.400000000000001e-002 | AP216: 50 | AQ216: 核能转债!
A217: 71 | B217: 113602 | C217: 景20转债 | D217: 603228 | E217: 景旺电子 | F217: 电子 | G217: 元器件制 | H217: 103.09 | I217: -1.8100000000000002e-002 | J217: 1.41e-002 | K217: 26.4 | L217: -1.2e-002 | M217: 113.3 | N217: 35.28 | O217: 0.37799999999999995 | P217: 74.83 | Q217: 24天 | R217: 5.55年 | S217: 3.55年 | T217: 17.8 | U217: 38 | V217: 2.1000000000000001e-002 | W217: 7.9000000000000001e-002 | X217: 5.9000000000000004e-002 | Y217: 225 | Z217: 3.76 | AA217: 1.7500000000000002e-002 | AB217: 1.3000000000000001e-002 | AC217: 1.9e-003 | AD217: -1.e-004 | AE217: 88.29 | AF217: 89.19 | AG217: 0.33 | AH217: AA | AI217: 4.4999999999999998e-002 | AJ217: =H217+100*O217 -> 140.88999999999999 | AK217: 131.4 | AL217: 240 | AM217: 42.2 | AN217: 252 | AO217: -6.9000000000000006e-002 | AP217: 7 | AQ217: 景20转债
A218: 251 | B218: 127012 | C218: 招路转债! | D218: 1965 | E218: 招商公路 | F218: 机场高速 | G218: 高速 | H218: 101.189 | I218: 1.9e-003 | J218: -1.1999999999999999e-003 | K218: 6.47 | L218: 3.0999999999999999e-003 | M218: 108.2 | N218: 8.81 | O218: 0.37799999999999995 | P218: 73.44 | Q218: 转股中 | R218: 4年45天 | S218: 2年45天 | T218: 50 | U218: 42 | V218: 8.0000000000000002e-003 | W218: 0.125 | X218: 9.1999999999999998e-002 | Y218: 400 | Z218: 0.82 | AA218: 1.66e-002 | AB218: 1.2800000000000001e-002 | AC218: 3.3e-003 | AD218: 1.6000000000000001e-003 | AE218: 93.51 | AF218: 92.72 | AG218: 0.2 | AH218: AAA | AI218: 3.8699999999999998e-002 | AJ218: =H218+100*O218 -> 138.98899999999998 | AK218: 128.9 | AL218: 223 | AM218: 35.4 | AN218: 215 | AO218: -6.6000000000000003e-002 | AP218: 36 | AQ218: 招路转债!
A219: 69 | B219: 128130 | C219: 景兴转债 | D219: 2067 | E219: 景兴纸业 | F219: 造纸包装 | G219: 包装用纸 | H219: 105.2 | I219: -4.36e-002 | J219: 3.8e-003 | K219: 3.48 | L219: -6.2e-002 | M219: 115.1 | N219: 3.4 | O219: 2.7999999999999997e-002 | P219: 102.35 | Q219: 27天 | R219: 5.57年 | S219: 3.57年 | T219: 12.8 | U219: 49 | V219: 3.6000000000000004e-002 | W219: 0.33100000000000002 | X219: 0.33899999999999997 | Y219: 39 | Z219: 0.86 | AA219: 1.66e-002 | AB219: 1.1599999999999999e-002 | AC219: -4.0999999999999995e-003 | AD219: -6.0000000000000001e-003 | AE219: 88.02 | AF219: 90.49 | AG219: 0.64 | AH219: AA | AI219: 4.4999999999999998e-002 | AJ219: =H219+100*O219 -> 108. | AK219: 108 | AL219: 67 | AM219: 17.6 | AN219: 67 | AO219: -8.6999999999999994e-002 | AP219: 11 | AQ219: 景兴转债
A220: 5 | B220: 113615 | C220: 金诚转债 | D220: 603979 | E220: 金诚信 | F220: 有色金属 | G220: 有色行业 | H220: 106.9 | I220: -1.8e-003 | J220: 5.6000000000000008e-003 | K220: 12.44 | L220: 6.5000000000000006e-003 | M220: 117.3 | N220: 12.73 | O220: 9.4e-002 | P220: 97.72 | Q220: 4月24天 | R220: 5.88年 | S220: 3.88年 | T220: 10 | U220: 44 | V220: 4.0999999999999995e-002 | W220: 0.13800000000000001 | X220: 0.13500000000000001 | Y220: 73 | Z220: 1.62 | AA220: 1.6200000000000003e-002 | AB220: 1.09e-002 | AC220: -7.3000000000000001e-003 | AD220: -9.1000000000000004e-003 | AE220: 87.01 | AF220: 90.99 | AG220: 0.59 | AH220: AA | AI220: 4.4999999999999998e-002 | AJ220: =H220+100*O220 -> 116.30000000000001 | AK220: 116.1 | AL220: 135 | AM220: 25.1 | AN220: 132 | AO220: -1.3000000000000001e-002 | AP220: 3 | AQ220: 金诚转债
A221: 274 | B221: 110048 | C221: 福能转债! | D221: 600483 | E221: 福能股份 | F221: 能源电力 | G221: 电力供应 | H221: 106.78 | I221: -4.7999999999999996e-003 | J221: -5.1999999999999998e-003 | K221: 7.72 | L221: -2.0299999999999999e-002 | M221: 113.3 | N221: 8.12 | O221: 0.12300000000000001 | P221: 95.07 | Q221: 转股中 | R221: 3.84年 | S221: 1.84年 | T221: 28.3 | U221: 30 | V221: 1.e-002 | W221: 0.20800000000000002 | X221: 0.19800000000000001 | Y221: 136 | Z221: 0.96 | AA221: 1.5900000000000001e-002 | AB221: 9.3999999999999986e-003 | AC221: -1.89e-002 | AD221: -2.1600000000000001e-002 | AE221: 94.78 | AF221: 97.14 | AG221: 0.49 | AH221: AA+ | AI221: 4.1700000000000001e-002 | AJ221: =H221+100*O221 -> 119.08 | AK221: 118.5 | AL221: 159 | AM221: 21.3 | AN221: 94 | AO221: 6.0000000000000001e-003 | AP221: 9 | AQ221: 福能转债!
A222: 307 | B222: 128034 | C222: 江银转债! | D222: 2807 | E222: 江阴银行 | F222: 金融 | G222: 银行行业 | H222: 103.49 | I222: 1.06e-002 | J222: 5.7999999999999996e-003 | K222: 4.13 | L222: 3.7699999999999997e-002 | M222: 108.3 | N222: 4.5 | O222: 0.128 | P222: 91.78 | Q222: 转股中 | R222: 2.97年 | S222: 无权 | T222: 17.6 | U222: 43 | V222: 2.4e-002 | W222: 0.19600000000000001 | X222: 0.17999999999999999 | Y222: 90 | Z222: 0.79 | AA222: 1.5600000000000001e-002 | AB222: 1.0200000000000001e-002 | AC222: 无权 | AD222: 无权 | AE222: 无权 | AF222: 96.47 | AG222: 0.44 | AH222: AA+ | AI222: 4.0099999999999997e-002 | AJ222: =H222+100*O222 -> 116.28999999999999 | AK222: 115.2 | AL222: 128 | AM222: 18.7 | AN222: 71 | AO222: 2.e-003 | AP222: 27 | AQ222: 江银转债!
A223: 340 | B223: 110033 | C223: 国贸转债! | D223: 600755 | E223: 厦门国贸 | F223: 交通运输 | G223: 交通运输 | H223: 106.5 | I223: 3.5999999999999999e-003 | J223: -2.3999999999999998e-003 | K223: 6.19 | L223: 1.4800000000000001e-002 | M223: 108 | N223: 7.18 | O223: 0.23499999999999999 | P223: 86.21 | Q223: 转股中 | R223: 0.92年 | S223: 回售内 | T223: 12.1 | U223: 31 | V223: 2.4e-002 | W223: 0.10099999999999999 | X223: 8.6999999999999994e-002 | Y223: 120 | Z223: 0.8 | AA223: 1.54e-002 | AB223: -1.e-003 | AC223: 回售内 | AD223: 回售内 | AE223: 100.33 | AF223: 104.65 | AG223: 0.08 | AH223: AAA | AI223: 3.5000000000000003e-002 | AJ223: =H223+100*O223 -> 130. | AK223: 126.8 | AL223: 211 | AM223: 22.1 | AN223: 107 | AO223: -2.2000000000000002e-002 | AP223: 19 | AQ223: 国贸转债!
A224: 48 | B224: 127023 | C224: 华菱转2 | D224: 932 | E224: 华菱钢铁 | F224: 钢铁 | G224: 炼钢 | H224: 101.014 | I224: -2.5499999999999998e-002 | J224: 1.54e-002 | K224: 4.74 | L224: -1.8600000000000002e-002 | M224: 110.1 | N224: 5.18 | O224: 0.10400000000000001 | P224: 91.51 | Q224: 2月23天 | R224: 5.71年 | S224: 4.71年 | T224: 40 | U224: 57 | V224: 1.3999999999999999e-002 | W224: 0.13800000000000001 | X224: 0.126 | Y224: 291 | Z224: 0.92 | AA224: 1.54e-002 | AB224: 1.2e-002 | AC224: 6.8999999999999999e-003 | AD224: 5.1000000000000004e-003 | AE224: 86.42 | AF224: 88.29 | AG224: 0.54 | AH224: AAA | AI224: 4.0000000000000001e-002 | AJ224: =H224+100*O224 -> 111.414 | AK224: 110.5 | AL224: 86 | AM224: 22.2 | AN224: 109 | AO224: -2.e-002 | AP224: 8 | AQ224: 华菱转2
A225: 150 | B225: 113034 | C225: 滨化转债 | D225: 601678 | E225: 滨化股份 | F225: 化工 | G225: 化工 | H225: 106.56 | I225: 5.9999999999999995e-004 | J225: -1.0700000000000001e-002 | K225: 4.61 | L225: -1.7100000000000001e-002 | M225: 115.1 | N225: 4.68 | O225: 8.199999999999999e-002 | P225: 98.5 | Q225: 转股中 | R225: 5.18年 | S225: 3.18年 | T225: 19.3 | U225: 25 | V225: 1.2e-002 | W225: 0.255 | X225: 0.251 | Y225: 76 | Z225: 1.14 | AA225: 1.5300000000000001e-002 | AB225: 1.e-002 | AC225: -8.5000000000000006e-003 | AD225: -1.0500000000000001e-002 | AE225: 89.55 | AF225: 92.06 | AG225: 0.59 | AH225: AA | AI225: 4.4999999999999998e-002 | AJ225: =H225+100*O225 -> 114.76000000000001 | AK225: 114.6 | AL225: 124 | AM225: 22.6 | AN225: 113 | AO225: -0.115 | AP225: 28 | AQ225: 滨化转债
A226: 46 | B226: 123074 | C226: 隆利转债 | D226: 300752 | E226: 隆利科技 | F226: 电子 | G226: 液晶显示 | H226: 114.4 | I226: -6.0499999999999998e-002 | J226: 1.43e-002 | K226: 33.6 | L226: -6.0899999999999996e-002 | M226: 124 | N226: 29.41 | O226: 1.e-003 | P226: 114.25 | Q226: 2月28天 | R226: 5.73年 | S226: 3.73年 | T226: 3.25 | U226: 242 | V226: 0.627 | W226: 8.0000000000000002e-002 | X226: 9.1999999999999998e-002 | Y226: 40 | Z226: 4.65 | AA226: 1.44e-002 | AB226: 7.3000000000000001e-003 | AC226: -2.46e-002 | AD226: -2.64e-002 | AE226: 81.21 | AF226: 86.6 | AG226: 0.76 | AH226: AA- | AI226: 6.6000000000000003e-002 | AJ226: =H226+100*O226 -> 114.5 | AK226: 114.6 | AL226: 122 | AM226: 28 | AN226: 162 | AO226: -0.23800000000000002 | AP226: 10 | AQ226: 隆利转债
A227: 218 | B227: 128075 | C227: 远东转债! | D227: 2406 | E227: 远东传动 | F227: 汽车 | G227: 零部件制 | H227: 107.84 | I227: -2.1499999999999998e-002 | J227: 4.4000000000000003e-003 | K227: 5.9 | L227: -2.64e-002 | M227: 114.9 | N227: 5.54 | O227: 1.3000000000000001e-002 | P227: 106.5 | Q227: 转股中 | R227: 4.63年 | S227: 2.63年 | T227: 5.45 | U227: 8.2 | V227: 1.3999999999999999e-002 | W227: 0.14800000000000002 | X227: 0.158 | Y227: 37 | Z227: 1.18 | AA227: 1.41e-002 | AB227: 8.199999999999999e-003 | AC227: -1.5100000000000001e-002 | AD227: -1.7399999999999999e-002 | AE227: 91.85 | AF227: 94.62 | AG227: 0.65 | AH227: AA | AI227: 4.3700000000000003e-002 | AJ227: =H227+100*O227 -> 109.14 | AK227: 109.2 | AL227: 74 | AM227: 14.6 | AN227: 49 | AO227: -3.3000000000000002e-002 | AP227: 15 | AQ227: 远东转债!
A228: 53 | B228: 123070 | C228: 鹏辉转债 | D228: 300438 | E228: 鹏辉能源 | F228: 汽车 | G228: 零部件制 | H228: 106.39 | I228: 2.0999999999999999e-003 | J228: -2.0999999999999999e-003 | K228: 19.15 | L228: 0. | M228: 115.1 | N228: 20.16 | O228: 0.12 | P228: 94.99 | Q228: 2月20天 | R228: 5.71年 | S228: 3.71年 | T228: 8.9 | U228: 36 | V228: 3.7999999999999999e-002 | W228: 0.111 | X228: 0.105 | Y228: 80 | Z228: 3.25 | AA228: 1.41e-002 | AB228: 9.300000000000001e-003 | AC228: -6.8999999999999999e-003 | AD228: -8.6999999999999994e-003 | AE228: 87.49 | AF228: 89.95 | AG228: 0.58 | AH228: AA | AI228: 4.4999999999999998e-002 | AJ228: =H228+100*O228 -> 118.39 | AK228: 117.8 | AL228: 152 | AM228: 27.8 | AN228: 161 | AO228: -0.11800000000000001 | AP228: 4 | AQ228: 鹏辉转债
A229: 98 | B229: 127020 | C229: 中金转债 | D229: 60 | E229: 中金岭南 | F229: 有色金属 | G229: 有色行业 | H229: 105.514 | I229: 7.000000000000001e-004 | J229: -4.0000000000000001e-003 | K229: 4.03 | L229: -7.4000000000000003e-003 | M229: 113.7 | N229: 4.71 | O229: 0.23300000000000001 | P229: 85.56 | Q229: 转股中 | R229: 5.45年 | S229: 3.45年 | T229: 38 | U229: 36 | V229: 9.0000000000000011e-003 | W229: 0.26400000000000001 | X229: 0.22600000000000001 | Y229: 144 | Z229: 1.28 | AA229: 1.3999999999999999e-002 | AB229: 9.3999999999999986e-003 | AC229: -8.199999999999999e-003 | AD229: -9.4999999999999998e-003 | AE229: 88.05 | AF229: 90.65 | AG229: 0.45 | AH229: AA+ | AI229: 4.2999999999999997e-002 | AJ229: =H229+100*O229 -> 128.81399999999999 | AK229: 125.5 | AL229: 203 | AM229: 34.8 | AN229: 211 | AO229: -7.6999999999999999e-002 | AP229: 14 | AQ229: 中金转债
A230: 166 | B230: 110067 | C230: 华安转债! | D230: 600909 | E230: 华安证券 | F230: 金融 | G230: 证券行业 | H230: 103.35 | I230: -1.9e-003 | J230: -1.7000000000000001e-003 | K230: 6.36 | L230: -1.24e-002 | M230: 110.5 | N230: 8.67 | O230: 0.40899999999999997 | P230: 73.36 | Q230: 转股中 | R230: 5年35天 | S230: 无权 | T230: 28 | U230: 46 | V230: 1.6e-002 | W230: 0.122 | X230: 8.900000000000001e-002 | Y230: 230 | Z230: 1.66 | AA230: 1.34e-002 | AB230: 9.4999999999999998e-003 | AC230: 无权 | AD230: 无权 | AE230: 无权 | AF230: 90.73 | AG230: 0.29 | AH230: AAA | AI230: 4.0000000000000001e-002 | AJ230: =H230+100*O230 -> 144.25 | AK230: 133.3 | AL230: 253 | AM230: 42.6 | AN230: 254 | AO230: -0.11199999999999999 | AP230: 27 | AQ230: 华安转债!
A231: 44 | B231: 113607 | C231: 伟20转债! | D231: 603568 | E231: 伟明环保 | F231: 城市公用 | G231: 三废处理 | H231: 107.62 | I231: 2.3700000000000002e-002 | J231: 2.e-003 | K231: 18.65 | L231: 5.67e-002 | M231: 115.1 | N231: 22.01 | O231: 0.27000000000000002 | P231: 84.73 | Q231: 3月0天 | R231: 5.74年 | S231: 3.74年 | T231: 12 | U231: 242 | V231: 0.18100000000000002 | W231: 5.0999999999999997e-002 | X231: 4.2999999999999997e-002 | Y231: 234 | Z231: 4.67 | AA231: 1.2e-002 | AB231: 7.1999999999999998e-003 | AC231: -9.7999999999999997e-003 | AD231: -1.15e-002 | AE231: 87.36 | AF231: 89.8 | AG231: 0.45 | AH231: AA | AI231: 4.4999999999999998e-002 | AJ231: =H231+100*O231 -> 134.62 | AK231: 130.5 | AL231: 234 | AM231: 40.7 | AN231: 243 | AO231: 3.1e-002 | AP231: 3 | AQ231: 伟20转债!
A232: 288 | B232: 123012 | C232: 万顺转债! | D232: 300057 | E232: 万顺新材 | F232: 有色金属 | G232: 铝金属 | H232: 106.193 | I232: -5.3499999999999999e-002 | J232: 4.58e-002 | K232: 4.09 | L232: -2.8500000000000001e-002 | M232: 110.3 | N232: 5.31 | O232: 0.379 | P232: 77.02 | Q232: 转股中 | R232: 3.45年 | S232: 1.45年 | T232: 1.29 | U232: 31 | V232: 0.221 | W232: 4.7e-002 | X232: 3.6000000000000004e-002 | Y232: 28 | Z232: 0.81 | AA232: 1.1299999999999999e-002 | AB232: 5.6000000000000008e-003 | AC232: -2.e-002 | AD232: -2.3300000000000001e-002 | AE232: 92.96 | AF232: 89.24 | AG232: 0.27 | AH232: AA- | AI232: 6.4699999999999994e-002 | AJ232: =H232+100*O232 -> 144.09299999999999 | AK232: 135.4 | AL232: 260 | AM232: 42.4 | AN232: 253 | AO232: -0.107 | AP232: 20 | AQ232: 万顺转债!
A233: 164 | B233: 113572 | C233: 三祥转债! | D233: 603663 | E233: 三祥新材 | F233: 其他 | G233: 其他 | H233: 107.15 | I233: 8.5000000000000006e-003 | J233: 9.8999999999999991e-003 | K233: 14.89 | L233: 2.3399999999999997e-002 | M233: 113.2 | N233: 14.19 | O233: 2.1000000000000001e-002 | P233: 104.93 | Q233: 转股中 | R233: 5年35天 | S233: 3年35天 | T233: 1.7 | U233: 6.3 | V233: 3.5000000000000003e-002 | W233: 5.9000000000000004e-002 | X233: 6.2e-002 | Y233: 29 | Z233: 4.81 | AA233: 1.11e-002 | AB233: 6.3e-003 | AC233: -1.01e-002 | AD233: -1.2199999999999999e-002 | AE233: 81.63 | AF233: 78.22 | AG233: 0.79 | AH233: A+ | AI233: 7.6999999999999999e-002 | AJ233: =H233+100*O233 -> 109.25 | AK233: 109.4 | AL233: 79 | AM233: 27.7 | AN233: 158 | AO233: 4.7e-002 | AP233: 19 | AQ233: 三祥转债!
A234: 279 | B234: 128048 | C234: 张行转债 | D234: 2839 | E234: 张家港行 | F234: 金融 | G234: 银行行业 | H234: 108.813 | I234: 1.03e-002 | J234: 1.95e-002 | K234: 5.7 | L234: 5.5599999999999997e-002 | M234: 113.3 | N234: 5.76 | O234: 0.10000000000000001 | P234: 98.96 | Q234: 转股中 | R234: 3.77年 | S234: 无权 | T234: 25 | U234: 169 | V234: 6.0999999999999999e-002 | W234: 0.24199999999999999 | X234: 0.23999999999999999 | Y234: 103 | Z234: 0.98 | AA234: 1.1000000000000001e-002 | AB234: 4.5000000000000005e-003 | AC234: 无权 | AD234: 无权 | AE234: 无权 | AF234: 97.41 | AG234: 0.54 | AH234: AA+ | AI234: 4.1700000000000001e-002 | AJ234: =H234+100*O234 -> 118.813 | AK234: 118.7 | AL234: 161 | AM234: 21.3 | AN234: 93 | AO234: 1.e-003 | AP234: 13 | AQ234: 张行转债
A235: 121 | B235: 128114 | C235: 正邦转债 | D235: 2157 | E235: 正邦科技 | F235: 农业 | G235: 畜牧业 | H235: 109.189 | I235: -3.4000000000000002e-003 | J235: 3.0000000000000001e-003 | K235: 15.84 | L235: -5.9999999999999995e-004 | M235: 115.3 | N235: 15.55 | O235: 7.2000000000000008e-002 | P235: 101.86 | Q235: 转股中 | R235: 5.36年 | S235: 3.36年 | T235: 16 | U235: 56 | V235: 3.2000000000000001e-002 | W235: 3.3000000000000002e-002 | X235: 3.3000000000000002e-002 | Y235: 491 | Z235: 2.66 | AA235: 1.04e-002 | AB235: 5.1999999999999998e-003 | AC235: -1.44e-002 | AD235: -1.6399999999999998e-002 | AE235: 89.61 | AF235: 92.43 | AG235: 0.62 | AH235: AA+ | AI235: 4.2999999999999997e-002 | AJ235: =H235+100*O235 -> 116.389 | AK235: 116.5 | AL235: 140 | AM235: 24.1 | AN235: 126 | AO235: -7.400000000000001e-002 | AP235: 14 | AQ235: 正邦转债
A236: 95 | B236: 123060 | C236: 苏试转债 | D236: 300416 | E236: 苏试试验 | F236: 机械装备 | G236: 专用设备 | H236: 112 | I236: -1.7500000000000002e-002 | J236: 9.300000000000001e-003 | K236: 22.71 | L236: -1.26e-002 | M236: 117.6 | N236: 23.86 | O236: 0.17699999999999999 | P236: 95.18 | Q236: 转股中 | R236: 5.46年 | S236: 3.46年 | T236: 3.1 | U236: 19 | V236: 5.5e-002 | W236: 6.7000000000000004e-002 | X236: 6.4000000000000001e-002 | Y236: 46 | Z236: 4.65 | AA236: 9.1999999999999998e-003 | AB236: 3.4000000000000002e-003 | AC236: -2.06e-002 | AD236: -2.2700000000000001e-002 | AE236: 82.67 | AF236: 83.61 | AG236: 0.65 | AH236: AA- | AI236: 6.6000000000000003e-002 | AJ236: =H236+100*O236 -> 129.69999999999999 | AK236: 128.8 | AL236: 221 | AM236: 45.2 | AN236: 263 | AO236: -4.2999999999999997e-002 | AP236: 9 | AQ236: 苏试转债
A237: 91 | B237: 110073 | C237: 国投转债 | D237: 600061 | E237: 国投资本 | F237: 金融 | G237: 证券行业 | H237: 105.16 | I237: -6.9999999999999993e-003 | J237: -2.9999999999999997e-004 | K237: 12.07 | L237: -1.8700000000000001e-002 | M237: 110.5 | N237: 15.25 | O237: 0.32899999999999996 | P237: 79.15 | Q237: 转股中 | R237: 5.46年 | S237: 无权 | T237: 80 | U237: 76 | V237: 9.0000000000000011e-003 | W237: 0.157 | X237: 0.124 | Y237: 510 | Z237: 1.22 | AA237: 9.1999999999999998e-003 | AB237: 5.6000000000000008e-003 | AC237: 无权 | AD237: 无权 | AE237: 无权 | AF237: 89.43 | AG237: 0.39 | AH237: AAA | AI237: 4.0000000000000001e-002 | AJ237: =H237+100*O237 -> 138.06 | AK237: 131.2 | AL237: 239 | AM237: 41.7 | AN237: 249 | AO237: -9.9000000000000005e-002 | AP237: 21 | AQ237: 国投转债
A238: 18 | B238: 113043 | C238: 财通转债 | D238: 601108 | E238: 财通证券 | F238: 金融 | G238: 证券行业 | H238: 104.98 | I238: -9.7000000000000003e-003 | J238: -1.e-003 | K238: 10.25 | L238: -2.75e-002 | M238: 110.2 | N238: 13.33 | O238: 0.36499999999999999 | P238: 76.89 | Q238: 4月11天 | R238: 5.85年 | S238: 无权 | T238: 38 | U238: 48 | V238: 1.2e-002 | W238: 0.10300000000000001 | X238: 7.9000000000000001e-002 | Y238: 368 | Z238: 1.69 | AA238: 8.3999999999999995e-003 | AB238: 5.1999999999999998e-003 | AC238: 无权 | AD238: 无权 | AE238: 无权 | AF238: 87.89 | AG238: 0.39 | AH238: AAA | AI238: 4.0000000000000001e-002 | AJ238: =H238+100*O238 -> 141.48000000000002 | AK238: 133.1 | AL238: 251 | AM238: 45.2 | AN238: 262 | AO238: -0.10300000000000001 | AP238: 6 | AQ238: 财通转债
A239: 226 | B239: 113542 | C239: 好客转债 | D239: 603898 | E239: 好莱客 | F239: 其他 | G239: 家居用品 | H239: 111 | I239: 1.3600000000000001e-002 | J239: 2.3e-003 | K239: 17.11 | L239: 2.52e-002 | M239: 114.9 | N239: 16.27 | O239: 5.5999999999999994e-002 | P239: 105.16 | Q239: 转股中 | R239: 4.49年 | S239: 2.49年 | T239: 6.03 | U239: 11 | V239: 1.6e-002 | W239: 0.113 | X239: 0.11900000000000001 | Y239: 53 | Z239: 2.17 | AA239: 7.9000000000000008e-003 | AB239: 1.9e-003 | AC239: -2.6600000000000002e-002 | AD239: -2.8999999999999998e-002 | AE239: 92.42 | AF239: 95.21 | AG239: 0.63 | AH239: AA | AI239: 4.3700000000000003e-002 | AJ239: =H239+100*O239 -> 116.59999999999999 | AK239: 116.8 | AL239: 143 | AM239: 21.6 | AN239: 98 | AO239: 7.9000000000000001e-002 | AP239: 19 | AQ239: 好客转债
A240: 83 | B240: 113598 | C240: 法兰转债 | D240: 603966 | E240: 法兰泰克 | F240: 机械装备 | G240: 工程机械 | H240: 116.32 | I240: -3.6799999999999999e-002 | J240: 2.4199999999999999e-002 | K240: 15.97 | L240: -1.6e-002 | M240: 121.2 | N240: 13.88 | O240: 1.1000000000000001e-002 | P240: 115.06 | Q240: 1.5天 | R240: 5.48年 | S240: 3.48年 | T240: 3.3 | U240: 22 | V240: 5.5999999999999994e-002 | W240: 9.8000000000000004e-002 | X240: 0.113 | Y240: 34 | Z240: 3.02 | AA240: 7.7000000000000002e-003 | AB240: 1.e-003 | AC240: -3.0200000000000001e-002 | AD240: -3.2300000000000002e-002 | AE240: 82.68 | AF240: 86.04 | AG240: 0.79 | AH240: AA- | AI240: 6.6000000000000003e-002 | AJ240: =H240+100*O240 -> 117.41999999999999 | AK240: 117.6 | AL240: 151 | AM240: 31.5 | AN240: 196 | AO240: 5.2999999999999999e-002 | AP240: 7 | AQ240: 法兰转债
A241: 233 | B241: 113537 | C241: 文灿转债!! | D241: 603348 | E241: 文灿股份 | F241: 汽车 | G241: 零部件制 | H241: 117.97 | I241: -4.9599999999999998e-002 | J241: 6.0999999999999995e-003 | K241: 22.8 | L241: -5.67e-002 | M241: 121.5 | N241: 19.43 | O241: 5.0000000000000001e-003 | P241: 117.34 | Q241: 转股中 | R241: 4.34年 | S241: 2.34年 | T241: 1.81 | U241: 25 | V241: 0.114 | W241: 3.1e-002 | X241: 3.6000000000000004e-002 | Y241: 59 | Z241: 2.34 | AA241: 6.9999999999999993e-003 | AB241: -1.5e-003 | AC241: -4.8099999999999997e-002 | AD241: -5.1200000000000002e-002 | AE241: 89.41 | AF241: 93.22 | AG241: 0.77 | AH241: AA- | AI241: 6.4699999999999994e-002 | AJ241: =H241+100*O241 -> 118.47 | AK241: 118.6 | AL241: 160 | AM241: 25.4 | AN241: 139 | AO241: -0.10400000000000001 | AP241: 26 | AQ241: 文灿转债!!
A242: 312 | B242: 128032 | C242: 双环转债! | D242: 2472 | E242: 双环传动 | F242: 机械装备 | G242: 通用设备 | H242: 107.181 | I242: -5.6999999999999993e-003 | J242: -7.3000000000000001e-003 | K242: 8.98 | L242: -3.1300000000000001e-002 | M242: 109.3 | N242: 9.89 | O242: 0.17999999999999999 | P242: 90.8 | Q242: 转股中 | R242: 2.89年 | S242: 0.89年 | T242: 10 | U242: 4.8 | V242: 5.0000000000000001e-003 | W242: 0.16200000000000001 | X242: 0.14699999999999999 | Y242: 62 | Z242: 1.85 | AA242: 6.8999999999999999e-003 | AB242: 8.0000000000000004e-004 | AC242: -4.7899999999999998e-002 | AD242: -5.1100000000000007e-002 | AE242: 97.49 | AF242: 97.22 | AG242: 0.42 | AH242: AA | AI242: 4.2099999999999999e-002 | AJ242: =H242+100*O242 -> 125.181 | AK242: 123.6 | AL242: 195 | AM242: 26.1 | AN242: 147 | AO242: 4.8000000000000001e-002 | AP242: 46 | AQ242: 双环转债!
A243: 11 | B243: 113614 | C243: 健20转债! | D243: 603707 | E243: 健友股份 | F243: 医药 | G243: 原料药 | H243: 109.93 | I243: -5.9999999999999995e-004 | J243: 4.5000000000000005e-003 | K243: 31.51 | L243: 8.6e-003 | M243: 114.2 | N243: 38.04 | O243: 0.32700000000000001 | P243: 82.83 | Q243: 4月18天 | R243: 5.86年 | S243: 3.86年 | T243: 7.8 | U243: 44 | V243: 5.0999999999999997e-002 | W243: 2.6000000000000002e-002 | X243: 2.2000000000000002e-002 | Y243: 294 | Z243: 8.59 | AA243: 6.6e-003 | AB243: 2.2000000000000001e-003 | AC243: -1.4499999999999999e-002 | AD243: -1.6200000000000003e-002 | AE243: 86.98 | AF243: 88.64 | AG243: 0.45 | AH243: AA | AI243: 4.4999999999999998e-002 | AJ243: =H243+100*O243 -> 142.63 | AK243: 137 | AL243: 268 | AM243: 48.4 | AN243: 277 | AO243: -3.7000000000000005e-002 | AP243: 2 | AQ243: 健20转债!
A244: 38 | B244: 127024 | C244: 盈峰转债 | D244: 967 | E244: 盈峰环境 | F244: 机械装备 | G244: 专用设备 | H244: 113 | I244: 2.9999999999999997e-004 | J244: -3.8e-003 | K244: 7.83 | L244: -6.3e-003 | M244: 116.8 | N244: 8.31 | O244: 0.19899999999999998 | P244: 94.22 | Q244: 3月4天 | R244: 5.75年 | S244: 3.75年 | T244: 14.8 | U244: 13 | V244: 8.0000000000000002e-003 | W244: 5.9999999999999998e-002 | X244: 5.5999999999999994e-002 | Y244: 248 | Z244: 1.53 | AA244: 5.8999999999999999e-003 | AB244: 7.000000000000001e-004 | AC244: -2.2799999999999997e-002 | AD244: -2.4399999999999998e-002 | AE244: 87.71 | AF244: 92.05 | AG244: 0.55 | AH244: AA+ | AI244: 4.2999999999999997e-002 | AJ244: =H244+100*O244 -> 132.90000000000001 | AK244: 131.8 | AL244: 244 | AM244: 39.7 | AN244: 239 | AO244: -3.2000000000000001e-002 | AP244: 5 | AQ244: 盈峰转债
A245: 39 | B245: 128137 | C245: 洁美转债 | D245: 2859 | E245: 洁美科技 | F245: 电子 | G245: 元器件制 | H245: 113.56 | I245: -3.7599999999999995e-002 | J245: -1.5e-003 | K245: 25.85 | L245: -5.9299999999999999e-002 | M245: 117.3 | N245: 27.77 | O245: 0.22 | P245: 93.09 | Q245: 3月4天 | R245: 5.75年 | S245: 3.75年 | T245: 6 | U245: 29 | V245: 4.2999999999999997e-002 | W245: 5.5999999999999994e-002 | X245: 5.2999999999999999e-002 | Y245: 106 | Z245: 6.08 | AA245: 5.7999999999999996e-003 | AB245: 4.0000000000000002e-004 | AC245: -2.29e-002 | AD245: -2.4700000000000003e-002 | AE245: 81.04 | AF245: 81.83 | AG245: 0.66 | AH245: AA- | AI245: 6.6000000000000003e-002 | AJ245: =H245+100*O245 -> 135.56 | AK245: 134 | AL245: 256 | AM245: 52.2 | AN245: 284 | AO245: -7.6999999999999999e-002 | AP245: 4 | AQ245: 洁美转债
A246: 28 | B246: 123079 | C246: 运达转债 | D246: 300772 | E246: 运达股份 | F246: 能源电力 | G246: 风能 | H246: 111.488 | I246: -2.29e-002 | J246: 2.12e-002 | K246: 16.35 | L246: -2.3999999999999998e-003 | M246: 115.1 | N246: 15.31 | O246: 4.4000000000000004e-002 | P246: 106.79 | Q246: 4月2天 | R246: 5.82年 | S246: 3.82年 | T246: 5.77 | U246: 21 | V246: 3.3000000000000002e-002 | W246: 0.12 | X246: 0.128 | Y246: 48 | Z246: 3.12 | AA246: 5.6000000000000008e-003 | AB246: 8.9999999999999998e-004 | AC246: -1.84e-002 | AD246: -2.0099999999999996e-002 | AE246: 87.05 | AF246: 89.49 | AG246: 0.69 | AH246: AA | AI246: 4.4999999999999998e-002 | AJ246: =H246+100*O246 -> 115.88800000000001 | AK246: 116.2 | AL246: 136 | AM246: 26.7 | AN246: 151 | AO246: -6.4000000000000001e-002 | AP246: 4 | AQ246: 运达转债
A247: 122 | B247: 128113 | C247: 比音转债 | D247: 2832 | E247: 比音勒芬 | F247: 服装纺织 | G247: 服装行业 | H247: 113.989 | I247: 1.8500000000000003e-002 | J247: 8.0000000000000002e-003 | K247: 16.28 | L247: 3.8300000000000001e-002 | M247: 117.3 | N247: 14.9 | O247: 4.2999999999999997e-002 | P247: 109.26 | Q247: 转股中 | R247: 5.36年 | S247: 3.36年 | T247: 6.89 | U247: 53 | V247: 6.7000000000000004e-002 | W247: 8.1000000000000003e-002 | X247: 8.8000000000000009e-002 | Y247: 85 | Z247: 3.96 | AA247: 5.5000000000000005e-003 | AB247: -2.0000000000000001e-004 | AC247: -2.6499999999999999e-002 | AD247: -2.8500000000000001e-002 | AE247: 89.04 | AF247: 93.11 | AG247: 0.69 | AH247: AA | AI247: 4.4999999999999998e-002 | AJ247: =H247+100*O247 -> 118.289 | AK247: 118.7 | AL247: 162 | AM247: 25.6 | AN247: 141 | AO247: 5.2000000000000005e-002 | AP247: 7 | AQ247: 比音转债
A248: 37 | B248: 127025 | C248: 冀东转债 | D248: 401 | E248: 冀东水泥 | F248: 建筑 | G248: 水泥 | H248: 106.71 | I248: -2.7000000000000001e-003 | J248: 7.0999999999999995e-003 | K248: 14.04 | L248: 8.6e-003 | M248: 110.1 | N248: 15.78 | O248: 0.19899999999999998 | P248: 88.97 | Q248: 3月5天 | R248: 5.75年 | S248: 3.75年 | T248: 28.2 | U248: 14 | V248: 5.0000000000000001e-003 | W248: 0.14899999999999999 | X248: 0.13300000000000001 | Y248: 189 | Z248: 1.39 | AA248: 5.5000000000000005e-003 | AB248: 2.2000000000000001e-003 | AC248: -9.3999999999999986e-003 | AD248: -1.0800000000000001e-002 | AE248: 88.29 | AF248: 88.16 | AG248: 0.51 | AH248: AAA | AI248: 4.0000000000000001e-002 | AJ248: =H248+100*O248 -> 126.60999999999999 | AK248: 124.4 | AL248: 200 | AM248: 36.2 | AN248: 221 | AO248: -4.0000000000000001e-003 | AP248: 8 | AQ248: 冀东转债
A249: 42 | B249: 110076 | C249: 华海转债 | D249: 600521 | E249: 华海药业 | F249: 医药 | G249: 医药行业 | H249: 111.8 | I249: -6.7000000000000002e-003 | J249: -1.e-003 | K249: 26.51 | L249: -2.18e-002 | M249: 115.1 | N249: 34.66 | O249: 0.46200000000000002 | P249: 76.49 | Q249: 3月0天 | R249: 5.74年 | S249: 3.74年 | T249: 18.4 | U249: 21 | V249: 1.e-002 | W249: 4.8000000000000001e-002 | X249: 3.7000000000000005e-002 | Y249: 386 | Z249: 6.24 | AA249: 5.1999999999999998e-003 | AB249: 4.0000000000000002e-004 | AC249: -1.95e-002 | AD249: -2.12e-002 | AE249: 87.36 | AF249: 89.8 | AG249: 0.35 | AH249: AA | AI249: 4.4999999999999998e-002 | AJ249: =H249+100*O249 -> 158. | AK249: 147.1 | AL249: 289 | AM249: 57.3 | AN249: 293 | AO249: -4.8000000000000001e-002 | AP249: 5 | AQ249: 华海转债
A250: 64 | B250: 123066 | C250: 赛意转债 | D250: 300687 | E250: 赛意信息 | F250: 计算机及 | G250: 软件开发 | H250: 119.253 | I250: -9.8999999999999991e-003 | J250: -1.5600000000000001e-002 | K250: 25.87 | L250: -3.1400000000000004e-002 | M250: 121.4 | N250: 22.58 | O250: 4.0999999999999995e-002 | P250: 114.57 | Q250: 45天 | R250: 5.61年 | S250: 3.61年 | T250: 3.2 | U250: 14 | V250: 3.6000000000000004e-002 | W250: 5.7000000000000002e-002 | X250: 6.5000000000000002e-002 | Y250: 56 | Z250: 5.93 | AA250: 3.3e-003 | AB250: -3.3e-003 | AC250: -3.5099999999999999e-002 | AD250: -3.7200000000000004e-002 | AE250: 79.06 | AF250: 80.81 | AG250: 0.81 | AH250: A+ | AI250: 7.6999999999999999e-002 | AJ250: =H250+100*O250 -> 123.35299999999999 | AK250: 123.9 | AL250: 196 | AM250: 43.1 | AN250: 255 | AO250: -9.8000000000000004e-002 | AP250: 6 | AQ250: 赛意转债
A251: 190 | B251: 110065 | C251: 淮矿转债! | D251: 600985 | E251: 淮北矿业 | F251: 煤炭 | G251: 煤炭开采 | H251: 109.39 | I251: -1.3899999999999999e-002 | J251: 5.9999999999999995e-004 | K251: 9.73 | L251: -2.0099999999999996e-002 | M251: 110.8 | N251: 9.33 | O251: 4.9000000000000002e-002 | P251: 104.29 | Q251: 转股中 | R251: 4.88年 | S251: 2.88年 | T251: 27.4 | U251: 74 | V251: 2.4e-002 | W251: 0.13 | X251: 0.13500000000000001 | Y251: 211 | Z251: 1.02 | AA251: 2.7000000000000001e-003 | AB251: -1.4000000000000002e-003 | AC251: -1.8799999999999997e-002 | AD251: -2.0799999999999999e-002 | AE251: 92.1 | AF251: 92.38 | AG251: 0.66 | AH251: AAA | AI251: 3.8699999999999998e-002 | AJ251: =H251+100*O251 -> 114.29000000000001 | AK251: 114.5 | AL251: 121 | AM251: 22.1 | AN251: 106 | AO251: -0.10199999999999999 | AP251: 22 | AQ251: 淮矿转债!
A252: 338 | B252: 113009 | C252: 广汽转债! | D252: 601238 | E252: 广汽集团 | F252: 汽车 | G252: 乘用车 | H252: 105.9 | I252: -1.7000000000000001e-003 | J252: 1.2999999999999999e-003 | K252: 10.46 | L252: -3.4200000000000001e-002 | M252: 106 | N252: 14.23 | O252: 0.441 | P252: 73.51 | Q252: 转股中 | R252: 0.96年 | S252: 回售内 | T252: 25.5 | U252: 32 | V252: 1.2e-002 | W252: 2.4e-002 | X252: 1.7000000000000001e-002 | Y252: 1083. | Z252: 1.29 | AA252: 1.e-003 | AB252: -1.0800000000000001e-002 | AC252: 回售内 | AD252: 回售内 | AE252: 100.27 | AF252: 102.55 | AG252: 0.01 | AH252: AAA | AI252: 3.5000000000000003e-002 | AJ252: =H252+100*O252 -> 150. | AK252: 138.3 | AL252: 275 | AM252: 35.7 | AN252: 217 | AO252: -0.10400000000000001 | AP252: 16 | AQ252: 广汽转债!
A253: 101 | B253: 128121 | C253: 宏川转债 | D253: 2930 | E253: 宏川智慧 | F253: 交通运输 | G253: 物流业 | H253: 113.89 | I253: -9.7000000000000003e-003 | J253: -2.5000000000000001e-003 | K253: 18.89 | L253: -1.8200000000000001e-002 | M253: 113.3 | N253: 20.25 | O253: 0.221 | P253: 93.28 | Q253: 转股中 | R253: 5.45年 | S253: 3.45年 | T253: 6.7 | U253: 13 | V253: 1.8000000000000002e-002 | W253: 8.0000000000000002e-002 | X253: 7.4999999999999997e-002 | Y253: 84 | Z253: 4.36 | AA253: -1.e-003 | AB253: -5.4000000000000003e-003 | AC253: -2.5600000000000001e-002 | AD253: -2.76e-002 | AE253: 82.61 | AF253: 80.6 | AG253: 0.67 | AH253: AA- | AI253: 6.6000000000000003e-002 | AJ253: =H253+100*O253 -> 135.99000000000001 | AK253: 134.5 | AL253: 258 | AM253: 51.9 | AN253: 282 | AO253: -5.0000000000000001e-003 | AP253: 4 | AQ253: 宏川转债
A254: 147 | B254: 128106 | C254: 华统转债 | D254: 2840 | E254: 华统股份 | F254: 农业 | G254: 农产品加 | H254: 114.2 | I254: 0. | J254: 0. | K254: 8.69 | L254: 0. | M254: 113.2 | N254: 9.39 | O254: 0.23399999999999999 | P254: 92.55 | Q254: 转股中 | R254: 5.18年 | S254: 3.18年 | T254: 5.37 | U254: 8.1 | V254: 1.3000000000000001e-002 | W254: 0.13800000000000001 | X254: 0.128 | Y254: 39 | Z254: 2.32 | AA254: -1.7000000000000001e-003 | AB254: -6.3e-003 | AC254: -2.87e-002 | AD254: -3.0800000000000001e-002 | AE254: 89.65 | AF254: 90.57 | AG254: 0.55 | AH254: AA | AI254: 4.4999999999999998e-002 | AJ254: =H254+100*O254 -> 137.59999999999999 | AK254: 135.9 | AL254: 263 | AM254: 45.3 | AN254: 264 | AO254: -5.0000000000000003e-002 | AP254: 8 | AQ254: 华统转债
A255: 143 | B255: 113577 | C255: 春秋转债 | D255: 603890 | E255: 春秋电子 | F255: 电子 | G255: 电子产品 | H255: 119.32 | I255: -4.0300000000000002e-002 | J255: 6.8999999999999999e-003 | K255: 13.31 | L255: -4.1100000000000005e-002 | M255: 118.2 | N255: 11.06 | O255: -9.0000000000000011e-003 | P255: 120.34 | Q255: 转股中 | R255: 5.19年 | S255: 3.19年 | T255: 2.24 | U255: 53 | V255: 0.19399999999999998 | W255: 4.4000000000000004e-002 | X255: 5.2999999999999999e-002 | Y255: 51 | Z255: 3.04 | AA255: -1.9e-003 | AB255: -8.0000000000000002e-003 | AC255: -4.0300000000000002e-002 | AD255: -4.2500000000000003e-002 | AE255: 84.27 | AF255: 85.54 | AG255: 0.81 | AH255: AA- | AI255: 6.6000000000000003e-002 | AJ255: =H255+100*O255 -> 118.41999999999999 | AK255: 118.3 | AL255: 156 | AM255: 32.8 | AN255: 202 | AO255: -1.e-002 | AP255: 12 | AQ255: 春秋转债
A256: 68 | B256: 123064 | C256: 万孚转债! | D256: 300482 | E256: 万孚生物 | F256: 医药 | G256: 医疗器械 | H256: 116.601 | I256: -1.1399999999999999e-002 | J256: 2.9700000000000001e-002 | K256: 88.81 | L256: 3.2400000000000005e-002 | M256: 115.1 | N256: 93.57 | O256: 0.22899999999999998 | P256: 94.91 | Q256: 31天 | R256: 5.57年 | S256: 3.57年 | T256: 6 | U256: 12 | V256: 1.8000000000000002e-002 | W256: 2.e-002 | X256: 1.9e-002 | Y256: 304 | Z256: 11.24 | AA256: -2.3999999999999998e-003 | AB256: -7.1999999999999998e-003 | AC256: -3.1400000000000004e-002 | AD256: -3.32e-002 | AE256: 88.01 | AF256: 90.48 | AG256: 0.56 | AH256: AA | AI256: 4.4999999999999998e-002 | AJ256: =H256+100*O256 -> 139.501 | AK256: 138.3 | AL256: 274 | AM256: 47.8 | AN256: 275 | AO256: -2.e-002 | AP256: 9 | AQ256: 万孚转债!
A257: 120 | B257: 123055 | C257: 晨光转债!* | D257: 300138 | E257: 晨光生物 | F257: 食品饮料 | G257: 食品加工 | H257: 126.23 | I257: -1.46e-002 | J257: 0. | K257: 15.52 | L257: -1.46e-002 | M257: 124.3 | N257: 12.25 | O257: -4.0000000000000001e-003 | P257: 126.69 | Q257: 转股中 | R257: 5.36年 | S257: 3.36年 | T257: 2.83 | U257: 97 | V257: 0.26700000000000002 | W257: 3.4000000000000002e-002 | X257: 4.2999999999999997e-002 | Y257: 83 | Z257: 4.13 | AA257: -2.8999999999999998e-003 | AB257: -1.04e-002 | AC257: -5.3499999999999999e-002 | AD257: -5.5500000000000001e-002 | AE257: 83.42 | AF257: 88.93 | AG257: 1 | AH257: AA- | AI257: 6.6000000000000003e-002 | AJ257: =H257+100*O257 -> 125.83 | AK257: 125.8 | AL257: 205 | AM257: 36.8 | AN257: 226 | AO257: -1.9e-002 | AP257: 9 | AQ257: 晨光转债!*
A258: 61 | B258: 113603 | C258: 东缆转债 | D258: 603606 | E258: 东方电缆 | F258: 能源电力 | G258: 电力设备 | H258: 117.01 | I258: -3.3099999999999997e-002 | J258: 2.e-003 | K258: 23.16 | L258: -5.28e-002 | M258: 115.1 | N258: 23.88 | O258: 0.20600000000000002 | P258: 96.98 | Q258: 53天 | R258: 5.63年 | S258: 3.63年 | T258: 8 | U258: 30 | V258: 3.1e-002 | W258: 5.2999999999999999e-002 | X258: 5.0999999999999997e-002 | Y258: 151 | Z258: 5.59 | AA258: -3.0000000000000001e-003 | AB258: -7.7000000000000002e-003 | AC258: -3.1800000000000002e-002 | AD258: -3.3500000000000002e-002 | AE258: 87.77 | AF258: 90.23 | AG258: 0.59 | AH258: AA | AI258: 4.4999999999999998e-002 | AJ258: =H258+100*O258 -> 137.61000000000001 | AK258: 137 | AL258: 269 | AM258: 46.8 | AN258: 270 | AO258: -0.12300000000000001 | AP258: 6 | AQ258: 东缆转债
A259: 181 | B259: 123042 | C259: 银河转债! | D259: 300619 | E259: 金银河 | F259: 机械装备 | G259: 专用设备 | H259: 117.21 | I259: -3.5299999999999998e-002 | J259: 3.61e-002 | K259: 17.09 | L259: 2.3e-003 | M259: 115.4 | N259: 24.4 | O259: 0.67299999999999993 | P259: 70.04 | Q259: 转股中 | R259: 4.94年 | S259: 2.94年 | T259: 1.67 | U259: 439 | V259: 2.1299999999999999 | W259: 0.13100000000000001 | X259: 9.1999999999999998e-002 | Y259: 13 | Z259: 2.61 | AA259: -3.2000000000000002e-003 | AB259: -8.6999999999999994e-003 | AC259: -3.8900000000000004e-002 | AD259: -4.1100000000000005e-002 | AE259: 82.9 | AF259: 81.11 | AG259: 0.34 | AH259: A+ | AI259: 7.5700000000000003e-002 | AJ259: =H259+100*O259 -> 184.50999999999999 | AK259: 164.4 | AL259: 308 | AM259: 81.5 | AN259: 308 | AO259: -9.6000000000000002e-002 | AP259: 25 | AQ259: 银河转债!
A260: 208 | B260: 113548 | C260: 石英转债! | D260: 603688 | E260: 石英股份 | F260: 电子 | G260: 电子产品 | H260: 126.41 | I260: -1.0800000000000001e-002 | J260: 1.1200000000000002e-002 | K260: 17.16 | L260: 5.9999999999999995e-004 | M260: 124.4 | N260: 15.1 | O260: 0.11199999999999999 | P260: 113.64 | Q260: 转股中 | R260: 4.73年 | S260: 2.73年 | T260: 1.23 | U260: 57 | V260: 0.36799999999999999 | W260: 2.e-002 | X260: 2.3e-002 | Y260: 61 | Z260: 3.21 | AA260: -3.4999999999999996e-003 | AB260: -1.2e-002 | AC260: -6.4899999999999999e-002 | AD260: -6.7500000000000004e-002 | AE260: 87.19 | AF260: 93.14 | AG260: 0.73 | AH260: AA- | AI260: 6.4699999999999994e-002 | AJ260: =H260+100*O260 -> 137.60999999999999 | AK260: 139.2 | AL260: 279 | AM260: 46 | AN260: 267 | AO260: -0.14099999999999999 | AP260: 12 | AQ260: 石英转债!
A261: 305 | B261: 128035 | C261: 大族转债! | D261: 2008 | E261: 大族激光 | F261: 机械装备 | G261: 专用设备 | H261: 109.285 | I261: -2.9399999999999999e-002 | J261: 1.6799999999999999e-002 | K261: 42.18 | L261: -5.7200000000000001e-002 | M261: 108 | N261: 52.1 | O261: 0.34999999999999998 | P261: 80.96 | Q261: 转股中 | R261: 3年1.5天 | S261: 1年1.5天 | T261: 23 | U261: 21 | V261: 8.0000000000000002e-003 | W261: 5.0999999999999997e-002 | X261: 4.0999999999999995e-002 | Y261: 450 | Z261: 4.9 | AA261: -4.0000000000000001e-003 | AB261: -9.0000000000000011e-003 | AC261: -3.8599999999999995e-002 | AD261: -4.5499999999999999e-002 | AE261: 99.56 | AF261: 95.72 | AG261: 0.22 | AH261: AA+ | AI261: 4.1700000000000001e-002 | AJ261: =H261+100*O261 -> 144.285 | AK261: 137.6 | AL261: 272 | AM261: 38 | AN261: 233 | AO261: -0.10300000000000001 | AP261: 21 | AQ261: 大族转债!
A262: 178 | B262: 128096 | C262: 奥瑞转债!! | D262: 2701 | E262: 奥瑞金 | F262: 造纸包装 | G262: 包装材料 | H262: 118.339 | I262: -3.9000000000000003e-003 | J262: -1.5e-003 | K262: 4.81 | L262: -8.199999999999999e-003 | M262: 116 | N262: 4.54 | O262: 0.11699999999999999 | P262: 105.95 | Q262: 转股中 | R262: 5年6.5天 | S262: 3年6.5天 | T262: 7.08 | U262: 9.1 | V262: 1.1000000000000001e-002 | W262: 6.0999999999999999e-002 | X262: 6.5000000000000002e-002 | Y262: 116 | Z262: 1.95 | AA262: -4.0999999999999995e-003 | AB262: -9.7000000000000003e-003 | AC262: -3.9300000000000002e-002 | AD262: -4.1799999999999997e-002 | AE262: 91.43 | AF262: 94.42 | AG262: 0.66 | AH262: AA+ | AI262: 4.2999999999999997e-002 | AJ262: =H262+100*O262 -> 130.03899999999999 | AK262: 130.7 | AL262: 236 | AM262: 36.3 | AN262: 222 | AO262: 3.2000000000000001e-002 | AP262: 21 | AQ262: 奥瑞转债!!
A263: 249 | B263: 123025 | C263: 精测转债!! | D263: 300567 | E263: 精测电子 | F263: 电子 | G263: 液晶显示 | H263: 120.297 | I263: -1.7000000000000001e-003 | J263: -3.3799999999999997e-002 | K263: 51.8 | L263: -5.2699999999999997e-002 | M263: 117.3 | N263: 49.95 | O263: 0.16 | P263: 103.7 | Q263: 转股中 | R263: 4年52天 | S263: 2年52天 | T263: 3.09 | U263: 34 | V263: 9.0999999999999998e-002 | W263: 2.4e-002 | X263: 2.5000000000000001e-002 | Y263: 128 | Z263: 8.23 | AA263: -6.1999999999999998e-003 | AB263: -1.3500000000000002e-002 | AC263: -6.3299999999999995e-002 | AD263: -6.6000000000000003e-002 | AE263: 89.85 | AF263: 91.05 | AG263: 0.67 | AH263: AA- | AI263: 6.4699999999999994e-002 | AJ263: =H263+100*O263 -> 136.297 | AK263: 136.9 | AL263: 266 | AM263: 45.8 | AN263: 265 | AO263: -0.14800000000000002 | AP263: 18 | AQ263: 精测转债!!
A264: 9 | B264: 128142 | C264: 新乳转债 | D264: 2946 | E264: 新乳业 | F264: 食品饮料 | G264: 乳制品 | H264: 119.486 | I264: -1.41e-002 | J264: 2.07e-002 | K264: 17.69 | L264: 1.1399999999999999e-002 | M264: 115.1 | N264: 18.69 | O264: 0.26200000000000001 | P264: 94.65 | Q264: 4月19天 | R264: 5.87年 | S264: 3.87年 | T264: 7.18 | U264: 14 | V264: 1.6e-002 | W264: 4.8000000000000001e-002 | X264: 4.4999999999999998e-002 | Y264: 151 | Z264: 7.39 | AA264: -6.5000000000000006e-003 | AB264: -1.1000000000000001e-002 | AC264: -3.5000000000000003e-002 | AD264: -3.6600000000000001e-002 | AE264: 86.87 | AF264: 89.31 | AG264: 0.58 | AH264: AA | AI264: 4.4999999999999998e-002 | AJ264: =H264+100*O264 -> 145.68600000000001 | AK264: 144.3 | AL264: 283 | AM264: 55 | AN264: 287 | AO264: -8.900000000000001e-002 | AP264: 2 | AQ264: 新乳转债
A265: 105 | B265: 128119 | C265: 龙大转债 | D265: 2726 | E265: 龙大肉食 | F265: 食品饮料 | G265: 肉制品 | H265: 124.91 | I265: -1.9099999999999999e-002 | J265: 1.84e-002 | K265: 12 | L265: -8.0000000000000004e-004 | M265: 120.2 | N265: 9.57 | O265: -4.0000000000000001e-003 | P265: 125.39 | Q265: 转股中 | R265: 5.43年 | S265: 3.43年 | T265: 9.5 | U265: 57 | V265: 4.7e-002 | W265: 7.9000000000000001e-002 | X265: 0.10000000000000001 | Y265: 120 | Z265: 3.88 | AA265: -7.1999999999999998e-003 | AB265: -1.3500000000000002e-002 | AC265: -5.0799999999999998e-002 | AD265: -5.2600000000000001e-002 | AE265: 88.64 | AF265: 95.06 | AG265: 0.79 | AH265: AA | AI265: 4.4999999999999998e-002 | AJ265: =H265+100*O265 -> 124.50999999999999 | AK265: 124.4 | AL265: 199 | AM265: 29.4 | AN265: 180 | AO265: -5.9000000000000004e-002 | AP265: 7 | AQ265: 龙大转债
A266: 329 | B266: 113013 | C266: 国君转债! | D266: 601211 | E266: 国泰君安 | F266: 金融 | G266: 证券行业 | H266: 110.28 | I266: 2.9999999999999997e-004 | J266: 1.e-004 | K266: 16.18 | L266: 1.1999999999999999e-003 | M266: 108.3 | N266: 19.01 | O266: 0.29600000000000004 | P266: 85.11 | Q266: 转股中 | R266: 2.42年 | S266: 无权 | T266: 69.9 | U266: 122 | V266: 1.6e-002 | W266: 4.8000000000000001e-002 | X266: 4.0999999999999995e-002 | Y266: 1441. | Z266: 1.16 | AA266: -7.6e-003 | AB266: -1.3999999999999999e-002 | AC266: 无权 | AD266: 无权 | AE266: 无权 | AF266: 99.34 | AG266: 0.29 | AH266: AAA | AI266: 3.7100000000000001e-002 | AJ266: =H266+100*O266 -> 139.88 | AK266: 135.4 | AL266: 261 | AM266: 36.1 | AN266: 220 | AO266: -5.5999999999999994e-002 | AP266: 14 | AQ266: 国君转债!
A267: 265 | B267: 128053 | C267: 尚荣转债! | D267: 2551 | E267: 尚荣医疗 | F267: 医药 | G267: 医疗器械 | H267: 118.85 | I267: 3.9699999999999999e-002 | J267: -3.95e-002 | K267: 5.17 | L267: 2.9900000000000003e-002 | M267: 114.9 | N267: 4.89 | O267: 0.124 | P267: 105.73 | Q267: 转股中 | R267: 4年9天 | S267: 2年9天 | T267: 1.91 | U267: 951 | V267: 3.98 | W267: 4.4999999999999998e-002 | X267: 4.8000000000000001e-002 | Y267: 42 | Z267: 1.43 | AA267: -8.5000000000000006e-003 | AB267: -1.5100000000000001e-002 | AC267: -6.2300000000000001e-002 | AD267: -6.5000000000000002e-002 | AE267: 94.26 | AF267: 97.11 | AG267: 0 | AH267: AA | AI267: 4.3700000000000003e-002 | AJ267: =H267+100*O267 -> 131.25 | AK267: 132 | AL267: 246 | AM267: 34.9 | AN267: 212 | AO267: -0.11 | AP267: 28 | AQ267: 尚荣转债!
A268: 339 | B268: 110034 | C268: 九州转债! | D268: 600998 | E268: 九州通 | F268: 医药 | G268: 医药商业 | H268: 108.94 | I268: 2.e-003 | J268: -1.4000000000000002e-003 | K268: 17.15 | L268: 2.8999999999999998e-003 | M268: 108 | N268: 18.32 | O268: 0.16399999999999998 | P268: 93.61 | Q268: 转股中 | R268: 0.94年 | S268: 回售内 | T268: 15 | U268: 17 | V268: 1.1000000000000001e-002 | W268: 4.7e-002 | X268: 4.4000000000000004e-002 | Y268: 321 | Z268: 1.71 | AA268: -9.1999999999999998e-003 | AB268: -2.4700000000000003e-002 | AC268: 回售内 | AD268: 回售内 | AE268: 103 | AF268: 104.27 | AG268: 0.22 | AH268: AA+ | AI268: 3.7999999999999999e-002 | AJ268: =H268+100*O268 -> 125.34 | AK268: 124.3 | AL268: 198 | AM268: 20 | AN268: 78 | AO268: -6.3e-002 | AP268: 27 | AQ268: 九州转债!
A269: 40 | B269: 128136 | C269: 立讯转债 | D269: 2475 | E269: 立讯精密 | F269: 电子 | G269: 元器件制 | H269: 118.8 | I269: 5.9999999999999995e-004 | J269: 4.4000000000000003e-003 | K269: 49.52 | L269: 1.06e-002 | M269: 111.9 | N269: 58.44 | O269: 0.40200000000000002 | P269: 84.74 | Q269: 3月3天 | R269: 5.74年 | S269: 3.74年 | T269: 30 | U269: 102 | V269: 2.8999999999999998e-002 | W269: 9.0000000000000011e-003 | X269: 6.9999999999999993e-003 | Y269: 3478. | Z269: 13.89 | AA269: -1.0500000000000001e-002 | AB269: -1.4199999999999999e-002 | AC269: -3.7400000000000003e-002 | AD269: -3.85e-002 | AE269: 86.9 | AF269: 88.1 | AG269: 0.47 | AH269: AA+ | AI269: 4.2999999999999997e-002 | AJ269: =H269+100*O269 -> 159. | AK269: 152.9 | AL269: 299 | AM269: 64.8 | AN269: 303 | AO269: -0.115 | AP269: 10 | AQ269: 立讯转债
A270: 302 | B270: 127005 | C270: 长证转债! | D270: 783 | E270: 长江证券 | F270: 金融 | G270: 证券行业 | H270: 113 | I270: -3.6699999999999997e-002 | J270: 3.0200000000000001e-002 | K270: 7.03 | L270: -1.26e-002 | M270: 109.3 | N270: 7.28 | O270: 0.17000000000000001 | P270: 96.57 | Q270: 转股中 | R270: 3年35天 | S270: 无权 | T270: 50 | U270: 111 | V270: 1.9e-002 | W270: 0.129 | X270: 0.124 | Y270: 389 | Z270: 1.39 | AA270: -1.09e-002 | AB270: -1.6500000000000001e-002 | AC270: 无权 | AD270: 无权 | AE270: 无权 | AF270: 97.44 | AG270: 0.51 | AH270: AAA | AI270: 3.8699999999999998e-002 | AJ270: =H270+100*O270 -> 130. | AK270: 129.4 | AL270: 227 | AM270: 32 | AN270: 198 | AO270: -0.122 | AP270: 15 | AQ270: 长证转债!
A271: 273 | B271: 128050 | C271: 钧达转债! | D271: 2865 | E271: 钧达股份 | F271: 汽车 | G271: 零部件制 | H271: 128.88 | I271: 2.9300000000000003e-002 | J271: -3.9399999999999998e-002 | K271: 18.46 | L271: -1.2800000000000001e-002 | M271: 122.7 | N271: 14.85 | O271: 3.7000000000000005e-002 | P271: 124.31 | Q271: 转股中 | R271: 3.85年 | S271: 1.85年 | T271: 1.96 | U271: 291 | V271: 1.1499999999999999 | W271: 8.199999999999999e-002 | X271: 0.10199999999999999 | Y271: 24 | Z271: 2.58 | AA271: -1.29e-002 | AB271: -2.2700000000000001e-002 | AC271: -0.106 | AD271: -0.10800000000000001 | AE271: 90.93 | AF271: 96.86 | AG271: 0.78 | AH271: AA- | AI271: 6.4699999999999994e-002 | AJ271: =H271+100*O271 -> 132.57999999999998 | AK271: 133.5 | AL271: 254 | AM271: 36.6 | AN271: 224 | AO271: 4.0000000000000001e-003 | AP271: 59 | AQ271: 钧达转债!
A272: 60 | B272: 128134 | C272: 鸿路转债! | D272: 2541 | E272: 鸿路钢构 | F272: 建筑 | G272: 其他 | H272: 124.98 | I272: 7.9000000000000008e-003 | J272: 3.3000000000000002e-002 | K272: 49.06 | L272: 5.5300000000000002e-002 | M272: 115.1 | N272: 43.74 | O272: 0.114 | P272: 112.16 | Q272: 2月9天 | R272: 5.68年 | S272: 3.68年 | T272: 18.8 | U272: 275 | V272: 0.114 | W272: 7.2999999999999995e-002 | X272: 8.199999999999999e-002 | Y272: 257 | Z272: 4.8 | AA272: -1.46e-002 | AB272: -1.9299999999999998e-002 | AC272: -4.8000000000000001e-002 | AD272: -4.9699999999999994e-002 | AE272: 87.61 | AF272: 90.06 | AG272: 0.74 | AH272: AA | AI272: 4.4999999999999998e-002 | AJ272: =H272+100*O272 -> 136.38 | AK272: 137.8 | AL272: 273 | AM272: 47.7 | AN272: 274 | AO272: 3.3000000000000002e-002 | AP272: 4 | AQ272: 鸿路转债!
A273: 333 | B273: 113012 | C273: 骆驼转债! | D273: 601311 | E273: 骆驼股份 | F273: 汽车 | G273: 零部件制 | H273: 111.29 | I273: 8.3999999999999995e-003 | J273: -2.07e-002 | K273: 9.72 | L273: -2.5099999999999997e-002 | M273: 107.8 | N273: 10.06 | O273: 0.152 | P273: 96.62 | Q273: 转股中 | R273: 2年47天 | S273: 47天 | T273: 5.1 | U273: 32 | V273: 5.7000000000000002e-002 | W273: 4.7e-002 | X273: 4.4999999999999998e-002 | Y273: 109 | Z273: 1.63 | AA273: -1.5100000000000001e-002 | AB273: -2.1899999999999999e-002 | AC273: -0.32200000000000001 | AD273: -0.33200000000000002 | AE273: 100.33 | AF273: 98.9 | AG273: 0.49 | AH273: AA | AI273: 4.2099999999999999e-002 | AJ273: =H273+100*O273 -> 126.49000000000001 | AK273: 126 | AL273: 206 | AM273: 25.6 | AN273: 142 | AO273: -2.9999999999999999e-002 | AP273: 18 | AQ273: 骆驼转债!
A274: 267 | B274: 113526 | C274: 联泰转债! | D274: 603797 | E274: 联泰环保 | F274: 城市公用 | G274: 三废处理 | H274: 117.15 | I274: -1.8600000000000002e-002 | J274: 1.6500000000000001e-002 | K274: 6.95 | L274: -2.8999999999999998e-003 | M274: 110.3 | N274: 6.11 | O274: 2.9999999999999999e-002 | P274: 113.75 | Q274: 转股中 | R274: 3.97年 | S274: 1.97年 | T274: 1.93 | U274: 1.7 | V274: 8.0000000000000002e-003 | W274: 6.2e-002 | X274: 7.0000000000000007e-002 | Y274: 31 | Z274: 2.02 | AA274: -1.5300000000000001e-002 | AB274: -2.e-002 | AC274: -5.9800000000000006e-002 | AD274: -6.2199999999999998e-002 | AE274: 94.28 | AF274: 94.08 | AG274: 0.72 | AH274: AA+ | AI274: 4.1700000000000001e-002 | AJ274: =H274+100*O274 -> 120.15000000000001 | AK274: 120.6 | AL274: 174 | AM274: 26.3 | AN274: 148 | AO274: -5.0999999999999997e-002 | AP274: 9 | AQ274: 联泰转债!
A275: 255 | B275: 123022 | C275: 长信转债!! | D275: 300088 | E275: 长信科技 | F275: 通信互联 | G275: 通信设备 | H275: 122.3 | I275: -3.7000000000000005e-002 | J275: 1.18e-002 | K275: 7.46 | L275: -3.2400000000000005e-002 | M275: 114.9 | N275: 6.15 | O275: 8.0000000000000002e-003 | P275: 121.3 | Q275: 转股中 | R275: 4年41天 | S275: 2年41天 | T275: 2.57 | U275: 18 | V275: 5.7000000000000002e-002 | W275: 1.3999999999999999e-002 | X275: 1.7000000000000001e-002 | Y275: 183 | Z275: 2.65 | AA275: -1.54e-002 | AB275: -2.1700000000000001e-002 | AC275: -7.1800000000000003e-002 | AD275: -7.4299999999999991e-002 | AE275: 93.91 | AF275: 96.74 | AG275: 0.78 | AH275: AA | AI275: 4.3700000000000003e-002 | AJ275: =H275+100*O275 -> 123.09999999999999 | AK275: 123.3 | AL275: 191 | AM275: 26.6 | AN275: 150 | AO275: -0.124 | AP275: 12 | AQ275: 长信转债!!
A276: 58 | B276: 110075 | C276: 南航转债 | D276: 600029 | E276: 南方航空 | F276: 交通运输 | G276: 航空运输 | H276: 120.49 | I276: 1.e-002 | J276: 1.6799999999999999e-002 | K276: 5.95 | L276: 4.5700000000000005e-002 | M276: 110 | N276: 6.24 | O276: 0.26400000000000001 | P276: 95.35 | Q276: 2月15天 | R276: 5.69年 | S276: 3.69年 | T276: 160 | U276: 172 | V276: 9.0000000000000011e-003 | W276: 0.17499999999999999 | X276: 0.16699999999999998 | Y276: 912 | Z276: 1.27 | AA276: -1.61e-002 | AB276: -1.9199999999999998e-002 | AC276: -4.1900000000000007e-002 | AD276: -4.2900000000000001e-002 | AE276: 87.97 | AF276: 88.24 | AG276: 0.59 | AH276: AAA | AI276: 4.0000000000000001e-002 | AJ276: =H276+100*O276 -> 146.88999999999999 | AK276: 145.6 | AL276: 286 | AM276: 57.4 | AN276: 295 | AO276: 4.0999999999999995e-002 | AP276: 8 | AQ276: 南航转债
A277: 54 | B277: 128135 | C277: 洽洽转债 | D277: 2557 | E277: 洽洽食品 | F277: 食品饮料 | G277: 休闲食品 | H277: 131.85 | I277: 1.5800000000000002e-002 | J277: -3.8e-003 | K277: 68.5 | L277: 1.7100000000000001e-002 | M277: 120.2 | N277: 60.83 | O277: 0.17100000000000001 | P277: 112.61 | Q277: 2月20天 | R277: 5.71年 | S277: 3.71年 | T277: 13.4 | U277: 111 | V277: 6.3e-002 | W277: 3.9e-002 | X277: 4.2999999999999997e-002 | Y277: 347 | Z277: 9.06 | AA277: -1.6299999999999999e-002 | AB277: -2.23e-002 | AC277: -6.0599999999999994e-002 | AD277: -6.2300000000000001e-002 | AE277: 87.59 | AF277: 93.93 | AG277: 0.7 | AH277: AA | AI277: 4.4999999999999998e-002 | AJ277: =H277+100*O277 -> 148.94999999999999 | AK277: 151.1 | AL277: 296 | AM277: 57.2 | AN277: 291 | AO277: 8.9999999999999997e-002 | AP277: 8 | AQ277: 洽洽转债
A278: 154 | B278: 110069 | C278: 瀚蓝转债 | D278: 600323 | E278: 瀚蓝环境 | F278: 城市公用 | G278: 三废处理 | H278: 123.51 | I278: -4.0000000000000001e-003 | J278: -1.9e-003 | K278: 21.02 | L278: -9.0000000000000011e-003 | M278: 113.5 | N278: 20.2 | O278: 0.187 | P278: 104.06 | Q278: 转股中 | R278: 5.17年 | S278: 3.17年 | T278: 9.83 | U278: 15 | V278: 1.2e-002 | W278: 6.0999999999999999e-002 | X278: 6.3e-002 | Y278: 161 | Z278: 2.25 | AA278: -1.6399999999999998e-002 | AB278: -2.1000000000000001e-002 | AC278: -5.5399999999999998e-002 | AD278: -5.6600000000000004e-002 | AE278: 88.94 | AF278: 91.57 | AG278: 0.66 | AH278: AA+ | AI278: 4.2999999999999997e-002 | AJ278: =H278+100*O278 -> 142.21000000000001 | AK278: 143 | AL278: 282 | AM278: 51.4 | AN278: 280 | AO278: -9.4e-002 | AP278: 8 | AQ278: 瀚蓝转债
A279: 221 | B279: 123030 | C279: 九洲转债! | D279: 300040 | E279: 九洲集团 | F279: 能源电力 | G279: 电力设备 | H279: 129.487 | I279: -6.2e-002 | J279: 6.7699999999999996e-002 | K279: 5.85 | L279: 8.6e-003 | M279: 120 | N279: 5.65 | O279: 0.251 | P279: 103.54 | Q279: 转股中 | R279: 4.54年 | S279: 2.54年 | T279: 0.97 | U279: 171 | V279: 1.3200000000000001 | W279: 4.4000000000000004e-002 | X279: 4.4999999999999998e-002 | Y279: 22 | Z279: 1.02 | AA279: -1.6899999999999998e-002 | AB279: -2.4300000000000002e-002 | AC279: -8.0299999999999996e-002 | AD279: -8.2400000000000001e-002 | AE279: 87.53 | AF279: 90.82 | AG279: 0.66 | AH279: AA- | AI279: 6.4699999999999994e-002 | AJ279: =H279+100*O279 -> 154.58699999999999 | AK279: 155.4 | AL279: 302 | AM279: 64.6 | AN279: 302 | AO279: -0.106 | AP279: 28 | AQ279: 九洲转债!
A280: 205 | B280: 110061 | C280: 川投转债 | D280: 600674 | E280: 川投能源 | F280: 能源电力 | G280: 水电 | H280: 121.05 | I280: 1.21e-002 | J280: -3.2000000000000002e-003 | K280: 10.73 | L280: 1.23e-002 | M280: 110.8 | N280: 9.58 | O280: 8.1000000000000003e-002 | P280: 112 | Q280: 转股中 | R280: 4.77年 | S280: 2.77年 | T280: 40 | U280: 13 | V280: 3.0000000000000001e-003 | W280: 8.5000000000000006e-002 | X280: 9.5000000000000001e-002 | Y280: 472 | Z280: 1.71 | AA280: -1.8700000000000001e-002 | AB280: -2.2799999999999997e-002 | AC280: -5.3099999999999994e-002 | AD280: -5.5099999999999996e-002 | AE280: 92.51 | AF280: 92.78 | AG280: 0.73 | AH280: AAA | AI280: 3.8699999999999998e-002 | AJ280: =H280+100*O280 -> 129.15000000000001 | AK280: 130.1 | AL280: 231 | AM280: 37.3 | AN280: 229 | AO280: 2.3e-002 | AP280: 16 | AQ280: 川投转债
A281: 8 | B281: 123090 | C281: 三诺转债 | D281: 300298 | E281: 三诺生物 | F281: 医药 | G281: 医疗器械 | H281: 131 | I281: -5.7999999999999996e-003 | J281: -5.0000000000000001e-004 | K281: 38.68 | L281: -9.1999999999999998e-003 | M281: 117.1 | N281: 35.35 | O281: 0.19699999999999998 | P281: 109.42 | Q281: 4月20天 | R281: 5.88年 | S281: 3.88年 | T281: 5 | U281: 189 | V281: 0.28100000000000003 | W281: 2.3e-002 | X281: 2.5000000000000001e-002 | Y281: 219 | Z281: 8.08 | AA281: -1.9199999999999998e-002 | AB281: -2.4199999999999999e-002 | AC281: -5.6799999999999996e-002 | AD281: -5.8400000000000001e-002 | AE281: 86.84 | AF281: 90.82 | AG281: 0.68 | AH281: AA | AI281: 4.4999999999999998e-002 | AJ281: =H281+100*O281 -> 150.69999999999999 | AK281: 152.6 | AL281: 298 | AM281: 61.8 | AN281: 300 | AO281: -5.0000000000000001e-003 | AP281: 3 | AQ281: 三诺转债
A282: 285 | B282: 123014 | C282: 凯发转债! | D282: 300407 | E282: 凯发电气 | F282: 能源电力 | G282: 电力设备 | H282: 114 | I282: -6.1600000000000002e-002 | J282: 6.1799999999999994e-002 | K282: 6.07 | L282: 1.7000000000000001e-003 | M282: 108.5 | N282: 8.12 | O282: 0.52500000000000002 | P282: 74.75 | Q282: 转股中 | R282: 2.47年 | S282: 0.47年 | T282: 1.16 | U282: 60 | V282: 0.43700000000000006 | W282: 6.3e-002 | X282: 4.7e-002 | Y282: 19 | Z282: 1.37 | AA282: -2.0099999999999996e-002 | AB282: -2.63e-002 | AC282: -0.184 | AD282: -0.187 | AE282: 96.75 | AF282: 91.15 | AG282: 0.12 | AH282: A+ | AI282: 7.4099999999999999e-002 | AJ282: =H282+100*O282 -> 166.5 | AK282: 153.2 | AL282: 300 | AM282: 56.5 | AN282: 290 | AO282: -0.115 | AP282: 17 | AQ282: 凯发转债!
A283: 49 | B283: 113605 | C283: 大参转债 | D283: 603233 | E283: 大参林 | F283: 医药 | G283: 医药商业 | H283: 130.33 | I283: 8.0000000000000004e-004 | J283: -3.8e-003 | K283: 94.92 | L283: -4.0000000000000001e-003 | M283: 115.2 | N283: 83.85 | O283: 0.151 | P283: 113.2 | Q283: 2月22天 | R283: 5.71年 | S283: 3.71年 | T283: 14.1 | U283: 28 | V283: 1.4999999999999999e-002 | W283: 2.2000000000000002e-002 | X283: 2.5000000000000001e-002 | Y283: 625 | Z283: 12.48 | AA283: -2.1700000000000001e-002 | AB283: -2.63e-002 | AC283: -5.7699999999999994e-002 | AD283: -5.9400000000000001e-002 | AE283: 87.57 | AF283: 90.02 | AG283: 0.75 | AH283: AA | AI283: 4.4999999999999998e-002 | AJ283: =H283+100*O283 -> 145.43000000000001 | AK283: 147.5 | AL283: 291 | AM283: 57.4 | AN283: 296 | AO283: 8.0000000000000002e-003 | AP283: 5 | AQ283: 大参转债
A284: 304 | B284: 113504 | C284: 艾华转债!! | D284: 603989 | E284: 艾华集团 | F284: 电子 | G284: 元器件制 | H284: 118.14 | I284: 3.8e-003 | J284: -1.4199999999999999e-002 | K284: 24.06 | L284: -1.3899999999999999e-002 | M284: 110.3 | N284: 21.13 | O284: 3.7999999999999999e-002 | P284: 113.87 | Q284: 转股中 | R284: 3年25天 | S284: 1年25天 | T284: 5.59 | U284: 25 | V284: 3.7999999999999999e-002 | W284: 5.9000000000000004e-002 | X284: 6.7000000000000004e-002 | Y284: 95 | Z284: 3.95 | AA284: -2.2599999999999999e-002 | AB284: -2.86e-002 | AC284: -0.10300000000000001 | AD284: -0.106 | AE284: 97.57 | AF284: 97.03 | AG284: 0.74 | AH284: AA | AI284: 4.3700000000000003e-002 | AJ284: =H284+100*O284 -> 121.94 | AK284: 122.4 | AL284: 186 | AM284: 24.8 | AN284: 129 | AO284: -2.5000000000000001e-002 | AP284: 9 | AQ284: 艾华转债!!
A285: 152 | B285: 113575 | C285: 东时转债! | D285: 603377 | E285: 东方时尚 | F285: 其他 | G285: 其他 | H285: 127.77 | I285: -7.4299999999999991e-002 | J285: 8.0700000000000008e-002 | K285: 11.14 | L285: 1.9199999999999998e-002 | M285: 113.5 | N285: 14.56 | O285: 0.67000000000000004 | P285: 76.51 | Q285: 转股中 | R285: 5.17年 | S285: 3.17年 | T285: 0.99 | U285: 403 | V285: 3.0499999999999998 | W285: 1.4999999999999999e-002 | X285: 1.1000000000000001e-002 | Y285: 68 | Z285: 3.49 | AA285: -2.3099999999999999e-002 | AB285: -2.76e-002 | AC285: -6.08e-002 | AD285: -6.2800000000000009e-002 | AE285: 89.79 | AF285: 90.84 | AG285: 0.33 | AH285: AA | AI285: 4.4999999999999998e-002 | AJ285: =H285+100*O285 -> 194.76999999999998 | AK285: 179 | AL285: 313 | AM285: 88.2 | AN285: 312 | AO285: -0.24600000000000002 | AP285: 15 | AQ285: 东时转债!
A286: 128 | B286: 113585 | C286: 寿仙转债 | D286: 603896 | E286: 寿仙谷 | F286: 医药 | G286: 中药 | H286: 133.13 | I286: -1.7899999999999999e-002 | J286: 8.199999999999999e-003 | K286: 38.58 | L286: -1.0800000000000001e-002 | M286: 117.8 | N286: 28.68 | O286: -1.e-002 | P286: 134.52 | Q286: 转股中 | R286: 5.34年 | S286: 3.34年 | T286: 2.19 | U286: 34 | V286: 0.114 | W286: 3.7999999999999999e-002 | X286: 5.2000000000000005e-002 | Y286: 57 | Z286: 4.49 | AA286: -2.3099999999999999e-002 | AB286: -2.87e-002 | AC286: -6.8400000000000002e-002 | AD286: -7.0400000000000004e-002 | AE286: 83.47 | AF286: 84.41 | AG286: 0.9 | AH286: AA- | AI286: 6.6000000000000003e-002 | AJ286: =H286+100*O286 -> 132.13 | AK286: 131.7 | AL286: 243 | AM286: 47.3 | AN286: 273 | AO286: 4.0999999999999995e-002 | AP286: 9 | AQ286: 寿仙转债
A287: 160 | B287: 123046 | C287: 天铁转债! | D287: 300587 | E287: 天铁股份 | F287: 铁路 | G287: 铁路设备 | H287: 133 | I287: -5.67e-002 | J287: 6.1500000000000006e-002 | K287: 12.59 | L287: 5.6000000000000008e-003 | M287: 118.2 | N287: 10.12 | O287: 6.9000000000000006e-002 | P287: 124.41 | Q287: 转股中 | R287: 5年42天 | S287: 3年42天 | T287: 0.99 | U287: 281 | V287: 2.1099999999999999 | W287: 2.3e-002 | X287: 2.8999999999999998e-002 | Y287: 43 | Z287: 3.09 | AA287: -2.3300000000000001e-002 | AB287: -2.9300000000000003e-002 | AC287: -7.2700000000000001e-002 | AD287: -7.4800000000000005e-002 | AE287: 84.65 | AF287: 85.93 | AG287: 0.85 | AH287: AA- | AI287: 6.6000000000000003e-002 | AJ287: =H287+100*O287 -> 139.90000000000001 | AK287: 141.6 | AL287: 281 | AM287: 55.7 | AN287: 288 | AO287: -3.7000000000000005e-002 | AP287: 12 | AQ287: 天铁转债!
A288: 182 | B288: 127015 | C288: 希望转债! | D288: 876 | E288: 新 希 望 | F288: 农业 | G288: 畜牧业 | H288: 123.699 | I288: -3.2000000000000002e-003 | J288: 4.4000000000000003e-003 | K288: 23.48 | L288: 1.2999999999999999e-003 | M288: 110 | N288: 19.75 | O288: 4.0000000000000001e-002 | P288: 118.89 | Q288: 转股中 | R288: 4.91年 | S288: 2.91年 | T288: 9.5 | U288: 263 | V288: 0.218 | W288: 9.0000000000000011e-003 | X288: 1.1000000000000001e-002 | Y288: 1058. | Z288: 2.92 | AA288: -2.4e-002 | AB288: -2.76e-002 | AC288: -5.91e-002 | AD288: -6.0700000000000004e-002 | AE288: 91.42 | AF288: 91.55 | AG288: 1 | AH288: AAA | AI288: 3.8699999999999998e-002 | AJ288: =H288+100*O288 -> 127.699 | AK288: 128.5 | AL288: 218 | AM288: 37 | AN288: 227 | AO288: 3.2000000000000001e-002 | AP288: 29 | AQ288: 希望转债!
A289: 176 | B289: 128097 | C289: 奥佳转债! | D289: 2614 | E289: 奥佳华 | F289: 机械装备 | G289: 专用设备 | H289: 131.3 | I289: -4.8600000000000004e-002 | J289: -1.7500000000000002e-002 | K289: 13.25 | L289: -8.3000000000000004e-002 | M289: 115.3 | N289: 10.69 | O289: 5.9000000000000004e-002 | P289: 123.95 | Q289: 转股中 | R289: 5年20天 | S289: 3年20天 | T289: 5.85 | U289: 72 | V289: 9.4e-002 | W289: 7.0999999999999994e-002 | X289: 8.8000000000000009e-002 | Y289: 82 | Z289: 1.94 | AA289: -2.5899999999999999e-002 | AB289: -3.1e-002 | AC289: -7.1099999999999997e-002 | AD289: -7.3099999999999998e-002 | AE289: 90.24 | AF289: 92.75 | AG289: 0.79 | AH289: AA | AI289: 4.4999999999999998e-002 | AJ289: =H289+100*O289 -> 137.20000000000002 | AK289: 138.7 | AL289: 277 | AM289: 45.9 | AN289: 266 | AO289: -8.0000000000000002e-002 | AP289: 25 | AQ289: 奥佳转债!
A290: 104 | B290: 123058 | C290: 欣旺转债 | D290: 300207 | E290: 欣旺达 | F290: 电子 | G290: 电子产品 | H290: 135.9 | I290: -1.7399999999999999e-002 | J290: -1.3899999999999999e-002 | K290: 26.02 | L290: -3.9900000000000005e-002 | M290: 116.3 | N290: 21.24 | O290: 0.109 | P290: 122.5 | Q290: 转股中 | R290: 5.44年 | S290: 3.44年 | T290: 11.2 | U290: 24 | V290: 1.4999999999999999e-002 | W290: 2.7000000000000003e-002 | X290: 3.3000000000000002e-002 | Y290: 410 | Z290: 6.47 | AA290: -2.8799999999999999e-002 | AB290: -3.3799999999999997e-002 | AC290: -7.2700000000000001e-002 | AD290: -7.4499999999999997e-002 | AE290: 88.73 | AF290: 91.99 | AG290: 0.78 | AH290: AA | AI290: 4.4999999999999998e-002 | AJ290: =H290+100*O290 -> 146.80000000000001 | AK290: 149.3 | AL290: 292 | AM290: 57.3 | AN290: 292 | AO290: -4.0999999999999995e-002 | AP290: 7 | AQ290: 欣旺转债
A291: 136 | B291: 128108 | C291: 蓝帆转债! | D291: 2382 | E291: 蓝帆医疗 | F291: 医药 | G291: 医疗器械 | H291: 132 | I291: -6.4500000000000002e-002 | J291: 1.18e-002 | K291: 23.58 | L291: -6.2100000000000002e-002 | M291: 113.3 | N291: 17.79 | O291: -4.0000000000000001e-003 | P291: 132.55 | Q291: 转股中 | R291: 5.31年 | S291: 4.31年 | T291: 17.9 | U291: 512 | V291: 0.20600000000000002 | W291: 7.400000000000001e-002 | X291: 9.6999999999999989e-002 | Y291: 244 | Z291: 2.38 | AA291: -2.8900000000000002e-002 | AB291: -3.32e-002 | AC291: -4.9299999999999997e-002 | AD291: -5.1500000000000004e-002 | AE291: 87.04 | AF291: 90.14 | AG291: 0.85 | AH291: AA | AI291: 4.4999999999999998e-002 | AJ291: =H291+100*O291 -> 131.59999999999999 | AK291: 131.5 | AL291: 241 | AM291: 41.3 | AN291: 247 | AO291: -4.2999999999999997e-002 | AP291: 25 | AQ291: 蓝帆转债!
A292: 123 | B292: 113587 | C292: 泛微转债!* | D292: 603039 | E292: 泛微网络 | F292: 计算机及 | G292: 软件开发 | H292: 145.97 | I292: 3.04e-002 | J292: 1.1000000000000001e-003 | K292: 94.68 | L292: 3.15e-002 | M292: 124.3 | N292: 64.33 | O292: -8.0000000000000002e-003 | P292: 147.18 | Q292: 转股中 | R292: 5.36年 | S292: 3.36年 | T292: 1.01 | U292: 141 | V292: 0.95799999999999996 | W292: 5.0000000000000001e-003 | X292: 6.9999999999999993e-003 | Y292: 202 | Z292: 20.85 | AA292: -3.0099999999999998e-002 | AB292: -3.7400000000000003e-002 | AC292: -9.2200000000000004e-002 | AD292: -9.4100000000000003e-002 | AE292: 83.45 | AF292: 88.96 | AG292: 1 | AH292: AA- | AI292: 6.6000000000000003e-002 | AJ292: =H292+100*O292 -> 145.16999999999999 | AK292: 144.8 | AL292: 285 | AM292: 55.8 | AN292: 289 | AO292: 1.8000000000000002e-002 | AP292: 6 | AQ292: 泛微转债!*
A293: 256 | B293: 110055 | C293: 伊力转债!! | D293: 600197 | E293: 伊力特 | F293: 食品饮料 | G293: 白酒 | H293: 130.72 | I293: -0.109 | J293: 6.0599999999999994e-002 | K293: 21.12 | L293: -6.0100000000000001e-002 | M293: 115 | N293: 16.81 | O293: 4.0000000000000001e-002 | P293: 125.64 | Q293: 转股中 | R293: 4年38天 | S293: 2年38天 | T293: 2.85 | U293: 278 | V293: 0.69099999999999995 | W293: 2.8999999999999998e-002 | X293: 3.6000000000000004e-002 | Y293: 99 | Z293: 3.43 | AA293: -3.1400000000000004e-002 | AB293: -3.7599999999999995e-002 | AC293: -9.8800000000000013e-002 | AD293: -0.10099999999999999 | AE293: 94.04 | AF293: 96.88 | AG293: 0.81 | AH293: AA | AI293: 4.3700000000000003e-002 | AJ293: =H293+100*O293 -> 134.72 | AK293: 135.8 | AL293: 262 | AM293: 38.9 | AN293: 236 | AO293: -0.13800000000000001 | AP293: 25 | AQ293: 伊力转债!!
A294: 241 | B294: 113025 | C294: 明泰转债! | D294: 601677 | E294: 明泰铝业 | F294: 有色金属 | G294: 铝金属 | H294: 131.34 | I294: -4.2699999999999995e-002 | J294: 1.2e-002 | K294: 14.81 | L294: -3.6400000000000002e-002 | M294: 115.1 | N294: 11.2 | O294: -6.9999999999999993e-003 | P294: 132.23 | Q294: 转股中 | R294: 4.18年 | S294: 2.18年 | T294: 12.8 | U294: 66 | V294: 3.7999999999999999e-002 | W294: 0.13100000000000001 | X294: 0.17300000000000001 | Y294: 98 | Z294: 1.21 | AA294: -3.1699999999999999e-002 | AB294: -3.7900000000000003e-002 | AC294: -9.7899999999999987e-002 | AD294: -0.10000000000000001 | AE294: 93.68 | AF294: 96.66 | AG294: 0.84 | AH294: AA | AI294: 4.3700000000000003e-002 | AJ294: =H294+100*O294 -> 130.64000000000001 | AK294: 130.4 | AL294: 232 | AM294: 33.8 | AN294: 207 | AO294: 2.e-003 | AP294: 30 | AQ294: 明泰转债!
A295: 124 | B295: 128112 | C295: 歌尔转2!* | D295: 2241 | E295: 歌尔股份 | F295: 电子 | G295: 电子产品 | H295: 136 | I295: -4.4299999999999999e-002 | J295: 6.8999999999999999e-003 | K295: 31.91 | L295: -3.7400000000000003e-002 | M295: 114.5 | N295: 23.27 | O295: -8.0000000000000002e-003 | P295: 137.13 | Q295: 转股中 | R295: 5.35年 | S295: 3.35年 | T295: 16.6 | U295: 324 | V295: 0.13900000000000001 | W295: 1.6e-002 | X295: 2.1000000000000001e-002 | Y295: 1065. | Z295: 5.92 | AA295: -3.2099999999999997e-002 | AB295: -3.6699999999999997e-002 | AC295: -7.6399999999999996e-002 | AD295: -7.7899999999999997e-002 | AE295: 88.92 | AF295: 91.73 | AG295: 1 | AH295: AA+ | AI295: 4.2999999999999997e-002 | AJ295: =H295+100*O295 -> 135.19999999999999 | AK295: 134.9 | AL295: 259 | AM295: 43.1 | AN295: 256 | AO295: -0.184 | AP295: 17 | AQ295: 歌尔转2!*
A296: 6 | B296: 123091 | C296: 长海转债 | D296: 300196 | E296: 长海股份 | F296: 其他 | G296: 非金属矿 | H296: 140.55 | I296: -1.95e-002 | J296: -3.5299999999999998e-002 | K296: 19 | L296: -7.0900000000000005e-002 | M296: 116.2 | N296: 16.24 | O296: 0.20100000000000001 | P296: 117 | Q296: 4月24天 | R296: 5.88年 | S296: 3.88年 | T296: 5.5 | U296: 132 | V296: 0.16500000000000001 | W296: 7.0999999999999994e-002 | X296: 8.3000000000000004e-002 | Y296: 78 | Z296: 2.78 | AA296: -3.2300000000000002e-002 | AB296: -3.7000000000000005e-002 | AC296: -7.2900000000000006e-002 | AD296: -7.4499999999999997e-002 | AE296: 86.91 | AF296: 90.12 | AG296: 0.77 | AH296: AA | AI296: 4.4999999999999998e-002 | AJ296: =H296+100*O296 -> 160.65000000000001 | AK296: 164.1 | AL296: 306 | AM296: 74 | AN296: 307 | AO296: 2.3e-002 | AP296: 3 | AQ296: 长海转债
A297: 135 | B297: 113583 | C297: 益丰转债! | D297: 603939 | E297: 益丰药房 | F297: 医药 | G297: 医药商业 | H297: 138.28 | I297: 1.18e-002 | J297: -1.2999999999999999e-003 | K297: 99.11 | L297: 1.0500000000000001e-002 | M297: 115.3 | N297: 71.82 | O297: 2.e-003 | P297: 138 | Q297: 转股中 | R297: 5.32年 | S297: 3.32年 | T297: 14.1 | U297: 111 | V297: 5.7000000000000002e-002 | W297: 2.7000000000000003e-002 | X297: 3.7000000000000005e-002 | Y297: 527 | Z297: 10.46 | AA297: -3.4200000000000001e-002 | AB297: -3.9e-002 | AC297: -7.9699999999999993e-002 | AD297: -8.1500000000000003e-002 | AE297: 89.19 | AF297: 91.68 | AG297: 1 | AH297: AA | AI297: 4.4999999999999998e-002 | AJ297: =H297+100*O297 -> 138.47999999999999 | AK297: 138.6 | AL297: 276 | AM297: 46.9 | AN297: 271 | AO297: -1.e-003 | AP297: 10 | AQ297: 益丰转债!
A298: 172 | B298: 110066 | C298: 盛屯转债!! | D298: 600711 | E298: 盛屯矿业 | F298: 有色金属 | G298: 有色行业 | H298: 138.16 | I298: -9.7299999999999998e-002 | J298: 1.11e-002 | K298: 6.77 | L298: -9.9700000000000011e-002 | M298: 115.3 | N298: 4.88 | O298: -4.0000000000000001e-003 | P298: 138.73 | Q298: 转股中 | R298: 5年25天 | S298: 3年25天 | T298: 6.92 | U298: 481 | V298: 0.48399999999999999 | W298: 3.9e-002 | X298: 5.4000000000000006e-002 | Y298: 179 | Z298: 1.7 | AA298: -3.5699999999999996e-002 | AB298: -4.0800000000000003e-002 | AC298: -8.539999999999999e-002 | AD298: -8.7300000000000003e-002 | AE298: 90.17 | AF298: 92.69 | AG298: 0.86 | AH298: AA | AI298: 4.4999999999999998e-002 | AJ298: =H298+100*O298 -> 137.75999999999999 | AK298: 137.6 | AL298: 271 | AM298: 44.9 | AN298: 261 | AO298: -0.156 | AP298: 40 | AQ298: 盛屯转债!!
A299: 232 | B299: 123027 | C299: 蓝晓转债! | D299: 300487 | E299: 蓝晓科技 | F299: 化工 | G299: 化工 | H299: 141.388 | I299: -4.4999999999999998e-002 | J299: 3.0299999999999997e-002 | K299: 38.91 | L299: -1.67e-002 | M299: 119.5 | N299: 29.33 | O299: 6.6000000000000003e-002 | P299: 132.66 | Q299: 转股中 | R299: 4.35年 | S299: 2.35年 | T299: 1.08 | U299: 94 | V299: 0.60299999999999998 | W299: 1.3000000000000001e-002 | X299: 1.7000000000000001e-002 | Y299: 83 | Z299: 5.25 | AA299: -3.8900000000000004e-002 | AB299: -4.6199999999999998e-002 | AC299: -0.114 | AD299: -0.11699999999999999 | AE299: 87.15 | AF299: 87.78 | AG299: 0.88 | AH299: A+ | AI299: 7.5700000000000003e-002 | AJ299: =H299+100*O299 -> 147.988 | AK299: 150.1 | AL299: 294 | AM299: 62.3 | AN299: 301 | AO299: -0.16 | AP299: 21 | AQ299: 蓝晓转债!
A300: 55 | B300: 127022 | C300: 恒逸转债 | D300: 703 | E300: 恒逸石化 | F300: 化工 | G300: 化工 | H300: 136.196 | I300: -3.7000000000000002e-003 | J300: -1.3600000000000001e-002 | K300: 14.47 | L300: -2.0299999999999999e-002 | M300: 108.9 | N300: 11.5 | O300: 8.199999999999999e-002 | P300: 125.83 | Q300: 2月16天 | R300: 5.69年 | S300: 3.69年 | T300: 20 | U300: 118 | V300: 4.2999999999999997e-002 | W300: 3.7999999999999999e-002 | X300: 4.7e-002 | Y300: 533 | Z300: 2.12 | AA300: -3.9e-002 | AB300: -4.1700000000000001e-002 | AC300: -7.0999999999999994e-002 | AD300: -7.22e-002 | AE300: 87.33 | AF300: 85.97 | AG300: 0.85 | AH300: AA+ | AI300: 4.2999999999999997e-002 | AJ300: =H300+100*O300 -> 144.39599999999999 | AK300: 146.6 | AL300: 287 | AM300: 59.2 | AN300: 298 | AO300: 4.5999999999999999e-002 | AP300: 5 | AQ300: 恒逸转债
A301: 299 | B301: 128036 | C301: 金农转债!! | D301: 2548 | E301: 金新农 | F301: 农业 | G301: 畜牧业 | H301: 124.5 | I301: -3.04e-002 | J301: 2.8999999999999998e-002 | K301: 7.12 | L301: -2.4700000000000003e-002 | M301: 110.3 | N301: 6.96 | O301: 0.217 | P301: 102.3 | Q301: 转股中 | R301: 3年32天 | S301: 1年32天 | T301: 1.46 | U301: 226 | V301: 1.1899999999999999 | W301: 2.9999999999999999e-002 | X301: 2.9999999999999999e-002 | Y301: 49 | Z301: 1.88 | AA301: -3.9300000000000002e-002 | AB301: -4.5100000000000001e-002 | AC301: -0.13600000000000001 | AD301: -0.13900000000000001 | AE301: 95.11 | AF301: 91.3 | AG301: 0.06 | AH301: AA- | AI301: 6.4699999999999994e-002 | AJ301: =H301+100*O301 -> 146.19999999999999 | AK301: 146.7 | AL301: 288 | AM301: 51.6 | AN301: 281 | AO301: -0.16300000000000001 | AP301: 17 | AQ301: 金农转债!!
A302: 298 | B302: 113508 | C302: 新凤转债! | D302: 603225 | E302: 新凤鸣 | F302: 服装纺织 | G302: 纺织行业 | H302: 128.11 | I302: -8.6e-003 | J302: 4.0000000000000002e-004 | K302: 20.15 | L302: -9.7999999999999997e-003 | M302: 112.3 | N302: 15.78 | O302: 3.0000000000000001e-003 | P302: 127.69 | Q302: 转股中 | R302: 3.22年 | S302: 1.22年 | T302: 21.3 | U302: 209 | V302: 7.5999999999999998e-002 | W302: 7.5999999999999998e-002 | X302: 9.6999999999999989e-002 | Y302: 281 | Z302: 2.49 | AA302: -4.0899999999999999e-002 | AB302: -4.7400000000000005e-002 | AC302: -0.13699999999999998 | AD302: -0.14000000000000001 | AE302: 96.94 | AF302: 98.15 | AG302: 0.83 | AH302: AA | AI302: 4.3700000000000003e-002 | AJ302: =H302+100*O302 -> 128.41000000000003 | AK302: 128.5 | AL302: 219 | AM302: 30.4 | AN302: 187 | AO302: 9.6000000000000002e-002 | AP302: 25 | AQ302: 新凤转债!
A303: 50 | B303: 113040 | C303: 星宇转债 | D303: 601799 | E303: 星宇股份 | F303: 汽车 | G303: 零部件制 | H303: 144.92 | I303: -1.7000000000000001e-003 | J303: -1.5300000000000001e-002 | K303: 207.44 | L303: -2.e-002 | M303: 111.5 | N303: 158 | O303: 0.10400000000000001 | P303: 131.29 | Q303: 2月22天 | R303: 5.71年 | S303: 3.71年 | T303: 15 | U303: 52 | V303: 2.4e-002 | W303: 2.6000000000000002e-002 | X303: 3.4000000000000002e-002 | Y303: 573 | Z303: 10.78 | AA303: -4.53e-002 | AB303: -4.8799999999999996e-002 | AC303: -8.6400000000000005e-002 | AD303: -8.7400000000000005e-002 | AE303: 86.93 | AF303: 87.93 | AG303: 0.85 | AH303: AA+ | AI303: 4.2999999999999997e-002 | AJ303: =H303+100*O303 -> 155.31999999999999 | AK303: 158.5 | AL303: 305 | AM303: 70.6 | AN303: 306 | AO303: 8.0000000000000002e-003 | AP303: 4 | AQ303: 星宇转债
A304: 3 | B304: 113616 | C304: 韦尔转债 | D304: 603501 | E304: 韦尔股份 | F304: 电子 | G304: 元器件制 | H304: 151.02 | I304: -2.1000000000000001e-002 | J304: 2.4900000000000002e-002 | K304: 285.1 | L304: 4.7999999999999996e-003 | M304: 114.5 | N304: 222.83 | O304: 0.17999999999999999 | P304: 127.95 | Q304: 5月0天 | R304: 5.89年 | S304: 3.89年 | T304: 24.4 | U304: 626 | V304: 0.16600000000000001 | W304: 1.e-002 | X304: 1.3000000000000001e-002 | Y304: 2474. | Z304: 24.41 | AA304: -4.6500000000000007e-002 | AB304: -5.0499999999999996e-002 | AC304: -9.0399999999999994e-002 | AD304: -9.1600000000000001e-002 | AE304: 86.9 | AF304: 89.65 | AG304: 0.82 | AH304: AA+ | AI304: 4.2999999999999997e-002 | AJ304: =H304+100*O304 -> 169.02000000000001 | AK304: 174.1 | AL304: 310 | AM304: 84.4 | AN304: 310 | AO304: -4.2000000000000003e-002 | AP304: 5 | AQ304: 韦尔转债
A305: 26 | B305: 113611 | C305: 福20转债 | D305: 603806 | E305: 福斯特 | F305: 能源电力 | G305: 太阳能 | H305: 148.49 | I305: 9.1000000000000004e-003 | J305: -3.8e-003 | K305: 102.87 | L305: 6.0999999999999995e-003 | M305: 111.85 | N305: 73.69 | O305: 6.4000000000000001e-002 | P305: 139.6 | Q305: 4月2天 | R305: 5.82年 | S305: 3.82年 | T305: 17 | U305: 156 | V305: 6.2e-002 | W305: 2.1000000000000001e-002 | X305: 2.9999999999999999e-002 | Y305: 792 | Z305: 9.92 | AA305: -4.8099999999999997e-002 | AB305: -5.1500000000000004e-002 | AC305: -8.900000000000001e-002 | AD305: -8.9999999999999997e-002 | AE305: 86.22 | AF305: 86.88 | AG305: 0.87 | AH305: AA | AI305: 4.4999999999999998e-002 | AJ305: =H305+100*O305 -> 154.89000000000001 | AK305: 157.4 | AL305: 304 | AM305: 70.5 | AN305: 305 | AO305: 6.7000000000000004e-002 | AP305: 4 | AQ305: 福20转债
A306: 306 | B306: 110043 | C306: 无锡转债! | D306: 600908 | E306: 无锡银行 | F306: 金融 | G306: 银行行业 | H306: 126.65 | I306: 5.91e-002 | J306: 2.3399999999999997e-002 | K306: 7.35 | L306: 0.10000000000000001 | M306: 108.3 | N306: 5.79 | O306: -2.e-003 | P306: 126.94 | Q306: 转股中 | R306: 2.98年 | S306: 无权 | T306: 30 | U306: 1535. | V306: 0.40399999999999997 | W306: 0.221 | X306: 0.28000000000000003 | Y306: 136 | Z306: 1.19 | AA306: -5.16e-002 | AB306: -5.6399999999999999e-002 | AC306: 无权 | AD306: 无权 | AE306: 无权 | AF306: 96.43 | AG306: 0.82 | AH306: AA+ | AI306: 4.0099999999999997e-002 | AJ306: =H306+100*O306 -> 126.45 | AK306: 126.4 | AL306: 209 | AM306: 29.9 | AN306: 183 | AO306: 0.192 | AP306: 29 | AQ306: 无锡转债!
A307: 334 | B307: 113011 | C307: 光大转债 | D307: 601818 | E307: 光大银行 | F307: 金融 | G307: 银行行业 | H307: 122.53 | I307: 2.9300000000000003e-002 | J307: 4.2599999999999999e-002 | K307: 4.36 | L307: 9.5500000000000002e-002 | M307: 108.3 | N307: 3.76 | O307: 5.7000000000000002e-002 | P307: 115.96 | Q307: 转股中 | R307: 2年40天 | S307: 无权 | T307: 242 | U307: 981 | V307: 3.3000000000000002e-002 | W307: 0.10300000000000001 | X307: 0.11900000000000001 | Y307: 2356. | Z307: 0.7 | AA307: -5.7999999999999996e-002 | AB307: -6.4699999999999994e-002 | AC307: 无权 | AD307: 无权 | AE307: 无权 | AF307: 100.46 | AG307: 0.75 | AH307: AAA | AI307: 3.7100000000000001e-002 | AJ307: =H307+100*O307 -> 128.22999999999999 | AK307: 129.1 | AL307: 224 | AM307: 28.6 | AN307: 174 | AO307: 7.4999999999999997e-002 | AP307: 15 | AQ307: 光大转债
A308: 196 | B308: 113029 | C308: 明阳转债!! | D308: 601615 | E308: 明阳智能 | F308: 能源电力 | G308: 风能 | H308: 152.39 | I308: -7.6299999999999993e-002 | J308: 7.4999999999999997e-003 | K308: 19.53 | L308: -7.5300000000000006e-002 | M308: 112.9 | N308: 12.8 | O308: -1.e-003 | P308: 152.58 | Q308: 转股中 | R308: 4.86年 | S308: 2.86年 | T308: 7.36 | U308: 220 | V308: 0.18899999999999997 | W308: 2.e-002 | X308: 3.1e-002 | Y308: 366 | Z308: 3.62 | AA308: -6.08e-002 | AB308: -6.5199999999999994e-002 | AC308: -0.11900000000000001 | AD308: -0.121 | AE308: 90.95 | AF308: 92.07 | AG308: 0.91 | AH308: AA | AI308: 4.3700000000000003e-002 | AJ308: =H308+100*O308 -> 152.28999999999999 | AK308: 152.2 | AL308: 297 | AM308: 60.1 | AN308: 299 | AO308: -4.4999999999999998e-002 | AP308: 22 | AQ308: 明阳转债!!
A309: 125 | B309: 128111 | C309: 中矿转债! | D309: 2738 | E309: 中矿资源 | F309: 有色金属 | G309: 有色行业 | H309: 176 | I309: -0.111 | J309: 1.5900000000000001e-002 | K309: 27.15 | L309: -0.10000000000000001 | M309: 124.7 | N309: 15.47 | O309: 3.0000000000000001e-003 | P309: 175.5 | Q309: 转股中 | R309: 5.35年 | S309: 3.35年 | T309: 2.44 | U309: 558 | V309: 1.23 | W309: 2.8999999999999998e-002 | X309: 5.0000000000000003e-002 | Y309: 85 | Z309: 2.8 | AA309: -6.3700000000000007e-002 | AB309: -7.0599999999999996e-002 | AC309: -0.13400000000000001 | AD309: -0.13600000000000001 | AE309: 83.83 | AF309: 89.35 | AG309: 0.95 | AH309: AA- | AI309: 6.6000000000000003e-002 | AJ309: =H309+100*O309 -> 176.30000000000001 | AK309: 176.5 | AL309: 312 | AM309: 87.2 | AN309: 311 | AO309: -0.13900000000000001 | AP309: 9 | AQ309: 中矿转债!
A310: 206 | B310: 123034 | C310: 通光转债! | D310: 300265 | E310: 通光线缆 | F310: 通信互联 | G310: 通信设备 | H310: 162.884 | I310: -5.9999999999999998e-002 | J310: 5.4800000000000001e-002 | K310: 8.04 | L310: -7.4000000000000003e-003 | M310: 118 | N310: 7.97 | O310: 0.61499999999999999 | P310: 100.88 | Q310: 转股中 | R310: 4.75年 | S310: 2.75年 | T310: 0.78 | U310: 152 | V310: 1.1599999999999999 | W310: 2.7000000000000003e-002 | X310: 2.7000000000000003e-002 | Y310: 29 | Z310: 2.34 | AA310: -6.6799999999999998e-002 | AB310: -7.2700000000000001e-002 | AC310: -0.14300000000000002 | AD310: -0.14499999999999999 | AE310: 83.87 | AF310: 84.05 | AG310: 0.71 | AH310: A+ | AI310: 7.5700000000000003e-002 | AJ310: =H310+100*O310 -> 224.38399999999999 | AK310: 224.9 | AL310: 324 | AM310: 140.8 | AN310: 326 | AO310: -0.12300000000000001 | AP310: 25 | AQ310: 通光转债!
A311: 115 | B311: 113590 | C311: 海容转债!* | D311: 603187 | E311: 海容冷链 | F311: 机械装备 | G311: 通用设备 | H311: 167.34 | I311: -3.15e-002 | J311: -3.4999999999999996e-003 | K311: 61.29 | L311: -3.5000000000000003e-002 | M311: 115.6 | N311: 36.39 | O311: -6.0000000000000001e-003 | P311: 168.43 | Q311: 转股中 | R311: 5.40年 | S311: 3.40年 | T311: 2.67 | U311: 169 | V311: 0.37 | W311: 2.7000000000000003e-002 | X311: 4.5999999999999999e-002 | Y311: 97 | Z311: 5.97 | AA311: -6.7500000000000004e-002 | AB311: -7.2000000000000008e-002 | AC311: -0.122 | AD311: -0.124 | AE311: 82.99 | AF311: 82.51 | AG311: 1 | AH311: AA- | AI311: 6.6000000000000003e-002 | AJ311: =H311+100*O311 -> 166.74000000000001 | AK311: 166.3 | AL311: 309 | AM311: 83.3 | AN311: 309 | AO311: -4.9000000000000002e-002 | AP311: 7 | AQ311: 海容转债!*
A312: 281 | B312: 128046 | C312: 利尔转债! | D312: 2258 | E312: 利尔化学 | F312: 化工 | G312: 农化 | H312: 147.1 | I312: -6.1900000000000004e-002 | J312: -1.6399999999999998e-002 | K312: 26.9 | L312: -8.6300000000000002e-002 | M312: 112.3 | N312: 18.62 | O312: 1.8000000000000002e-002 | P312: 144.47 | Q312: 转股中 | R312: 3.70年 | S312: 1.70年 | T312: 8.47 | U312: 305 | V312: 0.24100000000000002 | W312: 5.9999999999999998e-002 | X312: 8.6999999999999994e-002 | Y312: 141 | Z312: 3.95 | AA312: -7.1599999999999997e-002 | AB312: -7.6999999999999999e-002 | AC312: -0.14599999999999999 | AD312: -0.14699999999999999 | AE312: 94.99 | AF312: 96.17 | AG312: 0.91 | AH312: AA | AI312: 4.3700000000000003e-002 | AJ312: =H312+100*O312 -> 148.90000000000001 | AK312: 149.7 | AL312: 293 | AM312: 53.6 | AN312: 285 | AO312: 0.11599999999999999 | AP312: 10 | AQ312: 利尔转债!
A313: 337 | B313: 128010 | C313: 蔚蓝转债!!* | D313: 2245 | E313: 蔚蓝锂芯 | F313: 交通运输 | G313: 物流业 | H313: 116.1 | I313: 5.0000000000000001e-003 | J313: 1.37e-002 | K313: 10.88 | L313: 1.8700000000000001e-002 | M313: 108 | N313: 9.25 | O313: -1.3000000000000001e-002 | P313: 117.62 | Q313: 转股中 | R313: 0.96年 | S313: 回售内 | T313: 2 | U313: 1168. | V313: 4.7400000000000002 | W313: 1.8000000000000002e-002 | X313: 2.2000000000000002e-002 | Y313: 109 | Z313: 4.69 | AA313: -7.2400000000000006e-002 | AB313: -8.6699999999999999e-002 | AC313: 回售内 | AD313: 回售内 | AE313: 100.27 | AF313: 104 | AG313: 1 | AH313: AA | AI313: 4.0000000000000001e-002 | AJ313: =H313+100*O313 -> 114.8 | AK313: 114.6 | AL313: 123 | AM313: 10.6 | AN313: 25 | AO313: -5.0999999999999997e-002 | AP313: 41 | AQ313: 蔚蓝转债!!*
A314: 278 | B314: 127008 | C314: 特发转债!* | D314: 70 | E314: 特发信息 | F314: 通信互联 | G314: 通信设备 | H314: 137.55 | I314: 3.0299999999999997e-002 | J314: -4.7500000000000001e-002 | K314: 6.89 | L314: -1.7100000000000001e-002 | M314: 110.5 | N314: 5.54 | O314: 0.106 | P314: 124.37 | Q314: 转股中 | R314: 2.78年 | S314: 0.78年 | T314: 0.59 | U314: 562 | V314: 6.8700000000000001 | W314: 1.e-002 | X314: 1.3000000000000001e-002 | Y314: 56 | Z314: 1.98 | AA314: -7.6600000000000001e-002 | AB314: -8.2799999999999999e-002 | AC314: -0.28100000000000003 | AD314: -0.28300000000000003 | AE314: 97.39 | AF314: 98.67 | AG314: 1 | AH314: AA | AI314: 4.2099999999999999e-002 | AJ314: =H314+100*O314 -> 148.15000000000001 | AK314: 150.7 | AL314: 295 | AM314: 52.1 | AN314: 283 | AO314: -0.151 | AP314: 16 | AQ314: 特发转债!*
A315: 157 | B315: 128103 | C315: 同德转债! | D315: 2360 | E315: 同德化工 | F315: 化工 | G315: 化工 | H315: 183 | I315: -0.14899999999999999 | J315: 4.87e-002 | K315: 9.89 | L315: -0.10000000000000001 | M315: 121.8 | N315: 5.18 | O315: -4.2000000000000003e-002 | P315: 190.93 | Q315: 转股中 | R315: 5年49天 | S315: 3年49天 | T315: 1.22 | U315: 4860. | V315: 18.149999999999999 | W315: 3.2000000000000001e-002 | X315: 5.9999999999999998e-002 | Y315: 39 | Z315: 3.23 | AA315: -7.7800000000000008e-002 | AB315: -8.4100000000000008e-002 | AC315: -0.152 | AD315: -0.154 | AE315: 82.25 | AF315: 84.06 | AG315: 1 | AH315: A+ | AI315: 7.6999999999999999e-002 | AJ315: =H315+100*O315 -> 178.80000000000001 | AK315: 175.1 | AL315: 311 | AM315: 91 | AN315: 313 | AO315: 0.20800000000000002 | AP315: 13 | AQ315: 同德转债!
A316: 41 | B316: 113041 | C316: 紫金转债 | D316: 601899 | E316: 紫金矿业 | F316: 有色金属 | G316: 贵金属 | H316: 162.42 | I316: -5.5000000000000005e-003 | J316: -2.4799999999999999e-002 | K316: 9.8 | L316: -3.4500000000000003e-002 | M316: 108 | N316: 7 | O316: 0.16 | P316: 140 | Q316: 3月4天 | R316: 4.74年 | S316: 2.74年 | T316: 60 | U316: 294 | V316: 2.9999999999999999e-002 | W316: 2.4e-002 | X316: 3.4000000000000002e-002 | Y316: 2496. | Z316: 5.19 | AA316: -8.3000000000000004e-002 | AB316: -8.5699999999999998e-002 | AC316: -0.14699999999999999 | AD316: -0.14800000000000002 | AE316: 90.77 | AF316: 90.33 | AG316: 0.88 | AH316: AAA | AI316: 3.8699999999999998e-002 | AJ316: =H316+100*O316 -> 178.41999999999999 | AK316: 184.8 | AL316: 315 | AM316: 94.1 | AN316: 315 | AO316: -7.2000000000000008e-002 | AP316: 8 | AQ316: 紫金转债
A317: 80 | B317: 128126 | C317: 赣锋转2 | D317: 2460 | E317: 赣锋锂业 | F317: 有色金属 | G317: 小金属 | H317: 186.998 | I317: -9.4e-002 | J317: 1.1000000000000001e-003 | K317: 111.96 | L317: -9.6999999999999989e-002 | M317: 111.1 | N317: 60.27 | O317: 6.9999999999999993e-003 | P317: 185.76 | Q317: 7天 | R317: 5.50年 | S317: 3.50年 | T317: 21.1 | U317: 782 | V317: 0.187 | W317: 1.3999999999999999e-002 | X317: 2.6000000000000002e-002 | Y317: 1505. | Z317: 16.08 | AA317: -9.1499999999999998e-002 | AB317: -9.4600000000000004e-002 | AC317: -0.14499999999999999 | AD317: -0.14599999999999999 | AE317: 87.64 | AF317: 87.55 | AG317: 0.96 | AH317: AA | AI317: 4.4999999999999998e-002 | AJ317: =H317+100*O317 -> 187.69799999999998 | AK317: 188.2 | AL317: 316 | AM317: 100.6 | AN317: 317 | AO317: -0.13600000000000001 | AP317: 9 | AQ317: 赣锋转2
A318: 277 | B318: 123017 | C318: 寒锐转债!!* | D318: 300618 | E318: 寒锐钴业 | F318: 有色金属 | G318: 小金属 | H318: 158.8 | I318: -3.1699999999999999e-002 | J318: 6.8000000000000005e-003 | K318: 91.98 | L318: -2.4900000000000002e-002 | M318: 110.3 | N318: 57.4 | O318: -9.0000000000000011e-003 | P318: 160.24 | Q318: 转股中 | R318: 3.79年 | S318: 1.79年 | T318: 2.26 | U318: 641 | V318: 1.73 | W318: 8.0000000000000002e-003 | X318: 1.3000000000000001e-002 | Y318: 279 | Z318: 7.59 | AA318: -9.3100000000000002e-002 | AB318: -9.74e-002 | AC318: -0.161 | AD318: -0.16200000000000001 | AE318: 91.02 | AF318: 87.38 | AG318: 1 | AH318: AA- | AI318: 6.4699999999999994e-002 | AJ318: =H318+100*O318 -> 157.90000000000001 | AK318: 157.4 | AL318: 303 | AM318: 66.3 | AN318: 304 | AO318: -0.12300000000000001 | AP318: 13 | AQ318: 寒锐转债!!*
A319: 216 | B319: 113545 | C319: 金能转债! | D319: 603113 | E319: 金能科技 | F319: 煤炭 | G319: 炼焦 | H319: 190.64 | I319: -4.1599999999999998e-002 | J319: -9.300000000000001e-003 | K319: 20.3 | L319: -5.3200000000000004e-002 | M319: 114.9 | N319: 10.78 | O319: 1.2e-002 | P319: 188.31 | Q319: 转股中 | R319: 4.69年 | S319: 2.69年 | T319: 10.3 | U319: 763 | V319: 0.371 | W319: 5.9999999999999998e-002 | X319: 0.11199999999999999 | Y319: 172 | Z319: 2.25 | AA319: -0.10400000000000001 | AB319: -0.109 | AC319: -0.127 | AD319: -0.128 | AE319: 91.62 | AF319: 94.39 | AG319: 0.96 | AH319: AA | AI319: 4.3700000000000003e-002 | AJ319: =H319+100*O319 -> 191.83999999999997 | AK319: 193 | AL319: 317 | AM319: 98.6 | AN319: 316 | AO319: 9.3000000000000013e-002 | AP319: 20 | AQ319: 金能转债!
A320: 139 | B320: 113580 | C320: 康隆转债! | D320: 603665 | E320: 康隆达 | F320: 服装纺织 | G320: 服装行业 | H320: 212.3 | I320: -7.3200000000000001e-002 | J320: 5.8499999999999996e-002 | K320: 13.44 | L320: -2.8199999999999999e-002 | M320: 121.2 | N320: 15.51 | O320: 1.45 | P320: 86.65 | Q320: 转股中 | R320: 5.21年 | S320: 3.21年 | T320: 0.41 | U320: 255 | V320: 2.8500000000000001 | W320: 1.9e-002 | X320: 1.7000000000000001e-002 | Y320: 21 | Z320: 2.09 | AA320: -0.10400000000000001 | AB320: -0.11 | AC320: -0.11 | AD320: -0.111 | AE320: 84.13 | AF320: 87.54 | AG320: 0.52 | AH320: AA- | AI320: 6.6000000000000003e-002 | AJ320: =H320+100*O320 -> 357.30000000000001 | AK320: 337.9 | AL320: 336 | AM320: 250.4 | AN320: 336 | AO320: -0.124 | AP320: 9 | AQ320: 康隆转债!
A321: 177 | B321: 128095 | C321: 恩捷转债!! | D321: 2812 | E321: 恩捷股份 | F321: 电子 | G321: 元器件制 | H321: 203.988 | I321: -3.1899999999999998e-002 | J321: 5.1000000000000004e-003 | K321: 131.79 | L321: -2.7699999999999999e-002 | M321: 115.3 | N321: 65.09 | O321: 6.9999999999999993e-003 | P321: 202.47 | Q321: 转股中 | R321: 5年6.5天 | S321: 3年6.5天 | T321: 8 | U321: 87 | V321: 5.2000000000000005e-002 | W321: 6.9999999999999993e-003 | X321: 1.3999999999999999e-002 | Y321: 1168. | Z321: 11.73 | AA321: -0.109 | AB321: -0.114 | AC321: -0.11599999999999999 | AD321: -0.11699999999999999 | AE321: 90.39 | AF321: 92.9 | AG321: 0.97 | AH321: AA | AI321: 4.4999999999999998e-002 | AJ321: =H321+100*O321 -> 204.68799999999999 | AK321: 205.5 | AL321: 319 | AM321: 112.6 | AN321: 319 | AO321: -3.7000000000000005e-002 | AP321: 17 | AQ321: 恩捷转债!!
A322: 268 | B322: 128052 | C322: 凯龙转债! | D322: 2783 | E322: 凯龙股份 | F322: 化工 | G322: 化工 | H322: 180 | I322: -0.10199999999999999 | J322: 6.6799999999999998e-002 | K322: 10.36 | L322: -3.5400000000000001e-002 | M322: 114.3 | N322: 6.67 | O322: 0.159 | P322: 155.32 | Q322: 转股中 | R322: 3.88年 | S322: 1.88年 | T322: 0.32 | U322: 455 | V322: 7.5700000000000003 | W322: 8.0000000000000002e-003 | X322: 1.3000000000000001e-002 | Y322: 39 | Z322: 2.27 | AA322: -0.11199999999999999 | AB322: -0.11800000000000001 | AC322: -0.18600000000000003 | AD322: -0.188 | AE322: 94.26 | AF322: 97.13 | AG322: 1 | AH322: AA | AI322: 4.3700000000000003e-002 | AJ322: =H322+100*O322 -> 195.90000000000001 | AK322: 204.7 | AL322: 318 | AM322: 107.5 | AN322: 318 | AO322: 7.8e-002 | AP322: 13 | AQ322: 凯龙转债!
A323: 82 | B323: 113038 | C323: 隆20转债 | D323: 601012 | E323: 隆基股份 | F323: 能源电力 | G323: 太阳能 | H323: 213.43 | I323: 2.58e-002 | J323: 8.3000000000000001e-003 | K323: 114.62 | L323: 3.5000000000000003e-002 | M323: 111.8 | N323: 52.59 | O323: -2.1000000000000001e-002 | P323: 217.95 | Q323: 1.5天 | R323: 5.48年 | S323: 3.48年 | T323: 50 | U323: 2441. | V323: 0.22500000000000001 | W323: 1.2e-002 | X323: 2.5000000000000001e-002 | Y323: 4323. | Z323: 13.32 | AA323: -0.113 | AB323: -0.11599999999999999 | AC323: -0.17199999999999999 | AD323: -0.17300000000000001 | AE323: 89.62 | AF323: 90.5 | AG323: 0.97 | AH323: AAA | AI323: 4.0000000000000001e-002 | AJ323: =H323+100*O323 -> 211.33000000000001 | AK323: 208.9 | AL323: 320 | AM323: 118.4 | AN323: 321 | AO323: 4.4000000000000004e-002 | AP323: 13 | AQ323: 隆20转债
A324: 269 | B324: 123018 | C324: 溢利转债! | D324: 300381 | E324: 溢多利 | F324: 医药 | G324: 原料药 | H324: 181.1 | I324: -4.6799999999999994e-002 | J324: 4.8499999999999995e-002 | K324: 9.4 | L324: 2.0999999999999999e-003 | M324: 114.3 | N324: 8.32 | O324: 0.60299999999999998 | P324: 112.98 | Q324: 转股中 | R324: 3.87年 | S324: 1.87年 | T324: 0.54 | U324: 166 | V324: 1.6699999999999999 | W324: 1.2e-002 | X324: 1.3000000000000001e-002 | Y324: 46 | Z324: 1.59 | AA324: -0.114 | AB324: -0.11900000000000001 | AC324: -0.188 | AD324: -0.18899999999999997 | AE324: 90.55 | AF324: 90.06 | AG324: 0.77 | AH324: AA- | AI324: 6.4699999999999994e-002 | AJ324: =H324+100*O324 -> 241.39999999999998 | AK324: 249.2 | AL324: 329 | AM324: 158.7 | AN324: 329 | AO324: -0.111 | AP324: 13 | AQ324: 溢利转债!
A325: 219 | B325: 123031 | C325: 晶瑞转债! | D325: 300655 | E325: 晶瑞股份 | F325: 化工 | G325: 化工 | H325: 202 | I325: -7.4800000000000005e-002 | J325: 4.2000000000000003e-002 | K325: 26.15 | L325: -3.5799999999999998e-002 | M325: 115.8 | N325: 18.43 | O325: 0.42399999999999999 | P325: 141.89 | Q325: 转股中 | R325: 4.56年 | S325: 2.56年 | T325: 0.63 | U325: 103 | V325: 0.78200000000000003 | W325: 1.3000000000000001e-002 | X325: 1.8000000000000002e-002 | Y325: 49 | Z325: 3.84 | AA325: -0.11699999999999999 | AB325: -0.122 | AC325: -0.14499999999999999 | AD325: -0.14599999999999999 | AE325: 84.81 | AF325: 83.56 | AG325: 0.92 | AH325: A+ | AI325: 7.5700000000000003e-002 | AJ325: =H325+100*O325 -> 244.40000000000001 | AK325: 262.1 | AL325: 332 | AM325: 177.3 | AN325: 333 | AO325: -0.161 | AP325: 17 | AQ325: 晶瑞转债!
A326: 107 | B326: 113592 | C326: 安20转债! | D326: 603345 | E326: 安井食品 | F326: 食品饮料 | G326: 食品饮料 | H326: 235.99 | I326: 1.8500000000000003e-002 | J326: 5.9999999999999995e-004 | K326: 274.1 | L326: 1.9099999999999999e-002 | M326: 113.1 | N326: 115.9 | O326: -2.e-003 | P326: 236.5 | Q326: 转股中 | R326: 5.42年 | S326: 3.42年 | T326: 4.87 | U326: 316 | V326: 0.27500000000000002 | W326: 6.9999999999999993e-003 | X326: 1.8000000000000002e-002 | Y326: 656 | Z326: 20.2 | AA326: -0.129 | AB326: -0.13200000000000001 | AC326: -0.111 | AD326: -0.11199999999999999 | AE326: 88.6 | AF326: 89.5 | AG326: 1 | AH326: AA | AI326: 4.4999999999999998e-002 | AJ326: =H326+100*O326 -> 235.79000000000002 | AK326: 235.5 | AL326: 326 | AM326: 146 | AN326: 327 | AO326: 0.26300000000000001 | AP326: 9 | AQ326: 安20转债!
A327: 294 | B327: 110044 | C327: 广电转债!! | D327: 600831 | E327: 广电网络 | F327: 传媒娱乐 | G327: 影视娱乐 | H327: 179.84 | I327: -8.77e-002 | J327: 8.43e-002 | K327: 5.29 | L327: -1.49e-002 | M327: 112.3 | N327: 6.9 | O327: 1.3500000000000001 | P327: 76.67 | Q327: 转股中 | R327: 3.39年 | S327: 1.39年 | T327: 0.71 | U327: 280 | V327: 1.98 | W327: 1.9e-002 | X327: 1.3999999999999999e-002 | Y327: 38 | Z327: 1.02 | AA327: -0.13200000000000001 | AB327: -0.13699999999999998 | AC327: -0.26000000000000001 | AD327: -0.26100000000000001 | AE327: 96.24 | AF327: 97.44 | AG327: 0.23 | AH327: AA | AI327: 4.3700000000000003e-002 | AJ327: =H327+100*O327 -> 314.84000000000003 | AK327: 283 | AL327: 334 | AM327: 185.6 | AN327: 334 | AO327: -0.152 | AP327: 12 | AQ327: 广电转债!!
A328: 137 | B328: 113582 | C328: 火炬转债! | D328: 603678 | E328: 火炬电子 | F328: 电子 | G328: 元器件制 | H328: 249.16 | I328: -5.8799999999999998e-002 | J328: 3.2199999999999999e-002 | K328: 60 | L328: -2.7200000000000002e-002 | M328: 115.3 | N328: 25.33 | O328: 5.2000000000000005e-002 | P328: 236.87 | Q328: 转股中 | R328: 5.31年 | S328: 3.31年 | T328: 4.18 | U328: 182 | V328: 0.16800000000000001 | W328: 1.4999999999999999e-002 | X328: 3.6000000000000004e-002 | Y328: 276 | Z328: 7.82 | AA328: -0.13699999999999998 | AB328: -0.14099999999999999 | AC328: -0.122 | AD328: -0.12300000000000001 | AE328: 89.24 | AF328: 91.74 | AG328: 0.98 | AH328: AA | AI328: 4.4999999999999998e-002 | AJ328: =H328+100*O328 -> 254.35999999999999 | AK328: 261.4 | AL328: 331 | AM328: 169.7 | AN328: 331 | AO328: -0.16600000000000001 | AP328: 5 | AQ328: 火炬转债!
A329: 127 | B329: 128110 | C329: 永兴转债!* | D329: 2756 | E329: 永兴材料 | F329: 钢铁 | G329: 炼钢 | H329: 248 | I329: -6.2400000000000004e-002 | J329: 6.0000000000000001e-003 | K329: 42.85 | L329: -5.6399999999999999e-002 | M329: 113.2 | N329: 17.06 | O329: -1.3000000000000001e-002 | P329: 251.17 | Q329: 转股中 | R329: 5.34年 | S329: 3.34年 | T329: 0.66 | U329: 354 | V329: 2.1000000000000001 | W329: 4.0000000000000001e-003 | X329: 1.e-002 | Y329: 172 | Z329: 4.49 | AA329: -0.13900000000000001 | AB329: -0.14199999999999999 | AC329: -0.12 | AD329: -0.121 | AE329: 89 | AF329: 89.91 | AG329: 1 | AH329: AA | AI329: 4.4999999999999998e-002 | AJ329: =H329+100*O329 -> 246.69999999999999 | AK329: 244.8 | AL329: 328 | AM329: 154.9 | AN329: 328 | AO329: -0.23999999999999999 | AP329: 5 | AQ329: 永兴转债!*
A330: 331 | B330: 127004 | C330: 模塑转债!! | D330: 700 | E330: 模塑科技 | F330: 汽车 | G330: 零部件制 | H330: 161.8 | I330: -4.4699999999999997e-002 | J330: 4.4699999999999997e-002 | K330: 4.79 | L330: -2.64e-002 | M330: 113.3 | N330: 7.46 | O330: 1.52 | P330: 64.21 | Q330: 转股中 | R330: 2.32年 | S330: 0.32年 | T330: 1.32 | U330: 123 | V330: 0.55700000000000005 | W330: 2.9999999999999999e-002 | X330: 1.9e-002 | Y330: 44 | Z330: 1.69 | AA330: -0.14499999999999999 | AB330: -0.153 | AC330: -0.80400000000000005 | AD330: -0.80799999999999994 | AE330: 99.79 | AF330: 100.02 | AG330: 0 | AH330: AA | AI330: 4.2099999999999999e-002 | AJ330: =H330+100*O330 -> 313.80000000000001 | AK330: 259.4 | AL330: 330 | AM330: 159.4 | AN330: 330 | AO330: -0.157 | AP330: 37 | AQ330: 模塑转债!!
A331: 225 | B331: 113543 | C331: 欧派转债! | D331: 603833 | E331: 欧派家居 | F331: 其他 | G331: 家居用品 | H331: 231.52 | I331: -2.5000000000000001e-003 | J331: -4.8999999999999998e-003 | K331: 162.97 | L331: -7.4999999999999997e-003 | M331: 114.9 | N331: 71.69 | O331: 1.8000000000000002e-002 | P331: 227.33 | Q331: 转股中 | R331: 4.53年 | S331: 3.53年 | T331: 5.42 | U331: 196 | V331: 0.153 | W331: 6.0000000000000001e-003 | X331: 1.3000000000000001e-002 | Y331: 980 | Z331: 8.98 | AA331: -0.14599999999999999 | AB331: -0.14999999999999999 | AC331: -0.10300000000000001 | AD331: -0.10400000000000001 | AE331: 90.08 | AF331: 95.05 | AG331: 0.98 | AH331: AA | AI331: 4.3700000000000003e-002 | AJ331: =H331+100*O331 -> 233.32000000000002 | AK331: 235.7 | AL331: 327 | AM331: 140.7 | AN331: 325 | AO331: 0.14999999999999999 | AP331: 14 | AQ331: 欧派转债!
A332: 238 | B332: 128065 | C332: 雅化转债!!* | D332: 2497 | E332: 雅化集团 | F332: 化工 | G332: 化工 | H332: 214.353 | I332: -4.9500000000000002e-002 | J332: -6.6e-003 | K332: 20.2 | L332: -5.6100000000000004e-002 | M332: 110.9 | N332: 9.43 | O332: 1.e-003 | P332: 214.21 | Q332: 转股中 | R332: 4.19年 | S332: 2.19年 | T332: 1.12 | U332: 362 | V332: 1.4299999999999999 | W332: 5.0000000000000001e-003 | X332: 1.e-002 | Y332: 230 | Z332: 6.67 | AA332: -0.14800000000000002 | AB332: -0.151 | AC332: -0.188 | AD332: -0.18899999999999997 | AE332: 93.59 | AF332: 93.07 | AG332: 1 | AH332: AA | AI332: 4.3700000000000003e-002 | AJ332: =H332+100*O332 -> 214.453 | AK332: 214.5 | AL332: 322 | AM332: 120.9 | AN332: 322 | AO332: -0.19 | AP332: 21 | AQ332: 雅化转债!!*
A333: 118 | B333: 128115 | C333: 巨星转债!* | D333: 2444 | E333: 巨星科技 | F333: 机械装备 | G333: 通用设备 | H333: 292.998 | I333: 0. | J333: -5.5000000000000005e-003 | K333: 36 | L333: -5.5000000000000005e-003 | M333: 115.3 | N333: 12.28 | O333: -1.e-003 | P333: 293.16 | Q333: 转股中 | R333: 5.38年 | S333: 3.38年 | T333: 3.41 | U333: 189 | V333: 0.187 | W333: 9.0000000000000011e-003 | X333: 2.5000000000000001e-002 | Y333: 396 | Z333: 4.56 | AA333: -0.161 | AB333: -0.16500000000000001 | AC333: -0.13 | AD333: -0.13100000000000001 | AE333: 91.25 | AF333: 91.43 | AG333: 1 | AH333: AA | AI333: 4.4999999999999998e-002 | AJ333: =H333+100*O333 -> 292.89799999999997 | AK333: 292.8 | AL333: 335 | AM333: 201.4 | AN333: 335 | AO333: 7.4999999999999997e-002 | AP333: 4 | AQ333: 巨星转债!*
A334: 297 | B334: 113509 | C334: 新泉转债!! | D334: 603179 | E334: 新泉股份 | F334: 汽车 | G334: 零部件制 | H334: 212.49 | I334: -5.16e-002 | J334: 2.2599999999999999e-002 | K334: 33.48 | L334: -2.9600000000000001e-002 | M334: 110.3 | N334: 15.55 | O334: -1.3000000000000001e-002 | P334: 215.31 | Q334: 转股中 | R334: 3.33年 | S334: 1.33年 | T334: 1.04 | U334: 30 | V334: 0.13300000000000001 | W334: 8.0000000000000002e-003 | X334: 1.8000000000000002e-002 | Y334: 123 | Z334: 5.02 | AA334: -0.182 | AB334: -0.18600000000000003 | AC334: -0.32899999999999996 | AD334: -0.33000000000000002 | AE334: 96.5 | AF334: 95.97 | AG334: 0.98 | AH334: AA | AI334: 4.3700000000000003e-002 | AJ334: =H334+100*O334 -> 211.19 | AK334: 209.7 | AL334: 321 | AM334: 113.2 | AN334: 320 | AO334: -9.1999999999999998e-002 | AP334: 11 | AQ334: 新泉转债!!
A335: 283 | B335: 123015 | C335: 蓝盾转债!! | D335: 300297 | E335: 蓝盾股份 | F335: 计算机及 | G335: 软件开发 | H335: 240 | I335: -3.0699999999999998e-002 | J335: 3.3700000000000001e-002 | K335: 4.29 | L335: 1.4199999999999999e-002 | M335: 112.3 | N335: 5.79 | O335: 2.2400000000000002 | P335: 74.09 | Q335: 转股中 | R335: 3.52年 | S335: 1.52年 | T335: 1 | U335: 573 | V335: 2.3799999999999999 | W335: 1.9e-002 | X335: 1.3999999999999999e-002 | Y335: 54 | Z335: 1.39 | AA335: -0.19699999999999998 | AB335: -0.20100000000000001 | AC335: -0.316 | AD335: -0.317 | AE335: 92.58 | AF335: 90.48 | AG335: 0.21 | AH335: AA- | AI335: 6.4699999999999994e-002 | AJ335: =H335+100*O335 -> 464. | AK335: 405.9 | AL335: 338 | AM335: 313.3 | AN335: 338 | AO335: -7.2000000000000008e-002 | AP335: 19 | AQ335: 蓝盾转债!!
A336: 290 | B336: 128041 | C336: 盛路转债!! | D336: 2446 | E336: 盛路通信 | F336: 通信互联 | G336: 通信设备 | H336: 256.5 | I336: -8.1600000000000006e-002 | J336: 8.0299999999999996e-002 | K336: 5.29 | L336: -5.6000000000000008e-003 | M336: 114.3 | N336: 6.82 | O336: 2.3100000000000001 | P336: 77.57 | Q336: 转股中 | R336: 3.45年 | S336: 1.45年 | T336: 0.53 | U336: 574 | V336: 4.0199999999999996 | W336: 1.1000000000000001e-002 | X336: 9.0000000000000011e-003 | Y336: 48 | Z336: 1.59 | AA336: -0.21199999999999999 | AB336: -0.217 | AC336: -0.34899999999999998 | AD336: -0.34999999999999998 | AE336: 96.01 | AF336: 98.93 | AG336: 0.23 | AH336: AA | AI336: 4.3700000000000003e-002 | AJ336: =H336+100*O336 -> 487.5 | AK336: 435.4 | AL336: 339 | AM336: 336.5 | AN336: 339 | AO336: -0.13800000000000001 | AP336: 14 | AQ336: 盛路转债!!
A337: 327 | B337: 128017 | C337: 金禾转债!! | D337: 2597 | E337: 金禾实业 | F337: 化工 | G337: 化工 | H337: 211.1 | I337: -3.6499999999999998e-002 | J337: -2.41e-002 | K337: 45.18 | L337: -6.1699999999999998e-002 | M337: 108.8 | N337: 22.42 | O337: 4.8000000000000001e-002 | P337: 201.52 | Q337: 转股中 | R337: 2.74年 | S337: 0.74年 | T337: 5.52 | U337: 135 | V337: 0.115 | W337: 2.2000000000000002e-002 | X337: 4.4000000000000004e-002 | Y337: 253 | Z337: 5.5 | AA337: -0.217 | AB337: -0.222 | AC337: -0.58099999999999996 | AD337: -0.58200000000000007 | AE337: 97.84 | AF337: 97.34 | AG337: 0.98 | AH337: AA | AI337: 4.2099999999999999e-002 | AJ337: =H337+100*O337 -> 215.90000000000001 | AK337: 220.7 | AL337: 323 | AM337: 122.8 | AN337: 323 | AO337: 5.2000000000000005e-002 | AP337: 10 | AQ337: 金禾转债!!
A338: 313 | B338: 128030 | C338: 天康转债!! | D338: 2100 | E338: 天康生物 | F338: 农业 | G338: 畜牧业 | H338: 266.5 | I338: 3.5999999999999999e-003 | J338: -1.4999999999999999e-002 | K338: 11.27 | L338: -1.1399999999999999e-002 | M338: 111.3 | N338: 7.85 | O338: 0.85599999999999998 | P338: 143.57 | Q338: 转股中 | R338: 2.88年 | S338: 0.88年 | T338: 0.97 | U338: 61 | V338: 0.23600000000000002 | W338: 8.0000000000000002e-003 | X338: 1.1000000000000001e-002 | Y338: 121 | Z338: 2.03 | AA338: -0.26400000000000001 | AB338: -0.26899999999999996 | AC338: -0.58999999999999997 | AD338: -0.59099999999999997 | AE338: 97.52 | AF338: 99.03 | AG338: 1 | AH338: AA | AI338: 4.2099999999999999e-002 | AJ338: =H338+100*O338 -> 352.10000000000002 | AK338: 389.4 | AL338: 337 | AM338: 290.4 | AN338: 337 | AO338: 1.2e-002 | AP338: 12 | AQ338: 天康转债!!
A339: 315 | B339: 128028 | C339: 赣锋转债!!* | D339: 2460 | E339: 赣锋锂业 | F339: 有色金属 | G339: 小金属 | H339: 268 | I339: -9.8599999999999993e-002 | J339: 1.6000000000000001e-003 | K339: 111.96 | L339: -9.6999999999999989e-002 | M339: 108.5 | N339: 41.68 | O339: -2.e-003 | P339: 268.62 | Q339: 转股中 | R339: 2.88年 | S339: 0.88年 | T339: 3.69 | U339: 1411. | V339: 1.3300000000000001 | W339: 2.e-003 | X339: 6.9999999999999993e-003 | Y339: 1505. | Z339: 16.08 | AA339: -0.27200000000000002 | AB339: -0.27600000000000002 | AC339: -0.59599999999999997 | AD339: -0.59699999999999998 | AE339: 97 | AF339: 96.51 | AG339: 1 | AH339: AA | AI339: 4.2099999999999999e-002 | AJ339: =H339+100*O339 -> 267.80000000000001 | AK339: 267.4 | AL339: 333 | AM339: 170.4 | AN339: 332 | AO339: -0.13600000000000001 | AP339: 13 | AQ339: 赣锋转债!!*
A340: 287 | B340: 123013 | C340: 横河转债! | D340: 300539 | E340: 横河模具 | F340: 机械装备 | G340: 专用设备 | H340: 388 | I340: -8.0600000000000005e-002 | J340: 7.7199999999999991e-002 | K340: 6.14 | L340: -2.5399999999999999e-002 | M340: 115.2 | N340: 9.13 | O340: 4.7699999999999996 | P340: 67.25 | Q340: 转股中 | R340: 3.47年 | S340: 1.47年 | T340: 0.38 | U340: 467 | V340: 3.02 | W340: 2.7999999999999997e-002 | X340: 1.9e-002 | Y340: 14 | Z340: 2.81 | AA340: -0.29899999999999999 | AB340: -0.30399999999999999 | AC340: -0.41999999999999998 | AD340: -0.42100000000000004 | AE340: 91.85 | AF340: 90 | AG340: 0.13 | AH340: A+ | AI340: 7.5700000000000003e-002 | AJ340: =H340+100*O340 -> 865. | AK340: 708.7 | AL340: 340 | AM340: 616.9 | AN340: 340 | AO340: -8.0000000000000002e-002 | AP340: 16 | AQ340: 横河转债!
A341: 314 | B341: 128029 | C341: 太阳转债!! | D341: 2078 | E341: 太阳纸业 | F341: 造纸包装 | G341: 造纸行业 | H341: 223 | I341: -8.8999999999999999e-003 | J341: -2.1400000000000002e-002 | K341: 18.25 | L341: -3.0299999999999997e-002 | M341: 107 | N341: 8.55 | O341: 4.4999999999999998e-002 | P341: 213.45 | Q341: 转股中 | R341: 1.88年 | S341: 回售内 | T341: 9.09 | U341: 223 | V341: 0.111 | W341: 1.9e-002 | X341: 4.0999999999999995e-002 | Y341: 479 | Z341: 3.08 | AA341: -0.32500000000000001 | AB341: -0.32899999999999996 | AC341: 回售内 | AD341: 回售内 | AE341: 100.17 | AF341: 99.43 | AG341: 1 | AH341: AA+ | AI341: 4.0099999999999997e-002 | AJ341: =H341+100*O341 -> 227.5 | AK341: 232.5 | AL341: 325 | AM341: 132.4 | AN341: 324 | AO341: 9.1999999999999998e-002 | AP341: 7 | AQ341: 太阳转债!!
A342: 223 | B342: 123029 | C342: 英科转债! | D342: 300677 | E342: 英科医疗 | F342: 医药 | G342: 医疗器械 | H342: 2543 | I342: -3.3599999999999998e-002 | J342: -1.3300000000000001e-002 | K342: 214.3 | L342: -4.7100000000000003e-002 | M342: 138.2 | N342: 11.32 | O342: 0.34299999999999997 | P342: 1893.11 | Q342: 转股中 | R342: 4.53年 | S342: 2.53年 | T342: 1.23 | U342: 1145. | V342: 0.35899999999999999 | W342: 2.e-003 | X342: 3.1e-002 | Y342: 755 | Z342: 7.89 | AA342: -0.41799999999999998 | AB342: -0.42100000000000004 | AC342: -0.29499999999999998 | AD342: -0.29600000000000004 | AE342: 90.91 | AF342: 105.12 | AG342: 1 | AH342: AA- | AI342: 6.4699999999999994e-002 | AJ342: =H342+100*O342 -> 2577.3000000000002 | AK342: 3192.9000000000001 | AL342: 341 | AM342: 3087.8000000000002 | AN342: 341 | AO342: -0.124 | AP342: 17 | AQ342: 英科转债!