A1: 序号 | B1: 转债代码 | C1: 转债名称 | D1: 股票代码 | E1: 股票名称 | F1: 行业 | G1: 子行业 | H1: 转债价格 | I1: 涨跌 | J1: 日内套利 | K1: 股价 | L1: 涨跌 | M1: 剩余本息 | N1: 转股价格 | O1: 转股溢价率 | P1: 转股价值 | Q1: 距离转股日 | R1: 剩余年限 | S1: 回售年限 | T1: 转债余额 | U1: 转债成交额 | V1: 转债换手率 | W1: 余额/市值 | X1: 余额/股本 | Y1: 股票市值 | Z1: P/B | AA1: 税前收益率 | AB1: 税后收益率 | AC1: 税前回售收益 | AD1: 税后回售收益 | AE1: 回售价值 | AF1: 纯债价值 | AG1: 弹性 | AH1: 信用 | AI1: 折现率 | AJ1: 双低 | AK1: 老式双低 | AL1: 老式排名 | AM1: 新式双低 | AN1: 新式排名 | AO1: MA20乖离 | AP1: 热门度 | AQ1: 转债名称
A2: 293 | B2: 128062 | C2: 亚药转债! | D2: 2370 | E2: 亚太药业 | F2: 医药 | G2: 化学制药 | H2: 90.921 | I2: 1.1200000000000002e-002 | J2: -1.1200000000000002e-002 | K2: 4.36 | L2: 3.8100000000000002e-002 | M2: 119.3 | N2: 16.25 | O2: 2.3900000000000001 | P2: 26.83 | Q2: 转股中 | R2: 3.50年 | S2: 1.51年 | T2: 9.63 | U2: 17 | V2: 1.9e-002 | W2: 0.41200000000000003 | X2: 0.11 | Y2: 23 | Z2: 5.67 | AA2: 8.2299999999999998e-002 | AB2: 7.17e-002 | AC2: 7.690000000000001e-002 | AD2: 7.3300000000000004e-002 | AE2: 82.5 | AF2: 75.65 | AG2: 0 | AH2: BB | AI2: 0.1421 | AJ2: =H2+100*O2 -> 329.92099999999999 | AK2: 155 | AL2: 244 | AM2: 72.5 | AN2: 298 | AO2: -1.1000000000000001e-002 | AP2: 90 | AQ2: 亚药转债!
A3: 164 | B3: 113595 | C3: 花王转债! | D3: 603007 | E3: ST花王 | F3: 城市公用 | G3: 生态环境 | H3: 90.72 | I3: 8.8000000000000005e-003 | J3: -6.0999999999999995e-003 | K3: 3.07 | L3: 2.6800000000000001e-002 | M3: 124.8 | N3: 6.92 | O3: 1.04 | P3: 44.36 | Q3: 转股中 | R3: 4.80年 | S3: 2.81年 | T3: 3.3 | U3: 4.1 | V3: 1.3999999999999999e-002 | W3: 0.32000000000000001 | X3: 0.14199999999999999 | Y3: 10 | Z3: 0.93 | AA3: 7.0199999999999999e-002 | AB3: 6.0700000000000004e-002 | AC3: 4.6600000000000003e-002 | AD3: 4.3899999999999995e-002 | AE3: 77.92 | AF3: 79.03 | AG3: 0.1 | AH3: BBB+ | AI3: 0.10210000000000001 | AJ3: =H3+100*O3 -> 194.72 | AK3: 137.1 | AL3: 98 | AM3: 58 | AN3: 214 | AO3: -5.2000000000000005e-002 | AP3: 50 | AQ3: 花王转债!
A4: 208 | B4: 113576 | C4: 起步转债!! | D4: 603557 | E4: ST起步 | F4: 服装纺织 | G4: 鞋服行业 | H4: 95.57 | I4: 8.8999999999999999e-003 | J4: -7.1999999999999998e-003 | K4: 4.49 | L4: 3.2199999999999999e-002 | M4: 121.3 | N4: 10.55 | O4: 1.25 | P4: 42.56 | Q4: 转股中 | R4: 4.53年 | S4: 2.53年 | T4: 2.66 | U4: 8.5 | V4: 3.3000000000000002e-002 | W4: 0.12 | X4: 5.0999999999999997e-002 | Y4: 22 | Z4: 1.43 | AA4: 5.5500000000000001e-002 | AB4: 4.6799999999999994e-002 | AC4: 3.3099999999999997e-002 | AD4: 2.9900000000000003e-002 | AE4: 84.49 | AF4: 85.66 | AG4: 0.05 | AH4: A | AI4: 8.2100000000000006e-002 | AJ4: =H4+100*O4 -> 220.56999999999999 | AK4: 148.6 | AL4: 197 | AM4: 62.9 | AN4: 243 | AO4: -4.7e-002 | AP4: 41 | AQ4: 起步转债!!
A5: 109 | B5: 128138 | C5: 侨银转债! | D5: 2973 | E5: 侨银股份 | F5: 城市公用 | G5: 城市公用 | H5: 109.22 | I5: 2.8000000000000004e-003 | J5: -1.4000000000000002e-003 | K5: 16.04 | L5: 8.199999999999999e-003 | M5: 136.5 | N5: 25.33 | O5: 0.72499999999999998 | P5: 63.32 | Q5: 转股中 | R5: 5年47天 | S5: 3年48天 | T5: 4.2 | U5: 4.8 | V5: 1.e-002 | W5: 6.4000000000000001e-002 | X5: 4.0999999999999995e-002 | Y5: 66 | Z5: 4.29 | AA5: 4.5400000000000003e-002 | AB5: 3.39e-002 | AC5: -1.37e-002 | AD5: -1.6200000000000003e-002 | AE5: 85.7 | AF5: 100.68 | AG5: 0.18 | AH5: AA- | AI5: 6.25e-002 | AJ5: =H5+100*O5 -> 181.72 | AK5: 155.1 | AL5: 245 | AM5: 54.4 | AN5: 193 | AO5: -1.2e-002 | AP5: 18 | AQ5: 侨银转债!
A6: 145 | B6: 128127 | C6: 文科转债! | D6: 2775 | E6: 文科园林 | F6: 城市公用 | G6: 生态环境 | H6: 98.766 | I6: 5.7999999999999996e-003 | J6: 3.4999999999999996e-003 | K6: 4.05 | L6: 2.0199999999999999e-002 | M6: 120.8 | N6: 4.88 | O6: 0.19 | P6: 82.99 | Q6: 转股中 | R6: 4.89年 | S6: 2.89年 | T6: 9.5 | U6: 13 | V6: 1.3999999999999999e-002 | W6: 0.45700000000000002 | X6: 0.38 | Y6: 21 | Z6: 0.96 | AA6: 4.2999999999999997e-002 | AB6: 3.5200000000000002e-002 | AC6: 1.6299999999999999e-002 | AD6: 1.3899999999999999e-002 | AE6: 86.69 | AF6: 90.96 | AG6: 0.46 | AH6: AA- | AI6: 6.1100000000000002e-002 | AJ6: =H6+100*O6 -> 117.76600000000001 | AK6: 114.5 | AL6: 4 | AM6: 23.6 | AN6: 6 | AO6: -2.4e-002 | AP6: 67 | AQ6: 文科转债!
A7: 200 | B7: 113578 | C7: 全筑转债! | D7: 603030 | E7: 全筑股份 | F7: 建筑 | G7: 装饰工程 | H7: 98.99 | I7: 2.0999999999999999e-003 | J7: 5.9999999999999995e-004 | K7: 3.44 | L7: 1.78e-002 | M7: 117.9 | N7: 5.25 | O7: 0.51100000000000001 | P7: 65.52 | Q7: 转股中 | R7: 4.55年 | S7: 2.56年 | T7: 3.84 | U7: 4.1 | V7: 1.1000000000000001e-002 | W7: 0.192 | X7: 0.126 | Y7: 20 | Z7: 0.9 | AA7: 4.0000000000000001e-002 | AB7: 3.27e-002 | AC7: 1.6299999999999999e-002 | AD7: 1.38e-002 | AE7: 93.01 | AF7: 98.93 | AG7: 0.15 | AH7: AA | AI7: 4.0099999999999997e-002 | AJ7: =H7+100*O7 -> 150.09 | AK7: 132.5 | AL7: 47 | AM7: 33.5 | AN7: 38 | AO7: -7.0999999999999994e-002 | AP7: 26 | AQ7: 全筑转债!
A8: 156 | B8: 113596 | C8: 城地转债! | D8: 603887 | E8: 城地香江 | F8: 通信互联 | G8: 通信设备 | H8: 93.96 | I8: 3.0999999999999999e-003 | J8: -3.0999999999999999e-003 | K8: 8.19 | L8: 1.1999999999999999e-003 | M8: 113.1 | N8: 24.26 | O8: 1.78 | P8: 33.76 | Q8: 转股中 | R8: 4.82年 | S8: 2.83年 | T8: 12 | U8: 8.7 | V8: 8.0000000000000002e-003 | W8: 0.32500000000000001 | X8: 0.11 | Y8: 37 | Z8: 0.97 | AA8: 4.0000000000000001e-002 | AB8: 3.4700000000000002e-002 | AC8: 3.2899999999999999e-002 | AD8: 3.0499999999999999e-002 | AE8: 86.75 | AF8: 85.46 | AG8: 0 | AH8: AA- | AI8: 6.1100000000000002e-002 | AJ8: =H8+100*O8 -> 271.95999999999998 | AK8: 154.2 | AL8: 238 | AM8: 67.4 | AN8: 274 | AO8: -4.0999999999999995e-002 | AP8: 31 | AQ8: 城地转债!
A9: 225 | B9: 113569 | C9: 科达转债! | D9: 603660 | E9: 苏州科达 | F9: 通信互联 | G9: 物联网 | H9: 101.73 | I9: -7.000000000000001e-004 | J9: 8.0000000000000004e-004 | K9: 6.63 | L9: 3.0000000000000001e-003 | M9: 120.3 | N9: 14.8 | O9: 1.27 | P9: 44.8 | Q9: 转股中 | R9: 4.44年 | S9: 2.44年 | T9: 5.16 | U9: 1.9 | V9: 4.0000000000000001e-003 | W9: 0.157 | X9: 7.0999999999999994e-002 | Y9: 33 | Z9: 1.88 | AA9: 3.9399999999999998e-002 | AB9: 3.1099999999999999e-002 | AC9: 7.1999999999999998e-003 | AD9: 4.5000000000000005e-003 | AE9: 88.96 | AF9: 93.01 | AG9: 0.04 | AH9: AA- | AI9: 6.1100000000000002e-002 | AJ9: =H9+100*O9 -> 228.73000000000002 | AK9: 158.7 | AL9: 275 | AM9: 65.7 | AN9: 264 | AO9: -1.9e-002 | AP9: 32 | AQ9: 科达转债!
A10: 322 | B10: 113519 | C10: 长久转债! | D10: 603569 | E10: 长久物流 | F10: 交通运输 | G10: 物流业 | H10: 106.28 | I10: 3.7000000000000002e-003 | J10: -3.2000000000000002e-003 | K10: 7.21 | L10: 6.9999999999999993e-003 | M10: 119.3 | N10: 11.04 | O10: 0.627 | P10: 65.31 | Q10: 转股中 | R10: 3年37天 | S10: 1年38天 | T10: 6.97 | U10: 9 | V10: 1.2e-002 | W10: 0.17300000000000001 | X10: 0.113 | Y10: 40 | Z10: 1.9 | AA10: 3.8800000000000001e-002 | AB10: 2.75e-002 | AC10: -2.6099999999999998e-002 | AD10: -3.0299999999999997e-002 | AE10: 97.84 | AF10: 105.88 | AG10: 0.07 | AH10: AA | AI10: 4.0099999999999997e-002 | AJ10: =H10+100*O10 -> 168.98000000000002 | AK10: 147.3 | AL10: 187 | AM10: 41.4 | AN10: 94 | AO10: 2.7999999999999997e-002 | AP10: 23 | AQ10: 长久转债!
A11: 324 | B11: 128044 | C11: 岭南转债! | D11: 2717 | E11: 岭南股份 | F11: 城市公用 | G11: 生态环境 | H11: 99.25 | I11: 0. | J11: -2.0000000000000001e-004 | K11: 2.81 | L11: -1.7500000000000002e-002 | M11: 110.3 | N11: 5.59 | O11: 0.97400000000000009 | P11: 50.27 | Q11: 转股中 | R11: 2.87年 | S11: 0.87年 | T11: 6.59 | U11: 9 | V11: 1.3999999999999999e-002 | W11: 0.13900000000000001 | X11: 7.0000000000000007e-002 | Y11: 47 | Z11: 0.99 | AA11: 3.8100000000000002e-002 | AB11: 3.1099999999999999e-002 | AC11: 2.4799999999999999e-002 | AD11: 2.1299999999999999e-002 | AE11: 95.92 | AF11: 93.78 | AG11: 0.01 | AH11: AA- | AI11: 5.91e-002 | AJ11: =H11+100*O11 -> 196.65000000000001 | AK11: 148.2 | AL11: 195 | AM11: 52.3 | AN11: 177 | AO11: -8.4000000000000005e-002 | AP11: 52 | AQ11: 岭南转债!
A12: 181 | B12: 113589 | C12: 天创转债! | D12: 603608 | E12: 天创时尚 | F12: 服装纺织 | G12: 鞋服行业 | H12: 96.89 | I12: 3.2000000000000002e-003 | J12: -2.5000000000000001e-003 | K12: 5.55 | L12: 2.4e-002 | M12: 114.9 | N12: 12.29 | O12: 1.1499999999999999 | P12: 45.16 | Q12: 转股中 | R12: 4.73年 | S12: 2.73年 | T12: 6 | U12: 7.9 | V12: 1.3999999999999999e-002 | W12: 0.252 | X12: 0.114 | Y12: 24 | Z12: 1.5 | AA12: 3.7400000000000003e-002 | AB12: 3.15e-002 | AC12: 2.29e-002 | AD12: 2.0499999999999997e-002 | AE12: 92.36 | AF12: 95.75 | AG12: 0.03 | AH12: AA | AI12: 4.0099999999999997e-002 | AJ12: =H12+100*O12 -> 211.88999999999999 | AK12: 148.6 | AL12: 198 | AM12: 52.9 | AN12: 179 | AO12: -4.9000000000000002e-002 | AP12: 35 | AQ12: 天创转债!
A13: 366 | B13: 128015 | C13: 久其转债!! | D13: 2279 | E13: 久其软件 | F13: 计算机及 | G13: 软件开发 | H13: 103.11 | I13: 1.1000000000000001e-003 | J13: -1.1000000000000001e-003 | K13: 4.52 | L13: 2.0299999999999999e-002 | M13: 109.5 | N13: 6.97 | O13: 0.58999999999999997 | P13: 64.85 | Q13: 转股中 | R13: 1.69年 | S13: 回售内 | T13: 7.79 | U13: 13 | V13: 1.7000000000000001e-002 | W13: 0.24299999999999999 | X13: 0.157 | Y13: 32 | Z13: 3.9 | AA13: 3.6600000000000001e-002 | AB13: 2.58e-002 | AC13: 回售内 | AD13: 回售内 | AE13: 100.25 | AF13: 97.76 | AG13: 0 | AH13: A+ | AI13: 7.0099999999999996e-002 | AJ13: =H13+100*O13 -> 162.11000000000001 | AK13: 141.4 | AL13: 138 | AM13: 41.1 | AN13: 89 | AO13: -4.7e-002 | AP13: 69 | AQ13: 久其转债!!
A14: 201 | B14: 113573 | C14: 纵横转债! | D14: 603602 | E14: 纵横通信 | F14: 通信互联 | G14: 通信设备 | H14: 105.9 | I14: 5.3e-003 | J14: -3.7000000000000002e-003 | K14: 9.55 | L14: 1.7000000000000001e-002 | M14: 124.2 | N14: 18.78 | O14: 1.0800000000000001 | P14: 50.85 | Q14: 转股中 | R14: 4.54年 | S14: 2.55年 | T14: 2.7 | U14: 1.1 | V14: 4.0000000000000001e-003 | W14: 0.13900000000000001 | X14: 7.0000000000000007e-002 | Y14: 19 | Z14: 2.74 | AA14: 3.6600000000000001e-002 | AB14: 2.7200000000000002e-002 | AC14: -6.3e-003 | AD14: -9.1999999999999998e-003 | AE14: 86.39 | AF14: 91.2 | AG14: 0.09 | AH14: A+ | AI14: 7.2099999999999997e-002 | AJ14: =H14+100*O14 -> 213.90000000000001 | AK14: 160.9 | AL14: 279 | AM14: 69.7 | AN14: 287 | AO14: -5.9999999999999998e-002 | AP14: 26 | AQ14: 纵横转债!
A15: 306 | B15: 110052 | C15: 贵广转债! | D15: 600996 | E15: 贵广网络 | F15: 传媒娱乐 | G15: 影视娱乐 | H15: 104.74 | I15: -2.0000000000000001e-004 | J15: 1.5e-003 | K15: 4.72 | L15: 3.2799999999999996e-002 | M15: 117.7 | N15: 7.94 | O15: 0.76200000000000001 | P15: 59.45 | Q15: 转股中 | R15: 3.43年 | S15: 1.43年 | T15: 15.3 | U15: 4.6 | V15: 3.0000000000000001e-003 | W15: 0.308 | X15: 0.183 | Y15: 50 | Z15: 1.23 | AA15: 3.5400000000000001e-002 | AB15: 2.5899999999999999e-002 | AC15: -1.03e-002 | AD15: -1.3999999999999999e-002 | AE15: 97.57 | AF15: 104.84 | AG15: 0.04 | AH15: AA+ | AI15: 3.5099999999999999e-002 | AJ15: =H15+100*O15 -> 180.94 | AK15: 150 | AL15: 204 | AM15: 45.2 | AN15: 126 | AO15: -1.7000000000000001e-002 | AP15: 20 | AQ15: 贵广转债!
A16: 349 | B16: 113017 | C16: 吉视转债! | D16: 601929 | E16: 吉视传媒 | F16: 传媒娱乐 | G16: 影视娱乐 | H16: 101.25 | I16: 5.0000000000000001e-004 | J16: 5.0000000000000001e-004 | K16: 1.93 | L16: 2.12e-002 | M16: 108.8 | N16: 2.95 | O16: 0.54799999999999993 | P16: 65.42 | Q16: 转股中 | R16: 2.24年 | S16: 0.24年 | T16: 15.6 | U16: 10 | V16: 6.0000000000000001e-003 | W16: 0.26000000000000001 | X16: 0.17000000000000001 | Y16: 60 | Z16: 0.9 | AA16: 3.32e-002 | AB16: 2.5499999999999998e-002 | AC16: 7.3000000000000001e-003 | AD16: -2.0000000000000001e-004 | AE16: 100.22 | AF16: 101.27 | AG16: 0.05 | AH16: AA+ | AI16: 3.3099999999999997e-002 | AJ16: =H16+100*O16 -> 156.04999999999998 | AK16: 137.1 | AL16: 99 | AM16: 35.8 | AN16: 54 | AO16: -1.4999999999999999e-002 | AP16: 69 | AQ16: 吉视转债!
A17: 176 | B17: 128117 | C17: 道恩转债! | D17: 2838 | E17: 道恩股份 | F17: 化工 | G17: 橡胶塑料 | H17: 105.939 | I17: 9.3999999999999986e-003 | J17: -7.8000000000000005e-003 | K17: 15.03 | L17: 1.6899999999999998e-002 | M17: 123.1 | N17: 28.82 | O17: 1.03 | P17: 52.15 | Q17: 转股中 | R17: 4.75年 | S17: 2.76年 | T17: 3.6 | U17: 5.2 | V17: 1.3999999999999999e-002 | W17: 5.9000000000000004e-002 | X17: 3.1e-002 | Y17: 61 | Z17: 3.3 | AA17: 3.27e-002 | AB17: 2.4199999999999999e-002 | AC17: -8.199999999999999e-003 | AD17: -1.0500000000000001e-002 | AE17: 87.12 | AF17: 93.36 | AG17: 0.1 | AH17: AA- | AI17: 6.1100000000000002e-002 | AJ17: =H17+100*O17 -> 208.93899999999999 | AK17: 159.7 | AL17: 278 | AM17: 66.4 | AN17: 267 | AO17: -2.4e-002 | AP17: 24 | AQ17: 道恩转债!
A18: 284 | B18: 128066 | C18: 亚泰转债! | D18: 2811 | E18: 郑中设计 | F18: 建筑 | G18: 装饰工程 | H18: 104.4 | I18: 3.4000000000000002e-003 | J18: 3.0999999999999999e-003 | K18: 7.75 | L18: 1.7100000000000001e-002 | M18: 116.7 | N18: 9.27 | O18: 0.249 | P18: 83.6 | Q18: 转股中 | R18: 3.54年 | S18: 1.55年 | T18: 4.8 | U18: 3.5 | V18: 6.9999999999999993e-003 | W18: 0.22899999999999998 | X18: 0.192 | Y18: 21 | Z18: 1.52 | AA18: 3.2599999999999997e-002 | AB18: 2.3900000000000001e-002 | AC18: -7.7000000000000002e-003 | AD18: -1.1200000000000002e-002 | AE18: 93.18 | AF18: 95.01 | AG18: 0.38 | AH18: AA- | AI18: 6.1100000000000002e-002 | AJ18: =H18+100*O18 -> 129.30000000000001 | AK18: 125.2 | AL18: 12 | AM18: 30.2 | AN18: 22 | AO18: -4.2999999999999997e-002 | AP18: 64 | AQ18: 亚泰转债!
A19: 182 | B19: 123056 | C19: 雪榕转债! | D19: 300511 | E19: 雪榕生物 | F19: 农业 | G19: 种植业 | H19: 104.81 | I19: 4.0999999999999995e-003 | J19: -3.0999999999999999e-003 | K19: 6.67 | L19: 7.6e-003 | M19: 120.7 | N19: 11.77 | O19: 0.84900000000000009 | P19: 56.67 | Q19: 转股中 | R19: 4.73年 | S19: 2.73年 | T19: 5.84 | U19: 1.7 | V19: 3.0000000000000001e-003 | W19: 0.19800000000000001 | X19: 0.11199999999999999 | Y19: 29 | Z19: 1.6 | AA19: 3.0899999999999997e-002 | AB19: 2.3099999999999999e-002 | AC19: -4.0000000000000001e-003 | AD19: -6.4000000000000003e-003 | AE19: 87.4 | AF19: 91.71 | AG19: 0.14 | AH19: AA- | AI19: 6.1100000000000002e-002 | AJ19: =H19+100*O19 -> 189.71000000000001 | AK19: 153 | AL19: 230 | AM19: 61.2 | AN19: 232 | AO19: -3.7000000000000005e-002 | AP19: 17 | AQ19: 雪榕转债!
A20: 175 | B20: 128118 | C20: 瀛通转债! | D20: 2861 | E20: 瀛通通讯 | F20: 电子 | G20: 电子产品 | H20: 105.672 | I20: 3.4999999999999996e-003 | J20: -8.0000000000000004e-004 | K20: 11.79 | L20: 1.9900000000000001e-002 | M20: 121.7 | N20: 21.24 | O20: 0.90400000000000003 | P20: 55.51 | Q20: 转股中 | R20: 4.75年 | S20: 2.76年 | T20: 3 | U20: 2.1 | V20: 6.9999999999999993e-003 | W20: 0.16200000000000001 | X20: 8.9999999999999997e-002 | Y20: 18 | Z20: 1.77 | AA20: 3.0899999999999997e-002 | AB20: 2.2799999999999997e-002 | AC20: -4.7999999999999996e-003 | AD20: -7.6e-003 | AE20: 87.79 | AF20: 92.43 | AG20: 0.14 | AH20: AA- | AI20: 6.1100000000000002e-002 | AJ20: =H20+100*O20 -> 196.072 | AK20: 155.8 | AL20: 250 | AM20: 63.4 | AN20: 249 | AO20: -2.3e-002 | AP20: 20 | AQ20: 瀛通转债!
A21: 277 | B21: 128069 | C21: 华森转债! | D21: 2907 | E21: 华森制药 | F21: 医药 | G21: 化学制药 | H21: 106.749 | I21: 6.0999999999999995e-003 | J21: -4.0000000000000001e-003 | K21: 11.57 | L21: 1.3999999999999999e-002 | M21: 119.3 | N21: 18.01 | O21: 0.66200000000000003 | P21: 64.24 | Q21: 转股中 | R21: 3.73年 | S21: 1.73年 | T21: 3 | U21: 3.3 | V21: 1.e-002 | W21: 6.4000000000000001e-002 | X21: 4.0999999999999995e-002 | Y21: 46 | Z21: 4.05 | AA21: 3.0800000000000001e-002 | AB21: 2.1499999999999998e-002 | AC21: -1.9799999999999998e-002 | AD21: -2.2599999999999999e-002 | AE21: 91.93 | AF21: 96.01 | AG21: 0.15 | AH21: AA- | AI21: 6.1100000000000002e-002 | AJ21: =H21+100*O21 -> 172.94900000000001 | AK21: 149.3 | AL21: 200 | AM21: 53.2 | AN21: 182 | AO21: -4.5999999999999999e-002 | AP21: 42 | AQ21: 华森转债!
A22: 143 | B22: 113601 | C22: 塞力转债! | D22: 603716 | E22: 塞力医疗 | F22: 医药 | G22: 医药商业 | H22: 104.48 | I22: 4.7999999999999996e-003 | J22: 6.5000000000000006e-003 | K22: 11.35 | L22: 4.1299999999999996e-002 | M22: 120.8 | N22: 16.98 | O22: 0.56299999999999994 | P22: 66.84 | Q22: 转股中 | R22: 4.89年 | S22: 2.89年 | T22: 5.43 | U22: 6.4 | V22: 1.1000000000000001e-002 | W22: 0.23300000000000001 | X22: 0.156 | Y22: 23 | Z22: 1.54 | AA22: 3.0800000000000001e-002 | AB22: 2.3199999999999998e-002 | AC22: -2.3999999999999998e-003 | AD22: -4.7999999999999996e-003 | AE22: 86.67 | AF22: 90.95 | AG22: 0.27 | AH22: AA- | AI22: 6.1100000000000002e-002 | AJ22: =H22+100*O22 -> 160.78 | AK22: 142.1 | AL22: 146 | AM22: 51.2 | AN22: 169 | AO22: 2.2000000000000002e-002 | AP22: 38 | AQ22: 塞力转债!
A23: 106 | B23: 123077 | C23: 汉得转债! | D23: 300170 | E23: 汉得信息 | F23: 计算机及 | G23: 软件开发 | H23: 107.75 | I23: 9.0000000000000011e-003 | J23: -8.1000000000000013e-003 | K23: 6.97 | L23: 4.3e-003 | M23: 125.5 | N23: 9.69 | O23: 0.498 | P23: 71.93 | Q23: 转股中 | R23: 5年53天 | S23: 3年54天 | T23: 9.37 | U23: 2.9 | V23: 3.0000000000000001e-003 | W23: 0.152 | X23: 0.109 | Y23: 62 | Z23: 1.95 | AA23: 3.0699999999999998e-002 | AB23: 2.2200000000000001e-002 | AC23: -1.1200000000000002e-002 | AD23: -1.34e-002 | AE23: 90.88 | AF23: 102.23 | AG23: 0.21 | AH23: AA | AI23: 4.1500000000000002e-002 | AJ23: =H23+100*O23 -> 157.55000000000001 | AK23: 143.6 | AL23: 159 | AM23: 41.3 | AN23: 93 | AO23: -7.2000000000000008e-002 | AP23: 15 | AQ23: 汉得转债!
A24: 246 | B24: 110064 | C24: 建工转债! | D24: 600939 | E24: 重庆建工 | F24: 建筑 | G24: 建筑工程 | H24: 105.88 | I24: 8.8000000000000005e-003 | J24: -5.4000000000000003e-003 | K24: 3.62 | L24: 1.3999999999999999e-002 | M24: 119.8 | N24: 4.53 | O24: 0.32500000000000001 | P24: 79.91 | Q24: 转股中 | R24: 4.22年 | S24: 2.22年 | T24: 16.6 | U24: 8.5 | V24: 5.0000000000000001e-003 | W24: 0.253 | X24: 0.20199999999999999 | Y24: 66 | Z24: 0.91 | AA24: 3.0499999999999999e-002 | AB24: 2.2000000000000002e-002 | AC24: -6.9999999999999993e-003 | AD24: -1.03e-002 | AE24: 95.99 | AF24: 103.95 | AG24: 0.24 | AH24: AA+ | AI24: 3.5099999999999999e-002 | AJ24: =H24+100*O24 -> 138.38 | AK24: 131.8 | AL24: 42 | AM24: 27.9 | AN24: 12 | AO24: -5.0000000000000001e-003 | AP24: 47 | AQ24: 建工转债!
A25: 261 | B25: 110059 | C25: 浦发转债! | D25: 600000 | E25: 浦发银行 | F25: 金融 | G25: 银行行业 | H25: 104.5 | I25: 1.5e-003 | J25: -1.8e-003 | K25: 9 | L25: -2.2000000000000001e-003 | M25: 117.6 | N25: 13.97 | O25: 0.622 | P25: 64.42 | Q25: 转股中 | R25: 4年27天 | S25: 无权 | T25: 500 | U25: 112 | V25: 2.e-003 | W25: 0.18899999999999997 | X25: 0.122 | Y25: 2642. | Z25: 0.49 | AA25: 3.04e-002 | AB25: 2.2400000000000003e-002 | AC25: 无权 | AD25: 无权 | AE25: 无权 | AF25: 103.43 | AG25: 0.1 | AH25: AAA | AI25: 3.3099999999999997e-002 | AJ25: =H25+100*O25 -> 166.69999999999999 | AK25: 144.6 | AL25: 167 | AM25: 41.1 | AN25: 90 | AO25: -1.9e-002 | AP25: 60 | AQ25: 浦发转债!
A26: 36 | B26: 113624 | C26: 正川转债! | D26: 603976 | E26: 正川股份 | F26: 医药 | G26: 医药行业 | H26: 103.45 | I26: 5.8999999999999999e-003 | J26: -2.3999999999999998e-003 | K26: 29.86 | L26: 1.01e-002 | M26: 121.6 | N26: 46.69 | O26: 0.61799999999999999 | P26: 63.95 | Q26: 39天 | R26: 5.57年 | S26: 3.58年 | T26: 4.05 | U26: 3.2 | V26: 8.0000000000000002e-003 | W26: 8.9999999999999997e-002 | X26: 5.7000000000000002e-002 | Y26: 45 | Z26: 4.21 | AA26: 3.0099999999999998e-002 | AB26: 2.3199999999999998e-002 | AC26: 3.0000000000000001e-003 | AD26: 5.9999999999999995e-004 | AE26: 80.49 | AF26: 82.68 | AG26: 0.35 | AH26: A+ | AI26: 7.3499999999999996e-002 | AJ26: =H26+100*O26 -> 165.25 | AK26: 142.9 | AL26: 157 | AM26: 60.3 | AN26: 229 | AO26: -7.2999999999999995e-002 | AP26: 18 | AQ26: 正川转债!
A27: 335 | B27: 127007 | C27: 湖广转债! | D27: 665 | E27: 湖北广电 | F27: 传媒娱乐 | G27: 影视娱乐 | H27: 102.799 | I27: -5.9999999999999995e-004 | J27: 2.e-003 | K27: 3.66 | L27: 1.95e-002 | M27: 111.3 | N27: 5.58 | O27: 0.56700000000000006 | P27: 65.59 | Q27: 转股中 | R27: 2.74年 | S27: 0.74年 | T27: 12.2 | U27: 3.9 | V27: 3.0000000000000001e-003 | W27: 0.33799999999999997 | X27: 0.222 | Y27: 36 | Z27: 0.62 | AA27: 2.9900000000000003e-002 | AB27: 2.2000000000000002e-002 | AC27: -1.0700000000000001e-002 | AD27: -1.46e-002 | AE27: 98.84 | AF27: 101.94 | AG27: 0.07 | AH27: AA+ | AI27: 3.3099999999999997e-002 | AJ27: =H27+100*O27 -> 159.49900000000002 | AK27: 140 | AL27: 125 | AM27: 38.1 | AN27: 67 | AO27: -3.2000000000000001e-002 | AP27: 20 | AQ27: 湖广转债!
A28: 296 | B28: 113530 | C28: 大丰转债! | D28: 603081 | E28: 大丰实业 | F28: 建筑 | G28: 装饰工程 | H28: 109.5 | I28: 5.8999999999999999e-003 | J28: -2.e-003 | K28: 11.33 | L28: 3.7499999999999999e-002 | M28: 121 | N28: 16.49 | O28: 0.59399999999999997 | P28: 68.71 | Q28: 转股中 | R28: 3.49年 | S28: 1.49年 | T28: 6.3 | U28: 4.7 | V28: 6.9999999999999993e-003 | W28: 0.13800000000000001 | X28: 9.5000000000000001e-002 | Y28: 46 | Z28: 2.01 | AA28: 2.9700000000000001e-002 | AB28: 1.9e-002 | AC28: -3.7100000000000001e-002 | AD28: -4.0300000000000002e-002 | AE28: 96.49 | AF28: 105.8 | AG28: 0.1 | AH28: AA | AI28: 4.0099999999999997e-002 | AJ28: =H28+100*O28 -> 168.90000000000001 | AK28: 150.3 | AL28: 209 | AM28: 44.5 | AN28: 116 | AO28: -6.3e-002 | AP28: 31 | AQ28: 大丰转债!
A29: 286 | B29: 127013 | C29: 创维转债! | D29: 810 | E29: 创维数字 | F29: 电子 | G29: 电子产品 | H29: 105.978 | I29: 5.5000000000000005e-003 | J29: -4.8999999999999998e-003 | K29: 6.9 | L29: 8.8000000000000005e-003 | M29: 117.3 | N29: 11.29 | O29: 0.7340000000000001 | P29: 61.12 | Q29: 转股中 | R29: 3.54年 | S29: 1.54年 | T29: 9.78 | U29: 9.7 | V29: 9.0000000000000011e-003 | W29: 0.13300000000000001 | X29: 8.1000000000000003e-002 | Y29: 73 | Z29: 1.72 | AA29: 2.9700000000000001e-002 | AB29: 2.0799999999999999e-002 | AC29: -1.78e-002 | AD29: -2.1000000000000001e-002 | AE29: 96.18 | AF29: 102.34 | AG29: 0.06 | AH29: AA | AI29: 4.0099999999999997e-002 | AJ29: =H29+100*O29 -> 179.37799999999999 | AK29: 150.8 | AL29: 213 | AM29: 48.5 | AN29: 150 | AO29: -0.13100000000000001 | AP29: 23 | AQ29: 创维转债!
A30: 73 | B30: 113042 | C30: 上银转债! | D30: 601229 | E30: 上海银行 | F30: 金融 | G30: 银行行业 | H30: 103.99 | I30: 2.9999999999999997e-004 | J30: -8.0000000000000004e-004 | K30: 7.31 | L30: -2.7000000000000001e-003 | M30: 120.9 | N30: 10.63 | O30: 0.51200000000000001 | P30: 68.77 | Q30: 转股中 | R30: 5.32年 | S30: 无权 | T30: 200 | U30: 104 | V30: 5.0000000000000001e-003 | W30: 0.193 | X30: 0.13200000000000001 | Y30: 1038. | Z30: 0.59 | AA30: 2.9600000000000001e-002 | AB30: 2.2499999999999999e-002 | AC30: 无权 | AD30: 无权 | AE30: 无权 | AF30: 101.48 | AG30: 0.2 | AH30: AAA | AI30: 3.4500000000000003e-002 | AJ30: =H30+100*O30 -> 155.19 | AK30: 139.2 | AL30: 115 | AM30: 37.7 | AN30: 63 | AO30: -9.0000000000000011e-003 | AP30: 13 | AQ30: 上银转债!
A31: 291 | B31: 128063 | C31: 未来转债! | D31: 2631 | E31: 德尔未来 | F31: 其他 | G31: 家居用品 | H31: 115.598 | I31: 1.49e-002 | J31: -7.8000000000000005e-003 | K31: 7.66 | L31: 2.e-002 | M31: 127.5 | N31: 8.6 | O31: 0.29799999999999999 | P31: 89.07 | Q31: 转股中 | R31: 3.51年 | S31: 2.51年 | T31: 6.29 | U31: 18 | V31: 2.5000000000000001e-002 | W31: 0.12300000000000001 | X31: 0.11 | Y31: 51 | Z31: 3.01 | AA31: 2.92e-002 | AB31: 1.5900000000000001e-002 | AC31: -2.5099999999999997e-002 | AD31: -3.0600000000000002e-002 | AE31: 92.66 | AF31: 104.23 | AG31: 0.35 | AH31: AA- | AI31: 6.1100000000000002e-002 | AJ31: =H31+100*O31 -> 145.398 | AK31: 142.1 | AL31: 147 | AM31: 37.9 | AN31: 65 | AO31: -0.13500000000000001 | AP31: 36 | AQ31: 未来转债!
A32: 171 | B32: 127019 | C32: 国城转债! | D32: 688 | E32: 国城矿业 | F32: 有色金属 | G32: 锌铅镍锡 | H32: 100.51 | I32: 1.83e-002 | J32: -1.6200000000000003e-002 | K32: 10.47 | L32: 4.1799999999999997e-002 | M32: 114.8 | N32: 21.06 | O32: 1.02 | P32: 49.72 | Q32: 转股中 | R32: 4.79年 | S32: 2.79年 | T32: 8.5 | U32: 26 | V32: 3.1e-002 | W32: 7.0999999999999994e-002 | X32: 3.5000000000000003e-002 | Y32: 119 | Z32: 4.99 | AA32: 2.87e-002 | AB32: 2.29e-002 | AC32: 9.3999999999999986e-003 | AD32: 7.1999999999999998e-003 | AE32: 92.05 | AF32: 95.43 | AG32: 0.05 | AH32: AA | AI32: 4.0099999999999997e-002 | AJ32: =H32+100*O32 -> 202.50999999999999 | AK32: 151.3 | AL32: 216 | AM32: 55.9 | AN32: 204 | AO32: -0.23999999999999999 | AP32: 47 | AQ32: 国城转债!
A33: 135 | B33: 128132 | C33: 交建转债! | D33: 2941 | E33: 新疆交建 | F33: 建筑 | G33: 建筑工程 | H33: 101.935 | I33: 3.3e-003 | J33: -2.5000000000000001e-003 | K33: 11.54 | L33: 6.0999999999999995e-003 | M33: 116.9 | N33: 18.53 | O33: 0.63700000000000001 | P33: 62.28 | Q33: 转股中 | R33: 4.96年 | S33: 2.96年 | T33: 8.49 | U33: 10 | V33: 1.2e-002 | W33: 0.114 | X33: 7.0999999999999994e-002 | Y33: 74 | Z33: 2.95 | AA33: 2.8500000000000001e-002 | AB33: 2.23e-002 | AC33: 4.5999999999999999e-003 | AD33: 2.5000000000000001e-003 | AE33: 91.54 | AF33: 96.54 | AG33: 0.13 | AH33: AA | AI33: 4.0099999999999997e-002 | AJ33: =H33+100*O33 -> 165.63499999999999 | AK33: 141.6 | AL33: 141 | AM33: 45.1 | AN33: 123 | AO33: -8.0000000000000002e-002 | AP33: 25 | AQ33: 交建转债!
A34: 307 | B34: 113021 | C34: 中信转债! | D34: 601998 | E34: 中信银行 | F34: 金融 | G34: 银行行业 | H34: 107.53 | I34: 1.e-003 | J34: -1.e-003 | K34: 4.56 | L34: 0. | M34: 118 | N34: 6.73 | O34: 0.58700000000000008 | P34: 67.76 | Q34: 转股中 | R34: 3.42年 | S34: 无权 | T34: 400 | U34: 36 | V34: 1.e-003 | W34: 0.17899999999999999 | X34: 0.121 | Y34: 2231. | Z34: 0.46 | AA34: 2.8399999999999998e-002 | AB34: 1.8700000000000001e-002 | AC34: 无权 | AD34: 无权 | AE34: 无权 | AF34: 105.92 | AG34: 0.1 | AH34: AAA | AI34: 3.3099999999999997e-002 | AJ34: =H34+100*O34 -> 166.23000000000002 | AK34: 147.3 | AL34: 188 | AM34: 41.4 | AN34: 95 | AO34: -2.3e-002 | AP34: 41 | AQ34: 中信转债!
A35: 147 | B35: 110072 | C35: 广汇转债! | D35: 600297 | E35: 广汇汽车 | F35: 汽车 | G35: 分销、售 | H35: 99.89 | I35: 1.1000000000000001e-002 | J35: -9.300000000000001e-003 | K35: 2.99 | L35: 6.7000000000000002e-003 | M35: 114.3 | N35: 4.03 | O35: 0.34600000000000003 | P35: 74.19 | Q35: 转股中 | R35: 4.88年 | S35: 2.88年 | T35: 33.7 | U35: 41 | V35: 1.2e-002 | W35: 0.13900000000000001 | X35: 0.10300000000000001 | Y35: 243 | Z35: 0.59 | AA35: 2.8399999999999998e-002 | AB35: 2.3e-002 | AC35: 9.4999999999999998e-003 | AD35: 7.7000000000000002e-003 | AE35: 92.59 | AF35: 96.83 | AG35: 0.25 | AH35: AA+ | AI35: 3.5099999999999999e-002 | AJ35: =H35+100*O35 -> 134.49000000000001 | AK35: 125.6 | AL35: 14 | AM35: 28.8 | AN35: 16 | AO35: -4.4999999999999998e-002 | AP35: 73 | AQ35: 广汇转债!
A36: 221 | B36: 128100 | C36: 搜特转债! | D36: 2503 | E36: 搜于特 | F36: 服装纺织 | G36: 服装行业 | H36: 103.51 | I36: 6.0000000000000001e-003 | J36: -1.8e-003 | K36: 1.55 | L36: 6.5000000000000006e-003 | M36: 116.9 | N36: 1.62 | O36: 8.199999999999999e-002 | P36: 95.68 | Q36: 转股中 | R36: 4.45年 | S36: 2.45年 | T36: 7.99 | U36: 22 | V36: 2.7000000000000003e-002 | W36: 0.16699999999999998 | X36: 0.16 | Y36: 48 | Z36: 2.08 | AA36: 2.8300000000000002e-002 | AB36: 2.1299999999999999e-002 | AC36: -4.0000000000000002e-004 | AD36: -2.8999999999999998e-003 | AE36: 84.31 | AF36: 82.94 | AG36: 0.65 | AH36: A | AI36: 8.2100000000000006e-002 | AJ36: =H36+100*O36 -> 111.71000000000001 | AK36: 111.3 | AL36: 3 | AM36: 27 | AN36: 10 | AO36: -5.2999999999999999e-002 | AP36: 77 | AQ36: 搜特转债!
A37: 230 | B37: 113566 | C37: 翔港转债! | D37: 603499 | E37: 翔港科技 | F37: 造纸包装 | G37: 包装材料 | H37: 110.09 | I37: 1.e-002 | J37: -6.1999999999999998e-003 | K37: 7.09 | L37: 1.43e-002 | M37: 124 | N37: 10.77 | O37: 0.67200000000000004 | P37: 65.83 | Q37: 转股中 | R37: 4.41年 | S37: 2.41年 | T37: 1.61 | U37: 3.3 | V37: 1.8000000000000002e-002 | W37: 0.113 | X37: 7.400000000000001e-002 | Y37: 14 | Z37: 2.51 | AA37: 2.7999999999999997e-002 | AB37: 1.8500000000000003e-002 | AC37: -2.1499999999999998e-002 | AD37: -2.4500000000000001e-002 | AE37: 87.25 | AF37: 91.9 | AG37: 0.27 | AH37: A+ | AI37: 7.2099999999999997e-002 | AJ37: =H37+100*O37 -> 177.29000000000002 | AK37: 154.3 | AL37: 239 | AM37: 62.4 | AN37: 237 | AO37: -3.7999999999999999e-002 | AP37: 28 | AQ37: 翔港转债!
A38: 191 | B38: 113584 | C38: 家悦转债! | D38: 603708 | E38: 家家悦 | F38: 商业零售 | G38: 超市 | H38: 101.24 | I38: 3.0000000000000001e-003 | J38: -2.8999999999999998e-003 | K38: 15.03 | L38: 8.6999999999999994e-003 | M38: 114.9 | N38: 37.53 | O38: 1.53 | P38: 40.05 | Q38: 转股中 | R38: 4.68年 | S38: 2.68年 | T38: 6.45 | U38: 1.6 | V38: 2.e-003 | W38: 7.0999999999999994e-002 | X38: 2.7999999999999997e-002 | Y38: 91 | Z38: 3.54 | AA38: 2.7999999999999997e-002 | AB38: 2.2000000000000002e-002 | AC38: 7.4999999999999997e-003 | AD38: 5.1999999999999998e-003 | AE38: 92.55 | AF38: 95.94 | AG38: 0.01 | AH38: AA | AI38: 4.0099999999999997e-002 | AJ38: =H38+100*O38 -> 254.24000000000001 | AK38: 162.4 | AL38: 288 | AM38: 66.5 | AN38: 269 | AO38: -1.8000000000000002e-002 | AP38: 15 | AQ38: 家悦转债!
A39: 152 | B39: 128125 | C39: 华阳转债! | D39: 2949 | E39: 华阳国际 | F39: 建筑 | G39: 建筑工程 | H39: 103.72 | I39: 2.8999999999999998e-003 | J39: 1.e-003 | K39: 14.54 | L39: 2.3199999999999998e-002 | M39: 118.1 | N39: 25.39 | O39: 0.81099999999999994 | P39: 57.27 | Q39: 转股中 | R39: 4.83年 | S39: 2.83年 | T39: 4.5 | U39: 3.3 | V39: 6.9999999999999993e-003 | W39: 0.158 | X39: 8.9999999999999997e-002 | Y39: 29 | Z39: 2.24 | AA39: 2.7799999999999998e-002 | AB39: 2.1000000000000001e-002 | AC39: -8.9999999999999998e-004 | AD39: -3.0999999999999999e-003 | AE39: 86.72 | AF39: 89.18 | AG39: 0.17 | AH39: AA- | AI39: 6.1100000000000002e-002 | AJ39: =H39+100*O39 -> 184.81999999999999 | AK39: 150.2 | AL39: 208 | AM39: 61 | AN39: 231 | AO39: -8.0000000000000002e-002 | AP39: 9 | AQ39: 华阳转债!
A40: 268 | B40: 128074 | C40: 游族转债!! | D40: 2174 | E40: 游族网络 | F40: 通信互联 | G40: 互联网 | H40: 107.3 | I40: 5.6000000000000008e-003 | J40: -2.5000000000000001e-003 | K40: 11.72 | L40: 1.9099999999999999e-002 | M40: 119.3 | N40: 16.97 | O40: 0.55399999999999994 | P40: 69.06 | Q40: 转股中 | R40: 3.98年 | S40: 1.98年 | T40: 6.83 | U40: 4.3 | V40: 6.0000000000000001e-003 | W40: 6.4000000000000001e-002 | X40: 4.4000000000000004e-002 | Y40: 107 | Z40: 2.09 | AA40: 2.75e-002 | AB40: 1.8799999999999997e-002 | AC40: -1.9900000000000001e-002 | AD40: -2.2400000000000003e-002 | AE40: 94.53 | AF40: 97.21 | AG40: 0.17 | AH40: AA | AI40: 4.0099999999999997e-002 | AJ40: =H40+100*O40 -> 162.69999999999999 | AK40: 145.5 | AL40: 173 | AM40: 48.3 | AN40: 148 | AO40: -7.400000000000001e-002 | AP40: 30 | AQ40: 游族转债!!
A41: 193 | B41: 123051 | C41: 今天转债!* | D41: 300532 | E41: 今天国际 | F41: 计算机及 | G41: 软件开发 | H41: 108.489 | I41: 3.1800000000000002e-002 | J41: 1.1000000000000001e-002 | K41: 9.48 | L41: 4.6399999999999997e-002 | M41: 122.3 | N41: 8.7 | O41: -4.0000000000000001e-003 | P41: 108.97 | Q41: 转股中 | R41: 4.68年 | S41: 2.68年 | T41: 1.88 | U41: 87 | V41: 0.42599999999999999 | W41: 7.0999999999999994e-002 | X41: 7.6999999999999999e-002 | Y41: 27 | Z41: 3.13 | AA41: 2.6600000000000002e-002 | AB41: 1.8200000000000001e-002 | AC41: -1.4199999999999999e-002 | AD41: -1.7000000000000001e-002 | AE41: 85.7 | AF41: 89.02 | AG41: 0.92 | AH41: A+ | AI41: 7.2099999999999997e-002 | AJ41: =H41+100*O41 -> 108.089 | AK41: 108 | AL41: 1 | AM41: 19 | AN41: 4 | AO41: -0.11699999999999999 | AP41: 19 | AQ41: 今天转债!*
A42: 153 | B42: 113597 | C42: 佳力转债! | D42: 603912 | E42: 佳力图 | F42: 机械装备 | G42: 专用设备 | H42: 109.72 | I42: 8.9999999999999998e-004 | J42: 1.e-003 | K42: 14.28 | L42: 9.8999999999999991e-003 | M42: 124 | N42: 23.15 | O42: 0.77900000000000003 | P42: 61.68 | Q42: 转股中 | R42: 4.83年 | S42: 2.83年 | T42: 3 | U42: 3.2 | V42: 1.e-002 | W42: 9.6999999999999989e-002 | X42: 5.9999999999999998e-002 | Y42: 31 | Z42: 3.3 | AA42: 2.6200000000000001e-002 | AB42: 1.7600000000000001e-002 | AC42: -1.8100000000000002e-002 | AD42: -2.06e-002 | AE42: 87.14 | AF42: 93.69 | AG42: 0.2 | AH42: AA- | AI42: 6.1100000000000002e-002 | AJ42: =H42+100*O42 -> 187.62 | AK42: 157.8 | AL42: 269 | AM42: 64.1 | AN42: 255 | AO42: -0.157 | AP42: 18 | AQ42: 佳力转债!
A43: 212 | B43: 127016 | C43: 鲁泰转债! | D43: 726 | E43: 鲁 泰Ａ | F43: 服装纺织 | G43: 纺织行业 | H43: 103.6 | I43: 5.1999999999999998e-003 | J43: -4.0000000000000001e-003 | K43: 5.87 | L43: 8.6e-003 | M43: 115.9 | N43: 8.71 | O43: 0.53700000000000003 | P43: 67.39 | Q43: 转股中 | R43: 4.52年 | S43: 2.53年 | T43: 14 | U43: 2.4 | V43: 2.e-003 | W43: 0.27000000000000002 | X43: 0.182 | Y43: 52 | Z43: 0.66 | AA43: 2.5600000000000001e-002 | AB43: 1.9099999999999999e-002 | AC43: -7.000000000000001e-004 | AD43: -3.2000000000000002e-003 | AE43: 94.32 | AF43: 99.47 | AG43: 0.15 | AH43: AA+ | AI43: 3.5099999999999999e-002 | AJ43: =H43+100*O43 -> 157.30000000000001 | AK43: 139.8 | AL43: 120 | AM43: 40.3 | AN43: 82 | AO43: -1.4999999999999999e-002 | AP43: 22 | AQ43: 鲁泰转债!
A44: 319 | B44: 128049 | C44: 华源转债! | D44: 2787 | E44: 华源控股 | F44: 造纸包装 | G44: 包装材料 | H44: 105.93 | I44: 1.1999999999999999e-003 | J44: 4.5000000000000005e-003 | K44: 5.6 | L44: 2.e-002 | M44: 114.5 | N44: 7.37 | O44: 0.39399999999999996 | P44: 75.98 | Q44: 转股中 | R44: 3年57天 | S44: 1年58天 | T44: 3.63 | U44: 4.3 | V44: 1.1000000000000001e-002 | W44: 0.20499999999999999 | X44: 0.156 | Y44: 18 | Z44: 1.18 | AA44: 2.5499999999999998e-002 | AB44: 1.7000000000000001e-002 | AC44: -2.2400000000000003e-002 | AD44: -2.64e-002 | AE44: 95.14 | AF44: 95.36 | AG44: 0.29 | AH44: AA- | AI44: 6.1100000000000002e-002 | AJ44: =H44+100*O44 -> 145.33000000000001 | AK44: 135.9 | AL44: 85 | AM44: 40.5 | AN44: 83 | AO44: -3.7000000000000005e-002 | AP44: 42 | AQ44: 华源转债!
A45: 108 | B45: 123076 | C45: 强力转债! | D45: 300429 | E45: 强力新材 | F45: 化工 | G45: 化工 | H45: 104.399 | I45: 7.7000000000000002e-003 | J45: -4.0000000000000001e-003 | K45: 11.12 | L45: 1.9199999999999998e-002 | M45: 118.5 | N45: 18.94 | O45: 0.77800000000000002 | P45: 58.71 | Q45: 转股中 | R45: 5年49天 | S45: 3年50天 | T45: 8.5 | U45: 1.2 | V45: 1.e-003 | W45: 0.14800000000000002 | X45: 8.6999999999999994e-002 | Y45: 57 | Z45: 3.22 | AA45: 2.5499999999999998e-002 | AB45: 1.9e-002 | AC45: -1.6000000000000001e-003 | AD45: -3.9000000000000003e-003 | AE45: 85.19 | AF45: 87.39 | AG45: 0.19 | AH45: AA- | AI45: 6.25e-002 | AJ45: =H45+100*O45 -> 182.19900000000001 | AK45: 150.1 | AL45: 205 | AM45: 62.7 | AN45: 240 | AO45: -0.10300000000000001 | AP45: 18 | AQ45: 强力转债!
A46: 71 | B46: 123096 | C46: 思创转债! | D46: 300078 | E46: 思创医惠 | F46: 通信互联 | G46: 物联网 | H46: 108.82 | I46: -1.1999999999999999e-003 | J46: 4.5000000000000005e-003 | K46: 6.47 | L46: 7.8000000000000005e-003 | M46: 124 | N46: 8.27 | O46: 0.39100000000000001 | P46: 78.23 | Q46: 转股中 | R46: 5.32年 | S46: 3.33年 | T46: 8.17 | U46: 6.3 | V46: 6.9999999999999993e-003 | W46: 0.14599999999999999 | X46: 0.114 | Y46: 56 | Z46: 2.07 | AA46: 2.5399999999999999e-002 | AB46: 1.7600000000000001e-002 | AC46: -1.32e-002 | AD46: -1.54e-002 | AE46: 84.3 | AF46: 90.42 | AG46: 0.42 | AH46: AA- | AI46: 6.25e-002 | AJ46: =H46+100*O46 -> 147.91999999999999 | AK46: 139.4 | AL46: 117 | AM46: 49 | AN46: 153 | AO46: -2.9999999999999999e-002 | AP46: 10 | AQ46: 思创转债!
A47: 35 | B47: 127034 | C47: 绿茵转债! | D47: 2887 | E47: 绿茵生态 | F47: 城市公用 | G47: 生态环境 | H47: 104.122 | I47: 5.0000000000000001e-003 | J47: -8.9999999999999998e-004 | K47: 10.14 | L47: 8.0000000000000002e-003 | M47: 119 | N47: 12.38 | O47: 0.27100000000000002 | P47: 81.91 | Q47: 42天 | R47: 5.58年 | S47: 3.58年 | T47: 7.12 | U47: 7.7 | V47: 1.e-002 | W47: 0.22500000000000001 | X47: 0.184 | Y47: 32 | Z47: 1.56 | AA47: 2.4700000000000003e-002 | AB47: 1.8600000000000002e-002 | AC47: -5.0000000000000001e-004 | AD47: -2.5000000000000001e-003 | AE47: 82.99 | AF47: 85.45 | AG47: 0.52 | AH47: AA- | AI47: 6.25e-002 | AJ47: =H47+100*O47 -> 131.22200000000001 | AK47: 126.3 | AL47: 18 | AM47: 40.9 | AN47: 84 | AO47: -4.8000000000000001e-002 | AP47: 29 | AQ47: 绿茵转债!
A48: 128 | B48: 123068 | C48: 弘信转债!* | D48: 300657 | E48: 弘信电子 | F48: 电子 | G48: 元器件制 | H48: 107.9 | I48: -7.000000000000001e-004 | J48: 7.000000000000001e-004 | K48: 15.5 | L48: 7.0999999999999995e-003 | M48: 121.2 | N48: 15.34 | O48: 6.8000000000000005e-002 | P48: 101.04 | Q48: 转股中 | R48: 5年14天 | S48: 3年15天 | T48: 1.5 | U48: 87 | V48: 0.53299999999999992 | W48: 2.4e-002 | X48: 2.4e-002 | Y48: 64 | Z48: 4 | AA48: 2.3900000000000001e-002 | AB48: 1.6399999999999998e-002 | AC48: -1.1200000000000002e-002 | AD48: -1.3600000000000001e-002 | AE48: 85.94 | AF48: 89.96 | AG48: 0 | AH48: AA- | AI48: 6.25e-002 | AJ48: =H48+100*O48 -> 114.7 | AK48: 114.8 | AL48: 5 | AM48: 24.8 | AN48: 9 | AO48: -0.26000000000000001 | AP48: 10 | AQ48: 弘信转债!*
A49: 309 | B49: 128056 | C49: 今飞转债! | D49: 2863 | E49: 今飞凯达 | F49: 汽车 | G49: 零部件制 | H49: 111.199 | I49: 5.6999999999999993e-003 | J49: -2.7000000000000001e-003 | K49: 5.03 | L49: 1.e-002 | M49: 120.2 | N49: 6.69 | O49: 0.47899999999999998 | P49: 75.19 | Q49: 转股中 | R49: 3.42年 | S49: 1.42年 | T49: 1.72 | U49: 2.3 | V49: 1.2e-002 | W49: 6.9000000000000006e-002 | X49: 5.2000000000000005e-002 | Y49: 25 | Z49: 1.33 | AA49: 2.3599999999999999e-002 | AB49: 1.3100000000000001e-002 | AC49: -4.5599999999999995e-002 | AD49: -4.9500000000000002e-002 | AE49: 92.71 | AF49: 95.31 | AG49: 0.29 | AH49: A+ | AI49: 7.2099999999999997e-002 | AJ49: =H49+100*O49 -> 159.09899999999999 | AK49: 147.2 | AL49: 186 | AM49: 51.9 | AN49: 174 | AO49: -4.8000000000000001e-002 | AP49: 51 | AQ49: 今飞转债!
A50: 316 | B50: 113524 | C50: 奇精转债! | D50: 603677 | E50: 奇精机械 | F50: 家电 | G50: 零部件制 | H50: 109.24 | I50: 1.5e-003 | J50: -5.9999999999999995e-004 | K50: 10.99 | L50: 2.7000000000000001e-003 | M50: 117.3 | N50: 13.98 | O50: 0.39000000000000001 | P50: 78.61 | Q50: 转股中 | R50: 3.20年 | S50: 1.21年 | T50: 3.3 | U50: 3.5 | V50: 1.e-002 | W50: 0.156 | X50: 0.12300000000000001 | Y50: 21 | Z50: 2.13 | AA50: 2.29e-002 | AB50: 1.32e-002 | AC50: -4.3700000000000003e-002 | AD50: -4.7500000000000001e-002 | AE50: 94.85 | AF50: 97.4 | AG50: 0.3 | AH50: AA- | AI50: 6.1100000000000002e-002 | AJ50: =H50+100*O50 -> 148.24000000000001 | AK50: 139.9 | AL50: 121 | AM50: 42.5 | AN50: 100 | AO50: -8.4000000000000005e-002 | AP50: 43 | AQ50: 奇精转债!
A51: 371 | B51: 127003 | C51: 海印转债! | D51: 861 | E51: 海印股份 | F51: 商业零售 | G51: 商场 | H51: 108.308 | I51: 2.3999999999999998e-003 | J51: -2.3e-003 | K51: 2.08 | L51: 1.9599999999999999e-002 | M51: 110 | N51: 2.99 | O51: 0.55700000000000005 | P51: 69.57 | Q51: 转股中 | R51: 0.69年 | S51: 回售内 | T51: 6.74 | U51: 6 | V51: 8.0000000000000002e-003 | W51: 0.13900000000000001 | X51: 9.6999999999999989e-002 | Y51: 48 | Z51: 1.32 | AA51: 2.2799999999999997e-002 | AB51: -4.0999999999999995e-003 | AC51: 回售内 | AD51: 回售内 | AE51: 100.33 | AF51: 107.34 | AG51: 0.01 | AH51: AA | AI51: 3.6299999999999999e-002 | AJ51: =H51+100*O51 -> 164.00800000000001 | AK51: 147.1 | AL51: 183 | AM51: 39.7 | AN51: 77 | AO51: -3.9e-002 | AP51: 71 | AQ51: 海印转债!
A52: 213 | B52: 113033 | C52: 利群转债! | D52: 601366 | E52: 利群股份 | F52: 商业零售 | G52: 商场 | H52: 104.01 | I52: -1.8e-003 | J52: 1.8e-003 | K52: 6.2 | L52: 0. | M52: 114.9 | N52: 7.01 | O52: 0.17600000000000002 | P52: 88.45 | Q52: 转股中 | R52: 4.50年 | S52: 2.50年 | T52: 18 | U52: 13 | V52: 6.9999999999999993e-003 | W52: 0.33700000000000002 | X52: 0.29799999999999999 | Y52: 53 | Z52: 1.24 | AA52: 2.2799999999999997e-002 | AB52: 1.67e-002 | AC52: -2.2000000000000001e-003 | AD52: -4.6999999999999993e-003 | AE52: 93.2 | AF52: 96.62 | AG52: 0.42 | AH52: AA | AI52: 4.0099999999999997e-002 | AJ52: =H52+100*O52 -> 121.61000000000001 | AK52: 119.6 | AL52: 9 | AM52: 23 | AN52: 5 | AO52: -1.8000000000000002e-002 | AP52: 69 | AQ52: 利群转债!
A53: 170 | B53: 123059 | C53: 银信转债! | D53: 300231 | E53: 银信科技 | F53: 计算机及 | G53: 软件开发 | H53: 111.374 | I53: 3.7000000000000002e-003 | J53: 5.0000000000000001e-003 | K53: 8.09 | L53: 2.0199999999999999e-002 | M53: 123.7 | N53: 9.72 | O53: 0.33799999999999997 | P53: 83.23 | Q53: 转股中 | R53: 4.79年 | S53: 2.79年 | T53: 3.91 | U53: 2.9 | V53: 6.9999999999999993e-003 | W53: 0.109 | X53: 9.0999999999999998e-002 | Y53: 36 | Z53: 2.65 | AA53: 2.2599999999999999e-002 | AB53: 1.41e-002 | AC53: -2.4300000000000002e-002 | AD53: -2.6600000000000002e-002 | AE53: 87.1 | AF53: 93.66 | AG53: 0.43 | AH53: AA- | AI53: 6.1100000000000002e-002 | AJ53: =H53+100*O53 -> 145.17399999999998 | AK53: 139.5 | AL53: 118 | AM53: 45.9 | AN53: 133 | AO53: -8.6999999999999994e-002 | AP53: 18 | AQ53: 银信转债!
A54: 250 | B54: 128083 | C54: 新北转债! | D54: 2376 | E54: 新北洋 | F54: 电子 | G54: 电子产品 | H54: 105 | I54: 3.7000000000000002e-003 | J54: -1.6000000000000001e-003 | K54: 7.91 | L54: 1.15e-002 | M54: 114.9 | N54: 11.45 | O54: 0.52000000000000002 | P54: 69.08 | Q54: 转股中 | R54: 4.20年 | S54: 2.20年 | T54: 8.77 | U54: 1.5 | V54: 2.e-003 | W54: 0.16699999999999998 | X54: 0.115 | Y54: 53 | Z54: 1.58 | AA54: 2.2200000000000001e-002 | AB54: 1.5600000000000001e-002 | AC54: -6.5000000000000006e-003 | AD54: -9.300000000000001e-003 | AE54: 94.31 | AF54: 97.77 | AG54: 0.19 | AH54: AA | AI54: 4.0099999999999997e-002 | AJ54: =H54+100*O54 -> 157. | AK54: 140.9 | AL54: 132 | AM54: 43.1 | AN54: 106 | AO54: -5.2999999999999999e-002 | AP54: 20 | AQ54: 新北转债!
A55: 130 | B55: 113604 | C55: 多伦转债! | D55: 603528 | E55: 多伦科技 | F55: 计算机及 | G55: 软件开发 | H55: 105.3 | I55: 4.6999999999999993e-003 | J55: 0. | K55: 7.12 | L55: 1.4199999999999999e-002 | M55: 117.3 | N55: 10.4 | O55: 0.53799999999999992 | P55: 68.46 | Q55: 转股中 | R55: 5年12天 | S55: 3年13天 | T55: 6.4 | U55: 2.6 | V55: 4.0000000000000001e-003 | W55: 0.14300000000000002 | X55: 9.8000000000000004e-002 | Y55: 45 | Z55: 2.71 | AA55: 2.2099999999999998e-002 | AB55: 1.5900000000000001e-002 | AC55: -4.5000000000000005e-003 | AD55: -6.8000000000000005e-003 | AE55: 85.69 | AF55: 87.04 | AG55: 0.33 | AH55: AA- | AI55: 6.25e-002 | AJ55: =H55+100*O55 -> 159.09999999999999 | AK55: 142.1 | AL55: 148 | AM55: 55.1 | AN55: 200 | AO55: -5.0999999999999997e-002 | AP55: 8 | AQ55: 多伦转债!
A56: 63 | B56: 113620 | C56: 傲农转债! | D56: 603363 | E56: 傲农生物 | F56: 农业 | G56: 畜牧业 | H56: 107.72 | I56: -7.1999999999999998e-003 | J56: 6.9999999999999993e-003 | K56: 8.49 | L56: -1.1999999999999999e-003 | M56: 121.1 | N56: 14.51 | O56: 0.84099999999999997 | P56: 58.51 | Q56: 转股中 | R56: 5.44年 | S56: 3.44年 | T56: 10 | U56: 6.8 | V56: 6.0000000000000001e-003 | W56: 0.17199999999999999 | X56: 0.10099999999999999 | Y56: 58 | Z56: 2.32 | AA56: 2.2099999999999998e-002 | AB56: 1.5300000000000001e-002 | AC56: -1.0800000000000001e-002 | AD56: -1.2699999999999999e-002 | AE56: 89.58 | AF56: 97.45 | AG56: 0.12 | AH56: AA | AI56: 4.1500000000000002e-002 | AJ56: =H56+100*O56 -> 191.81999999999999 | AK56: 156.9 | AL56: 261 | AM56: 59.5 | AN56: 226 | AO56: 9.0000000000000011e-003 | AP56: 9 | AQ56: 傲农转债!
A57: 243 | B57: 123039 | C57: 开润转债! | D57: 300577 | E57: 开润股份 | F57: 服装纺织 | G57: 纺织行业 | H57: 110.66 | I57: 9.300000000000001e-003 | J57: 4.5999999999999999e-003 | K57: 20.35 | L57: 5.0599999999999999e-002 | M57: 121 | N57: 29.9 | O57: 0.626 | P57: 68.06 | Q57: 转股中 | R57: 4.24年 | S57: 2.24年 | T57: 2.22 | U57: 7.5 | V57: 3.1e-002 | W57: 4.4999999999999998e-002 | X57: 3.1e-002 | Y57: 49 | Z57: 3.14 | AA57: 2.18e-002 | AB57: 1.3100000000000001e-002 | AC57: -2.5499999999999998e-002 | AD57: -2.86e-002 | AE57: 88.24 | AF57: 90.78 | AG57: 0.28 | AH57: A+ | AI57: 7.2099999999999997e-002 | AJ57: =H57+100*O57 -> 173.25999999999999 | AK57: 153.3 | AL57: 231 | AM57: 62.5 | AN57: 238 | AO57: 4.0999999999999995e-002 | AP57: 23 | AQ57: 开润转债!
A58: 165 | B58: 113594 | C58: 淳中转债! | D58: 603516 | E58: 淳中科技 | F58: 电子 | G58: 电子产品 | H58: 109.37 | I58: 1.6000000000000001e-003 | J58: 2.0000000000000001e-004 | K58: 17.6 | L58: 6.3e-003 | M58: 120.9 | N58: 27.84 | O58: 0.72999999999999998 | P58: 63.22 | Q58: 转股中 | R58: 4.80年 | S58: 2.81年 | T58: 3 | U58: 1.6 | V58: 5.0000000000000001e-003 | W58: 9.0999999999999998e-002 | X58: 5.7999999999999996e-002 | Y58: 33 | Z58: 3.48 | AA58: 2.1499999999999998e-002 | AB58: 1.3899999999999999e-002 | AC58: -1.67e-002 | AD58: -1.9299999999999998e-002 | AE58: 84.8 | AF58: 87.19 | AG58: 0.28 | AH58: A+ | AI58: 7.2099999999999997e-002 | AJ58: =H58+100*O58 -> 182.37 | AK58: 155.5 | AL58: 248 | AM58: 68.3 | AN58: 280 | AO58: -4.4999999999999998e-002 | AP58: 9 | AQ58: 淳中转债!
A59: 89 | B59: 123088 | C59: 威唐转债! | D59: 300707 | E59: 威唐工业 | F59: 汽车 | G59: 零部件制 | H59: 109.15 | I59: 2.3e-003 | J59: -8.0000000000000004e-004 | K59: 15.4 | L59: 3.3e-003 | M59: 121.6 | N59: 20.72 | O59: 0.46899999999999997 | P59: 74.32 | Q59: 转股中 | R59: 5.21年 | S59: 3.21年 | T59: 3.01 | U59: 4.9 | V59: 1.4999999999999999e-002 | W59: 0.125 | X59: 9.3000000000000013e-002 | Y59: 24 | Z59: 3.48 | AA59: 2.1499999999999998e-002 | AB59: 1.4199999999999999e-002 | AC59: -1.2699999999999999e-002 | AD59: -1.5300000000000001e-002 | AE59: 82.61 | AF59: 84.86 | AG59: 0.45 | AH59: A+ | AI59: 7.3499999999999996e-002 | AJ59: =H59+100*O59 -> 156.05000000000001 | AK59: 144 | AL59: 162 | AM59: 59.1 | AN59: 223 | AO59: -7.8e-002 | AP59: 17 | AQ59: 威唐转债!
A60: 161 | B60: 113037 | C60: 紫银转债! | D60: 601860 | E60: 紫金银行 | F60: 金融 | G60: 银行行业 | H60: 104.92 | I60: 1.7000000000000001e-003 | J60: -3.8e-003 | K60: 3.33 | L60: -6.0000000000000001e-003 | M60: 115.6 | N60: 4.05 | O60: 0.27600000000000002 | P60: 82.22 | Q60: 转股中 | R60: 4.81年 | S60: 无权 | T60: 45 | U60: 9.9 | V60: 2.e-003 | W60: 0.36899999999999999 | X60: 0.30299999999999999 | Y60: 122 | Z60: 0.82 | AA60: 2.0799999999999999e-002 | AB60: 1.4800000000000001e-002 | AC60: 无权 | AD60: 无权 | AE60: 无权 | AF60: 98.28 | AG60: 0.35 | AH60: AA+ | AI60: 3.5099999999999999e-002 | AJ60: =H60+100*O60 -> 132.52000000000001 | AK60: 127.6 | AL60: 23 | AM60: 29.3 | AN60: 20 | AO60: -1.e-002 | AP60: 27 | AQ60: 紫银转债!
A61: 283 | B61: 113535 | C61: 大业转债! | D61: 603278 | E61: 大业股份 | F61: 汽车 | G61: 零部件制 | H61: 106.74 | I61: 6.9999999999999993e-003 | J61: -5.0000000000000001e-004 | K61: 9.27 | L61: 4.1599999999999998e-002 | M61: 112.5 | N61: 12.29 | O61: 0.41499999999999998 | P61: 75.43 | Q61: 转股中 | R61: 2.60年 | S61: 0.61年 | T61: 5 | U61: 3.9 | V61: 6.9999999999999993e-003 | W61: 0.18600000000000003 | X61: 0.14000000000000001 | Y61: 27 | Z61: 1.53 | AA61: 2.06e-002 | AB61: 1.1699999999999999e-002 | AC61: -6.6199999999999995e-002 | AD61: -6.9199999999999998e-002 | AE61: 98.37 | AF61: 102.18 | AG61: 0.16 | AH61: AA | AI61: 3.8100000000000002e-002 | AJ61: =H61+100*O61 -> 148.24000000000001 | AK61: 138.1 | AL61: 107 | AM61: 35.9 | AN61: 55 | AO61: -9.0999999999999998e-002 | AP61: 48 | AQ61: 大业转债!
A62: 222 | B62: 123044 | C62: 红相转债!! | D62: 300427 | E62: 红相股份 | F62: 能源电力 | G62: 电力设备 | H62: 114.54 | I62: 1.54e-002 | J62: 2.0000000000000001e-004 | K62: 13.94 | L62: 5.0499999999999996e-002 | M62: 125 | N62: 18.67 | O62: 0.53400000000000003 | P62: 74.67 | Q62: 转股中 | R62: 4.45年 | S62: 2.45年 | T62: 5.5 | U62: 51 | V62: 8.199999999999999e-002 | W62: 0.109 | X62: 8.199999999999999e-002 | Y62: 50 | Z62: 2.15 | AA62: 2.0400000000000001e-002 | AB62: 1.0800000000000001e-002 | AC62: -3.49e-002 | AD62: -3.7999999999999999e-002 | AE62: 89.69 | AF62: 96.71 | AG62: 0.31 | AH62: AA- | AI62: 6.1100000000000002e-002 | AJ62: =H62+100*O62 -> 167.94 | AK62: 154.4 | AL62: 241 | AM62: 57.7 | AN62: 212 | AO62: -6.7000000000000004e-002 | AP62: 22 | AQ62: 红相转债!!
A63: 137 | B63: 123065 | C63: 宝莱转债! | D63: 300246 | E63: 宝莱特 | F63: 医药 | G63: 医疗器械 | H63: 109.99 | I63: 9.300000000000001e-003 | J63: -8.8999999999999999e-003 | K63: 16.95 | L63: 1.0700000000000001e-002 | M63: 121 | N63: 40.14 | O63: 1.6000000000000001 | P63: 42.23 | Q63: 转股中 | R63: 4.93年 | S63: 2.93年 | T63: 2.19 | U63: 9.9 | V63: 4.0999999999999995e-002 | W63: 8.8000000000000009e-002 | X63: 3.7000000000000005e-002 | Y63: 25 | Z63: 2.89 | AA63: 2.e-002 | AB63: 1.2500000000000001e-002 | AC63: -1.83e-002 | AD63: -2.07e-002 | AE63: 86.63 | AF63: 90.9 | AG63: 0.04 | AH63: AA- | AI63: 6.1100000000000002e-002 | AJ63: =H63+100*O63 -> 269.99000000000001 | AK63: 177.8 | AL63: 319 | AM63: 86.9 | AN63: 319 | AO63: -1.1000000000000001e-002 | AP63: 19 | AQ63: 宝莱转债!
A64: 353 | B64: 123004 | C64: 铁汉转债! | D64: 300197 | E64: 节能铁汉 | F64: 城市公用 | G64: 生态环境 | H64: 104.235 | I64: 4.1999999999999997e-003 | J64: -3.8e-003 | K64: 2.85 | L64: 3.4999999999999996e-003 | M64: 108.8 | N64: 3.82 | O64: 0.39700000000000002 | P64: 74.61 | Q64: 转股中 | R64: 2.22年 | S64: 0.22年 | T64: 8.03 | U64: 6.1 | V64: 6.9999999999999993e-003 | W64: 0.10000000000000001 | X64: 7.400000000000001e-002 | Y64: 80 | Z64: 1.26 | AA64: 1.9900000000000001e-002 | AB64: 1.2199999999999999e-002 | AC64: -6.6199999999999995e-002 | AD64: -7.3599999999999999e-002 | AE64: 100.11 | AF64: 100.29 | AG64: 0.11 | AH64: AA | AI64: 3.8100000000000002e-002 | AJ64: =H64+100*O64 -> 143.935 | AK64: 133.9 | AL64: 62 | AM64: 33.6 | AN64: 40 | AO64: -4.2999999999999997e-002 | AP64: 47 | AQ64: 铁汉转债!
A65: 75 | B65: 123093 | C65: 金陵转债! | D65: 300651 | E65: 金陵体育 | F65: 其他 | G65: 文化教育 | H65: 116.897 | I65: 1.2500000000000001e-002 | J65: -4.4000000000000003e-003 | K65: 27.03 | L65: 4.5199999999999997e-002 | M65: 129.3 | N65: 49.19 | O65: 1.1299999999999999 | P65: 54.95 | Q65: 转股中 | R65: 5.30年 | S65: 3.31年 | T65: 2.5 | U65: 23 | V65: 8.0000000000000002e-002 | W65: 7.2000000000000008e-002 | X65: 3.9e-002 | Y65: 35 | Z65: 5.05 | AA65: 1.9799999999999998e-002 | AB65: 1.06e-002 | AC65: -2.7099999999999999e-002 | AD65: -3.0499999999999999e-002 | AE65: 83.49 | AF65: 89.82 | AG65: 0.18 | AH65: A+ | AI65: 7.3499999999999996e-002 | AJ65: =H65+100*O65 -> 229.89699999999999 | AK65: 178.8 | AL65: 321 | AM65: 89 | AN65: 322 | AO65: -9.5000000000000001e-002 | AP65: 8 | AQ65: 金陵转债!
A66: 204 | B66: 123049 | C66: 维尔转债! | D66: 300190 | E66: 维尔利 | F66: 城市公用 | G66: 三废处理 | H66: 114.1 | I66: -2.5999999999999999e-003 | J66: 5.4000000000000003e-003 | K66: 6.65 | L66: 6.0999999999999995e-003 | M66: 124.3 | N66: 7.38 | O66: 0.26600000000000001 | P66: 90.11 | Q66: 转股中 | R66: 4.53年 | S66: 2.54年 | T66: 9.17 | U66: 5.7 | V66: 5.0000000000000001e-003 | W66: 0.17600000000000002 | X66: 0.159 | Y66: 52 | Z66: 1.2 | AA66: 1.95e-002 | AB66: 1.03e-002 | AC66: -3.3300000000000003e-002 | AD66: -3.6200000000000003e-002 | AE66: 88.97 | AF66: 95.62 | AG66: 0.47 | AH66: AA- | AI66: 6.1100000000000002e-002 | AJ66: =H66+100*O66 -> 140.69999999999999 | AK66: 138.1 | AL66: 108 | AM66: 42.5 | AN66: 101 | AO66: -3.0000000000000001e-003 | AP66: 18 | AQ66: 维尔转债!
A67: 150 | B67: 113599 | C67: 嘉友转债! | D67: 603871 | E67: 嘉友国际 | F67: 交通运输 | G67: 物流业 | H67: 114.55 | I67: 1.24e-002 | J67: -1.1200000000000002e-002 | K67: 16.45 | L67: 2.3999999999999998e-003 | M67: 125.6 | N67: 18.32 | O67: 0.27600000000000002 | P67: 89.79 | Q67: 转股中 | R67: 4.85年 | S67: 2.85年 | T67: 7.2 | U67: 5.2 | V67: 6.0000000000000001e-003 | W67: 0.153 | X67: 0.13800000000000001 | Y67: 47 | Z67: 2.36 | AA67: 1.95e-002 | AB67: 1.06e-002 | AC67: -3.3300000000000003e-002 | AD67: -3.5400000000000001e-002 | AE67: 86.71 | AF67: 94.75 | AG67: 0.48 | AH67: AA- | AI67: 6.1100000000000002e-002 | AJ67: =H67+100*O67 -> 142.15000000000001 | AK67: 139.3 | AL67: 116 | AM67: 44.6 | AN67: 118 | AO67: -4.5999999999999999e-002 | AP67: 19 | AQ67: 嘉友转债!
A68: 2 | B68: 113628 | C68: 晨丰转债 | D68: 603685 | E68: 晨丰科技 | F68: 能源电力 | G68: 电力设备 | H68: 108.84 | I68: 7.8000000000000005e-003 | J68: -1.9e-003 | K68: 11.98 | L68: 8.3999999999999995e-003 | M68: 121.7 | N68: 13.06 | O68: 0.187 | P68: 91.73 | Q68: 5月0天 | R68: 5.89年 | S68: 3.90年 | T68: 4.15 | U68: 29 | V68: 6.3e-002 | W68: 0.20499999999999999 | X68: 0.188 | Y68: 20 | Z68: 1.83 | AA68: 1.95e-002 | AB68: 1.3100000000000001e-002 | AC68: -9.7999999999999997e-003 | AD68: -1.1899999999999999e-002 | AE68: 75.81 | AF68: 76.68 | AG68: 0.69 | AH68: A | AI68: 8.3499999999999991e-002 | AJ68: =H68+100*O68 -> 127.54000000000001 | AK68: 125.9 | AL68: 15 | AM68: 49.3 | AN68: 154 | AO68: -7.0000000000000007e-002 | AP68: 4 | AQ68: 晨丰转债
A69: 285 | B69: 110058 | C69: 永鼎转债! | D69: 600105 | E69: 永鼎股份 | F69: 通信互联 | G69: 通信设备 | H69: 106.93 | I69: 5.1000000000000004e-003 | J69: 0. | K69: 3.6 | L69: 1.9799999999999998e-002 | M69: 114.3 | N69: 5.04 | O69: 0.49700000000000005 | P69: 71.43 | Q69: 转股中 | R69: 3.54年 | S69: 1.54年 | T69: 2.61 | U69: 2.2 | V69: 8.0000000000000002e-003 | W69: 5.2999999999999999e-002 | X69: 3.7999999999999999e-002 | Y69: 50 | Z69: 1.78 | AA69: 1.9400000000000001e-002 | AB69: 1.1899999999999999e-002 | AC69: -2.3e-002 | AD69: -2.6099999999999998e-002 | AE69: 92.97 | AF69: 93.04 | AG69: 0.26 | AH69: AA- | AI69: 6.1100000000000002e-002 | AJ69: =H69+100*O69 -> 156.63 | AK69: 142.4 | AL69: 154 | AM69: 49.4 | AN69: 156 | AO69: -6.3e-002 | AP69: 47 | AQ69: 永鼎转债!
A70: 292 | B70: 113532 | C70: 海环转债! | D70: 603817 | E70: 海峡环保 | F70: 城市公用 | G70: 三废处理 | H70: 105.24 | I70: 3.4000000000000002e-003 | J70: 4.5999999999999999e-003 | K70: 5.95 | L70: 3.1200000000000002e-002 | M70: 112.3 | N70: 7.63 | O70: 0.34999999999999998 | P70: 77.98 | Q70: 转股中 | R70: 3.50年 | S70: 1.51年 | T70: 4.59 | U70: 3.2 | V70: 6.9999999999999993e-003 | W70: 0.17100000000000001 | X70: 0.13400000000000001 | Y70: 27 | Z70: 1.5 | AA70: 1.9099999999999999e-002 | AB70: 1.2500000000000001e-002 | AC70: -1.41e-002 | AD70: -1.7299999999999999e-002 | AE70: 96.32 | AF70: 98.13 | AG70: 0.26 | AH70: AA | AI70: 4.0099999999999997e-002 | AJ70: =H70+100*O70 -> 140.24000000000001 | AK70: 132.5 | AL70: 49 | AM70: 34.4 | AN70: 46 | AO70: 4.0000000000000001e-003 | AP70: 28 | AQ70: 海环转债!
A71: 174 | B71: 113036 | C71: 宁建转债! | D71: 601789 | E71: 宁波建工 | F71: 建筑 | G71: 建筑工程 | H71: 107.23 | I71: 4.8999999999999998e-003 | J71: -4.0000000000000001e-003 | K71: 3.87 | L71: 2.5999999999999999e-003 | M71: 116.9 | N71: 4.76 | O71: 0.31900000000000001 | P71: 81.3 | Q71: 转股中 | R71: 4.76年 | S71: 2.77年 | T71: 5.4 | U71: 1.1 | V71: 2.e-003 | W71: 0.14300000000000002 | X71: 0.11599999999999999 | Y71: 38 | Z71: 1.19 | AA71: 1.8600000000000002e-002 | AB71: 1.2199999999999999e-002 | AC71: -1.24e-002 | AD71: -1.46e-002 | AE71: 92.24 | AF71: 97.28 | AG71: 0.33 | AH71: AA | AI71: 4.0099999999999997e-002 | AJ71: =H71+100*O71 -> 139.13 | AK71: 133.2 | AL71: 55 | AM71: 35.9 | AN71: 56 | AO71: -2.4e-002 | AP71: 11 | AQ71: 宁建转债!
A72: 25 | B72: 113625 | C72: 江山转债! | D72: 603208 | E72: 江山欧派 | F72: 其他 | G72: 家居用品 | H72: 111.89 | I72: 7.1999999999999998e-003 | J72: 1.3600000000000001e-002 | K72: 63.41 | L72: 6.8199999999999997e-002 | M72: 124 | N72: 96.33 | O72: 0.69999999999999996 | P72: 65.83 | Q72: 2月19天 | R72: 5.69年 | S72: 3.70年 | T72: 5.83 | U72: 7.4 | V72: 1.1000000000000001e-002 | W72: 8.8000000000000009e-002 | X72: 5.7999999999999996e-002 | Y72: 67 | Z72: 3.6 | AA72: 1.8600000000000002e-002 | AB72: 1.1299999999999999e-002 | AC72: -1.9099999999999999e-002 | AD72: -2.1000000000000001e-002 | AE72: 82.42 | AF72: 88.4 | AG72: 0.3 | AH72: AA- | AI72: 6.25e-002 | AJ72: =H72+100*O72 -> 181.88999999999999 | AK72: 158 | AL72: 270 | AM72: 69.6 | AN72: 286 | AO72: -6.9000000000000006e-002 | AP72: 3 | AQ72: 江山转债!
A73: 247 | B73: 128087 | C73: 孚日转债! | D73: 2083 | E73: 孚日股份 | F73: 服装纺织 | G73: 家纺 | H73: 104.749 | I73: 5.5000000000000005e-003 | J73: 0. | K73: 4.08 | L73: 9.8999999999999991e-003 | M73: 112.9 | N73: 4.5 | O73: 0.155 | P73: 90.67 | Q73: 转股中 | R73: 4.21年 | S73: 2.22年 | T73: 6.5 | U73: 6.7 | V73: 1.e-002 | W73: 0.17499999999999999 | X73: 0.159 | Y73: 37 | Z73: 1 | AA73: 1.83e-002 | AB73: 1.26e-002 | AC73: -5.5000000000000005e-003 | AD73: -8.3000000000000001e-003 | AE73: 89.93 | AF73: 88.45 | AG73: 0.55 | AH73: AA- | AI73: 6.1100000000000002e-002 | AJ73: =H73+100*O73 -> 120.249 | AK73: 118.8 | AL73: 8 | AM73: 28.9 | AN73: 18 | AO73: -2.7999999999999997e-002 | AP73: 75 | AQ73: 孚日转债!
A74: 158 | B74: 128123 | C74: 国光转债! | D74: 2749 | E74: 国光股份 | F74: 化工 | G74: 农化 | H74: 106.35 | I74: 7.8000000000000005e-003 | J74: -7.4000000000000003e-003 | K74: 9.09 | L74: 1.1000000000000001e-003 | M74: 115.7 | N74: 13.49 | O74: 0.57799999999999996 | P74: 67.38 | Q74: 转股中 | R74: 4.82年 | S74: 2.82年 | T74: 3.2 | U74: 2 | V74: 6.0000000000000001e-003 | W74: 8.1000000000000003e-002 | X74: 5.4000000000000006e-002 | Y74: 40 | Z74: 3.14 | AA74: 1.8000000000000002e-002 | AB74: 1.2e-002 | AC74: -8.6999999999999994e-003 | AD74: -1.11e-002 | AE74: 86.93 | AF74: 87.47 | AG74: 0.3 | AH74: AA- | AI74: 6.1100000000000002e-002 | AJ74: =H74+100*O74 -> 164.14999999999998 | AK74: 145.3 | AL74: 170 | AM74: 57.8 | AN74: 213 | AO74: -5.7000000000000002e-002 | AP74: 12 | AQ74: 国光转债!
A75: 331 | B75: 123011 | C75: 德尔转债! | D75: 300473 | E75: 德尔股份 | F75: 汽车 | G75: 零部件制 | H75: 109.792 | I75: 5.4000000000000003e-003 | J75: 1.e-004 | K75: 20.99 | L75: 4.1200000000000001e-002 | M75: 115.3 | N75: 31.38 | O75: 0.6409999999999999 | P75: 66.89 | Q75: 转股中 | R75: 2.80年 | S75: 0.80年 | T75: 2.51 | U75: 2 | V75: 6.9999999999999993e-003 | W75: 8.900000000000001e-002 | X75: 5.9000000000000004e-002 | Y75: 28 | Z75: 1.31 | AA75: 1.7899999999999999e-002 | AB75: 8.0000000000000002e-003 | AC75: -7.5600000000000001e-002 | AD75: -7.9000000000000001e-002 | AE75: 96.33 | AF75: 98.44 | AG75: 0.13 | AH75: AA- | AI75: 5.91e-002 | AJ75: =H75+100*O75 -> 173.892 | AK75: 152.7 | AL75: 228 | AM75: 54.3 | AN75: 191 | AO75: -8.4000000000000005e-002 | AP75: 40 | AQ75: 德尔转债!
A76: 240 | B76: 113561 | C76: 正裕转债! | D76: 603089 | E76: 正裕工业 | F76: 汽车 | G76: 零部件制 | H76: 109.72 | I76: 1.1599999999999999e-002 | J76: -1.2999999999999999e-003 | K76: 7.98 | L76: 2.3099999999999999e-002 | M76: 118 | N76: 10.08 | O76: 0.38600000000000001 | P76: 79.17 | Q76: 转股中 | R76: 4.25年 | S76: 2.25年 | T76: 1.5 | U76: 2.5 | V76: 1.4999999999999999e-002 | W76: 8.4000000000000005e-002 | X76: 6.7000000000000004e-002 | Y76: 18 | Z76: 1.73 | AA76: 1.77e-002 | AB76: 1.01e-002 | AC76: -2.1499999999999998e-002 | AD76: -2.4799999999999999e-002 | AE76: 88.24 | AF76: 88.48 | AG76: 0.45 | AH76: A+ | AI76: 7.2099999999999997e-002 | AJ76: =H76+100*O76 -> 148.31999999999999 | AK76: 140.3 | AL76: 127 | AM76: 51.8 | AN76: 173 | AO76: -6.6000000000000003e-002 | AP76: 36 | AQ76: 正裕转债!
A77: 123 | B77: 123072 | C77: 乐歌转债! | D77: 300729 | E77: 乐歌股份 | F77: 其他 | G77: 家居用品 | H77: 119 | I77: 1.1999999999999999e-003 | J77: 0. | K77: 23.13 | L77: 2.53e-002 | M77: 129.6 | N77: 55.88 | O77: 1.8700000000000001 | P77: 41.39 | Q77: 转股中 | R77: 5年20天 | S77: 3年21天 | T77: 1.42 | U77: 49 | V77: 0.28699999999999998 | W77: 3.4000000000000002e-002 | X77: 1.3999999999999999e-002 | Y77: 42 | Z77: 3.97 | AA77: 1.7600000000000001e-002 | AB77: 7.9000000000000008e-003 | AC77: -3.3799999999999997e-002 | AD77: -3.7499999999999999e-002 | AE77: 85.23 | AF77: 91.67 | AG77: 0.05 | AH77: A+ | AI77: 7.3499999999999996e-002 | AJ77: =H77+100*O77 -> 306. | AK77: 196.6 | AL77: 334 | AM77: 104.9 | AN77: 332 | AO77: 5.0999999999999997e-002 | AP77: 9 | AQ77: 乐歌转债!
A78: 228 | B78: 113567 | C78: 君禾转债! | D78: 603617 | E78: 君禾股份 | F78: 机械装备 | G78: 通用设备 | H78: 110.34 | I78: 9.3999999999999986e-003 | J78: 8.199999999999999e-003 | K78: 9.96 | L78: 3.2099999999999997e-002 | M78: 118.8 | N78: 11.16 | O78: 0.23600000000000002 | P78: 89.25 | Q78: 转股中 | R78: 4.42年 | S78: 2.43年 | T78: 2.1 | U78: 1.7 | V78: 6.9999999999999993e-003 | W78: 0.106 | X78: 9.4e-002 | Y78: 20 | Z78: 2.93 | AA78: 1.72e-002 | AB78: 9.7000000000000003e-003 | AC78: -2.29e-002 | AD78: -2.58e-002 | AE78: 87 | AF78: 87.99 | AG78: 0.55 | AH78: A+ | AI78: 7.2099999999999997e-002 | AJ78: =H78+100*O78 -> 133.94 | AK78: 131.4 | AL78: 39 | AM78: 43.4 | AN78: 107 | AO78: -3.6000000000000004e-002 | AP78: 33 | AQ78: 君禾转债!
A79: 149 | B79: 127021 | C79: 特发转2! | D79: 70 | E79: 特发信息 | F79: 通信互联 | G79: 通信设备 | H79: 105.886 | I79: 2.8999999999999998e-003 | J79: -2.3999999999999998e-003 | K79: 7.02 | L79: 8.6e-003 | M79: 113 | N79: 12.33 | O79: 0.85999999999999999 | P79: 56.93 | Q79: 转股中 | R79: 3.85年 | S79: 1.85年 | T79: 5.5 | U79: 1.2 | V79: 2.e-003 | W79: 9.5000000000000001e-002 | X79: 5.4000000000000006e-002 | Y79: 58 | Z79: 1.98 | AA79: 1.72e-002 | AB79: 1.1000000000000001e-002 | AC79: -1.9599999999999999e-002 | AD79: -2.1299999999999999e-002 | AE79: 94.01 | AF79: 97.29 | AG79: 0.07 | AH79: AA | AI79: 4.0099999999999997e-002 | AJ79: =H79+100*O79 -> 191.886 | AK79: 154.8 | AL79: 243 | AM79: 57.5 | AN79: 210 | AO79: -5.5e-002 | AP79: 13 | AQ79: 特发转2!
A80: 357 | B80: 128022 | C80: 众信转债! | D80: 2707 | E80: 众信旅游 | F80: 旅游餐饮 | G80: 旅游 | H80: 104.99 | I80: 9.1999999999999998e-003 | J80: -9.1999999999999998e-003 | K80: 4.7 | L80: 1.0800000000000001e-002 | M80: 108.8 | N80: 7.92 | O80: 0.76900000000000002 | P80: 59.34 | Q80: 转股中 | R80: 2.17年 | S80: 0.17年 | T80: 4.56 | U80: 12 | V80: 2.6000000000000002e-002 | W80: 0.107 | X80: 6.3e-002 | Y80: 43 | Z80: 7.11 | AA80: 1.6899999999999998e-002 | AB80: 9.1000000000000004e-003 | AC80: -0.10800000000000001 | AD80: -0.11699999999999999 | AE80: 98.97 | AF80: 92.33 | AG80: 0 | AH80: A | AI80: 8.0100000000000005e-002 | AJ80: =H80+100*O80 -> 181.88999999999999 | AK80: 150.6 | AL80: 212 | AM80: 51.7 | AN80: 172 | AO80: -6.5000000000000002e-002 | AP80: 36 | AQ80: 众信转债!
A81: 235 | B81: 113563 | C81: 柳药转债! | D81: 603368 | E81: 柳药股份 | F81: 医药 | G81: 医药商业 | H81: 105.29 | I81: 8.3999999999999995e-003 | J81: -7.4999999999999997e-003 | K81: 16.31 | L81: 4.8999999999999998e-003 | M81: 112.9 | N81: 23.87 | O81: 0.54100000000000004 | P81: 68.33 | Q81: 转股中 | R81: 4.29年 | S81: 2.30年 | T81: 8.02 | U81: 4.9 | V81: 6.0000000000000001e-003 | W81: 0.13600000000000001 | X81: 9.3000000000000013e-002 | Y81: 59 | Z81: 1.17 | AA81: 1.67e-002 | AB81: 1.11e-002 | AC81: -7.4000000000000003e-003 | AD81: -1.01e-002 | AE81: 93.96 | AF81: 95.71 | AG81: 0.18 | AH81: AA | AI81: 4.0099999999999997e-002 | AJ81: =H81+100*O81 -> 159.39000000000001 | AK81: 142.3 | AL81: 152 | AM81: 46.5 | AN81: 138 | AO81: -2.2000000000000002e-002 | AP81: 16 | AQ81: 柳药转债!
A82: 263 | B82: 113546 | C82: 迪贝转债! | D82: 603320 | E82: 迪贝电气 | F82: 家电 | G82: 零部件制 | H82: 113.3 | I82: 1.1000000000000001e-003 | J82: -9.5999999999999992e-003 | K82: 12.67 | L82: -1.6299999999999999e-002 | M82: 120.6 | N82: 14 | O82: 0.252 | P82: 90.5 | Q82: 转股中 | R82: 4年22天 | S82: 2年23天 | T82: 2.3 | U82: 28 | V82: 0.107 | W82: 0.14000000000000001 | X82: 0.126 | Y82: 16 | Z82: 2.31 | AA82: 1.5900000000000001e-002 | AB82: 6.9999999999999993e-003 | AC82: -3.85e-002 | AD82: -4.1700000000000001e-002 | AE82: 89.2 | AF82: 91.58 | AG82: 0.52 | AH82: A+ | AI82: 7.2099999999999997e-002 | AJ82: =H82+100*O82 -> 138.5 | AK82: 136.1 | AL82: 88 | AM82: 44.5 | AN82: 117 | AO82: -7.2000000000000008e-002 | AP82: 38 | AQ82: 迪贝转债!
A83: 151 | B83: 113598 | C83: 法兰转债 | D83: 603966 | E83: 法兰泰克 | F83: 机械装备 | G83: 工程机械 | H83: 112.18 | I83: 1.06e-002 | J83: -5.4000000000000003e-003 | K83: 8.32 | L83: 1.09e-002 | M83: 120.8 | N83: 9.7 | O83: 0.308 | P83: 85.77 | Q83: 转股中 | R83: 4.83年 | S83: 2.83年 | T83: 2.75 | U83: 4.1 | V83: 1.3000000000000001e-002 | W83: 0.11 | X83: 9.5000000000000001e-002 | Y83: 25 | Z83: 1.52 | AA83: 1.5800000000000002e-002 | AB83: 8.199999999999999e-003 | AC83: -2.6000000000000002e-002 | AD83: -2.8300000000000002e-002 | AE83: 86.97 | AF83: 91.26 | AG83: 0.48 | AH83: AA- | AI83: 6.1100000000000002e-002 | AJ83: =H83+100*O83 -> 142.98000000000002 | AK83: 138.6 | AL83: 113 | AM83: 47.3 | AN83: 143 | AO83: -8.900000000000001e-002 | AP83: 13 | AQ83: 法兰转债
A84: 276 | B84: 128070 | C84: 智能转债! | D84: 2877 | E84: 智能自控 | F84: 机械装备 | G84: 通用设备 | H84: 110.291 | I84: 0. | J84: 3.5999999999999999e-003 | K84: 6.19 | L84: 1.4800000000000001e-002 | M84: 116.8 | N84: 9.47 | O84: 0.68700000000000006 | P84: 65.36 | Q84: 转股中 | R84: 3.75年 | S84: 无权 | T84: 2.3 | U84: 35 | V84: 0.13600000000000001 | W84: 0.11199999999999999 | X84: 7.2999999999999995e-002 | Y84: 21 | Z84: 2.78 | AA84: 1.5700000000000002e-002 | AB84: 7.7000000000000002e-003 | AC84: 无权 | AD84: 无权 | AE84: 无权 | AF84: 90.45 | AG84: 0.24 | AH84: A+ | AI84: 7.2099999999999997e-002 | AJ84: =H84+100*O84 -> 178.99099999999999 | AK84: 155.2 | AL84: 246 | AM84: 64.8 | AN84: 260 | AO84: -6.2e-002 | AP84: 30 | AQ84: 智能转债!
A85: 231 | B85: 113565 | C85: 宏辉转债 | D85: 603336 | E85: 宏辉果蔬 | F85: 农业 | G85: 农产品加 | H85: 110.16 | I85: 1.1000000000000001e-002 | J85: 4.4000000000000003e-003 | K85: 6.9 | L85: 2.9900000000000003e-002 | M85: 117.8 | N85: 7.64 | O85: 0.22 | P85: 90.31 | Q85: 转股中 | R85: 4.41年 | S85: 2.41年 | T85: 2.25 | U85: 15 | V85: 6.0999999999999999e-002 | W85: 7.400000000000001e-002 | X85: 6.7000000000000004e-002 | Y85: 30 | Z85: 2.94 | AA85: 1.5700000000000002e-002 | AB85: 8.3999999999999995e-003 | AC85: -2.3399999999999997e-002 | AD85: -2.6099999999999998e-002 | AE85: 89.2 | AF85: 91.28 | AG85: 0.52 | AH85: AA- | AI85: 6.1100000000000002e-002 | AJ85: =H85+100*O85 -> 132.16 | AK85: 130 | AL85: 33 | AM85: 38.7 | AN85: 70 | AO85: 3.9e-002 | AP85: 27 | AQ85: 宏辉转债
A86: 180 | B86: 127018 | C86: 本钢转债!! | D86: 761 | E86: 本钢板材 | F86: 钢铁 | G86: 炼钢 | H86: 119.22 | I86: 7.8000000000000005e-003 | J86: 4.6999999999999993e-003 | K86: 5.47 | L86: 2.2400000000000003e-002 | M86: 128 | N86: 5.02 | O86: 9.4e-002 | P86: 108.96 | Q86: 转股中 | R86: 4.74年 | S86: 2.75年 | T86: 56.4 | U86: 223 | V86: 3.3000000000000002e-002 | W86: 0.26500000000000001 | X86: 0.28899999999999998 | Y86: 213 | Z86: 0.96 | AA86: 1.55e-002 | AB86: 5.6999999999999993e-003 | AC86: -4.0500000000000001e-002 | AD86: -4.41e-002 | AE86: 93.75 | AF86: 105.4 | AG86: 0.55 | AH86: AAA | AI86: 4.3099999999999999e-002 | AJ86: =H86+100*O86 -> 128.62 | AK86: 129.5 | AL86: 30 | AM86: 24.1 | AN86: 7 | AO86: -0.161 | AP86: 66 | AQ86: 本钢转债!!
A87: 214 | B87: 113574 | C87: 华体转债! | D87: 603679 | E87: 华体科技 | F87: 城市公用 | G87: 城市公用 | H87: 108.46 | I87: 1.0500000000000001e-002 | J87: -9.4999999999999998e-003 | K87: 15.19 | L87: 3.3300000000000003e-002 | M87: 115.9 | N87: 33.91 | O87: 1.4199999999999999 | P87: 44.8 | Q87: 转股中 | R87: 4.50年 | S87: 2.50年 | T87: 2.09 | U87: 1.5 | V87: 6.9999999999999993e-003 | W87: 9.6999999999999989e-002 | X87: 4.2999999999999997e-002 | Y87: 22 | Z87: 2.82 | AA87: 1.52e-002 | AB87: 8.8000000000000005e-003 | AC87: -1.55e-002 | AD87: -1.84e-002 | AE87: 86.63 | AF87: 85.42 | AG87: 0.03 | AH87: A+ | AI87: 7.2099999999999997e-002 | AJ87: =H87+100*O87 -> 250.45999999999998 | AK87: 172.1 | AL87: 311 | AM87: 85.5 | AN87: 317 | AO87: -1.3000000000000001e-002 | AP87: 19 | AQ87: 华体转债!
A88: 90 | B88: 113044 | C88: 大秦转债! | D88: 601006 | E88: 大秦铁路 | F88: 铁路 | G88: 铁路运输 | H88: 105.65 | I88: 4.5999999999999999e-003 | J88: -3.9000000000000003e-003 | K88: 6.26 | L88: 1.6000000000000001e-003 | M88: 114.1 | N88: 7.18 | O88: 0.21199999999999999 | P88: 87.19 | Q88: 转股中 | R88: 5.20年 | S88: 3.21年 | T88: 320 | U88: 52 | V88: 2.e-003 | W88: 0.34399999999999997 | X88: 0.29999999999999999 | Y88: 931 | Z88: 0.79 | AA88: 1.52e-002 | AB88: 1.0200000000000001e-002 | AC88: -4.8999999999999998e-003 | AD88: -7.0999999999999995e-003 | AE88: 92.8 | AF88: 96 | AG88: 0.42 | AH88: AAA | AI88: 3.4500000000000003e-002 | AJ88: =H88+100*O88 -> 126.85000000000001 | AK88: 124.1 | AL88: 11 | AM88: 28.1 | AN88: 13 | AO88: -3.0000000000000001e-003 | AP88: 25 | AQ88: 大秦转债!
A89: 168 | B89: 128120 | C89: 联诚转债! | D89: 2921 | E89: 联诚精密 | F89: 汽车 | G89: 零部件制 | H89: 109.92 | I89: 2.8999999999999998e-003 | J89: -3.3e-003 | K89: 15.02 | L89: -7.000000000000001e-004 | M89: 117.9 | N89: 18.44 | O89: 0.34899999999999998 | P89: 81.45 | Q89: 转股中 | R89: 4.79年 | S89: 2.80年 | T89: 2.6 | U89: 2.1 | V89: 8.0000000000000002e-003 | W89: 0.16300000000000001 | X89: 0.13300000000000001 | Y89: 16 | Z89: 2.04 | AA89: 1.5100000000000001e-002 | AB89: 8.3999999999999995e-003 | AC89: -1.8500000000000003e-002 | AD89: -2.1000000000000001e-002 | AE89: 82.58 | AF89: 81.5 | AG89: 0.56 | AH89: A | AI89: 8.2100000000000006e-002 | AJ89: =H89+100*O89 -> 144.81999999999999 | AK89: 138.4 | AL89: 111 | AM89: 55.8 | AN89: 203 | AO89: -7.4999999999999997e-002 | AP89: 21 | AQ89: 联诚转债!
A90: 136 | B90: 128131 | C90: 崇达转2! | D90: 2815 | E90: 崇达技术 | F90: 电子 | G90: 元器件制 | H90: 106.887 | I90: 9.300000000000001e-003 | J90: -9.7000000000000003e-003 | K90: 12.07 | L90: -2.5000000000000001e-003 | M90: 114.9 | N90: 19.38 | O90: 0.71599999999999997 | P90: 62.28 | Q90: 转股中 | R90: 4.94年 | S90: 2.94年 | T90: 14 | U90: 3 | V90: 2.e-003 | W90: 0.13200000000000001 | X90: 8.199999999999999e-002 | Y90: 106 | Z90: 2.59 | AA90: 1.4999999999999999e-002 | AB90: 9.4999999999999998e-003 | AC90: -1.0700000000000001e-002 | AD90: -1.2800000000000001e-002 | AE90: 91.61 | AF90: 94.98 | AG90: 0.14 | AH90: AA | AI90: 4.0099999999999997e-002 | AJ90: =H90+100*O90 -> 178.48699999999999 | AK90: 151.5 | AL90: 220 | AM90: 56.5 | AN90: 206 | AO90: -3.1e-002 | AP90: 10 | AQ90: 崇达转2!
A91: 274 | B91: 113542 | C91: 好客转债! | D91: 603898 | E91: 好莱客 | F91: 其他 | G91: 家居用品 | H91: 108.11 | I91: -2.5999999999999999e-003 | J91: 5.5000000000000005e-003 | K91: 11.43 | L91: 1.6e-002 | M91: 114.3 | N91: 16.14 | O91: 0.52700000000000002 | P91: 70.82 | Q91: 转股中 | R91: 3.83年 | S91: 1.84年 | T91: 6.03 | U91: 3.6 | V91: 5.0000000000000001e-003 | W91: 0.16899999999999998 | X91: 0.12 | Y91: 36 | Z91: 1.35 | AA91: 1.49e-002 | AB91: 8.1000000000000013e-003 | AC91: -2.5000000000000001e-002 | AD91: -2.76e-002 | AE91: 95.07 | AF91: 98.58 | AG91: 0.18 | AH91: AA | AI91: 4.0099999999999997e-002 | AJ91: =H91+100*O91 -> 160.81 | AK91: 145.4 | AL91: 172 | AM91: 46.8 | AN91: 139 | AO91: -7.8e-002 | AP91: 16 | AQ91: 好客转债!
A92: 101 | B92: 123080 | C92: 海波转债! | D92: 300517 | E92: 海波重科 | F92: 建筑 | G92: 建筑工程 | H92: 117.454 | I92: 3.0000000000000001e-003 | J92: 1.1399999999999999e-002 | K92: 11.76 | L92: 2.2599999999999999e-002 | M92: 126.5 | N92: 11.58 | O92: 0.157 | P92: 101.55 | Q92: 转股中 | R92: 5.17年 | S92: 3.17年 | T92: 2.44 | U92: 4.4 | V92: 1.4999999999999999e-002 | W92: 0.10800000000000001 | X92: 0.109 | Y92: 23 | Z92: 2.65 | AA92: 1.4800000000000001e-002 | AB92: 6.1999999999999998e-003 | AC92: -3.44e-002 | AD92: -3.6900000000000002e-002 | AE92: 82.89 | AF92: 88.48 | AG92: 0.64 | AH92: A+ | AI92: 7.3499999999999996e-002 | AJ92: =H92+100*O92 -> 133.154 | AK92: 133.4 | AL92: 56 | AM92: 44.9 | AN92: 119 | AO92: -5.9000000000000004e-002 | AP92: 23 | AQ92: 海波转债!
A93: 103 | B93: 128139 | C93: 祥鑫转债! | D93: 2965 | E93: 祥鑫科技 | F93: 汽车 | G93: 零部件制 | H93: 112.51 | I93: 1.3600000000000001e-002 | J93: -7.4999999999999997e-003 | K93: 24.54 | L93: 2.1600000000000001e-002 | M93: 121 | N93: 36.96 | O93: 0.69499999999999995 | P93: 66.4 | Q93: 转股中 | R93: 5.17年 | S93: 3.17年 | T93: 6.47 | U93: 5.8 | V93: 8.0000000000000002e-003 | W93: 0.17499999999999999 | X93: 0.11599999999999999 | Y93: 37 | Z93: 2.13 | AA93: 1.4499999999999999e-002 | AB93: 7.4000000000000003e-003 | AC93: -2.3799999999999998e-002 | AD93: -2.5899999999999999e-002 | AE93: 85.09 | AF93: 89.07 | AG93: 0.28 | AH93: AA- | AI93: 6.25e-002 | AJ93: =H93+100*O93 -> 182.00999999999999 | AK93: 158.6 | AL93: 274 | AM93: 69.6 | AN93: 285 | AO93: 9.0000000000000011e-003 | AP93: 14 | AQ93: 祥鑫转债!
A94: 184 | B94: 128114 | C94: 正邦转债! | D94: 2157 | E94: 正邦科技 | F94: 农业 | G94: 畜牧业 | H94: 107.701 | I94: 6.6e-003 | J94: -9.7000000000000003e-003 | K94: 9.43 | L94: -2.2799999999999997e-002 | M94: 114.9 | N94: 14.76 | O94: 0.68599999999999994 | P94: 63.89 | Q94: 转股中 | R94: 4.71年 | S94: 2.71年 | T94: 16 | U94: 28 | V94: 1.6e-002 | W94: 5.4000000000000006e-002 | X94: 3.4000000000000002e-002 | Y94: 297 | Z94: 1.54 | AA94: 1.41e-002 | AB94: 8.3000000000000001e-003 | AC94: -1.4199999999999999e-002 | AD94: -1.6399999999999998e-002 | AE94: 93.71 | AF94: 97.97 | AG94: 0.14 | AH94: AA+ | AI94: 3.5099999999999999e-002 | AJ94: =H94+100*O94 -> 176.30099999999999 | AK94: 151.5 | AL94: 221 | AM94: 53.5 | AN94: 185 | AO94: 5.9000000000000004e-002 | AP94: 18 | AQ94: 正邦转债!
A95: 105 | B95: 113609 | C95: 永安转债! | D95: 603776 | E95: 永安行 | F95: 城市公用 | G95: 其他 | H95: 112.47 | I95: 6.8999999999999999e-003 | J95: 3.0000000000000001e-003 | K95: 15.84 | L95: 1.67e-002 | M95: 120.5 | N95: 16.48 | O95: 0.17000000000000001 | P95: 96.12 | Q95: 转股中 | R95: 5年54天 | S95: 3年55天 | T95: 7.34 | U95: 8.9 | V95: 1.1000000000000001e-002 | W95: 0.19899999999999998 | X95: 0.191 | Y95: 37 | Z95: 1.15 | AA95: 1.38e-002 | AB95: 6.8000000000000005e-003 | AC95: -2.4e-002 | AD95: -2.6200000000000001e-002 | AE95: 85.12 | AF95: 88.78 | AG95: 0.6 | AH95: AA- | AI95: 6.25e-002 | AJ95: =H95+100*O95 -> 129.47 | AK95: 128.8 | AL95: 27 | AM95: 40 | AN95: 81 | AO95: -9.4e-002 | AP95: 26 | AQ95: 永安转债!
A96: 334 | B96: 123010 | C96: 博世转债! | D96: 300422 | E96: 博世科 | F96: 城市公用 | G96: 三废处理 | H96: 107.31 | I96: 4.7999999999999996e-003 | J96: -3.0999999999999999e-003 | K96: 9.28 | L96: 6.5000000000000006e-003 | M96: 111.3 | N96: 12.15 | O96: 0.40500000000000003 | P96: 76.38 | Q96: 转股中 | R96: 2.76年 | S96: 0.76年 | T96: 4.3 | U96: 4.2 | V96: 9.0000000000000011e-003 | W96: 0.114 | X96: 8.6999999999999994e-002 | Y96: 38 | Z96: 1.54 | AA96: 1.3500000000000002e-002 | AB96: 5.8999999999999999e-003 | AC96: -5.5300000000000002e-002 | AD96: -5.8899999999999994e-002 | AE96: 96.53 | AF96: 95.23 | AG96: 0.26 | AH96: AA- | AI96: 5.91e-002 | AJ96: =H96+100*O96 -> 147.81 | AK96: 138.2 | AL96: 109 | AM96: 41.7 | AN96: 98 | AO96: -2.8999999999999998e-002 | AP96: 30 | AQ96: 博世转债!
A97: 115 | B97: 110076 | C97: 华海转债! | D97: 600521 | E97: 华海药业 | F97: 医药 | G97: 医药行业 | H97: 107.76 | I97: 4.3e-003 | J97: -3.4000000000000002e-003 | K97: 17.67 | L97: 1.2e-002 | M97: 115.1 | N97: 33.85 | O97: 1.0600000000000001 | P97: 52.2 | Q97: 转股中 | R97: 5年32天 | S97: 3年33天 | T97: 18.4 | U97: 9.9 | V97: 5.0000000000000001e-003 | W97: 7.0000000000000007e-002 | X97: 3.6000000000000004e-002 | Y97: 264 | Z97: 4.05 | AA97: 1.3300000000000001e-002 | AB97: 7.9000000000000008e-003 | AC97: -1.21e-002 | AD97: -1.4199999999999999e-002 | AE97: 90.87 | AF97: 93.98 | AG97: 0.08 | AH97: AA | AI97: 4.1500000000000002e-002 | AJ97: =H97+100*O97 -> 213.75999999999999 | AK97: 163.3 | AL97: 291 | AM97: 69.3 | AN97: 283 | AO97: 2.1000000000000001e-002 | AP97: 8 | AQ97: 华海转债!
A98: 53 | B98: 123106 | C98: 正丹转债! | D98: 300641 | E98: 正丹股份 | F98: 化工 | G98: 化工 | H98: 116.869 | I98: 2.5899999999999999e-002 | J98: 3.4999999999999996e-003 | K98: 7.26 | L98: 5.0700000000000002e-002 | M98: 125.5 | N98: 7.5 | O98: 0.20699999999999999 | P98: 96.8 | Q98: 转股中 | R98: 5.48年 | S98: 3.48年 | T98: 3.2 | U98: 14 | V98: 3.7000000000000005e-002 | W98: 8.9999999999999997e-002 | X98: 8.6999999999999994e-002 | Y98: 36 | Z98: 2.52 | AA98: 1.3300000000000001e-002 | AB98: 5.5000000000000005e-003 | AC98: -3.2199999999999999e-002 | AD98: -3.4099999999999998e-002 | AE98: 83.44 | AF98: 90.62 | AG98: 0.58 | AH98: AA- | AI98: 6.25e-002 | AJ98: =H98+100*O98 -> 137.56899999999999 | AK98: 136.9 | AL98: 96 | AM98: 46.3 | AN98: 136 | AO98: -9.4e-002 | AP98: 15 | AQ98: 正丹转债!
A99: 272 | B99: 128072 | C99: 翔鹭转债! | D99: 2842 | E99: 翔鹭钨业 | F99: 有色金属 | G99: 小金属 | H99: 108.99 | I99: 5.4000000000000003e-003 | J99: 2.7000000000000001e-003 | K99: 9.42 | L99: 4.5499999999999999e-002 | M99: 114.5 | N99: 15.36 | O99: 0.77700000000000002 | P99: 61.33 | Q99: 转股中 | R99: 3.89年 | S99: 1.89年 | T99: 3.02 | U99: 2 | V99: 6.0000000000000001e-003 | W99: 0.11699999999999999 | X99: 7.2000000000000008e-002 | Y99: 26 | Z99: 2.73 | AA99: 1.3000000000000001e-002 | AB99: 6.1999999999999998e-003 | AC99: -2.81e-002 | AD99: -3.0699999999999998e-002 | AE99: 91.11 | AF99: 91.32 | AG99: 0.18 | AH99: AA- | AI99: 6.1100000000000002e-002 | AJ99: =H99+100*O99 -> 186.69 | AK99: 156.7 | AL99: 260 | AM99: 65.3 | AN99: 263 | AO99: -0.16500000000000001 | AP99: 29 | AQ99: 翔鹭转债!
A100: 102 | B100: 113610 | C100: 灵康转债 | D100: 603669 | E100: 灵康药业 | F100: 医药 | G100: 化学制药 | H100: 113.45 | I100: 3.4999999999999996e-003 | J100: 3.7000000000000002e-003 | K100: 8.49 | L100: 1.1899999999999999e-002 | M100: 121.1 | N100: 8.61 | O100: 0.151 | P100: 98.61 | Q100: 转股中 | R100: 5.17年 | S100: 3.17年 | T100: 4.58 | U100: 13 | V100: 2.5000000000000001e-002 | W100: 7.5999999999999998e-002 | X100: 7.4999999999999997e-002 | Y100: 61 | Z100: 4.67 | AA100: 1.3000000000000001e-002 | AB100: 5.8999999999999999e-003 | AC100: -2.5899999999999999e-002 | AD100: -2.8199999999999999e-002 | AE100: 85.18 | AF100: 89.16 | AG100: 0.61 | AH100: AA- | AI100: 6.25e-002 | AJ100: =H100+100*O100 -> 128.55000000000001 | AK100: 128.3 | AL100: 26 | AM100: 39.1 | AN100: 72 | AO100: -2.3e-002 | AP100: 28 | AQ100: 灵康转债
A101: 74 | B101: 113619 | C101: 世运转债! | D101: 603920 | E101: 世运电路 | F101: 电子 | G101: 元器件制 | H101: 107.76 | I101: 1.5100000000000001e-002 | J101: -1.23e-002 | K101: 12.76 | L101: 1.43e-002 | M101: 115.2 | N101: 19.92 | O101: 0.68200000000000005 | P101: 64.06 | Q101: 转股中 | R101: 5.31年 | S101: 3.31年 | T101: 10 | U101: 7.7 | V101: 6.9999999999999993e-003 | W101: 0.14699999999999999 | X101: 9.4e-002 | Y101: 68 | Z101: 2.68 | AA101: 1.29e-002 | AB101: 7.7000000000000002e-003 | AC101: -1.11e-002 | AD101: -1.3100000000000001e-002 | AE101: 90.17 | AF101: 93.25 | AG101: 0.2 | AH101: AA | AI101: 4.1500000000000002e-002 | AJ101: =H101+100*O101 -> 175.96000000000001 | AK101: 151.5 | AL101: 218 | AM101: 58.2 | AN101: 218 | AO101: -0.10000000000000001 | AP101: 6 | AQ101: 世运转债!
A102: 39 | B102: 127033 | C102: 中装转2! | D102: 2822 | E102: 中装建设 | F102: 建筑 | G102: 装饰工程 | H102: 109.25 | I102: 6.8999999999999999e-003 | J102: -2.0999999999999999e-003 | K102: 5.25 | L102: 1.1599999999999999e-002 | M102: 117.1 | N102: 6.28 | O102: 0.307 | P102: 83.6 | Q102: 22天 | R102: 5.54年 | S102: 3.54年 | T102: 11.6 | U102: 5.5 | V102: 4.0000000000000001e-003 | W102: 0.307 | X102: 0.25600000000000001 | Y102: 38 | Z102: 1.11 | AA102: 1.2800000000000001e-002 | AB102: 7.3000000000000001e-003 | AC102: -1.43e-002 | AD102: -1.6200000000000003e-002 | AE102: 89.22 | AF102: 93.86 | AG102: 0.42 | AH102: AA | AI102: 4.1500000000000002e-002 | AJ102: =H102+100*O102 -> 139.94999999999999 | AK102: 134.9 | AL102: 72 | AM102: 41 | AN102: 86 | AO102: -4.8000000000000001e-002 | AP102: 26 | AQ102: 中装转2!
A103: 155 | B103: 128124 | C103: 科华转债! | D103: 2022 | E103: 科华生物 | F103: 医药 | G103: 生物制药 | H103: 103.6 | I103: 2.5999999999999999e-003 | J103: -1.1000000000000001e-003 | K103: 13.18 | L103: 9.1999999999999998e-003 | M103: 110 | N103: 21.3 | O103: 0.67400000000000004 | P103: 61.88 | Q103: 转股中 | R103: 4.82年 | S103: 2.83年 | T103: 7.38 | U103: 3.6 | V103: 5.0000000000000001e-003 | W103: 0.109 | X103: 6.7000000000000004e-002 | Y103: 68 | Z103: 2.01 | AA103: 1.2699999999999999e-002 | AB103: 8.8000000000000005e-003 | AC103: -2.8000000000000004e-003 | AD103: -4.5000000000000005e-003 | AE103: 91.42 | AF103: 91.28 | AG103: 0.16 | AH103: AA | AI103: 4.0099999999999997e-002 | AJ103: =H103+100*O103 -> 171. | AK103: 145.3 | AL103: 171 | AM103: 53.9 | AN103: 189 | AO103: -3.4000000000000002e-002 | AP103: 22 | AQ103: 科华转债!
A104: 118 | B104: 113606 | C104: 荣泰转债 | D104: 603579 | E104: 荣泰健康 | F104: 机械装备 | G104: 专用设备 | H104: 114.51 | I104: -6.8999999999999999e-003 | J104: 1.21e-002 | K104: 28.84 | L104: 1.0200000000000001e-002 | M104: 121.2 | N104: 32.83 | O104: 0.30399999999999999 | P104: 87.85 | Q104: 转股中 | R104: 5年29天 | S104: 3年30天 | T104: 6 | U104: 4.2 | V104: 6.0000000000000001e-003 | W104: 0.14899999999999999 | X104: 0.13100000000000001 | Y104: 40 | Z104: 2.41 | AA104: 1.15e-002 | AB104: 4.3e-003 | AC104: -2.92e-002 | AD104: -3.15e-002 | AE104: 85.74 | AF104: 89.74 | AG104: 0.52 | AH104: AA- | AI104: 6.25e-002 | AJ104: =H104+100*O104 -> 144.91 | AK104: 141.2 | AL104: 135 | AM104: 51.4 | AN104: 171 | AO104: -1.7000000000000001e-002 | AP104: 10 | AQ104: 荣泰转债
A105: 40 | B105: 110080 | C105: 东湖转债 | D105: 600133 | E105: 东湖高新 | F105: 建筑 | G105: 建筑工程 | H105: 108.22 | I105: 3.4000000000000002e-003 | J105: -1.1699999999999999e-002 | K105: 5.68 | L105: -1.5600000000000001e-002 | M105: 115.1 | N105: 6.05 | O105: 0.153 | P105: 93.88 | Q105: 16天 | R105: 5.53年 | S105: 3.53年 | T105: 15.5 | U105: 19 | V105: 1.1000000000000001e-002 | W105: 0.34299999999999997 | X105: 0.32200000000000001 | Y105: 45 | Z105: 0.82 | AA105: 1.1399999999999999e-002 | AB105: 6.5000000000000006e-003 | AC105: -1.18e-002 | AD105: -1.37e-002 | AE105: 89.26 | AF105: 92.31 | AG105: 0.53 | AH105: AA | AI105: 4.1500000000000002e-002 | AJ105: =H105+100*O105 -> 123.52 | AK105: 122.6 | AL105: 10 | AM105: 30.3 | AN105: 23 | AO105: -3.4000000000000002e-002 | AP105: 28 | AQ105: 东湖转债
A106: 273 | B106: 128071 | C106: 合兴转债! | D106: 2228 | E106: 合兴包装 | F106: 造纸包装 | G106: 包装材料 | H106: 109.598 | I106: 2.5999999999999999e-003 | J106: 1.5e-003 | K106: 3.58 | L106: 1.1299999999999999e-002 | M106: 114.3 | N106: 4.18 | O106: 0.28000000000000003 | P106: 85.65 | Q106: 转股中 | R106: 3.88年 | S106: 1.88年 | T106: 3 | U106: 1.5 | V106: 5.0000000000000001e-003 | W106: 6.8000000000000005e-002 | X106: 5.7999999999999996e-002 | Y106: 44 | Z106: 1.27 | AA106: 1.11e-002 | AB106: 4.4000000000000003e-003 | AC106: -3.1099999999999999e-002 | AD106: -3.3599999999999998e-002 | AE106: 94.92 | AF106: 98.42 | AG106: 0.36 | AH106: AA | AI106: 4.0099999999999997e-002 | AJ106: =H106+100*O106 -> 137.59800000000001 | AK106: 133.6 | AL106: 57 | AM106: 35.1 | AN106: 49 | AO106: -2.1000000000000001e-002 | AP106: 24 | AQ106: 合兴转债!
A107: 216 | B107: 110068 | C107: 龙净转债! | D107: 600388 | E107: 龙净环保 | F107: 城市公用 | G107: 三废处理 | H107: 109.49 | I107: 2.3999999999999998e-003 | J107: -7.0999999999999995e-003 | K107: 8.6 | L107: -1.49e-002 | M107: 114.8 | N107: 10.55 | O107: 0.34299999999999997 | P107: 81.52 | Q107: 转股中 | R107: 4.48年 | S107: 2.48年 | T107: 20 | U107: 7.6 | V107: 3.0000000000000001e-003 | W107: 0.218 | X107: 0.17699999999999999 | Y107: 92 | Z107: 1.5 | AA107: 1.0800000000000001e-002 | AB107: 4.7999999999999996e-003 | AC107: -2.1899999999999999e-002 | AD107: -2.4300000000000002e-002 | AE107: 94.36 | AF107: 98.67 | AG107: 0.32 | AH107: AA+ | AI107: 3.5099999999999999e-002 | AJ107: =H107+100*O107 -> 143.78999999999999 | AK107: 137.5 | AL107: 103 | AM107: 38.8 | AN107: 71 | AO107: -7.2999999999999995e-002 | AP107: 35 | AQ107: 龙净转债!
A108: 99 | B108: 123082 | C108: 北陆转债! | D108: 300016 | E108: 北陆药业 | F108: 医药 | G108: 化学制药 | H108: 115.38 | I108: 1.03e-002 | J108: -2.8000000000000004e-003 | K108: 8.86 | L108: 1.1399999999999999e-002 | M108: 121.7 | N108: 8.81 | O108: 0.14699999999999999 | P108: 100.57 | Q108: 转股中 | R108: 5.19年 | S108: 3.19年 | T108: 4.99 | U108: 6.6 | V108: 1.2e-002 | W108: 0.114 | X108: 0.115 | Y108: 44 | Z108: 2.57 | AA108: 1.06e-002 | AB108: 3.4000000000000002e-003 | AC108: -2.9100000000000001e-002 | AD108: -3.1600000000000003e-002 | AE108: 82.75 | AF108: 85.06 | AG108: 0.66 | AH108: A+ | AI108: 7.3499999999999996e-002 | AJ108: =H108+100*O108 -> 130.07999999999998 | AK108: 130.2 | AL108: 36 | AM108: 45.1 | AN108: 125 | AO108: -4.4000000000000004e-002 | AP108: 16 | AQ108: 北陆转债!
A109: 183 | B109: 113588 | C109: 润达转债! | D109: 603108 | E109: 润达医疗 | F109: 医药 | G109: 医疗器械 | H109: 108.58 | I109: 8.3000000000000001e-003 | J109: -2.3e-003 | K109: 10.23 | L109: 1.89e-002 | M109: 113.9 | N109: 13.25 | O109: 0.40600000000000003 | P109: 77.21 | Q109: 转股中 | R109: 4.71年 | S109: 2.71年 | T109: 5.5 | U109: 3.6 | V109: 6.0000000000000001e-003 | W109: 9.3000000000000013e-002 | X109: 7.2000000000000008e-002 | Y109: 59 | Z109: 1.83 | AA109: 1.04e-002 | AB109: 5.0000000000000001e-003 | AC109: -1.7000000000000001e-002 | AD109: -1.9199999999999998e-002 | AE109: 92.43 | AF109: 94.99 | AG109: 0.31 | AH109: AA | AI109: 4.0099999999999997e-002 | AJ109: =H109+100*O109 -> 149.18000000000001 | AK109: 140 | AL109: 124 | AM109: 45 | AN109: 121 | AO109: -1.7000000000000001e-002 | AP109: 11 | AQ109: 润达转债!
A110: 266 | B110: 128076 | C110: 金轮转债! | D110: 2722 | E110: 金轮股份 | F110: 机械装备 | G110: 专用设备 | H110: 110.35 | I110: 6.1999999999999998e-003 | J110: 3.5999999999999999e-003 | K110: 12.62 | L110: 2.1000000000000001e-002 | M110: 114.9 | N110: 14.66 | O110: 0.28199999999999997 | P110: 86.08 | Q110: 转股中 | R110: 4年13天 | S110: 2年14天 | T110: 2.14 | U110: 2.3 | V110: 1.e-002 | W110: 9.6999999999999989e-002 | X110: 8.3000000000000004e-002 | Y110: 22 | Z110: 1.16 | AA110: 1.03e-002 | AB110: 3.5999999999999999e-003 | AC110: -2.9399999999999999e-002 | AD110: -3.2300000000000002e-002 | AE110: 90.87 | AF110: 90.94 | AG110: 0.47 | AH110: AA- | AI110: 6.1100000000000002e-002 | AJ110: =H110+100*O110 -> 138.54999999999998 | AK110: 134.6 | AL110: 69 | AM110: 43.7 | AN110: 108 | AO110: -8.1000000000000003e-002 | AP110: 38 | AQ110: 金轮转债!
A111: 154 | B111: 123063 | C111: 大禹转债 | D111: 300021 | E111: 大禹节水 | F111: 化工 | G111: 橡胶塑料 | H111: 120.2 | I111: 6.1999999999999998e-003 | J111: 5.8999999999999999e-003 | K111: 5.14 | L111: 1.9799999999999998e-002 | M111: 126.1 | N111: 4.83 | O111: 0.13 | P111: 106.42 | Q111: 转股中 | R111: 4.82年 | S111: 3.83年 | T111: 6.35 | U111: 9.9 | V111: 1.3000000000000001e-002 | W111: 0.154 | X111: 0.16399999999999998 | Y111: 41 | Z111: 2.82 | AA111: 1.0200000000000001e-002 | AB111: 1.1999999999999999e-003 | AC111: -3.0099999999999998e-002 | AD111: -3.3000000000000002e-002 | AE111: 84.47 | AF111: 95.3 | AG111: 0.61 | AH111: AA- | AI111: 6.1100000000000002e-002 | AJ111: =H111+100*O111 -> 133.19999999999999 | AK111: 134 | AL111: 63 | AM111: 38.7 | AN111: 69 | AO111: -3.7000000000000005e-002 | AP111: 19 | AQ111: 大禹转债
A112: 178 | B112: 113591 | C112: 胜达转债! | D112: 603687 | E112: 大胜达 | F112: 造纸包装 | G112: 包装用纸 | H112: 116.42 | I112: 1.9799999999999998e-002 | J112: -1.e-003 | K112: 9.27 | L112: 2.9999999999999999e-002 | M112: 121.7 | N112: 8.76 | O112: 0.10000000000000001 | P112: 105.82 | Q112: 转股中 | R112: 4.75年 | S112: 2.75年 | T112: 5.5 | U112: 44 | V112: 7.0000000000000007e-002 | W112: 0.14400000000000002 | X112: 0.153 | Y112: 38 | Z112: 2.21 | AA112: 9.5999999999999992e-003 | AB112: 1.7000000000000001e-003 | AC112: -3.95e-002 | AD112: -4.1700000000000001e-002 | AE112: 87.3 | AF112: 92.36 | AG112: 0.63 | AH112: AA- | AI112: 6.1100000000000002e-002 | AJ112: =H112+100*O112 -> 126.42 | AK112: 127 | AL112: 21 | AM112: 34.7 | AN112: 47 | AO112: 3.2000000000000001e-002 | AP112: 32 | AQ112: 胜达转债!
A113: 110 | B113: 113608 | C113: 威派转债! | D113: 603956 | E113: 威派格 | F113: 机械装备 | G113: 专用设备 | H113: 115.97 | I113: 4.6999999999999993e-003 | J113: -1.e-003 | K113: 16.1 | L113: 6.8999999999999999e-003 | M113: 121.6 | N113: 19.08 | O113: 0.374 | P113: 84.38 | Q113: 转股中 | R113: 5年39天 | S113: 3年40天 | T113: 4.2 | U113: 5 | V113: 1.e-002 | W113: 6.0999999999999999e-002 | X113: 5.2000000000000005e-002 | Y113: 69 | Z113: 6.17 | AA113: 9.5999999999999992e-003 | AB113: 2.2000000000000001e-003 | AC113: -3.1400000000000004e-002 | AD113: -3.39e-002 | AE113: 83.19 | AF113: 85.45 | AG113: 0.54 | AH113: A+ | AI113: 7.3499999999999996e-002 | AJ113: =H113+100*O113 -> 153.37 | AK113: 147.6 | AL113: 189 | AM113: 62.1 | AN113: 235 | AO113: -7.400000000000001e-002 | AP113: 7 | AQ113: 威派转债!
A114: 78 | B114: 127028 | C114: 英特转债! | D114: 411 | E114: 英特集团 | F114: 医药 | G114: 医药商业 | H114: 107.75 | I114: 2.3e-003 | J114: 1.9e-003 | K114: 11.82 | L114: 9.3999999999999986e-003 | M114: 113.1 | N114: 13.4 | O114: 0.222 | P114: 88.21 | Q114: 转股中 | R114: 5.26年 | S114: 3.27年 | T114: 6 | U114: 7.8 | V114: 1.2e-002 | W114: 0.20399999999999999 | X114: 0.17999999999999999 | Y114: 29 | Z114: 1.69 | AA114: 9.3999999999999986e-003 | AB114: 4.7999999999999996e-003 | AC114: -1.15e-002 | AD114: -1.3500000000000002e-002 | AE114: 91.71 | AF114: 94 | AG114: 0.45 | AH114: AA+ | AI114: 3.6499999999999998e-002 | AJ114: =H114+100*O114 -> 129.94999999999999 | AK114: 127.3 | AL114: 22 | AM114: 33.3 | AN114: 37 | AO114: -2.7000000000000003e-002 | AP114: 27 | AQ114: 英特转债!
A115: 84 | B115: 123090 | C115: 三诺转债! | D115: 300298 | E115: 三诺生物 | F115: 医药 | G115: 医疗器械 | H115: 111.749 | I115: 1.04e-002 | J115: -7.4000000000000003e-003 | K115: 23.53 | L115: 1.38e-002 | M115: 117.1 | N115: 35.18 | O115: 0.67099999999999993 | P115: 66.88 | Q115: 转股中 | R115: 5.22年 | S115: 3.23年 | T115: 5 | U115: 5.6 | V115: 1.e-002 | W115: 3.7999999999999999e-002 | X115: 2.5000000000000001e-002 | Y115: 133 | Z115: 4.93 | AA115: 9.1999999999999998e-003 | AB115: 3.3e-003 | AC115: -2.23e-002 | AD115: -2.4199999999999999e-002 | AE115: 90.38 | AF115: 95.08 | AG115: 0.22 | AH115: AA | AI115: 4.1500000000000002e-002 | AJ115: =H115+100*O115 -> 178.84899999999999 | AK115: 156.6 | AL115: 257 | AM115: 61.5 | AN115: 233 | AO115: -6.7000000000000004e-002 | AP115: 4 | AQ115: 三诺转债!
A116: 41 | B116: 127032 | C116: 苏行转债 | D116: 2966 | E116: 苏州银行 | F116: 金融 | G116: 银行行业 | H116: 109.65 | I116: -5.0000000000000001e-004 | J116: -1.e-004 | K116: 6.81 | L116: -1.5e-003 | M116: 115.1 | N116: 8.1 | O116: 0.30399999999999999 | P116: 84.07 | Q116: 18天 | R116: 5.53年 | S116: 无权 | T116: 50 | U116: 11 | V116: 2.e-003 | W116: 0.22 | X116: 0.185 | Y116: 227 | Z116: 0.74 | AA116: 9.0000000000000011e-003 | AB116: 4.0000000000000001e-003 | AC116: 无权 | AD116: 无权 | AE116: 无权 | AF116: 95.72 | AG116: 0.39 | AH116: AAA | AI116: 3.4500000000000003e-002 | AJ116: =H116+100*O116 -> 140.05000000000001 | AK116: 135.2 | AL116: 76 | AM116: 39.5 | AN116: 75 | AO116: -1.6e-002 | AP116: 9 | AQ116: 苏行转债
A117: 59 | B117: 123104 | C117: 卫宁转债! | D117: 300253 | E117: 卫宁健康 | F117: 计算机及 | G117: 软件开发 | H117: 119.575 | I117: -4.4000000000000003e-003 | J117: 7.3000000000000001e-003 | K117: 14.53 | L117: 9.0000000000000011e-003 | M117: 125.1 | N117: 17.74 | O117: 0.46000000000000002 | P117: 81.91 | Q117: 转股中 | R117: 5.46年 | S117: 3.46年 | T117: 9.7 | U117: 6.3 | V117: 5.0000000000000001e-003 | W117: 3.1e-002 | X117: 2.6000000000000002e-002 | Y117: 311 | Z117: 6.78 | AA117: 8.5000000000000006e-003 | AB117: 8.0000000000000004e-004 | AC117: -3.9100000000000003e-002 | AD117: -4.0899999999999999e-002 | AE117: 89.53 | AF117: 100.59 | AG117: 0.32 | AH117: AA | AI117: 4.1500000000000002e-002 | AJ117: =H117+100*O117 -> 165.57499999999999 | AK117: 157.2 | AL117: 266 | AM117: 56.7 | AN117: 207 | AO117: 1.3999999999999999e-002 | AP117: 4 | AQ117: 卫宁转债!
A118: 18 | B118: 123118 | C118: 惠城转债 | D118: 300779 | E118: 惠城环保 | F118: 化工 | G118: 其他 | H118: 116.191 | I118: 1.6000000000000001e-003 | J118: 2.8000000000000004e-003 | K118: 17.11 | L118: 6.5000000000000006e-003 | M118: 121.7 | N118: 17.11 | O118: 0.16200000000000001 | P118: 100 | Q118: 3月15天 | R118: 5.77年 | S118: 3.77年 | T118: 3.2 | U118: 14 | V118: 3.7000000000000005e-002 | W118: 0.187 | X118: 0.187 | Y118: 17 | Z118: 2.59 | AA118: 8.199999999999999e-003 | AB118: 1.8e-003 | AC118: -2.6600000000000002e-002 | AD118: -2.87e-002 | AE118: 79.41 | AF118: 81.63 | AG118: 0.68 | AH118: A+ | AI118: 7.3499999999999996e-002 | AJ118: =H118+100*O118 -> 132.39099999999999 | AK118: 132.4 | AL118: 46 | AM118: 50.8 | AN118: 164 | AO118: -8.3000000000000004e-002 | AP118: 6 | AQ118: 惠城转债
A119: 340 | B119: 128037 | C119: 岩土转债! | D119: 2542 | E119: 中化岩土 | F119: 建筑 | G119: 建筑工程 | H119: 109.164 | I119: 2.3999999999999998e-003 | J119: -1.1000000000000001e-003 | K119: 2.86 | L119: 3.4999999999999996e-003 | M119: 111.3 | N119: 3.1 | O119: 0.183 | P119: 92.26 | Q119: 转股中 | R119: 2.45年 | S119: 0.46年 | T119: 5.99 | U119: 8.3 | V119: 1.3000000000000001e-002 | W119: 0.11599999999999999 | X119: 0.107 | Y119: 52 | Z119: 1.3 | AA119: 8.1000000000000013e-003 | AB119: -5.0000000000000001e-004 | AC119: -0.115 | AD119: -0.12 | AE119: 99.47 | AF119: 101.71 | AG119: 0.37 | AH119: AA | AI119: 3.8100000000000002e-002 | AJ119: =H119+100*O119 -> 127.464 | AK119: 126.1 | AL119: 16 | AM119: 24.4 | AN119: 8 | AO119: -5.2000000000000005e-002 | AP119: 53 | AQ119: 岩土转债!
A120: 220 | B120: 123045 | C120: 雷迪转债 | D120: 300652 | E120: 雷迪克 | F120: 汽车 | G120: 零部件制 | H120: 114.9 | I120: 7.9000000000000008e-003 | J120: 5.6999999999999993e-003 | K120: 18.02 | L120: 2.3900000000000001e-002 | M120: 118.9 | N120: 19.63 | O120: 0.252 | P120: 91.8 | Q120: 转股中 | R120: 4.45年 | S120: 2.45年 | T120: 1.66 | U120: 9.1 | V120: 4.8000000000000001e-002 | W120: 9.8000000000000004e-002 | X120: 8.9999999999999997e-002 | Y120: 17 | Z120: 1.84 | AA120: 7.9000000000000008e-003 | AB120: 4.0000000000000002e-004 | AC120: -3.7599999999999995e-002 | AD120: -4.0399999999999998e-002 | AE120: 86.94 | AF120: 87.93 | AG120: 0.57 | AH120: A+ | AI120: 7.2099999999999997e-002 | AJ120: =H120+100*O120 -> 140.09999999999999 | AK120: 138 | AL120: 106 | AM120: 50.1 | AN120: 161 | AO120: -7.2000000000000008e-002 | AP120: 35 | AQ120: 雷迪转债
A121: 56 | B121: 113046 | C121: 金田转债 | D121: 601609 | E121: 金田铜业 | F121: 有色金属 | G121: 铜金属 | H121: 110.22 | I121: 1.6399999999999998e-002 | J121: -1.21e-002 | K121: 8.59 | L121: 1.18e-002 | M121: 114.9 | N121: 10.75 | O121: 0.379 | P121: 79.91 | Q121: 转股中 | R121: 5.47年 | S121: 3.48年 | T121: 15 | U121: 28 | V121: 1.7000000000000001e-002 | W121: 0.11800000000000001 | X121: 9.4e-002 | Y121: 127 | Z121: 1.84 | AA121: 7.8000000000000005e-003 | AB121: 2.8000000000000004e-003 | AC121: -1.7500000000000002e-002 | AD121: -1.9299999999999998e-002 | AE121: 90.85 | AF121: 94.76 | AG121: 0.36 | AH121: AA+ | AI121: 3.6499999999999998e-002 | AJ121: =H121+100*O121 -> 148.12 | AK121: 140.5 | AL121: 129 | AM121: 45.8 | AN121: 130 | AO121: -7.9000000000000001e-002 | AP121: 13 | AQ121: 金田转债
A122: 157 | B122: 123062 | C122: 三超转债 | D122: 300554 | E122: 三超新材 | F122: 机械装备 | G122: 通用设备 | H122: 114.99 | I122: 1.2199999999999999e-002 | J122: 4.0000000000000001e-003 | K122: 16.07 | L122: 2.4900000000000002e-002 | M122: 119.2 | N122: 17.13 | O122: 0.22600000000000001 | P122: 93.81 | Q122: 转股中 | R122: 4.82年 | S122: 2.82年 | T122: 1.95 | U122: 6 | V122: 2.7000000000000003e-002 | W122: 0.129 | X122: 0.121 | Y122: 15 | Z122: 2.87 | AA122: 7.7000000000000002e-003 | AB122: 7.000000000000001e-004 | AC122: -3.2899999999999999e-002 | AD122: -3.5499999999999997e-002 | AE122: 82.43 | AF122: 82.21 | AG122: 0.65 | AH122: A | AI122: 8.2100000000000006e-002 | AJ122: =H122+100*O122 -> 137.59 | AK122: 136.2 | AL122: 89 | AM122: 53.7 | AN122: 187 | AO122: -9.6999999999999989e-002 | AP122: 27 | AQ122: 三超转债
A123: 140 | B123: 128129 | C123: 青农转债! | D123: 2958 | E123: 青农商行 | F123: 金融 | G123: 银行行业 | H123: 108.12 | I123: 1.9e-003 | J123: -5.3e-003 | K123: 3.89 | L123: -7.7000000000000002e-003 | M123: 112 | N123: 4.32 | O123: 0.20100000000000001 | P123: 90.05 | Q123: 转股中 | R123: 4.90年 | S123: 无权 | T123: 50 | U123: 8.4 | V123: 2.e-003 | W123: 0.23100000000000001 | X123: 0.20800000000000002 | Y123: 216 | Z123: 0.79 | AA123: 7.3000000000000001e-003 | AB123: 2.8000000000000004e-003 | AC123: 无权 | AD123: 无权 | AE123: 无权 | AF123: 95.71 | AG123: 0.45 | AH123: AAA | AI123: 3.3099999999999997e-002 | AJ123: =H123+100*O123 -> 128.22 | AK123: 126.2 | AL123: 17 | AM123: 30.5 | AN123: 25 | AO123: -2.2000000000000002e-002 | AP123: 23 | AQ123: 青农转债!
A124: 138 | B124: 123064 | C124: 万孚转债! | D124: 300482 | E124: 万孚生物 | F124: 医药 | G124: 医疗器械 | H124: 110.95 | I124: 1.4000000000000002e-003 | J124: 5.4000000000000003e-003 | K124: 43 | L124: 5.1100000000000007e-002 | M124: 114.8 | N124: 71.65 | O124: 0.84900000000000009 | P124: 60.01 | Q124: 转股中 | R124: 4.92年 | S124: 2.92年 | T124: 5.99 | U124: 9.2 | V124: 1.3999999999999999e-002 | W124: 3.1e-002 | X124: 1.9e-002 | Y124: 191 | Z124: 6.05 | AA124: 7.0999999999999995e-003 | AB124: 1.6000000000000001e-003 | AC124: -2.3e-002 | AD124: -2.5000000000000001e-002 | AE124: 91.58 | AF124: 94.94 | AG124: 0.13 | AH124: AA | AI124: 4.0099999999999997e-002 | AJ124: =H124+100*O124 -> 195.85000000000002 | AK124: 161.9 | AL124: 282 | AM124: 66.9 | AN124: 271 | AO124: 4.2000000000000003e-002 | AP124: 10 | AQ124: 万孚转债!
A125: 97 | B125: 127026 | C125: 超声转债! | D125: 823 | E125: 超声电子 | F125: 电子 | G125: 元器件制 | H125: 109.26 | I125: 1.01e-002 | J125: -2.8999999999999998e-003 | K125: 10.49 | L125: 1.7500000000000002e-002 | M125: 113.1 | N125: 12.72 | O125: 0.32500000000000001 | P125: 82.47 | Q125: 转股中 | R125: 5.19年 | S125: 3.19年 | T125: 7 | U125: 8 | V125: 1.1000000000000001e-002 | W125: 0.124 | X125: 0.10199999999999999 | Y125: 56 | Z125: 1.46 | AA125: 6.8000000000000005e-003 | AB125: 2.2000000000000001e-003 | AC125: -1.5900000000000001e-002 | AD125: -1.7899999999999999e-002 | AE125: 90.51 | AF125: 91.98 | AG125: 0.41 | AH125: AA | AI125: 4.1500000000000002e-002 | AJ125: =H125+100*O125 -> 141.75999999999999 | AK125: 136.1 | AL125: 86 | AM125: 44.1 | AN125: 113 | AO125: -7.4999999999999997e-002 | AP125: 12 | AQ125: 超声转债!
A126: 62 | B126: 123101 | C126: 拓斯转债! | D126: 300607 | E126: 拓斯达 | F126: 机械装备 | G126: 机器人及 | H126: 111.11 | I126: -4.4000000000000003e-003 | J126: 9.1999999999999998e-003 | K126: 17.17 | L126: 2.2000000000000002e-002 | M126: 115.1 | N126: 26.18 | O126: 0.69400000000000006 | P126: 65.58 | Q126: 转股中 | R126: 5.44年 | S126: 3.44年 | T126: 6.7 | U126: 11 | V126: 1.3999999999999999e-002 | W126: 9.1999999999999998e-002 | X126: 5.9999999999999998e-002 | Y126: 73 | Z126: 2.09 | AA126: 6.6e-003 | AB126: 1.6000000000000001e-003 | AC126: -1.9400000000000001e-002 | AD126: -2.12e-002 | AE126: 89.58 | AF126: 92.65 | AG126: 0.22 | AH126: AA | AI126: 4.1500000000000002e-002 | AJ126: =H126+100*O126 -> 180.50999999999999 | AK126: 156.6 | AL126: 259 | AM126: 64 | AN126: 254 | AO126: -0.13500000000000001 | AP126: 5 | AQ126: 拓斯转债!
A127: 88 | B127: 123087 | C127: 明电转债! | D127: 300739 | E127: 明阳电路 | F127: 电子 | G127: 元器件制 | H127: 117.36 | I127: 1.43e-002 | J127: -3.5999999999999999e-003 | K127: 16.1 | L127: 1.77e-002 | M127: 121.2 | N127: 16.32 | O127: 0.19 | P127: 98.65 | Q127: 转股中 | R127: 5.21年 | S127: 4.21年 | T127: 4.19 | U127: 28 | V127: 5.5999999999999994e-002 | W127: 8.8000000000000009e-002 | X127: 8.6999999999999994e-002 | Y127: 47 | Z127: 3.3 | AA127: 6.3e-003 | AB127: -7.000000000000001e-004 | AC127: -2.1899999999999999e-002 | AD127: -2.4700000000000003e-002 | AE127: 82.27 | AF127: 89.05 | AG127: 0.61 | AH127: AA- | AI127: 6.25e-002 | AJ127: =H127+100*O127 -> 136.36000000000001 | AK127: 136.1 | AL127: 87 | AM127: 47 | AN127: 142 | AO127: -2.7000000000000003e-002 | AP127: 18 | AQ127: 明电转债!
A128: 121 | B128: 113605 | C128: 大参转债! | D128: 603233 | E128: 大参林 | F128: 医药 | G128: 医药商业 | H128: 111.71 | I128: 4.5999999999999999e-003 | J128: -1.1999999999999999e-003 | K128: 42.41 | L128: 2.3700000000000002e-002 | M128: 115.2 | N128: 69.09 | O128: 0.81999999999999995 | P128: 61.38 | Q128: 转股中 | R128: 5年21天 | S128: 3年22天 | T128: 14 | U128: 4.2 | V128: 3.0000000000000001e-003 | W128: 4.2000000000000003e-002 | X128: 2.6000000000000002e-002 | Y128: 335 | Z128: 6.54 | AA128: 6.1999999999999998e-003 | AB128: 8.0000000000000004e-004 | AC128: -2.3e-002 | AD128: -2.5099999999999997e-002 | AE128: 91.08 | AF128: 94.19 | AG128: 0.14 | AH128: AA | AI128: 4.1500000000000002e-002 | AJ128: =H128+100*O128 -> 193.70999999999998 | AK128: 162 | AL128: 283 | AM128: 67.8 | AN128: 278 | AO128: -3.4000000000000002e-002 | AP128: 7 | AQ128: 大参转债!
A129: 70 | B129: 123097 | C129: 美力转债 | D129: 300611 | E129: 美力科技 | F129: 机械装备 | G129: 通用设备 | H129: 117.83 | I129: 1.1000000000000001e-002 | J129: 5.1000000000000004e-003 | K129: 9.33 | L129: 2.41e-002 | M129: 121.6 | N129: 9.28 | O129: 0.17199999999999999 | P129: 100.54 | Q129: 转股中 | R129: 5.33年 | S129: 3.33年 | T129: 3 | U129: 5.3 | V129: 1.4999999999999999e-002 | W129: 0.17999999999999999 | X129: 0.18100000000000002 | Y129: 17 | Z129: 2.41 | AA129: 6.0999999999999995e-003 | AB129: -8.9999999999999998e-004 | AC129: -3.39e-002 | AD129: -3.6299999999999999e-002 | AE129: 81.93 | AF129: 84.15 | AG129: 0.66 | AH129: A+ | AI129: 7.3499999999999996e-002 | AJ129: =H129+100*O129 -> 135.03 | AK129: 135.1 | AL129: 75 | AM129: 51 | AN129: 166 | AO129: -7.8e-002 | AP129: 21 | AQ129: 美力转债
A130: 328 | B130: 128042 | C130: 凯中转债! | D130: 2823 | E130: 凯中精密 | F130: 能源电力 | G130: 电力设备 | H130: 113.38 | I130: 1.8700000000000001e-002 | J130: -1.2500000000000001e-002 | K130: 10.3 | L130: 3.1e-002 | M130: 115.3 | N130: 12.86 | O130: 0.41600000000000004 | P130: 80.09 | Q130: 转股中 | R130: 2.83年 | S130: 0.83年 | T130: 4.16 | U130: 10 | V130: 2.2000000000000002e-002 | W130: 0.14099999999999999 | X130: 0.113 | Y130: 30 | Z130: 2.19 | AA130: 6.0000000000000001e-003 | AB130: -3.5999999999999999e-003 | AC130: -0.10300000000000001 | AD130: -0.106 | AE130: 98.08 | AF130: 103.89 | AG130: 0.2 | AH130: AA | AI130: 3.8100000000000002e-002 | AJ130: =H130+100*O130 -> 154.97999999999999 | AK130: 146.7 | AL130: 178 | AM130: 42.8 | AN130: 104 | AO130: -5.5e-002 | AP130: 25 | AQ130: 凯中转债!
A131: 100 | B131: 123081 | C131: 精研转债! | D131: 300709 | E131: 精研科技 | F131: 电子 | G131: 电子产品 | H131: 117.77 | I131: 9.1999999999999998e-003 | J131: -1.6000000000000001e-003 | K131: 31.48 | L131: 3.7599999999999995e-002 | M131: 121.3 | N131: 53.4 | O131: 0.998 | P131: 58.95 | Q131: 转股中 | R131: 5.17年 | S131: 3.18年 | T131: 5.7 | U131: 11 | V131: 1.6e-002 | W131: 0.13100000000000001 | X131: 7.6999999999999999e-002 | Y131: 44 | Z131: 2.79 | AA131: 5.8999999999999999e-003 | AB131: -1.1999999999999999e-003 | AC131: -3.6299999999999999e-002 | AD131: -3.8599999999999995e-002 | AE131: 85.31 | AF131: 89.29 | AG131: 0.2 | AH131: AA- | AI131: 6.25e-002 | AJ131: =H131+100*O131 -> 217.56999999999999 | AK131: 176.6 | AL131: 318 | AM131: 87.3 | AN131: 321 | AO131: -5.2000000000000005e-002 | AP131: 10 | AQ131: 精研转债!
A132: 8 | B132: 123123 | C132: 江丰转债 | D132: 300666 | E132: 江丰电子 | F132: 电子 | G132: 电子行业 | H132: 117.498 | I132: 4.0999999999999995e-003 | J132: 5.4000000000000003e-003 | K132: 42.35 | L132: 1.66e-002 | M132: 121.5 | N132: 51.93 | O132: 0.441 | P132: 81.55 | Q132: 4月21天 | R132: 5.86年 | S132: 3.87年 | T132: 5.17 | U132: 20 | V132: 3.2000000000000001e-002 | W132: 5.4000000000000006e-002 | X132: 4.4000000000000004e-002 | Y132: 96 | Z132: 8.36 | AA132: 5.7999999999999996e-003 | AB132: -4.0000000000000002e-004 | AC132: -2.9100000000000001e-002 | AD132: -3.1099999999999999e-002 | AE132: 78.68 | AF132: 80.88 | AG132: 0.57 | AH132: A+ | AI132: 7.3499999999999996e-002 | AJ132: =H132+100*O132 -> 161.59800000000001 | AK132: 153.4 | AL132: 233 | AM132: 72.6 | AN132: 299 | AO132: -8.8000000000000009e-002 | AP132: 4 | AQ132: 江丰转债
A133: 125 | B133: 128135 | C133: 洽洽转债! | D133: 2557 | E133: 洽洽食品 | F133: 食品饮料 | G133: 休闲食品 | H133: 116.883 | I133: -1.e-003 | J133: 5.1999999999999998e-003 | K133: 46.48 | L133: 1.4800000000000001e-002 | M133: 120.2 | N133: 60.03 | O133: 0.51000000000000001 | P133: 77.43 | Q133: 转股中 | R133: 5年19天 | S133: 3年20天 | T133: 13.4 | U133: 9.2 | V133: 6.0000000000000001e-003 | W133: 5.7000000000000002e-002 | X133: 4.4000000000000004e-002 | Y133: 236 | Z133: 5.69 | AA133: 5.6999999999999993e-003 | AB133: -1.1999999999999999e-003 | AC133: -3.6799999999999999e-002 | AD133: -3.8900000000000004e-002 | AE133: 91.1 | AF133: 98.28 | AG133: 0.28 | AH133: AA | AI133: 4.1500000000000002e-002 | AJ133: =H133+100*O133 -> 167.88299999999998 | AK133: 156.3 | AL133: 256 | AM133: 58.1 | AN133: 215 | AO133: 9.6000000000000002e-002 | AP133: 11 | AQ133: 洽洽转债!
A134: 252 | B134: 110062 | C134: 烽火转债! | D134: 600498 | E134: 烽火通信 | F134: 通信互联 | G134: 通信设备 | H134: 108.38 | I134: 4.4000000000000003e-003 | J134: -4.0000000000000001e-003 | K134: 17.64 | L134: 1.7000000000000001e-003 | M134: 110.8 | N134: 22.85 | O134: 0.40399999999999997 | P134: 77.2 | Q134: 转股中 | R134: 4.17年 | S134: 2.17年 | T134: 30.9 | U134: 13 | V134: 4.0000000000000001e-003 | W134: 0.155 | X134: 0.11900000000000001 | Y134: 200 | Z134: 1.84 | AA134: 5.4000000000000003e-003 | AB134: 5.9999999999999995e-004 | AC134: -2.0499999999999997e-002 | AD134: -2.3199999999999998e-002 | AE134: 95.8 | AF134: 97.01 | AG134: 0.26 | AH134: AAA | AI134: 3.3099999999999997e-002 | AJ134: =H134+100*O134 -> 148.78 | AK134: 139.6 | AL134: 119 | AM134: 42.5 | AN134: 102 | AO134: -3.5000000000000003e-002 | AP134: 18 | AQ134: 烽火转债!
A135: 77 | B135: 128143 | C135: 锋龙转债! | D135: 2931 | E135: 锋龙股份 | F135: 机械装备 | G135: 专用设备 | H135: 118.4 | I135: 2.64e-002 | J135: 2.1899999999999999e-002 | K135: 13.28 | L135: 7.0099999999999996e-002 | M135: 121.7 | N135: 12.73 | O135: 0.13500000000000001 | P135: 104.32 | Q135: 转股中 | R135: 5.27年 | S135: 3.28年 | T135: 2.44 | U135: 20 | V135: 7.0999999999999994e-002 | W135: 9.1999999999999998e-002 | X135: 9.6000000000000002e-002 | Y135: 26 | Z135: 4.21 | AA135: 5.4000000000000003e-003 | AB135: -1.7000000000000001e-003 | AC135: -3.5699999999999996e-002 | AD135: -3.8199999999999998e-002 | AE135: 82.24 | AF135: 84.54 | AG135: 0.69 | AH135: A+ | AI135: 7.3499999999999996e-002 | AJ135: =H135+100*O135 -> 131.90000000000001 | AK135: 132.5 | AL135: 48 | AM135: 47.9 | AN135: 145 | AO135: -2.9999999999999999e-002 | AP135: 14 | AQ135: 锋龙转债!
A136: 271 | B136: 128073 | C136: 哈尔转债! | D136: 2615 | E136: 哈尔斯 | F136: 其他 | G136: 家居用品 | H136: 112.779 | I136: 1.9e-003 | J136: 1.0200000000000001e-002 | K136: 5.18 | L136: 2.98e-002 | M136: 114.5 | N136: 5.71 | O136: 0.24299999999999999 | P136: 90.72 | Q136: 转股中 | R136: 2.89年 | S136: 0.89年 | T136: 2.99 | U136: 3.5 | V136: 1.1000000000000001e-002 | W136: 0.14000000000000001 | X136: 0.127 | Y136: 21 | Z136: 2.61 | AA136: 5.3e-003 | AB136: -3.7000000000000002e-003 | AC136: -9.69e-002 | AD136: -9.9000000000000005e-002 | AE136: 95.28 | AF136: 97.15 | AG136: 0.41 | AH136: AA- | AI136: 5.91e-002 | AJ136: =H136+100*O136 -> 137.07900000000001 | AK136: 134.8 | AL136: 71 | AM136: 37.7 | AN136: 62 | AO136: -3.7999999999999999e-002 | AP136: 38 | AQ136: 哈尔转债!
A137: 162 | B137: 123061 | C137: 航新转债! | D137: 300424 | E137: 航新科技 | F137: 航空航天 | G137: 航空航天 | H137: 121.3 | I137: 1.0800000000000001e-002 | J137: -4.5999999999999999e-003 | K137: 15.16 | L137: 1.e-002 | M137: 124.3 | N137: 14.85 | O137: 0.188 | P137: 102.09 | Q137: 转股中 | R137: 4.81年 | S137: 2.81年 | T137: 2.5 | U137: 42 | V137: 0.13900000000000001 | W137: 6.9000000000000006e-002 | X137: 7.0000000000000007e-002 | Y137: 36 | Z137: 5.4 | AA137: 5.1999999999999998e-003 | AB137: -3.3e-003 | AC137: -5.0199999999999995e-002 | AD137: -5.2699999999999997e-002 | AE137: 84.92 | AF137: 89.64 | AG137: 0.63 | AH137: A+ | AI137: 7.2099999999999997e-002 | AJ137: =H137+100*O137 -> 140.09999999999999 | AK137: 140.5 | AL137: 128 | AM137: 50.9 | AN137: 165 | AO137: -0.11 | AP137: 20 | AQ137: 航新转债!
A138: 38 | B138: 123113 | C138: 仙乐转债! | D138: 300791 | E138: 仙乐健康 | F138: 食品饮料 | G138: 食品饮料 | H138: 115.358 | I138: 7.4999999999999997e-003 | J138: 2.2000000000000001e-003 | K138: 41.95 | L138: 2.29e-002 | M138: 118.5 | N138: 56.88 | O138: 0.56399999999999995 | P138: 73.75 | Q138: 25天 | R138: 5.55年 | S138: 3.55年 | T138: 10.3 | U138: 3.3 | V138: 3.0000000000000001e-003 | W138: 0.13600000000000001 | X138: 0.10000000000000001 | Y138: 76 | Z138: 3.34 | AA138: 4.8999999999999998e-003 | AB138: -8.9999999999999998e-004 | AC138: -2.8199999999999999e-002 | AD138: -3.0099999999999998e-002 | AE138: 83.08 | AF138: 85.23 | AG138: 0.43 | AH138: AA- | AI138: 6.25e-002 | AJ138: =H138+100*O138 -> 171.75799999999998 | AK138: 157 | AL138: 263 | AM138: 71.7 | AN138: 295 | AO138: -7.2999999999999995e-002 | AP138: 3 | AQ138: 仙乐转债!
A139: 362 | B139: 128018 | C139: 时达转债!!* | D139: 2527 | E139: 新时达 | F139: 机械装备 | G139: 机器人及 | H139: 108.34 | I139: 1.72e-002 | J139: -6.0999999999999995e-003 | K139: 7.93 | L139: 1.2800000000000001e-002 | M139: 109.3 | N139: 7.36 | O139: 6.0000000000000001e-003 | P139: 107.74 | Q139: 转股中 | R139: 2年37天 | S139: 37天 | T139: 3.58 | U139: 49 | V139: 0.127 | W139: 7.2000000000000008e-002 | X139: 7.8e-002 | Y139: 49 | Z139: 1.83 | AA139: 4.3e-003 | AB139: -4.0000000000000001e-003 | AC139: -0.247 | AD139: -0.26000000000000001 | AE139: 100.79 | AF139: 101.21 | AG139: 0.87 | AH139: AA | AI139: 3.8100000000000002e-002 | AJ139: =H139+100*O139 -> 108.94 | AK139: 108.9 | AL139: 2 | AM139: 7.7 | AN139: 1 | AO139: -0.17600000000000002 | AP139: 34 | AQ139: 时达转债!!*
A140: 116 | B140: 123075 | C140: 贝斯转债! | D140: 300580 | E140: 贝斯特 | F140: 汽车 | G140: 零部件制 | H140: 113.15 | I140: 9.7999999999999997e-003 | J140: -6.3e-003 | K140: 18.49 | L140: 7.6e-003 | M140: 115.5 | N140: 23.74 | O140: 0.45299999999999996 | P140: 77.89 | Q140: 转股中 | R140: 5年32天 | S140: 3年33天 | T140: 6 | U140: 3.3 | V140: 5.0000000000000001e-003 | W140: 0.16200000000000001 | X140: 0.126 | Y140: 37 | Z140: 2.15 | AA140: 4.0999999999999995e-003 | AB140: -1.2999999999999999e-003 | AC140: -2.63e-002 | AD140: -2.8500000000000001e-002 | AE140: 85.43 | AF140: 85.44 | AG140: 0.46 | AH140: AA- | AI140: 6.25e-002 | AJ140: =H140+100*O140 -> 158.44999999999999 | AK140: 148.4 | AL140: 196 | AM140: 63 | AN140: 246 | AO140: -9.6000000000000002e-002 | AP140: 8 | AQ140: 贝斯转债!
A141: 112 | B141: 127024 | C141: 盈峰转债! | D141: 967 | E141: 盈峰环境 | F141: 机械装备 | G141: 专用设备 | H141: 114.48 | I141: 1.3300000000000001e-002 | J141: -9.4999999999999998e-003 | K141: 6.95 | L141: 1.0200000000000001e-002 | M141: 116.8 | N141: 8.19 | O141: 0.34899999999999998 | P141: 84.86 | Q141: 转股中 | R141: 5年34天 | S141: 3年35天 | T141: 14.8 | U141: 18 | V141: 1.1000000000000001e-002 | W141: 6.7000000000000004e-002 | X141: 5.7000000000000002e-002 | Y141: 220 | Z141: 1.36 | AA141: 4.0000000000000001e-003 | AB141: -1.8e-003 | AC141: -3.1200000000000002e-002 | AD141: -3.3099999999999997e-002 | AE141: 91.99 | AF141: 97.62 | AG141: 0.37 | AH141: AA+ | AI141: 3.6499999999999998e-002 | AJ141: =H141+100*O141 -> 149.38 | AK141: 144.1 | AL141: 163 | AM141: 46.5 | AN141: 137 | AO141: 5.2999999999999999e-002 | AP141: 5 | AQ141: 盈峰转债!
A142: 356 | B142: 128023 | C142: 亚太转债! | D142: 2284 | E142: 亚太股份 | F142: 汽车 | G142: 零部件制 | H142: 110.368 | I142: 1.6200000000000003e-002 | J142: -1.4499999999999999e-002 | K142: 7.17 | L142: 2.1400000000000002e-002 | M142: 111.3 | N142: 10.34 | O142: 0.59200000000000008 | P142: 69.34 | Q142: 转股中 | R142: 2.18年 | S142: 0.18年 | T142: 9.99 | U142: 6.6 | V142: 6.0000000000000001e-003 | W142: 0.18899999999999997 | X142: 0.13100000000000001 | Y142: 53 | Z142: 2.11 | AA142: 3.9000000000000003e-003 | AB142: -5.6000000000000008e-003 | AC142: -0.24399999999999999 | AD142: -0.254 | AE142: 100.51 | AF142: 102.77 | AG142: 0.08 | AH142: AA | AI142: 3.8100000000000002e-002 | AJ142: =H142+100*O142 -> 169.56800000000001 | AK142: 151.4 | AL142: 217 | AM142: 48.6 | AN142: 151 | AO142: -0.11199999999999999 | AP142: 63 | AQ142: 亚太转债!
A143: 120 | B143: 123073 | C143: 同和转债! | D143: 300636 | E143: 同和药业 | F143: 医药 | G143: 原料药 | H143: 120.232 | I143: 7.3000000000000001e-003 | J143: 1.06e-002 | K143: 15.3 | L143: 2.6800000000000001e-002 | M143: 122.4 | N143: 14.82 | O143: 0.16500000000000001 | P143: 103.24 | Q143: 转股中 | R143: 5年25天 | S143: 3年26天 | T143: 3.59 | U143: 7.9 | V143: 1.8000000000000002e-002 | W143: 0.114 | X143: 0.11800000000000001 | Y143: 31 | Z143: 3.95 | AA143: 3.5999999999999999e-003 | AB143: -3.9000000000000003e-003 | AC143: -4.2699999999999995e-002 | AD143: -4.5199999999999997e-002 | AE143: 83.39 | AF143: 86.24 | AG143: 0.67 | AH143: A+ | AI143: 7.3499999999999996e-002 | AJ143: =H143+100*O143 -> 136.732 | AK143: 137.2 | AL143: 101 | AM143: 51 | AN143: 167 | AO143: -2.6000000000000002e-002 | AP143: 12 | AQ143: 同和转债!
A144: 224 | B144: 113570 | C144: 百达转债! | D144: 603331 | E144: 百达精工 | F144: 机械装备 | G144: 机械装备 | H144: 113.37 | I144: 1.18e-002 | J144: -4.6999999999999993e-003 | K144: 10.72 | L144: 1.1299999999999999e-002 | M144: 114.9 | N144: 11.34 | O144: 0.19899999999999998 | P144: 94.53 | Q144: 转股中 | R144: 4.44年 | S144: 2.45年 | T144: 2.8 | U144: 1.7 | V144: 5.0000000000000001e-003 | W144: 0.14699999999999999 | X144: 0.13900000000000001 | Y144: 19 | Z144: 2.3 | AA144: 3.0999999999999999e-003 | AB144: -2.8999999999999998e-003 | AC144: -3.49e-002 | AD144: -3.73e-002 | AE144: 86.37 | AF144: 84.9 | AG144: 0.62 | AH144: A+ | AI144: 7.2099999999999997e-002 | AJ144: =H144+100*O144 -> 133.27000000000001 | AK144: 132.2 | AL144: 44 | AM144: 45.8 | AN144: 132 | AO144: -0.10400000000000001 | AP144: 32 | AQ144: 百达转债!
A145: 47 | B145: 123110 | C145: 九典转债 | D145: 300705 | E145: 九典制药 | F145: 医药 | G145: 化学制药 | H145: 119.44 | I145: 2.1700000000000001e-002 | J145: 3.1e-002 | K145: 25.46 | L145: 7.9699999999999993e-002 | M145: 121.4 | N145: 26.44 | O145: 0.23999999999999999 | P145: 96.29 | Q145: 8天 | R145: 5.50年 | S145: 3.50年 | T145: 2.7 | U145: 40 | V145: 0.125 | W145: 4.4999999999999998e-002 | X145: 4.4000000000000004e-002 | Y145: 60 | Z145: 6.37 | AA145: 3.0000000000000001e-003 | AB145: -3.5999999999999999e-003 | AC145: -3.6400000000000002e-002 | AD145: -3.85e-002 | AE145: 80.73 | AF145: 82.93 | AG145: 0.66 | AH145: A+ | AI145: 7.3499999999999996e-002 | AJ145: =H145+100*O145 -> 143.44 | AK145: 142.6 | AL145: 155 | AM145: 59.7 | AN145: 227 | AO145: -5.7999999999999996e-002 | AP145: 8 | AQ145: 九典转债
A146: 11 | B146: 123121 | C146: 帝尔转债! | D146: 300776 | E146: 帝尔激光 | F146: 机械装备 | G146: 专用设备 | H146: 119 | I146: 2.64e-002 | J146: -2.3e-002 | K146: 137.18 | L146: 8.6e-003 | M146: 121 | N146: 192.7 | O146: 0.67200000000000004 | P146: 71.19 | Q146: 4月14天 | R146: 5.85年 | S146: 3.85年 | T146: 8.4 | U146: 20 | V146: 2.e-002 | W146: 5.7999999999999996e-002 | X146: 4.0999999999999995e-002 | Y146: 145 | Z146: 7.61 | AA146: 2.8999999999999998e-003 | AB146: -3.2000000000000002e-003 | AC146: -3.3500000000000002e-002 | AD146: -3.5299999999999998e-002 | AE146: 81.67 | AF146: 85.49 | AG146: 0.4 | AH146: AA- | AI146: 6.25e-002 | AJ146: =H146+100*O146 -> 186.19999999999999 | AK146: 166.8 | AL146: 304 | AM146: 81.3 | AN146: 314 | AO146: -0.13900000000000001 | AP146: 3 | AQ146: 帝尔转债!
A147: 199 | B147: 128107 | C147: 交科转债 | D147: 2061 | E147: 浙江交科 | F147: 建筑 | G147: 建筑工程 | H147: 113.51 | I147: 1.e-004 | J147: -2.0999999999999999e-003 | K147: 5.2 | L147: -3.8e-003 | M147: 114.9 | N147: 5.24 | O147: 0.14400000000000002 | P147: 99.24 | Q147: 转股中 | R147: 4.56年 | S147: 2.56年 | T147: 25 | U147: 15 | V147: 5.0000000000000001e-003 | W147: 0.34899999999999998 | X147: 0.34700000000000003 | Y147: 72 | Z147: 0.81 | AA147: 2.7000000000000001e-003 | AB147: -3.0999999999999999e-003 | AC147: -3.39e-002 | AD147: -3.6200000000000003e-002 | AE147: 94.2 | AF147: 98.49 | AG147: 0.52 | AH147: AA+ | AI147: 3.5099999999999999e-002 | AJ147: =H147+100*O147 -> 127.91000000000001 | AK147: 127.8 | AL147: 24 | AM147: 29.3 | AN147: 19 | AO147: -5.9000000000000004e-002 | AP147: 20 | AQ147: 交科转债
A148: 303 | B148: 110053 | C148: 苏银转债! | D148: 600919 | E148: 江苏银行 | F148: 金融 | G148: 银行行业 | H148: 117.42 | I148: 1.4000000000000002e-003 | J148: -1.4000000000000002e-003 | K148: 5.82 | L148: 0. | M148: 118.3 | N148: 6.37 | O148: 0.28499999999999998 | P148: 91.37 | Q148: 转股中 | R148: 3.45年 | S148: 无权 | T148: 200 | U148: 103 | V148: 4.0000000000000001e-003 | W148: 0.23300000000000001 | X148: 0.21299999999999999 | Y148: 860 | Z148: 0.61 | AA148: 2.2000000000000001e-003 | AB148: -7.0999999999999995e-003 | AC148: 无权 | AD148: 无权 | AE148: 无权 | AF148: 106.1 | AG148: 0.36 | AH148: AAA | AI148: 3.3099999999999997e-002 | AJ148: =H148+100*O148 -> 145.91999999999999 | AK148: 143.5 | AL148: 158 | AM148: 37.4 | AN148: 61 | AO148: -6.2e-002 | AP148: 37 | AQ148: 苏银转债!
A149: 189 | B149: 123053 | C149: 宝通转债! | D149: 300031 | E149: 宝通科技 | F149: 通信互联 | G149: 互联网 | H149: 119.801 | I149: 2.3900000000000001e-002 | J149: 4.6999999999999993e-003 | K149: 19.05 | L149: 5.3699999999999998e-002 | M149: 120.8 | N149: 20.5 | O149: 0.28899999999999998 | P149: 92.93 | Q149: 转股中 | R149: 4.68年 | S149: 2.68年 | T149: 5 | U149: 509 | V149: 0.84299999999999997 | W149: 6.6000000000000003e-002 | X149: 6.0999999999999999e-002 | Y149: 76 | Z149: 2.46 | AA149: 1.8e-003 | AB149: -5.7999999999999996e-003 | AC149: -4.9800000000000004e-002 | AD149: -5.21e-002 | AE149: 87.77 | AF149: 92.09 | AG149: 0.53 | AH149: AA- | AI149: 6.1100000000000002e-002 | AJ149: =H149+100*O149 -> 148.70099999999999 | AK149: 146.7 | AL149: 180 | AM149: 54.6 | AN149: 194 | AO149: -5.9999999999999998e-002 | AP149: 11 | AQ149: 宝通转债!
A150: 43 | B150: 123112 | C150: 万讯转债 | D150: 300112 | E150: 万讯自控 | F150: 机械装备 | G150: 专用设备 | H150: 123.33 | I150: 1.1699999999999999e-002 | J150: 2.8999999999999998e-003 | K150: 9.98 | L150: 2.1499999999999998e-002 | M150: 124.4 | N150: 8.93 | O150: 0.10400000000000001 | P150: 111.76 | Q150: 14天 | R150: 5.52年 | S150: 3.52年 | T150: 2.46 | U150: 41 | V150: 0.13400000000000001 | W150: 8.5999999999999993e-002 | X150: 9.6000000000000002e-002 | Y150: 29 | Z150: 2.74 | AA150: 1.6000000000000001e-003 | AB150: -5.7999999999999996e-003 | AC150: -4.4800000000000006e-002 | AD150: -4.6900000000000004e-002 | AE150: 83.63 | AF150: 89.68 | AG150: 0.68 | AH150: AA- | AI150: 6.25e-002 | AJ150: =H150+100*O150 -> 133.72999999999999 | AK150: 134.9 | AL150: 73 | AM150: 45.2 | AN150: 127 | AO150: -6.8000000000000005e-002 | AP150: 14 | AQ150: 万讯转债
A151: 4 | B151: 127044 | C151: 蒙娜转债 | D151: 2918 | E151: 蒙娜丽莎 | F151: 建筑 | G151: 其他建材 | H151: 116 | I151: 8.6999999999999994e-003 | J151: -1.9e-003 | K151: 21.8 | L151: 1.7299999999999999e-002 | M151: 117.1 | N151: 27.07 | O151: 0.44 | P151: 80.53 | Q151: 4月24天 | R151: 5.88年 | S151: 3.88年 | T151: 11.7 | U151: 9.3 | V151: 6.9999999999999993e-003 | W151: 0.129 | X151: 0.10400000000000001 | Y151: 90 | Z151: 2.5 | AA151: 1.6000000000000001e-003 | AB151: -3.4999999999999996e-003 | AC151: -2.7799999999999998e-002 | AD151: -2.9399999999999999e-002 | AE151: 88.01 | AF151: 92.59 | AG151: 0.4 | AH151: AA | AI151: 4.1500000000000002e-002 | AJ151: =H151+100*O151 -> 160. | AK151: 151.5 | AL151: 219 | AM151: 58.9 | AN151: 222 | AO151: -0.151 | AP151: 2 | AQ151: 蒙娜转债
A152: 242 | B152: 128090 | C152: 汽模转2 | D152: 2510 | E152: 天汽模 | F152: 汽车 | G152: 零部件制 | H152: 114.303 | I152: 1.24e-002 | J152: -5.1999999999999998e-003 | K152: 4.01 | L152: 1.26e-002 | M152: 114.9 | N152: 4.23 | O152: 0.20600000000000002 | P152: 94.8 | Q152: 转股中 | R152: 4.24年 | S152: 2.24年 | T152: 3.1 | U152: 6.2 | V152: 1.8000000000000002e-002 | W152: 8.199999999999999e-002 | X152: 7.8e-002 | Y152: 38 | Z152: 1.85 | AA152: 1.2999999999999999e-003 | AB152: -5.0000000000000001e-003 | AC152: -4.1200000000000001e-002 | AD152: -4.3799999999999999e-002 | AE152: 89.79 | AF152: 89.86 | AG152: 0.57 | AH152: AA- | AI152: 6.1100000000000002e-002 | AJ152: =H152+100*O152 -> 134.90299999999999 | AK152: 133.8 | AL152: 60 | AM152: 44 | AN152: 111 | AO152: -6.7000000000000004e-002 | AP152: 30 | AQ152: 汽模转2
A153: 9 | B153: 127042 | C153: 嘉美转债 | D153: 2969 | E153: 嘉美包装 | F153: 造纸包装 | G153: 包装材料 | H153: 116.302 | I153: 1.1299999999999999e-002 | J153: 1.e-003 | K153: 5.23 | L153: 1.95e-002 | M153: 117.1 | N153: 4.87 | O153: 8.3000000000000004e-002 | P153: 107.39 | Q153: 4月17天 | R153: 5.86年 | S153: 3.86年 | T153: 7.5 | U153: 30 | V153: 3.5000000000000003e-002 | W153: 0.14899999999999999 | X153: 0.16 | Y153: 50 | Z153: 2.32 | AA153: 1.1999999999999999e-003 | AB153: -3.9000000000000003e-003 | AC153: -2.8500000000000001e-002 | AD153: -3.0200000000000001e-002 | AE153: 88.08 | AF153: 92.67 | AG153: 0.63 | AH153: AA | AI153: 4.1500000000000002e-002 | AJ153: =H153+100*O153 -> 124.602 | AK153: 125.2 | AL153: 13 | AM153: 32.5 | AN153: 34 | AO153: -4.4999999999999998e-002 | AP153: 7 | AQ153: 嘉美转债
A154: 34 | B154: 111000 | C154: 起帆转债 | D154: 605222 | E154: 起帆电缆 | F154: 能源电力 | G154: 电力设备 | H154: 119.88 | I154: 2.2599999999999999e-002 | J154: -4.5999999999999999e-003 | K154: 20.98 | L154: 2.7400000000000001e-002 | M154: 120.5 | N154: 20.53 | O154: 0.17300000000000001 | P154: 102.19 | Q154: 2月0天 | R154: 5.65年 | S154: 3.65年 | T154: 10 | U154: 8.3 | V154: 6.9999999999999993e-003 | W154: 0.114 | X154: 0.11599999999999999 | Y154: 88 | Z154: 2.7 | AA154: 8.9999999999999998e-004 | AB154: -5.3e-003 | AC154: -3.73e-002 | AD154: -3.9100000000000003e-002 | AE154: 82.6 | AF154: 86.15 | AG154: 0.66 | AH154: AA- | AI154: 6.25e-002 | AJ154: =H154+100*O154 -> 137.18000000000001 | AK154: 137.6 | AL154: 105 | AM154: 51.4 | AN154: 170 | AO154: -6.9000000000000006e-002 | AP154: 9 | AQ154: 起帆转债
A155: 347 | B155: 128034 | C155: 江银转债! | D155: 2807 | E155: 江阴银行 | F155: 金融 | G155: 银行行业 | H155: 108.28 | I155: -1.1000000000000001e-003 | J155: -5.9999999999999995e-004 | K155: 3.83 | L155: -5.1999999999999998e-003 | M155: 108.3 | N155: 4.32 | O155: 0.221 | P155: 88.66 | Q155: 转股中 | R155: 2.33年 | S155: 无权 | T155: 17.6 | U155: 5.4 | V155: 3.0000000000000001e-003 | W155: 0.21100000000000002 | X155: 0.187 | Y155: 83 | Z155: 0.7 | AA155: 1.e-004 | AB155: -6.6e-003 | AC155: 无权 | AD155: 无权 | AE155: 无权 | AF155: 100.51 | AG155: 0.33 | AH155: AA+ | AI155: 3.3099999999999997e-002 | AJ155: =H155+100*O155 -> 130.38 | AK155: 127.9 | AL155: 25 | AM155: 27.4 | AN155: 11 | AO155: -2.e-002 | AP155: 29 | AQ155: 江银转债!
A156: 49 | B156: 123107 | C156: 温氏转债! | D156: 300498 | E156: 温氏股份 | F156: 农业 | G156: 畜牧业 | H156: 112.92 | I156: 5.4000000000000003e-003 | J156: -1.11e-002 | K156: 14.47 | L156: -1.4999999999999999e-002 | M156: 113 | N156: 17.62 | O156: 0.375 | P156: 82.12 | Q156: 8天 | R156: 5.49年 | S156: 3.49年 | T156: 93 | U156: 98 | V156: 9.0000000000000011e-003 | W156: 0.10099999999999999 | X156: 8.3000000000000004e-002 | Y156: 919 | Z156: 2.2 | AA156: 1.e-004 | AB156: -4.1999999999999997e-003 | AC156: -2.3700000000000002e-002 | AD156: -2.5499999999999998e-002 | AE156: 91.51 | AF156: 94.11 | AG156: 0.38 | AH156: AAA | AI156: 3.4500000000000003e-002 | AJ156: =H156+100*O156 -> 150.42000000000002 | AK156: 143.7 | AL156: 160 | AM156: 49.6 | AN156: 159 | AO156: 6.5000000000000002e-002 | AP156: 12 | AQ156: 温氏转债!
A157: 210 | B157: 128105 | C157: 长集转债! | D157: 2616 | E157: 长青集团 | F157: 城市公用 | G157: 三废处理 | H157: 114.89 | I157: 2.1499999999999998e-002 | J157: -5.1000000000000004e-003 | K157: 6.98 | L157: 3.8699999999999998e-002 | M157: 114.9 | N157: 7.91 | O157: 0.30199999999999999 | P157: 88.24 | Q157: 转股中 | R157: 4.52年 | S157: 2.53年 | T157: 8 | U157: 66 | V157: 7.2000000000000008e-002 | W157: 0.154 | X157: 0.13600000000000001 | Y157: 52 | Z157: 2.03 | AA157: 0. | AB157: -5.8999999999999999e-003 | AC157: -3.8699999999999998e-002 | AD157: -4.0999999999999995e-002 | AE157: 93.12 | AF157: 96.53 | AG157: 0.42 | AH157: AA | AI157: 4.0099999999999997e-002 | AJ157: =H157+100*O157 -> 145.09 | AK157: 141.5 | AL157: 140 | AM157: 45 | AN157: 122 | AO157: 0.14899999999999999 | AP157: 18 | AQ157: 长集转债!
A158: 51 | B158: 113622 | C158: 杭叉转债! | D158: 603298 | E158: 杭叉集团 | F158: 机械装备 | G158: 通用设备 | H158: 112.6 | I158: -1.2999999999999999e-003 | J158: 3.0000000000000001e-003 | K158: 16.12 | L158: 6.1999999999999998e-003 | M158: 112.5 | N158: 23.08 | O158: 0.61199999999999999 | P158: 69.84 | Q158: 8天 | R158: 5.48年 | S158: 3.48年 | T158: 11.5 | U158: 5.8 | V158: 4.0000000000000001e-003 | W158: 8.199999999999999e-002 | X158: 5.7999999999999996e-002 | Y158: 140 | Z158: 2.76 | AA158: -2.0000000000000001e-004 | AB158: -4.3e-003 | AC158: -2.4199999999999999e-002 | AD158: -2.58e-002 | AE158: 90.45 | AF158: 92.71 | AG158: 0.27 | AH158: AA+ | AI158: 3.6499999999999998e-002 | AJ158: =H158+100*O158 -> 173.79999999999998 | AK158: 155.4 | AL158: 247 | AM158: 62.6 | AN158: 239 | AO158: -7.8e-002 | AP158: 5 | AQ158: 杭叉转债!
A159: 358 | B159: 128021 | C159: 兄弟转债!! | D159: 2562 | E159: 兄弟科技 | F159: 医药 | G159: 原料药 | H159: 108.88 | I159: 2.0199999999999999e-002 | J159: -1.95e-002 | K159: 3.95 | L159: 1.2800000000000001e-002 | M159: 108.8 | N159: 5.19 | O159: 0.43099999999999999 | P159: 76.11 | Q159: 转股中 | R159: 2年59天 | S159: 59天 | T159: 2.65 | U159: 3.6 | V159: 1.3000000000000001e-002 | W159: 6.3e-002 | X159: 4.8000000000000001e-002 | Y159: 42 | Z159: 1.42 | AA159: -2.9999999999999997e-004 | AB159: -8.0000000000000002e-003 | AC159: -0.223 | AD159: -0.23199999999999998 | AE159: 100.32 | AF159: 100.44 | AG159: 0.06 | AH159: AA | AI159: 3.8100000000000002e-002 | AJ159: =H159+100*O159 -> 151.97999999999999 | AK159: 141.7 | AL159: 142 | AM159: 41.2 | AN159: 91 | AO159: -6.0000000000000001e-003 | AP159: 17 | AQ159: 兄弟转债!!
A160: 22 | B160: 123117 | C160: 健帆转债! | D160: 300529 | E160: 健帆生物 | F160: 医药 | G160: 医疗器械 | H160: 115.5 | I160: 4.3e-003 | J160: 5.9999999999999995e-004 | K160: 58.56 | L160: 2.2000000000000002e-002 | M160: 115.1 | N160: 90.57 | O160: 0.78599999999999992 | P160: 64.66 | Q160: 3月0天 | R160: 5.73年 | S160: 3.73年 | T160: 10 | U160: 22 | V160: 1.9e-002 | W160: 2.1000000000000001e-002 | X160: 1.3999999999999999e-002 | Y160: 472 | Z160: 15.29 | AA160: -5.9999999999999995e-004 | AB160: -5.3e-003 | AC160: -2.7699999999999999e-002 | AD160: -2.9399999999999999e-002 | AE160: 88.54 | AF160: 91.57 | AG160: 0.22 | AH160: AA | AI160: 4.1500000000000002e-002 | AJ160: =H160+100*O160 -> 194.09999999999999 | AK160: 166.3 | AL160: 302 | AM160: 74.8 | AN160: 303 | AO160: 0.13 | AP160: 5 | AQ160: 健帆转债!
A161: 262 | B161: 127014 | C161: 北方转债! | D161: 65 | E161: 北方国际 | F161: 建筑 | G161: 建筑工程 | H161: 115.649 | I161: 5.1999999999999998e-003 | J161: -1.9e-003 | K161: 8.15 | L161: 7.4000000000000003e-003 | M161: 115.1 | N161: 8.65 | O161: 0.22699999999999998 | P161: 94.22 | Q161: 转股中 | R161: 4年23天 | S161: 2年24天 | T161: 5.35 | U161: 6.2 | V161: 1.e-002 | W161: 8.5000000000000006e-002 | X161: 8.0000000000000002e-002 | Y161: 63 | Z161: 1.1 | AA161: -1.1999999999999999e-003 | AB161: -7.8000000000000005e-003 | AC161: -4.87e-002 | AD161: -5.16e-002 | AE161: 96.02 | AF161: 100.38 | AG161: 0.45 | AH161: AA+ | AI161: 3.5099999999999999e-002 | AJ161: =H161+100*O161 -> 138.34899999999999 | AK161: 137.1 | AL161: 100 | AM161: 36.7 | AN161: 60 | AO161: -5.0000000000000003e-002 | AP161: 18 | AQ161: 北方转债!
A162: 354 | B162: 128026 | C162: 众兴转债! | D162: 2772 | E162: 众兴菌业 | F162: 农业 | G162: 种植业 | H162: 109.611 | I162: -3.2799999999999996e-002 | J162: 4.6999999999999993e-003 | K162: 10.12 | L162: -7.4099999999999999e-002 | M162: 109.3 | N162: 11.36 | O162: 0.23000000000000001 | P162: 89.08 | Q162: 转股中 | R162: 2.20年 | S162: 0.20年 | T162: 4.09 | U162: 156 | V162: 0.34799999999999998 | W162: 0.10000000000000001 | X162: 8.900000000000001e-002 | Y162: 41 | Z162: 1.37 | AA162: -1.2999999999999999e-003 | AB162: -9.1999999999999998e-003 | AC162: -0.20899999999999999 | AD162: -0.218 | AE162: 99.68 | AF162: 96.57 | AG162: 0.38 | AH162: AA- | AI162: 5.91e-002 | AJ162: =H162+100*O162 -> 132.61099999999999 | AK162: 130.1 | AL162: 35 | AM162: 30.5 | AN162: 24 | AO162: -0.13800000000000001 | AP162: 57 | AQ162: 众兴转债!
A163: 179 | B163: 128116 | C163: 瑞达转债! | D163: 2961 | E163: 瑞达期货 | F163: 金融 | G163: 期货行业 | H163: 115.89 | I163: 7.7000000000000002e-003 | J163: 2.0999999999999999e-003 | K163: 26.94 | L163: 2.0799999999999999e-002 | M163: 114.9 | N163: 29.55 | O163: 0.27100000000000002 | P163: 91.17 | Q163: 转股中 | R163: 4.74年 | S163: 2.75年 | T163: 6.49 | U163: 7.4 | V163: 1.e-002 | W163: 5.4000000000000006e-002 | X163: 4.9000000000000002e-002 | Y163: 120 | Z163: 6.03 | AA163: -1.8e-003 | AB163: -7.4000000000000003e-003 | AC163: -3.8900000000000004e-002 | AD163: -4.0999999999999995e-002 | AE163: 92.23 | AF163: 95.68 | AG163: 0.47 | AH163: AA | AI163: 4.0099999999999997e-002 | AJ163: =H163+100*O163 -> 142.99000000000001 | AK163: 140.6 | AL163: 130 | AM163: 44.9 | AN163: 120 | AO163: 2.8999999999999998e-002 | AP163: 18 | AQ163: 瑞达转债!
A164: 195 | B164: 128108 | C164: 蓝帆转债! | D164: 2382 | E164: 蓝帆医疗 | F164: 医药 | G164: 医疗器械 | H164: 114.06 | I164: 7.4000000000000003e-003 | J164: -3.7000000000000002e-003 | K164: 17.98 | L164: 6.7000000000000002e-003 | M164: 112.9 | N164: 18.24 | O164: 0.157 | P164: 98.57 | Q164: 转股中 | R164: 4.66年 | S164: 3.66年 | T164: 15.2 | U164: 28 | V164: 1.6e-002 | W164: 8.4000000000000005e-002 | X164: 8.3000000000000004e-002 | Y164: 181 | Z164: 1.43 | AA164: -2.2000000000000001e-003 | AB164: -7.1999999999999998e-003 | AC164: -2.1099999999999997e-002 | AD164: -2.3700000000000002e-002 | AE164: 90.75 | AF164: 94.36 | AG164: 0.56 | AH164: AA | AI164: 4.0099999999999997e-002 | AJ164: =H164+100*O164 -> 129.75999999999999 | AK164: 129.5 | AL164: 31 | AM164: 35.2 | AN164: 50 | AO164: -6.9000000000000006e-002 | AP164: 27 | AQ164: 蓝帆转债!
A165: 15 | B165: 113627 | C165: 太平转债 | D165: 603877 | E165: 太平鸟 | F165: 服装纺织 | G165: 服装行业 | H165: 116.64 | I165: 1.6000000000000001e-003 | J165: 1.1999999999999999e-003 | K165: 38.78 | L165: 7.8000000000000005e-003 | M165: 115.1 | N165: 50.32 | O165: 0.51300000000000001 | P165: 77.07 | Q165: 3月23天 | R165: 5.79年 | S165: 3.79年 | T165: 8 | U165: 3 | V165: 3.0000000000000001e-003 | W165: 4.2999999999999997e-002 | X165: 3.3000000000000002e-002 | Y165: 185 | Z165: 4.7 | AA165: -2.3e-003 | AB165: -6.9999999999999993e-003 | AC165: -2.9700000000000001e-002 | AD165: -3.1400000000000004e-002 | AE165: 88.33 | AF165: 91.34 | AG165: 0.37 | AH165: AA | AI165: 4.1500000000000002e-002 | AJ165: =H165+100*O165 -> 167.94 | AK165: 156.2 | AL165: 255 | AM165: 64.9 | AN165: 261 | AO165: -0.121 | AP165: 2 | AQ165: 太平转债
A166: 298 | B166: 123024 | C166: 岱勒转债! | D166: 300700 | E166: 岱勒新材 | F166: 机械装备 | G166: 专用设备 | H166: 113.18 | I166: 6.0000000000000001e-003 | J166: 5.1000000000000004e-003 | K166: 12.63 | L166: 2.6800000000000001e-002 | M166: 112.5 | N166: 14.1 | O166: 0.26400000000000001 | P166: 89.57 | Q166: 转股中 | R166: 2.47年 | S166: 0.47年 | T166: 2.1 | U166: 5.2 | V166: 2.2000000000000002e-002 | W166: 0.155 | X166: 0.13900000000000001 | Y166: 14 | Z166: 2.86 | AA166: -2.5000000000000001e-003 | AB166: -1.1599999999999999e-002 | AC166: -0.17300000000000001 | AD166: -0.17699999999999999 | AE166: 96.98 | AF166: 95.37 | AG166: 0.42 | AH166: A+ | AI166: 7.0099999999999996e-002 | AJ166: =H166+100*O166 -> 139.58000000000001 | AK166: 136.8 | AL166: 94 | AM166: 39.8 | AN166: 79 | AO166: -0.111 | AP166: 37 | AQ166: 岱勒转债!
A167: 114 | B167: 128136 | C167: 立讯转债! | D167: 2475 | E167: 立讯精密 | F167: 电子 | G167: 元器件制 | H167: 113.31 | I167: 7.1999999999999998e-003 | J167: -7.1999999999999998e-003 | K167: 35.71 | L167: 0. | M167: 111.9 | N167: 58.18 | O167: 0.84599999999999997 | P167: 61.38 | Q167: 转股中 | R167: 5年33天 | S167: 3年34天 | T167: 30 | U167: 12 | V167: 4.0000000000000001e-003 | W167: 1.2e-002 | X167: 6.9999999999999993e-003 | Y167: 2512. | Z167: 8.28 | AA167: -2.5000000000000001e-003 | AB167: -6.7000000000000002e-003 | AC167: -3.0699999999999998e-002 | AD167: -3.2000000000000001e-002 | AE167: 91.15 | AF167: 93.44 | AG167: 0.14 | AH167: AA+ | AI167: 3.6499999999999998e-002 | AJ167: =H167+100*O167 -> 197.91 | AK167: 165.2 | AL167: 298 | AM167: 71.8 | AN167: 296 | AO167: 2.4e-002 | AP167: 14 | AQ167: 立讯转债!
A168: 360 | B168: 110038 | C168: 济川转债! | D168: 600566 | E168: 济川药业 | F168: 医药 | G168: 中药 | H168: 107.83 | I168: 7.8000000000000005e-003 | J168: -7.7000000000000002e-003 | K168: 16.71 | L168: 1.1999999999999999e-003 | M168: 107.5 | N168: 23.4 | O168: 0.51000000000000001 | P168: 71.41 | Q168: 转股中 | R168: 1年44天 | S168: 回售内 | T168: 6.28 | U168: 2.9 | V168: 4.0000000000000001e-003 | W168: 4.2000000000000003e-002 | X168: 2.9999999999999999e-002 | Y168: 148 | Z168: 1.83 | AA168: -2.8000000000000004e-003 | AB168: -1.5300000000000001e-002 | AC168: 回售内 | AD168: 回售内 | AE168: 100.25 | AF168: 103.14 | AG168: 0.02 | AH168: AA | AI168: 3.8100000000000002e-002 | AJ168: =H168+100*O168 -> 158.82999999999998 | AK168: 144.2 | AL168: 165 | AM168: 41.1 | AN168: 87 | AO168: -1.8000000000000002e-002 | AP168: 22 | AQ168: 济川转债!
A169: 64 | B169: 113045 | C169: 环旭转债! | D169: 601231 | E169: 环旭电子 | F169: 电子 | G169: 电子产品 | H169: 113.81 | I169: 6.5000000000000006e-003 | J169: -5.8999999999999999e-003 | K169: 13.86 | L169: 2.8999999999999998e-003 | M169: 112 | N169: 19.75 | O169: 0.622 | P169: 70.18 | Q169: 2月11天 | R169: 5.42年 | S169: 2.43年 | T169: 34.5 | U169: 4.2 | V169: 1.e-003 | W169: 0.113 | X169: 7.9000000000000001e-002 | Y169: 306 | Z169: 2.65 | AA169: -3.0000000000000001e-003 | AB169: -6.9999999999999993e-003 | AC169: -3.8199999999999998e-002 | AD169: -4.0300000000000002e-002 | AE169: 93.78 | AF169: 92.44 | AG169: 0.24 | AH169: AA+ | AI169: 3.6499999999999998e-002 | AJ169: =H169+100*O169 -> 176.00999999999999 | AK169: 157.4 | AL169: 267 | AM169: 63.7 | AN169: 253 | AO169: -5.0999999999999997e-002 | AP169: 5 | AQ169: 环旭转债!
A170: 1 | B170: 123125 | C170: N元力转 | D170: 300174 | E170: 元力股份 | F170: 化工 | G170: 化工 | H170: 111.4 | I170: 0.114 | J170: 0. | K170: 15.95 | L170: -6.1999999999999998e-003 | M170: 109.3 | N170: 17.61 | O170: 0.23000000000000001 | P170: 90.57 | Q170: 5月11天 | R170: 5.93年 | S170: 3.94年 | T170: 9 | U170: 1960. | V170: 1.9399999999999999 | W170: 0.18100000000000002 | X170: 0.16399999999999998 | Y170: 50 | Z170: 2.88 | AA170: -3.2000000000000002e-003 | AB170: -6.0999999999999995e-003 | AC170: -1.95e-002 | AD170: -2.0799999999999999e-002 | AE170: 80.27 | AF170: 76.66 | AG170: 0.65 | AH170: AA- | AI170: 6.25e-002 | AJ170: =H170+100*O170 -> 134.40000000000001 | AK170: 132.2 | AL170: 45 | AM170: 52 | AN170: 175 | AO170: -3.7999999999999999e-002 | AP170: 1 | AQ170: N元力转
A171: 338 | B171: 128039 | C171: 三力转债! | D171: 2224 | E171: 三 力 士 | F171: 机械装备 | G171: 专用设备 | H171: 109.813 | I171: 3.4000000000000002e-003 | J171: 2.8999999999999998e-003 | K171: 5.02 | L171: 1.6200000000000003e-002 | M171: 108.8 | N171: 5.79 | O171: 0.26700000000000002 | P171: 86.7 | Q171: 转股中 | R171: 2.69年 | S171: 0.69年 | T171: 2.02 | U171: 5 | V171: 2.3e-002 | W171: 5.5e-002 | X171: 4.8000000000000001e-002 | Y171: 37 | Z171: 1.56 | AA171: -3.4999999999999996e-003 | AB171: -9.5999999999999992e-003 | AC171: -8.77e-002 | AD171: -9.0899999999999995e-002 | AE171: 96.7 | AF171: 93.45 | AG171: 0.39 | AH171: AA- | AI171: 5.91e-002 | AJ171: =H171+100*O171 -> 136.51300000000001 | AK171: 132.9 | AL171: 53 | AM171: 36.2 | AN171: 58 | AO171: -3.3000000000000002e-002 | AP171: 30 | AQ171: 三力转债!
A172: 16 | B172: 123119 | C172: 康泰转2! | D172: 300601 | E172: 康泰生物 | F172: 医药 | G172: 生物制药 | H172: 119.45 | I172: 2.06e-002 | J172: -1.1200000000000002e-002 | K172: 110.13 | L172: 2.75e-002 | M172: 117.1 | N172: 145.33 | O172: 0.57600000000000007 | P172: 75.78 | Q172: 3月23天 | R172: 5.79年 | S172: 3.79年 | T172: 20 | U172: 31 | V172: 1.3000000000000001e-002 | W172: 2.6000000000000002e-002 | X172: 2.e-002 | Y172: 757 | Z172: 9.48 | AA172: -3.4999999999999996e-003 | AB172: -8.6e-003 | AC172: -3.56e-002 | AD172: -3.73e-002 | AE172: 88.33 | AF172: 92.92 | AG172: 0.34 | AH172: AA | AI172: 4.1500000000000002e-002 | AJ172: =H172+100*O172 -> 177.05000000000001 | AK172: 163.1 | AL172: 290 | AM172: 70.2 | AN172: 289 | AO172: -2.8999999999999998e-002 | AP172: 8 | AQ172: 康泰转2!
A173: 260 | B173: 110060 | C173: 天路转债! | D173: 600326 | E173: 西藏天路 | F173: 建筑 | G173: 水泥 | H173: 116.57 | I173: 1.2800000000000001e-002 | J173: -5.1000000000000004e-003 | K173: 6.6 | L173: 1.6899999999999998e-002 | M173: 114.9 | N173: 7.08 | O173: 0.25 | P173: 93.22 | Q173: 转股中 | R173: 4年27天 | S173: 2年28天 | T173: 7.06 | U173: 6.2 | V173: 8.0000000000000002e-003 | W173: 0.11699999999999999 | X173: 0.109 | Y173: 61 | Z173: 1.39 | AA173: -3.5999999999999999e-003 | AB173: -1.01e-002 | AC173: -5.2600000000000001e-002 | AD173: -5.5300000000000002e-002 | AE173: 94.77 | AF173: 98.24 | AG173: 0.45 | AH173: AA | AI173: 4.0099999999999997e-002 | AJ173: =H173+100*O173 -> 141.56999999999999 | AK173: 139.9 | AL173: 123 | AM173: 41.7 | AN173: 97 | AO173: -5.2999999999999999e-002 | AP173: 13 | AQ173: 天路转债!
A174: 167 | B174: 113593 | C174: 沪工转债! | D174: 603131 | E174: 上海沪工 | F174: 机械装备 | G174: 通用设备 | H174: 123.25 | I174: 4.4400000000000002e-002 | J174: 1.9199999999999998e-002 | K174: 21.1 | L174: 0.10000000000000001 | M174: 121.2 | N174: 21.12 | O174: 0.23399999999999999 | P174: 99.91 | Q174: 转股中 | R174: 4.80年 | S174: 2.80年 | T174: 4 | U174: 43 | V174: 8.5999999999999993e-002 | W174: 5.9999999999999998e-002 | X174: 5.9999999999999998e-002 | Y174: 67 | Z174: 5.2 | AA174: -3.5999999999999999e-003 | AB174: -1.1000000000000001e-002 | AC174: -5.5399999999999998e-002 | AD174: -5.79e-002 | AE174: 84.91 | AF174: 87.43 | AG174: 0.64 | AH174: A+ | AI174: 7.2099999999999997e-002 | AJ174: =H174+100*O174 -> 146.65000000000001 | AK174: 146.6 | AL174: 175 | AM174: 59.2 | AN174: 224 | AO174: -4.4000000000000004e-002 | AP174: 10 | AQ174: 沪工转债!
A175: 320 | B175: 110047 | C175: 山鹰转债 | D175: 600567 | E175: 山鹰国际 | F175: 造纸包装 | G175: 包装用纸 | H175: 118.88 | I175: 6.8000000000000005e-003 | J175: -9.5999999999999992e-003 | K175: 3.42 | L175: -5.7999999999999996e-003 | M175: 117.5 | N175: 3.3 | O175: 0.14699999999999999 | P175: 103.64 | Q175: 转股中 | R175: 3年51天 | S175: 1年52天 | T175: 22.5 | U175: 47 | V175: 1.7000000000000001e-002 | W175: 0.14199999999999999 | X175: 0.14699999999999999 | Y175: 158 | Z175: 0.99 | AA175: -3.8e-003 | AB175: -1.3500000000000002e-002 | AC175: -0.106 | AD175: -0.10300000000000001 | AE175: 98.34 | AF175: 105.69 | AG175: 0.49 | AH175: AA+ | AI175: 3.5099999999999999e-002 | AJ175: =H175+100*O175 -> 133.57999999999998 | AK175: 134.1 | AL175: 64 | AM175: 28.4 | AN175: 14 | AO175: -5.9000000000000004e-002 | AP175: 28 | AQ175: 山鹰转债
A176: 244 | B176: 123038 | C176: 联得转债! | D176: 300545 | E176: 联得装备 | F176: 机械装备 | G176: 专用设备 | H176: 120.581 | I176: 4.8999999999999998e-003 | J176: 7.9000000000000008e-003 | K176: 22.76 | L176: 2.2000000000000002e-002 | M176: 118.6 | N176: 24.07 | O176: 0.27500000000000002 | P176: 94.56 | Q176: 转股中 | R176: 4.23年 | S176: 2.24年 | T176: 1.47 | U176: 23 | V176: 0.127 | W176: 3.6000000000000004e-002 | X176: 3.4000000000000002e-002 | Y176: 40 | Z176: 2.94 | AA176: -4.0000000000000001e-003 | AB176: -1.1599999999999999e-002 | AC176: -6.0999999999999999e-002 | AD176: -6.3799999999999996e-002 | AE176: 88.05 | AF176: 88.97 | AG176: 0.58 | AH176: A+ | AI176: 7.2099999999999997e-002 | AJ176: =H176+100*O176 -> 148.08100000000002 | AK176: 146.6 | AL176: 176 | AM176: 57.6 | AN176: 211 | AO176: -7.400000000000001e-002 | AP176: 20 | AQ176: 联得转债!
A177: 223 | B177: 110067 | C177: 华安转债! | D177: 600909 | E177: 华安证券 | F177: 金融 | G177: 证券行业 | H177: 112.44 | I177: 6.9999999999999993e-003 | J177: -8.5000000000000006e-003 | K177: 5.36 | L177: -3.7000000000000002e-003 | M177: 110.3 | N177: 6.22 | O177: 0.30499999999999999 | P177: 86.17 | Q177: 转股中 | R177: 4.45年 | S177: 无权 | T177: 28 | U177: 5.8 | V177: 2.e-003 | W177: 0.111 | X177: 9.6000000000000002e-002 | Y177: 252 | Z177: 1.38 | AA177: -4.4000000000000003e-003 | AB177: -8.6e-003 | AC177: 无权 | AD177: 无权 | AE177: 无权 | AF177: 95.62 | AG177: 0.4 | AH177: AAA | AI177: 3.3099999999999997e-002 | AJ177: =H177+100*O177 -> 142.94 | AK177: 138.7 | AL177: 114 | AM177: 43.1 | AN177: 105 | AO177: -4.2999999999999997e-002 | AP177: 28 | AQ177: 华安转债!
A178: 58 | B178: 123105 | C178: 拓尔转债! | D178: 300229 | E178: 拓尔思 | F178: 计算机及 | G178: 软件开发 | H178: 123.898 | I178: 3.32e-002 | J178: 1.e-004 | K178: 9.79 | L178: 5.3800000000000001e-002 | M178: 121 | N178: 9.96 | O178: 0.26000000000000001 | P178: 98.29 | Q178: 转股中 | R178: 5.46年 | S178: 3.47年 | T178: 8 | U178: 19 | V178: 1.9e-002 | W178: 0.114 | X178: 0.11199999999999999 | Y178: 70 | Z178: 3.21 | AA178: -4.4000000000000003e-003 | AB178: -1.09e-002 | AC178: -4.7699999999999992e-002 | AD178: -4.9599999999999998e-002 | AE178: 83.58 | AF178: 87.49 | AG178: 0.62 | AH178: AA- | AI178: 6.25e-002 | AJ178: =H178+100*O178 -> 149.898 | AK178: 149.5 | AL178: 201 | AM178: 62 | AN178: 234 | AO178: -8.1000000000000003e-002 | AP178: 8 | AQ178: 拓尔转债!
A179: 69 | B179: 123098 | C179: 一品转债! | D179: 300723 | E179: 一品红 | F179: 医药 | G179: 医药行业 | H179: 127 | I179: 1.6e-002 | J179: 2.0400000000000001e-002 | K179: 30.46 | L179: 5.0300000000000004e-002 | M179: 124 | N179: 25.48 | O179: 6.2e-002 | P179: 119.54 | Q179: 转股中 | R179: 5.33年 | S179: 3.33年 | T179: 4.25 | U179: 16 | V179: 2.8999999999999998e-002 | W179: 4.8000000000000001e-002 | X179: 5.7999999999999996e-002 | Y179: 88 | Z179: 5.95 | AA179: -4.5999999999999999e-003 | AB179: -1.2e-002 | AC179: -5.6299999999999996e-002 | AD179: -5.8200000000000002e-002 | AE179: 84.27 | AF179: 90.39 | AG179: 0.72 | AH179: AA- | AI179: 6.25e-002 | AJ179: =H179+100*O179 -> 133.19999999999999 | AK179: 134.5 | AL179: 66 | AM179: 44.1 | AN179: 112 | AO179: -6.7000000000000004e-002 | AP179: 8 | AQ179: 一品转债!
A180: 68 | B180: 123099 | C180: 普利转债 | D180: 300630 | E180: 普利制药 | F180: 医药 | G180: 化学制药 | H180: 126.506 | I180: 1.4499999999999999e-002 | J180: -1.9699999999999999e-002 | K180: 46.15 | L180: -8.6e-003 | M180: 123.5 | N180: 46.03 | O180: 0.26200000000000001 | P180: 100.26 | Q180: 转股中 | R180: 5.36年 | S180: 3.36年 | T180: 8.5 | U180: 14 | V180: 1.3000000000000001e-002 | W180: 4.2000000000000003e-002 | X180: 4.2000000000000003e-002 | Y180: 202 | Z180: 9.19 | AA180: -4.5999999999999999e-003 | AB180: -1.18e-002 | AC180: -5.4900000000000004e-002 | AD180: -5.6799999999999996e-002 | AE180: 84.04 | AF180: 89.82 | AG180: 0.61 | AH180: AA- | AI180: 6.25e-002 | AJ180: =H180+100*O180 -> 152.70600000000002 | AK180: 152.8 | AL180: 229 | AM180: 62.9 | AN180: 245 | AO180: 0.10000000000000001 | AP180: 5 | AQ180: 普利转债
A181: 95 | B181: 113043 | C181: 财通转债! | D181: 601108 | E181: 财通证券 | F181: 金融 | G181: 证券行业 | H181: 113.05 | I181: 1.11e-002 | J181: -1.04e-002 | K181: 10.81 | L181: 1.9e-003 | M181: 110.2 | N181: 13.13 | O181: 0.373 | P181: 82.33 | Q181: 转股中 | R181: 5.19年 | S181: 无权 | T181: 38 | U181: 11 | V181: 3.0000000000000001e-003 | W181: 9.8000000000000004e-002 | X181: 8.1000000000000003e-002 | Y181: 388 | Z181: 1.7 | AA181: -5.0000000000000001e-003 | AB181: -8.6e-003 | AC181: 无权 | AD181: 无权 | AE181: 无权 | AF181: 92.65 | AG181: 0.4 | AH181: AAA | AI181: 3.4500000000000003e-002 | AJ181: =H181+100*O181 -> 150.34999999999999 | AK181: 143.8 | AL181: 161 | AM181: 51.1 | AN181: 168 | AO181: -3.1e-002 | AP181: 11 | AQ181: 财通转债!
A182: 17 | B182: 127041 | C182: 弘亚转债 | D182: 2833 | E182: 弘亚数控 | F182: 机械装备 | G182: 专用设备 | H182: 122.02 | I182: 4.4000000000000003e-003 | J182: 7.9000000000000008e-003 | K182: 33.5 | L182: 2.4500000000000001e-002 | M182: 118.75 | N182: 38.09 | O182: 0.38700000000000001 | P182: 87.95 | Q182: 3月19天 | R182: 4.78年 | S182: 2.78年 | T182: 6 | U182: 4.3 | V182: 6.0000000000000001e-003 | W182: 5.9000000000000004e-002 | X182: 5.2000000000000005e-002 | Y182: 102 | Z182: 5.51 | AA182: -5.6999999999999993e-003 | AB182: -1.2500000000000001e-002 | AC182: -5.7699999999999994e-002 | AD182: -5.9200000000000003e-002 | AE182: 86.16 | AF182: 89.81 | AG182: 0.5 | AH182: AA- | AI182: 6.1100000000000002e-002 | AJ182: =H182+100*O182 -> 160.72 | AK182: 156.1 | AL182: 254 | AM182: 66.3 | AN182: 266 | AO182: -0.13400000000000001 | AP182: 4 | AQ182: 弘亚转债
A183: 85 | B183: 128142 | C183: 新乳转债! | D183: 2946 | E183: 新乳业 | F183: 食品饮料 | G183: 乳制品 | H183: 118.598 | I183: 1.44e-002 | J183: -1.5700000000000002e-002 | K183: 15.3 | L183: -3.3e-003 | M183: 115.1 | N183: 18.47 | O183: 0.43200000000000005 | P183: 82.84 | Q183: 转股中 | R183: 5.22年 | S183: 3.22年 | T183: 7.18 | U183: 9.5 | V183: 1.1000000000000001e-002 | W183: 5.4000000000000006e-002 | X183: 4.4999999999999998e-002 | Y183: 133 | Z183: 5.2 | AA183: -5.7999999999999996e-003 | AB183: -1.09e-002 | AC183: -3.95e-002 | AD183: -4.1399999999999999e-002 | AE183: 90.41 | AF183: 93.5 | AG183: 0.4 | AH183: AA | AI183: 4.1500000000000002e-002 | AJ183: =H183+100*O183 -> 161.798 | AK183: 154.4 | AL183: 240 | AM183: 60.9 | AN183: 230 | AO183: 3.6000000000000004e-002 | AP183: 4 | AQ183: 新乳转债!
A184: 203 | B184: 123050 | C184: 聚飞转债! | D184: 300303 | E184: 聚飞光电 | F184: 电子 | G184: LED制 | H184: 127.166 | I184: 1.2500000000000001e-002 | J184: 1.e-002 | K184: 5.75 | L184: 3.4200000000000001e-002 | M184: 123.8 | N184: 5.08 | O184: 0.12300000000000001 | P184: 113.19 | Q184: 转股中 | R184: 4.54年 | S184: 2.54年 | T184: 3.75 | U184: 69 | V184: 0.14400000000000002 | W184: 4.9000000000000002e-002 | X184: 5.5e-002 | Y184: 77 | Z184: 3.1 | AA184: -6.0000000000000001e-003 | AB184: -1.47e-002 | AC184: -7.3300000000000004e-002 | AD184: -7.5600000000000001e-002 | AE184: 88.51 | AF184: 95.17 | AG184: 0.66 | AH184: AA- | AI184: 6.1100000000000002e-002 | AJ184: =H184+100*O184 -> 139.46600000000001 | AK184: 141.1 | AL184: 134 | AM184: 46 | AN184: 134 | AO184: -5.9000000000000004e-002 | AP184: 13 | AQ184: 聚飞转债!
A185: 65 | B185: 128144 | C185: 利民转债! | D185: 2734 | E185: 利民股份 | F185: 化工 | G185: 农化 | H185: 117.88 | I185: 1.6200000000000003e-002 | J185: -1.37e-002 | K185: 11 | L185: 4.5999999999999999e-003 | M185: 114.1 | N185: 11.5 | O185: 0.23199999999999998 | P185: 95.65 | Q185: 转股中 | R185: 5.42年 | S185: 3.42年 | T185: 9.8 | U185: 7.6 | V185: 6.9999999999999993e-003 | W185: 0.23899999999999999 | X185: 0.22899999999999998 | Y185: 41 | Z185: 1.62 | AA185: -6.0999999999999995e-003 | AB185: -1.0700000000000001e-002 | AC185: -3.7599999999999995e-002 | AD185: -3.9100000000000003e-002 | AE185: 89.01 | AF185: 91.87 | AG185: 0.55 | AH185: AA | AI185: 4.1500000000000002e-002 | AJ185: =H185+100*O185 -> 141.07999999999998 | AK185: 140.1 | AL185: 126 | AM185: 48.2 | AN185: 147 | AO185: -3.7999999999999999e-002 | AP185: 6 | AQ185: 利民转债!
A186: 202 | B186: 113577 | C186: 春秋转债! | D186: 603890 | E186: 春秋电子 | F186: 电子 | G186: 电子产品 | H186: 121.13 | I186: 2.5499999999999998e-002 | J186: -1.7399999999999999e-002 | K186: 11.47 | L186: 1.24e-002 | M186: 117.7 | N186: 10.85 | O186: 0.14599999999999999 | P186: 105.71 | Q186: 转股中 | R186: 4.54年 | S186: 2.54年 | T186: 1.78 | U186: 16 | V186: 7.5999999999999998e-002 | W186: 3.5000000000000003e-002 | X186: 3.7000000000000005e-002 | Y186: 50 | Z186: 2.34 | AA186: -6.4000000000000003e-003 | AB186: -1.32e-002 | AC186: -5.6600000000000004e-002 | AD186: -5.9000000000000004e-002 | AE186: 88.41 | AF186: 90.49 | AG186: 0.65 | AH186: AA- | AI186: 6.1100000000000002e-002 | AJ186: =H186+100*O186 -> 135.72999999999999 | AK186: 136.5 | AL186: 93 | AM186: 46.1 | AN186: 135 | AO186: -5.5999999999999994e-002 | AP186: 17 | AQ186: 春秋转债!
A187: 300 | B187: 110056 | C187: 亨通转债! | D187: 600487 | E187: 亨通光电 | F187: 通信互联 | G187: 通信设备 | H187: 116.91 | I187: 1.0800000000000001e-002 | J187: -1.8e-003 | K187: 13.8 | L187: 2.3e-002 | M187: 114.3 | N187: 14.95 | O187: 0.26700000000000002 | P187: 92.31 | Q187: 转股中 | R187: 3.46年 | S187: 1.47年 | T187: 17.1 | U187: 14 | V187: 6.9999999999999993e-003 | W187: 5.2000000000000005e-002 | X187: 4.8000000000000001e-002 | Y187: 326 | Z187: 1.62 | AA187: -6.6e-003 | AB187: -1.3999999999999999e-002 | AC187: -7.6399999999999996e-002 | AD187: -7.9399999999999998e-002 | AE187: 97.22 | AF187: 101.67 | AG187: 0.39 | AH187: AA+ | AI187: 3.5099999999999999e-002 | AJ187: =H187+100*O187 -> 143.61000000000001 | AK187: 141.5 | AL187: 139 | AM187: 39.8 | AN187: 80 | AO187: 2.9999999999999999e-002 | AP187: 26 | AQ187: 亨通转债!
A188: 241 | B188: 128091 | C188: 新天转债 | D188: 2873 | E188: 新天药业 | F188: 医药 | G188: 中药 | H188: 122.72 | I188: 1.83e-002 | J188: 4.0999999999999995e-003 | K188: 17.42 | L188: 3.32e-002 | M188: 119.4 | N188: 16.27 | O188: 0.14599999999999999 | P188: 107.07 | Q188: 转股中 | R188: 4.25年 | S188: 2.25年 | T188: 1.76 | U188: 14 | V188: 6.3e-002 | W188: 8.5999999999999993e-002 | X188: 9.1999999999999998e-002 | Y188: 20 | Z188: 2.48 | AA188: -6.6e-003 | AB188: -1.44e-002 | AC188: -6.5299999999999997e-002 | AD188: -6.8499999999999991e-002 | AE188: 88.54 | AF188: 89.59 | AG188: 0.68 | AH188: A+ | AI188: 7.2099999999999997e-002 | AJ188: =H188+100*O188 -> 137.31999999999999 | AK188: 138.4 | AL188: 110 | AM188: 48.8 | AN188: 152 | AO188: -1.1000000000000001e-002 | AP188: 20 | AQ188: 新天转债
A189: 24 | B189: 113050 | C189: 南银转债 | D189: 601009 | E189: 南京银行 | F189: 金融 | G189: 银行行业 | H189: 115.41 | I189: 1.6000000000000001e-003 | J189: -6.3e-003 | K189: 9.05 | L189: -9.7999999999999997e-003 | M189: 111.2 | N189: 10.1 | O189: 0.28800000000000003 | P189: 89.6 | Q189: 2月22天 | R189: 5.71年 | S189: 无权 | T189: 200 | U189: 103 | V189: 4.0000000000000001e-003 | W189: 0.221 | X189: 0.19800000000000001 | Y189: 906 | Z189: 0.89 | AA189: -6.6e-003 | AB189: -1.01e-002 | AC189: 无权 | AD189: 无权 | AE189: 无权 | AF189: 91.89 | AG189: 0.49 | AH189: AAA | AI189: 3.4500000000000003e-002 | AJ189: =H189+100*O189 -> 144.21000000000001 | AK189: 141.2 | AL189: 136 | AM189: 49.3 | AN189: 155 | AO189: -3.5000000000000003e-002 | AP189: 6 | AQ189: 南银转债
A190: 264 | B190: 128079 | C190: 英联转债! | D190: 2846 | E190: 英联股份 | F190: 造纸包装 | G190: 包装材料 | H190: 120.688 | I190: 5.6999999999999993e-003 | J190: 2.5999999999999999e-003 | K190: 7.27 | L190: 1.54e-002 | M190: 117.5 | N190: 8.29 | O190: 0.376 | P190: 87.7 | Q190: 转股中 | R190: 4年20天 | S190: 2年21天 | T190: 1.52 | U190: 11 | V190: 5.9999999999999998e-002 | W190: 6.6000000000000003e-002 | X190: 5.7999999999999996e-002 | Y190: 23 | Z190: 2.94 | AA190: -6.7000000000000002e-003 | AB190: -1.4199999999999999e-002 | AC190: -6.6799999999999998e-002 | AD190: -6.9699999999999998e-002 | AE190: 88.97 | AF190: 89.22 | AG190: 0.54 | AH190: A+ | AI190: 7.2099999999999997e-002 | AJ190: =H190+100*O190 -> 158.28800000000001 | AK190: 153.7 | AL190: 235 | AM190: 64.5 | AN190: 258 | AO190: -4.4000000000000004e-002 | AP190: 17 | AQ190: 英联转债!
A191: 177 | B191: 123057 | C191: 美联转债! | D191: 300586 | E191: 美联新材 | F191: 化工 | G191: 橡胶塑料 | H191: 121.7 | I191: 3.27e-002 | J191: -2.75e-002 | K191: 9.05 | L191: 8.8999999999999999e-003 | M191: 117.8 | N191: 9.5 | O191: 0.27800000000000002 | P191: 95.26 | Q191: 转股中 | R191: 4.75年 | S191: 2.75年 | T191: 2.07 | U191: 28 | V191: 0.114 | W191: 4.4000000000000004e-002 | X191: 4.0999999999999995e-002 | Y191: 47 | Z191: 3.95 | AA191: -6.9999999999999993e-003 | AB191: -1.3500000000000002e-002 | AC191: -5.3800000000000001e-002 | AD191: -5.5999999999999994e-002 | AE191: 87.4 | AF191: 89.44 | AG191: 0.58 | AH191: AA- | AI191: 6.1100000000000002e-002 | AJ191: =H191+100*O191 -> 149.5 | AK191: 148.1 | AL191: 194 | AM191: 58.7 | AN191: 220 | AO191: -0.11199999999999999 | AP191: 20 | AQ191: 美联转债!
A192: 337 | B192: 128040 | C192: 华通转债! | D192: 2758 | E192: 浙农股份 | F192: 医药 | G192: 医药商业 | H192: 113.5 | I192: 5.5000000000000005e-003 | J192: 1.1999999999999999e-003 | K192: 9.66 | L192: 1.5800000000000002e-002 | M192: 111.3 | N192: 10.15 | O192: 0.193 | P192: 95.17 | Q192: 转股中 | R192: 2.70年 | S192: 0.71年 | T192: 2.22 | U192: 2.8 | V192: 1.1000000000000001e-002 | W192: 4.7e-002 | X192: 4.4999999999999998e-002 | Y192: 47 | Z192: 1.54 | AA192: -7.3000000000000001e-003 | AB192: -1.49e-002 | AC192: -0.121 | AD192: -0.124 | AE192: 98.55 | AF192: 100.76 | AG192: 0.43 | AH192: AA | AI192: 3.8100000000000002e-002 | AJ192: =H192+100*O192 -> 132.80000000000001 | AK192: 131.8 | AL192: 41 | AM192: 31.1 | AN192: 27 | AO192: -6.0000000000000001e-003 | AP192: 32 | AQ192: 华通转债!
A193: 28 | B193: 123116 | C193: 万兴转债 | D193: 300624 | E193: 万兴科技 | F193: 计算机及 | G193: 软件开发 | H193: 126.52 | I193: 2.2000000000000002e-002 | J193: 1.9799999999999998e-002 | K193: 50.98 | L193: 5.9900000000000002e-002 | M193: 121.4 | N193: 49.78 | O193: 0.23499999999999999 | P193: 102.41 | Q193: 2月17天 | R193: 5.69年 | S193: 3.69年 | T193: 3.79 | U193: 132 | V193: 0.27399999999999997 | W193: 5.7000000000000002e-002 | X193: 5.9000000000000004e-002 | Y193: 66 | Z193: 7.87 | AA193: -7.4000000000000003e-003 | AB193: -1.37e-002 | AC193: -4.9200000000000001e-002 | AD193: -5.1200000000000002e-002 | AE193: 79.59 | AF193: 81.82 | AG193: 0.7 | AH193: A+ | AI193: 7.3499999999999996e-002 | AJ193: =H193+100*O193 -> 150.01999999999998 | AK193: 150.6 | AL193: 211 | AM193: 68.8 | AN193: 282 | AO193: 4.7e-002 | AP193: 6 | AQ193: 万兴转债
A194: 76 | B194: 113618 | C194: 美诺转债! | D194: 603538 | E194: 美诺华 | F194: 医药 | G194: 原料药 | H194: 119.99 | I194: 1.49e-002 | J194: 4.8999999999999998e-003 | K194: 34.48 | L194: 3.2300000000000002e-002 | M194: 115.3 | N194: 37.47 | O194: 0.30399999999999999 | P194: 92.02 | Q194: 转股中 | R194: 5.29年 | S194: 3.29年 | T194: 5.2 | U194: 18 | V194: 2.8999999999999998e-002 | W194: 0.10099999999999999 | X194: 9.3000000000000013e-002 | Y194: 52 | Z194: 3.11 | AA194: -7.7000000000000002e-003 | AB194: -1.2699999999999999e-002 | AC194: -4.1399999999999999e-002 | AD194: -4.3400000000000001e-002 | AE194: 84.37 | AF194: 84.25 | AG194: 0.61 | AH194: AA- | AI194: 6.25e-002 | AJ194: =H194+100*O194 -> 150.38999999999999 | AK194: 148 | AL194: 192 | AM194: 63.6 | AN194: 252 | AO194: 4.2999999999999997e-002 | AP194: 5 | AQ194: 美诺转债!
A195: 249 | B195: 110063 | C195: 鹰19转债 | D195: 600567 | E195: 山鹰国际 | F195: 造纸包装 | G195: 包装用纸 | H195: 119.7 | I195: 1.24e-002 | J195: -1.5700000000000002e-002 | K195: 3.42 | L195: -5.7999999999999996e-003 | M195: 115.9 | N195: 3.26 | O195: 0.14099999999999999 | P195: 104.91 | Q195: 转股中 | R195: 4.20年 | S195: 2.20年 | T195: 18.4 | U195: 16 | V195: 6.9999999999999993e-003 | W195: 0.11699999999999999 | X195: 0.12300000000000001 | Y195: 158 | Z195: 0.99 | AA195: -7.8000000000000005e-003 | AB195: -1.44e-002 | AC195: -6.1100000000000002e-002 | AD195: -6.3500000000000001e-002 | AE195: 95.21 | AF195: 100.56 | AG195: 0.56 | AH195: AA+ | AI195: 3.5099999999999999e-002 | AJ195: =H195+100*O195 -> 133.80000000000001 | AK195: 134.5 | AL195: 67 | AM195: 33.9 | AN195: 42 | AO195: -5.9000000000000004e-002 | AP195: 31 | AQ195: 鹰19转债
A196: 159 | B196: 110073 | C196: 国投转债 | D196: 600061 | E196: 国投资本 | F196: 金融 | G196: 证券行业 | H196: 115.11 | I196: 1.e-003 | J196: -6.9999999999999993e-003 | K196: 8.8 | L196: -1.3500000000000002e-002 | M196: 110.3 | N196: 9.9 | O196: 0.29499999999999998 | P196: 88.89 | Q196: 转股中 | R196: 4.81年 | S196: 无权 | T196: 80 | U196: 36 | V196: 4.0000000000000001e-003 | W196: 0.14099999999999999 | X196: 0.126 | Y196: 565 | Z196: 1.29 | AA196: -8.8999999999999999e-003 | AB196: -1.2800000000000001e-002 | AC196: 无权 | AD196: 无权 | AE196: 无权 | AF196: 94.49 | AG196: 0.45 | AH196: AAA | AI196: 3.3099999999999997e-002 | AJ196: =H196+100*O196 -> 144.61000000000001 | AK196: 141.3 | AL196: 137 | AM196: 46.8 | AN196: 140 | AO196: -5.7999999999999996e-002 | AP196: 25 | AQ196: 国投转债
A197: 133 | B197: 128133 | C197: 奇正转债! | D197: 2287 | E197: 奇正藏药 | F197: 医药 | G197: 中药 | H197: 122.12 | I197: 3.4000000000000002e-002 | J197: 2.12e-002 | K197: 33.98 | L197: 8.2500000000000004e-002 | M197: 116.9 | N197: 29.78 | O197: 7.0000000000000007e-002 | P197: 114.1 | Q197: 转股中 | R197: 4.98年 | S197: 2.98年 | T197: 8 | U197: 95 | V197: 9.8000000000000004e-002 | W197: 4.4000000000000004e-002 | X197: 5.0999999999999997e-002 | Y197: 180 | Z197: 5.47 | AA197: -8.8999999999999999e-003 | AB197: -1.4800000000000001e-002 | AC197: -5.1900000000000002e-002 | AD197: -5.3800000000000001e-002 | AE197: 91.47 | AF197: 96.47 | AG197: 0.67 | AH197: AA | AI197: 4.0099999999999997e-002 | AJ197: =H197+100*O197 -> 129.12 | AK197: 130.1 | AL197: 34 | AM197: 33.7 | AN197: 41 | AO197: 7.0999999999999994e-002 | AP197: 18 | AQ197: 奇正转债!
A198: 326 | B198: 113516 | C198: 苏农转债! | D198: 603323 | E198: 苏农银行 | F198: 金融 | G198: 银行行业 | H198: 116.21 | I198: 1.26e-002 | J198: -1.5900000000000001e-002 | K198: 5.2 | L198: -7.6e-003 | M198: 113.3 | N198: 5.37 | O198: 0.20000000000000001 | P198: 96.83 | Q198: 转股中 | R198: 2.84年 | S198: 无权 | T198: 12.9 | U198: 5.5 | V198: 4.0000000000000001e-003 | W198: 0.13699999999999998 | X198: 0.13300000000000001 | Y198: 94 | Z198: 0.76 | AA198: -9.0000000000000011e-003 | AB198: -1.7399999999999999e-002 | AC198: 无权 | AD198: 无权 | AE198: 无权 | AF198: 103.44 | AG198: 0.42 | AH198: AA+ | AI198: 3.3099999999999997e-002 | AJ198: =H198+100*O198 -> 136.20999999999998 | AK198: 135.6 | AL198: 80 | AM198: 32.1 | AN198: 31 | AO198: 6.0000000000000001e-003 | AP198: 27 | AQ198: 苏农转债!
A199: 141 | B199: 113602 | C199: 景20转债! | D199: 603228 | E199: 景旺电子 | F199: 电子 | G199: 元器件制 | H199: 117.94 | I199: -1.06e-002 | J199: 8.5000000000000006e-003 | K199: 24.41 | L199: -4.5000000000000005e-003 | M199: 112.9 | N199: 27.4 | O199: 0.32400000000000001 | P199: 89.09 | Q199: 转股中 | R199: 4.90年 | S199: 2.90年 | T199: 17.8 | U199: 39 | V199: 1.8000000000000002e-002 | W199: 8.5999999999999993e-002 | X199: 7.5999999999999998e-002 | Y199: 208 | Z199: 3.2 | AA199: -9.0000000000000011e-003 | AB199: -1.37e-002 | AC199: -4.2300000000000004e-002 | AD199: -4.4299999999999999e-002 | AE199: 91.75 | AF199: 93.47 | AG199: 0.47 | AH199: AA | AI199: 4.0099999999999997e-002 | AJ199: =H199+100*O199 -> 150.34 | AK199: 146.8 | AL199: 182 | AM199: 53.3 | AN199: 183 | AO199: -3.7000000000000005e-002 | AP199: 9 | AQ199: 景20转债!
A200: 20 | B200: 127039 | C200: 北港转债 | D200: 582 | E200: 北部湾港 | F200: 机场高速 | G200: 港口 | H200: 118.95 | I200: 9.7000000000000003e-003 | J200: -8.3000000000000001e-003 | K200: 8.03 | L200: 2.5000000000000001e-003 | M200: 113 | N200: 8.35 | O200: 0.23699999999999999 | P200: 96.17 | Q200: 3月7天 | R200: 5.74年 | S200: 3.75年 | T200: 30 | U200: 16 | V200: 4.0000000000000001e-003 | W200: 0.22899999999999998 | X200: 0.22 | Y200: 131 | Z200: 1.24 | AA200: -9.0000000000000011e-003 | AB200: -1.3100000000000001e-002 | AC200: -3.5200000000000002e-002 | AD200: -3.6799999999999999e-002 | AE200: 90.73 | AF200: 93.31 | AG200: 0.55 | AH200: AAA | AI200: 3.4500000000000003e-002 | AJ200: =H200+100*O200 -> 142.65000000000001 | AK200: 141.7 | AL200: 143 | AM200: 48.4 | AN200: 149 | AO200: -2.8999999999999998e-002 | AP200: 5 | AQ200: 北港转债
A201: 52 | B201: 127031 | C201: 洋丰转债! | D201: 902 | E201: 新洋丰 | F201: 化工 | G201: 农化 | H201: 123 | I201: 2.5699999999999997e-002 | J201: -1.8000000000000002e-002 | K201: 17.7 | L201: 1.67e-002 | M201: 117.1 | N201: 19.94 | O201: 0.38600000000000001 | P201: 88.77 | Q201: 8天 | R201: 5.48年 | S201: 3.48年 | T201: 10 | U201: 62 | V201: 5.0000000000000003e-002 | W201: 4.2999999999999997e-002 | X201: 3.7999999999999999e-002 | Y201: 231 | Z201: 3.13 | AA201: -9.1000000000000004e-003 | AB201: -1.4499999999999999e-002 | AC201: -4.6300000000000001e-002 | AD201: -4.8099999999999997e-002 | AE201: 89.44 | AF201: 94.09 | AG201: 0.46 | AH201: AA | AI201: 4.1500000000000002e-002 | AJ201: =H201+100*O201 -> 161.59999999999999 | AK201: 157.2 | AL201: 265 | AM201: 63.1 | AN201: 247 | AO201: -0.159 | AP201: 4 | AQ201: 洋丰转债!
A202: 238 | B202: 127015 | C202: 希望转债!! | D202: 876 | E202: 新 希 望 | F202: 农业 | G202: 畜牧业 | H202: 114.418 | I202: 3.27e-002 | J202: -3.2000000000000001e-002 | K202: 14.76 | L202: 2.7000000000000001e-003 | M202: 110 | N202: 19.75 | O202: 0.53100000000000003 | P202: 74.73 | Q202: 转股中 | R202: 4.26年 | S202: 2.26年 | T202: 9.5 | U202: 205 | V202: 0.192 | W202: 1.3999999999999999e-002 | X202: 1.1000000000000001e-002 | Y202: 665 | Z202: 1.99 | AA202: -9.3999999999999986e-003 | AB202: -1.3600000000000001e-002 | AC202: -4.4000000000000004e-002 | AD202: -4.5999999999999999e-002 | AE202: 94.93 | AF202: 95.99 | AG202: 0.23 | AH202: AAA | AI202: 3.3099999999999997e-002 | AJ202: =H202+100*O202 -> 167.518 | AK202: 154.1 | AL202: 237 | AM202: 58.1 | AN202: 216 | AO202: 0.17899999999999999 | AP202: 28 | AQ202: 希望转债!!
A203: 297 | B203: 127012 | C203: 招路转债! | D203: 1965 | E203: 招商公路 | F203: 机场高速 | G203: 高速 | H203: 111.5 | I203: 1.8e-003 | J203: -8.0000000000000004e-004 | K203: 7.53 | L203: 2.7000000000000001e-003 | M203: 107.9 | N203: 8.63 | O203: 0.27800000000000002 | P203: 87.25 | Q203: 转股中 | R203: 3.47年 | S203: 1.48年 | T203: 50 | U203: 6.3 | V203: 1.e-003 | W203: 0.107 | X203: 9.4e-002 | Y203: 465 | Z203: 0.93 | AA203: -9.4999999999999998e-003 | AB203: -1.37e-002 | AC203: -5.5099999999999996e-002 | AD203: -5.6900000000000006e-002 | AE203: 96.39 | AF203: 96.51 | AG203: 0.38 | AH203: AAA | AI203: 3.3099999999999997e-002 | AJ203: =H203+100*O203 -> 139.30000000000001 | AK203: 135.7 | AL203: 84 | AM203: 39.2 | AN203: 74 | AO203: -6.0000000000000001e-003 | AP203: 29 | AQ203: 招路转债!
A204: 111 | B204: 127025 | C204: 冀东转债! | D204: 401 | E204: 冀东水泥 | F204: 建筑 | G204: 水泥 | H204: 116.004 | I204: 2.64e-002 | J204: -2.58e-002 | K204: 12.87 | L204: 1.6000000000000001e-003 | M204: 110.1 | N204: 15.28 | O204: 0.377 | P204: 84.23 | Q204: 转股中 | R204: 5年35天 | S204: 3年36天 | T204: 17.8 | U204: 44 | V204: 2.2000000000000002e-002 | W204: 9.8000000000000004e-002 | X204: 8.199999999999999e-002 | Y204: 182 | Z204: 1.16 | AA204: -1.04e-002 | AB204: -1.3999999999999999e-002 | AC204: -3.6400000000000002e-002 | AD204: -3.7999999999999999e-002 | AE204: 92.15 | AF204: 92.88 | AG204: 0.42 | AH204: AAA | AI204: 3.4500000000000003e-002 | AJ204: =H204+100*O204 -> 153.70400000000001 | AK204: 147.8 | AL204: 190 | AM204: 54.9 | AN204: 198 | AO204: -5.7000000000000002e-002 | AP204: 9 | AQ204: 冀东转债!
A205: 46 | B205: 123109 | C205: 昌红转债 | D205: 300151 | E205: 昌红科技 | F205: 机械装备 | G205: 专用设备 | H205: 128 | I205: 5.0900000000000001e-002 | J205: -2.6099999999999998e-002 | K205: 29.3 | L205: 3.7499999999999999e-002 | M205: 121 | N205: 28.06 | O205: 0.22600000000000001 | P205: 104.42 | Q205: 8天 | R205: 5.50年 | S205: 3.50年 | T205: 4.6 | U205: 152 | V205: 0.26000000000000001 | W205: 3.1e-002 | X205: 3.3000000000000002e-002 | Y205: 147 | Z205: 14.78 | AA205: -1.04e-002 | AB205: -1.6799999999999999e-002 | AC205: -5.57e-002 | AD205: -5.7599999999999998e-002 | AE205: 83.4 | AF205: 87.3 | AG205: 0.66 | AH205: AA- | AI205: 6.25e-002 | AJ205: =H205+100*O205 -> 150.59999999999999 | AK205: 151.6 | AL205: 222 | AM205: 64.3 | AN205: 257 | AO205: 6.3e-002 | AP205: 4 | AQ205: 昌红转债
A206: 32 | B206: 127035 | C206: 濮耐转债 | D206: 2225 | E206: 濮耐股份 | F206: 钢铁 | G206: 钢铁行业 | H206: 120.296 | I206: 3.2599999999999997e-002 | J206: -6.7000000000000002e-003 | K206: 4.65 | L206: 4.2599999999999999e-002 | M206: 114.7 | N206: 4.43 | O206: 0.14599999999999999 | P206: 104.97 | Q206: 2月2天 | R206: 4.65年 | S206: 2.65年 | T206: 6.26 | U206: 39 | V206: 5.2000000000000005e-002 | W206: 0.13300000000000001 | X206: 0.14000000000000001 | Y206: 47 | Z206: 1.56 | AA206: -1.04e-002 | AB206: -1.6e-002 | AC206: -5.2600000000000001e-002 | AD206: -5.4800000000000001e-002 | AE206: 92.64 | AF206: 95.9 | AG206: 0.61 | AH206: AA | AI206: 4.0099999999999997e-002 | AJ206: =H206+100*O206 -> 134.89600000000002 | AK206: 135.6 | AL206: 82 | AM206: 39.7 | AN206: 78 | AO206: -8.1000000000000003e-002 | AP206: 10 | AQ206: 濮耐转债
A207: 54 | B207: 128145 | C207: 日丰转债 | D207: 2953 | E207: 日丰股份 | F207: 家电 | G207: 零部件制 | H207: 122.6 | I207: 3.8199999999999998e-002 | J207: 1.7899999999999999e-002 | K207: 14.97 | L207: 7.6999999999999999e-002 | M207: 115.4 | N207: 13.66 | O207: 0.11900000000000001 | P207: 109.59 | Q207: 转股中 | R207: 5.47年 | S207: 3.48年 | T207: 3.8 | U207: 41 | V207: 8.8000000000000009e-002 | W207: 0.10400000000000001 | X207: 0.114 | Y207: 36 | Z207: 3.35 | AA207: -1.1200000000000002e-002 | AB207: -1.61e-002 | AC207: -4.5199999999999997e-002 | AD207: -4.7100000000000003e-002 | AE207: 83.37 | AF207: 83.38 | AG207: 0.73 | AH207: AA- | AI207: 6.25e-002 | AJ207: =H207+100*O207 -> 134.5 | AK207: 135.6 | AL207: 81 | AM207: 52.2 | AN207: 176 | AO207: 3.7999999999999999e-002 | AP207: 7 | AQ207: 日丰转债
A208: 172 | B208: 128119 | C208: 龙大转债! | D208: 2726 | E208: 龙大肉食 | F208: 食品饮料 | G208: 肉制品 | H208: 126.471 | I208: 1.2e-002 | J208: -1.e-004 | K208: 9.87 | L208: 2.07e-002 | M208: 119.9 | N208: 9.29 | O208: 0.19 | P208: 106.24 | Q208: 转股中 | R208: 4.78年 | S208: 2.79年 | T208: 9.46 | U208: 4.6 | V208: 4.0000000000000001e-003 | W208: 8.900000000000001e-002 | X208: 9.4e-002 | Y208: 106 | Z208: 2.9 | AA208: -1.1299999999999999e-002 | AB208: -1.83e-002 | AC208: -6.6500000000000004e-002 | AD208: -6.8499999999999991e-002 | AE208: 92.17 | AF208: 99.69 | AG208: 0.58 | AH208: AA | AI208: 4.0099999999999997e-002 | AJ208: =H208+100*O208 -> 145.471 | AK208: 146.7 | AL208: 181 | AM208: 47 | AN208: 141 | AO208: -3.2000000000000001e-002 | AP208: 8 | AQ208: 龙大转债!
A209: 169 | B209: 128121 | C209: 宏川转债! | D209: 2930 | E209: 宏川智慧 | F209: 交通运输 | G209: 物流业 | H209: 119.17 | I209: 1.8600000000000002e-002 | J209: 1.18e-002 | K209: 18.26 | L209: 5.1200000000000002e-002 | M209: 112.9 | N209: 19.92 | O209: 0.29999999999999999 | P209: 91.67 | Q209: 转股中 | R209: 4.79年 | S209: 2.80年 | T209: 6.7 | U209: 18 | V209: 2.3e-002 | W209: 8.199999999999999e-002 | X209: 7.5999999999999998e-002 | Y209: 81 | Z209: 4 | AA209: -1.1399999999999999e-002 | AB209: -1.6200000000000003e-002 | AC209: -4.7100000000000003e-002 | AD209: -4.9200000000000001e-002 | AE209: 86.88 | AF209: 85.45 | AG209: 0.59 | AH209: AA- | AI209: 6.1100000000000002e-002 | AJ209: =H209+100*O209 -> 149.17000000000002 | AK209: 146.7 | AL209: 179 | AM209: 59.8 | AN209: 228 | AO209: 5.0000000000000003e-002 | AP209: 5 | AQ209: 宏川转债!
A210: 166 | B210: 127020 | C210: 中金转债! | D210: 60 | E210: 中金岭南 | F210: 有色金属 | G210: 有色行业 | H210: 119.822 | I210: 1.4499999999999999e-002 | J210: -6.8999999999999999e-003 | K210: 5.13 | L210: 1.18e-002 | M210: 113.5 | N210: 4.63 | O210: 8.1000000000000003e-002 | P210: 110.8 | Q210: 转股中 | R210: 4.80年 | S210: 2.80年 | T210: 34.3 | U210: 101 | V210: 2.5000000000000001e-002 | W210: 0.187 | X210: 0.20699999999999999 | Y210: 183 | Z210: 1.54 | AA210: -1.1399999999999999e-002 | AB210: -1.6299999999999999e-002 | AC210: -5.2199999999999996e-002 | AD210: -5.3600000000000002e-002 | AE210: 92.34 | AF210: 96.38 | AG210: 0.64 | AH210: AA+ | AI210: 3.5099999999999999e-002 | AJ210: =H210+100*O210 -> 127.922 | AK210: 128.8 | AL210: 28 | AM210: 32.5 | AN210: 32 | AO210: -0.14300000000000002 | AP210: 20 | AQ210: 中金转债!
A211: 368 | B211: 128014 | C211: 永东转债! | D211: 2753 | E211: 永东股份 | F211: 化工 | G211: 化工 | H211: 112.001 | I211: 1.0700000000000001e-002 | J211: -3.7000000000000002e-003 | K211: 10.28 | L211: 3.73e-002 | M211: 109.8 | N211: 12.52 | O211: 0.36399999999999999 | P211: 82.11 | Q211: 转股中 | R211: 1.55年 | S211: 回售内 | T211: 3.37 | U211: 11 | V211: 2.8999999999999998e-002 | W211: 8.6999999999999994e-002 | X211: 7.2000000000000008e-002 | Y211: 39 | Z211: 1.88 | AA211: -1.29e-002 | AB211: -2.4399999999999998e-002 | AC211: 回售内 | AD211: 回售内 | AE211: 100.3 | AF211: 100.58 | AG211: 0.19 | AH211: AA- | AI211: 5.91e-002 | AJ211: =H211+100*O211 -> 148.40100000000001 | AK211: 141.9 | AL211: 145 | AM211: 41.3 | AN211: 92 | AO211: -0.122 | AP211: 36 | AQ211: 永东转债!
A212: 148 | B212: 113600 | C212: 新星转债! | D212: 603978 | E212: 深圳新星 | F212: 有色金属 | G212: 有色行业 | H212: 133.83 | I212: 7.1199999999999999e-002 | J212: 3.0999999999999999e-003 | K212: 30.82 | L212: 9.9900000000000003e-002 | M212: 125.6 | N212: 23.85 | O212: 3.6000000000000004e-002 | P212: 129.22 | Q212: 转股中 | R212: 4.87年 | S212: 2.87年 | T212: 5.95 | U212: 884 | V212: 1.1100000000000001 | W212: 0.121 | X212: 0.156 | Y212: 49 | Z212: 3.24 | AA212: -1.32e-002 | AB212: -2.1700000000000001e-002 | AC212: -8.1699999999999995e-002 | AD212: -8.3599999999999994e-002 | AE212: 86.6 | AF212: 94.62 | AG212: 0.74 | AH212: AA- | AI212: 6.1100000000000002e-002 | AJ212: =H212+100*O212 -> 137.43000000000001 | AK212: 138.4 | AL212: 112 | AM212: 43.8 | AN212: 110 | AO212: 0.34600000000000003 | AP212: 26 | AQ212: 新星转债!
A213: 94 | B213: 127027 | C213: 靖远转债! | D213: 552 | E213: 靖远煤电 | F213: 煤炭 | G213: 煤炭开采 | H213: 123.399 | I213: 2.98e-002 | J213: 2.3300000000000001e-002 | K213: 3.87 | L213: 7.4999999999999997e-002 | M213: 115.3 | N213: 3.23 | O213: 2.9999999999999999e-002 | P213: 119.81 | Q213: 转股中 | R213: 5.19年 | S213: 3.20年 | T213: 28 | U213: 435 | V213: 0.127 | W213: 0.316 | X213: 0.379 | Y213: 89 | Z213: 1.12 | AA213: -1.32e-002 | AB213: -1.84e-002 | AC213: -5.0599999999999999e-002 | AD213: -5.2600000000000001e-002 | AE213: 92.14 | AF213: 96.09 | AG213: 0.71 | AH213: AA+ | AI213: 3.6499999999999998e-002 | AJ213: =H213+100*O213 -> 126.399 | AK213: 127 | AL213: 20 | AM213: 30.9 | AN213: 26 | AO213: 6.4000000000000001e-002 | AP213: 41 | AQ213: 靖远转债!
A214: 119 | B214: 123074 | C214: 隆利转债!! | D214: 300752 | E214: 隆利科技 | F214: 电子 | G214: 液晶显示 | H214: 132.561 | I214: 1.3500000000000002e-002 | J214: 2.0000000000000001e-004 | K214: 20.29 | L214: 2.06e-002 | M214: 124 | N214: 18.34 | O214: 0.19800000000000001 | P214: 110.63 | Q214: 转股中 | R214: 5年28天 | S214: 3年29天 | T214: 1.48 | U214: 190 | V214: 0.92799999999999994 | W214: 3.6000000000000004e-002 | X214: 4.0000000000000001e-002 | Y214: 41 | Z214: 4.84 | AA214: -1.3300000000000001e-002 | AB214: -2.1000000000000001e-002 | AC214: -7.2900000000000006e-002 | AD214: -7.4999999999999997e-002 | AE214: 85.56 | AF214: 91.76 | AG214: 0.66 | AH214: AA- | AI214: 6.25e-002 | AJ214: =H214+100*O214 -> 152.36100000000002 | AK214: 154.5 | AL214: 242 | AM214: 62.7 | AN214: 241 | AO214: -9.6000000000000002e-002 | AP214: 16 | AQ214: 隆利转债!!
A215: 211 | B215: 113575 | C215: 东时转债!! | D215: 603377 | E215: 东方时尚 | F215: 其他 | G215: 其他 | H215: 120.3 | I215: 6.6e-003 | J215: -4.5000000000000005e-003 | K215: 7.94 | L215: 1.2800000000000001e-002 | M215: 113.1 | N215: 12.15 | O215: 0.84099999999999997 | P215: 65.35 | Q215: 转股中 | R215: 4.52年 | S215: 2.53年 | T215: 0.98 | U215: 17 | V215: 0.14000000000000001 | W215: 1.7000000000000001e-002 | X215: 1.1000000000000001e-002 | Y215: 58 | Z215: 2.77 | AA215: -1.38e-002 | AB215: -1.9e-002 | AC215: -5.5e-002 | AD215: -5.7300000000000004e-002 | AE215: 93.15 | AF215: 95.03 | AG215: 0.16 | AH215: AA | AI215: 4.0099999999999997e-002 | AJ215: =H215+100*O215 -> 204.39999999999998 | AK215: 175.3 | AL215: 314 | AM215: 80.2 | AN215: 310 | AO215: -2.5000000000000001e-002 | AP215: 14 | AQ215: 东时转债!!
A216: 310 | B216: 110051 | C216: 中天转债! | D216: 600522 | E216: 中天科技 | F216: 通信互联 | G216: 通信设备 | H216: 118.85 | I216: 1.44e-002 | J216: -2.5999999999999999e-003 | K216: 9.1 | L216: 3.0600000000000002e-002 | M216: 113.3 | N216: 9.99 | O216: 0.30499999999999999 | P216: 91.09 | Q216: 转股中 | R216: 3.42年 | S216: 1.42年 | T216: 39.6 | U216: 38 | V216: 8.0000000000000002e-003 | W216: 0.14199999999999999 | X216: 0.129 | Y216: 279 | Z216: 1.23 | AA216: -1.4199999999999999e-002 | AB216: -2.1099999999999997e-002 | AC216: -8.8399999999999992e-002 | AD216: -9.1400000000000009e-002 | AE216: 97.39 | AF216: 100.95 | AG216: 0.39 | AH216: AA+ | AI216: 3.5099999999999999e-002 | AJ216: =H216+100*O216 -> 149.34999999999999 | AK216: 146.6 | AL216: 177 | AM216: 45.7 | AN216: 129 | AO216: 3.7000000000000005e-002 | AP216: 27 | AQ216: 中天转债!
A217: 321 | B217: 128048 | C217: 张行转债 | D217: 2839 | E217: 张家港行 | F217: 金融 | G217: 银行行业 | H217: 118.487 | I217: -4.7999999999999996e-003 | J217: -5.6999999999999993e-003 | K217: 5.68 | L217: -2.07e-002 | M217: 113.3 | N217: 5.6 | O217: 0.16800000000000001 | P217: 101.43 | Q217: 转股中 | R217: 3年42天 | S217: 无权 | T217: 25 | U217: 14 | V217: 5.0000000000000001e-003 | W217: 0.24299999999999999 | X217: 0.247 | Y217: 103 | Z217: 0.92 | AA217: -1.46e-002 | AB217: -2.2099999999999998e-002 | AC217: 无权 | AD217: 无权 | AE217: 无权 | AF217: 102 | AG217: 0.51 | AH217: AA+ | AI217: 3.5099999999999999e-002 | AJ217: =H217+100*O217 -> 135.28700000000001 | AK217: 135.5 | AL217: 79 | AM217: 33.5 | AN217: 39 | AO217: -3.7999999999999999e-002 | AP217: 12 | AQ217: 张行转债
A218: 67 | B218: 123100 | C218: 朗科转债 | D218: 300543 | E218: 朗科智能 | F218: 电子 | G218: 电子产品 | H218: 127 | I218: 1.9699999999999999e-002 | J218: -2.0000000000000001e-004 | K218: 13.16 | L218: 2.6499999999999999e-002 | M218: 117.5 | N218: 11.61 | O218: 0.12 | P218: 113.35 | Q218: 转股中 | R218: 5.36年 | S218: 3.36年 | T218: 3.8 | U218: 11 | V218: 2.4e-002 | W218: 0.10800000000000001 | X218: 0.122 | Y218: 35 | Z218: 3.86 | AA218: -1.47e-002 | AB218: -2.0299999999999999e-002 | AC218: -5.5999999999999994e-002 | AD218: -5.79e-002 | AE218: 84.04 | AF218: 85.49 | AG218: 0.73 | AH218: AA- | AI218: 6.25e-002 | AJ218: =H218+100*O218 -> 139. | AK218: 140.6 | AL218: 131 | AM218: 55.2 | AN218: 202 | AO218: -3.3000000000000002e-002 | AP218: 9 | AQ218: 朗科转债
A219: 3 | B219: 123124 | C219: 晶瑞转2 | D219: 300655 | E219: 晶瑞电材 | F219: 电子 | G219: 电子行业 | H219: 121.474 | I219: 7.1999999999999998e-003 | J219: 1.41e-002 | K219: 40.05 | L219: 3.6799999999999999e-002 | M219: 111.2 | N219: 50.31 | O219: 0.52600000000000002 | P219: 79.61 | Q219: 4月23天 | R219: 5.88年 | S219: 3.88年 | T219: 5.23 | U219: 127 | V219: 0.20000000000000001 | W219: 3.7999999999999999e-002 | X219: 3.1e-002 | Y219: 136 | Z219: 9.8 | AA219: -1.5100000000000001e-002 | AB219: -1.8500000000000003e-002 | AC219: -4.0800000000000003e-002 | AD219: -4.2000000000000003e-002 | AE219: 77.2 | AF219: 73.72 | AG219: 0.58 | AH219: A+ | AI219: 7.3499999999999996e-002 | AJ219: =H219+100*O219 -> 174.07400000000001 | AK219: 163.3 | AL219: 292 | AM219: 86.1 | AN219: 318 | AO219: -0.13200000000000001 | AP219: 4 | AQ219: 晶瑞转2
A220: 269 | B220: 128075 | C220: 远东转债! | D220: 2406 | E220: 远东传动 | F220: 汽车 | G220: 零部件制 | H220: 121.541 | I220: 1.4499999999999999e-002 | J220: -7.8000000000000005e-003 | K220: 6 | L220: 1.01e-002 | M220: 114.3 | N220: 5.29 | O220: 7.2000000000000008e-002 | P220: 113.42 | Q220: 转股中 | R220: 3.98年 | S220: 1.98年 | T220: 5.44 | U220: 8.2 | V220: 1.3000000000000001e-002 | W220: 0.14499999999999999 | X220: 0.16500000000000001 | Y220: 37 | Z220: 1.16 | AA220: -1.5600000000000001e-002 | AB220: -2.1899999999999999e-002 | AC220: -7.5499999999999998e-002 | AD220: -7.7699999999999991e-002 | AE220: 94.53 | AF220: 98.01 | AG220: 0.66 | AH220: AA | AI220: 4.0099999999999997e-002 | AJ220: =H220+100*O220 -> 128.74099999999999 | AK220: 129.7 | AL220: 32 | AM220: 31.6 | AN220: 30 | AO220: -7.2000000000000008e-002 | AP220: 16 | AQ220: 远东转债!
A221: 139 | B221: 128130 | C221: 景兴转债 | D221: 2067 | E221: 景兴纸业 | F221: 造纸包装 | G221: 包装用纸 | H221: 123.923 | I221: 3.4000000000000002e-003 | J221: 1.e-004 | K221: 4.13 | L221: 4.8999999999999998e-003 | M221: 114.8 | N221: 3.4 | O221: 2.e-002 | P221: 121.47 | Q221: 转股中 | R221: 4.92年 | S221: 2.92年 | T221: 9.99 | U221: 98 | V221: 7.9000000000000001e-002 | W221: 0.20300000000000001 | X221: 0.24600000000000002 | Y221: 49 | Z221: 0.96 | AA221: -1.5700000000000002e-002 | AB221: -2.0899999999999998e-002 | AC221: -5.7699999999999994e-002 | AD221: -5.9500000000000004e-002 | AE221: 91.59 | AF221: 94.95 | AG221: 0.72 | AH221: AA | AI221: 4.0099999999999997e-002 | AJ221: =H221+100*O221 -> 125.923 | AK221: 126.4 | AL221: 19 | AM221: 31.4 | AN221: 28 | AO221: 3.0000000000000001e-003 | AP221: 19 | AQ221: 景兴转债
A222: 113 | B222: 128137 | C222: 洁美转债 | D222: 2859 | E222: 洁美科技 | F222: 电子 | G222: 元器件制 | H222: 127 | I222: 1.44e-002 | J222: 7.4999999999999997e-003 | K222: 28.5 | L222: 3.2599999999999997e-002 | M222: 117.3 | N222: 27.63 | O222: 0.23100000000000001 | P222: 103.15 | Q222: 转股中 | R222: 5年34天 | S222: 3年35天 | T222: 5.99 | U222: 3.8 | V222: 5.0000000000000001e-003 | W222: 5.0999999999999997e-002 | X222: 5.2999999999999999e-002 | Y222: 117 | Z222: 6.18 | AA222: -1.5800000000000002e-002 | AB222: -2.1600000000000001e-002 | AC222: -6.0499999999999998e-002 | AD222: -6.25e-002 | AE222: 85.37 | AF222: 86.72 | AG222: 0.67 | AH222: AA- | AI222: 6.25e-002 | AJ222: =H222+100*O222 -> 150.09999999999999 | AK222: 150.9 | AL222: 214 | AM222: 64.1 | AN222: 256 | AO222: -5.0000000000000003e-002 | AP222: 4 | AQ222: 洁美转债
A223: 194 | B223: 127017 | C223: 万青转债 | D223: 789 | E223: 万年青 | F223: 建筑 | G223: 水泥 | H223: 127.09 | I223: 8.5000000000000006e-003 | J223: -3.7000000000000002e-003 | K223: 13.27 | L223: 9.8999999999999991e-003 | M223: 118 | N223: 13.46 | O223: 0.28899999999999998 | P223: 98.59 | Q223: 转股中 | R223: 4.67年 | S223: 2.68年 | T223: 10 | U223: 45 | V223: 3.5000000000000003e-002 | W223: 9.4e-002 | X223: 9.3000000000000013e-002 | Y223: 106 | Z223: 1.62 | AA223: -1.6e-002 | AB223: -2.2599999999999999e-002 | AC223: -7.0699999999999999e-002 | AD223: -7.2800000000000004e-002 | AE223: 93.77 | AF223: 100.74 | AG223: 0.49 | AH223: AA+ | AI223: 3.5099999999999999e-002 | AJ223: =H223+100*O223 -> 155.99000000000001 | AK223: 155.6 | AL223: 249 | AM223: 54.9 | AN223: 196 | AO223: -4.9000000000000002e-002 | AP223: 8 | AQ223: 万青转债
A224: 48 | B224: 123108 | C224: 乐普转2 | D224: 300003 | E224: 乐普医疗 | F224: 医药 | G224: 医疗器械 | H224: 119.497 | I224: 3.3e-003 | J224: -6.7000000000000002e-003 | K224: 26.83 | L224: -7.4000000000000003e-003 | M224: 111.1 | N224: 29.5 | O224: 0.314 | P224: 90.95 | Q224: 8天 | R224: 4.49年 | S224: 2.50年 | T224: 16.4 | U224: 9.1 | V224: 5.0000000000000001e-003 | W224: 3.4000000000000002e-002 | X224: 3.1e-002 | Y224: 484 | Z224: 4.26 | AA224: -1.6299999999999999e-002 | AB224: -2.07e-002 | AC224: -5.7800000000000004e-002 | AD224: -5.91e-002 | AE224: 93.13 | AF224: 95.33 | AG224: 0.46 | AH224: AA+ | AI224: 3.5099999999999999e-002 | AJ224: =H224+100*O224 -> 150.89699999999999 | AK224: 148 | AL224: 193 | AM224: 52.7 | AN224: 178 | AO224: 2.1000000000000001e-002 | AP224: 11 | AQ224: 乐普转2
A225: 205 | B225: 110070 | C225: 凌钢转债!! | D225: 600231 | E225: 凌钢股份 | F225: 钢铁 | G225: 炼钢 | H225: 126.38 | I225: 1.1000000000000001e-002 | J225: 2.5099999999999997e-002 | K225: 3.23 | L225: 5.21e-002 | M225: 117.4 | N225: 2.69 | O225: 5.2999999999999999e-002 | P225: 120.07 | Q225: 转股中 | R225: 4.53年 | S225: 2.54年 | T225: 2.17 | U225: 110 | V225: 0.40100000000000002 | W225: 2.4e-002 | X225: 2.7999999999999997e-002 | Y225: 92 | Z225: 1 | AA225: -1.6500000000000001e-002 | AB225: -2.3e-002 | AC225: -7.1099999999999997e-002 | AD225: -7.3499999999999996e-002 | AE225: 93.39 | AF225: 98.62 | AG225: 0.69 | AH225: AA | AI225: 4.0099999999999997e-002 | AJ225: =H225+100*O225 -> 131.68000000000001 | AK225: 132.7 | AL225: 51 | AM225: 34.1 | AN225: 44 | AO225: -0.10400000000000001 | AP225: 23 | AQ225: 凌钢转债!!
A226: 294 | B226: 110057 | C226: 现代转债 | D226: 600420 | E226: 国药现代 | F226: 医药 | G226: 化学制药 | H226: 116.89 | I226: 9.1000000000000004e-003 | J226: -6.8999999999999999e-003 | K226: 9.64 | L226: 4.1999999999999997e-003 | M226: 110.3 | N226: 9.79 | O226: 0.187 | P226: 98.47 | Q226: 转股中 | R226: 3.50年 | S226: 1.50年 | T226: 16.2 | U226: 6.5 | V226: 3.0000000000000001e-003 | W226: 0.16300000000000001 | X226: 0.161 | Y226: 99 | Z226: 1.21 | AA226: -1.6799999999999999e-002 | AB226: -2.2099999999999998e-002 | AC226: -7.4700000000000003e-002 | AD226: -7.7600000000000002e-002 | AE226: 97.41 | AF226: 98.65 | AG226: 0.52 | AH226: AAA | AI226: 3.3099999999999997e-002 | AJ226: =H226+100*O226 -> 135.59 | AK226: 135.3 | AL226: 77 | AM226: 36.7 | AN226: 59 | AO226: -2.8999999999999998e-002 | AP226: 24 | AQ226: 现代转债
A227: 290 | B227: 113024 | C227: 核建转债! | D227: 601611 | E227: 中国核建 | F227: 建筑 | G227: 建筑工程 | H227: 115.93 | I227: -1.6799999999999999e-002 | J227: 8.9999999999999998e-004 | K227: 9.72 | L227: -2.8999999999999998e-002 | M227: 109.3 | N227: 9.7 | O227: 0.157 | P227: 100.21 | Q227: 转股中 | R227: 3.52年 | S227: 1.52年 | T227: 30 | U227: 263 | V227: 7.5999999999999998e-002 | W227: 0.11599999999999999 | X227: 0.11699999999999999 | Y227: 257 | Z227: 2.16 | AA227: -1.6899999999999998e-002 | AB227: -2.1700000000000001e-002 | AC227: -6.93e-002 | AD227: -7.22e-002 | AE227: 97.35 | AF227: 97.7 | AG227: 0.55 | AH227: AAA | AI227: 3.3099999999999997e-002 | AJ227: =H227+100*O227 -> 131.63 | AK227: 131.7 | AL227: 40 | AM227: 34 | AN227: 43 | AO227: -9.0000000000000011e-003 | AP227: 35 | AQ227: 核建转债!
A228: 245 | B228: 113030 | C228: 东风转债! | D228: 601515 | E228: 东风股份 | F228: 造纸包装 | G228: 包装材料 | H228: 125.76 | I228: 2.7099999999999999e-002 | J228: -3.9000000000000003e-003 | K228: 7.35 | L228: 3.5200000000000002e-002 | M228: 116.9 | N228: 6.45 | O228: 0.10400000000000001 | P228: 113.95 | Q228: 转股中 | R228: 4.23年 | S228: 2.23年 | T228: 2.95 | U228: 74 | V228: 0.20199999999999999 | W228: 2.9999999999999999e-002 | X228: 3.4000000000000002e-002 | Y228: 98 | Z228: 2.21 | AA228: -1.7500000000000002e-002 | AB228: -2.4300000000000002e-002 | AC228: -7.9100000000000004e-002 | AD228: -8.1500000000000003e-002 | AE228: 94.19 | AF228: 99.34 | AG228: 0.66 | AH228: AA | AI228: 4.0099999999999997e-002 | AJ228: =H228+100*O228 -> 136.16 | AK228: 137.6 | AL228: 104 | AM228: 38.2 | AN228: 68 | AO228: -3.3000000000000002e-002 | AP228: 19 | AQ228: 东风转债!
A229: 190 | B229: 123052 | C229: 飞鹿转债! | D229: 300665 | E229: 飞鹿股份 | F229: 化工 | G229: 化工 | H229: 137.5 | I229: 3.61e-002 | J229: -4.0000000000000002e-004 | K229: 9.31 | L229: 4.7199999999999999e-002 | M229: 126.8 | N229: 7.05 | O229: 4.0999999999999995e-002 | P229: 132.06 | Q229: 转股中 | R229: 4.68年 | S229: 2.68年 | T229: 1.5 | U229: 161 | V229: 0.78099999999999992 | W229: 9.3000000000000013e-002 | X229: 0.12300000000000001 | Y229: 16 | Z229: 3.21 | AA229: -1.7600000000000001e-002 | AB229: -2.6699999999999998e-002 | AC229: -9.2200000000000004e-002 | AD229: -9.4899999999999998e-002 | AE229: 86.11 | AF229: 92.33 | AG229: 0.75 | AH229: A+ | AI229: 7.2099999999999997e-002 | AJ229: =H229+100*O229 -> 141.59999999999999 | AK229: 142.9 | AL229: 156 | AM229: 50.6 | AN229: 163 | AO229: -8.900000000000001e-002 | AP229: 23 | AQ229: 飞鹿转债!
A230: 10 | B230: 123122 | C230: 富瀚转债 | D230: 300613 | E230: 富瀚微 | F230: 电子 | G230: 芯片制造 | H230: 133.697 | I230: 2.3700000000000002e-002 | J230: -1.8e-003 | K230: 173.58 | L230: 3.2000000000000001e-002 | M230: 120.3 | N230: 177.04 | O230: 0.36399999999999999 | P230: 98.05 | Q230: 4月15天 | R230: 5.85年 | S230: 3.85年 | T230: 5.81 | U230: 49 | V230: 6.4000000000000001e-002 | W230: 2.7999999999999997e-002 | X230: 2.7000000000000003e-002 | Y230: 209 | Z230: 13.92 | AA230: -1.8200000000000001e-002 | AB230: -2.3900000000000001e-002 | AC230: -6.1900000000000004e-002 | AD230: -6.3399999999999998e-002 | AE230: 78.13 | AF230: 80.05 | AG230: 0.68 | AH230: A+ | AI230: 7.3499999999999996e-002 | AJ230: =H230+100*O230 -> 170.09700000000001 | AK230: 169.3 | AL230: 307 | AM230: 89.3 | AN230: 323 | AO230: -0.10000000000000001 | AP230: 4 | AQ230: 富瀚转债
A231: 44 | B231: 113623 | C231: 凤21转债 | D231: 603225 | E231: 新凤鸣 | F231: 化工 | G231: 化纤 | H231: 129.8 | I231: 1.44e-002 | J231: -2.6000000000000002e-002 | K231: 16.66 | L231: -2.e-002 | M231: 117.1 | N231: 16.47 | O231: 0.28300000000000003 | P231: 101.15 | Q231: 14天 | R231: 5.52年 | S231: 3.52年 | T231: 25 | U231: 13 | V231: 4.0000000000000001e-003 | W231: 9.8000000000000004e-002 | X231: 9.9000000000000005e-002 | Y231: 255 | Z231: 1.81 | AA231: -1.8799999999999997e-002 | AB231: -2.41e-002 | AC231: -5.9800000000000006e-002 | AD231: -6.1399999999999996e-002 | AE231: 89.3 | AF231: 93.94 | AG231: 0.58 | AH231: AA | AI231: 4.1500000000000002e-002 | AJ231: =H231+100*O231 -> 158.10000000000002 | AK231: 158.4 | AL231: 273 | AM231: 64.5 | AN231: 259 | AO231: -0.16699999999999998 | AP231: 3 | AQ231: 凤21转债
A232: 299 | B232: 123023 | C232: 迪森转债! | D232: 300335 | E232: 迪森股份 | F232: 能源电力 | G232: 电力供应 | H232: 122 | I232: 4.9000000000000002e-002 | J232: -1.8799999999999997e-002 | K232: 7.54 | L232: 4.58e-002 | M232: 114.3 | N232: 6.89 | O232: 0.115 | P232: 109.43 | Q232: 转股中 | R232: 3.47年 | S232: 2.47年 | T232: 5.29 | U232: 2255. | V232: 3.5 | W232: 0.188 | X232: 0.20600000000000002 | Y232: 28 | Z232: 2.07 | AA232: -1.9e-002 | AB232: -2.6200000000000001e-002 | AC232: -5.7300000000000004e-002 | AD232: -6.0400000000000002e-002 | AE232: 89.71 | AF232: 93.45 | AG232: 0.66 | AH232: AA- | AI232: 6.1100000000000002e-002 | AJ232: =H232+100*O232 -> 133.5 | AK232: 134.6 | AL232: 68 | AM232: 41.1 | AN232: 88 | AO232: 0.192 | AP232: 51 | AQ232: 迪森转债!
A233: 265 | B233: 128078 | C233: 太极转债! | D233: 2368 | E233: 太极股份 | F233: 计算机及 | G233: 软件开发 | H233: 126.193 | I233: 2.18e-002 | J233: -1.95e-002 | K233: 24.04 | L233: 2.5000000000000001e-003 | M233: 116.9 | N233: 22.21 | O233: 0.16600000000000001 | P233: 108.24 | Q233: 转股中 | R233: 4年20天 | S233: 2年21天 | T233: 9.6 | U233: 13 | V233: 1.1000000000000001e-002 | W233: 6.9000000000000006e-002 | X233: 7.4999999999999997e-002 | Y233: 139 | Z233: 4.15 | AA233: -1.9099999999999999e-002 | AB233: -2.6200000000000001e-002 | AC233: -8.6599999999999996e-002 | AD233: -8.9099999999999999e-002 | AE233: 94.84 | AF233: 100.02 | AG233: 0.91 | AH233: AA | AI233: 4.0099999999999997e-002 | AJ233: =H233+100*O233 -> 142.79300000000001 | AK233: 144.1 | AL233: 164 | AM233: 44.1 | AN233: 114 | AO233: -5.2000000000000005e-002 | AP233: 10 | AQ233: 太极转债!
A234: 30 | B234: 127037 | C234: 银轮转债 | D234: 2126 | E234: 银轮股份 | F234: 汽车 | G234: 零部件制 | H234: 128.293 | I234: -1.3100000000000001e-002 | J234: 1.5300000000000001e-002 | K234: 10.18 | L234: 3.9000000000000003e-003 | M234: 115.1 | N234: 10.77 | O234: 0.35700000000000004 | P234: 94.52 | Q234: 2月12天 | R234: 5.68年 | S234: 3.69年 | T234: 7 | U234: 14 | V234: 1.4999999999999999e-002 | W234: 8.6999999999999994e-002 | X234: 8.199999999999999e-002 | Y234: 81 | Z234: 1.93 | AA234: -1.9199999999999998e-002 | AB234: -2.3799999999999998e-002 | AC234: -5.4400000000000004e-002 | AD234: -5.5999999999999994e-002 | AE234: 88.7 | AF234: 91.73 | AG234: 0.54 | AH234: AA | AI234: 4.1500000000000002e-002 | AJ234: =H234+100*O234 -> 163.99299999999999 | AK234: 162.1 | AL234: 284 | AM234: 70.3 | AN234: 291 | AO234: -7.8e-002 | AP234: 3 | AQ234: 银轮转债
A235: 50 | B235: 110079 | C235: 杭银转债! | D235: 600926 | E235: 杭州银行 | F235: 金融 | G235: 银行行业 | H235: 125.01 | I235: 1.4000000000000002e-003 | J235: -2.e-002 | K235: 14.93 | L235: -2.6699999999999998e-002 | M235: 112.4 | N235: 12.99 | O235: 8.8000000000000009e-002 | P235: 114.93 | Q235: 8天 | R235: 5.49年 | S235: 无权 | T235: 150 | U235: 233 | V235: 1.2e-002 | W235: 0.16899999999999998 | X235: 0.19500000000000001 | Y235: 885 | Z235: 1.32 | AA235: -1.95e-002 | AB235: -2.3399999999999997e-002 | AC235: 无权 | AD235: 无权 | AE235: 无权 | AF235: 93.56 | AG235: 0.7 | AH235: AAA | AI235: 3.4500000000000003e-002 | AJ235: =H235+100*O235 -> 133.81 | AK235: 135.1 | AL235: 74 | AM235: 41.5 | AN235: 96 | AO235: 9.0000000000000011e-003 | AP235: 13 | AQ235: 杭银转债!
A236: 82 | B236: 123091 | C236: 长海转债 | D236: 300196 | E236: 长海股份 | F236: 其他 | G236: 非金属矿 | H236: 128.609 | I236: 3.9000000000000003e-003 | J236: -7.0999999999999995e-003 | K236: 16.14 | L236: -5.5000000000000005e-003 | M236: 116.2 | N236: 16.14 | O236: 0.28600000000000003 | P236: 100 | Q236: 转股中 | R236: 5.23年 | S236: 3.23年 | T236: 5.5 | U236: 9.7 | V236: 1.3999999999999999e-002 | W236: 8.3000000000000004e-002 | X236: 8.3000000000000004e-002 | Y236: 66 | Z236: 2.14 | AA236: -1.9599999999999999e-002 | AB236: -2.4900000000000002e-002 | AC236: -6.1900000000000004e-002 | AD236: -6.3799999999999996e-002 | AE236: 90.45 | AF236: 94.35 | AG236: 0.57 | AH236: AA | AI236: 4.1500000000000002e-002 | AJ236: =H236+100*O236 -> 157.209 | AK236: 157.2 | AL236: 264 | AM236: 62.9 | AN236: 242 | AO236: -0.20100000000000001 | AP236: 4 | AQ236: 长海转债
A237: 131 | B237: 128134 | C237: 鸿路转债! | D237: 2541 | E237: 鸿路钢构 | F237: 建筑 | G237: 其他建材 | H237: 127.218 | I237: 1.38e-002 | J237: -6.6e-003 | K237: 43.9 | L237: 1.2199999999999999e-002 | M237: 115.1 | N237: 43.51 | O237: 0.26100000000000001 | P237: 100.9 | Q237: 转股中 | R237: 5年8天 | S237: 3年9天 | T237: 15.7 | U237: 7.7 | V237: 4.0000000000000001e-003 | W237: 6.8000000000000005e-002 | X237: 6.8000000000000005e-002 | Y237: 233 | Z237: 3.8 | AA237: -2.0099999999999996e-002 | AB237: -2.53e-002 | AC237: -6.2899999999999998e-002 | AD237: -6.480000000000001e-002 | AE237: 91.11 | AF237: 94.23 | AG237: 0.59 | AH237: AA | AI237: 4.1500000000000002e-002 | AJ237: =H237+100*O237 -> 153.31800000000001 | AK237: 153.5 | AL237: 234 | AM237: 59.3 | AN237: 225 | AO237: -0.111 | AP237: 5 | AQ237: 鸿路转债!
A238: 253 | B238: 128081 | C238: 海亮转债! | D238: 2203 | E238: 海亮股份 | F238: 有色金属 | G238: 铜金属 | H238: 124.809 | I238: 9.3999999999999986e-003 | J238: -3.2000000000000002e-003 | K238: 11.38 | L238: 8.8999999999999999e-003 | M238: 114.9 | N238: 9.69 | O238: 6.3e-002 | P238: 117.44 | Q238: 转股中 | R238: 4年51天 | S238: 2年52天 | T238: 30.1 | U238: 49 | V238: 1.3000000000000001e-002 | W238: 0.13400000000000001 | X238: 0.158 | Y238: 224 | Z238: 2.31 | AA238: -2.0199999999999999e-002 | AB238: -2.64e-002 | AC238: -7.9100000000000004e-002 | AD238: -8.1600000000000006e-002 | AE238: 94.53 | AF238: 97.99 | AG238: 0.7 | AH238: AA | AI238: 4.0099999999999997e-002 | AJ238: =H238+100*O238 -> 131.10900000000001 | AK238: 132.2 | AL238: 43 | AM238: 34.2 | AN238: 45 | AO238: -3.4000000000000002e-002 | AP238: 49 | AQ238: 海亮转债!
A239: 187 | B239: 123054 | C239: 思特转债!! | D239: 300608 | E239: 思特奇 | F239: 通信互联 | G239: 通信设备 | H239: 133.107 | I239: 2.4700000000000003e-002 | J239: 2.29e-002 | K239: 13.56 | L239: 7.3599999999999999e-002 | M239: 121.2 | N239: 12.63 | O239: 0.23999999999999999 | P239: 107.36 | Q239: 转股中 | R239: 4.69年 | S239: 2.69年 | T239: 2.08 | U239: 1954. | V239: 6.9299999999999997 | W239: 7.2999999999999995e-002 | X239: 7.8e-002 | Y239: 28 | Z239: 3.34 | AA239: -2.0199999999999999e-002 | AB239: -2.7699999999999999e-002 | AC239: -8.3000000000000004e-002 | AD239: -8.539999999999999e-002 | AE239: 88.03 | AF239: 92.36 | AG239: 0.65 | AH239: AA- | AI239: 6.1100000000000002e-002 | AJ239: =H239+100*O239 -> 157.107 | AK239: 158.9 | AL239: 276 | AM239: 66.5 | AN239: 270 | AO239: -2.4e-002 | AP239: 19 | AQ239: 思特转债!!
A240: 104 | B240: 123078 | C240: 飞凯转债!! | D240: 300398 | E240: 飞凯材料 | F240: 化工 | G240: 化工 | H240: 127.999 | I240: 1.95e-002 | J240: -1.34e-002 | K240: 16.18 | L240: 1.e-002 | M240: 115.2 | N240: 15.56 | O240: 0.23100000000000001 | P240: 103.98 | Q240: 转股中 | R240: 5年57天 | S240: 3年58天 | T240: 8.15 | U240: 13 | V240: 1.3000000000000001e-002 | W240: 9.8000000000000004e-002 | X240: 0.10099999999999999 | Y240: 84 | Z240: 3.01 | AA240: -2.06e-002 | AB240: -2.5699999999999997e-002 | AC240: -6.1900000000000004e-002 | AD240: -6.3799999999999996e-002 | AE240: 90.71 | AF240: 93.81 | AG240: 0.62 | AH240: AA | AI240: 4.1500000000000002e-002 | AJ240: =H240+100*O240 -> 151.09899999999999 | AK240: 152 | AL240: 226 | AM240: 58.2 | AN240: 217 | AO240: -0.111 | AP240: 8 | AQ240: 飞凯转债!!
A241: 129 | B241: 110075 | C241: 南航转债 | D241: 600029 | E241: 南方航空 | F241: 交通运输 | G241: 航空运输 | H241: 122.15 | I241: 1.4999999999999999e-002 | J241: -7.9000000000000008e-003 | K241: 5.78 | L241: 1.3999999999999999e-002 | M241: 110 | N241: 6.24 | O241: 0.31900000000000001 | P241: 92.63 | Q241: 转股中 | R241: 5年14天 | S241: 3年15天 | T241: 59 | U241: 8.6 | V241: 1.e-003 | W241: 5.9999999999999998e-002 | X241: 5.5999999999999994e-002 | Y241: 980 | Z241: 1.31 | AA241: -2.0799999999999999e-002 | AB241: -2.4399999999999998e-002 | AC241: -5.4199999999999998e-002 | AD241: -5.5500000000000001e-002 | AE241: 91.78 | AF241: 92.94 | AG241: 0.5 | AH241: AAA | AI241: 3.4500000000000003e-002 | AJ241: =H241+100*O241 -> 154.05000000000001 | AK241: 151.7 | AL241: 224 | AM241: 58.7 | AN241: 221 | AO241: -2.e-002 | AP241: 7 | AQ241: 南航转债
A242: 98 | B242: 128140 | C242: 润建转债! | D242: 2929 | E242: 润建股份 | F242: 通信互联 | G242: 通信设备 | H242: 128.341 | I242: 2.2599999999999999e-002 | J242: -4.8999999999999998e-003 | K242: 28.71 | L242: 2.7200000000000002e-002 | M242: 115.2 | N242: 26.4 | O242: 0.17999999999999999 | P242: 108.75 | Q242: 转股中 | R242: 5.19年 | S242: 3.19年 | T242: 10.9 | U242: 12 | V242: 9.0000000000000011e-003 | W242: 0.17199999999999999 | X242: 0.187 | Y242: 63 | Z242: 1.94 | AA242: -2.1000000000000001e-002 | AB242: -2.6000000000000002e-002 | AC242: -6.2100000000000002e-002 | AD242: -6.4000000000000001e-002 | AE242: 90.61 | AF242: 93.71 | AG242: 0.65 | AH242: AA | AI242: 4.1500000000000002e-002 | AJ242: =H242+100*O242 -> 146.34100000000001 | AK242: 147.9 | AL242: 191 | AM242: 54.2 | AN242: 190 | AO242: -5.2000000000000005e-002 | AP242: 11 | AQ242: 润建转债!
A243: 117 | B243: 113607 | C243: 伟20转债!! | D243: 603568 | E243: 伟明环保 | F243: 城市公用 | G243: 三废处理 | H243: 128.01 | I243: -7.000000000000001e-004 | J243: -1.5e-003 | K243: 27.6 | L243: -2.8999999999999998e-003 | M243: 115.1 | N243: 21.71 | O243: 6.9999999999999993e-003 | P243: 127.13 | Q243: 转股中 | R243: 5年32天 | S243: 3年33天 | T243: 11 | U243: 80 | V243: 5.7000000000000002e-002 | W243: 3.2000000000000001e-002 | X243: 4.0000000000000001e-002 | Y243: 347 | Z243: 6.12 | AA243: -2.1099999999999997e-002 | AB243: -2.6200000000000001e-002 | AC243: -6.3399999999999998e-002 | AD243: -6.5299999999999997e-002 | AE243: 90.87 | AF243: 93.98 | AG243: 0.78 | AH243: AA | AI243: 4.1500000000000002e-002 | AJ243: =H243+100*O243 -> 128.70999999999998 | AK243: 128.9 | AL243: 29 | AM243: 34.9 | AN243: 48 | AO243: -3.7000000000000005e-002 | AP243: 9 | AQ243: 伟20转债!!
A244: 207 | B244: 123048 | C244: 应急转债! | D244: 300527 | E244: 中船应急 | F244: 机械装备 | G244: 专用设备 | H244: 124.208 | I244: 2.3099999999999999e-002 | J244: -1.7000000000000001e-002 | K244: 8.7 | L244: 1.1599999999999999e-002 | M244: 112.8 | N244: 8.88 | O244: 0.26800000000000002 | P244: 97.97 | Q244: 转股中 | R244: 4.53年 | S244: 2.53年 | T244: 3.79 | U244: 25 | V244: 5.4000000000000006e-002 | W244: 4.4999999999999998e-002 | X244: 4.4000000000000004e-002 | Y244: 84 | Z244: 3.14 | AA244: -2.1499999999999998e-002 | AB244: -2.64e-002 | AC244: -6.6600000000000006e-002 | AD244: -6.88e-002 | AE244: 94.21 | AF244: 96.8 | AG244: 0.53 | AH244: AA+ | AI244: 3.5099999999999999e-002 | AJ244: =H244+100*O244 -> 151.00800000000001 | AK244: 150.4 | AL244: 210 | AM244: 53.6 | AN244: 186 | AO244: -0.10800000000000001 | AP244: 16 | AQ244: 应急转债!
A245: 282 | B245: 113536 | C245: 三星转债 | D245: 603578 | E245: 三星新材 | F245: 家电 | G245: 零部件制 | H245: 123.78 | I245: 1.9099999999999999e-002 | J245: -1.0200000000000001e-002 | K245: 15.53 | L245: 1.37e-002 | M245: 114.3 | N245: 13.76 | O245: 9.6999999999999989e-002 | P245: 112.86 | Q245: 转股中 | R245: 3.66年 | S245: 1.67年 | T245: 1.49 | U245: 15 | V245: 8.199999999999999e-002 | W245: 7.4999999999999997e-002 | X245: 8.4000000000000005e-002 | Y245: 20 | Z245: 2.62 | AA245: -2.1899999999999999e-002 | AB245: -2.87e-002 | AC245: -9.6999999999999989e-002 | AD245: -9.9600000000000008e-002 | AE245: 95.71 | AF245: 99.24 | AG245: 0.65 | AH245: AA | AI245: 4.0099999999999997e-002 | AJ245: =H245+100*O245 -> 133.47999999999999 | AK245: 134.7 | AL245: 70 | AM245: 35.5 | AN245: 52 | AO245: -1.3000000000000001e-002 | AP245: 37 | AQ245: 三星转债
A246: 305 | B246: 128057 | C246: 博彦转债 | D246: 2649 | E246: 博彦科技 | F246: 计算机及 | G246: 软件开发 | H246: 125.485 | I246: 1.2500000000000001e-002 | J246: 3.9000000000000003e-003 | K246: 10.02 | L246: 2.2400000000000003e-002 | M246: 116.3 | N246: 8.5 | O246: 6.4000000000000001e-002 | P246: 117.88 | Q246: 转股中 | R246: 3.43年 | S246: 1.43年 | T246: 4.94 | U246: 12 | V246: 1.9e-002 | W246: 9.3000000000000013e-002 | X246: 0.109 | Y246: 53 | Z246: 1.76 | AA246: -2.2400000000000003e-002 | AB246: -3.0499999999999999e-002 | AC246: -0.105 | AD246: -0.10800000000000001 | AE246: 93.61 | AF246: 95.31 | AG246: 0.73 | AH246: AA- | AI246: 6.1100000000000002e-002 | AJ246: =H246+100*O246 -> 131.88499999999999 | AK246: 133.1 | AL246: 54 | AM246: 37.8 | AN246: 64 | AO246: -3.7000000000000005e-002 | AP246: 28 | AQ246: 博彦转债
A247: 173 | B247: 110071 | C247: 湖盐转债! | D247: 600929 | E247: 雪天盐业 | F247: 食品饮料 | G247: 食品饮料 | H247: 127.87 | I247: 2.53e-002 | J247: -6.4000000000000003e-003 | K247: 7.16 | L247: 2.87e-002 | M247: 114.9 | N247: 6.52 | O247: 0.16399999999999998 | P247: 109.82 | Q247: 转股中 | R247: 4.77年 | S247: 2.78年 | T247: 7.2 | U247: 10 | V247: 1.1000000000000001e-002 | W247: 0.10800000000000001 | X247: 0.11800000000000001 | Y247: 67 | Z247: 2.56 | AA247: -2.2599999999999999e-002 | AB247: -2.7900000000000001e-002 | AC247: -7.0099999999999996e-002 | AD247: -7.2099999999999997e-002 | AE247: 92.2 | AF247: 95.58 | AG247: 0.66 | AH247: AA | AI247: 4.0099999999999997e-002 | AJ247: =H247+100*O247 -> 144.27000000000001 | AK247: 145.9 | AL247: 174 | AM247: 50.3 | AN247: 162 | AO247: -0.107 | AP247: 21 | AQ247: 湖盐转债!
A248: 160 | B248: 128122 | C248: 兴森转债! | D248: 2436 | E248: 兴森科技 | F248: 电子 | G248: 元器件制 | H248: 123.349 | I248: 9.3999999999999986e-003 | J248: 1.9e-003 | K248: 12.09 | L248: 3.1600000000000003e-002 | M248: 113 | N248: 14.1 | O248: 0.439 | P248: 85.74 | Q248: 转股中 | R248: 3.81年 | S248: 2.81年 | T248: 2.69 | U248: 5.7 | V248: 1.7000000000000001e-002 | W248: 1.4999999999999999e-002 | X248: 1.3000000000000001e-002 | Y248: 180 | Z248: 5.48 | AA248: -2.3e-002 | AB248: -2.8900000000000002e-002 | AC248: -5.8099999999999999e-002 | AD248: -6.0100000000000001e-002 | AE248: 92 | AF248: 97.45 | AG248: 0.36 | AH248: AA | AI248: 4.0099999999999997e-002 | AJ248: =H248+100*O248 -> 167.249 | AK248: 161 | AL248: 280 | AM248: 63.5 | AN248: 251 | AO248: -5.2000000000000005e-002 | AP248: 12 | AQ248: 兴森转债!
A249: 236 | B249: 128094 | C249: 星帅转债! | D249: 2860 | E249: 星帅尔 | F249: 家电 | G249: 零部件制 | H249: 133.89 | I249: 2.3599999999999999e-002 | J249: 8.3999999999999995e-003 | K249: 17.65 | L249: 4.1299999999999996e-002 | M249: 121 | N249: 13.8 | O249: 4.7e-002 | P249: 127.9 | Q249: 转股中 | R249: 4.29年 | S249: 2.30年 | T249: 2.19 | U249: 12 | V249: 4.2000000000000003e-002 | W249: 6.0999999999999999e-002 | X249: 7.8e-002 | Y249: 36 | Z249: 3.38 | AA249: -2.3799999999999998e-002 | AB249: -3.1899999999999998e-002 | AC249: -9.8299999999999998e-002 | AD249: -0.10000000000000001 | AE249: 87.88 | AF249: 90.42 | AG249: 0.78 | AH249: A+ | AI249: 7.2099999999999997e-002 | AJ249: =H249+100*O249 -> 138.58999999999997 | AK249: 139.9 | AL249: 122 | AM249: 49.5 | AN249: 158 | AO249: -5.5e-002 | AP249: 32 | AQ249: 星帅转债!
A250: 370 | B250: 128013 | C250: 洪涛转债! | D250: 2325 | E250: 洪涛股份 | F250: 建筑 | G250: 装饰工程 | H250: 110.211 | I250: 8.3000000000000001e-003 | J250: -1.5e-003 | K250: 2.45 | L250: 1.24e-002 | M250: 108 | N250: 2.32 | O250: 4.4000000000000004e-002 | P250: 105.6 | Q250: 转股中 | R250: 0.83年 | S250: 回售内 | T250: 11.5 | U250: 43 | V250: 3.4000000000000002e-002 | W250: 0.36899999999999999 | X250: 0.38900000000000001 | Y250: 31 | Z250: 1.11 | AA250: -2.4199999999999999e-002 | AB250: -4.1599999999999998e-002 | AC250: 回售内 | AD250: 回售内 | AE250: 100.33 | AF250: 100.7 | AG250: 0.55 | AH250: A- | AI250: 8.8300000000000003e-002 | AJ250: =H250+100*O250 -> 114.611 | AK250: 114.8 | AL250: 6 | AM250: 14.1 | AN250: 3 | AO250: -4.0999999999999995e-002 | AP250: 100 | AQ250: 洪涛转债!
A251: 355 | B251: 128025 | C251: 特一转债! | D251: 2728 | E251: 特一药业 | F251: 医药 | G251: 化学制药 | H251: 114.708 | I251: 1.77e-002 | J251: -1.4000000000000002e-003 | K251: 13.6 | L251: 3.1899999999999998e-002 | M251: 108.8 | N251: 14.05 | O251: 0.185 | P251: 96.8 | Q251: 转股中 | R251: 2.19年 | S251: 0.19年 | T251: 2.98 | U251: 44 | V251: 0.13 | W251: 0.10800000000000001 | X251: 0.10400000000000001 | Y251: 28 | Z251: 2.85 | AA251: -2.4300000000000002e-002 | AB251: -3.1600000000000003e-002 | AC251: -0.35299999999999998 | AD251: -0.36099999999999999 | AE251: 99.54 | AF251: 96.2 | AG251: 0.51 | AH251: AA- | AI251: 5.91e-002 | AJ251: =H251+100*O251 -> 133.208 | AK251: 132.6 | AL251: 50 | AM251: 33.1 | AN251: 35 | AO251: 8.5999999999999993e-002 | AP251: 51 | AQ251: 特一转债!
A252: 333 | B252: 110045 | C252: 海澜转债! | D252: 600398 | E252: 海澜之家 | F252: 服装纺织 | G252: 服装行业 | H252: 118.1 | I252: 4.0000000000000002e-004 | J252: -1.8e-003 | K252: 7.03 | L252: -2.8000000000000004e-003 | M252: 110.3 | N252: 7.04 | O252: 0.183 | P252: 99.86 | Q252: 转股中 | R252: 2.78年 | S252: 0.79年 | T252: 29.5 | U252: 4.2 | V252: 1.e-003 | W252: 9.6999999999999989e-002 | X252: 9.6999999999999989e-002 | Y252: 304 | Z252: 2.21 | AA252: -2.4500000000000001e-002 | AB252: -3.1099999999999999e-002 | AC252: -0.152 | AD252: -0.154 | AE252: 98.14 | AF252: 100.84 | AG252: 0.49 | AH252: AA+ | AI252: 3.3099999999999997e-002 | AJ252: =H252+100*O252 -> 136.40000000000001 | AK252: 136.3 | AL252: 91 | AM252: 35.5 | AN252: 53 | AO252: -6.5000000000000002e-002 | AP252: 48 | AQ252: 海澜转债!
A253: 29 | B253: 123115 | C253: 捷捷转债 | D253: 300623 | E253: 捷捷微电 | F253: 电子 | G253: 元器件制 | H253: 136.15 | I253: -1.34e-002 | J253: 1.41e-002 | K253: 31.93 | L253: 8.9999999999999998e-004 | M253: 118.5 | N253: 29 | O253: 0.23699999999999999 | P253: 110.1 | Q253: 2月16天 | R253: 5.69年 | S253: 3.69年 | T253: 12 | U253: 234 | V253: 0.14099999999999999 | W253: 5.0999999999999997e-002 | X253: 5.5999999999999994e-002 | Y253: 235 | Z253: 8.76 | AA253: -2.4500000000000001e-002 | AB253: -2.9999999999999999e-002 | AC253: -6.8400000000000002e-002 | AD253: -7.0099999999999996e-002 | AE253: 82.39 | AF253: 84.52 | AG253: 0.71 | AH253: AA- | AI253: 6.25e-002 | AJ253: =H253+100*O253 -> 159.84999999999999 | AK253: 162.2 | AL253: 285 | AM253: 77.7 | AN253: 306 | AO253: 5.5999999999999994e-002 | AP253: 6 | AQ253: 捷捷转债
A254: 359 | B254: 123002 | C254: 国祯转债!! | D254: 300388 | E254: 节能国祯 | F254: 城市公用 | G254: 三废处理 | H254: 114.7 | I254: 1.2699999999999999e-002 | J254: -8.1000000000000013e-003 | K254: 7.83 | L254: 1.03e-002 | M254: 108.8 | N254: 8.36 | O254: 0.22500000000000001 | P254: 93.66 | Q254: 转股中 | R254: 2年55天 | S254: 55天 | T254: 2.52 | U254: 12 | V254: 4.2999999999999997e-002 | W254: 4.5999999999999999e-002 | X254: 4.2999999999999997e-002 | Y254: 55 | Z254: 1.53 | AA254: -2.4700000000000003e-002 | AB254: -3.2099999999999997e-002 | AC254: -0.39100000000000001 | AD254: -0.40000000000000002 | AE254: 100.36 | AF254: 100.54 | AG254: 0.45 | AH254: AA | AI254: 3.8100000000000002e-002 | AJ254: =H254+100*O254 -> 137.19999999999999 | AK254: 135.7 | AL254: 83 | AM254: 35.2 | AN254: 51 | AO254: -1.1000000000000001e-002 | AP254: 17 | AQ254: 国祯转债!!
A255: 341 | B255: 127006 | C255: 敖东转债! | D255: 623 | E255: 吉林敖东 | F255: 金融 | G255: 证券行业 | H255: 114.184 | I255: 1.72e-002 | J255: -1.5700000000000002e-002 | K255: 16.84 | L255: 6.0000000000000001e-003 | M255: 107.4 | N255: 20.22 | O255: 0.371 | P255: 83.28 | Q255: 转股中 | R255: 2.45年 | S255: 0.45年 | T255: 24.1 | U255: 7.1 | V255: 3.0000000000000001e-003 | W255: 0.12300000000000001 | X255: 0.10199999999999999 | Y255: 196 | Z255: 0.84 | AA255: -2.5000000000000001e-002 | AB255: -3.0499999999999999e-002 | AC255: -0.19600000000000001 | AD255: -0.19899999999999998 | AE255: 99.06 | AF255: 99.27 | AG255: 0.26 | AH255: AA+ | AI255: 3.3099999999999997e-002 | AJ255: =H255+100*O255 -> 151.28399999999999 | AK255: 145.1 | AL255: 169 | AM255: 45.8 | AN255: 131 | AO255: -4.2000000000000003e-002 | AP255: 27 | AQ255: 敖东转债!
A256: 206 | B256: 128106 | C256: 华统转债 | D256: 2840 | E256: 华统股份 | F256: 农业 | G256: 农产品加 | H256: 126.4 | I256: 4.7800000000000002e-002 | J256: 1.9e-003 | K256: 11.24 | L256: 6.6400000000000001e-002 | M256: 112.9 | N256: 9.37 | O256: 5.4000000000000006e-002 | P256: 119.96 | Q256: 转股中 | R256: 4.53年 | S256: 2.53年 | T256: 5.35 | U256: 270 | V256: 0.40200000000000002 | W256: 0.106 | X256: 0.128 | Y256: 50 | Z256: 2.79 | AA256: -2.5099999999999997e-002 | AB256: -3.0099999999999998e-002 | AC256: -7.2400000000000006e-002 | AD256: -7.46e-002 | AE256: 93.11 | AF256: 94.85 | AG256: 0.75 | AH256: AA | AI256: 4.0099999999999997e-002 | AJ256: =H256+100*O256 -> 131.80000000000001 | AK256: 132.8 | AL256: 52 | AM256: 38 | AN256: 66 | AO256: 0.193 | AP256: 10 | AQ256: 华统转债
A257: 126 | B257: 127022 | C257: 恒逸转债 | D257: 703 | E257: 恒逸石化 | F257: 化工 | G257: 化工 | H257: 123.6 | I257: 2.3099999999999999e-002 | J257: -2.0299999999999999e-002 | K257: 11.5 | L257: 4.4000000000000003e-003 | M257: 108.9 | N257: 11.2 | O257: 0.20399999999999999 | P257: 102.68 | Q257: 转股中 | R257: 5年15天 | S257: 3年16天 | T257: 20 | U257: 41 | V257: 1.7000000000000001e-002 | W257: 4.7e-002 | X257: 4.9000000000000002e-002 | Y257: 422 | Z257: 1.64 | AA257: -2.52e-002 | AB257: -2.8300000000000002e-002 | AC257: -5.6500000000000002e-002 | AD257: -5.7999999999999996e-002 | AE257: 91.56 | AF257: 91.15 | AG257: 0.64 | AH257: AA+ | AI257: 3.6499999999999998e-002 | AJ257: =H257+100*O257 -> 144. | AK257: 144.5 | AL257: 166 | AM257: 53 | AN257: 180 | AO257: -5.4000000000000006e-002 | AP257: 7 | AQ257: 恒逸转债
A258: 6 | B258: 118002 | C258: 天合转债 | D258: 688599 | E258: 天合光能 | F258: 能源电力 | G258: 太阳能 | H258: 140.09 | I258: 1.77e-002 | J258: 2.3700000000000002e-002 | K258: 53.56 | L258: 6.7400000000000002e-002 | M258: 120.1 | N258: 50.51 | O258: 0.32100000000000001 | P258: 106.04 | Q258: 4月24天 | R258: 5.87年 | S258: 3.87年 | T258: 52.5 | U258: 363 | V258: 4.9000000000000002e-002 | W258: 4.7e-002 | X258: 5.0000000000000003e-002 | Y258: 1108. | Z258: 7.17 | AA258: -2.63e-002 | AB258: -3.1899999999999998e-002 | AC258: -7.2499999999999995e-002 | AD258: -7.400000000000001e-002 | AE258: 88.04 | AF258: 94.99 | AG258: 0.61 | AH258: AA | AI258: 4.1500000000000002e-002 | AJ258: =H258+100*O258 -> 172.19 | AK258: 174.1 | AL258: 313 | AM258: 79.2 | AN258: 309 | AO258: -1.3999999999999999e-002 | AP258: 5 | AQ258: 天合转债
A259: 107 | B259: 110077 | C259: 洪城转债 | D259: 600461 | E259: 洪城环境 | F259: 城市公用 | G259: 城市公用 | H259: 130.17 | I259: 3.3099999999999997e-002 | J259: -1.2999999999999999e-003 | K259: 8.46 | L259: 4.0599999999999997e-002 | M259: 113.5 | N259: 6.71 | O259: 3.2000000000000001e-002 | P259: 126.08 | Q259: 转股中 | R259: 5年50天 | S259: 3年51天 | T259: 17.7 | U259: 73 | V259: 3.2000000000000001e-002 | W259: 0.22 | X259: 0.27800000000000002 | Y259: 80 | Z259: 1.56 | AA259: -2.6600000000000002e-002 | AB259: -3.1200000000000002e-002 | AC259: -7.0800000000000002e-002 | AD259: -7.1900000000000006e-002 | AE259: 90.89 | AF259: 94.64 | AG259: 0.78 | AH259: AA+ | AI259: 3.6499999999999998e-002 | AJ259: =H259+100*O259 -> 133.36999999999998 | AK259: 134.3 | AL259: 65 | AM259: 39.6 | AN259: 76 | AO259: -2.1000000000000001e-002 | AP259: 7 | AQ259: 洪城转债
A260: 13 | B260: 110081 | C260: 闻泰转债 | D260: 600745 | E260: 闻泰科技 | F260: 电子 | G260: 电子行业 | H260: 130.77 | I260: 2.e-002 | J260: -1.7299999999999999e-002 | K260: 93.66 | L260: 4.7999999999999996e-003 | M260: 111.9 | N260: 96.67 | O260: 0.34999999999999998 | P260: 96.89 | Q260: 4月6天 | R260: 5.82年 | S260: 3.83年 | T260: 86 | U260: 211 | V260: 1.9e-002 | W260: 7.400000000000001e-002 | X260: 7.0999999999999994e-002 | Y260: 1166. | Z260: 3.83 | AA260: -2.6699999999999998e-002 | AB260: -3.0200000000000001e-002 | AC260: -5.96e-002 | AD260: -6.0599999999999994e-002 | AE260: 88.79 | AF260: 91.02 | AG260: 0.57 | AH260: AA+ | AI260: 3.6499999999999998e-002 | AJ260: =H260+100*O260 -> 165.77000000000001 | AK260: 164.7 | AL260: 297 | AM260: 73.6 | AN260: 300 | AO260: -0.10400000000000001 | AP260: 10 | AQ260: 闻泰转债
A261: 345 | B261: 128035 | C261: 大族转债! | D261: 2008 | E261: 大族激光 | F261: 机械装备 | G261: 专用设备 | H261: 114.417 | I261: 1.18e-002 | J261: -1.1599999999999999e-002 | K261: 37.83 | L261: 7.4999999999999997e-003 | M261: 107.4 | N261: 51.9 | O261: 0.56999999999999995 | P261: 72.89 | Q261: 转股中 | R261: 2.36年 | S261: 0.36年 | T261: 23 | U261: 5.9 | V261: 2.e-003 | W261: 5.7000000000000002e-002 | X261: 4.2000000000000003e-002 | Y261: 404 | Z261: 4.03 | AA261: -2.69e-002 | AB261: -3.2599999999999997e-002 | AC261: -0.18899999999999997 | AD261: -0.20300000000000001 | AE261: 102.06 | AF261: 99.58 | AG261: 0.03 | AH261: AA+ | AI261: 3.3099999999999997e-002 | AJ261: =H261+100*O261 -> 171.417 | AK261: 155.9 | AL261: 253 | AM261: 53.9 | AN261: 188 | AO261: -9.3000000000000013e-002 | AP261: 17 | AQ261: 大族转债!
A262: 339 | B262: 128036 | C262: 金农转债!! | D262: 2548 | E262: 金新农 | F262: 农业 | G262: 畜牧业 | H262: 116.835 | I262: -1.4000000000000002e-003 | J262: 4.3e-003 | K262: 5.56 | L262: 1.2800000000000001e-002 | M262: 109.3 | N262: 6.93 | O262: 0.45600000000000002 | P262: 80.23 | Q262: 转股中 | R262: 2.44年 | S262: 0.44年 | T262: 1.46 | U262: 32 | V262: 0.18899999999999997 | W262: 3.7999999999999999e-002 | X262: 2.9999999999999999e-002 | Y262: 38 | Z262: 1.44 | AA262: -2.7400000000000001e-002 | AB262: -3.4300000000000004e-002 | AC262: -0.223 | AD262: -0.22899999999999998 | AE262: 98.34 | AF262: 95.27 | AG262: 0.23 | AH262: AA- | AI262: 5.91e-002 | AJ262: =H262+100*O262 -> 162.435 | AK262: 153.4 | AL262: 232 | AM262: 55.1 | AN262: 201 | AO262: 3.3000000000000002e-002 | AP262: 16 | AQ262: 金农转债!!
A263: 93 | B263: 123084 | C263: 高澜转债!! | D263: 300499 | E263: 高澜股份 | F263: 能源电力 | G263: 电力设备 | H263: 141.1 | I263: 4.1100000000000005e-002 | J263: 3.8300000000000001e-002 | K263: 12.6 | L263: 9.5700000000000007e-002 | M263: 121.9 | N263: 9.01 | O263: 9.0000000000000011e-003 | P263: 139.84 | Q263: 转股中 | R263: 5.19年 | S263: 3.20年 | T263: 2.68 | U263: 286 | V263: 0.75099999999999989 | W263: 7.5999999999999998e-002 | X263: 0.106 | Y263: 35 | Z263: 4.24 | AA263: -2.8399999999999998e-002 | AB263: -3.5299999999999998e-002 | AC263: -8.5600000000000009e-002 | AD263: -8.7899999999999992e-002 | AE263: 82.87 | AF263: 85.17 | AG263: 0.83 | AH263: A+ | AI263: 7.3499999999999996e-002 | AJ263: =H263+100*O263 -> 142. | AK263: 142.4 | AL263: 153 | AM263: 57.2 | AN263: 208 | AO263: -8.199999999999999e-002 | AP263: 16 | AQ263: 高澜转债!!
A264: 31 | B264: 127036 | C264: 三花转债 | D264: 2050 | E264: 三花智控 | F264: 机械装备 | G264: 通用设备 | H264: 135.02 | I264: 1.52e-002 | J264: -1.3000000000000001e-002 | K264: 22.76 | L264: 3.4999999999999996e-003 | M264: 114.5 | N264: 21.55 | O264: 0.27800000000000002 | P264: 105.61 | Q264: 2月8天 | R264: 5.67年 | S264: 3.67年 | T264: 30 | U264: 37 | V264: 9.0000000000000011e-003 | W264: 3.7000000000000005e-002 | X264: 3.9e-002 | Y264: 817 | Z264: 8.15 | AA264: -2.9100000000000001e-002 | AB264: -3.3399999999999999e-002 | AC264: -6.8499999999999991e-002 | AD264: -6.9800000000000001e-002 | AE264: 89.84 | AF264: 93.73 | AG264: 0.62 | AH264: AA+ | AI264: 3.6499999999999998e-002 | AJ264: =H264+100*O264 -> 162.82000000000002 | AK264: 164.4 | AL264: 296 | AM264: 70.7 | AN264: 293 | AO264: -6.5000000000000002e-002 | AP264: 6 | AQ264: 三花转债
A265: 197 | B265: 113579 | C265: 健友转债! | D265: 603707 | E265: 健友股份 | F265: 医药 | G265: 原料药 | H265: 130.97 | I265: 1.32e-002 | J265: 5.9999999999999995e-004 | K265: 36 | L265: 2.0400000000000001e-002 | M265: 113.9 | N265: 32.2 | O265: 0.17100000000000001 | P265: 111.8 | Q265: 转股中 | R265: 4.56年 | S265: 2.56年 | T265: 5.03 | U265: 51 | V265: 7.8e-002 | W265: 1.1000000000000001e-002 | X265: 1.3000000000000001e-002 | Y265: 438 | Z265: 8.43 | AA265: -3.0699999999999998e-002 | AB265: -3.5900000000000001e-002 | AC265: -8.3599999999999994e-002 | AD265: -8.5699999999999998e-002 | AE265: 92.98 | AF265: 95.55 | AG265: 0.68 | AH265: AA | AI265: 4.0099999999999997e-002 | AJ265: =H265+100*O265 -> 148.06999999999999 | AK265: 150.1 | AL265: 206 | AM265: 54.6 | AN265: 195 | AO265: 0.20899999999999999 | AP265: 8 | AQ265: 健友转债!
A266: 5 | B266: 127045 | C266: 牧原转债 | D266: 2714 | E266: 牧原股份 | F266: 农业 | G266: 畜牧业 | H266: 133.2 | I266: 2.23e-002 | J266: -9.1000000000000004e-003 | K266: 51.9 | L266: 1.9599999999999999e-002 | M266: 111.1 | N266: 47.91 | O266: 0.23000000000000001 | P266: 108.33 | Q266: 4月24天 | R266: 5.88年 | S266: 3.88年 | T266: 95.5 | U266: 438 | V266: 3.4000000000000002e-002 | W266: 3.5000000000000003e-002 | X266: 3.7999999999999999e-002 | Y266: 2732. | Z266: 5.12 | AA266: -3.0800000000000001e-002 | AB266: -3.4099999999999998e-002 | AC266: -6.2300000000000001e-002 | AD266: -6.3500000000000001e-002 | AE266: 89.05 | AF266: 90.27 | AG266: 0.67 | AH266: AA+ | AI266: 3.6499999999999998e-002 | AJ266: =H266+100*O266 -> 156.19999999999999 | AK266: 158.1 | AL266: 271 | AM266: 67.8 | AN266: 277 | AO266: 0.14499999999999999 | AP266: 6 | AQ266: 牧原转债
A267: 275 | B267: 113541 | C267: 荣晟转债! | D267: 603165 | E267: 荣晟环保 | F267: 造纸包装 | G267: 包装用纸 | H267: 128.6 | I267: 1.4800000000000001e-002 | J267: -4.3e-003 | K267: 13.21 | L267: 1.38e-002 | M267: 114.3 | N267: 10.84 | O267: 5.5e-002 | P267: 121.86 | Q267: 转股中 | R267: 3.81年 | S267: 1.81年 | T267: 1.63 | U267: 34 | V267: 0.161 | W267: 4.7e-002 | X267: 5.7000000000000002e-002 | Y267: 35 | Z267: 2.05 | AA267: -3.1e-002 | AB267: -3.7400000000000003e-002 | AC267: -0.10800000000000001 | AD267: -0.11 | AE267: 91.5 | AF267: 91.57 | AG267: 0.75 | AH267: AA- | AI267: 6.1100000000000002e-002 | AJ267: =H267+100*O267 -> 134.09999999999999 | AK267: 135.3 | AL267: 78 | AM267: 43.8 | AN267: 109 | AO267: 4.0000000000000001e-003 | AP267: 43 | AQ267: 荣晟转债!
A268: 248 | B268: 128085 | C268: 鸿达转债!! | D268: 2002 | E268: 鸿达兴业 | F268: 化工 | G268: 化工 | H268: 141.88 | I268: 2.0400000000000001e-002 | J268: -4.0000000000000001e-003 | K268: 5.58 | L268: 1.6399999999999998e-002 | M268: 124.4 | N268: 3.91 | O268: -6.0000000000000001e-003 | P268: 142.71 | Q268: 转股中 | R268: 4.21年 | S268: 2.21年 | T268: 3.6 | U268: 206 | V268: 0.40200000000000002 | W268: 2.1000000000000001e-002 | X268: 3.1e-002 | Y268: 168 | Z268: 1.78 | AA268: -3.1400000000000004e-002 | AB268: -4.0599999999999997e-002 | AC268: -0.12300000000000001 | AD268: -0.126 | AE268: 71.57 | AF268: 64.93 | AG268: 1 | AH268: B | AI268: 0.1721 | AJ268: =H268+100*O268 -> 141.28 | AK268: 141 | AL268: 133 | AM268: 69.5 | AN268: 284 | AO268: -0.10300000000000001 | AP268: 96 | AQ268: 鸿达转债!!
A269: 21 | B269: 113626 | C269: 伯特转债 | D269: 603596 | E269: 伯特利 | F269: 汽车 | G269: 零部件制 | H269: 145.74 | I269: 2.6600000000000002e-002 | J269: -1.9e-002 | K269: 44.75 | L269: 1.06e-002 | M269: 121.1 | N269: 36 | O269: 0.17199999999999999 | P269: 124.31 | Q269: 3月7天 | R269: 5.74年 | S269: 3.75年 | T269: 9.02 | U269: 24 | V269: 1.9e-002 | W269: 4.9000000000000002e-002 | X269: 6.0999999999999999e-002 | Y269: 183 | Z269: 6.03 | AA269: -3.2199999999999999e-002 | AB269: -3.8199999999999998e-002 | AC269: -8.4100000000000008e-002 | AD269: -8.5600000000000009e-002 | AE269: 88.48 | AF269: 96.26 | AG269: 0.72 | AH269: AA | AI269: 4.1500000000000002e-002 | AJ269: =H269+100*O269 -> 162.94 | AK269: 167.2 | AL269: 305 | AM269: 70.9 | AN269: 294 | AO269: -6.7000000000000004e-002 | AP269: 3 | AQ269: 伯特转债
A270: 87 | B270: 113614 | C270: 健20转债! | D270: 603707 | E270: 健友股份 | F270: 医药 | G270: 原料药 | H270: 135.41 | I270: 2.5399999999999999e-002 | J270: -9.4999999999999998e-003 | K270: 36 | L270: 2.0400000000000001e-002 | M270: 114.2 | N270: 29.12 | O270: 9.5000000000000001e-002 | P270: 123.63 | Q270: 转股中 | R270: 5.21年 | S270: 3.22年 | T270: 7.8 | U270: 131 | V270: 0.125 | W270: 1.8000000000000002e-002 | X270: 2.2000000000000002e-002 | Y270: 438 | Z270: 8.43 | AA270: -3.2799999999999996e-002 | AB270: -3.7400000000000003e-002 | AC270: -7.6499999999999999e-002 | AD270: -7.8399999999999997e-002 | AE270: 90.51 | AF270: 92.79 | AG270: 0.78 | AH270: AA | AI270: 4.1500000000000002e-002 | AJ270: =H270+100*O270 -> 144.91 | AK270: 147.2 | AL270: 185 | AM270: 54.4 | AN270: 192 | AO270: 0.20899999999999999 | AP270: 4 | AQ270: 健20转债!
A271: 86 | B271: 128141 | C271: 旺能转债 | D271: 2034 | E271: 旺能环境 | F271: 城市公用 | G271: 三废处理 | H271: 136.7 | I271: 8.1000000000000013e-003 | J271: 1.2999999999999999e-003 | K271: 21.91 | L271: 1.15e-002 | M271: 115.1 | N271: 15.97 | O271: -4.0000000000000001e-003 | P271: 137.19 | Q271: 转股中 | R271: 5.21年 | S271: 3.22年 | T271: 12.8 | U271: 412 | V271: 0.23499999999999999 | W271: 0.13800000000000001 | X271: 0.19 | Y271: 92 | Z271: 1.96 | AA271: -3.3000000000000002e-002 | AB271: -3.7900000000000003e-002 | AC271: -7.9399999999999998e-002 | AD271: -8.1099999999999992e-002 | AE271: 90.42 | AF271: 93.51 | AG271: 0.81 | AH271: AA | AI271: 4.1500000000000002e-002 | AJ271: =H271+100*O271 -> 136.29999999999998 | AK271: 136.2 | AL271: 90 | AM271: 42.7 | AN271: 103 | AO271: 0.13600000000000001 | AP271: 9 | AQ271: 旺能转债
A272: 192 | B272: 128109 | C272: 楚江转债! | D272: 2171 | E272: 楚江新材 | F272: 有色金属 | G272: 铜金属 | H272: 134.1 | I272: 1.89e-002 | J272: -4.8999999999999998e-003 | K272: 10.11 | L272: 1.3999999999999999e-002 | M272: 114.9 | N272: 8.63 | O272: 0.14499999999999999 | P272: 117.15 | Q272: 转股中 | R272: 4.68年 | S272: 2.68年 | T272: 18.2 | U272: 64 | V272: 2.6000000000000002e-002 | W272: 0.13500000000000001 | X272: 0.158 | Y272: 135 | Z272: 2.39 | AA272: -3.3099999999999997e-002 | AB272: -3.85e-002 | AC272: -8.8000000000000009e-002 | AD272: -8.9999999999999997e-002 | AE272: 92.56 | AF272: 95.95 | AG272: 1 | AH272: AA | AI272: 4.0099999999999997e-002 | AJ272: =H272+100*O272 -> 148.59999999999999 | AK272: 151.1 | AL272: 215 | AM272: 55.1 | AN272: 199 | AO272: -0.17499999999999999 | AP272: 6 | AQ272: 楚江转债!
A273: 163 | B273: 123060 | C273: 苏试转债! | D273: 300416 | E273: 苏试试验 | F273: 机械装备 | G273: 专用设备 | H273: 137.5 | I273: -1.0800000000000001e-002 | J273: -1.3100000000000001e-002 | K273: 21.78 | L273: -3.2000000000000001e-002 | M273: 117.2 | N273: 18.28 | O273: 0.154 | P273: 119.15 | Q273: 转股中 | R273: 4.80年 | S273: 2.81年 | T273: 3.1 | U273: 29 | V273: 6.7000000000000004e-002 | W273: 5.4000000000000006e-002 | X273: 6.4000000000000001e-002 | Y273: 57 | Z273: 5.99 | AA273: -3.3300000000000003e-002 | AB273: -3.9300000000000002e-002 | AC273: -9.1700000000000004e-002 | AD273: -9.3699999999999992e-002 | AE273: 86.95 | AF273: 88.66 | AG273: 0.75 | AH273: AA- | AI273: 6.1100000000000002e-002 | AJ273: =H273+100*O273 -> 152.90000000000001 | AK273: 155.9 | AL273: 252 | AM273: 67.2 | AN273: 273 | AO273: -8.199999999999999e-002 | AP273: 8 | AQ273: 苏试转债!
A274: 343 | B274: 113505 | C274: 杭电转债! | D274: 603618 | E274: 杭电股份 | F274: 能源电力 | G274: 电力设备 | H274: 120.73 | I274: 3.2099999999999997e-002 | J274: -4.3e-003 | K274: 7.85 | L274: 4.3899999999999995e-002 | M274: 111.3 | N274: 7.08 | O274: 8.900000000000001e-002 | P274: 110.88 | Q274: 转股中 | R274: 2.43年 | S274: 0.43年 | T274: 7.5 | U274: 286 | V274: 0.316 | W274: 0.13800000000000001 | X274: 0.153 | Y274: 54 | Z274: 2.01 | AA274: -3.3500000000000002e-002 | AB274: -4.1599999999999998e-002 | AC274: -0.27600000000000002 | AD274: -0.28100000000000003 | AE274: 99.56 | AF274: 101.8 | AG274: 0.63 | AH274: AA | AI274: 3.8100000000000002e-002 | AJ274: =H274+100*O274 -> 129.63 | AK274: 130.6 | AL274: 38 | AM274: 28.8 | AN274: 17 | AO274: 0.14400000000000002 | AP274: 46 | AQ274: 杭电转债!
A275: 188 | B275: 113585 | C275: 寿仙转债! | D275: 603896 | E275: 寿仙谷 | F275: 医药 | G275: 中药 | H275: 137.78 | I275: -8.5000000000000006e-003 | J275: 2.0999999999999999e-003 | K275: 39.2 | L275: -7.6e-003 | M275: 117.3 | N275: 28.38 | O275: -3.0000000000000001e-003 | P275: 138.13 | Q275: 转股中 | R275: 4.69年 | S275: 2.69年 | T275: 1.06 | U275: 22 | V275: 0.14800000000000002 | W275: 1.8000000000000002e-002 | X275: 2.5000000000000001e-002 | Y275: 59 | Z275: 4.22 | AA275: -3.44e-002 | AB275: -4.0500000000000001e-002 | AC275: -9.5700000000000007e-002 | AD275: -9.7699999999999995e-002 | AE275: 87.64 | AF275: 89.36 | AG275: 0.84 | AH275: AA- | AI275: 6.1100000000000002e-002 | AJ275: =H275+100*O275 -> 137.47999999999999 | AK275: 137.4 | AL275: 102 | AM275: 48.1 | AN275: 146 | AO275: -2.5000000000000001e-002 | AP275: 18 | AQ275: 寿仙转债!
A276: 255 | B276: 113549 | C276: 白电转债! | D276: 603861 | E276: 白云电器 | F276: 能源电力 | G276: 电力设备 | H276: 132.35 | I276: 2.5000000000000001e-002 | J276: 7.4000000000000003e-003 | K276: 11.85 | L276: 3.95e-002 | M276: 114.8 | N276: 8.83 | O276: -1.3999999999999999e-002 | P276: 134.2 | Q276: 转股中 | R276: 4年45天 | S276: 2年46天 | T276: 8.16 | U276: 237 | V276: 0.22 | W276: 0.157 | X276: 0.20999999999999999 | Y276: 52 | Z276: 2.06 | AA276: -3.4599999999999999e-002 | AB276: -4.0599999999999997e-002 | AC276: -0.10300000000000001 | AD276: -0.105 | AE276: 94.49 | AF276: 97.95 | AG276: 0.82 | AH276: AA | AI276: 4.0099999999999997e-002 | AJ276: =H276+100*O276 -> 130.94999999999999 | AK276: 130.5 | AL276: 37 | AM276: 32.5 | AN276: 33 | AO276: 8.6999999999999994e-002 | AP276: 40 | AQ276: 白电转债!
A277: 311 | B277: 128053 | C277: 尚荣转债! | D277: 2551 | E277: 尚荣医疗 | F277: 医药 | G277: 医疗器械 | H277: 128.723 | I277: 1.1200000000000002e-002 | J277: -1.1200000000000002e-002 | K277: 4.92 | L277: 2.e-003 | M277: 114.3 | N277: 4.88 | O277: 0.27699999999999997 | P277: 100.82 | Q277: 转股中 | R277: 3.38年 | S277: 1.38年 | T277: 1.91 | U277: 63 | V277: 0.25800000000000001 | W277: 4.5999999999999999e-002 | X277: 4.5999999999999999e-002 | Y277: 42 | Z277: 1.32 | AA277: -3.5200000000000002e-002 | AB277: -4.24e-002 | AC277: -0.122 | AD277: -0.125 | AE277: 96.81 | AF277: 100.36 | AG277: 0 | AH277: AA | AI277: 4.0099999999999997e-002 | AJ277: =H277+100*O277 -> 156.423 | AK277: 156.6 | AL277: 258 | AM277: 56.3 | AN277: 205 | AO277: -2.7000000000000003e-002 | AP277: 24 | AQ277: 尚荣转债!
A278: 91 | B278: 123085 | C278: 万顺转2!! | D278: 300057 | E278: 万顺新材 | F278: 有色金属 | G278: 铝金属 | H278: 136 | I278: 2.6600000000000002e-002 | J278: 2.0999999999999999e-003 | K278: 8.05 | L278: 3.4700000000000002e-002 | M278: 113.3 | N278: 6.2 | O278: 4.7e-002 | P278: 129.84 | Q278: 转股中 | R278: 5.20年 | S278: 3.20年 | T278: 8.67 | U278: 23 | V278: 1.9e-002 | W278: 0.16 | X278: 0.20699999999999999 | Y278: 54 | Z278: 1.53 | AA278: -3.5200000000000002e-002 | AB278: -3.9599999999999996e-002 | AC278: -7.7899999999999997e-002 | AD278: -7.980000000000001e-002 | AE278: 84.85 | AF278: 83.27 | AG278: 0.83 | AH278: AA- | AI278: 6.25e-002 | AJ278: =H278+100*O278 -> 140.69999999999999 | AK278: 142.2 | AL278: 150 | AM278: 57.3 | AN278: 209 | AO278: 0. | AP278: 23 | AQ278: 万顺转2!!
A279: 57 | B279: 127029 | C279: 中钢转债 | D279: 928 | E279: 中钢国际 | F279: 建筑 | G279: 建筑工程 | H279: 144.001 | I279: 3.8900000000000004e-002 | J279: 3.5999999999999999e-003 | K279: 8.44 | L279: 5.1100000000000007e-002 | M279: 117.5 | N279: 5.79 | O279: -1.2e-002 | P279: 145.77 | Q279: 转股中 | R279: 5.46年 | S279: 3.47年 | T279: 8.42 | U279: 336 | V279: 0.27800000000000002 | W279: 7.9000000000000001e-002 | X279: 0.11599999999999999 | Y279: 106 | Z279: 1.82 | AA279: -3.7000000000000005e-002 | AB279: -4.2300000000000004e-002 | AC279: -8.8599999999999998e-002 | AD279: -8.9900000000000008e-002 | AE279: 90.5 | AF279: 96.88 | AG279: 0.83 | AH279: AA+ | AI279: 3.6499999999999998e-002 | AJ279: =H279+100*O279 -> 142.80100000000002 | AK279: 142.2 | AL279: 151 | AM279: 45.4 | AN279: 128 | AO279: -0.20300000000000001 | AP279: 15 | AQ279: 中钢转债
A280: 12 | B280: 123120 | C280: 隆华转债 | D280: 300263 | E280: 隆华科技 | F280: 机械装备 | G280: 通用设备 | H280: 151.6 | I280: 4.2699999999999995e-002 | J280: -1.9699999999999999e-002 | K280: 9.65 | L280: 2.9900000000000003e-002 | M280: 121.1 | N280: 7.76 | O280: 0.21899999999999997 | P280: 124.36 | Q280: 4月8天 | R280: 5.83年 | S280: 3.83年 | T280: 7.99 | U280: 147 | V280: 0.12300000000000001 | W280: 9.0999999999999998e-002 | X280: 0.113 | Y280: 88 | Z280: 3.15 | AA280: -3.85e-002 | AB280: -4.4299999999999999e-002 | AC280: -9.0500000000000011e-002 | AD280: -9.2100000000000015e-002 | AE280: 81.91 | AF280: 85.67 | AG280: 0.77 | AH280: AA- | AI280: 6.25e-002 | AJ280: =H280+100*O280 -> 173.5 | AK280: 178.8 | AL280: 322 | AM280: 93.2 | AN280: 329 | AO280: -0.18100000000000002 | AP280: 3 | AQ280: 隆华转债
A281: 346 | B281: 110043 | C281: 无锡转债! | D281: 600908 | E281: 无锡银行 | F281: 金融 | G281: 银行行业 | H281: 118.73 | I281: -5.1999999999999998e-003 | J281: -8.8000000000000005e-003 | K281: 5.82 | L281: -2.5099999999999997e-002 | M281: 108.3 | N281: 5.61 | O281: 0.14400000000000002 | P281: 103.74 | Q281: 转股中 | R281: 2.34年 | S281: 无权 | T281: 29.2 | U281: 28 | V281: 8.0000000000000002e-003 | W281: 0.27000000000000002 | X281: 0.28000000000000003 | Y281: 108 | Z281: 0.84 | AA281: -3.9100000000000003e-002 | AB281: -4.5400000000000003e-002 | AC281: 无权 | AD281: 无权 | AE281: 无权 | AF281: 100.48 | AG281: 0.56 | AH281: AA+ | AI281: 3.3099999999999997e-002 | AJ281: =H281+100*O281 -> 133.13 | AK281: 133.7 | AL281: 59 | AM281: 33.2 | AN281: 36 | AO281: -3.3000000000000002e-002 | AP281: 24 | AQ281: 无锡转债!
A282: 227 | B282: 123043 | C282: 正元转债! | D282: 300645 | E282: 正元智慧 | F282: 计算机及 | G282: 软件开发 | H282: 144.291 | I282: 1.26e-002 | J282: 2.46e-002 | K282: 19.2 | L282: 4.8600000000000004e-002 | M282: 120.9 | N282: 15.38 | O282: 0.156 | P282: 124.84 | Q282: 转股中 | R282: 4.43年 | S282: 2.43年 | T282: 1.66 | U282: 214 | V282: 0.88800000000000001 | W282: 6.8000000000000005e-002 | X282: 8.5000000000000006e-002 | Y282: 24 | Z282: 3.76 | AA282: -4.0000000000000001e-002 | AB282: -4.7599999999999996e-002 | AC282: -0.11800000000000001 | AD282: -0.121 | AE282: 87.06 | AF282: 89.51 | AG282: 0.76 | AH282: A+ | AI282: 7.2099999999999997e-002 | AJ282: =H282+100*O282 -> 159.89099999999999 | AK282: 163.7 | AL282: 293 | AM282: 74.2 | AN282: 302 | AO282: -8.5000000000000006e-002 | AP282: 18 | AQ282: 正元转债!
A283: 79 | B283: 113616 | C283: 韦尔转债! | D283: 603501 | E283: 韦尔股份 | F283: 电子 | G283: 元器件制 | H283: 142.62 | I283: 5.9999999999999995e-004 | J283: -4.1999999999999997e-003 | K283: 242.61 | L283: -5.6000000000000008e-003 | M283: 114.5 | N283: 222.52 | O283: 0.308 | P283: 109.03 | Q283: 转股中 | R283: 5.24年 | S283: 3.25年 | T283: 24.3 | U283: 74 | V283: 2.1000000000000001e-002 | W283: 1.2e-002 | X283: 1.3000000000000001e-002 | Y283: 2107. | Z283: 16.1 | AA283: -4.1599999999999998e-002 | AB283: -4.6199999999999998e-002 | AC283: -9.1499999999999998e-002 | AD283: -9.2899999999999996e-002 | AE283: 91.22 | AF283: 95.16 | AG283: 0.64 | AH283: AA+ | AI283: 3.6499999999999998e-002 | AJ283: =H283+100*O283 -> 173.42000000000002 | AK283: 176.2 | AL283: 317 | AM283: 81 | AN283: 313 | AO283: 5.0000000000000001e-003 | AP283: 9 | AQ283: 韦尔转债!
A284: 132 | B284: 113603 | C284: 东缆转债! | D284: 603606 | E284: 东方电缆 | F284: 能源电力 | G284: 电力设备 | H284: 141.48 | I284: 1.8100000000000002e-002 | J284: 2.06e-002 | K284: 29.8 | L284: 5.04e-002 | M284: 114.8 | N284: 23.65 | O284: 0.12300000000000001 | P284: 126 | Q284: 转股中 | R284: 4.98年 | S284: 2.99年 | T284: 8 | U284: 166 | V284: 0.14599999999999999 | W284: 4.0999999999999995e-002 | X284: 5.2000000000000005e-002 | Y284: 195 | Z284: 5.52 | AA284: -4.1700000000000001e-002 | AB284: -4.6699999999999998e-002 | AC284: -9.5600000000000004e-002 | AD284: -9.7299999999999998e-002 | AE284: 91.35 | AF284: 94.71 | AG284: 0.77 | AH284: AA | AI284: 4.0099999999999997e-002 | AJ284: =H284+100*O284 -> 153.78 | AK284: 157 | AL284: 262 | AM284: 62.2 | AN284: 236 | AO284: 6.7000000000000004e-002 | AP284: 7 | AQ284: 东缆转债!
A285: 14 | B285: 118001 | C285: 金博转债 | D285: 688598 | E285: XD金博股 | F285: 能源电力 | G285: 太阳能 | H285: 156.8 | I285: 3.7400000000000003e-002 | J285: -4.2300000000000004e-002 | K285: 350.97 | L285: -6.0999999999999995e-003 | M285: 121.6 | N285: 271.62 | O285: 0.21299999999999999 | P285: 129.21 | Q285: 4月1天 | R285: 5.81年 | S285: 3.81年 | T285: 6 | U285: 75 | V285: 8.199999999999999e-002 | W285: 2.1000000000000001e-002 | X285: 2.7999999999999997e-002 | Y285: 281 | Z285: 18.47 | AA285: -4.3700000000000003e-002 | AB285: -4.9500000000000002e-002 | AC285: -9.7699999999999995e-002 | AD285: -9.9499999999999991e-002 | AE285: 79.16 | AF285: 81.31 | AG285: 0.81 | AH285: A+ | AI285: 7.3499999999999996e-002 | AJ285: =H285+100*O285 -> 178.10000000000002 | AK285: 184.4 | AL285: 327 | AM285: 103.1 | AN285: 330 | AO285: -5.9000000000000004e-002 | AP285: 3 | AQ285: 金博转债
A286: 92 | B286: 123086 | C286: 海兰转债!! | D286: 300065 | E286: 海兰信 | F286: 电子 | G286: 电子产品 | H286: 155.498 | I286: 3.1099999999999999e-002 | J286: -3.4000000000000002e-003 | K286: 11.28 | L286: 3.2000000000000001e-002 | M286: 123.5 | N286: 7.27 | O286: 2.e-003 | P286: 155.16 | Q286: 转股中 | R286: 5.20年 | S286: 3.20年 | T286: 6.08 | U286: 392 | V286: 0.41100000000000003 | W286: 8.8000000000000009e-002 | X286: 0.13600000000000001 | Y286: 69 | Z286: 2.96 | AA286: -4.41e-002 | AB286: -5.1200000000000002e-002 | AC286: -0.11199999999999999 | AD286: -0.113 | AE286: 84.88 | AF286: 90.72 | AG286: 0.86 | AH286: AA- | AI286: 6.25e-002 | AJ286: =H286+100*O286 -> 155.69799999999998 | AK286: 155.8 | AL286: 251 | AM286: 65.1 | AN286: 262 | AO286: 1.9e-002 | AP286: 20 | AQ286: 海兰转债!!
A287: 295 | B287: 123025 | C287: 精测转债!! | D287: 300567 | E287: 精测电子 | F287: 电子 | G287: 液晶显示 | H287: 136.27 | I287: 2.46e-002 | J287: -2.1099999999999997e-002 | K287: 51.1 | L287: 5.8999999999999999e-003 | M287: 116.5 | N287: 49.37 | O287: 0.317 | P287: 103.5 | Q287: 转股中 | R287: 3.49年 | S287: 1.49年 | T287: 3.09 | U287: 10 | V287: 2.5000000000000001e-002 | W287: 2.2000000000000002e-002 | X287: 2.2000000000000002e-002 | Y287: 142 | Z287: 4.45 | AA287: -4.4699999999999997e-002 | AB287: -5.2499999999999998e-002 | AC287: -0.13699999999999998 | AD287: -0.13900000000000001 | AE287: 93.27 | AF287: 95.11 | AG287: 0.59 | AH287: AA- | AI287: 6.1100000000000002e-002 | AJ287: =H287+100*O287 -> 167.97 | AK287: 169 | AL287: 306 | AM287: 73.9 | AN287: 301 | AO287: -9.3000000000000013e-002 | AP287: 16 | AQ287: 精测转债!!
A288: 232 | B288: 128097 | C288: 奥佳转债!! | D288: 2614 | E288: 奥佳华 | F288: 机械装备 | G288: 专用设备 | H288: 140 | I288: -2.0999999999999999e-003 | J288: 1.3300000000000001e-002 | K288: 13.49 | L288: 1.43e-002 | M288: 114.9 | N288: 10.39 | O288: 7.8e-002 | P288: 129.84 | Q288: 转股中 | R288: 4.40年 | S288: 2.41年 | T288: 4.6 | U288: 28 | V288: 4.2999999999999997e-002 | W288: 5.4000000000000006e-002 | X288: 7.0000000000000007e-002 | Y288: 85 | Z288: 1.83 | AA288: -4.4699999999999997e-002 | AB288: -5.0300000000000004e-002 | AC288: -0.111 | AD288: -0.113 | AE288: 93.55 | AF288: 96.98 | AG288: 0.78 | AH288: AA | AI288: 4.0099999999999997e-002 | AJ288: =H288+100*O288 -> 147.80000000000001 | AK288: 150.2 | AL288: 207 | AM288: 53.2 | AN288: 181 | AO288: -6.7000000000000004e-002 | AP288: 19 | AQ288: 奥佳转债!!
A289: 37 | B289: 113048 | C289: 晶科转债! | D289: 601778 | E289: 晶科科技 | F289: 能源电力 | G289: 太阳能 | H289: 151.97 | I289: 1.2699999999999999e-002 | J289: 6.1999999999999998e-003 | K289: 8.51 | L289: 2.1600000000000001e-002 | M289: 117.1 | N289: 5.48 | O289: -2.1000000000000001e-002 | P289: 155.29 | Q289: 29天 | R289: 5.56年 | S289: 3.56年 | T289: 30 | U289: 943 | V289: 0.20699999999999999 | W289: 0.127 | X289: 0.19800000000000001 | Y289: 235 | Z289: 2.11 | AA289: -4.6500000000000007e-002 | AB289: -5.1500000000000004e-002 | AC289: -9.8299999999999998e-002 | AD289: -9.9900000000000003e-002 | AE289: 89.15 | AF289: 93.79 | AG289: 0.88 | AH289: AA | AI289: 4.1500000000000002e-002 | AJ289: =H289+100*O289 -> 149.87 | AK289: 148.6 | AL289: 199 | AM289: 54.9 | AN289: 197 | AO289: -0.105 | AP289: 14 | AQ289: 晶科转债!
A290: 234 | B290: 128096 | C290: 奥瑞转债!! | D290: 2701 | E290: 奥瑞金 | F290: 造纸包装 | G290: 包装材料 | H290: 141.8 | I290: 6.8600000000000008e-002 | J290: 1.6399999999999998e-002 | K290: 6.38 | L290: 0.10000000000000001 | M290: 115.5 | N290: 4.5 | O290: 0. | P290: 141.78 | Q290: 转股中 | R290: 4.37年 | S290: 2.37年 | T290: 6.74 | U290: 558 | V290: 0.58499999999999996 | W290: 4.4000000000000004e-002 | X290: 6.2e-002 | Y290: 155 | Z290: 2.23 | AA290: -4.6900000000000004e-002 | AB290: -5.2699999999999997e-002 | AC290: -0.11599999999999999 | AD290: -0.11800000000000001 | AE290: 95.25 | AF290: 99.71 | AG290: 0.85 | AH290: AA+ | AI290: 3.5099999999999999e-002 | AJ290: =H290+100*O290 -> 141.80000000000001 | AK290: 141.8 | AL290: 144 | AM290: 42.1 | AN290: 99 | AO290: 7.2999999999999995e-002 | AP290: 17 | AQ290: 奥瑞转债!!
A291: 42 | B291: 113047 | C291: 旗滨转债 | D291: 601636 | E291: 旗滨集团 | F291: 建筑 | G291: 玻璃 | H291: 148.9 | I291: 2.7699999999999999e-002 | J291: 4.5000000000000005e-003 | K291: 17.33 | L291: 4.0199999999999993e-002 | M291: 114 | N291: 12.8 | O291: 0.10000000000000001 | P291: 135.39 | Q291: 15天 | R291: 5.52年 | S291: 3.53年 | T291: 15 | U291: 217 | V291: 9.6999999999999989e-002 | W291: 3.2000000000000001e-002 | X291: 4.4000000000000004e-002 | Y291: 466 | Z291: 4.31 | AA291: -4.7800000000000002e-002 | AB291: -5.2000000000000005e-002 | AC291: -9.6699999999999994e-002 | AD291: -9.7799999999999998e-002 | AE291: 89.87 | AF291: 93.77 | AG291: 0.8 | AH291: AA+ | AI291: 3.6499999999999998e-002 | AJ291: =H291+100*O291 -> 158.90000000000001 | AK291: 162.4 | AL291: 287 | AM291: 68.6 | AN291: 281 | AO291: -0.22899999999999998 | AP291: 7 | AQ291: 旗滨转债
A292: 369 | B292: 113011 | C292: 光大转债 | D292: 601818 | E292: 光大银行 | F292: 金融 | G292: 银行行业 | H292: 114.65 | I292: 2.2000000000000001e-003 | J292: -3.3e-003 | K292: 3.39 | L292: -2.8999999999999998e-003 | M292: 106.8 | N292: 3.55 | O292: 0.20100000000000001 | P292: 95.49 | Q292: 转股中 | R292: 1.46年 | S292: 无权 | T292: 242 | U292: 47 | V292: 2.e-003 | W292: 0.13200000000000001 | X292: 0.126 | Y292: 1832. | Z292: 0.52 | AA292: -4.7899999999999998e-002 | AB292: -5.62e-002 | AC292: 无权 | AD292: 无权 | AE292: 无权 | AF292: 102.18 | AG292: 0.37 | AH292: AAA | AI292: 3.1099999999999999e-002 | AJ292: =H292+100*O292 -> 134.75 | AK292: 133.8 | AL292: 61 | AM292: 31.6 | AN292: 29 | AO292: -1.6e-002 | AP292: 15 | AQ292: 光大转债
A293: 251 | B293: 128082 | C293: 华锋转债!! | D293: 2806 | E293: 华锋股份 | F293: 电子 | G293: 元器件制 | H293: 150.193 | I293: 3.5000000000000003e-002 | J293: -1.1699999999999999e-002 | K293: 13.58 | L293: 2.7200000000000002e-002 | M293: 121.4 | N293: 9.13 | O293: 1.e-002 | P293: 148.74 | Q293: 转股中 | R293: 4.18年 | S293: 2.18年 | T293: 2.17 | U293: 163 | V293: 0.503 | W293: 8.4000000000000005e-002 | X293: 0.125 | Y293: 26 | Z293: 2.38 | AA293: -5.0900000000000001e-002 | AB293: -5.9000000000000004e-002 | AC293: -0.109 | AD293: -0.111 | AE293: 87.09 | AF293: 88.16 | AG293: 0.85 | AH293: A | AI293: 8.2100000000000006e-002 | AJ293: =H293+100*O293 -> 151.19300000000001 | AK293: 151.6 | AL293: 223 | AM293: 63.5 | AN293: 250 | AO293: -0.10199999999999999 | AP293: 53 | AQ293: 华锋转债!!
A294: 254 | B294: 113550 | C294: 常汽转债! | D294: 603035 | E294: 常熟汽饰 | F294: 汽车 | G294: 零部件制 | H294: 149.8 | I294: 1.9900000000000001e-002 | J294: -6.9999999999999993e-003 | K294: 12.5 | L294: 1.6299999999999999e-002 | M294: 121.3 | N294: 9.33 | O294: 0.11800000000000001 | P294: 133.98 | Q294: 转股中 | R294: 4年48天 | S294: 2年49天 | T294: 2.14 | U294: 32 | V294: 0.10000000000000001 | W294: 4.8000000000000001e-002 | X294: 6.4000000000000001e-002 | Y294: 45 | Z294: 1.17 | AA294: -5.0999999999999997e-002 | AB294: -5.91e-002 | AC294: -0.11199999999999999 | AD294: -0.114 | AE294: 91.11 | AF294: 95.57 | AG294: 0.79 | AH294: AA- | AI294: 6.1100000000000002e-002 | AJ294: =H294+100*O294 -> 161.60000000000002 | AK294: 165.6 | AL294: 300 | AM294: 70.1 | AN294: 288 | AO294: -7.2999999999999995e-002 | AP294: 17 | AQ294: 常汽转债!
A295: 122 | B295: 123071 | C295: 天能转债!! | D295: 300569 | E295: 天能重工 | F295: 能源电力 | G295: 风能 | H295: 157.3 | I295: 2.1400000000000002e-002 | J295: -7.6e-003 | K295: 12.43 | L295: 1.3899999999999999e-002 | M295: 121.1 | N295: 7.91 | O295: 1.e-003 | P295: 157.14 | Q295: 转股中 | R295: 5年20天 | S295: 3年21天 | T295: 6.95 | U295: 1124. | V295: 1.04 | W295: 7.0999999999999994e-002 | X295: 0.111 | Y295: 99 | Z295: 3.57 | AA295: -5.1399999999999994e-002 | AB295: -5.7999999999999996e-002 | AC295: -0.11900000000000001 | AD295: -0.121 | AE295: 85.75 | AF295: 89.76 | AG295: 1 | AH295: AA- | AI295: 6.25e-002 | AJ295: =H295+100*O295 -> 157.40000000000001 | AK295: 157.5 | AL295: 268 | AM295: 67.7 | AN295: 275 | AO295: 0.127 | AP295: 13 | AQ295: 天能转债!!
A296: 287 | B296: 113026 | C296: 核能转债! | D296: 601985 | E296: 中国核电 | F296: 能源电力 | G296: 核电 | H296: 131.34 | I296: 8.3999999999999995e-003 | J296: -1.6299999999999999e-002 | K296: 7.21 | L296: -9.5999999999999992e-003 | M296: 109.3 | N296: 5.73 | O296: 4.4000000000000004e-002 | P296: 125.83 | Q296: 转股中 | R296: 3.54年 | S296: 1.54年 | T296: 76 | U296: 670 | V296: 6.8000000000000005e-002 | W296: 5.9999999999999998e-002 | X296: 7.5999999999999998e-002 | Y296: 1259. | Z296: 2.02 | AA296: -5.1500000000000004e-002 | AB296: -5.5999999999999994e-002 | AC296: -0.11699999999999999 | AD296: -0.11900000000000001 | AE296: 97.29 | AF296: 97.63 | AG296: 0.82 | AH296: AAA | AI296: 3.3099999999999997e-002 | AJ296: =H296+100*O296 -> 135.74000000000001 | AK296: 136.9 | AL296: 95 | AM296: 39.2 | AN296: 73 | AO296: 7.400000000000001e-002 | AP296: 42 | AQ296: 核能转债!
A297: 19 | B297: 127040 | C297: 国泰转债 | D297: 2091 | E297: 江苏国泰 | F297: 商业零售 | G297: 商业零售 | H297: 151.99 | I297: 6.2899999999999998e-002 | J297: -2.52e-002 | K297: 12.77 | L297: 4.4199999999999996e-002 | M297: 112.5 | N297: 9.02 | O297: 7.400000000000001e-002 | P297: 141.57 | Q297: 3月15天 | R297: 5.77年 | S297: 3.77年 | T297: 45.6 | U297: 260 | V297: 3.7999999999999999e-002 | W297: 0.22800000000000001 | X297: 0.32299999999999995 | Y297: 200 | Z297: 2.17 | AA297: -5.1500000000000004e-002 | AB297: -5.5099999999999996e-002 | AC297: -9.4600000000000004e-002 | AD297: -9.5899999999999999e-002 | AE297: 89.53 | AF297: 91.77 | AG297: 0.85 | AH297: AA+ | AI297: 3.6499999999999998e-002 | AJ297: =H297+100*O297 -> 159.39000000000001 | AK297: 162.4 | AL297: 286 | AM297: 70.6 | AN297: 292 | AO297: -0.106 | AP297: 10 | AQ297: 国泰转债
A298: 33 | B298: 123114 | C298: 三角转债 | D298: 300775 | E298: 三角防务 | F298: 航空航天 | G298: 航空航天 | H298: 164.7 | I298: 3.2599999999999997e-002 | J298: -1.47e-002 | K298: 43.98 | L298: 2.18e-002 | M298: 121 | N298: 31.82 | O298: 0.192 | P298: 138.21 | Q298: 2月1天 | R298: 5.65年 | S298: 3.65年 | T298: 9.04 | U298: 90 | V298: 6.0999999999999999e-002 | W298: 4.0999999999999995e-002 | X298: 5.7000000000000002e-002 | Y298: 218 | Z298: 10.63 | AA298: -5.4000000000000006e-002 | AB298: -5.9900000000000002e-002 | AC298: -0.111 | AD298: -0.11199999999999999 | AE298: 82.65 | AF298: 86.52 | AG298: 0.82 | AH298: AA- | AI298: 6.25e-002 | AJ298: =H298+100*O298 -> 183.89999999999998 | AK298: 191.2 | AL298: 331 | AM298: 104.7 | AN298: 331 | AO298: -5.2000000000000005e-002 | AP298: 5 | AQ298: 三角转债
A299: 279 | B299: 113027 | C299: 华钰转债!! | D299: 601020 | E299: ST华钰 | F299: 有色金属 | G299: 锌铅镍锡 | H299: 140.57 | I299: 2.8199999999999999e-002 | J299: -2.4399999999999998e-002 | K299: 13.12 | L299: 4.5999999999999999e-003 | M299: 114.3 | N299: 10.17 | O299: 8.9999999999999997e-002 | P299: 129.01 | Q299: 转股中 | R299: 3.70年 | S299: 1.71年 | T299: 3.11 | U299: 513 | V299: 1.1699999999999999 | W299: 4.2999999999999997e-002 | X299: 5.5e-002 | Y299: 73 | Z299: 2.88 | AA299: -5.5300000000000002e-002 | AB299: -6.1600000000000002e-002 | AC299: -0.129 | AD299: -0.13100000000000001 | AE299: 88.79 | AF299: 85.83 | AG299: 0.83 | AH299: A | AI299: 8.2100000000000006e-002 | AJ299: =H299+100*O299 -> 149.56999999999999 | AK299: 152.1 | AL299: 227 | AM299: 63.3 | AN299: 248 | AO299: -0.13800000000000001 | AP299: 47 | AQ299: 华钰转债!!
A300: 219 | B300: 128101 | C300: 联创转债! | D300: 2036 | E300: 联创电子 | F300: 电子 | G300: 液晶显示 | H300: 147.909 | I300: 4.9299999999999997e-002 | J300: -1.5800000000000002e-002 | K300: 16.52 | L300: 4.6199999999999998e-002 | M300: 114.8 | N300: 13.72 | O300: 0.22800000000000001 | P300: 120.41 | Q300: 转股中 | R300: 4.46年 | S300: 2.46年 | T300: 3 | U300: 110 | V300: 0.25 | W300: 1.7000000000000001e-002 | X300: 2.1000000000000001e-002 | Y300: 176 | Z300: 4.64 | AA300: -5.62e-002 | AB300: -6.1699999999999998e-002 | AC300: -0.127 | AD300: -0.129 | AE300: 93.26 | AF300: 96.69 | AG300: 0.72 | AH300: AA | AI300: 4.0099999999999997e-002 | AJ300: =H300+100*O300 -> 170.709 | AK300: 175.4 | AL300: 315 | AM300: 78.7 | AN300: 308 | AO300: 1.7000000000000001e-002 | AP300: 15 | AQ300: 联创转债!
A301: 7 | B301: 127043 | C301: 川恒转债 | D301: 2895 | E301: 川恒股份 | F301: 化工 | G301: 农化 | H301: 168.89 | I301: 6.5599999999999992e-002 | J301: -2.1899999999999999e-002 | K301: 34.1 | L301: 4.9200000000000001e-002 | M301: 121 | N301: 21.02 | O301: 4.0999999999999995e-002 | P301: 162.23 | Q301: 4月21天 | R301: 5.86年 | S301: 3.87年 | T301: 11.6 | U301: 1100. | V301: 0.55799999999999994 | W301: 7.0000000000000007e-002 | X301: 0.113 | Y301: 167 | Z301: 5.45 | AA301: -5.62e-002 | AB301: -6.1799999999999994e-002 | AC301: -0.109 | AD301: -0.111 | AE301: 81.57 | AF301: 85.39 | AG301: 0.89 | AH301: AA- | AI301: 6.25e-002 | AJ301: =H301+100*O301 -> 172.98999999999998 | AK301: 175.6 | AL301: 316 | AM301: 90.2 | AN301: 324 | AO301: -0.14599999999999999 | AP301: 4 | AQ301: 川恒转债
A302: 304 | B302: 127011 | C302: 中鼎转2!! | D302: 887 | E302: 中鼎股份 | F302: 汽车 | G302: 零部件制 | H302: 140.2 | I302: 1.9599999999999999e-002 | J302: -1.4800000000000001e-002 | K302: 14.64 | L302: 6.1999999999999998e-003 | M302: 114.5 | N302: 11.39 | O302: 9.0999999999999998e-002 | P302: 128.53 | Q302: 转股中 | R302: 3.43年 | S302: 1.44年 | T302: 12 | U302: 61 | V302: 3.7000000000000005e-002 | W302: 6.7000000000000004e-002 | X302: 8.5999999999999993e-002 | Y302: 179 | Z302: 1.98 | AA302: -5.8299999999999998e-002 | AB302: -6.5199999999999994e-002 | AC302: -0.155 | AD302: -0.157 | AE302: 97.35 | AF302: 101.96 | AG302: 0.77 | AH302: AA+ | AI302: 3.5099999999999999e-002 | AJ302: =H302+100*O302 -> 149.29999999999998 | AK302: 151.9 | AL302: 225 | AM302: 49.9 | AN302: 160 | AO302: -0.13100000000000001 | AP302: 20 | AQ302: 中鼎转2!!
A303: 45 | B303: 123111 | C303: 东财转3 | D303: 300059 | E303: 东方财富 | F303: 金融 | G303: 证券行业 | H303: 155.1 | I303: 2.3099999999999999e-002 | J303: -5.3e-003 | K303: 34.37 | L303: 2.0499999999999997e-002 | M303: 110.5 | N303: 23.35 | O303: 5.4000000000000006e-002 | P303: 147.19 | Q303: 13天 | R303: 5.52年 | S303: 3.52年 | T303: 158 | U303: 820 | V303: 3.4000000000000002e-002 | W303: 4.4000000000000004e-002 | X303: 6.5000000000000002e-002 | Y303: 3552. | Z303: 9.76 | AA303: -6.0199999999999997e-002 | AB303: -6.3399999999999998e-002 | AC303: -0.105 | AD303: -0.106 | AE303: 89.44 | AF303: 90.88 | AG303: 0.87 | AH303: AA+ | AI303: 3.6499999999999998e-002 | AJ303: =H303+100*O303 -> 160.5 | AK303: 163 | AL303: 289 | AM303: 72.1 | AN303: 297 | AO303: 1.3000000000000001e-002 | AP303: 24 | AQ303: 东财转3
A304: 312 | B304: 113527 | C304: 维格转债!! | D304: 603518 | E304: 锦泓集团 | F304: 服装纺织 | G304: 服装行业 | H304: 146.37 | I304: 1.3899999999999999e-002 | J304: 1.7600000000000001e-002 | K304: 14.35 | L304: 3.7599999999999995e-002 | M304: 119.5 | N304: 9.85 | O304: 5.0000000000000001e-003 | P304: 145.69 | Q304: 转股中 | R304: 3.32年 | S304: 1.32年 | T304: 2.87 | U304: 229 | V304: 0.54200000000000004 | W304: 7.0999999999999994e-002 | X304: 0.10300000000000001 | Y304: 41 | Z304: 1.79 | AA304: -6.0400000000000002e-002 | AB304: -6.9599999999999995e-002 | AC304: -0.19 | AD304: -0.193 | AE304: 95.7 | AF304: 101.95 | AG304: 0.84 | AH304: AA | AI304: 5.0099999999999999e-002 | AJ304: =H304+100*O304 -> 146.87 | AK304: 147.1 | AL304: 184 | AM304: 45.1 | AN304: 124 | AO304: -7.8e-002 | AP304: 78 | AQ304: 维格转债!!
A305: 124 | B305: 123070 | C305: 鹏辉转债! | D305: 300438 | E305: 鹏辉能源 | F305: 汽车 | G305: 零部件制 | H305: 157.599 | I305: 7.0099999999999996e-002 | J305: -3.7200000000000004e-002 | K305: 27.4 | L305: 3.95e-002 | M305: 115.1 | N305: 20.08 | O305: 0.155 | P305: 136.45 | Q305: 转股中 | R305: 5年19天 | S305: 3年20天 | T305: 7.49 | U305: 269 | V305: 0.23300000000000001 | W305: 6.4000000000000001e-002 | X305: 8.8000000000000009e-002 | Y305: 117 | Z305: 4.8 | AA305: -6.13e-002 | AB305: -6.6100000000000006e-002 | AC305: -0.121 | AD305: -0.122 | AE305: 91 | AF305: 94.11 | AG305: 0.83 | AH305: AA | AI305: 4.1500000000000002e-002 | AJ305: =H305+100*O305 -> 173.09899999999999 | AK305: 178.7 | AL305: 320 | AM305: 84.6 | AN305: 316 | AO305: -4.2999999999999997e-002 | AP305: 7 | AQ305: 鹏辉转债!
A306: 342 | B306: 127005 | C306: 长证转债! | D306: 783 | E306: 长江证券 | F306: 金融 | G306: 证券行业 | H306: 126.187 | I306: 4.7999999999999996e-003 | J306: -1.6000000000000001e-003 | K306: 7.65 | L306: 5.3e-003 | M306: 108.3 | N306: 7.13 | O306: 0.17600000000000002 | P306: 107.29 | Q306: 转股中 | R306: 2.45年 | S306: 无权 | T306: 50 | U306: 21 | V306: 3.0000000000000001e-003 | W306: 0.11800000000000001 | X306: 0.127 | Y306: 423 | Z306: 1.47 | AA306: -6.1600000000000002e-002 | AB306: -6.7400000000000002e-002 | AC306: 无权 | AD306: 无权 | AE306: 无权 | AF306: 100.62 | AG306: 0.6 | AH306: AAA | AI306: 3.1099999999999999e-002 | AJ306: =H306+100*O306 -> 143.78700000000001 | AK306: 145.1 | AL306: 168 | AM306: 44.5 | AN306: 115 | AO306: -3.7000000000000005e-002 | AP306: 13 | AQ306: 长证转债!
A307: 365 | B307: 113013 | C307: 国君转债! | D307: 601211 | E307: 国泰君安 | F307: 金融 | G307: 证券行业 | H307: 119.4 | I307: -1.7000000000000001e-003 | J307: -5.6000000000000008e-003 | K307: 17.83 | L307: -1.7100000000000001e-002 | M307: 106.8 | N307: 18.45 | O307: 0.23600000000000002 | P307: 96.64 | Q307: 转股中 | R307: 1.77年 | S307: 无权 | T307: 69.9 | U307: 92 | V307: 1.1000000000000001e-002 | W307: 4.4000000000000004e-002 | X307: 4.2999999999999997e-002 | Y307: 1588. | Z307: 1.23 | AA307: -6.1699999999999998e-002 | AB307: -6.8400000000000002e-002 | AC307: 无权 | AD307: 无权 | AE307: 无权 | AF307: 101.23 | AG307: 0.43 | AH307: AAA | AI307: 3.1099999999999999e-002 | AJ307: =H307+100*O307 -> 143. | AK307: 142.2 | AL307: 149 | AM307: 40.9 | AN307: 85 | AO307: -3.3000000000000002e-002 | AP307: 12 | AQ307: 国君转债!
A308: 72 | B308: 113621 | C308: 彤程转债! | D308: 603650 | E308: 彤程新材 | F308: 化工 | G308: 橡胶塑料 | H308: 163.44 | I308: 4.07e-002 | J308: 8.0000000000000004e-004 | K308: 49.97 | L308: 4.6500000000000007e-002 | M308: 115.1 | N308: 32.62 | O308: 6.7000000000000004e-002 | P308: 153.19 | Q308: 转股中 | R308: 5.32年 | S308: 3.33年 | T308: 5.37 | U308: 199 | V308: 0.22899999999999998 | W308: 1.8000000000000002e-002 | X308: 2.7999999999999997e-002 | Y308: 297 | Z308: 12.29 | AA308: -6.480000000000001e-002 | AB308: -6.93e-002 | AC308: -0.12 | AD308: -0.121 | AE308: 90.02 | AF308: 93.09 | AG308: 0.89 | AH308: AA | AI308: 4.1500000000000002e-002 | AJ308: =H308+100*O308 -> 170.13999999999999 | AK308: 173.7 | AL308: 312 | AM308: 80.6 | AN308: 312 | AO308: -7.4999999999999997e-002 | AP308: 8 | AQ308: 彤程转债!
A309: 301 | B309: 123022 | C309: 长信转债!! | D309: 300088 | E309: 长信科技 | F309: 通信互联 | G309: 通信设备 | H309: 144.16 | I309: 2.2099999999999998e-002 | J309: -1.7100000000000001e-002 | K309: 7.41 | L309: 6.8000000000000005e-003 | M309: 114.3 | N309: 6.05 | O309: 0.17699999999999999 | P309: 122.48 | Q309: 转股中 | R309: 3.46年 | S309: 1.46年 | T309: 2.57 | U309: 19 | V309: 5.2000000000000005e-002 | W309: 1.3999999999999999e-002 | X309: 1.7000000000000001e-002 | Y309: 182 | Z309: 2.52 | AA309: -6.6000000000000003e-002 | AB309: -7.2700000000000001e-002 | AC309: -0.16399999999999998 | AD309: -0.16600000000000001 | AE309: 96.47 | AF309: 100.03 | AG309: 0.74 | AH309: AA | AI309: 4.0099999999999997e-002 | AJ309: =H309+100*O309 -> 161.85999999999999 | AK309: 165.8 | AL309: 301 | AM309: 65.8 | AN309: 265 | AO309: -5.5e-002 | AP309: 12 | AQ309: 长信转债!!
A310: 215 | B310: 128103 | C310: 同德转债! | D310: 2360 | E310: 同德化工 | F310: 化工 | G310: 化工 | H310: 164.325 | I310: 1.2500000000000001e-002 | J310: 1.e-002 | K310: 8.06 | L310: 2.5399999999999999e-002 | M310: 121.3 | N310: 5.08 | O310: 3.6000000000000004e-002 | P310: 158.66 | Q310: 转股中 | R310: 4.48年 | S310: 2.49年 | T310: 1.03 | U310: 82 | V310: 0.48299999999999998 | W310: 3.2000000000000001e-002 | X310: 5.0999999999999997e-002 | Y310: 32 | Z310: 2.45 | AA310: -6.6799999999999998e-002 | AB310: -7.4099999999999999e-002 | AC310: -0.111 | AD310: -0.113 | AE310: 86.82 | AF310: 89.46 | AG310: 0.88 | AH310: A+ | AI310: 7.2099999999999997e-002 | AJ310: =H310+100*O310 -> 167.92499999999998 | AK310: 170 | AL310: 308 | AM310: 80.5 | AN310: 311 | AO310: -0.17199999999999999 | AP310: 18 | AQ310: 同德转债!
A311: 348 | B311: 128033 | C311: 迪龙转债! | D311: 2658 | E311: 雪迪龙 | F311: 城市公用 | G311: 三废处理 | H311: 126.88 | I311: -8.8000000000000005e-003 | J311: -2.9999999999999997e-004 | K311: 10.22 | L311: -1.26e-002 | M311: 108.8 | N311: 8.71 | O311: 8.1000000000000003e-002 | P311: 117.34 | Q311: 转股中 | R311: 2.24年 | S311: 0.24年 | T311: 2.98 | U311: 257 | V311: 0.67700000000000005 | W311: 4.5999999999999999e-002 | X311: 5.4000000000000006e-002 | Y311: 64 | Z311: 2.68 | AA311: -6.7299999999999999e-002 | AB311: -7.400000000000001e-002 | AC311: -0.52300000000000002 | AD311: -0.52900000000000003 | AE311: 100.02 | AF311: 100.2 | AG311: 0.73 | AH311: AA | AI311: 3.8100000000000002e-002 | AJ311: =H311+100*O311 -> 134.97999999999999 | AK311: 136.4 | AL311: 92 | AM311: 36.2 | AN311: 57 | AO311: 5.7999999999999996e-002 | AP311: 35 | AQ311: 迪龙转债!
A312: 281 | B312: 113537 | C312: 文灿转债!! | D312: 603348 | E312: 文灿股份 | F312: 汽车 | G312: 零部件制 | H312: 155.58 | I312: 2.0299999999999999e-002 | J312: 1.5600000000000001e-002 | K312: 28.1 | L312: 4.2300000000000004e-002 | M312: 120.7 | N312: 19.28 | O312: 6.7000000000000004e-002 | P312: 145.75 | Q312: 转股中 | R312: 3.69年 | S312: 1.69年 | T312: 1.41 | U312: 45 | V312: 0.20600000000000002 | W312: 1.9e-002 | X312: 2.7999999999999997e-002 | Y312: 74 | Z312: 2.79 | AA312: -6.7799999999999999e-002 | AB312: -7.6499999999999999e-002 | AC312: -0.16200000000000001 | AD312: -0.16500000000000001 | AE312: 92.89 | AF312: 97.47 | AG312: 0.85 | AH312: AA- | AI312: 6.1100000000000002e-002 | AJ312: =H312+100*O312 -> 162.28 | AK312: 165.4 | AL312: 299 | AM312: 67.9 | AN312: 279 | AO312: -0.13600000000000001 | AP312: 25 | AQ312: 文灿转债!!
A313: 256 | B313: 123035 | C313: 利德转债!! | D313: 300296 | E313: 利亚德 | F313: 电子 | G313: LED制 | H313: 153.63 | I313: 4.4199999999999996e-002 | J313: 5.4000000000000003e-003 | K313: 10.36 | L313: 5.7099999999999998e-002 | M313: 115.1 | N313: 6.96 | O313: 3.2000000000000001e-002 | P313: 148.85 | Q313: 转股中 | R313: 4年44天 | S313: 2年45天 | T313: 7.99 | U313: 465 | V313: 0.38100000000000001 | W313: 2.9999999999999999e-002 | X313: 4.4999999999999998e-002 | Y313: 263 | Z313: 3.57 | AA313: -6.9000000000000006e-002 | AB313: -7.4900000000000008e-002 | AC313: -0.121 | AD313: -0.12300000000000001 | AE313: 95.83 | AF313: 100.18 | AG313: 0.87 | AH313: AA+ | AI313: 3.5099999999999999e-002 | AJ313: =H313+100*O313 -> 156.82999999999998 | AK313: 158.4 | AL313: 272 | AM313: 58.2 | AN313: 219 | AO313: 1.9e-002 | AP313: 14 | AQ313: 利德转债!!
A314: 80 | B314: 123092 | C314: 天壕转债! | D314: 300332 | E314: 天壕环境 | F314: 石油天然 | G314: 天然气 | H314: 177.646 | I314: 2.9999999999999997e-004 | J314: 1.9199999999999998e-002 | K314: 8.35 | L314: 2.2000000000000002e-002 | M314: 121.6 | N314: 5.19 | O314: 0.10400000000000001 | P314: 160.89 | Q314: 转股中 | R314: 5.23年 | S314: 3.23年 | T314: 4.23 | U314: 101 | V314: 0.13300000000000001 | W314: 5.7999999999999996e-002 | X314: 9.3000000000000013e-002 | Y314: 73 | Z314: 2.17 | AA314: -7.1300000000000002e-002 | AB314: -7.7600000000000002e-002 | AC314: -0.14099999999999999 | AD314: -0.14300000000000002 | AE314: 82.47 | AF314: 84.71 | AG314: 0.89 | AH314: A+ | AI314: 7.3499999999999996e-002 | AJ314: =H314+100*O314 -> 188.04599999999999 | AK314: 194.4 | AL314: 333 | AM314: 109.7 | AN314: 336 | AO314: 5.0000000000000003e-002 | AP314: 9 | AQ314: 天壕转债!
A315: 66 | B315: 118000 | C315: 嘉元转债! | D315: 688388 | E315: 嘉元科技 | F315: 电子 | G315: 电子产品 | H315: 179.72 | I315: 9.9199999999999997e-002 | J315: 1.1000000000000001e-002 | K315: 142.11 | L315: 0.121 | M315: 121 | N315: 78.74 | O315: -4.0000000000000001e-003 | P315: 180.48 | Q315: 转股中 | R315: 5.40年 | S315: 3.40年 | T315: 12.4 | U315: 995 | V315: 0.45100000000000001 | W315: 3.7999999999999999e-002 | X315: 6.8000000000000005e-002 | Y315: 328 | Z315: 11.73 | AA315: -7.1900000000000006e-002 | AB315: -7.7800000000000008e-002 | AC315: -0.13800000000000001 | AD315: -0.14000000000000001 | AE315: 83.91 | AF315: 87.84 | AG315: 0.91 | AH315: AA- | AI315: 6.25e-002 | AJ315: =H315+100*O315 -> 179.31999999999999 | AK315: 179 | AL315: 323 | AM315: 91.1 | AN315: 325 | AO315: 0.17399999999999999 | AP315: 5 | AQ315: 嘉元转债!
A316: 96 | B316: 123083 | C316: 朗新转债! | D316: 300682 | E316: 朗新科技 | F316: 计算机及 | G316: 软件开发 | H316: 169.339 | I316: 7.17e-002 | J316: -2.0099999999999996e-002 | K316: 25.82 | L316: 5.6500000000000002e-002 | M316: 115.1 | N316: 15.4 | O316: 1.e-002 | P316: 167.66 | Q316: 转股中 | R316: 5.19年 | S316: 3.19年 | T316: 7.84 | U316: 466 | V316: 0.35700000000000004 | W316: 2.8999999999999998e-002 | X316: 4.9000000000000002e-002 | Y316: 266 | Z316: 5.01 | AA316: -7.2900000000000006e-002 | AB316: -7.7399999999999997e-002 | AC316: -0.13300000000000001 | AD316: -0.13500000000000001 | AE316: 90.5 | AF316: 93.59 | AG316: 0.91 | AH316: AA | AI316: 4.1500000000000002e-002 | AJ316: =H316+100*O316 -> 170.339 | AK316: 171 | AL316: 310 | AM316: 77.4 | AN316: 305 | AO316: 0.18100000000000002 | AP316: 6 | AQ316: 朗新转债!
A317: 81 | B317: 113615 | C317: 金诚转债! | D317: 603979 | E317: 金诚信 | F317: 有色金属 | G317: 有色行业 | H317: 175.78 | I317: 7.690000000000001e-002 | J317: 1.1000000000000001e-003 | K317: 21.38 | L317: 8.4700000000000011e-002 | M317: 117.3 | N317: 12.65 | O317: 4.0000000000000001e-002 | P317: 169.01 | Q317: 转股中 | R317: 5.23年 | S317: 3.23年 | T317: 8.66 | U317: 250 | V317: 0.16800000000000001 | W317: 6.9000000000000006e-002 | X317: 0.11599999999999999 | Y317: 126 | Z317: 2.65 | AA317: -7.5700000000000003e-002 | AB317: -8.0799999999999997e-002 | AC317: -0.14000000000000001 | AD317: -0.14199999999999999 | AE317: 90.55 | AF317: 95.25 | AG317: 0.92 | AH317: AA | AI317: 4.1500000000000002e-002 | AJ317: =H317+100*O317 -> 179.78 | AK317: 182.5 | AL317: 325 | AM317: 87.3 | AN317: 320 | AO317: -9.3000000000000013e-002 | AP317: 4 | AQ317: 金诚转债!
A318: 23 | B318: 113051 | C318: 节能转债 | D318: 601016 | E318: 节能风电 | F318: 能源电力 | G318: 风能 | H318: 179.34 | I318: 6.7400000000000002e-002 | J318: 2.81e-002 | K318: 7.89 | L318: 0.10000000000000001 | M318: 114.5 | N318: 4.05 | O318: -7.9000000000000001e-002 | P318: 194.81 | Q318: 2月26天 | R318: 5.72年 | S318: 3.73年 | T318: 30 | U318: 3713. | V318: 0.71599999999999997 | W318: 7.5999999999999998e-002 | X318: 0.14800000000000002 | Y318: 396 | Z318: 3.88 | AA318: -7.6299999999999993e-002 | AB318: -8.0299999999999996e-002 | AC318: -0.128 | AD318: -0.129 | AE318: 89.67 | AF318: 93.54 | AG318: 0.95 | AH318: AA+ | AI318: 3.6499999999999998e-002 | AJ318: =H318+100*O318 -> 171.44 | AK318: 163.9 | AL318: 294 | AM318: 70.3 | AN318: 290 | AO318: 0.35399999999999998 | AP318: 7 | AQ318: 节能转债
A319: 26 | B319: 127038 | C319: 国微转债 | D319: 2049 | E319: 紫光国微 | F319: 电子 | G319: 芯片制造 | H319: 183.23 | I319: 2.1600000000000001e-002 | J319: -2.e-003 | K319: 206.8 | L319: 2.2499999999999999e-002 | M319: 114.5 | N319: 137.78 | O319: 0.221 | P319: 150.09 | Q319: 2月18天 | R319: 5.69年 | S319: 3.69年 | T319: 15 | U319: 97 | V319: 3.5000000000000003e-002 | W319: 1.2e-002 | X319: 1.8000000000000002e-002 | Y319: 1255. | Z319: 20.95 | AA319: -8.0199999999999994e-002 | AB319: -8.4199999999999997e-002 | AC319: -0.13300000000000001 | AD319: -0.13400000000000001 | AE319: 89.76 | AF319: 93.64 | AG319: 0.87 | AH319: AA+ | AI319: 3.6499999999999998e-002 | AJ319: =H319+100*O319 -> 205.32999999999998 | AK319: 216.4 | AL319: 343 | AM319: 122.7 | AN319: 342 | AO319: -2.2000000000000002e-002 | AP319: 5 | AQ319: 国微转债
A320: 278 | B320: 123028 | C320: 清水转债! | D320: 300437 | E320: 清水源 | F320: 城市公用 | G320: 三废处理 | H320: 164.58 | I320: 1.5900000000000001e-002 | J320: -3.8100000000000002e-002 | K320: 19.81 | L320: -2.46e-002 | M320: 121 | N320: 11.84 | O320: -1.6e-002 | P320: 167.31 | Q320: 转股中 | R320: 3.72年 | S320: 1.72年 | T320: 3.13 | U320: 4613. | V320: 8.6300000000000008 | W320: 7.2000000000000008e-002 | X320: 0.12 | Y320: 44 | Z320: 4.21 | AA320: -8.1199999999999994e-002 | AB320: -8.9700000000000002e-002 | AC320: -0.17699999999999999 | AD320: -0.17899999999999999 | AE320: 91.27 | AF320: 94.05 | AG320: 0.9 | AH320: A+ | AI320: 7.2099999999999997e-002 | AJ320: =H320+100*O320 -> 162.98000000000002 | AK320: 161.8 | AL320: 281 | AM320: 67.8 | AN320: 276 | AO320: 0.442 | AP320: 50 | AQ320: 清水转债!
A321: 27 | B321: 113049 | C321: 长汽转债 | D321: 601633 | E321: 长城汽车 | F321: 汽车 | G321: 乘用车 | H321: 178.52 | I321: 5.0599999999999999e-002 | J321: -3.1699999999999999e-002 | K321: 52.6 | L321: 2.2700000000000001e-002 | M321: 110.5 | N321: 38.3 | O321: 0.29999999999999999 | P321: 137.34 | Q321: 2月18天 | R321: 5.69年 | S321: 3.69年 | T321: 35 | U321: 208 | V321: 3.4000000000000002e-002 | W321: 6.9999999999999993e-003 | X321: 1.e-002 | Y321: 4858. | Z321: 8.19 | AA321: -8.1600000000000006e-002 | AB321: -8.4600000000000009e-002 | AC321: -0.129 | AD321: -0.13 | AE321: 89.77 | AF321: 91.32 | AG321: 0.83 | AH321: AAA | AI321: 3.4500000000000003e-002 | AJ321: =H321+100*O321 -> 208.52000000000001 | AK321: 219.7 | AL321: 347 | AM321: 128.4 | AN321: 349 | AO321: -0.109 | AP321: 5 | AQ321: 长汽转债
A322: 361 | B322: 113502 | C322: 嘉澳转债! | D322: 603822 | E322: 嘉澳环保 | F322: 化工 | G322: 化工 | H322: 132.97 | I322: -6.3e-003 | J322: 5.0000000000000001e-003 | K322: 51.94 | L322: -1.7000000000000001e-003 | M322: 111.3 | N322: 44.64 | O322: 0.14300000000000002 | P322: 116.35 | Q322: 转股中 | R322: 2年41天 | S322: 41天 | T322: 1.85 | U322: 66 | V322: 0.26700000000000002 | W322: 4.8000000000000001e-002 | X322: 5.5999999999999994e-002 | Y322: 38 | Z322: 4.68 | AA322: -8.2299999999999998e-002 | AB322: -9.0999999999999998e-002 | AC322: -0.90900000000000003 | AD322: -0.91900000000000004 | AE322: 100.2 | AF322: 98.84 | AG322: 0.72 | AH322: AA- | AI322: 5.91e-002 | AJ322: =H322+100*O322 -> 147.27000000000001 | AK322: 149.6 | AL322: 202 | AM322: 49.4 | AN322: 157 | AO322: 5.7000000000000002e-002 | AP322: 36 | AQ322: 嘉澳转债!
A323: 61 | B323: 123103 | C323: 震安转债 | D323: 300767 | E323: 震安科技 | F323: 化工 | G323: 橡胶塑料 | H323: 192.041 | I323: -5.0000000000000001e-003 | J323: 8.9999999999999998e-004 | K323: 109 | L323: -4.4000000000000003e-003 | M323: 121.4 | N323: 56.89 | O323: 2.e-003 | P323: 191.6 | Q323: 转股中 | R323: 5.45年 | S323: 3.45年 | T323: 2.71 | U323: 286 | V323: 0.54299999999999993 | W323: 1.2e-002 | X323: 2.4e-002 | Y323: 220 | Z323: 19.19 | AA323: -8.2299999999999998e-002 | AB323: -8.8200000000000001e-002 | AC323: -0.14999999999999999 | AD323: -0.151 | AE323: 81.2 | AF323: 83.29 | AG323: 0.94 | AH323: A+ | AI323: 7.3499999999999996e-002 | AJ323: =H323+100*O323 -> 192.24099999999999 | AK323: 192.5 | AL323: 332 | AM323: 109.2 | AN323: 335 | AO323: 5.2999999999999999e-002 | AP323: 5 | AQ323: 震安转债
A324: 142 | B324: 113039 | C324: 嘉泽转债!! | D324: 601619 | E324: 嘉泽新能 | F324: 能源电力 | G324: 风能 | H324: 173.23 | I324: 7.4400000000000008e-002 | J324: 7.4000000000000003e-003 | K324: 6.1 | L324: 8.7300000000000003e-002 | M324: 112.8 | N324: 3.46 | O324: -1.7000000000000001e-002 | P324: 176.3 | Q324: 转股中 | R324: 4.90年 | S324: 2.90年 | T324: 3.57 | U324: 2152. | V324: 3.52 | W324: 2.5000000000000001e-002 | X324: 4.4000000000000004e-002 | Y324: 144 | Z324: 3.3 | AA324: -8.5199999999999998e-002 | AB324: -8.9200000000000002e-002 | AC324: -0.152 | AD324: -0.10000000000000001 | AE324: 91.66 | AF324: 93.37 | AG324: 0.94 | AH324: AA | AI324: 4.0099999999999997e-002 | AJ324: =H324+100*O324 -> 171.53 | AK324: 170.2 | AL324: 309 | AM324: 76.8 | AN324: 304 | AO324: 0.153 | AP324: 37 | AQ324: 嘉泽转债!!
A325: 257 | B325: 110061 | C325: 川投转债! | D325: 600674 | E325: 川投能源 | F325: 能源电力 | G325: 水电 | H325: 160.21 | I325: -9.0000000000000011e-003 | J325: 2.1899999999999999e-002 | K325: 14.37 | L325: 1.41e-002 | M325: 110.8 | N325: 9.2 | O325: 2.6000000000000002e-002 | P325: 156.2 | Q325: 转股中 | R325: 4年41天 | S325: 2年42天 | T325: 39.6 | U325: 308 | V325: 4.8000000000000001e-002 | W325: 6.3e-002 | X325: 9.8000000000000004e-002 | Y325: 633 | Z325: 2.19 | AA325: -8.7300000000000003e-002 | AB325: -9.1400000000000009e-002 | AC325: -0.13300000000000001 | AD325: -0.13400000000000001 | AE325: 95.98 | AF325: 97.2 | AG325: 0.92 | AH325: AAA | AI325: 3.3099999999999997e-002 | AJ325: =H325+100*O325 -> 162.81 | AK325: 164.2 | AL325: 295 | AM325: 67 | AN325: 272 | AO325: 0.11 | AP325: 13 | AQ325: 川投转债!
A326: 127 | B326: 123069 | C326: 金诺转债!! | D326: 300505 | E326: 川金诺 | F326: 化工 | G326: 农化 | H326: 201.18 | I326: 9.9299999999999999e-002 | J326: 1.37e-002 | K326: 37.44 | L326: 0.121 | M326: 126 | N326: 19.09 | O326: 2.6000000000000002e-002 | P326: 196.12 | Q326: 转股中 | R326: 5年15天 | S326: 3年16天 | T326: 2.25 | U326: 4605. | V326: 9.9800000000000004 | W326: 4.4000000000000004e-002 | X326: 8.5000000000000006e-002 | Y326: 52 | Z326: 4.98 | AA326: -9.01e-002 | AB326: -9.7500000000000003e-002 | AC326: -0.113 | AD326: -0.114 | AE326: 85.74 | AF326: 93.44 | AG326: 0.93 | AH326: AA- | AI326: 6.25e-002 | AJ326: =H326+100*O326 -> 203.78 | AK326: 206.2 | AL326: 336 | AM326: 112.8 | AN326: 339 | AO326: -0.13300000000000001 | AP326: 17 | AQ326: 金诺转债!!
A327: 185 | B327: 128113 | C327: 比音转债! | D327: 2832 | E327: 比音勒芬 | F327: 服装纺织 | G327: 服装行业 | H327: 182.31 | I327: 5.6999999999999993e-003 | J327: 1.4499999999999999e-002 | K327: 25.49 | L327: 2.1600000000000001e-002 | M327: 116.9 | N327: 14.6 | O327: 4.4000000000000004e-002 | P327: 174.59 | Q327: 转股中 | R327: 4.71年 | S327: 2.71年 | T327: 3.02 | U327: 12 | V327: 2.2000000000000002e-002 | W327: 2.2000000000000002e-002 | X327: 3.7999999999999999e-002 | Y327: 140 | Z327: 5.11 | AA327: -9.1499999999999998e-002 | AB327: -9.6999999999999989e-002 | AC327: -0.11800000000000001 | AD327: -0.11900000000000001 | AE327: 92.45 | AF327: 97.5 | AG327: 0.93 | AH327: AA | AI327: 4.0099999999999997e-002 | AJ327: =H327+100*O327 -> 186.71000000000001 | AK327: 190 | AL327: 329 | AM327: 92.5 | AN327: 327 | AO327: -4.0999999999999995e-002 | AP327: 9 | AQ327: 比音转债!
A328: 146 | B328: 110074 | C328: 精达转债!! | D328: 600577 | E328: 精达股份 | F328: 电子 | G328: 电子产品 | H328: 189.55 | I328: 8.7100000000000011e-002 | J328: -5.0000000000000001e-003 | K328: 7.13 | L328: 8.6899999999999991e-002 | M328: 116.9 | N328: 3.73 | O328: -8.0000000000000002e-003 | P328: 191.15 | Q328: 转股中 | R328: 4.88年 | S328: 2.89年 | T328: 5.49 | U328: 649 | V328: 0.63 | W328: 3.9e-002 | X328: 7.400000000000001e-002 | Y328: 141 | Z328: 3.46 | AA328: -9.5600000000000004e-002 | AB328: -0.10099999999999999 | AC328: -0.114 | AD328: -0.115 | AE328: 91.8 | AF328: 96.82 | AG328: 0.95 | AH328: AA | AI328: 4.0099999999999997e-002 | AJ328: =H328+100*O328 -> 188.75 | AK328: 187.9 | AL328: 328 | AM328: 91.1 | AN328: 326 | AO328: -0.10400000000000001 | AP328: 12 | AQ328: 精达转债!!
A329: 327 | B329: 123014 | C329: 凯发转债! | D329: 300407 | E329: 凯发电气 | F329: 能源电力 | G329: 电力设备 | H329: 129.68 | I329: 8.8000000000000005e-003 | J329: 8.6999999999999994e-003 | K329: 8.5 | L329: 2.7799999999999998e-002 | M329: 107.5 | N329: 8.05 | O329: 0.22800000000000001 | P329: 105.59 | Q329: 转股中 | R329: 1.82年 | S329: 回售内 | T329: 1.16 | U329: 28 | V329: 0.183 | W329: 4.4999999999999998e-002 | X329: 4.7e-002 | Y329: 26 | Z329: 1.89 | AA329: -9.849999999999999e-002 | AB329: -0.105 | AC329: 回售内 | AD329: 回售内 | AE329: 100.25 | AF329: 95.11 | AG329: 0.63 | AH329: A+ | AI329: 7.0099999999999996e-002 | AJ329: =H329+100*O329 -> 152.48000000000002 | AK329: 153.8 | AL329: 236 | AM329: 53.5 | AN329: 184 | AO329: 2.e-003 | AP329: 16 | AQ329: 凯发转债!
A330: 83 | B330: 123089 | C330: 九洲转2!! | D330: 300040 | E330: 九洲集团 | F330: 能源电力 | G330: 电力设备 | H330: 207 | I330: 3.2199999999999999e-002 | J330: 3.32e-002 | K330: 11.45 | L330: 6.9099999999999995e-002 | M330: 121 | N330: 5.68 | O330: 2.7000000000000003e-002 | P330: 201.58 | Q330: 转股中 | R330: 5.22年 | S330: 3.23年 | T330: 3.06 | U330: 3109. | V330: 4.8099999999999996 | W330: 4.5999999999999999e-002 | X330: 9.1999999999999998e-002 | Y330: 67 | Z330: 1.92 | AA330: -9.9299999999999999e-002 | AB330: -0.105 | AC330: -0.107 | AD330: -0.10800000000000001 | AE330: 84.81 | AF330: 88.77 | AG330: 0.95 | AH330: AA- | AI330: 6.25e-002 | AJ330: =H330+100*O330 -> 209.69999999999999 | AK330: 212.4 | AL330: 340 | AM330: 123.6 | AN330: 344 | AO330: 0.14999999999999999 | AP330: 20 | AQ330: 九洲转2!!
A331: 60 | B331: 123102 | C331: 华自转债 | D331: 300490 | E331: 华自科技 | F331: 机械装备 | G331: 机器人及 | H331: 225.5 | I331: 5.1299999999999998e-002 | J331: -8.8000000000000005e-003 | K331: 21.02 | L331: 4.4699999999999997e-002 | M331: 126.9 | N331: 9.25 | O331: -8.0000000000000002e-003 | P331: 227.24 | Q331: 转股中 | R331: 5.45年 | S331: 3.45年 | T331: 4.08 | U331: 1632. | V331: 1.78 | W331: 7.0999999999999994e-002 | X331: 0.161 | Y331: 58 | Z331: 3.05 | AA331: -0.10199999999999999 | AB331: -0.109 | AC331: -0.10400000000000001 | AD331: -0.105 | AE331: 84.55 | AF331: 91.97 | AG331: 0.95 | AH331: AA- | AI331: 6.25e-002 | AJ331: =H331+100*O331 -> 224.69999999999999 | AK331: 223.8 | AL331: 348 | AM331: 131.8 | AN331: 351 | AO331: -0.21899999999999997 | AP331: 26 | AQ331: 华自转债
A332: 267 | B332: 113545 | C332: 金能转债! | D332: 603113 | E332: 金能科技 | F332: 煤炭 | G332: 炼焦 | H332: 176.76 | I332: 2.76e-002 | J332: -2.2700000000000001e-002 | K332: 16.94 | L332: 5.3e-003 | M332: 114.9 | N332: 10.43 | O332: 8.8000000000000009e-002 | P332: 162.42 | Q332: 转股中 | R332: 4年13天 | S332: 2年14天 | T332: 9.87 | U332: 220 | V332: 0.127 | W332: 6.8000000000000005e-002 | X332: 0.111 | Y332: 144 | Z332: 1.71 | AA332: -0.10300000000000001 | AB332: -0.109 | AC332: -0.16300000000000001 | AD332: -0.16500000000000001 | AE332: 94.91 | AF332: 98.39 | AG332: 0.91 | AH332: AA | AI332: 4.0099999999999997e-002 | AJ332: =H332+100*O332 -> 185.56 | AK332: 191.1 | AL332: 330 | AM332: 92.7 | AN332: 328 | AO332: -0.157 | AP332: 15 | AQ332: 金能转债!
A333: 55 | B333: 127030 | C333: 盛虹转债! | D333: 301 | E333: 东方盛虹 | F333: 化工 | G333: 化纤 | H333: 208.928 | I333: 6.9800000000000001e-002 | J333: -3.4000000000000002e-003 | K333: 28.12 | L333: 6.9199999999999998e-002 | M333: 112.5 | N333: 14.1 | O333: 4.8000000000000001e-002 | P333: 199.43 | Q333: 转股中 | R333: 5.47年 | S333: 3.48年 | T333: 50 | U333: 463 | V333: 4.4999999999999998e-002 | W333: 3.7000000000000005e-002 | X333: 7.2999999999999995e-002 | Y333: 1360. | Z333: 7.47 | AA333: -0.10800000000000001 | AB333: -0.11199999999999999 | AC333: -0.16800000000000001 | AD333: -0.16899999999999998 | AE333: 90.47 | AF333: 92.74 | AG333: 0.96 | AH333: AA+ | AI333: 3.6499999999999998e-002 | AJ333: =H333+100*O333 -> 213.72800000000001 | AK333: 218.4 | AL333: 345 | AM333: 125.7 | AN333: 347 | AO333: -0.16200000000000001 | AP333: 6 | AQ333: 盛虹转债!
A334: 226 | B334: 113568 | C334: 新春转债!! | D334: 603667 | E334: 五洲新春 | F334: 机械装备 | G334: 通用设备 | H334: 207.17 | I334: 6.6100000000000006e-002 | J334: -7.6e-003 | K334: 18.1 | L334: 6.1600000000000002e-002 | M334: 124.3 | N334: 8.75 | O334: 2.e-003 | P334: 206.86 | Q334: 转股中 | R334: 4.43年 | S334: 2.43年 | T334: 2.54 | U334: 474 | V334: 0.90799999999999992 | W334: 4.7e-002 | X334: 9.8000000000000004e-002 | Y334: 54 | Z334: 2.98 | AA334: -0.111 | AB334: -0.11900000000000001 | AC334: -0.158 | AD334: -0.159 | AE334: 89.52 | AF334: 96.22 | AG334: 0.95 | AH334: AA- | AI334: 6.1100000000000002e-002 | AJ334: =H334+100*O334 -> 207.36999999999998 | AK334: 207.5 | AL334: 337 | AM334: 111.3 | AN334: 337 | AO334: 6.2e-002 | AP334: 44 | AQ334: 新春转债!!
A335: 217 | B335: 123047 | C335: 久吾转债!* | D335: 300631 | E335: 久吾高科 | F335: 机械装备 | G335: 专用设备 | H335: 218.623 | I335: 5.6100000000000004e-002 | J335: 9.8999999999999991e-003 | K335: 38.9 | L335: 6.6000000000000003e-002 | M335: 129.6 | N335: 17.43 | O335: -2.e-002 | P335: 223.18 | Q335: 转股中 | R335: 4.47年 | S335: 2.47年 | T335: 1.33 | U335: 1704. | V335: 5.7999999999999998 | W335: 3.2000000000000001e-002 | X335: 7.0000000000000007e-002 | Y335: 42 | Z335: 5.22 | AA335: -0.113 | AB335: -0.122 | AC335: -0.161 | AD335: -0.16300000000000001 | AE335: 88.11 | AF335: 95.86 | AG335: 1 | AH335: A+ | AI335: 7.2099999999999997e-002 | AJ335: =H335+100*O335 -> 216.62299999999999 | AK335: 214.1 | AL335: 342 | AM335: 118.2 | AN335: 341 | AO335: -0.11800000000000001 | AP335: 21 | AQ335: 久吾转债!*
A336: 373 | B336: 110034 | C336: 九州转债! | D336: 600998 | E336: 九州通 | F336: 医药 | G336: 医药商业 | H336: 111.9 | I336: -8.3999999999999995e-003 | J336: 8.1000000000000013e-003 | K336: 15.48 | L336: -4.4400000000000002e-002 | M336: 108 | N336: 17.83 | O336: 0.28899999999999998 | P336: 86.82 | Q336: 转股中 | R336: 0.29年 | S336: 回售内 | T336: 15 | U336: 19 | V336: 1.1000000000000001e-002 | W336: 5.2000000000000005e-002 | X336: 4.4999999999999998e-002 | Y336: 290 | Z336: 1.4 | AA336: -0.114 | AB336: -0.158 | AC336: 回售内 | AD336: 回售内 | AE336: 103 | AF336: 107.07 | AG336: 0.01 | AH336: AA+ | AI336: 2.9999999999999999e-002 | AJ336: =H336+100*O336 -> 140.80000000000001 | AK336: 137 | AL336: 97 | AM336: 29.9 | AN336: 21 | AO336: -1.9e-002 | AP336: 26 | AQ336: 九州转债!
A337: 330 | B337: 123012 | C337: 万顺转债! | D337: 300057 | E337: 万顺新材 | F337: 有色金属 | G337: 铝金属 | H337: 155.99 | I337: 2.1899999999999999e-002 | J337: 1.e-002 | K337: 8.05 | L337: 3.4700000000000002e-002 | M337: 109.3 | N337: 5.27 | O337: 2.1000000000000001e-002 | P337: 152.75 | Q337: 转股中 | R337: 2.80年 | S337: 0.80年 | T337: 1.28 | U337: 167 | V337: 0.83999999999999997 | W337: 2.3e-002 | X337: 3.6000000000000004e-002 | Y337: 54 | Z337: 1.53 | AA337: -0.121 | AB337: -0.126 | AC337: -0.35999999999999999 | AD337: -0.36200000000000004 | AE337: 96.3 | AF337: 93.3 | AG337: 0.92 | AH337: AA- | AI337: 5.91e-002 | AJ337: =H337+100*O337 -> 158.09 | AK337: 159.2 | AL337: 277 | AM337: 62.9 | AN337: 244 | AO337: 0. | AP337: 25 | AQ337: 万顺转债!
A338: 144 | B338: 128128 | C338: 齐翔转2! | D338: 2408 | E338: 齐翔腾达 | F338: 化工 | G338: 化工 | H338: 215.9 | I338: -5.5000000000000005e-003 | J338: 6.3e-003 | K338: 12.14 | L338: 8.0000000000000004e-004 | M338: 115 | N338: 5.69 | O338: 1.2e-002 | P338: 213.36 | Q338: 转股中 | R338: 4.89年 | S338: 2.89年 | T338: 8.73 | U338: 243 | V338: 0.128 | W338: 2.6000000000000002e-002 | X338: 5.5e-002 | Y338: 341 | Z338: 2.1 | AA338: -0.12300000000000001 | AB338: -0.127 | AC338: -0.13200000000000001 | AD338: -0.13200000000000001 | AE338: 91.81 | AF338: 95.25 | AG338: 0.96 | AH338: AA | AI338: 4.0099999999999997e-002 | AJ338: =H338+100*O338 -> 217.09999999999999 | AK338: 218.4 | AL338: 346 | AM338: 123.2 | AN338: 343 | AO338: -0.254 | AP338: 30 | AQ338: 齐翔转2!
A339: 323 | B339: 128046 | C339: 利尔转债!! | D339: 2258 | E339: 利尔化学 | F339: 化工 | G339: 农化 | H339: 167.5 | I339: 6.0100000000000001e-002 | J339: -5.6999999999999993e-003 | K339: 28 | L339: 5.9400000000000001e-002 | M339: 112.3 | N339: 18.42 | O339: 0.10199999999999999 | P339: 152.01 | Q339: 转股中 | R339: 3年16天 | S339: 1年17天 | T339: 8.08 | U339: 135 | V339: 9.9000000000000005e-002 | W339: 5.5e-002 | X339: 8.3000000000000004e-002 | Y339: 147 | Z339: 3.51 | AA339: -0.125 | AB339: -0.13100000000000001 | AC339: -0.313 | AD339: -0.315 | AE339: 98.07 | AF339: 99.91 | AG339: 0.92 | AH339: AA | AI339: 4.0099999999999997e-002 | AJ339: =H339+100*O339 -> 177.69999999999999 | AK339: 183 | AL339: 326 | AM339: 83.1 | AN339: 315 | AO339: -0.107 | AP339: 9 | AQ339: 利尔转债!!
A340: 302 | B340: 110055 | C340: 伊力转债!! | D340: 600197 | E340: 伊力特 | F340: 食品饮料 | G340: 白酒 | H340: 184.77 | I340: -6.8999999999999999e-003 | J340: -7.000000000000001e-004 | K340: 26.87 | L340: -8.1000000000000013e-003 | M340: 114.3 | N340: 16.41 | O340: 0.128 | P340: 163.74 | Q340: 转股中 | R340: 3.45年 | S340: 1.46年 | T340: 2.44 | U340: 1388. | V340: 3.0299999999999998 | W340: 1.9e-002 | X340: 3.1e-002 | Y340: 127 | Z340: 3.4 | AA340: -0.13200000000000001 | AB340: -0.13800000000000001 | AC340: -0.25600000000000001 | AD340: -0.25800000000000001 | AE340: 96.5 | AF340: 100.06 | AG340: 0.93 | AH340: AA | AI340: 4.0099999999999997e-002 | AJ340: =H340+100*O340 -> 197.57000000000002 | AK340: 205.8 | AL340: 335 | AM340: 105.7 | AN340: 333 | AO340: -3.1e-002 | AP340: 22 | AQ340: 伊力转债!!
A341: 237 | B341: 123042 | C341: 银河转债!! | D341: 300619 | E341: 金银河 | F341: 机械装备 | G341: 专用设备 | H341: 216.7 | I341: 7.1399999999999991e-002 | J341: 8.8200000000000001e-002 | K341: 53.89 | L341: 0.16500000000000001 | M341: 115.4 | N341: 24.38 | O341: -2.e-002 | P341: 221.04 | Q341: 转股中 | R341: 4.29年 | S341: 2.29年 | T341: 1.52 | U341: 3405. | V341: 10.32 | W341: 3.7999999999999999e-002 | X341: 8.3000000000000004e-002 | Y341: 40 | Z341: 7.98 | AA341: -0.13900000000000001 | AB341: -0.14400000000000002 | AC341: -0.17899999999999999 | AD341: -0.17999999999999999 | AE341: 87.63 | AF341: 86.26 | AG341: 0.97 | AH341: A+ | AI341: 7.2099999999999997e-002 | AJ341: =H341+100*O341 -> 214.69999999999999 | AK341: 212.4 | AL341: 339 | AM341: 124.7 | AN341: 345 | AO341: 9.6000000000000002e-002 | AP341: 22 | AQ341: 银河转债!!
A342: 198 | B342: 113580 | C342: 康隆转债!! | D342: 603665 | E342: 康隆达 | F342: 服装纺织 | G342: 服装行业 | H342: 236.27 | I342: -2.7000000000000001e-003 | J342: 7.2499999999999995e-002 | K342: 19.42 | L342: 9.2899999999999996e-002 | M342: 120.8 | N342: 15.51 | O342: 0.88700000000000001 | P342: 125.21 | Q342: 转股中 | R342: 4.56年 | S342: 2.56年 | T342: 0.41 | U342: 364 | V342: 3.6899999999999999 | W342: 1.3000000000000001e-002 | X342: 1.7000000000000001e-002 | Y342: 31 | Z342: 2.85 | AA342: -0.13900000000000001 | AB342: -0.14499999999999999 | AC342: -0.16699999999999998 | AD342: -0.16800000000000001 | AE342: 88.38 | AF342: 92.74 | AG342: 0.75 | AH342: AA- | AI342: 6.1100000000000002e-002 | AJ342: =H342+100*O342 -> 324.97000000000003 | AK342: 347.3 | AL342: 363 | AM342: 254.6 | AN342: 364 | AO342: 0.41999999999999998 | AP342: 8 | AQ342: 康隆转债!!
A343: 209 | B343: 113034 | C343: 滨化转债! | D343: 601678 | E343: 滨化股份 | F343: 化工 | G343: 化工 | H343: 224.91 | I343: 3.1200000000000002e-002 | J343: 9.4999999999999998e-003 | K343: 10.18 | L343: 4.2000000000000003e-002 | M343: 114.8 | N343: 4.58 | O343: 1.2e-002 | P343: 222.27 | Q343: 转股中 | R343: 4.53年 | S343: 2.53年 | T343: 4.68 | U343: 889 | V343: 0.83700000000000008 | W343: 2.4e-002 | X343: 5.2000000000000005e-002 | Y343: 199 | Z343: 2.12 | AA343: -0.14000000000000001 | AB343: -0.14499999999999999 | AC343: -0.16399999999999998 | AD343: -0.16500000000000001 | AE343: 93.01 | AF343: 96.43 | AG343: 0.97 | AH343: AA | AI343: 4.0099999999999997e-002 | AJ343: =H343+100*O343 -> 226.10999999999999 | AK343: 227.5 | AL343: 351 | AM343: 131.1 | AN343: 350 | AO343: -0.13100000000000001 | AP343: 23 | AQ343: 滨化转债!
A344: 258 | B344: 123034 | C344: 通光转债! | D344: 300265 | E344: 通光线缆 | F344: 通信互联 | G344: 通信设备 | H344: 219.5 | I344: 1.6200000000000003e-002 | J344: 1.9900000000000001e-002 | K344: 11.29 | L344: 4.2500000000000003e-002 | M344: 118 | N344: 7.95 | O344: 0.54600000000000004 | P344: 142.01 | Q344: 转股中 | R344: 4年34天 | S344: 2年35天 | T344: 0.78 | U344: 982 | V344: 5.6100000000000003 | W344: 1.9e-002 | X344: 2.7000000000000003e-002 | Y344: 41 | Z344: 3.12 | AA344: -0.14300000000000002 | AB344: -0.14899999999999999 | AC344: -0.20300000000000001 | AD344: -0.20399999999999999 | AE344: 88.6 | AF344: 89.33 | AG344: 0.85 | AH344: A+ | AI344: 7.2099999999999997e-002 | AJ344: =H344+100*O344 -> 274.10000000000002 | AK344: 297 | AL344: 359 | AM344: 207.7 | AN344: 359 | AO344: -4.2000000000000003e-002 | AP344: 19 | AQ344: 通光转债!
A345: 314 | B345: 123018 | C345: 溢利转债! | D345: 300381 | E345: 溢多利 | F345: 医药 | G345: 原料药 | H345: 189 | I345: -3.0800000000000001e-002 | J345: 0.10199999999999999 | K345: 10.84 | L345: 8.7300000000000003e-002 | M345: 114.3 | N345: 8.25 | O345: 0.43799999999999994 | P345: 131.39 | Q345: 转股中 | R345: 3.22年 | S345: 1.22年 | T345: 0.54 | U345: 330 | V345: 3.1099999999999999 | W345: 1.e-002 | X345: 1.3000000000000001e-002 | Y345: 53 | Z345: 1.77 | AA345: -0.14699999999999999 | AB345: -0.153 | AC345: -0.316 | AD345: -0.318 | AE345: 94.75 | AF345: 94.83 | AG345: 0.82 | AH345: AA- | AI345: 6.1100000000000002e-002 | AJ345: =H345+100*O345 -> 232.80000000000001 | AK345: 246.6 | AL345: 353 | AM345: 151.8 | AN345: 353 | AO345: 4.0999999999999995e-002 | AP345: 11 | AQ345: 溢利转债!
A346: 350 | B346: 110041 | C346: 蒙电转债!! | D346: 600863 | E346: 内蒙华电 | F346: 能源电力 | G346: 电力供应 | H346: 155.13 | I346: 1.7399999999999999e-002 | J346: 1.26e-002 | K346: 4.11 | L346: 3.0099999999999998e-002 | M346: 109.3 | N346: 2.56 | O346: -3.4000000000000002e-002 | P346: 160.55 | Q346: 转股中 | R346: 2.23年 | S346: 0.23年 | T346: 12.2 | U346: 4391. | V346: 2.3900000000000001 | W346: 5.0999999999999997e-002 | X346: 8.199999999999999e-002 | Y346: 239 | Z346: 2.15 | AA346: -0.14800000000000002 | AB346: -0.154 | AC346: -0.93099999999999994 | AD346: -0.93599999999999994 | AE346: 100.59 | AF346: 102.23 | AG346: 1 | AH346: AAA | AI346: 3.1099999999999999e-002 | AJ346: =H346+100*O346 -> 151.72999999999999 | AK346: 149.7 | AL346: 203 | AM346: 47.5 | AN346: 144 | AO346: 0.16 | AP346: 15 | AQ346: 蒙电转债!!
A347: 134 | B347: 123067 | C347: 斯莱转债! | D347: 300382 | E347: 斯莱克 | F347: 机械装备 | G347: 专用设备 | H347: 265.815 | I347: 7.3599999999999999e-002 | J347: -1.4000000000000002e-003 | K347: 25.12 | L347: 7.400000000000001e-002 | M347: 120.8 | N347: 9.36 | O347: -1.e-002 | P347: 268.38 | Q347: 转股中 | R347: 4.96年 | S347: 2.97年 | T347: 3.14 | U347: 433 | V347: 0.52200000000000002 | W347: 2.2000000000000002e-002 | X347: 5.9000000000000004e-002 | Y347: 142 | Z347: 13.59 | AA347: -0.14899999999999999 | AB347: -0.155 | AC347: -0.14999999999999999 | AD347: -0.151 | AE347: 86.29 | AF347: 90.55 | AG347: 0.98 | AH347: AA- | AI347: 6.1100000000000002e-002 | AJ347: =H347+100*O347 -> 264.815 | AK347: 263.3 | AL347: 354 | AM347: 172.7 | AN347: 355 | AO347: -0.122 | AP347: 12 | AQ347: 斯莱转债!
A348: 344 | B348: 113504 | C348: 艾华转债!! | D348: 603989 | E348: 艾华集团 | F348: 电子 | G348: 元器件制 | H348: 161.11 | I348: 3.8699999999999998e-002 | J348: -1.6899999999999998e-002 | K348: 32.41 | L348: 2.3e-002 | M348: 109.3 | N348: 20.81 | O348: 3.4000000000000002e-002 | P348: 155.74 | Q348: 转股中 | R348: 2.42年 | S348: 0.42年 | T348: 4.9 | U348: 54 | V348: 7.0000000000000007e-002 | W348: 3.7999999999999999e-002 | X348: 5.9000000000000004e-002 | Y348: 129 | Z348: 4.77 | AA348: -0.14999999999999999 | AB348: -0.156 | AC348: -0.65700000000000003 | AD348: -0.66099999999999992 | AE348: 99.6 | AF348: 100.02 | AG348: 0.95 | AH348: AA | AI348: 3.8100000000000002e-002 | AJ348: =H348+100*O348 -> 164.51000000000002 | AK348: 166.5 | AL348: 303 | AM348: 66.5 | AN348: 268 | AO348: 1.9e-002 | AP348: 11 | AQ348: 艾华转债!!
A349: 317 | B349: 128050 | C349: 钧达转债!! | D349: 2865 | E349: 钧达股份 | F349: 汽车 | G349: 零部件制 | H349: 215.783 | I349: -4.5599999999999995e-002 | J349: 3.56e-002 | K349: 32.63 | L349: -1.e-002 | M349: 122.7 | N349: 14.8 | O349: -2.1000000000000001e-002 | P349: 220.47 | Q349: 转股中 | R349: 3.19年 | S349: 1.20年 | T349: 1.14 | U349: 2062. | V349: 7.8600000000000003 | W349: 2.6000000000000002e-002 | X349: 5.7999999999999996e-002 | Y349: 43 | Z349: 4.18 | AA349: -0.16500000000000001 | AB349: -0.17399999999999999 | AC349: -0.371 | AD349: -0.373 | AE349: 95.14 | AF349: 101.97 | AG349: 1 | AH349: AA- | AI349: 6.1100000000000002e-002 | AJ349: =H349+100*O349 -> 213.68299999999999 | AK349: 211.1 | AL349: 338 | AM349: 109.1 | AN349: 334 | AO349: 8.900000000000001e-002 | AP349: 51 | AQ349: 钧达转债!!
A350: 229 | B350: 110066 | C350: 盛屯转债!! | D350: 600711 | E350: 盛屯矿业 | F350: 有色金属 | G350: 有色行业 | H350: 255.54 | I350: 3.95e-002 | J350: -3.2899999999999999e-002 | K350: 11.88 | L350: 6.8000000000000005e-003 | M350: 114.9 | N350: 4.87 | O350: 4.8000000000000001e-002 | P350: 243.94 | Q350: 转股中 | R350: 4.42年 | S350: 2.42年 | T350: 3.83 | U350: 924 | V350: 0.94700000000000006 | W350: 1.2e-002 | X350: 2.8999999999999998e-002 | Y350: 326 | Z350: 2.79 | AA350: -0.16800000000000001 | AB350: -0.17199999999999999 | AC350: -0.191 | AD350: -0.192 | AE350: 93.5 | AF350: 96.93 | AG350: 0.98 | AH350: AA | AI350: 4.0099999999999997e-002 | AJ350: =H350+100*O350 -> 260.33999999999997 | AK350: 267.1 | AL350: 355 | AM350: 170.2 | AN350: 354 | AO350: -6.2e-002 | AP350: 32 | AQ350: 盛屯转债!!
A351: 239 | B351: 128093 | C351: 百川转债!! | D351: 2455 | E351: 百川股份 | F351: 化工 | G351: 化工 | H351: 279.863 | I351: 5.6100000000000004e-002 | J351: 3.04e-002 | K351: 15.52 | L351: 8.9900000000000008e-002 | M351: 129.8 | N351: 5.77 | O351: 4.0000000000000001e-002 | P351: 268.98 | Q351: 转股中 | R351: 4.26年 | S351: 2.26年 | T351: 1.62 | U351: 2429. | V351: 5.2999999999999998 | W351: 1.8000000000000002e-002 | X351: 5.0000000000000003e-002 | Y351: 88 | Z351: 5.46 | AA351: -0.17000000000000001 | AB351: -0.17800000000000002 | AC351: -0.217 | AD351: -0.21899999999999997 | AE351: 92.83 | AF351: 101.82 | AG351: 0.96 | AH351: AA- | AI351: 6.1100000000000002e-002 | AJ351: =H351+100*O351 -> 283.863 | AK351: 290.7 | AL351: 357 | AM351: 188.9 | AN351: 357 | AO351: -0.14400000000000002 | AP351: 44 | AQ351: 百川转债!!
A352: 308 | B352: 113528 | C352: 长城转债!! | D352: 603897 | E352: 长城科技 | F352: 机械装备 | G352: 专用设备 | H352: 224.85 | I352: 5.5300000000000002e-002 | J352: -3.4999999999999996e-003 | K352: 52.7 | L352: 5.3200000000000004e-002 | M352: 116.8 | N352: 23.35 | O352: -4.0000000000000001e-003 | P352: 225.7 | Q352: 转股中 | R352: 3.42年 | S352: 1.42年 | T352: 5.17 | U352: 1110. | V352: 0.95700000000000007 | W352: 5.4000000000000006e-002 | X352: 0.122 | Y352: 96 | Z352: 4.53 | AA352: -0.17699999999999999 | AB352: -0.184 | AC352: -0.32200000000000001 | AD352: -0.32400000000000001 | AE352: 93.98 | AF352: 95.83 | AG352: 0.97 | AH352: AA- | AI352: 6.1100000000000002e-002 | AJ352: =H352+100*O352 -> 224.44999999999999 | AK352: 224 | AL352: 349 | AM352: 128.2 | AN352: 348 | AO352: 0.13100000000000001 | AP352: 36 | AQ352: 长城转债!!
A353: 315 | B353: 113525 | C353: 台华转债!! | D353: 603055 | E353: 台华新材 | F353: 服装纺织 | G353: 纺织行业 | H353: 211.95 | I353: 0.106 | J353: -8.3999999999999995e-003 | K353: 16.38 | L353: 0.10000000000000001 | M353: 114.3 | N353: 7.78 | O353: 6.9999999999999993e-003 | P353: 210.54 | Q353: 转股中 | R353: 3.21年 | S353: 1.22年 | T353: 2.19 | U353: 943 | V353: 2.0899999999999999 | W353: 1.6e-002 | X353: 3.3000000000000002e-002 | Y353: 141 | Z353: 4.31 | AA353: -0.17800000000000002 | AB353: -0.184 | AC353: -0.35999999999999999 | AD353: -0.36099999999999999 | AE353: 97.42 | AF353: 101.02 | AG353: 0.97 | AH353: AA | AI353: 4.0099999999999997e-002 | AJ353: =H353+100*O353 -> 212.64999999999998 | AK353: 213.4 | AL353: 341 | AM353: 112.3 | AN353: 338 | AO353: 2.6000000000000002e-002 | AP353: 21 | AQ353: 台华转债!!
A354: 259 | B354: 113548 | C354: 石英转债! | D354: 603688 | E354: 石英股份 | F354: 电子 | G354: 电子产品 | H354: 278.16 | I354: 8.3499999999999991e-002 | J354: -1.8100000000000002e-002 | K354: 38.9 | L354: 6.7199999999999996e-002 | M354: 124.4 | N354: 14.93 | O354: 6.8000000000000005e-002 | P354: 260.55 | Q354: 转股中 | R354: 4年27天 | S354: 2年28天 | T354: 1.23 | U354: 465 | V354: 1.3899999999999999 | W354: 9.0000000000000011e-003 | X354: 2.3e-002 | Y354: 137 | Z354: 6.91 | AA354: -0.182 | AB354: -0.19 | AC354: -0.24299999999999999 | AD354: -0.24399999999999999 | AE354: 91.5 | AF354: 98.33 | AG354: 0.97 | AH354: AA- | AI354: 6.1100000000000002e-002 | AJ354: =H354+100*O354 -> 284.96000000000004 | AK354: 295.8 | AL354: 358 | AM354: 197.4 | AN354: 358 | AO354: -8.5000000000000006e-002 | AP354: 13 | AQ354: 石英转债!
A355: 367 | B355: 127004 | C355: 模塑转债!! | D355: 700 | E355: 模塑科技 | F355: 汽车 | G355: 零部件制 | H355: 156.75 | I355: -2.8999999999999998e-003 | J355: 2.8999999999999998e-003 | K355: 4.91 | L355: -4.0999999999999995e-003 | M355: 111.8 | N355: 7.24 | O355: 1.3100000000000001 | P355: 67.82 | Q355: 转股中 | R355: 1.67年 | S355: 回售内 | T355: 1.32 | U355: 64 | V355: 0.307 | W355: 2.8999999999999998e-002 | X355: 2.e-002 | Y355: 45 | Z355: 1.66 | AA355: -0.185 | AB355: -0.19500000000000001 | AC355: 回售内 | AD355: 回售内 | AE355: 100.3 | AF355: 100.59 | AG355: 0 | AH355: AA- | AI355: 5.91e-002 | AJ355: =H355+100*O355 -> 287.75 | AK355: 245.7 | AL355: 352 | AM355: 145.1 | AN355: 352 | AO355: -0.13699999999999998 | AP355: 28 | AQ355: 模塑转债!!
A356: 318 | B356: 110048 | C356: 福能转债!! | D356: 600483 | E356: 福能股份 | F356: 能源电力 | G356: 电力供应 | H356: 229.68 | I356: -1.4000000000000002e-003 | J356: 1.4499999999999999e-002 | K356: 18.24 | L356: 1.3300000000000001e-002 | M356: 113.3 | N356: 7.85 | O356: -1.2e-002 | P356: 232.36 | Q356: 转股中 | R356: 3.19年 | S356: 1.19年 | T356: 16.6 | U356: 1199. | V356: 0.317 | W356: 4.9000000000000002e-002 | X356: 0.113 | Y356: 341 | Z356: 2.08 | AA356: -0.20199999999999999 | AB356: -0.20699999999999999 | AC356: -0.39500000000000002 | AD356: -0.39600000000000002 | AE356: 98.16 | AF356: 101.76 | AG356: 0.98 | AH356: AA+ | AI356: 3.5099999999999999e-002 | AJ356: =H356+100*O356 -> 228.48000000000002 | AK356: 227 | AL356: 350 | AM356: 125.2 | AN356: 346 | AO356: 0.128 | AP356: 10 | AQ356: 福能转债!!
A357: 336 | B357: 110044 | C357: 广电转债!! | D357: 600831 | E357: 广电网络 | F357: 传媒娱乐 | G357: 影视娱乐 | H357: 206.98 | I357: -1.44e-002 | J357: 1.52e-002 | K357: 5.33 | L357: 3.8e-003 | M357: 111.3 | N357: 6.87 | O357: 1.6699999999999999 | P357: 77.58 | Q357: 转股中 | R357: 2.74年 | S357: 0.74年 | T357: 0.71 | U357: 172 | V357: 1.1699999999999999 | W357: 1.9e-002 | X357: 1.4999999999999999e-002 | Y357: 38 | Z357: 1.01 | AA357: -0.20499999999999999 | AB357: -0.21100000000000002 | AC357: -0.56700000000000006 | AD357: -0.56899999999999995 | AE357: 98.42 | AF357: 100.63 | AG357: 0.2 | AH357: AA | AI357: 3.8100000000000002e-002 | AJ357: =H357+100*O357 -> 373.98000000000002 | AK357: 336.4 | AL357: 360 | AM357: 235.7 | AN357: 360 | AO357: -6.2e-002 | AP357: 10 | AQ357: 广电转债!!
A358: 196 | B358: 113582 | C358: 火炬转债! | D358: 603678 | E358: 火炬电子 | F358: 电子 | G358: 元器件制 | H358: 331.92 | I358: 7.3000000000000001e-003 | J358: -7.000000000000001e-004 | K358: 70.55 | L358: 6.7000000000000002e-003 | M358: 114.9 | N358: 24.99 | O358: 0.17600000000000002 | P358: 282.31 | Q358: 转股中 | R358: 4.65年 | S358: 2.66年 | T358: 4.18 | U358: 105 | V358: 7.4999999999999997e-002 | W358: 1.3000000000000001e-002 | X358: 3.6000000000000004e-002 | Y358: 324 | Z358: 7.72 | AA358: -0.20600000000000002 | AB358: -0.21100000000000002 | AC358: -0.19699999999999998 | AD358: -0.19800000000000001 | AE358: 92.64 | AF358: 96.04 | AG358: 0.98 | AH358: AA | AI358: 4.0099999999999997e-002 | AJ358: =H358+100*O358 -> 349.52000000000004 | AK358: 381.5 | AL358: 368 | AM358: 285.5 | AN358: 367 | AO358: -2.4e-002 | AP358: 6 | AQ358: 火炬转债!
A359: 325 | B359: 123015 | C359: 蓝盾转债!! | D359: 300297 | E359: 蓝盾股份 | F359: 计算机及 | G359: 软件开发 | H359: 215.71 | I359: 3.3e-003 | J359: -3.3e-003 | K359: 3.56 | L359: 3.1899999999999998e-002 | M359: 111.3 | N359: 5.79 | O359: 2.5099999999999998 | P359: 61.49 | Q359: 转股中 | R359: 2.87年 | S359: 0.87年 | T359: 1 | U359: 490 | V359: 2.2000000000000002 | W359: 2.3e-002 | X359: 1.3999999999999999e-002 | Y359: 44 | Z359: 2.12 | AA359: -0.20800000000000002 | AB359: -0.214 | AC359: -0.50900000000000001 | AD359: -0.51000000000000001 | AE359: 90.55 | AF359: 80.82 | AG359: 0 | AH359: BBB- | AI359: 0.1201 | AJ359: =H359+100*O359 -> 466.70999999999998 | AK359: 369.9 | AL359: 366 | AM359: 279.4 | AN359: 366 | AO359: -5.0999999999999997e-002 | AP359: 16 | AQ359: 蓝盾转债!!
A360: 186 | B360: 128111 | C360: 中矿转债! | D360: 2738 | E360: 中矿资源 | F360: 有色金属 | G360: 有色行业 | H360: 374.272 | I360: 6.3299999999999995e-002 | J360: 6.0999999999999995e-003 | K360: 56.61 | L360: 7.0499999999999993e-002 | M360: 124.2 | N360: 15.42 | O360: 1.9e-002 | P360: 367.12 | Q360: 转股中 | R360: 4.69年 | S360: 2.70年 | T360: 1.52 | U360: 1075. | V360: 1.9099999999999999 | W360: 8.0000000000000002e-003 | X360: 2.9999999999999999e-002 | Y360: 183 | Z360: 5.2 | AA360: -0.21199999999999999 | AB360: -0.21899999999999997 | AC360: -0.20300000000000001 | AD360: -0.20399999999999999 | AE360: 88.02 | AF360: 94.62 | AG360: 0.98 | AH360: AA- | AI360: 6.1100000000000002e-002 | AJ360: =H360+100*O360 -> 376.17199999999997 | AK360: 381.4 | AL360: 367 | AM360: 286.8 | AN360: 368 | AO360: -0.10099999999999999 | AP360: 10 | AQ360: 中矿转债!
A361: 280 | B361: 123027 | C361: 蓝晓转债! | D361: 300487 | E361: 蓝晓科技 | F361: 化工 | G361: 化工 | H361: 295.582 | I361: 7.0900000000000005e-002 | J361: 3.5999999999999999e-003 | K361: 73.39 | L361: 7.6399999999999996e-002 | M361: 118.8 | N361: 29.02 | O361: 0.16899999999999998 | P361: 252.89 | Q361: 转股中 | R361: 3.69年 | S361: 1.70年 | T361: 1.07 | U361: 1293. | V361: 3.9300000000000002 | W361: 6.9999999999999993e-003 | X361: 1.7000000000000001e-002 | Y361: 161 | Z361: 8.64 | AA361: -0.222 | AB361: -0.22800000000000001 | AC361: -0.318 | AD361: -0.31900000000000001 | AE361: 91.22 | AF361: 92.45 | AG361: 0.98 | AH361: A+ | AI361: 7.2099999999999997e-002 | AJ361: =H361+100*O361 -> 312.48199999999997 | AK361: 338.3 | AL361: 361 | AM361: 245.8 | AN361: 362 | AO361: -0.13200000000000001 | AP361: 19 | AQ361: 蓝晓转债!
A362: 374 | B362: 110033 | C362: 国贸转债!! | D362: 600755 | E362: 厦门国贸 | F362: 交通运输 | G362: 交通运输 | H362: 115.53 | I362: -8.0000000000000002e-003 | J362: 2.8999999999999998e-003 | K362: 7.8 | L362: -5.1000000000000004e-003 | M362: 108 | N362: 6.72 | O362: -5.0000000000000001e-003 | P362: 116.07 | Q362: 转股中 | R362: 0.27年 | S362: 回售内 | T362: 3.58 | U362: 88 | V362: 0.214 | W362: 2.3e-002 | X362: 2.7000000000000003e-002 | Y362: 153 | Z362: 0.9 | AA362: -0.22399999999999998 | AB362: -0.26600000000000001 | AC362: 回售内 | AD362: 回售内 | AE362: 100.33 | AF362: 107.21 | AG362: 1 | AH362: AAA | AI362: 2.7999999999999997e-002 | AJ362: =H362+100*O362 -> 115.03 | AK362: 115 | AL362: 7 | AM362: 7.8 | AN362: 2 | AO362: -0.11699999999999999 | AP362: 26 | AQ362: 国贸转债!!
A363: 218 | B363: 123046 | C363: 天铁转债! | D363: 300587 | E363: 天铁股份 | F363: 铁路 | G363: 铁路设备 | H363: 371.189 | I363: 7.5800000000000006e-002 | J363: -4.5000000000000005e-003 | K363: 21.17 | L363: 7.2400000000000006e-002 | M363: 117.7 | N363: 5.9 | O363: 3.4000000000000002e-002 | P363: 358.81 | Q363: 转股中 | R363: 4.46年 | S363: 2.47年 | T363: 0.62 | U363: 448 | V363: 1.97 | W363: 5.0000000000000001e-003 | X363: 1.8000000000000002e-002 | Y363: 123 | Z363: 4.31 | AA363: -0.23000000000000001 | AB363: -0.23499999999999999 | AC363: -0.22699999999999998 | AD363: -0.22800000000000001 | AE363: 88.79 | AF363: 90.87 | AG363: 0.98 | AH363: AA- | AI363: 6.1100000000000002e-002 | AJ363: =H363+100*O363 -> 374.589 | AK363: 383.6 | AL363: 369 | AM363: 292.7 | AN363: 369 | AO363: 2.3e-002 | AP363: 14 | AQ363: 天铁转债!
A364: 351 | B364: 128030 | C364: 天康转债!! | D364: 2100 | E364: 天康生物 | F364: 农业 | G364: 畜牧业 | H364: 199.97 | I364: 1.9699999999999999e-002 | J364: -4.3400000000000001e-002 | K364: 8.62 | L364: -2.3799999999999998e-002 | M364: 111.3 | N364: 7.39 | O364: 0.71400000000000008 | P364: 116.64 | Q364: 转股中 | R364: 2.23年 | S364: 0.23年 | T364: 0.89 | U364: 152 | V364: 0.83299999999999996 | W364: 1.e-002 | X364: 1.1000000000000001e-002 | Y364: 93 | Z364: 1.54 | AA364: -0.23499999999999999 | AB364: -0.24100000000000002 | AC364: -1.327 | AD364: -1.331 | AE364: 100.32 | AF364: 102.58 | AG364: 1 | AH364: AA | AI364: 3.8100000000000002e-002 | AJ364: =H364+100*O364 -> 271.37 | AK364: 283.3 | AL364: 356 | AM364: 180.7 | AN364: 356 | AO364: 5.9000000000000004e-002 | AP364: 10 | AQ364: 天康转债!!
A365: 313 | B365: 113526 | C365: 联泰转债! | D365: 603797 | E365: 联泰环保 | F365: 城市公用 | G365: 三废处理 | H365: 271.48 | I365: -1.4800000000000001e-002 | J365: 4.0199999999999993e-002 | K365: 6.91 | L365: 3.6000000000000004e-002 | M365: 110.3 | N365: 5.92 | O365: 1.3300000000000001 | P365: 116.72 | Q365: 转股中 | R365: 3.32年 | S365: 1.32年 | T365: 1.93 | U365: 179 | V365: 0.34000000000000002 | W365: 4.8000000000000001e-002 | X365: 5.5999999999999994e-002 | Y365: 40 | Z365: 1.56 | AA365: -0.24100000000000002 | AB365: -0.245 | AC365: -0.40000000000000002 | AD365: -0.40100000000000002 | AE365: 97.72 | AF365: 98.62 | AG365: 0.7 | AH365: AA+ | AI365: 3.5099999999999999e-002 | AJ365: =H365+100*O365 -> 404.48000000000002 | AK365: 426.2 | AL365: 370 | AM365: 327.6 | AN365: 370 | AO365: -2.7999999999999997e-002 | AP365: 9 | AQ365: 联泰转债!
A366: 289 | B366: 113534 | C366: 鼎胜转债!! | D366: 603876 | E366: 鼎胜新材 | F366: 有色金属 | G366: 小金属 | H366: 311.38 | I366: 0.13 | J366: -5.6100000000000004e-002 | K366: 41.4 | L366: 7.5300000000000006e-002 | M366: 114.3 | N366: 15.18 | O366: 0.14199999999999999 | P366: 272.73 | Q366: 转股中 | R366: 3.52年 | S366: 1.53年 | T366: 4.39 | U366: 1530. | V366: 1.1399999999999999 | W366: 2.2000000000000002e-002 | X366: 5.9999999999999998e-002 | Y366: 200 | Z366: 4.48 | AA366: -0.251 | AB366: -0.25600000000000001 | AC366: -0.36899999999999999 | AD366: -0.37 | AE366: 93.07 | AF366: 93.15 | AG366: 0.98 | AH366: AA- | AI366: 6.1100000000000002e-002 | AJ366: =H366+100*O366 -> 325.57999999999998 | AK366: 350 | AL366: 364 | AM366: 256.9 | AN366: 365 | AO366: -5.4000000000000006e-002 | AP366: 32 | AQ366: 鼎胜转债!!
A367: 364 | B367: 128017 | C367: 金禾转债!! | D367: 2597 | E367: 金禾实业 | F367: 化工 | G367: 化工 | H367: 198.195 | I367: 4.7e-002 | J367: 7.7000000000000002e-003 | K367: 39.37 | L367: 5.6100000000000004e-002 | M367: 108.8 | N367: 21.97 | O367: 0.106 | P367: 179.2 | Q367: 转股中 | R367: 2年32天 | S367: 32天 | T367: 5.52 | U367: 168 | V367: 0.156 | W367: 2.5000000000000001e-002 | X367: 4.4999999999999998e-002 | Y367: 221 | Z367: 4.43 | AA367: -0.253 | AB367: -0.25800000000000001 | AC367: -2.0709999999999997 | AD367: -2.0760000000000001 | AE367: 100.6 | AF367: 100.78 | AG367: 0.98 | AH367: AA | AI367: 3.8100000000000002e-002 | AJ367: =H367+100*O367 -> 208.79499999999999 | AK367: 217.2 | AL367: 344 | AM367: 116.4 | AN367: 340 | AO367: -3.2000000000000001e-002 | AP367: 9 | AQ367: 金禾转债!!
A368: 288 | B368: 113025 | C368: 明泰转债!! | D368: 601677 | E368: 明泰铝业 | F368: 有色金属 | G368: 铝金属 | H368: 329.35 | I368: 9.820000000000001e-002 | J368: -1.29e-002 | K368: 34.55 | L368: 8.6500000000000007e-002 | M368: 114.5 | N368: 11 | O368: 4.9000000000000002e-002 | P368: 314.09 | Q368: 转股中 | R368: 3.53年 | S368: 1.53年 | T368: 11 | U368: 618 | V368: 0.17399999999999999 | W368: 4.7e-002 | X368: 0.14599999999999999 | Y368: 236 | Z368: 2.51 | AA368: -0.26200000000000001 | AB368: -0.26700000000000002 | AC368: -0.37799999999999995 | AD368: -0.379 | AE368: 96.27 | AF368: 99.96 | AG368: 0.99 | AH368: AA | AI368: 4.0099999999999997e-002 | AJ368: =H368+100*O368 -> 334.25 | AK368: 344.6 | AL368: 362 | AM368: 244.6 | AN368: 361 | AO368: -6.5000000000000002e-002 | AP368: 22 | AQ368: 明泰转债!!
A369: 332 | B369: 128041 | C369: 盛路转债!! | D369: 2446 | E369: 盛路通信 | F369: 通信互联 | G369: 通信设备 | H369: 286 | I369: -1.38e-002 | J369: 1.9e-002 | K369: 5.58 | L369: 2.2000000000000002e-002 | M369: 113.3 | N369: 6.82 | O369: 2.5 | P369: 81.82 | Q369: 转股中 | R369: 2.79年 | S369: 0.80年 | T369: 0.53 | U369: 895 | V369: 5.8300000000000001 | W369: 1.e-002 | X369: 9.0000000000000011e-003 | Y369: 51 | Z369: 1.66 | AA369: -0.28499999999999998 | AB369: -0.28999999999999998 | AC369: -0.67299999999999993 | AD369: -0.67400000000000004 | AE369: 98.22 | AF369: 101.09 | AG369: 0.23 | AH369: AA | AI369: 3.8100000000000002e-002 | AJ369: =H369+100*O369 -> 536. | AK369: 490.2 | AL369: 371 | AM369: 389.1 | AN369: 371 | AO369: -4.7e-002 | AP369: 11 | AQ369: 盛路转债!!
A370: 352 | B370: 128029 | C370: 太阳转债!! | D370: 2078 | E370: 太阳纸业 | F370: 造纸包装 | G370: 造纸行业 | H370: 161.3 | I370: 1.4499999999999999e-002 | J370: -8.6e-003 | K370: 11.96 | L370: 5.8999999999999999e-003 | M370: 107 | N370: 8.45 | O370: 0.14000000000000001 | P370: 141.54 | Q370: 转股中 | R370: 1.23年 | S370: 回售内 | T370: 9.09 | U370: 104 | V370: 7.0999999999999994e-002 | W370: 2.7999999999999997e-002 | X370: 4.0000000000000001e-002 | Y370: 321 | Z370: 1.74 | AA370: -0.28600000000000003 | AB370: -0.29299999999999998 | AC370: 回售内 | AD370: 回售内 | AE370: 100.17 | AF370: 102.84 | AG370: 1 | AH370: AA+ | AI370: 3.3099999999999997e-002 | AJ370: =H370+100*O370 -> 175.30000000000001 | AK370: 181.1 | AL370: 324 | AM370: 78.2 | AN370: 307 | AO370: -8.199999999999999e-002 | AP370: 7 | AQ370: 太阳转债!!
A371: 233 | B371: 128095 | C371: 恩捷转债!! | D371: 2812 | E371: 恩捷股份 | F371: 电子 | G371: 元器件制 | H371: 490 | I371: 9.2499999999999999e-002 | J371: -3.5299999999999998e-002 | K371: 280.12 | L371: 5.79e-002 | M371: 114.9 | N371: 64.92 | O371: 0.13600000000000001 | P371: 431.48 | Q371: 转股中 | R371: 4.37年 | S371: 2.37年 | T371: 4.54 | U371: 387 | V371: 0.17800000000000002 | W371: 2.e-003 | X371: 8.0000000000000002e-003 | Y371: 2500. | Z371: 20.72 | AA371: -0.28600000000000003 | AB371: -0.28999999999999998 | AC371: -0.26300000000000001 | AD371: -0.26300000000000001 | AE371: 93.7 | AF371: 97.13 | AG371: 0.99 | AH371: AA | AI371: 4.0099999999999997e-002 | AJ371: =H371+100*O371 -> 503.60000000000002 | AK371: 548.5 | AL371: 373 | AM371: 451.4 | AN371: 373 | AO371: -1.8000000000000002e-002 | AP371: 14 | AQ371: 恩捷转债!!
A372: 270 | B372: 123031 | C372: 晶瑞转债! | D372: 300655 | E372: 晶瑞电材 | F372: 电子 | G372: 电子行业 | H372: 462.002 | I372: -1.1699999999999999e-002 | J372: 4.8099999999999997e-002 | K372: 40.05 | L372: 3.6799999999999999e-002 | M372: 115.3 | N372: 10.13 | O372: 0.16899999999999998 | P372: 395.36 | Q372: 转股中 | R372: 3.91年 | S372: 1.91年 | T372: 0.53 | U372: 544 | V372: 2.1499999999999999 | W372: 4.0000000000000001e-003 | X372: 1.4999999999999999e-002 | Y372: 136 | Z372: 9.8 | AA372: -0.30199999999999999 | AB372: -0.30599999999999999 | AC372: -0.33299999999999996 | AD372: -0.33299999999999996 | AE372: 89.04 | AF372: 88.26 | AG372: 0.99 | AH372: A+ | AI372: 7.2099999999999997e-002 | AJ372: =H372+100*O372 -> 478.90199999999999 | AK372: 528.6 | AL372: 372 | AM372: 439.6 | AN372: 372 | AO372: -0.13200000000000001 | AP372: 17 | AQ372: 晶瑞转债!
A373: 329 | B373: 123013 | C373: 横河转债! | D373: 300539 | E373: 横河精密 | F373: 机械装备 | G373: 专用设备 | H373: 323.58 | I373: 3.3e-003 | J373: 5.6999999999999993e-003 | K373: 7.37 | L373: 2.6499999999999999e-002 | M373: 114 | N373: 9.04 | O373: 2.9700000000000002 | P373: 81.53 | Q373: 转股中 | R373: 2.82年 | S373: 0.82年 | T373: 0.38 | U373: 236 | V373: 1.9099999999999999 | W373: 2.3e-002 | X373: 1.9e-002 | Y373: 16 | Z373: 3.38 | AA373: -0.313 | AB373: -0.318 | AC373: -0.69599999999999995 | AD373: -0.69700000000000006 | AE373: 95.58 | AF373: 94.52 | AG373: 0.34 | AH373: A+ | AI373: 7.0099999999999996e-002 | AJ373: =H373+100*O373 -> 620.57999999999993 | AK373: 565.6 | AL373: 374 | AM373: 470 | AN373: 374 | AO373: -9.8000000000000004e-002 | AP373: 13 | AQ373: 横河转债!
A374: 363 | B374: 113016 | C374: 小康转债!! | D374: 601127 | E374: 小康股份 | F374: 汽车 | G374: 零部件制 | H374: 350.48 | I374: 7.1999999999999998e-003 | J374: 1.24e-002 | K374: 59.38 | L374: 1.9699999999999999e-002 | M374: 109.3 | N374: 16.96 | O374: 1.e-003 | P374: 350.12 | Q374: 转股中 | R374: 2年37天 | S374: 37天 | T374: 2.07 | U374: 905 | V374: 1.23 | W374: 3.0000000000000001e-003 | X374: 9.0000000000000011e-003 | Y374: 806 | Z374: 10.43 | AA374: -0.41499999999999998 | AB374: -0.41899999999999998 | AC374: -2.8489999999999998 | AD374: -2.8519999999999999 | AE374: 100.26 | AF374: 97.13 | AG374: 0.99 | AH374: AA- | AI374: 5.91e-002 | AJ374: =H374+100*O374 -> 350.58000000000004 | AK374: 350.8 | AL374: 365 | AM374: 250.6 | AN374: 363 | AO374: -0.192 | AP374: 38 | AQ374: 小康转债!!
A375: 372 | B375: 113009 | C375: 广汽转债!! | D375: 601238 | E375: 广汽集团 | F375: 汽车 | G375: 乘用车 | H375: 120.98 | I375: 1.8799999999999997e-002 | J375: -1.67e-002 | K375: 15.08 | L375: 3.3e-003 | M375: 106 | N375: 13.92 | O375: 0.11699999999999999 | P375: 108.33 | Q375: 转股中 | R375: 0.31年 | S375: 回售内 | T375: 25.4 | U375: 116 | V375: 3.7999999999999999e-002 | W375: 1.6e-002 | X375: 1.8000000000000002e-002 | Y375: 1562. | Z375: 1.79 | AA375: -0.42700000000000005 | AB375: -0.46100000000000002 | AC375: 回售内 | AD375: 回售内 | AE375: 100.27 | AF375: 105.09 | AG375: 0.61 | AH375: AAA | AI375: 2.7999999999999997e-002 | AJ375: =H375+100*O375 -> 132.68000000000001 | AK375: 133.6 | AL375: 58 | AM375: 28.5 | AN375: 15 | AO375: -0.161 | AP375: 20 | AQ375: 广汽转债!!
A377: 声明：本数据不构成任何投资建议，宁稳网不对数据的准确性及完整性做出保证，对使用者参考本数据造成的任何直接或间接损失概不负责。
A379: 来源：宁稳网，http://www.ninwin.cn，版权所有，本数据仅供【十七亩，8703】参考，请勿转发，2021-10-02 08:03:22