A1: 序号 | B1: 转债代码 | C1: 转债名称 | D1: 股票代码 | E1: 股票名称 | F1: 行业 | G1: 子行业 | H1: 转债价格 | I1: 涨跌 | J1: 日内套利 | K1: 股价 | L1: 涨跌 | M1: 剩余本息 | N1: 转股价格 | O1: 转股溢价率 | P1: 转股价值 | Q1: 距离转股日 | R1: 剩余年限 | S1: 回售年限 | T1: 转债余额 | U1: 转债成交额 | V1: 转债换手率 | W1: 余额/市值 | X1: 余额/股本 | Y1: 股票市值 | Z1: P/B | AA1: 税前收益率 | AB1: 税后收益率 | AC1: 税前回售收益 | AD1: 税后回售收益 | AE1: 回售价值 | AF1: 纯债价值 | AG1: 弹性 | AH1: 信用 | AI1: 折现率 | AJ1: 双低 | AK1: 老式双低 | AL1: 老式排名 | AM1: 新式双低 | AN1: 新式排名 | AO1: MA20乖离 | AP1: 热门度 | AQ1: 转债名称
A2: 274 | B2: 128062 | C2: 亚药转债! | D2: 2370 | E2: 亚太药业 | F2: 医药 | G2: 化学制药 | H2: 80.101 | I2: -5.8999999999999999e-003 | J2: 5.8999999999999999e-003 | K2: 4.1 | L2: -2.1499999999999998e-002 | M2: 119.3 | N2: 16.25 | O2: 2.1699999999999999 | P2: 25.23 | Q2: 转股中 | R2: 3.84年 | S2: 1.85年 | T2: 9.63 | U2: 17 | V2: 2.2000000000000002e-002 | W2: 0.43799999999999994 | X2: 0.11 | Y2: 22 | Z2: 5.09 | AA2: 0.111 | AB2: 0.10099999999999999 | AC2: 0.13300000000000001 | AD2: 0.13 | AE2: 81.34 | AF2: 76.68 | AG2: 0 | AH2: BB | AI2: 0.12429999999999999 | AJ2: =H2+100*O2 -> 297.101 | AK2: 135 | AL2: 198 | AM2: 53.6 | AN2: 262 | AO2: 1.1000000000000001e-002 | AP2: 84 | AQ2: 亚药转债!
A3: 136 | B3: 113595 | C3: 花王转债! | D3: 603007 | E3: ST花王 | F3: 城市公用 | G3: 生态环境 | H3: 88.12 | I3: 7.000000000000001e-004 | J3: -5.0000000000000001e-004 | K3: 3.07 | L3: 3.3e-003 | M3: 125.3 | N3: 6.93 | O3: 0.9890000000000001 | P3: 44.3 | Q3: 转股中 | R3: 5年53天 | S3: 3年54天 | T3: 3.3 | U3: 8.4 | V3: 2.8999999999999998e-002 | W3: 0.32000000000000001 | X3: 0.14199999999999999 | Y3: 10 | Z3: 0.9 | AA3: 7.2599999999999998e-002 | AB3: 6.3500000000000001e-002 | AC3: 5.2699999999999997e-002 | AD3: 4.99e-002 | AE3: 84.94 | AF3: 91.49 | AG3: 0.05 | AH3: AA- | AI3: 6.4600000000000005e-002 | AJ3: =H3+100*O3 -> 187.02000000000001 | AK3: 131.9 | AL3: 163 | AM3: 40.4 | AN3: 178 | AO3: -0.129 | AP3: 42 | AQ3: 花王转债!
A4: 363 | B4: 110031 | C4: 航信转债!!* | D4: 600271 | E4: 航天信息 | F4: 计算机及 | G4: 软件开发 | H4: 106.7 | I4: -8.9999999999999998e-004 | J4: 8.9999999999999998e-004 | K4: 12.52 | L4: -2.1899999999999999e-002 | M4: 107 | N4: 21.56 | O4: 0.83700000000000008 | P4: 58.07 | Q4: 转股中 | R4: 15天 | S4: 回售内 | T4: 24 | U4: 61 | V4: 2.4e-002 | W4: 0.10300000000000001 | X4: 5.9999999999999998e-002 | Y4: 232 | Z4: 1.86 | AA4: 7.0699999999999999e-002 | AB4: -0.223 | AC4: 回售内 | AD4: 回售内 | AE4: 100.27 | AF4: 106.88 | AG4: 0 | AH4: AAA | AI4: 2.7000000000000003e-002 | AJ4: =H4+100*O4 -> 190.40000000000001 | AK4: 155.3 | AL4: 308 | AM4: 48.4 | AN4: 236 | AO4: -6.9999999999999993e-003 | AP4: 14 | AQ4: 航信转债!!*
A5: 194 | B5: 128100 | C5: 搜特转债! | D5: 2503 | E5: 搜于特 | F5: 服装纺织 | G5: 服装行业 | H5: 87.474 | I5: -3.4000000000000002e-003 | J5: 4.0999999999999995e-003 | K5: 1.76 | L5: 5.6999999999999993e-003 | M5: 116.9 | N5: 2.9 | O5: 0.441 | P5: 60.69 | Q5: 转股中 | R5: 4.79年 | S5: 2.79年 | T5: 7.99 | U5: 46 | V5: 6.6000000000000003e-002 | W5: 0.14699999999999999 | X5: 8.900000000000001e-002 | Y5: 54 | Z5: 1.63 | AA5: 6.3700000000000007e-002 | AB5: 5.6900000000000006e-002 | AC5: 5.8700000000000002e-002 | AD5: 5.6299999999999996e-002 | AE5: 91.58 | AF5: 96.23 | AG5: 0.13 | AH5: AA | AI5: 4.2300000000000004e-002 | AJ5: =H5+100*O5 -> 131.57400000000001 | AK5: 114.3 | AL5: 10 | AM5: 18 | AN5: 5 | AO5: 2.5000000000000001e-002 | AP5: 62 | AQ5: 搜特转债!
A6: 272 | B6: 128063 | C6: 未来转债! | D6: 2631 | E6: 德尔未来 | F6: 其他 | G6: 家居用品 | H6: 102.912 | I6: 1.1000000000000001e-003 | J6: -1.7000000000000001e-003 | K6: 5.94 | L6: -3.4000000000000002e-003 | M6: 127.5 | N6: 8.6 | O6: 0.48999999999999999 | P6: 69.07 | Q6: 转股中 | R6: 3.85年 | S6: 2.85年 | T6: 6.3 | U6: 6.1 | V6: 9.0000000000000011e-003 | W6: 0.159 | X6: 0.11 | Y6: 40 | Z6: 2.35 | AA6: 5.8899999999999994e-002 | AB6: 4.6300000000000001e-002 | AC6: 1.7000000000000001e-002 | AD6: 1.18e-002 | AE6: 90.24 | AF6: 101.34 | AG6: 0.19 | AH6: AA- | AI6: 6.3299999999999995e-002 | AJ6: =H6+100*O6 -> 151.91200000000001 | AK6: 136.8 | AL6: 218 | AM6: 35.4 | AN6: 131 | AO6: -1.e-003 | AP6: 32 | AQ6: 未来转债!
A7: 77 | B7: 128138 | C7: 侨银转债! | D7: 2973 | E7: 侨银股份 | F7: 城市公用 | G7: 城市公用 | H7: 102.3 | I7: 1.4000000000000002e-003 | J7: -4.6999999999999993e-003 | K7: 16.45 | L7: -1.4999999999999999e-002 | M7: 136.5 | N7: 25.33 | O7: 0.57499999999999996 | P7: 64.94 | Q7: 转股中 | R7: 5.47年 | S7: 3.47年 | T7: 4.2 | U7: 7.8 | V7: 1.8000000000000002e-002 | W7: 6.2e-002 | X7: 4.0999999999999995e-002 | Y7: 67 | Z7: 4.46 | AA7: 5.5199999999999999e-002 | AB7: 4.4299999999999999e-002 | AC7: 5.6999999999999993e-003 | AD7: 3.3e-003 | AE7: 83.34 | AF7: 97.57 | AG7: 0.22 | AH7: AA- | AI7: 6.4600000000000005e-002 | AJ7: =H7+100*O7 -> 159.79999999999998 | AK7: 139.7 | AL7: 242 | AM7: 42.1 | AN7: 191 | AO7: -1.6e-002 | AP7: 10 | AQ7: 侨银转债!
A8: 120 | B8: 113600 | C8: 新星转债! | D8: 603978 | E8: 深圳新星 | F8: 有色金属 | G8: 有色行业 | H8: 96.6 | I8: 4.0000000000000002e-004 | J8: -4.8999999999999998e-003 | K8: 16.29 | L8: -1.5100000000000001e-002 | M8: 126 | N8: 23.85 | O8: 0.41399999999999998 | P8: 68.3 | Q8: 转股中 | R8: 5.21年 | S8: 3.21年 | T8: 5.95 | U8: 10 | V8: 1.8000000000000002e-002 | W8: 0.22800000000000001 | X8: 0.156 | Y8: 26 | Z8: 1.7 | AA8: 5.3499999999999999e-002 | AB8: 4.4600000000000001e-002 | AC8: 2.2099999999999998e-002 | AD8: 1.9799999999999998e-002 | AE8: 84.32 | AF8: 91.57 | AG8: 0.3 | AH8: AA- | AI8: 6.4600000000000005e-002 | AJ8: =H8+100*O8 -> 138. | AK8: 124.9 | AL8: 83 | AM8: 33.3 | AN8: 105 | AO8: -8.6999999999999994e-002 | AP8: 20 | AQ8: 新星转债!
A9: 153 | B9: 127018 | C9: 本钢转债! | D9: 761 | E9: 本钢板材 | F9: 钢铁 | G9: 炼钢 | H9: 101.25 | I9: 5.0000000000000001e-004 | J9: -1.2e-002 | K9: 4.35 | L9: -2.8999999999999998e-002 | M9: 128.6 | N9: 5.03 | O9: 0.17100000000000001 | P9: 86.48 | Q9: 转股中 | R9: 5年31天 | S9: 3年32天 | T9: 67.5 | U9: 96 | V9: 1.3999999999999999e-002 | W9: 0.40000000000000002 | X9: 0.34600000000000003 | Y9: 169 | Z9: 0.82 | AA9: 4.9800000000000004e-002 | AB9: 3.9900000000000005e-002 | AC9: 1.5800000000000002e-002 | AD9: 1.1899999999999999e-002 | AE9: 91.45 | AF9: 101.82 | AG9: 0.4 | AH9: AAA | AI9: 4.8600000000000004e-002 | AJ9: =H9+100*O9 -> 118.34999999999999 | AK9: 116 | AL9: 19 | AM9: 14.2 | AN9: 3 | AO9: -2.7999999999999997e-002 | AP9: 62 | AQ9: 本钢转债!
A10: 258 | B10: 123028 | C10: 清水转债! | D10: 300437 | E10: 清水源 | F10: 城市公用 | G10: 三废处理 | H10: 100.808 | I10: 8.0000000000000002e-003 | J10: 1.3600000000000001e-002 | K10: 9.19 | L10: 6.2400000000000004e-002 | M10: 121.8 | N10: 11.84 | O10: 0.29899999999999999 | P10: 77.62 | Q10: 转股中 | R10: 4年21天 | S10: 2年22天 | T10: 4.55 | U10: 41 | V10: 8.900000000000001e-002 | W10: 0.22399999999999998 | X10: 0.17399999999999999 | Y10: 20 | Z10: 1.83 | AA10: 4.9200000000000001e-002 | AB10: 3.9300000000000002e-002 | AC10: 1.7500000000000002e-002 | AD10: 1.3300000000000001e-002 | AE10: 91.55 | AF10: 95.67 | AG10: 0.35 | AH10: AA- | AI10: 6.3299999999999995e-002 | AJ10: =H10+100*O10 -> 130.708 | AK10: 124 | AL10: 73 | AM10: 28.3 | AN10: 48 | AO10: 9.5000000000000001e-002 | AP10: 52 | AQ10: 清水转债!
A11: 359 | B11: 127003 | C11: 海印转债! | D11: 861 | E11: 海印股份 | F11: 商业零售 | G11: 商场 | H11: 106.522 | I11: 2.0000000000000001e-004 | J11: -1.e-004 | K11: 2.24 | L11: 4.5000000000000005e-003 | M11: 111.8 | N11: 3 | O11: 0.42700000000000005 | P11: 74.67 | Q11: 转股中 | R11: 1年11天 | S11: 回售内 | T11: 6.74 | U11: 5.9 | V11: 8.0000000000000002e-003 | W11: 0.129 | X11: 9.6999999999999989e-002 | Y11: 52 | Z11: 1.37 | AA11: 4.8899999999999999e-002 | AB11: 2.69e-002 | AC11: 回售内 | AD11: 回售内 | AE11: 100.3 | AF11: 107.38 | AG11: 0.02 | AH11: AA | AI11: 4.0599999999999997e-002 | AJ11: =H11+100*O11 -> 149.22200000000001 | AK11: 138.4 | AL11: 229 | AM11: 31 | AN11: 77 | AO11: 4.0000000000000001e-003 | AP11: 72 | AQ11: 海印转债!
A12: 199 | B12: 113569 | C12: 科达转债! | D12: 603660 | E12: 苏州科达 | F12: 通信互联 | G12: 物联网 | H12: 96.86 | I12: -2.9999999999999997e-004 | J12: -2.0000000000000001e-004 | K12: 6.93 | L12: -8.6e-003 | M12: 120.3 | N12: 14.8 | O12: 1.0700000000000001 | P12: 46.82 | Q12: 转股中 | R12: 4.78年 | S12: 2.78年 | T12: 5.16 | U12: 1.9 | V12: 4.0000000000000001e-003 | W12: 0.14899999999999999 | X12: 7.0000000000000007e-002 | Y12: 35 | Z12: 1.91 | AA12: 4.7400000000000005e-002 | AB12: 3.9599999999999996e-002 | AC12: 2.3399999999999997e-002 | AD12: 2.0899999999999998e-002 | AE12: 86.64 | AF12: 90.26 | AG12: 0.06 | AH12: AA- | AI12: 6.3299999999999995e-002 | AJ12: =H12+100*O12 -> 203.86000000000001 | AK12: 146.9 | AL12: 273 | AM12: 56.6 | AN12: 284 | AO12: -5.0000000000000001e-003 | AP12: 27 | AQ12: 科达转债!
A13: 181 | B13: 113576 | C13: 起步转债!! | D13: 603557 | E13: ST起步 | F13: 服装纺织 | G13: 鞋服行业 | H13: 97.3 | I13: 3.5499999999999997e-002 | J13: -3.0099999999999998e-002 | K13: 4.97 | L13: 5.0700000000000002e-002 | M13: 121.3 | N13: 10.55 | O13: 1.0700000000000001 | P13: 47.11 | Q13: 转股中 | R13: 4.87年 | S13: 2.87年 | T13: 2.66 | U13: 267 | V13: 1.04 | W13: 0.10800000000000001 | X13: 5.0999999999999997e-002 | Y13: 25 | Z13: 1.57 | AA13: 4.7400000000000005e-002 | AB13: 3.9399999999999998e-002 | AC13: 2.3099999999999999e-002 | AD13: 2.0299999999999999e-002 | AE13: 81.74 | AF13: 82.58 | AG13: 0.11 | AH13: A | AI13: 8.43e-002 | AJ13: =H13+100*O13 -> 204.30000000000001 | AK13: 147.5 | AL13: 274 | AM13: 64.9 | AN13: 308 | AO13: -0.20000000000000001 | AP13: 31 | AQ13: 起步转债!!
A14: 334 | B14: 113017 | C14: 吉视转债! | D14: 601929 | E14: 吉视传媒 | F14: 传媒娱乐 | G14: 影视娱乐 | H14: 97.12 | I14: -3.0999999999999999e-003 | J14: 1.6000000000000001e-003 | K14: 1.87 | L14: -2.6000000000000002e-002 | M14: 108.8 | N14: 2.95 | O14: 0.53200000000000003 | P14: 63.39 | Q14: 转股中 | R14: 2.58年 | S14: 0.58年 | T14: 15.6 | U14: 45 | V14: 2.9999999999999999e-002 | W14: 0.26800000000000002 | X14: 0.17000000000000001 | Y14: 58 | Z14: 0.88 | AA14: 4.5599999999999995e-002 | AB14: 3.8800000000000001e-002 | AC14: 6.1399999999999996e-002 | AD14: 5.7099999999999998e-002 | AE14: 98.71 | AF14: 98.8 | AG14: 0.06 | AH14: AA+ | AI14: 3.8599999999999995e-002 | AJ14: =H14+100*O14 -> 150.31999999999999 | AK14: 130.9 | AL14: 152 | AM14: 32 | AN14: 91 | AO14: -1.e-002 | AP14: 64 | AQ14: 吉视转债!
A15: 287 | B15: 110052 | C15: 贵广转债! | D15: 600996 | E15: 贵广网络 | F15: 传媒娱乐 | G15: 影视娱乐 | H15: 99.96 | I15: -3.3e-003 | J15: 2.e-003 | K15: 4.62 | L15: -2.53e-002 | M15: 117.7 | N15: 7.94 | O15: 0.71799999999999997 | P15: 58.19 | Q15: 转股中 | R15: 3.77年 | S15: 1.77年 | T15: 15.3 | U15: 11 | V15: 6.9999999999999993e-003 | W15: 0.314 | X15: 0.183 | Y15: 49 | Z15: 1.15 | AA15: 4.5199999999999997e-002 | AB15: 3.6499999999999998e-002 | AC15: 1.5900000000000001e-002 | AD15: 1.2699999999999999e-002 | AE15: 95.5 | AF15: 101.71 | AG15: 0.05 | AH15: AA+ | AI15: 4.0300000000000002e-002 | AJ15: =H15+100*O15 -> 171.75999999999999 | AK15: 141.7 | AL15: 253 | AM15: 40 | AN15: 172 | AO15: 2.e-003 | AP15: 18 | AQ15: 贵广转债!
A16: 128 | B16: 113596 | C16: 城地转债! | D16: 603887 | E16: 城地香江 | F16: 通信互联 | G16: 通信设备 | H16: 90.77 | I16: -3.4000000000000002e-003 | J16: 2.8999999999999998e-003 | K16: 11.81 | L16: -1.9099999999999999e-002 | M16: 113.5 | N16: 29.21 | O16: 1.25 | P16: 40.43 | Q16: 转股中 | R16: 5.16年 | S16: 3.17年 | T16: 12 | U16: 14 | V16: 1.3000000000000001e-002 | W16: 0.27100000000000002 | X16: 0.109 | Y16: 44 | Z16: 1.16 | AA16: 4.5199999999999997e-002 | AB16: 4.0099999999999997e-002 | AC16: 4.1599999999999998e-002 | AD16: 3.9199999999999999e-002 | AE16: 84.48 | AF16: 82.75 | AG16: 0.03 | AH16: AA- | AI16: 6.4600000000000005e-002 | AJ16: =H16+100*O16 -> 215.76999999999998 | AK16: 141.1 | AL16: 247 | AM16: 56.6 | AN16: 283 | AO16: -2.9999999999999999e-002 | AP16: 22 | AQ16: 城地转债!
A17: 304 | B17: 113519 | C17: 长久转债! | D17: 603569 | E17: 长久物流 | F17: 交通运输 | G17: 物流业 | H17: 102.98 | I17: 3.0999999999999999e-003 | J17: -8.9999999999999998e-004 | K17: 7.95 | L17: 1.5300000000000001e-002 | M17: 119.3 | N17: 11.15 | O17: 0.44400000000000001 | P17: 71.3 | Q17: 转股中 | R17: 3.44年 | S17: 1.45年 | T17: 6.97 | U17: 4.2 | V17: 6.0000000000000001e-003 | W17: 0.156 | X17: 0.11199999999999999 | Y17: 45 | Z17: 2.03 | AA17: 4.4500000000000005e-002 | AB17: 3.4300000000000004e-002 | AC17: -1.1000000000000001e-003 | AD17: -4.5000000000000005e-003 | AE17: 96.21 | AF17: 103.72 | AG17: 0.14 | AH17: AA | AI17: 4.2300000000000004e-002 | AJ17: =H17+100*O17 -> 147.38 | AK17: 134.7 | AL17: 192 | AM17: 30.9 | AN17: 76 | AO17: 4.0999999999999995e-002 | AP17: 20 | AQ17: 长久转债!
A18: 174 | B18: 113573 | C18: 纵横转债! | D18: 603602 | E18: 纵横通信 | F18: 通信互联 | G18: 通信设备 | H18: 100.99 | I18: -8.9999999999999998e-004 | J18: 4.0000000000000002e-004 | K18: 10.36 | L18: -2.8999999999999998e-003 | M18: 124.2 | N18: 18.78 | O18: 0.83099999999999996 | P18: 55.17 | Q18: 转股中 | R18: 4.89年 | S18: 2.89年 | T18: 2.7 | U18: 7.5 | V18: 2.7000000000000003e-002 | W18: 0.128 | X18: 7.0999999999999994e-002 | Y18: 21 | Z18: 2.98 | AA18: 4.4199999999999996e-002 | AB18: 3.5400000000000001e-002 | AC18: 1.01e-002 | AD18: 7.4999999999999997e-003 | AE18: 83.83 | AF18: 88.19 | AG18: 0.16 | AH18: A+ | AI18: 7.4299999999999991e-002 | AJ18: =H18+100*O18 -> 184.08999999999997 | AK18: 146.8 | AL18: 272 | AM18: 58.6 | AN18: 291 | AO18: 1.2e-002 | AP18: 23 | AQ18: 纵横转债!
A19: 98 | B19: 123069 | C19: 金诺转债! | D19: 300505 | E19: 川金诺 | F19: 化工 | G19: 农化 | H19: 100.793 | I19: -2.0999999999999999e-003 | J19: -1.e-003 | K19: 13.92 | L19: -8.5000000000000006e-003 | M19: 126 | N19: 19.15 | O19: 0.38700000000000001 | P19: 72.69 | Q19: 转股中 | R19: 5.38年 | S19: 3.39年 | T19: 3.68 | U19: 2.5 | V19: 6.9999999999999993e-003 | W19: 0.20199999999999999 | X19: 0.14699999999999999 | Y19: 18 | Z19: 1.92 | AA19: 4.3200000000000002e-002 | AB19: 3.4799999999999998e-002 | AC19: 8.6999999999999994e-003 | AD19: 6.5000000000000006e-003 | AE19: 83.4 | AF19: 90.57 | AG19: 0.36 | AH19: AA- | AI19: 6.4600000000000005e-002 | AJ19: =H19+100*O19 -> 139.49299999999999 | AK19: 128.9 | AL19: 132 | AM19: 38.3 | AN19: 159 | AO19: 6.9999999999999993e-003 | AP19: 18 | AQ19: 金诺转债!
A20: 353 | B20: 128015 | C20: 久其转债! | D20: 2279 | E20: 久其软件 | F20: 计算机及 | G20: 软件开发 | H20: 101.888 | I20: 4.3e-003 | J20: -8.0000000000000004e-004 | K20: 5.26 | L20: 3.7499999999999999e-002 | M20: 110.8 | N20: 6.97 | O20: 0.34999999999999998 | P20: 75.47 | Q20: 转股中 | R20: 2年11天 | S20: 11天 | T20: 7.8 | U20: 87 | V20: 0.11 | W20: 0.20800000000000002 | X20: 0.157 | Y20: 37 | Z20: 4.35 | AA20: 4.2999999999999997e-002 | AB20: 3.2599999999999997e-002 | AC20: -1.6899999999999998e-002 | AD20: -3.2199999999999999e-002 | AE20: 100.17 | AF20: 96.37 | AG20: 0.09 | AH20: A+ | AI20: 7.2599999999999998e-002 | AJ20: =H20+100*O20 -> 136.88800000000001 | AK20: 128.3 | AL20: 119 | AM20: 28.1 | AN20: 47 | AO20: 0.13400000000000001 | AP20: 66 | AQ20: 久其转债!
A21: 74 | B21: 123077 | C21: 汉得转债! | D21: 300170 | E21: 汉得信息 | F21: 计算机及 | G21: 软件开发 | H21: 100.025 | I21: -7.7000000000000002e-003 | J21: 4.6999999999999993e-003 | K21: 6.94 | L21: -1.2800000000000001e-002 | M21: 125.5 | N21: 9.69 | O21: 0.39700000000000002 | P21: 71.62 | Q21: 转股中 | R21: 5.49年 | S21: 3.49年 | T21: 9.37 | U21: 4.7 | V21: 5.0000000000000001e-003 | W21: 0.153 | X21: 0.109 | Y21: 61 | Z21: 1.93 | AA21: 4.2999999999999997e-002 | AB21: 3.49e-002 | AC21: 1.04e-002 | AD21: 8.3000000000000001e-003 | AE21: 88.98 | AF21: 99.73 | AG21: 0.23 | AH21: AA | AI21: 4.36e-002 | AJ21: =H21+100*O21 -> 139.72500000000002 | AK21: 128.4 | AL21: 122 | AM21: 28.7 | AN21: 53 | AO21: 3.2000000000000001e-002 | AP21: 13 | AQ21: 汉得转债!
A22: 324 | B22: 128037 | C22: 岩土转债! | D22: 2542 | E22: 中化岩土 | F22: 建筑 | G22: 建筑工程 | H22: 99.3 | I22: 2.9999999999999997e-004 | J22: -4.0000000000000002e-004 | K22: 2.91 | L22: -1.6899999999999998e-002 | M22: 111.3 | N22: 7.99 | O22: 1.73 | P22: 36.42 | Q22: 转股中 | R22: 2.79年 | S22: 0.80年 | T22: 5.99 | U22: 2.2 | V22: 4.0000000000000001e-003 | W22: 0.114 | X22: 4.2000000000000003e-002 | Y22: 53 | Z22: 1.33 | AA22: 4.2300000000000004e-002 | AB22: 3.4500000000000003e-002 | AC22: 2.6200000000000001e-002 | AD22: 2.2400000000000003e-002 | AE22: 97.98 | AF22: 99.75 | AG22: 0 | AH22: AA | AI22: 4.0599999999999997e-002 | AJ22: =H22+100*O22 -> 272.30000000000001 | AK22: 162.2 | AL22: 316 | AM22: 62.4 | AN22: 302 | AO22: -6.0000000000000001e-003 | AP22: 49 | AQ22: 岩土转债!
A23: 277 | B23: 113530 | C23: 大丰转债! | D23: 603081 | E23: 大丰实业 | F23: 建筑 | G23: 装饰工程 | H23: 103.68 | I23: -1.e-004 | J23: -2.2000000000000001e-003 | K23: 11.54 | L23: -1.7899999999999999e-002 | M23: 121 | N23: 16.64 | O23: 0.495 | P23: 69.35 | Q23: 转股中 | R23: 3.83年 | S23: 1.83年 | T23: 6.3 | U23: 1.7 | V23: 3.0000000000000001e-003 | W23: 0.13600000000000001 | X23: 9.4e-002 | Y23: 46 | Z23: 2.08 | AA23: 4.2000000000000003e-002 | AB23: 3.2099999999999997e-002 | AC23: -3.7000000000000002e-003 | AD23: -6.6e-003 | AE23: 94.8 | AF23: 103.56 | AG23: 0.13 | AH23: AA | AI23: 4.2300000000000004e-002 | AJ23: =H23+100*O23 -> 153.18000000000001 | AK23: 138 | AL23: 226 | AM23: 34.4 | AN23: 117 | AO23: -1.3999999999999999e-002 | AP23: 33 | AQ23: 大丰转债!
A24: 263 | B24: 113535 | C24: 大业转债! | D24: 603278 | E24: 大业股份 | F24: 汽车 | G24: 零部件制 | H24: 99.87 | I24: -3.7000000000000002e-003 | J24: 1.1999999999999999e-003 | K24: 8.3 | L24: -2.35e-002 | M24: 112.5 | N24: 12.4 | O24: 0.49200000000000005 | P24: 66.94 | Q24: 转股中 | R24: 2.95年 | S24: 0.95年 | T24: 5 | U24: 5.1 | V24: 1.e-002 | W24: 0.20800000000000002 | X24: 0.13900000000000001 | Y24: 24 | Z24: 1.4 | AA24: 4.1700000000000001e-002 | AB24: 3.3599999999999998e-002 | AC24: 1.24e-002 | AD24: 1.0200000000000001e-002 | AE24: 96.86 | AF24: 100.17 | AG24: 0.11 | AH24: AA | AI24: 4.0599999999999997e-002 | AJ24: =H24+100*O24 -> 149.06999999999999 | AK24: 132.8 | AL24: 175 | AM24: 32.6 | AN24: 98 | AO24: -5.2000000000000005e-002 | AP24: 48 | AQ24: 大业转债!
A25: 143 | B25: 127019 | C25: 国城转债! | D25: 688 | E25: 国城矿业 | F25: 有色金属 | G25: 锌铅镍锡 | H25: 93.91 | I25: 3.0000000000000001e-003 | J25: -3.2000000000000002e-003 | K25: 9.3 | L25: -5.3e-003 | M25: 115.1 | N25: 21.07 | O25: 1.1299999999999999 | P25: 44.14 | Q25: 转股中 | R25: 5年47天 | S25: 3年48天 | T25: 8.5 | U25: 14 | V25: 1.7000000000000001e-002 | W25: 8.0000000000000002e-002 | X25: 3.5000000000000003e-002 | Y25: 106 | Z25: 4.56 | AA25: 4.1299999999999996e-002 | AB25: 3.5699999999999996e-002 | AC25: 3.0499999999999999e-002 | AD25: 2.8300000000000002e-002 | AE25: 90.13 | AF25: 92.88 | AG25: 0.03 | AH25: AA | AI25: 4.36e-002 | AJ25: =H25+100*O25 -> 206.90999999999997 | AK25: 143.7 | AL25: 260 | AM25: 50.8 | AN25: 250 | AO25: -2.7999999999999997e-002 | AP25: 40 | AQ25: 国城转债!
A26: 71 | B26: 128139 | C26: 祥鑫转债! | D26: 2965 | E26: 祥鑫科技 | F26: 汽车 | G26: 零部件制 | H26: 97.307 | I26: -1.e-003 | J26: -1.1000000000000001e-003 | K26: 24.05 | L26: -6.9999999999999993e-003 | M26: 121 | N26: 36.96 | O26: 0.495 | P26: 65.07 | Q26: 10天 | R26: 5.51年 | S26: 3.51年 | T26: 6.47 | U26: 3.3 | V26: 5.0000000000000001e-003 | W26: 0.17899999999999999 | X26: 0.11599999999999999 | Y26: 36 | Z26: 2.05 | AA26: 4.1200000000000001e-002 | AB26: 3.4300000000000004e-002 | AC26: 1.8200000000000001e-002 | AD26: 1.61e-002 | AE26: 82.74 | AF26: 86.32 | AG26: 0.29 | AH26: AA- | AI26: 6.4600000000000005e-002 | AJ26: =H26+100*O26 -> 146.80700000000002 | AK26: 129.5 | AL26: 137 | AM26: 43.2 | AN26: 206 | AO26: -0.121 | AP26: 12 | AQ26: 祥鑫转债!
A27: 306 | B27: 128044 | C27: 岭南转债! | D27: 2717 | E27: 岭南股份 | F27: 城市公用 | G27: 生态环境 | H27: 98.079 | I27: 5.7999999999999996e-003 | J27: -7.8000000000000005e-003 | K27: 3.39 | L27: -4.24e-002 | M27: 111.3 | N27: 5.91 | O27: 0.70999999999999996 | P27: 57.36 | Q27: 转股中 | R27: 3.21年 | S27: 1.21年 | T27: 6.59 | U27: 226 | V27: 0.34999999999999998 | W27: 0.127 | X27: 7.2999999999999995e-002 | Y27: 52 | Z27: 1.19 | AA27: 4.1100000000000005e-002 | AB27: 3.4200000000000001e-002 | AC27: 3.5000000000000003e-002 | AD27: 3.0800000000000001e-002 | AE27: 97.14 | AF27: 97.72 | AG27: 0.05 | AH27: AA | AI27: 4.2300000000000004e-002 | AJ27: =H27+100*O27 -> 169.07900000000001 | AK27: 138.8 | AL27: 235 | AM27: 41.1 | AN27: 183 | AO27: 0.113 | AP27: 44 | AQ27: 岭南转债!
A28: 148 | B28: 128118 | C28: 瀛通转债! | D28: 2861 | E28: 瀛通通讯 | F28: 电子 | G28: 电子产品 | H28: 99.99 | I28: 2.2000000000000001e-003 | J28: -6.1999999999999998e-003 | K28: 14.21 | L28: -1.32e-002 | M28: 122.1 | N28: 21.12 | O28: 0.48599999999999999 | P28: 67.28 | Q28: 转股中 | R28: 5年34天 | S28: 3年35天 | T28: 3 | U28: 2.6 | V28: 9.0000000000000011e-003 | W28: 0.13400000000000001 | X28: 8.9999999999999997e-002 | Y28: 22 | Z28: 1.62 | AA28: 4.0999999999999995e-002 | AB28: 3.32e-002 | AC28: 1.41e-002 | AD28: 1.1299999999999999e-002 | AE28: 85.51 | AF28: 89.5 | AG28: 0.3 | AH28: AA- | AI28: 6.4600000000000005e-002 | AJ28: =H28+100*O28 -> 148.59 | AK28: 132.7 | AL28: 171 | AM28: 43.2 | AN28: 205 | AO28: -0.17399999999999999 | AP28: 15 | AQ28: 瀛通转债!
A29: 119 | B29: 110072 | C29: 广汇转债! | D29: 600297 | E29: 广汇汽车 | F29: 汽车 | G29: 分销、售 | H29: 93.16 | I29: 8.0000000000000004e-004 | J29: -3.4999999999999996e-003 | K29: 2.88 | L29: -1.03e-002 | M29: 114.5 | N29: 4.03 | O29: 0.30399999999999999 | P29: 71.46 | Q29: 转股中 | R29: 5.22年 | S29: 3.22年 | T29: 33.7 | U29: 52 | V29: 1.7000000000000001e-002 | W29: 0.14400000000000002 | X29: 0.10300000000000001 | Y29: 234 | Z29: 0.58 | AA29: 4.0899999999999999e-002 | AB29: 3.5699999999999996e-002 | AC29: 3.0299999999999997e-002 | AD29: 2.8399999999999998e-002 | AE29: 89.79 | AF29: 92.86 | AG29: 0.27 | AH29: AA+ | AI29: 4.1599999999999998e-002 | AJ29: =H29+100*O29 -> 123.56 | AK29: 114.9 | AL29: 13 | AM29: 22 | AN29: 15 | AO29: -2.9999999999999999e-002 | AP29: 55 | AQ29: 广汇转债!
A30: 196 | B30: 123044 | C30: 红相转债!! | D30: 300427 | E30: 红相股份 | F30: 能源电力 | G30: 电力设备 | H30: 103.7 | I30: -3.8e-003 | J30: -1.1999999999999999e-003 | K30: 13.04 | L30: -1.7299999999999999e-002 | M30: 125 | N30: 18.67 | O30: 0.48499999999999999 | P30: 69.84 | Q30: 转股中 | R30: 4.79年 | S30: 2.79年 | T30: 5.5 | U30: 8.2 | V30: 1.3999999999999999e-002 | W30: 0.11699999999999999 | X30: 8.199999999999999e-002 | Y30: 47 | Z30: 2 | AA30: 4.0800000000000003e-002 | AB30: 3.1600000000000003e-002 | AC30: 2.7000000000000001e-003 | AD30: -2.9999999999999997e-004 | AE30: 87.35 | AF30: 93.86 | AG30: 0.29 | AH30: AA- | AI30: 6.3299999999999995e-002 | AJ30: =H30+100*O30 -> 152.19999999999999 | AK30: 137.6 | AL30: 224 | AM30: 43.7 | AN30: 210 | AO30: 5.5999999999999994e-002 | AP30: 20 | AQ30: 红相转债!!
A31: 340 | B31: 128026 | C31: 众兴转债! | D31: 2772 | E31: 众兴菌业 | F31: 农业 | G31: 种植业 | H31: 98.952 | I31: -3.0000000000000001e-003 | J31: 2.5000000000000001e-003 | K31: 7.9 | L31: -8.8000000000000005e-003 | M31: 109.3 | N31: 11.36 | O31: 0.42299999999999999 | P31: 69.54 | Q31: 转股中 | R31: 2.55年 | S31: 0.55年 | T31: 9.19 | U31: 4.5 | V31: 5.0000000000000001e-003 | W31: 0.316 | X31: 0.22 | Y31: 29 | Z31: 1.13 | AA31: 4.0599999999999997e-002 | AB31: 3.3399999999999999e-002 | AC31: 4.0800000000000003e-002 | AD31: 3.56e-002 | AE31: 97.57 | AF31: 94.13 | AG31: 0.05 | AH31: AA- | AI31: 6.1600000000000002e-002 | AJ31: =H31+100*O31 -> 141.25200000000001 | AK31: 128.4 | AL31: 121 | AM31: 30.8 | AN31: 75 | AO31: -4.0000000000000001e-003 | AP31: 62 | AQ31: 众兴转债!
A32: 115 | B32: 113601 | C32: 塞力转债! | D32: 603716 | E32: 塞力医疗 | F32: 医药 | G32: 医药商业 | H32: 98.99 | I32: 8.0000000000000002e-003 | J32: -1.5900000000000001e-002 | K32: 12.73 | L32: -1.9299999999999998e-002 | M32: 121.3 | N32: 16.98 | O32: 0.32000000000000001 | P32: 74.97 | Q32: 转股中 | R32: 5.23年 | S32: 3.23年 | T32: 5.43 | U32: 29 | V32: 5.4000000000000006e-002 | W32: 0.20800000000000002 | X32: 0.156 | Y32: 26 | Z32: 1.67 | AA32: 4.0599999999999997e-002 | AB32: 3.32e-002 | AC32: 1.55e-002 | AD32: 1.3000000000000001e-002 | AE32: 84.49 | AF32: 88.12 | AG32: 0.41 | AH32: AA- | AI32: 6.4600000000000005e-002 | AJ32: =H32+100*O32 -> 130.99000000000001 | AK32: 123 | AL32: 70 | AM32: 34.9 | AN32: 123 | AO32: -7.400000000000001e-002 | AP32: 37 | AQ32: 塞力转债!
A33: 222 | B33: 110064 | C33: 建工转债! | D33: 600939 | E33: 重庆建工 | F33: 建筑 | G33: 建筑工程 | H33: 100.55 | I33: -3.8e-003 | J33: 2.2000000000000001e-003 | K33: 3.64 | L33: -5.5000000000000005e-003 | M33: 119.8 | N33: 4.57 | O33: 0.26200000000000001 | P33: 79.65 | Q33: 转股中 | R33: 4.56年 | S33: 2.56年 | T33: 16.6 | U33: 2 | V33: 1.e-003 | W33: 0.251 | X33: 0.20000000000000001 | Y33: 66 | Z33: 0.94 | AA33: 4.0099999999999997e-002 | AB33: 3.2099999999999997e-002 | AC33: 1.3000000000000001e-002 | AD33: 1.e-002 | AE33: 93.58 | AF33: 100.47 | AG33: 0.28 | AH33: AA+ | AI33: 4.0300000000000002e-002 | AJ33: =H33+100*O33 -> 126.75 | AK33: 121.5 | AL33: 54 | AM33: 21 | AN33: 11 | AO33: 1.9e-002 | AP33: 44 | AQ33: 建工转债!
A34: 313 | B34: 123011 | C34: 德尔转债! | D34: 300473 | E34: 德尔股份 | F34: 汽车 | G34: 零部件制 | H34: 103.268 | I34: -5.0000000000000001e-003 | J34: -1.2999999999999999e-003 | K34: 20.16 | L34: -4.5899999999999996e-002 | M34: 116.3 | N34: 31.38 | O34: 0.60699999999999998 | P34: 64.24 | Q34: 转股中 | R34: 3年50天 | S34: 1年51天 | T34: 2.51 | U34: 31 | V34: 0.11800000000000001 | W34: 9.1999999999999998e-002 | X34: 5.9000000000000004e-002 | Y34: 27 | Z34: 1.23 | AA34: 3.95e-002 | AB34: 2.98e-002 | AC34: -3.4999999999999996e-003 | AD34: -7.7000000000000002e-003 | AE34: 94.96 | AF34: 96.34 | AG34: 0.14 | AH34: AA- | AI34: 6.3299999999999995e-002 | AJ34: =H34+100*O34 -> 163.96799999999999 | AK34: 142.3 | AL34: 256 | AM34: 46 | AN34: 225 | AO34: -3.4000000000000002e-002 | AP34: 42 | AQ34: 德尔转债!
A35: 259 | B35: 113027 | C35: 华钰转债!! | D35: 601020 | E35: ST华钰 | F35: 有色金属 | G35: 锌铅镍锡 | H35: 98.62 | I35: -4.3e-003 | J35: 4.7999999999999996e-003 | K35: 6.92 | L35: 1.4000000000000002e-003 | M35: 114.9 | N35: 10.17 | O35: 0.44900000000000001 | P35: 68.04 | Q35: 转股中 | R35: 4年16天 | S35: 2年17天 | T35: 3.25 | U35: 71 | V35: 0.21899999999999997 | W35: 8.5000000000000006e-002 | X35: 5.7999999999999996e-002 | Y35: 38 | Z35: 1.54 | AA35: 3.9399999999999998e-002 | AB35: 3.2400000000000005e-002 | AC35: 2.1899999999999999e-002 | AD35: 1.8799999999999997e-002 | AE35: 86.64 | AF35: 83.47 | AG35: 0.3 | AH35: A | AI35: 8.43e-002 | AJ35: =H35+100*O35 -> 143.52000000000001 | AK35: 129.2 | AL35: 134 | AM35: 42.6 | AN35: 200 | AO35: -4.2000000000000003e-002 | AP35: 46 | AQ35: 华钰转债!!
A36: 54 | B36: 123088 | C36: 威唐转债! | D36: 300707 | E36: 威唐工业 | F36: 汽车 | G36: 零部件制 | H36: 98.601 | I36: -1.e-003 | J36: 1.24e-002 | K36: 15.56 | L36: 2.3e-002 | M36: 121.6 | N36: 20.72 | O36: 0.313 | P36: 75.1 | Q36: 24天 | R36: 5.55年 | S36: 3.55年 | T36: 3.01 | U36: 8.6 | V36: 2.8999999999999998e-002 | W36: 0.12300000000000001 | X36: 9.3000000000000013e-002 | Y36: 24 | Z36: 3.54 | AA36: 3.9399999999999998e-002 | AB36: 3.2400000000000005e-002 | AC36: 1.6200000000000003e-002 | AD36: 1.37e-002 | AE36: 80.05 | AF36: 81.95 | AG36: 0.5 | AH36: A+ | AI36: 7.5600000000000001e-002 | AJ36: =H36+100*O36 -> 129.90100000000001 | AK36: 122.1 | AL36: 62 | AM36: 40.2 | AN36: 173 | AO36: 7.6999999999999999e-002 | AP36: 12 | AQ36: 威唐转债!
A37: 280 | B37: 123023 | C37: 迪森转债! | D37: 300335 | E37: 迪森股份 | F37: 能源电力 | G37: 电力供应 | H37: 98.96 | I37: -4.0000000000000002e-004 | J37: -7.000000000000001e-004 | K37: 4.82 | L37: -6.1999999999999998e-003 | M37: 114.3 | N37: 7.04 | O37: 0.44500000000000001 | P37: 68.47 | Q37: 转股中 | R37: 3.81年 | S37: 2.81年 | T37: 5.29 | U37: 3.3 | V37: 6.0000000000000001e-003 | W37: 0.29399999999999998 | X37: 0.20100000000000001 | Y37: 18 | Z37: 1.29 | AA37: 3.9300000000000002e-002 | AB37: 3.2199999999999999e-002 | AC37: 1.9199999999999998e-002 | AD37: 1.6e-002 | AE37: 92.64 | AF37: 97.89 | AG37: 0.17 | AH37: AA | AI37: 4.2300000000000004e-002 | AJ37: =H37+100*O37 -> 143.45999999999998 | AK37: 129.5 | AL37: 135 | AM37: 31.6 | AN37: 86 | AO37: 1.3999999999999999e-002 | AP37: 50 | AQ37: 迪森转债!
A38: 117 | B38: 128127 | C38: 文科转债! | D38: 2775 | E38: 文科园林 | F38: 城市公用 | G38: 生态环境 | H38: 99.63 | I38: -1.6000000000000001e-003 | J38: -6.9999999999999993e-003 | K38: 4.41 | L38: -1.5600000000000001e-002 | M38: 121.3 | N38: 4.88 | O38: 0.10199999999999999 | P38: 90.37 | Q38: 转股中 | R38: 5.23年 | S38: 3.23年 | T38: 9.5 | U38: 22 | V38: 2.3e-002 | W38: 0.41999999999999998 | X38: 0.38 | Y38: 23 | Z38: 0.96 | AA38: 3.9300000000000002e-002 | AB38: 3.1899999999999998e-002 | AC38: 1.3500000000000002e-002 | AD38: 1.1000000000000001e-002 | AE38: 84.5 | AF38: 88.14 | AG38: 0.55 | AH38: AA- | AI38: 6.4600000000000005e-002 | AJ38: =H38+100*O38 -> 109.83 | AK38: 108.9 | AL38: 1 | AM38: 20.8 | AN38: 10 | AO38: -6.9000000000000006e-002 | AP38: 44 | AQ38: 文科转债!
A39: 107 | B39: 128132 | C39: 交建转债! | D39: 2941 | E39: 新疆交建 | F39: 建筑 | G39: 建筑工程 | H39: 96.309 | I39: 1.e-004 | J39: 3.0999999999999999e-003 | K39: 11.33 | L39: 2.1600000000000001e-002 | M39: 117.3 | N39: 18.57 | O39: 0.57899999999999996 | P39: 61.01 | Q39: 转股中 | R39: 5.30年 | S39: 3.30年 | T39: 8.5 | U39: 49 | V39: 5.9000000000000004e-002 | W39: 0.11599999999999999 | X39: 7.0999999999999994e-002 | Y39: 73 | Z39: 3.01 | AA39: 3.8699999999999998e-002 | AB39: 3.2599999999999997e-002 | AC39: 2.2099999999999998e-002 | AD39: 1.9799999999999998e-002 | AE39: 89.67 | AF39: 93.99 | AG39: 0.15 | AH39: AA | AI39: 4.36e-002 | AJ39: =H39+100*O39 -> 154.209 | AK39: 131.6 | AL39: 160 | AM39: 37.6 | AN39: 152 | AO39: 3.9e-002 | AP39: 18 | AQ39: 交建转债!
A40: 149 | B40: 128117 | C40: 道恩转债! | D40: 2838 | E40: 道恩股份 | F40: 化工 | G40: 橡胶塑料 | H40: 102.354 | I40: -4.0000000000000002e-004 | J40: -4.5999999999999999e-003 | K40: 19.06 | L40: -1.8500000000000003e-002 | M40: 123.5 | N40: 28.83 | O40: 0.54799999999999993 | P40: 66.11 | Q40: 转股中 | R40: 5年34天 | S40: 3年35天 | T40: 3.6 | U40: 42 | V40: 0.113 | W40: 4.5999999999999999e-002 | X40: 3.1e-002 | Y40: 78 | Z40: 4.09 | AA40: 3.8399999999999997e-002 | AB40: 3.0200000000000001e-002 | AC40: 4.5000000000000005e-003 | AD40: 2.2000000000000001e-003 | AE40: 84.86 | AF40: 90.39 | AG40: 0.27 | AH40: AA- | AI40: 6.4600000000000005e-002 | AJ40: =H40+100*O40 -> 157.154 | AK40: 138.6 | AL40: 232 | AM40: 48.2 | AN40: 234 | AO40: 2.8999999999999998e-002 | AP40: 21 | AQ40: 道恩转债!
A41: 297 | B41: 113524 | C41: 奇精转债! | D41: 603677 | E41: 奇精机械 | F41: 家电 | G41: 零部件制 | H41: 102.91 | I41: -1.2999999999999999e-003 | J41: -3.3e-003 | K41: 10.62 | L41: -1.4800000000000001e-002 | M41: 117.3 | N41: 13.98 | O41: 0.35499999999999998 | P41: 75.97 | Q41: 转股中 | R41: 3.55年 | S41: 1.55年 | T41: 3.3 | U41: 3.5 | V41: 1.e-002 | W41: 0.16200000000000001 | X41: 0.12300000000000001 | Y41: 20 | Z41: 2.08 | AA41: 3.8300000000000001e-002 | AB41: 2.9300000000000003e-002 | AC41: -5.9999999999999995e-004 | AD41: -3.8e-003 | AE41: 92.61 | AF41: 94.76 | AG41: 0.31 | AH41: AA- | AI41: 6.3299999999999995e-002 | AJ41: =H41+100*O41 -> 138.41 | AK41: 129.9 | AL41: 141 | AM41: 35.1 | AN41: 126 | AO41: -2.e-002 | AP41: 44 | AQ41: 奇精转债!
A42: 154 | B42: 113589 | C42: 天创转债! | D42: 603608 | E42: 天创时尚 | F42: 服装纺织 | G42: 鞋服行业 | H42: 95.78 | I42: 2.2000000000000001e-003 | J42: -1.6000000000000001e-003 | K42: 6.88 | L42: 5.7999999999999996e-003 | M42: 115.3 | N42: 12.44 | O42: 0.73199999999999998 | P42: 55.31 | Q42: 转股中 | R42: 5年26天 | S42: 3年27天 | T42: 6 | U42: 17 | V42: 2.8999999999999998e-002 | W42: 0.20300000000000001 | X42: 0.11199999999999999 | Y42: 30 | Z42: 1.81 | AA42: 3.8100000000000002e-002 | AB42: 3.2300000000000002e-002 | AC42: 2.5399999999999999e-002 | AD42: 2.3e-002 | AE42: 90.54 | AF42: 93.3 | AG42: 0.1 | AH42: AA | AI42: 4.36e-002 | AJ42: =H42+100*O42 -> 168.98000000000002 | AK42: 136.3 | AL42: 210 | AM42: 43 | AN42: 203 | AO42: 7.0000000000000007e-002 | AP42: 26 | AQ42: 天创转债!
A43: 316 | B43: 123010 | C43: 博世转债! | D43: 300422 | E43: 博世科 | F43: 城市公用 | G43: 三废处理 | H43: 100.375 | I43: -5.9999999999999995e-004 | J43: -1.1999999999999999e-003 | K43: 8.48 | L43: -1.0500000000000001e-002 | M43: 112.3 | N43: 12.2 | O43: 0.44400000000000001 | P43: 69.51 | Q43: 转股中 | R43: 3年37天 | S43: 1年38天 | T43: 4.3 | U43: 3.6 | V43: 8.0000000000000002e-003 | W43: 0.125 | X43: 8.6999999999999994e-002 | Y43: 34 | Z43: 1.42 | AA43: 3.7699999999999997e-002 | AB43: 2.9999999999999999e-002 | AC43: 1.9199999999999998e-002 | AD43: 1.47e-002 | AE43: 95.17 | AF43: 93.24 | AG43: 0.17 | AH43: AA- | AI43: 6.3299999999999995e-002 | AJ43: =H43+100*O43 -> 144.77500000000001 | AK43: 131.2 | AL43: 156 | AM43: 36.1 | AN43: 138 | AO43: 3.0000000000000001e-003 | AP43: 30 | AQ43: 博世转债!
A44: 257 | B44: 128069 | C44: 华森转债! | D44: 2907 | E44: 华森制药 | F44: 医药 | G44: 化学制药 | H44: 103.8 | I44: -6.7000000000000002e-003 | J44: 3.2000000000000002e-003 | K44: 12.93 | L44: -1.3000000000000001e-002 | M44: 120 | N44: 18.04 | O44: 0.44799999999999995 | P44: 71.67 | Q44: 转股中 | R44: 4年26天 | S44: 2年27天 | T44: 3 | U44: 20 | V44: 6.4000000000000001e-002 | W44: 5.7999999999999996e-002 | X44: 4.0999999999999995e-002 | Y44: 52 | Z44: 4.57 | AA44: 3.7100000000000001e-002 | AB44: 2.8199999999999999e-002 | AC44: -1.2999999999999999e-003 | AD44: -4.4000000000000003e-003 | AE44: 90.37 | AF44: 94 | AG44: 0.27 | AH44: AA- | AI44: 6.3299999999999995e-002 | AJ44: =H44+100*O44 -> 148.59999999999999 | AK44: 135.9 | AL44: 208 | AM44: 41.9 | AN44: 190 | AO44: 3.7999999999999999e-002 | AP44: 45 | AQ44: 华森转债!
A45: 310 | B45: 128042 | C45: 凯中转债! | D45: 2823 | E45: 凯中精密 | F45: 能源电力 | G45: 电力设备 | H45: 103.895 | I45: -7.7000000000000002e-003 | J45: 6.9999999999999993e-003 | K45: 10.05 | L45: -3.0000000000000001e-003 | M45: 116.3 | N45: 12.96 | O45: 0.34000000000000002 | P45: 77.55 | Q45: 转股中 | R45: 3.17年 | S45: 1.17年 | T45: 4.16 | U45: 2.3 | V45: 5.0000000000000001e-003 | W45: 0.14400000000000002 | X45: 0.11199999999999999 | Y45: 29 | Z45: 2.12 | AA45: 3.7000000000000005e-002 | AB45: 2.7400000000000001e-002 | AC45: -8.0000000000000002e-003 | AD45: -1.2e-002 | AE45: 97.31 | AF45: 102.27 | AG45: 0.21 | AH45: AA | AI45: 4.2300000000000004e-002 | AJ45: =H45+100*O45 -> 137.89499999999998 | AK45: 130.2 | AL45: 147 | AM45: 28 | AN45: 45 | AO45: 1.e-003 | AP45: 27 | AQ45: 凯中转债!
A46: 266 | B46: 127013 | C46: 创维转债! | D46: 810 | E46: 创维数字 | F46: 电子 | G46: 电子产品 | H46: 102.301 | I46: -1.0800000000000001e-002 | J46: 6.4000000000000003e-003 | K46: 8.36 | L46: -2.3399999999999997e-002 | M46: 117.3 | N46: 11.39 | O46: 0.39399999999999996 | P46: 73.4 | Q46: 转股中 | R46: 3.88年 | S46: 1.88年 | T46: 9.78 | U46: 3.3 | V46: 3.0000000000000001e-003 | W46: 0.11 | X46: 8.1000000000000003e-002 | Y46: 89 | Z46: 2.11 | AA46: 3.6499999999999998e-002 | AB46: 2.8300000000000002e-002 | AC46: 2.3999999999999998e-003 | AD46: -2.9999999999999997e-004 | AE46: 94.49 | AF46: 100.16 | AG46: 0.19 | AH46: AA | AI46: 4.2300000000000004e-002 | AJ46: =H46+100*O46 -> 141.70099999999999 | AK46: 131.2 | AL46: 155 | AM46: 31 | AN46: 78 | AO46: 4.0000000000000001e-003 | AP46: 23 | AQ46: 创维转债!
A47: 264 | B47: 128066 | C47: 亚泰转债! | D47: 2811 | E47: 郑中设计 | F47: 建筑 | G47: 装饰工程 | H47: 102 | I47: -9.3999999999999986e-003 | J47: 1.2199999999999999e-002 | K47: 8.52 | L47: 5.8999999999999999e-003 | M47: 116.7 | N47: 9.67 | O47: 0.158 | P47: 88.11 | Q47: 转股中 | R47: 3.89年 | S47: 1.89年 | T47: 4.8 | U47: 7 | V47: 1.3999999999999999e-002 | W47: 0.20899999999999999 | X47: 0.184 | Y47: 23 | Z47: 1.55 | AA47: 3.6000000000000004e-002 | AB47: 2.7999999999999997e-002 | AC47: 5.0000000000000001e-003 | AD47: 2.e-003 | AE47: 90.92 | AF47: 92.37 | AG47: 0.46 | AH47: AA- | AI47: 6.3299999999999995e-002 | AJ47: =H47+100*O47 -> 117.8 | AK47: 115.9 | AL47: 16 | AM47: 23.5 | AN47: 23 | AO47: 3.7999999999999999e-002 | AP47: 61 | AQ47: 亚泰转债!
A48: 76 | B48: 123076 | C48: 强力转债! | D48: 300429 | E48: 强力新材 | F48: 化工 | G48: 化工 | H48: 98.09 | I48: -1.03e-002 | J48: 5.1000000000000004e-003 | K48: 11.63 | L48: -2.0199999999999999e-002 | M48: 118.5 | N48: 18.98 | O48: 0.60099999999999998 | P48: 61.28 | Q48: 转股中 | R48: 5.48年 | S48: 3.48年 | T48: 8.5 | U48: 21 | V48: 2.5000000000000001e-002 | W48: 0.14199999999999999 | X48: 8.6999999999999994e-002 | Y48: 60 | Z48: 3.39 | AA48: 3.5799999999999998e-002 | AB48: 2.9600000000000001e-002 | AC48: 1.5900000000000001e-002 | AD48: 1.38e-002 | AE48: 82.85 | AF48: 84.7 | AG48: 0.26 | AH48: AA- | AI48: 6.4600000000000005e-002 | AJ48: =H48+100*O48 -> 158.19 | AK48: 134.9 | AL48: 197 | AM48: 50.2 | AN48: 242 | AO48: 7.5999999999999998e-002 | AP48: 14 | AQ48: 强力转债!
A49: 301 | B49: 128049 | C49: 华源转债! | D49: 2787 | E49: 华源控股 | F49: 造纸包装 | G49: 包装材料 | H49: 101.744 | I49: 1.6000000000000001e-003 | J49: -5.1000000000000004e-003 | K49: 5.71 | L49: -1.04e-002 | M49: 114.5 | N49: 7.42 | O49: 0.32200000000000001 | P49: 76.95 | Q49: 转股中 | R49: 3.50年 | S49: 1.50年 | T49: 3.63 | U49: 3.8 | V49: 1.e-002 | W49: 0.20100000000000001 | X49: 0.155 | Y49: 18 | Z49: 1.21 | AA49: 3.5000000000000003e-002 | AB49: 2.7200000000000002e-002 | AC49: 6.5000000000000006e-003 | AD49: 3.0999999999999999e-003 | AE49: 92.91 | AF49: 92.78 | AG49: 0.33 | AH49: AA- | AI49: 6.3299999999999995e-002 | AJ49: =H49+100*O49 -> 133.94400000000002 | AK49: 126.5 | AL49: 99 | AM49: 33.6 | AN49: 106 | AO49: -1.6e-002 | AP49: 45 | AQ49: 华源转债!
A50: 317 | B50: 127007 | C50: 湖广转债! | D50: 665 | E50: 湖北广电 | F50: 传媒娱乐 | G50: 影视娱乐 | H50: 101.386 | I50: -9.0000000000000011e-003 | J50: 7.0999999999999995e-003 | K50: 4.05 | L50: -1.2199999999999999e-002 | M50: 112.3 | N50: 5.58 | O50: 0.39700000000000002 | P50: 72.58 | Q50: 转股中 | R50: 3年30天 | S50: 1年31天 | T50: 12.2 | U50: 17 | V50: 1.3999999999999999e-002 | W50: 0.30599999999999999 | X50: 0.222 | Y50: 40 | Z50: 0.68 | AA50: 3.4500000000000003e-002 | AB50: 2.6800000000000001e-002 | AC50: 1.1299999999999999e-002 | AD50: 6.8000000000000005e-003 | AE50: 97.89 | AF50: 99.7 | AG50: 0.16 | AH50: AA+ | AI50: 4.0300000000000002e-002 | AJ50: =H50+100*O50 -> 141.08600000000001 | AK50: 130.2 | AL50: 144 | AM50: 30.5 | AN50: 69 | AO50: 2.2000000000000002e-002 | AP50: 17 | AQ50: 湖广转债!
A51: 173 | B51: 113578 | C51: 全筑转债! | D51: 603030 | E51: 全筑股份 | F51: 建筑 | G51: 装饰工程 | H51: 100.3 | I51: -8.6999999999999994e-003 | J51: 3.4999999999999996e-003 | K51: 4.33 | L51: -1.5900000000000001e-002 | M51: 117.9 | N51: 5.43 | O51: 0.25800000000000001 | P51: 79.74 | Q51: 转股中 | R51: 4.89年 | S51: 2.90年 | T51: 3.84 | U51: 4.6 | V51: 1.2e-002 | W51: 0.16500000000000001 | X51: 0.13100000000000001 | Y51: 23 | Z51: 1.02 | AA51: 3.4200000000000001e-002 | AB51: 2.75e-002 | AC51: 1.01e-002 | AD51: 7.9000000000000008e-003 | AE51: 91.18 | AF51: 96.62 | AG51: 0.33 | AH51: AA | AI51: 4.2300000000000004e-002 | AJ51: =H51+100*O51 -> 126.09999999999999 | AK51: 120.9 | AL51: 49 | AM51: 24.2 | AN51: 24 | AO51: -1.9e-002 | AP51: 19 | AQ51: 全筑转债!
A52: 142 | B52: 123059 | C52: 银信转债! | D52: 300231 | E52: 银信科技 | F52: 计算机及 | G52: 软件开发 | H52: 105.01 | I52: -9.300000000000001e-003 | J52: 1.2199999999999999e-002 | K52: 7.89 | L52: 6.4000000000000003e-003 | M52: 124.1 | N52: 9.72 | O52: 0.29399999999999998 | P52: 81.17 | Q52: 转股中 | R52: 5年47天 | S52: 3年48天 | T52: 3.91 | U52: 30 | V52: 7.2999999999999995e-002 | W52: 0.11199999999999999 | X52: 9.0999999999999998e-002 | Y52: 35 | Z52: 2.56 | AA52: 3.3799999999999997e-002 | AB52: 2.5600000000000001e-002 | AC52: -2.8999999999999998e-003 | AD52: -5.3e-003 | AE52: 84.83 | AF52: 90.67 | AG52: 0.45 | AH52: AA- | AI52: 6.4600000000000005e-002 | AJ52: =H52+100*O52 -> 134.41 | AK52: 128.8 | AL52: 130 | AM52: 38.2 | AN52: 157 | AO52: 7.0000000000000007e-002 | AP52: 15 | AQ52: 银信转债!
A53: 66 | B53: 123081 | C53: 精研转债! | D53: 300709 | E53: 精研科技 | F53: 电子 | G53: 电子产品 | H53: 101.4 | I53: 8.0000000000000004e-004 | J53: -4.6999999999999993e-003 | K53: 38 | L53: -1.7100000000000001e-002 | M53: 121.3 | N53: 64.28 | O53: 0.71499999999999997 | P53: 59.12 | Q53: 12天 | R53: 5.52年 | S53: 3.52年 | T53: 5.7 | U53: 6.4 | V53: 1.1000000000000001e-002 | W53: 0.13 | X53: 7.6999999999999999e-002 | Y53: 44 | Z53: 2.76 | AA53: 3.3700000000000001e-002 | AB53: 2.6800000000000001e-002 | AC53: 7.6e-003 | AD53: 5.3e-003 | AE53: 82.96 | AF53: 86.53 | AG53: 0.23 | AH53: AA- | AI53: 6.4600000000000005e-002 | AJ53: =H53+100*O53 -> 172.90000000000001 | AK53: 143.7 | AL53: 261 | AM53: 57.2 | AN53: 286 | AO53: 3.1e-002 | AP53: 7 | AQ53: 精研转债!
A54: 339 | B54: 123004 | C54: 铁汉转债! | D54: 300197 | E54: 节能铁汉 | F54: 城市公用 | G54: 生态环境 | H54: 100.218 | I54: -3.8e-003 | J54: 1.1999999999999999e-003 | K54: 3 | L54: -1.32e-002 | M54: 108.8 | N54: 3.82 | O54: 0.27600000000000002 | P54: 78.53 | Q54: 转股中 | R54: 2.56年 | S54: 0.56年 | T54: 8.03 | U54: 5.6 | V54: 6.9999999999999993e-003 | W54: 9.5000000000000001e-002 | X54: 7.400000000000001e-002 | Y54: 85 | Z54: 1.29 | AA54: 3.3099999999999997e-002 | AB54: 2.64e-002 | AC54: 1.84e-002 | AD54: 1.41e-002 | AE54: 98.67 | AF54: 98.42 | AG54: 0.19 | AH54: AA | AI54: 4.0599999999999997e-002 | AJ54: =H54+100*O54 -> 127.81800000000001 | AK54: 121.9 | AL54: 60 | AM54: 23.2 | AN54: 21 | AO54: -6.9999999999999993e-003 | AP54: 45 | AQ54: 铁汉转债!
A55: 240 | B55: 113546 | C55: 迪贝转债! | D55: 603320 | E55: 迪贝电气 | F55: 家电 | G55: 零部件制 | H55: 104.84 | I55: 1.8e-003 | J55: -1.4000000000000002e-003 | K55: 11.17 | L55: 8.9999999999999998e-004 | M55: 120.6 | N55: 14 | O55: 0.314 | P55: 79.79 | Q55: 转股中 | R55: 4.40年 | S55: 2.41年 | T55: 2.3 | U55: 1.1 | V55: 5.0000000000000001e-003 | W55: 0.158 | X55: 0.126 | Y55: 15 | Z55: 2.09 | AA55: 3.3099999999999997e-002 | AB55: 2.4700000000000003e-002 | AC55: -3.4000000000000002e-003 | AD55: -6.4000000000000003e-003 | AE55: 86.65 | AF55: 88.64 | AG55: 0.45 | AH55: A+ | AI55: 7.4299999999999991e-002 | AJ55: =H55+100*O55 -> 136.24000000000001 | AK55: 129.9 | AL55: 142 | AM55: 41.3 | AN55: 185 | AO55: 8.0000000000000002e-003 | AP55: 39 | AQ55: 迪贝转债!
A56: 155 | B56: 123056 | C56: 雪榕转债! | D56: 300511 | E56: 雪榕生物 | F56: 农业 | G56: 种植业 | H56: 103.15 | I56: -1.2999999999999999e-003 | J56: -1.4000000000000002e-003 | K56: 8.87 | L56: -6.7000000000000002e-003 | M56: 121.1 | N56: 11.77 | O56: 0.36899999999999999 | P56: 75.36 | Q56: 转股中 | R56: 5年26天 | S56: 3年27天 | T56: 5.84 | U56: 2.8 | V56: 5.0000000000000001e-003 | W56: 0.14899999999999999 | X56: 0.11199999999999999 | Y56: 39 | Z56: 1.89 | AA56: 3.2899999999999999e-002 | AB56: 2.5399999999999999e-002 | AC56: 2.5999999999999999e-003 | AD56: 2.0000000000000001e-004 | AE56: 85.14 | AF56: 88.81 | AG56: 0.39 | AH56: AA- | AI56: 6.4600000000000005e-002 | AJ56: =H56+100*O56 -> 140.05000000000001 | AK56: 130.9 | AL56: 153 | AM56: 42.1 | AN56: 192 | AO56: 2.e-003 | AP56: 16 | AQ56: 雪榕转债!
A57: 17 | B57: 123106 | C57: 正丹转债! | D57: 300641 | E57: 正丹股份 | F57: 化工 | G57: 化工 | H57: 104.38 | I57: -7.0999999999999995e-003 | J57: -4.0000000000000001e-003 | K57: 6.69 | L57: -2.0499999999999997e-002 | M57: 125.5 | N57: 7.52 | O57: 0.17300000000000001 | P57: 88.96 | Q57: 4月5天 | R57: 5.82年 | S57: 3.82年 | T57: 3.2 | U57: 22 | V57: 6.5000000000000002e-002 | W57: 9.8000000000000004e-002 | X57: 8.6999999999999994e-002 | Y57: 33 | Z57: 2.35 | AA57: 3.27e-002 | AB57: 2.52e-002 | AC57: -1.2999999999999999e-003 | AD57: -3.2000000000000002e-003 | AE57: 81.09 | AF57: 87.76 | AG57: 0.54 | AH57: AA- | AI57: 6.4600000000000005e-002 | AJ57: =H57+100*O57 -> 121.67999999999999 | AK57: 119.8 | AL57: 37 | AM57: 32 | AN57: 89 | AO57: 3.2000000000000001e-002 | AP57: 8 | AQ57: 正丹转债!
A58: 250 | B58: 128072 | C58: 翔鹭转债! | D58: 2842 | E58: 翔鹭钨业 | F58: 有色金属 | G58: 小金属 | H58: 101.2 | I58: -8.9999999999999998e-004 | J58: 1.1000000000000001e-003 | K58: 9.27 | L58: 1.1000000000000001e-003 | M58: 115.1 | N58: 15.34 | O58: 0.67500000000000004 | P58: 60.43 | Q58: 转股中 | R58: 4.23年 | S58: 2.23年 | T58: 3.02 | U58: 19 | V58: 6.2e-002 | W58: 0.11900000000000001 | X58: 7.2000000000000008e-002 | Y58: 25 | Z58: 2.72 | AA58: 3.1600000000000003e-002 | AB58: 2.4900000000000002e-002 | AC58: 9.300000000000001e-003 | AD58: 6.4000000000000003e-003 | AE58: 89.43 | AF58: 89.31 | AG58: 0.2 | AH58: AA- | AI58: 6.3299999999999995e-002 | AJ58: =H58+100*O58 -> 168.69999999999999 | AK58: 142 | AL58: 254 | AM58: 52.5 | AN58: 254 | AO58: -7.2000000000000008e-002 | AP58: 29 | AQ58: 翔鹭转债!
A59: 160 | B59: 123054 | C59: 思特转债! | D59: 300608 | E59: 思特奇 | F59: 通信互联 | G59: 通信设备 | H59: 104.45 | I59: -2.3e-003 | J59: 5.7999999999999996e-003 | K59: 9.94 | L59: 8.1000000000000013e-003 | M59: 121.7 | N59: 12.63 | O59: 0.32700000000000001 | P59: 78.7 | Q59: 转股中 | R59: 5年12天 | S59: 3年13天 | T59: 2.71 | U59: 7.4 | V59: 2.6000000000000002e-002 | W59: 0.13300000000000001 | X59: 0.105 | Y59: 20 | Z59: 2.04 | AA59: 3.1600000000000003e-002 | AB59: 2.3900000000000001e-002 | AC59: 5.0000000000000001e-004 | AD59: -2.3e-003 | AE59: 85.87 | AF59: 89.55 | AG59: 0.43 | AH59: AA- | AI59: 6.4600000000000005e-002 | AJ59: =H59+100*O59 -> 137.15000000000001 | AK59: 130.2 | AL59: 145 | AM59: 40.6 | AN59: 179 | AO59: -0.17699999999999999 | AP59: 21 | AQ59: 思特转债!
A60: 185 | B60: 127016 | C60: 鲁泰转债! | D60: 726 | E60: 鲁 泰Ａ | F60: 服装纺织 | G60: 纺织行业 | H60: 100.001 | I60: -1.5e-003 | J60: 4.0000000000000001e-003 | K60: 6.36 | L60: 1.11e-002 | M60: 115.9 | N60: 8.91 | O60: 0.40100000000000002 | P60: 71.38 | Q60: 转股中 | R60: 4.86年 | S60: 2.87年 | T60: 14 | U60: 2.3 | V60: 2.e-003 | W60: 0.25700000000000001 | X60: 0.183 | Y60: 55 | Z60: 0.71 | AA60: 3.1400000000000004e-002 | AB60: 2.53e-002 | AC60: 1.1200000000000002e-002 | AD60: 9.0000000000000011e-003 | AE60: 91.82 | AF60: 95.98 | AG60: 0.22 | AH60: AA+ | AI60: 4.0300000000000002e-002 | AJ60: =H60+100*O60 -> 140.101 | AK60: 128.6 | AL60: 124 | AM60: 32.6 | AN60: 99 | AO60: 2.6000000000000002e-002 | AP60: 22 | AQ60: 鲁泰转债!
A61: 27 | B61: 113620 | C61: 傲农转债! | D61: 603363 | E61: 傲农生物 | F61: 农业 | G61: 畜牧业 | H61: 101.72 | I61: -1.4000000000000002e-003 | J61: -7.000000000000001e-004 | K61: 10.59 | L61: -7.4999999999999997e-003 | M61: 121.1 | N61: 14.66 | O61: 0.40799999999999997 | P61: 72.24 | Q61: 3月21天 | R61: 5.78年 | S61: 3.78年 | T61: 10 | U61: 3.9 | V61: 4.0000000000000001e-003 | W61: 0.13800000000000001 | X61: 0.10000000000000001 | Y61: 73 | Z61: 2.46 | AA61: 3.1099999999999999e-002 | AB61: 2.4700000000000003e-002 | AC61: 4.6999999999999993e-003 | AD61: 2.8999999999999998e-003 | AE61: 87.65 | AF61: 95.01 | AG61: 0.28 | AH61: AA | AI61: 4.36e-002 | AJ61: =H61+100*O61 -> 142.51999999999998 | AK61: 131.2 | AL61: 154 | AM61: 36.2 | AN61: 139 | AO61: -8.9999999999999997e-002 | AP61: 5 | AQ61: 傲农转债!
A62: 238 | B62: 110059 | C62: 浦发转债! | D62: 600000 | E62: 浦发银行 | F62: 金融 | G62: 银行行业 | H62: 103.21 | I62: 4.0000000000000002e-004 | J62: 8.0000000000000004e-004 | K62: 10.35 | L62: 5.7999999999999996e-003 | M62: 117.6 | N62: 14.45 | O62: 0.441 | P62: 71.63 | Q62: 转股中 | R62: 4.42年 | S62: 无权 | T62: 500 | U62: 94 | V62: 2.e-003 | W62: 0.16500000000000001 | X62: 0.11800000000000001 | Y62: 3038. | Z62: 0.56 | AA62: 3.0899999999999997e-002 | AB62: 2.35e-002 | AC62: 无权 | AD62: 无权 | AE62: 无权 | AF62: 100.52 | AG62: 0.2 | AH62: AAA | AI62: 3.73e-002 | AJ62: =H62+100*O62 -> 147.31 | AK62: 134.8 | AL62: 196 | AM62: 34.3 | AN62: 112 | AO62: 1.7000000000000001e-002 | AP62: 65 | AQ62: 浦发转债!
A63: 265 | B63: 110058 | C63: 永鼎转债! | D63: 600105 | E63: 永鼎股份 | F63: 通信互联 | G63: 通信设备 | H63: 101.8 | I63: -4.0000000000000001e-003 | J63: -7.000000000000001e-004 | K63: 3.44 | L63: -2.8199999999999999e-002 | M63: 114.3 | N63: 5.04 | O63: 0.49099999999999999 | P63: 68.25 | Q63: 转股中 | R63: 3.88年 | S63: 1.89年 | T63: 2.61 | U63: 8 | V63: 2.9999999999999999e-002 | W63: 5.5e-002 | X63: 3.7999999999999999e-002 | Y63: 48 | Z63: 1.71 | AA63: 3.0800000000000001e-002 | AB63: 2.3900000000000001e-002 | AC63: 4.7999999999999996e-003 | AD63: 2.0999999999999999e-003 | AE63: 94.48 | AF63: 97.6 | AG63: 0.17 | AH63: AA | AI63: 4.2300000000000004e-002 | AJ63: =H63+100*O63 -> 150.90000000000001 | AK63: 135.3 | AL63: 202 | AM63: 37.8 | AN63: 154 | AO63: -1.3000000000000001e-002 | AP63: 48 | AQ63: 永鼎转债!
A64: 289 | B64: 113528 | C64: 长城转债! | D64: 603897 | E64: 长城科技 | F64: 机械装备 | G64: 专用设备 | H64: 104.54 | I64: 6.6e-003 | J64: -5.8999999999999999e-003 | K64: 18.78 | L64: 2.0999999999999999e-003 | M64: 116.8 | N64: 23.35 | O64: 0.29999999999999999 | P64: 80.43 | Q64: 转股中 | R64: 3.76年 | S64: 1.76年 | T64: 6.34 | U64: 15 | V64: 2.2000000000000002e-002 | W64: 0.18899999999999997 | X64: 0.152 | Y64: 34 | Z64: 1.71 | AA64: 3.0600000000000002e-002 | AB64: 2.2400000000000003e-002 | AC64: -7.0999999999999995e-003 | AD64: -1.0200000000000001e-002 | AE64: 91.73 | AF64: 93.19 | AG64: 0.37 | AH64: AA- | AI64: 6.3299999999999995e-002 | AJ64: =H64+100*O64 -> 134.54000000000002 | AK64: 128.7 | AL64: 126 | AM64: 35.5 | AN64: 133 | AO64: 2.7999999999999997e-002 | AP64: 40 | AQ64: 长城转债!
A65: 200 | B65: 113568 | C65: 新春转债! | D65: 603667 | E65: 五洲新春 | F65: 机械装备 | G65: 通用设备 | H65: 107.99 | I65: -1.2699999999999999e-002 | J65: 4.5000000000000005e-003 | K65: 8.67 | L65: -1.4800000000000001e-002 | M65: 124.3 | N65: 8.91 | O65: 0.11 | P65: 97.31 | Q65: 转股中 | R65: 4.77年 | S65: 2.77年 | T65: 3.3 | U65: 9 | V65: 2.5000000000000001e-002 | W65: 0.13 | X65: 0.127 | Y65: 25 | Z65: 1.43 | AA65: 3.0600000000000002e-002 | AB65: 2.1700000000000001e-002 | AC65: -1.21e-002 | AD65: -1.49e-002 | AE65: 87.19 | AF65: 93.38 | AG65: 0.56 | AH65: AA- | AI65: 6.3299999999999995e-002 | AJ65: =H65+100*O65 -> 118.98999999999999 | AK65: 118.7 | AL65: 30 | AM65: 25.3 | AN65: 31 | AO65: 4.0000000000000001e-003 | AP65: 49 | AQ65: 新春转债!
A66: 177 | B66: 123049 | C66: 维尔转债 | D66: 300190 | E66: 维尔利 | F66: 城市公用 | G66: 三废处理 | H66: 107.721 | I66: 3.3e-003 | J66: -1.15e-002 | K66: 6.68 | L66: -1.6200000000000003e-002 | M66: 124.3 | N66: 7.38 | O66: 0.19 | P66: 90.51 | Q66: 转股中 | R66: 4.87年 | S66: 2.88年 | T66: 9.17 | U66: 9.4 | V66: 9.0000000000000011e-003 | W66: 0.17600000000000002 | X66: 0.159 | Y66: 52 | Z66: 1.2 | AA66: 3.0499999999999999e-002 | AB66: 2.18e-002 | AC66: -1.09e-002 | AD66: -1.3500000000000002e-002 | AE66: 86.63 | AF66: 92.78 | AG66: 0.51 | AH66: AA- | AI66: 6.3299999999999995e-002 | AJ66: =H66+100*O66 -> 126.721 | AK66: 124.9 | AL66: 84 | AM66: 32.1 | AN66: 94 | AO66: -1.2e-002 | AP66: 16 | AQ66: 维尔转债
A67: 53 | B67: 123087 | C67: 明电转债! | D67: 300739 | E67: 明阳电路 | F67: 电子 | G67: 元器件制 | H67: 102.95 | I67: -6.3e-003 | J67: -3.9000000000000003e-003 | K67: 14.43 | L67: -1.84e-002 | M67: 121.2 | N67: 16.32 | O67: 0.16399999999999998 | P67: 88.42 | Q67: 24天 | R67: 5.55年 | S67: 4.55年 | T67: 6.73 | U67: 9.6 | V67: 1.3999999999999999e-002 | W67: 0.16699999999999998 | X67: 0.14800000000000002 | Y67: 40 | Z67: 2.85 | AA67: 3.0499999999999999e-002 | AB67: 2.3700000000000002e-002 | AC67: 7.8000000000000005e-003 | AD67: 5.0000000000000001e-003 | AE67: 79.84 | AF67: 86.29 | AG67: 0.56 | AH67: AA- | AI67: 6.4600000000000005e-002 | AJ67: =H67+100*O67 -> 119.34999999999999 | AK67: 117.5 | AL67: 24 | AM67: 31.2 | AN67: 81 | AO67: 3.3000000000000002e-002 | AP67: 12 | AQ67: 明电转债!
A68: 355 | B68: 128014 | C68: 永东转债! | D68: 2753 | E68: 永东股份 | F68: 化工 | G68: 化工 | H68: 103.81 | I68: 1.e-004 | J68: 1.e-004 | K68: 8.61 | L68: 6.9999999999999993e-003 | M68: 109.8 | N68: 12.6 | O68: 0.51900000000000002 | P68: 68.33 | Q68: 转股中 | R68: 1.89年 | S68: 回售内 | T68: 3.37 | U68: 1.6 | V68: 4.0000000000000001e-003 | W68: 0.10400000000000001 | X68: 7.0999999999999994e-002 | Y68: 32 | Z68: 1.63 | AA68: 3.04e-002 | AB68: 2.0499999999999997e-002 | AC68: 回售内 | AD68: 回售内 | AE68: 100.3 | AF68: 98.18 | AG68: 0.03 | AH68: AA- | AI68: 6.1600000000000002e-002 | AJ68: =H68+100*O68 -> 155.71000000000001 | AK68: 139.3 | AL68: 239 | AM68: 39 | AN68: 164 | AO68: 6.9999999999999993e-003 | AP68: 38 | AQ68: 永东转债!
A69: 358 | B69: 128013 | C69: 洪涛转债! | D69: 2325 | E69: 洪涛股份 | F69: 建筑 | G69: 装饰工程 | H69: 106.1 | I69: -3.8e-003 | J69: -1.8e-003 | K69: 2.32 | L69: -1.2800000000000001e-002 | M69: 109.8 | N69: 2.32 | O69: 6.0999999999999999e-002 | P69: 100 | Q69: 转股中 | R69: 1.17年 | S69: 回售内 | T69: 11.6 | U69: 12 | V69: 1.e-002 | W69: 0.39700000000000002 | X69: 0.39700000000000002 | Y69: 29 | Z69: 1.08 | AA69: 3.0200000000000001e-002 | AB69: 1.4199999999999999e-002 | AC69: 回售内 | AD69: 回售内 | AE69: 100.3 | AF69: 102.49 | AG69: 0.43 | AH69: AA- | AI69: 6.1600000000000002e-002 | AJ69: =H69+100*O69 -> 112.19999999999999 | AK69: 112.2 | AL69: 7 | AM69: 9.7 | AN69: 1 | AO69: -1.e-003 | AP69: 92 | AQ69: 洪涛转债!
A70: 204 | B70: 113566 | C70: 翔港转债! | D70: 603499 | E70: 翔港科技 | F70: 造纸包装 | G70: 包装材料 | H70: 107.99 | I70: 1.1000000000000001e-003 | J70: -3.0999999999999999e-003 | K70: 8 | L70: -5.0000000000000001e-003 | M70: 124 | N70: 10.77 | O70: 0.45399999999999996 | P70: 74.28 | Q70: 转股中 | R70: 4.75年 | S70: 2.76年 | T70: 1.61 | U70: 15 | V70: 8.5999999999999993e-002 | W70: 0.10000000000000001 | X70: 7.400000000000001e-002 | Y70: 16 | Z70: 2.84 | AA70: 3.0200000000000001e-002 | AB70: 2.1400000000000002e-002 | AC70: -1.24e-002 | AD70: -1.5100000000000001e-002 | AE70: 84.69 | AF70: 88.89 | AG70: 0.4 | AH70: A+ | AI70: 7.4299999999999991e-002 | AJ70: =H70+100*O70 -> 153.38999999999999 | AK70: 141.7 | AL70: 252 | AM70: 52.8 | AN70: 257 | AO70: 0. | AP70: 29 | AQ70: 翔港转债!
A71: 35 | B71: 123096 | C71: 思创转债! | D71: 300078 | E71: 思创医惠 | F71: 通信互联 | G71: 物联网 | H71: 105.141 | I71: 1.2999999999999999e-003 | J71: -2.0999999999999999e-003 | K71: 6.9 | L71: -1.4000000000000002e-003 | M71: 124 | N71: 8.27 | O71: 0.26000000000000001 | P71: 83.43 | Q71: 2月6天 | R71: 5.66年 | S71: 3.67年 | T71: 8.17 | U71: 4.3 | V71: 5.0000000000000001e-003 | W71: 0.13600000000000001 | X71: 0.114 | Y71: 60 | Z71: 2.01 | AA71: 3.0099999999999998e-002 | AB71: 2.2799999999999997e-002 | AC71: -3.0999999999999999e-003 | AD71: -5.0000000000000001e-003 | AE71: 81.95 | AF71: 87.6 | AG71: 0.5 | AH71: AA- | AI71: 6.4600000000000005e-002 | AJ71: =H71+100*O71 -> 131.14100000000002 | AK71: 126.8 | AL71: 105 | AM71: 39.3 | AN71: 168 | AO71: -8.0000000000000002e-003 | AP71: 4 | AQ71: 思创转债!
A72: 147 | B72: 113036 | C72: 宁建转债! | D72: 601789 | E72: 宁波建工 | F72: 建筑 | G72: 建筑工程 | H72: 101.31 | I72: -1.9e-003 | J72: -7.000000000000001e-004 | K72: 3.8 | L72: -7.8000000000000005e-003 | M72: 117.3 | N72: 4.86 | O72: 0.29600000000000004 | P72: 78.19 | Q72: 转股中 | R72: 5年38天 | S72: 3年39天 | T72: 5.4 | U72: 0.6 | V72: 1.e-003 | W72: 0.14599999999999999 | X72: 0.114 | Y72: 37 | Z72: 1.18 | AA72: 2.98e-002 | AB72: 2.35e-002 | AC72: 7.4999999999999997e-003 | AD72: 5.1999999999999998e-003 | AE72: 90.41 | AF72: 94.78 | AG72: 0.33 | AH72: AA | AI72: 4.36e-002 | AJ72: =H72+100*O72 -> 130.91 | AK72: 124.4 | AL72: 77 | AM72: 29.7 | AN72: 66 | AO72: 2.e-003 | AP72: 9 | AQ72: 宁建转债!
A73: 288 | B73: 113021 | C73: 中信转债! | D73: 601998 | E73: 中信银行 | F73: 金融 | G73: 银行行业 | H73: 106.07 | I73: -1.6000000000000001e-003 | J73: 1.1999999999999999e-003 | K73: 5.28 | L73: -1.9e-003 | M73: 118 | N73: 6.98 | O73: 0.40200000000000002 | P73: 75.64 | Q73: 转股中 | R73: 3.76年 | S73: 无权 | T73: 400 | U73: 44 | V73: 1.e-003 | W73: 0.155 | X73: 0.11699999999999999 | Y73: 2584. | Z73: 0.54 | AA73: 2.9600000000000001e-002 | AB73: 2.0799999999999999e-002 | AC73: 无权 | AD73: 无权 | AE73: 无权 | AF73: 103.2 | AG73: 0.2 | AH73: AAA | AI73: 3.73e-002 | AJ73: =H73+100*O73 -> 146.26999999999998 | AK73: 136.5 | AL73: 212 | AM73: 33.3 | AN73: 104 | AO73: 1.e-003 | AP73: 45 | AQ73: 中信转债!
A74: 186 | B74: 113033 | C74: 利群转债! | D74: 601366 | E74: 利群股份 | F74: 商业零售 | G74: 商场 | H74: 100.05 | I74: 5.9999999999999995e-004 | J74: -5.9999999999999995e-004 | K74: 6.21 | L74: 0. | M74: 114.9 | N74: 7.01 | O74: 0.129 | P74: 88.59 | Q74: 转股中 | R74: 4.84年 | S74: 2.84年 | T74: 18 | U74: 14 | V74: 8.0000000000000002e-003 | W74: 0.33700000000000002 | X74: 0.29799999999999999 | Y74: 53 | Z74: 1.15 | AA74: 2.9600000000000001e-002 | AB74: 2.3799999999999998e-002 | AC74: 1.11e-002 | AD74: 8.8999999999999999e-003 | AE74: 91.37 | AF74: 94.37 | AG74: 0.45 | AH74: AA | AI74: 4.2300000000000004e-002 | AJ74: =H74+100*O74 -> 112.95 | AK74: 111.5 | AL74: 5 | AM74: 17.1 | AN74: 4 | AO74: -1.3000000000000001e-002 | AP74: 53 | AQ74: 利群转债!
A75: 99 | B75: 123068 | C75: 弘信转债 | D75: 300657 | E75: 弘信电子 | F75: 电子 | G75: 元器件制 | H75: 103.938 | I75: 0. | J75: 0. | K75: 15.67 | L75: 0. | M75: 121.2 | N75: 18.45 | O75: 0.22399999999999998 | P75: 84.93 | Q75: 转股中 | R75: 5.38年 | S75: 3.38年 | T75: 5.7 | U75: 0 | V75: 0. | W75: 0.106 | X75: 8.9999999999999997e-002 | Y75: 54 | Z75: 3.81 | AA75: 2.9600000000000001e-002 | AB75: 2.2599999999999999e-002 | AC75: 5.0000000000000001e-004 | AD75: -1.8e-003 | AE75: 83.6 | AF75: 87.2 | AG75: 0.52 | AH75: AA- | AI75: 6.4600000000000005e-002 | AJ75: =H75+100*O75 -> 126.33799999999999 | AK75: 122.9 | AL75: 68 | AM75: 35.7 | AN75: 137 | AO75: -2.1000000000000001e-002 | AP75: 7 | AQ75: 弘信转债
A76: 189 | B76: 110068 | C76: 龙净转债! | D76: 600388 | E76: 龙净环保 | F76: 城市公用 | G76: 三废处理 | H76: 100.09 | I76: -2.2000000000000001e-003 | J76: -1.e-003 | K76: 8.65 | L76: -9.1999999999999998e-003 | M76: 114.8 | N76: 10.73 | O76: 0.24199999999999999 | P76: 80.62 | Q76: 转股中 | R76: 4.82年 | S76: 2.82年 | T76: 20 | U76: 8.2 | V76: 4.0000000000000001e-003 | W76: 0.21600000000000003 | X76: 0.17399999999999999 | Y76: 92 | Z76: 1.52 | AA76: 2.9399999999999999e-002 | AB76: 2.3599999999999999e-002 | AC76: 1.0700000000000001e-002 | AD76: 8.5000000000000006e-003 | AE76: 91.88 | AF76: 95.22 | AG76: 0.35 | AH76: AA+ | AI76: 4.0300000000000002e-002 | AJ76: =H76+100*O76 -> 124.29000000000001 | AK76: 119.6 | AL76: 34 | AM76: 24.3 | AN76: 25 | AO76: 6.0000000000000001e-003 | AP76: 33 | AQ76: 龙净转债!
A77: 164 | B77: 113584 | C77: 家悦转债! | D77: 603708 | E77: 家家悦 | F77: 商业零售 | G77: 超市 | H77: 100.07 | I77: -1.1000000000000001e-003 | J77: 0. | K77: 19.66 | L77: -1.7000000000000001e-002 | M77: 115.3 | N77: 37.97 | O77: 0.93299999999999994 | P77: 51.78 | Q77: 转股中 | R77: 5年7天 | S77: 3年8天 | T77: 6.45 | U77: 6 | V77: 9.0000000000000011e-003 | W77: 5.4000000000000006e-002 | X77: 2.7999999999999997e-002 | Y77: 120 | Z77: 4.25 | AA77: 2.9300000000000003e-002 | AB77: 2.35e-002 | AC77: 1.1699999999999999e-002 | AD77: 9.300000000000001e-003 | AE77: 90.74 | AF77: 93.51 | AG77: 0.06 | AH77: AA | AI77: 4.36e-002 | AJ77: =H77+100*O77 -> 193.37 | AK77: 148.4 | AL77: 283 | AM77: 54.9 | AN77: 270 | AO77: 9.9000000000000005e-002 | AP77: 12 | AQ77: 家悦转债!
A78: 122 | B78: 113599 | C78: 嘉友转债! | D78: 603871 | E78: 嘉友国际 | F78: 交通运输 | G78: 物流业 | H78: 108.95 | I78: -9.5999999999999992e-003 | J78: 3.5999999999999999e-003 | K78: 23.69 | L78: -1.09e-002 | M78: 126 | N78: 24.82 | O78: 0.14099999999999999 | P78: 95.45 | Q78: 转股中 | R78: 5.19年 | S78: 3.19年 | T78: 7.2 | U78: 5.6 | V78: 6.9999999999999993e-003 | W78: 0.13800000000000001 | X78: 0.13200000000000001 | Y78: 52 | Z78: 2.42 | AA78: 2.8999999999999998e-002 | AB78: 2.0400000000000001e-002 | AC78: -1.41e-002 | AD78: -1.6299999999999999e-002 | AE78: 84.44 | AF78: 91.69 | AG78: 0.56 | AH78: AA- | AI78: 6.4600000000000005e-002 | AJ78: =H78+100*O78 -> 123.05 | AK78: 122.5 | AL78: 65 | AM78: 30.8 | AN78: 74 | AO78: 1.6e-002 | AP78: 20 | AQ78: 嘉友转债!
A79: 290 | B79: 128056 | C79: 今飞转债! | D79: 2863 | E79: 今飞凯达 | F79: 汽车 | G79: 零部件制 | H79: 108.258 | I79: 2.3999999999999998e-003 | J79: -4.4000000000000003e-003 | K79: 5.09 | L79: -5.8999999999999999e-003 | M79: 120.2 | N79: 6.7 | O79: 0.42499999999999999 | P79: 75.97 | Q79: 转股中 | R79: 3.76年 | S79: 1.76年 | T79: 1.72 | U79: 5.3 | V79: 2.7999999999999997e-002 | W79: 6.8000000000000005e-002 | X79: 5.0999999999999997e-002 | Y79: 25 | Z79: 1.36 | AA79: 2.8900000000000002e-002 | AB79: 1.9299999999999998e-002 | AC79: -2.4e-002 | AD79: -2.7300000000000001e-002 | AE79: 90.17 | AF79: 92.37 | AG79: 0.35 | AH79: A+ | AI79: 7.4299999999999991e-002 | AJ79: =H79+100*O79 -> 150.75799999999998 | AK79: 140.5 | AL79: 246 | AM79: 48.2 | AN79: 233 | AO79: 5.0000000000000001e-003 | AP79: 54 | AQ79: 今飞转债!
A80: 58 | B80: 123084 | C80: 高澜转债! | D80: 300499 | E80: 高澜股份 | F80: 能源电力 | G80: 电力设备 | H80: 104.5 | I80: -1.5e-003 | J80: -3.0999999999999999e-003 | K80: 7.68 | L80: -1.1599999999999999e-002 | M80: 121.9 | N80: 11.36 | O80: 0.54600000000000004 | P80: 67.61 | Q80: 19天 | R80: 5.53年 | S80: 3.54年 | T80: 2.8 | U80: 8.8 | V80: 2.9999999999999999e-002 | W80: 0.13100000000000001 | X80: 8.900000000000001e-002 | Y80: 21 | Z80: 2.55 | AA80: 2.8900000000000002e-002 | AB80: 2.1899999999999999e-002 | AC80: 8.0000000000000004e-004 | AD80: -1.7000000000000001e-003 | AE80: 80.3 | AF80: 82.26 | AG80: 0.4 | AH80: A+ | AI80: 7.5600000000000001e-002 | AJ80: =H80+100*O80 -> 159.09999999999999 | AK80: 141.4 | AL80: 251 | AM80: 59.1 | AN80: 293 | AO80: -2.6000000000000002e-002 | AP80: 11 | AQ80: 高澜转债!
A81: 151 | B81: 113591 | C81: 胜达转债! | D81: 603687 | E81: 大胜达 | F81: 造纸包装 | G81: 包装用纸 | H81: 106.08 | I81: 5.0000000000000001e-004 | J81: 6.6e-003 | K81: 8.5 | L81: 1.1899999999999999e-002 | M81: 122.2 | N81: 8.83 | O81: 0.10199999999999999 | P81: 96.26 | Q81: 转股中 | R81: 5年33天 | S81: 3年34天 | T81: 5.5 | U81: 13 | V81: 2.2000000000000002e-002 | W81: 0.157 | X81: 0.152 | Y81: 35 | Z81: 2.02 | AA81: 2.8799999999999999e-002 | AB81: 2.1099999999999997e-002 | AC81: -5.7999999999999996e-003 | AD81: -8.199999999999999e-003 | AE81: 85.14 | AF81: 89.53 | AG81: 0.59 | AH81: AA- | AI81: 6.4600000000000005e-002 | AJ81: =H81+100*O81 -> 116.28 | AK81: 115.9 | AL81: 17 | AM81: 26.4 | AN81: 35 | AO81: 6.9999999999999993e-003 | AP81: 26 | AQ81: 胜达转债!
A82: 56 | B82: 123085 | C82: 万顺转2! | D82: 300057 | E82: 万顺新材 | F82: 有色金属 | G82: 铝金属 | H82: 97.235 | I82: -2.3999999999999998e-003 | J82: -2.7000000000000001e-003 | K82: 4.81 | L82: -1.03e-002 | M82: 113.3 | N82: 6.2 | O82: 0.253 | P82: 77.58 | Q82: 20天 | R82: 5.54年 | S82: 3.54年 | T82: 9 | U82: 11 | V82: 1.2e-002 | W82: 0.27699999999999997 | X82: 0.215 | Y82: 32 | Z82: 0.91 | AA82: 2.86e-002 | AB82: 2.4e-002 | AC82: 1.8000000000000002e-002 | AD82: 1.5900000000000001e-002 | AE82: 82.51 | AF82: 80.69 | AG82: 0.49 | AH82: AA- | AI82: 6.4600000000000005e-002 | AJ82: =H82+100*O82 -> 122.535 | AK82: 116.9 | AL82: 21 | AM82: 34.4 | AN82: 115 | AO82: 3.5000000000000003e-002 | AP82: 22 | AQ82: 万顺转2!
A83: 37 | B83: 113042 | C83: 上银转债! | D83: 601229 | E83: 上海银行 | F83: 金融 | G83: 银行行业 | H83: 103.61 | I83: 2.3e-003 | J83: -1.e-004 | K83: 8.49 | L83: 7.0999999999999995e-003 | M83: 120.9 | N83: 11.03 | O83: 0.34600000000000003 | P83: 76.97 | Q83: 2月2天 | R83: 5.66年 | S83: 无权 | T83: 200 | U83: 270 | V83: 1.3000000000000001e-002 | W83: 0.16600000000000001 | X83: 0.128 | Y83: 1206. | Z83: 0.69 | AA83: 2.8399999999999998e-002 | AB83: 2.18e-002 | AC83: 无权 | AD83: 无权 | AE83: 无权 | AF83: 98.15 | AG83: 0.32 | AH83: AAA | AI83: 3.8599999999999995e-002 | AJ83: =H83+100*O83 -> 138.21000000000001 | AK83: 130.2 | AL83: 148 | AM83: 32.1 | AN83: 93 | AO83: 2.e-002 | AP83: 12 | AQ83: 上银转债!
A84: 224 | B84: 128085 | C84: 鸿达转债! | D84: 2002 | E84: 鸿达兴业 | F84: 化工 | G84: 化工 | H84: 109.897 | I84: 3.5999999999999999e-003 | J84: -1.46e-002 | K84: 4.3 | L84: -1.38e-002 | M84: 124.4 | N84: 3.92 | O84: 2.e-003 | P84: 109.69 | Q84: 转股中 | R84: 4.55年 | S84: 2.55年 | T84: 9.12 | U84: 342 | V84: 0.33700000000000002 | W84: 7.2999999999999995e-002 | X84: 8.0000000000000002e-002 | Y84: 125 | Z84: 1.48 | AA84: 2.8199999999999999e-002 | AB84: 1.9e-002 | AC84: -2.06e-002 | AD84: -2.3300000000000001e-002 | AE84: 75.8 | AF84: 73.92 | AG84: 0.8 | AH84: BB | AI84: 0.12429999999999999 | AJ84: =H84+100*O84 -> 110.09700000000001 | AK84: 110.1 | AL84: 2 | AM84: 34.3 | AN84: 113 | AO84: 8.900000000000001e-002 | AP84: 100 | AQ84: 鸿达转债!
A85: 273 | B85: 113532 | C85: 海环转债! | D85: 603817 | E85: 海峡环保 | F85: 城市公用 | G85: 三废处理 | H85: 101.2 | I85: 5.0000000000000001e-004 | J85: -3.7000000000000002e-003 | K85: 5.94 | L85: -1.1599999999999999e-002 | M85: 112.3 | N85: 7.69 | O85: 0.31 | P85: 77.24 | Q85: 转股中 | R85: 3.84年 | S85: 1.85年 | T85: 4.59 | U85: 3.1 | V85: 6.9999999999999993e-003 | W85: 0.17199999999999999 | X85: 0.13300000000000001 | Y85: 27 | Z85: 1.51 | AA85: 2.7999999999999997e-002 | AB85: 2.1899999999999999e-002 | AC85: 7.9000000000000008e-003 | AD85: 5.1000000000000004e-003 | AE85: 94.63 | AF85: 96.05 | AG85: 0.28 | AH85: AA | AI85: 4.2300000000000004e-002 | AJ85: =H85+100*O85 -> 132.19999999999999 | AK85: 125.2 | AL85: 86 | AM85: 29.1 | AN85: 56 | AO85: 2.e-003 | AP85: 26 | AQ85: 海环转债!
A86: 139 | B86: 113593 | C86: 沪工转债 | D86: 603131 | E86: 上海沪工 | F86: 机械装备 | G86: 通用设备 | H86: 105.84 | I86: -2.0999999999999999e-003 | J86: -4.3e-003 | K86: 18.08 | L86: -1.15e-002 | M86: 121.6 | N86: 21.32 | O86: 0.248 | P86: 84.8 | Q86: 转股中 | R86: 5年52天 | S86: 3年53天 | T86: 4 | U86: 4.1 | V86: 1.e-002 | W86: 7.0000000000000007e-002 | X86: 5.9000000000000004e-002 | Y86: 57 | Z86: 4.37 | AA86: 2.7999999999999997e-002 | AB86: 2.06e-002 | AC86: -3.5999999999999999e-003 | AD86: -6.1999999999999998e-003 | AE86: 82.42 | AF86: 84.38 | AG86: 0.56 | AH86: A+ | AI86: 7.5600000000000001e-002 | AJ86: =H86+100*O86 -> 130.64000000000001 | AK86: 126.9 | AL86: 106 | AM86: 42.5 | AN86: 197 | AO86: -1.9e-002 | AP86: 9 | AQ86: 沪工转债
A87: 183 | B87: 128105 | C87: 长集转债! | D87: 2616 | E87: 长青集团 | F87: 城市公用 | G87: 三废处理 | H87: 100.854 | I87: -2.3e-003 | J87: -2.5000000000000001e-003 | K87: 6.18 | L87: -1.44e-002 | M87: 114.9 | N87: 7.91 | O87: 0.29100000000000004 | P87: 78.13 | Q87: 转股中 | R87: 4.86年 | S87: 2.87年 | T87: 8 | U87: 4 | V87: 5.0000000000000001e-003 | W87: 0.17399999999999999 | X87: 0.13600000000000001 | Y87: 46 | Z87: 1.72 | AA87: 2.7699999999999999e-002 | AB87: 2.2000000000000002e-002 | AC87: 8.3000000000000001e-003 | AD87: 6.0999999999999995e-003 | AE87: 91.29 | AF87: 94.29 | AG87: 0.33 | AH87: AA | AI87: 4.2300000000000004e-002 | AJ87: =H87+100*O87 -> 129.95400000000001 | AK87: 123.6 | AL87: 71 | AM87: 29.3 | AN87: 59 | AO87: -3.5000000000000003e-002 | AP87: 14 | AQ87: 长集转债!
A88: 7 | B88: 123112 | C88: 万讯转债 | D88: 300112 | E88: 万讯自控 | F88: 机械装备 | G88: 专用设备 | H88: 106.301 | I88: -6.5000000000000006e-003 | J88: -5.1999999999999998e-003 | K88: 8.11 | L88: -2.0499999999999997e-002 | M88: 124.4 | N88: 8.93 | O88: 0.17000000000000001 | P88: 90.82 | Q88: 4月19天 | R88: 5.86年 | S88: 3.86年 | T88: 2.46 | U88: 10 | V88: 4.0000000000000001e-002 | W88: 0.106 | X88: 9.6000000000000002e-002 | Y88: 23 | Z88: 2.17 | AA88: 2.7699999999999999e-002 | AB88: 2.0499999999999997e-002 | AC88: -4.6999999999999993e-003 | AD88: -6.8000000000000005e-003 | AE88: 81.27 | AF88: 86.84 | AG88: 0.57 | AH88: AA- | AI88: 6.4600000000000005e-002 | AJ88: =H88+100*O88 -> 123.301 | AK88: 121.8 | AL88: 57 | AM88: 34.9 | AN88: 124 | AO88: -1.7000000000000001e-002 | AP88: 8 | AQ88: 万讯转债
A89: 226 | B89: 128083 | C89: 新北转债! | D89: 2376 | E89: 新北洋 | F89: 电子 | G89: 电子产品 | H89: 101.88 | I89: 2.3e-003 | J89: -4.0000000000000001e-003 | K89: 9.19 | L89: -5.4000000000000003e-003 | M89: 114.9 | N89: 11.7 | O89: 0.29699999999999999 | P89: 78.55 | Q89: 转股中 | R89: 4.54年 | S89: 2.54年 | T89: 8.77 | U89: 2.8 | V89: 3.0000000000000001e-003 | W89: 0.14300000000000002 | X89: 0.113 | Y89: 61 | Z89: 1.77 | AA89: 2.7400000000000001e-002 | AB89: 2.1299999999999999e-002 | AC89: 5.5000000000000005e-003 | AD89: 3.0999999999999999e-003 | AE89: 92.53 | AF89: 95.56 | AG89: 0.32 | AH89: AA | AI89: 4.2300000000000004e-002 | AJ89: =H89+100*O89 -> 131.57999999999998 | AK89: 125.2 | AL89: 88 | AM89: 29.7 | AN89: 65 | AO89: 9.0000000000000011e-003 | AP89: 19 | AQ89: 新北转债!
A90: 88 | B90: 123074 | C90: 隆利转债! | D90: 300752 | E90: 隆利科技 | F90: 电子 | G90: 液晶显示 | H90: 107.4 | I90: -2.5399999999999999e-002 | J90: 1.04e-002 | K90: 25.6 | L90: -2.8500000000000001e-002 | M90: 124 | N90: 29.41 | O90: 0.23399999999999999 | P90: 87.05 | Q90: 转股中 | R90: 5.42年 | S90: 3.42年 | T90: 3.25 | U90: 73 | V90: 0.20800000000000002 | W90: 0.105 | X90: 9.1999999999999998e-002 | Y90: 31 | Z90: 3.56 | AA90: 2.7400000000000001e-002 | AB90: 1.9699999999999999e-002 | AC90: -9.1999999999999998e-003 | AD90: -1.1299999999999999e-002 | AE90: 83.21 | AF90: 88.94 | AG90: 0.53 | AH90: AA- | AI90: 6.4600000000000005e-002 | AJ90: =H90+100*O90 -> 130.80000000000001 | AK90: 127.8 | AL90: 114 | AM90: 38.8 | AN90: 162 | AO90: 6.4000000000000001e-002 | AP90: 14 | AQ90: 隆利转债!
A91: 152 | B91: 128116 | C91: 瑞达转债! | D91: 2961 | E91: 瑞达期货 | F91: 金融 | G91: 期货行业 | H91: 100.945 | I91: -4.3e-003 | J91: 6.1999999999999998e-003 | K91: 21.18 | L91: 6.7000000000000002e-003 | M91: 115.3 | N91: 29.55 | O91: 0.40799999999999997 | P91: 71.68 | Q91: 转股中 | R91: 5年31天 | S91: 3年32天 | T91: 6.5 | U91: 9.1 | V91: 1.3999999999999999e-002 | W91: 6.9000000000000006e-002 | X91: 4.9000000000000002e-002 | Y91: 94 | Z91: 4.81 | AA91: 2.7099999999999999e-002 | AB91: 2.1400000000000002e-002 | AC91: 8.5000000000000006e-003 | AD91: 6.1999999999999998e-003 | AE91: 90.41 | AF91: 93.23 | AG91: 0.29 | AH91: AA | AI91: 4.36e-002 | AJ91: =H91+100*O91 -> 141.745 | AK91: 130.2 | AL91: 146 | AM91: 37 | AN91: 145 | AO91: 4.2000000000000003e-002 | AP91: 18 | AQ91: 瑞达转债!
A92: 59 | B92: 127027 | C92: 靖远转债! | D92: 552 | E92: 靖远煤电 | F92: 煤炭 | G92: 煤炭开采 | H92: 99.707 | I92: -2.3999999999999998e-003 | J92: -5.6000000000000008e-003 | K92: 2.96 | L92: -1.66e-002 | M92: 115.3 | N92: 3.33 | O92: 0.122 | P92: 88.89 | Q92: 19天 | R92: 5.53年 | S92: 3.54年 | T92: 28 | U92: 53 | V92: 1.9e-002 | W92: 0.41399999999999998 | X92: 0.36799999999999999 | Y92: 68 | Z92: 0.85 | AA92: 2.7099999999999999e-002 | AB92: 2.2000000000000002e-002 | AC92: 1.1000000000000001e-002 | AD92: 9.0000000000000011e-003 | AE92: 89.4 | AF92: 92.43 | AG92: 0.49 | AH92: AA+ | AI92: 4.1599999999999998e-002 | AJ92: =H92+100*O92 -> 111.907 | AK92: 110.5 | AL92: 3 | AM92: 18.1 | AN92: 6 | AO92: -3.7000000000000005e-002 | AP92: 35 | AQ92: 靖远转债!
A93: 351 | B93: 113014 | C93: 林洋转债! | D93: 601222 | E93: 林洋能源 | F93: 能源电力 | G93: 电力设备 | H93: 102.62 | I93: -1.8e-003 | J93: 2.0000000000000001e-004 | K93: 6.67 | L93: -8.8999999999999999e-003 | M93: 109.3 | N93: 8.54 | O93: 0.314 | P93: 78.1 | Q93: 转股中 | R93: 2.42年 | S93: 0.42年 | T93: 30 | U93: 11 | V93: 4.0000000000000001e-003 | W93: 0.25700000000000001 | X93: 0.20100000000000001 | Y93: 117 | Z93: 1.12 | AA93: 2.69e-002 | AB93: 1.95e-002 | AC93: -1.37e-002 | AD93: -1.9699999999999999e-002 | AE93: 99.47 | AF93: 99.46 | AG93: 0.19 | AH93: AA | AI93: 4.0599999999999997e-002 | AJ93: =H93+100*O93 -> 134.02000000000001 | AK93: 127.1 | AL93: 109 | AM93: 27.7 | AN93: 43 | AO93: -1.e-002 | AP93: 30 | AQ93: 林洋转债!
A94: 296 | B94: 113525 | C94: 台华转债! | D94: 603055 | E94: XD台华新 | F94: 服装纺织 | G94: 纺织行业 | H94: 104.19 | I94: -1.1999999999999999e-003 | J94: 4.0000000000000002e-004 | K94: 5.98 | L94: -3.3e-003 | M94: 114.3 | N94: 7.78 | O94: 0.35600000000000004 | P94: 76.86 | Q94: 转股中 | R94: 3.55年 | S94: 1.56年 | T94: 4.69 | U94: 0.5 | V94: 1.e-003 | W94: 9.4e-002 | X94: 7.2000000000000008e-002 | Y94: 50 | Z94: 1.64 | AA94: 2.69e-002 | AB94: 1.9400000000000001e-002 | AC94: -7.8000000000000005e-003 | AD94: -1.1000000000000001e-002 | AE94: 95.77 | AF94: 98.93 | AG94: 0.24 | AH94: AA | AI94: 4.2300000000000004e-002 | AJ94: =H94+100*O94 -> 139.78999999999999 | AK94: 131.5 | AL94: 158 | AM94: 32.6 | AN94: 97 | AO94: -2.3e-002 | AP94: 20 | AQ94: 台华转债!
A95: 124 | B95: 128125 | C95: 华阳转债! | D95: 2949 | E95: 华阳国际 | F95: 建筑 | G95: 建筑工程 | H95: 103.61 | I95: -1.03e-002 | J95: 7.1999999999999998e-003 | K95: 18.16 | L95: -8.199999999999999e-003 | M95: 118.5 | N95: 25.39 | O95: 0.44900000000000001 | P95: 71.52 | Q95: 转股中 | R95: 5.17年 | S95: 3.17年 | T95: 4.5 | U95: 0.5 | V95: 1.e-003 | W95: 0.126 | X95: 8.9999999999999997e-002 | Y95: 36 | Z95: 2.79 | AA95: 2.69e-002 | AB95: 2.0400000000000001e-002 | AC95: 7.000000000000001e-004 | AD95: -1.6000000000000001e-003 | AE95: 84.45 | AF95: 86.34 | AG95: 0.38 | AH95: AA- | AI95: 6.4600000000000005e-002 | AJ95: =H95+100*O95 -> 148.50999999999999 | AK95: 135.7 | AL95: 207 | AM95: 49.4 | AN95: 240 | AO95: -2.e-002 | AP95: 6 | AQ95: 华阳转债!
A96: 109 | B96: 123065 | C96: 宝莱转债! | D96: 300246 | E96: 宝莱特 | F96: 医药 | G96: 医疗器械 | H96: 106.01 | I96: -3.4999999999999996e-003 | J96: 2.8999999999999998e-003 | K96: 18.85 | L96: -6.8000000000000005e-003 | M96: 121.4 | N96: 40.54 | O96: 1.28 | P96: 46.5 | Q96: 转股中 | R96: 5.27年 | S96: 3.27年 | T96: 2.19 | U96: 25 | V96: 0.10800000000000001 | W96: 8.0000000000000002e-002 | X96: 3.7000000000000005e-002 | Y96: 28 | Z96: 3.1 | AA96: 2.6699999999999998e-002 | AB96: 1.95e-002 | AC96: -4.6999999999999993e-003 | AD96: -7.0999999999999995e-003 | AE96: 84.34 | AF96: 87.97 | AG96: 0.09 | AH96: AA- | AI96: 6.4600000000000005e-002 | AJ96: =H96+100*O96 -> 234.00999999999999 | AK96: 165.5 | AL96: 321 | AM96: 77.6 | AN96: 325 | AO96: 8.0000000000000002e-003 | AP96: 17 | AQ96: 宝莱转债!
A97: 327 | B97: 113505 | C97: 杭电转债! | D97: 603618 | E97: XD杭电股 | F97: 能源电力 | G97: 电力设备 | H97: 103.61 | I97: -1.9e-003 | J97: -1.e-003 | K97: 6.08 | L97: -9.7999999999999997e-003 | M97: 111.3 | N97: 7.08 | O97: 0.20699999999999999 | P97: 85.88 | Q97: 转股中 | R97: 2.77年 | S97: 0.77年 | T97: 7.5 | U97: 9.5 | V97: 1.2e-002 | W97: 0.17899999999999999 | X97: 0.153 | Y97: 42 | Z97: 1.56 | AA97: 2.6600000000000002e-002 | AB97: 1.8799999999999997e-002 | AC97: -1.8600000000000002e-002 | AD97: -2.23e-002 | AE97: 98.07 | AF97: 99.85 | AG97: 0.3 | AH97: AA | AI97: 4.0599999999999997e-002 | AJ97: =H97+100*O97 -> 124.31 | AK97: 121.3 | AL97: 52 | AM97: 21.5 | AN97: 13 | AO97: -2.3e-002 | AP97: 41 | AQ97: 杭电转债!
A98: 217 | B98: 123039 | C98: 开润转债! | D98: 300577 | E98: 开润股份 | F98: 服装纺织 | G98: 纺织行业 | H98: 107.608 | I98: -1.2999999999999999e-003 | J98: -7.4000000000000003e-003 | K98: 22.45 | L98: -2.18e-002 | M98: 121 | N98: 30 | O98: 0.43799999999999994 | P98: 74.83 | Q98: 转股中 | R98: 4.58年 | S98: 2.58年 | T98: 2.22 | U98: 2.3 | V98: 1.e-002 | W98: 4.0999999999999995e-002 | X98: 3.1e-002 | Y98: 54 | Z98: 3.52 | AA98: 2.6600000000000002e-002 | AB98: 1.84e-002 | AC98: -1.2199999999999999e-002 | AD98: -1.4999999999999999e-002 | AE98: 85.68 | AF98: 87.83 | AG98: 0.4 | AH98: A+ | AI98: 7.4299999999999991e-002 | AJ98: =H98+100*O98 -> 151.40800000000002 | AK98: 140.4 | AL98: 245 | AM98: 52.5 | AN98: 256 | AO98: 5.0000000000000001e-003 | AP98: 24 | AQ98: 开润转债!
A99: 126 | B99: 123063 | C99: 大禹转债 | D99: 300021 | E99: 大禹节水 | F99: 化工 | G99: 橡胶塑料 | H99: 110.81 | I99: -8.199999999999999e-003 | J99: -1.6000000000000001e-003 | K99: 4.97 | L99: -1.5800000000000002e-002 | M99: 126.5 | N99: 4.84 | O99: 7.9000000000000001e-002 | P99: 102.69 | Q99: 转股中 | R99: 5.16年 | S99: 4.17年 | T99: 6.38 | U99: 7.1 | V99: 1.e-002 | W99: 0.161 | X99: 0.16500000000000001 | Y99: 40 | Z99: 2.61 | AA99: 2.6600000000000002e-002 | AB99: 1.78e-002 | AC99: -8.199999999999999e-003 | AD99: -1.1200000000000002e-002 | AE99: 82.02 | AF99: 92.24 | AG99: 0.61 | AH99: AA- | AI99: 6.4600000000000005e-002 | AJ99: =H99+100*O99 -> 118.71000000000001 | AK99: 118.9 | AL99: 31 | AM99: 26.7 | AN99: 39 | AO99: -6.9999999999999993e-003 | AP99: 17 | AQ99: 大禹转债
A100: 108 | B100: 128131 | C100: 崇达转2! | D100: 2815 | E100: 崇达技术 | F100: 电子 | G100: 元器件制 | H100: 101.001 | I100: -3.0000000000000001e-003 | J100: 2.8000000000000004e-003 | K100: 11.73 | L100: -8.9999999999999998e-004 | M100: 115.2 | N100: 19.29 | O100: 0.66099999999999992 | P100: 60.81 | Q100: 转股中 | R100: 5.28年 | S100: 3.28年 | T100: 14 | U100: 1.2 | V100: 1.e-003 | W100: 0.13500000000000001 | X100: 8.199999999999999e-002 | Y100: 104 | Z100: 2.46 | AA100: 2.5699999999999997e-002 | AB100: 2.0400000000000001e-002 | AC100: 7.8000000000000005e-003 | AD100: 5.6000000000000008e-003 | AE100: 89.65 | AF100: 92.39 | AG100: 0.15 | AH100: AA | AI100: 4.36e-002 | AJ100: =H100+100*O100 -> 167.101 | AK100: 141.2 | AL100: 248 | AM100: 48.8 | AN100: 238 | AO100: 1.8000000000000002e-002 | AP100: 8 | AQ100: 崇达转2!
A101: 3 | B101: 127033 | C101: 中装转2 | D101: 2822 | E101: 中装建设 | F101: 建筑 | G101: 装饰工程 | H101: 101.2 | I101: -8.199999999999999e-003 | J101: 2.8999999999999998e-003 | K101: 5.77 | L101: -1.03e-002 | M101: 117.1 | N101: 6.33 | O101: 0.11 | P101: 91.15 | Q101: 4月27天 | R101: 5.88年 | S101: 3.89年 | T101: 11.6 | U101: 123 | V101: 0.10400000000000001 | W101: 0.27899999999999997 | X101: 0.254 | Y101: 42 | Z101: 1.23 | AA101: 2.5499999999999998e-002 | AB101: 2.0199999999999999e-002 | AC101: 5.8999999999999999e-003 | AD101: 4.0999999999999995e-003 | AE101: 87.27 | AF101: 91.49 | AG101: 0.52 | AH101: AA | AI101: 4.36e-002 | AJ101: =H101+100*O101 -> 112.2 | AK101: 111.2 | AL101: 4 | AM101: 19.8 | AN101: 9 | AO101: -1.3999999999999999e-002 | AP101: 10 | AQ101: 中装转2
A102: 140 | B102: 128120 | C102: 联诚转债! | D102: 2921 | E102: 联诚精密 | F102: 汽车 | G102: 零部件制 | H102: 104.7 | I102: -5.6999999999999993e-003 | J102: -2.0999999999999999e-003 | K102: 15.67 | L102: -1.26e-002 | M102: 118.4 | N102: 18.44 | O102: 0.23199999999999998 | P102: 84.98 | Q102: 转股中 | R102: 5年49天 | S102: 3年50天 | T102: 2.6 | U102: 3.4 | V102: 1.2e-002 | W102: 0.156 | X102: 0.13300000000000001 | Y102: 17 | Z102: 1.61 | AA102: 2.4900000000000002e-002 | AB102: 1.83e-002 | AC102: -4.0000000000000002e-004 | AD102: -3.0999999999999999e-003 | AE102: 80.03 | AF102: 78.54 | AG102: 0.62 | AH102: A | AI102: 8.5600000000000009e-002 | AJ102: =H102+100*O102 -> 127.90000000000001 | AK102: 124.4 | AL102: 76 | AM102: 44.4 | AN102: 213 | AO102: -0.11800000000000001 | AP102: 19 | AQ102: 联诚转债!
A103: 125 | B103: 113597 | C103: 佳力转债! | D103: 603912 | E103: 佳力图 | F103: 机械装备 | G103: 专用设备 | H103: 109.96 | I103: -1.4999999999999999e-002 | J103: 1.2199999999999999e-002 | K103: 16.12 | L103: -9.1999999999999998e-003 | M103: 124.5 | N103: 23.4 | O103: 0.59599999999999997 | P103: 68.89 | Q103: 转股中 | R103: 5.17年 | S103: 3.17年 | T103: 3 | U103: 442 | V103: 1.3200000000000001 | W103: 8.5999999999999993e-002 | X103: 5.9000000000000004e-002 | Y103: 35 | Z103: 3.76 | AA103: 2.4900000000000002e-002 | AB103: 1.67e-002 | AC103: -1.55e-002 | AD103: -1.8000000000000002e-002 | AE103: 84.96 | AF103: 90.78 | AG103: 0.31 | AH103: AA- | AI103: 6.4600000000000005e-002 | AJ103: =H103+100*O103 -> 169.56 | AK103: 151 | AL103: 293 | AM103: 60.3 | AN103: 295 | AO103: 0.152 | AP103: 14 | AQ103: 佳力转债!
A104: 133 | B104: 113037 | C104: 紫银转债 | D104: 601860 | E104: 紫金银行 | F104: 金融 | G104: 银行行业 | H104: 102.58 | I104: -1.6000000000000001e-003 | J104: 2.5999999999999999e-003 | K104: 3.86 | L104: 2.5999999999999999e-003 | M104: 115.8 | N104: 4.75 | O104: 0.26200000000000001 | P104: 81.26 | Q104: 转股中 | R104: 5年55天 | S104: 无权 | T104: 45 | U104: 16 | V104: 3.0000000000000001e-003 | W104: 0.318 | X104: 0.25900000000000001 | Y104: 141 | Z104: 0.96 | AA104: 2.4300000000000002e-002 | AB104: 1.8700000000000001e-002 | AC104: 无权 | AD104: 无权 | AE104: 无权 | AF104: 94.3 | AG104: 0.39 | AH104: AA+ | AI104: 4.1599999999999998e-002 | AJ104: =H104+100*O104 -> 128.78 | AK104: 123.9 | AL104: 72 | AM104: 29.6 | AN104: 63 | AO104: 4.0000000000000001e-003 | AP104: 19 | AQ104: 紫银转债
A105: 187 | B105: 113574 | C105: 华体转债! | D105: 603679 | E105: 华体科技 | F105: 城市公用 | G105: 城市公用 | H105: 103.55 | I105: -2.5999999999999999e-003 | J105: 8.9999999999999998e-004 | K105: 18.8 | L105: -1.1000000000000001e-002 | M105: 115.9 | N105: 33.99 | O105: 0.872 | P105: 55.31 | Q105: 转股中 | R105: 4.84年 | S105: 2.84年 | T105: 2.09 | U105: 2.6 | V105: 1.2e-002 | W105: 7.8e-002 | X105: 4.2999999999999997e-002 | Y105: 27 | Z105: 3.46 | AA105: 2.41e-002 | AB105: 1.8000000000000002e-002 | AC105: 1.7000000000000001e-003 | AD105: -8.9999999999999998e-004 | AE105: 84.07 | AF105: 82.6 | AG105: 0.15 | AH105: A+ | AI105: 7.4299999999999991e-002 | AJ105: =H105+100*O105 -> 190.75 | AK105: 151.8 | AL105: 295 | AM105: 67.7 | AN105: 314 | AO105: 2.e-003 | AP105: 18 | AQ105: 华体转债!
A106: 308 | B106: 113516 | C106: 苏农转债! | D106: 603323 | E106: 苏农银行 | F106: 金融 | G106: 银行行业 | H106: 106.16 | I106: 0. | J106: -5.9999999999999995e-004 | K106: 4.57 | L106: -2.2000000000000001e-003 | M106: 114.3 | N106: 5.52 | O106: 0.28199999999999997 | P106: 82.79 | Q106: 转股中 | R106: 3.18年 | S106: 无权 | T106: 12.9 | U106: 3.4 | V106: 2.e-003 | W106: 0.156 | X106: 0.13 | Y106: 82 | Z106: 0.67 | AA106: 2.4e-002 | AB106: 1.5700000000000002e-002 | AC106: 无权 | AD106: 无权 | AE106: 无权 | AF106: 101.09 | AG106: 0.29 | AH106: AA+ | AI106: 4.0300000000000002e-002 | AJ106: =H106+100*O106 -> 134.35999999999999 | AK106: 129.5 | AL106: 136 | AM106: 28.4 | AN106: 51 | AO106: 6.0000000000000001e-003 | AP106: 29 | AQ106: 苏农转债!
A107: 243 | B107: 128076 | C107: 金轮转债! | D107: 2722 | E107: 金轮股份 | F107: 机械装备 | G107: 专用设备 | H107: 103.802 | I107: -3.0999999999999999e-003 | J107: 5.0000000000000001e-004 | K107: 12.1 | L107: -5.7999999999999996e-003 | M107: 114.9 | N107: 14.76 | O107: 0.26600000000000001 | P107: 81.98 | Q107: 转股中 | R107: 4.38年 | S107: 2.38年 | T107: 2.14 | U107: 2.5 | V107: 1.1000000000000001e-002 | W107: 0.10099999999999999 | X107: 8.3000000000000004e-002 | Y107: 21 | Z107: 1.12 | AA107: 2.4e-002 | AB107: 1.7600000000000001e-002 | AC107: -1.5e-003 | AD107: -4.0999999999999995e-003 | AE107: 88.58 | AF107: 88.33 | AG107: 0.46 | AH107: AA- | AI107: 6.3299999999999995e-002 | AJ107: =H107+100*O107 -> 130.40200000000002 | AK107: 125.6 | AL107: 91 | AM107: 37 | AN107: 146 | AO107: 1.3999999999999999e-002 | AP107: 41 | AQ107: 金轮转债!
A108: 231 | B108: 113549 | C108: 白电转债 | D108: 603861 | E108: 白云电器 | F108: 能源电力 | G108: 电力设备 | H108: 103.6 | I108: -4.7999999999999996e-003 | J108: -1.e-004 | K108: 7.89 | L108: -1.1299999999999999e-002 | M108: 114.8 | N108: 8.88 | O108: 0.16600000000000001 | P108: 88.85 | Q108: 转股中 | R108: 4.47年 | S108: 2.47年 | T108: 8.8 | U108: 5.7 | V108: 6.0000000000000001e-003 | W108: 0.252 | X108: 0.22399999999999998 | Y108: 35 | Z108: 1.35 | AA108: 2.3700000000000002e-002 | AB108: 1.7600000000000001e-002 | AC108: -1.1000000000000001e-003 | AD108: -3.5999999999999999e-003 | AE108: 92.71 | AF108: 95.75 | AG108: 0.43 | AH108: AA | AI108: 4.2300000000000004e-002 | AJ108: =H108+100*O108 -> 120.19999999999999 | AK108: 118.3 | AL108: 26 | AM108: 22.6 | AN108: 17 | AO108: -1.7000000000000001e-002 | AP108: 38 | AQ108: 白电转债
A109: 67 | B109: 123080 | C109: 海波转债! | D109: 300517 | E109: 海波重科 | F109: 建筑 | G109: 建筑工程 | H109: 111.51 | I109: -1.06e-002 | J109: 3.4999999999999996e-003 | K109: 22.15 | L109: -1.03e-002 | M109: 126.5 | N109: 20.91 | O109: 5.2999999999999999e-002 | P109: 105.93 | Q109: 11天 | R109: 5.51年 | S109: 3.52年 | T109: 2.45 | U109: 6.3 | V109: 2.3e-002 | W109: 0.10400000000000001 | X109: 0.11 | Y109: 24 | Z109: 2.85 | AA109: 2.3700000000000002e-002 | AB109: 1.55e-002 | AC109: -1.72e-002 | AD109: -1.9599999999999999e-002 | AE109: 80.33 | AF109: 85.46 | AG109: 0.69 | AH109: A+ | AI109: 7.5600000000000001e-002 | AJ109: =H109+100*O109 -> 116.81 | AK109: 117.1 | AL109: 22 | AM109: 31.6 | AN109: 87 | AO109: -3.5000000000000003e-002 | AP109: 18 | AQ109: 海波转债!
A110: 57 | B110: 123086 | C110: 海兰转债! | D110: 300065 | E110: 海兰信 | F110: 电子 | G110: 电子产品 | H110: 108.75 | I110: 1.1399999999999999e-002 | J110: -1.2e-002 | K110: 10.57 | L110: -8.9999999999999998e-004 | M110: 123.5 | N110: 10.88 | O110: 0.11900000000000001 | P110: 97.15 | Q110: 20天 | R110: 5.54年 | S110: 3.54年 | T110: 7.3 | U110: 48 | V110: 6.0999999999999999e-002 | W110: 0.17300000000000001 | X110: 0.16899999999999998 | Y110: 42 | Z110: 2.83 | AA110: 2.3700000000000002e-002 | AB110: 1.6299999999999999e-002 | AC110: -1.2500000000000001e-002 | AD110: -1.4499999999999999e-002 | AE110: 82.53 | AF110: 87.91 | AG110: 0.61 | AH110: AA- | AI110: 6.4600000000000005e-002 | AJ110: =H110+100*O110 -> 120.65000000000001 | AK110: 120.3 | AL110: 40 | AM110: 32.4 | AN110: 96 | AO110: 2.2000000000000002e-002 | AP110: 16 | AQ110: 海兰转债!
A111: 121 | B111: 127021 | C111: 特发转2! | D111: 70 | E111: 特发信息 | F111: 通信互联 | G111: 通信设备 | H111: 103.026 | I111: -7.000000000000001e-004 | J111: -1.9e-003 | K111: 7.4 | L111: -2.5000000000000001e-002 | M111: 113.3 | N111: 12.33 | O111: 0.71700000000000008 | P111: 60.02 | Q111: 转股中 | R111: 4.19年 | S111: 2.19年 | T111: 5.5 | U111: 2.6 | V111: 5.0000000000000001e-003 | W111: 8.9999999999999997e-002 | X111: 5.4000000000000006e-002 | Y111: 61 | Z111: 2.08 | AA111: 2.3199999999999998e-002 | AB111: 1.7299999999999999e-002 | AC111: -4.0000000000000001e-003 | AD111: -5.6999999999999993e-003 | AE111: 92.59 | AF111: 95.45 | AG111: 0.11 | AH111: AA | AI111: 4.2300000000000004e-002 | AJ111: =H111+100*O111 -> 174.726 | AK111: 146 | AL111: 269 | AM111: 50.6 | AN111: 245 | AO111: 2.e-003 | AP111: 11 | AQ111: 特发转2!
A112: 39 | B112: 113619 | C112: 世运转债! | D112: 603920 | E112: 世运电路 | F112: 电子 | G112: 元器件制 | H112: 101.52 | I112: -2.9999999999999997e-004 | J112: -1.4000000000000002e-003 | K112: 16.13 | L112: -9.1999999999999998e-003 | M112: 115.2 | N112: 26.5 | O112: 0.66799999999999993 | P112: 60.87 | Q112: 59天 | R112: 5.65年 | S112: 3.65年 | T112: 10 | U112: 3.5 | V112: 3.0000000000000001e-003 | W112: 0.151 | X112: 9.1999999999999998e-002 | Y112: 66 | Z112: 2.42 | AA112: 2.3099999999999999e-002 | AB112: 1.8100000000000002e-002 | AC112: 5.6000000000000008e-003 | AD112: 3.7000000000000002e-003 | AE112: 88.25 | AF112: 90.94 | AG112: 0.18 | AH112: AA | AI112: 4.36e-002 | AJ112: =H112+100*O112 -> 168.31999999999999 | AK112: 142.2 | AL112: 255 | AM112: 51.2 | AN112: 252 | AO112: 1.4999999999999999e-002 | AP112: 4 | AQ112: 世运转债!
A113: 343 | B113: 128022 | C113: 众信转债! | D113: 2707 | E113: 众信旅游 | F113: 旅游餐饮 | G113: 旅游 | H113: 102.975 | I113: -5.1000000000000004e-003 | J113: 4.4000000000000003e-003 | K113: 5.8 | L113: -5.1000000000000004e-003 | M113: 108.8 | N113: 7.92 | O113: 0.40600000000000003 | P113: 73.23 | Q113: 转股中 | R113: 2.51年 | S113: 0.51年 | T113: 4.56 | U113: 5 | V113: 1.1000000000000001e-002 | W113: 8.6999999999999994e-002 | X113: 6.4000000000000001e-002 | Y113: 53 | Z113: 7.87 | AA113: 2.2499999999999999e-002 | AB113: 1.5700000000000002e-002 | AC113: -2.0400000000000001e-002 | AD113: -2.4799999999999999e-002 | AE113: 97.52 | AF113: 93.85 | AG113: 0.12 | AH113: AA- | AI113: 6.1600000000000002e-002 | AJ113: =H113+100*O113 -> 143.57499999999999 | AK113: 132.7 | AL113: 172 | AM113: 35.2 | AN113: 128 | AO113: 5.5e-002 | AP113: 31 | AQ113: 众信转债!
A114: 78 | B114: 113608 | C114: 威派转债! | D114: 603956 | E114: 威派格 | F114: 机械装备 | G114: 专用设备 | H114: 108.02 | I114: 1.e-004 | J114: -1.01e-002 | K114: 16.01 | L114: -1.78e-002 | M114: 121.6 | N114: 19.24 | O114: 0.29799999999999999 | P114: 83.21 | Q114: 转股中 | R114: 5.45年 | S114: 3.45年 | T114: 4.2 | U114: 4.9 | V114: 1.1000000000000001e-002 | W114: 6.2e-002 | X114: 5.0999999999999997e-002 | Y114: 68 | Z114: 5.89 | AA114: 2.2499999999999999e-002 | AB114: 1.55e-002 | AC114: -8.8999999999999999e-003 | AD114: -1.1399999999999999e-002 | AE114: 80.63 | AF114: 82.54 | AG114: 0.56 | AH114: A+ | AI114: 7.5600000000000001e-002 | AJ114: =H114+100*O114 -> 137.81999999999999 | AK114: 132.8 | AL114: 176 | AM114: 50.3 | AN114: 243 | AO114: -5.2000000000000005e-002 | AP114: 7 | AQ114: 威派转债!
A115: 223 | B115: 128087 | C115: 孚日转债! | D115: 2083 | E115: 孚日股份 | F115: 服装纺织 | G115: 家纺 | H115: 102.28 | I115: -5.4000000000000003e-003 | J115: 3.0000000000000001e-003 | K115: 4.16 | L115: -4.7999999999999996e-003 | M115: 112.9 | N115: 4.5 | O115: 0.106 | P115: 92.44 | Q115: 转股中 | R115: 4.55年 | S115: 2.56年 | T115: 6.5 | U115: 12 | V115: 1.8000000000000002e-002 | W115: 0.17199999999999999 | X115: 0.159 | Y115: 38 | Z115: 1.04 | AA115: 2.2400000000000003e-002 | AB115: 1.7000000000000001e-002 | AC115: 4.0000000000000001e-003 | AD115: 1.6000000000000001e-003 | AE115: 92.47 | AF115: 93.85 | AG115: 0.5 | AH115: AA | AI115: 4.2300000000000004e-002 | AJ115: =H115+100*O115 -> 112.88 | AK115: 112.1 | AL115: 6 | AM115: 18.3 | AN115: 7 | AO115: -5.0000000000000001e-003 | AP115: 60 | AQ115: 孚日转债!
A116: 162 | B116: 123053 | C116: 宝通转债! | D116: 300031 | E116: 宝通科技 | F116: 通信互联 | G116: 互联网 | H116: 108.81 | I116: -1.3000000000000001e-002 | J116: -8.0000000000000004e-004 | K116: 17.45 | L116: -2.8399999999999998e-002 | M116: 121.3 | N116: 20.8 | O116: 0.29699999999999999 | P116: 83.89 | Q116: 转股中 | R116: 5年7天 | S116: 3年8天 | T116: 5 | U116: 8.7 | V116: 1.6e-002 | W116: 7.2000000000000008e-002 | X116: 6.0999999999999999e-002 | Y116: 69 | Z116: 2.25 | AA116: 2.2400000000000003e-002 | AB116: 1.49e-002 | AC116: -1.3600000000000001e-002 | AD116: -1.61e-002 | AE116: 85.61 | AF116: 89.29 | AG116: 0.48 | AH116: AA- | AI116: 6.4600000000000005e-002 | AJ116: =H116+100*O116 -> 138.50999999999999 | AK116: 133.7 | AL116: 180 | AM116: 44.4 | AN116: 214 | AO116: 3.7000000000000005e-002 | AP116: 9 | AQ116: 宝通转债!
A117: 130 | B117: 128123 | C117: 国光转债! | D117: 2749 | E117: 国光股份 | F117: 化工 | G117: 农化 | H117: 103.9 | I117: -1.e-002 | J117: 6.4000000000000003e-003 | K117: 9.91 | L117: -9.0000000000000011e-003 | M117: 116.2 | N117: 13.7 | O117: 0.436 | P117: 72.34 | Q117: 转股中 | R117: 5年59天 | S117: 3.16年 | T117: 3.2 | U117: 1.8 | V117: 5.0000000000000001e-003 | W117: 7.400000000000001e-002 | X117: 5.4000000000000006e-002 | Y117: 43 | Z117: 3.46 | AA117: 2.2400000000000003e-002 | AB117: 1.66e-002 | AC117: 7.000000000000001e-004 | AD117: -1.8e-003 | AE117: 84.76 | AF117: 84.79 | AG117: 0.4 | AH117: AA- | AI117: 6.4600000000000005e-002 | AJ117: =H117+100*O117 -> 147.5 | AK117: 135.5 | AL117: 203 | AM117: 50.7 | AN117: 247 | AO117: -9.0000000000000011e-003 | AP117: 11 | AQ117: 国光转债!
A118: 269 | B118: 113534 | C118: 鼎胜转债! | D118: 603876 | E118: 鼎胜新材 | F118: 有色金属 | G118: 小金属 | H118: 105.19 | I118: 1.15e-002 | J118: -1.49e-002 | K118: 13.59 | L118: -8.0000000000000002e-003 | M118: 114.3 | N118: 15.18 | O118: 0.17499999999999999 | P118: 89.53 | Q118: 转股中 | R118: 3.86年 | S118: 1.87年 | T118: 12 | U118: 57 | V118: 4.4999999999999998e-002 | W118: 0.20300000000000001 | X118: 0.182 | Y118: 59 | Z118: 1.63 | AA118: 2.2099999999999998e-002 | AB118: 1.5300000000000001e-002 | AC118: -1.1299999999999999e-002 | AD118: -1.3999999999999999e-002 | AE118: 94.55 | AF118: 97.67 | AG118: 0.41 | AH118: AA | AI118: 4.2300000000000004e-002 | AJ118: =H118+100*O118 -> 122.69 | AK118: 120.9 | AL118: 48 | AM118: 23.2 | AN118: 20 | AO118: 4.5999999999999999e-002 | AP118: 37 | AQ118: 鼎胜转债!
A119: 134 | B119: 123061 | C119: 航新转债! | D119: 300424 | E119: 航新科技 | F119: 航空航天 | G119: 航空航天 | H119: 111.97 | I119: -1.1999999999999999e-003 | J119: 1.09e-002 | K119: 14.22 | L119: 1.5700000000000002e-002 | M119: 124.8 | N119: 14.86 | O119: 0.17000000000000001 | P119: 95.69 | Q119: 转股中 | R119: 5年54天 | S119: 3年55天 | T119: 2.5 | U119: 249 | V119: 0.88 | W119: 7.2999999999999995e-002 | X119: 7.0000000000000007e-002 | Y119: 34 | Z119: 5.12 | AA119: 2.18e-002 | AB119: 1.3600000000000001e-002 | AC119: -2.0199999999999999e-002 | AD119: -2.29e-002 | AE119: 82.53 | AF119: 86.6 | AG119: 0.62 | AH119: A+ | AI119: 7.5600000000000001e-002 | AJ119: =H119+100*O119 -> 128.97 | AK119: 128.2 | AL119: 117 | AM119: 41.6 | AN119: 188 | AO119: 7.0000000000000007e-002 | AP119: 16 | AQ119: 航新转债!
A120: 22 | B120: 123105 | C120: 拓尔转债! | D120: 300229 | E120: 拓尔思 | F120: 计算机及 | G120: 软件开发 | H120: 107 | I120: 2.6699999999999998e-002 | J120: 7.9000000000000001e-002 | K120: 9.74 | L120: 0.16500000000000001 | M120: 121 | N120: 9.93 | O120: 9.0999999999999998e-002 | P120: 98.09 | Q120: 4月0天 | R120: 5.81年 | S120: 3.81年 | T120: 8 | U120: 1559. | V120: 1.72 | W120: 0.115 | X120: 0.11199999999999999 | Y120: 70 | Z120: 3.2 | AA120: 2.18e-002 | AB120: 1.54e-002 | AC120: -7.4000000000000003e-003 | AD120: -9.300000000000001e-003 | AE120: 81.23 | AF120: 84.73 | AG120: 0.64 | AH120: AA- | AI120: 6.4600000000000005e-002 | AJ120: =H120+100*O120 -> 116.09999999999999 | AK120: 115.9 | AL120: 18 | AM120: 31.2 | AN120: 79 | AO120: 0.191 | AP120: 5 | AQ120: 拓尔转债!
A121: 42 | B121: 128143 | C121: 锋龙转债! | D121: 2931 | E121: 锋龙股份 | F121: 机械装备 | G121: 专用设备 | H121: 108.182 | I121: -2.8999999999999998e-003 | J121: -1.2999999999999999e-003 | K121: 16.42 | L121: -6.7000000000000002e-003 | M121: 121.7 | N121: 17.97 | O121: 0.184 | P121: 91.37 | Q121: 47天 | R121: 5.61年 | S121: 3.62年 | T121: 2.45 | U121: 16 | V121: 5.9000000000000004e-002 | W121: 0.105 | X121: 9.6000000000000002e-002 | Y121: 23 | Z121: 3.72 | AA121: 2.1700000000000001e-002 | AB121: 1.49e-002 | AC121: -8.8999999999999999e-003 | AD121: -1.1200000000000002e-002 | AE121: 79.68 | AF121: 81.63 | AG121: 0.64 | AH121: A+ | AI121: 7.5600000000000001e-002 | AJ121: =H121+100*O121 -> 126.58199999999999 | AK121: 125 | AL121: 85 | AM121: 43.4 | AN121: 207 | AO121: 3.6000000000000004e-002 | AP121: 10 | AQ121: 锋龙转债!
A122: 281 | B122: 110056 | C122: 亨通转债! | D122: 600487 | E122: 亨通光电 | F122: 通信互联 | G122: 通信设备 | H122: 105.51 | I122: -5.0000000000000001e-003 | J122: 3.2000000000000002e-003 | K122: 11.9 | L122: -6.7000000000000002e-003 | M122: 114.3 | N122: 15.01 | O122: 0.33100000000000002 | P122: 79.28 | Q122: 转股中 | R122: 3.81年 | S122: 1.81年 | T122: 17.1 | U122: 14 | V122: 8.0000000000000002e-003 | W122: 6.0999999999999999e-002 | X122: 4.8000000000000001e-002 | Y122: 281 | Z122: 1.4 | AA122: 2.1600000000000001e-002 | AB122: 1.47e-002 | AC122: -1.32e-002 | AD122: -1.5900000000000001e-002 | AE122: 95.14 | AF122: 98.61 | AG122: 0.26 | AH122: AA+ | AI122: 4.0300000000000002e-002 | AJ122: =H122+100*O122 -> 138.61000000000001 | AK122: 131.7 | AL122: 161 | AM122: 33.1 | AN122: 103 | AO122: 1.8000000000000002e-002 | AP122: 29 | AQ122: 亨通转债!
A123: 202 | B123: 113567 | C123: 君禾转债! | D123: 603617 | E123: 君禾股份 | F123: 机械装备 | G123: 通用设备 | H123: 107.63 | I123: 1.5e-003 | J123: 8.0000000000000004e-004 | K123: 10.04 | L123: 4.0000000000000001e-003 | M123: 118.8 | N123: 11.46 | O123: 0.22899999999999998 | P123: 87.61 | Q123: 转股中 | R123: 4.76年 | S123: 2.77年 | T123: 2.1 | U123: 1.7 | V123: 8.0000000000000002e-003 | W123: 0.105 | X123: 9.1999999999999998e-002 | Y123: 20 | Z123: 2.83 | AA123: 2.1400000000000002e-002 | AB123: 1.43e-002 | AC123: -1.18e-002 | AD123: -1.44e-002 | AE123: 84.45 | AF123: 85.1 | AG123: 0.56 | AH123: A+ | AI123: 7.4299999999999991e-002 | AJ123: =H123+100*O123 -> 130.53 | AK123: 127.7 | AL123: 113 | AM123: 42.5 | AN123: 199 | AO123: -5.7000000000000002e-002 | AP123: 34 | AQ123: 君禾转债!
A124: 166 | B124: 123051 | C124: 今天转债 | D124: 300532 | E124: 今天国际 | F124: 计算机及 | G124: 软件开发 | H124: 110.736 | I124: -1.6000000000000001e-003 | J124: -5.9999999999999995e-004 | K124: 8.7 | L124: -3.4000000000000002e-003 | M124: 122.8 | N124: 8.7 | O124: 0.107 | P124: 100 | Q124: 转股中 | R124: 5年6.1天 | S124: 3年7天 | T124: 2.79 | U124: 54 | V124: 0.17399999999999999 | W124: 0.11699999999999999 | X124: 0.11699999999999999 | Y124: 24 | Z124: 3.05 | AA124: 2.1400000000000002e-002 | AB124: 1.34e-002 | AC124: -1.7600000000000001e-002 | AD124: -2.0400000000000001e-002 | AE124: 83.32 | AF124: 86.05 | AG124: 0.64 | AH124: A+ | AI124: 7.5600000000000001e-002 | AJ124: =H124+100*O124 -> 121.43600000000001 | AK124: 121.5 | AL124: 55 | AM124: 35.4 | AN124: 132 | AO124: 7.4999999999999997e-002 | AP124: 17 | AQ124: 今天转债
A125: 1 | B125: 127034 | C125: N绿茵转 | D125: 2887 | E125: 绿茵生态 | F125: 城市公用 | G125: 生态环境 | H125: 105.52 | I125: 5.5199999999999999e-002 | J125: 0. | K125: 11.91 | L125: -2.06e-002 | M125: 119 | N125: 12.38 | O125: 9.6999999999999989e-002 | P125: 96.2 | Q125: 5月17天 | R125: 5.92年 | S125: 3.92年 | T125: 7.12 | U125: 867 | V125: 1.1399999999999999 | W125: 0.192 | X125: 0.184 | Y125: 37 | Z125: 1.73 | AA125: 2.0899999999999998e-002 | AB125: 1.52e-002 | AC125: -3.8e-003 | AD125: -5.6000000000000008e-003 | AE125: 80.64 | AF125: 82.74 | AG125: 0.64 | AH125: AA- | AI125: 6.4600000000000005e-002 | AJ125: =H125+100*O125 -> 115.22 | AK125: 114.8 | AL125: 12 | AM125: 32.1 | AN125: 92 | AO125: 5.2000000000000005e-002 | AP125: 2 | AQ125: N绿茵转
A126: 198 | B126: 113570 | C126: 百达转债! | D126: 603331 | E126: 百达精工 | F126: 机械装备 | G126: 机械装备 | H126: 104.31 | I126: -1.24e-002 | J126: 6.0000000000000001e-003 | K126: 9.98 | L126: -1.09e-002 | M126: 114.9 | N126: 11.54 | O126: 0.20600000000000002 | P126: 86.48 | Q126: 转股中 | R126: 4.78年 | S126: 2.79年 | T126: 2.8 | U126: 2.1 | V126: 6.9999999999999993e-003 | W126: 0.157 | X126: 0.13600000000000001 | Y126: 18 | Z126: 2.12 | AA126: 2.0799999999999999e-002 | AB126: 1.5100000000000001e-002 | AC126: -3.0000000000000001e-003 | AD126: -5.1999999999999998e-003 | AE126: 83.83 | AF126: 82.11 | AG126: 0.58 | AH126: A+ | AI126: 7.4299999999999991e-002 | AJ126: =H126+100*O126 -> 124.91 | AK126: 122.1 | AL126: 63 | AM126: 38.3 | AN126: 158 | AO126: -1.e-003 | AP126: 34 | AQ126: 百达转债!
A127: 342 | B127: 128023 | C127: 亚太转债! | D127: 2284 | E127: 亚太股份 | F127: 汽车 | G127: 零部件制 | H127: 105.81 | I127: 1.55e-002 | J127: -1.4000000000000002e-003 | K127: 7.61 | L127: 9.9700000000000011e-002 | M127: 111.3 | N127: 10.34 | O127: 0.43799999999999994 | P127: 73.6 | Q127: 转股中 | R127: 2.52年 | S127: 0.52年 | T127: 9.99 | U127: 549 | V127: 0.51200000000000001 | W127: 0.17800000000000002 | X127: 0.13100000000000001 | Y127: 56 | Z127: 2.25 | AA127: 2.06e-002 | AB127: 1.2199999999999999e-002 | AC127: -5.4900000000000004e-002 | AD127: -5.9699999999999996e-002 | AE127: 99.07 | AF127: 100.88 | AG127: 0.14 | AH127: AA | AI127: 4.0599999999999997e-002 | AJ127: =H127+100*O127 -> 149.61000000000001 | AK127: 138 | AL127: 227 | AM127: 37.1 | AN127: 148 | AO127: 0.113 | AP127: 68 | AQ127: 亚太转债!
A128: 34 | B128: 123097 | C128: 美力转债 | D128: 300611 | E128: 美力科技 | F128: 机械装备 | G128: 通用设备 | H128: 108.6 | I128: -3.7000000000000002e-003 | J128: -5.0000000000000001e-003 | K128: 9.16 | L128: -1.29e-002 | M128: 121.6 | N128: 9.34 | O128: 0.107 | P128: 98.07 | Q128: 2月6天 | R128: 5.67年 | S128: 3.67年 | T128: 3 | U128: 5.7 | V128: 1.7000000000000001e-002 | W128: 0.183 | X128: 0.17899999999999999 | Y128: 16 | Z128: 2.46 | AA128: 2.06e-002 | AB128: 1.3899999999999999e-002 | AC128: -9.7999999999999997e-003 | AD128: -1.21e-002 | AE128: 79.37 | AF128: 81.25 | AG128: 0.67 | AH128: A+ | AI128: 7.5600000000000001e-002 | AJ128: =H128+100*O128 -> 119.3 | AK128: 119.1 | AL128: 33 | AM128: 37.9 | AN128: 156 | AO128: 2.5000000000000001e-002 | AP128: 15 | AQ128: 美力转债
A129: 20 | B129: 113046 | C129: 金田转债 | D129: 601609 | E129: 金田铜业 | F129: 有色金属 | G129: 铜金属 | H129: 102.27 | I129: -4.0000000000000002e-004 | J129: -5.9999999999999995e-004 | K129: 9.19 | L129: -2.2000000000000001e-003 | M129: 114.9 | N129: 10.95 | O129: 0.21899999999999997 | P129: 83.93 | Q129: 4月2天 | R129: 5.81年 | S129: 3.82年 | T129: 15 | U129: 17 | V129: 1.1000000000000001e-002 | W129: 0.11199999999999999 | X129: 9.4e-002 | Y129: 134 | Z129: 1.96 | AA129: 2.06e-002 | AB129: 1.5800000000000002e-002 | AC129: 2.8000000000000004e-003 | AD129: 1.1000000000000001e-003 | AE129: 88.02 | AF129: 91.01 | AG129: 0.44 | AH129: AA+ | AI129: 4.1599999999999998e-002 | AJ129: =H129+100*O129 -> 124.16999999999999 | AK129: 120.6 | AL129: 43 | AM129: 29.6 | AN129: 64 | AO129: -2.4e-002 | AP129: 9 | AQ129: 金田转债
A130: 69 | B130: 113610 | C130: 灵康转债 | D130: 603669 | E130: 灵康药业 | F130: 医药 | G130: 化学制药 | H130: 108.52 | I130: -1.3600000000000001e-002 | J130: 7.0999999999999995e-003 | K130: 9 | L130: -9.8999999999999991e-003 | M130: 121.1 | N130: 8.81 | O130: 6.2e-002 | P130: 102.16 | Q130: 10天 | R130: 5.51年 | S130: 3.51年 | T130: 5.25 | U130: 9.9 | V130: 1.7000000000000001e-002 | W130: 8.199999999999999e-002 | X130: 8.4000000000000005e-002 | Y130: 64 | Z130: 4.56 | AA130: 2.0499999999999997e-002 | AB130: 1.38e-002 | AC130: -1.1599999999999999e-002 | AD130: -1.3600000000000001e-002 | AE130: 82.83 | AF130: 86.41 | AG130: 0.66 | AH130: AA- | AI130: 6.4600000000000005e-002 | AJ130: =H130+100*O130 -> 114.72 | AK130: 114.9 | AL130: 14 | AM130: 28.5 | AN130: 52 | AO130: -2.3e-002 | AP130: 23 | AQ130: 灵康转债
A131: 248 | B131: 128073 | C131: 哈尔转债! | D131: 2615 | E131: 哈尔斯 | F131: 其他 | G131: 家居用品 | H131: 108.15 | I131: 6.0000000000000001e-003 | J131: 1.23e-002 | K131: 4.84 | L131: 4.7599999999999996e-002 | M131: 115.3 | N131: 5.7 | O131: 0.27399999999999997 | P131: 84.91 | Q131: 转股中 | R131: 3.23年 | S131: 1.24年 | T131: 2.99 | U131: 495 | V131: 1.5 | W131: 0.14999999999999999 | X131: 0.127 | Y131: 20 | Z131: 2.55 | AA131: 2.0299999999999999e-002 | AB131: 1.1699999999999999e-002 | AC131: -4.0899999999999999e-002 | AD131: -4.36e-002 | AE131: 93.7 | AF131: 94.85 | AG131: 0.39 | AH131: AA- | AI131: 6.3299999999999995e-002 | AJ131: =H131+100*O131 -> 135.55000000000001 | AK131: 131.4 | AL131: 157 | AM131: 36.5 | AN131: 142 | AO131: 5.5e-002 | AP131: 40 | AQ131: 哈尔转债!
A132: 279 | B132: 123024 | C132: 岱勒转债! | D132: 300700 | E132: 岱勒新材 | F132: 机械装备 | G132: 专用设备 | H132: 106.5 | I132: -5.1000000000000004e-003 | J132: 5.9999999999999995e-004 | K132: 15.84 | L132: -1.06e-002 | M132: 112.5 | N132: 18.33 | O132: 0.23199999999999998 | P132: 86.42 | Q132: 转股中 | R132: 2.81年 | S132: 0.81年 | T132: 2.1 | U132: 9 | V132: 4.0000000000000001e-002 | W132: 0.161 | X132: 0.13900000000000001 | Y132: 13 | Z132: 2.69 | AA132: 1.9900000000000001e-002 | AB132: 1.1699999999999999e-002 | AC132: -5.0300000000000004e-002 | AD132: -5.2699999999999997e-002 | AE132: 94.54 | AF132: 92.58 | AG132: 0.42 | AH132: A+ | AI132: 7.2599999999999998e-002 | AJ132: =H132+100*O132 -> 129.69999999999999 | AK132: 126.6 | AL132: 100 | AM132: 32 | AN132: 90 | AO132: 4.7e-002 | AP132: 35 | AQ132: 岱勒转债!
A133: 137 | B133: 113594 | C133: 淳中转债! | D133: 603516 | E133: 淳中科技 | F133: 电子 | G133: 电子产品 | H133: 110.12 | I133: -1.06e-002 | J133: 9.8999999999999991e-003 | K133: 22.31 | L133: -1.2999999999999999e-003 | M133: 121.4 | N133: 27.84 | O133: 0.374 | P133: 80.14 | Q133: 转股中 | R133: 5年53天 | S133: 3年54天 | T133: 3 | U133: 1.4 | V133: 4.0000000000000001e-003 | W133: 7.2000000000000008e-002 | X133: 5.7999999999999996e-002 | Y133: 42 | Z133: 3.04 | AA133: 1.9599999999999999e-002 | AB133: 1.23e-002 | AC133: -1.5700000000000002e-002 | AD133: -1.83e-002 | AE133: 82.41 | AF133: 84.25 | AG133: 0.51 | AH133: A+ | AI133: 7.5600000000000001e-002 | AJ133: =H133+100*O133 -> 147.52000000000001 | AK133: 140.1 | AL133: 243 | AM133: 55.9 | AN133: 277 | AO133: -1.8000000000000002e-002 | AP133: 9 | AQ133: 淳中转债!
A134: 123 | B134: 113598 | C134: 法兰转债 | D134: 603966 | E134: 法兰泰克 | F134: 机械装备 | G134: 工程机械 | H134: 109.94 | I134: -3.2000000000000002e-003 | J134: 2.3e-003 | K134: 12.51 | L134: -1.6000000000000001e-003 | M134: 121.2 | N134: 13.88 | O134: 0.22 | P134: 90.13 | Q134: 转股中 | R134: 5.17年 | S134: 3.18年 | T134: 2.75 | U134: 4.7 | V134: 1.4999999999999999e-002 | W134: 0.10199999999999999 | X134: 9.1999999999999998e-002 | Y134: 27 | Z134: 2.3 | AA134: 1.95e-002 | AB134: 1.23e-002 | AC134: -1.6299999999999999e-002 | AD134: -1.8600000000000002e-002 | AE134: 84.69 | AF134: 88.34 | AG134: 0.55 | AH134: AA- | AI134: 6.4600000000000005e-002 | AJ134: =H134+100*O134 -> 131.94 | AK134: 129.8 | AL134: 139 | AM134: 41.4 | AN134: 187 | AO134: -0.183 | AP134: 10 | AQ134: 法兰转债
A135: 45 | B135: 123092 | C135: 天壕转债 | D135: 300332 | E135: 天壕环境 | F135: 石油天然 | G135: 天然气 | H135: 109.465 | I135: -3.3e-003 | J135: 8.6e-003 | K135: 5.19 | L135: 7.8000000000000005e-003 | M135: 121.6 | N135: 5.2 | O135: 9.6999999999999989e-002 | P135: 99.81 | Q135: 33天 | R135: 5.57年 | S135: 3.58年 | T135: 4.23 | U135: 2.4 | V135: 5.0000000000000001e-003 | W135: 9.3000000000000013e-002 | X135: 9.1999999999999998e-002 | Y135: 46 | Z135: 1.36 | AA135: 1.95e-002 | AB135: 1.2699999999999999e-002 | AC135: -1.2199999999999999e-002 | AD135: -1.4499999999999999e-002 | AE135: 79.91 | AF135: 81.81 | AG135: 0.68 | AH135: A+ | AI135: 7.5600000000000001e-002 | AJ135: =H135+100*O135 -> 119.16500000000001 | AK135: 119.1 | AL135: 32 | AM135: 37.3 | AN135: 151 | AO135: 8.1000000000000003e-002 | AP135: 7 | AQ135: 天壕转债
A136: 256 | B136: 128070 | C136: 智能转债! | D136: 2877 | E136: 智能自控 | F136: 机械装备 | G136: 通用设备 | H136: 109.001 | I136: -6.6e-003 | J136: 5.1000000000000004e-003 | K136: 6.51 | L136: -4.5999999999999999e-003 | M136: 117.6 | N136: 9.51 | O136: 0.59200000000000008 | P136: 68.45 | Q136: 转股中 | R136: 4年34天 | S136: 无权 | T136: 2.3 | U136: 30 | V136: 0.11800000000000001 | W136: 0.106 | X136: 7.2999999999999995e-002 | Y136: 22 | Z136: 2.93 | AA136: 1.9199999999999998e-002 | AB136: 1.1399999999999999e-002 | AC136: 无权 | AD136: 无权 | AE136: 无权 | AF136: 88.39 | AG136: 0.32 | AH136: A+ | AI136: 7.4299999999999991e-002 | AJ136: =H136+100*O136 -> 168.20100000000002 | AK136: 149.5 | AL136: 289 | AM136: 61.2 | AN136: 297 | AO136: -2.e-003 | AP136: 30 | AQ136: 智能转债!
A137: 176 | B137: 123050 | C137: 聚飞转债 | D137: 300303 | E137: 聚飞光电 | F137: 电子 | G137: LED制 | H137: 113.186 | I137: -1.9e-003 | J137: -3.5999999999999999e-003 | K137: 4.85 | L137: -1.0200000000000001e-002 | M137: 123.8 | N137: 5.18 | O137: 0.20899999999999999 | P137: 93.63 | Q137: 转股中 | R137: 4.88年 | S137: 2.88年 | T137: 7.05 | U137: 4 | V137: 5.0000000000000001e-003 | W137: 0.114 | X137: 0.106 | Y137: 62 | Z137: 2.52 | AA137: 1.89e-002 | AB137: 1.06e-002 | AC137: -2.8500000000000001e-002 | AD137: -3.0800000000000001e-002 | AE137: 86.19 | AF137: 92.34 | AG137: 0.54 | AH137: AA- | AI137: 6.3299999999999995e-002 | AJ137: =H137+100*O137 -> 134.08600000000001 | AK137: 132.7 | AL137: 173 | AM137: 40.4 | AN137: 176 | AO137: 6.0000000000000001e-003 | AP137: 12 | AQ137: 聚飞转债
A138: 150 | B138: 123057 | C138: 美联转债! | D138: 300586 | E138: 美联新材 | F138: 化工 | G138: 橡胶塑料 | H138: 107.699 | I138: -5.9999999999999995e-004 | J138: -8.5000000000000006e-003 | K138: 8.19 | L138: -1.8000000000000002e-002 | M138: 118.2 | N138: 9.91 | O138: 0.30299999999999999 | P138: 82.64 | Q138: 转股中 | R138: 5年33天 | S138: 3年34天 | T138: 2.07 | U138: 83 | V138: 0.37200000000000005 | W138: 5.5e-002 | X138: 4.5999999999999999e-002 | Y138: 37 | Z138: 5.03 | AA138: 1.89e-002 | AB138: 1.24e-002 | AC138: -1.04e-002 | AD138: -1.2800000000000001e-002 | AE138: 85.13 | AF138: 86.62 | AG138: 0.5 | AH138: AA- | AI138: 6.4600000000000005e-002 | AJ138: =H138+100*O138 -> 137.999 | AK138: 132.8 | AL138: 174 | AM138: 46.1 | AN138: 228 | AO138: 4.9000000000000002e-002 | AP138: 18 | AQ138: 美联转债!
A139: 64 | B139: 128140 | C139: 润建转债! | D139: 2929 | E139: 润建股份 | F139: 通信互联 | G139: 通信设备 | H139: 104.1 | I139: 2.5999999999999999e-003 | J139: -7.4999999999999997e-003 | K139: 23.25 | L139: -1.0200000000000001e-002 | M139: 115.2 | N139: 26.55 | O139: 0.18899999999999997 | P139: 87.57 | Q139: 14天 | R139: 5.53年 | S139: 3.53年 | T139: 10.9 | U139: 14 | V139: 1.2e-002 | W139: 0.21199999999999999 | X139: 0.18600000000000003 | Y139: 51 | Z139: 1.62 | AA139: 1.89e-002 | AB139: 1.38e-002 | AC139: -1.e-003 | AD139: -3.0000000000000001e-003 | AE139: 88.7 | AF139: 91.41 | AG139: 0.48 | AH139: AA | AI139: 4.36e-002 | AJ139: =H139+100*O139 -> 123. | AK139: 120.6 | AL139: 44 | AM139: 29.2 | AN139: 58 | AO139: -3.0000000000000001e-003 | AP139: 14 | AQ139: 润建转债!
A140: 213 | B140: 128093 | C140: 百川转债! | D140: 2455 | E140: 百川股份 | F140: 化工 | G140: 化工 | H140: 119.61 | I140: -7.8000000000000005e-003 | J140: -1.8e-003 | K140: 6.61 | L140: -1.49e-002 | M140: 129.8 | N140: 5.77 | O140: 4.4000000000000004e-002 | P140: 114.56 | Q140: 转股中 | R140: 4.60年 | S140: 2.60年 | T140: 4 | U140: 280 | V140: 0.57700000000000007 | W140: 0.11599999999999999 | X140: 0.13300000000000001 | Y140: 34 | Z140: 2.52 | AA140: 1.8600000000000002e-002 | AB140: 7.8000000000000005e-003 | AC140: -4.0500000000000001e-002 | AD140: -4.4900000000000002e-002 | AE140: 90.45 | AF140: 98.87 | AG140: 0.64 | AH140: AA- | AI140: 6.3299999999999995e-002 | AJ140: =H140+100*O140 -> 124.01000000000001 | AK140: 124.7 | AL140: 78 | AM140: 25.8 | AN140: 32 | AO140: -9.0999999999999998e-002 | AP140: 49 | AQ140: 百川转债!
A141: 93 | B141: 123071 | C141: 天能转债! | D141: 300569 | E141: 天能重工 | F141: 能源电力 | G141: 风能 | H141: 110.428 | I141: -3.7000000000000002e-003 | J141: 4.1999999999999997e-003 | K141: 13.71 | L141: 7.000000000000001e-004 | M141: 121.1 | N141: 13.4 | O141: 7.9000000000000001e-002 | P141: 102.31 | Q141: 转股中 | R141: 5.40年 | S141: 3.40年 | T141: 7 | U141: 10 | V141: 1.3000000000000001e-002 | W141: 0.128 | X141: 0.13100000000000001 | Y141: 55 | Z141: 2.31 | AA141: 1.7600000000000001e-002 | AB141: 1.0800000000000001e-002 | AC141: -1.6799999999999999e-002 | AD141: -1.89e-002 | AE141: 83.41 | AF141: 87.01 | AG141: 0.65 | AH141: AA- | AI141: 6.4600000000000005e-002 | AJ141: =H141+100*O141 -> 118.328 | AK141: 118.5 | AL141: 28 | AM141: 31.5 | AN141: 85 | AO141: 2.1000000000000001e-002 | AP141: 12 | AQ141: 天能转债!
A142: 239 | B142: 127014 | C142: 北方转债! | D142: 65 | E142: 北方国际 | F142: 建筑 | G142: 建筑工程 | H142: 106.85 | I142: -2.7000000000000001e-003 | J142: -1.7000000000000001e-003 | K142: 7.82 | L142: -1.01e-002 | M142: 115.1 | N142: 8.75 | O142: 0.19600000000000001 | P142: 89.37 | Q142: 转股中 | R142: 4.41年 | S142: 2.41年 | T142: 5.35 | U142: 6.6 | V142: 1.2e-002 | W142: 8.900000000000001e-002 | X142: 7.9000000000000001e-002 | Y142: 60 | Z142: 1.08 | AA142: 1.7399999999999999e-002 | AB142: 1.11e-002 | AC142: -1.21e-002 | AD142: -1.47e-002 | AE142: 93.7 | AF142: 97.09 | AG142: 0.43 | AH142: AA+ | AI142: 4.0300000000000002e-002 | AJ142: =H142+100*O142 -> 126.44999999999999 | AK142: 124.3 | AL142: 75 | AM142: 27.2 | AN142: 42 | AO142: 4.0000000000000001e-003 | AP142: 19 | AQ142: 北方转债!
A143: 62 | B143: 127026 | C143: 超声转债! | D143: 823 | E143: 超声电子 | F143: 电子 | G143: 元器件制 | H143: 103 | I143: 9.3999999999999986e-003 | J143: -1.6200000000000003e-002 | K143: 10.52 | L143: -1.5900000000000001e-002 | M143: 113.1 | N143: 12.85 | O143: 0.25800000000000001 | P143: 81.87 | Q143: 17天 | R143: 5.53年 | S143: 3.53年 | T143: 7 | U143: 26 | V143: 3.6000000000000004e-002 | W143: 0.124 | X143: 0.10099999999999999 | Y143: 56 | Z143: 1.47 | AA143: 1.7399999999999999e-002 | AB143: 1.3000000000000001e-002 | AC143: 1.6000000000000001e-003 | AD143: -2.9999999999999997e-004 | AE143: 88.6 | AF143: 89.72 | AG143: 0.43 | AH143: AA | AI143: 4.36e-002 | AJ143: =H143+100*O143 -> 128.80000000000001 | AK143: 124.1 | AL143: 74 | AM143: 34.4 | AN143: 116 | AO143: 6.0000000000000001e-003 | AP143: 11 | AQ143: 超声转债!
A144: 157 | B144: 128114 | C144: 正邦转债 | D144: 2157 | E144: 正邦科技 | F144: 农业 | G144: 畜牧业 | H144: 106.245 | I144: -7.0999999999999995e-003 | J144: 8.3000000000000001e-003 | K144: 13.01 | L144: 3.0999999999999999e-003 | M144: 115.3 | N144: 15.46 | O144: 0.26300000000000001 | P144: 84.15 | Q144: 转股中 | R144: 5年19天 | S144: 3年20天 | T144: 16 | U144: 59 | V144: 3.5000000000000003e-002 | W144: 3.9e-002 | X144: 3.3000000000000002e-002 | Y144: 409 | Z144: 1.75 | AA144: 1.67e-002 | AB144: 1.11e-002 | AC144: -7.3000000000000001e-003 | AD144: -9.4999999999999998e-003 | AE144: 91.17 | AF144: 94.26 | AG144: 0.41 | AH144: AA+ | AI144: 4.1599999999999998e-002 | AJ144: =H144+100*O144 -> 132.54500000000002 | AK144: 128.3 | AL144: 120 | AM144: 34.1 | AN144: 110 | AO144: -5.4000000000000006e-002 | AP144: 16 | AQ144: 正邦转债
A145: 104 | B145: 128133 | C145: 奇正转债! | D145: 2287 | E145: 奇正藏药 | F145: 医药 | G145: 中药 | H145: 108.01 | I145: -5.4000000000000003e-003 | J145: -1.9e-003 | K145: 26.38 | L145: -1.6399999999999998e-002 | M145: 117.3 | N145: 30.12 | O145: 0.23300000000000001 | P145: 87.58 | Q145: 转股中 | R145: 5.32年 | S145: 3.32年 | T145: 8 | U145: 14 | V145: 1.6e-002 | W145: 5.7000000000000002e-002 | X145: 5.0000000000000003e-002 | Y145: 140 | Z145: 5.4 | AA145: 1.6e-002 | AB145: 1.01e-002 | AC145: -1.1399999999999999e-002 | AD145: -1.3500000000000002e-002 | AE145: 89.59 | AF145: 93.92 | AG145: 0.45 | AH145: AA | AI145: 4.36e-002 | AJ145: =H145+100*O145 -> 131.31 | AK145: 128.4 | AL145: 123 | AM145: 34.5 | AN145: 119 | AO145: 1.6e-002 | AP145: 15 | AQ145: 奇正转债!
A146: 4 | B146: 110080 | C146: 东湖转债 | D146: 600133 | E146: 东湖高新 | F146: 建筑 | G146: 建筑工程 | H146: 105.29 | I146: -4.5999999999999999e-003 | J146: 9.5999999999999992e-003 | K146: 6.05 | L146: 8.3000000000000001e-003 | M146: 115.1 | N146: 6.16 | O146: 7.2000000000000008e-002 | P146: 98.21 | Q146: 4月21天 | R146: 5.87年 | S146: 3.87年 | T146: 15.5 | U146: 66 | V146: 4.0999999999999995e-002 | W146: 0.32200000000000001 | X146: 0.316 | Y146: 48 | Z146: 0.89 | AA146: 1.55e-002 | AB146: 1.0800000000000001e-002 | AC146: -4.0000000000000001e-003 | AD146: -5.6999999999999993e-003 | AE146: 87.31 | AF146: 89.98 | AG146: 0.6 | AH146: AA | AI146: 4.36e-002 | AJ146: =H146+100*O146 -> 112.49000000000001 | AK146: 112.4 | AL146: 8 | AM146: 22.4 | AN146: 16 | AO146: 4.8000000000000001e-002 | AP146: 12 | AQ146: 东湖转债
A147: 55 | B147: 113044 | C147: 大秦转债! | D147: 601006 | E147: 大秦铁路 | F147: 铁路 | G147: 铁路运输 | H147: 105.09 | I147: 1.6000000000000001e-003 | J147: -1.6000000000000001e-003 | K147: 6.93 | L147: 0. | M147: 114.1 | N147: 7.66 | O147: 0.16200000000000001 | P147: 90.47 | Q147: 21天 | R147: 5.55年 | S147: 3.55年 | T147: 320 | U147: 246 | V147: 6.9999999999999993e-003 | W147: 0.311 | X147: 0.28100000000000003 | Y147: 1030. | Z147: 0.85 | AA147: 1.52e-002 | AB147: 1.0500000000000001e-002 | AC147: -3.0000000000000001e-003 | AD147: -5.0000000000000001e-003 | AE147: 90.4 | AF147: 92.87 | AG147: 0.5 | AH147: AAA | AI147: 3.8599999999999995e-002 | AJ147: =H147+100*O147 -> 121.29000000000001 | AK147: 119.7 | AL147: 35 | AM147: 26.8 | AN147: 41 | AO147: -1.e-003 | AP147: 14 | AQ147: 大秦转债!
A148: 325 | B148: 127006 | C148: 敖东转债! | D148: 623 | E148: 吉林敖东 | F148: 金融 | G148: 证券行业 | H148: 103.04 | I148: 3.9000000000000003e-003 | J148: -1.4000000000000002e-003 | K148: 15.81 | L148: 1.2199999999999999e-002 | M148: 107.4 | N148: 20.42 | O148: 0.33100000000000002 | P148: 77.42 | Q148: 转股中 | R148: 2.79年 | S148: 0.79年 | T148: 24.1 | U148: 10 | V148: 4.0000000000000001e-003 | W148: 0.13100000000000001 | X148: 0.10099999999999999 | Y148: 184 | Z148: 0.8 | AA148: 1.5100000000000001e-002 | AB148: 1.e-002 | AC148: -2.e-002 | AD148: -2.2200000000000001e-002 | AE148: 97.47 | AF148: 96.74 | AG148: 0.21 | AH148: AA+ | AI148: 3.8599999999999995e-002 | AJ148: =H148+100*O148 -> 136.14000000000001 | AK148: 128.7 | AL148: 127 | AM148: 31.2 | AN148: 80 | AO148: 2.8999999999999998e-002 | AP148: 27 | AQ148: 敖东转债!
A149: 270 | B149: 113024 | C149: 核建转债! | D149: 601611 | E149: 中国核建 | F149: 建筑 | G149: 建筑工程 | H149: 103.32 | I149: -2.5999999999999999e-003 | J149: 1.e-004 | K149: 7.24 | L149: -1.09e-002 | M149: 109.3 | N149: 9.76 | O149: 0.39299999999999996 | P149: 74.18 | Q149: 转股中 | R149: 3.86年 | S149: 1.86年 | T149: 30 | U149: 11 | V149: 3.0000000000000001e-003 | W149: 0.156 | X149: 0.11599999999999999 | Y149: 192 | Z149: 1.62 | AA149: 1.4999999999999999e-002 | AB149: 1.03e-002 | AC149: -2.5000000000000001e-003 | AD149: -5.1999999999999998e-003 | AE149: 95.49 | AF149: 95.14 | AG149: 0.23 | AH149: AAA | AI149: 3.73e-002 | AJ149: =H149+100*O149 -> 142.62 | AK149: 132.5 | AL149: 169 | AM149: 37 | AN149: 144 | AO149: -3.6000000000000004e-002 | AP149: 38 | AQ149: 核建转债!
A150: 320 | B150: 128039 | C150: 三力转债! | D150: 2224 | E150: 三 力 士 | F150: 机械装备 | G150: 专用设备 | H150: 105.1 | I150: -1.e-003 | J150: 2.3999999999999998e-003 | K150: 4.82 | L150: 4.1999999999999997e-003 | M150: 109.8 | N150: 5.81 | O150: 0.26700000000000002 | P150: 82.96 | Q150: 转股中 | R150: 3年10天 | S150: 1年11天 | T150: 2.03 | U150: 5.6 | V150: 2.6000000000000002e-002 | W150: 5.7999999999999996e-002 | X150: 4.8000000000000001e-002 | Y150: 35 | Z150: 1.53 | AA150: 1.49e-002 | AB150: 8.6999999999999994e-003 | AC150: -2.0499999999999997e-002 | AD150: -2.46e-002 | AE150: 95.37 | AF150: 91.55 | AG150: 0.35 | AH150: AA- | AI150: 6.3299999999999995e-002 | AJ150: =H150+100*O150 -> 131.80000000000001 | AK150: 127.2 | AL150: 110 | AM150: 31.9 | AN150: 88 | AO150: -4.2999999999999997e-002 | AP150: 28 | AQ150: 三力转债!
A151: 156 | B151: 113588 | C151: 润达转债! | D151: 603108 | E151: 润达医疗 | F151: 医药 | G151: 医疗器械 | H151: 106.21 | I151: -1.8799999999999997e-002 | J151: 9.8999999999999991e-003 | K151: 11.07 | L151: -2.12e-002 | M151: 114.2 | N151: 13.36 | O151: 0.28199999999999997 | P151: 82.86 | Q151: 转股中 | R151: 5年19天 | S151: 3年20天 | T151: 5.5 | U151: 4.8 | V151: 8.0000000000000002e-003 | W151: 8.5999999999999993e-002 | X151: 7.0999999999999994e-002 | Y151: 64 | Z151: 2.01 | AA151: 1.4800000000000001e-002 | AB151: 9.5999999999999992e-003 | AC151: -7.4999999999999997e-003 | AD151: -9.7000000000000003e-003 | AE151: 90.52 | AF151: 92.47 | AG151: 0.42 | AH151: AA | AI151: 4.36e-002 | AJ151: =H151+100*O151 -> 134.41 | AK151: 129.6 | AL151: 138 | AM151: 37.1 | AN151: 147 | AO151: -4.8000000000000001e-002 | AP151: 10 | AQ151: 润达转债!
A152: 146 | B152: 110071 | C152: 湖盐转债! | D152: 600929 | E152: 雪天盐业 | F152: 食品饮料 | G152: 食品饮料 | H152: 107.07 | I152: -1.1999999999999999e-003 | J152: 8.3000000000000001e-003 | K152: 6.36 | L152: 1.2699999999999999e-002 | M152: 115.2 | N152: 6.6 | O152: 0.111 | P152: 96.36 | Q152: 转股中 | R152: 5年42天 | S152: 3年43天 | T152: 7.2 | U152: 6.1 | V152: 8.0000000000000002e-003 | W152: 0.12300000000000001 | X152: 0.11900000000000001 | Y152: 58 | Z152: 2.2 | AA152: 1.47e-002 | AB152: 9.300000000000001e-003 | AC152: -9.7999999999999997e-003 | AD152: -1.1899999999999999e-002 | AE152: 90.27 | AF152: 93.02 | AG152: 0.55 | AH152: AA | AI152: 4.36e-002 | AJ152: =H152+100*O152 -> 118.16999999999999 | AK152: 117.8 | AL152: 25 | AM152: 24.8 | AN152: 28 | AO152: 3.1e-002 | AP152: 18 | AQ152: 湖盐转债!
A153: 129 | B153: 123062 | C153: 三超转债 | D153: 300554 | E153: 三超新材 | F153: 机械装备 | G153: 通用设备 | H153: 111.459 | I153: -1.47e-002 | J153: -1.3000000000000001e-002 | K153: 16.72 | L153: -3.9599999999999996e-002 | M153: 119.7 | N153: 17.17 | O153: 0.14499999999999999 | P153: 97.38 | Q153: 转股中 | R153: 5年59天 | S153: 3.16年 | T153: 1.95 | U153: 61 | V153: 0.27899999999999997 | W153: 0.125 | X153: 0.121 | Y153: 16 | Z153: 2.99 | AA153: 1.43e-002 | AB153: 7.4999999999999997e-003 | AC153: -1.9e-002 | AD153: -2.1600000000000001e-002 | AE153: 79.88 | AF153: 79.22 | AG153: 0.7 | AH153: A | AI153: 8.5600000000000009e-002 | AJ153: =H153+100*O153 -> 125.959 | AK153: 125.5 | AL153: 90 | AM153: 45.7 | AN153: 221 | AO153: 5.9000000000000004e-002 | AP153: 20 | AQ153: 三超转债
A154: 114 | B154: 113039 | C154: 嘉泽转债! | D154: 601619 | E154: 嘉泽新能 | F154: 能源电力 | G154: 风能 | H154: 105.12 | I154: -1.03e-002 | J154: -2.7000000000000001e-003 | K154: 3.43 | L154: -2.2799999999999997e-002 | M154: 113.1 | N154: 3.57 | O154: 9.4e-002 | P154: 96.08 | Q154: 转股中 | R154: 5.24年 | S154: 3.24年 | T154: 11.8 | U154: 25 | V154: 2.e-002 | W154: 0.159 | X154: 0.152 | Y154: 75 | Z154: 1.99 | AA154: 1.43e-002 | AB154: 9.7000000000000003e-003 | AC154: -4.3e-003 | AD154: -6.3e-003 | AE154: 89.7 | AF154: 90.84 | AG154: 0.57 | AH154: AA | AI154: 4.36e-002 | AJ154: =H154+100*O154 -> 114.52000000000001 | AK154: 114.2 | AL154: 9 | AM154: 23.3 | AN154: 22 | AO154: -8.0000000000000002e-003 | AP154: 32 | AQ154: 嘉泽转债!
A155: 252 | B155: 128071 | C155: 合兴转债! | D155: 2228 | E155: 合兴包装 | F155: 造纸包装 | G155: 包装材料 | H155: 108.58 | I155: -3.9000000000000003e-003 | J155: 2.7000000000000001e-003 | K155: 3.88 | L155: -2.5999999999999999e-003 | M155: 114.8 | N155: 4.28 | O155: 0.19800000000000001 | P155: 90.65 | Q155: 转股中 | R155: 4.22年 | S155: 2.22年 | T155: 3 | U155: 7.6 | V155: 2.4e-002 | W155: 6.2e-002 | X155: 5.7000000000000002e-002 | Y155: 48 | Z155: 1.39 | AA155: 1.3600000000000001e-002 | AB155: 7.1999999999999998e-003 | AC155: -2.0899999999999998e-002 | AD155: -2.35e-002 | AE155: 93.67 | AF155: 96.75 | AG155: 0.45 | AH155: AA | AI155: 4.2300000000000004e-002 | AJ155: =H155+100*O155 -> 128.38 | AK155: 126.5 | AL155: 98 | AM155: 29.8 | AN155: 68 | AO155: 2.5000000000000001e-002 | AP155: 25 | AQ155: 合兴转债!
A156: 101 | B156: 113604 | C156: 多伦转债! | D156: 603528 | E156: 多伦科技 | F156: 计算机及 | G156: 软件开发 | H156: 109.67 | I156: -7.1999999999999998e-003 | J156: 5.8999999999999999e-003 | K156: 9.65 | L156: -2.0999999999999999e-003 | M156: 117.3 | N156: 10.44 | O156: 0.18600000000000003 | P156: 92.43 | Q156: 转股中 | R156: 5.38年 | S156: 3.38年 | T156: 6.4 | U156: 11 | V156: 1.6e-002 | W156: 0.106 | X156: 9.8000000000000004e-002 | Y156: 60 | Z156: 3.64 | AA156: 1.2800000000000001e-002 | AB156: 7.0999999999999995e-003 | AC156: -1.55e-002 | AD156: -1.7600000000000001e-002 | AE156: 83.35 | AF156: 84.37 | AG156: 0.61 | AH156: AA- | AI156: 6.4600000000000005e-002 | AJ156: =H156+100*O156 -> 128.27000000000001 | AK156: 126.9 | AL156: 107 | AM156: 42.5 | AN156: 198 | AO156: 7.8e-002 | AP156: 7 | AQ156: 多伦转债!
A157: 85 | B157: 123075 | C157: 贝斯转债! | D157: 300580 | E157: 贝斯特 | F157: 汽车 | G157: 零部件制 | H157: 108.188 | I157: -1.7000000000000001e-003 | J157: 1.95e-002 | K157: 19.73 | L157: 3.3000000000000002e-002 | M157: 115.5 | N157: 23.74 | O157: 0.30199999999999999 | P157: 83.11 | Q157: 转股中 | R157: 5.43年 | S157: 3.43年 | T157: 6 | U157: 6.6 | V157: 1.e-002 | W157: 0.152 | X157: 0.126 | Y157: 39 | Z157: 2.29 | AA157: 1.24e-002 | AB157: 7.1999999999999998e-003 | AC157: -1.1399999999999999e-002 | AD157: -1.3500000000000002e-002 | AE157: 83.09 | AF157: 82.81 | AG157: 0.54 | AH157: AA- | AI157: 6.4600000000000005e-002 | AJ157: =H157+100*O157 -> 138.38800000000001 | AK157: 133.3 | AL157: 178 | AM157: 50.2 | AN157: 241 | AO157: 5.9000000000000004e-002 | AP157: 8 | AQ157: 贝斯转债!
A158: 319 | B158: 128040 | C158: 华通转债! | D158: 2758 | E158: 浙农股份 | F158: 医药 | G158: 医药商业 | H158: 108.275 | I158: -3.0000000000000001e-003 | J158: 1.4000000000000002e-003 | K158: 9.75 | L158: -3.0999999999999999e-003 | M158: 112.3 | N158: 10.33 | O158: 0.14699999999999999 | P158: 94.39 | Q158: 转股中 | R158: 3年16天 | S158: 1年17天 | T158: 2.22 | U158: 2.9 | V158: 1.2e-002 | W158: 4.7e-002 | X158: 4.4000000000000004e-002 | Y158: 48 | Z158: 1.58 | AA158: 1.23e-002 | AB158: 4.7999999999999996e-003 | AC158: -4.2300000000000004e-002 | AD158: -4.6600000000000003e-002 | AE158: 95.51 | AF158: 93.57 | AG158: 0.52 | AH158: AA- | AI158: 6.3299999999999995e-002 | AJ158: =H158+100*O158 -> 122.97500000000001 | AK158: 122.2 | AL158: 64 | AM158: 26.7 | AN158: 38 | AO158: -3.1e-002 | AP158: 31 | AQ158: 华通转债!
A159: 219 | B159: 113030 | C159: 东风转债! | D159: 601515 | E159: 东风股份 | F159: 造纸包装 | G159: 包装材料 | H159: 110.74 | I159: -2.2200000000000001e-002 | J159: 5.8999999999999999e-003 | K159: 6.13 | L159: -3.3099999999999997e-002 | M159: 116.9 | N159: 6.45 | O159: 0.16500000000000001 | P159: 95.04 | Q159: 转股中 | R159: 4.57年 | S159: 2.58年 | T159: 2.95 | U159: 21 | V159: 6.2e-002 | W159: 3.6000000000000004e-002 | X159: 3.4000000000000002e-002 | Y159: 82 | Z159: 1.77 | AA159: 1.21e-002 | AB159: 5.5000000000000005e-003 | AC159: -2.4900000000000002e-002 | AD159: -2.7200000000000002e-002 | AE159: 92.4 | AF159: 97.08 | AG159: 0.49 | AH159: AA | AI159: 4.2300000000000004e-002 | AJ159: =H159+100*O159 -> 127.23999999999999 | AK159: 126.4 | AL159: 95 | AM159: 29.4 | AN159: 60 | AO159: -8.6999999999999994e-002 | AP159: 17 | AQ159: 东风转债!
A160: 24 | B160: 123102 | C160: 华自转债 | D160: 300490 | E160: 华自科技 | F160: 机械装备 | G160: 机器人及 | H160: 118.599 | I160: 2.4199999999999999e-002 | J160: -1.4000000000000002e-003 | K160: 10.98 | L160: 3.2000000000000001e-002 | M160: 126.9 | N160: 9.26 | O160: 0. | P160: 118.57 | Q160: 3月23天 | R160: 5.79年 | S160: 3.79年 | T160: 6.7 | U160: 329 | V160: 0.41499999999999998 | W160: 0.23800000000000002 | X160: 0.28199999999999997 | Y160: 28 | Z160: 1.61 | AA160: 1.2e-002 | AB160: 4.3e-003 | AC160: -3.0600000000000002e-002 | AD160: -3.2899999999999999e-002 | AE160: 82.17 | AF160: 89.08 | AG160: 0.71 | AH160: AA- | AI160: 6.4600000000000005e-002 | AJ160: =H160+100*O160 -> 118.599 | AK160: 118.6 | AL160: 29 | AM160: 29.5 | AN160: 62 | AO160: 0.154 | AP160: 18 | AQ160: 华自转债
A161: 13 | B161: 123107 | C161: 温氏转债! | D161: 300498 | E161: 温氏股份 | F161: 农业 | G161: 畜牧业 | H161: 105.501 | I161: -9.8999999999999991e-003 | J161: 4.5000000000000005e-003 | K161: 14.07 | L161: -1.3999999999999999e-002 | M161: 113 | N161: 17.82 | O161: 0.33600000000000002 | P161: 78.96 | Q161: 4月13天 | R161: 5.83年 | S161: 3.84年 | T161: 93 | U161: 46 | V161: 5.0000000000000001e-003 | W161: 0.10400000000000001 | X161: 8.199999999999999e-002 | Y161: 897 | Z161: 1.95 | AA161: 1.2e-002 | AB161: 7.9000000000000008e-003 | AC161: -4.7999999999999996e-003 | AD161: -6.5000000000000006e-003 | AE161: 89.04 | AF161: 90.94 | AG161: 0.39 | AH161: AAA | AI161: 3.8599999999999995e-002 | AJ161: =H161+100*O161 -> 139.101 | AK161: 132 | AL161: 164 | AM161: 41.1 | AN161: 184 | AO161: 2.e-003 | AP161: 9 | AQ161: 温氏转债!
A162: 89 | B162: 123073 | C162: 同和转债! | D162: 300636 | E162: 同和药业 | F162: 医药 | G162: 原料药 | H162: 115 | I162: -7.7000000000000002e-003 | J162: 2.0000000000000001e-004 | K162: 16.22 | L162: -1.04e-002 | M162: 122.4 | N162: 14.82 | O162: 5.0999999999999997e-002 | P162: 109.45 | Q162: 转股中 | R162: 5.41年 | S162: 3.41年 | T162: 3.59 | U162: 6.3 | V162: 1.4999999999999999e-002 | W162: 0.10800000000000001 | X162: 0.11800000000000001 | Y162: 33 | Z162: 2.66 | AA162: 1.1899999999999999e-002 | AB162: 4.6999999999999993e-003 | AC162: -2.6499999999999999e-002 | AD162: -2.8799999999999999e-002 | AE162: 80.83 | AF162: 83.3 | AG162: 0.73 | AH162: A+ | AI162: 7.5600000000000001e-002 | AJ162: =H162+100*O162 -> 120.09999999999999 | AK162: 120.6 | AL162: 42 | AM162: 37.2 | AN162: 150 | AO162: -0.30499999999999999 | AP162: 11 | AQ162: 同和转债!
A163: 193 | B163: 123045 | C163: 雷迪转债 | D163: 300652 | E163: 雷迪克 | F163: 汽车 | G163: 零部件制 | H163: 112.54 | I163: 5.5000000000000005e-003 | J163: 1.1599999999999999e-002 | K163: 18.38 | L163: 2.8500000000000001e-002 | M163: 118.9 | N163: 20.13 | O163: 0.23300000000000001 | P163: 91.31 | Q163: 转股中 | R163: 4.79年 | S163: 2.79年 | T163: 1.66 | U163: 61 | V163: 0.32500000000000001 | W163: 9.6000000000000002e-002 | X163: 8.8000000000000009e-002 | Y163: 17 | Z163: 1.82 | AA163: 1.18e-002 | AB163: 4.7999999999999996e-003 | AC163: -2.64e-002 | AD163: -2.8900000000000002e-002 | AE163: 84.39 | AF163: 85.04 | AG163: 0.6 | AH163: A+ | AI163: 7.4299999999999991e-002 | AJ163: =H163+100*O163 -> 135.84 | AK163: 133.8 | AL163: 181 | AM163: 48.7 | AN163: 237 | AO163: 3.7999999999999999e-002 | AP163: 34 | AQ163: 雷迪转债
A164: 216 | B164: 128090 | C164: 汽模转2 | D164: 2510 | E164: 天汽模 | F164: 汽车 | G164: 零部件制 | H164: 109.071 | I164: -6.6e-003 | J164: 2.9999999999999997e-004 | K164: 4.05 | L164: -1.2199999999999999e-002 | M164: 114.9 | N164: 4.21 | O164: 0.13400000000000001 | P164: 96.2 | Q164: 转股中 | R164: 4.58年 | S164: 2.58年 | T164: 3.1 | U164: 12 | V164: 3.6000000000000004e-002 | W164: 8.0000000000000002e-002 | X164: 7.6999999999999999e-002 | Y164: 39 | Z164: 1.89 | AA164: 1.1699999999999999e-002 | AB164: 5.6999999999999993e-003 | AC164: -1.9400000000000001e-002 | AD164: -2.1700000000000001e-002 | AE164: 92.37 | AF164: 95.4 | AG164: 0.52 | AH164: AA | AI164: 4.2300000000000004e-002 | AJ164: =H164+100*O164 -> 122.471 | AK164: 121.9 | AL164: 61 | AM164: 26.5 | AN164: 37 | AO164: -1.6e-002 | AP164: 28 | AQ164: 汽模转2
A165: 132 | B165: 128122 | C165: 兴森转债! | D165: 2436 | E165: 兴森科技 | F165: 电子 | G165: 元器件制 | H165: 108.35 | I165: 1.26e-002 | J165: -3.5999999999999999e-003 | K165: 9.72 | L165: 4.8499999999999995e-002 | M165: 113.3 | N165: 14.18 | O165: 0.58099999999999996 | P165: 68.55 | Q165: 转股中 | R165: 4年55天 | S165: 3年56天 | T165: 2.69 | U165: 12 | V165: 4.0999999999999995e-002 | W165: 1.9e-002 | X165: 1.3000000000000001e-002 | Y165: 145 | Z165: 4.51 | AA165: 1.1000000000000001e-002 | AB165: 5.1000000000000004e-003 | AC165: -1.34e-002 | AD165: -1.55e-002 | AE165: 90.44 | AF165: 95.62 | AG165: 0.19 | AH165: AA | AI165: 4.2300000000000004e-002 | AJ165: =H165+100*O165 -> 166.44999999999999 | AK165: 148.2 | AL165: 278 | AM165: 52.5 | AN165: 255 | AO165: 8.6999999999999994e-002 | AP165: 12 | AQ165: 兴森转债!
A166: 26 | B166: 123101 | C166: 拓斯转债! | D166: 300607 | E166: 拓斯达 | F166: 机械装备 | G166: 机器人及 | H166: 108.52 | I166: 6.7000000000000002e-003 | J166: 1.5e-003 | K166: 33.1 | L166: 2.1000000000000001e-002 | M166: 115.1 | N166: 42.25 | O166: 0.38500000000000001 | P166: 78.34 | Q166: 3月21天 | R166: 5.78年 | S166: 3.78年 | T166: 6.7 | U166: 14 | V166: 1.8000000000000002e-002 | W166: 7.5999999999999998e-002 | X166: 5.9999999999999998e-002 | Y166: 88 | Z166: 3.92 | AA166: 1.04e-002 | AB166: 5.6999999999999993e-003 | AC166: -1.18e-002 | AD166: -1.3500000000000002e-002 | AE166: 87.65 | AF166: 90.33 | AG166: 0.39 | AH166: AA | AI166: 4.36e-002 | AJ166: =H166+100*O166 -> 147.01999999999998 | AK166: 138.7 | AL166: 234 | AM166: 48.4 | AN166: 235 | AO166: 3.1e-002 | AP166: 4 | AQ166: 拓斯转债!
A167: 229 | B167: 128081 | C167: 海亮转债! | D167: 2203. | E167: 海亮股份 | F167: 有色金属 | G167: 铜金属 | H167: 109.874 | I167: -2.8000000000000004e-003 | J167: 4.5999999999999999e-003 | K167: 10.27 | L167: 2.8999999999999998e-003 | M167: 114.9 | N167: 9.76 | O167: 4.4000000000000004e-002 | P167: 105.23 | Q167: 转股中 | R167: 4.48年 | S167: 2.49年 | T167: 30.1 | U167: 16 | V167: 5.0000000000000001e-003 | W167: 0.14999999999999999 | X167: 0.157 | Y167: 201 | Z167: 2.12 | AA167: 1.0200000000000001e-002 | AB167: 4.1999999999999997e-003 | AC167: -2.29e-002 | AD167: -2.53e-002 | AE167: 92.75 | AF167: 95.79 | AG167: 0.61 | AH167: AA | AI167: 4.2300000000000004e-002 | AJ167: =H167+100*O167 -> 114.274 | AK167: 114.5 | AL167: 11 | AM167: 18.7 | AN167: 8 | AO167: -2.2000000000000002e-002 | AP167: 52 | AQ167: 海亮转债!
A168: 141 | B168: 128121 | C168: 宏川转债! | D168: 2930 | E168: 宏川智慧 | F168: 交通运输 | G168: 物流业 | H168: 107.65 | I168: -9.1999999999999998e-003 | J168: 5.9999999999999995e-004 | K168: 15.2 | L168: -2.e-002 | M168: 113.3 | N168: 20.25 | O168: 0.434 | P168: 75.06 | Q168: 转股中 | R168: 5年49天 | S168: 3年50天 | T168: 6.7 | U168: 4.1 | V168: 6.0000000000000001e-003 | W168: 9.9000000000000005e-002 | X168: 7.4999999999999997e-002 | Y168: 67 | Z168: 3.26 | AA168: 1.0200000000000001e-002 | AB168: 5.4000000000000003e-003 | AC168: -1.11e-002 | AD168: -1.3300000000000001e-002 | AE168: 84.61 | AF168: 82.75 | AG168: 0.43 | AH168: AA- | AI168: 6.4600000000000005e-002 | AJ168: =H168+100*O168 -> 151.05000000000001 | AK168: 140.2 | AL168: 244 | AM168: 55.6 | AN168: 276 | AO168: -5.0000000000000003e-002 | AP168: 5 | AQ168: 宏川转债!
A169: 48 | B169: 123089 | C169: 九洲转2! | D169: 300040 | E169: 九洲集团 | F169: 能源电力 | G169: 电力设备 | H169: 114.6 | I169: 0. | J169: 4.7999999999999996e-003 | K169: 8.95 | L169: 6.7000000000000002e-003 | M169: 121 | N169: 8 | O169: 2.4e-002 | P169: 111.87 | Q169: 28天 | R169: 5.56年 | S169: 3.57年 | T169: 5 | U169: 16 | V169: 2.7999999999999997e-002 | W169: 0.14699999999999999 | X169: 0.16399999999999998 | Y169: 34 | Z169: 1.53 | AA169: 1.e-002 | AB169: 3.4999999999999996e-003 | AC169: -2.6099999999999998e-002 | AD169: -2.7999999999999997e-002 | AE169: 82.46 | AF169: 86.02 | AG169: 0.71 | AH169: AA- | AI169: 6.4600000000000005e-002 | AJ169: =H169+100*O169 -> 117. | AK169: 117.3 | AL169: 23 | AM169: 31.3 | AN169: 82 | AO169: 5.2999999999999999e-002 | AP169: 20 | AQ169: 九洲转2!
A170: 218 | B170: 123038 | C170: 联得转债! | D170: 300545 | E170: 联得装备 | F170: 机械装备 | G170: 专用设备 | H170: 113.85 | I170: -2.8999999999999998e-003 | J170: -4.5999999999999999e-003 | K170: 21.46 | L170: -1.3300000000000001e-002 | M170: 118.6 | N170: 24.17 | O170: 0.28199999999999997 | P170: 88.79 | Q170: 转股中 | R170: 4.58年 | S170: 2.58年 | T170: 1.47 | U170: 27 | V170: 0.16200000000000001 | W170: 3.9e-002 | X170: 3.4000000000000002e-002 | Y170: 38 | Z170: 3.94 | AA170: 9.1999999999999998e-003 | AB170: 2.e-003 | AC170: -3.3300000000000003e-002 | AD170: -3.5900000000000001e-002 | AE170: 85.5 | AF170: 86.08 | AG170: 0.56 | AH170: A+ | AI170: 7.4299999999999991e-002 | AJ170: =H170+100*O170 -> 142.04999999999998 | AK170: 138.9 | AL170: 236 | AM170: 52.8 | AN170: 259 | AO170: 1.3000000000000001e-002 | AP170: 19 | AQ170: 联得转债!
A171: 335 | B171: 110041 | C171: 蒙电转债! | D171: 600863 | E171: 内蒙华电 | F171: 能源电力 | G171: 电力供应 | H171: 106.84 | I171: -1.9e-003 | J171: 4.0000000000000002e-004 | K171: 2.44 | L171: -4.0999999999999995e-003 | M171: 109.3 | N171: 2.69 | O171: 0.17800000000000002 | P171: 90.71 | Q171: 转股中 | R171: 2.57年 | S171: 0.57年 | T171: 18.7 | U171: 11 | V171: 5.0000000000000001e-003 | W171: 0.13200000000000001 | X171: 0.12 | Y171: 142 | Z171: 1.21 | AA171: 9.1000000000000004e-003 | AB171: 2.2000000000000001e-003 | AC171: -6.3700000000000007e-002 | AD171: -6.8199999999999997e-002 | AE171: 99.22 | AF171: 100.06 | AG171: 0.37 | AH171: AAA | AI171: 3.56e-002 | AJ171: =H171+100*O171 -> 124.64 | AK171: 123 | AL171: 69 | AM171: 22.9 | AN171: 19 | AO171: 6.0000000000000001e-003 | AP171: 11 | AQ171: 蒙电转债!
A172: 205 | B172: 113565 | C172: 宏辉转债 | D172: 603336 | E172: 宏辉果蔬 | F172: 农业 | G172: 农产品加 | H172: 112.94 | I172: -4.5000000000000005e-003 | J172: -2.e-003 | K172: 7.42 | L172: -1.0700000000000001e-002 | M172: 117.8 | N172: 7.64 | O172: 0.16300000000000001 | P172: 97.12 | Q172: 转股中 | R172: 4.75年 | S172: 2.75年 | T172: 2.25 | U172: 41 | V172: 0.159 | W172: 6.9000000000000006e-002 | X172: 6.7000000000000004e-002 | Y172: 33 | Z172: 2.39 | AA172: 9.1000000000000004e-003 | AB172: 2.5000000000000001e-003 | AC172: -2.9100000000000001e-002 | AD172: -3.1400000000000004e-002 | AE172: 86.88 | AF172: 88.59 | AG172: 0.61 | AH172: AA- | AI172: 6.3299999999999995e-002 | AJ172: =H172+100*O172 -> 129.24000000000001 | AK172: 128.8 | AL172: 129 | AM172: 40.2 | AN172: 174 | AO172: -0.13699999999999998 | AP172: 24 | AQ172: 宏辉转债
A173: 65 | B173: 123082 | C173: 北陆转债! | D173: 300016 | E173: 北陆药业 | F173: 医药 | G173: 化学制药 | H173: 115.883 | I173: -1.7000000000000001e-003 | J173: -2.e-003 | K173: 9.74 | L173: -5.1000000000000004e-003 | M173: 121.7 | N173: 8.8 | O173: 4.7e-002 | P173: 110.68 | Q173: 14天 | R173: 5.53年 | S173: 3.53年 | T173: 5 | U173: 12 | V173: 2.e-002 | W173: 0.10400000000000001 | X173: 0.115 | Y173: 48 | Z173: 2.9 | AA173: 9.1000000000000004e-003 | AB173: 2.3e-003 | AC173: -2.76e-002 | AD173: -2.9900000000000003e-002 | AE173: 80.2 | AF173: 82.16 | AG173: 0.73 | AH173: A+ | AI173: 7.5600000000000001e-002 | AJ173: =H173+100*O173 -> 120.583 | AK173: 121.1 | AL173: 50 | AM173: 38.9 | AN173: 163 | AO173: 1.e-002 | AP173: 10 | AQ173: 北陆转债!
A174: 84 | B174: 110076 | C174: 华海转债! | D174: 600521 | E174: 华海药业 | F174: 医药 | G174: 医药行业 | H174: 109.81 | I174: -1.7000000000000001e-003 | J174: -1.e-003 | K174: 20.11 | L174: -1.9e-002 | M174: 115.1 | N174: 34.66 | O174: 0.89300000000000002 | P174: 58.02 | Q174: 转股中 | R174: 5.43年 | S174: 3.43年 | T174: 18.4 | U174: 2.8 | V174: 1.e-003 | W174: 6.3e-002 | X174: 3.7000000000000005e-002 | Y174: 293 | Z174: 4.48 | AA174: 8.8999999999999999e-003 | AB174: 3.8e-003 | AC174: -1.6200000000000003e-002 | AD174: -1.8100000000000002e-002 | AE174: 88.97 | AF174: 91.69 | AG174: 0.14 | AH174: AA | AI174: 4.36e-002 | AJ174: =H174+100*O174 -> 199.11000000000001 | AK174: 161.6 | AL174: 314 | AM174: 69.9 | AN174: 316 | AO174: -1.6e-002 | AP174: 7 | AQ174: 华海转债!
A175: 254 | B175: 113542 | C175: 好客转债 | D175: 603898 | E175: 好莱客 | F175: 其他 | G175: 家居用品 | H175: 111 | I175: 1.4000000000000002e-003 | J175: -1.6000000000000001e-003 | K175: 14.58 | L175: -7.000000000000001e-004 | M175: 114.9 | N175: 16.27 | O175: 0.23899999999999999 | P175: 89.61 | Q175: 转股中 | R175: 4.18年 | S175: 2.18年 | T175: 6.03 | U175: 21 | V175: 3.1e-002 | W175: 0.13300000000000001 | X175: 0.11900000000000001 | Y175: 45 | Z175: 1.76 | AA175: 8.5000000000000006e-003 | AB175: 2.e-003 | AC175: -3.0099999999999998e-002 | AD175: -3.2799999999999996e-002 | AE175: 93.93 | AF175: 97.01 | AG175: 0.43 | AH175: AA | AI175: 4.2300000000000004e-002 | AJ175: =H175+100*O175 -> 134.90000000000001 | AK175: 132.4 | AL175: 168 | AM175: 35.4 | AN175: 130 | AO175: -0.10000000000000001 | AP175: 18 | AQ175: 好客转债
A176: 29 | B176: 128144 | C176: 利民转债 | D176: 2734 | E176: 利民股份 | F176: 化工 | G176: 农化 | H176: 109.072 | I176: -1.1999999999999999e-003 | J176: -2.e-003 | K176: 12.73 | L176: -6.1999999999999998e-003 | M176: 114.1 | N176: 14.23 | O176: 0.21899999999999997 | P176: 89.46 | Q176: 3月10天 | R176: 5.76年 | S176: 3.76年 | T176: 9.8 | U176: 3.7 | V176: 3.0000000000000001e-003 | W176: 0.20699999999999999 | X176: 0.185 | Y176: 47 | Z176: 1.72 | AA176: 8.0000000000000002e-003 | AB176: 3.4999999999999996e-003 | AC176: -1.49e-002 | AD176: -1.6299999999999999e-002 | AE176: 87.1 | AF176: 89.57 | AG176: 0.52 | AH176: AA | AI176: 4.36e-002 | AJ176: =H176+100*O176 -> 130.97200000000001 | AK176: 128.7 | AL176: 128 | AM176: 39.1 | AN176: 165 | AO176: 5.0000000000000001e-003 | AP176: 4 | AQ176: 利民转债
A177: 214 | B177: 113561 | C177: 正裕转债! | D177: 603089 | E177: 正裕工业 | F177: 汽车 | G177: 零部件制 | H177: 114.11 | I177: 2.0000000000000001e-004 | J177: 1.29e-002 | K177: 10.58 | L177: 1.9299999999999998e-002 | M177: 118 | N177: 10.23 | O177: 0.10300000000000001 | P177: 103.42 | Q177: 转股中 | R177: 4.59年 | S177: 2.59年 | T177: 1.5 | U177: 140 | V177: 0.81200000000000006 | W177: 6.4000000000000001e-002 | X177: 6.6000000000000003e-002 | Y177: 24 | Z177: 2.21 | AA177: 7.4999999999999997e-003 | AB177: 5.9999999999999995e-004 | AC177: -3.2899999999999999e-002 | AD177: -3.56e-002 | AE177: 85.68 | AF177: 85.61 | AG177: 0.68 | AH177: A+ | AI177: 7.4299999999999991e-002 | AJ177: =H177+100*O177 -> 124.41 | AK177: 124.8 | AL177: 81 | AM177: 39.1 | AN177: 166 | AO177: 0.14699999999999999 | AP177: 35 | AQ177: 正裕转债!
A178: 332 | B178: 123007 | C178: 道氏转债! | D178: 300409 | E178: 道氏技术 | F178: 建筑 | G178: 建筑行业 | H178: 108.25 | I178: 4.4000000000000003e-003 | J178: 9.1999999999999998e-003 | K178: 13.78 | L178: 2.76e-002 | M178: 110.3 | N178: 14.55 | O178: 0.14300000000000002 | P178: 94.71 | Q178: 转股中 | R178: 2.59年 | S178: 0.59年 | T178: 3.04 | U178: 35 | V178: 0.10400000000000001 | W178: 4.0000000000000001e-002 | X178: 3.7999999999999999e-002 | Y178: 77 | Z178: 2.08 | AA178: 7.4000000000000003e-003 | AB178: 0. | AC178: -7.8600000000000003e-002 | AD178: -8.2899999999999988e-002 | AE178: 97.33 | AF178: 94.76 | AG178: 0.49 | AH178: AA- | AI178: 6.1600000000000002e-002 | AJ178: =H178+100*O178 -> 122.55 | AK178: 121.8 | AL178: 58 | AM178: 24.5 | AN178: 26 | AO178: 4.4000000000000004e-002 | AP178: 22 | AQ178: 道氏转债!
A179: 172 | B179: 128107 | C179: 交科转债 | D179: 2061 | E179: 浙江交科 | F179: 建筑 | G179: 建筑工程 | H179: 110.9 | I179: 2.0000000000000001e-004 | J179: -3.4000000000000002e-003 | K179: 5.38 | L179: -5.5000000000000005e-003 | M179: 114.9 | N179: 5.36 | O179: 0.105 | P179: 100.37 | Q179: 转股中 | R179: 4.90年 | S179: 2.90年 | T179: 25 | U179: 25 | V179: 9.0000000000000011e-003 | W179: 0.33799999999999997 | X179: 0.33899999999999997 | Y179: 74 | Z179: 0.86 | AA179: 7.4000000000000003e-003 | AB179: 1.9e-003 | AC179: -2.2700000000000001e-002 | AD179: -2.4799999999999999e-002 | AE179: 91.69 | AF179: 95.02 | AG179: 0.57 | AH179: AA+ | AI179: 4.0300000000000002e-002 | AJ179: =H179+100*O179 -> 121.40000000000001 | AK179: 121.4 | AL179: 53 | AM179: 26.4 | AN179: 36 | AO179: -5.0000000000000001e-003 | AP179: 16 | AQ179: 交科转债
A180: 346 | B180: 110038 | C180: 济川转债! | D180: 600566 | E180: 济川药业 | F180: 医药 | G180: 中药 | H180: 106.41 | I180: 2.2000000000000001e-003 | J180: -2.8999999999999998e-003 | K180: 18.36 | L180: -8.1000000000000013e-003 | M180: 107.5 | N180: 23.4 | O180: 0.35600000000000004 | P180: 78.46 | Q180: 转股中 | R180: 1.46年 | S180: 回售内 | T180: 6.28 | U180: 28 | V180: 4.2000000000000003e-002 | W180: 3.9e-002 | X180: 2.9999999999999999e-002 | Y180: 163 | Z180: 2.01 | AA180: 7.0999999999999995e-003 | AB180: -2.7000000000000001e-003 | AC180: 回售内 | AD180: 回售内 | AE180: 100.25 | AF180: 101.48 | AG180: 0.09 | AH180: AA | AI180: 4.0599999999999997e-002 | AJ180: =H180+100*O180 -> 142.00999999999999 | AK180: 134.4 | AL180: 189 | AM180: 32.9 | AN180: 101 | AO180: -3.3000000000000002e-002 | AP180: 23 | AQ180: 济川转债!
A181: 228 | B181: 110062 | C181: 烽火转债! | D181: 600498 | E181: 烽火通信 | F181: 通信互联 | G181: 通信设备 | H181: 107.46 | I181: -2.7000000000000001e-003 | J181: 6.4000000000000003e-003 | K181: 17.97 | L181: 1.18e-002 | M181: 110.8 | N181: 22.93 | O181: 0.371 | P181: 78.37 | Q181: 转股中 | R181: 4.51年 | S181: 2.52年 | T181: 30.9 | U181: 20 | V181: 6.0000000000000001e-003 | W181: 0.152 | X181: 0.11900000000000001 | Y181: 203 | Z181: 1.89 | AA181: 6.8999999999999999e-003 | AB181: 2.5000000000000001e-003 | AC181: -1.47e-002 | AD181: -1.7100000000000001e-002 | AE181: 93.72 | AF181: 94.23 | AG181: 0.32 | AH181: AAA | AI181: 3.73e-002 | AJ181: =H181+100*O181 -> 144.56 | AK181: 136.6 | AL181: 215 | AM181: 42.3 | AN181: 194 | AO181: 2.1000000000000001e-002 | AP181: 20 | AQ181: 烽火转债!
A182: 127 | B182: 128124 | C182: 科华转债! | D182: 2022 | E182: 科华生物 | F182: 医药 | G182: 生物制药 | H182: 106.509 | I182: -3.8e-003 | J182: 5.1000000000000004e-003 | K182: 18.62 | L182: 2.7000000000000001e-003 | M182: 110.3 | N182: 21.51 | O182: 0.23000000000000001 | P182: 86.56 | Q182: 转股中 | R182: 5.16年 | S182: 3.17年 | T182: 7.38 | U182: 14 | V182: 1.8000000000000002e-002 | W182: 7.6999999999999999e-002 | X182: 6.7000000000000004e-002 | Y182: 96 | Z182: 2.88 | AA182: 6.8999999999999999e-003 | AB182: 3.2000000000000002e-003 | AC182: -9.8999999999999991e-003 | AD182: -1.1699999999999999e-002 | AE182: 89.5 | AF182: 88.83 | AG182: 0.49 | AH182: AA | AI182: 4.36e-002 | AJ182: =H182+100*O182 -> 129.50900000000001 | AK182: 126.5 | AL182: 96 | AM182: 37 | AN182: 143 | AO182: 3.5000000000000003e-002 | AP182: 19 | AQ182: 科华转债!
A183: 163 | B183: 123052 | C183: 飞鹿转债 | D183: 300665 | E183: 飞鹿股份 | F183: 化工 | G183: 化工 | H183: 123.29 | I183: 1.9400000000000001e-002 | J183: 1.5100000000000001e-002 | K183: 11.49 | L183: 4.9299999999999997e-002 | M183: 127.3 | N183: 9.9 | O183: 6.2e-002 | P183: 116.06 | Q183: 转股中 | R183: 5年7天 | S183: 3年8天 | T183: 1.53 | U183: 152 | V183: 0.80400000000000005 | W183: 0.109 | X183: 0.127 | Y183: 14 | Z183: 2.99 | AA183: 6.6e-003 | AB183: -2.3999999999999998e-003 | AC183: -4.9200000000000001e-002 | AD183: -5.2000000000000005e-002 | AE183: 83.73 | AF183: 89.23 | AG183: 0.7 | AH183: A+ | AI183: 7.5600000000000001e-002 | AJ183: =H183+100*O183 -> 129.49000000000001 | AK183: 130.5 | AL183: 150 | AM183: 41.3 | AN183: 186 | AO183: 2.2000000000000002e-002 | AP183: 16 | AQ183: 飞鹿转债
A184: 344 | B184: 128021 | C184: 兄弟转债!! | D184: 2562 | E184: 兄弟科技 | F184: 医药 | G184: 原料药 | H184: 107.149 | I184: -2.8999999999999998e-003 | J184: -1.4000000000000002e-003 | K184: 4.53 | L184: -1.3100000000000001e-002 | M184: 108.8 | N184: 5.19 | O184: 0.22800000000000001 | P184: 87.28 | Q184: 转股中 | R184: 2.50年 | S184: 0.50年 | T184: 2.65 | U184: 2.9 | V184: 1.e-002 | W184: 5.5e-002 | X184: 4.8000000000000001e-002 | Y184: 48 | Z184: 1.62 | AA184: 6.1999999999999998e-003 | AB184: -4.0000000000000002e-004 | AC184: -7.7100000000000002e-002 | AD184: -8.1300000000000011e-002 | AE184: 98.88 | AF184: 98.63 | AG184: 0.33 | AH184: AA | AI184: 4.0599999999999997e-002 | AJ184: =H184+100*O184 -> 129.94900000000001 | AK184: 127 | AL184: 108 | AM184: 28.1 | AN184: 46 | AO184: -2.6000000000000002e-002 | AP184: 15 | AQ184: 兄弟转债!!
A185: 315 | B185: 110045 | C185: 海澜转债! | D185: 600398 | E185: 海澜之家 | F185: 服装纺织 | G185: 服装行业 | H185: 109.02 | I185: -9.7000000000000003e-003 | J185: 4.1999999999999997e-003 | K185: 7.07 | L185: -1.1200000000000002e-002 | M185: 111.1 | N185: 7.3 | O185: 0.126 | P185: 96.85 | Q185: 转股中 | R185: 3年45天 | S185: 1年46天 | T185: 29.5 | U185: 37 | V185: 1.1000000000000001e-002 | W185: 9.6999999999999989e-002 | X185: 9.4e-002 | Y185: 305 | Z185: 2.18 | AA185: 6.1999999999999998e-003 | AB185: -4.0000000000000002e-004 | AC185: -5.0499999999999996e-002 | AD185: -5.33e-002 | AE185: 96.98 | AF185: 98.4 | AG185: 0.49 | AH185: AA+ | AI185: 4.0300000000000002e-002 | AJ185: =H185+100*O185 -> 121.61999999999999 | AK185: 121.2 | AL185: 51 | AM185: 22.8 | AN185: 18 | AO185: -1.9e-002 | AP185: 54 | AQ185: 海澜转债!
A186: 209 | B186: 113563 | C186: 柳药转债 | D186: 603368 | E186: 柳药股份 | F186: 医药 | G186: 医药商业 | H186: 109.94 | I186: 8.0000000000000004e-004 | J186: -3.9000000000000003e-003 | K186: 20.6 | L186: -7.7000000000000002e-003 | M186: 112.9 | N186: 24.47 | O186: 0.30599999999999999 | P186: 84.18 | Q186: 转股中 | R186: 4.64年 | S186: 2.64年 | T186: 8.02 | U186: 3.1 | V186: 4.0000000000000001e-003 | W186: 0.107 | X186: 8.9999999999999997e-002 | Y186: 75 | Z186: 1.45 | AA186: 5.8999999999999999e-003 | AB186: 8.0000000000000004e-004 | AC186: -2.18e-002 | AD186: -2.41e-002 | AE186: 92.16 | AF186: 93.53 | AG186: 0.4 | AH186: AA | AI186: 4.2300000000000004e-002 | AJ186: =H186+100*O186 -> 140.53999999999999 | AK186: 135.7 | AL186: 206 | AM186: 42.2 | AN186: 193 | AO186: -3.1e-002 | AP186: 17 | AQ186: 柳药转债
A187: 10 | B187: 123109 | C187: 昌红转债 | D187: 300151 | E187: 昌红科技 | F187: 机械装备 | G187: 专用设备 | H187: 117.18 | I187: 2.2000000000000002e-002 | J187: 2.6600000000000002e-002 | K187: 29.88 | L187: 7.0199999999999999e-002 | M187: 121 | N187: 28.26 | O187: 0.10800000000000001 | P187: 105.73 | Q187: 4月13天 | R187: 5.84年 | S187: 3.84年 | T187: 4.6 | U187: 83 | V187: 0.152 | W187: 3.1e-002 | X187: 3.2000000000000001e-002 | Y187: 150 | Z187: 14.04 | AA187: 5.6000000000000008e-003 | AB187: -5.9999999999999995e-004 | AC187: -2.9700000000000001e-002 | AD187: -3.15e-002 | AE187: 81.04 | AF187: 84.54 | AG187: 0.69 | AH187: AA- | AI187: 6.4600000000000005e-002 | AJ187: =H187+100*O187 -> 127.98 | AK187: 128.6 | AL187: 125 | AM187: 44.1 | AN187: 212 | AO187: 3.2000000000000001e-002 | AP187: 4 | AQ187: 昌红转债
A188: 237 | B188: 110060 | C188: 天路转债! | D188: 600326 | E188: 西藏天路 | F188: 建筑 | G188: 水泥 | H188: 112.35 | I188: -1.e-003 | J188: -4.4000000000000003e-003 | K188: 7.1 | L188: -9.7999999999999997e-003 | M188: 114.9 | N188: 7.16 | O188: 0.13300000000000001 | P188: 99.16 | Q188: 转股中 | R188: 4.42年 | S188: 2.42年 | T188: 7.06 | U188: 3.3 | V188: 4.0000000000000001e-003 | W188: 0.10800000000000001 | X188: 0.107 | Y188: 65 | Z188: 1.54 | AA188: 5.1999999999999998e-003 | AB188: -8.9999999999999998e-004 | AC188: -3.1899999999999998e-002 | AD188: -3.4300000000000004e-002 | AE188: 93 | AF188: 96.05 | AG188: 0.55 | AH188: AA | AI188: 4.2300000000000004e-002 | AJ188: =H188+100*O188 -> 125.64999999999999 | AK188: 125.5 | AL188: 89 | AM188: 29.5 | AN188: 61 | AO188: -2.8999999999999998e-002 | AP188: 13 | AQ188: 天路转债!
A189: 43 | B189: 127028 | C189: 英特转债! | D189: 411 | E189: 英特集团 | F189: 医药 | G189: 医药商业 | H189: 110.4 | I189: -1.43e-002 | J189: -6.6e-003 | K189: 14.15 | L189: -3.15e-002 | M189: 113.1 | N189: 13.4 | O189: 4.4999999999999998e-002 | P189: 105.6 | Q189: 44天 | R189: 5.61年 | S189: 3.61年 | T189: 6 | U189: 20 | V189: 2.9999999999999999e-002 | W189: 0.17000000000000001 | X189: 0.17999999999999999 | Y189: 35 | Z189: 2.07 | AA189: 4.4000000000000003e-003 | AB189: 1.e-004 | AC189: -1.6799999999999999e-002 | AD189: -1.8600000000000002e-002 | AE189: 88.95 | AF189: 90.38 | AG189: 0.66 | AH189: AA+ | AI189: 4.1599999999999998e-002 | AJ189: =H189+100*O189 -> 114.90000000000001 | AK189: 115.2 | AL189: 15 | AM189: 24.8 | AN189: 29 | AO189: -3.7999999999999999e-002 | AP189: 17 | AQ189: 英特转债!
A190: 73 | B190: 113609 | C190: 永安转债! | D190: 603776 | E190: 永安行 | F190: 城市公用 | G190: 其他 | H190: 117.74 | I190: -5.8999999999999999e-003 | J190: -2.9999999999999997e-004 | K190: 24.14 | L190: -8.199999999999999e-003 | M190: 120.5 | N190: 20.34 | O190: -8.0000000000000002e-003 | P190: 118.68 | Q190: 3.1天 | R190: 5.49年 | S190: 3.49年 | T190: 8.86 | U190: 108 | V190: 0.10300000000000001 | W190: 0.19600000000000001 | X190: 0.23199999999999998 | Y190: 45 | Z190: 1.44 | AA190: 4.3e-003 | AB190: -2.0999999999999999e-003 | AC190: -3.4099999999999998e-002 | AD190: -3.6000000000000004e-002 | AE190: 82.78 | AF190: 86.04 | AG190: 0.76 | AH190: AA- | AI190: 6.4600000000000005e-002 | AJ190: =H190+100*O190 -> 116.94 | AK190: 116.8 | AL190: 20 | AM190: 30.8 | AN190: 73 | AO190: -0.106 | AP190: 20 | AQ190: 永安转债!
A191: 212 | B191: 127015 | C191: 希望转债! | D191: 876 | E191: 新 希 望 | F191: 农业 | G191: 畜牧业 | H191: 107.91 | I191: -3.0000000000000001e-003 | J191: -2.5000000000000001e-003 | K191: 15.18 | L191: -1.8700000000000001e-002 | M191: 110 | N191: 19.75 | O191: 0.40399999999999997 | P191: 76.86 | Q191: 转股中 | R191: 4.60年 | S191: 2.60年 | T191: 9.5 | U191: 22 | V191: 2.2000000000000002e-002 | W191: 1.3999999999999999e-002 | X191: 1.1000000000000001e-002 | Y191: 684 | Z191: 1.84 | AA191: 4.1999999999999997e-003 | AB191: 2.0000000000000001e-004 | AC191: -1.7899999999999999e-002 | AD191: -1.9799999999999998e-002 | AE191: 92.83 | AF191: 93.2 | AG191: 0.29 | AH191: AAA | AI191: 3.73e-002 | AJ191: =H191+100*O191 -> 148.31 | AK191: 139 | AL191: 237 | AM191: 45.8 | AN191: 224 | AO191: -4.7e-002 | AP191: 27 | AQ191: 希望转债!
A192: 271 | B192: 128064 | C192: 司尔转债! | D192: 2538 | E192: 司尔特 | F192: 化工 | G192: 农化 | H192: 112.591 | I192: -1.7000000000000001e-003 | J192: -7.1999999999999998e-003 | K192: 6.23 | L192: -1.5800000000000002e-002 | M192: 114.3 | N192: 6.07 | O192: 9.6999999999999989e-002 | P192: 102.64 | Q192: 转股中 | R192: 3.86年 | S192: 1.86年 | T192: 8 | U192: 7.2 | V192: 8.0000000000000002e-003 | W192: 0.17899999999999999 | X192: 0.184 | Y192: 45 | Z192: 1.12 | AA192: 4.0000000000000001e-003 | AB192: -2.7000000000000001e-003 | AC192: -4.41e-002 | AD192: -4.6600000000000003e-002 | AE192: 94.56 | AF192: 97.68 | AG192: 0.57 | AH192: AA | AI192: 4.2300000000000004e-002 | AJ192: =H192+100*O192 -> 122.291 | AK192: 122.5 | AL192: 66 | AM192: 24.9 | AN192: 30 | AO192: -1.6e-002 | AP192: 46 | AQ192: 司尔转债!
A193: 18 | B193: 128145 | C193: 日丰转债 | D193: 2953 | E193: 日丰股份 | F193: 家电 | G193: 零部件制 | H193: 112.883 | I193: -2.e-003 | J193: -4.0000000000000001e-003 | K193: 20.21 | L193: -8.3000000000000001e-003 | M193: 115.4 | N193: 19.24 | O193: 7.4999999999999997e-002 | P193: 105.04 | Q193: 4月2天 | R193: 5.81年 | S193: 3.82年 | T193: 3.8 | U193: 7.1 | V193: 1.6e-002 | W193: 0.10800000000000001 | X193: 0.114 | Y193: 35 | Z193: 3.29 | AA193: 3.9000000000000003e-003 | AB193: -8.9999999999999998e-004 | AC193: -2.12e-002 | AD193: -2.29e-002 | AE193: 81.02 | AF193: 80.75 | AG193: 0.72 | AH193: AA- | AI193: 6.4600000000000005e-002 | AJ193: =H193+100*O193 -> 120.383 | AK193: 120.7 | AL193: 45 | AM193: 39.7 | AN193: 170 | AO193: 1.6e-002 | AP193: 4 | AQ193: 日丰转债
A194: 87 | B194: 113606 | C194: 荣泰转债 | D194: 603579 | E194: 荣泰健康 | F194: 机械装备 | G194: 专用设备 | H194: 119.14 | I194: 2.5999999999999999e-003 | J194: -1.06e-002 | K194: 36.13 | L194: -1.15e-002 | M194: 121.2 | N194: 33.32 | O194: 9.9000000000000005e-002 | P194: 108.43 | Q194: 转股中 | R194: 5.42年 | S194: 3.42年 | T194: 6 | U194: 18 | V194: 2.5000000000000001e-002 | W194: 0.11900000000000001 | X194: 0.129 | Y194: 51 | Z194: 3.02 | AA194: 3.2000000000000002e-003 | AB194: -3.4999999999999996e-003 | AC194: -3.7200000000000004e-002 | AD194: -3.9300000000000002e-002 | AE194: 83.39 | AF194: 86.98 | AG194: 0.7 | AH194: AA- | AI194: 6.4600000000000005e-002 | AJ194: =H194+100*O194 -> 129.03999999999999 | AK194: 129.8 | AL194: 140 | AM194: 42.9 | AN194: 202 | AO194: 2.6000000000000002e-002 | AP194: 10 | AQ194: 荣泰转债
A195: 31 | B195: 123100 | C195: 朗科转债 | D195: 300543 | E195: 朗科智能 | F195: 电子 | G195: 电子产品 | H195: 115.47 | I195: -1.3100000000000001e-002 | J195: -1.3300000000000001e-002 | K195: 11.85 | L195: -3.8100000000000002e-002 | M195: 117.5 | N195: 11.61 | O195: 0.13100000000000001 | P195: 102.07 | Q195: 2月26天 | R195: 5.70年 | S195: 3.70年 | T195: 3.8 | U195: 19 | V195: 4.2000000000000003e-002 | W195: 0.12 | X195: 0.122 | Y195: 32 | Z195: 2.61 | AA195: 3.0999999999999999e-003 | AB195: -2.3e-003 | AC195: -2.7300000000000001e-002 | AD195: -2.9100000000000001e-002 | AE195: 81.69 | AF195: 82.81 | AG195: 0.69 | AH195: AA- | AI195: 6.4600000000000005e-002 | AJ195: =H195+100*O195 -> 128.56999999999999 | AK195: 128.9 | AL195: 131 | AM195: 46.1 | AN195: 226 | AO195: -0.23899999999999999 | AP195: 9 | AQ195: 朗科转债
A196: 267 | B196: 113026 | C196: 核能转债! | D196: 601985 | E196: 中国核电 | F196: 能源电力 | G196: 核电 | H196: 108.09 | I196: -5.5000000000000005e-003 | J196: 5.5000000000000005e-003 | K196: 5.24 | L196: 0. | M196: 109.3 | N196: 5.86 | O196: 0.20899999999999999 | P196: 89.42 | Q196: 转股中 | R196: 3.88年 | S196: 1.88年 | T196: 78 | U196: 19 | V196: 2.e-003 | W196: 8.5000000000000006e-002 | X196: 7.5999999999999998e-002 | Y196: 915 | Z196: 1.48 | AA196: 2.8999999999999998e-003 | AB196: -1.6000000000000001e-003 | AC196: -2.4399999999999998e-002 | AD196: -2.69e-002 | AE196: 95.42 | AF196: 95.07 | AG196: 0.44 | AH196: AAA | AI196: 3.73e-002 | AJ196: =H196+100*O196 -> 128.99000000000001 | AK196: 126.8 | AL196: 104 | AM196: 31.3 | AN196: 83 | AO196: -9.0000000000000011e-003 | AP196: 46 | AQ196: 核能转债!
A197: 331 | B197: 128034 | C197: 江银转债! | D197: 2807 | E197: 江阴银行 | F197: 金融 | G197: 银行行业 | H197: 107.492 | I197: -1.e-004 | J197: 1.1999999999999999e-003 | K197: 4.11 | L197: 2.3999999999999998e-003 | M197: 108.3 | N197: 4.32 | O197: 0.13 | P197: 95.14 | Q197: 转股中 | R197: 2.67年 | S197: 无权 | T197: 17.6 | U197: 20 | V197: 1.1000000000000001e-002 | W197: 0.19699999999999998 | X197: 0.187 | Y197: 89 | Z197: 0.75 | AA197: 2.8000000000000004e-003 | AB197: -3.0000000000000001e-003 | AC197: 无权 | AD197: 无权 | AE197: 无权 | AF197: 98.02 | AG197: 0.47 | AH197: AA+ | AI197: 3.8599999999999995e-002 | AJ197: =H197+100*O197 -> 120.492 | AK197: 119.8 | AL197: 38 | AM197: 21.8 | AN197: 14 | AO197: -1.e-003 | AP197: 25 | AQ197: 江银转债!
A198: 16 | B198: 127031 | C198: 洋丰转债! | D198: 902 | E198: 新洋丰 | F198: 化工 | G198: 农化 | H198: 115.5 | I198: 3.9000000000000003e-003 | J198: -1.1599999999999999e-002 | K198: 14.53 | L198: -2.4199999999999999e-002 | M198: 117.1 | N198: 19.94 | O198: 0.58499999999999996 | P198: 72.87 | Q198: 4月13天 | R198: 5.82年 | S198: 3.82年 | T198: 10 | U198: 15 | V198: 1.3000000000000001e-002 | W198: 5.2999999999999999e-002 | X198: 3.7999999999999999e-002 | Y198: 190 | Z198: 2.61 | AA198: 2.3999999999999998e-003 | AB198: -2.8000000000000004e-003 | AC198: -2.7099999999999999e-002 | AD198: -2.87e-002 | AE198: 87.5 | AF198: 91.73 | AG198: 0.32 | AH198: AA | AI198: 4.36e-002 | AJ198: =H198+100*O198 -> 174. | AK198: 158.1 | AL198: 312 | AM198: 66.4 | AN198: 311 | AO198: -4.0000000000000001e-002 | AP198: 2 | AQ198: 洋丰转债!
A199: 23 | B199: 123104 | C199: 卫宁转债 | D199: 300253 | E199: 卫宁健康 | F199: 计算机及 | G199: 软件开发 | H199: 123.59 | I199: -3.3e-003 | J199: 4.0999999999999995e-003 | K199: 16.55 | L199: 1.8e-003 | M199: 125.1 | N199: 17.76 | O199: 0.32600000000000001 | P199: 93.19 | Q199: 3月27天 | R199: 5.80年 | S199: 3.80年 | T199: 9.7 | U199: 16 | V199: 1.3000000000000001e-002 | W199: 2.7000000000000003e-002 | X199: 2.6000000000000002e-002 | Y199: 354 | Z199: 7.76 | AA199: 2.0999999999999999e-003 | AB199: -5.0000000000000001e-003 | AC199: -4.3799999999999999e-002 | AD199: -4.5400000000000003e-002 | AE199: 87.59 | AF199: 98.07 | AG199: 0.46 | AH199: AA | AI199: 4.36e-002 | AJ199: =H199+100*O199 -> 156.19 | AK199: 154 | AL199: 301 | AM199: 55.9 | AN199: 278 | AO199: 7.2999999999999995e-002 | AP199: 3 | AQ199: 卫宁转债
A200: 347 | B200: 113502 | C200: 嘉澳转债! | D200: 603822 | E200: 嘉澳环保 | F200: 化工 | G200: 化工 | H200: 110.76 | I200: -5.1999999999999998e-003 | J200: 5.1000000000000004e-003 | K200: 21.69 | L200: -2.3399999999999997e-002 | M200: 111.3 | N200: 44.79 | O200: 1.29 | P200: 48.43 | Q200: 转股中 | R200: 2.46年 | S200: 0.46年 | T200: 1.85 | U200: 28 | V200: 0.13800000000000001 | W200: 0.11599999999999999 | X200: 5.5999999999999994e-002 | Y200: 16 | Z200: 1.99 | AA200: 2.e-003 | AB200: -6.4000000000000003e-003 | AC200: -0.13699999999999998 | AD200: -0.14300000000000002 | AE200: 98.1 | AF200: 96.37 | AG200: 0 | AH200: AA- | AI200: 6.1600000000000002e-002 | AJ200: =H200+100*O200 -> 239.75999999999999 | AK200: 173.1 | AL200: 326 | AM200: 75 | AN200: 322 | AO200: 2.3e-002 | AP200: 37 | AQ200: 嘉澳转债!
A201: 235 | B201: 123033 | C201: 金力转债! | D201: 300748 | E201: 金力永磁 | F201: 电子 | G201: 元器件制 | H201: 120.465 | I201: 2.9999999999999997e-004 | J201: -5.5000000000000005e-003 | K201: 24.6 | L201: -9.300000000000001e-003 | M201: 121.5 | N201: 25.3 | O201: 0.23899999999999999 | P201: 97.23 | Q201: 转股中 | R201: 4.43年 | S201: 2.43年 | T201: 4.34 | U201: 30 | V201: 5.5999999999999994e-002 | W201: 2.6000000000000002e-002 | X201: 2.5000000000000001e-002 | Y201: 170 | Z201: 5.06 | AA201: 2.e-003 | AB201: -6.3e-003 | AC201: -5.2300000000000006e-002 | AD201: -5.57e-002 | AE201: 89.76 | AF201: 93.36 | AG201: 0.57 | AH201: AA- | AI201: 6.3299999999999995e-002 | AJ201: =H201+100*O201 -> 144.36500000000001 | AK201: 143.7 | AL201: 262 | AM201: 50.3 | AN201: 244 | AO201: -0.18899999999999997 | AP201: 26 | AQ201: 金力转债!
A202: 72 | B202: 123078 | C202: 飞凯转债! | D202: 300398 | E202: 飞凯材料 | F202: 化工 | G202: 化工 | H202: 114.004 | I202: 3.4000000000000002e-003 | J202: -5.3e-003 | K202: 15.82 | L202: -3.2000000000000002e-003 | M202: 115.2 | N202: 15.62 | O202: 0.126 | P202: 101.28 | Q202: 6.1天 | R202: 5.50年 | S202: 3.50年 | T202: 8.2 | U202: 69 | V202: 7.400000000000001e-002 | W202: 0.10099999999999999 | X202: 0.10199999999999999 | Y202: 82 | Z202: 3.04 | AA202: 1.9e-003 | AB202: -3.0000000000000001e-003 | AC202: -2.5699999999999997e-002 | AD202: -2.76e-002 | AE202: 88.81 | AF202: 91.51 | AG202: 0.61 | AH202: AA | AI202: 4.36e-002 | AJ202: =H202+100*O202 -> 126.604 | AK202: 126.7 | AL202: 103 | AM202: 35.2 | AN202: 129 | AO202: 7.8e-002 | AP202: 7 | AQ202: 飞凯转债!
A203: 96 | B203: 128135 | C203: 洽洽转债! | D203: 2557 | E203: 洽洽食品 | F203: 食品饮料 | G203: 休闲食品 | H203: 119.18 | I203: -5.0000000000000001e-003 | J203: -1.04e-002 | K203: 52.25 | L203: -3.78e-002 | M203: 120.2 | N203: 60.83 | O203: 0.38799999999999996 | P203: 85.9 | Q203: 转股中 | R203: 5.39年 | S203: 3.40年 | T203: 13.4 | U203: 10 | V203: 6.0000000000000001e-003 | W203: 5.0999999999999997e-002 | X203: 4.2999999999999997e-002 | Y203: 265 | Z203: 6.2 | AA203: 1.6000000000000001e-003 | AB203: -4.7999999999999996e-003 | AC203: -3.8599999999999995e-002 | AD203: -4.0500000000000001e-002 | AE203: 89.2 | AF203: 95.89 | AG203: 0.41 | AH203: AA | AI203: 4.36e-002 | AJ203: =H203+100*O203 -> 157.98000000000002 | AK203: 152.5 | AL203: 297 | AM203: 56.6 | AN203: 282 | AO203: -1.3999999999999999e-002 | AP203: 11 | AQ203: 洽洽转债!
A204: 167 | B204: 127017 | C204: 万青转债 | D204: 789 | E204: 万年青 | F204: 建筑 | G204: 水泥 | H204: 117.816 | I204: -6.0000000000000001e-003 | J204: -5.5000000000000005e-003 | K204: 12.93 | L204: -2.2700000000000001e-002 | M204: 118.4 | N204: 13.46 | O204: 0.22600000000000001 | P204: 96.06 | Q204: 转股中 | R204: 5年5.1天 | S204: 3年6.1天 | T204: 10 | U204: 12 | V204: 1.e-002 | W204: 9.6999999999999989e-002 | X204: 9.3000000000000013e-002 | Y204: 103 | Z204: 1.57 | AA204: 1.e-003 | AB204: -5.4000000000000003e-003 | AC204: -3.9599999999999996e-002 | AD204: -4.1700000000000001e-002 | AE204: 91.25 | AF204: 96.93 | AG204: 0.51 | AH204: AA+ | AI204: 4.1599999999999998e-002 | AJ204: =H204+100*O204 -> 140.416 | AK204: 139.6 | AL204: 240 | AM204: 42.6 | AN204: 201 | AO204: -6.8000000000000005e-002 | AP204: 9 | AQ204: 万青转债
A205: 5 | B205: 127032 | C205: 苏行转债 | D205: 2966 | E205: 苏州银行 | F205: 金融 | G205: 银行行业 | H205: 114.505 | I205: -6.8999999999999999e-003 | J205: 8.3000000000000001e-003 | K205: 7.68 | L205: 2.5999999999999999e-003 | M205: 115.1 | N205: 8.1 | O205: 0.20800000000000002 | P205: 94.81 | Q205: 4月23天 | R205: 5.87年 | S205: 无权 | T205: 50 | U205: 113 | V205: 2.e-002 | W205: 0.19500000000000001 | X205: 0.185 | Y205: 256 | Z205: 0.84 | AA205: 8.9999999999999998e-004 | AB205: -3.7000000000000002e-003 | AC205: 无权 | AD205: 无权 | AE205: 无权 | AF205: 92.48 | AG205: 0.53 | AH205: AAA | AI205: 3.8599999999999995e-002 | AJ205: =H205+100*O205 -> 135.30500000000001 | AK205: 134.2 | AL205: 185 | AM205: 41.7 | AN205: 189 | AO205: 2.4e-002 | AP205: 6 | AQ205: 苏行转债
A206: 178 | B206: 110070 | C206: 凌钢转债! | D206: 600231 | E206: 凌钢股份 | F206: 钢铁 | G206: 炼钢 | H206: 117.02 | I206: -1.1999999999999999e-003 | J206: -6.9999999999999993e-003 | K206: 2.97 | L206: -1.3300000000000001e-002 | M206: 117.4 | N206: 2.75 | O206: 8.4000000000000005e-002 | P206: 108 | Q206: 转股中 | R206: 4.87年 | S206: 2.88年 | T206: 2.17 | U206: 125 | V206: 0.47999999999999998 | W206: 2.6000000000000002e-002 | X206: 2.7999999999999997e-002 | Y206: 84 | Z206: 0.98 | AA206: 7.000000000000001e-004 | AB206: -5.6000000000000008e-003 | AC206: -3.9100000000000003e-002 | AD206: -4.1399999999999999e-002 | AE206: 91.56 | AF206: 96.33 | AG206: 0.62 | AH206: AA | AI206: 4.2300000000000004e-002 | AJ206: =H206+100*O206 -> 125.42 | AK206: 126 | AL206: 92 | AM206: 29.7 | AN206: 67 | AO206: -6.2e-002 | AP206: 21 | AQ206: 凌钢转债!
A207: 94 | B207: 123072 | C207: 乐歌转债! | D207: 300729 | E207: 乐歌股份 | F207: 其他 | G207: 家居用品 | H207: 129.15 | I207: -1.1000000000000001e-002 | J207: 8.8999999999999999e-003 | K207: 26.39 | L207: -2.0099999999999996e-002 | M207: 129.6 | N207: 56.12 | O207: 1.75 | P207: 47.02 | Q207: 转股中 | R207: 5.40年 | S207: 3.40年 | T207: 1.42 | U207: 84 | V207: 0.45299999999999996 | W207: 2.9999999999999999e-002 | X207: 1.3999999999999999e-002 | Y207: 48 | Z207: 3.58 | AA207: 7.000000000000001e-004 | AB207: -8.199999999999999e-003 | AC207: -5.2900000000000003e-002 | AD207: -5.6100000000000004e-002 | AE207: 82.61 | AF207: 88.56 | AG207: 0.11 | AH207: A+ | AI207: 7.5600000000000001e-002 | AJ207: =H207+100*O207 -> 304.14999999999998 | AK207: 211.3 | AL207: 342 | AM207: 122.7 | AN207: 343 | AO207: -0.191 | AP207: 8 | AQ207: 乐歌转债!
A208: 227 | B208: 128082 | C208: 华锋转债! | D208: 2806 | E208: 华锋股份 | F208: 电子 | G208: 元器件制 | H208: 121.064 | I208: -1.9799999999999998e-002 | J208: 9.1999999999999998e-003 | K208: 11.08 | L208: -1.4199999999999999e-002 | M208: 121.4 | N208: 9.13 | O208: -2.e-003 | P208: 121.36 | Q208: 转股中 | R208: 4.52年 | S208: 2.52年 | T208: 3.12 | U208: 235 | V208: 0.60699999999999998 | W208: 0.157 | X208: 0.19 | Y208: 20 | Z208: 2.01 | AA208: 5.9999999999999995e-004 | AB208: -7.4000000000000003e-003 | AC208: -5.4000000000000006e-002 | AD208: -5.6900000000000006e-002 | AE208: 86.41 | AF208: 88.57 | AG208: 0.75 | AH208: A+ | AI208: 7.4299999999999991e-002 | AJ208: =H208+100*O208 -> 120.86399999999999 | AK208: 120.8 | AL208: 46 | AM208: 32.2 | AN208: 95 | AO208: 0. | AP208: 54 | AQ208: 华锋转债!
A209: 303 | B209: 128048 | C209: 张行转债 | D209: 2839 | E209: 张家港行 | F209: 金融 | G209: 银行行业 | H209: 113.114 | I209: -1.04e-002 | J209: 1.1299999999999999e-002 | K209: 5.69 | L209: 1.8e-003 | M209: 113.3 | N209: 5.76 | O209: 0.14499999999999999 | P209: 98.78 | Q209: 转股中 | R209: 3.46年 | S209: 无权 | T209: 25 | U209: 13 | V209: 5.0000000000000001e-003 | W209: 0.24299999999999999 | X209: 0.23999999999999999 | Y209: 103 | Z209: 0.92 | AA209: 5.0000000000000001e-004 | AB209: -6.5000000000000006e-003 | AC209: 无权 | AD209: 无权 | AE209: 无权 | AF209: 99.1 | AG209: 0.51 | AH209: AA+ | AI209: 4.0300000000000002e-002 | AJ209: =H209+100*O209 -> 127.614 | AK209: 127.4 | AL209: 111 | AM209: 28.3 | AN209: 49 | AO209: 2.2000000000000002e-002 | AP209: 13 | AQ209: 张行转债
A210: 112 | B210: 128129 | C210: 青农转债! | D210: 2958 | E210: 青农商行 | F210: 金融 | G210: 银行行业 | H210: 111.9 | I210: 7.1999999999999998e-003 | J210: 8.9999999999999998e-004 | K210: 4.51 | L210: 1.3500000000000002e-002 | M210: 112.2 | N210: 4.47 | O210: 0.109 | P210: 100.89 | Q210: 转股中 | R210: 5.24年 | S210: 无权 | T210: 50 | U210: 80 | V210: 1.3999999999999999e-002 | W210: 0.20000000000000001 | X210: 0.20100000000000001 | Y210: 251 | Z210: 0.92 | AA210: 5.0000000000000001e-004 | AB210: -3.7000000000000002e-003 | AC210: 无权 | AD210: 无权 | AE210: 无权 | AF210: 92.28 | AG210: 0.6 | AH210: AAA | AI210: 3.8599999999999995e-002 | AJ210: =H210+100*O210 -> 122.80000000000001 | AK210: 122.9 | AL210: 67 | AM210: 30.6 | AN210: 71 | AO210: 3.1e-002 | AP210: 14 | AQ210: 青农转债!
A211: 179 | B211: 128106 | C211: 华统转债 | D211: 2840 | E211: 华统股份 | F211: 农业 | G211: 农产品加 | H211: 112.9 | I211: -4.4000000000000003e-003 | J211: -8.0000000000000004e-004 | K211: 9.91 | L211: -8.0000000000000002e-003 | M211: 112.9 | N211: 9.4 | O211: 7.0999999999999994e-002 | P211: 105.43 | Q211: 转股中 | R211: 4.87年 | S211: 2.87年 | T211: 5.35 | U211: 4.4 | V211: 6.9999999999999993e-003 | W211: 0.121 | X211: 0.127 | Y211: 44 | Z211: 2.52 | AA211: 0. | AB211: -4.7999999999999996e-003 | AC211: -2.87e-002 | AD211: -3.0800000000000001e-002 | AE211: 91.28 | AF211: 92.64 | AG211: 0.65 | AH211: AA | AI211: 4.2300000000000004e-002 | AJ211: =H211+100*O211 -> 120. | AK211: 120.4 | AL211: 41 | AM211: 27.7 | AN211: 44 | AO211: -5.0000000000000003e-002 | AP211: 9 | AQ211: 华统转债
A212: 242 | B212: 128078 | C212: 太极转债! | D212: 2368 | E212: 太极股份 | F212: 计算机及 | G212: 软件开发 | H212: 117.002 | I212: -8.3000000000000001e-003 | J212: 1.0200000000000001e-002 | K212: 21.39 | L212: 3.3e-003 | M212: 116.9 | N212: 22.4 | O212: 0.22500000000000001 | P212: 95.49 | Q212: 转股中 | R212: 4.40年 | S212: 2.40年 | T212: 9.6 | U212: 5.1 | V212: 5.0000000000000001e-003 | W212: 7.6999999999999999e-002 | X212: 7.400000000000001e-002 | Y212: 124 | Z212: 3.7 | AA212: -2.0000000000000001e-004 | AB212: -6.9999999999999993e-003 | AC212: -4.7500000000000001e-002 | AD212: -4.9800000000000004e-002 | AE212: 93.07 | AF212: 97.79 | AG212: 0.57 | AH212: AA | AI212: 4.2300000000000004e-002 | AJ212: =H212+100*O212 -> 139.50200000000001 | AK212: 138.5 | AL212: 230 | AM212: 40.7 | AN212: 181 | AO212: 6.0999999999999999e-002 | AP212: 10 | AQ212: 太极转债!
A213: 60 | B213: 113043 | C213: 财通转债! | D213: 601108 | E213: 财通证券 | F213: 金融 | G213: 证券行业 | H213: 110.42 | I213: -3.5999999999999999e-003 | J213: 5.6999999999999993e-003 | K213: 11.35 | L213: 4.4000000000000003e-003 | M213: 110.2 | N213: 13.33 | O213: 0.29699999999999999 | P213: 85.15 | Q213: 19天 | R213: 5.53年 | S213: 无权 | T213: 38 | U213: 92 | V213: 2.2000000000000002e-002 | W213: 9.3000000000000013e-002 | X213: 7.9000000000000001e-002 | Y213: 407 | Z213: 1.78 | AA213: -4.0000000000000002e-004 | AB213: -3.8e-003 | AC213: 无权 | AD213: 无权 | AE213: 无权 | AF213: 89.62 | AG213: 0.47 | AH213: AAA | AI213: 3.8599999999999995e-002 | AJ213: =H213+100*O213 -> 140.12 | AK213: 135.7 | AL213: 205 | AM213: 46.1 | AN213: 227 | AO213: 7.2999999999999995e-002 | AP213: 10 | AQ213: 财通转债!
A214: 41 | B214: 113618 | C214: 美诺转债! | D214: 603538 | E214: 美诺华 | F214: 医药 | G214: 原料药 | H214: 115.55 | I214: -1.e-003 | J214: -2.8000000000000004e-003 | K214: 35.4 | L214: -5.8999999999999999e-003 | M214: 115.3 | N214: 37.47 | O214: 0.223 | P214: 94.48 | Q214: 53天 | R214: 5.63年 | S214: 3.63年 | T214: 5.2 | U214: 77 | V214: 0.126 | W214: 9.8000000000000004e-002 | X214: 9.3000000000000013e-002 | Y214: 53 | Z214: 3.34 | AA214: -4.0000000000000002e-004 | AB214: -5.1999999999999998e-003 | AC214: -2.81e-002 | AD214: -2.9900000000000003e-002 | AE214: 82.03 | AF214: 81.63 | AG214: 0.65 | AH214: AA- | AI214: 6.4600000000000005e-002 | AJ214: =H214+100*O214 -> 137.84999999999999 | AK214: 136.6 | AL214: 216 | AM214: 54.6 | AN214: 268 | AO214: -6.4000000000000001e-002 | AP214: 4 | AQ214: 美诺转债!
A215: 63 | B215: 113612 | C215: 永冠转债 | D215: 603681 | E215: 永冠新材 | F215: 化工 | G215: 其他 | H215: 121.67 | I215: -1.5600000000000001e-002 | J215: -5.1999999999999998e-003 | K215: 25.25 | L215: -2.7000000000000003e-002 | M215: 121.2 | N215: 20.79 | O215: 2.e-003 | P215: 121.45 | Q215: 17天 | R215: 5.53年 | S215: 3.53年 | T215: 5.2 | U215: 17 | V215: 2.7000000000000003e-002 | W215: 0.124 | X215: 0.14999999999999999 | Y215: 42 | Z215: 2.67 | AA215: -7.000000000000001e-004 | AB215: -7.1999999999999998e-003 | AC215: -4.1700000000000001e-002 | AD215: -4.3700000000000003e-002 | AE215: 82.83 | AF215: 86.4 | AG215: 0.77 | AH215: AA- | AI215: 6.4600000000000005e-002 | AJ215: =H215+100*O215 -> 121.87 | AK215: 121.9 | AL215: 59 | AM215: 35.5 | AN215: 134 | AO215: 5.0999999999999997e-002 | AP215: 6 | AQ215: 永冠转债
A216: 286 | B216: 128057 | C216: 博彦转债 | D216: 2649 | E216: 博彦科技 | F216: 计算机及 | G216: 软件开发 | H216: 116.681 | I216: -7.8000000000000005e-003 | J216: -5.1000000000000004e-003 | K216: 9.51 | L216: -1.8600000000000002e-002 | M216: 116.3 | N216: 8.5 | O216: 4.2999999999999997e-002 | P216: 111.88 | Q216: 转股中 | R216: 3.77年 | S216: 1.77年 | T216: 5.07 | U216: 3 | V216: 5.0000000000000001e-003 | W216: 0.10000000000000001 | X216: 0.11199999999999999 | Y216: 51 | Z216: 1.67 | AA216: -8.9999999999999998e-004 | AB216: -8.5000000000000006e-003 | AC216: -6.3700000000000007e-002 | AD216: -6.6299999999999998e-002 | AE216: 91.36 | AF216: 92.68 | AG216: 0.69 | AH216: AA- | AI216: 6.3299999999999995e-002 | AJ216: =H216+100*O216 -> 120.98099999999999 | AK216: 121.5 | AL216: 56 | AM216: 28.8 | AN216: 54 | AO216: -1.e-003 | AP216: 26 | AQ216: 博彦转债
A217: 40 | B217: 123093 | C217: 金陵转债 | D217: 300651 | E217: 金陵体育 | F217: 其他 | G217: 文化教育 | H217: 130.286 | I217: -3.49e-002 | J217: 4.7599999999999996e-002 | K217: 43.55 | L217: 2.18e-002 | M217: 129.3 | N217: 49.29 | O217: 0.47499999999999998 | P217: 88.35 | Q217: 59天 | R217: 5.64年 | S217: 3.65年 | T217: 2.5 | U217: 1119. | V217: 3.29 | W217: 4.4999999999999998e-002 | X217: 3.9e-002 | Y217: 56 | Z217: 8.13 | AA217: -1.4000000000000002e-003 | AB217: -9.7000000000000003e-003 | AC217: -5.2400000000000002e-002 | AD217: -5.5300000000000002e-002 | AE217: 80.89 | AF217: 86.74 | AG217: 0.58 | AH217: A+ | AI217: 7.5600000000000001e-002 | AJ217: =H217+100*O217 -> 177.786 | AK217: 172.2 | AL217: 325 | AM217: 85.5 | AN217: 329 | AO217: 3.0000000000000001e-003 | AP217: 6 | AQ217: 金陵转债
A218: 28 | B218: 113045 | C218: 环旭转债! | D218: 601231 | E218: 环旭电子 | F218: 电子 | G218: 电子产品 | H218: 112.9 | I218: 4.0000000000000002e-004 | J218: -4.0000000000000002e-004 | K218: 16.36 | L218: 0. | M218: 112 | N218: 20.25 | O218: 0.39700000000000002 | P218: 80.79 | Q218: 6月16天 | R218: 5.76年 | S218: 2.77年 | T218: 34.5 | U218: 9.7 | V218: 2.e-003 | W218: 9.5000000000000001e-002 | X218: 7.6999999999999999e-002 | Y218: 361 | Z218: 2.92 | AA218: -1.4000000000000002e-003 | AB218: -5.1999999999999998e-003 | AC218: -3.1099999999999999e-002 | AD218: -3.3000000000000002e-002 | AE218: 91.31 | AF218: 88.79 | AG218: 0.4 | AH218: AA+ | AI218: 4.1599999999999998e-002 | AJ218: =H218+100*O218 -> 152.60000000000002 | AK218: 145 | AL218: 266 | AM218: 53.7 | AN218: 263 | AO218: 2.2000000000000002e-002 | AP218: 4 | AQ218: 环旭转债!
A219: 197 | B219: 110067 | C219: 华安转债! | D219: 600909 | E219: 华安证券 | F219: 金融 | G219: 证券行业 | H219: 111.11 | I219: 8.0000000000000004e-004 | J219: 5.4000000000000003e-003 | K219: 6.41 | L219: 1.26e-002 | M219: 110.3 | N219: 6.98 | O219: 0.20999999999999999 | P219: 91.83 | Q219: 转股中 | R219: 4.79年 | S219: 无权 | T219: 28 | U219: 25 | V219: 8.0000000000000002e-003 | W219: 0.121 | X219: 0.111 | Y219: 232 | Z219: 1.62 | AA219: -1.5e-003 | AB219: -5.5000000000000005e-003 | AC219: 无权 | AD219: 无权 | AE219: 无权 | AF219: 92.77 | AG219: 0.49 | AH219: AAA | AI219: 3.73e-002 | AJ219: =H219+100*O219 -> 132.11000000000001 | AK219: 130.4 | AL219: 149 | AM219: 37.6 | AN219: 153 | AO219: 4.0999999999999995e-002 | AP219: 26 | AQ219: 华安转债!
A220: 138 | B220: 127020 | C220: 中金转债 | D220: 60 | E220: 中金岭南 | F220: 有色金属 | G220: 有色行业 | H220: 114.617 | I220: 5.3e-003 | J220: -2.0000000000000001e-004 | K220: 4.84 | L220: 8.3000000000000001e-003 | M220: 113.7 | N220: 4.71 | O220: 0.115 | P220: 102.76 | Q220: 转股中 | R220: 5年52天 | S220: 3年53天 | T220: 38 | U220: 28 | V220: 6.0000000000000001e-003 | W220: 0.22 | X220: 0.22600000000000001 | Y220: 173 | Z220: 1.45 | AA220: -1.6000000000000001e-003 | AB220: -6.4000000000000003e-003 | AC220: -3.3500000000000002e-002 | AD220: -3.49e-002 | AE220: 89.6 | AF220: 92.47 | AG220: 0.61 | AH220: AA+ | AI220: 4.1599999999999998e-002 | AJ220: =H220+100*O220 -> 126.117 | AK220: 126.5 | AL220: 97 | AM220: 34 | AN220: 108 | AO220: -1.3000000000000001e-002 | AP220: 15 | AQ220: 中金转债
A221: 75 | B221: 110077 | C221: 洪城转债 | D221: 600461 | E221: 洪城环境 | F221: 城市公用 | G221: 城市公用 | H221: 114.6 | I221: -5.5000000000000005e-003 | J221: -5.0000000000000001e-004 | K221: 7.35 | L221: -9.3999999999999986e-003 | M221: 113.5 | N221: 7.13 | O221: 0.11199999999999999 | P221: 103.09 | Q221: 转股中 | R221: 5.48年 | S221: 3.48年 | T221: 18 | U221: 13 | V221: 6.0000000000000001e-003 | W221: 0.25800000000000001 | X221: 0.26600000000000001 | Y221: 70 | Z221: 1.3 | AA221: -1.8e-003 | AB221: -6.1999999999999998e-003 | AC221: -3.0899999999999997e-002 | AD221: -3.2099999999999997e-002 | AE221: 88.2 | AF221: 91.03 | AG221: 0.63 | AH221: AA+ | AI221: 4.1599999999999998e-002 | AJ221: =H221+100*O221 -> 125.8 | AK221: 126.1 | AL221: 93 | AM221: 35.1 | AN221: 125 | AO221: -6.0000000000000001e-003 | AP221: 7 | AQ221: 洪城转债
A222: 49 | B222: 123090 | C222: 三诺转债 | D222: 300298 | E222: 三诺生物 | F222: 医药 | G222: 医疗器械 | H222: 118.465 | I222: -9.1000000000000004e-003 | J222: -7.9000000000000008e-003 | K222: 31.39 | L222: -3.5299999999999998e-002 | M222: 117.1 | N222: 35.35 | O222: 0.33399999999999996 | P222: 88.8 | Q222: 28天 | R222: 5.56年 | S222: 3.57年 | T222: 5 | U222: 6.5 | V222: 1.1000000000000001e-002 | W222: 2.7999999999999997e-002 | X222: 2.5000000000000001e-002 | Y222: 177 | Z222: 6.65 | AA222: -2.0999999999999999e-003 | AB222: -7.4999999999999997e-003 | AC222: -3.5499999999999997e-002 | AD222: -3.73e-002 | AE222: 88.47 | AF222: 92.74 | AG222: 0.48 | AH222: AA | AI222: 4.36e-002 | AJ222: =H222+100*O222 -> 151.86500000000001 | AK222: 148.1 | AL222: 277 | AM222: 55.4 | AN222: 273 | AO222: -8.1000000000000003e-002 | AP222: 3 | AQ222: 三诺转债
A223: 2 | B223: 123113 | C223: 仙乐转债 | D223: 300791 | E223: 仙乐健康 | F223: 食品饮料 | G223: 食品饮料 | H223: 120.18 | I223: -3.9000000000000003e-003 | J223: 5.5000000000000005e-003 | K223: 79.83 | L223: 2.5000000000000001e-003 | M223: 118.5 | N223: 85.98 | O223: 0.29399999999999998 | P223: 92.85 | Q223: 5月0天 | R223: 5.89年 | S223: 3.89年 | T223: 10.3 | U223: 8.1 | V223: 6.9999999999999993e-003 | W223: 0.107 | X223: 9.9000000000000005e-002 | Y223: 96 | Z223: 4.27 | AA223: -2.3999999999999998e-003 | AB223: -7.9000000000000008e-003 | AC223: -3.5699999999999996e-002 | AD223: -3.7400000000000003e-002 | AE223: 80.73 | AF223: 82.53 | AG223: 0.63 | AH223: AA- | AI223: 6.4600000000000005e-002 | AJ223: =H223+100*O223 -> 149.58000000000001 | AK223: 147.5 | AL223: 275 | AM223: 65 | AN223: 309 | AO223: 1.8000000000000002e-002 | AP223: 2 | AQ223: 仙乐转债
A224: 195 | B224: 113572 | C224: 三祥转债! | D224: 603663 | E224: 三祥新材 | F224: 其他 | G224: 其他 | H224: 114.23 | I224: -4.8999999999999998e-003 | J224: -4.0000000000000001e-003 | K224: 14.13 | L224: -1.26e-002 | M224: 112.8 | N224: 14.09 | O224: 0.13900000000000001 | P224: 100.28 | Q224: 转股中 | R224: 4.79年 | S224: 2.79年 | T224: 1.69 | U224: 1.5 | V224: 8.0000000000000002e-003 | W224: 6.2e-002 | X224: 6.2e-002 | Y224: 27 | Z224: 4.25 | AA224: -2.7000000000000001e-003 | AB224: -7.4999999999999997e-003 | AC224: -3.3700000000000001e-002 | AD224: -3.5699999999999996e-002 | AE224: 83.72 | AF224: 80.58 | AG224: 0.71 | AH224: A+ | AI224: 7.4299999999999991e-002 | AJ224: =H224+100*O224 -> 128.13 | AK224: 128.2 | AL224: 116 | AM224: 44.5 | AN224: 216 | AO224: -1.2e-002 | AP224: 19 | AQ224: 三祥转债!
A225: 165 | B225: 128109 | C225: 楚江转债 | D225: 2171 | E225: 楚江新材 | F225: 有色金属 | G225: 铜金属 | H225: 116.815 | I225: -3.3e-003 | J225: 2.7000000000000001e-003 | K225: 8.06 | L225: -1.1999999999999999e-003 | M225: 115.3 | N225: 8.73 | O225: 0.26500000000000001 | P225: 92.33 | Q225: 转股中 | R225: 5年6.1天 | S225: 3年7天 | T225: 18.3 | U225: 2.2 | V225: 1.e-003 | W225: 0.17000000000000001 | X225: 0.157 | Y225: 107 | Z225: 1.89 | AA225: -2.7000000000000001e-003 | AB225: -8.1000000000000013e-003 | AC225: -3.6799999999999999e-002 | AD225: -3.8900000000000004e-002 | AE225: 90.75 | AF225: 93.52 | AG225: 0.51 | AH225: AA | AI225: 4.36e-002 | AJ225: =H225+100*O225 -> 143.315 | AK225: 141.3 | AL225: 249 | AM225: 47.8 | AN225: 231 | AO225: 4.0000000000000001e-003 | AP225: 6 | AQ225: 楚江转债
A226: 103 | B226: 113603 | C226: 东缆转债! | D226: 603606 | E226: 东方电缆 | F226: 能源电力 | G226: 电力设备 | H226: 116.71 | I226: 9.7999999999999997e-003 | J226: -2.2000000000000001e-003 | K226: 20.08 | L226: 1.72e-002 | M226: 115.1 | N226: 23.65 | O226: 0.375 | P226: 84.9 | Q226: 转股中 | R226: 5.32年 | S226: 3.33年 | T226: 8 | U226: 9.7 | V226: 1.e-002 | W226: 6.0999999999999999e-002 | X226: 5.2000000000000005e-002 | Y226: 131 | Z226: 3.93 | AA226: -2.7000000000000001e-003 | AB226: -7.7000000000000002e-003 | AC226: -3.3799999999999997e-002 | AD226: -3.5699999999999996e-002 | AE226: 89.38 | AF226: 92.11 | AG226: 0.44 | AH226: AA | AI226: 4.36e-002 | AJ226: =H226+100*O226 -> 154.20999999999998 | AK226: 148.5 | AL226: 286 | AM226: 56.4 | AN226: 280 | AO226: -2.2000000000000002e-002 | AP226: 7 | AQ226: 东缆转债!
A227: 11 | B227: 123110 | C227: 九典转债 | D227: 300705 | E227: 九典制药 | F227: 医药 | G227: 化学制药 | H227: 123.5 | I227: -1.0700000000000001e-002 | J227: -2.5000000000000001e-003 | K227: 29.68 | L227: -1.7500000000000002e-002 | M227: 121.4 | N227: 26.44 | O227: 0.10000000000000001 | P227: 112.25 | Q227: 4月13天 | R227: 5.84年 | S227: 3.84年 | T227: 2.7 | U227: 42 | V227: 0.126 | W227: 3.9e-002 | X227: 4.4000000000000004e-002 | Y227: 70 | Z227: 7.9 | AA227: -3.0000000000000001e-003 | AB227: -9.1999999999999998e-003 | AC227: -4.1399999999999999e-002 | AD227: -4.3299999999999998e-002 | AE227: 78.18 | AF227: 80.04 | AG227: 0.75 | AH227: A+ | AI227: 7.5600000000000001e-002 | AJ227: =H227+100*O227 -> 133.5 | AK227: 134.7 | AL227: 195 | AM227: 54.7 | AN227: 269 | AO227: -1.4999999999999999e-002 | AP227: 4 | AQ227: 九典转债
A228: 113 | B228: 113602 | C228: 景20转债! | D228: 603228 | E228: 景旺电子 | F228: 电子 | G228: 元器件制 | H228: 115.14 | I228: 2.9999999999999997e-004 | J228: 7.3000000000000001e-003 | K228: 25.96 | L228: 1.37e-002 | M228: 113.3 | N228: 27.4 | O228: 0.215 | P228: 94.74 | Q228: 转股中 | R228: 5.24年 | S228: 3.24年 | T228: 17.8 | U228: 6.1 | V228: 3.0000000000000001e-003 | W228: 8.0000000000000002e-002 | X228: 7.5999999999999998e-002 | Y228: 221 | Z228: 3.4 | AA228: -3.0999999999999999e-003 | AB228: -7.7000000000000002e-003 | AC228: -3.0299999999999997e-002 | AD228: -3.2300000000000002e-002 | AE228: 89.9 | AF228: 91.04 | AG228: 0.56 | AH228: AA | AI228: 4.36e-002 | AJ228: =H228+100*O228 -> 136.63999999999999 | AK228: 135.5 | AL228: 204 | AM228: 44.5 | AN228: 217 | AO228: 3.0000000000000001e-003 | AP228: 9 | AQ228: 景20转债!
A229: 30 | B229: 118000 | C229: 嘉元转债 | D229: 688388 | E229: 嘉元科技 | F229: 电子 | G229: 电子产品 | H229: 123.22 | I229: 3.3599999999999998e-002 | J229: 3.4000000000000002e-002 | K229: 77.35 | L229: 0.107 | M229: 121 | N229: 78.74 | O229: 0.254 | P229: 98.23 | Q229: 3月6天 | R229: 5.74年 | S229: 3.74年 | T229: 12.4 | U229: 113 | V229: 7.400000000000001e-002 | W229: 6.9000000000000006e-002 | X229: 6.8000000000000005e-002 | Y229: 179 | Z229: 6.56 | AA229: -3.2000000000000002e-003 | AB229: -9.3999999999999986e-003 | AC229: -4.2999999999999997e-002 | AD229: -4.4800000000000006e-002 | AE229: 81.56 | AF229: 85.08 | AG229: 0.63 | AH229: AA- | AI229: 6.4600000000000005e-002 | AJ229: =H229+100*O229 -> 148.62 | AK229: 148.2 | AL229: 280 | AM229: 63.1 | AN229: 304 | AO229: 6.6000000000000003e-002 | AP229: 3 | AQ229: 嘉元转债
A230: 210 | B230: 128094 | C230: 星帅转债 | D230: 2860 | E230: 星帅尔 | F230: 家电 | G230: 零部件制 | H230: 122.913 | I230: 8.9999999999999998e-004 | J230: 7.1999999999999998e-003 | K230: 16.9 | L230: 1.0800000000000001e-002 | M230: 121 | N230: 13.95 | O230: 1.4999999999999999e-002 | P230: 121.15 | Q230: 转股中 | R230: 4.64年 | S230: 2.64年 | T230: 2.71 | U230: 8.6 | V230: 2.6000000000000002e-002 | W230: 8.0000000000000002e-002 | X230: 9.6999999999999989e-002 | Y230: 34 | Z230: 3.3 | AA230: -3.4999999999999996e-003 | AB230: -1.11e-002 | AC230: -5.8200000000000002e-002 | AD230: -6.0700000000000004e-002 | AE230: 85.33 | AF230: 87.47 | AG230: 0.76 | AH230: A+ | AI230: 7.4299999999999991e-002 | AJ230: =H230+100*O230 -> 124.413 | AK230: 124.7 | AL230: 79 | AM230: 37.2 | AN230: 149 | AO230: 2.6000000000000002e-002 | AP230: 30 | AQ230: 星帅转债
A231: 175 | B231: 113577 | C231: 春秋转债! | D231: 603890 | E231: 春秋电子 | F231: 电子 | G231: 电子产品 | H231: 119.69 | I231: -2.8300000000000002e-002 | J231: 7.3000000000000001e-003 | K231: 12.38 | L231: -2.98e-002 | M231: 117.7 | N231: 11.06 | O231: 6.9000000000000006e-002 | P231: 111.93 | Q231: 转股中 | R231: 4.88年 | S231: 2.88年 | T231: 1.78 | U231: 14 | V231: 6.5000000000000002e-002 | W231: 3.7000000000000005e-002 | X231: 4.0999999999999995e-002 | Y231: 48 | Z231: 2.56 | AA231: -3.4999999999999996e-003 | AB231: -9.7999999999999997e-003 | AC231: -4.6600000000000003e-002 | AD231: -4.87e-002 | AE231: 86.1 | AF231: 87.8 | AG231: 0.71 | AH231: AA- | AI231: 6.3299999999999995e-002 | AJ231: =H231+100*O231 -> 126.59 | AK231: 127.4 | AL231: 112 | AM231: 39.6 | AN231: 169 | AO231: -4.0000000000000001e-002 | AP231: 13 | AQ231: 春秋转债!
A232: 80 | B232: 127024 | C232: 盈峰转债 | D232: 967 | E232: 盈峰环境 | F232: 机械装备 | G232: 专用设备 | H232: 119 | I232: 1.7000000000000001e-002 | J232: -1.83e-002 | K232: 8.03 | L232: -2.5000000000000001e-003 | M232: 116.8 | N232: 8.31 | O232: 0.23100000000000001 | P232: 96.63 | Q232: 转股中 | R232: 5.44年 | S232: 3.44年 | T232: 14.8 | U232: 11 | V232: 6.9999999999999993e-003 | W232: 5.7999999999999996e-002 | X232: 5.5999999999999994e-002 | Y232: 254 | Z232: 1.51 | AA232: -3.4999999999999996e-003 | AB232: -8.8999999999999999e-003 | AC232: -3.8699999999999998e-002 | AD232: -4.0399999999999998e-002 | AE232: 89.28 | AF232: 93.93 | AG232: 0.54 | AH232: AA+ | AI232: 4.1599999999999998e-002 | AJ232: =H232+100*O232 -> 142.09999999999999 | AK232: 141.4 | AL232: 250 | AM232: 47.4 | AN232: 230 | AO232: 6.0000000000000001e-003 | AP232: 5 | AQ232: 盈峰转债
A233: 348 | B233: 128018 | C233: 时达转债! | D233: 2527 | E233: 新时达 | F233: 机械装备 | G233: 机器人及 | H233: 110.428 | I233: -2.8999999999999998e-003 | J233: -2.8999999999999998e-003 | K233: 6.87 | L233: -1.43e-002 | M233: 109.3 | N233: 7.42 | O233: 0.193 | P233: 92.59 | Q233: 转股中 | R233: 2.44年 | S233: 0.44年 | T233: 4.04 | U233: 13 | V233: 2.8999999999999998e-002 | W233: 9.5000000000000001e-002 | X233: 8.8000000000000009e-002 | Y233: 43 | Z233: 1.62 | AA233: -4.3e-003 | AB233: -1.1299999999999999e-002 | AC233: -0.13500000000000001 | AD233: -0.14099999999999999 | AE233: 99.37 | AF233: 99.35 | AG233: 0.4 | AH233: AA | AI233: 4.0599999999999997e-002 | AJ233: =H233+100*O233 -> 129.72800000000001 | AK233: 128.3 | AL233: 118 | AM233: 28.9 | AN233: 55 | AO233: 2.9999999999999999e-002 | AP233: 37 | AQ233: 时达转债!
A234: 79 | B234: 127025 | C234: 冀东转债 | D234: 401 | E234: 冀东水泥 | F234: 建筑 | G234: 水泥 | H234: 112.702 | I234: 0. | J234: -5.3e-003 | K234: 14.1 | L234: -1.0500000000000001e-002 | M234: 110.1 | N234: 15.78 | O234: 0.26100000000000001 | P234: 89.35 | Q234: 转股中 | R234: 5.44年 | S234: 3.44年 | T234: 17.8 | U234: 5.9 | V234: 3.0000000000000001e-003 | W234: 8.900000000000001e-002 | X234: 8.0000000000000002e-002 | Y234: 199 | Z234: 1.34 | AA234: -4.3e-003 | AB234: -7.8000000000000005e-003 | AC234: -2.52e-002 | AD234: -2.6699999999999998e-002 | AE234: 89.8 | AF234: 89.89 | AG234: 0.5 | AH234: AAA | AI234: 3.8599999999999995e-002 | AJ234: =H234+100*O234 -> 138.80199999999999 | AK234: 136.1 | AL234: 209 | AM234: 46.2 | AN234: 229 | AO234: -4.0000000000000001e-003 | AP234: 10 | AQ234: 冀东转债
A235: 131 | B235: 110073 | C235: 国投转债 | D235: 600061 | E235: 国投资本 | F235: 金融 | G235: 证券行业 | H235: 113.06 | I235: 1.1200000000000002e-002 | J235: -1.9e-003 | K235: 13.94 | L235: 1.83e-002 | M235: 110.5 | N235: 15.25 | O235: 0.23699999999999999 | P235: 91.41 | Q235: 转股中 | R235: 5年56天 | S235: 无权 | T235: 80 | U235: 107 | V235: 1.2e-002 | W235: 0.13600000000000001 | X235: 0.124 | Y235: 589 | Z235: 1.36 | AA235: -4.5000000000000005e-003 | AB235: -8.199999999999999e-003 | AC235: 无权 | AD235: 无权 | AE235: 无权 | AF235: 91.14 | AG235: 0.51 | AH235: AAA | AI235: 3.8599999999999995e-002 | AJ235: =H235+100*O235 -> 136.75999999999999 | AK235: 134.7 | AL235: 194 | AM235: 43.6 | AN235: 209 | AO235: 6.5000000000000002e-002 | AP235: 23 | AQ235: 国投转债
A236: 111 | B236: 128130 | C236: 景兴转债 | D236: 2067 | E236: 景兴纸业 | F236: 造纸包装 | G236: 包装用纸 | H236: 117.9 | I236: -6.8000000000000005e-003 | J236: -2.9999999999999997e-004 | K236: 3.99 | L236: -9.8999999999999991e-003 | M236: 115.1 | N236: 3.4 | O236: 5.0000000000000001e-003 | P236: 117.35 | Q236: 转股中 | R236: 5.26年 | S236: 3.26年 | T236: 10.7 | U236: 22 | V236: 1.7000000000000001e-002 | W236: 0.23100000000000001 | X236: 0.27100000000000002 | Y236: 46 | Z236: 0.94 | AA236: -4.5999999999999999e-003 | AB236: -9.7000000000000003e-003 | AC236: -3.73e-002 | AD236: -3.9199999999999999e-002 | AE236: 89.63 | AF236: 92.37 | AG236: 0.71 | AH236: AA | AI236: 4.36e-002 | AJ236: =H236+100*O236 -> 118.40000000000001 | AK236: 118.4 | AL236: 27 | AM236: 26.1 | AN236: 34 | AO236: 3.9e-002 | AP236: 13 | AQ236: 景兴转债
A237: 215 | B237: 128091 | C237: 新天转债 | D237: 2873 | E237: 新天药业 | F237: 医药 | G237: 中药 | H237: 122.1 | I237: -2.1600000000000001e-002 | J237: 8.6999999999999994e-003 | K237: 17.5 | L237: -1.8500000000000003e-002 | M237: 119.4 | N237: 16.39 | O237: 0.14400000000000002 | P237: 106.77 | Q237: 转股中 | R237: 4.59年 | S237: 2.59年 | T237: 1.76 | U237: 83 | V237: 0.38400000000000001 | W237: 8.5999999999999993e-002 | X237: 9.1999999999999998e-002 | Y237: 21 | Z237: 2.52 | AA237: -5.0000000000000001e-003 | AB237: -1.2199999999999999e-002 | AC237: -5.5599999999999997e-002 | AD237: -5.8400000000000001e-002 | AE237: 85.97 | AF237: 86.68 | AG237: 0.7 | AH237: A+ | AI237: 7.4299999999999991e-002 | AJ237: =H237+100*O237 -> 136.5 | AK237: 137.4 | AL237: 222 | AM237: 50.7 | AN237: 248 | AO237: -2.5000000000000001e-002 | AP237: 18 | AQ237: 新天转债
A238: 33 | B238: 123098 | C238: 一品转债 | D238: 300723 | E238: 一品红 | F238: 医药 | G238: 医药行业 | H238: 127.501 | I238: -1.7299999999999999e-002 | J238: 2.8999999999999998e-003 | K238: 26.69 | L238: -2.2000000000000002e-002 | M238: 124 | N238: 25.52 | O238: 0.21899999999999997 | P238: 104.58 | Q238: 2月7天 | R238: 5.67年 | S238: 3.67年 | T238: 4.8 | U238: 4.4 | V238: 6.9999999999999993e-003 | W238: 6.3e-002 | X238: 6.6000000000000003e-002 | Y238: 77 | Z238: 2.77 | AA238: -5.0000000000000001e-003 | AB238: -1.2e-002 | AC238: -5.2300000000000006e-002 | AD238: -5.4100000000000002e-002 | AE238: 81.92 | AF238: 87.57 | AG238: 0.66 | AH238: AA- | AI238: 6.4600000000000005e-002 | AJ238: =H238+100*O238 -> 149.40100000000001 | AK238: 150.4 | AL238: 292 | AM238: 62.9 | AN238: 303 | AO238: -0.113 | AP238: 3 | AQ238: 一品转债
A239: 278 | B239: 127012 | C239: 招路转债! | D239: 1965 | E239: 招商公路 | F239: 机场高速 | G239: 高速 | H239: 109.994 | I239: -8.9999999999999998e-004 | J239: -7.8000000000000005e-003 | K239: 7.86 | L239: -2.e-002 | M239: 107.9 | N239: 8.81 | O239: 0.23300000000000001 | P239: 89.22 | Q239: 转股中 | R239: 3.81年 | S239: 1.82年 | T239: 50 | U239: 21 | V239: 4.0000000000000001e-003 | W239: 0.10300000000000001 | X239: 9.1999999999999998e-002 | Y239: 486 | Z239: 0.97 | AA239: -5.1000000000000004e-003 | AB239: -8.8999999999999999e-003 | AC239: -3.9199999999999999e-002 | AD239: -4.07e-002 | AE239: 94.56 | AF239: 93.99 | AG239: 0.44 | AH239: AAA | AI239: 3.73e-002 | AJ239: =H239+100*O239 -> 133.29400000000001 | AK239: 130.8 | AL239: 151 | AM239: 36.2 | AN239: 141 | AO239: -2.3e-002 | AP239: 32 | AQ239: 招路转债!
A240: 51 | B240: 128141 | C240: 旺能转债 | D240: 2034 | E240: 旺能环境 | F240: 城市公用 | G240: 三废处理 | H240: 118.427 | I240: -1.72e-002 | J240: 1.5e-003 | K240: 18.39 | L240: -2.2799999999999997e-002 | M240: 115.1 | N240: 16.47 | O240: 6.0999999999999999e-002 | P240: 111.66 | Q240: 26天 | R240: 5.55年 | S240: 3.56年 | T240: 14 | U240: 37 | V240: 2.2000000000000002e-002 | W240: 0.18100000000000002 | X240: 0.20199999999999999 | Y240: 77 | Z240: 1.64 | AA240: -5.1999999999999998e-003 | AB240: -1.e-002 | AC240: -3.56e-002 | AD240: -3.73e-002 | AE240: 88.51 | AF240: 91.21 | AG240: 0.69 | AH240: AA | AI240: 4.36e-002 | AJ240: =H240+100*O240 -> 124.527 | AK240: 125.2 | AL240: 87 | AM240: 34 | AN240: 107 | AO240: -2.e-003 | AP240: 5 | AQ240: 旺能转债
A241: 135 | B241: 123060 | C241: 苏试转债 | D241: 300416 | E241: 苏试试验 | F241: 机械装备 | G241: 专用设备 | H241: 121 | I241: -8.8000000000000005e-003 | J241: -2.9999999999999997e-004 | K241: 18.79 | L241: -1.3600000000000001e-002 | M241: 117.6 | N241: 18.28 | O241: 0.17699999999999999 | P241: 102.79 | Q241: 转股中 | R241: 5年53天 | S241: 3年54天 | T241: 3.1 | U241: 6.2 | V241: 1.6e-002 | W241: 6.3e-002 | X241: 6.4000000000000001e-002 | Y241: 50 | Z241: 4.09 | AA241: -5.6000000000000008e-003 | AB241: -1.1599999999999999e-002 | AC241: -4.53e-002 | AD241: -4.7400000000000005e-002 | AE241: 84.68 | AF241: 85.84 | AG241: 0.67 | AH241: AA- | AI241: 6.4600000000000005e-002 | AJ241: =H241+100*O241 -> 138.69999999999999 | AK241: 139.2 | AL241: 238 | AM241: 53.4 | AN241: 261 | AO241: 1.7000000000000001e-002 | AP241: 9 | AQ241: 苏试转债
A242: 95 | B242: 123070 | C242: 鹏辉转债 | D242: 300438 | E242: 鹏辉能源 | F242: 汽车 | G242: 零部件制 | H242: 118.795 | I242: 3.3000000000000002e-002 | J242: 1.7299999999999999e-002 | K242: 20.38 | L242: 8.2299999999999998e-002 | M242: 115.1 | N242: 20.16 | O242: 0.17499999999999999 | P242: 101.09 | Q242: 转股中 | R242: 5.39年 | S242: 3.40年 | T242: 8.9 | U242: 568 | V242: 0.51600000000000001 | W242: 0.10400000000000001 | X242: 0.105 | Y242: 86 | Z242: 3.62 | AA242: -5.8999999999999999e-003 | AB242: -1.09e-002 | AC242: -3.7999999999999999e-002 | AD242: -3.9800000000000002e-002 | AE242: 89.11 | AF242: 91.83 | AG242: 0.61 | AH242: AA | AI242: 4.36e-002 | AJ242: =H242+100*O242 -> 136.29500000000002 | AK242: 136.5 | AL242: 214 | AM242: 44.7 | AN242: 218 | AO242: 0.157 | AP242: 4 | AQ242: 鹏辉转债
A243: 246 | B243: 128075 | C243: 远东转债! | D243: 2406 | E243: 远东传动 | F243: 汽车 | G243: 零部件制 | H243: 118 | I243: -5.8999999999999999e-003 | J243: 2.7000000000000001e-003 | K243: 6.16 | L243: -4.7999999999999996e-003 | M243: 114.9 | N243: 5.54 | O243: 6.0999999999999999e-002 | P243: 111.19 | Q243: 转股中 | R243: 4.32年 | S243: 2.32年 | T243: 5.44 | U243: 3 | V243: 5.0000000000000001e-003 | W243: 0.14099999999999999 | X243: 0.157 | Y243: 38 | Z243: 1.16 | AA243: -6.3e-003 | AB243: -1.24e-002 | AC243: -5.2199999999999996e-002 | AD243: -5.4600000000000003e-002 | AE243: 93.37 | AF243: 96.43 | AG243: 0.66 | AH243: AA | AI243: 4.2300000000000004e-002 | AJ243: =H243+100*O243 -> 124.09999999999999 | AK243: 124.8 | AL243: 82 | AM243: 28.4 | AN243: 50 | AO243: -1.3999999999999999e-002 | AP243: 15 | AQ243: 远东转债!
A244: 8 | B244: 113623 | C244: 凤21转债 | D244: 603225 | E244: 新凤鸣 | F244: 化工 | G244: 化纤 | H244: 121.78 | I244: 2.5999999999999999e-003 | J244: 7.1999999999999998e-003 | K244: 19.22 | L244: 1.37e-002 | M244: 117.1 | N244: 16.6 | O244: 5.2000000000000005e-002 | P244: 115.78 | Q244: 4月19天 | R244: 5.86年 | S244: 3.86年 | T244: 25 | U244: 4.7 | V244: 2.e-003 | W244: 9.3000000000000013e-002 | X244: 0.107 | Y244: 269 | Z244: 2.2 | AA244: -6.8000000000000005e-003 | AB244: -1.18e-002 | AC244: -3.9599999999999996e-002 | AD244: -4.1200000000000001e-002 | AE244: 87.36 | AF244: 91.58 | AG244: 0.71 | AH244: AA | AI244: 4.36e-002 | AJ244: =H244+100*O244 -> 126.98 | AK244: 127.8 | AL244: 115 | AM244: 36.2 | AN244: 140 | AO244: 5.7000000000000002e-002 | AP244: 3 | AQ244: 凤21转债
A245: 86 | B245: 113607 | C245: 伟20转债! | D245: 603568 | E245: 伟明环保 | F245: 城市公用 | G245: 三废处理 | H245: 119.5 | I245: -8.3000000000000001e-003 | J245: 1.0500000000000001e-002 | K245: 23.53 | L245: 3.4000000000000002e-003 | M245: 115.1 | N245: 22.01 | O245: 0.11800000000000001 | P245: 106.91 | Q245: 转股中 | R245: 5.43年 | S245: 3.43年 | T245: 12 | U245: 1.3 | V245: 1.e-003 | W245: 4.0999999999999995e-002 | X245: 4.2999999999999997e-002 | Y245: 296 | Z245: 5.29 | AA245: -6.9999999999999993e-003 | AB245: -1.1899999999999999e-002 | AC245: -3.9199999999999999e-002 | AD245: -4.0999999999999995e-002 | AE245: 88.97 | AF245: 91.69 | AG245: 0.65 | AH245: AA | AI245: 4.36e-002 | AJ245: =H245+100*O245 -> 131.30000000000001 | AK245: 132.1 | AL245: 166 | AM245: 40.4 | AN245: 177 | AO245: 1.3999999999999999e-002 | AP245: 5 | AQ245: 伟20转债!
A246: 345 | B246: 123002 | C246: 国祯转债!! | D246: 300388 | E246: 节能国祯 | F246: 城市公用 | G246: 三废处理 | H246: 110.723 | I246: -1.8e-003 | J246: 1.8e-003 | K246: 8.2 | L246: -9.7000000000000003e-003 | M246: 108.8 | N246: 8.48 | O246: 0.14499999999999999 | P246: 96.7 | Q246: 转股中 | R246: 2.49年 | S246: 0.49年 | T246: 2.52 | U246: 0.5 | V246: 2.e-003 | W246: 4.4000000000000004e-002 | X246: 4.2999999999999997e-002 | Y246: 57 | Z246: 1.55 | AA246: -7.0999999999999995e-003 | AB246: -1.3600000000000001e-002 | AC246: -0.13200000000000001 | AD246: -0.13600000000000001 | AE246: 98.93 | AF246: 98.68 | AG246: 0 | AH246: AA | AI246: 4.0599999999999997e-002 | AJ246: =H246+100*O246 -> 125.223 | AK246: 124.7 | AL246: 80 | AM246: 25.8 | AN246: 33 | AO246: 2.5000000000000001e-002 | AP246: 15 | AQ246: 国祯转债!!
A247: 82 | B247: 128136 | C247: 立讯转债! | D247: 2475 | E247: 立讯精密 | F247: 电子 | G247: 元器件制 | H247: 116.586 | I247: 2.5000000000000001e-003 | J247: -6.1999999999999998e-003 | K247: 39.3 | L247: -1.4999999999999999e-002 | M247: 111.9 | N247: 58.36 | O247: 0.73099999999999998 | P247: 67.34 | Q247: 转股中 | R247: 5.43年 | S247: 3.44年 | T247: 30 | U247: 45 | V247: 1.3000000000000001e-002 | W247: 1.1000000000000001e-002 | X247: 6.9999999999999993e-003 | Y247: 2765. | Z247: 9.56 | AA247: -7.6e-003 | AB247: -1.15e-002 | AC247: -3.5499999999999997e-002 | AD247: -3.6699999999999997e-002 | AE247: 88.46 | AF247: 89.9 | AG247: 0.25 | AH247: AA+ | AI247: 4.1599999999999998e-002 | AJ247: =H247+100*O247 -> 189.68599999999998 | AK247: 165.8 | AL247: 322 | AM247: 75.9 | AN247: 323 | AO247: 8.9999999999999997e-002 | AP247: 12 | AQ247: 立讯转债!
A248: 232 | B248: 123035 | C248: 利德转债! | D248: 300296 | E248: 利亚德 | F248: 电子 | G248: LED制 | H248: 119.04 | I248: -1.0200000000000001e-002 | J248: 8.6e-003 | K248: 7.2 | L248: -2.8000000000000004e-003 | M248: 115.1 | N248: 6.96 | O248: 0.151 | P248: 103.45 | Q248: 转股中 | R248: 4.46年 | S248: 2.47年 | T248: 8 | U248: 11 | V248: 1.1000000000000001e-002 | W248: 4.4000000000000004e-002 | X248: 4.4999999999999998e-002 | Y248: 183 | Z248: 2.51 | AA248: -7.7000000000000002e-003 | AB248: -1.3600000000000001e-002 | AC248: -5.2000000000000005e-002 | AD248: -5.4400000000000004e-002 | AE248: 93.48 | AF248: 96.87 | AG248: 0.58 | AH248: AA+ | AI248: 4.0300000000000002e-002 | AJ248: =H248+100*O248 -> 134.14000000000001 | AK248: 134.6 | AL248: 190 | AM248: 37.8 | AN248: 155 | AO248: 2.e-002 | AP248: 15 | AQ248: 利德转债!
A249: 262 | B249: 113536 | C249: 三星转债 | D249: 603578 | E249: DR三星新 | F249: 家电 | G249: 零部件制 | H249: 118.37 | I249: -8.8000000000000005e-003 | J249: 1.8e-003 | K249: 15.14 | L249: -1.11e-002 | M249: 114.8 | N249: 13.76 | O249: 7.5999999999999998e-002 | P249: 110.03 | Q249: 转股中 | R249: 4年2.1天 | S249: 2年3.1天 | T249: 1.49 | U249: 11 | V249: 6.0999999999999999e-002 | W249: 0.107 | X249: 0.11800000000000001 | Y249: 14 | Z249: 1.86 | AA249: -7.8000000000000005e-003 | AB249: -1.43e-002 | AC249: -6.13e-002 | AD249: -6.4000000000000001e-002 | AE249: 94.5 | AF249: 97.6 | AG249: 0.63 | AH249: AA | AI249: 4.2300000000000004e-002 | AJ249: =H249+100*O249 -> 125.97 | AK249: 126.7 | AL249: 102 | AM249: 29.1 | AN249: 57 | AO249: -0.28399999999999997 | AP249: 35 | AQ249: 三星转债
A250: 70 | B250: 123079 | C250: 运达转债 | D250: 300772 | E250: 运达股份 | F250: 能源电力 | G250: 风能 | H250: 120.102 | I250: -5.7999999999999996e-003 | J250: 1.0700000000000001e-002 | K250: 16.35 | L250: 7.4000000000000003e-003 | M250: 115.1 | N250: 15.12 | O250: 0.111 | P250: 108.13 | Q250: 10天 | R250: 5.51年 | S250: 3.51年 | T250: 5.77 | U250: 5 | V250: 6.9999999999999993e-003 | W250: 0.12 | X250: 0.13 | Y250: 48 | Z250: 2.85 | AA250: -7.8000000000000005e-003 | AB250: -1.26e-002 | AC250: -3.9699999999999999e-002 | AD250: -4.1399999999999999e-002 | AE250: 88.67 | AF250: 91.38 | AG250: 0.66 | AH250: AA | AI250: 4.36e-002 | AJ250: =H250+100*O250 -> 131.202 | AK250: 132.1 | AL250: 165 | AM250: 40.7 | AN250: 180 | AO250: 3.7999999999999999e-002 | AP250: 4 | AQ250: 运达转债
A251: 180 | B251: 123048 | C251: 应急转债! | D251: 300527 | E251: 中船应急 | F251: 机械装备 | G251: 专用设备 | H251: 117.2 | I251: -8.6999999999999994e-003 | J251: 6.7000000000000002e-003 | K251: 9.06 | L251: -3.3e-003 | M251: 112.8 | N251: 8.9 | O251: 0.151 | P251: 101.8 | Q251: 转股中 | R251: 4.87年 | S251: 2.87年 | T251: 3.8 | U251: 30 | V251: 6.5000000000000002e-002 | W251: 4.4000000000000004e-002 | X251: 4.4000000000000004e-002 | Y251: 87 | Z251: 3.28 | AA251: -8.0000000000000002e-003 | AB251: -1.2699999999999999e-002 | AC251: -4.0999999999999995e-002 | AD251: -4.2999999999999997e-002 | AE251: 91.71 | AF251: 93.4 | AG251: 0.6 | AH251: AA+ | AI251: 4.0300000000000002e-002 | AJ251: =H251+100*O251 -> 132.30000000000001 | AK251: 132.6 | AL251: 170 | AM251: 39.2 | AN251: 167 | AO251: 3.2000000000000001e-002 | AP251: 17 | AQ251: 应急转债!
A252: 275 | B252: 110057 | C252: 现代转债 | D252: 600420 | E252: 国药现代 | F252: 医药 | G252: 化学制药 | H252: 114.1 | I252: -1.0700000000000001e-002 | J252: -8.3000000000000001e-003 | K252: 10.62 | L252: -2.9300000000000003e-002 | M252: 110.3 | N252: 9.89 | O252: 6.3e-002 | P252: 107.38 | Q252: 转股中 | R252: 3.84年 | S252: 1.84年 | T252: 16.2 | U252: 22 | V252: 1.2e-002 | W252: 0.14800000000000002 | X252: 0.159 | Y252: 109 | Z252: 1.35 | AA252: -8.8999999999999999e-003 | AB252: -1.38e-002 | AC252: -5.0900000000000001e-002 | AD252: -5.3399999999999996e-002 | AE252: 95.55 | AF252: 96.08 | AG252: 0.65 | AH252: AAA | AI252: 3.73e-002 | AJ252: =H252+100*O252 -> 120.39999999999999 | AK252: 120.8 | AL252: 47 | AM252: 24.7 | AN252: 27 | AO252: -1.8000000000000002e-002 | AP252: 24 | AQ252: 现代转债
A253: 245 | B253: 128074 | C253: 游族转债!! | D253: 2174 | E253: 游族网络 | F253: 通信互联 | G253: 互联网 | H253: 124.6 | I253: 4.7999999999999996e-003 | J253: 2.41e-002 | K253: 19.36 | L253: 2.92e-002 | M253: 119.9 | N253: 16.97 | O253: 9.1999999999999998e-002 | P253: 114.08 | Q253: 转股中 | R253: 4.32年 | S253: 2.32年 | T253: 6.83 | U253: 478 | V253: 0.56200000000000006 | W253: 3.9e-002 | X253: 4.4000000000000004e-002 | Y253: 177 | Z253: 3.47 | AA253: -9.0000000000000011e-003 | AB253: -1.6799999999999999e-002 | AC253: -7.2900000000000006e-002 | AD253: -7.5199999999999989e-002 | AE253: 93.37 | AF253: 100.61 | AG253: 0.99 | AH253: AA | AI253: 4.2300000000000004e-002 | AJ253: =H253+100*O253 -> 133.79999999999998 | AK253: 135.1 | AL253: 199 | AM253: 34.5 | AN253: 118 | AO253: 0.223 | AP253: 26 | AQ253: 游族转债!!
A254: 32 | B254: 123099 | C254: 普利转债 | D254: 300630 | E254: 普利制药 | F254: 医药 | G254: 化学制药 | H254: 130.5 | I254: 2.5000000000000001e-003 | J254: -1.1699999999999999e-002 | K254: 54.8 | L254: -1.26e-002 | M254: 123.5 | N254: 46.22 | O254: 0.10099999999999999 | P254: 118.56 | Q254: 2月27天 | R254: 5.70年 | S254: 3.70年 | T254: 8.5 | U254: 25 | V254: 2.2000000000000002e-002 | W254: 3.5000000000000003e-002 | X254: 4.2000000000000003e-002 | Y254: 239 | Z254: 10.97 | AA254: -9.7999999999999997e-003 | AB254: -1.66e-002 | AC254: -5.7800000000000004e-002 | AD254: -5.9500000000000004e-002 | AE254: 81.69 | AF254: 87.01 | AG254: 0.74 | AH254: AA- | AI254: 6.4600000000000005e-002 | AJ254: =H254+100*O254 -> 140.59999999999999 | AK254: 142.4 | AL254: 257 | AM254: 55.4 | AN254: 274 | AO254: 0.11199999999999999 | AP254: 4 | AQ254: 普利转债
A255: 285 | B255: 127011 | C255: 中鼎转2! | D255: 887 | E255: 中鼎股份 | F255: 汽车 | G255: 零部件制 | H255: 119 | I255: 1.03e-002 | J255: 1.e-004 | K255: 11.4 | L255: 2.06e-002 | M255: 114.5 | N255: 11.59 | O255: 0.20999999999999999 | P255: 98.36 | Q255: 转股中 | R255: 3.78年 | S255: 1.78年 | T255: 12 | U255: 11 | V255: 8.0000000000000002e-003 | W255: 8.5999999999999993e-002 | X255: 8.5000000000000006e-002 | Y255: 139 | Z255: 1.56 | AA255: -1.03e-002 | AB255: -1.7100000000000001e-002 | AC255: -7.2800000000000004e-002 | AD255: -7.5399999999999995e-002 | AE255: 95.28 | AF255: 98.91 | AG255: 0.51 | AH255: AA+ | AI255: 4.0300000000000002e-002 | AJ255: =H255+100*O255 -> 140. | AK255: 139.6 | AL255: 241 | AM255: 40.7 | AN255: 182 | AO255: 2.6000000000000002e-002 | AP255: 22 | AQ255: 中鼎转2!
A256: 192 | B256: 128101 | C256: 联创转债! | D256: 2036 | E256: 联创电子 | F256: 电子 | G256: 液晶显示 | H256: 120.81 | I256: -1.78e-002 | J256: 1.78e-002 | K256: 12.13 | L256: 0. | M256: 114.8 | N256: 13.74 | O256: 0.36799999999999999 | P256: 88.28 | Q256: 转股中 | R256: 4.80年 | S256: 2.80年 | T256: 3 | U256: 311 | V256: 0.84499999999999997 | W256: 2.3e-002 | X256: 2.1000000000000001e-002 | Y256: 129 | Z256: 3.5 | AA256: -1.0800000000000001e-002 | AB256: -1.6200000000000003e-002 | AC256: -5.1699999999999996e-002 | AD256: -5.3699999999999998e-002 | AE256: 91.44 | AF256: 94.45 | AG256: 0.45 | AH256: AA | AI256: 4.2300000000000004e-002 | AJ256: =H256+100*O256 -> 157.61000000000001 | AK256: 153.3 | AL256: 300 | AM256: 58.9 | AN256: 292 | AO256: 8.8000000000000009e-002 | AP256: 16 | AQ256: 联创转债!
A257: 81 | B257: 128137 | C257: 洁美转债 | D257: 2859 | E257: 洁美科技 | F257: 电子 | G257: 元器件制 | H257: 124.331 | I257: -1.6399999999999998e-002 | J257: 1.3000000000000001e-002 | K257: 28.6 | L257: -4.8999999999999998e-003 | M257: 117.3 | N257: 27.83 | O257: 0.20999999999999999 | P257: 102.77 | Q257: 转股中 | R257: 5.44年 | S257: 3.44年 | T257: 6 | U257: 2.3 | V257: 3.0000000000000001e-003 | W257: 5.0999999999999997e-002 | X257: 5.2999999999999999e-002 | Y257: 117 | Z257: 6.38 | AA257: -1.09e-002 | AB257: -1.6299999999999999e-002 | AC257: -4.9299999999999997e-002 | AD257: -5.1100000000000007e-002 | AE257: 83.03 | AF257: 84.05 | AG257: 0.69 | AH257: AA- | AI257: 6.4600000000000005e-002 | AJ257: =H257+100*O257 -> 145.33100000000002 | AK257: 145.9 | AL257: 267 | AM257: 61.8 | AN257: 298 | AO257: -6.0000000000000001e-003 | AP257: 4 | AQ257: 洁美转债
A258: 15 | B258: 113622 | C258: 杭叉转债 | D258: 603298 | E258: 杭叉集团 | F258: 机械装备 | G258: 通用设备 | H258: 120.06 | I258: 2.3e-003 | J258: -6.4000000000000003e-003 | K258: 19.72 | L258: -8.5000000000000006e-003 | M258: 112.5 | N258: 23.08 | O258: 0.40500000000000003 | P258: 85.44 | Q258: 4月13天 | R258: 5.82年 | S258: 3.82年 | T258: 11.5 | U258: 4.6 | V258: 3.0000000000000001e-003 | W258: 6.7000000000000004e-002 | X258: 5.7999999999999996e-002 | Y258: 171 | Z258: 3.33 | AA258: -1.1299999999999999e-002 | AB258: -1.5100000000000001e-002 | AC258: -3.78e-002 | AD258: -3.9199999999999999e-002 | AE258: 87.62 | AF258: 89.04 | AG258: 0.48 | AH258: AA+ | AI258: 4.1599999999999998e-002 | AJ258: =H258+100*O258 -> 160.56 | AK258: 154.7 | AL258: 305 | AM258: 65.6 | AN258: 310 | AO258: -1.4999999999999999e-002 | AP258: 4 | AQ258: 杭叉转债
A259: 14 | B259: 110079 | C259: 杭银转债 | D259: 600926 | E259: 杭州银行 | F259: 金融 | G259: 银行行业 | H259: 120.03 | I259: 2.0999999999999999e-003 | J259: -6.6e-003 | K259: 16.57 | L259: -7.8000000000000005e-003 | M259: 112.4 | N259: 17.06 | O259: 0.23600000000000002 | P259: 97.13 | Q259: 4月13天 | R259: 5.83年 | S259: 3.84年 | T259: 150 | U259: 436 | V259: 2.4e-002 | W259: 0.153 | X259: 0.14800000000000002 | Y259: 983 | Z259: 1.49 | AA259: -1.1299999999999999e-002 | AB259: -1.5100000000000001e-002 | AC259: -3.7900000000000003e-002 | AD259: -3.9300000000000002e-002 | AE259: 88.51 | AF259: 90.41 | AG259: 0.58 | AH259: AAA | AI259: 3.8599999999999995e-002 | AJ259: =H259+100*O259 -> 143.63 | AK259: 142.9 | AL259: 258 | AM259: 52.5 | AN259: 253 | AO259: -1.1000000000000001e-002 | AP259: 11 | AQ259: 杭银转债
A260: 298 | B260: 128051 | C260: 光华转债! | D260: 2741 | E260: 光华科技 | F260: 电子 | G260: 元器件制 | H260: 119.5 | I260: -5.0000000000000001e-003 | J260: 4.5000000000000005e-003 | K260: 15.17 | L260: -7.000000000000001e-004 | M260: 114.8 | N260: 12.72 | O260: 2.e-003 | P260: 119.26 | Q260: 转股中 | R260: 3.55年 | S260: 1.55年 | T260: 2.47 | U260: 62 | V260: 0.20899999999999999 | W260: 4.2999999999999997e-002 | X260: 5.2000000000000005e-002 | Y260: 57 | Z260: 4.59 | AA260: -1.15e-002 | AB260: -1.8799999999999997e-002 | AC260: -8.3000000000000004e-002 | AD260: -8.6099999999999996e-002 | AE260: 92.91 | AF260: 92.79 | AG260: 0.75 | AH260: AA- | AI260: 6.3299999999999995e-002 | AJ260: =H260+100*O260 -> 119.7 | AK260: 119.7 | AL260: 36 | AM260: 26.8 | AN260: 40 | AO260: 5.9999999999999998e-002 | AP260: 26 | AQ260: 光华转债!
A261: 91 | B261: 113605 | C261: 大参转债 | D261: 603233 | E261: 大参林 | F261: 医药 | G261: 医药商业 | H261: 122.5 | I261: 6.3e-003 | J261: -1.6000000000000001e-003 | K261: 74.22 | L261: 9.7999999999999997e-003 | M261: 115.2 | N261: 83.71 | O261: 0.38200000000000001 | P261: 88.66 | Q261: 转股中 | R261: 5.40年 | S261: 3.40年 | T261: 14.1 | U261: 17 | V261: 1.e-002 | W261: 2.8999999999999998e-002 | X261: 2.5000000000000001e-002 | Y261: 489 | Z261: 9.13 | AA261: -1.15e-002 | AB261: -1.6399999999999998e-002 | AC261: -4.5999999999999999e-002 | AD261: -4.7800000000000002e-002 | AE261: 89.18 | AF261: 91.9 | AG261: 0.48 | AH261: AA | AI261: 4.36e-002 | AJ261: =H261+100*O261 -> 160.69999999999999 | AK261: 156.3 | AL261: 310 | AM261: 64.4 | AN261: 307 | AO261: 1.6e-002 | AP261: 7 | AQ261: 大参转债
A262: 299 | B262: 128050 | C262: 钧达转债!! | D262: 2865 | E262: 钧达股份 | F262: 汽车 | G262: 零部件制 | H262: 127.858 | I262: -3.0000000000000001e-003 | J262: 2.3999999999999998e-003 | K262: 18.27 | L262: -5.0000000000000001e-004 | M262: 122.7 | N262: 14.8 | O262: 3.6000000000000004e-002 | P262: 123.45 | Q262: 转股中 | R262: 3.53年 | S262: 1.54年 | T262: 1.41 | U262: 11 | V262: 5.7999999999999996e-002 | W262: 5.7999999999999996e-002 | X262: 7.2000000000000008e-002 | Y262: 24 | Z262: 2.26 | AA262: -1.18e-002 | AB262: -2.2400000000000003e-002 | AC262: -0.10400000000000001 | AD262: -0.107 | AE262: 92.9 | AF262: 99.21 | AG262: 1 | AH262: AA- | AI262: 6.3299999999999995e-002 | AJ262: =H262+100*O262 -> 131.458 | AK262: 132.3 | AL262: 167 | AM262: 33.1 | AN262: 102 | AO262: -2.9999999999999999e-002 | AP262: 51 | AQ262: 钧达转债!!
A263: 105 | B263: 123067 | C263: 斯莱转债 | D263: 300382 | E263: 斯莱克 | F263: 机械装备 | G263: 专用设备 | H263: 129.02 | I263: 1.67e-002 | J263: -5.7999999999999996e-003 | K263: 11.2 | L263: 1.4499999999999999e-002 | M263: 121.2 | N263: 9.38 | O263: 8.1000000000000003e-002 | P263: 119.4 | Q263: 转股中 | R263: 5.30年 | S263: 3.31年 | T263: 3.88 | U263: 262 | V263: 0.52400000000000002 | W263: 6.0999999999999999e-002 | X263: 7.2999999999999995e-002 | Y263: 63 | Z263: 6.09 | AA263: -1.2e-002 | AB263: -1.8600000000000002e-002 | AC263: -6.0499999999999998e-002 | AD263: -6.25e-002 | AE263: 84 | AF263: 87.62 | AG263: 0.75 | AH263: AA- | AI263: 6.4600000000000005e-002 | AJ263: =H263+100*O263 -> 137.12 | AK263: 138.6 | AL263: 233 | AM263: 51 | AN263: 251 | AO263: 0.14800000000000002 | AP263: 13 | AQ263: 斯莱转债
A264: 284 | B264: 110053 | C264: 苏银转债! | D264: 600919 | E264: 江苏银行 | F264: 金融 | G264: 银行行业 | H264: 124.21 | I264: -8.9999999999999998e-004 | J264: -8.0000000000000004e-004 | K264: 7.65 | L264: -2.5999999999999999e-003 | M264: 118.3 | N264: 6.69 | O264: 8.5999999999999993e-002 | P264: 114.35 | Q264: 转股中 | R264: 3.79年 | S264: 无权 | T264: 200 | U264: 446 | V264: 1.8000000000000002e-002 | W264: 0.17699999999999999 | X264: 0.20199999999999999 | Y264: 1130. | Z264: 0.81 | AA264: -1.3100000000000001e-002 | AB264: -2.1400000000000002e-002 | AC264: 无权 | AD264: 无权 | AE264: 无权 | AF264: 103.37 | AG264: 0.64 | AH264: AAA | AI264: 3.73e-002 | AJ264: =H264+100*O264 -> 132.81 | AK264: 134.1 | AL264: 184 | AM264: 30.7 | AN264: 72 | AO264: 6.3e-002 | AP264: 39 | AQ264: 苏银转债!
A265: 61 | B265: 123083 | C265: 朗新转债 | D265: 300682 | E265: 朗新科技 | F265: 计算机及 | G265: 软件开发 | H265: 123.666 | I265: 1.78e-002 | J265: 8.0000000000000004e-004 | K265: 17.47 | L265: 2.64e-002 | M265: 115.1 | N265: 15.45 | O265: 9.4e-002 | P265: 113.07 | Q265: 18天 | R265: 5.53年 | S265: 3.53年 | T265: 8 | U265: 42 | V265: 4.2999999999999997e-002 | W265: 4.4999999999999998e-002 | X265: 5.0999999999999997e-002 | Y265: 178 | Z265: 3.39 | AA265: -1.3100000000000001e-002 | AB265: -1.7899999999999999e-002 | AC265: -4.7100000000000003e-002 | AD265: -4.8799999999999996e-002 | AE265: 88.59 | AF265: 91.29 | AG265: 0.7 | AH265: AA | AI265: 4.36e-002 | AJ265: =H265+100*O265 -> 133.066 | AK265: 134.3 | AL265: 186 | AM265: 43 | AN265: 204 | AO265: 5.9999999999999998e-002 | AP265: 5 | AQ265: 朗新转债
A266: 110 | B266: 123064 | C266: 万孚转债! | D266: 300482 | E266: 万孚生物 | F266: 医药 | G266: 医疗器械 | H266: 123.5 | I266: -4.0000000000000001e-003 | J266: -2.3e-003 | K266: 71.8 | L266: -1.06e-002 | M266: 115.1 | N266: 71.64 | O266: 0.23199999999999998 | P266: 100.22 | Q266: 转股中 | R266: 5.26年 | S266: 3.26年 | T266: 5.99 | U266: 9.4 | V266: 1.3000000000000001e-002 | W266: 1.9e-002 | X266: 1.9e-002 | Y266: 320 | Z266: 8.46 | AA266: -1.3500000000000002e-002 | AB266: -1.8500000000000003e-002 | AC266: -5.0300000000000004e-002 | AD266: -5.2199999999999996e-002 | AE266: 89.62 | AF266: 92.36 | AG266: 0.59 | AH266: AA | AI266: 4.36e-002 | AJ266: =H266+100*O266 -> 146.69999999999999 | AK266: 146.8 | AL266: 271 | AM266: 54.4 | AN266: 266 | AO266: -0.22699999999999998 | AP266: 11 | AQ266: 万孚转债!
A267: 225 | B267: 110063 | C267: 鹰19转债 | D267: 600567 | E267: 山鹰国际 | F267: 造纸包装 | G267: 包装用纸 | H267: 123.21 | I267: -4.7999999999999996e-003 | J267: -5.6999999999999993e-003 | K267: 3.78 | L267: -1.5600000000000001e-002 | M267: 115.9 | N267: 3.3 | O267: 7.5999999999999998e-002 | P267: 114.55 | Q267: 转股中 | R267: 4.54年 | S267: 2.55年 | T267: 18.5 | U267: 8.2 | V267: 4.0000000000000001e-003 | W267: 0.106 | X267: 0.121 | Y267: 174 | Z267: 1.12 | AA267: -1.3600000000000001e-002 | AB267: -1.9699999999999999e-002 | AC267: -6.3600000000000004e-002 | AD267: -6.5700000000000008e-002 | AE267: 92.83 | AF267: 97.19 | AG267: 0.68 | AH267: AA+ | AI267: 4.0300000000000002e-002 | AJ267: =H267+100*O267 -> 130.81 | AK267: 131.9 | AL267: 162 | AM267: 34.7 | AN267: 122 | AO267: 1.3999999999999999e-002 | AP267: 36 | AQ267: 鹰19转债
A268: 302 | B268: 110047 | C268: 山鹰转债 | D268: 600567 | E268: 山鹰国际 | F268: 造纸包装 | G268: 包装用纸 | H268: 123.17 | I268: -5.9999999999999995e-004 | J268: -9.1000000000000004e-003 | K268: 3.78 | L268: -1.5600000000000001e-002 | M268: 117.5 | N268: 3.34 | O268: 8.8000000000000009e-002 | P268: 113.17 | Q268: 转股中 | R268: 3.48年 | S268: 1.49年 | T268: 22.5 | U268: 42 | V268: 1.4999999999999999e-002 | W268: 0.129 | X268: 0.14599999999999999 | Y268: 174 | Z268: 1.12 | AA268: -1.37e-002 | AB268: -2.23e-002 | AC268: -0.10400000000000001 | AD268: -0.107 | AE268: 96.39 | AF268: 102.67 | AG268: 0.63 | AH268: AA+ | AI268: 4.0300000000000002e-002 | AJ268: =H268+100*O268 -> 131.97 | AK268: 133.2 | AL268: 177 | AM268: 30.5 | AN268: 70 | AO268: 1.3999999999999999e-002 | AP268: 32 | AQ268: 山鹰转债
A269: 329 | B269: 128035 | C269: 大族转债! | D269: 2008 | E269: 大族激光 | F269: 机械装备 | G269: 专用设备 | H269: 111.46 | I269: 2.3e-003 | J269: -1.9e-003 | K269: 37.3 | L269: 8.3999999999999995e-003 | M269: 107.4 | N269: 51.9 | O269: 0.55100000000000005 | P269: 71.87 | Q269: 转股中 | R269: 2.70年 | S269: 0.70年 | T269: 23 | U269: 10 | V269: 4.0000000000000001e-003 | W269: 5.7999999999999996e-002 | X269: 4.2000000000000003e-002 | Y269: 398 | Z269: 4.14 | AA269: -1.38e-002 | AB269: -1.89e-002 | AC269: -7.9299999999999995e-002 | AD269: -8.7100000000000011e-002 | AE269: 100.47 | AF269: 97.09 | AG269: 0.05 | AH269: AA+ | AI269: 3.8599999999999995e-002 | AJ269: =H269+100*O269 -> 166.56 | AK269: 151.1 | AL269: 294 | AM269: 50.6 | AN269: 246 | AO269: 1.8000000000000002e-002 | AP269: 19 | AQ269: 大族转债!
A270: 50 | B270: 128142 | C270: 新乳转债 | D270: 2946 | E270: 新乳业 | F270: 食品饮料 | G270: 乳制品 | H270: 124.17 | I270: -5.5000000000000005e-003 | J270: -1.9799999999999998e-002 | K270: 17.63 | L270: -4.5499999999999999e-002 | M270: 115.1 | N270: 18.54 | O270: 0.30599999999999999 | P270: 95.09 | Q270: 27天 | R270: 5.56年 | S270: 3.56年 | T270: 7.18 | U270: 6.1 | V270: 6.9999999999999993e-003 | W270: 4.7e-002 | X270: 4.4999999999999998e-002 | Y270: 153 | Z270: 5.88 | AA270: -1.38e-002 | AB270: -1.8500000000000003e-002 | AC270: -4.7800000000000002e-002 | AD270: -4.9500000000000002e-002 | AE270: 88.5 | AF270: 91.2 | AG270: 0.56 | AH270: AA | AI270: 4.36e-002 | AJ270: =H270+100*O270 -> 154.77000000000001 | AK270: 153.2 | AL270: 299 | AM270: 62.1 | AN270: 299 | AO270: -4.0000000000000001e-003 | AP270: 4 | AQ270: 新乳转债
A271: 145 | B271: 128119 | C271: 龙大转债! | D271: 2726 | E271: 龙大肉食 | F271: 食品饮料 | G271: 肉制品 | H271: 129.1 | I271: 2.0000000000000001e-004 | J271: -4.0000000000000001e-003 | K271: 11.88 | L271: -5.0000000000000001e-003 | M271: 120.2 | N271: 9.38 | O271: 1.9e-002 | P271: 126.65 | Q271: 转股中 | R271: 5年45天 | S271: 3年46天 | T271: 9.46 | U271: 15 | V271: 1.2e-002 | W271: 8.0000000000000002e-002 | X271: 0.10099999999999999 | Y271: 119 | Z271: 3.41 | AA271: -1.41e-002 | AB271: -2.07e-002 | AC271: -6.4899999999999999e-002 | AD271: -6.6900000000000001e-002 | AE271: 90.24 | AF271: 97.01 | AG271: 0.76 | AH271: AA | AI271: 4.36e-002 | AJ271: =H271+100*O271 -> 131. | AK271: 131.5 | AL271: 159 | AM271: 34.5 | AN271: 120 | AO271: 1.4999999999999999e-002 | AP271: 9 | AQ271: 龙大转债!
A272: 36 | B272: 113621 | C272: 彤程转债 | D272: 603650 | E272: 彤程新材 | F272: 化工 | G272: 橡胶塑料 | H272: 124.72 | I272: 1.2199999999999999e-002 | J272: -1.2199999999999999e-002 | K272: 34.06 | L272: 0. | M272: 115.1 | N272: 32.96 | O272: 0.20699999999999999 | P272: 103.34 | Q272: 2月6天 | R272: 5.66年 | S272: 3.67年 | T272: 8 | U272: 118 | V272: 0.11800000000000001 | W272: 4.0000000000000001e-002 | X272: 4.0999999999999995e-002 | Y272: 200 | Z272: 7.74 | AA272: -1.43e-002 | AB272: -1.89e-002 | AC272: -4.7599999999999996e-002 | AD272: -4.9299999999999997e-002 | AE272: 88.09 | AF272: 90.78 | AG272: 0.64 | AH272: AA | AI272: 4.36e-002 | AJ272: =H272+100*O272 -> 145.41999999999999 | AK272: 146.1 | AL272: 270 | AM272: 55.3 | AN272: 272 | AO272: 7.2000000000000008e-002 | AP272: 4 | AQ272: 彤程转债
A273: 208 | B273: 128096 | C273: 奥瑞转债!! | D273: 2701 | E273: 奥瑞金 | F273: 造纸包装 | G273: 包装材料 | H273: 123.498 | I273: -4.6999999999999993e-003 | J273: 7.000000000000001e-004 | K273: 5.35 | L273: -5.6000000000000008e-003 | M273: 115.5 | N273: 4.54 | O273: 4.8000000000000001e-002 | P273: 117.84 | Q273: 转股中 | R273: 4.71年 | S273: 2.71年 | T273: 6.79 | U273: 41 | V273: 4.9000000000000002e-002 | W273: 5.2000000000000005e-002 | X273: 6.2e-002 | Y273: 129 | Z273: 1.93 | AA273: -1.44e-002 | AB273: -2.0099999999999996e-002 | AC273: -5.91e-002 | AD273: -6.1399999999999996e-002 | AE273: 92.8 | AF273: 96.29 | AG273: 0.72 | AH273: AA+ | AI273: 4.0300000000000002e-002 | AJ273: =H273+100*O273 -> 128.298 | AK273: 129.2 | AL273: 133 | AM273: 32.9 | AN273: 100 | AO273: -3.7999999999999999e-002 | AP273: 19 | AQ273: 奥瑞转债!!
A274: 291 | B274: 110051 | C274: 中天转债! | D274: 600522 | E274: 中天科技 | F274: 通信互联 | G274: 通信设备 | H274: 120 | I274: 4.4000000000000003e-003 | J274: -2.8000000000000004e-003 | K274: 10.34 | L274: 2.8999999999999998e-003 | M274: 113.3 | N274: 9.99 | O274: 0.159 | P274: 103.5 | Q274: 转股中 | R274: 3.76年 | S274: 1.76年 | T274: 39.6 | U274: 55 | V274: 1.2e-002 | W274: 0.125 | X274: 0.129 | Y274: 317 | Z274: 1.36 | AA274: -1.54e-002 | AB274: -2.1700000000000001e-002 | AC274: -7.7800000000000008e-002 | AD274: -8.0299999999999996e-002 | AE274: 95.33 | AF274: 97.94 | AG274: 0.58 | AH274: AA+ | AI274: 4.0300000000000002e-002 | AJ274: =H274+100*O274 -> 135.90000000000001 | AK274: 136.5 | AL274: 213 | AM274: 38.6 | AN274: 160 | AO274: 2.e-002 | AP274: 24 | AQ274: 中天转债!
A275: 168 | B275: 128108 | C275: 蓝帆转债! | D275: 2382 | E275: 蓝帆医疗 | F275: 医药 | G275: 医疗器械 | H275: 122.626 | I275: -6.0000000000000001e-003 | J275: -6.7000000000000002e-003 | K275: 21.16 | L275: -1.72e-002 | M275: 113.3 | N275: 17.79 | O275: 3.1e-002 | P275: 118.94 | Q275: 转股中 | R275: 4.997年 | S275: 4年0.1天 | T275: 15.3 | U275: 49 | V275: 2.6000000000000002e-002 | W275: 6.9000000000000006e-002 | X275: 8.199999999999999e-002 | Y275: 222 | Z275: 1.78 | AA275: -1.67e-002 | AB275: -2.12e-002 | AC275: -3.6499999999999998e-002 | AD275: -3.8699999999999998e-002 | AE275: 88.77 | AF275: 92.14 | AG275: 0.74 | AH275: AA | AI275: 4.2300000000000004e-002 | AJ275: =H275+100*O275 -> 125.726 | AK275: 126.3 | AL275: 94 | AM275: 34.2 | AN275: 111 | AO275: -4.2999999999999997e-002 | AP275: 25 | AQ275: 蓝帆转债!
A276: 47 | B276: 123091 | C276: 长海转债 | D276: 300196 | E276: 长海股份 | F276: 其他 | G276: 非金属矿 | H276: 128.32 | I276: 4.8999999999999998e-003 | J276: -1.54e-002 | K276: 17.49 | L276: -1.5800000000000002e-002 | M276: 116.2 | N276: 16.14 | O276: 0.184 | P276: 108.36 | Q276: 32天 | R276: 5.57年 | S276: 3.57年 | T276: 5.5 | U276: 17 | V276: 2.4e-002 | W276: 7.6999999999999999e-002 | X276: 8.3000000000000004e-002 | Y276: 71 | Z276: 2.41 | AA276: -1.8000000000000002e-002 | AB276: -2.29e-002 | AC276: -5.5800000000000002e-002 | AD276: -5.7500000000000002e-002 | AE276: 88.54 | AF276: 92.03 | AG276: 0.67 | AH276: AA | AI276: 4.36e-002 | AJ276: =H276+100*O276 -> 146.72 | AK276: 148.3 | AL276: 282 | AM276: 56.3 | AN276: 279 | AO276: 1.e-002 | AP276: 3 | AQ276: 长海转债
A277: 170 | B277: 113579 | C277: 健友转债! | D277: 603707 | E277: 健友股份 | F277: 医药 | G277: 原料药 | H277: 124.48 | I277: 6.5000000000000006e-003 | J277: -4.8999999999999998e-003 | K277: 42.52 | L277: 2.8000000000000004e-003 | M277: 113.9 | N277: 42.05 | O277: 0.23100000000000001 | P277: 101.12 | Q277: 转股中 | R277: 4.90年 | S277: 2.90年 | T277: 5.03 | U277: 15 | V277: 2.4e-002 | W277: 1.3000000000000001e-002 | X277: 1.3000000000000001e-002 | Y277: 397 | Z277: 10.33 | AA277: -1.83e-002 | AB277: -2.3199999999999998e-002 | AC277: -5.9000000000000004e-002 | AD277: -6.0999999999999999e-002 | AE277: 91.14 | AF277: 93.32 | AG277: 0.6 | AH277: AA | AI277: 4.2300000000000004e-002 | AJ277: =H277+100*O277 -> 147.58000000000001 | AK277: 147.8 | AL277: 276 | AM277: 54.5 | AN277: 267 | AO277: -1.8000000000000002e-002 | AP277: 9 | AQ277: 健友转债!
A278: 52 | B278: 113614 | C278: 健20转债! | D278: 603707 | E278: 健友股份 | F278: 医药 | G278: 原料药 | H278: 127.6 | I278: -4.4000000000000003e-003 | J278: 6.4000000000000003e-003 | K278: 42.52 | L278: 2.8000000000000004e-003 | M278: 114.2 | N278: 38.04 | O278: 0.14199999999999999 | P278: 111.78 | Q278: 26天 | R278: 5.55年 | S278: 3.56年 | T278: 7.8 | U278: 3.2 | V278: 3.0000000000000001e-003 | W278: 2.e-002 | X278: 2.2000000000000002e-002 | Y278: 397 | Z278: 10.33 | AA278: -2.0099999999999996e-002 | AB278: -2.46e-002 | AC278: -5.4600000000000003e-002 | AD278: -5.6399999999999999e-002 | AE278: 88.6 | AF278: 90.51 | AG278: 0.71 | AH278: AA | AI278: 4.36e-002 | AJ278: =H278+100*O278 -> 141.79999999999998 | AK278: 143.4 | AL278: 259 | AM278: 52.9 | AN278: 260 | AO278: -1.8000000000000002e-002 | AP278: 3 | AQ278: 健20转债!
A279: 236 | B279: 113548 | C279: 石英转债! | D279: 603688 | E279: XD石英股 | F279: 电子 | G279: 电子产品 | H279: 136.36 | I279: -5.6999999999999993e-003 | J279: 1.0800000000000001e-002 | K279: 18.4 | L279: 7.0999999999999995e-003 | M279: 124.4 | N279: 14.93 | O279: 0.106 | P279: 123.24 | Q279: 转股中 | R279: 4.42年 | S279: 2.42年 | T279: 1.23 | U279: 89 | V279: 0.52300000000000002 | W279: 1.9e-002 | X279: 2.3e-002 | Y279: 65 | Z279: 3.29 | AA279: -2.1000000000000001e-002 | AB279: -2.9900000000000003e-002 | AC279: -9.9499999999999991e-002 | AD279: -0.10099999999999999 | AE279: 89.19 | AF279: 95.5 | AG279: 0.72 | AH279: AA- | AI279: 6.3299999999999995e-002 | AJ279: =H279+100*O279 -> 146.96000000000001 | AK279: 149.5 | AL279: 288 | AM279: 54 | AN279: 265 | AO279: 3.9e-002 | AP279: 12 | AQ279: 石英转债!
A280: 312 | B280: 123012 | C280: 万顺转债! | D280: 300057 | E280: 万顺新材 | F280: 有色金属 | G280: 铝金属 | H280: 117.76 | I280: -5.4000000000000003e-003 | J280: 2.9999999999999997e-004 | K280: 4.81 | L280: -1.03e-002 | M280: 110.3 | N280: 5.27 | O280: 0.28999999999999998 | P280: 91.27 | Q280: 转股中 | R280: 3年52天 | S280: 1年53天 | T280: 1.29 | U280: 16 | V280: 0.107 | W280: 4.0000000000000001e-002 | X280: 3.6000000000000004e-002 | Y280: 32 | Z280: 0.91 | AA280: -2.1099999999999997e-002 | AB280: -2.69e-002 | AC280: -9.9299999999999999e-002 | AD280: -0.10300000000000001 | AE280: 94.93 | AF280: 91.36 | AG280: 0.5 | AH280: AA- | AI280: 6.3299999999999995e-002 | AJ280: =H280+100*O280 -> 146.75999999999999 | AK280: 144.2 | AL280: 263 | AM280: 49.3 | AN280: 239 | AO280: 3.5000000000000003e-002 | AP280: 20 | AQ280: 万顺转债!
A281: 161 | B281: 113585 | C281: 寿仙转债! | D281: 603896 | E281: 寿仙谷 | F281: 医药 | G281: 中药 | H281: 131.2 | I281: -5.7999999999999996e-003 | J281: 4.3e-003 | K281: 37.96 | L281: -1.8e-003 | M281: 117.8 | N281: 28.68 | O281: -9.0000000000000011e-003 | P281: 132.36 | Q281: 转股中 | R281: 5年11天 | S281: 3年12天 | T281: 1.6 | U281: 52 | V281: 0.245 | W281: 2.7999999999999997e-002 | X281: 3.7000000000000005e-002 | Y281: 57 | Z281: 4.11 | AA281: -2.1700000000000001e-002 | AB281: -2.76e-002 | AC281: -7.0499999999999993e-002 | AD281: -7.2700000000000001e-002 | AE281: 85.48 | AF281: 86.66 | AG281: 0.83 | AH281: AA- | AI281: 6.4600000000000005e-002 | AJ281: =H281+100*O281 -> 130.29999999999998 | AK281: 130 | AL281: 143 | AM281: 43.4 | AN281: 208 | AO281: 1.8000000000000002e-002 | AP281: 10 | AQ281: 寿仙转债!
A282: 102 | B282: 128134 | C282: 鸿路转债! | D282: 2541 | E282: 鸿路钢构 | F282: 建筑 | G282: 其他 | H282: 129.568 | I282: -1.09e-002 | J282: -1.06e-002 | K282: 53.18 | L282: -2.81e-002 | M282: 115.1 | N282: 43.74 | O282: 6.6000000000000003e-002 | P282: 121.58 | Q282: 转股中 | R282: 5.36年 | S282: 3.37年 | T282: 18.8 | U282: 22 | V282: 9.0000000000000011e-003 | W282: 6.8000000000000005e-002 | X282: 8.199999999999999e-002 | Y282: 279 | Z282: 4.79 | AA282: -2.2200000000000001e-002 | AB282: -2.7000000000000003e-002 | AC282: -6.1799999999999994e-002 | AD282: -6.3600000000000004e-002 | AE282: 89.22 | AF282: 91.95 | AG282: 0.76 | AH282: AA | AI282: 4.36e-002 | AJ282: =H282+100*O282 -> 136.16800000000001 | AK282: 137.6 | AL282: 223 | AM282: 45.6 | AN282: 220 | AO282: 2.2000000000000002e-002 | AP282: 4 | AQ282: 鸿路转债!
A283: 190 | B283: 123047 | C283: 久吾转债 | D283: 300631 | E283: 久吾高科 | F283: 机械装备 | G283: 专用设备 | H283: 145.02 | I283: 1.66e-002 | J283: -2.7000000000000001e-003 | K283: 22.08 | L283: 1.89e-002 | M283: 129.6 | N283: 17.43 | O283: 0.14499999999999999 | P283: 126.68 | Q283: 转股中 | R283: 4.81年 | S283: 2.81年 | T283: 1.99 | U283: 1708. | V283: 5.7999999999999998 | W283: 8.3000000000000004e-002 | X283: 0.105 | Y283: 24 | Z283: 2.9 | AA283: -2.3700000000000002e-002 | AB283: -3.32e-002 | AC283: -0.10099999999999999 | AD283: -0.10400000000000001 | AE283: 85.52 | AF283: 92.71 | AG283: 0.73 | AH283: A+ | AI283: 7.4299999999999991e-002 | AJ283: =H283+100*O283 -> 159.52000000000001 | AK283: 163.4 | AL283: 319 | AM283: 70.6 | AN283: 318 | AO283: 0.14499999999999999 | AP283: 22 | AQ283: 久吾转债
A284: 106 | B284: 123066 | C284: 赛意转债 | D284: 300687 | E284: 赛意信息 | F284: 计算机及 | G284: 软件开发 | H284: 137.97 | I284: 5.3e-003 | J284: 1.6e-002 | K284: 19.47 | L284: 2.58e-002 | M284: 121.4 | N284: 14.01 | O284: -6.9999999999999993e-003 | P284: 138.97 | Q284: 转股中 | R284: 5.30年 | S284: 3.30年 | T284: 2.93 | U284: 62 | V284: 0.155 | W284: 6.9000000000000006e-002 | X284: 9.6000000000000002e-002 | Y284: 42 | Z284: 4.3 | AA284: -2.4300000000000002e-002 | AB284: -3.0899999999999997e-002 | AC284: -7.8100000000000003e-002 | AD284: -8.0199999999999994e-002 | AE284: 81.25 | AF284: 83.25 | AG284: 0.82 | AH284: A+ | AI284: 7.5600000000000001e-002 | AJ284: =H284+100*O284 -> 137.27000000000001 | AK284: 137 | AL284: 219 | AM284: 53.7 | AN284: 264 | AO284: -0.318 | AP284: 7 | AQ284: 赛意转债
A285: 46 | B285: 113615 | C285: 金诚转债 | D285: 603979 | E285: 金诚信 | F285: 有色金属 | G285: 有色行业 | H285: 135.16 | I285: 3.5999999999999999e-003 | J285: -6.4000000000000003e-003 | K285: 16.77 | L285: -3.5999999999999999e-003 | M285: 117.3 | N285: 12.73 | O285: 2.6000000000000002e-002 | P285: 131.74 | Q285: 32天 | R285: 5.57年 | S285: 3.57年 | T285: 10 | U285: 9.5 | V285: 6.9999999999999993e-003 | W285: 0.10199999999999999 | X285: 0.13500000000000001 | Y285: 98 | Z285: 2.11 | AA285: -2.5600000000000001e-002 | AB285: -3.0800000000000001e-002 | AC285: -6.8699999999999997e-002 | AD285: -7.0499999999999993e-002 | AE285: 88.64 | AF285: 92.91 | AG285: 0.81 | AH285: AA | AI285: 4.36e-002 | AJ285: =H285+100*O285 -> 137.75999999999999 | AK285: 138.6 | AL285: 231 | AM285: 45.7 | AN285: 222 | AO285: 3.6000000000000004e-002 | AP285: 3 | AQ285: 金诚转债
A286: 100 | B286: 110075 | C286: 南航转债 | D286: 600029 | E286: 南方航空 | F286: 交通运输 | G286: 航空运输 | H286: 128.07 | I286: -8.0000000000000004e-004 | J286: -1.47e-002 | K286: 6.6 | L286: -2.3700000000000002e-002 | M286: 110 | N286: 6.24 | O286: 0.21100000000000002 | P286: 105.77 | Q286: 转股中 | R286: 5.38年 | S286: 3.38年 | T286: 160 | U286: 47 | V286: 2.e-003 | W286: 0.158 | X286: 0.16699999999999998 | Y286: 1012. | Z286: 1.55 | AA286: -2.8199999999999999e-002 | AB286: -3.15e-002 | AC286: -6.1799999999999994e-002 | AD286: -6.2899999999999998e-002 | AE286: 89.46 | AF286: 89.96 | AG286: 0.65 | AH286: AAA | AI286: 3.8599999999999995e-002 | AJ286: =H286+100*O286 -> 149.16999999999999 | AK286: 150.4 | AL286: 291 | AM286: 60.4 | AN286: 296 | AO286: 2.1000000000000001e-002 | AP286: 7 | AQ286: 南航转债
A287: 361 | B287: 110034 | C287: 九州转债! | D287: 600998 | E287: 九州通 | F287: 医药 | G287: 医药商业 | H287: 109.99 | I287: 0. | J287: -5.0000000000000001e-004 | K287: 17.09 | L287: -3.4999999999999996e-003 | M287: 108 | N287: 18.32 | O287: 0.17899999999999999 | P287: 93.29 | Q287: 转股中 | R287: 0.64年 | S287: 回售内 | T287: 15 | U287: 12 | V287: 6.9999999999999993e-003 | W287: 4.7e-002 | X287: 4.4000000000000004e-002 | Y287: 320 | Z287: 1.59 | AA287: -2.8300000000000002e-002 | AB287: -5.0900000000000001e-002 | AC287: 回售内 | AD287: 回售内 | AE287: 103 | AF287: 105.66 | AG287: 0.14 | AH287: AA+ | AI287: 3.5099999999999999e-002 | AJ287: =H287+100*O287 -> 127.88999999999999 | AK287: 126.7 | AL287: 101 | AM287: 21 | AN287: 12 | AO287: 1.3000000000000001e-002 | AP287: 24 | AQ287: 九州转债!
A288: 38 | B288: 123094 | C288: 星源转2! | D288: 300568 | E288: 星源材质 | F288: 电子 | G288: 电子行业 | H288: 138.33 | I288: 5.5999999999999994e-002 | J288: 3.4700000000000002e-002 | K288: 43.63 | L288: 0.11 | M288: 117.3 | N288: 31.53 | O288: 0. | P288: 138.38 | Q288: 59天 | R288: 5.65年 | S288: 3.65年 | T288: 10 | U288: 525 | V288: 0.377 | W288: 5.0999999999999997e-002 | X288: 7.0999999999999994e-002 | Y288: 196 | Z288: 6.47 | AA288: -2.9300000000000003e-002 | AB288: -3.44e-002 | AC288: -7.3099999999999998e-002 | AD288: -7.4800000000000005e-002 | AE288: 88.35 | AF288: 92.61 | AG288: 0.82 | AH288: AA | AI288: 4.36e-002 | AJ288: =H288+100*O288 -> 138.33000000000001 | AK288: 138.3 | AL288: 228 | AM288: 45.7 | AN288: 223 | AO288: 0.34399999999999997 | AP288: 4 | AQ288: 星源转2!
A289: 362 | B289: 110033 | C289: 国贸转债! | D289: 600755 | E289: 厦门国贸 | F289: 交通运输 | G289: 交通运输 | H289: 110.08 | I289: 3.5999999999999999e-003 | J289: 3.5999999999999999e-003 | K289: 7.19 | L289: 2.4199999999999999e-002 | M289: 108 | N289: 7.18 | O289: 9.9000000000000005e-002 | P289: 100.14 | Q289: 转股中 | R289: 0.61年 | S289: 回售内 | T289: 12.1 | U289: 28 | V289: 2.1000000000000001e-002 | W289: 8.6999999999999994e-002 | X289: 8.6999999999999994e-002 | Y289: 140 | Z289: 0.87 | AA289: -3.0899999999999997e-002 | AB289: -5.4400000000000004e-002 | AC289: 回售内 | AD289: 回售内 | AE289: 100.33 | AF289: 105.94 | AG289: 0.3 | AH289: AAA | AI289: 3.2099999999999997e-002 | AJ289: =H289+100*O289 -> 119.98 | AK289: 120 | AL289: 39 | AM289: 14.1 | AN289: 2 | AO289: 2.5000000000000001e-002 | AP289: 18 | AQ289: 国贸转债!
A290: 276 | B290: 123025 | C290: 精测转债!! | D290: 300567 | E290: 精测电子 | F290: 电子 | G290: 液晶显示 | H290: 131.167 | I290: -6.3e-003 | J290: -6.5000000000000006e-003 | K290: 53.17 | L290: -1.95e-002 | M290: 116.5 | N290: 49.37 | O290: 0.218 | P290: 107.7 | Q290: 转股中 | R290: 3.83年 | S290: 1.84年 | T290: 3.09 | U290: 42 | V290: 0.10300000000000001 | W290: 2.1000000000000001e-002 | X290: 2.3e-002 | Y290: 148 | Z290: 7.45 | AA290: -3.1e-002 | AB290: -3.8199999999999998e-002 | AC290: -0.115 | AD290: -0.11699999999999999 | AE290: 91.02 | AF290: 92.48 | AG290: 0.66 | AH290: AA- | AI290: 6.3299999999999995e-002 | AJ290: =H290+100*O290 -> 152.96700000000001 | AK290: 154.6 | AL290: 304 | AM290: 62.2 | AN290: 300 | AO290: -6.0000000000000001e-003 | AP290: 17 | AQ290: 精测转债!!
A291: 118 | B291: 110074 | C291: 精达转债! | D291: 600577 | E291: 精达股份 | F291: 电子 | G291: 电子产品 | H291: 138.03 | I291: 3.0099999999999998e-002 | J291: -4.0000000000000002e-004 | K291: 5.2 | L291: 3.5900000000000001e-002 | M291: 117.3 | N291: 3.73 | O291: -1.e-002 | P291: 139.41 | Q291: 转股中 | R291: 5.22年 | S291: 3.23年 | T291: 7.8 | U291: 482 | V291: 0.44 | W291: 7.8e-002 | X291: 0.109 | Y291: 100 | Z291: 2.63 | AA291: -3.1200000000000002e-002 | AB291: -3.6699999999999997e-002 | AC291: -8.1300000000000011e-002 | AD291: -8.3100000000000007e-002 | AE291: 89.95 | AF291: 94.29 | AG291: 0.83 | AH291: AA | AI291: 4.36e-002 | AJ291: =H291+100*O291 -> 137.03 | AK291: 136.6 | AL291: 217 | AM291: 42.4 | AN291: 195 | AO291: 0.217 | AP291: 12 | AQ291: 精达转债!
A292: 12 | B292: 123108 | C292: 乐普转2 | D292: 300003 | E292: 乐普医疗 | F292: 医药 | G292: 医疗器械 | H292: 129.5 | I292: -1.15e-002 | J292: -6.6e-003 | K292: 33.95 | L292: -2.5499999999999998e-002 | M292: 111.1 | N292: 29.73 | O292: 0.13400000000000001 | P292: 114.19 | Q292: 4月13天 | R292: 4.84年 | S292: 2.84年 | T292: 16.4 | U292: 61 | V292: 2.8999999999999998e-002 | W292: 2.7000000000000003e-002 | X292: 3.1e-002 | Y292: 613 | Z292: 5.76 | AA292: -3.15e-002 | AB292: -3.5499999999999997e-002 | AC292: -7.6499999999999999e-002 | AD292: -7.7600000000000002e-002 | AE292: 90.67 | AF292: 91.98 | AG292: 0.71 | AH292: AA+ | AI292: 4.0300000000000002e-002 | AJ292: =H292+100*O292 -> 142.90000000000001 | AK292: 144.8 | AL292: 265 | AM292: 52.8 | AN292: 258 | AO292: 7.400000000000001e-002 | AP292: 7 | AQ292: 乐普转2
A293: 241 | B293: 128079 | C293: 英联转债! | D293: 2846 | E293: 英联股份 | F293: 造纸包装 | G293: 包装材料 | H293: 134.929 | I293: -1.66e-002 | J293: 1.66e-002 | K293: 8.31 | L293: -4.7999999999999996e-003 | M293: 117.5 | N293: 8.29 | O293: 0.34600000000000003 | P293: 100.24 | Q293: 转股中 | R293: 4.40年 | S293: 2.40年 | T293: 1.52 | U293: 42 | V293: 0.20199999999999999 | W293: 5.7000000000000002e-002 | X293: 5.7999999999999996e-002 | Y293: 26 | Z293: 3.43 | AA293: -3.1600000000000003e-002 | AB293: -3.8199999999999998e-002 | AC293: -9.849999999999999e-002 | AD293: -0.10000000000000001 | AE293: 86.42 | AF293: 86.35 | AG293: 0 | AH293: A+ | AI293: 7.4299999999999991e-002 | AJ293: =H293+100*O293 -> 169.529 | AK293: 169.6 | AL293: 323 | AM293: 83.2 | AN293: 328 | AO293: -8.0000000000000002e-003 | AP293: 18 | AQ293: 英联转债!
A294: 233 | B294: 110061 | C294: 川投转债 | D294: 600674 | E294: 川投能源 | F294: 能源电力 | G294: 水电 | H294: 127.5 | I294: -7.8000000000000005e-003 | J294: -9.7999999999999997e-003 | K294: 11.53 | L294: -2.29e-002 | M294: 110.8 | N294: 9.58 | O294: 5.9000000000000004e-002 | P294: 120.35 | Q294: 转股中 | R294: 4.46年 | S294: 2.46年 | T294: 39.6 | U294: 14 | V294: 3.0000000000000001e-003 | W294: 7.8e-002 | X294: 9.4e-002 | Y294: 508 | Z294: 1.76 | AA294: -3.1600000000000003e-002 | AB294: -3.5799999999999998e-002 | AC294: -7.7699999999999991e-002 | AD294: -7.9899999999999999e-002 | AE294: 93.92 | AF294: 94.43 | AG294: 0.77 | AH294: AAA | AI294: 3.73e-002 | AJ294: =H294+100*O294 -> 133.40000000000001 | AK294: 134.6 | AL294: 191 | AM294: 40.2 | AN294: 175 | AO294: -1.1000000000000001e-002 | AP294: 15 | AQ294: 川投转债
A295: 97 | B295: 127022 | C295: 恒逸转债 | D295: 703 | E295: 恒逸石化 | F295: 化工 | G295: 化工 | H295: 129.14 | I295: 7.7000000000000002e-003 | J295: -1.11e-002 | K295: 12.64 | L295: -4.6999999999999993e-003 | M295: 108.9 | N295: 11.5 | O295: 0.17499999999999999 | P295: 109.91 | Q295: 转股中 | R295: 5.38年 | S295: 3.39年 | T295: 20 | U295: 14 | V295: 5.0000000000000001e-003 | W295: 4.2999999999999997e-002 | X295: 4.7e-002 | Y295: 465 | Z295: 1.88 | AA295: -3.1600000000000003e-002 | AB295: -3.4500000000000003e-002 | AC295: -6.2899999999999998e-002 | AD295: -6.4199999999999993e-002 | AE295: 88.89 | AF295: 87.72 | AG295: 0.73 | AH295: AA+ | AI295: 4.1599999999999998e-002 | AJ295: =H295+100*O295 -> 146.63999999999999 | AK295: 148.4 | AL295: 284 | AM295: 59.5 | AN295: 294 | AO295: -2.1000000000000001e-002 | AP295: 6 | AQ295: 恒逸转债
A296: 116 | B296: 128128 | C296: 齐翔转2 | D296: 2408 | E296: 齐翔腾达 | F296: 化工 | G296: 化工 | H296: 137.1 | I296: 1.1000000000000001e-003 | J296: -1.8e-003 | K296: 11.27 | L296: -8.9999999999999998e-004 | M296: 115.3 | N296: 8.22 | O296: 0. | P296: 137.1 | Q296: 转股中 | R296: 5.23年 | S296: 3.23年 | T296: 10.9 | U296: 58 | V296: 3.9e-002 | W296: 5.0000000000000003e-002 | X296: 6.9000000000000006e-002 | Y296: 217 | Z296: 2.07 | AA296: -3.32e-002 | AB296: -3.8100000000000002e-002 | AC296: -7.9500000000000001e-002 | AD296: -8.1300000000000011e-002 | AE296: 89.86 | AF296: 92.66 | AG296: 0.83 | AH296: AA | AI296: 4.36e-002 | AJ296: =H296+100*O296 -> 137.09999999999999 | AK296: 137.1 | AL296: 220 | AM296: 44.4 | AN296: 215 | AO296: 6.7000000000000004e-002 | AP296: 37 | AQ296: 齐翔转2
A297: 323 | B297: 128036 | C297: 金农转债!! | D297: 2548 | E297: 金新农 | F297: 农业 | G297: 畜牧业 | H297: 120 | I297: -6.7000000000000002e-003 | J297: 3.7000000000000002e-003 | K297: 5.96 | L297: -8.3000000000000001e-003 | M297: 109.3 | N297: 6.96 | O297: 0.40100000000000002 | P297: 85.63 | Q297: 转股中 | R297: 2.78年 | S297: 0.78年 | T297: 1.46 | U297: 13 | V297: 7.4999999999999997e-002 | W297: 3.5000000000000003e-002 | X297: 2.9999999999999999e-002 | Y297: 41 | Z297: 1.58 | AA297: -3.3500000000000002e-002 | AB297: -3.95e-002 | AC297: -0.161 | AD297: -0.16500000000000001 | AE297: 96.21 | AF297: 92.82 | AG297: 0.36 | AH297: AA- | AI297: 6.1600000000000002e-002 | AJ297: =H297+100*O297 -> 160.09999999999999 | AK297: 154.4 | AL297: 303 | AM297: 58.2 | AN297: 288 | AO297: -3.3000000000000002e-002 | AP297: 16 | AQ297: 金农转债!!
A298: 184 | B298: 113575 | C298: 东时转债! | D298: 603377 | E298: 东方时尚 | F298: 其他 | G298: 其他 | H298: 133.19 | I298: -7.4000000000000003e-003 | J298: 7.4000000000000003e-003 | K298: 10.53 | L298: 0. | M298: 113.1 | N298: 14.56 | O298: 0.84200000000000008 | P298: 72.32 | Q298: 转股中 | R298: 4.86年 | S298: 2.87年 | T298: 0.98 | U298: 49 | V298: 0.374 | W298: 1.4999999999999999e-002 | X298: 1.1000000000000001e-002 | Y298: 64 | Z298: 3.07 | AA298: -3.3599999999999998e-002 | AB298: -3.8199999999999998e-002 | AC298: -8.0500000000000002e-002 | AD298: -8.2500000000000004e-002 | AE298: 91.32 | AF298: 92.82 | AG298: 0.27 | AH298: AA | AI298: 4.2300000000000004e-002 | AJ298: =H298+100*O298 -> 217.38999999999999 | AK298: 194.1 | AL298: 337 | AM298: 101.2 | AN298: 334 | AO298: -0.188 | AP298: 14 | AQ298: 东时转债!
A299: 300 | B299: 110048 | C299: 福能转债! | D299: 600483 | E299: 福能股份 | F299: 能源电力 | G299: 电力供应 | H299: 128.5 | I299: -3.0999999999999999e-003 | J299: -8.1000000000000013e-003 | K299: 9.96 | L299: -1.4800000000000001e-002 | M299: 113.3 | N299: 8.12 | O299: 4.8000000000000001e-002 | P299: 122.66 | Q299: 转股中 | R299: 3.53年 | S299: 1.53年 | T299: 20.4 | U299: 196 | V299: 7.4999999999999997e-002 | W299: 0.115 | X299: 0.14000000000000001 | Y299: 178 | Z299: 1.13 | AA299: -3.5699999999999996e-002 | AB299: -4.2199999999999994e-002 | AC299: -0.10800000000000001 | AD299: -0.11 | AE299: 96.19 | AF299: 98.84 | AG299: 0.76 | AH299: AA+ | AI299: 4.0300000000000002e-002 | AJ299: =H299+100*O299 -> 133.30000000000001 | AK299: 134.3 | AL299: 188 | AM299: 35.5 | AN299: 135 | AO299: -3.4000000000000002e-002 | AP299: 9 | AQ299: 福能转债!
A300: 211 | B300: 123042 | C300: 银河转债! | D300: 300619 | E300: 金银河 | F300: 机械装备 | G300: 专用设备 | H300: 136.2 | I300: -4.4000000000000003e-003 | J300: 1.24e-002 | K300: 19.69 | L300: 1.55e-002 | M300: 115.4 | N300: 24.4 | O300: 0.68799999999999994 | P300: 80.7 | Q300: 转股中 | R300: 4.63年 | S300: 2.63年 | T300: 1.67 | U300: 103 | V300: 0.45000000000000001 | W300: 0.114 | X300: 9.1999999999999998e-002 | Y300: 15 | Z300: 3.01 | AA300: -3.5900000000000001e-002 | AB300: -4.1399999999999999e-002 | AC300: -9.3599999999999989e-002 | AD300: -9.5799999999999996e-002 | AE300: 85.08 | AF300: 83.45 | AG300: 0.52 | AH300: A+ | AI300: 7.4299999999999991e-002 | AJ300: =H300+100*O300 -> 205. | AK300: 191.7 | AL300: 335 | AM300: 106.6 | AN300: 338 | AO300: 6.9000000000000006e-002 | AP300: 23 | AQ300: 银河转债!
A301: 19 | B301: 127030 | C301: 盛虹转债 | D301: 301 | E301: 东方盛虹 | F301: 化工 | G301: 化纤 | H301: 139.6 | I301: -2.0899999999999998e-002 | J301: -1.77e-002 | K301: 17.43 | L301: -4.9599999999999998e-002 | M301: 112.5 | N301: 14.2 | O301: 0.13699999999999998 | P301: 122.75 | Q301: 4月2天 | R301: 5.81年 | S301: 3.82年 | T301: 50 | U301: 111 | V301: 1.6e-002 | W301: 5.9000000000000004e-002 | X301: 7.2999999999999995e-002 | Y301: 843 | Z301: 4.65 | AA301: -3.6900000000000002e-002 | AB301: -4.0599999999999997e-002 | AC301: -7.3800000000000004e-002 | AD301: -7.51e-002 | AE301: 87.65 | AF301: 89.07 | AG301: 0.78 | AH301: AA+ | AI301: 4.1599999999999998e-002 | AJ301: =H301+100*O301 -> 153.29999999999998 | AK301: 156.5 | AL301: 311 | AM301: 67.4 | AN301: 313 | AO301: 6.3e-002 | AP301: 4 | AQ301: 盛虹转债
A302: 330 | B302: 110043 | C302: 无锡转债! | D302: 600908 | E302: 无锡银行 | F302: 金融 | G302: 银行行业 | H302: 120 | I302: -1.0700000000000001e-002 | J302: 1.1699999999999999e-002 | K302: 6.16 | L302: 1.6000000000000001e-003 | M302: 108.3 | N302: 5.79 | O302: 0.128 | P302: 106.39 | Q302: 转股中 | R302: 2.68年 | S302: 无权 | T302: 29.2 | U302: 127 | V302: 3.6000000000000004e-002 | W302: 0.255 | X302: 0.27100000000000002 | Y302: 115 | Z302: 0.93 | AA302: -3.7999999999999999e-002 | AB302: -4.3499999999999997e-002 | AC302: 无权 | AD302: 无权 | AE302: 无权 | AF302: 97.98 | AG302: 0.61 | AH302: AA+ | AI302: 3.8599999999999995e-002 | AJ302: =H302+100*O302 -> 132.80000000000001 | AK302: 133.6 | AL302: 179 | AM302: 35.6 | AN302: 136 | AO302: 2.e-002 | AP302: 25 | AQ302: 无锡转债!
A303: 92 | B303: 113040 | C303: 星宇转债 | D303: 601799 | E303: 星宇股份 | F303: 汽车 | G303: 零部件制 | H303: 137.22 | I303: 1.06e-002 | J303: -6.0000000000000001e-003 | K303: 190.06 | L303: 6.0000000000000001e-003 | M303: 111.5 | N303: 158 | O303: 0.14099999999999999 | P303: 120.29 | Q303: 转股中 | R303: 5.40年 | S303: 3.40年 | T303: 15 | U303: 58 | V303: 2.7999999999999997e-002 | W303: 2.8999999999999998e-002 | X303: 3.4000000000000002e-002 | Y303: 525 | Z303: 8.68 | AA303: -3.8100000000000002e-002 | AB303: -4.1799999999999997e-002 | AC303: -7.9500000000000001e-002 | AD303: -8.0500000000000002e-002 | AE303: 88.49 | AF303: 89.72 | AG303: 0.76 | AH303: AA+ | AI303: 4.1599999999999998e-002 | AJ303: =H303+100*O303 -> 151.31999999999999 | AK303: 154.1 | AL303: 302 | AM303: 64.4 | AN303: 306 | AO303: 1.2e-002 | AP303: 5 | AQ303: 星宇转债
A304: 6 | B304: 113047 | C304: 旗滨转债 | D304: 601636 | E304: 旗滨集团 | F304: 建筑 | G304: 玻璃 | H304: 143.23 | I304: 1.4000000000000002e-003 | J304: -6.0000000000000001e-003 | K304: 16.1 | L304: -6.1999999999999998e-003 | M304: 114 | N304: 13.15 | O304: 0.17000000000000001 | P304: 122.43 | Q304: 4月20天 | R304: 5.86年 | S304: 3.87年 | T304: 15 | U304: 89 | V304: 4.0999999999999995e-002 | W304: 3.5000000000000003e-002 | X304: 4.2000000000000003e-002 | Y304: 432 | Z304: 4.16 | AA304: -3.8599999999999995e-002 | AB304: -4.2599999999999999e-002 | AC304: -8.0000000000000002e-002 | AD304: -8.1000000000000003e-002 | AE304: 87.05 | AF304: 90.04 | AG304: 0.75 | AH304: AA+ | AI304: 4.1599999999999998e-002 | AJ304: =H304+100*O304 -> 160.22999999999999 | AK304: 164 | AL304: 320 | AM304: 74 | AN304: 320 | AO304: 3.9e-002 | AP304: 4 | AQ304: 旗滨转债
A305: 255 | B305: 113541 | C305: 荣晟转债! | D305: 603165 | E305: 荣晟环保 | F305: 造纸包装 | G305: 包装用纸 | H305: 136.32 | I305: 4.0800000000000003e-002 | J305: -7.0999999999999995e-003 | K305: 14.9 | L305: 4.0500000000000001e-002 | M305: 115 | N305: 10.84 | O305: -8.0000000000000002e-003 | P305: 137.45 | Q305: 转股中 | R305: 4年55天 | S305: 2年56天 | T305: 2.07 | U305: 478 | V305: 1.7 | W305: 5.4000000000000006e-002 | X305: 7.4999999999999997e-002 | Y305: 38 | Z305: 2.23 | AA305: -4.0999999999999995e-002 | AB305: -4.7e-002 | AC305: -0.113 | AD305: -0.115 | AE305: 89.93 | AF305: 89.67 | AG305: 0.83 | AH305: AA- | AI305: 6.3299999999999995e-002 | AJ305: =H305+100*O305 -> 135.51999999999998 | AK305: 135.2 | AL305: 200 | AM305: 45.3 | AN305: 219 | AO305: 9.6999999999999989e-002 | AP305: 43 | AQ305: 荣晟转债!
A306: 220 | B306: 110065 | C306: 淮矿转债! | D306: 600985 | E306: 淮北矿业 | F306: 煤炭 | G306: 煤炭开采 | H306: 134.53 | I306: -3.3e-003 | J306: 3.3e-003 | K306: 11.51 | L306: 0. | M306: 110.8 | N306: 8.68 | O306: 1.4999999999999999e-002 | P306: 132.6 | Q306: 转股中 | R306: 4.57年 | S306: 2.57年 | T306: 16.9 | U306: 80 | V306: 3.5000000000000003e-002 | W306: 6.4000000000000001e-002 | X306: 8.5000000000000006e-002 | Y306: 263 | Z306: 1.12 | AA306: -4.2300000000000004e-002 | AB306: -4.6300000000000001e-002 | AC306: -9.2699999999999991e-002 | AD306: -9.4600000000000004e-002 | AE306: 93.53 | AF306: 94.03 | AG306: 0.84 | AH306: AAA | AI306: 3.73e-002 | AJ306: =H306+100*O306 -> 136.03 | AK306: 136.5 | AL306: 211 | AM306: 42.4 | AN306: 196 | AO306: -4.4999999999999998e-002 | AP306: 20 | AQ306: 淮矿转债!
A307: 360 | B307: 113009 | C307: 广汽转债! | D307: 601238 | E307: 广汽集团 | F307: 汽车 | G307: 乘用车 | H307: 109.08 | I307: 5.3e-003 | J307: -5.0000000000000001e-003 | K307: 11.7 | L307: 1.1200000000000002e-002 | M307: 106 | N307: 14.12 | O307: 0.316 | P307: 82.86 | Q307: 转股中 | R307: 0.66年 | S307: 回售内 | T307: 25.5 | U307: 13 | V307: 5.0000000000000001e-003 | W307: 2.1000000000000001e-002 | X307: 1.7000000000000001e-002 | Y307: 1211. | Z307: 1.4 | AA307: -4.2800000000000005e-002 | AB307: -5.9299999999999999e-002 | AC307: 回售内 | AD307: 回售内 | AE307: 100.27 | AF307: 103.83 | AG307: 0.03 | AH307: AAA | AI307: 3.2099999999999997e-002 | AJ307: =H307+100*O307 -> 140.68000000000001 | AK307: 135.3 | AL307: 201 | AM307: 31.5 | AN307: 84 | AO307: 6.0000000000000001e-003 | AP307: 15 | AQ307: 广汽转债!
A308: 352 | B308: 113013 | C308: 国君转债! | D308: 601211 | E308: 国泰君安 | F308: 金融 | G308: 证券行业 | H308: 118.56 | I308: -3.0000000000000001e-003 | J308: 9.7999999999999997e-003 | K308: 17.6 | L308: 1.7899999999999999e-002 | M308: 108.3 | N308: 19.01 | O308: 0.28100000000000003 | P308: 92.58 | Q308: 转股中 | R308: 2年40天 | S308: 无权 | T308: 69.9 | U308: 68 | V308: 8.0000000000000002e-003 | W308: 4.4999999999999998e-002 | X308: 4.0999999999999995e-002 | Y308: 1568. | Z308: 1.2 | AA308: -4.2800000000000005e-002 | AB308: -4.9800000000000004e-002 | AC308: 无权 | AD308: 无权 | AE308: 无权 | AF308: 100.76 | AG308: 0.38 | AH308: AAA | AI308: 3.56e-002 | AJ308: =H308+100*O308 -> 146.66 | AK308: 144.5 | AL308: 264 | AM308: 43.8 | AN308: 211 | AO308: 4.8000000000000001e-002 | AP308: 13 | AQ308: 国君转债!
A309: 144 | B309: 123058 | C309: 欣旺转债 | D309: 300207 | E309: 欣旺达 | F309: 电子 | G309: 电子产品 | H309: 145.4 | I309: 4.5999999999999999e-002 | J309: 1.95e-002 | K309: 30.12 | L309: 7.7600000000000002e-002 | M309: 116.3 | N309: 21.24 | O309: 2.5000000000000001e-002 | P309: 141.81 | Q309: 转股中 | R309: 5年46天 | S309: 3年47天 | T309: 11.2 | U309: 788 | V309: 0.48499999999999999 | W309: 2.4e-002 | X309: 3.4000000000000002e-002 | Y309: 474 | Z309: 6.78 | AA309: -4.3400000000000001e-002 | AB309: -4.8600000000000004e-002 | AC309: -9.8100000000000007e-002 | AD309: -9.9900000000000003e-002 | AE309: 90.33 | AF309: 93.88 | AG309: 0.84 | AH309: AA | AI309: 4.36e-002 | AJ309: =H309+100*O309 -> 147.90000000000001 | AK309: 149 | AL309: 287 | AM309: 55.1 | AN309: 271 | AO309: 0.30299999999999999 | AP309: 6 | AQ309: 欣旺转债
A310: 201 | B310: 123043 | C310: 正元转债 | D310: 300645 | E310: 正元智慧 | F310: 计算机及 | G310: 软件开发 | H310: 149 | I310: -1.55e-002 | J310: 1.21e-002 | K310: 16.7 | L310: -4.7999999999999996e-003 | M310: 120.9 | N310: 15.41 | O310: 0.375 | P310: 108.37 | Q310: 转股中 | R310: 4.77年 | S310: 2.77年 | T310: 1.66 | U310: 498 | V310: 1.98 | W310: 7.8e-002 | X310: 8.5000000000000006e-002 | Y310: 21 | Z310: 3.31 | AA310: -4.3700000000000003e-002 | AB310: -5.0700000000000002e-002 | AC310: -0.114 | AD310: -0.11699999999999999 | AE310: 84.5 | AF310: 86.58 | AG310: 0.7 | AH310: A+ | AI310: 7.4299999999999991e-002 | AJ310: =H310+100*O310 -> 186.5 | AK310: 189.6 | AL310: 334 | AM310: 103.1 | AN310: 335 | AO310: 3.7000000000000005e-002 | AP310: 18 | AQ310: 正元转债
A311: 68 | B311: 113611 | C311: 福20转债 | D311: 603806 | E311: 福斯特 | F311: 能源电力 | G311: 太阳能 | H311: 142.67 | I311: 3.4000000000000002e-003 | J311: -3.4000000000000002e-003 | K311: 78.99 | L311: 0. | M311: 111.85 | N311: 61.03 | O311: 0.10199999999999999 | P311: 129.43 | Q311: 10天 | R311: 5.51年 | S311: 3.51年 | T311: 17 | U311: 52 | V311: 2.1000000000000001e-002 | W311: 2.3e-002 | X311: 2.9999999999999999e-002 | Y311: 729 | Z311: 6.64 | AA311: -4.3799999999999999e-002 | AB311: -4.7400000000000005e-002 | AC311: -8.6099999999999996e-002 | AD311: -8.7300000000000003e-002 | AE311: 87.83 | AF311: 88.71 | AG311: 0.8 | AH311: AA | AI311: 4.36e-002 | AJ311: =H311+100*O311 -> 152.86999999999998 | AK311: 155.9 | AL311: 309 | AM311: 67.2 | AN311: 312 | AO311: -7.9000000000000001e-002 | AP311: 5 | AQ311: 福20转债
A312: 326 | B312: 127005 | C312: 长证转债! | D312: 783 | E312: 长江证券 | F312: 金融 | G312: 证券行业 | H312: 122.7 | I312: 2.8999999999999998e-003 | J312: 3.5999999999999999e-003 | K312: 7.88 | L312: 1.03e-002 | M312: 108.3 | N312: 7.28 | O312: 0.13400000000000001 | P312: 108.24 | Q312: 转股中 | R312: 2.79年 | S312: 无权 | T312: 50 | U312: 80 | V312: 1.3000000000000001e-002 | W312: 0.115 | X312: 0.124 | Y312: 436 | Z312: 1.51 | AA312: -4.4400000000000002e-002 | AB312: -4.9699999999999994e-002 | AC312: 无权 | AD312: 无权 | AE312: 无权 | AF312: 98.39 | AG312: 0.63 | AH312: AAA | AI312: 3.56e-002 | AJ312: =H312+100*O312 -> 136.09999999999999 | AK312: 137.2 | AL312: 221 | AM312: 38.8 | AN312: 161 | AO312: 7.0000000000000007e-002 | AP312: 14 | AQ312: 长证转债!
A313: 158 | B313: 128113 | C313: 比音转债! | D313: 2832 | E313: 比音勒芬 | F313: 服装纺织 | G313: 服装行业 | H313: 148.46 | I313: 2.3900000000000001e-002 | J313: -2.1899999999999999e-002 | K313: 21.57 | L313: 2.3e-003 | M313: 117.3 | N313: 14.9 | O313: 2.6000000000000002e-002 | P313: 144.77 | Q313: 转股中 | R313: 5年17天 | S313: 3年18天 | T313: 3.63 | U313: 103 | V313: 0.192 | W313: 3.1e-002 | X313: 4.4999999999999998e-002 | Y313: 117 | Z313: 4.46 | AA313: -4.6500000000000007e-002 | AB313: -5.2000000000000005e-002 | AC313: -0.10400000000000001 | AD313: -0.106 | AE313: 90.64 | AF313: 95.01 | AG313: 0.86 | AH313: AA | AI313: 4.36e-002 | AJ313: =H313+100*O313 -> 151.06 | AK313: 152.2 | AL313: 296 | AM313: 57.1 | AN313: 285 | AO313: 1.9e-002 | AP313: 8 | AQ313: 比音转债!
A314: 322 | B314: 113508 | C314: 新凤转债! | D314: 603225 | E314: 新凤鸣 | F314: 服装纺织 | G314: 纺织行业 | H314: 127.87 | I314: 1.21e-002 | J314: -1.6000000000000001e-003 | K314: 19.22 | L314: 1.37e-002 | M314: 111.3 | N314: 15.78 | O314: 5.0000000000000003e-002 | P314: 121.8 | Q314: 转股中 | R314: 2.91年 | S314: 0.91年 | T314: 20.6 | U314: 13 | V314: 5.0000000000000001e-003 | W314: 7.6999999999999999e-002 | X314: 9.3000000000000013e-002 | Y314: 269 | Z314: 2.2 | AA314: -4.7199999999999999e-002 | AB314: -5.3800000000000001e-002 | AC314: -0.187 | AD314: -0.19 | AE314: 97.53 | AF314: 99.3 | AG314: 0.77 | AH314: AA | AI314: 4.0599999999999997e-002 | AJ314: =H314+100*O314 -> 132.87 | AK314: 133.9 | AL314: 183 | AM314: 34.6 | AN314: 121 | AO314: 5.7000000000000002e-002 | AP314: 23 | AQ314: 新凤转债!
A315: 292 | B315: 128053 | C315: 尚荣转债! | D315: 2551 | E315: 尚荣医疗 | F315: 医药 | G315: 医疗器械 | H315: 136.7 | I315: -3.39e-002 | J315: 1.2e-002 | K315: 5.8 | L315: -2.1899999999999999e-002 | M315: 114.3 | N315: 4.89 | O315: 0.153 | P315: 118.61 | Q315: 转股中 | R315: 3.72年 | S315: 1.72年 | T315: 1.91 | U315: 104 | V315: 0.39000000000000001 | W315: 4.0000000000000001e-002 | X315: 4.8000000000000001e-002 | Y315: 48 | Z315: 1.56 | AA315: -4.7800000000000002e-002 | AB315: -5.4199999999999998e-002 | AC315: -0.11800000000000001 | AD315: -0.11900000000000001 | AE315: 95.13 | AF315: 98.26 | AG315: 1 | AH315: AA | AI315: 4.2300000000000004e-002 | AJ315: =H315+100*O315 -> 152. | AK315: 154.8 | AL315: 306 | AM315: 56.5 | AN315: 281 | AO315: -4.5999999999999999e-002 | AP315: 25 | AQ315: 尚荣转债!
A316: 90 | B316: 127023 | C316: 华菱转2! | D316: 932 | E316: 华菱钢铁 | F316: 钢铁 | G316: 炼钢 | H316: 143 | I316: -8.3000000000000001e-003 | J316: -6.0999999999999995e-003 | K316: 6.85 | L316: -1.44e-002 | M316: 110.1 | N316: 4.97 | O316: 3.7999999999999999e-002 | P316: 137.83 | Q316: 转股中 | R316: 5.40年 | S316: 4.41年 | T316: 20.7 | U316: 152 | V316: 5.0999999999999997e-002 | W316: 4.9000000000000002e-002 | X316: 6.8000000000000005e-002 | Y316: 420 | Z316: 1.19 | AA316: -4.7899999999999998e-002 | AB316: -5.0999999999999997e-002 | AC316: -6.7099999999999993e-002 | AD316: -6.8699999999999997e-002 | AE316: 88.01 | AF316: 90.01 | AG316: 1 | AH316: AAA | AI316: 3.8599999999999995e-002 | AJ316: =H316+100*O316 -> 146.80000000000001 | AK316: 148.2 | AL316: 279 | AM316: 58.2 | AN316: 289 | AO316: -0.10199999999999999 | AP316: 12 | AQ316: 华菱转2!
A317: 9 | B317: 123111 | C317: 东财转3 | D317: 300059 | E317: 东方财富 | F317: 金融 | G317: 证券行业 | H317: 148.1 | I317: -4.0000000000000001e-003 | J317: 1.1000000000000001e-003 | K317: 31.31 | L317: -3.4999999999999996e-003 | M317: 110.5 | N317: 23.35 | O317: 0.10400000000000001 | P317: 134.09 | Q317: 4月18天 | R317: 5.86年 | S317: 3.86年 | T317: 158 | U317: 1212. | V317: 5.2000000000000005e-002 | W317: 4.9000000000000002e-002 | X317: 6.5000000000000002e-002 | Y317: 3236. | Z317: 7.69 | AA317: -4.9200000000000001e-002 | AB317: -5.2300000000000006e-002 | AC317: -8.8699999999999987e-002 | AD317: -8.9600000000000013e-002 | AE317: 86.62 | AF317: 87.25 | AG317: 0.83 | AH317: AA+ | AI317: 4.1599999999999998e-002 | AJ317: =H317+100*O317 -> 158.5 | AK317: 162.1 | AL317: 315 | AM317: 74.9 | AN317: 321 | AO317: -5.2000000000000005e-002 | AP317: 14 | AQ317: 东财转3
A318: 305 | B318: 128046 | C318: 利尔转债!! | D318: 2258 | E318: 利尔化学 | F318: 化工 | G318: 农化 | H318: 133.455 | I318: -1.5100000000000001e-002 | J318: 6.3e-003 | K318: 23.77 | L318: -8.8000000000000005e-003 | M318: 112.3 | N318: 18.42 | O318: 3.4000000000000002e-002 | P318: 129.04 | Q318: 转股中 | R318: 3.39年 | S318: 1.39年 | T318: 8.47 | U318: 11 | V318: 1.e-002 | W318: 6.8000000000000005e-002 | X318: 8.8000000000000009e-002 | Y318: 125 | Z318: 3.2 | AA318: -5.0599999999999999e-002 | AB318: -5.67e-002 | AC318: -0.13800000000000001 | AD318: -0.14099999999999999 | AE318: 96.44 | AF318: 97.88 | AG318: 1 | AH318: AA | AI318: 4.2300000000000004e-002 | AJ318: =H318+100*O318 -> 136.85500000000002 | AK318: 137.9 | AL318: 225 | AM318: 40 | AN318: 171 | AO318: 2.e-002 | AP318: 9 | AQ318: 利尔转债!!
A319: 221 | B319: 113559 | C319: 永创转债! | D319: 603901 | E319: 永创智能 | F319: 机械装备 | G319: 专用设备 | H319: 149.59 | I319: 2.18e-002 | J319: -1.1000000000000001e-002 | K319: 15.55 | L319: 1.24e-002 | M319: 118.3 | N319: 10.32 | O319: -6.9999999999999993e-003 | P319: 150.68 | Q319: 转股中 | R319: 4.57年 | S319: 2.57年 | T319: 3.39 | U319: 228 | V319: 0.45399999999999996 | W319: 5.0000000000000003e-002 | X319: 7.4999999999999997e-002 | Y319: 68 | Z319: 4.69 | AA319: -5.1200000000000002e-002 | AB319: -5.7599999999999998e-002 | AC319: -0.12300000000000001 | AD319: -0.125 | AE319: 88.43 | AF319: 90.02 | AG319: 0.87 | AH319: AA- | AI319: 6.3299999999999995e-002 | AJ319: =H319+100*O319 -> 148.89000000000001 | AK319: 148.5 | AL319: 285 | AM319: 58.5 | AN319: 290 | AO319: 0.14599999999999999 | AP319: 18 | AQ319: 永创转债!
A320: 44 | B320: 113616 | C320: 韦尔转债 | D320: 603501 | E320: 韦尔股份 | F320: 电子 | G320: 元器件制 | H320: 153.51 | I320: -5.6000000000000008e-003 | J320: -1.2199999999999999e-002 | K320: 286.48 | L320: -2.23e-002 | M320: 114.5 | N320: 222.83 | O320: 0.19399999999999998 | P320: 128.56 | Q320: 38天 | R320: 5.58年 | S320: 3.59年 | T320: 24.4 | U320: 107 | V320: 2.7999999999999997e-002 | W320: 1.e-002 | X320: 1.3000000000000001e-002 | Y320: 2487. | Z320: 19.99 | AA320: -5.1799999999999999e-002 | AB320: -5.6100000000000004e-002 | AC320: -0.10099999999999999 | AD320: -0.10300000000000001 | AE320: 88.47 | AF320: 91.5 | AG320: 0.8 | AH320: AA+ | AI320: 4.1599999999999998e-002 | AJ320: =H320+100*O320 -> 172.91 | AK320: 178.5 | AL320: 329 | AM320: 87 | AN320: 330 | AO320: 1.4999999999999999e-002 | AP320: 8 | AQ320: 韦尔转债
A321: 182 | B321: 113034 | C321: 滨化转债! | D321: 601678 | E321: 滨化股份 | F321: 化工 | G321: 化工 | H321: 148.84 | I321: -2.76e-002 | J321: 1.1200000000000002e-002 | K321: 6.78 | L321: -1.8799999999999997e-002 | M321: 114.8 | N321: 4.58 | O321: 5.0000000000000001e-003 | P321: 148.03 | Q321: 转股中 | R321: 4.87年 | S321: 2.87年 | T321: 6 | U321: 82 | V321: 8.900000000000001e-002 | W321: 4.5999999999999999e-002 | X321: 6.8000000000000005e-002 | Y321: 131 | Z321: 1.48 | AA321: -5.28e-002 | AB321: -5.7800000000000004e-002 | AC321: -0.11199999999999999 | AD321: -0.114 | AE321: 91.18 | AF321: 94.18 | AG321: 0.87 | AH321: AA | AI321: 4.2300000000000004e-002 | AJ321: =H321+100*O321 -> 149.34 | AK321: 149.6 | AL321: 290 | AM321: 55.5 | AN321: 275 | AO321: 0. | AP321: 25 | AQ321: 滨化转债!
A322: 25 | B322: 123103 | C322: 震安转债 | D322: 300767 | E322: 震安科技 | F322: 化工 | G322: 橡胶塑料 | H322: 165.4 | I322: 7.000000000000001e-004 | J322: 1.4499999999999999e-002 | K322: 109.42 | L322: 1.8100000000000002e-002 | M322: 121.4 | N322: 79.87 | O322: 0.20699999999999999 | P322: 137 | Q322: 3月25天 | R322: 5.79年 | S322: 3.79年 | T322: 2.85 | U322: 620 | V322: 1.29 | W322: 1.8000000000000002e-002 | X322: 2.5000000000000001e-002 | Y322: 158 | Z322: 13.83 | AA322: -5.2999999999999999e-002 | AB322: -5.8799999999999998e-002 | AC322: -0.106 | AD322: -0.10800000000000001 | AE322: 78.65 | AF322: 80.4 | AG322: 0.84 | AH322: A+ | AI322: 7.5600000000000001e-002 | AJ322: =H322+100*O322 -> 186.09999999999999 | AK322: 193.8 | AL322: 336 | AM322: 113.4 | AN322: 342 | AO322: 4.2000000000000003e-002 | AP322: 3 | AQ322: 震安转债
A323: 261 | B323: 113537 | C323: 文灿转债!! | D323: 603348 | E323: 文灿股份 | F323: 汽车 | G323: 零部件制 | H323: 151.09 | I323: 4.58e-002 | J323: 4.0000000000000001e-002 | K323: 29.02 | L323: 0.10000000000000001 | M323: 121.5 | N323: 19.43 | O323: 1.2e-002 | P323: 149.36 | Q323: 转股中 | R323: 4年12天 | S323: 2年13天 | T323: 1.44 | U323: 1232. | V323: 5.6600000000000001 | W323: 1.9e-002 | X323: 2.8999999999999998e-002 | Y323: 75 | Z323: 2.92 | AA323: -5.3899999999999997e-002 | AB323: -6.2300000000000001e-002 | AC323: -0.121 | AD323: -0.12300000000000001 | AE323: 91.41 | AF323: 95.53 | AG323: 0.86 | AH323: AA- | AI323: 6.3299999999999995e-002 | AJ323: =H323+100*O323 -> 152.28999999999999 | AK323: 152.8 | AL323: 298 | AM323: 57.3 | AN323: 287 | AO323: 0.16800000000000001 | AP323: 24 | AQ323: 文灿转债!!
A324: 309 | B324: 123014 | C324: 凯发转债! | D324: 300407 | E324: 凯发电气 | F324: 能源电力 | G324: 电力设备 | H324: 122.858 | I324: -2.8000000000000004e-003 | J324: 3.5999999999999999e-003 | K324: 6.69 | L324: 3.0000000000000001e-003 | M324: 108.5 | N324: 8.12 | O324: 0.49099999999999999 | P324: 82.39 | Q324: 转股中 | R324: 2.16年 | S324: 0.16年 | T324: 1.16 | U324: 18 | V324: 0.129 | W324: 5.7000000000000002e-002 | X324: 4.7e-002 | Y324: 20 | Z324: 1.49 | AA324: -5.6600000000000004e-002 | AB324: -6.3399999999999998e-002 | AC324: -0.57200000000000006 | AD324: -0.57799999999999996 | AE324: 98.94 | AF324: 93.45 | AG324: 0.27 | AH324: A+ | AI324: 7.2599999999999998e-002 | AJ324: =H324+100*O324 -> 171.958 | AK324: 163.3 | AL324: 318 | AM324: 64.4 | AN324: 305 | AO324: 1.7000000000000001e-002 | AP324: 16 | AQ324: 凯发转债!
A325: 357 | B325: 113011 | C325: 光大转债 | D325: 601818 | E325: 光大银行 | F325: 金融 | G325: 银行行业 | H325: 118.68 | I325: -8.0000000000000004e-004 | J325: -5.9999999999999995e-004 | K325: 3.86 | L325: -2.5999999999999999e-003 | M325: 106.8 | N325: 3.76 | O325: 0.156 | P325: 102.66 | Q325: 转股中 | R325: 1.80年 | S325: 无权 | T325: 242 | U325: 177 | V325: 6.0000000000000001e-003 | W325: 0.11599999999999999 | X325: 0.11900000000000001 | Y325: 2086. | Z325: 0.59 | AA325: -5.7300000000000004e-002 | AB325: -6.4000000000000001e-002 | AC325: 无权 | AD325: 无权 | AE325: 无权 | AF325: 100.33 | AG325: 0.55 | AH325: AAA | AI325: 3.56e-002 | AJ325: =H325+100*O325 -> 134.28 | AK325: 134.7 | AL325: 193 | AM325: 34.4 | AN325: 114 | AO325: 8.0000000000000002e-003 | AP325: 13 | AQ325: 光大转债
A326: 21 | B326: 127029 | C326: 中钢转债 | D326: 928 | E326: 中钢国际 | F326: 建筑 | G326: 建筑工程 | H326: 169.37 | I326: -3.5999999999999999e-003 | J326: -5.6999999999999993e-003 | K326: 10.81 | L326: -1.01e-002 | M326: 117.5 | N326: 5.89 | O326: -7.6999999999999999e-002 | P326: 183.53 | Q326: 4月2天 | R326: 5.81年 | S326: 3.81年 | T326: 9.6 | U326: 899 | V326: 0.54400000000000004 | W326: 7.0999999999999994e-002 | X326: 0.13 | Y326: 136 | Z326: 2.36 | AA326: -6.1799999999999994e-002 | AB326: -6.6500000000000004e-002 | AC326: -0.113 | AD326: -0.114 | AE326: 87.68 | AF326: 93.04 | AG326: 0.93 | AH326: AA+ | AI326: 4.1599999999999998e-002 | AJ326: =H326+100*O326 -> 161.67000000000002 | AK326: 155.2 | AL326: 307 | AM326: 62.2 | AN326: 301 | AO326: -4.4999999999999998e-002 | AP326: 7 | AQ326: 中钢转债
A327: 336 | B327: 128032 | C327: 双环转债! | D327: 2472 | E327: 双环传动 | F327: 机械装备 | G327: 通用设备 | H327: 128.899 | I327: -8.5000000000000006e-003 | J327: -4.4000000000000003e-003 | K327: 12.25 | L327: -1.61e-002 | M327: 109.3 | N327: 9.89 | O327: 4.0999999999999995e-002 | P327: 123.86 | Q327: 转股中 | R327: 2.58年 | S327: 0.58年 | T327: 9.92 | U327: 12 | V327: 9.0000000000000011e-003 | W327: 0.11800000000000001 | X327: 0.14599999999999999 | Y327: 84 | Z327: 2.41 | AA327: -6.3e-002 | AB327: -6.9099999999999995e-002 | AC327: -0.29100000000000004 | AD327: -0.29499999999999998 | AE327: 98.84 | AF327: 98.82 | AG327: 0.8 | AH327: AA | AI327: 4.0599999999999997e-002 | AJ327: =H327+100*O327 -> 132.999 | AK327: 133.9 | AL327: 182 | AM327: 35.1 | AN327: 127 | AO327: 2.4e-002 | AP327: 38 | AQ327: 双环转债!
A328: 230 | B328: 113550 | C328: 常汽转债! | D328: 603035 | E328: XD常熟汽 | F328: 汽车 | G328: 零部件制 | H328: 161.88 | I328: -2.2000000000000001e-003 | J328: 1.0500000000000001e-002 | K328: 15.01 | L328: 9.3999999999999986e-003 | M328: 121.3 | N328: 9.33 | O328: 6.0000000000000001e-003 | P328: 160.88 | Q328: 转股中 | R328: 4.47年 | S328: 2.48年 | T328: 3.06 | U328: 1076. | V328: 2.1400000000000001 | W328: 5.7999999999999996e-002 | X328: 9.3000000000000013e-002 | Y328: 53 | Z328: 1.4 | AA328: -6.3799999999999996e-002 | AB328: -7.1099999999999997e-002 | AC328: -0.109 | AD328: -0.11 | AE328: 88.8 | AF328: 92.81 | AG328: 0.89 | AH328: AA- | AI328: 6.3299999999999995e-002 | AJ328: =H328+100*O328 -> 162.47999999999999 | AK328: 162.9 | AL328: 317 | AM328: 70.1 | AN328: 317 | AO328: -1.9e-002 | AP328: 16 | AQ328: 常汽转债!
A329: 188 | B329: 128103 | C329: 同德转债! | D329: 2360 | E329: 同德化工 | F329: 化工 | G329: 化工 | H329: 168.888 | I329: -1.7500000000000002e-002 | J329: -4.0000000000000002e-004 | K329: 7.66 | L329: -1.7899999999999999e-002 | M329: 121.3 | N329: 5.08 | O329: 0.12 | P329: 150.79 | Q329: 转股中 | R329: 4.82年 | S329: 2.83年 | T329: 1.09 | U329: 106 | V329: 0.57299999999999995 | W329: 3.6000000000000004e-002 | X329: 5.4000000000000006e-002 | Y329: 31 | Z329: 2.38 | AA329: -6.7500000000000004e-002 | AB329: -7.4299999999999991e-002 | AC329: -0.14699999999999999 | AD329: -0.14899999999999999 | AE329: 84.26 | AF329: 86.52 | AG329: 1 | AH329: A+ | AI329: 7.4299999999999991e-002 | AJ329: =H329+100*O329 -> 180.88800000000001 | AK329: 187 | AL329: 332 | AM329: 100.5 | AN329: 333 | AO329: -2.3e-002 | AP329: 13 | AQ329: 同德转债!
A330: 282 | B330: 123022 | C330: 长信转债!! | D330: 300088 | E330: 长信科技 | F330: 通信互联 | G330: 通信设备 | H330: 151.9 | I330: 1.26e-002 | J330: -8.6e-003 | K330: 8.17 | L330: 4.8999999999999998e-003 | M330: 114.3 | N330: 6.15 | O330: 0.14300000000000002 | P330: 132.85 | Q330: 转股中 | R330: 3.80年 | S330: 1.81年 | T330: 2.57 | U330: 84 | V330: 0.214 | W330: 1.3000000000000001e-002 | X330: 1.7000000000000001e-002 | Y330: 201 | Z330: 2.78 | AA330: -7.3200000000000001e-002 | AB330: -7.9199999999999993e-002 | AC330: -0.14599999999999999 | AD330: -0.14699999999999999 | AE330: 94.79 | AF330: 97.92 | AG330: 0.82 | AH330: AA | AI330: 4.2300000000000004e-002 | AJ330: =H330+100*O330 -> 166.20000000000002 | AK330: 171 | AL330: 324 | AM330: 73 | AN330: 319 | AO330: 5.4000000000000006e-002 | AP330: 12 | AQ330: 长信转债!!
A331: 206 | B331: 128097 | C331: 奥佳转债! | D331: 2614 | E331: 奥佳华 | F331: 机械装备 | G331: 专用设备 | H331: 169.925 | I331: -2.e-002 | J331: -8.8999999999999999e-003 | K331: 17.15 | L331: -3.1600000000000003e-002 | M331: 114.9 | N331: 10.39 | O331: 2.8999999999999998e-002 | P331: 165.06 | Q331: 转股中 | R331: 4.75年 | S331: 2.75年 | T331: 5.07 | U331: 156 | V331: 0.18100000000000002 | W331: 4.7e-002 | X331: 7.8e-002 | Y331: 107 | Z331: 2.34 | AA331: -8.0399999999999985e-002 | AB331: -8.5299999999999987e-002 | AC331: -0.10400000000000001 | AD331: -0.105 | AE331: 91.74 | AF331: 94.75 | AG331: 0.91 | AH331: AA | AI331: 4.2300000000000004e-002 | AJ331: =H331+100*O331 -> 172.82500000000002 | AK331: 174.8 | AL331: 327 | AM331: 80 | AN331: 327 | AO331: 5.9000000000000004e-002 | AP331: 22 | AQ331: 奥佳转债!
A332: 203 | B332: 110066 | C332: 盛屯转债!! | D332: 600711 | E332: 盛屯矿业 | F332: 有色金属 | G332: 有色行业 | H332: 171.32 | I332: 5.0799999999999998e-002 | J332: -2.4700000000000003e-002 | K332: 7.85 | L332: 2.8799999999999999e-002 | M332: 114.9 | N332: 4.88 | O332: 6.5000000000000002e-002 | P332: 160.86 | Q332: 转股中 | R332: 4.76年 | S332: 2.76年 | T332: 5.22 | U332: 1031. | V332: 1.1499999999999999 | W332: 2.5000000000000001e-002 | X332: 4.0000000000000001e-002 | Y332: 210 | Z332: 1.88 | AA332: -8.1799999999999998e-002 | AB332: -8.6699999999999999e-002 | AC332: -0.10400000000000001 | AD332: -0.106 | AE332: 91.68 | AF332: 94.7 | AG332: 0.91 | AH332: AA | AI332: 4.2300000000000004e-002 | AJ332: =H332+100*O332 -> 177.81999999999999 | AK332: 181.8 | AL332: 331 | AM332: 87.1 | AN332: 331 | AO332: 2.3e-002 | AP332: 34 | AQ332: 盛屯转债!!
A333: 83 | B333: 113041 | C333: 紫金转债! | D333: 601899 | E333: 紫金矿业 | F333: 有色金属 | G333: 贵金属 | H333: 160.04 | I333: -2.9999999999999997e-004 | J333: 4.5000000000000005e-003 | K333: 11.19 | L333: 4.5000000000000005e-003 | M333: 108 | N333: 7 | O333: 1.e-003 | P333: 159.86 | Q333: 转股中 | R333: 4.43年 | S333: 2.44年 | T333: 57 | U333: 770 | V333: 8.3000000000000004e-002 | W333: 2.e-002 | X333: 3.2000000000000001e-002 | Y333: 2850. | Z333: 5.31 | AA333: -8.5500000000000007e-002 | AB333: -8.8399999999999992e-002 | AC333: -0.114 | AD333: -0.115 | AE333: 92.16 | AF333: 91.94 | AG333: 0.92 | AH333: AAA | AI333: 3.73e-002 | AJ333: =H333+100*O333 -> 160.13999999999999 | AK333: 160.2 | AL333: 313 | AM333: 68.1 | AN333: 315 | AO333: -1.e-002 | AP333: 9 | AQ333: 紫金转债!
A334: 341 | B334: 128025 | C334: 特一转债! | D334: 2728 | E334: 特一药业 | F334: 医药 | G334: 化学制药 | H334: 136.5 | I334: -2.3999999999999998e-003 | J334: -6.8000000000000005e-003 | K334: 18.34 | L334: -1.1299999999999999e-002 | M334: 108.8 | N334: 14.7 | O334: 9.4e-002 | P334: 124.76 | Q334: 转股中 | R334: 2.53年 | S334: 0.53年 | T334: 2.98 | U334: 2595. | V334: 6.2300000000000004 | W334: 8.0000000000000002e-002 | X334: 0.10000000000000001 | Y334: 37 | Z334: 3.5 | AA334: -8.6999999999999994e-002 | AB334: -9.2799999999999994e-002 | AC334: -0.38299999999999995 | AD334: -0.38600000000000001 | AE334: 97.44 | AF334: 93.77 | AG334: 0.82 | AH334: AA- | AI334: 6.1600000000000002e-002 | AJ334: =H334+100*O334 -> 145.90000000000001 | AK334: 148.2 | AL334: 281 | AM334: 50.8 | AN334: 249 | AO334: 0.26400000000000001 | AP334: 51 | AQ334: 特一转债!
A335: 356 | B335: 113012 | C335: 骆驼转债! | D335: 601311 | E335: 骆驼股份 | F335: 汽车 | G335: 零部件制 | H335: 126.93 | I335: -1.4000000000000002e-003 | J335: -1.1999999999999999e-003 | K335: 12.03 | L335: -3.3e-003 | M335: 106.5 | N335: 10.06 | O335: 6.0999999999999999e-002 | P335: 119.58 | Q335: 转股中 | R335: 1.82年 | S335: 回售内 | T335: 5.09 | U335: 22 | V335: 3.3000000000000002e-002 | W335: 3.7999999999999999e-002 | X335: 4.4999999999999998e-002 | Y335: 135 | Z335: 1.78 | AA335: -9.2499999999999999e-002 | AB335: -9.849999999999999e-002 | AC335: 回售内 | AD335: 回售内 | AE335: 100.25 | AF335: 99.11 | AG335: 0.8 | AH335: AA | AI335: 4.0599999999999997e-002 | AJ335: =H335+100*O335 -> 133.03 | AK335: 134.3 | AL335: 187 | AM335: 34 | AN335: 109 | AO335: -1.9e-002 | AP335: 16 | AQ335: 骆驼转债!
A336: 234 | B336: 123034 | C336: 通光转债! | D336: 300265 | E336: 通光线缆 | F336: 通信互联 | G336: 通信设备 | H336: 181.191 | I336: 5.0000000000000001e-004 | J336: -1.01e-002 | K336: 8.7 | L336: -1.3600000000000001e-002 | M336: 118 | N336: 7.97 | O336: 0.66000000000000003 | P336: 109.16 | Q336: 转股中 | R336: 4.44年 | S336: 2.44年 | T336: 0.78 | U336: 126 | V336: 0.88099999999999989 | W336: 2.5000000000000001e-002 | X336: 2.7000000000000003e-002 | Y336: 32 | Z336: 2.44 | AA336: -9.3699999999999992e-002 | AB336: -9.98e-002 | AC336: -0.13500000000000001 | AD336: -0.13600000000000001 | AE336: 86.06 | AF336: 86.46 | AG336: 0.71 | AH336: A+ | AI336: 7.4299999999999991e-002 | AJ336: =H336+100*O336 -> 247.191 | AK336: 253.2 | AL336: 348 | AM336: 166.8 | AN336: 349 | AO336: 1.1000000000000001e-002 | AP336: 22 | AQ336: 通光转债!
A337: 191 | B337: 123046 | C337: 天铁转债! | D337: 300587 | E337: 天铁股份 | F337: 铁路 | G337: 铁路设备 | H337: 187.5 | I337: -3.0999999999999999e-003 | J337: 9.8999999999999991e-003 | K337: 17.99 | L337: 7.3000000000000001e-003 | M337: 117.7 | N337: 10.12 | O337: 5.5e-002 | P337: 177.77 | Q337: 转股中 | R337: 4.81年 | S337: 2.81年 | T337: 0.77 | U337: 85 | V337: 0.58999999999999997 | W337: 1.3000000000000001e-002 | X337: 2.2000000000000002e-002 | Y337: 61 | Z337: 3.78 | AA337: -9.3900000000000011e-002 | AB337: -9.9399999999999988e-002 | AC337: -0.11599999999999999 | AD337: -0.11699999999999999 | AE337: 86.47 | AF337: 88.18 | AG337: 0.93 | AH337: AA- | AI337: 6.3299999999999995e-002 | AJ337: =H337+100*O337 -> 193. | AK337: 197.2 | AL337: 338 | AM337: 109.1 | AN337: 339 | AO337: 7.2999999999999995e-002 | AP337: 12 | AQ337: 天铁转债!
A338: 328 | B338: 113504 | C338: 艾华转债!! | D338: 603989 | E338: 艾华集团 | F338: 电子 | G338: 元器件制 | H338: 144 | I338: -1.23e-002 | J338: 1.9599999999999999e-002 | K338: 30 | L338: 8.1000000000000013e-003 | M338: 109.3 | N338: 21.13 | O338: 1.3999999999999999e-002 | P338: 141.98 | Q338: 转股中 | R338: 2.76年 | S338: 0.76年 | T338: 4.95 | U338: 38 | V338: 5.4000000000000006e-002 | W338: 4.0999999999999995e-002 | X338: 5.9000000000000004e-002 | Y338: 119 | Z338: 4.45 | AA338: -9.64e-002 | AB338: -0.10199999999999999 | AC338: -0.31900000000000001 | AD338: -0.32100000000000001 | AE338: 98.12 | AF338: 98.1 | AG338: 0.91 | AH338: AA | AI338: 4.0599999999999997e-002 | AJ338: =H338+100*O338 -> 145.40000000000001 | AK338: 146 | AL338: 268 | AM338: 47.9 | AN338: 232 | AO338: 3.6000000000000004e-002 | AP338: 9 | AQ338: 艾华转债!!
A339: 268 | B339: 113025 | C339: 明泰转债!! | D339: 601677 | E339: 明泰铝业 | F339: 有色金属 | G339: 铝金属 | H339: 174.19 | I339: -1.8e-003 | J339: -5.6000000000000008e-003 | K339: 19.03 | L339: -7.8000000000000005e-003 | M339: 114.5 | N339: 11 | O339: 6.9999999999999993e-003 | P339: 173 | Q339: 转股中 | R339: 3.87年 | S339: 1.87年 | T339: 11 | U339: 66 | V339: 3.4000000000000002e-002 | W339: 8.5000000000000006e-002 | X339: 0.14599999999999999 | Y339: 130 | Z339: 1.44 | AA339: -0.10400000000000001 | AB339: -0.11 | AC339: -0.17800000000000002 | AD339: -0.17999999999999999 | AE339: 94.57 | AF339: 97.84 | AG339: 0.95 | AH339: AA | AI339: 4.2300000000000004e-002 | AJ339: =H339+100*O339 -> 174.88999999999999 | AK339: 175.4 | AL339: 328 | AM339: 77.5 | AN339: 324 | AO339: 2.2000000000000002e-002 | AP339: 25 | AQ339: 明泰转债!!
A340: 244 | B340: 113545 | C340: 金能转债! | D340: 603113 | E340: 金能科技 | F340: 煤炭 | G340: 炼焦 | H340: 184.96 | I340: 1.7600000000000001e-002 | J340: 1.7000000000000001e-003 | K340: 19.44 | L340: 2.0499999999999997e-002 | M340: 114.9 | N340: 10.78 | O340: 2.6000000000000002e-002 | P340: 180.33 | Q340: 转股中 | R340: 4.38年 | S340: 2.38年 | T340: 10.2 | U340: 148 | V340: 7.9000000000000001e-002 | W340: 6.2e-002 | X340: 0.111 | Y340: 166 | Z340: 1.99 | AA340: -0.105 | AB340: -0.11 | AC340: -0.14300000000000002 | AD340: -0.14400000000000002 | AE340: 93.15 | AF340: 96.2 | AG340: 0.94 | AH340: AA | AI340: 4.2300000000000004e-002 | AJ340: =H340+100*O340 -> 187.56 | AK340: 189.6 | AL340: 333 | AM340: 93.4 | AN340: 332 | AO340: 3.4000000000000002e-002 | AP340: 17 | AQ340: 金能转债!
A341: 249 | B341: 123030 | C341: 九洲转债! | D341: 300040 | E341: 九洲集团 | F341: 能源电力 | G341: 电力设备 | H341: 198.55 | I341: 7.9000000000000008e-003 | J341: -1.9e-003 | K341: 8.95 | L341: 6.7000000000000002e-003 | M341: 120 | N341: 5.65 | O341: 0.253 | P341: 158.41 | Q341: 转股中 | R341: 4.23年 | S341: 2.23年 | T341: 0.97 | U341: 330 | V341: 1.72 | W341: 2.7999999999999997e-002 | X341: 4.4999999999999998e-002 | Y341: 34 | Z341: 1.53 | AA341: -0.114 | AB341: -0.121 | AC341: -0.17000000000000001 | AD341: -0.17100000000000001 | AE341: 89.5 | AF341: 93.11 | AG341: 0.88 | AH341: AA- | AI341: 6.3299999999999995e-002 | AJ341: =H341+100*O341 -> 223.85000000000002 | AK341: 238.7 | AL341: 345 | AM341: 145.6 | AN341: 345 | AO341: 5.2999999999999999e-002 | AP341: 25 | AQ341: 九洲转债!
A342: 283 | B342: 110055 | C342: 伊力转债!! | D342: 600197 | E342: 伊力特 | F342: 食品饮料 | G342: 白酒 | H342: 190.86 | I342: 2.23e-002 | J342: 0. | K342: 30.27 | L342: 2.3300000000000001e-002 | M342: 114.3 | N342: 16.81 | O342: 5.9999999999999998e-002 | P342: 180.07 | Q342: 转股中 | R342: 3.79年 | S342: 1.80年 | T342: 2.54 | U342: 3256. | V342: 6.7300000000000004 | W342: 1.8000000000000002e-002 | X342: 3.2000000000000001e-002 | Y342: 142 | Z342: 3.98 | AA342: -0.128 | AB342: -0.13400000000000001 | AC342: -0.21100000000000002 | AD342: -0.21199999999999999 | AE342: 94.82 | AF342: 97.95 | AG342: 0.96 | AH342: AA | AI342: 4.2300000000000004e-002 | AJ342: =H342+100*O342 -> 196.86000000000001 | AK342: 201.6 | AL342: 339 | AM342: 103.7 | AN342: 336 | AO342: 0.13200000000000001 | AP342: 23 | AQ342: 伊力转债!!
A343: 253 | B343: 113543 | C343: 欧派转债! | D343: 603833 | E343: 欧派家居 | F343: 其他 | G343: 家居用品 | H343: 213.68 | I343: -2.3799999999999998e-002 | J343: -2.9600000000000001e-002 | K343: 147.01 | L343: -5.5099999999999996e-002 | M343: 114.9 | N343: 71.69 | O343: 4.2000000000000003e-002 | P343: 205.06 | Q343: 转股中 | R343: 4.22年 | S343: 3.22年 | T343: 3.46 | U343: 60 | V343: 7.9000000000000001e-002 | W343: 4.0000000000000001e-003 | X343: 8.0000000000000002e-003 | Y343: 885 | Z343: 7.31 | AA343: -0.13900000000000001 | AB343: -0.14400000000000002 | AC343: -0.11 | AD343: -0.111 | AE343: 91.69 | AF343: 96.85 | AG343: 0.97 | AH343: AA | AI343: 4.2300000000000004e-002 | AJ343: =H343+100*O343 -> 217.88 | AK343: 222.3 | AL343: 344 | AM343: 125.4 | AN343: 344 | AO343: -6.0999999999999999e-002 | AP343: 13 | AQ343: 欧派转债!
A344: 159 | B344: 128111 | C344: 中矿转债! | D344: 2738 | E344: 中矿资源 | F344: 有色金属 | G344: 有色行业 | H344: 273.101 | I344: 2.29e-002 | J344: 2.1000000000000001e-002 | K344: 40.33 | L344: 4.5100000000000001e-002 | M344: 124.7 | N344: 15.47 | O344: 4.8000000000000001e-002 | P344: 260.7 | Q344: 转股中 | R344: 5年13天 | S344: 3年14天 | T344: 1.72 | U344: 2425. | V344: 5.0199999999999996 | W344: 1.3000000000000001e-002 | X344: 3.5000000000000003e-002 | Y344: 130 | Z344: 3.8 | AA344: -0.14699999999999999 | AB344: -0.153 | AC344: -0.14699999999999999 | AD344: -0.14800000000000002 | AE344: 85.85 | AF344: 91.72 | AG344: 0.97 | AH344: AA- | AI344: 6.4600000000000005e-002 | AJ344: =H344+100*O344 -> 277.90100000000001 | AK344: 285.5 | AL344: 351 | AM344: 193.8 | AN344: 351 | AO344: 0.19399999999999998 | AP344: 8 | AQ344: 中矿转债!
A345: 169 | B345: 113582 | C345: 火炬转债! | D345: 603678 | E345: 火炬电子 | F345: 电子 | G345: 元器件制 | H345: 256.26 | I345: -2.0299999999999999e-002 | J345: 2.9999999999999997e-004 | K345: 59.9 | L345: -2.0400000000000001e-002 | M345: 114.9 | N345: 25.33 | O345: 8.4000000000000005e-002 | P345: 236.48 | Q345: 转股中 | R345: 4.99年 | S345: 2.997年 | T345: 4.18 | U345: 75 | V345: 6.9000000000000006e-002 | W345: 1.4999999999999999e-002 | X345: 3.6000000000000004e-002 | Y345: 275 | Z345: 6.78 | AA345: -0.14999999999999999 | AB345: -0.154 | AC345: -0.14400000000000002 | AD345: -0.14499999999999999 | AE345: 90.79 | AF345: 93.78 | AG345: 0.98 | AH345: AA | AI345: 4.2300000000000004e-002 | AJ345: =H345+100*O345 -> 264.65999999999997 | AK345: 276 | AL345: 350 | AM345: 182.3 | AN345: 350 | AO345: 2.6000000000000002e-002 | AP345: 6 | AQ345: 火炬转债!
A346: 333 | B346: 128033 | C346: 迪龙转债! | D346: 2658 | E346: 雪迪龙 | F346: 城市公用 | G346: 三废处理 | H346: 167.65 | I346: -5.8200000000000002e-002 | J346: 3.3000000000000002e-002 | K346: 11.52 | L346: -2.9500000000000002e-002 | M346: 108.8 | N346: 8.71 | O346: 0.26800000000000002 | P346: 132.26 | Q346: 转股中 | R346: 2.58年 | S346: 0.58年 | T346: 2.98 | U346: 2515. | V346: 4.8200000000000003 | W346: 4.0999999999999995e-002 | X346: 5.4000000000000006e-002 | Y346: 73 | Z346: 3.04 | AA346: -0.156 | AB346: -0.161 | AC346: -0.54000000000000004 | AD346: -0.54299999999999993 | AE346: 98.57 | AF346: 98.32 | AG346: 0.85 | AH346: AA | AI346: 4.0599999999999997e-002 | AJ346: =H346+100*O346 -> 194.45000000000002 | AK346: 203 | AL346: 340 | AM346: 104.5 | AN346: 337 | AO346: 0.12300000000000001 | AP346: 36 | AQ346: 迪龙转债!
A347: 207 | B347: 128095 | C347: 恩捷转债!! | D347: 2812 | E347: 恩捷股份 | F347: 电子 | G347: 元器件制 | H347: 253.5 | I347: 9.6500000000000002e-002 | J347: 1.4000000000000002e-003 | K347: 164.85 | L347: 0.10000000000000001 | M347: 114.9 | N347: 64.92 | O347: -2.e-003 | P347: 253.93 | Q347: 转股中 | R347: 4.71年 | S347: 2.71年 | T347: 6.51 | U347: 1236. | V347: 0.754 | W347: 4.0000000000000001e-003 | X347: 1.1000000000000001e-002 | Y347: 1464. | Z347: 12.7 | AA347: -0.157 | AB347: -0.161 | AC347: -0.16399999999999998 | AD347: -0.16500000000000001 | AE347: 91.89 | AF347: 94.9 | AG347: 0.98 | AH347: AA | AI347: 4.2300000000000004e-002 | AJ347: =H347+100*O347 -> 253.30000000000001 | AK347: 253.1 | AL347: 347 | AM347: 158.2 | AN347: 347 | AO347: 0.20199999999999999 | AP347: 15 | AQ347: 恩捷转债!!
A348: 171 | B348: 113580 | C348: 康隆转债! | D348: 603665 | E348: 康隆达 | F348: 服装纺织 | G348: 服装行业 | H348: 275.18 | I348: 0. | J348: -4.0000000000000002e-004 | K348: 14.54 | L348: -7.000000000000001e-004 | M348: 120.8 | N348: 15.51 | O348: 1.9399999999999999 | P348: 93.75 | Q348: 转股中 | R348: 4.90年 | S348: 2.90年 | T348: 0.41 | U348: 90 | V348: 0.79400000000000004 | W348: 1.8000000000000002e-002 | X348: 1.7000000000000001e-002 | Y348: 23 | Z348: 2.11 | AA348: -0.157 | AB348: -0.16300000000000001 | AC348: -0.158 | AD348: -0.158 | AE348: 86.06 | AF348: 89.98 | AG348: 0.56 | AH348: AA- | AI348: 6.3299999999999995e-002 | AJ348: =H348+100*O348 -> 469.18000000000001 | AK348: 456.6 | AL348: 360 | AM348: 366.6 | AN348: 360 | AO348: -4.0000000000000001e-002 | AP348: 9 | AQ348: 康隆转债!
A349: 350 | B349: 128017 | C349: 金禾转债!! | D349: 2597 | E349: 金禾实业 | F349: 化工 | G349: 化工 | H349: 168 | I349: -1.1399999999999999e-002 | J349: 1.7000000000000001e-003 | K349: 34.59 | L349: -1.03e-002 | M349: 108.8 | N349: 21.97 | O349: 6.7000000000000004e-002 | P349: 157.44 | Q349: 转股中 | R349: 2.43年 | S349: 0.43年 | T349: 5.52 | U349: 38 | V349: 4.0000000000000001e-002 | W349: 2.7999999999999997e-002 | X349: 4.4999999999999998e-002 | Y349: 194 | Z349: 3.87 | AA349: -0.16600000000000001 | AB349: -0.17100000000000001 | AC349: -0.69200000000000006 | AD349: -0.69499999999999995 | AE349: 99.17 | AF349: 98.92 | AG349: 0.95 | AH349: AA | AI349: 4.0599999999999997e-002 | AJ349: =H349+100*O349 -> 174.69999999999999 | AK349: 178.6 | AL349: 330 | AM349: 79.4 | AN349: 326 | AO349: 4.0000000000000001e-002 | AP349: 10 | AQ349: 金禾转债!!
A350: 293 | B350: 113527 | C350: 维格转债!! | D350: 603518 | E350: 锦泓集团 | F350: 服装纺织 | G350: 服装行业 | H350: 235.57 | I350: 0.14000000000000001 | J350: -4.2800000000000005e-002 | K350: 22.11 | L350: 0.10000000000000001 | M350: 119.5 | N350: 9.85 | O350: 4.9000000000000002e-002 | P350: 224.47 | Q350: 转股中 | R350: 3.66年 | S350: 1.66年 | T350: 4.63 | U350: 5752. | V350: 5.3099999999999996 | W350: 7.4999999999999997e-002 | X350: 0.16899999999999998 | Y350: 62 | Z350: 2.91 | AA350: -0.17199999999999999 | AB350: -0.17899999999999999 | AC350: -0.28199999999999997 | AD350: -0.28300000000000003 | AE350: 93.76 | AF350: 99.5 | AG350: 0.97 | AH350: AA | AI350: 5.2300000000000006e-002 | AJ350: =H350+100*O350 -> 240.47 | AK350: 246.7 | AL350: 346 | AM350: 147.2 | AN350: 346 | AO350: 0.39399999999999996 | AP350: 90 | AQ350: 维格转债!!
A351: 321 | B351: 113509 | C351: 新泉转债!! | D351: 603179 | E351: 新泉股份 | F351: 汽车 | G351: 零部件制 | H351: 199.1 | I351: -2.0000000000000001e-004 | J351: 6.5000000000000006e-003 | K351: 29.06 | L351: 6.6e-003 | M351: 110.3 | N351: 15.25 | O351: 4.4999999999999998e-002 | P351: 190.56 | Q351: 转股中 | R351: 3年6.1天 | S351: 1年7天 | T351: 0.84 | U351: 74 | V351: 0.442 | W351: 8.0000000000000002e-003 | X351: 1.4999999999999999e-002 | Y351: 107 | Z351: 3.03 | AA351: -0.18100000000000002 | AB351: -0.185 | AC351: -0.40200000000000002 | AD351: -0.40399999999999997 | AE351: 97.93 | AF351: 97.63 | AG351: 0.97 | AH351: AA | AI351: 4.2300000000000004e-002 | AJ351: =H351+100*O351 -> 203.59999999999999 | AK351: 207.6 | AL351: 341 | AM351: 109.7 | AN351: 340 | AO351: 1.8000000000000002e-002 | AP351: 11 | AQ351: 新泉转债!!
A352: 354 | B352: 127004 | C352: 模塑转债!! | D352: 700 | E352: 模塑科技 | F352: 汽车 | G352: 零部件制 | H352: 170.699 | I352: -7.6e-003 | J352: 7.3000000000000001e-003 | K352: 5.61 | L352: -7.0999999999999995e-003 | M352: 113.3 | N352: 7.46 | O352: 1.27 | P352: 75.2 | Q352: 转股中 | R352: 2年5.1天 | S352: 5.1天 | T352: 1.32 | U352: 91 | V352: 0.39899999999999997 | W352: 2.6000000000000002e-002 | X352: 1.9e-002 | Y352: 51 | Z352: 1.84 | AA352: -0.187 | AB352: -0.19600000000000001 | AC352: -2.4430000000000001 | AD352: -2.452 | AE352: 101.08 | AF352: 101.04 | AG352: 0.04 | AH352: AA | AI352: 4.0599999999999997e-002 | AJ352: =H352+100*O352 -> 297.69900000000001 | AK352: 266.2 | AL352: 349 | AM352: 165.1 | AN352: 348 | AO352: 3.4000000000000002e-002 | AP352: 32 | AQ352: 模塑转债!!
A353: 247 | B353: 123031 | C353: 晶瑞转债! | D353: 300655 | E353: 晶瑞股份 | F353: 化工 | G353: 化工 | H353: 280 | I353: -4.1100000000000005e-002 | J353: 4.4600000000000001e-002 | K353: 24.91 | L353: 3.5999999999999999e-003 | M353: 115.8 | N353: 10.13 | O353: 0.13900000000000001 | P353: 245.9 | Q353: 转股中 | R353: 4.25年 | S353: 2.26年 | T353: 0.63 | U353: 1621. | V353: 8.9800000000000004 | W353: 6.9999999999999993e-003 | X353: 1.8000000000000002e-002 | Y353: 85 | Z353: 3.54 | AA353: -0.19 | AB353: -0.19500000000000001 | AC353: -0.222 | AD353: -0.223 | AE353: 87 | AF353: 85.93 | AG353: 0.98 | AH353: A+ | AI353: 7.4299999999999991e-002 | AJ353: =H353+100*O353 -> 293.89999999999998 | AK353: 314.1 | AL353: 352 | AM353: 227.1 | AN353: 352 | AO353: 1.3000000000000001e-002 | AP353: 16 | AQ353: 晶瑞转债!
A354: 295 | B354: 123018 | C354: 溢利转债! | D354: 300381 | E354: 溢多利 | F354: 医药 | G354: 原料药 | H354: 244.6 | I354: -1.5e-003 | J354: -3.5999999999999999e-003 | K354: 8.98 | L354: -7.7000000000000002e-003 | M354: 114.3 | N354: 8.32 | O354: 1.27 | P354: 107.93 | Q354: 转股中 | R354: 3.56年 | S354: 1.56年 | T354: 0.54 | U354: 189 | V354: 1.4399999999999999 | W354: 1.2e-002 | X354: 1.3000000000000001e-002 | Y354: 44 | Z354: 1.46 | AA354: -0.19500000000000001 | AB354: -0.20000000000000001 | AC354: -0.31 | AD354: -0.311 | AE354: 92.52 | AF354: 92.25 | AG354: 0.67 | AH354: AA- | AI354: 6.3299999999999995e-002 | AJ354: =H354+100*O354 -> 371.60000000000002 | AK354: 381.3 | AL354: 355 | AM354: 288.7 | AN354: 355 | AO354: -3.9e-002 | AP354: 12 | AQ354: 溢利转债!
A355: 307 | B355: 123015 | C355: 蓝盾转债!! | D355: 300297 | E355: 蓝盾股份 | F355: 计算机及 | G355: 软件开发 | H355: 231 | I355: -1.15e-002 | J355: 1.1399999999999999e-002 | K355: 3.62 | L355: -5.5000000000000005e-003 | M355: 112.3 | N355: 5.79 | O355: 2.6899999999999999 | P355: 62.52 | Q355: 转股中 | R355: 3.21年 | S355: 1.21年 | T355: 1 | U355: 186 | V355: 0.79900000000000004 | W355: 2.2000000000000002e-002 | X355: 1.3999999999999999e-002 | Y355: 45 | Z355: 1.73 | AA355: -0.20399999999999999 | AB355: -0.20899999999999999 | AC355: -0.38900000000000001 | AD355: -0.39000000000000001 | AE355: 94.55 | AF355: 92.63 | AG355: 0.01 | AH355: AA- | AI355: 6.3299999999999995e-002 | AJ355: =H355+100*O355 -> 500. | AK355: 399.5 | AL355: 356 | AM355: 304.9 | AN355: 356 | AO355: 4.4999999999999998e-002 | AP355: 17 | AQ355: 蓝盾转债!!
A356: 260 | B356: 123027 | C356: 蓝晓转债! | D356: 300487 | E356: 蓝晓科技 | F356: 化工 | G356: 化工 | H356: 335.509 | I356: 1.3600000000000001e-002 | J356: 3.7400000000000003e-002 | K356: 70.41 | L356: 5.2600000000000001e-002 | M356: 119.5 | N356: 29.22 | O356: 0.39200000000000002 | P356: 240.97 | Q356: 转股中 | R356: 4年13天 | S356: 2年14天 | T356: 1.07 | U356: 2304. | V356: 6.25 | W356: 6.9999999999999993e-003 | X356: 1.7000000000000001e-002 | Y356: 155 | Z356: 8.38 | AA356: -0.23000000000000001 | AB356: -0.23499999999999999 | AC356: -0.27399999999999997 | AD356: -0.27500000000000002 | AE356: 89.37 | AF356: 90.25 | AG356: 0.97 | AH356: A+ | AI356: 7.4299999999999991e-002 | AJ356: =H356+100*O356 -> 374.709 | AK356: 430.1 | AL356: 358 | AM356: 339.8 | AN356: 358 | AO356: 0.251 | AP356: 20 | AQ356: 蓝晓转债!
A357: 294 | B357: 113526 | C357: 联泰转债! | D357: 603797 | E357: 联泰环保 | F357: 城市公用 | G357: 三废处理 | H357: 286.04 | I357: -1.32e-002 | J357: 9.1000000000000004e-003 | K357: 7.63 | L357: -5.1999999999999998e-003 | M357: 110.3 | N357: 6.11 | O357: 1.29 | P357: 124.88 | Q357: 转股中 | R357: 3.66年 | S357: 1.66年 | T357: 1.93 | U357: 87 | V357: 0.156 | W357: 5.5999999999999994e-002 | X357: 7.0000000000000007e-002 | Y357: 34 | Z357: 2.01 | AA357: -0.23199999999999998 | AB357: -0.23600000000000002 | AC357: -0.32200000000000001 | AD357: -0.32299999999999995 | AE357: 95.7 | AF357: 95.73 | AG357: 0.78 | AH357: AA+ | AI357: 4.0300000000000002e-002 | AJ357: =H357+100*O357 -> 415.04000000000002 | AK357: 447.2 | AL357: 359 | AM357: 351.5 | AN357: 359 | AO357: 1.2e-002 | AP357: 9 | AQ357: 联泰转债!
A358: 318 | B358: 110044 | C358: 广电转债!! | D358: 600831 | E358: 广电网络 | F358: 传媒娱乐 | G358: 影视娱乐 | H358: 254.36 | I358: -1.95e-002 | J358: 9.3999999999999986e-003 | K358: 6.29 | L358: -2.4799999999999999e-002 | M358: 112.3 | N358: 6.9 | O358: 1.79 | P358: 91.16 | Q358: 转股中 | R358: 3年29天 | S358: 1年30天 | T358: 0.71 | U358: 236 | V358: 1.29 | W358: 1.6e-002 | X358: 1.3999999999999999e-002 | Y358: 45 | Z358: 1.19 | AA358: -0.23699999999999999 | AB358: -0.24100000000000002 | AC358: -0.46700000000000003 | AD358: -0.46799999999999997 | AE358: 97.67 | AF358: 99.14 | AG358: 0.41 | AH358: AA | AI358: 4.2300000000000004e-002 | AJ358: =H358+100*O358 -> 433.36000000000001 | AK358: 417.6 | AL358: 357 | AM358: 318.4 | AN358: 357 | AO358: 3.9e-002 | AP358: 11 | AQ358: 广电转债!!
A359: 314 | B359: 128041 | C359: 盛路转债!! | D359: 2446 | E359: 盛路通信 | F359: 通信互联 | G359: 通信设备 | H359: 291.5 | I359: -1.4000000000000002e-003 | J359: -3.0999999999999999e-003 | K359: 5.91 | L359: -1.1699999999999999e-002 | M359: 114.3 | N359: 6.82 | O359: 2.3599999999999999 | P359: 86.66 | Q359: 转股中 | R359: 3年49天 | S359: 1年50天 | T359: 0.53 | U359: 535 | V359: 3.3700000000000001 | W359: 1.e-002 | X359: 9.0000000000000011e-003 | Y359: 54 | Z359: 1.75 | AA359: -0.26200000000000001 | AB359: -0.26700000000000002 | AC359: -0.48299999999999998 | AD359: -0.48399999999999999 | AE359: 97.45 | AF359: 100.67 | AG359: 0.38 | AH359: AA | AI359: 4.2300000000000004e-002 | AJ359: =H359+100*O359 -> 527.5 | AK359: 496.3 | AL359: 361 | AM359: 395.7 | AN359: 361 | AO359: 8.0000000000000002e-003 | AP359: 13 | AQ359: 盛路转债!!
A360: 337 | B360: 128030 | C360: 天康转债!! | D360: 2100 | E360: 天康生物 | F360: 农业 | G360: 畜牧业 | H360: 246.851 | I360: 0. | J360: -1.04e-002 | K360: 9.5 | L360: -1.04e-002 | M360: 111.3 | N360: 7.85 | O360: 1.04 | P360: 121.02 | Q360: 转股中 | R360: 2.57年 | S360: 0.57年 | T360: 0.94 | U360: 7.4 | V360: 3.2000000000000001e-002 | W360: 9.0000000000000011e-003 | X360: 1.1000000000000001e-002 | Y360: 102 | Z360: 1.56 | AA360: -0.27000000000000002 | AB360: -0.27500000000000002 | AC360: -0.81999999999999995 | AD360: -0.82200000000000006 | AE360: 98.87 | AF360: 100.66 | AG360: 1 | AH360: AA | AI360: 4.0599999999999997e-002 | AJ360: =H360+100*O360 -> 350.851 | AK360: 372.7 | AL360: 354 | AM360: 272 | AN360: 354 | AO360: -3.2000000000000001e-002 | AP360: 11 | AQ360: 天康转债!!
A361: 338 | B361: 128029 | C361: 太阳转债!! | D361: 2078 | E361: 太阳纸业 | F361: 造纸包装 | G361: 造纸行业 | H361: 189.549 | I361: -3.3399999999999999e-002 | J361: -9.7999999999999997e-003 | K361: 14.2 | L361: -4.3099999999999999e-002 | M361: 107 | N361: 8.55 | O361: 0.14099999999999999 | P361: 166.08 | Q361: 转股中 | R361: 1.57年 | S361: 回售内 | T361: 9.09 | U361: 70 | V361: 4.0000000000000001e-002 | W361: 2.4e-002 | X361: 4.0999999999999995e-002 | Y361: 373 | Z361: 2.18 | AA361: -0.307 | AB361: -0.312 | AC361: 回售内 | AD361: 回售内 | AE361: 100.17 | AF361: 100.86 | AG361: 1 | AH361: AA+ | AI361: 3.8599999999999995e-002 | AJ361: =H361+100*O361 -> 203.649 | AK361: 213 | AL361: 343 | AM361: 112.2 | AN361: 341 | AO361: -8.6999999999999994e-002 | AP361: 7 | AQ361: 太阳转债!!
A362: 311 | B362: 123013 | C362: 横河转债! | D362: 300539 | E362: 横河精密 | F362: 机械装备 | G362: 专用设备 | H362: 370.89 | I362: -6.9999999999999993e-003 | J362: -2.0999999999999999e-003 | K362: 7.59 | L362: -2.1899999999999999e-002 | M362: 115.2 | N362: 9.13 | O362: 3.46 | P362: 83.13 | Q362: 转股中 | R362: 3年58天 | S362: 1年59天 | T362: 0.38 | U362: 96 | V362: 0.67200000000000004 | W362: 2.3e-002 | X362: 1.9e-002 | Y362: 17 | Z362: 3.4 | AA362: -0.314 | AB362: -0.31900000000000001 | AC362: -0.52700000000000002 | AD362: -0.52800000000000002 | AE362: 94.09 | AF362: 92.42 | AG362: 0.41 | AH362: A+ | AI362: 7.4299999999999991e-002 | AJ362: =H362+100*O362 -> 716.88999999999999 | AK362: 658.6 | AL362: 362 | AM362: 564.6 | AN362: 362 | AO362: 4.5999999999999999e-002 | AP362: 14 | AQ362: 横河转债!
A363: 349 | B363: 113016 | C363: 小康转债!! | D363: 601127 | E363: 小康股份 | F363: 汽车 | G363: 零部件制 | H363: 367.13 | I363: 5.5000000000000005e-003 | J363: 7.8000000000000005e-003 | K363: 58.09 | L363: 1.34e-002 | M363: 109.3 | N363: 15.7 | O363: -8.0000000000000002e-003 | P363: 370 | Q363: 转股中 | R363: 2.44年 | S363: 0.44年 | T363: 3.11 | U363: 3559. | V363: 3.0699999999999998 | W363: 4.0000000000000001e-003 | X363: 1.4999999999999999e-002 | Y363: 750 | Z363: 16.01 | AA363: -0.39500000000000002 | AB363: -0.39799999999999996 | AC363: -1.232 | AD363: -1.2329999999999999 | AE363: 99.37 | AF363: 99.35 | AG363: 0.99 | AH363: AA | AI363: 4.0599999999999997e-002 | AJ363: =H363+100*O363 -> 366.32999999999998 | AK363: 364.3 | AL363: 353 | AM363: 264.9 | AN363: 353 | AO363: 3.4000000000000002e-002 | AP363: 42 | AQ363: 小康转债!!
A364: 251 | B364: 123029 | C364: 英科转债! | D364: 300677 | E364: 英科医疗 | F364: 医药 | G364: 医疗器械 | H364: 1673.06 | I364: -2.4500000000000001e-002 | J364: -4.5000000000000005e-003 | K364: 139.33 | L364: -2.92e-002 | M364: 138.2 | N364: 8.32 | O364: -1.e-003 | P364: 1674.64 | Q364: 转股中 | R364: 4.22年 | S364: 2.22年 | T364: 0.37 | U364: 336 | V364: 0.53500000000000003 | W364: 1.e-003 | X364: 1.2e-002 | Y364: 505 | Z364: 3.75 | AA364: -0.41600000000000004 | AB364: -0.41999999999999998 | AC364: -0.33799999999999997 | AD364: -0.33799999999999997 | AE364: 97.39 | AF364: 116.81 | AG364: 0.99 | AH364: AA | AI364: 4.2300000000000004e-002 | AJ364: =H364+100*O364 -> 1672.96 | AK364: 1671.5 | AL364: 363 | AM364: 1554.7 | AN364: 363 | AO364: -5.9000000000000004e-002 | AP364: 16 | AQ364: 英科转债!