A1: 序号 | B1: 转债代码 | C1: 转债名称 | D1: 股票代码 | E1: 股票名称 | F1: 行业 | G1: 子行业 | H1: 转债价格 | I1: 涨跌 | J1: 日内套利 | K1: 股价 | L1: 涨跌 | M1: 剩余本息 | N1: 转股价格 | O1: 转股溢价率 | P1: 转股价值 | Q1: 距离转股日 | R1: 剩余年限 | S1: 回售年限 | T1: 回售剩余年限 | U1: 转债余额 | V1: 转债成交额 | W1: 转债换手率 | X1: 余额/市值 | Y1: 余额/股本 | Z1: 股票市值 | AA1: P/B | AB1: 税前收益率 | AC1: 税后收益率 | AD1: 税前回售收益 | AE1: 税后回售收益 | AG1: 回售价值 | AH1: 纯债价值 | AI1: 弹性 | AJ1: 信用 | AK1: 折现率 | AL1: 双低 | AM1: 老式双低 | AN1: 老式排名 | AO1: 新式双低 | AP1: 新式排名 | AQ1: MA20乖离 | AR1: 热门度 | AS1: 转债名称
A2: 250 | B2: 128062 | C2: 亚药转债! | D2: 2370 | E2: 亚太药业 | F2: 医药 | G2: 化学制药 | H2: 69.438 | I2: 4.0000000000000002e-004 | J2: -4.0000000000000002e-004 | K2: 3.59 | L2: 8.3999999999999995e-003 | M2: 119.8 | N2: 16.25 | O2: 2.1400000000000001 | P2: 22.09 | Q2: 转股中 | R2: 4年35天 | S2: 2年35天 | T2: =2+35/365 -> 2.095890410958904 | U2: 9.63 | V2: 18 | W2: 2.6000000000000002e-002 | X2: 0.5 | Y2: 0.11 | Z2: 19 | AA2: 5.98 | AB2: 0.14599999999999999 | AC2: 0.13600000000000001 | AD2: 0.19500000000000001 | AE2: 0.191 | AF2: =AD2/T2 -> 9.3039215686274518e-002 | AG2: 84.13 | AH2: 82.94 | AI2: 0 | AJ2: A- | AK2: 9.6099999999999991e-002 | AL2: =H2+100*O2 -> 283.43799999999999 | AM2: 116.8 | AN2: 108 | AO2: 32.6 | AP2: 188 | AQ2: -2.2000000000000002e-002 | AR2: 87 | AS2: 亚药转债!
A3: 269 | B3: 113527 | C3: 维格转债! | D3: 603518 | E3: 锦泓集团 | F3: 服装纺织 | G3: 服装行业 | H3: 80.16 | I3: 1.e-004 | J3: 2.9999999999999997e-004 | K3: 4.96 | L3: 8.1000000000000013e-003 | M3: 119.5 | N3: 9.85 | O3: 0.59200000000000008 | P3: 50.36 | Q3: 转股中 | R3: 3.91年 | S3: 1.91年 | T3: 1.91 | U3: 7.46 | V3: 4.9 | W3: 8.0000000000000002e-003 | X3: 0.59599999999999997 | Y3: 0.29999999999999999 | Z3: 13 | AA3: 0.79 | AB3: 0.11 | AC3: 9.9700000000000011e-002 | AD3: 0.128 | AE3: 0.125 | AF3: =AD3/T3 -> 6.7015706806282729e-002 | AG3: 92.25 | AH3: 97.6 | AI3: 0.05 | AJ3: AA | AK3: 5.4100000000000002e-002 | AL3: =H3+100*O3 -> 139.36000000000001 | AM3: 110 | AN3: 48 | AO3: 12.4 | AP3: 16 | AQ3: 8.5999999999999993e-002 | AR3: 100 | AS3: 维格转债!
A4: 121 | B4: 127018 | C4: 本钢转债! | D4: 761 | E4: 本钢板材 | F4: 钢铁 | G4: 炼钢 | H4: 78.841 | I4: 2.9999999999999997e-004 | J4: -3.3e-003 | K4: 3.01 | L4: -1.95e-002 | M4: 128.6 | N4: 5.03 | O4: 0.318 | P4: 59.84 | Q4: 转股中 | R4: 5.34年 | S4: 3.34年 | T4: 3.34 | U4: 68 | V4: 47 | W4: 9.0000000000000011e-003 | X4: 0.58299999999999996 | Y4: 0.34899999999999998 | Z4: 117 | AA4: 0.59 | AB4: 9.9499999999999991e-002 | AC4: 8.9200000000000002e-002 | AD4: 9.0999999999999998e-002 | AE4: 8.6800000000000002e-002 | AF4: =AD4/T4 -> 2.724550898203593e-002 | AG4: 89.77 | AH4: 99.63 | AI4: 0.15 | AJ4: AAA | AK4: 5.0599999999999999e-002 | AL4: =H4+100*O4 -> 110.64099999999999 | AM4: 97.8 | AN4: 6 | AO4: -1.8 | AP4: 1 | AQ4: 2.3e-002 | AR4: 50 | AS4: 本钢转债!
A5: 166 | B5: 128100 | C5: 搜特转债! | D5: 2503 | E5: 搜于特 | F5: 服装纺织 | G5: 服装行业 | H5: 77.912 | I5: 1.4999999999999999e-002 | J5: -1.32e-002 | K5: 1.79 | L5: 1.1299999999999999e-002 | M5: 117.3 | N5: 2.9 | O5: 0.26200000000000001 | P5: 61.72 | Q5: 转股中 | R5: 5年14天 | S5: 3年14天 | T5: =3+14/365 -> 3.0383561643835617 | U5: 8 | V5: 33 | W5: 5.2000000000000005e-002 | X5: 0.14499999999999999 | Y5: 8.900000000000001e-002 | Z5: 55 | AA5: 1 | AB5: 8.6699999999999999e-002 | AC5: 7.9699999999999993e-002 | AD5: 9.4899999999999998e-002 | AE5: 9.2100000000000015e-002 | AF5: =AD5/T5 -> 3.1233994589720468e-002 | AG5: 90.13 | AH5: 94.15 | AI5: 0.16 | AJ5: AA | AK5: 4.5599999999999995e-002 | AL5: =H5+100*O5 -> 104.11200000000001 | AM5: 94.1 | AN5: 2 | AO5: -0.1 | AP5: 2 | AQ5: -2.7000000000000003e-002 | AR5: 51 | AS5: 搜特转债!
A6: 284 | B6: 128044 | C6: 岭南转债! | D6: 2717 | E6: 岭南股份 | F6: 城市公用 | G6: 生态环境 | H6: 85.17 | I6: -4.0000000000000002e-004 | J6: 5.0000000000000001e-004 | K6: 3.01 | L6: 6.7000000000000002e-003 | M6: 111.3 | N6: 5.91 | O6: 0.67200000000000004 | P6: 50.93 | Q6: 转股中 | R6: 3.46年 | S6: 1.46年 | T6: 1.46 | U6: 6.59 | V6: 3.3 | W6: 6.0000000000000001e-003 | X6: 0.14300000000000002 | Y6: 7.2999999999999995e-002 | Z6: 46 | AA6: 0.93 | AB6: 8.2100000000000006e-002 | AC6: 7.5300000000000006e-002 | AD6: 0.124 | AE6: 0.12 | AF6: =AD6/T6 -> 8.4931506849315067e-002 | AG6: 95.88 | AH6: 96.14 | AI6: 0.03 | AJ6: AA | AK6: 4.41e-002 | AL6: =H6+100*O6 -> 152.37 | AM6: 119.4 | AN6: 137 | AO6: 23.3 | AP6: 82 | AQ6: 2.7000000000000003e-002 | AR6: 38 | AS6: 岭南转债!
A7: 233 | B7: 123028 | C7: 清水转债! | D7: 300437 | E7: 清水源 | F7: 城市公用 | G7: 三废处理 | H7: 89.249 | I7: -2.8000000000000004e-003 | J7: 6.1999999999999998e-003 | K7: 8.06 | L7: 1.26e-002 | M7: 121.8 | N7: 11.84 | O7: 0.311 | P7: 68.07 | Q7: 转股中 | R7: 4.31年 | S7: 2.31年 | T7: 2.31 | U7: 4.56 | V7: 11 | W7: 2.7000000000000003e-002 | X7: 0.25600000000000001 | Y7: 0.17399999999999999 | Z7: 18 | AA7: 1.14 | AB7: 7.7100000000000002e-002 | AC7: 6.7400000000000002e-002 | AD7: 6.7799999999999999e-002 | AE7: 6.3600000000000004e-002 | AF7: =AD7/T7 -> 2.9350649350649349e-002 | AG7: 89.79 | AH7: 93.54 | AI7: 0.27 | AJ7: AA- | AK7: 6.5099999999999991e-002 | AL7: =H7+100*O7 -> 120.34899999999999 | AM7: 110.4 | AN7: 54 | AO7: 16.9 | AP7: 37 | AQ7: 4.2000000000000003e-002 | AR7: 53 | AS7: 清水转债!
A8: 338 | B8: 127003 | C8: 海印转债! | D8: 861 | E8: 海印股份 | F8: 商业零售 | G8: 商场 | H8: 101.81 | I8: 2.2000000000000001e-003 | J8: -2.8000000000000004e-003 | K8: 2.22 | L8: -1.77e-002 | M8: 111.8 | N8: 3 | O8: 0.376 | P8: 74 | Q8: 转股中 | R8: 1.28年 | S8: 回售内 | U8: 6.74 | V8: 8.1 | W8: 1.2e-002 | X8: 0.13100000000000001 | Y8: 9.6999999999999989e-002 | Z8: 52 | AA8: 1.31 | AB8: 7.690000000000001e-002 | AC8: 5.8700000000000002e-002 | AD8: 回售内 | AE8: 回售内 | AG8: 100.3 | AH8: 106.14 | AI8: 0.04 | AJ8: AA | AK8: 4.2000000000000003e-002 | AL8: =H8+100*O8 -> 139.41 | AM8: 129.6 | AN8: 219 | AO8: 23.5 | AP8: 86 | AQ8: 6.0000000000000001e-003 | AR8: 77 | AS8: 海印转债!
A9: 291 | B9: 123011 | C9: 德尔转债! | D9: 300473 | E9: 德尔股份 | F9: 汽车 | G9: 零部件制 | H9: 91 | I9: 0. | J9: 1.1000000000000001e-003 | K9: 17.79 | L9: 1.95e-002 | M9: 116.3 | N9: 34.54 | O9: 0.76700000000000002 | P9: 51.51 | Q9: 转股中 | R9: 3.39年 | S9: 1.39年 | T9: 1.39 | U9: 2.51 | V9: 2.2 | W9: 1.e-002 | X9: 0.124 | Y9: 6.4000000000000001e-002 | Z9: 20 | AA9: 0.9 | AB9: 7.6700000000000004e-002 | AC9: 6.7199999999999996e-002 | AD9: 8.2299999999999998e-002 | AE9: 7.8299999999999995e-002 | AF9: =AD9/T9 -> 5.9208633093525184e-002 | AG9: 93.28 | AH9: 94.33 | AI9: 0.06 | AJ9: AA- | AK9: 6.5099999999999991e-002 | AL9: =H9+100*O9 -> 167.69999999999999 | AM9: 130.5 | AN9: 223 | AO9: 36.2 | AP9: 211 | AQ9: 2.2000000000000002e-002 | AR9: 42 | AS9: 德尔转债!
A10: 123 | B10: 113589 | C10: 天创转债! | D10: 603608 | E10: 天创时尚 | F10: 服装纺织 | G10: 鞋服行业 | H10: 78.8 | I10: -2.5000000000000001e-003 | J10: 1.1999999999999999e-003 | K10: 5.89 | L10: -2.3199999999999998e-002 | M10: 115.3 | N10: 12.44 | O10: 0.66400000000000003 | P10: 47.35 | Q10: 转股中 | R10: 5.32年 | S10: 3.32年 | T10: 3.32 | U10: 6 | V10: 17 | W10: 3.5000000000000003e-002 | X10: 0.23800000000000002 | Y10: 0.11199999999999999 | Z10: 25 | AA10: 1.19 | AB10: 7.5800000000000006e-002 | AC10: 7.0000000000000007e-002 | AD10: 8.3100000000000007e-002 | AE10: 8.0600000000000005e-002 | AF10: =AD10/T10 -> 2.5030120481927716e-002 | AG10: 88.99 | AH10: 91.39 | AI10: 0.06 | AJ10: AA | AK10: 4.5599999999999995e-002 | AL10: =H10+100*O10 -> 145.19999999999999 | AM10: 110.3 | AN10: 51 | AO10: 18.9 | AP10: 47 | AQ10: 6.0999999999999999e-002 | AR10: 20 | AS10: 天创转债!
A11: 171 | B11: 113569 | C11: 科达转债! | D11: 603660 | E11: 苏州科达 | F11: 通信互联 | G11: 物联网 | H11: 85.62 | I11: 4.0000000000000002e-004 | J11: -5.0000000000000001e-004 | K11: 6.89 | L11: -1.4000000000000002e-003 | M11: 120.7 | N11: 14.84 | O11: 0.84400000000000008 | P11: 46.43 | Q11: 转股中 | R11: 5年11天 | S11: 3年11天 | T11: =3+11/365 -> 3.0301369863013701 | U11: 5.16 | V11: 1.7 | W11: 4.0000000000000001e-003 | X11: 0.14999999999999999 | Y11: 7.0000000000000007e-002 | Z11: 34 | AA11: 2.02 | AB11: 7.2400000000000006e-002 | AC11: 6.4500000000000002e-002 | AD11: 6.3700000000000007e-002 | AE11: 6.0899999999999996e-002 | AF11: =AD11/T11 -> 2.1022151898734177e-002 | AG11: 84.89 | AH11: 87.93 | AI11: 0.07 | AJ11: AA- | AK11: 6.6600000000000006e-002 | AL11: =H11+100*O11 -> 170.02000000000001 | AM11: 124.8 | AN11: 183 | AO11: 36.9 | AP11: 218 | AQ11: 1.1000000000000001e-002 | AR11: 25 | AS11: 科达转债!
A12: 84 | B12: 110072 | C12: 广汇转债! | D12: 600297 | E12: 广汇汽车 | F12: 汽车 | G12: 分销、售 | H12: 78.56 | I12: 1.7100000000000001e-002 | J12: -1.6200000000000003e-002 | K12: 2.63 | L12: 3.8e-003 | M12: 114.5 | N12: 4.03 | O12: 0.20399999999999999 | P12: 65.26 | Q12: 转股中 | R12: 5.48年 | S12: 3.48年 | T12: 3.48 | U12: 33.7 | V12: 100 | W12: 3.7999999999999999e-002 | X12: 0.158 | Y12: 0.10300000000000001 | Z12: 213 | AA12: 0.54 | AB12: 7.2400000000000006e-002 | AC12: 6.7099999999999993e-002 | AD12: 7.7699999999999991e-002 | AE12: 7.5899999999999995e-002 | AF12: =AD12/T12 -> 2.2327586206896548e-002 | AG12: 88.26 | AH12: 90.97 | AI12: 0.22 | AJ12: AA+ | AK12: 4.36e-002 | AL12: =H12+100*O12 -> 98.960000000000008 | AM12: 91.9 | AN12: 1 | AO12: 0.9 | AP12: 3 | AQ12: 4.2999999999999997e-002 | AR12: 39 | AS12: 广汇转债!
A13: 248 | B13: 128063 | C13: 未来转债! | D13: 2631 | E13: 德尔未来 | F13: 其他 | G13: 家居用品 | H13: 97.233 | I13: -1.2999999999999999e-003 | J13: -1.e-004 | K13: 5.94 | L13: -6.7000000000000002e-003 | M13: 128.2 | N13: 8.63 | O13: 0.41299999999999998 | P13: 68.83 | Q13: 转股中 | R13: 4年36天 | S13: 3年36天 | T13: =3+36/365 -> 3.0986301369863014 | U13: 6.3 | V13: 0.8 | W13: 1.e-003 | X13: 0.159 | Y13: 0.11 | Z13: 40 | AA13: 2.25 | AB13: 7.22e-002 | AC13: 5.9699999999999996e-002 | AD13: 3.61e-002 | AE13: 3.0699999999999998e-002 | AG13: 89.08 | AH13: 99.81 | AI13: 0.21 | AJ13: AA- | AK13: 6.5099999999999991e-002 | AL13: =H13+100*O13 -> 138.53300000000002 | AM13: 125.6 | AN13: 192 | AO13: 25.8 | AP13: 111 | AQ13: -1.7000000000000001e-002 | AR13: 34 | AS13: 未来转债!
A14: 110 | B14: 127019 | C14: 国城转债! | D14: 688 | E14: 国城矿业 | F14: 有色金属 | G14: 锌铅镍锡 | H14: 80.003 | I14: 6.9999999999999993e-003 | J14: -6.7000000000000002e-003 | K14: 9.3 | L14: 6.5000000000000006e-003 | M14: 115.1 | N14: 21.07 | O14: 0.81299999999999994 | P14: 44.14 | Q14: 转股中 | R14: 5.38年 | S14: 3.38年 | T14: 3.38 | U14: 8.5 | V14: 5.7 | W14: 8.0000000000000002e-003 | X14: 8.0000000000000002e-002 | Y14: 3.5000000000000003e-002 | Z14: 106 | AA14: 4.78 | AB14: 7.1399999999999991e-002 | AC14: 6.5700000000000008e-002 | AD14: 7.6299999999999993e-002 | AE14: 7.400000000000001e-002 | AF14: =AD14/T14 -> 2.257396449704142e-002 | AG14: 88.57 | AH14: 90.96 | AI14: 0.04 | AJ14: AA | AK14: 4.5599999999999995e-002 | AL14: =H14+100*O14 -> 161.303 | AM14: 115.9 | AN14: 97 | AO14: 24.9 | AP14: 102 | AQ14: 6.2e-002 | AR14: 36 | AS14: 国城转债!
A15: 103 | B15: 113595 | C15: 花王转债! | D15: 603007 | E15: 花王股份 | F15: 城市公用 | G15: 生态环境 | H15: 87.92 | I15: -1.78e-002 | J15: 2.69e-002 | K15: 5.46 | L15: 2.06e-002 | M15: 125.3 | N15: 6.93 | O15: 0.11599999999999999 | P15: 78.79 | Q15: 转股中 | R15: 5.40年 | S15: 3.40年 | T15: 3.4 | U15: 3.3 | V15: 33 | W15: 0.115 | X15: 0.17999999999999999 | Y15: 0.14199999999999999 | Z15: 18 | AA15: 1.65 | AB15: 6.9500000000000006e-002 | AC15: 6.0899999999999996e-002 | AD15: 4.9500000000000002e-002 | AE15: 4.7e-002 | AG15: 83.07 | AH15: 89.17 | AI15: 0.44 | AJ15: AA- | AK15: 6.6600000000000006e-002 | AL15: =H15+100*O15 -> 99.519999999999996 | AM15: 97.1 | AN15: 3 | AO15: 7.9 | AP15: 6 | AQ15: 9.4e-002 | AR15: 37 | AS15: 花王转债!
A16: 302 | B16: 128037 | C16: 岩土转债! | D16: 2542 | E16: 中化岩土 | F16: 建筑 | G16: 建筑工程 | H16: 92.072 | I16: -2.5000000000000001e-003 | J16: 2.5000000000000001e-003 | K16: 2.72 | L16: -3.7000000000000002e-003 | M16: 112.3 | N16: 7.99 | O16: 1.7 | P16: 34.04 | Q16: 转股中 | R16: 3年17天 | S16: 1年17天 | T16: =1+17/365 -> 1.0465753424657533 | U16: 5.99 | V16: 1.3 | W16: 2.e-003 | X16: 0.122 | Y16: 4.2000000000000003e-002 | Z16: 49 | AA16: 1.21 | AB16: 6.9000000000000006e-002 | AC16: 6.08e-002 | AD16: 9.6300000000000011e-002 | AE16: 9.11e-002 | AF16: =AD16/T16 -> 9.2014397905759174e-002 | AG16: 97.62 | AH16: 98.76 | AI16: 0 | AJ16: AA | AK16: 4.41e-002 | AL16: =H16+100*O16 -> 262.072 | AM16: 150.1 | AN16: 295 | AO16: 51.3 | AP16: 277 | AQ16: 1.2e-002 | AR16: 49 | AS16: 岩土转债!
A17: 253 | B17: 113530 | C17: 大丰转债! | D17: 603081 | E17: 大丰实业 | F17: 建筑 | G17: 装饰工程 | H17: 94.09 | I17: 4.8999999999999998e-003 | J17: -4.5000000000000005e-003 | K17: 11.02 | L17: 3.5999999999999999e-003 | M17: 121.6 | N17: 16.64 | O17: 0.42100000000000004 | P17: 66.23 | Q17: 转股中 | R17: 4年29天 | S17: 2年29天 | T17: =2+29/365 -> 2.0794520547945208 | U17: 6.3 | V17: 1.1 | W17: 2.e-003 | X17: 0.14199999999999999 | Y17: 9.4e-002 | Z17: 44 | AA17: 2.16 | AB17: 6.6500000000000004e-002 | AC17: 5.6600000000000004e-002 | AD17: 4.4000000000000004e-002 | AE17: 4.07e-002 | AG17: 94.06 | AH17: 102.38 | AI17: 0.12 | AJ17: AA | AK17: 4.41e-002 | AL17: =H17+100*O17 -> 136.19 | AM17: 122 | AN17: 159 | AO17: 19.6 | AP17: 52 | AQ17: 1.8000000000000002e-002 | AR17: 34 | AS17: 大丰转债!
A18: 282 | B18: 113519 | C18: 长久转债! | D18: 603569 | E18: 长久物流 | F18: 交通运输 | G18: 物流业 | H18: 94.57 | I18: 1.1599999999999999e-002 | J18: -1.03e-002 | K18: 6.94 | L18: 1.46e-002 | M18: 119.3 | N18: 11.15 | O18: 0.51900000000000002 | P18: 62.24 | Q18: 转股中 | R18: 3.70年 | S18: 1.70年 | T18: 1.7 | U18: 6.97 | V18: 1.5 | W18: 2.e-003 | X18: 0.17899999999999999 | Y18: 0.11199999999999999 | Z18: 39 | AA18: 1.83 | AB18: 6.6100000000000006e-002 | AC18: 5.6299999999999996e-002 | AD18: 4.6199999999999998e-002 | AE18: 4.2999999999999997e-002 | AG18: 94.92 | AH18: 102 | AI18: 0.08 | AJ18: AA | AK18: 4.41e-002 | AL18: =H18+100*O18 -> 146.47 | AM18: 126.9 | AN18: 204 | AO18: 24.9 | AP18: 101 | AQ18: 3.3000000000000002e-002 | AR18: 20 | AS18: 长久转债!
A19: 238 | B19: 113535 | C19: 大业转债! | D19: 603278 | E19: 大业股份 | F19: 汽车 | G19: 零部件制 | H19: 92.48 | I19: 8.9999999999999998e-004 | J19: 5.0000000000000001e-004 | K19: 7.79 | L19: 1.43e-002 | M19: 113.1 | N19: 12.4 | O19: 0.47200000000000003 | P19: 62.82 | Q19: 转股中 | R19: 3.20年 | S19: 1.20年 | T19: 1.2 | U19: 5 | V19: 0.8 | W19: 2.e-003 | X19: 0.221 | Y19: 0.13900000000000001 | Z19: 23 | AA19: 1.38 | AB19: 6.6000000000000003e-002 | AC19: 5.79e-002 | AD19: 7.3800000000000004e-002 | AE19: 7.0800000000000002e-002 | AF19: =AD19/T19 -> 6.1500000000000006e-002 | AG19: 96.06 | AH19: 98.72 | AI19: 0.09 | AJ19: AA | AK19: 4.41e-002 | AL19: =H19+100*O19 -> 139.68000000000001 | AM19: 122.1 | AN19: 162 | AO19: 23.4 | AP19: 84 | AQ19: 3.1e-002 | AR19: 50 | AS19: 大业转债!
A20: 85 | B20: 113600 | C20: 新星转债! | D20: 603978 | E20: 深圳新星 | F20: 有色金属 | G20: 有色行业 | H20: 90.22 | I20: 7.000000000000001e-004 | J20: -2.e-003 | K20: 17.84 | L20: -3.4000000000000002e-003 | M20: 126 | N20: 23.85 | O20: 0.20600000000000002 | P20: 74.8 | Q20: 转股中 | R20: 5.46年 | S20: 3.46年 | T20: 3.46 | U20: 5.95 | V20: 3.9 | W20: 6.9999999999999993e-003 | X20: 0.20800000000000002 | Y20: 0.156 | Z20: 29 | AA20: 1.87 | AB20: 6.4399999999999999e-002 | AC20: 5.5899999999999998e-002 | AD20: 4.0199999999999993e-002 | AE20: 3.7900000000000003e-002 | AG20: 82.45 | AH20: 89.24 | AI20: 0.39 | AJ20: AA- | AK20: 6.6600000000000006e-002 | AL20: =H20+100*O20 -> 110.81999999999999 | AM20: 105.6 | AN20: 22 | AO20: 16.4 | AP20: 34 | AQ20: 8.5999999999999993e-002 | AR20: 16 | AS20: 新星转债!
A21: 321 | B21: 128023 | C21: 亚太转债! | D21: 2284 | E21: 亚太股份 | F21: 汽车 | G21: 零部件制 | H21: 94 | I21: 1.1000000000000001e-003 | J21: -8.9999999999999998e-004 | K21: 5.35 | L21: 9.3999999999999986e-003 | M21: 111.3 | N21: 10.34 | O21: 0.81700000000000006 | P21: 51.74 | Q21: 转股中 | R21: 2.77年 | S21: 0.77年 | T21: 0.77 | U21: 9.99 | V21: 3 | W21: 3.0000000000000001e-003 | X21: 0.253 | Y21: 0.13100000000000001 | Z21: 39 | AA21: 1.63 | AB21: 6.4000000000000001e-002 | AC21: 5.5800000000000002e-002 | AD21: 8.9099999999999999e-002 | AE21: 8.4900000000000003e-002 | AF21: =AD21/T21 -> 0.11571428571428571 | AG21: 97.96 | AH21: 99.49 | AI21: 0.02 | AJ21: AA | AK21: 4.2000000000000003e-002 | AL21: =H21+100*O21 -> 175.69999999999999 | AM21: 136.3 | AN21: 254 | AO21: 36.8 | AP21: 216 | AQ21: 1.6e-002 | AR21: 68 | AS21: 亚太转债!
A22: 95 | B22: 113596 | C22: 城地转债! | D22: 603887 | E22: 城地香江 | F22: 通信互联 | G22: 通信设备 | H22: 81.93 | I22: 1.5e-003 | J22: 5.0000000000000001e-004 | K22: 15.8 | L22: 1.2800000000000001e-002 | M22: 113.5 | N22: 29.21 | O22: 0.51500000000000001 | P22: 54.09 | Q22: 转股中 | R22: 5.42年 | S22: 3.42年 | T22: 3.42 | U22: 12 | V22: 7.9 | W22: 8.0000000000000002e-003 | X22: 0.20199999999999999 | Y22: 0.109 | Z22: 59 | AA22: 1.64 | AB22: 6.3399999999999998e-002 | AC22: 5.8400000000000001e-002 | AD22: 6.9099999999999995e-002 | AE22: 6.6699999999999995e-002 | AF22: =AD22/T22 -> 2.0204678362573097e-002 | AG22: 82.62 | AH22: 80.65 | AI22: 0.16 | AJ22: AA- | AK22: 6.6600000000000006e-002 | AL22: =H22+100*O22 -> 133.43000000000001 | AM22: 109.8 | AN22: 47 | AO22: 27.2 | AP22: 126 | AQ22: 4.0999999999999995e-002 | AR22: 16 | AS22: 城地转债!
A23: 332 | B23: 128015 | C23: 久其转债! | D23: 2279 | E23: 久其软件 | F23: 计算机及 | G23: 软件开发 | H23: 96.637 | I23: 2.2000000000000001e-003 | J23: -2.2000000000000001e-003 | K23: 4.5 | L23: 0. | M23: 110.8 | N23: 9.48 | O23: 1.04 | P23: 47.47 | Q23: 转股中 | R23: 2.28年 | S23: 0.28年 | T23: 0.28 | U23: 7.8 | V23: 9.6 | W23: 1.3000000000000001e-002 | X23: 0.24399999999999999 | Y23: 0.11599999999999999 | Z23: 32 | AA23: 4.54 | AB23: 6.2899999999999998e-002 | AC23: 5.3499999999999999e-002 | AD23: 0.11800000000000001 | AE23: 0.11 | AF23: =AD23/T23 -> 0.42142857142857143 | AG23: 98.38 | AH23: 94.42 | AI23: 0 | AJ23: A+ | AK23: 7.400000000000001e-002 | AL23: =H23+100*O23 -> 200.637 | AM23: 145.8 | AN23: 286 | AO23: 47.4 | AP23: 264 | AQ23: 2.9999999999999999e-002 | AR23: 66 | AS23: 久其转债!
A24: 265 | B24: 113528 | C24: 长城转债! | D24: 603897 | E24: 长城科技 | F24: 机械装备 | G24: 专用设备 | H24: 92.98 | I24: 6.3e-003 | J24: -3.5999999999999999e-003 | K24: 16.9 | L24: 9.0000000000000011e-003 | M24: 117.6 | N24: 23.45 | O24: 0.28999999999999998 | P24: 72.07 | Q24: 转股中 | R24: 4年3.6天 | S24: 2年3.6天 | T24: =2+3.6/365 -> 2.00986301369863 | U24: 6.34 | V24: 4.6 | W24: 8.0000000000000002e-003 | X24: 0.20999999999999999 | Y24: 0.152 | Z24: 30 | AA24: 1.65 | AB24: 6.2100000000000002e-002 | AC24: 5.3499999999999999e-002 | AD24: 5.3399999999999996e-002 | AE24: 4.9500000000000002e-002 | AG24: 90.81 | AH24: 91.96 | AI24: 0.3 | AJ24: AA- | AK24: 6.5099999999999991e-002 | AL24: =H24+100*O24 -> 121.98 | AM24: 113.9 | AN24: 77 | AO24: 21.9 | AP24: 66 | AQ24: 4.0999999999999995e-002 | AR24: 44 | AS24: 长城转债!
A25: 312 | B25: 113017 | C25: 吉视转债! | D25: 601929 | E25: 吉视传媒 | F25: 传媒娱乐 | G25: 影视娱乐 | H25: 91.99 | I25: 3.7000000000000002e-003 | J25: -3.7000000000000002e-003 | K25: 1.81 | L25: 0. | M25: 108.8 | N25: 2.95 | O25: 0.499 | P25: 61.36 | Q25: 转股中 | R25: 2.83年 | S25: 0.83年 | T25: 0.83 | U25: 15.6 | V25: 4.3 | W25: 3.0000000000000001e-003 | X25: 0.27699999999999997 | Y25: 0.17000000000000001 | Z25: 56 | AA25: 0.85 | AB25: 6.1900000000000004e-002 | AC25: 5.5599999999999997e-002 | AD25: 0.10400000000000001 | AE25: 0.10099999999999999 | AF25: =AD25/T25 -> 0.12530120481927712 | AG25: 97.65 | AH25: 97.51 | AI25: 0.04 | AJ25: AA+ | AK25: 4.0000000000000001e-002 | AL25: =H25+100*O25 -> 141.88999999999999 | AM25: 122.6 | AN25: 168 | AO25: 25 | AP25: 104 | AQ25: 3.9e-002 | AR25: 61 | AS25: 吉视转债!
A26: 197 | B26: 128087 | C26: 孚日转债! | D26: 2083 | E26: 孚日股份 | F26: 服装纺织 | G26: 家纺 | H26: 85.079 | I26: 1.1999999999999999e-003 | J26: -3.3e-003 | K26: 4.29 | L26: -9.1999999999999998e-003 | M26: 112.9 | N26: 6.3 | O26: 0.249 | P26: 68.1 | Q26: 转股中 | R26: 4.81年 | S26: 2.81年 | T26: 2.81 | U26: 6.5 | V26: 10 | W26: 1.8000000000000002e-002 | X26: 0.16699999999999998 | Y26: 0.114 | Z26: 39 | AA26: 1.04 | AB26: 6.1900000000000004e-002 | AC26: 5.6500000000000002e-002 | AD26: 6.8499999999999991e-002 | AE26: 6.6000000000000003e-002 | AF26: =AD26/T26 -> 2.4377224199288252e-002 | AG26: 91.06 | AH26: 92.12 | AI26: 0.22 | AJ26: AA | AK26: 4.41e-002 | AL26: =H26+100*O26 -> 109.97899999999998 | AM26: 102.1 | AN26: 11 | AO26: 9.9 | AP26: 10 | AQ26: 5.9000000000000004e-002 | AR26: 54 | AS26: 孚日转债!
A27: 172 | B27: 113568 | C27: 新春转债! | D27: 603667 | E27: 五洲新春 | F27: 机械装备 | G27: 通用设备 | H27: 93.02 | I27: 2.9999999999999997e-004 | J27: 7.0999999999999995e-003 | K27: 7.13 | L27: 1.7100000000000001e-002 | M27: 124.8 | N27: 8.91 | O27: 0.16200000000000001 | P27: 80.02 | Q27: 转股中 | R27: 5年8天 | S27: 3年8天 | T27: =3+8/365 -> 3.021917808219178 | U27: 3.3 | V27: 1.4 | W27: 4.0000000000000001e-003 | X27: 0.158 | Y27: 0.127 | Z27: 21 | AA27: 1.21 | AB27: 6.1900000000000004e-002 | AC27: 5.2900000000000003e-002 | AD27: 3.8399999999999997e-002 | AE27: 3.5299999999999998e-002 | AG27: 85.52 | AH27: 91.06 | AI27: 0.43 | AJ27: AA- | AK27: 6.6600000000000006e-002 | AL27: =H27+100*O27 -> 109.22 | AM27: 106 | AN27: 24 | AO27: 15 | AP27: 26 | AQ27: 3.3000000000000002e-002 | AR27: 50 | AS27: 新春转债!
A28: 256 | B28: 123023 | C28: 迪森转债! | D28: 300335 | E28: 迪森股份 | F28: 能源电力 | G28: 电力供应 | H28: 90.76 | I28: 8.3999999999999995e-003 | J28: -3.9000000000000003e-003 | K28: 4.69 | L28: 2.63e-002 | M28: 114.9 | N28: 7.04 | O28: 0.36200000000000004 | P28: 66.62 | Q28: 转股中 | R28: 4年22天 | S28: 3年22天 | T28: =3+22/365 -> 3.0602739726027397 | U28: 5.29 | V28: 6.2 | W28: 1.3000000000000001e-002 | X28: 0.30199999999999999 | Y28: 0.20100000000000001 | Z28: 17 | AA28: 1.26 | AB28: 6.13e-002 | AC28: 5.4000000000000006e-002 | AD28: 4.7800000000000002e-002 | AE28: 4.4299999999999999e-002 | AG28: 91.78 | AH28: 96.81 | AI28: 0.17 | AJ28: AA | AK28: 4.41e-002 | AL28: =H28+100*O28 -> 126.96000000000001 | AM28: 114.9 | AN28: 87 | AO28: 18.1 | AP28: 39 | AQ28: 4.9000000000000002e-002 | AR28: 55 | AS28: 迪森转债!
A29: 242 | B29: 127013 | C29: 创维转债! | D29: 810 | E29: 创维数字 | F29: 电子 | G29: 电子产品 | H29: 92.84 | I29: -8.1000000000000013e-003 | J29: 8.199999999999999e-003 | K29: 7.41 | L29: 1.4000000000000002e-003 | M29: 117.9 | N29: 11.39 | O29: 0.42700000000000005 | P29: 65.06 | Q29: 转股中 | R29: 4年48天 | S29: 2年48天 | T29: =2+48/365 -> 2.1315068493150684 | U29: 9.78 | V29: 7.5 | W29: 8.0000000000000002e-003 | X29: 0.124 | Y29: 8.1000000000000003e-002 | Z29: 79 | AA29: 2.03 | AB29: 6.0899999999999996e-002 | AC29: 5.2600000000000001e-002 | AD29: 4.8600000000000004e-002 | AE29: 4.5400000000000003e-002 | AG29: 93.75 | AH29: 99.02 | AI29: 0.12 | AJ29: AA | AK29: 4.41e-002 | AL29: =H29+100*O29 -> 135.54000000000002 | AM29: 120.6 | AN29: 150 | AO29: 21.6 | AP29: 65 | AQ29: 1.4999999999999999e-002 | AR29: 25 | AS29: 创维转债!
A30: 239 | B30: 128066 | C30: 亚泰转债! | D30: 2811 | E30: 郑中设计 | F30: 建筑 | G30: 装饰工程 | H30: 92.666 | I30: -2.9900000000000003e-002 | J30: -2.2000000000000001e-003 | K30: 8.02 | L30: -7.3899999999999993e-002 | M30: 117.5 | N30: 9.67 | O30: 0.11699999999999999 | P30: 82.94 | Q30: 转股中 | R30: 4年50天 | S30: 2年50天 | T30: =2+50/365 -> 2.1369863013698631 | U30: 4.8 | V30: 23 | W30: 5.0999999999999997e-002 | X30: 0.222 | Y30: 0.184 | Z30: 22 | AA30: 1.47 | AB30: 6.0700000000000004e-002 | AC30: 5.2499999999999998e-002 | AD30: 5.1399999999999994e-002 | AE30: 4.7800000000000002e-002 | AG30: 89.99 | AH30: 91.13 | AI30: 0.43 | AJ30: AA- | AK30: 6.5099999999999991e-002 | AL30: =H30+100*O30 -> 104.366 | AM30: 102.4 | AN30: 12 | AO30: 11.3 | AP30: 13 | AQ30: 4.2999999999999997e-002 | AR30: 62 | AS30: 亚泰转债!
A31: 223 | B31: 128073 | C31: 哈尔转债! | D31: 2615 | E31: 哈尔斯 | F31: 其他 | G31: 家居用品 | H31: 94.202 | I31: 4.0999999999999995e-003 | J31: -2.2000000000000001e-003 | K31: 4.04 | L31: 7.4999999999999997e-003 | M31: 115.3 | N31: 5.7 | O31: 0.32899999999999996 | P31: 70.88 | Q31: 转股中 | R31: 3.49年 | S31: 1.49年 | T31: 1.49 | U31: 2.99 | V31: 8.8 | W31: 3.1e-002 | X31: 0.17899999999999999 | Y31: 0.127 | Z31: 17 | AA31: 2.08 | AB31: 6.0599999999999994e-002 | AC31: 5.2199999999999996e-002 | AD31: 5.0000000000000003e-002 | AE31: 4.7300000000000002e-002 | AG31: 92.02 | AH31: 92.85 | AI31: 0.25 | AJ31: AA- | AK31: 6.5099999999999991e-002 | AL31: =H31+100*O31 -> 127.102 | AM31: 117.5 | AN31: 114 | AO31: 24.7 | AP31: 100 | AQ31: 4.2000000000000003e-002 | AR31: 41 | AS31: 哈尔转债!
A32: 240 | B32: 110058 | C32: 永鼎转债! | D32: 600105 | E32: 永鼎股份 | F32: 通信互联 | G32: 通信设备 | H32: 90.63 | I32: 8.5000000000000006e-003 | J32: -3.4000000000000002e-003 | K32: 3.25 | L32: 3.5000000000000003e-002 | M32: 114.9 | N32: 5.04 | O32: 0.40500000000000003 | P32: 64.48 | Q32: 转股中 | R32: 4年49天 | S32: 2年49天 | T32: =2+49/365 -> 2.1342465753424658 | U32: 2.61 | V32: 23 | W32: 9.8000000000000004e-002 | X32: 5.7999999999999996e-002 | Y32: 3.7999999999999999e-002 | Z32: 45 | AA32: 1.59 | AB32: 6.0499999999999998e-002 | AC32: 5.3399999999999996e-002 | AD32: 5.9699999999999996e-002 | AE32: 5.6500000000000002e-002 | AF32: =AD32/T32 -> 2.7972400513478816e-002 | AG32: 93.74 | AH32: 96.5 | AI32: 0.15 | AJ32: AA | AK32: 4.41e-002 | AL32: =H32+100*O32 -> 131.13 | AM32: 116.8 | AN32: 107 | AO32: 20.3 | AP32: 57 | AQ32: 8.5000000000000006e-002 | AR32: 51 | AS32: 永鼎转债!
A33: 116 | B33: 128118 | C33: 瀛通转债! | D33: 2861 | E33: 瀛通通讯 | F33: 电子 | G33: 电子产品 | H33: 90.003 | I33: -1.01e-002 | J33: 1.34e-002 | K33: 17.3 | L33: 1.23e-002 | M33: 122.1 | N33: 27.53 | O33: 0.43200000000000005 | P33: 62.84 | Q33: 转股中 | R33: 5.35年 | S33: 3.35年 | T33: 3.35 | U33: 3 | V33: 1.3 | W33: 5.0000000000000001e-003 | X33: 0.14199999999999999 | Y33: 8.900000000000001e-002 | Z33: 21 | AA33: 1.98 | AB33: 6.0199999999999997e-002 | AC33: 5.2499999999999998e-002 | AD33: 4.4299999999999999e-002 | AE33: 4.1500000000000002e-002 | AG33: 83.64 | AH33: 87.24 | AI33: 0.27 | AJ33: AA- | AK33: 6.6600000000000006e-002 | AL33: =H33+100*O33 -> 133.203 | AM33: 117.2 | AN33: 110 | AO33: 29.9 | AP33: 155 | AQ33: 2.e-003 | AR33: 12 | AS33: 瀛通转债!
A34: 220 | B34: 128074 | C34: 游族转债!! | D34: 2174 | E34: 游族网络 | F34: 通信互联 | G34: 互联网 | H34: 92.7 | I34: -1.3000000000000001e-002 | J34: 1.2199999999999999e-002 | K34: 10.73 | L34: -4.5999999999999999e-003 | M34: 119.9 | N34: 16.97 | O34: 0.46600000000000003 | P34: 63.23 | Q34: 转股中 | R34: 4.57年 | S34: 2.57年 | T34: 2.57 | U34: 6.83 | V34: 16 | W34: 2.5000000000000001e-002 | X34: 7.0000000000000007e-002 | Y34: 4.4000000000000004e-002 | Z34: 98 | AA34: 1.74 | AB34: 5.91e-002 | AC34: 5.0900000000000001e-002 | AD34: 4.1100000000000005e-002 | AE34: 3.85e-002 | AG34: 91.98 | AH34: 94.07 | AI34: 0.16 | AJ34: AA | AK34: 4.41e-002 | AL34: =H34+100*O34 -> 139.30000000000001 | AM34: 122.2 | AN34: 164 | AO34: 28.1 | AP34: 137 | AQ34: -4.4999999999999998e-002 | AR34: 25 | AS34: 游族转债!!
A35: 19 | B35: 123088 | C35: 威唐转债! | D35: 300707 | E35: 威唐工业 | F35: 汽车 | G35: 零部件制 | H35: 88.504 | I35: -1.5e-003 | J35: 6.6e-003 | K35: 13.58 | L35: 1.2699999999999999e-002 | M35: 121.6 | N35: 20.75 | O35: 0.35200000000000004 | P35: 65.45 | Q35: 3月25天 | R35: 5.80年 | S35: 3.80年 | T35: 3.8 | U35: 3.01 | V35: 4.5 | W35: 1.7000000000000001e-002 | X35: 0.14099999999999999 | Y35: 9.1999999999999998e-002 | Z35: 21 | AA35: 3.14 | AB35: 5.7599999999999998e-002 | AC35: 5.0700000000000002e-002 | AD35: 4.3499999999999997e-002 | AE35: 4.1100000000000005e-002 | AG35: 78.04 | AH35: 79.62 | AI35: 0.4 | AJ35: A+ | AK35: 7.7600000000000002e-002 | AL35: =H35+100*O35 -> 123.70400000000001 | AM35: 111.6 | AN35: 60 | AO35: 31.9 | AP35: 171 | AQ35: 1.3999999999999999e-002 | AR35: 6 | AS35: 威唐转债!
A36: 130 | B36: 123054 | C36: 思特转债! | D36: 300608 | E36: 思特奇 | F36: 通信互联 | G36: 通信设备 | H36: 91.298 | I36: 1.11e-002 | J36: 1.5e-003 | K36: 11.66 | L36: 3.4599999999999999e-002 | M36: 121.7 | N36: 16.49 | O36: 0.29100000000000004 | P36: 70.71 | Q36: 转股中 | R36: 5.29年 | S36: 3.29年 | T36: 3.29 | U36: 2.71 | V36: 2.4 | W36: 1.e-002 | X36: 0.14699999999999999 | Y36: 0.10400000000000001 | Z36: 18 | AA36: 2.42 | AB36: 5.74e-002 | AC36: 4.9699999999999994e-002 | AD36: 4.0800000000000003e-002 | AE36: 3.7999999999999999e-002 | AG36: 83.99 | AH36: 87.3 | AI36: 0.36 | AJ36: AA- | AK36: 6.6600000000000006e-002 | AL36: =H36+100*O36 -> 120.39800000000001 | AM36: 111.9 | AN36: 62 | AO36: 24.6 | AP36: 98 | AQ36: 6.2e-002 | AR36: 20 | AS36: 思特转债!
A37: 232 | B37: 128069 | C37: 华森转债! | D37: 2907 | E37: 华森制药 | F37: 医药 | G37: 化学制药 | H37: 94.808 | I37: -3.4000000000000002e-003 | J37: 3.7000000000000002e-003 | K37: 11.3 | L37: 1.8e-003 | M37: 120 | N37: 18.04 | O37: 0.51400000000000001 | P37: 62.64 | Q37: 转股中 | R37: 4.32年 | S37: 2.32年 | T37: 2.32 | U37: 3 | V37: 1.3 | W37: 5.0000000000000001e-003 | X37: 6.6000000000000003e-002 | Y37: 4.0999999999999995e-002 | Z37: 45 | AA37: 4.23 | AB37: 5.7300000000000004e-002 | AC37: 4.8600000000000004e-002 | AD37: 3.6299999999999999e-002 | AE37: 3.3399999999999999e-002 | AG37: 88.62 | AH37: 91.9 | AI37: 0.18 | AJ37: AA- | AK37: 6.5099999999999991e-002 | AL37: =H37+100*O37 -> 146.208 | AM37: 127 | AN37: 205 | AO37: 35.1 | AP37: 201 | AQ37: -1.e-003 | AR37: 46 | AS37: 华森转债!
A38: 176 | B38: 113566 | C38: 翔港转债! | D38: 603499 | E38: 翔港科技 | F38: 造纸包装 | G38: 包装材料 | H38: 95.16 | I38: 3.2000000000000002e-003 | J38: 3.0999999999999999e-003 | K38: 7.71 | L38: 1.5800000000000002e-002 | M38: 124.5 | N38: 10.77 | O38: 0.32899999999999996 | P38: 71.59 | Q38: 转股中 | R38: 5年2.6天 | S38: 3年1.6天 | T38: =3+1.6/365 -> 3.0043835616438357 | U38: 1.61 | V38: 4.9 | W38: 3.2000000000000001e-002 | X38: 0.10300000000000001 | Y38: 7.400000000000001e-002 | Z38: 16 | AA38: 2.71 | AB38: 5.67e-002 | AC38: 4.7800000000000002e-002 | AD38: 3.1e-002 | AE38: 2.7900000000000001e-002 | AG38: 82.9 | AH38: 86.5 | AI38: 0.4 | AJ38: A+ | AK38: 7.7600000000000002e-002 | AL38: =H38+100*O38 -> 128.06 | AM38: 118.7 | AN38: 126 | AO38: 32.2 | AP38: 177 | AQ38: 2.9999999999999999e-002 | AR38: 28 | AS38: 翔港转债!
A39: 294 | B39: 123010 | C39: 博世转债! | D39: 300422 | E39: 博世科 | F39: 城市公用 | G39: 三废处理 | H39: 93.72 | I39: -1.5e-003 | J39: 9.7999999999999997e-003 | K39: 9.43 | L39: 2.6099999999999998e-002 | M39: 112.3 | N39: 12.2 | O39: 0.21199999999999999 | P39: 77.3 | Q39: 转股中 | R39: 3.35年 | S39: 1.35年 | T39: 1.35 | U39: 4.3 | V39: 8.5 | W39: 2.1000000000000001e-002 | X39: 0.11199999999999999 | Y39: 8.6999999999999994e-002 | Z39: 38 | AA39: 1.62 | AB39: 5.6600000000000004e-002 | AC39: 4.9299999999999997e-002 | AD39: 6.3299999999999995e-002 | AE39: 5.9400000000000001e-002 | AF39: =AD39/T39 -> 4.6888888888888883e-002 | AG39: 93.49 | AH39: 91.3 | AI39: 0.32 | AJ39: AA- | AK39: 6.5099999999999991e-002 | AL39: =H39+100*O39 -> 114.92 | AM39: 110.1 | AN39: 49 | AO39: 16.7 | AP39: 36 | AQ39: 4.2999999999999997e-002 | AR39: 32 | AS39: 博世转债!
A40: 92 | B40: 113597 | C40: 佳力转债! | D40: 603912 | E40: 佳力图 | F40: 机械装备 | G40: 专用设备 | H40: 93.29 | I40: 8.5000000000000006e-003 | J40: -4.3e-003 | K40: 12.95 | L40: 2.4500000000000001e-002 | M40: 124.5 | N40: 23.4 | O40: 0.68599999999999994 | P40: 55.34 | Q40: 转股中 | R40: 5.42年 | S40: 3.42年 | T40: 3.42 | U40: 3 | V40: 3.3 | W40: 1.2e-002 | X40: 0.107 | Y40: 5.9000000000000004e-002 | Z40: 28 | AA40: 3.24 | AB40: 5.5999999999999994e-002 | AC40: 4.7800000000000002e-002 | AD40: 3.2300000000000002e-002 | AE40: 2.9700000000000001e-002 | AG40: 83.08 | AH40: 88.48 | AI40: 0.17 | AJ40: AA- | AK40: 6.6600000000000006e-002 | AL40: =H40+100*O40 -> 161.88999999999999 | AM40: 131.2 | AN40: 229 | AO40: 42.8 | AP40: 245 | AQ40: 2.5000000000000001e-002 | AR40: 11 | AS40: 佳力转债!
A41: 319 | B41: 128026 | C41: 众兴转债! | D41: 2772 | E41: 众兴菌业 | F41: 农业 | G41: 种植业 | H41: 94.288 | I41: 5.1999999999999998e-003 | J41: 2.9999999999999997e-004 | K41: 8.85 | L41: 2.3099999999999999e-002 | M41: 109.3 | N41: 11.45 | O41: 0.22 | P41: 77.29 | Q41: 转股中 | R41: 2.80年 | S41: 0.80年 | T41: 0.8 | U41: 9.19 | V41: 7.3 | W41: 8.0000000000000002e-003 | X41: 0.28199999999999997 | Y41: 0.218 | Z41: 33 | AA41: 1.33 | AB41: 5.5199999999999999e-002 | AC41: 4.8499999999999995e-002 | AD41: 8.3199999999999996e-002 | AE41: 7.9199999999999993e-002 | AF41: =AD41/T41 -> 0.104 | AG41: 96.01 | AH41: 92.41 | AI41: 0.24 | AJ41: AA- | AK41: 6.3e-002 | AL41: =H41+100*O41 -> 116.288 | AM41: 111.3 | AN41: 58 | AO41: 15.3 | AP41: 28 | AQ41: 3.9e-002 | AR41: 62 | AS41: 众兴转债!
A42: 245 | B42: 113534 | C42: 鼎胜转债! | D42: 603876 | E42: 鼎胜新材 | F42: 有色金属 | G42: 小金属 | H42: 92.62 | I42: -5.4000000000000003e-003 | J42: 7.000000000000001e-004 | K42: 12.07 | L42: -1.55e-002 | M42: 114.9 | N42: 15.18 | O42: 0.16500000000000001 | P42: 79.51 | Q42: 转股中 | R42: 4年42天 | S42: 2年42天 | T42: =2+42/365 -> 2.1150684931506851 | U42: 12 | V42: 6.1 | W42: 5.0000000000000001e-003 | X42: 0.22899999999999998 | Y42: 0.182 | Z42: 52 | AA42: 1.46 | AB42: 5.5e-002 | AC42: 4.8000000000000001e-002 | AD42: 5.0000000000000003e-002 | AE42: 4.6900000000000004e-002 | AG42: 93.81 | AH42: 96.58 | AI42: 0.3 | AJ42: AA | AK42: 4.41e-002 | AL42: =H42+100*O42 -> 109.12 | AM42: 105.7 | AN42: 23 | AO42: 9.1 | AP42: 9 | AQ42: 2.e-003 | AR42: 36 | AS42: 鼎胜转债!
A43: 263 | B43: 110052 | C43: 贵广转债! | D43: 600996 | E43: 贵广网络 | F43: 传媒娱乐 | G43: 影视娱乐 | H43: 96.15 | I43: -2.5000000000000001e-003 | J43: 2.8000000000000004e-003 | K43: 4.94 | L43: 4.0999999999999995e-003 | M43: 118.5 | N43: 7.94 | O43: 0.54500000000000004 | P43: 62.22 | Q43: 转股中 | R43: 4年7天 | S43: 2年7天 | T43: =2+7/365 -> 2.0191780821917806 | U43: 15.3 | V43: 1.7 | W43: 1.e-003 | X43: 0.29399999999999998 | Y43: 0.183 | Z43: 52 | AA43: 1.15 | AB43: 5.4800000000000001e-002 | AC43: 4.6100000000000002e-002 | AD43: 3.6299999999999999e-002 | AE43: 3.27e-002 | AG43: 95.01 | AH43: 100.82 | AI43: 0.09 | AJ43: AA+ | AK43: 4.2099999999999999e-002 | AL43: =H43+100*O43 -> 150.65000000000001 | AM43: 130.1 | AN43: 220 | AO43: 29.3 | AP43: 148 | AQ43: 2.1000000000000001e-002 | AR43: 18 | AS43: 贵广转债!
A44: 82 | B44: 128127 | C44: 文科转债! | D44: 2775 | E44: 文科园林 | F44: 城市公用 | G44: 生态环境 | H44: 91.187 | I44: 2.2000000000000001e-003 | J44: -1.e-003 | K44: 4.55 | L44: 2.2000000000000001e-003 | M44: 121.3 | N44: 5.37 | O44: 7.5999999999999998e-002 | P44: 84.73 | Q44: 3.6天 | R44: 5.48年 | S44: 3.48年 | T44: 3.48 | U44: 9.5 | V44: 8.7 | W44: 1.e-002 | X44: 0.40700000000000003 | Y44: 0.34499999999999997 | Z44: 23 | AA44: 0.88 | AB44: 5.4699999999999999e-002 | AC44: 4.7500000000000001e-002 | AD44: 3.78e-002 | AE44: 3.5299999999999998e-002 | AG44: 82.63 | AH44: 85.89 | AI44: 0.54 | AJ44: AA- | AK44: 6.6600000000000006e-002 | AL44: =H44+100*O44 -> 98.786999999999992 | AM44: 97.6 | AN44: 5 | AO44: 11.8 | AP44: 15 | AQ44: 5.2000000000000005e-002 | AR44: 32 | AS44: 文科转债!
A45: 215 | B45: 113546 | C45: 迪贝转债! | D45: 603320 | E45: 迪贝电气 | F45: 家电 | G45: 零部件制 | H45: 94.78 | I45: 4.0000000000000001e-003 | J45: 4.5000000000000005e-003 | K45: 10.04 | L45: 2.2400000000000003e-002 | M45: 120.6 | N45: 14.1 | O45: 0.33100000000000002 | P45: 71.21 | Q45: 转股中 | R45: 4.66年 | S45: 2.66年 | T45: 2.66 | U45: 2.3 | V45: 2.7 | W45: 1.2e-002 | X45: 0.17600000000000002 | Y45: 0.125 | Z45: 13 | AA45: 1.96 | AB45: 5.4400000000000004e-002 | AC45: 4.6100000000000002e-002 | AD45: 3.3599999999999998e-002 | AE45: 3.0699999999999998e-002 | AG45: 84.72 | AH45: 86.39 | AI45: 0.38 | AJ45: A+ | AK45: 7.6100000000000001e-002 | AL45: =H45+100*O45 -> 127.88 | AM45: 118.4 | AN45: 122 | AO45: 32 | AP45: 172 | AQ45: 4.5999999999999999e-002 | AR45: 43 | AS45: 迪贝转债!
A46: 39 | B46: 123077 | C46: 汉得转债! | D46: 300170 | E46: 汉得信息 | F46: 计算机及 | G46: 软件开发 | H46: 93.179 | I46: -5.0000000000000001e-004 | J46: 1.2999999999999999e-003 | K46: 7.3 | L46: 2.7000000000000001e-003 | M46: 125.5 | N46: 9.72 | O46: 0.24100000000000002 | P46: 75.1 | Q46: 3月0天 | R46: 5.74年 | S46: 3.74年 | T46: 3.74 | U46: 9.37 | V46: 11 | W46: 1.3000000000000001e-002 | X46: 0.14499999999999999 | Y46: 0.109 | Z46: 65 | AA46: 2.03 | AB46: 5.4299999999999994e-002 | AC46: 4.6399999999999997e-002 | AD46: 2.8399999999999998e-002 | AE46: 2.64e-002 | AG46: 87.38 | AH46: 97.61 | AI46: 0.29 | AJ46: AA | AK46: 4.5599999999999995e-002 | AL46: =H46+100*O46 -> 117.279 | AM46: 111.3 | AN46: 57 | AO46: 13.6 | AP46: 20 | AQ46: 4.0999999999999995e-002 | AR46: 10 | AS46: 汉得转债!
A47: 218 | B47: 128076 | C47: 金轮转债! | D47: 2722 | E47: 金轮股份 | F47: 机械装备 | G47: 专用设备 | H47: 90.5 | I47: 4.3e-003 | J47: 1.6000000000000001e-003 | K47: 10.16 | L47: 1.8000000000000002e-002 | M47: 114.9 | N47: 14.76 | O47: 0.315 | P47: 68.83 | Q47: 转股中 | R47: 4.63年 | S47: 2.63年 | T47: 2.63 | U47: 2.14 | V47: 1.7 | W47: 9.0000000000000011e-003 | X47: 0.12 | Y47: 8.3000000000000004e-002 | Z47: 18 | AA47: 0.97 | AB47: 5.4000000000000006e-002 | AC47: 4.7699999999999992e-002 | AD47: 4.9299999999999997e-002 | AE47: 4.6699999999999998e-002 | AG47: 86.83 | AH47: 86.31 | AI47: 0.33 | AJ47: AA- | AK47: 6.5099999999999991e-002 | AL47: =H47+100*O47 -> 122. | AM47: 112.2 | AN47: 65 | AO47: 25.3 | AP47: 107 | AQ47: 4.9000000000000002e-002 | AR47: 43 | AS47: 金轮转债!
A48: 202 | B48: 128082 | C48: 华锋转债! | D48: 2806 | E48: 华锋股份 | F48: 电子 | G48: 元器件制 | H48: 95.101 | I48: 2.0999999999999999e-003 | J48: 3.5999999999999999e-003 | K48: 9.04 | L48: 1.23e-002 | M48: 121.4 | N48: 11.71 | O48: 0.23199999999999998 | P48: 77.2 | Q48: 转股中 | R48: 4.77年 | S48: 2.77年 | T48: 2.77 | U48: 3.45 | V48: 0.9 | W48: 3.0000000000000001e-003 | X48: 0.21600000000000003 | Y48: 0.16699999999999998 | Z48: 16 | AA48: 1.28 | AB48: 5.3899999999999997e-002 | AC48: 4.5599999999999995e-002 | AD48: 3.3000000000000002e-002 | AE48: 2.98e-002 | AG48: 84.47 | AH48: 86.32 | AI48: 0.46 | AJ48: A+ | AK48: 7.6100000000000001e-002 | AL48: =H48+100*O48 -> 118.301 | AM48: 113 | AN48: 70 | AO48: 26.7 | AP48: 120 | AQ48: 5.0000000000000001e-003 | AR48: 58 | AS48: 华锋转债!
A49: 288 | B49: 128042 | C49: 凯中转债! | D49: 2823 | E49: 凯中精密 | F49: 能源电力 | G49: 电力设备 | H49: 97.611 | I49: 4.0000000000000001e-003 | J49: -5.6999999999999993e-003 | K49: 9.88 | L49: -8.0000000000000002e-003 | M49: 116.3 | N49: 12.96 | O49: 0.28000000000000003 | P49: 76.23 | Q49: 转股中 | R49: 3.42年 | S49: 1.42年 | T49: 1.42 | U49: 4.16 | V49: 1.1 | W49: 3.0000000000000001e-003 | X49: 0.14699999999999999 | Y49: 0.11199999999999999 | Z49: 28 | AA49: 2.1 | AB49: 5.3600000000000002e-002 | AC49: 4.4600000000000001e-002 | AD49: 3.3399999999999999e-002 | AE49: 2.98e-002 | AG49: 96.05 | AH49: 100.63 | AI49: 0.21 | AJ49: AA | AK49: 4.41e-002 | AL49: =H49+100*O49 -> 125.611 | AM49: 119 | AN49: 132 | AO49: 18.4 | AP49: 42 | AQ49: 2.7999999999999997e-002 | AR49: 30 | AS49: 凯中转债!
A50: 145 | B50: 113573 | C50: 纵横转债! | D50: 603602 | E50: 纵横通信 | F50: 通信互联 | G50: 通信设备 | H50: 96.38 | I50: -3.4000000000000002e-003 | J50: 1.0800000000000001e-002 | K50: 11.15 | L50: 3.15e-002 | M50: 124.7 | N50: 18.81 | O50: 0.626 | P50: 59.28 | Q50: 转股中 | R50: 5年50天 | S50: 3年50天 | T50: =3+50/365 -> 3.1369863013698631 | U50: 2.7 | V50: 19 | W50: 7.2999999999999995e-002 | X50: 0.11900000000000001 | Y50: 7.0000000000000007e-002 | Z50: 23 | AA50: 3.37 | AB50: 5.28e-002 | AC50: 4.41e-002 | AD50: 2.5499999999999998e-002 | AE50: 2.2599999999999999e-002 | AG50: 82.01 | AH50: 85.78 | AI50: 0.24 | AJ50: A+ | AK50: 7.7600000000000002e-002 | AL50: =H50+100*O50 -> 158.97999999999999 | AM50: 133.5 | AN50: 243 | AO50: 47.7 | AP50: 267 | AQ50: 5.7999999999999996e-002 | AR50: 22 | AS50: 纵横转债!
A51: 72 | B51: 128132 | C51: 交建转债! | D51: 2941 | E51: 新疆交建 | F51: 建筑 | G51: 建筑工程 | H51: 88.703 | I51: -6.0999999999999995e-003 | J51: 4.0000000000000001e-003 | K51: 10.75 | L51: -1.6500000000000001e-002 | M51: 117.3 | N51: 18.57 | O51: 0.53200000000000003 | P51: 57.89 | Q51: 24天 | R51: 5.55年 | S51: 3.55年 | T51: 3.55 | U51: 8.5 | V51: 4.6 | W51: 6.0000000000000001e-003 | X51: 0.12300000000000001 | Y51: 7.0999999999999994e-002 | Z51: 69 | AA51: 2.86 | AB51: 5.2699999999999997e-002 | AC51: 4.6699999999999998e-002 | AD51: 4.36e-002 | AE51: 4.1500000000000002e-002 | AG51: 88.09 | AH51: 92.02 | AI51: 0.13 | AJ51: AA | AK51: 4.5599999999999995e-002 | AL51: =H51+100*O51 -> 141.90300000000002 | AM51: 119.5 | AN51: 139 | AO51: 27.5 | AP51: 127 | AQ51: 5.2000000000000005e-002 | AR51: 14 | AS51: 交建转债!
A52: 266 | B52: 128056 | C52: 今飞转债! | D52: 2863 | E52: 今飞凯达 | F52: 汽车 | G52: 零部件制 | H52: 99.103 | I52: 4.5000000000000005e-003 | J52: 7.1999999999999998e-003 | K52: 5.23 | L52: 2.9500000000000002e-002 | M52: 121 | N52: 6.7 | O52: 0.27000000000000002 | P52: 78.06 | Q52: 转股中 | R52: 4年2.6天 | S52: 2年2.6天 | T52: =2+2.6/365 -> 2.007123287671233 | U52: 1.72 | V52: 11 | W52: 6.6000000000000003e-002 | X52: 6.6000000000000003e-002 | Y52: 5.0999999999999997e-002 | Z52: 26 | AA52: 1.77 | AB52: 5.2600000000000001e-002 | AC52: 4.2800000000000005e-002 | AD52: 2.3599999999999999e-002 | AE52: 1.9699999999999999e-002 | AG52: 89.05 | AH52: 90.94 | AI52: 0.4 | AJ52: A+ | AK52: 7.6100000000000001e-002 | AL52: =H52+100*O52 -> 126.10299999999999 | AM52: 120.1 | AN52: 146 | AO52: 29.2 | AP52: 147 | AQ52: 3.5000000000000003e-002 | AR52: 56 | AS52: 今飞转债!
A53: 32 | B53: 123080 | C53: 海波转债! | D53: 300517 | E53: 海波重科 | F53: 建筑 | G53: 建筑工程 | H53: 95.4 | I53: 9.8999999999999991e-003 | J53: 3.0000000000000001e-003 | K53: 17.91 | L53: 2.23e-002 | M53: 126.5 | N53: 20.91 | O53: 0.114 | P53: 85.65 | Q53: 3月12天 | R53: 5.77年 | S53: 3.77年 | T53: 3.77 | U53: 2.45 | V53: 14 | W53: 5.9000000000000004e-002 | X53: 0.128 | Y53: 0.11 | Z53: 19 | AA53: 2.5 | AB53: 5.1299999999999998e-002 | AC53: 4.3200000000000002e-002 | AD53: 2.4199999999999999e-002 | AE53: 2.1700000000000001e-002 | AG53: 78.31 | AH53: 83.03 | AI53: 0.58 | AJ53: A+ | AK53: 7.7600000000000002e-002 | AL53: =H53+100*O53 -> 106.80000000000001 | AM53: 105.1 | AN53: 21 | AO53: 22.1 | AP53: 67 | AQ53: 4.8000000000000001e-002 | AR53: 8 | AS53: 海波转债!
A54: 320 | B54: 128025 | C54: 特一转债! | D54: 2728 | E54: 特一药业 | F54: 医药 | G54: 化学制药 | H54: 95.009 | I54: -7.000000000000001e-004 | J54: 1.e-004 | K54: 10.53 | L54: -4.6999999999999993e-003 | M54: 108.8 | N54: 14.7 | O54: 0.32600000000000001 | P54: 71.63 | Q54: 转股中 | R54: 2.78年 | S54: 0.78年 | T54: 0.78 | U54: 2.99 | V54: 1 | W54: 3.0000000000000001e-003 | X54: 0.14000000000000001 | Y54: 0.10000000000000001 | Z54: 21 | AA54: 2.12 | AB54: 5.0799999999999998e-002 | AC54: 4.4400000000000002e-002 | AD54: 7.3399999999999993e-002 | AE54: 6.9900000000000004e-002 | AF54: =AD54/T54 -> 9.4102564102564096e-002 | AG54: 95.88 | AH54: 92.05 | AI54: 0.14 | AJ54: AA- | AK54: 6.3e-002 | AL54: =H54+100*O54 -> 127.60900000000001 | AM54: 118.4 | AN54: 123 | AO54: 22.5 | AP54: 74 | AQ54: 1.1000000000000001e-002 | AR54: 54 | AS54: 特一转债!
A55: 274 | B55: 113524 | C55: 奇精转债! | D55: 603677 | E55: 奇精机械 | F55: 家电 | G55: 零部件制 | H55: 97.64 | I55: -4.5000000000000005e-003 | J55: -1.9e-003 | K55: 11.46 | L55: -2.1299999999999999e-002 | M55: 117.3 | N55: 14.08 | O55: 0.20000000000000001 | P55: 81.39 | Q55: 转股中 | R55: 3.80年 | S55: 1.80年 | T55: 1.8 | U55: 3.3 | V55: 43 | W55: 0.13200000000000001 | X55: 0.14999999999999999 | Y55: 0.122 | Z55: 22 | AA55: 2.3 | AB55: 5.04e-002 | AC55: 4.1900000000000007e-002 | AD55: 2.6800000000000001e-002 | AE55: 2.3900000000000001e-002 | AG55: 94.5 | AH55: 99.86 | AI55: 0.3 | AJ55: AA | AK55: 4.41e-002 | AL55: =H55+100*O55 -> 117.64 | AM55: 113.9 | AN55: 76 | AO55: 14 | AP55: 23 | AQ55: 2.7999999999999997e-002 | AR55: 48 | AS55: 奇精转债!
A56: 152 | B56: 113576 | C56: 起步转债!! | D56: 603557 | E56: 起步股份 | F56: 服装纺织 | G56: 鞋服行业 | H56: 95.35 | I56: 6.0999999999999995e-003 | J56: 1.21e-002 | K56: 8.55 | L56: 3.8900000000000004e-002 | M56: 121.8 | N56: 10.55 | O56: 0.17699999999999999 | P56: 81.04 | Q56: 转股中 | R56: 5年43天 | S56: 3年43天 | T56: =3+43/365 -> 3.117808219178082 | U56: 2.66 | V56: 34 | W56: 0.13400000000000001 | X56: 6.3e-002 | Y56: 5.0999999999999997e-002 | Z56: 42 | AA56: 2.52 | AB56: 5.0300000000000004e-002 | AC56: 4.2500000000000003e-002 | AD56: 2.9399999999999999e-002 | AE56: 2.64e-002 | AG56: 85 | AH56: 88.34 | AI56: 0.47 | AJ56: AA- | AK56: 6.6600000000000006e-002 | AL56: =H56+100*O56 -> 113.05 | AM56: 109.7 | AN56: 45 | AO56: 21.3 | AP56: 61 | AQ56: 0.17000000000000001 | AR56: 27 | AS56: 起步转债!!
A57: 186 | B57: 128093 | C57: 百川转债! | D57: 2455 | E57: 百川股份 | F57: 化工 | G57: 化工 | H57: 103.167 | I57: -5.4000000000000003e-003 | J57: 5.9999999999999995e-004 | K57: 5.8 | L57: -8.5000000000000006e-003 | M57: 129.8 | N57: 5.87 | O57: 4.4000000000000004e-002 | P57: 98.81 | Q57: 转股中 | R57: 4.85年 | S57: 2.85年 | T57: 2.85 | U57: 5.2 | V57: 12 | W57: 2.2000000000000002e-002 | X57: 0.17300000000000001 | Y57: 0.17100000000000001 | Z57: 30 | AA57: 2.32 | AB57: 5.0199999999999995e-002 | AC57: 3.95e-002 | AD57: 1.2e-002 | AE57: 7.6e-003 | AG57: 88.63 | AH57: 96.58 | AI57: 0.56 | AJ57: AA- | AK57: 6.5099999999999991e-002 | AL57: =H57+100*O57 -> 107.56700000000001 | AM57: 107.5 | AN57: 32 | AO57: 10.9 | AP57: 12 | AQ57: 4.7e-002 | AR57: 50 | AS57: 百川转债!
A58: 41 | B58: 123076 | C58: 强力转债! | D58: 300429 | E58: 强力新材 | F58: 化工 | G58: 化工 | H58: 90.003 | I58: 0. | J58: -2.3999999999999998e-003 | K58: 12.31 | L58: -7.3000000000000001e-003 | M58: 118.5 | N58: 18.98 | O58: 0.38799999999999996 | P58: 64.86 | Q58: 2月28天 | R58: 5.73年 | S58: 3.73年 | T58: 3.73 | U58: 8.5 | V58: 9.2 | W58: 1.2e-002 | X58: 0.13400000000000001 | Y58: 8.6999999999999994e-002 | Z58: 63 | AA58: 3.67 | AB58: 5.0199999999999995e-002 | AC58: 4.41e-002 | AD58: 3.7699999999999997e-002 | AE58: 3.5699999999999996e-002 | AG58: 80.97 | AH58: 82.5 | AI58: 0.33 | AJ58: AA- | AK58: 6.6600000000000006e-002 | AL58: =H58+100*O58 -> 128.803 | AM58: 115.1 | AN58: 92 | AO58: 32.6 | AP58: 187 | AQ58: 5.9000000000000004e-002 | AR58: 10 | AS58: 强力转债!
A59: 13 | B59: 123089 | C59: 九洲转2! | D59: 300040 | E59: 九洲集团 | F59: 能源电力 | G59: 电力设备 | H59: 91.76 | I59: 7.000000000000001e-004 | J59: 4.0999999999999995e-003 | K59: 6.38 | L59: 9.4999999999999998e-003 | M59: 121 | N59: 8 | O59: 0.151 | P59: 79.75 | Q59: 3月29天 | R59: 5.82年 | S59: 3.82年 | T59: 3.82 | U59: 5 | V59: 2.8 | W59: 6.0000000000000001e-003 | X59: 0.20600000000000002 | Y59: 0.16399999999999998 | Z59: 24 | AA59: 1.11 | AB59: 4.9699999999999994e-002 | AC59: 4.2999999999999997e-002 | AD59: 3.2000000000000001e-002 | AE59: 2.9999999999999999e-002 | AG59: 80.58 | AH59: 83.77 | AI59: 0.51 | AJ59: AA- | AK59: 6.6600000000000006e-002 | AL59: =H59+100*O59 -> 106.86 | AM59: 103.8 | AN59: 16 | AO59: 20 | AP59: 55 | AQ59: 2.1000000000000001e-002 | AR59: 7 | AS59: 九洲转2!
A60: 42 | B60: 128138 | C60: 侨银转债! | D60: 2973 | E60: 侨银股份 | F60: 城市公用 | G60: 城市公用 | H60: 104.1 | I60: 0. | J60: 9.0000000000000011e-003 | K60: 22.81 | L60: 1.8799999999999997e-002 | M60: 136.5 | N60: 25.43 | O60: 0.161 | P60: 89.7 | Q60: 2月27天 | R60: 5.72年 | S60: 3.72年 | T60: 3.72 | U60: 4.2 | V60: 8.4 | W60: 1.9e-002 | X60: 4.4999999999999998e-002 | Y60: 4.0000000000000001e-002 | Z60: 93 | AA60: 6.98 | AB60: 4.9400000000000006e-002 | AC60: 3.9100000000000003e-002 | AD60: 8.0000000000000004e-004 | AE60: -1.4000000000000002e-003 | AG60: 81.46 | AH60: 95.04 | AI60: 0.48 | AJ60: AA- | AK60: 6.6600000000000006e-002 | AL60: =H60+100*O60 -> 120.19999999999999 | AM60: 118.5 | AN60: 124 | AO60: 23.5 | AP60: 85 | AQ60: 5.2999999999999999e-002 | AR60: 6 | AS60: 侨银转债!
A61: 337 | B61: 128013 | C61: 洪涛转债! | D61: 2325 | E61: 洪涛股份 | F61: 建筑 | G61: 装饰工程 | H61: 102.78 | I61: 1.8e-003 | J61: 2.0000000000000001e-004 | K61: 2.3 | L61: 4.4000000000000003e-003 | M61: 109.8 | N61: 2.32 | O61: 3.7000000000000005e-002 | P61: 99.14 | Q61: 转股中 | R61: 1.42年 | S61: 回售内 | U61: 12 | V61: 15 | W61: 1.3000000000000001e-002 | X61: 0.41700000000000004 | Y61: 0.41299999999999998 | Z61: 29 | AA61: 0.96 | AB61: 4.82e-002 | AC61: 3.4799999999999998e-002 | AD61: 回售内 | AE61: 回售内 | AG61: 100.3 | AH61: 100.78 | AI61: 0.45 | AJ61: AA- | AK61: 6.3e-002 | AL61: =H61+100*O61 -> 106.48 | AM61: 106.4 | AN61: 26 | AO61: 5.6 | AP61: 5 | AQ61: 4.5999999999999999e-002 | AR61: 94 | AS61: 洪涛转债!
A62: 326 | B62: 113502 | C62: 嘉澳转债! | D62: 603822 | E62: 嘉澳环保 | F62: 化工 | G62: 化工 | H62: 98.23 | I62: 4.5999999999999999e-003 | J62: -4.6999999999999993e-003 | K62: 19.08 | L62: -3.6400000000000002e-002 | M62: 111.3 | N62: 44.79 | O62: 1.3100000000000001 | P62: 42.6 | Q62: 转股中 | R62: 2.71年 | S62: 0.71年 | T62: 0.71 | U62: 1.85 | V62: 3.1 | W62: 1.7000000000000001e-002 | X62: 0.13200000000000001 | Y62: 5.5999999999999994e-002 | Z62: 14 | AA62: 1.86 | AB62: 4.8099999999999997e-002 | AC62: 3.9900000000000005e-002 | AD62: 4.2000000000000003e-002 | AE62: 3.7699999999999997e-002 | AG62: 96.54 | AH62: 94.61 | AI62: 0 | AJ62: AA- | AK62: 6.3e-002 | AL62: =H62+100*O62 -> 229.23000000000002 | AM62: 153.9 | AN62: 302 | AO62: 57.3 | AP62: 293 | AQ62: 8.0000000000000002e-002 | AR62: 35 | AS62: 嘉澳转债!
A63: 38 | B63: 113609 | C63: 永安转债! | D63: 603776 | E63: 永安行 | F63: 城市公用 | G63: 其他 | H63: 92.55 | I63: 1.55e-002 | J63: 2.5000000000000001e-002 | K63: 17.79 | L63: 6.9800000000000001e-002 | M63: 120.5 | N63: 20.34 | O63: 5.7999999999999996e-002 | P63: 87.46 | Q63: 3月4天 | R63: 5.74年 | S63: 3.74年 | T63: 3.74 | U63: 8.86 | V63: 88 | W63: 0.107 | X63: 0.26600000000000001 | Y63: 0.23199999999999998 | Z63: 33 | AA63: 1.2 | AB63: 4.7899999999999998e-002 | AC63: 4.1399999999999999e-002 | AD63: 3.0200000000000001e-002 | AE63: 2.81e-002 | AG63: 80.9 | AH63: 83.81 | AI63: 0.58 | AJ63: AA- | AK63: 6.6600000000000006e-002 | AL63: =H63+100*O63 -> 98.349999999999994 | AM63: 97.6 | AN63: 4 | AO63: 13.8 | AP63: 22 | AQ63: 0.13400000000000001 | AR63: 10 | AS63: 永安转债!
A64: 58 | B64: 123071 | C64: 天能转债! | D64: 300569 | E64: 天能重工 | F64: 能源电力 | G64: 风能 | H64: 93.504 | I64: -1.e-002 | J64: 6.0000000000000001e-003 | K64: 13.26 | L64: -1.1899999999999999e-002 | M64: 121.1 | N64: 20.05 | O64: 0.41399999999999998 | P64: 66.13 | Q64: 2月0天 | R64: 5.65年 | S64: 3.65年 | T64: 3.65 | U64: 7 | V64: 3.1 | W64: 5.0000000000000001e-003 | X64: 0.13500000000000001 | Y64: 8.900000000000001e-002 | Z64: 52 | AA64: 2.35 | AB64: 4.7800000000000002e-002 | AC64: 4.0999999999999995e-002 | AD64: 2.86e-002 | AE64: 2.64e-002 | AG64: 81.53 | AH64: 84.76 | AI64: 0.34 | AJ64: AA- | AK64: 6.6600000000000006e-002 | AL64: =H64+100*O64 -> 134.904 | AM64: 120.9 | AN64: 153 | AO64: 36.1 | AP64: 210 | AQ64: -1.8000000000000002e-002 | AR64: 10 | AS64: 天能转债!
A65: 334 | B65: 128014 | C65: 永东转债! | D65: 2753 | E65: 永东股份 | F65: 化工 | G65: 化工 | H65: 101 | I65: 1.e-003 | J65: -1.e-003 | K65: 8.05 | L65: -8.6e-003 | M65: 111.3 | N65: 12.6 | O65: 0.58099999999999996 | P65: 63.89 | Q65: 转股中 | R65: 2年50天 | S65: 50天 | T65: =50/365 -> 0.13698630136986301 | U65: 3.37 | V65: 4.7 | W65: 1.3999999999999999e-002 | X65: 0.11199999999999999 | Y65: 7.0999999999999994e-002 | Z65: 30 | AA65: 1.72 | AB65: 4.7500000000000001e-002 | AC65: 3.7100000000000001e-002 | AD65: 2.6499999999999999e-002 | AE65: 1.4499999999999999e-002 | AG65: 99.94 | AH65: 97.95 | AI65: 0.01 | AJ65: AA- | AK65: 6.3e-002 | AL65: =H65+100*O65 -> 159.09999999999999 | AM65: 138.1 | AN65: 265 | AO65: 38.2 | AP65: 224 | AQ65: 1.7000000000000001e-002 | AR65: 40 | AS65: 永东转债!
A66: 195 | B66: 110064 | C66: 建工转债! | D66: 600939 | E66: 重庆建工 | F66: 建筑 | G66: 建筑工程 | H66: 96.51 | I66: -3.2000000000000002e-003 | J66: 3.2000000000000002e-003 | K66: 3.43 | L66: 0. | M66: 119.8 | N66: 4.57 | O66: 0.28600000000000003 | P66: 75.05 | Q66: 转股中 | R66: 4.82年 | S66: 2.82年 | T66: 2.82 | U66: 16.6 | V66: 6.4 | W66: 4.0000000000000001e-003 | X66: 0.26700000000000002 | Y66: 0.20000000000000001 | Z66: 62 | AA66: 0.9 | AB66: 4.7e-002 | AC66: 3.9399999999999998e-002 | AD66: 2.6099999999999998e-002 | AE66: 2.3300000000000001e-002 | AG66: 92.2 | AH66: 98.67 | AI66: 0.25 | AJ66: AA+ | AK66: 4.2099999999999999e-002 | AL66: =H66+100*O66 -> 125.11000000000001 | AM66: 118 | AN66: 118 | AO66: 19.3 | AP66: 50 | AQ66: 1.e-002 | AR66: 47 | AS66: 建工转债!
A67: 119 | B67: 113591 | C67: 胜达转债! | D67: 603687 | E67: 大胜达 | F67: 造纸包装 | G67: 包装用纸 | H67: 96.2 | I67: 1.6000000000000001e-003 | J67: 1.4000000000000002e-003 | K67: 9.03 | L67: 5.6000000000000008e-003 | M67: 122.2 | N67: 10.46 | O67: 0.114 | P67: 86.33 | Q67: 转股中 | R67: 5.34年 | S67: 3.34年 | T67: 3.34 | U67: 5.5 | V67: 4.7 | W67: 9.0000000000000011e-003 | X67: 0.14800000000000002 | Y67: 0.128 | Z67: 37 | AA67: 2.39 | AB67: 4.6900000000000004e-002 | AC67: 3.9300000000000002e-002 | AD67: 2.3099999999999999e-002 | AE67: 2.07e-002 | AG67: 83.27 | AH67: 87.27 | AI67: 0.53 | AJ67: AA- | AK67: 6.6600000000000006e-002 | AL67: =H67+100*O67 -> 107.60000000000001 | AM67: 106.1 | AN67: 25 | AO67: 18.8 | AP67: 46 | AQ67: -1.4999999999999999e-002 | AR67: 23 | AS67: 胜达转债!
A68: 305 | B68: 113505 | C68: 杭电转债! | D68: 603618 | E68: 杭电股份 | F68: 能源电力 | G68: 电力设备 | H68: 98.15 | I68: 4.4000000000000003e-003 | J68: -8.0000000000000004e-004 | K68: 5.98 | L68: 1.18e-002 | M68: 112.3 | N68: 7.14 | O68: 0.17199999999999999 | P68: 83.75 | Q68: 转股中 | R68: 3年8天 | S68: 1年8天 | T68: =1+8/365 -> 1.021917808219178 | U68: 7.5 | V68: 2.5 | W68: 3.0000000000000001e-003 | X68: 0.18100000000000002 | Y68: 0.152 | Z68: 41 | AA68: 1.63 | AB68: 4.6699999999999998e-002 | AC68: 3.8699999999999998e-002 | AD68: 4.0199999999999993e-002 | AE68: 3.5299999999999998e-002 | AG68: 97.72 | AH68: 98.87 | AI68: 0.31 | AJ68: AA | AK68: 4.41e-002 | AL68: =H68+100*O68 -> 115.35000000000001 | AM68: 112.5 | AN68: 67 | AO68: 13.7 | AP68: 21 | AQ68: -5.5e-002 | AR68: 41 | AS68: 杭电转债!
A69: 198 | B69: 128085 | C69: 鸿达转债! | D69: 2002 | E69: 鸿达兴业 | F69: 化工 | G69: 化工 | H69: 100.555 | I69: 8.2500000000000004e-002 | J69: -2.3e-003 | K69: 3.93 | L69: 0.10099999999999999 | M69: 124.4 | N69: 3.92 | O69: 3.0000000000000001e-003 | P69: 100.26 | Q69: 转股中 | R69: 4.80年 | S69: 2.80年 | T69: 2.8 | U69: 15.3 | V69: 1406. | W69: 0.93000000000000005 | X69: 0.14199999999999999 | Y69: 0.14199999999999999 | Z69: 108 | AA69: 1.43 | AB69: 4.6300000000000001e-002 | AC69: 3.73e-002 | AD69: 1.1200000000000002e-002 | AE69: 8.6e-003 | AG69: 73.28 | AH69: 71.24 | AI69: 0.8 | AJ69: BB | AK69: 0.12609999999999999 | AL69: =H69+100*O69 -> 100.855 | AM69: 100.9 | AN69: 7 | AO69: 27.6 | AP69: 131 | AQ69: 0.20800000000000002 | AR69: 99 | AS69: 鸿达转债!
A70: 107 | B70: 128120 | C70: 联诚转债! | D70: 2921 | E70: 联诚精密 | F70: 汽车 | G70: 零部件制 | H70: 93.31 | I70: -1.2999999999999999e-003 | J70: 7.8000000000000005e-003 | K70: 18.61 | L70: 1.1399999999999999e-002 | M70: 118.4 | N70: 24.37 | O70: 0.222 | P70: 76.36 | Q70: 转股中 | R70: 5.39年 | S70: 3.39年 | T70: 3.39 | U70: 2.6 | V70: 0.9 | W70: 4.0000000000000001e-003 | X70: 0.17100000000000001 | Y70: 0.13100000000000001 | Z70: 15 | AA70: 2.03 | AB70: 4.6300000000000001e-002 | AC70: 3.9900000000000005e-002 | AD70: 3.3000000000000002e-002 | AE70: 3.0299999999999997e-002 | AG70: 77.9 | AH70: 76.2 | AI70: 0.57 | AJ70: A | AK70: 8.7599999999999997e-002 | AL70: =H70+100*O70 -> 115.51000000000001 | AM70: 110.3 | AN70: 52 | AO70: 32.4 | AP70: 182 | AQ70: 3.2000000000000001e-002 | AR70: 18 | AS70: 联诚转债!
A71: 80 | B71: 113601 | C71: 塞力转债 | D71: 603716 | E71: 塞力医疗 | F71: 医药 | G71: 医药商业 | H71: 95.32 | I71: 1.e-002 | J71: -4.0000000000000002e-004 | K71: 15.2 | L71: 1.67e-002 | M71: 121.3 | N71: 16.98 | O71: 6.5000000000000002e-002 | P71: 89.52 | Q71: 1.6天 | R71: 5.48年 | S71: 3.48年 | T71: 3.48 | U71: 5.43 | V71: 16 | W71: 3.1e-002 | X71: 0.17399999999999999 | Y71: 0.156 | Z71: 31 | AA71: 2.05 | AB71: 4.5999999999999999e-002 | AC71: 3.8900000000000004e-002 | AD71: 2.5099999999999997e-002 | AE71: 2.2700000000000001e-002 | AG71: 82.61 | AH71: 85.88 | AI71: 0.57 | AJ71: AA- | AK71: 6.6600000000000006e-002 | AL71: =H71+100*O71 -> 101.81999999999999 | AM71: 101.1 | AN71: 8 | AO71: 15.2 | AP71: 27 | AQ71: 3.7000000000000005e-002 | AR71: 33 | AS71: 塞力转债
A72: 63 | B72: 123069 | C72: 金诺转债! | D72: 300505 | E72: 川金诺 | F72: 化工 | G72: 农化 | H72: 98.35 | I72: 6.5000000000000006e-003 | J72: -1.18e-002 | K72: 16.68 | L72: -1.01e-002 | M72: 126 | N72: 19.15 | O72: 0.129 | P72: 87.1 | Q72: 55天 | R72: 5.64年 | S72: 3.64年 | T72: 3.64 | U72: 3.68 | V72: 7.1 | W72: 2.e-002 | X72: 0.16899999999999998 | Y72: 0.14699999999999999 | Z72: 22 | AA72: 2.27 | AB72: 4.58e-002 | AC72: 3.78e-002 | AD72: 1.47e-002 | AE72: 1.2699999999999999e-002 | AG72: 81.52 | AH72: 88.23 | AI72: 0.53 | AJ72: AA- | AK72: 6.6600000000000006e-002 | AL72: =H72+100*O72 -> 111.25 | AM72: 109.6 | AN72: 43 | AO72: 21.4 | AP72: 62 | AQ72: 1.7000000000000001e-002 | AR72: 15 | AS72: 金诺转债!
A73: 23 | B73: 123084 | C73: 高澜转债! | D73: 300499 | E73: 高澜股份 | F73: 能源电力 | G73: 电力设备 | H73: 94.717 | I73: 5.8999999999999999e-003 | J73: 1.1399999999999999e-002 | K73: 9.06 | L73: 3.0699999999999998e-002 | M73: 121.9 | N73: 11.36 | O73: 0.188 | P73: 79.75 | Q73: 3月20天 | R73: 5.79年 | S73: 3.79年 | T73: 3.79 | U73: 2.8 | V73: 2.5 | W73: 9.0000000000000011e-003 | X73: 0.111 | Y73: 8.900000000000001e-002 | Z73: 25 | AA73: 3.23 | AB73: 4.5599999999999995e-002 | AC73: 3.8699999999999998e-002 | AD73: 2.63e-002 | AE73: 2.3799999999999998e-002 | AG73: 78.28 | AH73: 79.92 | AI73: 0.56 | AJ73: A+ | AK73: 7.7600000000000002e-002 | AL73: =H73+100*O73 -> 113.517 | AM73: 109.7 | AN73: 46 | AO73: 29.8 | AP73: 153 | AQ73: 1.9e-002 | AR73: 6 | AS73: 高澜转债!
A74: 196 | B74: 113557 | C74: 森特转债 | D74: 603098 | E74: 森特股份 | F74: 建筑 | G74: 建筑工程 | H74: 97.57 | I74: 1.2500000000000001e-002 | J74: 1.8799999999999997e-002 | K74: 9.25 | L74: 5.7099999999999998e-002 | M74: 120.3 | N74: 10.11 | O74: 6.6000000000000003e-002 | P74: 91.49 | Q74: 转股中 | R74: 4.81年 | S74: 2.81年 | T74: 2.81 | U74: 6 | V74: 7.3 | W74: 1.2e-002 | X74: 0.13500000000000001 | Y74: 0.124 | Z74: 44 | AA74: 2.14 | AB74: 4.5400000000000003e-002 | AC74: 3.7699999999999997e-002 | AD74: 2.07e-002 | AE74: 1.8200000000000001e-002 | AG74: 86.06 | AH74: 89.37 | AI74: 0.55 | AJ74: AA- | AK74: 6.5099999999999991e-002 | AL74: =H74+100*O74 -> 104.16999999999999 | AM74: 103.6 | AN74: 15 | AO74: 14.3 | AP74: 25 | AQ74: 0.10800000000000001 | AR74: 41 | AS74: 森特转债
A75: 117 | B75: 128117 | C75: 道恩转债 | D75: 2838 | E75: 道恩股份 | F75: 化工 | G75: 橡胶塑料 | H75: 98.1 | I75: 2.7000000000000001e-003 | J75: 9.3999999999999986e-003 | K75: 23.25 | L75: 2.6499999999999999e-002 | M75: 123.5 | N75: 29.03 | O75: 0.22500000000000001 | P75: 80.09 | Q75: 转股中 | R75: 5.35年 | S75: 3.35年 | T75: 3.35 | U75: 3.6 | V75: 27 | W75: 7.5999999999999998e-002 | X75: 3.7999999999999999e-002 | Y75: 2.9999999999999999e-002 | Z75: 95 | AA75: 5.5 | AB75: 4.4900000000000002e-002 | AC75: 3.7100000000000001e-002 | AD75: 1.6500000000000001e-002 | AE75: 1.43e-002 | AG75: 83 | AH75: 88.11 | AI75: 0.46 | AJ75: AA- | AK75: 6.6600000000000006e-002 | AL75: =H75+100*O75 -> 120.59999999999999 | AM75: 116.1 | AN75: 99 | AO75: 28 | AP75: 134 | AQ75: -2.8999999999999998e-002 | AR75: 20 | AS75: 道恩转债
A76: 109 | B76: 123059 | C76: 银信转债! | D76: 300231 | E76: 银信科技 | F76: 计算机及 | G76: 软件开发 | H76: 98.5 | I76: 2.0999999999999999e-003 | J76: 1.2999999999999999e-003 | K76: 7.85 | L76: 7.7000000000000002e-003 | M76: 124.1 | N76: 9.91 | O76: 0.24299999999999999 | P76: 79.21 | Q76: 转股中 | R76: 5.38年 | S76: 3.38年 | T76: 3.38 | U76: 3.91 | V76: 5.7 | W76: 1.4999999999999999e-002 | X76: 0.113 | Y76: 8.900000000000001e-002 | Z76: 35 | AA76: 2.64 | AB76: 4.4800000000000006e-002 | AC76: 3.6900000000000002e-002 | AD76: 1.5700000000000002e-002 | AE76: 1.34e-002 | AG76: 82.97 | AH76: 88.37 | AI76: 0.45 | AJ76: AA- | AK76: 6.6600000000000006e-002 | AL76: =H76+100*O76 -> 122.8 | AM76: 117.8 | AN76: 117 | AO76: 29.4 | AP76: 150 | AQ76: -6.0000000000000001e-003 | AR76: 15 | AS76: 银信转债!
A77: 311 | B77: 128033 | C77: 迪龙转债! | D77: 2658 | E77: 雪迪龙 | F77: 城市公用 | G77: 三废处理 | H77: 96.3 | I77: 0. | J77: 3.4999999999999996e-003 | K77: 5.57 | L77: 5.6900000000000006e-002 | M77: 108.8 | N77: 8.83 | O77: 0.52700000000000002 | P77: 63.08 | Q77: 转股中 | R77: 2.83年 | S77: 0.83年 | T77: 0.83 | U77: 5.2 | V77: 1.4 | W77: 3.0000000000000001e-003 | X77: 0.154 | Y77: 9.6999999999999989e-002 | Z77: 34 | AA77: 1.67 | AB77: 4.4699999999999997e-002 | AC77: 3.85e-002 | AD77: 5.4699999999999999e-002 | AE77: 5.1399999999999994e-002 | AF77: =AD77/T77 -> 6.5903614457831328e-002 | AG77: 97.47 | AH77: 96.99 | AI77: 0.06 | AJ77: AA | AK77: 4.2000000000000003e-002 | AL77: =H77+100*O77 -> 149. | AM77: 129.5 | AN77: 217 | AO77: 32.1 | AP77: 175 | AQ77: 7.9000000000000001e-002 | AR77: 38 | AS77: 迪龙转债!
A78: 278 | B78: 128049 | C78: 华源转债! | D78: 2787 | E78: 华源控股 | F78: 造纸包装 | G78: 包装材料 | H78: 97.47 | I78: -1.0500000000000001e-002 | J78: 7.7000000000000002e-003 | K78: 6.03 | L78: -6.6e-003 | M78: 114.5 | N78: 7.42 | O78: 0.19899999999999998 | P78: 81.27 | Q78: 转股中 | R78: 3.75年 | S78: 1.75年 | T78: 1.75 | U78: 3.63 | V78: 1.6 | W78: 4.0000000000000001e-003 | X78: 0.191 | Y78: 0.155 | Z78: 19 | AA78: 1.27 | AB78: 4.4699999999999997e-002 | AC78: 3.73e-002 | AD78: 2.8500000000000001e-002 | AE78: 2.5499999999999998e-002 | AG78: 91.2 | AH78: 90.79 | AI78: 0.41 | AJ78: AA- | AK78: 6.5099999999999991e-002 | AL78: =H78+100*O78 -> 117.37 | AM78: 113.7 | AN78: 75 | AO78: 22.5 | AP78: 72 | AQ78: 1.7000000000000001e-002 | AR78: 50 | AS78: 华源转债!
A79: 187 | B79: 113561 | C79: 正裕转债! | D79: 603089 | E79: 正裕工业 | F79: 汽车 | G79: 零部件制 | H79: 95.98 | I79: -1.8e-003 | J79: 7.4000000000000003e-003 | K79: 7.92 | L79: 1.15e-002 | M79: 118 | N79: 10.23 | O79: 0.23999999999999999 | P79: 77.42 | Q79: 转股中 | R79: 4.85年 | S79: 2.85年 | T79: 2.85 | U79: 1.5 | V79: 2 | W79: 1.3999999999999999e-002 | X79: 8.5000000000000006e-002 | Y79: 6.6000000000000003e-002 | Z79: 18 | AA79: 1.89 | AB79: 4.4600000000000001e-002 | AC79: 3.7599999999999995e-002 | AD79: 2.7900000000000001e-002 | AE79: 2.5099999999999997e-002 | AG79: 83.74 | AH79: 83.41 | AI79: 0.49 | AJ79: A+ | AK79: 7.6100000000000001e-002 | AL79: =H79+100*O79 -> 119.98 | AM79: 114.5 | AN79: 83 | AO79: 30.8 | AP79: 162 | AQ79: 2.2000000000000002e-002 | AR79: 32 | AS79: 正裕转债!
A80: 318 | B80: 123004 | C80: 铁汉转债! | D80: 300197 | E80: 铁汉生态 | F80: 城市公用 | G80: 生态环境 | H80: 96.5 | I80: 1.18e-002 | J80: 6.3e-003 | K80: 3.3 | L80: 5.4299999999999994e-002 | M80: 108.8 | N80: 3.82 | O80: 0.11699999999999999 | P80: 86.39 | Q80: 转股中 | R80: 2.81年 | S80: 0.81年 | T80: 0.81 | U80: 8.03 | V80: 68 | W80: 8.6999999999999994e-002 | X80: 8.5999999999999993e-002 | Y80: 7.400000000000001e-002 | Z80: 93 | AA80: 1.5 | AB80: 4.4299999999999999e-002 | AC80: 3.7999999999999999e-002 | AD80: 5.3800000000000001e-002 | AE80: 5.0499999999999996e-002 | AF80: =AD80/T80 -> 6.6419753086419744e-002 | AG80: 97.57 | AH80: 97.08 | AI80: 0.33 | AJ80: AA | AK80: 4.2000000000000003e-002 | AL80: =H80+100*O80 -> 108.2 | AM80: 106.6 | AN80: 27 | AO80: 9 | AP80: 8 | AQ80: 0.10099999999999999 | AR80: 47 | AS80: 铁汉转债!
A81: 22 | B81: 123086 | C81: 海兰转债! | D81: 300065 | E81: 海兰信 | F81: 电子 | G81: 电子产品 | H81: 96.56 | I81: 1.7000000000000001e-003 | J81: -2.7000000000000001e-003 | K81: 10.73 | L81: -2.8000000000000004e-003 | M81: 123.5 | N81: 15.16 | O81: 0.36399999999999999 | P81: 70.78 | Q81: 3月21天 | R81: 5.79年 | S81: 3.79年 | T81: 3.79 | U81: 7.3 | V81: 15 | W81: 2.2000000000000002e-002 | X81: 0.17100000000000001 | Y81: 0.121 | Z81: 43 | AA81: 2.86 | AB81: 4.4199999999999996e-002 | AC81: 3.7000000000000005e-002 | AD81: 1.8700000000000001e-002 | AE81: 1.67e-002 | AG81: 80.66 | AH81: 85.62 | AI81: 0.38 | AJ81: AA- | AK81: 6.6600000000000006e-002 | AL81: =H81+100*O81 -> 132.96000000000001 | AM81: 122.3 | AN81: 166 | AO81: 36.7 | AP81: 214 | AQ81: 0. | AR81: 4 | AS81: 海兰转债!
A82: 31 | B82: 123081 | C82: 精研转债! | D82: 300709 | E82: 精研科技 | F82: 电子 | G82: 电子产品 | H82: 95.3 | I82: -5.1999999999999998e-003 | J82: 3.0000000000000001e-003 | K82: 43.1 | L82: -6.1999999999999998e-003 | M82: 121.3 | N82: 64.28 | O82: 0.42100000000000004 | P82: 67.05 | Q82: 3月13天 | R82: 5.77年 | S82: 3.77年 | T82: 3.77 | U82: 5.7 | V82: 4.9 | W82: 9.0000000000000011e-003 | X82: 0.114 | Y82: 7.6999999999999999e-002 | Z82: 50 | AA82: 3.31 | AB82: 4.36e-002 | AC82: 3.6900000000000002e-002 | AD82: 2.3199999999999998e-002 | AE82: 2.1000000000000001e-002 | AG82: 81.07 | AH82: 84.28 | AI82: 0.36 | AJ82: AA- | AK82: 6.6600000000000006e-002 | AL82: =H82+100*O82 -> 137.40000000000001 | AM82: 123.5 | AN82: 174 | AO82: 39.3 | AP82: 229 | AQ82: -2.1000000000000001e-002 | AR82: 4 | AS82: 精研转债!
A83: 66 | B83: 113604 | C83: 多伦转债! | D83: 603528 | E83: 多伦科技 | F83: 计算机及 | G83: 软件开发 | H83: 92.71 | I83: 9.8999999999999991e-003 | J83: -1.0500000000000001e-002 | K83: 7.59 | L83: -1.2999999999999999e-003 | M83: 117.3 | N83: 10.44 | O83: 0.27500000000000002 | P83: 72.7 | Q83: 52天 | R83: 5.63年 | S83: 3.63年 | T83: 3.63 | U83: 6.4 | V83: 6.1 | W83: 1.e-002 | X83: 0.13500000000000001 | Y83: 9.8000000000000004e-002 | Z83: 48 | AA83: 2.94 | AB83: 4.3499999999999997e-002 | AC83: 3.78e-002 | AD83: 3.0499999999999999e-002 | AE83: 2.8500000000000001e-002 | AG83: 81.48 | AH83: 82.2 | AI83: 0.44 | AJ83: AA- | AK83: 6.6600000000000006e-002 | AL83: =H83+100*O83 -> 120.20999999999999 | AM83: 112.7 | AN83: 68 | AO83: 30.5 | AP83: 159 | AQ83: 1.4999999999999999e-002 | AR83: 5 | AS83: 多伦转债!
A84: 273 | B84: 113525 | C84: 台华转债! | D84: 603055 | E84: 台华新材 | F84: 服装纺织 | G84: 纺织行业 | H84: 97.53 | I84: 5.4000000000000003e-003 | J84: 6.7000000000000002e-003 | K84: 5.97 | L84: 4.7400000000000005e-002 | M84: 114.3 | N84: 7.83 | O84: 0.27899999999999997 | P84: 76.25 | Q84: 转股中 | R84: 3.81年 | S84: 1.81年 | T84: 1.81 | U84: 4.69 | V84: 3.4 | W84: 6.9999999999999993e-003 | X84: 9.4e-002 | Y84: 7.2000000000000008e-002 | Z84: 50 | AA84: 1.75 | AB84: 4.3400000000000001e-002 | AC84: 3.6200000000000003e-002 | AD84: 2.7200000000000002e-002 | AE84: 2.4300000000000002e-002 | AG84: 94.47 | AH84: 97.28 | AI84: 0.25 | AJ84: AA | AK84: 4.41e-002 | AL84: =H84+100*O84 -> 125.43000000000001 | AM84: 118.8 | AN84: 128 | AO84: 21.5 | AP84: 63 | AQ84: 0.13 | AR84: 22 | AS84: 台华转债!
A85: 295 | B85: 127007 | C85: 湖广转债! | D85: 665 | E85: 湖北广电 | F85: 传媒娱乐 | G85: 影视娱乐 | H85: 97.798 | I85: 1.1999999999999999e-003 | J85: -1.1999999999999999e-003 | K85: 3.8 | L85: 0. | M85: 112.3 | N85: 5.58 | O85: 0.436 | P85: 68.1 | Q85: 转股中 | R85: 3.34年 | S85: 1.34年 | T85: 1.34 | U85: 12.2 | V85: 4.3 | W85: 4.0000000000000001e-003 | X85: 0.32600000000000001 | Y85: 0.222 | Z85: 37 | AA85: 0.57 | AB85: 4.3299999999999998e-002 | AC85: 3.61e-002 | AD85: 3.4099999999999998e-002 | AE85: 3.0299999999999997e-002 | AG85: 96.69 | AH85: 98.16 | AI85: 0.14 | AJ85: AA+ | AK85: 4.2099999999999999e-002 | AL85: =H85+100*O85 -> 141.398 | AM85: 127.5 | AN85: 207 | AO85: 29.3 | AP85: 149 | AQ85: -2.5000000000000001e-002 | AR85: 18 | AS85: 湖广转债!
A86: 170 | B86: 113570 | C86: 百达转债! | D86: 603331 | E86: 百达精工 | F86: 机械装备 | G86: 机械装备 | H86: 93.57 | I86: 2.e-003 | J86: 1.3999999999999999e-002 | K86: 9.03 | L86: 3.0800000000000001e-002 | M86: 115.3 | N86: 11.54 | O86: 0.19600000000000001 | P86: 78.25 | Q86: 转股中 | R86: 5年13天 | S86: 3年13天 | T86: =3+13/365 -> 3.0356164383561643 | U86: 2.8 | V86: 1.7 | W86: 6.9999999999999993e-003 | X86: 0.17300000000000001 | Y86: 0.13600000000000001 | Z86: 16 | AA86: 2.09 | AB86: 4.3299999999999998e-002 | AC86: 3.7499999999999999e-002 | AD86: 3.3300000000000003e-002 | AE86: 3.0800000000000001e-002 | AG86: 81.94 | AH86: 79.82 | AI86: 0.52 | AJ86: A+ | AK86: 7.7600000000000002e-002 | AL86: =H86+100*O86 -> 113.16999999999999 | AM86: 108.9 | AN86: 40 | AO86: 26.9 | AP86: 124 | AQ86: 2.3e-002 | AR86: 35 | AS86: 百达转债!
A87: 225 | B87: 128072 | C87: 翔鹭转债! | D87: 2842 | E87: 翔鹭钨业 | F87: 有色金属 | G87: 小金属 | H87: 95.685 | I87: 5.5000000000000005e-003 | J87: -6.8999999999999999e-003 | K87: 10.15 | L87: -4.8999999999999998e-003 | M87: 115.1 | N87: 15.34 | O87: 0.44600000000000001 | P87: 66.17 | Q87: 转股中 | R87: 4.48年 | S87: 2.48年 | T87: 2.48 | U87: 3.02 | V87: 9.3 | W87: 3.2000000000000001e-002 | X87: 0.109 | Y87: 7.2000000000000008e-002 | Z87: 28 | AA87: 3.06 | AB87: 4.2999999999999997e-002 | AC87: 3.6600000000000001e-002 | AD87: 3.0200000000000001e-002 | AE87: 2.75e-002 | AG87: 87.69 | AH87: 87.29 | AI87: 0.29 | AJ87: AA- | AK87: 6.5099999999999991e-002 | AL87: =H87+100*O87 -> 140.285 | AM87: 125.2 | AN87: 185 | AO87: 37.5 | AP87: 220 | AQ87: 9.8000000000000004e-002 | AR87: 28 | AS87: 翔鹭转债!
A88: 8 | B88: 128143 | C88: 锋龙转债! | D88: 2931 | E88: 锋龙股份 | F88: 机械装备 | G88: 专用设备 | H88: 95.73 | I88: 2.3999999999999998e-003 | J88: 5.4000000000000003e-003 | K88: 14.79 | L88: 1.3000000000000001e-002 | M88: 121.7 | N88: 17.97 | O88: 0.16300000000000001 | P88: 82.3 | Q88: 4月18天 | R88: 5.87年 | S88: 3.87年 | T88: 3.87 | U88: 2.45 | V88: 6.4 | W88: 2.7000000000000003e-002 | X88: 0.11599999999999999 | Y88: 9.6000000000000002e-002 | Z88: 21 | AA88: 3.65 | AB88: 4.2699999999999995e-002 | AC88: 3.6000000000000004e-002 | AD88: 2.2499999999999999e-002 | AE88: 2.0199999999999999e-002 | AG88: 77.67 | AH88: 79.3 | AI88: 0.6 | AJ88: A+ | AK88: 7.7600000000000002e-002 | AL88: =H88+100*O88 -> 112.03 | AM88: 109.2 | AN88: 42 | AO88: 29.9 | AP88: 154 | AQ88: 1.e-002 | AR88: 6 | AS88: 锋龙转债!
A89: 88 | B89: 113599 | C89: 嘉友转债! | D89: 603871 | E89: 嘉友国际 | F89: 交通运输 | G89: 物流业 | H89: 100.86 | I89: -5.9999999999999995e-004 | J89: -1.2999999999999999e-003 | K89: 21.3 | L89: -3.7000000000000002e-003 | M89: 126 | N89: 24.82 | O89: 0.17499999999999999 | P89: 85.82 | Q89: 转股中 | R89: 5.44年 | S89: 3.44年 | T89: 3.44 | U89: 7.2 | V89: 2.6 | W89: 4.0000000000000001e-003 | X89: 0.154 | Y89: 0.13200000000000001 | Z89: 47 | AA89: 2.35 | AB89: 4.2599999999999999e-002 | AC89: 3.4300000000000004e-002 | AD89: 8.3999999999999995e-003 | AE89: 6.3e-003 | AG89: 82.57 | AH89: 89.36 | AI89: 0.5 | AJ89: AA- | AK89: 6.6600000000000006e-002 | AL89: =H89+100*O89 -> 118.36 | AM89: 115.9 | AN89: 98 | AO89: 26.5 | AP89: 118 | AQ89: 4.8000000000000001e-002 | AR89: 19 | AS89: 嘉友转债!
A90: 24 | B90: 127027 | C90: 靖远转债! | D90: 552 | E90: 靖远煤电 | F90: 煤炭 | G90: 煤炭开采 | H90: 91.12 | I90: -3.0999999999999999e-003 | J90: -1.06e-002 | K90: 2.67 | L90: -3.2599999999999997e-002 | M90: 115.3 | N90: 3.33 | O90: 0.13600000000000001 | P90: 80.18 | Q90: 3月20天 | R90: 5.79年 | S90: 3.79年 | T90: 3.79 | U90: 28 | V90: 44 | W90: 1.7000000000000001e-002 | X90: 0.45899999999999996 | Y90: 0.36799999999999999 | Z90: 61 | AA90: 0.77 | AB90: 4.2300000000000004e-002 | AC90: 3.73e-002 | AD90: 3.3799999999999997e-002 | AE90: 3.1800000000000002e-002 | AG90: 87.83 | AH90: 90.49 | AI90: 0.42 | AJ90: AA+ | AK90: 4.36e-002 | AL90: =H90+100*O90 -> 104.72 | AM90: 102.1 | AN90: 10 | AO90: 11.6 | AP90: 14 | AQ90: -1.4999999999999999e-002 | AR90: 15 | AS90: 靖远转债!
A91: 36 | B91: 128139 | C91: 祥鑫转债! | D91: 2965 | E91: 祥鑫科技 | F91: 汽车 | G91: 零部件制 | H91: 95.899 | I91: -1.1000000000000001e-003 | J91: -6.7000000000000002e-003 | K91: 31.6 | L91: -1.3999999999999999e-002 | M91: 121 | N91: 37.28 | O91: 0.13100000000000001 | P91: 84.76 | Q91: 3月11天 | R91: 5.76年 | S91: 3.76年 | T91: 3.76 | U91: 6.47 | V91: 3.2 | W91: 5.0000000000000001e-003 | X91: 0.13600000000000001 | Y91: 0.115 | Z91: 48 | AA91: 2.81 | AB91: 4.2000000000000003e-002 | AC91: 3.5400000000000001e-002 | AD91: 2.0799999999999999e-002 | AE91: 1.8799999999999997e-002 | AG91: 80.86 | AH91: 84.07 | AI91: 0.55 | AJ91: AA- | AK91: 6.6600000000000006e-002 | AL91: =H91+100*O91 -> 108.999 | AM91: 107 | AN91: 29 | AO91: 23 | AP91: 79 | AQ91: 5.5999999999999994e-002 | AR91: 7 | AS91: 祥鑫转债!
A92: 34 | B92: 113610 | C92: 灵康转债 | D92: 603669 | E92: 灵康药业 | F92: 医药 | G92: 化学制药 | H92: 96 | I92: -6.0999999999999995e-003 | J92: -6.9999999999999993e-003 | K92: 7.8 | L92: -2.2599999999999999e-002 | M92: 121.1 | N92: 8.81 | O92: 8.4000000000000005e-002 | P92: 88.54 | Q92: 3月11天 | R92: 5.76年 | S92: 3.76年 | T92: 3.76 | U92: 5.25 | V92: 8.6 | W92: 1.7000000000000001e-002 | X92: 9.4e-002 | Y92: 8.4000000000000005e-002 | Z92: 56 | AA92: 4.08 | AB92: 4.2000000000000003e-002 | AC92: 3.5299999999999998e-002 | AD92: 2.0799999999999999e-002 | AE92: 1.8799999999999997e-002 | AG92: 80.95 | AH92: 84.16 | AI92: 0.58 | AJ92: AA- | AK92: 6.6600000000000006e-002 | AL92: =H92+100*O92 -> 104.40000000000001 | AM92: 103.5 | AN92: 13 | AO92: 19.3 | AP92: 51 | AQ92: -1.4999999999999999e-002 | AR92: 13 | AS92: 灵康转债
A93: 255 | B93: 123024 | C93: 岱勒转债! | D93: 300700 | E93: 岱勒新材 | F93: 机械装备 | G93: 专用设备 | H93: 99.815 | I93: 5.4000000000000003e-003 | J93: -1.e-004 | K93: 16.04 | L93: 1.1299999999999999e-002 | M93: 113 | N93: 18.33 | O93: 0.14099999999999999 | P93: 87.51 | Q93: 转股中 | R93: 3年23天 | S93: 1年23天 | T93: =1+23/365 -> 1.0630136986301371 | U93: 2.1 | V93: 2.1 | W93: 1.e-002 | X93: 0.159 | Y93: 0.13900000000000001 | Z93: 13 | AA93: 2.68 | AB93: 4.1900000000000007e-002 | AC93: 3.3799999999999997e-002 | AD93: 1.5800000000000002e-002 | AE93: 1.3000000000000001e-002 | AG93: 93.03 | AH93: 90.56 | AI93: 0.47 | AJ93: A+ | AK93: 7.6100000000000001e-002 | AL93: =H93+100*O93 -> 113.91499999999999 | AM93: 112.1 | AN93: 64 | AO93: 19.1 | AP93: 49 | AQ93: 4.0000000000000001e-003 | AR93: 35 | AS93: 岱勒转债!
A94: 231 | B94: 128070 | C94: 智能转债! | D94: 2877 | E94: 智能自控 | F94: 机械装备 | G94: 通用设备 | H94: 98.8 | I94: 2.2799999999999997e-002 | J94: -1.95e-002 | K94: 6.65 | L94: 9.1000000000000004e-003 | M94: 117.6 | N94: 9.51 | O94: 0.41299999999999998 | P94: 69.93 | Q94: 转股中 | R94: 4.35年 | S94: 无权 | U94: 2.3 | V94: 65 | W94: 0.28999999999999998 | X94: 0.10400000000000001 | Y94: 7.2999999999999995e-002 | Z94: 22 | AA94: 3.1 | AB94: 4.1900000000000007e-002 | AC94: 3.4300000000000004e-002 | AD94: 无权 | AE94: 无权 | AG94: 无权 | AH94: 86.2 | AI94: 0.36 | AJ94: A+ | AK94: 7.6100000000000001e-002 | AL94: =H94+100*O94 -> 140.09999999999999 | AM94: 127.7 | AN94: 210 | AO94: 41.5 | AP94: 240 | AQ94: 2.1000000000000001e-002 | AR94: 31 | AS94: 智能转债!
A95: 206 | B95: 113549 | C95: 白电转债 | D95: 603861 | E95: 白云电器 | F95: 能源电力 | G95: 电力设备 | H95: 95.17 | I95: 7.000000000000001e-004 | J95: -4.5000000000000005e-003 | K95: 7.61 | L95: -9.1000000000000004e-003 | M95: 114.8 | N95: 8.88 | O95: 0.111 | P95: 85.7 | Q95: 转股中 | R95: 4.72年 | S95: 2.72年 | T95: 2.72 | U95: 8.8 | V95: 3.8 | W95: 5.0000000000000001e-003 | X95: 0.26200000000000001 | Y95: 0.22399999999999998 | Z95: 34 | AA95: 1.44 | AB95: 4.1299999999999996e-002 | AC95: 3.5299999999999998e-002 | AD95: 2.9100000000000001e-002 | AE95: 2.6699999999999998e-002 | AG95: 91.31 | AH95: 94.01 | AI95: 0.42 | AJ95: AA | AK95: 4.41e-002 | AL95: =H95+100*O95 -> 106.27 | AM95: 104.6 | AN95: 19 | AO95: 10.6 | AP95: 11 | AQ95: 8.0000000000000002e-003 | AR95: 35 | AS95: 白电转债
A96: 168 | B96: 123044 | C96: 红相转债! | D96: 300427 | E96: 红相股份 | F96: 能源电力 | G96: 电力设备 | H96: 103.03 | I96: 6.7000000000000002e-003 | J96: -8.8000000000000005e-003 | K96: 16.45 | L96: -4.1999999999999997e-003 | M96: 125.5 | N96: 18.8 | O96: 0.17699999999999999 | P96: 87.5 | Q96: 转股中 | R96: 5年14天 | S96: 3年14天 | T96: =3+14/365 -> 3.0383561643835617 | U96: 5.5 | V96: 20 | W96: 3.6000000000000004e-002 | X96: 9.3000000000000013e-002 | Y96: 8.1000000000000003e-002 | Z96: 59 | AA96: 2.59 | AB96: 4.1100000000000005e-002 | AC96: 3.2099999999999997e-002 | AD96: 6.0000000000000001e-003 | AE96: 3.0000000000000001e-003 | AG96: 85.68 | AH96: 91.52 | AI96: 0.5 | AJ96: AA- | AK96: 6.6600000000000006e-002 | AL96: =H96+100*O96 -> 120.73 | AM96: 118.6 | AN96: 125 | AO96: 27 | AP96: 125 | AQ96: -8.3000000000000004e-002 | AR96: 20 | AS96: 红相转债!
A97: 322 | B97: 128022 | C97: 众信转债! | D97: 2707 | E97: 众信旅游 | F97: 旅游餐饮 | G97: 旅游 | H97: 97.599 | I97: 8.9999999999999998e-004 | J97: -5.1000000000000004e-003 | K97: 5.97 | L97: -2.1299999999999999e-002 | M97: 108.8 | N97: 7.92 | O97: 0.29499999999999998 | P97: 75.38 | Q97: 转股中 | R97: 2.76年 | S97: 0.76年 | T97: 0.76 | U97: 4.56 | V97: 5.6 | W97: 1.2e-002 | X97: 8.4000000000000005e-002 | Y97: 6.4000000000000001e-002 | Z97: 54 | AA97: 2.54 | AB97: 4.07e-002 | AC97: 3.44e-002 | AD97: 4.3799999999999999e-002 | AE97: 4.0300000000000002e-002 | AG97: 95.96 | AH97: 92.13 | AI97: 0.19 | AJ97: AA- | AK97: 6.3e-002 | AL97: =H97+100*O97 -> 127.099 | AM97: 119.8 | AN97: 144 | AO97: 23.9 | AP97: 91 | AQ97: 9.5000000000000001e-002 | AR97: 32 | AS97: 众信转债!
A98: 101 | B98: 123061 | C98: 航新转债 | D98: 300424 | E98: 航新科技 | F98: 航空航天 | G98: 航空航天 | H98: 101.126 | I98: 3.0000000000000001e-003 | J98: -7.0999999999999995e-003 | K98: 13.02 | L98: -6.8999999999999999e-003 | M98: 124.8 | N98: 14.86 | O98: 0.154 | P98: 87.62 | Q98: 转股中 | R98: 5.40年 | S98: 3.40年 | T98: 3.4 | U98: 2.5 | V98: 34 | W98: 0.13300000000000001 | X98: 8.0000000000000002e-002 | Y98: 7.0000000000000007e-002 | Z98: 31 | AA98: 2.86 | AB98: 4.07e-002 | AC98: 3.2599999999999997e-002 | AD98: 1.e-002 | AE98: 7.3000000000000001e-003 | AG98: 80.51 | AH98: 84.2 | AI98: 0.59 | AJ98: A+ | AK98: 7.7600000000000002e-002 | AL98: =H98+100*O98 -> 116.52600000000001 | AM98: 114.6 | AN98: 84 | AO98: 30.4 | AP98: 158 | AQ98: 2.e-003 | AR98: 12 | AS98: 航新转债
A99: 293 | B99: 110045 | C99: 海澜转债! | D99: 600398 | E99: 海澜之家 | F99: 服装纺织 | G99: 服装行业 | H99: 97.5 | I99: -3.4000000000000002e-003 | J99: 2.3999999999999998e-003 | K99: 6.68 | L99: -2.0499999999999997e-002 | M99: 111.1 | N99: 11.75 | O99: 0.71499999999999997 | P99: 56.85 | Q99: 转股中 | R99: 3.38年 | S99: 1.38年 | T99: 1.38 | U99: 29.5 | V99: 6.4 | W99: 2.e-003 | X99: 0.10199999999999999 | Y99: 5.7999999999999996e-002 | Z99: 289 | AA99: 2.27 | AB99: 4.0099999999999997e-002 | AC99: 3.3700000000000001e-002 | AD99: 2.9999999999999999e-002 | AE99: 2.7300000000000001e-002 | AG99: 95.77 | AH99: 96.87 | AI99: 0.05 | AJ99: AA+ | AK99: 4.2099999999999999e-002 | AL99: =H99+100*O99 -> 169. | AM99: 138.1 | AN99: 266 | AO99: 41.3 | AP99: 238 | AQ99: -1.e-002 | AR99: 58 | AS99: 海澜转债!
A100: 149 | B100: 110070 | C100: 凌钢转债! | D100: 600231 | E100: 凌钢股份 | F100: 钢铁 | G100: 炼钢 | H100: 96.79 | I100: -9.8999999999999991e-003 | J100: 4.5000000000000005e-003 | K100: 2.36 | L100: -1.26e-002 | M100: 117.8 | N100: 2.75 | O100: 0.128 | P100: 85.82 | Q100: 转股中 | R100: 5年46天 | S100: 3年46天 | T100: =3+46/365 -> 3.1260273972602741 | U100: 2.89 | V100: 2.9 | W100: 1.e-002 | X100: 4.4000000000000004e-002 | Y100: 3.7999999999999999e-002 | Z100: 65 | AA100: 0.81 | AB100: 4.0000000000000001e-002 | AC100: 3.3500000000000002e-002 | AD100: 2.2700000000000001e-002 | AE100: 2.0199999999999999e-002 | AG100: 90.08 | AH100: 94.22 | AI100: 0.43 | AJ100: AA | AK100: 4.5599999999999995e-002 | AL100: =H100+100*O100 -> 109.59 | AM100: 107.8 | AN100: 34 | AO100: 13.5 | AP100: 19 | AQ100: 4.0000000000000001e-002 | AR100: 20 | AS100: 凌钢转债!
A101: 132 | B101: 123053 | C101: 宝通转债! | D101: 300031 | E101: 宝通科技 | F101: 通信互联 | G101: 互联网 | H101: 99.3 | I101: -1.e-003 | J101: 1.4199999999999999e-002 | K101: 16.43 | L101: 2.8799999999999999e-002 | M101: 121.3 | N101: 20.8 | O101: 0.25700000000000001 | P101: 78.99 | Q101: 转股中 | R101: 5.27年 | S101: 3.27年 | T101: 3.27 | U101: 5 | V101: 8.5 | W101: 1.7000000000000001e-002 | X101: 7.6999999999999999e-002 | Y101: 6.0999999999999999e-002 | Z101: 65 | AA101: 2.27 | AB101: 3.9599999999999996e-002 | AC101: 3.2300000000000002e-002 | AD101: 1.43e-002 | AE101: 1.1899999999999999e-002 | AG101: 83.74 | AH101: 87.05 | AI101: 0.46 | AJ101: AA- | AK101: 6.6600000000000006e-002 | AL101: =H101+100*O101 -> 125. | AM101: 119.6 | AN101: 141 | AO101: 32.6 | AP101: 185 | AQ101: 1.2e-002 | AR101: 9 | AS101: 宝通转债!
A102: 144 | B102: 113578 | C102: 全筑转债! | D102: 603030 | E102: 全筑股份 | F102: 建筑 | G102: 装饰工程 | H102: 97.41 | I102: 3.0000000000000001e-003 | J102: -1.2999999999999999e-003 | K102: 4.43 | L102: 4.5000000000000005e-003 | M102: 118.3 | N102: 5.43 | O102: 0.19399999999999998 | P102: 81.58 | Q102: 转股中 | R102: 5年53天 | S102: 3年53天 | T102: =3+53/365 -> 3.1452054794520548 | U102: 3.84 | V102: 2.7 | W102: 6.9999999999999993e-003 | X102: 0.161 | Y102: 0.13100000000000001 | Z102: 24 | AA102: 1.07 | AB102: 3.9300000000000002e-002 | AC102: 3.27e-002 | AD102: 1.9599999999999999e-002 | AE102: 1.7299999999999999e-002 | AG102: 89.7 | AH102: 94.5 | AI102: 0.38 | AJ102: AA | AK102: 4.5599999999999995e-002 | AL102: =H102+100*O102 -> 116.81 | AM102: 113.2 | AN102: 73 | AO102: 18.7 | AP102: 45 | AQ102: 4.7e-002 | AR102: 18 | AS102: 全筑转债!
A103: 118 | B103: 123057 | C103: 美联转债! | D103: 300586 | E103: 美联新材 | F103: 化工 | G103: 橡胶塑料 | H103: 96.75 | I103: 4.6999999999999993e-003 | J103: -1.6000000000000001e-003 | K103: 7.7 | L103: 6.5000000000000006e-003 | M103: 118.2 | N103: 9.91 | O103: 0.245 | P103: 77.7 | Q103: 转股中 | R103: 5.34年 | S103: 3.34年 | T103: 3.34 | U103: 2.07 | V103: 9.4 | W103: 4.7e-002 | X103: 5.9000000000000004e-002 | Y103: 4.5999999999999999e-002 | Z103: 35 | AA103: 4.72 | AB103: 3.9100000000000003e-002 | AC103: 3.27e-002 | AD103: 2.1400000000000002e-002 | AE103: 1.9e-002 | AG103: 83.26 | AH103: 84.43 | AI103: 0.47 | AJ103: AA- | AK103: 6.6600000000000006e-002 | AL103: =H103+100*O103 -> 121.25 | AM103: 115.8 | AN103: 96 | AO103: 31.4 | AP103: 165 | AQ103: -5.0000000000000001e-003 | AR103: 14 | AS103: 美联转债!
A104: 43 | B104: 113608 | C104: 威派转债! | D104: 603956 | E104: 威派格 | F104: 机械装备 | G104: 专用设备 | H104: 98.56 | I104: -7.3000000000000001e-003 | J104: -2.2000000000000001e-003 | K104: 14.7 | L104: -1.8000000000000002e-002 | M104: 121.6 | N104: 19.24 | O104: 0.28999999999999998 | P104: 76.4 | Q104: 2月16天 | R104: 5.70年 | S104: 3.70年 | T104: 3.7 | U104: 4.2 | V104: 0.8 | W104: 2.e-003 | X104: 6.7000000000000004e-002 | Y104: 5.0999999999999997e-002 | Z104: 63 | AA104: 5.49 | AB104: 3.8399999999999997e-002 | AC104: 3.1600000000000003e-002 | AD104: 1.5700000000000002e-002 | AE104: 1.3300000000000001e-002 | AG104: 78.62 | AH104: 80.21 | AI104: 0.53 | AJ104: A+ | AK104: 7.7600000000000002e-002 | AL104: =H104+100*O104 -> 127.56 | AM104: 120.7 | AN104: 152 | AO104: 40.5 | AP104: 235 | AQ104: 8.0000000000000002e-003 | AR104: 6 | AS104: 威派转债!
A105: 190 | B105: 123039 | C105: 开润转债! | D105: 300577 | E105: 开润股份 | F105: 服装纺织 | G105: 纺织行业 | H105: 101.5 | I105: -4.0599999999999997e-002 | J105: 2.18e-002 | K105: 23.48 | L105: -4.0099999999999997e-002 | M105: 121 | N105: 30 | O105: 0.29699999999999999 | P105: 78.27 | Q105: 转股中 | R105: 4.83年 | S105: 2.83年 | T105: 2.83 | U105: 2.22 | V105: 13 | W105: 5.7000000000000002e-002 | X105: 3.9e-002 | Y105: 3.1e-002 | Z105: 56 | AA105: 6.12 | AB105: 3.7900000000000003e-002 | AC105: 2.9999999999999999e-002 | AD105: 8.5000000000000006e-003 | AE105: 5.7999999999999996e-003 | AG105: 83.75 | AH105: 85.58 | AI105: 0.47 | AJ105: A+ | AK105: 7.6100000000000001e-002 | AL105: =H105+100*O105 -> 131.19999999999999 | AM105: 124.7 | AN105: 182 | AO105: 39.1 | AP105: 228 | AQ105: 1.8000000000000002e-002 | AR105: 25 | AS105: 开润转债!
A106: 74 | B106: 123065 | C106: 宝莱转债! | D106: 300246 | E106: 宝莱特 | F106: 医药 | G106: 医疗器械 | H106: 99.371 | I106: 1.6e-002 | J106: -1.37e-002 | K106: 24.4 | L106: 9.1000000000000004e-003 | M106: 121.4 | N106: 40.54 | O106: 0.65099999999999991 | P106: 60.19 | Q106: 13天 | R106: 5.52年 | S106: 3.52年 | T106: 3.52 | U106: 2.19 | V106: 38 | W106: 0.17300000000000001 | X106: 6.0999999999999999e-002 | Y106: 3.7000000000000005e-002 | Z106: 36 | AA106: 4.28 | AB106: 3.78e-002 | AC106: 3.0800000000000001e-002 | AD106: 1.34e-002 | AE106: 1.11e-002 | AG106: 82.46 | AH106: 85.72 | AI106: 0.26 | AJ106: AA- | AK106: 6.6600000000000006e-002 | AL106: =H106+100*O106 -> 164.471 | AM106: 138.6 | AN106: 270 | AO106: 52.8 | AP106: 282 | AQ106: -3.1e-002 | AR106: 13 | AS106: 宝莱转债!
A107: 64 | B107: 123068 | C107: 弘信转债 | D107: 300657 | E107: 弘信电子 | F107: 电子 | G107: 元器件制 | H107: 98.8 | I107: 7.0999999999999995e-003 | J107: -2.9999999999999997e-004 | K107: 16.69 | L107: 1.15e-002 | M107: 121.2 | N107: 18.45 | O107: 9.1999999999999998e-002 | P107: 90.46 | Q107: 54天 | R107: 5.63年 | S107: 3.63年 | T107: 3.63 | U107: 5.7 | V107: 13 | W107: 2.3e-002 | X107: 0.10000000000000001 | Y107: 8.9999999999999997e-002 | Z107: 57 | AA107: 3.9 | AB107: 3.7699999999999997e-002 | AC107: 3.0899999999999997e-002 | AD107: 1.3999999999999999e-002 | AE107: 1.1899999999999999e-002 | AG107: 81.72 | AH107: 84.95 | AI107: 0.59 | AJ107: AA- | AK107: 6.6600000000000006e-002 | AL107: =H107+100*O107 -> 108. | AM107: 107.1 | AN107: 30 | AO107: 22.2 | AP107: 69 | AQ107: 4.4000000000000004e-002 | AR107: 6 | AS107: 弘信转债
A108: 162 | B108: 123047 | C108: 久吾转债 | D108: 300631 | E108: 久吾高科 | F108: 机械装备 | G108: 专用设备 | H108: 108.7 | I108: 1.9299999999999998e-002 | J108: 5.7999999999999996e-003 | K108: 16.59 | L108: 4.3400000000000001e-002 | M108: 130.1 | N108: 17.61 | O108: 0.154 | P108: 94.21 | Q108: 转股中 | R108: 5年22天 | S108: 3年22天 | T108: =3+22/365 -> 3.0602739726027397 | U108: 1.99 | V108: 34 | W108: 0.155 | X108: 0.11 | Y108: 0.10400000000000001 | Z108: 18 | AA108: 2.48 | AB108: 3.73e-002 | AC108: 2.7200000000000002e-002 | AD108: -7.6e-003 | AE108: -1.1200000000000002e-002 | AG108: 83.68 | AH108: 90.19 | AI108: 0.58 | AJ108: A+ | AK108: 7.7600000000000002e-002 | AL108: =H108+100*O108 -> 124.10000000000001 | AM108: 123.2 | AN108: 171 | AO108: 33 | AP108: 191 | AQ108: 3.7999999999999999e-002 | AR108: 23 | AS108: 久吾转债
A109: 249 | B109: 113532 | C109: 海环转债! | D109: 603817 | E109: 海峡环保 | F109: 城市公用 | G109: 三废处理 | H109: 97.72 | I109: 3.0000000000000001e-003 | J109: -8.9999999999999998e-004 | K109: 5.49 | L109: 9.1999999999999998e-003 | M109: 112.9 | N109: 7.69 | O109: 0.36899999999999999 | P109: 71.39 | Q109: 转股中 | R109: 4年35天 | S109: 2年35天 | T109: =2+35/365 -> 2.095890410958904 | U109: 4.6 | V109: 0.9 | W109: 2.e-003 | X109: 0.18600000000000003 | Y109: 0.13300000000000001 | Z109: 25 | AA109: 1.45 | AB109: 3.6699999999999997e-002 | AC109: 3.0600000000000002e-002 | AD109: 2.5600000000000001e-002 | AE109: 2.2499999999999999e-002 | AG109: 93.89 | AH109: 94.99 | AI109: 0.23 | AJ109: AA | AK109: 4.41e-002 | AL109: =H109+100*O109 -> 134.62 | AM109: 124 | AN109: 176 | AO109: 29.1 | AP109: 144 | AQ109: 1.7000000000000001e-002 | AR109: 26 | AS109: 海环转债!
A110: 21 | B110: 123085 | C110: 万顺转2! | D110: 300057 | E110: 万顺新材 | F110: 有色金属 | G110: 铝金属 | H110: 92.36 | I110: -1.8e-003 | J110: 1.8e-003 | K110: 4.77 | L110: 0. | M110: 113.3 | N110: 6.24 | O110: 0.20800000000000002 | P110: 76.44 | Q110: 3月21天 | R110: 5.79年 | S110: 3.79年 | T110: 3.79 | U110: 9 | V110: 8.3 | W110: 1.e-002 | X110: 0.28000000000000003 | Y110: 0.214 | Z110: 32 | AA110: 0.94 | AB110: 3.6600000000000001e-002 | AC110: 3.2199999999999999e-002 | AD110: 3.0200000000000001e-002 | AE110: 2.8300000000000002e-002 | AG110: 80.63 | AH110: 78.59 | AI110: 0.5 | AJ110: AA- | AK110: 6.6600000000000006e-002 | AL110: =H110+100*O110 -> 113.16 | AM110: 108.3 | AN110: 36 | AO110: 27.6 | AP110: 133 | AQ110: 6.4000000000000001e-002 | AR110: 7 | AS110: 万顺转2!
A111: 214 | B111: 127014 | C111: 北方转债! | D111: 65 | E111: 北方国际 | F111: 建筑 | G111: 建筑工程 | H111: 98.012 | I111: -8.9999999999999998e-004 | J111: 2.3e-003 | K111: 6.87 | L111: 4.4000000000000003e-003 | M111: 115.1 | N111: 8.75 | O111: 0.248 | P111: 78.51 | Q111: 转股中 | R111: 4.66年 | S111: 2.66年 | T111: 2.66 | U111: 5.78 | V111: 1.7 | W111: 3.0000000000000001e-003 | X111: 0.109 | Y111: 8.5999999999999993e-002 | Z111: 53 | AA111: 1 | AB111: 3.5900000000000001e-002 | AC111: 2.9700000000000001e-002 | AD111: 2.e-002 | AE111: 1.7500000000000002e-002 | AG111: 92.33 | AH111: 95.37 | AI111: 0.32 | AJ111: AA+ | AK111: 4.2099999999999999e-002 | AL111: =H111+100*O111 -> 122.812 | AM111: 117.5 | AN111: 113 | AO111: 22.1 | AP111: 68 | AQ111: 1.8000000000000002e-002 | AR111: 17 | AS111: 北方转债!
A112: 159 | B112: 113574 | C112: 华体转债! | D112: 603679 | E112: 华体科技 | F112: 城市公用 | G112: 城市公用 | H112: 97.7 | I112: 1.1000000000000001e-003 | J112: 4.4000000000000003e-003 | K112: 18.83 | L112: 3.1800000000000002e-002 | M112: 116.4 | N112: 33.99 | O112: 0.76400000000000001 | P112: 55.4 | Q112: 转股中 | R112: 5年33天 | S112: 3年33天 | T112: =3+33/365 -> 3.0904109589041098 | U112: 2.09 | V112: 1.6 | W112: 8.0000000000000002e-003 | X112: 7.8e-002 | Y112: 4.2999999999999997e-002 | Z112: 27 | AA112: 3.67 | AB112: 3.5900000000000001e-002 | AC112: 2.98e-002 | AD112: 2.1400000000000002e-002 | AE112: 1.8500000000000003e-002 | AG112: 82.26 | AH112: 80.39 | AI112: 0.17 | AJ112: A+ | AK112: 7.7600000000000002e-002 | AL112: =H112+100*O112 -> 174.10000000000002 | AM112: 140 | AN112: 272 | AO112: 57.7 | AP112: 295 | AQ112: 0. | AR112: 16 | AS112: 华体转债!
A113: 148 | B113: 123049 | C113: 维尔转债 | D113: 300190 | E113: 维尔利 | F113: 城市公用 | G113: 三废处理 | H113: 104.749 | I113: 4.6999999999999993e-003 | J113: 6.0000000000000001e-003 | K113: 7.18 | L113: 1.84e-002 | M113: 124.8 | N113: 7.48 | O113: 9.0999999999999998e-002 | P113: 95.99 | Q113: 转股中 | R113: 5年46天 | S113: 3年46天 | T113: =3+46/365 -> 3.1260273972602741 | U113: 9.17 | V113: 1.7 | W113: 2.e-003 | X113: 0.16300000000000001 | Y113: 0.157 | Z113: 56 | AA113: 1.33 | AB113: 3.5699999999999996e-002 | AC113: 2.7200000000000002e-002 | AD113: -1.e-004 | AE113: -2.8999999999999998e-003 | AG113: 84.95 | AH113: 90.45 | AI113: 0.58 | AJ113: AA- | AK113: 6.6600000000000006e-002 | AL113: =H113+100*O113 -> 113.84899999999999 | AM113: 113.5 | AN113: 74 | AO113: 23.1 | AP113: 80 | AQ113: 6.3e-002 | AR113: 15 | AS113: 维尔转债
A114: 83 | B114: 110074 | C114: 精达转债! | D114: 600577 | E114: 精达股份 | F114: 电子 | G114: 电子产品 | H114: 97.32 | I114: -8.1000000000000013e-003 | J114: -7.4999999999999997e-003 | K114: 3.36 | L114: -3.1699999999999999e-002 | M114: 117.3 | N114: 3.75 | O114: 8.5999999999999993e-002 | P114: 89.6 | Q114: 转股中 | R114: 5.48年 | S114: 3.48年 | T114: 3.48 | U114: 7.87 | V114: 10 | W114: 1.3000000000000001e-002 | X114: 0.122 | Y114: 0.109 | Z114: 65 | AA114: 1.83 | AB114: 3.5400000000000001e-002 | AC114: 2.9500000000000002e-002 | AD114: 1.8000000000000002e-002 | AE114: 1.5900000000000001e-002 | AG114: 88.38 | AH114: 92.33 | AI114: 0.49 | AJ114: AA | AK114: 4.5599999999999995e-002 | AL114: =H114+100*O114 -> 105.91999999999999 | AM114: 105 | AN114: 20 | AO114: 12.7 | AP114: 17 | AQ114: 0.13200000000000001 | AR114: 13 | AS114: 精达转债!
A115: 115 | B115: 113036 | C115: 宁建转债! | D115: 601789 | E115: 宁波建工 | F115: 建筑 | G115: 建筑工程 | H115: 98.17 | I115: -5.0000000000000001e-003 | J115: 5.0000000000000001e-003 | K115: 3.85 | L115: 0. | M115: 117.3 | N115: 4.86 | O115: 0.23899999999999999 | P115: 79.22 | Q115: 转股中 | R115: 5.36年 | S115: 3.36年 | T115: 3.36 | U115: 5.4 | V115: 0.3 | W115: 1.e-003 | X115: 0.14400000000000002 | Y115: 0.114 | Z115: 38 | AA115: 1.26 | AB115: 3.4500000000000003e-002 | AC115: 2.8500000000000001e-002 | AD115: 1.61e-002 | AE115: 1.3999999999999999e-002 | AG115: 88.86 | AH115: 92.83 | AI115: 0.36 | AJ115: AA | AK115: 4.5599999999999995e-002 | AL115: =H115+100*O115 -> 122.06999999999999 | AM115: 117.1 | AN115: 109 | AO115: 24.3 | AP115: 95 | AQ115: 4.9000000000000002e-002 | AR115: 8 | AS115: 宁建转债!
A116: 10 | B116: 123092 | C116: 天壕转债 | D116: 300332 | E116: 天壕环境 | F116: 石油天然 | G116: 天然气 | H116: 100.3 | I116: 0. | J116: 2.29e-002 | K116: 4.65 | L116: 3.56e-002 | M116: 121.6 | N116: 5.2 | O116: 0.122 | P116: 89.42 | Q116: 4月4天 | R116: 5.83年 | S116: 3.83年 | T116: 3.83 | U116: 4.23 | V116: 1.9 | W116: 5.0000000000000001e-003 | X116: 0.10300000000000001 | Y116: 9.1999999999999998e-002 | Z116: 41 | AA116: 1.19 | AB116: 3.44e-002 | AC116: 2.7699999999999999e-002 | AD116: 1.0700000000000001e-002 | AE116: 8.3999999999999995e-003 | AG116: 77.89 | AH116: 79.47 | AI116: 0.64 | AJ116: A+ | AK116: 7.7600000000000002e-002 | AL116: =H116+100*O116 -> 112.5 | AM116: 111.2 | AN116: 56 | AO116: 31.7 | AP116: 168 | AQ116: 5.2000000000000005e-002 | AR116: 5 | AS116: 天壕转债
A117: 330 | B117: 113014 | C117: 林洋转债! | D117: 601222 | E117: 林洋能源 | F117: 能源电力 | G117: 电力设备 | H117: 100.09 | I117: -8.6999999999999994e-003 | J117: 1.6000000000000001e-003 | K117: 7.28 | L117: -2.2799999999999997e-002 | M117: 109.3 | N117: 8.54 | O117: 0.17399999999999999 | P117: 85.25 | Q117: 转股中 | R117: 2.67年 | S117: 0.67年 | T117: 0.67 | U117: 30 | V117: 41 | W117: 1.3999999999999999e-002 | X117: 0.23600000000000002 | Y117: 0.20100000000000001 | Z117: 127 | AA117: 1.22 | AB117: 3.4200000000000001e-002 | AC117: 2.7300000000000001e-002 | AD117: 2.06e-002 | AE117: 1.6299999999999999e-002 | AG117: 98.38 | AH117: 98.13 | AI117: 0.31 | AJ117: AA | AK117: 4.2000000000000003e-002 | AL117: =H117+100*O117 -> 117.49000000000001 | AM117: 114.9 | AN117: 88 | AO117: 16.6 | AP117: 35 | AQ117: 1.e-003 | AR117: 28 | AS117: 林洋转债!
A118: 93 | B118: 123063 | C118: 大禹转债 | D118: 300021 | E118: 大禹节水 | F118: 化工 | G118: 橡胶塑料 | H118: 106.002 | I118: 1.6399999999999998e-002 | J118: -2.3999999999999998e-003 | K118: 5.11 | L118: 2.2000000000000002e-002 | M118: 126.5 | N118: 4.94 | O118: 2.5000000000000001e-002 | P118: 103.44 | Q118: 转股中 | R118: 5.42年 | S118: 4.42年 | T118: 4.42 | U118: 6.38 | V118: 37 | W118: 5.4000000000000006e-002 | X118: 0.157 | Y118: 0.16200000000000001 | Z118: 41 | AA118: 2.82 | AB118: 3.39e-002 | AC118: 2.5499999999999998e-002 | AD118: 2.0999999999999999e-003 | AE118: -8.0000000000000004e-004 | AG118: 80.06 | AH118: 89.9 | AI118: 0.64 | AJ118: AA- | AK118: 6.6600000000000006e-002 | AL118: =H118+100*O118 -> 108.502 | AM118: 108.6 | AN118: 38 | AO118: 18.7 | AP118: 44 | AQ118: 6.5000000000000002e-002 | AR118: 16 | AS118: 大禹转债
A119: 165 | B119: 123045 | C119: 雷迪转债 | D119: 300652 | E119: 雷迪克 | F119: 汽车 | G119: 零部件制 | H119: 101.4 | I119: 8.5000000000000006e-003 | J119: -1.2800000000000001e-002 | K119: 17.66 | L119: -7.3000000000000001e-003 | M119: 119.4 | N119: 20.13 | O119: 0.156 | P119: 87.73 | Q119: 转股中 | R119: 5年14天 | S119: 3年14天 | T119: =3+14/365 -> 3.0383561643835617 | U119: 1.66 | V119: 17 | W119: 0.10000000000000001 | X119: 0.10000000000000001 | Y119: 8.8000000000000009e-002 | Z119: 17 | AA119: 1.95 | AB119: 3.3799999999999997e-002 | AC119: 2.6800000000000001e-002 | AD119: 9.7999999999999997e-003 | AE119: 6.9999999999999993e-003 | AG119: 82.58 | AH119: 82.76 | AI119: 0.59 | AJ119: A+ | AK119: 7.7600000000000002e-002 | AL119: =H119+100*O119 -> 117. | AM119: 115.1 | AN119: 90 | AO119: 32.3 | AP119: 180 | AQ119: 6.5000000000000002e-002 | AR119: 34 | AS119: 雷迪转债
A120: 158 | B120: 113033 | C120: 利群转债! | D120: 601366 | E120: 利群股份 | F120: 商业零售 | G120: 商场 | H120: 97.81 | I120: 4.3e-003 | J120: -2.0000000000000001e-004 | K120: 6.61 | L120: 7.6e-003 | M120: 115.3 | N120: 7.01 | O120: 3.7000000000000005e-002 | P120: 94.29 | Q120: 转股中 | R120: 5年34天 | S120: 3年34天 | T120: =3+34/365 -> 3.0931506849315067 | U120: 18 | V120: 17 | W120: 1.e-002 | X120: 0.316 | Y120: 0.29799999999999999 | Z120: 57 | AA120: 1.28 | AB120: 3.3599999999999998e-002 | AC120: 2.7900000000000001e-002 | AD120: 1.8600000000000002e-002 | AE120: 1.6299999999999999e-002 | AG120: 89.91 | AH120: 92.33 | AI120: 0.54 | AJ120: AA | AK120: 4.5599999999999995e-002 | AL120: =H120+100*O120 -> 101.51000000000001 | AM120: 101.3 | AN120: 9 | AO120: 9 | AP120: 7 | AQ120: -5.0000000000000001e-003 | AR120: 43 | AS120: 利群转债!
A121: 327 | B121: 128018 | C121: 时达转债!! | D121: 2527 | E121: 新时达 | F121: 机械装备 | G121: 机器人及 | H121: 100.256 | I121: -2.9999999999999997e-004 | J121: 9.4999999999999998e-003 | K121: 5.75 | L121: 4.5499999999999999e-002 | M121: 109.3 | N121: 7.42 | O121: 0.29399999999999998 | P121: 77.49 | Q121: 转股中 | R121: 2.69年 | S121: 回售内 | U121: 8.79 | V121: 61 | W121: 6.9000000000000006e-002 | X121: 0.24600000000000002 | Y121: 0.191 | Z121: 36 | AA121: 1.4 | AB121: 3.32e-002 | AC121: 2.64e-002 | AD121: 回售内 | AE121: 回售内 | AG121: 100.43 | AH121: 98.02 | AI121: 0.2 | AJ121: AA | AK121: 4.2000000000000003e-002 | AL121: =H121+100*O121 -> 129.65600000000001 | AM121: 123 | AN121: 170 | AO121: 22.6 | AP121: 75 | AQ121: 6.0999999999999999e-002 | AR121: 40 | AS121: 时达转债!!
A122: 161 | B122: 110068 | C122: 龙净转债! | D122: 600388 | E122: 龙净环保 | F122: 城市公用 | G122: 三废处理 | H122: 97.8 | I122: 1.4199999999999999e-002 | J122: -1.0500000000000001e-002 | K122: 8.86 | L122: 9.1000000000000004e-003 | M122: 115 | N122: 10.73 | O122: 0.184 | P122: 82.57 | Q122: 转股中 | R122: 5年26天 | S122: 3年26天 | T122: =3+26/365 -> 3.0712328767123287 | U122: 20 | V122: 22 | W122: 1.1000000000000001e-002 | X122: 0.21100000000000002 | Y122: 0.17399999999999999 | Z122: 95 | AA122: 1.64 | AB122: 3.3099999999999997e-002 | AC122: 2.75e-002 | AD122: 1.78e-002 | AE122: 1.5600000000000001e-002 | AG122: 90.25 | AH122: 93 | AI122: 0.4 | AJ122: AA+ | AK122: 4.36e-002 | AL122: =H122+100*O122 -> 116.19999999999999 | AM122: 113 | AN122: 71 | AO122: 20 | AP122: 56 | AQ122: 4.2999999999999997e-002 | AR122: 31 | AS122: 龙净转债!
A123: 120 | B123: 128116 | C123: 瑞达转债! | D123: 2961 | E123: 瑞达期货 | F123: 金融 | G123: 期货行业 | H123: 97.26 | I123: 3.0000000000000001e-003 | J123: -5.1999999999999998e-003 | K123: 22.75 | L123: -6.0999999999999995e-003 | M123: 115.3 | N123: 29.82 | O123: 0.27500000000000002 | P123: 76.29 | Q123: 转股中 | R123: 5.34年 | S123: 3.34年 | T123: 3.34 | U123: 6.5 | V123: 4.9 | W123: 8.0000000000000002e-003 | X123: 6.4000000000000001e-002 | Y123: 4.9000000000000002e-002 | Z123: 101 | AA123: 5.76 | AB123: 3.3099999999999997e-002 | AC123: 2.7699999999999999e-002 | AD123: 1.8700000000000001e-002 | AE123: 1.66e-002 | AG123: 88.85 | AH123: 91.32 | AI123: 0.36 | AJ123: AA | AK123: 4.5599999999999995e-002 | AL123: =H123+100*O123 -> 124.76000000000001 | AM123: 118.2 | AN123: 121 | AO123: 26.9 | AP123: 123 | AQ123: 5.2000000000000005e-002 | AR123: 17 | AS123: 瑞达转债!
A124: 154 | B124: 128105 | C124: 长集转债 | D124: 2616. | E124: 长青集团 | F124: 城市公用 | G124: 三废处理 | H124: 98 | I124: 6.3e-003 | J124: -2.0000000000000001e-004 | K124: 7.17 | L124: 1.2699999999999999e-002 | M124: 115.3 | N124: 8.11 | O124: 0.10800000000000001 | P124: 88.41 | Q124: 转股中 | R124: 5年42天 | S124: 3年42天 | T124: =3+42/365 -> 3.1150684931506851 | U124: 8 | V124: 6.4 | W124: 8.0000000000000002e-003 | X124: 0.14999999999999999 | Y124: 0.13300000000000001 | Z124: 53 | AA124: 2.11 | AB124: 3.3000000000000002e-002 | AC124: 2.7400000000000001e-002 | AD124: 1.7899999999999999e-002 | AE124: 1.55e-002 | AG124: 89.82 | AH124: 92.24 | AI124: 0.48 | AJ124: AA | AK124: 4.5599999999999995e-002 | AL124: =H124+100*O124 -> 108.8 | AM124: 107.6 | AN124: 33 | AO124: 15.4 | AP124: 29 | AQ124: 4.2999999999999997e-002 | AR124: 14 | AS124: 长集转债
A125: 174 | B125: 113567 | C125: 君禾转债! | D125: 603617 | E125: 君禾股份 | F125: 机械装备 | G125: 通用设备 | H125: 102 | I125: -1.26e-002 | J125: -1.83e-002 | K125: 10.22 | L125: -5.1100000000000007e-002 | M125: 119.3 | N125: 11.46 | O125: 0.14400000000000002 | P125: 89.18 | Q125: 转股中 | R125: 5年6.6天 | S125: 3年6.6天 | T125: =3+6.6/365 -> 3.018082191780822 | U125: 2.1 | V125: 5.3 | W125: 2.5000000000000001e-002 | X125: 0.10300000000000001 | Y125: 9.1999999999999998e-002 | Z125: 20 | AA125: 3.16 | AB125: 3.2599999999999997e-002 | AC125: 2.5499999999999998e-002 | AD125: 7.6e-003 | AE125: 4.8999999999999998e-003 | AG125: 82.65 | AH125: 82.83 | AI125: 0.61 | AJ125: A+ | AK125: 7.7600000000000002e-002 | AL125: =H125+100*O125 -> 116.40000000000001 | AM125: 114.8 | AN125: 85 | AO125: 32 | AP125: 173 | AQ125: 6.5000000000000002e-002 | AR125: 36 | AS125: 君禾转债!
A126: 2 | B126: 123097 | C126: 美力转债 | D126: 300611 | E126: 美力科技 | F126: 机械装备 | G126: 通用设备 | H126: 101.001 | I126: -3.0000000000000001e-003 | J126: 1.37e-002 | K126: 9.11 | L126: 1.5600000000000001e-002 | M126: 121.6 | N126: 9.34 | O126: 3.6000000000000004e-002 | P126: 97.54 | Q126: 5月7天 | R126: 5.92年 | S126: 3.92年 | T126: 3.92 | U126: 3 | V126: 164 | W126: 0.53799999999999992 | X126: 0.184 | Y126: 0.17899999999999999 | Z126: 16 | AA126: 2.53 | AB126: 3.2599999999999997e-002 | AC126: 2.6000000000000002e-002 | AD126: 8.6999999999999994e-003 | AE126: 6.5000000000000006e-003 | AG126: 77.35 | AH126: 78.92 | AI126: 0.69 | AJ126: A+ | AK126: 7.7600000000000002e-002 | AL126: =H126+100*O126 -> 104.601 | AM126: 104.5 | AN126: 18 | AO126: 25.5 | AP126: 109 | AQ126: 5.4000000000000006e-002 | AR126: 1 | AS126: 美力转债
A127: 4 | B127: 113042 | C127: 上银转债! | D127: 601229 | E127: 上海银行 | F127: 金融 | G127: 银行行业 | H127: 100.65 | I127: -2.3999999999999998e-003 | J127: -7.4000000000000003e-003 | K127: 8.38 | L127: -3.0099999999999998e-002 | M127: 120.9 | N127: 11.03 | O127: 0.32500000000000001 | P127: 75.97 | Q127: 5月3天 | R127: 5.91年 | S127: 无权 | U127: 200 | V127: 575 | W127: 2.8999999999999998e-002 | X127: 0.16800000000000001 | Y127: 0.128 | Z127: 1191. | AA127: 0.71 | AB127: 3.2400000000000005e-002 | AC127: 2.5899999999999999e-002 | AD127: 无权 | AE127: 无权 | AG127: 无权 | AH127: 96.15 | AI127: 0.33 | AJ127: AAA | AK127: 4.0599999999999997e-002 | AL127: =H127+100*O127 -> 133.15000000000001 | AM127: 125.3 | AN127: 188 | AO127: 29.2 | AP127: 145 | AQ127: 0. | AR127: 8 | AS127: 上银转债!
A128: 50 | B128: 123075 | C128: 贝斯转债! | D128: 300580 | E128: 贝斯特 | F128: 汽车 | G128: 零部件制 | H128: 96.759 | I128: -1.77e-002 | J128: 8.8000000000000005e-003 | K128: 17.71 | L128: -1.8799999999999997e-002 | M128: 115.5 | N128: 23.99 | O128: 0.311 | P128: 73.82 | Q128: 2月9天 | R128: 5.68年 | S128: 3.68年 | T128: 3.68 | U128: 6 | V128: 9.1 | W128: 1.4999999999999999e-002 | X128: 0.16899999999999998 | Y128: 0.125 | Z128: 35 | AA128: 2.2 | AB128: 3.2300000000000002e-002 | AC128: 2.7200000000000002e-002 | AD128: 1.8700000000000001e-002 | AE128: 1.67e-002 | AG128: 81.21 | AH128: 80.67 | AI128: 0.47 | AJ128: AA- | AK128: 6.6600000000000006e-002 | AL128: =H128+100*O128 -> 127.85900000000001 | AM128: 119.7 | AN128: 143 | AO128: 38.5 | AP128: 226 | AQ128: -2.7999999999999997e-002 | AR128: 7 | AS128: 贝斯转债!
A129: 213 | B129: 110059 | C129: 浦发转债! | D129: 600000 | E129: 浦发银行 | F129: 金融 | G129: 银行行业 | H129: 101.85 | I129: -1.7000000000000001e-003 | J129: -4.0000000000000001e-003 | K129: 10.54 | L129: -2.41e-002 | M129: 117.6 | N129: 14.45 | O129: 0.39600000000000002 | P129: 72.94 | Q129: 转股中 | R129: 4.67年 | S129: 无权 | U129: 500 | V129: 212 | W129: 4.0000000000000001e-003 | X129: 0.16200000000000001 | Y129: 0.11800000000000001 | Z129: 3094. | AA129: 0.61 | AB129: 3.2199999999999999e-002 | AC129: 2.52e-002 | AD129: 无权 | AE129: 无权 | AG129: 无权 | AH129: 98.82 | AI129: 0.24 | AJ129: AAA | AK129: 3.9100000000000003e-002 | AL129: =H129+100*O129 -> 141.44999999999999 | AM129: 130.8 | AN129: 225 | AO129: 31.9 | AP129: 170 | AQ129: 1.7000000000000001e-002 | AR129: 73 | AS129: 浦发转债!
A130: 70 | B130: 123067 | C130: 斯莱转债 | D130: 300382 | E130: 斯莱克 | F130: 机械装备 | G130: 专用设备 | H130: 102.066 | I130: 1.7600000000000001e-002 | J130: -2.2400000000000003e-002 | K130: 8.11 | L130: -8.6e-003 | M130: 121.2 | N130: 9.38 | O130: 0.17999999999999999 | P130: 86.46 | Q130: 25天 | R130: 5.56年 | S130: 3.56年 | T130: 3.56 | U130: 3.88 | V130: 4.7 | W130: 1.2e-002 | X130: 8.5000000000000006e-002 | Y130: 7.2999999999999995e-002 | Z130: 46 | AA130: 4.49 | AB130: 3.2099999999999997e-002 | AC130: 2.53e-002 | AD130: 5.4000000000000003e-003 | AE130: 3.2000000000000002e-003 | AG130: 82.12 | AH130: 85.37 | AI130: 0.56 | AJ130: AA- | AK130: 6.6600000000000006e-002 | AL130: =H130+100*O130 -> 120.066 | AM130: 117.7 | AN130: 116 | AO130: 32.3 | AP130: 179 | AQ130: -5.2999999999999999e-002 | AR130: 13 | AS130: 斯莱转债
A131: 257 | B131: 110056 | C131: 亨通转债! | D131: 600487 | E131: 亨通光电 | F131: 通信互联 | G131: 通信设备 | H131: 101.33 | I131: 4.3e-003 | J131: -2.8000000000000004e-003 | K131: 12.83 | L131: 3.9000000000000003e-003 | M131: 114.8 | N131: 15.01 | O131: 0.185 | P131: 85.48 | Q131: 转股中 | R131: 4年21天 | S131: 2年21天 | T131: =2+21/365 -> 2.0575342465753423 | U131: 17.1 | V131: 17 | W131: 1.e-002 | X131: 5.5999999999999994e-002 | Y131: 4.8000000000000001e-002 | Z131: 303 | AA131: 1.66 | AB131: 3.1899999999999998e-002 | AC131: 2.5099999999999997e-002 | AD131: 8.8000000000000005e-003 | AE131: 5.7999999999999996e-003 | AG131: 94.34 | AH131: 97.46 | AI131: 0.36 | AJ131: AA+ | AK131: 4.2099999999999999e-002 | AL131: =H131+100*O131 -> 119.83 | AM131: 117.2 | AN131: 111 | AO131: 19.7 | AP131: 53 | AQ131: 2.7999999999999997e-002 | AR131: 31 | AS131: 亨通转债!
A132: 264 | B132: 113021 | C132: 中信转债! | D132: 601998 | E132: 中信银行 | F132: 金融 | G132: 银行行业 | H132: 105.21 | I132: -1.1000000000000001e-003 | J132: -4.0999999999999995e-003 | K132: 5.23 | L132: -2.4300000000000002e-002 | M132: 118.8 | N132: 6.98 | O132: 0.40399999999999997 | P132: 74.93 | Q132: 转股中 | R132: 4年6.6天 | S132: 无权 | U132: 400 | V132: 66 | W132: 2.e-003 | X132: 0.156 | Y132: 0.11699999999999999 | Z132: 2559. | AA132: 0.56 | AB132: 3.1800000000000002e-002 | AC132: 2.3099999999999999e-002 | AD132: 无权 | AE132: 无权 | AG132: 无权 | AH132: 102.36 | AI132: 0.22 | AJ132: AAA | AK132: 3.9100000000000003e-002 | AL132: =H132+100*O132 -> 145.60999999999999 | AM132: 135.5 | AN132: 250 | AO132: 33.1 | AP132: 193 | AQ132: -6.0000000000000001e-003 | AR132: 50 | AS132: 中信转债!
A133: 156 | B133: 127016 | C133: 鲁泰转债! | D133: 726 | E133: 鲁 泰Ａ | F133: 服装纺织 | G133: 纺织行业 | H133: 99.302 | I133: 0. | J133: 8.8999999999999999e-003 | K133: 6.6 | L133: 3.1300000000000001e-002 | M133: 116.2 | N133: 8.91 | O133: 0.34100000000000003 | P133: 74.07 | Q133: 转股中 | R133: 5年42天 | S133: 3年42天 | T133: =3+42/365 -> 3.1150684931506851 | U133: 14 | V133: 3 | W133: 2.e-003 | X133: 0.247 | Y133: 0.183 | Z133: 57 | AA133: 0.74 | AB133: 3.1800000000000002e-002 | AC133: 2.5899999999999999e-002 | AD133: 1.34e-002 | AE133: 1.1200000000000002e-002 | AG133: 90.28 | AH133: 93.83 | AI133: 0.29 | AJ133: AA+ | AK133: 4.36e-002 | AL133: =H133+100*O133 -> 133.40200000000002 | AM133: 124.5 | AN133: 179 | AO133: 30.7 | AP133: 161 | AQ133: 5.9000000000000004e-002 | AR133: 22 | AS133: 鲁泰转债!
A134: 27 | B134: 127026 | C134: 超声转债! | D134: 823 | E134: 超声电子 | F134: 电子 | G134: 元器件制 | H134: 94.703 | I134: 1.1000000000000001e-003 | J134: -2.9999999999999997e-004 | K134: 9.9 | L134: 2.e-003 | M134: 113.1 | N134: 12.85 | O134: 0.22899999999999998 | P134: 77.04 | Q134: 3月18天 | R134: 5.78年 | S134: 3.78年 | T134: 3.78 | U134: 7 | V134: 6.2 | W134: 9.0000000000000011e-003 | X134: 0.13200000000000001 | Y134: 0.10099999999999999 | Z134: 53 | AA134: 1.45 | AB134: 3.1800000000000002e-002 | AC134: 2.7400000000000001e-002 | AD134: 2.3199999999999998e-002 | AE134: 2.1299999999999999e-002 | AG134: 87 | AH134: 87.81 | AI134: 0.4 | AJ134: AA | AK134: 4.5599999999999995e-002 | AL134: =H134+100*O134 -> 117.60300000000001 | AM134: 112.4 | AN134: 66 | AO134: 24.6 | AP134: 97 | AQ134: 9.0000000000000011e-003 | AR134: 6 | AS134: 超声转债!
A135: 30 | B135: 123082 | C135: 北陆转债! | D135: 300016 | E135: 北陆药业 | F135: 医药 | G135: 化学制药 | H135: 102.05 | I135: -5.0000000000000001e-004 | J135: -2.e-003 | K135: 8.44 | L135: -3.4999999999999996e-003 | M135: 121.7 | N135: 8.86 | O135: 7.0999999999999994e-002 | P135: 95.26 | Q135: 3月15天 | R135: 5.78年 | S135: 3.78年 | T135: 3.78 | U135: 5 | V135: 4 | W135: 8.0000000000000002e-003 | X135: 0.12 | Y135: 0.114 | Z135: 42 | AA135: 2.63 | AB135: 3.1600000000000003e-002 | AC135: 2.4900000000000002e-002 | AD135: 6.4000000000000003e-003 | AE135: 4.0999999999999995e-003 | AG135: 78.18 | AH135: 79.82 | AI135: 0.68 | AJ135: A+ | AK135: 7.7600000000000002e-002 | AL135: =H135+100*O135 -> 109.14999999999999 | AM135: 108.8 | AN135: 39 | AO135: 29 | AP135: 143 | AQ135: -1.2e-002 | AR135: 7 | AS135: 北陆转债!
A136: 18 | B136: 123087 | C136: 明电转债! | D136: 300739 | E136: 明阳电路 | F136: 电子 | G136: 元器件制 | H136: 102.002 | I136: 4.8999999999999998e-003 | J136: -1.7000000000000001e-003 | K136: 15.79 | L136: 5.1000000000000004e-003 | M136: 121.2 | N136: 16.62 | O136: 7.400000000000001e-002 | P136: 95.01 | Q136: 3月25天 | R136: 5.80年 | S136: 4.80年 | T136: 4.8 | U136: 6.73 | V136: 14 | W136: 2.e-002 | X136: 0.153 | Y136: 0.14499999999999999 | Z136: 44 | AA136: 3.21 | AB136: 3.0800000000000001e-002 | AC136: 2.4300000000000002e-002 | AD136: 9.300000000000001e-003 | AE136: 6.6e-003 | AG136: 77.88 | AH136: 84.04 | AI136: 0.64 | AJ136: AA- | AK136: 6.6600000000000006e-002 | AL136: =H136+100*O136 -> 109.402 | AM136: 109 | AN136: 41 | AO136: 25 | AP136: 103 | AQ136: -6.0000000000000001e-003 | AR136: 5 | AS136: 明电转债!
A137: 73 | B137: 128131 | C137: 崇达转2! | D137: 2815 | E137: 崇达技术 | F137: 电子 | G137: 元器件制 | H137: 97.78 | I137: -2.0000000000000001e-004 | J137: 3.0000000000000001e-003 | K137: 13.06 | L137: 1.1599999999999999e-002 | M137: 115.2 | N137: 19.54 | O137: 0.46299999999999997 | P137: 66.84 | Q137: 13天 | R137: 5.53年 | S137: 3.53年 | T137: 3.53 | U137: 14 | V137: 3.5 | W137: 3.0000000000000001e-003 | X137: 0.121 | Y137: 8.1000000000000003e-002 | Z137: 115 | AA137: 2.88 | AB137: 3.0699999999999998e-002 | AC137: 2.5499999999999998e-002 | AD137: 1.6200000000000003e-002 | AE137: 1.4199999999999999e-002 | AG137: 88.08 | AH137: 90.45 | AI137: 0.24 | AJ137: AA | AK137: 4.5599999999999995e-002 | AL137: =H137+100*O137 -> 144.07999999999998 | AM137: 128.7 | AN137: 214 | AO137: 38.3 | AP137: 225 | AQ137: 4.2999999999999997e-002 | AR137: 6 | AS137: 崇达转2!
A138: 192 | B138: 113030 | C138: 东风转债! | D138: 601515 | E138: 东风股份 | F138: 造纸包装 | G138: 包装材料 | H138: 101.41 | I138: -3.4000000000000002e-003 | J138: -6.5000000000000006e-003 | K138: 5.67 | L138: -2.58e-002 | M138: 116.9 | N138: 6.75 | O138: 0.20699999999999999 | P138: 84 | Q138: 转股中 | R138: 4.83年 | S138: 2.83年 | T138: 2.83 | U138: 2.95 | V138: 5.2 | W138: 1.7000000000000001e-002 | X138: 3.9e-002 | Y138: 3.3000000000000002e-002 | Z138: 76 | AA138: 1.82 | AB138: 3.0499999999999999e-002 | AC138: 2.4e-002 | AD138: 6.6e-003 | AE138: 4.3e-003 | AG138: 90.98 | AH138: 95.29 | AI138: 0.39 | AJ138: AA | AK138: 4.41e-002 | AL138: =H138+100*O138 -> 122.11 | AM138: 118.8 | AN138: 129 | AO138: 23.5 | AP138: 88 | AQ138: -2.4e-002 | AR138: 17 | AS138: 东风转债!
A139: 86 | B139: 127021 | C139: 特发转2! | D139: 70 | E139: 特发信息 | F139: 通信互联 | G139: 通信设备 | H139: 99.299 | I139: -1.e-003 | J139: 1.5e-003 | K139: 7.49 | L139: 4.0000000000000001e-003 | M139: 113.3 | N139: 12.33 | O139: 0.63500000000000001 | P139: 60.75 | Q139: 转股中 | R139: 4.45年 | S139: 2.45年 | T139: 2.45 | U139: 5.5 | V139: 3.1 | W139: 6.0000000000000001e-003 | X139: 8.9999999999999997e-002 | Y139: 5.5e-002 | Z139: 61 | AA139: 2.16 | AB139: 3.0499999999999999e-002 | AC139: 2.4900000000000002e-002 | AD139: 1.06e-002 | AE139: 9.0000000000000011e-003 | AG139: 91.23 | AH139: 93.75 | AI139: 0.13 | AJ139: AA | AK139: 4.41e-002 | AL139: =H139+100*O139 -> 162.79900000000001 | AM139: 137.9 | AN139: 262 | AO139: 44.1 | AP139: 249 | AQ139: 5.0000000000000001e-003 | AR139: 9 | AS139: 特发转2!
A140: 204 | B140: 128081 | C140: 海亮转债! | D140: 2203 | E140: 海亮股份 | F140: 有色金属 | G140: 铜金属 | H140: 99.997 | I140: -2.0000000000000001e-004 | J140: -6.4000000000000003e-003 | K140: 9.06 | L140: -1.3100000000000001e-002 | M140: 114.9 | N140: 9.76 | O140: 7.6999999999999999e-002 | P140: 92.83 | Q140: 转股中 | R140: 4.74年 | S140: 2.74年 | T140: 2.74 | U140: 31.5 | V140: 3.8 | W140: 1.e-003 | X140: 0.17800000000000002 | Y140: 0.16500000000000001 | Z140: 177 | AA140: 1.96 | AB140: 3.04e-002 | AC140: 2.4500000000000001e-002 | AD140: 1.1699999999999999e-002 | AE140: 9.3999999999999986e-003 | AG140: 91.34 | AH140: 94.04 | AI140: 0.51 | AJ140: AA | AK140: 4.41e-002 | AL140: =H140+100*O140 -> 107.697 | AM140: 107.2 | AN140: 31 | AO140: 13.1 | AP140: 18 | AQ140: 7.8e-002 | AR140: 51 | AS140: 海亮转债!
A141: 29 | B141: 128140 | C141: 润建转债! | D141: 2929 | E141: 润建股份 | F141: 通信互联 | G141: 通信设备 | H141: 97.3 | I141: 4.3e-003 | J141: 4.4000000000000003e-003 | K141: 24.18 | L141: 1.6e-002 | M141: 115.2 | N141: 26.55 | O141: 6.8000000000000005e-002 | P141: 91.07 | Q141: 3月15天 | R141: 5.78年 | S141: 3.78年 | T141: 3.78 | U141: 10.9 | V141: 3.2 | W141: 3.0000000000000001e-003 | X141: 0.20399999999999999 | Y141: 0.18600000000000003 | Z141: 53 | AA141: 1.8 | AB141: 3.0200000000000001e-002 | AC141: 2.53e-002 | AD141: 1.6399999999999998e-002 | AE141: 1.4499999999999999e-002 | AG141: 87.11 | AH141: 89.45 | AI141: 0.54 | AJ141: AA | AK141: 4.5599999999999995e-002 | AL141: =H141+100*O141 -> 104.09999999999999 | AM141: 103.5 | AN141: 14 | AO141: 14.1 | AP141: 24 | AQ141: 5.2999999999999999e-002 | AR141: 9 | AS141: 润建转债!
A142: 178 | B142: 113565 | C142: XD宏辉转 | D142: 603336 | E142: 宏辉果蔬 | F142: 农业 | G142: 农产品加 | H142: 102.3 | I142: -9.1000000000000004e-003 | J142: 9.1000000000000004e-003 | K142: 9.5 | L142: 0. | M142: 118.2 | N142: 10 | O142: 7.6999999999999999e-002 | P142: 95 | Q142: 转股中 | R142: 5年0.6天 | S142: 3年0.6天 | T142: =3+0.6/365 -> 3.0016438356164383 | U142: 2.25 | V142: 56 | W142: 0.24199999999999999 | X142: 7.0000000000000007e-002 | Y142: 6.7000000000000004e-002 | Z142: 32 | AA142: 3.37 | AB142: 2.9999999999999999e-002 | AC142: 2.3399999999999997e-002 | AD142: 5.6999999999999993e-003 | AE142: 3.0999999999999999e-003 | AG142: 84.74 | AH142: 86.32 | AI142: 0.62 | AJ142: AA- | AK142: 6.6600000000000006e-002 | AL142: =H142+100*O142 -> 110. | AM142: 109.6 | AN142: 44 | AO142: 23.3 | AP142: 83 | AQ142: -6.9999999999999993e-003 | AR142: 24 | AS142: XD宏辉转
A143: 106 | B143: 113593 | C143: 沪工转债 | D143: 603131 | E143: 上海沪工 | F143: 机械装备 | G143: 通用设备 | H143: 104.06 | I143: 1.1999999999999999e-003 | J143: 5.0000000000000001e-004 | K143: 20.05 | L143: 2.5000000000000001e-003 | M143: 121.6 | N143: 21.32 | O143: 0.107 | P143: 94.04 | Q143: 转股中 | R143: 5.40年 | S143: 3.40年 | T143: 3.4 | U143: 4 | V143: 4.2 | W143: 1.e-002 | X143: 6.3e-002 | Y143: 5.9000000000000004e-002 | Z143: 64 | AA143: 5.17 | AB143: 2.9999999999999999e-002 | AC143: 2.2799999999999997e-002 | AD143: 1.5e-003 | AE143: -1.e-003 | AG143: 80.41 | AH143: 82.04 | AI143: 0.65 | AJ143: A+ | AK143: 7.7600000000000002e-002 | AL143: =H143+100*O143 -> 114.76000000000001 | AM143: 114.1 | AN143: 78 | AO143: 32 | AP143: 174 | AQ143: -5.5e-002 | AR143: 9 | AS143: 沪工转债
A144: 134 | B144: 113584 | C144: 家悦转债! | D144: 603708 | E144: 家家悦 | F144: 商业零售 | G144: 超市 | H144: 99.2 | I144: 9.4999999999999998e-003 | J144: -1.5700000000000002e-002 | K144: 21.52 | L144: -5.3699999999999998e-002 | M144: 115.3 | N144: 37.97 | O144: 0.75 | P144: 56.68 | Q144: 转股中 | R144: 5.27年 | S144: 3.27年 | T144: 3.27 | U144: 6.45 | V144: 3.2 | W144: 5.0000000000000001e-003 | X144: 4.9000000000000002e-002 | Y144: 2.7999999999999997e-002 | Z144: 131 | AA144: 4.36 | AB144: 2.9600000000000001e-002 | AC144: 2.41e-002 | AD144: 1.34e-002 | AE144: 1.1200000000000002e-002 | AG144: 89.2 | AH144: 91.6 | AI144: 0.12 | AJ144: AA | AK144: 4.5599999999999995e-002 | AL144: =H144+100*O144 -> 174.19999999999999 | AM144: 141.7 | AN144: 279 | AO144: 50.1 | AP144: 273 | AQ144: 1.6e-002 | AR144: 8 | AS144: 家悦转债!
A145: 133 | B145: 123052 | C145: 飞鹿转债 | D145: 300665 | E145: 飞鹿股份 | F145: 化工 | G145: 化工 | H145: 109.6 | I145: 1.7600000000000001e-002 | J145: -7.9000000000000008e-003 | K145: 10.24 | L145: 1.49e-002 | M145: 127.3 | N145: 9.9 | O145: 5.9999999999999998e-002 | P145: 103.43 | Q145: 转股中 | R145: 5.27年 | S145: 3.27年 | T145: 3.27 | U145: 1.77 | V145: 61 | W145: 0.313 | X145: 0.14199999999999999 | Y145: 0.14699999999999999 | Z145: 12 | AA145: 2.64 | AB145: 2.9600000000000001e-002 | AC145: 2.07e-002 | AD145: -1.2e-002 | AE145: -1.4800000000000001e-002 | AG145: 81.7 | AH145: 86.77 | AI145: 0.66 | AJ145: A+ | AK145: 7.7600000000000002e-002 | AL145: =H145+100*O145 -> 115.59999999999999 | AM145: 115.8 | AN145: 95 | AO145: 29 | AP145: 142 | AQ145: 4.4999999999999998e-002 | AR145: 15 | AS145: 飞鹿转债
A146: 124 | B146: 123056 | C146: 雪榕转债 | D146: 300511 | E146: 雪榕生物 | F146: 农业 | G146: 种植业 | H146: 104 | I146: -1.8100000000000002e-002 | J146: 3.8300000000000001e-002 | K146: 11.29 | L146: 3.2899999999999999e-002 | M146: 121.1 | N146: 11.89 | O146: 9.5000000000000001e-002 | P146: 94.95 | Q146: 转股中 | R146: 5.32年 | S146: 3.32年 | T146: 3.32 | U146: 5.85 | V146: 45 | W146: 7.2000000000000008e-002 | X146: 0.11699999999999999 | Y146: 0.111 | Z146: 50 | AA146: 2.6 | AB146: 2.9600000000000001e-002 | AC146: 2.2599999999999999e-002 | AD146: 0. | AE146: -2.2000000000000001e-003 | AG146: 83.27 | AH146: 86.57 | AI146: 0.61 | AJ146: AA- | AK146: 6.6600000000000006e-002 | AL146: =H146+100*O146 -> 113.5 | AM146: 113 | AN146: 72 | AO146: 26.5 | AP146: 115 | AQ146: 7.6999999999999999e-002 | AR146: 14 | AS146: 雪榕转债
A147: 125 | B147: 113588 | C147: 润达转债! | D147: 603108 | E147: 润达医疗 | F147: 医药 | G147: 医疗器械 | H147: 98.18 | I147: 4.3e-003 | J147: -5.0000000000000001e-003 | K147: 10.44 | L147: -1.9e-003 | M147: 114.2 | N147: 13.36 | O147: 0.25600000000000001 | P147: 78.14 | Q147: 转股中 | R147: 5.31年 | S147: 3.31年 | T147: 3.31 | U147: 5.5 | V147: 3.4 | W147: 6.0000000000000001e-003 | X147: 9.0999999999999998e-002 | Y147: 7.0999999999999994e-002 | Z147: 61 | AA147: 2.02 | AB147: 2.9500000000000002e-002 | AC147: 2.4399999999999998e-002 | AD147: 1.6e-002 | AE147: 1.3899999999999999e-002 | AG147: 88.97 | AH147: 90.58 | AI147: 0.38 | AJ147: AA | AK147: 4.5599999999999995e-002 | AL147: =H147+100*O147 -> 123.78 | AM147: 118.2 | AN147: 120 | AO147: 27.6 | AP147: 132 | AQ147: -5.5999999999999994e-002 | AR147: 10 | AS147: 润达转债!
A148: 99 | B148: 128122 | C148: 兴森转债! | D148: 2436 | E148: 兴森科技 | F148: 电子 | G148: 元器件制 | H148: 100 | I148: 0. | J148: -2.9999999999999997e-004 | K148: 8.68 | L148: -2.3e-003 | M148: 113.3 | N148: 14.18 | O148: 0.63400000000000001 | P148: 61.21 | Q148: 转股中 | R148: 4.40年 | S148: 3.40年 | T148: 3.4 | U148: 2.69 | V148: 4.6 | W148: 1.7000000000000001e-002 | X148: 2.1000000000000001e-002 | Y148: 1.3000000000000001e-002 | Z148: 129 | AA148: 4.09 | AB148: 2.9100000000000001e-002 | AC148: 2.35e-002 | AD148: 1.01e-002 | AE148: 8.1000000000000013e-003 | AG148: 88.96 | AH148: 93.92 | AI148: 0.13 | AJ148: AA | AK148: 4.41e-002 | AL148: =H148+100*O148 -> 163.40000000000001 | AM148: 138.8 | AN148: 271 | AO148: 44.9 | AP148: 254 | AQ148: -2.1000000000000001e-002 | AR148: 10 | AS148: 兴森转债!
A149: 113 | B149: 110071 | C149: 湖盐转债! | D149: 600929 | E149: 雪天盐业 | F149: 食品饮料 | G149: 食品饮料 | H149: 99.67 | I149: 6.7000000000000002e-003 | J149: 6.5000000000000006e-003 | K149: 5.56 | L149: 2.9600000000000001e-002 | M149: 115.2 | N149: 6.6 | O149: 0.183 | P149: 84.24 | Q149: 转股中 | R149: 5.37年 | S149: 3.37年 | T149: 3.37 | U149: 7.2 | V149: 1.4 | W149: 2.e-003 | X149: 0.14099999999999999 | Y149: 0.11900000000000001 | Z149: 51 | AA149: 2.01 | AB149: 2.7900000000000001e-002 | AC149: 2.2599999999999999e-002 | AD149: 1.1399999999999999e-002 | AE149: 9.300000000000001e-003 | AG149: 88.72 | AH149: 91.11 | AI149: 0.44 | AJ149: AA | AK149: 4.5599999999999995e-002 | AL149: =H149+100*O149 -> 117.97 | AM149: 115.1 | AN149: 91 | AO149: 24 | AP149: 92 | AQ149: 8.6999999999999994e-002 | AR149: 15 | AS149: 湖盐转债!
A150: 79 | B150: 113039 | C150: 嘉泽转债! | D150: 601619 | E150: 嘉泽新能 | F150: 能源电力 | G150: 风能 | H150: 97.56 | I150: 3.5999999999999999e-003 | J150: -2.0000000000000001e-004 | K150: 3.24 | L150: 6.1999999999999998e-003 | M150: 113.1 | N150: 3.57 | O150: 7.4999999999999997e-002 | P150: 90.76 | Q150: 3.6天 | R150: 5.49年 | S150: 3.49年 | T150: 3.49 | U150: 13 | V150: 24 | W150: 1.9e-002 | X150: 0.193 | Y150: 0.17600000000000002 | Z150: 67 | AA150: 1.96 | AB150: 2.7799999999999998e-002 | AC150: 2.3300000000000001e-002 | AD150: 1.67e-002 | AE150: 1.47e-002 | AG150: 88.14 | AH150: 88.95 | AI150: 0.54 | AJ150: AA | AK150: 4.5599999999999995e-002 | AL150: =H150+100*O150 -> 105.06 | AM150: 104.4 | AN150: 17 | AO150: 15.4 | AP150: 30 | AQ150: -4.5999999999999999e-002 | AR150: 22 | AS150: 嘉泽转债!
A151: 28 | B151: 113612 | C151: 永冠转债 | D151: 603681 | E151: 永冠新材 | F151: 化工 | G151: 其他 | H151: 103.85 | I151: 7.4000000000000003e-003 | J151: 1.1999999999999999e-003 | K151: 20.18 | L151: 1.3100000000000001e-002 | M151: 121.2 | N151: 20.79 | O151: 7.0000000000000007e-002 | P151: 97.07 | Q151: 3月18天 | R151: 5.78年 | S151: 3.78年 | T151: 3.78 | U151: 5.2 | V151: 5.6 | W151: 1.e-002 | X151: 0.155 | Y151: 0.14999999999999999 | Z151: 34 | AA151: 2.27 | AB151: 2.76e-002 | AC151: 2.1099999999999997e-002 | AD151: 7.000000000000001e-004 | AE151: -1.4000000000000002e-003 | AG151: 80.95 | AH151: 84.15 | AI151: 0.65 | AJ151: AA- | AK151: 6.6600000000000006e-002 | AL151: =H151+100*O151 -> 110.84999999999999 | AM151: 110.6 | AN151: 55 | AO151: 26.5 | AP151: 116 | AQ151: 1.4999999999999999e-002 | AR151: 4 | AS151: 永冠转债
A152: 136 | B152: 123051 | C152: 今天转债 | D152: 300532 | E152: 今天国际 | F152: 计算机及 | G152: 软件开发 | H152: 106.87 | I152: 1.6000000000000001e-003 | J152: 4.5000000000000005e-003 | K152: 8.95 | L152: 9.0000000000000011e-003 | M152: 122.8 | N152: 8.8 | O152: 5.0999999999999997e-002 | P152: 101.7 | Q152: 转股中 | R152: 5.27年 | S152: 3.27年 | T152: 3.27 | U152: 2.8 | V152: 2.2 | W152: 6.9999999999999993e-003 | X152: 0.115 | Y152: 0.11599999999999999 | Z152: 24 | AA152: 3.07 | AB152: 2.7400000000000001e-002 | AC152: 1.9799999999999998e-002 | AD152: -6.0000000000000001e-003 | AE152: -8.6e-003 | AG152: 81.3 | AH152: 83.69 | AI152: 0.68 | AJ152: A+ | AK152: 7.7600000000000002e-002 | AL152: =H152+100*O152 -> 111.97 | AM152: 112 | AN152: 63 | AO152: 28.4 | AP152: 138 | AQ152: 1.7000000000000001e-002 | AR152: 15 | AS152: 今天转债
A153: 100 | B153: 113037 | C153: 紫银转债 | D153: 601860 | E153: 紫金银行 | F153: 金融 | G153: 银行行业 | H153: 100.43 | I153: -2.3e-003 | J153: -6.0000000000000001e-003 | K153: 3.9 | L153: -2.0099999999999996e-002 | M153: 115.8 | N153: 4.75 | O153: 0.223 | P153: 82.11 | Q153: 转股中 | R153: 5.40年 | S153: 无权 | U153: 45 | V153: 26 | W153: 6.0000000000000001e-003 | X153: 0.315 | Y153: 0.25900000000000001 | Z153: 143 | AA153: 1.01 | AB153: 2.7300000000000001e-002 | AC153: 2.18e-002 | AD153: 无权 | AE153: 无权 | AG153: 无权 | AH153: 92.4 | AI153: 0.41 | AJ153: AA+ | AK153: 4.36e-002 | AL153: =H153+100*O153 -> 122.73 | AM153: 118.8 | AN153: 127 | AO153: 26.4 | AP153: 114 | AQ153: -2.e-003 | AR153: 18 | AS153: 紫银转债
A154: 91 | B154: 128125 | C154: 华阳转债! | D154: 2949 | E154: 华阳国际 | F154: 建筑 | G154: 建筑工程 | H154: 103.2 | I154: -1.24e-002 | J154: -3.2000000000000002e-003 | K154: 20.91 | L154: -3.0600000000000002e-002 | M154: 118.5 | N154: 25.79 | O154: 0.27300000000000002 | P154: 81.08 | Q154: 转股中 | R154: 5.42年 | S154: 3.42年 | T154: 3.42 | U154: 4.5 | V154: 0.6 | W154: 1.e-003 | X154: 0.11 | Y154: 8.900000000000001e-002 | Z154: 41 | AA154: 3.36 | AB154: 2.63e-002 | AC154: 2.0199999999999999e-002 | AD154: 1.7000000000000001e-003 | AE154: -4.0000000000000002e-004 | AG154: 82.59 | AH154: 84.15 | AI154: 0.51 | AJ154: AA- | AK154: 6.6600000000000006e-002 | AL154: =H154+100*O154 -> 130.5 | AM154: 125.3 | AN154: 187 | AO154: 41.2 | AP154: 237 | AQ154: 4.2000000000000003e-002 | AR154: 6 | AS154: 华阳转债!
A155: 54 | B155: 123073 | C155: 同和转债! | D155: 300636 | E155: 同和药业 | F155: 医药 | G155: 原料药 | H155: 106 | I155: 4.5000000000000005e-003 | J155: 4.8999999999999998e-003 | K155: 24.63 | L155: 1.32e-002 | M155: 122.4 | N155: 23.8 | O155: 2.4e-002 | P155: 103.49 | Q155: 2月6天 | R155: 5.66年 | S155: 3.66年 | T155: 3.66 | U155: 3.6 | V155: 86 | W155: 0.218 | X155: 0.114 | Y155: 0.11800000000000001 | Z155: 32 | AA155: 4.19 | AB155: 2.63e-002 | AC155: 1.9299999999999998e-002 | AD155: -3.5999999999999999e-003 | AE155: -5.8999999999999999e-003 | AG155: 78.82 | AH155: 80.95 | AI155: 0.71 | AJ155: A+ | AK155: 7.7600000000000002e-002 | AL155: =H155+100*O155 -> 108.40000000000001 | AM155: 108.5 | AN155: 37 | AO155: 27.6 | AP155: 130 | AQ155: 7.4999999999999997e-002 | AR155: 9 | AS155: 同和转债!
A156: 59 | B156: 123072 | C156: 乐歌转债! | D156: 300729 | E156: 乐歌股份 | F156: 其他 | G156: 家居用品 | H156: 113 | I156: 2.9100000000000001e-002 | J156: -3.2899999999999999e-002 | K156: 37.2 | L156: -2.2599999999999999e-002 | M156: 129.6 | N156: 73.13 | O156: 1.22 | P156: 50.87 | Q156: 2月0天 | R156: 5.65年 | S156: 3.65年 | T156: 3.65 | U156: 1.42 | V156: 204 | W156: 1.28 | X156: 2.7000000000000003e-002 | Y156: 1.3999999999999999e-002 | Z156: 52 | AA156: 5.42 | AB156: 2.53e-002 | AC156: 1.6500000000000001e-002 | AD156: -1.52e-002 | AE156: -1.84e-002 | AG156: 80.55 | AH156: 86.07 | AI156: 0.17 | AJ156: A+ | AK156: 7.7600000000000002e-002 | AL156: =H156+100*O156 -> 235. | AM156: 175.1 | AN156: 318 | AO156: 89.1 | AP156: 318 | AQ156: 1.1000000000000001e-002 | AR156: 7 | AS156: 乐歌转债!
A157: 37 | B157: 123078 | C157: 飞凯转债!! | D157: 300398 | E157: 飞凯材料 | F157: 化工 | G157: 化工 | H157: 100.041 | I157: -1.e-004 | J157: -3.9000000000000003e-003 | K157: 14.85 | L157: -1.66e-002 | M157: 115.2 | N157: 19.34 | O157: 0.30299999999999999 | P157: 76.78 | Q157: 3月7天 | R157: 5.75年 | S157: 回售内 | T157: 3.42 | U157: 8.25 | V157: 24 | W157: 2.8999999999999998e-002 | X157: 0.10800000000000001 | Y157: 8.3000000000000004e-002 | Z157: 77 | AA157: 2.96 | AB157: 2.53e-002 | AC157: 2.0400000000000001e-002 | AD157: 回售内 | AE157: 回售内 | AG157: 100.08 | AH157: 89.56 | AI157: 0.24 | AJ157: AA | AK157: 4.5599999999999995e-002 | AL157: =H157+100*O157 -> 130.34100000000001 | AM157: 123.3 | AN157: 172 | AO157: 23.2 | AP157: 81 | AQ157: -2.e-002 | AR157: 7 | AS157: 飞凯转债!!
A158: 94 | B158: 128124 | C158: 科华转债! | D158: 2022 | E158: 科华生物 | F158: 医药 | G158: 生物制药 | H158: 96.594 | I158: 1.6799999999999999e-002 | J158: -1.49e-002 | K158: 15.65 | L158: 5.7999999999999996e-003 | M158: 110.3 | N158: 21.51 | O158: 0.32799999999999996 | P158: 72.76 | Q158: 转股中 | R158: 5.42年 | S158: 3.42年 | T158: 3.68 | U158: 7.38 | V158: 4.6 | W158: 6.0000000000000001e-003 | X158: 9.1999999999999998e-002 | Y158: 6.7000000000000004e-002 | Z158: 80 | AA158: 2.8 | AB158: 2.52e-002 | AC158: 2.1499999999999998e-002 | AD158: 1.84e-002 | AE158: 1.66e-002 | AG158: 87.95 | AH158: 86.99 | AI158: 0.33 | AJ158: AA | AK158: 4.5599999999999995e-002 | AL158: =H158+100*O158 -> 129.39400000000001 | AM158: 120.4 | AN158: 148 | AO158: 32.5 | AP158: 184 | AQ158: -3.1e-002 | AR158: 16 | AS158: 科华转债!
A159: 52 | B159: 113606 | C159: 荣泰转债 | D159: 603579 | E159: 荣泰健康 | F159: 机械装备 | G159: 专用设备 | H159: 105.81 | I159: -2.9999999999999997e-004 | J159: -4.8999999999999998e-003 | K159: 28.99 | L159: -9.1999999999999998e-003 | M159: 121.2 | N159: 33.32 | O159: 0.21600000000000003 | P159: 87 | Q159: 2月8天 | R159: 5.68年 | S159: 3.68年 | T159: 3.57 | U159: 6 | V159: 0.9 | W159: 1.e-003 | X159: 0.14800000000000002 | Y159: 0.129 | Z159: 41 | AA159: 2.56 | AB159: 2.4700000000000003e-002 | AC159: 1.8100000000000002e-002 | AD159: -4.1999999999999997e-003 | AE159: -6.3e-003 | AG159: 81.51 | AH159: 84.73 | AI159: 0.56 | AJ159: AA- | AK159: 6.6600000000000006e-002 | AL159: =H159+100*O159 -> 127.41 | AM159: 124.6 | AN159: 180 | AO159: 39.9 | AP159: 232 | AQ159: 2.7000000000000003e-002 | AR159: 8 | AS159: 荣泰转债
A160: 69 | B160: 128133 | C160: 奇正转债! | D160: 2287 | E160: 奇正藏药 | F160: 医药 | G160: 中药 | H160: 103.05 | I160: -1.5e-003 | J160: 5.1999999999999998e-003 | K160: 24.57 | L160: 9.0000000000000011e-003 | M160: 117.3 | N160: 30.12 | O160: 0.26300000000000001 | P160: 81.57 | Q160: 30天 | R160: 5.57年 | S160: 3.57年 | T160: 2.79 | U160: 8 | V160: 5.1 | W160: 6.0000000000000001e-003 | X160: 6.0999999999999999e-002 | Y160: 5.0000000000000003e-002 | Z160: 130 | AA160: 5.42 | AB160: 2.4e-002 | AC160: 1.83e-002 | AD160: 2.e-003 | AE160: 0. | AG160: 88.02 | AH160: 91.95 | AI160: 0.41 | AJ160: AA | AK160: 4.5599999999999995e-002 | AL160: =H160+100*O160 -> 129.34999999999999 | AM160: 124.5 | AN160: 178 | AO160: 32.6 | AP160: 186 | AQ160: -5.0999999999999997e-002 | AR160: 12 | AS160: 奇正转债!
A161: 201 | B161: 128083 | C161: 新北转债! | D161: 2376. | E161: 新北洋 | F161: 电子 | G161: 电子产品 | H161: 102.983 | I161: 1.1399999999999999e-002 | J161: -1.2800000000000001e-002 | K161: 10.45 | L161: -2.8999999999999998e-003 | M161: 114.9 | N161: 11.7 | O161: 0.153 | P161: 89.32 | Q161: 转股中 | R161: 4.79年 | S161: 2.79年 | T161: 3.42 | U161: 8.77 | V161: 9.2 | W161: 1.e-002 | X161: 0.126 | Y161: 0.113 | Z161: 70 | AA161: 2.06 | AB161: 2.3599999999999999e-002 | AC161: 1.78e-002 | AD161: 1.4000000000000002e-003 | AE161: -8.9999999999999998e-004 | AG161: 91.11 | AH161: 93.8 | AI161: 0.47 | AJ161: AA | AK161: 4.41e-002 | AL161: =H161+100*O161 -> 118.283 | AM161: 116.6 | AN161: 106 | AO161: 22.8 | AP161: 78 | AQ161: 5.2000000000000005e-002 | AR161: 20 | AS161: 新北转债!
A162: 96 | B162: 123062 | C162: 三超转债 | D162: 300554 | E162: 三超新材 | F162: 机械装备 | G162: 通用设备 | H162: 105.831 | I162: 1.0200000000000001e-002 | J162: -1.0200000000000001e-002 | K162: 16.69 | L162: 0. | M162: 119.7 | N162: 17.17 | O162: 8.900000000000001e-002 | P162: 97.2 | Q162: 转股中 | R162: 5.42年 | S162: 3.42年 | T162: 3.4 | U162: 1.95 | V162: 29 | W162: 0.13900000000000001 | X162: 0.125 | Y162: 0.121 | Z162: 16 | AA162: 2.99 | AB162: 2.3599999999999999e-002 | AC162: 1.7000000000000001e-002 | AD162: -3.3e-003 | AE162: -5.6999999999999993e-003 | AG162: 77.75 | AH162: 76.85 | AI162: 0.72 | AJ162: A | AK162: 8.7599999999999997e-002 | AL162: =H162+100*O162 -> 114.73100000000001 | AM162: 114.5 | AN162: 81 | AO162: 36.7 | AP162: 213 | AQ162: -3.1e-002 | AR162: 16 | AS162: 三超转债
A163: 286 | B163: 113516 | C163: 苏农转债! | D163: 603323 | E163: 苏农银行 | F163: 金融 | G163: 银行行业 | H163: 105.92 | I163: -9.0000000000000011e-003 | J163: 1.8e-003 | K163: 4.76 | L163: -2.06e-002 | M163: 114.3 | N163: 5.52 | O163: 0.22800000000000001 | P163: 86.23 | Q163: 转股中 | R163: 3.43年 | S163: 无权 | T163: 2.83 | U163: 12.9 | V163: 4.2 | W163: 3.0000000000000001e-003 | X163: 0.14999999999999999 | Y163: 0.13 | Z163: 86 | AA163: 0.72 | AB163: 2.29e-002 | AC163: 1.52e-002 | AD163: 无权 | AE163: 无权 | AG163: 无权 | AH163: 99.5 | AI163: 0.35 | AJ163: AA+ | AK163: 4.2099999999999999e-002 | AL163: =H163+100*O163 -> 128.72 | AM163: 125.6 | AN163: 191 | AO163: 26.1 | AP163: 113 | AQ163: 1.e-003 | AR163: 33 | AS163: 苏农转债!
A164: 260 | B164: 110053 | C164: 苏银转债! | D164: 600919 | E164: 江苏银行 | F164: 金融 | G164: 银行行业 | H164: 109.1 | I164: -2.8000000000000004e-003 | J164: -8.3999999999999995e-003 | K164: 5.75 | L164: -3.2000000000000001e-002 | M164: 119.1 | N164: 6.69 | O164: 0.26899999999999996 | P164: 85.95 | Q164: 转股中 | R164: 4年16天 | S164: 无权 | T164: 2.84 | U164: 200 | V164: 85 | W164: 4.0000000000000001e-003 | X164: 0.23600000000000002 | Y164: 0.20199999999999999 | Z164: 849 | AA164: 0.56 | AB164: 2.2700000000000001e-002 | AC164: 1.41e-002 | AD164: 无权 | AE164: 无权 | AG164: 无权 | AH164: 102.52 | AI164: 0.35 | AJ164: AAA | AK164: 3.9100000000000003e-002 | AL164: =H164+100*O164 -> 136. | AM164: 132.3 | AN164: 235 | AO164: 29.7 | AP164: 152 | AQ164: 1.6e-002 | AR164: 44 | AS164: 苏银转债!
A165: 104 | B165: 113594 | C165: 淳中转债! | D165: 603516 | E165: 淳中科技 | F165: 电子 | G165: 电子产品 | H165: 108.15 | I165: -5.1000000000000004e-003 | J165: -9.1000000000000004e-003 | K165: 34.16 | L165: -2.3399999999999997e-002 | M165: 121.4 | N165: 39.37 | O165: 0.24600000000000002 | P165: 86.77 | Q165: 转股中 | R165: 5.40年 | S165: 3.40年 | T165: 2.47 | U165: 3 | V165: 1.6 | W165: 5.0000000000000001e-003 | X165: 6.6000000000000003e-002 | Y165: 5.7000000000000002e-002 | Z165: 46 | AA165: 5.06 | AB165: 2.2200000000000001e-002 | AC165: 1.52e-002 | AD165: -9.4999999999999998e-003 | AE165: -1.2e-002 | AG165: 80.4 | AH165: 81.91 | AI165: 0.6 | AJ165: A+ | AK165: 7.7600000000000002e-002 | AL165: =H165+100*O165 -> 132.75 | AM165: 129.5 | AN165: 218 | AO165: 47.6 | AP165: 265 | AQ165: 0.14599999999999999 | AR165: 8 | AS165: 淳中转债!
A166: 191 | B166: 123038 | C166: 联得转债! | D166: 300545 | E166: 联得装备 | F166: 机械装备 | G166: 专用设备 | H166: 107 | I166: 1.4199999999999999e-002 | J166: -1.4999999999999999e-002 | K166: 22.17 | L166: -1.4000000000000002e-003 | M166: 118.6 | N166: 25.29 | O166: 0.221 | P166: 87.66 | Q166: 转股中 | R166: 4.83年 | S166: 2.83年 | T166: 2.83 | U166: 1.47 | V166: 7.7 | W166: 4.9000000000000002e-002 | X166: 4.4999999999999998e-002 | Y166: 4.0000000000000001e-002 | Z166: 32 | AA166: 4.23 | AB166: 2.2000000000000002e-002 | AC166: 1.5100000000000001e-002 | AD166: -1.e-002 | AE166: -1.2500000000000001e-002 | AG166: 83.57 | AH166: 83.88 | AI166: 0.58 | AJ166: A+ | AK166: 7.6100000000000001e-002 | AL166: =H166+100*O166 -> 129.09999999999999 | AM166: 126.3 | AN166: 201 | AO166: 42.5 | AP166: 244 | AQ166: -2.9999999999999999e-002 | AR166: 18 | AS166: 联得转债!
A167: 188 | B167: 128091 | C167: 新天转债 | D167: 2873 | E167: 新天药业 | F167: 医药 | G167: 中药 | H167: 107.8 | I167: 7.4999999999999997e-003 | J167: -4.0000000000000002e-004 | K167: 15.97 | L167: 1.0800000000000001e-002 | M167: 119.4 | N167: 16.39 | O167: 0.106 | P167: 97.44 | Q167: 转股中 | R167: 4.84年 | S167: 2.84年 | T167: 2.84 | U167: 1.76 | V167: 14 | W167: 7.2000000000000008e-002 | X167: 9.4e-002 | Y167: 9.1999999999999998e-002 | Z167: 19 | AA167: 2.48 | AB167: 2.1899999999999999e-002 | AC167: 1.47e-002 | AD167: -1.0500000000000001e-002 | AE167: -1.3300000000000001e-002 | AG167: 84.03 | AH167: 84.46 | AI167: 0.66 | AJ167: A+ | AK167: 7.6100000000000001e-002 | AL167: =H167+100*O167 -> 118.39999999999999 | AM167: 118.2 | AN167: 119 | AO167: 33.7 | AP167: 196 | AQ167: 2.7999999999999997e-002 | AR167: 18 | AS167: 新天转债
A168: 227 | B168: 128071 | C168: 合兴转债! | D168: 2228 | E168: 合兴包装 | F168: 造纸包装 | G168: 包装材料 | H168: 104.5 | I168: -1.6000000000000001e-003 | J168: 2.8000000000000004e-003 | K168: 3.85 | L168: 2.5999999999999999e-003 | M168: 114.8 | N168: 4.28 | O168: 0.16200000000000001 | P168: 89.95 | Q168: 转股中 | R168: 4.47年 | S168: 2.47年 | T168: 2.47 | U168: 3 | V168: 0.5 | W168: 2.e-003 | X168: 6.3e-002 | Y168: 5.7000000000000002e-002 | Z168: 48 | AA168: 1.43 | AB168: 2.1700000000000001e-002 | AC168: 1.55e-002 | AD168: -4.4000000000000003e-003 | AE168: -6.8000000000000005e-003 | AG168: 92.3 | AH168: 95.02 | AI168: 0.46 | AJ168: AA | AK168: 4.41e-002 | AL168: =H168+100*O168 -> 120.7 | AM168: 119 | AN168: 133 | AO168: 24 | AP168: 94 | AQ168: -8.0000000000000002e-003 | AR168: 26 | AS168: 合兴转债!
A169: 26 | B169: 123083 | C169: 朗新转债 | D169: 300682 | E169: 朗新科技 | F169: 计算机及 | G169: 软件开发 | H169: 102 | I169: -3.0000000000000001e-003 | J169: 2.0000000000000001e-004 | K169: 12.72 | L169: -6.3e-003 | M169: 115.1 | N169: 15.57 | O169: 0.249 | P169: 81.7 | Q169: 3月19天 | R169: 5.79年 | S169: 3.79年 | T169: 3.79 | U169: 8 | V169: 2.6 | W169: 3.0000000000000001e-003 | X169: 6.2e-002 | Y169: 5.0000000000000003e-002 | Z169: 130 | AA169: 2.72 | AB169: 2.1499999999999998e-002 | AC169: 1.67e-002 | AD169: 4.0000000000000001e-003 | AE169: 2.2000000000000001e-003 | AG169: 86.99 | AH169: 89.34 | AI169: 0.44 | AJ169: AA | AK169: 4.5599999999999995e-002 | AL169: =H169+100*O169 -> 126.90000000000001 | AM169: 122.3 | AN169: 165 | AO169: 33 | AP169: 190 | AQ169: -3.6000000000000004e-002 | AR169: 3 | AS169: 朗新转债
A170: 325 | B170: 110038 | C170: 济川转债! | D170: 600566 | E170: 济川药业 | F170: 医药 | G170: 中药 | H170: 103.75 | I170: 8.9999999999999998e-004 | J170: -1.8e-003 | K170: 19.85 | L170: -5.0000000000000001e-003 | M170: 107.5 | N170: 23.85 | O170: 0.247 | P170: 83.23 | Q170: 转股中 | R170: 1.71年 | S170: 回售内 | U170: 6.28 | V170: 2.1 | W170: 3.0000000000000001e-003 | X170: 3.6000000000000004e-002 | Y170: 2.9999999999999999e-002 | Z170: 176 | AA170: 2.4 | AB170: 2.1099999999999997e-002 | AC170: 1.2699999999999999e-002 | AD170: 回售内 | AE170: 回售内 | AG170: 100.25 | AH170: 100.25 | AI170: 0.18 | AJ170: AA | AK170: 4.2000000000000003e-002 | AL170: =H170+100*O170 -> 128.44999999999999 | AM170: 124.3 | AN170: 177 | AO170: 24 | AP170: 93 | AQ170: 2.e-002 | AR170: 22 | AS170: 济川转债!
A171: 343 | B171: 110031 | C171: 航信转债!! | D171: 600271 | E171: 航天信息 | F171: 计算机及 | G171: 软件开发 | H171: 106.36 | I171: 0. | J171: 0. | K171: 11.32 | L171: -1.1399999999999999e-002 | M171: 107 | N171: 21.56 | O171: 1.03 | P171: 52.5 | Q171: 转股中 | R171: 0.29年 | S171: 回售内 | U171: 24 | V171: 4.5 | W171: 2.e-003 | X171: 0.114 | Y171: 5.9999999999999998e-002 | Z171: 210 | AA171: 1.82 | AB171: 2.0899999999999998e-002 | AC171: -2.4399999999999998e-002 | AD171: 回售内 | AE171: 回售内 | AG171: 100.27 | AH171: 106.07 | AI171: 0 | AJ171: AAA | AK171: 3.0499999999999999e-002 | AL171: =H171+100*O171 -> 209.36000000000001 | AM171: 160.2 | AN171: 309 | AO171: 54.1 | AP171: 288 | AQ171: 2.e-003 | AR171: 15 | AS171: 航信转债!!
A172: 77 | B172: 128129 | C172: 青农转债 | D172: 2958 | E172: 青农商行 | F172: 金融 | G172: 银行行业 | H172: 100.58 | I172: -5.1000000000000004e-003 | J172: 1.7000000000000001e-003 | K172: 4.63 | L172: -8.6e-003 | M172: 112.2 | N172: 5.74 | O172: 0.247 | P172: 80.66 | Q172: 3.6天 | R172: 5.49年 | S172: 无权 | U172: 50 | V172: 15 | W172: 3.0000000000000001e-003 | X172: 0.19399999999999998 | Y172: 0.157 | Z172: 257 | AA172: 1 | AB172: 2.0400000000000001e-002 | AC172: 1.6200000000000003e-002 | AD172: 无权 | AE172: 无权 | AG172: 无权 | AH172: 90.46 | AI172: 0.4 | AJ172: AAA | AK172: 4.0599999999999997e-002 | AL172: =H172+100*O172 -> 125.28 | AM172: 120.5 | AN172: 149 | AO172: 30 | AP172: 156 | AQ172: 6.9999999999999993e-003 | AR172: 12 | AS172: 青农转债
A173: 303 | B173: 127006 | C173: 敖东转债! | D173: 623 | E173: 吉林敖东 | F173: 金融 | G173: 证券行业 | H173: 101.7 | I173: -8.6999999999999994e-003 | J173: 5.1000000000000004e-003 | K173: 15.64 | L173: -1.7000000000000001e-002 | M173: 108 | N173: 20.42 | O173: 0.32799999999999996 | P173: 76.59 | Q173: 转股中 | R173: 3年15天 | S173: 1年15天 | T173: =1+15/365 -> 1.0410958904109588 | U173: 24.1 | V173: 7.3 | W173: 3.0000000000000001e-003 | X173: 0.13200000000000001 | Y173: 0.10099999999999999 | Z173: 182 | AA173: 0.8 | AB173: 2.0299999999999999e-002 | AC173: 1.5100000000000001e-002 | AD173: -2.9999999999999997e-004 | AE173: -3.0000000000000001e-003 | AG173: 96.76 | AH173: 95.45 | AI173: 0.21 | AJ173: AA+ | AK173: 4.2099999999999999e-002 | AL173: =H173+100*O173 -> 134.5 | AM173: 126.8 | AN173: 203 | AO173: 30 | AP173: 157 | AQ173: 2.e-003 | AR173: 26 | AS173: 敖东转债!
A174: 5 | B174: 113619 | C174: 世运转债! | D174: 603920 | E174: 世运电路 | F174: 电子 | G174: 元器件制 | H174: 102.51 | I174: -1.01e-002 | J174: -1.1999999999999999e-003 | K174: 19.18 | L174: -3.3300000000000003e-002 | M174: 115.2 | N174: 26.5 | O174: 0.41600000000000004 | P174: 72.38 | Q174: 5月0天 | R174: 5.90年 | S174: 3.90年 | T174: 3.9 | U174: 10 | V174: 12 | W174: 1.1000000000000001e-002 | X174: 0.127 | Y174: 9.1999999999999998e-002 | Z174: 79 | AA174: 3.02 | AB174: 2.0299999999999999e-002 | AC174: 1.5600000000000001e-002 | AD174: 2.8999999999999998e-003 | AE174: 1.1000000000000001e-003 | AG174: 86.64 | AH174: 88.97 | AI174: 0.34 | AJ174: AA | AK174: 4.5599999999999995e-002 | AL174: =H174+100*O174 -> 144.11000000000001 | AM174: 132.6 | AN174: 239 | AO174: 43.7 | AP174: 248 | AQ174: -0.107 | AR174: 2 | AS174: 世运转债!
A175: 147 | B175: 123050 | C175: 聚飞转债 | D175: 300303 | E175: 聚飞光电 | F175: 电子 | G175: LED制 | H175: 112.4 | I175: -9.3999999999999986e-003 | J175: 5.7999999999999996e-003 | K175: 5.14 | L175: -5.7999999999999996e-003 | M175: 124.2 | N175: 5.18 | O175: 0.13300000000000001 | P175: 99.23 | Q175: 转股中 | R175: 5年47天 | S175: 3年47天 | T175: =3+47/365 -> 3.128767123287671 | U175: 7.05 | V175: 2.8 | W175: 4.0000000000000001e-003 | X175: 0.107 | Y175: 0.106 | Z175: 66 | AA175: 2.83 | AB175: 2.0099999999999996e-002 | AC175: 1.2e-002 | AD175: -2.3199999999999998e-002 | AE175: -2.5499999999999998e-002 | AG175: 84.42 | AH175: 89.91 | AI175: 0.61 | AJ175: AA- | AK175: 6.6600000000000006e-002 | AL175: =H175+100*O175 -> 125.7 | AM175: 125.6 | AN175: 190 | AO175: 35.7 | AP175: 204 | AQ175: 1.e-002 | AR175: 12 | AS175: 聚飞转债
A176: 182 | B176: 113563 | C176: 柳药转债 | D176: 603368 | E176: 柳药股份 | F176: 医药 | G176: 医药商业 | H176: 102.83 | I176: 2.7000000000000001e-003 | J176: -1.4000000000000002e-003 | K176: 20.99 | L176: 2.8999999999999998e-003 | M176: 112.9 | N176: 24.47 | O176: 0.19899999999999998 | P176: 85.78 | Q176: 转股中 | R176: 4.89年 | S176: 2.89年 | T176: 2.89 | U176: 8.02 | V176: 2.6 | W176: 3.0000000000000001e-003 | X176: 0.105 | Y176: 8.9999999999999997e-002 | Z176: 76 | AA176: 1.58 | AB176: 1.9699999999999999e-002 | AC176: 1.47e-002 | AD176: 1.8e-003 | AE176: -4.0000000000000002e-004 | AG176: 90.74 | AH176: 91.8 | AI176: 0.45 | AJ176: AA | AK176: 4.41e-002 | AL176: =H176+100*O176 -> 122.72999999999999 | AM176: 119.9 | AN176: 145 | AO176: 28.1 | AP176: 136 | AQ176: 1.e-003 | AR176: 17 | AS176: 柳药转债
A177: 173 | B177: 123043 | C177: 正元转债 | D177: 300645 | E177: 正元智慧 | F177: 计算机及 | G177: 软件开发 | H177: 110.5 | I177: 2.7099999999999999e-002 | J177: -1.2500000000000001e-002 | K177: 14.1 | L177: 2.4e-002 | M177: 121.4 | N177: 15.41 | O177: 0.20800000000000002 | P177: 91.5 | Q177: 转股中 | R177: 5年7天 | S177: 3年7天 | T177: =3+7/365 -> 3.0191780821917806 | U177: 1.66 | V177: 297 | W177: 1.6200000000000001 | X177: 9.1999999999999998e-002 | Y177: 8.5000000000000006e-002 | Z177: 18 | AA177: 2.91 | AB177: 1.9400000000000001e-002 | AC177: 1.1899999999999999e-002 | AD177: -1.7399999999999999e-002 | AE177: -2.0099999999999996e-002 | AG177: 82.7 | AH177: 84.26 | AI177: 0.61 | AJ177: A+ | AK177: 7.7600000000000002e-002 | AL177: =H177+100*O177 -> 131.30000000000001 | AM177: 129.5 | AN177: 216 | AO177: 45.2 | AP177: 255 | AQ177: -4.0000000000000001e-003 | AR177: 18 | AS177: 正元转债
A178: 97 | B178: 128123 | C178: 国光转债! | D178: 2749 | E178: 国光股份 | F178: 化工 | G178: 农化 | H178: 104.969 | I178: 9.300000000000001e-003 | J178: -9.7999999999999997e-003 | K178: 11.26 | L178: -8.9999999999999998e-004 | M178: 116.2 | N178: 13.7 | O178: 0.27699999999999997 | P178: 82.19 | Q178: 转股中 | R178: 5.42年 | S178: 3.42年 | T178: 3.42 | U178: 3.2 | V178: 4.3 | W178: 1.3000000000000001e-002 | X178: 6.6000000000000003e-002 | Y178: 5.4000000000000006e-002 | Z178: 49 | AA178: 3.95 | AB178: 1.9400000000000001e-002 | AC178: 1.3899999999999999e-002 | AD178: -2.3e-003 | AE178: -4.5000000000000005e-003 | AG178: 82.89 | AH178: 82.64 | AI178: 0.54 | AJ178: AA- | AK178: 6.6600000000000006e-002 | AL178: =H178+100*O178 -> 132.66899999999998 | AM178: 127.7 | AN178: 212 | AO178: 44.9 | AP178: 253 | AQ178: 7.4999999999999997e-002 | AR178: 10 | AS178: 国光转债!
A179: 20 | B179: 113044 | C179: 大秦转债! | D179: 601006 | E179: 大秦铁路 | F179: 铁路 | G179: 铁路运输 | H179: 102.4 | I179: -1.1000000000000001e-003 | J179: -3.8e-003 | K179: 6.53 | L179: -1.06e-002 | M179: 114.1 | N179: 7.66 | O179: 0.20100000000000001 | P179: 85.25 | Q179: 3月22天 | R179: 5.80年 | S179: 3.80年 | T179: 3.8 | U179: 320 | V179: 269 | W179: 8.0000000000000002e-003 | X179: 0.33000000000000002 | Y179: 0.28100000000000003 | Z179: 971 | AA179: 0.84 | AB179: 1.9199999999999998e-002 | AC179: 1.47e-002 | AD179: 3.8e-003 | AE179: 1.8e-003 | AG179: 88.87 | AH179: 90.99 | AI179: 0.46 | AJ179: AAA | AK179: 4.0599999999999997e-002 | AL179: =H179+100*O179 -> 122.5 | AM179: 119.6 | AN179: 140 | AO179: 28.6 | AP179: 139 | AQ179: 9.0000000000000011e-003 | AR179: 12 | AS179: 大秦转债!
A180: 313 | B180: 110041 | C180: 蒙电转债! | D180: 600863 | E180: 内蒙华电 | F180: 能源电力 | G180: 电力供应 | H180: 103.7 | I180: -2.8000000000000004e-003 | J180: 1.e-004 | K180: 2.32 | L180: -8.5000000000000006e-003 | M180: 109.3 | N180: 2.69 | O180: 0.20199999999999999 | P180: 86.25 | Q180: 转股中 | R180: 2.82年 | S180: 0.82年 | T180: 0.82 | U180: 18.7 | V180: 8.1 | W180: 4.0000000000000001e-003 | X180: 0.13900000000000001 | Y180: 0.12 | Z180: 135 | AA180: 1.14 | AB180: 1.9099999999999999e-002 | AC180: 1.2800000000000001e-002 | AD180: -1.8600000000000002e-002 | AE180: -2.2099999999999998e-002 | AG180: 98.23 | AH180: 98.82 | AI180: 0.32 | AJ180: AAA | AK180: 3.7000000000000005e-002 | AL180: =H180+100*O180 -> 123.90000000000001 | AM180: 121.2 | AN180: 155 | AO180: 22.3 | AP180: 71 | AQ180: 1.4999999999999999e-002 | AR180: 10 | AS180: 蒙电转债!
A181: 246 | B181: 113024 | C181: 核建转债! | D181: 601611 | E181: 中国核建 | F181: 建筑 | G181: 建筑工程 | H181: 101.65 | I181: -2.8000000000000004e-003 | J181: 1.e-004 | K181: 7.06 | L181: -1.26e-002 | M181: 109.7 | N181: 9.76 | O181: 0.40500000000000003 | P181: 72.34 | Q181: 转股中 | R181: 4年41天 | S181: 2年41天 | T181: =2+41/365 -> 2.1123287671232878 | U181: 30 | V181: 4.4 | W181: 1.e-003 | X181: 0.16 | Y181: 0.11599999999999999 | Z181: 187 | AA181: 1.74 | AB181: 1.9099999999999999e-002 | AC181: 1.4499999999999999e-002 | AD181: 6.7000000000000002e-003 | AE181: 3.9000000000000003e-003 | AG181: 94.64 | AH181: 94.01 | AI181: 0.22 | AJ181: AAA | AK181: 3.9100000000000003e-002 | AL181: =H181+100*O181 -> 142.15000000000001 | AM181: 131 | AN181: 226 | AO181: 36.3 | AP181: 212 | AQ181: -5.4000000000000006e-002 | AR181: 42 | AS181: 核建转债!
A182: 298 | B182: 128039 | C182: 三力转债! | D182: 2224 | E182: 三 力 士 | F182: 机械装备 | G182: 专用设备 | H182: 103.75 | I182: -2.e-003 | J182: -6.1999999999999998e-003 | K182: 5.58 | L182: -1.41e-002 | M182: 109.8 | N182: 5.81 | O182: 8.0000000000000002e-002 | P182: 96.04 | Q182: 转股中 | R182: 3.28年 | S182: 1.28年 | T182: 1.28 | U182: 2.03 | V182: 4.7 | W182: 2.3e-002 | X182: 5.0000000000000003e-002 | Y182: 4.8000000000000001e-002 | Z182: 41 | AA182: 1.74 | AB182: 1.78e-002 | AC182: 1.2e-002 | AD182: -8.1000000000000013e-003 | AE182: -1.15e-002 | AG182: 93.69 | AH182: 89.66 | AI182: 0.58 | AJ182: AA- | AK182: 6.5099999999999991e-002 | AL182: =H182+100*O182 -> 111.75 | AM182: 111.5 | AN182: 59 | AO182: 17.8 | AP182: 38 | AQ182: 2.8999999999999998e-002 | AR182: 26 | AS182: 三力转债!
A183: 237 | B183: 113536 | C183: 三星转债 | D183: 603578 | E183: 三星新材 | F183: 家电 | G183: 零部件制 | H183: 106.7 | I183: 1.0200000000000001e-002 | J183: -6.8000000000000005e-003 | K183: 19.38 | L183: 6.1999999999999998e-003 | M183: 114.8 | N183: 19.54 | O183: 7.5999999999999998e-002 | P183: 99.18 | Q183: 转股中 | R183: 4.26年 | S183: 2.26年 | T183: 2.26 | U183: 1.49 | V183: 1.8 | W183: 1.1000000000000001e-002 | X183: 8.4000000000000005e-002 | Y183: 8.3000000000000004e-002 | Z183: 18 | AA183: 2.55 | AB183: 1.77e-002 | AC183: 1.1299999999999999e-002 | AD183: -1.34e-002 | AE183: -1.6e-002 | AG183: 93.14 | AH183: 95.89 | AI183: 0.55 | AJ183: AA | AK183: 4.41e-002 | AL183: =H183+100*O183 -> 114.3 | AM183: 114.2 | AN183: 80 | AO183: 18.3 | AP183: 41 | AQ183: -6.9999999999999993e-003 | AR183: 37 | AS183: 三星转债
A184: 6 | B184: 123093 | C184: 金陵转债 | D184: 300651 | E184: 金陵体育 | F184: 其他 | G184: 文化教育 | H184: 116.9 | I184: 3.4500000000000003e-002 | J184: -5.5000000000000005e-003 | K184: 48.17 | L184: 4.3799999999999999e-002 | M184: 129.3 | N184: 49.29 | O184: 0.19600000000000001 | P184: 97.73 | Q184: 5月0天 | R184: 5.90年 | S184: 3.90年 | T184: 3.9 | U184: 2.5 | V184: 448 | W184: 1.5 | X184: 4.0000000000000001e-002 | Y184: 3.9e-002 | Z184: 62 | AA184: 9.04 | AB184: 1.77e-002 | AC184: 9.4999999999999998e-003 | AD184: -2.3199999999999998e-002 | AE184: -2.6099999999999998e-002 | AG184: 78.84 | AH184: 84.26 | AI184: 0.66 | AJ184: A+ | AK184: 7.7600000000000002e-002 | AL184: =H184+100*O184 -> 136.5 | AM184: 136.1 | AN184: 252 | AO184: 51.8 | AP184: 278 | AQ184: 4.9000000000000002e-002 | AR184: 1 | AS184: 金陵转债
A185: 164 | B185: 128101 | C185: 联创转债! | D185: 2036 | E185: 联创电子 | F185: 电子 | G185: 液晶显示 | H185: 105.6 | I185: -7.7000000000000002e-003 | J185: 1.9e-003 | K185: 10.47 | L185: -1.78e-002 | M185: 115.1 | N185: 13.86 | O185: 0.39799999999999996 | P185: 75.54 | Q185: 转股中 | R185: 5年18天 | S185: 3年18天 | T185: =3+18/365 -> 3.0493150684931507 | U185: 3 | V185: 1.6 | W185: 5.0000000000000001e-003 | X185: 2.7000000000000003e-002 | Y185: 2.1000000000000001e-002 | Z185: 110 | AA185: 3.72 | AB185: 1.7500000000000002e-002 | AC185: 1.21e-002 | AD185: -6.0000000000000001e-003 | AE185: -8.1000000000000013e-003 | AG185: 89.89 | AH185: 92.31 | AI185: 0.33 | AJ185: AA | AK185: 4.5599999999999995e-002 | AL185: =H185+100*O185 -> 145.39999999999998 | AM185: 135.7 | AN185: 251 | AO185: 43.3 | AP185: 247 | AQ185: 1.3000000000000001e-002 | AR185: 17 | AS185: 联创转债!
A186: 234 | B186: 113027 | C186: 华钰转债!! | D186: 601020 | E186: 华钰矿业 | F186: 有色金属 | G186: 锌铅镍锡 | H186: 107.03 | I186: -9.3999999999999986e-003 | J186: -3.3e-003 | K186: 9.95 | L186: -2.07e-002 | M186: 114.9 | N186: 10.17 | O186: 9.4e-002 | P186: 97.84 | Q186: 转股中 | R186: 4.30年 | S186: 2.30年 | U186: 3.25 | V186: 76 | W186: 0.22 | X186: 5.9000000000000004e-002 | Y186: 5.7999999999999996e-002 | Z186: 55 | AA186: 2.27 | AB186: 1.7000000000000001e-002 | AC186: 1.06e-002 | AD186: -1.41e-002 | AE186: -1.67e-002 | AG186: 88.68 | AH186: 88.15 | AI186: 0.62 | AJ186: AA- | AK186: 6.5099999999999991e-002 | AL186: =H186+100*O186 -> 116.43000000000001 | AM186: 116.2 | AN186: 100 | AO186: 27.5 | AP186: 129 | AQ186: 0.14599999999999999 | AR186: 45 | AS186: 华钰转债!!
A187: 251 | B187: 110057 | C187: 现代转债 | D187: 600420 | E187: 现代制药 | F187: 医药 | G187: 化学制药 | H187: 103.7 | I187: 2.7000000000000001e-003 | J187: -5.1999999999999998e-003 | K187: 8.68 | L187: -5.6999999999999993e-003 | M187: 110.8 | N187: 9.89 | O187: 0.182 | P187: 87.77 | Q187: 转股中 | R187: 4年34天 | S187: 2年34天 | U187: 16.2 | V187: 14 | W187: 8.0000000000000002e-003 | X187: 0.18100000000000002 | Y187: 0.159 | Z187: 89 | AA187: 1.13 | AB187: 1.67e-002 | AC187: 1.1599999999999999e-002 | AD187: -1.7000000000000001e-003 | AE187: -4.5999999999999999e-003 | AG187: 94.81 | AH187: 95.03 | AI187: 0.43 | AJ187: AAA | AK187: 3.9100000000000003e-002 | AL187: =H187+100*O187 -> 121.90000000000001 | AM187: 119.6 | AN187: 142 | AO187: 24.6 | AP187: 99 | AQ187: 0. | AR187: 24 | AS187: 现代转债
A188: 203 | B188: 110062 | C188: 烽火转债! | D188: 600498 | E188: 烽火通信 | F188: 通信互联 | G188: 通信设备 | H188: 102.56 | I188: -8.3999999999999995e-003 | J188: 6.3e-003 | K188: 19.14 | L188: -7.3000000000000001e-003 | M188: 110.8 | N188: 25.65 | O188: 0.374 | P188: 74.62 | Q188: 转股中 | R188: 4.77年 | S188: 2.77年 | U188: 30.9 | V188: 11 | W188: 4.0000000000000001e-003 | X188: 0.13800000000000001 | Y188: 0.10300000000000001 | Z188: 224 | AA188: 2.11 | AB188: 1.67e-002 | AC188: 1.23e-002 | AD188: 2.5000000000000001e-003 | AE188: 2.9999999999999997e-004 | AG188: 92.4 | AH188: 92.61 | AI188: 0.29 | AJ188: AAA | AK188: 3.9100000000000003e-002 | AL188: =H188+100*O188 -> 139.96000000000001 | AM188: 130.5 | AN188: 224 | AO188: 37.9 | AP188: 221 | AQ188: -2.7999999999999997e-002 | AR188: 21 | AS188: 烽火转债!
A189: 143 | B189: 128107 | C189: 交科转债 | D189: 2061 | E189: 浙江交科 | F189: 建筑 | G189: 建筑工程 | H189: 106.61 | I189: -5.8999999999999999e-003 | J189: -1.7000000000000001e-003 | K189: 5.29 | L189: -1.3100000000000001e-002 | M189: 115.3 | N189: 5.36 | O189: 8.0000000000000002e-002 | P189: 98.69 | Q189: 转股中 | R189: 5年55天 | S189: 3年55天 | U189: 25 | V189: 12 | W189: 4.0000000000000001e-003 | X189: 0.34399999999999997 | Y189: 0.33899999999999997 | Z189: 73 | AA189: 0.91 | AB189: 1.5700000000000002e-002 | AC189: 1.0200000000000001e-002 | AD189: -8.1000000000000013e-003 | AE189: -1.03e-002 | AG189: 90.24 | AH189: 92.98 | AI189: 0.58 | AJ189: AA+ | AK189: 4.36e-002 | AL189: =H189+100*O189 -> 114.61 | AM189: 114.5 | AN189: 82 | AO189: 21.5 | AP189: 64 | AQ189: 2.5000000000000001e-002 | AR189: 16 | AS189: 交科转债
A190: 261 | B190: 127011 | C190: 中鼎转2! | D190: 887 | E190: 中鼎股份 | F190: 汽车 | G190: 零部件制 | H190: 108.52 | I190: -1.0800000000000001e-002 | J190: 3.2000000000000002e-003 | K190: 9.8 | L190: -2.1000000000000001e-002 | M190: 115.2 | N190: 11.59 | O190: 0.28300000000000003 | P190: 84.56 | Q190: 转股中 | R190: 4年10天 | S190: 2年10天 | U190: 12 | V190: 8 | W190: 6.0000000000000001e-003 | X190: 0.10000000000000001 | Y190: 8.5000000000000006e-002 | Z190: 120 | AA190: 1.37 | AB190: 1.5300000000000001e-002 | AC190: 8.3999999999999995e-003 | AD190: -2.1499999999999998e-002 | AE190: -2.4500000000000001e-002 | AG190: 94.69 | AH190: 97.96 | AI190: 0.36 | AJ190: AA+ | AK190: 4.2099999999999999e-002 | AL190: =H190+100*O190 -> 136.81999999999999 | AM190: 132.5 | AN190: 237 | AO190: 34.5 | AP190: 197 | AQ190: -3.9e-002 | AR190: 25 | AS190: 中鼎转2!
A191: 135 | B191: 128109 | C191: 楚江转债 | D191: 2171 | E191: 楚江新材 | F191: 有色金属 | G191: 铜金属 | H191: 106.68 | I191: -6.7000000000000002e-003 | J191: -2.0000000000000001e-004 | K191: 7.74 | L191: -1.3999999999999999e-002 | M191: 115.3 | N191: 8.73 | O191: 0.20300000000000001 | P191: 88.66 | Q191: 转股中 | R191: 5.27年 | S191: 3.27年 | U191: 18.3 | V191: 3.3 | W191: 2.e-003 | X191: 0.17699999999999999 | Y191: 0.157 | Z191: 103 | AA191: 1.88 | AB191: 1.52e-002 | AC191: 9.8999999999999991e-003 | AD191: -8.0000000000000002e-003 | AE191: -1.01e-002 | AG191: 89.21 | AH191: 91.61 | AI191: 0.49 | AJ191: AA | AK191: 4.5599999999999995e-002 | AL191: =H191+100*O191 -> 126.98 | AM191: 124.7 | AN191: 181 | AO191: 33.1 | AP191: 192 | AQ191: 4.0000000000000001e-003 | AR191: 6 | AS191: 楚江转债
A192: 297 | B192: 128040 | C192: 华通转债! | D192: 2758 | E192: 浙农股份 | F192: 医药 | G192: 医药商业 | H192: 106.986 | I192: -1.e-004 | J192: 3.0999999999999999e-003 | K192: 10.72 | L192: 4.6999999999999993e-003 | M192: 112.3 | N192: 10.33 | O192: 3.1e-002 | P192: 103.78 | Q192: 转股中 | R192: 3.30年 | S192: 1.30年 | U192: 2.22 | V192: 7.9 | W192: 3.3000000000000002e-002 | X192: 4.2000000000000003e-002 | Y192: 4.4000000000000004e-002 | Z192: 52 | AA192: 3.55 | AB192: 1.5100000000000001e-002 | AC192: 8.199999999999999e-003 | AD192: -2.7200000000000002e-002 | AE192: -3.0800000000000001e-002 | AG192: 93.83 | AH192: 91.64 | AI192: 0.64 | AJ192: AA- | AK192: 6.5099999999999991e-002 | AL192: =H192+100*O192 -> 110.086 | AM192: 110.2 | AN192: 50 | AO192: 16.4 | AP192: 33 | AQ192: 1.2e-002 | AR192: 31 | AS192: 华通转债!
A193: 189 | B193: 128090 | C193: 汽模转2 | D193: 2510 | E193: 天汽模 | F193: 汽车 | G193: 零部件制 | H193: 107.198 | I193: 9.8999999999999991e-003 | J193: -1.5e-003 | K193: 4.19 | L193: 1.4499999999999999e-002 | M193: 114.9 | N193: 4.21 | O193: 7.6999999999999999e-002 | P193: 99.52 | Q193: 转股中 | R193: 4.83年 | S193: 2.83年 | U193: 3.1 | V193: 30 | W193: 9.0999999999999998e-002 | X193: 7.8e-002 | Y193: 7.6999999999999999e-002 | Z193: 40 | AA193: 1.45 | AB193: 1.47e-002 | AC193: 9.1000000000000004e-003 | AD193: -1.21e-002 | AE193: -1.4199999999999999e-002 | AG193: 90.95 | AH193: 93.64 | AI193: 0.57 | AJ193: AA | AK193: 4.41e-002 | AL193: =H193+100*O193 -> 114.898 | AM193: 114.9 | AN193: 86 | AO193: 21.2 | AP193: 60 | AQ193: 4.0000000000000001e-003 | AR193: 28 | AS193: 汽模转2
A194: 151 | B194: 123048 | C194: 应急转债! | D194: 300527 | E194: 中船应急 | F194: 机械装备 | G194: 专用设备 | H194: 105.371 | I194: -4.5999999999999999e-003 | J194: -4.1999999999999997e-003 | K194: 8.18 | L194: -1.6799999999999999e-002 | M194: 113.1 | N194: 8.9 | O194: 0.14599999999999999 | P194: 91.91 | Q194: 转股中 | R194: 5年43天 | S194: 3年43天 | U194: 3.8 | V194: 7.4 | W194: 1.8000000000000002e-002 | X194: 4.8000000000000001e-002 | Y194: 4.4000000000000004e-002 | Z194: 79 | AA194: 3.16 | AB194: 1.4199999999999999e-002 | AC194: 9.3999999999999986e-003 | AD194: -5.1999999999999998e-003 | AE194: -7.3000000000000001e-003 | AG194: 90.17 | AH194: 91.31 | AI194: 0.53 | AJ194: AA+ | AK194: 4.36e-002 | AL194: =H194+100*O194 -> 119.97099999999999 | AM194: 118.8 | AN194: 130 | AO194: 27.5 | AP194: 128 | AQ194: -4.0000000000000001e-003 | AR194: 16 | AS194: 应急转债!
A195: 60 | B195: 123070 | C195: 鹏辉转债 | D195: 300438 | E195: 鹏辉能源 | F195: 汽车 | G195: 零部件制 | H195: 106.502 | I195: -2.1499999999999998e-002 | J195: 1.66e-002 | K195: 17.4 | L195: -1.0200000000000001e-002 | M195: 115.1 | N195: 20.16 | O195: 0.23399999999999999 | P195: 86.31 | Q195: 59天 | R195: 5.65年 | S195: 3.65年 | U195: 8.9 | V195: 41 | W195: 4.2999999999999997e-002 | X195: 0.122 | Y195: 0.105 | Z195: 73 | AA195: 2.95 | AB195: 1.41e-002 | AC195: 9.1999999999999998e-003 | AD195: -7.3000000000000001e-003 | AE195: -9.1000000000000004e-003 | AG195: 87.53 | AH195: 89.89 | AI195: 0.48 | AJ195: AA | AK195: 4.5599999999999995e-002 | AL195: =H195+100*O195 -> 129.90199999999999 | AM195: 126.7 | AN195: 202 | AO195: 36.8 | AP195: 217 | AQ195: -0.13900000000000001 | AR195: 4 | AS195: 鹏辉转债
A196: 81 | B196: 128128 | C196: 齐翔转2 | D196: 2408. | E196: 齐翔腾达 | F196: 化工 | G196: 化工 | H196: 107 | I196: -2.1099999999999997e-002 | J196: 2.8000000000000004e-003 | K196: 8.81 | L196: -2.76e-002 | M196: 115.3 | N196: 8.22 | O196: -2.e-003 | P196: 107.18 | Q196: 转股中 | R196: 5.48年 | S196: 3.48年 | U196: 29.9 | V196: 157 | W196: 4.9000000000000002e-002 | X196: 0.191 | Y196: 0.20499999999999999 | Z196: 156 | AA196: 1.91 | AB196: 1.3999999999999999e-002 | AC196: 8.8999999999999999e-003 | AD196: -8.6e-003 | AE196: -1.0500000000000001e-002 | AG196: 88.29 | AH196: 90.73 | AI196: 0.66 | AJ196: AA | AK196: 4.5599999999999995e-002 | AL196: =H196+100*O196 -> 106.8 | AM196: 106.8 | AN196: 28 | AO196: 16.1 | AP196: 32 | AQ196: -1.3000000000000001e-002 | AR196: 41 | AS196: 齐翔转2
A197: 40 | B197: 110077 | C197: 洪城转债 | D197: 600461 | E197: 洪城水业 | F197: 城市公用 | G197: 城市公用 | H197: 105.19 | I197: 8.9999999999999998e-004 | J197: -1.6000000000000001e-003 | K197: 6.08 | L197: -1.6000000000000001e-003 | M197: 113.5 | N197: 7.13 | O197: 0.23399999999999999 | P197: 85.27 | Q197: 2月29天 | R197: 5.73年 | S197: 3.73年 | U197: 18 | V197: 2 | W197: 1.e-003 | X197: 0.312 | Y197: 0.26600000000000001 | Z197: 58 | AA197: 1.14 | AB197: 1.3500000000000002e-002 | AC197: 9.1999999999999998e-003 | AD197: -7.3000000000000001e-003 | AE197: -8.3999999999999995e-003 | AG197: 86.66 | AH197: 89.13 | AI197: 0.46 | AJ197: AA+ | AK197: 4.36e-002 | AL197: =H197+100*O197 -> 128.59 | AM197: 125.1 | AN197: 184 | AO197: 36 | AP197: 209 | AQ197: -4.0000000000000001e-003 | AR197: 5 | AS197: 洪城转债
A198: 7 | B198: 113618 | C198: 美诺转债! | D198: 603538 | E198: 美诺华 | F198: 医药 | G198: 原料药 | H198: 107.03 | I198: -1.01e-002 | J198: -9.7999999999999997e-003 | K198: 32.91 | L198: -3.1800000000000002e-002 | M198: 115.3 | N198: 37.47 | O198: 0.21899999999999997 | P198: 87.83 | Q198: 4月24天 | R198: 5.88年 | S198: 3.88年 | U198: 5.2 | V198: 19 | W198: 3.5000000000000003e-002 | X198: 0.106 | Y198: 9.3000000000000013e-002 | Z198: 49 | AA198: 3.24 | AB198: 1.3000000000000001e-002 | AC198: 8.199999999999999e-003 | AD198: -7.6e-003 | AE198: -9.3999999999999986e-003 | AG198: 80.15 | AH198: 79.49 | AI198: 0.62 | AJ198: AA- | AK198: 6.6600000000000006e-002 | AL198: =H198+100*O198 -> 128.93000000000001 | AM198: 126.2 | AN198: 200 | AO198: 46.1 | AP198: 258 | AQ198: 4.8000000000000001e-002 | AR198: 2 | AS198: 美诺转债!
A199: 210 | B199: 123033 | C199: 金力转债! | D199: 300748 | E199: 金力永磁 | F199: 电子 | G199: 元器件制 | H199: 114.9 | I199: 3.4999999999999996e-003 | J199: -1.15e-002 | K199: 37.19 | L199: -1.4800000000000001e-002 | M199: 121.5 | N199: 40.68 | O199: 0.25700000000000001 | P199: 91.42 | Q199: 转股中 | R199: 4.68年 | S199: 2.68年 | U199: 4.34 | V199: 57 | W199: 0.115 | X199: 2.7000000000000003e-002 | Y199: 2.5000000000000001e-002 | Z199: 161 | AA199: 11.51 | AB199: 1.23e-002 | AC199: 4.3e-003 | AD199: -3.1600000000000003e-002 | AE199: -3.4799999999999998e-002 | AG199: 87.98 | AH199: 91.23 | AI199: 0.54 | AJ199: AA- | AK199: 6.5099999999999991e-002 | AL199: =H199+100*O199 -> 140.59999999999999 | AM199: 138.4 | AN199: 268 | AO199: 47.2 | AP199: 262 | AQ199: 2.6000000000000002e-002 | AR199: 28 | AS199: 金力转债!
A200: 243 | B200: 113026 | C200: 核能转债! | D200: 601985 | E200: 中国核电 | F200: 能源电力 | G200: 核电 | H200: 104.7 | I200: -3.4999999999999996e-003 | J200: -4.8999999999999998e-003 | K200: 5.17 | L200: -1.9e-002 | M200: 109.8 | N200: 5.86 | O200: 0.187 | P200: 88.23 | Q200: 转股中 | R200: 4年48天 | S200: 2年48天 | U200: 78 | V200: 44 | W200: 5.0000000000000001e-003 | X200: 8.5999999999999993e-002 | Y200: 7.5999999999999998e-002 | Z200: 902 | AA200: 1.54 | AB200: 1.18e-002 | AC200: 7.3000000000000001e-003 | AD200: -5.8999999999999999e-003 | AE200: -8.6999999999999994e-003 | AG200: 94.67 | AH200: 94.04 | AI200: 0.44 | AJ200: AAA | AK200: 3.9100000000000003e-002 | AL200: =H200+100*O200 -> 123.40000000000001 | AM200: 121.2 | AN200: 156 | AO200: 26.5 | AP200: 117 | AQ200: 3.3000000000000002e-002 | AR200: 49 | AS200: 核能转债!
A201: 212 | B201: 110060 | C201: 天路转债! | D201: 600326 | E201: 西藏天路 | F201: 建筑 | G201: 水泥 | H201: 109.01 | I201: -8.1000000000000013e-003 | J201: -3.5999999999999999e-003 | K201: 7.06 | L201: -2.0799999999999999e-002 | M201: 114.9 | N201: 7.16 | O201: 0.106 | P201: 98.6 | Q201: 转股中 | R201: 4.67年 | S201: 2.67年 | U201: 7.06 | V201: 3.6 | W201: 5.0000000000000001e-003 | X201: 0.109 | Y201: 0.107 | Z201: 65 | AA201: 1.74 | AB201: 1.1599999999999999e-002 | AC201: 5.6999999999999993e-003 | AD201: -1.8600000000000002e-002 | AE201: -2.0899999999999998e-002 | AG201: 91.6 | AH201: 94.3 | AI201: 0.56 | AJ201: AA | AK201: 4.41e-002 | AL201: =H201+100*O201 -> 119.61 | AM201: 119.4 | AN201: 138 | AO201: 25.1 | AP201: 105 | AQ201: 5.7000000000000002e-002 | AR201: 13 | AS201: 天路转债!
A202: 169 | B202: 110067 | C202: 华安转债! | D202: 600909 | E202: 华安证券 | F202: 金融 | G202: 证券行业 | H202: 104.4 | I202: -9.3999999999999986e-003 | J202: 6.7000000000000002e-003 | K202: 6.74 | L202: -7.4000000000000003e-003 | M202: 110.5 | N202: 8.67 | O202: 0.34299999999999997 | P202: 77.74 | Q202: 转股中 | R202: 5年14天 | S202: 无权 | U202: 28 | V202: 26 | W202: 9.0000000000000011e-003 | X202: 0.115 | Y202: 8.900000000000001e-002 | Z202: 244 | AA202: 1.76 | AB202: 1.15e-002 | AC202: 7.6e-003 | AD202: 无权 | AE202: 无权 | AG202: 无权 | AH202: 90.67 | AI202: 0.36 | AJ202: AAA | AK202: 4.0599999999999997e-002 | AL202: =H202+100*O202 -> 138.69999999999999 | AM202: 131.1 | AN202: 227 | AO202: 40.4 | AP202: 234 | AQ202: 3.0000000000000001e-003 | AR202: 27 | AS202: 华安转债!
A203: 254 | B203: 127012 | C203: 招路转债! | D203: 1965 | E203: 招商公路 | F203: 机场高速 | G203: 高速 | H203: 103.41 | I203: -1.7000000000000001e-003 | J203: 9.300000000000001e-003 | K203: 7.14 | L203: 2.29e-002 | M203: 108.2 | N203: 8.81 | O203: 0.27600000000000002 | P203: 81.04 | Q203: 转股中 | R203: 4年24天 | S203: 2年24天 | U203: 50 | V203: 33 | W203: 6.0000000000000001e-003 | X203: 0.113 | Y203: 9.1999999999999998e-002 | Z203: 441 | AA203: 0.91 | AB203: 1.1399999999999999e-002 | AC203: 7.4999999999999997e-003 | AD203: -6.4000000000000003e-003 | AE203: -8.1000000000000013e-003 | AG203: 93.64 | AH203: 92.78 | AI203: 0.33 | AJ203: AAA | AK203: 3.9100000000000003e-002 | AL203: =H203+100*O203 -> 131.00999999999999 | AM203: 125.8 | AN203: 195 | AO203: 32.1 | AP203: 176 | AQ203: 5.9999999999999998e-002 | AR203: 36 | AS203: 招路转债!
A204: 275 | B204: 128051 | C204: 光华转债! | D204: 2741 | E204: 光华科技 | F204: 电子 | G204: 元器件制 | H204: 110.088 | I204: 1.e-002 | J204: 1.1000000000000001e-003 | K204: 13.98 | L204: 1.6e-002 | M204: 114.8 | N204: 12.72 | O204: 2.e-003 | P204: 109.91 | Q204: 转股中 | R204: 3.80年 | S204: 1.80年 | U204: 2.48 | V204: 10 | W204: 3.7999999999999999e-002 | X204: 4.7e-002 | Y204: 5.2000000000000005e-002 | Z204: 52 | AA204: 4.32 | AB204: 1.1299999999999999e-002 | AC204: 4.1999999999999997e-003 | AD204: -3.2899999999999999e-002 | AE204: -3.5900000000000001e-002 | AG204: 91.2 | AH204: 90.79 | AI204: 0.69 | AJ204: AA- | AK204: 6.5099999999999991e-002 | AL204: =H204+100*O204 -> 110.288 | AM204: 110.3 | AN204: 53 | AO204: 19.1 | AP204: 48 | AQ204: 7.2999999999999995e-002 | AR204: 27 | AS204: 光华转债!
A205: 194 | B205: 113559 | C205: 永创转债! | D205: 603901 | E205: 永创智能 | F205: 机械装备 | G205: 专用设备 | H205: 112.47 | I205: 1.09e-002 | J205: -7.8000000000000005e-003 | K205: 10.22 | L205: 4.8999999999999998e-003 | M205: 118.3 | N205: 10.32 | O205: 0.13600000000000001 | P205: 99.03 | Q205: 转股中 | R205: 4.82年 | S205: 2.82年 | U205: 5.1 | V205: 66 | W205: 0.113 | X205: 0.114 | Y205: 0.11199999999999999 | Z205: 45 | AA205: 3.25 | AB205: 1.0800000000000001e-002 | AC205: 4.0000000000000001e-003 | AD205: -2.4900000000000002e-002 | AE205: -2.7699999999999999e-002 | AG205: 86.65 | AH205: 87.94 | AI205: 0.63 | AJ205: AA- | AK205: 6.5099999999999991e-002 | AL205: =H205+100*O205 -> 126.06999999999999 | AM205: 125.9 | AN205: 198 | AO205: 38 | AP205: 222 | AQ205: 6.0999999999999999e-002 | AR205: 21 | AS205: 永创转债!
A206: 53 | B206: 123074 | C206: 隆利转债 | D206: 300752 | E206: 隆利科技 | F206: 电子 | G206: 液晶显示 | H206: 116.787 | I206: 7.000000000000001e-004 | J206: -8.199999999999999e-003 | K206: 34.75 | L206: -1.03e-002 | M206: 124 | N206: 29.41 | O206: -1.2e-002 | P206: 118.16 | Q206: 2月7天 | R206: 5.67年 | S206: 3.67年 | U206: 3.25 | V206: 251 | W206: 0.66400000000000003 | X206: 7.6999999999999999e-002 | Y206: 9.1999999999999998e-002 | Z206: 42 | AA206: 4.81 | AB206: 1.0800000000000001e-002 | AC206: 3.7000000000000002e-003 | AD206: -3.0200000000000001e-002 | AE206: -3.2099999999999997e-002 | AG206: 81.34 | AH206: 86.64 | AI206: 0.73 | AJ206: AA- | AK206: 6.6600000000000006e-002 | AL206: =H206+100*O206 -> 115.587 | AM206: 115.4 | AN206: 94 | AO206: 28.8 | AP206: 141 | AQ206: -6.2e-002 | AR206: 11 | AS206: 隆利转债
A207: 247 | B207: 128064 | C207: 司尔转债! | D207: 2538 | E207: 司尔特 | F207: 化工 | G207: 农化 | H207: 110.222 | I207: -1.37e-002 | J207: 1.46e-002 | K207: 5.97 | L207: 1.7000000000000001e-003 | M207: 114.9 | N207: 6.07 | O207: 0.121 | P207: 98.35 | Q207: 转股中 | R207: 4年41天 | S207: 2年41天 | U207: 8 | V207: 1.6 | W207: 2.e-003 | X207: 0.187 | Y207: 0.184 | Z207: 43 | AA207: 1.12 | AB207: 1.04e-002 | AC207: 3.8e-003 | AD207: -2.7999999999999997e-002 | AE207: -3.0699999999999998e-002 | AG207: 93.82 | AH207: 96.59 | AI207: 0.54 | AJ207: AA | AK207: 4.41e-002 | AL207: =H207+100*O207 -> 122.32199999999999 | AM207: 122.1 | AN207: 160 | AO207: 25.5 | AP207: 108 | AQ207: 5.9999999999999998e-002 | AR207: 53 | AS207: 司尔转债!
A208: 314 | B208: 128032 | C208: 双环转债! | D208: 2472 | E208: 双环传动 | F208: 机械装备 | G208: 通用设备 | H208: 106.275 | I208: -2.0999999999999999e-003 | J208: 6.1999999999999998e-003 | K208: 9.39 | L208: 8.6e-003 | M208: 109.3 | N208: 9.89 | O208: 0.11900000000000001 | P208: 94.94 | Q208: 转股中 | R208: 2.83年 | S208: 0.83年 | U208: 10 | V208: 3.4 | W208: 3.0000000000000001e-003 | X208: 0.155 | Y208: 0.14699999999999999 | Z208: 64 | AA208: 1.93 | AB208: 1.01e-002 | AC208: 3.9000000000000003e-003 | AD208: -4.2500000000000003e-002 | AE208: -4.58e-002 | AG208: 97.73 | AH208: 97.48 | AI208: 0.47 | AJ208: AA | AK208: 4.2000000000000003e-002 | AL208: =H208+100*O208 -> 118.17500000000001 | AM208: 117.6 | AN208: 115 | AO208: 19.9 | AP208: 54 | AQ208: 3.7000000000000005e-002 | AR208: 44 | AS208: 双环转债!
A209: 150 | B209: 128106 | C209: 华统转债 | D209: 2840 | E209: 华统股份 | F209: 农业 | G209: 农产品加 | H209: 107.8 | I209: -7.4000000000000003e-003 | J209: 7.4000000000000003e-003 | K209: 9.45 | L209: 0. | M209: 113.2 | N209: 9.39 | O209: 7.0999999999999994e-002 | P209: 100.64 | Q209: 转股中 | R209: 5年43天 | S209: 3年43天 | U209: 5.37 | V209: 1.4 | W209: 2.e-003 | X209: 0.127 | Y209: 0.128 | Z209: 42 | AA209: 2.52 | AB209: 9.7999999999999997e-003 | AC209: 5.0000000000000001e-003 | AD209: -1.1899999999999999e-002 | AE209: -1.3999999999999999e-002 | AG209: 89.71 | AH209: 90.54 | AI209: 0.63 | AJ209: AA | AK209: 4.5599999999999995e-002 | AL209: =H209+100*O209 -> 114.89999999999999 | AM209: 115 | AN209: 89 | AO209: 24.4 | AP209: 96 | AQ209: 4.4999999999999998e-002 | AR209: 8 | AS209: 华统转债
A210: 262 | B210: 128057 | C210: 博彦转债 | D210: 2649 | E210: 博彦科技 | F210: 计算机及 | G210: 软件开发 | H210: 112.879 | I210: 4.8999999999999998e-003 | J210: 2.0000000000000001e-004 | K210: 9.52 | L210: 7.4000000000000003e-003 | M210: 117.1 | N210: 8.72 | O210: 3.4000000000000002e-002 | P210: 109.17 | Q210: 转股中 | R210: 4年7天 | S210: 2年7天 | U210: 5.1 | V210: 12 | W210: 2.e-002 | X210: 0.10099999999999999 | Y210: 0.11 | Z210: 51 | AA210: 1.78 | AB210: 9.3999999999999986e-003 | AC210: 1.8e-003 | AD210: -3.9e-002 | AE210: -4.2000000000000003e-002 | AG210: 90.44 | AH210: 91.45 | AI210: 0.69 | AJ210: AA- | AK210: 6.5099999999999991e-002 | AL210: =H210+100*O210 -> 116.27900000000001 | AM210: 116.6 | AN210: 104 | AO210: 25.1 | AP210: 106 | AQ210: 3.7999999999999999e-002 | AR210: 28 | AS210: 博彦转债
A211: 98 | B211: 110073 | C211: 国投转债 | D211: 600061 | E211: 国投资本 | F211: 金融 | G211: 证券行业 | H211: 105.24 | I211: -1.3500000000000002e-002 | J211: 7.000000000000001e-004 | K211: 12.24 | L211: -3.1600000000000003e-002 | M211: 110.5 | N211: 15.25 | O211: 0.311 | P211: 80.26 | Q211: 转股中 | R211: 5.41年 | S211: 无权 | U211: 80 | V211: 69 | W211: 8.0000000000000002e-003 | X211: 0.155 | Y211: 0.124 | Z211: 517 | AA211: 1.24 | AB211: 9.1999999999999998e-003 | AC211: 5.5000000000000005e-003 | AD211: 无权 | AE211: 无权 | AG211: 无权 | AH211: 89.36 | AI211: 0.4 | AJ211: AAA | AK211: 4.0599999999999997e-002 | AL211: =H211+100*O211 -> 136.34 | AM211: 130.2 | AN211: 222 | AO211: 40.9 | AP211: 236 | AQ211: -4.0000000000000001e-002 | AR211: 22 | AS211: 国投转债
A212: 230 | B212: 113541 | C212: 荣晟转债! | D212: 603165 | E212: 荣晟环保 | F212: 造纸包装 | G212: 包装用纸 | H212: 110.61 | I212: 1.4199999999999999e-002 | J212: -5.9999999999999995e-004 | K212: 12.62 | L212: 1.9400000000000001e-002 | M212: 115 | N212: 11.54 | O212: 1.1000000000000001e-002 | P212: 109.36 | Q212: 转股中 | R212: 4.40年 | S212: 2.40年 | U212: 2.7 | V212: 8.5 | W212: 2.7999999999999997e-002 | X212: 8.5000000000000006e-002 | Y212: 9.1999999999999998e-002 | Z212: 32 | AA212: 2.08 | AB212: 9.1000000000000004e-003 | AC212: 2.8999999999999998e-003 | AD212: -2.58e-002 | AE212: -2.8300000000000002e-002 | AG212: 88.18 | AH212: 87.65 | AI212: 0.7 | AJ212: AA- | AK212: 6.5099999999999991e-002 | AL212: =H212+100*O212 -> 111.70999999999999 | AM212: 111.9 | AN212: 61 | AO212: 23.7 | AP212: 90 | AQ212: 9.0000000000000011e-003 | AR212: 47 | AS212: 荣晟转债!
A213: 309 | B213: 128034 | C213: 江银转债! | D213: 2807 | E213: 江阴银行 | F213: 金融 | G213: 银行行业 | H213: 105.59 | I213: -2.8999999999999998e-003 | J213: -4.1999999999999997e-003 | K213: 4.13 | L213: -1.67e-002 | M213: 108.3 | N213: 4.5 | O213: 0.14999999999999999 | P213: 91.78 | Q213: 转股中 | R213: 2.92年 | S213: 无权 | U213: 17.6 | V213: 14 | W213: 6.9999999999999993e-003 | X213: 0.19600000000000001 | Y213: 0.17999999999999999 | Z213: 90 | AA213: 0.79 | AB213: 8.8000000000000005e-003 | AC213: 3.4000000000000002e-003 | AD213: 无权 | AE213: 无权 | AG213: 无权 | AH213: 96.72 | AI213: 0.43 | AJ213: AA+ | AK213: 4.0000000000000001e-002 | AL213: =H213+100*O213 -> 120.59 | AM213: 119.4 | AN213: 136 | AO213: 22.7 | AP213: 76 | AQ213: 6.0000000000000001e-003 | AR213: 27 | AS213: 江银转债!
A214: 183 | B214: 128094 | C214: 星帅转债 | D214: 2860 | E214: 星帅尔 | F214: 家电 | G214: 零部件制 | H214: 116.12 | I214: -2.92e-002 | J214: -1.e-004 | K214: 16.13 | L214: -3.9300000000000002e-002 | M214: 121 | N214: 13.95 | O214: 4.0000000000000001e-003 | P214: 115.63 | Q214: 转股中 | R214: 4.89年 | S214: 2.89年 | U214: 2.75 | V214: 47 | W214: 0.14800000000000002 | X214: 8.5999999999999993e-002 | Y214: 9.9000000000000005e-002 | Z214: 32 | AA214: 3.45 | AB214: 8.6e-003 | AC214: 1.1999999999999999e-003 | AD214: -3.5499999999999997e-002 | AE214: -3.7999999999999999e-002 | AG214: 83.39 | AH214: 85.22 | AI214: 0.74 | AJ214: A+ | AK214: 7.6100000000000001e-002 | AL214: =H214+100*O214 -> 116.52000000000001 | AM214: 116.6 | AN214: 105 | AO214: 31.4 | AP214: 166 | AQ214: 4.5999999999999999e-002 | AR214: 32 | AS214: 星帅转债
A215: 310 | B215: 123007 | C215: 道氏转债! | D215: 300409 | E215: 道氏技术 | F215: 建筑 | G215: 建筑行业 | H215: 107.846 | I215: -7.000000000000001e-004 | J215: -1.52e-002 | K215: 15.18 | L215: -2.63e-002 | M215: 110.3 | N215: 14.95 | O215: 6.2e-002 | P215: 101.54 | Q215: 转股中 | R215: 2.84年 | S215: 0.84年 | U215: 3.04 | V215: 12 | W215: 3.7999999999999999e-002 | X215: 4.4000000000000004e-002 | Y215: 4.4000000000000004e-002 | Z215: 70 | AA215: 2.89 | AB215: 8.1000000000000013e-003 | AC215: 1.2999999999999999e-003 | AD215: -5.6100000000000004e-002 | AE215: -5.9400000000000001e-002 | AG215: 95.77 | AH215: 93.01 | AI215: 0.6 | AJ215: AA- | AK215: 6.3e-002 | AL215: =H215+100*O215 -> 114.04600000000001 | AM215: 114.2 | AN215: 79 | AO215: 18.4 | AP215: 43 | AQ215: -1.7000000000000001e-002 | AR215: 22 | AS215: 道氏转债!
A216: 16 | B216: 128141 | C216: 旺能转债 | D216: 2034 | E216: 旺能环境 | F216: 城市公用 | G216: 三废处理 | H216: 109.902 | I216: 6.0000000000000001e-003 | J216: 3.7900000000000003e-002 | K216: 17.22 | L216: 6.8199999999999997e-002 | M216: 115.1 | N216: 16.47 | O216: 5.0999999999999997e-002 | P216: 104.55 | Q216: 3月27天 | R216: 5.81年 | S216: 3.81年 | U216: 14 | V216: 92 | W216: 5.9999999999999998e-002 | X216: 0.193 | Y216: 0.20199999999999999 | Z216: 73 | AA216: 1.63 | AB216: 8.1000000000000013e-003 | AC216: 3.4000000000000002e-003 | AD216: -1.49e-002 | AE216: -1.66e-002 | AG216: 86.91 | AH216: 89.25 | AI216: 0.64 | AJ216: AA | AK216: 4.5599999999999995e-002 | AL216: =H216+100*O216 -> 115.002 | AM216: 115.3 | AN216: 93 | AO216: 26 | AP216: 112 | AQ216: 0.10000000000000001 | AR216: 3 | AS216: 旺能转债
A217: 279 | B217: 110047 | C217: 山鹰转债 | D217: 600567 | E217: 山鹰国际 | F217: 造纸包装 | G217: 包装用纸 | H217: 114.7 | I217: -3.4300000000000004e-002 | J217: 5.3e-003 | K217: 3.77 | L217: -4.5599999999999995e-002 | M217: 117.5 | N217: 3.34 | O217: 1.6e-002 | P217: 112.87 | Q217: 转股中 | R217: 3.74年 | S217: 1.74年 | U217: 22.5 | V217: 132 | W217: 5.0999999999999997e-002 | X217: 0.13 | Y217: 0.14699999999999999 | Z217: 173 | AA217: 1.18 | AB217: 6.6e-003 | AC217: -1.7000000000000001e-003 | AD217: -5.62e-002 | AE217: -5.8899999999999994e-002 | AG217: 95.14 | AH217: 101.01 | AI217: 0.64 | AJ217: AA+ | AK217: 4.2099999999999999e-002 | AL217: =H217+100*O217 -> 116.3 | AM217: 116.5 | AN217: 102 | AO217: 15.5 | AP217: 31 | AQ217: 0.157 | AR217: 35 | AS217: 山鹰转债
A218: 1 | B218: 123098 | C218: 一品转债 | D218: 300723 | E218: 一品红 | F218: 医药 | G218: 医药行业 | H218: 120.3 | I218: -5.7999999999999996e-003 | J218: -1.2699999999999999e-002 | K218: 45.51 | L218: -2.86e-002 | M218: 124 | N218: 45.78 | O218: 0.20999999999999999 | P218: 99.41 | Q218: 5月8天 | R218: 5.92年 | S218: 3.92年 | U218: 4.8 | V218: 44 | W218: 7.5999999999999998e-002 | X218: 6.6000000000000003e-002 | Y218: 6.5000000000000002e-002 | Z218: 73 | AA218: 5 | AB218: 5.1999999999999998e-003 | AC218: -1.6000000000000001e-003 | AD218: -3.5499999999999997e-002 | AE218: -3.7200000000000004e-002 | AG218: 80.04 | AH218: 85.26 | AI218: 0.65 | AJ218: AA- | AK218: 6.6600000000000006e-002 | AL218: =H218+100*O218 -> 141.30000000000001 | AM218: 141.2 | AN218: 278 | AO218: 55.9 | AP218: 291 | AQ218: -3.0000000000000001e-003 | AR218: 1 | AS218: 一品转债
A219: 78 | B219: 113602 | C219: 景20转债! | D219: 603228 | E219: 景旺电子 | F219: 电子 | G219: 元器件制 | H219: 110.23 | I219: 5.0099999999999999e-002 | J219: -4.1100000000000005e-002 | K219: 28.03 | L219: 2.1899999999999999e-002 | M219: 113.3 | N219: 35.28 | O219: 0.38700000000000001 | P219: 79.45 | Q219: 3.6天 | R219: 5.49年 | S219: 3.49年 | U219: 17.8 | V219: 193 | W219: 9.9000000000000005e-002 | X219: 7.400000000000001e-002 | Y219: 5.9000000000000004e-002 | Z219: 239 | AA219: 3.99 | AB219: 5.1000000000000004e-003 | AC219: 7.000000000000001e-004 | AD219: -1.6500000000000001e-002 | AE219: -1.84e-002 | AG219: 88.33 | AH219: 89.14 | AI219: 0.41 | AJ219: AA | AK219: 4.5599999999999995e-002 | AL219: =H219+100*O219 -> 148.93000000000001 | AM219: 141 | AN219: 276 | AO219: 51.9 | AP219: 279 | AQ219: 4.5999999999999999e-002 | AR219: 8 | AS219: 景20转债!
A220: 277 | B220: 110048 | C220: 福能转债! | D220: 600483 | E220: 福能股份 | F220: 能源电力 | G220: 电力供应 | H220: 111.21 | I220: 4.0000000000000002e-004 | J220: -1.1000000000000001e-003 | K220: 8.09 | L220: -1.1999999999999999e-003 | M220: 113.3 | N220: 8.12 | O220: 0.11599999999999999 | P220: 99.63 | Q220: 转股中 | R220: 3.78年 | S220: 1.78年 | U220: 28.3 | V220: 4.1 | W220: 1.e-003 | X220: 0.19899999999999998 | Y220: 0.19800000000000001 | Z220: 142 | AA220: 1.01 | AB220: 5.0000000000000001e-003 | AC220: -1.4000000000000002e-003 | AD220: -3.9900000000000005e-002 | AE220: -4.2599999999999999e-002 | AG220: 94.93 | AH220: 97.23 | AI220: 0.54 | AJ220: AA+ | AK220: 4.2099999999999999e-002 | AL220: =H220+100*O220 -> 122.80999999999999 | AM220: 122.8 | AN220: 169 | AO220: 25.6 | AP220: 110 | AQ220: 2.8999999999999998e-002 | AR220: 8 | AS220: 福能转债!
A221: 177 | B221: 113564 | C221: 天目转债 | D221: 603136 | E221: 天目湖 | F221: 旅游餐饮 | G221: 旅游 | H221: 123.94 | I221: 2.0000000000000001e-004 | J221: 7.8000000000000005e-003 | K221: 27.6 | L221: 1.1000000000000001e-002 | M221: 126.7 | N221: 23.1 | O221: 3.7000000000000005e-002 | P221: 119.48 | Q221: 转股中 | R221: 5年2.6天 | S221: 3年1.6天 | U221: 2.87 | V221: 11 | W221: 2.9999999999999999e-002 | X221: 8.900000000000001e-002 | Y221: 0.107 | Z221: 32 | AA221: 3.44 | AB221: 4.5000000000000005e-003 | AC221: -4.3e-003 | AD221: -5.2699999999999997e-002 | AE221: -5.5300000000000002e-002 | AG221: 85.54 | AH221: 92.51 | AI221: 0.72 | AJ221: AA- | AK221: 6.6600000000000006e-002 | AL221: =H221+100*O221 -> 127.64 | AM221: 128.4 | AN221: 213 | AO221: 35.9 | AP221: 207 | AQ221: 0.114 | AR221: 15 | AS221: 天目转债
A222: 137 | B222: 127017 | C222: 万青转债 | D222: 789 | E222: 万年青 | F222: 建筑 | G222: 水泥 | H222: 115.867 | I222: -5.6999999999999993e-003 | J222: -1.01e-002 | K222: 13.45 | L222: -3.0299999999999997e-002 | M222: 118.4 | N222: 14.16 | O222: 0.22 | P222: 94.99 | Q222: 转股中 | R222: 5.27年 | S222: 3.27年 | U222: 10 | V222: 9.2 | W222: 8.0000000000000002e-003 | X222: 9.3000000000000013e-002 | Y222: 8.900000000000001e-002 | Z222: 107 | AA222: 1.93 | AB222: 4.1999999999999997e-003 | AC222: -1.9e-003 | AD222: -3.2000000000000001e-002 | AE222: -3.4000000000000002e-002 | AG222: 89.74 | AH222: 95 | AI222: 0.52 | AJ222: AA+ | AK222: 4.36e-002 | AL222: =H222+100*O222 -> 137.86700000000002 | AM222: 136.7 | AN222: 256 | AO222: 41.7 | AP222: 242 | AQ222: 7.9000000000000001e-002 | AR222: 8 | AS222: 万青转债
A223: 108 | B223: 128121 | C223: 宏川转债 | D223: 2930 | E223: 宏川智慧 | F223: 交通运输 | G223: 物流业 | H223: 110.806 | I223: -2.3700000000000002e-002 | J223: 1.6899999999999998e-002 | K223: 17.99 | L223: -1.1000000000000001e-002 | M223: 113.3 | N223: 20.25 | O223: 0.247 | P223: 88.84 | Q223: 转股中 | R223: 5.39年 | S223: 3.39年 | U223: 6.7 | V223: 13 | W223: 1.8000000000000002e-002 | X223: 8.4000000000000005e-002 | Y223: 7.4999999999999997e-002 | Z223: 80 | AA223: 4.15 | AB223: 4.1999999999999997e-003 | AC223: -2.9999999999999997e-004 | AD223: -1.84e-002 | AE223: -2.0400000000000001e-002 | AG223: 82.75 | AH223: 80.66 | AI223: 0.62 | AJ223: AA- | AK223: 6.6600000000000006e-002 | AL223: =H223+100*O223 -> 135.506 | AM223: 132.8 | AN223: 240 | AO223: 50 | AP223: 271 | AQ223: -4.2000000000000003e-002 | AR223: 4 | AS223: 宏川转债
A224: 126 | B224: 128114 | C224: 正邦转债 | D224: 2157 | E224: 正邦科技 | F224: 农业 | G224: 畜牧业 | H224: 112.849 | I224: -4.2000000000000003e-002 | J224: 2.23e-002 | K224: 16.56 | L224: -3.04e-002 | M224: 115.3 | N224: 15.55 | O224: 5.9999999999999998e-002 | P224: 106.5 | Q224: 转股中 | R224: 5.31年 | S224: 3.31年 | U224: 16 | V224: 105 | W224: 5.7999999999999996e-002 | X224: 3.1e-002 | Y224: 3.3000000000000002e-002 | Z224: 513 | AA224: 2.78 | AB224: 4.0999999999999995e-003 | AC224: -1.e-003 | AD224: -2.4e-002 | AE224: -2.6099999999999998e-002 | AG224: 89.65 | AH224: 92.38 | AI224: 0.65 | AJ224: AA+ | AK224: 4.36e-002 | AL224: =H224+100*O224 -> 118.849 | AM224: 119.2 | AN224: 135 | AO224: 26.8 | AP224: 121 | AQ224: -2.e-002 | AR224: 14 | AS224: 正邦转债
A225: 324 | B225: 123002 | C225: 国祯转债!! | D225: 300388 | E225: 节能国祯 | F225: 城市公用 | G225: 三废处理 | H225: 107.744 | I225: 8.199999999999999e-003 | J225: 0. | K225: 8.07 | L225: 1.6399999999999998e-002 | M225: 108.8 | N225: 8.48 | O225: 0.13200000000000001 | P225: 95.17 | Q225: 转股中 | R225: 2.74年 | S225: 0.74年 | U225: 2.52 | V225: 2.4 | W225: 9.0000000000000011e-003 | X225: 4.4999999999999998e-002 | Y225: 4.2999999999999997e-002 | Z225: 56 | AA225: 1.49 | AB225: 3.5999999999999999e-003 | AC225: -2.3999999999999998e-003 | AD225: -6.3200000000000006e-002 | AE225: -6.6299999999999998e-002 | AG225: 97.83 | AH225: 97.35 | AI225: 0.5 | AJ225: AA | AK225: 4.2000000000000003e-002 | AL225: =H225+100*O225 -> 120.944 | AM225: 120.3 | AN225: 147 | AO225: 22.5 | AP225: 73 | AQ225: 6.9999999999999993e-003 | AR225: 15 | AS225: 国祯转债!!
A226: 25 | B226: 113043 | C226: 财通转债 | D226: 601108 | E226: 财通证券 | F226: 金融 | G226: 证券行业 | H226: 108.18 | I226: -3.8e-003 | J226: -9.8999999999999991e-003 | K226: 11.23 | L226: -2.8500000000000001e-002 | M226: 110.2 | N226: 13.33 | O226: 0.28399999999999997 | P226: 84.25 | Q226: 3月20天 | R226: 5.79年 | S226: 无权 | U226: 38 | V226: 46 | W226: 1.1000000000000001e-002 | X226: 9.4e-002 | Y226: 7.9000000000000001e-002 | Z226: 403 | AA226: 1.85 | AB226: 3.2000000000000002e-003 | AC226: 0. | AD226: 无权 | AE226: 无权 | AG226: 无权 | AH226: 87.8 | AI226: 0.48 | AJ226: AAA | AK226: 4.0599999999999997e-002 | AL226: =H226+100*O226 -> 136.58000000000001 | AM226: 132.1 | AN226: 234 | AO226: 44.3 | AP226: 250 | AQ226: 1.4999999999999999e-002 | AR226: 7 | AS226: 财通转债
A227: 205 | B227: 113550 | C227: 常汽转债! | D227: 603035 | E227: 常熟汽饰 | F227: 汽车 | G227: 零部件制 | H227: 119.61 | I227: 6.0999999999999995e-003 | J227: 1.7000000000000001e-003 | K227: 11.3 | L227: 1.0700000000000001e-002 | M227: 121.3 | N227: 9.65 | O227: 2.1000000000000001e-002 | P227: 117.1 | Q227: 转股中 | R227: 4.73年 | S227: 2.73年 | U227: 3.78 | V227: 11 | W227: 2.5000000000000001e-002 | X227: 9.6999999999999989e-002 | Y227: 0.114 | Z227: 39 | AA227: 1.13 | AB227: 3.0000000000000001e-003 | AC227: -4.6999999999999993e-003 | AD227: -4.7e-002 | AE227: -4.9599999999999998e-002 | AG227: 87.03 | AH227: 90.68 | AI227: 0.72 | AJ227: AA- | AK227: 6.5099999999999991e-002 | AL227: =H227+100*O227 -> 121.70999999999999 | AM227: 122.1 | AN227: 161 | AO227: 31.4 | AP227: 167 | AQ227: -2.6000000000000002e-002 | AR227: 15 | AS227: 常汽转债!
A228: 229 | B228: 113542 | C228: 好客转债 | D228: 603898 | E228: 好莱客 | F228: 其他 | G228: 家居用品 | H228: 113.84 | I228: 4.8999999999999998e-003 | J228: 6.4000000000000003e-003 | K228: 17.17 | L228: 1.84e-002 | M228: 114.9 | N228: 16.27 | O228: 7.9000000000000001e-002 | P228: 105.53 | Q228: 转股中 | R228: 4.43年 | S228: 2.43年 | U228: 6.03 | V228: 1.1 | W228: 2.e-003 | X228: 0.113 | Y228: 0.11900000000000001 | Z228: 53 | AA228: 2.18 | AB228: 2.0999999999999999e-003 | AC228: -3.9000000000000003e-003 | AD228: -3.6799999999999999e-002 | AE228: -3.9199999999999999e-002 | AG228: 92.56 | AH228: 95.29 | AI228: 0.62 | AJ228: AA | AK228: 4.41e-002 | AL228: =H228+100*O228 -> 121.74000000000001 | AM228: 122.1 | AN228: 163 | AO228: 26.9 | AP228: 122 | AQ228: 1.4999999999999999e-002 | AR228: 19 | AS228: 好客转债
A229: 105 | B229: 127020 | C229: 中金转债 | D229: 60 | E229: 中金岭南 | F229: 有色金属 | G229: 有色行业 | H229: 112.53 | I229: -1.5100000000000001e-002 | J229: -1.6299999999999999e-002 | K229: 4.7 | L229: -5.2400000000000002e-002 | M229: 113.7 | N229: 4.71 | O229: 0.128 | P229: 99.79 | Q229: 转股中 | R229: 5.40年 | S229: 3.40年 | U229: 38 | V229: 28 | W229: 6.0000000000000001e-003 | X229: 0.22600000000000001 | Y229: 0.22600000000000001 | Z229: 168 | AA229: 1.49 | AB229: 1.9e-003 | AC229: -2.5999999999999999e-003 | AD229: -2.6200000000000001e-002 | AE229: -2.7400000000000001e-002 | AG229: 88.09 | AH229: 90.59 | AI229: 0.6 | AJ229: AA+ | AK229: 4.36e-002 | AL229: =H229+100*O229 -> 125.33 | AM229: 125.3 | AN229: 186 | AO229: 34.7 | AP229: 198 | AQ229: 5.2000000000000005e-002 | AR229: 14 | AS229: 中金转债
A230: 49 | B230: 110076 | C230: 华海转债! | D230: 600521 | E230: 华海药业 | F230: 医药 | G230: 医药行业 | H230: 114 | I230: -1.9400000000000001e-002 | J230: 1.1000000000000001e-003 | K230: 28.26 | L230: -4.1700000000000001e-002 | M230: 115.1 | N230: 34.66 | O230: 0.39799999999999996 | P230: 81.53 | Q230: 2月9天 | R230: 5.68年 | S230: 3.68年 | U230: 18.4 | V230: 27 | W230: 1.3000000000000001e-002 | X230: 4.4999999999999998e-002 | Y230: 3.7000000000000005e-002 | Z230: 411 | AA230: 6.65 | AB230: 1.7000000000000001e-003 | AC230: -3.0000000000000001e-003 | AD230: -2.4700000000000003e-002 | AE230: -2.6499999999999999e-002 | AG230: 87.39 | AH230: 89.74 | AI230: 0.44 | AJ230: AA | AK230: 4.5599999999999995e-002 | AL230: =H230+100*O230 -> 153.80000000000001 | AM230: 146.5 | AN230: 289 | AO230: 56.7 | AP230: 292 | AQ230: 4.4000000000000004e-002 | AR230: 6 | AS230: 华海转债!
A231: 102 | B231: 123060 | C231: 苏试转债 | D231: 300416 | E231: 苏试试验 | F231: 机械装备 | G231: 专用设备 | H231: 116.69 | I231: -1.11e-002 | J231: -1.34e-002 | K231: 23.01 | L231: -3.7999999999999999e-002 | M231: 117.6 | N231: 23.86 | O231: 0.20999999999999999 | P231: 96.44 | Q231: 转股中 | R231: 5.40年 | S231: 3.40年 | U231: 3.1 | V231: 1.3 | W231: 4.0000000000000001e-003 | X231: 6.6000000000000003e-002 | Y231: 6.4000000000000001e-002 | Z231: 47 | AA231: 4.72 | AB231: 1.5e-003 | AC231: -4.3e-003 | AD231: -3.2300000000000002e-002 | AE231: -3.4300000000000004e-002 | AG231: 82.81 | AH231: 83.67 | AI231: 0.64 | AJ231: AA- | AK231: 6.6600000000000006e-002 | AL231: =H231+100*O231 -> 137.69 | AM231: 136.9 | AN231: 257 | AO231: 53.3 | AP231: 284 | AQ231: -1.1000000000000001e-002 | AR231: 9 | AS231: 苏试转债
A232: 217 | B232: 128078 | C232: 太极转债! | D232: 2368 | E232: 太极股份 | F232: 计算机及 | G232: 软件开发 | H232: 116.165 | I232: -1.1000000000000001e-003 | J232: 1.1000000000000001e-003 | K232: 22.66 | L232: 3.4999999999999996e-003 | M232: 116.9 | N232: 22.4 | O232: 0.14800000000000002 | P232: 101.16 | Q232: 转股中 | R232: 4.65年 | S232: 2.65年 | U232: 9.6 | V232: 4.5 | W232: 4.0000000000000001e-003 | X232: 7.2999999999999995e-002 | Y232: 7.400000000000001e-002 | Z232: 131 | AA232: 4.27 | AB232: 1.4000000000000002e-003 | AC232: -5.0000000000000001e-003 | AD232: -4.0899999999999999e-002 | AE232: -4.2999999999999997e-002 | AG232: 91.68 | AH232: 96.02 | AI232: 0 | AJ232: AA | AK232: 4.41e-002 | AL232: =H232+100*O232 -> 130.965 | AM232: 131.2 | AN232: 228 | AO232: 35.2 | AP232: 203 | AQ232: -1.9e-002 | AR232: 12 | AS232: 太极转债!
A233: 51 | B233: 113607 | C233: 伟20转债! | D233: 603568 | E233: 伟明环保 | F233: 城市公用 | G233: 三废处理 | H233: 114.36 | I233: -1.55e-002 | J233: 1.6299999999999999e-002 | K233: 20.63 | L233: 1.5e-003 | M233: 115.1 | N233: 22.01 | O233: 0.22 | P233: 93.73 | Q233: 2月9天 | R233: 5.68年 | S233: 3.68年 | U233: 12 | V233: 3.2 | W233: 2.e-003 | X233: 4.5999999999999999e-002 | Y233: 4.2999999999999997e-002 | Z233: 259 | AA233: 5.16 | AB233: 1.1999999999999999e-003 | AC233: -3.5999999999999999e-003 | AD233: -2.5499999999999998e-002 | AE233: -2.7300000000000001e-002 | AG233: 87.39 | AH233: 89.74 | AI233: 0.55 | AJ233: AA | AK233: 4.5599999999999995e-002 | AL233: =H233+100*O233 -> 136.36000000000001 | AM233: 135 | AN233: 249 | AO233: 45.2 | AP233: 256 | AQ233: 0.109 | AR233: 4 | AS233: 伟20转债!
A234: 207 | B234: 123035 | C234: 利德转债! | D234: 300296 | E234: 利亚德 | F234: 电子 | G234: LED制 | H234: 114.51 | I234: -5.1000000000000004e-003 | J234: 8.3999999999999995e-003 | K234: 7.08 | L234: 5.6999999999999993e-003 | M234: 115.1 | N234: 6.98 | O234: 0.129 | P234: 101.43 | Q234: 转股中 | R234: 4.72年 | S234: 2.72年 | U234: 8 | V234: 8.1 | W234: 9.0000000000000011e-003 | X234: 4.4000000000000004e-002 | Y234: 4.4999999999999998e-002 | Z234: 180 | AA234: 2.11 | AB234: 1.1000000000000001e-003 | AC234: -4.5999999999999999e-003 | AD234: -3.4500000000000003e-002 | AE234: -3.6799999999999999e-002 | AG234: 92.11 | AH234: 95.15 | AI234: 0.58 | AJ234: AA+ | AK234: 4.2099999999999999e-002 | AL234: =H234+100*O234 -> 127.41000000000001 | AM234: 127.6 | AN234: 209 | AO234: 32.4 | AP234: 183 | AQ234: 0.105 | AR234: 16 | AS234: 利德转债!
A235: 75 | B235: 123064 | C235: 万孚转债! | D235: 300482 | E235: 万孚生物 | F235: 医药 | G235: 医疗器械 | H235: 114.6 | I235: 2.5999999999999999e-003 | J235: -1.06e-002 | K235: 74 | L235: -2.e-002 | M235: 115.1 | N235: 93.57 | O235: 0.44900000000000001 | P235: 79.09 | Q235: 10天 | R235: 5.51年 | S235: 3.51年 | U235: 6 | V235: 4.6 | W235: 6.9999999999999993e-003 | X235: 2.4e-002 | Y235: 1.9e-002 | Z235: 254 | AA235: 9.36 | AB235: 8.0000000000000004e-004 | AC235: -4.0999999999999995e-003 | AD235: -2.7300000000000001e-002 | AE235: -2.9100000000000001e-002 | AG235: 88.05 | AH235: 90.43 | AI235: 0.4 | AJ235: AA | AK235: 4.5599999999999995e-002 | AL235: =H235+100*O235 -> 159.5 | AM235: 150.1 | AN235: 296 | AO235: 59.7 | AP235: 298 | AQ235: -0.14099999999999999 | AR235: 10 | AS235: 万孚转债!
A236: 342 | B236: 110033 | C236: 国贸转债! | D236: 600755 | E236: 厦门国贸 | F236: 交通运输 | G236: 交通运输 | H236: 108 | I236: -2.0000000000000001e-004 | J236: -2.5000000000000001e-003 | K236: 6.46 | L236: -2.12e-002 | M236: 108 | N236: 7.18 | O236: 0.20000000000000001 | P236: 89.97 | Q236: 转股中 | R236: 0.86年 | S236: 回售内 | U236: 12.1 | V236: 5.4 | W236: 4.0000000000000001e-003 | X236: 9.6000000000000002e-002 | Y236: 8.6999999999999994e-002 | Z236: 126 | AA236: 0.83 | AB236: 0. | AC236: -1.7299999999999999e-002 | AD236: 回售内 | AE236: 回售内 | AG236: 100.33 | AH236: 104.95 | AI236: 0.13 | AJ236: AAA | AK236: 3.4000000000000002e-002 | AL236: =H236+100*O236 -> 128. | AM236: 126 | AN236: 199 | AO236: 21.1 | AP236: 59 | AQ236: 2.3e-002 | AR236: 19 | AS236: 国贸转债!
A237: 221 | B237: 128075 | C237: 远东转债! | D237: 2406 | E237: 远东传动 | F237: 汽车 | G237: 零部件制 | H237: 114.89 | I237: -6.4000000000000003e-003 | J237: -1.e-004 | K237: 6.22 | L237: -9.5999999999999992e-003 | M237: 114.9 | N237: 5.54 | O237: 2.3e-002 | P237: 112.27 | Q237: 转股中 | R237: 4.57年 | S237: 2.57年 | U237: 5.44 | V237: 15 | W237: 2.4e-002 | X237: 0.14000000000000001 | Y237: 0.157 | Z237: 39 | AA237: 1.24 | AB237: 0. | AC237: -5.7999999999999996e-003 | AD237: -3.8100000000000002e-002 | AE237: -4.0300000000000002e-002 | AG237: 91.98 | AH237: 94.69 | AI237: 0.68 | AJ237: AA | AK237: 4.41e-002 | AL237: =H237+100*O237 -> 117.19 | AM237: 117.5 | AN237: 112 | AO237: 22.8 | AP237: 77 | AQ237: 1.4999999999999999e-002 | AR237: 15 | AS237: 远东转债!
A238: 35 | B238: 123079 | C238: 运达转债 | D238: 300772 | E238: 运达股份 | F238: 能源电力 | G238: 风能 | H238: 115.3 | I238: 1.7000000000000001e-003 | J238: 1.47e-002 | K238: 16.67 | L238: 2.4e-002 | M238: 115.1 | N238: 15.31 | O238: 5.9000000000000004e-002 | P238: 108.88 | Q238: 3月11天 | R238: 5.76年 | S238: 3.76年 | U238: 5.77 | V238: 10 | W238: 1.4999999999999999e-002 | X238: 0.11800000000000001 | Y238: 0.128 | Z238: 49 | AA238: 3.18 | AB238: -2.9999999999999997e-004 | AC238: -5.0000000000000001e-003 | AD238: -2.7099999999999999e-002 | AE238: -2.8799999999999999e-002 | AG238: 87.08 | AH238: 89.43 | AI238: 0.69 | AJ238: AA | AK238: 4.5599999999999995e-002 | AL238: =H238+100*O238 -> 121.2 | AM238: 121.7 | AN238: 158 | AO238: 32.3 | AP238: 178 | AQ238: -1.7000000000000001e-002 | AR238: 4 | AS238: 运达转债
A239: 76 | B239: 128130 | C239: 景兴转债 | D239: 2067 | E239: 景兴纸业 | F239: 造纸包装 | G239: 包装用纸 | H239: 115.787 | I239: 2.8999999999999998e-003 | J239: 7.000000000000001e-004 | K239: 4.04 | L239: 5.0000000000000001e-003 | M239: 115.1 | N239: 3.4 | O239: -2.6000000000000002e-002 | P239: 118.82 | Q239: 6.6天 | R239: 5.51年 | S239: 3.51年 | U239: 12.8 | V239: 103 | W239: 6.9000000000000006e-002 | X239: 0.28499999999999998 | Y239: 0.33899999999999997 | Z239: 45 | AA239: 0.99 | AB239: -1.1000000000000001e-003 | AC239: -6.0000000000000001e-003 | AD239: -2.9999999999999999e-002 | AE239: -3.1800000000000002e-002 | AG239: 88.06 | AH239: 90.44 | AI239: 0.73 | AJ239: AA | AK239: 4.5599999999999995e-002 | AL239: =H239+100*O239 -> 113.18700000000001 | AM239: 112.8 | AN239: 69 | AO239: 22.3 | AP239: 70 | AQ239: 5.7000000000000002e-002 | AR239: 13 | AS239: 景兴转债
A240: 200 | B240: 110063 | C240: 鹰19转债 | D240: 600567 | E240: 山鹰国际 | F240: 造纸包装 | G240: 包装用纸 | H240: 116.6 | I240: -2.4700000000000003e-002 | J240: -6.7000000000000002e-003 | K240: 3.77 | L240: -4.5599999999999995e-002 | M240: 115.9 | N240: 3.3 | O240: 2.1000000000000001e-002 | P240: 114.24 | Q240: 转股中 | R240: 4.80年 | S240: 2.80年 | U240: 18.4 | V240: 108 | W240: 5.0999999999999997e-002 | X240: 0.106 | Y240: 0.121 | Z240: 173 | AA240: 1.18 | AB240: -1.2999999999999999e-003 | AC240: -7.0999999999999995e-003 | AD240: -4.0599999999999997e-002 | AE240: -4.2599999999999999e-002 | AG240: 91.46 | AH240: 95.44 | AI240: 0.69 | AJ240: AA+ | AK240: 4.2099999999999999e-002 | AL240: =H240+100*O240 -> 118.69999999999999 | AM240: 119 | AN240: 131 | AO240: 23.5 | AP240: 87 | AQ240: 0.157 | AR240: 41 | AS240: 鹰19转债
A241: 181 | B241: 128096 | C241: 奥瑞转债!! | D241: 2701 | E241: 奥瑞金 | F241: 造纸包装 | G241: 包装材料 | H241: 116.5 | I241: 4.5999999999999999e-003 | J241: 1.0700000000000001e-002 | K241: 5.08 | L241: 2.2099999999999998e-002 | M241: 115.5 | N241: 4.54 | O241: 4.0999999999999995e-002 | P241: 111.89 | Q241: 转股中 | R241: 4.96年 | S241: 2.96年 | U241: 7.08 | V241: 4.9 | W241: 6.0000000000000001e-003 | X241: 5.7999999999999996e-002 | Y241: 6.5000000000000002e-002 | Z241: 123 | AA241: 2.06 | AB241: -1.8e-003 | AC241: -7.3000000000000001e-003 | AD241: -3.6499999999999998e-002 | AE241: -3.8699999999999998e-002 | AG241: 91.4 | AH241: 94.54 | AI241: 0.69 | AJ241: AA+ | AK241: 4.2099999999999999e-002 | AL241: =H241+100*O241 -> 120.59999999999999 | AM241: 121.1 | AN241: 154 | AO241: 26.6 | AP241: 119 | AQ241: 6.5000000000000002e-002 | AR241: 20 | AS241: 奥瑞转债!!
A242: 236 | B242: 113537 | C242: 文灿转债!! | D242: 603348 | E242: 文灿股份 | F242: 汽车 | G242: 零部件制 | H242: 122.57 | I242: -1.9099999999999999e-002 | J242: 2.0999999999999999e-003 | K242: 23.2 | L242: -2.3599999999999999e-002 | M242: 121.5 | N242: 19.43 | O242: 2.7000000000000003e-002 | P242: 119.4 | Q242: 转股中 | R242: 4.29年 | S242: 2.29年 | U242: 1.79 | V242: 31 | W242: 0.14099999999999999 | X242: 2.9999999999999999e-002 | Y242: 3.6000000000000004e-002 | Z242: 60 | AA242: 2.38 | AB242: -2.0999999999999999e-003 | AC242: -1.06e-002 | AD242: -6.4100000000000004e-002 | AE242: -6.7199999999999996e-002 | AG242: 89.66 | AH242: 93.41 | AI242: 0.72 | AJ242: AA- | AK242: 6.5099999999999991e-002 | AL242: =H242+100*O242 -> 125.27 | AM242: 125.7 | AN242: 193 | AO242: 32.3 | AP242: 181 | AQ242: -6.7000000000000004e-002 | AR242: 26 | AS242: 文灿转债!!
A243: 127 | B243: 128113 | C243: 比音转债 | D243: 2832 | E243: 比音勒芬 | F243: 服装纺织 | G243: 服装行业 | H243: 118.812 | I243: -1.5600000000000001e-002 | J243: -7.1999999999999998e-003 | K243: 16.67 | L243: -3.3099999999999997e-002 | M243: 117.3 | N243: 14.9 | O243: 6.2e-002 | P243: 111.88 | Q243: 转股中 | R243: 5.30年 | S243: 3.30年 | U243: 6.89 | V243: 20 | W243: 2.4e-002 | X243: 7.9000000000000001e-002 | Y243: 8.8000000000000009e-002 | Z243: 87 | AA243: 4.06 | AB243: -2.5000000000000001e-003 | AC243: -8.199999999999999e-003 | AD243: -3.8599999999999995e-002 | AE243: -4.0599999999999997e-002 | AG243: 89.09 | AH243: 93.06 | AI243: 0.69 | AJ243: AA | AK243: 4.5599999999999995e-002 | AL243: =H243+100*O243 -> 125.012 | AM243: 125.7 | AN243: 194 | AO243: 32.7 | AP243: 189 | AQ243: 3.3000000000000002e-002 | AR243: 7 | AS243: 比音转债
A244: 267 | B244: 110051 | C244: 中天转债! | D244: 600522 | E244: 中天科技 | F244: 通信互联 | G244: 通信设备 | H244: 115.18 | I244: -4.0000000000000002e-004 | J244: 9.5999999999999992e-003 | K244: 10.37 | L244: 1.5700000000000002e-002 | M244: 113.9 | N244: 10.09 | O244: 0.121 | P244: 102.78 | Q244: 转股中 | R244: 4年2.6天 | S244: 2年2.6天 | U244: 39.6 | V244: 54 | W244: 1.2e-002 | X244: 0.125 | Y244: 0.128 | Z244: 318 | AA244: 1.45 | AB244: -2.8000000000000004e-003 | AC244: -9.1000000000000004e-003 | AD244: -4.9000000000000002e-002 | AE244: -5.1799999999999999e-002 | AG244: 94.65 | AH244: 96.92 | AI244: 0.58 | AJ244: AA+ | AK244: 4.2099999999999999e-002 | AL244: =H244+100*O244 -> 127.28 | AM244: 127.6 | AN244: 208 | AO244: 30.7 | AP244: 160 | AQ244: 1.3999999999999999e-002 | AR244: 26 | AS244: 中天转债!
A245: 68 | B245: 113603 | C245: 东缆转债 | D245: 603606 | E245: 东方电缆 | F245: 能源电力 | G245: 电力设备 | H245: 117.1 | I245: -2.23e-002 | J245: 7.7000000000000002e-003 | K245: 22.41 | L245: -2.6499999999999999e-002 | M245: 115.1 | N245: 23.88 | O245: 0.248 | P245: 93.84 | Q245: 32天 | R245: 5.58年 | S245: 3.58年 | U245: 8 | V245: 42 | W245: 4.4000000000000004e-002 | X245: 5.5e-002 | Y245: 5.0999999999999997e-002 | Z245: 147 | AA245: 5.41 | AB245: -3.0999999999999999e-003 | AC245: -7.9000000000000008e-003 | AD245: -3.2500000000000001e-002 | AE245: -3.4200000000000001e-002 | AG245: 87.8 | AH245: 90.17 | AI245: 0.55 | AJ245: AA | AK245: 4.5599999999999995e-002 | AL245: =H245+100*O245 -> 141.90000000000001 | AM245: 140.4 | AN245: 273 | AO245: 50.2 | AP245: 274 | AQ245: -0.11800000000000001 | AR245: 6 | AS245: 东缆转债
A246: 290 | B246: 123012 | C246: 万顺转债! | D246: 300057 | E246: 万顺新材 | F246: 有色金属 | G246: 铝金属 | H246: 111.6 | I246: 2.9399999999999999e-002 | J246: -2.9399999999999999e-002 | K246: 4.77 | L246: 0. | M246: 110.3 | N246: 5.31 | O246: 0.24199999999999999 | P246: 89.83 | Q246: 转股中 | R246: 3.40年 | S246: 1.40年 | U246: 1.29 | V246: 33 | W246: 0.23100000000000001 | X246: 4.0000000000000001e-002 | Y246: 3.6000000000000004e-002 | Z246: 32 | AA246: 0.94 | AB246: -3.4999999999999996e-003 | AC246: -9.1000000000000004e-003 | AD246: -5.1699999999999996e-002 | AE246: -5.4900000000000004e-002 | AG246: 93.24 | AH246: 89.45 | AI246: 0.5 | AJ246: AA- | AK246: 6.5099999999999991e-002 | AL246: =H246+100*O246 -> 135.79999999999998 | AM246: 133.4 | AN246: 241 | AO246: 40.1 | AP246: 233 | AQ246: 6.4000000000000001e-002 | AR246: 19 | AS246: 万顺转债!
A247: 61 | B247: 128135 | C247: 洽洽转债 | D247: 2557 | E247: 洽洽食品 | F247: 食品饮料 | G247: 休闲食品 | H247: 123 | I247: 2.3999999999999998e-003 | J247: 2.1400000000000002e-002 | K247: 56.92 | L247: 4.6300000000000001e-002 | M247: 120.2 | N247: 60.83 | O247: 0.314 | P247: 93.57 | Q247: 59天 | R247: 5.65年 | S247: 3.65年 | U247: 13.4 | V247: 193 | W247: 0.114 | X247: 4.5999999999999999e-002 | Y247: 4.2999999999999997e-002 | Z247: 289 | AA247: 7.53 | AB247: -4.0999999999999995e-003 | AC247: -1.0200000000000001e-002 | AD247: -4.41e-002 | AE247: -4.5899999999999996e-002 | AG247: 87.62 | AH247: 93.87 | AI247: 0.51 | AJ247: AA | AK247: 4.5599999999999995e-002 | AL247: =H247+100*O247 -> 154.40000000000001 | AM247: 152.4 | AN247: 300 | AO247: 58.6 | AP247: 296 | AQ247: -9.6999999999999989e-002 | AR247: 8 | AS247: 洽洽转债
A248: 340 | B248: 113009 | C248: 广汽转债! | D248: 601238 | E248: 广汽集团 | F248: 汽车 | G248: 乘用车 | H248: 106.41 | I248: -3.9000000000000003e-003 | J248: 3.7000000000000002e-003 | K248: 10.57 | L248: -1.1200000000000002e-002 | M248: 106 | N248: 14.12 | O248: 0.42100000000000004 | P248: 74.86 | Q248: 转股中 | R248: 0.91年 | S248: 回售内 | U248: 25.5 | V248: 17 | W248: 6.0000000000000001e-003 | X248: 2.3e-002 | Y248: 1.7000000000000001e-002 | Z248: 1094. | AA248: 1.31 | AB248: -4.3e-003 | AC248: -1.67e-002 | AD248: 回售内 | AE248: 回售内 | AG248: 100.27 | AH248: 102.84 | AI248: 0.02 | AJ248: AAA | AK248: 3.4000000000000002e-002 | AL248: =H248+100*O248 -> 148.50999999999999 | AM248: 138 | AN248: 263 | AO248: 35.1 | AP248: 202 | AQ248: -3.6000000000000004e-002 | AR248: 16 | AS248: 广汽转债!
A249: 184 | B249: 123042 | C249: 银河转债! | D249: 300619 | E249: 金银河 | F249: 机械装备 | G249: 专用设备 | H249: 117.8 | I249: 5.6500000000000002e-002 | J249: -5.0300000000000004e-002 | K249: 18.34 | L249: 1.3300000000000001e-002 | M249: 115.4 | N249: 24.4 | O249: 0.56700000000000006 | P249: 75.16 | Q249: 转股中 | R249: 4.88年 | S249: 2.88年 | U249: 1.67 | V249: 818 | W249: 4.1600000000000001 | X249: 0.122 | Y249: 9.1999999999999998e-002 | Z249: 14 | AA249: 2.8 | AB249: -4.3e-003 | AC249: -9.8999999999999991e-003 | AD249: -4.1299999999999996e-002 | AE249: -4.3499999999999997e-002 | AG249: 83.15 | AH249: 81.3 | AI249: 0.47 | AJ249: A+ | AK249: 7.6100000000000001e-002 | AL249: =H249+100*O249 -> 174.5 | AM249: 160.4 | AN249: 310 | AO249: 77.3 | AP249: 312 | AQ249: 1.3000000000000001e-002 | AR249: 25 | AS249: 银河转债!
A250: 90 | B250: 113598 | C250: 法兰转债 | D250: 603966 | E250: 法兰泰克 | F250: 机械装备 | G250: 工程机械 | H250: 124.29 | I250: 1.54e-002 | J250: 4.7999999999999996e-003 | K250: 16.78 | L250: 2.63e-002 | M250: 121.2 | N250: 13.88 | O250: 2.7999999999999997e-002 | P250: 120.89 | Q250: 转股中 | R250: 5.43年 | S250: 3.43年 | U250: 3.3 | V250: 5.3 | W250: 1.3000000000000001e-002 | X250: 9.3000000000000013e-002 | Y250: 0.113 | Z250: 35 | AA250: 3.18 | AB250: -4.6999999999999993e-003 | AC250: -1.1299999999999999e-002 | AD250: -4.8600000000000004e-002 | AE250: -5.0599999999999999e-002 | AG250: 82.82 | AH250: 86.1 | AI250: 0.77 | AJ250: AA- | AK250: 6.6600000000000006e-002 | AL250: =H250+100*O250 -> 127.09 | AM250: 127.7 | AN250: 211 | AO250: 41.6 | AP250: 241 | AQ250: 3.7999999999999999e-002 | AR250: 8 | AS250: 法兰转债
A251: 46 | B251: 128137 | C251: 洁美转债 | D251: 2859 | E251: 洁美科技 | F251: 电子 | G251: 元器件制 | H251: 120.502 | I251: -1.55e-002 | J251: -9.7000000000000003e-003 | K251: 27.75 | L251: -3.6499999999999998e-002 | M251: 117.3 | N251: 27.77 | O251: 0.20600000000000002 | P251: 99.93 | Q251: 2月13天 | R251: 5.69年 | S251: 3.69年 | U251: 6 | V251: 7.9 | W251: 1.1000000000000001e-002 | X251: 5.2999999999999999e-002 | Y251: 5.2999999999999999e-002 | Z251: 114 | AA251: 6.52 | AB251: -4.7999999999999996e-003 | AC251: -1.01e-002 | AD251: -3.8300000000000001e-002 | AE251: -4.0099999999999997e-002 | AG251: 81.16 | AH251: 81.88 | AI251: 0.69 | AJ251: AA- | AK251: 6.6600000000000006e-002 | AL251: =H251+100*O251 -> 141.102 | AM251: 141.1 | AN251: 277 | AO251: 59.2 | AP251: 297 | AQ251: -1.3000000000000001e-002 | AR251: 4 | AS251: 洁美转债
A252: 112 | B252: 128119 | C252: 龙大转债! | D252: 2726 | E252: 龙大肉食 | F252: 食品饮料 | G252: 肉制品 | H252: 123.681 | I252: -1.7600000000000001e-002 | J252: -5.8999999999999999e-003 | K252: 10.78 | L252: -3.49e-002 | M252: 120.2 | N252: 9.57 | O252: 9.8000000000000004e-002 | P252: 112.64 | Q252: 转股中 | R252: 5.38年 | S252: 3.38年 | U252: 9.5 | V252: 15 | W252: 1.3000000000000001e-002 | X252: 8.8000000000000009e-002 | Y252: 0.10000000000000001 | Z252: 107 | AA252: 3.49 | AB252: -5.4000000000000003e-003 | AC252: -1.18e-002 | AD252: -4.8899999999999999e-002 | AE252: -5.0799999999999998e-002 | AG252: 88.68 | AH252: 95.01 | AI252: 0.67 | AJ252: AA | AK252: 4.5599999999999995e-002 | AL252: =H252+100*O252 -> 133.48099999999999 | AM252: 134.7 | AN252: 248 | AO252: 39.7 | AP252: 230 | AQ252: -0.114 | AR252: 8 | AS252: 龙大转债!
A253: 167 | B253: 113572 | C253: 三祥转债! | D253: 603663 | E253: 三祥新材 | F253: 其他 | G253: 其他 | H253: 116.32 | I253: -2.0999999999999999e-003 | J253: 3.0999999999999999e-003 | K253: 16.11 | L253: 1.1999999999999999e-003 | M253: 113.2 | N253: 14.19 | O253: 2.5000000000000001e-002 | P253: 113.53 | Q253: 转股中 | R253: 5年14天 | S253: 3年14天 | U253: 1.7 | V253: 32 | W253: 0.159 | X253: 5.5e-002 | Y253: 6.2e-002 | Z253: 31 | AA253: 5.2 | AB253: -5.5000000000000005e-003 | AC253: -1.0200000000000001e-002 | AD253: -3.5499999999999997e-002 | AE253: -3.7599999999999995e-002 | AG253: 81.83 | AH253: 78.34 | AI253: 0.8 | AJ253: A+ | AK253: 7.7600000000000002e-002 | AL253: =H253+100*O253 -> 118.81999999999999 | AM253: 119.1 | AN253: 134 | AO253: 37.3 | AP253: 219 | AQ253: 8.900000000000001e-002 | AR253: 18 | AS253: 三祥转债!
A254: 281 | B254: 128048 | C254: 张行转债 | D254: 2839 | E254: 张家港行 | F254: 金融 | G254: 银行行业 | H254: 115.85 | I254: -5.6000000000000008e-003 | J254: -6.0999999999999995e-003 | K254: 5.66 | L254: -2.2499999999999999e-002 | M254: 113.3 | N254: 5.76 | O254: 0.17899999999999999 | P254: 98.26 | Q254: 转股中 | R254: 3.71年 | S254: 无权 | U254: 25 | V254: 25 | W254: 9.0000000000000011e-003 | X254: 0.24399999999999999 | Y254: 0.23999999999999999 | Z254: 102 | AA254: 0.97 | AB254: -6.0999999999999995e-003 | AC254: -1.2500000000000001e-002 | AD254: 无权 | AE254: 无权 | AG254: 无权 | AH254: 97.51 | AI254: 0.52 | AJ254: AA+ | AK254: 4.2099999999999999e-002 | AL254: =H254+100*O254 -> 133.75 | AM254: 133.4 | AN254: 242 | AO254: 35.9 | AP254: 208 | AQ254: 0. | AR254: 14 | AS254: 张行转债
A255: 45 | B255: 127024 | C255: 盈峰转债 | D255: 967 | E255: 盈峰环境 | F255: 机械装备 | G255: 专用设备 | H255: 121.029 | I255: 6.5000000000000006e-003 | J255: 4.0000000000000001e-003 | K255: 8.63 | L255: 1.6500000000000001e-002 | M255: 116.8 | N255: 8.31 | O255: 0.16500000000000001 | P255: 103.85 | Q255: 2月13天 | R255: 5.69年 | S255: 3.69年 | U255: 14.8 | V255: 21 | W255: 1.2e-002 | X255: 5.4000000000000006e-002 | Y255: 5.5999999999999994e-002 | Z255: 273 | AA255: 1.69 | AB255: -6.3e-003 | AC255: -1.15e-002 | AD255: -4.0500000000000001e-002 | AE255: -4.2099999999999999e-002 | AG255: 87.73 | AH255: 91.98 | AI255: 0.63 | AJ255: AA+ | AK255: 4.36e-002 | AL255: =H255+100*O255 -> 137.529 | AM255: 138.2 | AN255: 267 | AO255: 46.2 | AP255: 260 | AQ255: 5.5999999999999994e-002 | AR255: 5 | AS255: 盈峰转债
A256: 141 | B256: 113579 | C256: 健友转债! | D256: 603707 | E256: 健友股份 | F256: 医药 | G256: 原料药 | H256: 118.01 | I256: -3.9900000000000005e-002 | J256: 1.7500000000000002e-002 | K256: 41.4 | L256: -3.7400000000000003e-002 | M256: 114.2 | N256: 42.05 | O256: 0.19899999999999998 | P256: 98.45 | Q256: 转股中 | R256: 5年56天 | S256: 3年56天 | U256: 5.03 | V256: 31 | W256: 5.0999999999999997e-002 | X256: 1.3000000000000001e-002 | Y256: 1.3000000000000001e-002 | Z256: 387 | AA256: 11.28 | AB256: -6.5000000000000006e-003 | AC256: -1.1399999999999999e-002 | AD256: -3.85e-002 | AE256: -4.0599999999999997e-002 | AG256: 89.57 | AH256: 91.19 | AI256: 0.6 | AJ256: AA | AK256: 4.5599999999999995e-002 | AL256: =H256+100*O256 -> 137.91 | AM256: 137.6 | AN256: 259 | AO256: 46.4 | AP256: 261 | AQ256: 0.20999999999999999 | AR256: 8 | AS256: 健友转债!
A257: 323 | B257: 128021 | C257: 兄弟转债!! | D257: 2562 | E257: 兄弟科技 | F257: 医药 | G257: 原料药 | H257: 110.776 | I257: -2.e-003 | J257: 2.e-003 | K257: 5.2 | L257: 9.7000000000000003e-003 | M257: 108.8 | N257: 5.19 | O257: 0.106 | P257: 100.19 | Q257: 转股中 | R257: 2.75年 | S257: 0.75年 | U257: 2.65 | V257: 1.4 | W257: 5.0000000000000001e-003 | X257: 4.8000000000000001e-002 | Y257: 4.8000000000000001e-002 | Z257: 55 | AA257: 2.02 | AB257: -6.6e-003 | AC257: -1.2500000000000001e-002 | AD257: -9.0399999999999994e-002 | AE257: -9.3399999999999997e-002 | AG257: 97.79 | AH257: 97.3 | AI257: 0 | AJ257: AA | AK257: 4.2000000000000003e-002 | AL257: =H257+100*O257 -> 121.37599999999999 | AM257: 121.4 | AN257: 157 | AO257: 23.6 | AP257: 89 | AQ257: 3.4000000000000002e-002 | AR257: 14 | AS257: 兄弟转债!!
A258: 211 | B258: 113548 | C258: 石英转债! | D258: 603688 | E258: 石英股份 | F258: 电子 | G258: 电子产品 | H258: 128.36 | I258: -7.6e-003 | J258: -7.9000000000000008e-003 | K258: 17.93 | L258: -2.18e-002 | M258: 124.4 | N258: 15.1 | O258: 8.1000000000000003e-002 | P258: 118.74 | Q258: 转股中 | R258: 4.67年 | S258: 2.67年 | U258: 1.23 | V258: 15 | W258: 9.5000000000000001e-002 | X258: 1.9e-002 | Y258: 2.3e-002 | Z258: 63 | AA258: 3.36 | AB258: -6.8000000000000005e-003 | AC258: -1.54e-002 | AD258: -7.1300000000000002e-002 | AE258: -7.3899999999999993e-002 | AG258: 87.42 | AH258: 93.31 | AI258: 0.71 | AJ258: AA- | AK258: 6.5099999999999991e-002 | AL258: =H258+100*O258 -> 136.46000000000001 | AM258: 138 | AN258: 264 | AO258: 44.7 | AP258: 252 | AQ258: -3.7999999999999999e-002 | AR258: 12 | AS258: 石英转债!
A259: 55 | B259: 127023 | C259: 华菱转2 | D259: 932 | E259: 华菱钢铁 | F259: 钢铁 | G259: 炼钢 | H259: 114.5 | I259: -1.8700000000000001e-002 | J259: -2.3300000000000001e-002 | K259: 5.84 | L259: -5.8099999999999999e-002 | M259: 110.1 | N259: 5.18 | O259: 1.6e-002 | P259: 112.74 | Q259: 2月2天 | R259: 5.66年 | S259: 4.66年 | U259: 40 | V259: 114 | W259: 2.5000000000000001e-002 | X259: 0.11199999999999999 | Y259: 0.126 | Z259: 358 | AA259: 1.13 | AB259: -6.9999999999999993e-003 | AC259: -1.03e-002 | AD259: -1.9099999999999999e-002 | AE259: -2.0799999999999999e-002 | AG259: 86.38 | AH259: 88.2 | AI259: 0.72 | AJ259: AAA | AK259: 4.0599999999999997e-002 | AL259: =H259+100*O259 -> 116.09999999999999 | AM259: 116.3 | AN259: 101 | AO259: 28.1 | AP259: 135 | AQ259: 0.14199999999999999 | AR259: 9 | AS259: 华菱转2
A260: 339 | B260: 128010 | C260: 蔚蓝转债!!* | D260: 2245 | E260: 蔚蓝锂芯 | F260: 交通运输 | G260: 物流业 | H260: 108.79 | I260: -3.5499999999999997e-002 | J260: 1.1000000000000001e-002 | K260: 10.15 | L260: -2.5899999999999999e-002 | M260: 108 | N260: 9.25 | O260: -9.0000000000000011e-003 | P260: 109.73 | Q260: 转股中 | R260: 0.91年 | S260: 回售内 | U260: 0.39 | V260: 0 | W260: 0. | X260: 4.0000000000000001e-003 | Y260: 4.0000000000000001e-003 | Z260: 101 | AA260: 3.97 | AB260: -8.0000000000000002e-003 | AC260: -2.4300000000000002e-002 | AD260: 回售内 | AE260: 回售内 | AG260: 100.27 | AH260: 104.33 | AI260: 0.95 | AJ260: AA | AK260: 3.9e-002 | AL260: =H260+100*O260 -> 107.89 | AM260: 107.9 | AN260: 35 | AO260: 3.5 | AP260: 4 | AQ260: -0.10400000000000001 | AR260: 39 | AS260: 蔚蓝转债!!*
A261: 341 | B261: 110034 | C261: 九州转债! | D261: 600998 | E261: 九州通 | F261: 医药 | G261: 医药商业 | H261: 108.8 | I261: 0. | J261: 2.9999999999999997e-004 | K261: 16.87 | L261: 1.8e-003 | M261: 108 | N261: 18.32 | O261: 0.182 | P261: 92.09 | Q261: 转股中 | R261: 0.89年 | S261: 回售内 | U261: 15 | V261: 8 | W261: 5.0000000000000001e-003 | X261: 4.7e-002 | Y261: 4.4000000000000004e-002 | Z261: 316 | AA261: 1.68 | AB261: -8.3000000000000001e-003 | AC261: -2.4900000000000002e-002 | AD261: 回售内 | AE261: 回售内 | AG261: 103 | AH261: 104.58 | AI261: 0.17 | AJ261: AA+ | AK261: 3.7000000000000005e-002 | AL261: =H261+100*O261 -> 127. | AM261: 125.5 | AN261: 189 | AO261: 20.9 | AP261: 58 | AQ261: -5.2999999999999999e-002 | AR261: 26 | AS261: 九州转债!
A262: 71 | B262: 123066 | C262: 赛意转债 | D262: 300687 | E262: 赛意信息 | F262: 计算机及 | G262: 软件开发 | H262: 127.1 | I262: 1.44e-002 | J262: 1.44e-002 | K262: 27.6 | L262: 3.6799999999999999e-002 | M262: 121.4 | N262: 22.58 | O262: 4.0000000000000001e-002 | P262: 122.23 | Q262: 24天 | R262: 5.55年 | S262: 3.55年 | U262: 3.2 | V262: 9.4 | W262: 2.3e-002 | X262: 5.2999999999999999e-002 | Y262: 6.5000000000000002e-002 | Z262: 60 | AA262: 6.33 | AB262: -8.3999999999999995e-003 | AC262: -1.49e-002 | AD262: -5.2199999999999996e-002 | AE262: -5.4199999999999998e-002 | AG262: 79.24 | AH262: 80.91 | AI262: 0.78 | AJ262: A+ | AK262: 7.7600000000000002e-002 | AL262: =H262+100*O262 -> 131.09999999999999 | AM262: 132 | AN262: 232 | AO262: 51.1 | AP262: 276 | AQ262: -3.0000000000000001e-003 | AR262: 7 | AS262: 赛意转债
A263: 268 | B263: 128053 | C263: 尚荣转债! | D263: 2551 | E263: 尚荣医疗 | F263: 医药 | G263: 医疗器械 | H263: 118.21 | I263: 3.4999999999999996e-003 | J263: 1.9e-003 | K263: 5.41 | L263: 5.6000000000000008e-003 | M263: 114.3 | N263: 4.89 | O263: 6.8000000000000005e-002 | P263: 110.63 | Q263: 转股中 | R263: 3.97年 | S263: 1.97年 | U263: 1.91 | V263: 28 | W263: 0.125 | X263: 4.2999999999999997e-002 | Y263: 4.8000000000000001e-002 | Z263: 44 | AA263: 1.5 | AB263: -8.6e-003 | AC263: -1.4999999999999999e-002 | AD263: -6.3700000000000007e-002 | AE263: -6.6100000000000006e-002 | AG263: 93.81 | AH263: 96.6 | AI263: 0.97 | AJ263: AA | AK263: 4.41e-002 | AL263: =H263+100*O263 -> 125.00999999999999 | AM263: 125.8 | AN263: 196 | AO263: 29.2 | AP263: 146 | AQ263: -8.0000000000000002e-003 | AR263: 28 | AS263: 尚荣转债!
A264: 155 | B264: 113575 | C264: 东时转债! | D264: 603377 | E264: 东方时尚 | F264: 其他 | G264: 其他 | H264: 118.62 | I264: 3.7100000000000001e-002 | J264: -5.5899999999999998e-002 | K264: 13.29 | L264: -3.56e-002 | M264: 113.5 | N264: 14.56 | O264: 0.29999999999999999 | P264: 91.28 | Q264: 转股中 | R264: 5年42天 | S264: 3年42天 | U264: 0.99 | V264: 259 | W264: 2.2200000000000002 | X264: 1.2e-002 | Y264: 1.1000000000000001e-002 | Z264: 81 | AA264: 4.16 | AB264: -8.8000000000000005e-003 | AC264: -1.3500000000000002e-002 | AD264: -4.0199999999999993e-002 | AE264: -4.2300000000000004e-002 | AG264: 89.85 | AH264: 90.81 | AI264: 0.53 | AJ264: AA | AK264: 4.5599999999999995e-002 | AL264: =H264+100*O264 -> 148.62 | AM264: 146 | AN264: 287 | AO264: 55.2 | AP264: 290 | AQ264: 6.3e-002 | AR264: 15 | AS264: 东时转债!
A265: 153 | B265: 113034 | C265: 滨化转债 | D265: 601678 | E265: 滨化股份 | F265: 化工 | G265: 化工 | H265: 121.25 | I265: -1.1000000000000001e-002 | J265: 5.6999999999999993e-003 | K265: 5.7 | L265: -6.9999999999999993e-003 | M265: 115.1 | N265: 4.68 | O265: -4.0000000000000001e-003 | P265: 121.79 | Q265: 转股中 | R265: 5年43天 | S265: 3年43天 | U265: 18.3 | V265: 66 | W265: 2.9999999999999999e-002 | X265: 0.19500000000000001 | Y265: 0.23800000000000002 | Z265: 94 | AA265: 1.41 | AB265: -1.03e-002 | AC265: -1.55e-002 | AD265: -4.7199999999999999e-002 | AE265: -4.9100000000000005e-002 | AG265: 89.61 | AH265: 92.03 | AI265: 0.76 | AJ265: AA | AK265: 4.5599999999999995e-002 | AL265: =H265+100*O265 -> 120.84999999999999 | AM265: 120.7 | AN265: 151 | AO265: 28.7 | AP265: 140 | AQ265: 8.4000000000000005e-002 | AR265: 27 | AS265: 滨化转债
A266: 44 | B266: 127025 | C266: 冀东转债 | D266: 401 | E266: 冀东水泥 | F266: 建筑 | G266: 水泥 | H266: 116.678 | I266: -1.95e-002 | J266: 1.7000000000000001e-003 | K266: 15.1 | L266: -3.0200000000000001e-002 | M266: 110.1 | N266: 15.78 | O266: 0.21899999999999997 | P266: 95.69 | Q266: 2月14天 | R266: 5.69年 | S266: 3.69年 | U266: 28.2 | V266: 17 | W266: 5.0000000000000001e-003 | X266: 0.13900000000000001 | Y266: 0.13300000000000001 | Z266: 203 | AA266: 1.5 | AB266: -1.03e-002 | AC266: -1.3500000000000002e-002 | AD266: -3.2400000000000005e-002 | AE266: -3.3700000000000001e-002 | AG266: 88.3 | AH266: 88.08 | AI266: 0.59 | AJ266: AAA | AK266: 4.0599999999999997e-002 | AL266: =H266+100*O266 -> 138.578 | AM266: 137.7 | AN266: 260 | AO266: 49.4 | AP266: 269 | AQ266: 5.2000000000000005e-002 | AR266: 9 | AS266: 冀东转债
A267: 47 | B267: 128136 | C267: 立讯转债 | D267: 2475 | E267: 立讯精密 | F267: 电子 | G267: 元器件制 | H267: 118.9 | I267: 8.0000000000000004e-004 | J267: -4.5000000000000005e-003 | K267: 46.5 | L267: -8.5000000000000006e-003 | M267: 111.9 | N267: 58.38 | O267: 0.49299999999999999 | P267: 79.65 | Q267: 2月12天 | R267: 5.69年 | S267: 3.69年 | U267: 30 | V267: 53 | W267: 1.4999999999999999e-002 | X267: 9.0000000000000011e-003 | Y267: 6.9999999999999993e-003 | Z267: 3270. | AA267: 13.05 | AB267: -1.0700000000000001e-002 | AC267: -1.4499999999999999e-002 | AD267: -3.8100000000000002e-002 | AE267: -3.9300000000000002e-002 | AG267: 86.92 | AH267: 88.03 | AI267: 0.42 | AJ267: AA+ | AK267: 4.36e-002 | AL267: =H267+100*O267 -> 168.19999999999999 | AM267: 158.1 | AN267: 306 | AO267: 70.1 | AP267: 309 | AQ267: -8.9999999999999997e-002 | AR267: 11 | AS267: 立讯转债
A268: 3 | B268: 113621 | C268: 彤程转债 | D268: 603650 | E268: 彤程新材 | F268: 化工 | G268: 橡胶塑料 | H268: 122.54 | I268: -3.2799999999999996e-002 | J268: 2.52e-002 | K268: 37.27 | L268: -1.04e-002 | M268: 115.1 | N268: 32.96 | O268: 8.4000000000000005e-002 | P268: 113.08 | Q268: 5月7天 | R268: 5.92年 | S268: 3.92年 | U268: 8 | V268: 128 | W268: 0.129 | X268: 3.7000000000000005e-002 | Y268: 4.0999999999999995e-002 | Z268: 218 | AA268: 9.27 | AB268: -1.0700000000000001e-002 | AC268: -1.52e-002 | AD268: -4.0599999999999997e-002 | AE268: -4.2199999999999994e-002 | AG268: 86.48 | AH268: 88.82 | AI268: 0.73 | AJ268: AA | AK268: 4.5599999999999995e-002 | AL268: =H268+100*O268 -> 130.94 | AM268: 132 | AN268: 233 | AO268: 43.2 | AP268: 246 | AQ268: 8.900000000000001e-002 | AR268: 1 | AS268: 彤程转债
A269: 56 | B269: 113605 | C269: 大参转债 | D269: 603233 | E269: 大参林 | F269: 医药 | G269: 医药商业 | H269: 122.64 | I269: -3.0499999999999999e-002 | J269: 2.2799999999999997e-002 | K269: 86.06 | L269: -1.1899999999999999e-002 | M269: 115.2 | N269: 83.85 | O269: 0.19500000000000001 | P269: 102.64 | Q269: 2月1天 | R269: 5.65年 | S269: 3.65年 | U269: 14.1 | V269: 38 | W269: 2.2000000000000002e-002 | X269: 2.5000000000000001e-002 | Y269: 2.5000000000000001e-002 | Z269: 567 | AA269: 11.31 | AB269: -1.1200000000000002e-002 | AC269: -1.5900000000000001e-002 | AD269: -4.3299999999999998e-002 | AE269: -4.5100000000000001e-002 | AG269: 87.6 | AH269: 89.96 | AI269: 0.65 | AJ269: AA | AK269: 4.5599999999999995e-002 | AL269: =H269+100*O269 -> 142.13999999999999 | AM269: 142.6 | AN269: 280 | AO269: 52.7 | AP269: 281 | AQ269: -0.107 | AR269: 6 | AS269: 大参转债
A270: 252 | B270: 123025 | C270: 精测转债!! | D270: 300567 | E270: 精测电子 | F270: 电子 | G270: 液晶显示 | H270: 122.99 | I270: -8.1000000000000013e-003 | J270: -1.32e-002 | K270: 50.62 | L270: -3.4500000000000003e-002 | M270: 117.3 | N270: 49.95 | O270: 0.214 | P270: 101.34 | Q270: 转股中 | R270: 4年31天 | S270: 2年31天 | U270: 3.09 | V270: 9.9 | W270: 2.6000000000000002e-002 | X270: 2.5000000000000001e-002 | Y270: 2.5000000000000001e-002 | Z270: 125 | AA270: 8.04 | AB270: -1.18e-002 | AC270: -1.9099999999999999e-002 | AD270: -7.4099999999999999e-002 | AE270: -7.690000000000001e-002 | AG270: 90.1 | AH270: 91.24 | AI270: 0.62 | AJ270: AA- | AK270: 6.5099999999999991e-002 | AL270: =H270+100*O270 -> 144.38999999999999 | AM270: 144.6 | AN270: 283 | AO270: 53.4 | AP270: 286 | AQ270: -0.107 | AR270: 18 | AS270: 精测转债!!
A271: 138 | B271: 113583 | C271: 益丰转债!* | D271: 603939 | E271: 益丰药房 | F271: 医药 | G271: 医药商业 | H271: 122.56 | I271: -2.07e-002 | J271: -7.000000000000001e-004 | K271: 88.1 | L271: -2.1400000000000002e-002 | M271: 115.3 | N271: 71.82 | O271: -1.e-003 | P271: 122.67 | Q271: 转股中 | R271: 5.26年 | S271: 3.26年 | U271: 5.88 | V271: 174 | W271: 0.24199999999999999 | X271: 1.3000000000000001e-002 | Y271: 1.4999999999999999e-002 | Z271: 468 | AA271: 9.3 | AB271: -1.18e-002 | AC271: -1.6799999999999999e-002 | AD271: -4.7800000000000002e-002 | AE271: -4.9699999999999994e-002 | AG271: 89.24 | AH271: 91.64 | AI271: 1 | AJ271: AA | AK271: 4.5599999999999995e-002 | AL271: =H271+100*O271 -> 122.46000000000001 | AM271: 122.5 | AN271: 167 | AO271: 30.8 | AP271: 163 | AQ271: -0.11900000000000001 | AR271: 9 | AS271: 益丰转债!*
A272: 14 | B272: 123090 | C272: 三诺转债 | D272: 300298 | E272: 三诺生物 | F272: 医药 | G272: 医疗器械 | H272: 125.41 | I272: 1.e-003 | J272: -1.77e-002 | K272: 34.89 | L272: -2.8399999999999998e-002 | M272: 117.1 | N272: 35.35 | O272: 0.27100000000000002 | P272: 98.7 | Q272: 3月29天 | R272: 5.82年 | S272: 3.82年 | U272: 5 | V272: 20 | W272: 3.2000000000000001e-002 | X272: 2.5000000000000001e-002 | Y272: 2.5000000000000001e-002 | Z272: 197 | AA272: 7.29 | AB272: -1.1899999999999999e-002 | AC272: -1.7000000000000001e-002 | AD272: -4.7199999999999999e-002 | AE272: -4.8799999999999996e-002 | AG272: 86.87 | AH272: 90.75 | AI272: 0.59 | AJ272: AA | AK272: 4.5599999999999995e-002 | AL272: =H272+100*O272 -> 152.50999999999999 | AM272: 152.1 | AN272: 299 | AO272: 61.4 | AP272: 300 | AQ272: -0.13500000000000001 | AR272: 3 | AS272: 三诺转债
A273: 67 | B273: 128134 | C273: 鸿路转债! | D273: 2541 | E273: 鸿路钢构 | F273: 建筑 | G273: 其他 | H273: 123.7 | I273: -1.2800000000000001e-002 | J273: -1.9400000000000001e-002 | K273: 45.53 | L273: -4.8899999999999999e-002 | M273: 115.1 | N273: 43.74 | O273: 0.188 | P273: 104.09 | Q273: 48天 | R273: 5.62年 | S273: 3.62年 | U273: 18.8 | V273: 63 | W273: 2.7000000000000003e-002 | X273: 7.9000000000000001e-002 | Y273: 8.199999999999999e-002 | Z273: 238 | AA273: 4.45 | AB273: -1.3000000000000001e-002 | AC273: -1.7600000000000001e-002 | AD273: -4.6100000000000002e-002 | AE273: -4.7800000000000002e-002 | AG273: 87.64 | AH273: 90.01 | AI273: 0.66 | AJ273: AA | AK273: 4.5599999999999995e-002 | AL273: =H273+100*O273 -> 142.5 | AM273: 143.3 | AN273: 281 | AO273: 53.3 | AP273: 285 | AQ273: -9.4e-002 | AR273: 4 | AS273: 鸿路转债!
A274: 131 | B274: 113585 | C274: 寿仙转债! | D274: 603896 | E274: 寿仙谷 | F274: 医药 | G274: 中药 | H274: 126.39 | I274: -2.87e-002 | J274: 5.0000000000000001e-003 | K274: 36.41 | L274: -2.9100000000000001e-002 | M274: 117.8 | N274: 28.68 | O274: -4.0000000000000001e-003 | P274: 126.95 | Q274: 转股中 | R274: 5.28年 | S274: 3.28年 | U274: 1.97 | V274: 11 | W274: 4.2999999999999997e-002 | X274: 3.7000000000000005e-002 | Y274: 4.5999999999999999e-002 | Z274: 54 | AA274: 4.24 | AB274: -1.3500000000000002e-002 | AC274: -1.9299999999999998e-002 | AD274: -5.5199999999999999e-002 | AE274: -5.7300000000000004e-002 | AG274: 83.62 | AH274: 84.48 | AI274: 0.82 | AJ274: AA- | AK274: 6.6600000000000006e-002 | AL274: =H274+100*O274 -> 125.98999999999999 | AM274: 125.8 | AN274: 197 | AO274: 41.3 | AP274: 239 | AQ274: -4.7e-002 | AR274: 9 | AS274: 寿仙转债!
A275: 17 | B275: 113614 | C275: 健20转债! | D275: 603707 | E275: 健友股份 | F275: 医药 | G275: 原料药 | H275: 123.62 | I275: -2.3199999999999998e-002 | J275: -3.0999999999999999e-003 | K275: 41.4 | L275: -3.7400000000000003e-002 | M275: 114.2 | N275: 38.04 | O275: 0.13600000000000001 | P275: 108.83 | Q275: 3月27天 | R275: 5.81年 | S275: 3.81年 | U275: 7.8 | V275: 39 | W275: 4.0000000000000001e-002 | X275: 2.e-002 | Y275: 2.2000000000000002e-002 | Z275: 387 | AA275: 11.28 | AB275: -1.38e-002 | AC275: -1.8100000000000002e-002 | AD275: -4.36e-002 | AE275: -4.53e-002 | AG275: 87 | AH275: 88.57 | AI275: 0.7 | AJ275: AA | AK275: 4.5599999999999995e-002 | AL275: =H275+100*O275 -> 137.22 | AM275: 138.4 | AN275: 269 | AO275: 49.8 | AP275: 270 | AQ275: 0.20999999999999999 | AR275: 2 | AS275: 健20转债!
A276: 15 | B276: 128142 | C276: 新乳转债 | D276: 2946 | E276: 新乳业 | F276: 食品饮料 | G276: 乳制品 | H276: 125.8 | I276: 2.7000000000000003e-002 | J276: -4.4600000000000001e-002 | K276: 18.75 | L276: -2.7999999999999997e-002 | M276: 115.1 | N276: 18.69 | O276: 0.254 | P276: 100.32 | Q276: 3月28天 | R276: 5.81年 | S276: 3.81年 | U276: 7.18 | V276: 26 | W276: 2.8999999999999998e-002 | X276: 4.4999999999999998e-002 | Y276: 4.4999999999999998e-002 | Z276: 160 | AA276: 7.83 | AB276: -1.54e-002 | AC276: -1.9900000000000001e-002 | AD276: -4.8000000000000001e-002 | AE276: -4.9599999999999998e-002 | AG276: 86.9 | AH276: 89.24 | AI276: 0.63 | AJ276: AA | AK276: 4.5599999999999995e-002 | AL276: =H276+100*O276 -> 151.19999999999999 | AM276: 151.3 | AN276: 298 | AO276: 62 | AP276: 302 | AQ276: -9.0000000000000011e-003 | AR276: 3 | AS276: 新乳转债
A277: 276 | B277: 128050 | C277: 钧达转债! | D277: 2865 | E277: 钧达股份 | F277: 汽车 | G277: 零部件制 | H277: 130.137 | I277: -2.3599999999999999e-002 | J277: 6.4000000000000003e-003 | K277: 19.51 | L277: -2.2499999999999999e-002 | M277: 122.7 | N277: 14.85 | O277: -9.0000000000000011e-003 | P277: 131.38 | Q277: 转股中 | R277: 3.79年 | S277: 1.79年 | U277: 1.67 | V277: 71 | W277: 0.32600000000000001 | X277: 6.6000000000000003e-002 | Y277: 8.6999999999999994e-002 | Z277: 25 | AA277: 2.73 | AB277: -1.5700000000000002e-002 | AC277: -2.5499999999999998e-002 | AD277: -0.113 | AE277: -0.11599999999999999 | AG277: 91.19 | AH277: 97.08 | AI277: 0.76 | AJ277: AA- | AK277: 6.5099999999999991e-002 | AL277: =H277+100*O277 -> 129.23699999999999 | AM277: 128.9 | AN277: 215 | AO277: 31.8 | AP277: 169 | AQ277: 4.9000000000000002e-002 | AR277: 57 | AS277: 钧达转债!
A278: 193 | B278: 110065 | C278: 淮矿转债! | D278: 600985 | E278: 淮北矿业 | F278: 煤炭 | G278: 煤炭开采 | H278: 119.62 | I278: -1.3500000000000002e-002 | J278: -1.5600000000000001e-002 | K278: 10.78 | L278: -3.9199999999999999e-002 | M278: 110.8 | N278: 9.33 | O278: 3.5000000000000003e-002 | P278: 115.54 | Q278: 转股中 | R278: 4.82年 | S278: 2.82年 | U278: 26.5 | V278: 111 | W278: 3.5000000000000003e-002 | X278: 0.113 | Y278: 0.13100000000000001 | Z278: 234 | AA278: 1.13 | AB278: -1.6e-002 | AC278: -2.e-002 | AD278: -4.8300000000000003e-002 | AE278: -5.0199999999999995e-002 | AG278: 92.2 | AH278: 92.41 | AI278: 0.74 | AJ278: AAA | AK278: 3.9100000000000003e-002 | AL278: =H278+100*O278 -> 123.12 | AM278: 123.7 | AN278: 175 | AO278: 31.3 | AP278: 164 | AQ278: 6.0000000000000001e-003 | AR278: 21 | AS278: 淮矿转债!
A279: 139 | B279: 128108 | C279: 蓝帆转债! | D279: 2382 | E279: 蓝帆医疗 | F279: 医药 | G279: 医疗器械 | H279: 123.31 | I279: -1.55e-002 | J279: 4.5999999999999999e-003 | K279: 21.93 | L279: -1.3899999999999999e-002 | M279: 113.3 | N279: 17.79 | O279: 0. | P279: 123.27 | Q279: 转股中 | R279: 5.25年 | S279: 4.25年 | U279: 16.8 | V279: 309 | W279: 0.14699999999999999 | X279: 7.400000000000001e-002 | Y279: 9.0999999999999998e-002 | Z279: 227 | AA279: 2.21 | AB279: -1.6299999999999999e-002 | AC279: -2.0799999999999999e-002 | AD279: -3.5000000000000003e-002 | AE279: -3.7200000000000004e-002 | AG279: 87.04 | AH279: 90.1 | AI279: 0.78 | AJ279: AA | AK279: 4.5599999999999995e-002 | AL279: =H279+100*O279 -> 123.31 | AM279: 123.3 | AN279: 173 | AO279: 33.2 | AP279: 194 | AQ279: -0.113 | AR279: 25 | AS279: 蓝帆转债!
A280: 11 | B280: 113615 | C280: 金诚转债 | D280: 603979 | E280: 金诚信 | F280: 有色金属 | G280: 有色行业 | H280: 128.87 | I280: -1.1999999999999999e-003 | J280: -2.46e-002 | K280: 15.43 | L280: -3.3799999999999997e-002 | M280: 117.3 | N280: 12.73 | O280: 6.3e-002 | P280: 121.21 | Q280: 4月3天 | R280: 5.82年 | S280: 3.82年 | U280: 10 | V280: 180 | W280: 0.14000000000000001 | X280: 0.111 | Y280: 0.13500000000000001 | Z280: 90 | AA280: 2.01 | AB280: -1.6299999999999999e-002 | AC280: -2.1400000000000002e-002 | AD280: -5.3200000000000004e-002 | AE280: -5.4900000000000004e-002 | AG280: 87.03 | AH280: 90.92 | AI280: 0.76 | AJ280: AA | AK280: 4.5599999999999995e-002 | AL280: =H280+100*O280 -> 135.17000000000002 | AM280: 136.5 | AN280: 255 | AO280: 45.6 | AP280: 257 | AQ280: 0.17899999999999999 | AR280: 3 | AS280: 金诚转债
A281: 331 | B281: 113013 | C281: 国君转债! | D281: 601211 | E281: 国泰君安 | F281: 金融 | G281: 证券行业 | H281: 112.59 | I281: -1.0500000000000001e-002 | J281: 6.4000000000000003e-003 | K281: 16.66 | L281: -1.24e-002 | M281: 108.3 | N281: 19.01 | O281: 0.28499999999999998 | P281: 87.64 | Q281: 转股中 | R281: 2.36年 | S281: 无权 | U281: 69.9 | V281: 52 | W281: 6.9999999999999993e-003 | X281: 4.7e-002 | Y281: 4.0999999999999995e-002 | Z281: 1484. | AA281: 1.2 | AB281: -1.66e-002 | AC281: -2.3099999999999999e-002 | AD281: 无权 | AE281: 无权 | AG281: 无权 | AH281: 99.57 | AI281: 0.33 | AJ281: AAA | AK281: 3.7000000000000005e-002 | AL281: =H281+100*O281 -> 141.09 | AM281: 137.5 | AN281: 258 | AO281: 38 | AP281: 223 | AQ281: 2.e-003 | AR281: 14 | AS281: 国君转债!
A282: 224 | B282: 123030 | C282: 九洲转债! | D282: 300040 | E282: 九洲集团 | F282: 能源电力 | G282: 电力设备 | H282: 129.3 | I282: 1.7100000000000001e-002 | J282: -1.0500000000000001e-002 | K282: 6.38 | L282: 9.4999999999999998e-003 | M282: 120 | N282: 5.65 | O282: 0.14499999999999999 | P282: 112.92 | Q282: 转股中 | R282: 4.48年 | S282: 2.48年 | U282: 0.97 | V282: 101 | W282: 0.81200000000000006 | X282: 4.0000000000000001e-002 | Y282: 4.4999999999999998e-002 | Z282: 24 | AA282: 1.11 | AB282: -1.6799999999999999e-002 | AC282: -2.4300000000000002e-002 | AD282: -8.1500000000000003e-002 | AE282: -8.3699999999999997e-002 | AG282: 87.76 | AH282: 91 | AI282: 0.69 | AJ282: AA- | AK282: 6.5099999999999991e-002 | AL282: =H282+100*O282 -> 143.80000000000001 | AM282: 145.7 | AN282: 285 | AO282: 54.7 | AP282: 289 | AQ282: 2.1000000000000001e-002 | AR282: 27 | AS282: 九洲转债!
A283: 304 | B283: 127005 | C283: 长证转债! | D283: 783 | E283: 长江证券 | F283: 金融 | G283: 证券行业 | H283: 116.02 | I283: -8.3999999999999995e-003 | J283: 3.2000000000000002e-003 | K283: 7.25 | L283: -9.5999999999999992e-003 | M283: 109.3 | N283: 7.28 | O283: 0.16500000000000001 | P283: 99.59 | Q283: 转股中 | R283: 3年14天 | S283: 无权 | U283: 50 | V283: 32 | W283: 5.0000000000000001e-003 | X283: 0.125 | Y283: 0.124 | Z283: 401 | AA283: 1.43 | AB283: -1.9900000000000001e-002 | AC283: -2.5399999999999999e-002 | AD283: 无权 | AE283: 无权 | AG283: 无权 | AH283: 97.54 | AI283: 0.54 | AJ283: AAA | AK283: 3.9100000000000003e-002 | AL283: =H283+100*O283 -> 132.51999999999998 | AM283: 132.5 | AN283: 236 | AO283: 34.9 | AP283: 199 | AQ283: -2.6000000000000002e-002 | AR283: 15 | AS283: 长证转债!
A284: 216 | B284: 128079 | C284: 英联转债! | D284: 2846 | E284: 英联股份 | F284: 造纸包装 | G284: 包装材料 | H284: 129 | I284: 2.9999999999999997e-004 | J284: 5.0000000000000001e-003 | K284: 16.92 | L284: 5.3e-003 | M284: 117.5 | N284: 13.41 | O284: 2.2000000000000002e-002 | P284: 126.17 | Q284: 转股中 | R284: 4.65年 | S284: 2.65年 | U284: 1.53 | V284: 298 | W284: 1.54 | X284: 4.4999999999999998e-002 | Y284: 5.7000000000000002e-002 | Z284: 34 | AA284: 4.34 | AB284: -2.0299999999999999e-002 | AC284: -2.6600000000000002e-002 | AD284: -7.5300000000000006e-002 | AE284: -7.7600000000000002e-002 | AG284: 84.5 | AH284: 84.16 | AI284: 1 | AJ284: A+ | AK284: 7.6100000000000001e-002 | AL284: =H284+100*O284 -> 131.19999999999999 | AM284: 131.8 | AN284: 231 | AO284: 47.3 | AP284: 263 | AQ284: 0.16200000000000001 | AR284: 20 | AS284: 英联转债!
A285: 208 | B285: 110061 | C285: 川投转债 | D285: 600674 | E285: 川投能源 | F285: 能源电力 | G285: 水电 | H285: 121.86 | I285: -6.0999999999999995e-003 | J285: 1.01e-002 | K285: 10.73 | L285: 5.6000000000000008e-003 | M285: 110.8 | N285: 9.58 | O285: 8.8000000000000009e-002 | P285: 112 | Q285: 转股中 | R285: 4.71年 | S285: 2.71年 | U285: 40 | V285: 2.4 | W285: 0. | X285: 8.5000000000000006e-002 | Y285: 9.5000000000000001e-002 | Z285: 472 | AA285: 1.71 | AB285: -2.0400000000000001e-002 | AC285: -2.4399999999999998e-002 | AD285: -5.6299999999999996e-002 | AE285: -5.8400000000000001e-002 | AG285: 92.61 | AH285: 92.82 | AI285: 0.72 | AJ285: AAA | AK285: 3.9100000000000003e-002 | AL285: =H285+100*O285 -> 130.66 | AM285: 131.7 | AN285: 230 | AO285: 38.9 | AP285: 227 | AQ285: -6.9999999999999993e-003 | AR285: 16 | AS285: 川投转债
A286: 307 | B286: 128035 | C286: 大族转债! | D286: 2008 | E286: 大族激光 | F286: 机械装备 | G286: 专用设备 | H286: 114.899 | I286: 8.0000000000000004e-004 | J286: -9.5999999999999992e-003 | K286: 43.11 | L286: -3.6400000000000002e-002 | M286: 107.4 | N286: 52.1 | O286: 0.38900000000000001 | P286: 82.74 | Q286: 转股中 | R286: 2.95年 | S286: 0.95年 | U286: 23 | V286: 33 | W286: 1.3000000000000001e-002 | X286: 5.0000000000000003e-002 | Y286: 4.0999999999999995e-002 | Z286: 460 | AA286: 5.01 | AB286: -2.29e-002 | AC286: -2.75e-002 | AD286: -8.7400000000000005e-002 | AE286: -9.3399999999999997e-002 | AG286: 99.38 | AH286: 95.8 | AI286: 0.24 | AJ286: AA+ | AK286: 4.0000000000000001e-002 | AL286: =H286+100*O286 -> 153.79900000000001 | AM286: 147.1 | AN286: 290 | AO286: 47.7 | AP286: 266 | AQ286: -7.9000000000000001e-002 | AR286: 20 | AS286: 大族转债!
A287: 65 | B287: 110075 | C287: 南航转债 | D287: 600029 | E287: 南方航空 | F287: 交通运输 | G287: 航空运输 | H287: 126.09 | I287: -1.1000000000000001e-002 | J287: -7.000000000000001e-004 | K287: 6.07 | L287: -1.9400000000000001e-002 | M287: 110 | N287: 6.24 | O287: 0.29600000000000004 | P287: 97.28 | Q287: 54天 | R287: 5.63年 | S287: 3.63年 | U287: 160 | V287: 119 | W287: 6.0000000000000001e-003 | X287: 0.17199999999999999 | Y287: 0.16699999999999998 | Z287: 930 | AA287: 1.29 | AB287: -2.4199999999999999e-002 | AC287: -2.7400000000000001e-002 | AD287: -5.3899999999999997e-002 | AE287: -5.5e-002 | AG287: 87.97 | AH287: 88.15 | AI287: 0.6 | AJ287: AAA | AK287: 4.0599999999999997e-002 | AL287: =H287+100*O287 -> 155.69 | AM287: 154.9 | AN287: 304 | AO287: 66.8 | AP287: 306 | AQ287: 1.4999999999999999e-002 | AR287: 8 | AS287: 南航转债
A288: 146 | B288: 113577 | C288: 春秋转债 | D288: 603890 | E288: 春秋电子 | F288: 电子 | G288: 电子产品 | H288: 134.75 | I288: -4.8999999999999998e-003 | J288: 5.0000000000000001e-004 | K288: 14.95 | L288: -5.3e-003 | M288: 118.2 | N288: 11.06 | O288: -3.0000000000000001e-003 | P288: 135.17 | Q288: 转股中 | R288: 5年47天 | S288: 3年47天 | U288: 1.93 | V288: 180 | W288: 0.68500000000000005 | X288: 3.3000000000000002e-002 | Y288: 4.4999999999999998e-002 | Z288: 58 | AA288: 3.41 | AB288: -2.58e-002 | AC288: -3.1699999999999999e-002 | AD288: -7.6100000000000001e-002 | AE288: -7.8200000000000006e-002 | AG288: 84.42 | AH288: 85.61 | AI288: 0.82 | AJ288: AA- | AK288: 6.6600000000000006e-002 | AL288: =H288+100*O288 -> 134.44999999999999 | AM288: 134.3 | AN288: 247 | AO288: 48.7 | AP288: 268 | AQ288: 8.4000000000000005e-002 | AR288: 13 | AS288: 春秋转债
A289: 111 | B289: 123058 | C289: 欣旺转债 | D289: 300207 | E289: 欣旺达 | F289: 电子 | G289: 电子产品 | H289: 135 | I289: 2.2000000000000001e-003 | J289: -4.3799999999999999e-002 | K289: 24.73 | L289: -5.7200000000000001e-002 | M289: 116.3 | N289: 21.24 | O289: 0.159 | P289: 116.43 | Q289: 转股中 | R289: 5.38年 | S289: 3.38年 | U289: 11.2 | V289: 119 | W289: 8.0000000000000002e-002 | X289: 2.8999999999999998e-002 | Y289: 3.3000000000000002e-002 | Z289: 389 | AA289: 6.15 | AB289: -2.7799999999999998e-002 | AC289: -3.3000000000000002e-002 | AD289: -7.2099999999999997e-002 | AE289: -7.3899999999999993e-002 | AG289: 88.77 | AH289: 91.95 | AI289: 0.73 | AJ289: AA | AK289: 4.5599999999999995e-002 | AL289: =H289+100*O289 -> 150.90000000000001 | AM289: 153.6 | AN289: 301 | AO289: 61.6 | AP289: 301 | AQ289: -9.9000000000000005e-002 | AR289: 6 | AS289: 欣旺转债
A290: 163 | B290: 123046 | C290: 天铁转债! | D290: 300587 | E290: 天铁股份 | F290: 铁路 | G290: 铁路设备 | H290: 136 | I290: -5.3e-003 | J290: 4.0000000000000002e-004 | K290: 12.73 | L290: -6.1999999999999998e-003 | M290: 118.2 | N290: 10.12 | O290: 8.1000000000000003e-002 | P290: 125.79 | Q290: 转股中 | R290: 5年21天 | S290: 3年21天 | U290: 0.99 | V290: 58 | W290: 0.436 | X290: 2.3e-002 | Y290: 2.8999999999999998e-002 | Z290: 43 | AA290: 3.13 | AB290: -2.7999999999999997e-002 | AC290: -3.39e-002 | AD290: -8.0399999999999985e-002 | AE290: -8.2500000000000004e-002 | AG290: 84.81 | AH290: 86 | AI290: 0.8 | AJ290: AA- | AK290: 6.6600000000000006e-002 | AL290: =H290+100*O290 -> 144.09999999999999 | AM290: 146.2 | AN290: 288 | AO290: 60.2 | AP290: 299 | AQ290: -5.7000000000000002e-002 | AR290: 12 | AS290: 天铁转债!
A291: 328 | B291: 113016 | C291: 小康转债! | D291: 601127 | E291: 小康股份 | F291: 汽车 | G291: 零部件制 | H291: 119.41 | I291: 7.17e-002 | J291: 1.7000000000000001e-003 | K291: 19.2 | L291: 9.2200000000000004e-002 | M291: 109.3 | N291: 15.7 | O291: -2.4e-002 | P291: 122.29 | Q291: 转股中 | R291: 2.69年 | S291: 0.69年 | U291: 5.61 | V291: 2238. | W291: 3.3599999999999999 | X291: 2.3e-002 | Y291: 2.7999999999999997e-002 | Z291: 245 | AA291: 4.18 | AB291: -3.2799999999999996e-002 | AC291: -3.9e-002 | AD291: -0.17499999999999999 | AE291: -0.17800000000000002 | AG291: 98.27 | AH291: 98.02 | AI291: 0.8 | AJ291: AA | AK291: 4.2000000000000003e-002 | AL291: =H291+100*O291 -> 117.00999999999999 | AM291: 116.5 | AN291: 103 | AO291: 18.3 | AP291: 40 | AQ291: 0.21199999999999999 | AR291: 49 | AS291: 小康转债!
A292: 179 | B292: 128097 | C292: 奥佳转债! | D292: 2614 | E292: 奥佳华 | F292: 机械装备 | G292: 专用设备 | H292: 135.6 | I292: -3.6799999999999999e-002 | J292: 1.6500000000000001e-002 | K292: 13.66 | L292: -2.5699999999999997e-002 | M292: 114.9 | N292: 10.69 | O292: 6.0999999999999999e-002 | P292: 127.78 | Q292: 转股中 | R292: 4.999年 | S292: 2.999年 | U292: 5.85 | V292: 5.6 | W292: 6.9999999999999993e-003 | X292: 6.9000000000000006e-002 | Y292: 8.8000000000000009e-002 | Z292: 85 | AA292: 2 | AB292: -3.3099999999999997e-002 | AC292: -3.8199999999999998e-002 | AD292: -8.2699999999999996e-002 | AE292: -8.4499999999999992e-002 | AG292: 90.31 | AH292: 92.98 | AI292: 0.79 | AJ292: AA | AK292: 4.41e-002 | AL292: =H292+100*O292 -> 141.69999999999999 | AM292: 143.4 | AN292: 282 | AO292: 50.4 | AP292: 275 | AQ292: -3.4000000000000002e-002 | AR292: 24 | AS292: 奥佳转债!
A293: 157 | B293: 110069 | C293: 瀚蓝转债 | D293: 600323 | E293: 瀚蓝环境 | F293: 城市公用 | G293: 三废处理 | H293: 134.8 | I293: 1.1000000000000001e-003 | J293: -1.1699999999999999e-002 | K293: 24.35 | L293: -1.38e-002 | M293: 113.5 | N293: 20.2 | O293: 0.11800000000000001 | P293: 120.54 | Q293: 转股中 | R293: 5年40天 | S293: 3年40天 | U293: 9.83 | V293: 6.2 | W293: 5.0000000000000001e-003 | X293: 5.2999999999999999e-002 | Y293: 6.3e-002 | Z293: 187 | AA293: 2.61 | AB293: -3.3500000000000002e-002 | AC293: -3.7999999999999999e-002 | AD293: -8.1300000000000011e-002 | AE293: -8.2500000000000004e-002 | AG293: 88.99 | AH293: 91.53 | AI293: 0.77 | AJ293: AA+ | AK293: 4.36e-002 | AL293: =H293+100*O293 -> 146.60000000000002 | AM293: 149.1 | AN293: 292 | AO293: 57.5 | AP293: 294 | AQ293: 8.5999999999999993e-002 | AR293: 9 | AS293: 瀚蓝转债
A294: 128 | B294: 128112 | C294: 歌尔转2!* | D294: 2241 | E294: 歌尔股份 | F294: 电子 | G294: 电子产品 | H294: 136.81 | I294: -4.8600000000000004e-002 | J294: 3.8e-003 | K294: 32 | L294: -4.4800000000000006e-002 | M294: 114.5 | N294: 23.27 | O294: -5.0000000000000001e-003 | P294: 137.52 | Q294: 转股中 | R294: 5.29年 | S294: 3.29年 | U294: 7.93 | V294: 614 | W294: 0.56100000000000005 | X294: 6.9999999999999993e-003 | Y294: 1.e-002 | Z294: 1078. | AA294: 5.94 | AB294: -3.3599999999999998e-002 | AC294: -3.8199999999999998e-002 | AD294: -7.9299999999999995e-002 | AE294: -8.0700000000000008e-002 | AG294: 88.96 | AH294: 91.68 | AI294: 1 | AJ294: AA+ | AK294: 4.36e-002 | AL294: =H294+100*O294 -> 136.31 | AM294: 136.1 | AN294: 253 | AO294: 44.4 | AP294: 251 | AQ294: -7.8e-002 | AR294: 17 | AS294: 歌尔转2!*
A295: 185 | B295: 127015 | C295: 希望转债! | D295: 876 | E295: 新 希 望 | F295: 农业 | G295: 畜牧业 | H295: 129.8 | I295: -2.41e-002 | J295: 5.0000000000000001e-004 | K295: 24.07 | L295: -2.35e-002 | M295: 110 | N295: 19.75 | O295: 6.5000000000000002e-002 | P295: 121.87 | Q295: 转股中 | R295: 4.85年 | S295: 2.85年 | U295: 9.5 | V295: 149 | W295: 0.121 | X295: 9.0000000000000011e-003 | Y295: 1.1000000000000001e-002 | Z295: 1085. | AA295: 2.99 | AB295: -3.4000000000000002e-002 | AC295: -3.7599999999999995e-002 | AD295: -7.5199999999999989e-002 | AE295: -7.6700000000000004e-002 | AG295: 91.51 | AH295: 91.58 | AI295: 1 | AJ295: AAA | AK295: 3.9100000000000003e-002 | AL295: =H295+100*O295 -> 136.30000000000001 | AM295: 137.7 | AN295: 261 | AO295: 46.1 | AP295: 259 | AQ295: 1.9e-002 | AR295: 28 | AS295: 希望转债!
A296: 287 | B296: 123014 | C296: 凯发转债! | D296: 300407 | E296: 凯发电气 | F296: 能源电力 | G296: 电力设备 | H296: 118 | I296: 2.1600000000000001e-002 | J296: -2.1099999999999997e-002 | K296: 7.02 | L296: 1.4000000000000002e-003 | M296: 108.5 | N296: 8.12 | O296: 0.36499999999999999 | P296: 86.45 | Q296: 转股中 | R296: 2.42年 | S296: 0.42年 | U296: 1.16 | V296: 166 | W296: 1.21 | X296: 5.4000000000000006e-002 | Y296: 4.7e-002 | Z296: 21 | AA296: 1.59 | AB296: -3.4599999999999999e-002 | AC296: -4.0899999999999999e-002 | AD296: -0.25700000000000001 | AE296: -0.26100000000000001 | AG296: 97.15 | AH296: 91.55 | AI296: 0.39 | AJ296: A+ | AK296: 7.400000000000001e-002 | AL296: =H296+100*O296 -> 154.5 | AM296: 149.5 | AN296: 293 | AO296: 52.4 | AP296: 280 | AQ296: 8.0000000000000002e-002 | AR296: 16 | AS296: 凯发转债!
A297: 270 | B297: 113526 | C297: 联泰转债! | D297: 603797 | E297: 联泰环保 | F297: 城市公用 | G297: 三废处理 | H297: 126.28 | I297: 1.8100000000000002e-002 | J297: -9.7999999999999997e-003 | K297: 7.48 | L297: 1.0800000000000001e-002 | M297: 110.3 | N297: 6.11 | O297: 3.2000000000000001e-002 | P297: 122.42 | Q297: 转股中 | R297: 3.91年 | S297: 1.91年 | U297: 1.93 | V297: 42 | W297: 0.17000000000000001 | X297: 5.7000000000000002e-002 | Y297: 7.0000000000000007e-002 | Z297: 34 | AA297: 2.18 | AB297: -3.4599999999999999e-002 | AC297: -3.9199999999999999e-002 | AD297: -9.5000000000000001e-002 | AE297: -9.7299999999999998e-002 | AG297: 94.43 | AH297: 94.16 | AI297: 0.77 | AJ297: AA+ | AK297: 4.2099999999999999e-002 | AL297: =H297+100*O297 -> 129.47999999999999 | AM297: 130.1 | AN297: 221 | AO297: 35.7 | AP297: 205 | AQ297: 3.4000000000000002e-002 | AR297: 9 | AS297: 联泰转债!
A298: 258 | B298: 123022 | C298: 长信转债!! | D298: 300088 | E298: 长信科技 | F298: 通信互联 | G298: 通信设备 | H298: 132.399 | I298: -1.5300000000000001e-002 | J298: 9.300000000000001e-003 | K298: 8.07 | L298: -7.4000000000000003e-003 | M298: 114.9 | N298: 6.15 | O298: 9.0000000000000011e-003 | P298: 131.22 | Q298: 转股中 | R298: 4年20天 | S298: 2年20天 | U298: 2.57 | V298: 9.2 | W298: 2.7000000000000003e-002 | X298: 1.3000000000000001e-002 | Y298: 1.7000000000000001e-002 | Z298: 198 | AA298: 2.86 | AB298: -3.5099999999999999e-002 | AC298: -4.1299999999999996e-002 | AD298: -0.106 | AE298: -0.10800000000000001 | AG298: 94.06 | AH298: 96.83 | AI298: 0.82 | AJ298: AA | AK298: 4.41e-002 | AL298: =H298+100*O298 -> 133.29900000000001 | AM298: 133.6 | AN298: 244 | AO298: 36.7 | AP298: 215 | AQ298: 1.4999999999999999e-002 | AR298: 12 | AS298: 长信转债!!
A299: 12 | B299: 123091 | C299: 长海转债 | D299: 300196 | E299: 长海股份 | F299: 其他 | G299: 非金属矿 | H299: 142.591 | I299: -1.23e-002 | J299: 6.8999999999999999e-003 | K299: 18.33 | L299: -7.6e-003 | M299: 116.2 | N299: 16.24 | O299: 0.26300000000000001 | P299: 112.87 | Q299: 4月3天 | R299: 5.82年 | S299: 3.82年 | U299: 5.5 | V299: 46 | W299: 5.9999999999999998e-002 | X299: 7.2999999999999995e-002 | Y299: 8.3000000000000004e-002 | Z299: 75 | AA299: 2.69 | AB299: -3.5099999999999999e-002 | AC299: -3.9699999999999999e-002 | AD299: -7.7300000000000008e-002 | AE299: -7.8799999999999995e-002 | AG299: 86.94 | AH299: 90.05 | AI299: 0.72 | AJ299: AA | AK299: 4.5599999999999995e-002 | AL299: =H299+100*O299 -> 168.89100000000002 | AM299: 172.3 | AN299: 313 | AO299: 82.3 | AP299: 314 | AQ299: -5.9000000000000004e-002 | AR299: 3 | AS299: 长海转债
A300: 335 | B300: 113012 | C300: 骆驼转债! | D300: 601311 | E300: 骆驼股份 | F300: 汽车 | G300: 零部件制 | H300: 116.19 | I300: 1.6000000000000001e-003 | J300: 6.0000000000000001e-003 | K300: 9.9 | L300: 1.54e-002 | M300: 107.8 | N300: 10.06 | O300: 0.18100000000000002 | P300: 98.41 | Q300: 转股中 | R300: 2年26天 | S300: 26天 | U300: 5.1 | V300: 8.2 | W300: 1.3999999999999999e-002 | X300: 4.5999999999999999e-002 | Y300: 4.4999999999999998e-002 | Z300: 111 | AA300: 1.66 | AB300: -3.6200000000000003e-002 | AC300: -4.2900000000000001e-002 | AD300: -0.57799999999999996 | AE300: -0.58899999999999997 | AG300: 100.57 | AH300: 99.15 | AI300: 0.5 | AJ300: AA | AK300: 4.2000000000000003e-002 | AL300: =H300+100*O300 -> 134.28999999999999 | AM300: 134 | AN300: 246 | AO300: 33.4 | AP300: 195 | AQ300: 1.e-003 | AR300: 17 | AS300: 骆驼转债!
A301: 57 | B301: 113040 | C301: 星宇转债 | D301: 601799 | E301: 星宇股份 | F301: 汽车 | G301: 零部件制 | H301: 137.93 | I301: -2.1400000000000002e-002 | J301: 9.3999999999999986e-003 | K301: 191.06 | L301: -1.54e-002 | M301: 111.5 | N301: 158 | O301: 0.14099999999999999 | P301: 120.92 | Q301: 2月1天 | R301: 5.65年 | S301: 3.65年 | U301: 15 | V301: 72 | W301: 3.5000000000000003e-002 | X301: 2.7999999999999997e-002 | Y301: 3.4000000000000002e-002 | Z301: 528 | AA301: 9.92 | AB301: -3.73e-002 | AC301: -4.0800000000000003e-002 | AD301: -7.5700000000000003e-002 | AE301: -7.6700000000000004e-002 | AG301: 86.95 | AH301: 87.86 | AI301: 0.78 | AJ301: AA+ | AK301: 4.36e-002 | AL301: =H301+100*O301 -> 152.03 | AM301: 154.9 | AN301: 305 | AO301: 67.1 | AP301: 307 | AQ301: -8.6999999999999994e-002 | AR301: 4 | AS301: 星宇转债
A302: 259 | B302: 110055 | C302: 伊力转债!! | D302: 600197 | E302: 伊力特 | F302: 食品饮料 | G302: 白酒 | H302: 134.74 | I302: 3.7000000000000002e-003 | J302: -1.03e-002 | K302: 19.96 | L302: -8.8999999999999999e-003 | M302: 115 | N302: 16.81 | O302: 0.13500000000000001 | P302: 118.74 | Q302: 转股中 | R302: 4年17天 | S302: 2年17天 | U302: 2.85 | V302: 133 | W302: 0.34799999999999998 | X302: 3.1e-002 | Y302: 3.6000000000000004e-002 | Z302: 93 | AA302: 3.25 | AB302: -3.9199999999999999e-002 | AC302: -4.5400000000000003e-002 | AD302: -0.113 | AE302: -0.11599999999999999 | AG302: 94.19 | AH302: 96.97 | AI302: 0.73 | AJ302: AA | AK302: 4.41e-002 | AL302: =H302+100*O302 -> 148.24000000000001 | AM302: 150.7 | AN302: 297 | AO302: 53.8 | AP302: 287 | AQ302: -9.5000000000000001e-002 | AR302: 24 | AS302: 伊力转债!!
A303: 33 | B303: 113611 | C303: 福20转债 | D303: 603806 | E303: 福斯特 | F303: 能源电力 | G303: 太阳能 | H303: 140.7 | I303: -1.47e-002 | J303: 3.5999999999999999e-003 | K303: 90.15 | L303: -1.4199999999999999e-002 | M303: 111.85 | N303: 73.69 | O303: 0.14999999999999999 | P303: 122.34 | Q303: 3月11天 | R303: 5.76年 | S303: 3.76年 | U303: 17 | V303: 38 | W303: 1.6e-002 | X303: 2.5000000000000001e-002 | Y303: 2.9999999999999999e-002 | Z303: 694 | AA303: 8.69 | AB303: -3.95e-002 | AC303: -4.2999999999999997e-002 | AD303: -7.7600000000000002e-002 | AE303: -7.8700000000000006e-002 | AG303: 86.25 | AH303: 86.82 | AI303: 0.78 | AJ303: AA | AK303: 4.5599999999999995e-002 | AL303: =H303+100*O303 -> 155.69999999999999 | AM303: 159.1 | AN303: 308 | AO303: 72.2 | AP303: 310 | AQ303: -0.115 | AR303: 4 | AS303: 福20转债
A304: 306 | B304: 113504 | C304: 艾华转债!! | D304: 603989 | E304: 艾华集团 | F304: 电子 | G304: 元器件制 | H304: 124.67 | I304: -1.4800000000000001e-002 | J304: 5.9999999999999995e-004 | K304: 25.77 | L304: -1.7899999999999999e-002 | M304: 110.3 | N304: 21.13 | O304: 2.2000000000000002e-002 | P304: 121.96 | Q304: 转股中 | R304: 3年4.6天 | S304: 1年4.6天 | U304: 5.59 | V304: 3 | W304: 4.0000000000000001e-003 | X304: 5.5e-002 | Y304: 6.7000000000000004e-002 | Z304: 102 | AA304: 4.23 | AB304: -4.07e-002 | AC304: -4.6600000000000003e-002 | AD304: -0.14699999999999999 | AE304: -0.151 | AG304: 97.77 | AH304: 97.16 | AI304: 0.79 | AJ304: AA | AK304: 4.41e-002 | AL304: =H304+100*O304 -> 126.87 | AM304: 127.4 | AN304: 206 | AO304: 29.6 | AP304: 151 | AQ304: 3.1e-002 | AR304: 9 | AS304: 艾华转债!!
A305: 235 | B305: 123027 | C305: 蓝晓转债! | D305: 300487 | E305: 蓝晓科技 | F305: 化工 | G305: 化工 | H305: 145.409 | I305: -1.2199999999999999e-002 | J305: -4.5000000000000005e-003 | K305: 40 | L305: -2.0099999999999996e-002 | M305: 119.5 | N305: 29.33 | O305: 6.6000000000000003e-002 | P305: 136.38 | Q305: 转股中 | R305: 4.29年 | S305: 2.29年 | U305: 1.08 | V305: 55 | W305: 0.34999999999999998 | X305: 1.3000000000000001e-002 | Y305: 1.7000000000000001e-002 | Z305: 86 | AA305: 5.4 | AB305: -4.58e-002 | AC305: -5.3099999999999994e-002 | AD305: -0.127 | AE305: -0.129 | AG305: 87.43 | AH305: 88.02 | AI305: 0.83 | AJ305: A+ | AK305: 7.6100000000000001e-002 | AL305: =H305+100*O305 -> 152.00899999999999 | AM305: 154.4 | AN305: 303 | AO305: 66.4 | AP305: 305 | AQ305: -6.5000000000000002e-002 | AR305: 21 | AS305: 蓝晓转债!
A306: 122 | B306: 113590 | C306: 海容转债!* | D306: 603187 | E306: 海容冷链 | F306: 机械装备 | G306: 通用设备 | H306: 150.15 | I306: -3.6499999999999998e-002 | J306: 2.3999999999999998e-003 | K306: 55.06 | L306: -3.4000000000000002e-002 | M306: 115.6 | N306: 36.39 | O306: -8.0000000000000002e-003 | P306: 151.31 | Q306: 转股中 | R306: 5.34年 | S306: 3.34年 | U306: 1.39 | V306: 61 | W306: 0.29199999999999998 | X306: 1.4999999999999999e-002 | Y306: 2.3e-002 | Z306: 91 | AA306: 5.36 | AB306: -4.87e-002 | AC306: -5.3499999999999999e-002 | AD306: -0.10099999999999999 | AE306: -0.10199999999999999 | AG306: 83.13 | AH306: 82.57 | AI306: 1 | AJ306: AA- | AK306: 6.6600000000000006e-002 | AL306: =H306+100*O306 -> 149.34999999999999 | AM306: 149 | AN306: 291 | AO306: 65.9 | AP306: 304 | AQ306: -0.13400000000000001 | AR306: 7 | AS306: 海容转债!*
A307: 301 | B307: 128036 | C307: 金农转债!! | D307: 2548 | E307: 金新农 | F307: 农业 | G307: 畜牧业 | H307: 128.15 | I307: 1.21e-002 | J307: 3.0000000000000001e-003 | K307: 7.71 | L307: 1.5800000000000002e-002 | M307: 110.3 | N307: 6.96 | O307: 0.157 | P307: 110.78 | Q307: 转股中 | R307: 3年11天 | S307: 1年11天 | U307: 1.46 | V307: 98 | W307: 0.52600000000000002 | X307: 2.7000000000000003e-002 | Y307: 2.9999999999999999e-002 | Z307: 53 | AA307: 2.04 | AB307: -4.9299999999999997e-002 | AC307: -5.5099999999999996e-002 | AD307: -0.16300000000000001 | AE307: -0.16600000000000001 | AG307: 95.41 | AH307: 91.53 | AI307: 0.95 | AJ307: AA- | AK307: 6.5099999999999991e-002 | AL307: =H307+100*O307 -> 143.84999999999999 | AM307: 145.5 | AN307: 284 | AO307: 50.1 | AP307: 272 | AQ307: -9.0000000000000011e-003 | AR307: 17 | AS307: 金农转债!!
A308: 300 | B308: 113508 | C308: 新凤转债! | D308: 603225 | E308: 新凤鸣 | F308: 服装纺织 | G308: 纺织行业 | H308: 132 | I308: -1.83e-002 | J308: -4.8499999999999995e-002 | K308: 19.5 | L308: -8.4499999999999992e-002 | M308: 112.3 | N308: 15.78 | O308: 6.8000000000000005e-002 | P308: 123.57 | Q308: 转股中 | R308: 3年59天 | S308: 1年59天 | U308: 20.7 | V308: 233 | W308: 8.6999999999999994e-002 | X308: 7.5999999999999998e-002 | Y308: 9.4e-002 | Z308: 272 | AA308: 2.41 | AB308: -5.0799999999999998e-002 | AC308: -5.74e-002 | AD308: -0.161 | AE308: -0.16399999999999998 | AG308: 97.13 | AH308: 98.27 | AI308: 0.79 | AJ308: AA | AK308: 4.41e-002 | AL308: =H308+100*O308 -> 138.80000000000001 | AM308: 140.4 | AN308: 274 | AO308: 42.2 | AP308: 243 | AQ308: -4.7e-002 | AR308: 25 | AS308: 新凤转债!
A309: 9 | B309: 113616 | C309: 韦尔转债 | D309: 603501 | E309: 韦尔股份 | F309: 电子 | G309: 元器件制 | H309: 155.9 | I309: -4.0999999999999995e-003 | J309: -3.0000000000000001e-003 | K309: 282.98 | L309: -8.8000000000000005e-003 | M309: 114.5 | N309: 222.83 | O309: 0.22800000000000001 | P309: 126.99 | Q309: 4月9天 | R309: 5.84年 | S309: 3.84年 | U309: 24.4 | V309: 237 | W309: 6.2e-002 | X309: 1.e-002 | Y309: 1.3000000000000001e-002 | Z309: 2455. | AA309: 24.23 | AB309: -5.21e-002 | AC309: -5.62e-002 | AD309: -9.8800000000000013e-002 | AE309: -0.10000000000000001 | AG309: 86.91 | AH309: 89.57 | AI309: 0.8 | AJ309: AA+ | AK309: 4.36e-002 | AL309: =H309+100*O309 -> 178.70000000000002 | AM309: 184.8 | AN309: 320 | AO309: 95.2 | AP309: 320 | AQ309: -5.0000000000000003e-002 | AR309: 6 | AS309: 韦尔转债
A310: 308 | B310: 110043 | C310: 无锡转债! | D310: 600908 | E310: 无锡银行 | F310: 金融 | G310: 银行行业 | H310: 126.8 | I310: -2.12e-002 | J310: -2.0999999999999999e-003 | K310: 7.01 | L310: -3.04e-002 | M310: 108.3 | N310: 5.79 | O310: 4.7e-002 | P310: 121.07 | Q310: 转股中 | R310: 2.93年 | S310: 无权 | U310: 29.2 | V310: 79 | W310: 2.1000000000000001e-002 | X310: 0.22500000000000001 | Y310: 0.27300000000000002 | Z310: 130 | AA310: 1.13 | AB310: -5.2999999999999999e-002 | AC310: -5.79e-002 | AD310: 无权 | AE310: 无权 | AG310: 无权 | AH310: 96.68 | AI310: 0.76 | AJ310: AA+ | AK310: 4.0000000000000001e-002 | AL310: =H310+100*O310 -> 131.5 | AM310: 132.5 | AN310: 238 | AO310: 35.9 | AP310: 206 | AQ310: 2.1000000000000001e-002 | AR310: 28 | AS310: 无锡转债!
A311: 244 | B311: 113025 | C311: 明泰转债!! | D311: 601677 | E311: 明泰铝业 | F311: 有色金属 | G311: 铝金属 | H311: 146.19 | I311: -2.18e-002 | J311: 9.4999999999999998e-003 | K311: 15.97 | L311: -1.4199999999999999e-002 | M311: 115.1 | N311: 11.2 | O311: 2.5000000000000001e-002 | P311: 142.59 | Q311: 转股中 | R311: 4年43天 | S311: 2年43天 | U311: 12.5 | V311: 98 | W311: 5.2999999999999999e-002 | X311: 0.11900000000000001 | Y311: 0.16899999999999998 | Z311: 106 | AA311: 1.3 | AB311: -5.7500000000000002e-002 | AC311: -6.3500000000000001e-002 | AD311: -0.10800000000000001 | AE311: -0.11 | AG311: 93.83 | AH311: 96.75 | AI311: 0.87 | AJ311: AA | AK311: 4.41e-002 | AL311: =H311+100*O311 -> 148.69 | AM311: 149.8 | AN311: 294 | AO311: 53 | AP311: 283 | AQ311: 4.0999999999999995e-002 | AR311: 28 | AS311: 明泰转债!!
A312: 129 | B312: 128111 | C312: 中矿转债! | D312: 2738 | E312: 中矿资源 | F312: 有色金属 | G312: 有色行业 | H312: 170.3 | I312: -6.1200000000000004e-002 | J312: 1.8100000000000002e-002 | K312: 25.76 | L312: -4.7699999999999992e-002 | M312: 124.7 | N312: 15.47 | O312: 2.3e-002 | P312: 166.52 | Q312: 转股中 | R312: 5.29年 | S312: 3.29年 | U312: 2.44 | V312: 250 | W312: 0.59599999999999997 | X312: 2.9999999999999999e-002 | Y312: 5.0000000000000003e-002 | Z312: 82 | AA312: 2.66 | AB312: -5.8400000000000001e-002 | AC312: -6.5500000000000003e-002 | AD312: -0.129 | AE312: -0.13100000000000001 | AG312: 83.98 | AH312: 89.42 | AI312: 0.9 | AJ312: AA- | AK312: 6.6600000000000006e-002 | AL312: =H312+100*O312 -> 172.60000000000002 | AM312: 174.1 | AN312: 316 | AO312: 84.7 | AP312: 315 | AQ312: -0.152 | AR312: 9 | AS312: 中矿转债!
A313: 160 | B313: 128103 | C313: 同德转债! | D313: 2360 | E313: 同德化工 | F313: 化工 | G313: 化工 | H313: 169.9 | I313: -2.41e-002 | J313: 1.84e-002 | K313: 8.61 | L313: -5.7999999999999996e-003 | M313: 121.8 | N313: 5.18 | O313: 2.2000000000000002e-002 | P313: 166.22 | Q313: 转股中 | R313: 5年28天 | S313: 3年28天 | U313: 1.09 | V313: 186 | W313: 1. | X313: 3.2000000000000001e-002 | Y313: 5.4000000000000006e-002 | Z313: 34 | AA313: 2.81 | AB313: -6.480000000000001e-002 | AC313: -7.1399999999999991e-002 | AD313: -0.13699999999999998 | AE313: -0.13900000000000001 | AG313: 82.45 | AH313: 84.18 | AI313: 1 | AJ313: A+ | AK313: 7.7600000000000002e-002 | AL313: =H313+100*O313 -> 172.09999999999999 | AM313: 173.6 | AN313: 314 | AO313: 89.4 | AP313: 319 | AQ313: -3.7000000000000005e-002 | AR313: 13 | AS313: 同德转债!
A314: 336 | B314: 113011 | C314: 光大转债 | D314: 601818 | E314: 光大银行 | F314: 金融 | G314: 银行行业 | H314: 124.77 | I314: -9.7999999999999997e-003 | J314: -8.8000000000000005e-003 | K314: 4.1 | L314: -2.8399999999999998e-002 | M314: 108.3 | N314: 3.76 | O314: 0.14400000000000002 | P314: 109.04 | Q314: 转股中 | R314: 2年19天 | S314: 无权 | U314: 242 | V314: 198 | W314: 6.9999999999999993e-003 | X314: 0.109 | Y314: 0.11900000000000001 | Z314: 2215. | AA314: 0.65 | AB314: -6.8000000000000005e-002 | AC314: -7.4900000000000008e-002 | AD314: 无权 | AE314: 无权 | AG314: 无权 | AH314: 100.69 | AI314: 0.65 | AJ314: AAA | AK314: 3.7000000000000005e-002 | AL314: =H314+100*O314 -> 139.16999999999999 | AM314: 140.5 | AN314: 275 | AO314: 39.8 | AP314: 231 | AQ314: -9.0000000000000011e-003 | AR314: 14 | AS314: 光大转债
A315: 280 | B315: 127008 | C315: 特发转债!* | D315: 70 | E315: 特发信息 | F315: 通信互联 | G315: 通信设备 | H315: 134.52 | I315: 6.0999999999999995e-003 | J315: -2.0999999999999999e-003 | K315: 7.49 | L315: 4.0000000000000001e-003 | M315: 110.5 | N315: 5.54 | O315: -5.0000000000000001e-003 | P315: 135.2 | Q315: 转股中 | R315: 2.72年 | S315: 0.72年 | U315: 0.53 | V315: 146 | W315: 2.0499999999999998 | X315: 9.0000000000000011e-003 | Y315: 1.2e-002 | Z315: 61 | AA315: 2.16 | AB315: -7.0499999999999993e-002 | AC315: -7.690000000000001e-002 | AD315: -0.28300000000000003 | AE315: -0.28499999999999998 | AG315: 97.63 | AH315: 98.93 | AI315: 1 | AJ315: AA | AK315: 4.2000000000000003e-002 | AL315: =H315+100*O315 -> 134.02000000000001 | AM315: 133.8 | AN315: 245 | AO315: 34.9 | AP315: 200 | AQ315: 5.0000000000000001e-003 | AR315: 16 | AS315: 特发转债!*
A316: 62 | B316: 127022 | C316: 恒逸转债 | D316: 703 | E316: 恒逸石化 | F316: 化工 | G316: 化工 | H316: 164.999 | I316: -2.8799999999999999e-002 | J316: -4.5199999999999997e-002 | K316: 17.97 | L316: -7.9899999999999999e-002 | M316: 108.9 | N316: 11.5 | O316: 5.5999999999999994e-002 | P316: 156.26 | Q316: 55天 | R316: 5.64年 | S316: 3.64年 | U316: 20 | V316: 373 | W316: 0.115 | X316: 2.9999999999999999e-002 | Y316: 4.7e-002 | Z316: 662 | AA316: 2.64 | AB316: -7.1900000000000006e-002 | AC316: -7.4499999999999997e-002 | AD316: -0.114 | AE316: -0.115 | AG316: 87.36 | AH316: 85.91 | AI316: 0.93 | AJ316: AA+ | AK316: 4.36e-002 | AL316: =H316+100*O316 -> 170.59899999999999 | AM316: 173.7 | AN316: 315 | AO316: 86.4 | AP316: 316 | AQ316: 0.13900000000000001 | AR316: 6 | AS316: 恒逸转债
A317: 199 | B317: 113029 | C317: 明阳转债!! | D317: 601615 | E317: 明阳智能 | F317: 能源电力 | G317: 风能 | H317: 161.07 | I317: -2.46e-002 | J317: 8.0000000000000004e-004 | K317: 20.51 | L317: -2.3799999999999998e-002 | M317: 112.9 | N317: 12.8 | O317: 5.0000000000000001e-003 | P317: 160.23 | Q317: 转股中 | R317: 4.80年 | S317: 2.80年 | U317: 6.74 | V317: 183 | W317: 0.16800000000000001 | X317: 1.7000000000000001e-002 | Y317: 2.7999999999999997e-002 | Z317: 389 | AA317: 3.8 | AB317: -7.2499999999999995e-002 | AC317: -7.6799999999999993e-002 | AD317: -0.13699999999999998 | AE317: -0.13900000000000001 | AG317: 91.07 | AH317: 92.13 | AI317: 1 | AJ317: AA | AK317: 4.41e-002 | AL317: =H317+100*O317 -> 161.56999999999999 | AM317: 161.9 | AN317: 311 | AO317: 69.8 | AP317: 308 | AQ317: -5.4000000000000006e-002 | AR317: 22 | AS317: 明阳转债!!
A318: 175 | B318: 110066 | C318: 盛屯转债!! | D318: 600711 | E318: 盛屯矿业 | F318: 有色金属 | G318: 有色行业 | H318: 167.74 | I318: -5.4800000000000001e-002 | J318: 2.5999999999999999e-003 | K318: 8.13 | L318: -5.6799999999999996e-002 | M318: 115.3 | N318: 4.88 | O318: 6.9999999999999993e-003 | P318: 166.6 | Q318: 转股中 | R318: 5年4.6天 | S318: 3年4.6天 | U318: 6.08 | V318: 615 | W318: 0.59699999999999998 | X318: 2.7999999999999997e-002 | Y318: 4.7e-002 | Z318: 215 | AA318: 2.05 | AB318: -7.3399999999999993e-002 | AC318: -7.8200000000000006e-002 | AD318: -0.13800000000000001 | AE318: -0.14000000000000001 | AG318: 90.24 | AH318: 92.67 | AI318: 0.92 | AJ318: AA | AK318: 4.5599999999999995e-002 | AL318: =H318+100*O318 -> 168.44 | AM318: 168.9 | AN318: 312 | AO318: 76.2 | AP318: 311 | AQ318: -3.0000000000000001e-003 | AR318: 39 | AS318: 盛屯转债!!
A319: 283 | B319: 128046 | C319: 利尔转债! | D319: 2258 | E319: 利尔化学 | F319: 化工 | G319: 农化 | H319: 148.1 | I319: -3.8199999999999998e-002 | J319: 1.1599999999999999e-002 | K319: 25.56 | L319: -3.0699999999999998e-002 | M319: 112.3 | N319: 18.62 | O319: 7.9000000000000001e-002 | P319: 137.27 | Q319: 转股中 | R319: 3.64年 | S319: 1.64年 | U319: 8.47 | V319: 167 | W319: 0.13300000000000001 | X319: 6.3e-002 | Y319: 8.6999999999999994e-002 | Z319: 134 | AA319: 3.75 | AB319: -7.4400000000000008e-002 | AC319: -7.9899999999999999e-002 | AD319: -0.154 | AE319: -0.156 | AG319: 95.15 | AH319: 96.27 | AI319: 0.87 | AJ319: AA | AK319: 4.41e-002 | AL319: =H319+100*O319 -> 156. | AM319: 158.9 | AN319: 307 | AO319: 62.7 | AP319: 303 | AQ319: -5.4000000000000006e-002 | AR319: 10 | AS319: 利尔转债!
A320: 180 | B320: 128095 | C320: 恩捷转债!! | D320: 2812 | E320: 恩捷股份 | F320: 电子 | G320: 元器件制 | H320: 168.5 | I320: 9.7000000000000003e-003 | J320: 7.3000000000000001e-003 | K320: 106.01 | L320: 1.8600000000000002e-002 | M320: 114.9 | N320: 65.09 | O320: 3.5000000000000003e-002 | P320: 162.87 | Q320: 转股中 | R320: 4.96年 | S320: 2.96年 | U320: 8 | V320: 232 | W320: 0.17300000000000001 | X320: 9.0000000000000011e-003 | Y320: 1.3999999999999999e-002 | Z320: 940 | AA320: 9.44 | AB320: -7.5399999999999995e-002 | AC320: -8.0199999999999994e-002 | AD320: -0.14199999999999999 | AE320: -0.14400000000000002 | AG320: 90.46 | AH320: 93.13 | AI320: 0.91 | AJ320: AA | AK320: 4.41e-002 | AL320: =H320+100*O320 -> 172. | AM320: 174.1 | AN320: 317 | AO320: 81 | AP320: 313 | AQ320: -0.19 | AR320: 16 | AS320: 恩捷转债!!
A321: 87 | B321: 128126 | C321: 赣锋转2 | D321: 2460 | E321: 赣锋锂业 | F321: 有色金属 | G321: 小金属 | H321: 170 | I321: -7.0999999999999994e-002 | J321: -3.5999999999999999e-003 | K321: 99.02 | L321: -8.14e-002 | M321: 111.1 | N321: 60.27 | O321: 3.5000000000000003e-002 | P321: 164.29 | Q321: 转股中 | R321: 5.44年 | S321: 3.44年 | U321: 20.4 | V321: 606 | W321: 0.17199999999999999 | X321: 1.4999999999999999e-002 | Y321: 2.5000000000000001e-002 | Z321: 1331. | AA321: 14.22 | AB321: -7.6200000000000004e-002 | AC321: -7.9399999999999998e-002 | AD321: -0.126 | AE321: -0.128 | AG321: 87.68 | AH321: 87.51 | AI321: 0.92 | AJ321: AA | AK321: 4.5599999999999995e-002 | AL321: =H321+100*O321 -> 173.5 | AM321: 175.7 | AN321: 319 | AO321: 88 | AP321: 317 | AQ321: -0.221 | AR321: 9 | AS321: 赣锋转2
A322: 209 | B322: 123034 | C322: 通光转债! | D322: 300265 | E322: 通光线缆 | F322: 通信互联 | G322: 通信设备 | H322: 173.4 | I322: 3.0099999999999998e-002 | J322: -6.4000000000000003e-003 | K322: 9.16 | L322: 3.15e-002 | M322: 118 | N322: 7.97 | O322: 0.50900000000000001 | P322: 114.93 | Q322: 转股中 | R322: 4.69年 | S322: 2.69年 | U322: 0.78 | V322: 876 | W322: 6.4100000000000001 | X322: 2.3e-002 | Y322: 2.7000000000000003e-002 | Z322: 33 | AA322: 2.66 | AB322: -8.0100000000000005e-002 | AC322: -8.5999999999999993e-002 | AD322: -0.111 | AE322: -0.11199999999999999 | AG322: 84.14 | AH322: 84.26 | AI322: 0.75 | AJ322: A+ | AK322: 7.6100000000000001e-002 | AL322: =H322+100*O322 -> 224.30000000000001 | AM322: 231.9 | AN322: 330 | AO322: 147.6 | AP322: 332 | AQ322: 4.4999999999999998e-002 | AR322: 24 | AS322: 通光转债!
A323: 114 | B323: 113592 | C323: 安20转债!* | D323: 603345 | E323: 安井食品 | F323: 食品饮料 | G323: 食品饮料 | H323: 191.17 | I323: -4.8099999999999997e-002 | J323: -3.5999999999999999e-003 | K323: 222.07 | L323: -5.1699999999999996e-002 | M323: 113.1 | N323: 115.9 | O323: -2.e-003 | P323: 191.6 | Q323: 转股中 | R323: 5.36年 | S323: 3.36年 | U323: 2.15 | V323: 148 | W323: 0.36200000000000004 | X323: 4.0000000000000001e-003 | Y323: 8.0000000000000002e-003 | Z323: 532 | AA323: 16.37 | AB323: -9.4700000000000006e-002 | AC323: -9.8400000000000001e-002 | AD323: -0.154 | AE323: -0.155 | AG323: 88.64 | AH323: 89.46 | AI323: 1 | AJ323: AA | AK323: 4.5599999999999995e-002 | AL323: =H323+100*O323 -> 190.97 | AM323: 190.7 | AN323: 321 | AO323: 101.3 | AP323: 321 | AQ323: -0.129 | AR323: 9 | AS323: 安20转债!*
A324: 89 | B324: 113038 | C324: 隆20转债 | D324: 601012 | E324: 隆基股份 | F324: 能源电力 | G324: 太阳能 | H324: 198.09 | I324: 5.1999999999999998e-003 | J324: -1.e-003 | K324: 104.46 | L324: 4.4000000000000003e-003 | M324: 111.8 | N324: 52.59 | O324: -3.0000000000000001e-003 | P324: 198.63 | Q324: 转股中 | R324: 5.43年 | S324: 3.43年 | U324: 33.8 | V324: 2669. | W324: 0.40200000000000002 | X324: 9.0000000000000011e-003 | Y324: 1.7000000000000001e-002 | Z324: 3940. | AA324: 12.14 | AB324: -0.10099999999999999 | AC324: -0.105 | AD324: -0.159 | AE324: -0.16 | AG324: 89.64 | AH324: 90.43 | AI324: 0.96 | AJ324: AAA | AK324: 4.0599999999999997e-002 | AL324: =H324+100*O324 -> 197.78999999999999 | AM324: 197.5 | AN324: 324 | AO324: 107.1 | AP324: 325 | AQ324: -7.6999999999999999e-002 | AR324: 14 | AS324: 隆20转债
A325: 48 | B325: 113041 | C325: 紫金转债 | D325: 601899 | E325: 紫金矿业 | F325: 有色金属 | G325: 贵金属 | H325: 183.95 | I325: -3.9100000000000003e-002 | J325: -1.8700000000000001e-002 | K325: 12.19 | L325: -6.0899999999999996e-002 | M325: 108 | N325: 7 | O325: 5.5999999999999994e-002 | P325: 174.14 | Q325: 2月13天 | R325: 4.69年 | S325: 2.69年 | U325: 60 | V325: 1164. | W325: 0.106 | X325: 1.9e-002 | Y325: 3.4000000000000002e-002 | Z325: 3105. | AA325: 6.45 | AB325: -0.10800000000000001 | AC325: -0.111 | AD325: -0.124 | AE325: -0.124 | AG325: 90.87 | AH325: 90.36 | AI325: 0.95 | AJ325: AAA | AK325: 3.9100000000000003e-002 | AL325: =H325+100*O325 -> 189.54999999999998 | AM325: 193.8 | AN325: 322 | AO325: 102.9 | AP325: 323 | AQ325: 6.2e-002 | AR325: 8 | AS325: 紫金转债
A326: 142 | B326: 113580 | C326: 康隆转债! | D326: 603665 | E326: 康隆达 | F326: 服装纺织 | G326: 服装行业 | H326: 222.05 | I326: -6.7000000000000002e-003 | J326: 4.2199999999999994e-002 | K326: 16.29 | L326: 5.2999999999999999e-002 | M326: 121.2 | N326: 15.51 | O326: 1.1100000000000001 | P326: 105.03 | Q326: 转股中 | R326: 5年56天 | S326: 3年56天 | U326: 0.41 | V326: 183 | W326: 2.0099999999999998 | X326: 1.6e-002 | Y326: 1.7000000000000001e-002 | Z326: 26 | AA326: 2.53 | AB326: -0.113 | AC326: -0.11900000000000001 | AD326: -0.11900000000000001 | AE326: -0.11900000000000001 | AG326: 84.28 | AH326: 87.62 | AI326: 0.67 | AJ326: AA- | AK326: 6.6600000000000006e-002 | AL326: =H326+100*O326 -> 333.05000000000001 | AM326: 339.1 | AN326: 338 | AO326: 251.5 | AP326: 338 | AQ326: 0.111 | AR326: 9 | AS326: 康隆转债!
A327: 222 | B327: 123031 | C327: 晶瑞转债! | D327: 300655 | E327: 晶瑞股份 | F327: 化工 | G327: 化工 | H327: 198.85 | I327: 1.21e-002 | J327: -1.1200000000000002e-002 | K327: 29.66 | L327: 1.e-003 | M327: 115.8 | N327: 18.43 | O327: 0.23600000000000002 | P327: 160.93 | Q327: 转股中 | R327: 4.51年 | S327: 2.51年 | U327: 0.63 | V327: 79 | W327: 0.63300000000000001 | X327: 1.1000000000000001e-002 | Y327: 1.8000000000000002e-002 | Z327: 56 | AA327: 4.36 | AB327: -0.115 | AC327: -0.12 | AD327: -0.14699999999999999 | AE327: -0.14800000000000002 | AG327: 85.08 | AH327: 83.77 | AI327: 0.91 | AJ327: A+ | AK327: 7.6100000000000001e-002 | AL327: =H327+100*O327 -> 222.44999999999999 | AM327: 236.8 | AN327: 332 | AO327: 151.7 | AP327: 333 | AQ327: 8.0000000000000002e-003 | AR327: 17 | AS327: 晶瑞转债!
A328: 219 | B328: 113545 | C328: 金能转债! | D328: 603113 | E328: 金能科技 | F328: 煤炭 | G328: 炼焦 | H328: 202.49 | I328: -9.7799999999999998e-002 | J328: 2.86e-002 | K328: 20.1 | L328: -7.2900000000000006e-002 | M328: 114.9 | N328: 10.78 | O328: 8.5999999999999993e-002 | P328: 186.46 | Q328: 转股中 | R328: 4.63年 | S328: 2.63年 | U328: 10.2 | V328: 214 | W328: 0.10199999999999999 | X328: 5.9999999999999998e-002 | Y328: 0.11199999999999999 | Z328: 171 | AA328: 2.23 | AB328: -0.11699999999999999 | AC328: -0.122 | AD328: -0.14000000000000001 | AE328: -0.14099999999999999 | AG328: 91.75 | AH328: 94.46 | AI328: 0.95 | AJ328: AA | AK328: 4.41e-002 | AL328: =H328+100*O328 -> 211.09 | AM328: 218.5 | AN328: 328 | AO328: 124.1 | AP328: 328 | AQ328: -6.0999999999999999e-002 | AR328: 19 | AS328: 金能转债!
A329: 272 | B329: 123018 | C329: 溢利转债! | D329: 300381 | E329: 溢多利 | F329: 医药 | G329: 原料药 | H329: 186.6 | I329: -4.7999999999999996e-003 | J329: 8.6999999999999994e-003 | K329: 9.75 | L329: 5.1999999999999998e-003 | M329: 114.3 | N329: 8.32 | O329: 0.59200000000000008 | P329: 117.19 | Q329: 转股中 | R329: 3.82年 | S329: 1.82年 | U329: 0.54 | V329: 39 | W329: 0.39100000000000001 | X329: 1.1000000000000001e-002 | Y329: 1.3000000000000001e-002 | Z329: 48 | AA329: 1.65 | AB329: -0.122 | AC329: -0.128 | AD329: -0.20300000000000001 | AE329: -0.20399999999999999 | AG329: 90.81 | AH329: 90.26 | AI329: 0.75 | AJ329: AA- | AK329: 6.5099999999999991e-002 | AL329: =H329+100*O329 -> 245.80000000000001 | AM329: 256 | AN329: 334 | AO329: 165.2 | AP329: 334 | AQ329: -1.4999999999999999e-002 | AR329: 13 | AS329: 溢利转债!
A330: 271 | B330: 128052 | C330: 凯龙转债!* | D330: 2783 | E330: 凯龙股份 | F330: 化工 | G330: 化工 | H330: 190.236 | I330: -1.43e-002 | J330: 2.7400000000000001e-002 | K330: 10.09 | L330: 1.3100000000000001e-002 | M330: 114.3 | N330: 6.67 | O330: 0.25800000000000001 | P330: 151.27 | Q330: 转股中 | R330: 3.82年 | S330: 1.82年 | U330: 0.32 | V330: 189 | W330: 3.0899999999999999 | X330: 8.0000000000000002e-003 | Y330: 1.3000000000000001e-002 | Z330: 38 | AA330: 2.21 | AB330: -0.127 | AC330: -0.13200000000000001 | AD330: -0.20699999999999999 | AE330: -0.20800000000000002 | AG330: 94.43 | AH330: 97.23 | AI330: 1 | AJ330: AA | AK330: 4.41e-002 | AL330: =H330+100*O330 -> 216.036 | AM330: 229.2 | AN330: 329 | AO330: 132 | AP330: 329 | AQ330: -5.0000000000000001e-003 | AR330: 13 | AS330: 凯龙转债!*
A331: 228 | B331: 113543 | C331: 欧派转债! | D331: 603833 | E331: 欧派家居 | F331: 其他 | G331: 家居用品 | H331: 210.11 | I331: -6.4399999999999999e-002 | J331: 6.1600000000000002e-002 | K331: 151.53 | L331: -2.8000000000000004e-003 | M331: 114.9 | N331: 71.69 | O331: -6.0000000000000001e-003 | P331: 211.37 | Q331: 转股中 | R331: 4.47年 | S331: 3.47年 | U331: 5.42 | V331: 134 | W331: 0.115 | X331: 6.0000000000000001e-003 | Y331: 1.3000000000000001e-002 | Z331: 912 | AA331: 8.35 | AB331: -0.128 | AC331: -0.13300000000000001 | AD331: -0.16600000000000001 | AE331: -0.16800000000000001 | AG331: 90.18 | AH331: 95.12 | AI331: 0.97 | AJ331: AA | AK331: 4.41e-002 | AL331: =H331+100*O331 -> 209.51000000000002 | AM331: 208.9 | AN331: 326 | AO331: 113.7 | AP331: 326 | AQ331: -2.9999999999999999e-002 | AR331: 14 | AS331: 欧派转债!
A332: 241 | B332: 128065 | C332: 雅化转债!!* | D332: 2497 | E332: 雅化集团 | F332: 化工 | G332: 化工 | H332: 196.88 | I332: 4.5000000000000005e-003 | J332: 2.5000000000000001e-003 | K332: 18.72 | L332: 6.9999999999999993e-003 | M332: 110.9 | N332: 9.43 | O332: -8.0000000000000002e-003 | P332: 198.52 | Q332: 转股中 | R332: 4年49天 | S332: 2年49天 | U332: 0.65 | V332: 369 | W332: 2.8500000000000001 | X332: 3.0000000000000001e-003 | Y332: 6.0000000000000001e-003 | Z332: 213 | AA332: 6.18 | AB332: -0.13200000000000001 | AC332: -0.13600000000000001 | AD332: -0.17699999999999999 | AE332: -0.17899999999999999 | AG332: 93.74 | AH332: 93.16 | AI332: 1 | AJ332: AA | AK332: 4.41e-002 | AL332: =H332+100*O332 -> 196.07999999999998 | AM332: 195.2 | AN332: 323 | AO332: 101.5 | AP332: 322 | AQ332: -0.16 | AR332: 20 | AS332: 雅化转债!!*
A333: 140 | B333: 113582 | C333: 火炬转债! | D333: 603678 | E333: 火炬电子 | F333: 电子 | G333: 元器件制 | H333: 269.81 | I333: -1.06e-002 | J333: -4.7100000000000003e-002 | K333: 62.83 | L333: -5.9000000000000004e-002 | M333: 115.3 | N333: 25.33 | O333: 8.8000000000000009e-002 | P333: 248.05 | Q333: 转股中 | R333: 5.25年 | S333: 3.25年 | U333: 4.18 | V333: 269 | W333: 0.24100000000000002 | X333: 1.3999999999999999e-002 | Y333: 3.6000000000000004e-002 | Z333: 289 | AA333: 8.19 | AB333: -0.152 | AC333: -0.156 | AD333: -0.13300000000000001 | AE333: -0.13400000000000001 | AG333: 89.29 | AH333: 91.7 | AI333: 0.98 | AJ333: AA | AK333: 4.5599999999999995e-002 | AL333: =H333+100*O333 -> 278.61000000000001 | AM333: 291.6 | AN333: 336 | AO333: 199.9 | AP333: 336 | AQ333: -5.4000000000000006e-002 | AR333: 5 | AS333: 火炬转债!
A334: 299 | B334: 113509 | C334: 新泉转债!! | D334: 603179 | E334: 新泉股份 | F334: 汽车 | G334: 零部件制 | H334: 190.41 | I334: -2.3399999999999997e-002 | J334: 1.9299999999999998e-002 | K334: 28.05 | L334: -4.3e-003 | M334: 110.3 | N334: 15.55 | O334: 5.5999999999999994e-002 | P334: 180.39 | Q334: 转股中 | R334: 3.27年 | S334: 1.27年 | U334: 1.04 | V334: 12 | W334: 6.3e-002 | X334: 1.e-002 | Y334: 1.8000000000000002e-002 | Z334: 103 | AA334: 4.21 | AB334: -0.156 | AC334: -0.161 | AD334: -0.307 | AE334: -0.309 | AG334: 96.68 | AH334: 96.08 | AI334: 0.96 | AJ334: AA | AK334: 4.41e-002 | AL334: =H334+100*O334 -> 196.00999999999999 | AM334: 200.4 | AN334: 325 | AO334: 103.7 | AP334: 324 | AQ334: -0.16699999999999998 | AR334: 10 | AS334: 新泉转债!!
A335: 333 | B335: 127004 | C335: 模塑转债!! | D335: 700 | E335: 模塑科技 | F335: 汽车 | G335: 零部件制 | H335: 168.7 | I335: 1.5800000000000002e-002 | J335: -1.5800000000000002e-002 | K335: 5.07 | L335: -2.e-003 | M335: 113.3 | N335: 7.46 | O335: 1.48 | P335: 67.96 | Q335: 转股中 | R335: 2.26年 | S335: 0.26年 | U335: 1.32 | V335: 251 | W335: 1.1299999999999999 | X335: 2.7999999999999997e-002 | Y335: 1.9e-002 | Z335: 46 | AA335: 1.79 | AB335: -0.16399999999999998 | AC335: -0.17199999999999999 | AD335: -0.97999999999999998 | AE335: -0.98499999999999999 | AG335: 100.03 | AH335: 100.25 | AI335: 0 | AJ335: AA | AK335: 4.2000000000000003e-002 | AL335: =H335+100*O335 -> 316.69999999999999 | AM335: 269.4 | AN335: 335 | AO335: 169.2 | AP335: 335 | AQ335: -2.5000000000000001e-002 | AR335: 36 | AS335: 模塑转债!!
A336: 296 | B336: 110044 | C336: 广电转债!! | D336: 600831 | E336: 广电网络 | F336: 传媒娱乐 | G336: 影视娱乐 | H336: 220.5 | I336: 0.218 | J336: -0.21600000000000003 | K336: 5.74 | L336: 6.9999999999999993e-003 | M336: 112.3 | N336: 6.9 | O336: 1.6499999999999999 | P336: 83.19 | Q336: 转股中 | R336: 3.33年 | S336: 1.33年 | U336: 0.71 | V336: 1368. | W336: 9.5500000000000007 | X336: 1.7000000000000001e-002 | Y336: 1.3999999999999999e-002 | Z336: 41 | AA336: 1.1 | AB336: -0.18600000000000003 | AC336: -0.191 | AD336: -0.33899999999999997 | AE336: -0.34000000000000002 | AG336: 96.42 | AH336: 97.56 | AI336: 0.33 | AJ336: AA | AK336: 4.41e-002 | AL336: =H336+100*O336 -> 385.5 | AM336: 357.8 | AN336: 339 | AO336: 260.3 | AP336: 339 | AQ336: 2.e-003 | AR336: 12 | AS336: 广电转债!!
A337: 329 | B337: 128017 | C337: 金禾转债!! | D337: 2597 | E337: 金禾实业 | F337: 化工 | G337: 化工 | H337: 198.523 | I337: -4.3700000000000003e-002 | J337: -4.4000000000000004e-002 | K337: 40.95 | L337: -8.9999999999999997e-002 | M337: 108.8 | N337: 22.42 | O337: 8.6999999999999994e-002 | P337: 182.65 | Q337: 转股中 | R337: 2.68年 | S337: 0.68年 | U337: 5.52 | V337: 151 | W337: 0.13900000000000001 | X337: 2.4e-002 | Y337: 4.4000000000000004e-002 | Z337: 230 | AA337: 4.98 | AB337: -0.20300000000000001 | AC337: -0.20800000000000002 | AD337: -0.58700000000000008 | AE337: -0.58899999999999997 | AG337: 98.08 | AH337: 97.6 | AI337: 0.97 | AJ337: AA | AK337: 4.2000000000000003e-002 | AL337: =H337+100*O337 -> 207.22299999999998 | AM337: 214.4 | AN337: 327 | AO337: 116.3 | AP337: 327 | AQ337: -0.13699999999999998 | AR337: 10 | AS337: 金禾转债!!
A338: 285 | B338: 123015 | C338: 蓝盾转债!! | D338: 300297 | E338: 蓝盾股份 | F338: 计算机及 | G338: 软件开发 | H338: 244.991 | I338: 4.0999999999999995e-003 | J338: 5.0000000000000001e-003 | K338: 4.83 | L338: 2.3300000000000001e-002 | M338: 112.3 | N338: 5.79 | O338: 1.9399999999999999 | P338: 83.42 | Q338: 转股中 | R338: 3.46年 | S338: 1.46年 | U338: 1 | V338: 418 | W338: 1.71 | X338: 1.7000000000000001e-002 | Y338: 1.3999999999999999e-002 | Z338: 60 | AA338: 1.57 | AB338: -0.20499999999999999 | AC338: -0.20899999999999999 | AD338: -0.33399999999999996 | AE338: -0.33500000000000002 | AG338: 92.86 | AH338: 90.69 | AI338: 0.39 | AJ338: AA- | AK338: 6.5099999999999991e-002 | AL338: =H338+100*O338 -> 438.99099999999999 | AM338: 406.6 | AN338: 340 | AO338: 313.7 | AP338: 340 | AQ338: 5.7999999999999996e-002 | AR338: 19 | AS338: 蓝盾转债!!
A339: 317 | B339: 128028 | C339: 赣锋转债!!* | D339: 2460 | E339: 赣锋锂业 | F339: 有色金属 | G339: 小金属 | H339: 235.5 | I339: -8.7599999999999997e-002 | J339: 6.0999999999999995e-003 | K339: 99.02 | L339: -8.14e-002 | M339: 108.5 | N339: 41.68 | O339: -9.0000000000000011e-003 | P339: 237.57 | Q339: 转股中 | R339: 2.82年 | S339: 0.82年 | U339: 2.34 | V339: 1125. | W339: 2.0099999999999998 | X339: 2.e-003 | Y339: 4.0000000000000001e-003 | Z339: 1331. | AA339: 14.22 | AB339: -0.24299999999999999 | AC339: -0.24600000000000002 | AD339: -0.58099999999999996 | AE339: -0.58200000000000007 | AG339: 97.24 | AH339: 96.76 | AI339: 1 | AJ339: AA | AK339: 4.2000000000000003e-002 | AL339: =H339+100*O339 -> 234.59999999999999 | AM339: 233.4 | AN339: 331 | AO339: 136.2 | AP339: 330 | AQ339: -0.221 | AR339: 13 | AS339: 赣锋转债!!*
A340: 315 | B340: 128030 | C340: 天康转债!! | D340: 2100 | E340: 天康生物 | F340: 农业 | G340: 畜牧业 | H340: 248.163 | I340: -1.4000000000000002e-003 | J340: 3.0000000000000001e-003 | K340: 12.41 | L340: 1.6000000000000001e-003 | M340: 111.3 | N340: 7.85 | O340: 0.56999999999999995 | P340: 158.09 | Q340: 转股中 | R340: 2.82年 | S340: 0.82年 | U340: 0.96 | V340: 82 | W340: 0.34000000000000002 | X340: 6.9999999999999993e-003 | Y340: 1.1000000000000001e-002 | Z340: 133 | AA340: 2.23 | AB340: -0.25 | AC340: -0.255 | AD340: -0.59999999999999998 | AE340: -0.60099999999999998 | AG340: 97.76 | AH340: 99.29 | AI340: 1 | AJ340: AA | AK340: 4.2000000000000003e-002 | AL340: =H340+100*O340 -> 305.16300000000001 | AM340: 338.2 | AN340: 337 | AO340: 238.9 | AP340: 337 | AQ340: 6.5000000000000002e-002 | AR340: 12 | AS340: 天康转债!!
A341: 292 | B341: 128041 | C341: 盛路转债!! | D341: 2446 | E341: 盛路通信 | F341: 通信互联 | G341: 通信设备 | H341: 323.49 | I341: -3.2899999999999999e-002 | J341: 3.7400000000000003e-002 | K341: 5.75 | L341: 1.23e-002 | M341: 114.3 | N341: 6.82 | O341: 2.8399999999999999 | P341: 84.31 | Q341: 转股中 | R341: 3.39年 | S341: 1.39年 | U341: 0.53 | V341: 1377. | W341: 7.8700000000000001 | X341: 1.e-002 | Y341: 9.0000000000000011e-003 | Z341: 52 | AA341: 1.73 | AB341: -0.26800000000000002 | AC341: -0.27300000000000002 | AD341: -0.41499999999999998 | AE341: -0.41600000000000004 | AG341: 96.19 | AH341: 99.05 | AI341: 0.37 | AJ341: AA | AK341: 4.41e-002 | AL341: =H341+100*O341 -> 607.49000000000001 | AM341: 562.7 | AN341: 341 | AO341: 463.6 | AP341: 341 | AQ341: 1.2e-002 | AR341: 14 | AS341: 盛路转债!!
A342: 289 | B342: 123013 | C342: 横河转债! | D342: 300539 | E342: 横河模具 | F342: 机械装备 | G342: 专用设备 | H342: 413.862 | I342: -2.7000000000000001e-003 | J342: 5.7999999999999996e-003 | K342: 7.06 | L342: 8.6e-003 | M342: 115.2 | N342: 9.13 | O342: 4.3499999999999996 | P342: 77.33 | Q342: 转股中 | R342: 3.41年 | S342: 1.41年 | U342: 0.38 | V342: 454 | W342: 2.8999999999999999 | X342: 2.4e-002 | Y342: 1.9e-002 | Z342: 16 | AA342: 3.24 | AB342: -0.317 | AC342: -0.32100000000000001 | AD342: -0.44900000000000001 | AE342: -0.44900000000000001 | AG342: 92.19 | AH342: 90.27 | AI342: 0.36 | AJ342: A+ | AK342: 7.6100000000000001e-002 | AL342: =H342+100*O342 -> 848.86199999999997 | AM342: 750.4 | AN342: 342 | AO342: 658.2 | AP342: 342 | AQ342: 7.2999999999999995e-002 | AR342: 16 | AS342: 横河转债!
A343: 316 | B343: 128029 | C343: 太阳转债!! | D343: 2078 | E343: 太阳纸业 | F343: 造纸包装 | G343: 造纸行业 | H343: 224.2 | I343: -5.96e-002 | J343: -3.5999999999999999e-003 | K343: 17.65 | L343: -6.3200000000000006e-002 | M343: 107 | N343: 8.55 | O343: 8.5999999999999993e-002 | P343: 206.43 | Q343: 转股中 | R343: 1.82年 | S343: 回售内 | U343: 9.09 | V343: 285 | W343: 0.14099999999999999 | X343: 2.e-002 | Y343: 4.0999999999999995e-002 | Z343: 463 | AA343: 2.98 | AB343: -0.33500000000000002 | AC343: -0.34000000000000002 | AD343: 回售内 | AE343: 回售内 | AG343: 100.17 | AH343: 99.67 | AI343: 1 | AJ343: AA+ | AK343: 4.0000000000000001e-002 | AL343: =H343+100*O343 -> 232.79999999999998 | AM343: 242 | AN343: 333 | AO343: 141.8 | AP343: 331 | AQ343: -3.3000000000000002e-002 | AR343: 7 | AS343: 太阳转债!!
A344: 226 | B344: 123029 | C344: 英科转债! | D344: 300677 | E344: 英科医疗 | F344: 医药 | G344: 医疗器械 | H344: 2541.6 | I344: 3.3300000000000003e-002 | J344: 8.3999999999999995e-003 | K344: 212.91 | L344: 4.1900000000000007e-002 | M344: 138.2 | N344: 11.32 | O344: 0.35100000000000003 | P344: 1880.83 | Q344: 转股中 | R344: 4.47年 | S344: 2.47年 | U344: 1.23 | V344: 1460. | W344: 0.46299999999999997 | X344: 2.e-003 | Y344: 3.1e-002 | Z344: 750 | AA344: 7.84 | AB344: -0.42299999999999999 | AC344: -0.42599999999999999 | AD344: -0.30399999999999999 | AE344: -0.30399999999999999 | AG344: 91.15 | AH344: 105.33 | AI344: 0.99 | AJ344: AA- | AK344: 6.5099999999999991e-002 | AL344: =H344+100*O344 -> 2576.6999999999998 | AM344: 3202.4000000000001 | AN344: 343 | AO344: 3097. | AP344: 343 | AQ344: -8.4000000000000005e-002 | AR344: 17 | AS344: 英科转债!