A1: 序号 | B1: 转债代码 | C1: 转债名称 | D1: 股票代码 | E1: 股票名称 | F1: 行业 | G1: 子行业 | H1: 转债价格 | I1: 涨跌 | J1: 日内套利 | K1: 股价 | L1: 涨跌 | M1: 剩余本息 | N1: 转股价格 | O1: 转股溢价率 | P1: 转股价值 | Q1: 距离转股日 | R1: 剩余年限 | S1: 回售年限 | T1: 转债余额 | U1: 转债成交额 | V1: 转债换手率 | W1: 余额/市值 | X1: 余额/股本 | Y1: 股票市值 | Z1: P/B | AA1: 税前收益率 | AB1: 税后收益率 | AC1: 税前回售收益 | AD1: 税后回售收益 | AE1: 回售价值 | AF1: 纯债价值 | AG1: 弹性 | AH1: 信用 | AI1: 折现率 | AJ1: 双低 | AK1: 老式双低 | AL1: 老式排名 | AM1: 新式双低 | AN1: 新式排名 | AO1: MA20乖离 | AP1: 热门度 | AQ1: 转债名称
A2: 273 | B2: 128062 | C2: 亚药转债! | D2: 2370 | E2: 亚太药业 | F2: 医药 | G2: 化学制药 | H2: 79.83 | I2: 3.4999999999999996e-003 | J2: -3.4999999999999996e-003 | K2: 4.04 | L2: -1.46e-002 | M2: 119.3 | N2: 16.25 | O2: 2.21 | P2: 24.86 | Q2: 转股中 | R2: 3.88年 | S2: 1.89年 | T2: 9.63 | U2: 24 | V2: 3.1e-002 | W2: 0.44400000000000001 | X2: 0.11 | Y2: 22 | Z2: 5.01 | AA2: 0.111 | AB2: 0.10099999999999999 | AC2: 0.13200000000000001 | AD2: 0.129 | AE2: 83.97 | AF2: 81.7 | AG2: 0 | AH2: BBB | AI2: 0.10439999999999999 | AJ2: =H2+100*O2 -> 300.82999999999998 | AK2: 134.8 | AL2: 220 | AM2: 50.8 | AN2: 262 | AO2: -1.1000000000000001e-002 | AP2: 86 | AQ2: 亚药转债!
A3: 134 | B3: 113595 | C3: 花王转债! | D3: 603007 | E3: ST花王 | F3: 城市公用 | G3: 生态环境 | H3: 86.95 | I3: -2.0999999999999999e-003 | J3: 1.6000000000000001e-003 | K3: 3.34 | L3: -6.0000000000000001e-003 | M3: 125.3 | N3: 6.93 | O3: 0.80400000000000005 | P3: 48.2 | Q3: 转股中 | R3: 5.18年 | S3: 3.19年 | T3: 3.3 | U3: 16 | V3: 5.5999999999999994e-002 | W3: 0.29399999999999998 | X3: 0.14199999999999999 | Y3: 11 | Z3: 0.98 | AA3: 7.4900000000000008e-002 | AB3: 6.59e-002 | AC3: 5.6299999999999996e-002 | AD3: 5.3600000000000002e-002 | AE3: 84.66 | AF3: 91.14 | AG3: 0.08 | AH3: AA- | AI3: 6.4899999999999999e-002 | AJ3: =H3+100*O3 -> 167.35000000000002 | AK3: 125.7 | AL3: 122 | AM3: 34.6 | AN3: 141 | AO3: -0.23999999999999999 | AP3: 42 | AQ3: 花王转债!
A4: 179 | B4: 113576 | C4: 起步转债!! | D4: 603557 | E4: ST起步 | F4: 服装纺织 | G4: 鞋服行业 | H4: 91.39 | I4: -8.0000000000000002e-003 | J4: -3.0000000000000001e-003 | K4: 5.81 | L4: -5.0700000000000002e-002 | M4: 121.3 | N4: 10.55 | O4: 0.65900000000000003 | P4: 55.07 | Q4: 转股中 | R4: 4.90年 | S4: 2.91年 | T4: 2.66 | U4: 29 | V4: 0.11699999999999999 | W4: 9.1999999999999998e-002 | X4: 5.0999999999999997e-002 | Y4: 29 | Z4: 1.84 | AA4: 6.0899999999999996e-002 | AB4: 5.2699999999999997e-002 | AC4: 4.41e-002 | AD4: 4.1299999999999996e-002 | AE4: 81.46 | AF4: 82.29 | AG4: 0.22 | AH4: A | AI4: 8.4399999999999989e-002 | AJ4: =H4+100*O4 -> 157.29000000000002 | AK4: 127.7 | AL4: 147 | AM4: 45.4 | AN4: 234 | AO4: -0.30299999999999999 | AP4: 30 | AQ4: 起步转债!!
A5: 192 | B5: 128100 | C5: 搜特转债! | D5: 2503 | E5: 搜于特 | F5: 服装纺织 | G5: 服装行业 | H5: 89.92 | I5: 2.0999999999999999e-003 | J5: -2.8000000000000004e-003 | K5: 1.73 | L5: -5.6999999999999993e-003 | M5: 116.9 | N5: 2.9 | O5: 0.50700000000000001 | P5: 59.66 | Q5: 转股中 | R5: 4.82年 | S5: 2.83年 | T5: 7.99 | U5: 13 | V5: 1.8000000000000002e-002 | W5: 0.14899999999999999 | X5: 8.900000000000001e-002 | Y5: 54 | Z5: 1.6 | AA5: 5.7000000000000002e-002 | AB5: 5.0300000000000004e-002 | AC5: 4.82e-002 | AD5: 4.58e-002 | AE5: 91.41 | AF5: 96.03 | AG5: 0.12 | AH5: AA | AI5: 4.24e-002 | AJ5: =H5+100*O5 -> 140.62 | AK5: 120.2 | AL5: 59 | AM5: 24.2 | AN5: 44 | AO5: -2.2000000000000002e-002 | AP5: 61 | AQ5: 搜特转债!
A6: 271 | B6: 128063 | C6: 未来转债! | D6: 2631 | E6: 德尔未来 | F6: 其他 | G6: 家居用品 | H6: 103.75 | I6: 3.0999999999999999e-003 | J6: -2.8000000000000004e-003 | K6: 5.96 | L6: 1.7000000000000001e-003 | M6: 127.5 | N6: 8.63 | O6: 0.502 | P6: 69.06 | Q6: 转股中 | R6: 3.89年 | S6: 2.89年 | T6: 6.3 | U6: 1.1 | V6: 2.e-003 | W6: 0.159 | X6: 0.11 | Y6: 40 | Z6: 2.35 | AA6: 5.5999999999999994e-002 | AB6: 4.36e-002 | AC6: 1.41e-002 | AD6: 8.8999999999999999e-003 | AE6: 90.01 | AF6: 101.07 | AG6: 0.19 | AH6: AA- | AI6: 6.3399999999999998e-002 | AJ6: =H6+100*O6 -> 153.94999999999999 | AK6: 138.4 | AL6: 246 | AM6: 37.4 | AN6: 183 | AO6: 1.e-003 | AP6: 32 | AQ6: 未来转债!
A7: 75 | B7: 128138 | C7: 侨银转债! | D7: 2973 | E7: 侨银股份 | F7: 城市公用 | G7: 城市公用 | H7: 102.581 | I7: 0. | J7: 9.4999999999999998e-003 | K7: 16.92 | L7: 4.0000000000000001e-002 | M7: 136.5 | N7: 25.43 | O7: 0.54200000000000004 | P7: 66.54 | Q7: 10天 | R7: 5.51年 | S7: 3.51年 | T7: 4.2 | U7: 25 | V7: 5.7999999999999996e-002 | W7: 6.0999999999999999e-002 | X7: 4.0000000000000001e-002 | Y7: 69 | Z7: 4.59 | AA7: 5.4299999999999994e-002 | AB7: 4.3499999999999997e-002 | AC7: 4.8999999999999998e-003 | AD7: 2.5000000000000001e-003 | AE7: 83.06 | AF7: 97.19 | AG7: 0.24 | AH7: AA- | AI7: 6.4899999999999999e-002 | AJ7: =H7+100*O7 -> 156.78100000000001 | AK7: 138.6 | AL7: 247 | AM7: 41.4 | AN7: 206 | AO7: -5.0000000000000003e-002 | AP7: 9 | AQ7: 侨银转债!
A8: 257 | B8: 123028 | C8: 清水转债! | D8: 300437 | E8: 清水源 | F8: 城市公用 | G8: 三废处理 | H8: 99.16 | I8: 3.7000000000000002e-003 | J8: -3.0000000000000001e-003 | K8: 8.8 | L8: 2.3e-003 | M8: 121.8 | N8: 11.84 | O8: 0.33399999999999996 | P8: 74.32 | Q8: 转股中 | R8: 4年35天 | S8: 2年36天 | T8: 4.55 | U8: 248 | V8: 0.54000000000000004 | W8: 0.23399999999999999 | X8: 0.17399999999999999 | Y8: 19 | Z8: 1.75 | AA8: 5.3099999999999994e-002 | AB8: 4.3200000000000002e-002 | AC8: 2.4799999999999999e-002 | AD8: 2.06e-002 | AE8: 91.32 | AF8: 95.41 | AG8: 0.31 | AH8: AA- | AI8: 6.3399999999999998e-002 | AJ8: =H8+100*O8 -> 132.56 | AK8: 124 | AL8: 109 | AM8: 28.6 | AN8: 84 | AO8: -1.e-003 | AP8: 51 | AQ8: 清水转债!
A9: 151 | B9: 127018 | C9: 本钢转债! | D9: 761 | E9: 本钢板材 | F9: 钢铁 | G9: 炼钢 | H9: 99.71 | I9: -8.6999999999999994e-003 | J9: -2.3e-003 | K9: 4.55 | L9: -2.5699999999999997e-002 | M9: 128.6 | N9: 5.03 | O9: 0.10199999999999999 | P9: 90.46 | Q9: 转股中 | R9: 5年45天 | S9: 3年46天 | T9: 67.5 | U9: 182 | V9: 2.7000000000000003e-002 | W9: 0.38299999999999995 | X9: 0.34600000000000003 | Y9: 176 | Z9: 0.86 | AA9: 5.2699999999999997e-002 | AB9: 4.2800000000000005e-002 | AC9: 2.0400000000000001e-002 | AD9: 1.6500000000000001e-002 | AE9: 91.2 | AF9: 101.5 | AG9: 0.43 | AH9: AAA | AI9: 4.8899999999999999e-002 | AJ9: =H9+100*O9 -> 109.91 | AK9: 109 | AL9: 7 | AM9: 7.5 | AN9: 2 | AO9: 3.7000000000000005e-002 | AP9: 62 | AQ9: 本钢转债!
A10: 258 | B10: 113027 | C10: 华钰转债!! | D10: 601020 | E10: ST华钰 | F10: 有色金属 | G10: 锌铅镍锡 | H10: 93.66 | I10: -1.9599999999999999e-002 | J10: 8.1000000000000013e-003 | K10: 6.6 | L10: -5.04e-002 | M10: 114.9 | N10: 10.17 | O10: 0.44299999999999995 | P10: 64.9 | Q10: 转股中 | R10: 4年30天 | S10: 2年31天 | T10: 3.25 | U10: 26 | V10: 8.5999999999999993e-002 | W10: 8.900000000000001e-002 | X10: 5.7999999999999996e-002 | Y10: 37 | Z10: 1.47 | AA10: 5.2600000000000001e-002 | AB10: 4.5400000000000003e-002 | AC10: 4.5499999999999999e-002 | AD10: 4.2300000000000004e-002 | AE10: 90.19 | AF10: 89.91 | AG10: 0.23 | AH10: AA- | AI10: 6.3399999999999998e-002 | AJ10: =H10+100*O10 -> 137.95999999999998 | AK10: 122.4 | AL10: 90 | AM10: 32.2 | AN10: 123 | AO10: -0.18899999999999997 | AP10: 46 | AQ10: 华钰转债!!
A11: 305 | B11: 128044 | C11: 岭南转债! | D11: 2717 | E11: 岭南股份 | F11: 城市公用 | G11: 生态环境 | H11: 94.995 | I11: -1.e-003 | J11: 1.1999999999999999e-003 | K11: 2.93 | L11: 1.38e-002 | M11: 111.3 | N11: 5.91 | O11: 0.91599999999999993 | P11: 49.58 | Q11: 转股中 | R11: 3.25年 | S11: 1.25年 | T11: 6.59 | U11: 10 | V11: 1.6e-002 | W11: 0.14699999999999999 | X11: 7.2999999999999995e-002 | Y11: 45 | Z11: 1.03 | AA11: 5.1100000000000007e-002 | AB11: 4.41e-002 | AC11: 5.7800000000000004e-002 | AD11: 5.3600000000000002e-002 | AE11: 96.98 | AF11: 97.54 | AG11: 0.02 | AH11: AA | AI11: 4.24e-002 | AJ11: =H11+100*O11 -> 186.595 | AK11: 140.4 | AL11: 255 | AM11: 42.9 | AN11: 213 | AO11: -1.3999999999999999e-002 | AP11: 43 | AQ11: 岭南转债!
A12: 197 | B12: 113569 | C12: 科达转债! | D12: 603660 | E12: 苏州科达 | F12: 通信互联 | G12: 物联网 | H12: 95.66 | I12: 5.5000000000000005e-003 | J12: -4.3e-003 | K12: 7.07 | L12: 1.7299999999999999e-002 | M12: 120.3 | N12: 14.84 | O12: 1.01 | P12: 47.64 | Q12: 转股中 | R12: 4.82年 | S12: 2.82年 | T12: 5.16 | U12: 2.8 | V12: 6.0000000000000001e-003 | W12: 0.14599999999999999 | X12: 7.0000000000000007e-002 | Y12: 35 | Z12: 1.95 | AA12: 4.9800000000000004e-002 | AB12: 4.2000000000000003e-002 | AC12: 2.75e-002 | AD12: 2.5000000000000001e-002 | AE12: 86.42 | AF12: 90.01 | AG12: 0.07 | AH12: AA- | AI12: 6.3399999999999998e-002 | AJ12: =H12+100*O12 -> 196.66 | AK12: 143.7 | AL12: 275 | AM12: 53.7 | AN12: 277 | AO12: -3.1e-002 | AP12: 27 | AQ12: 科达转债!
A13: 286 | B13: 110052 | C13: 贵广转债! | D13: 600996 | E13: 贵广网络 | F13: 传媒娱乐 | G13: 影视娱乐 | H13: 98.99 | I13: 1.e-003 | J13: -5.9999999999999995e-004 | K13: 4.57 | L13: 8.8000000000000005e-003 | M13: 117.7 | N13: 7.94 | O13: 0.71999999999999997 | P13: 57.56 | Q13: 转股中 | R13: 3.81年 | S13: 1.81年 | T13: 15.3 | U13: 3.3 | V13: 2.e-003 | W13: 0.318 | X13: 0.183 | Y13: 48 | Z13: 1.14 | AA13: 4.7500000000000001e-002 | AB13: 3.8800000000000001e-002 | AC13: 2.06e-002 | AD13: 1.7500000000000002e-002 | AE13: 95.34 | AF13: 101.52 | AG13: 0.05 | AH13: AA+ | AI13: 4.0399999999999998e-002 | AJ13: =H13+100*O13 -> 170.99000000000001 | AK13: 140.4 | AL13: 256 | AM13: 38.9 | AN13: 190 | AO13: -4.0999999999999995e-002 | AP13: 18 | AQ13: 贵广转债!
A14: 303 | B14: 113519 | C14: 长久转债! | D14: 603569 | E14: 长久物流 | F14: 交通运输 | G14: 物流业 | H14: 101.9 | I14: -5.0000000000000001e-004 | J14: 7.000000000000001e-004 | K14: 7.79 | L14: 1.2999999999999999e-003 | M14: 119.3 | N14: 11.15 | O14: 0.45899999999999996 | P14: 69.87 | Q14: 转股中 | R14: 3.48年 | S14: 1.49年 | T14: 6.97 | U14: 18 | V14: 2.6000000000000002e-002 | W14: 0.16 | X14: 0.11199999999999999 | Y14: 44 | Z14: 1.99 | AA14: 4.7199999999999999e-002 | AB14: 3.7100000000000001e-002 | AC14: 5.4000000000000003e-003 | AD14: 2.e-003 | AE14: 96.04 | AF14: 103.52 | AG14: 0.13 | AH14: AA | AI14: 4.24e-002 | AJ14: =H14+100*O14 -> 147.80000000000001 | AK14: 133.9 | AL14: 212 | AM14: 30.4 | AN14: 101 | AO14: 5.0999999999999997e-002 | AP14: 21 | AQ14: 长久转债!
A15: 223 | B15: 128085 | C15: 鸿达转债! | D15: 2002 | E15: 鸿达兴业 | F15: 化工 | G15: 化工 | H15: 101.15 | I15: -1.46e-002 | J15: 1.1000000000000001e-003 | K15: 3.97 | L15: -1.7299999999999999e-002 | M15: 124.4 | N15: 3.92 | O15: -1.e-003 | P15: 101.28 | Q15: 转股中 | R15: 4.59年 | S15: 2.59年 | T15: 11.8 | U15: 127 | V15: 0.107 | W15: 0.10199999999999999 | X15: 0.10400000000000001 | Y15: 115 | Z15: 1.36 | AA15: 4.7199999999999999e-002 | AB15: 3.7699999999999997e-002 | AC15: 9.8999999999999991e-003 | AD15: 7.0999999999999995e-003 | AE15: 75.45 | AF15: 73.56 | AG15: 0.78 | AH15: BB | AI15: 0.1244 | AJ15: =H15+100*O15 -> 101.05000000000001 | AK15: 101 | AL15: 1 | AM15: 25.6 | AN15: 50 | AO15: 3.3000000000000002e-002 | AP15: 100 | AQ15: 鸿达转债!
A16: 118 | B16: 113600 | C16: 新星转债! | D16: 603978 | E16: 深圳新星 | F16: 有色金属 | G16: 有色行业 | H16: 99.62 | I16: 1.67e-002 | J16: 1.5e-003 | K16: 20.25 | L16: 3.85e-002 | M16: 126 | N16: 23.85 | O16: 0.17300000000000001 | P16: 84.91 | Q16: 转股中 | R16: 5.25年 | S16: 3.25年 | T16: 5.95 | U16: 14 | V16: 2.3e-002 | W16: 0.184 | X16: 0.156 | Y16: 32 | Z16: 2.12 | AA16: 4.6799999999999994e-002 | AB16: 3.8100000000000002e-002 | AC16: 1.26e-002 | AD16: 1.03e-002 | AE16: 84.04 | AF16: 91.22 | AG16: 0.47 | AH16: AA- | AI16: 6.4899999999999999e-002 | AJ16: =H16+100*O16 -> 116.92 | AK16: 114.3 | AL16: 23 | AM16: 23.1 | AN16: 32 | AO16: 7.2999999999999995e-002 | AP16: 19 | AQ16: 新星转债!
A17: 312 | B17: 123011 | C17: 德尔转债! | D17: 300473 | E17: 德尔股份 | F17: 汽车 | G17: 零部件制 | H17: 100.91 | I17: -1.06e-002 | J17: 8.3000000000000001e-003 | K17: 21.04 | L17: -2.0499999999999997e-002 | M17: 116.3 | N17: 34.54 | O17: 0.65700000000000003 | P17: 60.91 | Q17: 转股中 | R17: 3.18年 | S17: 1.18年 | T17: 2.51 | U17: 76 | V17: 0.29899999999999999 | W17: 8.8000000000000009e-002 | X17: 5.4000000000000006e-002 | Y17: 28 | Z17: 1.29 | AA17: 4.6699999999999998e-002 | AB17: 3.7000000000000005e-002 | AC17: 1.3999999999999999e-002 | AD17: 9.8999999999999991e-003 | AE17: 94.73 | AF17: 96.08 | AG17: 0.11 | AH17: AA- | AI17: 6.3399999999999998e-002 | AJ17: =H17+100*O17 -> 166.61000000000001 | AK17: 140.9 | AL17: 258 | AM17: 44.8 | AN17: 229 | AO17: 8.900000000000001e-002 | AP17: 41 | AQ17: 德尔转债!
A18: 172 | B18: 113573 | C18: 纵横转债! | D18: 603602 | E18: 纵横通信 | F18: 通信互联 | G18: 通信设备 | H18: 99.84 | I18: 5.1000000000000004e-003 | J18: -4.1999999999999997e-003 | K18: 10.37 | L18: 5.7999999999999996e-003 | M18: 124.2 | N18: 18.81 | O18: 0.81099999999999994 | P18: 55.13 | Q18: 转股中 | R18: 4.92年 | S18: 2.93年 | T18: 2.7 | U18: 4.1 | V18: 1.4999999999999999e-002 | W18: 0.128 | X18: 7.0000000000000007e-002 | Y18: 21 | Z18: 2.98 | AA18: 4.6300000000000001e-002 | AB18: 3.7599999999999995e-002 | AC18: 1.38e-002 | AD18: 1.1200000000000002e-002 | AE18: 83.58 | AF18: 87.91 | AG18: 0.16 | AH18: A+ | AI18: 7.4400000000000008e-002 | AJ18: =H18+100*O18 -> 180.94 | AK18: 144.5 | AL18: 280 | AM18: 56.6 | AN18: 286 | AO18: -1.6e-002 | AP18: 23 | AQ18: 纵横转债!
A19: 96 | B19: 123069 | C19: 金诺转债! | D19: 300505 | E19: 川金诺 | F19: 化工 | G19: 农化 | H19: 99.26 | I19: 6.5000000000000006e-003 | J19: -4.6999999999999993e-003 | K19: 13.78 | L19: 5.1000000000000004e-003 | M19: 126 | N19: 19.15 | O19: 0.379 | P19: 71.96 | Q19: 转股中 | R19: 5.42年 | S19: 3.42年 | T19: 3.68 | U19: 2.5 | V19: 6.9999999999999993e-003 | W19: 0.20399999999999999 | X19: 0.14699999999999999 | Y19: 18 | Z19: 1.9 | AA19: 4.5899999999999996e-002 | AB19: 3.7499999999999999e-002 | AC19: 1.3000000000000001e-002 | AD19: 1.0800000000000001e-002 | AE19: 83.12 | AF19: 90.22 | AG19: 0.36 | AH19: AA- | AI19: 6.4899999999999999e-002 | AJ19: =H19+100*O19 -> 137.16 | AK19: 126.6 | AL19: 132 | AM19: 36.3 | AN19: 170 | AO19: -9.6999999999999989e-002 | AP19: 18 | AQ19: 金诺转债!
A20: 117 | B20: 110072 | C20: 广汇转债! | D20: 600297 | E20: 广汇汽车 | F20: 汽车 | G20: 分销、售 | H20: 90.95 | I20: 5.0000000000000001e-003 | J20: -2.8999999999999998e-003 | K20: 2.97 | L20: 6.8000000000000005e-003 | M20: 114.5 | N20: 4.03 | O20: 0.23399999999999999 | P20: 73.7 | Q20: 转股中 | R20: 5.26年 | S20: 3.26年 | T20: 33.7 | U20: 54 | V20: 1.8000000000000002e-002 | W20: 0.14000000000000001 | X20: 0.10300000000000001 | Y20: 241 | Z20: 0.6 | AA20: 4.5499999999999999e-002 | AB20: 4.0199999999999993e-002 | AC20: 3.7200000000000004e-002 | AD20: 3.5400000000000001e-002 | AE20: 89.56 | AF20: 92.58 | AG20: 0.3 | AH20: AA+ | AI20: 4.1900000000000007e-002 | AJ20: =H20+100*O20 -> 114.34999999999999 | AK20: 108.2 | AL20: 6 | AM20: 15.6 | AN20: 9 | AO20: -2.3e-002 | AP20: 53 | AQ20: 广汇转债!
A21: 358 | B21: 127003 | C21: 海印转债! | D21: 861 | E21: 海印股份 | F21: 商业零售 | G21: 商场 | H21: 106.781 | I21: 2.8000000000000004e-003 | J21: -2.3e-003 | K21: 2.29 | L21: 1.78e-002 | M21: 111.8 | N21: 3 | O21: 0.39899999999999997 | P21: 76.33 | Q21: 转股中 | R21: 1年25天 | S21: 回售内 | T21: 6.74 | U21: 6.9 | V21: 1.e-002 | W21: 0.127 | X21: 9.6999999999999989e-002 | Y21: 53 | Z21: 1.4 | AA21: 4.4600000000000001e-002 | AB21: 2.3599999999999999e-002 | AC21: 回售内 | AD21: 回售内 | AE21: 100.3 | AF21: 107.23 | AG21: 0.03 | AH21: AA | AI21: 4.0500000000000001e-002 | AJ21: =H21+100*O21 -> 146.68100000000001 | AK21: 137.2 | AL21: 242 | AM21: 30 | AN21: 97 | AO21: 1.e-002 | AP21: 74 | AQ21: 海印转债!
A22: 72 | B22: 123077 | C22: 汉得转债! | D22: 300170 | E22: 汉得信息 | F22: 计算机及 | G22: 软件开发 | H22: 99.261 | I22: 8.5000000000000006e-003 | J22: 5.1999999999999998e-003 | K22: 7.07 | L22: 5.6799999999999996e-002 | M22: 125.5 | N22: 9.72 | O22: 0.36499999999999999 | P22: 72.74 | Q22: 13天 | R22: 5.53年 | S22: 3.53年 | T22: 9.37 | U22: 9.2 | V22: 1.e-002 | W22: 0.14999999999999999 | X22: 0.109 | Y22: 63 | Z22: 1.97 | AA22: 4.4199999999999996e-002 | AB22: 3.61e-002 | AC22: 1.24e-002 | AD22: 1.03e-002 | AE22: 88.74 | AF22: 99.41 | AG22: 0.24 | AH22: AA | AI22: 4.3899999999999995e-002 | AJ22: =H22+100*O22 -> 135.761 | AK22: 125.8 | AL22: 125 | AM22: 26.4 | AN22: 59 | AO22: 5.5999999999999994e-002 | AP22: 12 | AQ22: 汉得转债!
A23: 333 | B23: 113017 | C23: 吉视转债! | D23: 601929 | E23: 吉视传媒 | F23: 传媒娱乐 | G23: 影视娱乐 | H23: 97.35 | I23: 1.5e-003 | J23: -5.0000000000000001e-004 | K23: 1.92 | L23: 1.5900000000000001e-002 | M23: 108.8 | N23: 2.95 | O23: 0.496 | P23: 65.08 | Q23: 转股中 | R23: 2.62年 | S23: 0.62年 | T23: 15.6 | U23: 12 | V23: 8.0000000000000002e-003 | W23: 0.26100000000000001 | X23: 0.17000000000000001 | Y23: 60 | Z23: 0.9 | AA23: 4.4000000000000004e-002 | AB23: 3.73e-002 | AC23: 5.5199999999999999e-002 | AD23: 5.1100000000000007e-002 | AE23: 98.58 | AF23: 98.68 | AG23: 0.07 | AH23: AA+ | AI23: 3.85e-002 | AJ23: =H23+100*O23 -> 146.94999999999999 | AK23: 129.6 | AL23: 171 | AM23: 30.9 | AN23: 109 | AO23: 3.3000000000000002e-002 | AP23: 65 | AQ23: 吉视转债!
A24: 203 | B24: 113564 | C24: 天目转债!* | D24: 603136 | E24: 天目湖 | F24: 旅游餐饮 | G24: 旅游 | H24: 103.26 | I24: 3.7000000000000002e-003 | J24: -3.7000000000000002e-003 | K24: 23.86 | L24: 1.5300000000000001e-002 | M24: 126.2 | N24: 23.1 | O24: 0. | P24: 103.29 | Q24: 转股中 | R24: 4.79年 | S24: 2.79年 | T24: 0.88 | U24: 71 | V24: 0.78000000000000003 | W24: 2.9999999999999999e-002 | X24: 3.1e-002 | Y24: 29 | Z24: 3.03 | AA24: 4.3700000000000003e-002 | AB24: 3.4200000000000001e-002 | AC24: 2.8000000000000004e-003 | AD24: 1.e-004 | AE24: 86.96 | AF24: 94.61 | AG24: 0 | AH24: AA- | AI24: 6.3399999999999998e-002 | AJ24: =H24+100*O24 -> 103.26000000000001 | AK24: 103.2 | AL24: 3 | AM24: 8.6 | AN24: 3 | AO24: -0.10099999999999999 | AP24: 13 | AQ24: 天目转债!*
A25: 352 | B25: 128015 | C25: 久其转债! | D25: 2279 | E25: 久其软件 | F25: 计算机及 | G25: 软件开发 | H25: 101.6 | I25: 1.e-003 | J25: -1.e-003 | K25: 4.79 | L25: 1.0500000000000001e-002 | M25: 110.8 | N25: 9.48 | O25: 1.01 | P25: 50.53 | Q25: 转股中 | R25: 2年25天 | S25: 25天 | T25: 7.8 | U25: 19 | V25: 2.4e-002 | W25: 0.22899999999999998 | X25: 0.11599999999999999 | Y25: 34 | Z25: 3.96 | AA25: 4.36e-002 | AB25: 3.3399999999999999e-002 | AC25: -2.0999999999999999e-003 | AD25: -1.5100000000000001e-002 | AE25: 99.91 | AF25: 96.13 | AG25: 0 | AH25: A+ | AI25: 7.2499999999999995e-002 | AJ25: =H25+100*O25 -> 202.59999999999999 | AK25: 152.7 | AL25: 306 | AM25: 52.8 | AN25: 275 | AO25: 1.9e-002 | AP25: 68 | AQ25: 久其转债!
A26: 276 | B26: 113530 | C26: 大丰转债! | D26: 603081 | E26: 大丰实业 | F26: 建筑 | G26: 装饰工程 | H26: 102.99 | I26: 8.6e-003 | J26: -4.6999999999999993e-003 | K26: 11.9 | L26: 2.5899999999999999e-002 | M26: 121 | N26: 16.64 | O26: 0.44 | P26: 71.51 | Q26: 转股中 | R26: 3.87年 | S26: 1.87年 | T26: 6.3 | U26: 5.7 | V26: 9.0000000000000011e-003 | W26: 0.13200000000000001 | X26: 9.4e-002 | Y26: 48 | Z26: 2.15 | AA26: 4.3400000000000001e-002 | AB26: 3.3599999999999998e-002 | AC26: -4.0000000000000002e-004 | AD26: -3.2000000000000002e-003 | AE26: 94.63 | AF26: 103.36 | AG26: 0.15 | AH26: AA | AI26: 4.24e-002 | AJ26: =H26+100*O26 -> 146.99000000000001 | AK26: 134.5 | AL26: 216 | AM26: 31.1 | AN26: 111 | AO26: 2.8999999999999998e-002 | AP26: 34 | AQ26: 大丰转债!
A27: 147 | B27: 128117 | C27: 道恩转债! | D27: 2838 | E27: 道恩股份 | F27: 化工 | G27: 橡胶塑料 | H27: 100.17 | I27: 1.1999999999999999e-003 | J27: 5.0000000000000001e-004 | K27: 18.25 | L27: 7.1999999999999998e-003 | M27: 123.5 | N27: 29.03 | O27: 0.59299999999999997 | P27: 62.87 | Q27: 转股中 | R27: 5年48天 | S27: 3年49天 | T27: 3.6 | U27: 4.8 | V27: 1.3000000000000001e-002 | W27: 4.8000000000000001e-002 | X27: 2.9999999999999999e-002 | Y27: 74 | Z27: 3.92 | AA27: 4.2500000000000003e-002 | AB27: 3.44e-002 | AC27: 1.11e-002 | AD27: 8.8000000000000005e-003 | AE27: 84.58 | AF27: 90.05 | AG27: 0.24 | AH27: AA- | AI27: 6.4899999999999999e-002 | AJ27: =H27+100*O27 -> 159.47 | AK27: 137.5 | AL27: 243 | AM27: 47.4 | AN27: 244 | AO27: -4.0999999999999995e-002 | AP27: 21 | AQ27: 道恩转债!
A28: 146 | B28: 128118 | C28: 瀛通转债! | D28: 2861 | E28: 瀛通通讯 | F28: 电子 | G28: 电子产品 | H28: 99.3 | I28: 1.43e-002 | J28: -1.1200000000000002e-002 | K28: 17.95 | L28: 1.1299999999999999e-002 | M28: 122.1 | N28: 27.53 | O28: 0.52300000000000002 | P28: 65.2 | Q28: 转股中 | R28: 5年48天 | S28: 3年49天 | T28: 3 | U28: 6 | V28: 2.e-002 | W28: 0.13699999999999998 | X28: 8.900000000000001e-002 | Y28: 22 | Z28: 2.04 | AA28: 4.2199999999999994e-002 | AB28: 3.44e-002 | AC28: 1.61e-002 | AD28: 1.3300000000000001e-002 | AE28: 85.23 | AF28: 89.16 | AG28: 0.28 | AH28: AA- | AI28: 6.4899999999999999e-002 | AJ28: =H28+100*O28 -> 151.59999999999999 | AK28: 133.4 | AL28: 205 | AM28: 44.2 | AN28: 225 | AO28: 5.0000000000000001e-003 | AP28: 14 | AQ28: 瀛通转债!
A29: 323 | B29: 128037 | C29: 岩土转债! | D29: 2542 | E29: 中化岩土 | F29: 建筑 | G29: 建筑工程 | H29: 99.195 | I29: 3.2000000000000002e-003 | J29: -3.2000000000000002e-003 | K29: 2.97 | L29: 0. | M29: 111.3 | N29: 7.99 | O29: 1.6699999999999999 | P29: 37.17 | Q29: 转股中 | R29: 2.83年 | S29: 0.84年 | T29: 5.99 | U29: 14 | V29: 2.4e-002 | W29: 0.11199999999999999 | X29: 4.2000000000000003e-002 | Y29: 54 | Z29: 1.35 | AA29: 4.2099999999999999e-002 | AB29: 3.44e-002 | AC29: 2.63e-002 | AD29: 2.2599999999999999e-002 | AE29: 97.84 | AF29: 99.63 | AG29: 0 | AH29: AA | AI29: 4.0500000000000001e-002 | AJ29: =H29+100*O29 -> 266.19499999999999 | AK29: 161.2 | AL29: 319 | AM29: 61.6 | AN29: 304 | AO29: -2.9999999999999999e-002 | AP29: 51 | AQ29: 岩土转债!
A30: 141 | B30: 127019 | C30: 国城转债! | D30: 688 | E30: 国城矿业 | F30: 有色金属 | G30: 锌铅镍锡 | H30: 93.558 | I30: 1.5e-003 | J30: -8.9999999999999998e-004 | K30: 10.07 | L30: 1.21e-002 | M30: 115.1 | N30: 21.07 | O30: 0.95799999999999996 | P30: 47.79 | Q30: 转股中 | R30: 5.17年 | S30: 3.17年 | T30: 8.5 | U30: 14 | V30: 1.8000000000000002e-002 | W30: 7.400000000000001e-002 | X30: 3.5000000000000003e-002 | Y30: 115 | Z30: 4.94 | AA30: 4.1799999999999997e-002 | AB30: 3.6200000000000003e-002 | AC30: 3.1300000000000001e-002 | AD30: 2.9100000000000001e-002 | AE30: 89.89 | AF30: 92.59 | AG30: 0.05 | AH30: AA | AI30: 4.3899999999999995e-002 | AJ30: =H30+100*O30 -> 189.358 | AK30: 139.3 | AL30: 251 | AM30: 46.7 | AN30: 240 | AO30: 7.8e-002 | AP30: 40 | AQ30: 国城转债!
A31: 52 | B31: 123088 | C31: 威唐转债! | D31: 300707 | E31: 威唐工业 | F31: 汽车 | G31: 零部件制 | H31: 97.249 | I31: 1.2500000000000001e-002 | J31: -1.2199999999999999e-002 | K31: 14.59 | L31: 7.000000000000001e-004 | M31: 121.6 | N31: 20.75 | O31: 0.38299999999999995 | P31: 70.31 | Q31: 38天 | R31: 5.59年 | S31: 3.59年 | T31: 3.01 | U31: 6.8 | V31: 2.3e-002 | W31: 0.13200000000000001 | X31: 9.1999999999999998e-002 | Y31: 23 | Z31: 3.32 | AA31: 4.1799999999999997e-002 | AB31: 3.4799999999999998e-002 | AC31: 1.9799999999999998e-002 | AD31: 1.7399999999999999e-002 | AE31: 79.75 | AF31: 81.6 | AG31: 0.44 | AH31: A+ | AI31: 7.5899999999999995e-002 | AJ31: =H31+100*O31 -> 135.54899999999998 | AK31: 124.2 | AL31: 110 | AM31: 42.6 | AN31: 212 | AO31: -1.3999999999999999e-002 | AP31: 10 | AQ31: 威唐转债!
A32: 194 | B32: 123044 | C32: 红相转债!! | D32: 300427 | E32: 红相股份 | F32: 能源电力 | G32: 电力设备 | H32: 103.23 | I32: 6.0999999999999995e-003 | J32: 1.2999999999999999e-003 | K32: 12.26 | L32: 3.1099999999999999e-002 | M32: 125 | N32: 18.8 | O32: 0.58299999999999996 | P32: 65.21 | Q32: 转股中 | R32: 4.82年 | S32: 2.83年 | T32: 5.5 | U32: 26 | V32: 4.4999999999999998e-002 | W32: 0.125 | X32: 8.1000000000000003e-002 | Y32: 44 | Z32: 1.88 | AA32: 4.1500000000000002e-002 | AB32: 3.2300000000000002e-002 | AC32: 4.1999999999999997e-003 | AD32: 1.1999999999999999e-003 | AE32: 87.12 | AF32: 93.6 | AG32: 0.24 | AH32: AA- | AI32: 6.3399999999999998e-002 | AJ32: =H32+100*O32 -> 161.53 | AK32: 141.2 | AL32: 259 | AM32: 47.7 | AN32: 246 | AO32: -2.e-003 | AP32: 20 | AQ32: 红相转债!!
A33: 105 | B33: 128132 | C33: 交建转债! | D33: 2941 | E33: 新疆交建 | F33: 建筑 | G33: 建筑工程 | H33: 94.831 | I33: 5.1000000000000004e-003 | J33: -4.6999999999999993e-003 | K33: 10.95 | L33: 2.7000000000000001e-003 | M33: 117.3 | N33: 18.57 | O33: 0.60799999999999998 | P33: 58.97 | Q33: 转股中 | R33: 5.34年 | S33: 3.34年 | T33: 8.5 | U33: 6.1 | V33: 8.0000000000000002e-003 | W33: 0.12 | X33: 7.0999999999999994e-002 | Y33: 71 | Z33: 2.91 | AA33: 4.1500000000000002e-002 | AB33: 3.5400000000000001e-002 | AC33: 2.64e-002 | AD33: 2.4199999999999999e-002 | AE33: 89.43 | AF33: 93.7 | AG33: 0.13 | AH33: AA | AI33: 4.3899999999999995e-002 | AJ33: =H33+100*O33 -> 155.631 | AK33: 130.7 | AL33: 181 | AM33: 37 | AN33: 180 | AO33: -3.6000000000000004e-002 | AP33: 18 | AQ33: 交建转债!
A34: 221 | B34: 110064 | C34: 建工转债! | D34: 600939 | E34: 重庆建工 | F34: 建筑 | G34: 建筑工程 | H34: 99.9 | I34: 5.5000000000000005e-003 | J34: -4.7999999999999996e-003 | K34: 3.61 | L34: 2.8000000000000004e-003 | M34: 119.8 | N34: 4.57 | O34: 0.26500000000000001 | P34: 78.99 | Q34: 转股中 | R34: 4.60年 | S34: 2.60年 | T34: 16.6 | U34: 11 | V34: 6.9999999999999993e-003 | W34: 0.253 | X34: 0.20000000000000001 | Y34: 66 | Z34: 0.93 | AA34: 4.1299999999999996e-002 | AB34: 3.3399999999999999e-002 | AC34: 1.52e-002 | AD34: 1.23e-002 | AE34: 93.42 | AF34: 100.27 | AG34: 0.28 | AH34: AA+ | AI34: 4.0399999999999998e-002 | AJ34: =H34+100*O34 -> 126.40000000000001 | AK34: 120.8 | AL34: 68 | AM34: 20.5 | AN34: 18 | AO34: 2.e-002 | AP34: 46 | AQ34: 建工转债!
A35: 113 | B35: 113601 | C35: 塞力转债! | D35: 603716 | E35: 塞力医疗 | F35: 医药 | G35: 医药商业 | H35: 98.5 | I35: 5.5000000000000005e-003 | J35: 2.8999999999999998e-003 | K35: 13.84 | L35: 1.7600000000000001e-002 | M35: 121.3 | N35: 16.98 | O35: 0.20800000000000002 | P35: 81.51 | Q35: 转股中 | R35: 5.27年 | S35: 3.27年 | T35: 5.43 | U35: 12 | V35: 2.2000000000000002e-002 | W35: 0.191 | X35: 0.156 | Y35: 28 | Z35: 1.81 | AA35: 4.1299999999999996e-002 | AB35: 3.39e-002 | AC35: 1.6799999999999999e-002 | AD35: 1.43e-002 | AE35: 84.2 | AF35: 87.78 | AG35: 0.48 | AH35: AA- | AI35: 6.4899999999999999e-002 | AJ35: =H35+100*O35 -> 119.3 | AK35: 115.5 | AL35: 28 | AM35: 27.7 | AN35: 73 | AO35: -2.3e-002 | AP35: 37 | AQ35: 塞力转债!
A36: 152 | B36: 113589 | C36: 天创转债! | D36: 603608 | E36: 天创时尚 | F36: 服装纺织 | G36: 鞋服行业 | H36: 94.21 | I36: 1.43e-002 | J36: -3.7000000000000002e-003 | K36: 6.9 | L36: 0.10099999999999999 | M36: 115.3 | N36: 12.44 | O36: 0.69900000000000007 | P36: 55.47 | Q36: 转股中 | R36: 5年40天 | S36: 3年41天 | T36: 6 | U36: 521 | V36: 0.88900000000000001 | W36: 0.20300000000000001 | X36: 0.11199999999999999 | Y36: 30 | Z36: 1.82 | AA36: 4.1200000000000001e-002 | AB36: 3.5499999999999997e-002 | AC36: 3.04e-002 | AD36: 2.7999999999999997e-002 | AE36: 90.31 | AF36: 93.01 | AG36: 0.11 | AH36: AA | AI36: 4.3899999999999995e-002 | AJ36: =H36+100*O36 -> 164.11000000000001 | AK36: 133 | AL36: 202 | AM36: 39.9 | AN36: 199 | AO36: 0.13699999999999998 | AP36: 26 | AQ36: 天创转债!
A37: 263 | B37: 128066 | C37: 亚泰转债! | D37: 2811 | E37: 郑中设计 | F37: 建筑 | G37: 装饰工程 | H37: 100.071 | I37: 1.1999999999999999e-003 | J37: -7.000000000000001e-004 | K37: 8.34 | L37: 1.1999999999999999e-003 | M37: 116.7 | N37: 9.67 | O37: 0.16 | P37: 86.25 | Q37: 转股中 | R37: 3.92年 | S37: 1.93年 | T37: 4.8 | U37: 4.3 | V37: 9.0000000000000011e-003 | W37: 0.21299999999999999 | X37: 0.184 | Y37: 23 | Z37: 1.52 | AA37: 4.07e-002 | AB37: 3.2799999999999996e-002 | AC37: 1.41e-002 | AD37: 1.1299999999999999e-002 | AE37: 90.69 | AF37: 92.12 | AG37: 0.45 | AH37: AA- | AI37: 6.3399999999999998e-002 | AJ37: =H37+100*O37 -> 116.071 | AK37: 113.9 | AL37: 21 | AM37: 21.8 | AN37: 23 | AO37: 3.3000000000000002e-002 | AP37: 62 | AQ37: 亚泰转债!
A38: 339 | B38: 128026 | C38: 众兴转债! | D38: 2772 | E38: 众兴菌业 | F38: 农业 | G38: 种植业 | H38: 98.828 | I38: 3.4000000000000002e-003 | J38: -2.8999999999999998e-003 | K38: 8.1 | L38: 6.1999999999999998e-003 | M38: 109.3 | N38: 11.45 | O38: 0.39700000000000002 | P38: 70.74 | Q38: 转股中 | R38: 2.58年 | S38: 0.58年 | T38: 9.19 | U38: 10 | V38: 1.1000000000000001e-002 | W38: 0.309 | X38: 0.218 | Y38: 30 | Z38: 1.16 | AA38: 4.0500000000000001e-002 | AB38: 3.3300000000000003e-002 | AC38: 4.0399999999999998e-002 | AD38: 3.5499999999999997e-002 | AE38: 97.36 | AF38: 93.94 | AG38: 0.09 | AH38: AA- | AI38: 6.1500000000000006e-002 | AJ38: =H38+100*O38 -> 138.52800000000002 | AK38: 126.9 | AL38: 137 | AM38: 29.6 | AN38: 90 | AO38: -2.9999999999999999e-002 | AP38: 64 | AQ38: 众兴转债!
A39: 288 | B39: 113528 | C39: 长城转债! | D39: 603897 | E39: 长城科技 | F39: 机械装备 | G39: 专用设备 | H39: 100.82 | I39: 7.000000000000001e-004 | J39: -3.7000000000000002e-003 | K39: 18.21 | L39: -8.6999999999999994e-003 | M39: 116.8 | N39: 23.45 | O39: 0.29799999999999999 | P39: 77.65 | Q39: 转股中 | R39: 3.79年 | S39: 1.80年 | T39: 6.34 | U39: 7.4 | V39: 1.2e-002 | W39: 0.19500000000000001 | X39: 0.152 | Y39: 32 | Z39: 1.66 | AA39: 4.0399999999999998e-002 | AB39: 3.2099999999999997e-002 | AC39: 1.1699999999999999e-002 | AD39: 8.5000000000000006e-003 | AE39: 91.5 | AF39: 92.94 | AG39: 0.34 | AH39: AA- | AI39: 6.3399999999999998e-002 | AJ39: =H39+100*O39 -> 130.62 | AK39: 124 | AL39: 108 | AM39: 31 | AN39: 110 | AO39: 4.8000000000000001e-002 | AP39: 42 | AQ39: 长城转债!
A40: 262 | B40: 113535 | C40: 大业转债! | D40: 603278 | E40: 大业股份 | F40: 汽车 | G40: 零部件制 | H40: 100.12 | I40: 2.7000000000000001e-003 | J40: -5.0000000000000001e-004 | K40: 8.97 | L40: 1.3600000000000001e-002 | M40: 112.5 | N40: 12.4 | O40: 0.38400000000000001 | P40: 72.34 | Q40: 转股中 | R40: 2.98年 | S40: 0.99年 | T40: 5 | U40: 2.3 | V40: 5.0000000000000001e-003 | W40: 0.192 | X40: 0.13900000000000001 | Y40: 26 | Z40: 1.52 | AA40: 4.0300000000000002e-002 | AB40: 3.2300000000000002e-002 | AC40: 9.7999999999999997e-003 | AD40: 7.6e-003 | AE40: 96.73 | AF40: 100.05 | AG40: 0.16 | AH40: AA | AI40: 4.0500000000000001e-002 | AJ40: =H40+100*O40 -> 138.52000000000001 | AK40: 127.9 | AL40: 150 | AM40: 27.9 | AN40: 75 | AO40: 1.2e-002 | AP40: 49 | AQ40: 大业转债!
A41: 256 | B41: 128069 | C41: 华森转债! | D41: 2907 | E41: 华森制药 | F41: 医药 | G41: 化学制药 | H41: 102.386 | I41: -6.9199999999999998e-002 | J41: 7.4499999999999997e-002 | K41: 13.18 | L41: 1.8500000000000003e-002 | M41: 120 | N41: 18.04 | O41: 0.40100000000000002 | P41: 73.06 | Q41: 转股中 | R41: 4年40天 | S41: 2年41天 | T41: 3 | U41: 898 | V41: 2.8300000000000001 | W41: 5.7000000000000002e-002 | X41: 4.0999999999999995e-002 | Y41: 53 | Z41: 4.66 | AA41: 4.0300000000000002e-002 | AB41: 3.1400000000000004e-002 | AC41: 4.7999999999999996e-003 | AD41: 1.8e-003 | AE41: 90.14 | AF41: 93.75 | AG41: 0.28 | AH41: AA- | AI41: 6.3399999999999998e-002 | AJ41: =H41+100*O41 -> 142.48599999999999 | AK41: 131.7 | AL41: 189 | AM41: 38 | AN41: 185 | AO41: 7.6999999999999999e-002 | AP41: 45 | AQ41: 华森转债!
A42: 126 | B42: 113596 | C42: 城地转债! | D42: 603887 | E42: 城地香江 | F42: 通信互联 | G42: 通信设备 | H42: 92.92 | I42: 2.46e-002 | J42: -2.3199999999999998e-002 | K42: 12.76 | L42: 3.32e-002 | M42: 113.5 | N42: 29.21 | O42: 1.1299999999999999 | P42: 43.68 | Q42: 转股中 | R42: 5.20年 | S42: 3.21年 | T42: 12 | U42: 40 | V42: 3.6000000000000004e-002 | W42: 0.25 | X42: 0.109 | Y42: 48 | Z42: 1.26 | AA42: 4.0099999999999997e-002 | AB42: 3.5000000000000003e-002 | AC42: 3.39e-002 | AD42: 3.15e-002 | AE42: 84.2 | AF42: 82.43 | AG42: 0.04 | AH42: AA- | AI42: 6.4899999999999999e-002 | AJ42: =H42+100*O42 -> 205.91999999999999 | AK42: 142.2 | AL42: 265 | AM42: 58 | AN42: 289 | AO42: -6.4000000000000001e-002 | AP42: 20 | AQ42: 城地转债!
A43: 296 | B43: 113524 | C43: 奇精转债! | D43: 603677 | E43: 奇精机械 | F43: 家电 | G43: 零部件制 | H43: 102.27 | I43: 4.4000000000000003e-003 | J43: -2.2000000000000001e-003 | K43: 10.99 | L43: 6.4000000000000003e-003 | M43: 117.3 | N43: 13.98 | O43: 0.30099999999999999 | P43: 78.61 | Q43: 转股中 | R43: 3.58年 | S43: 1.59年 | T43: 3.3 | U43: 5.5 | V43: 1.6e-002 | W43: 0.156 | X43: 0.12300000000000001 | Y43: 21 | Z43: 2.15 | AA43: 3.9800000000000002e-002 | AB43: 3.0800000000000001e-002 | AC43: 3.0000000000000001e-003 | AD43: -2.0000000000000001e-004 | AE43: 92.38 | AF43: 94.5 | AG43: 0.34 | AH43: AA- | AI43: 6.3399999999999998e-002 | AJ43: =H43+100*O43 -> 132.37 | AK43: 125.9 | AL43: 126 | AM43: 31.4 | AN43: 116 | AO43: 6.0000000000000001e-003 | AP43: 45 | AQ43: 奇精转债!
A44: 74 | B44: 123076 | C44: 强力转债! | D44: 300429 | E44: 强力新材 | F44: 化工 | G44: 化工 | H44: 95.961 | I44: 3.7000000000000002e-003 | J44: -2.3999999999999998e-003 | K44: 10.66 | L44: 6.6e-003 | M44: 118.5 | N44: 18.98 | O44: 0.70900000000000007 | P44: 56.16 | Q44: 11天 | R44: 5.52年 | S44: 3.52年 | T44: 8.5 | U44: 6 | V44: 6.9999999999999993e-003 | W44: 0.155 | X44: 8.6999999999999994e-002 | Y44: 55 | Z44: 3.11 | AA44: 3.9800000000000002e-002 | AB44: 3.3599999999999998e-002 | AC44: 2.1899999999999999e-002 | AD44: 1.9699999999999999e-002 | AE44: 82.56 | AF44: 84.37 | AG44: 0.19 | AH44: AA- | AI44: 6.4899999999999999e-002 | AJ44: =H44+100*O44 -> 166.86099999999999 | AK44: 135.8 | AL44: 231 | AM44: 51.4 | AN44: 264 | AO44: -6.9999999999999993e-003 | AP44: 14 | AQ44: 强力转债!
A45: 279 | B45: 123023 | C45: 迪森转债! | D45: 300335 | E45: 迪森股份 | F45: 能源电力 | G45: 电力供应 | H45: 98.8 | I45: 2.0099999999999996e-002 | J45: -1.46e-002 | K45: 4.89 | L45: 2.9500000000000002e-002 | M45: 114.3 | N45: 7.04 | O45: 0.42200000000000004 | P45: 69.46 | Q45: 转股中 | R45: 3.85年 | S45: 2.85年 | T45: 5.29 | U45: 33 | V45: 6.4000000000000001e-002 | W45: 0.28999999999999998 | X45: 0.20100000000000001 | Y45: 18 | Z45: 1.31 | AA45: 3.9300000000000002e-002 | AB45: 3.2300000000000002e-002 | AC45: 1.95e-002 | AD45: 1.6399999999999998e-002 | AE45: 92.47 | AF45: 97.7 | AG45: 0.19 | AH45: AA | AI45: 4.24e-002 | AJ45: =H45+100*O45 -> 141. | AK45: 128.1 | AL45: 154 | AM45: 30.4 | AN45: 103 | AO45: 3.2000000000000001e-002 | AP45: 51 | AQ45: 迪森转债!
A46: 115 | B46: 128127 | C46: 文科转债! | D46: 2775 | E46: 文科园林 | F46: 城市公用 | G46: 生态环境 | H46: 99.5 | I46: 0. | J46: 5.8999999999999999e-003 | K46: 5.16 | L46: 9.7999999999999997e-003 | M46: 121.3 | N46: 5.37 | O46: 3.5000000000000003e-002 | P46: 96.09 | Q46: 转股中 | R46: 5.27年 | S46: 3.27年 | T46: 9.5 | U46: 43 | V46: 4.5999999999999999e-002 | W46: 0.35899999999999999 | X46: 0.34499999999999997 | Y46: 26 | Z46: 1.12 | AA46: 3.9300000000000002e-002 | AB46: 3.1899999999999998e-002 | AC46: 1.38e-002 | AD46: 1.1299999999999999e-002 | AE46: 84.22 | AF46: 87.8 | AG46: 0.61 | AH46: AA- | AI46: 6.4899999999999999e-002 | AJ46: =H46+100*O46 -> 103. | AK46: 102.9 | AL46: 2 | AM46: 15.1 | AN46: 7 | AO46: 3.9e-002 | AP46: 41 | AQ46: 文科转债!
A47: 140 | B47: 123059 | C47: 银信转债! | D47: 300231 | E47: 银信科技 | F47: 计算机及 | G47: 软件开发 | H47: 102.255 | I47: 8.9999999999999998e-004 | J47: 1.1299999999999999e-002 | K47: 7.58 | L47: 2.8500000000000001e-002 | M47: 124.1 | N47: 9.72 | O47: 0.311 | P47: 77.98 | Q47: 转股中 | R47: 5.17年 | S47: 3.17年 | T47: 3.91 | U47: 64 | V47: 0.151 | W47: 0.11699999999999999 | X47: 9.0999999999999998e-002 | Y47: 34 | Z47: 2.46 | AA47: 3.9e-002 | AB47: 3.0800000000000001e-002 | AC47: 5.1999999999999998e-003 | AD47: 2.8000000000000004e-003 | AE47: 84.55 | AF47: 90.32 | AG47: 0.43 | AH47: AA- | AI47: 6.4899999999999999e-002 | AJ47: =H47+100*O47 -> 133.35499999999999 | AK47: 126.5 | AL47: 130 | AM47: 36.2 | AN47: 167 | AO47: -2.e-003 | AP47: 15 | AQ47: 银信转债!
A48: 316 | B48: 127007 | C48: 湖广转债! | D48: 665 | E48: 湖北广电 | F48: 传媒娱乐 | G48: 影视娱乐 | H48: 100 | I48: 5.0000000000000001e-004 | J48: 2.2000000000000001e-003 | K48: 3.95 | L48: 1.8000000000000002e-002 | M48: 112.3 | N48: 5.58 | O48: 0.41299999999999998 | P48: 70.79 | Q48: 转股中 | R48: 3年44天 | S48: 1年45天 | T48: 12.2 | U48: 3.1 | V48: 3.0000000000000001e-003 | W48: 0.314 | X48: 0.222 | Y48: 39 | Z48: 0.67 | AA48: 3.8800000000000001e-002 | AB48: 3.1099999999999999e-002 | AC48: 2.1899999999999999e-002 | AD48: 1.7500000000000002e-002 | AE48: 97.73 | AF48: 99.52 | AG48: 0.15 | AH48: AA+ | AI48: 4.0399999999999998e-002 | AJ48: =H48+100*O48 -> 141.30000000000001 | AK48: 129.2 | AL48: 165 | AM48: 29.7 | AN48: 94 | AO48: 4.0000000000000001e-003 | AP48: 17 | AQ48: 湖广转债!
A49: 309 | B49: 128042 | C49: 凯中转债! | D49: 2823 | E49: 凯中精密 | F49: 能源电力 | G49: 电力设备 | H49: 103.208 | I49: 3.4000000000000002e-003 | J49: -1.4000000000000002e-003 | K49: 10.2 | L49: 8.8999999999999999e-003 | M49: 116.3 | N49: 12.96 | O49: 0.311 | P49: 78.7 | Q49: 转股中 | R49: 3.21年 | S49: 1.21年 | T49: 4.16 | U49: 0.9 | V49: 2.e-003 | W49: 0.14199999999999999 | X49: 0.11199999999999999 | Y49: 29 | Z49: 2.16 | AA49: 3.8800000000000001e-002 | AB49: 2.9300000000000003e-002 | AC49: -2.8999999999999998e-003 | AD49: -6.8999999999999999e-003 | AE49: 97.14 | AF49: 102.08 | AG49: 0.22 | AH49: AA | AI49: 4.24e-002 | AJ49: =H49+100*O49 -> 134.30799999999999 | AK49: 127.7 | AL49: 148 | AM49: 25.6 | AN49: 51 | AO49: -1.e-003 | AP49: 28 | AQ49: 凯中转债!
A50: 69 | B50: 128139 | C50: 祥鑫转债! | D50: 2965 | E50: 祥鑫科技 | F50: 汽车 | G50: 零部件制 | H50: 98.47 | I50: 2.8999999999999998e-003 | J50: -2.9999999999999997e-004 | K50: 28.09 | L50: 6.0999999999999995e-003 | M50: 121 | N50: 37.28 | O50: 0.307 | P50: 75.35 | Q50: 24天 | R50: 5.55年 | S50: 3.55年 | T50: 6.47 | U50: 7.5 | V50: 1.2e-002 | W50: 0.153 | X50: 0.115 | Y50: 42 | Z50: 2.39 | AA50: 3.8599999999999995e-002 | AB50: 3.1800000000000002e-002 | AC50: 1.4800000000000001e-002 | AD50: 1.26e-002 | AE50: 82.46 | AF50: 85.98 | AG50: 0.43 | AH50: AA- | AI50: 6.4899999999999999e-002 | AJ50: =H50+100*O50 -> 129.16999999999999 | AK50: 121.6 | AL50: 77 | AM50: 35.6 | AN50: 154 | AO50: -9.6999999999999989e-002 | AP50: 11 | AQ50: 祥鑫转债!
A51: 315 | B51: 123010 | C51: 博世转债! | D51: 300422 | E51: 博世科 | F51: 城市公用 | G51: 三废处理 | H51: 100.028 | I51: 5.1999999999999998e-003 | J51: -2.e-003 | K51: 8.63 | L51: 1.6500000000000001e-002 | M51: 112.3 | N51: 12.2 | O51: 0.41399999999999998 | P51: 70.74 | Q51: 转股中 | R51: 3年51天 | S51: 1年52天 | T51: 4.3 | U51: 3 | V51: 6.9999999999999993e-003 | W51: 0.12300000000000001 | X51: 8.6999999999999994e-002 | Y51: 35 | Z51: 1.44 | AA51: 3.8399999999999997e-002 | AB51: 3.0800000000000001e-002 | AC51: 2.1299999999999999e-002 | AD51: 1.7000000000000001e-002 | AE51: 94.93 | AF51: 93 | AG51: 0.2 | AH51: AA- | AI51: 6.3399999999999998e-002 | AJ51: =H51+100*O51 -> 141.428 | AK51: 129.3 | AL51: 167 | AM51: 34.4 | AN51: 140 | AO51: 2.e-003 | AP51: 31 | AQ51: 博世转债!
A52: 56 | B52: 123084 | C52: 高澜转债! | D52: 300499 | E52: 高澜股份 | F52: 能源电力 | G52: 电力设备 | H52: 99.6 | I52: 1.41e-002 | J52: -3.4999999999999996e-003 | K52: 7.86 | L52: 2.4799999999999999e-002 | M52: 121.9 | N52: 11.36 | O52: 0.44 | P52: 69.19 | Q52: 33天 | R52: 5.57年 | S52: 3.58年 | T52: 2.8 | U52: 9.8 | V52: 3.5000000000000003e-002 | W52: 0.128 | X52: 8.900000000000001e-002 | Y52: 22 | Z52: 2.61 | AA52: 3.78e-002 | AB52: 3.0699999999999998e-002 | AC52: 1.3899999999999999e-002 | AD52: 1.1399999999999999e-002 | AE52: 80 | AF52: 81.91 | AG52: 0.42 | AH52: A+ | AI52: 7.5899999999999995e-002 | AJ52: =H52+100*O52 -> 143.59999999999999 | AK52: 130 | AL52: 175 | AM52: 48.1 | AN52: 248 | AO52: -6.3e-002 | AP52: 10 | AQ52: 高澜转债!
A53: 300 | B53: 128049 | C53: 华源转债! | D53: 2787 | E53: 华源控股 | F53: 造纸包装 | G53: 包装材料 | H53: 100.8 | I53: 8.3999999999999995e-003 | J53: -5.3e-003 | K53: 5.88 | L53: 8.6e-003 | M53: 114.5 | N53: 7.42 | O53: 0.27200000000000002 | P53: 79.25 | Q53: 转股中 | R53: 3.54年 | S53: 1.54年 | T53: 3.63 | U53: 1.6 | V53: 4.0000000000000001e-003 | W53: 0.19500000000000001 | X53: 0.155 | Y53: 19 | Z53: 1.24 | AA53: 3.7400000000000003e-002 | AB53: 2.9700000000000001e-002 | AC53: 1.1899999999999999e-002 | AD53: 8.6e-003 | AE53: 92.67 | AF53: 92.53 | AG53: 0.37 | AH53: AA- | AI53: 6.3399999999999998e-002 | AJ53: =H53+100*O53 -> 128. | AK53: 122.4 | AL53: 87 | AM53: 29.7 | AN53: 93 | AO53: -2.4e-002 | AP53: 46 | AQ53: 华源转债!
A54: 265 | B54: 127013 | C54: 创维转债! | D54: 810 | E54: 创维数字 | F54: 电子 | G54: 电子产品 | H54: 101.97 | I54: 7.6e-003 | J54: -3.5999999999999999e-003 | K54: 8.42 | L54: 2.06e-002 | M54: 117.3 | N54: 11.39 | O54: 0.379 | P54: 73.92 | Q54: 转股中 | R54: 3.92年 | S54: 1.92年 | T54: 9.78 | U54: 4.5 | V54: 5.0000000000000001e-003 | W54: 0.109 | X54: 8.1000000000000003e-002 | Y54: 90 | Z54: 2.12 | AA54: 3.7000000000000005e-002 | AB54: 2.8900000000000002e-002 | AC54: 3.9000000000000003e-003 | AD54: 1.2999999999999999e-003 | AE54: 94.32 | AF54: 99.96 | AG54: 0.19 | AH54: AA | AI54: 4.24e-002 | AJ54: =H54+100*O54 -> 139.87 | AK54: 130 | AL54: 176 | AM54: 30.1 | AN54: 98 | AO54: 4.0999999999999995e-002 | AP54: 24 | AQ54: 创维转债!
A55: 51 | B55: 123087 | C55: 明电转债! | D55: 300739 | E55: 明阳电路 | F55: 电子 | G55: 元器件制 | H55: 99.477 | I55: 1.1000000000000001e-003 | J55: 5.0000000000000001e-003 | K55: 13.7 | L55: 1.18e-002 | M55: 121.2 | N55: 16.62 | O55: 0.20699999999999999 | P55: 82.43 | Q55: 38天 | R55: 5.59年 | S55: 4.59年 | T55: 6.73 | U55: 8.5 | V55: 1.3000000000000001e-002 | W55: 0.17600000000000002 | X55: 0.14499999999999999 | Y55: 38 | Z55: 2.7 | AA55: 3.6799999999999999e-002 | AB55: 2.9900000000000003e-002 | AC55: 1.5100000000000001e-002 | AD55: 1.23e-002 | AE55: 79.55 | AF55: 85.95 | AG55: 0.51 | AH55: AA- | AI55: 6.4899999999999999e-002 | AJ55: =H55+100*O55 -> 120.17700000000001 | AK55: 116.5 | AL55: 36 | AM55: 30.6 | AN55: 106 | AO55: -6.7000000000000004e-002 | AP55: 10 | AQ55: 明电转债!
A56: 64 | B56: 123081 | C56: 精研转债! | D56: 300709 | E56: 精研科技 | F56: 电子 | G56: 电子产品 | H56: 99.71 | I56: 5.1000000000000004e-003 | J56: -1.e-003 | K56: 36.36 | L56: 2.0499999999999997e-002 | M56: 121.3 | N56: 64.28 | O56: 0.76300000000000001 | P56: 56.57 | Q56: 26天 | R56: 5.55年 | S56: 3.56年 | T56: 5.7 | U56: 3.5 | V56: 6.0000000000000001e-003 | W56: 0.13600000000000001 | X56: 7.6999999999999999e-002 | Y56: 42 | Z56: 2.64 | AA56: 3.6699999999999997e-002 | AB56: 2.98e-002 | AC56: 1.21e-002 | AD56: 9.7999999999999997e-003 | AE56: 82.67 | AF56: 86.19 | AG56: 0.2 | AH56: AA- | AI56: 6.4899999999999999e-002 | AJ56: =H56+100*O56 -> 176.00999999999999 | AK56: 142.9 | AL56: 267 | AM56: 56.7 | AN56: 287 | AO56: -6.7000000000000004e-002 | AP56: 6 | AQ56: 精研转债!
A57: 15 | B57: 123106 | C57: 正丹转债 | D57: 300641 | E57: 正丹股份 | F57: 化工 | G57: 化工 | H57: 102.4 | I57: 8.6999999999999994e-003 | J57: 1.0700000000000001e-002 | K57: 6.7 | L57: 3.5499999999999997e-002 | M57: 125.5 | N57: 7.52 | O57: 0.14899999999999999 | P57: 89.1 | Q57: 4月19天 | R57: 5.86年 | S57: 3.86年 | T57: 3.2 | U57: 23 | V57: 7.0999999999999994e-002 | W57: 9.8000000000000004e-002 | X57: 8.6999999999999994e-002 | Y57: 33 | Z57: 2.35 | AA57: 3.6000000000000004e-002 | AB57: 2.8399999999999998e-002 | AC57: 3.4999999999999996e-003 | AD57: 1.6000000000000001e-003 | AE57: 80.8 | AF57: 87.41 | AG57: 0.55 | AH57: AA- | AI57: 6.4899999999999999e-002 | AJ57: =H57+100*O57 -> 117.30000000000001 | AK57: 115.7 | AL57: 32 | AM57: 28.3 | AN57: 80 | AO57: 2.e-003 | AP57: 7 | AQ57: 正丹转债
A58: 54 | B58: 123085 | C58: 万顺转2! | D58: 300057 | E58: 万顺新材 | F58: 有色金属 | G58: 铝金属 | H58: 93.66 | I58: 7.0999999999999995e-003 | J58: 3.2000000000000002e-003 | K58: 4.71 | L58: 2.1700000000000001e-002 | M58: 113.3 | N58: 6.24 | O58: 0.24100000000000002 | P58: 75.48 | Q58: 34天 | R58: 5.58年 | S58: 3.58年 | T58: 9 | U58: 14 | V58: 1.6e-002 | W58: 0.28300000000000003 | X58: 0.214 | Y58: 32 | Z58: 0.89 | AA58: 3.5400000000000001e-002 | AB58: 3.0800000000000001e-002 | AC58: 2.81e-002 | AD58: 2.6000000000000002e-002 | AE58: 82.22 | AF58: 80.38 | AG58: 0.47 | AH58: AA- | AI58: 6.4899999999999999e-002 | AJ58: =H58+100*O58 -> 117.75999999999999 | AK58: 111.8 | AL58: 15 | AM58: 29.6 | AN58: 92 | AO58: 8.0000000000000002e-003 | AP58: 19 | AQ58: 万顺转2!
A59: 239 | B59: 113546 | C59: 迪贝转债! | D59: 603320 | E59: 迪贝电气 | F59: 家电 | G59: 零部件制 | H59: 103.77 | I59: 6.7000000000000002e-003 | J59: -6.3e-003 | K59: 11.19 | L59: 8.9999999999999998e-004 | M59: 120.6 | N59: 14.1 | O59: 0.308 | P59: 79.36 | Q59: 转股中 | R59: 4.44年 | S59: 2.44年 | T59: 2.3 | U59: 1.1 | V59: 5.0000000000000001e-003 | W59: 0.158 | X59: 0.125 | Y59: 15 | Z59: 2.1 | AA59: 3.5200000000000002e-002 | AB59: 2.69e-002 | AC59: 5.9999999999999995e-004 | AD59: -2.3e-003 | AE59: 86.39 | AF59: 88.36 | AG59: 0.45 | AH59: A+ | AI59: 7.4400000000000008e-002 | AJ59: =H59+100*O59 -> 134.56999999999999 | AK59: 128.2 | AL59: 155 | AM59: 39.8 | AN59: 197 | AO59: 6.0000000000000001e-003 | AP59: 40 | AQ59: 迪贝转债!
A60: 289 | B60: 128056 | C60: 今飞转债! | D60: 2863 | E60: 今飞凯达 | F60: 汽车 | G60: 零部件制 | H60: 105.741 | I60: -6.9999999999999993e-003 | J60: 9.7999999999999997e-003 | K60: 5.11 | L60: 7.9000000000000008e-003 | M60: 120.2 | N60: 6.7 | O60: 0.38600000000000001 | P60: 76.27 | Q60: 转股中 | R60: 3.79年 | S60: 1.79年 | T60: 1.72 | U60: 10 | V60: 5.5e-002 | W60: 6.7000000000000004e-002 | X60: 5.0999999999999997e-002 | Y60: 25 | Z60: 1.37 | AA60: 3.5099999999999999e-002 | AB60: 2.5499999999999998e-002 | AC60: -1.1599999999999999e-002 | AD60: -1.49e-002 | AE60: 89.91 | AF60: 92.08 | AG60: 0.35 | AH60: A+ | AI60: 7.4400000000000008e-002 | AJ60: =H60+100*O60 -> 144.34100000000001 | AK60: 135.2 | AL60: 225 | AM60: 43.1 | AN60: 217 | AO60: -1.8000000000000002e-002 | AP60: 55 | AQ60: 今飞转债!
A61: 149 | B61: 113591 | C61: 胜达转债! | D61: 603687 | E61: 大胜达 | F61: 造纸包装 | G61: 包装用纸 | H61: 102.96 | I61: 4.5000000000000005e-003 | J61: -1.2999999999999999e-003 | K61: 8.22 | L61: 7.4000000000000003e-003 | M61: 122.2 | N61: 10.46 | O61: 0.31 | P61: 78.59 | Q61: 转股中 | R61: 5年47天 | S61: 3年48天 | T61: 5.5 | U61: 4.4 | V61: 8.0000000000000002e-003 | W61: 0.16300000000000001 | X61: 0.128 | Y61: 34 | Z61: 1.96 | AA61: 3.4799999999999998e-002 | AB61: 2.7000000000000003e-002 | AC61: 3.4999999999999996e-003 | AD61: 1.e-003 | AE61: 84.85 | AF61: 89.19 | AG61: 0.43 | AH61: AA- | AI61: 6.4899999999999999e-002 | AJ61: =H61+100*O61 -> 133.95999999999998 | AK61: 127.3 | AL61: 143 | AM61: 38.1 | AN61: 187 | AO61: -6.2e-002 | AP61: 25 | AQ61: 胜达转债!
A62: 268 | B62: 113534 | C62: 鼎胜转债! | D62: 603876 | E62: 鼎胜新材 | F62: 有色金属 | G62: 小金属 | H62: 100.28 | I62: 4.3e-003 | J62: -5.4000000000000003e-003 | K62: 12.69 | L62: -3.0999999999999999e-003 | M62: 114.3 | N62: 15.18 | O62: 0.20000000000000001 | P62: 83.6 | Q62: 转股中 | R62: 3.90年 | S62: 1.90年 | T62: 12 | U62: 8.4 | V62: 6.9999999999999993e-003 | W62: 0.218 | X62: 0.182 | Y62: 55 | Z62: 1.52 | AA62: 3.4700000000000002e-002 | AB62: 2.7799999999999998e-002 | AC62: 1.21e-002 | AD62: 9.3999999999999986e-003 | AE62: 94.38 | AF62: 97.48 | AG62: 0.34 | AH62: AA | AI62: 4.24e-002 | AJ62: =H62+100*O62 -> 120.28 | AK62: 117 | AL62: 37 | AM62: 19.5 | AN62: 14 | AO62: 4.0000000000000001e-003 | AP62: 36 | AQ62: 鼎胜转债!
A63: 153 | B63: 123056 | C63: 雪榕转债! | D63: 300511 | E63: 雪榕生物 | F63: 农业 | G63: 种植业 | H63: 102.196 | I63: 2.2000000000000001e-003 | J63: 2.7000000000000001e-003 | K63: 8.76 | L63: 1.2699999999999999e-002 | M63: 121.1 | N63: 11.77 | O63: 0.373 | P63: 74.43 | Q63: 转股中 | R63: 5年40天 | S63: 3年41天 | T63: 5.84 | U63: 2.9 | V63: 5.0000000000000001e-003 | W63: 0.151 | X63: 0.11199999999999999 | Y63: 39 | Z63: 1.87 | AA63: 3.4500000000000003e-002 | AB63: 2.7099999999999999e-002 | AC63: 5.5000000000000005e-003 | AD63: 3.0999999999999999e-003 | AE63: 84.86 | AF63: 88.47 | AG63: 0.38 | AH63: AA- | AI63: 6.4899999999999999e-002 | AJ63: =H63+100*O63 -> 139.49599999999998 | AK63: 130 | AL63: 174 | AM63: 41.5 | AN63: 207 | AO63: -6.9000000000000006e-002 | AP63: 16 | AQ63: 雪榕转债!
A64: 22 | B64: 123102 | C64: 华自转债 | D64: 300490 | E64: 华自科技 | F64: 机械装备 | G64: 机器人及 | H64: 105 | I64: 1.6500000000000001e-002 | J64: 1.49e-002 | K64: 9.3 | L64: 5.0799999999999998e-002 | M64: 126.9 | N64: 9.28 | O64: 4.8000000000000001e-002 | P64: 100.22 | Q64: 4月7天 | R64: 5.82年 | S64: 3.83年 | T64: 6.7 | U64: 50 | V64: 7.0999999999999994e-002 | W64: 0.28100000000000003 | X64: 0.28199999999999997 | Y64: 24 | Z64: 1.36 | AA64: 3.3799999999999997e-002 | AB64: 2.5899999999999999e-002 | AC64: 0. | AD64: -2.3999999999999998e-003 | AE64: 81.89 | AF64: 88.72 | AG64: 0.62 | AH64: AA- | AI64: 6.4899999999999999e-002 | AJ64: =H64+100*O64 -> 109.8 | AK64: 109.8 | AL64: 10 | AM64: 21.1 | AN64: 21 | AO64: 2.7000000000000003e-002 | AP64: 15 | AQ64: 华自转债
A65: 86 | B65: 123074 | C65: 隆利转债 | D65: 300752 | E65: 隆利科技 | F65: 电子 | G65: 液晶显示 | H65: 103.86 | I65: -6.8999999999999999e-003 | J65: -7.000000000000001e-004 | K65: 24.1 | L65: -1.5900000000000001e-002 | M65: 124 | N65: 29.41 | O65: 0.26700000000000002 | P65: 81.94 | Q65: 转股中 | R65: 5.46年 | S65: 3.46年 | T65: 3.25 | U65: 22 | V65: 6.5000000000000002e-002 | W65: 0.11199999999999999 | X65: 9.1999999999999998e-002 | Y65: 29 | Z65: 3.35 | AA65: 3.3700000000000001e-002 | AB65: 2.6000000000000002e-002 | AC65: 2.0000000000000001e-004 | AD65: -1.9e-003 | AE65: 82.93 | AF65: 88.6 | AG65: 0.48 | AH65: AA- | AI65: 6.4899999999999999e-002 | AJ65: =H65+100*O65 -> 130.56 | AK65: 125.8 | AL65: 124 | AM65: 37.2 | AN65: 182 | AO65: -8.3000000000000004e-002 | AP65: 14 | AQ65: 隆利转债
A66: 20 | B66: 123105 | C66: 拓尔转债 | D66: 300229 | E66: 拓尔思 | F66: 计算机及 | G66: 软件开发 | H66: 100.28 | I66: -2.0000000000000001e-004 | J66: 4.0999999999999995e-003 | K66: 8.26 | L66: 7.3000000000000001e-003 | M66: 121 | N66: 9.98 | O66: 0.21199999999999999 | P66: 82.77 | Q66: 4月14天 | R66: 5.84年 | S66: 3.85年 | T66: 8 | U66: 23 | V66: 2.8999999999999998e-002 | W66: 0.13500000000000001 | X66: 0.11199999999999999 | Y66: 59 | Z66: 2.72 | AA66: 3.3300000000000003e-002 | AB66: 2.69e-002 | AC66: 9.0000000000000011e-003 | AD66: 7.0999999999999995e-003 | AE66: 80.94 | AF66: 84.39 | AG66: 0.53 | AH66: AA- | AI66: 6.4899999999999999e-002 | AJ66: =H66+100*O66 -> 121.48 | AK66: 117.8 | AL66: 43 | AM66: 33.4 | AN66: 132 | AO66: -2.2000000000000002e-002 | AP66: 4 | AQ66: 拓尔转债
A67: 162 | B67: 113584 | C67: 家悦转债! | D67: 603708 | E67: 家家悦 | F67: 商业零售 | G67: 超市 | H67: 98.13 | I67: 1.5300000000000001e-002 | J67: -1.47e-002 | K67: 16.95 | L67: 1.9900000000000001e-002 | M67: 115.3 | N67: 37.97 | O67: 1.2 | P67: 44.64 | Q67: 转股中 | R67: 5年21天 | S67: 3年22天 | T67: 6.45 | U67: 3.9 | V67: 6.0000000000000001e-003 | W67: 6.3e-002 | X67: 2.7999999999999997e-002 | Y67: 103 | Z67: 3.66 | AA67: 3.3099999999999997e-002 | AB67: 2.7400000000000001e-002 | AC67: 1.78e-002 | AD67: 1.54e-002 | AE67: 90.51 | AF67: 93.22 | AG67: 0.03 | AH67: AA | AI67: 4.3899999999999995e-002 | AJ67: =H67+100*O67 -> 218.13 | AK67: 151.6 | AL67: 304 | AM67: 58.4 | AN67: 291 | AO67: -9.6000000000000002e-002 | AP67: 12 | AQ67: 家悦转债!
A68: 33 | B68: 123096 | C68: 思创转债 | D68: 300078 | E68: 思创医惠 | F68: 通信互联 | G68: 物联网 | H68: 103.401 | I68: 8.8000000000000005e-003 | J68: -3.4999999999999996e-003 | K68: 7 | L68: 1.01e-002 | M68: 124 | N68: 8.27 | O68: 0.222 | P68: 84.64 | Q68: 2月20天 | R68: 5.70年 | S68: 3.70年 | T68: 8.17 | U68: 8.6 | V68: 1.e-002 | W68: 0.13400000000000001 | X68: 0.114 | Y68: 61 | Z68: 2.04 | AA68: 3.3000000000000002e-002 | AB68: 2.5600000000000001e-002 | AC68: 1.2999999999999999e-003 | AD68: -7.000000000000001e-004 | AE68: 81.67 | AF68: 87.25 | AG68: 0.52 | AH68: AA- | AI68: 6.4899999999999999e-002 | AJ68: =H68+100*O68 -> 125.601 | AK68: 122.2 | AL68: 82 | AM68: 34.9 | AN68: 148 | AO68: -6.2e-002 | AP68: 4 | AQ68: 思创转债
A69: 280 | B69: 110056 | C69: 亨通转债! | D69: 600487 | E69: 亨通光电 | F69: 通信互联 | G69: 通信设备 | H69: 101.16 | I69: -1.e-003 | J69: 3.0999999999999999e-003 | K69: 11.68 | L69: 8.6e-003 | M69: 114.3 | N69: 15.01 | O69: 0.29999999999999999 | P69: 77.81 | Q69: 转股中 | R69: 3.84年 | S69: 1.85年 | T69: 17.1 | U69: 3.1 | V69: 2.e-003 | W69: 6.2e-002 | X69: 4.8000000000000001e-002 | Y69: 276 | Z69: 1.37 | AA69: 3.2899999999999999e-002 | AB69: 2.5899999999999999e-002 | AC69: 8.1000000000000013e-003 | AD69: 5.3e-003 | AE69: 94.97 | AF69: 98.43 | AG69: 0.25 | AH69: AA+ | AI69: 4.0399999999999998e-002 | AJ69: =H69+100*O69 -> 131.16 | AK69: 124.5 | AL69: 114 | AM69: 26.1 | AN69: 56 | AO69: -1.4999999999999999e-002 | AP69: 29 | AQ69: 亨通转债!
A70: 202 | B70: 113566 | C70: 翔港转债! | D70: 603499 | E70: 翔港科技 | F70: 造纸包装 | G70: 包装材料 | H70: 106.58 | I70: -1.52e-002 | J70: 1.41e-002 | K70: 8.38 | L70: -2.3999999999999998e-003 | M70: 124 | N70: 10.77 | O70: 0.37 | P70: 77.81 | Q70: 转股中 | R70: 4.79年 | S70: 2.79年 | T70: 1.61 | U70: 18 | V70: 0.105 | W70: 9.5000000000000001e-002 | X70: 7.400000000000001e-002 | Y70: 17 | Z70: 2.98 | AA70: 3.2799999999999996e-002 | AB70: 2.41e-002 | AC70: -7.8000000000000005e-003 | AD70: -1.0500000000000001e-002 | AE70: 84.44 | AF70: 88.61 | AG70: 0.45 | AH70: A+ | AI70: 7.4400000000000008e-002 | AJ70: =H70+100*O70 -> 143.57999999999998 | AK70: 135.4 | AL70: 228 | AM70: 46.7 | AN70: 241 | AO70: 2.3e-002 | AP70: 29 | AQ70: 翔港转债!
A71: 150 | B71: 128116 | C71: 瑞达转债! | D71: 2961 | E71: 瑞达期货 | F71: 金融 | G71: 期货行业 | H71: 98.2 | I71: 4.1999999999999997e-003 | J71: 1.4800000000000001e-002 | K71: 20.89 | L71: 6.8000000000000005e-002 | M71: 115.3 | N71: 29.55 | O71: 0.38900000000000001 | P71: 70.69 | Q71: 转股中 | R71: 5年45天 | S71: 3年46天 | T71: 6.5 | U71: 40 | V71: 6.2e-002 | W71: 7.0000000000000007e-002 | X71: 4.9000000000000002e-002 | Y71: 93 | Z71: 4.74 | AA71: 3.2500000000000001e-002 | AB71: 2.69e-002 | AC71: 1.6899999999999998e-002 | AD71: 1.47e-002 | AE71: 90.18 | AF71: 92.95 | AG71: 0.28 | AH71: AA | AI71: 4.3899999999999995e-002 | AJ71: =H71+100*O71 -> 137.09999999999999 | AK71: 125.7 | AL71: 123 | AM71: 32.8 | AN71: 127 | AO71: -1.4999999999999999e-002 | AP71: 18 | AQ71: 瑞达转债!
A72: 362 | B72: 110031 | C72: 航信转债!! | D72: 600271 | E72: 航天信息 | F72: 计算机及 | G72: 软件开发 | H72: 106.73 | I72: 2.0000000000000001e-004 | J72: -2.0000000000000001e-004 | K72: 13.22 | L72: -1.1200000000000002e-002 | M72: 107 | N72: 21.56 | O72: 0.74099999999999999 | P72: 61.32 | Q72: 转股中 | R72: 29天 | S72: 回售内 | T72: 24 | U72: 44 | V72: 1.7000000000000001e-002 | W72: 9.8000000000000004e-002 | X72: 5.9999999999999998e-002 | Y72: 245 | Z72: 1.97 | AA72: 3.2300000000000002e-002 | AB72: -0.125 | AC72: 回售内 | AD72: 回售内 | AE72: 100.27 | AF72: 106.78 | AG72: 0 | AH72: AAA | AI72: 2.6800000000000001e-002 | AJ72: =H72+100*O72 -> 180.82999999999998 | AK72: 152.1 | AL72: 305 | AM72: 45.4 | AN72: 233 | AO72: 6.6000000000000003e-002 | AP72: 15 | AQ72: 航信转债!!
A73: 338 | B73: 123004 | C73: 铁汉转债! | D73: 300197 | E73: 节能铁汉 | F73: 城市公用 | G73: 生态环境 | H73: 100.39 | I73: 6.3e-003 | J73: 2.9999999999999997e-004 | K73: 3.05 | L73: 3.04e-002 | M73: 108.8 | N73: 3.82 | O73: 0.25700000000000001 | P73: 79.84 | Q73: 转股中 | R73: 2.60年 | S73: 0.60年 | T73: 8.03 | U73: 7.4 | V73: 9.0000000000000011e-003 | W73: 9.3000000000000013e-002 | X73: 7.400000000000001e-002 | Y73: 86 | Z73: 1.31 | AA73: 3.1899999999999998e-002 | AB73: 2.53e-002 | AC73: 1.52e-002 | AD73: 1.11e-002 | AE73: 98.52 | AF73: 98.29 | AG73: 0.22 | AH73: AA | AI73: 4.0500000000000001e-002 | AJ73: =H73+100*O73 -> 126.09 | AK73: 120.9 | AL73: 69 | AM73: 22.4 | AN73: 27 | AO73: -2.9999999999999999e-002 | AP73: 47 | AQ73: 铁汉转债!
A74: 198 | B74: 113568 | C74: 新春转债! | D74: 603667 | E74: 五洲新春 | F74: 机械装备 | G74: 通用设备 | H74: 107.3 | I74: 2.1600000000000001e-002 | J74: 1.24e-002 | K74: 8.87 | L74: 5.8499999999999996e-002 | M74: 124.3 | N74: 8.91 | O74: 7.8e-002 | P74: 99.55 | Q74: 转股中 | R74: 4.81年 | S74: 2.81年 | T74: 3.3 | U74: 26 | V74: 7.2999999999999995e-002 | W74: 0.127 | X74: 0.127 | Y74: 26 | Z74: 1.46 | AA74: 3.1800000000000002e-002 | AB74: 2.3e-002 | AC74: -9.7999999999999997e-003 | AD74: -1.2500000000000001e-002 | AE74: 86.96 | AF74: 93.12 | AG74: 0.58 | AH74: AA- | AI74: 6.3399999999999998e-002 | AJ74: =H74+100*O74 -> 115.09999999999999 | AK74: 115 | AL74: 26 | AM74: 21.9 | AN74: 24 | AO74: 6.5000000000000002e-002 | AP74: 50 | AQ74: 新春转债!
A75: 171 | B75: 113578 | C75: 全筑转债! | D75: 603030 | E75: 全筑股份 | F75: 建筑 | G75: 装饰工程 | H75: 101.37 | I75: 5.6000000000000008e-003 | J75: -5.0000000000000001e-004 | K75: 4.51 | L75: 1.3500000000000002e-002 | M75: 117.9 | N75: 5.43 | O75: 0.22 | P75: 83.06 | Q75: 转股中 | R75: 4.93年 | S75: 2.93年 | T75: 3.84 | U75: 4.1 | V75: 1.1000000000000001e-002 | W75: 0.158 | X75: 0.13100000000000001 | Y75: 24 | Z75: 1.07 | AA75: 3.1699999999999999e-002 | AB75: 2.5000000000000001e-002 | AC75: 6.5000000000000006e-003 | AD75: 4.3e-003 | AE75: 91 | AF75: 96.42 | AG75: 0.37 | AH75: AA | AI75: 4.24e-002 | AJ75: =H75+100*O75 -> 123.37 | AK75: 119.7 | AL75: 57 | AM75: 23.3 | AN75: 34 | AO75: 1.7000000000000001e-002 | AP75: 20 | AQ75: 全筑转债!
A76: 264 | B76: 110058 | C76: 永鼎转债! | D76: 600105 | E76: 永鼎股份 | F76: 通信互联 | G76: 通信设备 | H76: 101.44 | I76: 8.8999999999999999e-003 | J76: -1.0500000000000001e-002 | K76: 3.56 | L76: -8.3999999999999995e-003 | M76: 114.3 | N76: 5.04 | O76: 0.436 | P76: 70.63 | Q76: 转股中 | R76: 3.92年 | S76: 1.92年 | T76: 2.61 | U76: 13 | V76: 4.9000000000000002e-002 | W76: 5.2999999999999999e-002 | X76: 3.7999999999999999e-002 | Y76: 49 | Z76: 1.76 | AA76: 3.15e-002 | AB76: 2.46e-002 | AC76: 6.4000000000000003e-003 | AD76: 3.8e-003 | AE76: 94.31 | AF76: 97.4 | AG76: 0.19 | AH76: AA | AI76: 4.24e-002 | AJ76: =H76+100*O76 -> 145.03999999999999 | AK76: 132.2 | AL76: 195 | AM76: 34.8 | AN76: 146 | AO76: 5.5999999999999994e-002 | AP76: 49 | AQ76: 永鼎转债!
A77: 354 | B77: 128014 | C77: 永东转债! | D77: 2753 | E77: 永东股份 | F77: 化工 | G77: 化工 | H77: 103.516 | I77: 0. | J77: -2.0000000000000001e-004 | K77: 8.66 | L77: -6.8999999999999999e-003 | M77: 109.8 | N77: 12.6 | O77: 0.50600000000000001 | P77: 68.73 | Q77: 转股中 | R77: 1.93年 | S77: 回售内 | T77: 3.37 | U77: 3.2 | V77: 9.0000000000000011e-003 | W77: 0.10400000000000001 | X77: 7.0999999999999994e-002 | Y77: 33 | Z77: 1.64 | AA77: 3.1300000000000001e-002 | AB77: 2.1600000000000001e-002 | AC77: 回售内 | AD77: 回售内 | AE77: 100.3 | AF77: 97.98 | AG77: 0.03 | AH77: AA- | AI77: 6.1500000000000006e-002 | AJ77: =H77+100*O77 -> 154.11600000000001 | AK77: 138.3 | AL77: 245 | AM77: 38 | AN77: 186 | AO77: 2.8999999999999998e-002 | AP77: 39 | AQ77: 永东转债!
A78: 249 | B78: 128072 | C78: 翔鹭转债! | D78: 2842 | E78: 翔鹭钨业 | F78: 有色金属 | G78: 小金属 | H78: 101.201 | I78: -1.1699999999999999e-002 | J78: 6.8000000000000005e-003 | K78: 10.42 | L78: -1.7000000000000001e-002 | M78: 115.1 | N78: 15.34 | O78: 0.48999999999999999 | P78: 67.93 | Q78: 转股中 | R78: 4.27年 | S78: 2.27年 | T78: 3.02 | U78: 87 | V78: 0.28399999999999997 | W78: 0.106 | X78: 7.2000000000000008e-002 | Y78: 29 | Z78: 3.06 | AA78: 3.1300000000000001e-002 | AB78: 2.4700000000000003e-002 | AC78: 9.1000000000000004e-003 | AD78: 6.3e-003 | AE78: 89.2 | AF78: 89.07 | AG78: 0.29 | AH78: AA- | AI78: 6.3399999999999998e-002 | AJ78: =H78+100*O78 -> 150.20099999999999 | AK78: 134.5 | AL78: 217 | AM78: 45.3 | AN78: 232 | AO78: 4.0999999999999995e-002 | AP78: 28 | AQ78: 翔鹭转债!
A79: 237 | B79: 110059 | C79: 浦发转债! | D79: 600000 | E79: 浦发银行 | F79: 金融 | G79: 银行行业 | H79: 102.92 | I79: 1.7000000000000001e-003 | J79: 2.9999999999999997e-004 | K79: 10.19 | L79: 9.8999999999999991e-003 | M79: 117.6 | N79: 14.45 | O79: 0.45899999999999996 | P79: 70.52 | Q79: 转股中 | R79: 4.45年 | S79: 无权 | T79: 500 | U79: 152 | V79: 3.0000000000000001e-003 | W79: 0.16699999999999998 | X79: 0.11800000000000001 | Y79: 2991. | Z79: 0.55 | AA79: 3.1300000000000001e-002 | AB79: 2.4e-002 | AC79: 无权 | AD79: 无权 | AE79: 无权 | AF79: 100.34 | AG79: 0.19 | AH79: AAA | AI79: 3.7400000000000003e-002 | AJ79: =H79+100*O79 -> 148.81999999999999 | AK79: 135.3 | AL79: 227 | AM79: 35 | AN79: 149 | AO79: -1.3999999999999999e-002 | AP79: 67 | AQ79: 浦发转债!
A80: 183 | B80: 127016 | C80: 鲁泰转债! | D80: 726 | E80: 鲁 泰Ａ | F80: 服装纺织 | G80: 纺织行业 | H80: 100 | I80: -7.000000000000001e-004 | J80: 2.9999999999999997e-004 | K80: 6.27 | L80: -1.6000000000000001e-003 | M80: 115.9 | N80: 8.91 | O80: 0.42100000000000004 | P80: 70.37 | Q80: 转股中 | R80: 4.90年 | S80: 2.90年 | T80: 14 | U80: 0.9 | V80: 1.e-003 | W80: 0.26000000000000001 | X80: 0.183 | Y80: 54 | Z80: 0.7 | AA80: 3.1099999999999999e-002 | AB80: 2.5099999999999997e-002 | AC80: 1.1000000000000001e-002 | AD80: 8.8000000000000005e-003 | AE80: 91.65 | AF80: 95.79 | AG80: 0.22 | AH80: AA+ | AI80: 4.0399999999999998e-002 | AJ80: =H80+100*O80 -> 142.09999999999999 | AK80: 129.6 | AL80: 172 | AM80: 33.8 | AN80: 137 | AO80: 1.8000000000000002e-002 | AP80: 22 | AQ80: 鲁泰转债!
A81: 342 | B81: 128022 | C81: 众信转债! | D81: 2707 | E81: 众信旅游 | F81: 旅游餐饮 | G81: 旅游 | H81: 100.799 | I81: -3.4999999999999996e-003 | J81: 3.5999999999999999e-003 | K81: 5.39 | L81: 1.9e-003 | M81: 108.8 | N81: 7.92 | O81: 0.48100000000000004 | P81: 68.06 | Q81: 转股中 | R81: 2.55年 | S81: 0.55年 | T81: 4.56 | U81: 2.2 | V81: 5.0000000000000001e-003 | W81: 9.3000000000000013e-002 | X81: 6.4000000000000001e-002 | Y81: 49 | Z81: 7.31 | AA81: 3.0899999999999997e-002 | AB81: 2.41e-002 | AC81: 1.04e-002 | AD81: 6.0999999999999995e-003 | AE81: 97.31 | AF81: 93.66 | AG81: 0.05 | AH81: AA- | AI81: 6.1500000000000006e-002 | AJ81: =H81+100*O81 -> 148.899 | AK81: 133.5 | AL81: 206 | AM81: 36.2 | AN81: 168 | AO81: -0.11599999999999999 | AP81: 32 | AQ81: 众信转债!
A82: 137 | B82: 113593 | C82: 沪工转债 | D82: 603131 | E82: 上海沪工 | F82: 机械装备 | G82: 通用设备 | H82: 104.23 | I82: -4.5000000000000005e-003 | J82: 1.11e-002 | K82: 18.09 | L82: 1.1699999999999999e-002 | M82: 121.6 | N82: 21.32 | O82: 0.22800000000000001 | P82: 84.85 | Q82: 转股中 | R82: 5.18年 | S82: 3.18年 | T82: 4 | U82: 33 | V82: 8.0000000000000002e-002 | W82: 7.0000000000000007e-002 | X82: 5.9000000000000004e-002 | Y82: 58 | Z82: 4.37 | AA82: 3.0899999999999997e-002 | AB82: 2.35e-002 | AC82: 1.1000000000000001e-003 | AD82: -1.6000000000000001e-003 | AE82: 82.12 | AF82: 84.03 | AG82: 0.56 | AH82: A+ | AI82: 7.5899999999999995e-002 | AJ82: =H82+100*O82 -> 127.03 | AK82: 123.6 | AL82: 103 | AM82: 39.6 | AN82: 195 | AO82: -8.5999999999999993e-002 | AP82: 10 | AQ82: 沪工转债
A83: 160 | B83: 123053 | C83: 宝通转债! | D83: 300031 | E83: 宝通科技 | F83: 通信互联 | G83: 互联网 | H83: 104.5 | I83: -9.4999999999999998e-003 | J83: 1.3000000000000001e-002 | K83: 16.75 | L83: 7.8000000000000005e-003 | M83: 121.3 | N83: 20.8 | O83: 0.29799999999999999 | P83: 80.53 | Q83: 转股中 | R83: 5年21天 | S83: 3年22天 | T83: 5 | U83: 2.7 | V83: 5.0000000000000001e-003 | W83: 7.4999999999999997e-002 | X83: 6.0999999999999999e-002 | Y83: 66 | Z83: 2.16 | AA83: 3.0699999999999998e-002 | AB83: 2.3099999999999999e-002 | AC83: -8.0000000000000004e-004 | AD83: -3.4000000000000002e-003 | AE83: 85.33 | AF83: 88.96 | AG83: 0.45 | AH83: AA- | AI83: 6.4899999999999999e-002 | AJ83: =H83+100*O83 -> 134.30000000000001 | AK83: 128.5 | AL83: 159 | AM83: 39.5 | AN83: 194 | AO83: 5.2000000000000005e-002 | AP83: 10 | AQ83: 宝通转债!
A84: 25 | B84: 113620 | C84: 傲农转债 | D84: 603363 | E84: 傲农生物 | F84: 农业 | G84: 畜牧业 | H84: 101.83 | I84: 1.e-004 | J84: 2.8999999999999998e-003 | K84: 11.63 | L84: 8.6999999999999994e-003 | M84: 121.1 | N84: 14.8 | O84: 0.29600000000000004 | P84: 78.58 | Q84: 4月5天 | R84: 5.82年 | S84: 3.82年 | T84: 10 | U84: 14 | V84: 1.3999999999999999e-002 | W84: 0.128 | X84: 0.10000000000000001 | Y84: 78 | Z84: 2.7 | AA84: 3.0699999999999998e-002 | AB84: 2.4300000000000002e-002 | AC84: 4.4000000000000003e-003 | AD84: 2.5999999999999999e-003 | AE84: 87.41 | AF84: 94.7 | AG84: 0.35 | AH84: AA | AI84: 4.3899999999999995e-002 | AJ84: =H84+100*O84 -> 131.43000000000001 | AK84: 125.1 | AL84: 116 | AM84: 30.4 | AN84: 100 | AO84: -8.6999999999999994e-002 | AP84: 4 | AQ84: 傲农转债
A85: 287 | B85: 113021 | C85: 中信转债! | D85: 601998 | E85: 中信银行 | F85: 金融 | G85: 银行行业 | H85: 105.58 | I85: 8.0000000000000004e-004 | J85: 5.0000000000000001e-004 | K85: 5.32 | L85: 5.6999999999999993e-003 | M85: 118 | N85: 6.98 | O85: 0.38500000000000001 | P85: 76.22 | Q85: 转股中 | R85: 3.80年 | S85: 无权 | T85: 400 | U85: 41 | V85: 1.e-003 | W85: 0.154 | X85: 0.11699999999999999 | Y85: 2603. | Z85: 0.54 | AA85: 3.0499999999999999e-002 | AB85: 2.18e-002 | AC85: 无权 | AD85: 无权 | AE85: 无权 | AF85: 103.02 | AG85: 0.21 | AH85: AAA | AI85: 3.7400000000000003e-002 | AJ85: =H85+100*O85 -> 144.07999999999998 | AK85: 134.9 | AL85: 223 | AM85: 31.9 | AN85: 121 | AO85: 2.e-003 | AP85: 47 | AQ85: 中信转债!
A86: 35 | B86: 113042 | C86: 上银转债! | D86: 601229 | E86: 上海银行 | F86: 金融 | G86: 银行行业 | H86: 102.36 | I86: 2.3e-003 | J86: 1.9e-003 | K86: 8.42 | L86: 1.32e-002 | M86: 120.9 | N86: 11.03 | O86: 0.34100000000000003 | P86: 76.34 | Q86: 2月16天 | R86: 5.70年 | S86: 无权 | T86: 200 | U86: 104 | V86: 5.0000000000000001e-003 | W86: 0.16699999999999998 | X86: 0.128 | Y86: 1196. | Z86: 0.69 | AA86: 3.0499999999999999e-002 | AB86: 2.3799999999999998e-002 | AC86: 无权 | AD86: 无权 | AE86: 无权 | AF86: 97.85 | AG86: 0.31 | AH86: AAA | AI86: 3.8900000000000004e-002 | AJ86: =H86+100*O86 -> 136.46000000000001 | AK86: 128.4 | AL86: 158 | AM86: 30.5 | AN86: 104 | AO86: 1.4999999999999999e-002 | AP86: 12 | AQ86: 上银转债!
A87: 295 | B87: 113525 | C87: 台华转债! | D87: 603055 | E87: 台华新材 | F87: 服装纺织 | G87: 纺织行业 | H87: 102.86 | I87: 3.8e-003 | J87: -3.4000000000000002e-003 | K87: 6.14 | L87: 1.6000000000000001e-003 | M87: 114.3 | N87: 7.83 | O87: 0.312 | P87: 78.42 | Q87: 转股中 | R87: 3.59年 | S87: 1.59年 | T87: 4.69 | U87: 0.4 | V87: 1.e-003 | W87: 9.1999999999999998e-002 | X87: 7.2000000000000008e-002 | Y87: 51 | Z87: 1.68 | AA87: 3.04e-002 | AB87: 2.29e-002 | AC87: -2.9999999999999997e-004 | AD87: -3.4000000000000002e-003 | AE87: 95.61 | AF87: 98.74 | AG87: 0.26 | AH87: AA | AI87: 4.24e-002 | AJ87: =H87+100*O87 -> 134.06 | AK87: 127.3 | AL87: 142 | AM87: 28.6 | AN87: 83 | AO87: 8.0000000000000002e-003 | AP87: 21 | AQ87: 台华转债!
A88: 225 | B88: 128083 | C88: 新北转债! | D88: 2376 | E88: 新北洋 | F88: 电子 | G88: 电子产品 | H88: 100.456 | I88: 8.0000000000000004e-004 | J88: 1.2999999999999999e-003 | K88: 9.18 | L88: 6.6e-003 | M88: 114.9 | N88: 11.7 | O88: 0.28000000000000003 | P88: 78.46 | Q88: 转股中 | R88: 4.58年 | S88: 2.58年 | T88: 8.77 | U88: 5.2 | V88: 6.0000000000000001e-003 | W88: 0.14400000000000002 | X88: 0.113 | Y88: 61 | Z88: 1.76 | AA88: 3.04e-002 | AB88: 2.4300000000000002e-002 | AC88: 1.0700000000000001e-002 | AD88: 8.199999999999999e-003 | AE88: 92.36 | AF88: 95.37 | AG88: 0.32 | AH88: AA | AI88: 4.24e-002 | AJ88: =H88+100*O88 -> 128.45600000000002 | AK88: 122.5 | AL88: 91 | AM88: 27.1 | AN88: 67 | AO88: -4.0000000000000001e-003 | AP88: 19 | AQ88: 新北转债!
A89: 184 | B89: 113033 | C89: 利群转债! | D89: 601366 | E89: 利群股份 | F89: 商业零售 | G89: 商场 | H89: 99.8 | I89: 1.2999999999999999e-003 | J89: -1.2999999999999999e-003 | K89: 6.23 | L89: 0. | M89: 114.9 | N89: 7.01 | O89: 0.12300000000000001 | P89: 88.87 | Q89: 转股中 | R89: 4.88年 | S89: 2.88年 | T89: 18 | U89: 11 | V89: 6.0000000000000001e-003 | W89: 0.33600000000000002 | X89: 0.29799999999999999 | Y89: 54 | Z89: 1.15 | AA89: 2.9900000000000003e-002 | AB89: 2.41e-002 | AC89: 1.18e-002 | AD89: 9.5999999999999992e-003 | AE89: 91.2 | AF89: 94.18 | AG89: 0.46 | AH89: AA | AI89: 4.24e-002 | AJ89: =H89+100*O89 -> 112.09999999999999 | AK89: 110.7 | AL89: 12 | AM89: 16.5 | AN89: 11 | AO89: -3.3000000000000002e-002 | AP89: 51 | AQ89: 利群转债!
A90: 164 | B90: 123051 | C90: 今天转债 | D90: 300532 | E90: 今天国际 | F90: 计算机及 | G90: 软件开发 | H90: 106.2 | I90: 1.3899999999999999e-002 | J90: -2.5000000000000001e-003 | K90: 7.84 | L90: 1.95e-002 | M90: 122.8 | N90: 8.7 | O90: 0.17800000000000002 | P90: 90.11 | Q90: 转股中 | R90: 5年20天 | S90: 3年21天 | T90: 2.79 | U90: 10 | V90: 3.5000000000000003e-002 | W90: 0.13 | X90: 0.11699999999999999 | Y90: 21 | Z90: 2.75 | AA90: 2.9900000000000003e-002 | AB90: 2.1899999999999999e-002 | AC90: -4.4000000000000003e-003 | AD90: -7.1999999999999998e-003 | AE90: 83.02 | AF90: 85.69 | AG90: 0.58 | AH90: A+ | AI90: 7.5899999999999995e-002 | AJ90: =H90+100*O90 -> 124. | AK90: 122.3 | AL90: 85 | AM90: 36.6 | AN90: 173 | AO90: -4.9000000000000002e-002 | AP90: 15 | AQ90: 今天转债
A91: 175 | B91: 123049 | C91: 维尔转债 | D91: 300190 | E91: 维尔利 | F91: 城市公用 | G91: 三废处理 | H91: 108 | I91: 2.3700000000000002e-002 | J91: 2.7099999999999999e-002 | K91: 7.16 | L91: 9.1499999999999998e-002 | M91: 124.3 | N91: 7.48 | O91: 0.128 | P91: 95.72 | Q91: 转股中 | R91: 4.91年 | S91: 2.92年 | T91: 9.17 | U91: 772 | V91: 0.748 | W91: 0.16399999999999998 | X91: 0.157 | Y91: 56 | Z91: 1.29 | AA91: 2.9700000000000001e-002 | AB91: 2.1099999999999997e-002 | AC91: -1.1599999999999999e-002 | AD91: -1.4199999999999999e-002 | AE91: 86.41 | AF91: 92.52 | AG91: 0.56 | AH91: AA- | AI91: 6.3399999999999998e-002 | AJ91: =H91+100*O91 -> 120.8 | AK91: 120.3 | AL91: 61 | AM91: 27.8 | AN91: 74 | AO91: 3.2000000000000001e-002 | AP91: 16 | AQ91: 维尔转债
A92: 38 | B92: 123093 | C92: 金陵转债 | D92: 300651 | E92: 金陵体育 | F92: 其他 | G92: 文化教育 | H92: 110 | I92: -2.7000000000000001e-003 | J92: -1.7000000000000001e-003 | K92: 43.2 | L92: -7.6e-003 | M92: 129.3 | N92: 49.29 | O92: 0.255 | P92: 87.64 | Q92: 2月13天 | R92: 5.68年 | S92: 3.69年 | T92: 2.5 | U92: 32 | V92: 0.11699999999999999 | W92: 4.4999999999999998e-002 | X92: 3.9e-002 | Y92: 56 | Z92: 8.06 | AA92: 2.9700000000000001e-002 | AB92: 2.1000000000000001e-002 | AC92: -8.6999999999999994e-003 | AD92: -1.18e-002 | AE92: 80.58 | AF92: 86.36 | AG92: 0.58 | AH92: A+ | AI92: 7.5899999999999995e-002 | AJ92: =H92+100*O92 -> 135.5 | AK92: 132.4 | AL92: 199 | AM92: 46 | AN92: 236 | AO92: -4.7e-002 | AP92: 5 | AQ92: 金陵转债
A93: 350 | B93: 113014 | C93: 林洋转债! | D93: 601222 | E93: 林洋能源 | F93: 能源电力 | G93: 电力设备 | H93: 101.92 | I93: 1.2e-002 | J93: 3.4999999999999996e-003 | K93: 6.97 | L93: 6.7400000000000002e-002 | M93: 109.3 | N93: 8.54 | O93: 0.249 | P93: 81.62 | Q93: 转股中 | R93: 2.45年 | S93: 0.45年 | T93: 30 | U93: 38 | V93: 1.2e-002 | W93: 0.24600000000000002 | X93: 0.20100000000000001 | Y93: 122 | Z93: 1.17 | AA93: 2.9399999999999999e-002 | AB93: 2.2000000000000002e-002 | AC93: -1.9e-003 | AD93: -7.6e-003 | AE93: 99.33 | AF93: 99.33 | AG93: 0.23 | AH93: AA | AI93: 4.0500000000000001e-002 | AJ93: =H93+100*O93 -> 126.81999999999999 | AK93: 122.2 | AL93: 84 | AM93: 22.9 | AN93: 30 | AO93: 3.5000000000000003e-002 | AP93: 31 | AQ93: 林洋转债!
A94: 145 | B94: 113036 | C94: 宁建转债! | D94: 601789 | E94: 宁波建工 | F94: 建筑 | G94: 建筑工程 | H94: 101.38 | I94: 5.7999999999999996e-003 | J94: 8.0000000000000004e-004 | K94: 3.9 | L94: 1.83e-002 | M94: 117.3 | N94: 4.86 | O94: 0.26300000000000001 | P94: 80.25 | Q94: 转股中 | R94: 5年52天 | S94: 3年53天 | T94: 5.4 | U94: 1.7 | V94: 3.0000000000000001e-003 | W94: 0.14199999999999999 | X94: 0.114 | Y94: 38 | Z94: 1.21 | AA94: 2.9399999999999999e-002 | AB94: 2.3199999999999998e-002 | AC94: 7.1999999999999998e-003 | AD94: 5.0000000000000001e-003 | AE94: 90.18 | AF94: 94.48 | AG94: 0.36 | AH94: AA | AI94: 4.3899999999999995e-002 | AJ94: =H94+100*O94 -> 127.67999999999999 | AK94: 122.5 | AL94: 93 | AM94: 28 | AN94: 77 | AO94: 2.7000000000000003e-002 | AP94: 9 | AQ94: 宁建转债!
A95: 55 | B95: 123086 | C95: 海兰转债! | D95: 300065 | E95: 海兰信 | F95: 电子 | G95: 电子产品 | H95: 105.46 | I95: 4.4000000000000003e-003 | J95: 4.5000000000000005e-003 | K95: 10.56 | L95: 1.44e-002 | M95: 123.5 | N95: 10.88 | O95: 8.6999999999999994e-002 | P95: 97.06 | Q95: 34天 | R95: 5.58年 | S95: 3.58年 | T95: 7.3 | U95: 18 | V95: 2.3e-002 | W95: 0.17399999999999999 | X95: 0.16899999999999998 | Y95: 42 | Z95: 2.83 | AA95: 2.9300000000000003e-002 | AB95: 2.1899999999999999e-002 | AC95: -4.1999999999999997e-003 | AD95: -6.0999999999999995e-003 | AE95: 82.25 | AF95: 87.57 | AG95: 0.61 | AH95: AA- | AI95: 6.4899999999999999e-002 | AJ95: =H95+100*O95 -> 114.16 | AK95: 113.9 | AL95: 20 | AM95: 26.3 | AN95: 58 | AO95: -3.2000000000000001e-002 | AP95: 14 | AQ95: 海兰转债!
A96: 272 | B96: 113532 | C96: 海环转债! | D96: 603817 | E96: 海峡环保 | F96: 城市公用 | G96: 三废处理 | H96: 100.61 | I96: 6.8999999999999999e-003 | J96: 6.7000000000000002e-003 | K96: 6.06 | L96: 4.4800000000000006e-002 | M96: 112.3 | N96: 7.69 | O96: 0.27699999999999997 | P96: 78.8 | Q96: 转股中 | R96: 3.88年 | S96: 1.89年 | T96: 4.59 | U96: 21 | V96: 4.4999999999999998e-002 | W96: 0.16800000000000001 | X96: 0.13300000000000001 | Y96: 27 | Z96: 1.54 | AA96: 2.92e-002 | AB96: 2.3199999999999998e-002 | AC96: 1.06e-002 | AD96: 7.9000000000000008e-003 | AE96: 94.46 | AF96: 95.86 | AG96: 0.3 | AH96: AA | AI96: 4.24e-002 | AJ96: =H96+100*O96 -> 128.31 | AK96: 122.4 | AL96: 89 | AM96: 26.6 | AN96: 61 | AO96: -2.8999999999999998e-002 | AP96: 27 | AQ96: 海环转债!
A97: 120 | B97: 113599 | C97: 嘉友转债! | D97: 603871 | E97: 嘉友国际 | F97: 交通运输 | G97: 物流业 | H97: 108.75 | I97: -5.0000000000000001e-003 | J97: -3.4999999999999996e-003 | K97: 24.68 | L97: -1.44e-002 | M97: 126 | N97: 24.82 | O97: 9.4e-002 | P97: 99.44 | Q97: 转股中 | R97: 5.22年 | S97: 3.23年 | T97: 7.2 | U97: 21 | V97: 2.7000000000000003e-002 | W97: 0.13300000000000001 | X97: 0.13200000000000001 | Y97: 54 | Z97: 2.52 | AA97: 2.92e-002 | AB97: 2.07e-002 | AC97: -1.34e-002 | AD97: -1.5600000000000001e-002 | AE97: 84.15 | AF97: 91.34 | AG97: 0.6 | AH97: AA- | AI97: 6.4899999999999999e-002 | AJ97: =H97+100*O97 -> 118.15000000000001 | AK97: 118.1 | AL97: 45 | AM97: 26.7 | AN97: 63 | AO97: 0.126 | AP97: 20 | AQ97: 嘉友转债!
A98: 124 | B98: 123063 | C98: 大禹转债 | D98: 300021 | E98: 大禹节水 | F98: 化工 | G98: 橡胶塑料 | H98: 109.381 | I98: -7.9000000000000008e-003 | J98: 7.9000000000000008e-003 | K98: 5.1 | L98: 0. | M98: 126.5 | N98: 4.94 | O98: 5.9000000000000004e-002 | P98: 103.24 | Q98: 转股中 | R98: 5.20年 | S98: 4.21年 | T98: 6.38 | U98: 49 | V98: 7.0000000000000007e-002 | W98: 0.157 | X98: 0.16200000000000001 | Y98: 41 | Z98: 2.68 | AA98: 2.8999999999999998e-002 | AB98: 2.0299999999999999e-002 | AC98: -5.1000000000000004e-003 | AD98: -8.1000000000000013e-003 | AE98: 81.72 | AF98: 91.89 | AG98: 0.62 | AH98: AA- | AI98: 6.4899999999999999e-002 | AJ98: =H98+100*O98 -> 115.28100000000001 | AK98: 115.5 | AL98: 29 | AM98: 23.6 | AN98: 39 | AO98: 2.6000000000000002e-002 | AP98: 16 | AQ98: 大禹转债
A99: 5 | B99: 123112 | C99: 万讯转债 | D99: 300112 | E99: 万讯自控 | F99: 机械装备 | G99: 专用设备 | H99: 105.49 | I99: 6.3e-003 | J99: 1.e-004 | K99: 8.51 | L99: 1.0700000000000001e-002 | M99: 124.4 | N99: 9.13 | O99: 0.13200000000000001 | P99: 93.21 | Q99: 5月3天 | R99: 5.90年 | S99: 3.90年 | T99: 2.46 | U99: 44 | V99: 0.16899999999999998 | W99: 0.10099999999999999 | X99: 9.4e-002 | Y99: 24 | Z99: 2.27 | AA99: 2.8900000000000002e-002 | AB99: 2.1700000000000001e-002 | AC99: -2.8000000000000004e-003 | AD99: -4.7999999999999996e-003 | AE99: 80.98 | AF99: 86.5 | AG99: 0.6 | AH99: AA- | AI99: 6.4899999999999999e-002 | AJ99: =H99+100*O99 -> 118.69 | AK99: 117.8 | AL99: 42 | AM99: 31.3 | AN99: 115 | AO99: 1.6e-002 | AP99: 6 | AQ99: 万讯转债
A100: 326 | B100: 113505 | C100: 杭电转债! | D100: 603618 | E100: 杭电股份 | F100: 能源电力 | G100: 电力设备 | H100: 102.9 | I100: -8.0000000000000004e-004 | J100: 2.3999999999999998e-003 | K100: 6.34 | L100: 4.7999999999999996e-003 | M100: 111.3 | N100: 7.14 | O100: 0.159 | P100: 88.8 | Q100: 转股中 | R100: 2.81年 | S100: 0.81年 | T100: 7.5 | U100: 7.5 | V100: 1.e-002 | W100: 0.17100000000000001 | X100: 0.152 | Y100: 44 | Z100: 1.62 | AA100: 2.8799999999999999e-002 | AB100: 2.1099999999999997e-002 | AC100: -1.1000000000000001e-002 | AD100: -1.4499999999999999e-002 | AE100: 97.93 | AF100: 99.72 | AG100: 0.34 | AH100: AA | AI100: 4.0500000000000001e-002 | AJ100: =H100+100*O100 -> 118.80000000000001 | AK100: 117 | AL100: 38 | AM100: 17.3 | AN100: 12 | AO100: 3.7000000000000005e-002 | AP100: 43 | AQ100: 杭电转债!
A101: 187 | B101: 110068 | C101: 龙净转债! | D101: 600388 | E101: 龙净环保 | F101: 城市公用 | G101: 三废处理 | H101: 100.32 | I101: 2.2000000000000001e-003 | J101: 2.5000000000000001e-003 | K101: 8.8 | L101: 1.2699999999999999e-002 | M101: 114.8 | N101: 10.73 | O101: 0.223 | P101: 82.01 | Q101: 转股中 | R101: 4.86年 | S101: 2.86年 | T101: 20 | U101: 5.1 | V101: 3.0000000000000001e-003 | W101: 0.21299999999999999 | X101: 0.17399999999999999 | Y101: 94 | Z101: 1.55 | AA101: 2.87e-002 | AB101: 2.3e-002 | AC101: 9.7999999999999997e-003 | AD101: 7.6e-003 | AE101: 91.71 | AF101: 95.04 | AG101: 0.37 | AH101: AA+ | AI101: 4.0399999999999998e-002 | AJ101: =H101+100*O101 -> 122.61999999999999 | AK101: 118.6 | AL101: 51 | AM101: 23.6 | AN101: 38 | AO101: 1.7000000000000001e-002 | AP101: 32 | AQ101: 龙净转债!
A102: 181 | B102: 128105 | C102: 长集转债 | D102: 2616 | E102: 长青集团 | F102: 城市公用 | G102: 三废处理 | H102: 100.28 | I102: 6.3e-003 | J102: 8.9999999999999998e-004 | K102: 6.45 | L102: 1.9e-002 | M102: 114.9 | N102: 7.91 | O102: 0.23000000000000001 | P102: 81.54 | Q102: 转股中 | R102: 4.90年 | S102: 2.90年 | T102: 8 | U102: 7.7 | V102: 1.e-002 | W102: 0.16699999999999998 | X102: 0.13600000000000001 | Y102: 48 | Z102: 1.8 | AA102: 2.87e-002 | AB102: 2.3e-002 | AC102: 1.01e-002 | AD102: 7.9000000000000008e-003 | AE102: 91.12 | AF102: 94.09 | AG102: 0.38 | AH102: AA | AI102: 4.24e-002 | AJ102: =H102+100*O102 -> 123.28 | AK102: 119 | AL102: 56 | AM102: 24.9 | AN102: 45 | AO102: -5.4000000000000006e-002 | AP102: 14 | AQ102: 长集转债
A103: 278 | B103: 123024 | C103: 岱勒转债! | D103: 300700 | E103: 岱勒新材 | F103: 机械装备 | G103: 专用设备 | H103: 104.005 | I103: -7.4999999999999997e-003 | J103: 1.3600000000000001e-002 | K103: 14.99 | L103: 1.6299999999999999e-002 | M103: 112.5 | N103: 18.33 | O103: 0.27200000000000002 | P103: 81.78 | Q103: 转股中 | R103: 2.85年 | S103: 0.85年 | T103: 2.1 | U103: 23 | V103: 0.10400000000000001 | W103: 0.17000000000000001 | X103: 0.13900000000000001 | Y103: 12 | Z103: 2.55 | AA103: 2.8199999999999999e-002 | AB103: 2.e-002 | AC103: -2.6099999999999998e-002 | AD103: -2.8399999999999998e-002 | AE103: 94.29 | AF103: 92.35 | AG103: 0.37 | AH103: A+ | AI103: 7.2499999999999995e-002 | AJ103: =H103+100*O103 -> 131.20499999999998 | AK103: 126.2 | AL103: 129 | AM103: 31.9 | AN103: 122 | AO103: -2.3e-002 | AP103: 35 | AQ103: 岱勒转债!
A104: 247 | B104: 128073 | C104: 哈尔转债! | D104: 2615 | E104: 哈尔斯 | F104: 其他 | G104: 家居用品 | H104: 105.43 | I104: -3.1899999999999998e-002 | J104: 1.8500000000000003e-002 | K104: 4.72 | L104: -3.6699999999999997e-002 | M104: 115.3 | N104: 5.7 | O104: 0.27300000000000002 | P104: 82.81 | Q104: 转股中 | R104: 3.27年 | S104: 1.27年 | T104: 2.99 | U104: 103 | V104: 0.32500000000000001 | W104: 0.153 | X104: 0.127 | Y104: 19 | Z104: 2.48 | AA104: 2.8199999999999999e-002 | AB104: 1.9599999999999999e-002 | AC104: -2.2499999999999999e-002 | AD104: -2.52e-002 | AE104: 93.47 | AF104: 94.6 | AG104: 0.36 | AH104: AA- | AI104: 6.3399999999999998e-002 | AJ104: =H104+100*O104 -> 132.73000000000002 | AK104: 128.1 | AL104: 152 | AM104: 33.5 | AN104: 133 | AO104: 9.3000000000000013e-002 | AP104: 40 | AQ104: 哈尔转债!
A105: 122 | B105: 128125 | C105: 华阳转债! | D105: 2949 | E105: 华阳国际 | F105: 建筑 | G105: 建筑工程 | H105: 102.9 | I105: 6.8000000000000005e-003 | J105: -3.3e-003 | K105: 18.3 | L105: 9.3999999999999986e-003 | M105: 118.5 | N105: 25.79 | O105: 0.45000000000000001 | P105: 70.96 | Q105: 转股中 | R105: 5.21年 | S105: 3.21年 | T105: 4.5 | U105: 0.7 | V105: 2.e-003 | W105: 0.125 | X105: 8.900000000000001e-002 | Y105: 36 | Z105: 2.81 | AA105: 2.81e-002 | AB105: 2.1600000000000001e-002 | AC105: 2.7000000000000001e-003 | AD105: 5.0000000000000001e-004 | AE105: 84.17 | AF105: 86.01 | AG105: 0.37 | AH105: AA- | AI105: 6.4899999999999999e-002 | AJ105: =H105+100*O105 -> 147.90000000000001 | AK105: 134.8 | AL105: 222 | AM105: 48.8 | AN105: 253 | AO105: -4.5999999999999999e-002 | AP105: 6 | AQ105: 华阳转债!
A106: 341 | B106: 128023 | C106: 亚太转债! | D106: 2284 | E106: 亚太股份 | F106: 汽车 | G106: 零部件制 | H106: 103.828 | I106: -8.0000000000000004e-004 | J106: 2.0999999999999999e-003 | K106: 7.34 | L106: 1.1000000000000001e-002 | M106: 111.3 | N106: 10.34 | O106: 0.46299999999999997 | P106: 70.99 | Q106: 转股中 | R106: 2.56年 | S106: 0.56年 | T106: 9.99 | U106: 338 | V106: 0.32500000000000001 | W106: 0.185 | X106: 0.13100000000000001 | Y106: 54 | Z106: 2.17 | AA106: 2.7999999999999997e-002 | AB106: 1.9599999999999999e-002 | AC106: -2.69e-002 | AD106: -3.1600000000000003e-002 | AE106: 98.92 | AF106: 100.73 | AG106: 0.12 | AH106: AA | AI106: 4.0500000000000001e-002 | AJ106: =H106+100*O106 -> 150.12799999999999 | AK106: 136.7 | AL106: 235 | AM106: 35.9 | AN106: 160 | AO106: 8.1000000000000003e-002 | AP106: 70 | AQ106: 亚太转债!
A107: 357 | B107: 128013 | C107: 洪涛转债! | D107: 2325 | E107: 洪涛股份 | F107: 建筑 | G107: 装饰工程 | H107: 106.298 | I107: 5.6999999999999993e-003 | J107: 7.000000000000001e-004 | K107: 2.39 | L107: 1.2699999999999999e-002 | M107: 109.8 | N107: 2.32 | O107: 3.2000000000000001e-002 | P107: 103.02 | Q107: 转股中 | R107: 1.21年 | S107: 回售内 | T107: 11.6 | U107: 14 | V107: 1.2e-002 | W107: 0.38600000000000001 | X107: 0.39700000000000002 | Y107: 30 | Z107: 1.11 | AA107: 2.76e-002 | AB107: 1.21e-002 | AC107: 回售内 | AD107: 回售内 | AE107: 100.3 | AF107: 102.26 | AG107: 0.5 | AH107: AA- | AI107: 6.1500000000000006e-002 | AJ107: =H107+100*O107 -> 109.498 | AK107: 109.6 | AL107: 9 | AM107: 7.3 | AN107: 1 | AO107: -1.e-003 | AP107: 94 | AQ107: 洪涛转债!
A108: 216 | B108: 123039 | C108: 开润转债! | D108: 300577 | E108: 开润股份 | F108: 服装纺织 | G108: 纺织行业 | H108: 107 | I108: 6.0999999999999995e-003 | J108: -1.2999999999999999e-003 | K108: 22.19 | L108: 1.23e-002 | M108: 121 | N108: 30 | O108: 0.44700000000000001 | P108: 73.97 | Q108: 转股中 | R108: 4.62年 | S108: 2.62年 | T108: 2.22 | U108: 2.9 | V108: 1.2e-002 | W108: 4.2000000000000003e-002 | X108: 3.1e-002 | Y108: 53 | Z108: 3.48 | AA108: 2.76e-002 | AB108: 1.95e-002 | AC108: -1.e-002 | AD108: -1.2800000000000001e-002 | AE108: 85.42 | AF108: 87.56 | AG108: 0.39 | AH108: A+ | AI108: 7.4400000000000008e-002 | AJ108: =H108+100*O108 -> 151.69999999999999 | AK108: 140 | AL108: 254 | AM108: 52.5 | AN108: 272 | AO108: -8.0000000000000002e-002 | AP108: 24 | AQ108: 开润转债!
A109: 107 | B109: 123065 | C109: 宝莱转债! | D109: 300246 | E109: 宝莱特 | F109: 医药 | G109: 医疗器械 | H109: 105.41 | I109: -3.6000000000000004e-002 | J109: 3.73e-002 | K109: 18.72 | L109: 1.46e-002 | M109: 121.4 | N109: 40.54 | O109: 1.28 | P109: 46.18 | Q109: 转股中 | R109: 5.31年 | S109: 3.31年 | T109: 2.19 | U109: 196 | V109: 0.83900000000000008 | W109: 8.0000000000000002e-002 | X109: 3.7000000000000005e-002 | Y109: 27 | Z109: 3.08 | AA109: 2.76e-002 | AB109: 2.0400000000000001e-002 | AC109: -3.0000000000000001e-003 | AD109: -5.4000000000000003e-003 | AE109: 84.06 | AF109: 87.63 | AG109: 0.09 | AH109: AA- | AI109: 6.4899999999999999e-002 | AJ109: =H109+100*O109 -> 233.41 | AK109: 164.6 | AL109: 322 | AM109: 77 | AN109: 325 | AO109: -9.4e-002 | AP109: 15 | AQ109: 宝莱转债!
A110: 91 | B110: 123071 | C110: 天能转债! | D110: 300569 | E110: 天能重工 | F110: 能源电力 | G110: 风能 | H110: 104.779 | I110: 2.8999999999999998e-003 | J110: 6.6e-003 | K110: 13.33 | L110: 2.9300000000000003e-002 | M110: 121.1 | N110: 20.05 | O110: 0.57600000000000007 | P110: 66.48 | Q110: 转股中 | R110: 5.44年 | S110: 3.44年 | T110: 7 | U110: 2.6 | V110: 4.0000000000000001e-003 | W110: 0.13100000000000001 | X110: 8.6999999999999994e-002 | Y110: 53 | Z110: 2.24 | AA110: 2.76e-002 | AB110: 2.07e-002 | AC110: -2.e-003 | AD110: -4.1999999999999997e-003 | AE110: 83.12 | AF110: 86.67 | AG110: 0.32 | AH110: AA- | AI110: 6.4899999999999999e-002 | AJ110: =H110+100*O110 -> 162.37900000000002 | AK110: 143.1 | AL110: 269 | AM110: 56.4 | AN110: 284 | AO110: 1.e-003 | AP110: 12 | AQ110: 天能转债!
A111: 57 | B111: 127027 | C111: 靖远转债! | D111: 552 | E111: 靖远煤电 | F111: 煤炭 | G111: 煤炭开采 | H111: 99.477 | I111: -2.0999999999999999e-003 | J111: -6.1999999999999998e-003 | K111: 3.15 | L111: -1.5600000000000001e-002 | M111: 115.3 | N111: 3.33 | O111: 5.2000000000000005e-002 | P111: 94.59 | Q111: 33天 | R111: 5.57年 | S111: 3.58年 | T111: 28 | U111: 57 | V111: 2.e-002 | W111: 0.38900000000000001 | X111: 0.36799999999999999 | Y111: 72 | Z111: 0.9 | AA111: 2.7400000000000001e-002 | AB111: 2.2200000000000001e-002 | AC111: 1.1599999999999999e-002 | AD111: 9.4999999999999998e-003 | AE111: 89.16 | AF111: 92.14 | AG111: 0.54 | AH111: AA+ | AI111: 4.1900000000000007e-002 | AJ111: =H111+100*O111 -> 104.67700000000001 | AK111: 104.4 | AL111: 4 | AM111: 12.2 | AN111: 4 | AO111: 3.3000000000000002e-002 | AP111: 31 | AQ111: 靖远转债!
A112: 148 | B112: 123057 | C112: 美联转债! | D112: 300586 | E112: 美联新材 | F112: 化工 | G112: 橡胶塑料 | H112: 103.59 | I112: -2.3599999999999999e-002 | J112: 2.2499999999999999e-002 | K112: 7.9 | L112: -2.5000000000000001e-003 | M112: 118.2 | N112: 9.91 | O112: 0.29899999999999999 | P112: 79.72 | Q112: 转股中 | R112: 5年47天 | S112: 3年48天 | T112: 2.07 | U112: 57 | V112: 0.26400000000000001 | W112: 5.7000000000000002e-002 | X112: 4.5999999999999999e-002 | Y112: 36 | Z112: 4.86 | AA112: 2.6699999999999998e-002 | AB112: 2.0199999999999999e-002 | AC112: 1.6000000000000001e-003 | AD112: -8.9999999999999998e-004 | AE112: 84.85 | AF112: 86.29 | AG112: 0.47 | AH112: AA- | AI112: 6.4899999999999999e-002 | AJ112: =H112+100*O112 -> 133.49000000000001 | AK112: 127.5 | AL112: 145 | AM112: 41.2 | AN112: 205 | AO112: 1.e-002 | AP112: 17 | AQ112: 美联转债!
A113: 106 | B113: 128131 | C113: 崇达转2! | D113: 2815 | E113: 崇达技术 | F113: 电子 | G113: 元器件制 | H113: 100.4 | I113: 3.0999999999999999e-003 | J113: -2.0000000000000001e-004 | K113: 11.52 | L113: 2.1299999999999999e-002 | M113: 115.2 | N113: 19.54 | O113: 0.70299999999999996 | P113: 58.96 | Q113: 转股中 | R113: 5.32年 | S113: 3.32年 | T113: 14 | U113: 4.1 | V113: 3.0000000000000001e-003 | W113: 0.13800000000000001 | X113: 8.1000000000000003e-002 | Y113: 102 | Z113: 2.41 | AA113: 2.6699999999999998e-002 | AB113: 2.1400000000000002e-002 | AC113: 9.3999999999999986e-003 | AD113: 7.3000000000000001e-003 | AE113: 89.42 | AF113: 92.1 | AG113: 0.14 | AH113: AA | AI113: 4.3899999999999995e-002 | AJ113: =H113+100*O113 -> 170.69999999999999 | AK113: 141.8 | AL113: 261 | AM113: 49.7 | AN113: 256 | AO113: -2.6000000000000002e-002 | AP113: 8 | AQ113: 崇达转2!
A114: 40 | B114: 128143 | C114: 锋龙转债! | D114: 2931 | E114: 锋龙股份 | F114: 机械装备 | G114: 专用设备 | H114: 105.198 | I114: 8.8999999999999999e-003 | J114: -5.9999999999999995e-004 | K114: 15.87 | L114: 1.34e-002 | M114: 121.7 | N114: 17.97 | O114: 0.191 | P114: 88.31 | Q114: 2月1天 | R114: 5.65年 | S114: 3.65年 | T114: 2.45 | U114: 5.9 | V114: 2.3e-002 | W114: 0.109 | X114: 9.6000000000000002e-002 | Y114: 23 | Z114: 3.6 | AA114: 2.6699999999999998e-002 | AB114: 1.9900000000000001e-002 | AC114: -1.4000000000000002e-003 | AD114: -3.8e-003 | AE114: 79.38 | AF114: 81.28 | AG114: 0.62 | AH114: A+ | AI114: 7.5899999999999995e-002 | AJ114: =H114+100*O114 -> 124.298 | AK114: 122.1 | AL114: 81 | AM114: 40.8 | AN114: 203 | AO114: -2.7999999999999997e-002 | AP114: 10 | AQ114: 锋龙转债!
A115: 97 | B115: 123068 | C115: 弘信转债 | D115: 300657 | E115: 弘信电子 | F115: 电子 | G115: 元器件制 | H115: 105.49 | I115: 2.9999999999999997e-004 | J115: 1.3500000000000002e-002 | K115: 16.27 | L115: 2.52e-002 | M115: 121.2 | N115: 18.45 | O115: 0.19600000000000001 | P115: 88.18 | Q115: 转股中 | R115: 5.42年 | S115: 3.42年 | T115: 5.7 | U115: 3.6 | V115: 6.0000000000000001e-003 | W115: 0.10300000000000001 | X115: 8.9999999999999997e-002 | Y115: 56 | Z115: 3.96 | AA115: 2.6499999999999999e-002 | AB115: 1.9599999999999999e-002 | AC115: -3.7000000000000002e-003 | AD115: -5.8999999999999999e-003 | AE115: 83.31 | AF115: 86.86 | AG115: 0.55 | AH115: AA- | AI115: 6.4899999999999999e-002 | AJ115: =H115+100*O115 -> 125.09 | AK115: 122.8 | AL115: 96 | AM115: 35.9 | AN115: 158 | AO115: -8.0000000000000002e-003 | AP115: 7 | AQ115: 弘信转债
A116: 185 | B116: 113574 | C116: 华体转债! | D116: 603679 | E116: 华体科技 | F116: 城市公用 | G116: 城市公用 | H116: 102.45 | I116: 5.6999999999999993e-003 | J116: -3.3e-003 | K116: 18.72 | L116: 1.5700000000000002e-002 | M116: 115.9 | N116: 33.99 | O116: 0.85999999999999999 | P116: 55.08 | Q116: 转股中 | R116: 4.88年 | S116: 2.88年 | T116: 2.09 | U116: 7.8 | V116: 3.6000000000000004e-002 | W116: 7.8e-002 | X116: 4.2999999999999997e-002 | Y116: 27 | Z116: 3.44 | AA116: 2.6200000000000001e-002 | AB116: 2.0099999999999996e-002 | AC116: 5.1999999999999998e-003 | AD116: 2.5999999999999999e-003 | AE116: 83.82 | AF116: 82.34 | AG116: 0.15 | AH116: A+ | AI116: 7.4400000000000008e-002 | AJ116: =H116+100*O116 -> 188.44999999999999 | AK116: 149.8 | AL116: 291 | AM116: 66 | AN116: 318 | AO116: -1.8000000000000002e-002 | AP116: 18 | AQ116: 华体转债!
A117: 158 | B117: 123054 | C117: 思特转债! | D117: 300608 | E117: 思特奇 | F117: 通信互联 | G117: 通信设备 | H117: 107.2 | I117: 5.4600000000000003e-002 | J117: -4.6100000000000002e-002 | K117: 13.01 | L117: 1.9599999999999999e-002 | M117: 121.7 | N117: 16.49 | O117: 0.35899999999999999 | P117: 78.9 | Q117: 转股中 | R117: 5年26天 | S117: 3年27天 | T117: 2.71 | U117: 470 | V117: 1.6100000000000001 | W117: 0.13200000000000001 | X117: 0.10400000000000001 | Y117: 21 | Z117: 2.67 | AA117: 2.6000000000000002e-002 | AB117: 1.84e-002 | AC117: -7.6e-003 | AD117: -1.03e-002 | AE117: 85.58 | AF117: 89.21 | AG117: 0.44 | AH117: AA- | AI117: 6.4899999999999999e-002 | AJ117: =H117+100*O117 -> 143.09999999999999 | AK117: 135.5 | AL117: 229 | AM117: 46.3 | AN117: 237 | AO117: 4.5999999999999999e-002 | AP117: 20 | AQ117: 思特转债!
A118: 138 | B118: 128120 | C118: 联诚转债! | D118: 2921 | E118: 联诚精密 | F118: 汽车 | G118: 零部件制 | H118: 104.03 | I118: 1.1599999999999999e-002 | J118: 4.4900000000000002e-002 | K118: 16.88 | L118: 8.3400000000000002e-002 | M118: 118.4 | N118: 18.44 | O118: 0.13600000000000001 | P118: 91.54 | Q118: 转股中 | R118: 5.17年 | S118: 3.18年 | T118: 2.6 | U118: 257 | V118: 0.91599999999999993 | W118: 0.14499999999999999 | X118: 0.13300000000000001 | Y118: 18 | Z118: 1.74 | AA118: 2.6000000000000002e-002 | AB118: 1.95e-002 | AC118: 1.6000000000000001e-003 | AD118: -1.1000000000000001e-003 | AE118: 79.71 | AF118: 78.19 | AG118: 0.68 | AH118: A | AI118: 8.5900000000000004e-002 | AJ118: =H118+100*O118 -> 117.63 | AK118: 116.5 | AL118: 35 | AM118: 36.8 | AN118: 178 | AO118: -0.17300000000000001 | AP118: 19 | AQ118: 联诚转债!
A119: 174 | B119: 123050 | C119: 聚飞转债 | D119: 300303 | E119: 聚飞光电 | F119: 电子 | G119: LED制 | H119: 109.65 | I119: 2.7000000000000001e-003 | J119: 5.9999999999999995e-004 | K119: 4.85 | L119: 6.1999999999999998e-003 | M119: 123.8 | N119: 5.18 | O119: 0.17100000000000001 | P119: 93.63 | Q119: 转股中 | R119: 4.92年 | S119: 2.92年 | T119: 7.05 | U119: 4.1 | V119: 5.0000000000000001e-003 | W119: 0.114 | X119: 0.106 | Y119: 62 | Z119: 2.52 | AA119: 2.5499999999999998e-002 | AB119: 1.7100000000000001e-002 | AC119: -1.8000000000000002e-002 | AD119: -2.0299999999999999e-002 | AE119: 85.96 | AF119: 92.08 | AG119: 0.54 | AH119: AA- | AI119: 6.3399999999999998e-002 | AJ119: =H119+100*O119 -> 126.75 | AK119: 125.7 | AL119: 121 | AM119: 33.6 | AN119: 135 | AO119: -3.0000000000000001e-003 | AP119: 12 | AQ119: 聚飞转债
A120: 37 | B120: 113619 | C120: 世运转债! | D120: 603920 | E120: 世运电路 | F120: 电子 | G120: 元器件制 | H120: 100.14 | I120: 3.0999999999999999e-003 | J120: -2.7000000000000001e-003 | K120: 15.2 | L120: 2.5999999999999999e-003 | M120: 115.2 | N120: 26.5 | O120: 0.746 | P120: 57.36 | Q120: 2月13天 | R120: 5.69年 | S120: 3.69年 | T120: 10 | U120: 1.2 | V120: 1.e-003 | W120: 0.161 | X120: 9.1999999999999998e-002 | Y120: 62 | Z120: 2.28 | AA120: 2.5399999999999999e-002 | AB120: 2.0400000000000001e-002 | AC120: 9.1999999999999998e-003 | AD120: 7.3000000000000001e-003 | AE120: 88.01 | AF120: 90.64 | AG120: 0.15 | AH120: AA | AI120: 4.3899999999999995e-002 | AJ120: =H120+100*O120 -> 174.74000000000001 | AK120: 142.9 | AL120: 268 | AM120: 52.3 | AN120: 269 | AO120: -0.10099999999999999 | AP120: 4 | AQ120: 世运转债!
A121: 307 | B121: 113516 | C121: 苏农转债! | D121: 603323 | E121: 苏农银行 | F121: 金融 | G121: 银行行业 | H121: 105.73 | I121: 2.5999999999999999e-003 | J121: 2.e-003 | K121: 4.6 | L121: 1.55e-002 | M121: 114.3 | N121: 5.52 | O121: 0.26899999999999996 | P121: 83.33 | Q121: 转股中 | R121: 3.22年 | S121: 无权 | T121: 12.9 | U121: 5.8 | V121: 4.0000000000000001e-003 | W121: 0.155 | X121: 0.13 | Y121: 83 | Z121: 0.68 | AA121: 2.5099999999999997e-002 | AB121: 1.6799999999999999e-002 | AC121: 无权 | AD121: 无权 | AE121: 无权 | AF121: 100.9 | AG121: 0.3 | AH121: AA+ | AI121: 4.0399999999999998e-002 | AJ121: =H121+100*O121 -> 132.63 | AK121: 128.1 | AL121: 153 | AM121: 27.2 | AN121: 68 | AO121: 1.e-003 | AP121: 30 | AQ121: 苏农转债!
A122: 2 | B122: 110080 | C122: 东湖转债 | D122: 600133 | E122: 东湖高新 | F122: 建筑 | G122: 建筑工程 | H122: 99.67 | I122: 5.5000000000000005e-003 | J122: 1.34e-002 | K122: 5.83 | L122: 3.3700000000000001e-002 | M122: 115.1 | N122: 6.16 | O122: 5.2999999999999999e-002 | P122: 94.64 | Q122: 5月5天 | R122: 5.91年 | S122: 3.91年 | T122: 15.5 | U122: 217 | V122: 0.14099999999999999 | W122: 0.33399999999999996 | X122: 0.316 | Y122: 46 | Z122: 0.86 | AA122: 2.5099999999999997e-002 | AB122: 2.0299999999999999e-002 | AC122: 9.5999999999999992e-003 | AD122: 7.9000000000000008e-003 | AE122: 87.07 | AF122: 89.68 | AG122: 0.56 | AH122: AA | AI122: 4.3899999999999995e-002 | AJ122: =H122+100*O122 -> 104.97 | AK122: 104.7 | AL122: 5 | AM122: 15 | AN122: 6 | AO122: 2.1000000000000001e-002 | AP122: 5 | AQ122: 东湖转债
A123: 242 | B123: 128076 | C123: 金轮转债! | D123: 2722 | E123: 金轮股份 | F123: 机械装备 | G123: 专用设备 | H123: 103.253 | I123: -3.9000000000000003e-003 | J123: 1.34e-002 | K123: 12.31 | L123: 1.9900000000000001e-002 | M123: 114.9 | N123: 14.76 | O123: 0.23800000000000002 | P123: 83.4 | Q123: 转股中 | R123: 4.42年 | S123: 2.42年 | T123: 2.14 | U123: 32 | V123: 0.14300000000000002 | W123: 9.9000000000000005e-002 | X123: 8.3000000000000004e-002 | Y123: 22 | Z123: 1.14 | AA123: 2.5000000000000001e-002 | AB123: 1.8700000000000001e-002 | AC123: 5.9999999999999995e-004 | AD123: -2.e-003 | AE123: 88.35 | AF123: 88.09 | AG123: 0.48 | AH123: AA- | AI123: 6.3399999999999998e-002 | AJ123: =H123+100*O123 -> 127.053 | AK123: 123.1 | AL123: 98 | AM123: 34.8 | AN123: 142 | AO123: 8.900000000000001e-002 | AP123: 41 | AQ123: 金轮转债!
A124: 131 | B124: 113037 | C124: 紫银转债 | D124: 601860 | E124: 紫金银行 | F124: 金融 | G124: 银行行业 | H124: 102.15 | I124: 2.5000000000000001e-003 | J124: 5.8999999999999999e-003 | K124: 3.9 | L124: 2.0899999999999998e-002 | M124: 115.8 | N124: 4.75 | O124: 0.24399999999999999 | P124: 82.11 | Q124: 转股中 | R124: 5.19年 | S124: 无权 | T124: 45 | U124: 17 | V124: 4.0000000000000001e-003 | W124: 0.315 | X124: 0.25900000000000001 | Y124: 143 | Z124: 0.97 | AA124: 2.5000000000000001e-002 | AB124: 1.9400000000000001e-002 | AC124: 无权 | AD124: 无权 | AE124: 无权 | AF124: 94.02 | AG124: 0.4 | AH124: AA+ | AI124: 4.1900000000000007e-002 | AJ124: =H124+100*O124 -> 126.55000000000001 | AK124: 122.2 | AL124: 83 | AM124: 28.2 | AN124: 78 | AO124: 1.1000000000000001e-002 | AP124: 19 | AQ124: 紫银转债
A125: 32 | B125: 123097 | C125: 美力转债 | D125: 300611 | E125: 美力科技 | F125: 机械装备 | G125: 通用设备 | H125: 106.1 | I125: 1.44e-002 | J125: 4.5999999999999999e-003 | K125: 9.09 | L125: 2.8300000000000002e-002 | M125: 121.6 | N125: 9.34 | O125: 8.9999999999999997e-002 | P125: 97.32 | Q125: 2月20天 | R125: 5.70年 | S125: 3.71年 | T125: 3 | U125: 11 | V125: 3.4000000000000002e-002 | W125: 0.184 | X125: 0.17899999999999999 | Y125: 16 | Z125: 2.45 | AA125: 2.4700000000000003e-002 | AB125: 1.8000000000000002e-002 | AC125: -3.7000000000000002e-003 | AD125: -6.0000000000000001e-003 | AE125: 79.06 | AF125: 80.9 | AG125: 0.67 | AH125: A+ | AI125: 7.5899999999999995e-002 | AJ125: =H125+100*O125 -> 115.09999999999999 | AK125: 114.9 | AL125: 24 | AM125: 34 | AN125: 139 | AO125: 1.4999999999999999e-002 | AP125: 12 | AQ125: 美力转债
A126: 244 | B126: 128074 | C126: 游族转债!! | D126: 2174 | E126: 游族网络 | F126: 通信互联 | G126: 互联网 | H126: 108.102 | I126: -1.23e-002 | J126: 4.0000000000000002e-004 | K126: 15.39 | L126: -2.35e-002 | M126: 119.9 | N126: 16.97 | O126: 0.192 | P126: 90.69 | Q126: 转股中 | R126: 4.36年 | S126: 2.36年 | T126: 6.83 | U126: 45 | V126: 5.9999999999999998e-002 | W126: 4.8000000000000001e-002 | X126: 4.4000000000000004e-002 | Y126: 141 | Z126: 2.75 | AA126: 2.4500000000000001e-002 | AB126: 1.6399999999999998e-002 | AC126: -1.7600000000000001e-002 | AD126: -2.0199999999999999e-002 | AE126: 93.2 | AF126: 100.41 | AG126: 0.51 | AH126: AA | AI126: 4.24e-002 | AJ126: =H126+100*O126 -> 127.30200000000001 | AK126: 125.5 | AL126: 120 | AM126: 25.1 | AN126: 46 | AO126: 4.4999999999999998e-002 | AP126: 26 | AQ126: 游族转债!!
A127: 230 | B127: 113549 | C127: 白电转债 | D127: 603861 | E127: 白云电器 | F127: 能源电力 | G127: 电力设备 | H127: 103.23 | I127: 2.5000000000000001e-003 | J127: -4.7999999999999996e-003 | K127: 8.08 | L127: -4.8999999999999998e-003 | M127: 114.8 | N127: 8.88 | O127: 0.13500000000000001 | P127: 90.99 | Q127: 转股中 | R127: 4.50年 | S127: 2.51年 | T127: 8.8 | U127: 7.5 | V127: 8.0000000000000002e-003 | W127: 0.247 | X127: 0.22399999999999998 | Y127: 36 | Z127: 1.39 | AA127: 2.4300000000000002e-002 | AB127: 1.8200000000000001e-002 | AC127: 2.9999999999999997e-004 | AD127: -2.2000000000000001e-003 | AE127: 92.54 | AF127: 95.56 | AG127: 0.46 | AH127: AA | AI127: 4.24e-002 | AJ127: =H127+100*O127 -> 116.73 | AK127: 115.5 | AL127: 27 | AM127: 19.9 | AN127: 16 | AO127: 9.0000000000000011e-003 | AP127: 39 | AQ127: 白电转债
A128: 119 | B128: 127021 | C128: 特发转2! | D128: 70 | E128: 特发信息 | F128: 通信互联 | G128: 通信设备 | H128: 102.5 | I128: 8.8999999999999999e-003 | J128: -7.3000000000000001e-003 | K128: 7.48 | L128: 1.3600000000000001e-002 | M128: 113.3 | N128: 12.33 | O128: 0.68999999999999995 | P128: 60.67 | Q128: 转股中 | R128: 4.23年 | S128: 2.23年 | T128: 5.5 | U128: 21 | V128: 3.7999999999999999e-002 | W128: 8.900000000000001e-002 | X128: 5.4000000000000006e-002 | Y128: 62 | Z128: 2.11 | AA128: 2.4300000000000002e-002 | AB128: 1.84e-002 | AC128: -1.8e-003 | AD128: -3.4999999999999996e-003 | AE128: 92.43 | AF128: 95.26 | AG128: 0.11 | AH128: AA | AI128: 4.24e-002 | AJ128: =H128+100*O128 -> 171.5 | AK128: 144.3 | AL128: 279 | AM128: 49.1 | AN128: 255 | AO128: 4.2000000000000003e-002 | AP128: 10 | AQ128: 特发转2!
A129: 43 | B129: 123092 | C129: 天壕转债 | D129: 300332 | E129: 天壕环境 | F129: 石油天然 | G129: 天然气 | H129: 106.71 | I129: 2.e-003 | J129: 4.7999999999999996e-003 | K129: 4.95 | L129: 1.0200000000000001e-002 | M129: 121.6 | N129: 5.2 | O129: 0.121 | P129: 95.19 | Q129: 47天 | R129: 5.61年 | S129: 3.61年 | T129: 4.23 | U129: 71 | V129: 0.153 | W129: 9.6999999999999989e-002 | X129: 9.1999999999999998e-002 | Y129: 44 | Z129: 1.29 | AA129: 2.41e-002 | AB129: 1.7299999999999999e-002 | AC129: -5.3e-003 | AD129: -7.6e-003 | AE129: 79.6 | AF129: 81.45 | AG129: 0.67 | AH129: A+ | AI129: 7.5899999999999995e-002 | AJ129: =H129+100*O129 -> 118.80999999999999 | AK129: 118.2 | AL129: 47 | AM129: 36.8 | AN129: 177 | AO129: 4.4000000000000004e-002 | AP129: 7 | AQ129: 天壕转债
A130: 222 | B130: 128087 | C130: 孚日转债! | D130: 2083 | E130: 孚日股份 | F130: 服装纺织 | G130: 家纺 | H130: 101.5 | I130: 5.3e-003 | J130: -2.8000000000000004e-003 | K130: 4.22 | L130: 4.7999999999999996e-003 | M130: 112.9 | N130: 4.5 | O130: 8.199999999999999e-002 | P130: 93.78 | Q130: 转股中 | R130: 4.59年 | S130: 2.59年 | T130: 6.5 | U130: 12 | V130: 1.8000000000000002e-002 | W130: 0.17000000000000001 | X130: 0.159 | Y130: 38 | Z130: 1.06 | AA130: 2.3900000000000001e-002 | AB130: 1.8600000000000002e-002 | AC130: 6.8000000000000005e-003 | AD130: 4.4000000000000003e-003 | AE130: 92.3 | AF130: 93.66 | AG130: 0.52 | AH130: AA | AI130: 4.24e-002 | AJ130: =H130+100*O130 -> 109.7 | AK130: 109.2 | AL130: 8 | AM130: 15.6 | AN130: 8 | AO130: 8.0000000000000002e-003 | AP130: 58 | AQ130: 孚日转债!
A131: 62 | B131: 128140 | C131: 润建转债! | D131: 2929 | E131: 润建股份 | F131: 通信互联 | G131: 通信设备 | H131: 101.479 | I131: 1.1299999999999999e-002 | J131: 1.1999999999999999e-003 | K131: 23.38 | L131: 2.5399999999999999e-002 | M131: 115.2 | N131: 26.55 | O131: 0.152 | P131: 88.06 | Q131: 28天 | R131: 5.56年 | S131: 3.57年 | T131: 10.9 | U131: 6.7 | V131: 6.0000000000000001e-003 | W131: 0.21100000000000002 | X131: 0.18600000000000003 | Y131: 52 | Z131: 1.63 | AA131: 2.35e-002 | AB131: 1.84e-002 | AC131: 5.8999999999999999e-003 | AD131: 3.9000000000000003e-003 | AE131: 88.46 | AF131: 91.12 | AG131: 0.49 | AH131: AA | AI131: 4.3899999999999995e-002 | AJ131: =H131+100*O131 -> 116.679 | AK131: 114.9 | AL131: 25 | AM131: 23.8 | AN131: 41 | AO131: -1.2e-002 | AP131: 14 | AQ131: 润建转债!
A132: 65 | B132: 123080 | C132: 海波转债! | D132: 300517 | E132: 海波重科 | F132: 建筑 | G132: 建筑工程 | H132: 111.6 | I132: 1.8e-003 | J132: -2.3999999999999998e-003 | K132: 23.17 | L132: -8.9999999999999998e-004 | M132: 126.5 | N132: 20.91 | O132: 6.9999999999999993e-003 | P132: 110.81 | Q132: 25天 | R132: 5.55年 | S132: 3.55年 | T132: 2.45 | U132: 10 | V132: 3.7000000000000005e-002 | W132: 9.9000000000000005e-002 | X132: 0.11 | Y132: 25 | Z132: 2.98 | AA132: 2.3300000000000001e-002 | AB132: 1.5300000000000001e-002 | AC132: -1.7299999999999999e-002 | AD132: -1.9599999999999999e-002 | AE132: 80.02 | AF132: 85.09 | AG132: 0.72 | AH132: A+ | AI132: 7.5899999999999995e-002 | AJ132: =H132+100*O132 -> 112.3 | AK132: 112.4 | AL132: 16 | AM132: 27.3 | AN132: 70 | AO132: -3.0000000000000001e-003 | AP132: 16 | AQ132: 海波转债!
A133: 196 | B133: 113570 | C133: 百达转债! | D133: 603331 | E133: 百达精工 | F133: 机械装备 | G133: 机械装备 | H133: 103.08 | I133: 4.3e-003 | J133: 1.7000000000000001e-003 | K133: 10.12 | L133: 1.e-002 | M133: 114.9 | N133: 11.54 | O133: 0.17499999999999999 | P133: 87.69 | Q133: 转股中 | R133: 4.82年 | S133: 2.82年 | T133: 2.8 | U133: 2.3 | V133: 8.0000000000000002e-003 | W133: 0.155 | X133: 0.13600000000000001 | Y133: 18 | Z133: 2.15 | AA133: 2.3199999999999998e-002 | AB133: 1.7500000000000002e-002 | AC133: 1.1000000000000001e-003 | AD133: -1.1999999999999999e-003 | AE133: 83.58 | AF133: 81.84 | AG133: 0.6 | AH133: A+ | AI133: 7.4400000000000008e-002 | AJ133: =H133+100*O133 -> 120.58 | AK133: 118.5 | AL133: 49 | AM133: 34.9 | AN133: 147 | AO133: 5.0000000000000001e-003 | AP133: 35 | AQ133: 百达转债!
A134: 130 | B134: 128122 | C134: 兴森转债! | D134: 2436 | E134: 兴森科技 | F134: 电子 | G134: 元器件制 | H134: 103.2 | I134: 7.3000000000000001e-003 | J134: -6.4000000000000003e-003 | K134: 8.92 | L134: 6.8000000000000005e-003 | M134: 113.3 | N134: 14.18 | O134: 0.6409999999999999 | P134: 62.91 | Q134: 转股中 | R134: 4.19年 | S134: 3.19年 | T134: 2.69 | U134: 2.6 | V134: 1.e-002 | W134: 2.e-002 | X134: 1.3000000000000001e-002 | Y134: 133 | Z134: 4.14 | AA134: 2.2799999999999997e-002 | AB134: 1.6899999999999998e-002 | AC134: 1.2999999999999999e-003 | AD134: -8.0000000000000004e-004 | AE134: 90.27 | AF134: 95.43 | AG134: 0.13 | AH134: AA | AI134: 4.24e-002 | AJ134: =H134+100*O134 -> 167.30000000000001 | AK134: 143.5 | AL134: 272 | AM134: 48.1 | AN134: 247 | AO134: -4.0999999999999995e-002 | AP134: 11 | AQ134: 兴森转债!
A135: 60 | B135: 127026 | C135: 超声转债! | D135: 823 | E135: 超声电子 | F135: 电子 | G135: 元器件制 | H135: 100.141 | I135: 8.0000000000000004e-004 | J135: 4.1999999999999997e-003 | K135: 10.49 | L135: 1.1599999999999999e-002 | M135: 113.1 | N135: 12.85 | O135: 0.22699999999999998 | P135: 81.63 | Q135: 31天 | R135: 5.57年 | S135: 3.57年 | T135: 7 | U135: 5.8 | V135: 8.0000000000000002e-003 | W135: 0.124 | X135: 0.10099999999999999 | Y135: 56 | Z135: 1.47 | AA135: 2.2499999999999999e-002 | AB135: 1.8100000000000002e-002 | AC135: 9.1999999999999998e-003 | AD135: 7.3000000000000001e-003 | AE135: 88.36 | AF135: 89.44 | AG135: 0.43 | AH135: AA | AI135: 4.3899999999999995e-002 | AJ135: =H135+100*O135 -> 122.84100000000001 | AK135: 118.6 | AL135: 52 | AM135: 29.2 | AN135: 88 | AO135: -6.0000000000000001e-003 | AP135: 9 | AQ135: 超声转债!
A136: 135 | B136: 113594 | C136: 淳中转债! | D136: 603516 | E136: 淳中科技 | F136: 电子 | G136: 电子产品 | H136: 108.71 | I136: -4.8999999999999998e-003 | J136: 7.1999999999999998e-003 | K136: 22.61 | L136: 4.4000000000000003e-003 | M136: 121.4 | N136: 27.84 | O136: 0.33899999999999997 | P136: 81.21 | Q136: 转股中 | R136: 5.18年 | S136: 3.19年 | T136: 3 | U136: 0.8 | V136: 2.e-003 | W136: 7.0999999999999994e-002 | X136: 5.7999999999999996e-002 | Y136: 42 | Z136: 3.08 | AA136: 2.2099999999999998e-002 | AB136: 1.4800000000000001e-002 | AC136: -1.1699999999999999e-002 | AD136: -1.4199999999999999e-002 | AE136: 82.11 | AF136: 83.89 | AG136: 0.53 | AH136: A+ | AI136: 7.5899999999999995e-002 | AJ136: =H136+100*O136 -> 142.60999999999999 | AK136: 136.2 | AL136: 234 | AM136: 52.3 | AN136: 270 | AO136: -0.13400000000000001 | AP136: 9 | AQ136: 淳中转债!
A137: 127 | B137: 123062 | C137: 三超转债 | D137: 300554 | E137: 三超新材 | F137: 机械装备 | G137: 通用设备 | H137: 107.162 | I137: -1.7399999999999999e-002 | J137: 2.3e-002 | K137: 14.78 | L137: 8.8999999999999999e-003 | M137: 119.7 | N137: 17.17 | O137: 0.245 | P137: 86.08 | Q137: 转股中 | R137: 5.20年 | S137: 3.20年 | T137: 1.95 | U137: 70 | V137: 0.33299999999999996 | W137: 0.14099999999999999 | X137: 0.121 | Y137: 14 | Z137: 2.64 | AA137: 2.2000000000000002e-002 | AB137: 1.5300000000000001e-002 | AC137: -7.1999999999999998e-003 | AD137: -9.7999999999999997e-003 | AE137: 79.55 | AF137: 78.86 | AG137: 0.63 | AH137: A | AI137: 8.5900000000000004e-002 | AJ137: =H137+100*O137 -> 131.66200000000001 | AK137: 128.2 | AL137: 156 | AM137: 48.7 | AN137: 252 | AO137: -2.8999999999999998e-002 | AP137: 19 | AQ137: 三超转债
A138: 128 | B138: 128123 | C138: 国光转债! | D138: 2749 | E138: 国光股份 | F138: 化工 | G138: 农化 | H138: 104.148 | I138: 8.199999999999999e-003 | J138: -6.0999999999999995e-003 | K138: 10.09 | L138: 5.0000000000000001e-003 | M138: 116.2 | N138: 13.7 | O138: 0.41399999999999998 | P138: 73.65 | Q138: 转股中 | R138: 5.20年 | S138: 3.20年 | T138: 3.2 | U138: 1.2 | V138: 4.0000000000000001e-003 | W138: 7.2999999999999995e-002 | X138: 5.4000000000000006e-002 | Y138: 44 | Z138: 3.53 | AA138: 2.18e-002 | AB138: 1.6e-002 | AC138: -1.e-004 | AD138: -2.5000000000000001e-003 | AE138: 84.48 | AF138: 84.47 | AG138: 0.42 | AH138: AA- | AI138: 6.4899999999999999e-002 | AJ138: =H138+100*O138 -> 145.548 | AK138: 134.6 | AL138: 219 | AM138: 50.2 | AN138: 259 | AO138: -2.9999999999999999e-002 | AP138: 11 | AQ138: 国光转债!
A139: 18 | B139: 113046 | C139: 金田转债 | D139: 601609 | E139: 金田铜业 | F139: 有色金属 | G139: 铜金属 | H139: 101.64 | I139: -5.9999999999999995e-004 | J139: 5.9999999999999995e-004 | K139: 9.4 | L139: 0. | M139: 114.9 | N139: 10.95 | O139: 0.184 | P139: 85.84 | Q139: 4月16天 | R139: 5.85年 | S139: 3.85年 | T139: 15 | U139: 17 | V139: 1.1000000000000001e-002 | W139: 0.11 | X139: 9.4e-002 | Y139: 137 | Z139: 2.01 | AA139: 2.1499999999999998e-002 | AB139: 1.6799999999999999e-002 | AC139: 4.3e-003 | AD139: 2.7000000000000001e-003 | AE139: 87.78 | AF139: 90.72 | AG139: 0.47 | AH139: AA+ | AI139: 4.1900000000000007e-002 | AJ139: =H139+100*O139 -> 120.03999999999999 | AK139: 117.4 | AL139: 39 | AM139: 26.7 | AN139: 62 | AO139: -3.7000000000000005e-002 | AP139: 8 | AQ139: 金田转债
A140: 67 | B140: 113610 | C140: 灵康转债 | D140: 603669 | E140: 灵康药业 | F140: 医药 | G140: 化学制药 | H140: 107.92 | I140: -6.9999999999999993e-003 | J140: -5.3e-003 | K140: 9.33 | L140: -1.7899999999999999e-002 | M140: 121.1 | N140: 8.81 | O140: 1.9e-002 | P140: 105.9 | Q140: 24天 | R140: 5.55年 | S140: 3.55年 | T140: 5.25 | U140: 17 | V140: 2.9999999999999999e-002 | W140: 7.9000000000000001e-002 | X140: 8.4000000000000005e-002 | Y140: 67 | Z140: 4.73 | AA140: 2.1400000000000002e-002 | AB140: 1.47e-002 | AC140: -9.8999999999999991e-003 | AD140: -1.2e-002 | AE140: 82.55 | AF140: 86.07 | AG140: 0.69 | AH140: AA- | AI140: 6.4899999999999999e-002 | AJ140: =H140+100*O140 -> 109.82000000000001 | AK140: 109.9 | AL140: 11 | AM140: 23.9 | AN140: 42 | AO140: 2.7000000000000003e-002 | AP140: 22 | AQ140: 灵康转债
A141: 76 | B141: 113608 | C141: 威派转债! | D141: 603956 | E141: 威派格 | F141: 机械装备 | G141: 专用设备 | H141: 108.61 | I141: 5.7999999999999996e-003 | J141: 5.5000000000000005e-003 | K141: 17.27 | L141: 1.83e-002 | M141: 121.6 | N141: 19.24 | O141: 0.20999999999999999 | P141: 89.76 | Q141: 转股中 | R141: 5.49年 | S141: 3.49年 | T141: 4.2 | U141: 0.6 | V141: 1.e-003 | W141: 5.7000000000000002e-002 | X141: 5.0999999999999997e-002 | Y141: 74 | Z141: 6.35 | AA141: 2.1299999999999999e-002 | AB141: 1.44e-002 | AC141: -1.03e-002 | AD141: -1.2699999999999999e-002 | AE141: 80.33 | AF141: 82.19 | AG141: 0.62 | AH141: A+ | AI141: 7.5899999999999995e-002 | AJ141: =H141+100*O141 -> 129.61000000000001 | AK141: 127.5 | AL141: 144 | AM141: 45.3 | AN141: 231 | AO141: 6.0000000000000001e-003 | AP141: 7 | AQ141: 威派转债!
A142: 200 | B142: 113567 | C142: 君禾转债! | D142: 603617 | E142: 君禾股份 | F142: 机械装备 | G142: 通用设备 | H142: 107.67 | I142: -1.06e-002 | J142: -2.0000000000000001e-004 | K142: 10.81 | L142: -1.7299999999999999e-002 | M142: 118.8 | N142: 11.46 | O142: 0.14099999999999999 | P142: 94.33 | Q142: 转股中 | R142: 4.80年 | S142: 2.81年 | T142: 2.1 | U142: 2.4 | V142: 1.1000000000000001e-002 | W142: 9.6999999999999989e-002 | X142: 9.1999999999999998e-002 | Y142: 22 | Z142: 3.05 | AA142: 2.12e-002 | AB142: 1.41e-002 | AC142: -1.18e-002 | AD142: -1.43e-002 | AE142: 84.19 | AF142: 84.83 | AG142: 0.63 | AH142: A+ | AI142: 7.4400000000000008e-002 | AJ142: =H142+100*O142 -> 121.77 | AK142: 121 | AL142: 72 | AM142: 36.2 | AN142: 166 | AO142: -3.3000000000000002e-002 | AP142: 34 | AQ142: 君禾转债!
A143: 83 | B143: 123075 | C143: 贝斯转债! | D143: 300580 | E143: 贝斯特 | F143: 汽车 | G143: 零部件制 | H143: 103.37 | I143: 9.8999999999999991e-003 | J143: 2.3999999999999998e-003 | K143: 18.57 | L143: 2.4799999999999999e-002 | M143: 115.5 | N143: 23.99 | O143: 0.33500000000000002 | P143: 77.41 | Q143: 转股中 | R143: 5.47年 | S143: 3.47年 | T143: 6 | U143: 2.1 | V143: 3.0000000000000001e-003 | W143: 0.16200000000000001 | X143: 0.125 | Y143: 37 | Z143: 2.16 | AA143: 2.0899999999999998e-002 | AB143: 1.5700000000000002e-002 | AC143: 1.2999999999999999e-003 | AD143: -8.0000000000000004e-004 | AE143: 82.81 | AF143: 82.49 | AG143: 0.49 | AH143: AA- | AI143: 6.4899999999999999e-002 | AJ143: =H143+100*O143 -> 136.87 | AK143: 129.3 | AL143: 168 | AM143: 46.5 | AN143: 238 | AO143: 2.8999999999999998e-002 | AP143: 8 | AQ143: 贝斯转债!
A144: 144 | B144: 110071 | C144: 湖盐转债! | D144: 600929 | E144: 雪天盐业 | F144: 食品饮料 | G144: 食品饮料 | H144: 103.81 | I144: 2.5000000000000001e-003 | J144: 1.e-004 | K144: 6.28 | L144: 4.7999999999999996e-003 | M144: 115.2 | N144: 6.6 | O144: 9.0999999999999998e-002 | P144: 95.15 | Q144: 转股中 | R144: 5年56天 | S144: 3年57天 | T144: 7.2 | U144: 12 | V144: 1.6e-002 | W144: 0.125 | X144: 0.11900000000000001 | Y144: 58 | Z144: 2.17 | AA144: 2.0799999999999999e-002 | AB144: 1.54e-002 | AC144: -2.9999999999999997e-004 | AD144: -2.5000000000000001e-003 | AE144: 90.04 | AF144: 92.74 | AG144: 0.54 | AH144: AA | AI144: 4.3899999999999995e-002 | AJ144: =H144+100*O144 -> 112.91 | AK144: 112.5 | AL144: 17 | AM144: 19.7 | AN144: 15 | AO144: 2.7000000000000003e-002 | AP144: 18 | AQ144: 湖盐转债!
A145: 99 | B145: 113604 | C145: 多伦转债! | D145: 603528 | E145: 多伦科技 | F145: 计算机及 | G145: 软件开发 | H145: 105.39 | I145: 1.8100000000000002e-002 | J145: 9.7000000000000003e-003 | K145: 9.4 | L145: 4.6799999999999994e-002 | M145: 117.3 | N145: 10.44 | O145: 0.17100000000000001 | P145: 90.04 | Q145: 转股中 | R145: 5.41年 | S145: 3.42年 | T145: 6.4 | U145: 15 | V145: 2.2000000000000002e-002 | W145: 0.109 | X145: 9.8000000000000004e-002 | Y145: 59 | Z145: 3.54 | AA145: 2.0400000000000001e-002 | AB145: 1.46e-002 | AC145: -4.3e-003 | AD145: -6.3e-003 | AE145: 83.06 | AF145: 84.04 | AG145: 0.59 | AH145: AA- | AI145: 6.4899999999999999e-002 | AJ145: =H145+100*O145 -> 122.49000000000001 | AK145: 120.7 | AL145: 67 | AM145: 36.7 | AN145: 175 | AO145: 0.14400000000000002 | AP145: 7 | AQ145: 多伦转债!
A146: 324 | B146: 127006 | C146: 敖东转债! | D146: 623 | E146: 吉林敖东 | F146: 金融 | G146: 证券行业 | H146: 101.561 | I146: 3.5999999999999999e-003 | J146: 1.1000000000000001e-003 | K146: 15.71 | L146: 2.2799999999999997e-002 | M146: 107.4 | N146: 20.42 | O146: 0.32000000000000001 | P146: 76.93 | Q146: 转股中 | R146: 2.83年 | S146: 0.83年 | T146: 24.1 | U146: 7.9 | V146: 3.0000000000000001e-003 | W146: 0.13200000000000001 | X146: 0.10099999999999999 | Y146: 183 | Z146: 0.79 | AA146: 2.0199999999999999e-002 | AB146: 1.5100000000000001e-002 | AC146: -4.8999999999999998e-003 | AD146: -6.9999999999999993e-003 | AE146: 97.34 | AF146: 96.62 | AG146: 0.2 | AH146: AA+ | AI146: 3.85e-002 | AJ146: =H146+100*O146 -> 133.56100000000001 | AK146: 126.2 | AL146: 128 | AM146: 28.9 | AN146: 86 | AO146: 2.4e-002 | AP146: 28 | AQ146: 敖东转债!
A147: 204 | B147: 113565 | C147: 宏辉转债 | D147: 603336 | E147: 宏辉果蔬 | F147: 农业 | G147: 农产品加 | H147: 107.5 | I147: 5.4000000000000003e-003 | J147: 7.4999999999999997e-003 | K147: 9.68 | L147: 2.1099999999999997e-002 | M147: 117.8 | N147: 10 | O147: 0.111 | P147: 96.8 | Q147: 转股中 | R147: 4.79年 | S147: 2.79年 | T147: 2.25 | U147: 83 | V147: 0.34100000000000003 | W147: 6.9000000000000006e-002 | X147: 6.7000000000000004e-002 | Y147: 33 | Z147: 3.12 | AA147: 1.9699999999999999e-002 | AB147: 1.3000000000000001e-002 | AC147: -1.2199999999999999e-002 | AD147: -1.46e-002 | AE147: 86.66 | AF147: 88.34 | AG147: 0.61 | AH147: AA- | AI147: 6.3399999999999998e-002 | AJ147: =H147+100*O147 -> 118.59999999999999 | AK147: 118.2 | AL147: 46 | AM147: 29.9 | AN147: 96 | AO147: 9.0000000000000011e-003 | AP147: 24 | AQ147: 宏辉转债
A148: 102 | B148: 128133 | C148: 奇正转债! | D148: 2287 | E148: 奇正藏药 | F148: 医药 | G148: 中药 | H148: 106.296 | I148: 7.000000000000001e-004 | J148: 1.8799999999999997e-002 | K148: 27.2 | L148: 4.0199999999999993e-002 | M148: 117.3 | N148: 30.12 | O148: 0.17699999999999999 | P148: 90.31 | Q148: 转股中 | R148: 5.36年 | S148: 3.36年 | T148: 8 | U148: 189 | V148: 0.218 | W148: 5.5e-002 | X148: 5.0000000000000003e-002 | Y148: 144 | Z148: 5.57 | AA148: 1.89e-002 | AB148: 1.3100000000000001e-002 | AC148: -6.8000000000000005e-003 | AD148: -8.8000000000000005e-003 | AE148: 89.36 | AF148: 93.62 | AG148: 0.49 | AH148: AA | AI148: 4.3899999999999995e-002 | AJ148: =H148+100*O148 -> 123.99600000000001 | AK148: 122.3 | AL148: 86 | AM148: 28.7 | AN148: 85 | AO148: 8.1000000000000003e-002 | AP148: 15 | AQ148: 奇正转债!
A149: 213 | B149: 113561 | C149: 正裕转债! | D149: 603089 | E149: 正裕工业 | F149: 汽车 | G149: 零部件制 | H149: 108.5 | I149: 6.6e-003 | J149: 1.8e-003 | K149: 9.2 | L149: 1.43e-002 | M149: 118 | N149: 10.23 | O149: 0.20600000000000002 | P149: 89.93 | Q149: 转股中 | R149: 4.63年 | S149: 2.63年 | T149: 1.5 | U149: 8.4 | V149: 5.2000000000000005e-002 | W149: 7.2999999999999995e-002 | X149: 6.6000000000000003e-002 | Y149: 20 | Z149: 1.92 | AA149: 1.8700000000000001e-002 | AB149: 1.1699999999999999e-002 | AC149: -1.46e-002 | AD149: -1.7399999999999999e-002 | AE149: 85.42 | AF149: 85.34 | AG149: 0.58 | AH149: A+ | AI149: 7.4400000000000008e-002 | AJ149: =H149+100*O149 -> 129.09999999999999 | AK149: 127.1 | AL149: 141 | AM149: 41.6 | AN149: 208 | AO149: 5.0000000000000003e-002 | AP149: 34 | AQ149: 正裕转债!
A150: 132 | B150: 123061 | C150: 航新转债! | D150: 300424 | E150: 航新科技 | F150: 航空航天 | G150: 航空航天 | H150: 113.6 | I150: 4.4500000000000005e-002 | J150: 3.5499999999999997e-002 | K150: 14.63 | L150: 0.124 | M150: 124.8 | N150: 14.86 | O150: 0.154 | P150: 98.45 | Q150: 转股中 | R150: 5.19年 | S150: 3.19年 | T150: 2.5 | U150: 3125. | V150: 10.289999999999999 | W150: 7.0999999999999994e-002 | X150: 7.0000000000000007e-002 | Y150: 35 | Z150: 5.26 | AA150: 1.8700000000000001e-002 | AB150: 1.06e-002 | AC150: -2.4300000000000002e-002 | AD150: -2.69e-002 | AE150: 82.22 | AF150: 86.24 | AG150: 0.64 | AH150: A+ | AI150: 7.5899999999999995e-002 | AJ150: =H150+100*O150 -> 129. | AK150: 128.7 | AL150: 160 | AM150: 42.5 | AN150: 210 | AO150: 0.19600000000000001 | AP150: 15 | AQ150: 航新转债!
A151: 53 | B151: 113044 | C151: 大秦转债! | D151: 601006 | E151: 大秦铁路 | F151: 铁路 | G151: 铁路运输 | H151: 104.06 | I151: 6.4000000000000003e-003 | J151: -1.1000000000000001e-003 | K151: 7.09 | L151: 1.e-002 | M151: 114.1 | N151: 7.66 | O151: 0.124 | P151: 92.56 | Q151: 35天 | R151: 5.58年 | S151: 3.59年 | T151: 320 | U151: 457 | V151: 1.3999999999999999e-002 | W151: 0.30399999999999999 | X151: 0.28100000000000003 | Y151: 1054. | Z151: 0.87 | AA151: 1.7000000000000001e-002 | AB151: 1.23e-002 | AC151: -2.9999999999999997e-004 | AD151: -2.3e-003 | AE151: 90.17 | AF151: 92.59 | AG151: 0.53 | AH151: AAA | AI151: 3.8900000000000004e-002 | AJ151: =H151+100*O151 -> 116.46000000000001 | AK151: 115.6 | AL151: 31 | AM151: 23 | AN151: 31 | AO151: 3.2000000000000001e-002 | AP151: 14 | AQ151: 大秦转债!
A152: 191 | B152: 123045 | C152: 雷迪转债 | D152: 300652 | E152: 雷迪克 | F152: 汽车 | G152: 零部件制 | H152: 109.888 | I152: -2.0499999999999997e-002 | J152: 2.7000000000000003e-002 | K152: 17.66 | L152: 1.15e-002 | M152: 118.9 | N152: 20.13 | O152: 0.253 | P152: 87.73 | Q152: 转股中 | R152: 4.82年 | S152: 2.83年 | T152: 1.66 | U152: 70 | V152: 0.38299999999999995 | W152: 0.10000000000000001 | X152: 8.8000000000000009e-002 | Y152: 17 | Z152: 1.75 | AA152: 1.6799999999999999e-002 | AB152: 9.8999999999999991e-003 | AC152: -1.8200000000000001e-002 | AD152: -2.07e-002 | AE152: 84.13 | AF152: 84.77 | AG152: 0.57 | AH152: A+ | AI152: 7.4400000000000008e-002 | AJ152: =H152+100*O152 -> 135.18800000000002 | AK152: 132 | AL152: 193 | AM152: 47.3 | AN152: 243 | AO152: -2.7999999999999997e-002 | AP152: 35 | AQ152: 雷迪转债
A153: 255 | B153: 128070 | C153: 智能转债! | D153: 2877 | E153: 智能自控 | F153: 机械装备 | G153: 通用设备 | H153: 110.1 | I153: -4.0899999999999999e-002 | J153: 4.5999999999999999e-002 | K153: 6.56 | L153: 1.55e-002 | M153: 117.6 | N153: 9.51 | O153: 0.59599999999999997 | P153: 68.98 | Q153: 转股中 | R153: 4年48天 | S153: 无权 | T153: 2.3 | U153: 124 | V153: 0.48399999999999999 | W153: 0.105 | X153: 7.2999999999999995e-002 | Y153: 22 | Z153: 2.95 | AA153: 1.6500000000000001e-002 | AB153: 8.8000000000000005e-003 | AC153: 无权 | AD153: 无权 | AE153: 无权 | AF153: 88.12 | AG153: 0.33 | AH153: A+ | AI153: 7.4400000000000008e-002 | AJ153: =H153+100*O153 -> 169.69999999999999 | AK153: 151.2 | AL153: 300 | AM153: 63.1 | AN153: 312 | AO153: -4.2999999999999997e-002 | AP153: 30 | AQ153: 智能转债!
A154: 46 | B154: 123089 | C154: 九洲转2! | D154: 300040 | E154: 九洲集团 | F154: 能源电力 | G154: 电力设备 | H154: 110.602 | I154: 1.47e-002 | J154: 1.3999999999999999e-002 | K154: 8.69 | L154: 4.07e-002 | M154: 121 | N154: 8 | O154: 1.8000000000000002e-002 | P154: 108.62 | Q154: 42天 | R154: 5.60年 | S154: 3.61年 | T154: 5 | U154: 43 | V154: 7.8e-002 | W154: 0.151 | X154: 0.16399999999999998 | Y154: 33 | Z154: 1.48 | AA154: 1.6500000000000001e-002 | AB154: 9.8999999999999991e-003 | AC154: -1.6500000000000001e-002 | AD154: -1.8500000000000003e-002 | AE154: 82.18 | AF154: 85.68 | AG154: 0.7 | AH154: AA- | AI154: 6.4899999999999999e-002 | AJ154: =H154+100*O154 -> 112.402 | AK154: 112.6 | AL154: 18 | AM154: 26.9 | AN154: 65 | AO154: 8.5999999999999993e-002 | AP154: 19 | AQ154: 九洲转2!
A155: 238 | B155: 127014 | C155: 北方转债! | D155: 65 | E155: 北方国际 | F155: 建筑 | G155: 建筑工程 | H155: 107.3 | I155: 1.4000000000000002e-003 | J155: 4.4000000000000003e-003 | K155: 8 | L155: 1.2699999999999999e-002 | M155: 115.1 | N155: 8.75 | O155: 0.17399999999999999 | P155: 91.43 | Q155: 转股中 | R155: 4.44年 | S155: 2.45年 | T155: 5.35 | U155: 19 | V155: 3.3000000000000002e-002 | W155: 8.6999999999999994e-002 | X155: 7.9000000000000001e-002 | Y155: 62 | Z155: 1.11 | AA155: 1.6299999999999999e-002 | AB155: 1.e-002 | AC155: -1.3500000000000002e-002 | AD155: -1.61e-002 | AE155: 93.53 | AF155: 96.9 | AG155: 0.46 | AH155: AA+ | AI155: 4.0399999999999998e-002 | AJ155: =H155+100*O155 -> 124.69999999999999 | AK155: 123.2 | AL155: 100 | AM155: 26.3 | AN155: 57 | AO155: -1.7000000000000001e-002 | AP155: 19 | AQ155: 北方转债!
A156: 251 | B156: 128071 | C156: 合兴转债! | D156: 2228 | E156: 合兴包装 | F156: 造纸包装 | G156: 包装材料 | H156: 107.5 | I156: 9.4999999999999998e-003 | J156: -8.3000000000000001e-003 | K156: 3.78 | L156: 2.7000000000000001e-003 | M156: 114.8 | N156: 4.28 | O156: 0.217 | P156: 88.32 | Q156: 转股中 | R156: 4.25年 | S156: 2.26年 | T156: 3 | U156: 4.5 | V156: 1.3999999999999999e-002 | W156: 6.4000000000000001e-002 | X156: 5.7000000000000002e-002 | Y156: 47 | Z156: 1.35 | AA156: 1.5900000000000001e-002 | AB156: 9.4999999999999998e-003 | AC156: -1.6500000000000001e-002 | AD156: -1.9099999999999999e-002 | AE156: 93.5 | AF156: 96.56 | AG156: 0.42 | AH156: AA | AI156: 4.24e-002 | AJ156: =H156+100*O156 -> 129.19999999999999 | AK156: 126.7 | AL156: 135 | AM156: 30.1 | AN156: 99 | AO156: -2.e-003 | AP156: 25 | AQ156: 合兴转债!
A157: 269 | B157: 113024 | C157: 核建转债! | D157: 601611 | E157: 中国核建 | F157: 建筑 | G157: 建筑工程 | H157: 103.12 | I157: 4.0999999999999995e-003 | J157: 8.9999999999999998e-004 | K157: 7.3 | L157: 2.1000000000000001e-002 | M157: 109.3 | N157: 9.76 | O157: 0.379 | P157: 74.8 | Q157: 转股中 | R157: 3.90年 | S157: 1.90年 | T157: 30 | U157: 35 | V157: 1.1000000000000001e-002 | W157: 0.155 | X157: 0.11599999999999999 | Y157: 193 | Z157: 1.63 | AA157: 1.5300000000000001e-002 | AB157: 1.0700000000000001e-002 | AC157: -1.5e-003 | AD157: -4.1999999999999997e-003 | AE157: 95.33 | AF157: 94.97 | AG157: 0.24 | AH157: AAA | AI157: 3.7400000000000003e-002 | AJ157: =H157+100*O157 -> 141.02000000000001 | AK157: 131.4 | AL157: 186 | AM157: 36.1 | AN157: 162 | AO157: -8.1000000000000003e-002 | AP157: 39 | AQ157: 核建转债!
A158: 24 | B158: 123101 | C158: 拓斯转债! | D158: 300607 | E158: 拓斯达 | F158: 机械装备 | G158: 机器人及 | H158: 105.515 | I158: 1.46e-002 | J158: -8.199999999999999e-003 | K158: 31.9 | L158: 1.7899999999999999e-002 | M158: 115.1 | N158: 42.25 | O158: 0.39700000000000002 | P158: 75.5 | Q158: 4月5天 | R158: 5.82年 | S158: 3.82年 | T158: 6.7 | U158: 7.4 | V158: 1.e-002 | W158: 7.9000000000000001e-002 | X158: 5.9999999999999998e-002 | Y158: 85 | Z158: 3.78 | AA158: 1.5300000000000001e-002 | AB158: 1.06e-002 | AC158: -4.5999999999999999e-003 | AD158: -6.3e-003 | AE158: 87.41 | AF158: 90.03 | AG158: 0.36 | AH158: AA | AI158: 4.3899999999999995e-002 | AJ158: =H158+100*O158 -> 145.215 | AK158: 135.5 | AL158: 230 | AM158: 45.5 | AN158: 235 | AO158: -5.7000000000000002e-002 | AP158: 4 | AQ158: 拓斯转债!
A159: 154 | B159: 113588 | C159: 润达转债! | D159: 603108 | E159: 润达医疗 | F159: 医药 | G159: 医疗器械 | H159: 105.95 | I159: 5.0000000000000001e-004 | J159: 3.5999999999999999e-003 | K159: 11.77 | L159: 8.6e-003 | M159: 114.2 | N159: 13.36 | O159: 0.20300000000000001 | P159: 88.1 | Q159: 转股中 | R159: 5年33天 | S159: 3年34天 | T159: 5.5 | U159: 4 | V159: 6.9999999999999993e-003 | W159: 8.1000000000000003e-002 | X159: 7.0999999999999994e-002 | Y159: 68 | Z159: 2.14 | AA159: 1.5100000000000001e-002 | AB159: 1.e-002 | AC159: -6.6e-003 | AD159: -8.8000000000000005e-003 | AE159: 90.28 | AF159: 92.19 | AG159: 0.48 | AH159: AA | AI159: 4.3899999999999995e-002 | AJ159: =H159+100*O159 -> 126.25 | AK159: 123.8 | AL159: 105 | AM159: 31.6 | AN159: 118 | AO159: -5.0000000000000001e-003 | AP159: 10 | AQ159: 润达转债!
A160: 345 | B160: 110038 | C160: 济川转债! | D160: 600566 | E160: 济川药业 | F160: 医药 | G160: 中药 | H160: 105.16 | I160: -1.e-003 | J160: 1.7000000000000001e-003 | K160: 19.06 | L160: 6.8999999999999999e-003 | M160: 107.5 | N160: 23.85 | O160: 0.316 | P160: 79.92 | Q160: 转股中 | R160: 1.50年 | S160: 回售内 | T160: 6.28 | U160: 8 | V160: 1.2e-002 | W160: 3.7000000000000005e-002 | X160: 2.9999999999999999e-002 | Y160: 169 | Z160: 2.09 | AA160: 1.49e-002 | AB160: 5.4000000000000003e-003 | AC160: 回售内 | AD160: 回售内 | AE160: 100.25 | AF160: 101.34 | AG160: 0.11 | AH160: AA | AI160: 4.0500000000000001e-002 | AJ160: =H160+100*O160 -> 136.75999999999999 | AK160: 130.4 | AL160: 180 | AM160: 29.1 | AN160: 87 | AO160: -3.0000000000000001e-003 | AP160: 23 | AQ160: 济川转债!
A161: 112 | B161: 113039 | C161: 嘉泽转债! | D161: 601619 | E161: 嘉泽新能 | F161: 能源电力 | G161: 风能 | H161: 104.83 | I161: 1.03e-002 | J161: 1.7000000000000001e-003 | K161: 3.45 | L161: 2.07e-002 | M161: 113.1 | N161: 3.57 | O161: 8.5000000000000006e-002 | P161: 96.64 | Q161: 转股中 | R161: 5.28年 | S161: 3.28年 | T161: 11.8 | U161: 23 | V161: 1.9e-002 | W161: 0.16399999999999998 | X161: 0.159 | Y161: 72 | Z161: 2.01 | AA161: 1.4800000000000001e-002 | AB161: 1.0200000000000001e-002 | AC161: -3.4000000000000002e-003 | AD161: -5.5000000000000005e-003 | AE161: 89.47 | AF161: 90.56 | AG161: 0.58 | AH161: AA | AI161: 4.3899999999999995e-002 | AJ161: =H161+100*O161 -> 113.33 | AK161: 113 | AL161: 19 | AM161: 22.5 | AN161: 28 | AO161: -1.3999999999999999e-002 | AP161: 30 | AQ161: 嘉泽转债!
A162: 346 | B162: 113502 | C162: 嘉澳转债! | D162: 603822 | E162: 嘉澳环保 | F162: 化工 | G162: 化工 | H162: 107.44 | I162: 1.0700000000000001e-002 | J162: -1.0700000000000001e-002 | K162: 20.79 | L162: 5.3e-003 | M162: 111.3 | N162: 44.79 | O162: 1.3100000000000001 | P162: 46.42 | Q162: 转股中 | R162: 2.49年 | S162: 0.49年 | T162: 1.85 | U162: 177 | V162: 0.871 | W162: 0.121 | X162: 5.5999999999999994e-002 | Y162: 15 | Z162: 1.91 | AA162: 1.4499999999999999e-002 | AB162: 6.0000000000000001e-003 | AC162: -7.8799999999999995e-002 | AD162: -8.3599999999999994e-002 | AE162: 97.88 | AF162: 96.17 | AG162: 0 | AH162: AA- | AI162: 6.1500000000000006e-002 | AJ162: =H162+100*O162 -> 238.44 | AK162: 168.5 | AL162: 325 | AM162: 70.6 | AN162: 322 | AO162: 2.8999999999999998e-002 | AP162: 37 | AQ162: 嘉澳转债!
A163: 241 | B163: 128078 | C163: 太极转债! | D163: 2368 | E163: 太极股份 | F163: 计算机及 | G163: 软件开发 | H163: 110 | I163: 4.4000000000000003e-003 | J163: 2.2000000000000001e-003 | K163: 19.32 | L163: 1.47e-002 | M163: 116.9 | N163: 22.4 | O163: 0.27500000000000002 | P163: 86.25 | Q163: 转股中 | R163: 4.44年 | S163: 2.44年 | T163: 9.6 | U163: 1.7 | V163: 2.e-003 | W163: 8.5999999999999993e-002 | X163: 7.400000000000001e-002 | Y163: 112 | Z163: 3.34 | AA163: 1.41e-002 | AB163: 7.1999999999999998e-003 | AC163: -2.3700000000000002e-002 | AD163: -2.6099999999999998e-002 | AE163: 92.9 | AF163: 97.6 | AG163: 0.45 | AH163: AA | AI163: 4.24e-002 | AJ163: =H163+100*O163 -> 137.5 | AK163: 133.8 | AL163: 208 | AM163: 36.2 | AN163: 164 | AO163: -7.400000000000001e-002 | AP163: 11 | AQ163: 太极转债!
A164: 63 | B164: 123082 | C164: 北陆转债! | D164: 300016 | E164: 北陆药业 | F164: 医药 | G164: 化学制药 | H164: 112.91 | I164: -1.83e-002 | J164: 6.4000000000000003e-003 | K164: 9.83 | L164: -1.6e-002 | M164: 121.7 | N164: 8.8 | O164: 1.1000000000000001e-002 | P164: 111.7 | Q164: 28天 | R164: 5.56年 | S164: 3.57年 | T164: 5 | U164: 81 | V164: 0.14300000000000002 | W164: 0.10300000000000001 | X164: 0.115 | Y164: 49 | Z164: 2.93 | AA164: 1.3899999999999999e-002 | AB164: 7.0999999999999995e-003 | AC164: -2.0400000000000001e-002 | AD164: -2.2700000000000001e-002 | AE164: 79.89 | AF164: 81.8 | AG164: 0.74 | AH164: A+ | AI164: 7.5899999999999995e-002 | AJ164: =H164+100*O164 -> 114.00999999999999 | AK164: 114.1 | AL164: 22 | AM164: 32.3 | AN164: 124 | AO164: 7.6999999999999999e-002 | AP164: 9 | AQ164: 北陆转债!
A165: 319 | B165: 128039 | C165: 三力转债! | D165: 2224 | E165: 三 力 士 | F165: 机械装备 | G165: 专用设备 | H165: 105.382 | I165: -5.7999999999999996e-003 | J165: 9.4999999999999998e-003 | K165: 5.21 | L165: 7.7000000000000002e-003 | M165: 109.8 | N165: 5.81 | O165: 0.17499999999999999 | P165: 89.67 | Q165: 转股中 | R165: 3年24天 | S165: 1年25天 | T165: 2.03 | U165: 14 | V165: 6.4000000000000001e-002 | W165: 5.2999999999999999e-002 | X165: 4.8000000000000001e-002 | Y165: 38 | Z165: 1.65 | AA165: 1.38e-002 | AB165: 7.7000000000000002e-003 | AC165: -2.2000000000000002e-002 | AD165: -2.6000000000000002e-002 | AE165: 95.13 | AF165: 91.31 | AG165: 0.47 | AH165: AA- | AI165: 6.3399999999999998e-002 | AJ165: =H165+100*O165 -> 122.88200000000001 | AK165: 121.1 | AL165: 73 | AM165: 26 | AN165: 54 | AO165: -6.9999999999999993e-003 | AP165: 27 | AQ165: 三力转债!
A166: 3 | B166: 127032 | C166: 苏行转债 | D166: 2966 | E166: 苏州银行 | F166: 金融 | G166: 银行行业 | H166: 106.449 | I166: -4.0000000000000002e-004 | J166: 3.0999999999999999e-003 | K166: 7.52 | L166: 5.3e-003 | M166: 115.1 | N166: 8.34 | O166: 0.18100000000000002 | P166: 90.17 | Q166: 5月7天 | R166: 5.91年 | S166: 无权 | T166: 50 | U166: 439 | V166: 8.3000000000000004e-002 | W166: 0.19899999999999998 | X166: 0.17999999999999999 | Y166: 251 | Z166: 0.82 | AA166: 1.3500000000000002e-002 | AB166: 8.8999999999999999e-003 | AC166: 无权 | AD166: 无权 | AE166: 无权 | AF166: 92.19 | AG166: 0.5 | AH166: AAA | AI166: 3.8900000000000004e-002 | AJ166: =H166+100*O166 -> 124.54900000000001 | AK166: 122.7 | AL166: 94 | AM166: 30.5 | AN166: 105 | AO166: 2.9999999999999999e-002 | AP166: 5 | AQ166: 苏行转债
A167: 11 | B167: 123107 | C167: 温氏转债! | D167: 300498 | E167: 温氏股份 | F167: 农业 | G167: 畜牧业 | H167: 105 | I167: 1.66e-002 | J167: -6.5000000000000006e-003 | K167: 14.13 | L167: 2.5399999999999999e-002 | M167: 113 | N167: 17.82 | O167: 0.32400000000000001 | P167: 79.29 | Q167: 4月27天 | R167: 5.87年 | S167: 3.87年 | T167: 93 | U167: 207 | V167: 2.1000000000000001e-002 | W167: 0.10300000000000001 | X167: 8.199999999999999e-002 | Y167: 901 | Z167: 1.96 | AA167: 1.2800000000000001e-002 | AB167: 8.6999999999999994e-003 | AC167: -3.5999999999999999e-003 | AD167: -5.1999999999999998e-003 | AE167: 88.81 | AF167: 90.66 | AG167: 0.4 | AH167: AAA | AI167: 3.8900000000000004e-002 | AJ167: =H167+100*O167 -> 137.40000000000001 | AK167: 130.7 | AL167: 182 | AM167: 40.1 | AN167: 200 | AO167: -4.5999999999999999e-002 | AP167: 8 | AQ167: 温氏转债!
A168: 347 | B168: 128018 | C168: 时达转债! | D168: 2527 | E168: 新时达 | F168: 机械装备 | G168: 机器人及 | H168: 106.05 | I168: 5.0000000000000001e-004 | J168: -7.8000000000000005e-003 | K168: 6.76 | L168: -1.89e-002 | M168: 109.3 | N168: 7.42 | O168: 0.16399999999999998 | P168: 91.11 | Q168: 转股中 | R168: 2.48年 | S168: 0.48年 | T168: 4.04 | U168: 45 | V168: 0.10400000000000001 | W168: 9.6000000000000002e-002 | X168: 8.8000000000000009e-002 | Y168: 42 | Z168: 1.6 | AA168: 1.2500000000000001e-002 | AB168: 5.3e-003 | AC168: -6.13e-002 | AD168: -6.6400000000000001e-002 | AE168: 99.22 | AF168: 99.22 | AG168: 0.39 | AH168: AA | AI168: 4.0500000000000001e-002 | AJ168: =H168+100*O168 -> 122.44999999999999 | AK168: 121 | AL168: 71 | AM168: 21.8 | AN168: 22 | AO168: 8.199999999999999e-002 | AP168: 37 | AQ168: 时达转债!
A169: 318 | B169: 128040 | C169: 华通转债! | D169: 2758 | E169: 浙农股份 | F169: 医药 | G169: 医药商业 | H169: 108.17 | I169: -3.0000000000000001e-003 | J169: 1.2e-002 | K169: 10.08 | L169: 1.61e-002 | M169: 112.3 | N169: 10.33 | O169: 0.109 | P169: 97.58 | Q169: 转股中 | R169: 3年30天 | S169: 1年31天 | T169: 2.22 | U169: 16 | V169: 6.6000000000000003e-002 | W169: 4.4999999999999998e-002 | X169: 4.4000000000000004e-002 | Y169: 49 | Z169: 1.63 | AA169: 1.2500000000000001e-002 | AB169: 5.1000000000000004e-003 | AC169: -4.0300000000000002e-002 | AD169: -4.4400000000000002e-002 | AE169: 95.27 | AF169: 93.33 | AG169: 0.56 | AH169: AA- | AI169: 6.3399999999999998e-002 | AJ169: =H169+100*O169 -> 119.07000000000001 | AK169: 118.8 | AL169: 53 | AM169: 23.5 | AN169: 37 | AO169: -4.0000000000000001e-002 | AP169: 30 | AQ169: 华通转债!
A170: 227 | B170: 110062 | C170: 烽火转债! | D170: 600498 | E170: 烽火通信 | F170: 通信互联 | G170: 通信设备 | H170: 105.08 | I170: 7.000000000000001e-004 | J170: 2.7000000000000001e-003 | K170: 17.48 | L170: 1.1599999999999999e-002 | M170: 110.8 | N170: 22.93 | O170: 0.37799999999999995 | P170: 76.23 | Q170: 转股中 | R170: 4.55年 | S170: 2.55年 | T170: 30.9 | U170: 13 | V170: 4.0000000000000001e-003 | W170: 0.156 | X170: 0.11900000000000001 | Y170: 198 | Z170: 1.84 | AA170: 1.1899999999999999e-002 | AB170: 7.4999999999999997e-003 | AC170: -6.3e-003 | AD170: -8.6999999999999994e-003 | AE170: 93.57 | AF170: 94.06 | AG170: 0.29 | AH170: AAA | AI170: 3.7400000000000003e-002 | AJ170: =H170+100*O170 -> 142.88 | AK170: 133.9 | AL170: 211 | AM170: 39.9 | AN170: 198 | AO170: -3.7999999999999999e-002 | AP170: 20 | AQ170: 烽火转债!
A171: 331 | B171: 123007 | C171: 道氏转债! | D171: 300409 | E171: 道氏技术 | F171: 建筑 | G171: 建筑行业 | H171: 106.999 | I171: 1.3100000000000001e-002 | J171: 2.2000000000000001e-003 | K171: 13.26 | L171: 3.3500000000000002e-002 | M171: 110.3 | N171: 14.55 | O171: 0.17399999999999999 | P171: 91.13 | Q171: 转股中 | R171: 2.62年 | S171: 0.62年 | T171: 3.04 | U171: 34 | V171: 0.10400000000000001 | W171: 4.0999999999999995e-002 | X171: 3.7999999999999999e-002 | Y171: 74 | Z171: 2 | AA171: 1.18e-002 | AB171: 4.5000000000000005e-003 | AC171: -6.1200000000000004e-002 | AD171: -6.54e-002 | AE171: 97.12 | AF171: 94.56 | AG171: 0.46 | AH171: AA- | AI171: 6.1500000000000006e-002 | AJ171: =H171+100*O171 -> 124.399 | AK171: 122.9 | AL171: 97 | AM171: 25.7 | AN171: 53 | AO171: 4.7e-002 | AP171: 23 | AQ171: 道氏转债!
A172: 82 | B172: 110076 | C172: 华海转债! | D172: 600521 | E172: 华海药业 | F172: 医药 | G172: 医药行业 | H172: 108.07 | I172: 7.9000000000000008e-003 | J172: -7.9000000000000008e-003 | K172: 20.48 | L172: 0. | M172: 115.1 | N172: 34.66 | O172: 0.82900000000000007 | P172: 59.09 | Q172: 转股中 | R172: 5.47年 | S172: 3.47年 | T172: 18.4 | U172: 7.5 | V172: 4.0000000000000001e-003 | W172: 6.2e-002 | X172: 3.7000000000000005e-002 | Y172: 298 | Z172: 4.57 | AA172: 1.18e-002 | AB172: 6.8000000000000005e-003 | AC172: -1.1599999999999999e-002 | AD172: -1.3500000000000002e-002 | AE172: 88.74 | AF172: 91.4 | AG172: 0.16 | AH172: AA | AI172: 4.3899999999999995e-002 | AJ172: =H172+100*O172 -> 190.97 | AK172: 157.1 | AL172: 314 | AM172: 65.7 | AN172: 316 | AO172: 2.8999999999999998e-002 | AP172: 7 | AQ172: 华海转债!
A173: 155 | B173: 128114 | C173: 正邦转债 | D173: 2157 | E173: 正邦科技 | F173: 农业 | G173: 畜牧业 | H173: 108.999 | I173: 1.1699999999999999e-002 | J173: -9.0000000000000011e-003 | K173: 13.78 | L173: 5.7999999999999996e-003 | M173: 115.3 | N173: 15.45 | O173: 0.222 | P173: 89.19 | Q173: 转股中 | R173: 5年33天 | S173: 3年34天 | T173: 16 | U173: 51 | V173: 2.8999999999999998e-002 | W173: 3.7000000000000005e-002 | X173: 3.3000000000000002e-002 | Y173: 434 | Z173: 1.85 | AA173: 1.1299999999999999e-002 | AB173: 5.8999999999999999e-003 | AC173: -1.4999999999999999e-002 | AD173: -1.72e-002 | AE173: 90.94 | AF173: 93.98 | AG173: 0.47 | AH173: AA+ | AI173: 4.1900000000000007e-002 | AJ173: =H173+100*O173 -> 131.19899999999998 | AK173: 128.8 | AL173: 162 | AM173: 34.8 | AN173: 145 | AO173: -1.9e-002 | AP173: 17 | AQ173: 正邦转债
A174: 27 | B174: 128144 | C174: 利民转债 | D174: 2734 | E174: 利民股份 | F174: 化工 | G174: 农化 | H174: 107.56 | I174: 2.3999999999999998e-003 | J174: 1.2999999999999999e-003 | K174: 12.79 | L174: 7.0999999999999995e-003 | M174: 114.1 | N174: 14.23 | O174: 0.19699999999999998 | P174: 89.88 | Q174: 3月24天 | R174: 5.79年 | S174: 3.80年 | T174: 9.8 | U174: 3.6 | V174: 3.0000000000000001e-003 | W174: 0.20600000000000002 | X174: 0.185 | Y174: 48 | Z174: 1.73 | AA174: 1.04e-002 | AB174: 6.0000000000000001e-003 | AC174: -1.1299999999999999e-002 | AD174: -1.2699999999999999e-002 | AE174: 86.86 | AF174: 89.28 | AG174: 0.52 | AH174: AA | AI174: 4.3899999999999995e-002 | AJ174: =H174+100*O174 -> 127.26000000000001 | AK174: 125.2 | AL174: 118 | AM174: 36 | AN174: 161 | AO174: 2.e-003 | AP174: 4 | AQ174: 利民转债
A175: 93 | B175: 123070 | C175: 鹏辉转债 | D175: 300438 | E175: 鹏辉能源 | F175: 汽车 | G175: 零部件制 | H175: 109 | I175: 1.1899999999999999e-002 | J175: -4.8999999999999998e-003 | K175: 16.77 | L175: 1.6399999999999998e-002 | M175: 115.1 | N175: 20.16 | O175: 0.31 | P175: 83.18 | Q175: 转股中 | R175: 5.43年 | S175: 3.44年 | T175: 8.9 | U175: 26 | V175: 2.7000000000000003e-002 | W175: 0.126 | X175: 0.105 | Y175: 70 | Z175: 2.98 | AA175: 1.03e-002 | AB175: 5.1999999999999998e-003 | AC175: -1.41e-002 | AD175: -1.6e-002 | AE175: 88.87 | AF175: 91.54 | AG175: 0.43 | AH175: AA | AI175: 4.3899999999999995e-002 | AJ175: =H175+100*O175 -> 140. | AK175: 134.8 | AL175: 221 | AM175: 43.3 | AN175: 218 | AO175: -5.0000000000000003e-002 | AP175: 4 | AQ175: 鹏辉转债
A176: 343 | B176: 128021 | C176: 兄弟转债!! | D176: 2562 | E176: 兄弟科技 | F176: 医药 | G176: 原料药 | H176: 106.102 | I176: -2.3e-003 | J176: 2.3e-003 | K176: 4.66 | L176: 0. | M176: 108.8 | N176: 5.19 | O176: 0.182 | P176: 89.79 | Q176: 转股中 | R176: 2.54年 | S176: 0.54年 | T176: 2.65 | U176: 7.5 | V176: 2.7000000000000003e-002 | W176: 5.4000000000000006e-002 | X176: 4.8000000000000001e-002 | Y176: 50 | Z176: 1.67 | AA176: 1.01e-002 | AB176: 3.4999999999999996e-003 | AC176: -6.0100000000000001e-002 | AD176: -6.4199999999999993e-002 | AE176: 98.74 | AF176: 98.51 | AG176: 0.38 | AH176: AA | AI176: 4.0500000000000001e-002 | AJ176: =H176+100*O176 -> 124.30200000000001 | AK176: 122.4 | AL176: 88 | AM176: 23.7 | AN176: 40 | AO176: -4.4000000000000004e-002 | AP176: 14 | AQ176: 兄弟转债!!
A177: 21 | B177: 123104 | C177: 卫宁转债 | D177: 300253 | E177: 卫宁健康 | F177: 计算机及 | G177: 软件开发 | H177: 118.1 | I177: 8.0000000000000004e-004 | J177: 3.0999999999999999e-003 | K177: 15.15 | L177: 1.e-002 | M177: 125.1 | N177: 17.76 | O177: 0.38400000000000001 | P177: 85.3 | Q177: 4月11天 | R177: 5.84年 | S177: 3.84年 | T177: 9.7 | U177: 3.6 | V177: 3.0000000000000001e-003 | W177: 2.9999999999999999e-002 | X177: 2.6000000000000002e-002 | Y177: 325 | Z177: 7.1 | AA177: 1.01e-002 | AB177: 2.8999999999999998e-003 | AC177: -3.2400000000000005e-002 | AD177: -3.4000000000000002e-002 | AE177: 87.35 | AF177: 97.75 | AG177: 0.39 | AH177: AA | AI177: 4.3899999999999995e-002 | AJ177: =H177+100*O177 -> 156.5 | AK177: 150.9 | AL177: 297 | AM177: 53.1 | AN177: 276 | AO177: -7.6999999999999999e-002 | AP177: 4 | AQ177: 卫宁转债
A178: 215 | B178: 128090 | C178: 汽模转2 | D178: 2510 | E178: 天汽模 | F178: 汽车 | G178: 零部件制 | H178: 109.81 | I178: -7.1999999999999998e-003 | J178: 1.2500000000000001e-002 | K178: 4.14 | L178: 9.7999999999999997e-003 | M178: 114.9 | N178: 4.21 | O178: 0.11699999999999999 | P178: 98.34 | Q178: 转股中 | R178: 4.62年 | S178: 2.62年 | T178: 3.1 | U178: 51 | V178: 0.14999999999999999 | W178: 7.9000000000000001e-002 | X178: 7.6999999999999999e-002 | Y178: 39 | Z178: 1.94 | AA178: 1.e-002 | AB178: 4.1999999999999997e-003 | AC178: -2.1499999999999998e-002 | AD178: -2.3799999999999998e-002 | AE178: 92.2 | AF178: 95.2 | AG178: 0.55 | AH178: AA | AI178: 4.24e-002 | AJ178: =H178+100*O178 -> 121.51000000000001 | AK178: 121.3 | AL178: 75 | AM178: 26.1 | AN178: 55 | AO178: 3.0000000000000001e-003 | AP178: 29 | AQ178: 汽模转2
A179: 70 | B179: 123078 | C179: 飞凯转债! | D179: 300398 | E179: 飞凯材料 | F179: 化工 | G179: 化工 | H179: 109.177 | I179: -2.0000000000000001e-004 | J179: 8.5000000000000006e-003 | K179: 14.75 | L179: 1.5100000000000001e-002 | M179: 115.2 | N179: 15.62 | O179: 0.156 | P179: 94.43 | Q179: 20天 | R179: 5.54年 | S179: 3.54年 | T179: 8.2 | U179: 3.2 | V179: 4.0000000000000001e-003 | W179: 0.10800000000000001 | X179: 0.10199999999999999 | Y179: 76 | Z179: 2.84 | AA179: 9.8999999999999991e-003 | AB179: 5.0000000000000001e-003 | AC179: -1.3899999999999999e-002 | AD179: -1.5800000000000002e-002 | AE179: 88.57 | AF179: 91.22 | AG179: 0.55 | AH179: AA | AI179: 4.3899999999999995e-002 | AJ179: =H179+100*O179 -> 124.777 | AK179: 123.9 | AL179: 107 | AM179: 32.7 | AN179: 126 | AO179: -1.3999999999999999e-002 | AP179: 8 | AQ179: 飞凯转债!
A180: 228 | B180: 128081 | C180: 海亮转债! | D180: 2203. | E180: 海亮股份 | F180: 有色金属 | G180: 铜金属 | H180: 110.101 | I180: 7.4000000000000003e-003 | J180: 5.9999999999999995e-004 | K180: 10.63 | L180: 1.24e-002 | M180: 114.9 | N180: 9.76 | O180: 1.1000000000000001e-002 | P180: 108.91 | Q180: 转股中 | R180: 4.52年 | S180: 2.52年 | T180: 30.1 | U180: 22 | V180: 6.9999999999999993e-003 | W180: 0.14499999999999999 | X180: 0.157 | Y180: 208 | Z180: 2.2 | AA180: 9.7000000000000003e-003 | AB180: 3.7000000000000002e-003 | AC180: -2.3300000000000001e-002 | AD180: -2.5699999999999997e-002 | AE180: 92.58 | AF180: 95.59 | AG180: 0.64 | AH180: AA | AI180: 4.24e-002 | AJ180: =H180+100*O180 -> 111.20099999999999 | AK180: 111.3 | AL180: 14 | AM180: 15.7 | AN180: 10 | AO180: 8.0000000000000002e-003 | AP180: 52 | AQ180: 海亮转债!
A181: 170 | B181: 128107 | C181: 交科转债 | D181: 2061 | E181: 浙江交科 | F181: 建筑 | G181: 建筑工程 | H181: 109.678 | I181: -2.0000000000000001e-004 | J181: 1.2999999999999999e-003 | K181: 5.39 | L181: 1.9e-003 | M181: 114.9 | N181: 5.36 | O181: 9.0999999999999998e-002 | P181: 100.56 | Q181: 转股中 | R181: 4.94年 | S181: 2.94年 | T181: 25 | U181: 2.8 | V181: 1.e-003 | W181: 0.33700000000000002 | X181: 0.33899999999999997 | Y181: 74 | Z181: 0.86 | AA181: 9.5999999999999992e-003 | AB181: 4.1999999999999997e-003 | AC181: -1.89e-002 | AD181: -2.1000000000000001e-002 | AE181: 91.52 | AF181: 94.83 | AG181: 0.57 | AH181: AA+ | AI181: 4.0399999999999998e-002 | AJ181: =H181+100*O181 -> 118.77799999999999 | AK181: 118.8 | AL181: 54 | AM181: 24 | AN181: 43 | AO181: -2.7999999999999997e-002 | AP181: 17 | AQ181: 交科转债
A182: 8 | B182: 123109 | C182: 昌红转债 | D182: 300151 | E182: 昌红科技 | F182: 机械装备 | G182: 专用设备 | H182: 114.54 | I182: -4.8999999999999998e-003 | J182: 1.5700000000000002e-002 | K182: 28.63 | L182: 1.6299999999999999e-002 | M182: 121 | N182: 28.26 | O182: 0.13100000000000001 | P182: 101.31 | Q182: 4月27天 | R182: 5.88年 | S182: 3.88年 | T182: 4.6 | U182: 24 | V182: 4.5999999999999999e-002 | W182: 3.2000000000000001e-002 | X182: 3.2000000000000001e-002 | Y182: 144 | Z182: 13.45 | AA182: 9.4999999999999998e-003 | AB182: 3.4000000000000002e-003 | AC182: -2.3900000000000001e-002 | AD182: -2.5699999999999997e-002 | AE182: 80.76 | AF182: 84.2 | AG182: 0.66 | AH182: AA- | AI182: 6.4899999999999999e-002 | AJ182: =H182+100*O182 -> 127.64000000000001 | AK182: 127.8 | AL182: 149 | AM182: 43.6 | AN182: 223 | AO182: -1.3000000000000001e-002 | AP182: 3 | AQ182: 昌红转债
A183: 16 | B183: 128145 | C183: 日丰转债 | D183: 2953 | E183: 日丰股份 | F183: 家电 | G183: 零部件制 | H183: 109.328 | I183: 1.e-004 | J183: 3.2000000000000002e-003 | K183: 19.84 | L183: 4.5999999999999999e-003 | M183: 115.4 | N183: 19.24 | O183: 5.9999999999999998e-002 | P183: 103.12 | Q183: 4月16天 | R183: 5.85年 | S183: 3.85年 | T183: 3.8 | U183: 4.3 | V183: 1.e-002 | W183: 0.11 | X183: 0.114 | Y183: 34 | Z183: 3.23 | AA183: 9.3999999999999986e-003 | AB183: 4.6999999999999993e-003 | AC183: -1.3100000000000001e-002 | AD183: -1.4800000000000001e-002 | AE183: 80.74 | AF183: 80.43 | AG183: 0.72 | AH183: AA- | AI183: 6.4899999999999999e-002 | AJ183: =H183+100*O183 -> 115.328 | AK183: 115.5 | AL183: 30 | AM183: 34.8 | AN183: 143 | AO183: -1.e-002 | AP183: 4 | AQ183: 日丰转债
A184: 218 | B184: 113030 | C184: 东风转债! | D184: 601515 | E184: 东风股份 | F184: 造纸包装 | G184: 包装材料 | H184: 112.12 | I184: -4.0000000000000001e-003 | J184: -1.1299999999999999e-002 | K184: 6.9 | L184: -2.6800000000000001e-002 | M184: 116.9 | N184: 6.75 | O184: 9.6999999999999989e-002 | P184: 102.22 | Q184: 转股中 | R184: 4.61年 | S184: 2.61年 | T184: 2.95 | U184: 16 | V184: 4.7e-002 | W184: 3.2000000000000001e-002 | X184: 3.3000000000000002e-002 | Y184: 92 | Z184: 2 | AA184: 9.300000000000001e-003 | AB184: 2.7000000000000001e-003 | AC184: -2.8999999999999998e-002 | AD184: -3.1200000000000002e-002 | AE184: 92.23 | AF184: 96.89 | AG184: 0.57 | AH184: AA | AI184: 4.24e-002 | AJ184: =H184+100*O184 -> 121.82000000000001 | AK184: 122 | AL184: 80 | AM184: 25.1 | AN184: 47 | AO184: 8.900000000000001e-002 | AP184: 17 | AQ184: 东风转债!
A185: 334 | B185: 110041 | C185: 蒙电转债! | D185: 600863 | E185: 内蒙华电 | F185: 能源电力 | G185: 电力供应 | H185: 106.78 | I185: 1.1000000000000001e-003 | J185: -1.1000000000000001e-003 | K185: 2.43 | L185: 0. | M185: 109.3 | N185: 2.69 | O185: 0.182 | P185: 90.33 | Q185: 转股中 | R185: 2.61年 | S185: 0.61年 | T185: 18.7 | U185: 4.3 | V185: 2.e-003 | W185: 0.13200000000000001 | X185: 0.12 | Y185: 141 | Z185: 1.21 | AA185: 9.1000000000000004e-003 | AB185: 2.3999999999999998e-003 | AC185: -5.9999999999999998e-002 | AD185: -6.4199999999999993e-002 | AE185: 99.09 | AF185: 99.95 | AG185: 0.37 | AH185: AAA | AI185: 3.5499999999999997e-002 | AJ185: =H185+100*O185 -> 124.98 | AK185: 123.2 | AL185: 101 | AM185: 23.3 | AN185: 35 | AO185: -3.0000000000000001e-003 | AP185: 11 | AQ185: 蒙电转债!
A186: 139 | B186: 128121 | C186: 宏川转债! | D186: 2930 | E186: 宏川智慧 | F186: 交通运输 | G186: 物流业 | H186: 108.32 | I186: 8.6e-003 | J186: -6.7000000000000002e-003 | K186: 16.12 | L186: 3.7000000000000002e-003 | M186: 113.3 | N186: 20.25 | O186: 0.36099999999999999 | P186: 79.6 | Q186: 转股中 | R186: 5.17年 | S186: 3.18年 | T186: 6.7 | U186: 1.6 | V186: 2.e-003 | W186: 9.4e-002 | X186: 7.4999999999999997e-002 | Y186: 72 | Z186: 3.45 | AA186: 8.8999999999999999e-003 | AB186: 4.1999999999999997e-003 | AC186: -1.2800000000000001e-002 | AD186: -1.4999999999999999e-002 | AE186: 84.33 | AF186: 82.44 | AG186: 0.49 | AH186: AA- | AI186: 6.4899999999999999e-002 | AJ186: =H186+100*O186 -> 144.41999999999999 | AK186: 137 | AL186: 238 | AM186: 52.7 | AN186: 274 | AO186: -4.4999999999999998e-002 | AP186: 5 | AQ186: 宏川转债!
A187: 125 | B187: 128124 | C187: 科华转债! | D187: 2022 | E187: 科华生物 | F187: 医药 | G187: 生物制药 | H187: 105.598 | I187: -5.45e-002 | J187: 5.1500000000000004e-002 | K187: 18.94 | L187: -5.7999999999999996e-003 | M187: 110.3 | N187: 21.51 | O187: 0.19899999999999998 | P187: 88.05 | Q187: 转股中 | R187: 5.20年 | S187: 3.21年 | T187: 7.38 | U187: 444 | V187: 0.56600000000000006 | W187: 7.5999999999999998e-002 | X187: 6.7000000000000004e-002 | Y187: 97 | Z187: 2.93 | AA187: 8.6e-003 | AB187: 4.7999999999999996e-003 | AC187: -7.3000000000000001e-003 | AD187: -9.0000000000000011e-003 | AE187: 89.27 | AF187: 88.55 | AG187: 0.51 | AH187: AA | AI187: 4.3899999999999995e-002 | AJ187: =H187+100*O187 -> 125.49799999999999 | AK187: 123.1 | AL187: 99 | AM187: 33.9 | AN187: 138 | AO187: 9.6000000000000002e-002 | AP187: 18 | AQ187: 科华转债!
A188: 85 | B188: 113606 | C188: 荣泰转债 | D188: 603579 | E188: 荣泰健康 | F188: 机械装备 | G188: 专用设备 | H188: 116.06 | I188: -1.8e-003 | J188: -7.0999999999999995e-003 | K188: 36.26 | L188: -1.2800000000000001e-002 | M188: 121.2 | N188: 33.32 | O188: 6.6000000000000003e-002 | P188: 108.82 | Q188: 转股中 | R188: 5.46年 | S188: 3.46年 | T188: 6 | U188: 5.9 | V188: 8.0000000000000002e-003 | W188: 0.11800000000000001 | X188: 0.129 | Y188: 51 | Z188: 3.03 | AA188: 8.1000000000000013e-003 | AB188: 1.4000000000000002e-003 | AC188: -2.98e-002 | AD188: -3.1899999999999998e-002 | AE188: 83.1 | AF188: 86.64 | AG188: 0.7 | AH188: AA- | AI188: 6.4899999999999999e-002 | AJ188: =H188+100*O188 -> 122.66 | AK188: 123.3 | AL188: 102 | AM188: 36.7 | AN188: 174 | AO188: 7.5999999999999998e-002 | AP188: 10 | AQ188: 荣泰转债
A189: 29 | B189: 123100 | C189: 朗科转债 | D189: 300543 | E189: 朗科智能 | F189: 电子 | G189: 电子产品 | H189: 112.3 | I189: 2.7000000000000001e-003 | J189: -6.6e-003 | K189: 15.8 | L189: -5.6999999999999993e-003 | M189: 117.5 | N189: 15.34 | O189: 8.9999999999999997e-002 | P189: 103 | Q189: 3月10天 | R189: 5.74年 | S189: 3.74年 | T189: 3.8 | U189: 14 | V189: 3.2000000000000001e-002 | W189: 0.11699999999999999 | X189: 0.12 | Y189: 33 | Z189: 3.48 | AA189: 8.1000000000000013e-003 | AB189: 2.7000000000000001e-003 | AC189: -2.e-002 | AD189: -2.1899999999999999e-002 | AE189: 81.41 | AF189: 82.49 | AG189: 0.7 | AH189: AA- | AI189: 6.4899999999999999e-002 | AJ189: =H189+100*O189 -> 121.3 | AK189: 121.6 | AL189: 78 | AM189: 39.1 | AN189: 191 | AO189: -1.1000000000000001e-002 | AP189: 9 | AQ189: 朗科转债
A190: 103 | B190: 123067 | C190: 斯莱转债 | D190: 300382 | E190: 斯莱克 | F190: 机械装备 | G190: 专用设备 | H190: 116.5 | I190: -4.3e-003 | J190: -8.3999999999999995e-003 | K190: 9.68 | L190: -1.9299999999999998e-002 | M190: 121.2 | N190: 9.38 | O190: 0.129 | P190: 103.2 | Q190: 转股中 | R190: 5.34年 | S190: 3.35年 | T190: 3.88 | U190: 7.3 | V190: 1.6e-002 | W190: 7.0999999999999994e-002 | X190: 7.2999999999999995e-002 | Y190: 55 | Z190: 5.26 | AA190: 7.6e-003 | AB190: 8.0000000000000004e-004 | AC190: -3.1800000000000002e-002 | AD190: -3.4000000000000002e-002 | AE190: 83.72 | AF190: 87.28 | AG190: 0.66 | AH190: AA- | AI190: 6.4899999999999999e-002 | AJ190: =H190+100*O190 -> 129.40000000000001 | AK190: 129.8 | AL190: 173 | AM190: 42.5 | AN190: 211 | AO190: 1.2e-002 | AP190: 13 | AQ190: 斯莱转债
A191: 28 | B191: 118000 | C191: 嘉元转债 | D191: 688388 | E191: 嘉元科技 | F191: 电子 | G191: 电子产品 | H191: 116.6 | I191: 3.4000000000000002e-003 | J191: 1.4000000000000002e-003 | K191: 67.6 | L191: 8.8000000000000005e-003 | M191: 121 | N191: 78.74 | O191: 0.35799999999999998 | P191: 85.85 | Q191: 3月20天 | R191: 5.78年 | S191: 3.78年 | T191: 12.4 | U191: 9.2 | V191: 6.0000000000000001e-003 | W191: 7.9000000000000001e-002 | X191: 6.8000000000000005e-002 | Y191: 156 | Z191: 5.74 | AA191: 6.6e-003 | AB191: 2.9999999999999997e-004 | AC191: -2.8999999999999998e-002 | AD191: -3.0800000000000001e-002 | AE191: 81.28 | AF191: 84.74 | AG191: 0.55 | AH191: AA- | AI191: 6.4899999999999999e-002 | AJ191: =H191+100*O191 -> 152.39999999999998 | AK191: 147.3 | AL191: 286 | AM191: 62.6 | AN191: 307 | AO191: -0.127 | AP191: 4 | AQ191: 嘉元转债
A192: 195 | B192: 110067 | C192: 华安转债! | D192: 600909 | E192: 华安证券 | F192: 金融 | G192: 证券行业 | H192: 107.08 | I192: 1.3500000000000002e-002 | J192: 9.7999999999999997e-003 | K192: 6.31 | L192: 4.82e-002 | M192: 110.3 | N192: 6.98 | O192: 0.184 | P192: 90.4 | Q192: 转股中 | R192: 4.82年 | S192: 无权 | T192: 28 | U192: 75 | V192: 2.5000000000000001e-002 | W192: 0.12300000000000001 | X192: 0.111 | Y192: 228 | Z192: 1.6 | AA192: 6.1999999999999998e-003 | AB192: 2.3e-003 | AC192: 无权 | AD192: 无权 | AE192: 无权 | AF192: 92.59 | AG192: 0.49 | AH192: AAA | AI192: 3.7400000000000003e-002 | AJ192: =H192+100*O192 -> 125.47999999999999 | AK192: 123.8 | AL192: 104 | AM192: 31.2 | AN192: 113 | AO192: 2.9999999999999999e-002 | AP192: 27 | AQ192: 华安转债!
A193: 161 | B193: 123052 | C193: 飞鹿转债 | D193: 300665 | E193: 飞鹿股份 | F193: 化工 | G193: 化工 | H193: 123.46 | I193: -1.1200000000000002e-002 | J193: 1.9900000000000001e-002 | K193: 11.35 | L193: 1.2500000000000001e-002 | M193: 127.3 | N193: 9.9 | O193: 7.6999999999999999e-002 | P193: 114.65 | Q193: 转股中 | R193: 5年21天 | S193: 3年22天 | T193: 1.53 | U193: 99 | V193: 0.51900000000000002 | W193: 0.111 | X193: 0.127 | Y193: 14 | Z193: 2.95 | AA193: 6.1999999999999998e-003 | AB193: -2.7000000000000001e-003 | AC193: -4.9000000000000002e-002 | AD193: -5.1799999999999999e-002 | AE193: 83.42 | AF193: 88.86 | AG193: 0.7 | AH193: A+ | AI193: 7.5899999999999995e-002 | AJ193: =H193+100*O193 -> 131.16 | AK193: 132.3 | AL193: 196 | AM193: 43.4 | AN193: 220 | AO193: -4.2000000000000003e-002 | AP193: 15 | AQ193: 飞鹿转债
A194: 14 | B194: 127031 | C194: 洋丰转债! | D194: 902 | E194: 新洋丰 | F194: 化工 | G194: 农化 | H194: 113.1 | I194: 5.3e-003 | J194: 2.e-003 | K194: 14.36 | L194: 2.35e-002 | M194: 117.1 | N194: 19.94 | O194: 0.56999999999999995 | P194: 72.02 | Q194: 4月27天 | R194: 5.86年 | S194: 3.86年 | T194: 10 | U194: 9.9 | V194: 9.0000000000000011e-003 | W194: 5.2999999999999999e-002 | X194: 3.7999999999999999e-002 | Y194: 187 | Z194: 2.58 | AA194: 6.0000000000000001e-003 | AB194: 8.9999999999999998e-004 | AC194: -2.1700000000000001e-002 | AD194: -2.3399999999999997e-002 | AE194: 87.25 | AF194: 91.43 | AG194: 0.31 | AH194: AA | AI194: 4.3899999999999995e-002 | AJ194: =H194+100*O194 -> 170.09999999999999 | AK194: 154.2 | AL194: 307 | AM194: 62.8 | AN194: 309 | AO194: -0.114 | AP194: 2 | AQ194: 洋丰转债!
A195: 58 | B195: 113043 | C195: 财通转债! | D195: 601108 | E195: 财通证券 | F195: 金融 | G195: 证券行业 | H195: 106.78 | I195: 1.4999999999999999e-002 | J195: 1.5900000000000001e-002 | K195: 10.83 | L195: 7.3300000000000004e-002 | M195: 110.2 | N195: 13.33 | O195: 0.314 | P195: 81.25 | Q195: 33天 | R195: 5.57年 | S195: 无权 | T195: 38 | U195: 159 | V195: 3.9e-002 | W195: 9.8000000000000004e-002 | X195: 7.9000000000000001e-002 | Y195: 389 | Z195: 1.7 | AA195: 5.7999999999999996e-003 | AB195: 2.3e-003 | AC195: 无权 | AD195: 无权 | AE195: 无权 | AF195: 89.35 | AG195: 0.42 | AH195: AAA | AI195: 3.8900000000000004e-002 | AJ195: =H195+100*O195 -> 138.18000000000001 | AK195: 132.3 | AL195: 198 | AM195: 43 | AN195: 214 | AO195: 3.2000000000000001e-002 | AP195: 10 | AQ195: 财通转债!
A196: 208 | B196: 113563 | C196: 柳药转债 | D196: 603368 | E196: 柳药股份 | F196: 医药 | G196: 医药商业 | H196: 110 | I196: 3.5999999999999999e-003 | J196: 4.7999999999999996e-003 | K196: 21.02 | L196: 1.9400000000000001e-002 | M196: 112.9 | N196: 24.47 | O196: 0.28100000000000003 | P196: 85.9 | Q196: 转股中 | R196: 4.67年 | S196: 2.68年 | T196: 8.02 | U196: 4.1 | V196: 5.0000000000000001e-003 | W196: 0.105 | X196: 8.9999999999999997e-002 | Y196: 76 | Z196: 1.48 | AA196: 5.6999999999999993e-003 | AB196: 5.9999999999999995e-004 | AC196: -2.1700000000000001e-002 | AD196: -2.4e-002 | AE196: 91.99 | AF196: 93.34 | AG196: 0.43 | AH196: AA | AI196: 4.24e-002 | AJ196: =H196+100*O196 -> 138.09999999999999 | AK196: 134.1 | AL196: 213 | AM196: 40.8 | AN196: 202 | AO196: -6.2e-002 | AP196: 18 | AQ196: 柳药转债
A197: 212 | B197: 128093 | C197: 百川转债! | D197: 2455 | E197: 百川股份 | F197: 化工 | G197: 化工 | H197: 126.65 | I197: -1.21e-002 | J197: 7.000000000000001e-004 | K197: 7.44 | L197: -1.5900000000000001e-002 | M197: 129.8 | N197: 5.87 | O197: -1.e-003 | P197: 126.75 | Q197: 转股中 | R197: 4.64年 | S197: 2.64年 | T197: 4.2 | U197: 171 | V197: 0.32799999999999996 | W197: 0.109 | X197: 0.13800000000000001 | Y197: 38 | Z197: 2.83 | AA197: 5.5000000000000005e-003 | AB197: -5.0000000000000001e-003 | AC197: -5.96e-002 | AD197: -6.3799999999999996e-002 | AE197: 90.22 | AF197: 98.59 | AG197: 0.72 | AH197: AA- | AI197: 6.3399999999999998e-002 | AJ197: =H197+100*O197 -> 126.55000000000001 | AK197: 126.6 | AL197: 131 | AM197: 28 | AN197: 76 | AO197: 0.155 | AP197: 51 | AQ197: 百川转债!
A198: 266 | B198: 113026 | C198: 核能转债! | D198: 601985 | E198: 中国核电 | F198: 能源电力 | G198: 核电 | H198: 107.04 | I198: 4.3e-003 | J198: 1.e-004 | K198: 5.35 | L198: 9.3999999999999986e-003 | M198: 109.3 | N198: 5.86 | O198: 0.17199999999999999 | P198: 91.3 | Q198: 转股中 | R198: 3.92年 | S198: 1.92年 | T198: 78 | U198: 20 | V198: 2.e-003 | W198: 8.4000000000000005e-002 | X198: 7.5999999999999998e-002 | Y198: 934 | Z198: 1.51 | AA198: 5.4000000000000003e-003 | AB198: 1.e-003 | AC198: -1.9299999999999998e-002 | AD198: -2.1899999999999999e-002 | AE198: 95.27 | AF198: 94.9 | AG198: 0.47 | AH198: AAA | AI198: 3.7400000000000003e-002 | AJ198: =H198+100*O198 -> 124.24000000000001 | AK198: 122.8 | AL198: 95 | AM198: 27.5 | AN198: 72 | AO198: 1.7000000000000001e-002 | AP198: 47 | AQ198: 核能转债!
A199: 110 | B199: 128129 | C199: 青农转债! | D199: 2958 | E199: 青农商行 | F199: 金融 | G199: 银行行业 | H199: 109.289 | I199: 1.43e-002 | J199: 7.000000000000001e-004 | K199: 4.46 | L199: 2.53e-002 | M199: 112.2 | N199: 4.47 | O199: 9.5000000000000001e-002 | P199: 99.78 | Q199: 转股中 | R199: 5.28年 | S199: 无权 | T199: 50 | U199: 32 | V199: 6.0000000000000001e-003 | W199: 0.20199999999999999 | X199: 0.20100000000000001 | Y199: 248 | Z199: 0.91 | AA199: 5.1000000000000004e-003 | AB199: 8.0000000000000004e-004 | AC199: 无权 | AD199: 无权 | AE199: 无权 | AF199: 92.01 | AG199: 0.59 | AH199: AAA | AI199: 3.8900000000000004e-002 | AJ199: =H199+100*O199 -> 118.789 | AK199: 118.8 | AL199: 55 | AM199: 26.8 | AN199: 64 | AO199: 2.8999999999999998e-002 | AP199: 15 | AQ199: 青农转债!
A200: 94 | B200: 128135 | C200: 洽洽转债! | D200: 2557 | E200: 洽洽食品 | F200: 食品饮料 | G200: 休闲食品 | H200: 117 | I200: 0. | J200: -4.6999999999999993e-003 | K200: 52.86 | L200: -1.1000000000000001e-002 | M200: 120.2 | N200: 60.83 | O200: 0.34600000000000003 | P200: 86.9 | Q200: 转股中 | R200: 5.43年 | S200: 3.44年 | T200: 13.4 | U200: 3.1 | V200: 2.e-003 | W200: 5.0000000000000003e-002 | X200: 4.2999999999999997e-002 | Y200: 268 | Z200: 6.27 | AA200: 5.1000000000000004e-003 | AB200: -1.2999999999999999e-003 | AC200: -3.32e-002 | AD200: -3.5099999999999999e-002 | AE200: 88.97 | AF200: 95.59 | AG200: 0.42 | AH200: AA | AI200: 4.3899999999999995e-002 | AJ200: =H200+100*O200 -> 151.59999999999999 | AK200: 147.1 | AL200: 284 | AM200: 51.5 | AN200: 265 | AO200: 4.0000000000000001e-003 | AP200: 11 | AQ200: 洽洽转债!
A201: 217 | B201: 123038 | C201: 联得转债! | D201: 300545 | E201: 联得装备 | F201: 机械装备 | G201: 专用设备 | H201: 116 | I201: -1.9900000000000001e-002 | J201: 2.63e-002 | K201: 21.43 | L201: 1.1299999999999999e-002 | M201: 118.6 | N201: 24.17 | O201: 0.308 | P201: 88.66 | Q201: 转股中 | R201: 4.61年 | S201: 2.62年 | T201: 1.47 | U201: 322 | V201: 1.9099999999999999 | W201: 3.9e-002 | X201: 3.4000000000000002e-002 | Y201: 38 | Z201: 3.94 | AA201: 4.8999999999999998e-003 | AB201: -2.0999999999999999e-003 | AC201: -3.9399999999999998e-002 | AD201: -4.1900000000000007e-002 | AE201: 85.24 | AF201: 85.81 | AG201: 0.57 | AH201: A+ | AI201: 7.4400000000000008e-002 | AJ201: =H201+100*O201 -> 146.80000000000001 | AK201: 143.3 | AL201: 271 | AM201: 57.5 | AN201: 288 | AO201: -5.0999999999999997e-002 | AP201: 19 | AQ201: 联得转债!
A202: 330 | B202: 128034 | C202: 江银转债! | D202: 2807 | E202: 江阴银行 | F202: 金融 | G202: 银行行业 | H202: 106.99 | I202: 1.4999999999999999e-002 | J202: -6.8999999999999999e-003 | K202: 4.12 | L202: 1.7299999999999999e-002 | M202: 108.3 | N202: 4.32 | O202: 0.122 | P202: 95.37 | Q202: 转股中 | R202: 2.70年 | S202: 无权 | T202: 17.6 | U202: 16 | V202: 9.0000000000000011e-003 | W202: 0.19600000000000001 | X202: 0.187 | Y202: 89 | Z202: 0.75 | AA202: 4.5999999999999999e-003 | AB202: -1.1999999999999999e-003 | AC202: 无权 | AD202: 无权 | AE202: 无权 | AF202: 97.9 | AG202: 0.47 | AH202: AA+ | AI202: 3.85e-002 | AJ202: =H202+100*O202 -> 119.19 | AK202: 118.6 | AL202: 50 | AM202: 20.7 | AN202: 19 | AO202: -1.1000000000000001e-002 | AP202: 26 | AQ202: 江银转债!
A203: 234 | B203: 123033 | C203: 金力转债! | D203: 300748 | E203: 金力永磁 | F203: 电子 | G203: 元器件制 | H203: 119.11 | I203: 9.3999999999999986e-003 | J203: 1.44e-002 | K203: 23.84 | L203: 4.3799999999999999e-002 | M203: 121.5 | N203: 25.3 | O203: 0.26400000000000001 | P203: 94.23 | Q203: 转股中 | R203: 4.47年 | S203: 2.47年 | T203: 4.34 | U203: 91 | V203: 0.17399999999999999 | W203: 2.6000000000000002e-002 | X203: 2.5000000000000001e-002 | Y203: 165 | Z203: 4.9 | AA203: 4.5999999999999999e-003 | AB203: -3.7000000000000002e-003 | AC203: -4.7400000000000005e-002 | AD203: -5.0799999999999998e-002 | AE203: 89.53 | AF203: 93.1 | AG203: 0.54 | AH203: AA- | AI203: 6.3399999999999998e-002 | AJ203: =H203+100*O203 -> 145.50999999999999 | AK203: 144 | AL203: 276 | AM203: 50.9 | AN203: 263 | AO203: -0.35499999999999998 | AP203: 27 | AQ203: 金力转债!
A204: 101 | B204: 113603 | C204: 东缆转债 | D204: 603606 | E204: 东方电缆 | F204: 能源电力 | G204: 电力设备 | H204: 112.37 | I204: -1.e-004 | J204: 4.8999999999999998e-003 | K204: 19.76 | L204: 1.1299999999999999e-002 | M204: 115.1 | N204: 23.88 | O204: 0.35799999999999998 | P204: 82.75 | Q204: 转股中 | R204: 5.36年 | S204: 3.36年 | T204: 8 | U204: 5.4 | V204: 6.0000000000000001e-003 | W204: 6.2e-002 | X204: 5.0999999999999997e-002 | Y204: 129 | Z204: 3.87 | AA204: 4.5999999999999999e-003 | AB204: -5.0000000000000001e-004 | AC204: -2.29e-002 | AD204: -2.4799999999999999e-002 | AE204: 89.14 | AF204: 91.82 | AG204: 0.43 | AH204: AA | AI204: 4.3899999999999995e-002 | AJ204: =H204+100*O204 -> 148.17000000000002 | AK204: 142 | AL204: 264 | AM204: 50.2 | AN204: 260 | AO204: -9.5000000000000001e-002 | AP204: 7 | AQ204: 东缆转债
A205: 129 | B205: 110073 | C205: 国投转债 | D205: 600061 | E205: 国投资本 | F205: 金融 | G205: 证券行业 | H205: 108 | I205: 1.3100000000000001e-002 | J205: 2.7200000000000002e-002 | K205: 13.6 | L205: 8.1099999999999992e-002 | M205: 110.5 | N205: 15.25 | O205: 0.21100000000000002 | P205: 89.18 | Q205: 转股中 | R205: 5.19年 | S205: 无权 | T205: 80 | U205: 160 | V205: 1.9e-002 | W205: 0.13900000000000001 | X205: 0.124 | Y205: 575 | Z205: 1.32 | AA205: 4.5000000000000005e-003 | AB205: 7.000000000000001e-004 | AC205: 无权 | AD205: 无权 | AE205: 无权 | AF205: 90.88 | AG205: 0.5 | AH205: AAA | AI205: 3.8900000000000004e-002 | AJ205: =H205+100*O205 -> 129.09999999999999 | AK205: 126.8 | AL205: 136 | AM205: 35.9 | AN205: 159 | AO205: 5.9999999999999998e-002 | AP205: 23 | AQ205: 国投转债
A206: 340 | B206: 128025 | C206: 特一转债! | D206: 2728 | E206: 特一药业 | F206: 医药 | G206: 化学制药 | H206: 107.608 | I206: 1.3300000000000001e-002 | J206: 1.41e-002 | K206: 14.59 | L206: 4.8099999999999997e-002 | M206: 108.8 | N206: 14.7 | O206: 8.4000000000000005e-002 | P206: 99.25 | Q206: 转股中 | R206: 2.56年 | S206: 0.56年 | T206: 2.99 | U206: 253 | V206: 0.78099999999999992 | W206: 0.10099999999999999 | X206: 0.10000000000000001 | Y206: 30 | Z206: 2.78 | AA206: 4.4000000000000003e-003 | AB206: -2.0999999999999999e-003 | AC206: -7.6399999999999996e-002 | AD206: -8.0199999999999994e-002 | AE206: 97.23 | AF206: 93.58 | AG206: 0.57 | AH206: AA- | AI206: 6.1500000000000006e-002 | AJ206: =H206+100*O206 -> 116.00800000000001 | AK206: 116 | AL206: 33 | AM206: 18.7 | AN206: 13 | AO206: 0.17399999999999999 | AP206: 53 | AQ206: 特一转债!
A207: 190 | B207: 128101 | C207: 联创转债! | D207: 2036 | E207: 联创电子 | F207: 电子 | G207: 液晶显示 | H207: 112.5 | I207: 9.8999999999999991e-003 | J207: -7.6e-003 | K207: 11.1 | L207: 6.3e-003 | M207: 114.8 | N207: 13.74 | O207: 0.39299999999999996 | P207: 80.79 | Q207: 转股中 | R207: 4.84年 | S207: 2.84年 | T207: 3 | U207: 55 | V207: 0.161 | W207: 2.5000000000000001e-002 | X207: 2.1000000000000001e-002 | Y207: 118 | Z207: 3.2 | AA207: 4.3e-003 | AB207: -1.1999999999999999e-003 | AC207: -2.8199999999999999e-002 | AD207: -3.0200000000000001e-002 | AE207: 91.27 | AF207: 94.26 | AG207: 0.37 | AH207: AA | AI207: 4.24e-002 | AJ207: =H207+100*O207 -> 151.80000000000001 | AK207: 144.2 | AL207: 278 | AM207: 50 | AN207: 257 | AO207: 4.9000000000000002e-002 | AP207: 16 | AQ207: 联创转债!
A208: 209 | B208: 128094 | C208: 星帅转债 | D208: 2860 | E208: 星帅尔 | F208: 家电 | G208: 零部件制 | H208: 119 | I208: 0. | J208: 7.3000000000000001e-003 | K208: 16.41 | L208: 9.7999999999999997e-003 | M208: 121 | N208: 13.95 | O208: 1.2e-002 | P208: 117.63 | Q208: 转股中 | R208: 4.67年 | S208: 2.68年 | T208: 2.71 | U208: 12 | V208: 3.9e-002 | W208: 8.3000000000000004e-002 | X208: 9.6999999999999989e-002 | Y208: 33 | Z208: 3.21 | AA208: 3.7000000000000002e-003 | AB208: -4.0999999999999995e-003 | AC208: -4.6500000000000007e-002 | AD208: -4.9100000000000005e-002 | AE208: 85.07 | AF208: 87.2 | AG208: 0.74 | AH208: A+ | AI208: 7.4400000000000008e-002 | AJ208: =H208+100*O208 -> 120.2 | AK208: 120.4 | AL208: 62 | AM208: 33.2 | AN208: 131 | AO208: 2.2000000000000002e-002 | AP208: 30 | AQ208: 星帅转债
A209: 314 | B209: 110045 | C209: 海澜转债! | D209: 600398 | E209: 海澜之家 | F209: 服装纺织 | G209: 服装行业 | H209: 109.89 | I209: -3.7000000000000002e-003 | J209: -9.7000000000000003e-003 | K209: 7.27 | L209: -2.5499999999999998e-002 | M209: 111.1 | N209: 7.3 | O209: 0.10300000000000001 | P209: 99.59 | Q209: 转股中 | R209: 3年59天 | S209: 1.16年 | T209: 29.5 | U209: 24 | V209: 6.9999999999999993e-003 | W209: 9.4e-002 | X209: 9.4e-002 | Y209: 314 | Z209: 2.24 | AA209: 3.4999999999999996e-003 | AB209: -3.0000000000000001e-003 | AC209: -5.4699999999999999e-002 | AD209: -5.7500000000000002e-002 | AE209: 96.82 | AF209: 98.22 | AG209: 0.53 | AH209: AA+ | AI209: 4.0399999999999998e-002 | AJ209: =H209+100*O209 -> 120.19 | AK209: 120.2 | AL209: 60 | AM209: 22 | AN209: 25 | AO209: 5.2999999999999999e-002 | AP209: 56 | AQ209: 海澜转债!
A210: 302 | B210: 128048 | C210: 张行转债 | D210: 2839 | E210: 张家港行 | F210: 金融 | G210: 银行行业 | H210: 112 | I210: 1.3899999999999999e-002 | J210: -4.7999999999999996e-003 | K210: 5.68 | L210: 1.7899999999999999e-002 | M210: 113.3 | N210: 5.76 | O210: 0.13600000000000001 | P210: 98.61 | Q210: 转股中 | R210: 3.50年 | S210: 无权 | T210: 25 | U210: 25 | V210: 9.0000000000000011e-003 | W210: 0.24299999999999999 | X210: 0.23999999999999999 | Y210: 103 | Z210: 0.92 | AA210: 3.4000000000000002e-003 | AB210: -3.4999999999999996e-003 | AC210: 无权 | AD210: 无权 | AE210: 无权 | AF210: 98.92 | AG210: 0.51 | AH210: AA+ | AI210: 4.0399999999999998e-002 | AJ210: =H210+100*O210 -> 125.59999999999999 | AK210: 125.4 | AL210: 119 | AM210: 26.5 | AN210: 60 | AO210: 3.3000000000000002e-002 | AP210: 13 | AQ210: 张行转债
A211: 253 | B211: 113542 | C211: 好客转债 | D211: 603898 | E211: 好莱客 | F211: 其他 | G211: 家居用品 | H211: 113.31 | I211: -7.6e-003 | J211: -3.2000000000000002e-003 | K211: 16.1 | L211: -2.0099999999999996e-002 | M211: 114.9 | N211: 16.27 | O211: 0.14499999999999999 | P211: 98.96 | Q211: 转股中 | R211: 4.21年 | S211: 2.22年 | T211: 6.03 | U211: 11 | V211: 1.6e-002 | W211: 0.12 | X211: 0.11900000000000001 | Y211: 50 | Z211: 1.95 | AA211: 3.4000000000000002e-003 | AB211: -3.0000000000000001e-003 | AC211: -3.8100000000000002e-002 | AD211: -4.07e-002 | AE211: 93.76 | AF211: 96.82 | AG211: 0.54 | AH211: AA | AI211: 4.24e-002 | AJ211: =H211+100*O211 -> 127.81 | AK211: 127.7 | AL211: 146 | AM211: 30.8 | AN211: 108 | AO211: -8.1000000000000003e-002 | AP211: 18 | AQ211: 好客转债
A212: 26 | B212: 113045 | C212: 环旭转债 | D212: 601231 | E212: 环旭电子 | F212: 电子 | G212: 电子产品 | H212: 109.89 | I212: 5.4000000000000003e-003 | J212: -5.9999999999999995e-004 | K212: 15.51 | L212: 1.37e-002 | M212: 112 | N212: 20.25 | O212: 0.435 | P212: 76.59 | Q212: 7月0天 | R212: 5.80年 | S212: 2.81年 | T212: 34.5 | U212: 11 | V212: 3.0000000000000001e-003 | W212: 0.10099999999999999 | X212: 7.6999999999999999e-002 | Y212: 343 | Z212: 2.76 | AA212: 3.3e-003 | AB212: -5.0000000000000001e-004 | AC212: -2.1899999999999999e-002 | AD212: -2.3700000000000002e-002 | AE212: 91.09 | AF212: 88.51 | AG212: 0.35 | AH212: AA+ | AI212: 4.1900000000000007e-002 | AJ212: =H212+100*O212 -> 153.38999999999999 | AK212: 143.2 | AL212: 270 | AM212: 52.1 | AN212: 268 | AO212: -0.11599999999999999 | AP212: 4 | AQ212: 环旭转债
A213: 87 | B213: 123073 | C213: 同和转债! | D213: 300636 | E213: 同和药业 | F213: 医药 | G213: 原料药 | H213: 120.33 | I213: 1.2800000000000001e-002 | J213: 2.0999999999999999e-003 | K213: 28.45 | L213: 1.9299999999999998e-002 | M213: 122.4 | N213: 23.8 | O213: 6.9999999999999993e-003 | P213: 119.54 | Q213: 转股中 | R213: 5.45年 | S213: 3.45年 | T213: 3.6 | U213: 19 | V213: 4.2999999999999997e-002 | W213: 9.8000000000000004e-002 | X213: 0.11800000000000001 | Y213: 37 | Z213: 4.66 | AA213: 3.2000000000000002e-003 | AB213: -3.8e-003 | AC213: -3.85e-002 | AD213: -4.07e-002 | AE213: 80.53 | AF213: 82.95 | AG213: 0.77 | AH213: A+ | AI213: 7.5899999999999995e-002 | AJ213: =H213+100*O213 -> 121.03 | AK213: 121.1 | AL213: 74 | AM213: 38.2 | AN213: 188 | AO213: 1.3999999999999999e-002 | AP213: 11 | AQ213: 同和转债!
A214: 270 | B214: 128064 | C214: 司尔转债! | D214: 2538 | E214: 司尔特 | F214: 化工 | G214: 农化 | H214: 113 | I214: 5.3e-003 | J214: -2.e-002 | K214: 6.39 | L214: -2.4399999999999998e-002 | M214: 114.3 | N214: 6.07 | O214: 7.2999999999999995e-002 | P214: 105.27 | Q214: 转股中 | R214: 3.90年 | S214: 1.90年 | T214: 8 | U214: 15 | V214: 1.6e-002 | W214: 0.17399999999999999 | X214: 0.184 | Y214: 46 | Z214: 1.14 | AA214: 3.0000000000000001e-003 | AB214: -3.5999999999999999e-003 | AC214: -4.4999999999999998e-002 | AD214: -4.7500000000000001e-002 | AE214: 94.4 | AF214: 97.49 | AG214: 0.6 | AH214: AA | AI214: 4.24e-002 | AJ214: =H214+100*O214 -> 120.3 | AK214: 120.7 | AL214: 66 | AM214: 23.2 | AN214: 33 | AO214: 1.3999999999999999e-002 | AP214: 48 | AQ214: 司尔转债!
A215: 136 | B215: 127020 | C215: 中金转债 | D215: 60 | E215: 中金岭南 | F215: 有色金属 | G215: 有色行业 | H215: 112 | I215: -8.9999999999999998e-004 | J215: -2.8999999999999998e-003 | K215: 4.87 | L215: -6.0999999999999995e-003 | M215: 113.7 | N215: 4.71 | O215: 8.3000000000000004e-002 | P215: 103.4 | Q215: 转股中 | R215: 5.18年 | S215: 3.18年 | T215: 38 | U215: 70 | V215: 1.6e-002 | W215: 0.21899999999999997 | X215: 0.22600000000000001 | Y215: 174 | Z215: 1.46 | AA215: 3.0000000000000001e-003 | AB215: -1.8e-003 | AC215: -2.64e-002 | AD215: -2.7799999999999998e-002 | AE215: 89.37 | AF215: 92.19 | AG215: 0.62 | AH215: AA+ | AI215: 4.1900000000000007e-002 | AJ215: =H215+100*O215 -> 120.3 | AK215: 120.6 | AL215: 65 | AM215: 28.4 | AN215: 81 | AO215: 1.2e-002 | AP215: 15 | AQ215: 中金转债
A216: 92 | B216: 123072 | C216: 乐歌转债! | D216: 300729 | E216: 乐歌股份 | F216: 其他 | G216: 家居用品 | H216: 127.86 | I216: -1.5700000000000002e-002 | J216: 1.66e-002 | K216: 31.34 | L216: 1.3600000000000001e-002 | M216: 129.6 | N216: 73.13 | O216: 1.98 | P216: 42.86 | Q216: 转股中 | R216: 5.44年 | S216: 3.44年 | T216: 1.42 | U216: 93 | V216: 0.50800000000000001 | W216: 3.3000000000000002e-002 | X216: 1.3999999999999999e-002 | Y216: 44 | Z216: 4.25 | AA216: 2.5999999999999999e-003 | AB216: -6.1999999999999998e-003 | AC216: -4.9599999999999998e-002 | AD216: -5.2900000000000003e-002 | AE216: 82.3 | AF216: 88.18 | AG216: 0.07 | AH216: A+ | AI216: 7.5899999999999995e-002 | AJ216: =H216+100*O216 -> 325.86000000000001 | AK216: 212.9 | AL216: 342 | AM216: 124.7 | AN216: 343 | AO216: -9.3000000000000013e-002 | AP216: 8 | AQ216: 乐歌转债!
A217: 1 | B217: 123113 | C217: N仙乐转 | D217: 300791 | E217: 仙乐健康 | F217: 食品饮料 | G217: 食品饮料 | H217: 116.99 | I217: 0.17000000000000001 | J217: 0. | K217: 79.15 | L217: 5.2199999999999996e-002 | M217: 118.5 | N217: 85.98 | O217: 0.27100000000000002 | P217: 92.06 | Q217: 5月14天 | R217: 5.93年 | S217: 3.93年 | T217: 10.3 | U217: 941 | V217: 0.75800000000000001 | W217: 0.10800000000000001 | X217: 9.9000000000000005e-002 | Y217: 95 | Z217: 4.24 | AA217: 2.2000000000000001e-003 | AB217: -3.2000000000000002e-003 | AC217: -2.8900000000000002e-002 | AD217: -3.0600000000000002e-002 | AE217: 80.44 | AF217: 82.2 | AG217: 0.63 | AH217: AA- | AI217: 6.4899999999999999e-002 | AJ217: =H217+100*O217 -> 144.09 | AK217: 141.9 | AL217: 263 | AM217: 59.7 | AN217: 295 | AO217: -3.4000000000000002e-002 | AP217: 1 | AQ217: N仙乐转
A218: 211 | B218: 127015 | C218: 希望转债! | D218: 876 | E218: 新 希 望 | F218: 农业 | G218: 畜牧业 | H218: 109.2 | I218: 1.8e-003 | J218: 3.5999999999999999e-003 | K218: 15.92 | L218: 1.5300000000000001e-002 | M218: 110 | N218: 19.75 | O218: 0.35499999999999998 | P218: 80.61 | Q218: 转股中 | R218: 4.64年 | S218: 2.64年 | T218: 9.5 | U218: 17 | V218: 1.7000000000000001e-002 | W218: 1.3000000000000001e-002 | X218: 1.1000000000000001e-002 | Y218: 717 | Z218: 1.93 | AA218: 1.6000000000000001e-003 | AB218: -2.3999999999999998e-003 | AC218: -2.1899999999999999e-002 | AD218: -2.3700000000000002e-002 | AE218: 92.68 | AF218: 93.02 | AG218: 0.36 | AH218: AAA | AI218: 3.7400000000000003e-002 | AJ218: =H218+100*O218 -> 144.69999999999999 | AK218: 137.8 | AL218: 244 | AM218: 44.8 | AN218: 228 | AO218: -6.0999999999999999e-002 | AP218: 28 | AQ218: 希望转债!
A219: 163 | B219: 128109 | C219: 楚江转债 | D219: 2171 | E219: 楚江新材 | F219: 有色金属 | G219: 铜金属 | H219: 114.666 | I219: 1.7000000000000001e-003 | J219: -2.3e-003 | K219: 8.05 | L219: -1.1999999999999999e-003 | M219: 115.3 | N219: 8.73 | O219: 0.24399999999999999 | P219: 92.21 | Q219: 转股中 | R219: 5年20天 | S219: 3年21天 | T219: 18.3 | U219: 5.4 | V219: 3.0000000000000001e-003 | W219: 0.17000000000000001 | X219: 0.157 | Y219: 107 | Z219: 1.89 | AA219: 1.1000000000000001e-003 | AB219: -4.3e-003 | AC219: -3.0699999999999998e-002 | AD219: -3.2899999999999999e-002 | AE219: 90.52 | AF219: 93.23 | AG219: 0.51 | AH219: AA | AI219: 4.3899999999999995e-002 | AJ219: =H219+100*O219 -> 139.066 | AK219: 137.1 | AL219: 241 | AM219: 43.9 | AN219: 224 | AO219: 2.4e-002 | AP219: 7 | AQ219: 楚江转债
A220: 41 | B220: 127028 | C220: 英特转债! | D220: 411 | E220: 英特集团 | F220: 医药 | G220: 医药商业 | H220: 112.5 | I220: 1.1000000000000001e-002 | J220: -4.1999999999999997e-003 | K220: 15.36 | L220: 9.1999999999999998e-003 | M220: 113.1 | N220: 13.46 | O220: -1.3999999999999999e-002 | P220: 114.12 | Q220: 58天 | R220: 5.64年 | S220: 3.65年 | T220: 6 | U220: 200 | V220: 0.29600000000000004 | W220: 0.157 | X220: 0.17899999999999999 | Y220: 38 | Z220: 2.25 | AA220: 1.e-003 | AB220: -3.3e-003 | AC220: -2.1499999999999998e-002 | AD220: -2.3300000000000001e-002 | AE220: 88.71 | AF220: 90.09 | AG220: 0.73 | AH220: AA+ | AI220: 4.1900000000000007e-002 | AJ220: =H220+100*O220 -> 111.09999999999999 | AK220: 110.9 | AL220: 13 | AM220: 20.8 | AN220: 20 | AO220: 6.8000000000000005e-002 | AP220: 14 | AQ220: 英特转债!
A221: 165 | B221: 127017 | C221: 万青转债 | D221: 789 | E221: 万年青 | F221: 建筑 | G221: 水泥 | H221: 117.9 | I221: 3.4000000000000002e-003 | J221: 8.5000000000000006e-003 | K221: 14.23 | L221: 2.1499999999999998e-002 | M221: 118.4 | N221: 14.16 | O221: 0.17300000000000001 | P221: 100.49 | Q221: 转股中 | R221: 5年19天 | S221: 3年20天 | T221: 10 | U221: 2.1 | V221: 2.e-003 | W221: 8.8000000000000009e-002 | X221: 8.900000000000001e-002 | Y221: 113 | Z221: 1.73 | AA221: 8.9999999999999998e-004 | AB221: -5.5000000000000005e-003 | AC221: -3.9300000000000002e-002 | AD221: -4.1399999999999999e-002 | AE221: 91.03 | AF221: 96.64 | AG221: 0.55 | AH221: AA+ | AI221: 4.1900000000000007e-002 | AJ221: =H221+100*O221 -> 135.20000000000002 | AK221: 135.3 | AL221: 226 | AM221: 38.7 | AN221: 189 | AO221: 3.3000000000000002e-002 | AP221: 9 | AQ221: 万青转债
A222: 61 | B222: 113612 | C222: 永冠转债 | D222: 603681 | E222: 永冠新材 | F222: 化工 | G222: 其他 | H222: 120.75 | I222: 4.4500000000000005e-002 | J222: 5.1000000000000004e-003 | K222: 24.89 | L222: 6.4600000000000005e-002 | M222: 121.2 | N222: 20.79 | O222: 9.0000000000000011e-003 | P222: 119.72 | Q222: 31天 | R222: 5.57年 | S222: 3.57年 | T222: 5.2 | U222: 127 | V222: 0.20499999999999999 | W222: 0.125 | X222: 0.14999999999999999 | Y222: 41 | Z222: 2.63 | AA222: 7.000000000000001e-004 | AB222: -5.7999999999999996e-003 | AC222: -3.9300000000000002e-002 | AD222: -4.1200000000000001e-002 | AE222: 82.55 | AF222: 86.06 | AG222: 0.77 | AH222: AA- | AI222: 6.4899999999999999e-002 | AJ222: =H222+100*O222 -> 121.65000000000001 | AK222: 121.8 | AL222: 79 | AM222: 35.7 | AN222: 155 | AO222: 9.9000000000000005e-002 | AP222: 5 | AQ222: 永冠转债
A223: 297 | B223: 128051 | C223: 光华转债! | D223: 2741 | E223: 光华科技 | F223: 电子 | G223: 元器件制 | H223: 114.567 | I223: -4.0000000000000002e-004 | J223: 4.8999999999999998e-003 | K223: 14.37 | L223: 6.3e-003 | M223: 114.8 | N223: 12.72 | O223: 1.3999999999999999e-002 | P223: 112.97 | Q223: 转股中 | R223: 3.58年 | S223: 1.59年 | T223: 2.47 | U223: 7.3 | V223: 2.6000000000000002e-002 | W223: 4.5999999999999999e-002 | X223: 5.2000000000000005e-002 | Y223: 54 | Z223: 4.35 | AA223: 5.9999999999999995e-004 | AB223: -6.8000000000000005e-003 | AC223: -5.8700000000000002e-002 | AD223: -6.1900000000000004e-002 | AE223: 92.68 | AF223: 92.54 | AG223: 0.7 | AH223: AA- | AI223: 6.3399999999999998e-002 | AJ223: =H223+100*O223 -> 115.967 | AK223: 116.2 | AL223: 34 | AM223: 23.5 | AN223: 36 | AO223: 2.7999999999999997e-002 | AP223: 26 | AQ223: 光华转债!
A224: 6 | B224: 113623 | C224: 凤21转债 | D224: 603225 | E224: 新凤鸣 | F224: 化工 | G224: 化纤 | H224: 116.9 | I224: -8.9999999999999998e-004 | J224: -2.3999999999999998e-003 | K224: 17.79 | L224: -5.0000000000000001e-003 | M224: 117.1 | N224: 16.6 | O224: 9.0999999999999998e-002 | P224: 107.17 | Q224: 5月3天 | R224: 5.90年 | S224: 3.90年 | T224: 25 | U224: 28 | V224: 1.e-002 | W224: 0.10000000000000001 | X224: 0.107 | Y224: 249 | Z224: 2.04 | AA224: 2.9999999999999997e-004 | AB224: -4.7999999999999996e-003 | AC224: -2.9500000000000002e-002 | AD224: -3.1099999999999999e-002 | AE224: 87.11 | AF224: 91.28 | AG224: 0.65 | AH224: AA | AI224: 4.3899999999999995e-002 | AJ224: =H224+100*O224 -> 126. | AK224: 126.6 | AL224: 133 | AM224: 35.4 | AN224: 152 | AO224: 2.8999999999999998e-002 | AP224: 2 | AQ224: 凤21转债
A225: 30 | B225: 123099 | C225: 普利转债 | D225: 300630 | E225: 普利制药 | F225: 医药 | G225: 化学制药 | H225: 123.35 | I225: 1.0500000000000001e-002 | J225: -6.1999999999999998e-003 | K225: 48.44 | L225: 6.4000000000000003e-003 | M225: 123.5 | N225: 46.22 | O225: 0.17699999999999999 | P225: 104.8 | Q225: 3月11天 | R225: 5.74年 | S225: 3.74年 | T225: 8.5 | U225: 6.6 | V225: 6.0000000000000001e-003 | W225: 4.0000000000000001e-002 | X225: 4.2000000000000003e-002 | Y225: 212 | Z225: 9.7 | AA225: 2.0000000000000001e-004 | AB225: -6.6e-003 | AC225: -4.3499999999999997e-002 | AD225: -4.5199999999999997e-002 | AE225: 81.41 | AF225: 86.67 | AG225: 0.67 | AH225: AA- | AI225: 6.4899999999999999e-002 | AJ225: =H225+100*O225 -> 141.04999999999998 | AK225: 141.9 | AL225: 262 | AM225: 55.2 | AN225: 279 | AO225: 1.3999999999999999e-002 | AP225: 4 | AQ225: 普利转债
A226: 111 | B226: 113602 | C226: 景20转债! | D226: 603228 | E226: 景旺电子 | F226: 电子 | G226: 元器件制 | H226: 113.4 | I226: -5.0000000000000001e-004 | J226: -2.2000000000000001e-003 | K226: 25.48 | L226: -5.1000000000000004e-003 | M226: 113.3 | N226: 27.4 | O226: 0.21899999999999997 | P226: 92.99 | Q226: 转股中 | R226: 5.28年 | S226: 3.28年 | T226: 17.8 | U226: 3 | V226: 1.e-003 | W226: 8.199999999999999e-002 | X226: 7.5999999999999998e-002 | Y226: 217 | Z226: 3.34 | AA226: -2.0000000000000001e-004 | AB226: -4.6999999999999993e-003 | AC226: -2.5600000000000001e-002 | AD226: -2.76e-002 | AE226: 89.66 | AF226: 90.75 | AG226: 0.54 | AH226: AA | AI226: 4.3899999999999995e-002 | AJ226: =H226+100*O226 -> 135.30000000000001 | AK226: 133.8 | AL226: 209 | AM226: 43.1 | AN226: 215 | AO226: -5.9000000000000004e-002 | AP226: 9 | AQ226: 景20转债!
A227: 68 | B227: 123079 | C227: 运达转债 | D227: 300772 | E227: 运达股份 | F227: 能源电力 | G227: 风能 | H227: 115.201 | I227: -1.7000000000000001e-003 | J227: 4.0999999999999995e-003 | K227: 15.64 | L227: 3.9000000000000003e-003 | M227: 115.1 | N227: 15.31 | O227: 0.128 | P227: 102.16 | Q227: 24天 | R227: 5.55年 | S227: 3.55年 | T227: 5.77 | U227: 5.6 | V227: 8.0000000000000002e-003 | W227: 0.126 | X227: 0.128 | Y227: 46 | Z227: 2.72 | AA227: -2.0000000000000001e-004 | AB227: -5.0000000000000001e-003 | AC227: -2.8399999999999998e-002 | AD227: -3.0099999999999998e-002 | AE227: 88.43 | AF227: 91.09 | AG227: 0.63 | AH227: AA | AI227: 4.3899999999999995e-002 | AJ227: =H227+100*O227 -> 128.001 | AK227: 128.2 | AL227: 157 | AM227: 37.2 | AN227: 181 | AO227: 0. | AP227: 4 | AQ227: 运达转债
A228: 285 | B228: 128057 | C228: 博彦转债 | D228: 2649 | E228: 博彦科技 | F228: 计算机及 | G228: 软件开发 | H228: 116.437 | I228: 1.6899999999999998e-002 | J228: -7.1999999999999998e-003 | K228: 9.61 | L228: 1.37e-002 | M228: 116.3 | N228: 8.5 | O228: 2.9999999999999999e-002 | P228: 113.06 | Q228: 转股中 | R228: 3.81年 | S228: 1.81年 | T228: 5.07 | U228: 9.1 | V228: 1.4999999999999999e-002 | W228: 9.9000000000000005e-002 | X228: 0.11199999999999999 | Y228: 51 | Z228: 1.69 | AA228: -2.9999999999999997e-004 | AB228: -7.9000000000000008e-003 | AC228: -6.1500000000000006e-002 | AD228: -6.4100000000000004e-002 | AE228: 91.13 | AF228: 92.43 | AG228: 0.7 | AH228: AA- | AI228: 6.3399999999999998e-002 | AJ228: =H228+100*O228 -> 119.437 | AK228: 119.8 | AL228: 58 | AM228: 27.4 | AN228: 71 | AO228: -3.6000000000000004e-002 | AP228: 27 | AQ228: 博彦转债
A229: 121 | B229: 113598 | C229: 法兰转债 | D229: 603966 | E229: 法兰泰克 | F229: 机械装备 | G229: 工程机械 | H229: 121.36 | I229: -3.2000000000000002e-003 | J229: -8.3999999999999995e-003 | K229: 16.5 | L229: -1.55e-002 | M229: 121.2 | N229: 13.88 | O229: 2.1000000000000001e-002 | P229: 118.88 | Q229: 转股中 | R229: 5.21年 | S229: 3.21年 | T229: 2.75 | U229: 8.7 | V229: 2.6000000000000002e-002 | W229: 7.8e-002 | X229: 9.3000000000000013e-002 | Y229: 35 | Z229: 3.04 | AA229: -2.9999999999999997e-004 | AB229: -7.1999999999999998e-003 | AC229: -4.4800000000000006e-002 | AD229: -4.7e-002 | AE229: 84.41 | AF229: 88 | AG229: 0.75 | AH229: AA- | AI229: 6.4899999999999999e-002 | AJ229: =H229+100*O229 -> 123.45999999999999 | AK229: 123.8 | AL229: 106 | AM229: 35.8 | AN229: 157 | AO229: -3.4000000000000002e-002 | AP229: 9 | AQ229: 法兰转债
A230: 109 | B230: 128130 | C230: 景兴转债 | D230: 2067 | E230: 景兴纸业 | F230: 造纸包装 | G230: 包装用纸 | H230: 115.477 | I230: 1.e-004 | J230: 1.7000000000000001e-003 | K230: 3.85 | L230: 2.5999999999999999e-003 | M230: 115.1 | N230: 3.4 | O230: 2.e-002 | P230: 113.24 | Q230: 转股中 | R230: 5.30年 | S230: 3.30年 | T230: 10.8 | U230: 7.9 | V230: 6.0000000000000001e-003 | W230: 0.24199999999999999 | X230: 0.27399999999999997 | Y230: 45 | Z230: 0.91 | AA230: -5.9999999999999995e-004 | AB230: -5.6999999999999993e-003 | AC230: -3.1099999999999999e-002 | AD230: -3.3000000000000002e-002 | AE230: 89.4 | AF230: 92.08 | AG230: 0.69 | AH230: AA | AI230: 4.3899999999999995e-002 | AJ230: =H230+100*O230 -> 117.477 | AK230: 117.7 | AL230: 41 | AM230: 25.6 | AN230: 52 | AO230: 1.e-002 | AP230: 14 | AQ230: 景兴转债
A231: 78 | B231: 127024 | C231: 盈峰转债 | D231: 967 | E231: 盈峰环境 | F231: 机械装备 | G231: 专用设备 | H231: 117.399 | I231: 1.01e-002 | J231: 9.0000000000000011e-003 | K231: 8.15 | L231: 3.4300000000000004e-002 | M231: 116.8 | N231: 8.31 | O231: 0.19699999999999998 | P231: 98.07 | Q231: 转股中 | R231: 5.47年 | S231: 3.48年 | T231: 14.8 | U231: 16 | V231: 9.0000000000000011e-003 | W231: 5.7000000000000002e-002 | X231: 5.5999999999999994e-002 | Y231: 258 | Z231: 1.53 | AA231: -8.9999999999999998e-004 | AB231: -6.3e-003 | AC231: -3.4700000000000002e-002 | AD231: -3.6400000000000002e-002 | AE231: 89.05 | AF231: 93.64 | AG231: 0.56 | AH231: AA+ | AI231: 4.1900000000000007e-002 | AJ231: =H231+100*O231 -> 137.09899999999999 | AK231: 136.7 | AL231: 237 | AM231: 43.1 | AN231: 216 | AO231: 1.3000000000000001e-002 | AP231: 5 | AQ231: 盈峰转债
A232: 80 | B232: 128136 | C232: 立讯转债! | D232: 2475 | E232: 立讯精密 | F232: 电子 | G232: 元器件制 | H232: 112.736 | I232: -2.e-003 | J232: 4.1999999999999997e-003 | K232: 33.47 | L232: 1.55e-002 | M232: 111.9 | N232: 58.36 | O232: 0.96599999999999997 | P232: 57.35 | Q232: 转股中 | R232: 5.47年 | S232: 3.47年 | T232: 30 | U232: 14 | V232: 4.0000000000000001e-003 | W232: 1.3000000000000001e-002 | X232: 6.9999999999999993e-003 | Y232: 2355. | Z232: 8.15 | AA232: -1.4000000000000002e-003 | AB232: -5.3e-003 | AC232: -2.6099999999999998e-002 | AD232: -2.7400000000000001e-002 | AE232: 88.23 | AF232: 89.62 | AG232: 0.14 | AH232: AA+ | AI232: 4.1900000000000007e-002 | AJ232: =H232+100*O232 -> 209.33600000000001 | AK232: 168.1 | AL232: 324 | AM232: 78.5 | AN232: 330 | AO232: -5.7000000000000002e-002 | AP232: 13 | AQ232: 立讯转债!
A233: 236 | B233: 110060 | C233: 天路转债! | D233: 600326 | E233: 西藏天路 | F233: 建筑 | G233: 水泥 | H233: 115.76 | I233: 9.1000000000000004e-003 | J233: 1.8e-003 | K233: 7.61 | L233: 1.7399999999999999e-002 | M233: 114.9 | N233: 7.16 | O233: 8.900000000000001e-002 | P233: 106.28 | Q233: 转股中 | R233: 4.45年 | S233: 2.46年 | T233: 7.06 | U233: 18 | V233: 2.3e-002 | W233: 0.10099999999999999 | X233: 0.107 | Y233: 70 | Z233: 1.66 | AA233: -1.7000000000000001e-003 | AB233: -7.7000000000000002e-003 | AC233: -4.2500000000000003e-002 | AD233: -4.4900000000000002e-002 | AE233: 92.83 | AF233: 95.86 | AG233: 0.63 | AH233: AA | AI233: 4.24e-002 | AJ233: =H233+100*O233 -> 124.66000000000001 | AK233: 125.2 | AL233: 117 | AM233: 29.4 | AN233: 89 | AO233: 4.4000000000000004e-002 | AP233: 14 | AQ233: 天路转债!
A234: 73 | B234: 110077 | C234: 洪城转债 | D234: 600461 | E234: 洪城环境 | F234: 城市公用 | G234: 城市公用 | H234: 114.67 | I234: 9.1000000000000004e-003 | J234: -6.4000000000000003e-003 | K234: 7.62 | L234: 4.0000000000000001e-003 | M234: 113.5 | N234: 7.13 | O234: 7.2999999999999995e-002 | P234: 106.87 | Q234: 12天 | R234: 5.52年 | S234: 3.52年 | T234: 18 | U234: 54 | V234: 2.6000000000000002e-002 | W234: 0.249 | X234: 0.26600000000000001 | Y234: 72 | Z234: 1.35 | AA234: -1.9e-003 | AB234: -6.3e-003 | AC234: -3.0800000000000001e-002 | AD234: -3.1899999999999998e-002 | AE234: 87.97 | AF234: 90.75 | AG234: 0.67 | AH234: AA+ | AI234: 4.1900000000000007e-002 | AJ234: =H234+100*O234 -> 121.97 | AK234: 122.5 | AL234: 92 | AM234: 31.7 | AN234: 119 | AO234: 8.1000000000000003e-002 | AP234: 7 | AQ234: 洪城转债
A235: 284 | B235: 127011 | C235: 中鼎转2! | D235: 887 | E235: 中鼎股份 | F235: 汽车 | G235: 零部件制 | H235: 115.45 | I235: 0. | J235: 2.2000000000000001e-003 | K235: 11.25 | L235: 4.5000000000000005e-003 | M235: 114.5 | N235: 11.59 | O235: 0.18899999999999997 | P235: 97.07 | Q235: 转股中 | R235: 3.81年 | S235: 1.82年 | T235: 12 | U235: 0.9 | V235: 1.e-003 | W235: 8.6999999999999994e-002 | X235: 8.5000000000000006e-002 | Y235: 137 | Z235: 1.54 | AA235: -2.2000000000000001e-003 | AB235: -9.0000000000000011e-003 | AC235: -5.7099999999999998e-002 | AD235: -5.96e-002 | AE235: 95.12 | AF235: 98.72 | AG235: 0.5 | AH235: AA+ | AI235: 4.0399999999999998e-002 | AJ235: =H235+100*O235 -> 134.34999999999999 | AK235: 133.8 | AL235: 210 | AM235: 35.1 | AN235: 150 | AO235: 5.0999999999999997e-002 | AP235: 23 | AQ235: 中鼎转2!
A236: 176 | B236: 110070 | C236: 凌钢转债! | D236: 600231 | E236: 凌钢股份 | F236: 钢铁 | G236: 炼钢 | H236: 118.67 | I236: -1.44e-002 | J236: -2.3999999999999998e-003 | K236: 3.19 | L236: -2.4500000000000001e-002 | M236: 117.4 | N236: 2.75 | O236: 2.3e-002 | P236: 116 | Q236: 转股中 | R236: 4.91年 | S236: 2.92年 | T236: 2.17 | U236: 170 | V236: 0.65799999999999992 | W236: 2.4e-002 | X236: 2.7999999999999997e-002 | Y236: 90 | Z236: 1.05 | AA236: -2.2000000000000001e-003 | AB236: -8.3999999999999995e-003 | AC236: -4.3099999999999999e-002 | AD236: -4.5199999999999997e-002 | AE236: 91.38 | AF236: 96.13 | AG236: 0.68 | AH236: AA | AI236: 4.24e-002 | AJ236: =H236+100*O236 -> 120.97 | AK236: 121.3 | AL236: 76 | AM236: 25.2 | AN236: 49 | AO236: 6.0000000000000001e-003 | AP236: 21 | AQ236: 凌钢转债!
A237: 77 | B237: 127025 | C237: 冀东转债 | D237: 401 | E237: 冀东水泥 | F237: 建筑 | G237: 水泥 | H237: 111.45 | I237: -5.0000000000000001e-004 | J237: 3.8e-003 | K237: 14.34 | L237: 6.3e-003 | M237: 110.1 | N237: 15.78 | O237: 0.22600000000000001 | P237: 90.87 | Q237: 转股中 | R237: 5.48年 | S237: 3.48年 | T237: 17.8 | U237: 37 | V237: 1.9e-002 | W237: 8.8000000000000009e-002 | X237: 8.0000000000000002e-002 | Y237: 203 | Z237: 1.37 | AA237: -2.3e-003 | AB237: -5.6999999999999993e-003 | AC237: -2.1899999999999999e-002 | AD237: -2.3399999999999997e-002 | AE237: 89.58 | AF237: 89.62 | AG237: 0.52 | AH237: AAA | AI237: 3.8900000000000004e-002 | AJ237: =H237+100*O237 -> 134.05000000000001 | AK237: 132 | AL237: 191 | AM237: 42.4 | AN237: 209 | AO237: -6.0000000000000001e-003 | AP237: 10 | AQ237: 冀东转债
A238: 36 | B238: 123094 | C238: 星源转2! | D238: 300568 | E238: 星源材质 | F238: 电子 | G238: 电子行业 | H238: 119.1 | I238: 1.7899999999999999e-002 | J238: -6.6e-003 | K238: 29.47 | L238: 2.1099999999999997e-002 | M238: 117.3 | N238: 31.53 | O238: 0.27399999999999997 | P238: 93.47 | Q238: 2月13天 | R238: 5.69年 | S238: 3.69年 | T238: 10 | U238: 6.9 | V238: 6.0000000000000001e-003 | W238: 7.5999999999999998e-002 | X238: 7.0999999999999994e-002 | Y238: 132 | Z238: 4.37 | AA238: -2.7000000000000001e-003 | AB238: -8.0000000000000002e-003 | AC238: -3.5299999999999998e-002 | AD238: -3.7100000000000001e-002 | AE238: 88.1 | AF238: 92.31 | AG238: 0.54 | AH238: AA | AI238: 4.3899999999999995e-002 | AJ238: =H238+100*O238 -> 146.5 | AK238: 144.7 | AL238: 281 | AM238: 52.4 | AN238: 271 | AO238: -1.3999999999999999e-002 | AP238: 4 | AQ238: 星源转2!
A239: 34 | B239: 113621 | C239: 彤程转债 | D239: 603650 | E239: 彤程新材 | F239: 化工 | G239: 橡胶塑料 | H239: 117 | I239: 1.09e-002 | J239: -5.1999999999999998e-003 | K239: 31.41 | L239: 1.e-002 | M239: 115.1 | N239: 32.96 | O239: 0.22800000000000001 | P239: 95.3 | Q239: 2月20天 | R239: 5.70年 | S239: 3.70年 | T239: 8 | U239: 1 | V239: 1.e-003 | W239: 4.2999999999999997e-002 | X239: 4.0999999999999995e-002 | Y239: 184 | Z239: 7.14 | AA239: -2.8999999999999998e-003 | AB239: -7.6e-003 | AC239: -3.1200000000000002e-002 | AD239: -3.2899999999999999e-002 | AE239: 87.85 | AF239: 90.49 | AG239: 0.57 | AH239: AA | AI239: 4.3899999999999995e-002 | AJ239: =H239+100*O239 -> 139.80000000000001 | AK239: 138.7 | AL239: 248 | AM239: 48.2 | AN239: 250 | AO239: -3.7999999999999999e-002 | AP239: 4 | AQ239: 彤程转债
A240: 193 | B240: 113572 | C240: 三祥转债! | D240: 603663 | E240: 三祥新材 | F240: 其他 | G240: 其他 | H240: 114.47 | I240: 8.8999999999999999e-003 | J240: 3.8e-003 | K240: 14.47 | L240: 1.7600000000000001e-002 | M240: 112.8 | N240: 14.19 | O240: 0.12300000000000001 | P240: 101.97 | Q240: 转股中 | R240: 4.82年 | S240: 2.83年 | T240: 1.69 | U240: 8.1 | V240: 4.2000000000000003e-002 | W240: 6.0999999999999999e-002 | X240: 6.2e-002 | Y240: 28 | Z240: 4.35 | AA240: -3.0999999999999999e-003 | AB240: -7.9000000000000008e-003 | AC240: -3.39e-002 | AD240: -3.6000000000000004e-002 | AE240: 83.47 | AF240: 80.32 | AG240: 0.72 | AH240: A+ | AI240: 7.4400000000000008e-002 | AJ240: =H240+100*O240 -> 126.77 | AK240: 127 | AL240: 139 | AM240: 43.5 | AN240: 222 | AO240: 1.e-002 | AP240: 19 | AQ240: 三祥转债!
A241: 277 | B241: 127012 | C241: 招路转债! | D241: 1965 | E241: 招商公路 | F241: 机场高速 | G241: 高速 | H241: 109.231 | I241: 4.0000000000000002e-004 | J241: -1.e-003 | K241: 8.3 | L241: -1.1999999999999999e-003 | M241: 107.9 | N241: 8.81 | O241: 0.159 | P241: 94.21 | Q241: 转股中 | R241: 3.85年 | S241: 1.85年 | T241: 50 | U241: 9.8 | V241: 2.e-003 | W241: 9.8000000000000004e-002 | X241: 9.1999999999999998e-002 | Y241: 513 | Z241: 1.03 | AA241: -3.2000000000000002e-003 | AB241: -6.9999999999999993e-003 | AC241: -3.5099999999999999e-002 | AD241: -3.6600000000000001e-002 | AE241: 94.41 | AF241: 93.82 | AG241: 0.52 | AH241: AAA | AI241: 3.7400000000000003e-002 | AJ241: =H241+100*O241 -> 125.131 | AK241: 124.3 | AL241: 111 | AM241: 29.8 | AN241: 95 | AO241: 5.9000000000000004e-002 | AP241: 33 | AQ241: 招路转债!
A242: 231 | B242: 123035 | C242: 利德转债! | D242: 300296 | E242: 利亚德 | F242: 电子 | G242: LED制 | H242: 116.8 | I242: -1.7000000000000001e-003 | J242: 9.0000000000000011e-003 | K242: 7.08 | L242: 1.29e-002 | M242: 115.1 | N242: 6.98 | O242: 0.152 | P242: 101.43 | Q242: 转股中 | R242: 4.50年 | S242: 2.50年 | T242: 8 | U242: 27 | V242: 2.8999999999999998e-002 | W242: 4.4000000000000004e-002 | X242: 4.4999999999999998e-002 | Y242: 180 | Z242: 2.47 | AA242: -3.3e-003 | AB242: -9.300000000000001e-003 | AC242: -4.4400000000000002e-002 | AD242: -4.6799999999999994e-002 | AE242: 93.32 | AF242: 96.68 | AG242: 0.57 | AH242: AA+ | AI242: 4.0399999999999998e-002 | AJ242: =H242+100*O242 -> 132. | AK242: 132.2 | AL242: 194 | AM242: 35.5 | AN242: 153 | AO242: -3.7000000000000005e-002 | AP242: 16 | AQ242: 利德转债!
A243: 226 | B243: 128082 | C243: 华锋转债! | D243: 2806 | E243: 华锋股份 | F243: 电子 | G243: 元器件制 | H243: 123.274 | I243: -2.8999999999999998e-003 | J243: -6.9999999999999993e-003 | K243: 11.15 | L243: -1.3300000000000001e-002 | M243: 121.4 | N243: 9.13 | O243: 9.0000000000000011e-003 | P243: 122.12 | Q243: 转股中 | R243: 4.56年 | S243: 2.56年 | T243: 3.14 | U243: 185 | V243: 0.47700000000000004 | W243: 0.157 | X243: 0.191 | Y243: 20 | Z243: 2.02 | AA243: -3.4000000000000002e-003 | AB243: -1.1399999999999999e-002 | AC243: -5.96e-002 | AD243: -6.2400000000000004e-002 | AE243: 86.15 | AF243: 88.29 | AG243: 0.75 | AH243: A+ | AI243: 7.4400000000000008e-002 | AJ243: =H243+100*O243 -> 124.17400000000001 | AK243: 124.4 | AL243: 113 | AM243: 36.1 | AN243: 163 | AO243: 4.0999999999999995e-002 | AP243: 55 | AQ243: 华锋转债!
A244: 47 | B244: 123090 | C244: 三诺转债 | D244: 300298 | E244: 三诺生物 | F244: 医药 | G244: 医疗器械 | H244: 119.288 | I244: -8.8999999999999999e-003 | J244: -1.5600000000000001e-002 | K244: 33.98 | L244: -4.4999999999999998e-002 | M244: 117.1 | N244: 35.35 | O244: 0.24100000000000002 | P244: 96.12 | Q244: 42天 | R244: 5.60年 | S244: 3.61年 | T244: 5 | U244: 7.6 | V244: 1.3000000000000001e-002 | W244: 2.6000000000000002e-002 | X244: 2.5000000000000001e-002 | Y244: 192 | Z244: 7.2 | AA244: -3.4000000000000002e-003 | AB244: -8.6999999999999994e-003 | AC244: -3.7000000000000005e-002 | AD244: -3.8699999999999998e-002 | AE244: 88.23 | AF244: 92.44 | AG244: 0.55 | AH244: AA | AI244: 4.3899999999999995e-002 | AJ244: =H244+100*O244 -> 143.38800000000001 | AK244: 142.5 | AL244: 266 | AM244: 50 | AN244: 258 | AO244: -1.1000000000000001e-002 | AP244: 4 | AQ244: 三诺转债
A245: 328 | B245: 128035 | C245: 大族转债! | D245: 2008 | E245: 大族激光 | F245: 机械装备 | G245: 专用设备 | H245: 108.583 | I245: 1.7000000000000001e-003 | J245: -5.0000000000000001e-004 | K245: 35.53 | L245: 3.5299999999999998e-002 | M245: 107.4 | N245: 51.9 | O245: 0.58599999999999997 | P245: 68.46 | Q245: 转股中 | R245: 2.73年 | S245: 0.73年 | T245: 23 | U245: 19 | V245: 6.9999999999999993e-003 | W245: 6.0999999999999999e-002 | X245: 4.2000000000000003e-002 | Y245: 379 | Z245: 3.94 | AA245: -4.0000000000000001e-003 | AB245: -9.1000000000000004e-003 | AC245: -4.8799999999999996e-002 | AD245: -5.6600000000000004e-002 | AE245: 100.33 | AF245: 96.97 | AG245: 0.03 | AH245: AA+ | AI245: 3.85e-002 | AJ245: =H245+100*O245 -> 167.18299999999999 | AK245: 148.7 | AL245: 288 | AM245: 48.4 | AN245: 251 | AO245: -0.10300000000000001 | AP245: 20 | AQ245: 大族转债!
A246: 39 | B246: 113618 | C246: 美诺转债! | D246: 603538 | E246: 美诺华 | F246: 医药 | G246: 原料药 | H246: 118.18 | I246: 7.1999999999999998e-003 | J246: 3.0999999999999999e-003 | K246: 37.21 | L246: 1.4999999999999999e-002 | M246: 115.3 | N246: 37.47 | O246: 0.19 | P246: 99.31 | Q246: 2月7天 | R246: 5.67年 | S246: 3.67年 | T246: 5.2 | U246: 527 | V246: 0.84999999999999998 | W246: 9.3000000000000013e-002 | X246: 9.3000000000000013e-002 | Y246: 56 | Z246: 3.51 | AA246: -4.4000000000000003e-003 | AB246: -9.1999999999999998e-003 | AC246: -3.3500000000000002e-002 | AD246: -3.5299999999999998e-002 | AE246: 81.74 | AF246: 81.31 | AG246: 0.69 | AH246: AA- | AI246: 6.4899999999999999e-002 | AJ246: =H246+100*O246 -> 137.18000000000001 | AK246: 137.1 | AL246: 239 | AM246: 55.3 | AN246: 280 | AO246: 4.4000000000000004e-002 | AP246: 4 | AQ246: 美诺转债!
A247: 13 | B247: 113622 | C247: 杭叉转债 | D247: 603298 | E247: 杭叉集团 | F247: 机械装备 | G247: 通用设备 | H247: 115.4 | I247: 7.9000000000000008e-003 | J247: -6.7000000000000002e-003 | K247: 19.26 | L247: 2.5999999999999999e-003 | M247: 112.5 | N247: 23.48 | O247: 0.40700000000000003 | P247: 82.03 | Q247: 4月27天 | R247: 5.86年 | S247: 3.86年 | T247: 11.5 | U247: 3.7 | V247: 3.0000000000000001e-003 | W247: 6.9000000000000006e-002 | X247: 5.7000000000000002e-002 | Y247: 167 | Z247: 3.25 | AA247: -4.4000000000000003e-003 | AB247: -8.199999999999999e-003 | AC247: -2.7900000000000001e-002 | AD247: -2.9300000000000003e-002 | AE247: 87.38 | AF247: 88.75 | AG247: 0.44 | AH247: AA+ | AI247: 4.1900000000000007e-002 | AJ247: =H247+100*O247 -> 156.10000000000002 | AK247: 148.8 | AL247: 289 | AM247: 60 | AN247: 297 | AO247: -0.10400000000000001 | AP247: 3 | AQ247: 杭叉转债
A248: 59 | B248: 123083 | C248: 朗新转债 | D248: 300682 | E248: 朗新科技 | F248: 计算机及 | G248: 软件开发 | H248: 118 | I248: 6.0000000000000001e-003 | J248: -3.5999999999999999e-003 | K248: 16.57 | L248: 3.5999999999999999e-003 | M248: 115.1 | N248: 15.45 | O248: 0.10000000000000001 | P248: 107.25 | Q248: 32天 | R248: 5.57年 | S248: 3.57年 | T248: 8 | U248: 8.9 | V248: 9.0000000000000011e-003 | W248: 4.7e-002 | X248: 5.0999999999999997e-002 | Y248: 169 | Z248: 3.21 | AA248: -4.5000000000000005e-003 | AB248: -9.300000000000001e-003 | AC248: -3.4500000000000003e-002 | AD248: -3.6200000000000003e-002 | AE248: 88.35 | AF248: 91 | AG248: 0.66 | AH248: AA | AI248: 4.3899999999999995e-002 | AJ248: =H248+100*O248 -> 128. | AK248: 128.8 | AL248: 161 | AM248: 37.8 | AN248: 184 | AO248: 2.e-003 | AP248: 5 | AQ248: 朗新转债
A249: 301 | B249: 110047 | C249: 山鹰转债 | D249: 600567 | E249: 山鹰国际 | F249: 造纸包装 | G249: 包装用纸 | H249: 119.4 | I249: -4.6999999999999993e-003 | J249: 1.4000000000000002e-003 | K249: 3.8 | L249: -5.1999999999999998e-003 | M249: 117.5 | N249: 3.34 | O249: 4.9000000000000002e-002 | P249: 113.77 | Q249: 转股中 | R249: 3.52年 | S249: 1.52年 | T249: 22.5 | U249: 20 | V249: 6.9999999999999993e-003 | W249: 0.128 | X249: 0.14599999999999999 | Y249: 175 | Z249: 1.13 | AA249: -4.5999999999999999e-003 | AB249: -1.3300000000000001e-002 | AC249: -8.5199999999999998e-002 | AD249: -8.8100000000000012e-002 | AE249: 96.23 | AF249: 102.48 | AG249: 0.63 | AH249: AA+ | AI249: 4.0399999999999998e-002 | AJ249: =H249+100*O249 -> 124.30000000000001 | AK249: 125 | AL249: 115 | AM249: 22.5 | AN249: 29 | AO249: 6.0999999999999999e-002 | AP249: 33 | AQ249: 山鹰转债
A250: 49 | B250: 128141 | C250: 旺能转债 | D250: 2034 | E250: 旺能环境 | F250: 城市公用 | G250: 三废处理 | H250: 118.436 | I250: 2.2799999999999997e-002 | J250: 4.0199999999999993e-002 | K250: 19.58 | L250: 8.6599999999999996e-002 | M250: 115.1 | N250: 16.47 | O250: -4.0000000000000001e-003 | P250: 118.88 | Q250: 40天 | R250: 5.59年 | S250: 3.59年 | T250: 14 | U250: 238 | V250: 0.14300000000000002 | W250: 0.17000000000000001 | X250: 0.20199999999999999 | Y250: 83 | Z250: 1.74 | AA250: -5.1999999999999998e-003 | AB250: -1.e-002 | AC250: -3.5200000000000002e-002 | AD250: -3.7000000000000005e-002 | AE250: 88.27 | AF250: 90.91 | AG250: 0.73 | AH250: AA | AI250: 4.3899999999999995e-002 | AJ250: =H250+100*O250 -> 118.036 | AK250: 118 | AL250: 44 | AM250: 27.1 | AN250: 66 | AO250: 6.8000000000000005e-002 | AP250: 5 | AQ250: 旺能转债
A251: 283 | B251: 110053 | C251: 苏银转债! | D251: 600919 | E251: 江苏银行 | F251: 金融 | G251: 银行行业 | H251: 120.65 | I251: 6.5000000000000006e-003 | J251: -7.3000000000000001e-003 | K251: 7.26 | L251: -1.4000000000000002e-003 | M251: 118.3 | N251: 6.69 | O251: 0.11199999999999999 | P251: 108.52 | Q251: 转股中 | R251: 3.83年 | S251: 无权 | T251: 200 | U251: 173 | V251: 6.9999999999999993e-003 | W251: 0.187 | X251: 0.20199999999999999 | Y251: 1072. | Z251: 0.77 | AA251: -5.3e-003 | AB251: -1.3500000000000002e-002 | AC251: 无权 | AD251: 无权 | AE251: 无权 | AF251: 103.19 | AG251: 0.58 | AH251: AAA | AI251: 3.7400000000000003e-002 | AJ251: =H251+100*O251 -> 131.84999999999999 | AK251: 132.8 | AL251: 201 | AM251: 29.6 | AN251: 91 | AO251: 9.1999999999999998e-002 | AP251: 41 | AQ251: 苏银转债!
A252: 133 | B252: 123060 | C252: 苏试转债 | D252: 300416 | E252: 苏试试验 | F252: 机械装备 | G252: 专用设备 | H252: 121 | I252: 1.89e-002 | J252: 3.0000000000000001e-003 | K252: 18.71 | L252: 3.2599999999999997e-002 | M252: 117.6 | N252: 18.28 | O252: 0.182 | P252: 102.35 | Q252: 转股中 | R252: 5.18年 | S252: 3.19年 | T252: 3.1 | U252: 21 | V252: 5.5999999999999994e-002 | W252: 6.3e-002 | X252: 6.4000000000000001e-002 | Y252: 49 | Z252: 4.07 | AA252: -5.6000000000000008e-003 | AB252: -1.15e-002 | AC252: -4.4800000000000006e-002 | AD252: -4.6900000000000004e-002 | AE252: 84.4 | AF252: 85.51 | AG252: 0.67 | AH252: AA- | AI252: 6.4899999999999999e-002 | AJ252: =H252+100*O252 -> 139.19999999999999 | AK252: 139.6 | AL252: 253 | AM252: 54.1 | AN252: 278 | AO252: -7.0000000000000007e-002 | AP252: 9 | AQ252: 苏试转债
A253: 290 | B253: 110051 | C253: 中天转债! | D253: 600522 | E253: 中天科技 | F253: 通信互联 | G253: 通信设备 | H253: 115.96 | I253: 1.4000000000000002e-003 | J253: 6.4000000000000003e-003 | K253: 10.11 | L253: 1.3999999999999999e-002 | M253: 113.3 | N253: 9.99 | O253: 0.14599999999999999 | P253: 101.2 | Q253: 转股中 | R253: 3.79年 | S253: 1.79年 | T253: 39.6 | U253: 15 | V253: 3.0000000000000001e-003 | W253: 0.128 | X253: 0.129 | Y253: 310 | Z253: 1.33 | AA253: -6.1999999999999998e-003 | AB253: -1.2500000000000001e-002 | AC253: -5.9999999999999998e-002 | AD253: -6.25e-002 | AE253: 95.17 | AF253: 97.76 | AG253: 0.55 | AH253: AA+ | AI253: 4.0399999999999998e-002 | AJ253: =H253+100*O253 -> 130.56 | AK253: 130.7 | AL253: 183 | AM253: 33 | AN253: 129 | AO253: -2.8999999999999998e-002 | AP253: 25 | AQ253: 中天转债!
A254: 84 | B254: 113607 | C254: 伟20转债! | D254: 603568 | E254: 伟明环保 | F254: 城市公用 | G254: 三废处理 | H254: 119.05 | I254: 1.3100000000000001e-002 | J254: 2.6099999999999998e-002 | K254: 23.53 | L254: 5.9900000000000002e-002 | M254: 115.1 | N254: 22.01 | O254: 0.114 | P254: 106.91 | Q254: 转股中 | R254: 5.47年 | S254: 3.47年 | T254: 12 | U254: 18 | V254: 1.3000000000000001e-002 | W254: 4.0999999999999995e-002 | X254: 4.2999999999999997e-002 | Y254: 296 | Z254: 5.29 | AA254: -6.3e-003 | AB254: -1.11e-002 | AC254: -3.78e-002 | AD254: -3.9599999999999996e-002 | AE254: 88.74 | AF254: 91.4 | AG254: 0.65 | AH254: AA | AI254: 4.3899999999999995e-002 | AJ254: =H254+100*O254 -> 130.44999999999999 | AK254: 131.2 | AL254: 185 | AM254: 39.8 | AN254: 196 | AO254: 3.7999999999999999e-002 | AP254: 5 | AQ254: 伟20转债!
A255: 178 | B255: 123048 | C255: 应急转债! | D255: 300527 | E255: 中船应急 | F255: 机械装备 | G255: 专用设备 | H255: 116.5 | I255: 1.84e-002 | J255: -8.3000000000000001e-003 | K255: 8.93 | L255: 1.7100000000000001e-002 | M255: 112.8 | N255: 8.9 | O255: 0.161 | P255: 100.34 | Q255: 转股中 | R255: 4.90年 | S255: 2.91年 | T255: 3.8 | U255: 517 | V255: 1.1499999999999999 | W255: 4.4000000000000004e-002 | X255: 4.4000000000000004e-002 | Y255: 86 | Z255: 3.23 | AA255: -6.7000000000000002e-003 | AB255: -1.1399999999999999e-002 | AC255: -3.8599999999999995e-002 | AD255: -4.0599999999999997e-002 | AE255: 91.55 | AF255: 93.21 | AG255: 0.59 | AH255: AA+ | AI255: 4.0399999999999998e-002 | AJ255: =H255+100*O255 -> 132.59999999999999 | AK255: 132.7 | AL255: 200 | AM255: 39.4 | AN255: 192 | AO255: 3.9e-002 | AP255: 17 | AQ255: 应急转债!
A256: 177 | B256: 128106 | C256: 华统转债 | D256: 2840 | E256: 华统股份 | F256: 农业 | G256: 农产品加 | H256: 116.72 | I256: 8.9999999999999998e-004 | J256: 4.0000000000000002e-004 | K256: 10.89 | L256: 1.8e-003 | M256: 112.9 | N256: 9.4 | O256: 8.0000000000000002e-003 | P256: 115.85 | Q256: 转股中 | R256: 4.90年 | S256: 2.91年 | T256: 5.35 | U256: 25 | V256: 4.0000000000000001e-002 | W256: 0.11 | X256: 0.127 | Y256: 49 | Z256: 2.77 | AA256: -6.8999999999999999e-003 | AB256: -1.1599999999999999e-002 | AC256: -3.8900000000000004e-002 | AD256: -4.0899999999999999e-002 | AE256: 91.11 | AF256: 92.45 | AG256: 0.73 | AH256: AA | AI256: 4.24e-002 | AJ256: =H256+100*O256 -> 117.52 | AK256: 117.6 | AL256: 40 | AM256: 25.1 | AN256: 48 | AO256: 3.4000000000000002e-002 | AP256: 8 | AQ256: 华统转债
A257: 224 | B257: 110063 | C257: 鹰19转债 | D257: 600567 | E257: 山鹰国际 | F257: 造纸包装 | G257: 包装用纸 | H257: 119.72 | I257: -2.9999999999999997e-004 | J257: -3.3e-003 | K257: 3.8 | L257: -5.1999999999999998e-003 | M257: 115.9 | N257: 3.3 | O257: 4.0000000000000001e-002 | P257: 115.15 | Q257: 转股中 | R257: 4.58年 | S257: 2.58年 | T257: 18.5 | U257: 17 | V257: 6.9999999999999993e-003 | W257: 0.105 | X257: 0.121 | Y257: 175 | Z257: 1.13 | AA257: -7.1999999999999998e-003 | AB257: -1.3300000000000001e-002 | AC257: -5.2900000000000003e-002 | AD257: -5.5e-002 | AE257: 92.67 | AF257: 97 | AG257: 0.68 | AH257: AA+ | AI257: 4.0399999999999998e-002 | AJ257: =H257+100*O257 -> 123.72 | AK257: 124.3 | AL257: 112 | AM257: 27.3 | AN257: 69 | AO257: 6.0999999999999999e-002 | AP257: 38 | AQ257: 鹰19转债
A258: 12 | B258: 110079 | C258: 杭银转债 | D258: 600926 | E258: 杭州银行 | F258: 金融 | G258: 银行行业 | H258: 117.29 | I258: 1.e-003 | J258: 1.5e-003 | K258: 16.7 | L258: 4.1999999999999997e-003 | M258: 112.4 | N258: 17.06 | O258: 0.19800000000000001 | P258: 97.89 | Q258: 4月27天 | R258: 5.87年 | S258: 3.87年 | T258: 150 | U258: 162 | V258: 9.0000000000000011e-003 | W258: 0.151 | X258: 0.14800000000000002 | Y258: 990 | Z258: 1.5 | AA258: -7.3000000000000001e-003 | AB258: -1.11e-002 | AC258: -3.2000000000000001e-002 | AD258: -3.3399999999999999e-002 | AE258: 88.28 | AF258: 90.12 | AG258: 0.59 | AH258: AAA | AI258: 3.8900000000000004e-002 | AJ258: =H258+100*O258 -> 137.09 | AK258: 136.7 | AL258: 236 | AM258: 46.6 | AN258: 239 | AO258: 2.7000000000000003e-002 | AP258: 10 | AQ258: 杭银转债
A259: 173 | B259: 113577 | C259: 春秋转债! | D259: 603890 | E259: 春秋电子 | F259: 电子 | G259: 电子产品 | H259: 122.03 | I259: -6.4000000000000003e-003 | J259: 9.1999999999999998e-003 | K259: 12.94 | L259: 3.9000000000000003e-003 | M259: 117.7 | N259: 11.06 | O259: 4.2999999999999997e-002 | P259: 117 | Q259: 转股中 | R259: 4.92年 | S259: 2.92年 | T259: 1.78 | U259: 8.8 | V259: 4.0000000000000001e-002 | W259: 3.5000000000000003e-002 | X259: 4.0999999999999995e-002 | Y259: 50 | Z259: 2.67 | AA259: -7.4999999999999997e-003 | AB259: -1.37e-002 | AC259: -5.2000000000000005e-002 | AD259: -5.4100000000000002e-002 | AE259: 85.87 | AF259: 87.55 | AG259: 0.74 | AH259: AA- | AI259: 6.3399999999999998e-002 | AJ259: =H259+100*O259 -> 126.33 | AK259: 127.1 | AL259: 140 | AM259: 39.5 | AN259: 193 | AO259: -4.8000000000000001e-002 | AP259: 14 | AQ259: 春秋转债!
A260: 89 | B260: 113605 | C260: 大参转债 | D260: 603233 | E260: 大参林 | F260: 医药 | G260: 医药商业 | H260: 119.9 | I260: 2.7000000000000001e-003 | J260: -2.3999999999999998e-003 | K260: 71.52 | L260: 5.9999999999999995e-004 | M260: 115.2 | N260: 83.71 | O260: 0.40299999999999997 | P260: 85.44 | Q260: 转股中 | R260: 5.44年 | S260: 3.44年 | T260: 14.1 | U260: 12 | V260: 6.9999999999999993e-003 | W260: 2.9999999999999999e-002 | X260: 2.5000000000000001e-002 | Y260: 471 | Z260: 8.8 | AA260: -7.4999999999999997e-003 | AB260: -1.24e-002 | AC260: -3.9800000000000002e-002 | AD260: -4.1599999999999998e-002 | AE260: 88.94 | AF260: 91.61 | AG260: 0.45 | AH260: AA | AI260: 4.3899999999999995e-002 | AJ260: =H260+100*O260 -> 160.19999999999999 | AK260: 154.4 | AL260: 309 | AM260: 62.8 | AN260: 308 | AO260: -5.2999999999999999e-002 | AP260: 7 | AQ260: 大参转债
A261: 123 | B261: 113597 | C261: 佳力转债! | D261: 603912 | E261: 佳力图 | F261: 机械装备 | G261: 专用设备 | H261: 129.56 | I261: 0.29299999999999998 | J261: -0.27500000000000002 | K261: 13.42 | L261: 0.10000000000000001 | M261: 124.5 | N261: 23.4 | O261: 1.26 | P261: 57.35 | Q261: 转股中 | R261: 5.21年 | S261: 3.21年 | T261: 3 | U261: 1598. | V261: 4.5099999999999998 | W261: 0.10300000000000001 | X261: 5.9000000000000004e-002 | Y261: 29 | Z261: 3.13 | AA261: -7.8000000000000005e-003 | AB261: -1.55e-002 | AC261: -6.25e-002 | AD261: -6.480000000000001e-002 | AE261: 84.68 | AF261: 90.43 | AG261: 0.18 | AH261: AA- | AI261: 6.4899999999999999e-002 | AJ261: =H261+100*O261 -> 255.56 | AK261: 201.8 | AL261: 337 | AM261: 111.3 | AN261: 337 | AO261: 1.8000000000000002e-002 | AP261: 13 | AQ261: 佳力转债!
A262: 9 | B262: 123110 | C262: 九典转债 | D262: 300705 | E262: 九典制药 | F262: 医药 | G262: 化学制药 | H262: 127.222 | I262: 5.3e-003 | J262: 5.1999999999999998e-003 | K262: 30.44 | L262: 1.37e-002 | M262: 121.4 | N262: 26.48 | O262: 0.107 | P262: 114.95 | Q262: 4月27天 | R262: 5.88年 | S262: 3.88年 | T262: 2.7 | U262: 1031. | V262: 2.98 | W262: 3.7999999999999999e-002 | X262: 4.2999999999999997e-002 | Y262: 71 | Z262: 8.1 | AA262: -8.1000000000000013e-003 | AB262: -1.4199999999999999e-002 | AC262: -4.8099999999999997e-002 | AD262: -5.0000000000000003e-002 | AE262: 77.88 | AF262: 79.69 | AG262: 0.77 | AH262: A+ | AI262: 7.5899999999999995e-002 | AJ262: =H262+100*O262 -> 137.922 | AK262: 139.5 | AL262: 252 | AM262: 59.8 | AN262: 296 | AO262: 4.0999999999999995e-002 | AP262: 3 | AQ262: 九典转债
A263: 274 | B263: 110057 | C263: 现代转债 | D263: 600420 | E263: 国药现代 | F263: 医药 | G263: 化学制药 | H263: 114.17 | I263: -3.8e-003 | J263: -8.3999999999999995e-003 | K263: 10.89 | L263: -1.8000000000000002e-002 | M263: 110.3 | N263: 9.89 | O263: 3.7000000000000005e-002 | P263: 110.11 | Q263: 转股中 | R263: 3.88年 | S263: 1.88年 | T263: 16.2 | U263: 54 | V263: 2.8999999999999998e-002 | W263: 0.14400000000000002 | X263: 0.159 | Y263: 112 | Z263: 1.38 | AA263: -9.0000000000000011e-003 | AB263: -1.38e-002 | AC263: -5.0199999999999995e-002 | AD263: -5.2699999999999997e-002 | AE263: 95.4 | AF263: 95.91 | AG263: 0.68 | AH263: AAA | AI263: 3.7400000000000003e-002 | AJ263: =H263+100*O263 -> 117.87 | AK263: 118.2 | AL263: 48 | AM263: 22.3 | AN263: 26 | AO263: 7.2000000000000008e-002 | AP263: 24 | AQ263: 现代转债
A264: 71 | B264: 113609 | C264: 永安转债! | D264: 603776 | E264: 永安行 | F264: 城市公用 | G264: 其他 | H264: 126.75 | I264: 3.0299999999999997e-002 | J264: -1.41e-002 | K264: 27.05 | L264: 1.9599999999999999e-002 | M264: 120.5 | N264: 20.34 | O264: -4.7e-002 | P264: 132.99 | Q264: 17天 | R264: 5.53年 | S264: 3.53年 | T264: 8.86 | U264: 295 | V264: 0.26600000000000001 | W264: 0.17499999999999999 | X264: 0.23199999999999998 | Y264: 51 | Z264: 1.61 | AA264: -9.300000000000001e-003 | AB264: -1.55e-002 | AC264: -5.2999999999999999e-002 | AD264: -5.4800000000000001e-002 | AE264: 82.49 | AF264: 85.71 | AG264: 0.83 | AH264: AA- | AI264: 6.4899999999999999e-002 | AJ264: =H264+100*O264 -> 122.05 | AK264: 120.5 | AL264: 64 | AM264: 34.8 | AN264: 144 | AO264: 6.8000000000000005e-002 | AP264: 19 | AQ264: 永安转债!
A265: 188 | B265: 123047 | C265: 久吾转债 | D265: 300631 | E265: 久吾高科 | F265: 机械装备 | G265: 专用设备 | H265: 135.7 | I265: -3.15e-002 | J265: 4.1200000000000001e-002 | K265: 17.78 | L265: 1.6e-002 | M265: 129.6 | N265: 17.61 | O265: 0.34399999999999997 | P265: 100.97 | Q265: 转股中 | R265: 4.85年 | S265: 2.85年 | T265: 1.99 | U265: 1128. | V265: 4.04 | W265: 0.10300000000000001 | X265: 0.10400000000000001 | Y265: 19 | Z265: 2.34 | AA265: -9.7000000000000003e-003 | AB265: -1.9400000000000001e-002 | AC265: -8.0500000000000002e-002 | AD265: -8.3599999999999994e-002 | AE265: 85.26 | AF265: 92.42 | AG265: 0.61 | AH265: A+ | AI265: 7.4400000000000008e-002 | AJ265: =H265+100*O265 -> 170.09999999999999 | AK265: 170.4 | AL265: 327 | AM265: 78 | AN265: 326 | AO265: -4.5999999999999999e-002 | AP265: 23 | AQ265: 久吾转债
A266: 116 | B266: 110074 | C266: 精达转债! | D266: 600577 | E266: 精达股份 | F266: 电子 | G266: 电子产品 | H266: 123.39 | I266: 2.41e-002 | J266: -1.0800000000000001e-002 | K266: 4.35 | L266: 1.8700000000000001e-002 | M266: 117.3 | N266: 3.73 | O266: 5.7999999999999996e-002 | P266: 116.62 | Q266: 转股中 | R266: 5.26年 | S266: 3.27年 | T266: 7.87 | U266: 36 | V266: 3.7000000000000005e-002 | W266: 9.4e-002 | X266: 0.11 | Y266: 84 | Z266: 2.2 | AA266: -9.7999999999999997e-003 | AB266: -1.54e-002 | AC266: -4.9599999999999998e-002 | AD266: -5.1500000000000004e-002 | AE266: 89.72 | AF266: 94 | AG266: 0.71 | AH266: AA | AI266: 4.3899999999999995e-002 | AJ266: =H266+100*O266 -> 129.19 | AK266: 130.2 | AL266: 178 | AM266: 36.2 | AN266: 165 | AO266: 0.155 | AP266: 13 | AQ266: 精达转债!
A267: 48 | B267: 128142 | C267: 新乳转债 | D267: 2946 | E267: 新乳业 | F267: 食品饮料 | G267: 乳制品 | H267: 121.602 | I267: 5.0000000000000001e-003 | J267: -2.0999999999999999e-003 | K267: 17.89 | L267: 5.1000000000000004e-003 | M267: 115.1 | N267: 18.54 | O267: 0.26000000000000001 | P267: 96.49 | Q267: 41天 | R267: 5.59年 | S267: 3.60年 | T267: 7.18 | U267: 67 | V267: 7.4999999999999997e-002 | W267: 4.5999999999999999e-002 | X267: 4.4999999999999998e-002 | Y267: 155 | Z267: 5.97 | AA267: -9.8999999999999991e-003 | AB267: -1.47e-002 | AC267: -4.2000000000000003e-002 | AD267: -4.3700000000000003e-002 | AE267: 88.26 | AF267: 90.9 | AG267: 0.57 | AH267: AA | AI267: 4.3899999999999995e-002 | AJ267: =H267+100*O267 -> 147.602 | AK267: 146.7 | AL267: 283 | AM267: 55.8 | AN267: 281 | AO267: 2.1000000000000001e-002 | AP267: 4 | AQ267: 新乳转债
A268: 108 | B268: 123064 | C268: 万孚转债! | D268: 300482 | E268: 万孚生物 | F268: 医药 | G268: 医疗器械 | H268: 121.411 | I268: 5.1000000000000004e-003 | J268: -9.7999999999999997e-003 | K268: 92.79 | L268: -8.1000000000000013e-003 | M268: 115.1 | N268: 93.57 | O268: 0.22399999999999998 | P268: 99.17 | Q268: 转股中 | R268: 5.30年 | S268: 3.30年 | T268: 5.99 | U268: 1.4 | V268: 2.e-003 | W268: 1.9e-002 | X268: 1.9e-002 | Y268: 318 | Z268: 10.93 | AA268: -1.0200000000000001e-002 | AB268: -1.52e-002 | AC268: -4.5100000000000001e-002 | AD268: -4.6900000000000004e-002 | AE268: 89.39 | AF268: 92.07 | AG268: 0.59 | AH268: AA | AI268: 4.3899999999999995e-002 | AJ268: =H268+100*O268 -> 143.81100000000001 | AK268: 143.7 | AL268: 273 | AM268: 51.6 | AN268: 266 | AO268: -5.0000000000000001e-003 | AP268: 11 | AQ268: 万孚转债!
A269: 79 | B269: 128137 | C269: 洁美转债 | D269: 2859 | E269: 洁美科技 | F269: 电子 | G269: 元器件制 | H269: 124 | I269: 4.0000000000000001e-003 | J269: 4.5999999999999999e-003 | K269: 28.88 | L269: 1.23e-002 | M269: 117.3 | N269: 27.77 | O269: 0.192 | P269: 104 | Q269: 转股中 | R269: 5.47年 | S269: 3.48年 | T269: 6 | U269: 3.6 | V269: 5.0000000000000001e-003 | W269: 5.0999999999999997e-002 | X269: 5.2999999999999999e-002 | Y269: 119 | Z269: 6.44 | AA269: -1.03e-002 | AB269: -1.5700000000000002e-002 | AC269: -4.8099999999999997e-002 | AD269: -4.99e-002 | AE269: 82.75 | AF269: 83.72 | AG269: 0.7 | AH269: AA- | AI269: 6.4899999999999999e-002 | AJ269: =H269+100*O269 -> 143.19999999999999 | AK269: 144 | AL269: 277 | AM269: 60.3 | AN269: 298 | AO269: -4.4000000000000004e-002 | AP269: 5 | AQ269: 洁美转债
A270: 254 | B270: 113541 | C270: 荣晟转债! | D270: 603165 | E270: 荣晟环保 | F270: 造纸包装 | G270: 包装用纸 | H270: 120.48 | I270: 1.2199999999999999e-002 | J270: -5.0000000000000001e-003 | K270: 13.85 | L270: 9.4999999999999998e-003 | M270: 115 | N270: 11.54 | O270: 4.0000000000000001e-003 | P270: 120.02 | Q270: 转股中 | R270: 4.19年 | S270: 2.19年 | T270: 2.39 | U270: 16 | V270: 5.7000000000000002e-002 | W270: 6.7000000000000004e-002 | X270: 8.1000000000000003e-002 | Y270: 35 | Z270: 2.07 | AA270: -1.1299999999999999e-002 | AB270: -1.7600000000000001e-002 | AC270: -6.3099999999999989e-002 | AD270: -6.5700000000000008e-002 | AE270: 89.7 | AF270: 89.42 | AG270: 0.75 | AH270: AA- | AI270: 6.3399999999999998e-002 | AJ270: =H270+100*O270 -> 120.88000000000001 | AK270: 120.9 | AL270: 70 | AM270: 31.2 | AN270: 114 | AO270: 3.2000000000000001e-002 | AP270: 44 | AQ270: 荣晟转债!
A271: 261 | B271: 113536 | C271: 三星转债 | D271: 603578 | E271: 三星新材 | F271: 家电 | G271: 零部件制 | H271: 120.13 | I271: 1.1299999999999999e-002 | J271: 2.0899999999999998e-002 | K271: 21.75 | L271: 4.9699999999999994e-002 | M271: 114.8 | N271: 19.54 | O271: 7.9000000000000001e-002 | P271: 111.31 | Q271: 转股中 | R271: 4年16天 | S271: 2年17天 | T271: 1.49 | U271: 46 | V271: 0.25600000000000001 | W271: 7.4999999999999997e-002 | X271: 8.3000000000000004e-002 | Y271: 20 | Z271: 2.68 | AA271: -1.1399999999999999e-002 | AB271: -1.78e-002 | AC271: -6.6600000000000006e-002 | AD271: -6.9199999999999998e-002 | AE271: 94.33 | AF271: 97.41 | AG271: 0.65 | AH271: AA | AI271: 4.24e-002 | AJ271: =H271+100*O271 -> 128.03 | AK271: 128.9 | AL271: 163 | AM271: 31.5 | AN271: 117 | AO271: 5.9999999999999998e-002 | AP271: 37 | AQ271: 三星转债
A272: 104 | B272: 123066 | C272: 赛意转债 | D272: 300687 | E272: 赛意信息 | F272: 计算机及 | G272: 软件开发 | H272: 129.184 | I272: 4.0999999999999995e-003 | J272: 8.6999999999999994e-003 | K272: 28.96 | L272: 1.61e-002 | M272: 121.4 | N272: 22.58 | O272: 6.9999999999999993e-003 | P272: 128.26 | Q272: 转股中 | R272: 5.34年 | S272: 3.34年 | T272: 2.93 | U272: 17 | V272: 4.4999999999999998e-002 | W272: 4.7e-002 | X272: 5.9999999999999998e-002 | Y272: 63 | Z272: 6.4 | AA272: -1.18e-002 | AB272: -1.8500000000000003e-002 | AC272: -5.9699999999999996e-002 | AD272: -6.1799999999999994e-002 | AE272: 80.95 | AF272: 82.89 | AG272: 0.79 | AH272: A+ | AI272: 7.5899999999999995e-002 | AJ272: =H272+100*O272 -> 129.88399999999999 | AK272: 130.1 | AL272: 177 | AM272: 47.2 | AN272: 242 | AO272: 2.2000000000000002e-002 | AP272: 7 | AQ272: 赛意转债
A273: 245 | B273: 128075 | C273: 远东转债! | D273: 2406 | E273: 远东传动 | F273: 汽车 | G273: 零部件制 | H273: 121.002 | I273: 4.1999999999999997e-003 | J273: 3.4999999999999996e-003 | K273: 6.39 | L273: 1.11e-002 | M273: 114.9 | N273: 5.54 | O273: 4.9000000000000002e-002 | P273: 115.34 | Q273: 转股中 | R273: 4.36年 | S273: 2.36年 | T273: 5.44 | U273: 7.6 | V273: 1.2e-002 | W273: 0.13600000000000001 | X273: 0.157 | Y273: 40 | Z273: 1.2 | AA273: -1.2e-002 | AB273: -1.8000000000000002e-002 | AC273: -6.0899999999999996e-002 | AD273: -6.3200000000000006e-002 | AE273: 93.2 | AF273: 96.24 | AG273: 0.7 | AH273: AA | AI273: 4.24e-002 | AJ273: =H273+100*O273 -> 125.902 | AK273: 126.7 | AL273: 134 | AM273: 30.4 | AN273: 102 | AO273: -1.e-003 | AP273: 15 | AQ273: 远东转债!
A274: 100 | B274: 128134 | C274: 鸿路转债! | D274: 2541 | E274: 鸿路钢构 | F274: 建筑 | G274: 其他 | H274: 122.8 | I274: -1.29e-002 | J274: -4.5000000000000005e-003 | K274: 47.88 | L274: -2.5399999999999999e-002 | M274: 115.1 | N274: 43.74 | O274: 0.122 | P274: 109.47 | Q274: 转股中 | R274: 5.40年 | S274: 3.41年 | T274: 18.8 | U274: 92 | V274: 4.0000000000000001e-002 | W274: 7.4999999999999997e-002 | X274: 8.199999999999999e-002 | Y274: 251 | Z274: 4.31 | AA274: -1.21e-002 | AB274: -1.7000000000000001e-002 | AC274: -4.6799999999999994e-002 | AD274: -4.8600000000000004e-002 | AE274: 88.99 | AF274: 91.66 | AG274: 0.68 | AH274: AA | AI274: 4.3899999999999995e-002 | AJ274: =H274+100*O274 -> 135. | AK274: 136.1 | AL274: 233 | AM274: 44.5 | AN274: 227 | AO274: -9.5000000000000001e-002 | AP274: 4 | AQ274: 鸿路转债!
A275: 142 | B275: 123058 | C275: 欣旺转债 | D275: 300207 | E275: 欣旺达 | F275: 电子 | G275: 电子产品 | H275: 124.148 | I275: 6.7000000000000002e-003 | J275: -6.7000000000000002e-003 | K275: 20.86 | L275: 0. | M275: 116.3 | N275: 21.24 | O275: 0.26400000000000001 | P275: 98.21 | Q275: 转股中 | R275: 5.16年 | S275: 3.17年 | T275: 11.2 | U275: 16 | V275: 1.1000000000000001e-002 | W275: 3.4000000000000002e-002 | X275: 3.3000000000000002e-002 | Y275: 328 | Z275: 4.7 | AA275: -1.2800000000000001e-002 | AB275: -1.83e-002 | AC275: -5.28e-002 | AD275: -5.4800000000000001e-002 | AE275: 90.1 | AF275: 93.59 | AG275: 0.56 | AH275: AA | AI275: 4.3899999999999995e-002 | AJ275: =H275+100*O275 -> 150.548 | AK275: 150.1 | AL275: 292 | AM275: 56.5 | AN275: 285 | AO275: -4.2999999999999997e-002 | AP275: 7 | AQ275: 欣旺转债
A276: 31 | B276: 123098 | C276: 一品转债 | D276: 300723 | E276: 一品红 | F276: 医药 | G276: 医药行业 | H276: 133.5 | I276: -3.8e-003 | J276: 4.7999999999999996e-003 | K276: 28.67 | L276: 1.4000000000000002e-003 | M276: 124 | N276: 25.52 | O276: 0.188 | P276: 112.34 | Q276: 2月21天 | R276: 5.71年 | S276: 3.71年 | T276: 4.8 | U276: 42 | V276: 6.5000000000000002e-002 | W276: 5.7999999999999996e-002 | X276: 6.6000000000000003e-002 | Y276: 82 | Z276: 2.97 | AA276: -1.3100000000000001e-002 | AB276: -1.9900000000000001e-002 | AC276: -6.3099999999999989e-002 | AD276: -6.480000000000001e-002 | AE276: 81.64 | AF276: 87.22 | AG276: 0.7 | AH276: AA- | AI276: 6.4899999999999999e-002 | AJ276: =H276+100*O276 -> 152.30000000000001 | AK276: 154.7 | AL276: 310 | AM276: 67.4 | AN276: 321 | AO276: -0.29399999999999998 | AP276: 3 | AQ276: 一品转债
A277: 45 | B277: 123091 | C277: 长海转债 | D277: 300196 | E277: 长海股份 | F277: 其他 | G277: 非金属矿 | H277: 125.35 | I277: 2.23e-002 | J277: -1.44e-002 | K277: 16.31 | L277: 1.3000000000000001e-002 | M277: 116.2 | N277: 16.24 | O277: 0.248 | P277: 100.43 | Q277: 46天 | R277: 5.61年 | S277: 3.61年 | T277: 5.5 | U277: 15 | V277: 2.1000000000000001e-002 | W277: 8.3000000000000004e-002 | X277: 8.3000000000000004e-002 | Y277: 67 | Z277: 2.24 | AA277: -1.37e-002 | AB277: -1.8600000000000002e-002 | AC277: -4.9299999999999997e-002 | AD277: -5.1100000000000007e-002 | AE277: 88.3 | AF277: 91.73 | AG277: 0.6 | AH277: AA | AI277: 4.3899999999999995e-002 | AJ277: =H277+100*O277 -> 150.15000000000001 | AK277: 150.3 | AL277: 293 | AM277: 58.5 | AN277: 292 | AO277: -4.2000000000000003e-002 | AP277: 3 | AQ277: 长海转债
A278: 298 | B278: 128050 | C278: 钧达转债!! | D278: 2865 | E278: 钧达股份 | F278: 汽车 | G278: 零部件制 | H278: 128.9 | I278: 1.5e-003 | J278: 7.0999999999999995e-003 | K278: 18.87 | L278: 8.6e-003 | M278: 122.7 | N278: 14.85 | O278: 1.3999999999999999e-002 | P278: 127.07 | Q278: 转股中 | R278: 3.57年 | S278: 1.58年 | T278: 1.41 | U278: 37 | V278: 0.20100000000000001 | W278: 5.7000000000000002e-002 | X278: 7.2000000000000008e-002 | Y278: 25 | Z278: 2.33 | AA278: -1.3999999999999999e-002 | AB278: -2.4399999999999998e-002 | AC278: -0.105 | AD278: -0.107 | AE278: 92.66 | AF278: 98.94 | AG278: 1 | AH278: AA- | AI278: 6.3399999999999998e-002 | AJ278: =H278+100*O278 -> 130.30000000000001 | AK278: 130.7 | AL278: 184 | AM278: 31.8 | AN278: 120 | AO278: -6.0000000000000001e-003 | AP278: 53 | AQ278: 钧达转债!!
A279: 44 | B279: 113615 | C279: 金诚转债 | D279: 603979 | E279: 金诚信 | F279: 有色金属 | G279: 有色行业 | H279: 127 | I279: -2.2099999999999998e-002 | J279: 1.2999999999999999e-003 | K279: 15.9 | L279: -2.69e-002 | M279: 117.3 | N279: 12.73 | O279: 1.7000000000000001e-002 | P279: 124.9 | Q279: 46天 | R279: 5.61年 | S279: 3.61年 | T279: 10 | U279: 26 | V279: 2.e-002 | W279: 0.10800000000000001 | X279: 0.13500000000000001 | Y279: 93 | Z279: 2 | AA279: -1.43e-002 | AB279: -1.9599999999999999e-002 | AC279: -5.2400000000000002e-002 | AD279: -5.4199999999999998e-002 | AE279: 88.4 | AF279: 92.61 | AG279: 0.77 | AH279: AA | AI279: 4.3899999999999995e-002 | AJ279: =H279+100*O279 -> 128.69999999999999 | AK279: 129.1 | AL279: 164 | AM279: 36.5 | AN279: 172 | AO279: 3.7999999999999999e-002 | AP279: 4 | AQ279: 金诚转债
A280: 344 | B280: 123002 | C280: 国祯转债!! | D280: 300388 | E280: 节能国祯 | F280: 城市公用 | G280: 三废处理 | H280: 112.82 | I280: 3.73e-002 | J280: -3.73e-002 | K280: 8.16 | L280: 2.e-002 | M280: 108.8 | N280: 8.48 | O280: 0.17199999999999999 | P280: 96.23 | Q280: 转股中 | R280: 2.53年 | S280: 0.53年 | T280: 2.52 | U280: 19 | V280: 6.6000000000000003e-002 | W280: 4.4000000000000004e-002 | X280: 4.2999999999999997e-002 | Y280: 57 | Z280: 1.55 | AA280: -1.44e-002 | AB280: -2.0799999999999999e-002 | AC280: -0.14899999999999999 | AD280: -0.153 | AE280: 98.78 | AF280: 98.55 | AG280: 0 | AH280: AA | AI280: 4.0500000000000001e-002 | AJ280: =H280+100*O280 -> 130.01999999999998 | AK280: 129.4 | AL280: 170 | AM280: 30.6 | AN280: 107 | AO280: 3.7999999999999999e-002 | AP280: 15 | AQ280: 国祯转债!!
A281: 143 | B281: 128119 | C281: 龙大转债! | D281: 2726 | E281: 龙大肉食 | F281: 食品饮料 | G281: 肉制品 | H281: 129.7 | I281: 1.2e-002 | J281: 3.0000000000000001e-003 | K281: 12.2 | L281: 1.9199999999999998e-002 | M281: 120.2 | N281: 9.38 | O281: -3.0000000000000001e-003 | P281: 130.06 | Q281: 转股中 | R281: 5年59天 | S281: 3.16年 | T281: 9.48 | U281: 47 | V281: 3.7999999999999999e-002 | W281: 7.8e-002 | X281: 0.10099999999999999 | Y281: 122 | Z281: 3.5 | AA281: -1.49e-002 | AB281: -2.1400000000000002e-002 | AC281: -6.5500000000000003e-002 | AD281: -6.7400000000000002e-002 | AE281: 90.01 | AF281: 96.71 | AG281: 0.78 | AH281: AA | AI281: 4.3899999999999995e-002 | AJ281: =H281+100*O281 -> 129.39999999999998 | AK281: 129.3 | AL281: 169 | AM281: 32.6 | AN281: 125 | AO281: 5.9000000000000004e-002 | AP281: 9 | AQ281: 龙大转债!
A282: 168 | B282: 113579 | C282: 健友转债! | D282: 603707 | E282: 健友股份 | F282: 医药 | G282: 原料药 | H282: 122.6 | I282: 1.49e-002 | J282: 1.18e-002 | K282: 43.91 | L282: 4.2300000000000004e-002 | M282: 113.9 | N282: 42.05 | O282: 0.17399999999999999 | P282: 104.42 | Q282: 转股中 | R282: 4.94年 | S282: 2.94年 | T282: 5.03 | U282: 16 | V282: 2.5000000000000001e-002 | W282: 1.2e-002 | X282: 1.3000000000000001e-002 | Y282: 410 | Z282: 10.66 | AA282: -1.4999999999999999e-002 | AB282: -2.e-002 | AC282: -5.3699999999999998e-002 | AD282: -5.5599999999999997e-002 | AE282: 90.97 | AF282: 93.13 | AG282: 0.63 | AH282: AA | AI282: 4.24e-002 | AJ282: =H282+100*O282 -> 140. | AK282: 140.8 | AL282: 257 | AM282: 47.6 | AN282: 245 | AO282: 6.2e-002 | AP282: 10 | AQ282: 健友转债!
A283: 360 | B283: 110034 | C283: 九州转债! | D283: 600998 | E283: 九州通 | F283: 医药 | G283: 医药商业 | H283: 109.14 | I283: 5.0000000000000001e-004 | J283: -4.0000000000000002e-004 | K283: 16.91 | L283: 5.9999999999999995e-004 | M283: 108 | N283: 18.32 | O283: 0.182 | P283: 92.3 | Q283: 转股中 | R283: 0.67年 | S283: 回售内 | T283: 15 | U283: 5.3 | V283: 3.0000000000000001e-003 | W283: 4.7e-002 | X283: 4.4000000000000004e-002 | Y283: 317 | Z283: 1.57 | AA283: -1.55e-002 | AB283: -3.7000000000000005e-002 | AC283: 回售内 | AD283: 回售内 | AE283: 103 | AF283: 105.57 | AG283: 0.13 | AH283: AA+ | AI283: 3.4300000000000004e-002 | AJ283: =H283+100*O283 -> 127.34 | AK283: 126 | AL283: 127 | AM283: 20.4 | AN283: 17 | AO283: -1.3000000000000001e-002 | AP283: 25 | AQ283: 九州转债!
A284: 235 | B284: 113548 | C284: 石英转债! | D284: 603688 | E284: 石英股份 | F284: 电子 | G284: 电子产品 | H284: 133.52 | I284: -1.95e-002 | J284: 2.1400000000000002e-002 | K284: 17.5 | L284: 2.8999999999999998e-003 | M284: 124.4 | N284: 15.1 | O284: 0.152 | P284: 115.89 | Q284: 转股中 | R284: 4.45年 | S284: 2.46年 | T284: 1.23 | U284: 34 | V284: 0.20499999999999999 | W284: 2.e-002 | X284: 2.3e-002 | Y284: 62 | Z284: 3.13 | AA284: -1.61e-002 | AB284: -2.5000000000000001e-002 | AC284: -9.0700000000000003e-002 | AD284: -9.3399999999999997e-002 | AE284: 88.95 | AF284: 95.24 | AG284: 0.68 | AH284: AA- | AI284: 6.3399999999999998e-002 | AJ284: =H284+100*O284 -> 148.72 | AK284: 151.1 | AL284: 299 | AM284: 55.9 | AN284: 282 | AO284: -2.6000000000000002e-002 | AP284: 13 | AQ284: 石英转债!
A285: 50 | B285: 113614 | C285: 健20转债! | D285: 603707 | E285: 健友股份 | F285: 医药 | G285: 原料药 | H285: 127.3 | I285: 1.21e-002 | J285: 1.9099999999999999e-002 | K285: 43.91 | L285: 4.2300000000000004e-002 | M285: 114.2 | N285: 38.04 | O285: 0.10300000000000001 | P285: 115.43 | Q285: 40天 | R285: 5.59年 | S285: 3.59年 | T285: 7.8 | U285: 23 | V285: 2.3e-002 | W285: 1.9e-002 | X285: 2.2000000000000002e-002 | Y285: 410 | Z285: 10.66 | AA285: -1.9599999999999999e-002 | AB285: -2.4e-002 | AC285: -5.3499999999999999e-002 | AD285: -5.5199999999999999e-002 | AE285: 88.36 | AF285: 90.22 | AG285: 0.74 | AH285: AA | AI285: 4.3899999999999995e-002 | AJ285: =H285+100*O285 -> 137.59999999999999 | AK285: 139.2 | AL285: 250 | AM285: 48.9 | AN285: 254 | AO285: 6.2e-002 | AP285: 3 | AQ285: 健20转债!
A286: 214 | B286: 128091 | C286: 新天转债 | D286: 2873 | E286: 新天药业 | F286: 医药 | G286: 中药 | H286: 131.506 | I286: -5.8700000000000002e-002 | J286: 5.8299999999999998e-002 | K286: 18.65 | L286: -5.0000000000000001e-004 | M286: 119.4 | N286: 16.39 | O286: 0.156 | P286: 113.79 | Q286: 转股中 | R286: 4.63年 | S286: 2.63年 | T286: 1.76 | U286: 1201. | V286: 5.0700000000000003 | W286: 8.1000000000000003e-002 | X286: 9.1999999999999998e-002 | Y286: 22 | Z286: 2.68 | AA286: -2.1099999999999997e-002 | AB286: -2.81e-002 | AC286: -7.9899999999999999e-002 | AD286: -8.2500000000000004e-002 | AE286: 85.71 | AF286: 86.41 | AG286: 0.74 | AH286: A+ | AI286: 7.4400000000000008e-002 | AJ286: =H286+100*O286 -> 147.10599999999999 | AK286: 149.2 | AL286: 290 | AM286: 62.8 | AN286: 311 | AO286: 8.5000000000000006e-002 | AP286: 18 | AQ286: 新天转债
A287: 311 | B287: 123012 | C287: 万顺转债! | D287: 300057 | E287: 万顺新材 | F287: 有色金属 | G287: 铝金属 | H287: 118 | I287: -4.4500000000000005e-002 | J287: 5.4699999999999999e-002 | K287: 4.71 | L287: 2.1700000000000001e-002 | M287: 110.3 | N287: 5.31 | O287: 0.33000000000000002 | P287: 88.7 | Q287: 转股中 | R287: 3.18年 | S287: 1.18年 | T287: 1.29 | U287: 90 | V287: 0.57799999999999996 | W287: 4.0999999999999995e-002 | X287: 3.6000000000000004e-002 | Y287: 32 | Z287: 0.89 | AA287: -2.1400000000000002e-002 | AB287: -2.7200000000000002e-002 | AC287: -9.8000000000000004e-002 | AD287: -0.10099999999999999 | AE287: 94.69 | AF287: 91.12 | AG287: 0.47 | AH287: AA- | AI287: 6.3399999999999998e-002 | AJ287: =H287+100*O287 -> 151. | AK287: 147.3 | AL287: 285 | AM287: 52.6 | AN287: 273 | AO287: 8.0000000000000002e-003 | AP287: 20 | AQ287: 万顺转债!
A288: 207 | B288: 128096 | C288: 奥瑞转债!! | D288: 2701 | E288: 奥瑞金 | F288: 造纸包装 | G288: 包装材料 | H288: 127.92 | I288: 3.3599999999999998e-002 | J288: -5.5000000000000005e-003 | K288: 5.63 | L288: 3.6799999999999999e-002 | M288: 115.5 | N288: 4.54 | O288: 3.2000000000000001e-002 | P288: 124.01 | Q288: 转股中 | R288: 4.75年 | S288: 2.75年 | T288: 6.84 | U288: 38 | V288: 4.4000000000000004e-002 | W288: 5.0000000000000003e-002 | X288: 6.2e-002 | Y288: 136 | Z288: 2.03 | AA288: -2.1700000000000001e-002 | AB288: -2.7300000000000001e-002 | AC288: -6.9699999999999998e-002 | AD288: -7.2000000000000008e-002 | AE288: 92.63 | AF288: 96.1 | AG288: 0.76 | AH288: AA+ | AI288: 4.0399999999999998e-002 | AJ288: =H288+100*O288 -> 131.12 | AK288: 131.8 | AL288: 190 | AM288: 35.7 | AN288: 156 | AO288: 3.1e-002 | AP288: 19 | AQ288: 奥瑞转债!!
A289: 114 | B289: 128128 | C289: 齐翔转2 | D289: 2408 | E289: 齐翔腾达 | F289: 化工 | G289: 化工 | H289: 129.499 | I289: 3.0999999999999999e-003 | J289: -2.3e-003 | K289: 10.66 | L289: 8.9999999999999998e-004 | M289: 115.3 | N289: 8.22 | O289: -1.e-003 | P289: 129.68 | Q289: 转股中 | R289: 5.27年 | S289: 3.27年 | T289: 12.4 | U289: 68 | V289: 4.2000000000000003e-002 | W289: 5.9999999999999998e-002 | X289: 7.8e-002 | Y289: 205 | Z289: 1.95 | AA289: -2.2200000000000001e-002 | AB289: -2.7200000000000002e-002 | AC289: -6.3099999999999989e-002 | AD289: -6.5000000000000002e-002 | AE289: 89.62 | AF289: 92.37 | AG289: 0.8 | AH289: AA | AI289: 4.3899999999999995e-002 | AJ289: =H289+100*O289 -> 129.399 | AK289: 129.3 | AL289: 166 | AM289: 36.9 | AN289: 179 | AO289: 9.0999999999999998e-002 | AP289: 39 | AQ289: 齐翔转2
A290: 159 | B290: 113585 | C290: 寿仙转债! | D290: 603896 | E290: 寿仙谷 | F290: 医药 | G290: 中药 | H290: 132.01 | I290: -1.15e-002 | J290: 1.7299999999999999e-002 | K290: 38 | L290: 6.8999999999999999e-003 | M290: 117.8 | N290: 28.68 | O290: -4.0000000000000001e-003 | P290: 132.5 | Q290: 转股中 | R290: 5年25天 | S290: 3年26天 | T290: 1.68 | U290: 171 | V290: 0.76200000000000001 | W290: 2.9999999999999999e-002 | X290: 3.9e-002 | Y290: 57 | Z290: 4.12 | AA290: -2.2700000000000001e-002 | AB290: -2.86e-002 | AC290: -7.1500000000000008e-002 | AD290: -7.3599999999999999e-002 | AE290: 85.2 | AF290: 86.33 | AG290: 0.83 | AH290: AA- | AI290: 6.4899999999999999e-002 | AJ290: =H290+100*O290 -> 131.60999999999999 | AK290: 131.5 | AL290: 188 | AM290: 45.2 | AN290: 230 | AO290: 2.3e-002 | AP290: 9 | AQ290: 寿仙转债!
A291: 166 | B291: 128108 | C291: 蓝帆转债! | D291: 2382 | E291: 蓝帆医疗 | F291: 医药 | G291: 医疗器械 | H291: 127.11 | I291: -7.000000000000001e-004 | J291: -2.8000000000000004e-003 | K291: 22.46 | L291: -4.4000000000000003e-003 | M291: 113.3 | N291: 17.79 | O291: 6.9999999999999993e-003 | P291: 126.25 | Q291: 转股中 | R291: 5年13天 | S291: 4年14天 | T291: 15.3 | U291: 149 | V291: 7.5999999999999998e-002 | W291: 6.5000000000000002e-002 | X291: 8.199999999999999e-002 | Y291: 235 | Z291: 1.89 | AA291: -2.3e-002 | AB291: -2.76e-002 | AC291: -4.3700000000000003e-002 | AD291: -4.6100000000000002e-002 | AE291: 88.46 | AF291: 91.7 | AG291: 0.79 | AH291: AA | AI291: 4.3899999999999995e-002 | AJ291: =H291+100*O291 -> 127.81 | AK291: 128 | AL291: 151 | AM291: 36.3 | AN291: 169 | AO291: 4.2999999999999997e-002 | AP291: 26 | AQ291: 蓝帆转债!
A292: 351 | B292: 113013 | C292: 国君转债! | D292: 601211 | E292: 国泰君安 | F292: 金融 | G292: 证券行业 | H292: 114.03 | I292: 1.32e-002 | J292: 8.3000000000000001e-003 | K292: 17.52 | L292: 5.7300000000000004e-002 | M292: 108.3 | N292: 19.01 | O292: 0.23699999999999999 | P292: 92.16 | Q292: 转股中 | R292: 2年54天 | S292: 无权 | T292: 69.9 | U292: 226 | V292: 2.7999999999999997e-002 | W292: 4.4999999999999998e-002 | X292: 4.0999999999999995e-002 | Y292: 1561. | Z292: 1.2 | AA292: -2.4199999999999999e-002 | AB292: -3.1200000000000002e-002 | AC292: 无权 | AD292: 无权 | AE292: 无权 | AF292: 100.64 | AG292: 0.38 | AH292: AAA | AI292: 3.5499999999999997e-002 | AJ292: =H292+100*O292 -> 137.72999999999999 | AK292: 135.9 | AL292: 232 | AM292: 35.3 | AN292: 151 | AO292: 7.9000000000000001e-002 | AP292: 14 | AQ292: 国君转债!
A293: 275 | B293: 123025 | C293: 精测转债!! | D293: 300567 | E293: 精测电子 | F293: 电子 | G293: 液晶显示 | H293: 128.103 | I293: -5.1000000000000004e-003 | J293: 1.1299999999999999e-002 | K293: 52.54 | L293: 9.5999999999999992e-003 | M293: 116.5 | N293: 49.67 | O293: 0.21100000000000002 | P293: 105.78 | Q293: 转股中 | R293: 3.87年 | S293: 1.87年 | T293: 3.09 | U293: 5.8 | V293: 1.4999999999999999e-002 | W293: 2.1000000000000001e-002 | X293: 2.2000000000000002e-002 | Y293: 146 | Z293: 7.36 | AA293: -2.46e-002 | AB293: -3.1899999999999998e-002 | AC293: -0.10199999999999999 | AD293: -0.105 | AE293: 90.79 | AF293: 92.23 | AG293: 0.64 | AH293: AA- | AI293: 6.3399999999999998e-002 | AJ293: =H293+100*O293 -> 149.203 | AK293: 150.4 | AL293: 294 | AM293: 58.2 | AN293: 290 | AO293: -7.8e-002 | AP293: 17 | AQ293: 精测转债!!
A294: 220 | B294: 113559 | C294: 永创转债! | D294: 603901 | E294: 永创智能 | F294: 机械装备 | G294: 专用设备 | H294: 132.53 | I294: 5.9699999999999996e-002 | J294: 2.1299999999999999e-002 | K294: 13.61 | L294: 0.10000000000000001 | M294: 118.3 | N294: 10.32 | O294: 5.0000000000000001e-003 | P294: 131.88 | Q294: 转股中 | R294: 4.61年 | S294: 2.61年 | T294: 4.69 | U294: 1386. | V294: 2.1699999999999999 | W294: 7.8e-002 | X294: 0.10300000000000001 | Y294: 60 | Z294: 4.1 | AA294: -2.4900000000000002e-002 | AB294: -3.1600000000000003e-002 | AC294: -8.3299999999999999e-002 | AD294: -8.5900000000000004e-002 | AE294: 88.2 | AF294: 89.77 | AG294: 0.81 | AH294: AA- | AI294: 6.3399999999999998e-002 | AJ294: =H294+100*O294 -> 133.03 | AK294: 133.2 | AL294: 203 | AM294: 43.4 | AN294: 219 | AO294: 4.2000000000000003e-002 | AP294: 19 | AQ294: 永创转债!
A295: 95 | B295: 127022 | C295: 恒逸转债 | D295: 703 | E295: 恒逸石化 | F295: 化工 | G295: 化工 | H295: 124.85 | I295: -2.8000000000000004e-003 | J295: 3.4000000000000002e-003 | K295: 12.72 | L295: 8.0000000000000004e-004 | M295: 108.9 | N295: 11.5 | O295: 0.129 | P295: 110.61 | Q295: 转股中 | R295: 5.42年 | S295: 3.42年 | T295: 20 | U295: 37 | V295: 1.4999999999999999e-002 | W295: 4.2999999999999997e-002 | X295: 4.7e-002 | Y295: 468 | Z295: 1.89 | AA295: -2.52e-002 | AB295: -2.81e-002 | AC295: -5.33e-002 | AD295: -5.4600000000000003e-002 | AE295: 88.66 | AF295: 87.45 | AG295: 0.74 | AH295: AA+ | AI295: 4.1900000000000007e-002 | AJ295: =H295+100*O295 -> 137.75 | AK295: 139.1 | AL295: 249 | AM295: 50.4 | AN295: 261 | AO295: -3.9e-002 | AP295: 6 | AQ295: 恒逸转债
A296: 10 | B296: 123108 | C296: 乐普转2 | D296: 300003 | E296: 乐普医疗 | F296: 医药 | G296: 医疗器械 | H296: 125.749 | I296: 1.2500000000000001e-002 | J296: 2.2700000000000001e-002 | K296: 32.06 | L296: 5.3600000000000002e-002 | M296: 111.1 | N296: 29.73 | O296: 0.16600000000000001 | P296: 107.84 | Q296: 4月27天 | R296: 4.87年 | S296: 2.88年 | T296: 16.4 | U296: 59 | V296: 2.8999999999999998e-002 | W296: 2.7999999999999997e-002 | X296: 3.1e-002 | Y296: 579 | Z296: 5.44 | AA296: -2.5399999999999999e-002 | AB296: -2.9399999999999999e-002 | AC296: -6.6500000000000004e-002 | AD296: -6.7699999999999996e-002 | AE296: 90.51 | AF296: 91.8 | AG296: 0.66 | AH296: AA+ | AI296: 4.0399999999999998e-002 | AJ296: =H296+100*O296 -> 142.34899999999999 | AK296: 143.7 | AL296: 274 | AM296: 51.9 | AN296: 267 | AO296: 8.1000000000000003e-002 | AP296: 7 | AQ296: 乐普转2
A297: 98 | B297: 110075 | C297: 南航转债 | D297: 600029 | E297: 南方航空 | F297: 交通运输 | G297: 航空运输 | H297: 126.51 | I297: 8.9999999999999998e-004 | J297: 1.41e-002 | K297: 6.36 | L297: 2.4199999999999999e-002 | M297: 110 | N297: 6.24 | O297: 0.24100000000000002 | P297: 101.92 | Q297: 转股中 | R297: 5.42年 | S297: 3.42年 | T297: 160 | U297: 22 | V297: 1.e-003 | W297: 0.16399999999999998 | X297: 0.16699999999999998 | Y297: 975 | Z297: 1.49 | AA297: -2.58e-002 | AB297: -2.8999999999999998e-002 | AC297: -5.79e-002 | AD297: -5.9000000000000004e-002 | AE297: 89.24 | AF297: 89.69 | AG297: 0.62 | AH297: AAA | AI297: 3.8900000000000004e-002 | AJ297: =H297+100*O297 -> 150.61000000000001 | AK297: 151.1 | AL297: 298 | AM297: 61.4 | AN297: 301 | AO297: -2.4e-002 | AP297: 7 | AQ297: 南航转债
A298: 4 | B298: 113047 | C298: 旗滨转债 | D298: 601636 | E298: 旗滨集团 | F298: 建筑 | G298: 玻璃 | H298: 134.8 | I298: 5.7999999999999996e-003 | J298: -1.43e-002 | K298: 14.92 | L298: -1.1899999999999999e-002 | M298: 114 | N298: 13.15 | O298: 0.188 | P298: 113.46 | Q298: 5月4天 | R298: 5.90年 | S298: 3.90年 | T298: 15 | U298: 122 | V298: 6.0999999999999999e-002 | W298: 3.7000000000000005e-002 | X298: 4.2000000000000003e-002 | Y298: 401 | Z298: 3.86 | AA298: -2.8300000000000002e-002 | AB298: -3.2400000000000005e-002 | AC298: -6.54e-002 | AD298: -6.6400000000000001e-002 | AE298: 86.81 | AF298: 89.75 | AG298: 0.71 | AH298: AA+ | AI298: 4.1900000000000007e-002 | AJ298: =H298+100*O298 -> 153.60000000000002 | AK298: 156.1 | AL298: 312 | AM298: 66.4 | AN298: 319 | AO298: 2.7000000000000003e-002 | AP298: 4 | AQ298: 旗滨转债
A299: 90 | B299: 113040 | C299: 星宇转债 | D299: 601799 | E299: 星宇股份 | F299: 汽车 | G299: 零部件制 | H299: 130.48 | I299: 2.2000000000000001e-003 | J299: -1.38e-002 | K299: 173.06 | L299: -1.67e-002 | M299: 111.5 | N299: 158 | O299: 0.191 | P299: 109.53 | Q299: 转股中 | R299: 5.44年 | S299: 3.44年 | T299: 15 | U299: 3.6 | V299: 2.e-003 | W299: 3.1e-002 | X299: 3.4000000000000002e-002 | Y299: 478 | Z299: 7.9 | AA299: -2.8799999999999999e-002 | AB299: -3.2500000000000001e-002 | AC299: -6.5700000000000008e-002 | AD299: -6.6699999999999995e-002 | AE299: 88.26 | AF299: 89.44 | AG299: 0.7 | AH299: AA+ | AI299: 4.1900000000000007e-002 | AJ299: =H299+100*O299 -> 149.57999999999998 | AK299: 151.4 | AL299: 302 | AM299: 62 | AN299: 305 | AO299: -9.6000000000000002e-002 | AP299: 5 | AQ299: 星宇转债
A300: 325 | B300: 127005 | C300: 长证转债! | D300: 783 | E300: 长江证券 | F300: 金融 | G300: 证券行业 | H300: 117.8 | I300: 3.1400000000000004e-002 | J300: 2.e-003 | K300: 7.54 | L300: 5.7500000000000002e-002 | M300: 108.3 | N300: 7.28 | O300: 0.13699999999999998 | P300: 103.57 | Q300: 转股中 | R300: 2.82年 | S300: 无权 | T300: 50 | U300: 198 | V300: 3.4000000000000002e-002 | W300: 0.12 | X300: 0.124 | Y300: 417 | Z300: 1.45 | AA300: -2.9700000000000001e-002 | AB300: -3.5000000000000003e-002 | AC300: 无权 | AD300: 无权 | AE300: 无权 | AF300: 98.28 | AG300: 0.58 | AH300: AAA | AI300: 3.5499999999999997e-002 | AJ300: =H300+100*O300 -> 131.5 | AK300: 132 | AL300: 192 | AM300: 33.7 | AN300: 136 | AO300: 4.4999999999999998e-002 | AP300: 14 | AQ300: 长证转债!
A301: 17 | B301: 127030 | C301: 盛虹转债 | D301: 301 | E301: 东方盛虹 | F301: 化工 | G301: 化纤 | H301: 133.87 | I301: 3.2899999999999999e-002 | J301: -3.2899999999999999e-002 | K301: 16.5 | L301: 0. | M301: 112.5 | N301: 14.2 | O301: 0.152 | P301: 116.2 | Q301: 4月16天 | R301: 5.85年 | S301: 3.85年 | T301: 50 | U301: 753 | V301: 0.11199999999999999 | W301: 6.3e-002 | X301: 7.2999999999999995e-002 | Y301: 798 | Z301: 4.4 | AA301: -2.9700000000000001e-002 | AB301: -3.3300000000000003e-002 | AC301: -6.3399999999999998e-002 | AD301: -6.4699999999999994e-002 | AE301: 87.41 | AF301: 88.78 | AG301: 0.74 | AH301: AA+ | AI301: 4.1900000000000007e-002 | AJ301: =H301+100*O301 -> 149.06999999999999 | AK301: 151.5 | AL301: 303 | AM301: 62.8 | AN301: 310 | AO301: 0.122 | AP301: 4 | AQ301: 盛虹转债
A302: 321 | B302: 113508 | C302: 新凤转债! | D302: 603225 | E302: 新凤鸣 | F302: 服装纺织 | G302: 纺织行业 | H302: 121.52 | I302: -3.9000000000000003e-003 | J302: 5.0000000000000001e-004 | K302: 17.79 | L302: -5.0000000000000001e-003 | M302: 111.3 | N302: 15.78 | O302: 7.8e-002 | P302: 112.74 | Q302: 转股中 | R302: 2.95年 | S302: 0.95年 | T302: 20.6 | U302: 24 | V302: 1.e-002 | W302: 8.3000000000000004e-002 | X302: 9.3000000000000013e-002 | Y302: 249 | Z302: 2.04 | AA302: -2.98e-002 | AB302: -3.6499999999999998e-002 | AC302: -0.14300000000000002 | AD302: -0.14599999999999999 | AE302: 97.39 | AF302: 99.17 | AG302: 0.68 | AH302: AA | AI302: 4.0500000000000001e-002 | AJ302: =H302+100*O302 -> 129.31999999999999 | AK302: 130.3 | AL302: 179 | AM302: 31.1 | AN302: 112 | AO302: 2.8999999999999998e-002 | AP302: 24 | AQ302: 新凤转债!
A303: 232 | B303: 110061 | C303: 川投转债 | D303: 600674 | E303: 川投能源 | F303: 能源电力 | G303: 水电 | H303: 126.96 | I303: 6.5000000000000006e-003 | J303: -2.0199999999999999e-002 | K303: 11.38 | L303: -1.8100000000000002e-002 | M303: 110.8 | N303: 9.58 | O303: 6.9000000000000006e-002 | P303: 118.79 | Q303: 转股中 | R303: 4.49年 | S303: 2.50年 | T303: 39.6 | U303: 4.6 | V303: 1.e-003 | W303: 7.9000000000000001e-002 | X303: 9.4e-002 | Y303: 501 | Z303: 1.74 | AA303: -3.04e-002 | AB303: -3.4599999999999999e-002 | AC303: -7.5199999999999989e-002 | AD303: -7.7300000000000008e-002 | AE303: 93.76 | AF303: 94.26 | AG303: 0.76 | AH303: AAA | AI303: 3.7400000000000003e-002 | AJ303: =H303+100*O303 -> 133.85999999999999 | AK303: 135.1 | AL303: 224 | AM303: 40.9 | AN303: 204 | AO303: -2.5000000000000001e-002 | AP303: 16 | AQ303: 川投转债
A304: 361 | B304: 110033 | C304: 国贸转债! | D304: 600755 | E304: 厦门国贸 | F304: 交通运输 | G304: 交通运输 | H304: 110.23 | I304: 2.3999999999999998e-003 | J304: 2.3e-003 | K304: 7.18 | L304: 1.5600000000000001e-002 | M304: 108 | N304: 7.18 | O304: 0.10199999999999999 | P304: 100 | Q304: 转股中 | R304: 0.65年 | S304: 回售内 | T304: 12.1 | U304: 19 | V304: 1.3999999999999999e-002 | W304: 8.6999999999999994e-002 | X304: 8.6999999999999994e-002 | Y304: 140 | Z304: 0.87 | AA304: -3.1099999999999999e-002 | AB304: -5.3200000000000004e-002 | AC304: 回售内 | AD304: 回售内 | AE304: 100.33 | AF304: 105.87 | AG304: 0.3 | AH304: AAA | AI304: 3.1300000000000001e-002 | AJ304: =H304+100*O304 -> 120.43000000000001 | AK304: 120.5 | AL304: 63 | AM304: 14.6 | AN304: 5 | AO304: 4.7e-002 | AP304: 18 | AQ304: 国贸转债!
A305: 66 | B305: 113611 | C305: 福20转债 | D305: 603806 | E305: 福斯特 | F305: 能源电力 | G305: 太阳能 | H305: 134.51 | I305: 1.0500000000000001e-002 | J305: 1.2500000000000001e-002 | K305: 87.12 | L305: 3.1e-002 | M305: 111.85 | N305: 73.69 | O305: 0.13800000000000001 | P305: 118.22 | Q305: 24天 | R305: 5.55年 | S305: 3.55年 | T305: 17 | U305: 12 | V305: 5.0000000000000001e-003 | W305: 2.5000000000000001e-002 | X305: 2.9999999999999999e-002 | Y305: 670 | Z305: 7.32 | AA305: -3.3099999999999997e-002 | AB305: -3.6799999999999999e-002 | AC305: -7.0599999999999996e-002 | AD305: -7.1800000000000003e-002 | AE305: 87.59 | AF305: 88.43 | AG305: 0.74 | AH305: AA | AI305: 4.3899999999999995e-002 | AJ305: =H305+100*O305 -> 148.31 | AK305: 150.8 | AL305: 295 | AM305: 62.4 | AN305: 306 | AO305: 2.8999999999999998e-002 | AP305: 5 | AQ305: 福20转债
A306: 7 | B306: 123111 | C306: 东财转3 | D306: 300059 | E306: 东方财富 | F306: 金融 | G306: 证券行业 | H306: 135.314 | I306: 4.1200000000000001e-002 | J306: 5.8499999999999996e-002 | K306: 34.4 | L306: 0.128 | M306: 110.5 | N306: 28.08 | O306: 0.105 | P306: 122.51 | Q306: 5月2天 | R306: 5.90年 | S306: 3.90年 | T306: 158 | U306: 4098. | V306: 0.191 | W306: 5.2999999999999999e-002 | X306: 6.5000000000000002e-002 | Y306: 2963. | Z306: 8.44 | AA306: -3.4099999999999998e-002 | AB306: -3.7200000000000004e-002 | AC306: -6.7400000000000002e-002 | AD306: -6.8199999999999997e-002 | AE306: 86.39 | AF306: 86.97 | AG306: 0.78 | AH306: AA+ | AI306: 4.1900000000000007e-002 | AJ306: =H306+100*O306 -> 145.81399999999999 | AK306: 148.1 | AL306: 287 | AM306: 61.2 | AN306: 300 | AO306: 0.13800000000000001 | AP306: 12 | AQ306: 东财转3
A307: 240 | B307: 128079 | C307: 英联转债! | D307: 2846 | E307: 英联股份 | F307: 造纸包装 | G307: 包装材料 | H307: 137 | I307: -2.1400000000000002e-002 | J307: 2.1400000000000002e-002 | K307: 8.32 | L307: 1.46e-002 | M307: 117.5 | N307: 8.29 | O307: 0.36499999999999999 | P307: 100.36 | Q307: 转股中 | R307: 4.44年 | S307: 2.44年 | T307: 1.52 | U307: 261 | V307: 1.25 | W307: 5.7000000000000002e-002 | X307: 5.7999999999999996e-002 | Y307: 26 | Z307: 3.44 | AA307: -3.4700000000000002e-002 | AB307: -4.1200000000000001e-002 | AC307: -0.10199999999999999 | AD307: -0.10400000000000001 | AE307: 86.16 | AF307: 86.08 | AG307: 0 | AH307: A+ | AI307: 7.4400000000000008e-002 | AJ307: =H307+100*O307 -> 173.5 | AK307: 173.6 | AL307: 328 | AM307: 87.5 | AN307: 332 | AO307: -5.0000000000000003e-002 | AP307: 19 | AQ307: 英联转债!
A308: 299 | B308: 110048 | C308: 福能转债! | D308: 600483 | E308: 福能股份 | F308: 能源电力 | G308: 电力供应 | H308: 128.41 | I308: 1.6000000000000001e-003 | J308: -3.9000000000000003e-003 | K308: 10.18 | L308: -2.8999999999999998e-003 | M308: 113.3 | N308: 8.12 | O308: 2.4e-002 | P308: 125.37 | Q308: 转股中 | R308: 3.56年 | S308: 1.57年 | T308: 20.5 | U308: 66 | V308: 2.5000000000000001e-002 | W308: 0.113 | X308: 0.14199999999999999 | Y308: 182 | Z308: 1.15 | AA308: -3.5099999999999999e-002 | AB308: -4.1500000000000002e-002 | AC308: -0.105 | AD308: -0.107 | AE308: 96.03 | AF308: 98.65 | AG308: 0.79 | AH308: AA+ | AI308: 4.0399999999999998e-002 | AJ308: =H308+100*O308 -> 130.81 | AK308: 131.5 | AL308: 187 | AM308: 32.8 | AN308: 128 | AO308: 2.1000000000000001e-002 | AP308: 9 | AQ308: 福能转债!
A309: 219 | B309: 110065 | C309: 淮矿转债! | D309: 600985 | E309: 淮北矿业 | F309: 煤炭 | G309: 煤炭开采 | H309: 131.6 | I309: -1.3899999999999999e-002 | J309: -1.5e-003 | K309: 12.03 | L309: -1.8799999999999997e-002 | M309: 110.8 | N309: 9.33 | O309: 2.1000000000000001e-002 | P309: 128.94 | Q309: 转股中 | R309: 4.61年 | S309: 2.61年 | T309: 17 | U309: 147 | V309: 6.6000000000000003e-002 | W309: 6.3e-002 | X309: 8.199999999999999e-002 | Y309: 268 | Z309: 1.17 | AA309: -3.73e-002 | AB309: -4.1299999999999996e-002 | AC309: -8.4100000000000008e-002 | AD309: -8.6099999999999996e-002 | AE309: 93.37 | AF309: 93.86 | AG309: 0.82 | AH309: AAA | AI309: 3.7400000000000003e-002 | AJ309: =H309+100*O309 -> 133.69999999999999 | AK309: 134.3 | AL309: 215 | AM309: 40.4 | AN309: 201 | AO309: 8.0000000000000002e-003 | AP309: 21 | AQ309: 淮矿转债!
A310: 260 | B310: 113537 | C310: 文灿转债!! | D310: 603348 | E310: 文灿股份 | F310: 汽车 | G310: 零部件制 | H310: 142.32 | I310: -3.5999999999999999e-003 | J310: 1.3899999999999999e-002 | K310: 23.98 | L310: 1.3999999999999999e-002 | M310: 121.5 | N310: 19.43 | O310: 0.153 | P310: 123.42 | Q310: 转股中 | R310: 4年26天 | S310: 2年27天 | T310: 1.44 | U310: 229 | V310: 1.1299999999999999 | W310: 2.3e-002 | X310: 2.8999999999999998e-002 | Y310: 62 | Z310: 2.41 | AA310: -3.9100000000000003e-002 | AB310: -4.7500000000000001e-002 | AC310: -0.10099999999999999 | AD310: -0.10300000000000001 | AE310: 91.18 | AF310: 95.27 | AG310: 0.74 | AH310: AA- | AI310: 6.3399999999999998e-002 | AJ310: =H310+100*O310 -> 157.62 | AK310: 161.2 | AL310: 320 | AM310: 65.9 | AN310: 317 | AO310: -8.5000000000000006e-002 | AP310: 24 | AQ310: 文灿转债!!
A311: 210 | B311: 123042 | C311: 银河转债! | D311: 300619 | E311: 金银河 | F311: 机械装备 | G311: 专用设备 | H311: 138.654 | I311: -4.5100000000000001e-002 | J311: 5.0599999999999999e-002 | K311: 18.51 | L311: 1.2e-002 | M311: 115.4 | N311: 24.4 | O311: 0.82799999999999996 | P311: 75.86 | Q311: 转股中 | R311: 4.67年 | S311: 2.67年 | T311: 1.67 | U311: 309 | V311: 1.3200000000000001 | W311: 0.121 | X311: 9.1999999999999998e-002 | Y311: 14 | Z311: 2.83 | AA311: -3.9300000000000002e-002 | AB311: -4.4800000000000006e-002 | AC311: -9.8100000000000007e-002 | AD311: -0.10000000000000001 | AE311: 84.82 | AF311: 83.18 | AG311: 0.46 | AH311: A+ | AI311: 7.4400000000000008e-002 | AJ311: =H311+100*O311 -> 221.45400000000001 | AK311: 201.4 | AL311: 336 | AM311: 116.6 | AN311: 341 | AO311: -6.9999999999999993e-003 | AP311: 24 | AQ311: 银河转债!
A312: 335 | B312: 128032 | C312: 双环转债! | D312: 2472 | E312: 双环传动 | F312: 机械装备 | G312: 通用设备 | H312: 121.2 | I312: 1.e-002 | J312: -7.4000000000000003e-003 | K312: 11.42 | L312: 3.4999999999999996e-003 | M312: 109.3 | N312: 9.89 | O312: 5.0000000000000003e-002 | P312: 115.47 | Q312: 转股中 | R312: 2.62年 | S312: 0.62年 | T312: 9.93 | U312: 4.3 | V312: 4.0000000000000001e-003 | W312: 0.127 | X312: 0.14599999999999999 | Y312: 78 | Z312: 2.24 | AA312: -3.9399999999999998e-002 | AB312: -4.5599999999999995e-002 | AC312: -0.20999999999999999 | AD312: -0.214 | AE312: 98.69 | AF312: 98.69 | AG312: 0.72 | AH312: AA | AI312: 4.0500000000000001e-002 | AJ312: =H312+100*O312 -> 126.2 | AK312: 126.9 | AL312: 138 | AM312: 28.2 | AN312: 79 | AO312: 2.6000000000000002e-002 | AP312: 41 | AQ312: 双环转债!
A313: 329 | B313: 110043 | C313: 无锡转债! | D313: 600908 | E313: 无锡银行 | F313: 金融 | G313: 银行行业 | H313: 120.68 | I313: 2.2700000000000001e-002 | J313: -1.06e-002 | K313: 6.18 | L313: 1.9799999999999998e-002 | M313: 108.3 | N313: 5.79 | O313: 0.13100000000000001 | P313: 106.74 | Q313: 转股中 | R313: 2.72年 | S313: 无权 | T313: 29.2 | U313: 79 | V313: 2.3e-002 | W313: 0.254 | X313: 0.27100000000000002 | Y313: 115 | Z313: 0.93 | AA313: -3.95e-002 | AB313: -4.4900000000000002e-002 | AC313: 无权 | AD313: 无权 | AE313: 无权 | AF313: 97.86 | AG313: 0.61 | AH313: AA+ | AI313: 3.85e-002 | AJ313: =H313+100*O313 -> 133.78 | AK313: 134.6 | AL313: 218 | AM313: 36.8 | AN313: 176 | AO313: 3.4000000000000002e-002 | AP313: 26 | AQ313: 无锡转债!
A314: 359 | B314: 113009 | C314: 广汽转债! | D314: 601238 | E314: 广汽集团 | F314: 汽车 | G314: 乘用车 | H314: 109.06 | I314: 9.4999999999999998e-003 | J314: -5.6999999999999993e-003 | K314: 12.12 | L314: 5.9400000000000001e-002 | M314: 106 | N314: 14.12 | O314: 0.27100000000000002 | P314: 85.84 | Q314: 转股中 | R314: 0.69年 | S314: 回售内 | T314: 25.5 | U314: 74 | V314: 2.7000000000000003e-002 | W314: 2.e-002 | X314: 1.7000000000000001e-002 | Y314: 1255. | Z314: 1.45 | AA314: -4.0199999999999993e-002 | AB314: -5.5899999999999998e-002 | AC314: 回售内 | AD314: 回售内 | AE314: 100.27 | AF314: 103.76 | AG314: 0.06 | AH314: AAA | AI314: 3.1300000000000001e-002 | AJ314: =H314+100*O314 -> 136.16 | AK314: 132.3 | AL314: 197 | AM314: 28.5 | AN314: 82 | AO314: 8.900000000000001e-002 | AP314: 16 | AQ314: 广汽转债!
A315: 304 | B315: 128046 | C315: 利尔转债!! | D315: 2258 | E315: 利尔化学 | F315: 化工 | G315: 农化 | H315: 129.323 | I315: 8.9999999999999998e-004 | J315: 0. | K315: 22.93 | L315: 8.9999999999999998e-004 | M315: 112.3 | N315: 18.42 | O315: 3.9e-002 | P315: 124.48 | Q315: 转股中 | R315: 3.42年 | S315: 1.43年 | T315: 8.47 | U315: 4.5 | V315: 4.0000000000000001e-003 | W315: 7.0000000000000007e-002 | X315: 8.8000000000000009e-002 | Y315: 120 | Z315: 3.09 | AA315: -4.1100000000000005e-002 | AB315: -4.7300000000000002e-002 | AC315: -0.12 | AD315: -0.122 | AE315: 96.27 | AF315: 97.7 | AG315: 1 | AH315: AA | AI315: 4.24e-002 | AJ315: =H315+100*O315 -> 133.22300000000001 | AK315: 134.2 | AL315: 214 | AM315: 36.5 | AN315: 171 | AO315: -1.e-003 | AP315: 10 | AQ315: 利尔转债!!
A316: 42 | B316: 113616 | C316: 韦尔转债 | D316: 603501 | E316: 韦尔股份 | F316: 电子 | G316: 元器件制 | H316: 145.86 | I316: 2.4900000000000002e-002 | J316: -4.3e-003 | K316: 272 | L316: 2.7200000000000002e-002 | M316: 114.5 | N316: 222.83 | O316: 0.19500000000000001 | P316: 122.07 | Q316: 52天 | R316: 5.62年 | S316: 3.62年 | T316: 24.4 | U316: 157 | V316: 4.4000000000000004e-002 | W316: 1.e-002 | X316: 1.3000000000000001e-002 | Y316: 2361. | Z316: 18.98 | AA316: -4.2699999999999995e-002 | AB316: -4.7e-002 | AC316: -8.8100000000000012e-002 | AD316: -8.9399999999999993e-002 | AE316: 88.24 | AF316: 91.21 | AG316: 0.76 | AH316: AA+ | AI316: 4.1900000000000007e-002 | AJ316: =H316+100*O316 -> 165.36000000000001 | AK316: 169.7 | AL316: 326 | AM316: 78.4 | AN316: 329 | AO316: -4.8000000000000001e-002 | AP316: 8 | AQ316: 韦尔转债
A317: 322 | B317: 128036 | C317: 金农转债!! | D317: 2548 | E317: 金新农 | F317: 农业 | G317: 畜牧业 | H317: 123.65 | I317: -2.1000000000000001e-002 | J317: 1.7500000000000002e-002 | K317: 6.13 | L317: -8.1000000000000013e-003 | M317: 109.3 | N317: 6.96 | O317: 0.40399999999999997 | P317: 88.07 | Q317: 转股中 | R317: 2.82年 | S317: 0.82年 | T317: 1.46 | U317: 73 | V317: 0.40200000000000002 | W317: 3.4000000000000002e-002 | X317: 2.9999999999999999e-002 | Y317: 42 | Z317: 1.62 | AA317: -4.3499999999999997e-002 | AB317: -4.9200000000000001e-002 | AC317: -0.17999999999999999 | AD317: -0.183 | AE317: 96 | AF317: 92.63 | AG317: 0.43 | AH317: AA- | AI317: 6.1500000000000006e-002 | AJ317: =H317+100*O317 -> 164.05000000000001 | AK317: 159.2 | AL317: 316 | AM317: 63.2 | AN317: 313 | AO317: -8.199999999999999e-002 | AP317: 16 | AQ317: 金农转债!!
A318: 156 | B318: 128113 | C318: 比音转债! | D318: 2832 | E318: 比音勒芬 | F318: 服装纺织 | G318: 服装行业 | H318: 147 | I318: 3.95e-002 | J318: -2.52e-002 | K318: 21.33 | L318: 1.67e-002 | M318: 117.3 | N318: 14.9 | O318: 2.7000000000000003e-002 | P318: 143.15 | Q318: 转股中 | R318: 5年31天 | S318: 3年32天 | T318: 3.74 | U318: 40 | V318: 7.2999999999999995e-002 | W318: 3.2000000000000001e-002 | X318: 4.5999999999999999e-002 | Y318: 116 | Z318: 4.41 | AA318: -4.4199999999999996e-002 | AB318: -4.9800000000000004e-002 | AC318: -0.10099999999999999 | AD318: -0.10199999999999999 | AE318: 90.41 | AF318: 94.72 | AG318: 0.86 | AH318: AA | AI318: 4.3899999999999995e-002 | AJ318: =H318+100*O318 -> 149.69999999999999 | AK318: 150.8 | AL318: 296 | AM318: 56.1 | AN318: 283 | AO318: 5.7999999999999996e-002 | AP318: 9 | AQ318: 比音转债!
A319: 182 | B319: 113575 | C319: 东时转债! | D319: 603377 | E319: 东方时尚 | F319: 其他 | G319: 其他 | H319: 140.97 | I319: -3.5099999999999999e-002 | J319: 4.4400000000000002e-002 | K319: 14.79 | L319: 1.5100000000000001e-002 | M319: 113.1 | N319: 14.56 | O319: 0.38799999999999996 | P319: 101.58 | Q319: 转股中 | R319: 4.90年 | S319: 2.90年 | T319: 0.98 | U319: 193 | V319: 1.3899999999999999 | W319: 1.1000000000000001e-002 | X319: 1.1000000000000001e-002 | Y319: 90 | Z319: 4.31 | AA319: -4.4699999999999997e-002 | AB319: -4.9200000000000001e-002 | AC319: -9.6500000000000002e-002 | AD319: -9.8400000000000001e-002 | AE319: 91.15 | AF319: 92.63 | AG319: 0.61 | AH319: AA | AI319: 4.24e-002 | AJ319: =H319+100*O319 -> 179.76999999999998 | AK319: 180.4 | AL319: 333 | AM319: 87.7 | AN319: 333 | AO319: -1.1000000000000001e-002 | AP319: 15 | AQ319: 东时转债!
A320: 281 | B320: 123022 | C320: 长信转债!! | D320: 300088 | E320: 长信科技 | F320: 通信互联 | G320: 通信设备 | H320: 136.95 | I320: 3.7000000000000002e-003 | J320: 1.4000000000000002e-003 | K320: 7.87 | L320: 6.4000000000000003e-003 | M320: 114.3 | N320: 6.15 | O320: 7.0000000000000007e-002 | P320: 127.97 | Q320: 转股中 | R320: 3.84年 | S320: 1.84年 | T320: 2.57 | U320: 25 | V320: 7.2999999999999995e-002 | W320: 1.3000000000000001e-002 | X320: 1.7000000000000001e-002 | Y320: 193 | Z320: 2.68 | AA320: -4.6699999999999998e-002 | AB320: -5.2900000000000003e-002 | AC320: -0.109 | AD320: -0.11 | AE320: 94.62 | AF320: 97.73 | AG320: 0.8 | AH320: AA | AI320: 4.24e-002 | AJ320: =H320+100*O320 -> 143.94999999999999 | AK320: 145.9 | AL320: 282 | AM320: 48.2 | AN320: 249 | AO320: 3.9e-002 | AP320: 12 | AQ320: 长信转债!!
A321: 229 | B321: 113550 | C321: 常汽转债! | D321: 603035 | E321: 常熟汽饰 | F321: 汽车 | G321: 零部件制 | H321: 153.5 | I321: 2.7000000000000001e-003 | J321: -3.9000000000000003e-003 | K321: 14.54 | L321: -1.4000000000000002e-003 | M321: 121.3 | N321: 9.65 | O321: 1.9e-002 | P321: 150.67 | Q321: 转股中 | R321: 4.51年 | S321: 2.52年 | T321: 3.07 | U321: 1073. | V321: 2.2599999999999998 | W321: 6.0999999999999999e-002 | X321: 9.3000000000000013e-002 | Y321: 50 | Z321: 1.36 | AA321: -5.1900000000000002e-002 | AB321: -5.9299999999999999e-002 | AC321: -0.13400000000000001 | AD321: -0.13699999999999998 | AE321: 88.57 | AF321: 92.55 | AG321: 0.86 | AH321: AA- | AI321: 6.3399999999999998e-002 | AJ321: =H321+100*O321 -> 155.40000000000001 | AK321: 156.3 | AL321: 313 | AM321: 63.8 | AN321: 315 | AO321: -3.2000000000000001e-002 | AP321: 16 | AQ321: 常汽转债!
A322: 356 | B322: 113011 | C322: 光大转债 | D322: 601818 | E322: 光大银行 | F322: 金融 | G322: 银行行业 | H322: 118.2 | I322: 1.7000000000000001e-003 | J322: 2.7000000000000001e-003 | K322: 3.88 | L322: 7.8000000000000005e-003 | M322: 106.8 | N322: 3.76 | O322: 0.14499999999999999 | P322: 103.19 | Q322: 转股中 | R322: 1.84年 | S322: 无权 | T322: 242 | U322: 375 | V322: 1.3000000000000001e-002 | W322: 0.115 | X322: 0.11900000000000001 | Y322: 2096. | Z322: 0.59 | AA322: -5.4100000000000002e-002 | AB322: -6.0599999999999994e-002 | AC322: 无权 | AD322: 无权 | AE322: 无权 | AF322: 100.22 | AG322: 0.56 | AH322: AAA | AI322: 3.5499999999999997e-002 | AJ322: =H322+100*O322 -> 132.69999999999999 | AK322: 133.2 | AL322: 204 | AM322: 33 | AN322: 130 | AO322: 6.0000000000000001e-003 | AP322: 14 | AQ322: 光大转债
A323: 88 | B323: 127023 | C323: 华菱转2 | D323: 932 | E323: 华菱钢铁 | F323: 钢铁 | G323: 炼钢 | H323: 151 | I323: -5.45e-002 | J323: 8.5000000000000006e-003 | K323: 7.49 | L323: -5.1900000000000002e-002 | M323: 110.1 | N323: 4.97 | O323: 2.e-003 | P323: 150.7 | Q323: 转股中 | R323: 5.44年 | S323: 4.44年 | T323: 21.7 | U323: 410 | V323: 0.124 | W323: 4.7e-002 | X323: 7.0999999999999994e-002 | Y323: 459 | Z323: 1.31 | AA323: -5.7099999999999998e-002 | AB323: -6.0199999999999997e-002 | AC323: -7.7600000000000002e-002 | AD323: -7.9199999999999993e-002 | AE323: 87.76 | AF323: 89.74 | AG323: 0.88 | AH323: AAA | AI323: 3.8900000000000004e-002 | AJ323: =H323+100*O323 -> 151.19999999999999 | AK323: 151.3 | AL323: 301 | AM323: 61.6 | AN323: 303 | AO323: -8.3000000000000004e-002 | AP323: 12 | AQ323: 华菱转2
A324: 19 | B324: 127029 | C324: 中钢转债 | D324: 928 | E324: 中钢国际 | F324: 建筑 | G324: 建筑工程 | H324: 167.955 | I324: 5.7999999999999996e-003 | J324: -1.38e-002 | K324: 11.71 | L324: -8.5000000000000006e-003 | M324: 117.5 | N324: 5.89 | O324: -0.155 | P324: 198.81 | Q324: 4月16天 | R324: 5.84年 | S324: 3.85年 | T324: 9.6 | U324: 3048. | V324: 1.8200000000000001 | W324: 6.5000000000000002e-002 | X324: 0.13 | Y324: 147 | Z324: 2.56 | AA324: -5.9999999999999998e-002 | AB324: -6.480000000000001e-002 | AC324: -0.11 | AD324: -0.11199999999999999 | AE324: 87.44 | AF324: 92.74 | AG324: 0.95 | AH324: AA+ | AI324: 4.1900000000000007e-002 | AJ324: =H324+100*O324 -> 152.45500000000001 | AK324: 137.1 | AL324: 240 | AM324: 44.4 | AN324: 226 | AO324: 0.214 | AP324: 6 | AQ324: 中钢转债
A325: 180 | B325: 113034 | C325: 滨化转债! | D325: 601678 | E325: 滨化股份 | F325: 化工 | G325: 化工 | H325: 155.18 | I325: -4.4000000000000003e-003 | J325: -8.8999999999999999e-003 | K325: 7.27 | L325: -1.49e-002 | M325: 114.8 | N325: 4.68 | O325: -1.e-003 | P325: 155.34 | Q325: 转股中 | R325: 4.90年 | S325: 2.91年 | T325: 7.26 | U325: 208 | V325: 0.18600000000000003 | W325: 5.2999999999999999e-002 | X325: 8.199999999999999e-002 | Y325: 138 | Z325: 1.59 | AA325: -6.0499999999999998e-002 | AB325: -6.54e-002 | AC325: -0.12300000000000001 | AD325: -0.124 | AE325: 91.01 | AF325: 93.99 | AG325: 0.89 | AH325: AA | AI325: 4.24e-002 | AJ325: =H325+100*O325 -> 155.08000000000001 | AK325: 155 | AL325: 311 | AM325: 61 | AN325: 299 | AO325: 0.13800000000000001 | AP325: 26 | AQ325: 滨化转债!
A326: 205 | B326: 128097 | C326: 奥佳转债! | D326: 2614 | E326: 奥佳华 | F326: 机械装备 | G326: 专用设备 | H326: 154.69 | I326: 2.3099999999999999e-002 | J326: 2.0000000000000001e-004 | K326: 16.12 | L326: 2.6099999999999998e-002 | M326: 114.9 | N326: 10.39 | O326: -3.0000000000000001e-003 | P326: 155.15 | Q326: 转股中 | R326: 4.78年 | S326: 2.79年 | T326: 5.08 | U326: 62 | V326: 7.9000000000000001e-002 | W326: 5.0000000000000003e-002 | X326: 7.8e-002 | Y326: 101 | Z326: 2.2 | AA326: -6.13e-002 | AB326: -6.6299999999999998e-002 | AC326: -0.126 | AD326: -0.128 | AE326: 91.57 | AF326: 94.56 | AG326: 0.89 | AH326: AA | AI326: 4.24e-002 | AJ326: =H326+100*O326 -> 154.38999999999999 | AK326: 154.2 | AL326: 308 | AM326: 59.7 | AN326: 294 | AO326: -4.4999999999999998e-002 | AP326: 22 | AQ326: 奥佳转债!
A327: 201 | B327: 110066 | C327: 盛屯转债!! | D327: 600711 | E327: 盛屯矿业 | F327: 有色金属 | G327: 有色行业 | H327: 156.94 | I327: 8.8000000000000005e-003 | J327: -4.0000000000000001e-003 | K327: 7.44 | L327: 5.4000000000000003e-003 | M327: 114.9 | N327: 4.88 | O327: 2.8999999999999998e-002 | P327: 152.46 | Q327: 转股中 | R327: 4.80年 | S327: 2.80年 | T327: 5.23 | U327: 211 | V327: 0.25900000000000001 | W327: 2.6000000000000002e-002 | X327: 4.0000000000000001e-002 | Y327: 199 | Z327: 1.78 | AA327: -6.3899999999999998e-002 | AB327: -6.8900000000000003e-002 | AC327: -0.13 | AD327: -0.13200000000000001 | AE327: 91.51 | AF327: 94.5 | AG327: 0.88 | AH327: AA | AI327: 4.24e-002 | AJ327: =H327+100*O327 -> 159.84 | AK327: 161.4 | AL327: 321 | AM327: 66.9 | AN327: 320 | AO327: 3.7999999999999999e-002 | AP327: 36 | AQ327: 盛屯转债!!
A328: 199 | B328: 123043 | C328: 正元转债 | D328: 300645 | E328: 正元智慧 | F328: 计算机及 | G328: 软件开发 | H328: 166.095 | I328: -5.6100000000000004e-002 | J328: 8.4199999999999997e-002 | K328: 17.03 | L328: 3.9699999999999999e-002 | M328: 120.9 | N328: 15.41 | O328: 0.503 | P328: 110.51 | Q328: 转股中 | R328: 4.81年 | S328: 2.81年 | T328: 1.66 | U328: 2711. | V328: 9.3499999999999996 | W328: 7.6999999999999999e-002 | X328: 8.5000000000000006e-002 | Y328: 22 | Z328: 3.37 | AA328: -6.5099999999999991e-002 | AB328: -7.1800000000000003e-002 | AC328: -0.14400000000000002 | AD328: -0.14599999999999999 | AE328: 84.25 | AF328: 86.3 | AG328: 0.71 | AH328: A+ | AI328: 7.4400000000000008e-002 | AJ328: =H328+100*O328 -> 216.39499999999998 | AK328: 221.7 | AL328: 344 | AM328: 135.4 | AN328: 344 | AO328: 7.0999999999999994e-002 | AP328: 18 | AQ328: 正元转债
A329: 186 | B329: 128103 | C329: 同德转债! | D329: 2360 | E329: 同德化工 | F329: 化工 | G329: 化工 | H329: 168.155 | I329: -2.7400000000000001e-002 | J329: 3.3700000000000001e-002 | K329: 7.94 | L329: 6.3e-003 | M329: 121.3 | N329: 5.18 | O329: 9.6999999999999989e-002 | P329: 153.28 | Q329: 转股中 | R329: 4.86年 | S329: 2.87年 | T329: 1.09 | U329: 133 | V329: 0.71999999999999997 | W329: 3.4000000000000002e-002 | X329: 5.2999999999999999e-002 | Y329: 32 | Z329: 2.47 | AA329: -6.6199999999999995e-002 | AB329: -7.2900000000000006e-002 | AC329: -0.14400000000000002 | AD329: -0.14599999999999999 | AE329: 84.01 | AF329: 86.24 | AG329: 1 | AH329: A+ | AI329: 7.4400000000000008e-002 | AJ329: =H329+100*O329 -> 177.85499999999999 | AK329: 183 | AL329: 334 | AM329: 96.8 | AN329: 334 | AO329: -6.9999999999999993e-003 | AP329: 13 | AQ329: 同德转债!
A330: 308 | B330: 123014 | C330: 凯发转债! | D330: 300407 | E330: 凯发电气 | F330: 能源电力 | G330: 电力设备 | H330: 128.2 | I330: -5.74e-002 | J330: 6.2899999999999998e-002 | K330: 6.64 | L330: 2.1499999999999998e-002 | M330: 108.5 | N330: 8.12 | O330: 0.56799999999999995 | P330: 81.77 | Q330: 转股中 | R330: 2.20年 | S330: 0.20年 | T330: 1.16 | U330: 267 | V330: 1.78 | W330: 5.7000000000000002e-002 | X330: 4.7e-002 | Y330: 20 | Z330: 1.48 | AA330: -7.3899999999999993e-002 | AB330: -8.0399999999999985e-002 | AC330: -0.60899999999999999 | AD330: -0.61499999999999999 | AE330: 98.68 | AF330: 93.22 | AG330: 0.26 | AH330: A+ | AI330: 7.2499999999999995e-002 | AJ330: =H330+100*O330 -> 185. | AK330: 174.6 | AL330: 330 | AM330: 75.9 | AN330: 324 | AO330: -3.7999999999999999e-002 | AP330: 17 | AQ330: 凯发转债!
A331: 292 | B331: 113527 | C331: 维格转债! | D331: 603518 | E331: 锦泓集团 | F331: 服装纺织 | G331: 服装行业 | H331: 162.39 | I331: 1.7399999999999999e-002 | J331: -1.46e-002 | K331: 16.15 | L331: 3.0999999999999999e-003 | M331: 119.5 | N331: 9.85 | O331: -1.e-002 | P331: 163.96 | Q331: 转股中 | R331: 3.70年 | S331: 1.70年 | T331: 6.23 | U331: 2137. | V331: 2.0699999999999998 | W331: 0.153 | X331: 0.251 | Y331: 41 | Z331: 2.13 | AA331: -8.0799999999999997e-002 | AB331: -8.8900000000000007e-002 | AC331: -0.17800000000000002 | AD331: -0.17899999999999999 | AE331: 93.56 | AF331: 99.27 | AG331: 0.9 | AH331: AA | AI331: 5.2400000000000002e-002 | AJ331: =H331+100*O331 -> 161.38999999999999 | AK331: 160.8 | AL331: 317 | AM331: 61.5 | AN331: 302 | AO331: 0.748 | AP331: 95 | AQ331: 维格转债!
A332: 267 | B332: 113025 | C332: 明泰转债!! | D332: 601677 | E332: XD明泰铝 | F332: 有色金属 | G332: 铝金属 | H332: 160.76 | I332: 7.3000000000000001e-003 | J332: -7.3000000000000001e-003 | K332: 17.66 | L332: 0. | M332: 114.5 | N332: 11 | O332: 1.e-003 | P332: 160.55 | Q332: 转股中 | R332: 3.90年 | S332: 1.91年 | T332: 11 | U332: 115 | V332: 6.4000000000000001e-002 | W332: 9.0999999999999998e-002 | X332: 0.14699999999999999 | Y332: 120 | Z332: 1.34 | AA332: -8.4499999999999992e-002 | AB332: -9.0299999999999991e-002 | AC332: -0.153 | AD332: -0.154 | AE332: 94.4 | AF332: 97.65 | AG332: 0.92 | AH332: AA | AI332: 4.24e-002 | AJ332: =H332+100*O332 -> 160.85999999999999 | AK332: 161 | AL332: 318 | AM332: 63.3 | AN332: 314 | AO332: -6.4000000000000001e-002 | AP332: 26 | AQ332: 明泰转债!!
A333: 327 | B333: 113504 | C333: 艾华转债!! | D333: 603989 | E333: 艾华集团 | F333: 电子 | G333: 元器件制 | H333: 140.23 | I333: 8.8999999999999999e-003 | J333: 2.3199999999999998e-002 | K333: 29.38 | L333: 3.6000000000000004e-002 | M333: 109.3 | N333: 21.13 | O333: 9.0000000000000011e-003 | P333: 139.04 | Q333: 转股中 | R333: 2.80年 | S333: 0.80年 | T333: 4.95 | U333: 18 | V333: 2.6000000000000002e-002 | W333: 4.2000000000000003e-002 | X333: 5.9000000000000004e-002 | Y333: 117 | Z333: 4.36 | AA333: -8.6400000000000005e-002 | AB333: -9.1799999999999993e-002 | AC333: -0.28499999999999998 | AD333: -0.28800000000000003 | AE333: 97.98 | AF333: 97.98 | AG333: 0.89 | AH333: AA | AI333: 4.0500000000000001e-002 | AJ333: =H333+100*O333 -> 141.13 | AK333: 141.4 | AL333: 260 | AM333: 43.4 | AN333: 221 | AO333: -1.3000000000000001e-002 | AP333: 9 | AQ333: 艾华转债!!
A334: 81 | B334: 113041 | C334: 紫金转债 | D334: 601899 | E334: 紫金矿业 | F334: 有色金属 | G334: 贵金属 | H334: 161.42 | I334: -4.5999999999999999e-003 | J334: 2.8999999999999998e-003 | K334: 11.06 | L334: -1.8e-003 | M334: 108 | N334: 7 | O334: 2.2000000000000002e-002 | P334: 158 | Q334: 转股中 | R334: 4.47年 | S334: 2.47年 | T334: 57.1 | U334: 383 | V334: 4.2000000000000003e-002 | W334: 2.e-002 | X334: 3.2000000000000001e-002 | Y334: 2817. | Z334: 5.25 | AA334: -8.6500000000000007e-002 | AB334: -8.9499999999999996e-002 | AC334: -0.113 | AD334: -0.114 | AE334: 92 | AF334: 91.77 | AG334: 0.92 | AH334: AAA | AI334: 3.7400000000000003e-002 | AJ334: =H334+100*O334 -> 163.61999999999998 | AK334: 164.8 | AL334: 323 | AM334: 72.8 | AN334: 323 | AO334: 8.0000000000000002e-003 | AP334: 9 | AQ334: 紫金转债
A335: 243 | B335: 113545 | C335: 金能转债! | D335: 603113 | E335: 金能科技 | F335: 煤炭 | G335: 炼焦 | H335: 171.47 | I335: -3.3e-003 | J335: 2.8000000000000004e-003 | K335: 18.17 | L335: -5.9999999999999995e-004 | M335: 114.9 | N335: 10.78 | O335: 1.7000000000000001e-002 | P335: 168.55 | Q335: 转股中 | R335: 4.42年 | S335: 2.42年 | T335: 10.2 | U335: 55 | V335: 3.1e-002 | W335: 6.6000000000000003e-002 | X335: 0.11199999999999999 | Y335: 155 | Z335: 1.86 | AA335: -8.8100000000000012e-002 | AB335: -9.3299999999999994e-002 | AC335: -0.126 | AD335: -0.127 | AE335: 92.98 | AF335: 96.01 | AG335: 0.92 | AH335: AA | AI335: 4.24e-002 | AJ335: =H335+100*O335 -> 173.16999999999999 | AK335: 174.4 | AL335: 329 | AM335: 78.4 | AN335: 327 | AO335: 1.6e-002 | AP335: 18 | AQ335: 金能转债!
A336: 282 | B336: 110055 | C336: 伊力转债!! | D336: 600197 | E336: 伊力特 | F336: 食品饮料 | G336: 白酒 | H336: 163.21 | I336: 7.9000000000000008e-003 | J336: -1.8100000000000002e-002 | K336: 25.26 | L336: -1.1399999999999999e-002 | M336: 114.3 | N336: 16.81 | O336: 8.5999999999999993e-002 | P336: 150.27 | Q336: 转股中 | R336: 3.83年 | S336: 1.84年 | T336: 2.54 | U336: 1170. | V336: 2.8300000000000001 | W336: 2.1000000000000001e-002 | X336: 3.2000000000000001e-002 | Y336: 119 | Z336: 3.32 | AA336: -9.01e-002 | AB336: -9.5899999999999999e-002 | AC336: -0.16399999999999998 | AD336: -0.16600000000000001 | AE336: 94.65 | AF336: 97.76 | AG336: 0.9 | AH336: AA | AI336: 4.24e-002 | AJ336: =H336+100*O336 -> 171.81 | AK336: 176.2 | AL336: 331 | AM336: 78.4 | AN336: 328 | AO336: -3.0000000000000001e-003 | AP336: 24 | AQ336: 伊力转债!!
A337: 189 | B337: 123046 | C337: 天铁转债! | D337: 300587 | E337: 天铁股份 | F337: 铁路 | G337: 铁路设备 | H337: 188.527 | I337: 3.7699999999999997e-002 | J337: 1.04e-002 | K337: 17.29 | L337: 5.2300000000000006e-002 | M337: 117.7 | N337: 10.12 | O337: 0.10300000000000001 | P337: 170.85 | Q337: 转股中 | R337: 4.84年 | S337: 2.85年 | T337: 0.77 | U337: 3167. | V337: 20.100000000000001 | W337: 1.3000000000000001e-002 | X337: 2.2000000000000002e-002 | Y337: 59 | Z337: 3.63 | AA337: -9.4200000000000006e-002 | AB337: -9.9700000000000011e-002 | AC337: -0.115 | AD337: -0.11599999999999999 | AE337: 86.25 | AF337: 87.93 | AG337: 0.92 | AH337: AA- | AI337: 6.3399999999999998e-002 | AJ337: =H337+100*O337 -> 198.827 | AK337: 206.2 | AL337: 338 | AM337: 118.3 | AN337: 342 | AO337: 4.2999999999999997e-002 | AP337: 12 | AQ337: 天铁转债!
A338: 23 | B338: 123103 | C338: 震安转债 | D338: 300767 | E338: 震安科技 | F338: 化工 | G338: 橡胶塑料 | H338: 216 | I338: 0.29399999999999998 | J338: -0.113 | K338: 132.32 | L338: 0.20000000000000001 | M338: 121.4 | N338: 79.87 | O338: 0.30399999999999999 | P338: 165.67 | Q338: 4月9天 | R338: 5.82年 | S338: 3.83年 | T338: 2.85 | U338: 4427. | V338: 7.7300000000000004 | W338: 1.4999999999999999e-002 | X338: 2.5000000000000001e-002 | Y338: 191 | Z338: 16.73 | AA338: -9.5799999999999996e-002 | AB338: -0.10099999999999999 | AC338: -0.157 | AD338: -0.158 | AE338: 78.34 | AF338: 80.05 | AG338: 0.9 | AH338: A+ | AI338: 7.5899999999999995e-002 | AJ338: =H338+100*O338 -> 246.40000000000001 | AK338: 266.3 | AL338: 348 | AM338: 186.3 | AN338: 348 | AO338: 0.51300000000000001 | AP338: 2 | AQ338: 震安转债
A339: 291 | B339: 128053 | C339: 尚荣转债! | D339: 2551 | E339: 尚荣医疗 | F339: 医药 | G339: 医疗器械 | H339: 167.99 | I339: -1.7600000000000001e-002 | J339: -1.03e-002 | K339: 6.28 | L339: -2.7900000000000001e-002 | M339: 114.3 | N339: 4.89 | O339: 0.308 | P339: 128.43 | Q339: 转股中 | R339: 3.76年 | S339: 1.76年 | T339: 1.91 | U339: 2134. | V339: 6.4500000000000002 | W339: 3.7000000000000005e-002 | X339: 4.8000000000000001e-002 | Y339: 52 | Z339: 1.68 | AA339: -9.8900000000000002e-002 | AB339: -0.105 | AC339: -0.18100000000000002 | AD339: -0.183 | AE339: 94.97 | AF339: 98.07 | AG339: 1 | AH339: AA | AI339: 4.24e-002 | AJ339: =H339+100*O339 -> 198.79000000000002 | AK339: 207.6 | AL339: 339 | AM339: 109.5 | AN339: 336 | AO339: 5.5e-002 | AP339: 27 | AQ339: 尚荣转债!
A340: 355 | B340: 113012 | C340: 骆驼转债! | D340: 601311 | E340: 骆驼股份 | F340: 汽车 | G340: 零部件制 | H340: 129.84 | I340: 3.3e-003 | J340: -9.3999999999999986e-003 | K340: 12.67 | L340: -7.0999999999999995e-003 | M340: 106.5 | N340: 10.06 | O340: 3.1e-002 | P340: 125.94 | Q340: 转股中 | R340: 1.86年 | S340: 回售内 | T340: 5.09 | U340: 47 | V340: 7.0000000000000007e-002 | W340: 3.6000000000000004e-002 | X340: 4.4999999999999998e-002 | Y340: 142 | Z340: 1.88 | AA340: -0.10199999999999999 | AB340: -0.10800000000000001 | AC340: 回售内 | AD340: 回售内 | AE340: 100.25 | AF340: 98.97 | AG340: 0.86 | AH340: AA | AI340: 4.0500000000000001e-002 | AJ340: =H340+100*O340 -> 132.94 | AK340: 133.7 | AL340: 207 | AM340: 33.5 | AN340: 134 | AO340: 7.2999999999999995e-002 | AP340: 16 | AQ340: 骆驼转债!
A341: 233 | B341: 123034 | C341: 通光转债! | D341: 300265 | E341: 通光线缆 | F341: 通信互联 | G341: 通信设备 | H341: 192.35 | I341: 1.8e-003 | J341: 1.9900000000000001e-002 | K341: 8.85 | L341: 3.0299999999999997e-002 | M341: 118 | N341: 7.97 | O341: 0.73199999999999998 | P341: 111.04 | Q341: 转股中 | R341: 4.47年 | S341: 2.48年 | T341: 0.78 | U341: 1167. | V341: 7.2000000000000002 | W341: 2.4e-002 | X341: 2.7000000000000003e-002 | Y341: 32 | Z341: 2.48 | AA341: -0.105 | AB341: -0.111 | AC341: -0.14300000000000002 | AD341: -0.14400000000000002 | AE341: 85.8 | AF341: 86.19 | AG341: 0.72 | AH341: A+ | AI341: 7.4400000000000008e-002 | AJ341: =H341+100*O341 -> 265.55000000000001 | AK341: 273.7 | AL341: 349 | AM341: 187.5 | AN341: 349 | AO341: 3.4000000000000002e-002 | AP341: 23 | AQ341: 通光转债!
A342: 248 | B342: 123030 | C342: 九洲转债! | D342: 300040 | E342: 九洲集团 | F342: 能源电力 | G342: 电力设备 | H342: 191.5 | I342: 1.8600000000000002e-002 | J342: 1.67e-002 | K342: 8.69 | L342: 4.07e-002 | M342: 120 | N342: 5.65 | O342: 0.245 | P342: 153.81 | Q342: 转股中 | R342: 4.27年 | S342: 2.27年 | T342: 0.97 | U342: 1718. | V342: 8.9199999999999999 | W342: 2.8999999999999998e-002 | X342: 4.4999999999999998e-002 | Y342: 33 | Z342: 1.48 | AA342: -0.106 | AB342: -0.11199999999999999 | AC342: -0.159 | AD342: -0.16 | AE342: 89.27 | AF342: 92.85 | AG342: 0.87 | AH342: AA- | AI342: 6.3399999999999998e-002 | AJ342: =H342+100*O342 -> 216. | AK342: 229.2 | AL342: 345 | AM342: 136.3 | AN342: 345 | AO342: 8.5999999999999993e-002 | AP342: 26 | AQ342: 九洲转债!
A343: 206 | B343: 128095 | C343: 恩捷转债!! | D343: 2812 | E343: 恩捷股份 | F343: 电子 | G343: 元器件制 | H343: 195 | I343: 6.8999999999999999e-003 | J343: -2.3e-003 | K343: 126.73 | L343: 4.7999999999999996e-003 | M343: 114.9 | N343: 64.92 | O343: -1.e-003 | P343: 195.21 | Q343: 转股中 | R343: 4.75年 | S343: 2.75年 | T343: 6.85 | U343: 96 | V343: 7.2000000000000008e-002 | W343: 6.0000000000000001e-003 | X343: 1.2e-002 | Y343: 1126. | Z343: 9.76 | AA343: -0.107 | AB343: -0.11199999999999999 | AC343: -0.126 | AD343: -0.127 | AE343: 91.72 | AF343: 94.71 | AG343: 0.96 | AH343: AA | AI343: 4.24e-002 | AJ343: =H343+100*O343 -> 194.90000000000001 | AK343: 194.8 | AL343: 335 | AM343: 100.1 | AN343: 335 | AO343: 8.0000000000000002e-003 | AP343: 16 | AQ343: 恩捷转债!!
A344: 157 | B344: 128111 | C344: 中矿转债! | D344: 2738 | E344: 中矿资源 | F344: 有色金属 | G344: 有色行业 | H344: 219.469 | I344: 2.6000000000000002e-002 | J344: -2.e-002 | K344: 31.97 | L344: 6.3e-003 | M344: 124.7 | N344: 15.47 | O344: 6.2e-002 | P344: 206.66 | Q344: 转股中 | R344: 5年27天 | S344: 3年28天 | T344: 1.72 | U344: 642 | V344: 1.6899999999999999 | W344: 1.7000000000000001e-002 | X344: 3.5000000000000003e-002 | Y344: 103 | Z344: 3.01 | AA344: -0.107 | AB344: -0.114 | AC344: -0.121 | AD344: -0.122 | AE344: 85.57 | AF344: 91.37 | AG344: 0.95 | AH344: AA- | AI344: 6.4899999999999999e-002 | AJ344: =H344+100*O344 -> 225.66899999999998 | AK344: 232.3 | AL344: 346 | AM344: 140.9 | AN344: 346 | AO344: 7.2999999999999995e-002 | AP344: 8 | AQ344: 中矿转债!
A345: 332 | B345: 128033 | C345: 迪龙转债! | D345: 2658 | E345: 雪迪龙 | F345: 城市公用 | G345: 三废处理 | H345: 148.5 | I345: 6.0100000000000001e-002 | J345: -3.0600000000000002e-002 | K345: 10.44 | L345: 3.9800000000000002e-002 | M345: 108.8 | N345: 8.83 | O345: 0.25600000000000001 | P345: 118.23 | Q345: 转股中 | R345: 2.62年 | S345: 0.62年 | T345: 2.98 | U345: 4245. | V345: 9.2799999999999994 | W345: 4.4999999999999998e-002 | X345: 5.4000000000000006e-002 | Y345: 66 | Z345: 2.76 | AA345: -0.113 | AB345: -0.11900000000000001 | AC345: -0.41100000000000003 | AD345: -0.41299999999999998 | AE345: 98.43 | AF345: 98.2 | AG345: 0.74 | AH345: AA | AI345: 4.0500000000000001e-002 | AJ345: =H345+100*O345 -> 174.09999999999999 | AK345: 178.8 | AL345: 332 | AM345: 80.3 | AN345: 331 | AO345: 9.4e-002 | AP345: 38 | AQ345: 迪龙转债!
A346: 349 | B346: 128017 | C346: 金禾转债!! | D346: 2597 | E346: 金禾实业 | F346: 化工 | G346: 化工 | H346: 151.9 | I346: 3.8900000000000004e-002 | J346: 1.7500000000000002e-002 | K346: 32.68 | L346: 6.1699999999999998e-002 | M346: 108.8 | N346: 22.42 | O346: 4.2000000000000003e-002 | P346: 145.76 | Q346: 转股中 | R346: 2.47年 | S346: 0.47年 | T346: 5.52 | U346: 306 | V346: 0.36299999999999999 | W346: 2.9999999999999999e-002 | X346: 4.4000000000000004e-002 | Y346: 183 | Z346: 3.65 | AA346: -0.128 | AB346: -0.13400000000000001 | AC346: -0.54299999999999993 | AD346: -0.54600000000000004 | AE346: 99.03 | AF346: 98.8 | AG346: 0.91 | AH346: AA | AI346: 4.0500000000000001e-002 | AJ346: =H346+100*O346 -> 156.09999999999999 | AK346: 158 | AL346: 315 | AM346: 59 | AN346: 293 | AO346: -1.e-003 | AP346: 10 | AQ346: 金禾转债!!
A347: 252 | B347: 113543 | C347: 欧派转债! | D347: 603833 | E347: 欧派家居 | F347: 其他 | G347: 家居用品 | H347: 208.67 | I347: 1.32e-002 | J347: -7.3000000000000001e-003 | K347: 148.05 | L347: 6.0000000000000001e-003 | M347: 114.9 | N347: 71.69 | O347: 1.e-002 | P347: 206.51 | Q347: 转股中 | R347: 4.25年 | S347: 3.26年 | T347: 3.51 | U347: 109 | V347: 0.14899999999999999 | W347: 4.0000000000000001e-003 | X347: 8.0000000000000002e-003 | Y347: 892 | Z347: 7.36 | AA347: -0.13300000000000001 | AB347: -0.13800000000000001 | AC347: -0.105 | AD347: -0.106 | AE347: 91.51 | AF347: 96.66 | AG347: 0.97 | AH347: AA | AI347: 4.24e-002 | AJ347: =H347+100*O347 -> 209.66999999999999 | AK347: 210.8 | AL347: 340 | AM347: 114.2 | AN347: 339 | AO347: -5.2000000000000005e-002 | AP347: 14 | AQ347: 欧派转债!
A348: 167 | B348: 113582 | C348: 火炬转债! | D348: 603678 | E348: 火炬电子 | F348: 电子 | G348: 元器件制 | H348: 237.51 | I348: 2.6000000000000002e-002 | J348: 1.2e-002 | K348: 55.36 | L348: 3.9199999999999999e-002 | M348: 115.3 | N348: 25.33 | O348: 8.6999999999999994e-002 | P348: 218.56 | Q348: 转股中 | R348: 5年12天 | S348: 3年13天 | T348: 4.18 | U348: 85 | V348: 8.5999999999999993e-002 | W348: 1.6e-002 | X348: 3.6000000000000004e-002 | Y348: 255 | Z348: 6.26 | AA348: -0.13600000000000001 | AB348: -0.14000000000000001 | AC348: -0.13300000000000001 | AD348: -0.13400000000000001 | AE348: 90.61 | AF348: 93.32 | AG348: 0.97 | AH348: AA | AI348: 4.3899999999999995e-002 | AJ348: =H348+100*O348 -> 246.20999999999998 | AK348: 256.5 | AL348: 347 | AM348: 163.1 | AN348: 347 | AO348: -1.8000000000000002e-002 | AP348: 5 | AQ348: 火炬转债!
A349: 169 | B349: 113580 | C349: 康隆转债! | D349: 603665 | E349: 康隆达 | F349: 服装纺织 | G349: 服装行业 | H349: 283.53 | I349: -2.2499999999999999e-002 | J349: 1.9e-002 | K349: 15.37 | L349: -5.7999999999999996e-003 | M349: 120.8 | N349: 15.51 | O349: 1.8600000000000001 | P349: 99.1 | Q349: 转股中 | R349: 4.94年 | S349: 2.94年 | T349: 0.41 | U349: 156 | V349: 1.3400000000000001 | W349: 1.7000000000000001e-002 | X349: 1.7000000000000001e-002 | Y349: 24 | Z349: 2.23 | AA349: -0.161 | AB349: -0.16600000000000001 | AC349: -0.158 | AD349: -0.158 | AE349: 85.83 | AF349: 89.73 | AG349: 0.61 | AH349: AA- | AI349: 6.3399999999999998e-002 | AJ349: =H349+100*O349 -> 469.52999999999997 | AK349: 468 | AL349: 358 | AM349: 378.2 | AN349: 358 | AO349: -2.6000000000000002e-002 | AP349: 9 | AQ349: 康隆转债!
A350: 320 | B350: 113509 | C350: 新泉转债!! | D350: 603179 | E350: 新泉股份 | F350: 汽车 | G350: 零部件制 | H350: 197.99 | I350: -5.3e-003 | J350: -5.4000000000000003e-003 | K350: 27.75 | L350: -1.1000000000000001e-002 | M350: 110.3 | N350: 15.25 | O350: 8.8000000000000009e-002 | P350: 181.97 | Q350: 转股中 | R350: 3年20天 | S350: 1年21天 | T350: 0.84 | U350: 298 | V350: 1.77 | W350: 8.0000000000000002e-003 | X350: 1.4999999999999999e-002 | Y350: 103 | Z350: 2.89 | AA350: -0.17699999999999999 | AB350: -0.182 | AC350: -0.38600000000000001 | AD350: -0.38700000000000001 | AE350: 97.76 | AF350: 97.45 | AG350: 0.96 | AH350: AA | AI350: 4.24e-002 | AJ350: =H350+100*O350 -> 206.79000000000002 | AK350: 214 | AL350: 343 | AM350: 116.3 | AN350: 340 | AO350: -5.7000000000000002e-002 | AP350: 11 | AQ350: 新泉转债!!
A351: 294 | B351: 123018 | C351: 溢利转债! | D351: 300381 | E351: 溢多利 | F351: 医药 | G351: 原料药 | H351: 228 | I351: 2.06e-002 | J351: -1.83e-002 | K351: 9.36 | L351: 3.2000000000000002e-003 | M351: 114.3 | N351: 8.32 | O351: 1.03 | P351: 112.5 | Q351: 转股中 | R351: 3.60年 | S351: 1.60年 | T351: 0.54 | U351: 397 | V351: 3.25 | W351: 1.2e-002 | X351: 1.3000000000000001e-002 | Y351: 46 | Z351: 1.53 | AA351: -0.17699999999999999 | AB351: -0.182 | AC351: -0.28600000000000003 | AD351: -0.28699999999999998 | AE351: 92.29 | AF351: 92 | AG351: 0.7 | AH351: AA- | AI351: 6.3399999999999998e-002 | AJ351: =H351+100*O351 -> 331. | AK351: 343.5 | AL351: 352 | AM351: 251.2 | AN351: 352 | AO351: 2.e-003 | AP351: 12 | AQ351: 溢利转债!
A352: 246 | B352: 123031 | C352: 晶瑞转债! | D352: 300655 | E352: 晶瑞股份 | F352: 化工 | G352: 化工 | H352: 263.483 | I352: -4.99e-002 | J352: 5.96e-002 | K352: 21.11 | L352: 1.e-002 | M352: 115.8 | N352: 10.13 | O352: 0.26400000000000001 | P352: 208.39 | Q352: 转股中 | R352: 4.29年 | S352: 2.29年 | T352: 0.63 | U352: 688 | V352: 4.0800000000000001 | W352: 9.0000000000000011e-003 | X352: 1.8000000000000002e-002 | Y352: 72 | Z352: 3 | AA352: -0.17699999999999999 | AB352: -0.182 | AC352: -0.20899999999999999 | AD352: -0.20999999999999999 | AE352: 86.74 | AF352: 85.66 | AG352: 0.96 | AH352: A+ | AI352: 7.4400000000000008e-002 | AJ352: =H352+100*O352 -> 289.88299999999998 | AK352: 318.6 | AL352: 351 | AM352: 231.8 | AN352: 351 | AO352: -0.32200000000000001 | AP352: 16 | AQ352: 晶瑞转债!
A353: 306 | B353: 123015 | C353: 蓝盾转债!! | D353: 300297 | E353: 蓝盾股份 | F353: 计算机及 | G353: 软件开发 | H353: 245.2 | I353: -2.5399999999999999e-002 | J353: 2.5399999999999999e-002 | K353: 3.56 | L353: -8.3999999999999995e-003 | M353: 112.3 | N353: 5.79 | O353: 2.9900000000000002 | P353: 61.49 | Q353: 转股中 | R353: 3.25年 | S353: 1.25年 | T353: 1 | U353: 1575. | V353: 6.2300000000000004 | W353: 2.2000000000000002e-002 | X353: 1.3999999999999999e-002 | Y353: 44 | Z353: 1.7 | AA353: -0.217 | AB353: -0.222 | AC353: -0.39399999999999996 | AD353: -0.39500000000000002 | AE353: 94.31 | AF353: 92.39 | AG353: 0 | AH353: AA- | AI353: 6.3399999999999998e-002 | AJ353: =H353+100*O353 -> 544.20000000000005 | AK353: 428.9 | AL353: 355 | AM353: 334.6 | AN353: 355 | AO353: -2.6000000000000002e-002 | AP353: 18 | AQ353: 蓝盾转债!!
A354: 353 | B354: 127004 | C354: 模塑转债!! | D354: 700 | E354: 模塑科技 | F354: 汽车 | G354: 零部件制 | H354: 187.8 | I354: -0.13100000000000001 | J354: 0.129 | K354: 5.68 | L354: -2.2400000000000003e-002 | M354: 113.3 | N354: 7.46 | O354: 1.47 | P354: 76.14 | Q354: 转股中 | R354: 2年19天 | S354: 19天 | T354: 1.32 | U354: 1878. | V354: 7.25 | W354: 2.5000000000000001e-002 | X354: 1.9e-002 | Y354: 52 | Z354: 1.87 | AA354: -0.222 | AB354: -0.23000000000000001 | AC354: -2.2730000000000001 | AD354: -2.2799999999999998 | AE354: 100.93 | AF354: 101.15 | AG354: 0.07 | AH354: AA | AI354: 4.0500000000000001e-002 | AJ354: =H354+100*O354 -> 334.80000000000001 | AK354: 299.5 | AL354: 350 | AM354: 198.3 | AN354: 350 | AO354: 9.9000000000000005e-002 | AP354: 33 | AQ354: 模塑转债!!
A355: 293 | B355: 113526 | C355: 联泰转债! | D355: 603797 | E355: 联泰环保 | F355: 城市公用 | G355: 三废处理 | H355: 289.99 | I355: -2.3999999999999998e-003 | J355: 1.06e-002 | K355: 7.65 | L355: 1.06e-002 | M355: 110.3 | N355: 6.11 | O355: 1.3200000000000001 | P355: 125.2 | Q355: 转股中 | R355: 3.70年 | S355: 1.70年 | T355: 1.93 | U355: 529 | V355: 0.90200000000000002 | W355: 5.5999999999999994e-002 | X355: 7.0000000000000007e-002 | Y355: 34 | Z355: 2.02 | AA355: -0.23300000000000001 | AB355: -0.23600000000000002 | AC355: -0.316 | AD355: -0.317 | AE355: 95.54 | AF355: 95.55 | AG355: 0.78 | AH355: AA+ | AI355: 4.0399999999999998e-002 | AJ355: =H355+100*O355 -> 421.99000000000001 | AK355: 454.8 | AL355: 357 | AM355: 359.2 | AN355: 357 | AO355: -6.0000000000000001e-003 | AP355: 9 | AQ355: 联泰转债!
A356: 317 | B356: 110044 | C356: 广电转债!! | D356: 600831 | E356: 广电网络 | F356: 传媒娱乐 | G356: 影视娱乐 | H356: 264.09 | I356: -6.2800000000000009e-002 | J356: 7.2000000000000008e-002 | K356: 6.19 | L356: 2.3099999999999999e-002 | M356: 112.3 | N356: 6.9 | O356: 1.9399999999999999 | P356: 89.71 | Q356: 转股中 | R356: 3年43天 | S356: 1年44天 | T356: 0.71 | U356: 1255. | V356: 6.3099999999999996 | W356: 1.6e-002 | X356: 1.3999999999999999e-002 | Y356: 44 | Z356: 1.18 | AA356: -0.24299999999999999 | AB356: -0.248 | AC356: -0.46200000000000002 | AD356: -0.46299999999999997 | AE356: 97.51 | AF356: 98.95 | AG356: 0.4 | AH356: AA | AI356: 4.24e-002 | AJ356: =H356+100*O356 -> 458.08999999999997 | AK356: 438.5 | AL356: 356 | AM356: 339.5 | AN356: 356 | AO356: 7.0999999999999994e-002 | AP356: 11 | AQ356: 广电转债!!
A357: 259 | B357: 123027 | C357: 蓝晓转债! | D357: 300487 | E357: 蓝晓科技 | F357: 化工 | G357: 化工 | H357: 385.536 | I357: 7.9899999999999999e-002 | J357: 1.03e-002 | K357: 54.6 | L357: 9.5899999999999999e-002 | M357: 119.5 | N357: 29.22 | O357: 1.0600000000000001 | P357: 186.86 | Q357: 转股中 | R357: 4年27天 | S357: 2年28天 | T357: 1.07 | U357: 8016. | V357: 19.219999999999999 | W357: 9.0000000000000011e-003 | X357: 1.7000000000000001e-002 | Y357: 120 | Z357: 6.5 | AA357: -0.254 | AB357: -0.25900000000000001 | AC357: -0.28399999999999997 | AD357: -0.28499999999999998 | AE357: 89.11 | AF357: 89.97 | AG357: 0.94 | AH357: A+ | AI357: 7.4400000000000008e-002 | AJ357: =H357+100*O357 -> 491.536 | AK357: 584.2 | AL357: 360 | AM357: 494.2 | AN357: 360 | AO357: 0.28000000000000003 | AP357: 20 | AQ357: 蓝晓转债!
A358: 313 | B358: 128041 | C358: 盛路转债!! | D358: 2446 | E358: 盛路通信 | F358: 通信互联 | G358: 通信设备 | H358: 295.5 | I358: -2.4900000000000002e-002 | J358: 2.69e-002 | K358: 5.99 | L358: 5.0000000000000001e-003 | M358: 114.3 | N358: 6.82 | O358: 2.3599999999999999 | P358: 87.83 | Q358: 转股中 | R358: 3.17年 | S358: 1.18年 | T358: 0.53 | U358: 177 | V358: 1.1200000000000001 | W358: 1.e-002 | X358: 9.0000000000000011e-003 | Y358: 54 | Z358: 1.77 | AA358: -0.26200000000000001 | AB358: -0.26700000000000002 | AC358: -0.46999999999999997 | AD358: -0.47100000000000003 | AE358: 97.28 | AF358: 100.48 | AG358: 0.4 | AH358: AA | AI358: 4.24e-002 | AJ358: =H358+100*O358 -> 531.5 | AK358: 503.2 | AL358: 359 | AM358: 402.7 | AN358: 359 | AO358: 1.1000000000000001e-002 | AP358: 13 | AQ358: 盛路转债!!
A359: 336 | B359: 128030 | C359: 天康转债!! | D359: 2100 | E359: 天康生物 | F359: 农业 | G359: 畜牧业 | H359: 245.099 | I359: 5.1999999999999998e-003 | J359: -4.1999999999999997e-003 | K359: 9.89 | L359: 1.e-003 | M359: 111.3 | N359: 7.85 | O359: 0.94499999999999995 | P359: 125.99 | Q359: 转股中 | R359: 2.61年 | S359: 0.61年 | T359: 0.95 | U359: 18 | V359: 7.9000000000000001e-002 | W359: 9.0000000000000011e-003 | X359: 1.1000000000000001e-002 | Y359: 106 | Z359: 1.62 | AA359: -0.26400000000000001 | AB359: -0.26899999999999996 | AC359: -0.77300000000000002 | AD359: -0.77500000000000002 | AE359: 98.73 | AF359: 100.53 | AG359: 1 | AH359: AA | AI359: 4.0500000000000001e-002 | AJ359: =H359+100*O359 -> 339.59899999999999 | AK359: 364.2 | AL359: 353 | AM359: 263.7 | AN359: 353 | AO359: -2.7999999999999997e-002 | AP359: 12 | AQ359: 天康转债!!
A360: 337 | B360: 128029 | C360: 太阳转债!! | D360: 2078 | E360: 太阳纸业 | F360: 造纸包装 | G360: 造纸行业 | H360: 196.2 | I360: 1.1299999999999999e-002 | J360: -2.6099999999999998e-002 | K360: 15.37 | L360: -1.47e-002 | M360: 107 | N360: 8.55 | O360: 9.0999999999999998e-002 | P360: 179.77 | Q360: 转股中 | R360: 1.61年 | S360: 回售内 | T360: 9.09 | U360: 75 | V360: 4.2000000000000003e-002 | W360: 2.3e-002 | X360: 4.0999999999999995e-002 | Y360: 403 | Z360: 2.36 | AA360: -0.315 | AB360: -0.32100000000000001 | AC360: 回售内 | AD360: 回售内 | AE360: 100.17 | AF360: 100.73 | AG360: 1 | AH360: AA+ | AI360: 3.85e-002 | AJ360: =H360+100*O360 -> 205.29999999999998 | AK360: 212.6 | AL360: 341 | AM360: 111.9 | AN360: 338 | AO360: -8.0000000000000002e-003 | AP360: 7 | AQ360: 太阳转债!!
A361: 310 | B361: 123013 | C361: 横河转债! | D361: 300539 | E361: 横河模具 | F361: 机械装备 | G361: 专用设备 | H361: 386.4 | I361: -2.76e-002 | J361: 3.0699999999999998e-002 | K361: 7.28 | L361: 8.3000000000000001e-003 | M361: 115.2 | N361: 9.13 | O361: 3.8500000000000001 | P361: 79.74 | Q361: 转股中 | R361: 3.20年 | S361: 1.20年 | T361: 0.38 | U361: 152 | V361: 1.01 | W361: 2.4e-002 | X361: 1.9e-002 | Y361: 16 | Z361: 3.26 | AA361: -0.32000000000000001 | AB361: -0.32400000000000001 | AC361: -0.51700000000000002 | AD361: -0.51800000000000002 | AE361: 93.82 | AF361: 92.14 | AG361: 0.37 | AH361: A+ | AI361: 7.4400000000000008e-002 | AJ361: =H361+100*O361 -> 771.39999999999998 | AK361: 693.1 | AL361: 361 | AM361: 599.2 | AN361: 361 | AO361: 4.0000000000000001e-002 | AP361: 15 | AQ361: 横河转债!
A362: 348 | B362: 113016 | C362: 小康转债!! | D362: 601127 | E362: 小康股份 | F362: 汽车 | G362: 零部件制 | H362: 378.18 | I362: 3.39e-002 | J362: -2.3300000000000001e-002 | K362: 58.32 | L362: 1.0700000000000001e-002 | M362: 109.3 | N362: 15.7 | O362: 1.8000000000000002e-002 | P362: 371.46 | Q362: 转股中 | R362: 2.48年 | S362: 0.48年 | T362: 3.22 | U362: 4557. | V362: 3.6899999999999999 | W362: 4.0000000000000001e-003 | X362: 1.6e-002 | Y362: 753 | Z362: 16.07 | AA362: -0.39700000000000002 | AB362: -0.40000000000000002 | AC362: -1.167 | AD362: -1.169 | AE362: 99.22 | AF362: 99.22 | AG362: 0.99 | AH362: AA | AI362: 4.0500000000000001e-002 | AJ362: =H362+100*O362 -> 379.98000000000002 | AK362: 384.9 | AL362: 354 | AM362: 285.7 | AN362: 354 | AO362: 0.34399999999999997 | AP362: 45 | AQ362: 小康转债!!
A363: 250 | B363: 123029 | C363: 英科转债! | D363: 300677 | E363: 英科医疗 | F363: 医药 | G363: 医疗器械 | H363: 1741.1 | I363: 1.4000000000000002e-003 | J363: -1.8e-003 | K363: 145.15 | L363: -4.0000000000000002e-004 | M363: 138.2 | N363: 8.32 | O363: -2.e-003 | P363: 1744.59 | Q363: 转股中 | R363: 4.25年 | S363: 2.26年 | T363: 0.41 | U363: 608 | V363: 0.84799999999999998 | W363: 1.e-003 | X363: 1.3999999999999999e-002 | Y363: 512 | Z363: 3.9 | AA363: -0.41499999999999998 | AB363: -0.41899999999999998 | AC363: -0.33200000000000002 | AD363: -0.33200000000000002 | AE363: 97.21 | AF363: 116.58 | AG363: 0.99 | AH363: AA | AI363: 4.24e-002 | AJ363: =H363+100*O363 -> 1740.8999999999999 | AK363: 1737.5999999999999 | AL363: 362 | AM363: 1621. | AN363: 362 | AO363: -6.6000000000000003e-002 | AP363: 17 | AQ363: 英科转债!