A1: 序号 | B1: 转债代码 | C1: 转债名称 | D1: 股票代码 | E1: 股票名称 | F1: 行业 | G1: 子行业 | H1: 转债价格 | I1: 涨跌 | J1: 日内套利 | K1: 股价 | L1: 涨跌 | M1: 剩余本息 | N1: 转股价格 | O1: 转股溢价率 | P1: 转股价值 | Q1: 距离转股日 | R1: 剩余年限 | S1: 回售年限 | T1: 转债余额 | U1: 转债成交额 | V1: 转债换手率 | W1: 余额/市值 | X1: 余额/股本 | Y1: 股票市值 | Z1: P/B | AA1: 税前收益率 | AB1: 税后收益率 | AC1: 税前回售收益 | AD1: 税后回售收益 | AE1: 回售价值 | AF1: 纯债价值 | AG1: 弹性 | AH1: 信用 | AI1: 折现率 | AJ1: 双低 | AK1: 老式双低 | AL1: 老式排名 | AM1: 新式双低 | AN1: 新式排名 | AO1: MA20乖离 | AP1: 热门度 | AQ1: 转债名称
A2: 285 | B2: 128062 | C2: 亚药转债! | D2: 2370 | E2: 亚太药业 | F2: 医药 | G2: 化学制药 | H2: 79.99 | I2: -2.0000000000000001e-004 | J2: 2.0000000000000001e-004 | K2: 4.46 | L2: 2.2000000000000001e-003 | M2: 119.3 | N2: 16.25 | O2: 1.9099999999999999 | P2: 27.45 | Q2: 转股中 | R2: 3.65年 | S2: 1.66年 | T2: 9.63 | U2: 7.5 | V2: 1.e-002 | W2: 0.40200000000000002 | X2: 0.11 | Y2: 24 | Z2: 5.53 | AA2: 0.11800000000000001 | AB2: 0.107 | AC2: 0.14899999999999999 | AD2: 0.14499999999999999 | AE2: 80.89 | AF2: 74.19 | AG2: 0 | AH2: BB | AI2: 0.1419 | AJ2: =H2+100*O2 -> 270.99000000000001 | AK2: 132.5 | AL2: 62 | AM2: 51.6 | AN2: 185 | AO2: -5.0000000000000003e-002 | AP2: 84 | AQ2: 亚药转债!
A3: 152 | B3: 113595 | C3: 花王转债! | D3: 603007 | E3: ST花王 | F3: 城市公用 | G3: 生态环境 | H3: 85.78 | I3: -1.e-003 | J3: 1.6000000000000001e-003 | K3: 3.16 | L3: 6.4000000000000003e-003 | M3: 124.8 | N3: 6.92 | O3: 0.878 | P3: 45.66 | Q3: 转股中 | R3: 4.95年 | S3: 2.96年 | T3: 3.3 | U3: 5.8 | V3: 2.e-002 | W3: 0.311 | X3: 0.14199999999999999 | Y3: 11 | Z3: 0.92 | AA3: 8.0299999999999996e-002 | AB3: 7.1099999999999997e-002 | AC3: 6.3299999999999995e-002 | AD3: 6.0700000000000004e-002 | AE3: 81.31 | AF3: 85.18 | AG3: 0.09 | AH3: A | AI3: 8.1900000000000001e-002 | AJ3: =H3+100*O3 -> 173.57999999999998 | AK3: 125.9 | AL3: 22 | AM3: 40.7 | AN3: 105 | AO3: -4.9000000000000002e-002 | AP3: 44 | AQ3: 花王转债!
A4: 196 | B4: 113576 | C4: 起步转债!! | D4: 603557 | E4: ST起步 | F4: 服装纺织 | G4: 鞋服行业 | H4: 91.9 | I4: -1.1999999999999999e-003 | J4: 0. | K4: 4.39 | L4: -2.4399999999999998e-002 | M4: 121.3 | N4: 10.55 | O4: 1.21 | P4: 41.61 | Q4: 转股中 | R4: 4.68年 | S4: 2.68年 | T4: 2.66 | U4: 2.8 | V4: 1.1000000000000001e-002 | W4: 0.122 | X4: 5.0999999999999997e-002 | Y4: 22 | Z4: 1.39 | AA4: 6.2699999999999992e-002 | AB4: 5.4199999999999998e-002 | AC4: 4.58e-002 | AD4: 4.2599999999999999e-002 | AE4: 83.53 | AF4: 84.72 | AG4: 0.05 | AH4: A | AI4: 8.1900000000000001e-002 | AJ4: =H4+100*O4 -> 212.90000000000001 | AK4: 142.2 | AL4: 167 | AM4: 57.5 | AN4: 226 | AO4: -0.11599999999999999 | AP4: 34 | AQ4: 起步转债!!
A5: 209 | B5: 128100 | C5: 搜特转债! | D5: 2503 | E5: 搜于特 | F5: 服装纺织 | G5: 服装行业 | H5: 92.37 | I5: 5.1999999999999998e-003 | J5: -6.0000000000000001e-003 | K5: 1.53 | L5: -6.5000000000000006e-003 | M5: 116.9 | N5: 2.9 | O5: 0.75099999999999989 | P5: 52.76 | Q5: 转股中 | R5: 4.60年 | S5: 2.60年 | T5: 7.99 | U5: 45 | V5: 6.0999999999999999e-002 | W5: 0.16899999999999998 | X5: 8.900000000000001e-002 | Y5: 47 | Z5: 1.41 | AA5: 5.3699999999999998e-002 | AB5: 4.6699999999999998e-002 | AC5: 4.2099999999999999e-002 | AD5: 3.95e-002 | AE5: 83.35 | AF5: 82.03 | AG5: 0.13 | AH5: A | AI5: 8.1900000000000001e-002 | AJ5: =H5+100*O5 -> 167.47 | AK5: 132 | AL5: 54 | AM5: 48.6 | AN5: 156 | AO5: -1.9e-002 | AP5: 68 | AQ5: 搜特转债!
A6: 96 | B6: 128138 | C6: 侨银转债! | D6: 2973 | E6: 侨银股份 | F6: 城市公用 | G6: 城市公用 | H6: 105.4 | I6: 3.8e-003 | J6: -7.0999999999999995e-003 | K6: 14.83 | L6: -2.3700000000000002e-002 | M6: 136.5 | N6: 25.33 | O6: 0.80000000000000004 | P6: 58.55 | Q6: 转股中 | R6: 5.28年 | S6: 3.28年 | T6: 4.2 | U6: 8.7 | V6: 2.e-002 | W6: 6.9000000000000006e-002 | X6: 4.0999999999999995e-002 | Y6: 61 | Z6: 4.02 | AA6: 5.1299999999999998e-002 | AB6: 4.0000000000000001e-002 | AC6: -2.7000000000000001e-003 | AD6: -5.1999999999999998e-003 | AE6: 85 | AF6: 99.91 | AG6: 0.14 | AH6: AA- | AI6: 6.2199999999999998e-002 | AJ6: =H6+100*O6 -> 185.40000000000001 | AK6: 152.3 | AL6: 235 | AM6: 52.3 | AN6: 189 | AO6: -3.7000000000000005e-002 | AP6: 14 | AQ6: 侨银转债!
A7: 133 | B7: 128127 | C7: 文科转债! | D7: 2775 | E7: 文科园林 | F7: 城市公用 | G7: 生态环境 | H7: 96.146 | I7: -3.0999999999999999e-003 | J7: 3.0999999999999999e-003 | K7: 4.07 | L7: 0. | M7: 121.3 | N7: 4.88 | O7: 0.153 | P7: 83.4 | Q7: 转股中 | R7: 5年13天 | S7: 3年14天 | T7: 9.5 | U7: 18 | V7: 2.e-002 | W7: 0.45500000000000002 | X7: 0.38 | Y7: 21 | Z7: 0.88 | AA7: 4.8399999999999999e-002 | AB7: 4.0599999999999997e-002 | AC7: 2.58e-002 | AD7: 2.3099999999999999e-002 | AE7: 86.13 | AF7: 90.19 | AG7: 0.48 | AH7: AA- | AI7: 6.2199999999999998e-002 | AJ7: =H7+100*O7 -> 111.446 | AK7: 108.9 | AL7: 1 | AM7: 18.7 | AN7: 3 | AO7: -4.0999999999999995e-002 | AP7: 54 | AQ7: 文科转债!
A8: 317 | B8: 128044 | C8: 岭南转债! | D8: 2717 | E8: 岭南股份 | F8: 城市公用 | G8: 生态环境 | H8: 97.223 | I8: 4.0999999999999995e-003 | J8: -4.0999999999999995e-003 | K8: 2.8 | L8: 0. | M8: 111.3 | N8: 5.91 | O8: 1.05 | P8: 47.38 | Q8: 转股中 | R8: 3年7天 | S8: 1年8天 | T8: 6.59 | U8: 9.6 | V8: 1.4999999999999999e-002 | W8: 0.154 | X8: 7.2999999999999995e-002 | Y8: 43 | Z8: 0.98 | AA8: 4.6900000000000004e-002 | AB8: 3.95e-002 | AC8: 4.8600000000000004e-002 | AD8: 4.3700000000000003e-002 | AE8: 95.9 | AF8: 93.5 | AG8: 0 | AH8: AA- | AI8: 6.0899999999999996e-002 | AJ8: =H8+100*O8 -> 202.22300000000001 | AK8: 147.1 | AL8: 206 | AM8: 51.2 | AN8: 182 | AO8: -2.7999999999999997e-002 | AP8: 49 | AQ8: 岭南转债!
A9: 135 | B9: 110072 | C9: 广汇转债! | D9: 600297 | E9: 广汇汽车 | F9: 汽车 | G9: 分销、售 | H9: 91.78 | I9: -1.6000000000000001e-003 | J9: -5.0000000000000001e-004 | K9: 2.72 | L9: -1.09e-002 | M9: 114.5 | N9: 4.03 | O9: 0.35999999999999999 | P9: 67.49 | Q9: 转股中 | R9: 5年11天 | S9: 3年12天 | T9: 33.7 | U9: 36 | V9: 1.2e-002 | W9: 0.153 | X9: 0.10300000000000001 | Y9: 221 | Z9: 0.55 | AA9: 4.5700000000000005e-002 | AB9: 4.0199999999999993e-002 | AC9: 3.7000000000000005e-002 | AD9: 3.5000000000000003e-002 | AE9: 92 | AF9: 96.02 | AG9: 0.19 | AH9: AA+ | AI9: 3.6200000000000003e-002 | AJ9: =H9+100*O9 -> 127.78 | AK9: 116.1 | AL9: 4 | AM9: 20 | AN9: 4 | AO9: -3.5000000000000003e-002 | AP9: 63 | AQ9: 广汇转债!
A10: 315 | B10: 113519 | C10: 长久转债! | D10: 603569 | E10: 长久物流 | F10: 交通运输 | G10: 物流业 | H10: 103.96 | I10: 5.9999999999999995e-004 | J10: -8.0000000000000004e-004 | K10: 6.6 | L10: -4.5000000000000005e-003 | M10: 119.3 | N10: 11.04 | O10: 0.7390000000000001 | P10: 59.78 | Q10: 转股中 | R10: 3.25年 | S10: 1.26年 | T10: 6.97 | U10: 7.3 | V10: 1.e-002 | W10: 0.188 | X10: 0.113 | Y10: 37 | Z10: 1.69 | AA10: 4.41e-002 | AB10: 3.3300000000000003e-002 | AC10: -7.9000000000000008e-003 | AD10: -1.18e-002 | AE10: 97.29 | AF10: 105.32 | AG10: 0.05 | AH10: AA | AI10: 3.9900000000000005e-002 | AJ10: =H10+100*O10 -> 177.86000000000001 | AK10: 148.1 | AL10: 213 | AM10: 42.8 | AN10: 121 | AO10: -8.0000000000000002e-003 | AP10: 21 | AQ10: 长久转债!
A11: 369 | B11: 127003 | C11: 海印转债! | D11: 861 | E11: 海印股份 | F11: 商业零售 | G11: 商场 | H11: 106.098 | I11: 4.0000000000000001e-003 | J11: -3.3e-003 | K11: 2.12 | L11: 5.9999999999999998e-002 | M11: 110 | N11: 2.99 | O11: 0.496 | P11: 70.9 | Q11: 转股中 | R11: 0.84年 | S11: 回售内 | T11: 6.74 | U11: 52 | V11: 7.2999999999999995e-002 | W11: 0.13699999999999998 | X11: 9.6999999999999989e-002 | Y11: 49 | Z11: 1.29 | AA11: 4.4000000000000004e-002 | AB11: 2.1400000000000002e-002 | AC11: 回售内 | AD11: 回售内 | AE11: 100.33 | AF11: 106.93 | AG11: 0.01 | AH11: AA | AI11: 3.4300000000000004e-002 | AJ11: =H11+100*O11 -> 155.69800000000001 | AK11: 141.3 | AL11: 154 | AM11: 34.4 | AN11: 44 | AO11: 7.8e-002 | AP11: 68 | AQ11: 海印转债!
A12: 214 | B12: 113569 | C12: 科达转债! | D12: 603660 | E12: 苏州科达 | F12: 通信互联 | G12: 物联网 | H12: 99.41 | I12: 1.1000000000000001e-003 | J12: -1.e-003 | K12: 6.74 | L12: 1.5e-003 | M12: 120.3 | N12: 14.8 | O12: 1.1799999999999999 | P12: 45.54 | Q12: 转股中 | R12: 4.59年 | S12: 2.59年 | T12: 5.16 | U12: 2.1 | V12: 4.0000000000000001e-003 | W12: 0.155 | X12: 7.0999999999999994e-002 | Y12: 33 | Z12: 1.86 | AA12: 4.3400000000000001e-002 | AB12: 3.5299999999999998e-002 | AC12: 1.54e-002 | AD12: 1.2699999999999999e-002 | AE12: 88.21 | AF12: 92.26 | AG12: 0.05 | AH12: AA- | AI12: 6.0899999999999996e-002 | AJ12: =H12+100*O12 -> 217.41 | AK12: 153.3 | AL12: 242 | AM12: 61 | AN12: 240 | AO12: -2.7999999999999997e-002 | AP12: 29 | AQ12: 科达转债!
A13: 283 | B13: 128063 | C13: 未来转债! | D13: 2631 | E13: 德尔未来 | F13: 其他 | G13: 家居用品 | H13: 109.99 | I13: 1.2800000000000001e-002 | J13: -4.3e-003 | K13: 6.85 | L13: 3.1600000000000003e-002 | M13: 127.5 | N13: 8.6 | O13: 0.38100000000000001 | P13: 79.65 | Q13: 转股中 | R13: 3.66年 | S13: 2.66年 | T13: 6.3 | U13: 20 | V13: 2.8999999999999998e-002 | W13: 0.13800000000000001 | X13: 0.11 | Y13: 46 | Z13: 2.71 | AA13: 4.2500000000000003e-002 | AB13: 2.9500000000000002e-002 | AC13: -6.0000000000000001e-003 | AD13: -1.1399999999999999e-002 | AE13: 91.88 | AF13: 103.37 | AG13: 0.27 | AH13: AA- | AI13: 6.0899999999999996e-002 | AJ13: =H13+100*O13 -> 148.09 | AK13: 140.3 | AL13: 147 | AM13: 37 | AN13: 67 | AO13: 8.3000000000000004e-002 | AP13: 31 | AQ13: 未来转债!
A14: 144 | B14: 113596 | C14: 城地转债! | D14: 603887 | E14: 城地香江 | F14: 通信互联 | G14: 通信设备 | H14: 92.61 | I14: 3.5999999999999999e-003 | J14: -3.7000000000000002e-003 | K14: 8.87 | L14: -8.8999999999999999e-003 | M14: 113.1 | N14: 24.26 | O14: 1.53 | P14: 36.56 | Q14: 转股中 | R14: 4.97年 | S14: 2.98年 | T14: 12 | U14: 15 | V14: 1.3999999999999999e-002 | W14: 0.29999999999999999 | X14: 0.11 | Y14: 40 | Z14: 0.87 | AA14: 4.1799999999999997e-002 | AB14: 3.6699999999999997e-002 | AC14: 3.61e-002 | AD14: 3.3799999999999997e-002 | AE14: 86.03 | AF14: 84.77 | AG14: 0.01 | AH14: AA- | AI14: 6.0899999999999996e-002 | AJ14: =H14+100*O14 -> 245.61000000000001 | AK14: 148.7 | AL14: 217 | AM14: 62.6 | AN14: 246 | AO14: -5.0999999999999997e-002 | AP14: 27 | AQ14: 城地转债!
A15: 136 | B15: 113600 | C15: 新星转债! | D15: 603978 | E15: 深圳新星 | F15: 有色金属 | G15: 有色行业 | H15: 103.15 | I15: -3.2000000000000002e-003 | J15: 7.6e-003 | K15: 17.66 | L15: 1.32e-002 | M15: 126 | N15: 23.85 | O15: 0.39299999999999996 | P15: 74.05 | Q15: 转股中 | R15: 5年6.5天 | S15: 3年7天 | T15: 5.95 | U15: 17 | V15: 2.7999999999999997e-002 | W15: 0.21100000000000002 | X15: 0.156 | Y15: 28 | Z15: 1.85 | AA15: 4.1599999999999998e-002 | AB15: 3.2599999999999997e-002 | AC15: 2.3999999999999998e-003 | AD15: 0. | AE15: 85.95 | AF15: 93.7 | AG15: 0.34 | AH15: AA- | AI15: 6.2199999999999998e-002 | AJ15: =H15+100*O15 -> 142.44999999999999 | AK15: 132.3 | AL15: 58 | AM15: 38.5 | AN15: 83 | AO15: -7.2000000000000008e-002 | AP15: 23 | AQ15: 新星转债!
A16: 363 | B16: 128015 | C16: 久其转债! | D16: 2279 | E16: 久其软件 | F16: 计算机及 | G16: 软件开发 | H16: 101.884 | I16: 2.3e-003 | J16: -2.3e-003 | K16: 4.67 | L16: 1.52e-002 | M16: 109.5 | N16: 6.97 | O16: 0.52100000000000002 | P16: 67 | Q16: 转股中 | R16: 1.84年 | S16: 回售内 | T16: 7.8 | U16: 16 | V16: 2.1000000000000001e-002 | W16: 0.23499999999999999 | X16: 0.157 | Y16: 33 | Z16: 3.86 | AA16: 4.0300000000000002e-002 | AB16: 3.0299999999999997e-002 | AC16: 回售内 | AD16: 回售内 | AE16: 100.25 | AF16: 96.72 | AG16: 0 | AH16: A+ | AI16: 7.0400000000000004e-002 | AJ16: =H16+100*O16 -> 153.98400000000001 | AK16: 136.8 | AL16: 107 | AM16: 36.5 | AN16: 60 | AO16: -3.3000000000000002e-002 | AP16: 66 | AQ16: 久其转债!
A17: 298 | B17: 110052 | C17: 贵广转债! | D17: 600996 | E17: 贵广网络 | F17: 传媒娱乐 | G17: 影视娱乐 | H17: 102.51 | I17: -1.9e-003 | J17: 3.0999999999999999e-003 | K17: 4.61 | L17: 3.3599999999999998e-002 | M17: 117.7 | N17: 7.94 | O17: 0.7659999999999999 | P17: 58.06 | Q17: 转股中 | R17: 3.58年 | S17: 1.58年 | T17: 15.3 | U17: 11 | V17: 6.9999999999999993e-003 | W17: 0.315 | X17: 0.183 | Y17: 48 | Z17: 1.15 | AA17: 4.0199999999999993e-002 | AB17: 3.1099999999999999e-002 | AC17: 2.8999999999999998e-003 | AD17: -5.0000000000000001e-004 | AE17: 97.1 | AF17: 104.37 | AG17: 0.04 | AH17: AA+ | AI17: 3.49e-002 | AJ17: =H17+100*O17 -> 179.11000000000001 | AK17: 147 | AL17: 205 | AM17: 42.6 | AN17: 117 | AO17: -3.9e-002 | AP17: 18 | AQ17: 贵广转债!
A18: 159 | B18: 127019 | C18: 国城转债! | D18: 688 | E18: 国城矿业 | F18: 有色金属 | G18: 锌铅镍锡 | H18: 94.87 | I18: 8.1000000000000013e-003 | J18: -6.0000000000000001e-003 | K18: 9.63 | L18: 6.1699999999999998e-002 | M18: 114.8 | N18: 21.06 | O18: 1.0700000000000001 | P18: 45.73 | Q18: 转股中 | R18: 4.94年 | S18: 2.94年 | T18: 8.5 | U18: 22 | V18: 2.7999999999999997e-002 | W18: 7.8e-002 | X18: 3.5000000000000003e-002 | Y18: 110 | Z18: 4.72 | AA18: 4.0099999999999997e-002 | AB18: 3.44e-002 | AC18: 2.7999999999999997e-002 | AD18: 2.58e-002 | AE18: 91.56 | AF18: 94.96 | AG18: 0.03 | AH18: AA | AI18: 3.9900000000000005e-002 | AJ18: =H18+100*O18 -> 201.87 | AK18: 144 | AL18: 183 | AM18: 49.1 | AN18: 165 | AO18: 2.7000000000000003e-002 | AP18: 43 | AQ18: 国城转债!
A19: 345 | B19: 113017 | C19: 吉视转债! | D19: 601929 | E19: 吉视传媒 | F19: 传媒娱乐 | G19: 影视娱乐 | H19: 99.31 | I19: -5.0000000000000001e-004 | J19: 5.0000000000000001e-004 | K19: 1.74 | L19: 0. | M19: 108.8 | N19: 2.95 | O19: 0.68400000000000005 | P19: 58.98 | Q19: 转股中 | R19: 2.39年 | S19: 0.39年 | T19: 15.6 | U19: 9.8 | V19: 6.0000000000000001e-003 | W19: 0.28800000000000003 | X19: 0.17000000000000001 | Y19: 54 | Z19: 0.82 | AA19: 3.9599999999999996e-002 | AB19: 3.2300000000000002e-002 | AC19: 4.0899999999999999e-002 | AD19: 3.5200000000000002e-002 | AE19: 99.71 | AF19: 100.71 | AG19: 0.02 | AH19: AA+ | AI19: 3.3399999999999999e-002 | AJ19: =H19+100*O19 -> 167.71000000000001 | AK19: 139.6 | AL19: 139 | AM19: 38.9 | AN19: 87 | AO19: -2.4e-002 | AP19: 66 | AQ19: 吉视转债!
A20: 169 | B20: 113589 | C20: 天创转债! | D20: 603608 | E20: 天创时尚 | F20: 服装纺织 | G20: 鞋服行业 | H20: 95.47 | I20: 2.0000000000000001e-004 | J20: -7.000000000000001e-004 | K20: 5.57 | L20: -1.7600000000000001e-002 | M20: 114.9 | N20: 12.29 | O20: 1.1100000000000001 | P20: 45.32 | Q20: 转股中 | R20: 4.88年 | S20: 2.88年 | T20: 6 | U20: 7.9 | V20: 1.3999999999999999e-002 | W20: 0.251 | X20: 0.114 | Y20: 24 | Z20: 1.47 | AA20: 3.9399999999999998e-002 | AB20: 3.3599999999999998e-002 | AC20: 2.6699999999999998e-002 | AD20: 2.4500000000000001e-002 | AE20: 91.87 | AF20: 95.27 | AG20: 0.03 | AH20: AA | AI20: 3.9900000000000005e-002 | AJ20: =H20+100*O20 -> 206.47000000000003 | AK20: 145.6 | AL20: 194 | AM20: 50.4 | AN20: 173 | AO20: -6.9000000000000006e-002 | AP20: 30 | AQ20: 天创转债!
A21: 235 | B21: 110064 | C21: 建工转债! | D21: 600939 | E21: 重庆建工 | F21: 建筑 | G21: 建筑工程 | H21: 102.15 | I21: -5.0000000000000001e-003 | J21: 2.8999999999999998e-003 | K21: 3.27 | L21: -1.21e-002 | M21: 119.8 | N21: 4.53 | O21: 0.41499999999999998 | P21: 72.19 | Q21: 转股中 | R21: 4.37年 | S21: 2.37年 | T21: 16.6 | U21: 14 | V21: 8.0000000000000002e-003 | W21: 0.28000000000000003 | X21: 0.20199999999999999 | Y21: 59 | Z21: 0.84 | AA21: 3.8100000000000002e-002 | AB21: 2.98e-002 | AC21: 7.7000000000000002e-003 | AD21: 4.5000000000000005e-003 | AE21: 95.54 | AF21: 103.5 | AG21: 0.17 | AH21: AA+ | AI21: 3.49e-002 | AJ21: =H21+100*O21 -> 143.65000000000001 | AK21: 132.1 | AL21: 55 | AM21: 28.6 | AN21: 20 | AO21: -3.6000000000000004e-002 | AP21: 45 | AQ21: 建工转债!
A22: 275 | B22: 128066 | C22: 亚泰转债! | D22: 2811 | E22: 郑中设计 | F22: 建筑 | G22: 装饰工程 | H22: 102.092 | I22: -8.0000000000000004e-004 | J22: -2.e-003 | K22: 7.55 | L22: -7.9000000000000008e-003 | M22: 116.7 | N22: 9.27 | O22: 0.254 | P22: 81.45 | Q22: 转股中 | R22: 3.69年 | S22: 1.70年 | T22: 4.8 | U22: 4.5 | V22: 9.0000000000000011e-003 | W22: 0.23499999999999999 | X22: 0.192 | Y22: 20 | Z22: 1.37 | AA22: 3.7599999999999995e-002 | AB22: 2.92e-002 | AC22: 5.0000000000000001e-003 | AD22: 1.8e-003 | AE22: 92.38 | AF22: 94.23 | AG22: 0.36 | AH22: AA- | AI22: 6.0899999999999996e-002 | AJ22: =H22+100*O22 -> 127.49199999999999 | AK22: 122.7 | AL22: 10 | AM22: 28.5 | AN22: 19 | AO22: -3.7999999999999999e-002 | AP22: 59 | AQ22: 亚泰转债!
A23: 269 | B23: 123028 | C23: 清水转债! | D23: 300437 | E23: 清水源 | F23: 城市公用 | G23: 三废处理 | H23: 105.68 | I23: 6.5000000000000006e-003 | J23: -1.46e-002 | K23: 9.28 | L23: -2.1099999999999997e-002 | M23: 121 | N23: 11.84 | O23: 0.34799999999999998 | P23: 78.38 | Q23: 转股中 | R23: 3.87年 | S23: 1.87年 | T23: 4.55 | U23: 12 | V23: 2.5000000000000001e-002 | W23: 0.222 | X23: 0.17399999999999999 | Y23: 21 | Z23: 1.85 | AA23: 3.6499999999999998e-002 | AB23: 2.6699999999999998e-002 | AC23: -8.3000000000000001e-003 | AD23: -1.2e-002 | AE23: 90.35 | AF23: 93.13 | AG23: 0.38 | AH23: A+ | AI23: 7.1900000000000006e-002 | AJ23: =H23+100*O23 -> 140.48000000000002 | AK23: 133 | AL23: 67 | AM23: 39.9 | AN23: 96 | AO23: 5.0000000000000001e-003 | AP23: 51 | AQ23: 清水转债!
A24: 164 | B24: 128117 | C24: 道恩转债! | D24: 2838 | E24: 道恩股份 | F24: 化工 | G24: 橡胶塑料 | H24: 103.6 | I24: 8.0000000000000004e-004 | J24: -4.0000000000000001e-003 | K24: 16.52 | L24: -2.1299999999999999e-002 | M24: 123.1 | N24: 28.83 | O24: 0.80799999999999994 | P24: 57.3 | Q24: 转股中 | R24: 4.90年 | S24: 2.91年 | T24: 3.6 | U24: 7.4 | V24: 2.e-002 | W24: 5.2999999999999999e-002 | X24: 3.1e-002 | Y24: 67 | Z24: 3.55 | AA24: 3.6499999999999998e-002 | AB24: 2.8199999999999999e-002 | AC24: -5.0000000000000001e-004 | AD24: -2.7000000000000001e-003 | AE24: 86.39 | AF24: 92.62 | AG24: 0.15 | AH24: AA- | AI24: 6.0899999999999996e-002 | AJ24: =H24+100*O24 -> 184.39999999999998 | AK24: 149.9 | AL24: 223 | AM24: 57.3 | AN24: 224 | AO24: 1.e-002 | AP24: 22 | AQ24: 道恩转债!
A25: 288 | B25: 113530 | C25: 大丰转债! | D25: 603081 | E25: 大丰实业 | F25: 建筑 | G25: 装饰工程 | H25: 106.65 | I25: 8.9999999999999998e-004 | J25: -6.6e-003 | K25: 12.07 | L25: -3.8199999999999998e-002 | M25: 121 | N25: 16.49 | O25: 0.45700000000000002 | P25: 73.2 | Q25: 转股中 | R25: 3.64年 | S25: 1.64年 | T25: 6.3 | U25: 16 | V25: 2.3e-002 | W25: 0.13 | X25: 9.5000000000000001e-002 | Y25: 48 | Z25: 2.18 | AA25: 3.6000000000000004e-002 | AB25: 2.5699999999999997e-002 | AC25: -1.9699999999999999e-002 | AD25: -2.2799999999999997e-002 | AE25: 95.95 | AF25: 105.25 | AG25: 0.15 | AH25: AA | AI25: 3.9900000000000005e-002 | AJ25: =H25+100*O25 -> 152.35000000000002 | AK25: 140.1 | AL25: 144 | AM25: 34.9 | AN25: 45 | AO25: 0.107 | AP25: 31 | AQ25: 大丰转债!
A26: 123 | B26: 128132 | C26: 交建转债! | D26: 2941 | E26: 新疆交建 | F26: 建筑 | G26: 建筑工程 | H26: 98.5 | I26: -5.0000000000000001e-004 | J26: 1.e-003 | K26: 9.97 | L26: 6.0999999999999995e-003 | M26: 117.3 | N26: 18.53 | O26: 0.83099999999999996 | P26: 53.8 | Q26: 转股中 | R26: 5年39天 | S26: 3年40天 | T26: 8.5 | U26: 8.6 | V26: 1.e-002 | W26: 0.13200000000000001 | X26: 7.0999999999999994e-002 | Y26: 64 | Z26: 2.65 | AA26: 3.56e-002 | AB26: 2.9300000000000003e-002 | AC26: 1.6299999999999999e-002 | AD26: 1.3999999999999999e-002 | AE26: 91.08 | AF26: 95.86 | AG26: 0.07 | AH26: AA | AI26: 4.1200000000000001e-002 | AJ26: =H26+100*O26 -> 181.59999999999999 | AK26: 143.2 | AL26: 177 | AM26: 47.3 | AN26: 146 | AO26: -1.8000000000000002e-002 | AP26: 20 | AQ26: 交建转债!
A27: 131 | B27: 113601 | C27: 塞力转债! | D27: 603716 | E27: 塞力医疗 | F27: 医药 | G27: 医药商业 | H27: 102.62 | I27: -3.0000000000000001e-003 | J27: -4.0999999999999995e-003 | K27: 12.38 | L27: -1.9799999999999998e-002 | M27: 121.3 | N27: 16.98 | O27: 0.40799999999999997 | P27: 72.91 | Q27: 转股中 | R27: 5年14天 | S27: 3年15天 | T27: 5.43 | U27: 11 | V27: 2.e-002 | W27: 0.214 | X27: 0.156 | Y27: 25 | Z27: 1.62 | AA27: 3.4599999999999999e-002 | AB27: 2.7000000000000003e-002 | AC27: 4.8999999999999998e-003 | AD27: 2.3e-003 | AE27: 86.12 | AF27: 90.18 | AG27: 0.36 | AH27: AA- | AI27: 6.2199999999999998e-002 | AJ27: =H27+100*O27 -> 143.42000000000002 | AK27: 132.3 | AL27: 59 | AM27: 42.2 | AN27: 116 | AO27: -3.7000000000000005e-002 | AP27: 38 | AQ27: 塞力转债!
A28: 188 | B28: 113578 | C28: 全筑转债! | D28: 603030 | E28: 全筑股份 | F28: 建筑 | G28: 装饰工程 | H28: 101.4 | I28: 4.0000000000000002e-004 | J28: 2.0999999999999999e-003 | K28: 4.01 | L28: 1.01e-002 | M28: 117.9 | N28: 5.4 | O28: 0.36499999999999999 | P28: 74.26 | Q28: 转股中 | R28: 4.70年 | S28: 2.71年 | T28: 3.84 | U28: 7 | V28: 1.8000000000000002e-002 | W28: 0.17800000000000002 | X28: 0.13200000000000001 | Y28: 22 | Z28: 0.95 | AA28: 3.32e-002 | AB28: 2.6200000000000001e-002 | AC28: 6.8999999999999999e-003 | AD28: 4.5999999999999999e-003 | AE28: 92.51 | AF28: 98.43 | AG28: 0.25 | AH28: AA | AI28: 3.9900000000000005e-002 | AJ28: =H28+100*O28 -> 137.90000000000001 | AK28: 128.5 | AL28: 31 | AM28: 30.1 | AN28: 30 | AO28: -5.2000000000000005e-002 | AP28: 22 | AQ28: 全筑转债!
A29: 166 | B29: 113591 | C29: 胜达转债! | D29: 603687 | E29: 大胜达 | F29: 造纸包装 | G29: 包装用纸 | H29: 104.31 | I29: 2.3e-003 | J29: -7.8000000000000005e-003 | K29: 7.19 | L29: -1.24e-002 | M29: 121.7 | N29: 8.76 | O29: 0.27100000000000002 | P29: 82.08 | Q29: 转股中 | R29: 4.90年 | S29: 2.90年 | T29: 5.5 | U29: 4.1 | V29: 6.9999999999999993e-003 | W29: 0.18600000000000003 | X29: 0.153 | Y29: 30 | Z29: 1.71 | AA29: 3.2599999999999997e-002 | AB29: 2.4700000000000003e-002 | AC29: -2.2000000000000001e-003 | AD29: -4.5000000000000005e-003 | AE29: 86.57 | AF29: 91.63 | AG29: 0.44 | AH29: AA- | AI29: 6.0899999999999996e-002 | AJ29: =H29+100*O29 -> 131.41 | AK29: 126.5 | AL29: 26 | AM29: 34.9 | AN29: 48 | AO29: -5.0000000000000003e-002 | AP29: 29 | AQ29: 胜达转债!
A30: 90 | B30: 128139 | C30: 祥鑫转债! | D30: 2965 | E30: 祥鑫科技 | F30: 汽车 | G30: 零部件制 | H30: 102.37 | I30: 5.6000000000000008e-003 | J30: 4.0000000000000002e-004 | K30: 24.11 | L30: 2.1600000000000001e-002 | M30: 121 | N30: 36.96 | O30: 0.56899999999999995 | P30: 65.23 | Q30: 转股中 | R30: 5.32年 | S30: 3.32年 | T30: 6.47 | U30: 5.6 | V30: 8.0000000000000002e-003 | W30: 0.17800000000000002 | X30: 0.11599999999999999 | Y30: 36 | Z30: 2.05 | AA30: 3.2599999999999997e-002 | AB30: 2.5499999999999998e-002 | AC30: 4.4000000000000003e-003 | AD30: 2.2000000000000001e-003 | AE30: 84.4 | AF30: 88.39 | AG30: 0.28 | AH30: AA- | AI30: 6.2199999999999998e-002 | AJ30: =H30+100*O30 -> 159.26999999999998 | AK30: 139.5 | AL30: 138 | AM30: 51.1 | AN30: 180 | AO30: -2.1000000000000001e-002 | AP30: 14 | AQ30: 祥鑫转债!
A31: 328 | B31: 127007 | C31: 湖广转债! | D31: 665 | E31: 湖北广电 | F31: 传媒娱乐 | G31: 影视娱乐 | H31: 101.8 | I31: -3.8e-003 | J31: 3.4000000000000002e-003 | K31: 3.56 | L31: -5.6000000000000008e-003 | M31: 111.3 | N31: 5.58 | O31: 0.59599999999999997 | P31: 63.8 | Q31: 转股中 | R31: 2.89年 | S31: 0.89年 | T31: 12.2 | U31: 4.4 | V31: 4.0000000000000001e-003 | W31: 0.34799999999999998 | X31: 0.222 | Y31: 35 | Z31: 0.6 | AA31: 3.1800000000000002e-002 | AB31: 2.4300000000000002e-002 | AC31: 0. | AD31: -3.3e-003 | AE31: 98.32 | AF31: 101.36 | AG31: 0.07 | AH31: AA+ | AI31: 3.3399999999999999e-002 | AJ31: =H31+100*O31 -> 161.39999999999998 | AK31: 139.8 | AL31: 143 | AM31: 38.4 | AN31: 81 | AO31: -4.5999999999999999e-002 | AP31: 18 | AQ31: 湖广转债!
A32: 47 | B32: 113620 | C32: 傲农转债! | D32: 603363 | E32: 傲农生物 | F32: 农业 | G32: 畜牧业 | H32: 101.97 | I32: 1.e-003 | J32: 0. | K32: 8.11 | L32: 1.e-002 | M32: 121.1 | N32: 14.51 | O32: 0.82400000000000007 | P32: 55.89 | Q32: 41天 | R32: 5.59年 | S32: 3.59年 | T32: 10 | U32: 20 | V32: 2.e-002 | W32: 0.17999999999999999 | X32: 0.10099999999999999 | Y32: 56 | Z32: 1.88 | AA32: 3.1800000000000002e-002 | AB32: 2.5099999999999997e-002 | AC32: 4.3e-003 | AD32: 2.3999999999999998e-003 | AE32: 89.13 | AF32: 97.01 | AG32: 0.1 | AH32: AA | AI32: 4.1200000000000001e-002 | AJ32: =H32+100*O32 -> 184.37 | AK32: 148 | AL32: 212 | AM32: 51 | AN32: 179 | AO32: -6.6000000000000003e-002 | AP32: 7 | AQ32: 傲农转债!
A33: 312 | B33: 128049 | C33: 华源转债! | D33: 2787 | E33: 华源控股 | F33: 造纸包装 | G33: 包装材料 | H33: 103.5 | I33: 2.7000000000000001e-003 | J33: -5.0000000000000001e-003 | K33: 5.29 | L33: -9.3999999999999986e-003 | M33: 114.5 | N33: 7.37 | O33: 0.442 | P33: 71.78 | Q33: 转股中 | R33: 3.31年 | S33: 1.31年 | T33: 3.63 | U33: 3.6 | V33: 9.0000000000000011e-003 | W33: 0.217 | X33: 0.156 | Y33: 17 | Z33: 1.12 | AA33: 3.1699999999999999e-002 | AB33: 2.3399999999999997e-002 | AC33: -4.4000000000000003e-003 | AD33: -8.1000000000000013e-003 | AE33: 94.32 | AF33: 94.57 | AG33: 0.25 | AH33: AA- | AI33: 6.0899999999999996e-002 | AJ33: =H33+100*O33 -> 147.69999999999999 | AK33: 135.2 | AL33: 94 | AM33: 40.7 | AN33: 102 | AO33: -1.4999999999999999e-002 | AP33: 42 | AQ33: 华源转债!
A34: 57 | B34: 113042 | C34: 上银转债! | D34: 601229 | E34: 上海银行 | F34: 金融 | G34: 银行行业 | H34: 103.08 | I34: 0. | J34: -2.9999999999999997e-004 | K34: 7.18 | L34: -1.4000000000000002e-003 | M34: 120.9 | N34: 10.63 | O34: 0.52600000000000002 | P34: 67.54 | Q34: 转股中 | R34: 5.47年 | S34: 无权 | T34: 200 | U34: 289 | V34: 1.3999999999999999e-002 | W34: 0.19600000000000001 | X34: 0.13200000000000001 | Y34: 1020. | Z34: 0.58 | AA34: 3.0499999999999999e-002 | AB34: 2.35e-002 | AC34: 无权 | AD34: 无权 | AE34: 无权 | AF34: 101.12 | AG34: 0.19 | AH34: AAA | AI34: 3.4200000000000001e-002 | AJ34: =H34+100*O34 -> 155.68000000000001 | AK34: 138.6 | AL34: 133 | AM34: 37.5 | AN34: 71 | AO34: -2.2000000000000002e-002 | AP34: 11 | AQ34: 上银转债!
A35: 251 | B35: 110059 | C35: 浦发转债! | D35: 600000 | E35: 浦发银行 | F35: 金融 | G35: 银行行业 | H35: 104.11 | I35: -8.9999999999999998e-004 | J35: 1.1999999999999999e-003 | K35: 9.08 | L35: 3.3e-003 | M35: 117.6 | N35: 13.97 | O35: 0.60199999999999998 | P35: 65 | Q35: 转股中 | R35: 4.23年 | S35: 无权 | T35: 500 | U35: 133 | V35: 3.0000000000000001e-003 | W35: 0.188 | X35: 0.122 | Y35: 2665. | Z35: 0.49 | AA35: 3.0200000000000001e-002 | AB35: 2.2499999999999999e-002 | AC35: 无权 | AD35: 无权 | AE35: 无权 | AF35: 103 | AG35: 0.11 | AH35: AAA | AI35: 3.2899999999999999e-002 | AJ35: =H35+100*O35 -> 164.31 | AK35: 143.2 | AL35: 179 | AM35: 40.2 | AN35: 97 | AO35: -4.7e-002 | AP35: 60 | AQ35: 浦发转债!
A36: 258 | B36: 128074 | C36: 游族转债!! | D36: 2174 | E36: 游族网络 | F36: 通信互联 | G36: 互联网 | H36: 106.357 | I36: 4.3e-003 | J36: -5.6999999999999993e-003 | K36: 12.11 | L36: -6.6e-003 | M36: 119.9 | N36: 16.97 | O36: 0.48999999999999999 | P36: 71.36 | Q36: 转股中 | R36: 4年47天 | S36: 2年48天 | T36: 6.83 | U36: 18 | V36: 2.5000000000000001e-002 | W36: 6.2e-002 | X36: 4.4000000000000004e-002 | Y36: 111 | Z36: 2.17 | AA36: 3.0099999999999998e-002 | AB36: 2.1400000000000002e-002 | AC36: -1.23e-002 | AD36: -1.52e-002 | AE36: 94.61 | AF36: 98.22 | AG36: 0.21 | AH36: AA | AI36: 3.9900000000000005e-002 | AJ36: =H36+100*O36 -> 155.357 | AK36: 141.4 | AL36: 156 | AM36: 43.1 | AN36: 124 | AO36: -0.16 | AP36: 27 | AQ36: 游族转债!!
A37: 179 | B37: 113584 | C37: 家悦转债! | D37: 603708 | E37: 家家悦 | F37: 商业零售 | G37: 超市 | H37: 99.85 | I37: -3.7000000000000002e-003 | J37: 3.4999999999999996e-003 | K37: 14.81 | L37: -2.3700000000000002e-002 | M37: 114.9 | N37: 37.53 | O37: 1.53 | P37: 39.46 | Q37: 转股中 | R37: 4.83年 | S37: 2.83年 | T37: 6.45 | U37: 3.7 | V37: 6.0000000000000001e-003 | W37: 7.2000000000000008e-002 | X37: 2.7999999999999997e-002 | Y37: 90 | Z37: 3.2 | AA37: 3.0099999999999998e-002 | AB37: 2.4300000000000002e-002 | AC37: 1.18e-002 | AD37: 9.5999999999999992e-003 | AE37: 92.05 | AF37: 95.46 | AG37: 0.01 | AH37: AA | AI37: 3.9900000000000005e-002 | AJ37: =H37+100*O37 -> 252.84999999999999 | AK37: 160.2 | AL37: 274 | AM37: 64.8 | AN37: 255 | AO37: -4.4000000000000004e-002 | AP37: 13 | AQ37: 家悦转债!
A38: 200 | B38: 127016 | C38: 鲁泰转债! | D38: 726 | E38: 鲁 泰Ａ | F38: 服装纺织 | G38: 纺织行业 | H38: 101.21 | I38: 0. | J38: -1.e-003 | K38: 5.46 | L38: -9.1000000000000004e-003 | M38: 115.9 | N38: 8.71 | O38: 0.61499999999999999 | P38: 62.69 | Q38: 转股中 | R38: 4.67年 | S38: 2.68年 | T38: 14 | U38: 2.4 | V38: 2.e-003 | W38: 0.29100000000000004 | X38: 0.182 | Y38: 48 | Z38: 0.61 | AA38: 2.9999999999999999e-002 | AB38: 2.3700000000000002e-002 | AC38: 7.6e-003 | AD38: 5.3e-003 | AE38: 93.88 | AF38: 99.04 | AG38: 0.11 | AH38: AA+ | AI38: 3.49e-002 | AJ38: =H38+100*O38 -> 162.70999999999998 | AK38: 139.7 | AL38: 141 | AM38: 40.7 | AN38: 104 | AO38: -5.7999999999999996e-002 | AP38: 21 | AQ38: 鲁泰转债!
A39: 170 | B39: 123056 | C39: 雪榕转债! | D39: 300511 | E39: 雪榕生物 | F39: 农业 | G39: 种植业 | H39: 104.859 | I39: 1.e-003 | J39: -3.0000000000000001e-003 | K39: 6.93 | L39: -1.1399999999999999e-002 | M39: 120.7 | N39: 11.77 | O39: 0.78099999999999992 | P39: 58.88 | Q39: 转股中 | R39: 4.88年 | S39: 2.88年 | T39: 5.84 | U39: 11 | V39: 1.8000000000000002e-002 | W39: 0.191 | X39: 0.11199999999999999 | Y39: 31 | Z39: 1.48 | AA39: 2.98e-002 | AB39: 2.23e-002 | AC39: -3.9000000000000003e-003 | AD39: -6.1999999999999998e-003 | AE39: 86.67 | AF39: 90.98 | AG39: 0.17 | AH39: AA- | AI39: 6.0899999999999996e-002 | AJ39: =H39+100*O39 -> 182.959 | AK39: 150.8 | AL39: 226 | AM39: 59.9 | AN39: 233 | AO39: -0.14899999999999999 | AP39: 16 | AQ39: 雪榕转债!
A40: 189 | B40: 113573 | C40: 纵横转债! | D40: 603602 | E40: 纵横通信 | F40: 通信互联 | G40: 通信设备 | H40: 108.67 | I40: 5.1999999999999998e-003 | J40: -3.8e-003 | K40: 11.18 | L40: 7.1999999999999998e-003 | M40: 124.2 | N40: 18.78 | O40: 0.82499999999999996 | P40: 59.53 | Q40: 转股中 | R40: 4.69年 | S40: 2.70年 | T40: 2.7 | U40: 8.3 | V40: 2.7999999999999997e-002 | W40: 0.11800000000000001 | X40: 7.0000000000000007e-002 | Y40: 23 | Z40: 3.21 | AA40: 2.9500000000000002e-002 | AB40: 2.06e-002 | AC40: -1.4999999999999999e-002 | AD40: -1.77e-002 | AE40: 85.53 | AF40: 90.33 | AG40: 0.19 | AH40: A+ | AI40: 7.1900000000000006e-002 | AJ40: =H40+100*O40 -> 191.17000000000002 | AK40: 157.8 | AL40: 265 | AM40: 67.5 | AN40: 265 | AO40: 5.7000000000000002e-002 | AP40: 25 | AQ40: 纵横转债!
A41: 268 | B41: 128069 | C41: 华森转债! | D41: 2907 | E41: 华森制药 | F41: 医药 | G41: 化学制药 | H41: 106.8 | I41: -5.0000000000000001e-004 | J41: 2.3e-003 | K41: 12.27 | L41: 9.0000000000000011e-003 | M41: 119.3 | N41: 18.01 | O41: 0.56799999999999995 | P41: 68.13 | Q41: 转股中 | R41: 3.88年 | S41: 1.88年 | T41: 3 | U41: 1.4 | V41: 4.0000000000000001e-003 | W41: 6.0999999999999999e-002 | X41: 4.0999999999999995e-002 | Y41: 49 | Z41: 4.34 | AA41: 2.9399999999999999e-002 | AB41: 2.0499999999999997e-002 | AC41: -1.8600000000000002e-002 | AD41: -2.12e-002 | AE41: 91.15 | AF41: 95.23 | AG41: 0.2 | AH41: AA- | AI41: 6.0899999999999996e-002 | AJ41: =H41+100*O41 -> 163.59999999999999 | AK41: 145.5 | AL41: 193 | AM41: 50.2 | AN41: 169 | AO41: -1.4999999999999999e-002 | AP41: 43 | AQ41: 华森转债!
A42: 177 | B42: 123053 | C42: 宝通转债! | D42: 300031 | E42: 宝通科技 | F42: 通信互联 | G42: 互联网 | H42: 105.379 | I42: -2.0000000000000001e-004 | J42: -7.4000000000000003e-003 | K42: 13.5 | L42: -2.9500000000000002e-002 | M42: 120.8 | N42: 20.5 | O42: 0.59999999999999998 | P42: 65.85 | Q42: 转股中 | R42: 4.83年 | S42: 2.83年 | T42: 5 | U42: 4 | V42: 8.0000000000000002e-003 | W42: 9.3000000000000013e-002 | X42: 6.0999999999999999e-002 | Y42: 54 | Z42: 1.74 | AA42: 2.9300000000000003e-002 | AB42: 2.1600000000000001e-002 | AC42: -5.3e-003 | AD42: -7.7000000000000002e-003 | AE42: 87.03 | AF42: 91.36 | AG42: 0.26 | AH42: AA- | AI42: 6.0899999999999996e-002 | AJ42: =H42+100*O42 -> 165.37900000000002 | AK42: 144.9 | AL42: 188 | AM42: 53.5 | AN42: 199 | AO42: -9.8000000000000004e-002 | AP42: 10 | AQ42: 宝通转债!
A43: 232 | B43: 123039 | C43: 开润转债! | D43: 300577 | E43: 开润股份 | F43: 服装纺织 | G43: 纺织行业 | H43: 106.95 | I43: 4.1999999999999997e-003 | J43: -8.199999999999999e-003 | K43: 15.96 | L43: -3.39e-002 | M43: 121 | N43: 29.9 | O43: 1. | P43: 53.38 | Q43: 转股中 | R43: 4.39年 | S43: 2.39年 | T43: 2.22 | U43: 2.2 | V43: 9.0000000000000011e-003 | W43: 5.7999999999999996e-002 | X43: 3.1e-002 | Y43: 38 | Z43: 2.5 | AA43: 2.92e-002 | AB43: 2.07e-002 | AC43: -1.0700000000000001e-002 | AD43: -1.38e-002 | AE43: 87.36 | AF43: 89.9 | AG43: 0.12 | AH43: A+ | AI43: 7.1900000000000006e-002 | AJ43: =H43+100*O43 -> 206.94999999999999 | AK43: 160.5 | AL43: 275 | AM43: 70.6 | AN43: 283 | AO43: -0.127 | AP43: 22 | AQ43: 开润转债!
A44: 299 | B44: 113021 | C44: 中信转债! | D44: 601998 | E44: 中信银行 | F44: 金融 | G44: 银行行业 | H44: 106.82 | I44: -5.9999999999999995e-004 | J44: -1.e-004 | K44: 4.5 | L44: -6.6e-003 | M44: 118 | N44: 6.73 | O44: 0.59799999999999998 | P44: 66.86 | Q44: 转股中 | R44: 3.57年 | S44: 无权 | T44: 400 | U44: 54 | V44: 1.e-003 | W44: 0.182 | X44: 0.121 | Y44: 2202. | Z44: 0.46 | AA44: 2.9100000000000001e-002 | AB44: 1.9900000000000001e-002 | AC44: 无权 | AD44: 无权 | AE44: 无权 | AF44: 105.47 | AG44: 0.1 | AH44: AAA | AI44: 3.2899999999999999e-002 | AJ44: =H44+100*O44 -> 166.62 | AK44: 146.8 | AL44: 203 | AM44: 41.3 | AN44: 107 | AO44: -7.9000000000000001e-002 | AP44: 42 | AQ44: 中信转债!
A45: 163 | B45: 128118 | C45: 瀛通转债! | D45: 2861 | E45: 瀛通通讯 | F45: 电子 | G45: 电子产品 | H45: 106.198 | I45: 4.0000000000000001e-003 | J45: -7.4000000000000003e-003 | K45: 11.97 | L45: -2.1299999999999999e-002 | M45: 121.7 | N45: 21.12 | O45: 0.87400000000000011 | P45: 56.68 | Q45: 转股中 | R45: 4.90年 | S45: 2.91年 | T45: 3 | U45: 3.4 | V45: 1.1000000000000001e-002 | W45: 0.158 | X45: 8.9999999999999997e-002 | Y45: 19 | Z45: 1.36 | AA45: 2.8799999999999999e-002 | AB45: 2.1000000000000001e-002 | AC45: -6.1999999999999998e-003 | AD45: -8.8000000000000005e-003 | AE45: 87.06 | AF45: 91.69 | AG45: 0.16 | AH45: AA- | AI45: 6.0899999999999996e-002 | AJ45: =H45+100*O45 -> 193.59800000000001 | AK45: 155.7 | AL45: 255 | AM45: 64 | AN45: 250 | AO45: -6.8000000000000005e-002 | AP45: 18 | AQ45: 瀛通转债!
A46: 192 | B46: 123049 | C46: 维尔转债 | D46: 300190 | E46: 维尔利 | F46: 城市公用 | G46: 三废处理 | H46: 109.2 | I46: 1.e-003 | J46: -2.3e-003 | K46: 6.06 | L46: -3.3e-003 | M46: 124.3 | N46: 7.38 | O46: 0.33000000000000002 | P46: 82.11 | Q46: 转股中 | R46: 4.68年 | S46: 2.69年 | T46: 9.17 | U46: 1.3 | V46: 1.e-003 | W46: 0.19399999999999998 | X46: 0.159 | Y46: 47 | Z46: 1.09 | AA46: 2.87e-002 | AB46: 1.9699999999999999e-002 | AC46: -1.6399999999999998e-002 | AD46: -1.9199999999999998e-002 | AE46: 88.22 | AF46: 94.85 | AG46: 0.41 | AH46: AA- | AI46: 6.0899999999999996e-002 | AJ46: =H46+100*O46 -> 142.19999999999999 | AK46: 136.3 | AL46: 102 | AM46: 41.4 | AN46: 111 | AO46: -5.2999999999999999e-002 | AP46: 17 | AQ46: 维尔转债
A47: 162 | B47: 113036 | C47: 宁建转债! | D47: 601789 | E47: 宁波建工 | F47: 建筑 | G47: 建筑工程 | H47: 102.29 | I47: 1.e-004 | J47: -8.0000000000000004e-004 | K47: 3.47 | L47: -2.8999999999999998e-003 | M47: 116.9 | N47: 4.76 | O47: 0.40299999999999997 | P47: 72.9 | Q47: 转股中 | R47: 4.91年 | S47: 2.92年 | T47: 5.4 | U47: 0.9 | V47: 2.e-003 | W47: 0.159 | X47: 0.11599999999999999 | Y47: 34 | Z47: 1.08 | AA47: 2.81e-002 | AB47: 2.1700000000000001e-002 | AC47: 3.5999999999999999e-003 | AD47: 1.4000000000000002e-003 | AE47: 91.75 | AF47: 96.8 | AG47: 0.24 | AH47: AA | AI47: 3.9900000000000005e-002 | AJ47: =H47+100*O47 -> 142.59 | AK47: 131.7 | AL47: 52 | AM47: 34.9 | AN47: 46 | AO47: -1.4999999999999999e-002 | AP47: 10 | AQ47: 宁建转债!
A48: 138 | B48: 113599 | C48: 嘉友转债! | D48: 603871 | E48: 嘉友国际 | F48: 交通运输 | G48: 物流业 | H48: 109.8 | I48: 2.2000000000000001e-003 | J48: -6.6e-003 | K48: 16.13 | L48: -9.1999999999999998e-003 | M48: 125.6 | N48: 18.32 | O48: 0.247 | P48: 88.05 | Q48: 转股中 | R48: 4.996年 | S48: 2.999年 | T48: 7.2 | U48: 2.6 | V48: 3.0000000000000001e-003 | W48: 0.156 | X48: 0.13800000000000001 | Y48: 46 | Z48: 1.65 | AA48: 2.7799999999999998e-002 | AB48: 1.9e-002 | AC48: -1.8600000000000002e-002 | AD48: -2.07e-002 | AE48: 85.99 | AF48: 93.99 | AG48: 0.47 | AH48: AA- | AI48: 6.0899999999999996e-002 | AJ48: =H48+100*O48 -> 134.5 | AK48: 131.6 | AL48: 50 | AM48: 37.6 | AN48: 72 | AO48: 1.e-003 | AP48: 19 | AQ48: 嘉友转债!
A49: 86 | B49: 123081 | C49: 精研转债! | D49: 300709 | E49: 精研科技 | F49: 电子 | G49: 电子产品 | H49: 105.3 | I49: 1.e-003 | J49: -2.7000000000000001e-003 | K49: 30.32 | L49: -9.7999999999999997e-003 | M49: 121.3 | N49: 53.4 | O49: 0.85499999999999998 | P49: 56.78 | Q49: 转股中 | R49: 5.32年 | S49: 3.33年 | T49: 5.7 | U49: 3 | V49: 5.0000000000000001e-003 | W49: 0.13600000000000001 | X49: 7.6999999999999999e-002 | Y49: 42 | Z49: 2.2 | AA49: 2.75e-002 | AB49: 2.0400000000000001e-002 | AC49: -3.0000000000000001e-003 | AD49: -5.3e-003 | AE49: 84.61 | AF49: 88.61 | AG49: 0.18 | AH49: AA- | AI49: 6.2199999999999998e-002 | AJ49: =H49+100*O49 -> 190.80000000000001 | AK49: 153.8 | AL49: 246 | AM49: 65.2 | AN49: 257 | AO49: -0.13600000000000001 | AP49: 9 | AQ49: 精研转债!
A50: 140 | B50: 128125 | C50: 华阳转债! | D50: 2949 | E50: 华阳国际 | F50: 建筑 | G50: 建筑工程 | H50: 103.604 | I50: -1.e-004 | J50: -3.0000000000000001e-003 | K50: 15.94 | L50: -1.3000000000000001e-002 | M50: 118.1 | N50: 25.39 | O50: 0.65000000000000002 | P50: 62.78 | Q50: 转股中 | R50: 4.98年 | S50: 2.98年 | T50: 4.5 | U50: 4.1 | V50: 9.0000000000000011e-003 | W50: 0.14400000000000002 | X50: 8.9999999999999997e-002 | Y50: 31 | Z50: 2.45 | AA50: 2.7099999999999999e-002 | AB50: 2.06e-002 | AC50: -5.0000000000000001e-004 | AD50: -2.5999999999999999e-003 | AE50: 86 | AF50: 88.47 | AG50: 0.24 | AH50: AA- | AI50: 6.0899999999999996e-002 | AJ50: =H50+100*O50 -> 168.60399999999998 | AK50: 144.4 | AL50: 186 | AM50: 56 | AN50: 211 | AO50: -4.5999999999999999e-002 | AP50: 7 | AQ50: 华阳转债!
A51: 368 | B51: 128013 | C51: 洪涛转债! | D51: 2325 | E51: 洪涛股份 | F51: 建筑 | G51: 装饰工程 | H51: 105.22 | I51: -2.7000000000000001e-003 | J51: -2.8000000000000004e-003 | K51: 2.3 | L51: -1.29e-002 | M51: 108 | N51: 2.32 | O51: 6.0999999999999999e-002 | P51: 99.14 | Q51: 转股中 | R51: 0.98年 | S51: 回售内 | T51: 11.5 | U51: 16 | V51: 1.3999999999999999e-002 | W51: 0.39500000000000002 | X51: 0.39200000000000002 | Y51: 29 | Z51: 1.07 | AA51: 2.7000000000000003e-002 | AB51: 1.15e-002 | AC51: 回售内 | AD51: 回售内 | AE51: 100.33 | AF51: 99.6 | AG51: 0.43 | AH51: A- | AI51: 8.6300000000000002e-002 | AJ51: =H51+100*O51 -> 111.31999999999999 | AK51: 111.3 | AL51: 2 | AM51: 11 | AN51: 1 | AO51: -2.5000000000000001e-002 | AP51: 92 | AQ51: 洪涛转债!
A52: 168 | B52: 127018 | C52: 本钢转债! | D52: 761 | E52: 本钢板材 | F52: 钢铁 | G52: 炼钢 | H52: 113.12 | I52: 1.e-002 | J52: -5.3e-003 | K52: 4.82 | L52: 1.0500000000000001e-002 | M52: 128 | N52: 5.02 | O52: 0.17800000000000002 | P52: 96.02 | Q52: 转股中 | R52: 4.89年 | S52: 2.90年 | T52: 67.5 | U52: 133 | V52: 1.7000000000000001e-002 | W52: 0.36099999999999999 | X52: 0.34600000000000003 | Y52: 187 | Z52: 0.91 | AA52: 2.63e-002 | AB52: 1.66e-002 | AC52: -2.1700000000000001e-002 | AD52: -2.52e-002 | AE52: 93.21 | AF52: 104.83 | AG52: 0.45 | AH52: AAA | AI52: 4.2900000000000001e-002 | AJ52: =H52+100*O52 -> 130.92000000000002 | AK52: 130.2 | AL52: 43 | AM52: 25.4 | AN52: 12 | AO52: -2.e-003 | AP52: 65 | AQ52: 本钢转债!
A53: 93 | B53: 123077 | C53: 汉得转债! | D53: 300170 | E53: 汉得信息 | F53: 计算机及 | G53: 软件开发 | H53: 109.8 | I53: -8.0000000000000002e-003 | J53: -1.9e-003 | K53: 7.88 | L53: -3.1899999999999998e-002 | M53: 125.5 | N53: 9.69 | O53: 0.34999999999999998 | P53: 81.32 | Q53: 转股中 | R53: 5.30年 | S53: 3.30年 | T53: 9.37 | U53: 83 | V53: 8.0000000000000002e-002 | W53: 0.13400000000000001 | X53: 0.109 | Y53: 70 | Z53: 2.2 | AA53: 2.6099999999999998e-002 | AB53: 1.78e-002 | AC53: -1.61e-002 | AD53: -1.8200000000000001e-002 | AE53: 90.42 | AF53: 101.76 | AG53: 0.31 | AH53: AA | AI53: 4.1200000000000001e-002 | AJ53: =H53+100*O53 -> 144.80000000000001 | AK53: 138.3 | AL53: 130 | AM53: 36.5 | AN53: 61 | AO53: 6.6000000000000003e-002 | AP53: 14 | AQ53: 汉得转债!
A54: 277 | B54: 127013 | C54: 创维转债! | D54: 810 | E54: 创维数字 | F54: 电子 | G54: 电子产品 | H54: 107.189 | I54: -1.37e-002 | J54: 1.23e-002 | K54: 8.33 | L54: -8.3000000000000001e-003 | M54: 117.3 | N54: 11.29 | O54: 0.45299999999999996 | P54: 73.78 | Q54: 转股中 | R54: 3.69年 | S54: 1.69年 | T54: 9.78 | U54: 4 | V54: 4.0000000000000001e-003 | W54: 0.11 | X54: 8.1000000000000003e-002 | Y54: 89 | Z54: 2.1 | AA54: 2.52e-002 | AB54: 1.67e-002 | AC54: -2.2400000000000003e-002 | AD54: -2.53e-002 | AE54: 95.65 | AF54: 101.81 | AG54: 0.17 | AH54: AA | AI54: 3.9900000000000005e-002 | AJ54: =H54+100*O54 -> 152.48899999999998 | AK54: 140.6 | AL54: 151 | AM54: 38.8 | AN54: 85 | AO54: -1.8000000000000002e-002 | AP54: 22 | AQ54: 创维转债!
A55: 167 | B55: 128116 | C55: 瑞达转债! | D55: 2961 | E55: 瑞达期货 | F55: 金融 | G55: 期货行业 | H55: 102.035 | I55: -1.1000000000000001e-003 | J55: -5.9999999999999995e-004 | K55: 19.74 | L55: -8.5000000000000006e-003 | M55: 114.9 | N55: 29.55 | O55: 0.52700000000000002 | P55: 66.8 | Q55: 转股中 | R55: 4.89年 | S55: 2.90年 | T55: 6.5 | U55: 1.6 | V55: 2.e-003 | W55: 7.400000000000001e-002 | X55: 4.9000000000000002e-002 | Y55: 88 | Z55: 4.48 | AA55: 2.5000000000000001e-002 | AB55: 1.9400000000000001e-002 | AC55: 4.0999999999999995e-003 | AD55: 2.e-003 | AE55: 91.73 | AF55: 95.21 | AG55: 0.21 | AH55: AA | AI55: 3.9900000000000005e-002 | AJ55: =H55+100*O55 -> 154.73500000000001 | AK55: 137.3 | AL55: 118 | AM55: 42.1 | AN55: 115 | AO55: -2.2000000000000002e-002 | AP55: 18 | AQ55: 瑞达转债!
A56: 211 | B56: 123044 | C56: 红相转债!! | D56: 300427 | E56: 红相股份 | F56: 能源电力 | G56: 电力设备 | H56: 112 | I56: 2.7999999999999997e-002 | J56: -1.4800000000000001e-002 | K56: 14 | L56: 4.0899999999999999e-002 | M56: 125 | N56: 18.67 | O56: 0.49399999999999999 | P56: 74.99 | Q56: 转股中 | R56: 4.60年 | S56: 2.60年 | T56: 5.5 | U56: 244 | V56: 0.39500000000000002 | W56: 0.109 | X56: 8.199999999999999e-002 | Y56: 50 | Z56: 2.15 | AA56: 2.4799999999999999e-002 | AB56: 1.54e-002 | AC56: -2.5000000000000001e-002 | AD56: -2.7999999999999997e-002 | AE56: 88.93 | AF56: 95.93 | AG56: 0.32 | AH56: AA- | AI56: 6.0899999999999996e-002 | AJ56: =H56+100*O56 -> 161.40000000000001 | AK56: 149 | AL56: 219 | AM56: 53.1 | AN56: 193 | AO56: 8.8000000000000009e-002 | AP56: 20 | AQ56: 红相转债!!
A57: 349 | B57: 123004 | C57: 铁汉转债! | D57: 300197 | E57: 节能铁汉 | F57: 城市公用 | G57: 生态环境 | H57: 102.8 | I57: 1.8e-003 | J57: -3.5999999999999999e-003 | K57: 2.78 | L57: -1.77e-002 | M57: 108.8 | N57: 3.82 | O57: 0.41299999999999998 | P57: 72.77 | Q57: 转股中 | R57: 2.37年 | S57: 0.37年 | T57: 8.03 | U57: 7.8 | V57: 9.0000000000000011e-003 | W57: 0.10199999999999999 | X57: 7.400000000000001e-002 | Y57: 78 | Z57: 1.2 | AA57: 2.4700000000000003e-002 | AB57: 1.7500000000000002e-002 | AC57: -2.2700000000000001e-002 | AD57: -2.8300000000000002e-002 | AE57: 99.54 | AF57: 99.66 | AG57: 0.1 | AH57: AA | AI57: 3.8399999999999997e-002 | AJ57: =H57+100*O57 -> 144.09999999999999 | AK57: 132.8 | AL57: 65 | AM57: 33.2 | AN57: 38 | AO57: -4.9000000000000002e-002 | AP57: 45 | AQ57: 铁汉转债!
A58: 284 | B58: 113532 | C58: 海环转债! | D58: 603817 | E58: 海峡环保 | F58: 城市公用 | G58: 三废处理 | H58: 102.91 | I58: 2.0000000000000001e-004 | J58: -1.8e-003 | K58: 5.36 | L58: -9.1999999999999998e-003 | M58: 112.3 | N58: 7.63 | O58: 0.46500000000000002 | P58: 70.25 | Q58: 转股中 | R58: 3.65年 | S58: 1.66年 | T58: 4.59 | U58: 1.8 | V58: 4.0000000000000001e-003 | W58: 0.19 | X58: 0.13400000000000001 | Y58: 24 | Z58: 1.36 | AA58: 2.4700000000000003e-002 | AB58: 1.83e-002 | AC58: -5.9999999999999995e-004 | AD58: -3.5999999999999999e-003 | AE58: 95.78 | AF58: 97.61 | AG58: 0.18 | AH58: AA | AI58: 3.9900000000000005e-002 | AJ58: =H58+100*O58 -> 149.41 | AK58: 135.6 | AL58: 97 | AM58: 38 | AN58: 77 | AO58: -2.7000000000000003e-002 | AP58: 26 | AQ58: 海环转债!
A59: 353 | B59: 128022 | C59: 众信转债! | D59: 2707 | E59: 众信旅游 | F59: 旅游餐饮 | G59: 旅游 | H59: 103 | I59: 3.2000000000000002e-003 | J59: -3.2000000000000002e-003 | K59: 4.29 | L59: -1.15e-002 | M59: 108.8 | N59: 7.92 | O59: 0.90200000000000002 | P59: 54.17 | Q59: 转股中 | R59: 2.32年 | S59: 0.32年 | T59: 4.56 | U59: 8 | V59: 1.7000000000000001e-002 | W59: 0.11699999999999999 | X59: 6.3e-002 | Y59: 39 | Z59: 5.82 | AA59: 2.4300000000000002e-002 | AB59: 1.6899999999999998e-002 | AC59: -2.8799999999999999e-002 | AD59: -3.49e-002 | AE59: 97.81 | AF59: 91.21 | AG59: 0 | AH59: A | AI59: 8.0399999999999985e-002 | AJ59: =H59+100*O59 -> 193.19999999999999 | AK59: 151.8 | AL59: 232 | AM59: 54 | AN59: 201 | AO59: -0.14699999999999999 | AP59: 33 | AQ59: 众信转债!
A60: 236 | B60: 128087 | C60: 孚日转债! | D60: 2083 | E60: 孚日股份 | F60: 服装纺织 | G60: 家纺 | H60: 101.933 | I60: -7.000000000000001e-004 | J60: 2.0999999999999999e-003 | K60: 4.02 | L60: 2.5000000000000001e-003 | M60: 112.9 | N60: 4.5 | O60: 0.14099999999999999 | P60: 89.33 | Q60: 转股中 | R60: 4.36年 | S60: 2.37年 | T60: 6.5 | U60: 12 | V60: 1.8000000000000002e-002 | W60: 0.17800000000000002 | X60: 0.159 | Y60: 37 | Z60: 1.01 | AA60: 2.4199999999999999e-002 | AB60: 1.8600000000000002e-002 | AC60: 5.6999999999999993e-003 | AD60: 3.0999999999999999e-003 | AE60: 89.18 | AF60: 87.73 | AG60: 0.54 | AH60: AA- | AI60: 6.0899999999999996e-002 | AJ60: =H60+100*O60 -> 116.033 | AK60: 114.5 | AL60: 3 | AM60: 25.4 | AN60: 11 | AO60: -3.3000000000000002e-002 | AP60: 67 | AQ60: 孚日转债!
A61: 219 | B61: 113566 | C61: 翔港转债! | D61: 603499 | E61: 翔港科技 | F61: 造纸包装 | G61: 包装材料 | H61: 111.7 | I61: 8.0000000000000002e-003 | J61: -1.3500000000000002e-002 | K61: 7.12 | L61: -1.9299999999999998e-002 | M61: 124 | N61: 10.77 | O61: 0.68999999999999995 | P61: 66.11 | Q61: 转股中 | R61: 4.56年 | S61: 2.56年 | T61: 1.61 | U61: 3.9 | V61: 2.2000000000000002e-002 | W61: 0.113 | X61: 7.400000000000001e-002 | Y61: 14 | Z61: 2.53 | AA61: 2.3700000000000002e-002 | AB61: 1.46e-002 | AC61: -2.5499999999999998e-002 | AD61: -2.8399999999999998e-002 | AE61: 86.38 | AF61: 91.02 | AG61: 0.28 | AH61: A+ | AI61: 7.1900000000000006e-002 | AJ61: =H61+100*O61 -> 180.69999999999999 | AK61: 157.3 | AL61: 262 | AM61: 66.3 | AN61: 262 | AO61: -4.9000000000000002e-002 | AP61: 28 | AQ61: 翔港转债!
A62: 149 | B62: 113037 | C62: 紫银转债! | D62: 601860 | E62: 紫金银行 | F62: 金融 | G62: 银行行业 | H62: 103.47 | I62: 2.5000000000000001e-003 | J62: -1.9e-003 | K62: 3.24 | L62: 3.0999999999999999e-003 | M62: 115.6 | N62: 4.65 | O62: 0.48499999999999999 | P62: 69.68 | Q62: 转股中 | R62: 4.96年 | S62: 无权 | T62: 45 | U62: 41 | V62: 9.0000000000000011e-003 | W62: 0.379 | X62: 0.26400000000000001 | Y62: 119 | Z62: 0.8 | AA62: 2.3099999999999999e-002 | AB62: 1.7299999999999999e-002 | AC62: 无权 | AD62: 无权 | AE62: 无权 | AF62: 97.86 | AG62: 0.22 | AH62: AA+ | AI62: 3.49e-002 | AJ62: =H62+100*O62 -> 151.97 | AK62: 137.3 | AL62: 117 | AM62: 39.4 | AN62: 90 | AO62: -5.2000000000000005e-002 | AP62: 21 | AQ62: 紫银转债!
A63: 146 | B63: 128123 | C63: 国光转债! | D63: 2749 | E63: 国光股份 | F63: 化工 | G63: 农化 | H63: 103.604 | I63: 1.1999999999999999e-003 | J63: -2.5999999999999999e-003 | K63: 8.37 | L63: -5.8999999999999999e-003 | M63: 115.7 | N63: 13.48 | O63: 0.66900000000000004 | P63: 62.09 | Q63: 转股中 | R63: 4.97年 | S63: 2.97年 | T63: 3.2 | U63: 1.2 | V63: 4.0000000000000001e-003 | W63: 8.8000000000000009e-002 | X63: 5.4000000000000006e-002 | Y63: 37 | Z63: 2.93 | AA63: 2.29e-002 | AB63: 1.7100000000000001e-002 | AC63: 1.e-004 | AD63: -2.2000000000000001e-003 | AE63: 86.21 | AF63: 86.77 | AG63: 0.24 | AH63: AA- | AI63: 6.0899999999999996e-002 | AJ63: =H63+100*O63 -> 170.50400000000002 | AK63: 145.1 | AL63: 190 | AM63: 58.3 | AN63: 228 | AO63: -4.9000000000000002e-002 | AP63: 12 | AQ63: 国光转债!
A64: 239 | B64: 128083 | C64: 新北转债! | D64: 2376 | E64: 新北洋 | F64: 电子 | G64: 电子产品 | H64: 104.75 | I64: 3.2000000000000002e-003 | J64: -4.6999999999999993e-003 | K64: 8.4 | L64: -5.8999999999999999e-003 | M64: 114.9 | N64: 11.45 | O64: 0.42799999999999999 | P64: 73.36 | Q64: 转股中 | R64: 4.35年 | S64: 2.35年 | T64: 8.77 | U64: 32 | V64: 3.4000000000000002e-002 | W64: 0.157 | X64: 0.115 | Y64: 56 | Z64: 1.61 | AA64: 2.2000000000000002e-002 | AB64: 1.5600000000000001e-002 | AC64: -5.1999999999999998e-003 | AD64: -7.8000000000000005e-003 | AE64: 93.8 | AF64: 97.27 | AG64: 0.24 | AH64: AA | AI64: 3.9900000000000005e-002 | AJ64: =H64+100*O64 -> 147.55000000000001 | AK64: 136.1 | AL64: 100 | AM64: 38.9 | AN64: 86 | AO64: -5.7999999999999996e-002 | AP64: 19 | AQ64: 新北转债!
A65: 20 | B65: 113624 | C65: 正川转债! | D65: 603976 | E65: 正川股份 | F65: 医药 | G65: 医药行业 | H65: 107.71 | I65: -2.5000000000000001e-003 | J65: -2.1600000000000001e-002 | K65: 37.4 | L65: -4.4199999999999996e-002 | M65: 121.6 | N65: 46.69 | O65: 0.34499999999999997 | P65: 80.1 | Q65: 3月4天 | R65: 5.72年 | S65: 3.73年 | T65: 4.05 | U65: 43 | V65: 9.9000000000000005e-002 | W65: 7.2000000000000008e-002 | X65: 5.7000000000000002e-002 | Y65: 57 | Z65: 5.36 | AA65: 2.1899999999999999e-002 | AB65: 1.5300000000000001e-002 | AC65: -7.6e-003 | AD65: -9.7999999999999997e-003 | AE65: 79.72 | AF65: 81.93 | AG65: 0.55 | AH65: A+ | AI65: 7.3200000000000001e-002 | AJ65: =H65+100*O65 -> 142.20999999999998 | AK65: 135.3 | AL65: 95 | AM65: 53.4 | AN65: 197 | AO65: 4.0999999999999995e-002 | AP65: 13 | AQ65: 正川转债!
A66: 201 | B66: 113033 | C66: 利群转债! | D66: 601366 | E66: 利群股份 | F66: 商业零售 | G66: 商场 | H66: 104.19 | I66: 2.5000000000000001e-003 | J66: 2.7000000000000001e-003 | K66: 6.45 | L66: 1.1000000000000001e-002 | M66: 114.9 | N66: 7.01 | O66: 0.13200000000000001 | P66: 92.01 | Q66: 转股中 | R66: 4.65年 | S66: 2.65年 | T66: 18 | U66: 30 | V66: 1.6e-002 | W66: 0.32400000000000001 | X66: 0.29799999999999999 | Y66: 56 | Z66: 1.2 | AA66: 2.1700000000000001e-002 | AB66: 1.5800000000000002e-002 | AC66: -2.7000000000000001e-003 | AD66: -5.0000000000000001e-003 | AE66: 92.7 | AF66: 96.13 | AG66: 0.47 | AH66: AA | AI66: 3.9900000000000005e-002 | AJ66: =H66+100*O66 -> 117.39 | AK66: 116.4 | AL66: 5 | AM66: 20.2 | AN66: 5 | AO66: 2.3e-002 | AP66: 62 | AQ66: 利群转债!
A67: 19 | B67: 127034 | C67: 绿茵转债 | D67: 2887 | E67: 绿茵生态 | F67: 城市公用 | G67: 生态环境 | H67: 105.517 | I67: 5.8999999999999999e-003 | J67: 2.2000000000000001e-003 | K67: 11.07 | L67: 1.37e-002 | M67: 119 | N67: 12.38 | O67: 0.17999999999999999 | P67: 89.42 | Q67: 3月7天 | R67: 5.73年 | S67: 3.73年 | T67: 7.12 | U67: 12 | V67: 1.6e-002 | W67: 0.20600000000000002 | X67: 0.184 | Y67: 35 | Z67: 1.61 | AA67: 2.1600000000000001e-002 | AB67: 1.5700000000000002e-002 | AC67: -3.9000000000000003e-003 | AD67: -5.8999999999999999e-003 | AE67: 82.33 | AF67: 84.81 | AG67: 0.58 | AH67: AA- | AI67: 6.2199999999999998e-002 | AJ67: =H67+100*O67 -> 123.517 | AK67: 121.6 | AL67: 8 | AM67: 36.8 | AN67: 64 | AO67: -3.9e-002 | AP67: 20 | AQ67: 绿茵转债
A68: 9 | B68: 113625 | C68: 江山转债! | D68: 603208 | E68: 江山欧派 | F68: 其他 | G68: 家居用品 | H68: 109.74 | I68: -7.0999999999999995e-003 | J68: -2.5999999999999999e-003 | K68: 65.99 | L68: -2.8799999999999999e-002 | M68: 124 | N68: 97.55 | O68: 0.622 | P68: 67.65 | Q68: 4月14天 | R68: 5.85年 | S68: 3.85年 | T68: 5.83 | U68: 3.6 | V68: 6.0000000000000001e-003 | W68: 8.4000000000000005e-002 | X68: 5.7000000000000002e-002 | Y68: 69 | Z68: 4.12 | AA68: 2.1499999999999998e-002 | AB68: 1.4499999999999999e-002 | AC68: -1.3600000000000001e-002 | AD68: -1.54e-002 | AE68: 81.76 | AF68: 87.74 | AG68: 0.34 | AH68: AA- | AI68: 6.2199999999999998e-002 | AJ68: =H68+100*O68 -> 171.94 | AK68: 151.8 | AL68: 231 | AM68: 64.1 | AN68: 251 | AO68: -0.184 | AP68: 2 | AQ68: 江山转债!
A69: 139 | B69: 113598 | C69: 法兰转债 | D69: 603966 | E69: 法兰泰克 | F69: 机械装备 | G69: 工程机械 | H69: 109.12 | I69: 2.5000000000000001e-003 | J69: -1.03e-002 | K69: 7.46 | L69: -1.9699999999999999e-002 | M69: 120.8 | N69: 9.7 | O69: 0.41899999999999998 | P69: 76.91 | Q69: 转股中 | R69: 4.98年 | S69: 2.99年 | T69: 2.75 | U69: 2.3 | V69: 8.0000000000000002e-003 | W69: 0.12300000000000001 | X69: 9.5000000000000001e-002 | Y69: 22 | Z69: 1.37 | AA69: 2.1000000000000001e-002 | AB69: 1.37e-002 | AC69: -1.61e-002 | AD69: -1.83e-002 | AE69: 86.25 | AF69: 90.53 | AG69: 0.4 | AH69: AA- | AI69: 6.0899999999999996e-002 | AJ69: =H69+100*O69 -> 151.02000000000001 | AK69: 141.3 | AL69: 155 | AM69: 50.8 | AN69: 177 | AO69: -0.317 | AP69: 12 | AQ69: 法兰转债
A70: 141 | B70: 113597 | C70: 佳力转债! | D70: 603912 | E70: 佳力图 | F70: 机械装备 | G70: 专用设备 | H70: 112.17 | I70: 1.e-004 | J70: -6.6e-003 | K70: 16 | L70: -2.2599999999999999e-002 | M70: 124 | N70: 23.15 | O70: 0.623 | P70: 69.11 | Q70: 转股中 | R70: 4.98年 | S70: 2.98年 | T70: 3 | U70: 23 | V70: 6.7000000000000004e-002 | W70: 8.5999999999999993e-002 | X70: 5.9999999999999998e-002 | Y70: 35 | Z70: 3.73 | AA70: 2.07e-002 | AB70: 1.2500000000000001e-002 | AC70: -2.4199999999999999e-002 | AD70: -2.6499999999999999e-002 | AE70: 86.42 | AF70: 92.94 | AG70: 0.29 | AH70: AA- | AI70: 6.0899999999999996e-002 | AJ70: =H70+100*O70 -> 174.47 | AK70: 155.2 | AL70: 251 | AM70: 62.3 | AN70: 245 | AO70: -4.8000000000000001e-002 | AP70: 17 | AQ70: 佳力转债!
A71: 55 | B71: 123096 | C71: 思创转债! | D71: 300078 | E71: 思创医惠 | F71: 通信互联 | G71: 物联网 | H71: 111.095 | I71: 3.0000000000000001e-003 | J71: 3.4999999999999996e-003 | K71: 7.24 | L71: 1.26e-002 | M71: 124 | N71: 8.26 | O71: 0.26700000000000002 | P71: 87.65 | Q71: 转股中 | R71: 5.47年 | S71: 3.48年 | T71: 8.17 | U71: 5.4 | V71: 6.0000000000000001e-003 | W71: 0.13 | X71: 0.114 | Y71: 63 | Z71: 2.11 | AA71: 2.07e-002 | AB71: 1.32e-002 | AC71: -1.83e-002 | AD71: -2.0400000000000001e-002 | AE71: 83.62 | AF71: 89.73 | AG71: 0.52 | AH71: AA- | AI71: 6.2199999999999998e-002 | AJ71: =H71+100*O71 -> 137.79500000000002 | AK71: 134.5 | AL71: 79 | AM71: 44.8 | AN71: 132 | AO71: -5.9000000000000004e-002 | AP71: 6 | AQ71: 思创转债!
A72: 75 | B72: 113044 | C72: 大秦转债! | D72: 601006 | E72: 大秦铁路 | F72: 铁路 | G72: 铁路运输 | H72: 102.86 | I72: -1.8e-003 | J72: -5.0000000000000001e-004 | K72: 5.84 | L72: -6.8000000000000005e-003 | M72: 114.1 | N72: 7.18 | O72: 0.26500000000000001 | P72: 81.34 | Q72: 转股中 | R72: 5.35年 | S72: 3.36年 | T72: 320 | U72: 378 | V72: 1.1000000000000001e-002 | W72: 0.36899999999999999 | X72: 0.29999999999999999 | Y72: 868 | Z72: 0.72 | AA72: 2.e-002 | AB72: 1.5100000000000001e-002 | AC72: 3.0000000000000001e-003 | AD72: 8.0000000000000004e-004 | AE72: 92.42 | AF72: 95.65 | AG72: 0.35 | AH72: AAA | AI72: 3.4200000000000001e-002 | AJ72: =H72+100*O72 -> 129.36000000000001 | AK72: 124.4 | AL72: 16 | AM72: 28.7 | AN72: 22 | AO72: -2.3e-002 | AP72: 16 | AQ72: 大秦转债!
A73: 97 | B73: 113608 | C73: 威派转债! | D73: 603956 | E73: 威派格 | F73: 机械装备 | G73: 专用设备 | H73: 110 | I73: 8.0000000000000004e-004 | J73: -7.4999999999999997e-003 | K73: 15.68 | L73: -1.26e-002 | M73: 121.6 | N73: 19.08 | O73: 0.33899999999999997 | P73: 82.18 | Q73: 转股中 | R73: 5.26年 | S73: 3.26年 | T73: 4.2 | U73: 1.3 | V73: 3.0000000000000001e-003 | W73: 6.3e-002 | X73: 5.2000000000000005e-002 | Y73: 67 | Z73: 5.77 | AA73: 1.9699999999999999e-002 | AB73: 1.2500000000000001e-002 | AC73: -1.47e-002 | AD73: -1.7299999999999999e-002 | AE73: 82.39 | AF73: 84.67 | AG73: 0.53 | AH73: A+ | AI73: 7.3200000000000001e-002 | AJ73: =H73+100*O73 -> 143.90000000000001 | AK73: 137.8 | AL73: 123 | AM73: 53.2 | AN73: 194 | AO73: -6.7000000000000004e-002 | AP73: 6 | AQ73: 威派转债!
A74: 327 | B74: 123010 | C74: 博世转债! | D74: 300422 | E74: 博世科 | F74: 城市公用 | G74: 三废处理 | H74: 105.26 | I74: -1.2999999999999999e-003 | J74: 4.4000000000000003e-003 | K74: 8.64 | L74: 1.6500000000000001e-002 | M74: 111.3 | N74: 12.15 | O74: 0.47999999999999998 | P74: 71.11 | Q74: 转股中 | R74: 2.91年 | S74: 0.91年 | T74: 4.3 | U74: 4.1 | V74: 9.0000000000000011e-003 | W74: 0.12300000000000001 | X74: 8.6999999999999994e-002 | Y74: 35 | Z74: 1.44 | AA74: 1.9599999999999999e-002 | AB74: 1.23e-002 | AC74: -3.0600000000000002e-002 | AD74: -3.3700000000000001e-002 | AE74: 95.67 | AF74: 94.33 | AG74: 0.19 | AH74: AA- | AI74: 5.9400000000000001e-002 | AJ74: =H74+100*O74 -> 153.25999999999999 | AK74: 139.4 | AL74: 137 | AM74: 43.7 | AN74: 126 | AO74: -3.1e-002 | AP74: 30 | AQ74: 博世转债!
A75: 23 | B75: 127033 | C75: 中装转2 | D75: 2822 | E75: 中装建设 | F75: 建筑 | G75: 装饰工程 | H75: 105.25 | I75: -5.9999999999999995e-004 | J75: -4.0000000000000001e-003 | K75: 5.06 | L75: -1.1699999999999999e-002 | M75: 117.1 | N75: 6.28 | O75: 0.30599999999999999 | P75: 80.57 | Q75: 2月17天 | R75: 5.69年 | S75: 3.69年 | T75: 11.6 | U75: 14 | V75: 1.2e-002 | W75: 0.318 | X75: 0.25600000000000001 | Y75: 37 | Z75: 1.08 | AA75: 1.9299999999999998e-002 | AB75: 1.38e-002 | AC75: -4.0999999999999995e-003 | AD75: -5.8999999999999999e-003 | AE75: 88.77 | AF75: 93.44 | AG75: 0.39 | AH75: AA | AI75: 4.1200000000000001e-002 | AJ75: =H75+100*O75 -> 135.84999999999999 | AK75: 129.9 | AL75: 40 | AM75: 36.5 | AN75: 59 | AO75: -7.6999999999999999e-002 | AP75: 25 | AQ75: 中装转2
A76: 156 | B76: 128120 | C76: 联诚转债! | D76: 2921 | E76: 联诚精密 | F76: 汽车 | G76: 零部件制 | H76: 107.6 | I76: 2.8000000000000004e-003 | J76: 5.4000000000000003e-003 | K76: 15.32 | L76: 1.3899999999999999e-002 | M76: 117.9 | N76: 18.44 | O76: 0.29499999999999998 | P76: 83.08 | Q76: 转股中 | R76: 4.94年 | S76: 2.95年 | T76: 2.6 | U76: 1.5 | V76: 5.0000000000000001e-003 | W76: 0.16 | X76: 0.13300000000000001 | Y76: 16 | Z76: 1.58 | AA76: 1.9099999999999999e-002 | AB76: 1.2500000000000001e-002 | AC76: -1.0800000000000001e-002 | AD76: -1.32e-002 | AE76: 81.66 | AF76: 80.6 | AG76: 0.59 | AH76: A | AI76: 8.1900000000000001e-002 | AJ76: =H76+100*O76 -> 137.09999999999999 | AK76: 132.1 | AL76: 56 | AM76: 50.5 | AN76: 175 | AO76: 2.e-002 | AP76: 21 | AQ76: 联诚转债!
A77: 172 | B77: 128114 | C77: 正邦转债! | D77: 2157 | E77: 正邦科技 | F77: 农业 | G77: 畜牧业 | H77: 105.084 | I77: 8.0000000000000004e-004 | J77: -5.0000000000000001e-004 | K77: 9.46 | L77: 2.0999999999999999e-003 | M77: 114.9 | N77: 14.76 | O77: 0.64000000000000001 | P77: 64.09 | Q77: 转股中 | R77: 4.86年 | S77: 2.86年 | T77: 16 | U77: 16 | V77: 9.0000000000000011e-003 | W77: 5.4000000000000006e-002 | X77: 3.4000000000000002e-002 | Y77: 298 | Z77: 1.27 | AA77: 1.89e-002 | AB77: 1.32e-002 | AC77: -5.3e-003 | AD77: -7.4999999999999997e-003 | AE77: 93.28 | AF77: 97.56 | AG77: 0.15 | AH77: AA+ | AI77: 3.49e-002 | AJ77: =H77+100*O77 -> 169.084 | AK77: 146.1 | AL77: 199 | AM77: 48.5 | AN77: 153 | AO77: -9.0999999999999998e-002 | AP77: 17 | AQ77: 正邦转债!
A78: 338 | B78: 113505 | C78: 杭电转债! | D78: 603618 | E78: 杭电股份 | F78: 能源电力 | G78: 电力设备 | H78: 106.16 | I78: 4.0999999999999995e-003 | J78: -2.2000000000000001e-003 | K78: 5.76 | L78: 8.8000000000000005e-003 | M78: 111.3 | N78: 7.08 | O78: 0.30499999999999999 | P78: 81.36 | Q78: 转股中 | R78: 2.58年 | S78: 0.58年 | T78: 7.5 | U78: 10 | V78: 1.3000000000000001e-002 | W78: 0.188 | X78: 0.153 | Y78: 40 | Z78: 1.48 | AA78: 1.8799999999999997e-002 | AB78: 1.06e-002 | AC78: -5.4699999999999999e-002 | AD78: -5.9200000000000003e-002 | AE78: 98.98 | AF78: 101.16 | AG78: 0.22 | AH78: AA | AI78: 3.8399999999999997e-002 | AJ78: =H78+100*O78 -> 136.66 | AK78: 131 | AL78: 48 | AM78: 29.8 | AN78: 27 | AO78: -4.2000000000000003e-002 | AP78: 44 | AQ78: 杭电转债!
A79: 158 | B79: 123059 | C79: 银信转债! | D79: 300231 | E79: 银信科技 | F79: 计算机及 | G79: 软件开发 | H79: 113.17 | I79: 1.04e-002 | J79: -1.7000000000000001e-003 | K79: 8.56 | L79: 1.78e-002 | M79: 123.7 | N79: 9.72 | O79: 0.28499999999999998 | P79: 88.07 | Q79: 转股中 | R79: 4.94年 | S79: 2.94年 | T79: 3.91 | U79: 10 | V79: 2.3e-002 | W79: 0.10300000000000001 | X79: 9.0999999999999998e-002 | Y79: 38 | Z79: 2.78 | AA79: 1.8500000000000003e-002 | AB79: 1.03e-002 | AC79: -2.8199999999999999e-002 | AD79: -3.04e-002 | AE79: 86.38 | AF79: 92.91 | AG79: 0.49 | AH79: AA- | AI79: 6.0899999999999996e-002 | AJ79: =H79+100*O79 -> 141.66999999999999 | AK79: 138.3 | AL79: 129 | AM79: 45.4 | AN79: 135 | AO79: 4.8000000000000001e-002 | AP79: 17 | AQ79: 银信转债!
A80: 117 | B80: 113604 | C80: 多伦转债! | D80: 603528 | E80: 多伦科技 | F80: 计算机及 | G80: 软件开发 | H80: 106.88 | I80: -1.1000000000000001e-003 | J80: 5.9999999999999995e-004 | K80: 8.02 | L80: -1.1999999999999999e-003 | M80: 117.3 | N80: 10.4 | O80: 0.38600000000000001 | P80: 77.12 | Q80: 转股中 | R80: 5.19年 | S80: 3.19年 | T80: 6.4 | U80: 15 | V80: 2.2000000000000002e-002 | W80: 0.127 | X80: 9.8000000000000004e-002 | Y80: 50 | Z80: 3.02 | AA80: 1.8500000000000003e-002 | AB80: 1.24e-002 | AC80: -8.8000000000000005e-003 | AD80: -1.09e-002 | AE80: 84.99 | AF80: 86.37 | AG80: 0.44 | AH80: AA- | AI80: 6.2199999999999998e-002 | AJ80: =H80+100*O80 -> 145.47999999999999 | AK80: 136.6 | AL80: 104 | AM80: 50.3 | AN80: 171 | AO80: -9.0000000000000011e-003 | AP80: 7 | AQ80: 多伦转债!
A81: 253 | B81: 113546 | C81: 迪贝转债! | D81: 603320 | E81: 迪贝电气 | F81: 家电 | G81: 零部件制 | H81: 112 | I81: -5.9999999999999995e-004 | J81: -4.1999999999999997e-003 | K81: 12.06 | L81: -9.8999999999999991e-003 | M81: 120.6 | N81: 14 | O81: 0.29999999999999999 | P81: 86.14 | Q81: 转股中 | R81: 4.21年 | S81: 2.22年 | T81: 2.3 | U81: 3.7 | V81: 1.3999999999999999e-002 | W81: 0.14699999999999999 | X81: 0.126 | Y81: 16 | Z81: 2.26 | AA81: 1.8200000000000001e-002 | AB81: 9.4999999999999998e-003 | AC81: -3.1300000000000001e-002 | AD81: -3.44e-002 | AE81: 88.31 | AF81: 90.69 | AG81: 0.49 | AH81: A+ | AI81: 7.1900000000000006e-002 | AJ81: =H81+100*O81 -> 142. | AK81: 137.9 | AL81: 124 | AM81: 47.2 | AN81: 143 | AO81: 2.3e-002 | AP81: 38 | AQ81: 迪贝转债!
A82: 276 | B82: 110058 | C82: 永鼎转债! | D82: 600105 | E82: 永鼎股份 | F82: 通信互联 | G82: 通信设备 | H82: 107.09 | I82: 7.000000000000001e-004 | J82: 1.6000000000000001e-003 | K82: 3.61 | L82: 8.3999999999999995e-003 | M82: 114.3 | N82: 5.04 | O82: 0.495 | P82: 71.63 | Q82: 转股中 | R82: 3.69年 | S82: 1.69年 | T82: 2.61 | U82: 9.5 | V82: 3.4000000000000002e-002 | W82: 5.2000000000000005e-002 | X82: 3.7999999999999999e-002 | Y82: 50 | Z82: 1.79 | AA82: 1.8100000000000002e-002 | AB82: 1.1000000000000001e-002 | AC82: -2.1899999999999999e-002 | AD82: -2.4799999999999999e-002 | AE82: 92.17 | AF82: 92.28 | AG82: 0.27 | AH82: AA- | AI82: 6.0899999999999996e-002 | AJ82: =H82+100*O82 -> 156.59 | AK82: 142.6 | AL82: 170 | AM82: 50.3 | AN82: 172 | AO82: -1.8000000000000002e-002 | AP82: 47 | AQ82: 永鼎转债!
A83: 302 | B83: 110051 | C83: 中天转债! | D83: 600522 | E83: 中天科技 | F83: 通信互联 | G83: 通信设备 | H83: 106.48 | I83: -7.9000000000000008e-003 | J83: 5.1000000000000004e-003 | K83: 7.58 | L83: -1.43e-002 | M83: 113.3 | N83: 9.99 | O83: 0.40299999999999997 | P83: 75.88 | Q83: 转股中 | R83: 3.57年 | S83: 1.57年 | T83: 39.6 | U83: 128 | V83: 2.9999999999999999e-002 | W83: 0.17100000000000001 | X83: 0.129 | Y83: 232 | Z83: 1 | AA83: 1.7899999999999999e-002 | AB83: 1.1000000000000001e-002 | AC83: -2.0299999999999999e-002 | AD83: -2.3300000000000001e-002 | AE83: 96.92 | AF83: 100.5 | AG83: 0.2 | AH83: AA+ | AI83: 3.49e-002 | AJ83: =H83+100*O83 -> 146.78 | AK83: 137.1 | AL83: 113 | AM83: 36.6 | AN83: 62 | AO83: -0.14499999999999999 | AP83: 25 | AQ83: 中天转债!
A84: 79 | B84: 127027 | C84: 靖远转债! | D84: 552 | E84: 靖远煤电 | F84: 煤炭 | G84: 煤炭开采 | H84: 105.1 | I84: 1.15e-002 | J84: 1.2999999999999999e-003 | K84: 2.86 | L84: 2.8799999999999999e-002 | M84: 115.3 | N84: 3.23 | O84: 0.187 | P84: 88.54 | Q84: 转股中 | R84: 5.34年 | S84: 3.35年 | T84: 28 | U84: 71 | V84: 2.4e-002 | W84: 0.42799999999999999 | X84: 0.379 | Y84: 65 | Z84: 0.82 | AA84: 1.78e-002 | AB84: 1.26e-002 | AC84: -3.5999999999999999e-003 | AD84: -5.6999999999999993e-003 | AE84: 91.74 | AF84: 95.72 | AG84: 0.45 | AH84: AA+ | AI84: 3.6200000000000003e-002 | AJ84: =H84+100*O84 -> 123.8 | AK84: 121.7 | AL84: 9 | AM84: 25.9 | AN84: 15 | AO84: 2.e-003 | AP84: 42 | AQ84: 靖远转债!
A85: 308 | B85: 113524 | C85: 奇精转债! | D85: 603677 | E85: 奇精机械 | F85: 家电 | G85: 零部件制 | H85: 110.86 | I85: 1.04e-002 | J85: -7.4000000000000003e-003 | K85: 12.12 | L85: 7.4999999999999997e-003 | M85: 117.3 | N85: 13.98 | O85: 0.27899999999999997 | P85: 86.7 | Q85: 转股中 | R85: 3.35年 | S85: 1.36年 | T85: 3.3 | U85: 4 | V85: 1.1000000000000001e-002 | W85: 0.14199999999999999 | X85: 0.12300000000000001 | Y85: 23 | Z85: 2.37 | AA85: 1.7299999999999999e-002 | AB85: 8.1000000000000013e-003 | AC85: -4.8799999999999996e-002 | AD85: -5.21e-002 | AE85: 94.03 | AF85: 96.59 | AG85: 0.4 | AH85: AA- | AI85: 6.0899999999999996e-002 | AJ85: =H85+100*O85 -> 138.75999999999999 | AK85: 135 | AL85: 91 | AM85: 38.4 | AN85: 80 | AO85: 3.3000000000000002e-002 | AP85: 42 | AQ85: 奇精转债!
A86: 291 | B86: 123023 | C86: 迪森转债! | D86: 300335 | E86: 迪森股份 | F86: 能源电力 | G86: 电力供应 | H86: 107.6 | I86: 4.6999999999999993e-003 | J86: -2.5000000000000001e-003 | K86: 5.65 | L86: 5.3e-003 | M86: 114.3 | N86: 6.89 | O86: 0.312 | P86: 82 | Q86: 转股中 | R86: 3.62年 | S86: 2.62年 | T86: 5.29 | U86: 17 | V86: 2.8999999999999998e-002 | W86: 0.251 | X86: 0.20600000000000002 | Y86: 21 | Z86: 1.51 | AA86: 1.72e-002 | AB86: 9.8999999999999991e-003 | AC86: -1.01e-002 | AD86: -1.3300000000000001e-002 | AE86: 88.96 | AF86: 92.68 | AG86: 0.4 | AH86: AA- | AI86: 6.0899999999999996e-002 | AJ86: =H86+100*O86 -> 138.79999999999998 | AK86: 133.2 | AL86: 68 | AM86: 40.5 | AN86: 100 | AO86: 4.5999999999999999e-002 | AP86: 51 | AQ86: 迪森转债!
A87: 74 | B87: 123088 | C87: 威唐转债! | D87: 300707 | E87: 威唐工业 | F87: 汽车 | G87: 零部件制 | H87: 111.37 | I87: 1.9400000000000001e-002 | J87: -1.4199999999999999e-002 | K87: 17.8 | L87: 9.1000000000000004e-003 | M87: 121.6 | N87: 20.72 | O87: 0.29600000000000004 | P87: 85.91 | Q87: 转股中 | R87: 5.36年 | S87: 3.36年 | T87: 3.01 | U87: 13 | V87: 4.0000000000000001e-002 | W87: 0.10800000000000001 | X87: 9.3000000000000013e-002 | Y87: 28 | Z87: 4.05 | AA87: 1.6899999999999998e-002 | AB87: 9.8999999999999991e-003 | AC87: -1.78e-002 | AD87: -2.0299999999999999e-002 | AE87: 81.81 | AF87: 84.08 | AG87: 0.58 | AH87: A+ | AI87: 7.3200000000000001e-002 | AJ87: =H87+100*O87 -> 140.97 | AK87: 136.8 | AL87: 109 | AM87: 52.8 | AN87: 191 | AO87: 4.0000000000000001e-002 | AP87: 15 | AQ87: 威唐转债!
A88: 264 | B88: 128071 | C88: 合兴转债! | D88: 2228 | E88: 合兴包装 | F88: 造纸包装 | G88: 包装材料 | H88: 107.501 | I88: -8.0000000000000004e-004 | J88: -2.8999999999999998e-003 | K88: 3.4 | L88: -1.1599999999999999e-002 | M88: 114.8 | N88: 4.18 | O88: 0.32200000000000001 | P88: 81.34 | Q88: 转股中 | R88: 4年9天 | S88: 2年10天 | T88: 3 | U88: 3 | V88: 9.0000000000000011e-003 | W88: 7.0999999999999994e-002 | X88: 5.7999999999999996e-002 | Y88: 42 | Z88: 1.21 | AA88: 1.6799999999999999e-002 | AB88: 1.01e-002 | AC88: -1.8200000000000001e-002 | AD88: -2.1099999999999997e-002 | AE88: 94.89 | AF88: 98.41 | AG88: 0.32 | AH88: AA | AI88: 3.9900000000000005e-002 | AJ88: =H88+100*O88 -> 139.70100000000002 | AK88: 133.7 | AL88: 74 | AM88: 35.3 | AN88: 51 | AO88: -3.7999999999999999e-002 | AP88: 24 | AQ88: 合兴转债!
A89: 137 | B89: 127021 | C89: 特发转2! | D89: 70 | E89: 特发信息 | F89: 通信互联 | G89: 通信设备 | H89: 106.1 | I89: 4.6999999999999993e-003 | J89: -5.0000000000000001e-003 | K89: 7.46 | L89: -2.7000000000000001e-003 | M89: 113.3 | N89: 12.33 | O89: 0.754 | P89: 60.5 | Q89: 转股中 | R89: 4年0.5天 | S89: 2年1.5天 | T89: 5.5 | U89: 2.4 | V89: 4.0000000000000001e-003 | W89: 8.900000000000001e-002 | X89: 5.4000000000000006e-002 | Y89: 62 | Z89: 2.1 | AA89: 1.6799999999999999e-002 | AB89: 1.06e-002 | AC89: -1.7899999999999999e-002 | AD89: -1.9699999999999999e-002 | AE89: 93.8 | AF89: 97.09 | AG89: 0.1 | AH89: AA | AI89: 3.9900000000000005e-002 | AJ89: =H89+100*O89 -> 181.5 | AK89: 151.7 | AL89: 230 | AM89: 54.6 | AN89: 205 | AO89: -2.1000000000000001e-002 | AP89: 12 | AQ89: 特发转2!
A90: 301 | B90: 128056 | C90: 今飞转债! | D90: 2863 | E90: 今飞凯达 | F90: 汽车 | G90: 零部件制 | H90: 113.5 | I90: 7.9000000000000008e-003 | J90: -1.04e-002 | K90: 5.05 | L90: -7.9000000000000008e-003 | M90: 120.2 | N90: 6.69 | O90: 0.504 | P90: 75.49 | Q90: 转股中 | R90: 3.57年 | S90: 1.57年 | T90: 1.72 | U90: 18 | V90: 9.4e-002 | W90: 6.8000000000000005e-002 | X90: 5.2000000000000005e-002 | Y90: 25 | Z90: 1.35 | AA90: 1.66e-002 | AB90: 6.6e-003 | AC90: -5.3099999999999994e-002 | AD90: -5.6600000000000004e-002 | AE90: 91.77 | AF90: 94.38 | AG90: 0.31 | AH90: A+ | AI90: 7.1900000000000006e-002 | AJ90: =H90+100*O90 -> 163.90000000000001 | AK90: 151.5 | AL90: 229 | AM90: 57.1 | AN90: 221 | AO90: 6.0000000000000001e-003 | AP90: 52 | AQ90: 今飞转债!
A91: 204 | B91: 110068 | C91: 龙净转债! | D91: 600388 | E91: 龙净环保 | F91: 城市公用 | G91: 三废处理 | H91: 106.55 | I91: -2.8999999999999998e-003 | J91: 3.3e-003 | K91: 8.59 | L91: 1.1999999999999999e-003 | M91: 114.8 | N91: 10.55 | O91: 0.309 | P91: 81.42 | Q91: 转股中 | R91: 4.63年 | S91: 2.63年 | T91: 20 | U91: 11 | V91: 5.0000000000000001e-003 | W91: 0.218 | X91: 0.17699999999999999 | Y91: 92 | Z91: 1.51 | AA91: 1.66e-002 | AB91: 1.0700000000000001e-002 | AC91: -1.11e-002 | AD91: -1.3300000000000001e-002 | AE91: 93.93 | AF91: 98.24 | AG91: 0.32 | AH91: AA+ | AI91: 3.49e-002 | AJ91: =H91+100*O91 -> 137.44999999999999 | AK91: 131.7 | AL91: 51 | AM91: 33.4 | AN91: 40 | AO91: -6.0000000000000001e-003 | AP91: 33 | AQ91: 龙净转债!
A92: 198 | B92: 128105 | C92: 长集转债! | D92: 2616 | E92: 长青集团 | F92: 城市公用 | G92: 三废处理 | H92: 106.8 | I92: 0. | J92: -1.e-003 | K92: 6.25 | L92: -3.2000000000000002e-003 | M92: 114.9 | N92: 7.91 | O92: 0.35200000000000004 | P92: 79.01 | Q92: 转股中 | R92: 4.67年 | S92: 2.68年 | T92: 8 | U92: 5 | V92: 6.0000000000000001e-003 | W92: 0.17199999999999999 | X92: 0.13600000000000001 | Y92: 46 | Z92: 1.74 | AA92: 1.61e-002 | AB92: 1.0200000000000001e-002 | AC92: -1.1399999999999999e-002 | AD92: -1.37e-002 | AE92: 92.62 | AF92: 96.05 | AG92: 0.32 | AH92: AA | AI92: 3.9900000000000005e-002 | AJ92: =H92+100*O92 -> 142. | AK92: 134.6 | AL92: 80 | AM92: 38.5 | AN92: 82 | AO92: -7.5999999999999998e-002 | AP92: 17 | AQ92: 长集转债!
A93: 125 | B93: 123065 | C93: 宝莱转债! | D93: 300246 | E93: 宝莱特 | F93: 医药 | G93: 医疗器械 | H93: 112.256 | I93: 8.9999999999999998e-004 | J93: -2.e-003 | K93: 16.63 | L93: -2.52e-002 | M93: 121.4 | N93: 40.14 | O93: 1.71 | P93: 41.43 | Q93: 转股中 | R93: 5年28天 | S93: 3年29天 | T93: 2.19 | U93: 15 | V93: 6.3e-002 | W93: 8.9999999999999997e-002 | X93: 3.7000000000000005e-002 | Y93: 24 | Z93: 2.74 | AA93: 1.5900000000000001e-002 | AB93: 8.5000000000000006e-003 | AC93: -2.2599999999999999e-002 | AD93: -2.5099999999999997e-002 | AE93: 85.98 | AF93: 90.03 | AG93: 0.04 | AH93: AA- | AI93: 6.2199999999999998e-002 | AJ93: =H93+100*O93 -> 283.25599999999997 | AK93: 183.1 | AL93: 316 | AM93: 93.1 | AN93: 323 | AO93: -6.3e-002 | AP93: 18 | AQ93: 宝莱转债!
A94: 95 | B94: 123076 | C94: 强力转债! | D94: 300429 | E94: 强力新材 | F94: 化工 | G94: 化工 | H94: 109.2 | I94: 2.8000000000000004e-003 | J94: 4.1999999999999997e-003 | K94: 14.24 | L94: 1.7100000000000001e-002 | M94: 118.5 | N94: 18.94 | O94: 0.45200000000000001 | P94: 75.18 | Q94: 转股中 | R94: 5.29年 | S94: 3.29年 | T94: 8.5 | U94: 11 | V94: 1.2e-002 | W94: 0.11599999999999999 | X94: 8.6999999999999994e-002 | Y94: 73 | Z94: 4.15 | AA94: 1.5900000000000001e-002 | AB94: 9.7000000000000003e-003 | AC94: -1.46e-002 | AD94: -1.67e-002 | AE94: 84.5 | AF94: 86.72 | AG94: 0.41 | AH94: AA- | AI94: 6.2199999999999998e-002 | AJ94: =H94+100*O94 -> 154.40000000000001 | AK94: 143.2 | AL94: 178 | AM94: 56.5 | AN94: 215 | AO94: 3.7999999999999999e-002 | AP94: 16 | AQ94: 强力转债!
A95: 274 | B95: 113535 | C95: 大业转债! | D95: 603278 | E95: 大业股份 | F95: 汽车 | G95: 零部件制 | H95: 107.88 | I95: 3.4300000000000004e-002 | J95: -1.1599999999999999e-002 | K95: 9.94 | L95: 9.9600000000000008e-002 | M95: 112.5 | N95: 12.29 | O95: 0.33399999999999996 | P95: 80.88 | Q95: 转股中 | R95: 2.75年 | S95: 0.76年 | T95: 5 | U95: 347 | V95: 0.63100000000000001 | W95: 0.17300000000000001 | X95: 0.14000000000000001 | Y95: 29 | Z95: 1.64 | AA95: 1.55e-002 | AB95: 7.1999999999999998e-003 | AC95: -6.6500000000000004e-002 | AD95: -6.9000000000000006e-002 | AE95: 97.8 | AF95: 101.52 | AG95: 0.23 | AH95: AA | AI95: 3.8399999999999997e-002 | AJ95: =H95+100*O95 -> 141.28 | AK95: 134.9 | AL95: 88 | AM95: 33.4 | AN95: 39 | AO95: 9.3000000000000013e-002 | AP95: 47 | AQ95: 大业转债!
A96: 261 | B96: 128073 | C96: 哈尔转债! | D96: 2615 | E96: 哈尔斯 | F96: 其他 | G96: 家居用品 | H96: 110.22 | I96: 9.300000000000001e-003 | J96: -7.1999999999999998e-003 | K96: 4.71 | L96: 6.4000000000000003e-003 | M96: 115.3 | N96: 5.71 | O96: 0.33600000000000002 | P96: 82.49 | Q96: 转股中 | R96: 3年15天 | S96: 1年16天 | T96: 2.99 | U96: 10 | V96: 3.1e-002 | W96: 0.154 | X96: 0.127 | Y96: 19 | Z96: 2.48 | AA96: 1.52e-002 | AB96: 6.0999999999999995e-003 | AC96: -6.2199999999999998e-002 | AD96: -6.5199999999999994e-002 | AE96: 95.06 | AF96: 96.62 | AG96: 0.32 | AH96: AA- | AI96: 6.0899999999999996e-002 | AJ96: =H96+100*O96 -> 143.81999999999999 | AK96: 138 | AL96: 128 | AM96: 41.3 | AN96: 108 | AO96: -2.2000000000000002e-002 | AP96: 38 | AQ96: 哈尔转债!
A97: 153 | B97: 113594 | C97: 淳中转债! | D97: 603516 | E97: 淳中科技 | F97: 电子 | G97: 电子产品 | H97: 112.36 | I97: -7.4000000000000003e-003 | J97: -1.18e-002 | K97: 19.61 | L97: -5.04e-002 | M97: 120.9 | N97: 27.84 | O97: 0.59499999999999997 | P97: 70.44 | Q97: 转股中 | R97: 4.95年 | S97: 2.96年 | T97: 3 | U97: 5 | V97: 1.4999999999999999e-002 | W97: 8.199999999999999e-002 | X97: 5.7999999999999996e-002 | Y97: 37 | Z97: 2.67 | AA97: 1.52e-002 | AB97: 7.8000000000000005e-003 | AC97: -2.4500000000000001e-002 | AD97: -2.69e-002 | AE97: 83.96 | AF97: 86.36 | AG97: 0.38 | AH97: A+ | AI97: 7.1900000000000006e-002 | AJ97: =H97+100*O97 -> 171.86000000000001 | AK97: 154.3 | AL97: 249 | AM97: 67.9 | AN97: 269 | AO97: -4.4000000000000004e-002 | AP97: 9 | AQ97: 淳中转债!
A98: 107 | B98: 123073 | C98: 同和转债! | D98: 300636 | E98: 同和药业 | F98: 医药 | G98: 原料药 | H98: 113.5 | I98: -4.6199999999999998e-002 | J98: -2.3900000000000001e-002 | K98: 13.38 | L98: -0.11900000000000001 | M98: 122.4 | N98: 14.82 | O98: 0.25700000000000001 | P98: 90.28 | Q98: 转股中 | R98: 5.22年 | S98: 3.22年 | T98: 3.59 | U98: 20 | V98: 4.8000000000000001e-002 | W98: 0.13 | X98: 0.11800000000000001 | Y98: 28 | Z98: 2.19 | AA98: 1.49e-002 | AB98: 7.4999999999999997e-003 | AC98: -2.4199999999999999e-002 | AD98: -2.6699999999999998e-002 | AE98: 82.58 | AF98: 85.44 | AG98: 0.59 | AH98: A+ | AI98: 7.3200000000000001e-002 | AJ98: =H98+100*O98 -> 139.19999999999999 | AK98: 136.7 | AL98: 106 | AM98: 51.3 | AN98: 184 | AO98: -0.13300000000000001 | AP98: 12 | AQ98: 同和转债!
A99: 85 | B99: 123082 | C99: 北陆转债! | D99: 300016 | E99: 北陆药业 | F99: 医药 | G99: 化学制药 | H99: 112.7 | I99: -9.8999999999999991e-003 | J99: 1.7000000000000001e-003 | K99: 8.67 | L99: -1.2500000000000001e-002 | M99: 121.7 | N99: 8.81 | O99: 0.14499999999999999 | P99: 98.41 | Q99: 转股中 | R99: 5.34年 | S99: 3.34年 | T99: 5 | U99: 19 | V99: 3.3000000000000002e-002 | W99: 0.11699999999999999 | X99: 0.115 | Y99: 43 | Z99: 2.58 | AA99: 1.49e-002 | AB99: 7.8000000000000005e-003 | AC99: -2.1299999999999999e-002 | AD99: -2.3700000000000002e-002 | AE99: 81.95 | AF99: 84.28 | AG99: 0.65 | AH99: A+ | AI99: 7.3200000000000001e-002 | AJ99: =H99+100*O99 -> 127.2 | AK99: 127 | AL99: 27 | AM99: 42.7 | AN99: 120 | AO99: -6.9999999999999993e-003 | AP99: 14 | AQ99: 北陆转债!
A100: 256 | B100: 128076 | C100: 金轮转债! | D100: 2722 | E100: 金轮股份 | F100: 机械装备 | G100: 专用设备 | H100: 108.188 | I100: 1.8e-003 | J100: 1.1999999999999999e-003 | K100: 12.13 | L100: 6.6e-003 | M100: 114.9 | N100: 14.66 | O100: 0.308 | P100: 82.74 | Q100: 转股中 | R100: 4.19年 | S100: 2.19年 | T100: 2.14 | U100: 1.8 | V100: 8.0000000000000002e-003 | W100: 0.10000000000000001 | X100: 8.3000000000000004e-002 | Y100: 21 | Z100: 1.13 | AA100: 1.4800000000000001e-002 | AB100: 8.3000000000000001e-003 | AC100: -1.9199999999999998e-002 | AD100: -2.2000000000000002e-002 | AE100: 90.1 | AF100: 90.2 | AG100: 0.44 | AH100: AA- | AI100: 6.0899999999999996e-002 | AJ100: =H100+100*O100 -> 138.988 | AK100: 133.6 | AL100: 73 | AM100: 43.4 | AN100: 125 | AO100: 1.4999999999999999e-002 | AP100: 39 | AQ100: 金轮转债!
A101: 62 | B101: 128143 | C101: 锋龙转债! | D101: 2931 | E101: 锋龙股份 | F101: 机械装备 | G101: 专用设备 | H101: 112.59 | I101: 6.6e-003 | J101: 3.2000000000000002e-003 | K101: 11.76 | L101: 1.55e-002 | M101: 121.7 | N101: 12.73 | O101: 0.21899999999999997 | P101: 92.38 | Q101: 转股中 | R101: 5.42年 | S101: 3.43年 | T101: 2.45 | U101: 3.7 | V101: 1.3000000000000001e-002 | W101: 0.105 | X101: 9.6999999999999989e-002 | Y101: 23 | Z101: 2.67 | AA101: 1.4800000000000001e-002 | AB101: 7.8000000000000005e-003 | AC101: -2.0499999999999997e-002 | AD101: -2.29e-002 | AE101: 81.45 | AF101: 83.76 | AG101: 0.62 | AH101: A+ | AI101: 7.3200000000000001e-002 | AJ101: =H101+100*O101 -> 134.49000000000001 | AK101: 132.8 | AL101: 64 | AM101: 49 | AN101: 164 | AO101: -1.9e-002 | AP101: 13 | AQ101: 锋龙转债!
A102: 24 | B102: 110080 | C102: 东湖转债 | D102: 600133 | E102: 东湖高新 | F102: 建筑 | G102: 建筑工程 | H102: 106.03 | I102: 2.2000000000000001e-003 | J102: 4.5000000000000005e-003 | K102: 5.7 | L102: 1.24e-002 | M102: 115.1 | N102: 6.05 | O102: 0.125 | P102: 94.21 | Q102: 2月11天 | R102: 5.68年 | S102: 3.68年 | T102: 15.5 | U102: 22 | V102: 1.3999999999999999e-002 | W102: 0.34200000000000003 | X102: 0.32200000000000001 | Y102: 45 | Z102: 0.84 | AA102: 1.4800000000000001e-002 | AB102: 1.e-002 | AC102: -6.0000000000000001e-003 | AD102: -7.8000000000000005e-003 | AE102: 88.81 | AF102: 91.89 | AG102: 0.54 | AH102: AA | AI102: 4.1200000000000001e-002 | AJ102: =H102+100*O102 -> 118.53 | AK102: 117.8 | AL102: 6 | AM102: 26 | AN102: 16 | AO102: -4.0000000000000001e-003 | AP102: 22 | AQ102: 东湖转债
A103: 220 | B103: 113565 | C103: 宏辉转债 | D103: 603336 | E103: 宏辉果蔬 | F103: 农业 | G103: 农产品加 | H103: 110.47 | I103: 5.6000000000000008e-003 | J103: -4.0999999999999995e-003 | K103: 6.93 | L103: 2.8999999999999998e-003 | M103: 117.8 | N103: 7.64 | O103: 0.218 | P103: 90.71 | Q103: 转股中 | R103: 4.56年 | S103: 2.56年 | T103: 2.25 | U103: 15 | V103: 6.2e-002 | W103: 7.400000000000001e-002 | X103: 6.7000000000000004e-002 | Y103: 30 | Z103: 2.24 | AA103: 1.4499999999999999e-002 | AB103: 7.4999999999999997e-003 | AC103: -2.3099999999999999e-002 | AD103: -2.5699999999999997e-002 | AE103: 88.45 | AF103: 90.54 | AG103: 0.53 | AH103: AA- | AI103: 6.0899999999999996e-002 | AJ103: =H103+100*O103 -> 132.27000000000001 | AK103: 130.2 | AL103: 44 | AM103: 39.7 | AN103: 94 | AO103: 4.9000000000000002e-002 | AP103: 25 | AQ103: 宏辉转债
A104: 142 | B104: 123063 | C104: 大禹转债 | D104: 300021 | E104: 大禹节水 | F104: 化工 | G104: 橡胶塑料 | H104: 117.713 | I104: -4.0999999999999995e-003 | J104: -1.8e-003 | K104: 5.27 | L104: -9.3999999999999986e-003 | M104: 126.1 | N104: 4.83 | O104: 7.9000000000000001e-002 | P104: 109.11 | Q104: 转股中 | R104: 4.97年 | S104: 3.98年 | T104: 6.35 | U104: 27 | V104: 3.6000000000000004e-002 | W104: 0.14999999999999999 | X104: 0.16399999999999998 | Y104: 42 | Z104: 2.77 | AA104: 1.4199999999999999e-002 | AB104: 5.4000000000000003e-003 | AC104: -2.4e-002 | AD104: -2.69e-002 | AE104: 83.79 | AF104: 94.54 | AG104: 0.63 | AH104: AA- | AI104: 6.0899999999999996e-002 | AJ104: =H104+100*O104 -> 125.613 | AK104: 126.3 | AL104: 25 | AM104: 31.8 | AN104: 34 | AO104: -3.0000000000000001e-003 | AP104: 18 | AQ104: 大禹转债
A105: 335 | B105: 128037 | C105: 岩土转债! | D105: 2542 | E105: 中化岩土 | F105: 建筑 | G105: 建筑工程 | H105: 107.504 | I105: 0. | J105: 1.1000000000000001e-003 | K105: 2.76 | L105: 3.5999999999999999e-003 | M105: 111.3 | N105: 3.1 | O105: 0.20699999999999999 | P105: 89.03 | Q105: 转股中 | R105: 2.60年 | S105: 0.61年 | T105: 5.99 | U105: 9.4 | V105: 1.4999999999999999e-002 | W105: 0.12 | X105: 0.107 | Y105: 50 | Z105: 1.26 | AA105: 1.3600000000000001e-002 | AB105: 5.5000000000000005e-003 | AC105: -6.8400000000000002e-002 | AD105: -7.2599999999999998e-002 | AE105: 98.89 | AF105: 101.06 | AG105: 0.32 | AH105: AA | AI105: 3.8399999999999997e-002 | AJ105: =H105+100*O105 -> 128.20400000000001 | AK105: 126 | AL105: 24 | AM105: 24.9 | AN105: 8 | AO105: -2.1000000000000001e-002 | AP105: 50 | AQ105: 岩土转债!
A106: 92 | B106: 113609 | C106: 永安转债! | D106: 603776 | E106: 永安行 | F106: 城市公用 | G106: 其他 | H106: 112.41 | I106: 3.8e-003 | J106: -5.0000000000000001e-003 | K106: 16.3 | L106: -1.8e-003 | M106: 120.5 | N106: 16.48 | O106: 0.13699999999999998 | P106: 98.91 | Q106: 转股中 | R106: 5.30年 | S106: 3.30年 | T106: 7.35 | U106: 26 | V106: 3.1e-002 | W106: 0.193 | X106: 0.191 | Y106: 38 | Z106: 0.97 | AA106: 1.3500000000000002e-002 | AB106: 6.7000000000000002e-003 | AC106: -2.2799999999999997e-002 | AD106: -2.4900000000000002e-002 | AE106: 84.43 | AF106: 88.11 | AG106: 0.62 | AH106: AA- | AI106: 6.2199999999999998e-002 | AJ106: =H106+100*O106 -> 126.11 | AK106: 125.9 | AL106: 23 | AM106: 37.8 | AN106: 75 | AO106: -8.1000000000000003e-002 | AP106: 24 | AQ106: 永安转债!
A107: 128 | B107: 128129 | C107: 青农转债! | D107: 2958 | E107: 青农商行 | F107: 金融 | G107: 银行行业 | H107: 105.046 | I107: -1.9e-003 | J107: 1.9e-003 | K107: 3.87 | L107: 0. | M107: 112.2 | N107: 4.32 | O107: 0.17300000000000001 | P107: 89.58 | Q107: 转股中 | R107: 5年18天 | S107: 无权 | T107: 50 | U107: 43 | V107: 8.0000000000000002e-003 | W107: 0.23300000000000001 | X107: 0.20800000000000002 | Y107: 215 | Z107: 0.79 | AA107: 1.3300000000000001e-002 | AB107: 8.8000000000000005e-003 | AC107: 无权 | AD107: 无权 | AE107: 无权 | AF107: 94.94 | AG107: 0.46 | AH107: AAA | AI107: 3.4200000000000001e-002 | AJ107: =H107+100*O107 -> 122.346 | AK107: 120.5 | AL107: 7 | AM107: 25.6 | AN107: 14 | AO107: -3.4000000000000002e-002 | AP107: 17 | AQ107: 青农转债!
A108: 102 | B108: 110076 | C108: 华海转债! | D108: 600521 | E108: 华海药业 | F108: 医药 | G108: 医药行业 | H108: 107.7 | I108: 2.e-003 | J108: -1.1999999999999999e-003 | K108: 19.1 | L108: 6.8999999999999999e-003 | M108: 115.1 | N108: 33.85 | O108: 0.90900000000000003 | P108: 56.43 | Q108: 转股中 | R108: 5.24年 | S108: 3.24年 | T108: 18.4 | U108: 2.6 | V108: 1.e-003 | W108: 6.5000000000000002e-002 | X108: 3.6000000000000004e-002 | Y108: 285 | Z108: 4.26 | AA108: 1.3000000000000001e-002 | AB108: 7.8000000000000005e-003 | AC108: -1.1399999999999999e-002 | AD108: -1.34e-002 | AE108: 90.4 | AF108: 93.54 | AG108: 0.12 | AH108: AA | AI108: 4.1200000000000001e-002 | AJ108: =H108+100*O108 -> 198.60000000000002 | AK108: 159 | AL108: 269 | AM108: 65.4 | AN108: 259 | AO108: -6.8000000000000005e-002 | AP108: 7 | AQ108: 华海转债!
A109: 336 | B109: 127006 | C109: 敖东转债! | D109: 623 | E109: 吉林敖东 | F109: 金融 | G109: 证券行业 | H109: 104 | I109: -3.8e-003 | J109: 3.9000000000000003e-003 | K109: 15.29 | L109: 7.000000000000001e-004 | M109: 107.4 | N109: 20.22 | O109: 0.375 | P109: 75.62 | Q109: 转股中 | R109: 2.60年 | S109: 0.60年 | T109: 24.1 | U109: 13 | V109: 5.0000000000000001e-003 | W109: 0.13500000000000001 | X109: 0.10199999999999999 | Y109: 178 | Z109: 0.77 | AA109: 1.26e-002 | AB109: 7.0999999999999995e-003 | AC109: -3.6699999999999997e-002 | AD109: -3.9300000000000002e-002 | AE109: 98.56 | AF109: 98.71 | AG109: 0.16 | AH109: AA+ | AI109: 3.3399999999999999e-002 | AJ109: =H109+100*O109 -> 141.5 | AK109: 132.4 | AL109: 60 | AM109: 33.7 | AN109: 42 | AO109: 4.0000000000000001e-003 | AP109: 28 | AQ109: 敖东转债!
A110: 265 | B110: 113542 | C110: 好客转债 | D110: 603898 | E110: 好莱客 | F110: 其他 | G110: 家居用品 | H110: 108.86 | I110: 0. | J110: -1.1999999999999999e-003 | K110: 11.63 | L110: -6.0000000000000001e-003 | M110: 114.3 | N110: 16.14 | O110: 0.51100000000000001 | P110: 72.06 | Q110: 转股中 | R110: 3.99年 | S110: 1.99年 | T110: 6.03 | U110: 5.7 | V110: 9.0000000000000011e-003 | W110: 0.16600000000000001 | X110: 0.12 | Y110: 36 | Z110: 1.41 | AA110: 1.2500000000000001e-002 | AB110: 6.0000000000000001e-003 | AC110: -2.64e-002 | AD110: -2.8900000000000002e-002 | AE110: 94.55 | AF110: 98.07 | AG110: 0.21 | AH110: AA | AI110: 3.9900000000000005e-002 | AJ110: =H110+100*O110 -> 159.96000000000001 | AK110: 145.7 | AL110: 196 | AM110: 47.6 | AN110: 149 | AO110: -7.0999999999999994e-002 | AP110: 16 | AQ110: 好客转债
A111: 59 | B111: 113619 | C111: 世运转债! | D111: 603920 | E111: 世运电路 | F111: 电子 | G111: 元器件制 | H111: 107.85 | I111: 8.0000000000000002e-003 | J111: -5.0000000000000001e-003 | K111: 13.91 | L111: 1.1599999999999999e-002 | M111: 115.2 | N111: 19.92 | O111: 0.54400000000000004 | P111: 69.83 | Q111: 转股中 | R111: 5.46年 | S111: 3.46年 | T111: 10 | U111: 76 | V111: 7.0999999999999994e-002 | W111: 0.13500000000000001 | X111: 9.4e-002 | Y111: 74 | Z111: 2.09 | AA111: 1.24e-002 | AB111: 7.3000000000000001e-003 | AC111: -1.09e-002 | AD111: -1.2800000000000001e-002 | AE111: 89.71 | AF111: 92.82 | AG111: 0.27 | AH111: AA | AI111: 4.1200000000000001e-002 | AJ111: =H111+100*O111 -> 162.25 | AK111: 145.9 | AL111: 198 | AM111: 53 | AN111: 192 | AO111: 5.2999999999999999e-002 | AP111: 5 | AQ111: 世运转债!
A112: 281 | B112: 113024 | C112: 核建转债! | D112: 601611 | E112: 中国核建 | F112: 建筑 | G112: 建筑工程 | H112: 104.77 | I112: 2.0000000000000001e-004 | J112: 4.0000000000000002e-004 | K112: 7.23 | L112: 2.8000000000000004e-003 | M112: 109.3 | N112: 9.7 | O112: 0.40600000000000003 | P112: 74.54 | Q112: 转股中 | R112: 3.67年 | S112: 1.67年 | T112: 30 | U112: 13 | V112: 4.0000000000000001e-003 | W112: 0.156 | X112: 0.11699999999999999 | Y112: 192 | Z112: 1.62 | AA112: 1.18e-002 | AB112: 6.9999999999999993e-003 | AC112: -1.04e-002 | AD112: -1.3300000000000001e-002 | AE112: 96.91 | AF112: 97.29 | AG112: 0.21 | AH112: AAA | AI112: 3.2899999999999999e-002 | AJ112: =H112+100*O112 -> 145.37 | AK112: 135 | AL112: 90 | AM112: 37.7 | AN112: 74 | AO112: 3.2000000000000001e-002 | AP112: 35 | AQ112: 核建转债!
A113: 270 | B113: 113027 | C113: 华钰转债!! | D113: 601020 | E113: ST华钰 | F113: 有色金属 | G113: 锌铅镍锡 | H113: 109.64 | I113: 2.3900000000000001e-002 | J113: 2.5999999999999999e-003 | K113: 8.69 | L113: 4.9500000000000002e-002 | M113: 114.3 | N113: 10.17 | O113: 0.28300000000000003 | P113: 85.45 | Q113: 转股中 | R113: 3.85年 | S113: 1.86年 | T113: 3.25 | U113: 95 | V113: 0.26700000000000002 | W113: 6.8000000000000005e-002 | X113: 5.7999999999999996e-002 | Y113: 48 | Z113: 1.94 | AA113: 1.11e-002 | AB113: 4.3e-003 | AC113: -3.1600000000000003e-002 | AD113: -3.4200000000000001e-002 | AE113: 87.78 | AF113: 84.88 | AG113: 0.54 | AH113: A | AI113: 8.1900000000000001e-002 | AJ113: =H113+100*O113 -> 137.94 | AK113: 133.8 | AL113: 75 | AM113: 46.1 | AN113: 139 | AO113: -1.e-003 | AP113: 46 | AQ113: 华钰转债!!
A114: 252 | B114: 127014 | C114: 北方转债! | D114: 65 | E114: 北方国际 | F114: 建筑 | G114: 建筑工程 | H114: 109.998 | I114: -3.5999999999999999e-003 | J114: 3.2000000000000002e-003 | K114: 7.19 | L114: -1.4000000000000002e-003 | M114: 115.1 | N114: 8.65 | O114: 0.32299999999999995 | P114: 83.12 | Q114: 转股中 | R114: 4.22年 | S114: 2.22年 | T114: 5.35 | U114: 4.5 | V114: 8.0000000000000002e-003 | W114: 9.6000000000000002e-002 | X114: 8.0000000000000002e-002 | Y114: 56 | Z114: 1 | AA114: 1.11e-002 | AB114: 4.5000000000000005e-003 | AC114: -2.5099999999999997e-002 | AD114: -2.7999999999999997e-002 | AE114: 95.57 | AF114: 99.94 | AG114: 0.32 | AH114: AA+ | AI114: 3.49e-002 | AJ114: =H114+100*O114 -> 142.298 | AK114: 136.9 | AL114: 111 | AM114: 36.9 | AN114: 66 | AO114: -6.3e-002 | AP114: 18 | AQ114: 北方转债!
A115: 143 | B115: 128124 | C115: 科华转债! | D115: 2022 | E115: 科华生物 | F115: 医药 | G115: 生物制药 | H115: 104.2 | I115: 2.9999999999999997e-004 | J115: -6.8000000000000005e-003 | K115: 14.25 | L115: -2.86e-002 | M115: 110 | N115: 21.3 | O115: 0.55799999999999994 | P115: 66.9 | Q115: 转股中 | R115: 4.97年 | S115: 2.98年 | T115: 7.38 | U115: 23 | V115: 2.9999999999999999e-002 | W115: 0.10099999999999999 | X115: 6.7000000000000004e-002 | Y115: 73 | Z115: 2.2 | AA115: 1.11e-002 | AB115: 7.3000000000000001e-003 | AC115: -4.5000000000000005e-003 | AD115: -6.1999999999999998e-003 | AE115: 90.94 | AF115: 90.82 | AG115: 0.23 | AH115: AA | AI115: 3.9900000000000005e-002 | AJ115: =H115+100*O115 -> 160. | AK115: 141.5 | AL115: 157 | AM115: 50.6 | AN115: 176 | AO115: -2.4e-002 | AP115: 21 | AQ115: 科华转债!
A116: 187 | B116: 128107 | C116: 交科转债 | D116: 2061 | E116: 浙江交科 | F116: 建筑 | G116: 建筑工程 | H116: 109.492 | I116: -1.23e-002 | J116: 1.1299999999999999e-002 | K116: 5 | L116: -2.e-003 | M116: 114.9 | N116: 5.24 | O116: 0.14699999999999999 | P116: 95.42 | Q116: 转股中 | R116: 4.71年 | S116: 2.71年 | T116: 25 | U116: 37 | V116: 1.3000000000000001e-002 | W116: 0.36299999999999999 | X116: 0.34700000000000003 | Y116: 69 | Z116: 0.8 | AA116: 1.0500000000000001e-002 | AB116: 4.6999999999999993e-003 | AC116: -1.9799999999999998e-002 | AD116: -2.2099999999999998e-002 | AE116: 93.77 | AF116: 98.07 | AG116: 0.48 | AH116: AA+ | AI116: 3.49e-002 | AJ116: =H116+100*O116 -> 124.19200000000001 | AK116: 123.6 | AL116: 13 | AM116: 25.5 | AN116: 13 | AO116: -1.6e-002 | AP116: 19 | AQ116: 交科转债
A117: 37 | B117: 123106 | C117: 正丹转债! | D117: 300641 | E117: 正丹股份 | F117: 化工 | G117: 化工 | H117: 118.5 | I117: 8.1000000000000013e-003 | J117: -4.8999999999999998e-003 | K117: 7.56 | L117: 5.3e-003 | M117: 125.5 | N117: 7.5 | O117: 0.17600000000000002 | P117: 100.8 | Q117: 55天 | R117: 5.63年 | S117: 3.63年 | T117: 3.2 | U117: 20 | V117: 5.4000000000000006e-002 | W117: 8.5999999999999993e-002 | X117: 8.6999999999999994e-002 | Y117: 37 | Z117: 2.66 | AA117: 1.04e-002 | AB117: 2.8999999999999998e-003 | AC117: -3.4500000000000003e-002 | AD117: -3.6299999999999999e-002 | AE117: 82.77 | AF117: 89.93 | AG117: 0.61 | AH117: AA- | AI117: 6.2199999999999998e-002 | AJ117: =H117+100*O117 -> 136.09999999999999 | AK117: 136.2 | AL117: 101 | AM117: 46.3 | AN117: 141 | AO117: -3.5000000000000003e-002 | AP117: 14 | AQ117: 正丹转债!
A118: 229 | B118: 113561 | C118: 正裕转债! | D118: 603089 | E118: 正裕工业 | F118: 汽车 | G118: 零部件制 | H118: 112.92 | I118: 4.6999999999999993e-003 | J118: -1.26e-002 | K118: 8.99 | L118: -1.43e-002 | M118: 118 | N118: 10.08 | O118: 0.26600000000000001 | P118: 89.19 | Q118: 转股中 | R118: 4.40年 | S118: 2.40年 | T118: 1.5 | U118: 9.9 | V118: 5.7999999999999996e-002 | W118: 7.4999999999999997e-002 | X118: 6.7000000000000004e-002 | Y118: 20 | Z118: 1.88 | AA118: 1.03e-002 | AB118: 3.0000000000000001e-003 | AC118: -3.1300000000000001e-002 | AD118: -3.4300000000000004e-002 | AE118: 87.36 | AF118: 87.63 | AG118: 0.55 | AH118: A+ | AI118: 7.1900000000000006e-002 | AJ118: =H118+100*O118 -> 139.52000000000001 | AK118: 136.7 | AL118: 105 | AM118: 49 | AN118: 163 | AO118: 3.0000000000000001e-003 | AP118: 36 | AQ118: 正裕转债!
A119: 171 | B119: 113588 | C119: 润达转债! | D119: 603108 | E119: 润达医疗 | F119: 医药 | G119: 医疗器械 | H119: 108.59 | I119: 1.47e-002 | J119: -1.24e-002 | K119: 10.38 | L119: 6.8000000000000005e-003 | M119: 113.9 | N119: 13.25 | O119: 0.38600000000000001 | P119: 78.34 | Q119: 转股中 | R119: 4.86年 | S119: 2.86年 | T119: 5.5 | U119: 11 | V119: 1.8000000000000002e-002 | W119: 9.0999999999999998e-002 | X119: 7.2000000000000008e-002 | Y119: 60 | Z119: 1.89 | AA119: 1.01e-002 | AB119: 4.7999999999999996e-003 | AC119: -1.61e-002 | AD119: -1.83e-002 | AE119: 91.93 | AF119: 94.51 | AG119: 0.33 | AH119: AA | AI119: 3.9900000000000005e-002 | AJ119: =H119+100*O119 -> 147.19 | AK119: 138.8 | AL119: 135 | AM119: 44.3 | AN119: 130 | AO119: -3.7000000000000005e-002 | AP119: 11 | AQ119: 润达转债!
A120: 354 | B120: 128021 | C120: 兄弟转债!! | D120: 2562 | E120: 兄弟科技 | F120: 医药 | G120: 原料药 | H120: 106.398 | I120: 3.9000000000000003e-003 | J120: -3.9000000000000003e-003 | K120: 3.64 | L120: 0. | M120: 108.8 | N120: 5.19 | O120: 0.51700000000000002 | P120: 70.13 | Q120: 转股中 | R120: 2.31年 | S120: 0.31年 | T120: 2.65 | U120: 8.4 | V120: 2.9999999999999999e-002 | W120: 6.9000000000000006e-002 | X120: 4.8000000000000001e-002 | Y120: 39 | Z120: 1.3 | AA120: 9.8999999999999991e-003 | AB120: 2.5999999999999999e-003 | AC120: -0.10300000000000001 | AD120: -0.109 | AE120: 99.74 | AF120: 99.77 | AG120: 0 | AH120: AA | AI120: 3.8399999999999997e-002 | AJ120: =H120+100*O120 -> 158.09800000000001 | AK120: 142.7 | AL120: 172 | AM120: 42.9 | AN120: 122 | AO120: -3.3000000000000002e-002 | AP120: 17 | AQ120: 兄弟转债!!
A121: 217 | B121: 113567 | C121: 君禾转债! | D121: 603617 | E121: 君禾股份 | F121: 机械装备 | G121: 通用设备 | H121: 113.74 | I121: 0. | J121: -5.9999999999999995e-004 | K121: 10.63 | L121: -8.9999999999999998e-004 | M121: 118.8 | N121: 11.16 | O121: 0.19399999999999998 | P121: 95.25 | Q121: 转股中 | R121: 4.57年 | S121: 2.58年 | T121: 2.1 | U121: 2.6 | V121: 1.1000000000000001e-002 | W121: 9.9000000000000005e-002 | X121: 9.4e-002 | Y121: 21 | Z121: 3 | AA121: 9.7999999999999997e-003 | AB121: 2.5000000000000001e-003 | AC121: -3.2599999999999997e-002 | AD121: -3.5200000000000002e-002 | AE121: 86.14 | AF121: 87.14 | AG121: 0.61 | AH121: A+ | AI121: 7.1900000000000006e-002 | AJ121: =H121+100*O121 -> 133.13999999999999 | AK121: 132.2 | AL121: 57 | AM121: 45.1 | AN121: 134 | AO121: 3.9e-002 | AP121: 33 | AQ121: 君禾转债!
A122: 108 | B122: 113605 | C122: 大参转债! | D122: 603233 | E122: 大参林 | F122: 医药 | G122: 医药商业 | H122: 110.02 | I122: -1.1200000000000002e-002 | J122: 8.3000000000000001e-003 | K122: 39.97 | L122: -2.5600000000000001e-002 | M122: 115.2 | N122: 69.09 | O122: 0.90200000000000002 | P122: 57.85 | Q122: 转股中 | R122: 5.21年 | S122: 3.21年 | T122: 14.1 | U122: 20 | V122: 1.3000000000000001e-002 | W122: 4.4000000000000004e-002 | X122: 2.6000000000000002e-002 | Y122: 316 | Z122: 4.92 | AA122: 9.0000000000000011e-003 | AB122: 3.8e-003 | AC122: -1.7500000000000002e-002 | AD122: -1.9599999999999999e-002 | AE122: 90.61 | AF122: 93.75 | AG122: 0.12 | AH122: AA | AI122: 4.1200000000000001e-002 | AJ122: =H122+100*O122 -> 200.22 | AK122: 162.2 | AL122: 279 | AM122: 68.4 | AN122: 271 | AO122: -8.0000000000000002e-002 | AP122: 7 | AQ122: 大参转债!
A123: 33 | B123: 123107 | C123: 温氏转债! | D123: 300498 | E123: 温氏股份 | F123: 农业 | G123: 畜牧业 | H123: 107.55 | I123: -1.1999999999999999e-003 | J123: -8.0000000000000004e-004 | K123: 13.06 | L123: -6.8000000000000005e-003 | M123: 113 | N123: 17.62 | O123: 0.45100000000000001 | P123: 74.12 | Q123: 2月3天 | R123: 5.64年 | S123: 3.65年 | T123: 93 | U123: 36 | V123: 4.0000000000000001e-003 | W123: 0.11199999999999999 | X123: 8.3000000000000004e-002 | Y123: 832 | Z123: 1.81 | AA123: 9.0000000000000011e-003 | AB123: 4.6999999999999993e-003 | AC123: -1.01e-002 | AD123: -1.18e-002 | AE123: 91.14 | AF123: 93.78 | AG123: 0.29 | AH123: AAA | AI123: 3.4200000000000001e-002 | AJ123: =H123+100*O123 -> 152.65000000000001 | AK123: 141 | AL123: 152 | AM123: 47.2 | AN123: 145 | AO123: -4.0000000000000001e-003 | AP123: 10 | AQ123: 温氏转债!
A124: 43 | B124: 123104 | C124: 卫宁转债 | D124: 300253 | E124: 卫宁健康 | F124: 计算机及 | G124: 软件开发 | H124: 119.34 | I124: -6.3e-003 | J124: -3.5999999999999999e-003 | K124: 13.93 | L124: -3.2599999999999997e-002 | M124: 125.1 | N124: 17.74 | O124: 0.52000000000000002 | P124: 78.52 | Q124: 47天 | R124: 5.61年 | S124: 3.61年 | T124: 9.7 | U124: 14 | V124: 1.2e-002 | W124: 3.3000000000000002e-002 | X124: 2.6000000000000002e-002 | Y124: 298 | Z124: 6.53 | AA124: 8.6e-003 | AB124: 1.1000000000000001e-003 | AC124: -3.7000000000000005e-002 | AD124: -3.8800000000000001e-002 | AE124: 89.07 | AF124: 100.14 | AG124: 0.3 | AH124: AA | AI124: 4.1200000000000001e-002 | AJ124: =H124+100*O124 -> 171.34 | AK124: 160.2 | AL124: 273 | AM124: 60 | AN124: 236 | AO124: -0.126 | AP124: 4 | AQ124: 卫宁转债
A125: 25 | B125: 127032 | C125: 苏行转债 | D125: 2966 | E125: 苏州银行 | F125: 金融 | G125: 银行行业 | H125: 109.694 | I125: 8.9999999999999998e-004 | J125: -1.4000000000000002e-003 | K125: 6.77 | L125: -1.5e-003 | M125: 115.1 | N125: 8.1 | O125: 0.312 | P125: 83.58 | Q125: 2月13天 | R125: 5.68年 | S125: 无权 | T125: 50 | U125: 17 | V125: 3.0000000000000001e-003 | W125: 0.222 | X125: 0.185 | Y125: 226 | Z125: 0.74 | AA125: 8.6e-003 | AB125: 3.8e-003 | AC125: 无权 | AD125: 无权 | AE125: 无权 | AF125: 95.39 | AG125: 0.39 | AH125: AAA | AI125: 3.4200000000000001e-002 | AJ125: =H125+100*O125 -> 140.89400000000001 | AK125: 135.8 | AL125: 98 | AM125: 40.4 | AN125: 98 | AO125: -7.0999999999999994e-002 | AP125: 7 | AQ125: 苏行转债
A126: 99 | B126: 127024 | C126: 盈峰转债! | D126: 967 | E126: 盈峰环境 | F126: 机械装备 | G126: 专用设备 | H126: 111.85 | I126: 1.3899999999999999e-002 | J126: -2.0299999999999999e-002 | K126: 6.23 | L126: -2.35e-002 | M126: 116.8 | N126: 8.19 | O126: 0.46999999999999997 | P126: 76.07 | Q126: 转股中 | R126: 5.25年 | S126: 3.25年 | T126: 14.8 | U126: 37 | V126: 2.2000000000000002e-002 | W126: 7.4999999999999997e-002 | X126: 5.7000000000000002e-002 | Y126: 197 | Z126: 1.17 | AA126: 8.3999999999999995e-003 | AB126: 2.7000000000000001e-003 | AC126: -2.3199999999999998e-002 | AD126: -2.5000000000000001e-002 | AE126: 91.58 | AF126: 97.24 | AG126: 0.27 | AH126: AA+ | AI126: 3.6200000000000003e-002 | AJ126: =H126+100*O126 -> 158.84999999999999 | AK126: 147.6 | AL126: 209 | AM126: 50.4 | AN126: 174 | AO126: -3.7000000000000005e-002 | AP126: 5 | AQ126: 盈峰转债!
A127: 365 | B127: 128014 | C127: 永东转债! | D127: 2753 | E127: 永东股份 | F127: 化工 | G127: 化工 | H127: 108.301 | I127: 7.4000000000000003e-003 | J127: -3.0000000000000001e-003 | K127: 9.85 | L127: 2.6000000000000002e-002 | M127: 109.8 | N127: 12.52 | O127: 0.377 | P127: 78.67 | Q127: 转股中 | R127: 1.70年 | S127: 回售内 | T127: 3.37 | U127: 4.3 | V127: 1.2e-002 | W127: 9.0999999999999998e-002 | X127: 7.2000000000000008e-002 | Y127: 37 | Z127: 1.86 | AA127: 8.199999999999999e-003 | AB127: -2.5000000000000001e-003 | AC127: 回售内 | AD127: 回售内 | AE127: 100.3 | AF127: 99.66 | AG127: 0.17 | AH127: AA- | AI127: 5.9400000000000001e-002 | AJ127: =H127+100*O127 -> 146.001 | AK127: 137.9 | AL127: 127 | AM127: 37.6 | AN127: 73 | AO127: 1.1000000000000001e-002 | AP127: 36 | AQ127: 永东转债!
A128: 234 | B128: 113030 | C128: 东风转债! | D128: 601515 | E128: 东风股份 | F128: 造纸包装 | G128: 包装材料 | H128: 112.88 | I128: 4.0000000000000002e-004 | J128: -5.4000000000000003e-003 | K128: 5.85 | L128: -1.18e-002 | M128: 116.9 | N128: 6.45 | O128: 0.245 | P128: 90.7 | Q128: 转股中 | R128: 4.38年 | S128: 2.39年 | T128: 2.95 | U128: 2.4 | V128: 6.9999999999999993e-003 | W128: 3.7999999999999999e-002 | X128: 3.4000000000000002e-002 | Y128: 78 | Z128: 1.69 | AA128: 8.199999999999999e-003 | AB128: 1.2999999999999999e-003 | AC128: -3.4099999999999998e-002 | AD128: -3.6600000000000001e-002 | AE128: 93.68 | AF128: 98.83 | AG128: 0.42 | AH128: AA | AI128: 3.9900000000000005e-002 | AJ128: =H128+100*O128 -> 137.38 | AK128: 135.1 | AL128: 92 | AM128: 36.2 | AN128: 58 | AO128: -3.4000000000000002e-002 | AP128: 18 | AQ128: 东风转债!
A129: 112 | B129: 128135 | C129: 洽洽转债! | D129: 2557 | E129: 洽洽食品 | F129: 食品饮料 | G129: 休闲食品 | H129: 115.271 | I129: 3.7000000000000002e-003 | J129: -6.8999999999999999e-003 | K129: 39.05 | L129: -2.0099999999999996e-002 | M129: 120.2 | N129: 60.03 | O129: 0.77200000000000002 | P129: 65.05 | Q129: 转股中 | R129: 5.20年 | S129: 3.21年 | T129: 13.4 | U129: 14 | V129: 9.0000000000000011e-003 | W129: 6.8000000000000005e-002 | X129: 4.4000000000000004e-002 | Y129: 198 | Z129: 4.63 | AA129: 8.199999999999999e-003 | AB129: 1.5e-003 | AC129: -3.1200000000000002e-002 | AD129: -3.32e-002 | AE129: 90.63 | AF129: 97.82 | AG129: 0.16 | AH129: AA | AI129: 4.1200000000000001e-002 | AJ129: =H129+100*O129 -> 192.471 | AK129: 165.5 | AL129: 285 | AM129: 67.7 | AN129: 266 | AO129: -1.1000000000000001e-002 | AP129: 11 | AQ129: 洽洽转债!
A130: 342 | B130: 128034 | C130: 江银转债! | D130: 2807 | E130: 江阴银行 | F130: 金融 | G130: 银行行业 | H130: 106.18 | I130: -1.e-004 | J130: 1.e-004 | K130: 3.77 | L130: 0. | M130: 108.3 | N130: 4.32 | O130: 0.217 | P130: 87.27 | Q130: 转股中 | R130: 2.48年 | S130: 无权 | T130: 17.6 | U130: 4.4 | V130: 2.e-003 | W130: 0.215 | X130: 0.187 | Y130: 82 | Z130: 0.68 | AA130: 8.1000000000000013e-003 | AB130: 1.8e-003 | AC130: 无权 | AD130: 无权 | AE130: 无权 | AF130: 99.95 | AG130: 0.32 | AH130: AA+ | AI130: 3.3399999999999999e-002 | AJ130: =H130+100*O130 -> 127.88000000000001 | AK130: 125.1 | AL130: 18 | AM130: 25.1 | AN130: 10 | AO130: -2.3e-002 | AP130: 25 | AQ130: 江银转债!
A131: 63 | B131: 127028 | C131: 英特转债! | D131: 411 | E131: 英特集团 | F131: 医药 | G131: 医药商业 | H131: 108.8 | I131: -4.8999999999999998e-003 | J131: -8.3999999999999995e-003 | K131: 12.59 | L131: -2.5499999999999998e-002 | M131: 113.1 | N131: 13.4 | O131: 0.158 | P131: 93.96 | Q131: 转股中 | R131: 5.42年 | S131: 3.42年 | T131: 6 | U131: 18 | V131: 2.7999999999999997e-002 | W131: 0.191 | X131: 0.17999999999999999 | Y131: 31 | Z131: 1.84 | AA131: 7.3000000000000001e-003 | AB131: 2.8999999999999998e-003 | AC131: -1.37e-002 | AD131: -1.5600000000000001e-002 | AE131: 91.31 | AF131: 93.63 | AG131: 0.52 | AH131: AA+ | AI131: 3.6200000000000003e-002 | AJ131: =H131+100*O131 -> 124.59999999999999 | AK131: 123.6 | AL131: 14 | AM131: 30 | AN131: 28 | AO131: -5.0000000000000001e-003 | AP131: 22 | AQ131: 英特转债!
A132: 224 | B132: 113563 | C132: 柳药转债! | D132: 603368 | E132: 柳药股份 | F132: 医药 | G132: 医药商业 | H132: 109.5 | I132: 4.5999999999999999e-003 | J132: -1.0200000000000001e-002 | K132: 19.62 | L132: -1.5600000000000001e-002 | M132: 112.9 | N132: 23.87 | O132: 0.33200000000000002 | P132: 82.2 | Q132: 转股中 | R132: 4.45年 | S132: 2.45年 | T132: 8.02 | U132: 17 | V132: 2.e-002 | W132: 0.113 | X132: 9.3000000000000013e-002 | Y132: 71 | Z132: 1.38 | AA132: 6.9999999999999993e-003 | AB132: 1.7000000000000001e-003 | AC132: -2.1899999999999999e-002 | AD132: -2.4399999999999998e-002 | AE132: 93.45 | AF132: 95.23 | AG132: 0.36 | AH132: AA | AI132: 3.9900000000000005e-002 | AJ132: =H132+100*O132 -> 142.69999999999999 | AK132: 136.8 | AL132: 108 | AM132: 41.6 | AN132: 112 | AO132: -2.9999999999999999e-002 | AP132: 16 | AQ132: 柳药转债!
A133: 147 | B133: 110073 | C133: 国投转债 | D133: 600061 | E133: 国投资本 | F133: 金融 | G133: 证券行业 | H133: 106.61 | I133: -1.8e-003 | J133: 1.8e-003 | K133: 7.46 | L133: 0. | M133: 110.3 | N133: 9.9 | O133: 0.41499999999999998 | P133: 75.35 | Q133: 转股中 | R133: 4.96年 | S133: 无权 | T133: 80 | U133: 18 | V133: 2.e-003 | W133: 0.16699999999999998 | X133: 0.126 | Y133: 479 | Z133: 0.73 | AA133: 6.9999999999999993e-003 | AB133: 3.0999999999999999e-003 | AC133: 无权 | AD133: 无权 | AE133: 无权 | AF133: 94.11 | AG133: 0.29 | AH133: AAA | AI133: 3.2899999999999999e-002 | AJ133: =H133+100*O133 -> 148.11000000000001 | AK133: 137.9 | AL133: 125 | AM133: 43.8 | AN133: 127 | AO133: -5.5999999999999994e-002 | AP133: 24 | AQ133: 国投转债
A134: 267 | B134: 128070 | C134: 智能转债! | D134: 2877 | E134: 智能自控 | F134: 机械装备 | G134: 通用设备 | H134: 113.837 | I134: 2.9999999999999997e-004 | J134: 1.1000000000000001e-003 | K134: 6.4 | L134: 4.6999999999999993e-003 | M134: 116.8 | N134: 9.47 | O134: 0.68400000000000005 | P134: 67.58 | Q134: 转股中 | R134: 3.90年 | S134: 无权 | T134: 2.3 | U134: 34 | V134: 0.13 | W134: 0.10800000000000001 | X134: 7.2999999999999995e-002 | Y134: 21 | Z134: 2.88 | AA134: 6.7000000000000002e-003 | AB134: -8.9999999999999998e-004 | AC134: 无权 | AD134: 无权 | AE134: 无权 | AF134: 89.57 | AG134: 0.28 | AH134: A+ | AI134: 7.1900000000000006e-002 | AJ134: =H134+100*O134 -> 182.23700000000002 | AK134: 160.1 | AL134: 272 | AM134: 70.5 | AN134: 282 | AO134: 1.e-003 | AP134: 29 | AQ134: 智能转债!
A135: 346 | B135: 110041 | C135: 蒙电转债! | D135: 600863 | E135: 内蒙华电 | F135: 能源电力 | G135: 电力供应 | H135: 107.66 | I135: -1.e-004 | J135: 1.e-004 | K135: 2.31 | L135: 0. | M135: 109.3 | N135: 2.56 | O135: 0.193 | P135: 90.23 | Q135: 转股中 | R135: 2.38年 | S135: 0.38年 | T135: 18.7 | U135: 10 | V135: 5.0000000000000001e-003 | W135: 0.13900000000000001 | X135: 0.126 | Y135: 134 | Z135: 1.15 | AA135: 6.5000000000000006e-003 | AB135: -8.9999999999999998e-004 | AC135: -0.107 | AD135: -0.113 | AE135: 100.11 | AF135: 101.69 | AG135: 0.34 | AH135: AAA | AI135: 3.1400000000000004e-002 | AJ135: =H135+100*O135 -> 126.95999999999999 | AK135: 125.1 | AL135: 17 | AM135: 23.4 | AN135: 6 | AO135: -2.e-003 | AP135: 13 | AQ135: 蒙电转债!
A136: 250 | B136: 110060 | C136: 天路转债! | D136: 600326 | E136: 西藏天路 | F136: 建筑 | G136: 水泥 | H136: 111.88 | I136: -9.7999999999999997e-003 | J136: 3.2000000000000002e-003 | K136: 6.41 | L136: -1.54e-002 | M136: 114.9 | N136: 7.08 | O136: 0.23600000000000002 | P136: 90.54 | Q136: 转股中 | R136: 4.23年 | S136: 2.23年 | T136: 7.06 | U136: 11 | V136: 1.3999999999999999e-002 | W136: 0.12 | X136: 0.109 | Y136: 59 | Z136: 1.39 | AA136: 6.5000000000000006e-003 | AB136: 1.e-004 | AC136: -3.27e-002 | AD136: -3.5299999999999998e-002 | AE136: 94.25 | AF136: 97.74 | AG136: 0.43 | AH136: AA | AI136: 3.9900000000000005e-002 | AJ136: =H136+100*O136 -> 135.47999999999999 | AK136: 133.2 | AL136: 70 | AM136: 35.5 | AN136: 53 | AO136: -7.8e-002 | AP136: 13 | AQ136: 天路转债!
A137: 227 | B137: 127015 | C137: 希望转债!! | D137: 876 | E137: 新 希 望 | F137: 农业 | G137: 畜牧业 | H137: 107.148 | I137: 6.0999999999999995e-003 | J137: -5.5000000000000005e-003 | K137: 11.73 | L137: 9.4999999999999998e-003 | M137: 110 | N137: 19.75 | O137: 0.80400000000000005 | P137: 59.39 | Q137: 转股中 | R137: 4.41年 | S137: 2.41年 | T137: 9.5 | U137: 12 | V137: 1.2e-002 | W137: 1.8000000000000002e-002 | X137: 1.1000000000000001e-002 | Y137: 528 | Z137: 1.42 | AA137: 6.0999999999999995e-003 | AB137: 1.8e-003 | AC137: -1.66e-002 | AD137: -1.8500000000000003e-002 | AE137: 94.51 | AF137: 95.38 | AG137: 0.06 | AH137: AAA | AI137: 3.2899999999999999e-002 | AJ137: =H137+100*O137 -> 187.548 | AK137: 154.9 | AL137: 250 | AM137: 59.5 | AN137: 232 | AO137: -4.2999999999999997e-002 | AP137: 26 | AQ137: 希望转债!!
A138: 212 | B138: 110067 | C138: 华安转债! | D138: 600909 | E138: 华安证券 | F138: 金融 | G138: 证券行业 | H138: 107.51 | I138: 8.9999999999999998e-004 | J138: -1.6000000000000001e-003 | K138: 5.07 | L138: -2.e-003 | M138: 110.3 | N138: 6.22 | O138: 0.31900000000000001 | P138: 81.51 | Q138: 转股中 | R138: 4.60年 | S138: 无权 | T138: 28 | U138: 13 | V138: 4.0000000000000001e-003 | W138: 0.11800000000000001 | X138: 9.6000000000000002e-002 | Y138: 238 | Z138: 1.28 | AA138: 5.6999999999999993e-003 | AB138: 1.5e-003 | AC138: 无权 | AD138: 无权 | AE138: 无权 | AF138: 95.24 | AG138: 0.35 | AH138: AAA | AI138: 3.2899999999999999e-002 | AJ138: =H138+100*O138 -> 139.41 | AK138: 133.5 | AL138: 71 | AM138: 38.3 | AN138: 78 | AO138: -3.9e-002 | AP138: 26 | AQ138: 华安转债!
A139: 352 | B139: 128023 | C139: 亚太转债! | D139: 2284 | E139: 亚太股份 | F139: 汽车 | G139: 零部件制 | H139: 109.89 | I139: -5.1000000000000004e-003 | J139: 1.8e-003 | K139: 7.98 | L139: -2.0899999999999998e-002 | M139: 111.3 | N139: 10.34 | O139: 0.42399999999999999 | P139: 77.18 | Q139: 转股中 | R139: 2.33年 | S139: 0.33年 | T139: 9.99 | U139: 18 | V139: 1.7000000000000001e-002 | W139: 0.17000000000000001 | X139: 0.13100000000000001 | Y139: 59 | Z139: 2.36 | AA139: 5.6000000000000008e-003 | AB139: -3.4000000000000002e-003 | AC139: -0.159 | AD139: -0.16600000000000001 | AE139: 99.93 | AF139: 102.12 | AG139: 0.16 | AH139: AA | AI139: 3.8399999999999997e-002 | AJ139: =H139+100*O139 -> 152.28999999999999 | AK139: 142.6 | AL139: 171 | AM139: 40.5 | AN139: 99 | AO139: 4.2999999999999997e-002 | AP139: 66 | AQ139: 亚太转债!
A140: 319 | B140: 113516 | C140: 苏农转债! | D140: 603323 | E140: 苏农银行 | F140: 金融 | G140: 银行行业 | H140: 111.6 | I140: 3.4000000000000002e-003 | J140: -1.e-004 | K140: 4.73 | L140: 1.0700000000000001e-002 | M140: 113.3 | N140: 5.37 | O140: 0.26700000000000002 | P140: 88.08 | Q140: 转股中 | R140: 2.99年 | S140: 无权 | T140: 12.9 | U140: 4.1 | V140: 3.0000000000000001e-003 | W140: 0.151 | X140: 0.13300000000000001 | Y140: 85 | Z140: 0.7 | AA140: 5.1000000000000004e-003 | AB140: -2.8999999999999998e-003 | AC140: 无权 | AD140: 无权 | AE140: 无权 | AF140: 102.85 | AG140: 0.31 | AH140: AA+ | AI140: 3.3399999999999999e-002 | AJ140: =H140+100*O140 -> 138.30000000000001 | AK140: 135.1 | AL140: 93 | AM140: 32.3 | AN140: 36 | AO140: 1.4999999999999999e-002 | AP140: 27 | AQ140: 苏农转债!
A141: 160 | B141: 128119 | C141: 龙大转债! | D141: 2726 | E141: 龙大肉食 | F141: 食品饮料 | G141: 肉制品 | H141: 117 | I141: -6.4000000000000003e-003 | J141: 9.1000000000000004e-003 | K141: 9.09 | L141: 5.5000000000000005e-003 | M141: 119.9 | N141: 9.38 | O141: 0.20699999999999999 | P141: 96.91 | Q141: 转股中 | R141: 4.93年 | S141: 2.94年 | T141: 9.46 | U141: 12 | V141: 1.1000000000000001e-002 | W141: 0.10400000000000001 | X141: 0.10099999999999999 | Y141: 91 | Z141: 2.61 | AA141: 5.1000000000000004e-003 | AB141: -1.9e-003 | AC141: -3.9300000000000002e-002 | AD141: -4.1299999999999996e-002 | AE141: 91.68 | AF141: 99.2 | AG141: 0.49 | AH141: AA | AI141: 3.9900000000000005e-002 | AJ141: =H141+100*O141 -> 137.69999999999999 | AK141: 137.1 | AL141: 114 | AM141: 37.9 | AN141: 76 | AO141: -3.6000000000000004e-002 | AP141: 9 | AQ141: 龙大转债!
A142: 49 | B142: 128144 | C142: 利民转债! | D142: 2734 | E142: 利民股份 | F142: 化工 | G142: 农化 | H142: 110.968 | I142: 6.8000000000000005e-003 | J142: -8.9999999999999998e-004 | K142: 10.91 | L142: 1.5800000000000002e-002 | M142: 114.1 | N142: 13.98 | O142: 0.42200000000000004 | P142: 78.04 | Q142: 30天 | R142: 5.57年 | S142: 3.57年 | T142: 9.8 | U142: 3.3 | V142: 3.0000000000000001e-003 | W142: 0.24100000000000002 | X142: 0.188 | Y142: 41 | Z142: 1.48 | AA142: 5.1000000000000004e-003 | AB142: 5.0000000000000001e-004 | AC142: -2.0299999999999999e-002 | AD142: -2.1700000000000001e-002 | AE142: 88.57 | AF142: 91.45 | AG142: 0.37 | AH142: AA | AI142: 4.1200000000000001e-002 | AJ142: =H142+100*O142 -> 153.16800000000001 | AK142: 143.9 | AL142: 182 | AM142: 52.4 | AN142: 190 | AO142: -3.7000000000000005e-002 | AP142: 5 | AQ142: 利民转债!
A143: 40 | B143: 113046 | C143: 金田转债 | D143: 601609 | E143: 金田铜业 | F143: 有色金属 | G143: 铜金属 | H143: 111.85 | I143: 2.1299999999999999e-002 | J143: -1.1000000000000001e-002 | K143: 8.79 | L143: 2.69e-002 | M143: 114.9 | N143: 10.75 | O143: 0.36799999999999999 | P143: 81.77 | Q143: 52天 | R143: 5.62年 | S143: 3.63年 | T143: 15 | U143: 94 | V143: 5.5999999999999994e-002 | W143: 0.115 | X143: 9.4e-002 | Y143: 130 | Z143: 1.88 | AA143: 4.8999999999999998e-003 | AB143: 1.e-004 | AC143: -2.06e-002 | AD143: -2.23e-002 | AE143: 90.46 | AF143: 94.4 | AG143: 0.38 | AH143: AA+ | AI143: 3.6200000000000003e-002 | AJ143: =H143+100*O143 -> 148.64999999999998 | AK143: 141.9 | AL143: 164 | AM143: 47.5 | AN143: 148 | AO143: -6.9999999999999993e-003 | AP143: 12 | AQ143: 金田转债
A144: 202 | B144: 113574 | C144: 华体转债! | D144: 603679 | E144: 华体科技 | F144: 城市公用 | G144: 城市公用 | H144: 113.68 | I144: 1.0800000000000001e-002 | J144: -9.4999999999999998e-003 | K144: 16.81 | L144: 1.6899999999999998e-002 | M144: 115.9 | N144: 33.91 | O144: 1.29 | P144: 49.57 | Q144: 转股中 | R144: 4.65年 | S144: 2.65年 | T144: 2.09 | U144: 70 | V144: 0.28999999999999998 | W144: 8.6999999999999994e-002 | X144: 4.2999999999999997e-002 | Y144: 24 | Z144: 3.09 | AA144: 4.3e-003 | AB144: -1.9e-003 | AC144: -3.1200000000000002e-002 | AD144: -3.3799999999999997e-002 | AE144: 85.77 | AF144: 84.6 | AG144: 0.07 | AH144: A+ | AI144: 7.1900000000000006e-002 | AJ144: =H144+100*O144 -> 242.68000000000001 | AK144: 177.8 | AL144: 306 | AM144: 92 | AN144: 321 | AO144: 5.2999999999999999e-002 | AP144: 19 | AQ144: 华体转债!
A145: 124 | B145: 128131 | C145: 崇达转2! | D145: 2815 | E145: 崇达技术 | F145: 电子 | G145: 元器件制 | H145: 113 | I145: -5.8999999999999999e-003 | J145: 2.7000000000000001e-003 | K145: 13.62 | L145: -1.38e-002 | M145: 115.2 | N145: 19.38 | O145: 0.60799999999999998 | P145: 70.28 | Q145: 转股中 | R145: 5年31天 | S145: 3年32天 | T145: 14 | U145: 4.9 | V145: 3.0000000000000001e-003 | W145: 0.11699999999999999 | X145: 8.199999999999999e-002 | Y145: 119 | Z145: 2.85 | AA145: 3.9000000000000003e-003 | AB145: -1.5e-003 | AC145: -2.63e-002 | AD145: -2.8399999999999998e-002 | AE145: 91.06 | AF145: 94.22 | AG145: 0.24 | AH145: AA | AI145: 4.1200000000000001e-002 | AJ145: =H145+100*O145 -> 173.80000000000001 | AK145: 155.7 | AL145: 256 | AM145: 61.5 | AN145: 242 | AO145: 2.5000000000000001e-002 | AP145: 10 | AQ145: 崇达转2!
A146: 3 | B146: 123118 | C146: 惠城转债 | D146: 300779 | E146: 惠城环保 | F146: 化工 | G146: 其他 | H146: 119.133 | I146: 1.04e-002 | J146: 9.7000000000000003e-003 | K146: 18.57 | L146: 2.7699999999999999e-002 | M146: 121.7 | N146: 17.11 | O146: 9.8000000000000004e-002 | P146: 108.53 | Q146: 5月10天 | R146: 5.92年 | S146: 3.92年 | T146: 3.2 | U146: 46 | V146: 0.12 | W146: 0.17199999999999999 | X146: 0.187 | Y146: 19 | Z146: 2.77 | AA146: 3.7000000000000002e-003 | AB146: -2.5999999999999999e-003 | AC146: -3.1600000000000003e-002 | AD146: -3.3700000000000001e-002 | AE146: 78.66 | AF146: 80.89 | AG146: 0.72 | AH146: A+ | AI146: 7.3200000000000001e-002 | AJ146: =H146+100*O146 -> 128.93299999999999 | AK146: 129.7 | AL146: 38 | AM146: 48.8 | AN146: 159 | AO146: -3.7999999999999999e-002 | AP146: 4 | AQ146: 惠城转债
A147: 127 | B147: 128130 | C147: 景兴转债 | D147: 2067 | E147: 景兴纸业 | F147: 造纸包装 | G147: 包装用纸 | H147: 113.051 | I147: -4.0000000000000002e-004 | J147: -1.2999999999999999e-003 | K147: 3.51 | L147: -2.8000000000000004e-003 | M147: 115.1 | N147: 3.4 | O147: 9.5000000000000001e-002 | P147: 103.24 | Q147: 转股中 | R147: 5年24天 | S147: 3年25天 | T147: 10.7 | U147: 3.6 | V147: 3.0000000000000001e-003 | W147: 0.25800000000000001 | X147: 0.26700000000000002 | Y147: 41 | Z147: 0.83 | AA147: 3.5999999999999999e-003 | AB147: -1.7000000000000001e-003 | AC147: -2.69e-002 | AD147: -2.8900000000000002e-002 | AE147: 91.04 | AF147: 94.19 | AG147: 0.6 | AH147: AA | AI147: 4.1200000000000001e-002 | AJ147: =H147+100*O147 -> 122.551 | AK147: 122.9 | AL147: 12 | AM147: 28.7 | AN147: 21 | AO147: -2.9999999999999999e-002 | AP147: 16 | AQ147: 景兴转债
A148: 30 | B148: 123109 | C148: 昌红转债 | D148: 300151 | E148: 昌红科技 | F148: 机械装备 | G148: 专用设备 | H148: 118.6 | I148: 3.4999999999999996e-003 | J148: 4.0000000000000001e-003 | K148: 25.04 | L148: 1.34e-002 | M148: 121 | N148: 28.06 | O148: 0.32899999999999996 | P148: 89.24 | Q148: 2月3天 | R148: 5.65年 | S148: 3.65年 | T148: 4.6 | U148: 9.7 | V148: 1.8000000000000002e-002 | W148: 3.7000000000000005e-002 | X148: 3.3000000000000002e-002 | Y148: 126 | Z148: 11.77 | AA148: 3.5999999999999999e-003 | AB148: -2.7000000000000001e-003 | AC148: -3.4300000000000004e-002 | AD148: -3.6200000000000003e-002 | AE148: 82.73 | AF148: 86.64 | AG148: 0.56 | AH148: AA- | AI148: 6.2199999999999998e-002 | AJ148: =H148+100*O148 -> 151.5 | AK148: 148 | AL148: 211 | AM148: 61.3 | AN148: 241 | AO148: 8.4000000000000005e-002 | AP148: 3 | AQ148: 昌红转债
A149: 330 | B149: 128040 | C149: 华通转债! | D149: 2758 | E149: 浙农股份 | F149: 医药 | G149: 医药商业 | H149: 110.199 | I149: 1.5e-003 | J149: -3.4999999999999996e-003 | K149: 9.16 | L149: -5.4000000000000003e-003 | M149: 111.3 | N149: 10.15 | O149: 0.221 | P149: 90.25 | Q149: 转股中 | R149: 2.85年 | S149: 0.86年 | T149: 2.22 | U149: 5.4 | V149: 2.2000000000000002e-002 | W149: 5.0000000000000003e-002 | X149: 4.4999999999999998e-002 | Y149: 45 | Z149: 1.48 | AA149: 3.4999999999999996e-003 | AB149: -3.7000000000000002e-003 | AC149: -7.4800000000000005e-002 | AD149: -7.8e-002 | AE149: 97.97 | AF149: 100.12 | AG149: 0.38 | AH149: AA | AI149: 3.8399999999999997e-002 | AJ149: =H149+100*O149 -> 132.29900000000001 | AK149: 130.2 | AL149: 41 | AM149: 30 | AN149: 29 | AO149: -1.3999999999999999e-002 | AP149: 32 | AQ149: 华通转债!
A150: 194 | B150: 128106 | C150: 华统转债 | D150: 2840 | E150: 华统股份 | F150: 农业 | G150: 农产品加 | H150: 111.352 | I150: -4.0000000000000002e-004 | J150: 3.9000000000000003e-003 | K150: 8.72 | L150: 6.8999999999999999e-003 | M150: 112.9 | N150: 9.37 | O150: 0.19699999999999998 | P150: 93.06 | Q150: 转股中 | R150: 4.68年 | S150: 2.68年 | T150: 5.35 | U150: 9.3 | V150: 1.6e-002 | W150: 0.13699999999999998 | X150: 0.128 | Y150: 39 | Z150: 2.22 | AA150: 3.0000000000000001e-003 | AB150: -2.e-003 | AC150: -2.5899999999999999e-002 | AD150: -2.81e-002 | AE150: 92.61 | AF150: 94.37 | AG150: 0.5 | AH150: AA | AI150: 3.9900000000000005e-002 | AJ150: =H150+100*O150 -> 131.05199999999999 | AK150: 129.6 | AL150: 37 | AM150: 35.3 | AN150: 52 | AO150: -3.0000000000000001e-003 | AP150: 9 | AQ150: 华统转债
A151: 80 | B151: 113043 | C151: 财通转债! | D151: 601108 | E151: 财通证券 | F151: 金融 | G151: 证券行业 | H151: 108.51 | I151: -4.0000000000000002e-004 | J151: 4.0000000000000002e-004 | K151: 9.83 | L151: 0. | M151: 110.2 | N151: 13.13 | O151: 0.44900000000000001 | P151: 74.87 | Q151: 转股中 | R151: 5.34年 | S151: 无权 | T151: 38 | U151: 5.1 | V151: 1.e-003 | W151: 0.10800000000000001 | X151: 8.1000000000000003e-002 | Y151: 353 | Z151: 1.54 | AA151: 2.8999999999999998e-003 | AB151: -5.9999999999999995e-004 | AC151: 无权 | AD151: 无权 | AE151: 无权 | AF151: 92.32 | AG151: 0.32 | AH151: AAA | AI151: 3.4200000000000001e-002 | AJ151: =H151+100*O151 -> 153.41 | AK151: 142.2 | AL151: 166 | AM151: 49.8 | AN151: 166 | AO151: -2.7999999999999997e-002 | AP151: 10 | AQ151: 财通转债!
A152: 145 | B152: 123062 | C152: 三超转债 | D152: 300554 | E152: 三超新材 | F152: 机械装备 | G152: 通用设备 | H152: 117.698 | I152: -3.4000000000000002e-003 | J152: -1.2800000000000001e-002 | K152: 17.23 | L152: -2.3199999999999998e-002 | M152: 119.2 | N152: 17.13 | O152: 0.17000000000000001 | P152: 100.58 | Q152: 转股中 | R152: 4.97年 | S152: 2.97年 | T152: 1.95 | U152: 33 | V152: 0.14400000000000002 | W152: 0.121 | X152: 0.121 | Y152: 16 | Z152: 3.08 | AA152: 2.5999999999999999e-003 | AB152: -4.0999999999999995e-003 | AC152: -3.8599999999999995e-002 | AD152: -4.0999999999999995e-002 | AE152: 81.51 | AF152: 81.31 | AG152: 0.7 | AH152: A | AI152: 8.1900000000000001e-002 | AJ152: =H152+100*O152 -> 134.69799999999998 | AK152: 134.8 | AL152: 85 | AM152: 53.3 | AN152: 196 | AO152: -1.6e-002 | AP152: 24 | AQ152: 三超转债
A153: 213 | B153: 113570 | C153: 百达转债! | D153: 603331 | E153: 百达精工 | F153: 机械装备 | G153: 机械装备 | H153: 113.59 | I153: 3.0999999999999999e-003 | J153: -3.7000000000000002e-003 | K153: 10.96 | L153: -8.9999999999999998e-004 | M153: 114.9 | N153: 11.34 | O153: 0.17499999999999999 | P153: 96.65 | Q153: 转股中 | R153: 4.59年 | S153: 2.60年 | T153: 2.8 | U153: 4.1 | V153: 1.3000000000000001e-002 | W153: 0.14300000000000002 | X153: 0.13900000000000001 | Y153: 20 | Z153: 2.33 | AA153: 2.5000000000000001e-003 | AB153: -3.3e-003 | AC153: -3.3700000000000001e-002 | AD153: -3.6000000000000004e-002 | AE153: 85.51 | AF153: 84.08 | AG153: 0.65 | AH153: A+ | AI153: 7.1900000000000006e-002 | AJ153: =H153+100*O153 -> 131.09 | AK153: 130.5 | AL153: 46 | AM153: 45 | AN153: 133 | AO153: 7.2999999999999995e-002 | AP153: 33 | AQ153: 百达转债!
A154: 324 | B154: 123011 | C154: 德尔转债! | D154: 300473 | E154: 德尔股份 | F154: 汽车 | G154: 零部件制 | H154: 114.495 | I154: 3.0200000000000001e-002 | J154: -1.6e-002 | K154: 26.21 | L154: 4.3799999999999999e-002 | M154: 115.3 | N154: 31.38 | O154: 0.371 | P154: 83.52 | Q154: 转股中 | R154: 2.95年 | S154: 0.95年 | T154: 2.51 | U154: 158 | V154: 0.54500000000000004 | W154: 7.0999999999999994e-002 | X154: 5.9000000000000004e-002 | Y154: 35 | Z154: 1.6 | AA154: 2.3999999999999998e-003 | AB154: -6.8000000000000005e-003 | AC154: -0.10000000000000001 | AD154: -0.10099999999999999 | AE154: 95.47 | AF154: 97.51 | AG154: 0.32 | AH154: AA- | AI154: 5.9400000000000001e-002 | AJ154: =H154+100*O154 -> 151.595 | AK154: 145.5 | AL154: 192 | AM154: 48 | AN154: 150 | AO154: 7.400000000000001e-002 | AP154: 41 | AQ154: 德尔转债!
A155: 289 | B155: 127012 | C155: 招路转债! | D155: 1965 | E155: 招商公路 | F155: 机场高速 | G155: 高速 | H155: 107.07 | I155: 5.9999999999999995e-004 | J155: -2.3999999999999998e-003 | K155: 6.69 | L155: -7.4000000000000003e-003 | M155: 107.9 | N155: 8.63 | O155: 0.38100000000000001 | P155: 77.52 | Q155: 转股中 | R155: 3.62年 | S155: 1.63年 | T155: 50 | U155: 116 | V155: 2.2000000000000002e-002 | W155: 0.121 | X155: 9.4e-002 | Y155: 413 | Z155: 0.83 | AA155: 2.2000000000000001e-003 | AB155: -2.e-003 | AC155: -2.87e-002 | AD155: -3.0499999999999999e-002 | AE155: 95.95 | AF155: 96.1 | AG155: 0.23 | AH155: AAA | AI155: 3.2899999999999999e-002 | AJ155: =H155+100*O155 -> 145.16999999999999 | AK155: 136.6 | AL155: 103 | AM155: 40.5 | AN155: 101 | AO155: -6.7000000000000004e-002 | AP155: 29 | AQ155: 招路转债!
A156: 120 | B156: 128133 | C156: 奇正转债! | D156: 2287 | E156: 奇正藏药 | F156: 医药 | G156: 中药 | H156: 116.099 | I156: 1.e-003 | J156: -1.8200000000000001e-002 | K156: 27.8 | L156: -3.4700000000000002e-002 | M156: 117.3 | N156: 29.78 | O156: 0.24399999999999999 | P156: 93.35 | Q156: 转股中 | R156: 5年46天 | S156: 3年47天 | T156: 8 | U156: 24 | V156: 2.6000000000000002e-002 | W156: 5.4000000000000006e-002 | X156: 5.0999999999999997e-002 | Y156: 147 | Z156: 5.69 | AA156: 2.0999999999999999e-003 | AB156: -3.9000000000000003e-003 | AC156: -3.3700000000000001e-002 | AD156: -3.5799999999999998e-002 | AE156: 91.01 | AF156: 95.79 | AG156: 0.49 | AH156: AA | AI156: 4.1200000000000001e-002 | AJ156: =H156+100*O156 -> 140.499 | AK156: 138.8 | AL156: 136 | AM156: 43.1 | AN156: 123 | AO156: -2.9999999999999999e-002 | AP156: 16 | AQ156: 奇正转债!
A157: 18 | B157: 111000 | C157: 起帆转债 | D157: 605222 | E157: 起帆电缆 | F157: 能源电力 | G157: 电力设备 | H157: 119.11 | I157: 2.2000000000000001e-003 | J157: -3.8e-003 | K157: 21.43 | L157: -2.3e-003 | M157: 120.5 | N157: 20.53 | O157: 0.14099999999999999 | P157: 104.38 | Q157: 3月25天 | R157: 5.80年 | S157: 3.80年 | T157: 10 | U157: 5.6 | V157: 5.0000000000000001e-003 | W157: 0.11599999999999999 | X157: 0.122 | Y157: 86 | Z157: 2.94 | AA157: 2.e-003 | AB157: -4.0000000000000001e-003 | AC157: -3.4300000000000004e-002 | AD157: -3.61e-002 | AE157: 81.94 | AF157: 85.51 | AG157: 0.68 | AH157: AA- | AI157: 6.2199999999999998e-002 | AJ157: =H157+100*O157 -> 133.21000000000001 | AK157: 133.8 | AL157: 76 | AM157: 48.3 | AN157: 151 | AO157: 3.7000000000000005e-002 | AP157: 9 | AQ157: 起帆转债
A158: 110 | B158: 123072 | C158: 乐歌转债! | D158: 300729 | E158: 乐歌股份 | F158: 其他 | G158: 家居用品 | H158: 128.35 | I158: -6.9999999999999993e-003 | J158: 5.6999999999999993e-003 | K158: 22.55 | L158: -3.1400000000000004e-002 | M158: 129.6 | N158: 56.12 | O158: 2.1899999999999999 | P158: 40.18 | Q158: 转股中 | R158: 5.21年 | S158: 3.21年 | T158: 1.42 | U158: 31 | V158: 0.16899999999999998 | W158: 3.5000000000000003e-002 | X158: 1.3999999999999999e-002 | Y158: 41 | Z158: 3.06 | AA158: 1.9e-003 | AB158: -7.3000000000000001e-003 | AC158: -5.4100000000000002e-002 | AD158: -5.7500000000000002e-002 | AE158: 84.4 | AF158: 90.82 | AG158: 0.04 | AH158: A+ | AI158: 7.3200000000000001e-002 | AJ158: =H158+100*O158 -> 347.35000000000002 | AK158: 216.5 | AL158: 343 | AM158: 125.7 | AN158: 342 | AO158: 2.2000000000000002e-002 | AP158: 9 | AQ158: 乐歌转债!
A159: 105 | B159: 113606 | C159: 荣泰转债 | D159: 603579 | E159: 荣泰健康 | F159: 机械装备 | G159: 专用设备 | H159: 120 | I159: 0. | J159: -5.7999999999999996e-003 | K159: 31.16 | L159: -9.8999999999999991e-003 | M159: 121.2 | N159: 32.83 | O159: 0.26400000000000001 | P159: 94.91 | Q159: 转股中 | R159: 5.23年 | S159: 3.23年 | T159: 6 | U159: 1.7 | V159: 2.e-003 | W159: 0.13800000000000001 | X159: 0.13100000000000001 | Y159: 44 | Z159: 2.6 | AA159: 1.9e-003 | AB159: -5.0000000000000001e-003 | AC159: -4.1299999999999996e-002 | AD159: -4.3499999999999997e-002 | AE159: 85.04 | AF159: 89.05 | AG159: 0.59 | AH159: AA- | AI159: 6.2199999999999998e-002 | AJ159: =H159+100*O159 -> 146.40000000000001 | AK159: 145.1 | AL159: 189 | AM159: 56 | AN159: 213 | AO159: -8.5999999999999993e-002 | AP159: 10 | AQ159: 荣泰转债
A160: 71 | B160: 128141 | C160: 旺能转债 | D160: 2034 | E160: 旺能环境 | F160: 城市公用 | G160: 三废处理 | H160: 114.24 | I160: -4.8999999999999998e-003 | J160: 1.2999999999999999e-003 | K160: 15.9 | L160: -6.3e-003 | M160: 115.1 | N160: 15.97 | O160: 0.14699999999999999 | P160: 99.56 | Q160: 转股中 | R160: 5.36年 | S160: 3.37年 | T160: 14 | U160: 7.3 | V160: 5.0000000000000001e-003 | W160: 0.20899999999999999 | X160: 0.20800000000000002 | Y160: 67 | Z160: 1.42 | AA160: 1.4000000000000002e-003 | AB160: -3.5999999999999999e-003 | AC160: -2.75e-002 | AD160: -2.9399999999999999e-002 | AE160: 89.96 | AF160: 93.08 | AG160: 0.58 | AH160: AA | AI160: 4.1200000000000001e-002 | AJ160: =H160+100*O160 -> 128.94 | AK160: 128.9 | AL160: 33 | AM160: 35.8 | AN160: 55 | AO160: -3.3000000000000002e-002 | AP160: 7 | AQ160: 旺能转债
A161: 208 | B161: 123045 | C161: 雷迪转债 | D161: 300652 | E161: 雷迪克 | F161: 汽车 | G161: 零部件制 | H161: 118.19 | I161: 3.3e-003 | J161: 5.6000000000000008e-003 | K161: 18.37 | L161: 1.49e-002 | M161: 118.9 | N161: 19.63 | O161: 0.26300000000000001 | P161: 93.58 | Q161: 转股中 | R161: 4.60年 | S161: 2.60年 | T161: 1.66 | U161: 32 | V161: 0.161 | W161: 9.6000000000000002e-002 | X161: 8.9999999999999997e-002 | Y161: 17 | Z161: 1.82 | AA161: 1.2999999999999999e-003 | AB161: -5.7999999999999996e-003 | AC161: -4.5400000000000003e-002 | AD161: -4.8099999999999997e-002 | AE161: 86.08 | AF161: 87.08 | AG161: 0.6 | AH161: A+ | AI161: 7.1900000000000006e-002 | AJ161: =H161+100*O161 -> 144.49000000000001 | AK161: 142.8 | AL161: 174 | AM161: 55.7 | AN161: 210 | AO161: -2.e-002 | AP161: 34 | AQ161: 雷迪转债
A162: 321 | B162: 128042 | C162: 凯中转债! | D162: 2823 | E162: 凯中精密 | F162: 能源电力 | G162: 电力设备 | H162: 115.004 | I162: 3.4999999999999996e-003 | J162: -1.5e-003 | K162: 11.51 | L162: 6.0999999999999995e-003 | M162: 115.3 | N162: 12.86 | O162: 0.28499999999999998 | P162: 89.5 | Q162: 转股中 | R162: 2.98年 | S162: 0.98年 | T162: 4.16 | U162: 1.2 | V162: 2.e-003 | W162: 0.126 | X162: 0.113 | Y162: 33 | Z162: 2.43 | AA162: 8.9999999999999998e-004 | AB162: -8.199999999999999e-003 | AC162: -0.10099999999999999 | AD162: -0.10099999999999999 | AE162: 97.5 | AF162: 103.22 | AG162: 0.32 | AH162: AA | AI162: 3.8399999999999997e-002 | AJ162: =H162+100*O162 -> 143.50399999999999 | AK162: 140.5 | AL162: 150 | AM162: 37.3 | AN162: 68 | AO162: 2.e-003 | AP162: 25 | AQ162: 凯中转债!
A163: 155 | B163: 113593 | C163: 沪工转债! | D163: 603131 | E163: 上海沪工 | F163: 机械装备 | G163: 通用设备 | H163: 120.66 | I163: 7.9000000000000008e-003 | J163: 3.5999999999999999e-003 | K163: 19.88 | L163: 1.9e-002 | M163: 121.2 | N163: 21.12 | O163: 0.28199999999999997 | P163: 94.13 | Q163: 转股中 | R163: 4.95年 | S163: 2.95年 | T163: 4 | U163: 100 | V163: 0.20600000000000002 | W163: 6.3e-002 | X163: 5.9999999999999998e-002 | Y163: 63 | Z163: 4.8 | AA163: 8.9999999999999998e-004 | AB163: -6.4000000000000003e-003 | AC163: -4.6300000000000001e-002 | AD163: -4.87e-002 | AE163: 84.07 | AF163: 86.59 | AG163: 0.61 | AH163: A+ | AI163: 7.1900000000000006e-002 | AJ163: =H163+100*O163 -> 148.85999999999999 | AK163: 147.2 | AL163: 207 | AM163: 60.6 | AN163: 237 | AO163: 0.14699999999999999 | AP163: 10 | AQ163: 沪工转债!
A164: 4 | B164: 127039 | C164: 北港转债 | D164: 582 | E164: 北部湾港 | F164: 机场高速 | G164: 港口 | H164: 112.5 | I164: -4.0999999999999995e-003 | J164: 2.8000000000000004e-003 | K164: 7.57 | L164: -2.5999999999999999e-003 | M164: 113 | N164: 8.35 | O164: 0.24100000000000002 | P164: 90.66 | Q164: 5月2天 | R164: 5.89年 | S164: 3.90年 | T164: 30 | U164: 58 | V164: 1.7000000000000001e-002 | W164: 0.24299999999999999 | X164: 0.22 | Y164: 124 | Z164: 1.17 | AA164: 8.0000000000000004e-004 | AB164: -3.2000000000000002e-003 | AC164: -2.0400000000000001e-002 | AD164: -2.2099999999999998e-002 | AE164: 90.37 | AF164: 92.99 | AG164: 0.5 | AH164: AAA | AI164: 3.4200000000000001e-002 | AJ164: =H164+100*O164 -> 136.59999999999999 | AK164: 134.3 | AL164: 78 | AM164: 41.4 | AN164: 110 | AO164: -5.7000000000000002e-002 | AP164: 4 | AQ164: 北港转债
A165: 313 | B165: 110047 | C165: 山鹰转债 | D165: 600567 | E165: 山鹰国际 | F165: 造纸包装 | G165: 包装用纸 | H165: 117.43 | I165: 1.1000000000000001e-003 | J165: 1.7000000000000001e-003 | K165: 3.3 | L165: 6.0999999999999995e-003 | M165: 117.5 | N165: 3.3 | O165: 0.17399999999999999 | P165: 100 | Q165: 转股中 | R165: 3.29年 | S165: 1.29年 | T165: 22.5 | U165: 28 | V165: 1.1000000000000001e-002 | W165: 0.14699999999999999 | X165: 0.14699999999999999 | Y165: 152 | Z165: 0.98 | AA165: 2.0000000000000001e-004 | AB165: -9.1000000000000004e-003 | AC165: -8.77e-002 | AD165: -9.0999999999999998e-002 | AE165: 97.86 | AF165: 105.2 | AG165: 0.46 | AH165: AA+ | AI165: 3.49e-002 | AJ165: =H165+100*O165 -> 134.83000000000001 | AK165: 134.9 | AL165: 87 | AM165: 29.7 | AN165: 26 | AO165: -9.0000000000000011e-003 | AP165: 28 | AQ165: 山鹰转债
A166: 292 | B166: 110056 | C166: 亨通转债! | D166: 600487 | E166: 亨通光电 | F166: 通信互联 | G166: 通信设备 | H166: 114.21 | I166: 1.1000000000000001e-002 | J166: -1.7000000000000001e-003 | K166: 13.19 | L166: 2.7300000000000001e-002 | M166: 114.3 | N166: 14.95 | O166: 0.29399999999999998 | P166: 88.23 | Q166: 转股中 | R166: 3.62年 | S166: 1.62年 | T166: 17.1 | U166: 30 | V166: 1.6e-002 | W166: 5.5e-002 | X166: 4.8000000000000001e-002 | Y166: 312 | Z166: 1.55 | AA166: 2.0000000000000001e-004 | AB166: -6.8999999999999999e-003 | AC166: -5.7699999999999994e-002 | AD166: -6.0599999999999994e-002 | AE166: 96.75 | AF166: 101.21 | AG166: 0.34 | AH166: AA+ | AI166: 3.49e-002 | AJ166: =H166+100*O166 -> 143.60999999999999 | AK166: 140.2 | AL166: 146 | AM166: 39 | AN166: 88 | AO166: 6.8000000000000005e-002 | AP166: 28 | AQ166: 亨通转债!
A167: 356 | B167: 110038 | C167: 济川转债! | D167: 600566 | E167: 济川药业 | F167: 医药 | G167: 中药 | H167: 107.53 | I167: 6.8000000000000005e-003 | J167: -6.8999999999999999e-003 | K167: 15.29 | L167: -7.0999999999999995e-003 | M167: 107.5 | N167: 23.4 | O167: 0.64599999999999991 | P167: 65.34 | Q167: 转股中 | R167: 1.27年 | S167: 回售内 | T167: 6.28 | U167: 33 | V167: 4.9000000000000002e-002 | W167: 4.5999999999999999e-002 | X167: 2.9999999999999999e-002 | Y167: 136 | Z167: 1.68 | AA167: -2.0000000000000001e-004 | AB167: -1.1299999999999999e-002 | AC167: 回售内 | AD167: 回售内 | AE167: 100.25 | AF167: 102.53 | AG167: 0.01 | AH167: AA | AI167: 3.8399999999999997e-002 | AJ167: =H167+100*O167 -> 172.13 | AK167: 149.7 | AL167: 221 | AM167: 47.2 | AN167: 144 | AO167: -4.4999999999999998e-002 | AP167: 22 | AQ167: 济川转债!
A168: 38 | B168: 128145 | C168: 日丰转债 | D168: 2953 | E168: 日丰股份 | F168: 家电 | G168: 零部件制 | H168: 115.62 | I168: -4.0999999999999995e-003 | J168: -2.8000000000000004e-003 | K168: 13.28 | L168: -1.04e-002 | M168: 115.4 | N168: 13.66 | O168: 0.18899999999999997 | P168: 97.22 | Q168: 52天 | R168: 5.62年 | S168: 3.63年 | T168: 3.8 | U168: 1.8 | V168: 4.0000000000000001e-003 | W168: 0.11800000000000001 | X168: 0.114 | Y168: 32 | Z168: 2.16 | AA168: -2.9999999999999997e-004 | AB168: -5.1999999999999998e-003 | AC168: -2.8399999999999998e-002 | AD168: -3.0200000000000001e-002 | AE168: 82.7 | AF168: 82.75 | AG168: 0.66 | AH168: AA- | AI168: 6.2199999999999998e-002 | AJ168: =H168+100*O168 -> 134.52000000000001 | AK168: 134 | AL168: 77 | AM168: 51.3 | AN168: 183 | AO168: -4.2000000000000003e-002 | AP168: 6 | AQ168: 日丰转债
A169: 6 | B169: 123117 | C169: 健帆转债 | D169: 300529 | E169: 健帆生物 | F169: 医药 | G169: 医疗器械 | H169: 115.6 | I169: -1.01e-002 | J169: -2.0000000000000001e-004 | K169: 53.92 | L169: -6.0599999999999994e-002 | M169: 115.1 | N169: 90.6 | O169: 0.94200000000000006 | P169: 59.51 | Q169: 4月25天 | R169: 5.88年 | S169: 3.88年 | T169: 10 | U169: 20 | V169: 1.7000000000000001e-002 | W169: 2.3e-002 | X169: 1.3999999999999999e-002 | Y169: 434 | Z169: 14.07 | AA169: -7.000000000000001e-004 | AB169: -5.3e-003 | AC169: -2.69e-002 | AD169: -2.86e-002 | AE169: 88.1 | AF169: 91.16 | AG169: 0.17 | AH169: AA | AI169: 4.1200000000000001e-002 | AJ169: =H169+100*O169 -> 209.80000000000001 | AK169: 171.7 | AL169: 300 | AM169: 80.5 | AN169: 302 | AO169: -0.27800000000000002 | AP169: 2 | AQ169: 健帆转债
A170: 182 | B170: 127017 | C170: 万青转债 | D170: 789 | E170: 万年青 | F170: 建筑 | G170: 水泥 | H170: 118.509 | I170: -1.04e-002 | J170: 8.199999999999999e-003 | K170: 10.91 | L170: -7.3000000000000001e-003 | M170: 118 | N170: 13.46 | O170: 0.46200000000000002 | P170: 81.05 | Q170: 转股中 | R170: 4.82年 | S170: 2.83年 | T170: 10 | U170: 2.9 | V170: 2.e-003 | W170: 0.115 | X170: 9.3000000000000013e-002 | Y170: 87 | Z170: 1.33 | AA170: -8.9999999999999998e-004 | AB170: -7.4000000000000003e-003 | AC170: -4.5100000000000001e-002 | AD170: -4.7100000000000003e-002 | AE170: 93.33 | AF170: 100.31 | AG170: 0.3 | AH170: AA+ | AI170: 3.49e-002 | AJ170: =H170+100*O170 -> 164.709 | AK170: 156 | AL170: 258 | AM170: 55.7 | AN170: 209 | AO170: -1.e-002 | AP170: 9 | AQ170: 万青转债
A171: 87 | B171: 123080 | C171: 海波转债! | D171: 300517 | E171: 海波重科 | F171: 建筑 | G171: 建筑工程 | H171: 127.112 | I171: -2.0799999999999999e-002 | J171: 7.000000000000001e-004 | K171: 14.5 | L171: -2.6200000000000001e-002 | M171: 126.5 | N171: 11.58 | O171: 1.4999999999999999e-002 | P171: 125.22 | Q171: 转股中 | R171: 5.32年 | S171: 3.32年 | T171: 2.44 | U171: 25 | V171: 8.1000000000000003e-002 | W171: 8.6999999999999994e-002 | X171: 0.11 | Y171: 28 | Z171: 1.86 | AA171: -8.9999999999999998e-004 | AB171: -9.1000000000000004e-003 | AC171: -5.4800000000000001e-002 | AD171: -5.7099999999999998e-002 | AE171: 82.08 | AF171: 87.67 | AG171: 0.77 | AH171: A+ | AI171: 7.3200000000000001e-002 | AJ171: =H171+100*O171 -> 128.61199999999999 | AK171: 129 | AL171: 34 | AM171: 41.3 | AN171: 109 | AO171: 8.3000000000000004e-002 | AP171: 22 | AQ171: 海波转债!
A172: 60 | B172: 123093 | C172: 金陵转债! | D172: 300651 | E172: 金陵体育 | F172: 其他 | G172: 文化教育 | H172: 130 | I172: -7.0000000000000007e-002 | J172: 2.5499999999999998e-002 | K172: 38.4 | L172: -9.5000000000000001e-002 | M172: 129.3 | N172: 49.19 | O172: 0.66500000000000004 | P172: 78.06 | Q172: 转股中 | R172: 5.45年 | S172: 3.46年 | T172: 2.5 | U172: 535 | V172: 1.6200000000000001 | W172: 5.0999999999999997e-002 | X172: 3.9e-002 | Y172: 49 | Z172: 7.17 | AA172: -1.e-003 | AB172: -9.7000000000000003e-003 | AC172: -5.45e-002 | AD172: -5.7599999999999998e-002 | AE172: 82.69 | AF172: 89 | AG172: 0.47 | AH172: A+ | AI172: 7.3200000000000001e-002 | AJ172: =H172+100*O172 -> 196.5 | AK172: 181.9 | AL172: 314 | AM172: 92.9 | AN172: 322 | AO172: -4.9000000000000002e-002 | AP172: 7 | AQ172: 金陵转债!
A173: 244 | B173: 113549 | C173: 白电转债 | D173: 603861 | E173: 白云电器 | F173: 能源电力 | G173: 电力设备 | H173: 115.63 | I173: 6.1999999999999998e-003 | J173: -9.300000000000001e-003 | K173: 9.06 | L173: -5.5000000000000005e-003 | M173: 114.8 | N173: 8.81 | O173: 0.124 | P173: 102.84 | Q173: 转股中 | R173: 4.28年 | S173: 2.28年 | T173: 8.8 | U173: 15 | V173: 1.4999999999999999e-002 | W173: 0.22 | X173: 0.22600000000000001 | Y173: 40 | Z173: 1.56 | AA173: -1.7000000000000001e-003 | AB173: -7.9000000000000008e-003 | AC173: -4.5499999999999999e-002 | AD173: -4.8000000000000001e-002 | AE173: 93.97 | AF173: 97.45 | AG173: 0.57 | AH173: AA | AI173: 3.9900000000000005e-002 | AJ173: =H173+100*O173 -> 128.03 | AK173: 128.4 | AL173: 30 | AM173: 31 | AN173: 31 | AO173: 3.2000000000000001e-002 | AP173: 39 | AQ173: 白电转债
A174: 31 | B174: 123110 | C174: 九典转债 | D174: 300705 | E174: 九典制药 | F174: 医药 | G174: 化学制药 | H174: 122.55 | I174: -1.2999999999999999e-003 | J174: 1.54e-002 | K174: 27.24 | L174: 2.0199999999999999e-002 | M174: 121.4 | N174: 26.44 | O174: 0.19 | P174: 103.03 | Q174: 2月3天 | R174: 5.65年 | S174: 3.65年 | T174: 2.7 | U174: 55 | V174: 0.16500000000000001 | W174: 4.2000000000000003e-002 | X174: 4.4000000000000004e-002 | Y174: 64 | Z174: 7.25 | AA174: -1.7000000000000001e-003 | AB174: -8.1000000000000013e-003 | AC174: -4.1500000000000002e-002 | AD174: -4.3499999999999997e-002 | AE174: 79.95 | AF174: 82.17 | AG174: 0.7 | AH174: A+ | AI174: 7.3200000000000001e-002 | AJ174: =H174+100*O174 -> 141.55000000000001 | AK174: 142.1 | AL174: 165 | AM174: 59.9 | AN174: 234 | AO174: -0.16699999999999998 | AP174: 6 | AQ174: 九典转债
A175: 237 | B175: 128085 | C175: 鸿达转债! | D175: 2002 | E175: 鸿达兴业 | F175: 化工 | G175: 化工 | H175: 125.521 | I175: 2.0499999999999997e-002 | J175: -2.2000000000000001e-003 | K175: 4.92 | L175: 2.07e-002 | M175: 124.4 | N175: 3.91 | O175: -2.e-003 | P175: 125.83 | Q175: 转股中 | R175: 4.36年 | S175: 2.36年 | T175: 6.93 | U175: 413 | V175: 0.47100000000000003 | W175: 4.7e-002 | X175: 5.9000000000000004e-002 | Y175: 148 | Z175: 1.69 | AA175: -2.0999999999999999e-003 | AB175: -1.1399999999999999e-002 | AC175: -7.2700000000000001e-002 | AD175: -7.5399999999999995e-002 | AE175: 69.91 | AF175: 63.45 | AG175: 0.88 | AH175: B | AI175: 0.17190000000000003 | AJ175: =H175+100*O175 -> 125.321 | AK175: 125.2 | AL175: 19 | AM175: 55.3 | AN175: 206 | AO175: 0.109 | AP175: 100 | AQ175: 鸿达转债!
A176: 8 | B176: 113050 | C176: 南银转债 | D176: 601009 | E176: 南京银行 | F176: 金融 | G176: 银行行业 | H176: 113 | I176: -7.6e-003 | J176: 6.0999999999999995e-003 | K176: 8.5 | L176: -3.4999999999999996e-003 | M176: 111.2 | N176: 10.1 | O176: 0.34299999999999997 | P176: 84.16 | Q176: 4月17天 | R176: 5.86年 | S176: 无权 | T176: 200 | U176: 429 | V176: 1.9e-002 | W176: 0.23499999999999999 | X176: 0.19800000000000001 | Y176: 851 | Z176: 0.84 | AA176: -2.8000000000000004e-003 | AB176: -6.3e-003 | AC176: 无权 | AD176: 无权 | AE176: 无权 | AF176: 91.57 | AG176: 0.43 | AH176: AAA | AI176: 3.4200000000000001e-002 | AJ176: =H176+100*O176 -> 147.30000000000001 | AK176: 141.8 | AL176: 162 | AM176: 50.3 | AN176: 170 | AO176: -0.105 | AP176: 4 | AQ176: 南银转债
A177: 48 | B177: 113045 | C177: 环旭转债! | D177: 601231 | E177: 环旭电子 | F177: 电子 | G177: 电子产品 | H177: 113.83 | I177: -1.5e-003 | J177: -5.0000000000000001e-003 | K177: 14.08 | L177: -2.4900000000000002e-002 | M177: 112 | N177: 19.75 | O177: 0.59699999999999998 | P177: 71.29 | Q177: 4月6天 | R177: 5.57年 | S177: 2.58年 | T177: 34.5 | U177: 1.7 | V177: 0. | W177: 0.111 | X177: 7.9000000000000001e-002 | Y177: 311 | Z177: 2.51 | AA177: -2.8999999999999998e-003 | AB177: -6.8000000000000005e-003 | AC177: -3.6200000000000003e-002 | AD177: -3.8199999999999998e-002 | AE177: 93.35 | AF177: 92.09 | AG177: 0.26 | AH177: AA+ | AI177: 3.6200000000000003e-002 | AJ177: =H177+100*O177 -> 173.53 | AK177: 156.4 | AL177: 261 | AM177: 63 | AN177: 247 | AO177: -3.4000000000000002e-002 | AP177: 4 | AQ177: 环旭转债!
A178: 54 | B178: 123097 | C178: 美力转债 | D178: 300611 | E178: 美力科技 | F178: 机械装备 | G178: 通用设备 | H178: 124 | I178: -2.3999999999999998e-003 | J178: 3.8e-003 | K178: 11.13 | L178: 1.8e-003 | M178: 121.6 | N178: 9.28 | O178: 3.4000000000000002e-002 | P178: 119.94 | Q178: 转股中 | R178: 5.48年 | S178: 3.48年 | T178: 3 | U178: 17 | V178: 4.5999999999999999e-002 | W178: 0.151 | X178: 0.18100000000000002 | Y178: 20 | Z178: 2.99 | AA178: -3.5999999999999999e-003 | AB178: -1.03e-002 | AC178: -4.6100000000000002e-002 | AD178: -4.8300000000000003e-002 | AE178: 81.14 | AF178: 83.38 | AG178: 0.76 | AH178: A+ | AI178: 7.3200000000000001e-002 | AJ178: =H178+100*O178 -> 127.40000000000001 | AK178: 128.1 | AL178: 29 | AM178: 44.7 | AN178: 131 | AO178: 5.9000000000000004e-002 | AP178: 19 | AQ178: 美力转债
A179: 42 | B179: 123105 | C179: 拓尔转债! | D179: 300229 | E179: 拓尔思 | F179: 计算机及 | G179: 软件开发 | H179: 123.455 | I179: -4.0000000000000002e-004 | J179: 6.1999999999999998e-003 | K179: 9.99 | L179: 9.1000000000000004e-003 | M179: 121 | N179: 9.93 | O179: 0.22699999999999998 | P179: 100.6 | Q179: 50天 | R179: 5.62年 | S179: 3.62年 | T179: 8 | U179: 22 | V179: 2.2000000000000002e-002 | W179: 0.11199999999999999 | X179: 0.11199999999999999 | Y179: 72 | Z179: 3.29 | AA179: -3.5999999999999999e-003 | AB179: -1.e-002 | AC179: -4.4900000000000002e-002 | AD179: -4.6699999999999998e-002 | AE179: 82.9 | AF179: 86.82 | AG179: 0.64 | AH179: AA- | AI179: 6.2199999999999998e-002 | AJ179: =H179+100*O179 -> 146.155 | AK179: 146.3 | AL179: 201 | AM179: 59.5 | AN179: 231 | AO179: -2.e-003 | AP179: 7 | AQ179: 拓尔转债!
A180: 52 | B180: 123099 | C180: 普利转债 | D180: 300630 | E180: 普利制药 | F180: 医药 | G180: 化学制药 | H180: 126 | I180: 1.2999999999999999e-003 | J180: -1.7600000000000001e-002 | K180: 45.77 | L180: -2.6600000000000002e-002 | M180: 123.5 | N180: 46.03 | O180: 0.26700000000000002 | P180: 99.44 | Q180: 17天 | R180: 5.51年 | S180: 3.51年 | T180: 8.5 | U180: 5.1 | V180: 5.0000000000000001e-003 | W180: 4.2000000000000003e-002 | X180: 4.2000000000000003e-002 | Y180: 200 | Z180: 9.16 | AA180: -3.7000000000000002e-003 | AB180: -1.0800000000000001e-002 | AC180: -5.1699999999999996e-002 | AD180: -5.3499999999999999e-002 | AE180: 83.36 | AF180: 89.14 | AG180: 0.61 | AH180: AA- | AI180: 6.2199999999999998e-002 | AJ180: =H180+100*O180 -> 152.69999999999999 | AK180: 152.6 | AL180: 237 | AM180: 63.4 | AN180: 248 | AO180: -6.0000000000000001e-003 | AP180: 5 | AQ180: 普利转债
A181: 69 | B181: 123090 | C181: 三诺转债 | D181: 300298 | E181: 三诺生物 | F181: 医药 | G181: 医疗器械 | H181: 119.5 | I181: -8.0000000000000004e-004 | J181: 2.0000000000000001e-004 | K181: 29.89 | L181: -1.7000000000000001e-003 | M181: 117.1 | N181: 35.15 | O181: 0.40500000000000003 | P181: 85.04 | Q181: 转股中 | R181: 5.37年 | S181: 3.38年 | T181: 5 | U181: 1.3 | V181: 2.e-003 | W181: 2.9999999999999999e-002 | X181: 2.5000000000000001e-002 | Y181: 169 | Z181: 6.34 | AA181: -3.8e-003 | AB181: -9.3999999999999986e-003 | AC181: -3.9800000000000002e-002 | AD181: -4.1700000000000001e-002 | AE181: 89.92 | AF181: 94.64 | AG181: 0.42 | AH181: AA | AI181: 4.1200000000000001e-002 | AJ181: =H181+100*O181 -> 160. | AK181: 154 | AL181: 247 | AM181: 59.3 | AN181: 230 | AO181: 3.1e-002 | AP181: 4 | AQ181: 三诺转债
A182: 355 | B182: 123002 | C182: 国祯转债!! | D182: 300388 | E182: 节能国祯 | F182: 城市公用 | G182: 三废处理 | H182: 109.77 | I182: -1.9e-003 | J182: -7.000000000000001e-004 | K182: 7.07 | L182: -9.7999999999999997e-003 | M182: 108.8 | N182: 8.36 | O182: 0.29799999999999999 | P182: 84.57 | Q182: 转股中 | R182: 2.30年 | S182: 0.30年 | T182: 2.52 | U182: 8.2 | V182: 2.9999999999999999e-002 | W182: 5.0999999999999997e-002 | X182: 4.2999999999999997e-002 | Y182: 49 | Z182: 1.34 | AA182: -3.9000000000000003e-003 | AB182: -1.1000000000000001e-002 | AC182: -0.17199999999999999 | AD182: -0.17800000000000002 | AE182: 99.78 | AF182: 99.91 | AG182: 0.27 | AH182: AA | AI182: 3.8399999999999997e-002 | AJ182: =H182+100*O182 -> 139.56999999999999 | AK182: 135 | AL182: 89 | AM182: 35.1 | AN182: 49 | AO182: -3.2000000000000001e-002 | AP182: 16 | AQ182: 国祯转债!!
A183: 295 | B183: 110053 | C183: 苏银转债! | D183: 600919 | E183: 江苏银行 | F183: 金融 | G183: 银行行业 | H183: 120 | I183: -2.8000000000000004e-003 | J183: 2.0999999999999999e-003 | K183: 6.26 | L183: -1.6000000000000001e-003 | M183: 118.3 | N183: 6.37 | O183: 0.221 | P183: 98.27 | Q183: 转股中 | R183: 3.60年 | S183: 无权 | T183: 200 | U183: 385 | V183: 1.6e-002 | W183: 0.21600000000000003 | X183: 0.21299999999999999 | Y183: 925 | Z183: 0.66 | AA183: -4.0999999999999995e-003 | AB183: -1.29e-002 | AC183: 无权 | AD183: 无权 | AE183: 无权 | AF183: 105.65 | AG183: 0.45 | AH183: AAA | AI183: 3.2899999999999999e-002 | AJ183: =H183+100*O183 -> 142.09999999999999 | AK183: 141.7 | AL183: 161 | AM183: 36.1 | AN183: 57 | AO183: -6.4000000000000001e-002 | AP183: 36 | AQ183: 苏银转债!
A184: 278 | B184: 113026 | C184: 核能转债! | D184: 601985 | E184: 中国核电 | F184: 能源电力 | G184: 核电 | H184: 111.1 | I184: 8.9999999999999998e-004 | J184: 2.2000000000000001e-003 | K184: 5.02 | L184: 8.0000000000000002e-003 | M184: 109.3 | N184: 5.73 | O184: 0.26800000000000002 | P184: 87.61 | Q184: 转股中 | R184: 3.69年 | S184: 1.69年 | T184: 78 | U184: 161 | V184: 1.9e-002 | W184: 8.900000000000001e-002 | X184: 7.8e-002 | Y184: 876 | Z184: 1.42 | AA184: -4.5000000000000005e-003 | AB184: -9.1999999999999998e-003 | AC184: -4.1200000000000001e-002 | AD184: -4.4000000000000004e-002 | AE184: 96.85 | AF184: 97.22 | AG184: 0.39 | AH184: AAA | AI184: 3.2899999999999999e-002 | AJ184: =H184+100*O184 -> 137.90000000000001 | AK184: 134.6 | AL184: 82 | AM184: 37.4 | AN184: 70 | AO184: 3.4000000000000002e-002 | AP184: 42 | AQ184: 核能转债!
A185: 286 | B185: 110057 | C185: 现代转债 | D185: 600420 | E185: 国药现代 | F185: 医药 | G185: 化学制药 | H185: 112.2 | I185: -7.4999999999999997e-003 | J185: -8.0000000000000004e-004 | K185: 9.48 | L185: -1.66e-002 | M185: 110.3 | N185: 9.79 | O185: 0.159 | P185: 96.83 | Q185: 转股中 | R185: 3.65年 | S185: 1.65年 | T185: 16.2 | U185: 11 | V185: 6.0000000000000001e-003 | W185: 0.16600000000000001 | X185: 0.161 | Y185: 97 | Z185: 1.2 | AA185: -4.7999999999999996e-003 | AB185: -9.8999999999999991e-003 | AC185: -4.7300000000000002e-002 | AD185: -5.0099999999999999e-002 | AE185: 96.97 | AF185: 98.23 | AG185: 0.5 | AH185: AAA | AI185: 3.2899999999999999e-002 | AJ185: =H185+100*O185 -> 128.09999999999999 | AK185: 127.6 | AL185: 28 | AM185: 29.3 | AN185: 25 | AO185: -9.0000000000000011e-003 | AP185: 23 | AQ185: 现代转债
A186: 331 | B186: 128039 | C186: 三力转债! | D186: 2224 | E186: 三 力 士 | F186: 机械装备 | G186: 专用设备 | H186: 110.3 | I186: -3.5999999999999999e-003 | J186: -1.7000000000000001e-003 | K186: 4.98 | L186: -1.3899999999999999e-002 | M186: 108.8 | N186: 5.79 | O186: 0.28199999999999997 | P186: 86.01 | Q186: 转股中 | R186: 2.84年 | S186: 0.84年 | T186: 2.02 | U186: 31 | V186: 0.13600000000000001 | W186: 5.5999999999999994e-002 | X186: 4.8000000000000001e-002 | Y186: 36 | Z186: 1.58 | AA186: -4.8999999999999998e-003 | AB186: -1.06e-002 | AC186: -7.9100000000000004e-002 | AD186: -8.1900000000000001e-002 | AE186: 95.84 | AF186: 92.57 | AG186: 0.39 | AH186: AA- | AI186: 5.9400000000000001e-002 | AJ186: =H186+100*O186 -> 138.5 | AK186: 134.6 | AL186: 81 | AM186: 38.7 | AN186: 84 | AO186: -6.9999999999999993e-003 | AP186: 29 | AQ186: 三力转债!
A187: 77 | B187: 123086 | C187: 海兰转债! | D187: 300065 | E187: 海兰信 | F187: 电子 | G187: 电子产品 | H187: 126.7 | I187: 2.0999999999999999e-003 | J187: -1.2699999999999999e-002 | K187: 8.45 | L187: -1.52e-002 | M187: 123.5 | N187: 7.27 | O187: 8.9999999999999997e-002 | P187: 116.23 | Q187: 转股中 | R187: 5.35年 | S187: 3.35年 | T187: 7.29 | U187: 66 | V187: 7.2000000000000008e-002 | W187: 0.14499999999999999 | X187: 0.16800000000000001 | Y187: 50 | Z187: 2.27 | AA187: -4.8999999999999998e-003 | AB187: -1.2199999999999999e-002 | AC187: -5.5599999999999997e-002 | AD187: -5.7500000000000002e-002 | AE187: 84.19 | AF187: 90.03 | AG187: 0.7 | AH187: AA- | AI187: 6.2199999999999998e-002 | AJ187: =H187+100*O187 -> 135.69999999999999 | AK187: 137.2 | AL187: 116 | AM187: 47.1 | AN187: 142 | AO187: -6.2e-002 | AP187: 17 | AQ187: 海兰转债!
A188: 263 | B188: 128072 | C188: 翔鹭转债! | D188: 2842 | E188: 翔鹭钨业 | F188: 有色金属 | G188: 小金属 | H188: 117.5 | I188: 8.199999999999999e-002 | J188: -4.5899999999999996e-002 | K188: 11.69 | L188: 9.9700000000000011e-002 | M188: 115.1 | N188: 15.36 | O188: 0.54400000000000004 | P188: 76.11 | Q188: 转股中 | R188: 4年13天 | S188: 2年14天 | T188: 3.02 | U188: 898 | V188: 2.4399999999999999 | W188: 9.5000000000000001e-002 | X188: 7.2000000000000008e-002 | Y188: 32 | Z188: 3.43 | AA188: -5.1999999999999998e-003 | AB188: -1.18e-002 | AC188: -5.6799999999999996e-002 | AD188: -5.96e-002 | AE188: 90.94 | AF188: 91.18 | AG188: 0.36 | AH188: AA- | AI188: 6.0899999999999996e-002 | AJ188: =H188+100*O188 -> 171.90000000000001 | AK188: 158.9 | AL188: 268 | AM188: 67.7 | AN188: 268 | AO188: 0.11800000000000001 | AP188: 29 | AQ188: 翔鹭转债!
A189: 12 | B189: 123116 | C189: 万兴转债 | D189: 300624 | E189: 万兴科技 | F189: 计算机及 | G189: 软件开发 | H189: 125.101 | I189: 8.0000000000000004e-004 | J189: -9.3999999999999986e-003 | K189: 49.73 | L189: -1.2500000000000001e-002 | M189: 121.4 | N189: 49.78 | O189: 0.252 | P189: 99.9 | Q189: 4月12天 | R189: 5.84年 | S189: 3.84年 | T189: 3.79 | U189: 6.6 | V189: 1.3999999999999999e-002 | W189: 5.9000000000000004e-002 | X189: 5.9000000000000004e-002 | Y189: 65 | Z189: 7.27 | AA189: -5.1999999999999998e-003 | AB189: -1.1399999999999999e-002 | AC189: -4.4699999999999997e-002 | AD189: -4.6600000000000003e-002 | AE189: 78.83 | AF189: 81.08 | AG189: 0.69 | AH189: A+ | AI189: 7.3200000000000001e-002 | AJ189: =H189+100*O189 -> 150.30099999999999 | AK189: 150.3 | AL189: 224 | AM189: 69.2 | AN189: 277 | AO189: -6.5000000000000002e-002 | AP189: 4 | AQ189: 万兴转债
A190: 126 | B190: 123064 | C190: 万孚转债! | D190: 300482 | E190: 万孚生物 | F190: 医药 | G190: 医疗器械 | H190: 118.2 | I190: -1.4199999999999999e-002 | J190: -7.6e-003 | K190: 57.81 | L190: -5.8600000000000006e-002 | M190: 115.1 | N190: 71.65 | O190: 0.46500000000000002 | P190: 80.68 | Q190: 转股中 | R190: 5年25天 | S190: 3年26天 | T190: 5.99 | U190: 56 | V190: 7.9000000000000001e-002 | W190: 2.3e-002 | X190: 1.9e-002 | Y190: 257 | Z190: 6.81 | AA190: -5.3e-003 | AB190: -1.06e-002 | AC190: -4.0199999999999993e-002 | AD190: -4.2199999999999994e-002 | AE190: 91.03 | AF190: 94.18 | AG190: 0.37 | AH190: AA | AI190: 4.1200000000000001e-002 | AJ190: =H190+100*O190 -> 164.69999999999999 | AK190: 155.7 | AL190: 254 | AM190: 61.5 | AN190: 243 | AO190: 1.7000000000000001e-002 | AP190: 10 | AQ190: 万孚转债!
A191: 98 | B191: 127025 | C191: 冀东转债! | D191: 401 | E191: 冀东水泥 | F191: 建筑 | G191: 水泥 | H191: 113.316 | I191: -1.6000000000000001e-003 | J191: -2.5999999999999999e-003 | K191: 12.35 | L191: -1.1200000000000002e-002 | M191: 110.1 | N191: 15.28 | O191: 0.40200000000000002 | P191: 80.82 | Q191: 转股中 | R191: 5.25年 | S191: 3.25年 | T191: 17.8 | U191: 30 | V191: 1.4999999999999999e-002 | W191: 0.10199999999999999 | X191: 8.199999999999999e-002 | Y191: 175 | Z191: 1.18 | AA191: -5.6000000000000008e-003 | AB191: -9.1000000000000004e-003 | AC191: -2.81e-002 | AD191: -2.9700000000000001e-002 | AE191: 91.77 | AF191: 92.55 | AG191: 0.38 | AH191: AAA | AI191: 3.4200000000000001e-002 | AJ191: =H191+100*O191 -> 153.51600000000002 | AK191: 145.8 | AL191: 197 | AM191: 53.3 | AN191: 195 | AO191: 8.0000000000000002e-003 | AP191: 9 | AQ191: 冀东转债!
A192: 157 | B192: 128121 | C192: 宏川转债! | D192: 2930 | E192: 宏川智慧 | F192: 交通运输 | G192: 物流业 | H192: 116.105 | I192: -2.5000000000000001e-003 | J192: -1.7000000000000001e-003 | K192: 17.77 | L192: -7.3000000000000001e-003 | M192: 112.9 | N192: 19.92 | O192: 0.30199999999999999 | P192: 89.21 | Q192: 转股中 | R192: 4.94年 | S192: 2.95年 | T192: 6.7 | U192: 1.6 | V192: 2.e-003 | W192: 8.5000000000000006e-002 | X192: 7.5999999999999998e-002 | Y192: 79 | Z192: 3.81 | AA192: -5.6999999999999993e-003 | AB192: -1.04e-002 | AC192: -3.6799999999999999e-002 | AD192: -3.8800000000000001e-002 | AE192: 86.16 | AF192: 84.77 | AG192: 0.58 | AH192: AA- | AI192: 6.0899999999999996e-002 | AJ192: =H192+100*O192 -> 146.30500000000001 | AK192: 143 | AL192: 176 | AM192: 56.8 | AN192: 217 | AO192: 2.5000000000000001e-002 | AP192: 5 | AQ192: 宏川转债!
A193: 46 | B193: 123101 | C193: 拓斯转债! | D193: 300607 | E193: 拓斯达 | F193: 机械装备 | G193: 机器人及 | H193: 118.749 | I193: -2.0999999999999999e-003 | J193: -2.5999999999999999e-003 | K193: 19.63 | L193: -1.46e-002 | M193: 115.1 | N193: 26.19 | O193: 0.58399999999999996 | P193: 74.95 | Q193: 41天 | R193: 5.59年 | S193: 3.59年 | T193: 6.7 | U193: 2.8 | V193: 4.0000000000000001e-003 | W193: 8.0000000000000002e-002 | X193: 5.9999999999999998e-002 | Y193: 84 | Z193: 2.33 | AA193: -5.6999999999999993e-003 | AB193: -1.04e-002 | AC193: -3.5900000000000001e-002 | AD193: -3.7699999999999997e-002 | AE193: 89.13 | AF193: 92.23 | AG193: 0.33 | AH193: AA | AI193: 4.1200000000000001e-002 | AJ193: =H193+100*O193 -> 177.149 | AK193: 162.5 | AL193: 280 | AM193: 70.3 | AN193: 281 | AO193: 2.e-002 | AP193: 4 | AQ193: 拓斯转债!
A194: 273 | B194: 113536 | C194: 三星转债 | D194: 603578 | E194: 三星新材 | F194: 家电 | G194: 零部件制 | H194: 116.95 | I194: 6.1999999999999998e-003 | J194: -6.6e-003 | K194: 13.8 | L194: -7.000000000000001e-004 | M194: 114.3 | N194: 13.76 | O194: 0.16600000000000001 | P194: 100.29 | Q194: 转股中 | R194: 3.82年 | S194: 1.82年 | T194: 1.49 | U194: 4 | V194: 2.3e-002 | W194: 8.4000000000000005e-002 | X194: 8.4000000000000005e-002 | Y194: 18 | Z194: 1.7 | AA194: -6.0999999999999995e-003 | AB194: -1.2699999999999999e-002 | AC194: -6.3399999999999998e-002 | AD194: -6.59e-002 | AE194: 95.18 | AF194: 98.72 | AG194: 0.53 | AH194: AA | AI194: 3.9900000000000005e-002 | AJ194: =H194+100*O194 -> 133.55000000000001 | AK194: 133.6 | AL194: 72 | AM194: 34.9 | AN194: 47 | AO194: 5.0000000000000001e-003 | AP194: 34 | AQ194: 三星转债
A195: 70 | B195: 128142 | C195: 新乳转债! | D195: 2946 | E195: 新乳业 | F195: 食品饮料 | G195: 乳制品 | H195: 119.012 | I195: 4.0000000000000002e-004 | J195: -1.3100000000000001e-002 | K195: 14.1 | L195: -3.8900000000000004e-002 | M195: 115.1 | N195: 18.47 | O195: 0.55899999999999994 | P195: 76.34 | Q195: 转股中 | R195: 5.37年 | S195: 3.37年 | T195: 7.18 | U195: 4 | V195: 5.0000000000000001e-003 | W195: 5.9000000000000004e-002 | X195: 4.4999999999999998e-002 | Y195: 122 | Z195: 4.7 | AA195: -6.3e-003 | AB195: -1.1299999999999999e-002 | AC195: -3.8800000000000001e-002 | AD195: -4.0599999999999997e-002 | AE195: 89.95 | AF195: 93.07 | AG195: 0.33 | AH195: AA | AI195: 4.1200000000000001e-002 | AJ195: =H195+100*O195 -> 174.91199999999998 | AK195: 161.7 | AL195: 277 | AM195: 68.6 | AN195: 273 | AO195: -2.6000000000000002e-002 | AP195: 4 | AQ195: 新乳转债!
A196: 35 | B196: 113622 | C196: 杭叉转债! | D196: 603298 | E196: 杭叉集团 | F196: 机械装备 | G196: 通用设备 | H196: 116.58 | I196: 7.000000000000001e-004 | J196: 1.4000000000000002e-003 | K196: 17.43 | L196: 6.4000000000000003e-003 | M196: 112.5 | N196: 23.08 | O196: 0.54400000000000004 | P196: 75.52 | Q196: 2月3天 | R196: 5.63年 | S196: 3.63年 | T196: 11.5 | U196: 4.1 | V196: 3.0000000000000001e-003 | W196: 7.5999999999999998e-002 | X196: 5.7999999999999996e-002 | Y196: 151 | Z196: 2.94 | AA196: -6.4000000000000003e-003 | AB196: -1.04e-002 | AC196: -3.2199999999999999e-002 | AD196: -3.3700000000000001e-002 | AE196: 90.06 | AF196: 92.36 | AG196: 0.33 | AH196: AA+ | AI196: 3.6200000000000003e-002 | AJ196: =H196+100*O196 -> 170.98000000000002 | AK196: 157.6 | AL196: 264 | AM196: 65.3 | AN196: 258 | AO196: 3.7999999999999999e-002 | AP196: 4 | AQ196: 杭叉转债!
A197: 165 | B197: 123057 | C197: 美联转债! | D197: 300586 | E197: 美联新材 | F197: 化工 | G197: 橡胶塑料 | H197: 121.801 | I197: -5.5000000000000005e-003 | J197: 2.2000000000000001e-003 | K197: 9.8 | L197: -5.1000000000000004e-003 | M197: 117.8 | N197: 9.5 | O197: 0.18100000000000002 | P197: 103.16 | Q197: 转股中 | R197: 4.90年 | S197: 2.90年 | T197: 2.07 | U197: 75 | V197: 0.29399999999999998 | W197: 4.0000000000000001e-002 | X197: 4.2000000000000003e-002 | Y197: 51 | Z197: 6.02 | AA197: -6.8999999999999999e-003 | AB197: -1.32e-002 | AC197: -5.1500000000000004e-002 | AD197: -5.3600000000000002e-002 | AE197: 86.67 | AF197: 88.73 | AG197: 0.65 | AH197: AA- | AI197: 6.0899999999999996e-002 | AJ197: =H197+100*O197 -> 139.90100000000001 | AK197: 140.4 | AL197: 149 | AM197: 51.7 | AN197: 187 | AO197: 6.3e-002 | AP197: 20 | AQ197: 美联转债!
A198: 27 | B198: 123112 | C198: 万讯转债 | D198: 300112 | E198: 万讯自控 | F198: 机械装备 | G198: 专用设备 | H198: 129.3 | I198: 6.0000000000000001e-003 | J198: 1.2699999999999999e-002 | K198: 10.78 | L198: 2.5699999999999997e-002 | M198: 124.4 | N198: 8.93 | O198: 7.0999999999999994e-002 | P198: 120.72 | Q198: 2月9天 | R198: 5.67年 | S198: 3.67年 | T198: 2.46 | U198: 70 | V198: 0.221 | W198: 8.0000000000000002e-002 | X198: 9.6000000000000002e-002 | Y198: 31 | Z198: 2.88 | AA198: -6.8999999999999999e-003 | AB198: -1.3999999999999999e-002 | AC198: -5.4900000000000004e-002 | AD198: -5.6799999999999996e-002 | AE198: 82.96 | AF198: 89 | AG198: 0.73 | AH198: AA- | AI198: 6.2199999999999998e-002 | AJ198: =H198+100*O198 -> 136.40000000000001 | AK198: 137.9 | AL198: 126 | AM198: 48.9 | AN198: 161 | AO198: 0.107 | AP198: 12 | AQ198: 万讯转债
A199: 34 | B199: 110079 | C199: 杭银转债! | D199: 600926 | E199: 杭州银行 | F199: 金融 | G199: 银行行业 | H199: 116.92 | I199: 7.7000000000000002e-003 | J199: -1.01e-002 | K199: 11.78 | L199: -9.300000000000001e-003 | M199: 112.4 | N199: 16.71 | O199: 0.65900000000000003 | P199: 70.5 | Q199: 2月3天 | R199: 5.64年 | S199: 3.65年 | T199: 150 | U199: 650 | V199: 3.7000000000000005e-002 | W199: 0.215 | X199: 0.151 | Y199: 699 | Z199: 1.06 | AA199: -7.0999999999999995e-003 | AB199: -1.1000000000000001e-002 | AC199: -3.3099999999999997e-002 | AD199: -3.4500000000000003e-002 | AE199: 90.6 | AF199: 93.24 | AG199: 0.27 | AH199: AAA | AI199: 3.4200000000000001e-002 | AJ199: =H199+100*O199 -> 182.81999999999999 | AK199: 163.3 | AL199: 282 | AM199: 70.1 | AN199: 280 | AO199: -8.4000000000000005e-002 | AP199: 10 | AQ199: 杭银转债!
A200: 82 | B200: 127026 | C200: 超声转债! | D200: 823 | E200: 超声电子 | F200: 电子 | G200: 元器件制 | H200: 117.495 | I200: -4.3e-003 | J200: 1.5800000000000002e-002 | K200: 11.88 | L200: 2.1499999999999998e-002 | M200: 113.1 | N200: 12.72 | O200: 0.25800000000000001 | P200: 93.4 | Q200: 转股中 | R200: 5.34年 | S200: 3.34年 | T200: 7 | U200: 20 | V200: 2.4e-002 | W200: 0.11 | X200: 0.10199999999999999 | Y200: 64 | Z200: 1.66 | AA200: -7.1999999999999998e-003 | AB200: -1.1599999999999999e-002 | AC200: -3.5499999999999997e-002 | AD200: -3.7400000000000003e-002 | AE200: 90.04 | AF200: 91.56 | AG200: 0.53 | AH200: AA | AI200: 4.1200000000000001e-002 | AJ200: =H200+100*O200 -> 143.29500000000002 | AK200: 141.6 | AL200: 159 | AM200: 50 | AN200: 168 | AO200: 3.2000000000000001e-002 | AP200: 12 | AQ200: 超声转债!
A201: 61 | B201: 113618 | C201: 美诺转债! | D201: 603538 | E201: 美诺华 | F201: 医药 | G201: 原料药 | H201: 120.13 | I201: -7.9000000000000008e-003 | J201: -9.300000000000001e-003 | K201: 34.46 | L201: -2.7900000000000001e-002 | M201: 115.3 | N201: 37.47 | O201: 0.30599999999999999 | P201: 91.97 | Q201: 转股中 | R201: 5.44年 | S201: 3.44年 | T201: 5.2 | U201: 12 | V201: 1.9e-002 | W201: 0.10099999999999999 | X201: 9.3000000000000013e-002 | Y201: 52 | Z201: 3.11 | AA201: -7.7000000000000002e-003 | AB201: -1.26e-002 | AC201: -4.0000000000000001e-002 | AD201: -4.1900000000000007e-002 | AE201: 83.69 | AF201: 83.61 | AG201: 0.62 | AH201: AA- | AI201: 6.2199999999999998e-002 | AJ201: =H201+100*O201 -> 150.72999999999999 | AK201: 148.3 | AL201: 215 | AM201: 64.6 | AN201: 253 | AO201: -9.3000000000000013e-002 | AP201: 5 | AQ201: 美诺转债!
A202: 314 | B202: 128048 | C202: 张行转债 | D202: 2839 | E202: 张家港行 | F202: 金融 | G202: 银行行业 | H202: 116.3 | I202: 1.6e-002 | J202: 1.e-003 | K202: 5.75 | L202: 3.2300000000000002e-002 | M202: 113.3 | N202: 5.6 | O202: 0.13300000000000001 | P202: 102.68 | Q202: 转股中 | R202: 3.27年 | S202: 无权 | T202: 25 | U202: 106 | V202: 3.7000000000000005e-002 | W202: 0.23999999999999999 | X202: 0.247 | Y202: 104 | Z202: 0.93 | AA202: -8.1000000000000013e-003 | AB202: -1.54e-002 | AC202: 无权 | AD202: 无权 | AE202: 无权 | AF202: 101.53 | AG202: 0.53 | AH202: AA+ | AI202: 3.49e-002 | AJ202: =H202+100*O202 -> 129.59999999999999 | AK202: 129.9 | AL202: 39 | AM202: 28.4 | AN202: 18 | AO202: 4.5999999999999999e-002 | AP202: 12 | AQ202: 张行转债
A203: 193 | B203: 110070 | C203: 凌钢转债! | D203: 600231 | E203: 凌钢股份 | F203: 钢铁 | G203: 炼钢 | H203: 122.03 | I203: 2.0899999999999998e-002 | J203: 5.5000000000000005e-003 | K203: 3.02 | L203: 4.1399999999999999e-002 | M203: 117.4 | N203: 2.69 | O203: 8.6999999999999994e-002 | P203: 112.27 | Q203: 转股中 | R203: 4.68年 | S203: 2.69年 | T203: 2.17 | U203: 50 | V203: 0.188 | W203: 2.5000000000000001e-002 | X203: 2.7999999999999997e-002 | Y203: 86 | Z203: 0.99 | AA203: -8.3999999999999995e-003 | AB203: -1.4800000000000001e-002 | AC203: -5.5800000000000002e-002 | AD203: -5.8099999999999999e-002 | AE203: 92.89 | AF203: 98.13 | AG203: 0.64 | AH203: AA | AI203: 3.9900000000000005e-002 | AJ203: =H203+100*O203 -> 130.72999999999999 | AK203: 131.8 | AL203: 53 | AM203: 33.7 | AN203: 41 | AO203: 4.0000000000000001e-003 | AP203: 22 | AQ203: 凌钢转债!
A204: 230 | B204: 128091 | C204: 新天转债 | D204: 2873 | E204: 新天药业 | F204: 医药 | G204: 中药 | H204: 123.999 | I204: -6.6e-003 | J204: -3.8e-003 | K204: 16.87 | L204: -1.5800000000000002e-002 | M204: 119.4 | N204: 16.27 | O204: 0.19600000000000001 | P204: 103.69 | Q204: 转股中 | R204: 4.40年 | S204: 2.40年 | T204: 1.76 | U204: 39 | V204: 0.17899999999999999 | W204: 8.900000000000001e-002 | X204: 9.1999999999999998e-002 | Y204: 20 | Z204: 2.42 | AA204: -8.8000000000000005e-003 | AB204: -1.6299999999999999e-002 | AC204: -6.54e-002 | AD204: -6.8400000000000002e-002 | AE204: 87.65 | AF204: 88.73 | AG204: 0.66 | AH204: A+ | AI204: 7.1900000000000006e-002 | AJ204: =H204+100*O204 -> 143.59899999999999 | AK204: 144.3 | AL204: 185 | AM204: 55.6 | AN204: 208 | AO204: -1.6e-002 | AP204: 18 | AQ204: 新天转债
A205: 21 | B205: 113048 | C205: 晶科转债! | D205: 601778 | E205: 晶科科技 | F205: 能源电力 | G205: 太阳能 | H205: 123.14 | I205: 3.0499999999999999e-002 | J205: 1.e-004 | K205: 5.96 | L205: 4.7500000000000001e-002 | M205: 117.1 | N205: 5.48 | O205: 0.13200000000000001 | P205: 108.76 | Q205: 2月24天 | R205: 5.71年 | S205: 3.71年 | T205: 30 | U205: 185 | V205: 4.9000000000000002e-002 | W205: 0.182 | X205: 0.19800000000000001 | Y205: 165 | Z205: 1.52 | AA205: -8.8999999999999999e-003 | AB205: -1.41e-002 | AC205: -4.3899999999999995e-002 | AD205: -4.5499999999999999e-002 | AE205: 88.7 | AF205: 93.37 | AG205: 0.64 | AH205: AA | AI205: 4.1200000000000001e-002 | AJ205: =H205+100*O205 -> 136.34 | AK205: 137.5 | AL205: 120 | AM205: 44.2 | AN205: 129 | AO205: 5.9000000000000004e-002 | AP205: 8 | AQ205: 晶科转债!
A206: 238 | B206: 110063 | C206: 鹰19转债 | D206: 600567 | E206: 山鹰国际 | F206: 造纸包装 | G206: 包装用纸 | H206: 120.5 | I206: 1.66e-002 | J206: -1.34e-002 | K206: 3.3 | L206: 6.0999999999999995e-003 | M206: 115.9 | N206: 3.26 | O206: 0.19 | P206: 101.23 | Q206: 转股中 | R206: 4.35年 | S206: 2.35年 | T206: 18.5 | U206: 35 | V206: 1.6e-002 | W206: 0.121 | X206: 0.12300000000000001 | Y206: 152 | Z206: 0.98 | AA206: -9.1000000000000004e-003 | AB206: -1.55e-002 | AC206: -5.9999999999999998e-002 | AD206: -6.2300000000000001e-002 | AE206: 94.76 | AF206: 100.12 | AG206: 0.53 | AH206: AA+ | AI206: 3.49e-002 | AJ206: =H206+100*O206 -> 139.5 | AK206: 139.8 | AL206: 142 | AM206: 39.7 | AN206: 92 | AO206: -9.0000000000000011e-003 | AP206: 32 | AQ206: 鹰19转债
A207: 241 | B207: 110062 | C207: 烽火转债! | D207: 600498 | E207: 烽火通信 | F207: 通信互联 | G207: 通信设备 | H207: 115.43 | I207: -4.0999999999999995e-003 | J207: 9.5999999999999992e-003 | K207: 20.24 | L207: 1.3000000000000001e-002 | M207: 110.8 | N207: 22.85 | O207: 0.30299999999999999 | P207: 88.58 | Q207: 转股中 | R207: 4.32年 | S207: 2.32年 | T207: 30.9 | U207: 54 | V207: 1.4999999999999999e-002 | W207: 0.13500000000000001 | X207: 0.11900000000000001 | Y207: 229 | Z207: 2.13 | AA207: -9.5999999999999992e-003 | AB207: -1.4199999999999999e-002 | AC207: -4.4000000000000004e-002 | AD207: -4.6399999999999997e-002 | AE207: 95.38 | AF207: 96.62 | AG207: 0.42 | AH207: AAA | AI207: 3.2899999999999999e-002 | AJ207: =H207+100*O207 -> 145.73000000000002 | AK207: 142.3 | AL207: 168 | AM207: 45.7 | AN207: 137 | AO207: 4.2999999999999997e-002 | AP207: 18 | AQ207: 烽火转债!
A208: 88 | B208: 113610 | C208: 灵康转债 | D208: 603669 | E208: 灵康药业 | F208: 医药 | G208: 化学制药 | H208: 127.58 | I208: 3.4500000000000003e-002 | J208: 1.77e-002 | K208: 10.85 | L208: 6.7900000000000002e-002 | M208: 121.1 | N208: 8.61 | O208: 1.2e-002 | P208: 126.02 | Q208: 转股中 | R208: 5.32年 | S208: 3.32年 | T208: 5.25 | U208: 157 | V208: 0.23600000000000002 | W208: 6.8000000000000005e-002 | X208: 8.5000000000000006e-002 | Y208: 77 | Z208: 5.5 | AA208: -1.e-002 | AB208: -1.66e-002 | AC208: -5.74e-002 | AD208: -5.9400000000000001e-002 | AE208: 84.49 | AF208: 88.48 | AG208: 0.77 | AH208: AA- | AI208: 6.2199999999999998e-002 | AJ208: =H208+100*O208 -> 128.78 | AK208: 129.1 | AL208: 35 | AM208: 40.7 | AN208: 103 | AO208: 0.126 | AP208: 27 | AQ208: 灵康转债
A209: 101 | B209: 128136 | C209: 立讯转债! | D209: 2475 | E209: 立讯精密 | F209: 电子 | G209: 元器件制 | H209: 118.06 | I209: 5.0000000000000001e-004 | J209: -5.1000000000000004e-003 | K209: 40.65 | L209: -1.8799999999999997e-002 | M209: 111.9 | N209: 58.2 | O209: 0.68999999999999995 | P209: 69.85 | Q209: 转股中 | R209: 5.24年 | S209: 3.25年 | T209: 30 | U209: 27 | V209: 8.0000000000000002e-003 | W209: 1.e-002 | X209: 6.9999999999999993e-003 | Y209: 2860. | Z209: 9.89 | AA209: -1.03e-002 | AB209: -1.44e-002 | AC209: -4.0999999999999995e-002 | AD209: -4.2300000000000004e-002 | AE209: 90.74 | AF209: 93.08 | AG209: 0.24 | AH209: AA+ | AI209: 3.6200000000000003e-002 | AJ209: =H209+100*O209 -> 187.06 | AK209: 166.3 | AL209: 289 | AM209: 73.2 | AN209: 292 | AO209: -1.2e-002 | AP209: 13 | AQ209: 立讯转债!
A210: 16 | B210: 127035 | C210: 濮耐转债 | D210: 2225 | E210: 濮耐股份 | F210: 钢铁 | G210: 钢铁行业 | H210: 120.6 | I210: 1.4999999999999999e-002 | J210: -1.1000000000000001e-002 | K210: 4.61 | L210: 6.6e-003 | M210: 114.7 | N210: 4.43 | O210: 0.159 | P210: 104.06 | Q210: 3月27天 | R210: 4.80年 | S210: 2.80年 | T210: 6.26 | U210: 30 | V210: 4.0000000000000001e-002 | W210: 0.13400000000000001 | X210: 0.14000000000000001 | Y210: 47 | Z210: 1.53 | AA210: -1.06e-002 | AB210: -1.6e-002 | AC210: -5.0799999999999998e-002 | AD210: -5.2900000000000003e-002 | AE210: 92.15 | AF210: 95.42 | AG210: 0.6 | AH210: AA | AI210: 3.9900000000000005e-002 | AJ210: =H210+100*O210 -> 136.5 | AK210: 137.1 | AL210: 115 | AM210: 41.7 | AN210: 113 | AO210: 4.8000000000000001e-002 | AP210: 10 | AQ210: 濮耐转债
A211: 115 | B211: 123068 | C211: 弘信转债 | D211: 300657 | E211: 弘信电子 | F211: 电子 | G211: 元器件制 | H211: 128.002 | I211: -3.0000000000000001e-003 | J211: 4.1999999999999997e-003 | K211: 17.77 | L211: 1.7000000000000001e-003 | M211: 121.2 | N211: 15.34 | O211: 0.105 | P211: 115.84 | Q211: 转股中 | R211: 5.19年 | S211: 3.19年 | T211: 5.65 | U211: 9.2 | V211: 1.3000000000000001e-002 | W211: 7.8e-002 | X211: 8.9999999999999997e-002 | Y211: 73 | Z211: 4.33 | AA211: -1.0700000000000001e-002 | AB211: -1.7500000000000002e-002 | AC211: -6.0299999999999999e-002 | AD211: -6.2400000000000004e-002 | AE211: 85.24 | AF211: 89.26 | AG211: 0.72 | AH211: AA- | AI211: 6.2199999999999998e-002 | AJ211: =H211+100*O211 -> 138.50200000000001 | AK211: 140.2 | AL211: 145 | AM211: 50.9 | AN211: 178 | AO211: -3.9e-002 | AP211: 8 | AQ211: 弘信转债
A212: 297 | B212: 128057 | C212: 博彦转债 | D212: 2649 | E212: 博彦科技 | F212: 计算机及 | G212: 软件开发 | H212: 121.135 | I212: -6.3e-003 | J212: 4.0999999999999995e-003 | K212: 9.53 | L212: -3.0999999999999999e-003 | M212: 116.3 | N212: 8.5 | O212: 8.0000000000000002e-002 | P212: 112.12 | Q212: 转股中 | R212: 3.58年 | S212: 1.58年 | T212: 4.94 | U212: 4.4 | V212: 6.9999999999999993e-003 | W212: 9.6999999999999989e-002 | X212: 0.109 | Y212: 51 | Z212: 1.67 | AA212: -1.15e-002 | AB212: -1.9400000000000001e-002 | AC212: -9.0399999999999994e-002 | AD212: -9.3200000000000005e-002 | AE212: 92.8 | AF212: 94.53 | AG212: 0.68 | AH212: AA- | AI212: 6.0899999999999996e-002 | AJ212: =H212+100*O212 -> 129.13499999999999 | AK212: 130.2 | AL212: 42 | AM212: 35.6 | AN212: 54 | AO212: -6.8000000000000005e-002 | AP212: 26 | AQ212: 博彦转债
A213: 154 | B213: 127020 | C213: 中金转债 | D213: 60 | E213: 中金岭南 | F213: 有色金属 | G213: 有色行业 | H213: 120.31 | I213: 1.8799999999999997e-002 | J213: 3.6600000000000001e-002 | K213: 5.34 | L213: 8.1000000000000003e-002 | M213: 113.5 | N213: 4.63 | O213: 4.2999999999999997e-002 | P213: 115.33 | Q213: 转股中 | R213: 4.95年 | S213: 2.95年 | T213: 38 | U213: 351 | V213: 7.6999999999999999e-002 | W213: 0.19899999999999998 | X213: 0.23000000000000001 | Y213: 191 | Z213: 1.6 | AA213: -1.18e-002 | AB213: -1.66e-002 | AC213: -5.0999999999999997e-002 | AD213: -5.2300000000000006e-002 | AE213: 91.92 | AF213: 95.97 | AG213: 0.68 | AH213: AA+ | AI213: 3.49e-002 | AJ213: =H213+100*O213 -> 124.61 | AK213: 125.3 | AL213: 21 | AM213: 29.3 | AN213: 24 | AO213: 7.400000000000001e-002 | AP213: 15 | AQ213: 中金转债
A214: 181 | B214: 123051 | C214: 今天转债 | D214: 300532 | E214: 今天国际 | F214: 计算机及 | G214: 软件开发 | H214: 129.5 | I214: 1.9400000000000001e-002 | J214: -2.e-003 | K214: 10.21 | L214: 2.41e-002 | M214: 122.3 | N214: 8.7 | O214: 0.10300000000000001 | P214: 117.36 | Q214: 转股中 | R214: 4.83年 | S214: 2.83年 | T214: 2.8 | U214: 22 | V214: 5.9999999999999998e-002 | W214: 0.10000000000000001 | X214: 0.11800000000000001 | Y214: 28 | Z214: 3.58 | AA214: -1.2e-002 | AB214: -1.9699999999999999e-002 | AC214: -7.0599999999999996e-002 | AD214: -7.2999999999999995e-002 | AE214: 84.85 | AF214: 88.17 | AG214: 0.72 | AH214: A+ | AI214: 7.1900000000000006e-002 | AJ214: =H214+100*O214 -> 139.80000000000001 | AK214: 141.6 | AL214: 160 | AM214: 53.5 | AN214: 198 | AO214: 8.4000000000000005e-002 | AP214: 18 | AQ214: 今天转债
A215: 94 | B215: 110077 | C215: 洪城转债 | D215: 600461 | E215: 洪城环境 | F215: 城市公用 | G215: 城市公用 | H215: 121.69 | I215: 0. | J215: 0. | K215: 7.14 | L215: 0. | M215: 113.5 | N215: 6.71 | O215: 0.14400000000000002 | P215: 106.41 | Q215: 转股中 | R215: 5.29年 | S215: 3.29年 | T215: 18 | U215: 0 | V215: 0. | W215: 0.26600000000000001 | X215: 0.28300000000000003 | Y215: 68 | Z215: 1.26 | AA215: -1.32e-002 | AB215: -1.77e-002 | AC215: -4.9400000000000006e-002 | AD215: -5.0499999999999996e-002 | AE215: 90.49 | AF215: 94.27 | AG215: 0.63 | AH215: AA+ | AI215: 3.6200000000000003e-002 | AJ215: =H215+100*O215 -> 136.09 | AK215: 137 | AL215: 112 | AM215: 42.7 | AN215: 119 | AO215: -1.e-003 | AP215: 6 | AQ215: 洪城转债
A216: 150 | B216: 123061 | C216: 航新转债! | D216: 300424 | E216: 航新科技 | F216: 航空航天 | G216: 航空航天 | H216: 132.9 | I216: 9.1000000000000004e-003 | J216: -2.0499999999999997e-002 | K216: 17.67 | L216: -1.5600000000000001e-002 | M216: 124.3 | N216: 14.85 | O216: 0.11699999999999999 | P216: 118.99 | Q216: 转股中 | R216: 4.96年 | S216: 2.96年 | T216: 2.5 | U216: 472 | V216: 1.4399999999999999 | W216: 5.9000000000000004e-002 | X216: 7.0000000000000007e-002 | Y216: 42 | Z216: 6.36 | AA216: -1.37e-002 | AB216: -2.1700000000000001e-002 | AC216: -7.5499999999999998e-002 | AD216: -7.7800000000000008e-002 | AE216: 84.08 | AF216: 88.79 | AG216: 0.73 | AH216: A+ | AI216: 7.1900000000000006e-002 | AJ216: =H216+100*O216 -> 144.59999999999999 | AK216: 146.8 | AL216: 204 | AM216: 58 | AN216: 227 | AO216: 6.0999999999999999e-002 | AP216: 20 | AQ216: 航新转债!
A217: 340 | B217: 128035 | C217: 大族转债! | D217: 2008 | E217: 大族激光 | F217: 机械装备 | G217: 专用设备 | H217: 111.5 | I217: 7.7000000000000002e-003 | J217: -7.6e-003 | K217: 36.22 | L217: 1.1200000000000002e-002 | M217: 107.4 | N217: 51.9 | O217: 0.59799999999999998 | P217: 69.79 | Q217: 转股中 | R217: 2.51年 | S217: 0.51年 | T217: 23 | U217: 33 | V217: 1.3000000000000001e-002 | W217: 5.9000000000000004e-002 | X217: 4.2000000000000003e-002 | Y217: 386 | Z217: 4.02 | AA217: -1.4999999999999999e-002 | AB217: -2.0499999999999997e-002 | AC217: -0.10800000000000001 | AD217: -0.11800000000000001 | AE217: 101.54 | AF217: 99.02 | AG217: 0.01 | AH217: AA+ | AI217: 3.3399999999999999e-002 | AJ217: =H217+100*O217 -> 171.30000000000001 | AK217: 153.2 | AL217: 241 | AM217: 51.7 | AN217: 186 | AO217: -3.2000000000000001e-002 | AP217: 18 | AQ217: 大族转债!
A218: 116 | B218: 110075 | C218: 南航转债 | D218: 600029 | E218: 南方航空 | F218: 交通运输 | G218: 航空运输 | H218: 118.84 | I218: -3.5999999999999999e-003 | J218: 2.e-003 | K218: 5.26 | L218: -3.8e-003 | M218: 110 | N218: 6.24 | O218: 0.40999999999999998 | P218: 84.29 | Q218: 转股中 | R218: 5.19年 | S218: 3.19年 | T218: 59 | U218: 8 | V218: 1.e-003 | W218: 6.6000000000000003e-002 | X218: 5.5999999999999994e-002 | Y218: 891 | Z218: 1.23 | AA218: -1.4999999999999999e-002 | AB218: -1.84e-002 | AC218: -4.4000000000000004e-002 | AD218: -4.5199999999999997e-002 | AE218: 91.4 | AF218: 92.6 | AG218: 0.42 | AH218: AAA | AI218: 3.4200000000000001e-002 | AJ218: =H218+100*O218 -> 159.84 | AK218: 153.4 | AL218: 243 | AM218: 60.8 | AN218: 239 | AO218: -8.0000000000000002e-002 | AP218: 7 | AQ218: 南航转债
A219: 178 | B219: 123052 | C219: 飞鹿转债 | D219: 300665 | E219: 飞鹿股份 | F219: 化工 | G219: 化工 | H219: 136.49 | I219: 4.0000000000000002e-004 | J219: 4.5000000000000005e-003 | K219: 9.46 | L219: 6.4000000000000003e-003 | M219: 126.8 | N219: 7.05 | O219: 1.7000000000000001e-002 | P219: 134.18 | Q219: 转股中 | R219: 4.83年 | S219: 2.83年 | T219: 1.51 | U219: 39 | V219: 0.191 | W219: 9.1999999999999998e-002 | X219: 0.124 | Y219: 16 | Z219: 2.46 | AA219: -1.55e-002 | AB219: -2.4300000000000002e-002 | AC219: -8.5500000000000007e-002 | AD219: -8.8100000000000012e-002 | AE219: 85.26 | AF219: 91.44 | AG219: 0.77 | AH219: A+ | AI219: 7.1900000000000006e-002 | AJ219: =H219+100*O219 -> 138.19 | AK219: 138.8 | AL219: 134 | AM219: 47.4 | AN219: 147 | AO219: 8.6999999999999994e-002 | AP219: 19 | AQ219: 飞鹿转债
A220: 84 | B220: 128140 | C220: 润建转债! | D220: 2929 | E220: 润建股份 | F220: 通信互联 | G220: 通信设备 | H220: 125 | I220: -7.9000000000000008e-003 | J220: 1.15e-002 | K220: 28.55 | L220: 5.6000000000000008e-003 | M220: 115.2 | N220: 26.4 | O220: 0.156 | P220: 108.14 | Q220: 转股中 | R220: 5.34年 | S220: 3.34年 | T220: 10.9 | U220: 5.9 | V220: 4.0000000000000001e-003 | W220: 0.17300000000000001 | X220: 0.187 | Y220: 63 | Z220: 1.99 | AA220: -1.55e-002 | AB220: -2.0400000000000001e-002 | AC220: -5.2400000000000002e-002 | AD220: -5.4199999999999998e-002 | AE220: 90.15 | AF220: 93.27 | AG220: 0.65 | AH220: AA | AI220: 4.1200000000000001e-002 | AJ220: =H220+100*O220 -> 140.59999999999999 | AK220: 141.9 | AL220: 163 | AM220: 48.6 | AN220: 154 | AO220: 3.9e-002 | AP220: 13 | AQ220: 润建转债!
A221: 130 | B221: 113039 | C221: 嘉泽转债! | D221: 601619 | E221: 嘉泽新能 | F221: 能源电力 | G221: 风能 | H221: 122.41 | I221: 4.3e-003 | J221: -2.5999999999999999e-003 | K221: 3.99 | L221: 2.5000000000000001e-003 | M221: 113.1 | N221: 3.46 | O221: 6.2e-002 | P221: 115.32 | Q221: 转股中 | R221: 5年17天 | S221: 3年18天 | T221: 5.4 | U221: 35 | V221: 5.4000000000000006e-002 | W221: 5.7000000000000002e-002 | X221: 6.6000000000000003e-002 | Y221: 94 | Z221: 2.32 | AA221: -1.5800000000000002e-002 | AB221: -2.0400000000000001e-002 | AC221: -5.0999999999999997e-002 | AD221: -5.2999999999999999e-002 | AE221: 91.11 | AF221: 92.64 | AG221: 0.71 | AH221: AA | AI221: 4.1200000000000001e-002 | AJ221: =H221+100*O221 -> 128.60999999999999 | AK221: 129.5 | AL221: 36 | AM221: 36.9 | AN221: 65 | AO221: 1.4999999999999999e-002 | AP221: 34 | AQ221: 嘉泽转债!
A222: 36 | B222: 127031 | C222: 洋丰转债! | D222: 902 | E222: 新洋丰 | F222: 化工 | G222: 农化 | H222: 128.05 | I222: 3.0999999999999999e-003 | J222: 3.3300000000000003e-002 | K222: 19.65 | L222: 6.5000000000000002e-002 | M222: 117.1 | N222: 19.94 | O222: 0.29899999999999999 | P222: 98.55 | Q222: 2月3天 | R222: 5.63年 | S222: 3.63年 | T222: 10 | U222: 60 | V222: 4.7e-002 | W222: 3.9e-002 | X222: 3.7999999999999999e-002 | Y222: 256 | Z222: 3.53 | AA222: -1.6e-002 | AB222: -2.12e-002 | AC222: -5.4600000000000003e-002 | AD222: -5.6299999999999996e-002 | AE222: 88.99 | AF222: 93.67 | AG222: 0.56 | AH222: AA | AI222: 4.1200000000000001e-002 | AJ222: =H222+100*O222 -> 157.95000000000002 | AK222: 157.6 | AL222: 263 | AM222: 63.9 | AN222: 249 | AO222: 3.1e-002 | AP222: 4 | AQ222: 洋丰转债!
A223: 242 | B223: 128081 | C223: 海亮转债! | D223: 2203 | E223: 海亮股份 | F223: 有色金属 | G223: 铜金属 | H223: 123 | I223: 1.44e-002 | J223: -2.5000000000000001e-003 | K223: 11.36 | L223: 1.7000000000000001e-002 | M223: 114.9 | N223: 9.69 | O223: 4.9000000000000002e-002 | P223: 117.23 | Q223: 转股中 | R223: 4.29年 | S223: 2.29年 | T223: 30.1 | U223: 32 | V223: 9.0000000000000011e-003 | W223: 0.13500000000000001 | X223: 0.158 | Y223: 223 | Z223: 2.35 | AA223: -1.61e-002 | AB223: -2.2099999999999998e-002 | AC223: -6.88e-002 | AD223: -7.1199999999999999e-002 | AE223: 94.01 | AF223: 97.49 | AG223: 0.7 | AH223: AA | AI223: 3.9900000000000005e-002 | AJ223: =H223+100*O223 -> 127.90000000000001 | AK223: 128.8 | AL223: 32 | AM223: 31.3 | AN223: 33 | AO223: 4.2000000000000003e-002 | AP223: 50 | AQ223: 海亮转债!
A224: 103 | B224: 123075 | C224: 贝斯转债! | D224: 300580 | E224: 贝斯特 | F224: 汽车 | G224: 零部件制 | H224: 125.666 | I224: 1.34e-002 | J224: -1.09e-002 | K224: 23.19 | L224: 3.9000000000000003e-003 | M224: 115.5 | N224: 23.74 | O224: 0.28600000000000003 | P224: 97.68 | Q224: 转股中 | R224: 5.24年 | S224: 3.24年 | T224: 6 | U224: 15 | V224: 2.e-002 | W224: 0.129 | X224: 0.126 | Y224: 46 | Z224: 2.69 | AA224: -1.6299999999999999e-002 | AB224: -2.1400000000000002e-002 | AC224: -5.5e-002 | AD224: -5.6900000000000006e-002 | AE224: 84.73 | AF224: 84.78 | AG224: 0.64 | AH224: AA- | AI224: 6.2199999999999998e-002 | AJ224: =H224+100*O224 -> 154.26599999999999 | AK224: 153.6 | AL224: 245 | AM224: 68.9 | AN224: 274 | AO224: 9.3000000000000013e-002 | AP224: 9 | AQ224: 贝斯转债!
A225: 371 | B225: 110034 | C225: 九州转债! | D225: 600998 | E225: 九州通 | F225: 医药 | G225: 医药商业 | H225: 108.82 | I225: 1.9e-003 | J225: -2.e-003 | K225: 14.24 | L225: -1.11e-002 | M225: 108 | N225: 17.83 | O225: 0.36299999999999999 | P225: 79.87 | Q225: 转股中 | R225: 0.45年 | S225: 回售内 | T225: 15 | U225: 11 | V225: 6.9999999999999993e-003 | W225: 5.5999999999999994e-002 | X225: 4.4999999999999998e-002 | Y225: 267 | Z225: 1.32 | AA225: -1.6899999999999998e-002 | AB225: -4.9400000000000006e-002 | AC225: 回售内 | AD225: 回售内 | AE225: 103 | AF225: 106.7 | AG225: 0 | AH225: AA+ | AI225: 2.7699999999999999e-002 | AJ225: =H225+100*O225 -> 145.12 | AK225: 137.8 | AL225: 122 | AM225: 31.1 | AN225: 32 | AO225: -1.4999999999999999e-002 | AP225: 24 | AQ225: 九州转债!
A226: 32 | B226: 123108 | C226: 乐普转2 | D226: 300003 | E226: 乐普医疗 | F226: 医药 | G226: 医疗器械 | H226: 120.154 | I226: -5.5000000000000005e-003 | J226: 1.6000000000000001e-003 | K226: 26.05 | L226: -9.1000000000000004e-003 | M226: 111.1 | N226: 29.5 | O226: 0.36099999999999999 | P226: 88.31 | Q226: 2月3天 | R226: 4.65年 | S226: 2.65年 | T226: 16.4 | U226: 22 | V226: 1.1000000000000001e-002 | W226: 3.5000000000000003e-002 | X226: 3.1e-002 | Y226: 470 | Z226: 4.42 | AA226: -1.6899999999999998e-002 | AB226: -2.12e-002 | AC226: -5.6600000000000004e-002 | AD226: -5.79e-002 | AE226: 92.7 | AF226: 94.92 | AG226: 0.43 | AH226: AA+ | AI226: 3.49e-002 | AJ226: =H226+100*O226 -> 156.25399999999999 | AK226: 152 | AL226: 234 | AM226: 57.1 | AN226: 219 | AO226: -7.2000000000000008e-002 | AP226: 9 | AQ226: 乐普转2
A227: 78 | B227: 123084 | C227: 高澜转债! | D227: 300499 | E227: 高澜股份 | F227: 能源电力 | G227: 电力设备 | H227: 133.4 | I227: 1.1399999999999999e-002 | J227: -2.23e-002 | K227: 11.27 | L227: -1.3999999999999999e-002 | M227: 121.9 | N227: 9 | O227: 6.5000000000000002e-002 | P227: 125.22 | Q227: 转股中 | R227: 5.34年 | S227: 3.35年 | T227: 2.8 | U227: 171 | V227: 0.45600000000000002 | W227: 8.900000000000001e-002 | X227: 0.11199999999999999 | Y227: 31 | Z227: 3.74 | AA227: -1.7100000000000001e-002 | AB227: -2.3900000000000001e-002 | AC227: -6.7099999999999993e-002 | AD227: -6.9400000000000003e-002 | AE227: 82.06 | AF227: 84.39 | AG227: 0.78 | AH227: A+ | AI227: 7.3200000000000001e-002 | AJ227: =H227+100*O227 -> 139.90000000000001 | AK227: 141.6 | AL227: 158 | AM227: 57.2 | AN227: 222 | AO227: 0.14300000000000002 | AP227: 15 | AQ227: 高澜转债!
A228: 161 | B228: 110071 | C228: 湖盐转债! | D228: 600929 | E228: 雪天盐业 | F228: 食品饮料 | G228: 食品饮料 | H228: 125.18 | I228: 7.3000000000000001e-003 | J228: -1.6000000000000001e-003 | K228: 7.69 | L228: 7.9000000000000008e-003 | M228: 114.9 | N228: 6.52 | O228: 6.0999999999999999e-002 | P228: 117.94 | Q228: 转股中 | R228: 4.92年 | S228: 2.93年 | T228: 7.2 | U228: 36 | V228: 4.0000000000000001e-002 | W228: 0.10000000000000001 | X228: 0.11800000000000001 | Y228: 72 | Z228: 2.66 | AA228: -1.7600000000000001e-002 | AB228: -2.2799999999999997e-002 | AC228: -6.0299999999999999e-002 | AD228: -6.2300000000000001e-002 | AE228: 91.71 | AF228: 95.11 | AG228: 0.72 | AH228: AA | AI228: 3.9900000000000005e-002 | AJ228: =H228+100*O228 -> 131.28 | AK228: 132.4 | AL228: 61 | AM228: 37.3 | AN228: 69 | AO228: 8.5000000000000006e-002 | AP228: 23 | AQ228: 湖盐转债!
A229: 183 | B229: 128108 | C229: 蓝帆转债! | D229: 2382 | E229: 蓝帆医疗 | F229: 医药 | G229: 医疗器械 | H229: 122.98 | I229: -4.0000000000000002e-004 | J229: -6.8999999999999999e-003 | K229: 20.3 | L229: -1.0700000000000001e-002 | M229: 112.9 | N229: 18.24 | O229: 0.105 | P229: 111.29 | Q229: 转股中 | R229: 4.81年 | S229: 3.81年 | T229: 15.3 | U229: 48 | V229: 2.6000000000000002e-002 | W229: 7.4999999999999997e-002 | X229: 8.3000000000000004e-002 | Y229: 204 | Z229: 1.71 | AA229: -1.8000000000000002e-002 | AB229: -2.2700000000000001e-002 | AC229: -3.8900000000000004e-002 | AD229: -4.1299999999999996e-002 | AE229: 90.29 | AF229: 93.89 | AG229: 0.68 | AH229: AA | AI229: 3.9900000000000005e-002 | AJ229: =H229+100*O229 -> 133.48000000000002 | AK229: 134.7 | AL229: 83 | AM229: 40.8 | AN229: 106 | AO229: -3.0000000000000001e-003 | AP229: 26 | AQ229: 蓝帆转债!
A230: 266 | B230: 113541 | C230: 荣晟转债! | D230: 603165 | E230: 荣晟环保 | F230: 造纸包装 | G230: 包装用纸 | H230: 122.9 | I230: 2.5999999999999999e-003 | J230: -5.5000000000000005e-003 | K230: 12.26 | L230: -4.0999999999999995e-003 | M230: 114.3 | N230: 10.84 | O230: 8.6999999999999994e-002 | P230: 113.1 | Q230: 转股中 | R230: 3.96年 | S230: 1.96年 | T230: 1.63 | U230: 3.3 | V230: 1.6e-002 | W230: 5.0999999999999997e-002 | X230: 5.7000000000000002e-002 | Y230: 32 | Z230: 1.84 | AA230: -1.8500000000000003e-002 | AB230: -2.4700000000000003e-002 | AC230: -8.1000000000000003e-002 | AD230: -8.3199999999999996e-002 | AE230: 90.72 | AF230: 90.82 | AG230: 0.7 | AH230: AA- | AI230: 6.0899999999999996e-002 | AJ230: =H230+100*O230 -> 131.59999999999999 | AK230: 132.7 | AL230: 63 | AM230: 41.9 | AN230: 114 | AO230: -1.8000000000000002e-002 | AP230: 42 | AQ230: 荣晟转债!
A231: 190 | B231: 113577 | C231: 春秋转债! | D231: 603890 | E231: 春秋电子 | F231: 电子 | G231: 电子产品 | H231: 128.6 | I231: 2.3e-003 | J231: 1.6899999999999998e-002 | K231: 12.88 | L231: 2.63e-002 | M231: 117.7 | N231: 10.86 | O231: 8.4000000000000005e-002 | P231: 118.6 | Q231: 转股中 | R231: 4.69年 | S231: 2.69年 | T231: 1.78 | U231: 15 | V231: 6.5000000000000002e-002 | W231: 3.5000000000000003e-002 | X231: 4.2000000000000003e-002 | Y231: 50 | Z231: 2.63 | AA231: -1.9099999999999999e-002 | AB231: -2.5499999999999998e-002 | AC231: -7.3499999999999996e-002 | AD231: -7.5600000000000001e-002 | AE231: 87.67 | AF231: 89.76 | AG231: 0.73 | AH231: AA- | AI231: 6.0899999999999996e-002 | AJ231: =H231+100*O231 -> 137. | AK231: 138.6 | AL231: 132 | AM231: 48.8 | AN231: 160 | AO231: 7.9000000000000001e-002 | AP231: 14 | AQ231: 春秋转债!
A232: 255 | B232: 128078 | C232: 太极转债! | D232: 2368 | E232: 太极股份 | F232: 计算机及 | G232: 软件开发 | H232: 127.1 | I232: 8.0000000000000004e-004 | J232: -8.0000000000000004e-004 | K232: 23.26 | L232: 9.1000000000000004e-003 | M232: 116.9 | N232: 22.21 | O232: 0.214 | P232: 104.73 | Q232: 转股中 | R232: 4.21年 | S232: 2.21年 | T232: 9.6 | U232: 2.9 | V232: 2.e-003 | W232: 7.0999999999999994e-002 | X232: 7.4999999999999997e-002 | Y232: 135 | Z232: 4.02 | AA232: -2.0099999999999996e-002 | AB232: -2.69e-002 | AC232: -8.4100000000000008e-002 | AD232: -8.6500000000000007e-002 | AE232: 94.33 | AF232: 99.51 | AG232: 0 | AH232: AA | AI232: 3.9900000000000005e-002 | AJ232: =H232+100*O232 -> 148.5 | AK232: 149.5 | AL232: 220 | AM232: 50 | AN232: 167 | AO232: 2.7000000000000003e-002 | AP232: 10 | AQ232: 太极转债!
A233: 185 | B233: 113579 | C233: 健友转债! | D233: 603707 | E233: 健友股份 | F233: 医药 | G233: 原料药 | H233: 125.34 | I233: -1.5600000000000001e-002 | J233: 7.000000000000001e-004 | K233: 31.64 | L233: -2.7099999999999999e-002 | M233: 113.9 | N233: 32.2 | O233: 0.27600000000000002 | P233: 98.26 | Q233: 转股中 | R233: 4.71年 | S233: 2.71年 | T233: 5.03 | U233: 15 | V233: 2.3e-002 | W233: 1.3000000000000001e-002 | X233: 1.3000000000000001e-002 | Y233: 385 | Z233: 7.41 | AA233: -2.0499999999999997e-002 | AB233: -2.5600000000000001e-002 | AC233: -6.5099999999999991e-002 | AD233: -6.7199999999999996e-002 | AE233: 92.48 | AF233: 95.07 | AG233: 0.55 | AH233: AA | AI233: 3.9900000000000005e-002 | AJ233: =H233+100*O233 -> 152.94 | AK233: 152.4 | AL233: 236 | AM233: 57.3 | AN233: 225 | AO233: -6.9999999999999993e-003 | AP233: 9 | AQ233: 健友转债!
A234: 215 | B234: 113568 | C234: 新春转债! | D234: 603667 | E234: 五洲新春 | F234: 机械装备 | G234: 通用设备 | H234: 136.45 | I234: 1.03e-002 | J234: -5.0000000000000001e-003 | K234: 11.27 | L234: 7.0999999999999995e-003 | M234: 124.3 | N234: 8.75 | O234: 5.9000000000000004e-002 | P234: 128.8 | Q234: 转股中 | R234: 4.58年 | S234: 2.58年 | T234: 2.74 | U234: 60 | V234: 0.16200000000000001 | W234: 8.3000000000000004e-002 | X234: 0.107 | Y234: 33 | Z234: 1.86 | AA234: -2.06e-002 | AB234: -2.92e-002 | AC234: -9.4299999999999995e-002 | AD234: -9.6799999999999997e-002 | AE234: 88.77 | AF234: 95.44 | AG234: 0.75 | AH234: AA- | AI234: 6.0899999999999996e-002 | AJ234: =H234+100*O234 -> 142.34999999999999 | AK234: 144.1 | AL234: 184 | AM234: 48.7 | AN234: 157 | AO234: -4.4000000000000004e-002 | AP234: 46 | AQ234: 新春转债!
A235: 53 | B235: 123098 | C235: 一品转债 | D235: 300723 | E235: 一品红 | F235: 医药 | G235: 医药行业 | H235: 139.107 | I235: -5.8999999999999999e-003 | J235: 8.8999999999999999e-003 | K235: 35.55 | L235: 3.7000000000000002e-003 | M235: 124 | N235: 25.45 | O235: -4.0000000000000001e-003 | P235: 139.69 | Q235: 转股中 | R235: 5.48年 | S235: 3.48年 | T235: 4.53 | U235: 136 | V235: 0.21600000000000003 | W235: 4.4000000000000004e-002 | X235: 6.2e-002 | Y235: 103 | Z235: 6.94 | AA235: -2.1099999999999997e-002 | AB235: -2.8199999999999999e-002 | AC235: -7.7499999999999999e-002 | AD235: -7.9299999999999995e-002 | AE235: 83.59 | AF235: 89.7 | AG235: 0.81 | AH235: AA- | AI235: 6.2199999999999998e-002 | AJ235: =H235+100*O235 -> 138.70699999999999 | AK235: 138.5 | AL235: 131 | AM235: 48.8 | AN235: 158 | AO235: 0. | AP235: 6 | AQ235: 一品转债
A236: 104 | B236: 113607 | C236: 伟20转债! | D236: 603568 | E236: 伟明环保 | F236: 城市公用 | G236: 三废处理 | H236: 128.51 | I236: -9.8999999999999991e-003 | J236: 2.0999999999999999e-003 | K236: 26.88 | L236: -1.03e-002 | M236: 115.1 | N236: 21.71 | O236: 3.7999999999999999e-002 | P236: 123.81 | Q236: 转股中 | R236: 5.24年 | S236: 3.24年 | T236: 12 | U236: 9.7 | V236: 6.0000000000000001e-003 | W236: 3.6000000000000004e-002 | X236: 4.4000000000000004e-002 | Y236: 338 | Z236: 6.04 | AA236: -2.12e-002 | AB236: -2.6099999999999998e-002 | AC236: -6.1799999999999994e-002 | AD236: -6.3600000000000004e-002 | AE236: 90.4 | AF236: 93.54 | AG236: 0.76 | AH236: AA | AI236: 4.1200000000000001e-002 | AJ236: =H236+100*O236 -> 132.31 | AK236: 133.2 | AL236: 69 | AM236: 39.7 | AN236: 93 | AO236: 2.4e-002 | AP236: 5 | AQ236: 伟20转债!
A237: 7 | B237: 113051 | C237: 节能转债 | D237: 601016 | E237: 节能风电 | F237: 能源电力 | G237: 风能 | H237: 130.01 | I237: 1.1000000000000001e-002 | J237: -1.54e-002 | K237: 4.33 | L237: -6.8999999999999999e-003 | M237: 114.5 | N237: 4.05 | O237: 0.21600000000000003 | P237: 106.91 | Q237: 4月21天 | R237: 5.87年 | S237: 3.88年 | T237: 30 | U237: 196 | V237: 5.0000000000000003e-002 | W237: 0.13800000000000001 | X237: 0.14800000000000002 | Y237: 217 | Z237: 2.14 | AA237: -2.1700000000000001e-002 | AB237: -2.5899999999999999e-002 | AC237: -5.6299999999999996e-002 | AD237: -5.7599999999999998e-002 | AE237: 89.29 | AF237: 93.19 | AG237: 0.63 | AH237: AA+ | AI237: 3.6200000000000003e-002 | AJ237: =H237+100*O237 -> 151.60999999999999 | AK237: 153.1 | AL237: 240 | AM237: 59.9 | AN237: 235 | AO237: 8.3000000000000004e-002 | AP237: 4 | AQ237: 节能转债
A238: 259 | B238: 128075 | C238: 远东转债! | D238: 2406 | E238: 远东传动 | F238: 汽车 | G238: 零部件制 | H238: 125.74 | I238: 1.3999999999999999e-002 | J238: 3.4000000000000002e-003 | K238: 6.41 | L238: 2.4e-002 | M238: 114.9 | N238: 5.29 | O238: 3.7999999999999999e-002 | P238: 121.17 | Q238: 转股中 | R238: 4年47天 | S238: 2年48天 | T238: 5.44 | U238: 26 | V238: 3.7999999999999999e-002 | W238: 0.13600000000000001 | X238: 0.16500000000000001 | Y238: 40 | Z238: 1.21 | AA238: -2.2000000000000002e-002 | AB238: -2.8300000000000002e-002 | AC238: -8.2400000000000001e-002 | AD238: -8.4900000000000003e-002 | AE238: 94.61 | AF238: 98.11 | AG238: 0.73 | AH238: AA | AI238: 3.9900000000000005e-002 | AJ238: =H238+100*O238 -> 129.53999999999999 | AK238: 130.3 | AL238: 45 | AM238: 32.2 | AN238: 35 | AO238: 2.3e-002 | AP238: 14 | AQ238: 远东转债!
A239: 350 | B239: 128026 | C239: 众兴转债! | D239: 2772 | E239: 众兴菌业 | F239: 农业 | G239: 种植业 | H239: 115.2 | I239: 0. | J239: -7.1999999999999998e-003 | K239: 10.86 | L239: -1.4499999999999999e-002 | M239: 109.3 | N239: 11.36 | O239: 0.20499999999999999 | P239: 95.6 | Q239: 转股中 | R239: 2.35年 | S239: 0.35年 | T239: 4.09 | U239: 131 | V239: 0.27600000000000002 | W239: 9.3000000000000013e-002 | X239: 8.900000000000001e-002 | Y239: 44 | Z239: 1.55 | AA239: -2.2499999999999999e-002 | AB239: -2.9600000000000001e-002 | AC239: -0.23699999999999999 | AD239: -0.24299999999999999 | AE239: 98.8 | AF239: 95.67 | AG239: 0.5 | AH239: AA- | AI239: 5.9400000000000001e-002 | AJ239: =H239+100*O239 -> 135.69999999999999 | AK239: 134.8 | AL239: 84 | AM239: 36 | AN239: 56 | AO239: -0.183 | AP239: 57 | AQ239: 众兴转债!
A240: 72 | B240: 113614 | C240: 健20转债! | D240: 603707 | E240: 健友股份 | F240: 医药 | G240: 原料药 | H240: 128.78 | I240: 1.1999999999999999e-003 | J240: -1.9299999999999998e-002 | K240: 31.64 | L240: -2.7099999999999999e-002 | M240: 114.2 | N240: 29.12 | O240: 0.185 | P240: 108.65 | Q240: 转股中 | R240: 5.36年 | S240: 3.37年 | T240: 7.8 | U240: 21 | V240: 2.1000000000000001e-002 | W240: 2.e-002 | X240: 2.2000000000000002e-002 | Y240: 385 | Z240: 7.41 | AA240: -2.2599999999999999e-002 | AB240: -2.7099999999999999e-002 | AC240: -5.9999999999999998e-002 | AD240: -6.1799999999999994e-002 | AE240: 90.05 | AF240: 92.37 | AG240: 0.67 | AH240: AA | AI240: 4.1200000000000001e-002 | AJ240: =H240+100*O240 -> 147.28 | AK240: 148.9 | AL240: 218 | AM240: 56.5 | AN240: 216 | AO240: -6.9999999999999993e-003 | AP240: 4 | AQ240: 健20转债!
A241: 326 | B241: 110045 | C241: 海澜转债! | D241: 600398 | E241: 海澜之家 | F241: 服装纺织 | G241: 服装行业 | H241: 117.99 | I241: -7.3000000000000001e-003 | J241: 8.6999999999999994e-003 | K241: 7.08 | L241: 2.8000000000000004e-003 | M241: 110.3 | N241: 7.04 | O241: 0.17300000000000001 | P241: 100.57 | Q241: 转股中 | R241: 2.93年 | S241: 0.94年 | T241: 29.5 | U241: 25 | V241: 6.9999999999999993e-003 | W241: 9.6000000000000002e-002 | X241: 9.6999999999999989e-002 | Y241: 306 | Z241: 2.18 | AA241: -2.29e-002 | AB241: -2.92e-002 | AC241: -0.128 | AD241: -0.129 | AE241: 97.63 | AF241: 100.26 | AG241: 0.5 | AH241: AA+ | AI241: 3.3399999999999999e-002 | AJ241: =H241+100*O241 -> 135.28999999999999 | AK241: 135.4 | AL241: 96 | AM241: 35.1 | AN241: 50 | AO241: -2.3e-002 | AP241: 49 | AQ241: 海澜转债!
A242: 22 | B242: 123113 | C242: 仙乐转债 | D242: 300791 | E242: 仙乐健康 | F242: 食品饮料 | G242: 食品饮料 | H242: 135 | I242: 4.5999999999999999e-003 | J242: -3.7000000000000002e-003 | K242: 63.59 | L242: 1.2999999999999999e-003 | M242: 118.5 | N242: 56.92 | O242: 0.20800000000000002 | P242: 111.72 | Q242: 2月20天 | R242: 5.70年 | S242: 3.70年 | T242: 10.3 | U242: 13 | V242: 9.0000000000000011e-003 | W242: 8.9999999999999997e-002 | X242: 0.10000000000000001 | Y242: 114 | Z242: 3.4 | AA242: -2.3e-002 | AB242: -2.8399999999999998e-002 | AC242: -6.6100000000000006e-002 | AD242: -6.7799999999999999e-002 | AE242: 82.41 | AF242: 84.59 | AG242: 0.72 | AH242: AA- | AI242: 6.2199999999999998e-002 | AJ242: =H242+100*O242 -> 155.80000000000001 | AK242: 158.3 | AL242: 267 | AM242: 73.7 | AN242: 293 | AO242: 8.199999999999999e-002 | AP242: 3 | AQ242: 仙乐转债
A243: 73 | B243: 123087 | C243: 明电转债! | D243: 300739 | E243: 明阳电路 | F243: 电子 | G243: 元器件制 | H243: 137.02 | I243: 7.8000000000000005e-003 | J243: 2.1600000000000001e-002 | K243: 22.31 | L243: 3.6200000000000003e-002 | M243: 121.2 | N243: 16.32 | O243: 2.e-003 | P243: 136.7 | Q243: 转股中 | R243: 5.36年 | S243: 4.36年 | T243: 4.2 | U243: 1177. | V243: 2.04 | W243: 6.7000000000000004e-002 | X243: 9.1999999999999998e-002 | Y243: 62 | Z243: 4.4 | AA243: -2.3099999999999999e-002 | AB243: -2.9600000000000001e-002 | AC243: -5.4600000000000003e-002 | AD243: -5.7099999999999998e-002 | AE243: 81.62 | AF243: 88.37 | AG243: 0.81 | AH243: AA- | AI243: 6.2199999999999998e-002 | AJ243: =H243+100*O243 -> 137.22 | AK243: 137.3 | AL243: 119 | AM243: 49 | AN243: 162 | AO243: 0.19500000000000001 | AP243: 19 | AQ243: 明电转债!
A244: 351 | B244: 128025 | C244: 特一转债! | D244: 2728 | E244: 特一药业 | F244: 医药 | G244: 化学制药 | H244: 114.905 | I244: 2.0000000000000001e-004 | J244: -2.0000000000000001e-004 | K244: 12.23 | L244: 0. | M244: 108.8 | N244: 14.05 | O244: 0.32000000000000001 | P244: 87.05 | Q244: 转股中 | R244: 2.34年 | S244: 0.34年 | T244: 2.98 | U244: 23 | V244: 6.6000000000000003e-002 | W244: 0.12 | X244: 0.10400000000000001 | Y244: 25 | Z244: 2.33 | AA244: -2.35e-002 | AB244: -3.0299999999999997e-002 | AC244: -0.247 | AD244: -0.252 | AE244: 98.67 | AF244: 95.31 | AG244: 0.36 | AH244: AA- | AI244: 5.9400000000000001e-002 | AJ244: =H244+100*O244 -> 146.905 | AK244: 142.8 | AL244: 173 | AM244: 44.1 | AN244: 128 | AO244: -3.5000000000000003e-002 | AP244: 50 | AQ244: 特一转债!
A245: 282 | B245: 128064 | C245: 司尔转债!!* | D245: 2538 | E245: 司尔特 | F245: 化工 | G245: 农化 | H245: 125.078 | I245: 1.8600000000000002e-002 | J245: 2.3e-003 | K245: 7.32 | L245: 2.0899999999999998e-002 | M245: 114.3 | N245: 5.82 | O245: -6.0000000000000001e-003 | P245: 125.77 | Q245: 转股中 | R245: 3.67年 | S245: 1.67年 | T245: 4.2 | U245: 125 | V245: 0.23899999999999999 | W245: 7.400000000000001e-002 | X245: 9.3000000000000013e-002 | Y245: 57 | Z245: 1.31 | AA245: -2.4700000000000003e-002 | AB245: -3.1400000000000004e-002 | AC245: -0.10199999999999999 | AD245: -0.10400000000000001 | AE245: 95.72 | AF245: 99.28 | AG245: 1 | AH245: AA | AI245: 3.9900000000000005e-002 | AJ245: =H245+100*O245 -> 124.47800000000001 | AK245: 124.4 | AL245: 15 | AM245: 25.1 | AN245: 9 | AO245: -8.3000000000000004e-002 | AP245: 43 | AQ245: 司尔转债!!*
A246: 254 | B246: 128079 | C246: 英联转债! | D246: 2846 | E246: 英联股份 | F246: 造纸包装 | G246: 包装材料 | H246: 130.23 | I246: -5.0000000000000001e-004 | J246: -2.5999999999999999e-003 | K246: 7.74 | L246: -5.1000000000000004e-003 | M246: 117.5 | N246: 8.29 | O246: 0.39500000000000002 | P246: 93.37 | Q246: 转股中 | R246: 4.21年 | S246: 2.21年 | T246: 1.52 | U246: 22 | V246: 0.109 | W246: 6.2e-002 | X246: 5.7999999999999996e-002 | Y246: 25 | Z246: 3.2 | AA246: -2.4700000000000003e-002 | AB246: -3.1699999999999999e-002 | AC246: -9.2499999999999999e-002 | AD246: -9.5100000000000004e-002 | AE246: 88.08 | AF246: 88.35 | AG246: 0.62 | AH246: A+ | AI246: 7.1900000000000006e-002 | AJ246: =H246+100*O246 -> 169.72999999999999 | AK246: 167.1 | AL246: 291 | AM246: 78.7 | AN246: 297 | AO246: -4.8000000000000001e-002 | AP246: 17 | AQ246: 英联转债!
A247: 129 | B247: 113602 | C247: 景20转债! | D247: 603228 | E247: 景旺电子 | F247: 电子 | G247: 元器件制 | H247: 128.69 | I247: -1.1999999999999999e-003 | J247: 7.1999999999999998e-003 | K247: 30.13 | L247: 8.6999999999999994e-003 | M247: 113.3 | N247: 27.4 | O247: 0.17000000000000001 | P247: 109.96 | Q247: 转股中 | R247: 5年17天 | S247: 3年18天 | T247: 17.8 | U247: 18 | V247: 8.0000000000000002e-003 | W247: 6.9000000000000006e-002 | X247: 7.5999999999999998e-002 | Y247: 257 | Z247: 3.95 | AA247: -2.5399999999999999e-002 | AB247: -2.9999999999999999e-002 | AC247: -6.5299999999999997e-002 | AD247: -6.7299999999999999e-002 | AE247: 91.3 | AF247: 92.83 | AG247: 0.68 | AH247: AA | AI247: 4.1200000000000001e-002 | AJ247: =H247+100*O247 -> 145.69 | AK247: 147.4 | AL247: 208 | AM247: 54.6 | AN247: 204 | AO247: 3.3000000000000002e-002 | AP247: 9 | AQ247: 景20转债!
A248: 223 | B248: 128096 | C248: 奥瑞转债!! | D248: 2701 | E248: 奥瑞金 | F248: 造纸包装 | G248: 包装材料 | H248: 129.899 | I248: 8.5000000000000006e-003 | J248: -4.5000000000000005e-003 | K248: 5.5 | L248: 5.5000000000000005e-003 | M248: 115.5 | N248: 4.5 | O248: 6.3e-002 | P248: 122.22 | Q248: 转股中 | R248: 4.52年 | S248: 2.52年 | T248: 6.74 | U248: 19 | V248: 2.2000000000000002e-002 | W248: 5.0999999999999997e-002 | X248: 6.2e-002 | Y248: 133 | Z248: 1.98 | AA248: -2.6200000000000001e-002 | AB248: -3.2099999999999997e-002 | AC248: -8.09e-002 | AD248: -8.3299999999999999e-002 | AE248: 94.8 | AF248: 99.27 | AG248: 0.74 | AH248: AA+ | AI248: 3.49e-002 | AJ248: =H248+100*O248 -> 136.19900000000001 | AK248: 137.6 | AL248: 121 | AM248: 38.3 | AN248: 79 | AO248: 2.4e-002 | AP248: 18 | AQ248: 奥瑞转债!!
A249: 290 | B249: 123024 | C249: 岱勒转债! | D249: 300700 | E249: 岱勒新材 | F249: 机械装备 | G249: 专用设备 | H249: 120.532 | I249: 3.5999999999999999e-003 | J249: -1.77e-002 | K249: 14.84 | L249: -2.3e-002 | M249: 112.5 | N249: 14.1 | O249: 0.14499999999999999 | P249: 105.25 | Q249: 转股中 | R249: 2.62年 | S249: 0.62年 | T249: 2.1 | U249: 84 | V249: 0.33100000000000002 | W249: 0.13200000000000001 | X249: 0.13900000000000001 | Y249: 16 | Z249: 2.52 | AA249: -2.63e-002 | AB249: -3.4599999999999999e-002 | AC249: -0.20800000000000002 | AD249: -0.21100000000000002 | AE249: 95.97 | AF249: 94.33 | AG249: 0.61 | AH249: A+ | AI249: 7.0400000000000004e-002 | AJ249: =H249+100*O249 -> 135.03199999999998 | AK249: 135.8 | AL249: 99 | AM249: 39.8 | AN249: 95 | AO249: 9.6000000000000002e-002 | AP249: 36 | AQ249: 岱勒转债!
A250: 307 | B250: 113525 | C250: 台华转债! | D250: 603055 | E250: 台华新材 | F250: 服装纺织 | G250: 纺织行业 | H250: 125.04 | I250: -7.6e-003 | J250: 1.2699999999999999e-002 | K250: 8.59 | L250: 8.199999999999999e-003 | M250: 114.3 | N250: 7.78 | O250: 0.13200000000000001 | P250: 110.41 | Q250: 转股中 | R250: 3.36年 | S250: 1.37年 | T250: 4.69 | U250: 29 | V250: 4.8000000000000001e-002 | W250: 6.6000000000000003e-002 | X250: 7.2999999999999995e-002 | Y250: 71 | Z250: 2.35 | AA250: -2.69e-002 | AB250: -3.4200000000000001e-002 | AC250: -0.109 | AD250: -0.111 | AE250: 96.88 | AF250: 100.48 | AG250: 0.62 | AH250: AA | AI250: 3.9900000000000005e-002 | AJ250: =H250+100*O250 -> 138.24000000000001 | AK250: 139.7 | AL250: 140 | AM250: 39.2 | AN250: 89 | AO250: 4.0000000000000001e-002 | AP250: 19 | AQ250: 台华转债!
A251: 199 | B251: 113575 | C251: 东时转债!! | D251: 603377 | E251: 东方时尚 | F251: 其他 | G251: 其他 | H251: 128.58 | I251: -5.9999999999999995e-004 | J251: -8.0000000000000004e-004 | K251: 8.16 | L251: -7.3000000000000001e-003 | M251: 113.1 | N251: 12.15 | O251: 0.91500000000000004 | P251: 67.16 | Q251: 转股中 | R251: 4.67年 | S251: 2.68年 | T251: 0.98 | U251: 13 | V251: 0.10199999999999999 | W251: 1.7000000000000001e-002 | X251: 1.1000000000000001e-002 | Y251: 59 | Z251: 2.38 | AA251: -2.76e-002 | AB251: -3.2400000000000005e-002 | AC251: -7.4299999999999991e-002 | AD251: -7.6399999999999996e-002 | AE251: 92.65 | AF251: 94.56 | AG251: 0.19 | AH251: AA | AI251: 3.9900000000000005e-002 | AJ251: =H251+100*O251 -> 220.08000000000001 | AK251: 190 | AL251: 324 | AM251: 95.4 | AN251: 326 | AO251: -0.113 | AP251: 15 | AQ251: 东时转债!!
A252: 2 | B252: 123119 | C252: 康泰转2 | D252: 300601 | E252: 康泰生物 | F252: 医药 | G252: 生物制药 | H252: 138.3 | I252: 2.4399999999999998e-002 | J252: -6.5599999999999992e-002 | K252: 145.31 | L252: -7.0900000000000005e-002 | M252: 117.1 | N252: 145.63 | O252: 0.38600000000000001 | P252: 99.78 | Q252: 5月18天 | R252: 5.94年 | S252: 3.94年 | T252: 20 | U252: 2780. | V252: 1.01 | W252: 2.e-002 | X252: 2.e-002 | Y252: 998 | Z252: 13.16 | AA252: -2.81e-002 | AB252: -3.2899999999999999e-002 | AC252: -6.8400000000000002e-002 | AD252: -6.9900000000000004e-002 | AE252: 87.89 | AF252: 92.51 | AG252: 0.58 | AH252: AA | AI252: 4.1200000000000001e-002 | AJ252: =H252+100*O252 -> 176.90000000000001 | AK252: 176.8 | AL252: 305 | AM252: 84.3 | AN252: 309 | AO252: 3.4000000000000002e-002 | AP252: 5 | AQ252: 康泰转2
A253: 367 | B253: 113011 | C253: 光大转债 | D253: 601818 | E253: 光大银行 | F253: 金融 | G253: 银行行业 | H253: 111.94 | I253: -3.9000000000000003e-003 | J253: 4.8999999999999998e-003 | K253: 3.3 | L253: 3.0000000000000001e-003 | M253: 106.8 | N253: 3.55 | O253: 0.20399999999999999 | P253: 92.96 | Q253: 转股中 | R253: 1.61年 | S253: 无权 | T253: 242 | U253: 148 | V253: 5.0000000000000001e-003 | W253: 0.13600000000000001 | X253: 0.126 | Y253: 1783. | Z253: 0.5 | AA253: -2.9100000000000001e-002 | AB253: -3.6799999999999999e-002 | AC253: 无权 | AD253: 无权 | AE253: 无权 | AF253: 101.66 | AG253: 0.34 | AH253: AAA | AI253: 3.1400000000000004e-002 | AJ253: =H253+100*O253 -> 132.34 | AK253: 130.9 | AL253: 47 | AM253: 29.3 | AN253: 23 | AO253: -4.8000000000000001e-002 | AP253: 12 | AQ253: 光大转债
A254: 233 | B254: 123038 | C254: 联得转债! | D254: 300545 | E254: 联得装备 | F254: 机械装备 | G254: 专用设备 | H254: 134.679 | I254: 2.5000000000000001e-002 | J254: -1.54e-002 | K254: 28.05 | L254: 1.3000000000000001e-002 | M254: 118.6 | N254: 24.07 | O254: 0.156 | P254: 116.54 | Q254: 转股中 | R254: 4.39年 | S254: 2.39年 | T254: 1.47 | U254: 118 | V254: 0.60599999999999998 | W254: 2.9999999999999999e-002 | X254: 3.4000000000000002e-002 | Y254: 50 | Z254: 5.15 | AA254: -2.92e-002 | AB254: -3.6200000000000003e-002 | AC254: -9.7799999999999998e-002 | AD254: -0.10000000000000001 | AE254: 87.17 | AF254: 88.11 | AG254: 0.74 | AH254: A+ | AI254: 7.1900000000000006e-002 | AJ254: =H254+100*O254 -> 150.279 | AK254: 152.8 | AL254: 238 | AM254: 64.7 | AN254: 254 | AO254: 5.0000000000000003e-002 | AP254: 19 | AQ254: 联得转债!
A255: 175 | B255: 123054 | C255: 思特转债!! | D255: 300608 | E255: 思特奇 | F255: 通信互联 | G255: 通信设备 | H255: 139.5 | I255: -3.5999999999999999e-003 | J255: -8.1000000000000013e-003 | K255: 13.85 | L255: -1.77e-002 | M255: 121.2 | N255: 12.63 | O255: 0.27200000000000002 | P255: 109.66 | Q255: 转股中 | R255: 4.84年 | S255: 2.85年 | T255: 2.08 | U255: 1107. | V255: 3.73 | W255: 7.0999999999999994e-002 | X255: 7.8e-002 | Y255: 29 | Z255: 2.85 | AA255: -2.92e-002 | AB255: -3.6299999999999999e-002 | AC255: -9.3399999999999997e-002 | AD255: -9.5600000000000004e-002 | AE255: 87.3 | AF255: 91.62 | AG255: 0.66 | AH255: AA- | AI255: 6.0899999999999996e-002 | AJ255: =H255+100*O255 -> 166.69999999999999 | AK255: 169.3 | AL255: 297 | AM255: 77.7 | AN255: 295 | AO255: -0.14199999999999999 | AP255: 20 | AQ255: 思特转债!!
A256: 180 | B256: 128109 | C256: 楚江转债 | D256: 2171 | E256: 楚江新材 | F256: 有色金属 | G256: 铜金属 | H256: 132.331 | I256: 6.3e-003 | J256: -6.9999999999999993e-003 | K256: 9.81 | L256: -1.e-003 | M256: 114.9 | N256: 8.63 | O256: 0.16399999999999998 | P256: 113.67 | Q256: 转股中 | R256: 4.83年 | S256: 2.83年 | T256: 18.3 | U256: 30 | V256: 1.2e-002 | W256: 0.14000000000000001 | X256: 0.159 | Y256: 131 | Z256: 2.31 | AA256: -2.9300000000000003e-002 | AB256: -3.4599999999999999e-002 | AC256: -7.9600000000000004e-002 | AD256: -8.1600000000000006e-002 | AE256: 92.06 | AF256: 95.47 | AG256: 0.68 | AH256: AA | AI256: 3.9900000000000005e-002 | AJ256: =H256+100*O256 -> 148.73099999999999 | AK256: 151 | AL256: 227 | AM256: 55.5 | AN256: 207 | AO256: 5.2000000000000005e-002 | AP256: 6 | AQ256: 楚江转债
A257: 337 | B257: 127005 | C257: 长证转债! | D257: 783 | E257: 长江证券 | F257: 金融 | G257: 证券行业 | H257: 116.89 | I257: -3.0000000000000001e-003 | J257: 1.e-003 | K257: 6.91 | L257: -4.3e-003 | M257: 108.3 | N257: 7.13 | O257: 0.20600000000000002 | P257: 96.91 | Q257: 转股中 | R257: 2.60年 | S257: 无权 | T257: 50 | U257: 18 | V257: 3.0000000000000001e-003 | W257: 0.13100000000000001 | X257: 0.127 | Y257: 382 | Z257: 1.33 | AA257: -2.9399999999999999e-002 | AB257: -3.5200000000000002e-002 | AC257: 无权 | AD257: 无权 | AE257: 无权 | AF257: 100.08 | AG257: 0.47 | AH257: AAA | AI257: 3.1400000000000004e-002 | AJ257: =H257+100*O257 -> 137.49000000000001 | AK257: 136.9 | AL257: 110 | AM257: 36.8 | AN257: 63 | AO257: -2.4e-002 | AP257: 13 | AQ257: 长证转债!
A258: 195 | B258: 123048 | C258: 应急转债! | D258: 300527 | E258: 中船应急 | F258: 机械装备 | G258: 专用设备 | H258: 129.66 | I258: 1.89e-002 | J258: -1.95e-002 | K258: 9.85 | L258: -1.e-003 | M258: 112.8 | N258: 8.88 | O258: 0.16899999999999998 | P258: 110.92 | Q258: 转股中 | R258: 4.68年 | S258: 2.68年 | T258: 3.79 | U258: 543 | V258: 1.1200000000000001 | W258: 4.0000000000000001e-002 | X258: 4.4000000000000004e-002 | Y258: 95 | Z258: 3.56 | AA258: -2.9900000000000003e-002 | AB258: -3.4599999999999999e-002 | AC258: -7.7300000000000008e-002 | AD258: -7.9299999999999995e-002 | AE258: 93.78 | AF258: 96.38 | AG258: 0.66 | AH258: AA+ | AI258: 3.49e-002 | AJ258: =H258+100*O258 -> 146.56 | AK258: 148.4 | AL258: 216 | AM258: 52 | AN258: 188 | AO258: 6.4000000000000001e-002 | AP258: 16 | AQ258: 应急转债!
A259: 1 | B259: 113627 | C259: N太平转 | D259: 603877 | E259: 太平鸟 | F259: 服装纺织 | G259: 服装行业 | H259: 137.69 | I259: 0.377 | J259: 0. | K259: 52.88 | L259: -2.0400000000000001e-002 | M259: 115.1 | N259: 50.32 | O259: 0.31 | P259: 105.09 | Q259: 5月18天 | R259: 5.94年 | S259: 3.94年 | T259: 8 | U259: 77 | V259: 7.2000000000000008e-002 | W259: 3.2000000000000001e-002 | X259: 3.3000000000000002e-002 | Y259: 252 | Z259: 6.15 | AA259: -3.0200000000000001e-002 | AB259: -3.4500000000000003e-002 | AC259: -6.7400000000000002e-002 | AD259: -6.8900000000000003e-002 | AE259: 87.89 | AF259: 90.94 | AG259: 0.64 | AH259: AA | AI259: 4.1200000000000001e-002 | AJ259: =H259+100*O259 -> 168.69 | AK259: 170.3 | AL259: 298 | AM259: 79.4 | AN259: 300 | AO259: 1.7000000000000001e-002 | AP259: 1 | AQ259: N太平转
A260: 231 | B260: 128090 | C260: 汽模转2 | D260: 2510 | E260: 天汽模 | F260: 汽车 | G260: 零部件制 | H260: 131.15 | I260: 0.17699999999999999 | J260: -0.11199999999999999 | K260: 4.36 | L260: 0.10099999999999999 | M260: 114.9 | N260: 4.23 | O260: 0.27200000000000002 | P260: 103.07 | Q260: 转股中 | R260: 4.39年 | S260: 2.39年 | T260: 3.1 | U260: 2404. | V260: 5.7300000000000004 | W260: 7.5999999999999998e-002 | X260: 7.8e-002 | Y260: 41 | Z260: 2.04 | AA260: -3.0299999999999997e-002 | AB260: -3.6000000000000004e-002 | AC260: -8.9600000000000013e-002 | AD260: -9.1799999999999993e-002 | AE260: 89.03 | AF260: 89.13 | AG260: 0.64 | AH260: AA- | AI260: 6.0899999999999996e-002 | AJ260: =H260+100*O260 -> 158.35000000000002 | AK260: 159.2 | AL260: 270 | AM260: 70.1 | AN260: 279 | AO260: 8.1000000000000003e-002 | AP260: 29 | AQ260: 汽模转2
A261: 109 | B261: 123071 | C261: 天能转债! | D261: 300569 | E261: 天能重工 | F261: 能源电力 | G261: 风能 | H261: 141.67 | I261: -9.300000000000001e-003 | J261: -3.9000000000000003e-003 | K261: 11.08 | L261: -1.6e-002 | M261: 121.1 | N261: 7.91 | O261: 1.1000000000000001e-002 | P261: 140.08 | Q261: 转股中 | R261: 5.21年 | S261: 3.21年 | T261: 6.95 | U261: 401 | V261: 0.40700000000000003 | W261: 7.9000000000000001e-002 | X261: 0.111 | Y261: 88 | Z261: 1.87 | AA261: -3.0299999999999997e-002 | AB261: -3.6900000000000002e-002 | AC261: -8.8300000000000003e-002 | AD261: -9.0200000000000002e-002 | AE261: 85.05 | AF261: 89.07 | AG261: 0.82 | AH261: AA- | AI261: 6.2199999999999998e-002 | AJ261: =H261+100*O261 -> 142.76999999999998 | AK261: 143.3 | AL261: 180 | AM261: 54.2 | AN261: 203 | AO261: 0.187 | AP261: 14 | AQ261: 天能转债!
A262: 100 | B262: 128137 | C262: 洁美转债 | D262: 2859 | E262: 洁美科技 | F262: 电子 | G262: 元器件制 | H262: 137.431 | I262: -5.0000000000000001e-003 | J262: 5.9999999999999995e-004 | K262: 33 | L262: -5.6999999999999993e-003 | M262: 117.3 | N262: 27.63 | O262: 0.151 | P262: 119.44 | Q262: 转股中 | R262: 5.25年 | S262: 3.25年 | T262: 5.99 | U262: 11 | V262: 1.3000000000000001e-002 | W262: 4.4000000000000004e-002 | X262: 5.2999999999999999e-002 | Y262: 135 | Z262: 7.36 | AA262: -3.0299999999999997e-002 | AB262: -3.5799999999999998e-002 | AC262: -7.9699999999999993e-002 | AD262: -8.1500000000000003e-002 | AE262: 84.68 | AF262: 86.06 | AG262: 0.77 | AH262: AA- | AI262: 6.2199999999999998e-002 | AJ262: =H262+100*O262 -> 152.53100000000001 | AK262: 155.4 | AL262: 253 | AM262: 69.4 | AN262: 278 | AO262: 4.0000000000000001e-003 | AP262: 4 | AQ262: 洁美转债
A263: 362 | B263: 113013 | C263: 国君转债! | D263: 601211 | E263: 国泰君安 | F263: 金融 | G263: 证券行业 | H263: 113.3 | I263: -6.3e-003 | J263: 6.3e-003 | K263: 16.4 | L263: 0. | M263: 106.8 | N263: 19.01 | O263: 0.313 | P263: 86.27 | Q263: 转股中 | R263: 1.92年 | S263: 无权 | T263: 69.9 | U263: 28 | V263: 4.0000000000000001e-003 | W263: 4.8000000000000001e-002 | X263: 4.0999999999999995e-002 | Y263: 1461. | Z263: 1.12 | AA263: -3.0600000000000002e-002 | AB263: -3.7000000000000005e-002 | AC263: 无权 | AD263: 无权 | AE263: 无权 | AF263: 100.7 | AG263: 0.26 | AH263: AAA | AI263: 3.1400000000000004e-002 | AJ263: =H263+100*O263 -> 144.59999999999999 | AK263: 140.3 | AL263: 148 | AM263: 39.6 | AN263: 91 | AO263: -2.2000000000000002e-002 | AP263: 12 | AQ263: 国君转债!
A264: 113 | B264: 127022 | C264: 恒逸转债 | D264: 703 | E264: 恒逸石化 | F264: 化工 | G264: 化工 | H264: 127.88 | I264: 2.2000000000000001e-003 | J264: -1.e-003 | K264: 12.04 | L264: 1.7000000000000001e-003 | M264: 108.9 | N264: 11.2 | O264: 0.19 | P264: 107.5 | Q264: 转股中 | R264: 5.19年 | S264: 3.20年 | T264: 20 | U264: 27 | V264: 1.e-002 | W264: 4.4999999999999998e-002 | X264: 4.9000000000000002e-002 | Y264: 441 | Z264: 1.79 | AA264: -3.0899999999999997e-002 | AB264: -3.39e-002 | AC264: -6.3600000000000004e-002 | AD264: -6.5000000000000002e-002 | AE264: 91.16 | AF264: 90.79 | AG264: 0.68 | AH264: AA+ | AI264: 3.6200000000000003e-002 | AJ264: =H264+100*O264 -> 146.88 | AK264: 148.3 | AL264: 214 | AM264: 57.1 | AN264: 220 | AO264: -4.7e-002 | AP264: 7 | AQ264: 恒逸转债
A265: 76 | B265: 123085 | C265: 万顺转2! | D265: 300057 | E265: 万顺新材 | F265: 有色金属 | G265: 铝金属 | H265: 133.546 | I265: 3.5200000000000002e-002 | J265: 1.72e-002 | K265: 7.81 | L265: 6.4000000000000001e-002 | M265: 113.3 | N265: 6.2 | O265: 5.9999999999999998e-002 | P265: 125.97 | Q265: 转股中 | R265: 5.35年 | S265: 3.35年 | T265: 9 | U265: 157 | V265: 0.128 | W265: 0.17100000000000001 | X265: 0.215 | Y265: 53 | Z265: 1.48 | AA265: -3.0899999999999997e-002 | AB265: -3.5099999999999999e-002 | AC265: -6.9800000000000001e-002 | AD265: -7.1599999999999997e-002 | AE265: 84.16 | AF265: 82.64 | AG265: 0.82 | AH265: AA- | AI265: 6.2199999999999998e-002 | AJ265: =H265+100*O265 -> 139.54599999999999 | AK265: 141.1 | AL265: 153 | AM265: 57 | AN265: 218 | AO265: 0.13300000000000001 | AP265: 24 | AQ265: 万顺转2!
A266: 28 | B266: 113623 | C266: 凤21转债 | D266: 603225 | E266: 新凤鸣 | F266: 化工 | G266: 化纤 | H266: 139.83 | I266: 7.6e-003 | J266: -1.7000000000000001e-003 | K266: 19.6 | L266: 8.199999999999999e-003 | M266: 117.1 | N266: 16.47 | O266: 0.17499999999999999 | P266: 119 | Q266: 2月9天 | R266: 5.67年 | S266: 3.67年 | T266: 25 | U266: 29 | V266: 8.0000000000000002e-003 | W266: 9.0999999999999998e-002 | X266: 0.10800000000000001 | Y266: 275 | Z266: 2.25 | AA266: -3.1300000000000001e-002 | AB266: -3.6299999999999999e-002 | AC266: -7.5700000000000003e-002 | AD266: -7.7300000000000008e-002 | AE266: 88.85 | AF266: 93.52 | AG266: 0.72 | AH266: AA | AI266: 4.1200000000000001e-002 | AJ266: =H266+100*O266 -> 157.33000000000001 | AK266: 160.7 | AL266: 276 | AM266: 67.1 | AN266: 264 | AO266: -8.5999999999999993e-002 | AP266: 3 | AQ266: 凤21转债
A267: 51 | B267: 123100 | C267: 朗科转债 | D267: 300543 | E267: 朗科智能 | F267: 电子 | G267: 电子产品 | H267: 140.2 | I267: 9.7000000000000003e-003 | J267: -9.1999999999999998e-003 | K267: 15.52 | L267: 5.9999999999999995e-004 | M267: 117.5 | N267: 11.61 | O267: 4.9000000000000002e-002 | P267: 133.68 | Q267: 16天 | R267: 5.51年 | S267: 3.51年 | T267: 3.8 | U267: 47 | V267: 8.900000000000001e-002 | W267: 9.0999999999999998e-002 | X267: 0.122 | Y267: 42 | Z267: 3.42 | AA267: -3.2099999999999997e-002 | AB267: -3.7400000000000003e-002 | AC267: -7.9000000000000001e-002 | AD267: -8.0799999999999997e-002 | AE267: 83.36 | AF267: 84.84 | AG267: 0.82 | AH267: AA- | AI267: 6.2199999999999998e-002 | AJ267: =H267+100*O267 -> 145.09999999999999 | AK267: 146.7 | AL267: 202 | AM267: 61.9 | AN267: 244 | AO267: -4.5999999999999999e-002 | AP267: 9 | AQ267: 朗科转债
A268: 50 | B268: 118000 | C268: 嘉元转债 | D268: 688388 | E268: 嘉元科技 | F268: 电子 | G268: 电子产品 | H268: 144.74 | I268: 1.2e-002 | J268: 7.4999999999999997e-003 | K268: 95.26 | L268: 2.6000000000000002e-002 | M268: 121 | N268: 78.74 | O268: 0.19600000000000001 | P268: 120.98 | Q268: 26天 | R268: 5.55年 | S268: 3.55年 | T268: 12.4 | U268: 61 | V268: 3.4000000000000002e-002 | W268: 5.5999999999999994e-002 | X268: 6.8000000000000005e-002 | Y268: 220 | Z268: 8.08 | AA268: -3.2300000000000002e-002 | AB268: -3.85e-002 | AC268: -8.5999999999999993e-002 | AD268: -8.77e-002 | AE268: 83.23 | AF268: 87.17 | AG268: 0.75 | AH268: AA- | AI268: 6.2199999999999998e-002 | AJ268: =H268+100*O268 -> 164.34 | AK268: 168.5 | AL268: 292 | AM268: 81.3 | AN268: 305 | AO268: 8.0000000000000002e-003 | AP268: 4 | AQ268: 嘉元转债
A269: 119 | B269: 113603 | C269: 东缆转债! | D269: 603606 | E269: 东方电缆 | F269: 能源电力 | G269: 电力设备 | H269: 136 | I269: 7.4000000000000003e-003 | J269: 8.0000000000000004e-004 | K269: 25.79 | L269: 1.26e-002 | M269: 115.1 | N269: 23.65 | O269: 0.247 | P269: 109.05 | Q269: 转股中 | R269: 5年48天 | S269: 3年49天 | T269: 8 | U269: 16 | V269: 1.4999999999999999e-002 | W269: 4.7e-002 | X269: 5.2000000000000005e-002 | Y269: 169 | Z269: 4.77 | AA269: -3.2599999999999997e-002 | AB269: -3.7499999999999999e-002 | AC269: -7.980000000000001e-002 | AD269: -8.1600000000000006e-002 | AE269: 90.8 | AF269: 93.94 | AG269: 0.65 | AH269: AA | AI269: 4.1200000000000001e-002 | AJ269: =H269+100*O269 -> 160.69999999999999 | AK269: 163 | AL269: 281 | AM269: 69 | AN269: 275 | AO269: 0.10800000000000001 | AP269: 7 | AQ269: 东缆转债!
A270: 15 | B270: 127036 | C270: 三花转债 | D270: 2050 | E270: 三花智控 | F270: 机械装备 | G270: 通用设备 | H270: 139.1 | I270: 8.9999999999999998e-004 | J270: -8.199999999999999e-003 | K270: 22.72 | L270: -1.1699999999999999e-002 | M270: 114.5 | N270: 21.55 | O270: 0.31900000000000001 | P270: 105.43 | Q270: 4月3天 | R270: 5.82年 | S270: 3.82年 | T270: 30 | U270: 29 | V270: 6.9999999999999993e-003 | W270: 3.7000000000000005e-002 | X270: 3.9e-002 | Y270: 816 | Z270: 7.82 | AA270: -3.3300000000000003e-002 | AB270: -3.7499999999999999e-002 | AC270: -7.2900000000000006e-002 | AD270: -7.4200000000000002e-002 | AE270: 89.46 | AF270: 93.38 | AG270: 0.62 | AH270: AA+ | AI270: 3.6200000000000003e-002 | AJ270: =H270+100*O270 -> 171. | AK270: 172.8 | AL270: 301 | AM270: 79.4 | AN270: 301 | AO270: 2.9999999999999999e-002 | AP270: 4 | AQ270: 三花转债
A271: 65 | B271: 123092 | C271: 天壕转债 | D271: 300332 | E271: 天壕环境 | F271: 石油天然 | G271: 天然气 | H271: 146.283 | I271: 3.8399999999999997e-002 | J271: 1.61e-002 | K271: 7.08 | L271: 6.6299999999999998e-002 | M271: 121.6 | N271: 5.19 | O271: 7.2000000000000008e-002 | P271: 136.42 | Q271: 转股中 | R271: 5.38年 | S271: 3.39年 | T271: 4.23 | U271: 337 | V271: 0.53500000000000003 | W271: 6.8000000000000005e-002 | X271: 9.3000000000000013e-002 | Y271: 62 | Z271: 1.85 | AA271: -3.4500000000000003e-002 | AB271: -4.0899999999999999e-002 | AC271: -9.11e-002 | AD271: -9.3200000000000005e-002 | AE271: 81.67 | AF271: 83.93 | AG271: 0.82 | AH271: A+ | AI271: 7.3200000000000001e-002 | AJ271: =H271+100*O271 -> 153.48299999999998 | AK271: 156.1 | AL271: 259 | AM271: 72.2 | AN271: 288 | AO271: 0.17999999999999999 | AP271: 9 | AQ271: 天壕转债
A272: 67 | B272: 123091 | C272: 长海转债 | D272: 300196 | E272: 长海股份 | F272: 其他 | G272: 非金属矿 | H272: 140.672 | I272: 1.3600000000000001e-002 | J272: 4.7999999999999996e-003 | K272: 19.88 | L272: 2.4199999999999999e-002 | M272: 116.2 | N272: 16.14 | O272: 0.14199999999999999 | P272: 123.17 | Q272: 转股中 | R272: 5.38年 | S272: 3.38年 | T272: 5.5 | U272: 12 | V272: 1.6e-002 | W272: 6.8000000000000005e-002 | X272: 8.3000000000000004e-002 | Y272: 81 | Z272: 2.74 | AA272: -3.5499999999999997e-002 | AB272: -4.0500000000000001e-002 | AC272: -8.3000000000000004e-002 | AD272: -8.4700000000000011e-002 | AE272: 89.99 | AF272: 93.91 | AG272: 0.76 | AH272: AA | AI272: 4.1200000000000001e-002 | AJ272: =H272+100*O272 -> 154.87199999999999 | AK272: 158.2 | AL272: 266 | AM272: 64.3 | AN272: 252 | AO272: 5.5999999999999994e-002 | AP272: 3 | AQ272: 长海转债
A273: 341 | B273: 110043 | C273: 无锡转债! | D273: 600908 | E273: 无锡银行 | F273: 金融 | G273: 银行行业 | H273: 118.42 | I273: -6.0000000000000001e-003 | J273: 6.0000000000000001e-003 | K273: 5.83 | L273: 0. | M273: 108.3 | N273: 5.61 | O273: 0.14000000000000001 | P273: 103.92 | Q273: 转股中 | R273: 2.49年 | S273: 无权 | T273: 29.2 | U273: 27 | V273: 8.0000000000000002e-003 | W273: 0.26899999999999996 | X273: 0.28000000000000003 | Y273: 109 | Z273: 0.88 | AA273: -3.5699999999999996e-002 | AB273: -4.1700000000000001e-002 | AC273: 无权 | AD273: 无权 | AE273: 无权 | AF273: 99.91 | AG273: 0.56 | AH273: AA+ | AI273: 3.3399999999999999e-002 | AJ273: =H273+100*O273 -> 132.42000000000002 | AK273: 132.9 | AL273: 66 | AM273: 33 | AN273: 37 | AO273: 2.3e-002 | AP273: 23 | AQ273: 无锡转债!
A274: 5 | B274: 113626 | C274: 伯特转债 | D274: 603596 | E274: 伯特利 | F274: 汽车 | G274: 零部件制 | H274: 149.66 | I274: 9.1000000000000004e-003 | J274: -1.8e-003 | K274: 45.23 | L274: 1.e-002 | M274: 121.1 | N274: 36 | O274: 0.191 | P274: 125.64 | Q274: 5月2天 | R274: 5.89年 | S274: 3.90年 | T274: 9.02 | U274: 30 | V274: 2.3e-002 | W274: 4.9000000000000002e-002 | X274: 6.0999999999999999e-002 | Y274: 185 | Z274: 6.54 | AA274: -3.5799999999999998e-002 | AB274: -4.1599999999999998e-002 | AC274: -8.7100000000000011e-002 | AD274: -8.8599999999999998e-002 | AE274: 88.05 | AF274: 95.83 | AG274: 0.73 | AH274: AA | AI274: 4.1200000000000001e-002 | AJ274: =H274+100*O274 -> 168.75999999999999 | AK274: 173.7 | AL274: 302 | AM274: 77.9 | AN274: 296 | AO274: 0.17499999999999999 | AP274: 3 | AQ274: 伯特转债
A275: 83 | B275: 113612 | C275: 永冠转债 | D275: 603681 | E275: 永冠新材 | F275: 化工 | G275: 其他 | H275: 146.89 | I275: -4.0000000000000001e-003 | J275: 1.1000000000000001e-003 | K275: 28.33 | L275: -3.4999999999999996e-003 | M275: 121.2 | N275: 20.59 | O275: 6.8000000000000005e-002 | P275: 137.59 | Q275: 转股中 | R275: 5.34年 | S275: 3.34年 | T275: 5.2 | U275: 7.7 | V275: 1.e-002 | W275: 0.11 | X275: 0.152 | Y275: 47 | Z275: 3 | AA275: -3.61e-002 | AB275: -4.2500000000000003e-002 | AC275: -9.4399999999999998e-002 | AD275: -9.6300000000000011e-002 | AE275: 84.49 | AF275: 88.48 | AG275: 0.83 | AH275: AA- | AI275: 6.2199999999999998e-002 | AJ275: =H275+100*O275 -> 153.69 | AK275: 156.2 | AL275: 260 | AM275: 67.7 | AN275: 267 | AO275: 6.4000000000000001e-002 | AP275: 6 | AQ275: 永冠转债
A276: 41 | B276: 127029 | C276: 中钢转债 | D276: 928 | E276: 中钢国际 | F276: 建筑 | G276: 建筑工程 | H276: 144.38 | I276: -3.4999999999999996e-003 | J276: 4.5000000000000005e-003 | K276: 8.62 | L276: 1.1999999999999999e-003 | M276: 117.5 | N276: 5.89 | O276: -1.3000000000000001e-002 | P276: 146.35 | Q276: 52天 | R276: 5.62年 | S276: 3.62年 | T276: 9.6 | U276: 101 | V276: 7.2000000000000008e-002 | W276: 8.900000000000001e-002 | X276: 0.13 | Y276: 108 | Z276: 1.88 | AA276: -3.6499999999999998e-002 | AB276: -4.1599999999999998e-002 | AC276: -8.5800000000000001e-002 | AD276: -8.7100000000000011e-002 | AE276: 90.11 | AF276: 96.51 | AG276: 0.83 | AH276: AA+ | AI276: 3.6200000000000003e-002 | AJ276: =H276+100*O276 -> 143.07999999999998 | AK276: 142.4 | AL276: 169 | AM276: 45.9 | AN276: 138 | AO276: -0.126 | AP276: 11 | AQ276: 中钢转债
A277: 91 | B277: 123078 | C277: 飞凯转债!! | D277: 300398 | E277: 飞凯材料 | F277: 化工 | G277: 化工 | H277: 139.988 | I277: 3.1899999999999998e-002 | J277: 4.4000000000000003e-003 | K277: 21.08 | L277: 4.4600000000000001e-002 | M277: 115.2 | N277: 15.56 | O277: 3.3000000000000002e-002 | P277: 135.48 | Q277: 转股中 | R277: 5.31年 | S277: 3.31年 | T277: 8.15 | U277: 108 | V277: 9.6000000000000002e-002 | W277: 7.4999999999999997e-002 | X277: 0.10099999999999999 | Y277: 109 | Z277: 4.05 | AA277: -3.6699999999999997e-002 | AB277: -4.1500000000000002e-002 | AC277: -8.3400000000000002e-002 | AD277: -8.5099999999999995e-002 | AE277: 90.25 | AF277: 93.38 | AG277: 0.81 | AH277: AA | AI277: 4.1200000000000001e-002 | AJ277: =H277+100*O277 -> 143.28800000000001 | AK277: 144.5 | AL277: 187 | AM277: 51.1 | AN277: 181 | AO277: 6.6000000000000003e-002 | AP277: 8 | AQ277: 飞凯转债!!
A278: 14 | B278: 127037 | C278: 银轮转债 | D278: 2126 | E278: 银轮股份 | F278: 汽车 | G278: 零部件制 | H278: 143.45 | I278: 3.8e-003 | J278: -7.8000000000000005e-003 | K278: 11.35 | L278: -6.0999999999999995e-003 | M278: 115.1 | N278: 10.77 | O278: 0.36099999999999999 | P278: 105.39 | Q278: 4月7天 | R278: 5.83年 | S278: 3.84年 | T278: 7 | U278: 61 | V278: 6.2e-002 | W278: 7.8e-002 | X278: 8.199999999999999e-002 | Y278: 90 | Z278: 2.19 | AA278: -3.7599999999999995e-002 | AB278: -4.1900000000000007e-002 | AC278: -7.8600000000000003e-002 | AD278: -8.0100000000000005e-002 | AE278: 88.26 | AF278: 91.32 | AG278: 0.64 | AH278: AA | AI278: 4.1200000000000001e-002 | AJ278: =H278+100*O278 -> 179.54999999999998 | AK278: 181.5 | AL278: 312 | AM278: 90.2 | AN278: 316 | AO278: -1.3000000000000001e-002 | AP278: 2 | AQ278: 银轮转债
A279: 81 | B279: 123083 | C279: 朗新转债 | D279: 300682 | E279: 朗新科技 | F279: 计算机及 | G279: 软件开发 | H279: 141.1 | I279: -3.0899999999999997e-002 | J279: 5.8999999999999999e-003 | K279: 20.36 | L279: -3.1400000000000004e-002 | M279: 115.1 | N279: 15.45 | O279: 7.0999999999999994e-002 | P279: 131.78 | Q279: 转股中 | R279: 5.34年 | S279: 3.34年 | T279: 8 | U279: 54 | V279: 4.7e-002 | W279: 3.7999999999999999e-002 | X279: 5.0999999999999997e-002 | Y279: 208 | Z279: 3.95 | AA279: -3.8100000000000002e-002 | AB279: -4.2800000000000005e-002 | AC279: -8.4900000000000003e-002 | AD279: -8.6599999999999996e-002 | AE279: 90.03 | AF279: 93.16 | AG279: 0.8 | AH279: AA | AI279: 4.1200000000000001e-002 | AJ279: =H279+100*O279 -> 148.19999999999999 | AK279: 150.4 | AL279: 225 | AM279: 57.3 | AN279: 223 | AO279: 0.11199999999999999 | AP279: 6 | AQ279: 朗新转债
A280: 334 | B280: 128036 | C280: 金农转债!! | D280: 2548 | E280: 金新农 | F280: 农业 | G280: 畜牧业 | H280: 120.739 | I280: 2.8999999999999998e-003 | J280: -3.5999999999999999e-003 | K280: 5.23 | L280: -5.6999999999999993e-003 | M280: 109.3 | N280: 6.93 | O280: 0.59999999999999998 | P280: 75.47 | Q280: 转股中 | R280: 2.59年 | S280: 0.59年 | T280: 1.46 | U280: 25 | V280: 0.14199999999999999 | W280: 4.0000000000000001e-002 | X280: 2.9999999999999999e-002 | Y280: 36 | Z280: 1.39 | AA280: -3.8300000000000001e-002 | AB280: -4.4699999999999997e-002 | AC280: -0.214 | AD280: -0.218 | AE280: 97.47 | AF280: 94.38 | AG280: 0.12 | AH280: AA- | AI280: 5.9400000000000001e-002 | AJ280: =H280+100*O280 -> 180.739 | AK280: 166 | AL280: 288 | AM280: 68.5 | AN280: 272 | AO280: -2.8999999999999998e-002 | AP280: 16 | AQ280: 金农转债!!
A281: 225 | B281: 128094 | C281: 星帅转债! | D281: 2860 | E281: 星帅尔 | F281: 家电 | G281: 零部件制 | H281: 143.5 | I281: -2.2400000000000003e-002 | J281: 1.15e-002 | K281: 19.81 | L281: -1.3000000000000001e-002 | M281: 121 | N281: 13.8 | O281: 0. | P281: 143.55 | Q281: 转股中 | R281: 4.45年 | S281: 2.45年 | T281: 2.27 | U281: 61 | V281: 0.185 | W281: 5.7000000000000002e-002 | X281: 8.199999999999999e-002 | Y281: 40 | Z281: 3.87 | AA281: -3.85e-002 | AB281: -4.5999999999999999e-002 | AC281: -0.11599999999999999 | AD281: -0.11800000000000001 | AE281: 87.01 | AF281: 89.55 | AG281: 0.84 | AH281: A+ | AI281: 7.1900000000000006e-002 | AJ281: =H281+100*O281 -> 143.5 | AK281: 143.4 | AL281: 181 | AM281: 53.9 | AN281: 200 | AO281: 6.9000000000000006e-002 | AP281: 30 | AQ281: 星帅转债!
A282: 118 | B282: 128134 | C282: 鸿路转债! | D282: 2541 | E282: 鸿路钢构 | F282: 建筑 | G282: 其他 | H282: 141.5 | I282: 3.2799999999999996e-002 | J282: -4.0000000000000002e-004 | K282: 58.8 | L282: 3.9199999999999999e-002 | M282: 115.1 | N282: 43.51 | O282: 4.7e-002 | P282: 135.14 | Q282: 转股中 | R282: 5.17年 | S282: 3.18年 | T282: 15.7 | U282: 145 | V282: 6.6000000000000003e-002 | W282: 5.0999999999999997e-002 | X282: 6.9000000000000006e-002 | Y282: 309 | Z282: 5.3 | AA282: -3.9800000000000002e-002 | AB282: -4.4699999999999997e-002 | AC282: -8.9800000000000005e-002 | AD282: -9.1499999999999998e-002 | AE282: 90.64 | AF282: 93.79 | AG282: 0.83 | AH282: AA | AI282: 4.1200000000000001e-002 | AJ282: =H282+100*O282 -> 146.19999999999999 | AK282: 147.9 | AL282: 210 | AM282: 54.1 | AN282: 202 | AO282: 8.5999999999999993e-002 | AP282: 5 | AQ282: 鸿路转债!
A283: 191 | B283: 123050 | C283: 聚飞转债 | D283: 300303 | E283: 聚飞光电 | F283: 电子 | G283: LED制 | H283: 149.3 | I283: 1.18e-002 | J283: 6.4000000000000003e-003 | K283: 7.4 | L283: 2.2099999999999998e-002 | M283: 123.8 | N283: 5.08 | O283: 2.5000000000000001e-002 | P283: 145.67 | Q283: 转股中 | R283: 4.69年 | S283: 2.69年 | T283: 3.75 | U283: 536 | V283: 0.96499999999999997 | W283: 4.0000000000000001e-002 | X283: 5.7999999999999996e-002 | Y283: 95 | Z283: 3.84 | AA283: -3.9900000000000005e-002 | AB283: -4.7899999999999998e-002 | AC283: -0.11900000000000001 | AD283: -0.121 | AE283: 87.77 | AF283: 94.4 | AG283: 0.83 | AH283: AA- | AI283: 6.0899999999999996e-002 | AJ283: =H283+100*O283 -> 151.80000000000001 | AK283: 152.9 | AL283: 239 | AM283: 58.5 | AN283: 229 | AO283: 8.8000000000000009e-002 | AP283: 13 | AQ283: 聚飞转债
A284: 357 | B284: 113502 | C284: 嘉澳转债! | D284: 603822 | E284: 嘉澳环保 | F284: 化工 | G284: 化工 | H284: 122.1 | I284: 5.1000000000000004e-003 | J284: -6.4000000000000003e-003 | K284: 39.66 | L284: -3.4999999999999996e-003 | M284: 111.3 | N284: 44.64 | O284: 0.374 | P284: 88.84 | Q284: 转股中 | R284: 2.26年 | S284: 0.26年 | T284: 1.85 | U284: 32 | V284: 0.14199999999999999 | W284: 6.3e-002 | X284: 5.5999999999999994e-002 | Y284: 29 | Z284: 3.63 | AA284: -4.0800000000000003e-002 | AB284: -4.9500000000000002e-002 | AC284: -0.41299999999999998 | AD284: -0.41999999999999998 | AE284: 99.32 | AF284: 97.93 | AG284: 0.36 | AH284: AA- | AI284: 5.9400000000000001e-002 | AJ284: =H284+100*O284 -> 159.5 | AK284: 155.4 | AL284: 252 | AM284: 56 | AN284: 212 | AO284: 7.2000000000000008e-002 | AP284: 37 | AQ284: 嘉澳转债!
A285: 246 | B285: 110061 | C285: 川投转债 | D285: 600674 | E285: 川投能源 | F285: 能源电力 | G285: 水电 | H285: 132.21 | I285: -5.8999999999999999e-003 | J285: -8.9999999999999998e-004 | K285: 10.95 | L285: -9.0000000000000011e-003 | M285: 110.8 | N285: 9.2 | O285: 0.111 | P285: 119.02 | Q285: 转股中 | R285: 4.26年 | S285: 2.27年 | T285: 39.6 | U285: 7.7 | V285: 1.e-003 | W285: 8.199999999999999e-002 | X285: 9.8000000000000004e-002 | Y285: 482 | Z285: 1.67 | AA285: -4.1399999999999999e-002 | AB285: -4.5700000000000005e-002 | AC285: -9.7299999999999998e-002 | AD285: -9.9499999999999991e-002 | AE285: 95.55 | AF285: 96.8 | AG285: 0.74 | AH285: AAA | AI285: 3.2899999999999999e-002 | AJ285: =H285+100*O285 -> 143.31 | AK285: 145.4 | AL285: 191 | AM285: 48.6 | AN285: 155 | AO285: -5.2999999999999999e-002 | AP285: 14 | AQ285: 川投转债
A286: 13 | B286: 123115 | C286: 捷捷转债 | D286: 300623 | E286: 捷捷微电 | F286: 电子 | G286: 元器件制 | H286: 152 | I286: 1.95e-002 | J286: -9.8999999999999991e-003 | K286: 35.26 | L286: 1.23e-002 | M286: 118.5 | N286: 29 | O286: 0.25 | P286: 121.59 | Q286: 4月11天 | R286: 5.84年 | S286: 3.84年 | T286: 12 | U286: 123 | V286: 6.8000000000000005e-002 | W286: 4.5999999999999999e-002 | X286: 5.5999999999999994e-002 | Y286: 260 | Z286: 6.66 | AA286: -4.24e-002 | AB286: -4.7599999999999996e-002 | AC286: -9.1499999999999998e-002 | AD286: -9.3000000000000013e-002 | AE286: 81.73 | AF286: 83.89 | AG286: 0.77 | AH286: AA- | AI286: 6.2199999999999998e-002 | AJ286: =H286+100*O286 -> 177. | AK286: 182.4 | AL286: 315 | AM286: 98.5 | AN286: 328 | AO286: 0. | AP286: 4 | AQ286: 捷捷转债
A287: 114 | B287: 123069 | C287: 金诺转债!! | D287: 300505 | E287: 川金诺 | F287: 化工 | G287: 农化 | H287: 157.2 | I287: 2.41e-002 | J287: 1.0500000000000001e-002 | K287: 27.26 | L287: 4.2800000000000005e-002 | M287: 126 | N287: 19.09 | O287: 0.10099999999999999 | P287: 142.8 | Q287: 转股中 | R287: 5.19年 | S287: 3.20年 | T287: 2.54 | U287: 1023. | V287: 2.5499999999999998 | W287: 7.0999999999999994e-002 | X287: 0.10199999999999999 | Y287: 36 | Z287: 3.76 | AA287: -4.2500000000000003e-002 | AB287: -5.0199999999999995e-002 | AC287: -0.114 | AD287: -0.11599999999999999 | AE287: 85.04 | AF287: 92.72 | AG287: 0.81 | AH287: AA- | AI287: 6.2199999999999998e-002 | AJ287: =H287+100*O287 -> 167.29999999999998 | AK287: 171.6 | AL287: 299 | AM287: 78.9 | AN287: 298 | AO287: -0.10000000000000001 | AP287: 18 | AQ287: 金诺转债!!
A288: 148 | B288: 128122 | C288: 兴森转债! | D288: 2436 | E288: 兴森科技 | F288: 电子 | G288: 元器件制 | H288: 134.128 | I288: 3.2000000000000002e-003 | J288: 2.8999999999999998e-003 | K288: 13.97 | L288: 1.1599999999999999e-002 | M288: 113 | N288: 14.1 | O288: 0.35399999999999998 | P288: 99.08 | Q288: 转股中 | R288: 3.96年 | S288: 2.96年 | T288: 2.69 | U288: 23 | V288: 6.4000000000000001e-002 | W288: 1.3000000000000001e-002 | X288: 1.3000000000000001e-002 | Y288: 208 | Z288: 6.48 | AA288: -4.2800000000000005e-002 | AB288: -4.8399999999999999e-002 | AC288: -8.0500000000000002e-002 | AD288: -8.2299999999999998e-002 | AE288: 91.51 | AF288: 96.95 | AG288: 0.53 | AH288: AA | AI288: 3.9900000000000005e-002 | AJ288: =H288+100*O288 -> 169.52799999999999 | AK288: 169.2 | AL288: 294 | AM288: 72.2 | AN288: 289 | AO288: 5.9000000000000004e-002 | AP288: 13 | AQ288: 兴森转债!
A289: 333 | B289: 113508 | C289: 新凤转债!!* | D289: 603225 | E289: 新凤鸣 | F289: 服装纺织 | G289: 纺织行业 | H289: 125.23 | I289: 9.300000000000001e-003 | J289: -1.1000000000000001e-003 | K289: 19.6 | L289: 8.199999999999999e-003 | M289: 111.3 | N289: 15.65 | O289: 0. | P289: 125.24 | Q289: 转股中 | R289: 2.72年 | S289: 0.72年 | T289: 11 | U289: 151 | V289: 0.11 | W289: 4.0000000000000001e-002 | X289: 5.0000000000000003e-002 | Y289: 275 | Z289: 2.25 | AA289: -4.3099999999999999e-002 | AB289: -5.0199999999999995e-002 | AC289: -0.214 | AD289: -0.217 | AE289: 98.46 | AF289: 100.62 | AG289: 1 | AH289: AA | AI289: 3.8399999999999997e-002 | AJ289: =H289+100*O289 -> 125.23 | AK289: 125.2 | AL289: 20 | AM289: 24.6 | AN289: 7 | AO289: -8.5999999999999993e-002 | AP289: 22 | AQ289: 新凤转债!!*
A290: 151 | B290: 123060 | C290: 苏试转债! | D290: 300416 | E290: 苏试试验 | F290: 机械装备 | G290: 专用设备 | H290: 146.8 | I290: -3.4000000000000002e-003 | J290: -3.4000000000000002e-003 | K290: 22.82 | L290: -8.6999999999999994e-003 | M290: 117.2 | N290: 18.28 | O290: 0.17600000000000002 | P290: 124.84 | Q290: 转股中 | R290: 4.95年 | S290: 2.96年 | T290: 3.1 | U290: 20 | V290: 4.4999999999999998e-002 | W290: 5.0999999999999997e-002 | X290: 6.4000000000000001e-002 | Y290: 60 | Z290: 4.97 | AA290: -4.5199999999999997e-002 | AB290: -5.0900000000000001e-002 | AC290: -0.105 | AD290: -0.107 | AE290: 86.22 | AF290: 87.95 | AG290: 0.78 | AH290: AA- | AI290: 6.0899999999999996e-002 | AJ290: =H290+100*O290 -> 164.40000000000001 | AK290: 168.8 | AL290: 293 | AM290: 80.8 | AN290: 304 | AO290: -6.4000000000000001e-002 | AP290: 8 | AQ290: 苏试转债!
A291: 68 | B291: 123089 | C291: 九洲转2!! | D291: 300040 | E291: 九洲集团 | F291: 能源电力 | G291: 电力设备 | H291: 154.55 | I291: 1.46e-002 | J291: 1.5e-003 | K291: 8.8 | L291: 1.8500000000000003e-002 | M291: 121 | N291: 5.68 | O291: -2.e-003 | P291: 154.93 | Q291: 转股中 | R291: 5.37年 | S291: 3.38年 | T291: 3.28 | U291: 152 | V291: 0.29899999999999999 | W291: 7.0000000000000007e-002 | X291: 0.10800000000000001 | Y291: 47 | Z291: 1.5 | AA291: -4.53e-002 | AB291: -5.1500000000000004e-002 | AC291: -0.10400000000000001 | AD291: -0.106 | AE291: 84.12 | AF291: 88.1 | AG291: 0.87 | AH291: AA- | AI291: 6.2199999999999998e-002 | AJ291: =H291+100*O291 -> 154.35000000000002 | AK291: 154.2 | AL291: 248 | AM291: 66.1 | AN291: 261 | AO291: -6.9999999999999993e-003 | AP291: 21 | AQ291: 九洲转2!!
A292: 210 | B292: 113572 | C292: 三祥转债! | D292: 603663 | E292: 三祥新材 | F292: 其他 | G292: 其他 | H292: 140.18 | I292: 3.5200000000000002e-002 | J292: -3.1600000000000003e-002 | K292: 18.2 | L292: 4.4000000000000003e-003 | M292: 112.8 | N292: 14.09 | O292: 8.5000000000000006e-002 | P292: 129.17 | Q292: 转股中 | R292: 4.60年 | S292: 2.60年 | T292: 1.69 | U292: 172 | V292: 0.73199999999999998 | W292: 4.8000000000000001e-002 | X292: 6.2e-002 | Y292: 35 | Z292: 5.47 | AA292: -4.7e-002 | AB292: -5.1699999999999996e-002 | AC292: -0.10400000000000001 | AD292: -0.106 | AE292: 85.4 | AF292: 82.52 | AG292: 0.83 | AH292: A+ | AI292: 7.1900000000000006e-002 | AJ292: =H292+100*O292 -> 148.68000000000001 | AK292: 151.2 | AL292: 228 | AM292: 65.8 | AN292: 260 | AO292: 9.6999999999999989e-002 | AP292: 20 | AQ292: 三祥转债!
A293: 243 | B293: 113550 | C293: 常汽转债! | D293: 603035 | E293: 常熟汽饰 | F293: 汽车 | G293: 零部件制 | H293: 152.21 | I293: -2.1299999999999999e-002 | J293: 1.1999999999999999e-003 | K293: 12.96 | L293: -2.4799999999999999e-002 | M293: 121.3 | N293: 9.33 | O293: 9.6000000000000002e-002 | P293: 138.91 | Q293: 转股中 | R293: 4.28年 | S293: 2.29年 | T293: 2.15 | U293: 125 | V293: 0.377 | W293: 4.5999999999999999e-002 | X293: 6.4000000000000001e-002 | Y293: 47 | Z293: 1.21 | AA293: -5.28e-002 | AB293: -6.0599999999999994e-002 | AC293: -0.106 | AD293: -0.10800000000000001 | AE293: 90.34 | AF293: 94.8 | AG293: 0.81 | AH293: AA- | AI293: 6.0899999999999996e-002 | AJ293: =H293+100*O293 -> 161.81 | AK293: 165.5 | AL293: 286 | AM293: 70.7 | AN293: 285 | AO293: -2.7999999999999997e-002 | AP293: 16 | AQ293: 常汽转债!
A294: 216 | B294: 123043 | C294: 正元转债 | D294: 300645 | E294: 正元智慧 | F294: 计算机及 | G294: 软件开发 | H294: 155 | I294: -1.52e-002 | J294: -2.0999999999999999e-003 | K294: 18.43 | L294: -2.3300000000000001e-002 | M294: 120.9 | N294: 15.38 | O294: 0.29299999999999998 | P294: 119.83 | Q294: 转股中 | R294: 4.58年 | S294: 2.58年 | T294: 1.66 | U294: 324 | V294: 1.24 | W294: 7.0999999999999994e-002 | X294: 8.5000000000000006e-002 | Y294: 23 | Z294: 3.65 | AA294: -5.3899999999999997e-002 | AB294: -6.1100000000000002e-002 | AC294: -0.13500000000000001 | AD294: -0.13699999999999998 | AE294: 86.19 | AF294: 88.65 | AG294: 0.74 | AH294: A+ | AI294: 7.1900000000000006e-002 | AJ294: =H294+100*O294 -> 184.30000000000001 | AK294: 190.2 | AL294: 325 | AM294: 101.5 | AN294: 331 | AO294: 5.2000000000000005e-002 | AP294: 17 | AQ294: 正元转债
A295: 44 | B295: 123102 | C295: 华自转债 | D295: 300490 | E295: 华自科技 | F295: 机械装备 | G295: 机器人及 | H295: 172.593 | I295: 1.7000000000000001e-003 | J295: -7.3000000000000001e-003 | K295: 17.88 | L295: -6.0999999999999995e-003 | M295: 126.9 | N295: 9.25 | O295: -0.107 | P295: 193.3 | Q295: 43天 | R295: 5.60年 | S295: 3.60年 | T295: 6.7 | U295: 381 | V295: 0.32799999999999996 | W295: 0.14599999999999999 | X295: 0.28199999999999997 | Y295: 46 | Z295: 2.62 | AA295: -5.4600000000000003e-002 | AB295: -6.1799999999999994e-002 | AC295: -0.12 | AD295: -0.122 | AE295: 83.87 | AF295: 91.27 | AG295: 0.91 | AH295: AA- | AI295: 6.2199999999999998e-002 | AJ295: =H295+100*O295 -> 161.893 | AK295: 151.9 | AL295: 233 | AM295: 60.6 | AN295: 238 | AO295: -9.3000000000000013e-002 | AP295: 21 | AQ295: 华自转债
A296: 176 | B296: 113585 | C296: 寿仙转债! | D296: 603896 | E296: 寿仙谷 | F296: 医药 | G296: 中药 | H296: 153.55 | I296: 1.1999999999999999e-003 | J296: -3.4999999999999996e-003 | K296: 43.57 | L296: -2.5000000000000001e-003 | M296: 117.3 | N296: 28.38 | O296: 0. | P296: 153.52 | Q296: 转股中 | R296: 4.84年 | S296: 2.84年 | T296: 1.08 | U296: 48 | V296: 0.29399999999999998 | W296: 1.6e-002 | X296: 2.5000000000000001e-002 | Y296: 66 | Z296: 4.72 | AA296: -5.5099999999999996e-002 | AB296: -6.08e-002 | AC296: -0.121 | AD296: -0.12300000000000001 | AE296: 86.91 | AF296: 88.64 | AG296: 0.89 | AH296: AA- | AI296: 6.0899999999999996e-002 | AJ296: =H296+100*O296 -> 153.55000000000001 | AK296: 153.6 | AL296: 244 | AM296: 64.9 | AN296: 256 | AO296: 5.7000000000000002e-002 | AP296: 14 | AQ296: 寿仙转债!
A297: 240 | B297: 128082 | C297: 华锋转债!! | D297: 2806 | E297: 华锋股份 | F297: 电子 | G297: 元器件制 | H297: 155 | I297: -4.0000000000000001e-003 | J297: 2.4399999999999998e-002 | K297: 13.74 | L297: 2.3799999999999998e-002 | M297: 121.4 | N297: 9.13 | O297: 2.9999999999999999e-002 | P297: 150.49 | Q297: 转股中 | R297: 4.33年 | S297: 2.33年 | T297: 2.19 | U297: 316 | V297: 0.92599999999999993 | W297: 8.4000000000000005e-002 | X297: 0.126 | Y297: 26 | Z297: 2.5 | AA297: -5.62e-002 | AB297: -6.3899999999999998e-002 | AC297: -0.10800000000000001 | AD297: -0.109 | AE297: 86.1 | AF297: 87.18 | AG297: 0.85 | AH297: A | AI297: 8.1900000000000001e-002 | AJ297: =H297+100*O297 -> 158. | AK297: 159.5 | AL297: 271 | AM297: 72.3 | AN297: 290 | AO297: 8.900000000000001e-002 | AP297: 54 | AQ297: 华锋转债!!
A298: 245 | B298: 123035 | C298: 利德转债!! | D298: 300296 | E298: 利亚德 | F298: 电子 | G298: LED制 | H298: 147.233 | I298: -2.0999999999999999e-003 | J298: -1.54e-002 | K298: 9.65 | L298: -2.1299999999999999e-002 | M298: 115.1 | N298: 6.96 | O298: 6.2e-002 | P298: 138.65 | Q298: 转股中 | R298: 4.27年 | S298: 2.28年 | T298: 8 | U298: 71 | V298: 5.9999999999999998e-002 | W298: 3.3000000000000002e-002 | X298: 4.4999999999999998e-002 | Y298: 245 | Z298: 3.36 | AA298: -5.7099999999999998e-002 | AB298: -6.2899999999999998e-002 | AC298: -0.10000000000000001 | AD298: -0.10199999999999999 | AE298: 95.38 | AF298: 99.74 | AG298: 0.82 | AH298: AA+ | AI298: 3.49e-002 | AJ298: =H298+100*O298 -> 153.43299999999999 | AK298: 155.8 | AL298: 257 | AM298: 56.1 | AN298: 214 | AO298: 4.0000000000000001e-002 | AP298: 14 | AQ298: 利德转债!!
A299: 132 | B299: 128128 | C299: 齐翔转2! | D299: 2408 | E299: 齐翔腾达 | F299: 化工 | G299: 化工 | H299: 159.14 | I299: 1.3600000000000001e-002 | J299: 2.5000000000000001e-003 | K299: 12.2 | L299: 1.84e-002 | M299: 115.3 | N299: 7.97 | O299: 4.0000000000000001e-002 | P299: 153.07 | Q299: 转股中 | R299: 5年13天 | S299: 3年14天 | T299: 8.74 | U299: 34 | V299: 2.4e-002 | W299: 3.6000000000000004e-002 | X299: 5.5e-002 | Y299: 244 | Z299: 2.24 | AA299: -6.3099999999999989e-002 | AB299: -6.7900000000000002e-002 | AC299: -0.12300000000000001 | AD299: -0.125 | AE299: 91.26 | AF299: 94.49 | AG299: 0.88 | AH299: AA | AI299: 4.1200000000000001e-002 | AJ299: =H299+100*O299 -> 163.13999999999999 | AK299: 165.2 | AL299: 284 | AM299: 70.7 | AN299: 284 | AO299: -4.4000000000000004e-002 | AP299: 32 | AQ299: 齐翔转2!
A300: 344 | B300: 128033 | C300: 迪龙转债! | D300: 2658 | E300: 雪迪龙 | F300: 城市公用 | G300: 三废处理 | H300: 126.95 | I300: -4.1999999999999997e-003 | J300: 4.7999999999999996e-003 | K300: 9.43 | L300: 1.1000000000000001e-003 | M300: 108.8 | N300: 8.71 | O300: 0.17300000000000001 | P300: 108.27 | Q300: 转股中 | R300: 2.39年 | S300: 0.39年 | T300: 2.98 | U300: 53 | V300: 0.14099999999999999 | W300: 5.0000000000000003e-002 | X300: 5.4000000000000006e-002 | Y300: 59 | Z300: 2.49 | AA300: -6.3399999999999998e-002 | AB300: -6.9699999999999998e-002 | AC300: -0.377 | AD300: -0.38100000000000001 | AE300: 99.44 | AF300: 99.57 | AG300: 0.62 | AH300: AA | AI300: 3.8399999999999997e-002 | AJ300: =H300+100*O300 -> 144.25 | AK300: 145.6 | AL300: 195 | AM300: 46.1 | AN300: 140 | AO300: -4.7e-002 | AP300: 35 | AQ300: 迪龙转债!
A301: 296 | B301: 127011 | C301: 中鼎转2! | D301: 887 | E301: 中鼎股份 | F301: 汽车 | G301: 零部件制 | H301: 144.296 | I301: -1.84e-002 | J301: 1.1599999999999999e-002 | K301: 15.8 | L301: -8.199999999999999e-003 | M301: 114.5 | N301: 11.39 | O301: 4.0000000000000001e-002 | P301: 138.72 | Q301: 转股中 | R301: 3.59年 | S301: 1.59年 | T301: 12 | U301: 69 | V301: 3.9e-002 | W301: 6.2e-002 | X301: 8.5999999999999993e-002 | Y301: 193 | Z301: 2.16 | AA301: -6.3600000000000004e-002 | AB301: -7.0099999999999996e-002 | AC301: -0.14999999999999999 | AD301: -0.152 | AE301: 96.88 | AF301: 101.5 | AG301: 0.83 | AH301: AA+ | AI301: 3.49e-002 | AJ301: =H301+100*O301 -> 148.29599999999999 | AK301: 149.9 | AL301: 222 | AM301: 48.4 | AN301: 152 | AO301: 8.9999999999999997e-002 | AP301: 21 | AQ301: 中鼎转2!
A302: 29 | B302: 123111 | C302: 东财转3 | D302: 300059 | E302: 东方财富 | F302: 金融 | G302: 证券行业 | H302: 159.85 | I302: 2.5999999999999999e-003 | J302: 3.7000000000000002e-003 | K302: 32.93 | L302: 7.3000000000000001e-003 | M302: 110.5 | N302: 23.35 | O302: 0.13300000000000001 | P302: 141.03 | Q302: 2月8天 | R302: 5.67年 | S302: 3.67年 | T302: 158 | U302: 634 | V302: 2.5000000000000001e-002 | W302: 4.5999999999999999e-002 | X302: 6.5000000000000002e-002 | Y302: 3404. | Z302: 9.35 | AA302: -6.3700000000000007e-002 | AB302: -6.6699999999999995e-002 | AC302: -0.107 | AD302: -0.10800000000000001 | AE302: 89.05 | AF302: 90.54 | AG302: 0.85 | AH302: AA+ | AI302: 3.6200000000000003e-002 | AJ302: =H302+100*O302 -> 173.15000000000001 | AK302: 178.7 | AL302: 309 | AM302: 88.1 | AN302: 314 | AO302: 9.0000000000000011e-003 | AP302: 19 | AQ302: 东财转3
A303: 17 | B303: 123114 | C303: 三角转债 | D303: 300775 | E303: 三角防务 | F303: 航空航天 | G303: 航空航天 | H303: 176.7 | I303: 3.73e-002 | J303: -2.3300000000000001e-002 | K303: 44.66 | L303: 1.6799999999999999e-002 | M303: 121 | N303: 31.82 | O303: 0.25900000000000001 | P303: 140.35 | Q303: 3月26天 | R303: 5.80年 | S303: 3.80年 | T303: 9.04 | U303: 508 | V303: 0.32100000000000001 | W303: 4.0999999999999995e-002 | X303: 5.7000000000000002e-002 | Y303: 221 | Z303: 10.79 | AA303: -6.4199999999999993e-002 | AB303: -6.9800000000000001e-002 | AC303: -0.121 | AD303: -0.122 | AE303: 81.99 | AF303: 85.87 | AG303: 0.83 | AH303: AA- | AI303: 6.2199999999999998e-002 | AJ303: =H303+100*O303 -> 202.59999999999999 | AK303: 213 | AL303: 339 | AM303: 127.2 | AN303: 343 | AO303: 0.13100000000000001 | AP303: 4 | AQ303: 三角转债
A304: 106 | B304: 123074 | C304: 隆利转债!! | D304: 300752 | E304: 隆利科技 | F304: 电子 | G304: 液晶显示 | H304: 174.559 | I304: -2.8999999999999998e-002 | J304: 7.000000000000001e-004 | K304: 30.1 | L304: -3.2500000000000001e-002 | M304: 124 | N304: 18.33 | O304: 6.3e-002 | P304: 164.21 | Q304: 转股中 | R304: 5.23年 | S304: 3.23年 | T304: 1.48 | U304: 458 | V304: 1.74 | W304: 2.5000000000000001e-002 | X304: 4.2000000000000003e-002 | Y304: 58 | Z304: 4.18 | AA304: -6.4399999999999999e-002 | AB304: -7.1399999999999991e-002 | AC304: -0.13800000000000001 | AD304: -0.14000000000000001 | AE304: 84.86 | AF304: 91.06 | AG304: 0.87 | AH304: AA- | AI304: 6.2199999999999998e-002 | AJ304: =H304+100*O304 -> 180.85900000000001 | AK304: 184.9 | AL304: 318 | AM304: 93.8 | AN304: 324 | AO304: -1.1000000000000001e-002 | AP304: 16 | AQ304: 隆利转债!!
A305: 66 | B305: 113615 | C305: 金诚转债! | D305: 603979 | E305: 金诚信 | F305: 有色金属 | G305: 有色行业 | H305: 168.4 | I305: 1.44e-002 | J305: 7.1999999999999998e-003 | K305: 20.01 | L305: 2.41e-002 | M305: 117.3 | N305: 12.65 | O305: 6.5000000000000002e-002 | P305: 158.18 | Q305: 转股中 | R305: 5.38年 | S305: 3.38年 | T305: 8.98 | U305: 79 | V305: 5.2000000000000005e-002 | W305: 7.5999999999999998e-002 | X305: 0.12 | Y305: 118 | Z305: 2.51 | AA305: -6.6100000000000006e-002 | AB305: -7.1199999999999999e-002 | AC305: -0.125 | AD305: -0.126 | AE305: 90.09 | AF305: 94.82 | AG305: 0.9 | AH305: AA | AI305: 4.1200000000000001e-002 | AJ305: =H305+100*O305 -> 174.90000000000001 | AK305: 178.6 | AL305: 308 | AM305: 83.8 | AN305: 308 | AO305: -2.e-002 | AP305: 3 | AQ305: 金诚转债!
A306: 64 | B306: 113616 | C306: 韦尔转债! | D306: 603501 | E306: 韦尔股份 | F306: 电子 | G306: 元器件制 | H306: 164.8 | I306: -1.6500000000000001e-002 | J306: -1.47e-002 | K306: 308.97 | L306: -3.7699999999999997e-002 | M306: 114.5 | N306: 222.52 | O306: 0.187 | P306: 138.85 | Q306: 转股中 | R306: 5.39年 | S306: 3.40年 | T306: 24.3 | U306: 252 | V306: 6.2e-002 | W306: 9.0000000000000011e-003 | X306: 1.3000000000000001e-002 | Y306: 2684. | Z306: 21.56 | AA306: -6.6199999999999995e-002 | AB306: -7.0499999999999993e-002 | AC306: -0.121 | AD306: -0.122 | AE306: 90.82 | AF306: 94.8 | AG306: 0.83 | AH306: AA+ | AI306: 3.6200000000000003e-002 | AJ306: =H306+100*O306 -> 183.5 | AK306: 190.7 | AL306: 326 | AM306: 96 | AN306: 327 | AO306: -1.3000000000000001e-002 | AP306: 9 | AQ306: 韦尔转债!
A307: 221 | B307: 128097 | C307: 奥佳转债! | D307: 2614 | E307: 奥佳华 | F307: 机械装备 | G307: 专用设备 | H307: 158.8 | I307: -3.6600000000000001e-002 | J307: 2.07e-002 | K307: 15.42 | L307: -1.8500000000000003e-002 | M307: 114.9 | N307: 10.39 | O307: 7.0000000000000007e-002 | P307: 148.41 | Q307: 转股中 | R307: 4.55年 | S307: 2.56年 | T307: 4.6 | U307: 108 | V307: 0.14800000000000002 | W307: 4.7e-002 | X307: 7.0000000000000007e-002 | Y307: 97 | Z307: 2.1 | AA307: -6.9800000000000001e-002 | AB307: -7.4999999999999997e-002 | AC307: -0.10199999999999999 | AD307: -0.10300000000000001 | AE307: 93.05 | AF307: 96.49 | AG307: 0.87 | AH307: AA | AI307: 3.9900000000000005e-002 | AJ307: =H307+100*O307 -> 165.80000000000001 | AK307: 169.2 | AL307: 295 | AM307: 72.7 | AN307: 291 | AO307: -0.14800000000000002 | AP307: 20 | AQ307: 奥佳转债!
A308: 45 | B308: 123103 | C308: 震安转债 | D308: 300767 | E308: 震安科技 | F308: 化工 | G308: 橡胶塑料 | H308: 180.913 | I308: -6.5099999999999991e-002 | J308: -1.5e-003 | K308: 86.25 | L308: -7.6600000000000001e-002 | M308: 121.4 | N308: 56.89 | O308: 0.193 | P308: 151.61 | Q308: 45天 | R308: 5.60年 | S308: 3.60年 | T308: 2.85 | U308: 318 | V308: 0.60399999999999998 | W308: 1.6e-002 | X308: 2.5000000000000001e-002 | Y308: 174 | Z308: 10.91 | AA308: -7.0099999999999996e-002 | AB308: -7.5899999999999995e-002 | AC308: -0.13100000000000001 | AD308: -0.13300000000000001 | AE308: 80.42 | AF308: 82.53 | AG308: 0.87 | AH308: A+ | AI308: 7.3200000000000001e-002 | AJ308: =H308+100*O308 -> 200.21300000000002 | AK308: 210.2 | AL308: 337 | AM308: 127.7 | AN308: 344 | AO308: 8.0000000000000002e-003 | AP308: 4 | AQ308: 震安转债
A309: 248 | B309: 123033 | C309: 金力转债!!* | D309: 300748 | E309: 金力永磁 | F309: 电子 | G309: 元器件制 | H309: 166 | I309: 9.0700000000000003e-002 | J309: 1.7899999999999999e-002 | K309: 42.37 | L309: 0.109 | M309: 121.5 | N309: 25.3 | O309: -9.0000000000000011e-003 | P309: 167.47 | Q309: 转股中 | R309: 4.24年 | S309: 2.24年 | T309: 3.19 | U309: 4519. | V309: 8.4000000000000004 | W309: 1.1000000000000001e-002 | X309: 1.8000000000000002e-002 | Y309: 293 | Z309: 8.72 | AA309: -7.2900000000000006e-002 | AB309: -8.0600000000000005e-002 | AC309: -0.129 | AD309: -0.13100000000000001 | AE309: 91.31 | AF309: 95.34 | AG309: 1 | AH309: AA- | AI309: 6.0899999999999996e-002 | AJ309: =H309+100*O309 -> 165.09999999999999 | AK309: 164.5 | AL309: 283 | AM309: 69.2 | AN309: 276 | AO309: 0.13100000000000001 | AP309: 25 | AQ309: 金力转债!!*
A310: 111 | B310: 123070 | C310: 鹏辉转债! | D310: 300438 | E310: 鹏辉能源 | F310: 汽车 | G310: 零部件制 | H310: 170.569 | I310: -3.2000000000000002e-003 | J310: 1.43e-002 | K310: 33.44 | L310: 1.21e-002 | M310: 115.1 | N310: 20.06 | O310: 2.3e-002 | P310: 166.7 | Q310: 转股中 | R310: 5.20年 | S310: 3.21年 | T310: 7.49 | U310: 766 | V310: 0.58499999999999996 | W310: 5.2999999999999999e-002 | X310: 8.900000000000001e-002 | Y310: 140 | Z310: 5.94 | AA310: -7.400000000000001e-002 | AB310: -7.85e-002 | AC310: -0.13500000000000001 | AD310: -0.13600000000000001 | AE310: 90.53 | AF310: 93.67 | AG310: 0.92 | AH310: AA | AI310: 4.1200000000000001e-002 | AJ310: =H310+100*O310 -> 172.869 | AK310: 174.4 | AL310: 303 | AM310: 80.8 | AN310: 303 | AO310: 0.115 | AP310: 6 | AQ310: 鹏辉转债!
A311: 10 | B311: 127038 | C311: 国微转债 | D311: 2049 | E311: 紫光国微 | F311: 电子 | G311: 芯片制造 | H311: 178.75 | I311: 4.1999999999999997e-003 | J311: -1.8200000000000001e-002 | K311: 195.69 | L311: -1.66e-002 | M311: 114.5 | N311: 137.78 | O311: 0.25900000000000001 | P311: 142.03 | Q311: 4月13天 | R311: 5.84年 | S311: 3.85年 | T311: 15 | U311: 234 | V311: 8.6999999999999994e-002 | W311: 1.3000000000000001e-002 | X311: 1.8000000000000002e-002 | Y311: 1187. | Z311: 22.46 | AA311: -7.4299999999999991e-002 | AB311: -7.8200000000000006e-002 | AC311: -0.12300000000000001 | AD311: -0.124 | AE311: 89.38 | AF311: 93.29 | AG311: 0.84 | AH311: AA+ | AI311: 3.6200000000000003e-002 | AJ311: =H311+100*O311 -> 204.65000000000001 | AK311: 215.5 | AL311: 342 | AM311: 122.2 | AN311: 339 | AO311: 0.11699999999999999 | AP311: 4 | AQ311: 国微转债
A312: 303 | B312: 128053 | C312: 尚荣转债! | D312: 2551 | E312: 尚荣医疗 | F312: 医药 | G312: 医疗器械 | H312: 149.492 | I312: -4.58e-002 | J312: 3.2199999999999999e-002 | K312: 5.29 | L312: -1.49e-002 | M312: 114.3 | N312: 4.89 | O312: 0.38200000000000001 | P312: 108.18 | Q312: 转股中 | R312: 3.53年 | S312: 1.53年 | T312: 1.91 | U312: 567 | V312: 1.99 | W312: 4.4000000000000004e-002 | X312: 4.8000000000000001e-002 | Y312: 43 | Z312: 1.42 | AA312: -7.4499999999999997e-002 | AB312: -8.1000000000000003e-002 | AC312: -0.17000000000000001 | AD312: -0.17199999999999999 | AE312: 96.27 | AF312: 99.84 | AG312: 0.91 | AH312: AA | AI312: 3.9900000000000005e-002 | AJ312: =H312+100*O312 -> 187.69200000000001 | AK312: 190.8 | AL312: 327 | AM312: 91 | AN312: 319 | AO312: -1.e-003 | AP312: 24 | AQ312: 尚荣转债!
A313: 287 | B313: 123025 | C313: 精测转债!! | D313: 300567 | E313: 精测电子 | F313: 电子 | G313: 液晶显示 | H313: 155 | I313: -9.4999999999999998e-003 | J313: 6.8000000000000005e-003 | K313: 71.18 | L313: -3.0999999999999999e-003 | M313: 116.5 | N313: 49.37 | O313: 7.4999999999999997e-002 | P313: 144.18 | Q313: 转股中 | R313: 3.64年 | S313: 1.65年 | T313: 3.09 | U313: 166 | V313: 0.34100000000000003 | W313: 1.6e-002 | X313: 2.2000000000000002e-002 | Y313: 198 | Z313: 9.97 | AA313: -7.6700000000000004e-002 | AB313: -8.3800000000000013e-002 | AC313: -0.16899999999999998 | AD313: -0.17100000000000001 | AE313: 92.47 | AF313: 94.33 | AG313: 0.86 | AH313: AA- | AI313: 6.0899999999999996e-002 | AJ313: =H313+100*O313 -> 162.5 | AK313: 165.8 | AL313: 287 | AM313: 71.5 | AN313: 286 | AO313: 2.7000000000000003e-002 | AP313: 17 | AQ313: 精测转债!!
A314: 304 | B314: 113527 | C314: 维格转债!! | D314: 603518 | E314: 锦泓集团 | F314: 服装纺织 | G314: 服装行业 | H314: 156.97 | I314: 1.2199999999999999e-002 | J314: 8.1000000000000013e-003 | K314: 14.25 | L314: 2.4399999999999998e-002 | M314: 119.5 | N314: 9.85 | O314: 8.5000000000000006e-002 | P314: 144.67 | Q314: 转股中 | R314: 3.47年 | S314: 1.47年 | T314: 2.87 | U314: 585 | V314: 1.28 | W314: 7.0999999999999994e-002 | X314: 0.10199999999999999 | Y314: 41 | Z314: 1.88 | AA314: -7.690000000000001e-002 | AB314: -8.5600000000000009e-002 | AC314: -0.19699999999999998 | AD314: -0.19899999999999998 | AE314: 95.03 | AF314: 101.26 | AG314: 0.83 | AH314: AA | AI314: 4.99e-002 | AJ314: =H314+100*O314 -> 165.47 | AK314: 169.3 | AL314: 296 | AM314: 68 | AN314: 270 | AO314: -0.23300000000000001 | AP314: 82 | AQ314: 维格转债!!
A315: 26 | B315: 113047 | C315: 旗滨转债 | D315: 601636 | E315: 旗滨集团 | F315: 建筑 | G315: 玻璃 | H315: 180.72 | I315: -3.4500000000000003e-002 | J315: 1.84e-002 | K315: 20.87 | L315: -1.7899999999999999e-002 | M315: 114 | N315: 12.8 | O315: 0.10800000000000001 | P315: 163.05 | Q315: 2月10天 | R315: 5.67年 | S315: 3.68年 | T315: 15 | U315: 246 | V315: 8.9999999999999997e-002 | W315: 2.7000000000000003e-002 | X315: 4.4000000000000004e-002 | Y315: 561 | Z315: 5.4 | AA315: -7.8899999999999998e-002 | AB315: -8.2799999999999999e-002 | AC315: -0.13200000000000001 | AD315: -0.13300000000000001 | AE315: 89.49 | AF315: 93.42 | AG315: 0.9 | AH315: AA+ | AI315: 3.6200000000000003e-002 | AJ315: =H315+100*O315 -> 191.52000000000001 | AK315: 198.4 | AL315: 333 | AM315: 105 | AN315: 332 | AO315: 2.e-003 | AP315: 6 | AQ315: 旗滨转债
A316: 203 | B316: 128103 | C316: 同德转债! | D316: 2360 | E316: 同德化工 | F316: 化工 | G316: 化工 | H316: 177.007 | I316: -1.7600000000000001e-002 | J316: -6.5000000000000006e-003 | K316: 8.89 | L316: -2.41e-002 | M316: 121.3 | N316: 5.08 | O316: 1.1000000000000001e-002 | P316: 175 | Q316: 转股中 | R316: 4.63年 | S316: 2.64年 | T316: 1.09 | U316: 78 | V316: 0.40200000000000002 | W316: 3.1e-002 | X316: 5.4000000000000006e-002 | Y316: 35 | Z316: 2.76 | AA316: -7.980000000000001e-002 | AB316: -8.6699999999999999e-002 | AC316: -0.11599999999999999 | AD316: -0.11699999999999999 | AE316: 85.96 | AF316: 88.6 | AG316: 1 | AH316: A+ | AI316: 7.1900000000000006e-002 | AJ316: =H316+100*O316 -> 178.107 | AK316: 179 | AL316: 310 | AM316: 90.4 | AN316: 317 | AO316: 6.7000000000000004e-002 | AP316: 15 | AQ316: 同德转债!
A317: 39 | B317: 127030 | C317: 盛虹转债 | D317: 301 | E317: 东方盛虹 | F317: 化工 | G317: 化纤 | H317: 185 | I317: 8.6999999999999994e-003 | J317: -1.9400000000000001e-002 | K317: 22.64 | L317: -1.18e-002 | M317: 112.5 | N317: 14.1 | O317: 0.152 | P317: 160.57 | Q317: 52天 | R317: 5.62年 | S317: 3.63年 | T317: 50 | U317: 415 | V317: 4.4999999999999998e-002 | W317: 4.5999999999999999e-002 | X317: 7.2999999999999995e-002 | Y317: 1095. | Z317: 6.03 | AA317: -8.5699999999999998e-002 | AB317: -8.9200000000000002e-002 | AC317: -0.13699999999999998 | AD317: -0.13800000000000001 | AE317: 90.08 | AF317: 92.39 | AG317: 0.91 | AH317: AA+ | AI317: 3.6200000000000003e-002 | AJ317: =H317+100*O317 -> 200.19999999999999 | AK317: 209.4 | AL317: 336 | AM317: 117 | AN317: 336 | AO317: -0.106 | AP317: 4 | AQ317: 盛虹转债
A318: 358 | B318: 128018 | C318: 时达转债! | D318: 2527 | E318: 新时达 | F318: 机械装备 | G318: 机器人及 | H318: 133.509 | I318: -3.7000000000000002e-003 | J318: 2.8999999999999998e-003 | K318: 8.89 | L318: -1.1000000000000001e-003 | M318: 109.3 | N318: 7.36 | O318: 0.105 | P318: 120.79 | Q318: 转股中 | R318: 2.25年 | S318: 0.25年 | T318: 4.04 | U318: 3.1 | V318: 6.0000000000000001e-003 | W318: 7.2999999999999995e-002 | X318: 8.8000000000000009e-002 | Y318: 55 | Z318: 2.1 | AA318: -8.6500000000000007e-002 | AB318: -9.3299999999999994e-002 | AC318: -0.60499999999999998 | AD318: -0.61099999999999999 | AE318: 100.22 | AF318: 100.58 | AG318: 0.78 | AH318: AA | AI318: 3.8399999999999997e-002 | AJ318: =H318+100*O318 -> 144.00899999999999 | AK318: 146.2 | AL318: 200 | AM318: 45.7 | AN318: 136 | AO318: 2.7999999999999997e-002 | AP318: 34 | AQ318: 时达转债!
A319: 122 | B319: 123066 | C319: 赛意转债!* | D319: 300687 | E319: 赛意信息 | F319: 计算机及 | G319: 软件开发 | H319: 194.1 | I319: -5.3200000000000004e-002 | J319: 3.4200000000000001e-002 | K319: 26.86 | L319: -1.9e-002 | M319: 121.4 | N319: 14.01 | O319: 1.2e-002 | P319: 191.72 | Q319: 转股中 | R319: 5年40天 | S319: 3年41天 | T319: 0.77 | U319: 515 | V319: 3.46 | W319: 8.0000000000000002e-003 | X319: 1.4999999999999999e-002 | Y319: 98 | Z319: 5.94 | AA319: -8.9399999999999993e-002 | AB319: -9.5600000000000004e-002 | AC319: -0.10400000000000001 | AD319: -0.105 | AE319: 82.99 | AF319: 85.36 | AG319: 1 | AH319: A+ | AI319: 7.3200000000000001e-002 | AJ319: =H319+100*O319 -> 195.29999999999998 | AK319: 196.5 | AL319: 332 | AM319: 111.1 | AN319: 335 | AO319: 0.17800000000000002 | AP319: 8 | AQ319: 赛意转债!*
A320: 89 | B320: 123079 | C320: 运达转债! | D320: 300772 | E320: 运达股份 | F320: 能源电力 | G320: 风能 | H320: 191.801 | I320: 5.7300000000000004e-002 | J320: -1.3600000000000001e-002 | K320: 28.87 | L320: 4.3700000000000003e-002 | M320: 115.1 | N320: 15.12 | O320: 5.0000000000000001e-003 | P320: 190.94 | Q320: 转股中 | R320: 5.32年 | S320: 3.32年 | T320: 2.34 | U320: 530 | V320: 1.22 | W320: 2.5000000000000001e-002 | X320: 4.8000000000000001e-002 | Y320: 92 | Z320: 5.03 | AA320: -9.3000000000000013e-002 | AB320: -9.7299999999999998e-002 | AC320: -0.157 | AD320: -0.158 | AE320: 90.11 | AF320: 93.24 | AG320: 1 | AH320: AA | AI320: 4.1200000000000001e-002 | AJ320: =H320+100*O320 -> 192.30099999999999 | AK320: 192.7 | AL320: 329 | AM320: 99.4 | AN320: 329 | AO320: 0.10800000000000001 | AP320: 4 | AQ320: 运达转债!
A321: 293 | B321: 123022 | C321: 长信转债!! | D321: 300088 | E321: 长信科技 | F321: 通信互联 | G321: 通信设备 | H321: 161.99 | I321: 6.3e-003 | J321: 1.5100000000000001e-002 | K321: 8.8 | L321: 2.4399999999999998e-002 | M321: 114.3 | N321: 6.05 | O321: 0.114 | P321: 145.45 | Q321: 转股中 | R321: 3.61年 | S321: 1.62年 | T321: 2.57 | U321: 70 | V321: 0.16600000000000001 | W321: 1.2e-002 | X321: 1.7000000000000001e-002 | Y321: 216 | Z321: 2.99 | AA321: -9.35e-002 | AB321: -9.9600000000000008e-002 | AC321: -0.188 | AD321: -0.18899999999999997 | AE321: 95.94 | AF321: 99.51 | AG321: 0.88 | AH321: AA | AI321: 3.9900000000000005e-002 | AJ321: =H321+100*O321 -> 173.39000000000001 | AK321: 178.5 | AL321: 307 | AM321: 79 | AN321: 299 | AO321: 2.3e-002 | AP321: 12 | AQ321: 长信转债!!
A322: 56 | B322: 113621 | C322: 彤程转债 | D322: 603650 | E322: 彤程新材 | F322: 化工 | G322: 橡胶塑料 | H322: 195.38 | I322: -1.23e-002 | J322: 1.44e-002 | K322: 64.25 | L322: 2.2000000000000001e-003 | M322: 115.1 | N322: 32.62 | O322: -8.0000000000000002e-003 | P322: 196.97 | Q322: 转股中 | R322: 5.47年 | S322: 3.48年 | T322: 5.73 | U322: 726 | V322: 0.64500000000000002 | W322: 1.4999999999999999e-002 | X322: 2.9999999999999999e-002 | Y322: 376 | Z322: 14.61 | AA322: -9.35e-002 | AB322: -9.7699999999999995e-002 | AC322: -0.154 | AD322: -0.155 | AE322: 89.56 | AF322: 92.66 | AG322: 0.96 | AH322: AA | AI322: 4.1200000000000001e-002 | AJ322: =H322+100*O322 -> 194.57999999999998 | AK322: 193.8 | AL322: 331 | AM322: 101.1 | AN322: 330 | AO322: 6.8000000000000005e-002 | AP322: 7 | AQ322: 彤程转债
A323: 361 | B323: 113014 | C323: 林洋转债! | D323: 601222 | E323: 林洋能源 | F323: 能源电力 | G323: 电力设备 | H323: 136.2 | I323: -1.1299999999999999e-002 | J323: 6.0000000000000001e-003 | K323: 11.61 | L323: -6.0000000000000001e-003 | M323: 109.3 | N323: 8.44 | O323: -1.e-002 | P323: 137.56 | Q323: 转股中 | R323: 2.23年 | S323: 0.23年 | T323: 27.3 | U323: 618 | V323: 0.16600000000000001 | W323: 0.13500000000000001 | X323: 0.185 | Y323: 203 | Z323: 1.95 | AA323: -9.5799999999999996e-002 | AB323: -0.10300000000000001 | AC323: -0.68999999999999995 | AD323: -0.69700000000000006 | AE323: 100.32 | AF323: 100.68 | AG323: 0.9 | AH323: AA | AI323: 3.8399999999999997e-002 | AJ323: =H323+100*O323 -> 135.19999999999999 | AK323: 134.8 | AL323: 86 | AM323: 34.2 | AN323: 43 | AO323: 0.19699999999999998 | AP323: 31 | AQ323: 林洋转债!
A324: 207 | B324: 128101 | C324: 联创转债! | D324: 2036 | E324: 联创电子 | F324: 电子 | G324: 液晶显示 | H324: 181.809 | I324: -4.6900000000000004e-002 | J324: 4.99e-002 | K324: 20.35 | L324: 3.4999999999999996e-003 | M324: 114.8 | N324: 13.72 | O324: 0.22600000000000001 | P324: 148.32 | Q324: 转股中 | R324: 4.61年 | S324: 2.61年 | T324: 3 | U324: 1460. | V324: 2.75 | W324: 1.3999999999999999e-002 | X324: 2.1000000000000001e-002 | Y324: 216 | Z324: 5.87 | AA324: -9.6500000000000002e-002 | AB324: -0.10099999999999999 | AC324: -0.124 | AD324: -0.125 | AE324: 92.76 | AF324: 96.2 | AG324: 0.87 | AH324: AA | AI324: 3.9900000000000005e-002 | AJ324: =H324+100*O324 -> 204.40899999999999 | AK324: 215.3 | AL324: 341 | AM324: 119.1 | AN324: 338 | AO324: 0.154 | AP324: 15 | AQ324: 联创转债!
A325: 300 | B325: 113528 | C325: 长城转债! | D325: 603897 | E325: 长城科技 | F325: 机械装备 | G325: 专用设备 | H325: 166.79 | I325: 6.59e-002 | J325: -2.1700000000000001e-002 | K325: 38.94 | L325: 4.7899999999999998e-002 | M325: 116.8 | N325: 23.35 | O325: 0. | P325: 166.77 | Q325: 转股中 | R325: 3.57年 | S325: 1.57年 | T325: 5.91 | U325: 1685. | V325: 1.71 | W325: 8.5000000000000006e-002 | X325: 0.14199999999999999 | Y325: 69 | Z325: 3.55 | AA325: -9.6799999999999997e-002 | AB325: -0.10400000000000001 | AC325: -0.20300000000000001 | AD325: -0.20499999999999999 | AE325: 93.18 | AF325: 95.04 | AG325: 0.92 | AH325: AA- | AI325: 6.0899999999999996e-002 | AJ325: =H325+100*O325 -> 166.78999999999999 | AK325: 166.8 | AL325: 290 | AM325: 71.8 | AN325: 287 | AO325: 0.36200000000000004 | AP325: 37 | AQ325: 长城转债!
A326: 197 | B326: 113034 | C326: 滨化转债! | D326: 601678 | E326: 滨化股份 | F326: 化工 | G326: 化工 | H326: 184.99 | I326: 2.7900000000000001e-002 | J326: 3.3000000000000002e-002 | K326: 8.4 | L326: 6.4600000000000005e-002 | M326: 114.8 | N326: 4.58 | O326: 9.0000000000000011e-003 | P326: 183.41 | Q326: 转股中 | R326: 4.68年 | S326: 2.68年 | T326: 4.74 | U326: 236 | V326: 0.26400000000000001 | W326: 2.8999999999999998e-002 | X326: 5.2999999999999999e-002 | Y326: 164 | Z326: 1.83 | AA326: -9.849999999999999e-002 | AB326: -0.10300000000000001 | AC326: -0.122 | AD326: -0.12300000000000001 | AE326: 92.51 | AF326: 95.94 | AG326: 0.94 | AH326: AA | AI326: 3.9900000000000005e-002 | AJ326: =H326+100*O326 -> 185.89000000000001 | AK326: 186.6 | AL326: 321 | AM326: 90.6 | AN326: 318 | AO326: 2.9999999999999999e-002 | AP326: 22 | AQ326: 滨化转债!
A327: 294 | B327: 110055 | C327: 伊力转债!! | D327: 600197 | E327: 伊力特 | F327: 食品饮料 | G327: 白酒 | H327: 166.98 | I327: -6.7000000000000002e-003 | J327: -5.9999999999999995e-004 | K327: 23.43 | L327: -8.5000000000000006e-003 | M327: 114.3 | N327: 16.41 | O327: 0.17000000000000001 | P327: 142.78 | Q327: 转股中 | R327: 3.60年 | S327: 1.61年 | T327: 2.44 | U327: 343 | V327: 0.82999999999999996 | W327: 2.2000000000000002e-002 | X327: 3.1e-002 | Y327: 111 | Z327: 3.08 | AA327: -0.10099999999999999 | AB327: -0.10800000000000001 | AC327: -0.19899999999999998 | AD327: -0.20000000000000001 | AE327: 95.97 | AF327: 99.54 | AG327: 0.87 | AH327: AA | AI327: 3.9900000000000005e-002 | AJ327: =H327+100*O327 -> 183.97999999999999 | AK327: 191.2 | AL327: 328 | AM327: 91.6 | AN327: 320 | AO327: -0.12 | AP327: 22 | AQ327: 伊力转债!!
A328: 11 | B328: 113049 | C328: 长汽转债 | D328: 601633 | E328: 长城汽车 | F328: 汽车 | G328: 乘用车 | H328: 205.04 | I328: -1.67e-002 | J328: 4.1999999999999997e-003 | K328: 62.52 | L328: -1.37e-002 | M328: 110.5 | N328: 38.39 | O328: 0.25900000000000001 | P328: 162.85 | Q328: 4月13天 | R328: 5.84年 | S328: 3.85年 | T328: 35 | U328: 363 | V328: 5.0000000000000003e-002 | W328: 6.0000000000000001e-003 | X328: 1.e-002 | Y328: 5754. | Z328: 10.15 | AA328: -0.10099999999999999 | AB328: -0.10400000000000001 | AC328: -0.14999999999999999 | AD328: -0.151 | AE328: 89.42 | AF328: 91 | AG328: 0.91 | AH328: AAA | AI328: 3.4200000000000001e-002 | AJ328: =H328+100*O328 -> 230.94 | AK328: 247.2 | AL328: 346 | AM328: 156.2 | AN328: 347 | AO328: 0.193 | AP328: 4 | AQ328: 长汽转债
A329: 257 | B329: 113545 | C329: 金能转债! | D329: 603113 | E329: 金能科技 | F329: 煤炭 | G329: 炼焦 | H329: 179.66 | I329: 5.4000000000000003e-003 | J329: -5.8999999999999999e-003 | K329: 17.37 | L329: -5.9999999999999995e-004 | M329: 114.9 | N329: 10.43 | O329: 7.9000000000000001e-002 | P329: 166.54 | Q329: 转股中 | R329: 4.19年 | S329: 2.19年 | T329: 10.2 | U329: 71 | V329: 3.9e-002 | W329: 6.9000000000000006e-002 | X329: 0.115 | Y329: 148 | Z329: 1.78 | AA329: -0.10300000000000001 | AB329: -0.10800000000000001 | AC329: -0.153 | AD329: -0.154 | AE329: 94.4 | AF329: 97.89 | AG329: 0.92 | AH329: AA | AI329: 3.9900000000000005e-002 | AJ329: =H329+100*O329 -> 187.56 | AK329: 192.8 | AL329: 330 | AM329: 94.9 | AN329: 325 | AO329: 3.7999999999999999e-002 | AP329: 15 | AQ329: 金能转债!
A330: 173 | B330: 128113 | C330: 比音转债! | D330: 2832 | E330: 比音勒芬 | F330: 服装纺织 | G330: 服装行业 | H330: 196.126 | I330: 1.6399999999999998e-002 | J330: 2.0499999999999997e-002 | K330: 27.59 | L330: 3.8800000000000001e-002 | M330: 116.9 | N330: 14.6 | O330: 3.7999999999999999e-002 | P330: 188.97 | Q330: 转股中 | R330: 4.86年 | S330: 2.86年 | T330: 3.03 | U330: 344 | V330: 0.58299999999999996 | W330: 2.e-002 | X330: 3.7999999999999999e-002 | Y330: 152 | Z330: 5.7 | AA330: -0.10300000000000001 | AB330: -0.10800000000000001 | AC330: -0.12 | AD330: -0.121 | AE330: 91.95 | AF330: 97.01 | AG330: 0.95 | AH330: AA | AI330: 3.9900000000000005e-002 | AJ330: =H330+100*O330 -> 199.92600000000002 | AK330: 203.3 | AL330: 334 | AM330: 106.3 | AN330: 333 | AO330: 0.129 | AP330: 9 | AQ330: 比音转债!
A331: 226 | B331: 123042 | C331: 银河转债! | D331: 300619 | E331: 金银河 | F331: 机械装备 | G331: 专用设备 | H331: 187.518 | I331: 0.14999999999999999 | J331: 3.0699999999999998e-002 | K331: 39.9 | L331: 0.20000000000000001 | M331: 115.4 | N331: 24.38 | O331: 0.14599999999999999 | P331: 163.66 | Q331: 转股中 | R331: 4.44年 | S331: 2.44年 | T331: 1.67 | U331: 6242. | V331: 20.850000000000001 | W331: 5.5999999999999994e-002 | X331: 9.1999999999999998e-002 | Y331: 30 | Z331: 6.11 | AA331: -0.106 | AB331: -0.111 | AC331: -0.14099999999999999 | AD331: -0.14199999999999999 | AE331: 86.75 | AF331: 85.42 | AG331: 0.91 | AH331: A+ | AI331: 7.1900000000000006e-002 | AJ331: =H331+100*O331 -> 202.11799999999999 | AK331: 211.4 | AL331: 338 | AM331: 124.6 | AN331: 341 | AO331: 0.504 | AP331: 22 | AQ331: 银河转债!
A332: 323 | B332: 123012 | C332: 万顺转债! | D332: 300057 | E332: 万顺新材 | F332: 有色金属 | G332: 铝金属 | H332: 155 | I332: 5.5999999999999994e-002 | J332: 2.e-003 | K332: 7.81 | L332: 6.4000000000000001e-002 | M332: 109.3 | N332: 5.27 | O332: 4.5999999999999999e-002 | P332: 148.2 | Q332: 转股中 | R332: 2.95年 | S332: 0.95年 | T332: 1.29 | U332: 1131. | V332: 5.6500000000000004 | W332: 2.4e-002 | X332: 3.6000000000000004e-002 | Y332: 53 | Z332: 1.48 | AA332: -0.113 | AB332: -0.11800000000000001 | AC332: -0.30299999999999999 | AD332: -0.30499999999999999 | AE332: 95.44 | AF332: 92.42 | AG332: 0.91 | AH332: AA- | AI332: 5.9400000000000001e-002 | AJ332: =H332+100*O332 -> 159.59999999999999 | AK332: 161.8 | AL332: 278 | AM332: 66.4 | AN332: 263 | AO332: 0.13300000000000001 | AP332: 23 | AQ332: 万顺转债!
A333: 310 | B333: 128050 | C333: 钧达转债!! | D333: 2865 | E333: 钧达股份 | F333: 汽车 | G333: 零部件制 | H333: 184.509 | I333: -1.38e-002 | J333: 3.5999999999999999e-003 | K333: 27.17 | L333: -1.0200000000000001e-002 | M333: 122.7 | N333: 14.8 | O333: 5.0000000000000001e-003 | P333: 183.58 | Q333: 转股中 | R333: 3.34年 | S333: 1.35年 | T333: 1.39 | U333: 203 | V333: 0.78000000000000003 | W333: 3.9e-002 | X333: 7.0999999999999994e-002 | Y333: 36 | Z333: 3.36 | AA333: -0.11699999999999999 | AB333: -0.127 | AC333: -0.27699999999999997 | AD333: -0.27899999999999997 | AE333: 94.32 | AF333: 101.13 | AG333: 1 | AH333: AA- | AI333: 6.0899999999999996e-002 | AJ333: =H333+100*O333 -> 185.00899999999999 | AK333: 185.4 | AL333: 319 | AM333: 84.3 | AN333: 310 | AO333: 5.0999999999999997e-002 | AP333: 50 | AQ333: 钧达转债!!
A334: 218 | B334: 110066 | C334: 盛屯转债!! | D334: 600711 | E334: 盛屯矿业 | F334: 有色金属 | G334: 有色行业 | H334: 202.82 | I334: 3.9699999999999999e-002 | J334: 1.0700000000000001e-002 | K334: 9.35 | L334: 5.2900000000000003e-002 | M334: 114.9 | N334: 4.87 | O334: 5.5999999999999994e-002 | P334: 191.99 | Q334: 转股中 | R334: 4.57年 | S334: 2.57年 | T334: 3.84 | U334: 1193. | V334: 1.53 | W334: 1.4999999999999999e-002 | X334: 2.8999999999999998e-002 | Y334: 252 | Z334: 2.23 | AA334: -0.11900000000000001 | AB334: -0.124 | AC334: -0.14499999999999999 | AD334: -0.14499999999999999 | AE334: 92.99 | AF334: 96.44 | AG334: 0.95 | AH334: AA | AI334: 3.9900000000000005e-002 | AJ334: =H334+100*O334 -> 208.41999999999999 | AK334: 213.6 | AL334: 340 | AM334: 117.2 | AN334: 337 | AO334: 2.3e-002 | AP334: 33 | AQ334: 盛屯转债!!
A335: 320 | B335: 123014 | C335: 凯发转债! | D335: 300407 | E335: 凯发电气 | F335: 能源电力 | G335: 电力设备 | H335: 138.48 | I335: 1.2199999999999999e-002 | J335: 8.0000000000000004e-004 | K335: 8.17 | L335: 2.2499999999999999e-002 | M335: 107.5 | N335: 8.05 | O335: 0.36399999999999999 | P335: 101.49 | Q335: 转股中 | R335: 1.97年 | S335: 回售内 | T335: 1.16 | U335: 56 | V335: 0.35299999999999998 | W335: 4.7e-002 | X335: 4.7e-002 | Y335: 25 | Z335: 1.82 | AA335: -0.121 | AB335: -0.127 | AC335: 回售内 | AD335: 回售内 | AE335: 100.25 | AF335: 94.09 | AG335: 0.58 | AH335: A+ | AI335: 7.0400000000000004e-002 | AJ335: =H335+100*O335 -> 174.88 | AK335: 175.5 | AL335: 304 | AM335: 75.2 | AN335: 294 | AO335: 4.0000000000000001e-002 | AP335: 15 | AQ335: 凯发转债!
A336: 247 | B336: 123034 | C336: 通光转债! | D336: 300265 | E336: 通光线缆 | F336: 通信互联 | G336: 通信设备 | H336: 206.001 | I336: -3.6000000000000004e-002 | J336: -6.0000000000000001e-003 | K336: 11.43 | L336: -4.9100000000000005e-002 | M336: 118 | N336: 7.95 | O336: 0.433 | P336: 143.77 | Q336: 转股中 | R336: 4.25年 | S336: 2.25年 | T336: 0.78 | U336: 458 | V336: 2.8199999999999998 | W336: 1.9e-002 | X336: 2.7000000000000003e-002 | Y336: 42 | Z336: 3.21 | AA336: -0.125 | AB336: -0.13100000000000001 | AC336: -0.17499999999999999 | AD336: -0.17600000000000002 | AE336: 87.72 | AF336: 88.47 | AG336: 0.86 | AH336: A+ | AI336: 7.1900000000000006e-002 | AJ336: =H336+100*O336 -> 249.30099999999999 | AK336: 268.2 | AL336: 350 | AM336: 179.8 | AN336: 351 | AO336: 8.6999999999999994e-002 | AP336: 20 | AQ336: 通光转债!
A337: 186 | B337: 113580 | C337: 康隆转债! | D337: 603665 | E337: 康隆达 | F337: 服装纺织 | G337: 服装行业 | H337: 225.14 | I337: 6.1999999999999998e-003 | J337: -6.8000000000000005e-003 | K337: 11.48 | L337: -1.7000000000000001e-003 | M337: 120.8 | N337: 15.51 | O337: 2.04 | P337: 74.02 | Q337: 转股中 | R337: 4.71年 | S337: 2.71年 | T337: 0.41 | U337: 363 | V337: 3.8700000000000001 | W337: 2.3e-002 | X337: 1.7000000000000001e-002 | Y337: 18 | Z337: 1.67 | AA337: -0.126 | AB337: -0.13200000000000001 | AC337: -0.14899999999999999 | AD337: -0.14999999999999999 | AE337: 87.64 | AF337: 91.99 | AG337: 0.34 | AH337: AA- | AI337: 6.0899999999999996e-002 | AJ337: =H337+100*O337 -> 429.13999999999999 | AK337: 376.3 | AL337: 364 | AM337: 284.3 | AN337: 364 | AO337: -0.16399999999999998 | AP337: 8 | AQ337: 康隆转债!
A338: 309 | B338: 128051 | C338: 光华转债!! | D338: 2741 | E338: 光华科技 | F338: 电子 | G338: 元器件制 | H338: 180.49 | I338: 4.2000000000000003e-002 | J338: 5.4000000000000003e-003 | K338: 22.99 | L338: 4.7400000000000005e-002 | M338: 114.8 | N338: 12.72 | O338: -1.e-003 | P338: 180.74 | Q338: 转股中 | R338: 3.35年 | S338: 1.36年 | T338: 1.32 | U338: 443 | V338: 1.8799999999999999 | W338: 1.4999999999999999e-002 | X338: 2.7999999999999997e-002 | Y338: 87 | Z338: 6.95 | AA338: -0.128 | AB338: -0.13500000000000001 | AC338: -0.26700000000000002 | AD338: -0.26899999999999996 | AE338: 94.34 | AF338: 94.58 | AG338: 1 | AH338: AA- | AI338: 6.0899999999999996e-002 | AJ338: =H338+100*O338 -> 180.39000000000001 | AK338: 180.2 | AL338: 311 | AM338: 85.7 | AN338: 312 | AO338: 0.13200000000000001 | AP338: 29 | AQ338: 光华转债!!
A339: 372 | B339: 110033 | C339: 国贸转债! | D339: 600755 | E339: 厦门国贸 | F339: 交通运输 | G339: 交通运输 | H339: 114.43 | I339: 5.9999999999999995e-004 | J339: 1.9e-003 | K339: 7.13 | L339: 5.6000000000000008e-003 | M339: 108 | N339: 6.72 | O339: 7.8e-002 | P339: 106.1 | Q339: 转股中 | R339: 0.42年 | S339: 回售内 | T339: 11.5 | U339: 16 | V339: 1.2e-002 | W339: 8.3000000000000004e-002 | X339: 8.8000000000000009e-002 | Y339: 139 | Z339: 0.86 | AA339: -0.13 | AB339: -0.16 | AC339: 回售内 | AD339: 回售内 | AE339: 100.33 | AF339: 106.86 | AG339: 0.45 | AH339: AAA | AI339: 2.5699999999999997e-002 | AJ339: =H339+100*O339 -> 122.23 | AK339: 122.8 | AL339: 11 | AM339: 15.9 | AN339: 2 | AO339: -6.0999999999999999e-002 | AP339: 21 | AQ339: 国贸转债!
A340: 311 | B340: 110048 | C340: 福能转债!! | D340: 600483 | E340: 福能股份 | F340: 能源电力 | G340: 电力供应 | H340: 181.94 | I340: 3.8900000000000004e-002 | J340: -7.0999999999999995e-003 | K340: 13.65 | L340: 3.3300000000000003e-002 | M340: 113.3 | N340: 7.85 | O340: 4.5999999999999999e-002 | P340: 173.89 | Q340: 转股中 | R340: 3.34年 | S340: 1.34年 | T340: 19.5 | U340: 220 | V340: 6.2e-002 | W340: 7.5999999999999998e-002 | X340: 0.13300000000000001 | Y340: 255 | Z340: 1.54 | AA340: -0.13500000000000001 | AB340: -0.14000000000000001 | AC340: -0.27500000000000002 | AD340: -0.27600000000000002 | AE340: 97.68 | AF340: 101.29 | AG340: 0.95 | AH340: AA+ | AI340: 3.49e-002 | AJ340: =H340+100*O340 -> 186.53999999999999 | AK340: 190 | AL340: 323 | AM340: 88.7 | AN340: 315 | AO340: 0.16300000000000001 | AP340: 9 | AQ340: 福能转债!!
A341: 316 | B341: 128046 | C341: 利尔转债!! | D341: 2258 | E341: 利尔化学 | F341: 化工 | G341: 农化 | H341: 178.06 | I341: -3.5999999999999999e-003 | J341: -1.5e-003 | K341: 31.62 | L341: -5.3e-003 | M341: 112.3 | N341: 18.42 | O341: 3.7000000000000005e-002 | P341: 171.66 | Q341: 转股中 | R341: 3.20年 | S341: 1.20年 | T341: 8.08 | U341: 171 | V341: 0.11699999999999999 | W341: 4.9000000000000002e-002 | X341: 8.3000000000000004e-002 | Y341: 166 | Z341: 4.26 | AA341: -0.13699999999999998 | AB341: -0.14199999999999999 | AC341: -0.29899999999999999 | AD341: -0.30099999999999999 | AE341: 97.51 | AF341: 99.38 | AG341: 0.95 | AH341: AA | AI341: 3.9900000000000005e-002 | AJ341: =H341+100*O341 -> 181.75999999999999 | AK341: 184.5 | AL341: 317 | AM341: 85.1 | AN341: 311 | AO341: 0.107 | AP341: 10 | AQ341: 利尔转债!!
A342: 272 | B342: 113537 | C342: 文灿转债!! | D342: 603348 | E342: 文灿股份 | F342: 汽车 | G342: 零部件制 | H342: 211.28 | I342: -2.86e-002 | J342: 6.93e-002 | K342: 39.2 | L342: 4.2599999999999999e-002 | M342: 120.7 | N342: 19.28 | O342: 3.9e-002 | P342: 203.32 | Q342: 转股中 | R342: 3.84年 | S342: 1.85年 | T342: 1.41 | U342: 1879. | V342: 6.0300000000000002 | W342: 1.3999999999999999e-002 | X342: 2.7999999999999997e-002 | Y342: 103 | Z342: 3.95 | AA342: -0.13800000000000001 | AB342: -0.14499999999999999 | AC342: -0.22600000000000001 | AD342: -0.22800000000000001 | AE342: 92.1 | AF342: 96.67 | AG342: 0.96 | AH342: AA- | AI342: 6.0899999999999996e-002 | AJ342: =H342+100*O342 -> 215.18000000000001 | AK342: 219.2 | AL342: 344 | AM342: 122.6 | AN342: 340 | AO342: 0.23199999999999998 | AP342: 25 | AQ342: 文灿转债!!
A343: 58 | B343: 123094 | C343: 星源转2! | D343: 300568 | E343: 星源材质 | F343: 电子 | G343: 电子行业 | H343: 266.299 | I343: 9.1000000000000004e-003 | J343: 5.1000000000000004e-003 | K343: 52.61 | L343: 1.4499999999999999e-002 | M343: 117.3 | N343: 19.64 | O343: -6.0000000000000001e-003 | P343: 267.87 | Q343: 转股中 | R343: 5.46年 | S343: 3.46年 | T343: 6.61 | U343: 2783. | V343: 1.49 | W343: 1.7000000000000001e-002 | X343: 4.5999999999999999e-002 | Y343: 383 | Z343: 7.8 | AA343: -0.14199999999999999 | AB343: -0.14599999999999999 | AC343: -0.12 | AD343: -0.121 | AE343: 89.81 | AF343: 94.52 | AG343: 0.98 | AH343: AA | AI343: 4.1200000000000001e-002 | AJ343: =H343+100*O343 -> 265.69899999999996 | AK343: 264.7 | AL343: 349 | AM343: 170.2 | AN343: 350 | AO343: 0.20300000000000001 | AP343: 7 | AQ343: 星源转2!
A344: 121 | B344: 123067 | C344: 斯莱转债! | D344: 300382 | E344: 斯莱克 | F344: 机械装备 | G344: 专用设备 | H344: 279.92 | I344: 1.7899999999999999e-002 | J344: 6.5000000000000006e-003 | K344: 26.22 | L344: 2.5000000000000001e-002 | M344: 121.2 | N344: 9.36 | O344: -1.e-003 | P344: 280.13 | Q344: 转股中 | R344: 5年41天 | S344: 3年42天 | T344: 3.54 | U344: 373 | V344: 0.38 | W344: 2.4e-002 | X344: 6.7000000000000004e-002 | Y344: 148 | Z344: 14.26 | AA344: -0.153 | AB344: -0.159 | AC344: -0.14400000000000002 | AD344: -0.14499999999999999 | AE344: 85.64 | AF344: 89.68 | AG344: 0.98 | AH344: AA- | AI344: 6.2199999999999998e-002 | AJ344: =H344+100*O344 -> 279.81999999999999 | AK344: 279.7 | AL344: 352 | AM344: 190 | AN344: 353 | AO344: 0.26600000000000001 | AP344: 12 | AQ344: 斯莱转债!
A345: 262 | B345: 123030 | C345: 九洲转债! | D345: 300040 | E345: 九洲集团 | F345: 能源电力 | G345: 电力设备 | H345: 234.95 | I345: -2.8999999999999998e-003 | J345: 2.07e-002 | K345: 8.8 | L345: 1.8500000000000003e-002 | M345: 120 | N345: 4 | O345: 6.8000000000000005e-002 | P345: 220 | Q345: 转股中 | R345: 4年13天 | S345: 2年14天 | T345: 0.97 | U345: 472 | V345: 2.0499999999999998 | W345: 2.1000000000000001e-002 | X345: 4.4999999999999998e-002 | Y345: 47 | Z345: 1.5 | AA345: -0.156 | AB345: -0.16300000000000001 | AC345: -0.222 | AD345: -0.223 | AE345: 91.01 | AF345: 95.05 | AG345: 0.96 | AH345: AA- | AI345: 6.0899999999999996e-002 | AJ345: =H345+100*O345 -> 241.75 | AK345: 249.9 | AL345: 347 | AM345: 154.9 | AN345: 346 | AO345: -6.9999999999999993e-003 | AP345: 24 | AQ345: 九洲转债!
A346: 360 | B346: 128017 | C346: 金禾转债!! | D346: 2597 | E346: 金禾实业 | F346: 化工 | G346: 化工 | H346: 159.016 | I346: 3.3e-003 | J346: 9.4999999999999998e-003 | K346: 28.68 | L346: 1.52e-002 | M346: 108.8 | N346: 21.97 | O346: 0.218 | P346: 130.54 | Q346: 转股中 | R346: 2.24年 | S346: 0.24年 | T346: 5.52 | U346: 10 | V346: 1.2e-002 | W346: 3.4000000000000002e-002 | X346: 4.4999999999999998e-002 | Y346: 161 | Z346: 3.21 | AA346: -0.158 | AB346: -0.16399999999999998 | AC346: -0.94999999999999996 | AD346: -0.95499999999999996 | AE346: 100.02 | AF346: 100.15 | AG346: 0.85 | AH346: AA | AI346: 3.8399999999999997e-002 | AJ346: =H346+100*O346 -> 180.816 | AK346: 187.5 | AL346: 322 | AM346: 87.3 | AN346: 313 | AO346: -0.107 | AP346: 9 | AQ346: 金禾转债!!
A347: 366 | B347: 113012 | C347: 骆驼转债! | D347: 601311 | E347: 骆驼股份 | F347: 汽车 | G347: 零部件制 | H347: 140.98 | I347: 1.1000000000000001e-002 | J347: 1.5700000000000002e-002 | K347: 13.71 | L347: 2.8500000000000001e-002 | M347: 106.5 | N347: 9.86 | O347: 1.3999999999999999e-002 | P347: 139.05 | Q347: 转股中 | R347: 1.63年 | S347: 回售内 | T347: 5.08 | U347: 146 | V347: 0.20199999999999999 | W347: 3.3000000000000002e-002 | X347: 4.5999999999999999e-002 | Y347: 154 | Z347: 2.03 | AA347: -0.159 | AB347: -0.16500000000000001 | AC347: 回售内 | AD347: 回售内 | AE347: 100.25 | AF347: 100.21 | AG347: 0.94 | AH347: AA | AI347: 3.8399999999999997e-002 | AJ347: =H347+100*O347 -> 142.38 | AK347: 142.9 | AL347: 175 | AM347: 42.7 | AN347: 118 | AO347: 4.9000000000000002e-002 | AP347: 18 | AQ347: 骆驼转债!
A348: 134 | B348: 110074 | C348: 精达转债!! | D348: 600577 | E348: 精达股份 | F348: 电子 | G348: 电子产品 | H348: 277.21 | I348: 0.11 | J348: -1.2199999999999999e-002 | K348: 10.16 | L348: 9.9600000000000008e-002 | M348: 117.3 | N348: 3.73 | O348: 1.8000000000000002e-002 | P348: 272.39 | Q348: 转股中 | R348: 5年12天 | S348: 3年13天 | T348: 5.67 | U348: 2424. | V348: 1.5600000000000001 | W348: 2.7999999999999997e-002 | X348: 7.6999999999999999e-002 | Y348: 201 | Z348: 4.93 | AA348: -0.159 | AB348: -0.16399999999999998 | AC348: -0.14899999999999999 | AD348: -0.14999999999999999 | AE348: 91.35 | AF348: 96.15 | AG348: 0.98 | AH348: AA | AI348: 4.1200000000000001e-002 | AJ348: =H348+100*O348 -> 279.00999999999999 | AK348: 282 | AL348: 353 | AM348: 185.9 | AN348: 352 | AO348: 0.14800000000000002 | AP348: 12 | AQ348: 精达转债!!
A349: 249 | B349: 113548 | C349: 石英转债! | D349: 603688 | E349: 石英股份 | F349: 电子 | G349: 电子产品 | H349: 258.04 | I349: 2.9999999999999999e-002 | J349: -2.9500000000000002e-002 | K349: 34.01 | L349: 5.9999999999999995e-004 | M349: 124.4 | N349: 14.93 | O349: 0.13300000000000001 | P349: 227.8 | Q349: 转股中 | R349: 4.23年 | S349: 2.23年 | T349: 1.23 | U349: 514 | V349: 1.6299999999999999 | W349: 1.e-002 | X349: 2.3e-002 | Y349: 120 | Z349: 6.08 | AA349: -0.161 | AB349: -0.16899999999999998 | AC349: -0.21299999999999999 | AD349: -0.214 | AE349: 90.72 | AF349: 97.53 | AG349: 0.96 | AH349: AA- | AI349: 6.0899999999999996e-002 | AJ349: =H349+100*O349 -> 271.34000000000003 | AK349: 288.3 | AL349: 354 | AM349: 190.8 | AN349: 354 | AO349: 0.14499999999999999 | AP349: 13 | AQ349: 石英转债!
A350: 306 | B350: 123018 | C350: 溢利转债! | D350: 300381 | E350: 溢多利 | F350: 医药 | G350: 原料药 | H350: 209.475 | I350: 1.2999999999999999e-003 | J350: -2.07e-002 | K350: 9.19 | L350: -2.8500000000000001e-002 | M350: 114.3 | N350: 8.25 | O350: 0.88 | P350: 111.39 | Q350: 转股中 | R350: 3.37年 | S350: 1.37年 | T350: 0.54 | U350: 36 | V350: 0.31900000000000001 | W350: 1.2e-002 | X350: 1.3000000000000001e-002 | Y350: 45 | Z350: 1.5 | AA350: -0.16699999999999998 | AB350: -0.17300000000000001 | AC350: -0.313 | AD350: -0.314 | AE350: 93.94 | AF350: 94.04 | AG350: 0.68 | AH350: AA- | AI350: 6.0899999999999996e-002 | AJ350: =H350+100*O350 -> 297.47500000000002 | AK350: 307.6 | AL350: 356 | AM350: 213.5 | AN350: 356 | AO350: -3.4000000000000002e-002 | AP350: 11 | AQ350: 溢利转债!
A351: 339 | B351: 113504 | C351: 艾华转债!! | D351: 603989 | E351: 艾华集团 | F351: 电子 | G351: 元器件制 | H351: 177.74 | I351: 6.8999999999999999e-003 | J351: -7.0999999999999995e-003 | K351: 36.15 | L351: -2.9999999999999997e-004 | M351: 109.3 | N351: 20.81 | O351: 2.3e-002 | P351: 173.71 | Q351: 转股中 | R351: 2.57年 | S351: 0.57年 | T351: 4.9 | U351: 100 | V351: 0.115 | W351: 3.4000000000000002e-002 | X351: 5.9000000000000004e-002 | Y351: 144 | Z351: 5.32 | AA351: -0.17499999999999999 | AB351: -0.17999999999999999 | AC351: -0.59699999999999998 | AD351: -0.59999999999999998 | AE351: 99.02 | AF351: 99.38 | AG351: 0.97 | AH351: AA | AI351: 3.8399999999999997e-002 | AJ351: =H351+100*O351 -> 180.04000000000002 | AK351: 181.8 | AL351: 313 | AM351: 82.4 | AN351: 306 | AO351: 5.0000000000000003e-002 | AP351: 9 | AQ351: 艾华转债!!
A352: 318 | B352: 123015 | C352: 蓝盾转债!! | D352: 300297 | E352: 蓝盾股份 | F352: 计算机及 | G352: 软件开发 | H352: 205.5 | I352: 2.3999999999999998e-003 | J352: -2.3999999999999998e-003 | K352: 3.43 | L352: -2.5600000000000001e-002 | M352: 112.3 | N352: 5.79 | O352: 2.4700000000000002 | P352: 59.24 | Q352: 转股中 | R352: 3年6.5天 | S352: 1年7天 | T352: 1 | U352: 937 | V352: 4.4500000000000002 | W352: 2.3e-002 | X352: 1.3999999999999999e-002 | Y352: 43 | Z352: 1.64 | AA352: -0.185 | AB352: -0.19 | AC352: -0.41600000000000004 | AD352: -0.41700000000000004 | AE352: 89.84 | AF352: 80.07 | AG352: 0 | AH352: BBB- | AI352: 0.12189999999999999 | AJ352: =H352+100*O352 -> 452.5 | AK352: 351.8 | AL352: 360 | AM352: 261.9 | AN352: 361 | AO352: -0.27800000000000002 | AP352: 16 | AQ352: 蓝盾转债!!
A353: 280 | B353: 113534 | C353: 鼎胜转债!! | D353: 603876 | E353: 鼎胜新材 | F353: 有色金属 | G353: 小金属 | H353: 241.21 | I353: 0.153 | J353: -5.5300000000000002e-002 | K353: 34.44 | L353: 0.10000000000000001 | M353: 114.3 | N353: 15.18 | O353: 6.3e-002 | P353: 226.88 | Q353: 转股中 | R353: 3.67年 | S353: 1.68年 | T353: 4.39 | U353: 2894. | V353: 2.7999999999999998 | W353: 2.6000000000000002e-002 | X353: 5.9999999999999998e-002 | Y353: 167 | Z353: 4.12 | AA353: -0.18600000000000003 | AB353: -0.192 | AC353: -0.28499999999999998 | AD353: -0.28600000000000003 | AE353: 92.28 | AF353: 92.38 | AG353: 0.98 | AH353: AA- | AI353: 6.0899999999999996e-002 | AJ353: =H353+100*O353 -> 247.51000000000002 | AK353: 255.5 | AL353: 348 | AM353: 163.2 | AN353: 348 | AO353: 0.13400000000000001 | AP353: 33 | AQ353: 鼎胜转债!!
A354: 206 | B354: 123046 | C354: 天铁转债! | D354: 300587 | E354: 天铁股份 | F354: 铁路 | G354: 铁路设备 | H354: 304.85 | I354: 1.1000000000000001e-003 | J354: -2.2400000000000003e-002 | K354: 16.21 | L354: -2.1700000000000001e-002 | M354: 117.7 | N354: 5.9 | O354: 0.11 | P354: 274.75 | Q354: 转股中 | R354: 4.62年 | S354: 2.62年 | T354: 0.62 | U354: 158 | V354: 0.82999999999999996 | W354: 6.9999999999999993e-003 | X354: 1.8000000000000002e-002 | Y354: 94 | Z354: 3.41 | AA354: -0.18899999999999997 | AB354: -0.19399999999999998 | AC354: -0.193 | AD354: -0.193 | AE354: 88.04 | AF354: 90.14 | AG354: 0.98 | AH354: AA- | AI354: 6.0899999999999996e-002 | AJ354: =H354+100*O354 -> 315.85000000000002 | AK354: 335 | AL354: 358 | AM354: 244.8 | AN354: 359 | AO354: 7.0999999999999994e-002 | AP354: 14 | AQ354: 天铁转债!
A355: 305 | B355: 113526 | C355: 联泰转债! | D355: 603797 | E355: 联泰环保 | F355: 城市公用 | G355: 三废处理 | H355: 230.94 | I355: -3.8699999999999998e-002 | J355: 2.4900000000000002e-002 | K355: 6.6 | L355: -2.2200000000000001e-002 | M355: 110.3 | N355: 6.11 | O355: 1.1399999999999999 | P355: 108.02 | Q355: 转股中 | R355: 3.47年 | S355: 1.47年 | T355: 1.93 | U355: 122 | V355: 0.26899999999999996 | W355: 5.0000000000000003e-002 | X355: 5.4000000000000006e-002 | Y355: 39 | Z355: 1.74 | AA355: -0.19500000000000001 | AB355: -0.19899999999999998 | AC355: -0.318 | AD355: -0.31900000000000001 | AE355: 97.25 | AF355: 98.17 | AG355: 0.62 | AH355: AA+ | AI355: 3.49e-002 | AJ355: =H355+100*O355 -> 344.94 | AK355: 353.9 | AL355: 361 | AM355: 255.7 | AN355: 360 | AO355: -4.5999999999999999e-002 | AP355: 9 | AQ355: 联泰转债!
A356: 228 | B356: 128093 | C356: 百川转债!! | D356: 2455 | E356: 百川股份 | F356: 化工 | G356: 化工 | H356: 333.001 | I356: -3.7599999999999995e-002 | J356: 1.7299999999999999e-002 | K356: 18.72 | L356: -2.0899999999999998e-002 | M356: 129.8 | N356: 5.77 | O356: 2.6000000000000002e-002 | P356: 324.44 | Q356: 转股中 | R356: 4.41年 | S356: 2.41年 | T356: 1.62 | U356: 2212. | V356: 4.1200000000000001 | W356: 1.4999999999999999e-002 | X356: 5.0000000000000003e-002 | Y356: 106 | Z356: 7.13 | AA356: -0.19699999999999998 | AB356: -0.20499999999999999 | AC356: -0.221 | AD356: -0.222 | AE356: 92.05 | AF356: 101 | AG356: 0.97 | AH356: AA- | AI356: 6.0899999999999996e-002 | AJ356: =H356+100*O356 -> 335.601 | AK356: 341.6 | AL356: 359 | AM356: 240.6 | AN356: 358 | AO356: 0.48299999999999998 | AP356: 46 | AQ356: 百川转债!!
A357: 205 | B357: 123047 | C357: 久吾转债! | D357: 300631 | E357: 久吾高科 | F357: 机械装备 | G357: 专用设备 | H357: 351 | I357: 4.0000000000000001e-003 | J357: -7.3000000000000001e-003 | K357: 58.61 | L357: -3.4000000000000002e-003 | M357: 129.6 | N357: 17.43 | O357: 4.4000000000000004e-002 | P357: 336.26 | Q357: 转股中 | R357: 4.62年 | S357: 2.62年 | T357: 1.58 | U357: 5955. | V357: 10.33 | W357: 2.5000000000000001e-002 | X357: 8.4000000000000005e-002 | Y357: 64 | Z357: 7.7 | AA357: -0.19800000000000001 | AB357: -0.20499999999999999 | AC357: -0.20399999999999999 | AD357: -0.20499999999999999 | AE357: 87.24 | AF357: 94.94 | AG357: 0.97 | AH357: A+ | AI357: 7.1900000000000006e-002 | AJ357: =H357+100*O357 -> 355.39999999999998 | AK357: 365.7 | AL357: 362 | AM357: 270.8 | AN357: 362 | AO357: 0.28199999999999997 | AP357: 22 | AQ357: 久吾转债!
A358: 370 | B358: 113009 | C358: 广汽转债! | D358: 601238 | E358: 广汽集团 | F358: 汽车 | G358: 乘用车 | H358: 117.48 | I358: -1.9e-003 | J358: 7.7000000000000002e-003 | K358: 14.5 | L358: 1.3300000000000001e-002 | M358: 106 | N358: 13.97 | O358: 0.13200000000000001 | P358: 103.79 | Q358: 转股中 | R358: 0.46年 | S358: 回售内 | T358: 25.5 | U358: 56 | V358: 1.9e-002 | W358: 1.7000000000000001e-002 | X358: 1.8000000000000002e-002 | Y358: 1502. | Z358: 1.73 | AA358: -0.19899999999999998 | AB358: -0.21899999999999997 | AC358: 回售内 | AD358: 回售内 | AE358: 100.27 | AF358: 104.76 | AG358: 0.44 | AH358: AAA | AI358: 2.5699999999999997e-002 | AJ358: =H358+100*O358 -> 130.68000000000001 | AK358: 131.2 | AL358: 49 | AM358: 26.4 | AN358: 17 | AO358: 4.0000000000000001e-003 | AP358: 16 | AQ358: 广汽转债!
A359: 174 | B359: 128111 | C359: 中矿转债! | D359: 2738 | E359: 中矿资源 | F359: 有色金属 | G359: 有色行业 | H359: 393 | I359: 1.8e-003 | J359: 1.78e-002 | K359: 55.8 | L359: 1.9900000000000001e-002 | M359: 124.2 | N359: 15.42 | O359: 8.5999999999999993e-002 | P359: 361.87 | Q359: 转股中 | R359: 4.85年 | S359: 2.85年 | T359: 1.52 | U359: 573 | V359: 0.94999999999999996 | W359: 8.0000000000000002e-003 | X359: 3.1e-002 | Y359: 180 | Z359: 5.26 | AA359: -0.215 | AB359: -0.221 | AC359: -0.193 | AD359: -0.193 | AE359: 87.29 | AF359: 93.86 | AG359: 0.98 | AH359: AA- | AI359: 6.0899999999999996e-002 | AJ359: =H359+100*O359 -> 401.60000000000002 | AK359: 424.1 | AL359: 368 | AM359: 330.3 | AN359: 368 | AO359: -7.5999999999999998e-002 | AP359: 9 | AQ359: 中矿转债!
A360: 184 | B360: 113582 | C360: 火炬转债! | D360: 603678 | E360: 火炬电子 | F360: 电子 | G360: 元器件制 | H360: 371.56 | I360: 1.7100000000000001e-002 | J360: -9.7999999999999997e-003 | K360: 84.23 | L360: 7.4000000000000003e-003 | M360: 114.9 | N360: 24.99 | O360: 0.10199999999999999 | P360: 337.05 | Q360: 转股中 | R360: 4.80年 | S360: 2.81年 | T360: 4.18 | U360: 383 | V360: 0.248 | W360: 1.1000000000000001e-002 | X360: 3.6000000000000004e-002 | Y360: 387 | Z360: 9.53 | AA360: -0.21899999999999997 | AB360: -0.223 | AC360: -0.193 | AD360: -0.193 | AE360: 92.14 | AF360: 95.55 | AG360: 0.99 | AH360: AA | AI360: 3.9900000000000005e-002 | AJ360: =H360+100*O360 -> 381.75999999999999 | AK360: 406.1 | AL360: 367 | AM360: 310.5 | AN360: 367 | AO360: 6.2e-002 | AP360: 6 | AQ360: 火炬转债!
A361: 364 | B361: 127004 | C361: 模塑转债!! | D361: 700 | E361: 模塑科技 | F361: 汽车 | G361: 零部件制 | H361: 177.27 | I361: 1.49e-002 | J361: -1.1399999999999999e-002 | K361: 6.15 | L361: 1.32e-002 | M361: 111.8 | N361: 7.24 | O361: 1.0900000000000001 | P361: 84.94 | Q361: 转股中 | R361: 1.82年 | S361: 回售内 | T361: 1.32 | U361: 508 | V361: 2.1600000000000001 | W361: 2.3e-002 | X361: 2.e-002 | Y361: 56 | Z361: 2.02 | AA361: -0.22500000000000001 | AB361: -0.23399999999999999 | AC361: 回售内 | AD361: 回售内 | AE361: 100.3 | AF361: 100.3 | AG361: 0.27 | AH361: AA- | AI361: 5.9400000000000001e-002 | AJ361: =H361+100*O361 -> 286.27000000000004 | AK361: 269.6 | AL361: 351 | AM361: 169.3 | AN361: 349 | AO361: 8.9999999999999997e-002 | AP361: 29 | AQ361: 模塑转债!!
A362: 347 | B362: 128030 | C362: 天康转债!! | D362: 2100 | E362: 天康生物 | F362: 农业 | G362: 畜牧业 | H362: 204.2 | I362: 5.8999999999999999e-003 | J362: -5.8999999999999999e-003 | K362: 7.49 | L362: 1.0800000000000001e-002 | M362: 111.3 | N362: 7.39 | O362: 1.01 | P362: 101.35 | Q362: 转股中 | R362: 2.38年 | S362: 0.38年 | T362: 0.89 | U362: 42 | V362: 0.23000000000000001 | W362: 1.1000000000000001e-002 | X362: 1.1000000000000001e-002 | Y362: 81 | Z362: 1.23 | AA362: -0.22800000000000001 | AB362: -0.23399999999999999 | AC362: -0.96599999999999997 | AD362: -0.96900000000000008 | AE362: 99.74 | AF362: 101.93 | AG362: 0 | AH362: AA | AI362: 3.8399999999999997e-002 | AJ362: =H362+100*O362 -> 305.19999999999999 | AK362: 307 | AL362: 355 | AM362: 205.1 | AN362: 355 | AO362: -4.5999999999999999e-002 | AP362: 11 | AQ362: 天康转债!!
A363: 329 | B363: 110044 | C363: 广电转债!! | D363: 600831 | E363: 广电网络 | F363: 传媒娱乐 | G363: 影视娱乐 | H363: 236.79 | I363: -8.199999999999999e-003 | J363: 5.6000000000000008e-003 | K363: 5.24 | L363: -1.32e-002 | M363: 111.3 | N363: 6.87 | O363: 2.1000000000000001 | P363: 76.27 | Q363: 转股中 | R363: 2.89年 | S363: 0.89年 | T363: 0.71 | U363: 78 | V363: 0.46100000000000002 | W363: 1.9e-002 | X363: 1.4999999999999999e-002 | Y363: 37 | Z363: 0.99 | AA363: -0.23199999999999998 | AB363: -0.23699999999999999 | AC363: -0.53700000000000003 | AD363: -0.53799999999999992 | AE363: 97.83 | AF363: 99.98 | AG363: 0.2 | AH363: AA | AI363: 3.8399999999999997e-002 | AJ363: =H363+100*O363 -> 446.78999999999996 | AK363: 397.3 | AL363: 366 | AM363: 297.3 | AN363: 366 | AO363: -4.4999999999999998e-002 | AP363: 10 | AQ363: 广电转债!!
A364: 343 | B364: 123007 | C364: 道氏转债!!* | D364: 300409 | E364: 道氏技术 | F364: 建筑 | G364: 建筑行业 | H364: 206.001 | I364: 2.0299999999999999e-002 | J364: -1.e-004 | K364: 29.79 | L364: 2.0199999999999999e-002 | M364: 110.3 | N364: 14.5 | O364: 3.0000000000000001e-003 | P364: 205.45 | Q364: 转股中 | R364: 2.40年 | S364: 0.40年 | T364: 0.69 | U364: 1278. | V364: 8.8599999999999994 | W364: 4.0000000000000001e-003 | X364: 8.0000000000000002e-003 | Y364: 170 | Z364: 4.5 | AA364: -0.23300000000000001 | AB364: -0.23800000000000002 | AC364: -0.94400000000000006 | AD364: -0.94700000000000006 | AE364: 98.57 | AF364: 96.32 | AG364: 1 | AH364: AA- | AI364: 5.9400000000000001e-002 | AJ364: =H364+100*O364 -> 206.30100000000002 | AK364: 206.6 | AL364: 335 | AM364: 108 | AN364: 334 | AO364: 5.2999999999999999e-002 | AP364: 21 | AQ364: 道氏转债!!*
A365: 279 | B365: 113025 | C365: 明泰转债!! | D365: 601677 | E365: 明泰铝业 | F365: 有色金属 | G365: 铝金属 | H365: 306.06 | I365: -5.4000000000000003e-003 | J365: 5.4000000000000003e-003 | K365: 32.62 | L365: 0. | M365: 114.5 | N365: 11 | O365: 3.2000000000000001e-002 | P365: 296.55 | Q365: 转股中 | R365: 3.68年 | S365: 1.68年 | T365: 11 | U365: 311 | V365: 9.1999999999999998e-002 | W365: 4.9000000000000002e-002 | X365: 0.14599999999999999 | Y365: 223 | Z365: 2.47 | AA365: -0.23800000000000002 | AB365: -0.24199999999999999 | AC365: -0.32899999999999996 | AD365: -0.33000000000000002 | AE365: 95.73 | AF365: 99.44 | AG365: 0.98 | AH365: AA | AI365: 3.9900000000000005e-002 | AJ365: =H365+100*O365 -> 309.25999999999999 | AK365: 315.6 | AL365: 357 | AM365: 216.1 | AN365: 357 | AO365: 0.22500000000000001 | AP365: 23 | AQ365: 明泰转债!!
A366: 271 | B366: 123027 | C366: 蓝晓转债! | D366: 300487 | E366: 蓝晓科技 | F366: 化工 | G366: 化工 | H366: 338.999 | I366: 3.4999999999999996e-003 | J366: -1.2800000000000001e-002 | K366: 88.09 | L366: -9.3999999999999986e-003 | M366: 118.8 | N366: 29.02 | O366: 0.11699999999999999 | P366: 303.55 | Q366: 转股中 | R366: 3.85年 | S366: 1.85年 | T366: 1.07 | U366: 653 | V366: 1.78 | W366: 6.0000000000000001e-003 | X366: 1.7000000000000001e-002 | Y366: 194 | Z366: 10.49 | AA366: -0.24199999999999999 | AB366: -0.248 | AC366: -0.309 | AD366: -0.31 | AE366: 90.3 | AF366: 91.55 | AG366: 0.98 | AH366: A+ | AI366: 7.1900000000000006e-002 | AJ366: =H366+100*O366 -> 350.69900000000001 | AK366: 374.4 | AL366: 363 | AM366: 282.9 | AN366: 363 | AO366: -6.9999999999999993e-003 | AP366: 19 | AQ366: 蓝晓转债!
A367: 332 | B367: 113509 | C367: 新泉转债!! | D367: 603179 | E367: 新泉股份 | F367: 汽车 | G367: 零部件制 | H367: 241.13 | I367: 2.6699999999999998e-002 | J367: 7.6e-003 | K367: 37.12 | L367: 3.4300000000000004e-002 | M367: 109.3 | N367: 15.25 | O367: -9.0000000000000011e-003 | P367: 243.41 | Q367: 转股中 | R367: 2.83年 | S367: 0.83年 | T367: 0.77 | U367: 483 | V367: 2.5800000000000001 | W367: 6.0000000000000001e-003 | X367: 1.3999999999999999e-002 | Y367: 137 | Z367: 3.87 | AA367: -0.247 | AB367: -0.251 | AC367: -0.58200000000000007 | AD367: -0.58399999999999996 | AE367: 98.07 | AF367: 98.42 | AG367: 1 | AH367: AA | AI367: 3.8399999999999997e-002 | AJ367: =H367+100*O367 -> 240.22999999999999 | AK367: 238.9 | AL367: 345 | AM367: 140.4 | AN367: 345 | AO367: 5.7000000000000002e-002 | AP367: 14 | AQ367: 新泉转债!!
A368: 348 | B368: 128029 | C368: 太阳转债!! | D368: 2078 | E368: 太阳纸业 | F368: 造纸包装 | G368: 造纸行业 | H368: 163.5 | I368: 1.4499999999999999e-002 | J368: -1.61e-002 | K368: 11.96 | L368: -1.7000000000000001e-003 | M368: 107 | N368: 8.45 | O368: 0.155 | P368: 141.54 | Q368: 转股中 | R368: 1.38年 | S368: 回售内 | T368: 9.09 | U368: 12 | V368: 8.0000000000000002e-003 | W368: 2.7999999999999997e-002 | X368: 4.0000000000000001e-002 | Y368: 321 | Z368: 1.84 | AA368: -0.26600000000000001 | AB368: -0.27300000000000002 | AC368: 回售内 | AD368: 回售内 | AE368: 100.17 | AF368: 102.3 | AG368: 1 | AH368: AA+ | AI368: 3.3399999999999999e-002 | AJ368: =H368+100*O368 -> 179. | AK368: 185.5 | AL368: 320 | AM368: 83.2 | AN368: 307 | AO368: -1.1000000000000001e-002 | AP368: 7 | AQ368: 太阳转债!!
A369: 222 | B369: 128095 | C369: 恩捷转债!! | D369: 2812 | E369: 恩捷股份 | F369: 电子 | G369: 元器件制 | H369: 499.996 | I369: 4.6699999999999998e-002 | J369: -4.9599999999999998e-002 | K369: 290.02 | L369: -3.0000000000000001e-003 | M369: 114.9 | N369: 64.92 | O369: 0.11900000000000001 | P369: 446.73 | Q369: 转股中 | R369: 4.52年 | S369: 2.52年 | T369: 4.54 | U369: 1028. | V369: 0.45500000000000002 | W369: 2.e-003 | X369: 8.0000000000000002e-003 | Y369: 2586. | Z369: 22.34 | AA369: -0.28100000000000003 | AB369: -0.28499999999999998 | AC369: -0.245 | AD369: -0.245 | AE369: 93.19 | AF369: 96.64 | AG369: 0.99 | AH369: AA | AI369: 3.9900000000000005e-002 | AJ369: =H369+100*O369 -> 511.89599999999996 | AK369: 553.3 | AL369: 370 | AM369: 456.6 | AN369: 370 | AO369: 0.11599999999999999 | AP369: 14 | AQ369: 恩捷转债!!
A370: 325 | B370: 128041 | C370: 盛路转债!! | D370: 2446 | E370: 盛路通信 | F370: 通信互联 | G370: 通信设备 | H370: 310.1 | I370: -2.69e-002 | J370: 2.69e-002 | K370: 6.86 | L370: 7.3000000000000001e-003 | M370: 113.3 | N370: 6.82 | O370: 2.0800000000000001 | P370: 100.59 | Q370: 转股中 | R370: 2.94年 | S370: 0.95年 | T370: 0.53 | U370: 150 | V370: 0.90099999999999991 | W370: 9.0000000000000011e-003 | X370: 9.0000000000000011e-003 | Y370: 62 | Z370: 2.03 | AA370: -0.29199999999999998 | AB370: -0.29799999999999999 | AC370: -0.59799999999999998 | AD370: -0.59899999999999998 | AE370: 97.63 | AF370: 101.57 | AG370: 0 | AH370: AA | AI370: 3.8399999999999997e-002 | AJ370: =H370+100*O370 -> 518.10000000000002 | AK370: 519.6 | AL370: 369 | AM370: 418 | AN370: 369 | AO370: 4.8000000000000001e-002 | AP370: 12 | AQ370: 盛路转债!!
A371: 322 | B371: 123013 | C371: 横河转债! | D371: 300539 | E371: 横河精密 | F371: 机械装备 | G371: 专用设备 | H371: 364.12 | I371: -1.7000000000000001e-002 | J371: 1.8799999999999997e-002 | K371: 8.49 | L371: 3.4999999999999996e-003 | M371: 114 | N371: 9.04 | O371: 2.8799999999999999 | P371: 93.92 | Q371: 转股中 | R371: 2.97年 | S371: 0.97年 | T371: 0.38 | U371: 89 | V371: 0.63400000000000001 | W371: 2.e-002 | X371: 1.9e-002 | Y371: 19 | Z371: 3.8 | AA371: -0.32700000000000001 | AB371: -0.33200000000000002 | AC371: -0.625 | AD371: -0.626 | AE371: 94.58 | AF371: 93.49 | AG371: 0.51 | AH371: A+ | AI371: 7.0400000000000004e-002 | AJ371: =H371+100*O371 -> 652.12 | AK371: 634.3 | AL371: 371 | AM371: 539.7 | AN371: 371 | AO371: 3.3000000000000002e-002 | AP371: 14 | AQ371: 横河转债!
A372: 260 | B372: 123031 | C372: 晶瑞转债! | D372: 300655 | E372: 晶瑞电材 | F372: 化工 | G372: 化工 | H372: 595 | I372: -3.4999999999999996e-003 | J372: -3.4599999999999999e-002 | K372: 55.58 | L372: -3.8399999999999997e-002 | M372: 115.8 | N372: 10.13 | O372: 8.4000000000000005e-002 | P372: 548.67 | Q372: 转股中 | R372: 4年22天 | S372: 2年23天 | T372: 0.53 | U372: 1771. | V372: 5.4900000000000002 | W372: 3.0000000000000001e-003 | X372: 1.4999999999999999e-002 | Y372: 189 | Z372: 7.89 | AA372: -0.33500000000000002 | AB372: -0.33899999999999997 | AC372: -0.32500000000000001 | AD372: -0.32500000000000001 | AE372: 88.64 | AF372: 87.9 | AG372: 0.99 | AH372: A+ | AI372: 7.1900000000000006e-002 | AJ372: =H372+100*O372 -> 603.39999999999998 | AK372: 641.3 | AL372: 372 | AM372: 552.7 | AN372: 372 | AO372: 0.20600000000000002 | AP372: 16 | AQ372: 晶瑞转债!
A373: 359 | B373: 113016 | C373: 小康转债!! | D373: 601127 | E373: 小康股份 | F373: 汽车 | G373: 零部件制 | H373: 368.46 | I373: -2.81e-002 | J373: -1.2999999999999999e-003 | K373: 59.19 | L373: -2.9700000000000001e-002 | M373: 109.3 | N373: 16.96 | O373: 5.5999999999999994e-002 | P373: 349 | Q373: 转股中 | R373: 2.25年 | S373: 0.25年 | T373: 2.39 | U373: 914 | V373: 1.02 | W373: 3.0000000000000001e-003 | X373: 1.e-002 | Y373: 804 | Z373: 16.31 | AA373: -0.40299999999999997 | AB373: -0.40600000000000003 | AC373: -1.8330000000000002 | AD373: -1.8340000000000001 | AE373: 99.38 | AF373: 96.24 | AG373: 0.99 | AH373: AA- | AI373: 5.9400000000000001e-002 | AJ373: =H373+100*O373 -> 374.06 | AK373: 387.9 | AL373: 365 | AM373: 288.5 | AN373: 365 | AO373: -6.4000000000000001e-002 | AP373: 39 | AQ373: 小康转债!!