A1: 序号 | B1: 转债代码 | C1: 转债名称 | D1: 股票代码 | E1: 股票名称 | F1: 行业 | G1: 子行业 | H1: 转债价格 | I1: 涨跌 | J1: 日内套利 | K1: 股价 | L1: 涨跌 | M1: 剩余本息 | N1: 转股价格 | O1: 转股溢价率 | P1: 转股价值 | Q1: 距离转股日 | R1: 剩余年限 | S1: 回售年限 | T1: 转债余额 | U1: 转债成交额 | V1: 转债换手率 | W1: 余额/市值 | X1: 余额/股本 | Y1: 股票市值 | Z1: P/B | AA1: 税前收益率 | AB1: 税后收益率 | AC1: 税前回售收益 | AD1: 税后回售收益 | AE1: 回售价值 | AF1: 纯债价值 | AG1: 弹性 | AH1: 信用 | AI1: 折现率 | AJ1: 双低 | AK1: 老式双低 | AL1: 老式排名 | AM1: 新式双低 | AN1: 新式排名 | AO1: MA20乖离 | AP1: 热门度 | AQ1: 转债名称
A2: 281 | B2: 128062 | C2: 亚药转债! | D2: 2370 | E2: 亚太药业 | F2: 医药 | G2: 化学制药 | H2: 79.97 | I2: 1.2999999999999999e-003 | J2: -1.2999999999999999e-003 | K2: 4.92 | L2: 0. | M2: 119.3 | N2: 16.25 | O2: 1.6399999999999999 | P2: 30.28 | Q2: 转股中 | R2: 3.71年 | S2: 1.71年 | T2: 9.63 | U2: 9.5 | V2: 1.2e-002 | W2: 0.36499999999999999 | X2: 0.11 | Y2: 26 | Z2: 6.1 | AA2: 0.11599999999999999 | AB2: 0.106 | AC2: 0.14400000000000002 | AD2: 0.14099999999999999 | AE2: 80.1 | AF2: 73.33 | AG2: 0 | AH2: BB | AI2: 0.14319999999999999 | AJ2: =H2+100*O2 -> 243.97 | AK2: 129.7 | AL2: 86 | AM2: 49.6 | AN2: 207 | AO2: 9.0000000000000011e-003 | AP2: 84 | AQ2: 亚药转债!
A3: 205 | B3: 128100 | C3: 搜特转债! | D3: 2503 | E3: 搜于特 | F3: 服装纺织 | G3: 服装行业 | H3: 76.388 | I3: 4.7999999999999996e-003 | J3: -4.7999999999999996e-003 | K3: 1.45 | L3: 0. | M3: 116.9 | N3: 2.9 | O3: 0.52800000000000002 | P3: 50 | Q3: 转股中 | R3: 4.65年 | S3: 2.66年 | T3: 7.99 | U3: 12 | V3: 2.e-002 | W3: 0.17800000000000002 | X3: 8.900000000000001e-002 | Y3: 45 | Z3: 1.34 | AA3: 9.7899999999999987e-002 | AB3: 9.0500000000000011e-002 | AC3: 0.114 | AD3: 0.11199999999999999 | AE3: 82.7 | AF3: 81.21 | AG3: 0.1 | AH3: A | AI3: 8.3199999999999996e-002 | AJ3: =H3+100*O3 -> 129.18800000000002 | AK3: 102.8 | AL3: 1 | AM3: 20.1 | AN3: 6 | AO3: -6.6000000000000003e-002 | AP3: 66 | AQ3: 搜特转债!
A4: 148 | B4: 113595 | C4: 花王转债! | D4: 603007 | E4: ST花王 | F4: 城市公用 | G4: 生态环境 | H4: 86.22 | I4: 3.0000000000000001e-003 | J4: -1.7000000000000001e-003 | K4: 3.51 | L4: 8.6e-003 | M4: 125.3 | N4: 6.92 | O4: 0.69999999999999996 | P4: 50.72 | Q4: 转股中 | R4: 5年4.1天 | S4: 3年5.1天 | T4: 3.3 | U4: 4 | V4: 1.3999999999999999e-002 | W4: 0.28000000000000003 | X4: 0.14199999999999999 | Y4: 12 | Z4: 1.03 | AA4: 7.9500000000000001e-002 | AB4: 7.0099999999999996e-002 | AC4: 6.2400000000000004e-002 | AD4: 5.9400000000000001e-002 | AE4: 80.83 | AF4: 84.3 | AG4: 0.15 | AH4: A | AI4: 8.4499999999999992e-002 | AJ4: =H4+100*O4 -> 156.22 | AK4: 121.7 | AL4: 24 | AM4: 37.4 | AN4: 109 | AO4: 2.2000000000000002e-002 | AP4: 43 | AQ4: 花王转债!
A5: 192 | B5: 113576 | C5: 起步转债!! | D5: 603557 | E5: ST起步 | F5: 服装纺织 | G5: 鞋服行业 | H5: 91.81 | I5: 1.e-003 | J5: -5.4000000000000003e-003 | K5: 5.13 | L5: -3.7499999999999999e-002 | M5: 121.3 | N5: 10.55 | O5: 0.88800000000000001 | P5: 48.63 | Q5: 转股中 | R5: 4.73年 | S5: 2.73年 | T5: 2.66 | U5: 5.2 | V5: 2.1000000000000001e-002 | W5: 0.105 | X5: 5.0999999999999997e-002 | Y5: 25 | Z5: 1.62 | AA5: 6.2199999999999998e-002 | AB5: 5.3699999999999998e-002 | AC5: 4.5199999999999997e-002 | AD5: 4.2099999999999999e-002 | AE5: 82.87 | AF5: 83.87 | AG5: 0.12 | AH5: A | AI5: 8.3199999999999996e-002 | AJ5: =H5+100*O5 -> 180.61000000000001 | AK5: 135 | AL5: 143 | AM5: 51.1 | AN5: 219 | AO5: -6.4000000000000001e-002 | AP5: 34 | AQ5: 起步转债!!
A6: 91 | B6: 128138 | C6: 侨银转债! | D6: 2973 | E6: 侨银股份 | F6: 城市公用 | G6: 城市公用 | H6: 104.3 | I6: 3.3e-003 | J6: -3.0000000000000001e-003 | K6: 15.83 | L6: 1.9e-003 | M6: 136.5 | N6: 25.33 | O6: 0.66900000000000004 | P6: 62.5 | Q6: 转股中 | R6: 5.34年 | S6: 3.34年 | T6: 4.2 | U6: 2.6 | V6: 6.0000000000000001e-003 | W6: 6.5000000000000002e-002 | X6: 4.0999999999999995e-002 | Y6: 65 | Z6: 4.3 | AA6: 5.28e-002 | AB6: 4.1599999999999998e-002 | AC6: 2.9999999999999997e-004 | AD6: -2.0999999999999999e-003 | AE6: 84.35 | AF6: 98.93 | AG6: 0.18 | AH6: AA- | AI6: 6.3500000000000001e-002 | AJ6: =H6+100*O6 -> 171.19999999999999 | AK6: 146.1 | AL6: 238 | AM6: 47.2 | AN6: 196 | AO6: -1.6e-002 | AP6: 13 | AQ6: 侨银转债!
A7: 313 | B7: 128044 | C7: 岭南转债! | D7: 2717 | E7: 岭南股份 | F7: 城市公用 | G7: 生态环境 | H7: 96.15 | I7: -5.0000000000000001e-004 | J7: 5.0000000000000001e-004 | K7: 2.95 | L7: -3.4000000000000002e-003 | M7: 111.3 | N7: 5.91 | O7: 0.92599999999999993 | P7: 49.92 | Q7: 转股中 | R7: 3年28天 | S7: 1年29天 | T7: 6.59 | U7: 12 | V7: 1.9e-002 | W7: 0.14599999999999999 | X7: 7.2999999999999995e-002 | Y7: 45 | Z7: 1.04 | AA7: 4.99e-002 | AB7: 4.2500000000000003e-002 | AC7: 5.5800000000000002e-002 | AD7: 5.0999999999999997e-002 | AE7: 95.44 | AF7: 92.84 | AG7: 0.01 | AH7: AA- | AI7: 6.2199999999999998e-002 | AJ7: =H7+100*O7 -> 188.75 | AK7: 142.4 | AL7: 215 | AM7: 46.9 | AN7: 194 | AO7: -2.1000000000000001e-002 | AP7: 48 | AQ7: 岭南转债!
A8: 279 | B8: 128063 | C8: 未来转债! | D8: 2631 | E8: 德尔未来 | F8: 其他 | G8: 家居用品 | H8: 107.669 | I8: 3.4000000000000002e-003 | J8: -2.0999999999999999e-003 | K8: 6.34 | L8: 6.3e-003 | M8: 127.5 | N8: 8.6 | O8: 0.46000000000000002 | P8: 73.72 | Q8: 转股中 | R8: 3.71年 | S8: 2.72年 | T8: 6.3 | U8: 2.2 | V8: 3.0000000000000001e-003 | W8: 0.14899999999999999 | X8: 0.11 | Y8: 42 | Z8: 2.5 | AA8: 4.8000000000000001e-002 | AB8: 3.5099999999999999e-002 | AC8: 1.7000000000000001e-003 | AD8: -3.7000000000000002e-003 | AE8: 91.26 | AF8: 102.56 | AG8: 0.22 | AH8: AA- | AI8: 6.2199999999999998e-002 | AJ8: =H8+100*O8 -> 153.66899999999998 | AK8: 141.6 | AL8: 212 | AM8: 39.1 | AN8: 128 | AO8: 1.3999999999999999e-002 | AP8: 31 | AQ8: 未来转债!
A9: 366 | B9: 127003 | C9: 海印转债! | D9: 861 | E9: 海印股份 | F9: 商业零售 | G9: 商场 | H9: 105.619 | I9: 1.6000000000000001e-003 | J9: -1.5e-003 | K9: 2.05 | L9: 9.8999999999999991e-003 | M9: 110 | N9: 3 | O9: 0.54600000000000004 | P9: 68.33 | Q9: 转股中 | R9: 0.90年 | S9: 回售内 | T9: 6.74 | U9: 5.6 | V9: 8.0000000000000002e-003 | W9: 0.14099999999999999 | X9: 9.6999999999999989e-002 | Y9: 48 | Z9: 1.25 | AA9: 4.6399999999999997e-002 | AB9: 2.52e-002 | AC9: 回售内 | AD9: 回售内 | AE9: 100.33 | AF9: 106.58 | AG9: 0.01 | AH9: AA | AI9: 3.5900000000000001e-002 | AJ9: =H9+100*O9 -> 160.21899999999999 | AK9: 142.9 | AL9: 218 | AM9: 36.3 | AN9: 86 | AO9: -9.0000000000000011e-003 | AP9: 69 | AQ9: 海印转债!
A10: 155 | B10: 127019 | C10: 国城转债! | D10: 688 | E10: 国城矿业 | F10: 有色金属 | G10: 锌铅镍锡 | H10: 92.001 | I10: 8.5000000000000006e-003 | J10: -8.0000000000000002e-003 | K10: 9.25 | L10: 1.6500000000000001e-002 | M10: 114.8 | N10: 21.06 | O10: 1.0900000000000001 | P10: 43.92 | Q10: 转股中 | R10: 4.99年 | S10: 2.998年 | T10: 8.5 | U10: 9.3 | V10: 1.2e-002 | W10: 8.1000000000000003e-002 | X10: 3.5000000000000003e-002 | Y10: 105 | Z10: 4.54 | AA10: 4.6199999999999998e-002 | AB10: 4.0500000000000001e-002 | AC10: 3.7599999999999995e-002 | AD10: 3.5400000000000001e-002 | AE10: 91 | AF10: 94.17 | AG10: 0.03 | AH10: AA | AI10: 4.1200000000000001e-002 | AJ10: =H10+100*O10 -> 201.00100000000003 | AK10: 140.1 | AL10: 199 | AM10: 45.9 | AN10: 183 | AO10: 4.0999999999999995e-002 | AP10: 42 | AQ10: 国城转债!
A11: 265 | B11: 123028 | C11: 清水转债! | D11: 300437 | E11: 清水源 | F11: 城市公用 | G11: 三废处理 | H11: 101.848 | I11: 8.9999999999999998e-004 | J11: -8.8000000000000005e-003 | K11: 8.69 | L11: -2.3599999999999999e-002 | M11: 121 | N11: 11.84 | O11: 0.38799999999999996 | P11: 73.4 | Q11: 转股中 | R11: 3.92年 | S11: 1.93年 | T11: 4.55 | U11: 3.6 | V11: 8.0000000000000002e-003 | W11: 0.23699999999999999 | X11: 0.17399999999999999 | Y11: 19 | Z11: 1.73 | AA11: 4.5999999999999999e-002 | AB11: 3.6200000000000003e-002 | AC11: 9.7000000000000003e-003 | AD11: 6.0999999999999995e-003 | AE11: 89.77 | AF11: 92.33 | AG11: 0.33 | AH11: A+ | AI11: 7.3200000000000001e-002 | AJ11: =H11+100*O11 -> 140.648 | AK11: 130.3 | AL11: 93 | AM11: 38 | AN11: 113 | AO11: -3.1e-002 | AP11: 52 | AQ11: 清水转债!
A12: 311 | B12: 113519 | C12: 长久转债! | D12: 603569 | E12: 长久物流 | F12: 交通运输 | G12: 物流业 | H12: 103.5 | I12: -2.7000000000000001e-003 | J12: 2.5000000000000001e-003 | K12: 6.63 | L12: -3.0000000000000001e-003 | M12: 119.3 | N12: 11.04 | O12: 0.72299999999999998 | P12: 60.05 | Q12: 转股中 | R12: 3.31年 | S12: 1.31年 | T12: 6.97 | U12: 0.9 | V12: 1.e-003 | W12: 0.188 | X12: 0.113 | Y12: 37 | Z12: 1.69 | AA12: 4.4800000000000006e-002 | AB12: 3.4099999999999998e-002 | AC12: -4.5999999999999999e-003 | AD12: -8.3000000000000001e-003 | AE12: 96.9 | AF12: 104.65 | AG12: 0.05 | AH12: AA | AI12: 4.1200000000000001e-002 | AJ12: =H12+100*O12 -> 175.80000000000001 | AK12: 146.9 | AL12: 248 | AM12: 42.3 | AN12: 156 | AO12: -9.3000000000000013e-002 | AP12: 21 | AQ12: 长久转债!
A13: 129 | B13: 128127 | C13: 文科转债! | D13: 2775 | E13: 文科园林 | F13: 城市公用 | G13: 生态环境 | H13: 97.933 | I13: 1.e-004 | J13: -1.2999999999999999e-003 | K13: 4.25 | L13: -2.3e-003 | M13: 121.3 | N13: 4.88 | O13: 0.125 | P13: 87.09 | Q13: 转股中 | R13: 5年34天 | S13: 3年35天 | T13: 9.5 | U13: 9.4 | V13: 1.e-002 | W13: 0.436 | X13: 0.38 | Y13: 22 | Z13: 0.92 | AA13: 4.4000000000000004e-002 | AB13: 3.6299999999999999e-002 | AC13: 1.95e-002 | AD13: 1.6899999999999998e-002 | AE13: 85.5 | AF13: 89.34 | AG13: 0.51 | AH13: AA- | AI13: 6.3500000000000001e-002 | AJ13: =H13+100*O13 -> 110.43300000000001 | AK13: 108.8 | AL13: 3 | AM13: 19.4 | AN13: 5 | AO13: -1.8000000000000002e-002 | AP13: 52 | AQ13: 文科转债!
A14: 210 | B14: 113569 | C14: 科达转债! | D14: 603660 | E14: 苏州科达 | F14: 通信互联 | G14: 物联网 | H14: 98.98 | I14: 3.4999999999999996e-003 | J14: -3.9000000000000003e-003 | K14: 7.09 | L14: -5.6000000000000008e-003 | M14: 120.3 | N14: 14.8 | O14: 1.0700000000000001 | P14: 47.91 | Q14: 转股中 | R14: 4.64年 | S14: 2.65年 | T14: 5.16 | U14: 1.7 | V14: 3.0000000000000001e-003 | W14: 0.14699999999999999 | X14: 7.0999999999999994e-002 | Y14: 35 | Z14: 1.96 | AA14: 4.3799999999999999e-002 | AB14: 3.5799999999999998e-002 | AC14: 1.67e-002 | AD14: 1.41e-002 | AE14: 87.61 | AF14: 91.44 | AG14: 0.07 | AH14: AA- | AI14: 6.2199999999999998e-002 | AJ14: =H14+100*O14 -> 205.98000000000002 | AK14: 150.1 | AL14: 265 | AM14: 58.6 | AN14: 264 | AO14: 1.4999999999999999e-002 | AP14: 28 | AQ14: 科达转债!
A15: 231 | B15: 110064 | C15: 建工转债! | D15: 600939 | E15: 重庆建工 | F15: 建筑 | G15: 建筑工程 | H15: 99.7 | I15: 4.5999999999999999e-003 | J15: -4.0000000000000001e-003 | K15: 3.45 | L15: 2.8999999999999998e-003 | M15: 119.8 | N15: 4.57 | O15: 0.32100000000000001 | P15: 75.49 | Q15: 转股中 | R15: 4.43年 | S15: 2.43年 | T15: 16.6 | U15: 9.5 | V15: 6.0000000000000001e-003 | W15: 0.26500000000000001 | X15: 0.20000000000000001 | Y15: 63 | Z15: 0.89 | AA15: 4.3400000000000001e-002 | AB15: 3.5200000000000002e-002 | AC15: 1.7100000000000001e-002 | AD15: 1.3899999999999999e-002 | AE15: 94.57 | AF15: 101.89 | AG15: 0.22 | AH15: AA+ | AI15: 3.8199999999999998e-002 | AJ15: =H15+100*O15 -> 131.80000000000001 | AK15: 123.9 | AL15: 41 | AM15: 22 | AN15: 9 | AO15: -1.1000000000000001e-002 | AP15: 46 | AQ15: 建工转债!
A16: 140 | B16: 113596 | C16: 城地转债! | D16: 603887 | E16: 城地香江 | F16: 通信互联 | G16: 通信设备 | H16: 92.1 | I16: 3.3e-003 | J16: -3.3e-003 | K16: 9.98 | L16: -1.e-003 | M16: 113.5 | N16: 24.26 | O16: 1.24 | P16: 41.14 | Q16: 转股中 | R16: 5年11天 | S16: 3年12天 | T16: 12 | U16: 17 | V16: 1.4999999999999999e-002 | W16: 0.26700000000000002 | X16: 0.11 | Y16: 45 | Z16: 0.98 | AA16: 4.3400000000000001e-002 | AB16: 3.8100000000000002e-002 | AC16: 3.8699999999999998e-002 | AD16: 3.61e-002 | AE16: 85.47 | AF16: 83.87 | AG16: 0.02 | AH16: AA- | AI16: 6.3500000000000001e-002 | AJ16: =H16+100*O16 -> 216.09999999999999 | AK16: 143.1 | AL16: 221 | AM16: 57.6 | AN16: 255 | AO16: -5.7999999999999996e-002 | AP16: 26 | AQ16: 城地转债!
A17: 284 | B17: 113530 | C17: 大丰转债! | D17: 603081 | E17: 大丰实业 | F17: 建筑 | G17: 装饰工程 | H17: 103.8 | I17: 6.6e-003 | J17: -6.6e-003 | K17: 10.58 | L17: 0. | M17: 121 | N17: 16.49 | O17: 0.61799999999999999 | P17: 64.16 | Q17: 转股中 | R17: 3.69年 | S17: 1.70年 | T17: 6.3 | U17: 1.8 | V17: 3.0000000000000001e-003 | W17: 0.14800000000000002 | X17: 9.5000000000000001e-002 | Y17: 43 | Z17: 1.91 | AA17: 4.3200000000000002e-002 | AB17: 3.3000000000000002e-002 | AC17: -4.5999999999999999e-003 | AD17: -7.7000000000000002e-003 | AE17: 95.52 | AF17: 104.53 | AG17: 0.08 | AH17: AA | AI17: 4.1200000000000001e-002 | AJ17: =H17+100*O17 -> 165.59999999999999 | AK17: 143.4 | AL17: 225 | AM17: 38.9 | AN17: 126 | AO17: -4.2999999999999997e-002 | AP17: 32 | AQ17: 大丰转债!
A18: 164 | B18: 127018 | C18: 本钢转债! | D18: 761 | E18: 本钢板材 | F18: 钢铁 | G18: 炼钢 | H18: 104.8 | I18: -3.8e-003 | J18: 1.3999999999999999e-002 | K18: 5.12 | L18: 1.9900000000000001e-002 | M18: 128 | N18: 5.03 | O18: 2.9999999999999999e-002 | P18: 101.79 | Q18: 转股中 | R18: 4.95年 | S18: 2.95年 | T18: 67.5 | U18: 512 | V18: 7.0999999999999994e-002 | W18: 0.33899999999999997 | X18: 0.34499999999999997 | Y18: 199 | Z18: 0.96 | AA18: 4.24e-002 | AB18: 3.2599999999999997e-002 | AC18: 3.2000000000000002e-003 | AD18: -4.0000000000000002e-004 | AE18: 92.08 | AF18: 103 | AG18: 0.51 | AH18: AAA | AI18: 4.6199999999999998e-002 | AJ18: =H18+100*O18 -> 107.8 | AK18: 107.8 | AL18: 2 | AM18: 4.8 | AN18: 1 | AO18: 0.16600000000000001 | AP18: 66 | AQ18: 本钢转债!
A19: 294 | B19: 110052 | C19: 贵广转债! | D19: 600996 | E19: 贵广网络 | F19: 传媒娱乐 | G19: 影视娱乐 | H19: 101.67 | I19: -1.9e-003 | J19: 1.4000000000000002e-003 | K19: 5.05 | L19: -5.8999999999999999e-003 | M19: 117.7 | N19: 7.94 | O19: 0.59899999999999998 | P19: 63.6 | Q19: 转股中 | R19: 3.63年 | S19: 1.64年 | T19: 15.3 | U19: 5 | V19: 3.0000000000000001e-003 | W19: 0.28699999999999998 | X19: 0.183 | Y19: 53 | Z19: 1.26 | AA19: 4.2000000000000003e-002 | AB19: 3.2899999999999999e-002 | AC19: 7.4999999999999997e-003 | AD19: 4.0999999999999995e-003 | AE19: 96.35 | AF19: 102.99 | AG19: 0.07 | AH19: AA+ | AI19: 3.8199999999999998e-002 | AJ19: =H19+100*O19 -> 161.56999999999999 | AK19: 139.7 | AL19: 193 | AM19: 36.7 | AN19: 91 | AO19: -1.1000000000000001e-002 | AP19: 18 | AQ19: 贵广转债!
A20: 360 | B20: 128015 | C20: 久其转债! | D20: 2279 | E20: 久其软件 | F20: 计算机及 | G20: 软件开发 | H20: 101.4 | I20: 2.5000000000000001e-003 | J20: -2.5000000000000001e-003 | K20: 4.9 | L20: 0. | M20: 109.5 | N20: 6.97 | O20: 0.442 | P20: 70.3 | Q20: 转股中 | R20: 1.90年 | S20: 回售内 | T20: 7.8 | U20: 9.4 | V20: 1.2e-002 | W20: 0.22399999999999998 | X20: 0.157 | Y20: 35 | Z20: 4.05 | AA20: 4.1700000000000001e-002 | AB20: 3.2000000000000001e-002 | AC20: 回售内 | AD20: 回售内 | AE20: 100.25 | AF20: 96.17 | AG20: 0 | AH20: A+ | AI20: 7.1399999999999991e-002 | AJ20: =H20+100*O20 -> 145.60000000000002 | AK20: 132.5 | AL20: 119 | AM20: 32.2 | AN20: 55 | AO20: -5.4000000000000006e-002 | AP20: 65 | AQ20: 久其转债!
A21: 165 | B21: 113589 | C21: 天创转债! | D21: 603608 | E21: 天创时尚 | F21: 服装纺织 | G21: 鞋服行业 | H21: 94.44 | I21: -2.9999999999999997e-004 | J21: 2.0000000000000001e-004 | K21: 6.2 | L21: -1.6000000000000001e-003 | M21: 114.9 | N21: 12.29 | O21: 0.872 | P21: 50.45 | Q21: 转股中 | R21: 4.94年 | S21: 2.94年 | T21: 6 | U21: 5.3 | V21: 9.0000000000000011e-003 | W21: 0.22500000000000001 | X21: 0.114 | Y21: 27 | Z21: 1.63 | AA21: 4.1299999999999996e-002 | AB21: 3.5499999999999997e-002 | AC21: 2.9900000000000003e-002 | AD21: 2.76e-002 | AE21: 91.31 | AF21: 94.48 | AG21: 0.06 | AH21: AA | AI21: 4.1200000000000001e-002 | AJ21: =H21+100*O21 -> 181.63999999999999 | AK21: 138.4 | AL21: 184 | AM21: 44 | AN21: 168 | AO21: -2.7000000000000003e-002 | AP21: 29 | AQ21: 天创转债!
A22: 131 | B22: 110072 | C22: 广汇转债! | D22: 600297 | E22: 广汇汽车 | F22: 汽车 | G22: 分销、售 | H22: 93.54 | I22: 1.09e-002 | J22: -8.199999999999999e-003 | K22: 2.91 | L22: 1.04e-002 | M22: 114.5 | N22: 4.03 | O22: 0.29499999999999998 | P22: 72.21 | Q22: 转股中 | R22: 5年32天 | S22: 3年33天 | T22: 33.7 | U22: 52 | V22: 1.6e-002 | W22: 0.14300000000000002 | X22: 0.10300000000000001 | Y22: 236 | Z22: 0.59 | AA22: 4.1200000000000001e-002 | AB22: 3.5799999999999998e-002 | AC22: 3.0200000000000001e-002 | AD22: 2.8300000000000002e-002 | AE22: 90.87 | AF22: 94.32 | AG22: 0.26 | AH22: AA+ | AI22: 3.95e-002 | AJ22: =H22+100*O22 -> 123.04000000000001 | AK22: 114.9 | AL22: 9 | AM22: 20.6 | AN22: 7 | AO22: 1.2e-002 | AP22: 61 | AQ22: 广汇转债!
A23: 341 | B23: 113017 | C23: 吉视转债! | D23: 601929 | E23: XD吉视传 | F23: 传媒娱乐 | G23: 影视娱乐 | H23: 98.87 | I23: 5.0000000000000001e-004 | J23: -5.0000000000000001e-004 | K23: 1.81 | L23: 0. | M23: 108.8 | N23: 2.95 | O23: 0.61099999999999999 | P23: 61.36 | Q23: 转股中 | R23: 2.45年 | S23: 0.45年 | T23: 15.6 | U23: 7.4 | V23: 5.0000000000000001e-003 | W23: 0.27699999999999997 | X23: 0.17000000000000001 | Y23: 56 | Z23: 0.85 | AA23: 4.0500000000000001e-002 | AB23: 3.3399999999999999e-002 | AC23: 4.4500000000000005e-002 | AD23: 3.9300000000000002e-002 | AE23: 99.35 | AF23: 99.82 | AG23: 0.04 | AH23: AA+ | AI23: 3.6400000000000002e-002 | AJ23: =H23+100*O23 -> 159.97 | AK23: 136.4 | AL23: 156 | AM23: 36.6 | AN23: 90 | AO23: -1.4999999999999999e-002 | AP23: 65 | AQ23: 吉视转债!
A24: 160 | B24: 128117 | C24: 道恩转债! | D24: 2838 | E24: 道恩股份 | F24: 化工 | G24: 橡胶塑料 | H24: 101.659 | I24: 5.9999999999999995e-004 | J24: -3.2000000000000002e-003 | K24: 15.85 | L24: -1.9199999999999998e-002 | M24: 123.1 | N24: 28.83 | O24: 0.84900000000000009 | P24: 54.98 | Q24: 转股中 | R24: 4.96年 | S24: 2.96年 | T24: 3.6 | U24: 5 | V24: 1.3999999999999999e-002 | W24: 5.5999999999999994e-002 | X24: 3.1e-002 | Y24: 65 | Z24: 3.4 | AA24: 4.0099999999999997e-002 | AB24: 3.1800000000000002e-002 | AC24: 5.6000000000000008e-003 | AD24: 3.4000000000000002e-003 | AE24: 85.77 | AF24: 91.75 | AG24: 0.13 | AH24: AA- | AI24: 6.2199999999999998e-002 | AJ24: =H24+100*O24 -> 186.55900000000003 | AK24: 148.3 | AL24: 253 | AM24: 56.6 | AN24: 248 | AO24: -0.10300000000000001 | AP24: 22 | AQ24: 道恩转债!
A25: 119 | B25: 128132 | C25: 交建转债! | D25: 2941 | E25: 新疆交建 | F25: 建筑 | G25: 建筑工程 | H25: 96.418 | I25: 2.2000000000000001e-003 | J25: -1.7000000000000001e-003 | K25: 10.23 | L25: 5.8999999999999999e-003 | M25: 117.3 | N25: 18.53 | O25: 0.746 | P25: 55.21 | Q25: 转股中 | R25: 5.16年 | S25: 3.17年 | T25: 8.5 | U25: 7.4 | V25: 9.0000000000000011e-003 | W25: 0.129 | X25: 7.0999999999999994e-002 | Y25: 66 | Z25: 2.72 | AA25: 3.95e-002 | AB25: 3.3300000000000003e-002 | AC25: 2.2599999999999999e-002 | AD25: 2.0299999999999999e-002 | AE25: 90.5 | AF25: 95.04 | AG25: 0.09 | AH25: AA | AI25: 4.2500000000000003e-002 | AJ25: =H25+100*O25 -> 171.018 | AK25: 137.6 | AL25: 170 | AM25: 42.6 | AN25: 160 | AO25: -4.2000000000000003e-002 | AP25: 19 | AQ25: 交建转债!
A26: 132 | B26: 113600 | C26: 新星转债! | D26: 603978 | E26: 深圳新星 | F26: 有色金属 | G26: 有色行业 | H26: 104.81 | I26: 9.8999999999999991e-003 | J26: -9.0000000000000011e-003 | K26: 19.49 | L26: 2.0999999999999999e-003 | M26: 126 | N26: 23.85 | O26: 0.28300000000000003 | P26: 81.72 | Q26: 转股中 | R26: 5年27天 | S26: 3年28天 | T26: 5.95 | U26: 6.6 | V26: 1.1000000000000001e-002 | W26: 0.191 | X26: 0.156 | Y26: 31 | Z26: 2.04 | AA26: 3.78e-002 | AB26: 2.8900000000000002e-002 | AC26: -2.5999999999999999e-003 | AD26: -5.0000000000000001e-003 | AE26: 85.31 | AF26: 92.82 | AG26: 0.43 | AH26: AA- | AI26: 6.3500000000000001e-002 | AJ26: =H26+100*O26 -> 133.11000000000001 | AK26: 127.9 | AL26: 70 | AM26: 35.1 | AN26: 74 | AO26: 5.5999999999999994e-002 | AP26: 23 | AQ26: 新星转债!
A27: 185 | B27: 113573 | C27: 纵横转债! | D27: 603602 | E27: 纵横通信 | F27: 通信互联 | G27: 通信设备 | H27: 105.01 | I27: 3.9000000000000003e-003 | J27: -4.5999999999999999e-003 | K27: 10.26 | L27: -4.7999999999999996e-003 | M27: 124.2 | N27: 18.78 | O27: 0.92200000000000004 | P27: 54.63 | Q27: 转股中 | R27: 4.75年 | S27: 2.75年 | T27: 2.7 | U27: 2.9 | V27: 1.e-002 | W27: 0.129 | X27: 7.0000000000000007e-002 | Y27: 21 | Z27: 2.95 | AA27: 3.6799999999999999e-002 | AB27: 2.7799999999999998e-002 | AC27: -2.8999999999999998e-003 | AD27: -5.6999999999999993e-003 | AE27: 84.89 | AF27: 89.47 | AG27: 0.14 | AH27: A+ | AI27: 7.3200000000000001e-002 | AJ27: =H27+100*O27 -> 197.21000000000001 | AK27: 155.4 | AL27: 283 | AM27: 65.9 | AN27: 290 | AO27: -2.8999999999999998e-002 | AP27: 24 | AQ27: 纵横转债!
A28: 127 | B28: 113601 | C28: 塞力转债! | D28: 603716 | E28: 塞力医疗 | F28: 医药 | G28: 医药商业 | H28: 101.36 | I28: 8.0000000000000004e-004 | J28: -4.5999999999999999e-003 | K28: 13 | L28: -9.1000000000000004e-003 | M28: 121.3 | N28: 16.98 | O28: 0.32400000000000001 | P28: 76.56 | Q28: 转股中 | R28: 5年35天 | S28: 3年36天 | T28: 5.43 | U28: 9 | V28: 1.6e-002 | W28: 0.20399999999999999 | X28: 0.156 | Y28: 27 | Z28: 1.7 | AA28: 3.6799999999999999e-002 | AB28: 2.92e-002 | AC28: 8.6999999999999994e-003 | AD28: 6.0999999999999995e-003 | AE28: 85.48 | AF28: 89.32 | AG28: 0.41 | AH28: AA- | AI28: 6.3500000000000001e-002 | AJ28: =H28+100*O28 -> 133.75999999999999 | AK28: 126.2 | AL28: 54 | AM28: 36.8 | AN28: 99 | AO28: -6.0999999999999999e-002 | AP28: 39 | AQ28: 塞力转债!
A29: 88 | B29: 123077 | C29: 汉得转债! | D29: 300170 | E29: 汉得信息 | F29: 计算机及 | G29: 软件开发 | H29: 104.1 | I29: 1.e-003 | J29: -5.1000000000000004e-003 | K29: 7.29 | L29: -1.6200000000000003e-002 | M29: 125.5 | N29: 9.69 | O29: 0.38400000000000001 | P29: 75.23 | Q29: 转股中 | R29: 5.35年 | S29: 3.36年 | T29: 9.37 | U29: 7.2 | V29: 6.9999999999999993e-003 | W29: 0.14499999999999999 | X29: 0.109 | Y29: 64 | Z29: 2.03 | AA29: 3.6200000000000003e-002 | AB29: 2.7999999999999997e-002 | AC29: -7.000000000000001e-004 | AD29: -2.8000000000000004e-003 | AE29: 89.82 | AF29: 100.86 | AG29: 0.26 | AH29: AA | AI29: 4.2500000000000003e-002 | AJ29: =H29+100*O29 -> 142.5 | AK29: 133 | AL29: 121 | AM29: 32.1 | AN29: 54 | AO29: -3.3000000000000002e-002 | AP29: 14 | AQ29: 汉得转债!
A30: 287 | B30: 123023 | C30: 迪森转债! | D30: 300335 | E30: 迪森股份 | F30: 能源电力 | G30: 电力供应 | H30: 101.19 | I30: 3.9000000000000003e-003 | J30: -5.7999999999999996e-003 | K30: 5.24 | L30: -5.6999999999999993e-003 | M30: 114.3 | N30: 6.89 | O30: 0.33100000000000002 | P30: 76.05 | Q30: 转股中 | R30: 3.67年 | S30: 2.68年 | T30: 5.29 | U30: 19 | V30: 3.5000000000000003e-002 | W30: 0.27100000000000002 | X30: 0.20600000000000002 | Y30: 20 | Z30: 1.4 | AA30: 3.44e-002 | AB30: 2.7000000000000003e-002 | AC30: 1.2e-002 | AD30: 8.8000000000000005e-003 | AE30: 88.35 | AF30: 91.96 | AG30: 0.34 | AH30: AA- | AI30: 6.2199999999999998e-002 | AJ30: =H30+100*O30 -> 134.28999999999999 | AK30: 126.3 | AL30: 57 | AM30: 34.4 | AN30: 70 | AO30: 2.e-002 | AP30: 50 | AQ30: 迪森转债!
A31: 271 | B31: 128066 | C31: 亚泰转债! | D31: 2811 | E31: 郑中设计 | F31: 建筑 | G31: 装饰工程 | H31: 103.08 | I31: 5.1999999999999998e-003 | J31: -6.8000000000000005e-003 | K31: 8.1 | L31: -3.7000000000000002e-003 | M31: 116.7 | N31: 9.27 | O31: 0.17999999999999999 | P31: 87.38 | Q31: 转股中 | R31: 3.75年 | S31: 1.75年 | T31: 4.8 | U31: 4.6 | V31: 9.0000000000000011e-003 | W31: 0.21899999999999997 | X31: 0.192 | Y31: 22 | Z31: 1.48 | AA31: 3.4300000000000004e-002 | AB31: 2.6099999999999998e-002 | AC31: -2.0000000000000001e-004 | AD31: -3.3e-003 | AE31: 91.85 | AF31: 93.49 | AG31: 0.44 | AH31: AA- | AI31: 6.2199999999999998e-002 | AJ31: =H31+100*O31 -> 121.08 | AK31: 118.8 | AL31: 12 | AM31: 25.3 | AN31: 22 | AO31: -5.0000000000000001e-003 | AP31: 60 | AQ31: 亚泰转债!
A32: 85 | B32: 128139 | C32: 祥鑫转债! | D32: 2965 | E32: 祥鑫科技 | F32: 汽车 | G32: 零部件制 | H32: 101.31 | I32: -5.9999999999999995e-004 | J32: -2.0999999999999999e-003 | K32: 25.54 | L32: -8.199999999999999e-003 | M32: 121 | N32: 36.96 | O32: 0.46600000000000003 | P32: 69.1 | Q32: 转股中 | R32: 5.38年 | S32: 3.38年 | T32: 6.47 | U32: 5.7 | V32: 9.0000000000000011e-003 | W32: 0.16800000000000001 | X32: 0.11599999999999999 | Y32: 38 | Z32: 2.18 | AA32: 3.4300000000000004e-002 | AB32: 2.7300000000000001e-002 | AC32: 7.3000000000000001e-003 | AD32: 5.1000000000000004e-003 | AE32: 83.74 | AF32: 87.52 | AG32: 0.34 | AH32: AA- | AI32: 6.3500000000000001e-002 | AJ32: =H32+100*O32 -> 147.91 | AK32: 133.5 | AL32: 132 | AM32: 46 | AN32: 186 | AO32: 6.0000000000000001e-003 | AP32: 14 | AQ32: 祥鑫转债!
A33: 324 | B33: 127007 | C33: 湖广转债! | D33: 665 | E33: 湖北广电 | F33: 传媒娱乐 | G33: 影视娱乐 | H33: 101.199 | I33: 1.6000000000000001e-003 | J33: -1.2999999999999999e-003 | K33: 3.81 | L33: 2.5999999999999999e-003 | M33: 111.3 | N33: 5.58 | O33: 0.48200000000000004 | P33: 68.28 | Q33: 转股中 | R33: 2.95年 | S33: 0.95年 | T33: 12.2 | U33: 5.3 | V33: 4.0000000000000001e-003 | W33: 0.32500000000000001 | X33: 0.222 | Y33: 37 | Z33: 0.64 | AA33: 3.3300000000000003e-002 | AB33: 2.5899999999999999e-002 | AC33: 5.3e-003 | AD33: 2.0999999999999999e-003 | AE33: 97.82 | AF33: 100.31 | AG33: 0.11 | AH33: AA+ | AI33: 3.6400000000000002e-002 | AJ33: =H33+100*O33 -> 149.399 | AK33: 134.1 | AL33: 136 | AM33: 33.8 | AN33: 66 | AO33: -4.0000000000000001e-002 | AP33: 17 | AQ33: 湖广转债!
A34: 207 | B34: 123044 | C34: 红相转债!! | D34: 300427 | E34: 红相股份 | F34: 能源电力 | G34: 电力设备 | H34: 107.8 | I34: 2.8000000000000004e-003 | J34: 3.4000000000000002e-003 | K34: 13.21 | L34: 2.1700000000000001e-002 | M34: 125 | N34: 18.67 | O34: 0.52400000000000002 | P34: 70.76 | Q34: 转股中 | R34: 4.65年 | S34: 2.66年 | T34: 5.5 | U34: 11 | V34: 1.8000000000000002e-002 | W34: 0.115 | X34: 8.199999999999999e-002 | Y34: 48 | Z34: 2.03 | AA34: 3.32e-002 | AB34: 2.3799999999999998e-002 | AC34: -1.11e-002 | AD34: -1.41e-002 | AE34: 88.33 | AF34: 95.08 | AG34: 0.29 | AH34: AA- | AI34: 6.2199999999999998e-002 | AJ34: =H34+100*O34 -> 160.19999999999999 | AK34: 144.8 | AL34: 233 | AM34: 49.8 | AN34: 209 | AO34: -1.9e-002 | AP34: 20 | AQ34: 红相转债!!
A35: 308 | B35: 128049 | C35: 华源转债! | D35: 2787 | E35: 华源控股 | F35: 造纸包装 | G35: 包装材料 | H35: 103.057 | I35: -1.4000000000000002e-003 | J35: -4.0999999999999995e-003 | K35: 5.38 | L35: -2.e-002 | M35: 114.5 | N35: 7.37 | O35: 0.41200000000000003 | P35: 73 | Q35: 转股中 | R35: 3.36年 | S35: 1.37年 | T35: 3.63 | U35: 0.8 | V35: 2.e-003 | W35: 0.214 | X35: 0.156 | Y35: 17 | Z35: 1.14 | AA35: 3.2500000000000001e-002 | AB35: 2.4399999999999998e-002 | AC35: -1.4000000000000002e-003 | AD35: -5.0000000000000001e-003 | AE35: 93.82 | AF35: 93.87 | AG35: 0.27 | AH35: AA- | AI35: 6.2199999999999998e-002 | AJ35: =H35+100*O35 -> 144.25700000000001 | AK35: 133.1 | AL35: 126 | AM35: 39.2 | AN35: 130 | AO35: -4.4000000000000004e-002 | AP35: 43 | AQ35: 华源转债!
A36: 159 | B36: 128118 | C36: 瀛通转债! | D36: 2861 | E36: 瀛通通讯 | F36: 电子 | G36: 电子产品 | H36: 104.27 | I36: 3.8e-003 | J36: -9.1999999999999998e-003 | K36: 12.72 | L36: -2.6800000000000001e-002 | M36: 121.7 | N36: 21.12 | O36: 0.73099999999999998 | P36: 60.23 | Q36: 转股中 | R36: 4.96年 | S36: 2.96年 | T36: 3 | U36: 2.7 | V36: 9.0000000000000011e-003 | W36: 0.14899999999999999 | X36: 8.9999999999999997e-002 | Y36: 20 | Z36: 1.45 | AA36: 3.2400000000000005e-002 | AB36: 2.46e-002 | AC36: -2.0000000000000001e-004 | AD36: -2.8000000000000004e-003 | AE36: 86.44 | AF36: 90.84 | AG36: 0.2 | AH36: AA- | AI36: 6.2199999999999998e-002 | AJ36: =H36+100*O36 -> 177.37 | AK36: 148.3 | AL36: 252 | AM36: 57.5 | AN36: 253 | AO36: -0.153 | AP36: 17 | AQ36: 瀛通转债!
A37: 264 | B37: 128069 | C37: 华森转债! | D37: 2907 | E37: 华森制药 | F37: 医药 | G37: 化学制药 | H37: 105.476 | I37: 3.4999999999999996e-003 | J37: -6.6e-003 | K37: 12.5 | L37: -1.4199999999999999e-002 | M37: 119.3 | N37: 18.01 | O37: 0.52000000000000002 | P37: 69.41 | Q37: 转股中 | R37: 3.94年 | S37: 1.94年 | T37: 3 | U37: 5.4 | V37: 1.7000000000000001e-002 | W37: 5.9999999999999998e-002 | X37: 4.0999999999999995e-002 | Y37: 50 | Z37: 4.42 | AA37: 3.2300000000000002e-002 | AB37: 2.35e-002 | AC37: -1.2199999999999999e-002 | AD37: -1.4800000000000001e-002 | AE37: 90.61 | AF37: 94.45 | AG37: 0.22 | AH37: AA- | AI37: 6.2199999999999998e-002 | AJ37: =H37+100*O37 -> 157.476 | AK37: 141.5 | AL37: 211 | AM37: 47.1 | AN37: 195 | AO37: -5.5e-002 | AP37: 44 | AQ37: 华森转债!
A38: 175 | B38: 113584 | C38: 家悦转债! | D38: 603708 | E38: 家家悦 | F38: 商业零售 | G38: 超市 | H38: 99.01 | I38: 1.e-004 | J38: -1.e-004 | K38: 16.21 | L38: 1.9e-003 | M38: 114.9 | N38: 37.53 | O38: 1.29 | P38: 43.19 | Q38: 转股中 | R38: 4.89年 | S38: 2.89年 | T38: 6.45 | U38: 1.3 | V38: 2.e-003 | W38: 6.5000000000000002e-002 | X38: 2.7999999999999997e-002 | Y38: 99 | Z38: 3.5 | AA38: 3.15e-002 | AB38: 2.58e-002 | AC38: 1.44e-002 | AD38: 1.2199999999999999e-002 | AE38: 91.5 | AF38: 94.68 | AG38: 0.02 | AH38: AA | AI38: 4.1200000000000001e-002 | AJ38: =H38+100*O38 -> 228.00999999999999 | AK38: 154.8 | AL38: 281 | AM38: 60.1 | AN38: 273 | AO38: -4.7e-002 | AP38: 13 | AQ38: 家悦转债!
A39: 41 | B39: 113620 | C39: 傲农转债! | D39: 603363 | E39: 傲农生物 | F39: 农业 | G39: 畜牧业 | H39: 101.94 | I39: 0. | J39: -7.1999999999999998e-003 | K39: 9.19 | L39: -4.1700000000000001e-002 | M39: 121.1 | N39: 14.51 | O39: 0.60999999999999999 | P39: 63.34 | Q39: 2月2天 | R39: 5.65年 | S39: 3.65年 | T39: 10 | U39: 4.9 | V39: 5.0000000000000001e-003 | W39: 0.159 | X39: 0.10099999999999999 | Y39: 63 | Z39: 2.13 | AA39: 3.15e-002 | AB39: 2.4900000000000002e-002 | AC39: 4.3e-003 | AD39: 2.3999999999999998e-003 | AE39: 88.51 | AF39: 96.12 | AG39: 0.17 | AH39: AA | AI39: 4.2500000000000003e-002 | AJ39: =H39+100*O39 -> 162.94 | AK39: 140.5 | AL39: 204 | AM39: 44.4 | AN39: 171 | AO39: -7.2000000000000008e-002 | AP39: 6 | AQ39: 傲农转债!
A40: 247 | B40: 110059 | C40: 浦发转债! | D40: 600000 | E40: 浦发银行 | F40: 金融 | G40: 银行行业 | H40: 103.54 | I40: 5.0000000000000001e-004 | J40: 2.0000000000000001e-004 | K40: 9.98 | L40: 4.0000000000000001e-003 | M40: 117.6 | N40: 14.45 | O40: 0.499 | P40: 69.07 | Q40: 转股中 | R40: 4.28年 | S40: 无权 | T40: 500 | U40: 424 | V40: 8.0000000000000002e-003 | W40: 0.17100000000000001 | X40: 0.11800000000000001 | Y40: 2929. | Z40: 0.54 | AA40: 3.1099999999999999e-002 | AB40: 2.35e-002 | AC40: 无权 | AD40: 无权 | AE40: 无权 | AF40: 101.46 | AG40: 0.17 | AH40: AAA | AI40: 3.6200000000000003e-002 | AJ40: =H40+100*O40 -> 153.44 | AK40: 138 | AL40: 177 | AM40: 36.6 | AN40: 88 | AO40: 0. | AP40: 61 | AQ40: 浦发转债!
A41: 233 | B41: 128085 | C41: 鸿达转债! | D41: 2002 | E41: 鸿达兴业 | F41: 化工 | G41: 化工 | H41: 109.17 | I41: 7.000000000000001e-004 | J41: -7.000000000000001e-004 | K41: 4.18 | L41: 0. | M41: 124.4 | N41: 3.91 | O41: 2.1000000000000001e-002 | P41: 106.91 | Q41: 转股中 | R41: 4.42年 | S41: 2.42年 | T41: 7.78 | U41: 65 | V41: 7.5999999999999998e-002 | W41: 6.2e-002 | X41: 6.6000000000000003e-002 | Y41: 126 | Z41: 1.43 | AA41: 3.0699999999999998e-002 | AB41: 2.1099999999999997e-002 | AC41: -1.9099999999999999e-002 | AD41: -2.2000000000000002e-002 | AE41: 69.08 | AF41: 62.57 | AG41: 0.88 | AH41: B | AI41: 0.17319999999999999 | AJ41: =H41+100*O41 -> 111.27 | AK41: 111.4 | AL41: 5 | AM41: 42.4 | AN41: 158 | AO41: 5.0000000000000003e-002 | AP41: 100 | AQ41: 鸿达转债!
A42: 51 | B42: 113042 | C42: 上银转债! | D42: 601229 | E42: 上海银行 | F42: 金融 | G42: 银行行业 | H42: 102.83 | I42: 7.000000000000001e-004 | J42: -1.6000000000000001e-003 | K42: 7.49 | L42: -4.0000000000000001e-003 | M42: 120.9 | N42: 10.63 | O42: 0.45899999999999996 | P42: 70.46 | Q42: 13天 | R42: 5.53年 | S42: 无权 | T42: 200 | U42: 135 | V42: 6.9999999999999993e-003 | W42: 0.188 | X42: 0.13200000000000001 | Y42: 1064. | Z42: 0.61 | AA42: 3.0600000000000002e-002 | AB42: 2.3700000000000002e-002 | AC42: 无权 | AD42: 无权 | AE42: 无权 | AF42: 99.21 | AG42: 0.24 | AH42: AAA | AI42: 3.7499999999999999e-002 | AJ42: =H42+100*O42 -> 148.72999999999999 | AK42: 135.2 | AL42: 144 | AM42: 36 | AN42: 82 | AO42: -6.0999999999999999e-002 | AP42: 11 | AQ42: 上银转债!
A43: 158 | B43: 113036 | C43: 宁建转债! | D43: 601789 | E43: 宁波建工 | F43: 建筑 | G43: 建筑工程 | H43: 100.96 | I43: 4.4000000000000003e-003 | J43: -5.8999999999999999e-003 | K43: 3.54 | L43: -5.6000000000000008e-003 | M43: 116.9 | N43: 4.76 | O43: 0.35799999999999998 | P43: 74.37 | Q43: 转股中 | R43: 4.97年 | S43: 2.97年 | T43: 5.4 | U43: 4.2 | V43: 8.0000000000000002e-003 | W43: 0.156 | X43: 0.11599999999999999 | Y43: 35 | Z43: 1.1 | AA43: 3.0499999999999999e-002 | AB43: 2.4199999999999999e-002 | AC43: 7.7000000000000002e-003 | AD43: 5.6000000000000008e-003 | AE43: 91.19 | AF43: 95.99 | AG43: 0.27 | AH43: AA | AI43: 4.1200000000000001e-002 | AJ43: =H43+100*O43 -> 136.75999999999999 | AK43: 127.6 | AL43: 65 | AM43: 31.6 | AN43: 49 | AO43: -4.4999999999999998e-002 | AP43: 9 | AQ43: 宁建转债!
A44: 228 | B44: 123039 | C44: 开润转债! | D44: 300577 | E44: 开润股份 | F44: 服装纺织 | G44: 纺织行业 | H44: 106.4 | I44: -5.0000000000000001e-004 | J44: -7.8000000000000005e-003 | K44: 19.44 | L44: -3.1899999999999998e-002 | M44: 121 | N44: 29.9 | O44: 0.63700000000000001 | P44: 65.02 | Q44: 转股中 | R44: 4.44年 | S44: 2.45年 | T44: 2.22 | U44: 1.7 | V44: 6.9999999999999993e-003 | W44: 4.7e-002 | X44: 3.1e-002 | Y44: 47 | Z44: 3.05 | AA44: 3.0099999999999998e-002 | AB44: 2.1600000000000001e-002 | AC44: -8.5000000000000006e-003 | AD44: -1.15e-002 | AE44: 86.74 | AF44: 89.08 | AG44: 0.26 | AH44: A+ | AI44: 7.3200000000000001e-002 | AJ44: =H44+100*O44 -> 170.10000000000002 | AK44: 147.8 | AL44: 250 | AM44: 58.7 | AN44: 265 | AO44: -7.5999999999999998e-002 | AP44: 23 | AQ44: 开润转债!
A45: 162 | B45: 113591 | C45: 胜达转债! | D45: 603687 | E45: 大胜达 | F45: 造纸包装 | G45: 包装用纸 | H45: 105.38 | I45: 9.300000000000001e-003 | J45: 5.6000000000000008e-003 | K45: 7.82 | L45: 2.8900000000000002e-002 | M45: 121.7 | N45: 8.76 | O45: 0.17999999999999999 | P45: 89.27 | Q45: 转股中 | R45: 4.96年 | S45: 2.96年 | T45: 5.5 | U45: 35 | V45: 6.0999999999999999e-002 | W45: 0.17100000000000001 | X45: 0.153 | Y45: 32 | Z45: 1.86 | AA45: 3.0099999999999998e-002 | AB45: 2.23e-002 | AC45: -5.4000000000000003e-003 | AD45: -7.6e-003 | AE45: 85.95 | AF45: 90.77 | AG45: 0.51 | AH45: AA- | AI45: 6.2199999999999998e-002 | AJ45: =H45+100*O45 -> 123.38 | AK45: 121.5 | AL45: 23 | AM45: 30.7 | AN45: 39 | AO45: -3.0000000000000001e-003 | AP45: 29 | AQ45: 胜达转债!
A46: 270 | B46: 113535 | C46: 大业转债! | D46: 603278 | E46: 大业股份 | F46: 汽车 | G46: 零部件制 | H46: 103.62 | I46: -8.9999999999999998e-004 | J46: -8.0000000000000004e-004 | K46: 9.22 | L46: -9.7000000000000003e-003 | M46: 112.5 | N46: 12.29 | O46: 0.38100000000000001 | P46: 75.02 | Q46: 转股中 | R46: 2.81年 | S46: 0.81年 | T46: 5 | U46: 3.8 | V46: 6.9999999999999993e-003 | W46: 0.187 | X46: 0.14000000000000001 | Y46: 27 | Z46: 1.56 | AA46: 2.9999999999999999e-002 | AB46: 2.1700000000000001e-002 | AC46: -2.3399999999999997e-002 | AD46: -2.58e-002 | AE46: 97.49 | AF46: 101.03 | AG46: 0.17 | AH46: AA | AI46: 3.9399999999999998e-002 | AJ46: =H46+100*O46 -> 141.72 | AK46: 132.2 | AL46: 116 | AM46: 31.2 | AN46: 45 | AO46: 8.1000000000000003e-002 | AP46: 48 | AQ46: 大业转债!
A47: 295 | B47: 113021 | C47: 中信转债! | D47: 601998 | E47: 中信银行 | F47: 金融 | G47: 银行行业 | H47: 106.47 | I47: -4.0000000000000002e-004 | J47: -2.0000000000000001e-004 | K47: 5.03 | L47: -4.0000000000000001e-003 | M47: 118 | N47: 6.98 | O47: 0.47700000000000004 | P47: 72.06 | Q47: 转股中 | R47: 3.63年 | S47: 无权 | T47: 400 | U47: 61 | V47: 1.e-003 | W47: 0.16300000000000001 | X47: 0.11699999999999999 | Y47: 2461. | Z47: 0.51 | AA47: 2.9600000000000001e-002 | AB47: 2.0499999999999997e-002 | AC47: 无权 | AD47: 无权 | AE47: 无权 | AF47: 104.1 | AG47: 0.16 | AH47: AAA | AI47: 3.6200000000000003e-002 | AJ47: =H47+100*O47 -> 154.17000000000002 | AK47: 140.9 | AL47: 205 | AM47: 36.8 | AN47: 92 | AO47: -1.3000000000000001e-002 | AP47: 43 | AQ47: 中信转债!
A48: 134 | B48: 113599 | C48: 嘉友转债! | D48: 603871 | E48: 嘉友国际 | F48: 交通运输 | G48: 物流业 | H48: 109.23 | I48: 2.2000000000000001e-003 | J48: -4.8999999999999998e-003 | K48: 16.25 | L48: -5.5000000000000005e-003 | M48: 126 | N48: 18.32 | O48: 0.23100000000000001 | P48: 88.7 | Q48: 转股中 | R48: 5年19天 | S48: 3年20天 | T48: 7.2 | U48: 3 | V48: 4.0000000000000001e-003 | W48: 0.155 | X48: 0.13800000000000001 | Y48: 46 | Z48: 1.66 | AA48: 2.9300000000000003e-002 | AB48: 2.0499999999999997e-002 | AC48: -1.55e-002 | AD48: -1.78e-002 | AE48: 85.43 | AF48: 92.94 | AG48: 0.49 | AH48: AA- | AI48: 6.3500000000000001e-002 | AJ48: =H48+100*O48 -> 132.33000000000001 | AK48: 129.8 | AL48: 87 | AM48: 36.8 | AN48: 97 | AO48: -6.9999999999999993e-003 | AP48: 19 | AQ48: 嘉友转债!
A49: 90 | B49: 123076 | C49: 强力转债! | D49: 300429 | E49: 强力新材 | F49: 化工 | G49: 化工 | H49: 101.93 | I49: 8.199999999999999e-003 | J49: -9.4999999999999998e-003 | K49: 12.85 | L49: -3.9000000000000003e-003 | M49: 118.5 | N49: 18.94 | O49: 0.502 | P49: 67.85 | Q49: 转股中 | R49: 5.34年 | S49: 3.35年 | T49: 8.5 | U49: 7.3 | V49: 8.0000000000000002e-003 | W49: 0.128 | X49: 8.6999999999999994e-002 | Y49: 66 | Z49: 3.75 | AA49: 2.92e-002 | AB49: 2.29e-002 | AC49: 5.4000000000000003e-003 | AD49: 3.2000000000000002e-003 | AE49: 83.85 | AF49: 85.87 | AG49: 0.33 | AH49: AA- | AI49: 6.3500000000000001e-002 | AJ49: =H49+100*O49 -> 152.13 | AK49: 136 | AL49: 151 | AM49: 50.1 | AN49: 216 | AO49: -2.e-002 | AP49: 16 | AQ49: 强力转债!
A50: 14 | B50: 113624 | C50: 正川转债! | D50: 603976 | E50: 正川股份 | F50: 医药 | G50: 医药行业 | H50: 103.36 | I50: 8.0000000000000004e-004 | J50: -3.0999999999999999e-003 | K50: 36.41 | L50: -4.4000000000000003e-003 | M50: 121.6 | N50: 46.69 | O50: 0.32500000000000001 | P50: 77.98 | Q50: 3月25天 | R50: 5.78年 | S50: 3.78年 | T50: 4.05 | U50: 7.8 | V50: 1.9e-002 | W50: 7.400000000000001e-002 | X50: 5.7000000000000002e-002 | Y50: 55 | Z50: 5.22 | AA50: 2.92e-002 | AB50: 2.2499999999999999e-002 | AC50: 3.0999999999999999e-003 | AD50: 8.0000000000000004e-004 | AE50: 79.02 | AF50: 81.04 | AG50: 0.53 | AH50: A+ | AI50: 7.4499999999999997e-002 | AJ50: =H50+100*O50 -> 135.86000000000001 | AK50: 128.7 | AL50: 77 | AM50: 47.7 | AN50: 199 | AO50: -3.7999999999999999e-002 | AP50: 13 | AQ50: 正川转债!
A51: 197 | B51: 113033 | C51: 利群转债! | D51: 601366 | E51: 利群股份 | F51: 商业零售 | G51: 商场 | H51: 100.74 | I51: 2.2000000000000001e-003 | J51: -7.000000000000001e-004 | K51: 6.3 | L51: 3.2000000000000002e-003 | M51: 114.9 | N51: 7.01 | O51: 0.121 | P51: 89.87 | Q51: 转股中 | R51: 4.71年 | S51: 2.71年 | T51: 18 | U51: 15 | V51: 9.0000000000000011e-003 | W51: 0.33200000000000002 | X51: 0.29799999999999999 | Y51: 54 | Z51: 1.17 | AA51: 2.8900000000000002e-002 | AB51: 2.3e-002 | AC51: 9.1999999999999998e-003 | AD51: 6.8000000000000005e-003 | AE51: 92.16 | AF51: 95.36 | AG51: 0.46 | AH51: AA | AI51: 4.1200000000000001e-002 | AJ51: =H51+100*O51 -> 112.83999999999999 | AK51: 111.6 | AL51: 6 | AM51: 16.2 | AN51: 3 | AO51: 4.0000000000000001e-003 | AP51: 60 | AQ51: 利群转债!
A52: 249 | B52: 113546 | C52: 迪贝转债! | D52: 603320 | E52: 迪贝电气 | F52: 家电 | G52: 零部件制 | H52: 107.13 | I52: 5.0000000000000001e-004 | J52: -4.0999999999999995e-003 | K52: 11.71 | L52: -7.6e-003 | M52: 120.6 | N52: 14 | O52: 0.28100000000000003 | P52: 83.64 | Q52: 转股中 | R52: 4.27年 | S52: 2.27年 | T52: 2.3 | U52: 1.4 | V52: 5.0000000000000001e-003 | W52: 0.151 | X52: 0.126 | Y52: 15 | Z52: 2.19 | AA52: 2.8799999999999999e-002 | AB52: 2.0199999999999999e-002 | AC52: -1.2500000000000001e-002 | AD52: -1.5600000000000001e-002 | AE52: 87.7 | AF52: 89.88 | AG52: 0.48 | AH52: A+ | AI52: 7.3200000000000001e-002 | AJ52: =H52+100*O52 -> 135.22999999999999 | AK52: 130.6 | AL52: 96 | AM52: 40.7 | AN52: 144 | AO52: 1.8000000000000002e-002 | AP52: 38 | AQ52: 迪贝转债!
A53: 196 | B53: 127016 | C53: 鲁泰转债! | D53: 726 | E53: 鲁 泰Ａ | F53: 服装纺织 | G53: 纺织行业 | H53: 101.643 | I53: 1.2999999999999999e-003 | J53: -1.9e-003 | K53: 5.99 | L53: -3.3e-003 | M53: 115.9 | N53: 8.71 | O53: 0.47799999999999998 | P53: 68.77 | Q53: 转股中 | R53: 4.73年 | S53: 2.73年 | T53: 14 | U53: 2.3 | V53: 2.e-003 | W53: 0.26500000000000001 | X53: 0.182 | Y53: 53 | Z53: 0.67 | AA53: 2.87e-002 | AB53: 2.2499999999999999e-002 | AC53: 6.0000000000000001e-003 | AD53: 3.7000000000000002e-003 | AE53: 92.84 | AF53: 97.4 | AG53: 0.18 | AH53: AA+ | AI53: 3.8199999999999998e-002 | AJ53: =H53+100*O53 -> 149.44299999999998 | AK53: 134.5 | AL53: 139 | AM53: 37.1 | AN53: 103 | AO53: -6.0000000000000001e-003 | AP53: 21 | AQ53: 鲁泰转债!
A54: 136 | B54: 128125 | C54: 华阳转债! | D54: 2949 | E54: 华阳国际 | F54: 建筑 | G54: 建筑工程 | H54: 103.1 | I54: 5.7999999999999996e-003 | J54: -1.11e-002 | K54: 16.89 | L54: -1.7500000000000002e-002 | M54: 118.5 | N54: 25.39 | O54: 0.55000000000000004 | P54: 66.52 | Q54: 转股中 | R54: 5年13天 | S54: 3年14天 | T54: 4.5 | U54: 2.1 | V54: 5.0000000000000001e-003 | W54: 0.13600000000000001 | X54: 8.9999999999999997e-002 | Y54: 33 | Z54: 2.6 | AA54: 2.86e-002 | AB54: 2.2000000000000002e-002 | AC54: 2.3e-003 | AD54: -1.e-004 | AE54: 85.45 | AF54: 87.51 | AG54: 0.3 | AH54: AA- | AI54: 6.3500000000000001e-002 | AJ54: =H54+100*O54 -> 158.09999999999999 | AK54: 139.7 | AL54: 192 | AM54: 52.2 | AN54: 224 | AO54: 3.0000000000000001e-003 | AP54: 8 | AQ54: 华阳转债!
A55: 184 | B55: 113578 | C55: 全筑转债! | D55: 603030 | E55: 全筑股份 | F55: 建筑 | G55: 装饰工程 | H55: 103.42 | I55: 5.1999999999999998e-003 | J55: -7.4999999999999997e-003 | K55: 4.4 | L55: -6.8000000000000005e-003 | M55: 117.9 | N55: 5.4 | O55: 0.26899999999999996 | P55: 81.48 | Q55: 转股中 | R55: 4.76年 | S55: 2.76年 | T55: 3.84 | U55: 3.1 | V55: 8.0000000000000002e-003 | W55: 0.16200000000000001 | X55: 0.13200000000000001 | Y55: 24 | Z55: 1.04 | AA55: 2.8399999999999998e-002 | AB55: 2.1600000000000001e-002 | AC55: -1.e-004 | AD55: -2.3e-003 | AE55: 91.97 | AF55: 97.64 | AG55: 0.34 | AH55: AA | AI55: 4.1200000000000001e-002 | AJ55: =H55+100*O55 -> 130.31999999999999 | AK55: 125.4 | AL55: 49 | AM55: 27.7 | AN55: 29 | AO55: -8.0000000000000002e-003 | AP55: 22 | AQ55: 全筑转债!
A56: 154 | B56: 123059 | C56: 银信转债! | D56: 300231 | E56: 银信科技 | F56: 计算机及 | G56: 软件开发 | H56: 108.387 | I56: 1.7000000000000001e-003 | J56: -4.8999999999999998e-003 | K56: 7.9 | L56: -7.4999999999999997e-003 | M56: 123.7 | N56: 9.72 | O56: 0.33399999999999996 | P56: 81.28 | Q56: 转股中 | R56: 4.99年 | S56: 2.998年 | T56: 3.91 | U56: 6.9 | V56: 1.6e-002 | W56: 0.11199999999999999 | X56: 9.0999999999999998e-002 | Y56: 35 | Z56: 2.56 | AA56: 2.7300000000000001e-002 | AB56: 1.9099999999999999e-002 | AC56: -1.4199999999999999e-002 | AD56: -1.6399999999999998e-002 | AE56: 85.75 | AF56: 92.04 | AG56: 0.43 | AH56: AA- | AI56: 6.2199999999999998e-002 | AJ56: =H56+100*O56 -> 141.78700000000001 | AK56: 135.5 | AL56: 148 | AM56: 43.5 | AN56: 164 | AO56: -1.6e-002 | AP56: 16 | AQ56: 银信转债!
A57: 346 | B57: 123004 | C57: 铁汉转债! | D57: 300197 | E57: 节能铁汉 | F57: 城市公用 | G57: 生态环境 | H57: 102.128 | I57: 1.2999999999999999e-003 | J57: -7.000000000000001e-004 | K57: 2.99 | L57: 3.4000000000000002e-003 | M57: 108.8 | N57: 3.82 | O57: 0.30499999999999999 | P57: 78.27 | Q57: 转股中 | R57: 2.42年 | S57: 0.42年 | T57: 8.03 | U57: 4.7 | V57: 6.0000000000000001e-003 | W57: 9.5000000000000001e-002 | X57: 7.400000000000001e-002 | Y57: 84 | Z57: 1.29 | AA57: 2.69e-002 | AB57: 1.9799999999999998e-002 | AC57: -9.5999999999999992e-003 | AD57: -1.47e-002 | AE57: 99.26 | AF57: 99.22 | AG57: 0.17 | AH57: AA | AI57: 3.9399999999999998e-002 | AJ57: =H57+100*O57 -> 132.62799999999999 | AK57: 126 | AL57: 51 | AM57: 26.7 | AN57: 25 | AO57: -2.7999999999999997e-002 | AP57: 45 | AQ57: 铁汉转债!
A58: 215 | B58: 113566 | C58: 翔港转债! | D58: 603499 | E58: 翔港科技 | F58: 造纸包装 | G58: 包装材料 | H58: 110.11 | I58: -9.7999999999999997e-003 | J58: -2.0999999999999999e-003 | K58: 7.9 | L58: -3.1899999999999998e-002 | M58: 124 | N58: 10.77 | O58: 0.501 | P58: 73.35 | Q58: 转股中 | R58: 4.62年 | S58: 2.62年 | T58: 1.61 | U58: 12 | V58: 6.5000000000000002e-002 | W58: 0.10199999999999999 | X58: 7.400000000000001e-002 | Y58: 16 | Z58: 2.81 | AA58: 2.6699999999999998e-002 | AB58: 1.7600000000000001e-002 | AC58: -1.9900000000000001e-002 | AD58: -2.2700000000000001e-002 | AE58: 85.75 | AF58: 90.16 | AG58: 0.37 | AH58: A+ | AI58: 7.3200000000000001e-002 | AJ58: =H58+100*O58 -> 160.21000000000001 | AK58: 146.9 | AL58: 246 | AM58: 56.7 | AN58: 249 | AO58: 2.7000000000000003e-002 | AP58: 27 | AQ58: 翔港转债!
A59: 304 | B59: 113524 | C59: 奇精转债! | D59: 603677 | E59: 奇精机械 | F59: 家电 | G59: 零部件制 | H59: 107.43 | I59: 1.01e-002 | J59: -7.1999999999999998e-003 | K59: 11.43 | L59: 7.9000000000000008e-003 | M59: 117.3 | N59: 13.98 | O59: 0.314 | P59: 81.76 | Q59: 转股中 | R59: 3.41年 | S59: 1.41年 | T59: 3.3 | U59: 17 | V59: 4.7e-002 | W59: 0.14999999999999999 | X59: 0.12300000000000001 | Y59: 22 | Z59: 2.24 | AA59: 2.6600000000000002e-002 | AB59: 1.7399999999999999e-002 | AC59: -2.7699999999999999e-002 | AD59: -3.1099999999999999e-002 | AE59: 93.53 | AF59: 95.87 | AG59: 0.36 | AH59: AA- | AI59: 6.2199999999999998e-002 | AJ59: =H59+100*O59 -> 138.83000000000001 | AK59: 133.1 | AL59: 123 | AM59: 37.2 | AN59: 105 | AO59: 0. | AP59: 43 | AQ59: 奇精转债!
A60: 280 | B60: 113532 | C60: 海环转债! | D60: 603817 | E60: 海峡环保 | F60: 城市公用 | G60: 三废处理 | H60: 102.08 | I60: -1.1000000000000001e-003 | J60: -1.e-004 | K60: 5.61 | L60: -5.3e-003 | M60: 112.3 | N60: 7.63 | O60: 0.38799999999999996 | P60: 73.53 | Q60: 转股中 | R60: 3.71年 | S60: 1.71年 | T60: 4.59 | U60: 1 | V60: 2.e-003 | W60: 0.182 | X60: 0.13400000000000001 | Y60: 25 | Z60: 1.42 | AA60: 2.6600000000000002e-002 | AB60: 2.0299999999999999e-002 | AC60: 3.8e-003 | AD60: 8.0000000000000004e-004 | AE60: 95.34 | AF60: 96.95 | AG60: 0.22 | AH60: AA | AI60: 4.1200000000000001e-002 | AJ60: =H60+100*O60 -> 140.88 | AK60: 130.6 | AL60: 97 | AM60: 33.7 | AN60: 62 | AO60: -1.e-003 | AP60: 26 | AQ60: 海环转债!
A61: 166 | B61: 123056 | C61: 雪榕转债! | D61: 300511 | E61: 雪榕生物 | F61: 农业 | G61: 种植业 | H61: 106.3 | I61: -5.9999999999999995e-004 | J61: -2.2000000000000001e-003 | K61: 8.55 | L61: -8.1000000000000013e-003 | M61: 120.7 | N61: 11.77 | O61: 0.46299999999999997 | P61: 72.64 | Q61: 转股中 | R61: 4.94年 | S61: 2.94年 | T61: 5.84 | U61: 9.4 | V61: 1.4999999999999999e-002 | W61: 0.155 | X61: 0.11199999999999999 | Y61: 38 | Z61: 1.82 | AA61: 2.6600000000000002e-002 | AB61: 1.9099999999999999e-002 | AC61: -8.199999999999999e-003 | AD61: -1.0500000000000001e-002 | AE61: 86.05 | AF61: 90.14 | AG61: 0.34 | AH61: AA- | AI61: 6.2199999999999998e-002 | AJ61: =H61+100*O61 -> 152.59999999999999 | AK61: 140 | AL61: 197 | AM61: 49.8 | AN61: 210 | AO61: 3.5000000000000003e-002 | AP61: 16 | AQ61: 雪榕转债!
A62: 273 | B62: 127013 | C62: 创维转债! | D62: 810 | E62: 创维数字 | F62: 电子 | G62: 电子产品 | H62: 106.527 | I62: 1.1999999999999999e-003 | J62: -1.9e-003 | K62: 8.48 | L62: -3.4999999999999996e-003 | M62: 117.3 | N62: 11.29 | O62: 0.41799999999999998 | P62: 75.11 | Q62: 转股中 | R62: 3.75年 | S62: 1.75年 | T62: 9.78 | U62: 5 | V62: 5.0000000000000001e-003 | W62: 0.10800000000000001 | X62: 8.1000000000000003e-002 | Y62: 90 | Z62: 2.14 | AA62: 2.6499999999999999e-002 | AB62: 1.8100000000000002e-002 | AC62: -1.8600000000000002e-002 | AD62: -2.1299999999999999e-002 | AE62: 95.21 | AF62: 101.11 | AG62: 0.19 | AH62: AA | AI62: 4.1200000000000001e-002 | AJ62: =H62+100*O62 -> 148.327 | AK62: 137.9 | AL62: 173 | AM62: 36.8 | AN62: 98 | AO62: -1.6e-002 | AP62: 23 | AQ62: 创维转债!
A63: 188 | B63: 123049 | C63: 维尔转债 | D63: 300190 | E63: 维尔利 | F63: 城市公用 | G63: 三废处理 | H63: 110.106 | I63: -5.9999999999999995e-004 | J63: 1.2999999999999999e-003 | K63: 6.7 | L63: 1.5e-003 | M63: 124.3 | N63: 7.38 | O63: 0.21299999999999999 | P63: 90.79 | Q63: 转股中 | R63: 4.74年 | S63: 2.74年 | T63: 9.17 | U63: 4.4 | V63: 4.0000000000000001e-003 | W63: 0.17499999999999999 | X63: 0.159 | Y63: 52 | Z63: 1.21 | AA63: 2.6499999999999999e-002 | AB63: 1.7600000000000001e-002 | AC63: -1.89e-002 | AD63: -2.1600000000000001e-002 | AE63: 87.61 | AF63: 94 | AG63: 0.5 | AH63: AA- | AI63: 6.2199999999999998e-002 | AJ63: =H63+100*O63 -> 131.40600000000001 | AK63: 129.4 | AL63: 81 | AM63: 35.4 | AN63: 77 | AO63: 1.4999999999999999e-002 | AP63: 17 | AQ63: 维尔转债
A64: 80 | B64: 123081 | C64: 精研转债! | D64: 300709 | E64: 精研科技 | F64: 电子 | G64: 电子产品 | H64: 106.5 | I64: 4.0000000000000002e-004 | J64: 2.8999999999999998e-003 | K64: 37.04 | L64: 9.300000000000001e-003 | M64: 121.3 | N64: 53.4 | O64: 0.53500000000000003 | P64: 69.36 | Q64: 转股中 | R64: 5.38年 | S64: 3.38年 | T64: 5.7 | U64: 3 | V64: 5.0000000000000001e-003 | W64: 0.111 | X64: 7.6999999999999999e-002 | Y64: 51 | Z64: 2.69 | AA64: 2.5000000000000001e-002 | AB64: 1.8000000000000002e-002 | AC64: -6.0999999999999995e-003 | AD64: -8.3999999999999995e-003 | AE64: 83.96 | AF64: 87.73 | AG64: 0.35 | AH64: AA- | AI64: 6.3500000000000001e-002 | AJ64: =H64+100*O64 -> 160. | AK64: 143.6 | AL64: 227 | AM64: 55.9 | AN64: 245 | AO64: -5.4000000000000006e-002 | AP64: 8 | AQ64: 精研转债!
A65: 173 | B65: 123053 | C65: 宝通转债! | D65: 300031 | E65: 宝通科技 | F65: 通信互联 | G65: 互联网 | H65: 107.368 | I65: 5.9999999999999995e-004 | J65: -6.4000000000000003e-003 | K65: 15.52 | L65: -1.52e-002 | M65: 120.8 | N65: 20.5 | O65: 0.41799999999999998 | P65: 75.71 | Q65: 转股中 | R65: 4.89年 | S65: 2.89年 | T65: 5 | U65: 4 | V65: 6.9999999999999993e-003 | W65: 8.1000000000000003e-002 | X65: 6.0999999999999999e-002 | Y65: 62 | Z65: 2 | AA65: 2.4900000000000002e-002 | AB65: 1.7399999999999999e-002 | AC65: -1.1299999999999999e-002 | AD65: -1.37e-002 | AE65: 86.42 | AF65: 90.51 | AG65: 0.38 | AH65: AA- | AI65: 6.2199999999999998e-002 | AJ65: =H65+100*O65 -> 149.16800000000001 | AK65: 139 | AL65: 187 | AM65: 48.5 | AN65: 205 | AO65: -3.7999999999999999e-002 | AP65: 10 | AQ65: 宝通转债!
A66: 365 | B66: 128013 | C66: 洪涛转债! | D66: 2325 | E66: 洪涛股份 | F66: 建筑 | G66: 装饰工程 | H66: 107.13 | I66: -2.3e-003 | J66: -2.2000000000000001e-003 | K66: 2.41 | L66: -8.199999999999999e-003 | M66: 109.8 | N66: 2.32 | O66: 3.1e-002 | P66: 103.88 | Q66: 转股中 | R66: 1年13天 | S66: 回售内 | T66: 11.5 | U66: 23 | V66: 1.8000000000000002e-002 | W66: 0.377 | X66: 0.39200000000000002 | Y66: 31 | Z66: 1.12 | AA66: 2.4500000000000001e-002 | AB66: 6.5000000000000006e-003 | AC66: 回售内 | AD66: 回售内 | AE66: 100.3 | AF66: 100.44 | AG66: 0.54 | AH66: A- | AI66: 9.1400000000000009e-002 | AJ66: =H66+100*O66 -> 110.22999999999999 | AK66: 110.4 | AL66: 4 | AM66: 9.9 | AN66: 2 | AO66: -2.3e-002 | AP66: 92 | AQ66: 洪涛转债!
A67: 323 | B67: 123010 | C67: 博世转债! | D67: 300422 | E67: 博世科 | F67: 城市公用 | G67: 三废处理 | H67: 103.746 | I67: 1.0700000000000001e-002 | J67: -1.34e-002 | K67: 8.97 | L67: -1.21e-002 | M67: 111.3 | N67: 12.15 | O67: 0.40500000000000003 | P67: 73.83 | Q67: 转股中 | R67: 2.97年 | S67: 0.97年 | T67: 4.3 | U67: 19 | V67: 4.2000000000000003e-002 | W67: 0.11800000000000001 | X67: 8.6999999999999994e-002 | Y67: 36 | Z67: 1.5 | AA67: 2.4300000000000002e-002 | AB67: 1.7100000000000001e-002 | AC67: -1.66e-002 | AD67: -1.9599999999999999e-002 | AE67: 95.25 | AF67: 93.76 | AG67: 0.23 | AH67: AA- | AI67: 6.0400000000000002e-002 | AJ67: =H67+100*O67 -> 144.24599999999998 | AK67: 133.7 | AL67: 133 | AM67: 38.4 | AN67: 118 | AO67: 2.6000000000000002e-002 | AP67: 31 | AQ67: 博世转债!
A68: 142 | B68: 128123 | C68: 国光转债! | D68: 2749 | E68: 国光股份 | F68: 化工 | G68: 农化 | H68: 103.322 | I68: 1.2999999999999999e-003 | J68: -2.e-003 | K68: 9.05 | L68: -2.2000000000000001e-003 | M68: 116.2 | N68: 13.48 | O68: 0.53900000000000003 | P68: 67.14 | Q68: 转股中 | R68: 5年10天 | S68: 3年11天 | T68: 3.2 | U68: 0.6 | V68: 2.e-003 | W68: 8.1000000000000003e-002 | X68: 5.4000000000000006e-002 | Y68: 39 | Z68: 3.16 | AA68: 2.4199999999999999e-002 | AB68: 1.83e-002 | AC68: 2.5000000000000001e-003 | AD68: -1.e-004 | AE68: 85.75 | AF68: 85.94 | AG68: 0.32 | AH68: AA- | AI68: 6.3500000000000001e-002 | AJ68: =H68+100*O68 -> 157.22200000000001 | AK68: 139.5 | AL68: 189 | AM68: 53.6 | AN68: 228 | AO68: -1.7000000000000001e-002 | AP68: 12 | AQ68: 国光转债!
A69: 68 | B69: 123088 | C69: 威唐转债! | D69: 300707 | E69: 威唐工业 | F69: 汽车 | G69: 零部件制 | H69: 107.188 | I69: 1.1200000000000002e-002 | J69: 5.0000000000000001e-004 | K69: 17.52 | L69: 2.0400000000000001e-002 | M69: 121.6 | N69: 20.72 | O69: 0.26800000000000002 | P69: 84.56 | Q69: 转股中 | R69: 5.41年 | S69: 3.42年 | T69: 3.01 | U69: 19 | V69: 5.7999999999999996e-002 | W69: 0.109 | X69: 9.3000000000000013e-002 | Y69: 28 | Z69: 3.99 | AA69: 2.41e-002 | AB69: 1.7100000000000001e-002 | AC69: -6.8999999999999999e-003 | AD69: -9.300000000000001e-003 | AE69: 81.13 | AF69: 83.21 | AG69: 0.57 | AH69: A+ | AI69: 7.4499999999999997e-002 | AJ69: =H69+100*O69 -> 133.988 | AK69: 129.8 | AL69: 89 | AM69: 46.6 | AN69: 191 | AO69: 4.0000000000000001e-002 | AP69: 14 | AQ69: 威唐转债!
A70: 297 | B70: 128056 | C70: 今飞转债! | D70: 2863 | E70: 今飞凯达 | F70: 汽车 | G70: 零部件制 | H70: 110.531 | I70: -5.8999999999999999e-003 | J70: 8.5000000000000006e-003 | K70: 5.05 | L70: 8.0000000000000002e-003 | M70: 120.2 | N70: 6.69 | O70: 0.46399999999999997 | P70: 75.49 | Q70: 转股中 | R70: 3.62年 | S70: 1.62年 | T70: 1.72 | U70: 12 | V70: 6.2e-002 | W70: 6.8000000000000005e-002 | X70: 5.2000000000000005e-002 | Y70: 25 | Z70: 1.35 | AA70: 2.3900000000000001e-002 | AB70: 1.41e-002 | AC70: -3.7100000000000001e-002 | AD70: -4.0599999999999997e-002 | AE70: 91.21 | AF70: 93.6 | AG70: 0.32 | AH70: A+ | AI70: 7.3200000000000001e-002 | AJ70: =H70+100*O70 -> 156.93100000000001 | AK70: 145.6 | AL70: 235 | AM70: 52 | AN70: 222 | AO70: 0. | AP70: 53 | AQ70: 今飞转债!
A71: 163 | B71: 128116 | C71: 瑞达转债! | D71: 2961 | E71: 瑞达期货 | F71: 金融 | G71: 期货行业 | H71: 102.47 | I71: 1.1999999999999999e-003 | J71: -7.8000000000000005e-003 | K71: 20.57 | L71: -2.7000000000000003e-002 | M71: 114.9 | N71: 29.55 | O71: 0.47200000000000003 | P71: 69.61 | Q71: 转股中 | R71: 4.95年 | S71: 2.95年 | T71: 6.5 | U71: 2.4 | V71: 4.0000000000000001e-003 | W71: 7.0999999999999994e-002 | X71: 4.9000000000000002e-002 | Y71: 92 | Z71: 4.67 | AA71: 2.3799999999999998e-002 | AB71: 1.8200000000000001e-002 | AC71: 2.7000000000000001e-003 | AD71: 5.9999999999999995e-004 | AE71: 91.17 | AF71: 94.42 | AG71: 0.25 | AH71: AA | AI71: 4.1200000000000001e-002 | AJ71: =H71+100*O71 -> 149.67000000000002 | AK71: 135.3 | AL71: 145 | AM71: 40.9 | AN71: 146 | AO71: -3.1e-002 | AP71: 18 | AQ71: 瑞达转债!
A72: 135 | B72: 113598 | C72: 法兰转债 | D72: 603966 | E72: 法兰泰克 | F72: 机械装备 | G72: 工程机械 | H72: 107.98 | I72: -4.1999999999999997e-003 | J72: -3.0999999999999999e-003 | K72: 11.5 | L72: -1.54e-002 | M72: 121.2 | N72: 13.88 | O72: 0.30299999999999999 | P72: 82.85 | Q72: 转股中 | R72: 5年14天 | S72: 3年15天 | T72: 2.75 | U72: 3 | V72: 1.e-002 | W72: 0.111 | X72: 9.1999999999999998e-002 | Y72: 25 | Z72: 2.12 | AA72: 2.3700000000000002e-002 | AB72: 1.6299999999999999e-002 | AC72: -1.1399999999999999e-002 | AD72: -1.3899999999999999e-002 | AE72: 85.69 | AF72: 89.54 | AG72: 0.47 | AH72: AA- | AI72: 6.3500000000000001e-002 | AJ72: =H72+100*O72 -> 138.28 | AK72: 133.1 | AL72: 125 | AM72: 43.6 | AN72: 165 | AO72: -4.7e-002 | AP72: 11 | AQ72: 法兰转债
A73: 151 | B73: 113593 | C73: 沪工转债! | D73: 603131 | E73: 上海沪工 | F73: 机械装备 | G73: 通用设备 | H73: 108.8 | I73: 6.3e-003 | J73: -4.1999999999999997e-003 | K73: 17.03 | L73: 4.0999999999999995e-003 | M73: 121.6 | N73: 21.12 | O73: 0.34899999999999998 | P73: 80.63 | Q73: 转股中 | R73: 5年3.1天 | S73: 3年4.1天 | T73: 4 | U73: 3.1 | V73: 6.9999999999999993e-003 | W73: 7.400000000000001e-002 | X73: 5.9999999999999998e-002 | Y73: 54 | Z73: 4.12 | AA73: 2.3e-002 | AB73: 1.54e-002 | AC73: -1.24e-002 | AD73: -1.52e-002 | AE73: 83.5 | AF73: 85.63 | AG73: 0.5 | AH73: A+ | AI73: 7.4499999999999997e-002 | AJ73: =H73+100*O73 -> 143.69999999999999 | AK73: 137 | AL73: 165 | AM73: 51.3 | AN73: 220 | AO73: -1.3999999999999999e-002 | AP73: 10 | AQ73: 沪工转债!
A74: 145 | B74: 113037 | C74: 紫银转债! | D74: 601860 | E74: 紫金银行 | F74: 金融 | G74: 银行行业 | H74: 103.72 | I74: 2.5000000000000001e-003 | J74: -5.8999999999999999e-003 | K74: 3.53 | L74: -1.1200000000000002e-002 | M74: 115.8 | N74: 4.65 | O74: 0.36599999999999999 | P74: 75.91 | Q74: 转股中 | R74: 5年6.1天 | S74: 无权 | T74: 45 | U74: 59 | V74: 1.3000000000000001e-002 | W74: 0.34799999999999998 | X74: 0.26400000000000001 | Y74: 129 | Z74: 0.88 | AA74: 2.2700000000000001e-002 | AB74: 1.6899999999999998e-002 | AC74: 无权 | AD74: 无权 | AE74: 无权 | AF74: 95.76 | AG74: 0.3 | AH74: AA+ | AI74: 3.95e-002 | AJ74: =H74+100*O74 -> 140.31999999999999 | AK74: 131.5 | AL74: 109 | AM74: 35.8 | AN74: 79 | AO74: -2.2000000000000002e-002 | AP74: 21 | AQ74: 紫银转债!
A75: 259 | B75: 128072 | C75: 翔鹭转债! | D75: 2842 | E75: 翔鹭钨业 | F75: 有色金属 | G75: 小金属 | H75: 105.25 | I75: 5.3e-003 | J75: -7.9000000000000008e-003 | K75: 10.14 | L75: -1.0700000000000001e-002 | M75: 115.1 | N75: 15.36 | O75: 0.59399999999999997 | P75: 66.02 | Q75: 转股中 | R75: 4年34天 | S75: 2年35天 | T75: 3.02 | U75: 28 | V75: 8.8000000000000009e-002 | W75: 0.109 | X75: 7.2000000000000008e-002 | Y75: 28 | Z75: 2.98 | AA75: 2.2599999999999999e-002 | AB75: 1.5800000000000002e-002 | AC75: -7.8000000000000005e-003 | AD75: -1.0700000000000001e-002 | AE75: 90.38 | AF75: 90.43 | AG75: 0.25 | AH75: AA- | AI75: 6.2199999999999998e-002 | AJ75: =H75+100*O75 -> 164.65000000000001 | AK75: 144.5 | AL75: 232 | AM75: 54.1 | AN75: 234 | AO75: 8.900000000000001e-002 | AP75: 29 | AQ75: 翔鹭转债!
A76: 73 | B76: 127027 | C76: 靖远转债! | D76: 552 | E76: 靖远煤电 | F76: 煤炭 | G76: 煤炭开采 | H76: 102.5 | I76: 1.2800000000000001e-002 | J76: -7.8000000000000005e-003 | K76: 2.92 | L76: 1.04e-002 | M76: 115.3 | N76: 3.23 | O76: 0.13400000000000001 | P76: 90.4 | Q76: 转股中 | R76: 5.40年 | S76: 3.40年 | T76: 28 | U76: 83 | V76: 2.8999999999999998e-002 | W76: 0.41899999999999998 | X76: 0.379 | Y76: 67 | Z76: 0.84 | AA76: 2.2499999999999999e-002 | AB76: 1.72e-002 | AC76: 3.5999999999999999e-003 | AD76: 1.5e-003 | AE76: 90.53 | AF76: 93.93 | AG76: 0.49 | AH76: AA+ | AI76: 3.95e-002 | AJ76: =H76+100*O76 -> 115.90000000000001 | AK76: 114.6 | AL76: 8 | AM76: 20.7 | AN76: 8 | AO76: -8.0000000000000002e-003 | AP76: 42 | AQ76: 靖远转债!
A77: 235 | B77: 128083 | C77: 新北转债! | D77: 2376 | E77: 新北洋 | F77: 电子 | G77: 电子产品 | H77: 104.687 | I77: 3.2000000000000002e-003 | J77: -4.7999999999999996e-003 | K77: 8.97 | L77: -5.5000000000000005e-003 | M77: 114.9 | N77: 11.45 | O77: 0.33600000000000002 | P77: 78.34 | Q77: 转股中 | R77: 4.41年 | S77: 2.41年 | T77: 8.77 | U77: 1.4 | V77: 2.e-003 | W77: 0.14699999999999999 | X77: 0.115 | Y77: 60 | Z77: 1.72 | AA77: 2.18e-002 | AB77: 1.55e-002 | AC77: -4.7999999999999996e-003 | AD77: -7.4000000000000003e-003 | AE77: 93.29 | AF77: 96.53 | AG77: 0.31 | AH77: AA | AI77: 4.1200000000000001e-002 | AJ77: =H77+100*O77 -> 138.28700000000001 | AK77: 131 | AL77: 102 | AM77: 34.5 | AN77: 71 | AO77: -1.9e-002 | AP77: 19 | AQ77: 新北转债!
A78: 152 | B78: 128120 | C78: 联诚转债! | D78: 2921 | E78: 联诚精密 | F78: 汽车 | G78: 零部件制 | H78: 106.754 | I78: 1.6000000000000001e-003 | J78: -4.3e-003 | K78: 15.2 | L78: -4.5999999999999999e-003 | M78: 118.4 | N78: 18.44 | O78: 0.29499999999999998 | P78: 82.43 | Q78: 转股中 | R78: 5年0.1天 | S78: 3年1.1天 | T78: 2.6 | U78: 1.9 | V78: 6.9999999999999993e-003 | W78: 0.161 | X78: 0.13300000000000001 | Y78: 16 | Z78: 1.57 | AA78: 2.1499999999999998e-002 | AB78: 1.4800000000000001e-002 | AC78: -6.6e-003 | AD78: -9.300000000000001e-003 | AE78: 81.18 | AF78: 79.81 | AG78: 0.6 | AH78: A | AI78: 8.4499999999999992e-002 | AJ78: =H78+100*O78 -> 136.25400000000002 | AK78: 131.1 | AL78: 103 | AM78: 49.9 | AN78: 213 | AO78: -2.7000000000000003e-002 | AP78: 21 | AQ78: 联诚转债!
A79: 137 | B79: 113597 | C79: 佳力转债! | D79: 603912 | E79: 佳力图 | F79: 机械装备 | G79: 专用设备 | H79: 112.18 | I79: 0. | J79: -8.3999999999999995e-003 | K79: 17.34 | L79: -2.3099999999999999e-002 | M79: 124.5 | N79: 23.15 | O79: 0.498 | P79: 74.9 | Q79: 转股中 | R79: 5年13天 | S79: 3年14天 | T79: 3 | U79: 49 | V79: 0.14599999999999999 | W79: 8.0000000000000002e-002 | X79: 5.9999999999999998e-002 | Y79: 38 | Z79: 4.05 | AA79: 2.1400000000000002e-002 | AB79: 1.3000000000000001e-002 | AC79: -2.2400000000000003e-002 | AD79: -2.4900000000000002e-002 | AE79: 85.96 | AF79: 92.01 | AG79: 0.36 | AH79: AA- | AI79: 6.3500000000000001e-002 | AJ79: =H79+100*O79 -> 161.98000000000002 | AK79: 149.5 | AL79: 260 | AM79: 57.4 | AN79: 252 | AO79: 5.5e-002 | AP79: 16 | AQ79: 佳力转债!
A80: 67 | B80: 123087 | C80: 明电转债! | D80: 300739 | E80: 明阳电路 | F80: 电子 | G80: 元器件制 | H80: 108.383 | I80: 3.4000000000000002e-003 | J80: 3.7000000000000002e-003 | K80: 15.6 | L80: 1.1699999999999999e-002 | M80: 121.2 | N80: 16.32 | O80: 0.13400000000000001 | P80: 95.59 | Q80: 转股中 | R80: 5.41年 | S80: 4.42年 | T80: 6.73 | U80: 16 | V80: 2.2000000000000002e-002 | W80: 0.155 | X80: 0.14800000000000002 | Y80: 44 | Z80: 3.08 | AA80: 2.1299999999999999e-002 | AB80: 1.44e-002 | AC80: -3.4999999999999996e-003 | AD80: -6.1999999999999998e-003 | AE80: 80.89 | AF80: 87.5 | AG80: 0.61 | AH80: AA- | AI80: 6.3500000000000001e-002 | AJ80: =H80+100*O80 -> 121.783 | AK80: 121.2 | AL80: 22 | AM80: 33.7 | AN80: 63 | AO80: -4.4000000000000004e-002 | AP80: 18 | AQ80: 明电转债!
A81: 53 | B81: 113619 | C81: 世运转债! | D81: 603920 | E81: 世运电路 | F81: 电子 | G81: 元器件制 | H81: 102.81 | I81: -3.7000000000000002e-003 | J81: 3.8e-003 | K81: 12.28 | L81: 8.0000000000000004e-004 | M81: 115.2 | N81: 19.92 | O81: 0.66799999999999993 | P81: 61.65 | Q81: 10天 | R81: 5.51年 | S81: 3.52年 | T81: 10 | U81: 18 | V81: 1.7000000000000001e-002 | W81: 0.153 | X81: 9.4e-002 | Y81: 65 | Z81: 1.84 | AA81: 2.1299999999999999e-002 | AB81: 1.6200000000000003e-002 | AC81: 2.3999999999999998e-003 | AD81: 4.0000000000000002e-004 | AE81: 89.1 | AF81: 91.98 | AG81: 0.18 | AH81: AA | AI81: 4.2500000000000003e-002 | AJ81: =H81+100*O81 -> 169.61000000000001 | AK81: 144 | AL81: 229 | AM81: 52 | AN81: 223 | AO81: -7.8e-002 | AP81: 4 | AQ81: 世运转债!
A82: 349 | B82: 128023 | C82: 亚太转债! | D82: 2284 | E82: 亚太股份 | F82: 汽车 | G82: 零部件制 | H82: 106.021 | I82: -1.e-004 | J82: -3.7000000000000002e-003 | K82: 7.56 | L82: -2.9500000000000002e-002 | M82: 111.3 | N82: 10.34 | O82: 0.45000000000000001 | P82: 73.11 | Q82: 转股中 | R82: 2.39年 | S82: 0.39年 | T82: 9.99 | U82: 7.6 | V82: 6.9999999999999993e-003 | W82: 0.17899999999999999 | X82: 0.13100000000000001 | Y82: 56 | Z82: 2.24 | AA82: 2.1000000000000001e-002 | AB82: 1.2e-002 | AC82: -7.1099999999999997e-002 | AD82: -7.6999999999999999e-002 | AE82: 99.66 | AF82: 101.67 | AG82: 0.13 | AH82: AA | AI82: 3.9399999999999998e-002 | AJ82: =H82+100*O82 -> 151.02100000000002 | AK82: 138.9 | AL82: 186 | AM82: 37.3 | AN82: 106 | AO82: -9.1999999999999998e-002 | AP82: 66 | AQ82: 亚太转债!
A83: 272 | B83: 110058 | C83: 永鼎转债! | D83: 600105 | E83: 永鼎股份 | F83: 通信互联 | G83: 通信设备 | H83: 106.03 | I83: 2.8000000000000004e-003 | J83: -5.3e-003 | K83: 3.75 | L83: -7.9000000000000008e-003 | M83: 114.3 | N83: 5.04 | O83: 0.42499999999999999 | P83: 74.4 | Q83: 转股中 | R83: 3.75年 | S83: 1.75年 | T83: 2.61 | U83: 5.2 | V83: 1.9e-002 | W83: 5.0000000000000003e-002 | X83: 3.7999999999999999e-002 | Y83: 52 | Z83: 1.86 | AA83: 2.06e-002 | AB83: 1.3600000000000001e-002 | AC83: -1.61e-002 | AD83: -1.89e-002 | AE83: 91.65 | AF83: 91.55 | AG83: 0.32 | AH83: AA- | AI83: 6.2199999999999998e-002 | AJ83: =H83+100*O83 -> 148.53 | AK83: 137.7 | AL83: 171 | AM83: 46 | AN83: 187 | AO83: -2.5000000000000001e-002 | AP83: 47 | AQ83: 永鼎转债!
A84: 216 | B84: 113565 | C84: 宏辉转债 | D84: 603336 | E84: 宏辉果蔬 | F84: 农业 | G84: 农产品加 | H84: 107.47 | I84: 1.9e-003 | J84: -2.5999999999999999e-003 | K84: 6.47 | L84: -1.5e-003 | M84: 117.8 | N84: 7.64 | O84: 0.26899999999999996 | P84: 84.69 | Q84: 转股中 | R84: 4.61年 | S84: 2.62年 | T84: 2.25 | U84: 4 | V84: 1.7000000000000001e-002 | W84: 7.9000000000000001e-002 | X84: 6.7000000000000004e-002 | Y84: 28 | Z84: 2.09 | AA84: 2.0499999999999997e-002 | AB84: 1.3600000000000001e-002 | AC84: -1.2800000000000001e-002 | AD84: -1.54e-002 | AE84: 87.85 | AF84: 89.74 | AG84: 0.48 | AH84: AA- | AI84: 6.2199999999999998e-002 | AJ84: =H84+100*O84 -> 134.37 | AK84: 130.3 | AL84: 92 | AM84: 40.5 | AN84: 142 | AO84: -7.9000000000000001e-002 | AP84: 25 | AQ84: 宏辉转债
A85: 232 | B85: 128087 | C85: 孚日转债! | D85: 2083 | E85: 孚日股份 | F85: 服装纺织 | G85: 家纺 | H85: 103.546 | I85: 5.8999999999999999e-003 | J85: -4.5000000000000005e-003 | K85: 4.27 | L85: 2.3e-003 | M85: 112.9 | N85: 4.5 | O85: 9.0999999999999998e-002 | P85: 94.89 | Q85: 转股中 | R85: 4.42年 | S85: 2.42年 | T85: 6.5 | U85: 10 | V85: 1.4999999999999999e-002 | W85: 0.16800000000000001 | X85: 0.159 | Y85: 39 | Z85: 1.07 | AA85: 2.0199999999999999e-002 | AB85: 1.47e-002 | AC85: -5.9999999999999995e-004 | AD85: -3.0999999999999999e-003 | AE85: 88.59 | AF85: 86.97 | AG85: 0.61 | AH85: AA- | AI85: 6.2199999999999998e-002 | AJ85: =H85+100*O85 -> 112.646 | AK85: 112.2 | AL85: 7 | AM85: 23.6 | AN85: 15 | AO85: -1.e-002 | AP85: 66 | AQ85: 孚日转债!
A86: 120 | B86: 128131 | C86: 崇达转2! | D86: 2815 | E86: 崇达技术 | F86: 电子 | G86: 元器件制 | H86: 104.16 | I86: 1.5e-003 | J86: -4.0999999999999995e-003 | K86: 12.64 | L86: -1.3300000000000001e-002 | M86: 115.2 | N86: 19.38 | O86: 0.59699999999999998 | P86: 65.22 | Q86: 转股中 | R86: 5年52天 | S86: 3年53天 | T86: 14 | U86: 2.3 | V86: 2.e-003 | W86: 0.126 | X86: 8.199999999999999e-002 | Y86: 111 | Z86: 2.65 | AA86: 2.0199999999999999e-002 | AB86: 1.47e-002 | AC86: -1.2999999999999999e-003 | AD86: -3.4999999999999996e-003 | AE86: 90.48 | AF86: 93.41 | AG86: 0.19 | AH86: AA | AI86: 4.2500000000000003e-002 | AJ86: =H86+100*O86 -> 163.85999999999999 | AK86: 143.1 | AL86: 222 | AM86: 49.7 | AN86: 208 | AO86: 1.e-002 | AP86: 10 | AQ86: 崇达转2!
A87: 149 | B87: 113594 | C87: 淳中转债! | D87: 603516 | E87: 淳中科技 | F87: 电子 | G87: 电子产品 | H87: 110.21 | I87: -1.e-003 | J87: 1.4000000000000002e-003 | K87: 21.32 | L87: 8.9999999999999998e-004 | M87: 121.4 | N87: 27.84 | O87: 0.439 | P87: 76.58 | Q87: 转股中 | R87: 5年4.1天 | S87: 3年5.1天 | T87: 3 | U87: 1.4 | V87: 4.0000000000000001e-003 | W87: 7.4999999999999997e-002 | X87: 5.7999999999999996e-002 | Y87: 40 | Z87: 2.9 | AA87: 2.e-002 | AB87: 1.2500000000000001e-002 | AC87: -1.66e-002 | AD87: -1.9299999999999998e-002 | AE87: 83.49 | AF87: 85.5 | AG87: 0.46 | AH87: A+ | AI87: 7.4499999999999997e-002 | AJ87: =H87+100*O87 -> 154.10999999999999 | AK87: 143.8 | AL87: 228 | AM87: 58.3 | AN87: 261 | AO87: 6.9999999999999993e-003 | AP87: 8 | AQ87: 淳中转债!
A88: 334 | B88: 113505 | C88: 杭电转债! | D88: 603618 | E88: 杭电股份 | F88: 能源电力 | G88: 电力设备 | H88: 105.8 | I88: 4.4000000000000003e-003 | J88: -4.8999999999999998e-003 | K88: 6.16 | L88: -1.6000000000000001e-003 | M88: 111.3 | N88: 7.08 | O88: 0.21600000000000003 | P88: 87.01 | Q88: 转股中 | R88: 2.64年 | S88: 0.64年 | T88: 7.5 | U88: 6.7 | V88: 8.0000000000000002e-003 | W88: 0.17600000000000002 | X88: 0.153 | Y88: 43 | Z88: 1.58 | AA88: 1.9699999999999999e-002 | AB88: 1.1699999999999999e-002 | AC88: -4.6900000000000004e-002 | AD88: -5.1100000000000007e-002 | AE88: 98.69 | AF88: 100.69 | AG88: 0.3 | AH88: AA | AI88: 3.9399999999999998e-002 | AJ88: =H88+100*O88 -> 127.40000000000001 | AK88: 124.6 | AL88: 45 | AM88: 23.9 | AN88: 17 | AO88: -3.6000000000000004e-002 | AP88: 44 | AQ88: 杭电转债!
A89: 49 | B89: 123096 | C89: 思创转债! | D89: 300078 | E89: 思创医惠 | F89: 通信互联 | G89: 物联网 | H89: 111.7 | I89: -7.6e-003 | J89: -9.1999999999999998e-003 | K89: 8.02 | L89: -2.7900000000000001e-002 | M89: 124 | N89: 8.26 | O89: 0.14999999999999999 | P89: 97.09 | Q89: 17天 | R89: 5.53年 | S89: 3.53年 | T89: 8.17 | U89: 22 | V89: 2.4e-002 | W89: 0.11699999999999999 | X89: 0.114 | Y89: 70 | Z89: 2.34 | AA89: 1.9400000000000001e-002 | AB89: 1.2e-002 | AC89: -1.95e-002 | AD89: -2.1499999999999998e-002 | AE89: 82.96 | AF89: 88.83 | AG89: 0.6 | AH89: AA- | AI89: 6.3500000000000001e-002 | AJ89: =H89+100*O89 -> 126.7 | AK89: 126.3 | AL89: 56 | AM89: 37.5 | AN89: 110 | AO89: 7.5999999999999998e-002 | AP89: 6 | AQ89: 思创转债!
A90: 69 | B90: 113044 | C90: 大秦转债! | D90: 601006 | E90: 大秦铁路 | F90: 铁路 | G90: 铁路运输 | H90: 103.13 | I90: -4.0000000000000002e-004 | J90: -3.0000000000000001e-003 | K90: 6.04 | L90: -8.199999999999999e-003 | M90: 114.1 | N90: 7.18 | O90: 0.22600000000000001 | P90: 84.12 | Q90: 转股中 | R90: 5.41年 | S90: 3.41年 | T90: 320 | U90: 129 | V90: 4.0000000000000001e-003 | W90: 0.35600000000000004 | X90: 0.29999999999999999 | Y90: 898 | Z90: 0.74 | AA90: 1.9199999999999998e-002 | AB90: 1.44e-002 | AC90: 2.2000000000000001e-003 | AD90: 1.e-004 | AE90: 91.2 | AF90: 93.87 | AG90: 0.41 | AH90: AAA | AI90: 3.7499999999999999e-002 | AJ90: =H90+100*O90 -> 125.72999999999999 | AK90: 122.1 | AL90: 25 | AM90: 28.3 | AN90: 30 | AO90: -5.7000000000000002e-002 | AP90: 16 | AQ90: 大秦转债!
A91: 113 | B91: 113604 | C91: 多伦转债! | D91: 603528 | E91: 多伦科技 | F91: 计算机及 | G91: 软件开发 | H91: 106.47 | I91: 3.2000000000000002e-003 | J91: -7.7000000000000002e-003 | K91: 8.2 | L91: -9.7000000000000003e-003 | M91: 117.3 | N91: 10.4 | O91: 0.34999999999999998 | P91: 78.85 | Q91: 转股中 | R91: 5.24年 | S91: 3.24年 | T91: 6.4 | U91: 1.3 | V91: 2.e-003 | W91: 0.125 | X91: 9.8000000000000004e-002 | Y91: 51 | Z91: 3.09 | AA91: 1.9e-002 | AB91: 1.3100000000000001e-002 | AC91: -7.4999999999999997e-003 | AD91: -9.5999999999999992e-003 | AE91: 84.34 | AF91: 85.53 | AG91: 0.47 | AH91: AA- | AI91: 6.3500000000000001e-002 | AJ91: =H91+100*O91 -> 141.47 | AK91: 134.1 | AL91: 135 | AM91: 48.6 | AN91: 206 | AO91: -4.5999999999999999e-002 | AP91: 7 | AQ91: 多伦转债!
A92: 121 | B92: 123065 | C92: 宝莱转债! | D92: 300246 | E92: 宝莱特 | F92: 医药 | G92: 医疗器械 | H92: 110.6 | I92: -3.5999999999999999e-003 | J92: 2.3999999999999998e-003 | K92: 17.87 | L92: -1.8100000000000002e-002 | M92: 121.4 | N92: 40.14 | O92: 1.48 | P92: 44.52 | Q92: 转股中 | R92: 5年49天 | S92: 3年50天 | T92: 2.19 | U92: 32 | V92: 0.13300000000000001 | W92: 8.4000000000000005e-002 | X92: 3.7000000000000005e-002 | Y92: 26 | Z92: 2.94 | AA92: 1.8700000000000001e-002 | AB92: 1.1399999999999999e-002 | AC92: -1.77e-002 | AD92: -2.0199999999999999e-002 | AE92: 85.34 | AF92: 89.17 | AG92: 0.06 | AH92: AA- | AI92: 6.3500000000000001e-002 | AJ92: =H92+100*O92 -> 258.60000000000002 | AK92: 176.7 | AL92: 318 | AM92: 87.5 | AN92: 323 | AO92: -7.8e-002 | AP92: 18 | AQ92: 宝莱转债!
A93: 13 | B93: 127034 | C93: 绿茵转债 | D93: 2887 | E93: 绿茵生态 | F93: 城市公用 | G93: 生态环境 | H93: 107.107 | I93: 3.8e-003 | J93: -1.7299999999999999e-002 | K93: 11.7 | L93: -2.1700000000000001e-002 | M93: 119 | N93: 12.38 | O93: 0.13300000000000001 | P93: 94.51 | Q93: 3月28天 | R93: 5.79年 | S93: 3.79年 | T93: 7.12 | U93: 23 | V93: 2.9999999999999999e-002 | W93: 0.19500000000000001 | X93: 0.184 | Y93: 37 | Z93: 1.7 | AA93: 1.8700000000000001e-002 | AB93: 1.29e-002 | AC93: -7.7000000000000002e-003 | AD93: -9.5999999999999992e-003 | AE93: 81.65 | AF93: 83.93 | AG93: 0.62 | AH93: AA- | AI93: 6.3500000000000001e-002 | AJ93: =H93+100*O93 -> 120.407 | AK93: 119.7 | AL93: 15 | AM93: 35.8 | AN93: 80 | AO93: 5.5e-002 | AP93: 18 | AQ93: 绿茵转债
A94: 288 | B94: 110056 | C94: 亨通转债! | D94: 600487 | E94: 亨通光电 | F94: 通信互联 | G94: 通信设备 | H94: 106.96 | I94: 2.0000000000000001e-004 | J94: -1.e-003 | K94: 12.09 | L94: -3.3e-003 | M94: 114.3 | N94: 15.01 | O94: 0.32799999999999996 | P94: 80.55 | Q94: 转股中 | R94: 3.67年 | S94: 1.67年 | T94: 17.1 | U94: 5 | V94: 3.0000000000000001e-003 | W94: 5.9999999999999998e-002 | X94: 4.8000000000000001e-002 | Y94: 286 | Z94: 1.42 | AA94: 1.8600000000000002e-002 | AB94: 1.1399999999999999e-002 | AC94: -2.1499999999999998e-002 | AD94: -2.4399999999999998e-002 | AE94: 96 | AF94: 99.86 | AG94: 0.26 | AH94: AA+ | AI94: 3.8199999999999998e-002 | AJ94: =H94+100*O94 -> 139.75999999999999 | AK94: 133.4 | AL94: 130 | AM94: 33.5 | AN94: 60 | AO94: 3.9e-002 | AP94: 28 | AQ94: 亨通转债!
A95: 266 | B95: 113027 | C95: 华钰转债!! | D95: 601020 | E95: ST华钰 | F95: 有色金属 | G95: 锌铅镍锡 | H95: 106.47 | I95: 1.5300000000000001e-002 | J95: 7.9000000000000008e-003 | K95: 8.59 | L95: 4.3700000000000003e-002 | M95: 114.3 | N95: 10.17 | O95: 0.26100000000000001 | P95: 84.46 | Q95: 转股中 | R95: 3.91年 | S95: 1.91年 | T95: 3.25 | U95: 48 | V95: 0.13699999999999998 | W95: 6.8000000000000005e-002 | X95: 5.7999999999999996e-002 | Y95: 48 | Z95: 1.92 | AA95: 1.8600000000000002e-002 | AB95: 1.1899999999999999e-002 | AC95: -1.6799999999999999e-002 | AD95: -1.9400000000000001e-002 | AE95: 87.16 | AF95: 84.11 | AG95: 0.53 | AH95: A | AI95: 8.3199999999999996e-002 | AJ95: =H95+100*O95 -> 132.56999999999999 | AK95: 128.5 | AL95: 75 | AM95: 41.3 | AN95: 147 | AO95: 0.157 | AP95: 47 | AQ95: 华钰转债!!
A96: 200 | B96: 110068 | C96: 龙净转债! | D96: 600388 | E96: 龙净环保 | F96: 城市公用 | G96: 三废处理 | H96: 105.45 | I96: 6.9999999999999993e-003 | J96: -7.4000000000000003e-003 | K96: 8.8 | L96: -1.1000000000000001e-003 | M96: 114.8 | N96: 10.55 | O96: 0.26400000000000001 | P96: 83.41 | Q96: 转股中 | R96: 4.69年 | S96: 2.69年 | T96: 20 | U96: 14 | V96: 6.9999999999999993e-003 | W96: 0.21299999999999999 | X96: 0.17699999999999999 | Y96: 94 | Z96: 1.55 | AA96: 1.8600000000000002e-002 | AB96: 1.2800000000000001e-002 | AC96: -7.1999999999999998e-003 | AD96: -9.4999999999999998e-003 | AE96: 92.9 | AF96: 96.62 | AG96: 0.37 | AH96: AA+ | AI96: 3.8199999999999998e-002 | AJ96: =H96+100*O96 -> 131.84999999999999 | AK96: 127.5 | AL96: 64 | AM96: 30.9 | AN96: 41 | AO96: 2.5000000000000001e-002 | AP96: 33 | AQ96: 龙净转债!
A97: 139 | B97: 128124 | C97: 科华转债! | D97: 2022 | E97: 科华生物 | F97: 医药 | G97: 生物制药 | H97: 100.698 | I97: 6.0000000000000001e-003 | J97: -6.8999999999999999e-003 | K97: 13.88 | L97: -4.3e-003 | M97: 110.3 | N97: 21.3 | O97: 0.54500000000000004 | P97: 65.16 | Q97: 转股中 | R97: 5年11天 | S97: 3年12天 | T97: 7.38 | U97: 25 | V97: 3.4000000000000002e-002 | W97: 0.10300000000000001 | X97: 6.7000000000000004e-002 | Y97: 71 | Z97: 2.14 | AA97: 1.8600000000000002e-002 | AB97: 1.47e-002 | AC97: 7.3000000000000001e-003 | AD97: 5.4000000000000003e-003 | AE97: 90.32 | AF97: 89.81 | AG97: 0.21 | AH97: AA | AI97: 4.2500000000000003e-002 | AJ97: =H97+100*O97 -> 155.19800000000001 | AK97: 136.2 | AL97: 154 | AM97: 45.9 | AN97: 184 | AO97: -0.19699999999999998 | AP97: 20 | AQ97: 科华转债!
A98: 320 | B98: 123011 | C98: 德尔转债! | D98: 300473 | E98: 德尔股份 | F98: 汽车 | G98: 零部件制 | H98: 110.19 | I98: -7.000000000000001e-004 | J98: 5.0000000000000001e-004 | K98: 23.88 | L98: -8.0000000000000004e-004 | M98: 116.3 | N98: 31.38 | O98: 0.44799999999999995 | P98: 76.1 | Q98: 转股中 | R98: 3年1.1天 | S98: 1年2.1天 | T98: 2.51 | U98: 14 | V98: 5.0000000000000003e-002 | W98: 7.8e-002 | X98: 5.9000000000000004e-002 | Y98: 32 | Z98: 1.46 | AA98: 1.8500000000000003e-002 | AB98: 8.6999999999999994e-003 | AC98: -5.8200000000000002e-002 | AD98: -6.2400000000000004e-002 | AE98: 95.86 | AF98: 97.43 | AG98: 0.25 | AH98: AA- | AI98: 6.2199999999999998e-002 | AJ98: =H98+100*O98 -> 154.99000000000001 | AK98: 144.3 | AL98: 230 | AM98: 46.9 | AN98: 193 | AO98: 6.5000000000000002e-002 | AP98: 41 | AQ98: 德尔转债!
A99: 277 | B99: 113024 | C99: 核建转债! | D99: 601611 | E99: 中国核建 | F99: 建筑 | G99: 建筑工程 | H99: 102.24 | I99: 1.e-003 | J99: -1.e-003 | K99: 6.94 | L99: 0. | M99: 109.3 | N99: 9.7 | O99: 0.42899999999999999 | P99: 71.55 | Q99: 转股中 | R99: 3.73年 | S99: 1.73年 | T99: 30 | U99: 15 | V99: 5.0000000000000001e-003 | W99: 0.16300000000000001 | X99: 0.11699999999999999 | Y99: 184 | Z99: 1.55 | AA99: 1.84e-002 | AB99: 1.3600000000000001e-002 | AC99: 2.8999999999999998e-003 | AD99: 0. | AE99: 96.15 | AF99: 95.98 | AG99: 0.19 | AH99: AAA | AI99: 3.6200000000000003e-002 | AJ99: =H99+100*O99 -> 145.13999999999999 | AK99: 132.9 | AL99: 120 | AM99: 36.8 | AN99: 93 | AO99: -2.9999999999999999e-002 | AP99: 35 | AQ99: 核建转债!
A100: 79 | B100: 123082 | C100: 北陆转债! | D100: 300016 | E100: 北陆药业 | F100: 医药 | G100: 化学制药 | H100: 110.567 | I100: 8.1000000000000013e-003 | J100: -1.4199999999999999e-002 | K100: 8.72 | L100: -9.1000000000000004e-003 | M100: 121.7 | N100: 8.81 | O100: 0.11699999999999999 | P100: 98.98 | Q100: 转股中 | R100: 5.39年 | S100: 3.39年 | T100: 5 | U100: 11 | V100: 2.1000000000000001e-002 | W100: 0.11599999999999999 | X100: 0.115 | Y100: 43 | Z100: 2.6 | AA100: 1.84e-002 | AB100: 1.1299999999999999e-002 | AC100: -1.5600000000000001e-002 | AD100: -1.8000000000000002e-002 | AE100: 81.28 | AF100: 83.41 | AG100: 0.67 | AH100: A+ | AI100: 7.4499999999999997e-002 | AJ100: =H100+100*O100 -> 122.267 | AK100: 122.2 | AL100: 26 | AM100: 38.7 | AN100: 124 | AO100: -4.0999999999999995e-002 | AP100: 13 | AQ100: 北陆转债!
A101: 168 | B101: 128114 | C101: 正邦转债! | D101: 2157 | E101: 正邦科技 | F101: 农业 | G101: 畜牧业 | H101: 105.253 | I101: -1.4000000000000002e-003 | J101: -6.6e-003 | K101: 10.7 | L101: -3.1699999999999999e-002 | M101: 114.9 | N101: 14.76 | O101: 0.45200000000000001 | P101: 72.49 | Q101: 转股中 | R101: 4.92年 | S101: 2.92年 | T101: 16 | U101: 11 | V101: 6.9999999999999993e-003 | W101: 4.7e-002 | X101: 3.4000000000000002e-002 | Y101: 337 | Z101: 1.44 | AA101: 1.83e-002 | AB101: 1.2800000000000001e-002 | AC101: -5.7999999999999996e-003 | AD101: -7.9000000000000008e-003 | AE101: 92.19 | AF101: 95.88 | AG101: 0.25 | AH101: AA+ | AI101: 3.8199999999999998e-002 | AJ101: =H101+100*O101 -> 150.453 | AK101: 138 | AL101: 176 | AM101: 42.1 | AN101: 152 | AO101: -6.4000000000000001e-002 | AP101: 17 | AQ101: 正邦转债!
A102: 133 | B102: 127021 | C102: 特发转2! | D102: 70 | E102: 特发信息 | F102: 通信互联 | G102: 通信设备 | H102: 105.508 | I102: 6.8000000000000005e-003 | J102: -6.4000000000000003e-003 | K102: 7.74 | L102: 2.5999999999999999e-003 | M102: 113.3 | N102: 12.33 | O102: 0.68099999999999994 | P102: 62.77 | Q102: 转股中 | R102: 4年21天 | S102: 2年22天 | T102: 5.5 | U102: 4.6 | V102: 8.0000000000000002e-003 | W102: 8.5999999999999993e-002 | X102: 5.4000000000000006e-002 | Y102: 64 | Z102: 2.18 | AA102: 1.8000000000000002e-002 | AB102: 1.1899999999999999e-002 | AC102: -1.49e-002 | AD102: -1.67e-002 | AE102: 93.33 | AF102: 96.39 | AG102: 0.12 | AH102: AA | AI102: 4.1200000000000001e-002 | AJ102: =H102+100*O102 -> 173.608 | AK102: 148.2 | AL102: 251 | AM102: 51.8 | AN102: 221 | AO102: -4.4000000000000004e-002 | AP102: 12 | AQ102: 特发转2!
A103: 332 | B103: 127006 | C103: 敖东转债! | D103: 623 | E103: 吉林敖东 | F103: 金融 | G103: 证券行业 | H103: 102.5 | I103: 1.5e-003 | J103: -4.0000000000000002e-004 | K103: 15.28 | L103: 5.8999999999999999e-003 | M103: 107.4 | N103: 20.22 | O103: 0.35600000000000004 | P103: 75.57 | Q103: 转股中 | R103: 2.66年 | S103: 0.66年 | T103: 24.1 | U103: 5.8 | V103: 2.e-003 | W103: 0.13500000000000001 | X103: 0.10199999999999999 | Y103: 178 | Z103: 0.77 | AA103: 1.7899999999999999e-002 | AB103: 1.2500000000000001e-002 | AC103: -1.7000000000000001e-002 | AD103: -1.95e-002 | AE103: 98.14 | AF103: 97.77 | AG103: 0.17 | AH103: AA+ | AI103: 3.6400000000000002e-002 | AJ103: =H103+100*O103 -> 138.09999999999999 | AK103: 129.4 | AL103: 82 | AM103: 31.3 | AN103: 47 | AO103: -1.e-003 | AP103: 28 | AQ103: 敖东转债!
A104: 252 | B104: 128076 | C104: 金轮转债! | D104: 2722 | E104: 金轮股份 | F104: 机械装备 | G104: 专用设备 | H104: 106.8 | I104: 6.1999999999999998e-003 | J104: -6.1999999999999998e-003 | K104: 12.13 | L104: 0. | M104: 114.9 | N104: 14.66 | O104: 0.29100000000000004 | P104: 82.74 | Q104: 转股中 | R104: 4.24年 | S104: 2.25年 | T104: 2.14 | U104: 3.1 | V104: 1.3000000000000001e-002 | W104: 0.10000000000000001 | X104: 8.3000000000000004e-002 | Y104: 21 | Z104: 1.13 | AA104: 1.77e-002 | AB104: 1.1299999999999999e-002 | AC104: -1.3500000000000002e-002 | AD104: -1.61e-002 | AE104: 89.54 | AF104: 89.44 | AG104: 0.45 | AH104: AA- | AI104: 6.2199999999999998e-002 | AJ104: =H104+100*O104 -> 135.90000000000001 | AK104: 130.9 | AL104: 100 | AM104: 41.3 | AN104: 148 | AO104: -3.4000000000000002e-002 | AP104: 40 | AQ104: 金轮转债!
A105: 138 | B105: 123063 | C105: 大禹转债 | D105: 300021 | E105: 大禹节水 | F105: 化工 | G105: 橡胶塑料 | H105: 116.1 | I105: 1.04e-002 | J105: -6.7000000000000002e-003 | K105: 5.25 | L105: 5.6999999999999993e-003 | M105: 126.5 | N105: 4.83 | O105: 6.8000000000000005e-002 | P105: 108.7 | Q105: 转股中 | R105: 5年11天 | S105: 4年12天 | T105: 6.35 | U105: 24 | V105: 3.3000000000000002e-002 | W105: 0.151 | X105: 0.16399999999999998 | Y105: 42 | Z105: 2.76 | AA105: 1.7600000000000001e-002 | AB105: 8.6999999999999994e-003 | AC105: -1.9599999999999999e-002 | AD105: -2.2599999999999999e-002 | AE105: 83.06 | AF105: 93.49 | AG105: 0.64 | AH105: AA- | AI105: 6.3500000000000001e-002 | AJ105: =H105+100*O105 -> 122.89999999999999 | AK105: 123.5 | AL105: 37 | AM105: 30 | AN105: 35 | AO105: 4.0000000000000001e-003 | AP105: 18 | AQ105: 大禹转债
A106: 260 | B106: 128071 | C106: 合兴转债! | D106: 2228 | E106: 合兴包装 | F106: 造纸包装 | G106: 包装材料 | H106: 107.096 | I106: 4.0999999999999995e-003 | J106: 1.4000000000000002e-003 | K106: 3.63 | L106: 1.3999999999999999e-002 | M106: 114.8 | N106: 4.18 | O106: 0.23300000000000001 | P106: 86.84 | Q106: 转股中 | R106: 4年30天 | S106: 2年31天 | T106: 3 | U106: 8.6 | V106: 2.7000000000000003e-002 | W106: 6.7000000000000004e-002 | X106: 5.7999999999999996e-002 | Y106: 45 | Z106: 1.3 | AA106: 1.7500000000000002e-002 | AB106: 1.09e-002 | AC106: -1.61e-002 | AD106: -1.89e-002 | AE106: 94.42 | AF106: 97.7 | AG106: 0.39 | AH106: AA | AI106: 4.1200000000000001e-002 | AJ106: =H106+100*O106 -> 130.39600000000002 | AK106: 127.3 | AL106: 63 | AM106: 29.7 | AN106: 34 | AO106: -1.9e-002 | AP106: 24 | AQ106: 合兴转债!
A107: 350 | B107: 128022 | C107: 众信转债! | D107: 2707 | E107: 众信旅游 | F107: 旅游餐饮 | G107: 旅游 | H107: 104.505 | I107: 1.9e-003 | J107: -1.9e-003 | K107: 5.38 | L107: 5.6000000000000008e-003 | M107: 108.8 | N107: 7.92 | O107: 0.53799999999999992 | P107: 67.93 | Q107: 转股中 | R107: 2.38年 | S107: 0.38年 | T107: 4.56 | U107: 8.1 | V107: 1.7000000000000001e-002 | W107: 9.3000000000000013e-002 | X107: 6.3e-002 | Y107: 49 | Z107: 7.3 | AA107: 1.7399999999999999e-002 | AB107: 1.03e-002 | AC107: -5.1500000000000004e-002 | AD107: -5.6799999999999996e-002 | AE107: 97.33 | AF107: 90.61 | AG107: 0 | AH107: A | AI107: 8.14e-002 | AJ107: =H107+100*O107 -> 158.30499999999998 | AK107: 141.1 | AL107: 208 | AM107: 43.8 | AN107: 166 | AO107: -5.7000000000000002e-002 | AP107: 32 | AQ107: 众信转债!
A108: 213 | B108: 113567 | C108: 君禾转债! | D108: 603617 | E108: 君禾股份 | F108: 机械装备 | G108: 通用设备 | H108: 110.47 | I108: 5.0000000000000001e-003 | J108: -5.0000000000000001e-003 | K108: 10.35 | L108: 0. | M108: 118.8 | N108: 11.16 | O108: 0.191 | P108: 92.74 | Q108: 转股中 | R108: 4.63年 | S108: 2.63年 | T108: 2.1 | U108: 0.8 | V108: 3.0000000000000001e-003 | W108: 0.10199999999999999 | X108: 9.4e-002 | Y108: 21 | Z108: 2.92 | AA108: 1.6200000000000003e-002 | AB108: 9.0000000000000011e-003 | AC108: -2.1600000000000001e-002 | AD108: -2.4300000000000002e-002 | AE108: 85.51 | AF108: 86.32 | AG108: 0.6 | AH108: A+ | AI108: 7.3200000000000001e-002 | AJ108: =H108+100*O108 -> 129.56999999999999 | AK108: 128.2 | AL108: 74 | AM108: 41.9 | AN108: 150 | AO108: 1.7000000000000001e-002 | AP108: 33 | AQ108: 君禾转债!
A109: 177 | B109: 123051 | C109: 今天转债 | D109: 300532 | E109: 今天国际 | F109: 计算机及 | G109: 软件开发 | H109: 113.5 | I109: 4.4000000000000003e-003 | J109: -1.1599999999999999e-002 | K109: 8.74 | L109: -1.1299999999999999e-002 | M109: 122.3 | N109: 8.7 | O109: 0.13 | P109: 100.46 | Q109: 转股中 | R109: 4.88年 | S109: 2.89年 | T109: 2.8 | U109: 7.5 | V109: 2.4e-002 | W109: 0.11699999999999999 | X109: 0.11800000000000001 | Y109: 24 | Z109: 3.06 | AA109: 1.5800000000000002e-002 | AB109: 7.9000000000000008e-003 | AC109: -2.7799999999999998e-002 | AD109: -3.04e-002 | AE109: 84.2 | AF109: 87.32 | AG109: 0.64 | AH109: A+ | AI109: 7.3200000000000001e-002 | AJ109: =H109+100*O109 -> 126.5 | AK109: 126.5 | AL109: 59 | AM109: 39.2 | AN109: 129 | AO109: -1.2e-002 | AP109: 19 | AQ109: 今天转债
A110: 17 | B110: 127033 | C110: 中装转2 | D110: 2822 | E110: 中装建设 | F110: 建筑 | G110: 装饰工程 | H110: 107.29 | I110: 2.7000000000000001e-003 | J110: -6.1999999999999998e-003 | K110: 5.71 | L110: -6.9999999999999993e-003 | M110: 117.1 | N110: 6.28 | O110: 0.17999999999999999 | P110: 90.92 | Q110: 3月8天 | R110: 5.75年 | S110: 3.75年 | T110: 11.6 | U110: 22 | V110: 1.8000000000000002e-002 | W110: 0.28199999999999997 | X110: 0.25600000000000001 | Y110: 41 | Z110: 1.22 | AA110: 1.5600000000000001e-002 | AB110: 1.03e-002 | AC110: -9.0000000000000011e-003 | AD110: -1.0700000000000001e-002 | AE110: 88.14 | AF110: 92.57 | AG110: 0.5 | AH110: AA | AI110: 4.2500000000000003e-002 | AJ110: =H110+100*O110 -> 125.29000000000001 | AK110: 123.7 | AL110: 39 | AM110: 31.1 | AN110: 44 | AO110: -2.1000000000000001e-002 | AP110: 24 | AQ110: 中装转2
A111: 72 | B111: 123084 | C111: 高澜转债! | D111: 300499 | E111: 高澜股份 | F111: 能源电力 | G111: 电力设备 | H111: 112.4 | I111: 3.5999999999999999e-003 | J111: 4.0000000000000001e-003 | K111: 8.91 | L111: 1.1399999999999999e-002 | M111: 121.9 | N111: 9 | O111: 0.13500000000000001 | P111: 99 | Q111: 转股中 | R111: 5.40年 | S111: 3.40年 | T111: 2.8 | U111: 21 | V111: 6.6000000000000003e-002 | W111: 0.113 | X111: 0.11199999999999999 | Y111: 25 | Z111: 2.96 | AA111: 1.55e-002 | AB111: 8.3999999999999995e-003 | AC111: -1.9599999999999999e-002 | AD111: -2.2099999999999998e-002 | AE111: 81.38 | AF111: 83.52 | AG111: 0.67 | AH111: A+ | AI111: 7.4499999999999997e-002 | AJ111: =H111+100*O111 -> 125.90000000000001 | AK111: 125.8 | AL111: 50 | AM111: 42.3 | AN111: 155 | AO111: 2.4e-002 | AP111: 14 | AQ111: 高澜转债!
A112: 18 | B112: 110080 | C112: 东湖转债 | D112: 600133 | E112: 东湖高新 | F112: 建筑 | G112: 建筑工程 | H112: 105.52 | I112: 4.6999999999999993e-003 | J112: 6.0999999999999995e-003 | K112: 5.74 | L112: 1.95e-002 | M112: 115.1 | N112: 6.05 | O112: 0.11199999999999999 | P112: 94.88 | Q112: 3月2天 | R112: 5.74年 | S112: 3.74年 | T112: 15.5 | U112: 15 | V112: 9.0000000000000011e-003 | W112: 0.33899999999999997 | X112: 0.32200000000000001 | Y112: 46 | Z112: 0.84 | AA112: 1.55e-002 | AB112: 1.0700000000000001e-002 | AC112: -4.6999999999999993e-003 | AD112: -6.5000000000000006e-003 | AE112: 88.18 | AF112: 91.03 | AG112: 0.55 | AH112: AA | AI112: 4.2500000000000003e-002 | AJ112: =H112+100*O112 -> 116.72 | AK112: 116.2 | AL112: 10 | AM112: 25.1 | AN112: 21 | AO112: -2.1000000000000001e-002 | AP112: 21 | AQ112: 东湖转债
A113: 198 | B113: 113574 | C113: 华体转债! | D113: 603679 | E113: 华体科技 | F113: 城市公用 | G113: 城市公用 | H113: 108.02 | I113: -8.5000000000000006e-003 | J113: 8.6e-003 | K113: 15.61 | L113: 1.9e-003 | M113: 115.9 | N113: 33.91 | O113: 1.3500000000000001 | P113: 46.03 | Q113: 转股中 | R113: 4.70年 | S113: 2.71年 | T113: 2.09 | U113: 1.9 | V113: 9.0000000000000011e-003 | W113: 9.4e-002 | X113: 4.2999999999999997e-002 | Y113: 22 | Z113: 2.87 | AA113: 1.54e-002 | AB113: 9.300000000000001e-003 | AC113: -1.3000000000000001e-002 | AD113: -1.5700000000000002e-002 | AE113: 85.13 | AF113: 83.79 | AG113: 0.05 | AH113: A+ | AI113: 7.3200000000000001e-002 | AJ113: =H113+100*O113 -> 243.01999999999998 | AK113: 170 | AL113: 307 | AM113: 84.9 | AN113: 318 | AO113: -8.199999999999999e-002 | AP113: 18 | AQ113: 华体转债!
A114: 209 | B114: 113570 | C114: 百达转债! | D114: 603331 | E114: 百达精工 | F114: 机械装备 | G114: 机械装备 | H114: 107.53 | I114: 7.7000000000000002e-003 | J114: -9.4999999999999998e-003 | K114: 10.2 | L114: -2.8999999999999998e-003 | M114: 114.9 | N114: 11.34 | O114: 0.19500000000000001 | P114: 89.95 | Q114: 转股中 | R114: 4.65年 | S114: 2.65年 | T114: 2.8 | U114: 2.7 | V114: 9.0000000000000011e-003 | W114: 0.154 | X114: 0.13900000000000001 | Y114: 18 | Z114: 2.17 | AA114: 1.46e-002 | AB114: 8.8000000000000005e-003 | AC114: -1.3899999999999999e-002 | AD114: -1.6200000000000003e-002 | AE114: 84.88 | AF114: 83.29 | AG114: 0.6 | AH114: A+ | AI114: 7.3200000000000001e-002 | AJ114: =H114+100*O114 -> 127.03 | AK114: 125.1 | AL114: 46 | AM114: 40.2 | AN114: 140 | AO114: 4.0000000000000001e-003 | AP114: 33 | AQ114: 百达转债!
A115: 351 | B115: 128021 | C115: 兄弟转债!! | D115: 2562 | E115: 兄弟科技 | F115: 医药 | G115: 原料药 | H115: 105.289 | I115: -1.e-004 | J115: -1.e-003 | K115: 3.83 | L115: -1.54e-002 | M115: 108.8 | N115: 5.19 | O115: 0.42700000000000005 | P115: 73.8 | Q115: 转股中 | R115: 2.37年 | S115: 0.37年 | T115: 2.65 | U115: 2.5 | V115: 9.0000000000000011e-003 | W115: 6.5000000000000002e-002 | X115: 4.8000000000000001e-002 | Y115: 41 | Z115: 1.37 | AA115: 1.4199999999999999e-002 | AB115: 7.0999999999999995e-003 | AC115: -6.54e-002 | AD115: -7.0699999999999999e-002 | AE115: 99.47 | AF115: 99.43 | AG115: 0.07 | AH115: AA | AI115: 3.9399999999999998e-002 | AJ115: =H115+100*O115 -> 147.989 | AK115: 136.8 | AL115: 162 | AM115: 37.3 | AN115: 108 | AO115: -8.3000000000000004e-002 | AP115: 15 | AQ115: 兄弟转债!!
A116: 257 | B116: 128073 | C116: 哈尔转债! | D116: 2615 | E116: 哈尔斯 | F116: 其他 | G116: 家居用品 | H116: 110.438 | I116: -5.1000000000000004e-003 | J116: -4.7999999999999996e-003 | K116: 4.9 | L116: -2.58e-002 | M116: 115.3 | N116: 5.7 | O116: 0.28499999999999998 | P116: 85.96 | Q116: 转股中 | R116: 3年36天 | S116: 1年37天 | T116: 2.99 | U116: 11 | V116: 3.3000000000000002e-002 | W116: 0.14800000000000002 | X116: 0.127 | Y116: 20 | Z116: 2.58 | AA116: 1.4199999999999999e-002 | AB116: 5.3e-003 | AC116: -6.0899999999999996e-002 | AD116: -6.3799999999999996e-002 | AE116: 94.6 | AF116: 95.94 | AG116: 0.38 | AH116: AA- | AI116: 6.2199999999999998e-002 | AJ116: =H116+100*O116 -> 138.93799999999999 | AK116: 134.9 | AL116: 141 | AM116: 39 | AN116: 127 | AO116: 2.3e-002 | AP116: 39 | AQ116: 哈尔转债!
A117: 225 | B117: 113561 | C117: 正裕转债! | D117: 603089 | E117: 正裕工业 | F117: 汽车 | G117: 零部件制 | H117: 110.97 | I117: 2.0999999999999999e-003 | J117: 1.1000000000000001e-003 | K117: 9.06 | L117: 5.5000000000000005e-003 | M117: 118 | N117: 10.08 | O117: 0.23499999999999999 | P117: 89.88 | Q117: 转股中 | R117: 4.46年 | S117: 2.46年 | T117: 1.5 | U117: 5.3 | V117: 3.2000000000000001e-002 | W117: 7.400000000000001e-002 | X117: 6.7000000000000004e-002 | Y117: 20 | Z117: 1.9 | AA117: 1.4199999999999999e-002 | AB117: 6.9999999999999993e-003 | AC117: -2.41e-002 | AD117: -2.7000000000000003e-002 | AE117: 86.74 | AF117: 86.82 | AG117: 0.57 | AH117: A+ | AI117: 7.3200000000000001e-002 | AJ117: =H117+100*O117 -> 134.47 | AK117: 132.1 | AL117: 114 | AM117: 45.2 | AN117: 178 | AO117: 2.e-002 | AP117: 35 | AQ117: 正裕转债!
A118: 240 | B118: 113549 | C118: 白电转债 | D118: 603861 | E118: 白云电器 | F118: 能源电力 | G118: 电力设备 | H118: 108.22 | I118: 8.3000000000000001e-003 | J118: -1.01e-002 | K118: 8.4 | L118: -3.5999999999999999e-003 | M118: 114.8 | N118: 8.81 | O118: 0.13500000000000001 | P118: 95.35 | Q118: 转股中 | R118: 4.33年 | S118: 2.33年 | T118: 8.8 | U118: 17 | V118: 1.8000000000000002e-002 | W118: 0.23699999999999999 | X118: 0.22600000000000001 | Y118: 37 | Z118: 1.44 | AA118: 1.3999999999999999e-002 | AB118: 7.7000000000000002e-003 | AC118: -1.8600000000000002e-002 | AD118: -2.1099999999999997e-002 | AE118: 93.47 | AF118: 96.72 | AG118: 0.5 | AH118: AA | AI118: 4.1200000000000001e-002 | AJ118: =H118+100*O118 -> 121.72 | AK118: 121.1 | AL118: 20 | AM118: 24.4 | AN118: 19 | AO118: 1.7000000000000001e-002 | AP118: 40 | AQ118: 白电转债
A119: 56 | B119: 128143 | C119: 锋龙转债! | D119: 2931 | E119: 锋龙股份 | F119: 机械装备 | G119: 专用设备 | H119: 113.199 | I119: -1.18e-002 | J119: 3.8e-003 | K119: 12.19 | L119: -1.2199999999999999e-002 | M119: 121.7 | N119: 12.73 | O119: 0.182 | P119: 95.76 | Q119: 转股中 | R119: 5.48年 | S119: 3.48年 | T119: 2.45 | U119: 12 | V119: 4.4000000000000004e-002 | W119: 0.10099999999999999 | X119: 9.6999999999999989e-002 | Y119: 24 | Z119: 2.76 | AA119: 1.3600000000000001e-002 | AB119: 6.7000000000000002e-003 | AC119: -2.1600000000000001e-002 | AD119: -2.4e-002 | AE119: 80.76 | AF119: 82.89 | AG119: 0.66 | AH119: A+ | AI119: 7.4499999999999997e-002 | AJ119: =H119+100*O119 -> 131.399 | AK119: 130.6 | AL119: 98 | AM119: 47.8 | AN119: 200 | AO119: -8.1000000000000003e-002 | AP119: 12 | AQ119: 锋龙转债!
A120: 81 | B120: 123080 | C120: 海波转债! | D120: 300517 | E120: 海波重科 | F120: 建筑 | G120: 建筑工程 | H120: 118 | I120: 1.0800000000000001e-002 | J120: -6.9999999999999993e-003 | K120: 12.98 | L120: 5.4000000000000003e-003 | M120: 126.5 | N120: 11.58 | O120: 5.2999999999999999e-002 | P120: 112.09 | Q120: 转股中 | R120: 5.38年 | S120: 3.38年 | T120: 2.45 | U120: 30 | V120: 0.10300000000000001 | W120: 9.8000000000000004e-002 | X120: 0.11 | Y120: 25 | Z120: 1.67 | AA120: 1.3300000000000001e-002 | AB120: 5.1000000000000004e-003 | AC120: -3.3599999999999998e-002 | AD120: -3.6000000000000004e-002 | AE120: 81.41 | AF120: 86.76 | AG120: 0.71 | AH120: A+ | AI120: 7.4499999999999997e-002 | AJ120: =H120+100*O120 -> 123.3 | AK120: 123.9 | AL120: 42 | AM120: 37.2 | AN120: 104 | AO120: 0.107 | AP120: 22 | AQ120: 海波转债!
A121: 194 | B121: 128105 | C121: 长集转债! | D121: 2616 | E121: 长青集团 | F121: 城市公用 | G121: 三废处理 | H121: 108.631 | I121: 2.e-003 | J121: -1.01e-002 | K121: 7.06 | L121: -1.8100000000000002e-002 | M121: 114.9 | N121: 7.91 | O121: 0.217 | P121: 89.25 | Q121: 转股中 | R121: 4.73年 | S121: 2.73年 | T121: 8 | U121: 13 | V121: 1.4999999999999999e-002 | W121: 0.153 | X121: 0.13600000000000001 | Y121: 52 | Z121: 1.97 | AA121: 1.2199999999999999e-002 | AB121: 6.4000000000000003e-003 | AC121: -1.7000000000000001e-002 | AD121: -1.9199999999999998e-002 | AE121: 92.08 | AF121: 95.28 | AG121: 0.45 | AH121: AA | AI121: 4.1200000000000001e-002 | AJ121: =H121+100*O121 -> 130.33099999999999 | AK121: 128 | AL121: 71 | AM121: 32.7 | AN121: 57 | AO121: -6.0000000000000001e-003 | AP121: 17 | AQ121: 长集转债!
A122: 34 | B122: 113046 | C122: 金田转债 | D122: 601609 | E122: 金田铜业 | F122: 有色金属 | G122: 铜金属 | H122: 107.46 | I122: 2.5999999999999999e-003 | J122: -2.2000000000000001e-003 | K122: 8.91 | L122: 1.1000000000000001e-003 | M122: 114.9 | N122: 10.75 | O122: 0.29699999999999999 | P122: 82.88 | Q122: 2月13天 | R122: 5.68年 | S122: 3.68年 | T122: 15 | U122: 36 | V122: 2.2000000000000002e-002 | W122: 0.114 | X122: 9.4e-002 | Y122: 132 | Z122: 1.9 | AA122: 1.21e-002 | AB122: 7.3000000000000001e-003 | AC122: -1.e-002 | AD122: -1.1699999999999999e-002 | AE122: 89.18 | AF122: 92.55 | AG122: 0.41 | AH122: AA+ | AI122: 3.95e-002 | AJ122: =H122+100*O122 -> 137.16 | AK122: 132 | AL122: 113 | AM122: 39.5 | AN122: 132 | AO122: 8.0000000000000002e-003 | AP122: 11 | AQ122: 金田转债
A123: 261 | B123: 113542 | C123: 好客转债 | D123: 603898 | E123: 好莱客 | F123: 其他 | G123: 家居用品 | H123: 109.65 | I123: 2.5999999999999999e-003 | J123: -5.8999999999999999e-003 | K123: 13.13 | L123: -1.06e-002 | M123: 114.9 | N123: 16.14 | O123: 0.34799999999999998 | P123: 81.35 | Q123: 转股中 | R123: 4年15天 | S123: 2年16天 | T123: 6.03 | U123: 13 | V123: 2.e-002 | W123: 0.14699999999999999 | X123: 0.12 | Y123: 41 | Z123: 1.59 | AA123: 1.1899999999999999e-002 | AB123: 5.1999999999999998e-003 | AC123: -2.6499999999999999e-002 | AD123: -2.9399999999999999e-002 | AE123: 94.68 | AF123: 97.96 | AG123: 0.32 | AH123: AA | AI123: 4.1200000000000001e-002 | AJ123: =H123+100*O123 -> 144.44999999999999 | AK123: 137.9 | AL123: 174 | AM123: 40 | AN123: 139 | AO123: -5.2999999999999999e-002 | AP123: 17 | AQ123: 好客转债
A124: 183 | B124: 128107 | C124: 交科转债 | D124: 2061 | E124: 浙江交科 | F124: 建筑 | G124: 建筑工程 | H124: 108.851 | I124: 1.4000000000000002e-003 | J124: 2.8000000000000004e-003 | K124: 5.15 | L124: 7.8000000000000005e-003 | M124: 114.9 | N124: 5.24 | O124: 0.10800000000000001 | P124: 98.28 | Q124: 转股中 | R124: 4.76年 | S124: 2.77年 | T124: 25 | U124: 9.4 | V124: 3.0000000000000001e-003 | W124: 0.35299999999999998 | X124: 0.34700000000000003 | Y124: 71 | Z124: 0.83 | AA124: 1.1599999999999999e-002 | AB124: 5.8999999999999999e-003 | AC124: -1.7500000000000002e-002 | AD124: -1.9699999999999999e-002 | AE124: 92.72 | AF124: 96.43 | AG124: 0.53 | AH124: AA+ | AI124: 3.8199999999999998e-002 | AJ124: =H124+100*O124 -> 119.651 | AK124: 119.4 | AL124: 14 | AM124: 23 | AN124: 13 | AO124: -2.7999999999999997e-002 | AP124: 18 | AQ124: 交科转债
A125: 12 | B125: 111000 | C125: 起帆转债 | D125: 605222 | E125: 起帆电缆 | F125: 能源电力 | G125: 电力设备 | H125: 112.81 | I125: -2.9999999999999997e-004 | J125: -4.1999999999999997e-003 | K125: 21.06 | L125: -6.6e-003 | M125: 120.5 | N125: 20.53 | O125: 0.10000000000000001 | P125: 102.58 | Q125: 4月16天 | R125: 5.85年 | S125: 3.86年 | T125: 10 | U125: 17 | V125: 1.4999999999999999e-002 | W125: 0.11900000000000001 | X125: 0.122 | Y125: 84 | Z125: 2.89 | AA125: 1.15e-002 | AB125: 5.4000000000000003e-003 | AC125: -2.06e-002 | AD125: -2.2400000000000003e-002 | AE125: 81.26 | AF125: 84.62 | AG125: 0.67 | AH125: AA- | AI125: 6.3500000000000001e-002 | AJ125: =H125+100*O125 -> 122.81 | AK125: 123 | AL125: 32 | AM125: 38.4 | AN125: 119 | AO125: 4.0999999999999995e-002 | AP125: 8 | AQ125: 起帆转债
A126: 97 | B126: 110076 | C126: 华海转债! | D126: 600521 | E126: 华海药业 | F126: 医药 | G126: 医药行业 | H126: 108.5 | I126: 4.5000000000000005e-003 | J126: -4.5000000000000005e-003 | K126: 21.4 | L126: 0. | M126: 115.1 | N126: 33.85 | O126: 0.71599999999999997 | P126: 63.22 | Q126: 转股中 | R126: 5.30年 | S126: 3.30年 | T126: 18.4 | U126: 18 | V126: 9.0000000000000011e-003 | W126: 5.7999999999999996e-002 | X126: 3.6000000000000004e-002 | Y126: 319 | Z126: 4.77 | AA126: 1.1399999999999999e-002 | AB126: 6.1999999999999998e-003 | AC126: -1.3300000000000001e-002 | AD126: -1.5300000000000001e-002 | AE126: 89.81 | AF126: 92.72 | AG126: 0.19 | AH126: AA | AI126: 4.2500000000000003e-002 | AJ126: =H126+100*O126 -> 180.09999999999999 | AK126: 153.8 | AL126: 276 | AM126: 61.1 | AN126: 278 | AO126: 3.7000000000000005e-002 | AP126: 7 | AQ126: 华海转债!
A127: 102 | B127: 123073 | C127: 同和转债! | D127: 300636 | E127: 同和药业 | F127: 医药 | G127: 原料药 | H127: 115.48 | I127: -3.0999999999999999e-003 | J127: -1.5900000000000001e-002 | K127: 15.07 | L127: -2.8399999999999998e-002 | M127: 122.4 | N127: 14.82 | O127: 0.13600000000000001 | P127: 101.69 | Q127: 转股中 | R127: 5.28年 | S127: 3.28年 | T127: 3.59 | U127: 2.1 | V127: 5.0000000000000001e-003 | W127: 0.11599999999999999 | X127: 0.11800000000000001 | Y127: 31 | Z127: 2.47 | AA127: 1.1299999999999999e-002 | AB127: 4.0000000000000001e-003 | AC127: -2.87e-002 | AD127: -3.1099999999999999e-002 | AE127: 81.91 | AF127: 84.57 | AG127: 0.67 | AH127: A+ | AI127: 7.4499999999999997e-002 | AJ127: =H127+100*O127 -> 129.08000000000001 | AK127: 129.3 | AL127: 79 | AM127: 44.7 | AN127: 173 | AO127: -5.0000000000000003e-002 | AP127: 12 | AQ127: 同和转债!
A128: 21 | B128: 123112 | C128: 万讯转债 | D128: 300112 | E128: 万讯自控 | F128: 机械装备 | G128: 专用设备 | H128: 116.766 | I128: 9.300000000000001e-003 | J128: -8.0000000000000004e-004 | K128: 9.58 | L128: 1.2699999999999999e-002 | M128: 124.4 | N128: 8.93 | O128: 8.8000000000000009e-002 | P128: 107.28 | Q128: 3月0天 | R128: 5.73年 | S128: 3.73年 | T128: 2.46 | U128: 15 | V128: 5.0999999999999997e-002 | W128: 8.9999999999999997e-002 | X128: 9.6000000000000002e-002 | Y128: 27 | Z128: 2.56 | AA128: 1.1299999999999999e-002 | AB128: 4.0999999999999995e-003 | AC128: -2.8799999999999999e-002 | AD128: -3.0800000000000001e-002 | AE128: 82.28 | AF128: 88.09 | AG128: 0.67 | AH128: AA- | AI128: 6.3500000000000001e-002 | AJ128: =H128+100*O128 -> 125.566 | AK128: 126.3 | AL128: 55 | AM128: 38.2 | AN128: 115 | AO128: 4.5999999999999999e-002 | AP128: 11 | AQ128: 万讯转债
A129: 94 | B129: 127024 | C129: 盈峰转债! | D129: 967 | E129: 盈峰环境 | F129: 机械装备 | G129: 专用设备 | H129: 110.2 | I129: 9.1999999999999998e-003 | J129: -1.0200000000000001e-002 | K129: 6.59 | L129: -3.0000000000000001e-003 | M129: 116.8 | N129: 8.19 | O129: 0.37 | P129: 80.46 | Q129: 转股中 | R129: 5.30年 | S129: 3.30年 | T129: 14.8 | U129: 6.1 | V129: 4.0000000000000001e-003 | W129: 7.0999999999999994e-002 | X129: 5.7000000000000002e-002 | Y129: 208 | Z129: 1.24 | AA129: 1.1200000000000002e-002 | AB129: 5.6000000000000008e-003 | AC129: -1.8600000000000002e-002 | AD129: -2.0400000000000001e-002 | AE129: 90.4 | AF129: 95.44 | AG129: 0.34 | AH129: AA+ | AI129: 3.95e-002 | AJ129: =H129+100*O129 -> 147.19999999999999 | AK129: 139.9 | AL129: 195 | AM129: 44.5 | AN129: 172 | AO129: -3.4000000000000002e-002 | AP129: 5 | AQ129: 盈峰转债!
A130: 248 | B130: 127014 | C130: 北方转债! | D130: 65 | E130: 北方国际 | F130: 建筑 | G130: 建筑工程 | H130: 109.99 | I130: -1.e-004 | J130: 1.e-004 | K130: 7.83 | L130: 0. | M130: 115.1 | N130: 8.65 | O130: 0.215 | P130: 90.52 | Q130: 转股中 | R130: 4.27年 | S130: 2.27年 | T130: 5.35 | U130: 2.8 | V130: 5.0000000000000001e-003 | W130: 8.8000000000000009e-002 | X130: 8.0000000000000002e-002 | Y130: 61 | Z130: 1.08 | AA130: 1.09e-002 | AB130: 4.5000000000000005e-003 | AC130: -2.4500000000000001e-002 | AD130: -2.7300000000000001e-002 | AE130: 94.65 | AF130: 98.43 | AG130: 0.43 | AH130: AA+ | AI130: 3.8199999999999998e-002 | AJ130: =H130+100*O130 -> 131.49000000000001 | AK130: 129.5 | AL130: 84 | AM130: 31 | AN130: 42 | AO130: -2.9999999999999999e-002 | AP130: 19 | AQ130: 北方转债!
A131: 54 | B131: 123093 | C131: 金陵转债 | D131: 300651 | E131: 金陵体育 | F131: 其他 | G131: 文化教育 | H131: 122.001 | I131: 2.5000000000000001e-003 | J131: 1.37e-002 | K131: 43.8 | L131: 2.8199999999999999e-002 | M131: 129.3 | N131: 49.19 | O131: 0.37 | P131: 89.04 | Q131: 10天 | R131: 5.51年 | S131: 3.51年 | T131: 2.5 | U131: 115 | V131: 0.37200000000000005 | W131: 4.4000000000000004e-002 | X131: 3.9e-002 | Y131: 56 | Z131: 8.18 | AA131: 1.09e-002 | AB131: 2.2000000000000001e-003 | AC131: -3.7000000000000005e-002 | AD131: -4.0099999999999997e-002 | AE131: 81.99 | AF131: 88.07 | AG131: 0.57 | AH131: A+ | AI131: 7.4499999999999997e-002 | AJ131: =H131+100*O131 -> 159.001 | AK131: 155 | AL131: 282 | AM131: 66.9 | AN131: 293 | AO131: 5.0000000000000003e-002 | AP131: 6 | AQ131: 金陵转债
A132: 220 | B132: 113563 | C132: 柳药转债! | D132: 603368 | E132: 柳药股份 | F132: 医药 | G132: 医药商业 | H132: 107.71 | I132: 3.8e-003 | J132: 1.7000000000000001e-003 | K132: 20.08 | L132: 1.41e-002 | M132: 112.9 | N132: 23.87 | O132: 0.28000000000000003 | P132: 84.12 | Q132: 转股中 | R132: 4.50年 | S132: 2.50年 | T132: 8.02 | U132: 3.8 | V132: 4.0000000000000001e-003 | W132: 0.11 | X132: 9.3000000000000013e-002 | Y132: 73 | Z132: 1.41 | AA132: 1.0700000000000001e-002 | AB132: 5.4000000000000003e-003 | AC132: -1.5300000000000001e-002 | AD132: -1.77e-002 | AE132: 92.93 | AF132: 94.49 | AG132: 0.39 | AH132: AA | AI132: 4.1200000000000001e-002 | AJ132: =H132+100*O132 -> 135.71000000000001 | AK132: 131.3 | AL132: 107 | AM132: 36.8 | AN132: 94 | AO132: 1.8000000000000002e-002 | AP132: 16 | AQ132: 柳药转债!
A133: 92 | B133: 113608 | C133: 威派转债! | D133: 603956 | E133: 威派格 | F133: 机械装备 | G133: 专用设备 | H133: 115.25 | I133: -1.2e-002 | J133: 3.5999999999999999e-003 | K133: 17.77 | L133: -1.3300000000000001e-002 | M133: 121.6 | N133: 19.08 | O133: 0.23699999999999999 | P133: 93.13 | Q133: 转股中 | R133: 5.32年 | S133: 3.32年 | T133: 4.2 | U133: 15 | V133: 3.1e-002 | W133: 5.5e-002 | X133: 5.2000000000000005e-002 | Y133: 76 | Z133: 6.54 | AA133: 1.04e-002 | AB133: 3.4000000000000002e-003 | AC133: -2.7799999999999998e-002 | AD133: -3.0200000000000001e-002 | AE133: 81.71 | AF133: 83.8 | AG133: 0.63 | AH133: A+ | AI133: 7.4499999999999997e-002 | AJ133: =H133+100*O133 -> 138.94999999999999 | AK133: 137.4 | AL133: 168 | AM133: 53.6 | AN133: 227 | AO133: -1.3999999999999999e-002 | AP133: 7 | AQ133: 威派转债!
A134: 3 | B134: 113625 | C134: 江山转债 | D134: 603208 | E134: 江山欧派 | F134: 其他 | G134: 家居用品 | H134: 116.78 | I134: 6.8999999999999999e-003 | J134: -2.5000000000000001e-003 | K134: 89.05 | L134: 7.6e-003 | M134: 124 | N134: 97.55 | O134: 0.27899999999999997 | P134: 91.29 | Q134: 5月5天 | R134: 5.90年 | S134: 3.90年 | T134: 5.83 | U134: 8.5 | V134: 1.3000000000000001e-002 | W134: 6.2e-002 | X134: 5.7000000000000002e-002 | Y134: 94 | Z134: 5.56 | AA134: 1.04e-002 | AB134: 3.4999999999999996e-003 | AC134: -2.8500000000000001e-002 | AD134: -3.0299999999999997e-002 | AE134: 81.08 | AF134: 86.82 | AG134: 0.57 | AH134: AA- | AI134: 6.3500000000000001e-002 | AJ134: =H134+100*O134 -> 144.68000000000001 | AK134: 142.3 | AL134: 214 | AM134: 55.5 | AN134: 241 | AO134: -5.2999999999999999e-002 | AP134: 2 | AQ134: 江山转债
A135: 71 | B135: 123086 | C135: 海兰转债! | D135: 300065 | E135: 海兰信 | F135: 电子 | G135: 电子产品 | H135: 116.96 | I135: 4.8999999999999998e-003 | J135: -2.3999999999999998e-003 | K135: 8.2 | L135: 3.7000000000000002e-003 | M135: 123.5 | N135: 7.27 | O135: 3.7000000000000005e-002 | P135: 112.79 | Q135: 转股中 | R135: 5.40年 | S135: 3.41年 | T135: 7.29 | U135: 136 | V135: 0.159 | W135: 0.14899999999999999 | X135: 0.16800000000000001 | Y135: 49 | Z135: 2.2 | AA135: 1.03e-002 | AB135: 2.8999999999999998e-003 | AC135: -3.3099999999999997e-002 | AD135: -3.5000000000000003e-002 | AE135: 83.54 | AF135: 89.14 | AG135: 0.69 | AH135: AA- | AI135: 6.3500000000000001e-002 | AJ135: =H135+100*O135 -> 120.66 | AK135: 121.1 | AL135: 21 | AM135: 32 | AN135: 51 | AO135: -0.26300000000000001 | AP135: 19 | AQ135: 海兰转债!
A136: 31 | B136: 123106 | C136: 正丹转债! | D136: 300641 | E136: 正丹股份 | F136: 化工 | G136: 化工 | H136: 118.584 | I136: 0. | J136: 4.8999999999999998e-003 | K136: 8.15 | L136: 7.4000000000000003e-003 | M136: 125.5 | N136: 7.5 | O136: 9.0999999999999998e-002 | P136: 108.67 | Q136: 2月16天 | R136: 5.69年 | S136: 3.69年 | T136: 3.2 | U136: 18 | V136: 4.7e-002 | W136: 8.0000000000000002e-002 | X136: 8.6999999999999994e-002 | Y136: 40 | Z136: 2.86 | AA136: 1.0200000000000001e-002 | AB136: 2.7000000000000001e-003 | AC136: -3.4200000000000001e-002 | AD136: -3.6000000000000004e-002 | AE136: 82.1 | AF136: 89.01 | AG136: 0.67 | AH136: AA- | AI136: 6.3500000000000001e-002 | AJ136: =H136+100*O136 -> 127.684 | AK136: 128.5 | AL136: 76 | AM136: 39.5 | AN136: 133 | AO136: 2.4e-002 | AP136: 13 | AQ136: 正丹转债!
A137: 331 | B137: 128037 | C137: 岩土转债! | D137: 2542 | E137: 中化岩土 | F137: 建筑 | G137: 建筑工程 | H137: 108.409 | I137: 7.000000000000001e-004 | J137: -2.0999999999999999e-003 | K137: 2.91 | L137: -3.4000000000000002e-003 | M137: 111.3 | N137: 3.1 | O137: 0.155 | P137: 93.87 | Q137: 转股中 | R137: 2.66年 | S137: 0.66年 | T137: 5.99 | U137: 4 | V137: 6.0000000000000001e-003 | W137: 0.114 | X137: 0.107 | Y137: 53 | Z137: 1.33 | AA137: 1.01e-002 | AB137: 2.2000000000000001e-003 | AC137: -7.3200000000000001e-002 | AD137: -7.7100000000000002e-002 | AE137: 98.6 | AF137: 100.59 | AG137: 0.41 | AH137: AA | AI137: 3.9399999999999998e-002 | AJ137: =H137+100*O137 -> 123.90900000000001 | AK137: 122.9 | AL137: 31 | AM137: 22.4 | AN137: 11 | AO137: -3.9e-002 | AP137: 50 | AQ137: 岩土转债!
A138: 178 | B138: 127017 | C138: 万青转债 | D138: 789 | E138: 万年青 | F138: 建筑 | G138: 水泥 | H138: 112.45 | I138: -9.300000000000001e-003 | J138: 5.5000000000000005e-003 | K138: 11.3 | L138: -1.0500000000000001e-002 | M138: 118 | N138: 13.46 | O138: 0.33899999999999997 | P138: 83.95 | Q138: 转股中 | R138: 4.88年 | S138: 2.88年 | T138: 10 | U138: 4.1 | V138: 4.0000000000000001e-003 | W138: 0.111 | X138: 9.3000000000000013e-002 | Y138: 90 | Z138: 1.37 | AA138: 1.01e-002 | AB138: 3.5999999999999999e-003 | AC138: -2.75e-002 | AD138: -2.9600000000000001e-002 | AE138: 92.26 | AF138: 98.59 | AG138: 0.36 | AH138: AA+ | AI138: 3.8199999999999998e-002 | AJ138: =H138+100*O138 -> 146.34999999999999 | AK138: 140.9 | AL138: 206 | AM138: 42.4 | AN138: 157 | AO138: -2.e-002 | AP138: 9 | AQ138: 万青转债
A139: 187 | B139: 123050 | C139: 聚飞转债 | D139: 300303 | E139: 聚飞光电 | F139: 电子 | G139: LED制 | H139: 118.21 | I139: -1.49e-002 | J139: 8.199999999999999e-003 | K139: 5.13 | L139: -1.1599999999999999e-002 | M139: 123.8 | N139: 5.08 | O139: 0.17100000000000001 | P139: 100.98 | Q139: 转股中 | R139: 4.74年 | S139: 2.75年 | T139: 7.05 | U139: 11 | V139: 1.3000000000000001e-002 | W139: 0.107 | X139: 0.109 | Y139: 66 | Z139: 2.66 | AA139: 1.e-002 | AB139: 1.5e-003 | AC139: -4.4299999999999999e-002 | AD139: -4.6600000000000003e-002 | AE139: 87.16 | AF139: 93.55 | AG139: 0.58 | AH139: AA- | AI139: 6.2199999999999998e-002 | AJ139: =H139+100*O139 -> 135.31 | AK139: 135.4 | AL139: 146 | AM139: 41.9 | AN139: 151 | AO139: -9.0000000000000011e-003 | AP139: 11 | AQ139: 聚飞转债
A140: 317 | B140: 128042 | C140: 凯中转债! | D140: 2823 | E140: 凯中精密 | F140: 能源电力 | G140: 电力设备 | H140: 112.94 | I140: 1.5e-003 | J140: -8.5000000000000006e-003 | K140: 11.43 | L140: -2.1400000000000002e-002 | M140: 116.3 | N140: 12.86 | O140: 0.27100000000000002 | P140: 88.88 | Q140: 转股中 | R140: 3年13天 | S140: 1年14天 | T140: 4.16 | U140: 9.5 | V140: 2.e-002 | W140: 0.127 | X140: 0.113 | Y140: 33 | Z140: 2.42 | AA140: 9.8999999999999991e-003 | AB140: 2.9999999999999997e-004 | AC140: -7.5899999999999995e-002 | AD140: -8.0000000000000002e-002 | AE140: 97.97 | AF140: 103.17 | AG140: 0.33 | AH140: AA | AI140: 4.1200000000000001e-002 | AJ140: =H140+100*O140 -> 140.03999999999999 | AK140: 137 | AL140: 167 | AM140: 33.8 | AN140: 67 | AO140: 6.4000000000000001e-002 | AP140: 26 | AQ140: 凯中转债!
A141: 327 | B141: 128039 | C141: 三力转债! | D141: 2224 | E141: 三 力 士 | F141: 机械装备 | G141: 专用设备 | H141: 105.8 | I141: -1.9e-003 | J141: 1.1999999999999999e-003 | K141: 4.66 | L141: -2.0999999999999999e-003 | M141: 108.8 | N141: 5.79 | O141: 0.315 | P141: 80.48 | Q141: 转股中 | R141: 2.89年 | S141: 0.90年 | T141: 2.03 | U141: 4.5 | V141: 2.1000000000000001e-002 | W141: 5.9999999999999998e-002 | X141: 4.8000000000000001e-002 | Y141: 34 | Z141: 1.48 | AA141: 9.7999999999999997e-003 | AB141: 4.0999999999999995e-003 | AC141: -3.7900000000000003e-002 | AD141: -4.07e-002 | AE141: 95.43 | AF141: 92.02 | AG141: 0.31 | AH141: AA- | AI141: 6.0400000000000002e-002 | AJ141: =H141+100*O141 -> 137.30000000000001 | AK141: 131.1 | AL141: 105 | AM141: 35.7 | AN141: 78 | AO141: -1.7000000000000001e-002 | AP141: 28 | AQ141: 三力转债!
A142: 108 | B142: 128135 | C142: 洽洽转债! | D142: 2557 | E142: 洽洽食品 | F142: 食品饮料 | G142: 休闲食品 | H142: 114.409 | I142: -6.3e-003 | J142: 1.1000000000000001e-003 | K142: 40.5 | L142: -2.7099999999999999e-002 | M142: 120.2 | N142: 60.03 | O142: 0.69599999999999995 | P142: 67.47 | Q142: 转股中 | R142: 5.26年 | S142: 3.26年 | T142: 13.4 | U142: 7.1 | V142: 5.0000000000000001e-003 | W142: 6.5000000000000002e-002 | X142: 4.4000000000000004e-002 | Y142: 205 | Z142: 4.81 | AA142: 9.5999999999999992e-003 | AB142: 2.8999999999999998e-003 | AC142: -2.8500000000000001e-002 | AD142: -3.0499999999999999e-002 | AE142: 90.04 | AF142: 96.97 | AG142: 0.19 | AH142: AA | AI142: 4.2500000000000003e-002 | AJ142: =H142+100*O142 -> 184.00900000000001 | AK142: 161.4 | AL142: 297 | AM142: 64.4 | AN142: 288 | AO142: -6.6000000000000003e-002 | AP142: 11 | AQ142: 洽洽转债!
A143: 342 | B143: 110041 | C143: 蒙电转债! | D143: 600863 | E143: 内蒙华电 | F143: 能源电力 | G143: 电力供应 | H143: 106.89 | I143: -8.9999999999999998e-004 | J143: 8.9999999999999998e-004 | K143: 2.31 | L143: 0. | M143: 109.3 | N143: 2.56 | O143: 0.185 | P143: 90.23 | Q143: 转股中 | R143: 2.44年 | S143: 0.44年 | T143: 18.7 | U143: 10 | V143: 5.0000000000000001e-003 | W143: 0.13900000000000001 | X143: 0.126 | Y143: 134 | Z143: 1.15 | AA143: 9.3999999999999986e-003 | AB143: 2.0999999999999999e-003 | AC143: -7.8100000000000003e-002 | AD143: -8.3499999999999991e-002 | AE143: 99.76 | AF143: 100.81 | AG143: 0.35 | AH143: AAA | AI143: 3.44e-002 | AJ143: =H143+100*O143 -> 125.39 | AK143: 123.5 | AL143: 38 | AM143: 22.7 | AN143: 12 | AO143: -2.e-002 | AP143: 11 | AQ143: 蒙电转债!
A144: 167 | B144: 113588 | C144: 润达转债! | D144: 603108 | E144: XD润达医 | F144: 医药 | G144: 医疗器械 | H144: 108.92 | I144: 1.4199999999999999e-002 | J144: 2.0199999999999999e-002 | K144: 11.55 | L144: 7.7399999999999997e-002 | M144: 113.9 | N144: 13.25 | O144: 0.25 | P144: 87.17 | Q144: 转股中 | R144: 4.92年 | S144: 2.92年 | T144: 5.5 | U144: 17 | V144: 2.7999999999999997e-002 | W144: 8.199999999999999e-002 | X144: 7.2000000000000008e-002 | Y144: 67 | Z144: 2.1 | AA144: 9.300000000000001e-003 | AB144: 4.0999999999999995e-003 | AC144: -1.6799999999999999e-002 | AD144: -1.89e-002 | AE144: 91.38 | AF144: 93.73 | AG144: 0.44 | AH144: AA | AI144: 4.1200000000000001e-002 | AJ144: =H144+100*O144 -> 133.92000000000002 | AK144: 130.7 | AL144: 99 | AM144: 36.9 | AN144: 100 | AO144: 5.5999999999999994e-002 | AP144: 10 | AQ144: 润达转债!
A145: 124 | B145: 128129 | C145: 青农转债! | D145: 2958 | E145: 青农商行 | F145: 金融 | G145: 银行行业 | H145: 107.1 | I145: 0. | J145: -5.1000000000000004e-003 | K145: 4.08 | L145: -9.7000000000000003e-003 | M145: 112.2 | N145: 4.32 | O145: 0.13400000000000001 | P145: 94.44 | Q145: 转股中 | R145: 5年39天 | S145: 无权 | T145: 50 | U145: 11 | V145: 2.e-003 | W145: 0.221 | X145: 0.20800000000000002 | Y145: 227 | Z145: 0.83 | AA145: 9.300000000000001e-003 | AB145: 4.8999999999999998e-003 | AC145: 无权 | AD145: 无权 | AE145: 无权 | AF145: 93.25 | AG145: 0.52 | AH145: AAA | AI145: 3.7499999999999999e-002 | AJ145: =H145+100*O145 -> 120.5 | AK145: 119.8 | AL145: 16 | AM145: 26.5 | AN145: 24 | AO145: -3.4000000000000002e-002 | AP145: 16 | AQ145: 青农转债!
A146: 27 | B146: 123107 | C146: 温氏转债! | D146: 300498 | E146: 温氏股份 | F146: 农业 | G146: 畜牧业 | H146: 107.3 | I146: 4.0000000000000002e-004 | J146: -1.1000000000000001e-003 | K146: 13.52 | L146: -2.2000000000000001e-003 | M146: 113 | N146: 17.62 | O146: 0.39799999999999996 | P146: 76.73 | Q146: 2月24天 | R146: 5.70年 | S146: 3.70年 | T146: 93 | U146: 44 | V146: 4.0000000000000001e-003 | W146: 0.10800000000000001 | X146: 8.3000000000000004e-002 | Y146: 862 | Z146: 1.87 | AA146: 9.300000000000001e-003 | AB146: 5.1000000000000004e-003 | AC146: -9.300000000000001e-003 | AD146: -1.11e-002 | AE146: 89.86 | AF146: 91.95 | AG146: 0.35 | AH146: AAA | AI146: 3.7499999999999999e-002 | AJ146: =H146+100*O146 -> 147.09999999999999 | AK146: 137.9 | AL146: 172 | AM146: 45.9 | AN146: 185 | AO146: -3.6000000000000004e-002 | AP146: 9 | AQ146: 温氏转债!
A147: 230 | B147: 113030 | C147: 东风转债! | D147: 601515 | E147: 东风股份 | F147: 造纸包装 | G147: 包装材料 | H147: 112.33 | I147: -1.6000000000000001e-003 | J147: -3.0000000000000001e-003 | K147: 6.12 | L147: -9.7000000000000003e-003 | M147: 116.9 | N147: 6.45 | O147: 0.184 | P147: 94.88 | Q147: 转股中 | R147: 4.44年 | S147: 2.44年 | T147: 2.95 | U147: 2.9 | V147: 9.0000000000000011e-003 | W147: 3.6000000000000004e-002 | X147: 3.4000000000000002e-002 | Y147: 82 | Z147: 1.77 | AA147: 9.1999999999999998e-003 | AB147: 2.3999999999999998e-003 | AC147: -3.1600000000000003e-002 | AD147: -3.4000000000000002e-002 | AE147: 93.17 | AF147: 98.07 | AG147: 0.48 | AH147: AA | AI147: 4.1200000000000001e-002 | AJ147: =H147+100*O147 -> 130.72999999999999 | AK147: 129.8 | AL147: 88 | AM147: 31.7 | AN147: 50 | AO147: -3.3000000000000002e-002 | AP147: 18 | AQ147: 东风转债!
A148: 315 | B148: 113516 | C148: 苏农转债! | D148: 603323 | E148: 苏农银行 | F148: 金融 | G148: 银行行业 | H148: 111.28 | I148: -9.8999999999999991e-003 | J148: 7.1999999999999998e-003 | K148: 4.66 | L148: -8.5000000000000006e-003 | M148: 114.3 | N148: 5.37 | O148: 0.28199999999999997 | P148: 86.78 | Q148: 转股中 | R148: 3年16天 | S148: 无权 | T148: 12.9 | U148: 17 | V148: 1.2e-002 | W148: 0.153 | X148: 0.13300000000000001 | Y148: 84 | Z148: 0.69 | AA148: 9.0000000000000011e-003 | AB148: 5.0000000000000001e-004 | AC148: 无权 | AD148: 无权 | AE148: 无权 | AF148: 102.23 | AG148: 0.32 | AH148: AA+ | AI148: 3.8199999999999998e-002 | AJ148: =H148+100*O148 -> 139.47999999999999 | AK148: 135.8 | AL148: 149 | AM148: 33.5 | AN148: 61 | AO148: 4.0999999999999995e-002 | AP148: 28 | AQ148: 苏农转债!
A149: 10 | B149: 127035 | C149: 濮耐转债 | D149: 2225 | E149: 濮耐股份 | F149: 钢铁 | G149: 钢铁行业 | H149: 110 | I149: 3.4999999999999996e-003 | J149: 4.0000000000000002e-004 | K149: 4.29 | L149: 6.9999999999999993e-003 | M149: 114.7 | N149: 4.43 | O149: 0.13600000000000001 | P149: 96.84 | Q149: 4月18天 | R149: 4.86年 | S149: 2.86年 | T149: 6.26 | U149: 8.4 | V149: 1.2e-002 | W149: 0.14400000000000002 | X149: 0.14000000000000001 | Y149: 43 | Z149: 1.43 | AA149: 8.8000000000000005e-003 | AB149: 3.3e-003 | AC149: -2.0299999999999999e-002 | AD149: -2.2499999999999999e-002 | AE149: 91.59 | AF149: 94.64 | AG149: 0.54 | AH149: AA | AI149: 4.1200000000000001e-002 | AJ149: =H149+100*O149 -> 123.59999999999999 | AK149: 123.2 | AL149: 34 | AM149: 28.5 | AN149: 32 | AO149: 1.2e-002 | AP149: 9 | AQ149: 濮耐转债
A150: 353 | B150: 110038 | C150: 济川转债! | D150: 600566 | E150: 济川药业 | F150: 医药 | G150: 中药 | H150: 106.3 | I150: 2.7000000000000001e-003 | J150: -2.8000000000000004e-003 | K150: 16.32 | L150: -2.3999999999999998e-003 | M150: 107.5 | N150: 23.4 | O150: 0.52400000000000002 | P150: 69.74 | Q150: 转股中 | R150: 1.33年 | S150: 回售内 | T150: 6.28 | U150: 7 | V150: 1.e-002 | W150: 4.2999999999999997e-002 | X150: 2.9999999999999999e-002 | Y150: 145 | Z150: 1.79 | AA150: 8.6e-003 | AB150: -2.0999999999999999e-003 | AC150: 回售内 | AD150: 回售内 | AE150: 100.25 | AF150: 102.18 | AG150: 0.03 | AH150: AA | AI150: 3.9399999999999998e-002 | AJ150: =H150+100*O150 -> 158.69999999999999 | AK150: 142.9 | AL150: 217 | AM150: 40.7 | AN150: 143 | AO150: -6.4000000000000001e-002 | AP150: 23 | AQ150: 济川转债!
A151: 263 | B151: 128070 | C151: 智能转债! | D151: 2877 | E151: 智能自控 | F151: 机械装备 | G151: 通用设备 | H151: 112.967 | I151: -1.3100000000000001e-002 | J151: 1.04e-002 | K151: 6.44 | L151: -9.1999999999999998e-003 | M151: 116.8 | N151: 9.47 | O151: 0.66099999999999992 | P151: 68 | Q151: 转股中 | R151: 3.96年 | S151: 无权 | T151: 2.3 | U151: 109 | V151: 0.41799999999999998 | W151: 0.107 | X151: 7.2999999999999995e-002 | Y151: 21 | Z151: 2.9 | AA151: 8.6e-003 | AB151: 1.1000000000000001e-003 | AC151: 无权 | AD151: 无权 | AE151: 无权 | AF151: 88.8 | AG151: 0.3 | AH151: A+ | AI151: 7.3200000000000001e-002 | AJ151: =H151+100*O151 -> 179.06700000000001 | AK151: 157.9 | AL151: 292 | AM151: 69.1 | AN151: 298 | AO151: -3.2000000000000001e-002 | AP151: 29 | AQ151: 智能转债!
A152: 43 | B152: 128144 | C152: 利民转债! | D152: 2734 | E152: 利民股份 | F152: 化工 | G152: 农化 | H152: 108.8 | I152: 9.4999999999999998e-003 | J152: -1.8e-003 | K152: 11.78 | L152: 1.7299999999999999e-002 | M152: 114.1 | N152: 13.98 | O152: 0.29100000000000004 | P152: 84.26 | Q152: 51天 | R152: 5.62年 | S152: 3.62年 | T152: 9.8 | U152: 5 | V152: 5.0000000000000001e-003 | W152: 0.223 | X152: 0.188 | Y152: 44 | Z152: 1.59 | AA152: 8.6e-003 | AB152: 4.0999999999999995e-003 | AC152: -1.4800000000000001e-002 | AD152: -1.6299999999999999e-002 | AE152: 87.95 | AF152: 90.61 | AG152: 0.44 | AH152: AA | AI152: 4.2500000000000003e-002 | AJ152: =H152+100*O152 -> 137.90000000000001 | AK152: 133.3 | AL152: 129 | AM152: 42.7 | AN152: 161 | AO152: 4.0000000000000001e-003 | AP152: 5 | AQ152: 利民转债!
A153: 274 | B153: 113026 | C153: 核能转债! | D153: 601985 | E153: XD中国核 | F153: 能源电力 | G153: 核电 | H153: 105.99 | I153: -4.0000000000000002e-004 | J153: -1.5e-003 | K153: 4.75 | L153: -6.3e-003 | M153: 109.3 | N153: 5.95 | O153: 0.32799999999999996 | P153: 79.83 | Q153: 转股中 | R153: 3.75年 | S153: 1.75年 | T153: 78 | U153: 81 | V153: 1.e-002 | W153: 9.4e-002 | X153: 7.4999999999999997e-002 | Y153: 829 | Z153: 1.34 | AA153: 8.3999999999999995e-003 | AB153: 3.7000000000000002e-003 | AC153: -1.5900000000000001e-002 | AD153: -1.8700000000000001e-002 | AE153: 96.08 | AF153: 95.91 | AG153: 0.29 | AH153: AAA | AI153: 3.6200000000000003e-002 | AJ153: =H153+100*O153 -> 138.78999999999999 | AK153: 132.1 | AL153: 115 | AM153: 36.1 | AN153: 84 | AO153: -5.7000000000000002e-002 | AP153: 43 | AQ153: 核能转债!
A154: 24 | B154: 123109 | C154: 昌红转债 | D154: 300151 | E154: 昌红科技 | F154: 机械装备 | G154: 专用设备 | H154: 115.48 | I154: 1.6000000000000001e-003 | J154: -1.89e-002 | K154: 23.68 | L154: -3.2300000000000002e-002 | M154: 121 | N154: 28.06 | O154: 0.36799999999999999 | P154: 84.39 | Q154: 2月24天 | R154: 5.71年 | S154: 3.71年 | T154: 4.6 | U154: 8 | V154: 1.4999999999999999e-002 | W154: 3.9e-002 | X154: 3.3000000000000002e-002 | Y154: 119 | Z154: 11.13 | AA154: 8.3999999999999995e-003 | AB154: 2.e-003 | AC154: -2.7099999999999999e-002 | AD154: -2.8900000000000002e-002 | AE154: 82.05 | AF154: 85.75 | AG154: 0.54 | AH154: AA- | AI154: 6.3500000000000001e-002 | AJ154: =H154+100*O154 -> 152.28 | AK154: 146.6 | AL154: 243 | AM154: 60.8 | AN154: 276 | AO154: -0.106 | AP154: 3 | AQ154: 昌红转债
A155: 76 | B155: 127026 | C155: 超声转债! | D155: 823 | E155: 超声电子 | F155: 电子 | G155: 元器件制 | H155: 108.26 | I155: 5.1000000000000004e-003 | J155: -9.1000000000000004e-003 | K155: 11.3 | L155: -7.9000000000000008e-003 | M155: 113.1 | N155: 12.72 | O155: 0.21899999999999997 | P155: 88.84 | Q155: 转股中 | R155: 5.39年 | S155: 3.40年 | T155: 7 | U155: 11 | V155: 1.3999999999999999e-002 | W155: 0.115 | X155: 0.10199999999999999 | Y155: 61 | Z155: 1.58 | AA155: 8.3000000000000001e-003 | AB155: 3.8e-003 | AC155: -1.24e-002 | AD155: -1.43e-002 | AE155: 89.44 | AF155: 90.74 | AG155: 0.5 | AH155: AA | AI155: 4.2500000000000003e-002 | AJ155: =H155+100*O155 -> 130.16 | AK155: 127.7 | AL155: 68 | AM155: 36.9 | AN155: 101 | AO155: 1.1000000000000001e-002 | AP155: 12 | AQ155: 超声转债!
A156: 157 | B156: 110071 | C156: 湖盐转债! | D156: 600929 | E156: 雪天盐业 | F156: 食品饮料 | G156: 食品饮料 | H156: 110.39 | I156: 3.0000000000000001e-003 | J156: 1.3600000000000001e-002 | K156: 6.68 | L156: 2.7699999999999999e-002 | M156: 114.9 | N156: 6.52 | O156: 7.6999999999999999e-002 | P156: 102.45 | Q156: 转股中 | R156: 4.98年 | S156: 2.98年 | T156: 7.2 | U156: 60 | V156: 7.5999999999999998e-002 | W156: 0.11599999999999999 | X156: 0.11800000000000001 | Y156: 62 | Z156: 2.31 | AA156: 8.199999999999999e-003 | AB156: 2.8000000000000004e-003 | AC156: -2.07e-002 | AD156: -2.2700000000000001e-002 | AE156: 91.15 | AF156: 94.31 | AG156: 0.6 | AH156: AA | AI156: 4.1200000000000001e-002 | AJ156: =H156+100*O156 -> 118.09 | AK156: 118.3 | AL156: 11 | AM156: 24 | AN156: 18 | AO156: 3.3000000000000002e-002 | AP156: 23 | AQ156: 湖盐转债!
A157: 286 | B157: 123024 | C157: 岱勒转债! | D157: 300700 | E157: 岱勒新材 | F157: 机械装备 | G157: 专用设备 | H157: 110.18 | I157: -1.1000000000000001e-003 | J157: 2.8999999999999998e-003 | K157: 12.83 | L157: 3.9000000000000003e-003 | M157: 112.5 | N157: 14.1 | O157: 0.21100000000000002 | P157: 90.99 | Q157: 转股中 | R157: 2.68年 | S157: 0.68年 | T157: 2.1 | U157: 5.4 | V157: 2.3e-002 | W157: 0.153 | X157: 0.13900000000000001 | Y157: 14 | Z157: 2.18 | AA157: 7.9000000000000008e-003 | AB157: -5.9999999999999995e-004 | AC157: -9.5199999999999993e-002 | AD157: -0.10099999999999999 | AE157: 95.52 | AF157: 93.73 | AG157: 0.47 | AH157: A+ | AI157: 7.1399999999999991e-002 | AJ157: =H157+100*O157 -> 131.28 | AK157: 129.4 | AL157: 80 | AM157: 33.8 | AN157: 68 | AO157: -3.2000000000000001e-002 | AP157: 36 | AQ157: 岱勒转债!
A158: 57 | B158: 127028 | C158: 英特转债! | D158: 411. | E158: 英特集团 | F158: 医药 | G158: 医药商业 | H158: 108.602 | I158: 5.8999999999999999e-003 | J158: -5.4000000000000003e-003 | K158: 12.88 | L158: 8.0000000000000004e-004 | M158: 113.1 | N158: 13.4 | O158: 0.13 | P158: 96.12 | Q158: 转股中 | R158: 5.47年 | S158: 3.47年 | T158: 6 | U158: 6.7 | V158: 1.e-002 | W158: 0.187 | X158: 0.17999999999999999 | Y158: 32 | Z158: 1.88 | AA158: 7.6e-003 | AB158: 3.2000000000000002e-003 | AC158: -1.3000000000000001e-002 | AD158: -1.4800000000000001e-002 | AE158: 90.09 | AF158: 91.86 | AG158: 0.56 | AH158: AA+ | AI158: 3.95e-002 | AJ158: =H158+100*O158 -> 121.602 | AK158: 121.1 | AL158: 19 | AM158: 29.2 | AN158: 33 | AO158: -2.4e-002 | AP158: 22 | AQ158: 英特转债!
A159: 36 | B159: 123105 | C159: 拓尔转债! | D159: 300229 | E159: 拓尔思 | F159: 计算机及 | G159: 软件开发 | H159: 116.081 | I159: 8.5000000000000006e-003 | J159: -7.1999999999999998e-003 | K159: 9.23 | L159: 2.2000000000000001e-003 | M159: 121 | N159: 9.93 | O159: 0.249 | P159: 92.95 | Q159: 2月11天 | R159: 5.67年 | S159: 3.67年 | T159: 8 | U159: 16 | V159: 1.7000000000000001e-002 | W159: 0.121 | X159: 0.11199999999999999 | Y159: 66 | Z159: 3.04 | AA159: 7.4999999999999997e-003 | AB159: 1.1000000000000001e-003 | AC159: -2.86e-002 | AD159: -3.0499999999999999e-002 | AE159: 82.23 | AF159: 85.94 | AG159: 0.6 | AH159: AA- | AI159: 6.3500000000000001e-002 | AJ159: =H159+100*O159 -> 140.98099999999999 | AK159: 139.2 | AL159: 188 | AM159: 53.3 | AN159: 226 | AO159: 2.3e-002 | AP159: 6 | AQ159: 拓尔转债!
A160: 59 | B160: 123092 | C160: 天壕转债 | D160: 300332 | E160: 天壕环境 | F160: 石油天然 | G160: 天然气 | H160: 116.928 | I160: 6.6e-003 | J160: -5.3e-003 | K160: 5.68 | L160: 1.8e-003 | M160: 121.6 | N160: 5.19 | O160: 6.8000000000000005e-002 | P160: 109.44 | Q160: 转股中 | R160: 5.44年 | S160: 3.44年 | T160: 4.23 | U160: 6.6 | V160: 1.3000000000000001e-002 | W160: 8.5000000000000006e-002 | X160: 9.3000000000000013e-002 | Y160: 50 | Z160: 1.48 | AA160: 7.4000000000000003e-003 | AB160: 5.9999999999999995e-004 | AC160: -3.0699999999999998e-002 | AD160: -3.3099999999999997e-002 | AE160: 80.99 | AF160: 83.06 | AG160: 0.72 | AH160: A+ | AI160: 7.4499999999999997e-002 | AJ160: =H160+100*O160 -> 123.72799999999999 | AK160: 124.4 | AL160: 44 | AM160: 41.4 | AN160: 149 | AO160: 2.9999999999999999e-002 | AP160: 9 | AQ160: 天壕转债
A161: 338 | B161: 128034 | C161: 江银转债! | D161: 2807 | E161: 江阴银行 | F161: 金融 | G161: 银行行业 | H161: 106.42 | I161: 5.9999999999999995e-004 | J161: -1.5e-003 | K161: 3.89 | L161: -2.5999999999999999e-003 | M161: 108.3 | N161: 4.32 | O161: 0.182 | P161: 90.05 | Q161: 转股中 | R161: 2.53年 | S161: 无权 | T161: 17.6 | U161: 4.9 | V161: 3.0000000000000001e-003 | W161: 0.20800000000000002 | X161: 0.187 | Y161: 84 | Z161: 0.71 | AA161: 6.9999999999999993e-003 | AB161: 8.0000000000000004e-004 | AC161: 无权 | AD161: 无权 | AE161: 无权 | AF161: 99.04 | AG161: 0.37 | AH161: AA+ | AI161: 3.6400000000000002e-002 | AJ161: =H161+100*O161 -> 124.62 | AK161: 122.8 | AL161: 29 | AM161: 23.8 | AN161: 16 | AO161: -1.2e-002 | AP161: 25 | AQ161: 江银转债!
A162: 362 | B162: 128014 | C162: 永东转债! | D162: 2753 | E162: 永东股份 | F162: 化工 | G162: 化工 | H162: 108.501 | I162: 1.24e-002 | J162: -6.8000000000000005e-003 | K162: 9.8 | L162: 3.27e-002 | M162: 109.8 | N162: 12.52 | O162: 0.38600000000000001 | P162: 78.27 | Q162: 转股中 | R162: 1.75年 | S162: 回售内 | T162: 3.37 | U162: 9.7 | V162: 2.7000000000000003e-002 | W162: 9.1999999999999998e-002 | X162: 7.2000000000000008e-002 | Y162: 37 | Z162: 1.85 | AA162: 6.8999999999999999e-003 | AB162: -3.4999999999999996e-003 | AC162: 回售内 | AD162: 回售内 | AE162: 100.3 | AF162: 99.17 | AG162: 0.17 | AH162: AA- | AI162: 6.0400000000000002e-002 | AJ162: =H162+100*O162 -> 147.101 | AK162: 138.7 | AL162: 185 | AM162: 38.4 | AN162: 120 | AO162: 7.0999999999999994e-002 | AP162: 37 | AQ162: 永东转债!
A163: 40 | B163: 123101 | C163: 拓斯转债! | D163: 300607 | E163: 拓斯达 | F163: 机械装备 | G163: 机器人及 | H163: 110.8 | I163: -7.1999999999999998e-003 | J163: 2.e-003 | K163: 19.57 | L163: -1.5600000000000001e-002 | M163: 115.1 | N163: 26.19 | O163: 0.48299999999999998 | P163: 74.72 | Q163: 2月2天 | R163: 5.65年 | S163: 3.65年 | T163: 6.7 | U163: 13 | V163: 1.7000000000000001e-002 | W163: 8.0000000000000002e-002 | X163: 5.9999999999999998e-002 | Y163: 83 | Z163: 2.32 | AA163: 6.8999999999999999e-003 | AB163: 2.0999999999999999e-003 | AC163: -1.7600000000000001e-002 | AD163: -1.9400000000000001e-002 | AE163: 88.51 | AF163: 91.38 | AG163: 0.33 | AH163: AA | AI163: 4.2500000000000003e-002 | AJ163: =H163+100*O163 -> 159.09999999999999 | AK163: 146.9 | AL163: 247 | AM163: 55.5 | AN163: 242 | AO163: -0.313 | AP163: 4 | AQ163: 拓斯转债!
A164: 254 | B164: 128074 | C164: 游族转债!! | D164: 2174 | E164: 游族网络 | F164: 通信互联 | G164: 互联网 | H164: 116.6 | I164: 6.0000000000000001e-003 | J164: 1.3899999999999999e-002 | K164: 15.75 | L164: 3.8199999999999998e-002 | M164: 119.9 | N164: 16.97 | O164: 0.25600000000000001 | P164: 92.81 | Q164: 转股中 | R164: 4.19年 | S164: 2.19年 | T164: 6.83 | U164: 75 | V164: 9.4e-002 | W164: 4.7e-002 | X164: 4.4000000000000004e-002 | Y164: 144 | Z164: 2.82 | AA164: 6.8000000000000005e-003 | AB164: -1.4000000000000002e-003 | AC164: -5.0199999999999995e-002 | AD164: -5.28e-002 | AE164: 94.12 | AF164: 101.61 | AG164: 0.52 | AH164: AA | AI164: 4.1200000000000001e-002 | AJ164: =H164+100*O164 -> 142.19999999999999 | AK164: 140.4 | AL164: 202 | AM164: 38.8 | AN164: 125 | AO164: -6.7000000000000004e-002 | AP164: 27 | AQ164: 游族转债!!
A165: 146 | B165: 123061 | C165: 航新转债! | D165: 300424 | E165: 航新科技 | F165: 航空航天 | G165: 航空航天 | H165: 120.798 | I165: 2.6000000000000002e-002 | J165: 2.1400000000000002e-002 | K165: 15.87 | L165: 7.0099999999999996e-002 | M165: 124.8 | N165: 14.85 | O165: 0.13 | P165: 106.87 | Q165: 转股中 | R165: 5年5.1天 | S165: 3年6.1天 | T165: 2.5 | U165: 1869. | V165: 6.04 | W165: 6.6000000000000003e-002 | X165: 7.0000000000000007e-002 | Y165: 38 | Z165: 5.71 | AA165: 6.7000000000000002e-003 | AB165: -1.6000000000000001e-003 | AC165: -4.4500000000000005e-002 | AD165: -4.7100000000000003e-002 | AE165: 83.61 | AF165: 87.89 | AG165: 0.67 | AH165: A+ | AI165: 7.4499999999999997e-002 | AJ165: =H165+100*O165 -> 133.798 | AK165: 134.7 | AL165: 140 | AM165: 46.8 | AN165: 192 | AO165: 1.3999999999999999e-002 | AP165: 17 | AQ165: 航新转债!
A166: 141 | B166: 123062 | C166: 三超转债 | D166: 300554 | E166: 三超新材 | F166: 机械装备 | G166: 通用设备 | H166: 115.951 | I166: -3.0000000000000001e-003 | J166: 4.1999999999999997e-003 | K166: 16.9 | L166: 1.8e-003 | M166: 119.7 | N166: 17.13 | O166: 0.17499999999999999 | P166: 98.66 | Q166: 转股中 | R166: 5年10天 | S166: 3年11天 | T166: 1.95 | U166: 64 | V166: 0.28000000000000003 | W166: 0.12300000000000001 | X166: 0.121 | Y166: 16 | Z166: 3.02 | AA166: 6.5000000000000006e-003 | AB166: -2.9999999999999997e-004 | AC166: -3.2000000000000001e-002 | AD166: -3.4700000000000002e-002 | AE166: 81.02 | AF166: 80.5 | AG166: 0.7 | AH166: A | AI166: 8.4499999999999992e-002 | AJ166: =H166+100*O166 -> 133.45099999999999 | AK166: 133.2 | AL166: 128 | AM166: 52.2 | AN166: 225 | AO166: -9.3000000000000013e-002 | AP166: 24 | AQ166: 三超转债
A167: 48 | B167: 123097 | C167: 美力转债 | D167: 300611 | E167: 美力科技 | F167: 机械装备 | G167: 通用设备 | H167: 117.4 | I167: -1.5900000000000001e-002 | J167: -5.7999999999999996e-003 | K167: 10.35 | L167: -2.9999999999999999e-002 | M167: 121.6 | N167: 9.28 | O167: 5.2999999999999999e-002 | P167: 111.53 | Q167: 17天 | R167: 5.53年 | S167: 3.53年 | T167: 3 | U167: 28 | V167: 8.0000000000000002e-002 | W167: 0.16200000000000001 | X167: 0.18100000000000002 | Y167: 19 | Z167: 2.78 | AA167: 6.5000000000000006e-003 | AB167: -2.0000000000000001e-004 | AC167: -3.1e-002 | AD167: -3.3300000000000003e-002 | AE167: 80.45 | AF167: 82.5 | AG167: 0.73 | AH167: A+ | AI167: 7.4499999999999997e-002 | AJ167: =H167+100*O167 -> 122.7 | AK167: 123.3 | AL167: 36 | AM167: 40.8 | AN167: 145 | AO167: 5.0000000000000001e-003 | AP167: 19 | AQ167: 美力转债
A168: 227 | B168: 128090 | C168: 汽模转2 | D168: 2510 | E168: 天汽模 | F168: 汽车 | G168: 零部件制 | H168: 111.811 | I168: 2.e-003 | J168: -6.3e-003 | K168: 4.09 | L168: -7.3000000000000001e-003 | M168: 114.9 | N168: 4.23 | O168: 0.156 | P168: 96.69 | Q168: 转股中 | R168: 4.45年 | S168: 2.45年 | T168: 3.1 | U168: 5.3 | V168: 1.4999999999999999e-002 | W168: 8.1000000000000003e-002 | X168: 7.8e-002 | Y168: 39 | Z168: 1.91 | AA168: 6.3e-003 | AB168: 2.0000000000000001e-004 | AC168: -2.9700000000000001e-002 | AD168: -3.2099999999999997e-002 | AE168: 88.45 | AF168: 88.36 | AG168: 0.6 | AH168: AA- | AI168: 6.2199999999999998e-002 | AJ168: =H168+100*O168 -> 127.411 | AK168: 126.9 | AL168: 61 | AM168: 38.5 | AN168: 122 | AO168: -9.0000000000000011e-003 | AP168: 29 | AQ168: 汽模转2
A169: 83 | B169: 113610 | C169: 灵康转债 | D169: 603669 | E169: 灵康药业 | F169: 医药 | G169: 化学制药 | H169: 117.46 | I169: 3.3700000000000001e-002 | J169: 4.7999999999999996e-003 | K169: 9.69 | L169: 5.4400000000000004e-002 | M169: 121.1 | N169: 8.61 | O169: 4.4000000000000004e-002 | P169: 112.54 | Q169: 转股中 | R169: 5.38年 | S169: 3.38年 | T169: 5.25 | U169: 75 | V169: 0.122 | W169: 7.5999999999999998e-002 | X169: 8.5000000000000006e-002 | Y169: 69 | Z169: 4.91 | AA169: 5.7999999999999996e-003 | AB169: -8.9999999999999998e-004 | AC169: -3.4000000000000002e-002 | AD169: -3.61e-002 | AE169: 83.84 | AF169: 87.61 | AG169: 0.71 | AH169: AA- | AI169: 6.3500000000000001e-002 | AJ169: =H169+100*O169 -> 121.86 | AK169: 122.4 | AL169: 28 | AM169: 34.8 | AN169: 73 | AO169: 0.124 | AP169: 26 | AQ169: 灵康转债
A170: 326 | B170: 128040 | C170: 华通转债! | D170: 2758 | E170: 浙农股份 | F170: 医药 | G170: 医药商业 | H170: 109.801 | I170: -5.0000000000000001e-004 | J170: -3.0000000000000001e-003 | K170: 9.44 | L170: -8.3999999999999995e-003 | M170: 111.3 | N170: 10.15 | O170: 0.18100000000000002 | P170: 93 | Q170: 转股中 | R170: 2.91年 | S170: 0.91年 | T170: 2.22 | U170: 5.7 | V170: 2.3e-002 | W170: 4.8000000000000001e-002 | X170: 4.4999999999999998e-002 | Y170: 46 | Z170: 1.53 | AA170: 4.6999999999999993e-003 | AB170: -2.3999999999999998e-003 | AC170: -6.7900000000000002e-002 | AD170: -7.0900000000000005e-002 | AE170: 97.65 | AF170: 99.62 | AG170: 0.42 | AH170: AA | AI170: 3.9399999999999998e-002 | AJ170: =H170+100*O170 -> 127.90100000000001 | AK170: 126.6 | AL170: 60 | AM170: 27 | AN170: 27 | AO170: -5.0000000000000001e-003 | AP170: 32 | AQ170: 华通转债!
A171: 208 | B171: 110067 | C171: 华安转债! | D171: 600909 | E171: 华安证券 | F171: 金融 | G171: 证券行业 | H171: 107.99 | I171: 2.7000000000000001e-003 | J171: -2.7000000000000001e-003 | K171: 5.35 | L171: 0. | M171: 110.3 | N171: 6.22 | O171: 0.25600000000000001 | P171: 86.01 | Q171: 转股中 | R171: 4.65年 | S171: 无权 | T171: 28 | U171: 23 | V171: 8.0000000000000002e-003 | W171: 0.111 | X171: 9.6000000000000002e-002 | Y171: 251 | Z171: 1.35 | AA171: 4.5999999999999999e-003 | AB171: 5.0000000000000001e-004 | AC171: 无权 | AD171: 无权 | AE171: 无权 | AF171: 93.68 | AG171: 0.42 | AH171: AAA | AI171: 3.6200000000000003e-002 | AJ171: =H171+100*O171 -> 133.59 | AK171: 130 | AL171: 90 | AM171: 36.3 | AN171: 85 | AO171: -2.1000000000000001e-002 | AP171: 26 | AQ171: 华安转债!
A172: 98 | B172: 123075 | C172: 贝斯转债! | D172: 300580 | E172: 贝斯特 | F172: 汽车 | G172: 零部件制 | H172: 112.793 | I172: 7.0999999999999995e-003 | J172: -4.5999999999999999e-003 | K172: 20.07 | L172: 4.5000000000000005e-003 | M172: 115.5 | N172: 23.74 | O172: 0.33399999999999996 | P172: 84.54 | Q172: 转股中 | R172: 5.30年 | S172: 3.30年 | T172: 6 | U172: 7.6 | V172: 1.1000000000000001e-002 | W172: 0.14899999999999999 | X172: 0.126 | Y172: 40 | Z172: 2.33 | AA172: 4.5999999999999999e-003 | AB172: -7.000000000000001e-004 | AC172: -2.3799999999999998e-002 | AD172: -2.5899999999999999e-002 | AE172: 84.09 | AF172: 83.96 | AG172: 0.54 | AH172: AA- | AI172: 6.3500000000000001e-002 | AJ172: =H172+100*O172 -> 146.19300000000001 | AK172: 141 | AL172: 207 | AM172: 57 | AN172: 250 | AO172: 1.4999999999999999e-002 | AP172: 8 | AQ172: 贝斯转债!
A173: 223 | B173: 127015 | C173: 希望转债!! | D173: 876 | E173: 新 希 望 | F173: 农业 | G173: 畜牧业 | H173: 107.87 | I173: -1.1999999999999999e-003 | J173: -1.2999999999999999e-003 | K173: 12.6 | L173: -2.7000000000000003e-002 | M173: 110 | N173: 19.75 | O173: 0.69099999999999995 | P173: 63.8 | Q173: 转股中 | R173: 4.47年 | S173: 2.47年 | T173: 9.5 | U173: 7.4 | V173: 6.9999999999999993e-003 | W173: 1.7000000000000001e-002 | X173: 1.1000000000000001e-002 | Y173: 568 | Z173: 1.53 | AA173: 4.5000000000000005e-003 | AB173: 2.9999999999999997e-004 | AC173: -1.8700000000000001e-002 | AD173: -2.06e-002 | AE173: 93.55 | AF173: 94.09 | AG173: 0.09 | AH173: AAA | AI173: 3.6200000000000003e-002 | AJ173: =H173+100*O173 -> 176.97 | AK173: 151.9 | AL173: 270 | AM173: 57.8 | AN173: 257 | AO173: -0.10099999999999999 | AP173: 26 | AQ173: 希望转债!!
A174: 87 | B174: 113609 | C174: 永安转债! | D174: 603776 | E174: 永安行 | F174: 城市公用 | G174: 其他 | H174: 117.69 | I174: 2.5399999999999999e-002 | J174: 2.3300000000000001e-002 | K174: 19.13 | L174: 6.5700000000000008e-002 | M174: 120.5 | N174: 16.48 | O174: 1.3999999999999999e-002 | P174: 116.08 | Q174: 转股中 | R174: 5.36年 | S174: 3.36年 | T174: 7.35 | U174: 328 | V174: 0.38200000000000001 | W174: 0.16699999999999998 | X174: 0.19399999999999998 | Y174: 44 | Z174: 1.14 | AA174: 4.5000000000000005e-003 | AB174: -2.0999999999999999e-003 | AC174: -3.5200000000000002e-002 | AD174: -3.7200000000000004e-002 | AE174: 83.78 | AF174: 87.24 | AG174: 0.74 | AH174: AA- | AI174: 6.3500000000000001e-002 | AJ174: =H174+100*O174 -> 119.09 | AK174: 119.3 | AL174: 13 | AM174: 32.1 | AN174: 52 | AO174: 2.e-002 | AP174: 22 | AQ174: 永安转债!
A175: 204 | B175: 123045 | C175: 雷迪转债 | D175: 300652 | E175: 雷迪克 | F175: 汽车 | G175: 零部件制 | H175: 116.611 | I175: -9.3999999999999986e-003 | J175: -5.0000000000000001e-003 | K175: 19.06 | L175: -2.3099999999999999e-002 | M175: 118.9 | N175: 19.63 | O175: 0.20100000000000001 | P175: 97.1 | Q175: 转股中 | R175: 4.65年 | S175: 2.66年 | T175: 1.66 | U175: 107 | V175: 0.54899999999999993 | W175: 9.3000000000000013e-002 | X175: 8.9999999999999997e-002 | Y175: 18 | Z175: 1.89 | AA175: 4.3e-003 | AB175: -2.8000000000000004e-003 | AC175: -3.9900000000000005e-002 | AD175: -4.2500000000000003e-002 | AE175: 85.45 | AF175: 86.26 | AG175: 0.62 | AH175: A+ | AI175: 7.3200000000000001e-002 | AJ175: =H175+100*O175 -> 136.71100000000001 | AK175: 136.1 | AL175: 152 | AM175: 49.9 | AN175: 212 | AO175: -4.2000000000000003e-002 | AP175: 34 | AQ175: 雷迪转债
A176: 190 | B176: 128106 | C176: 华统转债 | D176: 2840 | E176: 华统股份 | F176: 农业 | G176: 农产品加 | H176: 110.739 | I176: -1.1200000000000002e-002 | J176: -4.0000000000000002e-004 | K176: 8.82 | L176: -2.2200000000000001e-002 | M176: 112.9 | N176: 9.37 | O176: 0.17600000000000002 | P176: 94.13 | Q176: 转股中 | R176: 4.73年 | S176: 2.73年 | T176: 5.35 | U176: 6.4 | V176: 1.1000000000000001e-002 | W176: 0.13600000000000001 | X176: 0.128 | Y176: 39 | Z176: 2.24 | AA176: 4.1999999999999997e-003 | AB176: -8.0000000000000004e-004 | AC176: -2.35e-002 | AD176: -2.5699999999999997e-002 | AE176: 92.07 | AF176: 93.62 | AG176: 0.52 | AH176: AA | AI176: 4.1200000000000001e-002 | AJ176: =H176+100*O176 -> 128.339 | AK176: 127.3 | AL176: 62 | AM176: 33.7 | AN176: 65 | AO176: -1.8000000000000002e-002 | AP176: 8 | AQ176: 华统转债
A177: 116 | B177: 128133 | C177: 奇正转债! | D177: 2287 | E177: 奇正藏药 | F177: 医药 | G177: 中药 | H177: 115 | I177: 1.0500000000000001e-002 | J177: -2.06e-002 | K177: 29.25 | L177: -1.8500000000000003e-002 | M177: 117.3 | N177: 29.78 | O177: 0.17100000000000001 | P177: 98.22 | Q177: 转股中 | R177: 5.18年 | S177: 3.19年 | T177: 8 | U177: 39 | V177: 4.2999999999999997e-002 | W177: 5.2000000000000005e-002 | X177: 5.0999999999999997e-002 | Y177: 155 | Z177: 5.99 | AA177: 3.9000000000000003e-003 | AB177: -2.e-003 | AC177: -3.04e-002 | AD177: -3.2500000000000001e-002 | AE177: 90.42 | AF177: 94.96 | AG177: 0.55 | AH177: AA | AI177: 4.2500000000000003e-002 | AJ177: =H177+100*O177 -> 132.09999999999999 | AK177: 131.8 | AL177: 112 | AM177: 36.8 | AN177: 96 | AO177: 8.3000000000000004e-002 | AP177: 16 | AQ177: 奇正转债!
A178: 143 | B178: 110073 | C178: 国投转债 | D178: 600061 | E178: 国投资本 | F178: 金融 | G178: 证券行业 | H178: 108.46 | I178: 1.5e-003 | J178: 1.e-003 | K178: 8.18 | L178: 6.1999999999999998e-003 | M178: 110.5 | N178: 9.9 | O178: 0.313 | P178: 82.63 | Q178: 转股中 | R178: 5年7天 | S178: 无权 | T178: 80 | U178: 27 | V178: 3.0000000000000001e-003 | W178: 0.152 | X178: 0.126 | Y178: 526 | Z178: 0.8 | AA178: 3.8e-003 | AB178: -1.e-004 | AC178: 无权 | AD178: 无权 | AE178: 无权 | AF178: 92.09 | AG178: 0.4 | AH178: AAA | AI178: 3.7499999999999999e-002 | AJ178: =H178+100*O178 -> 139.75999999999999 | AK178: 134.3 | AL178: 137 | AM178: 42.2 | AN178: 153 | AO178: -1.1000000000000001e-002 | AP178: 24 | AQ178: 国投转债
A179: 74 | B179: 113043 | C179: 财通转债! | D179: 601108 | E179: 财通证券 | F179: 金融 | G179: 证券行业 | H179: 108.05 | I179: -1.4000000000000002e-003 | J179: 2.9999999999999997e-004 | K179: 10.25 | L179: -2.8999999999999998e-003 | M179: 110.2 | N179: 13.13 | O179: 0.38400000000000001 | P179: 78.07 | Q179: 转股中 | R179: 5.40年 | S179: 无权 | T179: 38 | U179: 19 | V179: 5.0000000000000001e-003 | W179: 0.10300000000000001 | X179: 8.1000000000000003e-002 | Y179: 368 | Z179: 1.61 | AA179: 3.7000000000000002e-003 | AB179: 2.0000000000000001e-004 | AC179: 无权 | AD179: 无权 | AE179: 无权 | AF179: 90.59 | AG179: 0.38 | AH179: AAA | AI179: 3.7499999999999999e-002 | AJ179: =H179+100*O179 -> 146.44999999999999 | AK179: 138 | AL179: 180 | AM179: 47.4 | AN179: 198 | AO179: -5.0000000000000001e-003 | AP179: 10 | AQ179: 财通转债!
A180: 93 | B180: 127025 | C180: 冀东转债! | D180: 401 | E180: 冀东水泥 | F180: 建筑 | G180: 水泥 | H180: 108.05 | I180: 2.3e-003 | J180: -3.2000000000000002e-003 | K180: 12.1 | L180: -2.5000000000000001e-003 | M180: 110.1 | N180: 15.28 | O180: 0.36399999999999999 | P180: 79.19 | Q180: 转股中 | R180: 5.30年 | S180: 3.31年 | T180: 17.8 | U180: 1.8 | V180: 1.e-003 | W180: 0.10400000000000001 | X180: 8.199999999999999e-002 | Y180: 171 | Z180: 1.15 | AA180: 3.5999999999999999e-003 | AB180: 1.e-004 | AC180: -1.4199999999999999e-002 | AD180: -1.5700000000000002e-002 | AE180: 90.59 | AF180: 90.84 | AG180: 0.38 | AH180: AAA | AI180: 3.7499999999999999e-002 | AJ180: =H180+100*O180 -> 144.44999999999999 | AK180: 136.9 | AL180: 164 | AM180: 46.1 | AN180: 188 | AO180: -2.e-002 | AP180: 9 | AQ180: 冀东转债!
A181: 237 | B181: 110062 | C181: 烽火转债! | D181: 600498 | E181: XD烽火通 | F181: 通信互联 | G181: 通信设备 | H181: 109.24 | I181: -2.5999999999999999e-003 | J181: 1.e-003 | K181: 18.4 | L181: -4.8999999999999998e-003 | M181: 110.8 | N181: 22.85 | O181: 0.35700000000000004 | P181: 80.53 | Q181: 转股中 | R181: 4.38年 | S181: 2.38年 | T181: 30.9 | U181: 13 | V181: 4.0000000000000001e-003 | W181: 0.14800000000000002 | X181: 0.11900000000000001 | Y181: 208 | Z181: 1.93 | AA181: 3.3e-003 | AB181: -1.2999999999999999e-003 | AC181: -2.1899999999999999e-002 | AD181: -2.4300000000000002e-002 | AE181: 94.44 | AF181: 95.13 | AG181: 0.33 | AH181: AAA | AI181: 3.6200000000000003e-002 | AJ181: =H181+100*O181 -> 144.94 | AK181: 138 | AL181: 175 | AM181: 42.8 | AN181: 162 | AO181: 2.e-003 | AP181: 19 | AQ181: 烽火转债!
A182: 100 | B182: 113606 | C182: 荣泰转债 | D182: 603579 | E182: 荣泰健康 | F182: 机械装备 | G182: 专用设备 | H182: 119.21 | I182: -1.1399999999999999e-002 | J182: 4.0000000000000002e-004 | K182: 35.09 | L182: -1.6299999999999999e-002 | M182: 121.2 | N182: 32.83 | O182: 0.115 | P182: 106.88 | Q182: 转股中 | R182: 5.29年 | S182: 3.29年 | T182: 6 | U182: 15 | V182: 2.1000000000000001e-002 | W182: 0.122 | X182: 0.13100000000000001 | Y182: 49 | Z182: 2.93 | AA182: 3.2000000000000002e-003 | AB182: -3.7000000000000002e-003 | AC182: -3.8800000000000001e-002 | AD182: -4.0999999999999995e-002 | AE182: 84.39 | AF182: 88.18 | AG182: 0.68 | AH182: AA- | AI182: 6.3500000000000001e-002 | AJ182: =H182+100*O182 -> 130.70999999999998 | AK182: 131.5 | AL182: 110 | AM182: 43.4 | AN182: 163 | AO182: -8.0000000000000002e-002 | AP182: 10 | AQ182: 荣泰转债
A183: 105 | B183: 123071 | C183: 天能转债! | D183: 300569 | E183: 天能重工 | F183: 能源电力 | G183: 风能 | H183: 119.203 | I183: 1.e-002 | J183: 2.3099999999999999e-002 | K183: 8.52 | L183: 4.8000000000000001e-002 | M183: 121.1 | N183: 7.73 | O183: 8.199999999999999e-002 | P183: 110.22 | Q183: 转股中 | R183: 5.26年 | S183: 3.27年 | T183: 7 | U183: 44 | V183: 5.2000000000000005e-002 | W183: 0.121 | X183: 0.13300000000000001 | Y183: 58 | Z183: 1.43 | AA183: 3.0999999999999999e-003 | AB183: -3.8e-003 | AC183: -3.9300000000000002e-002 | AD183: -4.1399999999999999e-002 | AE183: 84.41 | AF183: 88.21 | AG183: 0.69 | AH183: AA- | AI183: 6.3500000000000001e-002 | AJ183: =H183+100*O183 -> 127.40300000000001 | AK183: 128.2 | AL183: 73 | AM183: 40 | AN183: 138 | AO183: 1.4999999999999999e-002 | AP183: 14 | AQ183: 天能转债!
A184: 310 | B184: 128048 | C184: 张行转债 | D184: 2839 | E184: 张家港行 | F184: 金融 | G184: 银行行业 | H184: 112.2 | I184: 1.8e-003 | J184: 1.8e-003 | K184: 5.56 | L184: 7.1999999999999998e-003 | M184: 113.3 | N184: 5.6 | O184: 0.13 | P184: 99.29 | Q184: 转股中 | R184: 3.32年 | S184: 无权 | T184: 25 | U184: 33 | V184: 1.2e-002 | W184: 0.248 | X184: 0.247 | Y184: 101 | Z184: 0.9 | AA184: 3.0000000000000001e-003 | AB184: -4.3e-003 | AC184: 无权 | AD184: 无权 | AE184: 无权 | AF184: 100.29 | AG184: 0.5 | AH184: AA+ | AI184: 3.8199999999999998e-002 | AJ184: =H184+100*O184 -> 125.2 | AK184: 125.1 | AL184: 47 | AM184: 24.8 | AN184: 20 | AO184: 2.4e-002 | AP184: 11 | AQ184: 张行转债
A185: 19 | B185: 127032 | C185: 苏行转债 | D185: 2966 | E185: 苏州银行 | F185: 金融 | G185: 银行行业 | H185: 113.21 | I185: -8.6999999999999994e-003 | J185: 6.0000000000000001e-003 | K185: 7.56 | L185: -5.3e-003 | M185: 115.1 | N185: 8.1 | O185: 0.21299999999999999 | P185: 93.33 | Q185: 3月4天 | R185: 5.74年 | S185: 无权 | T185: 50 | U185: 19 | V185: 3.0000000000000001e-003 | W185: 0.19800000000000001 | X185: 0.185 | Y185: 252 | Z185: 0.82 | AA185: 2.8999999999999998e-003 | AB185: -1.8e-003 | AC185: 无权 | AD185: 无权 | AE185: 无权 | AF185: 93.51 | AG185: 0.51 | AH185: AAA | AI185: 3.7499999999999999e-002 | AJ185: =H185+100*O185 -> 134.50999999999999 | AK185: 133.1 | AL185: 122 | AM185: 39.6 | AN185: 134 | AO185: -3.0000000000000001e-003 | AP185: 7 | AQ185: 苏行转债
A186: 37 | B186: 123104 | C186: 卫宁转债 | D186: 300253 | E186: 卫宁健康 | F186: 计算机及 | G186: 软件开发 | H186: 123.19 | I186: -1.e-004 | J186: -1.3100000000000001e-002 | K186: 16.48 | L186: -2.9399999999999999e-002 | M186: 125.1 | N186: 17.74 | O186: 0.32600000000000001 | P186: 92.9 | Q186: 2月8天 | R186: 5.66年 | S186: 3.67年 | T186: 9.7 | U186: 9.1 | V186: 8.0000000000000002e-003 | W186: 2.7000000000000003e-002 | X186: 2.6000000000000002e-002 | Y186: 353 | Z186: 7.72 | AA186: 2.8000000000000004e-003 | AB186: -4.5999999999999999e-003 | AC186: -4.4500000000000005e-002 | AD186: -4.6199999999999998e-002 | AE186: 88.45 | AF186: 99.21 | AG186: 0.45 | AH186: AA | AI186: 4.2500000000000003e-002 | AJ186: =H186+100*O186 -> 155.78999999999999 | AK186: 153.5 | AL186: 274 | AM186: 54.3 | AN186: 236 | AO186: 1.3000000000000001e-002 | AP186: 4 | AQ186: 卫宁转债
A187: 103 | B187: 113605 | C187: 大参转债! | D187: 603233 | E187: 大参林 | F187: 医药 | G187: 医药商业 | H187: 113.59 | I187: -1.e-004 | J187: 1.e-004 | K187: 44.65 | L187: 0. | M187: 115.2 | N187: 69.09 | O187: 0.75800000000000001 | P187: 64.63 | Q187: 转股中 | R187: 5.27年 | S187: 3.27年 | T187: 14.1 | U187: 2.9 | V187: 2.e-003 | W187: 4.0000000000000001e-002 | X187: 2.6000000000000002e-002 | Y187: 353 | Z187: 5.49 | AA187: 2.7000000000000001e-003 | AB187: -2.3999999999999998e-003 | AC187: -2.64e-002 | AD187: -2.8399999999999998e-002 | AE187: 90.02 | AF187: 92.93 | AG187: 0.19 | AH187: AA | AI187: 4.2500000000000003e-002 | AJ187: =H187+100*O187 -> 189.38999999999999 | AK187: 162.6 | AL187: 299 | AM187: 69.6 | AN187: 299 | AO187: -9.5000000000000001e-002 | AP187: 7 | AQ187: 大参转债!
A188: 161 | B188: 123057 | C188: 美联转债! | D188: 300586 | E188: 美联新材 | F188: 化工 | G188: 橡胶塑料 | H188: 116.401 | I188: -5.5000000000000005e-003 | J188: 3.4999999999999996e-003 | K188: 9.34 | L188: -3.2000000000000002e-003 | M188: 117.8 | N188: 9.5 | O188: 0.184 | P188: 98.32 | Q188: 转股中 | R188: 4.96年 | S188: 2.96年 | T188: 2.07 | U188: 28 | V188: 0.11599999999999999 | W188: 4.2000000000000003e-002 | X188: 4.2000000000000003e-002 | Y188: 49 | Z188: 5.74 | AA188: 2.5000000000000001e-003 | AB188: -3.8e-003 | AC188: -3.6499999999999998e-002 | AD188: -3.8699999999999998e-002 | AE188: 86.05 | AF188: 87.9 | AG188: 0.62 | AH188: AA- | AI188: 6.2199999999999998e-002 | AJ188: =H188+100*O188 -> 134.80099999999999 | AK188: 134.5 | AL188: 138 | AM188: 46.6 | AN188: 190 | AO188: 3.9e-002 | AP188: 20 | AQ188: 美联转债!
A189: 246 | B189: 110060 | C189: 天路转债! | D189: 600326 | E189: 西藏天路 | F189: 建筑 | G189: 水泥 | H189: 113.9 | I189: 1.0800000000000001e-002 | J189: 8.8999999999999999e-003 | K189: 7.49 | L189: 3.3099999999999997e-002 | M189: 114.9 | N189: 7.16 | O189: 8.900000000000001e-002 | P189: 104.61 | Q189: 转股中 | R189: 4.28年 | S189: 2.29年 | T189: 7.06 | U189: 33 | V189: 4.0999999999999995e-002 | W189: 0.10300000000000001 | X189: 0.107 | Y189: 69 | Z189: 1.63 | AA189: 2.0999999999999999e-003 | AB189: -4.1999999999999997e-003 | AC189: -3.9100000000000003e-002 | AD189: -4.1599999999999998e-002 | AE189: 93.76 | AF189: 97.01 | AG189: 0.6 | AH189: AA | AI189: 4.1200000000000001e-002 | AJ189: =H189+100*O189 -> 122.80000000000001 | AK189: 123.2 | AL189: 35 | AM189: 26.2 | AN189: 23 | AO189: 8.5999999999999993e-002 | AP189: 13 | AQ189: 天路转债!
A190: 156 | B190: 128119 | C190: 龙大转债! | D190: 2726 | E190: 龙大肉食 | F190: 食品饮料 | G190: 肉制品 | H190: 118.901 | I190: -5.7999999999999996e-003 | J190: 1.e-004 | K190: 9.65 | L190: -1.03e-002 | M190: 119.9 | N190: 9.38 | O190: 0.156 | P190: 102.88 | Q190: 转股中 | R190: 4.99年 | S190: 2.99年 | T190: 9.46 | U190: 3.7 | V190: 3.0000000000000001e-003 | W190: 9.8000000000000004e-002 | X190: 0.10099999999999999 | Y190: 97 | Z190: 2.77 | AA190: 1.7000000000000001e-003 | AB190: -5.1000000000000004e-003 | AC190: -4.36e-002 | AD190: -4.5499999999999999e-002 | AE190: 91.11 | AF190: 98.37 | AG190: 0.56 | AH190: AA | AI190: 4.1200000000000001e-002 | AJ190: =H190+100*O190 -> 134.501 | AK190: 134.9 | AL190: 142 | AM190: 36.6 | AN190: 89 | AO190: -6.0999999999999999e-002 | AP190: 8 | AQ190: 龙大转债!
A191: 238 | B191: 128081 | C191: 海亮转债! | D191: 2203 | E191: 海亮股份 | F191: 有色金属 | G191: 铜金属 | H191: 114.37 | I191: -8.8999999999999999e-003 | J191: -7.4999999999999997e-003 | K191: 10.54 | L191: -2.5899999999999999e-002 | M191: 114.9 | N191: 9.69 | O191: 5.0999999999999997e-002 | P191: 108.77 | Q191: 转股中 | R191: 4.35年 | S191: 2.35年 | T191: 30.1 | U191: 35 | V191: 1.e-002 | W191: 0.14499999999999999 | X191: 0.158 | Y191: 207 | Z191: 2.18 | AA191: 1.1000000000000001e-003 | AB191: -5.0000000000000001e-003 | AC191: -3.9699999999999999e-002 | AD191: -4.2099999999999999e-002 | AE191: 93.51 | AF191: 96.75 | AG191: 0.63 | AH191: AA | AI191: 4.1200000000000001e-002 | AJ191: =H191+100*O191 -> 119.47 | AK191: 120 | AL191: 17 | AM191: 23.2 | AN191: 14 | AO191: 1.2e-002 | AP191: 51 | AQ191: 海亮转债!
A192: 15 | B192: 113048 | C192: 晶科转债! | D192: 601778 | E192: 晶科科技 | F192: 能源电力 | G192: 太阳能 | H192: 116.35 | I192: 3.8e-003 | J192: -3.8e-003 | K192: 5.76 | L192: 0. | M192: 117.1 | N192: 5.48 | O192: 0.107 | P192: 105.11 | Q192: 3月15天 | R192: 5.77年 | S192: 3.77年 | T192: 30 | U192: 64 | V192: 1.8000000000000002e-002 | W192: 0.188 | X192: 0.19800000000000001 | Y192: 159 | Z192: 1.47 | AA192: 1.1000000000000001e-003 | AB192: -4.0999999999999995e-003 | AC192: -2.9300000000000003e-002 | AD192: -3.0899999999999997e-002 | AE192: 88.06 | AF192: 92.49 | AG192: 0.63 | AH192: AA | AI192: 4.2500000000000003e-002 | AJ192: =H192+100*O192 -> 127.05 | AK192: 127.6 | AL192: 67 | AM192: 35.1 | AN192: 75 | AO192: 5.4000000000000006e-002 | AP192: 7 | AQ192: 晶科转债!
A193: 32 | B193: 128145 | C193: 日丰转债 | D193: 2953 | E193: 日丰股份 | F193: 家电 | G193: 零部件制 | H193: 114.949 | I193: 6.8000000000000005e-003 | J193: -5.7999999999999996e-003 | K193: 14.18 | L193: 1.4000000000000002e-003 | M193: 115.4 | N193: 13.66 | O193: 0.107 | P193: 103.81 | Q193: 2月13天 | R193: 5.68年 | S193: 3.68年 | T193: 3.8 | U193: 2.2 | V193: 5.0000000000000001e-003 | W193: 0.11 | X193: 0.114 | Y193: 35 | Z193: 2.31 | AA193: 7.000000000000001e-004 | AB193: -4.0999999999999995e-003 | AC193: -2.6499999999999999e-002 | AD193: -2.8300000000000002e-002 | AE193: 82.03 | AF193: 81.9 | AG193: 0.71 | AH193: AA- | AI193: 6.3500000000000001e-002 | AJ193: =H193+100*O193 -> 125.649 | AK193: 126.1 | AL193: 53 | AM193: 44.1 | AN193: 169 | AO193: -2.3e-002 | AP193: 6 | AQ193: 日丰转债
A194: 65 | B194: 128141 | C194: 旺能转债 | D194: 2034 | E194: 旺能环境 | F194: 城市公用 | G194: 三废处理 | H194: 114.784 | I194: 6.8999999999999999e-003 | J194: -1.e-004 | K194: 17.01 | L194: 1.0700000000000001e-002 | M194: 115.1 | N194: 15.97 | O194: 7.8e-002 | P194: 106.51 | Q194: 转股中 | R194: 5.42年 | S194: 3.42年 | T194: 14 | U194: 27 | V194: 1.7000000000000001e-002 | W194: 0.19500000000000001 | X194: 0.20800000000000002 | Y194: 72 | Z194: 1.51 | AA194: 5.0000000000000001e-004 | AB194: -4.5000000000000005e-003 | AC194: -2.8399999999999998e-002 | AD194: -3.0200000000000001e-002 | AE194: 89.35 | AF194: 92.25 | AG194: 0.64 | AH194: AA | AI194: 4.2500000000000003e-002 | AJ194: =H194+100*O194 -> 122.584 | AK194: 123.1 | AL194: 33 | AM194: 30.8 | AN194: 40 | AO194: 5.9999999999999998e-002 | AP194: 6 | AQ194: 旺能转债
A195: 123 | B195: 128130 | C195: 景兴转债 | D195: 2067 | E195: 景兴纸业 | F195: 造纸包装 | G195: 包装用纸 | H195: 115.053 | I195: 1.01e-002 | J195: -3.0000000000000001e-003 | K195: 3.72 | L195: 1.09e-002 | M195: 115.1 | N195: 3.4 | O195: 5.2000000000000005e-002 | P195: 109.41 | Q195: 转股中 | R195: 5年45天 | S195: 3年46天 | T195: 10.7 | U195: 23 | V195: 1.9e-002 | W195: 0.24399999999999999 | X195: 0.26700000000000002 | Y195: 44 | Z195: 0.88 | AA195: 1.e-004 | AB195: -5.1999999999999998e-003 | AC195: -3.1600000000000003e-002 | AD195: -3.3599999999999998e-002 | AE195: 90.46 | AF195: 93.39 | AG195: 0.65 | AH195: AA | AI195: 4.2500000000000003e-002 | AJ195: =H195+100*O195 -> 120.253 | AK195: 120.7 | AL195: 18 | AM195: 27.3 | AN195: 28 | AO195: 0. | AP195: 15 | AQ195: 景兴转债
A196: 285 | B196: 127012 | C196: 招路转债! | D196: 1965 | E196: 招商公路 | F196: 机场高速 | G196: 高速 | H196: 108 | I196: 1.4000000000000002e-003 | J196: 4.0999999999999995e-003 | K196: 7.37 | L196: 1.52e-002 | M196: 107.9 | N196: 8.63 | O196: 0.26500000000000001 | P196: 85.4 | Q196: 转股中 | R196: 3.68年 | S196: 1.68年 | T196: 50 | U196: 21 | V196: 4.0000000000000001e-003 | W196: 0.11 | X196: 9.4e-002 | Y196: 455 | Z196: 0.91 | AA196: -2.9999999999999997e-004 | AB196: -4.3e-003 | AC196: -3.2400000000000005e-002 | AD196: -3.4099999999999998e-002 | AE196: 95.21 | AF196: 94.82 | AG196: 0.37 | AH196: AAA | AI196: 3.6200000000000003e-002 | AJ196: =H196+100*O196 -> 134.5 | AK196: 130.6 | AL196: 95 | AM196: 35.4 | AN196: 76 | AO196: 3.0000000000000001e-003 | AP196: 30 | AQ196: 招路转债!
A197: 42 | B197: 113045 | C197: 环旭转债! | D197: 601231 | E197: 环旭电子 | F197: 电子 | G197: 电子产品 | H197: 112.34 | I197: -7.000000000000001e-004 | J197: 8.9999999999999998e-004 | K197: 14.62 | L197: 7.000000000000001e-004 | M197: 112 | N197: 19.75 | O197: 0.51800000000000002 | P197: 74.03 | Q197: 4月27天 | R197: 5.63年 | S197: 2.63年 | T197: 34.5 | U197: 10 | V197: 3.0000000000000001e-003 | W197: 0.107 | X197: 7.9000000000000001e-002 | Y197: 323 | Z197: 2.61 | AA197: -5.0000000000000001e-004 | AB197: -4.4000000000000003e-003 | AC197: -3.0899999999999997e-002 | AD197: -3.2799999999999996e-002 | AE197: 92.33 | AF197: 90.29 | AG197: 0.3 | AH197: AA+ | AI197: 3.95e-002 | AJ197: =H197+100*O197 -> 164.14000000000001 | AK197: 150.7 | AL197: 267 | AM197: 58.3 | AN197: 260 | AO197: -9.4e-002 | AP197: 4 | AQ197: 环旭转债!
A198: 153 | B198: 128121 | C198: 宏川转债! | D198: 2930 | E198: 宏川智慧 | F198: 交通运输 | G198: 物流业 | H198: 113.608 | I198: -1.21e-002 | J198: 1.8e-003 | K198: 17.3 | L198: -1.8200000000000001e-002 | M198: 113.3 | N198: 19.92 | O198: 0.308 | P198: 86.85 | Q198: 转股中 | R198: 5年0.1天 | S198: 3年1.1天 | T198: 6.7 | U198: 8 | V198: 1.1000000000000001e-002 | W198: 8.6999999999999994e-002 | X198: 7.5999999999999998e-002 | Y198: 77 | Z198: 3.71 | AA198: -5.9999999999999995e-004 | AB198: -5.4000000000000003e-003 | AC198: -2.8399999999999998e-002 | AD198: -3.0600000000000002e-002 | AE198: 85.6 | AF198: 83.87 | AG198: 0.57 | AH198: AA- | AI198: 6.3500000000000001e-002 | AJ198: =H198+100*O198 -> 144.40800000000002 | AK198: 140.4 | AL198: 201 | AM198: 54.8 | AN198: 238 | AO198: 4.0000000000000001e-002 | AP198: 5 | AQ198: 宏川转债!
A199: 174 | B199: 123052 | C199: 飞鹿转债 | D199: 300665 | E199: 飞鹿股份 | F199: 化工 | G199: 化工 | H199: 127.305 | I199: 2.5999999999999999e-003 | J199: -9.1999999999999998e-003 | K199: 8.4 | L199: -9.3999999999999986e-003 | M199: 126.8 | N199: 7.05 | O199: 6.8000000000000005e-002 | P199: 119.15 | Q199: 转股中 | R199: 4.89年 | S199: 2.89年 | T199: 1.51 | U199: 43 | V199: 0.221 | W199: 0.10400000000000001 | X199: 0.124 | Y199: 15 | Z199: 2.19 | AA199: -8.0000000000000004e-004 | AB199: -9.7999999999999997e-003 | AC199: -6.2600000000000003e-002 | AD199: -6.5199999999999994e-002 | AE199: 84.61 | AF199: 90.56 | AG199: 0.71 | AH199: A+ | AI199: 7.3200000000000001e-002 | AJ199: =H199+100*O199 -> 134.10500000000002 | AK199: 135.5 | AL199: 147 | AM199: 44.9 | AN199: 176 | AO199: -4.0999999999999995e-002 | AP199: 17 | AQ199: 飞鹿转债
A200: 29 | B200: 113622 | C200: 杭叉转债! | D200: 603298 | E200: 杭叉集团 | F200: 机械装备 | G200: 通用设备 | H200: 113 | I200: 7.0999999999999995e-003 | J200: -3.4999999999999996e-003 | K200: 17.36 | L200: 1.0500000000000001e-002 | M200: 112.5 | N200: 23.08 | O200: 0.502 | P200: 75.22 | Q200: 2月24天 | R200: 5.69年 | S200: 3.69年 | T200: 11.5 | U200: 2.9 | V200: 2.e-003 | W200: 7.5999999999999998e-002 | X200: 5.7999999999999996e-002 | Y200: 150 | Z200: 2.93 | AA200: -8.0000000000000004e-004 | AB200: -4.7999999999999996e-003 | AC200: -2.3900000000000001e-002 | AD200: -2.53e-002 | AE200: 88.78 | AF200: 90.54 | AG200: 0.35 | AH200: AA+ | AI200: 3.95e-002 | AJ200: =H200+100*O200 -> 163.19999999999999 | AK200: 150.8 | AL200: 269 | AM200: 60.2 | AN200: 274 | AO200: -1.9e-002 | AP200: 4 | AQ200: 杭叉转债!
A201: 229 | B201: 123038 | C201: 联得转债! | D201: 300545 | E201: 联得装备 | F201: 机械装备 | G201: 专用设备 | H201: 119.2 | I201: -7.8000000000000005e-003 | J201: 1.8e-003 | K201: 22.08 | L201: -1.03e-002 | M201: 118.6 | N201: 24.07 | O201: 0.29899999999999999 | P201: 91.73 | Q201: 转股中 | R201: 4.44年 | S201: 2.44年 | T201: 1.47 | U201: 18 | V201: 0.10400000000000001 | W201: 3.7999999999999999e-002 | X201: 3.4000000000000002e-002 | Y201: 39 | Z201: 4.06 | AA201: -1.1999999999999999e-003 | AB201: -8.3999999999999995e-003 | AC201: -5.2000000000000005e-002 | AD201: -5.4600000000000003e-002 | AE201: 86.55 | AF201: 87.3 | AG201: 0.58 | AH201: A+ | AI201: 7.3200000000000001e-002 | AJ201: =H201+100*O201 -> 149.09999999999999 | AK201: 146.7 | AL201: 244 | AM201: 59.4 | AN201: 269 | AO201: -6.5000000000000002e-002 | AP201: 18 | AQ201: 联得转债!
A202: 46 | B202: 123099 | C202: 普利转债 | D202: 300630 | E202: 普利制药 | F202: 医药 | G202: 化学制药 | H202: 124.6 | I202: -2.e-003 | J202: -2.5000000000000001e-003 | K202: 46.01 | L202: -7.3000000000000001e-003 | M202: 123.5 | N202: 46.03 | O202: 0.247 | P202: 99.96 | Q202: 38天 | R202: 5.57年 | S202: 3.57年 | T202: 8.5 | U202: 2.9 | V202: 3.0000000000000001e-003 | W202: 4.2000000000000003e-002 | X202: 4.2000000000000003e-002 | Y202: 201 | Z202: 9.21 | AA202: -1.6000000000000001e-003 | AB202: -8.6e-003 | AC202: -4.8000000000000001e-002 | AD202: -4.9800000000000004e-002 | AE202: 82.69 | AF202: 88.24 | AG202: 0.62 | AH202: AA- | AI202: 6.3500000000000001e-002 | AJ202: =H202+100*O202 -> 149.29999999999998 | AK202: 149.2 | AL202: 258 | AM202: 61 | AN202: 277 | AO202: -8.0000000000000002e-002 | AP202: 4 | AQ202: 普利转债
A203: 150 | B203: 127020 | C203: 中金转债 | D203: 60 | E203: 中金岭南 | F203: 有色金属 | G203: 有色行业 | H203: 115 | I203: 5.1999999999999998e-003 | J203: -2.7000000000000001e-003 | K203: 4.85 | L203: 4.0999999999999995e-003 | M203: 113.7 | N203: 4.63 | O203: 9.8000000000000004e-002 | P203: 104.75 | Q203: 转股中 | R203: 5年3.1天 | S203: 3年4.1天 | T203: 38 | U203: 31 | V203: 6.9999999999999993e-003 | W203: 0.21899999999999997 | X203: 0.23000000000000001 | Y203: 173 | Z203: 1.45 | AA203: -2.3e-003 | AB203: -7.1999999999999998e-003 | AC203: -3.5900000000000001e-002 | AD203: -3.73e-002 | AE203: 90.66 | AF203: 93.9 | AG203: 0.61 | AH203: AA+ | AI203: 3.95e-002 | AJ203: =H203+100*O203 -> 124.8 | AK203: 125.2 | AL203: 48 | AM203: 31.3 | AN203: 48 | AO203: 6.2e-002 | AP203: 14 | AQ203: 中金转债
A204: 186 | B204: 113577 | C204: 春秋转债! | D204: 603890 | E204: 春秋电子 | F204: 电子 | G204: 电子产品 | H204: 119.21 | I204: -6.7000000000000002e-003 | J204: -6.8999999999999999e-003 | K204: 11.37 | L204: -2.07e-002 | M204: 117.7 | N204: 10.86 | O204: 0.13900000000000001 | P204: 104.7 | Q204: 转股中 | R204: 4.74年 | S204: 2.75年 | T204: 1.78 | U204: 7.3 | V204: 3.4000000000000002e-002 | W204: 4.0000000000000001e-002 | X204: 4.2000000000000003e-002 | Y204: 44 | Z204: 2.35 | AA204: -2.7000000000000001e-003 | AB204: -9.1999999999999998e-003 | AC204: -4.7400000000000005e-002 | AD204: -4.9599999999999998e-002 | AE204: 87.07 | AF204: 88.95 | AG204: 0.66 | AH204: AA- | AI204: 6.2199999999999998e-002 | AJ204: =H204+100*O204 -> 133.10999999999999 | AK204: 133.7 | AL204: 134 | AM204: 44.8 | AN204: 174 | AO204: -0.109 | AP204: 14 | AQ204: 春秋转债!
A205: 122 | B205: 123064 | C205: 万孚转债! | D205: 300482 | E205: 万孚生物 | F205: 医药 | G205: 医疗器械 | H205: 116.65 | I205: 2.0999999999999999e-003 | J205: -1.4499999999999999e-002 | K205: 56.99 | L205: -3.3700000000000001e-002 | M205: 115.1 | N205: 71.64 | O205: 0.46600000000000003 | P205: 79.55 | Q205: 转股中 | R205: 5年46天 | S205: 3年47天 | T205: 5.99 | U205: 2.4 | V205: 3.0000000000000001e-003 | W205: 2.4e-002 | X205: 1.9e-002 | Y205: 254 | Z205: 6.72 | AA205: -2.7000000000000001e-003 | AB205: -7.9000000000000008e-003 | AC205: -3.5699999999999996e-002 | AD205: -3.7599999999999995e-002 | AE205: 90.45 | AF205: 93.38 | AG205: 0.37 | AH205: AA | AI205: 4.2500000000000003e-002 | AJ205: =H205+100*O205 -> 163.25 | AK205: 153.7 | AL205: 275 | AM205: 60.4 | AN205: 275 | AO205: -8.3000000000000004e-002 | AP205: 10 | AQ205: 万孚转债!
A206: 28 | B206: 110079 | C206: 杭银转债 | D206: 600926 | E206: 杭州银行 | F206: 金融 | G206: 银行行业 | H206: 114.38 | I206: 3.9000000000000003e-003 | J206: -5.3e-003 | K206: 13.25 | L206: -3.8e-003 | M206: 112.4 | N206: 16.71 | O206: 0.442 | P206: 79.29 | Q206: 2月24天 | R206: 5.70年 | S206: 3.70年 | T206: 150 | U206: 89 | V206: 5.0000000000000001e-003 | W206: 0.191 | X206: 0.151 | Y206: 786 | Z206: 1.19 | AA206: -3.0999999999999999e-003 | AB206: -6.9999999999999993e-003 | AC206: -2.7099999999999999e-002 | AD206: -2.8500000000000001e-002 | AE206: 89.33 | AF206: 91.41 | AG206: 0.39 | AH206: AAA | AI206: 3.7499999999999999e-002 | AJ206: =H206+100*O206 -> 158.57999999999998 | AK206: 149.5 | AL206: 261 | AM206: 58.1 | AN206: 258 | AO206: -7.8e-002 | AP206: 11 | AQ206: 杭银转债
A207: 352 | B207: 123002 | C207: 国祯转债!! | D207: 300388 | E207: 节能国祯 | F207: 城市公用 | G207: 三废处理 | H207: 109.659 | I207: 3.9000000000000003e-003 | J207: -6.3e-003 | K207: 7.42 | L207: -6.7000000000000002e-003 | M207: 108.8 | N207: 8.36 | O207: 0.23600000000000002 | P207: 88.76 | Q207: 转股中 | R207: 2.36年 | S207: 0.36年 | T207: 2.52 | U207: 0.7 | V207: 3.0000000000000001e-003 | W207: 4.9000000000000002e-002 | X207: 4.2999999999999997e-002 | Y207: 52 | Z207: 1.41 | AA207: -3.4000000000000002e-003 | AB207: -1.03e-002 | AC207: -0.14999999999999999 | AD207: -0.156 | AE207: 99.52 | AF207: 99.47 | AG207: 0.35 | AH207: AA | AI207: 3.9399999999999998e-002 | AJ207: =H207+100*O207 -> 133.25900000000001 | AK207: 130.6 | AL207: 94 | AM207: 31 | AN207: 43 | AO207: -3.4000000000000002e-002 | AP207: 16 | AQ207: 国祯转债!!
A208: 269 | B208: 113536 | C208: 三星转债 | D208: 603578 | E208: 三星新材 | F208: 家电 | G208: 零部件制 | H208: 115.97 | I208: 1.6000000000000001e-003 | J208: -2.3e-003 | K208: 13.79 | L208: -1.4000000000000002e-003 | M208: 114.3 | N208: 13.76 | O208: 0.157 | P208: 100.22 | Q208: 转股中 | R208: 3.87年 | S208: 1.87年 | T208: 1.49 | U208: 1.9 | V208: 1.1000000000000001e-002 | W208: 8.4000000000000005e-002 | X208: 8.4000000000000005e-002 | Y208: 18 | Z208: 1.7 | AA208: -3.8e-003 | AB208: -1.04e-002 | AC208: -5.7699999999999994e-002 | AD208: -6.0199999999999997e-002 | AE208: 94.72 | AF208: 98.03 | AG208: 0.53 | AH208: AA | AI208: 4.1200000000000001e-002 | AJ208: =H208+100*O208 -> 131.66999999999999 | AK208: 131.7 | AL208: 111 | AM208: 33.7 | AN208: 64 | AO208: -3.6000000000000004e-002 | AP208: 35 | AQ208: 三星转债
A209: 106 | B209: 123072 | C209: 乐歌转债! | D209: 300729 | E209: 乐歌股份 | F209: 其他 | G209: 家居用品 | H209: 132.171 | I209: -3.2000000000000002e-003 | J209: 2.e-003 | K209: 22.95 | L209: -2.5499999999999998e-002 | M209: 129.6 | N209: 56.12 | O209: 2.23 | P209: 40.89 | Q209: 转股中 | R209: 5.26年 | S209: 3.27年 | T209: 1.42 | U209: 72 | V209: 0.38299999999999995 | W209: 3.4000000000000002e-002 | X209: 1.3999999999999999e-002 | Y209: 41 | Z209: 3.11 | AA209: -3.8e-003 | AB209: -1.2800000000000001e-002 | AC209: -6.13e-002 | AD209: -6.4699999999999994e-002 | AE209: 83.71 | AF209: 89.9 | AG209: 0.05 | AH209: A+ | AI209: 7.4499999999999997e-002 | AJ209: =H209+100*O209 -> 355.17099999999999 | AK209: 223.4 | AL209: 347 | AM209: 133.6 | AN209: 349 | AO209: -6.0999999999999999e-002 | AP209: 9 | AQ209: 乐歌转债!
A210: 6 | B210: 123116 | C210: 万兴转债 | D210: 300624 | E210: 万兴科技 | F210: 计算机及 | G210: 软件开发 | H210: 124.852 | I210: -1.2199999999999999e-002 | J210: -2.5899999999999999e-002 | K210: 53.9 | L210: -5.16e-002 | M210: 121.4 | N210: 49.78 | O210: 0.153 | P210: 108.28 | Q210: 5月3天 | R210: 5.90年 | S210: 3.90年 | T210: 3.79 | U210: 30 | V210: 6.3e-002 | W210: 5.4000000000000006e-002 | X210: 5.9000000000000004e-002 | Y210: 70 | Z210: 7.87 | AA210: -4.7999999999999996e-003 | AB210: -1.1000000000000001e-002 | AC210: -4.36e-002 | AD210: -4.5499999999999999e-002 | AE210: 78.13 | AF210: 80.19 | AG210: 0.74 | AH210: A+ | AI210: 7.4499999999999997e-002 | AJ210: =H210+100*O210 -> 140.15200000000002 | AK210: 141.4 | AL210: 210 | AM210: 61.2 | AN210: 279 | AO210: -8.5999999999999993e-002 | AP210: 3 | AQ210: 万兴转债
A211: 236 | B211: 128082 | C211: 华锋转债! | D211: 2806 | E211: 华锋股份 | F211: 电子 | G211: 元器件制 | H211: 124.1 | I211: 2.23e-002 | J211: 1.2999999999999999e-003 | K211: 11.35 | L211: 3.0899999999999997e-002 | M211: 121.4 | N211: 9.13 | O211: -2.e-003 | P211: 124.32 | Q211: 转股中 | R211: 4.38年 | S211: 2.39年 | T211: 3.11 | U211: 139 | V211: 0.35799999999999998 | W211: 0.152 | X211: 0.18899999999999997 | Y211: 20 | Z211: 2.06 | AA211: -5.1000000000000004e-003 | AB211: -1.34e-002 | AC211: -6.6000000000000003e-002 | AD211: -6.9000000000000006e-002 | AE211: 85.46 | AF211: 86.35 | AG211: 0.77 | AH211: A | AI211: 8.3199999999999996e-002 | AJ211: =H211+100*O211 -> 123.89999999999999 | AK211: 123.9 | AL211: 40 | AM211: 37.5 | AN211: 111 | AO211: 8.5999999999999993e-002 | AP211: 55 | AQ211: 华锋转债!
A212: 64 | B212: 128142 | C212: 新乳转债 | D212: 2946 | E212: 新乳业 | F212: 食品饮料 | G212: 乳制品 | H212: 118.35 | I212: 2.0999999999999999e-003 | J212: -5.1999999999999998e-003 | K212: 14.86 | L212: -8.0000000000000002e-003 | M212: 115.1 | N212: 18.47 | O212: 0.47100000000000003 | P212: 80.45 | Q212: 转股中 | R212: 5.42年 | S212: 3.42年 | T212: 7.18 | U212: 1.5 | V212: 2.e-003 | W212: 5.5999999999999994e-002 | X212: 4.4999999999999998e-002 | Y212: 129 | Z212: 4.96 | AA212: -5.1999999999999998e-003 | AB212: -1.01e-002 | AC212: -3.6699999999999997e-002 | AD212: -3.85e-002 | AE212: 89.34 | AF212: 92.24 | AG212: 0.39 | AH212: AA | AI212: 4.2500000000000003e-002 | AJ212: =H212+100*O212 -> 165.44999999999999 | AK212: 156.2 | AL212: 286 | AM212: 64 | AN212: 284 | AO212: -8.0000000000000002e-003 | AP212: 4 | AQ212: 新乳转债
A213: 78 | B213: 128140 | C213: 润建转债! | D213: 2929 | E213: 润建股份 | F213: 通信互联 | G213: 通信设备 | H213: 118.5 | I213: -1.2500000000000001e-002 | J213: -2.2000000000000001e-003 | K213: 26.61 | L213: -2.46e-002 | M213: 115.2 | N213: 26.4 | O213: 0.17600000000000002 | P213: 100.8 | Q213: 转股中 | R213: 5.39年 | S213: 3.39年 | T213: 10.9 | U213: 13 | V213: 1.e-002 | W213: 0.18600000000000003 | X213: 0.187 | Y213: 59 | Z213: 1.86 | AA213: -5.3e-003 | AB213: -1.03e-002 | AC213: -3.7100000000000001e-002 | AD213: -3.9e-002 | AE213: 89.55 | AF213: 92.45 | AG213: 0.6 | AH213: AA | AI213: 4.2500000000000003e-002 | AJ213: =H213+100*O213 -> 136.09999999999999 | AK213: 136.2 | AL213: 153 | AM213: 43.8 | AN213: 167 | AO213: 3.3000000000000002e-002 | AP213: 14 | AQ213: 润建转债!
A214: 63 | B214: 123090 | C214: 三诺转债 | D214: 300298 | E214: 三诺生物 | F214: 医药 | G214: 医疗器械 | H214: 120.8 | I214: 3.3e-003 | J214: 2.5999999999999999e-003 | K214: 29.48 | L214: 1.4499999999999999e-002 | M214: 117.1 | N214: 35.15 | O214: 0.44 | P214: 83.87 | Q214: 转股中 | R214: 5.43年 | S214: 3.43年 | T214: 5 | U214: 28 | V214: 4.4999999999999998e-002 | W214: 2.9999999999999999e-002 | X214: 2.5000000000000001e-002 | Y214: 167 | Z214: 6.25 | AA214: -5.7999999999999996e-003 | AB214: -1.1299999999999999e-002 | AC214: -4.2099999999999999e-002 | AD214: -4.3899999999999995e-002 | AE214: 89.31 | AF214: 93.8 | AG214: 0.41 | AH214: AA | AI214: 4.2500000000000003e-002 | AJ214: =H214+100*O214 -> 164.80000000000001 | AK214: 157.7 | AL214: 290 | AM214: 63.9 | AN214: 283 | AO214: -2.1000000000000001e-002 | AP214: 3 | AQ214: 三诺转债
A215: 70 | B215: 123085 | C215: 万顺转2! | D215: 300057 | E215: 万顺新材 | F215: 有色金属 | G215: 铝金属 | H215: 117 | I215: 2.18e-002 | J215: -1.6200000000000003e-002 | K215: 6.23 | L215: 8.1000000000000013e-003 | M215: 113.3 | N215: 6.2 | O215: 0.16399999999999998 | P215: 100.48 | Q215: 转股中 | R215: 5.40年 | S215: 3.41年 | T215: 9 | U215: 24 | V215: 2.3e-002 | W215: 0.214 | X215: 0.215 | Y215: 42 | Z215: 1.18 | AA215: -6.0000000000000001e-003 | AB215: -1.0500000000000001e-002 | AC215: -3.3300000000000003e-002 | AD215: -3.5200000000000002e-002 | AE215: 83.51 | AF215: 81.82 | AG215: 0.7 | AH215: AA- | AI215: 6.3500000000000001e-002 | AJ215: =H215+100*O215 -> 133.40000000000001 | AK215: 133.5 | AL215: 131 | AM215: 50 | AN215: 214 | AO215: -2.6000000000000002e-002 | AP215: 24 | AQ215: 万顺转2!
A216: 115 | B216: 113603 | C216: 东缆转债! | D216: 603606 | E216: 东方电缆 | F216: 能源电力 | G216: 电力设备 | H216: 119.3 | I216: 9.1000000000000004e-003 | J216: -1.01e-002 | K216: 22.54 | L216: -1.8e-003 | M216: 115.1 | N216: 23.65 | O216: 0.252 | P216: 95.31 | Q216: 转股中 | R216: 5.19年 | S216: 3.19年 | T216: 8 | U216: 9.3 | V216: 1.e-002 | W216: 5.4000000000000006e-002 | X216: 5.2000000000000005e-002 | Y216: 147 | Z216: 4.41 | AA216: -6.9999999999999993e-003 | AB216: -1.21e-002 | AC216: -4.1500000000000002e-002 | AD216: -4.3400000000000001e-002 | AE216: 90.21 | AF216: 93.13 | AG216: 0.54 | AH216: AA | AI216: 4.2500000000000003e-002 | AJ216: =H216+100*O216 -> 144.5 | AK216: 143.3 | AL216: 223 | AM216: 50.2 | AN216: 217 | AO216: 0.10099999999999999 | AP216: 7 | AQ216: 东缆转债!
A217: 16 | B217: 123113 | C217: 仙乐转债 | D217: 300791 | E217: 仙乐健康 | F217: 食品饮料 | G217: 食品饮料 | H217: 123.3 | I217: 2.2400000000000003e-002 | J217: -1.29e-002 | K217: 55.2 | L217: 1.47e-002 | M217: 118.5 | N217: 56.92 | O217: 0.27100000000000002 | P217: 96.98 | Q217: 3月11天 | R217: 5.76年 | S217: 3.76年 | T217: 10.3 | U217: 19 | V217: 1.4999999999999999e-002 | W217: 0.10300000000000001 | X217: 0.10000000000000001 | Y217: 99 | Z217: 2.95 | AA217: -6.9999999999999993e-003 | AB217: -1.2500000000000001e-002 | AC217: -4.3200000000000002e-002 | AD217: -4.4900000000000002e-002 | AE217: 81.74 | AF217: 83.71 | AG217: 0.64 | AH217: AA- | AI217: 6.3500000000000001e-002 | AJ217: =H217+100*O217 -> 150.40000000000001 | AK217: 149.6 | AL217: 262 | AM217: 65.9 | AN217: 289 | AO217: 5.9000000000000004e-002 | AP217: 2 | AQ217: 仙乐转债
A218: 226 | B218: 128091 | C218: 新天转债 | D218: 2873 | E218: 新天药业 | F218: 医药 | G218: 中药 | H218: 123.158 | I218: -4.0000000000000002e-004 | J218: -8.8999999999999999e-003 | K218: 17.01 | L218: -1.3899999999999999e-002 | M218: 119.4 | N218: 16.27 | O218: 0.17800000000000002 | P218: 104.55 | Q218: 转股中 | R218: 4.46年 | S218: 2.46年 | T218: 1.76 | U218: 29 | V218: 0.13400000000000001 | W218: 8.8000000000000009e-002 | X218: 9.1999999999999998e-002 | Y218: 20 | Z218: 2.44 | AA218: -7.0999999999999995e-003 | AB218: -1.46e-002 | AC218: -6.1500000000000006e-002 | AD218: -6.4500000000000002e-002 | AE218: 87.03 | AF218: 87.91 | AG218: 0.67 | AH218: A+ | AI218: 7.3200000000000001e-002 | AJ218: =H218+100*O218 -> 140.958 | AK218: 141.8 | AL218: 213 | AM218: 53.9 | AN218: 232 | AO218: -6.5000000000000002e-002 | AP218: 18 | AQ218: 新天转债
A219: 126 | B219: 113039 | C219: 嘉泽转债! | D219: 601619 | E219: 嘉泽新能 | F219: 能源电力 | G219: 风能 | H219: 117.52 | I219: -5.5000000000000005e-003 | J219: 9.1000000000000004e-003 | K219: 3.9 | L219: 5.1999999999999998e-003 | M219: 113.1 | N219: 3.46 | O219: 4.2999999999999997e-002 | P219: 112.72 | Q219: 转股中 | R219: 5年38天 | S219: 3年39天 | T219: 5.41 | U219: 112 | V219: 0.17499999999999999 | W219: 5.9000000000000004e-002 | X219: 6.6000000000000003e-002 | Y219: 92 | Z219: 2.27 | AA219: -7.6e-003 | AB219: -1.2199999999999999e-002 | AC219: -3.8100000000000002e-002 | AD219: -4.0099999999999997e-002 | AE219: 90.53 | AF219: 91.85 | AG219: 0.71 | AH219: AA | AI219: 4.2500000000000003e-002 | AJ219: =H219+100*O219 -> 121.81999999999999 | AK219: 122.3 | AL219: 27 | AM219: 30.5 | AN219: 38 | AO219: -6.0000000000000001e-003 | AP219: 34 | AQ219: 嘉泽转债!
A220: 211 | B220: 113568 | C220: 新春转债! | D220: 603667 | E220: 五洲新春 | F220: 机械装备 | G220: 通用设备 | H220: 128.75 | I220: 4.0000000000000001e-003 | J220: -4.0000000000000001e-003 | K220: 11.06 | L220: 0. | M220: 124.3 | N220: 8.75 | O220: 1.9e-002 | P220: 126.4 | Q220: 转股中 | R220: 4.64年 | S220: 2.64年 | T220: 3 | U220: 45 | V220: 0.115 | W220: 9.3000000000000013e-002 | X220: 0.11699999999999999 | Y220: 32 | Z220: 1.82 | AA220: -7.7000000000000002e-003 | AB220: -1.6299999999999999e-002 | AC220: -7.3300000000000004e-002 | AD220: -7.5800000000000006e-002 | AE220: 88.16 | AF220: 94.59 | AG220: 0.74 | AH220: AA- | AI220: 6.2199999999999998e-002 | AJ220: =H220+100*O220 -> 130.65000000000001 | AK220: 131.1 | AL220: 104 | AM220: 36.5 | AN220: 87 | AO220: 0.114 | AP220: 48 | AQ220: 新春转债!
A221: 221 | B221: 128094 | C221: 星帅转债 | D221: 2860 | E221: 星帅尔 | F221: 家电 | G221: 零部件制 | H221: 125.222 | I221: 6.9999999999999993e-003 | J221: 2.3999999999999998e-003 | K221: 17.17 | L221: 1.24e-002 | M221: 121 | N221: 13.8 | O221: 6.0000000000000001e-003 | P221: 124.42 | Q221: 转股中 | R221: 4.50年 | S221: 2.50年 | T221: 2.54 | U221: 14 | V221: 4.4999999999999998e-002 | W221: 7.400000000000001e-002 | X221: 9.1999999999999998e-002 | Y221: 35 | Z221: 3.35 | AA221: -7.8000000000000005e-003 | AB221: -1.5600000000000001e-002 | AC221: -6.7599999999999993e-002 | AD221: -7.0199999999999999e-002 | AE221: 86.39 | AF221: 88.72 | AG221: 0.77 | AH221: A+ | AI221: 7.3200000000000001e-002 | AJ221: =H221+100*O221 -> 125.82199999999999 | AK221: 126 | AL221: 52 | AM221: 37.3 | AN221: 107 | AO221: 3.7000000000000005e-002 | AP221: 30 | AQ221: 星帅转债
A222: 251 | B222: 128078 | C222: 太极转债! | D222: 2368 | E222: 太极股份 | F222: 计算机及 | G222: 软件开发 | H222: 121 | I222: -1.0200000000000001e-002 | J222: 1.0200000000000001e-002 | K222: 21.86 | L222: -5.8999999999999999e-003 | M222: 116.9 | N222: 22.21 | O222: 0.22899999999999998 | P222: 98.42 | Q222: 转股中 | R222: 4.26年 | S222: 2.27年 | T222: 9.6 | U222: 7 | V222: 6.0000000000000001e-003 | W222: 7.5999999999999998e-002 | X222: 7.4999999999999997e-002 | Y222: 127 | Z222: 3.78 | AA222: -8.199999999999999e-003 | AB222: -1.5100000000000001e-002 | AC222: -6.3200000000000006e-002 | AD222: -6.5599999999999992e-002 | AE222: 93.83 | AF222: 98.77 | AG222: 0 | AH222: AA | AI222: 4.1200000000000001e-002 | AJ222: =H222+100*O222 -> 143.90000000000001 | AK222: 143.6 | AL222: 226 | AM222: 44.8 | AN222: 175 | AO222: 3.3000000000000002e-002 | AP222: 10 | AQ222: 太极转债!
A223: 309 | B223: 110047 | C223: 山鹰转债 | D223: 600567 | E223: 山鹰国际 | F223: 造纸包装 | G223: 包装用纸 | H223: 121.15 | I223: 1.3600000000000001e-002 | J223: -5.7999999999999996e-003 | K223: 3.49 | L223: 1.4499999999999999e-002 | M223: 117.5 | N223: 3.3 | O223: 0.14599999999999999 | P223: 105.76 | Q223: 转股中 | R223: 3.35年 | S223: 1.35年 | T223: 22.5 | U223: 39 | V223: 1.3999999999999999e-002 | W223: 0.13900000000000001 | X223: 0.14699999999999999 | Y223: 161 | Z223: 1.03 | AA223: -9.300000000000001e-003 | AB223: -1.83e-002 | AC223: -0.10300000000000001 | AD223: -0.106 | AE223: 97.2 | AF223: 103.91 | AG223: 0.53 | AH223: AA+ | AI223: 3.8199999999999998e-002 | AJ223: =H223+100*O223 -> 135.75 | AK223: 136.5 | AL223: 158 | AM223: 32.6 | AN223: 56 | AO223: 1.8000000000000002e-002 | AP223: 29 | AQ223: 山鹰转债
A224: 191 | B224: 123048 | C224: 应急转债! | D224: 300527 | E224: 中船应急 | F224: 机械装备 | G224: 专用设备 | H224: 117.8 | I224: 1.0500000000000001e-002 | J224: -2.5000000000000001e-003 | K224: 9.11 | L224: 1.3300000000000001e-002 | M224: 112.8 | N224: 8.9 | O224: 0.151 | P224: 102.36 | Q224: 转股中 | R224: 4.73年 | S224: 2.73年 | T224: 3.79 | U224: 98 | V224: 0.218 | W224: 4.2999999999999997e-002 | X224: 4.4000000000000004e-002 | Y224: 88 | Z224: 3.3 | AA224: -9.300000000000001e-003 | AB224: -1.41e-002 | AC224: -4.4600000000000001e-002 | AD224: -4.6600000000000003e-002 | AE224: 92.74 | AF224: 94.78 | AG224: 0.6 | AH224: AA+ | AI224: 3.8199999999999998e-002 | AJ224: =H224+100*O224 -> 132.90000000000001 | AK224: 133.2 | AL224: 127 | AM224: 38.5 | AN224: 121 | AO224: -2.3e-002 | AP224: 16 | AQ224: 应急转债!
A225: 303 | B225: 113525 | C225: 台华转债! | D225: 603055 | E225: 台华新材 | F225: 服装纺织 | G225: 纺织行业 | H225: 118.07 | I225: -2.81e-002 | J225: 2.5000000000000001e-003 | K225: 7.73 | L225: -5.04e-002 | M225: 114.3 | N225: 7.78 | O225: 0.188 | P225: 99.36 | Q225: 转股中 | R225: 3.42年 | S225: 1.42年 | T225: 4.69 | U225: 11 | V225: 1.9e-002 | W225: 7.2999999999999995e-002 | X225: 7.2999999999999995e-002 | Y225: 64 | Z225: 2.11 | AA225: -9.5999999999999992e-003 | AB225: -1.7000000000000001e-002 | AC225: -8.4199999999999997e-002 | AD225: -8.72e-002 | AE225: 96.47 | AF225: 99.84 | AG225: 0.51 | AH225: AA | AI225: 4.1200000000000001e-002 | AJ225: =H225+100*O225 -> 136.87 | AK225: 136.8 | AL225: 163 | AM225: 36.9 | AN225: 102 | AO225: 0.10099999999999999 | AP225: 19 | AQ225: 台华转债!
A226: 282 | B226: 110057 | C226: 现代转债 | D226: 600420 | E226: 国药现代 | F226: 医药 | G226: 化学制药 | H226: 114.36 | I226: 8.199999999999999e-003 | J226: 1.6000000000000001e-003 | K226: 9.85 | L226: 1.7600000000000001e-002 | M226: 110.3 | N226: 9.79 | O226: 0.13699999999999998 | P226: 100.61 | Q226: 转股中 | R226: 3.71年 | S226: 1.71年 | T226: 16.2 | U226: 16 | V226: 9.0000000000000011e-003 | W226: 0.16 | X226: 0.161 | Y226: 101 | Z226: 1.25 | AA226: -9.8999999999999991e-003 | AB226: -1.49e-002 | AC226: -5.5599999999999997e-002 | AD226: -5.8299999999999998e-002 | AE226: 96.21 | AF226: 96.92 | AG226: 0.56 | AH226: AAA | AI226: 3.6200000000000003e-002 | AJ226: =H226+100*O226 -> 128.06 | AK226: 128.1 | AL226: 72 | AM226: 31.2 | AN226: 46 | AO226: 9.0000000000000011e-003 | AP226: 23 | AQ226: 现代转债
A227: 111 | B227: 123068 | C227: 弘信转债 | D227: 300657 | E227: 弘信电子 | F227: 电子 | G227: 元器件制 | H227: 127.65 | I227: 5.1000000000000004e-003 | J227: -1.4999999999999999e-002 | K227: 19.08 | L227: -1.29e-002 | M227: 121.2 | N227: 15.34 | O227: 2.6000000000000002e-002 | P227: 124.38 | Q227: 转股中 | R227: 5.25年 | S227: 3.25年 | T227: 5.69 | U227: 247 | V227: 0.33500000000000002 | W227: 7.2999999999999995e-002 | X227: 9.0999999999999998e-002 | Y227: 78 | Z227: 4.64 | AA227: -1.e-002 | AB227: -1.6799999999999999e-002 | AC227: -5.8499999999999996e-002 | AD227: -6.0599999999999994e-002 | AE227: 84.6 | AF227: 88.4 | AG227: 0.76 | AH227: AA- | AI227: 6.3500000000000001e-002 | AJ227: =H227+100*O227 -> 130.25 | AK227: 130.9 | AL227: 101 | AM227: 42.5 | AN227: 159 | AO227: 0.10300000000000001 | AP227: 9 | AQ227: 弘信转债
A228: 291 | B228: 110053 | C228: 苏银转债! | D228: 600919 | E228: 江苏银行 | F228: 金融 | G228: 银行行业 | H228: 122.69 | I228: -3.7000000000000002e-003 | J228: -6.8000000000000005e-003 | K228: 6.83 | L228: -1.8700000000000001e-002 | M228: 118.3 | N228: 6.37 | O228: 0.14400000000000002 | P228: 107.22 | Q228: 转股中 | R228: 3.66年 | S228: 无权 | T228: 200 | U228: 132 | V228: 5.0000000000000001e-003 | W228: 0.19800000000000001 | X228: 0.21299999999999999 | Y228: 1009. | Z228: 0.72 | AA228: -1.0200000000000001e-002 | AB228: -1.8799999999999997e-002 | AC228: 无权 | AD228: 无权 | AE228: 无权 | AF228: 104.27 | AG228: 0.56 | AH228: AAA | AI228: 3.6200000000000003e-002 | AJ228: =H228+100*O228 -> 137.09 | AK228: 138.2 | AL228: 181 | AM228: 33.9 | AN228: 69 | AO228: -3.1e-002 | AP228: 37 | AQ228: 苏银转债!
A229: 144 | B229: 128122 | C229: 兴森转债! | D229: 2436 | E229: 兴森科技 | F229: 电子 | G229: 元器件制 | H229: 118 | I229: -1.09e-002 | J229: 6.8999999999999999e-003 | K229: 12.06 | L229: -1.0700000000000001e-002 | M229: 113.3 | N229: 14.1 | O229: 0.38 | P229: 85.53 | Q229: 转股中 | R229: 4年6.1天 | S229: 3年7天 | T229: 2.69 | U229: 20 | V229: 6.0999999999999999e-002 | W229: 1.4999999999999999e-002 | X229: 1.3000000000000001e-002 | Y229: 179 | Z229: 5.59 | AA229: -1.0200000000000001e-002 | AB229: -1.61e-002 | AC229: -4.0300000000000002e-002 | AD229: -4.2300000000000004e-002 | AE229: 91.25 | AF229: 96.55 | AG229: 0.37 | AH229: AA | AI229: 4.1200000000000001e-002 | AJ229: =H229+100*O229 -> 156. | AK229: 150.5 | AL229: 266 | AM229: 53.9 | AN229: 233 | AO229: 6.4000000000000001e-002 | AP229: 13 | AQ229: 兴森转债!
A230: 298 | B230: 110051 | C230: 中天转债! | D230: 600522 | E230: 中天科技 | F230: 通信互联 | G230: 通信设备 | H230: 117.9 | I230: 3.0999999999999999e-003 | J230: 3.4999999999999996e-003 | K230: 10.32 | L230: 1.18e-002 | M230: 113.3 | N230: 9.99 | O230: 0.14099999999999999 | P230: 103.3 | Q230: 转股中 | R230: 3.62年 | S230: 1.62年 | T230: 39.6 | U230: 11 | V230: 2.e-003 | W230: 0.125 | X230: 0.129 | Y230: 316 | Z230: 1.35 | AA230: -1.11e-002 | AB230: -1.7600000000000001e-002 | AC230: -7.4299999999999991e-002 | AD230: -7.6999999999999999e-002 | AE230: 96.18 | AF230: 99.17 | AG230: 0.56 | AH230: AA+ | AI230: 3.8199999999999998e-002 | AJ230: =H230+100*O230 -> 132. | AK230: 132.5 | AL230: 118 | AM230: 33.3 | AN230: 59 | AO230: 3.7999999999999999e-002 | AP230: 23 | AQ230: 中天转债!
A231: 96 | B231: 128136 | C231: 立讯转债! | D231: 2475 | E231: 立讯精密 | F231: 电子 | G231: 元器件制 | H231: 118.9 | I231: -2.5000000000000001e-003 | J231: -4.0000000000000001e-003 | K231: 41.26 | L231: -2.3700000000000002e-002 | M231: 111.9 | N231: 58.25 | O231: 0.67900000000000005 | P231: 70.83 | Q231: 转股中 | R231: 5.30年 | S231: 3.30年 | T231: 30 | U231: 24 | V231: 6.9999999999999993e-003 | W231: 1.e-002 | X231: 6.9999999999999993e-003 | Y231: 2903. | Z231: 10.04 | AA231: -1.15e-002 | AB231: -1.55e-002 | AC231: -4.2300000000000004e-002 | AD231: -4.3499999999999997e-002 | AE231: 89.57 | AF231: 91.36 | AG231: 0.28 | AH231: AA+ | AI231: 3.95e-002 | AJ231: =H231+100*O231 -> 186.80000000000001 | AK231: 167 | AL231: 305 | AM231: 75.6 | AN231: 303 | AO231: -7.6999999999999999e-002 | AP231: 13 | AQ231: 立讯转债!
A232: 234 | B232: 110063 | C232: 鹰19转债 | D232: 600567 | E232: 山鹰国际 | F232: 造纸包装 | G232: 包装用纸 | H232: 121.89 | I232: 1.4499999999999999e-002 | J232: -5.6999999999999993e-003 | K232: 3.49 | L232: 1.4499999999999999e-002 | M232: 115.9 | N232: 3.26 | O232: 0.13900000000000001 | P232: 107.06 | Q232: 转股中 | R232: 4.41年 | S232: 2.41年 | T232: 18.5 | U232: 17 | V232: 6.9999999999999993e-003 | W232: 0.115 | X232: 0.12300000000000001 | Y232: 161 | Z232: 1.03 | AA232: -1.1599999999999999e-002 | AB232: -1.78e-002 | AC232: -6.2899999999999998e-002 | AD232: -6.5099999999999991e-002 | AE232: 93.81 | AF232: 98.56 | AG232: 0.6 | AH232: AA+ | AI232: 3.8199999999999998e-002 | AJ232: =H232+100*O232 -> 135.78999999999999 | AK232: 136.7 | AL232: 160 | AM232: 38.2 | AN232: 114 | AO232: 1.8000000000000002e-002 | AP232: 33 | AQ232: 鹰19转债
A233: 181 | B233: 113579 | C233: 健友转债! | D233: 603707 | E233: 健友股份 | F233: 医药 | G233: 原料药 | H233: 120.3 | I233: -2.9999999999999997e-004 | J233: -1.7000000000000001e-002 | K233: 29.46 | L233: -3.5699999999999996e-002 | M233: 113.9 | N233: 32.2 | O233: 0.315 | P233: 91.49 | Q233: 转股中 | R233: 4.77年 | S233: 2.77年 | T233: 5.03 | U233: 13 | V233: 2.1000000000000001e-002 | W233: 1.3999999999999999e-002 | X233: 1.3000000000000001e-002 | Y233: 358 | Z233: 7.15 | AA233: -1.1599999999999999e-002 | AB233: -1.6799999999999999e-002 | AC233: -5.0599999999999999e-002 | AD233: -5.2699999999999997e-002 | AE233: 91.93 | AF233: 94.31 | AG233: 0.49 | AH233: AA | AI233: 4.1200000000000001e-002 | AJ233: =H233+100*O233 -> 151.80000000000001 | AK233: 149.1 | AL233: 257 | AM233: 54.8 | AN233: 239 | AO233: -0.26200000000000001 | AP233: 9 | AQ233: 健友转债!
A234: 2 | B234: 113050 | C234: 南银转债 | D234: 601009 | E234: 南京银行 | F234: 金融 | G234: 银行行业 | H234: 120.37 | I234: 2.0000000000000001e-004 | J234: -2.5999999999999999e-003 | K234: 10.22 | L234: -3.9000000000000003e-003 | M234: 111.2 | N234: 10.1 | O234: 0.19 | P234: 101.19 | Q234: 5月8天 | R234: 5.91年 | S234: 无权 | T234: 200 | U234: 243 | V234: 1.e-002 | W234: 0.19600000000000001 | X234: 0.19800000000000001 | Y234: 1023. | Z234: 1.01 | AA234: -1.3500000000000002e-002 | AB234: -1.6899999999999998e-002 | AC234: 无权 | AD234: 无权 | AE234: 无权 | AF234: 89.71 | AG234: 0.62 | AH234: AAA | AI234: 3.7499999999999999e-002 | AJ234: =H234+100*O234 -> 139.37 | AK234: 139.6 | AL234: 190 | AM234: 49.8 | AN234: 211 | AO234: -2.1000000000000001e-002 | AP234: 3 | AQ234: 南银转债
A235: 89 | B235: 110077 | C235: 洪城转债 | D235: 600461 | E235: 洪城环境 | F235: 城市公用 | G235: 城市公用 | H235: 122.22 | I235: 9.300000000000001e-003 | J235: -1.0200000000000001e-002 | K235: 7.23 | L235: -1.4000000000000002e-003 | M235: 113.5 | N235: 6.71 | O235: 0.13400000000000001 | P235: 107.75 | Q235: 转股中 | R235: 5.35年 | S235: 3.35年 | T235: 18 | U235: 5.4 | V235: 2.e-003 | W235: 0.26300000000000001 | X235: 0.28300000000000003 | Y235: 69 | Z235: 1.28 | AA235: -1.3899999999999999e-002 | AB235: -1.84e-002 | AC235: -4.9699999999999994e-002 | AD235: -5.0900000000000001e-002 | AE235: 89.31 | AF235: 92.51 | AG235: 0.66 | AH235: AA+ | AI235: 3.95e-002 | AJ235: =H235+100*O235 -> 135.62 | AK235: 136.7 | AL235: 159 | AM235: 44.2 | AN235: 170 | AO235: -1.3999999999999999e-002 | AP235: 6 | AQ235: 洪城转债
A236: 55 | B236: 113618 | C236: 美诺转债! | D236: 603538 | E236: 美诺华 | F236: 医药 | G236: 原料药 | H236: 124.37 | I236: -1.9199999999999998e-002 | J236: 6.8999999999999999e-003 | K236: 39.85 | L236: -1.7299999999999999e-002 | M236: 115.3 | N236: 37.47 | O236: 0.16899999999999998 | P236: 106.35 | Q236: 4.1天 | R236: 5.50年 | S236: 3.50年 | T236: 5.2 | U236: 36 | V236: 5.5e-002 | W236: 8.6999999999999994e-002 | X236: 9.3000000000000013e-002 | Y236: 60 | Z236: 3.76 | AA236: -1.3899999999999999e-002 | AB236: -1.8799999999999997e-002 | AC236: -4.8600000000000004e-002 | AD236: -5.04e-002 | AE236: 83.03 | AF236: 82.78 | AG236: 0.71 | AH236: AA- | AI236: 6.3500000000000001e-002 | AJ236: =H236+100*O236 -> 141.27000000000001 | AK236: 142.4 | AL236: 216 | AM236: 59.4 | AN236: 268 | AO236: -9.9000000000000005e-002 | AP236: 5 | AQ236: 美诺转债!
A237: 336 | B237: 128035 | C237: 大族转债! | D237: 2008 | E237: 大族激光 | F237: 机械装备 | G237: 专用设备 | H237: 111.3 | I237: 2.8000000000000004e-003 | J237: -3.2000000000000002e-003 | K237: 38 | L237: -8.1000000000000013e-003 | M237: 107.4 | N237: 51.9 | O237: 0.52000000000000002 | P237: 73.22 | Q237: 转股中 | R237: 2.56年 | S237: 0.56年 | T237: 23 | U237: 6.3 | V237: 2.e-003 | W237: 5.7000000000000002e-002 | X237: 4.2000000000000003e-002 | Y237: 405 | Z237: 4.21 | AA237: -1.3999999999999999e-002 | AB237: -1.9299999999999998e-002 | AC237: -9.1499999999999998e-002 | AD237: -0.106 | AE237: 101.14 | AF237: 98.11 | AG237: 0.05 | AH237: AA+ | AI237: 3.6400000000000002e-002 | AJ237: =H237+100*O237 -> 163.30000000000001 | AK237: 149.4 | AL237: 259 | AM237: 48.2 | AN237: 202 | AO237: -2.1000000000000001e-002 | AP237: 18 | AQ237: 大族转债!
A238: 189 | B238: 110070 | C238: 凌钢转债! | D238: 600231 | E238: 凌钢股份 | F238: 钢铁 | G238: 炼钢 | H238: 125.43 | I238: 4.6699999999999998e-002 | J238: -4.24e-002 | K238: 3.07 | L238: 6.6e-003 | M238: 117.4 | N238: 2.69 | O238: 9.9000000000000005e-002 | P238: 114.13 | Q238: 转股中 | R238: 4.74年 | S238: 2.74年 | T238: 2.17 | U238: 100 | V238: 0.36899999999999999 | W238: 2.5000000000000001e-002 | X238: 2.7999999999999997e-002 | Y238: 88 | Z238: 1.01 | AA238: -1.41e-002 | AB238: -2.0400000000000001e-002 | AC238: -6.3700000000000007e-002 | AD238: -6.59e-002 | AE238: 92.35 | AF238: 97.34 | AG238: 0.66 | AH238: AA | AI238: 4.1200000000000001e-002 | AJ238: =H238+100*O238 -> 135.33000000000001 | AK238: 136.7 | AL238: 161 | AM238: 39.4 | AN238: 131 | AO238: 6.4000000000000001e-002 | AP238: 22 | AQ238: 凌钢转债!
A239: 66 | B239: 113614 | C239: 健20转债! | D239: 603707 | E239: 健友股份 | F239: 医药 | G239: 原料药 | H239: 123.2 | I239: -5.1999999999999998e-003 | J239: -1.6899999999999998e-002 | K239: 29.46 | L239: -3.5699999999999996e-002 | M239: 114.2 | N239: 29.12 | O239: 0.218 | P239: 101.17 | Q239: 转股中 | R239: 5.42年 | S239: 3.42年 | T239: 7.8 | U239: 5.1 | V239: 5.0000000000000001e-003 | W239: 2.2000000000000002e-002 | X239: 2.2000000000000002e-002 | Y239: 358 | Z239: 7.15 | AA239: -1.4199999999999999e-002 | AB239: -1.8700000000000001e-002 | AC239: -4.7300000000000002e-002 | AD239: -4.9100000000000005e-002 | AE239: 89.44 | AF239: 91.54 | AG239: 0.62 | AH239: AA | AI239: 4.2500000000000003e-002 | AJ239: =H239+100*O239 -> 145. | AK239: 145.2 | AL239: 234 | AM239: 53.7 | AN239: 230 | AO239: -0.26200000000000001 | AP239: 4 | AQ239: 健20转债!
A240: 1 | B240: 123117 | C240: 健帆转债 | D240: 300529 | E240: 健帆生物 | F240: 医药 | G240: 医疗器械 | H240: 125.101 | I240: -1.6000000000000001e-003 | J240: -2.29e-002 | K240: 80.61 | L240: -4.8099999999999997e-002 | M240: 115.1 | N240: 90.6 | O240: 0.40600000000000003 | P240: 88.97 | Q240: 5月16天 | R240: 5.93年 | S240: 3.94年 | T240: 10 | U240: 28 | V240: 2.2000000000000002e-002 | W240: 1.4999999999999999e-002 | X240: 1.3999999999999999e-002 | Y240: 649 | Z240: 20.82 | AA240: -1.4199999999999999e-002 | AB240: -1.8600000000000002e-002 | AC240: -4.5199999999999997e-002 | AD240: -4.6799999999999994e-002 | AE240: 87.45 | AF240: 90.29 | AG240: 0.51 | AH240: AA | AI240: 4.2500000000000003e-002 | AJ240: =H240+100*O240 -> 165.70099999999999 | AK240: 161.2 | AL240: 296 | AM240: 70.9 | AN240: 301 | AO240: -4.7e-002 | AP240: 1 | AQ240: 健帆转债
A241: 179 | B241: 128108 | C241: 蓝帆转债! | D241: 2382 | E241: 蓝帆医疗 | F241: 医药 | G241: 医疗器械 | H241: 121.072 | I241: -1.6899999999999998e-002 | J241: 7.000000000000001e-004 | K241: 20.86 | L241: -2.3e-002 | M241: 112.9 | N241: 18.24 | O241: 5.9000000000000004e-002 | P241: 114.36 | Q241: 转股中 | R241: 4.86年 | S241: 3.87年 | T241: 15.3 | U241: 64 | V241: 3.4000000000000002e-002 | W241: 7.2999999999999995e-002 | X241: 8.3000000000000004e-002 | Y241: 210 | Z241: 1.76 | AA241: -1.4499999999999999e-002 | AB241: -1.9199999999999998e-002 | AC241: -3.4599999999999999e-002 | AD241: -3.6900000000000002e-002 | AE241: 89.64 | AF241: 93.12 | AG241: 0.71 | AH241: AA | AI241: 4.1200000000000001e-002 | AJ241: =H241+100*O241 -> 126.97200000000001 | AK241: 127.8 | AL241: 69 | AM241: 34.7 | AN241: 72 | AO241: 1.9e-002 | AP241: 26 | AQ241: 蓝帆转债!
A242: 30 | B242: 127031 | C242: 洋丰转债! | D242: 902 | E242: 新洋丰 | F242: 化工 | G242: 农化 | H242: 127.1 | I242: 1.3600000000000001e-002 | J242: 1.6299999999999999e-002 | K242: 21.05 | L242: 4.7300000000000002e-002 | M242: 117.1 | N242: 19.94 | O242: 0.20399999999999999 | P242: 105.57 | Q242: 2月24天 | R242: 5.69年 | S242: 3.69年 | T242: 10 | U242: 174 | V242: 0.13500000000000001 | W242: 3.6000000000000004e-002 | X242: 3.7999999999999999e-002 | Y242: 275 | Z242: 3.78 | AA242: -1.4499999999999999e-002 | AB242: -1.9699999999999999e-002 | AC242: -5.2000000000000005e-002 | AD242: -5.3600000000000002e-002 | AE242: 88.36 | AF242: 92.8 | AG242: 0.63 | AH242: AA | AI242: 4.2500000000000003e-002 | AJ242: =H242+100*O242 -> 147.5 | AK242: 148.6 | AL242: 255 | AM242: 55.8 | AN242: 244 | AO242: 0.308 | AP242: 3 | AQ242: 洋丰转债!
A243: 255 | B243: 128075 | C243: 远东转债! | D243: 2406 | E243: 远东传动 | F243: 汽车 | G243: 零部件制 | H243: 122.15 | I243: -5.3e-003 | J243: 4.1999999999999997e-003 | K243: 6.35 | L243: -1.6000000000000001e-003 | M243: 114.9 | N243: 5.29 | O243: 1.8000000000000002e-002 | P243: 120.04 | Q243: 转股中 | R243: 4.19年 | S243: 2.19年 | T243: 5.44 | U243: 6.8 | V243: 1.e-002 | W243: 0.13699999999999998 | X243: 0.16500000000000001 | Y243: 40 | Z243: 1.2 | AA243: -1.4800000000000001e-002 | AB243: -2.1000000000000001e-002 | AC243: -6.9000000000000006e-002 | AD243: -7.1500000000000008e-002 | AE243: 94.12 | AF243: 97.39 | AG243: 0.72 | AH243: AA | AI243: 4.1200000000000001e-002 | AJ243: =H243+100*O243 -> 123.95 | AK243: 124.3 | AL243: 43 | AM243: 26.9 | AN243: 26 | AO243: -2.3e-002 | AP243: 14 | AQ243: 远东转债!
A244: 176 | B244: 128109 | C244: 楚江转债 | D244: 2171 | E244: 楚江新材 | F244: 有色金属 | G244: 铜金属 | H244: 123.916 | I244: 1.1699999999999999e-002 | J244: 1.24e-002 | K244: 9.26 | L244: 3.8100000000000002e-002 | M244: 114.9 | N244: 8.63 | O244: 0.155 | P244: 107.3 | Q244: 转股中 | R244: 4.88年 | S244: 2.89年 | T244: 18.3 | U244: 29 | V244: 1.3000000000000001e-002 | W244: 0.14800000000000002 | X244: 0.159 | Y244: 123 | Z244: 2.18 | AA244: -1.5600000000000001e-002 | AB244: -2.0899999999999998e-002 | AC244: -5.7999999999999996e-002 | AD244: -5.9900000000000002e-002 | AE244: 91.51 | AF244: 94.69 | AG244: 0.63 | AH244: AA | AI244: 4.1200000000000001e-002 | AJ244: =H244+100*O244 -> 139.416 | AK244: 140.5 | AL244: 203 | AM244: 45.8 | AN244: 182 | AO244: 4.4999999999999998e-002 | AP244: 6 | AQ244: 楚江转债
A245: 206 | B245: 113572 | C245: 三祥转债! | D245: 603663 | E245: 三祥新材 | F245: 其他 | G245: 其他 | H245: 121.4 | I245: 4.4000000000000003e-003 | J245: -1.3500000000000002e-002 | K245: 15.86 | L245: -1.18e-002 | M245: 112.8 | N245: 14.09 | O245: 7.9000000000000001e-002 | P245: 112.56 | Q245: 转股中 | R245: 4.65年 | S245: 2.66年 | T245: 1.69 | U245: 6.3 | V245: 3.1e-002 | W245: 5.5e-002 | X245: 6.2e-002 | Y245: 31 | Z245: 4.77 | AA245: -1.6e-002 | AB245: -2.0799999999999999e-002 | AC245: -5.5999999999999994e-002 | AD245: -5.8099999999999999e-002 | AE245: 84.77 | AF245: 81.74 | AG245: 0.77 | AH245: A+ | AI245: 7.3200000000000001e-002 | AJ245: =H245+100*O245 -> 129.30000000000001 | AK245: 130.2 | AL245: 91 | AM245: 45.5 | AN245: 179 | AO245: 4.5999999999999999e-002 | AP245: 19 | AQ245: 三祥转债!
A246: 99 | B246: 113607 | C246: 伟20转债! | D246: 603568 | E246: 伟明环保 | F246: 城市公用 | G246: 三废处理 | H246: 125.21 | I246: -4.6999999999999993e-003 | J246: -5.6000000000000008e-003 | K246: 25.88 | L246: -1.41e-002 | M246: 115.1 | N246: 21.71 | O246: 5.0000000000000003e-002 | P246: 119.21 | Q246: 转股中 | R246: 5.30年 | S246: 3.30年 | T246: 12 | U246: 19 | V246: 1.3000000000000001e-002 | W246: 3.7000000000000005e-002 | X246: 4.4000000000000004e-002 | Y246: 325 | Z246: 5.82 | AA246: -1.61e-002 | AB246: -2.1000000000000001e-002 | AC246: -5.3600000000000002e-002 | AD246: -5.5500000000000001e-002 | AE246: 89.81 | AF246: 92.72 | AG246: 0.73 | AH246: AA | AI246: 4.2500000000000003e-002 | AJ246: =H246+100*O246 -> 130.20999999999998 | AK246: 131.2 | AL246: 106 | AM246: 38.5 | AN246: 123 | AO246: 9.9000000000000005e-002 | AP246: 5 | AQ246: 伟20转债!
A247: 262 | B247: 113541 | C247: 荣晟转债! | D247: 603165 | E247: 荣晟环保 | F247: 造纸包装 | G247: 包装用纸 | H247: 123.32 | I247: 8.0000000000000004e-004 | J247: -8.8000000000000005e-003 | K247: 12.74 | L247: -1.09e-002 | M247: 115 | N247: 10.84 | O247: 4.9000000000000002e-002 | P247: 117.53 | Q247: 转股中 | R247: 4年6.1天 | S247: 2年7天 | T247: 1.63 | U247: 5 | V247: 2.5000000000000001e-002 | W247: 4.9000000000000002e-002 | X247: 5.7000000000000002e-002 | Y247: 34 | Z247: 1.91 | AA247: -1.7600000000000001e-002 | AB247: -2.41e-002 | AC247: -7.7899999999999997e-002 | AD247: -8.0600000000000005e-002 | AE247: 90.87 | AF247: 90.78 | AG247: 0.73 | AH247: AA- | AI247: 6.2199999999999998e-002 | AJ247: =H247+100*O247 -> 128.22 | AK247: 129.1 | AL247: 78 | AM247: 38.2 | AN247: 116 | AO247: -2.2000000000000002e-002 | AP247: 42 | AQ247: 荣晟转债!
A248: 125 | B248: 113602 | C248: 景20转债! | D248: 603228 | E248: 景旺电子 | F248: 电子 | G248: 元器件制 | H248: 124.03 | I248: -5.5000000000000005e-003 | J248: -1.55e-002 | K248: 28.06 | L248: -3.3399999999999999e-002 | M248: 113.3 | N248: 27.4 | O248: 0.21100000000000002 | P248: 102.41 | Q248: 转股中 | R248: 5年38天 | S248: 3年39天 | T248: 17.8 | U248: 29 | V248: 1.3000000000000001e-002 | W248: 7.400000000000001e-002 | X248: 7.5999999999999998e-002 | Y248: 239 | Z248: 3.68 | AA248: -1.7899999999999999e-002 | AB248: -2.2499999999999999e-002 | AC248: -5.3499999999999999e-002 | AD248: -5.5500000000000001e-002 | AE248: 90.72 | AF248: 92.04 | AG248: 0.63 | AH248: AA | AI248: 4.2500000000000003e-002 | AJ248: =H248+100*O248 -> 145.13 | AK248: 145.7 | AL248: 236 | AM248: 53.6 | AN248: 229 | AO248: 5.4000000000000006e-002 | AP248: 9 | AQ248: 景20转债!
A249: 8 | B249: 127037 | C249: 银轮转债 | D249: 2126 | E249: 银轮股份 | F249: 汽车 | G249: 零部件制 | H249: 128 | I249: -1.2699999999999999e-002 | J249: 9.3999999999999986e-003 | K249: 10.59 | L249: -5.6000000000000008e-003 | M249: 115.1 | N249: 10.77 | O249: 0.30199999999999999 | P249: 98.33 | Q249: 4月28天 | R249: 5.89年 | S249: 3.89年 | T249: 7 | U249: 42 | V249: 4.5999999999999999e-002 | W249: 8.3000000000000004e-002 | X249: 8.199999999999999e-002 | Y249: 84 | Z249: 2.05 | AA249: -1.8200000000000001e-002 | AB249: -2.2599999999999999e-002 | AC249: -5.1100000000000007e-002 | AD249: -5.2699999999999997e-002 | AE249: 87.61 | AF249: 90.45 | AG249: 0.59 | AH249: AA | AI249: 4.2500000000000003e-002 | AJ249: =H249+100*O249 -> 158.19999999999999 | AK249: 157.7 | AL249: 289 | AM249: 67.2 | AN249: 294 | AO249: 1.4999999999999999e-002 | AP249: 2 | AQ249: 银轮转债
A250: 337 | B250: 110043 | C250: 无锡转债! | D250: 600908 | E250: 无锡银行 | F250: 金融 | G250: 银行行业 | H250: 113.66 | I250: -3.0000000000000001e-003 | J250: 2.0999999999999999e-003 | K250: 5.49 | L250: -1.8e-003 | M250: 108.3 | N250: 5.61 | O250: 0.161 | P250: 97.86 | Q250: 转股中 | R250: 2.54年 | S250: 无权 | T250: 29.2 | U250: 23 | V250: 6.9999999999999993e-003 | W250: 0.28600000000000003 | X250: 0.28000000000000003 | Y250: 102 | Z250: 0.83 | AA250: -1.9e-002 | AB250: -2.5000000000000001e-002 | AC250: 无权 | AD250: 无权 | AE250: 无权 | AF250: 99 | AG250: 0.49 | AH250: AA+ | AI250: 3.6400000000000002e-002 | AJ250: =H250+100*O250 -> 129.75999999999999 | AK250: 129.5 | AL250: 83 | AM250: 30.5 | AN250: 37 | AO250: -3.2000000000000001e-002 | AP250: 23 | AQ250: 无锡转债!
A251: 296 | B251: 113528 | C251: 长城转债! | D251: 603897 | E251: 长城科技 | F251: 机械装备 | G251: 专用设备 | H251: 125.06 | I251: 6.0999999999999995e-003 | J251: 2.06e-002 | K251: 27.52 | L251: 3.6900000000000002e-002 | M251: 116.8 | N251: 23.35 | O251: 6.0999999999999999e-002 | P251: 117.86 | Q251: 转股中 | R251: 3.62年 | S251: 1.62年 | T251: 6.34 | U251: 51 | V251: 6.3e-002 | W251: 0.129 | X251: 0.152 | Y251: 49 | Z251: 2.51 | AA251: -1.9099999999999999e-002 | AB251: -2.7000000000000003e-002 | AC251: -0.10300000000000001 | AD251: -0.106 | AE251: 92.66 | AF251: 94.31 | AG251: 0.72 | AH251: AA- | AI251: 6.2199999999999998e-002 | AJ251: =H251+100*O251 -> 131.16 | AK251: 132.3 | AL251: 117 | AM251: 38 | AN251: 112 | AO251: 0.10099999999999999 | AP251: 37 | AQ251: 长城转债!
A252: 368 | B252: 110034 | C252: 九州转债! | D252: 600998 | E252: 九州通 | F252: 医药 | G252: 医药商业 | H252: 109.09 | I252: -5.0000000000000001e-004 | J252: 4.0000000000000002e-004 | K252: 14.57 | L252: -1.0200000000000001e-002 | M252: 108 | N252: 17.83 | O252: 0.33500000000000002 | P252: 81.72 | Q252: 转股中 | R252: 0.50年 | S252: 回售内 | T252: 15 | U252: 28 | V252: 1.7000000000000001e-002 | W252: 5.5e-002 | X252: 4.4999999999999998e-002 | Y252: 273 | Z252: 1.35 | AA252: -1.9799999999999998e-002 | AB252: -4.8600000000000004e-002 | AC252: 回售内 | AD252: 回售内 | AE252: 103 | AF252: 106.26 | AG252: 0.01 | AH252: AA+ | AI252: 3.2899999999999999e-002 | AJ252: =H252+100*O252 -> 142.59 | AK252: 136.5 | AL252: 157 | AM252: 30.2 | AN252: 36 | AO252: -3.1e-002 | AP252: 24 | AQ252: 九州转债!
A253: 95 | B253: 128137 | C253: 洁美转债 | D253: 2859 | E253: 洁美科技 | F253: 电子 | G253: 元器件制 | H253: 130.96 | I253: -3.3e-003 | J253: -1.0500000000000001e-002 | K253: 32.75 | L253: -1.8000000000000002e-002 | M253: 117.3 | N253: 27.63 | O253: 0.105 | P253: 118.53 | Q253: 转股中 | R253: 5.30年 | S253: 3.30年 | T253: 5.99 | U253: 14 | V253: 1.7000000000000001e-002 | W253: 4.4999999999999998e-002 | X253: 5.2999999999999999e-002 | Y253: 134 | Z253: 7.3 | AA253: -2.0899999999999998e-002 | AB253: -2.6499999999999999e-002 | AC253: -6.54e-002 | AD253: -6.7199999999999996e-002 | AE253: 84.03 | AF253: 85.22 | AG253: 0.77 | AH253: AA- | AI253: 6.3500000000000001e-002 | AJ253: =H253+100*O253 -> 141.46000000000001 | AK253: 143.4 | AL253: 224 | AM253: 58.2 | AN253: 259 | AO253: 4.8000000000000001e-002 | AP253: 4 | AQ253: 洁美转债
A254: 75 | B254: 123083 | C254: 朗新转债 | D254: 300682 | E254: 朗新科技 | F254: 计算机及 | G254: 软件开发 | H254: 129 | I254: 5.9999999999999995e-004 | J254: -2.2000000000000001e-003 | K254: 18.18 | L254: -2.2000000000000001e-003 | M254: 115.1 | N254: 15.45 | O254: 9.6000000000000002e-002 | P254: 117.67 | Q254: 转股中 | R254: 5.40年 | S254: 3.40年 | T254: 8 | U254: 7.3 | V254: 6.9999999999999993e-003 | W254: 4.2999999999999997e-002 | X254: 5.0999999999999997e-002 | Y254: 186 | Z254: 3.53 | AA254: -2.1299999999999999e-002 | AB254: -2.6099999999999998e-002 | AC254: -6.0100000000000001e-002 | AD254: -6.1799999999999994e-002 | AE254: 89.43 | AF254: 92.33 | AG254: 0.72 | AH254: AA | AI254: 4.2500000000000003e-002 | AJ254: =H254+100*O254 -> 138.59999999999999 | AK254: 140.3 | AL254: 200 | AM254: 48 | AN254: 201 | AO254: 5.2000000000000005e-002 | AP254: 5 | AQ254: 朗新转债
A255: 112 | B255: 110075 | C255: 南航转债 | D255: 600029 | E255: 南方航空 | F255: 交通运输 | G255: 航空运输 | H255: 123.1 | I255: 7.4000000000000003e-003 | J255: 6.0000000000000001e-003 | K255: 5.96 | L255: 2.41e-002 | M255: 110 | N255: 6.24 | O255: 0.28899999999999998 | P255: 95.51 | Q255: 转股中 | R255: 5.25年 | S255: 3.25年 | T255: 59 | U255: 20 | V255: 3.0000000000000001e-003 | W255: 5.7999999999999996e-002 | X255: 5.5999999999999994e-002 | Y255: 1010. | Z255: 1.4 | AA255: -2.1499999999999998e-002 | AB255: -2.4900000000000002e-002 | AC255: -5.3200000000000004e-002 | AD255: -5.4299999999999994e-002 | AE255: 90.24 | AF255: 90.91 | AG255: 0.56 | AH255: AAA | AI255: 3.7499999999999999e-002 | AJ255: =H255+100*O255 -> 152. | AK255: 150.7 | AL255: 268 | AM255: 59.8 | AN255: 270 | AO255: -5.0000000000000001e-003 | AP255: 7 | AQ255: 南航转债
A256: 61 | B256: 123091 | C256: 长海转债 | D256: 300196 | E256: 长海股份 | F256: 其他 | G256: 非金属矿 | H256: 131.605 | I256: 3.0000000000000001e-003 | J256: -6.8999999999999999e-003 | K256: 18.79 | L256: -5.3e-003 | M256: 116.2 | N256: 16.14 | O256: 0.13 | P256: 116.42 | Q256: 转股中 | R256: 5.44年 | S256: 3.44年 | T256: 5.5 | U256: 15 | V256: 2.1000000000000001e-002 | W256: 7.2000000000000008e-002 | X256: 8.3000000000000004e-002 | Y256: 77 | Z256: 2.59 | AA256: -2.3e-002 | AB256: -2.81e-002 | AC256: -6.4500000000000002e-002 | AD256: -6.6199999999999995e-002 | AE256: 89.38 | AF256: 93.08 | AG256: 0.72 | AH256: AA | AI256: 4.2500000000000003e-002 | AJ256: =H256+100*O256 -> 144.60499999999999 | AK256: 146.8 | AL256: 245 | AM256: 53.7 | AN256: 231 | AO256: 9.6000000000000002e-002 | AP256: 3 | AQ256: 长海转债
A257: 219 | B257: 128096 | C257: 奥瑞转债!! | D257: 2701 | E257: 奥瑞金 | F257: 造纸包装 | G257: 包装材料 | H257: 128.348 | I257: -5.0000000000000001e-004 | J257: -6.1999999999999998e-003 | K257: 5.34 | L257: -9.300000000000001e-003 | M257: 115.5 | N257: 4.5 | O257: 8.199999999999999e-002 | P257: 118.67 | Q257: 转股中 | R257: 4.57年 | S257: 2.58年 | T257: 6.74 | U257: 5.7 | V257: 6.9999999999999993e-003 | W257: 5.2000000000000005e-002 | X257: 6.2e-002 | Y257: 129 | Z257: 1.92 | AA257: -2.3300000000000001e-002 | AB257: -2.9100000000000001e-002 | AC257: -7.51e-002 | AD257: -7.7499999999999999e-002 | AE257: 93.8 | AF257: 97.68 | AG257: 0.72 | AH257: AA+ | AI257: 3.8199999999999998e-002 | AJ257: =H257+100*O257 -> 136.548 | AK257: 138 | AL257: 179 | AM257: 40.3 | AN257: 141 | AO257: 3.7999999999999999e-002 | AP257: 18 | AQ257: 奥瑞转债!!
A258: 47 | B258: 123098 | C258: 一品转债 | D258: 300723 | E258: 一品红 | F258: 医药 | G258: 医药行业 | H258: 141 | I258: 5.1999999999999998e-003 | J258: 7.9000000000000008e-003 | K258: 35.37 | L258: 1.61e-002 | M258: 124 | N258: 25.45 | O258: 1.4999999999999999e-002 | P258: 138.98 | Q258: 18天 | R258: 5.53年 | S258: 3.54年 | T258: 4.8 | U258: 646 | V258: 0.95099999999999996 | W258: 4.7e-002 | X258: 6.5000000000000002e-002 | Y258: 102 | Z258: 3.66 | AA258: -2.3399999999999997e-002 | AB258: -3.0299999999999997e-002 | AC258: -7.980000000000001e-002 | AD258: -8.1500000000000003e-002 | AE258: 82.93 | AF258: 88.8 | AG258: 0.82 | AH258: AA- | AI258: 6.3500000000000001e-002 | AJ258: =H258+100*O258 -> 142.5 | AK258: 143 | AL258: 220 | AM258: 54.2 | AN258: 235 | AO258: 0.191 | AP258: 4 | AQ258: 一品转债
A259: 86 | B259: 123078 | C259: 飞凯转债! | D259: 300398 | E259: 飞凯材料 | F259: 化工 | G259: 化工 | H259: 131 | I259: -1.1399999999999999e-002 | J259: 2.3999999999999998e-003 | K259: 18.99 | L259: -1.2e-002 | M259: 115.2 | N259: 15.56 | O259: 7.2999999999999995e-002 | P259: 122.04 | Q259: 转股中 | R259: 5.36年 | S259: 3.37年 | T259: 8.15 | U259: 93 | V259: 8.4000000000000005e-002 | W259: 8.3000000000000004e-002 | X259: 0.10199999999999999 | Y259: 98 | Z259: 3.65 | AA259: -2.41e-002 | AB259: -2.8900000000000002e-002 | AC259: -6.4500000000000002e-002 | AD259: -6.6299999999999998e-002 | AE259: 89.65 | AF259: 92.55 | AG259: 0.75 | AH259: AA | AI259: 4.2500000000000003e-002 | AJ259: =H259+100*O259 -> 138.30000000000001 | AK259: 140 | AL259: 196 | AM259: 47.4 | AN259: 197 | AO259: 2.9999999999999999e-002 | AP259: 8 | AQ259: 飞凯转债!
A260: 77 | B260: 113612 | C260: 永冠转债 | D260: 603681 | E260: 永冠新材 | F260: 化工 | G260: 其他 | H260: 138.5 | I260: 2.7400000000000001e-002 | J260: -6.1999999999999998e-003 | K260: 26.95 | L260: 2.63e-002 | M260: 121.2 | N260: 20.59 | O260: 5.7999999999999996e-002 | P260: 130.89 | Q260: 转股中 | R260: 5.39年 | S260: 3.40年 | T260: 5.2 | U260: 37 | V260: 5.0999999999999997e-002 | W260: 0.11599999999999999 | X260: 0.152 | Y260: 45 | Z260: 2.85 | AA260: -2.4900000000000002e-002 | AB260: -3.1300000000000001e-002 | AC260: -7.7699999999999991e-002 | AD260: -7.9600000000000004e-002 | AE260: 83.84 | AF260: 87.6 | AG260: 0.81 | AH260: AA- | AI260: 6.3500000000000001e-002 | AJ260: =H260+100*O260 -> 144.30000000000001 | AK260: 146.1 | AL260: 239 | AM260: 58.5 | AN260: 263 | AO260: 6.6000000000000003e-002 | AP260: 6 | AQ260: 永冠转债
A261: 322 | B261: 110045 | C261: 海澜转债! | D261: 600398 | E261: 海澜之家 | F261: 服装纺织 | G261: 服装行业 | H261: 118.89 | I261: 2.8999999999999998e-002 | J261: 1.6e-002 | K261: 7.76 | L261: 7.0300000000000001e-002 | M261: 110.3 | N261: 7.04 | O261: 7.9000000000000001e-002 | P261: 110.23 | Q261: 转股中 | R261: 2.99年 | S261: 0.99年 | T261: 29.5 | U261: 199 | V261: 5.7000000000000002e-002 | W261: 8.8000000000000009e-002 | X261: 9.6999999999999989e-002 | Y261: 335 | Z261: 2.39 | AA261: -2.5000000000000001e-002 | AB261: -3.1099999999999999e-002 | AC261: -0.126 | AD261: -0.128 | AE261: 97.12 | AF261: 99.22 | AG261: 0.64 | AH261: AA+ | AI261: 3.6400000000000002e-002 | AJ261: =H261+100*O261 -> 126.79000000000001 | AK261: 127.6 | AL261: 66 | AM261: 28.3 | AN261: 31 | AO261: 9.0999999999999998e-002 | AP261: 50 | AQ261: 海澜转债!
A262: 114 | B262: 128134 | C262: 鸿路转债! | D262: 2541 | E262: 鸿路钢构 | F262: 建筑 | G262: 其他 | H262: 131.54 | I262: -9.1000000000000004e-003 | J262: -2.7300000000000001e-002 | K262: 54.34 | L262: -4.6699999999999998e-002 | M262: 115.1 | N262: 43.51 | O262: 5.2999999999999999e-002 | P262: 124.89 | Q262: 转股中 | R262: 5.23年 | S262: 3.23年 | T262: 15.8 | U262: 43 | V262: 2.1000000000000001e-002 | W262: 5.5e-002 | X262: 6.9000000000000006e-002 | Y262: 285 | Z262: 4.9 | AA262: -2.5600000000000001e-002 | AB262: -3.0600000000000002e-002 | AC262: -6.8400000000000002e-002 | AD262: -7.0199999999999999e-002 | AE262: 90.06 | AF262: 92.98 | AG262: 0.78 | AH262: AA | AI262: 4.2500000000000003e-002 | AJ262: =H262+100*O262 -> 136.84 | AK262: 138.2 | AL262: 182 | AM262: 45.2 | AN262: 177 | AO262: -6.0999999999999999e-002 | AP262: 5 | AQ262: 鸿路转债!
A263: 348 | B263: 128025 | C263: 特一转债! | D263: 2728 | E263: 特一药业 | F263: 医药 | G263: 化学制药 | H263: 115.735 | I263: -3.5999999999999999e-003 | J263: 7.000000000000001e-004 | K263: 13.13 | L263: -6.0999999999999995e-003 | M263: 108.8 | N263: 14.05 | O263: 0.23800000000000002 | P263: 93.45 | Q263: 转股中 | R263: 2.39年 | S263: 0.39年 | T263: 2.98 | U263: 62 | V263: 0.17999999999999999 | W263: 0.111 | X263: 0.10400000000000001 | Y263: 27 | Z263: 2.5 | AA263: -2.5899999999999999e-002 | AB263: -3.2500000000000001e-002 | AC263: -0.23199999999999998 | AD263: -0.23699999999999999 | AE263: 98.29 | AF263: 94.78 | AG263: 0.47 | AH263: AA- | AI263: 6.0400000000000002e-002 | AJ263: =H263+100*O263 -> 139.535 | AK263: 138 | AL263: 178 | AM263: 39.7 | AN263: 136 | AO263: -5.5e-002 | AP263: 49 | AQ263: 特一转债!
A264: 44 | B264: 118000 | C264: 嘉元转债 | D264: 688388 | E264: 嘉元科技 | F264: 电子 | G264: 电子产品 | H264: 139.98 | I264: -4.6900000000000004e-002 | J264: -8.199999999999999e-003 | K264: 99 | L264: -7.2099999999999997e-002 | M264: 121 | N264: 78.74 | O264: 0.113 | P264: 125.73 | Q264: 47天 | R264: 5.61年 | S264: 3.61年 | T264: 12.4 | U264: 98 | V264: 5.5e-002 | W264: 5.4000000000000006e-002 | X264: 6.8000000000000005e-002 | Y264: 229 | Z264: 8.4 | AA264: -2.6099999999999998e-002 | AB264: -3.2199999999999999e-002 | AC264: -7.6499999999999999e-002 | AD264: -7.8200000000000006e-002 | AE264: 82.57 | AF264: 86.29 | AG264: 0.76 | AH264: AA- | AI264: 6.3500000000000001e-002 | AJ264: =H264+100*O264 -> 151.28 | AK264: 154.2 | AL264: 278 | AM264: 67.9 | AN264: 296 | AO264: 2.8999999999999998e-002 | AP264: 4 | AQ264: 嘉元转债
A265: 9 | B265: 127036 | C265: 三花转债 | D265: 2050 | E265: 三花智控 | F265: 机械装备 | G265: 通用设备 | H265: 133.66 | I265: -6.1999999999999998e-003 | J265: -1.3600000000000001e-002 | K265: 21.63 | L265: -3.3099999999999997e-002 | M265: 114.5 | N265: 21.55 | O265: 0.33200000000000002 | P265: 100.37 | Q265: 4月24天 | R265: 5.87年 | S265: 3.88年 | T265: 30 | U265: 63 | V265: 1.6e-002 | W265: 3.9e-002 | X265: 3.9e-002 | Y265: 777 | Z265: 7.44 | AA265: -2.63e-002 | AB265: -3.0600000000000002e-002 | AC265: -6.2699999999999992e-002 | AD265: -6.4000000000000001e-002 | AE265: 88.15 | AF265: 91.49 | AG265: 0.6 | AH265: AA+ | AI265: 3.95e-002 | AJ265: =H265+100*O265 -> 166.86000000000001 | AK265: 166.9 | AL265: 304 | AM265: 75.5 | AN265: 302 | AO265: -5.9000000000000004e-002 | AP265: 4 | AQ265: 三花转债
A266: 26 | B266: 123108 | C266: 乐普转2 | D266: 300003 | E266: 乐普医疗 | F266: 医药 | G266: 医疗器械 | H266: 126.51 | I266: -5.4000000000000003e-003 | J266: -6.4000000000000003e-003 | K266: 29.42 | L266: -2.06e-002 | M266: 111.1 | N266: 29.5 | O266: 0.26899999999999996 | P266: 99.73 | Q266: 2月24天 | R266: 4.70年 | S266: 2.70年 | T266: 16.4 | U266: 24 | V266: 1.2e-002 | W266: 3.1e-002 | X266: 3.1e-002 | Y266: 531 | Z266: 4.99 | AA266: -2.75e-002 | AB266: -3.1699999999999999e-002 | AC266: -7.2300000000000003e-002 | AD266: -7.3599999999999999e-002 | AE266: 91.68 | AF266: 93.34 | AG266: 0.57 | AH266: AA+ | AI266: 3.8199999999999998e-002 | AJ266: =H266+100*O266 -> 153.41 | AK266: 153.3 | AL266: 273 | AM266: 59.9 | AN266: 271 | AO266: -4.2999999999999997e-002 | AP266: 9 | AQ266: 乐普转2
A267: 11 | B267: 123114 | C267: 三角转债 | D267: 300775 | E267: 三角防务 | F267: 航空航天 | G267: 航空航天 | H267: 142.1 | I267: 2.8199999999999999e-002 | J267: 2.1000000000000001e-002 | K267: 36.22 | L267: 6.7500000000000004e-002 | M267: 121 | N267: 31.82 | O267: 0.248 | P267: 113.83 | Q267: 4月17天 | R267: 5.86年 | S267: 3.86年 | T267: 9.04 | U267: 740 | V267: 0.55899999999999994 | W267: 5.0000000000000003e-002 | X267: 5.7000000000000002e-002 | Y267: 179 | Z267: 8.97 | AA267: -2.75e-002 | AB267: -3.3399999999999999e-002 | AC267: -7.5399999999999995e-002 | AD267: -7.6999999999999999e-002 | AE267: 81.31 | AF267: 84.97 | AG267: 0.73 | AH267: AA- | AI267: 6.3500000000000001e-002 | AJ267: =H267+100*O267 -> 166.90000000000001 | AK267: 170.4 | AL267: 309 | AM267: 85.4 | AN267: 319 | AO267: -2.e-002 | AP267: 3 | AQ267: 三角转债
A268: 293 | B268: 128057 | C268: 博彦转债 | D268: 2649 | E268: 博彦科技 | F268: 计算机及 | G268: 软件开发 | H268: 129.5 | I268: 9.3999999999999986e-003 | J268: -4.8999999999999998e-003 | K268: 11 | L268: 5.5000000000000005e-003 | M268: 116.3 | N268: 8.5 | O268: 1.e-003 | P268: 129.41 | Q268: 转股中 | R268: 3.63年 | S268: 1.64年 | T268: 4.99 | U268: 96 | V268: 0.14899999999999999 | W268: 8.5000000000000006e-002 | X268: 0.11 | Y268: 59 | Z268: 1.93 | AA268: -2.9700000000000001e-002 | AB268: -3.7200000000000004e-002 | AC268: -0.10300000000000001 | AD268: -0.105 | AE268: 92.29 | AF268: 93.79 | AG268: 0.81 | AH268: AA- | AI268: 6.2199999999999998e-002 | AJ268: =H268+100*O268 -> 129.59999999999999 | AK268: 129.6 | AL268: 85 | AM268: 35.8 | AN268: 81 | AO268: 6.4000000000000001e-002 | AP268: 25 | AQ268: 博彦转债
A269: 7 | B269: 123115 | C269: 捷捷转债 | D269: 300623 | E269: 捷捷微电 | F269: 电子 | G269: 元器件制 | H269: 141.11 | I269: -7.7000000000000002e-003 | J269: -1.49e-002 | K269: 32.67 | L269: -3.0600000000000002e-002 | M269: 118.5 | N269: 29 | O269: 0.253 | P269: 112.66 | Q269: 5月2天 | R269: 5.89年 | S269: 3.90年 | T269: 12 | U269: 64 | V269: 3.7000000000000005e-002 | W269: 5.0000000000000003e-002 | X269: 5.5999999999999994e-002 | Y269: 241 | Z269: 6.17 | AA269: -2.9700000000000001e-002 | AB269: -3.49e-002 | AC269: -7.3300000000000004e-002 | AD269: -7.4900000000000008e-002 | AE269: 81.05 | AF269: 83.01 | AG269: 0.74 | AH269: AA- | AI269: 6.3500000000000001e-002 | AJ269: =H269+100*O269 -> 166.41000000000003 | AK269: 169.6 | AL269: 306 | AM269: 86.6 | AN269: 321 | AO269: -7.0000000000000007e-002 | AP269: 3 | AQ269: 捷捷转债
A270: 45 | B270: 123100 | C270: 朗科转债 | D270: 300543 | E270: 朗科智能 | F270: 电子 | G270: 电子产品 | H270: 139 | I270: -3.7900000000000003e-002 | J270: -3.4000000000000002e-003 | K270: 16.05 | L270: -4.9200000000000001e-002 | M270: 117.5 | N270: 11.61 | O270: 5.0000000000000001e-003 | P270: 138.24 | Q270: 37天 | R270: 5.57年 | S270: 3.57年 | T270: 3.8 | U270: 249 | V270: 0.46200000000000002 | W270: 8.8000000000000009e-002 | X270: 0.122 | Y270: 43 | Z270: 3.53 | AA270: -3.0299999999999997e-002 | AB270: -3.5499999999999997e-002 | AC270: -7.5700000000000003e-002 | AD270: -7.7399999999999997e-002 | AE270: 82.69 | AF270: 83.98 | AG270: 0.84 | AH270: AA- | AI270: 6.3500000000000001e-002 | AJ270: =H270+100*O270 -> 139.5 | AK270: 139.8 | AL270: 194 | AM270: 55.8 | AN270: 243 | AO270: -6.0000000000000001e-003 | AP270: 9 | AQ270: 朗科转债
A271: 333 | B271: 127005 | C271: 长证转债! | D271: 783 | E271: 长江证券 | F271: 金融 | G271: 证券行业 | H271: 117.5 | I271: 1.2999999999999999e-003 | J271: 1.5e-003 | K271: 7.21 | L271: 5.6000000000000008e-003 | M271: 108.3 | N271: 7.28 | O271: 0.18600000000000003 | P271: 99.04 | Q271: 转股中 | R271: 2.65年 | S271: 无权 | T271: 50 | U271: 51 | V271: 9.0000000000000011e-003 | W271: 0.125 | X271: 0.124 | Y271: 399 | Z271: 1.38 | AA271: -3.0699999999999998e-002 | AB271: -3.6299999999999999e-002 | AC271: 无权 | AD271: 无权 | AE271: 无权 | AF271: 99.15 | AG271: 0.51 | AH271: AAA | AI271: 3.44e-002 | AJ271: =H271+100*O271 -> 136.09999999999999 | AK271: 136 | AL271: 150 | AM271: 36.8 | AN271: 95 | AO271: 1.e-003 | AP271: 13 | AQ271: 长证转债!
A272: 241 | B272: 123035 | C272: 利德转债! | D272: 300296 | E272: 利亚德 | F272: 电子 | G272: LED制 | H272: 131.505 | I272: -5.3e-003 | J272: -4.0000000000000001e-003 | K272: 8.11 | L272: -1.34e-002 | M272: 115.1 | N272: 6.96 | O272: 0.129 | P272: 116.52 | Q272: 转股中 | R272: 4.33年 | S272: 2.33年 | T272: 8 | U272: 23 | V272: 2.2000000000000002e-002 | W272: 3.9e-002 | X272: 4.4999999999999998e-002 | Y272: 206 | Z272: 2.83 | AA272: -3.0899999999999997e-002 | AB272: -3.6900000000000002e-002 | AC272: -9.1999999999999998e-002 | AD272: -9.4399999999999998e-002 | AE272: 94.45 | AF272: 98.22 | AG272: 0.69 | AH272: AA+ | AI272: 3.8199999999999998e-002 | AJ272: =H272+100*O272 -> 144.405 | AK272: 146.5 | AL272: 242 | AM272: 48.3 | AN272: 203 | AO272: -6.0000000000000001e-003 | AP272: 14 | AQ272: 利德转债!
A273: 250 | B273: 128079 | C273: 英联转债! | D273: 2846 | E273: 英联股份 | F273: 造纸包装 | G273: 包装材料 | H273: 134.62 | I273: -1.01e-002 | J273: 1.01e-002 | K273: 8.59 | L273: -5.7999999999999996e-003 | M273: 117.5 | N273: 8.29 | O273: 0.29899999999999999 | P273: 103.62 | Q273: 转股中 | R273: 4.26年 | S273: 2.27年 | T273: 1.52 | U273: 64 | V273: 0.31 | W273: 5.5999999999999994e-002 | X273: 5.7999999999999996e-002 | Y273: 27 | Z273: 3.55 | AA273: -3.2000000000000001e-002 | AB273: -3.8900000000000004e-002 | AC273: -0.10199999999999999 | AD273: -0.105 | AE273: 87.47 | AF273: 87.56 | AG273: 0 | AH273: A+ | AI273: 7.3200000000000001e-002 | AJ273: =H273+100*O273 -> 164.52000000000001 | AK273: 165.6 | AL273: 303 | AM273: 78.1 | AN273: 309 | AO273: 1.e-003 | AP273: 18 | AQ273: 英联转债!
A274: 299 | B274: 128053 | C274: 尚荣转债! | D274: 2551 | E274: 尚荣医疗 | F274: 医药 | G274: 医疗器械 | H274: 128.3 | I274: -5.4000000000000003e-003 | J274: 2.0999999999999999e-003 | K274: 5.23 | L274: -3.8e-003 | M274: 114.3 | N274: 4.89 | O274: 0.20000000000000001 | P274: 106.95 | Q274: 转股中 | R274: 3.58年 | S274: 1.58年 | T274: 1.91 | U274: 28 | V274: 0.113 | W274: 4.4000000000000004e-002 | X274: 4.8000000000000001e-002 | Y274: 43 | Z274: 1.4 | AA274: -3.2300000000000002e-002 | AB274: -3.9100000000000003e-002 | AC274: -0.10300000000000001 | AD274: -0.105 | AE274: 95.84 | AF274: 99.18 | AG274: 0.88 | AH274: AA | AI274: 4.1200000000000001e-002 | AJ274: =H274+100*O274 -> 148.30000000000001 | AK274: 149.6 | AL274: 263 | AM274: 50.5 | AN274: 218 | AO274: -3.7999999999999999e-002 | AP274: 25 | AQ274: 尚荣转债!
A275: 195 | B275: 113575 | C275: 东时转债!! | D275: 603377 | E275: 东方时尚 | F275: 其他 | G275: 其他 | H275: 132.45 | I275: -5.1999999999999998e-003 | J275: 1.47e-002 | K275: 9.81 | L275: 2.6200000000000001e-002 | M275: 113.1 | N275: 12.15 | O275: 0.64000000000000001 | P275: 80.74 | Q275: 转股中 | R275: 4.73年 | S275: 2.73年 | T275: 0.98 | U275: 21 | V275: 0.16300000000000001 | W275: 1.3999999999999999e-002 | X275: 1.1000000000000001e-002 | Y275: 71 | Z275: 2.86 | AA275: -3.3399999999999999e-002 | AB275: -3.8199999999999998e-002 | AC275: -8.2400000000000001e-002 | AD275: -8.4399999999999989e-002 | AE275: 92.11 | AF275: 93.8 | AG275: 0.36 | AH275: AA | AI275: 4.1200000000000001e-002 | AJ275: =H275+100*O275 -> 196.44999999999999 | AK275: 184.2 | AL275: 327 | AM275: 90.4 | AN275: 329 | AO275: -1.7000000000000001e-002 | AP275: 14 | AQ275: 东时转债!!
A276: 62 | B276: 123089 | C276: 九洲转2! | D276: 300040 | E276: 九洲集团 | F276: 能源电力 | G276: 电力设备 | H276: 145.2 | I276: -2.8399999999999998e-002 | J276: -1.55e-002 | K276: 8.18 | L276: -5.21e-002 | M276: 121 | N276: 5.68 | O276: 8.0000000000000002e-003 | P276: 144.01 | Q276: 转股中 | R276: 5.43年 | S276: 3.43年 | T276: 4.04 | U276: 452 | V276: 0.75 | W276: 9.3000000000000013e-002 | X276: 0.13400000000000001 | Y276: 44 | Z276: 1.4 | AA276: -3.3599999999999998e-002 | AB276: -3.9900000000000005e-002 | AC276: -8.9499999999999996e-002 | AD276: -9.1300000000000006e-002 | AE276: 83.46 | AF276: 87.22 | AG276: 0.84 | AH276: AA- | AI276: 6.3500000000000001e-002 | AJ276: =H276+100*O276 -> 146. | AK276: 146.4 | AL276: 241 | AM276: 59.2 | AN276: 267 | AO276: -0.157 | AP276: 21 | AQ276: 九洲转2!
A277: 107 | B277: 123070 | C277: 鹏辉转债 | D277: 300438 | E277: 鹏辉能源 | F277: 汽车 | G277: 零部件制 | H277: 138.01 | I277: -3.0999999999999999e-003 | J277: 8.3999999999999995e-003 | K277: 27.05 | L277: 6.3e-003 | M277: 115.1 | N277: 20.06 | O277: 2.3e-002 | P277: 134.85 | Q277: 转股中 | R277: 5.26年 | S277: 3.26年 | T277: 8.9 | U277: 369 | V277: 0.29600000000000004 | W277: 7.8e-002 | X277: 0.106 | Y277: 113 | Z277: 4.8 | AA277: -3.4500000000000003e-002 | AB277: -3.9300000000000002e-002 | AC277: -8.0799999999999997e-002 | AD277: -8.2599999999999993e-002 | AE277: 89.94 | AF277: 92.86 | AG277: 0.83 | AH277: AA | AI277: 4.2500000000000003e-002 | AJ277: =H277+100*O277 -> 140.31 | AK277: 141.2 | AL277: 209 | AM277: 48.3 | AN277: 204 | AO277: 0.125 | AP277: 5 | AQ277: 鹏辉转债
A278: 147 | B278: 123060 | C278: 苏试转债 | D278: 300416 | E278: 苏试试验 | F278: 机械装备 | G278: 专用设备 | H278: 139.9 | I278: -4.3e-003 | J278: 1.6399999999999998e-002 | K278: 25.01 | L278: 1.46e-002 | M278: 117.6 | N278: 18.28 | O278: 2.3e-002 | P278: 136.82 | Q278: 转股中 | R278: 5年4.1天 | S278: 3年5.1天 | T278: 3.1 | U278: 44 | V278: 0.10199999999999999 | W278: 4.7e-002 | X278: 6.4000000000000001e-002 | Y278: 66 | Z278: 5.45 | AA278: -3.4700000000000002e-002 | AB278: -4.0500000000000001e-002 | AC278: -9.01e-002 | AD278: -9.2100000000000015e-002 | AE278: 85.67 | AF278: 87 | AG278: 0.83 | AH278: AA- | AI278: 6.3500000000000001e-002 | AJ278: =H278+100*O278 -> 142.20000000000002 | AK278: 143 | AL278: 219 | AM278: 56 | AN278: 246 | AO278: 5.2999999999999999e-002 | AP278: 9 | AQ278: 苏试转债
A279: 109 | B279: 127022 | C279: 恒逸转债 | D279: 703 | E279: 恒逸石化 | F279: 化工 | G279: 化工 | H279: 130.959 | I279: 1.29e-002 | J279: -1.8200000000000001e-002 | K279: 13.16 | L279: -6.8000000000000005e-003 | M279: 108.9 | N279: 11.2 | O279: 0.115 | P279: 117.5 | Q279: 转股中 | R279: 5.25年 | S279: 3.25年 | T279: 20 | U279: 81 | V279: 3.1e-002 | W279: 4.0999999999999995e-002 | X279: 4.8000000000000001e-002 | Y279: 485 | Z279: 1.95 | AA279: -3.5000000000000003e-002 | AB279: -3.7999999999999999e-002 | AC279: -6.9099999999999995e-002 | AD279: -7.0499999999999993e-002 | AE279: 90 | AF279: 89.13 | AG279: 0.77 | AH279: AA+ | AI279: 3.95e-002 | AJ279: =H279+100*O279 -> 142.459 | AK279: 144.4 | AL279: 231 | AM279: 54.4 | AN279: 237 | AO279: 5.7999999999999996e-002 | AP279: 7 | AQ279: 恒逸转债
A280: 359 | B280: 113013 | C280: 国君转债! | D280: 601211 | E280: 国泰君安 | F280: 金融 | G280: 证券行业 | H280: 114.58 | I280: 5.6999999999999993e-003 | J280: -1.6000000000000001e-003 | K280: 17.02 | L280: 1.2500000000000001e-002 | M280: 106.8 | N280: 19.01 | O280: 0.28000000000000003 | P280: 89.53 | Q280: 转股中 | R280: 1.98年 | S280: 无权 | T280: 69.9 | U280: 55 | V280: 6.9999999999999993e-003 | W280: 4.5999999999999999e-002 | X280: 4.0999999999999995e-002 | Y280: 1516. | Z280: 1.16 | AA280: -3.5299999999999998e-002 | AB280: -4.1500000000000002e-002 | AC280: 无权 | AD280: 无权 | AE280: 无权 | AF280: 99.96 | AG280: 0.33 | AH280: AAA | AI280: 3.44e-002 | AJ280: =H280+100*O280 -> 142.58000000000001 | AK280: 139.6 | AL280: 191 | AM280: 39.7 | AN280: 135 | AO280: 9.0000000000000011e-003 | AP280: 12 | AQ280: 国君转债!
A281: 330 | B281: 128036 | C281: 金农转债!! | D281: 2548 | E281: 金新农 | F281: 农业 | G281: 畜牧业 | H281: 120.072 | I281: 5.9999999999999995e-004 | J281: -2.8000000000000004e-003 | K281: 5.47 | L281: -1.0800000000000001e-002 | M281: 109.3 | N281: 6.93 | O281: 0.52100000000000002 | P281: 78.93 | Q281: 转股中 | R281: 2.64年 | S281: 0.65年 | T281: 1.46 | U281: 28 | V281: 0.16 | W281: 3.9e-002 | X281: 2.9999999999999999e-002 | Y281: 38 | Z281: 1.45 | AA281: -3.5499999999999997e-002 | AB281: -4.1700000000000001e-002 | AC281: -0.192 | AD281: -0.19500000000000001 | AE281: 97.07 | AF281: 93.84 | AG281: 0.2 | AH281: AA- | AI281: 6.0400000000000002e-002 | AJ281: =H281+100*O281 -> 172.172 | AK281: 161.2 | AL281: 295 | AM281: 64.1 | AN281: 286 | AO281: -4.0000000000000001e-002 | AP281: 15 | AQ281: 金农转债!!
A282: 104 | B282: 113040 | C282: 星宇转债!* | D282: 601799 | E282: 星宇股份 | F282: 汽车 | G282: 零部件制 | H282: 137.15 | I282: -2.0400000000000001e-002 | J282: -1.4000000000000002e-003 | K282: 215.2 | L282: -2.18e-002 | M282: 111.5 | N282: 156.7 | O282: -1.e-003 | P282: 137.33 | Q282: 转股中 | R282: 5.27年 | S282: 3.27年 | T282: 9.04 | U282: 25 | V282: 2.e-002 | W282: 1.4999999999999999e-002 | X282: 2.1000000000000001e-002 | Y282: 596 | Z282: 9.82 | AA282: -3.9e-002 | AB282: -4.2699999999999995e-002 | AC282: -8.2299999999999998e-002 | AD282: -8.3400000000000002e-002 | AE282: 89.59 | AF282: 91.17 | AG282: 1 | AH282: AA+ | AI282: 3.95e-002 | AJ282: =H282+100*O282 -> 137.05000000000001 | AK282: 137 | AL282: 166 | AM282: 45.8 | AN282: 181 | AO282: -2.9999999999999999e-002 | AP282: 5 | AQ282: 星宇转债!*
A283: 118 | B283: 123066 | C283: 赛意转债! | D283: 300687 | E283: 赛意信息 | F283: 计算机及 | G283: 软件开发 | H283: 148.68 | I283: -1.5300000000000001e-002 | J283: 9.8999999999999991e-003 | K283: 19.89 | L283: -6.5000000000000006e-003 | M283: 121.4 | N283: 14.01 | O283: 4.7e-002 | P283: 141.97 | Q283: 转股中 | R283: 5.17年 | S283: 3.17年 | T283: 2.43 | U283: 71 | V283: 0.19399999999999998 | W283: 3.5000000000000003e-002 | X283: 4.9000000000000002e-002 | Y283: 70 | Z283: 4.4 | AA283: -3.9300000000000002e-002 | AB283: -4.5899999999999996e-002 | AC283: -0.10199999999999999 | AD283: -0.10199999999999999 | AE283: 82.33 | AF283: 84.5 | AG283: 0.83 | AH283: A+ | AI283: 7.4499999999999997e-002 | AJ283: =H283+100*O283 -> 153.38 | AK283: 155.4 | AL283: 284 | AM283: 70.9 | AN283: 300 | AO283: -6.8000000000000005e-002 | AP283: 9 | AQ283: 赛意转债!
A284: 22 | B284: 113623 | C284: 凤21转债 | D284: 603225 | E284: 新凤鸣 | F284: 化工 | G284: 化纤 | H284: 148.23 | I284: -5.0000000000000001e-004 | J284: -1.84e-002 | K284: 23.36 | L284: -2.2599999999999999e-002 | M284: 117.1 | N284: 16.47 | O284: 4.4999999999999998e-002 | P284: 141.83 | Q284: 3月0天 | R284: 5.73年 | S284: 3.73年 | T284: 25 | U284: 50 | V284: 1.3000000000000001e-002 | W284: 7.5999999999999998e-002 | X284: 0.10800000000000001 | Y284: 327 | Z284: 2.68 | AA284: -4.0999999999999995e-002 | AB284: -4.5899999999999996e-002 | AC284: -8.8499999999999995e-002 | AD284: -8.9999999999999997e-002 | AE284: 88.22 | AF284: 92.65 | AG284: 0.84 | AH284: AA | AI284: 4.2500000000000003e-002 | AJ284: =H284+100*O284 -> 152.72999999999999 | AK284: 154.6 | AL284: 280 | AM284: 62 | AN284: 280 | AO284: 0.153 | AP284: 3 | AQ284: 凤21转债
A285: 172 | B285: 113585 | C285: 寿仙转债! | D285: 603896 | E285: 寿仙谷 | F285: 医药 | G285: 中药 | H285: 144.3 | I285: 3.3099999999999997e-002 | J285: -5.1999999999999998e-003 | K285: 40.19 | L285: 3.2400000000000005e-002 | M285: 117.3 | N285: 28.38 | O285: 1.9e-002 | P285: 141.61 | Q285: 转股中 | R285: 4.90年 | S285: 2.90年 | T285: 1.26 | U285: 86 | V285: 0.47999999999999998 | W285: 2.1000000000000001e-002 | X285: 2.8999999999999998e-002 | Y285: 61 | Z285: 4.35 | AA285: -4.2199999999999994e-002 | AB285: -4.8000000000000001e-002 | AC285: -0.10199999999999999 | AD285: -0.10400000000000001 | AE285: 86.29 | AF285: 87.83 | AG285: 0.86 | AH285: AA- | AI285: 6.2199999999999998e-002 | AJ285: =H285+100*O285 -> 146.20000000000002 | AK285: 147 | AL285: 249 | AM285: 59.2 | AN285: 266 | AO285: 4.4000000000000004e-002 | AP285: 11 | AQ285: 寿仙转债!
A286: 4 | B286: 127038 | C286: 国微转债 | D286: 2049 | E286: 紫光国微 | F286: 电子 | G286: 芯片制造 | H286: 147.95 | I286: 2.0299999999999999e-002 | J286: 3.5999999999999999e-003 | K286: 165.27 | L286: 3.2400000000000005e-002 | M286: 114.5 | N286: 137.78 | O286: 0.23300000000000001 | P286: 119.95 | Q286: 5月4天 | R286: 5.90年 | S286: 3.90年 | T286: 15 | U286: 889 | V286: 0.39299999999999996 | W286: 1.4999999999999999e-002 | X286: 1.8000000000000002e-002 | Y286: 1003. | Z286: 18.97 | AA286: -4.2999999999999997e-002 | AB286: -4.7100000000000003e-002 | AC286: -8.5600000000000009e-002 | AD286: -8.6800000000000002e-002 | AE286: 88.06 | AF286: 91.4 | AG286: 0.74 | AH286: AA+ | AI286: 3.95e-002 | AJ286: =H286+100*O286 -> 171.25 | AK286: 175.9 | AL286: 314 | AM286: 84.5 | AN286: 317 | AO286: 6.6000000000000003e-002 | AP286: 3 | AQ286: 国微转债
A287: 364 | B287: 113011 | C287: 光大转债 | D287: 601818 | E287: 光大银行 | F287: 金融 | G287: 银行行业 | H287: 115.09 | I287: -2.8999999999999998e-003 | J287: 2.8999999999999998e-003 | K287: 3.65 | L287: 0. | M287: 106.8 | N287: 3.76 | O287: 0.18600000000000003 | P287: 97.07 | Q287: 转股中 | R287: 1.67年 | S287: 无权 | T287: 242 | U287: 78 | V287: 3.0000000000000001e-003 | W287: 0.12300000000000001 | X287: 0.11900000000000001 | Y287: 1972. | Z287: 0.56 | AA287: -4.4199999999999996e-002 | AB287: -5.1500000000000004e-002 | AC287: 无权 | AD287: 无权 | AE287: 无权 | AF287: 101 | AG287: 0.43 | AH287: AAA | AI287: 3.44e-002 | AJ287: =H287+100*O287 -> 133.69 | AK287: 133.1 | AL287: 124 | AM287: 32.1 | AN287: 53 | AO287: -2.1000000000000001e-002 | AP287: 13 | AQ287: 光大转债
A288: 358 | B288: 113014 | C288: 林洋转债! | D288: 601222 | E288: 林洋能源 | F288: 能源电力 | G288: 电力设备 | H288: 121.4 | I288: 1.21e-002 | J288: -1.2800000000000001e-002 | K288: 8.99 | L288: -1.1000000000000001e-003 | M288: 109.3 | N288: 8.44 | O288: 0.14000000000000001 | P288: 106.52 | Q288: 转股中 | R288: 2.28年 | S288: 0.28年 | T288: 30 | U288: 151 | V288: 4.0999999999999995e-002 | W288: 0.191 | X288: 0.20300000000000001 | Y288: 157 | Z288: 1.51 | AA288: -4.58e-002 | AB288: -5.2900000000000003e-002 | AC288: -0.38299999999999995 | AD288: -0.39000000000000001 | AE288: 100.06 | AF288: 100.25 | AG288: 0.61 | AH288: AA | AI288: 3.9399999999999998e-002 | AJ288: =H288+100*O288 -> 135.40000000000001 | AK288: 136.3 | AL288: 155 | AM288: 36 | AN288: 83 | AO288: 0.10800000000000001 | AP288: 30 | AQ288: 林洋转债!
A289: 242 | B289: 110061 | C289: 川投转债 | D289: 600674 | E289: 川投能源 | F289: 能源电力 | G289: 水电 | H289: 135.26 | I289: -3.2000000000000002e-003 | J289: 2.5999999999999999e-003 | K289: 12.23 | L289: -8.0000000000000004e-004 | M289: 110.8 | N289: 9.2 | O289: 1.7000000000000001e-002 | P289: 132.93 | Q289: 转股中 | R289: 4.32年 | S289: 2.32年 | T289: 39.6 | U289: 69 | V289: 1.3000000000000001e-002 | W289: 7.400000000000001e-002 | X289: 9.8000000000000004e-002 | Y289: 539 | Z289: 1.87 | AA289: -4.5999999999999999e-002 | AB289: -5.0199999999999995e-002 | AC289: -0.10300000000000001 | AD289: -0.105 | AE289: 94.63 | AF289: 95.32 | AG289: 0.84 | AH289: AAA | AI289: 3.6200000000000003e-002 | AJ289: =H289+100*O289 -> 136.95999999999998 | AK289: 137.6 | AL289: 169 | AM289: 42.3 | AN289: 154 | AO289: 3.0000000000000001e-003 | AP289: 14 | AQ289: 川投转债
A290: 283 | B290: 123025 | C290: 精测转债!! | D290: 300567 | E290: 精测电子 | F290: 电子 | G290: 液晶显示 | H290: 138.5 | I290: -1.4800000000000001e-002 | J290: -1.61e-002 | K290: 63.38 | L290: -3.9100000000000003e-002 | M290: 116.5 | N290: 49.37 | O290: 7.9000000000000001e-002 | P290: 128.38 | Q290: 转股中 | R290: 3.70年 | S290: 1.70年 | T290: 3.09 | U290: 194 | V290: 0.44700000000000001 | W290: 1.8000000000000002e-002 | X290: 2.2000000000000002e-002 | Y290: 176 | Z290: 8.88 | AA290: -4.6500000000000007e-002 | AB290: -5.3800000000000001e-002 | AC290: -0.124 | AD290: -0.125 | AE290: 91.95 | AF290: 93.59 | AG290: 0.79 | AH290: AA- | AI290: 6.2199999999999998e-002 | AJ290: =H290+100*O290 -> 146.40000000000001 | AK290: 148.6 | AL290: 254 | AM290: 55 | AN290: 240 | AO290: 5.2999999999999999e-002 | AP290: 16 | AQ290: 精测转债!!
A291: 292 | B291: 127011 | C291: 中鼎转2! | D291: 887 | E291: 中鼎股份 | F291: 汽车 | G291: 零部件制 | H291: 137 | I291: -2.8300000000000002e-002 | J291: -5.7999999999999996e-003 | K291: 14.61 | L291: -4.3799999999999999e-002 | M291: 114.5 | N291: 11.39 | O291: 6.8000000000000005e-002 | P291: 128.27 | Q291: 转股中 | R291: 3.64年 | S291: 1.64年 | T291: 12 | U291: 215 | V291: 0.13 | W291: 6.7000000000000004e-002 | X291: 8.5999999999999993e-002 | Y291: 178 | Z291: 2 | AA291: -4.8899999999999999e-002 | AB291: -5.5500000000000001e-002 | AC291: -0.124 | AD291: -0.126 | AE291: 96.14 | AF291: 100.15 | AG291: 0.78 | AH291: AA+ | AI291: 3.8199999999999998e-002 | AJ291: =H291+100*O291 -> 143.80000000000001 | AK291: 145.7 | AL291: 237 | AM291: 45.6 | AN291: 180 | AO291: 0.18899999999999997 | AP291: 21 | AQ291: 中鼎转2!
A292: 101 | B292: 123074 | C292: 隆利转债! | D292: 300752 | E292: 隆利科技 | F292: 电子 | G292: 液晶显示 | H292: 161.5 | I292: 1.7600000000000001e-002 | J292: -1.6500000000000001e-002 | K292: 30.28 | L292: 1.2999999999999999e-003 | M292: 124 | N292: 18.33 | O292: -2.2000000000000002e-002 | P292: 165.19 | Q292: 转股中 | R292: 5.29年 | S292: 3.29年 | T292: 2.72 | U292: 3383. | V292: 7.6399999999999997 | W292: 4.7e-002 | X292: 7.6999999999999999e-002 | Y292: 58 | Z292: 4.21 | AA292: -4.9599999999999998e-002 | AB292: -5.67e-002 | AC292: -0.11800000000000001 | AD292: -0.11900000000000001 | AE292: 84.21 | AF292: 90.17 | AG292: 0.88 | AH292: AA- | AI292: 6.3500000000000001e-002 | AJ292: =H292+100*O292 -> 159.30000000000001 | AK292: 157.8 | AL292: 291 | AM292: 67.6 | AN292: 295 | AO292: 0.55200000000000005 | AP292: 15 | AQ292: 隆利转债!
A293: 58 | B293: 113616 | C293: 韦尔转债 | D293: 603501 | E293: 韦尔股份 | F293: 电子 | G293: 元器件制 | H293: 150.93 | I293: -2.58e-002 | J293: 2.5000000000000001e-003 | K293: 311.5 | L293: -2.7699999999999999e-002 | M293: 114.5 | N293: 222.52 | O293: 7.8e-002 | P293: 139.99 | Q293: 转股中 | R293: 5.45年 | S293: 3.45年 | T293: 24.4 | U293: 396 | V293: 0.106 | W293: 9.0000000000000011e-003 | X293: 1.3000000000000001e-002 | Y293: 2706. | Z293: 21.74 | AA293: -5.0099999999999999e-002 | AB293: -5.45e-002 | AC293: -0.10099999999999999 | AD293: -0.10199999999999999 | AE293: 89.61 | AF293: 93 | AG293: 0.84 | AH293: AA+ | AI293: 3.95e-002 | AJ293: =H293+100*O293 -> 158.73000000000002 | AK293: 161.9 | AL293: 298 | AM293: 68.9 | AN293: 297 | AO293: 4.0000000000000001e-003 | AP293: 9 | AQ293: 韦尔转债
A294: 84 | B294: 123079 | C294: 运达转债 | D294: 300772 | E294: 运达股份 | F294: 能源电力 | G294: 风能 | H294: 151.113 | I294: 4.6999999999999993e-003 | J294: -4.0000000000000001e-003 | K294: 23.02 | L294: 8.9999999999999998e-004 | M294: 115.1 | N294: 15.12 | O294: -6.9999999999999993e-003 | P294: 152.25 | Q294: 转股中 | R294: 5.38年 | S294: 3.38年 | T294: 5.67 | U294: 182 | V294: 0.214 | W294: 8.199999999999999e-002 | X294: 0.124 | Y294: 69 | Z294: 4.01 | AA294: -5.0199999999999995e-002 | AB294: -5.4800000000000001e-002 | AC294: -0.10199999999999999 | AD294: -0.10099999999999999 | AE294: 89.51 | AF294: 92.41 | AG294: 0.88 | AH294: AA | AI294: 4.2500000000000003e-002 | AJ294: =H294+100*O294 -> 150.41300000000001 | AK294: 150 | AL294: 264 | AM294: 57.6 | AN294: 254 | AO294: 0.20999999999999999 | AP294: 4 | AQ294: 运达转债
A295: 244 | B295: 123033 | C295: 金力转债! | D295: 300748 | E295: 金力永磁 | F295: 电子 | G295: 元器件制 | H295: 152 | I295: -5.1999999999999998e-003 | J295: 8.199999999999999e-003 | K295: 37.15 | L295: 3.4999999999999996e-003 | M295: 121.5 | N295: 25.3 | O295: 3.5000000000000003e-002 | P295: 146.84 | Q295: 转股中 | R295: 4.29年 | S295: 2.30年 | T295: 4.07 | U295: 1967. | V295: 3.1000000000000001 | W295: 1.6e-002 | X295: 2.3e-002 | Y295: 257 | Z295: 7.64 | AA295: -5.2199999999999996e-002 | AB295: -6.0100000000000001e-002 | AC295: -0.10400000000000001 | AD295: -0.106 | AE295: 90.73 | AF295: 94.54 | AG295: 0.86 | AH295: AA- | AI295: 6.2199999999999998e-002 | AJ295: =H295+100*O295 -> 155.5 | AK295: 157.2 | AL295: 287 | AM295: 62.6 | AN295: 281 | AO295: 0.159 | AP295: 27 | AQ295: 金力转债!
A296: 60 | B296: 113615 | C296: 金诚转债 | D296: 603979 | E296: 金诚信 | F296: 有色金属 | G296: 有色行业 | H296: 156.72 | I296: -1.1899999999999999e-002 | J296: 1.4999999999999999e-002 | K296: 19.73 | L296: 3.5999999999999999e-003 | M296: 117.3 | N296: 12.65 | O296: 5.0000000000000001e-003 | P296: 155.97 | Q296: 转股中 | R296: 5.44年 | S296: 3.44年 | T296: 9.99 | U296: 142 | V296: 9.0999999999999998e-002 | W296: 8.6999999999999994e-002 | X296: 0.13500000000000001 | Y296: 115 | Z296: 2.48 | AA296: -5.28e-002 | AB296: -5.79e-002 | AC296: -0.106 | AD296: -0.107 | AE296: 89.48 | AF296: 93.97 | AG296: 0.89 | AH296: AA | AI296: 4.2500000000000003e-002 | AJ296: =H296+100*O296 -> 157.22 | AK296: 157.5 | AL296: 288 | AM296: 63.5 | AN296: 282 | AO296: 8.0000000000000002e-002 | AP296: 3 | AQ296: 金诚转债
A297: 222 | B297: 123042 | C297: 银河转债! | D297: 300619 | E297: 金银河 | F297: 机械装备 | G297: 专用设备 | H297: 146.7 | I297: -9.0000000000000011e-003 | J297: -8.8000000000000005e-003 | K297: 25.35 | L297: -2.5699999999999997e-002 | M297: 115.4 | N297: 24.38 | O297: 0.41100000000000003 | P297: 103.98 | Q297: 转股中 | R297: 4.50年 | S297: 2.50年 | T297: 1.67 | U297: 312 | V297: 1.27 | W297: 8.8000000000000009e-002 | X297: 9.1999999999999998e-002 | Y297: 19 | Z297: 3.88 | AA297: -5.2999999999999999e-002 | AB297: -5.8600000000000006e-002 | AC297: -0.122 | AD297: -0.124 | AE297: 86.13 | AF297: 84.63 | AG297: 0.69 | AH297: A+ | AI297: 7.3200000000000001e-002 | AJ297: =H297+100*O297 -> 187.79999999999998 | AK297: 189.4 | AL297: 332 | AM297: 103.3 | AN297: 340 | AO297: 1.8000000000000002e-002 | AP297: 22 | AQ297: 银河转债!
A298: 50 | B298: 113621 | C298: 彤程转债 | D298: 603650 | E298: 彤程新材 | F298: 化工 | G298: 橡胶塑料 | H298: 155.54 | I298: -1.e-003 | J298: -1.95e-002 | K298: 49.76 | L298: -2.3e-002 | M298: 115.1 | N298: 32.62 | O298: 2.e-002 | P298: 152.54 | Q298: 17天 | R298: 5.53年 | S298: 3.53年 | T298: 8 | U298: 325 | V298: 0.255 | W298: 2.7000000000000003e-002 | X298: 4.2000000000000003e-002 | Y298: 292 | Z298: 11.31 | AA298: -5.3800000000000001e-002 | AB298: -5.8299999999999998e-002 | AC298: -0.10199999999999999 | AD298: -0.10300000000000001 | AE298: 88.94 | AF298: 91.83 | AG298: 0.89 | AH298: AA | AI298: 4.2500000000000003e-002 | AJ298: =H298+100*O298 -> 157.53999999999999 | AK298: 158.5 | AL298: 294 | AM298: 66.7 | AN298: 292 | AO298: 2.1000000000000001e-002 | AP298: 6 | AQ298: 彤程转债
A299: 5 | B299: 113049 | C299: 长汽转债 | D299: 601633 | E299: 长城汽车 | F299: 汽车 | G299: 乘用车 | H299: 152.98 | I299: 1.8600000000000002e-002 | J299: -3.3e-003 | K299: 44.68 | L299: 2.1000000000000001e-002 | M299: 110.5 | N299: 38.39 | O299: 0.314 | P299: 116.38 | Q299: 5月4天 | R299: 5.90年 | S299: 3.90年 | T299: 35 | U299: 176 | V299: 3.3000000000000002e-002 | W299: 9.0000000000000011e-003 | X299: 1.e-002 | Y299: 4116. | Z299: 7.25 | AA299: -5.4199999999999998e-002 | AB299: -5.7200000000000001e-002 | AC299: -9.4700000000000006e-002 | AD299: -9.5600000000000004e-002 | AE299: 88.1 | AF299: 89.16 | AG299: 0.73 | AH299: AAA | AI299: 3.7499999999999999e-002 | AJ299: =H299+100*O299 -> 184.38 | AK299: 189.6 | AL299: 333 | AM299: 100.4 | AN299: 336 | AO299: -6.0000000000000001e-003 | AP299: 3 | AQ299: 长汽转债
A300: 23 | B300: 123111 | C300: 东财转3 | D300: 300059 | E300: 东方财富 | F300: 金融 | G300: 证券行业 | H300: 151.85 | I300: -1.34e-002 | J300: -1.7000000000000001e-003 | K300: 32.5 | L300: -1.78e-002 | M300: 110.5 | N300: 23.35 | O300: 9.0999999999999998e-002 | P300: 139.19 | Q300: 2月29天 | R300: 5.72年 | S300: 3.73年 | T300: 158 | U300: 595 | V300: 2.5000000000000001e-002 | W300: 4.7e-002 | X300: 6.5000000000000002e-002 | Y300: 3359. | Z300: 7.98 | AA300: -5.45e-002 | AB300: -5.7599999999999998e-002 | AC300: -9.7500000000000003e-002 | AD300: -9.8299999999999998e-002 | AE300: 87.78 | AF300: 88.74 | AG300: 0.85 | AH300: AA+ | AI300: 3.95e-002 | AJ300: =H300+100*O300 -> 160.94999999999999 | AK300: 164.5 | AL300: 301 | AM300: 75.8 | AN300: 304 | AO300: 3.6000000000000004e-002 | AP300: 19 | AQ300: 东财转3
A301: 39 | B301: 123103 | C301: 震安转债 | D301: 300767 | E301: 震安科技 | F301: 化工 | G301: 橡胶塑料 | H301: 166.535 | I301: 1.9799999999999998e-002 | J301: -7.4000000000000003e-003 | K301: 87 | L301: 1.4199999999999999e-002 | M301: 121.4 | N301: 56.89 | O301: 8.900000000000001e-002 | P301: 152.93 | Q301: 2月6天 | R301: 5.65年 | S301: 3.66年 | T301: 2.85 | U301: 628 | V301: 1.3100000000000001 | W301: 1.6e-002 | X301: 2.5000000000000001e-002 | Y301: 175 | Z301: 11 | AA301: -5.5399999999999998e-002 | AB301: -6.13e-002 | AC301: -0.11199999999999999 | AD301: -0.113 | AE301: 79.73 | AF301: 81.65 | AG301: 0.88 | AH301: A+ | AI301: 7.4499999999999997e-002 | AJ301: =H301+100*O301 -> 175.435 | AK301: 180.1 | AL301: 323 | AM301: 98.5 | AN301: 335 | AO301: 9.6999999999999989e-002 | AP301: 4 | AQ301: 震安转债
A302: 25 | B302: 123110 | C302: 九典转债 | D302: 300705 | E302: 九典制药 | F302: 医药 | G302: 化学制药 | H302: 168 | I302: 2.5600000000000001e-002 | J302: -8.3000000000000001e-003 | K302: 43.86 | L302: 1.9299999999999998e-002 | M302: 121.4 | N302: 26.44 | O302: 1.3000000000000001e-002 | P302: 165.89 | Q302: 2月24天 | R302: 5.71年 | S302: 3.71年 | T302: 2.7 | U302: 89 | V302: 0.19699999999999998 | W302: 2.6000000000000002e-002 | X302: 4.4000000000000004e-002 | Y302: 103 | Z302: 11.67 | AA302: -5.6299999999999996e-002 | AB302: -6.2199999999999998e-002 | AC302: -0.11199999999999999 | AD302: -0.114 | AE302: 79.26 | AF302: 81.29 | AG302: 0.9 | AH302: A+ | AI302: 7.4499999999999997e-002 | AJ302: =H302+100*O302 -> 169.30000000000001 | AK302: 170.1 | AL302: 308 | AM302: 88.8 | AN302: 327 | AO302: 0.128 | AP302: 6 | AQ302: 九典转债
A303: 110 | B303: 123069 | C303: 金诺转债! | D303: 300505 | E303: 川金诺 | F303: 化工 | G303: 农化 | H303: 171.009 | I303: 1.9599999999999999e-002 | J303: -1.52e-002 | K303: 32.4 | L303: 5.0000000000000001e-003 | M303: 126 | N303: 19.09 | O303: 8.0000000000000002e-003 | P303: 169.72 | Q303: 转股中 | R303: 5.25年 | S303: 3.25年 | T303: 2.64 | U303: 3893. | V303: 8.1899999999999995 | W303: 6.2e-002 | X303: 0.106 | Y303: 42 | Z303: 4.47 | AA303: -5.7500000000000002e-002 | AB303: -6.5000000000000002e-002 | AC303: -0.13300000000000001 | AD303: -0.13400000000000001 | AE303: 84.4 | AF303: 91.82 | AG303: 0.89 | AH303: AA- | AI303: 6.3500000000000001e-002 | AJ303: =H303+100*O303 -> 171.809 | AK303: 172.3 | AL303: 311 | AM303: 80.5 | AN303: 313 | AO303: 0.38799999999999996 | AP303: 19 | AQ303: 金诺转债!
A304: 203 | B304: 128101 | C304: 联创转债! | D304: 2036 | E304: 联创电子 | F304: 电子 | G304: 液晶显示 | H304: 151.75 | I304: 5.5999999999999994e-002 | J304: -3.3099999999999997e-002 | K304: 17.42 | L304: 2.9600000000000001e-002 | M304: 114.8 | N304: 13.72 | O304: 0.19500000000000001 | P304: 126.97 | Q304: 转股中 | R304: 4.66年 | S304: 2.67年 | T304: 3 | U304: 707 | V304: 1.5600000000000001 | W304: 1.6e-002 | X304: 2.1000000000000001e-002 | Y304: 185 | Z304: 5.02 | AA304: -5.9000000000000004e-002 | AB304: -6.4199999999999993e-002 | AC304: -0.126 | AD304: -0.128 | AE304: 92.22 | AF304: 95.43 | AG304: 0.77 | AH304: AA | AI304: 4.1200000000000001e-002 | AJ304: =H304+100*O304 -> 171.25 | AK304: 176.5 | AL304: 316 | AM304: 81.1 | AN304: 315 | AO304: 0.247 | AP304: 15 | AQ304: 联创转债!
A305: 212 | B305: 123043 | C305: 正元转债 | D305: 300645 | E305: 正元智慧 | F305: 计算机及 | G305: 软件开发 | H305: 161.001 | I305: -1.0500000000000001e-002 | J305: 3.2000000000000002e-003 | K305: 17 | L305: -1.0500000000000001e-002 | M305: 120.9 | N305: 15.38 | O305: 0.45700000000000002 | P305: 110.53 | Q305: 转股中 | R305: 4.63年 | S305: 2.64年 | T305: 1.66 | U305: 749 | V305: 2.7799999999999998 | W305: 7.6999999999999999e-002 | X305: 8.5000000000000006e-002 | Y305: 22 | Z305: 3.37 | AA305: -6.1100000000000002e-002 | AB305: -6.8099999999999994e-002 | AC305: -0.14300000000000002 | AD305: -0.10000000000000001 | AE305: 85.56 | AF305: 87.82 | AG305: 0.7 | AH305: A+ | AI305: 7.3200000000000001e-002 | AJ305: =H305+100*O305 -> 206.70100000000002 | AK305: 211.5 | AL305: 344 | AM305: 123.7 | AN305: 345 | AO305: -2.5000000000000001e-002 | AP305: 18 | AQ305: 正元转债
A306: 35 | B306: 127029 | C306: 中钢转债 | D306: 928 | E306: 中钢国际 | F306: 建筑 | G306: 建筑工程 | H306: 168.5 | I306: -1.23e-002 | J306: -2.3e-002 | K306: 10.88 | L306: -3.7999999999999999e-002 | M306: 117.5 | N306: 5.89 | O306: -8.8000000000000009e-002 | P306: 184.72 | Q306: 2月13天 | R306: 5.67年 | S306: 3.67年 | T306: 9.6 | U306: 465 | V306: 0.28499999999999998 | W306: 7.0000000000000007e-002 | X306: 0.13 | Y306: 137 | Z306: 2.37 | AA306: -6.2300000000000001e-002 | AB306: -6.7199999999999996e-002 | AC306: -0.11599999999999999 | AD306: -0.11699999999999999 | AE306: 88.84 | AF306: 94.62 | AG306: 0.93 | AH306: AA+ | AI306: 3.95e-002 | AJ306: =H306+100*O306 -> 159.69999999999999 | AK306: 152.3 | AL306: 272 | AM306: 57.7 | AN306: 256 | AO306: 0.115 | AP306: 10 | AQ306: 中钢转债
A307: 347 | B307: 128026 | C307: 众兴转债! | D307: 2772 | E307: 众兴菌业 | F307: 农业 | G307: 种植业 | H307: 127.5 | I307: 6.6e-003 | J307: 1.6000000000000001e-003 | K307: 14.04 | L307: 1.01e-002 | M307: 109.3 | N307: 11.36 | O307: 3.2000000000000001e-002 | P307: 123.59 | Q307: 转股中 | R307: 2.41年 | S307: 0.41年 | T307: 4.54 | U307: 751 | V307: 1.29 | W307: 8.0000000000000002e-002 | X307: 9.9000000000000005e-002 | Y307: 57 | Z307: 2 | AA307: -6.2899999999999998e-002 | AB307: -6.9500000000000006e-002 | AC307: -0.36599999999999999 | AD307: -0.371 | AE307: 98.42 | AF307: 95.14 | AG307: 0.82 | AH307: AA- | AI307: 6.0400000000000002e-002 | AJ307: =H307+100*O307 -> 130.69999999999999 | AK307: 131.4 | AL307: 108 | AM307: 33 | AN307: 58 | AO307: 1.6e-002 | AP307: 57 | AQ307: 众兴转债!
A308: 171 | B308: 123054 | C308: 思特转债!! | D308: 300608 | E308: 思特奇 | F308: 通信互联 | G308: 通信设备 | H308: 167.407 | I308: -2.23e-002 | J308: -1.1000000000000001e-002 | K308: 17.15 | L308: -4.1399999999999999e-002 | M308: 121.2 | N308: 12.63 | O308: 0.23300000000000001 | P308: 135.79 | Q308: 转股中 | R308: 4.90年 | S308: 2.90年 | T308: 2.08 | U308: 1581. | V308: 4.3899999999999997 | W308: 5.7999999999999996e-002 | X308: 7.8e-002 | Y308: 36 | Z308: 3.53 | AA308: -6.5000000000000002e-002 | AB308: -7.17e-002 | AC308: -0.14099999999999999 | AD308: -0.14300000000000002 | AE308: 86.68 | AF308: 90.78 | AG308: 0.81 | AH308: AA- | AI308: 6.2199999999999998e-002 | AJ308: =H308+100*O308 -> 190.70700000000002 | AK308: 199 | AL308: 340 | AM308: 108.3 | AN308: 341 | AO308: -0.111 | AP308: 20 | AQ308: 思特转债!!
A309: 239 | B309: 113550 | C309: 常汽转债! | D309: 603035 | E309: 常熟汽饰 | F309: 汽车 | G309: 零部件制 | H309: 162.24 | I309: -1.15e-002 | J309: 5.4000000000000003e-003 | K309: 13.99 | L309: -7.0999999999999995e-003 | M309: 121.3 | N309: 9.33 | O309: 8.199999999999999e-002 | P309: 149.95 | Q309: 转股中 | R309: 4.34年 | S309: 2.34年 | T309: 2.15 | U309: 65 | V309: 0.185 | W309: 4.2999999999999997e-002 | X309: 6.4000000000000001e-002 | Y309: 50 | Z309: 1.31 | AA309: -6.6199999999999995e-002 | AB309: -7.3800000000000004e-002 | AC309: -0.11800000000000001 | AD309: -0.11900000000000001 | AE309: 89.76 | AF309: 93.99 | AG309: 0.86 | AH309: AA- | AI309: 6.2199999999999998e-002 | AJ309: =H309+100*O309 -> 170.44 | AK309: 174.5 | AL309: 313 | AM309: 80.5 | AN309: 314 | AO309: -8.0000000000000002e-002 | AP309: 16 | AQ309: 常汽转债!
A310: 319 | B310: 123012 | C310: 万顺转债! | D310: 300057 | E310: 万顺新材 | F310: 有色金属 | G310: 铝金属 | H310: 135.1 | I310: 6.0999999999999995e-003 | J310: 0. | K310: 6.23 | L310: 8.1000000000000013e-003 | M310: 110.3 | N310: 5.27 | O310: 0.14300000000000002 | P310: 118.22 | Q310: 转股中 | R310: 3年3.1天 | S310: 1年4.1天 | T310: 1.29 | U310: 168 | V310: 0.96599999999999997 | W310: 3.1e-002 | X310: 3.6000000000000004e-002 | Y310: 42 | Z310: 1.18 | AA310: -6.6500000000000004e-002 | AB310: -7.22e-002 | AC310: -0.20100000000000001 | AD310: -0.20399999999999999 | AE310: 95.83 | AF310: 92.39 | AG310: 0.76 | AH310: AA- | AI310: 6.2199999999999998e-002 | AJ310: =H310+100*O310 -> 149.40000000000001 | AK310: 152 | AL310: 271 | AM310: 56.2 | AN310: 247 | AO310: -2.6000000000000002e-002 | AP310: 21 | AQ310: 万顺转债!
A311: 355 | B311: 128018 | C311: 时达转债! | D311: 2527 | E311: 新时达 | F311: 机械装备 | G311: 机器人及 | H311: 127.993 | I311: -3.4000000000000002e-003 | J311: -2.5000000000000001e-003 | K311: 8.7 | L311: -8.0000000000000002e-003 | M311: 109.3 | N311: 7.4 | O311: 8.900000000000001e-002 | P311: 117.57 | Q311: 转股中 | R311: 2.31年 | S311: 0.31年 | T311: 4.04 | U311: 6.7 | V311: 1.3000000000000001e-002 | W311: 7.4999999999999997e-002 | X311: 8.8000000000000009e-002 | Y311: 54 | Z311: 2.05 | AA311: -6.7199999999999996e-002 | AB311: -7.400000000000001e-002 | AC311: -0.45600000000000002 | AD311: -0.46200000000000002 | AE311: 99.95 | AF311: 100.14 | AG311: 0.74 | AH311: AA | AI311: 3.9399999999999998e-002 | AJ311: =H311+100*O311 -> 136.893 | AK311: 138.4 | AL311: 183 | AM311: 38.3 | AN311: 117 | AO311: 0.113 | AP311: 35 | AQ311: 时达转债!
A312: 38 | B312: 123102 | C312: 华自转债 | D312: 300490 | E312: 华自科技 | F312: 机械装备 | G312: 机器人及 | H312: 188 | I312: 5.1000000000000004e-003 | J312: -3.3700000000000001e-002 | K312: 20.5 | L312: -3.0299999999999997e-002 | M312: 126.9 | N312: 9.26 | O312: -0.151 | P312: 221.38 | Q312: 2月4天 | R312: 5.65年 | S312: 3.66年 | T312: 6.7 | U312: 3166. | V312: 2.4199999999999999 | W312: 0.128 | X312: 0.28199999999999997 | Y312: 53 | Z312: 3 | AA312: -6.8499999999999991e-002 | AB312: -7.5499999999999998e-002 | AC312: -0.13600000000000001 | AD312: -0.13800000000000001 | AE312: 83.19 | AF312: 90.34 | AG312: 0.94 | AH312: AA- | AI312: 6.3500000000000001e-002 | AJ312: =H312+100*O312 -> 172.90000000000001 | AK312: 154.6 | AL312: 279 | AM312: 64.3 | AN312: 287 | AO312: 0.185 | AP312: 20 | AQ312: 华自转债
A313: 278 | B313: 128064 | C313: 司尔转债! | D313: 2538 | E313: 司尔特 | F313: 化工 | G313: 农化 | H313: 148.573 | I313: 1.7600000000000001e-002 | J313: -4.0000000000000001e-003 | K313: 8.64 | L313: 1.5300000000000001e-002 | M313: 114.3 | N313: 5.82 | O313: 1.e-003 | P313: 148.45 | Q313: 转股中 | R313: 3.73年 | S313: 1.73年 | T313: 6.94 | U313: 346 | V313: 0.33299999999999996 | W313: 0.11199999999999999 | X313: 0.16600000000000001 | Y313: 62 | Z313: 1.55 | AA313: -6.9000000000000006e-002 | AB313: -7.5199999999999989e-002 | AC313: -0.14599999999999999 | AD313: -0.14800000000000002 | AE313: 95.28 | AF313: 98.61 | AG313: 0.89 | AH313: AA | AI313: 4.1200000000000001e-002 | AJ313: =H313+100*O313 -> 148.673 | AK313: 148.7 | AL313: 256 | AM313: 50.1 | AN313: 215 | AO313: 0.191 | AP313: 44 | AQ313: 司尔转债!
A314: 199 | B314: 128103 | C314: 同德转债! | D314: 2360 | E314: 同德化工 | F314: 化工 | G314: 化工 | H314: 169.2 | I314: 4.6999999999999993e-003 | J314: 3.8e-003 | K314: 8.23 | L314: 8.6e-003 | M314: 121.3 | N314: 5.08 | O314: 4.4000000000000004e-002 | P314: 162.01 | Q314: 转股中 | R314: 4.69年 | S314: 2.69年 | T314: 1.09 | U314: 165 | V314: 0.89400000000000002 | W314: 3.3000000000000002e-002 | X314: 5.4000000000000006e-002 | Y314: 33 | Z314: 2.56 | AA314: -6.9800000000000001e-002 | AB314: -7.6799999999999993e-002 | AC314: -0.105 | AD314: -0.106 | AE314: 85.33 | AF314: 87.76 | AG314: 1 | AH314: A+ | AI314: 7.3200000000000001e-002 | AJ314: =H314+100*O314 -> 173.59999999999999 | AK314: 176.4 | AL314: 315 | AM314: 88.6 | AN314: 325 | AO314: 5.0999999999999997e-002 | AP314: 13 | AQ314: 同德转债!
A315: 224 | B315: 128093 | C315: 百川转债! | D315: 2455 | E315: 百川股份 | F315: 化工 | G315: 化工 | H315: 178.999 | I315: 1.9400000000000001e-002 | J315: 3.0099999999999998e-002 | K315: 10.28 | L315: 5.5399999999999998e-002 | M315: 129.8 | N315: 5.77 | O315: 5.0000000000000001e-003 | P315: 178.16 | Q315: 转股中 | R315: 4.47年 | S315: 2.47年 | T315: 2.49 | U315: 3677. | V315: 7.9900000000000002 | W315: 4.4000000000000004e-002 | X315: 7.9000000000000001e-002 | Y315: 56 | Z315: 3.91 | AA315: -7.1599999999999997e-002 | AB315: -8.1199999999999994e-002 | AC315: -0.125 | AD315: -0.127 | AE315: 91.45 | AF315: 100.13 | AG315: 0.89 | AH315: AA- | AI315: 6.2199999999999998e-002 | AJ315: =H315+100*O315 -> 179.499 | AK315: 179.8 | AL315: 322 | AM315: 79.7 | AN315: 311 | AO315: 0.26800000000000002 | AP315: 47 | AQ315: 百川转债!
A316: 128 | B316: 128128 | C316: 齐翔转2! | D316: 2408 | E316: 齐翔腾达 | F316: 化工 | G316: 化工 | H316: 171.106 | I316: 1.2500000000000001e-002 | J316: -8.0000000000000004e-004 | K316: 13.65 | L316: 1.26e-002 | M316: 115.3 | N316: 7.97 | O316: -1.e-003 | P316: 171.27 | Q316: 转股中 | R316: 5年34天 | S316: 3年35天 | T316: 9.26 | U316: 147 | V316: 9.3000000000000013e-002 | W316: 3.4000000000000002e-002 | X316: 5.7999999999999996e-002 | Y316: 272 | Z316: 2.5 | AA316: -7.5899999999999995e-002 | AB316: -8.0500000000000002e-002 | AC316: -0.14000000000000001 | AD316: -0.14099999999999999 | AE316: 90.68 | AF316: 93.69 | AG316: 0.92 | AH316: AA | AI316: 4.2500000000000003e-002 | AJ316: =H316+100*O316 -> 171.006 | AK316: 170.9 | AL316: 310 | AM316: 77.3 | AN316: 306 | AO316: 0.13699999999999998 | AP316: 34 | AQ316: 齐翔转2!
A317: 354 | B317: 113502 | C317: 嘉澳转债! | D317: 603822 | E317: 嘉澳环保 | F317: 化工 | G317: 化工 | H317: 133.48 | I317: 7.6700000000000004e-002 | J317: -5.0799999999999998e-002 | K317: 35.68 | L317: 9.9900000000000003e-002 | M317: 111.3 | N317: 44.64 | O317: 0.67000000000000004 | P317: 79.93 | Q317: 转股中 | R317: 2.32年 | S317: 0.32年 | T317: 1.85 | U317: 3264. | V317: 12.58 | W317: 7.0999999999999994e-002 | X317: 5.5999999999999994e-002 | Y317: 26 | Z317: 3.27 | AA317: -7.6600000000000001e-002 | AB317: -8.4600000000000009e-002 | AC317: -0.51600000000000001 | AD317: -0.52100000000000002 | AE317: 98.95 | AF317: 97.4 | AG317: 0.26 | AH317: AA- | AI317: 6.0400000000000002e-002 | AJ317: =H317+100*O317 -> 200.47999999999999 | AK317: 187 | AL317: 331 | AM317: 88.1 | AN317: 324 | AO317: 0.27500000000000002 | AP317: 36 | AQ317: 嘉澳转债!
A318: 169 | B318: 128113 | C318: 比音转债! | D318: 2832 | E318: 比音勒芬 | F318: 服装纺织 | G318: 服装行业 | H318: 172.183 | I318: -1.e-002 | J318: -1.8e-003 | K318: 25 | L318: -1.26e-002 | M318: 116.9 | N318: 14.6 | O318: 6.0000000000000001e-003 | P318: 171.23 | Q318: 转股中 | R318: 4.91年 | S318: 2.92年 | T318: 3.03 | U318: 26 | V318: 5.0000000000000003e-002 | W318: 2.2000000000000002e-002 | X318: 3.7999999999999999e-002 | Y318: 137 | Z318: 5.17 | AA318: -7.6999999999999999e-002 | AB318: -8.2299999999999998e-002 | AC318: -0.14999999999999999 | AD318: -0.151 | AE318: 91.4 | AF318: 96.22 | AG318: 0.93 | AH318: AA | AI318: 4.1200000000000001e-002 | AJ318: =H318+100*O318 -> 172.78299999999999 | AK318: 173.1 | AL318: 312 | AM318: 76.9 | AN318: 305 | AO318: 6.0000000000000001e-003 | AP318: 9 | AQ318: 比音转债!
A319: 289 | B319: 123022 | C319: 长信转债!! | D319: 300088 | E319: 长信科技 | F319: 通信互联 | G319: 通信设备 | H319: 153.3 | I319: 4.0399999999999998e-002 | J319: -8.1000000000000013e-003 | K319: 8.69 | L319: 3.7000000000000005e-002 | M319: 114.3 | N319: 6.05 | O319: 6.7000000000000004e-002 | P319: 143.64 | Q319: 转股中 | R319: 3.67年 | S319: 1.67年 | T319: 2.57 | U319: 262 | V319: 0.66599999999999993 | W319: 1.2e-002 | X319: 1.7000000000000001e-002 | Y319: 213 | Z319: 2.95 | AA319: -7.8100000000000003e-002 | AB319: -8.43e-002 | AC319: -0.16200000000000001 | AD319: -0.16399999999999998 | AE319: 95.5 | AF319: 98.84 | AG319: 0.87 | AH319: AA | AI319: 4.1200000000000001e-002 | AJ319: =H319+100*O319 -> 160. | AK319: 163 | AL319: 300 | AM319: 64.1 | AN319: 285 | AO319: 4.5999999999999999e-002 | AP319: 12 | AQ319: 长信转债!!
A320: 307 | B320: 110048 | C320: 福能转债!! | D320: 600483 | E320: 福能股份 | F320: 能源电力 | G320: 电力供应 | H320: 149.28 | I320: 1.8100000000000002e-002 | J320: 7.8000000000000005e-003 | K320: 11.38 | L320: 2.9900000000000003e-002 | M320: 113.3 | N320: 8.12 | O320: 6.5000000000000002e-002 | P320: 140.15 | Q320: 转股中 | R320: 3.39年 | S320: 1.39年 | T320: 19.5 | U320: 92 | V320: 3.1e-002 | W320: 9.1999999999999998e-002 | X320: 0.128 | Y320: 213 | Z320: 1.29 | AA320: -7.9500000000000001e-002 | AB320: -8.5699999999999998e-002 | AC320: -0.188 | AD320: -0.19 | AE320: 97.01 | AF320: 100.03 | AG320: 0.87 | AH320: AA+ | AI320: 3.8199999999999998e-002 | AJ320: =H320+100*O320 -> 155.78 | AK320: 158.4 | AL320: 293 | AM320: 58.4 | AN320: 262 | AO320: 4.9000000000000002e-002 | AP320: 9 | AQ320: 福能转债!!
A321: 117 | B321: 123067 | C321: 斯莱转债! | D321: 300382 | E321: 斯莱克 | F321: 机械装备 | G321: 专用设备 | H321: 185.748 | I321: 1.6799999999999999e-002 | J321: 2.0999999999999999e-003 | K321: 16.93 | L321: 2.0499999999999997e-002 | M321: 121.2 | N321: 9.36 | O321: 2.7000000000000003e-002 | P321: 180.88 | Q321: 转股中 | R321: 5.17年 | S321: 3.17年 | T321: 3.88 | U321: 262 | V321: 0.36799999999999999 | W321: 4.0999999999999995e-002 | X321: 7.2999999999999995e-002 | Y321: 96 | Z321: 9.21 | AA321: -8.0700000000000008e-002 | AB321: -8.6899999999999991e-002 | AC321: -0.155 | AD321: -0.157 | AE321: 85 | AF321: 88.82 | AG321: 0.92 | AH321: AA- | AI321: 6.3500000000000001e-002 | AJ321: =H321+100*O321 -> 188.44799999999998 | AK321: 190.6 | AL321: 335 | AM321: 101.8 | AN321: 338 | AO321: 0.14999999999999999 | AP321: 12 | AQ321: 斯莱转债!
A322: 305 | B322: 128051 | C322: 光华转债! | D322: 2741 | E322: 光华科技 | F322: 电子 | G322: 元器件制 | H322: 153.494 | I322: -1.7600000000000001e-002 | J322: -1.1599999999999999e-002 | K322: 19.48 | L322: -3.2300000000000002e-002 | M322: 114.8 | N322: 12.72 | O322: 2.e-003 | P322: 153.14 | Q322: 转股中 | R322: 3.41年 | S322: 1.41年 | T322: 1.58 | U322: 159 | V322: 0.64900000000000002 | W322: 2.1000000000000001e-002 | X322: 3.3000000000000002e-002 | Y322: 73 | Z322: 5.89 | AA322: -8.3199999999999996e-002 | AB322: -8.9999999999999997e-002 | AC322: -0.19500000000000001 | AD322: -0.19699999999999998 | AE322: 93.84 | AF322: 93.88 | AG322: 0.9 | AH322: AA- | AI322: 6.2199999999999998e-002 | AJ322: =H322+100*O322 -> 153.69399999999999 | AK322: 153.8 | AL322: 277 | AM322: 60 | AN322: 272 | AO322: 0.156 | AP322: 28 | AQ322: 光华转债!
A323: 82 | B323: 113611 | C323: 福20转债!* | D323: 603806 | E323: 福斯特 | F323: 能源电力 | G323: 太阳能 | H323: 180.1 | I323: -3.7400000000000003e-002 | J323: -5.1000000000000004e-003 | K323: 110.3 | L323: -4.2500000000000003e-002 | M323: 111.85 | N323: 61.03 | O323: -3.0000000000000001e-003 | P323: 180.73 | Q323: 转股中 | R323: 5.38年 | S323: 3.38年 | T323: 8.12 | U323: 304 | V323: 0.20000000000000001 | W323: 8.0000000000000002e-003 | X323: 1.3999999999999999e-002 | Y323: 1025. | Z323: 9.27 | AA323: -8.5800000000000001e-002 | AB323: -8.929999999999999e-002 | AC323: -0.14199999999999999 | AD323: -0.14300000000000002 | AE323: 88.66 | AF323: 89.72 | AG323: 1 | AH323: AA | AI323: 4.2500000000000003e-002 | AJ323: =H323+100*O323 -> 179.79999999999998 | AK323: 179.5 | AL323: 321 | AM323: 89.7 | AN323: 328 | AO323: 5.4000000000000006e-002 | AP323: 5 | AQ323: 福20转债!*
A324: 268 | B324: 113537 | C324: 文灿转债!! | D324: 603348 | E324: 文灿股份 | F324: 汽车 | G324: 零部件制 | H324: 171.27 | I324: 5.2499999999999998e-002 | J324: -4.3e-003 | K324: 30.8 | L324: 5.4100000000000002e-002 | M324: 120.7 | N324: 19.28 | O324: 7.2000000000000008e-002 | P324: 159.75 | Q324: 转股中 | R324: 3.90年 | S324: 1.90年 | T324: 1.41 | U324: 430 | V324: 1.79 | W324: 1.7000000000000001e-002 | X324: 2.7999999999999997e-002 | Y324: 81 | Z324: 3.1 | AA324: -8.7400000000000005e-002 | AB324: -9.5399999999999985e-002 | AC324: -0.16800000000000001 | AD324: -0.17000000000000001 | AE324: 91.56 | AF324: 95.9 | AG324: 0.89 | AH324: AA- | AI324: 6.2199999999999998e-002 | AJ324: =H324+100*O324 -> 178.47 | AK324: 182.8 | AL324: 325 | AM324: 86.9 | AN324: 322 | AO324: -6.0999999999999999e-002 | AP324: 25 | AQ324: 文灿转债!!
A325: 20 | B325: 113047 | C325: 旗滨转债 | D325: 601636 | E325: 旗滨集团 | F325: 建筑 | G325: 玻璃 | H325: 192.6 | I325: 3.0999999999999999e-003 | J325: -1.03e-002 | K325: 21.28 | L325: -7.9000000000000008e-003 | M325: 114 | N325: 12.8 | O325: 0.158 | P325: 166.25 | Q325: 3月1天 | R325: 5.73年 | S325: 3.73年 | T325: 15 | U325: 89 | V325: 2.9999999999999999e-002 | W325: 2.6000000000000002e-002 | X325: 4.4000000000000004e-002 | Y325: 572 | Z325: 5.5 | AA325: -8.8399999999999992e-002 | AB325: -9.2200000000000004e-002 | AC325: -0.14199999999999999 | AD325: -0.14300000000000002 | AE325: 88.21 | AF325: 91.57 | AG325: 0.91 | AH325: AA+ | AI325: 3.95e-002 | AJ325: =H325+100*O325 -> 208.40000000000001 | AK325: 219 | AL325: 346 | AM325: 127.4 | AN325: 347 | AO325: 0.13200000000000001 | AP325: 5 | AQ325: 旗滨转债
A326: 312 | B326: 128046 | C326: 利尔转债!! | D326: 2258 | E326: 利尔化学 | F326: 化工 | G326: 农化 | H326: 152.647 | I326: 6.3700000000000007e-002 | J326: -2.5899999999999999e-002 | K326: 27.51 | L326: 4.1700000000000001e-002 | M326: 112.3 | N326: 18.42 | O326: 2.2000000000000002e-002 | P326: 149.35 | Q326: 转股中 | R326: 3.25年 | S326: 1.26年 | T326: 8.08 | U326: 679 | V326: 0.55100000000000005 | W326: 5.5999999999999994e-002 | X326: 8.3000000000000004e-002 | Y326: 145 | Z326: 3.71 | AA326: -9.1700000000000004e-002 | AB326: -9.7599999999999992e-002 | AC326: -0.22 | AD326: -0.222 | AE326: 97.12 | AF326: 98.76 | AG326: 0.91 | AH326: AA | AI326: 4.1200000000000001e-002 | AJ326: =H326+100*O326 -> 154.84699999999998 | AK326: 155.9 | AL326: 285 | AM326: 57.2 | AN326: 251 | AO326: 0.122 | AP326: 10 | AQ326: 利尔转债!!
A327: 33 | B327: 127030 | C327: 盛虹转债 | D327: 301 | E327: 东方盛虹 | F327: 化工 | G327: 化纤 | H327: 193 | I327: 3.2099999999999997e-002 | J327: 7.8000000000000005e-003 | K327: 26.25 | L327: 4.2099999999999999e-002 | M327: 112.5 | N327: 14.1 | O327: 3.7000000000000005e-002 | P327: 186.17 | Q327: 2月13天 | R327: 5.68年 | S327: 3.68年 | T327: 50 | U327: 533 | V327: 5.5e-002 | W327: 3.9e-002 | X327: 7.2999999999999995e-002 | Y327: 1269. | Z327: 7 | AA327: -9.1700000000000004e-002 | AB327: -9.5100000000000004e-002 | AC327: -0.14400000000000002 | AD327: -0.14499999999999999 | AE327: 88.81 | AF327: 90.57 | AG327: 0.95 | AH327: AA+ | AI327: 3.95e-002 | AJ327: =H327+100*O327 -> 196.69999999999999 | AK327: 199.8 | AL327: 341 | AM327: 109.3 | AN327: 342 | AO327: 0.30499999999999999 | AP327: 4 | AQ327: 盛虹转债
A328: 245 | B328: 113548 | C328: 石英转债! | D328: 603688 | E328: 石英股份 | F328: 电子 | G328: 电子产品 | H328: 187.22 | I328: 3.5299999999999998e-002 | J328: 2.0299999999999999e-002 | K328: 26.99 | L328: 6.0499999999999998e-002 | M328: 124.4 | N328: 14.93 | O328: 3.6000000000000004e-002 | P328: 180.78 | Q328: 转股中 | R328: 4.28年 | S328: 2.29年 | T328: 1.23 | U328: 687 | V328: 2.8999999999999999 | W328: 1.3000000000000001e-002 | X328: 2.3e-002 | Y328: 95 | Z328: 4.83 | AA328: -9.2899999999999996e-002 | AB328: -0.10099999999999999 | AC328: -0.152 | AD328: -0.153 | AE328: 90.15 | AF328: 96.71 | AG328: 0.92 | AH328: AA- | AI328: 6.2199999999999998e-002 | AJ328: =H328+100*O328 -> 190.81999999999999 | AK328: 193.7 | AL328: 338 | AM328: 97 | AN328: 334 | AO328: 0.127 | AP328: 13 | AQ328: 石英转债!
A329: 52 | B329: 123094 | C329: 星源转2! | D329: 300568 | E329: 星源材质 | F329: 电子 | G329: 电子行业 | H329: 201.699 | I329: -5.2600000000000001e-002 | J329: -1.1999999999999999e-003 | K329: 40.73 | L329: -5.6100000000000004e-002 | M329: 117.3 | N329: 19.64 | O329: -2.7000000000000003e-002 | P329: 207.38 | Q329: 10天 | R329: 5.51年 | S329: 3.52年 | T329: 10 | U329: 615 | V329: 0.29600000000000004 | W329: 3.4000000000000002e-002 | X329: 7.0999999999999994e-002 | Y329: 292 | Z329: 6.04 | AA329: -9.5100000000000004e-002 | AB329: -9.98e-002 | AC329: -0.158 | AD329: -0.16 | AE329: 89.2 | AF329: 93.67 | AG329: 0.96 | AH329: AA | AI329: 4.2500000000000003e-002 | AJ329: =H329+100*O329 -> 198.99900000000002 | AK329: 196 | AL329: 339 | AM329: 102.3 | AN329: 339 | AO329: -0.11800000000000001 | AP329: 6 | AQ329: 星源转2!
A330: 253 | B330: 113545 | C330: 金能转债! | D330: 603113 | E330: 金能科技 | F330: 煤炭 | G330: 炼焦 | H330: 175.1 | I330: 2.8999999999999998e-003 | J330: -1.03e-002 | K330: 17.13 | L330: -8.1000000000000013e-003 | M330: 114.9 | N330: 10.43 | O330: 6.6000000000000003e-002 | P330: 164.24 | Q330: 转股中 | R330: 4.24年 | S330: 2.25年 | T330: 10.2 | U330: 71 | V330: 4.0000000000000001e-002 | W330: 7.0000000000000007e-002 | X330: 0.115 | Y330: 146 | Z330: 1.76 | AA330: -9.6099999999999991e-002 | AB330: -0.10099999999999999 | AC330: -0.14300000000000002 | AD330: -0.14400000000000002 | AE330: 93.9 | AF330: 97.16 | AG330: 0.91 | AH330: AA | AI330: 4.1200000000000001e-002 | AJ330: =H330+100*O330 -> 181.69999999999999 | AK330: 186 | AL330: 329 | AM330: 88.8 | AN330: 326 | AO330: -2.5000000000000001e-002 | AP330: 16 | AQ330: 金能转债!
A331: 243 | B331: 123034 | C331: 通光转债! | D331: 300265 | E331: 通光线缆 | F331: 通信互联 | G331: 通信设备 | H331: 182.365 | I331: 4.7999999999999996e-003 | J331: 5.7999999999999996e-003 | K331: 9.16 | L331: 1.44e-002 | M331: 118 | N331: 7.95 | O331: 0.58299999999999996 | P331: 115.22 | Q331: 转股中 | R331: 4.30年 | S331: 2.30年 | T331: 0.78 | U331: 130 | V331: 0.91400000000000003 | W331: 2.3e-002 | X331: 2.7000000000000003e-002 | Y331: 33 | Z331: 2.57 | AA331: -9.7899999999999987e-002 | AB331: -0.10400000000000001 | AC331: -0.14599999999999999 | AD331: -0.14800000000000002 | AE331: 87.11 | AF331: 87.67 | AG331: 0.73 | AH331: A+ | AI331: 7.3200000000000001e-002 | AJ331: =H331+100*O331 -> 240.66500000000002 | AK331: 249.5 | AL331: 351 | AM331: 161.8 | AN331: 351 | AO331: 6.0000000000000001e-003 | AP331: 20 | AQ331: 通光转债!
A332: 329 | B332: 113508 | C332: 新凤转债! | D332: 603225 | E332: 新凤鸣 | F332: 服装纺织 | G332: 纺织行业 | H332: 147.79 | I332: -8.0000000000000002e-003 | J332: -1.2699999999999999e-002 | K332: 23.36 | L332: -2.2599999999999999e-002 | M332: 111.3 | N332: 15.65 | O332: -1.e-002 | P332: 149.27 | Q332: 转股中 | R332: 2.78年 | S332: 0.78年 | T332: 19.7 | U332: 444 | V332: 0.151 | W332: 5.9999999999999998e-002 | X332: 8.9999999999999997e-002 | Y332: 327 | Z332: 2.68 | AA332: -9.8400000000000001e-002 | AB332: -0.105 | AC332: -0.33200000000000002 | AD332: -0.33399999999999996 | AE332: 98.16 | AF332: 100.14 | AG332: 0.92 | AH332: AA | AI332: 3.9399999999999998e-002 | AJ332: =H332+100*O332 -> 146.78999999999999 | AK332: 146.3 | AL332: 240 | AM332: 46.2 | AN332: 189 | AO332: 0.153 | AP332: 22 | AQ332: 新凤转债!
A333: 193 | B333: 113034 | C333: 滨化转债! | D333: 601678 | E333: 滨化股份 | F333: 化工 | G333: 化工 | H333: 187.89 | I333: 4.1399999999999999e-002 | J333: -1.49e-002 | K333: 8.43 | L333: 2.7999999999999997e-002 | M333: 114.8 | N333: 4.58 | O333: 2.1000000000000001e-002 | P333: 184.06 | Q333: 转股中 | R333: 4.73年 | S333: 2.73年 | T333: 4.74 | U333: 161 | V333: 0.17899999999999999 | W333: 2.8999999999999998e-002 | X333: 5.2999999999999999e-002 | Y333: 164 | Z333: 1.84 | AA333: -0.10000000000000001 | AB333: -0.105 | AC333: -0.121 | AD333: -0.122 | AE333: 91.97 | AF333: 95.17 | AG333: 0.94 | AH333: AA | AI333: 4.1200000000000001e-002 | AJ333: =H333+100*O333 -> 189.98999999999998 | AK333: 191.7 | AL333: 336 | AM333: 96.5 | AN333: 333 | AO333: 0.13100000000000001 | AP333: 23 | AQ333: 滨化转债!
A334: 316 | B334: 123014 | C334: 凯发转债! | D334: 300407 | E334: 凯发电气 | F334: 能源电力 | G334: 电力设备 | H334: 135 | I334: -8.1000000000000013e-003 | J334: 5.1999999999999998e-003 | K334: 7.22 | L334: -6.8999999999999999e-003 | M334: 108.5 | N334: 8.05 | O334: 0.505 | P334: 89.69 | Q334: 转股中 | R334: 2年11天 | S334: 11天 | T334: 1.16 | U334: 76 | V334: 0.47999999999999998 | W334: 5.2999999999999999e-002 | X334: 4.7e-002 | Y334: 22 | Z334: 1.61 | AA334: -0.10300000000000001 | AB334: -0.11 | AC334: -1.3840000000000001 | AD334: -1.3919999999999999 | AE334: 99.9 | AF334: 94.55 | AG334: 0.42 | AH334: A+ | AI334: 7.1399999999999991e-002 | AJ334: =H334+100*O334 -> 185.5 | AK334: 180.3 | AL334: 324 | AM334: 80.4 | AN334: 312 | AO334: -9.0000000000000011e-003 | AP334: 15 | AQ334: 凯发转债!
A335: 214 | B335: 110066 | C335: 盛屯转债!! | D335: 600711 | E335: 盛屯矿业 | F335: 有色金属 | G335: 有色行业 | H335: 191.32 | I335: 5.4299999999999994e-002 | J335: 2.7000000000000001e-003 | K335: 9.4 | L335: 5.9800000000000006e-002 | M335: 114.9 | N335: 4.87 | O335: -9.0000000000000011e-003 | P335: 193.02 | Q335: 转股中 | R335: 4.62年 | S335: 2.63年 | T335: 4.54 | U335: 3587. | V335: 4.0099999999999998 | W335: 1.8000000000000002e-002 | X335: 3.5000000000000003e-002 | Y335: 253 | Z335: 2.25 | AA335: -0.106 | AB335: -0.111 | AC335: -0.13100000000000001 | AD335: -0.13200000000000001 | AE335: 92.47 | AF335: 95.68 | AG335: 0.95 | AH335: AA | AI335: 4.1200000000000001e-002 | AJ335: =H335+100*O335 -> 190.41999999999999 | AK335: 189.6 | AL335: 334 | AM335: 93.9 | AN335: 332 | AO335: 0.23199999999999998 | AP335: 33 | AQ335: 盛屯转债!!
A336: 340 | B336: 128033 | C336: 迪龙转债! | D336: 2658 | E336: 雪迪龙 | F336: 城市公用 | G336: 三废处理 | H336: 143.07 | I336: -3.4000000000000002e-002 | J336: 3.7000000000000002e-003 | K336: 10.5 | L336: -3.9300000000000002e-002 | M336: 108.8 | N336: 8.71 | O336: 0.187 | P336: 120.55 | Q336: 转股中 | R336: 2.45年 | S336: 0.45年 | T336: 2.98 | U336: 700 | V336: 1.6000000000000001 | W336: 4.4999999999999998e-002 | X336: 5.4000000000000006e-002 | Y336: 66 | Z336: 2.77 | AA336: -0.107 | AB336: -0.113 | AC336: -0.49200000000000005 | AD336: -0.495 | AE336: 99.17 | AF336: 99.12 | AG336: 0.77 | AH336: AA | AI336: 3.9399999999999998e-002 | AJ336: =H336+100*O336 -> 161.76999999999998 | AK336: 165.6 | AL336: 302 | AM336: 66.4 | AN336: 291 | AO336: 0.10800000000000001 | AP336: 35 | AQ336: 迪龙转债!
A337: 306 | B337: 128050 | C337: 钧达转债!! | D337: 2865 | E337: 钧达股份 | F337: 汽车 | G337: 零部件制 | H337: 179 | I337: -8.2100000000000006e-002 | J337: 0.11699999999999999 | K337: 26.63 | L337: 3.5000000000000003e-002 | M337: 122.7 | N337: 14.8 | O337: -5.0000000000000001e-003 | P337: 179.93 | Q337: 转股中 | R337: 3.40年 | S337: 1.40年 | T337: 1.4 | U337: 1667. | V337: 6.3499999999999996 | W337: 4.0000000000000001e-002 | X337: 7.0999999999999994e-002 | Y337: 35 | Z337: 3.29 | AA337: -0.107 | AB337: -0.11699999999999999 | AC337: -0.255 | AD337: -0.25700000000000001 | AE337: 93.82 | AF337: 100.38 | AG337: 1 | AH337: AA- | AI337: 6.2199999999999998e-002 | AJ337: =H337+100*O337 -> 178.5 | AK337: 178.1 | AL337: 319 | AM337: 77.7 | AN337: 307 | AO337: 0.26200000000000001 | AP337: 50 | AQ337: 钧达转债!!
A338: 217 | B338: 128097 | C338: 奥佳转债! | D338: 2614 | E338: 奥佳华 | F338: 机械装备 | G338: 专用设备 | H338: 200 | I338: -1.5e-003 | J338: 3.4999999999999996e-003 | K338: 19.84 | L338: 2.e-003 | M338: 114.9 | N338: 10.39 | O338: 4.7e-002 | P338: 190.95 | Q338: 转股中 | R338: 4.61年 | S338: 2.61年 | T338: 4.6 | U338: 61 | V338: 6.6000000000000003e-002 | W338: 3.7000000000000005e-002 | X338: 7.0000000000000007e-002 | Y338: 125 | Z338: 2.71 | AA338: -0.115 | AB338: -0.12 | AC338: -0.13900000000000001 | AD338: -0.14000000000000001 | AE338: 92.52 | AF338: 95.73 | AG338: 0.95 | AH338: AA | AI338: 4.1200000000000001e-002 | AJ338: =H338+100*O338 -> 204.69999999999999 | AK338: 209 | AL338: 343 | AM338: 113.3 | AN338: 343 | AO338: -0.109 | AP338: 20 | AQ338: 奥佳转债!
A339: 276 | B339: 113534 | C339: 鼎胜转债!! | D339: 603876 | E339: 鼎胜新材 | F339: 有色金属 | G339: 小金属 | H339: 183.3 | I339: 1.3999999999999999e-002 | J339: 1.5e-003 | K339: 27.69 | L339: 1.61e-002 | M339: 114.3 | N339: 15.18 | O339: 5.0000000000000001e-003 | P339: 182.41 | Q339: 转股中 | R339: 3.73年 | S339: 1.73年 | T339: 4.44 | U339: 453 | V339: 0.55200000000000005 | W339: 3.3000000000000002e-002 | X339: 6.0999999999999999e-002 | Y339: 133 | Z339: 3.31 | AA339: -0.121 | AB339: -0.126 | AC339: -0.20899999999999999 | AD339: -0.20999999999999999 | AE339: 91.75 | AF339: 91.66 | AG339: 0.96 | AH339: AA- | AI339: 6.2199999999999998e-002 | AJ339: =H339+100*O339 -> 183.80000000000001 | AK339: 184.2 | AL339: 328 | AM339: 92.4 | AN339: 331 | AO339: -1.8000000000000002e-002 | AP339: 34 | AQ339: 鼎胜转债!!
A340: 290 | B340: 110055 | C340: 伊力转债!! | D340: 600197 | E340: 伊力特 | F340: 食品饮料 | G340: 白酒 | H340: 186.98 | I340: -2.0899999999999998e-002 | J340: 4.0000000000000002e-004 | K340: 28.5 | L340: -2.1600000000000001e-002 | M340: 114.3 | N340: 16.41 | O340: 7.6999999999999999e-002 | P340: 173.67 | Q340: 转股中 | R340: 3.66年 | S340: 1.66年 | T340: 2.44 | U340: 534 | V340: 1.1599999999999999 | W340: 1.8000000000000002e-002 | X340: 3.1e-002 | Y340: 135 | Z340: 3.74 | AA340: -0.128 | AB340: -0.13300000000000001 | AC340: -0.22399999999999998 | AD340: -0.22600000000000001 | AE340: 95.53 | AF340: 98.87 | AG340: 0.95 | AH340: AA | AI340: 4.1200000000000001e-002 | AJ340: =H340+100*O340 -> 194.67999999999998 | AK340: 200.3 | AL340: 342 | AM340: 101.4 | AN340: 337 | AO340: -5.7999999999999996e-002 | AP340: 22 | AQ340: 伊力转债!!
A341: 130 | B341: 110074 | C341: 精达转债!! | D341: 600577 | E341: 精达股份 | F341: 电子 | G341: 电子产品 | H341: 232.94 | I341: 2.98e-002 | J341: -1.26e-002 | K341: 8.58 | L341: 1.78e-002 | M341: 117.3 | N341: 3.73 | O341: 1.3000000000000001e-002 | P341: 230.03 | Q341: 转股中 | R341: 5年33天 | S341: 3年34天 | T341: 5.98 | U341: 845 | V341: 0.58999999999999997 | W341: 3.6000000000000004e-002 | X341: 8.199999999999999e-002 | Y341: 167 | Z341: 4.34 | AA341: -0.128 | AB341: -0.13300000000000001 | AC341: -0.128 | AD341: -0.128 | AE341: 90.78 | AF341: 95.33 | AG341: 0.97 | AH341: AA | AI341: 4.2500000000000003e-002 | AJ341: =H341+100*O341 -> 234.24000000000001 | AK341: 235.9 | AL341: 350 | AM341: 140.5 | AN341: 350 | AO341: 0.19600000000000001 | AP341: 12 | AQ341: 精达转债!!
A342: 300 | B342: 113527 | C342: 维格转债!! | D342: 603518 | E342: 锦泓集团 | F342: 服装纺织 | G342: 服装行业 | H342: 199.9 | I342: -1.2699999999999999e-002 | J342: -8.4100000000000008e-002 | K342: 21.74 | L342: -9.98e-002 | M342: 119.5 | N342: 9.85 | O342: -9.4e-002 | P342: 220.71 | Q342: 转股中 | R342: 3.53年 | S342: 1.53年 | T342: 3.45 | U342: 689 | V342: 0.995 | W342: 5.5999999999999994e-002 | X342: 0.12300000000000001 | Y342: 62 | Z342: 2.87 | AA342: -0.13800000000000001 | AB342: -0.14599999999999999 | AC342: -0.26600000000000001 | AD342: -0.26800000000000002 | AE342: 94.57 | AF342: 100.55 | AG342: 0.97 | AH342: AA | AI342: 5.1200000000000002e-002 | AJ342: =H342+100*O342 -> 190.5 | AK342: 179.1 | AL342: 320 | AM342: 78.5 | AN342: 310 | AO342: -6.9000000000000006e-002 | AP342: 84 | AQ342: 维格转债!!
A343: 201 | B343: 123047 | C343: 久吾转债! | D343: 300631 | E343: 久吾高科 | F343: 机械装备 | G343: 专用设备 | H343: 255.37 | I343: 9.0000000000000011e-003 | J343: 4.0999999999999995e-002 | K343: 43.15 | L343: 5.2199999999999996e-002 | M343: 129.6 | N343: 17.43 | O343: 3.2000000000000001e-002 | P343: 247.56 | Q343: 转股中 | R343: 4.67年 | S343: 2.68年 | T343: 1.58 | U343: 4475. | V343: 11.050000000000001 | W343: 3.4000000000000002e-002 | X343: 8.4000000000000005e-002 | Y343: 47 | Z343: 5.67 | AA343: -0.13800000000000001 | AB343: -0.14599999999999999 | AC343: -0.16500000000000001 | AD343: -0.16699999999999998 | AE343: 86.6 | AF343: 94.04 | AG343: 0.96 | AH343: A+ | AI343: 7.3200000000000001e-002 | AJ343: =H343+100*O343 -> 258.56999999999999 | AK343: 263.2 | AL343: 353 | AM343: 169.1 | AN343: 354 | AO343: 0.38799999999999996 | AP343: 23 | AQ343: 久吾转债!
A344: 182 | B344: 113580 | C344: 康隆转债! | D344: 603665 | E344: 康隆达 | F344: 服装纺织 | G344: 服装行业 | H344: 244.73 | I344: -1.66e-002 | J344: 1.0700000000000001e-002 | K344: 14.14 | L344: -1.1200000000000002e-002 | M344: 120.8 | N344: 15.51 | O344: 1.6799999999999999 | P344: 91.17 | Q344: 转股中 | R344: 4.77年 | S344: 2.77年 | T344: 0.41 | U344: 43 | V344: 0.42899999999999999 | W344: 1.8000000000000002e-002 | X344: 1.7000000000000001e-002 | Y344: 22 | Z344: 2.06 | AA344: -0.14000000000000001 | AB344: -0.14599999999999999 | AC344: -0.155 | AD344: -0.156 | AE344: 87.03 | AF344: 91.16 | AG344: 0.53 | AH344: AA- | AI344: 6.2199999999999998e-002 | AJ344: =H344+100*O344 -> 412.73000000000002 | AK344: 398.3 | AL344: 361 | AM344: 307.1 | AN344: 361 | AO344: -2.4e-002 | AP344: 9 | AQ344: 康隆转债!
A345: 363 | B345: 113012 | C345: 骆驼转债! | D345: 601311 | E345: 骆驼股份 | F345: 汽车 | G345: 零部件制 | H345: 137.46 | I345: 3.3500000000000002e-002 | J345: 9.7000000000000003e-003 | K345: 13.3 | L345: 4.7199999999999999e-002 | M345: 106.5 | N345: 9.86 | O345: 1.9e-002 | P345: 134.89 | Q345: 转股中 | R345: 1.69年 | S345: 回售内 | T345: 5.09 | U345: 96 | V345: 0.13699999999999998 | W345: 3.4000000000000002e-002 | X345: 4.5999999999999999e-002 | Y345: 149 | Z345: 1.97 | AA345: -0.14099999999999999 | AB345: -0.14699999999999999 | AC345: 回售内 | AD345: 回售内 | AE345: 100.25 | AF345: 99.83 | AG345: 0.91 | AH345: AA | AI345: 3.9399999999999998e-002 | AJ345: =H345+100*O345 -> 139.36000000000001 | AK345: 140 | AL345: 198 | AM345: 39.8 | AN345: 137 | AO345: 0.14000000000000001 | AP345: 16 | AQ345: 骆驼转债!
A346: 367 | B346: 113009 | C346: 广汽转债! | D346: 601238 | E346: 广汽集团 | F346: 汽车 | G346: 乘用车 | H346: 114.99 | I346: -4.5999999999999999e-003 | J346: 2.0999999999999999e-003 | K346: 14.46 | L346: -5.5000000000000005e-003 | M346: 106 | N346: 13.97 | O346: 0.111 | P346: 103.51 | Q346: 转股中 | R346: 0.52年 | S346: 回售内 | T346: 25.5 | U346: 92 | V346: 3.1e-002 | W346: 1.7000000000000001e-002 | X346: 1.8000000000000002e-002 | Y346: 1497. | Z346: 1.73 | AA346: -0.14499999999999999 | AB346: -0.16300000000000001 | AC346: 回售内 | AD346: 回售内 | AE346: 100.27 | AF346: 104.33 | AG346: 0.45 | AH346: AAA | AI346: 3.0899999999999997e-002 | AJ346: =H346+100*O346 -> 126.08999999999999 | AK346: 126.5 | AL346: 58 | AM346: 22.1 | AN346: 10 | AO346: 5.9000000000000004e-002 | AP346: 16 | AQ346: 广汽转债!
A347: 202 | B347: 123046 | C347: 天铁转债! | D347: 300587 | E347: 天铁股份 | F347: 铁路 | G347: 铁路设备 | H347: 249.187 | I347: 3.6699999999999997e-002 | J347: -1.3999999999999999e-002 | K347: 13.55 | L347: 2.3399999999999997e-002 | M347: 117.7 | N347: 5.9 | O347: 8.5000000000000006e-002 | P347: 229.66 | Q347: 转股中 | R347: 4.67年 | S347: 2.67年 | T347: 0.62 | U347: 369 | V347: 2.3799999999999999 | W347: 8.0000000000000002e-003 | X347: 1.8000000000000002e-002 | Y347: 78 | Z347: 2.85 | AA347: -0.151 | AB347: -0.156 | AC347: -0.16500000000000001 | AD347: -0.16600000000000001 | AE347: 87.44 | AF347: 89.33 | AG347: 0.97 | AH347: AA- | AI347: 6.2199999999999998e-002 | AJ347: =H347+100*O347 -> 257.68700000000001 | AK347: 268.7 | AL347: 355 | AM347: 179.4 | AN347: 355 | AO347: -0.28800000000000003 | AP347: 14 | AQ347: 天铁转债!
A348: 258 | B348: 123030 | C348: 九洲转债! | D348: 300040 | E348: 九洲集团 | F348: 能源电力 | G348: 电力设备 | H348: 233.5 | I348: -3.8699999999999998e-002 | J348: -1.1000000000000001e-002 | K348: 8.18 | L348: -5.21e-002 | M348: 120 | N348: 4 | O348: 0.14199999999999999 | P348: 204.5 | Q348: 转股中 | R348: 4年34天 | S348: 2年35天 | T348: 0.97 | U348: 1405. | V348: 5.9699999999999998 | W348: 2.2000000000000002e-002 | X348: 4.4999999999999998e-002 | Y348: 44 | Z348: 1.4 | AA348: -0.152 | AB348: -0.159 | AC348: -0.214 | AD348: -0.215 | AE348: 90.45 | AF348: 94.26 | AG348: 0.95 | AH348: AA- | AI348: 6.2199999999999998e-002 | AJ348: =H348+100*O348 -> 247.69999999999999 | AK348: 262.5 | AL348: 352 | AM348: 168.2 | AN348: 353 | AO348: -0.157 | AP348: 24 | AQ348: 九洲转债!
A349: 335 | B349: 113504 | C349: 艾华转债!! | D349: 603989 | E349: 艾华集团 | F349: 电子 | G349: 元器件制 | H349: 169.38 | I349: 2.6600000000000002e-002 | J349: -2.2599999999999999e-002 | K349: 33.74 | L349: 4.1999999999999997e-003 | M349: 109.3 | N349: 20.81 | O349: 4.4999999999999998e-002 | P349: 162.13 | Q349: 转股中 | R349: 2.62年 | S349: 0.63年 | T349: 4.9 | U349: 67 | V349: 8.1000000000000003e-002 | W349: 3.6000000000000004e-002 | X349: 5.9000000000000004e-002 | Y349: 135 | Z349: 5.01 | AA349: -0.156 | AB349: -0.161 | AC349: -0.51400000000000001 | AD349: -0.51700000000000002 | AE349: 98.73 | AF349: 98.92 | AG349: 0.96 | AH349: AA | AI349: 3.9399999999999998e-002 | AJ349: =H349+100*O349 -> 173.88 | AK349: 176.6 | AL349: 317 | AM349: 77.7 | AN349: 308 | AO349: 5.9000000000000004e-002 | AP349: 9 | AQ349: 艾华转债!!
A350: 275 | B350: 113025 | C350: 明泰转债!! | D350: 601677 | E350: 明泰铝业 | F350: 有色金属 | G350: 铝金属 | H350: 221.7 | I350: -1.46e-002 | J350: 2.1700000000000001e-002 | K350: 23.56 | L350: 7.3000000000000001e-003 | M350: 114.5 | N350: 11 | O350: 3.5000000000000003e-002 | P350: 214.18 | Q350: 转股中 | R350: 3.73年 | S350: 1.73年 | T350: 11 | U350: 139 | V350: 5.5999999999999994e-002 | W350: 6.8000000000000005e-002 | X350: 0.14599999999999999 | Y350: 161 | Z350: 1.78 | AA350: -0.16500000000000001 | AB350: -0.17000000000000001 | AC350: -0.25600000000000001 | AD350: -0.25700000000000001 | AE350: 95.29 | AF350: 98.77 | AG350: 0.98 | AH350: AA | AI350: 4.1200000000000001e-002 | AJ350: =H350+100*O350 -> 225.19999999999999 | AK350: 229.2 | AL350: 349 | AM350: 130.5 | AN350: 348 | AO350: 0.11699999999999999 | AP350: 23 | AQ350: 明泰转债!!
A351: 357 | B351: 128017 | C351: 金禾转债!! | D351: 2597 | E351: 金禾实业 | F351: 化工 | G351: 化工 | H351: 169.815 | I351: -4.1999999999999997e-003 | J351: -1.78e-002 | K351: 33.72 | L351: -2.35e-002 | M351: 108.8 | N351: 21.97 | O351: 0.106 | P351: 153.48 | Q351: 转股中 | R351: 2.30年 | S351: 0.30年 | T351: 5.52 | U351: 17 | V351: 1.8000000000000002e-002 | W351: 2.8999999999999998e-002 | X351: 4.4999999999999998e-002 | Y351: 189 | Z351: 3.77 | AA351: -0.17899999999999999 | AB351: -0.184 | AC351: -0.92000000000000004 | AD351: -0.92299999999999993 | AE351: 99.76 | AF351: 99.71 | AG351: 0.94 | AH351: AA | AI351: 3.9399999999999998e-002 | AJ351: =H351+100*O351 -> 180.41499999999999 | AK351: 186.1 | AL351: 330 | AM351: 86.4 | AN351: 320 | AO351: 8.0000000000000002e-003 | AP351: 10 | AQ351: 金禾转债!!
A352: 302 | B352: 123018 | C352: 溢利转债! | D352: 300381 | E352: 溢多利 | F352: 医药 | G352: 原料药 | H352: 224.2 | I352: -4.1100000000000005e-002 | J352: 2.1099999999999997e-002 | K352: 9.81 | L352: -2.6800000000000001e-002 | M352: 114.3 | N352: 8.25 | O352: 0.88500000000000001 | P352: 118.91 | Q352: 转股中 | R352: 3.43年 | S352: 1.43年 | T352: 0.54 | U352: 304 | V352: 2.4100000000000001 | W352: 1.1000000000000001e-002 | X352: 1.3000000000000001e-002 | Y352: 48 | Z352: 1.6 | AA352: -0.18100000000000002 | AB352: -0.187 | AC352: -0.31900000000000001 | AD352: -0.32000000000000001 | AE352: 93.44 | AF352: 93.34 | AG352: 0.74 | AH352: AA- | AI352: 6.2199999999999998e-002 | AJ352: =H352+100*O352 -> 312.69999999999999 | AK352: 329.5 | AL352: 357 | AM352: 236.1 | AN352: 357 | AO352: 2.3e-002 | AP352: 11 | AQ352: 溢利转债!
A353: 343 | B353: 128032 | C353: 双环转债!!* | D353: 2472 | E353: 双环传动 | F353: 机械装备 | G353: 通用设备 | H353: 183.12 | I353: -1.0200000000000001e-002 | J353: -9.8999999999999991e-003 | K353: 18.08 | L353: -2.0099999999999996e-002 | M353: 109.3 | N353: 9.87 | O353: 0. | P353: 183.18 | Q353: 转股中 | R353: 2.44年 | S353: 0.44年 | T353: 1.33 | U353: 131 | V353: 0.53799999999999992 | W353: 1.e-002 | X353: 1.8000000000000002e-002 | Y353: 138 | Z353: 3.55 | AA353: -0.193 | AB353: -0.19800000000000001 | AC353: -0.75800000000000001 | AD353: -0.7609999999999999 | AE353: 99.44 | AF353: 99.62 | AG353: 1 | AH353: AA | AI353: 3.9399999999999998e-002 | AJ353: =H353+100*O353 -> 183.12 | AK353: 183.1 | AL353: 326 | AM353: 83.4 | AN353: 316 | AO353: 0.12300000000000001 | AP353: 36 | AQ353: 双环转债!!*
A354: 180 | B354: 113582 | C354: 火炬转债! | D354: 603678 | E354: 火炬电子 | F354: 电子 | G354: 元器件制 | H354: 329.75 | I354: 6.25e-002 | J354: -1.6000000000000001e-003 | K354: 79.66 | L354: 6.1900000000000004e-002 | M354: 114.9 | N354: 24.99 | O354: 3.4000000000000002e-002 | P354: 318.77 | Q354: 转股中 | R354: 4.86年 | S354: 2.86年 | T354: 4.18 | U354: 970 | V354: 0.70200000000000007 | W354: 1.1000000000000001e-002 | X354: 3.6000000000000004e-002 | Y354: 366 | Z354: 9.01 | AA354: -0.19699999999999998 | AB354: -0.20100000000000001 | AC354: -0.17800000000000002 | AD354: -0.17800000000000002 | AE354: 91.59 | AF354: 94.77 | AG354: 0.99 | AH354: AA | AI354: 4.1200000000000001e-002 | AJ354: =H354+100*O354 -> 333.14999999999998 | AK354: 340.7 | AL354: 358 | AM354: 246 | AN354: 358 | AO354: 0.14999999999999999 | AP354: 6 | AQ354: 火炬转债!
A355: 361 | B355: 127004 | C355: 模塑转债!! | D355: 700 | E355: 模塑科技 | F355: 汽车 | G355: 零部件制 | H355: 171.5 | I355: -4.99e-002 | J355: 4.99e-002 | K355: 5.47 | L355: -1.9699999999999999e-002 | M355: 111.8 | N355: 7.24 | O355: 1.27 | P355: 75.55 | Q355: 转股中 | R355: 1.88年 | S355: 回售内 | T355: 1.32 | U355: 427 | V355: 1.8600000000000001 | W355: 2.6000000000000002e-002 | X355: 2.e-002 | Y355: 50 | Z355: 1.8 | AA355: -0.20499999999999999 | AB355: -0.214 | AC355: 回售内 | AD355: 回售内 | AE355: 100.3 | AF355: 98.33 | AG355: 0 | AH355: AA- | AI355: 6.0400000000000002e-002 | AJ355: =H355+100*O355 -> 298.5 | AK355: 267.4 | AL355: 354 | AM355: 167.1 | AN355: 352 | AO355: -3.5000000000000003e-002 | AP355: 30 | AQ355: 模塑转债!!
A356: 328 | B356: 113509 | C356: 新泉转债!! | D356: 603179 | E356: 新泉股份 | F356: 汽车 | G356: 零部件制 | H356: 213.29 | I356: -1.47e-002 | J356: -5.9999999999999995e-004 | K356: 30.86 | L356: -1.5600000000000001e-002 | M356: 109.3 | N356: 15.25 | O356: 5.4000000000000006e-002 | P356: 202.36 | Q356: 转股中 | R356: 2.88年 | S356: 0.89年 | T356: 0.78 | U356: 75 | V356: 0.441 | W356: 6.9999999999999993e-003 | X356: 1.3999999999999999e-002 | Y356: 114 | Z356: 3.22 | AA356: -0.20899999999999999 | AB356: -0.214 | AC356: -0.495 | AD356: -0.496 | AE356: 97.76 | AF356: 97.94 | AG356: 0.98 | AH356: AA | AI356: 3.9399999999999998e-002 | AJ356: =H356+100*O356 -> 218.69 | AK356: 224.2 | AL356: 348 | AM356: 126.3 | AN356: 346 | AO356: -5.0000000000000003e-002 | AP356: 13 | AQ356: 新泉转债!!
A357: 170 | B357: 128111 | C357: 中矿转债! | D357: 2738 | E357: 中矿资源 | F357: 有色金属 | G357: 有色行业 | H357: 409 | I357: -2.2499999999999999e-002 | J357: 1.7000000000000001e-003 | K357: 60.2 | L357: -2.1099999999999997e-002 | M357: 124.2 | N357: 15.42 | O357: 4.8000000000000001e-002 | P357: 390.4 | Q357: 转股中 | R357: 4.90年 | S357: 2.90年 | T357: 1.52 | U357: 1160. | V357: 1.8 | W357: 8.0000000000000002e-003 | X357: 3.1e-002 | Y357: 194 | Z357: 5.68 | AA357: -0.21899999999999997 | AB357: -0.22500000000000001 | AC357: -0.19 | AD357: -0.191 | AE357: 86.67 | AF357: 92.99 | AG357: 0.98 | AH357: AA- | AI357: 6.2199999999999998e-002 | AJ357: =H357+100*O357 -> 413.80000000000001 | AK357: 427.6 | AL357: 364 | AM357: 334.6 | AN357: 364 | AO357: 0.20300000000000001 | AP357: 9 | AQ357: 中矿转债!
A358: 301 | B358: 113526 | C358: 联泰转债! | D358: 603797 | E358: 联泰环保 | F358: 城市公用 | G358: 三废处理 | H358: 262.54 | I358: 8.0000000000000004e-004 | J358: -5.6999999999999993e-003 | K358: 7.11 | L358: -6.9999999999999993e-003 | M358: 110.3 | N358: 6.11 | O358: 1.26 | P358: 116.37 | Q358: 转股中 | R358: 3.52年 | S358: 1.52年 | T358: 1.93 | U358: 83 | V358: 0.16200000000000001 | W358: 4.5999999999999999e-002 | X358: 5.4000000000000006e-002 | Y358: 42 | Z358: 1.87 | AA358: -0.221 | AB358: -0.22500000000000001 | AC358: -0.33500000000000002 | AD358: -0.33600000000000002 | AE358: 96.54 | AF358: 96.91 | AG358: 0.71 | AH358: AA+ | AI358: 3.8199999999999998e-002 | AJ358: =H358+100*O358 -> 388.54000000000002 | AK358: 408.7 | AL358: 363 | AM358: 311.8 | AN358: 363 | AO358: -4.0000000000000001e-002 | AP358: 9 | AQ358: 联泰转债!
A359: 344 | B359: 128030 | C359: 天康转债!! | D359: 2100 | E359: 天康生物 | F359: 农业 | G359: 畜牧业 | H359: 203.996 | I359: 4.3e-003 | J359: -1.34e-002 | K359: 8.09 | L359: -9.7999999999999997e-003 | M359: 111.3 | N359: 7.39 | O359: 0.86299999999999999 | P359: 109.47 | Q359: 转股中 | R359: 2.44年 | S359: 0.44年 | T359: 0.89 | U359: 17 | V359: 9.6999999999999989e-002 | W359: 1.e-002 | X359: 1.1000000000000001e-002 | Y359: 87 | Z359: 1.33 | AA359: -0.223 | AB359: -0.22899999999999998 | AC359: -0.86699999999999999 | AD359: -0.87 | AE359: 99.47 | AF359: 101.48 | AG359: 0.93 | AH359: AA | AI359: 3.9399999999999998e-002 | AJ359: =H359+100*O359 -> 290.29599999999999 | AK359: 298.5 | AL359: 356 | AM359: 197 | AN359: 356 | AO359: -6.7000000000000004e-002 | AP359: 11 | AQ359: 天康转债!!
A360: 218 | B360: 128095 | C360: 恩捷转债!! | D360: 2812 | E360: 恩捷股份 | F360: 电子 | G360: 元器件制 | H360: 387 | I360: -8.2899999999999988e-002 | J360: -1.5800000000000002e-002 | K360: 245.7 | L360: -0.10000000000000001 | M360: 114.9 | N360: 64.92 | O360: 2.3e-002 | P360: 378.47 | Q360: 转股中 | R360: 4.57年 | S360: 2.58年 | T360: 4.54 | U360: 724 | V360: 0.39600000000000002 | W360: 2.e-003 | X360: 8.0000000000000002e-003 | Y360: 2191. | Z360: 18.93 | AA360: -0.23600000000000002 | AB360: -0.23999999999999999 | AC360: -0.21899999999999997 | AD360: -0.22 | AE360: 92.67 | AF360: 95.88 | AG360: 0.99 | AH360: AA | AI360: 4.1200000000000001e-002 | AJ360: =H360+100*O360 -> 389.30000000000001 | AK360: 395.5 | AL360: 360 | AM360: 299.7 | AN360: 360 | AO360: 6.5000000000000002e-002 | AP360: 15 | AQ360: 恩捷转债!!
A361: 325 | B361: 110044 | C361: 广电转债!! | D361: 600831 | E361: 广电网络 | F361: 传媒娱乐 | G361: 影视娱乐 | H361: 244.45 | I361: -1.5600000000000001e-002 | J361: 1.1699999999999999e-002 | K361: 5.54 | L361: -1.6e-002 | M361: 111.3 | N361: 6.9 | O361: 2.04 | P361: 80.29 | Q361: 转股中 | R361: 2.95年 | S361: 0.95年 | T361: 0.71 | U361: 133 | V361: 0.76700000000000002 | W361: 1.8000000000000002e-002 | X361: 1.3999999999999999e-002 | Y361: 39 | Z361: 1.05 | AA361: -0.23699999999999999 | AB361: -0.24199999999999999 | AC361: -0.51800000000000002 | AD361: -0.51900000000000002 | AE361: 97.52 | AF361: 99.49 | AG361: 0.24 | AH361: AA | AI361: 3.9399999999999998e-002 | AJ361: =H361+100*O361 -> 448.44999999999999 | AK361: 408.6 | AL361: 362 | AM361: 309.1 | AN361: 362 | AO361: -4.5999999999999999e-002 | AP361: 10 | AQ361: 广电转债!!
A362: 267 | B362: 123027 | C362: 蓝晓转债! | D362: 300487 | E362: 蓝晓科技 | F362: 化工 | G362: 化工 | H362: 337.74 | I362: 4.0000000000000001e-003 | J362: 2.0799999999999999e-002 | K362: 88.46 | L362: 2.53e-002 | M362: 118.8 | N362: 29.02 | O362: 0.10800000000000001 | P362: 304.82 | Q362: 转股中 | R362: 3.90年 | S362: 1.90年 | T362: 1.07 | U362: 1669. | V362: 4.5 | W362: 6.0000000000000001e-003 | X362: 1.7000000000000001e-002 | Y362: 194 | Z362: 10.53 | AA362: -0.23800000000000002 | AB362: -0.24399999999999999 | AC362: -0.29799999999999999 | AD362: -0.29899999999999999 | AE362: 89.72 | AF362: 90.77 | AG362: 0.98 | AH362: A+ | AI362: 7.3200000000000001e-002 | AJ362: =H362+100*O362 -> 348.54000000000002 | AK362: 370.7 | AL362: 359 | AM362: 279.9 | AN362: 359 | AO362: 7.6999999999999999e-002 | AP362: 19 | AQ362: 蓝晓转债!
A363: 339 | B363: 123007 | C363: 道氏转债!! | D363: 300409 | E363: 道氏技术 | F363: 建筑 | G363: 建筑行业 | H363: 214.5 | I363: -3.2899999999999999e-002 | J363: 1.6500000000000001e-002 | K363: 30.49 | L363: -1.6500000000000001e-002 | M363: 110.3 | N363: 14.5 | O363: 2.e-002 | P363: 210.28 | Q363: 转股中 | R363: 2.45年 | S363: 0.45年 | T363: 1.65 | U363: 1485. | V363: 4.0899999999999999 | W363: 1.e-002 | X363: 2.e-002 | Y363: 171 | Z363: 4.61 | AA363: -0.24100000000000002 | AB363: -0.24600000000000002 | AC363: -0.88400000000000001 | AD363: -0.88700000000000001 | AE363: 98.19 | AF363: 95.78 | AG363: 1 | AH363: AA- | AI363: 6.0400000000000002e-002 | AJ363: =H363+100*O363 -> 216.5 | AK363: 218.7 | AL363: 345 | AM363: 120.5 | AN363: 344 | AO363: 0.318 | AP363: 23 | AQ363: 道氏转债!!
A364: 369 | B364: 110033 | C364: 国贸转债! | D364: 600755 | E364: 厦门国贸 | F364: 交通运输 | G364: 交通运输 | H364: 123.18 | I364: 1.89e-002 | J364: 1.0500000000000001e-002 | K364: 8.3 | L364: 3.2300000000000002e-002 | M364: 108 | N364: 6.72 | O364: -3.0000000000000001e-003 | P364: 123.51 | Q364: 转股中 | R364: 0.47年 | S364: 回售内 | T364: 11.7 | U364: 720 | V364: 0.48399999999999999 | W364: 7.2000000000000008e-002 | X364: 8.900000000000001e-002 | Y364: 162 | Z364: 1 | AA364: -0.24199999999999999 | AB364: -0.26600000000000001 | AC364: 回售内 | AD364: 回售内 | AE364: 100.33 | AF364: 106.6 | AG364: 0.91 | AH364: AAA | AI364: 2.7900000000000001e-002 | AJ364: =H364+100*O364 -> 122.88000000000001 | AK364: 122.8 | AL364: 30 | AM364: 16.2 | AN364: 4 | AO364: 4.0000000000000001e-002 | AP364: 20 | AQ364: 国贸转债!
A365: 256 | B365: 123031 | C365: 晶瑞转债! | D365: 300655 | E365: 晶瑞股份 | F365: 化工 | G365: 化工 | H365: 407 | I365: 1.7500000000000002e-002 | J365: -4.4000000000000003e-003 | K365: 37.32 | L365: 1.3300000000000001e-002 | M365: 115.8 | N365: 10.13 | O365: 0.105 | P365: 368.41 | Q365: 转股中 | R365: 4年43天 | S365: 2年44天 | T365: 0.53 | U365: 2023. | V365: 9.0800000000000001 | W365: 4.0000000000000001e-003 | X365: 1.6e-002 | Y365: 127 | Z365: 5.3 | AA365: -0.26600000000000001 | AB365: -0.27100000000000002 | AC365: -0.28300000000000003 | AD365: -0.28399999999999997 | AE365: 88.05 | AF365: 87.12 | AG365: 0.99 | AH365: A+ | AI365: 7.3200000000000001e-002 | AJ365: =H365+100*O365 -> 417.5 | AK365: 445.6 | AL365: 366 | AM365: 357.5 | AN365: 366 | AO365: 0.10000000000000001 | AP365: 16 | AQ365: 晶瑞转债!
A366: 314 | B366: 123015 | C366: 蓝盾转债!! | D366: 300297 | E366: 蓝盾股份 | F366: 计算机及 | G366: 软件开发 | H366: 288 | I366: -1.95e-002 | J366: 9.5999999999999992e-003 | K366: 4.82 | L366: -1.83e-002 | M366: 112.3 | N366: 5.79 | O366: 2.46 | P366: 83.25 | Q366: 转股中 | R366: 3年27天 | S366: 1年28天 | T366: 1 | U366: 1587. | V366: 5.4100000000000001 | W366: 1.7000000000000001e-002 | X366: 1.3999999999999999e-002 | Y366: 60 | Z366: 2.31 | AA366: -0.26800000000000002 | AB366: -0.27200000000000002 | AC366: -0.50600000000000001 | AD366: -0.50700000000000001 | AE366: 89.12 | AF366: 79.27 | AG366: 0.54 | AH366: BBB- | AI366: 0.1232 | AJ366: =H366+100*O366 -> 534. | AK366: 492.8 | AL366: 367 | AM366: 403.6 | AN366: 367 | AO366: 8.0000000000000002e-002 | AP366: 16 | AQ366: 蓝盾转债!!
A367: 345 | B367: 128029 | C367: 太阳转债!! | D367: 2078 | E367: 太阳纸业 | F367: 造纸包装 | G367: 造纸行业 | H367: 172.256 | I367: 2.0499999999999997e-002 | J367: 3.4999999999999996e-003 | K367: 12.79 | L367: 2.4e-002 | M367: 107 | N367: 8.45 | O367: 0.13800000000000001 | P367: 151.36 | Q367: 转股中 | R367: 1.44年 | S367: 回售内 | T367: 9.09 | U367: 89 | V367: 5.7000000000000002e-002 | W367: 2.7000000000000003e-002 | X367: 4.0999999999999995e-002 | Y367: 336 | Z367: 1.96 | AA367: -0.28399999999999997 | AB367: -0.28999999999999998 | AC367: 回售内 | AD367: 回售内 | AE367: 100.17 | AF367: 101.68 | AG367: 1 | AH367: AA+ | AI367: 3.6400000000000002e-002 | AJ367: =H367+100*O367 -> 186.05600000000001 | AK367: 193.2 | AL367: 337 | AM367: 91.5 | AN367: 330 | AO367: -2.6000000000000002e-002 | AP367: 7 | AQ367: 太阳转债!!
A368: 321 | B368: 128041 | C368: 盛路转债!! | D368: 2446 | E368: 盛路通信 | F368: 通信互联 | G368: 通信设备 | H368: 316 | I368: -4.24e-002 | J368: 4.1200000000000001e-002 | K368: 5.96 | L368: -3.3e-003 | M368: 114.3 | N368: 6.82 | O368: 2.6200000000000001 | P368: 87.39 | Q368: 转股中 | R368: 3年0.1天 | S368: 1年1.1天 | T368: 0.53 | U368: 899 | V368: 5.2699999999999996 | W368: 1.e-002 | X368: 9.0000000000000011e-003 | Y368: 54 | Z368: 1.76 | AA368: -0.29100000000000004 | AB368: -0.29699999999999999 | AC368: -0.56899999999999995 | AD368: -0.56999999999999995 | AE368: 98.11 | AF368: 101.54 | AG368: 0.38 | AH368: AA | AI368: 4.1200000000000001e-002 | AJ368: =H368+100*O368 -> 578. | AK368: 544.6 | AL368: 368 | AM368: 443.1 | AN368: 368 | AO368: -9.8000000000000004e-002 | AP368: 12 | AQ368: 盛路转债!!
A369: 318 | B369: 123013 | C369: 横河转债! | D369: 300539 | E369: 横河精密 | F369: 机械装备 | G369: 专用设备 | H369: 377.178 | I369: -2.0299999999999999e-002 | J369: 1.5300000000000001e-002 | K369: 7.9 | L369: -1.1299999999999999e-002 | M369: 115.2 | N369: 9.04 | O369: 3.3199999999999998 | P369: 87.39 | Q369: 转股中 | R369: 3年9天 | S369: 1年10天 | T369: 0.38 | U369: 375 | V369: 2.5800000000000001 | W369: 2.2000000000000002e-002 | X369: 1.9e-002 | Y369: 18 | Z369: 3.53 | AA369: -0.32899999999999996 | AB369: -0.33399999999999996 | AC369: -0.59799999999999998 | AD369: -0.59899999999999998 | AE369: 95.12 | AF369: 93.6 | AG369: 0.44 | AH369: A+ | AI369: 7.3200000000000001e-002 | AJ369: =H369+100*O369 -> 709.178 | AK369: 667 | AL369: 369 | AM369: 571.8 | AN369: 369 | AO369: -1.3999999999999999e-002 | AP369: 13 | AQ369: 横河转债!
A370: 356 | B370: 113016 | C370: 小康转债!! | D370: 601127 | E370: 小康股份 | F370: 汽车 | G370: 零部件制 | H370: 414.95 | I370: -2.4900000000000002e-002 | J370: -7.7000000000000002e-003 | K370: 65.23 | L370: -3.2899999999999999e-002 | M370: 109.3 | N370: 16.96 | O370: 7.9000000000000001e-002 | P370: 384.61 | Q370: 转股中 | R370: 2.31年 | S370: 0.31年 | T370: 2.39 | U370: 831 | V370: 0.81900000000000006 | W370: 3.0000000000000001e-003 | X370: 1.e-002 | Y370: 886 | Z370: 17.97 | AA370: -0.41799999999999998 | AB370: -0.42100000000000004 | AC370: -1.6699999999999999 | AD370: -1.6719999999999999 | AE370: 99.01 | AF370: 95.71 | AG370: 0.99 | AH370: AA- | AI370: 6.0400000000000002e-002 | AJ370: =H370+100*O370 -> 422.84999999999997 | AK370: 445.3 | AL370: 365 | AM370: 346.3 | AN370: 365 | AO370: -7.2000000000000008e-002 | AP370: 40 | AQ370: 小康转债!!