A1: 序号 | B1: 转债代码 | C1: 转债名称 | D1: 股票代码 | E1: 股票名称 | F1: 行业 | G1: 子行业 | H1: 转债价格 | I1: 涨跌 | J1: 日内套利 | K1: 股价 | L1: 涨跌 | M1: 剩余本息 | N1: 转股价格 | O1: 转股溢价率 | P1: 转股价值 | Q1: 距离转股日 | R1: 剩余年限 | S1: 回售年限 | T1: 转债余额 | U1: 转债成交额 | V1: 转债换手率 | W1: 余额/市值 | X1: 余额/股本 | Y1: 股票市值 | Z1: P/B | AA1: 税前收益率 | AB1: 税后收益率 | AC1: 税前回售收益 | AD1: 税后回售收益 | AE1: 回售价值 | AF1: 纯债价值 | AG1: 弹性 | AH1: 信用 | AI1: 折现率 | AJ1: 双低 | AK1: 老式双低 | AL1: 老式排名 | AM1: 新式双低 | AN1: 新式排名 | AO1: MA20乖离 | AP1: 热门度 | AQ1: 转债名称
A2: 1 | B2: 113052 | C2: N兴业转 | D2: 601166 | E2: 兴业银行 | F2: 金融 | G2: 银行行业 | H2: 111.06 | I2: 0.111 | J2: 0. | K2: 20.66 | L2: -2.7300000000000001e-002 | M2: 114.4 | N2: 25.51 | O2: 0.371 | P2: 80.99 | Q2: 5月15天 | R2: 5.95年 | S2: 无权 | T2: 500 | U2: 29996. | V2: 0.53900000000000003 | W2: 0.11599999999999999 | X2: 9.4e-002 | Y2: 4292. | Z2: 0.74 | AA2: 5.1000000000000004e-003 | AB2: 7.000000000000001e-004 | AC2: 无权 | AD2: 无权 | AE2: 无权 | AF2: 94.19 | AG2: 0.37 | AH2: AAA | AI2: 3.3799999999999997e-002 | AJ2: =H2+100*O2 -> 148.16 | AK2: 141.1 | AL2: 27 | AM2: 46.9 | AN2: 54 | AO2: 4.7e-002 | AP2: 5 | AQ2: N兴业转
A3: 2 | B3: 123132 | C3: 回盛转债 | D3: 300871 | E3: 回盛生物 | F3: 医药 | G3: 医药行业 | H3: 136.8 | I3: -1.3000000000000001e-002 | J3: 1.46e-002 | K3: 29.63 | L3: 2.3999999999999998e-003 | M3: 121 | N3: 28.32 | O3: 0.308 | P3: 104.63 | Q3: 5月8天 | R3: 5.92年 | S3: 3.92年 | T3: 7 | U3: 41 | V3: 4.2999999999999997e-002 | W3: 0.14199999999999999 | X3: 0.14899999999999999 | Y3: 49 | Z3: 3.39 | AA3: -2.0899999999999998e-002 | AB3: -2.6699999999999998e-002 | AC3: -6.5599999999999992e-002 | AD3: -6.7199999999999996e-002 | AE3: 81.53 | AF3: 85.44 | AG3: 0.68 | AH3: AA- | AI3: 6.1799999999999994e-002 | AJ3: =H3+100*O3 -> 167.60000000000002 | AK3: 169 | AL3: 246 | AM3: 83.5 | AN3: 276 | AO3: 2.9999999999999999e-002 | AP3: 1 | AQ3: 回盛转债
A4: 3 | B4: 113636 | C4: 甬金转债 | D4: 603995 | E4: 甬金股份 | F4: 钢铁 | G4: 钢铁行业 | H4: 141.43 | I4: -1.11e-002 | J4: 2.3e-003 | K4: 57.4 | L4: -1.26e-002 | M4: 120.6 | N4: 53.07 | O4: 0.308 | P4: 108.16 | Q4: 5月2天 | R4: 5.91年 | S4: 3.91年 | T4: 10 | U4: 50 | V4: 3.5000000000000003e-002 | W4: 7.4999999999999997e-002 | X4: 8.1000000000000003e-002 | Y4: 134 | Z4: 3.9 | AA4: -2.7000000000000003e-002 | AB4: -3.27e-002 | AC4: -7.4200000000000002e-002 | AD4: -7.5600000000000001e-002 | AE4: 81.23 | AF4: 85.14 | AG4: 0.7 | AH4: AA- | AI4: 6.1799999999999994e-002 | AJ4: =H4+100*O4 -> 172.23000000000002 | AK4: 174.7 | AL4: 273 | AM4: 89.6 | AN4: 292 | AO4: 3.0000000000000001e-003 | AP4: 2 | AQ4: 甬金转债
A5: 4 | B5: 113635 | C5: 升21转债 | D5: 603305 | E5: 旭升股份 | F5: 汽车 | G5: 零部件制 | H5: 140.79 | I5: 2.12e-002 | J5: 0. | K5: 46.96 | L5: 3.2099999999999997e-002 | M5: 119.6 | N5: 46.37 | O5: 0.39000000000000001 | P5: 101.27 | Q5: 5月1天 | R5: 5.90年 | S5: 3.90年 | T5: 13.5 | U5: 105 | V5: 5.5e-002 | W5: 6.4000000000000001e-002 | X5: 6.5000000000000002e-002 | Y5: 210 | Z5: 5.99 | AA5: -2.7699999999999999e-002 | AB5: -3.3099999999999997e-002 | AC5: -7.3700000000000002e-002 | AD5: -7.51e-002 | AE5: 81.14 | AF5: 84.45 | AG5: 0.66 | AH5: AA- | AI5: 6.1799999999999994e-002 | AJ5: =H5+100*O5 -> 179.78999999999999 | AK5: 180.3 | AL5: 295 | AM5: 95.9 | AN5: 306 | AO5: -5.0000000000000001e-003 | AP5: 2 | AQ5: 升21转债
A6: 5 | B6: 111002 | C6: 特纸转债 | D6: 605007 | E6: 五洲特纸 | F6: 造纸包装 | G6: 包装用纸 | H6: 159.14 | I6: -2.2099999999999998e-002 | J6: 1.2800000000000001e-002 | K6: 23.24 | L6: -1.23e-002 | M6: 117.1 | N6: 18.5 | O6: 0.26700000000000002 | P6: 125.62 | Q6: 4月29天 | R6: 5.89年 | S6: 3.89年 | T6: 6.7 | U6: 41 | V6: 3.7999999999999999e-002 | W6: 7.2000000000000008e-002 | X6: 9.0999999999999998e-002 | Y6: 93 | Z6: 4.94 | AA6: -5.1500000000000004e-002 | AB6: -5.6100000000000004e-002 | AC6: -0.10099999999999999 | AD6: -0.10199999999999999 | AE6: 88.19 | AF6: 92.89 | AG6: 0.76 | AH6: AA | AI6: 4.0800000000000003e-002 | AJ6: =H6+100*O6 -> 185.83999999999997 | AK6: 192.7 | AL6: 318 | AM6: 99.8 | AN6: 315 | AO6: 5.0999999999999997e-002 | AP6: 1 | AQ6: 特纸转债
A7: 6 | B7: 113634 | C7: 珀莱转债 | D7: 603605 | E7: 珀莱雅 | F7: 化工 | G7: 日化 | H7: 134.41 | I7: -2.2000000000000001e-003 | J7: 2.e-003 | K7: 184.49 | L7: -5.0000000000000001e-004 | M7: 120.1 | N7: 195.98 | O7: 0.42799999999999999 | P7: 94.14 | Q7: 4月29天 | R7: 5.89年 | S7: 3.89年 | T7: 7.52 | U7: 69 | V7: 6.8000000000000005e-002 | W7: 2.e-002 | X7: 1.9e-002 | Y7: 371 | Z7: 14.19 | AA7: -1.9199999999999998e-002 | AB7: -2.4900000000000002e-002 | AC7: -6.25e-002 | AD7: -6.4000000000000001e-002 | AE7: 88.19 | AF7: 95.26 | AG7: 0.51 | AH7: AA | AI7: 4.0800000000000003e-002 | AJ7: =H7+100*O7 -> 177.20999999999998 | AK7: 174.7 | AL7: 272 | AM7: 79.4 | AN7: 265 | AO7: -8.6999999999999994e-002 | AP7: 4 | AQ7: 珀莱转债
A8: 7 | B8: 123131 | C8: 奥飞转债 | D8: 300738 | E8: 奥飞数据 | F8: 通信互联 | G8: 通信设备 | H8: 142.317 | I8: 7.8000000000000005e-003 | J8: -4.6999999999999993e-003 | K8: 22.78 | L8: 4.4000000000000003e-003 | M8: 121.7 | N8: 22.02 | O8: 0.376 | P8: 103.45 | Q8: 4月24天 | R8: 5.88年 | S8: 3.88年 | T8: 6.35 | U8: 23 | V8: 2.5000000000000001e-002 | W8: 7.2999999999999995e-002 | X8: 7.5999999999999998e-002 | Y8: 87 | Z8: 6.17 | AA8: -2.6800000000000001e-002 | AB8: -3.2799999999999996e-002 | AC8: -7.3899999999999993e-002 | AD8: -7.5800000000000006e-002 | AE8: 78.98 | AF8: 81.28 | AG8: 0.71 | AH8: A+ | AI8: 7.2800000000000004e-002 | AJ8: =H8+100*O8 -> 179.917 | AK8: 181.2 | AL8: 296 | AM8: 99.9 | AN8: 316 | AO8: 1.1000000000000001e-002 | AP8: 2 | AQ8: 奥飞转债
A9: 8 | B9: 113633 | C9: 科沃转债! | D9: 603486 | E9: 科沃斯 | F9: 机械装备 | G9: 机器人及 | H9: 126.74 | I9: -1.06e-002 | J9: 3.4000000000000002e-003 | K9: 140.5 | L9: -1.8200000000000001e-002 | M9: 115.1 | N9: 178.28 | O9: 0.60799999999999998 | P9: 78.81 | Q9: 4月21天 | R9: 5.87年 | S9: 3.87年 | T9: 10.4 | U9: 42 | V9: 3.2000000000000001e-002 | W9: 1.3000000000000001e-002 | X9: 1.e-002 | Y9: 805 | Z9: 19.04 | AA9: -1.6500000000000001e-002 | AB9: -2.1000000000000001e-002 | AC9: -4.9000000000000002e-002 | AD9: -5.0599999999999999e-002 | AE9: 88.26 | AF9: 91.39 | AG9: 0.4 | AH9: AA | AI9: 4.0800000000000003e-002 | AJ9: =H9+100*O9 -> 187.53999999999999 | AK9: 174.7 | AL9: 271 | AM9: 83.3 | AN9: 275 | AO9: -5.9000000000000004e-002 | AP9: 5 | AQ9: 科沃转债!
A10: 9 | B10: 118003 | C10: 华兴转债 | D10: 688001 | E10: 华兴源创 | F10: 机械装备 | G10: 专用设备 | H10: 131.11 | I10: 1.1000000000000001e-003 | J10: -8.6999999999999994e-003 | K10: 35.65 | L10: -1.46e-002 | M10: 115.1 | N10: 39.33 | O10: 0.44600000000000001 | P10: 90.64 | Q10: 4月18天 | R10: 5.87年 | S10: 3.87年 | T10: 8 | U10: 7.5 | V10: 6.9999999999999993e-003 | W10: 5.0999999999999997e-002 | X10: 4.5999999999999999e-002 | Y10: 157 | Z10: 4.61 | AA10: -2.23e-002 | AB10: -2.6699999999999998e-002 | AC10: -5.7099999999999998e-002 | AD10: -5.8600000000000006e-002 | AE10: 88.27 | AF10: 91.4 | AG10: 0.52 | AH10: AA | AI10: 4.0800000000000003e-002 | AJ10: =H10+100*O10 -> 175.71000000000001 | AK10: 171.6 | AL10: 259 | AM10: 80.2 | AN10: 268 | AO10: -4.0000000000000001e-003 | AP10: 3 | AQ10: 华兴转债
A11: 10 | B11: 127051 | C11: 博杰转债 | D11: 2975 | E11: 博杰股份 | F11: 机械装备 | G11: 机器人及 | H11: 137.48 | I11: 6.5000000000000006e-003 | J11: 1.2500000000000001e-002 | K11: 64.98 | L11: 2.8199999999999999e-002 | M11: 121.1 | N11: 62.17 | O11: 0.315 | P11: 104.52 | Q11: 4月7天 | R11: 5.84年 | S11: 4.84年 | T11: 5.26 | U11: 6.4 | V11: 9.0000000000000011e-003 | W11: 5.7999999999999996e-002 | X11: 6.0999999999999999e-002 | Y11: 91 | Z11: 6.13 | AA11: -2.1899999999999999e-002 | AB11: -2.7799999999999998e-002 | AC11: -5.0199999999999995e-002 | AD11: -5.2499999999999998e-002 | AE11: 79.34 | AF11: 85.94 | AG11: 0.68 | AH11: AA- | AI11: 6.1799999999999994e-002 | AJ11: =H11+100*O11 -> 168.97999999999999 | AK11: 170.4 | AL11: 252 | AM11: 84.5 | AN11: 281 | AO11: 5.0999999999999997e-002 | AP11: 2 | AQ11: 博杰转债
A12: 11 | B12: 113632 | C12: 鹤21转债 | D12: 603733 | E12: 仙鹤股份 | F12: 造纸包装 | G12: 造纸行业 | H12: 136 | I12: -1.9e-003 | J12: -2.2000000000000001e-003 | K12: 38.5 | L12: -7.1999999999999998e-003 | M12: 117.1 | N12: 39.09 | O12: 0.38100000000000001 | P12: 98.49 | Q12: 4月7天 | R12: 5.84年 | S12: 3.84年 | T12: 20.5 | U12: 2.7 | V12: 1.e-003 | W12: 7.4999999999999997e-002 | X12: 7.400000000000001e-002 | Y12: 272 | Z12: 4.5 | AA12: -2.5699999999999997e-002 | AB12: -3.0600000000000002e-002 | AC12: -6.6100000000000006e-002 | AD12: -6.7699999999999996e-002 | AE12: 88.39 | AF12: 93.1 | AG12: 0.56 | AH12: AA | AI12: 4.0800000000000003e-002 | AJ12: =H12+100*O12 -> 174.09999999999999 | AK12: 173.5 | AL12: 265 | AM12: 80.4 | AN12: 269 | AO12: -2.8999999999999998e-002 | AP12: 2 | AQ12: 鹤21转债
A13: 12 | B13: 127050 | C13: 麒麟转债 | D13: 2984 | E13: 森麒麟 | F13: 汽车 | G13: 零部件制 | H13: 136.95 | I13: -1.6e-002 | J13: 1.54e-002 | K13: 30.56 | L13: -1.2999999999999999e-003 | M13: 115.1 | N13: 34.85 | O13: 0.56200000000000006 | P13: 87.69 | Q13: 4月1天 | R13: 5.82年 | S13: 3.82年 | T13: 22 | U13: 27 | V13: 9.0000000000000011e-003 | W13: 0.111 | X13: 9.6999999999999989e-002 | Y13: 199 | Z13: 3.25 | AA13: -2.9900000000000003e-002 | AB13: -3.4300000000000004e-002 | AC13: -6.8099999999999994e-002 | AD13: -6.9599999999999995e-002 | AE13: 88.45 | AF13: 91.58 | AG13: 0.48 | AH13: AA | AI13: 4.0800000000000003e-002 | AJ13: =H13+100*O13 -> 193.14999999999998 | AK13: 186.2 | AL13: 304 | AM13: 94.6 | AN13: 301 | AO13: -0.129 | AP13: 3 | AQ13: 麒麟转债
A14: 13 | B14: 110083 | C14: 苏租转债 | D14: 600901 | E14: 江苏租赁 | F14: 金融 | G14: 其他 | H14: 118.92 | I14: -6.0000000000000001e-003 | J14: -1.2999999999999999e-003 | K14: 5.14 | L14: -1.34e-002 | M14: 110.5 | N14: 5.42 | O14: 0.254 | P14: 94.83 | Q14: 4月1天 | R14: 5.82年 | S14: 无权 | T14: 50 | U14: 22 | V14: 4.0000000000000001e-003 | W14: 0.32600000000000001 | X14: 0.309 | Y14: 154 | Z14: 1.12 | AA14: -1.2699999999999999e-002 | AB14: -1.5900000000000001e-002 | AC14: 无权 | AD14: 无权 | AE14: 无权 | AF14: 91.28 | AG14: 0.54 | AH14: AAA | AI14: 3.3799999999999997e-002 | AJ14: =H14+100*O14 -> 144.31999999999999 | AK14: 143 | AL14: 37 | AM14: 51.7 | AN14: 86 | AO14: 1.e-003 | AP14: 5 | AQ14: 苏租转债
A15: 14 | B15: 123130 | C15: 设研转债 | D15: 300732 | E15: 设研院 | F15: 建筑 | G15: 建筑工程 | H15: 131.911 | I15: -2.86e-002 | J15: 1.52e-002 | K15: 12.24 | L15: -2.0799999999999999e-002 | M15: 117.1 | N15: 11.24 | O15: 0.21100000000000002 | P15: 108.9 | Q15: 4月1天 | R15: 5.82年 | S15: 3.82年 | T15: 3.76 | U15: 12 | V15: 2.5000000000000001e-002 | W15: 0.11199999999999999 | X15: 0.122 | Y15: 34 | Z15: 1.33 | AA15: -2.06e-002 | AB15: -2.5600000000000001e-002 | AC15: -5.9200000000000003e-002 | AD15: -6.08e-002 | AE15: 88.45 | AF15: 93.16 | AG15: 0.65 | AH15: AA | AI15: 4.0800000000000003e-002 | AJ15: =H15+100*O15 -> 153.011 | AK15: 154.9 | AL15: 148 | AM15: 61.8 | AN15: 155 | AO15: 5.0000000000000001e-003 | AP15: 3 | AQ15: 设研转债
A16: 15 | B16: 111001 | C16: 山玻转债 | D16: 605006 | E16: 山东玻纤 | F16: 其他 | G16: 非金属矿 | H16: 128.3 | I16: -1.4199999999999999e-002 | J16: -2.9999999999999997e-004 | K16: 13.57 | L16: -2.3e-002 | M16: 120.1 | N16: 13.91 | O16: 0.315 | P16: 97.56 | Q16: 3月26天 | R16: 5.81年 | S16: 3.81年 | T16: 6 | U16: 14 | V16: 1.8000000000000002e-002 | W16: 8.8000000000000009e-002 | X16: 8.5999999999999993e-002 | Y16: 68 | Z16: 3.15 | AA16: -1.15e-002 | AB16: -1.7299999999999999e-002 | AC16: -5.2699999999999997e-002 | AD16: -5.4299999999999994e-002 | AE16: 81.77 | AF16: 85.28 | AG16: 0.63 | AH16: AA- | AI16: 6.1799999999999994e-002 | AJ16: =H16+100*O16 -> 159.80000000000001 | AK16: 159 | AL16: 177 | AM16: 73.8 | AN16: 240 | AO16: -2.e-002 | AP16: 3 | AQ16: 山玻转债
A17: 16 | B17: 113631 | C17: 皖天转债 | D17: 603689 | E17: 皖天然气 | F17: 石油天然 | G17: 天然气 | H17: 122.09 | I17: -1.2500000000000001e-002 | J17: 2.3e-003 | K17: 10.52 | L17: -1.9599999999999999e-002 | M17: 114.5 | N17: 11.12 | O17: 0.29100000000000004 | P17: 94.6 | Q17: 3月26天 | R17: 5.81年 | S17: 3.81年 | T17: 9.3 | U17: 13 | V17: 1.1000000000000001e-002 | W17: 0.26300000000000001 | X17: 0.249 | Y17: 35 | Z17: 1.44 | AA17: -1.11e-002 | AB17: -1.55e-002 | AC17: -4.2000000000000003e-002 | AD17: -4.3400000000000001e-002 | AE17: 89.62 | AF17: 93.6 | AG17: 0.52 | AH17: AA+ | AI17: 3.5799999999999998e-002 | AJ17: =H17+100*O17 -> 151.19 | AK17: 149.6 | AL17: 94 | AM17: 56 | AN17: 115 | AO17: -8.0000000000000002e-003 | AP17: 3 | AQ17: 皖天转债
A18: 17 | B18: 123129 | C18: 锦鸡转债 | D18: 300798 | E18: 锦鸡股份 | F18: 化工 | G18: 其他 | H18: 126.34 | I18: -1.3100000000000001e-002 | J18: -5.9999999999999995e-004 | K18: 9.95 | L18: -1.9699999999999999e-002 | M18: 117.8 | N18: 9.53 | O18: 0.20999999999999999 | P18: 104.41 | Q18: 3月24天 | R18: 5.80年 | S18: 3.80年 | T18: 6 | U18: 8 | V18: 1.e-002 | W18: 0.14400000000000002 | X18: 0.151 | Y18: 42 | Z18: 3.33 | AA18: -1.2199999999999999e-002 | AB18: -1.7500000000000002e-002 | AC18: -4.8499999999999995e-002 | AD18: -5.0199999999999995e-002 | AE18: 82.08 | AF18: 83.77 | AG18: 0.69 | AH18: AA- | AI18: 6.1799999999999994e-002 | AJ18: =H18+100*O18 -> 147.34 | AK18: 148.3 | AL18: 82 | AM18: 64.5 | AN18: 170 | AO18: 3.0000000000000001e-003 | AP18: 3 | AQ18: 锦鸡转债
A19: 18 | B19: 127049 | C19: 希望转2 | D19: 876 | E19: 新 希 望 | F19: 农业 | G19: 畜牧业 | H19: 140.499 | I19: -1.1200000000000002e-002 | J19: -7.6e-003 | K19: 16.66 | L19: -2.69e-002 | M19: 111.2 | N19: 14.45 | O19: 0.21899999999999997 | P19: 115.29 | Q19: 3月22天 | R19: 5.80年 | S19: 3.80年 | T19: 81.5 | U19: 192 | V19: 1.7000000000000001e-002 | W19: 0.109 | X19: 0.125 | Y19: 751 | Z19: 2.46 | AA19: -4.0099999999999997e-002 | AB19: -4.3400000000000001e-002 | AC19: -7.5999999999999998e-002 | AD19: -7.7300000000000008e-002 | AE19: 90.25 | AF19: 91.97 | AG19: 0.7 | AH19: AAA | AI19: 3.3799999999999997e-002 | AJ19: =H19+100*O19 -> 162.399 | AK19: 165.7 | AL19: 230 | AM19: 73.7 | AN19: 239 | AO19: 5.9999999999999998e-002 | AP19: 8 | AQ19: 希望转2
A20: 19 | B20: 123128 | C20: 首华转债! | D20: 300483 | E20: 首华燃气 | F20: 石油天然 | G20: 天然气 | H20: 109.888 | I20: -1.41e-002 | J20: 5.5000000000000005e-003 | K20: 15.71 | L20: -3.9699999999999999e-002 | M20: 115.1 | N20: 25.02 | O20: 0.75 | P20: 62.79 | Q20: 3月19天 | R20: 5.79年 | S20: 3.79年 | T20: 13.8 | U20: 30 | V20: 2.e-002 | W20: 0.32700000000000001 | X20: 0.20499999999999999 | Y20: 42 | Z20: 1.5 | AA20: 8.199999999999999e-003 | AB20: 3.4999999999999996e-003 | AC20: -1.49e-002 | AD20: -1.66e-002 | AE20: 88.54 | AF20: 91.68 | AG20: 0.22 | AH20: AA | AI20: 4.0800000000000003e-002 | AJ20: =H20+100*O20 -> 184.88800000000001 | AK20: 157 | AL20: 163 | AM20: 65.3 | AN20: 178 | AO20: -0.109 | AP20: 8 | AQ20: 首华转债!
A21: 20 | B21: 123127 | C21: 耐普转债 | D21: 300818 | E21: 耐普矿机 | F21: 机械装备 | G21: 专用设备 | H21: 138.95 | I21: -3.5999999999999999e-003 | J21: 1.21e-002 | K21: 46.55 | L21: 1.04e-002 | M21: 116.2 | N21: 37 | O21: 0.10400000000000001 | P21: 125.81 | Q21: 3月18天 | R21: 5.79年 | S21: 3.79年 | T21: 4 | U21: 320 | V21: 0.56899999999999995 | W21: 0.12300000000000001 | X21: 0.154 | Y21: 33 | Z21: 3.46 | AA21: -3.1e-002 | AB21: -3.5699999999999996e-002 | AC21: -7.0599999999999996e-002 | AD21: -7.2499999999999995e-002 | AE21: 79.22 | AF21: 78.09 | AG21: 0.81 | AH21: A+ | AI21: 7.2800000000000004e-002 | AJ21: =H21+100*O21 -> 149.34999999999999 | AK21: 152.1 | AL21: 127 | AM21: 72.9 | AN21: 231 | AO21: 0.13300000000000001 | AP21: 4 | AQ21: 耐普转债
A22: 21 | B22: 110082 | C22: 宏发转债 | D22: 600885 | E22: 宏发股份 | F22: 能源电力 | G22: 电力设备 | H22: 135.32 | I22: 3.4000000000000002e-003 | J22: 9.1000000000000004e-003 | K22: 66.59 | L22: 2.4500000000000001e-002 | M22: 117.1 | N22: 72.28 | O22: 0.46899999999999997 | P22: 92.13 | Q22: 3月17天 | R22: 5.78年 | S22: 3.78年 | T22: 20 | U22: 21 | V22: 8.0000000000000002e-003 | W22: 4.0000000000000001e-002 | X22: 3.7000000000000005e-002 | Y22: 496 | Z22: 8.16 | AA22: -2.5099999999999997e-002 | AB22: -3.0099999999999998e-002 | AC22: -6.5799999999999997e-002 | AD22: -6.7400000000000002e-002 | AE22: 88.58 | AF22: 93.3 | AG22: 0.51 | AH22: AA | AI22: 4.0800000000000003e-002 | AJ22: =H22+100*O22 -> 182.22 | AK22: 178.5 | AL22: 289 | AM22: 85.2 | AN22: 283 | AO22: -4.9000000000000002e-002 | AP22: 5 | AQ22: 宏发转债
A23: 22 | B23: 113630 | C23: 赛伍转债 | D23: 603212 | E23: 赛伍技术 | F23: 能源电力 | G23: 太阳能 | H23: 136.78 | I23: -8.0000000000000004e-004 | J23: 1.4000000000000002e-003 | K23: 27.95 | L23: 1.1000000000000001e-003 | M23: 120.5 | N23: 32.9 | O23: 0.60999999999999999 | P23: 84.95 | Q23: 3月16天 | R23: 5.78年 | S23: 3.78年 | T23: 7 | U23: 9.2 | V23: 1.e-002 | W23: 6.2e-002 | X23: 5.2999999999999999e-002 | Y23: 113 | Z23: 5.61 | AA23: -2.2099999999999998e-002 | AB23: -2.7900000000000001e-002 | AC23: -6.8000000000000005e-002 | AD23: -6.9599999999999995e-002 | AE23: 82.14 | AF23: 85.78 | AG23: 0.54 | AH23: AA- | AI23: 6.1799999999999994e-002 | AJ23: =H23+100*O23 -> 197.78 | AK23: 188.6 | AL23: 309 | AM23: 102.8 | AN23: 323 | AO23: -7.0000000000000007e-002 | AP23: 4 | AQ23: 赛伍转债
A24: 23 | B24: 127048 | C24: 中大转债 | D24: 2896 | E24: 中大力德 | F24: 机械装备 | G24: 通用设备 | H24: 137.389 | I24: -2.5999999999999999e-003 | J24: 1.3999999999999999e-002 | K24: 23.83 | L24: 1.5800000000000002e-002 | M24: 121.7 | N24: 22.1 | O24: 0.27399999999999997 | P24: 107.83 | Q24: 3月15天 | R24: 5.78年 | S24: 3.78年 | T24: 2.7 | U24: 2.7 | V24: 6.9999999999999993e-003 | W24: 0.109 | X24: 0.11699999999999999 | Y24: 25 | Z24: 3.39 | AA24: -2.12e-002 | AB24: -2.7400000000000001e-002 | AC24: -6.7400000000000002e-002 | AD24: -6.9400000000000003e-002 | AE24: 79.55 | AF24: 81.87 | AG24: 0.72 | AH24: A+ | AI24: 7.2800000000000004e-002 | AJ24: =H24+100*O24 -> 164.78900000000002 | AK24: 166.9 | AL24: 239 | AM24: 85.1 | AN24: 282 | AO24: 5.0000000000000001e-003 | AP24: 3 | AQ24: 中大转债
A25: 24 | B25: 127047 | C25: 帝欧转债 | D25: 2798 | E25: 帝欧家居 | F25: 其他 | G25: 家居用品 | H25: 131.043 | I25: -2.35e-002 | J25: -1.e-004 | K25: 14.26 | L25: -3.4500000000000003e-002 | M25: 120.4 | N25: 13.53 | O25: 0.24299999999999999 | P25: 105.4 | Q25: 3月13天 | R25: 5.77年 | S25: 3.77年 | T25: 15 | U25: 32 | V25: 1.6e-002 | W25: 0.27200000000000002 | X25: 0.28699999999999998 | Y25: 55 | Z25: 1.21 | AA25: -1.4800000000000001e-002 | AB25: -2.07e-002 | AC25: -5.7999999999999996e-002 | AD25: -5.96e-002 | AE25: 82.07 | AF25: 85.7 | AG25: 0.68 | AH25: AA- | AI25: 6.1799999999999994e-002 | AJ25: =H25+100*O25 -> 155.34300000000002 | AK25: 156.7 | AL25: 160 | AM25: 71 | AN25: 220 | AO25: -3.7999999999999999e-002 | AP25: 4 | AQ25: 帝欧转债
A26: 25 | B26: 127046 | C26: 百润转债 | D26: 2568 | E26: 百润股份 | F26: 食品饮料 | G26: 葡萄酒洋 | H26: 132.25 | I26: -6.4000000000000003e-003 | J26: -8.0000000000000004e-004 | K26: 48.36 | L26: -2.3199999999999998e-002 | M26: 115.1 | N26: 66.89 | O26: 0.82900000000000007 | P26: 72.3 | Q26: 2月26天 | R26: 5.70年 | S26: 3.70年 | T26: 11.3 | U26: 5.2 | V26: 3.0000000000000001e-003 | W26: 3.1e-002 | X26: 2.2000000000000002e-002 | Y26: 363 | Z26: 10.32 | AA26: -2.4500000000000001e-002 | AB26: -2.8999999999999998e-002 | AC26: -6.1600000000000002e-002 | AD26: -6.3200000000000006e-002 | AE26: 88.86 | AF26: 92.01 | AG26: 0.31 | AH26: AA | AI26: 4.0800000000000003e-002 | AJ26: =H26+100*O26 -> 215.15000000000001 | AK26: 192.2 | AL26: 316 | AM26: 100.2 | AN26: 317 | AO26: -0.187 | AP26: 4 | AQ26: 百润转债
A27: 26 | B27: 113629 | C27: 泉峰转债 | D27: 603982 | E27: 泉峰汽车 | F27: 汽车 | G27: 零部件制 | H27: 205.54 | I27: 3.8300000000000001e-002 | J27: 1.5300000000000001e-002 | K27: 44.12 | L27: 5.7800000000000004e-002 | M27: 121 | N27: 23.03 | O27: 7.2999999999999995e-002 | P27: 191.58 | Q27: 2月5天 | R27: 5.66年 | S27: 3.66年 | T27: 6.2 | U27: 538 | V27: 0.42100000000000004 | W27: 7.0000000000000007e-002 | X27: 0.13400000000000001 | Y27: 89 | Z27: 5.35 | AA27: -9.0800000000000006e-002 | AB27: -9.6199999999999994e-002 | AC27: -0.155 | AD27: -0.157 | AE27: 82.79 | AF27: 86.77 | AG27: 0.93 | AH27: AA- | AI27: 6.1799999999999994e-002 | AJ27: =H27+100*O27 -> 212.84 | AK27: 219.5 | AL27: 337 | AM27: 132.7 | AN27: 341 | AO27: 4.0000000000000001e-003 | AP27: 5 | AQ27: 泉峰转债
A28: 27 | B28: 123126 | C28: 瑞丰转债! | D28: 300243 | E28: 瑞丰高材 | F28: 化工 | G28: 橡胶塑料 | H28: 117.98 | I28: -1.7899999999999999e-002 | J28: 1.26e-002 | K28: 13.37 | L28: -1.18e-002 | M28: 129.6 | N28: 17.8 | O28: 0.57100000000000006 | P28: 75.11 | Q28: 59天 | R28: 5.65年 | S28: 3.65年 | T28: 3.4 | U28: 7.7 | V28: 1.9e-002 | W28: 0.109 | X28: 8.199999999999999e-002 | Y28: 31 | Z28: 3.83 | AA28: 1.7299999999999999e-002 | AB28: 8.6e-003 | AC28: -2.63e-002 | AD28: -2.9500000000000002e-002 | AE28: 81.91 | AF28: 88.2 | AG28: 0.45 | AH28: A+ | AI28: 7.2800000000000004e-002 | AJ28: =H28+100*O28 -> 175.08000000000001 | AK28: 160.8 | AL28: 195 | AM28: 72.6 | AN28: 228 | AO28: -1.1000000000000001e-002 | AP28: 8 | AQ28: 瑞丰转债!
A29: 28 | B29: 123125 | C29: 元力转债 | D29: 300174 | E29: 元力股份 | F29: 化工 | G29: 化工 | H29: 122.95 | I29: -3.3099999999999997e-002 | J29: 2.76e-002 | K29: 16.07 | L29: -8.6e-003 | M29: 109.3 | N29: 17.61 | O29: 0.34700000000000003 | P29: 91.25 | Q29: 53天 | R29: 5.64年 | S29: 3.64年 | T29: 9 | U29: 16 | V29: 1.3999999999999999e-002 | W29: 0.17899999999999999 | X29: 0.16399999999999998 | Y29: 50 | Z29: 2.86 | AA29: -2.0899999999999998e-002 | AB29: -2.3900000000000001e-002 | AC29: -4.6100000000000002e-002 | AD29: -4.7500000000000001e-002 | AE29: 81.92 | AF29: 78.33 | AG29: 0.64 | AH29: AA- | AI29: 6.1799999999999994e-002 | AJ29: =H29+100*O29 -> 157.65000000000001 | AK29: 154.6 | AL29: 145 | AM29: 72.7 | AN29: 229 | AO29: -3.4000000000000002e-002 | AP29: 5 | AQ29: 元力转债
A30: 29 | B30: 113628 | C30: 晨丰转债 | D30: 603685 | E30: 晨丰科技 | F30: 能源电力 | G30: 电力设备 | H30: 120.77 | I30: -1.11e-002 | J30: 1.38e-002 | K30: 12.65 | L30: 4.0000000000000001e-003 | M30: 121.7 | N30: 13.06 | O30: 0.247 | P30: 96.86 | Q30: 42天 | R30: 5.60年 | S30: 3.60年 | T30: 4.15 | U30: 4.9 | V30: 1.e-002 | W30: 0.19399999999999998 | X30: 0.188 | Y30: 21 | Z30: 1.9 | AA30: 1.4000000000000002e-003 | AB30: -5.1999999999999998e-003 | AC30: -3.78e-002 | AD30: -4.0000000000000001e-002 | AE30: 77.8 | AF30: 78.79 | AG30: 0.69 | AH30: A | AI30: 8.2799999999999999e-002 | AJ30: =H30+100*O30 -> 145.47 | AK30: 144.7 | AL30: 56 | AM30: 65.9 | AN30: 184 | AO30: 2.e-002 | AP30: 10 | AQ30: 晨丰转债
A31: 30 | B31: 123124 | C31: 晶瑞转2! | D31: 300655 | E31: 晶瑞电材 | F31: 电子 | G31: 电子行业 | H31: 126.518 | I31: -9.1000000000000004e-003 | J31: 7.6e-003 | K31: 38.39 | L31: -2.8999999999999998e-003 | M31: 111.2 | N31: 50.31 | O31: 0.65799999999999992 | P31: 76.31 | Q31: 35天 | R31: 5.58年 | S31: 3.58年 | T31: 5.23 | U31: 7.1 | V31: 1.1000000000000001e-002 | W31: 4.0000000000000001e-002 | X31: 3.1e-002 | Y31: 131 | Z31: 9.01 | AA31: -2.3099999999999999e-002 | AB31: -2.6699999999999998e-002 | AC31: -5.4299999999999994e-002 | AD31: -5.5599999999999997e-002 | AE31: 79.02 | AF31: 75.54 | AG31: 0.53 | AH31: A+ | AI31: 7.2800000000000004e-002 | AJ31: =H31+100*O31 -> 192.31799999999998 | AK31: 176.7 | AL31: 280 | AM31: 97.7 | AN31: 310 | AO31: -9.6000000000000002e-002 | AP31: 7 | AQ31: 晶瑞转2!
A32: 31 | B32: 127044 | C32: 蒙娜转债! | D32: 2918 | E32: 蒙娜丽莎 | F32: 建筑 | G32: 其他建材 | H32: 136.15 | I32: -1.34e-002 | J32: 1.38e-002 | K32: 24.1 | L32: 8.0000000000000004e-004 | M32: 117.1 | N32: 27.07 | O32: 0.52900000000000003 | P32: 89.03 | Q32: 36天 | R32: 5.58年 | S32: 3.58年 | T32: 11.7 | U32: 54 | V32: 3.4000000000000002e-002 | W32: 0.11699999999999999 | X32: 0.10400000000000001 | Y32: 100 | Z32: 2.68 | AA32: -2.7099999999999999e-002 | AB32: -3.2199999999999999e-002 | AC32: -7.0800000000000002e-002 | AD32: -7.2400000000000006e-002 | AE32: 89.29 | AF32: 94.05 | AG32: 0.47 | AH32: AA | AI32: 4.0800000000000003e-002 | AJ32: =H32+100*O32 -> 189.05000000000001 | AK32: 183.3 | AL32: 298 | AM32: 89.2 | AN32: 291 | AO32: -8.1000000000000003e-002 | AP32: 3 | AQ32: 蒙娜转债!
A33: 32 | B33: 127045 | C33: 牧原转债 | D33: 2714 | E33: 牧原股份 | F33: 农业 | G33: 畜牧业 | H33: 138.13 | I33: -1.0500000000000001e-002 | J33: 1.6299999999999999e-002 | K33: 55.7 | L33: 8.1000000000000013e-003 | M33: 111.1 | N33: 47.91 | O33: 0.188 | P33: 116.26 | Q33: 36天 | R33: 5.58年 | S33: 3.58年 | T33: 95.5 | U33: 120 | V33: 9.0000000000000011e-003 | W33: 3.3000000000000002e-002 | X33: 3.7999999999999999e-002 | Y33: 2931. | Z33: 5.56 | AA33: -3.8800000000000001e-002 | AB33: -4.2199999999999994e-002 | AC33: -7.6100000000000001e-002 | AD33: -7.7300000000000008e-002 | AE33: 90.22 | AF33: 91.56 | AG33: 0.71 | AH33: AA+ | AI33: 3.5799999999999998e-002 | AJ33: =H33+100*O33 -> 156.93000000000001 | AK33: 160 | AL33: 186 | AM33: 68.4 | AN33: 201 | AO33: 5.2999999999999999e-002 | AP33: 10 | AQ33: 牧原转债
A34: 33 | B34: 118002 | C34: 天合转债 | D34: 688599 | E34: 天合光能 | F34: 能源电力 | G34: 太阳能 | H34: 157.61 | I34: 6.7000000000000002e-003 | J34: 3.6299999999999999e-002 | K34: 68.22 | L34: 5.4400000000000004e-002 | M34: 120.1 | N34: 50.51 | O34: 0.16699999999999998 | P34: 135.06 | Q34: 36天 | R34: 5.57年 | S34: 3.57年 | T34: 52.5 | U34: 381 | V34: 4.5999999999999999e-002 | W34: 3.7000000000000005e-002 | X34: 5.0000000000000003e-002 | Y34: 1415. | Z34: 8.79 | AA34: -4.8300000000000003e-002 | AB34: -5.4100000000000002e-002 | AC34: -0.10400000000000001 | AD34: -0.105 | AE34: 89.32 | AF34: 96.49 | AG34: 0.79 | AH34: AA | AI34: 4.0800000000000003e-002 | AJ34: =H34+100*O34 -> 174.31 | AK34: 180.2 | AL34: 294 | AM34: 83.7 | AN34: 277 | AO34: -6.4000000000000001e-002 | AP34: 8 | AQ34: 天合转债
A35: 34 | B35: 127043 | C35: 川恒转债 | D35: 2895 | E35: 川恒股份 | F35: 化工 | G35: 农化 | H35: 153.02 | I35: 3.0600000000000002e-002 | J35: 4.5100000000000001e-002 | K35: 25.69 | L35: 0.10000000000000001 | M35: 121 | N35: 21.02 | O35: 0.252 | P35: 122.22 | Q35: 33天 | R35: 5.57年 | S35: 3.57年 | T35: 11.6 | U35: 264 | V35: 0.14999999999999999 | W35: 9.1999999999999998e-002 | X35: 0.113 | Y35: 125 | Z35: 3.97 | AA35: -4.2000000000000003e-002 | AB35: -4.8000000000000001e-002 | AC35: -9.9100000000000008e-002 | AD35: -0.10099999999999999 | AE35: 83.24 | AF35: 87.24 | AG35: 0.76 | AH35: AA- | AI35: 6.1799999999999994e-002 | AJ35: =H35+100*O35 -> 178.22 | AK35: 183.8 | AL35: 300 | AM35: 96.6 | AN35: 309 | AO35: 2.3e-002 | AP35: 7 | AQ35: 川恒转债
A36: 35 | B36: 123123 | C36: 江丰转债! | D36: 300666 | E36: 江丰电子 | F36: 电子 | G36: 电子行业 | H36: 140.09 | I36: 8.8000000000000005e-003 | J36: 2.2700000000000001e-002 | K36: 54.93 | L36: 4.4299999999999999e-002 | M36: 121.5 | N36: 51.93 | O36: 0.32400000000000001 | P36: 105.78 | Q36: 33天 | R36: 5.57年 | S36: 3.57年 | T36: 5.17 | U36: 45 | V36: 6.3e-002 | W36: 4.0999999999999995e-002 | X36: 4.4000000000000004e-002 | Y36: 125 | Z36: 10.01 | AA36: -2.5699999999999997e-002 | AB36: -3.2000000000000001e-002 | AC36: -7.6299999999999993e-002 | AD36: -7.8299999999999995e-002 | AE36: 80.53 | AF36: 82.88 | AG36: 0.71 | AH36: A+ | AI36: 7.2800000000000004e-002 | AJ36: =H36+100*O36 -> 172.49000000000001 | AK36: 174.4 | AL36: 269 | AM36: 91.5 | AN36: 295 | AO36: 9.5000000000000001e-002 | AP36: 7 | AQ36: 江丰转债!
A37: 36 | B37: 127042 | C37: 嘉美转债 | D37: 2969 | E37: 嘉美包装 | F37: 造纸包装 | G37: 包装材料 | H37: 123.57 | I37: -2.0099999999999996e-002 | J37: 4.5999999999999999e-003 | K37: 5.54 | L37: -2.29e-002 | M37: 117.1 | N37: 4.87 | O37: 8.5999999999999993e-002 | P37: 113.76 | Q37: 29天 | R37: 5.56年 | S37: 3.56年 | T37: 7.5 | U37: 29 | V37: 3.1e-002 | W37: 0.14099999999999999 | X37: 0.16 | Y37: 53 | Z37: 2.43 | AA37: -9.7999999999999997e-003 | AB37: -1.5100000000000001e-002 | AC37: -4.6500000000000007e-002 | AD37: -4.82e-002 | AE37: 89.36 | AF37: 94.13 | AG37: 0.67 | AH37: AA | AI37: 4.0800000000000003e-002 | AJ37: =H37+100*O37 -> 132.16999999999999 | AK37: 133.4 | AL37: 6 | AM37: 39.3 | AN37: 20 | AO37: 3.0000000000000001e-003 | AP37: 13 | AQ37: 嘉美转债
A38: 37 | B38: 123122 | C38: 富瀚转债 | D38: 300613 | E38: 富瀚微 | F38: 电子 | G38: 芯片制造 | H38: 128.469 | I38: -3.8e-003 | J38: 9.5999999999999992e-003 | K38: 141.27 | L38: 1.09e-002 | M38: 120.3 | N38: 177.04 | O38: 0.60999999999999999 | P38: 79.8 | Q38: 27天 | R38: 5.56年 | S38: 3.56年 | T38: 5.81 | U38: 21 | V38: 2.7999999999999997e-002 | W38: 3.4000000000000002e-002 | X38: 2.7000000000000003e-002 | Y38: 170 | Z38: 10.37 | AA38: -1.2e-002 | AB38: -1.8100000000000002e-002 | AC38: -5.6500000000000002e-002 | AD38: -5.8200000000000002e-002 | AE38: 79.97 | AF38: 82.03 | AG38: 0.53 | AH38: A+ | AI38: 7.2800000000000004e-002 | AJ38: =H38+100*O38 -> 189.46899999999999 | AK38: 177.1 | AL38: 283 | AM38: 95.1 | AN38: 303 | AO38: -7.5999999999999998e-002 | AP38: 6 | AQ38: 富瀚转债
A39: 38 | B39: 123121 | C39: 帝尔转债! | D39: 300776 | E39: 帝尔激光 | F39: 机械装备 | G39: 专用设备 | H39: 150.08 | I39: 8.5000000000000006e-003 | J39: -5.1000000000000004e-003 | K39: 215.19 | L39: 4.7999999999999996e-003 | M39: 121 | N39: 192.24 | O39: 0.34100000000000003 | P39: 111.94 | Q39: 26天 | R39: 5.55年 | S39: 3.55年 | T39: 8.4 | U39: 44 | V39: 3.5000000000000003e-002 | W39: 3.7000000000000005e-002 | X39: 4.0999999999999995e-002 | Y39: 229 | Z39: 11.3 | AA39: -3.8699999999999998e-002 | AB39: -4.4800000000000006e-002 | AC39: -9.4899999999999998e-002 | AD39: -9.6600000000000005e-002 | AE39: 83.34 | AF39: 87.34 | AG39: 0.7 | AH39: AA- | AI39: 6.1799999999999994e-002 | AJ39: =H39+100*O39 -> 184.18000000000001 | AK39: 188.2 | AL39: 307 | AM39: 100.9 | AN39: 320 | AO39: -8.199999999999999e-002 | AP39: 5 | AQ39: 帝尔转债!
A40: 39 | B40: 123120 | C40: 隆华转债 | D40: 300263 | E40: 隆华科技 | F40: 机械装备 | G40: 通用设备 | H40: 160.567 | I40: 2.4900000000000002e-002 | J40: -2.1700000000000001e-002 | K40: 9.52 | L40: 4.1999999999999997e-003 | M40: 121.1 | N40: 7.76 | O40: 0.309 | P40: 122.68 | Q40: 20天 | R40: 5.54年 | S40: 3.54年 | T40: 7.99 | U40: 49 | V40: 3.7999999999999999e-002 | W40: 9.1999999999999998e-002 | X40: 0.113 | Y40: 87 | Z40: 3.02 | AA40: -5.0599999999999999e-002 | AB40: -5.6600000000000004e-002 | AC40: -0.10800000000000001 | AD40: -0.11 | AE40: 83.58 | AF40: 87.52 | AG40: 0.75 | AH40: AA- | AI40: 6.1799999999999994e-002 | AJ40: =H40+100*O40 -> 191.46700000000001 | AK40: 198.5 | AL40: 323 | AM40: 110.9 | AN40: 327 | AO40: -5.2000000000000005e-002 | AP40: 4 | AQ40: 隆华转债
A41: 40 | B41: 110081 | C41: 闻泰转债 | D41: 600745 | E41: 闻泰科技 | F41: 电子 | G41: 电子行业 | H41: 147.07 | I41: 6.9999999999999993e-003 | J41: 1.2800000000000001e-002 | K41: 119.2 | L41: 2.58e-002 | M41: 111.9 | N41: 96.67 | O41: 0.193 | P41: 123.31 | Q41: 18天 | R41: 5.53年 | S41: 3.53年 | T41: 86 | U41: 332 | V41: 2.6000000000000002e-002 | W41: 5.7999999999999996e-002 | X41: 7.0999999999999994e-002 | Y41: 1485. | Z41: 4.73 | AA41: -4.87e-002 | AB41: -5.2400000000000002e-002 | AC41: -9.35e-002 | AD41: -9.4600000000000004e-002 | AE41: 89.95 | AF41: 92.33 | AG41: 0.77 | AH41: AA+ | AI41: 3.5799999999999998e-002 | AJ41: =H41+100*O41 -> 166.37 | AK41: 170.8 | AL41: 254 | AM41: 78.5 | AN41: 261 | AO41: -8.0000000000000002e-002 | AP41: 10 | AQ41: 闻泰转债
A42: 41 | B42: 118001 | C42: 金博转债 | D42: 688598 | E42: 金博股份 | F42: 能源电力 | G42: 太阳能 | H42: 144.54 | I42: 5.8999999999999999e-003 | J42: 2.0199999999999999e-002 | K42: 279.15 | L42: 3.78e-002 | M42: 121.6 | N42: 271.12 | O42: 0.40399999999999997 | P42: 102.96 | Q42: 13天 | R42: 5.52年 | S42: 3.52年 | T42: 6 | U42: 115 | V42: 0.13200000000000001 | W42: 2.7000000000000003e-002 | X42: 2.7999999999999997e-002 | Y42: 224 | Z42: 13.59 | AA42: -3.15e-002 | AB42: -3.78e-002 | AC42: -8.4900000000000003e-002 | AD42: -8.6899999999999991e-002 | AE42: 81.02 | AF42: 83.31 | AG42: 0.69 | AH42: A+ | AI42: 7.2800000000000004e-002 | AJ42: =H42+100*O42 -> 184.94 | AK42: 186.1 | AL42: 303 | AM42: 102.8 | AN42: 322 | AO42: -0.16200000000000001 | AP42: 4 | AQ42: 金博转债
A43: 42 | B43: 113627 | C43: 太平转债! | D43: 603877 | E43: 太平鸟 | F43: 服装纺织 | G43: 服装行业 | H43: 122.45 | I43: -1.52e-002 | J43: 1.21e-002 | K43: 28.18 | L43: -2.5899999999999999e-002 | M43: 115.1 | N43: 50.32 | O43: 1.1899999999999999 | P43: 56 | Q43: 6.0天 | R43: 5.49年 | S43: 3.49年 | T43: 8 | U43: 15 | V43: 1.4999999999999999e-002 | W43: 5.9999999999999998e-002 | X43: 3.3000000000000002e-002 | Y43: 134 | Z43: 3.3 | AA43: -1.1399999999999999e-002 | AB43: -1.6200000000000003e-002 | AC43: -4.4999999999999998e-002 | AD43: -4.6699999999999998e-002 | AE43: 89.61 | AF43: 92.78 | AG43: 0.12 | AH43: AA | AI43: 4.0800000000000003e-002 | AJ43: =H43+100*O43 -> 241.44999999999999 | AK43: 188.9 | AL43: 311 | AM43: 96.1 | AN43: 308 | AO43: -2.e-002 | AP43: 3 | AQ43: 太平转债!
A44: 43 | B44: 123119 | C44: 康泰转2! | D44: 300601 | E44: 康泰生物 | F44: 医药 | G44: 生物制药 | H44: 128.8 | I44: -3.3e-003 | J44: 9.8999999999999991e-003 | K44: 93.38 | L44: 1.52e-002 | M44: 117.1 | N44: 108.5 | O44: 0.49700000000000005 | P44: 86.06 | Q44: 6.0天 | R44: 5.49年 | S44: 3.49年 | T44: 20 | U44: 28 | V44: 1.1000000000000001e-002 | W44: 3.1e-002 | X44: 2.7000000000000003e-002 | Y44: 642 | Z44: 7.54 | AA44: -1.7500000000000002e-002 | AB44: -2.2799999999999997e-002 | AC44: -5.8200000000000002e-002 | AD44: -5.9900000000000002e-002 | AE44: 89.61 | AF44: 94.38 | AG44: 0.43 | AH44: AA | AI44: 4.0800000000000003e-002 | AJ44: =H44+100*O44 -> 178.5 | AK44: 171.5 | AL44: 258 | AM44: 77.2 | AN44: 255 | AO44: -5.0999999999999997e-002 | AP44: 10 | AQ44: 康泰转2!
A45: 44 | B45: 127041 | C45: 弘亚转债! | D45: 2833 | E45: 弘亚数控 | F45: 机械装备 | G45: 专用设备 | H45: 121.8 | I45: -1.44e-002 | J45: 1.1399999999999999e-002 | K45: 31.14 | L45: -7.3000000000000001e-003 | M45: 118.75 | N45: 38.09 | O45: 0.48999999999999999 | P45: 81.75 | Q45: 2.0天 | R45: 4.49年 | S45: 2.49年 | T45: 6 | U45: 9.5 | V45: 1.3000000000000001e-002 | W45: 6.4000000000000001e-002 | X45: 5.2000000000000005e-002 | Y45: 94 | Z45: 4.73 | AA45: -5.6999999999999993e-003 | AB45: -1.29e-002 | AC45: -6.3299999999999995e-002 | AD45: -6.5000000000000002e-002 | AE45: 87.9 | AF45: 91.77 | AG45: 0.41 | AH45: AA- | AI45: 6.0100000000000001e-002 | AJ45: =H45+100*O45 -> 170.80000000000001 | AK45: 161.8 | AL45: 200 | AM45: 70.1 | AN45: 214 | AO45: -2.8999999999999998e-002 | AP45: 5 | AQ45: 弘亚转债!
A46: 45 | B46: 123118 | C46: 惠城转债 | D46: 300779 | E46: 惠城环保 | F46: 化工 | G46: 其他 | H46: 122.535 | I46: -1.8100000000000002e-002 | J46: -3.3e-003 | K46: 17.13 | L46: -3.2199999999999999e-002 | M46: 121.7 | N46: 17.11 | O46: 0.22399999999999998 | P46: 100.12 | Q46: 已到 | R46: 5.47年 | S46: 3.47年 | T46: 3.2 | U46: 16 | V46: 4.0000000000000001e-002 | W46: 0.187 | X46: 0.187 | Y46: 17 | Z46: 2.57 | AA46: -1.2999999999999999e-003 | AB46: -8.0000000000000002e-003 | AC46: -4.2999999999999997e-002 | AD46: -4.5199999999999997e-002 | AE46: 81.28 | AF46: 83.64 | AG46: 0.66 | AH46: A+ | AI46: 7.2800000000000004e-002 | AJ46: =H46+100*O46 -> 144.935 | AK46: 145 | AL46: 58 | AM46: 61.3 | AN46: 151 | AO46: -2.3e-002 | AP46: 10 | AQ46: 惠城转债
A47: 46 | B47: 127040 | C47: 国泰转债 | D47: 2091 | E47: 江苏国泰 | F47: 商业零售 | G47: 商业零售 | H47: 152.441 | I47: 2.9999999999999997e-004 | J47: 5.0000000000000001e-003 | K47: 13.07 | L47: 6.1999999999999998e-003 | M47: 112.5 | N47: 9.02 | O47: 5.2000000000000005e-002 | P47: 144.9 | Q47: 已到 | R47: 5.47年 | S47: 3.47年 | T47: 44.9 | U47: 86 | V47: 1.3000000000000001e-002 | W47: 0.22 | X47: 0.318 | Y47: 204 | Z47: 2.13 | AA47: -5.4699999999999999e-002 | AB47: -5.8499999999999996e-002 | AC47: -0.10300000000000001 | AD47: -0.10099999999999999 | AE47: 90.7 | AF47: 93.08 | AG47: 0.86 | AH47: AA+ | AI47: 3.5799999999999998e-002 | AJ47: =H47+100*O47 -> 157.64099999999999 | AK47: 160 | AL47: 184 | AM47: 66.9 | AN47: 189 | AO47: -2.1000000000000001e-002 | AP47: 11 | AQ47: 国泰转债
A48: 47 | B48: 127039 | C48: 北港转债 | D48: 582 | E48: 北部湾港 | F48: 机场高速 | G48: 港口 | H48: 123.65 | I48: -1.0800000000000001e-002 | J48: 1.e-003 | K48: 8.02 | L48: -1.84e-002 | M48: 113 | N48: 8.35 | O48: 0.28699999999999998 | P48: 96.05 | Q48: 已到 | R48: 5.45年 | S48: 3.45年 | T48: 30 | U48: 13 | V48: 3.0000000000000001e-003 | W48: 0.22899999999999998 | X48: 0.22 | Y48: 131 | Z48: 1.22 | AA48: -1.67e-002 | AB48: -2.0899999999999998e-002 | AC48: -4.8300000000000003e-002 | AD48: -5.0000000000000003e-002 | AE48: 91.86 | AF48: 94.59 | AG48: 0.53 | AH48: AAA | AI48: 3.3799999999999997e-002 | AJ48: =H48+100*O48 -> 152.34999999999999 | AK48: 151.3 | AL48: 117 | AM48: 56.7 | AN48: 120 | AO48: -1.3000000000000001e-002 | AP48: 6 | AQ48: 北港转债
A49: 48 | B49: 113626 | C49: 伯特转债 | D49: 603596 | E49: 伯特利 | F49: 汽车 | G49: 零部件制 | H49: 231.92 | I49: 7.7399999999999997e-002 | J49: -2.8900000000000002e-002 | K49: 81.48 | L49: 5.0300000000000004e-002 | M49: 121.1 | N49: 36.01 | O49: 2.5000000000000001e-002 | P49: 226.27 | Q49: 已到 | R49: 5.45年 | S49: 3.45年 | T49: 9.02 | U49: 1264. | V49: 0.61199999999999999 | W49: 2.7000000000000003e-002 | X49: 6.0999999999999999e-002 | Y49: 333 | Z49: 10.52 | AA49: -0.114 | AB49: -0.11900000000000001 | AC49: -0.10800000000000001 | AD49: -0.109 | AE49: 89.76 | AF49: 97.77 | AG49: 0.96 | AH49: AA | AI49: 4.0800000000000003e-002 | AJ49: =H49+100*O49 -> 234.41999999999999 | AK49: 237.6 | AL49: 346 | AM49: 139.8 | AN49: 345 | AO49: 0.17999999999999999 | AP49: 4 | AQ49: 伯特转债
A50: 49 | B50: 123117 | C50: 健帆转债! | D50: 300529 | E50: 健帆生物 | F50: 医药 | G50: 医疗器械 | H50: 117.392 | I50: -1.18e-002 | J50: 1.3500000000000002e-002 | K50: 56.01 | L50: 9.7000000000000003e-003 | M50: 115.1 | N50: 90.57 | O50: 0.89800000000000002 | P50: 61.84 | Q50: 已到 | R50: 5.43年 | S50: 3.43年 | T50: 10 | U50: 14 | V50: 1.2e-002 | W50: 2.2000000000000002e-002 | X50: 1.3999999999999999e-002 | Y50: 451 | Z50: 14.79 | AA50: -3.7000000000000002e-003 | AB50: -8.6e-003 | AC50: -3.44e-002 | AD50: -3.6200000000000003e-002 | AE50: 89.82 | AF50: 93 | AG50: 0.17 | AH50: AA | AI50: 4.0800000000000003e-002 | AJ50: =H50+100*O50 -> 207.19200000000001 | AK50: 172.9 | AL50: 263 | AM50: 79.9 | AN50: 267 | AO50: 6.3e-002 | AP50: 7 | AQ50: 健帆转债!
A51: 50 | B51: 113051 | C51: 节能转债! | D51: 601016 | E51: 节能风电 | F51: 能源电力 | G51: 风能 | H51: 149.12 | I51: 3.7000000000000002e-003 | J51: -9.5999999999999992e-003 | K51: 5.39 | L51: -7.4000000000000003e-003 | M51: 114.5 | N51: 4.05 | O51: 0.12 | P51: 133.09 | Q51: 已到 | R51: 5.43年 | S51: 3.43年 | T51: 30 | U51: 202 | V51: 4.4999999999999998e-002 | W51: 0.111 | X51: 0.14800000000000002 | Y51: 270 | Z51: 2.62 | AA51: -4.8099999999999997e-002 | AB51: -5.2600000000000001e-002 | AC51: -9.8299999999999998e-002 | AD51: -9.9600000000000008e-002 | AE51: 90.84 | AF51: 94.88 | AG51: 0.8 | AH51: AA+ | AI51: 3.5799999999999998e-002 | AJ51: =H51+100*O51 -> 161.12 | AK51: 165.2 | AL51: 227 | AM51: 70.3 | AN51: 217 | AO51: -0.155 | AP51: 9 | AQ51: 节能转债!
A52: 51 | B52: 113050 | C52: 南银转债 | D52: 601009 | E52: 南京银行 | F52: 金融 | G52: 银行行业 | H52: 118.91 | I52: -1.9900000000000001e-002 | J52: 3.0000000000000001e-003 | K52: 9.48 | L52: -3.27e-002 | M52: 111.2 | N52: 10.1 | O52: 0.26700000000000002 | P52: 93.86 | Q52: 已到 | R52: 5.41年 | S52: 无权 | T52: 200 | U52: 368 | V52: 1.4999999999999999e-002 | W52: 0.21100000000000002 | X52: 0.19800000000000001 | Y52: 949 | Z52: 0.9 | AA52: -1.2500000000000001e-002 | AB52: -1.6200000000000003e-002 | AC52: 无权 | AD52: 无权 | AE52: 无权 | AF52: 93.15 | AG52: 0.52 | AH52: AAA | AI52: 3.3799999999999997e-002 | AJ52: =H52+100*O52 -> 145.61000000000001 | AK52: 144 | AL52: 47 | AM52: 50.8 | AN52: 82 | AO52: 3.7000000000000005e-002 | AP52: 7 | AQ52: 南银转债
A53: 52 | B53: 113625 | C53: 江山转债! | D53: 603208 | E53: 江山欧派 | F53: 其他 | G53: 家居用品 | H53: 118.99 | I53: -1.1899999999999999e-002 | J53: 1.3100000000000001e-002 | K53: 69.57 | L53: 3.5999999999999999e-003 | M53: 124 | N53: 96.33 | O53: 0.64800000000000002 | P53: 72.22 | Q53: 已到 | R53: 5.40年 | S53: 3.40年 | T53: 5.83 | U53: 10 | V53: 1.4999999999999999e-002 | W53: 8.0000000000000002e-002 | X53: 5.7999999999999996e-002 | Y53: 73 | Z53: 3.98 | AA53: 7.8000000000000005e-003 | AB53: 2.9999999999999997e-004 | AC53: -3.7599999999999995e-002 | AD53: -3.9599999999999996e-002 | AE53: 84.1 | AF53: 90.3 | AG53: 0.35 | AH53: AA- | AI53: 6.1799999999999994e-002 | AJ53: =H53+100*O53 -> 183.78999999999999 | AK53: 165.8 | AL53: 232 | AM53: 75.5 | AN53: 248 | AO53: 8.0000000000000002e-002 | AP53: 7 | AQ53: 江山转债!
A54: 53 | B54: 127038 | C54: 国微转债! | D54: 2049 | E54: 紫光国微 | F54: 电子 | G54: 芯片制造 | H54: 193.674 | I54: -3.9000000000000003e-003 | J54: 2.81e-002 | K54: 217.85 | L54: 2.7099999999999999e-002 | M54: 114.5 | N54: 137.78 | O54: 0.22500000000000001 | P54: 158.11 | Q54: 已到 | R54: 5.40年 | S54: 3.40年 | T54: 14.9 | U54: 102 | V54: 3.5000000000000003e-002 | W54: 1.1000000000000001e-002 | X54: 1.8000000000000002e-002 | Y54: 1322. | Z54: 20.12 | AA54: -9.3900000000000011e-002 | AB54: -9.8100000000000007e-002 | AC54: -0.156 | AD54: -0.157 | AE54: 90.93 | AF54: 94.98 | AG54: 0.89 | AH54: AA+ | AI54: 3.5799999999999998e-002 | AJ54: =H54+100*O54 -> 216.17400000000001 | AK54: 229.2 | AL54: 341 | AM54: 134.3 | AN54: 342 | AO54: 3.1e-002 | AP54: 5 | AQ54: 国微转债!
A55: 54 | B55: 113049 | C55: 长汽转债 | D55: 601633 | E55: 长城汽车 | F55: 汽车 | G55: 乘用车 | H55: 147.72 | I55: -2.7400000000000001e-002 | J55: 2.7900000000000001e-002 | K55: 45.02 | L55: 7.000000000000001e-004 | M55: 110.5 | N55: 38.01 | O55: 0.247 | P55: 118.44 | Q55: 已到 | R55: 5.40年 | S55: 3.40年 | T55: 35 | U55: 144 | V55: 2.7000000000000003e-002 | W55: 8.0000000000000002e-003 | X55: 1.e-002 | Y55: 4158. | Z55: 7.09 | AA55: -5.2999999999999999e-002 | AB55: -5.62e-002 | AC55: -9.849999999999999e-002 | AD55: -9.9499999999999991e-002 | AE55: 90.89 | AF55: 92.57 | AG55: 0.73 | AH55: AAA | AI55: 3.3799999999999997e-002 | AJ55: =H55+100*O55 -> 172.41999999999999 | AK55: 177 | AL55: 281 | AM55: 84.4 | AN55: 280 | AO55: -7.400000000000001e-002 | AP55: 5 | AQ55: 长汽转债
A56: 55 | B56: 123116 | C56: 万兴转债 | D56: 300624 | E56: 万兴科技 | F56: 计算机及 | G56: 软件开发 | H56: 133.551 | I56: -3.32e-002 | J56: 3.5499999999999997e-002 | K56: 50.96 | L56: 3.3e-003 | M56: 121.4 | N56: 49.78 | O56: 0.30499999999999999 | P56: 102.37 | Q56: 已到 | R56: 5.40年 | S56: 3.40年 | T56: 3.78 | U56: 116 | V56: 0.22500000000000001 | W56: 5.7000000000000002e-002 | X56: 5.7999999999999996e-002 | Y56: 66 | Z56: 7.96 | AA56: -1.7899999999999999e-002 | AB56: -2.4399999999999998e-002 | AC56: -6.7599999999999993e-002 | AD56: -6.9699999999999998e-002 | AE56: 81.45 | AF56: 83.83 | AG56: 0.68 | AH56: A+ | AI56: 7.2800000000000004e-002 | AJ56: =H56+100*O56 -> 164.05099999999999 | AK56: 164.7 | AL56: 221 | AM56: 80.9 | AN56: 270 | AO56: -4.2999999999999997e-002 | AP56: 8 | AQ56: 万兴转债
A57: 56 | B57: 123115 | C57: 捷捷转债 | D57: 300623 | E57: 捷捷微电 | F57: 电子 | G57: 元器件制 | H57: 137.297 | I57: 3.0999999999999999e-003 | J57: 5.0000000000000001e-003 | K57: 28.9 | L57: 1.26e-002 | M57: 118.5 | N57: 29 | O57: 0.37799999999999995 | P57: 99.66 | Q57: 已到 | R57: 5.39年 | S57: 3.39年 | T57: 11.9 | U57: 31 | V57: 1.9e-002 | W57: 5.5999999999999994e-002 | X57: 5.5999999999999994e-002 | Y57: 213 | Z57: 7.49 | AA57: -2.7400000000000001e-002 | AB57: -3.3099999999999997e-002 | AC57: -7.6100000000000001e-002 | AD57: -7.7899999999999997e-002 | AE57: 84.07 | AF57: 86.34 | AG57: 0.64 | AH57: AA- | AI57: 6.1799999999999994e-002 | AJ57: =H57+100*O57 -> 175.09699999999998 | AK57: 174.9 | AL57: 274 | AM57: 88.6 | AN57: 289 | AO57: -6.6000000000000003e-002 | AP57: 8 | AQ57: 捷捷转债
A58: 57 | B58: 127037 | C58: 银轮转债 | D58: 2126 | E58: 银轮股份 | F58: 汽车 | G58: 零部件制 | H58: 153.68 | I58: 4.5999999999999999e-003 | J58: 1.3899999999999999e-002 | K58: 13.09 | L58: 2.5099999999999997e-002 | M58: 115.1 | N58: 10.77 | O58: 0.26400000000000001 | P58: 121.54 | Q58: 已到 | R58: 5.39年 | S58: 3.39年 | T58: 7 | U58: 25 | V58: 2.3e-002 | W58: 6.7000000000000004e-002 | X58: 8.199999999999999e-002 | Y58: 104 | Z58: 2.46 | AA58: -5.3099999999999994e-002 | AB58: -5.7599999999999998e-002 | AC58: -0.10300000000000001 | AD58: -0.105 | AE58: 89.98 | AF58: 93.17 | AG58: 0.74 | AH58: AA | AI58: 4.0800000000000003e-002 | AJ58: =H58+100*O58 -> 180.08000000000001 | AK58: 185.8 | AL58: 302 | AM58: 92.7 | AN58: 298 | AO58: 5.5e-002 | AP58: 3 | AQ58: 银轮转债
A59: 58 | B59: 127036 | C59: 三花转债 | D59: 2050 | E59: 三花智控 | F59: 机械装备 | G59: 通用设备 | H59: 139.23 | I59: 1.7000000000000001e-003 | J59: -1.23e-002 | K59: 24.11 | L59: -1.5900000000000001e-002 | M59: 114.5 | N59: 21.55 | O59: 0.24399999999999999 | P59: 111.88 | Q59: 已到 | R59: 5.37年 | S59: 3.37年 | T59: 30 | U59: 23 | V59: 5.0000000000000001e-003 | W59: 3.5000000000000003e-002 | X59: 3.9e-002 | Y59: 866 | Z59: 8.38 | AA59: -3.6200000000000003e-002 | AB59: -4.0800000000000003e-002 | AC59: -8.199999999999999e-002 | AD59: -8.3400000000000002e-002 | AE59: 91.01 | AF59: 95.06 | AG59: 0.67 | AH59: AA+ | AI59: 3.5799999999999998e-002 | AJ59: =H59+100*O59 -> 163.63 | AK59: 166.6 | AL59: 238 | AM59: 71.5 | AN59: 223 | AO59: -1.e-003 | AP59: 7 | AQ59: 三花转债
A60: 59 | B60: 127035 | C60: 濮耐转债 | D60: 2225 | E60: 濮耐股份 | F60: 钢铁 | G60: 钢铁行业 | H60: 124.998 | I60: -1.37e-002 | J60: 1.6000000000000001e-003 | K60: 4.44 | L60: -2.2000000000000002e-002 | M60: 114.7 | N60: 4.43 | O60: 0.247 | P60: 100.23 | Q60: 已到 | R60: 4.36年 | S60: 2.36年 | T60: 6.26 | U60: 8.8 | V60: 1.1000000000000001e-002 | W60: 0.14000000000000001 | X60: 0.14000000000000001 | Y60: 45 | Z60: 1.47 | AA60: -2.e-002 | AB60: -2.58e-002 | AC60: -7.2900000000000006e-002 | AD60: -7.5199999999999989e-002 | AE60: 93.94 | AF60: 97.41 | AG60: 0.55 | AH60: AA | AI60: 3.9100000000000003e-002 | AJ60: =H60+100*O60 -> 149.69800000000001 | AK60: 149.8 | AL60: 97 | AM60: 52.4 | AN60: 89 | AO60: -1.1000000000000001e-002 | AP60: 9 | AQ60: 濮耐转债
A61: 60 | B61: 123114 | C61: 三角转债! | D61: 300775 | E61: 三角防务 | F61: 航空航天 | G61: 航空航天 | H61: 172.6 | I61: 1.7299999999999999e-002 | J61: 1.4199999999999999e-002 | K61: 44.34 | L61: 3.8399999999999997e-002 | M61: 121 | N61: 31.82 | O61: 0.23899999999999999 | P61: 139.35 | Q61: 已到 | R61: 5.36年 | S61: 3.36年 | T61: 9.04 | U61: 100 | V61: 6.4000000000000001e-002 | W61: 4.0999999999999995e-002 | X61: 5.7000000000000002e-002 | Y61: 220 | Z61: 10.17 | AA61: -6.5299999999999997e-002 | AB61: -7.1399999999999991e-002 | AC61: -0.13100000000000001 | AD61: -0.13200000000000001 | AE61: 84.33 | AF61: 88.38 | AG61: 0.82 | AH61: AA- | AI61: 6.1799999999999994e-002 | AJ61: =H61+100*O61 -> 196.5 | AK61: 205.9 | AL61: 328 | AM61: 117.5 | AN61: 332 | AO61: -3.1e-002 | AP61: 7 | AQ61: 三角转债!
A62: 61 | B62: 111000 | C62: 起帆转债 | D62: 605222 | E62: 起帆电缆 | F62: 能源电力 | G62: 电力设备 | H62: 143.1 | I62: -5.1000000000000004e-003 | J62: 1.52e-002 | K62: 25.78 | L62: 1.3000000000000001e-002 | M62: 120.5 | N62: 20.1 | O62: 0.11599999999999999 | P62: 128.26 | Q62: 已到 | R62: 5.35年 | S62: 3.35年 | T62: 10 | U62: 38 | V62: 2.6000000000000002e-002 | W62: 9.3000000000000013e-002 | X62: 0.11900000000000001 | Y62: 108 | Z62: 3.11 | AA62: -3.2199999999999999e-002 | AB62: -3.8399999999999997e-002 | AC62: -8.7899999999999992e-002 | AD62: -8.9600000000000013e-002 | AE62: 84.28 | AF62: 88.01 | AG62: 0.78 | AH62: AA- | AI62: 6.1799999999999994e-002 | AJ62: =H62+100*O62 -> 154.69999999999999 | AK62: 157.9 | AL62: 169 | AM62: 69.9 | AN62: 213 | AO62: 2.5000000000000001e-002 | AP62: 10 | AQ62: 起帆转债
A63: 62 | B63: 127034 | C63: 绿茵转债! | D63: 2887 | E63: 绿茵生态 | F63: 城市公用 | G63: 生态环境 | H63: 108 | I63: -1.9299999999999998e-002 | J63: 1.9699999999999999e-002 | K63: 10.03 | L63: 1.e-003 | M63: 119 | N63: 12.38 | O63: 0.33299999999999996 | P63: 81.02 | Q63: 已到 | R63: 5.29年 | S63: 3.29年 | T63: 7.12 | U63: 22 | V63: 2.7999999999999997e-002 | W63: 0.22800000000000001 | X63: 0.184 | Y63: 31 | Z63: 1.53 | AA63: 1.89e-002 | AB63: 1.2500000000000001e-002 | AC63: -1.1200000000000002e-002 | AD63: -1.34e-002 | AE63: 84.68 | AF63: 87.29 | AG63: 0.48 | AH63: AA- | AI63: 6.1799999999999994e-002 | AJ63: =H63+100*O63 -> 141.30000000000001 | AK63: 135 | AL63: 9 | AM63: 47.7 | AN63: 57 | AO63: 2.1000000000000001e-002 | AP63: 41 | AQ63: 绿茵转债!
A64: 63 | B64: 113624 | C64: 正川转债! | D64: 603976 | E64: 正川股份 | F64: 医药 | G64: 医药行业 | H64: 116.11 | I64: 2.0000000000000001e-004 | J64: 2.2000000000000002e-002 | K64: 36.09 | L64: 4.5499999999999999e-002 | M64: 121.6 | N64: 46.69 | O64: 0.502 | P64: 77.3 | Q64: 已到 | R64: 5.28年 | S64: 3.28年 | T64: 4.05 | U64: 28 | V64: 5.9000000000000004e-002 | W64: 7.400000000000001e-002 | X64: 5.7000000000000002e-002 | Y64: 55 | Z64: 4.94 | AA64: 9.0000000000000011e-003 | AB64: 1.9e-003 | AC64: -3.0200000000000001e-002 | AD64: -3.2599999999999997e-002 | AE64: 82.37 | AF64: 84.7 | AG64: 0.49 | AH64: A+ | AI64: 7.2800000000000004e-002 | AJ64: =H64+100*O64 -> 166.31 | AK64: 154.9 | AL64: 147 | AM64: 70.2 | AN64: 216 | AO64: 6.4000000000000001e-002 | AP64: 22 | AQ64: 正川转债!
A65: 64 | B65: 113048 | C65: 晶科转债!! | D65: 601778 | E65: 晶科科技 | F65: 能源电力 | G65: 太阳能 | H65: 149.85 | I65: -2.3300000000000001e-002 | J65: 2.3300000000000001e-002 | K65: 7.14 | L65: 0. | M65: 117.1 | N65: 5.46 | O65: 0.14599999999999999 | P65: 130.77 | Q65: 已到 | R65: 5.27年 | S65: 3.27年 | T65: 23 | U65: 271 | V65: 7.8e-002 | W65: 0.111 | X65: 0.14499999999999999 | Y65: 207 | Z65: 1.74 | AA65: -4.6500000000000007e-002 | AB65: -5.1799999999999999e-002 | AC65: -0.10000000000000001 | AD65: -0.10199999999999999 | AE65: 90.43 | AF65: 95.25 | AG65: 0.78 | AH65: AA | AI65: 4.0800000000000003e-002 | AJ65: =H65+100*O65 -> 164.44999999999999 | AK65: 168.9 | AL65: 245 | AM65: 73.7 | AN65: 236 | AO65: -0.154 | AP65: 14 | AQ65: 晶科转债!!
A66: 65 | B66: 123113 | C66: 仙乐转债! | D66: 300791 | E66: 仙乐健康 | F66: 食品饮料 | G66: 食品饮料 | H66: 120.5 | I66: 5.0000000000000001e-003 | J66: 8.8000000000000005e-003 | K66: 46.29 | L66: 2.87e-002 | M66: 118.5 | N66: 56.88 | O66: 0.48100000000000004 | P66: 81.38 | Q66: 已到 | R66: 5.26年 | S66: 3.26年 | T66: 10.2 | U66: 43 | V66: 3.5000000000000003e-002 | W66: 0.12300000000000001 | X66: 0.10000000000000001 | Y66: 83 | Z66: 3.6 | AA66: -3.2000000000000002e-003 | AB66: -9.300000000000001e-003 | AC66: -4.2999999999999997e-002 | AD66: -4.4999999999999998e-002 | AE66: 84.76 | AF66: 87.06 | AG66: 0.48 | AH66: AA- | AI66: 6.1799999999999994e-002 | AJ66: =H66+100*O66 -> 168.59999999999999 | AK66: 159.6 | AL66: 182 | AM66: 72.6 | AN66: 227 | AO66: 9.4e-002 | AP66: 5 | AQ66: 仙乐转债!
A67: 66 | B67: 127033 | C67: 中装转2! | D67: 2822 | E67: 中装建设 | F67: 建筑 | G67: 装饰工程 | H67: 120.25 | I67: -2.7300000000000001e-002 | J67: 1.5700000000000002e-002 | K67: 5.82 | L67: -2.35e-002 | M67: 117.1 | N67: 6.28 | O67: 0.29799999999999999 | P67: 92.68 | Q67: 已到 | R67: 5.25年 | S67: 3.25年 | T67: 11.6 | U67: 39 | V67: 2.7999999999999997e-002 | W67: 0.27699999999999997 | X67: 0.25600000000000001 | Y67: 42 | Z67: 1.2 | AA67: -5.1000000000000004e-003 | AB67: -1.0800000000000001e-002 | AC67: -4.3099999999999999e-002 | AD67: -4.4900000000000002e-002 | AE67: 90.5 | AF67: 95.32 | AG67: 0.49 | AH67: AA | AI67: 4.0800000000000003e-002 | AJ67: =H67+100*O67 -> 150.05000000000001 | AK67: 147.8 | AL67: 79 | AM67: 52.5 | AN67: 90 | AO67: -4.2000000000000003e-002 | AP67: 27 | AQ67: 中装转2!
A68: 67 | B68: 110080 | C68: 东湖转债 | D68: 600133 | E68: 东湖高新 | F68: 建筑 | G68: 建筑工程 | H68: 112.13 | I68: -2.2700000000000001e-002 | J68: 1.1699999999999999e-002 | K68: 5.39 | L68: -2.3599999999999999e-002 | M68: 115.1 | N68: 6.05 | O68: 0.25900000000000001 | P68: 89.09 | Q68: 已到 | R68: 5.24年 | S68: 3.24年 | T68: 15.5 | U68: 45 | V68: 2.5000000000000001e-002 | W68: 0.36099999999999999 | X68: 0.32200000000000001 | Y68: 43 | Z68: 0.76 | AA68: 5.1000000000000004e-003 | AB68: -1.e-004 | AC68: -2.3199999999999998e-002 | AD68: -2.5099999999999997e-002 | AE68: 90.54 | AF68: 93.74 | AG68: 0.47 | AH68: AA | AI68: 4.0800000000000003e-002 | AJ68: =H68+100*O68 -> 138.03 | AK68: 135.2 | AL68: 12 | AM68: 41.4 | AN68: 27 | AO68: -9.0000000000000011e-003 | AP68: 32 | AQ68: 东湖转债
A69: 68 | B69: 127032 | C69: 苏行转债 | D69: 2966 | E69: 苏州银行 | F69: 金融 | G69: 银行行业 | H69: 113.57 | I69: -2.41e-002 | J69: 1.8600000000000002e-002 | K69: 6.86 | L69: -1.44e-002 | M69: 115.1 | N69: 8.1 | O69: 0.34100000000000003 | P69: 84.69 | Q69: 已到 | R69: 5.24年 | S69: 无权 | T69: 50 | U69: 216 | V69: 3.7999999999999999e-002 | W69: 0.21899999999999997 | X69: 0.185 | Y69: 229 | Z69: 0.72 | AA69: 2.5999999999999999e-003 | AB69: -2.5999999999999999e-003 | AC69: 无权 | AD69: 无权 | AE69: 无权 | AF69: 97.02 | AG69: 0.38 | AH69: AAA | AI69: 3.3799999999999997e-002 | AJ69: =H69+100*O69 -> 147.66999999999999 | AK69: 142.4 | AL69: 35 | AM69: 45.4 | AN69: 46 | AO69: 8.0000000000000002e-003 | AP69: 10 | AQ69: 苏行转债
A70: 69 | B70: 113047 | C70: 旗滨转债! | D70: 601636 | E70: 旗滨集团 | F70: 建筑 | G70: 玻璃 | H70: 165.91 | I70: -1.2500000000000001e-002 | J70: 8.8000000000000005e-003 | K70: 16.43 | L70: -4.7999999999999996e-003 | M70: 114 | N70: 12.8 | O70: 0.29299999999999998 | P70: 128.36 | Q70: 已到 | R70: 5.23年 | S70: 3.23年 | T70: 15 | U70: 65 | V70: 2.6000000000000002e-002 | W70: 3.4000000000000002e-002 | X70: 4.4000000000000004e-002 | Y70: 441 | Z70: 3.6 | AA70: -7.0099999999999996e-002 | AB70: -7.4400000000000008e-002 | AC70: -0.129 | AD70: -0.13 | AE70: 91.03 | AF70: 95.1 | AG70: 0.77 | AH70: AA+ | AI70: 3.5799999999999998e-002 | AJ70: =H70+100*O70 -> 195.20999999999998 | AK70: 203.5 | AL70: 327 | AM70: 108.4 | AN70: 325 | AO70: -4.9000000000000002e-002 | AP70: 7 | AQ70: 旗滨转债!
A71: 70 | B71: 123112 | C71: 万讯转债! | D71: 300112 | E71: 万讯自控 | F71: 机械装备 | G71: 专用设备 | H71: 160.8 | I71: -3.32e-002 | J71: -9.3999999999999986e-003 | K71: 13.03 | L71: -5.2400000000000002e-002 | M71: 124.4 | N71: 8.93 | O71: 0.10199999999999999 | P71: 145.91 | Q71: 已到 | R71: 5.23年 | S71: 3.23年 | T71: 2.45 | U71: 216 | V71: 0.53299999999999992 | W71: 6.6000000000000003e-002 | X71: 9.6000000000000002e-002 | Y71: 37 | Z71: 3.43 | AA71: -4.8899999999999999e-002 | AB71: -5.6100000000000004e-002 | AC71: -0.11800000000000001 | AD71: -0.12 | AE71: 85.33 | AF71: 91.6 | AG71: 0.81 | AH71: AA- | AI71: 6.1799999999999994e-002 | AJ71: =H71+100*O71 -> 171. | AK71: 175.7 | AL71: 277 | AM71: 84.1 | AN71: 278 | AO71: -3.7000000000000005e-002 | AP71: 14 | AQ71: 万讯转债!
A72: 71 | B72: 113623 | C72: 凤21转债 | D72: 603225 | E72: 新凤鸣 | F72: 化工 | G72: 化纤 | H72: 125.22 | I72: -2.1499999999999998e-002 | J72: 2.e-003 | K72: 14.89 | L72: -4.1799999999999997e-002 | M72: 117.1 | N72: 16.47 | O72: 0.38500000000000001 | P72: 90.41 | Q72: 已到 | R72: 5.23年 | S72: 3.23年 | T72: 25 | U72: 102 | V72: 3.2000000000000001e-002 | W72: 0.11 | X72: 9.9000000000000005e-002 | Y72: 228 | Z72: 1.44 | AA72: -1.3000000000000001e-002 | AB72: -1.8600000000000002e-002 | AC72: -5.4800000000000001e-002 | AD72: -5.6600000000000004e-002 | AE72: 90.58 | AF72: 95.4 | AG72: 0.47 | AH72: AA | AI72: 4.0800000000000003e-002 | AJ72: =H72+100*O72 -> 163.72 | AK72: 160 | AL72: 187 | AM72: 64.6 | AN72: 173 | AO72: 1.3999999999999999e-002 | AP72: 4 | AQ72: 凤21转债
A73: 72 | B73: 123111 | C73: 东财转3! | D73: 300059 | E73: 东方财富 | F73: 金融 | G73: 证券行业 | H73: 143 | I73: -6.8999999999999999e-003 | J73: -1.e-003 | K73: 32.22 | L73: -9.4999999999999998e-003 | M73: 110.5 | N73: 23.35 | O73: 3.6000000000000004e-002 | P73: 137.99 | Q73: 已到 | R73: 5.22年 | S73: 3.22年 | T73: 151 | U73: 1108. | V73: 5.0999999999999997e-002 | W73: 4.4999999999999998e-002 | X73: 6.2e-002 | Y73: 3340. | Z73: 8.54 | AA73: -4.87e-002 | AB73: -5.21e-002 | AC73: -9.5199999999999993e-002 | AD73: -9.6199999999999994e-002 | AE73: 90.59 | AF73: 92.16 | AG73: 0.84 | AH73: AA+ | AI73: 3.5799999999999998e-002 | AJ73: =H73+100*O73 -> 146.59999999999999 | AK73: 148 | AL73: 80 | AM73: 55.9 | AN73: 113 | AO73: -0.106 | AP73: 27 | AQ73: 东财转3!
A74: 73 | B74: 123109 | C74: 昌红转债! | D74: 300151 | E74: 昌红科技 | F74: 机械装备 | G74: 专用设备 | H74: 143.9 | I74: -8.3000000000000001e-003 | J74: -1.e-003 | K74: 35.05 | L74: -1.24e-002 | M74: 121 | N74: 28.06 | O74: 0.152 | P74: 124.91 | Q74: 已到 | R74: 5.21年 | S74: 3.21年 | T74: 4.6 | U74: 16 | V74: 2.4e-002 | W74: 2.6000000000000002e-002 | X74: 3.3000000000000002e-002 | Y74: 176 | Z74: 17.05 | AA74: -3.3399999999999999e-002 | AB74: -3.9900000000000005e-002 | AC74: -9.2799999999999994e-002 | AD74: -9.4700000000000006e-002 | AE74: 85.08 | AF74: 89.17 | AG74: 0.75 | AH74: AA- | AI74: 6.1799999999999994e-002 | AJ74: =H74+100*O74 -> 159.09999999999999 | AK74: 162.9 | AL74: 204 | AM74: 73.7 | AN74: 237 | AO74: -0.11699999999999999 | AP74: 6 | AQ74: 昌红转债!
A75: 74 | B75: 123110 | C75: 九典转债 | D75: 300705 | E75: 九典制药 | F75: 医药 | G75: 化学制药 | H75: 144 | I75: 1.77e-002 | J75: 1.1000000000000001e-003 | K75: 34.29 | L75: 2.3599999999999999e-002 | M75: 121.4 | N75: 26.44 | O75: 0.11 | P75: 129.69 | Q75: 已到 | R75: 5.21年 | S75: 3.21年 | T75: 2.7 | U75: 87 | V75: 0.22399999999999998 | W75: 3.4000000000000002e-002 | X75: 4.2999999999999997e-002 | Y75: 80 | Z75: 8.09 | AA75: -3.2899999999999999e-002 | AB75: -3.9599999999999996e-002 | AC75: -9.1799999999999993e-002 | AD75: -9.3900000000000011e-002 | AE75: 82.61 | AF75: 84.95 | AG75: 0.8 | AH75: A+ | AI75: 7.2800000000000004e-002 | AJ75: =H75+100*O75 -> 155. | AK75: 158.3 | AL75: 172 | AM75: 73.4 | AN75: 232 | AO75: 4.0999999999999995e-002 | AP75: 10 | AQ75: 九典转债
A76: 75 | B76: 123108 | C76: 乐普转2! | D76: 300003 | E76: 乐普医疗 | F76: 医药 | G76: 医疗器械 | H76: 125.378 | I76: 1.03e-002 | J76: 4.0000000000000002e-004 | K76: 24.96 | L76: 2.9300000000000003e-002 | M76: 111.1 | N76: 29.5 | O76: 0.48200000000000004 | P76: 84.61 | Q76: 已到 | R76: 4.20年 | S76: 2.20年 | T76: 16.4 | U76: 84 | V76: 4.0999999999999995e-002 | W76: 3.6000000000000004e-002 | X76: 3.1e-002 | Y76: 450 | Z76: 3.91 | AA76: -2.87e-002 | AB76: -3.3399999999999999e-002 | AC76: -8.3599999999999994e-002 | AD76: -8.5099999999999995e-002 | AE76: 94.3 | AF76: 96.69 | AG76: 0.36 | AH76: AA+ | AI76: 3.4099999999999998e-002 | AJ76: =H76+100*O76 -> 173.578 | AK76: 166.1 | AL76: 235 | AM76: 69.5 | AN76: 210 | AO76: 9.4e-002 | AP76: 13 | AQ76: 乐普转2!
A77: 76 | B77: 123107 | C77: 温氏转债! | D77: 300498 | E77: 温氏股份 | F77: 农业 | G77: 畜牧业 | H77: 131.88 | I77: -2.0099999999999996e-002 | J77: 9.3999999999999986e-003 | K77: 19.41 | L77: -1.6200000000000003e-002 | M77: 113 | N77: 17.62 | O77: 0.19699999999999998 | P77: 110.16 | Q77: 已到 | R77: 5.20年 | S77: 3.20年 | T77: 93 | U77: 186 | V77: 1.4999999999999999e-002 | W77: 7.4999999999999997e-002 | X77: 8.3000000000000004e-002 | Y77: 1233. | Z77: 3.51 | AA77: -2.98e-002 | AB77: -3.4099999999999998e-002 | AC77: -7.0000000000000007e-002 | AD77: -7.17e-002 | AE77: 92.64 | AF77: 95.38 | AG77: 0.66 | AH77: AAA | AI77: 3.3799999999999997e-002 | AJ77: =H77+100*O77 -> 151.57999999999998 | AK77: 153.6 | AL77: 140 | AM77: 58.2 | AN77: 131 | AO77: -3.0000000000000001e-003 | AP77: 12 | AQ77: 温氏转债!
A78: 77 | B78: 110079 | C78: 杭银转债! | D78: 600926 | E78: 杭州银行 | F78: 金融 | G78: 银行行业 | H78: 124.82 | I78: -1.37e-002 | J78: 1.6000000000000001e-003 | K78: 13.48 | L78: -2.0299999999999999e-002 | M78: 112.4 | N78: 12.99 | O78: 0.20300000000000001 | P78: 103.77 | Q78: 已到 | R78: 5.20年 | S78: 无权 | T78: 150 | U78: 267 | V78: 1.3999999999999999e-002 | W78: 0.188 | X78: 0.19500000000000001 | Y78: 799 | Z78: 1.15 | AA78: -2.0299999999999999e-002 | AB78: -2.4500000000000001e-002 | AC78: 无权 | AD78: 无权 | AE78: 无权 | AF78: 94.83 | AG78: 0.59 | AH78: AAA | AI78: 3.3799999999999997e-002 | AJ78: =H78+100*O78 -> 145.12 | AK78: 145.9 | AL78: 62 | AM78: 51 | AN78: 84 | AO78: 1.4999999999999999e-002 | AP78: 12 | AQ78: 杭银转债!
A79: 78 | B79: 113622 | C79: 杭叉转债! | D79: 603298 | E79: 杭叉集团 | F79: 机械装备 | G79: 通用设备 | H79: 119.86 | I79: -2.12e-002 | J79: 1.1599999999999999e-002 | K79: 17.54 | L79: -3.04e-002 | M79: 112.5 | N79: 23.08 | O79: 0.57700000000000007 | P79: 76 | Q79: 已到 | R79: 5.19年 | S79: 3.19年 | T79: 11.5 | U79: 16 | V79: 1.2e-002 | W79: 7.5999999999999998e-002 | X79: 5.7999999999999996e-002 | Y79: 152 | Z79: 2.88 | AA79: -1.23e-002 | AB79: -1.66e-002 | AC79: -4.4400000000000002e-002 | AD79: -4.5999999999999999e-002 | AE79: 91.61 | AF79: 94.02 | AG79: 0.32 | AH79: AA+ | AI79: 3.5799999999999998e-002 | AJ79: =H79+100*O79 -> 177.56 | AK79: 163.7 | AL79: 214 | AM79: 69.7 | AN79: 212 | AO79: 1.8000000000000002e-002 | AP79: 5 | AQ79: 杭叉转债!
A80: 79 | B80: 127031 | C80: 洋丰转债! | D80: 902 | E80: 新洋丰 | F80: 化工 | G80: 农化 | H80: 128.85 | I80: -1.7100000000000001e-002 | J80: 7.9000000000000008e-003 | K80: 16.81 | L80: -1.8100000000000002e-002 | M80: 117.1 | N80: 17.76 | O80: 0.36099999999999999 | P80: 94.65 | Q80: 已到 | R80: 5.19年 | S80: 3.19年 | T80: 10 | U80: 39 | V80: 2.9999999999999999e-002 | W80: 4.5999999999999999e-002 | X80: 4.2999999999999997e-002 | Y80: 219 | Z80: 2.91 | AA80: -1.8600000000000002e-002 | AB80: -2.4199999999999999e-002 | AC80: -6.3500000000000001e-002 | AD80: -6.5299999999999997e-002 | AE80: 90.71 | AF80: 95.55 | AG80: 0.51 | AH80: AA | AI80: 4.0800000000000003e-002 | AJ80: =H80+100*O80 -> 164.94999999999999 | AK80: 163 | AL80: 206 | AM80: 67.5 | AN80: 195 | AO80: -2.e-002 | AP80: 6 | AQ80: 洋丰转债!
A81: 80 | B81: 123106 | C81: 正丹转债! | D81: 300641 | E81: 正丹股份 | F81: 化工 | G81: 化工 | H81: 121.183 | I81: -9.1000000000000004e-003 | J81: -5.9999999999999995e-004 | K81: 7.05 | L81: -1.8100000000000002e-002 | M81: 125.5 | N81: 7.5 | O81: 0.28899999999999998 | P81: 94 | Q81: 已到 | R81: 5.19年 | S81: 3.19年 | T81: 3.2 | U81: 9.3 | V81: 2.4e-002 | W81: 9.3000000000000013e-002 | X81: 8.6999999999999994e-002 | Y81: 35 | Z81: 2.41 | AA81: 6.8999999999999999e-003 | AB81: -1.2999999999999999e-003 | AC81: -4.5499999999999999e-002 | AD81: -4.7500000000000001e-002 | AE81: 85.13 | AF81: 92.56 | AG81: 0.54 | AH81: AA- | AI81: 6.1799999999999994e-002 | AJ81: =H81+100*O81 -> 150.083 | AK81: 148.4 | AL81: 84 | AM81: 55.8 | AN81: 112 | AO81: 3.0000000000000001e-003 | AP81: 19 | AQ81: 正丹转债!
A82: 81 | B82: 128145 | C82: 日丰转债! | D82: 2953 | E82: 日丰股份 | F82: 家电 | G82: 零部件制 | H82: 143.2 | I82: -1.38e-002 | J82: 1.84e-002 | K82: 17.41 | L82: 5.7999999999999996e-003 | M82: 115.4 | N82: 13.66 | O82: 0.124 | P82: 127.45 | Q82: 已到 | R82: 5.18年 | S82: 3.18年 | T82: 3.8 | U82: 34 | V82: 6.2e-002 | W82: 8.9999999999999997e-002 | X82: 0.114 | Y82: 42 | Z82: 3.71 | AA82: -4.1599999999999998e-002 | AB82: -4.6500000000000007e-002 | AC82: -9.2600000000000002e-002 | AD82: -9.4399999999999998e-002 | AE82: 85.05 | AF82: 85.16 | AG82: 0.81 | AH82: AA- | AI82: 6.1799999999999994e-002 | AJ82: =H82+100*O82 -> 155.59999999999999 | AK82: 158.9 | AL82: 176 | AM82: 73.8 | AN82: 241 | AO82: 2.3e-002 | AP82: 10 | AQ82: 日丰转债!
A83: 82 | B83: 127030 | C83: 盛虹转债! | D83: 301 | E83: 东方盛虹 | F83: 化工 | G83: 化纤 | H83: 170.85 | I83: -6.7000000000000002e-003 | J83: -2.7000000000000001e-003 | K83: 19.01 | L83: -1.1399999999999999e-002 | M83: 112.5 | N83: 14.1 | O83: 0.26700000000000002 | P83: 134.82 | Q83: 已到 | R83: 5.18年 | S83: 3.18年 | T83: 50 | U83: 80 | V83: 9.0000000000000011e-003 | W83: 5.4000000000000006e-002 | X83: 7.2999999999999995e-002 | Y83: 919 | Z83: 8.1 | AA83: -7.8600000000000003e-002 | AB83: -8.2400000000000001e-002 | AC83: -0.13699999999999998 | AD83: -0.13800000000000001 | AE83: 91.64 | AF83: 94.04 | AG83: 0.82 | AH83: AA+ | AI83: 3.5799999999999998e-002 | AJ83: =H83+100*O83 -> 197.55000000000001 | AK83: 206.9 | AL83: 330 | AM83: 112.8 | AN83: 329 | AO83: -9.5000000000000001e-002 | AP83: 5 | AQ83: 盛虹转债!
A84: 83 | B84: 113046 | C84: 金田转债! | D84: 601609 | E84: 金田铜业 | F84: 有色金属 | G84: 铜金属 | H84: 119 | I84: -1.6399999999999998e-002 | J84: 9.7000000000000003e-003 | K84: 8.59 | L84: -1.9400000000000001e-002 | M84: 114.9 | N84: 10.75 | O84: 0.48899999999999999 | P84: 79.91 | Q84: 已到 | R84: 5.18年 | S84: 3.18年 | T84: 15 | U84: 58 | V84: 3.2000000000000001e-002 | W84: 0.11800000000000001 | X84: 9.4e-002 | Y84: 127 | Z84: 1.81 | AA84: -6.8999999999999999e-003 | AB84: -1.1899999999999999e-002 | AC84: -4.1399999999999999e-002 | AD84: -4.3299999999999998e-002 | AE84: 92.02 | AF84: 96.09 | AG84: 0.35 | AH84: AA+ | AI84: 3.5799999999999998e-002 | AJ84: =H84+100*O84 -> 167.90000000000001 | AK84: 158.1 | AL84: 170 | AM84: 62 | AN84: 157 | AO84: -1.3000000000000001e-002 | AP84: 13 | AQ84: 金田转债!
A85: 84 | B85: 127029 | C85: 中钢转债! | D85: 928 | E85: 中钢国际 | F85: 建筑 | G85: 建筑工程 | H85: 147.66 | I85: -1.04e-002 | J85: 7.4000000000000003e-003 | K85: 7.6 | L85: -3.9000000000000003e-003 | M85: 117.5 | N85: 5.79 | O85: 0.125 | P85: 131.26 | Q85: 已到 | R85: 5.17年 | S85: 3.17年 | T85: 8.19 | U85: 60 | V85: 4.9000000000000002e-002 | W85: 8.4000000000000005e-002 | X85: 0.11 | Y85: 97 | Z85: 1.63 | AA85: -4.3799999999999999e-002 | AB85: -4.9400000000000006e-002 | AC85: -0.10099999999999999 | AD85: -0.10199999999999999 | AE85: 91.66 | AF85: 98.24 | AG85: 0.76 | AH85: AA+ | AI85: 3.5799999999999998e-002 | AJ85: =H85+100*O85 -> 160.16 | AK85: 164.1 | AL85: 216 | AM85: 65.8 | AN85: 182 | AO85: -0.16500000000000001 | AP85: 12 | AQ85: 中钢转债!
A86: 85 | B86: 123105 | C86: 拓尔转债! | D86: 300229 | E86: 拓尔思 | F86: 计算机及 | G86: 软件开发 | H86: 136.38 | I86: -1.1399999999999999e-002 | J86: 3.78e-002 | K86: 11.41 | L86: 3.73e-002 | M86: 121 | N86: 9.96 | O86: 0.19 | P86: 114.56 | Q86: 已到 | R86: 5.17年 | S86: 3.17年 | T86: 8 | U86: 30 | V86: 2.7999999999999997e-002 | W86: 9.8000000000000004e-002 | X86: 0.11199999999999999 | Y86: 82 | Z86: 3.69 | AA86: -2.3300000000000001e-002 | AB86: -2.9999999999999999e-002 | AC86: -7.8899999999999998e-002 | AD86: -8.09e-002 | AE86: 85.27 | AF86: 89.36 | AG86: 0.71 | AH86: AA- | AI86: 6.1799999999999994e-002 | AJ86: =H86+100*O86 -> 155.38 | AK86: 158.2 | AL86: 171 | AM86: 68.8 | AN86: 206 | AO86: 0.115 | AP86: 9 | AQ86: 拓尔转债!
A87: 86 | B87: 123104 | C87: 卫宁转债! | D87: 300253 | E87: 卫宁健康 | F87: 计算机及 | G87: 软件开发 | H87: 129.57 | I87: 9.8999999999999991e-003 | J87: -7.4000000000000003e-003 | K87: 14.93 | L87: 7.4000000000000003e-003 | M87: 125.1 | N87: 17.74 | O87: 0.54000000000000004 | P87: 84.16 | Q87: 已到 | R87: 5年59天 | S87: 3年59天 | T87: 9.7 | U87: 15 | V87: 1.2e-002 | W87: 2.9999999999999999e-002 | X87: 2.5000000000000001e-002 | Y87: 320 | Z87: 6.68 | AA87: -6.8999999999999999e-003 | AB87: -1.4800000000000001e-002 | AC87: -6.5500000000000003e-002 | AD87: -6.7400000000000002e-002 | AE87: 90.8 | AF87: 102.15 | AG87: 0.33 | AH87: AA | AI87: 4.0800000000000003e-002 | AJ87: =H87+100*O87 -> 183.56999999999999 | AK87: 175 | AL87: 275 | AM87: 72.8 | AN87: 230 | AO87: -4.4000000000000004e-002 | AP87: 5 | AQ87: 卫宁转债!
A88: 87 | B88: 123103 | C88: 震安转债! | D88: 300767 | E88: 震安科技 | F88: 化工 | G88: 橡胶塑料 | H88: 173.764 | I88: -2.3799999999999998e-002 | J88: -3.0999999999999999e-003 | K88: 91.44 | L88: -3.0299999999999997e-002 | M88: 121.4 | N88: 56.89 | O88: 8.1000000000000003e-002 | P88: 160.73 | Q88: 已到 | R88: 5年55天 | S88: 3年55天 | T88: 2.53 | U88: 30 | V88: 6.8000000000000005e-002 | W88: 1.3999999999999999e-002 | X88: 2.2000000000000002e-002 | Y88: 185 | Z88: 15.76 | AA88: -6.8600000000000008e-002 | AB88: -7.4999999999999997e-002 | AC88: -0.13900000000000001 | AD88: -0.14099999999999999 | AE88: 83.09 | AF88: 85.32 | AG88: 0.89 | AH88: A+ | AI88: 7.2800000000000004e-002 | AJ88: =H88+100*O88 -> 181.864 | AK88: 186.8 | AL88: 305 | AM88: 101.5 | AN88: 321 | AO88: -9.3000000000000013e-002 | AP88: 5 | AQ88: 震安转债!
A89: 88 | B89: 123101 | C89: 拓斯转债! | D89: 300607 | E89: 拓斯达 | F89: 机械装备 | G89: 机器人及 | H89: 115.3 | I89: -2.7000000000000001e-003 | J89: 2.0000000000000001e-004 | K89: 16.29 | L89: -1.5700000000000002e-002 | M89: 115.1 | N89: 26.18 | O89: 0.85299999999999998 | P89: 62.22 | Q89: 已到 | R89: 5年53天 | S89: 3年53天 | T89: 6.7 | U89: 12 | V89: 1.6e-002 | W89: 9.6000000000000002e-002 | X89: 5.9999999999999998e-002 | Y89: 69 | Z89: 3.14 | AA89: -2.9999999999999997e-004 | AB89: -5.6000000000000008e-003 | AC89: -3.2000000000000001e-002 | AD89: -3.4000000000000002e-002 | AE89: 90.86 | AF89: 94.08 | AG89: 0.16 | AH89: AA | AI89: 4.0800000000000003e-002 | AJ89: =H89+100*O89 -> 200.59999999999999 | AK89: 168.4 | AL89: 243 | AM89: 74.3 | AN89: 243 | AO89: 1.4999999999999999e-002 | AP89: 10 | AQ89: 拓斯转债!
A90: 89 | B90: 113620 | C90: 傲农转债! | D90: 603363 | E90: 傲农生物 | F90: 农业 | G90: 畜牧业 | H90: 134.11 | I90: -1.7500000000000002e-002 | J90: 7.4999999999999997e-003 | K90: 15.44 | L90: -1.72e-002 | M90: 121.1 | N90: 14.51 | O90: 0.26000000000000001 | P90: 106.41 | Q90: 已到 | R90: 5年53天 | S90: 3年53天 | T90: 10 | U90: 206 | V90: 0.151 | W90: 9.5000000000000001e-002 | X90: 0.10099999999999999 | Y90: 106 | Z90: 4.86 | AA90: -2.e-002 | AB90: -2.6699999999999998e-002 | AC90: -7.5499999999999998e-002 | AD90: -7.7399999999999997e-002 | AE90: 90.86 | AF90: 98.96 | AG90: 0.58 | AH90: AA | AI90: 4.0800000000000003e-002 | AJ90: =H90+100*O90 -> 160.11000000000001 | AK90: 161.8 | AL90: 199 | AM90: 62.8 | AN90: 159 | AO90: 0.16200000000000001 | AP90: 9 | AQ90: 傲农转债!
A91: 90 | B91: 113045 | C91: 环旭转债! | D91: 601231 | E91: 环旭电子 | F91: 电子 | G91: 电子产品 | H91: 119.59 | I91: -2.0999999999999999e-003 | J91: 3.0000000000000001e-003 | K91: 14.91 | L91: 3.4000000000000002e-003 | M91: 112 | N91: 19.75 | O91: 0.58399999999999996 | P91: 75.49 | Q91: 已到 | R91: 5年47天 | S91: 2年47天 | T91: 34.5 | U91: 14 | V91: 3.0000000000000001e-003 | W91: 0.105 | X91: 7.9000000000000001e-002 | Y91: 330 | Z91: 2.76 | AA91: -1.29e-002 | AB91: -1.7000000000000001e-002 | AC91: -6.3399999999999998e-002 | AD91: -6.5700000000000008e-002 | AE91: 94.92 | AF91: 93.74 | AG91: 0.28 | AH91: AA+ | AI91: 3.5799999999999998e-002 | AJ91: =H91+100*O91 -> 177.99000000000001 | AK91: 163.7 | AL91: 213 | AM91: 68.8 | AN91: 205 | AO91: -5.9000000000000004e-002 | AP91: 6 | AQ91: 环旭转债!
A92: 91 | B92: 128144 | C92: 利民转债! | D92: 2734 | E92: 利民股份 | F92: 化工 | G92: 农化 | H92: 143 | I92: -2.52e-002 | J92: 1.5800000000000002e-002 | K92: 13.48 | L92: -1.32e-002 | M92: 114.1 | N92: 11.5 | O92: 0.22 | P92: 117.22 | Q92: 已到 | R92: 5年44天 | S92: 3年44天 | T92: 9.79 | U92: 11 | V92: 8.0000000000000002e-003 | W92: 0.19500000000000001 | X92: 0.22899999999999998 | Y92: 50 | Z92: 1.99 | AA92: -4.3799999999999999e-002 | AB92: -4.8399999999999999e-002 | AC92: -9.6000000000000002e-002 | AD92: -9.74e-002 | AE92: 90.28 | AF92: 93.29 | AG92: 0.71 | AH92: AA | AI92: 4.0800000000000003e-002 | AJ92: =H92+100*O92 -> 165. | AK92: 168.8 | AL92: 244 | AM92: 75.5 | AN92: 249 | AO92: 3.7999999999999999e-002 | AP92: 5 | AQ92: 利民转债!
A93: 92 | B93: 118000 | C93: 嘉元转债! | D93: 688388 | E93: 嘉元科技 | F93: 电子 | G93: 电子产品 | H93: 194.35 | I93: 7.7000000000000002e-003 | J93: 7.4000000000000003e-003 | K93: 132.33 | L93: 1.6799999999999999e-002 | M93: 121 | N93: 78.74 | O93: 0.156 | P93: 168.06 | Q93: 已到 | R93: 5年38天 | S93: 3年38天 | T93: 9.79 | U93: 186 | V93: 9.8000000000000004e-002 | W93: 3.2000000000000001e-002 | X93: 5.2999999999999999e-002 | Y93: 310 | Z93: 10.34 | AA93: -9.0200000000000002e-002 | AB93: -9.6300000000000011e-002 | AC93: -0.105 | AD93: -0.106 | AE93: 85.6 | AF93: 89.71 | AG93: 0.89 | AH93: AA- | AI93: 6.1799999999999994e-002 | AJ93: =H93+100*O93 -> 209.94999999999999 | AK93: 220.6 | AL93: 338 | AM93: 130.9 | AN93: 339 | AO93: 5.5999999999999994e-002 | AP93: 6 | AQ93: 嘉元转债!
A94: 93 | B94: 123100 | C94: 朗科转债 | D94: 300543 | E94: 朗科智能 | F94: 电子 | G94: 电子产品 | H94: 134.5 | I94: -1.18e-002 | J94: -3.8e-003 | K94: 13.32 | L94: -2.1299999999999999e-002 | M94: 117.5 | N94: 11.61 | O94: 0.17199999999999999 | P94: 114.73 | Q94: 已到 | R94: 5年24天 | S94: 3年24天 | T94: 3.8 | U94: 6 | V94: 1.2e-002 | W94: 0.106 | X94: 0.122 | Y94: 36 | Z94: 3.77 | AA94: -2.6800000000000001e-002 | AB94: -3.2599999999999997e-002 | AC94: -7.7600000000000002e-002 | AD94: -7.9600000000000004e-002 | AE94: 85.73 | AF94: 87.31 | AG94: 0.73 | AH94: AA- | AI94: 6.1799999999999994e-002 | AJ94: =H94+100*O94 -> 151.69999999999999 | AK94: 154.3 | AL94: 143 | AM94: 67 | AN94: 190 | AO94: -5.5999999999999994e-002 | AP94: 9 | AQ94: 朗科转债
A95: 94 | B95: 123099 | C95: 普利转债 | D95: 300630 | E95: 普利制药 | F95: 医药 | G95: 化学制药 | H95: 137.55 | I95: 4.7999999999999996e-003 | J95: 9.4999999999999998e-003 | K95: 51.5 | L95: 2.12e-002 | M95: 123.5 | N95: 46.03 | O95: 0.22899999999999998 | P95: 111.88 | Q95: 已到 | R95: 5年24天 | S95: 3年24天 | T95: 8.5 | U95: 7.8 | V95: 6.9999999999999993e-003 | W95: 3.7999999999999999e-002 | X95: 4.2000000000000003e-002 | Y95: 225 | Z95: 9.46 | AA95: -2.1400000000000002e-002 | AB95: -2.8999999999999998e-002 | AC95: -8.4100000000000008e-002 | AD95: -8.5999999999999993e-002 | AE95: 85.73 | AF95: 91.74 | AG95: 0.67 | AH95: AA- | AI95: 6.1799999999999994e-002 | AJ95: =H95+100*O95 -> 160.45000000000002 | AK95: 163.2 | AL95: 208 | AM95: 71.5 | AN95: 222 | AO95: -6.9999999999999993e-003 | AP95: 5 | AQ95: 普利转债
A96: 95 | B96: 123098 | C96: 一品转债! | D96: 300723 | E96: 一品红 | F96: 医药 | G96: 医药行业 | H96: 153.069 | I96: 4.4000000000000003e-003 | J96: 2.1000000000000001e-002 | K96: 33.68 | L96: 3.2799999999999996e-002 | M96: 124 | N96: 25.48 | O96: 0.158 | P96: 132.18 | Q96: 已到 | R96: 5年12天 | S96: 3年12天 | T96: 4.24 | U96: 28 | V96: 4.2999999999999997e-002 | W96: 4.4000000000000004e-002 | X96: 5.7999999999999996e-002 | Y96: 97 | Z96: 5.8 | AA96: -4.1799999999999997e-002 | AB96: -4.9200000000000001e-002 | AC96: -0.113 | AD96: -0.115 | AE96: 85.97 | AF96: 92.31 | AG96: 0.77 | AH96: AA- | AI96: 6.1799999999999994e-002 | AJ96: =H96+100*O96 -> 168.869 | AK96: 174 | AL96: 267 | AM96: 81.6 | AN96: 272 | AO96: 2.e-003 | AP96: 7 | AQ96: 一品转债!
A97: 96 | B97: 123097 | C97: 美力转债 | D97: 300611 | E97: 美力科技 | F97: 机械装备 | G97: 通用设备 | H97: 138 | I97: 1.e-004 | J97: -7.000000000000001e-004 | K97: 11.87 | L97: -8.0000000000000004e-004 | M97: 121.6 | N97: 9.28 | O97: 7.9000000000000001e-002 | P97: 127.91 | Q97: 已到 | R97: 5年11天 | S97: 3年11天 | T97: 3 | U97: 102 | V97: 0.245 | W97: 0.14099999999999999 | X97: 0.18100000000000002 | Y97: 21 | Z97: 3.02 | AA97: -2.5399999999999999e-002 | AB97: -3.2400000000000005e-002 | AC97: -8.4000000000000005e-002 | AD97: -8.6300000000000002e-002 | AE97: 83.82 | AF97: 86.2 | AG97: 0.78 | AH97: A+ | AI97: 7.2800000000000004e-002 | AJ97: =H97+100*O97 -> 145.90000000000001 | AK97: 148.1 | AL97: 81 | AM97: 61.9 | AN97: 156 | AO97: 3.2000000000000001e-002 | AP97: 21 | AQ97: 美力转债
A98: 97 | B98: 123096 | C98: 思创转债! | D98: 300078 | E98: 思创医惠 | F98: 通信互联 | G98: 物联网 | H98: 121 | I98: -1.9099999999999999e-002 | J98: 2.9600000000000001e-002 | K98: 7.46 | L98: 2.0499999999999997e-002 | M98: 124 | N98: 8.27 | O98: 0.34100000000000003 | P98: 90.21 | Q98: 已到 | R98: 5年10天 | S98: 3年10天 | T98: 8.17 | U98: 12 | V98: 1.2e-002 | W98: 0.126 | X98: 0.114 | Y98: 65 | Z98: 2.37 | AA98: 5.0000000000000001e-003 | AB98: -3.0000000000000001e-003 | AC98: -4.7e-002 | AD98: -4.9100000000000005e-002 | AE98: 86 | AF98: 92.34 | AG98: 0.51 | AH98: AA- | AI98: 6.1799999999999994e-002 | AJ98: =H98+100*O98 -> 155.09999999999999 | AK98: 151.8 | AL98: 121 | AM98: 59.5 | AN98: 140 | AO98: 3.9e-002 | AP98: 13 | AQ98: 思创转债!
A99: 98 | B99: 113621 | C99: 彤程转债! | D99: 603650 | E99: 彤程新材 | F99: 化工 | G99: 橡胶塑料 | H99: 153.64 | I99: -6.8999999999999999e-003 | J99: -6.9999999999999993e-003 | K99: 38.05 | L99: -1.9299999999999998e-002 | M99: 115.1 | N99: 32.62 | O99: 0.317 | P99: 116.65 | Q99: 已到 | R99: 5年10天 | S99: 3年10天 | T99: 5.37 | U99: 29 | V99: 3.5000000000000003e-002 | W99: 2.4e-002 | X99: 2.7999999999999997e-002 | Y99: 227 | Z99: 8.47 | AA99: -5.6799999999999996e-002 | AB99: -6.1699999999999998e-002 | AC99: -0.115 | AD99: -0.11599999999999999 | AE99: 91.29 | AF99: 94.52 | AG99: 0.72 | AH99: AA | AI99: 4.0800000000000003e-002 | AJ99: =H99+100*O99 -> 185.33999999999997 | AK99: 190.6 | AL99: 313 | AM99: 96.1 | AN99: 307 | AO99: -0.192 | AP99: 7 | AQ99: 彤程转债!
A100: 99 | B100: 113042 | C100: 上银转债! | D100: 601229 | E100: 上海银行 | F100: 金融 | G100: 银行行业 | H100: 106.82 | I100: -1.01e-002 | J100: 8.0000000000000002e-003 | K100: 7.2 | L100: -1.23e-002 | M100: 120.9 | N100: 10.63 | O100: 0.57700000000000007 | P100: 67.73 | Q100: 已到 | R100: 5年9天 | S100: 无权 | T100: 200 | U100: 208 | V100: 1.e-002 | W100: 0.19600000000000001 | X100: 0.13200000000000001 | Y100: 1023. | Z100: 0.57 | AA100: 2.58e-002 | AB100: 1.83e-002 | AC100: 无权 | AD100: 无权 | AE100: 无权 | AF100: 102.83 | AG100: 0.17 | AH100: AAA | AI100: 3.3799999999999997e-002 | AJ100: =H100+100*O100 -> 164.52000000000001 | AK100: 145.9 | AL100: 63 | AM100: 43.1 | AN100: 32 | AO100: 1.e-003 | AP100: 16 | AQ100: 上银转债!
A101: 100 | B101: 113619 | C101: 世运转债! | D101: 603920 | E101: 世运电路 | F101: 电子 | G101: 元器件制 | H101: 139.83 | I101: 2.07e-002 | J101: 5.16e-002 | K101: 23.77 | L101: 0.10000000000000001 | M101: 115.2 | N101: 19.92 | O101: 0.17199999999999999 | P101: 119.33 | Q101: 已到 | R101: 5年4.6天 | S101: 3年4.6天 | T101: 10 | U101: 204 | V101: 0.14599999999999999 | W101: 7.9000000000000001e-002 | X101: 9.4e-002 | Y101: 127 | Z101: 4.85 | AA101: -3.8599999999999995e-002 | AB101: -4.3700000000000003e-002 | AC101: -9.0500000000000011e-002 | AD101: -9.2399999999999996e-002 | AE101: 91.45 | AF101: 94.68 | AG101: 0.72 | AH101: AA | AI101: 4.0800000000000003e-002 | AJ101: =H101+100*O101 -> 157.03 | AK101: 160.3 | AL101: 189 | AM101: 65.7 | AN101: 179 | AO101: 0.106 | AP101: 6 | AQ101: 世运转债!
A102: 101 | B102: 123093 | C102: 金陵转债! | D102: 300651 | E102: 金陵体育 | F102: 其他 | G102: 文化教育 | H102: 118.205 | I102: -1.7000000000000001e-002 | J102: 1.6500000000000001e-002 | K102: 29.54 | L102: -2.e-003 | M102: 129.3 | N102: 49.19 | O102: 0.96799999999999997 | P102: 60.05 | Q102: 已到 | R102: 5年3.6天 | S102: 3年3.6天 | T102: 2.5 | U102: 23 | V102: 7.5999999999999998e-002 | W102: 6.6000000000000003e-002 | X102: 3.9e-002 | Y102: 38 | Z102: 5.46 | AA102: 1.8700000000000001e-002 | AB102: 8.8999999999999999e-003 | AC102: -3.3099999999999997e-002 | AD102: -3.6699999999999997e-002 | AE102: 85.43 | AF102: 92 | AG102: 0.22 | AH102: A+ | AI102: 7.2800000000000004e-002 | AJ102: =H102+100*O102 -> 215.005 | AK102: 176.4 | AL102: 278 | AM102: 84.4 | AN102: 279 | AO102: 4.0999999999999995e-002 | AP102: 12 | AQ102: 金陵转债!
A103: 102 | B103: 113618 | C103: 美诺转债! | D103: 603538 | E103: 美诺华 | F103: 医药 | G103: 原料药 | H103: 128.75 | I103: 4.0999999999999995e-003 | J103: 2.18e-002 | K103: 37.15 | L103: 4.0000000000000001e-002 | M103: 115.3 | N103: 37.23 | O103: 0.28999999999999998 | P103: 99.79 | Q103: 已到 | R103: 4.996年 | S103: 2.996年 | T103: 5.2 | U103: 20 | V103: 2.8999999999999998e-002 | W103: 9.1999999999999998e-002 | X103: 9.1999999999999998e-002 | Y103: 56 | Z103: 3.29 | AA103: -2.29e-002 | AB103: -2.7999999999999997e-002 | AC103: -6.7400000000000002e-002 | AD103: -6.93e-002 | AE103: 86.1 | AF103: 86.32 | AG103: 0.64 | AH103: AA- | AI103: 6.0100000000000001e-002 | AJ103: =H103+100*O103 -> 157.75 | AK103: 157.7 | AL103: 167 | AM103: 71.4 | AN103: 221 | AO103: 8.900000000000001e-002 | AP103: 5 | AQ103: 美诺转债!
A104: 103 | B104: 128143 | C104: 锋龙转债! | D104: 2931 | E104: 锋龙股份 | F104: 机械装备 | G104: 专用设备 | H104: 131.698 | I104: 7.9000000000000008e-003 | J104: 7.9000000000000008e-003 | K104: 14.37 | L104: 2.2000000000000002e-002 | M104: 121.2 | N104: 12.73 | O104: 0.16699999999999998 | P104: 112.88 | Q104: 已到 | R104: 4.98年 | S104: 2.98年 | T104: 2.44 | U104: 24 | V104: 7.4999999999999997e-002 | W104: 8.5000000000000006e-002 | X104: 9.6000000000000002e-002 | Y104: 29 | Z104: 4.5 | AA104: -1.6899999999999998e-002 | AB104: -2.3900000000000001e-002 | AC104: -7.2499999999999995e-002 | AD104: -7.4800000000000005e-002 | AE104: 84.06 | AF104: 86.76 | AG104: 0.71 | AH104: A+ | AI104: 7.1099999999999997e-002 | AJ104: =H104+100*O104 -> 148.398 | AK104: 150.5 | AL104: 107 | AM104: 63.8 | AN104: 166 | AO104: 2.2000000000000002e-002 | AP104: 15 | AQ104: 锋龙转债!
A105: 104 | B105: 127028 | C105: 英特转债! | D105: 411 | E105: 英特集团 | F105: 医药 | G105: 医药商业 | H105: 126.495 | I105: -1.3100000000000001e-002 | J105: 1.09e-002 | K105: 14.72 | L105: -3.4000000000000002e-003 | M105: 112.8 | N105: 13.22 | O105: 0.13600000000000001 | P105: 111.35 | Q105: 已到 | R105: 4.97年 | S105: 2.97年 | T105: 5.99 | U105: 93 | V105: 0.121 | W105: 0.159 | X105: 0.17699999999999999 | Y105: 38 | Z105: 2.06 | AA105: -2.3199999999999998e-002 | AB105: -2.7699999999999999e-002 | AC105: -6.2899999999999998e-002 | AD105: -6.4699999999999994e-002 | AE105: 93.06 | AF105: 95.77 | AG105: 0.67 | AH105: AA+ | AI105: 3.4099999999999998e-002 | AJ105: =H105+100*O105 -> 140.095 | AK105: 141.6 | AL105: 30 | AM105: 45.9 | AN105: 48 | AO105: -1.2e-002 | AP105: 31 | AQ105: 英特转债!
A106: 105 | B106: 113616 | C106: 韦尔转债! | D106: 603501 | E106: 韦尔股份 | F106: 电子 | G106: 元器件制 | H106: 158.35 | I106: -1.15e-002 | J106: 4.0800000000000003e-002 | K106: 277.05 | L106: 3.9199999999999999e-002 | M106: 114.3 | N106: 222.52 | O106: 0.27200000000000002 | P106: 124.51 | Q106: 已到 | R106: 4.95年 | S106: 2.95年 | T106: 24.3 | U106: 248 | V106: 6.4000000000000001e-002 | W106: 1.e-002 | X106: 1.2e-002 | Y106: 2426. | Z106: 16.61 | AA106: -6.4600000000000005e-002 | AB106: -6.93e-002 | AC106: -0.127 | AD106: -0.129 | AE106: 92.65 | AF106: 97.06 | AG106: 0.75 | AH106: AA+ | AI106: 3.4099999999999998e-002 | AJ106: =H106+100*O106 -> 185.55000000000001 | AK106: 192.2 | AL106: 315 | AM106: 95.1 | AN106: 304 | AO106: -5.7000000000000002e-002 | AP106: 9 | AQ106: 韦尔转债!
A107: 106 | B107: 123092 | C107: 天壕转债! | D107: 300332 | E107: 天壕环境 | F107: 石油天然 | G107: 天然气 | H107: 207.849 | I107: -1.8100000000000002e-002 | J107: 6.4000000000000003e-003 | K107: 10.39 | L107: -1.24e-002 | M107: 121.1 | N107: 5.19 | O107: 3.7999999999999999e-002 | P107: 200.19 | Q107: 已到 | R107: 4.94年 | S107: 2.94年 | T107: 4.17 | U107: 199 | V107: 0.22699999999999998 | W107: 4.5999999999999999e-002 | X107: 9.0999999999999998e-002 | Y107: 92 | Z107: 2.69 | AA107: -0.105 | AB107: -0.11199999999999999 | AC107: -0.12300000000000001 | AD107: -0.124 | AE107: 84.28 | AF107: 86.93 | AG107: 0.95 | AH107: A+ | AI107: 7.1099999999999997e-002 | AJ107: =H107+100*O107 -> 211.649 | AK107: 215.5 | AL107: 334 | AM107: 128.6 | AN107: 337 | AO107: -3.7000000000000005e-002 | AP107: 9 | AQ107: 天壕转债!
A108: 107 | B108: 113615 | C108: 金诚转债! | D108: 603979 | E108: 金诚信 | F108: 有色金属 | G108: 有色行业 | H108: 196.84 | I108: 2.8999999999999998e-003 | J108: -4.5899999999999996e-002 | K108: 21.12 | L108: -4.6900000000000004e-002 | M108: 116.9 | N108: 12.65 | O108: 0.17899999999999999 | P108: 166.96 | Q108: 已到 | R108: 4.94年 | S108: 2.94年 | T108: 8.66 | U108: 80 | V108: 4.7e-002 | W108: 6.9000000000000006e-002 | X108: 0.115 | Y108: 125 | Z108: 2.53 | AA108: -0.10199999999999999 | AB108: -0.107 | AC108: -0.11599999999999999 | AD108: -0.11699999999999999 | AE108: 91.89 | AF108: 97.08 | AG108: 0.92 | AH108: AA | AI108: 3.9100000000000003e-002 | AJ108: =H108+100*O108 -> 214.74000000000001 | AK108: 226.7 | AL108: 340 | AM108: 129.6 | AN108: 338 | AO108: -1.e-002 | AP108: 3 | AQ108: 金诚转债!
A109: 108 | B109: 123091 | C109: 长海转债 | D109: 300196 | E109: 长海股份 | F109: 其他 | G109: 非金属矿 | H109: 137.3 | I109: -1.4000000000000002e-003 | J109: 9.3999999999999986e-003 | K109: 17.47 | L109: 1.2800000000000001e-002 | M109: 115.9 | N109: 16.14 | O109: 0.26800000000000002 | P109: 108.24 | Q109: 已到 | R109: 4.94年 | S109: 2.94年 | T109: 5.5 | U109: 4 | V109: 5.0000000000000001e-003 | W109: 7.6999999999999999e-002 | X109: 8.3000000000000004e-002 | Y109: 71 | Z109: 2.2 | AA109: -3.4300000000000004e-002 | AB109: -3.9699999999999999e-002 | AC109: -8.7899999999999992e-002 | AD109: -8.9700000000000002e-002 | AE109: 91.89 | AF109: 96.25 | AG109: 0.63 | AH109: AA | AI109: 3.9100000000000003e-002 | AJ109: =H109+100*O109 -> 164.10000000000002 | AK109: 166.4 | AL109: 236 | AM109: 70.1 | AN109: 215 | AO109: -6.0000000000000001e-003 | AP109: 4 | AQ109: 长海转债
A110: 109 | B110: 123089 | C110: 九洲转2!! | D110: 300040 | E110: 九洲集团 | F110: 能源电力 | G110: 电力设备 | H110: 160.22 | I110: -4.6699999999999998e-002 | J110: 1.8700000000000001e-002 | K110: 8.6 | L110: -3.2599999999999997e-002 | M110: 120.6 | N110: 5.68 | O110: 5.7999999999999996e-002 | P110: 151.41 | Q110: 已到 | R110: 4.93年 | S110: 2.93年 | T110: 3.06 | U110: 65 | V110: 0.128 | W110: 6.0999999999999999e-002 | X110: 9.1999999999999998e-002 | Y110: 51 | Z110: 1.97 | AA110: -5.6900000000000006e-002 | AB110: -6.3500000000000001e-002 | AC110: -0.13 | AD110: -0.13100000000000001 | AE110: 86.53 | AF110: 90.96 | AG110: 0.86 | AH110: AA- | AI110: 6.0100000000000001e-002 | AJ110: =H110+100*O110 -> 166.02000000000001 | AK110: 169 | AL110: 247 | AM110: 78.1 | AN110: 259 | AO110: -8.4000000000000005e-002 | AP110: 17 | AQ110: 九洲转2!!
A111: 110 | B111: 123090 | C111: 三诺转债! | D111: 300298 | E111: 三诺生物 | F111: 医药 | G111: 医疗器械 | H111: 127.5 | I111: 2.1700000000000001e-002 | J111: 1.e-002 | K111: 31.61 | L111: 7.1500000000000008e-002 | M111: 116.8 | N111: 35.18 | O111: 0.41899999999999998 | P111: 89.85 | Q111: 已到 | R111: 4.93年 | S111: 2.93年 | T111: 5 | U111: 83 | V111: 0.129 | W111: 2.7999999999999997e-002 | X111: 2.5000000000000001e-002 | Y111: 179 | Z111: 6.6 | AA111: -1.7899999999999999e-002 | AB111: -2.3700000000000002e-002 | AC111: -6.6100000000000006e-002 | AD111: -6.8000000000000005e-002 | AE111: 91.81 | AF111: 97 | AG111: 0.44 | AH111: AA | AI111: 3.9100000000000003e-002 | AJ111: =H111+100*O111 -> 169.40000000000001 | AK111: 165.1 | AL111: 226 | AM111: 68.1 | AN111: 200 | AO111: 5.9999999999999998e-002 | AP111: 5 | AQ111: 三诺转债!
A112: 111 | B112: 128142 | C112: 新乳转债! | D112: 2946 | E112: 新乳业 | F112: 食品饮料 | G112: 乳制品 | H112: 123.12 | I112: -1.11e-002 | J112: 6.1999999999999998e-003 | K112: 15.04 | L112: -1.38e-002 | M112: 114.8 | N112: 18.47 | O112: 0.51200000000000001 | P112: 81.43 | Q112: 已到 | R112: 4.92年 | S112: 2.92年 | T112: 7.18 | U112: 12 | V112: 1.3999999999999999e-002 | W112: 5.5e-002 | X112: 4.4999999999999998e-002 | Y112: 130 | Z112: 5.13 | AA112: -1.44e-002 | AB112: -1.9599999999999999e-002 | AC112: -5.5599999999999997e-002 | AD112: -5.7500000000000002e-002 | AE112: 91.84 | AF112: 95.38 | AG112: 0.36 | AH112: AA | AI112: 3.9100000000000003e-002 | AJ112: =H112+100*O112 -> 174.31999999999999 | AK112: 164.8 | AL112: 222 | AM112: 69.4 | AN112: 209 | AO112: -4.0999999999999995e-002 | AP112: 5 | AQ112: 新乳转债!
A113: 112 | B113: 128141 | C113: 旺能转债 | D113: 2034 | E113: 旺能环境 | F113: 城市公用 | G113: 三废处理 | H113: 141.5 | I113: -7.000000000000001e-004 | J113: 1.7100000000000001e-002 | K113: 19.74 | L113: 2.23e-002 | M113: 114.8 | N113: 15.97 | O113: 0.14499999999999999 | P113: 123.61 | Q113: 已到 | R113: 4.92年 | S113: 2.92年 | T113: 12.7 | U113: 145 | V113: 8.0000000000000002e-002 | W113: 0.14999999999999999 | X113: 0.185 | Y113: 85 | Z113: 1.69 | AA113: -4.2300000000000004e-002 | AB113: -4.7300000000000002e-002 | AC113: -9.7500000000000003e-002 | AD113: -9.9299999999999999e-002 | AE113: 91.85 | AF113: 95.39 | AG113: 0.74 | AH113: AA | AI113: 3.9100000000000003e-002 | AJ113: =H113+100*O113 -> 156. | AK113: 159.4 | AL113: 179 | AM113: 64 | AN113: 168 | AO113: 8.6999999999999994e-002 | AP113: 8 | AQ113: 旺能转债
A114: 113 | B114: 123087 | C114: 明电转债! | D114: 300739 | E114: 明阳电路 | F114: 电子 | G114: 元器件制 | H114: 127.01 | I114: -1.4999999999999999e-002 | J114: 2.0199999999999999e-002 | K114: 17.44 | L114: 8.1000000000000013e-003 | M114: 120.8 | N114: 16.32 | O114: 0.18899999999999997 | P114: 106.86 | Q114: 已到 | R114: 4.91年 | S114: 3.91年 | T114: 4.19 | U114: 31 | V114: 5.7999999999999996e-002 | W114: 8.1000000000000003e-002 | X114: 8.6999999999999994e-002 | Y114: 51 | Z114: 3.1 | AA114: -1.03e-002 | AB114: -1.7500000000000002e-002 | AC114: -4.3299999999999998e-002 | AD114: -4.5999999999999999e-002 | AE114: 84.1 | AF114: 91.23 | AG114: 0.65 | AH114: AA- | AI114: 6.0100000000000001e-002 | AJ114: =H114+100*O114 -> 145.91 | AK114: 147.2 | AL114: 73 | AM114: 55.9 | AN114: 114 | AO114: -6.8000000000000005e-002 | AP114: 18 | AQ114: 明电转债!
A115: 114 | B115: 123088 | C115: 威唐转债! | D115: 300707 | E115: 威唐工业 | F115: 汽车 | G115: 零部件制 | H115: 125.5 | I115: -1.5600000000000001e-002 | J115: 4.5999999999999999e-003 | K115: 18.13 | L115: -2.e-002 | M115: 121.1 | N115: 20.72 | O115: 0.434 | P115: 87.5 | Q115: 已到 | R115: 4.91年 | S115: 2.91年 | T115: 3.01 | U115: 14 | V115: 3.5000000000000003e-002 | W115: 0.106 | X115: 9.3000000000000013e-002 | Y115: 28 | Z115: 4.05 | AA115: -7.4000000000000003e-003 | AB115: -1.46e-002 | AC115: -5.9400000000000001e-002 | AD115: -6.1699999999999998e-002 | AE115: 84.43 | AF115: 87.07 | AG115: 0.55 | AH115: A+ | AI115: 7.1099999999999997e-002 | AJ115: =H115+100*O115 -> 168.90000000000001 | AK115: 163.5 | AL115: 210 | AM115: 76.4 | AN115: 254 | AO115: -6.8000000000000005e-002 | AP115: 18 | AQ115: 威唐转债!
A116: 115 | B116: 113044 | C116: 大秦转债! | D116: 601006 | E116: 大秦铁路 | F116: 铁路 | G116: 铁路运输 | H116: 109.07 | I116: -1.04e-002 | J116: 5.7999999999999996e-003 | K116: 6.45 | L116: -1.0700000000000001e-002 | M116: 113.9 | N116: 7.18 | O116: 0.214 | P116: 89.83 | Q116: 已到 | R116: 4.91年 | S116: 2.91年 | T116: 320 | U116: 272 | V116: 8.0000000000000002e-003 | W116: 0.33399999999999996 | X116: 0.29999999999999999 | Y116: 959 | Z116: 0.8 | AA116: 9.0000000000000011e-003 | AB116: 3.9000000000000003e-003 | AC116: -1.6299999999999999e-002 | AD116: -1.8600000000000002e-002 | AE116: 94.19 | AF116: 97.84 | AG116: 0.43 | AH116: AAA | AI116: 3.2099999999999997e-002 | AJ116: =H116+100*O116 -> 130.47 | AK116: 128.3 | AL116: 3 | AM116: 30.5 | AN116: 4 | AO116: 5.0000000000000001e-003 | AP116: 34 | AQ116: 大秦转债!
A117: 116 | B117: 123085 | C117: 万顺转2!! | D117: 300057 | E117: 万顺新材 | F117: 有色金属 | G117: 铝金属 | H117: 145.5 | I117: 1.04e-002 | J117: 1.2e-002 | K117: 8.67 | L117: 2.6000000000000002e-002 | M117: 112.9 | N117: 6.2 | O117: 4.0000000000000001e-002 | P117: 139.84 | Q117: 已到 | R117: 4.90年 | S117: 2.90年 | T117: 8.51 | U117: 61 | V117: 4.9000000000000002e-002 | W117: 0.14400000000000002 | X117: 0.20100000000000001 | Y117: 59 | Z117: 1.64 | AA117: -5.1299999999999998e-002 | AB117: -5.5599999999999997e-002 | AC117: -0.10400000000000001 | AD117: -0.106 | AE117: 86.57 | AF117: 85.29 | AG117: 0.86 | AH117: AA- | AI117: 6.0100000000000001e-002 | AJ117: =H117+100*O117 -> 149.5 | AK117: 151.2 | AL117: 115 | AM117: 64.6 | AN117: 172 | AO117: -7.2000000000000008e-002 | AP117: 19 | AQ117: 万顺转2!!
A118: 117 | B118: 123086 | C118: 海兰转债!! | D118: 300065 | E118: 海兰信 | F118: 电子 | G118: 电子产品 | H118: 199.145 | I118: 5.7999999999999996e-003 | J118: -1.0500000000000001e-002 | K118: 13.76 | L118: -5.1000000000000004e-003 | M118: 123.1 | N118: 7.27 | O118: 5.2000000000000005e-002 | P118: 189.27 | Q118: 已到 | R118: 4.90年 | S118: 2.90年 | T118: 4.82 | U118: 451 | V118: 0.46500000000000002 | W118: 5.5999999999999994e-002 | X118: 0.105 | Y118: 87 | Z118: 5.15 | AA118: -9.4800000000000009e-002 | AB118: -0.10199999999999999 | AC118: -0.12 | AD118: -0.121 | AE118: 86.6 | AF118: 92.96 | AG118: 0.93 | AH118: AA- | AI118: 6.0100000000000001e-002 | AJ118: =H118+100*O118 -> 204.345 | AK118: 209 | AL118: 332 | AM118: 116.1 | AN118: 331 | AO118: -0.18100000000000002 | AP118: 18 | AQ118: 海兰转债!!
A119: 118 | B119: 123084 | C119: 高澜转债!! | D119: 300499 | E119: 高澜股份 | F119: 能源电力 | G119: 电力设备 | H119: 183.45 | I119: 3.3500000000000002e-002 | J119: -1.34e-002 | K119: 14.3 | L119: 2.29e-002 | M119: 121.4 | N119: 9.01 | O119: 0.156 | P119: 158.71 | Q119: 已到 | R119: 4.90年 | S119: 2.90年 | T119: 2.54 | U119: 192 | V119: 0.41299999999999998 | W119: 6.3e-002 | X119: 0.10099999999999999 | Y119: 40 | Z119: 4.66 | AA119: -8.2299999999999998e-002 | AB119: -8.8900000000000007e-002 | AC119: -0.107 | AD119: -0.10800000000000001 | AE119: 84.68 | AF119: 87.4 | AG119: 0.88 | AH119: A+ | AI119: 7.1099999999999997e-002 | AJ119: =H119+100*O119 -> 199.04999999999998 | AK119: 208.2 | AL119: 331 | AM119: 120.8 | AN119: 334 | AO119: -8.199999999999999e-002 | AP119: 14 | AQ119: 高澜转债!!
A120: 119 | B120: 127027 | C120: 靖远转债! | D120: 552 | E120: 靖远煤电 | F120: 煤炭 | G120: 煤炭开采 | H120: 131.4 | I120: -1.5100000000000001e-002 | J120: -2.9500000000000002e-002 | K120: 3.53 | L120: -6.8600000000000008e-002 | M120: 114.9 | N120: 3.13 | O120: 0.16500000000000001 | P120: 112.78 | Q120: 已到 | R120: 4.90年 | S120: 2.90年 | T120: 24.3 | U120: 122 | V120: 3.7999999999999999e-002 | W120: 0.29299999999999998 | X120: 0.33000000000000002 | Y120: 83 | Z120: 1 | AA120: -2.75e-002 | AB120: -3.27e-002 | AC120: -7.5700000000000003e-002 | AD120: -7.7600000000000002e-002 | AE120: 93.38 | AF120: 97.79 | AG120: 0.65 | AH120: AA+ | AI120: 3.4099999999999998e-002 | AJ120: =H120+100*O120 -> 147.90000000000001 | AK120: 150 | AL120: 98 | AM120: 52.2 | AN120: 88 | AO120: -1.9e-002 | AP120: 37 | AQ120: 靖远转债!
A121: 120 | B121: 113043 | C121: 财通转债! | D121: 601108 | E121: 财通证券 | F121: 金融 | G121: 证券行业 | H121: 116.6 | I121: -1.84e-002 | J121: 8.3000000000000001e-003 | K121: 10.38 | L121: -2.9900000000000003e-002 | M121: 110 | N121: 13.13 | O121: 0.47499999999999998 | P121: 79.06 | Q121: 已到 | R121: 4.90年 | S121: 无权 | T121: 38 | U121: 36 | V121: 8.0000000000000002e-003 | W121: 0.10199999999999999 | X121: 8.1000000000000003e-002 | Y121: 373 | Z121: 1.6 | AA121: -1.2e-002 | AB121: -1.5700000000000002e-002 | AC121: 无权 | AD121: 无权 | AE121: 无权 | AF121: 94.43 | AG121: 0.34 | AH121: AAA | AI121: 3.2099999999999997e-002 | AJ121: =H121+100*O121 -> 164.09999999999999 | AK121: 154.1 | AL121: 142 | AM121: 59.7 | AN121: 142 | AO121: -5.5999999999999994e-002 | AP121: 11 | AQ121: 财通转债!
A122: 121 | B122: 123083 | C122: 朗新转债! | D122: 300682 | E122: 朗新科技 | F122: 计算机及 | G122: 软件开发 | H122: 224.87 | I122: -1.0700000000000001e-002 | J122: 1.1599999999999999e-002 | K122: 33.78 | L122: 8.9999999999999998e-004 | M122: 114.8 | N122: 15.39 | O122: 2.4e-002 | P122: 219.49 | Q122: 已到 | R122: 4.90年 | S122: 2.90年 | T122: 6.01 | U122: 65 | V122: 4.8000000000000001e-002 | W122: 1.7000000000000001e-002 | X122: 3.7000000000000005e-002 | Y122: 353 | Z122: 6.42 | AA122: -0.13 | AB122: -0.13400000000000001 | AC122: -0.13600000000000001 | AD122: -0.13699999999999998 | AE122: 91.93 | AF122: 95.47 | AG122: 0.97 | AH122: AA | AI122: 3.9100000000000003e-002 | AJ122: =H122+100*O122 -> 227.27000000000001 | AK122: 230.2 | AL122: 343 | AM122: 134.8 | AN122: 343 | AO122: -7.8e-002 | AP122: 7 | AQ122: 朗新转债!
A123: 122 | B123: 127026 | C123: 超声转债! | D123: 823 | E123: 超声电子 | F123: 电子 | G123: 元器件制 | H123: 131.1 | I123: 2.3e-003 | J123: 8.9999999999999998e-004 | K123: 13.15 | L123: 5.4000000000000003e-003 | M123: 112.8 | N123: 12.72 | O123: 0.26800000000000002 | P123: 103.38 | Q123: 已到 | R123: 4.89年 | S123: 2.89年 | T123: 7 | U123: 11 | V123: 1.2e-002 | W123: 9.9000000000000005e-002 | X123: 0.10199999999999999 | Y123: 71 | Z123: 1.77 | AA123: -3.0800000000000001e-002 | AB123: -3.5299999999999998e-002 | AC123: -7.5399999999999995e-002 | AD123: -7.7199999999999991e-002 | AE123: 91.94 | AF123: 93.82 | AG123: 0.61 | AH123: AA | AI123: 3.9100000000000003e-002 | AJ123: =H123+100*O123 -> 157.90000000000001 | AK123: 158.8 | AL123: 175 | AM123: 65 | AN123: 176 | AO123: -1.e-003 | AP123: 12 | AQ123: 超声转债!
A124: 123 | B124: 128140 | C124: 润建转债!! | D124: 2929 | E124: 润建股份 | F124: 通信互联 | G124: 通信设备 | H124: 150.209 | I124: -1.18e-002 | J124: 1.3899999999999999e-002 | K124: 33.69 | L124: 2.7000000000000001e-003 | M124: 114.9 | N124: 26.4 | O124: 0.17699999999999999 | P124: 127.61 | Q124: 已到 | R124: 4.89年 | S124: 2.89年 | T124: 10.9 | U124: 9.5 | V124: 6.0000000000000001e-003 | W124: 0.14099999999999999 | X124: 0.17999999999999999 | Y124: 77 | Z124: 2.19 | AA124: -5.4199999999999998e-002 | AB124: -5.9200000000000003e-002 | AC124: -0.114 | AD124: -0.11599999999999999 | AE124: 92.04 | AF124: 95.58 | AG124: 0.77 | AH124: AA | AI124: 3.9100000000000003e-002 | AJ124: =H124+100*O124 -> 167.90899999999999 | AK124: 172.8 | AL124: 262 | AM124: 77.2 | AN124: 256 | AO124: -6.2e-002 | AP124: 10 | AQ124: 润建转债!!
A125: 124 | B125: 123082 | C125: 北陆转债! | D125: 300016 | E125: 北陆药业 | F125: 医药 | G125: 化学制药 | H125: 127.06 | I125: 1.e-002 | J125: 2.23e-002 | K125: 9.72 | L125: 4.6300000000000001e-002 | M125: 121.2 | N125: 8.81 | O125: 0.152 | P125: 110.33 | Q125: 已到 | R125: 4.89年 | S125: 2.89年 | T125: 4.99 | U125: 96 | V125: 0.151 | W125: 0.10400000000000001 | X125: 0.115 | Y125: 48 | Z125: 2.79 | AA125: -9.7999999999999997e-003 | AB125: -1.7100000000000001e-002 | AC125: -6.3600000000000004e-002 | AD125: -6.59e-002 | AE125: 84.57 | AF125: 87.28 | AG125: 0.7 | AH125: A+ | AI125: 7.1099999999999997e-002 | AJ125: =H125+100*O125 -> 142.25999999999999 | AK125: 143.8 | AL125: 45 | AM125: 56.5 | AN125: 117 | AO125: 0.114 | AP125: 18 | AQ125: 北陆转债!
A126: 125 | B126: 123080 | C126: 海波转债! | D126: 300517 | E126: 海波重科 | F126: 建筑 | G126: 建筑工程 | H126: 129.824 | I126: -1.6500000000000001e-002 | J126: 1.e-004 | K126: 13.32 | L126: -2.35e-002 | M126: 126 | N126: 11.58 | O126: 0.129 | P126: 115.03 | Q126: 已到 | R126: 4.88年 | S126: 2.88年 | T126: 2.44 | U126: 16 | V126: 5.0999999999999997e-002 | W126: 9.5000000000000001e-002 | X126: 0.109 | Y126: 26 | Z126: 2.98 | AA126: -6.1999999999999998e-003 | AB126: -1.49e-002 | AC126: -7.0400000000000004e-002 | AD126: -7.2700000000000001e-002 | AE126: 84.7 | AF126: 90.8 | AG126: 0.7 | AH126: A+ | AI126: 7.1099999999999997e-002 | AJ126: =H126+100*O126 -> 142.72400000000002 | AK126: 144.6 | AL126: 55 | AM126: 53.8 | AN126: 100 | AO126: 2.e-003 | AP126: 25 | AQ126: 海波转债!
A127: 126 | B127: 113610 | C127: 灵康转债 | D127: 603669 | E127: 灵康药业 | F127: 医药 | G127: 化学制药 | H127: 127.99 | I127: 1.1200000000000002e-002 | J127: 1.5800000000000002e-002 | K127: 9.65 | L127: 3.9900000000000005e-002 | M127: 120.7 | N127: 8.61 | O127: 0.14199999999999999 | P127: 112.08 | Q127: 已到 | R127: 4.88年 | S127: 2.88年 | T127: 4.58 | U127: 44 | V127: 7.4999999999999997e-002 | W127: 6.6000000000000003e-002 | X127: 7.400000000000001e-002 | Y127: 70 | Z127: 5.05 | AA127: -1.2199999999999999e-002 | AB127: -1.9299999999999998e-002 | AC127: -6.7599999999999993e-002 | AD127: -6.9599999999999995e-002 | AE127: 86.9 | AF127: 91.34 | AG127: 0.68 | AH127: AA- | AI127: 6.0100000000000001e-002 | AJ127: =H127+100*O127 -> 142.19 | AK127: 143.9 | AL127: 46 | AM127: 52.6 | AN127: 91 | AO127: -1.3000000000000001e-002 | AP127: 29 | AQ127: 灵康转债
A128: 127 | B128: 128139 | C128: 祥鑫转债! | D128: 2965 | E128: 祥鑫科技 | F128: 汽车 | G128: 零部件制 | H128: 126.98 | I128: 1.e-004 | J128: -1.e-003 | K128: 25.33 | L128: -3.0999999999999999e-003 | M128: 120.6 | N128: 36.52 | O128: 0.83099999999999996 | P128: 69.36 | Q128: 已到 | R128: 4.88年 | S128: 2.88年 | T128: 6.47 | U128: 13 | V128: 1.6e-002 | W128: 0.16600000000000001 | X128: 0.115 | Y128: 39 | Z128: 2.19 | AA128: -1.0700000000000001e-002 | AB128: -1.78e-002 | AC128: -6.54e-002 | AD128: -6.7400000000000002e-002 | AE128: 86.81 | AF128: 91.25 | AG128: 0.29 | AH128: AA- | AI128: 6.0100000000000001e-002 | AJ128: =H128+100*O128 -> 210.07999999999998 | AK128: 184.6 | AL128: 301 | AM128: 93.4 | AN128: 300 | AO128: 4.0000000000000001e-003 | AP128: 14 | AQ128: 祥鑫转债!
A129: 128 | B129: 123078 | C129: 飞凯转债!! | D129: 300398 | E129: 飞凯材料 | F129: 化工 | G129: 化工 | H129: 208 | I129: 4.7899999999999998e-002 | J129: 3.4599999999999999e-002 | K129: 32.57 | L129: 8.5699999999999998e-002 | M129: 114.9 | N129: 15.56 | O129: -6.0000000000000001e-003 | P129: 209.32 | Q129: 已到 | R129: 4.86年 | S129: 2.86年 | T129: 8.1 | U129: 5588. | V129: 3.2999999999999998 | W129: 4.8000000000000001e-002 | X129: 0.10099999999999999 | Y129: 168 | Z129: 5.81 | AA129: -0.11699999999999999 | AB129: -0.121 | AC129: -0.128 | AD129: -0.129 | AE129: 92.14 | AF129: 95.68 | AG129: 0.96 | AH129: AA | AI129: 3.9100000000000003e-002 | AJ129: =H129+100*O129 -> 207.40000000000001 | AK129: 206.7 | AL129: 329 | AM129: 111 | AN129: 328 | AO129: 0.35600000000000004 | AP129: 8 | AQ129: 飞凯转债!!
A130: 129 | B130: 113609 | C130: 永安转债! | D130: 603776 | E130: 永安行 | F130: 城市公用 | G130: 其他 | H130: 130.42 | I130: 5.1999999999999998e-003 | J130: 1.6e-002 | K130: 19.87 | L130: 2.8500000000000001e-002 | M130: 120.1 | N130: 16.48 | O130: 8.199999999999999e-002 | P130: 120.57 | Q130: 已到 | R130: 4.86年 | S130: 2.86年 | T130: 7.34 | U130: 85 | V130: 8.6999999999999994e-002 | W130: 0.158 | X130: 0.191 | Y130: 46 | Z130: 1.42 | AA130: -1.7100000000000001e-002 | AB130: -2.4e-002 | AC130: -7.4299999999999991e-002 | AD130: -7.6299999999999993e-002 | AE130: 86.83 | AF130: 90.95 | AG130: 0.74 | AH130: AA- | AI130: 6.0100000000000001e-002 | AJ130: =H130+100*O130 -> 138.61999999999998 | AK130: 140.3 | AL130: 25 | AM130: 49.3 | AN130: 74 | AO130: -2.e-002 | AP130: 25 | AQ130: 永安转债!
A131: 130 | B131: 123077 | C131: 汉得转债! | D131: 300170 | E131: 汉得信息 | F131: 计算机及 | G131: 软件开发 | H131: 119.128 | I131: -1.1399999999999999e-002 | J131: 5.6999999999999993e-003 | K131: 8.27 | L131: -1.78e-002 | M131: 125.1 | N131: 9.69 | O131: 0.39600000000000002 | P131: 85.35 | Q131: 已到 | R131: 4.85年 | S131: 2.85年 | T131: 9.37 | U131: 8.4 | V131: 8.0000000000000002e-003 | W131: 0.128 | X131: 0.109 | Y131: 73 | Z131: 2.34 | AA131: 1.03e-002 | AB131: 1.7000000000000001e-003 | AC131: -4.5999999999999999e-002 | AD131: -4.8099999999999997e-002 | AE131: 92.21 | AF131: 104.2 | AG131: 0.32 | AH131: AA | AI131: 3.9100000000000003e-002 | AJ131: =H131+100*O131 -> 158.72800000000001 | AK131: 152.9 | AL131: 137 | AM131: 48.7 | AN131: 67 | AO131: -2.3e-002 | AP131: 17 | AQ131: 汉得转债!
A132: 131 | B132: 110077 | C132: 洪城转债 | D132: 600461 | E132: 洪城环境 | F132: 城市公用 | G132: 城市公用 | H132: 141.85 | I132: -9.8999999999999991e-003 | J132: -3.4999999999999996e-003 | K132: 8.29 | L132: -1.78e-002 | M132: 113.3 | N132: 6.71 | O132: 0.14800000000000002 | P132: 123.55 | Q132: 已到 | R132: 4.85年 | S132: 2.85年 | T132: 17.7 | U132: 23 | V132: 9.0000000000000011e-003 | W132: 0.22399999999999998 | X132: 0.27600000000000002 | Y132: 79 | Z132: 1.46 | AA132: -4.58e-002 | AB132: -5.04e-002 | AC132: -0.10300000000000001 | AD132: -0.10400000000000001 | AE132: 92.29 | AF132: 96.5 | AG132: 0.76 | AH132: AA+ | AI132: 3.4099999999999998e-002 | AJ132: =H132+100*O132 -> 156.65000000000001 | AK132: 160.2 | AL132: 188 | AM132: 63.7 | AN132: 165 | AO132: -1.e-003 | AP132: 6 | AQ132: 洪城转债
A133: 132 | B133: 123076 | C133: 强力转债! | D133: 300429 | E133: 强力新材 | F133: 化工 | G133: 化工 | H133: 109.421 | I133: -1.47e-002 | J133: 1.11e-002 | K133: 12.03 | L133: -1.55e-002 | M133: 118.1 | N133: 18.94 | O133: 0.72299999999999998 | P133: 63.52 | Q133: 已到 | R133: 4.84年 | S133: 2.84年 | T133: 8.5 | U133: 19 | V133: 2.1000000000000001e-002 | W133: 0.13699999999999998 | X133: 8.6999999999999994e-002 | Y133: 62 | Z133: 3.43 | AA133: 1.6200000000000003e-002 | AB133: 9.4999999999999998e-003 | AC133: -1.8700000000000001e-002 | AD133: -2.0799999999999999e-002 | AE133: 86.9 | AF133: 89.52 | AG133: 0.23 | AH133: AA- | AI133: 6.0100000000000001e-002 | AJ133: =H133+100*O133 -> 181.721 | AK133: 155.3 | AL133: 151 | AM133: 65.8 | AN133: 181 | AO133: 0. | AP133: 23 | AQ133: 强力转债!
A134: 133 | B134: 128138 | C134: 侨银转债! | D134: 2973 | E134: 侨银股份 | F134: 城市公用 | G134: 城市公用 | H134: 117 | I134: -1.5100000000000001e-002 | J134: 1.44e-002 | K134: 16.2 | L134: -4.3e-003 | M134: 136.1 | N134: 25.33 | O134: 0.82900000000000007 | P134: 63.96 | Q134: 已到 | R134: 4.84年 | S134: 2.84年 | T134: 4.2 | U134: 9.6 | V134: 2.e-002 | W134: 6.3e-002 | X134: 4.0999999999999995e-002 | Y134: 66 | Z134: 4.13 | AA134: 3.2400000000000005e-002 | AB134: 2.0499999999999997e-002 | AC134: -3.8699999999999998e-002 | AD134: -4.1100000000000005e-002 | AE134: 87.43 | AF134: 103.19 | AG134: 0.16 | AH134: AA- | AI134: 6.0100000000000001e-002 | AJ134: =H134+100*O134 -> 199.90000000000001 | AK134: 170 | AL134: 249 | AM134: 66.9 | AN134: 188 | AO134: 5.0999999999999997e-002 | AP134: 25 | AQ134: 侨银转债!
A135: 134 | B135: 113608 | C135: 威派转债! | D135: 603956 | E135: 威派格 | F135: 机械装备 | G135: 专用设备 | H135: 121.89 | I135: -1.6399999999999998e-002 | J135: 3.4000000000000002e-003 | K135: 17.82 | L135: -2.2000000000000002e-002 | M135: 121.1 | N135: 19.08 | O135: 0.30499999999999999 | P135: 93.4 | Q135: 已到 | R135: 4.82年 | S135: 2.82年 | T135: 4.2 | U135: 10 | V135: 2.e-002 | W135: 5.5e-002 | X135: 5.2000000000000005e-002 | Y135: 76 | Z135: 6.41 | AA135: -1.4000000000000002e-003 | AB135: -8.8000000000000005e-003 | AC135: -5.2000000000000005e-002 | AD135: -5.4400000000000004e-002 | AE135: 85 | AF135: 87.67 | AG135: 0.59 | AH135: A+ | AI135: 7.1099999999999997e-002 | AJ135: =H135+100*O135 -> 152.38999999999999 | AK135: 150.4 | AL135: 103 | AM135: 62.7 | AN135: 158 | AO135: 6.9999999999999993e-003 | AP135: 8 | AQ135: 威派转债!
A136: 135 | B136: 127025 | C136: 冀东转债! | D136: 401 | E136: 冀东水泥 | F136: 建筑 | G136: 水泥 | H136: 117.588 | I136: -1.3500000000000002e-002 | J136: 3.8e-003 | K136: 11.99 | L136: -2.3599999999999999e-002 | M136: 109.9 | N136: 14.01 | O136: 0.374 | P136: 85.58 | Q136: 已到 | R136: 4.80年 | S136: 2.80年 | T136: 17.8 | U136: 13 | V136: 6.0000000000000001e-003 | W136: 5.9999999999999998e-002 | X136: 5.0999999999999997e-002 | Y136: 297 | Z136: 1.04 | AA136: -1.4199999999999999e-002 | AB136: -1.7899999999999999e-002 | AC136: -4.4900000000000002e-002 | AD136: -4.6500000000000007e-002 | AE136: 93.51 | AF136: 94.65 | AG136: 0.41 | AH136: AAA | AI136: 3.2099999999999997e-002 | AJ136: =H136+100*O136 -> 154.988 | AK136: 149.6 | AL136: 96 | AM136: 54.9 | AN136: 108 | AO136: -1.6e-002 | AP136: 8 | AQ136: 冀东转债!
A137: 136 | B137: 127024 | C137: 盈峰转债! | D137: 967 | E137: 盈峰环境 | F137: 机械装备 | G137: 专用设备 | H137: 116.44 | I137: -2.1000000000000001e-002 | J137: 2.1000000000000001e-002 | K137: 6.61 | L137: 0. | M137: 116.6 | N137: 8.19 | O137: 0.44299999999999995 | P137: 80.71 | Q137: 已到 | R137: 4.80年 | S137: 2.80年 | T137: 14.8 | U137: 12 | V137: 6.9999999999999993e-003 | W137: 7.0000000000000007e-002 | X137: 5.7000000000000002e-002 | Y137: 210 | Z137: 1.27 | AA137: 2.9999999999999997e-004 | AB137: -5.7999999999999996e-003 | AC137: -4.0399999999999998e-002 | AD137: -4.2300000000000004e-002 | AE137: 93.4 | AF137: 99.53 | AG137: 0.29 | AH137: AA+ | AI137: 3.4099999999999998e-002 | AJ137: =H137+100*O137 -> 160.74000000000001 | AK137: 152.2 | AL137: 128 | AM137: 52.6 | AN137: 92 | AO137: -0.11699999999999999 | AP137: 6 | AQ137: 盈峰转债!
A138: 137 | B138: 128137 | C138: 洁美转债! | D138: 2859 | E138: 洁美科技 | F138: 电子 | G138: 元器件制 | H138: 152.1 | I138: 4.0000000000000001e-003 | J138: 4.7999999999999996e-003 | K138: 34.69 | L138: 1.11e-002 | M138: 116.9 | N138: 27.63 | O138: 0.21100000000000002 | P138: 125.55 | Q138: 已到 | R138: 4.80年 | S138: 2.80年 | T138: 5.99 | U138: 11 | V138: 1.1000000000000001e-002 | W138: 4.2000000000000003e-002 | X138: 5.2999999999999999e-002 | Y138: 142 | Z138: 7.22 | AA138: -5.4199999999999998e-002 | AB138: -5.9900000000000002e-002 | AC138: -0.121 | AD138: -0.12300000000000001 | AE138: 87.08 | AF138: 88.82 | AG138: 0.79 | AH138: AA- | AI138: 6.0100000000000001e-002 | AJ138: =H138+100*O138 -> 173.19999999999999 | AK138: 178.6 | AL138: 290 | AM138: 89.8 | AN138: 293 | AO138: -4.2000000000000003e-002 | AP138: 5 | AQ138: 洁美转债!
A139: 138 | B139: 128136 | C139: 立讯转债! | D139: 2475 | E139: 立讯精密 | F139: 电子 | G139: 元器件制 | H139: 124.96 | I139: 0. | J139: 6.8999999999999999e-003 | K139: 46.3 | L139: 2.07e-002 | M139: 111.8 | N139: 57.98 | O139: 0.56499999999999995 | P139: 79.86 | Q139: 已到 | R139: 4.80年 | S139: 2.80年 | T139: 30 | U139: 45 | V139: 1.2e-002 | W139: 9.0000000000000011e-003 | X139: 6.9999999999999993e-003 | Y139: 3274. | Z139: 10.13 | AA139: -2.3199999999999998e-002 | AB139: -2.75e-002 | AC139: -6.54e-002 | AD139: -6.6799999999999998e-002 | AE139: 92.64 | AF139: 95.37 | AG139: 0.33 | AH139: AA+ | AI139: 3.4099999999999998e-002 | AJ139: =H139+100*O139 -> 181.45999999999998 | AK139: 170.1 | AL139: 250 | AM139: 74.7 | AN139: 245 | AO139: -2.7000000000000003e-002 | AP139: 14 | AQ139: 立讯转债!
A140: 139 | B140: 110076 | C140: 华海转债! | D140: 600521 | E140: 华海药业 | F140: 医药 | G140: 医药行业 | H140: 116.19 | I140: -1.3899999999999999e-002 | J140: 1.6e-002 | K140: 23.27 | L140: 1.e-002 | M140: 114.8 | N140: 33.85 | O140: 0.68999999999999995 | P140: 68.74 | Q140: 已到 | R140: 4.80年 | S140: 2.80年 | T140: 18.4 | U140: 32 | V140: 1.4999999999999999e-002 | W140: 5.2999999999999999e-002 | X140: 3.6000000000000004e-002 | Y140: 347 | Z140: 5.29 | AA140: -2.5999999999999999e-003 | AB140: -8.0000000000000002e-003 | AC140: -3.9199999999999999e-002 | AD140: -4.1200000000000001e-002 | AE140: 92.29 | AF140: 95.84 | AG140: 0.21 | AH140: AA | AI140: 3.9100000000000003e-002 | AJ140: =H140+100*O140 -> 185.19 | AK140: 163.6 | AL140: 212 | AM140: 67.8 | AN140: 196 | AO140: 0.109 | AP140: 8 | AQ140: 华海转债!
A141: 140 | B141: 123075 | C141: 贝斯转债! | D141: 300580 | E141: 贝斯特 | F141: 汽车 | G141: 零部件制 | H141: 156.4 | I141: 3.1e-002 | J141: 1.54e-002 | K141: 31.97 | L141: 5.6900000000000006e-002 | M141: 115.1 | N141: 23.74 | O141: 0.161 | P141: 134.67 | Q141: 已到 | R141: 4.80年 | S141: 2.80年 | T141: 6 | U141: 290 | V141: 0.31 | W141: 9.4e-002 | X141: 0.126 | Y141: 64 | Z141: 3.61 | AA141: -6.3e-002 | AB141: -6.8000000000000005e-002 | AC141: -0.129 | AD141: -0.13100000000000001 | AE141: 87.14 | AF141: 87.49 | AG141: 0.82 | AH141: AA- | AI141: 6.0100000000000001e-002 | AJ141: =H141+100*O141 -> 172.5 | AK141: 178.1 | AL141: 285 | AM141: 90.6 | AN141: 294 | AO141: 0.16300000000000001 | AP141: 8 | AQ141: 贝斯转债!
A142: 141 | B142: 113606 | C142: 荣泰转债 | D142: 603579 | E142: 荣泰健康 | F142: 机械装备 | G142: 专用设备 | H142: 125.99 | I142: -1.8000000000000002e-002 | J142: 2.2200000000000001e-002 | K142: 32.91 | L142: 6.9999999999999993e-003 | M142: 120.7 | N142: 32.83 | O142: 0.25700000000000001 | P142: 100.24 | Q142: 已到 | R142: 4.79年 | S142: 2.79年 | T142: 6 | U142: 10 | V142: 1.3000000000000001e-002 | W142: 0.13 | X142: 0.13100000000000001 | Y142: 46 | Z142: 2.75 | AA142: -9.1000000000000004e-003 | AB142: -1.6399999999999998e-002 | AC142: -6.4500000000000002e-002 | AD142: -6.6600000000000006e-002 | AE142: 87.35 | AF142: 91.81 | AG142: 0.59 | AH142: AA- | AI142: 6.0100000000000001e-002 | AJ142: =H142+100*O142 -> 151.69 | AK142: 151.7 | AL142: 120 | AM142: 59.9 | AN142: 145 | AO142: 2.9999999999999999e-002 | AP142: 11 | AQ142: 荣泰转债
A143: 142 | B143: 123073 | C143: 同和转债!! | D143: 300636 | E143: 同和药业 | F143: 医药 | G143: 原料药 | H143: 163.33 | I143: 2.4e-002 | J143: 1.2199999999999999e-002 | K143: 23.48 | L143: 4.1200000000000001e-002 | M143: 121.9 | N143: 14.82 | O143: 3.1e-002 | P143: 158.43 | Q143: 已到 | R143: 4.78年 | S143: 2.78年 | T143: 3.58 | U143: 192 | V143: 0.33000000000000002 | W143: 7.400000000000001e-002 | X143: 0.11699999999999999 | Y143: 48 | Z143: 5.88 | AA143: -6.0499999999999998e-002 | AB143: -6.7599999999999993e-002 | AC143: -0.14099999999999999 | AD143: -0.14300000000000002 | AE143: 85.2 | AF143: 88.46 | AG143: 0.88 | AH143: A+ | AI143: 7.1099999999999997e-002 | AJ143: =H143+100*O143 -> 166.43000000000001 | AK143: 168.2 | AL143: 242 | AM143: 79.8 | AN143: 266 | AO143: -1.3000000000000001e-002 | AP143: 13 | AQ143: 同和转债!!
A144: 143 | B144: 113605 | C144: 大参转债! | D144: 603233 | E144: 大参林 | F144: 医药 | G144: 医药商业 | H144: 116.23 | I144: -2.9999999999999997e-004 | J144: 6.0000000000000001e-003 | K144: 42.85 | L144: 4.41e-002 | M144: 114.9 | N144: 69.05 | O144: 0.873 | P144: 62.06 | Q144: 已到 | R144: 4.77年 | S144: 2.77年 | T144: 14 | U144: 7.3 | V144: 4.0000000000000001e-003 | W144: 4.0999999999999995e-002 | X144: 2.6000000000000002e-002 | Y144: 339 | Z144: 6.37 | AA144: -2.5000000000000001e-003 | AB144: -8.0000000000000002e-003 | AC144: -3.9399999999999998e-002 | AD144: -4.1500000000000002e-002 | AE144: 92.49 | AF144: 96.05 | AG144: 0.13 | AH144: AA | AI144: 3.9100000000000003e-002 | AJ144: =H144+100*O144 -> 203.53 | AK144: 170.4 | AL144: 251 | AM144: 74.4 | AN144: 244 | AO144: 7.0999999999999994e-002 | AP144: 7 | AQ144: 大参转债!
A145: 144 | B145: 123071 | C145: 天能转债!! | D145: 300569 | E145: 天能重工 | F145: 能源电力 | G145: 风能 | H145: 181.795 | I145: -6.1999999999999998e-003 | J145: 1.7399999999999999e-002 | K145: 12.81 | L145: 1.26e-002 | M145: 120.7 | N145: 7.91 | O145: 0.12300000000000001 | P145: 161.95 | Q145: 已到 | R145: 4.76年 | S145: 2.76年 | T145: 6.94 | U145: 134 | V145: 0.105 | W145: 6.8000000000000005e-002 | X145: 0.11 | Y145: 102 | Z145: 2.9 | AA145: -8.3800000000000013e-002 | AB145: -9.0299999999999991e-002 | AC145: -0.114 | AD145: -0.115 | AE145: 87.46 | AF145: 91.93 | AG145: 0.89 | AH145: AA- | AI145: 6.0100000000000001e-002 | AJ145: =H145+100*O145 -> 194.095 | AK145: 201.6 | AL145: 325 | AM145: 109.7 | AN145: 326 | AO145: -0.115 | AP145: 12 | AQ145: 天能转债!!
A146: 145 | B146: 123072 | C146: 乐歌转债! | D146: 300729 | E146: 乐歌股份 | F146: 其他 | G146: 家居用品 | H146: 123.08 | I146: -1.8e-003 | J146: 1.2999999999999999e-003 | K146: 26.55 | L146: -3.4000000000000002e-003 | M146: 129.1 | N146: 49.24 | O146: 1.28 | P146: 53.92 | Q146: 已到 | R146: 4.76年 | S146: 2.76年 | T146: 1.42 | U146: 10 | V146: 5.9000000000000004e-002 | W146: 2.4e-002 | X146: 1.3000000000000001e-002 | Y146: 59 | Z146: 3.24 | AA146: 1.04e-002 | AB146: 2.9999999999999997e-004 | AC146: -4.9699999999999994e-002 | AD146: -5.3399999999999996e-002 | AE146: 87.08 | AF146: 94.05 | AG146: 0.14 | AH146: A+ | AI146: 7.1099999999999997e-002 | AJ146: =H146+100*O146 -> 251.07999999999998 | AK146: 192.2 | AL146: 317 | AM146: 98.2 | AN146: 312 | AO146: -7.400000000000001e-002 | AP146: 11 | AQ146: 乐歌转债!
A147: 146 | B147: 123070 | C147: 鹏辉转债! | D147: 300438 | E147: 鹏辉能源 | F147: 汽车 | G147: 零部件制 | H147: 250.1 | I147: 7.4200000000000002e-002 | J147: -2.1600000000000001e-002 | K147: 42.35 | L147: 5.4299999999999994e-002 | M147: 114.8 | N147: 20.08 | O147: 0.18600000000000003 | P147: 210.91 | Q147: 已到 | R147: 4.76年 | S147: 2.76年 | T147: 5.99 | U147: 1543. | V147: 1.05 | W147: 3.3000000000000002e-002 | X147: 6.9000000000000006e-002 | Y147: 184 | Z147: 7.03 | AA147: -0.153 | AB147: -0.157 | AC147: -0.159 | AD147: -0.159 | AE147: 92.41 | AF147: 95.97 | AG147: 0.97 | AH147: AA | AI147: 3.9100000000000003e-002 | AJ147: =H147+100*O147 -> 268.69999999999999 | AK147: 289.3 | AL147: 360 | AM147: 193.3 | AN147: 360 | AO147: -7.9000000000000001e-002 | AP147: 8 | AQ147: 鹏辉转债!
A148: 147 | B148: 128135 | C148: 洽洽转债! | D148: 2557 | E148: 洽洽食品 | F148: 食品饮料 | G148: 休闲食品 | H148: 127.503 | I148: -1.5800000000000002e-002 | J148: 8.3999999999999995e-003 | K148: 54.9 | L148: -1.7899999999999999e-002 | M148: 119.9 | N148: 60.03 | O148: 0.39399999999999996 | P148: 91.45 | Q148: 已到 | R148: 4.76年 | S148: 2.76年 | T148: 13.4 | U148: 13 | V148: 6.9999999999999993e-003 | W148: 4.8000000000000001e-002 | X148: 4.4000000000000004e-002 | Y148: 278 | Z148: 6.38 | AA148: -1.3100000000000001e-002 | AB148: -2.0099999999999996e-002 | AC148: -6.9599999999999995e-002 | AD148: -7.1599999999999997e-002 | AE148: 92.51 | AF148: 100.23 | AG148: 0.42 | AH148: AA | AI148: 3.9100000000000003e-002 | AJ148: =H148+100*O148 -> 166.90299999999999 | AK148: 163.6 | AL148: 211 | AM148: 63.3 | AN148: 163 | AO148: -8.3000000000000004e-002 | AP148: 11 | AQ148: 洽洽转债!
A149: 148 | B149: 127022 | C149: 恒逸转债 | D149: 703 | E149: 恒逸石化 | F149: 化工 | G149: 化工 | H149: 125 | I149: -2.1899999999999999e-002 | J149: 6.8999999999999999e-003 | K149: 10.54 | L149: -2.86e-002 | M149: 108.7 | N149: 11.2 | O149: 0.32799999999999996 | P149: 94.11 | Q149: 已到 | R149: 4.75年 | S149: 2.75年 | T149: 20 | U149: 11 | V149: 4.0000000000000001e-003 | W149: 5.2000000000000005e-002 | X149: 4.9000000000000002e-002 | Y149: 386 | Z149: 1.49 | AA149: -2.9399999999999999e-002 | AB149: -3.2599999999999997e-002 | AC149: -6.6199999999999995e-002 | AD149: -6.7699999999999996e-002 | AE149: 92.96 | AF149: 92.91 | AG149: 0.53 | AH149: AA+ | AI149: 3.4099999999999998e-002 | AJ149: =H149+100*O149 -> 157.80000000000001 | AK149: 155.9 | AL149: 155 | AM149: 62.9 | AN149: 160 | AO149: -6.0000000000000001e-003 | AP149: 6 | AQ149: 恒逸转债
A150: 149 | B150: 110075 | C150: 南航转债 | D150: 600029 | E150: 南方航空 | F150: 交通运输 | G150: 航空运输 | H150: 136.62 | I150: -1.37e-002 | J150: 4.1999999999999997e-003 | K150: 6.95 | L150: -1.4199999999999999e-002 | M150: 109.8 | N150: 6.24 | O150: 0.22699999999999998 | P150: 111.38 | Q150: 已到 | R150: 4.75年 | S150: 2.75年 | T150: 59 | U150: 94 | V150: 1.2e-002 | W150: 5.0000000000000003e-002 | X150: 5.5999999999999994e-002 | Y150: 1178. | Z150: 1.6 | AA150: -4.5499999999999999e-002 | AB150: -4.9100000000000005e-002 | AC150: -9.5700000000000007e-002 | AD150: -9.6799999999999997e-002 | AE150: 93.12 | AF150: 94.69 | AG150: 0.67 | AH150: AAA | AI150: 3.2099999999999997e-002 | AJ150: =H150+100*O150 -> 159.31999999999999 | AK150: 161.9 | AL150: 201 | AM150: 67.2 | AN150: 192 | AO150: 4.2000000000000003e-002 | AP150: 8 | AQ150: 南航转债
A151: 150 | B151: 113604 | C151: 多伦转债! | D151: 603528 | E151: 多伦科技 | F151: 计算机及 | G151: 软件开发 | H151: 110.96 | I151: -8.5000000000000006e-003 | J151: 4.8999999999999998e-003 | K151: 6.98 | L151: -1.2699999999999999e-002 | M151: 116.9 | N151: 10.4 | O151: 0.65300000000000002 | P151: 67.12 | Q151: 已到 | R151: 4.74年 | S151: 2.74年 | T151: 6.4 | U151: 15 | V151: 2.1000000000000001e-002 | W151: 0.14599999999999999 | X151: 9.8000000000000004e-002 | Y151: 44 | Z151: 2.67 | AA151: 1.1299999999999999e-002 | AB151: 4.8999999999999998e-003 | AC151: -2.41e-002 | AD151: -2.63e-002 | AE151: 87.39 | AF151: 89.13 | AG151: 0.28 | AH151: AA- | AI151: 6.0100000000000001e-002 | AJ151: =H151+100*O151 -> 176.25999999999999 | AK151: 154.8 | AL151: 146 | AM151: 65.7 | AN151: 180 | AO151: 6.9999999999999993e-003 | AP151: 14 | AQ151: 多伦转债!
A152: 151 | B152: 128134 | C152: 鸿路转债! | D152: 2541 | E152: 鸿路钢构 | F152: 建筑 | G152: 其他建材 | H152: 145 | I152: -1.3600000000000001e-002 | J152: -2.0999999999999999e-003 | K152: 48.62 | L152: -2.35e-002 | M152: 114.8 | N152: 43.51 | O152: 0.29799999999999999 | P152: 111.74 | Q152: 已到 | R152: 4.73年 | S152: 2.73年 | T152: 15.7 | U152: 16 | V152: 6.9999999999999993e-003 | W152: 6.0999999999999999e-002 | X152: 6.8000000000000005e-002 | Y152: 258 | Z152: 3.88 | AA152: -4.9000000000000002e-002 | AB152: -5.4100000000000002e-002 | AC152: -0.11 | AD152: -0.11199999999999999 | AE152: 92.52 | AF152: 96.08 | AG152: 0.67 | AH152: AA | AI152: 3.9100000000000003e-002 | AJ152: =H152+100*O152 -> 174.80000000000001 | AK152: 178.3 | AL152: 288 | AM152: 82.2 | AN152: 273 | AO152: -8.4000000000000005e-002 | AP152: 4 | AQ152: 鸿路转债!
A153: 152 | B153: 128133 | C153: 奇正转债! | D153: 2287 | E153: 奇正藏药 | F153: 医药 | G153: 中药 | H153: 125.904 | I153: -8.0000000000000004e-004 | J153: 1.9e-002 | K153: 29.72 | L153: 3.4500000000000003e-002 | M153: 116.9 | N153: 29.79 | O153: 0.26200000000000001 | P153: 99.77 | Q153: 已到 | R153: 4.68年 | S153: 2.68年 | T153: 8 | U153: 67 | V153: 6.6000000000000003e-002 | W153: 5.0999999999999997e-002 | X153: 5.0999999999999997e-002 | Y153: 158 | Z153: 5.33 | AA153: -1.6e-002 | AB153: -2.2200000000000001e-002 | AC153: -6.7199999999999996e-002 | AD153: -6.93e-002 | AE153: 92.78 | AF153: 98.02 | AG153: 0.53 | AH153: AA | AI153: 3.9100000000000003e-002 | AJ153: =H153+100*O153 -> 152.10399999999998 | AK153: 152 | AL153: 126 | AM153: 54 | AN153: 102 | AO153: 2.1000000000000001e-002 | AP153: 19 | AQ153: 奇正转债!
A154: 153 | B154: 123067 | C154: 斯莱转债! | D154: 300382 | E154: 斯莱克 | F154: 机械装备 | G154: 专用设备 | H154: 262.868 | I154: 5.9699999999999996e-002 | J154: 2.92e-002 | K154: 23.15 | L154: 9.1499999999999998e-002 | M154: 120.8 | N154: 9.36 | O154: 6.3e-002 | P154: 247.33 | Q154: 已到 | R154: 4.67年 | S154: 2.67年 | T154: 2.4 | U154: 381 | V154: 0.61099999999999999 | W154: 1.8000000000000002e-002 | X154: 4.4000000000000004e-002 | Y154: 134 | Z154: 11.63 | AA154: -0.156 | AB154: -0.16200000000000001 | AC154: -0.17100000000000001 | AD154: -0.17199999999999999 | AE154: 88.05 | AF154: 92.54 | AG154: 0.97 | AH154: AA- | AI154: 6.0100000000000001e-002 | AJ154: =H154+100*O154 -> 269.16800000000001 | AK154: 278.4 | AL154: 358 | AM154: 185.9 | AN154: 357 | AO154: 5.9000000000000004e-002 | AP154: 11 | AQ154: 斯莱转债!
A155: 154 | B155: 128132 | C155: 交建转债! | D155: 2941 | E155: 新疆交建 | F155: 建筑 | G155: 建筑工程 | H155: 109.28 | I155: -2.18e-002 | J155: 1.9599999999999999e-002 | K155: 12.3 | L155: -1.3600000000000001e-002 | M155: 116.9 | N155: 18.53 | O155: 0.64599999999999991 | P155: 66.38 | Q155: 已到 | R155: 4.66年 | S155: 2.66年 | T155: 8.49 | U155: 31 | V155: 3.3000000000000002e-002 | W155: 0.107 | X155: 7.0999999999999994e-002 | Y155: 79 | Z155: 3.07 | AA155: 1.4800000000000001e-002 | AB155: 8.3000000000000001e-003 | AC155: -1.95e-002 | AD155: -2.18e-002 | AE155: 92.85 | AF155: 98.09 | AG155: 0.16 | AH155: AA | AI155: 3.9100000000000003e-002 | AJ155: =H155+100*O155 -> 173.88 | AK155: 152.2 | AL155: 129 | AM155: 54.1 | AN155: 103 | AO155: 9.0000000000000011e-003 | AP155: 28 | AQ155: 交建转债!
A156: 155 | B156: 128131 | C156: 崇达转2! | D156: 2815 | E156: 崇达技术 | F156: 电子 | G156: 元器件制 | H156: 125.166 | I156: 3.3e-003 | J156: 7.7000000000000002e-003 | K156: 16.11 | L156: 3.0699999999999998e-002 | M156: 114.9 | N156: 19.38 | O156: 0.50600000000000001 | P156: 83.13 | Q156: 已到 | R156: 4.64年 | S156: 2.64年 | T156: 14 | U156: 6.4 | V156: 4.0000000000000001e-003 | W156: 9.9000000000000005e-002 | X156: 8.199999999999999e-002 | Y156: 141 | Z156: 3.28 | AA156: -1.8600000000000002e-002 | AB156: -2.4199999999999999e-002 | AC156: -6.6199999999999995e-002 | AD156: -6.83e-002 | AE156: 92.93 | AF156: 96.5 | AG156: 0.36 | AH156: AA | AI156: 3.9100000000000003e-002 | AJ156: =H156+100*O156 -> 175.76599999999999 | AK156: 167.2 | AL156: 240 | AM156: 70.7 | AN156: 219 | AO156: -9.0000000000000011e-003 | AP156: 11 | AQ156: 崇达转2!
A157: 156 | B157: 123065 | C157: 宝莱转债! | D157: 300246 | E157: 宝莱特 | F157: 医药 | G157: 医疗器械 | H157: 116.09 | I157: -1.1000000000000001e-002 | J157: 1.7600000000000001e-002 | K157: 21.69 | L157: 5.2900000000000003e-002 | M157: 121 | N157: 40.14 | O157: 1.1499999999999999 | P157: 54.04 | Q157: 已到 | R157: 4.63年 | S157: 2.63年 | T157: 2.19 | U157: 28 | V157: 0.10800000000000001 | W157: 6.9000000000000006e-002 | X157: 3.7000000000000005e-002 | Y157: 32 | Z157: 3.63 | AA157: 9.1999999999999998e-003 | AB157: 1.2999999999999999e-003 | AC157: -3.9100000000000003e-002 | AD157: -4.1599999999999998e-002 | AE157: 88.39 | AF157: 92.9 | AG157: 0.12 | AH157: AA- | AI157: 6.0100000000000001e-002 | AJ157: =H157+100*O157 -> 231.08999999999997 | AK157: 178.1 | AL157: 286 | AM157: 85.2 | AN157: 284 | AO157: 8.6999999999999994e-002 | AP157: 23 | AQ157: 宝莱转债!
A158: 157 | B158: 123064 | C158: 万孚转债! | D158: 300482 | E158: 万孚生物 | F158: 医药 | G158: 医疗器械 | H158: 122.001 | I158: 1.67e-002 | J158: 5.2499999999999998e-002 | K158: 59.9 | L158: 0.18600000000000003 | M158: 114.8 | N158: 71.65 | O158: 0.45899999999999996 | P158: 83.6 | Q158: 已到 | R158: 4.63年 | S158: 2.63年 | T158: 5.99 | U158: 766 | V158: 1.03 | W158: 2.2000000000000002e-002 | X158: 1.9e-002 | Y158: 267 | Z158: 8.31 | AA158: -1.3300000000000001e-002 | AB158: -1.89e-002 | AC158: -5.8200000000000002e-002 | AD158: -6.0299999999999999e-002 | AE158: 92.89 | AF158: 96.47 | AG158: 0.37 | AH158: AA | AI158: 3.9100000000000003e-002 | AJ158: =H158+100*O158 -> 167.90100000000001 | AK158: 160.4 | AL158: 190 | AM158: 63.9 | AN158: 167 | AO158: 0.48799999999999999 | AP158: 12 | AQ158: 万孚转债!
A159: 158 | B159: 128130 | C159: 景兴转债 | D159: 2067 | E159: 景兴纸业 | F159: 造纸包装 | G159: 包装用纸 | H159: 127.1 | I159: -1.84e-002 | J159: -1.8e-003 | K159: 4 | L159: -2.9100000000000001e-002 | M159: 114.8 | N159: 3.4 | O159: 8.0000000000000002e-002 | P159: 117.65 | Q159: 已到 | R159: 4.62年 | S159: 2.62年 | T159: 9.99 | U159: 23 | V159: 1.8000000000000002e-002 | W159: 0.20899999999999999 | X159: 0.24600000000000002 | Y159: 48 | Z159: 0.91 | AA159: -2.2200000000000001e-002 | AB159: -2.7699999999999999e-002 | AC159: -7.2099999999999997e-002 | AD159: -7.4099999999999999e-002 | AE159: 92.9 | AF159: 96.48 | AG159: 0.69 | AH159: AA | AI159: 3.9100000000000003e-002 | AJ159: =H159+100*O159 -> 135.09999999999999 | AK159: 136.6 | AL159: 16 | AM159: 40.1 | AN159: 21 | AO159: -1.1000000000000001e-002 | AP159: 19 | AQ159: 景兴转债
A160: 159 | B160: 128129 | C160: 青农转债! | D160: 2958 | E160: 青农商行 | F160: 金融 | G160: 银行行业 | H160: 112.942 | I160: -1.7899999999999999e-002 | J160: 1.1299999999999999e-002 | K160: 3.9 | L160: -1.52e-002 | M160: 112 | N160: 4.32 | O160: 0.251 | P160: 90.28 | Q160: 已到 | R160: 4.61年 | S160: 无权 | T160: 50 | U160: 51 | V160: 9.0000000000000011e-003 | W160: 0.23100000000000001 | X160: 0.20800000000000002 | Y160: 217 | Z160: 0.76 | AA160: -1.8e-003 | AB160: -6.6e-003 | AC160: 无权 | AD160: 无权 | AE160: 无权 | AF160: 97.06 | AG160: 0.44 | AH160: AAA | AI160: 3.2099999999999997e-002 | AJ160: =H160+100*O160 -> 138.042 | AK160: 135.6 | AL160: 13 | AM160: 38.6 | AN160: 17 | AO160: 5.0000000000000001e-003 | AP160: 28 | AQ160: 青农转债!
A161: 160 | B161: 113602 | C161: 景20转债! | D161: 603228 | E161: 景旺电子 | F161: 电子 | G161: 元器件制 | H161: 139.62 | I161: -6.5000000000000006e-003 | J161: 1.66e-002 | K161: 32.74 | L161: 1.3600000000000001e-002 | M161: 112.9 | N161: 27.4 | O161: 0.16800000000000001 | P161: 119.49 | Q161: 已到 | R161: 4.60年 | S161: 2.60年 | T161: 17.8 | U161: 21 | V161: 9.0000000000000011e-003 | W161: 6.4000000000000001e-002 | X161: 7.5999999999999998e-002 | Y161: 279 | Z161: 4.13 | AA161: -4.5899999999999996e-002 | AB161: -5.0599999999999999e-002 | AC161: -0.10199999999999999 | AD161: -0.10400000000000001 | AE161: 93.07 | AF161: 94.97 | AG161: 0.74 | AH161: AA | AI161: 3.9100000000000003e-002 | AJ161: =H161+100*O161 -> 156.42000000000002 | AK161: 159.8 | AL161: 183 | AM161: 64.8 | AN161: 174 | AO161: 9.0000000000000011e-003 | AP161: 9 | AQ161: 景20转债!
A162: 161 | B162: 113039 | C162: 嘉泽转债!! | D162: 601619 | E162: 嘉泽新能 | F162: 能源电力 | G162: 风能 | H162: 147.94 | I162: -2.4e-002 | J162: 1.e-004 | K162: 4.6 | L162: -2.9500000000000002e-002 | M162: 112.8 | N162: 3.46 | O162: 0.113 | P162: 132.95 | Q162: 已到 | R162: 4.60年 | S162: 2.60年 | T162: 2.88 | U162: 57 | V162: 0.13100000000000001 | W162: 2.6000000000000002e-002 | X162: 3.4000000000000002e-002 | Y162: 112 | Z162: 2.35 | AA162: -5.8200000000000002e-002 | AB162: -6.2800000000000009e-002 | AC162: -0.121 | AD162: -0.12300000000000001 | AE162: 92.97 | AF162: 94.87 | AG162: 0.81 | AH162: AA | AI162: 3.9100000000000003e-002 | AJ162: =H162+100*O162 -> 159.24000000000001 | AK162: 162.9 | AL162: 205 | AM162: 68.1 | AN162: 199 | AO162: -0.10400000000000001 | AP162: 32 | AQ162: 嘉泽转债!!
A163: 162 | B163: 113601 | C163: 塞力转债! | D163: 603716 | E163: 塞力医疗 | F163: 医药 | G163: 医药商业 | H163: 123.97 | I163: 8.199999999999999e-003 | J163: 1.7000000000000001e-002 | K163: 17.28 | L163: 4.2199999999999994e-002 | M163: 120.8 | N163: 16.98 | O163: 0.218 | P163: 101.77 | Q163: 已到 | R163: 4.60年 | S163: 2.60年 | T163: 5.43 | U163: 269 | V163: 0.39799999999999996 | W163: 0.153 | X163: 0.156 | Y163: 35 | Z163: 2.32 | AA163: -5.6999999999999993e-003 | AB163: -1.34e-002 | AC163: -6.3099999999999989e-002 | AD163: -6.54e-002 | AE163: 88.43 | AF163: 92.94 | AG163: 0.6 | AH163: AA- | AI163: 6.0100000000000001e-002 | AJ163: =H163+100*O163 -> 145.77000000000001 | AK163: 146.2 | AL163: 66 | AM163: 53.2 | AN163: 95 | AO163: 0.158 | AP163: 39 | AQ163: 塞力转债!
A164: 163 | B164: 128128 | C164: 齐翔转2! | D164: 2408 | E164: 齐翔腾达 | F164: 化工 | G164: 化工 | H164: 190.2 | I164: -2.1299999999999999e-002 | J164: 2.8000000000000004e-003 | K164: 10.43 | L164: -1.9699999999999999e-002 | M164: 115 | N164: 5.69 | O164: 3.7999999999999999e-002 | P164: 183.3 | Q164: 已到 | R164: 4.59年 | S164: 2.59年 | T164: 6.81 | U164: 43 | V164: 3.3000000000000002e-002 | W164: 2.3e-002 | X164: 4.2000000000000003e-002 | Y164: 296 | Z164: 2.38 | AA164: -0.105 | AB164: -0.11 | AC164: -0.13200000000000001 | AD164: -0.13300000000000001 | AE164: 93.12 | AF164: 96.77 | AG164: 0.94 | AH164: AA | AI164: 3.9100000000000003e-002 | AJ164: =H164+100*O164 -> 194. | AK164: 197.1 | AL164: 322 | AM164: 100.3 | AN164: 318 | AO164: -1.2e-002 | AP164: 26 | AQ164: 齐翔转2!
A165: 164 | B165: 128127 | C165: 文科转债! | D165: 2775 | E165: 文科园林 | F165: 城市公用 | G165: 生态环境 | H165: 111.6 | I165: -1.6299999999999999e-002 | J165: -4.4000000000000003e-003 | K165: 4.08 | L165: -4.6699999999999998e-002 | M165: 120.8 | N165: 4.88 | O165: 0.33500000000000002 | P165: 83.61 | Q165: 已到 | R165: 4.59年 | S165: 2.59年 | T165: 9.49 | U165: 51 | V165: 4.8000000000000001e-002 | W165: 0.45399999999999996 | X165: 0.379 | Y165: 21 | Z165: 0.98 | AA165: 1.78e-002 | AB165: 9.7999999999999997e-003 | AC165: -2.64e-002 | AD165: -2.8900000000000002e-002 | AE165: 88.44 | AF165: 92.96 | AG165: 0.44 | AH165: AA- | AI165: 6.0100000000000001e-002 | AJ165: =H165+100*O165 -> 145.09999999999999 | AK165: 139.6 | AL165: 22 | AM165: 46.6 | AN165: 53 | AO165: -2.4e-002 | AP165: 77 | AQ165: 文科转债!
A166: 165 | B166: 110074 | C166: 精达转债!! | D166: 600577 | E166: 精达股份 | F166: 电子 | G166: 电子产品 | H166: 254.53 | I166: 3.6799999999999999e-002 | J166: -3.5499999999999997e-002 | K166: 7.74 | L166: 1.2999999999999999e-003 | M166: 116.9 | N166: 3.73 | O166: 0.22699999999999998 | P166: 207.51 | Q166: 已到 | R166: 4.59年 | S166: 2.59年 | T166: 5.1 | U166: 692 | V166: 0.54200000000000004 | W166: 3.3000000000000002e-002 | X166: 6.8000000000000005e-002 | Y166: 154 | Z166: 3.57 | AA166: -0.158 | AB166: -0.16300000000000001 | AC166: -0.17499999999999999 | AD166: -0.17499999999999999 | AE166: 93.11 | AF166: 98.37 | AG166: 0.96 | AH166: AA | AI166: 3.9100000000000003e-002 | AJ166: =H166+100*O166 -> 277.23000000000002 | AK166: 301.6 | AL166: 361 | AM166: 203.2 | AN166: 361 | AO166: 4.9000000000000002e-002 | AP166: 10 | AQ166: 精达转债!!
A167: 166 | B167: 110072 | C167: 广汇转债! | D167: 600297 | E167: 广汇汽车 | F167: 汽车 | G167: 分销、售 | H167: 103.34 | I167: -1.78e-002 | J167: 1.3600000000000001e-002 | K167: 2.72 | L167: -2.5099999999999997e-002 | M167: 114.3 | N167: 4.03 | O167: 0.53100000000000003 | P167: 67.49 | Q167: 已到 | R167: 4.59年 | S167: 2.59年 | T167: 33.7 | U167: 77 | V167: 2.2000000000000002e-002 | W167: 0.153 | X167: 0.10300000000000001 | Y167: 221 | Z167: 0.54 | AA167: 2.2599999999999999e-002 | AB167: 1.6799999999999999e-002 | AC167: -1.9e-003 | AD167: -3.9000000000000003e-003 | AE167: 93.78 | AF167: 98.25 | AG167: 0.16 | AH167: AA+ | AI167: 3.4099999999999998e-002 | AJ167: =H167+100*O167 -> 156.44 | AK167: 139.2 | AL167: 20 | AM167: 40.9 | AN167: 24 | AO167: 1.1000000000000001e-002 | AP167: 84 | AQ167: 广汇转债!
A168: 167 | B168: 113600 | C168: 新星转债!! | D168: 603978 | E168: 深圳新星 | F168: 有色金属 | G168: 有色行业 | H168: 134.85 | I168: -1.37e-002 | J168: -4.8999999999999998e-003 | K168: 27.08 | L168: -2.8999999999999998e-002 | M168: 125.6 | N168: 23.85 | O168: 0.188 | P168: 113.54 | Q168: 已到 | R168: 4.57年 | S168: 2.57年 | T168: 4.53 | U168: 16 | V168: 2.6000000000000002e-002 | W168: 0.10099999999999999 | X168: 0.115 | Y168: 45 | Z168: 2.85 | AA168: -1.5700000000000002e-002 | AB168: -2.4700000000000003e-002 | AC168: -9.2600000000000002e-002 | AD168: -9.4800000000000009e-002 | AE168: 88.35 | AF168: 96.7 | AG168: 0.64 | AH168: AA- | AI168: 6.0100000000000001e-002 | AJ168: =H168+100*O168 -> 153.65000000000001 | AK168: 156.2 | AL168: 158 | AM168: 59.5 | AN168: 141 | AO168: -4.4999999999999998e-002 | AP168: 24 | AQ168: 新星转债!!
A169: 168 | B169: 127021 | C169: 特发转2! | D169: 70 | E169: 特发信息 | F169: 通信互联 | G169: 通信设备 | H169: 124.2 | I169: -7.4999999999999997e-003 | J169: 5.9999999999999995e-004 | K169: 6.48 | L169: -1.8200000000000001e-002 | M169: 113 | N169: 7.33 | O169: 0.40500000000000003 | P169: 88.4 | Q169: 已到 | R169: 3.56年 | S169: 1.56年 | T169: 4.16 | U169: 2.3 | V169: 5.0000000000000001e-003 | W169: 7.5999999999999998e-002 | X169: 6.7000000000000004e-002 | Y169: 55 | Z169: 1.85 | AA169: -2.6499999999999999e-002 | AB169: -3.2899999999999999e-002 | AC169: -0.11 | AD169: -0.111 | AE169: 95.27 | AF169: 98.76 | AG169: 0.38 | AH169: AA | AI169: 3.9100000000000003e-002 | AJ169: =H169+100*O169 -> 164.69999999999999 | AK169: 160 | AL169: 185 | AM169: 61.2 | AN169: 150 | AO169: -3.6000000000000004e-002 | AP169: 16 | AQ169: 特发转2!
A170: 169 | B170: 113599 | C170: 嘉友转债! | D170: 603871 | E170: 嘉友国际 | F170: 交通运输 | G170: 物流业 | H170: 139.45 | I170: -2.6099999999999998e-002 | J170: 1.9299999999999998e-002 | K170: 22.4 | L170: -9.7000000000000003e-003 | M170: 125.6 | N170: 18.32 | O170: 0.14099999999999999 | P170: 122.27 | Q170: 已到 | R170: 4.55年 | S170: 2.55年 | T170: 7.2 | U170: 24 | V170: 2.3e-002 | W170: 0.10099999999999999 | X170: 0.124 | Y170: 71 | Z170: 3.06 | AA170: -2.3099999999999999e-002 | AB170: -3.2099999999999997e-002 | AC170: -0.10400000000000001 | AD170: -0.106 | AE170: 88.46 | AF170: 96.82 | AG170: 0.7 | AH170: AA- | AI170: 6.0100000000000001e-002 | AJ170: =H170+100*O170 -> 153.54999999999998 | AK170: 156.6 | AL170: 159 | AM170: 59.8 | AN170: 144 | AO170: 1.6e-002 | AP170: 17 | AQ170: 嘉友转债!
A171: 170 | B171: 113598 | C171: 法兰转债 | D171: 603966 | E171: 法兰泰克 | F171: 机械装备 | G171: 工程机械 | H171: 125.24 | I171: -1.8600000000000002e-002 | J171: 3.3e-003 | K171: 10 | L171: -2.53e-002 | M171: 120.8 | N171: 9.7 | O171: 0.215 | P171: 103.09 | Q171: 已到 | R171: 4.54年 | S171: 2.54年 | T171: 2.75 | U171: 11 | V171: 3.2000000000000001e-002 | W171: 9.1999999999999998e-002 | X171: 9.4e-002 | Y171: 30 | Z171: 2.4 | AA171: -8.1000000000000013e-003 | AB171: -1.5800000000000002e-002 | AC171: -6.7900000000000002e-002 | AD171: -7.0300000000000001e-002 | AE171: 88.72 | AF171: 93.25 | AG171: 0.6 | AH171: AA- | AI171: 6.0100000000000001e-002 | AJ171: =H171+100*O171 -> 146.74000000000001 | AK171: 147.4 | AL171: 75 | AM171: 54.1 | AN171: 104 | AO171: 6.0000000000000001e-003 | AP171: 13 | AQ171: 法兰转债
A172: 171 | B172: 128125 | C172: 华阳转债! | D172: 2949 | E172: 华阳国际 | F172: 建筑 | G172: 建筑工程 | H172: 114.106 | I172: -2.2200000000000001e-002 | J172: 1.6899999999999998e-002 | K172: 18.33 | L172: -1.66e-002 | M172: 118.1 | N172: 25.39 | O172: 0.58099999999999996 | P172: 72.19 | Q172: 已到 | R172: 4.54年 | S172: 2.54年 | T172: 4.5 | U172: 15 | V172: 2.7999999999999997e-002 | W172: 0.125 | X172: 8.9999999999999997e-002 | Y172: 36 | Z172: 2.66 | AA172: 7.8000000000000005e-003 | AB172: 7.000000000000001e-004 | AC172: -3.6000000000000004e-002 | AD172: -3.8300000000000001e-002 | AE172: 88.47 | AF172: 91.13 | AG172: 0.32 | AH172: AA- | AI172: 6.0100000000000001e-002 | AJ172: =H172+100*O172 -> 172.20599999999999 | AK172: 156 | AL172: 157 | AM172: 64.9 | AN172: 175 | AO172: 4.4000000000000004e-002 | AP172: 13 | AQ172: 华阳转债!
A173: 172 | B173: 113597 | C173: 佳力转债! | D173: 603912 | E173: 佳力图 | F173: 机械装备 | G173: 专用设备 | H173: 115.01 | I173: -1.95e-002 | J173: 1.38e-002 | K173: 13.58 | L173: -3.9599999999999996e-002 | M173: 124 | N173: 23.15 | O173: 0.96099999999999997 | P173: 58.66 | Q173: 已到 | R173: 4.54年 | S173: 2.54年 | T173: 3 | U173: 14 | V173: 4.0999999999999995e-002 | W173: 0.10199999999999999 | X173: 5.9999999999999998e-002 | Y173: 29 | Z173: 3.07 | AA173: 1.7100000000000001e-002 | AB173: 8.1000000000000013e-003 | AC173: -3.7200000000000004e-002 | AD173: -3.9800000000000002e-002 | AE173: 88.9 | AF173: 95.73 | AG173: 0.14 | AH173: AA- | AI173: 6.0100000000000001e-002 | AJ173: =H173+100*O173 -> 211.11000000000001 | AK173: 171.4 | AL173: 256 | AM173: 75.6 | AN173: 251 | AO173: -7.9000000000000001e-002 | AP173: 21 | AQ173: 佳力转债!
A174: 173 | B174: 123063 | C174: 大禹转债 | D174: 300021 | E174: 大禹节水 | F174: 化工 | G174: 橡胶塑料 | H174: 133.94 | I174: -2.9399999999999999e-002 | J174: -2.0999999999999999e-003 | K174: 5.67 | L174: -4.7100000000000003e-002 | M174: 126.1 | N174: 4.83 | O174: 0.14099999999999999 | P174: 117.39 | Q174: 已到 | R174: 4.53年 | S174: 3.53年 | T174: 6.35 | U174: 41 | V174: 4.8000000000000001e-002 | W174: 0.14000000000000001 | X174: 0.16399999999999998 | Y174: 45 | Z174: 3.05 | AA174: -1.3500000000000002e-002 | AB174: -2.2799999999999997e-002 | AC174: -6.08e-002 | AD174: -6.3799999999999996e-002 | AE174: 86.25 | AF174: 97.39 | AG174: 0.67 | AH174: AA- | AI174: 6.0100000000000001e-002 | AJ174: =H174+100*O174 -> 148.03999999999999 | AK174: 150.5 | AL174: 106 | AM174: 53.1 | AN174: 94 | AO174: -4.0999999999999995e-002 | AP174: 20 | AQ174: 大禹转债
A175: 174 | B175: 128124 | C175: 科华转债! | D175: 2022 | E175: 科华生物 | F175: 医药 | G175: 生物制药 | H175: 112.86 | I175: 1.3100000000000001e-002 | J175: 1.8000000000000002e-002 | K175: 17.91 | L175: 7.5700000000000003e-002 | M175: 110 | N175: 21.31 | O175: 0.34299999999999997 | P175: 84.05 | Q175: 已到 | R175: 4.53年 | S175: 2.53年 | T175: 7.38 | U175: 189 | V175: 0.22699999999999998 | W175: 8.0000000000000002e-002 | X175: 6.7000000000000004e-002 | Y175: 92 | Z175: 2.55 | AA175: -5.6999999999999993e-003 | AB175: -9.7999999999999997e-003 | AC175: -3.44e-002 | AD175: -3.6299999999999999e-002 | AE175: 92.73 | AF175: 92.74 | AG175: 0.41 | AH175: AA | AI175: 3.9100000000000003e-002 | AJ175: =H175+100*O175 -> 147.16 | AK175: 141.7 | AL175: 31 | AM175: 48.9 | AN175: 70 | AO175: 0.20499999999999999 | AP175: 28 | AQ175: 科华转债!
A176: 175 | B176: 113596 | C176: 城地转债! | D176: 603887 | E176: 城地香江 | F176: 通信互联 | G176: 通信设备 | H176: 99.67 | I176: -2.2000000000000002e-002 | J176: 2.18e-002 | K176: 8.15 | L176: -6.7500000000000004e-002 | M176: 113.1 | N176: 24.26 | O176: 1.97 | P176: 33.59 | Q176: 已到 | R176: 4.53年 | S176: 2.53年 | T176: 12 | U176: 94 | V176: 7.8e-002 | W176: 0.32700000000000001 | X176: 0.11 | Y176: 37 | Z176: 0.98 | AA176: 2.8900000000000002e-002 | AB176: 2.3399999999999997e-002 | AC176: 1.3999999999999999e-002 | AD176: 1.1399999999999999e-002 | AE176: 88.5 | AF176: 87.33 | AG176: 0 | AH176: AA- | AI176: 6.0100000000000001e-002 | AJ176: =H176+100*O176 -> 296.67000000000002 | AK176: 165.7 | AL176: 231 | AM176: 77.2 | AN176: 257 | AO176: -6.0000000000000001e-003 | AP176: 42 | AQ176: 城地转债!
A177: 176 | B177: 123062 | C177: 三超转债 | D177: 300554 | E177: 三超新材 | F177: 机械装备 | G177: 通用设备 | H177: 122.8 | I177: -1.8600000000000002e-002 | J177: 1.09e-002 | K177: 17.03 | L177: -1.1599999999999999e-002 | M177: 119.2 | N177: 17.13 | O177: 0.23499999999999999 | P177: 99.42 | Q177: 已到 | R177: 4.53年 | S177: 2.53年 | T177: 1.95 | U177: 11 | V177: 4.5999999999999999e-002 | W177: 0.122 | X177: 0.121 | Y177: 16 | Z177: 3.04 | AA177: -6.7000000000000002e-003 | AB177: -1.3999999999999999e-002 | AC177: -5.9900000000000002e-002 | AD177: -6.2600000000000003e-002 | AE177: 84.58 | AF177: 84.49 | AG177: 0.66 | AH177: A | AI177: 8.1099999999999992e-002 | AJ177: =H177+100*O177 -> 146.30000000000001 | AK177: 146.2 | AL177: 67 | AM177: 61.6 | AN177: 154 | AO177: 2.2000000000000002e-002 | AP177: 27 | AQ177: 三超转债
A178: 177 | B178: 128123 | C178: 国光转债! | D178: 2749 | E178: 国光股份 | F178: 化工 | G178: 农化 | H178: 112.08 | I178: -2.1400000000000002e-002 | J178: 1.23e-002 | K178: 9.65 | L178: -2.8199999999999999e-002 | M178: 115.7 | N178: 13.49 | O178: 0.56700000000000006 | P178: 71.53 | Q178: 已到 | R178: 4.53年 | S178: 2.53年 | T178: 3.2 | U178: 8.7 | V178: 2.4e-002 | W178: 7.5999999999999998e-002 | X178: 5.4000000000000006e-002 | Y178: 42 | Z178: 3.2 | AA178: 7.1999999999999998e-003 | AB178: 1.e-003 | AC178: -2.8999999999999998e-002 | AD178: -3.1400000000000004e-002 | AE178: 88.68 | AF178: 89.38 | AG178: 0.32 | AH178: AA- | AI178: 6.0100000000000001e-002 | AJ178: =H178+100*O178 -> 168.78 | AK178: 152.6 | AL178: 133 | AM178: 63.2 | AN178: 161 | AO178: -2.6000000000000002e-002 | AP178: 15 | AQ178: 国光转债!
A179: 178 | B179: 110073 | C179: 国投转债 | D179: 600061 | E179: 国投资本 | F179: 金融 | G179: 证券行业 | H179: 115.12 | I179: -1.67e-002 | J179: 5.4000000000000003e-003 | K179: 8 | L179: -3.3799999999999997e-002 | M179: 110.3 | N179: 9.9 | O179: 0.42499999999999999 | P179: 80.81 | Q179: 已到 | R179: 4.52年 | S179: 无权 | T179: 80 | U179: 74 | V179: 8.0000000000000002e-003 | W179: 0.156 | X179: 0.126 | Y179: 514 | Z179: 1.13 | AA179: -9.4999999999999998e-003 | AB179: -1.37e-002 | AC179: 无权 | AD179: 无权 | AE179: 无权 | AF179: 95.81 | AG179: 0.34 | AH179: AAA | AI179: 3.2099999999999997e-002 | AJ179: =H179+100*O179 -> 157.62 | AK179: 149.4 | AL179: 91 | AM179: 53.6 | AN179: 99 | AO179: -2.7000000000000003e-002 | AP179: 23 | AQ179: 国投转债
A180: 179 | B180: 128122 | C180: 兴森转债! | D180: 2436 | E180: 兴森科技 | F180: 电子 | G180: 元器件制 | H180: 133.38 | I180: 5.5000000000000005e-003 | J180: -5.8999999999999999e-003 | K180: 12.99 | L180: -8.0000000000000004e-004 | M180: 113 | N180: 14.1 | O180: 0.44799999999999995 | P180: 92.13 | Q180: 已到 | R180: 3.52年 | S180: 2.52年 | T180: 2.69 | U180: 4.5 | V180: 1.3000000000000001e-002 | W180: 1.3999999999999999e-002 | X180: 1.3000000000000001e-002 | Y180: 193 | Z180: 5.39 | AA180: -4.6600000000000003e-002 | AB180: -5.2900000000000003e-002 | AC180: -9.1400000000000009e-002 | AD180: -9.3399999999999997e-002 | AE180: 93.31 | AF180: 98.92 | AG180: 0.42 | AH180: AA | AI180: 3.9100000000000003e-002 | AJ180: =H180+100*O180 -> 178.18000000000001 | AK180: 174.6 | AL180: 270 | AM180: 75.7 | AN180: 252 | AO180: -3.3000000000000002e-002 | AP180: 10 | AQ180: 兴森转债!
A181: 180 | B181: 113037 | C181: 紫银转债! | D181: 601860 | E181: 紫金银行 | F181: 金融 | G181: 银行行业 | H181: 108.27 | I181: -2.63e-002 | J181: 1.7600000000000001e-002 | K181: 3.33 | L181: -2.63e-002 | M181: 115.6 | N181: 4.05 | O181: 0.317 | P181: 82.22 | Q181: 已到 | R181: 4.52年 | S181: 无权 | T181: 45 | U181: 150 | V181: 3.1e-002 | W181: 0.36899999999999999 | X181: 0.30299999999999999 | Y181: 122 | Z181: 0.79 | AA181: 1.49e-002 | AB181: 8.6e-003 | AC181: 无权 | AD181: 无权 | AE181: 无权 | AF181: 99.7 | AG181: 0.33 | AH181: AA+ | AI181: 3.4099999999999998e-002 | AJ181: =H181+100*O181 -> 139.97 | AK181: 134.3 | AL181: 7 | AM181: 34.6 | AN181: 10 | AO181: -2.e-003 | AP181: 29 | AQ181: 紫银转债!
A182: 181 | B182: 123061 | C182: 航新转债! | D182: 300424 | E182: 航新科技 | F182: 航空航天 | G182: 航空航天 | H182: 125.072 | I182: -7.4000000000000003e-003 | J182: -2.8000000000000004e-003 | K182: 14.39 | L182: -1.77e-002 | M182: 124.3 | N182: 14.85 | O182: 0.29100000000000004 | P182: 96.9 | Q182: 已到 | R182: 4.51年 | S182: 2.51年 | T182: 2.5 | U182: 22 | V182: 6.9000000000000006e-002 | W182: 7.2000000000000008e-002 | X182: 7.0000000000000007e-002 | Y182: 35 | Z182: 5.11 | AA182: -1.4000000000000002e-003 | AB182: -1.03e-002 | AC182: -6.6400000000000001e-002 | AD182: -6.9199999999999998e-002 | AE182: 86.89 | AF182: 91.87 | AG182: 0.57 | AH182: A+ | AI182: 7.1099999999999997e-002 | AJ182: =H182+100*O182 -> 154.172 | AK182: 153.2 | AL182: 139 | AM182: 61.4 | AN182: 152 | AO182: -5.5999999999999994e-002 | AP182: 19 | AQ182: 航新转债!
A183: 182 | B183: 123060 | C183: 苏试转债! | D183: 300416 | E183: 苏试试验 | F183: 机械装备 | G183: 专用设备 | H183: 194.97 | I183: 1.9e-003 | J183: 4.4000000000000003e-003 | K183: 32.05 | L183: 6.8999999999999999e-003 | M183: 117.2 | N183: 19.05 | O183: 0.159 | P183: 168.24 | Q183: 已到 | R183: 4.51年 | S183: 2.51年 | T183: 3.1 | U183: 44 | V183: 7.2999999999999995e-002 | W183: 3.4000000000000002e-002 | X183: 5.7000000000000002e-002 | Y183: 91 | Z183: 8.34 | AA183: -0.109 | AB183: -0.114 | AC183: -0.14199999999999999 | AD183: -0.14300000000000002 | AE183: 88.7 | AF183: 90.59 | AG183: 0.91 | AH183: AA- | AI183: 6.0100000000000001e-002 | AJ183: =H183+100*O183 -> 210.87 | AK183: 221.7 | AL183: 339 | AM183: 131.1 | AN183: 340 | AO183: 6.0000000000000001e-003 | AP183: 7 | AQ183: 苏试转债!
A184: 183 | B184: 113595 | C184: 花王转债! | D184: 603007 | E184: ST花王 | F184: 城市公用 | G184: 生态环境 | H184: 106.24 | I184: -2.1600000000000001e-002 | J184: 1.7600000000000001e-002 | K184: 3.35 | L184: -3.1800000000000002e-002 | M184: 124.8 | N184: 6.92 | O184: 1.1899999999999999 | P184: 48.41 | Q184: 已到 | R184: 4.51年 | S184: 2.51年 | T184: 3.3 | U184: 34 | V184: 9.6000000000000002e-002 | W184: 0.29299999999999998 | X184: 0.14199999999999999 | Y184: 11 | Z184: 1.05 | AA184: 3.7200000000000004e-002 | AB184: 2.76e-002 | AC184: -9.0000000000000011e-003 | AD184: -1.1699999999999999e-002 | AE184: 76.64 | AF184: 75.45 | AG184: 0.13 | AH184: BBB- | AI184: 0.1211 | AJ184: =H184+100*O184 -> 225.24000000000001 | AK184: 164.1 | AL184: 217 | AM184: 87.4 | AN184: 288 | AO184: -2.4e-002 | AP184: 50 | AQ184: 花王转债!
A185: 184 | B185: 113594 | C185: 淳中转债! | D185: 603516 | E185: 淳中科技 | F185: 电子 | G185: 电子产品 | H185: 134.01 | I185: -3.3700000000000001e-002 | J185: 2.9300000000000003e-002 | K185: 19.13 | L185: -6.7000000000000002e-003 | M185: 120.9 | N185: 18.23 | O185: 0.27699999999999997 | P185: 104.94 | Q185: 已到 | R185: 4.51年 | S185: 2.51年 | T185: 3 | U185: 11 | V185: 2.7999999999999997e-002 | W185: 8.4000000000000005e-002 | X185: 8.8000000000000009e-002 | Y185: 36 | Z185: 3.68 | AA185: -2.3099999999999999e-002 | AB185: -3.0699999999999998e-002 | AC185: -9.0899999999999995e-002 | AD185: -9.3399999999999997e-002 | AE185: 86.77 | AF185: 89.36 | AG185: 0.65 | AH185: A+ | AI185: 7.1099999999999997e-002 | AJ185: =H185+100*O185 -> 161.70999999999998 | AK185: 163.1 | AL185: 207 | AM185: 73.7 | AN185: 238 | AO185: -5.2000000000000005e-002 | AP185: 9 | AQ185: 淳中转债!
A186: 185 | B186: 127020 | C186: 中金转债 | D186: 60 | E186: 中金岭南 | F186: 有色金属 | G186: 有色行业 | H186: 125.497 | I186: -1.7299999999999999e-002 | J186: 4.4000000000000003e-003 | K186: 4.94 | L186: -2.18e-002 | M186: 113.5 | N186: 4.63 | O186: 0.17600000000000002 | P186: 106.7 | Q186: 已到 | R186: 4.51年 | S186: 2.51年 | T186: 34.3 | U186: 62 | V186: 1.3999999999999999e-002 | W186: 0.19 | X186: 0.20300000000000001 | Y186: 180 | Z186: 1.44 | AA186: -2.23e-002 | AB186: -2.75e-002 | AC186: -7.4099999999999999e-002 | AD186: -7.5499999999999998e-002 | AE186: 93.53 | AF186: 97.78 | AG186: 0.59 | AH186: AA+ | AI186: 3.4099999999999998e-002 | AJ186: =H186+100*O186 -> 143.09700000000001 | AK186: 144.3 | AL186: 53 | AM186: 46.5 | AN186: 50 | AO186: -5.0000000000000001e-003 | AP186: 19 | AQ186: 中金转债
A187: 186 | B187: 113593 | C187: 沪工转债! | D187: 603131 | E187: 上海沪工 | F187: 机械装备 | G187: 通用设备 | H187: 149 | I187: -1.5e-003 | J187: 2.3599999999999999e-002 | K187: 25.67 | L187: 2.9700000000000001e-002 | M187: 121.2 | N187: 21.12 | O187: 0.22600000000000001 | P187: 121.54 | Q187: 已到 | R187: 4.51年 | S187: 2.51年 | T187: 4 | U187: 14 | V187: 2.4e-002 | W187: 4.9000000000000002e-002 | X187: 5.9999999999999998e-002 | Y187: 82 | Z187: 6.14 | AA187: -4.5700000000000005e-002 | AB187: -5.3200000000000004e-002 | AC187: -0.125 | AD187: -0.127 | AE187: 86.88 | AF187: 89.6 | AG187: 0.75 | AH187: A+ | AI187: 7.1099999999999997e-002 | AJ187: =H187+100*O187 -> 171.59999999999999 | AK187: 176.5 | AL187: 279 | AM187: 86.9 | AN187: 286 | AO187: -6.9999999999999993e-003 | AP187: 9 | AQ187: 沪工转债!
A188: 187 | B188: 128120 | C188: 联诚转债! | D188: 2921 | E188: 联诚精密 | F188: 汽车 | G188: 零部件制 | H188: 125.207 | I188: -2.64e-002 | J188: 4.5999999999999999e-003 | K188: 19.41 | L188: -3.1e-002 | M188: 117.9 | N188: 18.44 | O188: 0.18899999999999997 | P188: 105.26 | Q188: 已到 | R188: 4.50年 | S188: 2.50年 | T188: 2.6 | U188: 27 | V188: 8.3000000000000004e-002 | W188: 0.126 | X188: 0.13300000000000001 | Y188: 21 | Z188: 2.58 | AA188: -1.3600000000000001e-002 | AB188: -2.0400000000000001e-002 | AC188: -6.7599999999999993e-002 | AD188: -7.0300000000000001e-002 | AE188: 84.73 | AF188: 83.75 | AG188: 0.7 | AH188: A | AI188: 8.1099999999999992e-002 | AJ188: =H188+100*O188 -> 144.107 | AK188: 145.2 | AL188: 60 | AM188: 60.4 | AN188: 148 | AO188: 9.1999999999999998e-002 | AP188: 22 | AQ188: 联诚转债!
A189: 188 | B189: 128121 | C189: 宏川转债! | D189: 2930 | E189: 宏川智慧 | F189: 交通运输 | G189: 物流业 | H189: 127.897 | I189: -1.47e-002 | J189: 4.0000000000000002e-004 | K189: 22.22 | L189: -1.9400000000000001e-002 | M189: 112.9 | N189: 19.89 | O189: 0.14499999999999999 | P189: 111.71 | Q189: 已到 | R189: 4.50年 | S189: 2.50年 | T189: 6.7 | U189: 31 | V189: 3.6000000000000004e-002 | W189: 6.7000000000000004e-002 | X189: 7.4999999999999997e-002 | Y189: 99 | Z189: 4.68 | AA189: -2.7900000000000001e-002 | AB189: -3.2799999999999996e-002 | AC189: -7.7199999999999991e-002 | AD189: -7.9399999999999998e-002 | AE189: 88.63 | AF189: 87.32 | AG189: 0.73 | AH189: AA- | AI189: 6.0100000000000001e-002 | AJ189: =H189+100*O189 -> 142.39699999999999 | AK189: 144.1 | AL189: 49 | AM189: 55.5 | AN189: 111 | AO189: -0.127 | AP189: 7 | AQ189: 宏川转债!
A190: 189 | B190: 123059 | C190: 银信转债! | D190: 300231 | E190: 银信科技 | F190: 计算机及 | G190: 软件开发 | H190: 122.548 | I190: -1.0800000000000001e-002 | J190: 8.6e-003 | K190: 8.97 | L190: -4.4000000000000003e-003 | M190: 123.7 | N190: 9.72 | O190: 0.32799999999999996 | P190: 92.28 | Q190: 已到 | R190: 4.49年 | S190: 2.49年 | T190: 3.91 | U190: 9.8 | V190: 2.e-002 | W190: 9.9000000000000005e-002 | X190: 9.0999999999999998e-002 | Y190: 40 | Z190: 2.83 | AA190: 2.0999999999999999e-003 | AB190: -6.7000000000000002e-003 | AC190: -6.1600000000000002e-002 | AD190: -6.4000000000000001e-002 | AE190: 88.86 | AF190: 95.7 | AG190: 0.49 | AH190: AA- | AI190: 6.0100000000000001e-002 | AJ190: =H190+100*O190 -> 155.34800000000001 | AK190: 152.8 | AL190: 135 | AM190: 57.1 | AN190: 121 | AO190: 1.8000000000000002e-002 | AP190: 19 | AQ190: 银信转债!
A191: 190 | B191: 127019 | C191: 国城转债! | D191: 688 | E191: 国城矿业 | F191: 有色金属 | G191: 锌铅镍锡 | H191: 106.9 | I191: -1.6899999999999998e-002 | J191: 1.5700000000000002e-002 | K191: 13.03 | L191: -9.1000000000000004e-003 | M191: 114.8 | N191: 21.06 | O191: 0.72799999999999998 | P191: 61.87 | Q191: 已到 | R191: 4.49年 | S191: 2.49年 | T191: 8.5 | U191: 23 | V191: 2.6000000000000002e-002 | W191: 5.7000000000000002e-002 | X191: 3.5000000000000003e-002 | Y191: 148 | Z191: 6.13 | AA191: 1.6299999999999999e-002 | AB191: 1.03e-002 | AC191: -1.29e-002 | AD191: -1.52e-002 | AE191: 93.36 | AF191: 96.95 | AG191: 0.13 | AH191: AA | AI191: 3.9100000000000003e-002 | AJ191: =H191+100*O191 -> 179.69999999999999 | AK191: 151.9 | AL191: 125 | AM191: 55 | AN191: 109 | AO191: -4.4000000000000004e-002 | AP191: 51 | AQ191: 国城转债!
A192: 191 | B192: 128119 | C192: 龙大转债! | D192: 2726 | E192: 龙大美食 | F192: 食品饮料 | G192: 肉制品 | H192: 139.3 | I192: -2.0400000000000001e-002 | J192: 9.0000000000000011e-003 | K192: 10.98 | L192: -1.7000000000000001e-002 | M192: 119.9 | N192: 9.29 | O192: 0.17899999999999999 | P192: 118.19 | Q192: 已到 | R192: 4.49年 | S192: 2.49年 | T192: 9.46 | U192: 212 | V192: 0.155 | W192: 8.0000000000000002e-002 | X192: 9.4e-002 | Y192: 118 | Z192: 2.93 | AA192: -3.3500000000000002e-002 | AB192: -4.07e-002 | AC192: -0.106 | AD192: -0.10800000000000001 | AE192: 93.48 | AF192: 101.28 | AG192: 0.67 | AH192: AA | AI192: 3.9100000000000003e-002 | AJ192: =H192+100*O192 -> 157.20000000000002 | AK192: 160.4 | AL192: 191 | AM192: 59.1 | AN192: 138 | AO192: 4.9000000000000002e-002 | AP192: 9 | AQ192: 龙大转债!
A193: 192 | B193: 110071 | C193: 湖盐转债! | D193: 600929 | E193: 雪天盐业 | F193: 食品饮料 | G193: 食品饮料 | H193: 132.97 | I193: 1.1299999999999999e-002 | J193: -2.4e-002 | K193: 7.52 | L193: -1.83e-002 | M193: 114.9 | N193: 6.52 | O193: 0.153 | P193: 115.34 | Q193: 已到 | R193: 4.48年 | S193: 2.48年 | T193: 7.2 | U193: 100 | V193: 0.10400000000000001 | W193: 0.10300000000000001 | X193: 0.11800000000000001 | Y193: 70 | Z193: 2.69 | AA193: -3.27e-002 | AB193: -3.8300000000000001e-002 | AC193: -9.1300000000000006e-002 | AD193: -9.3399999999999997e-002 | AE193: 93.51 | AF193: 97.1 | AG193: 0.69 | AH193: AA | AI193: 3.9100000000000003e-002 | AJ193: =H193+100*O193 -> 148.27000000000001 | AK193: 150.6 | AL193: 109 | AM193: 53.5 | AN193: 98 | AO193: 3.7999999999999999e-002 | AP193: 19 | AQ193: 湖盐转债!
A194: 193 | B194: 113036 | C194: 宁建转债! | D194: 601789 | E194: 宁波建工 | F194: 建筑 | G194: 建筑工程 | H194: 114.21 | I194: -2.9700000000000001e-002 | J194: 1.8200000000000001e-002 | K194: 3.85 | L194: -3.7499999999999999e-002 | M194: 116.9 | N194: 4.76 | O194: 0.41200000000000003 | P194: 80.88 | Q194: 已到 | R194: 4.47年 | S194: 2.47年 | T194: 5.4 | U194: 9.3 | V194: 1.4999999999999999e-002 | W194: 0.14400000000000002 | X194: 0.11599999999999999 | Y194: 38 | Z194: 1.16 | AA194: 5.3e-003 | AB194: -1.4000000000000002e-003 | AC194: -3.73e-002 | AD194: -3.9699999999999999e-002 | AE194: 93.55 | AF194: 98.83 | AG194: 0.31 | AH194: AA | AI194: 3.9100000000000003e-002 | AJ194: =H194+100*O194 -> 155.41 | AK194: 147.5 | AL194: 77 | AM194: 48.7 | AN194: 66 | AO194: 6.9999999999999993e-003 | AP194: 14 | AQ194: 宁建转债!
A195: 194 | B195: 128118 | C195: 瀛通转债! | D195: 2861 | E195: 瀛通通讯 | F195: 电子 | G195: 电子产品 | H195: 110.79 | I195: -2.3199999999999998e-002 | J195: 2.07e-002 | K195: 12.9 | L195: -1.4499999999999999e-002 | M195: 121.7 | N195: 21.24 | O195: 0.82400000000000007 | P195: 60.73 | Q195: 已到 | R195: 4.46年 | S195: 2.46年 | T195: 3 | U195: 19 | V195: 5.7000000000000002e-002 | W195: 0.14800000000000002 | X195: 8.9999999999999997e-002 | Y195: 20 | Z195: 1.93 | AA195: 2.18e-002 | AB195: 1.3300000000000001e-002 | AC195: -2.3300000000000001e-002 | AD195: -2.63e-002 | AE195: 89.56 | AF195: 94.44 | AG195: 0.17 | AH195: AA- | AI195: 6.0100000000000001e-002 | AJ195: =H195+100*O195 -> 193.19 | AK195: 160.8 | AL195: 194 | AM195: 66.4 | AN195: 185 | AO195: 9.0000000000000011e-003 | AP195: 27 | AQ195: 瀛通转债!
A196: 195 | B196: 128117 | C196: 道恩转债! | D196: 2838 | E196: 道恩股份 | F196: 化工 | G196: 橡胶塑料 | H196: 112.95 | I196: -2.0999999999999999e-003 | J196: 1.4199999999999999e-002 | K196: 17.7 | L196: 7.2099999999999997e-002 | M196: 123.1 | N196: 28.78 | O196: 0.83700000000000008 | P196: 61.5 | Q196: 已到 | R196: 4.46年 | S196: 2.46年 | T196: 3.6 | U196: 41 | V196: 0.10099999999999999 | W196: 5.0000000000000003e-002 | X196: 3.1e-002 | Y196: 72 | Z196: 3.8 | AA196: 1.9900000000000001e-002 | AB196: 1.1000000000000001e-002 | AC196: -3.32e-002 | AD196: -3.56e-002 | AE196: 88.87 | AF196: 95.4 | AG196: 0.17 | AH196: AA- | AI196: 6.0100000000000001e-002 | AJ196: =H196+100*O196 -> 196.65000000000001 | AK196: 164.4 | AL196: 220 | AM196: 69 | AN196: 208 | AO196: 5.7999999999999996e-002 | AP196: 27 | AQ196: 道恩转债!
A197: 196 | B197: 123057 | C197: 美联转债!! | D197: 300586 | E197: 美联新材 | F197: 化工 | G197: 橡胶塑料 | H197: 146.3 | I197: -8.1000000000000013e-003 | J197: -5.7999999999999996e-003 | K197: 11.69 | L197: -1.8500000000000003e-002 | M197: 117.8 | N197: 9.5 | O197: 0.18899999999999997 | P197: 123.05 | Q197: 已到 | R197: 4.46年 | S197: 2.46年 | T197: 2.07 | U197: 68 | V197: 0.222 | W197: 3.4000000000000002e-002 | X197: 4.0999999999999995e-002 | Y197: 61 | Z197: 5.13 | AA197: -4.8399999999999999e-002 | AB197: -5.4900000000000004e-002 | AC197: -0.12300000000000001 | AD197: -0.125 | AE197: 89.15 | AF197: 91.39 | AG197: 0.76 | AH197: AA- | AI197: 6.0100000000000001e-002 | AJ197: =H197+100*O197 -> 165.20000000000002 | AK197: 169.5 | AL197: 248 | AM197: 78.2 | AN197: 260 | AO197: -0.128 | AP197: 20 | AQ197: 美联转债!!
A198: 197 | B198: 113591 | C198: 胜达转债! | D198: 603687 | E198: 大胜达 | F198: 造纸包装 | G198: 包装用纸 | H198: 139.68 | I198: -1.34e-002 | J198: 1.3999999999999999e-002 | K198: 12.26 | L198: 8.0000000000000004e-004 | M198: 121.7 | N198: 8.76 | O198: -2.e-003 | P198: 139.95 | Q198: 已到 | R198: 4.46年 | S198: 2.46年 | T198: 5.19 | U198: 107 | V198: 0.14699999999999999 | W198: 0.10199999999999999 | X198: 0.14300000000000002 | Y198: 51 | Z198: 2.9 | AA198: -3.1099999999999999e-002 | AB198: -3.8900000000000004e-002 | AC198: -0.10800000000000001 | AD198: -0.11 | AE198: 89.05 | AF198: 94.38 | AG198: 0.8 | AH198: AA- | AI198: 6.0100000000000001e-002 | AJ198: =H198+100*O198 -> 139.48000000000002 | AK198: 139.4 | AL198: 21 | AM198: 45 | AN198: 44 | AO198: 0.10099999999999999 | AP198: 35 | AQ198: 胜达转债!
A199: 198 | B199: 128116 | C199: 瑞达转债! | D199: 2961 | E199: 瑞达期货 | F199: 金融 | G199: 期货行业 | H199: 118.28 | I199: -5.4000000000000003e-003 | J199: 7.0999999999999995e-003 | K199: 23.53 | L199: 5.1000000000000004e-003 | M199: 114.9 | N199: 29.55 | O199: 0.48499999999999999 | P199: 79.63 | Q199: 已到 | R199: 4.45年 | S199: 2.45年 | T199: 6.49 | U199: 37 | V199: 4.7e-002 | W199: 6.2e-002 | X199: 4.9000000000000002e-002 | Y199: 105 | Z199: 4.93 | AA199: -6.6e-003 | AB199: -1.2500000000000001e-002 | AC199: -5.0700000000000002e-002 | AD199: -5.2999999999999999e-002 | AE199: 93.53 | AF199: 97.2 | AG199: 0.32 | AH199: AA | AI199: 3.9100000000000003e-002 | AJ199: =H199+100*O199 -> 166.78 | AK199: 156.9 | AL199: 162 | AM199: 59.7 | AN199: 143 | AO199: -3.3000000000000002e-002 | AP199: 17 | AQ199: 瑞达转债!
A200: 199 | B200: 127018 | C200: 本钢转债! | D200: 761 | E200: 本钢板材 | F200: 钢铁 | G200: 炼钢 | H200: 122 | I200: -1.21e-002 | J200: 3.0000000000000001e-003 | K200: 4.34 | L200: -2.4700000000000003e-002 | M200: 128 | N200: 4.55 | O200: 0.27899999999999997 | P200: 95.38 | Q200: 已到 | R200: 4.45年 | S200: 2.45年 | T200: 56.3 | U200: 112 | V200: 1.6e-002 | W200: 0.316 | X200: 0.30099999999999999 | Y200: 178 | Z200: 0.78 | AA200: 1.1200000000000002e-002 | AB200: 8.0000000000000004e-004 | AC200: -5.3499999999999999e-002 | AD200: -5.74e-002 | AE200: 97.55 | AF200: 111.7 | AG200: 0.37 | AH200: AAA | AI200: 3.2099999999999997e-002 | AJ200: =H200+100*O200 -> 149.90000000000001 | AK200: 148.6 | AL200: 85 | AM200: 36.9 | AN200: 15 | AO200: -1.e-003 | AP200: 59 | AQ200: 本钢转债!
A201: 200 | B201: 113589 | C201: 天创转债! | D201: 603608 | E201: 天创时尚 | F201: 服装纺织 | G201: 鞋服行业 | H201: 106.02 | I201: -1.5e-003 | J201: 8.0000000000000004e-004 | K201: 6.72 | L201: -1.03e-002 | M201: 114.9 | N201: 12.29 | O201: 0.93900000000000006 | P201: 54.68 | Q201: 已到 | R201: 4.44年 | S201: 2.44年 | T201: 6 | U201: 32 | V201: 5.0999999999999997e-002 | W201: 0.20800000000000002 | X201: 0.114 | Y201: 29 | Z201: 1.83 | AA201: 1.8700000000000001e-002 | AB201: 1.2500000000000001e-002 | AC201: -9.5999999999999992e-003 | AD201: -1.21e-002 | AE201: 93.66 | AF201: 97.27 | AG201: 0.07 | AH201: AA | AI201: 3.9100000000000003e-002 | AJ201: =H201+100*O201 -> 199.92000000000002 | AK201: 157.4 | AL201: 165 | AM201: 60.1 | AN201: 146 | AO201: 2.4e-002 | AP201: 42 | AQ201: 天创转债!
A202: 201 | B202: 123056 | C202: 雪榕转债! | D202: 300511 | E202: 雪榕生物 | F202: 农业 | G202: 种植业 | H202: 115.95 | I202: -6.0000000000000001e-003 | J202: 2.5000000000000001e-003 | K202: 8.72 | L202: -1.1299999999999999e-002 | M202: 120.7 | N202: 11.77 | O202: 0.56499999999999995 | P202: 74.09 | Q202: 已到 | R202: 4.44年 | S202: 2.44年 | T202: 5.84 | U202: 61 | V202: 8.900000000000001e-002 | W202: 0.152 | X202: 0.11199999999999999 | Y202: 39 | Z202: 2.16 | AA202: 9.300000000000001e-003 | AB202: 1.1999999999999999e-003 | AC202: -4.2599999999999999e-002 | AD202: -4.5199999999999997e-002 | AE202: 89.15 | AF202: 93.71 | AG202: 0.31 | AH202: AA- | AI202: 6.0100000000000001e-002 | AJ202: =H202+100*O202 -> 172.44999999999999 | AK202: 157.8 | AL202: 168 | AM202: 64.1 | AN202: 169 | AO202: 0.11800000000000001 | AP202: 22 | AQ202: 雪榕转债!
A203: 202 | B203: 113588 | C203: 润达转债! | D203: 603108 | E203: 润达医疗 | F203: 医药 | G203: 医疗器械 | H203: 137.25 | I203: 1.6500000000000001e-002 | J203: 5.7999999999999996e-002 | K203: 16.34 | L203: 9.9600000000000008e-002 | M203: 113.9 | N203: 13.25 | O203: 0.113 | P203: 123.32 | Q203: 已到 | R203: 4.42年 | S203: 2.42年 | T203: 5.5 | U203: 262 | V203: 0.34200000000000003 | W203: 5.7999999999999996e-002 | X203: 7.2000000000000008e-002 | Y203: 95 | Z203: 2.87 | AA203: -4.2099999999999999e-002 | AB203: -4.7400000000000005e-002 | AC203: -0.10400000000000001 | AD203: -0.106 | AE203: 93.73 | AF203: 96.49 | AG203: 0.75 | AH203: AA | AI203: 3.9100000000000003e-002 | AJ203: =H203+100*O203 -> 148.55000000000001 | AK203: 151.2 | AL203: 116 | AM203: 54.7 | AN203: 107 | AO203: 0.253 | AP203: 11 | AQ203: 润达转债!
A204: 203 | B204: 128114 | C204: 正邦转债! | D204: 2157 | E204: 正邦科技 | F204: 农业 | G204: 畜牧业 | H204: 111.5 | I204: -1.5900000000000001e-002 | J204: 1.1599999999999999e-002 | K204: 10 | L204: -2.3399999999999997e-002 | M204: 114.9 | N204: 14.77 | O204: 0.64700000000000002 | P204: 67.7 | Q204: 已到 | R204: 4.42年 | S204: 2.42年 | T204: 16 | U204: 46 | V204: 2.6000000000000002e-002 | W204: 5.0999999999999997e-002 | X204: 3.4000000000000002e-002 | Y204: 315 | Z204: 2.42 | AA204: 6.9999999999999993e-003 | AB204: 8.9999999999999998e-004 | AC204: -2.8999999999999998e-002 | AD204: -3.1400000000000004e-002 | AE204: 93.73 | AF204: 97.34 | AG204: 0.18 | AH204: AA | AI204: 3.9100000000000003e-002 | AJ204: =H204+100*O204 -> 176.19999999999999 | AK204: 155.3 | AL204: 149 | AM204: 58 | AN204: 129 | AO204: 1.9e-002 | AP204: 25 | AQ204: 正邦转债!
A205: 204 | B205: 128113 | C205: 比音转债! | D205: 2832 | E205: 比音勒芬 | F205: 服装纺织 | G205: 服装行业 | H205: 183.701 | I205: -2.8300000000000002e-002 | J205: 1.6299999999999999e-002 | K205: 25.26 | L205: -1.29e-002 | M205: 116.9 | N205: 14.6 | O205: 6.2e-002 | P205: 173.01 | Q205: 已到 | R205: 4.41年 | S205: 2.41年 | T205: 2.98 | U205: 32 | V205: 5.7999999999999996e-002 | W205: 2.1000000000000001e-002 | X205: 3.7000000000000005e-002 | Y205: 139 | Z205: 4.7 | AA205: -9.9000000000000005e-002 | AB205: -0.105 | AC205: -0.13900000000000001 | AD205: -0.14000000000000001 | AE205: 93.75 | AF205: 99.05 | AG205: 0.93 | AH205: AA | AI205: 3.9100000000000003e-002 | AJ205: =H205+100*O205 -> 189.90099999999998 | AK205: 194.4 | AL205: 319 | AM205: 95.3 | AN205: 305 | AO205: 2.1000000000000001e-002 | AP205: 8 | AQ205: 比音转债!
A206: 205 | B206: 128111 | C206: 中矿转债! | D206: 2738 | E206: 中矿资源 | F206: 有色金属 | G206: 有色行业 | H206: 401.495 | I206: 1.26e-002 | J206: -1.9e-003 | K206: 57.49 | L206: 1.09e-002 | M206: 124.2 | N206: 15.45 | O206: 7.9000000000000001e-002 | P206: 372.1 | Q206: 已到 | R206: 4.40年 | S206: 2.40年 | T206: 1.45 | U206: 385 | V206: 0.66599999999999993 | W206: 8.0000000000000002e-003 | X206: 2.8999999999999998e-002 | Y206: 187 | Z206: 5 | AA206: -0.23699999999999999 | AB206: -0.24399999999999999 | AC206: -0.24199999999999999 | AD206: -0.24199999999999999 | AE206: 89.78 | AF206: 96.67 | AG206: 0.98 | AH206: AA- | AI206: 6.0100000000000001e-002 | AJ206: =H206+100*O206 -> 409.39499999999998 | AK206: 430.9 | AL206: 374 | AM206: 334.2 | AN206: 374 | AO206: -8.8000000000000009e-002 | AP206: 10 | AQ206: 中矿转债!
A207: 206 | B207: 123054 | C207: 思特转债!! | D207: 300608 | E207: 思特奇 | F207: 通信互联 | G207: 通信设备 | H207: 139 | I207: -1.24e-002 | J207: 5.8999999999999999e-003 | K207: 14.6 | L207: -9.4999999999999998e-003 | M207: 121.2 | N207: 12.63 | O207: 0.20199999999999999 | P207: 115.6 | Q207: 已到 | R207: 4.40年 | S207: 2.40年 | T207: 2.07 | U207: 91 | V207: 0.315 | W207: 6.8000000000000005e-002 | X207: 7.8e-002 | Y207: 31 | Z207: 3.68 | AA207: -3.1400000000000004e-002 | AB207: -3.9199999999999999e-002 | AC207: -0.107 | AD207: -0.109 | AE207: 89.8 | AF207: 94.37 | AG207: 0.69 | AH207: AA- | AI207: 6.0100000000000001e-002 | AJ207: =H207+100*O207 -> 159.19999999999999 | AK207: 162.4 | AL207: 203 | AM207: 68 | AN207: 198 | AO207: -3.0000000000000001e-003 | AP207: 17 | AQ207: 思特转债!!
A208: 207 | B208: 113585 | C208: 寿仙转债! | D208: 603896 | E208: 寿仙谷 | F208: 医药 | G208: 中药 | H208: 205.82 | I208: 1.7899999999999999e-002 | J208: 9.1000000000000004e-003 | K208: 55.5 | L208: 2.8199999999999999e-002 | M208: 117.3 | N208: 28.38 | O208: 5.2000000000000005e-002 | P208: 195.56 | Q208: 已到 | R208: 4.40年 | S208: 2.40年 | T208: 1.01 | U208: 268 | V208: 1.26 | W208: 1.2e-002 | X208: 2.3e-002 | Y208: 85 | Z208: 5.7 | AA208: -0.122 | AB208: -0.128 | AC208: -0.161 | AD208: -0.16200000000000001 | AE208: 89.39 | AF208: 91.3 | AG208: 0.96 | AH208: AA- | AI208: 6.0100000000000001e-002 | AJ208: =H208+100*O208 -> 211.01999999999998 | AK208: 216.1 | AL208: 335 | AM208: 124.8 | AN208: 335 | AO208: -1.6e-002 | AP208: 18 | AQ208: 寿仙转债!
A209: 208 | B209: 123052 | C209: 飞鹿转债! | D209: 300665 | E209: 飞鹿股份 | F209: 化工 | G209: 化工 | H209: 155.16 | I209: -1.7600000000000001e-002 | J209: 1.2199999999999999e-002 | K209: 10.36 | L209: -6.7000000000000002e-003 | M209: 126.8 | N209: 7.05 | O209: 5.5999999999999994e-002 | P209: 146.95 | Q209: 已到 | R209: 4.39年 | S209: 2.39年 | T209: 1.5 | U209: 88 | V209: 0.375 | W209: 8.4000000000000005e-002 | X209: 0.12300000000000001 | Y209: 18 | Z209: 3.52 | AA209: -4.6100000000000002e-002 | AB209: -5.5399999999999998e-002 | AC209: -0.10400000000000001 | AD209: -0.106 | AE209: 88.1 | AF209: 94.61 | AG209: 0.81 | AH209: A+ | AI209: 7.1099999999999997e-002 | AJ209: =H209+100*O209 -> 160.75999999999999 | AK209: 163.4 | AL209: 209 | AM209: 68.8 | AN209: 204 | AO209: 4.8000000000000001e-002 | AP209: 24 | AQ209: 飞鹿转债!
A210: 209 | B210: 113584 | C210: 家悦转债! | D210: 603708 | E210: 家家悦 | F210: 商业零售 | G210: 超市 | H210: 107.4 | I210: -2.63e-002 | J210: 2.58e-002 | K210: 16.45 | L210: -3.0099999999999998e-002 | M210: 114.9 | N210: 37.53 | O210: 1.45 | P210: 43.83 | Q210: 已到 | R210: 4.39年 | S210: 2.39年 | T210: 6.45 | U210: 18 | V210: 2.5000000000000001e-002 | W210: 6.4000000000000001e-002 | X210: 2.7999999999999997e-002 | Y210: 100 | Z210: 3.9 | AA210: 1.5800000000000002e-002 | AB210: 9.5999999999999992e-003 | AC210: -1.49e-002 | AD210: -1.7399999999999999e-002 | AE210: 93.85 | AF210: 97.46 | AG210: 0.02 | AH210: AA | AI210: 3.9100000000000003e-002 | AJ210: =H210+100*O210 -> 252.40000000000001 | AK210: 171 | AL210: 255 | AM210: 73.5 | AN210: 234 | AO210: 2.e-002 | AP210: 20 | AQ210: 家悦转债!
A211: 210 | B211: 128109 | C211: 楚江转债! | D211: 2171 | E211: 楚江新材 | F211: 有色金属 | G211: 铜金属 | H211: 161.3 | I211: 8.1000000000000013e-003 | J211: 1.7000000000000001e-003 | K211: 11.38 | L211: 1.2500000000000001e-002 | M211: 114.9 | N211: 8.63 | O211: 0.223 | P211: 131.87 | Q211: 已到 | R211: 4.38年 | S211: 2.38年 | T211: 18.2 | U211: 49 | V211: 1.7000000000000001e-002 | W211: 0.12 | X211: 0.158 | Y211: 152 | Z211: 2.59 | AA211: -7.5800000000000006e-002 | AB211: -8.1199999999999994e-002 | AC211: -0.115 | AD211: -0.11599999999999999 | AE211: 93.86 | AF211: 97.47 | AG211: 0.79 | AH211: AA | AI211: 3.9100000000000003e-002 | AJ211: =H211+100*O211 -> 183.60000000000002 | AK211: 190.7 | AL211: 314 | AM211: 93.3 | AN211: 299 | AO211: -5.4000000000000006e-002 | AP211: 6 | AQ211: 楚江转债!
A212: 211 | B212: 127017 | C212: 万青转债 | D212: 789 | E212: 万年青 | F212: 建筑 | G212: 水泥 | H212: 125 | I212: -1.9599999999999999e-002 | J212: 4.5000000000000005e-003 | K212: 12.05 | L212: -4.0599999999999997e-002 | M212: 118 | N212: 13.46 | O212: 0.39600000000000002 | P212: 89.52 | Q212: 已到 | R212: 4.38年 | S212: 2.38年 | T212: 10 | U212: 20 | V212: 1.6e-002 | W212: 0.10400000000000001 | X212: 9.3000000000000013e-002 | Y212: 96 | Z212: 1.41 | AA212: -1.3300000000000001e-002 | AB212: -2.0299999999999999e-002 | AC212: -7.2599999999999998e-002 | AD212: -7.4800000000000005e-002 | AE212: 94.96 | AF212: 102.19 | AG212: 0.37 | AH212: AA+ | AI212: 3.4099999999999998e-002 | AJ212: =H212+100*O212 -> 164.59999999999999 | AK212: 160.5 | AL212: 192 | AM212: 58.3 | AN212: 133 | AO212: -3.6000000000000004e-002 | AP212: 7 | AQ212: 万青转债
A213: 212 | B213: 128108 | C213: 蓝帆转债!! | D213: 2382 | E213: 蓝帆医疗 | F213: 医药 | G213: 医疗器械 | H213: 120.35 | I213: 1.1999999999999999e-003 | J213: 2.3e-002 | K213: 17.61 | L213: 4.6300000000000001e-002 | M213: 112.9 | N213: 18.24 | O213: 0.247 | P213: 96.55 | Q213: 已到 | R213: 4.36年 | S213: 3.36年 | T213: 15.2 | U213: 172 | V213: 9.4e-002 | W213: 8.5999999999999993e-002 | X213: 8.3000000000000004e-002 | Y213: 177 | Z213: 1.39 | AA213: -1.4800000000000001e-002 | AB213: -2.0099999999999996e-002 | AC213: -3.7900000000000003e-002 | AD213: -4.0500000000000001e-002 | AE213: 92.12 | AF213: 95.85 | AG213: 0.52 | AH213: AA | AI213: 3.9100000000000003e-002 | AJ213: =H213+100*O213 -> 145.04999999999998 | AK213: 144.2 | AL213: 50 | AM213: 48.3 | AN213: 62 | AO213: 8.5999999999999993e-002 | AP213: 29 | AQ213: 蓝帆转债!!
A214: 213 | B214: 113582 | C214: 火炬转债! | D214: 603678 | E214: 火炬电子 | F214: 电子 | G214: 元器件制 | H214: 329.98 | I214: -1.1899999999999999e-002 | J214: -1.2800000000000001e-002 | K214: 65.2 | L214: -2.5099999999999997e-002 | M214: 114.9 | N214: 24.99 | O214: 0.26500000000000001 | P214: 260.9 | Q214: 已到 | R214: 4.36年 | S214: 2.36年 | T214: 4.18 | U214: 79 | V214: 5.7000000000000002e-002 | W214: 1.3999999999999999e-002 | X214: 3.6000000000000004e-002 | Y214: 300 | Z214: 6.76 | AA214: -0.218 | AB214: -0.222 | AC214: -0.22800000000000001 | AD214: -0.22899999999999998 | AE214: 93.94 | AF214: 97.55 | AG214: 0.98 | AH214: AA | AI214: 3.9100000000000003e-002 | AJ214: =H214+100*O214 -> 356.48000000000002 | AK214: 399.1 | AL214: 368 | AM214: 301.5 | AN214: 369 | AO214: -9.9000000000000005e-002 | AP214: 5 | AQ214: 火炬转债!
A215: 214 | B215: 113579 | C215: 健友转债! | D215: 603707 | E215: 健友股份 | F215: 医药 | G215: 原料药 | H215: 138.7 | I215: 3.0000000000000001e-003 | J215: 6.4000000000000003e-003 | K215: 38.62 | L215: 1.29e-002 | M215: 113.9 | N215: 32.2 | O215: 0.156 | P215: 119.94 | Q215: 已到 | R215: 4.27年 | S215: 2.27年 | T215: 5.03 | U215: 34 | V215: 4.9000000000000002e-002 | W215: 1.e-002 | X215: 1.3000000000000001e-002 | Y215: 480 | Z215: 10.94 | AA215: -4.5999999999999999e-002 | AB215: -5.1399999999999994e-002 | AC215: -0.114 | AD215: -0.11599999999999999 | AE215: 94.28 | AF215: 97.05 | AG215: 0.73 | AH215: AA | AI215: 3.9100000000000003e-002 | AJ215: =H215+100*O215 -> 154.29999999999998 | AK215: 157.5 | AL215: 166 | AM215: 60.4 | AN215: 147 | AO215: -1.3000000000000001e-002 | AP215: 9 | AQ215: 健友转债!
A216: 215 | B216: 128107 | C216: 交科转债 | D216: 2061 | E216: 浙江交科 | F216: 建筑 | G216: 建筑工程 | H216: 127 | I216: -4.6999999999999993e-003 | J216: -1.e-002 | K216: 5.76 | L216: -2.3700000000000002e-002 | M216: 114.9 | N216: 5.24 | O216: 0.155 | P216: 109.92 | Q216: 已到 | R216: 4.26年 | S216: 2.26年 | T216: 25 | U216: 103 | V216: 3.3000000000000002e-002 | W216: 0.315 | X216: 0.34700000000000003 | Y216: 79 | Z216: 0.88 | AA216: -2.3700000000000002e-002 | AB216: -2.9700000000000001e-002 | AC216: -8.1799999999999998e-002 | AD216: -8.4100000000000008e-002 | AE216: 95.39 | AF216: 99.9 | AG216: 0.62 | AH216: AA+ | AI216: 3.4099999999999998e-002 | AJ216: =H216+100*O216 -> 142.5 | AK216: 144.1 | AL216: 48 | AM216: 44.2 | AN216: 40 | AO216: 1.8000000000000002e-002 | AP216: 20 | AQ216: 交科转债
A217: 216 | B217: 113578 | C217: 全筑转债! | D217: 603030 | E217: 全筑股份 | F217: 建筑 | G217: 装饰工程 | H217: 107.67 | I217: -1.9799999999999998e-002 | J217: 1.3300000000000001e-002 | K217: 3.67 | L217: -3.6699999999999997e-002 | M217: 117.9 | N217: 5.25 | O217: 0.54000000000000004 | P217: 69.9 | Q217: 已到 | R217: 4.26年 | S217: 2.26年 | T217: 3.84 | U217: 15 | V217: 3.6000000000000004e-002 | W217: 0.17999999999999999 | X217: 0.126 | Y217: 21 | Z217: 0.97 | AA217: 2.2000000000000002e-002 | AB217: 1.44e-002 | AC217: -1.67e-002 | AD217: -1.9299999999999998e-002 | AE217: 94.31 | AF217: 100.48 | AG217: 0.18 | AH217: AA | AI217: 3.9100000000000003e-002 | AJ217: =H217+100*O217 -> 161.67000000000002 | AK217: 145.4 | AL217: 61 | AM217: 45 | AN217: 42 | AO217: -1.4999999999999999e-002 | AP217: 35 | AQ217: 全筑转债!
A218: 217 | B218: 113573 | C218: 纵横转债! | D218: 603602 | E218: 纵横通信 | F218: 通信互联 | G218: 通信设备 | H218: 114.17 | I218: -1.2500000000000001e-002 | J218: 1.2800000000000001e-002 | K218: 11.9 | L218: 1.7000000000000001e-003 | M218: 124.2 | N218: 18.78 | O218: 0.80200000000000005 | P218: 63.37 | Q218: 已到 | R218: 4.25年 | S218: 2.25年 | T218: 2.7 | U218: 43 | V218: 0.13699999999999998 | W218: 0.111 | X218: 7.0000000000000007e-002 | Y218: 24 | Z218: 3.41 | AA218: 2.0499999999999997e-002 | AB218: 1.0700000000000001e-002 | AC218: -3.78e-002 | AD218: -4.0899999999999999e-002 | AE218: 88.37 | AF218: 93.45 | AG218: 0.2 | AH218: A+ | AI218: 7.1099999999999997e-002 | AJ218: =H218+100*O218 -> 194.37 | AK218: 165 | AL218: 224 | AM218: 71.5 | AN218: 224 | AO218: 0.14199999999999999 | AP218: 30 | AQ218: 纵横转债!
A219: 218 | B219: 113577 | C219: 春秋转债! | D219: 603890 | E219: 春秋电子 | F219: 电子 | G219: 电子产品 | H219: 154.77 | I219: 6.0100000000000001e-002 | J219: -3.0299999999999997e-002 | K219: 14.15 | L219: 3.8199999999999998e-002 | M219: 117.7 | N219: 10.85 | O219: 0.187 | P219: 130.41 | Q219: 已到 | R219: 4.24年 | S219: 2.24年 | T219: 1.78 | U219: 741 | V219: 2.6699999999999999 | W219: 2.8999999999999998e-002 | X219: 3.7000000000000005e-002 | Y219: 62 | Z219: 2.5 | AA219: -6.3799999999999996e-002 | AB219: -7.0400000000000004e-002 | AC219: -0.114 | AD219: -0.11599999999999999 | AE219: 90.17 | AF219: 92.44 | AG219: 0.78 | AH219: AA- | AI219: 6.0100000000000001e-002 | AJ219: =H219+100*O219 -> 173.47 | AK219: 179.1 | AL219: 291 | AM219: 86.7 | AN219: 285 | AO219: 8.9999999999999997e-002 | AP219: 15 | AQ219: 春秋转债!
A220: 219 | B220: 123050 | C220: 聚飞转债! | D220: 300303 | E220: 聚飞光电 | F220: 电子 | G220: LED制 | H220: 143.57 | I220: -2.6200000000000001e-002 | J220: 2.1700000000000001e-002 | K220: 6.2 | L220: -6.4000000000000003e-003 | M220: 123.8 | N220: 5.08 | O220: 0.17600000000000002 | P220: 122.05 | Q220: 已到 | R220: 4.24年 | S220: 2.24年 | T220: 3.75 | U220: 37 | V220: 6.7000000000000004e-002 | W220: 4.4999999999999998e-002 | X220: 5.5e-002 | Y220: 83 | Z220: 3 | AA220: -3.5099999999999999e-002 | AB220: -4.4000000000000004e-002 | AC220: -0.127 | AD220: -0.129 | AE220: 90.27 | AF220: 97.22 | AG220: 0.7 | AH220: AA- | AI220: 6.0100000000000001e-002 | AJ220: =H220+100*O220 -> 161.16999999999999 | AK220: 165.1 | AL220: 225 | AM220: 67.9 | AN220: 197 | AO220: -8.0000000000000002e-003 | AP220: 12 | AQ220: 聚飞转债!
A221: 220 | B221: 123049 | C221: 维尔转债! | D221: 300190 | E221: 维尔利 | F221: 城市公用 | G221: 三废处理 | H221: 115.78 | I221: -6.9999999999999993e-003 | J221: -1.e-004 | K221: 5.99 | L221: -1.9599999999999999e-002 | M221: 124.3 | N221: 7.38 | O221: 0.42599999999999999 | P221: 81.17 | Q221: 已到 | R221: 4.24年 | S221: 2.24年 | T221: 9.17 | U221: 11 | V221: 1.e-002 | W221: 0.19600000000000001 | X221: 0.159 | Y221: 47 | Z221: 1.07 | AA221: 1.7299999999999999e-002 | AB221: 7.4999999999999997e-003 | AC221: -4.3299999999999998e-002 | AD221: -4.6399999999999997e-002 | AE221: 90.73 | AF221: 97.69 | AG221: 0.36 | AH221: AA- | AI221: 6.0100000000000001e-002 | AJ221: =H221+100*O221 -> 158.38 | AK221: 150.4 | AL221: 104 | AM221: 52.7 | AN221: 93 | AO221: -1.8000000000000002e-002 | AP221: 20 | AQ221: 维尔转债!
A222: 221 | B222: 110070 | C222: 凌钢转债! | D222: 600231 | E222: 凌钢股份 | F222: 钢铁 | G222: 炼钢 | H222: 124.81 | I222: -3.9e-002 | J222: 2.23e-002 | K222: 2.7 | L222: -3.2300000000000002e-002 | M222: 117.4 | N222: 2.69 | O222: 0.24299999999999999 | P222: 100.37 | Q222: 已到 | R222: 4.24年 | S222: 2.24年 | T222: 2.17 | U222: 25 | V222: 9.3000000000000013e-002 | W222: 2.7999999999999997e-002 | X222: 2.7999999999999997e-002 | Y222: 77 | Z222: 0.82 | AA222: -1.47e-002 | AB222: -2.1700000000000001e-002 | AC222: -7.4700000000000003e-002 | AD222: -7.7300000000000008e-002 | AE222: 94.69 | AF222: 100.17 | AG222: 0.52 | AH222: AA | AI222: 3.9100000000000003e-002 | AJ222: =H222+100*O222 -> 149.11000000000001 | AK222: 149.2 | AL222: 88 | AM222: 49.1 | AN222: 71 | AO222: -1.e-002 | AP222: 21 | AQ222: 凌钢转债!
A223: 222 | B223: 128106 | C223: 华统转债! | D223: 2840 | E223: 华统股份 | F223: 农业 | G223: 农产品加 | H223: 190.001 | I223: 4.7999999999999996e-003 | J223: -2.0999999999999999e-003 | K223: 17.91 | L223: 2.8000000000000004e-003 | M223: 112.9 | N223: 9.37 | O223: -6.0000000000000001e-003 | P223: 191.14 | Q223: 已到 | R223: 4.23年 | S223: 2.23年 | T223: 4.31 | U223: 588 | V223: 0.71400000000000008 | W223: 5.2999999999999999e-002 | X223: 0.10099999999999999 | Y223: 82 | Z223: 4.75 | AA223: -0.11800000000000001 | AB223: -0.122 | AC223: -0.161 | AD223: -0.16200000000000001 | AE223: 94.41 | AF223: 96.33 | AG223: 0.96 | AH223: AA | AI223: 3.9100000000000003e-002 | AJ223: =H223+100*O223 -> 189.40100000000001 | AK223: 188.9 | AL223: 310 | AM223: 92.5 | AN223: 297 | AO223: 0.113 | AP223: 13 | AQ223: 华统转债!
A224: 223 | B224: 123048 | C224: 应急转债! | D224: 300527 | E224: 中船应急 | F224: 机械装备 | G224: 专用设备 | H224: 140.7 | I224: -5.6999999999999993e-003 | J224: 5.6999999999999993e-003 | K224: 10.42 | L224: 0. | M224: 112.8 | N224: 8.88 | O224: 0.19899999999999998 | P224: 117.34 | Q224: 已到 | R224: 4.23年 | S224: 2.23年 | T224: 3.79 | U224: 89 | V224: 0.16600000000000001 | W224: 3.7999999999999999e-002 | X224: 4.4000000000000004e-002 | Y224: 100 | Z224: 3.82 | AA224: -5.1900000000000002e-002 | AB224: -5.6900000000000006e-002 | AC224: -0.121 | AD224: -0.12300000000000001 | AE224: 95.39 | AF224: 98.18 | AG224: 0.7 | AH224: AA+ | AI224: 3.4099999999999998e-002 | AJ224: =H224+100*O224 -> 160.59999999999999 | AK224: 164.1 | AL224: 215 | AM224: 65.9 | AN224: 183 | AO224: 2.9999999999999999e-002 | AP224: 15 | AQ224: 应急转债!
A225: 224 | B225: 113576 | C225: 起步转债!! | D225: 603557 | E225: ST起步 | F225: 服装纺织 | G225: 鞋服行业 | H225: 115.15 | I225: -2.41e-002 | J225: 2.2200000000000001e-002 | K225: 5.11 | L225: -2.29e-002 | M225: 121.3 | N225: 10.55 | O225: 1.3799999999999999 | P225: 48.44 | Q225: 已到 | R225: 4.23年 | S225: 2.23年 | T225: 2.66 | U225: 62 | V225: 0.20199999999999999 | W225: 0.105 | X225: 5.0999999999999997e-002 | Y225: 25 | Z225: 1.68 | AA225: 1.2699999999999999e-002 | AB225: 3.9000000000000003e-003 | AC225: -4.1200000000000001e-002 | AD225: -4.4400000000000002e-002 | AE225: 82.99 | AF225: 81.64 | AG225: 0.08 | AH225: BBB+ | AI225: 0.1011 | AJ225: =H225+100*O225 -> 253.15000000000001 | AK225: 181.9 | AL225: 297 | AM225: 98.9 | AN225: 313 | AO225: -0.10300000000000001 | AP225: 34 | AQ225: 起步转债!!
A226: 225 | B226: 128105 | C226: 长集转债! | D226: 2616 | E226: 长青集团 | F226: 城市公用 | G226: 三废处理 | H226: 111 | I226: -1.5100000000000001e-002 | J226: 1.37e-002 | K226: 5.52 | L226: -7.1999999999999998e-003 | M226: 114.9 | N226: 7.91 | O226: 0.59099999999999997 | P226: 69.79 | Q226: 已到 | R226: 4.23年 | S226: 2.23年 | T226: 8 | U226: 34 | V226: 3.7999999999999999e-002 | W226: 0.19500000000000001 | X226: 0.13600000000000001 | Y226: 41 | Z226: 1.64 | AA226: 8.3999999999999995e-003 | AB226: 2.e-003 | AC226: -2.9399999999999999e-002 | AD226: -3.2099999999999997e-002 | AE226: 94.42 | AF226: 98.05 | AG226: 0.19 | AH226: AA | AI226: 3.9100000000000003e-002 | AJ226: =H226+100*O226 -> 170.09999999999999 | AK226: 152.2 | AL226: 130 | AM226: 54.2 | AN226: 105 | AO226: -9.3000000000000013e-002 | AP226: 22 | AQ226: 长集转债!
A227: 226 | B227: 113575 | C227: 东时转债!! | D227: 603377 | E227: 东方时尚 | F227: 其他 | G227: 其他 | H227: 127.87 | I227: -5.4000000000000003e-003 | J227: 6.4000000000000003e-003 | K227: 8.78 | L227: 4.5999999999999999e-003 | M227: 113.1 | N227: 12.15 | O227: 0.76900000000000002 | P227: 72.26 | Q227: 已到 | R227: 4.23年 | S227: 2.23年 | T227: 0.98 | U227: 21 | V227: 0.16399999999999998 | W227: 1.4999999999999999e-002 | X227: 1.1000000000000001e-002 | Y227: 64 | Z227: 2.95 | AA227: -2.92e-002 | AB227: -3.4599999999999999e-002 | AC227: -8.539999999999999e-002 | AD227: -8.7799999999999989e-002 | AE227: 94.45 | AF227: 96.52 | AG227: 0.22 | AH227: AA | AI227: 3.9100000000000003e-002 | AJ227: =H227+100*O227 -> 204.77000000000001 | AK227: 183.5 | AL227: 299 | AM227: 87 | AN227: 287 | AO227: -9.0000000000000011e-003 | AP227: 14 | AQ227: 东时转债!!
A228: 227 | B228: 127016 | C228: 鲁泰转债! | D228: 726 | E228: 鲁 泰Ａ | F228: 服装纺织 | G228: 纺织行业 | H228: 113.8 | I228: -1.23e-002 | J228: 7.6e-003 | K228: 6.75 | L228: -2.0299999999999999e-002 | M228: 115.9 | N228: 8.71 | O228: 0.46799999999999997 | P228: 77.5 | Q228: 已到 | R228: 4.23年 | S228: 2.23年 | T228: 14 | U228: 13 | V228: 8.0000000000000002e-003 | W228: 0.23499999999999999 | X228: 0.182 | Y228: 60 | Z228: 0.75 | AA228: 4.4000000000000003e-003 | AB228: -2.3e-003 | AC228: -3.9599999999999996e-002 | AD228: -4.2099999999999999e-002 | AE228: 95.5 | AF228: 100.89 | AG228: 0.23 | AH228: AA+ | AI228: 3.4099999999999998e-002 | AJ228: =H228+100*O228 -> 160.59999999999999 | AK228: 150.1 | AL228: 100 | AM228: 49.2 | AN228: 72 | AO228: 4.0999999999999995e-002 | AP228: 23 | AQ228: 鲁泰转债!
A229: 228 | B229: 113033 | C229: 利群转债! | D229: 601366 | E229: 利群股份 | F229: 商业零售 | G229: 商场 | H229: 112.19 | I229: -1.72e-002 | J229: 1.5800000000000002e-002 | K229: 6.26 | L229: -3.2000000000000002e-003 | M229: 114.9 | N229: 7.01 | O229: 0.25600000000000001 | P229: 89.3 | Q229: 已到 | R229: 4.21年 | S229: 2.21年 | T229: 18 | U229: 23 | V229: 1.1000000000000001e-002 | W229: 0.33399999999999996 | X229: 0.29799999999999999 | Y229: 54 | Z229: 1.23 | AA229: 5.7999999999999996e-003 | AB229: -5.9999999999999995e-004 | AC229: -3.4099999999999998e-002 | AD229: -3.6699999999999997e-002 | AE229: 94.49 | AF229: 98.13 | AG229: 0.42 | AH229: AA | AI229: 3.9100000000000003e-002 | AJ229: =H229+100*O229 -> 137.78999999999999 | AK229: 135.1 | AL229: 10 | AM229: 37 | AN229: 16 | AO229: 1.2e-002 | AP229: 71 | AQ229: 利群转债!
A230: 229 | B230: 113574 | C230: 华体转债! | D230: 603679 | E230: 华体科技 | F230: 城市公用 | G230: 城市公用 | H230: 115.11 | I230: -1.6200000000000003e-002 | J230: 1.5700000000000002e-002 | K230: 14.3 | L230: -3.3099999999999997e-002 | M230: 115.9 | N230: 33.91 | O230: 1.73 | P230: 42.17 | Q230: 已到 | R230: 4.20年 | S230: 2.20年 | T230: 2.09 | U230: 9.9 | V230: 4.0999999999999995e-002 | W230: 0.10300000000000001 | X230: 4.2999999999999997e-002 | Y230: 20 | Z230: 2.71 | AA230: 1.7000000000000001e-003 | AB230: -5.1000000000000004e-003 | AC230: -4.2099999999999999e-002 | AD230: -4.5199999999999997e-002 | AE230: 88.61 | AF230: 87.52 | AG230: 0.02 | AH230: A+ | AI230: 7.1099999999999997e-002 | AJ230: =H230+100*O230 -> 288.11000000000001 | AK230: 188 | AL230: 306 | AM230: 99.4 | AN230: 314 | AO230: 2.5000000000000001e-002 | AP230: 21 | AQ230: 华体转债!
A231: 230 | B231: 128103 | C231: 同德转债! | D231: 2360 | E231: 同德化工 | F231: 化工 | G231: 化工 | H231: 183.4 | I231: -1.3300000000000001e-002 | J231: 1.1299999999999999e-002 | K231: 9 | L231: -2.2000000000000001e-003 | M231: 121.3 | N231: 5.08 | O231: 3.5000000000000003e-002 | P231: 177.17 | Q231: 已到 | R231: 4.19年 | S231: 2.19年 | T231: 0.88 | U231: 39 | V231: 0.23699999999999999 | W231: 2.4e-002 | X231: 4.2999999999999997e-002 | Y231: 36 | Z231: 2.69 | AA231: -9.5899999999999999e-002 | AB231: -0.10300000000000001 | AC231: -0.156 | AD231: -0.157 | AE231: 88.81 | AF231: 91.66 | AG231: 0.92 | AH231: A+ | AI231: 7.1099999999999997e-002 | AJ231: =H231+100*O231 -> 186.90000000000001 | AK231: 189.6 | AL231: 312 | AM231: 98 | AN231: 311 | AO231: -3.1e-002 | AP231: 18 | AQ231: 同德转债!
A232: 231 | B232: 110068 | C232: 龙净转债! | D232: 600388 | E232: 龙净环保 | F232: 城市公用 | G232: 三废处理 | H232: 111.87 | I232: -6.3e-003 | J232: 2.e-003 | K232: 8.46 | L232: -1.5100000000000001e-002 | M232: 114.8 | N232: 10.55 | O232: 0.39500000000000002 | P232: 80.19 | Q232: 已到 | R232: 4.19年 | S232: 2.19年 | T232: 20 | U232: 37 | V232: 1.6e-002 | W232: 0.221 | X232: 0.17699999999999999 | Y232: 90 | Z232: 1.4 | AA232: 6.3e-003 | AB232: -1.e-004 | AC232: -3.3599999999999998e-002 | AD232: -3.6200000000000003e-002 | AE232: 95.54 | AF232: 100.07 | AG232: 0.28 | AH232: AA+ | AI232: 3.4099999999999998e-002 | AJ232: =H232+100*O232 -> 151.37 | AK232: 143.6 | AL232: 43 | AM232: 43.5 | AN232: 35 | AO232: -1.3000000000000001e-002 | AP232: 41 | AQ232: 龙净转债!
A233: 232 | B233: 123046 | C233: 天铁转债! | D233: 300587 | E233: 天铁股份 | F233: 铁路 | G233: 铁路设备 | H233: 307.538 | I233: -2.5000000000000001e-003 | J233: 6.0999999999999995e-003 | K233: 19.21 | L233: 3.7000000000000002e-003 | M233: 117.7 | N233: 6.73 | O233: 7.6999999999999999e-002 | P233: 285.44 | Q233: 已到 | R233: 4.17年 | S233: 2.17年 | T233: 0.6 | U233: 86 | V233: 0.47100000000000003 | W233: 5.0000000000000001e-003 | X233: 1.3999999999999999e-002 | Y233: 121 | Z233: 6.53 | AA233: -0.20899999999999999 | AB233: -0.214 | AC233: -0.24399999999999999 | AD233: -0.245 | AE233: 90.55 | AF233: 92.82 | AG233: 0.98 | AH233: AA- | AI233: 6.0100000000000001e-002 | AJ233: =H233+100*O233 -> 315.238 | AK233: 329.6 | AL233: 363 | AM233: 236.8 | AN233: 363 | AO233: -1.3999999999999999e-002 | AP233: 13 | AQ233: 天铁转债!
A234: 233 | B234: 128101 | C234: 联创转债!! | D234: 2036 | E234: 联创电子 | F234: 电子 | G234: 液晶显示 | H234: 206.827 | I234: 3.9399999999999998e-002 | J234: 3.0499999999999999e-002 | K234: 23.79 | L234: 7.4999999999999997e-002 | M234: 114.8 | N234: 13.72 | O234: 0.193 | P234: 173.4 | Q234: 已到 | R234: 4年59天 | S234: 2年59天 | T234: 3 | U234: 646 | V234: 1.05 | W234: 1.2e-002 | X234: 2.1000000000000001e-002 | Y234: 253 | Z234: 6.48 | AA234: -0.13400000000000001 | AB234: -0.13900000000000001 | AC234: -0.184 | AD234: -0.185 | AE234: 94.55 | AF234: 98.19 | AG234: 0.93 | AH234: AA | AI234: 3.9100000000000003e-002 | AJ234: =H234+100*O234 -> 226.12700000000001 | AK234: 240.3 | AL234: 347 | AM234: 142.1 | AN234: 348 | AO234: 4.4999999999999998e-002 | AP234: 13 | AQ234: 联创转债!!
A235: 234 | B235: 123045 | C235: 雷迪转债 | D235: 300652 | E235: 雷迪克 | F235: 汽车 | G235: 零部件制 | H235: 134.981 | I235: -1.11e-002 | J235: -2.9999999999999997e-004 | K235: 22.64 | L235: -1.61e-002 | M235: 118.9 | N235: 19.63 | O235: 0.17000000000000001 | P235: 115.33 | Q235: 已到 | R235: 4年55天 | S235: 2年55天 | T235: 1.66 | U235: 40 | V235: 0.17899999999999999 | W235: 7.8e-002 | X235: 8.9999999999999997e-002 | Y235: 21 | Z235: 2.24 | AA235: -3.0800000000000001e-002 | AB235: -3.8300000000000001e-002 | AC235: -0.107 | AD235: -0.11 | AE235: 88.93 | AF235: 90.09 | AG235: 0.71 | AH235: A+ | AI235: 7.1099999999999997e-002 | AJ235: =H235+100*O235 -> 151.98099999999999 | AK235: 154.6 | AL235: 144 | AM235: 64.5 | AN235: 171 | AO235: 1.3000000000000001e-002 | AP235: 33 | AQ235: 雷迪转债
A236: 235 | B236: 128100 | C236: 搜特转债! | D236: 2503 | E236: 搜于特 | F236: 服装纺织 | G236: 服装行业 | H236: 111.771 | I236: -1.5100000000000001e-002 | J236: 1.5100000000000001e-002 | K236: 1.68 | L236: 0. | M236: 116.9 | N236: 1.62 | O236: 7.8e-002 | P236: 103.7 | Q236: 已到 | R236: 4年55天 | S236: 2年55天 | T236: 7.99 | U236: 109 | V236: 0.122 | W236: 0.154 | X236: 0.159 | Y236: 52 | Z236: 3.44 | AA236: 1.11e-002 | AB236: 3.8e-003 | AC236: -3.3300000000000003e-002 | AD236: -3.6000000000000004e-002 | AE236: 86.47 | AF236: 85.2 | AG236: 0.68 | AH236: A | AI236: 8.1099999999999992e-002 | AJ236: =H236+100*O236 -> 119.571 | AK236: 119.8 | AL236: 1 | AM236: 33.4 | AN236: 7 | AO236: 2.6000000000000002e-002 | AP236: 92 | AQ236: 搜特转债!
A237: 236 | B237: 123044 | C237: 红相转债!! | D237: 300427 | E237: 红相股份 | F237: 能源电力 | G237: 电力设备 | H237: 116.6 | I237: -1.2699999999999999e-002 | J237: 7.0999999999999995e-003 | K237: 12.56 | L237: -2.7099999999999999e-002 | M237: 125 | N237: 18.67 | O237: 0.73299999999999998 | P237: 67.27 | Q237: 已到 | R237: 4年55天 | S237: 2年55天 | T237: 5.5 | U237: 9.8 | V237: 1.4999999999999999e-002 | W237: 0.121 | X237: 8.199999999999999e-002 | Y237: 45 | Z237: 1.92 | AA237: 1.7399999999999999e-002 | AB237: 7.0999999999999995e-003 | AC237: -4.6699999999999998e-002 | AD237: -5.0199999999999995e-002 | AE237: 91.46 | AF237: 98.79 | AG237: 0.21 | AH237: AA- | AI237: 6.0100000000000001e-002 | AJ237: =H237+100*O237 -> 189.89999999999998 | AK237: 165.9 | AL237: 233 | AM237: 67.1 | AN237: 191 | AO237: -5.7999999999999996e-002 | AP237: 23 | AQ237: 红相转债!!
A238: 237 | B238: 110067 | C238: 华安转债! | D238: 600909 | E238: 华安证券 | F238: 金融 | G238: 证券行业 | H238: 115.27 | I238: -1.7000000000000001e-002 | J238: 8.5000000000000006e-003 | K238: 5.21 | L238: -2.4300000000000002e-002 | M238: 110.3 | N238: 6.22 | O238: 0.376 | P238: 83.76 | Q238: 已到 | R238: 4年55天 | S238: 无权 | T238: 28 | U238: 21 | V238: 6.0000000000000001e-003 | W238: 0.114 | X238: 9.6000000000000002e-002 | Y238: 245 | Z238: 1.31 | AA238: -1.0700000000000001e-002 | AB238: -1.52e-002 | AC238: 无权 | AD238: 无权 | AE238: 无权 | AF238: 96.93 | AG238: 0.35 | AH238: AAA | AI238: 3.2099999999999997e-002 | AJ238: =H238+100*O238 -> 152.87 | AK238: 146.8 | AL238: 70 | AM238: 49.9 | AN238: 76 | AO238: -2.7000000000000003e-002 | AP238: 25 | AQ238: 华安转债!
A239: 238 | B239: 113570 | C239: 百达转债! | D239: 603331 | E239: 百达精工 | F239: 机械装备 | G239: 机械装备 | H239: 129.7 | I239: -1.95e-002 | J239: -2.5999999999999999e-003 | K239: 12.76 | L239: -3.04e-002 | M239: 114.9 | N239: 11.34 | O239: 0.153 | P239: 112.52 | Q239: 已到 | R239: 4年54天 | S239: 2年54天 | T239: 2.8 | U239: 27 | V239: 7.2999999999999995e-002 | W239: 0.12300000000000001 | X239: 0.13900000000000001 | Y239: 23 | Z239: 2.8 | AA239: -2.9399999999999999e-002 | AB239: -3.5499999999999997e-002 | AC239: -9.4e-002 | AD239: -9.64e-002 | AE239: 88.35 | AF239: 86.98 | AG239: 0.73 | AH239: A+ | AI239: 7.1099999999999997e-002 | AJ239: =H239+100*O239 -> 145. | AK239: 146.9 | AL239: 71 | AM239: 58.5 | AN239: 135 | AO239: -1.3000000000000001e-002 | AP239: 31 | AQ239: 百达转债!
A240: 239 | B240: 113569 | C240: 科达转债! | D240: 603660 | E240: 苏州科达 | F240: 通信互联 | G240: 物联网 | H240: 106.5 | I240: -2.1099999999999997e-002 | J240: 2.0199999999999999e-002 | K240: 7.05 | L240: -1.95e-002 | M240: 120.3 | N240: 14.8 | O240: 1.24 | P240: 47.64 | Q240: 已到 | R240: 4年52天 | S240: 2年52天 | T240: 5.16 | U240: 17 | V240: 3.1e-002 | W240: 0.14800000000000002 | X240: 7.0999999999999994e-002 | Y240: 35 | Z240: 2.06 | AA240: 3.0600000000000002e-002 | AB240: 2.18e-002 | AC240: -1.1899999999999999e-002 | AD240: -1.49e-002 | AE240: 90.72 | AF240: 95.01 | AG240: 0.05 | AH240: AA- | AI240: 6.0100000000000001e-002 | AJ240: =H240+100*O240 -> 230.5 | AK240: 165.4 | AL240: 229 | AM240: 70.4 | AN240: 218 | AO240: 1.4999999999999999e-002 | AP240: 39 | AQ240: 科达转债!
A241: 240 | B241: 113568 | C241: 新春转债!! | D241: 603667 | E241: 五洲新春 | F241: 机械装备 | G241: 通用设备 | H241: 195.69 | I241: 6.6e-003 | J241: 1.72e-002 | K241: 15.25 | L241: 2.6200000000000001e-002 | M241: 124.3 | N241: 8.75 | O241: 0.12300000000000001 | P241: 174.29 | Q241: 已到 | R241: 4年49天 | S241: 2年49天 | T241: 2.44 | U241: 56 | V241: 0.11699999999999999 | W241: 5.2999999999999999e-002 | X241: 9.1999999999999998e-002 | Y241: 46 | Z241: 2.44 | AA241: -0.106 | AB241: -0.114 | AC241: -0.17399999999999999 | AD241: -0.17600000000000002 | AE241: 91.29 | AF241: 98.28 | AG241: 0.91 | AH241: AA- | AI241: 6.0100000000000001e-002 | AJ241: =H241+100*O241 -> 207.99000000000001 | AK241: 217.1 | AL241: 336 | AM241: 118.8 | AN241: 333 | AO241: -8.5000000000000006e-002 | AP241: 35 | AQ241: 新春转债!!
A242: 241 | B242: 123043 | C242: 正元转债! | D242: 300645 | E242: 正元智慧 | F242: 计算机及 | G242: 软件开发 | H242: 173.3 | I242: -4.1500000000000002e-002 | J242: 1.66e-002 | K242: 22.58 | L242: -2.92e-002 | M242: 120.9 | N242: 15.38 | O242: 0.17999999999999999 | P242: 146.81 | Q242: 已到 | R242: 4年48天 | S242: 2年48天 | T242: 1.66 | U242: 433 | V242: 1.46 | W242: 5.7000000000000002e-002 | X242: 8.4000000000000005e-002 | Y242: 29 | Z242: 4.35 | AA242: -8.5199999999999998e-002 | AB242: -9.2799999999999994e-002 | AC242: -0.14899999999999999 | AD242: -0.14999999999999999 | AE242: 89.05 | AF242: 91.71 | AG242: 0.85 | AH242: A+ | AI242: 7.1099999999999997e-002 | AJ242: =H242+100*O242 -> 191.30000000000001 | AK242: 199.8 | AL242: 324 | AM242: 108.1 | AN242: 324 | AO242: -3.3000000000000002e-002 | AP242: 16 | AQ242: 正元转债!
A243: 242 | B243: 113567 | C243: 君禾转债! | D243: 603617 | E243: 君禾股份 | F243: 机械装备 | G243: 通用设备 | H243: 136.28 | I243: -1.1200000000000002e-002 | J243: 9.0000000000000011e-003 | K243: 13.66 | L243: -2.8999999999999998e-003 | M243: 118.8 | N243: 10.58 | O243: 5.5999999999999994e-002 | P243: 129.11 | Q243: 已到 | R243: 4年47天 | S243: 2年47天 | T243: 2.1 | U243: 31 | V243: 0.109 | W243: 5.9000000000000004e-002 | X243: 7.6999999999999999e-002 | Y243: 35 | Z243: 3.88 | AA243: -3.3500000000000002e-002 | AB243: -4.0999999999999995e-002 | AC243: -0.11199999999999999 | AD243: -0.115 | AE243: 88.99 | AF243: 90.15 | AG243: 0.78 | AH243: A+ | AI243: 7.1099999999999997e-002 | AJ243: =H243+100*O243 -> 141.88 | AK243: 143.4 | AL243: 42 | AM243: 53.3 | AN243: 97 | AO243: 7.0999999999999994e-002 | AP243: 33 | AQ243: 君禾转债!
A244: 243 | B244: 110066 | C244: 盛屯转债!! | D244: 600711 | E244: 盛屯矿业 | F244: 有色金属 | G244: 有色行业 | H244: 252.85 | I244: 9.1999999999999998e-003 | J244: -1.6500000000000001e-002 | K244: 10.6 | L244: -7.4999999999999997e-003 | M244: 114.9 | N244: 4.87 | O244: 0.16200000000000001 | P244: 217.66 | Q244: 已到 | R244: 4年45天 | S244: 2年45天 | T244: 3.83 | U244: 111 | V244: 0.115 | W244: 1.3000000000000001e-002 | X244: 2.8999999999999998e-002 | Y244: 291 | Z244: 2.36 | AA244: -0.17699999999999999 | AB244: -0.182 | AC244: -0.223 | AD244: -0.22399999999999998 | AE244: 94.79 | AF244: 98.44 | AG244: 0.97 | AH244: AA | AI244: 3.9100000000000003e-002 | AJ244: =H244+100*O244 -> 269.05000000000001 | AK244: 288 | AL244: 359 | AM244: 189.6 | AN244: 359 | AO244: -1.3000000000000001e-002 | AP244: 27 | AQ244: 盛屯转债!!
A245: 244 | B245: 113566 | C245: 翔港转债! | D245: 603499 | E245: 翔港科技 | F245: 造纸包装 | G245: 包装材料 | H245: 119.73 | I245: -2.0400000000000001e-002 | J245: 9.1000000000000004e-003 | K245: 9.49 | L245: -2.3700000000000002e-002 | M245: 124 | N245: 10.77 | O245: 0.35899999999999999 | P245: 88.12 | Q245: 已到 | R245: 4年43天 | S245: 2年43天 | T245: 1.61 | U245: 16 | V245: 8.199999999999999e-002 | W245: 8.4000000000000005e-002 | X245: 7.400000000000001e-002 | Y245: 19 | Z245: 3.36 | AA245: 8.8000000000000005e-003 | AB245: -1.1000000000000001e-003 | AC245: -5.9900000000000002e-002 | AD245: -6.3099999999999989e-002 | AE245: 89.24 | AF245: 94.16 | AG245: 0.47 | AH245: A+ | AI245: 7.1099999999999997e-002 | AJ245: =H245+100*O245 -> 155.63 | AK245: 151.3 | AL245: 119 | AM245: 57.2 | AN245: 122 | AO245: 2.5000000000000001e-002 | AP245: 29 | AQ245: 翔港转债!
A246: 245 | B246: 113565 | C246: 宏辉转债 | D246: 603336 | E246: 宏辉果蔬 | F246: 农业 | G246: 农产品加 | H246: 131.96 | I246: -1.8600000000000002e-002 | J246: 8.3000000000000001e-003 | K246: 8.63 | L246: -1.4800000000000001e-002 | M246: 117.8 | N246: 7.64 | O246: 0.16800000000000001 | P246: 112.96 | Q246: 已到 | R246: 4年41天 | S246: 2年41天 | T246: 2.25 | U246: 731 | V246: 2.3599999999999999 | W246: 5.9999999999999998e-002 | X246: 6.7000000000000004e-002 | Y246: 38 | Z246: 3.64 | AA246: -2.7900000000000001e-002 | AB246: -3.5099999999999999e-002 | AC246: -0.10099999999999999 | AD246: -0.10400000000000001 | AE246: 90.96 | AF246: 93.24 | AG246: 0.69 | AH246: AA- | AI246: 6.0100000000000001e-002 | AJ246: =H246+100*O246 -> 148.76000000000002 | AK246: 151 | AL246: 112 | AM246: 57.7 | AN246: 126 | AO246: 4.7e-002 | AP246: 28 | AQ246: 宏辉转债
A247: 246 | B247: 128097 | C247: 奥佳转债!! | D247: 2614 | E247: 奥佳华 | F247: 机械装备 | G247: 专用设备 | H247: 149.291 | I247: -8.6e-003 | J247: -1.52e-002 | K247: 12.97 | L247: -3.0600000000000002e-002 | M247: 114.9 | N247: 10.39 | O247: 0.19600000000000001 | P247: 124.83 | Q247: 已到 | R247: 4年40天 | S247: 2年40天 | T247: 4.59 | U247: 24 | V247: 3.5000000000000003e-002 | W247: 5.5999999999999994e-002 | X247: 7.0000000000000007e-002 | Y247: 82 | Z247: 1.74 | AA247: -6.2899999999999998e-002 | AB247: -6.88e-002 | AC247: -0.115 | AD247: -0.11599999999999999 | AE247: 90.67 | AF247: 90.89 | AG247: 0.78 | AH247: AA- | AI247: 6.0100000000000001e-002 | AJ247: =H247+100*O247 -> 168.89099999999999 | AK247: 173.8 | AL247: 266 | AM247: 82.9 | AN247: 274 | AO247: 2.3e-002 | AP247: 16 | AQ247: 奥佳转债!!
A248: 247 | B248: 128095 | C248: 恩捷转债!! | D248: 2812 | E248: 恩捷股份 | F248: 电子 | G248: 元器件制 | H248: 452.986 | I248: 2.9500000000000002e-002 | J248: -8.6e-003 | K248: 257.3 | L248: 2.12e-002 | M248: 114.9 | N248: 64.92 | O248: 0.14300000000000002 | P248: 396.33 | Q248: 已到 | R248: 4年26天 | S248: 2年26天 | T248: 4.54 | U248: 260 | V248: 0.127 | W248: 2.e-003 | X248: 8.0000000000000002e-003 | Y248: 2296. | Z248: 17.91 | AA248: -0.28999999999999998 | AB248: -0.29399999999999998 | AC248: -0.30099999999999999 | AD248: -0.30199999999999999 | AE248: 94.99 | AF248: 98.63 | AG248: 0.99 | AH248: AA | AI248: 3.9100000000000003e-002 | AJ248: =H248+100*O248 -> 467.286 | AK248: 509.6 | AL248: 378 | AM248: 411 | AN248: 378 | AO248: 5.4000000000000006e-002 | AP248: 12 | AQ248: 恩捷转债!!
A249: 248 | B249: 128096 | C249: 奥瑞转债!! | D249: 2701 | E249: 奥瑞金 | F249: 造纸包装 | G249: 包装材料 | H249: 166.101 | I249: 5.3e-003 | J249: 4.2599999999999999e-002 | K249: 6.85 | L249: 5.3800000000000001e-002 | M249: 115.5 | N249: 4.5 | O249: 9.0999999999999998e-002 | P249: 152.22 | Q249: 已到 | R249: 4年26天 | S249: 2年26天 | T249: 5.66 | U249: 626 | V249: 0.64000000000000001 | W249: 3.4000000000000002e-002 | X249: 5.0999999999999997e-002 | Y249: 168 | Z249: 2.31 | AA249: -8.72e-002 | AB249: -9.3000000000000013e-002 | AC249: -0.14400000000000002 | AD249: -0.14599999999999999 | AE249: 96.42 | AF249: 101.11 | AG249: 0.89 | AH249: AA+ | AI249: 3.4099999999999998e-002 | AJ249: =H249+100*O249 -> 175.20099999999999 | AK249: 180 | AL249: 293 | AM249: 78.9 | AN249: 262 | AO249: 3.3000000000000002e-002 | AP249: 16 | AQ249: 奥瑞转债!!
A250: 249 | B250: 113563 | C250: 柳药转债! | D250: 603368 | E250: 柳药股份 | F250: 医药 | G250: 医药商业 | H250: 122.42 | I250: 1.06e-002 | J250: -1.1000000000000001e-003 | K250: 21.73 | L250: 2.1600000000000001e-002 | M250: 112.9 | N250: 23.87 | O250: 0.34499999999999997 | P250: 91.03 | Q250: 已到 | R250: 4年0.6天 | S250: 2年0.6天 | T250: 8.02 | U250: 99 | V250: 0.10099999999999999 | W250: 0.10199999999999999 | X250: 9.3000000000000013e-002 | Y250: 79 | Z250: 1.51 | AA250: -2.0499999999999997e-002 | AB250: -2.6099999999999998e-002 | AC250: -7.5700000000000003e-002 | AD250: -7.8399999999999997e-002 | AE250: 95.25 | AF250: 97.19 | AG250: 0.44 | AH250: AA | AI250: 3.9100000000000003e-002 | AJ250: =H250+100*O250 -> 156.92000000000002 | AK250: 153.8 | AL250: 141 | AM250: 56.6 | AN250: 119 | AO250: 0.17699999999999999 | AP250: 18 | AQ250: 柳药转债!
A251: 250 | B251: 128094 | C251: 星帅转债! | D251: 2860 | E251: 星帅尔 | F251: 家电 | G251: 零部件制 | H251: 166.6 | I251: -5.1500000000000004e-002 | J251: 6.0000000000000001e-003 | K251: 22.45 | L251: -5.0700000000000002e-002 | M251: 121 | N251: 13.8 | O251: 2.4e-002 | P251: 162.68 | Q251: 已到 | R251: 4年0.6天 | S251: 2年0.6天 | T251: 2.09 | U251: 83 | V251: 0.23100000000000001 | W251: 4.5999999999999999e-002 | X251: 7.400000000000001e-002 | Y251: 46 | Z251: 3.98 | AA251: -7.85e-002 | AB251: -8.6500000000000007e-002 | AC251: -0.151 | AD251: -0.153 | AE251: 89.88 | AF251: 92.62 | AG251: 0.9 | AH251: A+ | AI251: 7.1099999999999997e-002 | AJ251: =H251+100*O251 -> 169. | AK251: 170.5 | AL251: 253 | AM251: 77.9 | AN251: 258 | AO251: -7.6999999999999999e-002 | AP251: 30 | AQ251: 星帅转债!
A252: 251 | B252: 123042 | C252: 银河转债!! | D252: 300619 | E252: 金银河 | F252: 机械装备 | G252: 专用设备 | H252: 346.191 | I252: -4.6300000000000001e-002 | J252: 4.6699999999999998e-002 | K252: 72.46 | L252: 4.0000000000000002e-004 | M252: 115.4 | N252: 23.59 | O252: 0.127 | P252: 307.16 | Q252: 已到 | R252: 3.996年 | S252: 1.996年 | T252: 0.98 | U252: 429 | V252: 1.23 | W252: 1.6e-002 | X252: 4.9000000000000002e-002 | Y252: 61 | Z252: 10.21 | AA252: -0.245 | AB252: -0.249 | AC252: -0.28600000000000003 | AD252: -0.28699999999999998 | AE252: 88.82 | AF252: 87.56 | AG252: 0.98 | AH252: A+ | AI252: 7.1099999999999997e-002 | AJ252: =H252+100*O252 -> 358.89099999999996 | AK252: 385.2 | AL252: 366 | AM252: 296.4 | AN252: 367 | AO252: -9.6999999999999989e-002 | AP252: 20 | AQ252: 银河转债!!
A253: 252 | B253: 127015 | C253: 希望转债!! | D253: 876 | E253: 新 希 望 | F253: 农业 | G253: 畜牧业 | H253: 124.25 | I253: -2.0099999999999996e-002 | J253: 1.03e-002 | K253: 16.66 | L253: -2.69e-002 | M253: 109.6 | N253: 19.75 | O253: 0.47299999999999998 | P253: 84.35 | Q253: 已到 | R253: 3.97年 | S253: 1.97年 | T253: 9.5 | U253: 46 | V253: 3.9e-002 | W253: 1.3000000000000001e-002 | X253: 1.1000000000000001e-002 | Y253: 751 | Z253: 2.46 | AA253: -3.1600000000000003e-002 | AB253: -3.5900000000000001e-002 | AC253: -8.77e-002 | AD253: -8.9499999999999996e-002 | AE253: 95.64 | AF253: 96.88 | AG253: 0.36 | AH253: AAA | AI253: 3.2099999999999997e-002 | AJ253: =H253+100*O253 -> 171.55000000000001 | AK253: 164.1 | AL253: 219 | AM253: 67.3 | AN253: 193 | AO253: 5.9999999999999998e-002 | AP253: 26 | AQ253: 希望转债!!
A254: 253 | B254: 128093 | C254: 百川转债!! | D254: 2455 | E254: 百川股份 | F254: 化工 | G254: 化工 | H254: 242.5 | I254: -1.21e-002 | J254: -9.3999999999999986e-003 | K254: 12.98 | L254: -2.2599999999999999e-002 | M254: 129 | N254: 5.77 | O254: 7.8e-002 | P254: 224.96 | Q254: 已到 | R254: 3.97年 | S254: 1.97年 | T254: 1.61 | U254: 76 | V254: 0.191 | W254: 2.2000000000000002e-002 | X254: 4.9000000000000002e-002 | Y254: 73 | Z254: 4.15 | AA254: -0.151 | AB254: -0.16 | AC254: -0.23300000000000001 | AD254: -0.23499999999999999 | AE254: 93.85 | AF254: 103.19 | AG254: 0.95 | AH254: AA- | AI254: 6.0100000000000001e-002 | AJ254: =H254+100*O254 -> 250.30000000000001 | AK254: 260 | AL254: 354 | AM254: 156.9 | AN254: 352 | AO254: -5.0999999999999997e-002 | AP254: 36 | AQ254: 百川转债!!
A255: 254 | B255: 113561 | C255: 正裕转债! | D255: 603089 | E255: 正裕工业 | F255: 汽车 | G255: 零部件制 | H255: 122.1 | I255: -1.3100000000000001e-002 | J255: 4.3e-003 | K255: 9.42 | L255: -1.5700000000000002e-002 | M255: 117.2 | N255: 10.08 | O255: 0.307 | P255: 93.45 | Q255: 已到 | R255: 3.96年 | S255: 1.96年 | T255: 1.5 | U255: 8.7 | V255: 4.7e-002 | W255: 7.2000000000000008e-002 | X255: 6.7000000000000004e-002 | Y255: 21 | Z255: 2.02 | AA255: -1.0500000000000001e-002 | AB255: -1.8000000000000002e-002 | AC255: -7.5899999999999995e-002 | AD255: -7.8700000000000006e-002 | AE255: 89.44 | AF255: 89.83 | AG255: 0.56 | AH255: A+ | AI255: 7.1099999999999997e-002 | AJ255: =H255+100*O255 -> 152.79999999999998 | AK255: 150.7 | AL255: 110 | AM255: 60.9 | AN255: 149 | AO255: -8.0000000000000002e-003 | AP255: 35 | AQ255: 正裕转债!
A256: 255 | B256: 128091 | C256: 新天转债! | D256: 2873 | E256: 新天药业 | F256: 医药 | G256: 中药 | H256: 221.89 | I256: 2.3099999999999999e-002 | J256: 1.1899999999999999e-002 | K256: 24.6 | L256: 3.6200000000000003e-002 | M256: 118.6 | N256: 11.62 | O256: 4.8000000000000001e-002 | P256: 211.7 | Q256: 已到 | R256: 3.96年 | S256: 1.96年 | T256: 1.55 | U256: 4034. | V256: 11.57 | W256: 3.7999999999999999e-002 | X256: 8.1000000000000003e-002 | Y256: 40 | Z256: 3.32 | AA256: -0.14899999999999999 | AB256: -0.156 | AC256: -0.221 | AD256: -0.223 | AE256: 89.74 | AF256: 90.97 | AG256: 0.97 | AH256: A+ | AI256: 7.1099999999999997e-002 | AJ256: =H256+100*O256 -> 226.69 | AK256: 232.1 | AL256: 344 | AM256: 141.1 | AN256: 346 | AO256: 0.25900000000000001 | AP256: 22 | AQ256: 新天转债!
A257: 256 | B257: 128090 | C257: 汽模转2 | D257: 2510 | E257: 天汽模 | F257: 汽车 | G257: 零部件制 | H257: 129.888 | I257: -9.4999999999999998e-003 | J257: 2.3e-003 | K257: 4.64 | L257: -1.0700000000000001e-002 | M257: 114.3 | N257: 4.23 | O257: 0.184 | P257: 109.69 | Q257: 已到 | R257: 3.95年 | S257: 1.95年 | T257: 3.1 | U257: 51 | V257: 0.126 | W257: 7.0999999999999994e-002 | X257: 7.8e-002 | Y257: 44 | Z257: 2.14 | AA257: -3.2400000000000005e-002 | AB257: -3.8599999999999995e-002 | AC257: -0.105 | AD257: -0.107 | AE257: 90.95 | AF257: 91.17 | AG257: 0.67 | AH257: AA- | AI257: 6.0100000000000001e-002 | AJ257: =H257+100*O257 -> 148.28800000000001 | AK257: 150.1 | AL257: 99 | AM257: 58.9 | AN257: 136 | AO257: 1.2e-002 | AP257: 28 | AQ257: 汽模转2
A258: 257 | B258: 123039 | C258: 开润转债! | D258: 300577 | E258: 开润股份 | F258: 服装纺织 | G258: 纺织行业 | H258: 117 | I258: -1.11e-002 | J258: 2.2000000000000001e-003 | K258: 21.57 | L258: -2.9700000000000001e-002 | M258: 120.3 | N258: 29.92 | O258: 0.623 | P258: 72.09 | Q258: 已到 | R258: 3.94年 | S258: 1.94年 | T258: 2.22 | U258: 2.6 | V258: 1.e-002 | W258: 4.2999999999999997e-002 | X258: 3.1e-002 | Y258: 52 | Z258: 3.21 | AA258: 7.1999999999999998e-003 | AB258: -1.7000000000000001e-003 | AC258: -5.74e-002 | AD258: -6.0199999999999997e-002 | AE258: 89.54 | AF258: 92.29 | AG258: 0.3 | AH258: A+ | AI258: 7.1099999999999997e-002 | AJ258: =H258+100*O258 -> 179.30000000000001 | AK258: 161.9 | AL258: 202 | AM258: 69.6 | AN258: 211 | AO258: -2.3e-002 | AP258: 22 | AQ258: 开润转债!
A259: 258 | B259: 123038 | C259: 联得转债! | D259: 300545 | E259: 联得装备 | F259: 机械装备 | G259: 专用设备 | H259: 128.9 | I259: -1.6799999999999999e-002 | J259: 8.0000000000000004e-004 | K259: 22.56 | L259: -2.8799999999999999e-002 | M259: 117.9 | N259: 24.07 | O259: 0.375 | P259: 93.73 | Q259: 已到 | R259: 3.94年 | S259: 1.94年 | T259: 1.47 | U259: 13 | V259: 6.7000000000000004e-002 | W259: 3.7000000000000005e-002 | X259: 3.4000000000000002e-002 | Y259: 40 | Z259: 2.9 | AA259: -2.2799999999999997e-002 | AB259: -3.04e-002 | AC259: -0.10099999999999999 | AD259: -0.10300000000000001 | AE259: 89.34 | AF259: 90.43 | AG259: 0.55 | AH259: A+ | AI259: 7.1099999999999997e-002 | AJ259: =H259+100*O259 -> 166.40000000000001 | AK259: 164.1 | AL259: 218 | AM259: 73.6 | AN259: 235 | AO259: -3.9e-002 | AP259: 18 | AQ259: 联得转债!
A260: 259 | B260: 113030 | C260: 东风转债! | D260: 601515 | E260: 东风股份 | F260: 造纸包装 | G260: 包装材料 | H260: 153.82 | I260: -1.7600000000000001e-002 | J260: -4.4000000000000003e-003 | K260: 8.22 | L260: -2.8399999999999998e-002 | M260: 116.3 | N260: 6.4 | O260: 0.19800000000000001 | P260: 128.44 | Q260: 已到 | R260: 3.94年 | S260: 1.94年 | T260: 2.95 | U260: 88 | V260: 0.19399999999999998 | W260: 2.3e-002 | X260: 2.9999999999999999e-002 | Y260: 126 | Z260: 2.42 | AA260: -6.9599999999999995e-002 | AB260: -7.6200000000000004e-002 | AC260: -0.13699999999999998 | AD260: -0.13900000000000001 | AE260: 94.88 | AF260: 100.26 | AG260: 0.77 | AH260: AA | AI260: 3.9100000000000003e-002 | AJ260: =H260+100*O260 -> 173.62 | AK260: 179.2 | AL260: 292 | AM260: 78.9 | AN260: 263 | AO260: 2.7000000000000003e-002 | AP260: 18 | AQ260: 东风转债!
A261: 260 | B261: 110064 | C261: 建工转债! | D261: 600939 | E261: 重庆建工 | F261: 建筑 | G261: 建筑工程 | H261: 116.51 | I261: -2.92e-002 | J261: 1.7100000000000001e-002 | K261: 4.18 | L261: -3.2400000000000005e-002 | M261: 119.2 | N261: 4.53 | O261: 0.26300000000000001 | P261: 92.27 | Q261: 已到 | R261: 3.93年 | S261: 1.93年 | T261: 16.6 | U261: 38 | V261: 1.9e-002 | W261: 0.21899999999999997 | X261: 0.20199999999999999 | Y261: 76 | Z261: 1.04 | AA261: 6.0000000000000001e-003 | AB261: -2.5999999999999999e-003 | AC261: -5.5199999999999999e-002 | AD261: -5.8200000000000002e-002 | AE261: 96.56 | AF261: 104.8 | AG261: 0.38 | AH261: AA+ | AI261: 3.4099999999999998e-002 | AJ261: =H261+100*O261 -> 142.81 | AK261: 140.7 | AL261: 26 | AM261: 35.9 | AN261: 14 | AO261: -1.8000000000000002e-002 | AP261: 47 | AQ261: 建工转债!
A262: 261 | B262: 128087 | C262: 孚日转债! | D262: 2083 | E262: 孚日股份 | F262: 服装纺织 | G262: 家纺 | H262: 123.379 | I262: -1.4499999999999999e-002 | J262: 1.5900000000000001e-002 | K262: 4.88 | L262: 2.0999999999999999e-003 | M262: 112.3 | N262: 4.5 | O262: 0.13800000000000001 | P262: 108.44 | Q262: 已到 | R262: 3.92年 | S262: 1.92年 | T262: 6.5 | U262: 49 | V262: 6.0999999999999999e-002 | W262: 0.14699999999999999 | X262: 0.159 | Y262: 44 | Z262: 1.18 | AA262: -2.41e-002 | AB262: -2.9600000000000001e-002 | AC262: -8.43e-002 | AD262: -8.6599999999999996e-002 | AE262: 91.09 | AF262: 89.72 | AG262: 0.7 | AH262: AA- | AI262: 6.0100000000000001e-002 | AJ262: =H262+100*O262 -> 137.179 | AK262: 138.3 | AL262: 18 | AM262: 47.2 | AN262: 56 | AO262: 4.8000000000000001e-002 | AP262: 73 | AQ262: 孚日转债!
A263: 262 | B263: 128085 | C263: 鸿达转债!! | D263: 2002 | E263: 鸿达兴业 | F263: 化工 | G263: 化工 | H263: 148.901 | I263: -2.3700000000000002e-002 | J263: 2.2200000000000001e-002 | K263: 5.8 | L263: -1.7000000000000001e-003 | M263: 123.8 | N263: 3.91 | O263: 4.0000000000000001e-003 | P263: 148.34 | Q263: 已到 | R263: 3.92年 | S263: 1.92年 | T263: 3.39 | U263: 109 | V263: 0.21199999999999999 | W263: 1.9e-002 | X263: 2.7999999999999997e-002 | Y263: 181 | Z263: 1.74 | AA263: -4.6900000000000004e-002 | AB263: -5.6399999999999999e-002 | AC263: -0.128 | AD263: -0.13 | AE263: 74.51 | AF263: 67.65 | AG263: 0.9 | AH263: B | AI263: 0.1711 | AJ263: =H263+100*O263 -> 149.30100000000002 | AK263: 149.5 | AL263: 92 | AM263: 74.9 | AN263: 246 | AO263: -4.0999999999999995e-002 | AP263: 84 | AQ263: 鸿达转债!!
A264: 263 | B264: 110063 | C264: 鹰19转债 | D264: 600567 | E264: 山鹰国际 | F264: 造纸包装 | G264: 包装用纸 | H264: 121.64 | I264: -2.64e-002 | J264: 1.29e-002 | K264: 3.29 | L264: -2.6600000000000002e-002 | M264: 115.4 | N264: 3.26 | O264: 0.20499999999999999 | P264: 100.92 | Q264: 已到 | R264: 3.91年 | S264: 1.91年 | T264: 18.4 | U264: 7.6 | V264: 3.0000000000000001e-003 | W264: 0.121 | X264: 0.12300000000000001 | Y264: 152 | Z264: 0.94 | AA264: -1.3600000000000001e-002 | AB264: -2.0499999999999997e-002 | AC264: -7.8600000000000003e-002 | AD264: -8.09e-002 | AE264: 95.87 | AF264: 101.46 | AG264: 0.51 | AH264: AA+ | AI264: 3.4099999999999998e-002 | AJ264: =H264+100*O264 -> 142.13999999999999 | AK264: 142.4 | AL264: 34 | AM264: 40.9 | AN264: 23 | AO264: -9.0000000000000011e-003 | AP264: 29 | AQ264: 鹰19转债
A265: 264 | B265: 128083 | C265: 新北转债! | D265: 2376 | E265: 新北洋 | F265: 电子 | G265: 电子产品 | H265: 114.46 | I265: -1.8799999999999997e-002 | J265: 1.8799999999999997e-002 | K265: 9.19 | L265: 0. | M265: 114.3 | N265: 11.45 | O265: 0.42599999999999999 | P265: 80.26 | Q265: 已到 | R265: 3.91年 | S265: 1.91年 | T265: 8.77 | U265: 15 | V265: 1.3999999999999999e-002 | W265: 0.14300000000000002 | X265: 0.115 | Y265: 61 | Z265: 1.81 | AA265: -4.0000000000000002e-004 | AB265: -6.8999999999999999e-003 | AC265: -5.0799999999999998e-002 | AD265: -5.33e-002 | AE265: 95 | AF265: 98.67 | AG265: 0.29 | AH265: AA | AI265: 3.9100000000000003e-002 | AJ265: =H265+100*O265 -> 157.06 | AK265: 148.7 | AL265: 86 | AM265: 50 | AN265: 77 | AO265: 1.1000000000000001e-002 | AP265: 22 | AQ265: 新北转债!
A266: 265 | B266: 128082 | C266: 华锋转债!! | D266: 2806 | E266: 华锋股份 | F266: 电子 | G266: 元器件制 | H266: 159.101 | I266: -2.81e-002 | J266: 2.0099999999999996e-002 | K266: 13.97 | L266: -9.1999999999999998e-003 | M266: 120.6 | N266: 9.13 | O266: 4.0000000000000001e-002 | P266: 153.01 | Q266: 已到 | R266: 3.88年 | S266: 1.88年 | T266: 2.04 | U266: 50 | V266: 0.152 | W266: 7.5999999999999998e-002 | X266: 0.11599999999999999 | Y266: 27 | Z266: 2.35 | AA266: -7.0199999999999999e-002 | AB266: -7.8399999999999997e-002 | AC266: -0.14999999999999999 | AD266: -0.152 | AE266: 88.5 | AF266: 89.73 | AG266: 0.87 | AH266: A | AI266: 8.1099999999999992e-002 | AJ266: =H266+100*O266 -> 163.101 | AK266: 165.2 | AL266: 228 | AM266: 75.5 | AN266: 247 | AO266: -8.1000000000000003e-002 | AP266: 47 | AQ266: 华锋转债!!
A267: 266 | B267: 110062 | C267: 烽火转债! | D267: 600498 | E267: 烽火通信 | F267: 通信互联 | G267: 通信设备 | H267: 116.74 | I267: -3.7000000000000002e-003 | J267: 1.1000000000000001e-003 | K267: 17.84 | L267: -1.e-002 | M267: 110.3 | N267: 22.85 | O267: 0.495 | P267: 78.07 | Q267: 已到 | R267: 3.88年 | S267: 1.88年 | T267: 30.9 | U267: 14 | V267: 4.0000000000000001e-003 | W267: 0.14599999999999999 | X267: 0.114 | Y267: 212 | Z267: 1.84 | AA267: -1.4800000000000001e-002 | AB267: -1.9599999999999999e-002 | AC267: -6.0700000000000004e-002 | AD267: -6.3099999999999989e-002 | AE267: 96.41 | AF267: 97.8 | AG267: 0.26 | AH267: AAA | AI267: 3.2099999999999997e-002 | AJ267: =H267+100*O267 -> 166.24000000000001 | AK267: 155.4 | AL267: 152 | AM267: 57.6 | AN267: 125 | AO267: -4.0000000000000001e-003 | AP267: 18 | AQ267: 烽火转债!
A268: 267 | B268: 128081 | C268: 海亮转债! | D268: 2203 | E268: 海亮股份 | F268: 有色金属 | G268: 铜金属 | H268: 132.249 | I268: -1.3100000000000001e-002 | J268: 6.3e-003 | K268: 12.05 | L268: -9.0000000000000011e-003 | M268: 114.3 | N268: 9.69 | O268: 6.3e-002 | P268: 124.36 | Q268: 已到 | R268: 3.85年 | S268: 1.85年 | T268: 30.1 | U268: 57 | V268: 1.3999999999999999e-002 | W268: 0.127 | X268: 0.158 | Y268: 237 | Z268: 2.37 | AA268: -3.78e-002 | AB268: -4.41e-002 | AC268: -0.11800000000000001 | AD268: -0.12 | AE268: 95.21 | AF268: 98.88 | AG268: 0.75 | AH268: AA | AI268: 3.9100000000000003e-002 | AJ268: =H268+100*O268 -> 138.54900000000001 | AK268: 140.1 | AL268: 23 | AM268: 41.3 | AN268: 26 | AO268: -2.3e-002 | AP268: 44 | AQ268: 海亮转债!
A269: 268 | B269: 113550 | C269: 常汽转债! | D269: 603035 | E269: 常熟汽饰 | F269: 汽车 | G269: 零部件制 | H269: 242.97 | I269: -2.3199999999999998e-002 | J269: 4.7400000000000005e-002 | K269: 20.5 | L269: 2.5000000000000001e-002 | M269: 120.5 | N269: 9.33 | O269: 0.106 | P269: 219.72 | Q269: 已到 | R269: 3.84年 | S269: 1.84年 | T269: 2.14 | U269: 578 | V269: 1.0800000000000001 | W269: 2.8999999999999998e-002 | X269: 6.4000000000000001e-002 | Y269: 74 | Z269: 1.89 | AA269: -0.17000000000000001 | AB269: -0.17699999999999999 | AC269: -0.25600000000000001 | AD269: -0.25700000000000001 | AE269: 92.08 | AF269: 96.79 | AG269: 0.97 | AH269: AA- | AI269: 6.0100000000000001e-002 | AJ269: =H269+100*O269 -> 253.56999999999999 | AK269: 266.2 | AL269: 356 | AM269: 169.4 | AN269: 356 | AO269: 0.14899999999999999 | AP269: 15 | AQ269: 常汽转债!
A270: 269 | B270: 113549 | C270: 白电转债! | D270: 603861 | E270: 白云电器 | F270: 能源电力 | G270: 电力设备 | H270: 137.92 | I270: -1.6200000000000003e-002 | J270: 1.4199999999999999e-002 | K270: 11.91 | L270: -2.5000000000000001e-003 | M270: 114.3 | N270: 9.06 | O270: 4.9000000000000002e-002 | P270: 131.46 | Q270: 已到 | R270: 3.83年 | S270: 1.83年 | T270: 8.05 | U270: 237 | V270: 0.20999999999999999 | W270: 0.155 | X270: 0.20399999999999999 | Y270: 52 | Z270: 2 | AA270: -4.8600000000000004e-002 | AB270: -5.4900000000000004e-002 | AC270: -0.11199999999999999 | AD270: -0.114 | AE270: 95.27 | AF270: 98.95 | AG270: 0.81 | AH270: AA | AI270: 3.9100000000000003e-002 | AJ270: =H270+100*O270 -> 142.81999999999999 | AK270: 144.4 | AL270: 54 | AM270: 45.4 | AN270: 47 | AO270: 1.9e-002 | AP270: 35 | AQ270: 白电转债!
A271: 270 | B271: 123035 | C271: 利德转债!! | D271: 300296 | E271: 利亚德 | F271: 电子 | G271: LED制 | H271: 176.21 | I271: 4.2800000000000005e-002 | J271: 2.0799999999999999e-002 | K271: 10.91 | L271: 7.0699999999999999e-002 | M271: 114.3 | N271: 6.96 | O271: 0.124 | P271: 156.75 | Q271: 已到 | R271: 3.83年 | S271: 1.83年 | T271: 7.99 | U271: 243 | V271: 0.17399999999999999 | W271: 2.8999999999999998e-002 | X271: 4.4999999999999998e-002 | Y271: 277 | Z271: 3.61 | AA271: -0.109 | AB271: -0.114 | AC271: -0.18600000000000003 | AD271: -0.187 | AE271: 96.19 | AF271: 100.77 | AG271: 0.9 | AH271: AA+ | AI271: 3.4099999999999998e-002 | AJ271: =H271+100*O271 -> 188.61000000000001 | AK271: 195.7 | AL271: 321 | AM271: 94.9 | AN271: 302 | AO271: 4.7e-002 | AP271: 13 | AQ271: 利德转债!!
A272: 271 | B272: 110061 | C272: 川投转债! | D272: 600674 | E272: 川投能源 | F272: 能源电力 | G272: 水电 | H272: 145.35 | I272: -2.5000000000000001e-002 | J272: 3.0499999999999999e-002 | K272: 11.58 | L272: 6.9999999999999993e-003 | M272: 110.3 | N272: 9.2 | O272: 0.155 | P272: 125.87 | Q272: 已到 | R272: 3.82年 | S272: 1.82年 | T272: 39.6 | U272: 103 | V272: 1.8000000000000002e-002 | W272: 7.8e-002 | X272: 9.8000000000000004e-002 | Y272: 510 | Z272: 1.66 | AA272: -7.0800000000000002e-002 | AB272: -7.5300000000000006e-002 | AC272: -0.13 | AD272: -0.13200000000000001 | AE272: 96.59 | AF272: 97.98 | AG272: 0.79 | AH272: AAA | AI272: 3.2099999999999997e-002 | AJ272: =H272+100*O272 -> 160.84999999999999 | AK272: 164.8 | AL272: 223 | AM272: 66.8 | AN272: 187 | AO272: -3.4000000000000002e-002 | AP272: 12 | AQ272: 川投转债!
A273: 272 | B273: 123034 | C273: 通光转债! | D273: 300265 | E273: 通光线缆 | F273: 通信互联 | G273: 通信设备 | H273: 204.102 | I273: -1.1599999999999999e-002 | J273: -1.1699999999999999e-002 | K273: 10.36 | L273: -2.9100000000000001e-002 | M273: 117.3 | N273: 7.95 | O273: 0.56600000000000006 | P273: 130.31 | Q273: 已到 | R273: 3.80年 | S273: 1.80年 | T273: 0.78 | U273: 42 | V273: 0.26600000000000001 | W273: 2.1000000000000001e-002 | X273: 2.7000000000000003e-002 | Y273: 38 | Z273: 2.91 | AA273: -0.13800000000000001 | AB273: -0.14400000000000002 | AC273: -0.22600000000000001 | AD273: -0.22699999999999998 | AE273: 89.89 | AF273: 90.79 | AG273: 0.8 | AH273: A+ | AI273: 7.1099999999999997e-002 | AJ273: =H273+100*O273 -> 260.702 | AK273: 277.9 | AL273: 357 | AM273: 187.1 | AN273: 358 | AO273: -5.0000000000000003e-002 | AP273: 16 | AQ273: 通光转债!
A274: 273 | B274: 113548 | C274: 石英转债! | D274: 603688 | E274: 石英股份 | F274: 电子 | G274: 电子产品 | H274: 402.64 | I274: -2.7400000000000001e-002 | J274: 1.46e-002 | K274: 57.01 | L274: -1.3000000000000001e-002 | M274: 123.7 | N274: 14.93 | O274: 5.4000000000000006e-002 | P274: 381.85 | Q274: 已到 | R274: 3.78年 | S274: 1.78年 | T274: 1.2 | U274: 142 | V274: 0.28999999999999998 | W274: 6.0000000000000001e-003 | X274: 2.3e-002 | Y274: 201 | Z274: 9.8 | AA274: -0.27200000000000002 | AB274: -0.27899999999999997 | AC274: -0.34399999999999997 | AD274: -0.34499999999999997 | AE274: 92.57 | AF274: 99.7 | AG274: 0.99 | AH274: AA- | AI274: 6.0100000000000001e-002 | AJ274: =H274+100*O274 -> 408.03999999999996 | AK274: 423.4 | AL274: 373 | AM274: 323.7 | AN274: 373 | AO274: -5.9999999999999998e-002 | AP274: 12 | AQ274: 石英转债!
A275: 274 | B275: 110060 | C275: 天路转债! | D275: 600326 | E275: 西藏天路 | F275: 建筑 | G275: 水泥 | H275: 120.98 | I275: -1.6200000000000003e-002 | J275: 9.7000000000000003e-003 | K275: 6.54 | L275: -1.5100000000000001e-002 | M275: 114.3 | N275: 7.08 | O275: 0.31 | P275: 92.37 | Q275: 已到 | R275: 3.78年 | S275: 1.78年 | T275: 7.06 | U275: 7.9 | V275: 9.0000000000000011e-003 | W275: 0.11800000000000001 | X275: 0.109 | Y275: 60 | Z275: 1.41 | AA275: -1.52e-002 | AB275: -2.18e-002 | AC275: -8.0700000000000008e-002 | AD275: -8.3199999999999996e-002 | AE275: 95.45 | AF275: 99.13 | AG275: 0.43 | AH275: AA | AI275: 3.9100000000000003e-002 | AJ275: =H275+100*O275 -> 151.98000000000002 | AK275: 149.6 | AL275: 95 | AM275: 50.5 | AN275: 79 | AO275: 4.0000000000000001e-003 | AP275: 12 | AQ275: 天路转债!
A276: 275 | B276: 110059 | C276: 浦发转债! | D276: 600000 | E276: 浦发银行 | F276: 金融 | G276: 银行行业 | H276: 106.03 | I276: -2.2000000000000001e-003 | J276: 1.1000000000000001e-003 | K276: 8.59 | L276: -1.49e-002 | M276: 116.8 | N276: 13.97 | O276: 0.72400000000000009 | P276: 61.49 | Q276: 已到 | R276: 3.78年 | S276: 无权 | T276: 500 | U276: 607 | V276: 1.1000000000000001e-002 | W276: 0.19800000000000001 | X276: 0.122 | Y276: 2521. | Z276: 0.46 | AA276: 2.6699999999999998e-002 | AB276: 1.84e-002 | AC276: 无权 | AD276: 无权 | AE276: 无权 | AF276: 103.99 | AG276: 0.07 | AH276: AAA | AI276: 3.2099999999999997e-002 | AJ276: =H276+100*O276 -> 178.43000000000001 | AK276: 150.6 | AL276: 108 | AM276: 46.6 | AN276: 51 | AO276: -2.e-003 | AP276: 53 | AQ276: 浦发转债!
A277: 276 | B277: 127014 | C277: 北方转债! | D277: 65 | E277: 北方国际 | F277: 建筑 | G277: 建筑工程 | H277: 122.22 | I277: -1.2199999999999999e-002 | J277: -2.0999999999999999e-003 | K277: 8.15 | L277: -3.32e-002 | M277: 114.3 | N277: 8.65 | O277: 0.29699999999999999 | P277: 94.22 | Q277: 已到 | R277: 3.77年 | S277: 1.77年 | T277: 5.35 | U277: 14 | V277: 2.2000000000000002e-002 | W277: 8.5000000000000006e-002 | X277: 8.0000000000000002e-002 | Y277: 63 | Z277: 1.05 | AA277: -1.7899999999999999e-002 | AB277: -2.4500000000000001e-002 | AC277: -8.5999999999999993e-002 | AD277: -8.8399999999999992e-002 | AE277: 96.38 | AF277: 100.96 | AG277: 0.43 | AH277: AA+ | AI277: 3.4099999999999998e-002 | AJ277: =H277+100*O277 -> 151.91999999999999 | AK277: 150.2 | AL277: 101 | AM277: 49.3 | AN277: 73 | AO277: -3.9e-002 | AP277: 16 | AQ277: 北方转债!
A278: 277 | B278: 113546 | C278: 迪贝转债! | D278: 603320 | E278: 迪贝电气 | F278: 家电 | G278: 零部件制 | H278: 123.24 | I278: -6.4000000000000003e-003 | J278: -3.2000000000000002e-003 | K278: 13.57 | L278: -1.7399999999999999e-002 | M278: 119.8 | N278: 14 | O278: 0.27100000000000002 | P278: 96.93 | Q278: 已到 | R278: 3.77年 | S278: 1.77年 | T278: 2.3 | U278: 10 | V278: 3.7000000000000005e-002 | W278: 0.13 | X278: 0.126 | Y278: 18 | Z278: 2.43 | AA278: -7.6e-003 | AB278: -1.66e-002 | AC278: -8.8599999999999998e-002 | AD278: -9.1300000000000006e-002 | AE278: 90.4 | AF278: 92.98 | AG278: 0.55 | AH278: A+ | AI278: 7.1099999999999997e-002 | AJ278: =H278+100*O278 -> 150.34 | AK278: 149.6 | AL278: 93 | AM278: 56.6 | AN278: 118 | AO278: 2.5000000000000001e-002 | AP278: 36 | AQ278: 迪贝转债!
A279: 278 | B279: 128079 | C279: 英联转债! | D279: 2846 | E279: 英联股份 | F279: 造纸包装 | G279: 包装材料 | H279: 126.5 | I279: -4.6999999999999993e-003 | J279: 4.6999999999999993e-003 | K279: 8.04 | L279: 1.1299999999999999e-002 | M279: 116.9 | N279: 8.29 | O279: 0.30399999999999999 | P279: 96.98 | Q279: 已到 | R279: 3.76年 | S279: 1.76年 | T279: 1.52 | U279: 17 | V279: 8.6999999999999994e-002 | W279: 5.9000000000000004e-002 | X279: 5.7999999999999996e-002 | Y279: 26 | Z279: 3.17 | AA279: -2.12e-002 | AB279: -2.8799999999999999e-002 | AC279: -0.10099999999999999 | AD279: -0.10400000000000001 | AE279: 90.36 | AF279: 90.76 | AG279: 0 | AH279: A+ | AI279: 7.1099999999999997e-002 | AJ279: =H279+100*O279 -> 156.90000000000001 | AK279: 156 | AL279: 156 | AM279: 65.3 | AN279: 177 | AO279: 3.7999999999999999e-002 | AP279: 16 | AQ279: 英联转债!
A280: 279 | B280: 128078 | C280: 太极转债! | D280: 2368 | E280: 太极股份 | F280: 计算机及 | G280: 软件开发 | H280: 146.5 | I280: -2.e-003 | J280: -1.04e-002 | K280: 25.76 | L280: -1.8700000000000001e-002 | M280: 116.3 | N280: 22.21 | O280: 0.26300000000000001 | P280: 115.98 | Q280: 已到 | R280: 3.76年 | S280: 1.76年 | T280: 9.6 | U280: 9.5 | V280: 6.9999999999999993e-003 | W280: 6.4000000000000001e-002 | X280: 7.4999999999999997e-002 | Y280: 149 | Z280: 4.52 | AA280: -6.0499999999999998e-002 | AB280: -6.7500000000000004e-002 | AC280: -0.13800000000000001 | AD280: -0.14000000000000001 | AE280: 95.52 | AF280: 100.94 | AG280: 0.67 | AH280: AA | AI280: 3.9100000000000003e-002 | AJ280: =H280+100*O280 -> 172.80000000000001 | AK280: 177 | AL280: 282 | AM280: 76.1 | AN280: 253 | AO280: -5.5999999999999994e-002 | AP280: 9 | AQ280: 太极转债!
A281: 280 | B281: 128076 | C281: 金轮转债! | D281: 2722 | E281: 金轮股份 | F281: 机械装备 | G281: 专用设备 | H281: 131.25 | I281: -2.58e-002 | J281: 1.9e-003 | K281: 16.3 | L281: -3.49e-002 | M281: 114.3 | N281: 14.66 | O281: 0.17999999999999999 | P281: 111.19 | Q281: 已到 | R281: 3.74年 | S281: 1.74年 | T281: 2.14 | U281: 32 | V281: 0.114 | W281: 7.4999999999999997e-002 | X281: 8.3000000000000004e-002 | Y281: 29 | Z281: 1.46 | AA281: -3.6900000000000002e-002 | AB281: -4.3400000000000001e-002 | AC281: -0.10000000000000001 | AD281: -0.10199999999999999 | AE281: 92.03 | AF281: 92.25 | AG281: 0.69 | AH281: AA- | AI281: 6.0100000000000001e-002 | AJ281: =H281+100*O281 -> 149.25 | AK281: 151.3 | AL281: 118 | AM281: 59.1 | AN281: 137 | AO281: -2.2000000000000002e-002 | AP281: 37 | AQ281: 金轮转债!
A282: 281 | B282: 113545 | C282: 金能转债! | D282: 603113 | E282: 金能科技 | F282: 煤炭 | G282: 炼焦 | H282: 167.32 | I282: -3.56e-002 | J282: 2.2000000000000001e-003 | K282: 15.25 | L282: -3.85e-002 | M282: 114.3 | N282: 10.43 | O282: 0.14400000000000002 | P282: 146.21 | Q282: 已到 | R282: 3.74年 | S282: 1.74年 | T282: 9.87 | U282: 51 | V282: 3.1e-002 | W282: 7.5999999999999998e-002 | X282: 0.111 | Y282: 130 | Z282: 1.49 | AA282: -9.8299999999999998e-002 | AB282: -0.10400000000000001 | AC282: -0.182 | AD282: -0.183 | AE282: 95.59 | AF282: 99.28 | AG282: 0.87 | AH282: AA | AI282: 3.9100000000000003e-002 | AJ282: =H282+100*O282 -> 181.72 | AK282: 188.4 | AL282: 308 | AM282: 89.1 | AN282: 290 | AO282: -8.5000000000000006e-002 | AP282: 13 | AQ282: 金能转债!
A283: 282 | B283: 128074 | C283: 游族转债!! | D283: 2174 | E283: 游族网络 | F283: 通信互联 | G283: 互联网 | H283: 120.75 | I283: 1.2999999999999999e-003 | J283: 5.9999999999999995e-004 | K283: 13.9 | L283: 5.7999999999999996e-003 | M283: 119.3 | N283: 16.97 | O283: 0.47399999999999998 | P283: 81.91 | Q283: 已到 | R283: 3.69年 | S283: 1.69年 | T283: 6.83 | U283: 21 | V283: 2.5000000000000001e-002 | W283: 5.4000000000000006e-002 | X283: 4.4000000000000004e-002 | Y283: 127 | Z283: 2.43 | AA283: -3.3e-003 | AB283: -1.23e-002 | AC283: -8.3699999999999997e-002 | AD283: -8.6300000000000002e-002 | AE283: 95.8 | AF283: 102.06 | AG283: 0.34 | AH283: AA | AI283: 3.9100000000000003e-002 | AJ283: =H283+100*O283 -> 168.15000000000001 | AK283: 159.6 | AL283: 180 | AM283: 57.5 | AN283: 124 | AO283: -5.7000000000000002e-002 | AP283: 29 | AQ283: 游族转债!!
A284: 283 | B284: 128075 | C284: 远东转债! | D284: 2406 | E284: 远东传动 | F284: 汽车 | G284: 零部件制 | H284: 130.435 | I284: -1.49e-002 | J284: -2.2000000000000001e-003 | K284: 6.07 | L284: -2.5699999999999997e-002 | M284: 114.3 | N284: 5.29 | O284: 0.13699999999999998 | P284: 114.74 | Q284: 已到 | R284: 3.69年 | S284: 1.69年 | T284: 5.44 | U284: 10 | V284: 1.3999999999999999e-002 | W284: 0.14400000000000002 | X284: 0.16500000000000001 | Y284: 38 | Z284: 1.16 | AA284: -3.5799999999999998e-002 | AB284: -4.24e-002 | AC284: -0.10199999999999999 | AD284: -0.10400000000000001 | AE284: 95.8 | AF284: 99.5 | AG284: 0.67 | AH284: AA | AI284: 3.9100000000000003e-002 | AJ284: =H284+100*O284 -> 144.13499999999999 | AK284: 146.1 | AL284: 65 | AM284: 46.6 | AN284: 52 | AO284: -1.8000000000000002e-002 | AP284: 16 | AQ284: 远东转债!
A285: 284 | B285: 123031 | C285: 晶瑞转债! | D285: 300655 | E285: 晶瑞电材 | F285: 电子 | G285: 电子行业 | H285: 411.3 | I285: -1.06e-002 | J285: 7.7000000000000002e-003 | K285: 38.39 | L285: -2.8999999999999998e-003 | M285: 115.3 | N285: 10.13 | O285: 8.5000000000000006e-002 | P285: 378.97 | Q285: 已到 | R285: 3.62年 | S285: 1.62年 | T285: 0.53 | U285: 84 | V285: 0.38299999999999995 | W285: 4.0000000000000001e-003 | X285: 1.4999999999999999e-002 | Y285: 131 | Z285: 9.01 | AA285: -0.29999999999999999 | AB285: -0.30399999999999999 | AC285: -0.38700000000000001 | AD285: -0.38799999999999996 | AE285: 91.03 | AF285: 90.38 | AG285: 0.99 | AH285: A+ | AI285: 7.1099999999999997e-002 | AJ285: =H285+100*O285 -> 419.80000000000001 | AK285: 443.6 | AL285: 376 | AM285: 352.6 | AN285: 376 | AO285: -9.6000000000000002e-002 | AP285: 15 | AQ285: 晶瑞转债!
A286: 285 | B286: 128073 | C286: 哈尔转债! | D286: 2615 | E286: 哈尔斯 | F286: 其他 | G286: 家居用品 | H286: 122.35 | I286: -2.0299999999999999e-002 | J286: 8.1000000000000013e-003 | K286: 5.73 | L286: -2.3900000000000001e-002 | M286: 114.5 | N286: 5.7 | O286: 0.217 | P286: 100.53 | Q286: 已到 | R286: 2.60年 | S286: 0.60年 | T286: 2.99 | U286: 15 | V286: 4.0999999999999995e-002 | W286: 0.126 | X286: 0.127 | Y286: 24 | Z286: 2.75 | AA286: -2.5499999999999998e-002 | AB286: -3.5099999999999999e-002 | AC286: -0.23199999999999998 | AD286: -0.23399999999999999 | AE286: 96.96 | AF286: 99 | AG286: 0.51 | AH286: AA- | AI286: 5.8299999999999998e-002 | AJ286: =H286+100*O286 -> 144.04999999999998 | AK286: 144.2 | AL286: 51 | AM286: 45.2 | AN286: 45 | AO286: 1.8000000000000002e-002 | AP286: 35 | AQ286: 哈尔转债!
A287: 286 | B287: 128072 | C287: 翔鹭转债! | D287: 2842 | E287: 翔鹭钨业 | F287: 有色金属 | G287: 小金属 | H287: 112.333 | I287: -1.55e-002 | J287: 1.3000000000000001e-002 | K287: 9.55 | L287: -1.44e-002 | M287: 114.5 | N287: 15.19 | O287: 0.78700000000000003 | P287: 62.87 | Q287: 已到 | R287: 3.59年 | S287: 1.59年 | T287: 3.02 | U287: 7 | V287: 2.1000000000000001e-002 | W287: 0.114 | X287: 7.2000000000000008e-002 | Y287: 27 | Z287: 2.73 | AA287: 5.4000000000000003e-003 | AB287: -1.8e-003 | AC287: -4.9299999999999997e-002 | AD287: -5.2300000000000006e-002 | AE287: 92.87 | AF287: 93.24 | AG287: 0.17 | AH287: AA- | AI287: 6.0100000000000001e-002 | AJ287: =H287+100*O287 -> 191.03300000000002 | AK287: 161.8 | AL287: 198 | AM287: 68.6 | AN287: 203 | AO287: 6.9999999999999993e-003 | AP287: 28 | AQ287: 翔鹭转债!
A288: 287 | B288: 128071 | C288: 合兴转债! | D288: 2228 | E288: 合兴包装 | F288: 造纸包装 | G288: 包装材料 | H288: 115.703 | I288: -2.6099999999999998e-002 | J288: 1.1399999999999999e-002 | K288: 3.68 | L288: -3.9199999999999999e-002 | M288: 114.3 | N288: 4.18 | O288: 0.314 | P288: 88.04 | Q288: 已到 | R288: 3.58年 | S288: 1.58年 | T288: 3 | U288: 6.9 | V288: 2.e-002 | W288: 6.6000000000000003e-002 | X288: 5.7999999999999996e-002 | Y288: 46 | Z288: 1.35 | AA288: -3.4999999999999996e-003 | AB288: -1.06e-002 | AC288: -6.59e-002 | AD288: -6.8699999999999997e-002 | AE288: 96.18 | AF288: 99.9 | AG288: 0.37 | AH288: AA | AI288: 3.9100000000000003e-002 | AJ288: =H288+100*O288 -> 147.10300000000001 | AK288: 143.4 | AL288: 41 | AM288: 43.5 | AN288: 34 | AO288: 4.0000000000000001e-003 | AP288: 25 | AQ288: 合兴转债!
A289: 288 | B289: 113542 | C289: 好客转债! | D289: 603898 | E289: 好莱客 | F289: 其他 | G289: 家居用品 | H289: 113.4 | I289: -1.6899999999999998e-002 | J289: 1.18e-002 | K289: 12.1 | L289: -2.4199999999999999e-002 | M289: 114.3 | N289: 16.14 | O289: 0.51300000000000001 | P289: 74.97 | Q289: 已到 | R289: 3.54年 | S289: 1.54年 | T289: 6.03 | U289: 14 | V289: 2.e-002 | W289: 0.16 | X289: 0.12 | Y289: 38 | Z289: 1.39 | AA289: 2.3e-003 | AB289: -5.0000000000000001e-003 | AC289: -5.6299999999999996e-002 | AD289: -5.9200000000000003e-002 | AE289: 96.33 | AF289: 100.06 | AG289: 0.21 | AH289: AA | AI289: 3.9100000000000003e-002 | AJ289: =H289+100*O289 -> 164.70000000000002 | AK289: 151.8 | AL289: 123 | AM289: 51.8 | AN289: 87 | AO289: -1.2e-002 | AP289: 17 | AQ289: 好客转债!
A290: 289 | B290: 113541 | C290: 荣晟转债!! | D290: 603165 | E290: 荣晟环保 | F290: 造纸包装 | G290: 包装用纸 | H290: 165.48 | I290: -1.7000000000000001e-003 | J290: 2.4500000000000001e-002 | K290: 17.69 | L290: 2.4900000000000002e-002 | M290: 114.3 | N290: 10.84 | O290: 1.3999999999999999e-002 | P290: 163.19 | Q290: 已到 | R290: 3.52年 | S290: 1.52年 | T290: 1.63 | U290: 55 | V290: 0.20499999999999999 | W290: 3.5000000000000003e-002 | X290: 5.7000000000000002e-002 | Y290: 47 | Z290: 2.69 | AA290: -0.10199999999999999 | AB290: -0.10800000000000001 | AC290: -0.20899999999999999 | AD290: -0.20999999999999999 | AE290: 93.26 | AF290: 93.49 | AG290: 0.91 | AH290: AA- | AI290: 6.0100000000000001e-002 | AJ290: =H290+100*O290 -> 166.88 | AK290: 167.8 | AL290: 241 | AM290: 74.3 | AN290: 242 | AO290: -4.4999999999999998e-002 | AP290: 39 | AQ290: 荣晟转债!!
A291: 290 | B291: 128070 | C291: 智能转债! | D291: 2877 | E291: 智能自控 | F291: 机械装备 | G291: 通用设备 | H291: 115.802 | I291: -1.8000000000000002e-002 | J291: 1.21e-002 | K291: 6.85 | L291: -2.e-002 | M291: 116.8 | N291: 9.47 | O291: 0.60099999999999998 | P291: 72.33 | Q291: 已到 | R291: 3.46年 | S291: 无权 | T291: 2.3 | U291: 14 | V291: 5.0999999999999997e-002 | W291: 0.10099999999999999 | X291: 7.2999999999999995e-002 | Y291: 23 | Z291: 3 | AA291: 2.5000000000000001e-003 | AB291: -6.0000000000000001e-003 | AC291: 无权 | AD291: 无权 | AE291: 无权 | AF291: 92.61 | AG291: 0.29 | AH291: A+ | AI291: 7.1099999999999997e-002 | AJ291: =H291+100*O291 -> 175.90199999999999 | AK291: 159.3 | AL291: 178 | AM291: 66.7 | AN291: 186 | AO291: -6.0000000000000001e-003 | AP291: 27 | AQ291: 智能转债!
A292: 291 | B292: 128069 | C292: 华森转债! | D292: 2907 | E292: 华森制药 | F292: 医药 | G292: 化学制药 | H292: 124.98 | I292: -6.0999999999999995e-003 | J292: 1.38e-002 | K292: 18.59 | L292: 1.3600000000000001e-002 | M292: 119.3 | N292: 18.01 | O292: 0.21100000000000002 | P292: 103.22 | Q292: 已到 | R292: 3.44年 | S292: 1.44年 | T292: 3 | U292: 196 | V292: 0.51700000000000002 | W292: 4.0000000000000001e-002 | X292: 4.0999999999999995e-002 | Y292: 75 | Z292: 6.3 | AA292: -1.37e-002 | AB292: -2.3199999999999998e-002 | AC292: -0.10199999999999999 | AD292: -0.105 | AE292: 93.69 | AF292: 98.01 | AG292: 0.56 | AH292: AA- | AI292: 6.0100000000000001e-002 | AJ292: =H292+100*O292 -> 146.08000000000001 | AK292: 146.7 | AL292: 69 | AM292: 48.7 | AN292: 68 | AO292: 0.182 | AP292: 43 | AQ292: 华森转债!
A293: 292 | B293: 113027 | C293: 华钰转债!! | D293: 601020 | E293: ST华钰 | F293: 有色金属 | G293: 锌铅镍锡 | H293: 132.27 | I293: -1.6299999999999999e-002 | J293: 1.e-002 | K293: 11.93 | L293: -8.3000000000000001e-003 | M293: 114.3 | N293: 10.17 | O293: 0.128 | P293: 117.31 | Q293: 已到 | R293: 3.41年 | S293: 1.41年 | T293: 3.1 | U293: 51 | V293: 0.124 | W293: 4.7e-002 | X293: 5.5e-002 | Y293: 66 | Z293: 2.55 | AA293: -4.2699999999999995e-002 | AB293: -4.9800000000000004e-002 | AC293: -0.13200000000000001 | AD293: -0.13400000000000001 | AE293: 91.01 | AF293: 88.12 | AG293: 0.76 | AH293: A | AI293: 8.1099999999999992e-002 | AJ293: =H293+100*O293 -> 145.07000000000002 | AK293: 147.2 | AL293: 74 | AM293: 56.2 | AN293: 116 | AO293: -7.9000000000000001e-002 | AP293: 41 | AQ293: 华钰转债!!
A294: 293 | B294: 123027 | C294: 蓝晓转债! | D294: 300487 | E294: 蓝晓科技 | F294: 化工 | G294: 化工 | H294: 390.04 | I294: -5.7999999999999996e-003 | J294: 4.4000000000000004e-002 | K294: 105.91 | L294: 3.8800000000000001e-002 | M294: 118.8 | N294: 29.02 | O294: 6.9000000000000006e-002 | P294: 364.96 | Q294: 已到 | R294: 3.40年 | S294: 1.40年 | T294: 1.07 | U294: 833 | V294: 1.97 | W294: 5.0000000000000001e-003 | X294: 1.7000000000000001e-002 | Y294: 233 | Z294: 11.77 | AA294: -0.29999999999999999 | AB294: -0.30499999999999999 | AC294: -0.442 | AD294: -0.44299999999999995 | AE294: 93.24 | AF294: 94.66 | AG294: 0.98 | AH294: A+ | AI294: 7.1099999999999997e-002 | AJ294: =H294+100*O294 -> 396.94 | AK294: 415.1 | AL294: 372 | AM294: 320.5 | AN294: 372 | AO294: 0.14199999999999999 | AP294: 17 | AQ294: 蓝晓转债!
A295: 294 | B295: 113537 | C295: 文灿转债!! | D295: 603348 | E295: 文灿股份 | F295: 汽车 | G295: 零部件制 | H295: 363.25 | I295: 9.2300000000000007e-002 | J295: 6.0000000000000001e-003 | K295: 65.09 | L295: 0.10000000000000001 | M295: 120.7 | N295: 19.28 | O295: 7.5999999999999998e-002 | P295: 337.6 | Q295: 已到 | R295: 3.40年 | S295: 1.40年 | T295: 1.41 | U295: 1870. | V295: 3.6299999999999999 | W295: 8.0000000000000002e-003 | X295: 2.7999999999999997e-002 | Y295: 171 | Z295: 6.5 | AA295: -0.28100000000000003 | AB295: -0.28800000000000003 | AC295: -0.43099999999999999 | AD295: -0.43200000000000005 | AE295: 94.66 | AF295: 99.5 | AG295: 0.98 | AH295: AA- | AI295: 6.0100000000000001e-002 | AJ295: =H295+100*O295 -> 370.85000000000002 | AK295: 388.9 | AL295: 367 | AM295: 289.4 | AN295: 366 | AO295: 0.13400000000000001 | AP295: 22 | AQ295: 文灿转债!!
A296: 295 | B296: 113535 | C296: 大业转债! | D296: 603278 | E296: 大业股份 | F296: 汽车 | G296: 零部件制 | H296: 122.62 | I296: -2.2200000000000001e-002 | J296: 1.41e-002 | K296: 12.13 | L296: -1.8600000000000002e-002 | M296: 112.5 | N296: 12.29 | O296: 0.24199999999999999 | P296: 98.7 | Q296: 已到 | R296: 2.31年 | S296: 0.31年 | T296: 5 | U296: 19 | V296: 3.1e-002 | W296: 0.14199999999999999 | X296: 0.14000000000000001 | Y296: 35 | Z296: 1.97 | AA296: -3.7100000000000001e-002 | AB296: -4.6399999999999997e-002 | AC296: -0.38700000000000001 | AD296: -0.39100000000000001 | AE296: 99.5 | AF296: 103.49 | AG296: 0.44 | AH296: AA | AI296: 3.73e-002 | AJ296: =H296+100*O296 -> 146.81999999999999 | AK296: 146.5 | AL296: 68 | AM296: 43.1 | AN296: 31 | AO296: 4.0000000000000001e-002 | AP296: 45 | AQ296: 大业转债!
A297: 296 | B297: 128066 | C297: 亚泰转债! | D297: 2811 | E297: 郑中设计 | F297: 建筑 | G297: 装饰工程 | H297: 115.51 | I297: -3.4500000000000003e-002 | J297: 2.06e-002 | K297: 8.84 | L297: -2.86e-002 | M297: 116.7 | N297: 9.27 | O297: 0.21100000000000002 | P297: 95.36 | Q297: 已到 | R297: 3.25年 | S297: 1.25年 | T297: 4.8 | U297: 17 | V297: 3.1e-002 | W297: 0.20100000000000001 | X297: 0.192 | Y297: 24 | Z297: 1.72 | AA297: 3.2000000000000002e-003 | AB297: -5.8999999999999999e-003 | AC297: -7.8299999999999995e-002 | AD297: -8.199999999999999e-002 | AE297: 94.94 | AF297: 96.97 | AG297: 0.49 | AH297: AA- | AI297: 6.0100000000000001e-002 | AJ297: =H297+100*O297 -> 136.61000000000001 | AK297: 135.7 | AL297: 14 | AM297: 38.7 | AN297: 18 | AO297: -3.4000000000000002e-002 | AP297: 66 | AQ297: 亚泰转债!
A298: 297 | B298: 110058 | C298: 永鼎转债! | D298: 600105 | E298: 永鼎股份 | F298: 通信互联 | G298: 通信设备 | H298: 126.7 | I298: -4.6999999999999993e-003 | J298: -6.3e-003 | K298: 5.05 | L298: -1.9400000000000001e-002 | M298: 114.3 | N298: 5.04 | O298: 0.26400000000000001 | P298: 100.2 | Q298: 已到 | R298: 3.25年 | S298: 1.25年 | T298: 2.61 | U298: 21 | V298: 6.5000000000000002e-002 | W298: 3.7000000000000005e-002 | X298: 3.7000000000000005e-002 | Y298: 71 | Z298: 2.49 | AA298: -3.1800000000000002e-002 | AB298: -3.9399999999999998e-002 | AC298: -0.127 | AD298: -0.13 | AE298: 94.73 | AF298: 94.96 | AG298: 0.57 | AH298: AA- | AI298: 6.0100000000000001e-002 | AJ298: =H298+100*O298 -> 153.09999999999999 | AK298: 153.2 | AL298: 138 | AM298: 58.2 | AN298: 132 | AO298: -7.5999999999999998e-002 | AP298: 45 | AQ298: 永鼎转债!
A299: 298 | B299: 127013 | C299: 创维转债! | D299: 810 | E299: 创维数字 | F299: 电子 | G299: 电子产品 | H299: 135.75 | I299: -1.5600000000000001e-002 | J299: 4.6100000000000002e-002 | K299: 13.5 | L299: 4.41e-002 | M299: 117.3 | N299: 11.29 | O299: 0.13500000000000001 | P299: 119.57 | Q299: 已到 | R299: 3.25年 | S299: 1.25年 | T299: 9.78 | U299: 600 | V299: 0.44700000000000001 | W299: 6.8000000000000005e-002 | X299: 8.1000000000000003e-002 | Y299: 144 | Z299: 3.39 | AA299: -4.4900000000000002e-002 | AB299: -5.3600000000000002e-002 | AC299: -0.16500000000000001 | AD299: -0.16699999999999998 | AE299: 97.43 | AF299: 103.85 | AG299: 0.69 | AH299: AA | AI299: 3.9100000000000003e-002 | AJ299: =H299+100*O299 -> 149.25 | AK299: 151.9 | AL299: 124 | AM299: 48.1 | AN299: 60 | AO299: 0.26899999999999996 | AP299: 24 | AQ299: 创维转债!
A300: 299 | B300: 113026 | C300: 核能转债!! | D300: 601985 | E300: 中国核电 | F300: 能源电力 | G300: 核电 | H300: 129.7 | I300: 5.0000000000000001e-003 | J300: 1.0200000000000001e-002 | K300: 7.37 | L300: 1.8000000000000002e-002 | M300: 109.3 | N300: 5.73 | O300: 8.0000000000000002e-003 | P300: 128.62 | Q300: 已到 | R300: 3.25年 | S300: 1.25年 | T300: 75.1 | U300: 437 | V300: 4.4999999999999998e-002 | W300: 5.7999999999999996e-002 | X300: 7.4999999999999997e-002 | Y300: 1291. | Z300: 2 | AA300: -5.2400000000000002e-002 | AB300: -5.7300000000000004e-002 | AC300: -0.14000000000000001 | AD300: -0.14300000000000002 | AE300: 98.36 | AF300: 98.88 | AG300: 0.84 | AH300: AAA | AI300: 3.2099999999999997e-002 | AJ300: =H300+100*O300 -> 130.5 | AK300: 130.8 | AL300: 4 | AM300: 31.9 | AN300: 5 | AO300: -5.5999999999999994e-002 | AP300: 38 | AQ300: 核能转债!!
A301: 300 | B301: 113025 | C301: 明泰转债!! | D301: 601677 | E301: 明泰铝业 | F301: 有色金属 | G301: 铝金属 | H301: 407.18 | I301: -2.4399999999999998e-002 | J301: 1.7000000000000001e-002 | K301: 41.19 | L301: -7.4999999999999997e-003 | M301: 114.5 | N301: 11 | O301: 8.6999999999999994e-002 | P301: 374.45 | Q301: 已到 | R301: 3.23年 | S301: 1.23年 | T301: 11 | U301: 124 | V301: 2.7000000000000003e-002 | W301: 3.9e-002 | X301: 0.14599999999999999 | Y301: 281 | Z301: 2.79 | AA301: -0.32899999999999996 | AB301: -0.33299999999999996 | AC301: -0.51400000000000001 | AD301: -0.51500000000000001 | AE301: 97.52 | AF301: 101.43 | AG301: 0.99 | AH301: AA | AI301: 3.9100000000000003e-002 | AJ301: =H301+100*O301 -> 415.88 | AK301: 439.9 | AL301: 375 | AM301: 338.5 | AN301: 375 | AO301: -1.1000000000000001e-002 | AP301: 18 | AQ301: 明泰转债!!
A302: 301 | B302: 113534 | C302: 鼎胜转债!! | D302: 603876 | E302: 鼎胜新材 | F302: 有色金属 | G302: 小金属 | H302: 248.53 | I302: 8.9999999999999998e-004 | J302: 1.6899999999999998e-002 | K302: 35.88 | L302: 1.8200000000000001e-002 | M302: 114.3 | N302: 15.18 | O302: 5.0999999999999997e-002 | P302: 236.36 | Q302: 已到 | R302: 3.23年 | S302: 1.23年 | T302: 4.04 | U302: 101 | V302: 0.10099999999999999 | W302: 2.3e-002 | X302: 5.5e-002 | Y302: 174 | Z302: 3.73 | AA302: -0.217 | AB302: -0.223 | AC302: -0.40399999999999997 | AD302: -0.40600000000000003 | AE302: 94.84 | AF302: 95.07 | AG302: 0.98 | AH302: AA- | AI302: 6.0100000000000001e-002 | AJ302: =H302+100*O302 -> 253.63 | AK302: 260.7 | AL302: 355 | AM302: 165.6 | AN302: 355 | AO302: -5.2000000000000005e-002 | AP302: 27 | AQ302: 鼎胜转债!!
A303: 302 | B303: 113024 | C303: 核建转债! | D303: 601611 | E303: 中国核建 | F303: 建筑 | G303: 建筑工程 | H303: 124.34 | I303: -2.0799999999999999e-002 | J303: 1.0800000000000001e-002 | K303: 8.92 | L303: -2.41e-002 | M303: 109.3 | N303: 9.7 | O303: 0.35200000000000004 | P303: 91.96 | Q303: 已到 | R303: 3.23年 | S303: 1.23年 | T303: 30 | U303: 28 | V303: 6.9999999999999993e-003 | W303: 0.127 | X303: 0.11699999999999999 | Y303: 236 | Z303: 1.9 | AA303: -4.0000000000000001e-002 | AB303: -4.4999999999999998e-002 | AC303: -0.11900000000000001 | AD303: -0.122 | AE303: 98.42 | AF303: 98.94 | AG303: 0.42 | AH303: AAA | AI303: 3.2099999999999997e-002 | AJ303: =H303+100*O303 -> 159.54000000000002 | AK303: 156.7 | AL303: 161 | AM303: 57.8 | AN303: 128 | AO303: -0.109 | AP303: 30 | AQ303: 核建转债!
A304: 303 | B304: 128063 | C304: 未来转债! | D304: 2631 | E304: 德尔未来 | F304: 其他 | G304: 家居用品 | H304: 119.259 | I304: -1.9699999999999999e-002 | J304: 1.47e-002 | K304: 7.19 | L304: -1.9099999999999999e-002 | M304: 127.5 | N304: 8.64 | O304: 0.433 | P304: 83.22 | Q304: 已到 | R304: 3.21年 | S304: 2.21年 | T304: 6.29 | U304: 12 | V304: 1.6e-002 | W304: 0.13300000000000001 | X304: 0.111 | Y304: 47 | Z304: 2.77 | AA304: 2.1700000000000001e-002 | AB304: 7.3000000000000001e-003 | AC304: -4.1100000000000005e-002 | AD304: -4.7199999999999999e-002 | AE304: 94.5 | AF304: 106.37 | AG304: 0.26 | AH304: AA- | AI304: 6.0100000000000001e-002 | AJ304: =H304+100*O304 -> 162.559 | AK304: 155.3 | AL304: 150 | AM304: 48.9 | AN304: 69 | AO304: -1.4999999999999999e-002 | AP304: 34 | AQ304: 未来转债!
A305: 304 | B305: 113532 | C305: 海环转债! | D305: 603817 | E305: 海峡环保 | F305: 城市公用 | G305: 三废处理 | H305: 112.28 | I305: -1.9599999999999999e-002 | J305: 1.1399999999999999e-002 | K305: 6.28 | L305: -2.7900000000000001e-002 | M305: 112.3 | N305: 7.63 | O305: 0.36399999999999999 | P305: 82.31 | Q305: 已到 | R305: 3.21年 | S305: 1.21年 | T305: 4.59 | U305: 13 | V305: 2.4e-002 | W305: 0.16200000000000001 | X305: 0.13400000000000001 | Y305: 28 | Z305: 1.56 | AA305: 1.e-004 | AB305: -6.8999999999999999e-003 | AC305: -6.2699999999999992e-002 | AD305: -6.6299999999999998e-002 | AE305: 97.57 | AF305: 99.57 | AG305: 0.29 | AH305: AA | AI305: 3.9100000000000003e-002 | AJ305: =H305+100*O305 -> 148.68000000000001 | AK305: 142.3 | AL305: 32 | AM305: 42.7 | AN305: 29 | AO305: 4.0000000000000001e-003 | AP305: 34 | AQ305: 海环转债!
A306: 305 | B306: 128062 | C306: 亚药转债! | D306: 2370 | E306: 亚太药业 | F306: 医药 | G306: 化学制药 | H306: 103.75 | I306: -3.4999999999999996e-003 | J306: 3.7000000000000002e-003 | K306: 9.3 | L306: 0.10099999999999999 | M306: 119.3 | N306: 16.25 | O306: 0.81299999999999994 | P306: 57.23 | Q306: 已到 | R306: 3.21年 | S306: 1.21年 | T306: 9.62 | U306: 567 | V306: 0.56399999999999995 | W306: 0.193 | X306: 0.11 | Y306: 50 | Z306: 13.8 | AA306: 4.5499999999999999e-002 | AB306: 3.44e-002 | AC306: -6.7000000000000002e-003 | AD306: -1.0700000000000001e-002 | AE306: 82.91 | AF306: 72.74 | AG306: 0 | AH306: B | AI306: 0.1711 | AJ306: =H306+100*O306 -> 185.05000000000001 | AK306: 150.3 | AL306: 102 | AM306: 67.4 | AN306: 194 | AO306: 0.84400000000000008 | AP306: 92 | AQ306: 亚药转债!
A307: 306 | B307: 110057 | C307: 现代转债 | D307: 600420 | E307: 国药现代 | F307: 医药 | G307: 化学制药 | H307: 123.9 | I307: 1.9e-003 | J307: 8.8999999999999999e-003 | K307: 10.53 | L307: 1.7399999999999999e-002 | M307: 110.3 | N307: 9.79 | O307: 0.152 | P307: 107.56 | Q307: 已到 | R307: 3.21年 | S307: 1.21年 | T307: 16.2 | U307: 46 | V307: 2.3e-002 | W307: 0.14899999999999999 | X307: 0.161 | Y307: 108 | Z307: 1.29 | AA307: -3.6400000000000002e-002 | AB307: -4.2000000000000003e-002 | AC307: -0.11900000000000001 | AD307: -0.122 | AE307: 98.48 | AF307: 99.9 | AG307: 0.62 | AH307: AAA | AI307: 3.2099999999999997e-002 | AJ307: =H307+100*O307 -> 139.09999999999999 | AK307: 140.2 | AL307: 24 | AM307: 40.3 | AN307: 22 | AO307: 5.0999999999999997e-002 | AP307: 23 | AQ307: 现代转债
A308: 307 | B308: 123025 | C308: 精测转债!! | D308: 300567 | E308: 精测电子 | F308: 电子 | G308: 液晶显示 | H308: 150.8 | I308: 0. | J308: 4.8999999999999998e-003 | K308: 60.95 | L308: 6.6e-003 | M308: 116.5 | N308: 49.37 | O308: 0.221 | P308: 123.46 | Q308: 已到 | R308: 3.20年 | S308: 1.20年 | T308: 3.09 | U308: 28 | V308: 5.9999999999999998e-002 | W308: 1.8000000000000002e-002 | X308: 2.2000000000000002e-002 | Y308: 170 | Z308: 5.25 | AA308: -7.9000000000000001e-002 | AB308: -8.7100000000000011e-002 | AC308: -0.22500000000000001 | AD308: -0.22699999999999998 | AE308: 95.03 | AF308: 97.07 | AG308: 0.75 | AH308: AA- | AI308: 6.0100000000000001e-002 | AJ308: =H308+100*O308 -> 172.90000000000001 | AK308: 178.1 | AL308: 287 | AM308: 81.1 | AN308: 271 | AO308: -9.3000000000000013e-002 | AP308: 14 | AQ308: 精测转债!!
A309: 308 | B309: 113530 | C309: 大丰转债! | D309: 603081 | E309: 大丰实业 | F309: 建筑 | G309: 装饰工程 | H309: 118.73 | I309: -3.0800000000000001e-002 | J309: 2.9399999999999999e-002 | K309: 13.32 | L309: -6.7000000000000002e-003 | M309: 121 | N309: 16.3 | O309: 0.45299999999999996 | P309: 81.72 | Q309: 已到 | R309: 3.19年 | S309: 1.19年 | T309: 6.3 | U309: 35 | V309: 4.5999999999999999e-002 | W309: 0.11599999999999999 | X309: 9.4e-002 | Y309: 54 | Z309: 2.29 | AA309: 6.0999999999999995e-003 | AB309: -5.1999999999999998e-003 | AC309: -0.10099999999999999 | AD309: -0.10400000000000001 | AE309: 97.74 | AF309: 107.35 | AG309: 0.2 | AH309: AA | AI309: 3.9100000000000003e-002 | AJ309: =H309+100*O309 -> 164.03 | AK309: 155.7 | AL309: 154 | AM309: 48.4 | AN309: 63 | AO309: -1.e-002 | AP309: 29 | AQ309: 大丰转债!
A310: 309 | B310: 127012 | C310: 招路转债! | D310: 1965 | E310: 招商公路 | F310: 机场高速 | G310: 高速 | H310: 117.199 | I310: -8.8999999999999999e-003 | J310: 8.8999999999999999e-003 | K310: 7.91 | L310: 0. | M310: 107.9 | N310: 8.63 | O310: 0.27899999999999997 | P310: 91.66 | Q310: 已到 | R310: 3.18年 | S310: 1.18年 | T310: 50 | U310: 25 | V310: 4.0000000000000001e-003 | W310: 0.10199999999999999 | X310: 9.4e-002 | Y310: 489 | Z310: 0.95 | AA310: -2.6000000000000002e-002 | AB310: -3.0499999999999999e-002 | AC310: -0.10099999999999999 | AD310: -0.10300000000000001 | AE310: 97.44 | AF310: 97.73 | AG310: 0.41 | AH310: AAA | AI310: 3.2099999999999997e-002 | AJ310: =H310+100*O310 -> 145.09899999999999 | AK310: 142.7 | AL310: 36 | AM310: 45 | AN310: 43 | AO310: 2.6000000000000002e-002 | AP310: 25 | AQ310: 招路转债!
A311: 310 | B311: 123024 | C311: 岱勒转债! | D311: 300700 | E311: 岱勒新材 | F311: 机械装备 | G311: 专用设备 | H311: 127.952 | I311: -1.1899999999999999e-002 | J311: 1.8e-003 | K311: 15.29 | L311: -1.61e-002 | M311: 112.5 | N311: 14.1 | O311: 0.17999999999999999 | P311: 108.44 | Q311: 已到 | R311: 2.18年 | S311: 0.18年 | T311: 2.1 | U311: 24 | V311: 8.8000000000000009e-002 | W311: 0.128 | X311: 0.13900000000000001 | Y311: 16 | Z311: 3.46 | AA311: -5.8200000000000002e-002 | AB311: -6.7799999999999999e-002 | AC311: -0.65200000000000002 | AD311: -0.65799999999999992 | AE311: 98.96 | AF311: 97.44 | AG311: 0.63 | AH311: A+ | AI311: 6.93e-002 | AJ311: =H311+100*O311 -> 145.952 | AK311: 147.5 | AL311: 76 | AM311: 48.5 | AN311: 64 | AO311: 6.6000000000000003e-002 | AP311: 35 | AQ311: 岱勒转债!
A312: 311 | B312: 123023 | C312: 迪森转债! | D312: 300335 | E312: 迪森股份 | F312: 能源电力 | G312: 电力供应 | H312: 116.1 | I312: -1.0200000000000001e-002 | J312: -1.6000000000000001e-003 | K312: 5.71 | L312: -3.2199999999999999e-002 | M312: 114.3 | N312: 6.89 | O312: 0.40100000000000002 | P312: 82.87 | Q312: 已到 | R312: 3.17年 | S312: 2.17年 | T312: 5.29 | U312: 15 | V312: 2.5000000000000001e-002 | W312: 0.249 | X312: 0.20600000000000002 | Y312: 21 | Z312: 1.57 | AA312: -5.0000000000000001e-003 | AB312: -1.3000000000000001e-002 | AC312: -4.41e-002 | AD312: -4.7599999999999996e-002 | AE312: 91.49 | AF312: 95.37 | AG312: 0.37 | AH312: AA- | AI312: 6.0100000000000001e-002 | AJ312: =H312+100*O312 -> 156.19999999999999 | AK312: 149.3 | AL312: 90 | AM312: 54 | AN312: 101 | AO312: -5.2000000000000005e-002 | AP312: 51 | AQ312: 迪森转债!
A313: 312 | B313: 110056 | C313: 亨通转债! | D313: 600487 | E313: 亨通光电 | F313: 通信互联 | G313: 通信设备 | H313: 135.32 | I313: 3.9000000000000003e-003 | J313: -3.3e-003 | K313: 14.82 | L313: 1.4000000000000002e-003 | M313: 114.3 | N313: 14.95 | O313: 0.36499999999999999 | P313: 99.13 | Q313: 已到 | R313: 3.17年 | S313: 1.17年 | T313: 17.1 | U313: 17 | V313: 6.9999999999999993e-003 | W313: 4.9000000000000002e-002 | X313: 4.8000000000000001e-002 | Y313: 350 | Z313: 1.7 | AA313: -5.2900000000000003e-002 | AB313: -6.0400000000000002e-002 | AC313: -0.17399999999999999 | AD313: -0.17600000000000002 | AE313: 98.34 | AF313: 103.01 | AG313: 0.47 | AH313: AA+ | AI313: 3.4099999999999998e-002 | AJ313: =H313+100*O313 -> 171.81999999999999 | AK313: 171.5 | AL313: 257 | AM313: 68.5 | AN313: 202 | AO313: -6.9999999999999993e-003 | AP313: 23 | AQ313: 亨通转债!
A314: 313 | B314: 123022 | C314: 长信转债!! | D314: 300088 | E314: 长信科技 | F314: 通信互联 | G314: 通信设备 | H314: 227.674 | I314: 7.5300000000000006e-002 | J314: -1.5300000000000001e-002 | K314: 11.85 | L314: 6.1799999999999994e-002 | M314: 114.3 | N314: 6.05 | O314: 0.16200000000000001 | P314: 195.87 | Q314: 已到 | R314: 3.17年 | S314: 1.17年 | T314: 2.56 | U314: 1204. | V314: 2.0899999999999999 | W314: 9.0000000000000011e-003 | X314: 1.7000000000000001e-002 | Y314: 291 | Z314: 3.86 | AA314: -0.19899999999999998 | AB314: -0.20399999999999999 | AC314: -0.39799999999999996 | AD314: -0.39899999999999997 | AE314: 97.72 | AF314: 101.5 | AG314: 0.97 | AH314: AA | AI314: 3.9100000000000003e-002 | AJ314: =H314+100*O314 -> 243.874 | AK314: 259.5 | AL314: 353 | AM314: 158 | AN314: 354 | AO314: -5.7000000000000002e-002 | AP314: 11 | AQ314: 长信转债!!
A315: 314 | B315: 110055 | C315: 伊力转债!! | D315: 600197 | E315: 伊力特 | F315: 食品饮料 | G315: 白酒 | H315: 190.09 | I315: -1.37e-002 | J315: 1.5e-003 | K315: 24.68 | L315: -1.3600000000000001e-002 | M315: 114.3 | N315: 16.41 | O315: 0.26400000000000001 | P315: 150.4 | Q315: 已到 | R315: 3年58天 | S315: 1年58天 | T315: 2.44 | U315: 78 | V315: 0.16699999999999998 | W315: 2.1000000000000001e-002 | X315: 3.1e-002 | Y315: 116 | Z315: 3.23 | AA315: -0.151 | AB315: -0.158 | AC315: -0.33600000000000002 | AD315: -0.33700000000000002 | AE315: 97.75 | AF315: 101.53 | AG315: 0.9 | AH315: AA | AI315: 3.9100000000000003e-002 | AJ315: =H315+100*O315 -> 216.49000000000001 | AK315: 229.8 | AL315: 342 | AM315: 128.3 | AN315: 336 | AO315: -9.8000000000000004e-002 | AP315: 20 | AQ315: 伊力转债!!
A316: 315 | B316: 110053 | C316: 苏银转债! | D316: 600919 | E316: 江苏银行 | F316: 金融 | G316: 银行行业 | H316: 122.36 | I316: -2.0899999999999998e-002 | J316: 2.8000000000000004e-003 | K316: 6.47 | L316: -3.8599999999999995e-002 | M316: 118.3 | N316: 6.37 | O316: 0.20499999999999999 | P316: 101.57 | Q316: 已到 | R316: 3年57天 | S316: 无权 | T316: 200 | U316: 418 | V316: 1.7000000000000001e-002 | W316: 0.20899999999999999 | X316: 0.21299999999999999 | Y316: 956 | Z316: 0.65 | AA316: -1.1000000000000001e-002 | AB316: -2.1000000000000001e-002 | AC316: 无权 | AD316: 无权 | AE316: 无权 | AF316: 107.44 | AG316: 0.47 | AH316: AAA | AI316: 3.2099999999999997e-002 | AJ316: =H316+100*O316 -> 142.86000000000001 | AK316: 143.2 | AL316: 40 | AM316: 35.7 | AN316: 13 | AO316: 7.6999999999999999e-002 | AP316: 32 | AQ316: 苏银转债!
A317: 316 | B317: 127011 | C317: 中鼎转2!! | D317: 887 | E317: 中鼎股份 | F317: 汽车 | G317: 零部件制 | H317: 229.747 | I317: 2.5699999999999997e-002 | J317: 6.0400000000000002e-002 | K317: 24.4 | L317: 8.8300000000000003e-002 | M317: 114.5 | N317: 11.39 | O317: 7.2000000000000008e-002 | P317: 214.22 | Q317: 已到 | R317: 3年51天 | S317: 1年51天 | T317: 12 | U317: 740 | V317: 0.26700000000000002 | W317: 4.0999999999999995e-002 | X317: 8.6999999999999994e-002 | Y317: 296 | Z317: 3.24 | AA317: -0.20199999999999999 | AB317: -0.20800000000000002 | AC317: -0.41100000000000003 | AD317: -0.41200000000000003 | AE317: 98.47 | AF317: 103.3 | AG317: 0.97 | AH317: AA+ | AI317: 3.4099999999999998e-002 | AJ317: =H317+100*O317 -> 236.947 | AK317: 245.3 | AL317: 349 | AM317: 142 | AN317: 347 | AO317: 0.13900000000000001 | AP317: 17 | AQ317: 中鼎转2!!
A318: 317 | B318: 110052 | C318: 贵广转债! | D318: 600996 | E318: 贵广网络 | F318: 传媒娱乐 | G318: 影视娱乐 | H318: 114.04 | I318: -1.4499999999999999e-002 | J318: 9.8999999999999991e-003 | K318: 6.01 | L318: -3.3799999999999997e-002 | M318: 117.7 | N318: 7.94 | O318: 0.50700000000000001 | P318: 75.69 | Q318: 已到 | R318: 3年48天 | S318: 1年48天 | T318: 15.3 | U318: 100 | V318: 5.7000000000000002e-002 | W318: 0.24199999999999999 | X318: 0.183 | Y318: 63 | Z318: 1.65 | AA318: 1.04e-002 | AB318: 2.9999999999999997e-004 | AC318: -7.5899999999999995e-002 | AD318: -7.9899999999999999e-002 | AE318: 98.69 | AF318: 106.22 | AG318: 0.14 | AH318: AA+ | AI318: 3.4099999999999998e-002 | AJ318: =H318+100*O318 -> 164.74000000000001 | AK318: 152.4 | AL318: 131 | AM318: 46.2 | AN318: 49 | AO318: 8.4000000000000005e-002 | AP318: 29 | AQ318: 贵广转债!
A319: 318 | B319: 113021 | C319: 中信转债! | D319: 601998 | E319: 中信银行 | F319: 金融 | G319: 银行行业 | H319: 110.05 | I319: -3.5999999999999999e-003 | J319: 1.9e-003 | K319: 4.65 | L319: -1.9e-002 | M319: 118 | N319: 6.73 | O319: 0.59299999999999997 | P319: 69.09 | Q319: 已到 | R319: 3年47天 | S319: 无权 | T319: 400 | U319: 98 | V319: 2.e-003 | W319: 0.17600000000000002 | X319: 0.121 | Y319: 2275. | Z319: 0.46 | AA319: 2.3300000000000001e-002 | AB319: 1.2800000000000001e-002 | AC319: 无权 | AD319: 无权 | AE319: 无权 | AF319: 107.25 | AG319: 0.09 | AH319: AAA | AI319: 3.2099999999999997e-002 | AJ319: =H319+100*O319 -> 169.34999999999999 | AK319: 151 | AL319: 113 | AM319: 43.8 | AN319: 36 | AO319: 5.0000000000000001e-003 | AP319: 37 | AQ319: 中信转债!
A320: 319 | B320: 128056 | C320: 今飞转债! | D320: 2863 | E320: 今飞凯达 | F320: 汽车 | G320: 零部件制 | H320: 121.35 | I320: -1.78e-002 | J320: 1.43e-002 | K320: 6.03 | L320: -8.199999999999999e-003 | M320: 120.2 | N320: 6.69 | O320: 0.34600000000000003 | P320: 90.13 | Q320: 已到 | R320: 3年43天 | S320: 1年43天 | T320: 1.72 | U320: 9.2 | V320: 4.4000000000000004e-002 | W320: 5.7000000000000002e-002 | X320: 5.2000000000000005e-002 | Y320: 30 | Z320: 1.59 | AA320: -3.0999999999999999e-003 | AB320: -1.4199999999999999e-002 | AC320: -0.11199999999999999 | AD320: -0.11599999999999999 | AE320: 94.74 | AF320: 97.56 | AG320: 0.43 | AH320: A+ | AI320: 7.1099999999999997e-002 | AJ320: =H320+100*O320 -> 155.94999999999999 | AK320: 152.6 | AL320: 132 | AM320: 55 | AN320: 110 | AO320: 1.8000000000000002e-002 | AP320: 46 | AQ320: 今飞转债!
A321: 320 | B321: 128053 | C321: 尚荣转债! | D321: 2551 | E321: 尚荣医疗 | F321: 医药 | G321: 医疗器械 | H321: 148 | I321: 2.2499999999999999e-002 | J321: 2.1099999999999997e-002 | K321: 5.98 | L321: 4.36e-002 | M321: 114.3 | N321: 4.88 | O321: 0.20800000000000002 | P321: 122.54 | Q321: 已到 | R321: 3年29天 | S321: 1年29天 | T321: 1.9 | U321: 840 | V321: 2.96 | W321: 3.7999999999999999e-002 | X321: 4.5999999999999999e-002 | Y321: 51 | Z321: 1.6 | AA321: -8.199999999999999e-002 | AB321: -8.929999999999999e-002 | AC321: -0.23999999999999999 | AD321: -0.24199999999999999 | AE321: 98.05 | AF321: 101.83 | AG321: 1 | AH321: AA | AI321: 3.9100000000000003e-002 | AJ321: =H321+100*O321 -> 168.80000000000001 | AK321: 173.5 | AL321: 264 | AM321: 71.6 | AN321: 225 | AO321: 8.5000000000000006e-002 | AP321: 21 | AQ321: 尚荣转债!
A322: 321 | B322: 113527 | C322: 维格转债!! | D322: 603518 | E322: 锦泓集团 | F322: 服装纺织 | G322: 服装行业 | H322: 139.75 | I322: -2.8500000000000001e-002 | J322: -3.7000000000000002e-003 | K322: 11.66 | L322: -4.9699999999999994e-002 | M322: 119.5 | N322: 9.85 | O322: 0.18100000000000002 | P322: 118.38 | Q322: 已到 | R322: 3年8天 | S322: 1年8天 | T322: 2.86 | U322: 79 | V322: 0.19399999999999998 | W322: 8.3000000000000004e-002 | X322: 9.8000000000000004e-002 | Y322: 35 | Z322: 1.42 | AA322: -5.1500000000000004e-002 | AB322: -6.1799999999999994e-002 | AC322: -0.21899999999999997 | AD322: -0.222 | AE322: 97.2 | AF322: 103.71 | AG322: 0.65 | AH322: AA | AI322: 4.9100000000000005e-002 | AJ322: =H322+100*O322 -> 157.84999999999999 | AK322: 161.1 | AL322: 196 | AM322: 57.4 | AN322: 123 | AO322: -5.5e-002 | AP322: 65 | AQ322: 维格转债!!
A323: 322 | B323: 113526 | C323: 联泰转债! | D323: 603797 | E323: 联泰环保 | F323: 城市公用 | G323: 三废处理 | H323: 230.18 | I323: -1.0700000000000001e-002 | J323: -5.7999999999999996e-003 | K323: 6.72 | L323: -2.4700000000000003e-002 | M323: 110.3 | N323: 5.92 | O323: 1.03 | P323: 113.51 | Q323: 已到 | R323: 3年7天 | S323: 1年7天 | T323: 1.93 | U323: 9.3 | V323: 2.1000000000000001e-002 | W323: 4.9000000000000002e-002 | X323: 5.5999999999999994e-002 | Y323: 39 | Z323: 1.55 | AA323: -0.22 | AB323: -0.22399999999999998 | AC323: -0.45899999999999996 | AD323: -0.46100000000000002 | AE323: 98.83 | AF323: 99.91 | AG323: 0.67 | AH323: AA+ | AI323: 3.4099999999999998e-002 | AJ323: =H323+100*O323 -> 333.18000000000001 | AK323: 346.8 | AL323: 364 | AM323: 246.9 | AN323: 364 | AO323: -3.3000000000000002e-002 | AP323: 7 | AQ323: 联泰转债!
A324: 323 | B324: 123018 | C324: 溢利转债! | D324: 300381 | E324: 溢多利 | F324: 医药 | G324: 原料药 | H324: 186.7 | I324: 1.1000000000000001e-003 | J324: 2.2700000000000001e-002 | K324: 11.51 | L324: 2.7699999999999999e-002 | M324: 113.3 | N324: 8.25 | O324: 0.33799999999999997 | P324: 139.52 | Q324: 已到 | R324: 2.93年 | S324: 0.93年 | T324: 0.54 | U324: 45 | V324: 0.44400000000000001 | W324: 1.e-002 | X324: 1.3000000000000001e-002 | Y324: 56 | Z324: 1.9 | AA324: -0.159 | AB324: -0.16500000000000001 | AC324: -0.41200000000000003 | AD324: -0.41299999999999998 | AE324: 95.69 | AF324: 96.22 | AG324: 0.86 | AH324: AA- | AI324: 5.8299999999999998e-002 | AJ324: =H324+100*O324 -> 220.5 | AK324: 233.9 | AL324: 345 | AM324: 137.7 | AN324: 344 | AO324: -1.e-003 | AP324: 9 | AQ324: 溢利转债!
A325: 324 | B325: 113525 | C325: 台华转债!! | D325: 603055 | E325: 台华新材 | F325: 服装纺织 | G325: 纺织行业 | H325: 228.27 | I325: 1.09e-002 | J325: 2.9399999999999999e-002 | K325: 16.47 | L325: 4.1100000000000005e-002 | M325: 113.3 | N325: 7.78 | O325: 7.8e-002 | P325: 211.7 | Q325: 已到 | R325: 2.92年 | S325: 0.92年 | T325: 1.82 | U325: 71 | V325: 0.17100000000000001 | W325: 1.3000000000000001e-002 | X325: 2.7000000000000003e-002 | Y325: 143 | Z325: 4 | AA325: -0.21600000000000003 | AB325: -0.222 | AC325: -0.50600000000000001 | AD325: -0.50700000000000001 | AE325: 97.84 | AF325: 101.97 | AG325: 0.98 | AH325: AA | AI325: 3.73e-002 | AJ325: =H325+100*O325 -> 236.07000000000002 | AK325: 244.8 | AL325: 348 | AM325: 142.9 | AN325: 349 | AO325: 3.2000000000000001e-002 | AP325: 17 | AQ325: 台华转债!!
A326: 325 | B326: 113524 | C326: 奇精转债! | D326: 603677 | E326: 奇精机械 | F326: 家电 | G326: 零部件制 | H326: 120.21 | I326: -1.9099999999999999e-002 | J326: 8.8000000000000005e-003 | K326: 12.58 | L326: -2.63e-002 | M326: 116.3 | N326: 13.98 | O326: 0.33600000000000002 | P326: 89.99 | Q326: 已到 | R326: 2.91年 | S326: 0.91年 | T326: 3.3 | U326: 6.5 | V326: 1.6e-002 | W326: 0.13600000000000001 | X326: 0.12300000000000001 | Y326: 24 | Z326: 2.38 | AA326: -1.15e-002 | AB326: -2.1099999999999997e-002 | AC326: -0.14099999999999999 | AD326: -0.14400000000000002 | AE326: 95.78 | AF326: 98.86 | AG326: 0.39 | AH326: AA- | AI326: 5.8299999999999998e-002 | AJ326: =H326+100*O326 -> 153.81 | AK326: 150.4 | AL326: 105 | AM326: 51.6 | AN326: 85 | AO326: -1.1000000000000001e-002 | AP326: 39 | AQ326: 奇精转债!
A327: 326 | B327: 128050 | C327: 钧达转债!!* | D327: 2865 | E327: 钧达股份 | F327: 汽车 | G327: 零部件制 | H327: 399.854 | I327: -2.9500000000000002e-002 | J327: 3.4000000000000002e-003 | K327: 59.09 | L327: -2.6000000000000002e-002 | M327: 121.5 | N327: 14.81 | O327: 2.e-003 | P327: 398.99 | Q327: 已到 | R327: 12天 | S327: 无权 | T327: 0.5 | U327: 335 | V327: 1.6499999999999999 | W327: 6.0000000000000001e-003 | X327: 2.4e-002 | Y327: 81 | Z327: 7.75 | AA327: <-100% | AB327: <-100% | AC327: 无权 | AD327: 无权 | AE327: 无权 | AF327: 100.03 | AG327: 1 | AH327: AA- | AI327: 5.4299999999999994e-002 | AJ327: =H327+100*O327 -> 400.05399999999997 | AK327: 400.7 | AL327: 369 | AM327: 300.7 | AN327: 368 | AO327: -7.9000000000000001e-002 | AP327: 43 | AQ327: 钧达转债!!*
A328: 327 | B328: 110048 | C328: 福能转债!! | D328: 600483 | E328: 福能股份 | F328: 能源电力 | G328: 电力供应 | H328: 212.41 | I328: -1.0500000000000001e-002 | J328: 1.6200000000000003e-002 | K328: 13.41 | L328: 6.0000000000000001e-003 | M328: 112.3 | N328: 7.85 | O328: 0.24299999999999999 | P328: 170.83 | Q328: 已到 | R328: 2.89年 | S328: 0.89年 | T328: 12.8 | U328: 161 | V328: 5.9000000000000004e-002 | W328: 4.9000000000000002e-002 | X328: 8.3000000000000004e-002 | Y328: 262 | Z328: 3.3 | AA328: -0.20000000000000001 | AB328: -0.20600000000000002 | AC328: -0.48899999999999999 | AD328: -0.49099999999999999 | AE328: 98.44 | AF328: 102.58 | AG328: 0.96 | AH328: AA+ | AI328: 3.2300000000000002e-002 | AJ328: =H328+100*O328 -> 236.71000000000001 | AK328: 254 | AL328: 351 | AM328: 151.4 | AN328: 351 | AO328: -0.14800000000000002 | AP328: 9 | AQ328: 福能转债!!
A329: 328 | B329: 128049 | C329: 华源转债! | D329: 2787 | E329: 华源控股 | F329: 造纸包装 | G329: 包装材料 | H329: 114.75 | I329: -2.4199999999999999e-002 | J329: 1.52e-002 | K329: 6.25 | L329: -2.5000000000000001e-002 | M329: 113.5 | N329: 7.37 | O329: 0.35299999999999998 | P329: 84.8 | Q329: 已到 | R329: 2.86年 | S329: 0.86年 | T329: 3.63 | U329: 23 | V329: 5.5e-002 | W329: 0.184 | X329: 0.156 | Y329: 20 | Z329: 1.29 | AA329: -3.9000000000000003e-003 | AB329: -1.23e-002 | AC329: -0.109 | AD329: -0.11199999999999999 | AE329: 96.07 | AF329: 96.75 | AG329: 0.36 | AH329: AA- | AI329: 5.8299999999999998e-002 | AJ329: =H329+100*O329 -> 150.05000000000001 | AK329: 144.7 | AL329: 57 | AM329: 48 | AN329: 59 | AO329: 8.0000000000000002e-003 | AP329: 43 | AQ329: 华源转债!
A330: 329 | B330: 110047 | C330: 山鹰转债 | D330: 600567 | E330: 山鹰国际 | F330: 造纸包装 | G330: 包装用纸 | H330: 120.65 | I330: -1.9599999999999999e-002 | J330: 8.6e-003 | K330: 3.29 | L330: -2.6600000000000002e-002 | M330: 116.5 | N330: 3.3 | O330: 0.20999999999999999 | P330: 99.7 | Q330: 已到 | R330: 2.85年 | S330: 0.85年 | T330: 22.5 | U330: 24 | V330: 9.0000000000000011e-003 | W330: 0.14800000000000002 | X330: 0.14699999999999999 | Y330: 152 | Z330: 0.94 | AA330: -1.24e-002 | AB330: -2.2400000000000003e-002 | AC330: -0.154 | AD330: -0.157 | AE330: 98.61 | AF330: 106.56 | AG330: 0.41 | AH330: AA+ | AI330: 3.2300000000000002e-002 | AJ330: =H330+100*O330 -> 141.65000000000001 | AK330: 141.6 | AL330: 29 | AM330: 35 | AN330: 11 | AO330: -9.0000000000000011e-003 | AP330: 27 | AQ330: 山鹰转债
A331: 330 | B331: 128048 | C331: 张行转债 | D331: 2839 | E331: 张家港行 | F331: 金融 | G331: 银行行业 | H331: 125.25 | I331: -2.e-002 | J331: 6.9999999999999993e-003 | K331: 6.1 | L331: -2.2400000000000003e-002 | M331: 112.3 | N331: 5.6 | O331: 0.14999999999999999 | P331: 108.93 | Q331: 已到 | R331: 2.82年 | S331: 无权 | T331: 25 | U331: 75 | V331: 2.4e-002 | W331: 0.22600000000000001 | X331: 0.247 | Y331: 110 | Z331: 0.95 | AA331: -3.85e-002 | AB331: -4.5999999999999999e-002 | AC331: 无权 | AD331: 无权 | AE331: 无权 | AF331: 102.8 | AG331: 0.58 | AH331: AA+ | AI331: 3.2300000000000002e-002 | AJ331: =H331+100*O331 -> 140.25 | AK331: 141.6 | AL331: 28 | AM331: 38.8 | AN331: 19 | AO331: 4.2999999999999997e-002 | AP331: 11 | AQ331: 张行转债
A332: 331 | B332: 113519 | C332: 长久转债! | D332: 603569 | E332: 长久物流 | F332: 交通运输 | G332: 物流业 | H332: 112.06 | I332: -5.6999999999999993e-003 | J332: 3.7000000000000002e-003 | K332: 7.39 | L332: -2.8900000000000002e-002 | M332: 118.3 | N332: 11.04 | O332: 0.67400000000000004 | P332: 66.94 | Q332: 已到 | R332: 2.81年 | S332: 0.81年 | T332: 6.97 | U332: 19 | V332: 2.4e-002 | W332: 0.16800000000000001 | X332: 0.113 | Y332: 41 | Z332: 1.95 | AA332: 1.9799999999999998e-002 | AB332: 8.199999999999999e-003 | AC332: -9.3900000000000011e-002 | AD332: -9.7100000000000006e-002 | AE332: 98.23 | AF332: 106.9 | AG332: 0.07 | AH332: AA | AI332: 3.73e-002 | AJ332: =H332+100*O332 -> 179.46000000000001 | AK332: 157.2 | AL332: 164 | AM332: 50.3 | AN332: 78 | AO332: -3.0000000000000001e-003 | AP332: 28 | AQ332: 长久转债!
A333: 332 | B333: 128046 | C333: 利尔转债!! | D333: 2258 | E333: 利尔化学 | F333: 化工 | G333: 农化 | H333: 171 | I333: -7.4999999999999997e-003 | J333: 1.2500000000000001e-002 | K333: 30.9 | L333: 5.1999999999999998e-003 | M333: 111.3 | N333: 18.42 | O333: 1.9e-002 | P333: 167.75 | Q333: 已到 | R333: 2.75年 | S333: 0.75年 | T333: 8.08 | U333: 174 | V333: 0.124 | W333: 5.0000000000000003e-002 | X333: 8.3000000000000004e-002 | Y333: 163 | Z333: 3.76 | AA333: -0.14599999999999999 | AB333: -0.152 | AC333: -0.44500000000000001 | AD333: -0.44700000000000001 | AE333: 98.44 | AF333: 100.79 | AG333: 0.96 | AH333: AA | AI333: 3.73e-002 | AJ333: =H333+100*O333 -> 172.90000000000001 | AK333: 174.2 | AL333: 268 | AM333: 73.5 | AN333: 233 | AO333: -6.4000000000000001e-002 | AP333: 9 | AQ333: 利尔转债!!
A334: 333 | B334: 128044 | C334: 岭南转债! | D334: 2717 | E334: 岭南股份 | F334: 城市公用 | G334: 生态环境 | H334: 122.588 | I334: -2.1600000000000001e-002 | J334: -7.3000000000000001e-003 | K334: 3.53 | L334: -4.8499999999999995e-002 | M334: 110.3 | N334: 3.43 | O334: 0.191 | P334: 102.92 | Q334: 已到 | R334: 2.58年 | S334: 0.58年 | T334: 6.59 | U334: 47 | V334: 5.7000000000000002e-002 | W334: 0.111 | X334: 0.114 | Y334: 59 | Z334: 1.26 | AA334: -4.0800000000000003e-002 | AB334: -4.7800000000000002e-002 | AC334: -0.23499999999999999 | AD334: -0.23899999999999999 | AE334: 97.61 | AF334: 95.56 | AG334: 0.59 | AH334: AA- | AI334: 5.8299999999999998e-002 | AJ334: =H334+100*O334 -> 141.68799999999999 | AK334: 142.3 | AL334: 33 | AM334: 44.6 | AN334: 41 | AO334: -1.8000000000000002e-002 | AP334: 54 | AQ334: 岭南转债!
A335: 334 | B335: 123015 | C335: 蓝盾转债!! | D335: 300297 | E335: 蓝盾股份 | F335: 计算机及 | G335: 软件开发 | H335: 213.012 | I335: -2.3199999999999998e-002 | J335: 2.3199999999999998e-002 | K335: 3.38 | L335: -1.7399999999999999e-002 | M335: 111.3 | N335: 5.79 | O335: 2.6499999999999999 | P335: 58.38 | Q335: 已到 | R335: 2.57年 | S335: 0.57年 | T335: 1 | U335: 108 | V335: 0.49700000000000005 | W335: 2.4e-002 | X335: 1.3999999999999999e-002 | Y335: 42 | Z335: 2.38 | AA335: -0.22600000000000001 | AB335: -0.23100000000000001 | AC335: -0.72499999999999998 | AD335: -0.72699999999999998 | AE335: 93.67 | AF335: 83.72 | AG335: 0 | AH335: BBB- | AI335: 0.1193 | AJ335: =H335+100*O335 -> 478.012 | AK335: 367.6 | AL335: 365 | AM335: 274 | AN335: 365 | AO335: -4.8000000000000001e-002 | AP335: 14 | AQ335: 蓝盾转债!!
A336: 335 | B336: 113516 | C336: 苏农转债! | D336: 603323 | E336: 苏农银行 | F336: 金融 | G336: 银行行业 | H336: 119.1 | I336: -3.0499999999999999e-002 | J336: 1.5300000000000001e-002 | K336: 5.33 | L336: -3.44e-002 | M336: 113.3 | N336: 5.37 | O336: 0.20000000000000001 | P336: 99.26 | Q336: 已到 | R336: 2.54年 | S336: 无权 | T336: 12.9 | U336: 92 | V336: 5.9999999999999998e-002 | W336: 0.13400000000000001 | X336: 0.13300000000000001 | Y336: 96 | Z336: 0.75 | AA336: -1.9799999999999998e-002 | AB336: -2.8900000000000002e-002 | AC336: 无权 | AD336: 无权 | AE336: 无权 | AF336: 104.64 | AG336: 0.44 | AH336: AA+ | AI336: 3.2300000000000002e-002 | AJ336: =H336+100*O336 -> 139.09999999999999 | AK336: 138.9 | AL336: 19 | AM336: 34.3 | AN336: 9 | AO336: 7.0000000000000007e-002 | AP336: 23 | AQ336: 苏农转债!
A337: 336 | B337: 123014 | C337: 凯发转债! | D337: 300407 | E337: 凯发电气 | F337: 能源电力 | G337: 电力设备 | H337: 136.912 | I337: -1.0500000000000001e-002 | J337: -3.3e-003 | K337: 9.03 | L337: -1.95e-002 | M337: 107.5 | N337: 8.05 | O337: 0.221 | P337: 112.17 | Q337: 已到 | R337: 1.53年 | S337: 回售内 | T337: 1.16 | U337: 7.4 | V337: 4.7e-002 | W337: 4.2000000000000003e-002 | X337: 4.7e-002 | Y337: 28 | Z337: 1.99 | AA337: -0.14800000000000002 | AB337: -0.155 | AC337: 回售内 | AD337: 回售内 | AE337: 100.25 | AF337: 97.13 | AG337: 0.7 | AH337: A+ | AI337: 6.93e-002 | AJ337: =H337+100*O337 -> 159.012 | AK337: 161.7 | AL337: 197 | AM337: 61.4 | AN337: 153 | AO337: 2.6000000000000002e-002 | AP337: 16 | AQ337: 凯发转债!
A338: 337 | B338: 128042 | C338: 凯中转债! | D338: 2823 | E338: 凯中精密 | F338: 能源电力 | G338: 电力设备 | H338: 118.125 | I338: -1.8000000000000002e-002 | J338: 1.55e-002 | K338: 11.18 | L338: -9.7000000000000003e-003 | M338: 115.3 | N338: 12.86 | O338: 0.35899999999999999 | P338: 86.94 | Q338: 已到 | R338: 2.54年 | S338: 0.54年 | T338: 4.16 | U338: 11 | V338: 2.2000000000000002e-002 | W338: 0.129 | X338: 0.113 | Y338: 32 | Z338: 2.44 | AA338: -9.7000000000000003e-003 | AB338: -2.0199999999999999e-002 | AC338: -0.20399999999999999 | AD338: -0.20899999999999999 | AE338: 99.22 | AF338: 105.24 | AG338: 0.26 | AH338: AA | AI338: 3.73e-002 | AJ338: =H338+100*O338 -> 154.02500000000001 | AK338: 149.3 | AL338: 89 | AM338: 44.1 | AN338: 39 | AO338: 2.e-002 | AP338: 25 | AQ338: 凯中转债!
A339: 338 | B339: 123013 | C339: 横河转债! | D339: 300539 | E339: 横河精密 | F339: 机械装备 | G339: 专用设备 | H339: 282.948 | I339: -2.58e-002 | J339: 1.7399999999999999e-002 | K339: 8.28 | L339: -1.9e-002 | M339: 114 | N339: 9.04 | O339: 2.0899999999999999 | P339: 91.59 | Q339: 已到 | R339: 2.52年 | S339: 0.52年 | T339: 0.38 | U339: 28 | V339: 0.25600000000000001 | W339: 2.1000000000000001e-002 | X339: 1.9e-002 | Y339: 18 | Z339: 3.73 | AA339: -0.30599999999999999 | AB339: -0.312 | AC339: -0.95400000000000007 | AD339: -0.95599999999999996 | AE339: 97.56 | AF339: 96.6 | AG339: 0.44 | AH339: A+ | AI339: 6.93e-002 | AJ339: =H339+100*O339 -> 491.94799999999998 | AK339: 474.3 | AL339: 377 | AM339: 376.7 | AN339: 377 | AO339: 1.8000000000000002e-002 | AP339: 11 | AQ339: 横河转债!
A340: 339 | B340: 123012 | C340: 万顺转债! | D340: 300057 | E340: 万顺新材 | F340: 有色金属 | G340: 铝金属 | H340: 170.917 | I340: 1.1299999999999999e-002 | J340: 1.3300000000000001e-002 | K340: 8.67 | L340: 2.6000000000000002e-002 | M340: 109.3 | N340: 5.27 | O340: 3.9e-002 | P340: 164.52 | Q340: 已到 | R340: 2.51年 | S340: 0.51年 | T340: 1.23 | U340: 66 | V340: 0.316 | W340: 2.1000000000000001e-002 | X340: 3.4000000000000002e-002 | Y340: 59 | Z340: 1.64 | AA340: -0.16600000000000001 | AB340: -0.17100000000000001 | AC340: -0.621 | AD340: -0.624 | AE340: 97.99 | AF340: 95.06 | AG340: 0.95 | AH340: AA- | AI340: 5.8299999999999998e-002 | AJ340: =H340+100*O340 -> 174.81700000000001 | AK340: 177.3 | AL340: 284 | AM340: 79.3 | AN340: 264 | AO340: -7.2000000000000008e-002 | AP340: 23 | AQ340: 万顺转债!
A341: 340 | B341: 123011 | C341: 德尔转债! | D341: 300473 | E341: 德尔股份 | F341: 汽车 | G341: 零部件制 | H341: 123.861 | I341: -1.1000000000000001e-003 | J341: -3.3e-003 | K341: 23.78 | L341: -2.3e-002 | M341: 115.3 | N341: 31.38 | O341: 0.63400000000000001 | P341: 75.78 | Q341: 已到 | R341: 2.50年 | S341: 0.50年 | T341: 2.51 | U341: 16 | V341: 5.0000000000000003e-002 | W341: 7.8e-002 | X341: 5.9000000000000004e-002 | Y341: 32 | Z341: 1.51 | AA341: -2.87e-002 | AB341: -3.9100000000000003e-002 | AC341: -0.27699999999999997 | AD341: -0.28100000000000003 | AE341: 98.02 | AF341: 100.3 | AG341: 0.19 | AH341: AA- | AI341: 5.8299999999999998e-002 | AJ341: =H341+100*O341 -> 187.261 | AK341: 171.9 | AL341: 260 | AM341: 71.6 | AN341: 226 | AO341: 3.0000000000000001e-003 | AP341: 37 | AQ341: 德尔转债!
A342: 341 | B342: 128041 | C342: 盛路转债!! | D342: 2446 | E342: 盛路通信 | F342: 通信互联 | G342: 通信设备 | H342: 250.2 | I342: -1.9400000000000001e-002 | J342: 2.0499999999999997e-002 | K342: 5.95 | L342: 3.4000000000000002e-003 | M342: 113.3 | N342: 6.82 | O342: 1.8700000000000001 | P342: 87.24 | Q342: 已到 | R342: 2.50年 | S342: 0.50年 | T342: 0.53 | U342: 71 | V342: 0.52800000000000002 | W342: 1.e-002 | X342: 9.0000000000000011e-003 | Y342: 54 | Z342: 1.77 | AA342: -0.27500000000000002 | AB342: -0.28100000000000003 | AC342: -0.92099999999999993 | AD342: -0.92299999999999993 | AE342: 99.35 | AF342: 103.37 | AG342: 0.33 | AH342: AA | AI342: 3.73e-002 | AJ342: =H342+100*O342 -> 437.19999999999999 | AK342: 413.2 | AL342: 371 | AM342: 309.8 | AN342: 371 | AO342: 4.0000000000000001e-003 | AP342: 10 | AQ342: 盛路转债!!
A343: 342 | B343: 110045 | C343: 海澜转债! | D343: 600398 | E343: 海澜之家 | F343: 服装纺织 | G343: 服装行业 | H343: 117.4 | I343: -1.5300000000000001e-002 | J343: 9.3999999999999986e-003 | K343: 6.46 | L343: -1.67e-002 | M343: 110.3 | N343: 7.04 | O343: 0.27899999999999997 | P343: 91.76 | Q343: 已到 | R343: 2.49年 | S343: 0.49年 | T343: 29.5 | U343: 25 | V343: 6.9999999999999993e-003 | W343: 0.106 | X343: 9.6999999999999989e-002 | Y343: 279 | Z343: 1.98 | AA343: -2.5000000000000001e-002 | AB343: -3.2400000000000005e-002 | AC343: -0.21899999999999997 | AD343: -0.222 | AE343: 99.13 | AF343: 102.01 | AG343: 0.35 | AH343: AA+ | AI343: 3.2300000000000002e-002 | AJ343: =H343+100*O343 -> 145.30000000000001 | AK343: 143 | AL343: 38 | AM343: 41 | AN343: 25 | AO343: -2.e-003 | AP343: 42 | AQ343: 海澜转债!
A344: 343 | B344: 123010 | C344: 博世转债! | D344: 300422 | E344: 博世科 | F344: 城市公用 | G344: 三废处理 | H344: 112.2 | I344: -1.7600000000000001e-002 | J344: 1.26e-002 | K344: 8.82 | L344: -2.e-002 | M344: 111.3 | N344: 11.26 | O344: 0.43200000000000005 | P344: 78.33 | Q344: 已到 | R344: 2.47年 | S344: 0.47年 | T344: 4.3 | U344: 11 | V344: 2.2000000000000002e-002 | W344: 9.6000000000000002e-002 | X344: 7.5999999999999998e-002 | Y344: 45 | Z344: 1.38 | AA344: -3.3e-003 | AB344: -1.1699999999999999e-002 | AC344: -0.154 | AD344: -0.159 | AE344: 98.22 | AF344: 97.03 | AG344: 0.25 | AH344: AA- | AI344: 5.8299999999999998e-002 | AJ344: =H344+100*O344 -> 155.40000000000001 | AK344: 146.1 | AL344: 64 | AM344: 47.8 | AN344: 58 | AO344: -1.3000000000000001e-002 | AP344: 34 | AQ344: 博世转债!
A345: 344 | B345: 127007 | C345: 湖广转债! | D345: 665 | E345: 湖北广电 | F345: 传媒娱乐 | G345: 影视娱乐 | H345: 173.049 | I345: -4.8999999999999998e-003 | J345: -3.2199999999999999e-002 | K345: 9.71 | L345: -3.8599999999999995e-002 | M345: 111.3 | N345: 5.58 | O345: -6.0000000000000001e-003 | P345: 174.01 | Q345: 已到 | R345: 2.45年 | S345: 0.45年 | T345: 5.26 | U345: 11842. | V345: 12.33 | W345: 5.2999999999999999e-002 | X345: 9.3000000000000013e-002 | Y345: 98 | Z345: 1.68 | AA345: -0.16699999999999998 | AB345: -0.17399999999999999 | AC345: -0.69799999999999995 | AD345: -0.70099999999999996 | AE345: 99.84 | AF345: 103.11 | AG345: 0.96 | AH345: AA+ | AI345: 3.2300000000000002e-002 | AJ345: =H345+100*O345 -> 172.44900000000001 | AK345: 172.1 | AL345: 261 | AM345: 69 | AN345: 207 | AO345: 0.34799999999999998 | AP345: 32 | AQ345: 湖广转债!
A346: 345 | B346: 110044 | C346: 广电转债!! | D346: 600831 | E346: 广电网络 | F346: 传媒娱乐 | G346: 影视娱乐 | H346: 200.95 | I346: -1.8500000000000003e-002 | J346: 1.1200000000000002e-002 | K346: 6.05 | L346: -2.4199999999999999e-002 | M346: 111.3 | N346: 6.87 | O346: 1.28 | P346: 88.06 | Q346: 已到 | R346: 2.45年 | S346: 0.45年 | T346: 0.71 | U346: 33 | V346: 0.22800000000000001 | W346: 1.6e-002 | X346: 1.4999999999999999e-002 | Y346: 43 | Z346: 1.14 | AA346: -0.217 | AB346: -0.22399999999999998 | AC346: -0.83999999999999997 | AD346: -0.84299999999999997 | AE346: 99.55 | AF346: 101.93 | AG346: 0.3 | AH346: AA | AI346: 3.73e-002 | AJ346: =H346+100*O346 -> 328.94999999999999 | AK346: 313.8 | AL346: 362 | AM346: 211.9 | AN346: 362 | AO346: 2.e-003 | AP346: 9 | AQ346: 广电转债!!
A347: 346 | B347: 128040 | C347: 华通转债! | D347: 2758 | E347: 浙农股份 | F347: 医药 | G347: 医药商业 | H347: 131.058 | I347: -6.8999999999999999e-003 | J347: 1.1599999999999999e-002 | K347: 11.89 | L347: 6.8000000000000005e-003 | M347: 111.3 | N347: 10.15 | O347: 0.11900000000000001 | P347: 117.14 | Q347: 已到 | R347: 2.41年 | S347: 0.41年 | T347: 2.22 | U347: 16 | V347: 5.2999999999999999e-002 | W347: 3.7999999999999999e-002 | X347: 4.4999999999999998e-002 | Y347: 58 | Z347: 1.77 | AA347: -6.6699999999999995e-002 | AB347: -7.4499999999999997e-002 | AC347: -0.40600000000000003 | AD347: -0.41100000000000003 | AE347: 99.68 | AF347: 102.06 | AG347: 0.69 | AH347: AA | AI347: 3.73e-002 | AJ347: =H347+100*O347 -> 142.958 | AK347: 145 | AL347: 59 | AM347: 42.9 | AN347: 30 | AO347: 3.6000000000000004e-002 | AP347: 31 | AQ347: 华通转债!
A348: 347 | B348: 128039 | C348: 三力转债! | D348: 2224 | E348: 三 力 士 | F348: 机械装备 | G348: 专用设备 | H348: 125.98 | I348: -6.54e-002 | J348: 4.7899999999999998e-002 | K348: 5.74 | L348: -3.2000000000000001e-002 | M348: 108.8 | N348: 5.79 | O348: 0.27100000000000002 | P348: 99.14 | Q348: 已到 | R348: 2.39年 | S348: 0.39年 | T348: 2.02 | U348: 475 | V348: 1.8200000000000001 | W348: 4.8000000000000001e-002 | X348: 4.8000000000000001e-002 | Y348: 42 | Z348: 1.75 | AA348: -6.0299999999999999e-002 | AB348: -6.6600000000000006e-002 | AC348: -0.36399999999999999 | AD348: -0.36899999999999999 | AE348: 98.39 | AF348: 95.21 | AG348: 0.55 | AH348: AA- | AI348: 5.8299999999999998e-002 | AJ348: =H348+100*O348 -> 153.08000000000001 | AK348: 152.8 | AL348: 136 | AM348: 54.4 | AN348: 106 | AO348: 8.5000000000000006e-002 | AP348: 30 | AQ348: 三力转债!
A349: 348 | B349: 128036 | C349: 金农转债!! | D349: 2548 | E349: 金新农 | F349: 农业 | G349: 畜牧业 | H349: 135.521 | I349: -3.2000000000000001e-002 | J349: 5.6999999999999993e-003 | K349: 6.61 | L349: -5.16e-002 | M349: 109.3 | N349: 6.93 | O349: 0.42100000000000004 | P349: 95.38 | Q349: 已到 | R349: 2年52天 | S349: 52天 | T349: 1.46 | U349: 213 | V349: 1.0600000000000001 | W349: 3.2000000000000001e-002 | X349: 2.9999999999999999e-002 | Y349: 46 | Z349: 1.96 | AA349: -9.7200000000000009e-002 | AB349: -0.10400000000000001 | AC349: -0.86299999999999999 | AD349: -0.871 | AE349: 100.04 | AF349: 97.05 | AG349: 0.51 | AH349: AA- | AI349: 5.8299999999999998e-002 | AJ349: =H349+100*O349 -> 177.62099999999998 | AK349: 175.7 | AL349: 276 | AM349: 75.6 | AN349: 250 | AO349: 8.8000000000000009e-002 | AP349: 16 | AQ349: 金农转债!!
A350: 349 | B350: 128037 | C350: 岩土转债! | D350: 2542 | E350: 中化岩土 | F350: 建筑 | G350: 建筑工程 | H350: 115.7 | I350: -2.1899999999999999e-002 | J350: 1.18e-002 | K350: 2.95 | L350: -2.64e-002 | M350: 111.3 | N350: 3.1 | O350: 0.21600000000000003 | P350: 95.16 | Q350: 已到 | R350: 2年58天 | S350: 58天 | T350: 5.99 | U350: 28 | V350: 4.0999999999999995e-002 | W350: 0.113 | X350: 0.107 | Y350: 53 | Z350: 1.34 | AA350: -1.8100000000000002e-002 | AB350: -2.75e-002 | AC350: -0.39700000000000002 | AD350: -0.40700000000000003 | AE350: 100.6 | AF350: 103 | AG350: 0.38 | AH350: AA | AI350: 3.73e-002 | AJ350: =H350+100*O350 -> 137.30000000000001 | AK350: 136.2 | AL350: 15 | AM350: 33.2 | AN350: 6 | AO350: -4.0000000000000001e-003 | AP350: 54 | AQ350: 岩土转债!
A351: 350 | B351: 127006 | C351: 敖东转债! | D351: 623 | E351: 吉林敖东 | F351: 金融 | G351: 证券行业 | H351: 119 | I351: -1.3300000000000001e-002 | J351: 9.7000000000000003e-003 | K351: 17.62 | L351: -1.29e-002 | M351: 107.4 | N351: 20.22 | O351: 0.36599999999999999 | P351: 87.14 | Q351: 已到 | R351: 2年56天 | S351: 56天 | T351: 24.1 | U351: 13 | V351: 5.0000000000000001e-003 | W351: 0.11699999999999999 | X351: 0.10199999999999999 | Y351: 205 | Z351: 0.85 | AA351: -4.7100000000000003e-002 | AB351: -5.3200000000000004e-002 | AC351: -0.505 | AD351: -0.51000000000000001 | AE351: 100.04 | AF351: 100.39 | AG351: 0.28 | AH351: AA+ | AI351: 3.2300000000000002e-002 | AJ351: =H351+100*O351 -> 155.59999999999999 | AK351: 150.9 | AL351: 111 | AM351: 50.5 | AN351: 80 | AO351: -2.3e-002 | AP351: 25 | AQ351: 敖东转债!
A352: 351 | B352: 127005 | C352: 长证转债! | D352: 783 | E352: 长江证券 | F352: 金融 | G352: 证券行业 | H352: 127.3 | I352: -5.4000000000000003e-003 | J352: -1.2699999999999999e-002 | K352: 7.27 | L352: -3.4500000000000003e-002 | M352: 108.3 | N352: 7.13 | O352: 0.248 | P352: 101.96 | Q352: 已到 | R352: 2年55天 | S352: 无权 | T352: 50 | U352: 89 | V352: 1.3999999999999999e-002 | W352: 0.124 | X352: 0.127 | Y352: 402 | Z352: 1.36 | AA352: -7.3700000000000002e-002 | AB352: -8.0199999999999994e-002 | AC352: 无权 | AD352: 无权 | AE352: 无权 | AF352: 101.7 | AG352: 0.52 | AH352: AAA | AI352: 3.0299999999999997e-002 | AJ352: =H352+100*O352 -> 152.09999999999999 | AK352: 152.6 | AL352: 134 | AM352: 50.9 | AN352: 83 | AO352: -3.1e-002 | AP352: 11 | AQ352: 长证转债!
A353: 352 | B353: 113505 | C353: 杭电转债! | D353: 603618 | E353: 杭电股份 | F353: 能源电力 | G353: 电力设备 | H353: 123.49 | I353: -1.6899999999999998e-002 | J353: 9.1000000000000004e-003 | K353: 7.08 | L353: -1.67e-002 | M353: 111.3 | N353: 7.08 | O353: 0.23499999999999999 | P353: 100 | Q353: 已到 | R353: 2年49天 | S353: 49天 | T353: 7.5 | U353: 16 | V353: 1.7000000000000001e-002 | W353: 0.153 | X353: 0.153 | Y353: 49 | Z353: 1.85 | AA353: -4.8399999999999999e-002 | AB353: -5.7500000000000002e-002 | AC353: -0.628 | AD353: -0.63700000000000001 | AE353: 100.69 | AF353: 103.09 | AG353: 0.47 | AH353: AA | AI353: 3.73e-002 | AJ353: =H353+100*O353 -> 146.99000000000001 | AK353: 147 | AL353: 72 | AM353: 43.9 | AN353: 38 | AO353: -1.e-002 | AP353: 42 | AQ353: 杭电转债!
A354: 353 | B354: 113504 | C354: 艾华转债!! | D354: 603989 | E354: 艾华集团 | F354: 电子 | G354: 元器件制 | H354: 193.01 | I354: -1.47e-002 | J354: 1.52e-002 | K354: 35.77 | L354: 5.9999999999999995e-004 | M354: 109.3 | N354: 20.81 | O354: 0.12300000000000001 | P354: 171.89 | Q354: 已到 | R354: 2年45天 | S354: 45天 | T354: 4.63 | U354: 37 | V354: 4.0999999999999995e-002 | W354: 3.2000000000000001e-002 | X354: 5.5e-002 | Y354: 143 | Z354: 5.03 | AA354: -0.23800000000000002 | AB354: -0.24399999999999999 | AC354: <-100% | AD354: <-100% | AE354: 100.73 | AF354: 101.28 | AG354: 0.97 | AH354: AA | AI354: 3.73e-002 | AJ354: =H354+100*O354 -> 205.31 | AK354: 214.1 | AL354: 333 | AM354: 112.8 | AN354: 330 | AO354: -6.8000000000000005e-002 | AP354: 10 | AQ354: 艾华转债!!
A355: 354 | B355: 128035 | C355: 大族转债! | D355: 2008 | E355: 大族激光 | F355: 机械装备 | G355: 专用设备 | H355: 129.301 | I355: 3.3e-003 | J355: 1.37e-002 | K355: 47.87 | L355: 4.7899999999999998e-002 | M355: 107.4 | N355: 51.9 | O355: 0.40200000000000002 | P355: 92.24 | Q355: 已到 | R355: 2年21天 | S355: 21天 | T355: 23 | U355: 145 | V355: 4.8000000000000001e-002 | W355: 4.4999999999999998e-002 | X355: 4.2000000000000003e-002 | Y355: 511 | Z355: 4.81 | AA355: -8.7300000000000003e-002 | AB355: -9.3299999999999994e-002 | AC355: -0.94799999999999995 | AD355: -0.97499999999999998 | AE355: 103.06 | AF355: 100.69 | AG355: 0.35 | AH355: AA+ | AI355: 3.2300000000000002e-002 | AJ355: =H355+100*O355 -> 169.50099999999998 | AK355: 166.4 | AL355: 237 | AM355: 63.3 | AN355: 162 | AO355: -6.2e-002 | AP355: 17 | AQ355: 大族转债!
A356: 355 | B356: 110043 | C356: 无锡转债! | D356: 600908 | E356: 无锡银行 | F356: 金融 | G356: 银行行业 | H356: 124.05 | I356: -1.0500000000000001e-002 | J356: 2.9999999999999997e-004 | K356: 5.89 | L356: -1.83e-002 | M356: 108.3 | N356: 5.61 | O356: 0.182 | P356: 104.99 | Q356: 已到 | R356: 2年14天 | S356: 无权 | T356: 29.2 | U356: 94 | V356: 2.6000000000000002e-002 | W356: 0.26600000000000001 | X356: 0.28000000000000003 | Y356: 110 | Z356: 0.85 | AA356: -6.5299999999999997e-002 | AB356: -7.22e-002 | AC356: 无权 | AD356: 无权 | AE356: 无权 | AF356: 101.6 | AG356: 0.56 | AH356: AA+ | AI356: 3.2300000000000002e-002 | AJ356: =H356+100*O356 -> 142.25 | AK356: 143.1 | AL356: 39 | AM356: 41.5 | AN356: 28 | AO356: 2.7999999999999997e-002 | AP356: 21 | AQ356: 无锡转债!
A357: 356 | B357: 128034 | C357: 江银转债! | D357: 2807 | E357: 江阴银行 | F357: 金融 | G357: 银行行业 | H357: 112.483 | I357: -1.8000000000000002e-002 | J357: 1.3100000000000001e-002 | K357: 3.88 | L357: -1.52e-002 | M357: 108.3 | N357: 4.32 | O357: 0.252 | P357: 89.81 | Q357: 已到 | R357: 2年10天 | S357: 无权 | T357: 17.6 | U357: 31 | V357: 1.4999999999999999e-002 | W357: 0.20899999999999999 | X357: 0.187 | Y357: 84 | Z357: 0.7 | AA357: -1.8799999999999997e-002 | AB357: -2.63e-002 | AC357: 无权 | AD357: 无权 | AE357: 无权 | AF357: 101.64 | AG357: 0.33 | AH357: AA+ | AI357: 3.2300000000000002e-002 | AJ357: =H357+100*O357 -> 137.68299999999999 | AK357: 135.2 | AL357: 11 | AM357: 33.5 | AN357: 8 | AO357: 4.0000000000000001e-003 | AP357: 29 | AQ357: 江银转债!
A358: 357 | B358: 128033 | C358: 迪龙转债! | D358: 2658 | E358: 雪迪龙 | F358: 城市公用 | G358: 三废处理 | H358: 126.1 | I358: -1.4800000000000001e-002 | J358: 1.55e-002 | K358: 8.89 | L358: 1.1000000000000001e-003 | M358: 107.5 | N358: 8.56 | O358: 0.214 | P358: 103.86 | Q358: 已到 | R358: 1.95年 | S358: 回售内 | T358: 2.98 | U358: 29 | V358: 7.6999999999999999e-002 | W358: 5.2999999999999999e-002 | X358: 5.5e-002 | Y358: 56 | Z358: 2.29 | AA358: -7.9199999999999993e-002 | AB358: -8.5800000000000001e-002 | AC358: 回售内 | AD358: 回售内 | AE358: 100.25 | AF358: 100.16 | AG358: 0.56 | AH358: AA | AI358: 3.73e-002 | AJ358: =H358+100*O358 -> 147.5 | AK358: 148.3 | AL358: 83 | AM358: 48.1 | AN358: 61 | AO358: 2.4e-002 | AP358: 32 | AQ358: 迪龙转债!
A359: 358 | B359: 113017 | C359: 吉视转债! | D359: 601929 | E359: 吉视传媒 | F359: 传媒娱乐 | G359: 影视娱乐 | H359: 119.93 | I359: -2.4399999999999998e-002 | J359: 1.0800000000000001e-002 | K359: 2.3 | L359: -2.5399999999999999e-002 | M359: 107.5 | N359: 2.23 | O359: 0.16300000000000001 | P359: 103.14 | Q359: 已到 | R359: 1.95年 | S359: 回售内 | T359: 15.6 | U359: 149 | V359: 7.9000000000000001e-002 | W359: 0.218 | X359: 0.22500000000000001 | Y359: 72 | Z359: 1.07 | AA359: -5.5e-002 | AB359: -6.1799999999999994e-002 | AC359: 回售内 | AD359: 回售内 | AE359: 100.25 | AF359: 101.09 | AG359: 0.53 | AH359: AA+ | AI359: 3.2300000000000002e-002 | AJ359: =H359+100*O359 -> 136.23000000000002 | AK359: 136.7 | AL359: 17 | AM359: 35.6 | AN359: 12 | AO359: 1.e-002 | AP359: 69 | AQ359: 吉视转债!
A360: 359 | B360: 128030 | C360: 天康转债!! | D360: 2100 | E360: 天康生物 | F360: 农业 | G360: 畜牧业 | H360: 177 | I360: -2.4e-002 | J360: 3.2000000000000002e-003 | K360: 11.16 | L360: -2.1899999999999999e-002 | M360: 109.8 | N360: 7.4 | O360: 0.17399999999999999 | P360: 150.81 | Q360: 已到 | R360: 1.93年 | S360: 回售内 | T360: 0.87 | U360: 20 | V360: 0.128 | W360: 6.0000000000000001e-003 | X360: 9.0000000000000011e-003 | Y360: 151 | Z360: 2.13 | AA360: -0.22 | AB360: -0.22699999999999998 | AC360: 回售内 | AD360: 回售内 | AE360: 100.3 | AF360: 102.36 | AG360: 0.95 | AH360: AA | AI360: 3.73e-002 | AJ360: =H360+100*O360 -> 194.40000000000001 | AK360: 203.2 | AL360: 326 | AM360: 100.8 | AN360: 319 | AO360: 3.3000000000000002e-002 | AP360: 9 | AQ360: 天康转债!!
A361: 360 | B361: 128029 | C361: 太阳转债!! | D361: 2078 | E361: 太阳纸业 | F361: 造纸包装 | G361: 造纸行业 | H361: 166 | I361: -1.1299999999999999e-002 | J361: -1.2199999999999999e-002 | K361: 11.59 | L361: -2.4399999999999998e-002 | M361: 106 | N361: 8.45 | O361: 0.20999999999999999 | P361: 137.16 | Q361: 已到 | R361: 0.93年 | S361: 回售内 | T361: 9.09 | U361: 32 | V361: 2.1000000000000001e-002 | W361: 2.8999999999999998e-002 | X361: 4.0000000000000001e-002 | Y361: 311 | Z361: 1.64 | AA361: -0.38200000000000001 | AB361: -0.38900000000000001 | AC361: 回售内 | AD361: 回售内 | AE361: 100.25 | AF361: 103.14 | AG361: 0.96 | AH361: AA+ | AI361: 2.9700000000000001e-002 | AJ361: =H361+100*O361 -> 187. | AK361: 194.8 | AL361: 320 | AM361: 91.7 | AN361: 296 | AO361: 1.e-003 | AP361: 7 | AQ361: 太阳转债!!
A362: 361 | B362: 123004 | C362: 铁汉转债! | D362: 300197 | E362: 节能铁汉 | F362: 城市公用 | G362: 生态环境 | H362: 109.675 | I362: -1.9e-002 | J362: 1.7000000000000001e-002 | K362: 2.89 | L362: -2.0299999999999999e-002 | M362: 107.5 | N362: 3.82 | O362: 0.45000000000000001 | P362: 75.65 | Q362: 已到 | R362: 1.92年 | S362: 回售内 | T362: 8.03 | U362: 29 | V362: 3.2000000000000001e-002 | W362: 9.8000000000000004e-002 | X362: 7.400000000000001e-002 | Y362: 82 | Z362: 1.27 | AA362: -1.04e-002 | AB362: -1.77e-002 | AC362: 回售内 | AD362: 回售内 | AE362: 100.25 | AF362: 100.25 | AG362: 0.1 | AH362: AA | AI362: 3.73e-002 | AJ362: =H362+100*O362 -> 154.67500000000001 | AK362: 143.7 | AL362: 44 | AM362: 43.4 | AN362: 33 | AO362: -2.e-003 | AP362: 51 | AQ362: 铁汉转债!
A363: 362 | B363: 128026 | C363: 众兴转债! | D363: 2772 | E363: 众兴菌业 | F363: 农业 | G363: 种植业 | H363: 112.521 | I363: -1.9699999999999999e-002 | J363: 1.7600000000000001e-002 | K363: 8.41 | L363: -3.6699999999999997e-002 | M363: 107.8 | N363: 11.36 | O363: 0.52000000000000002 | P363: 74.03 | Q363: 已到 | R363: 1.91年 | S363: 回售内 | T363: 4.09 | U363: 46 | V363: 9.8000000000000004e-002 | W363: 0.11900000000000001 | X363: 8.8000000000000009e-002 | Y363: 34 | Z363: 1.14 | AA363: -2.2400000000000003e-002 | AB363: -2.9900000000000003e-002 | AC363: 回售内 | AD363: 回售内 | AE363: 100.3 | AF363: 96.84 | AG363: 0.06 | AH363: AA- | AI363: 5.8299999999999998e-002 | AJ363: =H363+100*O363 -> 164.52100000000002 | AK363: 151 | AL363: 114 | AM363: 50.7 | AN363: 81 | AO363: -2.2000000000000002e-002 | AP363: 59 | AQ363: 众兴转债!
A364: 363 | B364: 128025 | C364: 特一转债! | D364: 2728 | E364: 特一药业 | F364: 医药 | G364: 化学制药 | H364: 148 | I364: 4.2300000000000004e-002 | J364: 1.04e-002 | K364: 19 | L364: 5.79e-002 | M364: 107.5 | N364: 13.8 | O364: 7.4999999999999997e-002 | P364: 137.68 | Q364: 已到 | R364: 1.89年 | S364: 回售内 | T364: 2.98 | U364: 1610. | V364: 3.6600000000000001 | W364: 7.0999999999999994e-002 | X364: 9.6999999999999989e-002 | Y364: 42 | Z364: 3.88 | AA364: -0.157 | AB364: -0.16300000000000001 | AC364: 回售内 | AD364: 回售内 | AE364: 100.25 | AF364: 96.66 | AG364: 0.91 | AH364: AA- | AI364: 5.8299999999999998e-002 | AJ364: =H364+100*O364 -> 155.5 | AK364: 158.3 | AL364: 173 | AM364: 58.1 | AN364: 130 | AO364: 0.152 | AP364: 46 | AQ364: 特一转债!
A365: 364 | B365: 128023 | C365: 亚太转债! | D365: 2284 | E365: 亚太股份 | F365: 汽车 | G365: 零部件制 | H365: 134.273 | I365: 1.0800000000000001e-002 | J365: 9.7999999999999997e-003 | K365: 10.59 | L365: 4.2300000000000004e-002 | M365: 109.8 | N365: 10.34 | O365: 0.311 | P365: 102.42 | Q365: 已到 | R365: 1.88年 | S365: 回售内 | T365: 9.99 | U365: 97 | V365: 7.2999999999999995e-002 | W365: 0.128 | X365: 0.13100000000000001 | Y365: 78 | Z365: 3.11 | AA365: -0.10199999999999999 | AB365: -0.111 | AC365: 回售内 | AD365: 回售内 | AE365: 100.3 | AF365: 102.54 | AG365: 0.49 | AH365: AA | AI365: 3.73e-002 | AJ365: =H365+100*O365 -> 165.37299999999999 | AK365: 166.1 | AL365: 234 | AM365: 63.6 | AN365: 164 | AO365: 3.7000000000000005e-002 | AP365: 53 | AQ365: 亚太转债!
A366: 365 | B366: 128022 | C366: 众信转债! | D366: 2707 | E366: 众信旅游 | F366: 旅游餐饮 | G366: 旅游 | H366: 118.18 | I366: -1.3100000000000001e-002 | J366: 1.e-002 | K366: 6.08 | L366: -3.49e-002 | M366: 107.5 | N366: 7.92 | O366: 0.53900000000000003 | P366: 76.77 | Q366: 已到 | R366: 1.88年 | S366: 回售内 | T366: 4.55 | U366: 19 | V366: 3.5000000000000003e-002 | W366: 8.3000000000000004e-002 | X366: 6.3e-002 | Y366: 55 | Z366: 10.67 | AA366: -4.9599999999999998e-002 | AB366: -5.67e-002 | AC366: 回售内 | AD366: 回售内 | AE366: 100.25 | AF366: 93.27 | AG366: 0.09 | AH366: A | AI366: 7.9299999999999995e-002 | AJ366: =H366+100*O366 -> 172.08000000000001 | AK366: 159.6 | AL366: 181 | AM366: 59.3 | AN366: 139 | AO366: 7.9000000000000001e-002 | AP366: 39 | AQ366: 众信转债!
A367: 366 | B367: 128021 | C367: 兄弟转债!! | D367: 2562 | E367: 兄弟科技 | F367: 医药 | G367: 原料药 | H367: 129.602 | I367: -3.0999999999999999e-003 | J367: 3.7999999999999999e-002 | K367: 5.79 | L367: 3.5799999999999998e-002 | M367: 107.5 | N367: 5.19 | O367: 0.16200000000000001 | P367: 111.56 | Q367: 已到 | R367: 1.87年 | S367: 回售内 | T367: 2.65 | U367: 194 | V367: 0.55100000000000005 | W367: 4.2999999999999997e-002 | X367: 4.8000000000000001e-002 | Y367: 62 | Z367: 2.09 | AA367: -9.5899999999999999e-002 | AB367: -0.10300000000000001 | AC367: 回售内 | AD367: 回售内 | AE367: 100.25 | AF367: 100.45 | AG367: 0.98 | AH367: AA | AI367: 3.73e-002 | AJ367: =H367+100*O367 -> 145.80199999999999 | AK367: 147.6 | AL367: 78 | AM367: 47.2 | AN367: 55 | AO367: 0.17699999999999999 | AP367: 18 | AQ367: 兄弟转债!!
A368: 367 | B368: 123002 | C368: 国祯转债!! | D368: 300388 | E368: 节能国祯 | F368: 城市公用 | G368: 三废处理 | H368: 117.89 | I368: -2.4399999999999998e-002 | J368: 1.43e-002 | K368: 7.65 | L368: -2.5499999999999998e-002 | M368: 107.5 | N368: 8.36 | O368: 0.28800000000000003 | P368: 91.51 | Q368: 已到 | R368: 1.86年 | S368: 回售内 | T368: 2.52 | U368: 6.6 | V368: 2.2000000000000002e-002 | W368: 4.7e-002 | X368: 4.2999999999999997e-002 | Y368: 53 | Z368: 1.45 | AA368: -4.8799999999999996e-002 | AB368: -5.5999999999999994e-002 | AC368: 回售内 | AD368: 回售内 | AE368: 100.25 | AF368: 100.49 | AG368: 0.4 | AH368: AA | AI368: 3.73e-002 | AJ368: =H368+100*O368 -> 146.69 | AK368: 144.3 | AL368: 52 | AM368: 43.8 | AN368: 37 | AO368: -1.9e-002 | AP368: 19 | AQ368: 国祯转债!!
A369: 368 | B369: 110038 | C369: 济川转债! | D369: 600566 | E369: 济川药业 | F369: 医药 | G369: 中药 | H369: 139.07 | I369: -4.0000000000000002e-004 | J369: 2.2799999999999997e-002 | K369: 27.46 | L369: 2.7699999999999999e-002 | M369: 106 | N369: 23.4 | O369: 0.185 | P369: 117.35 | Q369: 已到 | R369: 0.83年 | S369: 回售内 | T369: 6.27 | U369: 179 | V369: 0.20399999999999999 | W369: 2.6000000000000002e-002 | X369: 2.9999999999999999e-002 | Y369: 244 | Z369: 2.85 | AA369: -0.28000000000000003 | AB369: -0.28999999999999998 | AC369: 回售内 | AD369: 回售内 | AE369: 101 | AF369: 103.05 | AG369: 0.81 | AH369: AA | AI369: 3.4700000000000002e-002 | AJ369: =H369+100*O369 -> 157.56999999999999 | AK369: 160.8 | AL369: 193 | AM369: 57.7 | AN369: 127 | AO369: 2.8999999999999998e-002 | AP369: 23 | AQ369: 济川转债!
A370: 369 | B370: 113502 | C370: 嘉澳转债! | D370: 603822 | E370: 嘉澳环保 | F370: 化工 | G370: 化工 | H370: 132.01 | I370: -5.1999999999999998e-003 | J370: 2.5000000000000001e-003 | K370: 46.98 | L370: -4.6999999999999993e-003 | M370: 109.8 | N370: 44.64 | O370: 0.254 | P370: 105.24 | Q370: 已到 | R370: 1.82年 | S370: 回售内 | T370: 1.84 | U370: 9.8 | V370: 4.0000000000000001e-002 | W370: 5.4000000000000006e-002 | X370: 5.5999999999999994e-002 | Y370: 34 | Z370: 4.15 | AA370: -9.7200000000000009e-002 | AB370: -0.106 | AC370: 回售内 | AD370: 回售内 | AE370: 100.3 | AF370: 99.15 | AG370: 0.58 | AH370: AA- | AI370: 5.8299999999999998e-002 | AJ370: =H370+100*O370 -> 157.41 | AK370: 158.8 | AL370: 174 | AM370: 58.5 | AN370: 134 | AO370: 8.8000000000000009e-002 | AP370: 32 | AQ370: 嘉澳转债!
A371: 370 | B371: 113016 | C371: 小康转债!! | D371: 601127 | E371: 小康股份 | F371: 汽车 | G371: 零部件制 | H371: 336.53 | I371: -2.4e-002 | J371: -8.6e-003 | K371: 45.09 | L371: -3.2799999999999996e-002 | M371: 107.8 | N371: 16.96 | O371: 0.26600000000000001 | P371: 265.86 | Q371: 已到 | R371: 1.81年 | S371: 回售内 | T371: 2.07 | U371: 306 | V371: 0.43099999999999999 | W371: 3.0000000000000001e-003 | X371: 9.0000000000000011e-003 | Y371: 613 | Z371: 8.53 | AA371: -0.46000000000000002 | AB371: -0.46399999999999997 | AC371: 回售内 | AD371: 回售内 | AE371: 100.3 | AF371: 97.4 | AG371: 0.99 | AH371: AA- | AI371: 5.8299999999999998e-002 | AJ371: =H371+100*O371 -> 363.13 | AK371: 407.2 | AL371: 370 | AM371: 306.9 | AN371: 370 | AO371: -0.25600000000000001 | AP371: 32 | AQ371: 小康转债!!
A372: 371 | B372: 128017 | C372: 金禾转债!! | D372: 2597 | E372: 金禾实业 | F372: 化工 | G372: 化工 | H372: 221 | I372: -2.9399999999999999e-002 | J372: 4.4999999999999998e-002 | K372: 41.92 | L372: 1.5700000000000002e-002 | M372: 107.5 | N372: 21.97 | O372: 0.158 | P372: 190.81 | Q372: 已到 | R372: 1.79年 | S372: 回售内 | T372: 5.52 | U372: 59 | V372: 4.8000000000000001e-002 | W372: 2.3e-002 | X372: 4.4999999999999998e-002 | Y372: 235 | Z372: 4.52 | AA372: -0.33299999999999996 | AB372: -0.33799999999999997 | AC372: 回售内 | AD372: 回售内 | AE372: 100.25 | AF372: 100.72 | AG372: 0.99 | AH372: AA | AI372: 3.73e-002 | AJ372: =H372+100*O372 -> 236.80000000000001 | AK372: 251.2 | AL372: 350 | AM372: 150.5 | AN372: 350 | AO372: -0.10099999999999999 | AP372: 9 | AQ372: 金禾转债!!
A373: 372 | B373: 113013 | C373: 国君转债! | D373: 601211 | E373: 国泰君安 | F373: 金融 | G373: 证券行业 | H373: 122.63 | I373: -1.4999999999999999e-002 | J373: 4.5999999999999999e-003 | K373: 17.24 | L373: -3.0899999999999997e-002 | M373: 106.8 | N373: 18.45 | O373: 0.312 | P373: 93.44 | Q373: 已到 | R373: 1.47年 | S373: 无权 | T373: 69.9 | U373: 58 | V373: 6.9999999999999993e-003 | W373: 4.5999999999999999e-002 | X373: 4.2999999999999997e-002 | Y373: 1536. | Z373: 1.16 | AA373: -9.0500000000000011e-002 | AB373: -9.8299999999999998e-002 | AC373: 无权 | AD373: 无权 | AE373: 无权 | AF373: 102.26 | AG373: 0.34 | AH373: AAA | AI373: 3.0299999999999997e-002 | AJ373: =H373+100*O373 -> 153.82999999999998 | AK373: 151.8 | AL373: 122 | AM373: 49.6 | AN373: 75 | AO373: -2.2000000000000002e-002 | AP373: 11 | AQ373: 国君转债!
A374: 373 | B374: 128015 | C374: 久其转债!! | D374: 2279 | E374: 久其软件 | F374: 计算机及 | G374: 软件开发 | H374: 110.053 | I374: -1.4999999999999999e-002 | J374: 1.5700000000000002e-002 | K374: 4.96 | L374: 8.1000000000000013e-003 | M374: 109.5 | N374: 6.97 | O374: 0.54700000000000004 | P374: 71.16 | Q374: 已到 | R374: 1.39年 | S374: 回售内 | T374: 7.79 | U374: 25 | V374: 2.8999999999999998e-002 | W374: 0.221 | X374: 0.157 | Y374: 35 | Z374: 4.4 | AA374: -3.5999999999999999e-003 | AB374: -1.6200000000000003e-002 | AC374: 回售内 | AD374: 回售内 | AE374: 100.25 | AF374: 99.83 | AG374: 0.08 | AH374: A+ | AI374: 6.93e-002 | AJ374: =H374+100*O374 -> 164.75299999999999 | AK374: 148.9 | AL374: 87 | AM374: 48.7 | AN374: 65 | AO374: 5.2000000000000005e-002 | AP374: 71 | AQ374: 久其转债!!
A375: 374 | B375: 127004 | C375: 模塑转债!! | D375: 700 | E375: 模塑科技 | F375: 汽车 | G375: 零部件制 | H375: 163.612 | I375: -6.0999999999999995e-003 | J375: 6.0999999999999995e-003 | K375: 4.99 | L375: -1.38e-002 | M375: 111.8 | N375: 7.24 | O375: 1.3700000000000001 | P375: 68.92 | Q375: 已到 | R375: 1.38年 | S375: 回售内 | T375: 1.31 | U375: 22 | V375: 0.10099999999999999 | W375: 2.8999999999999998e-002 | X375: 2.e-002 | Y375: 46 | Z375: 2.01 | AA375: -0.24399999999999999 | AB375: -0.255 | AC375: 回售内 | AD375: 回售内 | AE375: 100.3 | AF375: 101.12 | AG375: 0 | AH375: AA- | AI375: 5.8299999999999998e-002 | AJ375: =H375+100*O375 -> 300.61199999999997 | AK375: 258.3 | AL375: 352 | AM375: 157.2 | AN375: 353 | AO375: -1.4999999999999999e-002 | AP375: 24 | AQ375: 模塑转债!!
A376: 375 | B376: 128014 | C376: 永东转债! | D376: 2753 | E376: 永东股份 | F376: 化工 | G376: 化工 | H376: 117.2 | I376: -1.9799999999999998e-002 | J376: 1.78e-002 | K376: 9.86 | L376: -1.89e-002 | M376: 109.8 | N376: 12.52 | O376: 0.48799999999999999 | P376: 78.75 | Q376: 已到 | R376: 1.25年 | S376: 回售内 | T376: 3.37 | U376: 7.2 | V376: 1.8000000000000002e-002 | W376: 9.0999999999999998e-002 | X376: 7.2000000000000008e-002 | Y376: 37 | Z376: 1.77 | AA376: -5.1399999999999994e-002 | AB376: -6.5000000000000002e-002 | AC376: 回售内 | AD376: 回售内 | AE376: 100.3 | AF376: 102.38 | AG376: 0.11 | AH376: AA- | AI376: 5.8299999999999998e-002 | AJ376: =H376+100*O376 -> 166. | AK376: 155.6 | AL376: 153 | AM376: 53.3 | AN376: 96 | AO376: 6.9999999999999993e-003 | AP376: 38 | AQ376: 永东转债!
A377: 376 | B377: 113011 | C377: 光大转债 | D377: 601818 | E377: 光大银行 | F377: 金融 | G377: 银行行业 | H377: 113.29 | I377: -1.1899999999999999e-002 | J377: 7.9000000000000008e-003 | K377: 3.4 | L377: -1.1599999999999999e-002 | M377: 106.8 | N377: 3.55 | O377: 0.183 | P377: 95.77 | Q377: 已到 | R377: 1.17年 | S377: 无权 | T377: 242 | U377: 421 | V377: 1.4999999999999999e-002 | W377: 0.13200000000000001 | X377: 0.126 | Y377: 1837. | Z377: 0.5 | AA377: -5.0000000000000003e-002 | AB377: -6.0400000000000002e-002 | AC377: 无权 | AD377: 无权 | AE377: 无权 | AF377: 103.2 | AG377: 0.34 | AH377: AAA | AI377: 3.0299999999999997e-002 | AJ377: =H377+100*O377 -> 131.59 | AK377: 130.8 | AL377: 5 | AM377: 27.6 | AN377: 3 | AO377: 1.4999999999999999e-002 | AP377: 17 | AQ377: 光大转债
A378: 377 | B378: 128013 | C378: 洪涛转债! | D378: 2325 | E378: 洪涛股份 | F378: 建筑 | G378: 装饰工程 | H378: 121.75 | I378: -2.7799999999999998e-002 | J378: 3.5999999999999999e-003 | K378: 2.8 | L378: -2.7799999999999998e-002 | M378: 108 | N378: 2.31 | O378: 4.0000000000000001e-003 | P378: 121.21 | Q378: 已到 | R378: 0.53年 | S378: 回售内 | T378: 10.6 | U378: 101 | V378: 7.6999999999999999e-002 | W378: 0.28600000000000003 | X378: 0.34600000000000003 | Y378: 37 | Z378: 1.26 | AA378: -0.20100000000000001 | AB378: -0.223 | AC378: 回售内 | AD378: 回售内 | AE378: 100.33 | AF378: 103.32 | AG378: 0.87 | AH378: A- | AI378: 8.6699999999999999e-002 | AJ378: =H378+100*O378 -> 122.15000000000001 | AK378: 122.3 | AL378: 2 | AM378: 19 | AN378: 1 | AO378: -3.2000000000000001e-002 | AP378: 100 | AQ378: 洪涛转债!
A379: 378 | B379: 127003 | C379: 海印转债! | D379: 861 | E379: 海印股份 | F379: 商业零售 | G379: 商场 | H379: 118.65 | I379: -1.4499999999999999e-002 | J379: 1.2800000000000001e-002 | K379: 3.06 | L379: -6.5000000000000006e-003 | M379: 110 | N379: 2.99 | O379: 0.159 | P379: 102.34 | Q379: 已到 | R379: 0.39年 | S379: 回售内 | T379: 6.74 | U379: 44 | V379: 5.4000000000000006e-002 | W379: 9.5000000000000001e-002 | X379: 9.6999999999999989e-002 | Y379: 71 | Z379: 1.94 | AA379: -0.17499999999999999 | AB379: -0.21299999999999999 | AC379: 回售内 | AD379: 回售内 | AE379: 100.33 | AF379: 108.55 | AG379: 0.26 | AH379: AA | AI379: 3.4200000000000001e-002 | AJ379: =H379+100*O379 -> 134.55000000000001 | AK379: 135 | AL379: 8 | AM379: 26.4 | AN379: 2 | AO379: -4.7e-002 | AP379: 74 | AQ379: 海印转债!