A1: 序号 | B1: 转债代码 | C1: 转债名称 | D1: 股票代码 | E1: 股票名称 | F1: 行业 | G1: 子行业 | H1: 转债价格 | I1: 涨跌 | J1: 日内套利 | K1: 股价 | L1: 涨跌 | M1: 剩余本息 | N1: 转股价格 | O1: 转股溢价率 | P1: 转股价值 | Q1: 距离转股日 | R1: 剩余年限 | S1: 回售年限 | T1: 转债余额 | U1: 转债成交额 | V1: 转债换手率 | W1: 余额/市值 | X1: 余额/股本 | Y1: 股票市值 | Z1: P/B | AA1: 税前收益率 | AB1: 税后收益率 | AC1: 税前回售收益 | AD1: 税后回售收益 | AE1: 回售价值 | AF1: 纯债价值 | AG1: 弹性 | AH1: 信用 | AI1: 折现率 | AJ1: 双低 | AK1: 老式双低 | AL1: 老式排名 | AM1: 新式双低 | AN1: 新式排名 | AO1: MA20乖离 | AP1: 热门度 | AQ1: 转债名称
A2: 293 | B2: 128062 | C2: 亚药转债! | D2: 2370 | E2: 亚太药业 | F2: 医药 | G2: 化学制药 | H2: 93.265 | I2: -2.0999999999999999e-003 | J2: 2.0999999999999999e-003 | K2: 4.35 | L2: 3.0800000000000001e-002 | M2: 119.3 | N2: 16.25 | O2: 2.48 | P2: 26.77 | Q2: 已到 | R2: 3.40年 | S2: 1.40年 | T2: 9.63 | U2: 18 | V2: 2.e-002 | W2: 0.41299999999999998 | X2: 0.11 | Y2: 23 | Z2: 6.45 | AA2: 7.6700000000000004e-002 | AB2: 6.5799999999999997e-002 | AC2: 6.4600000000000005e-002 | AD2: 6.0700000000000004e-002 | AE2: 83.53 | AF2: 76.51 | AG2: 0 | AH2: BB | AI2: 0.14279999999999998 | AJ2: =H2+100*O2 -> 341.26499999999999 | AK2: 159.8 | AL2: 244 | AM2: 76.2 | AN2: 281 | AO2: 2.e-002 | AP2: 90 | AQ2: 亚药转债!
A3: 166 | B3: 113595 | C3: 花王转债! | D3: 603007 | E3: ST花王 | F3: 城市公用 | G3: 生态环境 | H3: 95.88 | I3: -2.5000000000000001e-003 | J3: 2.5000000000000001e-003 | K3: 3.06 | L3: 0. | M3: 124.8 | N3: 6.92 | O3: 1.1699999999999999 | P3: 44.22 | Q3: 已到 | R3: 4.70年 | S3: 2.70年 | T3: 3.3 | U3: 103 | V3: 0.32500000000000001 | W3: 0.32100000000000001 | X3: 0.14199999999999999 | Y3: 10 | Z3: 0.96 | AA3: 5.8899999999999994e-002 | AB3: 4.9500000000000002e-002 | AC3: 2.7999999999999997e-002 | AD3: 2.5399999999999999e-002 | AE3: 78.55 | AF3: 79.58 | AG3: 0.09 | AH3: BBB+ | AI3: 0.10279999999999999 | AJ3: =H3+100*O3 -> 212.88 | AK3: 147.5 | AL3: 159 | AM3: 68 | AN3: 248 | AO3: -6.9999999999999993e-003 | AP3: 49 | AQ3: 花王转债!
A4: 147 | B4: 128127 | C4: 文科转债! | D4: 2775 | E4: 文科园林 | F4: 城市公用 | G4: 生态环境 | H4: 96.73 | I4: 1.5e-003 | J4: 1.2999999999999999e-003 | K4: 3.45 | L4: 8.8000000000000005e-003 | M4: 120.8 | N4: 4.88 | O4: 0.36799999999999999 | P4: 70.7 | Q4: 已到 | R4: 4.79年 | S4: 2.79年 | T4: 9.5 | U4: 6.8 | V4: 6.9999999999999993e-003 | W4: 0.53700000000000003 | X4: 0.38 | Y4: 18 | Z4: 0.83 | AA4: 4.8600000000000004e-002 | AB4: 4.0599999999999997e-002 | AC4: 2.4199999999999999e-002 | AD4: 2.1600000000000001e-002 | AE4: 87.04 | AF4: 91.23 | AG4: 0.32 | AH4: AA- | AI4: 6.1799999999999994e-002 | AJ4: =H4+100*O4 -> 133.53 | AK4: 122.8 | AL4: 4 | AM4: 31.5 | AN4: 15 | AO4: -5.0999999999999997e-002 | AP4: 70 | AQ4: 文科转债!
A5: 112 | B5: 128138 | C5: 侨银转债! | D5: 2973 | E5: 侨银股份 | F5: 城市公用 | G5: 城市公用 | H5: 108.15 | I5: 0. | J5: -1.1000000000000001e-003 | K5: 14.8 | L5: -8.6999999999999994e-003 | M5: 136.5 | N5: 25.33 | O5: 0.85099999999999998 | P5: 58.43 | Q5: 已到 | R5: 5年11天 | S5: 3年11天 | T5: 4.2 | U5: 2.4 | V5: 5.0000000000000001e-003 | W5: 6.9000000000000006e-002 | X5: 4.0999999999999995e-002 | Y5: 60 | Z5: 3.77 | AA5: 4.8399999999999999e-002 | AB5: 3.6699999999999997e-002 | AC5: -1.1000000000000001e-002 | AD5: -1.37e-002 | AE5: 86 | AF5: 100.88 | AG5: 0.13 | AH5: AA- | AI5: 6.3399999999999998e-002 | AJ5: =H5+100*O5 -> 193.25 | AK5: 157.9 | AL5: 230 | AM5: 57 | AN5: 177 | AO5: -6.0999999999999999e-002 | AP5: 19 | AQ5: 侨银转债!
A6: 158 | B6: 113596 | C6: 城地转债! | D6: 603887 | E6: 城地香江 | F6: 通信互联 | G6: 通信设备 | H6: 91.57 | I6: -8.6e-003 | J6: 8.6e-003 | K6: 7.21 | L6: 4.1999999999999997e-003 | M6: 113.1 | N6: 24.26 | O6: 2.0800000000000001 | P6: 29.72 | Q6: 已到 | R6: 4.72年 | S6: 2.72年 | T6: 12 | U6: 31 | V6: 2.7999999999999997e-002 | W6: 0.36899999999999999 | X6: 0.11 | Y6: 32 | Z6: 0.86 | AA6: 4.6699999999999998e-002 | AB6: 4.1200000000000001e-002 | AC6: 4.3400000000000001e-002 | AD6: 4.0899999999999999e-002 | AE6: 87.11 | AF6: 85.71 | AG6: 0 | AH6: AA- | AI6: 6.1799999999999994e-002 | AJ6: =H6+100*O6 -> 299.56999999999999 | AK6: 153.4 | AL6: 203 | AM6: 66.3 | AN6: 239 | AO6: -8.3000000000000004e-002 | AP6: 33 | AQ6: 城地转债!
A7: 225 | B7: 113569 | C7: 科达转债! | D7: 603660 | E7: 苏州科达 | F7: 通信互联 | G7: 物联网 | H7: 100.1 | I7: -1.e-003 | J7: 1.2999999999999999e-003 | K7: 5.89 | L7: 1.38e-002 | M7: 120.3 | N7: 14.8 | O7: 1.52 | P7: 39.8 | Q7: 已到 | R7: 4.34年 | S7: 2.34年 | T7: 5.16 | U7: 2 | V7: 4.0000000000000001e-003 | W7: 0.17699999999999999 | X7: 7.0999999999999994e-002 | Y7: 29 | Z7: 1.72 | AA7: 4.4299999999999999e-002 | AB7: 3.5699999999999996e-002 | AC7: 1.41e-002 | AD7: 1.1200000000000002e-002 | AE7: 89.35 | AF7: 93.31 | AG7: 0.02 | AH7: AA- | AI7: 6.1799999999999994e-002 | AJ7: =H7+100*O7 -> 252.09999999999999 | AK7: 160.4 | AL7: 250 | AM7: 67.1 | AN7: 243 | AO7: -7.8e-002 | AP7: 34 | AQ7: 科达转债!
A8: 306 | B8: 110052 | C8: 贵广转债! | D8: 600996 | E8: 贵广网络 | F8: 传媒娱乐 | G8: 影视娱乐 | H8: 102.89 | I8: 8.9999999999999998e-004 | J8: -5.0000000000000001e-004 | K8: 4.33 | L8: 1.8799999999999997e-002 | M8: 117.7 | N8: 7.94 | O8: 0.88700000000000001 | P8: 54.53 | Q8: 已到 | R8: 3.33年 | S8: 1.33年 | T8: 15.3 | U8: 12 | V8: 6.9999999999999993e-003 | W8: 0.33500000000000002 | X8: 0.183 | Y8: 46 | Z8: 1.19 | AA8: 4.2199999999999994e-002 | AB8: 3.2300000000000002e-002 | AC8: 8.9999999999999998e-004 | AD8: -3.0000000000000001e-003 | AE8: 97.81 | AF8: 104.98 | AG8: 0.02 | AH8: AA+ | AI8: 3.5799999999999998e-002 | AJ8: =H8+100*O8 -> 191.59 | AK8: 151.2 | AL8: 188 | AM8: 46.3 | AN8: 95 | AO8: -3.1e-002 | AP8: 20 | AQ8: 贵广转债!
A9: 149 | B9: 110072 | C9: 广汇转债! | D9: 600297 | E9: 广汇汽车 | F9: 汽车 | G9: 分销、售 | H9: 94.7 | I9: 1.7000000000000001e-003 | J9: -3.3e-003 | K9: 2.58 | L9: -1.15e-002 | M9: 114.3 | N9: 4.03 | O9: 0.47899999999999998 | P9: 64.02 | Q9: 已到 | R9: 4.78年 | S9: 2.78年 | T9: 33.7 | U9: 30 | V9: 9.0000000000000011e-003 | W9: 0.161 | X9: 0.10300000000000001 | Y9: 209 | Z9: 0.51 | AA9: 4.0800000000000003e-002 | AB9: 3.5099999999999999e-002 | AC9: 2.8399999999999998e-002 | AD9: 2.64e-002 | AE9: 92.73 | AF9: 96.86 | AG9: 0.14 | AH9: AA+ | AI9: 3.5799999999999998e-002 | AJ9: =H9+100*O9 -> 142.59999999999999 | AK9: 125.4 | AL9: 7 | AM9: 28.5 | AN9: 10 | AO9: -0.11800000000000001 | AP9: 76 | AQ9: 广汇转债!
A10: 201 | B10: 113578 | C10: 全筑转债! | D10: 603030 | E10: 全筑股份 | F10: 建筑 | G10: 装饰工程 | H10: 99.39 | I10: -4.0000000000000001e-003 | J10: 4.4000000000000003e-003 | K10: 3.22 | L10: 3.0999999999999999e-003 | M10: 117.9 | N10: 5.25 | O10: 0.62 | P10: 61.33 | Q10: 已到 | R10: 4.45年 | S10: 2.45年 | T10: 3.84 | U10: 5.4 | V10: 1.3999999999999999e-002 | W10: 0.20600000000000002 | X10: 0.126 | Y10: 19 | Z10: 0.85 | AA10: 3.9900000000000005e-002 | AB10: 3.2500000000000001e-002 | AC10: 1.54e-002 | AD10: 1.2800000000000001e-002 | AE10: 93.21 | AF10: 99.03 | AG10: 0.11 | AH10: AA | AI10: 4.0800000000000003e-002 | AJ10: =H10+100*O10 -> 161.38999999999999 | AK10: 137.4 | AL10: 55 | AM10: 38.4 | AN10: 39 | AO10: -5.9999999999999998e-002 | AP10: 29 | AQ10: 全筑转债!
A11: 364 | B11: 128015 | C11: 久其转债!! | D11: 2279 | E11: 久其软件 | F11: 计算机及 | G11: 软件开发 | H11: 103.089 | I11: 4.0000000000000002e-004 | J11: -4.0000000000000002e-004 | K11: 4.22 | L11: 1.44e-002 | M11: 109.5 | N11: 6.97 | O11: 0.70299999999999996 | P11: 60.55 | Q11: 已到 | R11: 1.59年 | S11: 回售内 | T11: 7.79 | U11: 11 | V11: 1.3999999999999999e-002 | W11: 0.26000000000000001 | X11: 0.157 | Y11: 30 | Z11: 3.74 | AA11: 3.9100000000000003e-002 | AB11: 2.76e-002 | AC11: 回售内 | AD11: 回售内 | AE11: 100.25 | AF11: 98.25 | AG11: 0 | AH11: A+ | AI11: 7.1399999999999991e-002 | AJ11: =H11+100*O11 -> 173.38900000000001 | AK11: 145.6 | AL11: 138 | AM11: 45.4 | AN11: 90 | AO11: -2.5000000000000001e-002 | AP11: 69 | AQ11: 久其转债!!
A12: 322 | B12: 113519 | C12: 长久转债! | D12: 603569 | E12: 长久物流 | F12: 交通运输 | G12: 物流业 | H12: 106.7 | I12: 4.0999999999999995e-003 | J12: -4.0999999999999995e-003 | K12: 6.28 | L12: 0. | M12: 119.3 | N12: 11.04 | O12: 0.87599999999999989 | P12: 56.88 | Q12: 已到 | R12: 3年1.1天 | S12: 1年1.1天 | T12: 6.97 | U12: 2.3 | V12: 3.0000000000000001e-003 | W12: 0.19800000000000001 | X12: 0.113 | Y12: 35 | Z12: 1.66 | AA12: 3.8800000000000001e-002 | AB12: 2.7099999999999999e-002 | AC12: -3.1699999999999999e-002 | AD12: -3.6200000000000003e-002 | AE12: 98.16 | AF12: 106.09 | AG12: 0.03 | AH12: AA | AI12: 4.0800000000000003e-002 | AJ12: =H12+100*O12 -> 194.30000000000001 | AK12: 156.5 | AL12: 222 | AM12: 50.4 | AN12: 132 | AO12: -5.5999999999999994e-002 | AP12: 23 | AQ12: 长久转债!
A13: 183 | B13: 113589 | C13: 天创转债! | D13: 603608 | E13: 天创时尚 | F13: 服装纺织 | G13: 鞋服行业 | H13: 96.69 | I13: 2.3999999999999998e-003 | J13: -2.3e-003 | K13: 5.4 | L13: 5.6000000000000008e-003 | M13: 114.9 | N13: 12.29 | O13: 1.2 | P13: 43.94 | Q13: 已到 | R13: 4.63年 | S13: 2.63年 | T13: 6 | U13: 5.3 | V13: 9.0000000000000011e-003 | W13: 0.25900000000000001 | X13: 0.114 | Y13: 23 | Z13: 1.47 | AA13: 3.8800000000000001e-002 | AB13: 3.2599999999999997e-002 | AC13: 2.4500000000000001e-002 | AD13: 2.2000000000000002e-002 | AE13: 92.55 | AF13: 95.83 | AG13: 0.02 | AH13: AA | AI13: 4.0800000000000003e-002 | AJ13: =H13+100*O13 -> 216.69 | AK13: 149.4 | AL13: 176 | AM13: 53.6 | AN13: 152 | AO13: -2.7999999999999997e-002 | AP13: 37 | AQ13: 天创转债!
A14: 291 | B14: 128063 | C14: 未来转债! | D14: 2631 | E14: 德尔未来 | F14: 其他 | G14: 家居用品 | H14: 112.822 | I14: -4.1999999999999997e-003 | J14: -4.0000000000000002e-004 | K14: 6.87 | L14: -1.8600000000000002e-002 | M14: 127.5 | N14: 8.64 | O14: 0.41899999999999998 | P14: 79.51 | Q14: 已到 | R14: 3.41年 | S14: 2.41年 | T14: 6.29 | U14: 7.9 | V14: 1.1000000000000001e-002 | W14: 0.13900000000000001 | X14: 0.111 | Y14: 45 | Z14: 2.64 | AA14: 3.78e-002 | AB14: 2.3799999999999998e-002 | AC14: -1.66e-002 | AD14: -2.2400000000000003e-002 | AE14: 93.06 | AF14: 104.62 | AG14: 0.25 | AH14: AA- | AI14: 6.1799999999999994e-002 | AJ14: =H14+100*O14 -> 154.72200000000001 | AK14: 146.1 | AL14: 145 | AM14: 41.5 | AN14: 62 | AO14: -7.2999999999999995e-002 | AP14: 36 | AQ14: 未来转债!
A15: 221 | B15: 128100 | C15: 搜特转债! | D15: 2503 | E15: 搜于特 | F15: 服装纺织 | G15: 服装行业 | H15: 99.85 | I15: -5.6999999999999993e-003 | J15: -2.5000000000000001e-003 | K15: 1.45 | L15: -1.3600000000000001e-002 | M15: 116.9 | N15: 1.62 | O15: 0.11599999999999999 | P15: 89.51 | Q15: 已到 | R15: 4.35年 | S15: 2.35年 | T15: 7.99 | U15: 21 | V15: 2.6000000000000002e-002 | W15: 0.17800000000000002 | X15: 0.16 | Y15: 45 | Z15: 2.97 | AA15: 3.78e-002 | AB15: 3.0499999999999999e-002 | AC15: 1.4199999999999999e-002 | AD15: 1.1399999999999999e-002 | AE15: 84.84 | AF15: 83.37 | AG15: 0.6 | AH15: A | AI15: 8.2799999999999999e-002 | AJ15: =H15+100*O15 -> 111.44999999999999 | AK15: 110.2 | AL15: 1 | AM15: 25.3 | AN15: 4 | AO15: -4.9000000000000002e-002 | AP15: 80 | AQ15: 搜特转债!
A16: 296 | B16: 113530 | C16: 大丰转债! | D16: 603081 | E16: 大丰实业 | F16: 建筑 | G16: 装饰工程 | H16: 107.29 | I16: -2.e-003 | J16: 1.4000000000000002e-003 | K16: 10.27 | L16: -9.5999999999999992e-003 | M16: 121 | N16: 16.49 | O16: 0.72299999999999998 | P16: 62.28 | Q16: 已到 | R16: 3.39年 | S16: 1.39年 | T16: 6.3 | U16: 0.9 | V16: 1.e-003 | W16: 0.153 | X16: 9.5000000000000001e-002 | Y16: 41 | Z16: 1.76 | AA16: 3.7000000000000005e-002 | AB16: 2.5899999999999999e-002 | AC16: -2.6699999999999998e-002 | AD16: -3.0200000000000001e-002 | AE16: 96.77 | AF16: 105.98 | AG16: 0.06 | AH16: AA | AI16: 4.0800000000000003e-002 | AJ16: =H16+100*O16 -> 179.59 | AK16: 152.3 | AL16: 197 | AM16: 46.3 | AN16: 96 | AO16: -5.9999999999999998e-002 | AP16: 30 | AQ16: 大丰转债!
A17: 246 | B17: 110064 | C17: 建工转债! | D17: 600939 | E17: 重庆建工 | F17: 建筑 | G17: 建筑工程 | H17: 103.97 | I17: -3.2000000000000002e-003 | J17: 2.7000000000000001e-003 | K17: 3.3 | L17: -3.0000000000000001e-003 | M17: 119.8 | N17: 4.53 | O17: 0.42700000000000005 | P17: 72.85 | Q17: 已到 | R17: 4年44天 | S17: 2年44天 | T17: 16.6 | U17: 5.6 | V17: 3.0000000000000001e-003 | W17: 0.27699999999999997 | X17: 0.20199999999999999 | Y17: 60 | Z17: 0.82 | AA17: 3.6000000000000004e-002 | AB17: 2.7200000000000002e-002 | AC17: 7.000000000000001e-004 | AD17: -2.8000000000000004e-003 | AE17: 96.18 | AF17: 104.03 | AG17: 0.16 | AH17: AA+ | AI17: 3.5799999999999998e-002 | AJ17: =H17+100*O17 -> 146.67000000000002 | AK17: 135.1 | AL17: 40 | AM17: 31.1 | AN17: 14 | AO17: -4.8000000000000001e-002 | AP17: 46 | AQ17: 建工转债!
A18: 324 | B18: 128044 | C18: 岭南转债! | D18: 2717 | E18: 岭南股份 | F18: 城市公用 | G18: 生态环境 | H18: 100.2 | I18: -6.0000000000000001e-003 | J18: 5.8999999999999999e-003 | K18: 2.97 | L18: -1.e-002 | M18: 110.3 | N18: 5.59 | O18: 0.8859999999999999 | P18: 53.13 | Q18: 已到 | R18: 2.77年 | S18: 0.77年 | T18: 6.59 | U18: 91 | V18: 0.13699999999999998 | W18: 0.13200000000000001 | X18: 7.0000000000000007e-002 | Y18: 50 | Z18: 1.06 | AA18: 3.5900000000000001e-002 | AB18: 2.86e-002 | AC18: 1.7100000000000001e-002 | AD18: 1.32e-002 | AE18: 96.37 | AF18: 94.01 | AG18: 0.01 | AH18: AA- | AI18: 6.0400000000000002e-002 | AJ18: =H18+100*O18 -> 188.80000000000001 | AK18: 147.3 | AL18: 158 | AM18: 50.9 | AN18: 137 | AO18: 7.6999999999999999e-002 | AP18: 54 | AQ18: 岭南转债!
A19: 335 | B19: 127007 | C19: 湖广转债! | D19: 665 | E19: 湖北广电 | F19: 传媒娱乐 | G19: 影视娱乐 | H19: 101.62 | I19: -1.2999999999999999e-003 | J19: 2.0999999999999999e-003 | K19: 3.31 | L19: 2.4799999999999999e-002 | M19: 111.3 | N19: 5.58 | O19: 0.71299999999999997 | P19: 59.32 | Q19: 已到 | R19: 2.64年 | S19: 0.64年 | T19: 12.2 | U19: 16 | V19: 1.3000000000000001e-002 | W19: 0.374 | X19: 0.222 | Y19: 33 | Z19: 0.57 | AA19: 3.5699999999999996e-002 | AB19: 2.7400000000000001e-002 | AC19: 2.2000000000000001e-003 | AD19: -2.2000000000000001e-003 | AE19: 99.06 | AF19: 101.94 | AG19: 0.03 | AH19: AA+ | AI19: 3.44e-002 | AJ19: =H19+100*O19 -> 172.92000000000002 | AK19: 143.9 | AL19: 120 | AM19: 42 | AN19: 65 | AO19: -4.0000000000000001e-002 | AP19: 21 | AQ19: 湖广转债!
A20: 202 | B20: 113573 | C20: 纵横转债! | D20: 603602 | E20: 纵横通信 | F20: 通信互联 | G20: 通信设备 | H20: 106.9 | I20: 8.0000000000000004e-004 | J20: -4.0000000000000002e-004 | K20: 8.97 | L20: 6.7000000000000002e-003 | M20: 124.2 | N20: 18.78 | O20: 1.24 | P20: 47.76 | Q20: 已到 | R20: 4.44年 | S20: 2.44年 | T20: 2.7 | U20: 8.7 | V20: 2.9999999999999999e-002 | W20: 0.14800000000000002 | X20: 7.0000000000000007e-002 | Y20: 18 | Z20: 2.57 | AA20: 3.5200000000000002e-002 | AB20: 2.5600000000000001e-002 | AC20: -1.01e-002 | AD20: -1.3100000000000001e-002 | AE20: 86.85 | AF20: 91.59 | AG20: 0.06 | AH20: A+ | AI20: 7.2800000000000004e-002 | AJ20: =H20+100*O20 -> 230.90000000000001 | AK20: 166 | AL20: 272 | AM20: 74.4 | AN20: 275 | AO20: -3.6000000000000004e-002 | AP20: 27 | AQ20: 纵横转债!
A21: 173 | B21: 127019 | C21: 国城转债! | D21: 688 | E21: 国城矿业 | F21: 有色金属 | G21: 锌铅镍锡 | H21: 98 | I21: -1.9e-003 | J21: 1.2999999999999999e-003 | K21: 9.2 | L21: -2.6499999999999999e-002 | M21: 114.8 | N21: 21.06 | O21: 1.24 | P21: 43.68 | Q21: 已到 | R21: 4.69年 | S21: 2.69年 | T21: 8.5 | U21: 8.9 | V21: 1.1000000000000001e-002 | W21: 8.1000000000000003e-002 | X21: 3.5000000000000003e-002 | Y21: 105 | Z21: 4.33 | AA21: 3.5000000000000003e-002 | AB21: 2.8999999999999998e-002 | AC21: 1.8799999999999997e-002 | AD21: 1.6399999999999998e-002 | AE21: 92.24 | AF21: 95.52 | AG21: 0.02 | AH21: AA | AI21: 4.0800000000000003e-002 | AJ21: =H21+100*O21 -> 222. | AK21: 152.3 | AL21: 198 | AM21: 56.8 | AN21: 175 | AO21: -9.6999999999999989e-002 | AP21: 48 | AQ21: 国城转债!
A22: 178 | B22: 128117 | C22: 道恩转债! | D22: 2838 | E22: 道恩股份 | F22: 化工 | G22: 橡胶塑料 | H22: 105.304 | I22: 8.9999999999999998e-004 | J22: -8.0000000000000004e-004 | K22: 15.33 | L22: 7.000000000000001e-004 | M22: 123.1 | N22: 28.82 | O22: 0.97999999999999998 | P22: 53.19 | Q22: 已到 | R22: 4.65年 | S22: 2.65年 | T22: 3.6 | U22: 4.3 | V22: 1.1000000000000001e-002 | W22: 5.7999999999999996e-002 | X22: 3.1e-002 | Y22: 63 | Z22: 3.29 | AA22: 3.4799999999999998e-002 | AB22: 2.6099999999999998e-002 | AC22: -6.4000000000000003e-003 | AD22: -8.6999999999999994e-003 | AE22: 87.48 | AF22: 93.64 | AG22: 0.1 | AH22: AA- | AI22: 6.1799999999999994e-002 | AJ22: =H22+100*O22 -> 203.304 | AK22: 157.4 | AL22: 227 | AM22: 63.8 | AN22: 224 | AO22: 3.2000000000000001e-002 | AP22: 24 | AQ22: 道恩转债!
A23: 349 | B23: 113017 | C23: 吉视转债! | D23: 601929 | E23: 吉视传媒 | F23: 传媒娱乐 | G23: 影视娱乐 | H23: 101.33 | I23: -2.0000000000000001e-004 | J23: 4.0000000000000002e-004 | K23: 1.85 | L23: 5.4000000000000003e-003 | M23: 108.8 | N23: 2.95 | O23: 0.61599999999999999 | P23: 62.71 | Q23: 已到 | R23: 2年51天 | S23: 51天 | T23: 15.6 | U23: 36 | V23: 2.3e-002 | W23: 0.27100000000000002 | X23: 0.17000000000000001 | Y23: 58 | Z23: 0.86 | AA23: 3.44e-002 | AB23: 2.63e-002 | AC23: 7.0999999999999995e-003 | AD23: -2.8999999999999998e-003 | AE23: 100.51 | AF23: 101.34 | AG23: 0.03 | AH23: AA+ | AI23: 3.44e-002 | AJ23: =H23+100*O23 -> 162.93000000000001 | AK23: 139.9 | AL23: 80 | AM23: 38.6 | AN23: 43 | AO23: -1.8000000000000002e-002 | AP23: 67 | AQ23: 吉视转债!
A24: 177 | B24: 128118 | C24: 瀛通转债! | D24: 2861 | E24: 瀛通通讯 | F24: 电子 | G24: 电子产品 | H24: 104.87 | I24: 2.2000000000000001e-003 | J24: 2.9999999999999997e-004 | K24: 11.49 | L24: 2.1299999999999999e-002 | M24: 121.7 | N24: 21.24 | O24: 0.93900000000000006 | P24: 54.1 | Q24: 已到 | R24: 4.65年 | S24: 2.65年 | T24: 3 | U24: 2.5 | V24: 8.0000000000000002e-003 | W24: 0.16600000000000001 | X24: 8.9999999999999997e-002 | Y24: 18 | Z24: 1.72 | AA24: 3.3300000000000003e-002 | AB24: 2.5000000000000001e-002 | AC24: -2.3e-003 | AD24: -5.1000000000000004e-003 | AE24: 88.16 | AF24: 92.71 | AG24: 0.12 | AH24: AA- | AI24: 6.1799999999999994e-002 | AJ24: =H24+100*O24 -> 198.77000000000001 | AK24: 155.6 | AL24: 215 | AM24: 62.9 | AN24: 218 | AO24: -1.4999999999999999e-002 | AP24: 21 | AQ24: 瀛通转债!
A25: 277 | B25: 128069 | C25: 华森转债! | D25: 2907 | E25: 华森制药 | F25: 医药 | G25: 化学制药 | H25: 106.495 | I25: -2.5000000000000001e-003 | J25: 2.5000000000000001e-003 | K25: 11.27 | L25: 0. | M25: 119.3 | N25: 18.01 | O25: 0.70200000000000007 | P25: 62.58 | Q25: 已到 | R25: 3.63年 | S25: 1.63年 | T25: 3 | U25: 1.6 | V25: 5.0000000000000001e-003 | W25: 6.6000000000000003e-002 | X25: 4.0999999999999995e-002 | Y25: 45 | Z25: 3.82 | AA25: 3.2400000000000005e-002 | AB25: 2.2799999999999997e-002 | AC25: -1.9599999999999999e-002 | AD25: -2.2599999999999999e-002 | AE25: 92.38 | AF25: 96.36 | AG25: 0.13 | AH25: AA- | AI25: 6.1799999999999994e-002 | AJ25: =H25+100*O25 -> 176.69499999999999 | AK25: 150.4 | AL25: 183 | AM25: 54.1 | AN25: 158 | AO25: -3.3000000000000002e-002 | AP25: 41 | AQ25: 华森转债!
A26: 205 | B26: 123049 | C26: 维尔转债! | D26: 300190 | E26: 维尔利 | F26: 城市公用 | G26: 三废处理 | H26: 108.845 | I26: -1.1000000000000001e-002 | J26: 8.8000000000000005e-003 | K26: 5.36 | L26: -7.4000000000000003e-003 | M26: 124.3 | N26: 7.38 | O26: 0.499 | P26: 72.63 | Q26: 已到 | R26: 4.43年 | S26: 2.43年 | T26: 9.17 | U26: 3.9 | V26: 4.0000000000000001e-003 | W26: 0.21899999999999997 | X26: 0.159 | Y26: 42 | Z26: 0.96 | AA26: 3.1200000000000002e-002 | AB26: 2.1600000000000001e-002 | AC26: -1.67e-002 | AD26: -1.9799999999999998e-002 | AE26: 89.35 | AF26: 95.93 | AG26: 0.29 | AH26: AA- | AI26: 6.1799999999999994e-002 | AJ26: =H26+100*O26 -> 158.745 | AK26: 145.1 | AL26: 134 | AM26: 49.1 | AN26: 122 | AO26: -9.9000000000000005e-002 | AP26: 19 | AQ26: 维尔转债!
A27: 182 | B27: 127018 | C27: 本钢转债! | D27: 761 | E27: 本钢板材 | F27: 钢铁 | G27: 炼钢 | H27: 111.5 | I27: -7.0999999999999995e-003 | J27: -7.8000000000000005e-003 | K27: 4.1 | L27: -4.4299999999999999e-002 | M27: 128 | N27: 4.55 | O27: 0.23699999999999999 | P27: 90.11 | Q27: 已到 | R27: 4.64年 | S27: 2.64年 | T27: 56.3 | U27: 145 | V27: 2.3e-002 | W27: 0.33399999999999996 | X27: 0.30099999999999999 | Y27: 168 | Z27: 0.74 | AA27: 3.1099999999999999e-002 | AB27: 2.0799999999999999e-002 | AC27: -1.8600000000000002e-002 | AD27: -2.2400000000000003e-002 | AE27: 96.52 | AF27: 110.2 | AG27: 0.34 | AH27: AAA | AI27: 3.3799999999999997e-002 | AJ27: =H27+100*O27 -> 135.19999999999999 | AK27: 132.9 | AL27: 29 | AM27: 22.7 | AN27: 2 | AO27: -0.153 | AP27: 65 | AQ27: 本钢转债!
A28: 76 | B28: 113042 | C28: 上银转债! | D28: 601229 | E28: 上海银行 | F28: 金融 | G28: 银行行业 | H28: 103.66 | I28: -5.0000000000000001e-004 | J28: 5.0000000000000001e-004 | K28: 7.25 | L28: 0. | M28: 120.9 | N28: 10.63 | O28: 0.52000000000000002 | P28: 68.2 | Q28: 已到 | R28: 5.22年 | S28: 无权 | T28: 200 | U28: 224 | V28: 1.1000000000000001e-002 | W28: 0.19399999999999998 | X28: 0.13200000000000001 | Y28: 1030. | Z28: 0.57 | AA28: 3.0899999999999997e-002 | AB28: 2.3599999999999999e-002 | AC28: 无权 | AD28: 无权 | AE28: 无权 | AF28: 101.38 | AG28: 0.19 | AH28: AAA | AI28: 3.5400000000000001e-002 | AJ28: =H28+100*O28 -> 155.66 | AK28: 139.1 | AL28: 71 | AM28: 37.7 | AN28: 36 | AO28: -2.3e-002 | AP28: 13 | AQ28: 上银转债!
A29: 261 | B29: 110059 | C29: 浦发转债! | D29: 600000 | E29: 浦发银行 | F29: 金融 | G29: 银行行业 | H29: 103.89 | I29: 1.8e-003 | J29: -1.6000000000000001e-003 | K29: 8.53 | L29: 2.3999999999999998e-003 | M29: 116.8 | N29: 13.97 | O29: 0.70099999999999996 | P29: 61.06 | Q29: 已到 | R29: 3.98年 | S29: 无权 | T29: 500 | U29: 320 | V29: 6.0000000000000001e-003 | W29: 0.20000000000000001 | X29: 0.122 | Y29: 2504. | Z29: 0.46 | AA29: 3.0699999999999998e-002 | AB29: 2.29e-002 | AC29: 无权 | AD29: 无权 | AE29: 无权 | AF29: 102.7 | AG29: 0.08 | AH29: AAA | AI29: 3.3799999999999997e-002 | AJ29: =H29+100*O29 -> 173.99000000000001 | AK29: 146.7 | AL29: 151 | AM29: 44 | AN29: 83 | AO29: -4.7e-002 | AP29: 57 | AQ29: 浦发转债!
A30: 137 | B30: 128132 | C30: 交建转债! | D30: 2941 | E30: 新疆交建 | F30: 建筑 | G30: 建筑工程 | H30: 101.67 | I30: -2.0999999999999999e-003 | J30: 8.9999999999999998e-004 | K30: 10.48 | L30: -1.41e-002 | M30: 116.9 | N30: 18.53 | O30: 0.79799999999999993 | P30: 56.56 | Q30: 已到 | R30: 4.86年 | S30: 2.86年 | T30: 8.49 | U30: 10 | V30: 1.2e-002 | W30: 0.126 | X30: 7.0999999999999994e-002 | Y30: 68 | Z30: 2.61 | AA30: 2.9700000000000001e-002 | AB30: 2.3300000000000001e-002 | AC30: 5.6999999999999993e-003 | AD30: 3.4000000000000002e-003 | AE30: 91.71 | AF30: 96.61 | AG30: 0.08 | AH30: AA | AI30: 4.0800000000000003e-002 | AJ30: =H30+100*O30 -> 181.47 | AK30: 146.8 | AL30: 152 | AM30: 50.2 | AN30: 129 | AO30: -5.2000000000000005e-002 | AP30: 25 | AQ30: 交建转债!
A31: 184 | B31: 123056 | C31: 雪榕转债! | D31: 300511 | E31: 雪榕生物 | F31: 农业 | G31: 种植业 | H31: 106.098 | I31: -5.6000000000000008e-003 | J31: -2.3999999999999998e-003 | K31: 7.96 | L31: -3.1600000000000003e-002 | M31: 120.7 | N31: 11.77 | O31: 0.56899999999999995 | P31: 67.63 | Q31: 已到 | R31: 4.63年 | S31: 2.63年 | T31: 5.84 | U31: 18 | V31: 2.8999999999999998e-002 | W31: 0.16600000000000001 | X31: 0.11199999999999999 | Y31: 35 | Z31: 1.97 | AA31: 2.8900000000000002e-002 | AB31: 2.0899999999999998e-002 | AC31: -8.5000000000000006e-003 | AD31: -1.1000000000000001e-002 | AE31: 87.76 | AF31: 91.99 | AG31: 0.26 | AH31: AA- | AI31: 6.1799999999999994e-002 | AJ31: =H31+100*O31 -> 162.99799999999999 | AK31: 144.6 | AL31: 126 | AM31: 52.6 | AN31: 149 | AO31: 0.10199999999999999 | AP31: 18 | AQ31: 雪榕转债!
A32: 154 | B32: 128125 | C32: 华阳转债! | D32: 2949 | E32: 华阳国际 | F32: 建筑 | G32: 建筑工程 | H32: 103.488 | I32: 0. | J32: 5.9999999999999995e-004 | K32: 13.7 | L32: 4.4000000000000003e-003 | M32: 118.1 | N32: 25.39 | O32: 0.91799999999999993 | P32: 53.96 | Q32: 已到 | R32: 4.73年 | S32: 2.73年 | T32: 4.5 | U32: 2.3 | V32: 5.0000000000000001e-003 | W32: 0.16800000000000001 | X32: 8.9999999999999997e-002 | Y32: 27 | Z32: 1.99 | AA32: 2.8900000000000002e-002 | AB32: 2.1899999999999999e-002 | AC32: -2.0000000000000001e-004 | AD32: -2.5000000000000001e-003 | AE32: 87.08 | AF32: 89.45 | AG32: 0.13 | AH32: AA- | AI32: 6.1799999999999994e-002 | AJ32: =H32+100*O32 -> 195.28800000000001 | AK32: 153 | AL32: 200 | AM32: 63.6 | AN32: 222 | AO32: -1.2e-002 | AP32: 10 | AQ32: 华阳转债!
A33: 307 | B33: 113021 | C33: 中信转债! | D33: 601998 | E33: 中信银行 | F33: 金融 | G33: 银行行业 | H33: 107.7 | I33: 2.0000000000000001e-004 | J33: -2.0000000000000001e-004 | K33: 4.5 | L33: 0. | M33: 118 | N33: 6.73 | O33: 0.61099999999999999 | P33: 66.86 | Q33: 已到 | R33: 3.32年 | S33: 无权 | T33: 400 | U33: 9.8 | V33: 0. | W33: 0.182 | X33: 0.121 | Y33: 2202. | Z33: 0.44 | AA33: 2.8799999999999999e-002 | AB33: 1.8799999999999997e-002 | AC33: 无权 | AD33: 无权 | AE33: 无权 | AF33: 106.04 | AG33: 0.09 | AH33: AAA | AI33: 3.3799999999999997e-002 | AJ33: =H33+100*O33 -> 168.80000000000001 | AK33: 148.5 | AL33: 168 | AM33: 42.5 | AN33: 69 | AO33: -1.9e-002 | AP33: 39 | AQ33: 中信转债!
A34: 369 | B34: 127003 | C34: 海印转债! | D34: 861 | E34: 海印股份 | F34: 商业零售 | G34: 商场 | H34: 108.2 | I34: 8.0000000000000004e-004 | J34: -8.0000000000000004e-004 | K34: 1.99 | L34: 0. | M34: 110 | N34: 2.99 | O34: 0.626 | P34: 66.56 | Q34: 已到 | R34: 0.59年 | S34: 回售内 | T34: 6.74 | U34: 8.5 | V34: 1.2e-002 | W34: 0.14599999999999999 | X34: 9.6999999999999989e-002 | Y34: 46 | Z34: 1.26 | AA34: 2.8500000000000001e-002 | AB34: -3.0999999999999999e-003 | AC34: 回售内 | AD34: 回售内 | AE34: 100.33 | AF34: 107.74 | AG34: 0.01 | AH34: AA | AI34: 3.6000000000000004e-002 | AJ34: =H34+100*O34 -> 170.80000000000001 | AK34: 149.8 | AL34: 178 | AM34: 42.1 | AN34: 67 | AO34: -5.0999999999999997e-002 | AP34: 71 | AQ34: 海印转债!
A35: 284 | B35: 128066 | C35: 亚泰转债! | D35: 2811 | E35: 郑中设计 | F35: 建筑 | G35: 装饰工程 | H35: 106.265 | I35: 2.5000000000000001e-003 | J35: -1.e-003 | K35: 7.91 | L35: 3.8e-003 | M35: 116.7 | N35: 9.27 | O35: 0.245 | P35: 85.33 | Q35: 已到 | R35: 3.44年 | S35: 1.44年 | T35: 4.8 | U35: 2.3 | V35: 5.0000000000000001e-003 | W35: 0.22500000000000001 | X35: 0.192 | Y35: 21 | Z35: 1.54 | AA35: 2.8199999999999999e-002 | AB35: 1.9299999999999998e-002 | AC35: -1.9199999999999998e-002 | AD35: -2.2799999999999997e-002 | AE35: 93.64 | AF35: 95.37 | AG35: 0.4 | AH35: AA- | AI35: 6.1799999999999994e-002 | AJ35: =H35+100*O35 -> 130.76499999999999 | AK35: 127.2 | AL35: 10 | AM35: 31.8 | AN35: 17 | AO35: -8.0000000000000002e-003 | AP35: 66 | AQ35: 亚泰转债!
A36: 222 | B36: 123044 | C36: 红相转债!! | D36: 300427 | E36: 红相股份 | F36: 能源电力 | G36: 电力设备 | H36: 111.26 | I36: -1.01e-002 | J36: 7.3000000000000001e-003 | K36: 13.16 | L36: -1.0500000000000001e-002 | M36: 125 | N36: 18.67 | O36: 0.57799999999999996 | P36: 70.49 | Q36: 已到 | R36: 4.35年 | S36: 2.35年 | T36: 5.5 | U36: 23 | V36: 3.7000000000000005e-002 | W36: 0.11599999999999999 | X36: 8.199999999999999e-002 | Y36: 47 | Z36: 2.01 | AA36: 2.7900000000000001e-002 | AB36: 1.8000000000000002e-002 | AC36: -2.4900000000000002e-002 | AD36: -2.8199999999999999e-002 | AE36: 90.08 | AF36: 97.02 | AG36: 0.26 | AH36: AA- | AI36: 6.1799999999999994e-002 | AJ36: =H36+100*O36 -> 169.06 | AK36: 152 | AL36: 194 | AM36: 55 | AN36: 161 | AO36: 2.7000000000000003e-002 | AP36: 22 | AQ36: 红相转债!!
A37: 155 | B37: 113597 | C37: 佳力转债! | D37: 603912 | E37: 佳力图 | F37: 机械装备 | G37: 专用设备 | H37: 109.25 | I37: -2.8999999999999998e-003 | J37: 1.6000000000000001e-003 | K37: 13.31 | L37: -8.8999999999999999e-003 | M37: 124 | N37: 23.15 | O37: 0.90000000000000002 | P37: 57.49 | Q37: 已到 | R37: 4.73年 | S37: 2.73年 | T37: 3 | U37: 2.7 | V37: 8.0000000000000002e-003 | W37: 0.10400000000000001 | X37: 5.9999999999999998e-002 | Y37: 29 | Z37: 3.01 | AA37: 2.7699999999999999e-002 | AB37: 1.89e-002 | AC37: -1.7299999999999999e-002 | AD37: -1.9799999999999998e-002 | AE37: 87.5 | AF37: 93.96 | AG37: 0.15 | AH37: AA- | AI37: 6.1799999999999994e-002 | AJ37: =H37+100*O37 -> 199.25 | AK37: 161 | AL37: 255 | AM37: 67 | AN37: 242 | AO37: -5.5e-002 | AP37: 18 | AQ37: 佳力转债!
A38: 74 | B38: 123096 | C38: 思创转债! | D38: 300078 | E38: 思创医惠 | F38: 通信互联 | G38: 物联网 | H38: 107.85 | I38: 2.8999999999999998e-003 | J38: 4.1999999999999997e-003 | K38: 6.34 | L38: 1.77e-002 | M38: 124 | N38: 8.27 | O38: 0.40700000000000003 | P38: 76.66 | Q38: 已到 | R38: 5.22年 | S38: 3.22年 | T38: 8.17 | U38: 4.9 | V38: 6.0000000000000001e-003 | W38: 0.14899999999999999 | X38: 0.114 | Y38: 55 | Z38: 2.01 | AA38: 2.7699999999999999e-002 | AB38: 1.9699999999999999e-002 | AC38: -1.1000000000000001e-002 | AD38: -1.32e-002 | AE38: 84.58 | AF38: 90.58 | AG38: 0.4 | AH38: AA- | AI38: 6.3399999999999998e-002 | AJ38: =H38+100*O38 -> 148.55000000000001 | AK38: 139 | AL38: 70 | AM38: 48.5 | AN38: 117 | AO38: -1.3999999999999999e-002 | AP38: 11 | AQ38: 思创转债!
A39: 3 | B39: 123126 | C39: 瑞丰转债! | D39: 300243 | E39: 瑞丰高材 | F39: 化工 | G39: 橡胶塑料 | H39: 111 | I39: -1.2999999999999999e-003 | J39: -2.3999999999999998e-003 | K39: 13.09 | L39: -8.3000000000000001e-003 | M39: 129.6 | N39: 17.8 | O39: 0.50900000000000001 | P39: 73.54 | Q39: 4月10天 | R39: 5.84年 | S39: 3.84年 | T39: 3.4 | U39: 7.4 | V39: 2.e-002 | W39: 0.11199999999999999 | X39: 8.199999999999999e-002 | Y39: 30 | Z39: 3.75 | AA39: 2.7699999999999999e-002 | AB39: 1.9099999999999999e-002 | AC39: -9.8999999999999991e-003 | AD39: -1.3100000000000001e-002 | AE39: 80.33 | AF39: 86.28 | AG39: 0.45 | AH39: A+ | AI39: 7.4400000000000008e-002 | AJ39: =H39+100*O39 -> 161.90000000000001 | AK39: 148.5 | AL39: 166 | AM39: 62.2 | AN39: 214 | AO39: -5.9000000000000004e-002 | AP39: 4 | AQ39: 瑞丰转债!
A40: 38 | B40: 127034 | C40: 绿茵转债! | D40: 2887 | E40: 绿茵生态 | F40: 城市公用 | G40: 生态环境 | H40: 102.846 | I40: 0. | J40: -3.3e-003 | K40: 9.07 | L40: -7.7000000000000002e-003 | M40: 119 | N40: 12.38 | O40: 0.40399999999999997 | P40: 73.26 | Q40: 5.5天 | R40: 5.48年 | S40: 3.48年 | T40: 7.12 | U40: 5 | V40: 6.9999999999999993e-003 | W40: 0.252 | X40: 0.184 | Y40: 28 | Z40: 1.38 | AA40: 2.76e-002 | AB40: 2.1299999999999999e-002 | AC40: 2.8999999999999998e-003 | AD40: 8.0000000000000004e-004 | AE40: 83.25 | AF40: 85.59 | AG40: 0.43 | AH40: AA- | AI40: 6.3399999999999998e-002 | AJ40: =H40+100*O40 -> 143.24600000000001 | AK40: 132.4 | AL40: 25 | AM40: 46.8 | AN40: 102 | AO40: -6.7000000000000004e-002 | AP40: 31 | AQ40: 绿茵转债!
A41: 111 | B41: 123076 | C41: 强力转债! | D41: 300429 | E41: 强力新材 | F41: 化工 | G41: 化工 | H41: 103.66 | I41: -1.2999999999999999e-003 | J41: -1.7000000000000001e-003 | K41: 12 | L41: -1.23e-002 | M41: 118.5 | N41: 18.94 | O41: 0.63600000000000001 | P41: 63.36 | Q41: 已到 | R41: 5年13天 | S41: 3年13天 | T41: 8.5 | U41: 7 | V41: 8.0000000000000002e-003 | W41: 0.13699999999999998 | X41: 8.6999999999999994e-002 | Y41: 62 | Z41: 3.42 | AA41: 2.75e-002 | AB41: 2.0799999999999999e-002 | AC41: 5.0000000000000001e-004 | AD41: -1.8e-003 | AE41: 85.48 | AF41: 87.57 | AG41: 0.25 | AH41: AA- | AI41: 6.3399999999999998e-002 | AJ41: =H41+100*O41 -> 167.25999999999999 | AK41: 144 | AL41: 121 | AM41: 56.4 | AN41: 169 | AO41: 2.1000000000000001e-002 | AP41: 19 | AQ41: 强力转债!
A42: 132 | B42: 113604 | C42: 多伦转债! | D42: 603528 | E42: 多伦科技 | F42: 计算机及 | G42: 软件开发 | H42: 102.91 | I42: -2.5000000000000001e-003 | J42: 4.6999999999999993e-003 | K42: 6.37 | L42: 9.4999999999999998e-003 | M42: 116.9 | N42: 10.4 | O42: 0.68000000000000005 | P42: 61.25 | Q42: 已到 | R42: 4.93年 | S42: 2.93年 | T42: 6.4 | U42: 3.7 | V42: 6.0000000000000001e-003 | W42: 0.16 | X42: 9.8000000000000004e-002 | Y42: 40 | Z42: 2.44 | AA42: 2.6699999999999998e-002 | AB42: 2.0400000000000001e-002 | AC42: 1.6000000000000001e-003 | AD42: -5.9999999999999995e-004 | AE42: 85.99 | AF42: 87.45 | AG42: 0.23 | AH42: AA- | AI42: 6.1799999999999994e-002 | AJ42: =H42+100*O42 -> 170.91 | AK42: 144.6 | AL42: 128 | AM42: 57.1 | AN42: 179 | AO42: -7.6999999999999999e-002 | AP42: 9 | AQ42: 多伦转债!
A43: 193 | B43: 113584 | C43: 家悦转债! | D43: 603708 | E43: 家家悦 | F43: 商业零售 | G43: 超市 | H43: 102.15 | I43: 1.5e-003 | J43: -1.6000000000000001e-003 | K43: 15.3 | L43: -1.1599999999999999e-002 | M43: 114.9 | N43: 37.53 | O43: 1.51 | P43: 40.77 | Q43: 已到 | R43: 4.58年 | S43: 2.58年 | T43: 6.45 | U43: 5.2 | V43: 8.0000000000000002e-003 | W43: 6.9000000000000006e-002 | X43: 2.7999999999999997e-002 | Y43: 93 | Z43: 3.63 | AA43: 2.6600000000000002e-002 | AB43: 2.0499999999999997e-002 | AC43: 4.5000000000000005e-003 | AD43: 2.0999999999999999e-003 | AE43: 92.75 | AF43: 96.03 | AG43: 0.01 | AH43: AA | AI43: 4.0800000000000003e-002 | AJ43: =H43+100*O43 -> 253.15000000000001 | AK43: 163.5 | AL43: 265 | AM43: 67.5 | AN43: 246 | AO43: 1.6e-002 | AP43: 16 | AQ43: 家悦转债!
A44: 214 | B44: 113033 | C44: 利群转债! | D44: 601366 | E44: 利群股份 | F44: 商业零售 | G44: 商场 | H44: 102.74 | I44: 5.9999999999999995e-004 | J44: 7.000000000000001e-004 | K44: 6.02 | L44: 3.3e-003 | M44: 114.9 | N44: 7.01 | O44: 0.19600000000000001 | P44: 85.88 | Q44: 已到 | R44: 4.40年 | S44: 2.40年 | T44: 18 | U44: 14 | V44: 8.0000000000000002e-003 | W44: 0.34700000000000003 | X44: 0.29799999999999999 | Y44: 52 | Z44: 1.18 | AA44: 2.63e-002 | AB44: 2.e-002 | AC44: 2.5000000000000001e-003 | AD44: -1.e-004 | AE44: 93.41 | AF44: 96.72 | AG44: 0.39 | AH44: AA | AI44: 4.0800000000000003e-002 | AJ44: =H44+100*O44 -> 122.34 | AK44: 119.6 | AL44: 3 | AM44: 22.9 | AN44: 3 | AO44: -2.4e-002 | AP44: 71 | AQ44: 利群转债!
A45: 319 | B45: 128049 | C45: 华源转债! | D45: 2787 | E45: 华源控股 | F45: 造纸包装 | G45: 包装材料 | H45: 106.155 | I45: -8.9999999999999998e-004 | J45: -2.2000000000000001e-003 | K45: 5.35 | L45: -1.29e-002 | M45: 114.5 | N45: 7.37 | O45: 0.46200000000000002 | P45: 72.59 | Q45: 已到 | R45: 3年21天 | S45: 1年21天 | T45: 3.63 | U45: 0.8 | V45: 2.e-003 | W45: 0.215 | X45: 0.156 | Y45: 17 | Z45: 1.1 | AA45: 2.5699999999999997e-002 | AB45: 1.6799999999999999e-002 | AC45: -2.5899999999999999e-002 | AD45: -3.0299999999999997e-002 | AE45: 95.63 | AF45: 95.74 | AG45: 0.24 | AH45: AA- | AI45: 6.1799999999999994e-002 | AJ45: =H45+100*O45 -> 152.35500000000002 | AK45: 139.7 | AL45: 78 | AM45: 44 | AN45: 81 | AO45: -1.9e-002 | AP45: 42 | AQ45: 华源转债!
A46: 283 | B46: 113535 | C46: 大业转债! | D46: 603278 | E46: 大业股份 | F46: 汽车 | G46: 零部件制 | H46: 105.66 | I46: 2.8999999999999998e-003 | J46: -3.4999999999999996e-003 | K46: 8.18 | L46: -7.3000000000000001e-003 | M46: 112.5 | N46: 12.29 | O46: 0.58700000000000008 | P46: 66.56 | Q46: 已到 | R46: 2.50年 | S46: 0.50年 | T46: 5 | U46: 3.1 | V46: 6.0000000000000001e-003 | W46: 0.21100000000000002 | X46: 0.14000000000000001 | Y46: 24 | Z46: 1.33 | AA46: 2.5699999999999997e-002 | AB46: 1.6399999999999998e-002 | AC46: -6.1699999999999998e-002 | AD46: -6.5099999999999991e-002 | AE46: 98.66 | AF46: 102.25 | AG46: 0.08 | AH46: AA | AI46: 3.9399999999999998e-002 | AJ46: =H46+100*O46 -> 164.36000000000001 | AK46: 144.8 | AL46: 131 | AM46: 42.5 | AN46: 70 | AO46: -9.1999999999999998e-002 | AP46: 47 | AQ46: 大业转债!
A47: 217 | B47: 110068 | C47: 龙净转债! | D47: 600388 | E47: 龙净环保 | F47: 城市公用 | G47: 三废处理 | H47: 102.95 | I47: -5.0000000000000001e-004 | J47: 5.0000000000000001e-004 | K47: 7.86 | L47: 0. | M47: 114.8 | N47: 10.55 | O47: 0.38200000000000001 | P47: 74.5 | Q47: 已到 | R47: 4.38年 | S47: 2.38年 | T47: 20 | U47: 36 | V47: 1.8000000000000002e-002 | W47: 0.23800000000000002 | X47: 0.17699999999999999 | Y47: 84 | Z47: 1.3 | AA47: 2.5699999999999997e-002 | AB47: 1.9400000000000001e-002 | AC47: 1.4000000000000002e-003 | AD47: -1.1999999999999999e-003 | AE47: 94.53 | AF47: 98.72 | AG47: 0.23 | AH47: AA+ | AI47: 3.5799999999999998e-002 | AJ47: =H47+100*O47 -> 141.15000000000001 | AK47: 131.4 | AL47: 19 | AM47: 32.7 | AN47: 21 | AO47: -4.9000000000000002e-002 | AP47: 37 | AQ47: 龙净转债!
A48: 230 | B48: 113566 | C48: 翔港转债! | D48: 603499 | E48: 翔港科技 | F48: 造纸包装 | G48: 包装材料 | H48: 111.47 | I48: -1.1000000000000001e-003 | J48: 1.5e-003 | K48: 7.38 | L48: 1.4000000000000002e-003 | M48: 124 | N48: 10.77 | O48: 0.627 | P48: 68.52 | Q48: 已到 | R48: 4.31年 | S48: 2.31年 | T48: 1.61 | U48: 1.1 | V48: 6.0000000000000001e-003 | W48: 0.109 | X48: 7.400000000000001e-002 | Y48: 15 | Z48: 2.61 | AA48: 2.5600000000000001e-002 | AB48: 1.6e-002 | AC48: -2.7300000000000001e-002 | AD48: -3.04e-002 | AE48: 87.73 | AF48: 92.3 | AG48: 0.29 | AH48: A+ | AI48: 7.2800000000000004e-002 | AJ48: =H48+100*O48 -> 174.17000000000002 | AK48: 154.4 | AL48: 208 | AM48: 62.1 | AN48: 212 | AO48: 2.e-002 | AP48: 27 | AQ48: 翔港转债!
A49: 39 | B49: 113624 | C49: 正川转债! | D49: 603976 | E49: 正川股份 | F49: 医药 | G49: 医药行业 | H49: 106.3 | I49: -5.1999999999999998e-003 | J49: -4.8999999999999998e-003 | K49: 33.62 | L49: -2.2700000000000001e-002 | M49: 121.6 | N49: 46.69 | O49: 0.47600000000000003 | P49: 72.01 | Q49: 2.5天 | R49: 5.47年 | S49: 3.47年 | T49: 4.05 | U49: 8 | V49: 1.9e-002 | W49: 8.0000000000000002e-002 | X49: 5.7000000000000002e-002 | Y49: 51 | Z49: 4.61 | AA49: 2.5499999999999998e-002 | AB49: 1.8500000000000003e-002 | AC49: -4.5000000000000005e-003 | AD49: -6.8999999999999999e-003 | AE49: 80.82 | AF49: 82.9 | AG49: 0.45 | AH49: A+ | AI49: 7.4400000000000008e-002 | AJ49: =H49+100*O49 -> 153.90000000000001 | AK49: 140.6 | AL49: 87 | AM49: 57.7 | AN49: 183 | AO49: 6.2e-002 | AP49: 19 | AQ49: 正川转债!
A50: 352 | B50: 123004 | C50: 铁汉转债! | D50: 300197 | E50: 节能铁汉 | F50: 城市公用 | G50: 生态环境 | H50: 103.531 | I50: 2.9999999999999997e-004 | J50: -8.9999999999999998e-004 | K50: 2.75 | L50: -7.1999999999999998e-003 | M50: 108.8 | N50: 3.82 | O50: 0.43799999999999994 | P50: 71.99 | Q50: 已到 | R50: 2年42天 | S50: 42天 | T50: 8.03 | U50: 11 | V50: 1.3000000000000001e-002 | W50: 0.10300000000000001 | X50: 7.400000000000001e-002 | Y50: 78 | Z50: 1.21 | AA50: 2.4199999999999999e-002 | AB50: 1.61e-002 | AC50: -6.6699999999999995e-002 | AD50: -7.6700000000000004e-002 | AE50: 100.46 | AF50: 100.41 | AG50: 0.08 | AH50: AA | AI50: 3.9399999999999998e-002 | AJ50: =H50+100*O50 -> 147.33100000000002 | AK50: 135.1 | AL50: 39 | AM50: 34.6 | AN50: 27 | AO50: -1.3999999999999999e-002 | AP50: 47 | AQ50: 铁汉转债!
A51: 176 | B51: 113036 | C51: 宁建转债! | D51: 601789 | E51: 宁波建工 | F51: 建筑 | G51: 建筑工程 | H51: 104.92 | I51: -3.0999999999999999e-003 | J51: 5.0000000000000001e-004 | K51: 3.46 | L51: -1.1399999999999999e-002 | M51: 116.9 | N51: 4.76 | O51: 0.44299999999999995 | P51: 72.69 | Q51: 已到 | R51: 4.66年 | S51: 2.66年 | T51: 5.4 | U51: 1.2 | V51: 2.e-003 | W51: 0.16 | X51: 0.11599999999999999 | Y51: 34 | Z51: 1.04 | AA51: 2.3900000000000001e-002 | AB51: 1.7299999999999999e-002 | AC51: -5.1999999999999998e-003 | AD51: -7.4999999999999997e-003 | AE51: 92.43 | AF51: 97.37 | AG51: 0.23 | AH51: AA | AI51: 4.0800000000000003e-002 | AJ51: =H51+100*O51 -> 149.22 | AK51: 137.2 | AL51: 50 | AM51: 39.8 | AN51: 50 | AO51: -5.2999999999999999e-002 | AP51: 12 | AQ51: 宁建转债!
A52: 145 | B52: 113601 | C52: 塞力转债! | D52: 603716 | E52: 塞力医疗 | F52: 医药 | G52: 医药商业 | H52: 108.2 | I52: 0. | J52: -2.7000000000000001e-003 | K52: 13.22 | L52: -6.8000000000000005e-003 | M52: 120.8 | N52: 16.98 | O52: 0.39000000000000001 | P52: 77.86 | Q52: 已到 | R52: 4.79年 | S52: 2.79年 | T52: 5.43 | U52: 2.2 | V52: 4.0000000000000001e-003 | W52: 0.20000000000000001 | X52: 0.156 | Y52: 27 | Z52: 1.78 | AA52: 2.3799999999999998e-002 | AB52: 1.61e-002 | AC52: -1.43e-002 | AD52: -1.67e-002 | AE52: 87.03 | AF52: 91.21 | AG52: 0.4 | AH52: AA- | AI52: 6.1799999999999994e-002 | AJ52: =H52+100*O52 -> 147.19999999999999 | AK52: 138.5 | AL52: 65 | AM52: 47.3 | AN52: 107 | AO52: 1.7000000000000001e-002 | AP52: 37 | AQ52: 塞力转债!
A53: 286 | B53: 127013 | C53: 创维转债! | D53: 810 | E53: 创维数字 | F53: 电子 | G53: 电子产品 | H53: 108.568 | I53: 1.6000000000000001e-003 | J53: 1.6000000000000001e-003 | K53: 8.06 | L53: 2.2799999999999997e-002 | M53: 117.3 | N53: 11.29 | O53: 0.52100000000000002 | P53: 71.39 | Q53: 已到 | R53: 3.44年 | S53: 1.44年 | T53: 9.78 | U53: 24 | V53: 2.3e-002 | W53: 0.114 | X53: 8.1000000000000003e-002 | Y53: 86 | Z53: 2.02 | AA53: 2.3199999999999998e-002 | AB53: 1.41e-002 | AC53: -3.3700000000000001e-002 | AD53: -3.7000000000000005e-002 | AE53: 96.46 | AF53: 102.51 | AG53: 0.14 | AH53: AA | AI53: 4.0800000000000003e-002 | AJ53: =H53+100*O53 -> 160.66800000000001 | AK53: 145.7 | AL53: 141 | AM53: 43.2 | AN53: 76 | AO53: 0.122 | AP53: 24 | AQ53: 创维转债!
A54: 163 | B54: 113037 | C54: 紫银转债! | D54: 601860 | E54: 紫金银行 | F54: 金融 | G54: 银行行业 | H54: 104.11 | I54: -4.0000000000000001e-003 | J54: 2.0999999999999999e-003 | K54: 3.17 | L54: -6.3e-003 | M54: 115.6 | N54: 4.05 | O54: 0.33000000000000002 | P54: 78.27 | Q54: 已到 | R54: 4.71年 | S54: 无权 | T54: 45 | U54: 40 | V54: 8.0000000000000002e-003 | W54: 0.38799999999999996 | X54: 0.30299999999999999 | Y54: 116 | Z54: 0.76 | AA54: 2.3e-002 | AB54: 1.6899999999999998e-002 | AC54: 无权 | AD54: 无权 | AE54: 无权 | AF54: 98.31 | AG54: 0.3 | AH54: AA+ | AI54: 3.5799999999999998e-002 | AJ54: =H54+100*O54 -> 137.11000000000001 | AK54: 129.9 | AL54: 17 | AM54: 31.6 | AN54: 16 | AO54: -4.4000000000000004e-002 | AP54: 27 | AQ54: 紫银转债!
A55: 78 | B55: 123093 | C55: 金陵转债! | D55: 300651 | E55: 金陵体育 | F55: 其他 | G55: 文化教育 | H55: 115.449 | I55: -1.5e-003 | J55: -5.0000000000000001e-004 | K55: 25.89 | L55: -1.37e-002 | M55: 129.3 | N55: 49.19 | O55: 1.1899999999999999 | P55: 52.63 | Q55: 已到 | R55: 5.20年 | S55: 3.20年 | T55: 2.5 | U55: 8.7 | V55: 2.9999999999999999e-002 | W55: 7.4999999999999997e-002 | X55: 3.9e-002 | Y55: 33 | Z55: 4.79 | AA55: 2.2700000000000001e-002 | AB55: 1.3300000000000001e-002 | AC55: -2.4300000000000002e-002 | AD55: -2.7799999999999998e-002 | AE55: 83.86 | AF55: 90.09 | AG55: 0.15 | AH55: A+ | AI55: 7.4400000000000008e-002 | AJ55: =H55+100*O55 -> 234.44900000000001 | AK55: 178.3 | AL55: 304 | AM55: 88.2 | AN55: 305 | AO55: -4.4000000000000004e-002 | AP55: 9 | AQ55: 金陵转债!
A56: 28 | B56: 113625 | C56: 江山转债! | D56: 603208 | E56: 江山欧派 | F56: 其他 | G56: 家居用品 | H56: 109.66 | I56: 1.e-003 | J56: -2.8000000000000004e-003 | K56: 51.73 | L56: -1.1699999999999999e-002 | M56: 124 | N56: 96.33 | O56: 1.04 | P56: 53.7 | Q56: 42天 | R56: 5.59年 | S56: 3.59年 | T56: 5.83 | U56: 3.6 | V56: 6.0000000000000001e-003 | W56: 0.107 | X56: 5.7999999999999996e-002 | Y56: 54 | Z56: 2.96 | AA56: 2.2599999999999999e-002 | AB56: 1.5300000000000001e-002 | AC56: -1.43e-002 | AD56: -1.6299999999999999e-002 | AE56: 82.66 | AF56: 88.53 | AG56: 0.16 | AH56: AA- | AI56: 6.3399999999999998e-002 | AJ56: =H56+100*O56 -> 213.66 | AK56: 165.6 | AL56: 271 | AM56: 77.1 | AN56: 285 | AO56: -0.10300000000000001 | AP56: 5 | AQ56: 江山转债!
A57: 316 | B57: 113524 | C57: 奇精转债! | D57: 603677 | E57: 奇精机械 | F57: 家电 | G57: 零部件制 | H57: 109.65 | I57: -5.7999999999999996e-003 | J57: 5.7999999999999996e-003 | K57: 11.02 | L57: 0. | M57: 117.3 | N57: 13.98 | O57: 0.39100000000000001 | P57: 78.83 | Q57: 已到 | R57: 3年38天 | S57: 1年38天 | T57: 3.3 | U57: 3.4 | V57: 9.0000000000000011e-003 | W57: 0.156 | X57: 0.12300000000000001 | Y57: 21 | Z57: 2.08 | AA57: 2.2499999999999999e-002 | AB57: 1.24e-002 | AC57: -5.0000000000000003e-002 | AD57: -5.4000000000000006e-002 | AE57: 95.34 | AF57: 97.79 | AG57: 0.29 | AH57: AA- | AI57: 6.1799999999999994e-002 | AJ57: =H57+100*O57 -> 148.75 | AK57: 140.5 | AL57: 85 | AM57: 42.7 | AN57: 72 | AO57: -8.0000000000000002e-003 | AP57: 42 | AQ57: 奇精转债!
A58: 213 | B58: 127016 | C58: 鲁泰转债! | D58: 726 | E58: 鲁 泰Ａ | F58: 服装纺织 | G58: 纺织行业 | H58: 105.45 | I58: -7.000000000000001e-004 | J58: -1.e-004 | K58: 6.15 | L58: -4.8999999999999998e-003 | M58: 115.9 | N58: 8.71 | O58: 0.49299999999999999 | P58: 70.61 | Q58: 已到 | R58: 4.42年 | S58: 2.42年 | T58: 14 | U58: 2.4 | V58: 2.e-003 | W58: 0.25800000000000001 | X58: 0.182 | Y58: 54 | Z58: 0.69 | AA58: 2.2099999999999998e-002 | AB58: 1.55e-002 | AC58: -7.6e-003 | AD58: -1.01e-002 | AE58: 94.49 | AF58: 99.53 | AG58: 0.17 | AH58: AA+ | AI58: 3.5799999999999998e-002 | AJ58: =H58+100*O58 -> 154.75 | AK58: 140.3 | AL58: 82 | AM58: 40.8 | AN58: 57 | AO58: 1.8000000000000002e-002 | AP58: 22 | AQ58: 鲁泰转债!
A59: 167 | B59: 113594 | C59: 淳中转债! | D59: 603516 | E59: 淳中科技 | F59: 电子 | G59: 电子产品 | H59: 109.38 | I59: 1.2999999999999999e-003 | J59: 3.9000000000000003e-003 | K59: 16.98 | L59: 2.1700000000000001e-002 | M59: 120.9 | N59: 27.84 | O59: 0.79299999999999993 | P59: 60.99 | Q59: 已到 | R59: 4.70年 | S59: 2.70年 | T59: 3 | U59: 2.8 | V59: 9.0000000000000011e-003 | W59: 9.5000000000000001e-002 | X59: 5.7999999999999996e-002 | Y59: 32 | Z59: 3.27 | AA59: 2.2000000000000002e-002 | AB59: 1.4199999999999999e-002 | AC59: -1.7299999999999999e-002 | AD59: -2.e-002 | AE59: 85.24 | AF59: 87.54 | AG59: 0.24 | AH59: A+ | AI59: 7.2800000000000004e-002 | AJ59: =H59+100*O59 -> 188.68000000000001 | AK59: 157.8 | AL59: 229 | AM59: 70.2 | AN59: 260 | AO59: -1.3999999999999999e-002 | AP59: 9 | AQ59: 淳中转债!
A60: 292 | B60: 113532 | C60: 海环转债! | D60: 603817 | E60: 海峡环保 | F60: 城市公用 | G60: 三废处理 | H60: 104.47 | I60: 2.e-003 | J60: -1.2999999999999999e-003 | K60: 5.53 | L60: 3.5999999999999999e-003 | M60: 112.3 | N60: 7.63 | O60: 0.441 | P60: 72.48 | Q60: 已到 | R60: 3.40年 | S60: 1.40年 | T60: 4.59 | U60: 2.2 | V60: 5.0000000000000001e-003 | W60: 0.184 | X60: 0.13400000000000001 | Y60: 25 | Z60: 1.37 | AA60: 2.1899999999999999e-002 | AB60: 1.5100000000000001e-002 | AC60: -1.03e-002 | AD60: -1.37e-002 | AE60: 96.6 | AF60: 98.3 | AG60: 0.19 | AH60: AA | AI60: 4.0800000000000003e-002 | AJ60: =H60+100*O60 -> 148.56999999999999 | AK60: 136.5 | AL60: 46 | AM60: 38.2 | AN60: 38 | AO60: -2.6000000000000002e-002 | AP60: 29 | AQ60: 海环转债!
A61: 151 | B61: 127021 | C61: 特发转2! | D61: 70 | E61: 特发信息 | F61: 通信互联 | G61: 通信设备 | H61: 104.37 | I61: -4.0999999999999995e-003 | J61: 4.1999999999999997e-003 | K61: 6.18 | L61: 1.6000000000000001e-003 | M61: 113 | N61: 12.33 | O61: 1.0800000000000001 | P61: 50.12 | Q61: 已到 | R61: 3.75年 | S61: 1.75年 | T61: 5.5 | U61: 1.2 | V61: 2.e-003 | W61: 0.10800000000000001 | X61: 5.4000000000000006e-002 | Y61: 51 | Z61: 1.76 | AA61: 2.1700000000000001e-002 | AB61: 1.52e-002 | AC61: -1.32e-002 | AD61: -1.4999999999999999e-002 | AE61: 94.27 | AF61: 97.44 | AG61: 0.03 | AH61: AA | AI61: 4.0800000000000003e-002 | AJ61: =H61+100*O61 -> 212.37 | AK61: 158.6 | AL61: 237 | AM61: 61.2 | AN61: 206 | AO61: -3.6000000000000004e-002 | AP61: 14 | AQ61: 特发转2!
A62: 211 | B62: 128105 | C62: 长集转债! | D62: 2616 | E62: 长青集团 | F62: 城市公用 | G62: 三废处理 | H62: 104.771 | I62: -4.0999999999999995e-003 | J62: 2.0000000000000001e-004 | K62: 5.45 | L62: -1.9799999999999998e-002 | M62: 114.9 | N62: 7.91 | O62: 0.52100000000000002 | P62: 68.9 | Q62: 已到 | R62: 4.42年 | S62: 2.42年 | T62: 8 | U62: 7.9 | V62: 9.0000000000000011e-003 | W62: 0.19800000000000001 | X62: 0.13600000000000001 | Y62: 40 | Z62: 1.62 | AA62: 2.1499999999999998e-002 | AB62: 1.5300000000000001e-002 | AC62: -5.1000000000000004e-003 | AD62: -7.6e-003 | AE62: 93.33 | AF62: 96.64 | AG62: 0.2 | AH62: AA | AI62: 4.0800000000000003e-002 | AJ62: =H62+100*O62 -> 156.87100000000001 | AK62: 140.6 | AL62: 88 | AM62: 44 | AN62: 82 | AO62: -8.6999999999999994e-002 | AP62: 18 | AQ62: 长集转债!
A63: 250 | B63: 128083 | C63: 新北转债! | D63: 2376 | E63: 新北洋 | F63: 电子 | G63: 电子产品 | H63: 105.7 | I63: -2.7000000000000001e-003 | J63: 3.2000000000000002e-003 | K63: 8.12 | L63: 2.5000000000000001e-003 | M63: 114.9 | N63: 11.45 | O63: 0.48999999999999999 | P63: 70.92 | Q63: 已到 | R63: 4年36天 | S63: 2年36天 | T63: 8.77 | U63: 6.1 | V63: 6.9999999999999993e-003 | W63: 0.16200000000000001 | X63: 0.115 | Y63: 54 | Z63: 1.6 | AA63: 2.1000000000000001e-002 | AB63: 1.43e-002 | AC63: -9.7999999999999997e-003 | AD63: -1.2699999999999999e-002 | AE63: 94.55 | AF63: 97.89 | AG63: 0.2 | AH63: AA | AI63: 4.0800000000000003e-002 | AJ63: =H63+100*O63 -> 154.69999999999999 | AK63: 140.5 | AL63: 86 | AM63: 42.6 | AN63: 71 | AO63: 1.4999999999999999e-002 | AP63: 20 | AQ63: 新北转债!
A64: 243 | B64: 123039 | C64: 开润转债! | D64: 300577 | E64: 开润股份 | F64: 服装纺织 | G64: 纺织行业 | H64: 111.255 | I64: -4.5999999999999999e-003 | J64: 6.1999999999999998e-003 | K64: 21.3 | L64: 5.1999999999999998e-003 | M64: 121 | N64: 29.92 | O64: 0.56299999999999994 | P64: 71.19 | Q64: 已到 | R64: 4年50天 | S64: 2年50天 | T64: 2.22 | U64: 5.4 | V64: 2.2000000000000002e-002 | W64: 4.2999999999999997e-002 | X64: 3.1e-002 | Y64: 51 | Z64: 3.17 | AA64: 2.1000000000000001e-002 | AB64: 1.21e-002 | AC64: -2.8900000000000002e-002 | AD64: -3.2199999999999999e-002 | AE64: 88.73 | AF64: 91.18 | AG64: 0.31 | AH64: A+ | AI64: 7.2800000000000004e-002 | AJ64: =H64+100*O64 -> 167.55500000000001 | AK64: 151.3 | AL64: 189 | AM64: 60.1 | AN64: 202 | AO64: -1.4999999999999999e-002 | AP64: 23 | AQ64: 开润转债!
A65: 160 | B65: 128123 | C65: 国光转债! | D65: 2749 | E65: 国光股份 | F65: 化工 | G65: 农化 | H65: 105.12 | I65: -9.1999999999999998e-003 | J65: 1.03e-002 | K65: 8.28 | L65: 4.8999999999999998e-003 | M65: 115.7 | N65: 13.49 | O65: 0.71299999999999997 | P65: 61.38 | Q65: 已到 | R65: 4.72年 | S65: 2.72年 | T65: 3.2 | U65: 1.2 | V65: 3.0000000000000001e-003 | W65: 8.900000000000001e-002 | X65: 5.4000000000000006e-002 | Y65: 36 | Z65: 2.75 | AA65: 2.1000000000000001e-002 | AB65: 1.4800000000000001e-002 | AC65: -5.0000000000000001e-003 | AD65: -7.4000000000000003e-003 | AE65: 87.29 | AF65: 87.73 | AG65: 0.22 | AH65: AA- | AI65: 6.1799999999999994e-002 | AJ65: =H65+100*O65 -> 176.42000000000002 | AK65: 148.9 | AL65: 170 | AM65: 61.1 | AN65: 204 | AO65: -3.7000000000000005e-002 | AP65: 12 | AQ65: 国光转债!
A66: 56 | B66: 123106 | C66: 正丹转债! | D66: 300641 | E66: 正丹股份 | F66: 化工 | G66: 化工 | H66: 112.701 | I66: -2.5000000000000001e-003 | J66: -1.9e-003 | K66: 6.26 | L66: -9.4999999999999998e-003 | M66: 125.5 | N66: 7.5 | O66: 0.34999999999999998 | P66: 83.47 | Q66: 已到 | R66: 5.38年 | S66: 3.38年 | T66: 3.2 | U66: 8.6 | V66: 2.4e-002 | W66: 0.10400000000000001 | X66: 8.6999999999999994e-002 | Y66: 31 | Z66: 2.14 | AA66: 2.06e-002 | AB66: 1.26e-002 | AC66: -2.3099999999999999e-002 | AD66: -2.5099999999999997e-002 | AE66: 83.7 | AF66: 90.77 | AG66: 0.47 | AH66: AA- | AI66: 6.3399999999999998e-002 | AJ66: =H66+100*O66 -> 147.70099999999999 | AK66: 141.9 | AL66: 103 | AM66: 51.2 | AN66: 138 | AO66: -8.6999999999999994e-002 | AP66: 16 | AQ66: 正丹转债!
A67: 109 | B67: 123077 | C67: 汉得转债! | D67: 300170 | E67: 汉得信息 | F67: 计算机及 | G67: 软件开发 | H67: 113.88 | I67: 4.1999999999999997e-003 | J67: 2.0000000000000001e-004 | K67: 7.63 | L67: 1.6e-002 | M67: 125.5 | N67: 9.69 | O67: 0.44600000000000001 | P67: 78.74 | Q67: 已到 | R67: 5年17天 | S67: 3年17天 | T67: 9.37 | U67: 34 | V67: 3.1e-002 | W67: 0.13900000000000001 | X67: 0.109 | Y67: 67 | Z67: 2.15 | AA67: 1.9799999999999998e-002 | AB67: 1.1299999999999999e-002 | AC67: -2.86e-002 | AD67: -3.0800000000000001e-002 | AE67: 91.01 | AF67: 102.22 | AG67: 0.28 | AH67: AA | AI67: 4.24e-002 | AJ67: =H67+100*O67 -> 158.47999999999999 | AK67: 149 | AL67: 171 | AM67: 46.8 | AN67: 101 | AO67: 7.5999999999999998e-002 | AP67: 16 | AQ67: 汉得转债!
A68: 139 | B68: 123065 | C68: 宝莱转债! | D68: 300246 | E68: 宝莱特 | F68: 医药 | G68: 医疗器械 | H68: 110.479 | I68: 2.5999999999999999e-003 | J68: -3.0000000000000001e-003 | K68: 16.64 | L68: -9.4999999999999998e-003 | M68: 121 | N68: 40.14 | O68: 1.6699999999999999 | P68: 41.45 | Q68: 已到 | R68: 4.83年 | S68: 2.83年 | T68: 2.19 | U68: 6.4 | V68: 2.6000000000000002e-002 | W68: 8.9999999999999997e-002 | X68: 3.7000000000000005e-002 | Y68: 24 | Z68: 2.79 | AA68: 1.9400000000000001e-002 | AB68: 1.18e-002 | AC68: -2.0400000000000001e-002 | AD68: -2.2799999999999997e-002 | AE68: 86.99 | AF68: 91.16 | AG68: 0.04 | AH68: AA- | AI68: 6.1799999999999994e-002 | AJ68: =H68+100*O68 -> 277.47899999999998 | AK68: 179.5 | AL68: 307 | AM68: 88.3 | AN68: 306 | AO68: -3.9e-002 | AP68: 20 | AQ68: 宝莱转债!
A69: 172 | B69: 123059 | C69: 银信转债! | D69: 300231 | E69: 银信科技 | F69: 计算机及 | G69: 软件开发 | H69: 113.483 | I69: 1.2500000000000001e-002 | J69: -1.3000000000000001e-002 | K69: 7.85 | L69: -1.2999999999999999e-003 | M69: 123.7 | N69: 9.72 | O69: 0.40500000000000003 | P69: 80.76 | Q69: 已到 | R69: 4.69年 | S69: 2.69年 | T69: 3.91 | U69: 6.1 | V69: 1.3999999999999999e-002 | W69: 0.113 | X69: 9.0999999999999998e-002 | Y69: 35 | Z69: 2.48 | AA69: 1.89e-002 | AB69: 1.03e-002 | AC69: -3.1600000000000003e-002 | AD69: -3.39e-002 | AE69: 87.46 | AF69: 93.94 | AG69: 0.4 | AH69: AA- | AI69: 6.1799999999999994e-002 | AJ69: =H69+100*O69 -> 153.983 | AK69: 146.2 | AL69: 147 | AM69: 52.3 | AN69: 147 | AO69: -1.7000000000000001e-002 | AP69: 18 | AQ69: 银信转债!
A70: 235 | B70: 113563 | C70: 柳药转债! | D70: 603368 | E70: 柳药股份 | F70: 医药 | G70: 医药商业 | H70: 104.63 | I70: 1.8e-003 | J70: -1.9e-003 | K70: 15.48 | L70: -5.9999999999999995e-004 | M70: 112.9 | N70: 23.87 | O70: 0.61299999999999999 | P70: 64.85 | Q70: 已到 | R70: 4.19年 | S70: 2.19年 | T70: 8.02 | U70: 1.1 | V70: 1.e-003 | W70: 0.14300000000000002 | X70: 9.3000000000000013e-002 | Y70: 56 | Z70: 1.07 | AA70: 1.8700000000000001e-002 | AB70: 1.29e-002 | AC70: -5.1000000000000004e-003 | AD70: -7.8000000000000005e-003 | AE70: 94.18 | AF70: 95.83 | AG70: 0.14 | AH70: AA | AI70: 4.0800000000000003e-002 | AJ70: =H70+100*O70 -> 165.93000000000001 | AK70: 144.4 | AL70: 124 | AM70: 48.6 | AN70: 119 | AO70: -3.9e-002 | AP70: 17 | AQ70: 柳药转债!
A71: 106 | B71: 128139 | C71: 祥鑫转债! | D71: 2965 | E71: 祥鑫科技 | F71: 汽车 | G71: 零部件制 | H71: 110.502 | I71: 1.3600000000000001e-002 | J71: -7.9000000000000008e-003 | K71: 23.33 | L71: 2.41e-002 | M71: 121 | N71: 36.96 | O71: 0.75099999999999989 | P71: 63.12 | Q71: 已到 | R71: 5年25天 | S71: 3年25天 | T71: 6.47 | U71: 11 | V71: 1.6e-002 | W71: 0.184 | X71: 0.11599999999999999 | Y71: 35 | Z71: 2.02 | AA71: 1.8500000000000003e-002 | AB71: 1.1200000000000002e-002 | AC71: -1.9e-002 | AD71: -2.1299999999999999e-002 | AE71: 85.38 | AF71: 89.24 | AG71: 0.24 | AH71: AA- | AI71: 6.3399999999999998e-002 | AJ71: =H71+100*O71 -> 185.60199999999998 | AK71: 157.9 | AL71: 231 | AM71: 68.6 | AN71: 251 | AO71: -2.9999999999999999e-002 | AP71: 13 | AQ71: 祥鑫转债!
A72: 102 | B72: 123082 | C72: 北陆转债! | D72: 300016 | E72: 北陆药业 | F72: 医药 | G72: 化学制药 | H72: 111.221 | I72: -2.3999999999999998e-003 | J72: -2.e-003 | K72: 7.32 | L72: -8.1000000000000013e-003 | M72: 121.7 | N72: 8.81 | O72: 0.33899999999999997 | P72: 83.09 | Q72: 已到 | R72: 5年31天 | S72: 3年31天 | T72: 4.99 | U72: 3.6 | V72: 6.9999999999999993e-003 | W72: 0.13800000000000001 | X72: 0.115 | Y72: 36 | Z72: 2.1 | AA72: 1.83e-002 | AB72: 1.0800000000000001e-002 | AC72: -1.89e-002 | AD72: -2.1499999999999998e-002 | AE72: 83.13 | AF72: 85.32 | AG72: 0.53 | AH72: A+ | AI72: 7.4400000000000008e-002 | AJ72: =H72+100*O72 -> 145.12100000000001 | AK72: 139.4 | AL72: 75 | AM72: 54 | AN72: 157 | AO72: -0.11699999999999999 | AP72: 17 | AQ72: 北陆转债!
A73: 328 | B73: 128042 | C73: 凯中转债! | D73: 2823 | E73: 凯中精密 | F73: 能源电力 | G73: 电力设备 | H73: 109.999 | I73: 4.5000000000000005e-003 | J73: -4.6999999999999993e-003 | K73: 9.25 | L73: -1.1000000000000001e-003 | M73: 115.3 | N73: 12.86 | O73: 0.52900000000000003 | P73: 71.93 | Q73: 已到 | R73: 2.73年 | S73: 0.73年 | T73: 4.16 | U73: 4.6 | V73: 1.e-002 | W73: 0.156 | X73: 0.113 | Y73: 27 | Z73: 2.02 | AA73: 1.77e-002 | AB73: 7.4999999999999997e-003 | AC73: -8.3100000000000007e-002 | AD73: -8.6599999999999996e-002 | AE73: 98.35 | AF73: 103.93 | AG73: 0.11 | AH73: AA | AI73: 3.9399999999999998e-002 | AJ73: =H73+100*O73 -> 162.899 | AK73: 148.1 | AL73: 164 | AM73: 44.1 | AN73: 84 | AO73: -2.5000000000000001e-002 | AP73: 25 | AQ73: 凯中转债!
A74: 334 | B74: 123010 | C74: 博世转债! | D74: 300422 | E74: 博世科 | F74: 城市公用 | G74: 三废处理 | H74: 106.446 | I74: 1.1000000000000001e-003 | J74: -1.2999999999999999e-003 | K74: 8.19 | L74: -1.1999999999999999e-003 | M74: 111.3 | N74: 11.26 | O74: 0.46299999999999997 | P74: 72.74 | Q74: 已到 | R74: 2.66年 | S74: 0.66年 | T74: 4.3 | U74: 2.9 | V74: 6.0000000000000001e-003 | W74: 0.10400000000000001 | X74: 7.5999999999999998e-002 | Y74: 41 | Z74: 1.28 | AA74: 1.72e-002 | AB74: 9.1999999999999998e-003 | AC74: -5.2699999999999997e-002 | AD74: -5.67e-002 | AE74: 96.99 | AF74: 95.47 | AG74: 0.19 | AH74: AA- | AI74: 6.0400000000000002e-002 | AJ74: =H74+100*O74 -> 152.74599999999998 | AK74: 140.2 | AL74: 81 | AM74: 43.2 | AN74: 75 | AO74: -5.2999999999999999e-002 | AP74: 30 | AQ74: 博世转债!
A75: 93 | B75: 113044 | C75: 大秦转债! | D75: 601006 | E75: 大秦铁路 | F75: 铁路 | G75: 铁路运输 | H75: 105.38 | I75: -5.9999999999999995e-004 | J75: -8.0000000000000004e-004 | K75: 6.22 | L75: -3.2000000000000002e-003 | M75: 114.1 | N75: 7.18 | O75: 0.21600000000000003 | P75: 86.63 | Q75: 已到 | R75: 5年38天 | S75: 3年38天 | T75: 320 | U75: 109 | V75: 3.0000000000000001e-003 | W75: 0.34600000000000003 | X75: 0.29999999999999999 | Y75: 925 | Z75: 0.77 | AA75: 1.6e-002 | AB75: 1.09e-002 | AC75: -4.1999999999999997e-003 | AD75: -6.6e-003 | AE75: 92.85 | AF75: 95.91 | AG75: 0.41 | AH75: AAA | AI75: 3.5400000000000001e-002 | AJ75: =H75+100*O75 -> 126.97999999999999 | AK75: 124.1 | AL75: 6 | AM75: 28.2 | AN75: 9 | AO75: -1.9e-002 | AP75: 28 | AQ75: 大秦转债!
A76: 186 | B76: 128114 | C76: 正邦转债! | D76: 2157 | E76: 正邦科技 | F76: 农业 | G76: 畜牧业 | H76: 107 | I76: 1.8e-003 | J76: -9.300000000000001e-003 | K76: 10.71 | L76: -3.3399999999999999e-002 | M76: 114.9 | N76: 14.77 | O76: 0.47600000000000003 | P76: 72.51 | Q76: 已到 | R76: 4.61年 | S76: 2.61年 | T76: 16 | U76: 48 | V76: 2.7999999999999997e-002 | W76: 4.7e-002 | X76: 3.4000000000000002e-002 | Y76: 337 | Z76: 2.6 | AA76: 1.5900000000000001e-002 | AB76: 1.e-002 | AC76: -1.23e-002 | AD76: -1.47e-002 | AE76: 93.86 | AF76: 98.02 | AG76: 0.22 | AH76: AA+ | AI76: 3.5799999999999998e-002 | AJ76: =H76+100*O76 -> 154.59999999999999 | AK76: 141.5 | AL76: 97 | AM76: 43.5 | AN76: 79 | AO76: 6.5000000000000002e-002 | AP76: 22 | AQ76: 正邦转债!
A77: 5 | B77: 113628 | C77: 晨丰转债 | D77: 603685 | E77: 晨丰科技 | F77: 能源电力 | G77: 电力设备 | H77: 111.46 | I77: -3.5999999999999999e-003 | J77: -4.0000000000000002e-004 | K77: 11.32 | L77: -6.0999999999999995e-003 | M77: 121.7 | N77: 13.06 | O77: 0.28600000000000003 | P77: 86.68 | Q77: 3月23天 | R77: 5.79年 | S77: 3.79年 | T77: 4.15 | U77: 7.6 | V77: 1.6e-002 | W77: 0.217 | X77: 0.188 | Y77: 19 | Z77: 1.7 | AA77: 1.5600000000000001e-002 | AB77: 9.1000000000000004e-003 | AC77: -1.6e-002 | AD77: -1.8200000000000001e-002 | AE77: 76.18 | AF77: 76.95 | AG77: 0.65 | AH77: A | AI77: 8.4399999999999989e-002 | AJ77: =H77+100*O77 -> 140.06 | AK77: 136.2 | AL77: 44 | AM77: 59.3 | AN77: 196 | AO77: -1.3999999999999999e-002 | AP77: 7 | AQ77: 晨丰转债
A78: 170 | B78: 128120 | C78: 联诚转债! | D78: 2921 | E78: 联诚精密 | F78: 汽车 | G78: 零部件制 | H78: 109.891 | I78: 1.9e-003 | J78: -8.3000000000000001e-003 | K78: 14.53 | L78: -1.2199999999999999e-002 | M78: 117.9 | N78: 18.44 | O78: 0.39500000000000002 | P78: 78.8 | Q78: 已到 | R78: 4.69年 | S78: 2.69年 | T78: 2.6 | U78: 2.6 | V78: 9.0000000000000011e-003 | W78: 0.16899999999999998 | X78: 0.13300000000000001 | Y78: 15 | Z78: 1.93 | AA78: 1.55e-002 | AB78: 8.6e-003 | AC78: -1.9e-002 | AD78: -2.1700000000000001e-002 | AE78: 83.09 | AF78: 81.91 | AG78: 0.53 | AH78: A | AI78: 8.2799999999999999e-002 | AJ78: =H78+100*O78 -> 149.39100000000002 | AK78: 141 | AL78: 91 | AM78: 57.9 | AN78: 184 | AO78: -2.2000000000000002e-002 | AP78: 22 | AQ78: 联诚转债!
A79: 272 | B79: 128072 | C79: 翔鹭转债! | D79: 2842 | E79: 翔鹭钨业 | F79: 有色金属 | G79: 小金属 | H79: 108.37 | I79: -8.9999999999999998e-004 | J79: -1.6000000000000001e-003 | K79: 8.97 | L79: -1.7500000000000002e-002 | M79: 114.5 | N79: 15.36 | O79: 0.85599999999999998 | P79: 58.4 | Q79: 已到 | R79: 3.79年 | S79: 1.79年 | T79: 3.02 | U79: 0.8 | V79: 3.0000000000000001e-003 | W79: 0.12300000000000001 | X79: 7.2000000000000008e-002 | Y79: 24 | Z79: 2.56 | AA79: 1.49e-002 | AB79: 7.9000000000000008e-003 | AC79: -2.6699999999999998e-002 | AD79: -2.9399999999999999e-002 | AE79: 91.54 | AF79: 91.65 | AG79: 0.14 | AH79: AA- | AI79: 6.1799999999999994e-002 | AJ79: =H79+100*O79 -> 193.97 | AK79: 158.3 | AL79: 232 | AM79: 66.7 | AN79: 241 | AO79: -4.5999999999999999e-002 | AP79: 28 | AQ79: 翔鹭转债!
A80: 356 | B80: 128022 | C80: 众信转债! | D80: 2707 | E80: 众信旅游 | F80: 旅游餐饮 | G80: 旅游 | H80: 105.65 | I80: 0. | J80: 0. | K80: 4.83 | L80: 6.3e-003 | M80: 108.8 | N80: 7.92 | O80: 0.73199999999999998 | P80: 60.98 | Q80: 已到 | R80: 2年25天 | S80: 25天 | T80: 4.56 | U80: 9.9 | V80: 2.e-002 | W80: 0.10400000000000001 | X80: 6.3e-002 | Y80: 44 | Z80: 8.47 | AA80: 1.46e-002 | AB80: 6.4000000000000003e-003 | AC80: -0.182 | AD80: -0.19600000000000001 | AE80: 99.71 | AF80: 92.83 | AG80: 0 | AH80: A | AI80: 8.14e-002 | AJ80: =H80+100*O80 -> 178.85000000000002 | AK80: 150.3 | AL80: 182 | AM80: 50.6 | AN80: 134 | AO80: -3.5000000000000003e-002 | AP80: 36 | AQ80: 众信转债!
A81: 105 | B81: 113610 | C81: 灵康转债 | D81: 603669 | E81: 灵康药业 | F81: 医药 | G81: 化学制药 | H81: 112.7 | I81: 2.9999999999999997e-004 | J81: 4.0000000000000002e-004 | K81: 8.02 | L81: 1.1999999999999999e-003 | M81: 121.1 | N81: 8.61 | O81: 0.20999999999999999 | P81: 93.15 | Q81: 已到 | R81: 5年25天 | S81: 3年25天 | T81: 4.58 | U81: 3.1 | V81: 6.0000000000000001e-003 | W81: 7.9000000000000001e-002 | X81: 7.400000000000001e-002 | Y81: 58 | Z81: 4.2 | AA81: 1.46e-002 | AB81: 7.3000000000000001e-003 | AC81: -2.4700000000000003e-002 | AD81: -2.7000000000000003e-002 | AE81: 85.47 | AF81: 89.34 | AG81: 0.57 | AH81: AA- | AI81: 6.3399999999999998e-002 | AJ81: =H81+100*O81 -> 133.69999999999999 | AK81: 132.3 | AL81: 22 | AM81: 42.9 | AN81: 73 | AO81: -5.9000000000000004e-002 | AP81: 28 | AQ81: 灵康转债
A82: 21 | B82: 123118 | C82: 惠城转债 | D82: 300779 | E82: 惠城环保 | F82: 化工 | G82: 其他 | H82: 112.419 | I82: -7.000000000000001e-004 | J82: 7.000000000000001e-004 | K82: 15.6 | L82: 0. | M82: 121.7 | N82: 17.11 | O82: 0.23300000000000001 | P82: 91.17 | Q82: 2月8天 | R82: 5.67年 | S82: 3.67年 | T82: 3.2 | U82: 8.6 | V82: 2.4e-002 | W82: 0.20499999999999999 | X82: 0.187 | Y82: 16 | Z82: 2.34 | AA82: 1.44e-002 | AB82: 7.8000000000000005e-003 | AC82: -1.8799999999999997e-002 | AD82: -2.1000000000000001e-002 | AE82: 79.73 | AF82: 81.84 | AG82: 0.63 | AH82: A+ | AI82: 7.4400000000000008e-002 | AJ82: =H82+100*O82 -> 135.71899999999999 | AK82: 133.7 | AL82: 33 | AM82: 51.8 | AN82: 143 | AO82: -2.6000000000000002e-002 | AP82: 8 | AQ82: 惠城转债
A83: 42 | B83: 127033 | C83: 中装转2! | D83: 2822 | E83: 中装建设 | F83: 建筑 | G83: 装饰工程 | H83: 108.623 | I83: 2.3999999999999998e-003 | J83: -8.3000000000000001e-003 | K83: 5.03 | L83: -1.5700000000000002e-002 | M83: 117.1 | N83: 6.28 | O83: 0.35600000000000004 | P83: 80.1 | Q83: 已到 | R83: 5.44年 | S83: 3.44年 | T83: 11.6 | U83: 18 | V83: 1.3999999999999999e-002 | W83: 0.32000000000000001 | X83: 0.25600000000000001 | Y83: 36 | Z83: 1.04 | AA83: 1.4199999999999999e-002 | AB83: 8.5000000000000006e-003 | AC83: -1.3100000000000001e-002 | AD83: -1.4999999999999999e-002 | AE83: 89.31 | AF83: 93.81 | AG83: 0.37 | AH83: AA | AI83: 4.24e-002 | AJ83: =H83+100*O83 -> 144.22300000000001 | AK83: 137.2 | AL83: 49 | AM83: 43.3 | AN83: 77 | AO83: -2.2000000000000002e-002 | AP83: 27 | AQ83: 中装转2!
A84: 43 | B84: 110080 | C84: 东湖转债 | D84: 600133 | E84: 东湖高新 | F84: 建筑 | G84: 建筑工程 | H84: 106.84 | I84: -4.0000000000000002e-004 | J84: -5.5000000000000005e-003 | K84: 5.14 | L84: -1.34e-002 | M84: 115.1 | N84: 6.05 | O84: 0.25800000000000001 | P84: 84.96 | Q84: 已到 | R84: 5.43年 | S84: 3.43年 | T84: 15.5 | U84: 10 | V84: 6.0000000000000001e-003 | W84: 0.379 | X84: 0.32200000000000001 | Y84: 41 | Z84: 0.73 | AA84: 1.41e-002 | AB84: 9.0000000000000011e-003 | AC84: -8.6e-003 | AD84: -1.0500000000000001e-002 | AE84: 89.35 | AF84: 92.26 | AG84: 0.44 | AH84: AA | AI84: 4.24e-002 | AJ84: =H84+100*O84 -> 132.64000000000001 | AK84: 128.7 | AL84: 12 | AM84: 36.5 | AN84: 31 | AO84: -0.114 | AP84: 29 | AQ84: 东湖转债
A85: 340 | B85: 128037 | C85: 岩土转债! | D85: 2542 | E85: 中化岩土 | F85: 建筑 | G85: 建筑工程 | H85: 107.829 | I85: -1.6000000000000001e-003 | J85: 4.6999999999999993e-003 | K85: 2.69 | L85: 1.1299999999999999e-002 | M85: 111.3 | N85: 3.1 | O85: 0.24299999999999999 | P85: 86.77 | Q85: 已到 | R85: 2.35年 | S85: 0.35年 | T85: 5.99 | U85: 8.4 | V85: 1.3000000000000001e-002 | W85: 0.12300000000000001 | X85: 0.107 | Y85: 49 | Z85: 1.22 | AA85: 1.38e-002 | AB85: 4.7999999999999996e-003 | AC85: -0.115 | AD85: -0.122 | AE85: 99.78 | AF85: 101.8 | AG85: 0.28 | AH85: AA | AI85: 3.9399999999999998e-002 | AJ85: =H85+100*O85 -> 132.12899999999999 | AK85: 128.9 | AL85: 13 | AM85: 27.1 | AN85: 5 | AO85: -2.7000000000000003e-002 | AP85: 53 | AQ85: 岩土转债!
A86: 215 | B86: 113574 | C86: 华体转债! | D86: 603679 | E86: 华体科技 | F86: 城市公用 | G86: 城市公用 | H86: 109.36 | I86: 2.5999999999999999e-003 | J86: -2.5000000000000001e-003 | K86: 12.61 | L86: 1.37e-002 | M86: 115.9 | N86: 33.91 | O86: 1.9399999999999999 | P86: 37.19 | Q86: 已到 | R86: 4.40年 | S86: 2.40年 | T86: 2.09 | U86: 3.4 | V86: 1.4999999999999999e-002 | W86: 0.11699999999999999 | X86: 4.2999999999999997e-002 | Y86: 18 | Z86: 2.39 | AA86: 1.3600000000000001e-002 | AB86: 6.9999999999999993e-003 | AC86: -1.9299999999999998e-002 | AD86: -2.23e-002 | AE86: 87.1 | AF86: 85.78 | AG86: 0.01 | AH86: A+ | AI86: 7.2800000000000004e-002 | AJ86: =H86+100*O86 -> 303.36000000000001 | AK86: 181.5 | AL86: 309 | AM86: 94.4 | AN86: 314 | AO86: -8.3000000000000004e-002 | AP86: 19 | AQ86: 华体转债!
A87: 309 | B87: 128056 | C87: 今飞转债! | D87: 2863 | E87: 今飞凯达 | F87: 汽车 | G87: 零部件制 | H87: 115.11 | I87: 1.24e-002 | J87: -1.3000000000000001e-002 | K87: 5.12 | L87: -1.9e-003 | M87: 120.2 | N87: 6.69 | O87: 0.504 | P87: 76.53 | Q87: 已到 | R87: 3.31年 | S87: 1.31年 | T87: 1.72 | U87: 13 | V87: 6.4000000000000001e-002 | W87: 6.7000000000000004e-002 | X87: 5.2000000000000005e-002 | Y87: 26 | Z87: 1.35 | AA87: 1.3500000000000002e-002 | AB87: 2.8000000000000004e-003 | AC87: -7.0900000000000005e-002 | AD87: -7.4900000000000008e-002 | AE87: 93.27 | AF87: 95.78 | AG87: 0.3 | AH87: A+ | AI87: 7.2800000000000004e-002 | AJ87: =H87+100*O87 -> 165.50999999999999 | AK87: 153.7 | AL87: 205 | AM87: 57.9 | AN87: 185 | AO87: 8.0000000000000002e-003 | AP87: 50 | AQ87: 今飞转债!
A88: 274 | B88: 113542 | C88: 好客转债! | D88: 603898 | E88: 好莱客 | F88: 其他 | G88: 家居用品 | H88: 108.93 | I88: 2.8000000000000004e-003 | J88: -1.2999999999999999e-003 | K88: 10.86 | L88: 1.0200000000000001e-002 | M88: 114.3 | N88: 16.14 | O88: 0.61899999999999999 | P88: 67.29 | Q88: 已到 | R88: 3.73年 | S88: 1.73年 | T88: 6.03 | U88: 3.9 | V88: 6.0000000000000001e-003 | W88: 0.17800000000000002 | X88: 0.12 | Y88: 34 | Z88: 1.25 | AA88: 1.32e-002 | AB88: 6.1999999999999998e-003 | AC88: -3.0200000000000001e-002 | AD88: -3.3000000000000002e-002 | AE88: 95.33 | AF88: 98.72 | AG88: 0.15 | AH88: AA | AI88: 4.0800000000000003e-002 | AJ88: =H88+100*O88 -> 170.83000000000001 | AK88: 150.6 | AL88: 184 | AM88: 51.8 | AN88: 144 | AO88: -3.1e-002 | AP88: 16 | AQ88: 好客转债!
A89: 331 | B89: 123011 | C89: 德尔转债! | D89: 300473 | E89: 德尔股份 | F89: 汽车 | G89: 零部件制 | H89: 111.378 | I89: -2.8999999999999998e-003 | J89: 2.3e-003 | K89: 20.15 | L89: -5.4000000000000003e-003 | M89: 115.3 | N89: 31.38 | O89: 0.73499999999999999 | P89: 64.21 | Q89: 已到 | R89: 2.70年 | S89: 0.70年 | T89: 2.51 | U89: 6.6 | V89: 2.4e-002 | W89: 9.1999999999999998e-002 | X89: 5.9000000000000004e-002 | Y89: 27 | Z89: 1.28 | AA89: 1.3100000000000001e-002 | AB89: 2.8999999999999998e-003 | AC89: -0.10199999999999999 | AD89: -0.106 | AE89: 96.79 | AF89: 98.69 | AG89: 0.11 | AH89: AA- | AI89: 6.0400000000000002e-002 | AJ89: =H89+100*O89 -> 184.87799999999999 | AK89: 158.5 | AL89: 235 | AM89: 59.9 | AN89: 200 | AO89: -2.4e-002 | AP89: 39 | AQ89: 德尔转债!
A90: 115 | B90: 127024 | C90: 盈峰转债! | D90: 967 | E90: 盈峰环境 | F90: 机械装备 | G90: 专用设备 | H90: 109.4 | I90: -2.9999999999999997e-004 | J90: -4.0999999999999995e-003 | K90: 6.18 | L90: -1.7500000000000002e-002 | M90: 116.8 | N90: 8.19 | O90: 0.45000000000000001 | P90: 75.46 | Q90: 已到 | R90: 4.99年 | S90: 2.99年 | T90: 14.8 | U90: 19 | V90: 1.1000000000000001e-002 | W90: 7.5999999999999998e-002 | X90: 5.7000000000000002e-002 | Y90: 195 | Z90: 1.19 | AA90: 1.3100000000000001e-002 | AB90: 7.0999999999999995e-003 | AC90: -1.8700000000000001e-002 | AD90: -2.0499999999999997e-002 | AE90: 92.32 | AF90: 98.1 | AG90: 0.25 | AH90: AA+ | AI90: 3.5799999999999998e-002 | AJ90: =H90+100*O90 -> 154.40000000000001 | AK90: 143.3 | AL90: 112 | AM90: 45.2 | AN90: 88 | AO90: -5.0999999999999997e-002 | AP90: 5 | AQ90: 盈峰转债!
A91: 157 | B91: 128124 | C91: 科华转债! | D91: 2022 | E91: 科华生物 | F91: 医药 | G91: 生物制药 | H91: 104.14 | I91: -1.2999999999999999e-003 | J91: -5.0000000000000001e-004 | K91: 14.16 | L91: -9.1000000000000004e-003 | M91: 110 | N91: 21.3 | O91: 0.56700000000000006 | P91: 66.48 | Q91: 已到 | R91: 4.72年 | S91: 2.72年 | T91: 7.38 | U91: 2.5 | V91: 3.0000000000000001e-003 | W91: 0.10099999999999999 | X91: 6.7000000000000004e-002 | Y91: 73 | Z91: 2.02 | AA91: 1.1899999999999999e-002 | AB91: 7.8000000000000005e-003 | AC91: -4.6999999999999993e-003 | AD91: -6.5000000000000006e-003 | AE91: 91.61 | AF91: 91.36 | AG91: 0.21 | AH91: AA | AI91: 4.0800000000000003e-002 | AJ91: =H91+100*O91 -> 160.84 | AK91: 141.8 | AL91: 101 | AM91: 50.2 | AN91: 130 | AO91: 3.5000000000000003e-002 | AP91: 23 | AQ91: 科华转债!
A92: 299 | B92: 123023 | C92: 迪森转债! | D92: 300335 | E92: 迪森股份 | F92: 能源电力 | G92: 电力供应 | H92: 110 | I92: 4.6999999999999993e-003 | J92: -4.6999999999999993e-003 | K92: 5.39 | L92: 0. | M92: 114.3 | N92: 6.89 | O92: 0.40600000000000003 | P92: 78.23 | Q92: 已到 | R92: 3.37年 | S92: 2.37年 | T92: 5.29 | U92: 96 | V92: 0.16399999999999998 | W92: 0.26300000000000001 | X92: 0.20600000000000002 | Y92: 20 | Z92: 1.48 | AA92: 1.1699999999999999e-002 | AB92: 3.9000000000000003e-003 | AC92: -1.9799999999999998e-002 | AD92: -2.3199999999999998e-002 | AE92: 90.1 | AF92: 93.81 | AG92: 0.33 | AH92: AA- | AI92: 6.1799999999999994e-002 | AJ92: =H92+100*O92 -> 150.59999999999999 | AK92: 141.8 | AL92: 100 | AM92: 48 | AN92: 114 | AO92: -0.11199999999999999 | AP92: 50 | AQ92: 迪森转债!
A93: 108 | B93: 113609 | C93: 永安转债! | D93: 603776 | E93: 永安行 | F93: 城市公用 | G93: 其他 | H93: 113.78 | I93: 5.9999999999999995e-004 | J93: 6.9999999999999993e-003 | K93: 16.13 | L93: 1.26e-002 | M93: 120.5 | N93: 16.48 | O93: 0.16200000000000001 | P93: 97.88 | Q93: 已到 | R93: 5年18天 | S93: 3年18天 | T93: 7.34 | U93: 20 | V93: 2.3e-002 | W93: 0.19500000000000001 | X93: 0.191 | Y93: 38 | Z93: 1.15 | AA93: 1.1699999999999999e-002 | AB93: 4.5999999999999999e-003 | AC93: -2.8300000000000002e-002 | AD93: -3.0499999999999999e-002 | AE93: 85.41 | AF93: 88.96 | AG93: 0.61 | AH93: AA- | AI93: 6.3399999999999998e-002 | AJ93: =H93+100*O93 -> 129.97999999999999 | AK93: 129.7 | AL93: 15 | AM93: 40.7 | AN93: 56 | AO93: 1.2e-002 | AP93: 26 | AQ93: 永安转债!
A94: 92 | B94: 123088 | C94: 威唐转债! | D94: 300707 | E94: 威唐工业 | F94: 汽车 | G94: 零部件制 | H94: 114.78 | I94: 3.3099999999999997e-002 | J94: -1.26e-002 | K94: 16.65 | L94: 4.0599999999999997e-002 | M94: 121.6 | N94: 20.72 | O94: 0.42799999999999999 | P94: 80.36 | Q94: 已到 | R94: 5年39天 | S94: 3年39天 | T94: 3.01 | U94: 170 | V94: 0.496 | W94: 0.115 | X94: 9.3000000000000013e-002 | Y94: 26 | Z94: 3.72 | AA94: 1.1699999999999999e-002 | AB94: 4.3e-003 | AC94: -2.8300000000000002e-002 | AD94: -3.0899999999999997e-002 | AE94: 82.98 | AF94: 85.11 | AG94: 0.51 | AH94: A+ | AI94: 7.4400000000000008e-002 | AJ94: =H94+100*O94 -> 157.57999999999998 | AK94: 149.2 | AL94: 173 | AM94: 64.1 | AN94: 228 | AO94: 0.11699999999999999 | AP94: 17 | AQ94: 威唐转债!
A95: 263 | B95: 113546 | C95: 迪贝转债! | D95: 603320 | E95: 迪贝电气 | F95: 家电 | G95: 零部件制 | H95: 114.56 | I95: -4.0000000000000001e-003 | J95: -4.1999999999999997e-003 | K95: 11.54 | L95: -1.8700000000000001e-002 | M95: 119.8 | N95: 14 | O95: 0.39000000000000001 | P95: 82.43 | Q95: 已到 | R95: 3.96年 | S95: 1.96年 | T95: 2.3 | U95: 3.8 | V95: 1.3999999999999999e-002 | W95: 0.153 | X95: 0.126 | Y95: 15 | Z95: 2.06 | AA95: 1.1599999999999999e-002 | AB95: 2.8999999999999998e-003 | AC95: -4.8499999999999995e-002 | AD95: -5.1200000000000002e-002 | AE95: 88.91 | AF95: 91.19 | AG95: 0.44 | AH95: A+ | AI95: 7.2800000000000004e-002 | AJ95: =H95+100*O95 -> 153.56 | AK95: 146.7 | AL95: 150 | AM95: 55.5 | AN95: 165 | AO95: -0.106 | AP95: 38 | AQ95: 迪贝转债!
A96: 66 | B96: 113620 | C96: 傲农转债! | D96: 603363 | E96: 傲农生物 | F96: 农业 | G96: 畜牧业 | H96: 114.06 | I96: -3.0999999999999999e-003 | J96: -8.0000000000000004e-004 | K96: 11.95 | L96: -1.0800000000000001e-002 | M96: 121.1 | N96: 14.51 | O96: 0.38500000000000001 | P96: 82.36 | Q96: 已到 | R96: 5.34年 | S96: 3.34年 | T96: 10 | U96: 65 | V96: 5.5999999999999994e-002 | W96: 0.122 | X96: 0.10099999999999999 | Y96: 82 | Z96: 3.76 | AA96: 1.15e-002 | AB96: 4.6999999999999993e-003 | AC96: -2.7300000000000001e-002 | AD96: -2.92e-002 | AE96: 89.68 | AF96: 97.41 | AG96: 0.36 | AH96: AA | AI96: 4.24e-002 | AJ96: =H96+100*O96 -> 152.56 | AK96: 145.8 | AL96: 142 | AM96: 48.3 | AN96: 116 | AO96: 0.126 | AP96: 9 | AQ96: 傲农转债!
A97: 126 | B97: 123072 | C97: 乐歌转债! | D97: 300729 | E97: 乐歌股份 | F97: 其他 | G97: 家居用品 | H97: 122.223 | I97: 0. | J97: -1.1000000000000001e-003 | K97: 26.56 | L97: -6.7000000000000002e-003 | M97: 129.1 | N97: 49.24 | O97: 1.27 | P97: 53.94 | Q97: 已到 | R97: 4.96年 | S97: 2.96年 | T97: 1.42 | U97: 41 | V97: 0.23499999999999999 | W97: 2.4e-002 | X97: 1.3000000000000001e-002 | Y97: 59 | Z97: 3.24 | AA97: 1.1399999999999999e-002 | AB97: 1.8e-003 | AC97: -4.4500000000000005e-002 | AD97: -4.8000000000000001e-002 | AE97: 85.51 | AF97: 92.11 | AG97: 0.16 | AH97: A+ | AI97: 7.2800000000000004e-002 | AJ97: =H97+100*O97 -> 249.22300000000001 | AK97: 190.5 | AL97: 317 | AM97: 98.4 | AN97: 318 | AO97: 8.900000000000001e-002 | AP97: 9 | AQ97: 乐歌转债!
A98: 247 | B98: 128087 | C98: 孚日转债! | D98: 2083 | E98: 孚日股份 | F98: 服装纺织 | G98: 家纺 | H98: 108.103 | I98: -1.8e-003 | J98: -7.4999999999999997e-003 | K98: 4.15 | L98: -1.66e-002 | M98: 112.9 | N98: 4.5 | O98: 0.17199999999999999 | P98: 92.22 | Q98: 已到 | R98: 4年41天 | S98: 2年41天 | T98: 6.5 | U98: 19 | V98: 2.7000000000000003e-002 | W98: 0.17199999999999999 | X98: 0.159 | Y98: 38 | Z98: 1 | AA98: 1.09e-002 | AB98: 5.0000000000000001e-003 | AC98: -1.95e-002 | AD98: -2.2400000000000003e-002 | AE98: 90.34 | AF98: 88.74 | AG98: 0.56 | AH98: AA- | AI98: 6.1799999999999994e-002 | AJ98: =H98+100*O98 -> 125.303 | AK98: 124 | AL98: 5 | AM98: 33.6 | AN98: 23 | AO98: 1.3000000000000001e-002 | AP98: 76 | AQ98: 孚日转债!
A99: 135 | B99: 128133 | C99: 奇正转债! | D99: 2287 | E99: 奇正藏药 | F99: 医药 | G99: 中药 | H99: 111.299 | I99: 1.e-003 | J99: 1.5e-003 | K99: 25.12 | L99: 6.4000000000000003e-003 | M99: 116.9 | N99: 29.78 | O99: 0.31900000000000001 | P99: 84.35 | Q99: 已到 | R99: 4.88年 | S99: 2.88年 | T99: 8 | U99: 20 | V99: 2.2000000000000002e-002 | W99: 5.9999999999999998e-002 | X99: 5.0999999999999997e-002 | Y99: 133 | Z99: 4.5 | AA99: 1.03e-002 | AB99: 4.0999999999999995e-003 | AC99: -2.41e-002 | AD99: -2.6200000000000001e-002 | AE99: 91.64 | AF99: 96.54 | AG99: 0.38 | AH99: AA | AI99: 4.0800000000000003e-002 | AJ99: =H99+100*O99 -> 143.19900000000001 | AK99: 138.2 | AL99: 60 | AM99: 41.7 | AN99: 63 | AO99: -8.0000000000000002e-002 | AP99: 19 | AQ99: 奇正转债!
A100: 113 | B100: 113608 | C100: 威派转债! | D100: 603956 | E100: 威派格 | F100: 机械装备 | G100: 专用设备 | H100: 115.66 | I100: 5.7999999999999996e-003 | J100: -3.2000000000000002e-003 | K100: 15.94 | L100: 5.0000000000000001e-003 | M100: 121.6 | N100: 19.08 | O100: 0.38400000000000001 | P100: 83.54 | Q100: 已到 | R100: 5年3.1天 | S100: 3年3.1天 | T100: 4.2 | U100: 2.4 | V100: 5.0000000000000001e-003 | W100: 6.2e-002 | X100: 5.2000000000000005e-002 | Y100: 68 | Z100: 5.74 | AA100: 1.03e-002 | AB100: 2.8000000000000004e-003 | AC100: -3.15e-002 | AD100: -3.4200000000000001e-002 | AE100: 83.57 | AF100: 85.72 | AG100: 0.53 | AH100: A+ | AI100: 7.4400000000000008e-002 | AJ100: =H100+100*O100 -> 154.06 | AK100: 147.8 | AL100: 161 | AM100: 62.1 | AN100: 210 | AO100: 0. | AP100: 7 | AQ100: 威派转债!
A101: 228 | B101: 113567 | C101: 君禾转债! | D101: 603617 | E101: 君禾股份 | F101: 机械装备 | G101: 通用设备 | H101: 113.84 | I101: -2.8999999999999998e-003 | J101: 1.8e-003 | K101: 9.96 | L101: -2.e-003 | M101: 118.8 | N101: 11.16 | O101: 0.27600000000000002 | P101: 89.25 | Q101: 已到 | R101: 4.32年 | S101: 2.32年 | T101: 2.1 | U101: 1.9 | V101: 8.0000000000000002e-003 | W101: 0.106 | X101: 9.4e-002 | Y101: 20 | Z101: 2.83 | AA101: 1.0200000000000001e-002 | AB101: 2.5000000000000001e-003 | AC101: -3.6200000000000003e-002 | AD101: -3.9100000000000003e-002 | AE101: 87.48 | AF101: 88.37 | AG101: 0.54 | AH101: A+ | AI101: 7.2800000000000004e-002 | AJ101: =H101+100*O101 -> 141.44 | AK101: 138.4 | AL101: 64 | AM101: 50.1 | AN101: 128 | AO101: -4.0000000000000001e-003 | AP101: 33 | AQ101: 君禾转债!
A102: 142 | B102: 128129 | C102: 青农转债! | D102: 2958 | E102: 青农商行 | F102: 金融 | G102: 银行行业 | H102: 106.8 | I102: -3.4999999999999996e-003 | J102: 2.3999999999999998e-003 | K102: 3.81 | L102: -2.5999999999999999e-003 | M102: 112 | N102: 4.32 | O102: 0.21100000000000002 | P102: 88.19 | Q102: 已到 | R102: 4.80年 | S102: 无权 | T102: 50 | U102: 48 | V102: 9.0000000000000011e-003 | W102: 0.23600000000000002 | X102: 0.20800000000000002 | Y102: 212 | Z102: 0.74 | AA102: 1.01e-002 | AB102: 5.5000000000000005e-003 | AC102: 无权 | AD102: 无权 | AE102: 无权 | AF102: 95.72 | AG102: 0.43 | AH102: AAA | AI102: 3.3799999999999997e-002 | AJ102: =H102+100*O102 -> 127.90000000000001 | AK102: 125.4 | AL102: 8 | AM102: 29.7 | AN102: 11 | AO102: -2.3e-002 | AP102: 24 | AQ102: 青农转债!
A103: 273 | B103: 128071 | C103: 合兴转债! | D103: 2228 | E103: 合兴包装 | F103: 造纸包装 | G103: 包装材料 | H103: 110.277 | I103: 2.5000000000000001e-003 | J103: 4.0000000000000002e-004 | K103: 3.49 | L103: 8.6999999999999994e-003 | M103: 114.3 | N103: 4.18 | O103: 0.32100000000000001 | P103: 83.49 | Q103: 已到 | R103: 3.78年 | S103: 1.78年 | T103: 3 | U103: 1.6 | V103: 5.0000000000000001e-003 | W103: 6.9000000000000006e-002 | X103: 5.7999999999999996e-002 | Y103: 43 | Z103: 1.28 | AA103: 9.7000000000000003e-003 | AB103: 2.8000000000000004e-003 | AC103: -3.5699999999999996e-002 | AD103: -3.8399999999999997e-002 | AE103: 95.17 | AF103: 98.56 | AG103: 0.34 | AH103: AA | AI103: 4.0800000000000003e-002 | AJ103: =H103+100*O103 -> 142.37700000000001 | AK103: 137.1 | AL103: 48 | AM103: 38.5 | AN103: 40 | AO103: -1.e-003 | AP103: 26 | AQ103: 合兴转债!
A104: 156 | B104: 123063 | C104: 大禹转债 | D104: 300021 | E104: 大禹节水 | F104: 化工 | G104: 橡胶塑料 | H104: 120.859 | I104: -1.1000000000000001e-003 | J104: -1.e-004 | K104: 5.12 | L104: -1.9e-003 | M104: 126.1 | N104: 4.83 | O104: 0.14000000000000001 | P104: 106 | Q104: 已到 | R104: 4.72年 | S104: 3.72年 | T104: 6.35 | U104: 14 | V104: 1.8000000000000002e-002 | W104: 0.155 | X104: 0.16399999999999998 | Y104: 41 | Z104: 2.76 | AA104: 9.1999999999999998e-003 | AB104: 0. | AC104: -3.2199999999999999e-002 | AD104: -3.5299999999999998e-002 | AE104: 84.77 | AF104: 95.58 | AG104: 0.6 | AH104: AA- | AI104: 6.1799999999999994e-002 | AJ104: =H104+100*O104 -> 134.85900000000001 | AK104: 135.7 | AL104: 42 | AM104: 40.1 | AN104: 53 | AO104: 9.0000000000000011e-003 | AP104: 20 | AQ104: 大禹转债
A105: 206 | B105: 110070 | C105: 凌钢转债! | D105: 600231 | E105: 凌钢股份 | F105: 钢铁 | G105: 炼钢 | H105: 112.87 | I105: -2.1499999999999998e-002 | J105: 5.5000000000000005e-003 | K105: 2.51 | L105: -3.4599999999999999e-002 | M105: 117.4 | N105: 2.69 | O105: 0.20999999999999999 | P105: 93.31 | Q105: 已到 | R105: 4.43年 | S105: 2.43年 | T105: 2.17 | U105: 27 | V105: 0.10800000000000001 | W105: 2.9999999999999999e-002 | X105: 2.7999999999999997e-002 | Y105: 72 | Z105: 0.76 | AA105: 9.1000000000000004e-003 | AB105: 2.0999999999999999e-003 | AC105: -3.2199999999999999e-002 | AD105: -3.49e-002 | AE105: 93.6 | AF105: 98.73 | AG105: 0.46 | AH105: AA | AI105: 4.0800000000000003e-002 | AJ105: =H105+100*O105 -> 133.87 | AK105: 132.4 | AL105: 26 | AM105: 33.7 | AN105: 25 | AO105: -0.13600000000000001 | AP105: 23 | AQ105: 凌钢转债!
A106: 355 | B106: 128023 | C106: 亚太转债! | D106: 2284 | E106: 亚太股份 | F106: 汽车 | G106: 零部件制 | H106: 109.284 | I106: -5.1999999999999998e-003 | J106: 4.8999999999999998e-003 | K106: 6.87 | L106: -4.3e-003 | M106: 111.3 | N106: 10.34 | O106: 0.64500000000000002 | P106: 66.44 | Q106: 已到 | R106: 2年28天 | S106: 28天 | T106: 9.99 | U106: 9.8 | V106: 9.0000000000000011e-003 | W106: 0.19699999999999998 | X106: 0.13100000000000001 | Y106: 51 | Z106: 2.02 | AA106: 9.0000000000000011e-003 | AB106: -1.1000000000000001e-003 | AC106: -0.308 | AD106: -0.32299999999999995 | AE106: 100.86 | AF106: 102.89 | AG106: 0.05 | AH106: AA | AI106: 3.9399999999999998e-002 | AJ106: =H106+100*O106 -> 173.78399999999999 | AK106: 152.1 | AL106: 195 | AM106: 49.2 | AN106: 123 | AO106: -1.4999999999999999e-002 | AP106: 61 | AQ106: 亚太转债!
A107: 276 | B107: 128070 | C107: 智能转债! | D107: 2877 | E107: 智能自控 | F107: 机械装备 | G107: 通用设备 | H107: 113.202 | I107: 6.3e-003 | J107: -5.5000000000000005e-003 | K107: 6.29 | L107: 3.2000000000000002e-003 | M107: 116.8 | N107: 9.47 | O107: 0.70400000000000007 | P107: 66.42 | Q107: 已到 | R107: 3.65年 | S107: 无权 | T107: 2.3 | U107: 16 | V107: 6.3e-002 | W107: 0.11 | X107: 7.2999999999999995e-002 | Y107: 21 | Z107: 2.76 | AA107: 8.8000000000000005e-003 | AB107: 5.9999999999999995e-004 | AC107: 无权 | AD107: 无权 | AE107: 无权 | AF107: 90.88 | AG107: 0.25 | AH107: A+ | AI107: 7.2800000000000004e-002 | AJ107: =H107+100*O107 -> 183.602 | AK107: 160 | AL107: 248 | AM107: 69.1 | AN107: 254 | AO107: 1.3000000000000001e-002 | AP107: 30 | AQ107: 智能转债!
A108: 240 | B108: 113561 | C108: 正裕转债! | D108: 603089 | E108: 正裕工业 | F108: 汽车 | G108: 零部件制 | H108: 114.08 | I108: 1.6299999999999999e-002 | J108: -9.4999999999999998e-003 | K108: 8.08 | L108: 1.5100000000000001e-002 | M108: 118 | N108: 10.08 | O108: 0.42299999999999999 | P108: 80.16 | Q108: 已到 | R108: 4年55天 | S108: 2年55天 | T108: 1.5 | U108: 19 | V108: 0.113 | W108: 8.3000000000000004e-002 | X108: 6.7000000000000004e-002 | Y108: 18 | Z108: 1.73 | AA108: 8.3999999999999995e-003 | AB108: 7.000000000000001e-004 | AC108: -3.9e-002 | AD108: -4.2199999999999994e-002 | AE108: 88.73 | AF108: 88.87 | AG108: 0.45 | AH108: A+ | AI108: 7.2800000000000004e-002 | AJ108: =H108+100*O108 -> 156.38 | AK108: 148 | AL108: 163 | AM108: 59.1 | AN108: 195 | AO108: 2.e-002 | AP108: 36 | AQ108: 正裕转债!
A109: 268 | B109: 128074 | C109: 游族转债!! | D109: 2174 | E109: 游族网络 | F109: 通信互联 | G109: 互联网 | H109: 115.655 | I109: 1.01e-002 | J109: -6.5000000000000006e-003 | K109: 13.66 | L109: 1.11e-002 | M109: 119.3 | N109: 16.97 | O109: 0.43700000000000006 | P109: 80.49 | Q109: 已到 | R109: 3.88年 | S109: 1.88年 | T109: 6.83 | U109: 103 | V109: 0.13100000000000001 | W109: 5.5e-002 | X109: 4.4000000000000004e-002 | Y109: 125 | Z109: 2.39 | AA109: 8.199999999999999e-003 | AB109: -5.0000000000000001e-004 | AC109: -5.6299999999999996e-002 | AD109: -5.8799999999999998e-002 | AE109: 94.78 | AF109: 101.07 | AG109: 0.33 | AH109: AA | AI109: 4.0800000000000003e-002 | AJ109: =H109+100*O109 -> 159.35500000000002 | AK109: 150.8 | AL109: 187 | AM109: 49.7 | AN109: 125 | AO109: 8.0000000000000002e-002 | AP109: 31 | AQ109: 游族转债!!
A110: 44 | B110: 127032 | C110: 苏行转债 | D110: 2966 | E110: 苏州银行 | F110: 金融 | G110: 银行行业 | H110: 110.299 | I110: -4.8999999999999998e-003 | J110: 3.2000000000000002e-003 | K110: 6.78 | L110: -4.4000000000000003e-003 | M110: 115.1 | N110: 8.1 | O110: 0.318 | P110: 83.7 | Q110: 已到 | R110: 5.43年 | S110: 无权 | T110: 50 | U110: 12 | V110: 2.e-003 | W110: 0.221 | X110: 0.185 | Y110: 226 | Z110: 0.72 | AA110: 8.0000000000000002e-003 | AB110: 3.0000000000000001e-003 | AC110: 无权 | AD110: 无权 | AE110: 无权 | AF110: 95.61 | AG110: 0.38 | AH110: AAA | AI110: 3.5400000000000001e-002 | AJ110: =H110+100*O110 -> 142.09900000000002 | AK110: 136.9 | AL110: 47 | AM110: 41.3 | AN110: 59 | AO110: -2.5000000000000001e-002 | AP110: 9 | AQ110: 苏行转债
A111: 185 | B111: 113588 | C111: 润达转债! | D111: 603108 | E111: 润达医疗 | F111: 医药 | G111: 医疗器械 | H111: 110 | I111: -7.000000000000001e-004 | J111: -6.8000000000000005e-003 | K111: 10.13 | L111: -2.5000000000000001e-002 | M111: 113.9 | N111: 13.25 | O111: 0.439 | P111: 76.45 | Q111: 已到 | R111: 4.61年 | S111: 2.61年 | T111: 5.5 | U111: 1.6 | V111: 3.0000000000000001e-003 | W111: 9.4e-002 | X111: 7.2000000000000008e-002 | Y111: 59 | Z111: 1.78 | AA111: 7.7000000000000002e-003 | AB111: 2.2000000000000001e-003 | AC111: -2.2200000000000001e-002 | AD111: -2.4500000000000001e-002 | AE111: 92.62 | AF111: 95.08 | AG111: 0.3 | AH111: AA | AI111: 4.0800000000000003e-002 | AJ111: =H111+100*O111 -> 153.90000000000001 | AK111: 143.5 | AL111: 115 | AM111: 48.5 | AN111: 118 | AO111: -5.2999999999999999e-002 | AP111: 12 | AQ111: 润达转债!
A112: 140 | B112: 123064 | C112: 万孚转债! | D112: 300482 | E112: 万孚生物 | F112: 医药 | G112: 医疗器械 | H112: 110.7 | I112: 7.9000000000000008e-003 | J112: -8.199999999999999e-003 | K112: 35.09 | L112: -6.1999999999999998e-003 | M112: 114.8 | N112: 71.65 | O112: 1.26 | P112: 48.97 | Q112: 已到 | R112: 4.82年 | S112: 2.82年 | T112: 5.99 | U112: 4.1 | V112: 6.0000000000000001e-003 | W112: 3.7999999999999999e-002 | X112: 1.9e-002 | Y112: 156 | Z112: 4.87 | AA112: 7.7000000000000002e-003 | AB112: 2.2000000000000001e-003 | AC112: -2.3e-002 | AD112: -2.5099999999999997e-002 | AE112: 91.76 | AF112: 95.02 | AG112: 0.05 | AH112: AA | AI112: 4.0800000000000003e-002 | AJ112: =H112+100*O112 -> 236.69999999999999 | AK112: 172.4 | AL112: 291 | AM112: 77.4 | AN112: 287 | AO112: -8.8000000000000009e-002 | AP112: 11 | AQ112: 万孚转债!
A113: 118 | B113: 110076 | C113: 华海转债! | D113: 600521 | E113: 华海药业 | F113: 医药 | G113: 医药行业 | H113: 110.59 | I113: 4.5000000000000005e-003 | J113: -7.8000000000000005e-003 | K113: 20.75 | L113: -2.2099999999999998e-002 | M113: 114.8 | N113: 33.85 | O113: 0.80400000000000005 | P113: 61.3 | Q113: 已到 | R113: 4.99年 | S113: 2.99年 | T113: 18.4 | U113: 21 | V113: 1.e-002 | W113: 5.9999999999999998e-002 | X113: 3.6000000000000004e-002 | Y113: 310 | Z113: 4.72 | AA113: 7.6e-003 | AB113: 2.3e-003 | AC113: -2.1499999999999998e-002 | AD113: -2.35e-002 | AE113: 91.14 | AF113: 94.37 | AG113: 0.15 | AH113: AA | AI113: 4.0800000000000003e-002 | AJ113: =H113+100*O113 -> 190.99000000000001 | AK113: 159.9 | AL113: 247 | AM113: 65.5 | AN113: 234 | AO113: 0.121 | AP113: 8 | AQ113: 华海转债!
A114: 62 | B114: 123104 | C114: 卫宁转债! | D114: 300253 | E114: 卫宁健康 | F114: 计算机及 | G114: 软件开发 | H114: 120.2 | I114: 6.8999999999999999e-003 | J114: -4.0000000000000002e-004 | K114: 13.75 | L114: 2.3099999999999999e-002 | M114: 125.1 | N114: 17.74 | O114: 0.55100000000000005 | P114: 77.51 | Q114: 已到 | R114: 5.36年 | S114: 3.36年 | T114: 9.7 | U114: 36 | V114: 2.9999999999999999e-002 | W114: 3.3000000000000002e-002 | X114: 2.6000000000000002e-002 | Y114: 295 | Z114: 6.15 | AA114: 7.6e-003 | AB114: -2.0000000000000001e-004 | AC114: -4.1599999999999998e-002 | AD114: -4.3499999999999997e-002 | AE114: 89.62 | AF114: 100.55 | AG114: 0.28 | AH114: AA | AI114: 4.24e-002 | AJ114: =H114+100*O114 -> 175.30000000000001 | AK114: 162.9 | AL114: 263 | AM114: 62.3 | AN114: 215 | AO114: 2.7000000000000003e-002 | AP114: 5 | AQ114: 卫宁转债!
A115: 59 | B115: 113046 | C115: 金田转债! | D115: 601609 | E115: 金田铜业 | F115: 有色金属 | G115: 铜金属 | H115: 110.48 | I115: -5.1000000000000004e-003 | J115: 2.3e-003 | K115: 7.96 | L115: -1.e-002 | M115: 114.9 | N115: 10.75 | O115: 0.49200000000000005 | P115: 74.05 | Q115: 已到 | R115: 5.37年 | S115: 3.37年 | T115: 15 | U115: 22 | V115: 1.3000000000000001e-002 | W115: 0.127 | X115: 9.4e-002 | Y115: 118 | Z115: 1.67 | AA115: 7.4999999999999997e-003 | AB115: 2.3999999999999998e-003 | AC115: -1.8700000000000001e-002 | AD115: -2.0499999999999997e-002 | AE115: 90.9 | AF115: 94.67 | AG115: 0.29 | AH115: AA+ | AI115: 3.7400000000000003e-002 | AJ115: =H115+100*O115 -> 159.68000000000001 | AK115: 146.9 | AL115: 155 | AM115: 52.2 | AN115: 146 | AO115: -5.4000000000000006e-002 | AP115: 13 | AQ115: 金田转债!
A116: 50 | B116: 123110 | C116: 九典转债 | D116: 300705 | E116: 九典制药 | F116: 医药 | G116: 化学制药 | H116: 116.7 | I116: -7.1999999999999998e-003 | J116: 5.1999999999999998e-003 | K116: 22.27 | L116: -3.5999999999999999e-003 | M116: 121.4 | N116: 26.44 | O116: 0.38600000000000001 | P116: 84.23 | Q116: 已到 | R116: 5.40年 | S116: 3.40年 | T116: 2.7 | U116: 10 | V116: 3.2000000000000001e-002 | W116: 5.2000000000000005e-002 | X116: 4.2999999999999997e-002 | Y116: 52 | Z116: 5.25 | AA116: 7.4999999999999997e-003 | AB116: 7.000000000000001e-004 | AC116: -3.1e-002 | AD116: -3.3300000000000003e-002 | AE116: 81.07 | AF116: 83.16 | AG116: 0.57 | AH116: A+ | AI116: 7.4400000000000008e-002 | AJ116: =H116+100*O116 -> 155.30000000000001 | AK116: 149.2 | AL116: 172 | AM116: 66 | AN116: 237 | AO116: -0.10099999999999999 | AP116: 9 | AQ116: 九典转债
A117: 121 | B117: 113606 | C117: 荣泰转债 | D117: 603579 | E117: 荣泰健康 | F117: 机械装备 | G117: 专用设备 | H117: 116.6 | I117: -4.3e-003 | J117: 4.0000000000000002e-004 | K117: 28.86 | L117: -7.6e-003 | M117: 120.7 | N117: 32.83 | O117: 0.32600000000000001 | P117: 87.91 | Q117: 已到 | R117: 4.98年 | S117: 2.98年 | T117: 6 | U117: 3.1 | V117: 4.0000000000000001e-003 | W117: 0.14800000000000002 | X117: 0.13100000000000001 | Y117: 40 | Z117: 2.42 | AA117: 7.0999999999999995e-003 | AB117: -1.e-004 | AC117: -3.7100000000000001e-002 | AD117: -3.9199999999999999e-002 | AE117: 85.94 | AF117: 90.08 | AG117: 0.51 | AH117: AA- | AI117: 6.1799999999999994e-002 | AJ117: =H117+100*O117 -> 149.19999999999999 | AK117: 145.3 | AL117: 135 | AM117: 55.2 | AN117: 163 | AO117: -1.9e-002 | AP117: 11 | AQ117: 荣泰转债
A118: 353 | B118: 128026 | C118: 众兴转债! | D118: 2772 | E118: 众兴菌业 | F118: 农业 | G118: 种植业 | H118: 107.748 | I118: -1.15e-002 | J118: 1.15e-002 | K118: 7.88 | L118: -3.0800000000000001e-002 | M118: 109.3 | N118: 11.36 | O118: 0.55299999999999994 | P118: 69.37 | Q118: 已到 | R118: 2年37天 | S118: 37天 | T118: 4.09 | U118: 25 | V118: 5.5999999999999994e-002 | W118: 0.126 | X118: 8.6999999999999994e-002 | Y118: 33 | Z118: 1.07 | AA118: 6.9999999999999993e-003 | AB118: -1.4000000000000002e-003 | AC118: -0.22600000000000001 | AD118: -0.23899999999999999 | AE118: 100.22 | AF118: 96.89 | AG118: 0 | AH118: AA- | AI118: 6.0400000000000002e-002 | AJ118: =H118+100*O118 -> 163.048 | AK118: 146.1 | AL118: 144 | AM118: 45.9 | AN118: 94 | AO118: -9.5000000000000001e-002 | AP118: 58 | AQ118: 众兴转债!
A119: 196 | B119: 128108 | C119: 蓝帆转债!! | D119: 2382 | E119: 蓝帆医疗 | F119: 医药 | G119: 医疗器械 | H119: 109.531 | I119: -2.0999999999999999e-003 | J119: 3.0999999999999999e-003 | K119: 14.89 | L119: 2.7000000000000001e-003 | M119: 112.9 | N119: 18.24 | O119: 0.34200000000000003 | P119: 81.63 | Q119: 已到 | R119: 4.56年 | S119: 3.56年 | T119: 15.2 | U119: 28 | V119: 1.7000000000000001e-002 | W119: 0.10099999999999999 | X119: 8.3000000000000004e-002 | Y119: 150 | Z119: 1.18 | AA119: 6.8000000000000005e-003 | AB119: 1.6000000000000001e-003 | AC119: -1.0800000000000001e-002 | AD119: -1.3500000000000002e-002 | AE119: 90.89 | AF119: 94.45 | AG119: 0.37 | AH119: AA | AI119: 4.0800000000000003e-002 | AJ119: =H119+100*O119 -> 143.73099999999999 | AK119: 137.4 | AL119: 54 | AM119: 43 | AN119: 74 | AO119: -5.7000000000000002e-002 | AP119: 29 | AQ119: 蓝帆转债!!
A120: 164 | B120: 123061 | C120: 航新转债! | D120: 300424 | E120: 航新科技 | F120: 航空航天 | G120: 航空航天 | H120: 120.63 | I120: -1.3600000000000001e-002 | J120: 1.03e-002 | K120: 14.08 | L120: -5.6000000000000008e-003 | M120: 124.3 | N120: 14.85 | O120: 0.27200000000000002 | P120: 94.81 | Q120: 已到 | R120: 4.71年 | S120: 2.71年 | T120: 2.5 | U120: 106 | V120: 0.34999999999999998 | W120: 7.400000000000001e-002 | X120: 7.0000000000000007e-002 | Y120: 34 | Z120: 5 | AA120: 6.5000000000000006e-003 | AB120: -2.0999999999999999e-003 | AC120: -5.0099999999999999e-002 | AD120: -5.2699999999999997e-002 | AE120: 85.36 | AF120: 90.01 | AG120: 0.58 | AH120: A+ | AI120: 7.2800000000000004e-002 | AJ120: =H120+100*O120 -> 147.82999999999998 | AK120: 146.4 | AL120: 149 | AM120: 56.4 | AN120: 170 | AO120: -4.0999999999999995e-002 | AP120: 20 | AQ120: 航新转债!
A121: 153 | B121: 113598 | C121: 法兰转债 | D121: 603966 | E121: 法兰泰克 | F121: 机械装备 | G121: 工程机械 | H121: 117.27 | I121: 1.0200000000000001e-002 | J121: 2.6600000000000002e-002 | K121: 8.85 | L121: 7.0099999999999996e-002 | M121: 120.8 | N121: 9.7 | O121: 0.28499999999999998 | P121: 91.24 | Q121: 已到 | R121: 4.73年 | S121: 2.73年 | T121: 2.75 | U121: 185 | V121: 0.56000000000000005 | W121: 0.10400000000000001 | X121: 9.5000000000000001e-002 | Y121: 27 | Z121: 2.12 | AA121: 6.4000000000000003e-003 | AB121: -1.1999999999999999e-003 | AC121: -4.1799999999999997e-002 | AD121: -4.4199999999999996e-002 | AE121: 87.33 | AF121: 91.53 | AG121: 0.52 | AH121: AA- | AI121: 6.1799999999999994e-002 | AJ121: =H121+100*O121 -> 145.76999999999998 | AK121: 143.3 | AL121: 111 | AM121: 51.8 | AN121: 142 | AO121: 8.3000000000000004e-002 | AP121: 13 | AQ121: 法兰转债
A122: 73 | B122: 123097 | C122: 美力转债 | D122: 300611 | E122: 美力科技 | F122: 机械装备 | G122: 通用设备 | H122: 117.737 | I122: 1.41e-002 | J122: -1.0500000000000001e-002 | K122: 9.01 | L122: 5.6000000000000008e-003 | M122: 121.6 | N122: 9.28 | O122: 0.21299999999999999 | P122: 97.09 | Q122: 已到 | R122: 5.22年 | S122: 3.22年 | T122: 3 | U122: 21 | V122: 5.9999999999999998e-002 | W122: 0.18600000000000003 | X122: 0.18100000000000002 | Y122: 16 | Z122: 2.29 | AA122: 6.3e-003 | AB122: -8.0000000000000004e-004 | AC122: -3.4700000000000002e-002 | AD122: -3.7100000000000001e-002 | AE122: 82.28 | AF122: 84.4 | AG122: 0.64 | AH122: A+ | AI122: 7.4400000000000008e-002 | AJ122: =H122+100*O122 -> 139.03700000000001 | AK122: 138.4 | AL122: 62 | AM122: 54 | AN122: 155 | AO122: -9.0000000000000011e-003 | AP122: 21 | AQ122: 美力转债
A123: 152 | B123: 113599 | C123: 嘉友转债! | D123: 603871 | E123: 嘉友国际 | F123: 交通运输 | G123: 物流业 | H123: 122.33 | I123: 8.3999999999999995e-003 | J123: -4.6999999999999993e-003 | K123: 19.02 | L123: 6.3e-003 | M123: 125.6 | N123: 18.32 | O123: 0.17800000000000002 | P123: 103.82 | Q123: 已到 | R123: 4.75年 | S123: 2.75年 | T123: 7.2 | U123: 35 | V123: 4.0000000000000001e-002 | W123: 0.13300000000000001 | X123: 0.13800000000000001 | Y123: 54 | Z123: 2.6 | AA123: 5.6999999999999993e-003 | AB123: -3.3e-003 | AC123: -5.6100000000000004e-002 | AD123: -5.8299999999999998e-002 | AE123: 87.07 | AF123: 95.02 | AG123: 0.59 | AH123: AA- | AI123: 6.1799999999999994e-002 | AJ123: =H123+100*O123 -> 140.13 | AK123: 140.8 | AL123: 90 | AM123: 45.8 | AN123: 93 | AO123: 0.114 | AP123: 19 | AQ123: 嘉友转债!
A124: 65 | B124: 123101 | C124: 拓斯转债! | D124: 300607 | E124: 拓斯达 | F124: 机械装备 | G124: 机器人及 | H124: 111.811 | I124: 3.8e-003 | J124: -2.3999999999999998e-003 | K124: 15.46 | L124: 9.1000000000000004e-003 | M124: 115.1 | N124: 26.18 | O124: 0.89300000000000002 | P124: 59.05 | Q124: 已到 | R124: 5.34年 | S124: 3.34年 | T124: 6.7 | U124: 6.6 | V124: 9.0000000000000011e-003 | W124: 0.10199999999999999 | X124: 5.9999999999999998e-002 | Y124: 66 | Z124: 2.98 | AA124: 5.5000000000000005e-003 | AB124: 5.0000000000000001e-004 | AC124: -2.1700000000000001e-002 | AD124: -2.3599999999999999e-002 | AE124: 89.68 | AF124: 92.61 | AG124: 0.15 | AH124: AA | AI124: 4.24e-002 | AJ124: =H124+100*O124 -> 201.11099999999999 | AK124: 164.6 | AL124: 267 | AM124: 72 | AN124: 265 | AO124: -9.4e-002 | AP124: 7 | AQ124: 拓斯转债!
A125: 41 | B125: 123113 | C125: 仙乐转债! | D125: 300791 | E125: 仙乐健康 | F125: 食品饮料 | G125: 食品饮料 | H125: 115.18 | I125: -7.9000000000000008e-003 | J125: -1.0800000000000001e-002 | K125: 44.95 | L125: -3.9300000000000002e-002 | M125: 118.5 | N125: 56.88 | O125: 0.45700000000000002 | P125: 79.03 | Q125: 已到 | R125: 5.45年 | S125: 3.45年 | T125: 10.2 | U125: 66 | V125: 5.5e-002 | W125: 0.127 | X125: 0.10000000000000001 | Y125: 81 | Z125: 3.49 | AA125: 5.3e-003 | AB125: -5.9999999999999995e-004 | AC125: -2.8500000000000001e-002 | AD125: -3.0499999999999999e-002 | AE125: 83.34 | AF125: 85.37 | AG125: 0.48 | AH125: AA- | AI125: 6.3399999999999998e-002 | AJ125: =H125+100*O125 -> 160.88 | AK125: 151.3 | AL125: 190 | AM125: 66 | AN125: 236 | AO125: 7.8e-002 | AP125: 3 | AQ125: 仙乐转债!
A126: 181 | B126: 128116 | C126: 瑞达转债! | D126: 2961 | E126: 瑞达期货 | F126: 金融 | G126: 期货行业 | H126: 112.3 | I126: -1.8200000000000001e-002 | J126: 7.6e-003 | K126: 23.14 | L126: -3.2599999999999997e-002 | M126: 114.9 | N126: 29.55 | O126: 0.434 | P126: 78.31 | Q126: 已到 | R126: 4.64年 | S126: 2.64年 | T126: 6.49 | U126: 13 | V126: 1.8000000000000002e-002 | W126: 6.3e-002 | X126: 4.9000000000000002e-002 | Y126: 103 | Z126: 4.85 | AA126: 5.0000000000000001e-003 | AB126: -7.000000000000001e-004 | AC126: -2.9399999999999999e-002 | AD126: -3.1600000000000003e-002 | AE126: 92.42 | AF126: 95.77 | AG126: 0.33 | AH126: AA | AI126: 4.0800000000000003e-002 | AJ126: =H126+100*O126 -> 155.69999999999999 | AK126: 146.3 | AL126: 148 | AM126: 50.5 | AN126: 133 | AO126: -0.115 | AP126: 18 | AQ126: 瑞达转债!
A127: 104 | B127: 123080 | C127: 海波转债! | D127: 300517 | E127: 海波重科 | F127: 建筑 | G127: 建筑工程 | H127: 123.4 | I127: 6.5000000000000006e-003 | J127: 1.1999999999999999e-003 | K127: 12.93 | L127: 1.09e-002 | M127: 126.5 | N127: 11.58 | O127: 0.105 | P127: 111.66 | Q127: 已到 | R127: 5年26天 | S127: 3年26天 | T127: 2.44 | U127: 21 | V127: 6.8000000000000005e-002 | W127: 9.8000000000000004e-002 | X127: 0.11 | Y127: 25 | Z127: 2.89 | AA127: 5.0000000000000001e-003 | AB127: -3.5999999999999999e-003 | AC127: -5.0199999999999995e-002 | AD127: -5.2699999999999997e-002 | AE127: 83.26 | AF127: 88.75 | AG127: 0.7 | AH127: A+ | AI127: 7.4400000000000008e-002 | AJ127: =H127+100*O127 -> 133.90000000000001 | AK127: 135.1 | AL127: 41 | AM127: 46.4 | AN127: 97 | AO127: 5.9000000000000004e-002 | AP127: 23 | AQ127: 海波转债!
A128: 260 | B128: 110060 | C128: 天路转债! | D128: 600326 | E128: 西藏天路 | F128: 建筑 | G128: 水泥 | H128: 112.3 | I128: -1.2999999999999999e-003 | J128: -2.3999999999999998e-003 | K128: 6.25 | L128: -9.4999999999999998e-003 | M128: 114.3 | N128: 7.08 | O128: 0.27200000000000002 | P128: 88.28 | Q128: 已到 | R128: 3.98年 | S128: 1.98年 | T128: 7.06 | U128: 10 | V128: 1.3000000000000001e-002 | W128: 0.12300000000000001 | X128: 0.109 | Y128: 57 | Z128: 1.34 | AA128: 4.5000000000000005e-003 | AB128: -2.e-003 | AC128: -4.07e-002 | AD128: -4.3099999999999999e-002 | AE128: 94.41 | AF128: 97.78 | AG128: 0.4 | AH128: AA | AI128: 4.0800000000000003e-002 | AJ128: =H128+100*O128 -> 139.5 | AK128: 136.3 | AL128: 45 | AM128: 38.5 | AN128: 41 | AO128: -3.7999999999999999e-002 | AP128: 12 | AQ128: 天路转债!
A129: 347 | B129: 128034 | C129: 江银转债! | D129: 2807 | E129: 江阴银行 | F129: 金融 | G129: 银行行业 | H129: 107.3 | I129: 4.0000000000000002e-004 | J129: -1.1999999999999999e-003 | K129: 3.73 | L129: -2.7000000000000001e-003 | M129: 108.3 | N129: 4.32 | O129: 0.24299999999999999 | P129: 86.34 | Q129: 已到 | R129: 2.22年 | S129: 无权 | T129: 17.6 | U129: 5.7 | V129: 3.0000000000000001e-003 | W129: 0.217 | X129: 0.187 | Y129: 81 | Z129: 0.67 | AA129: 4.1999999999999997e-003 | AB129: -2.8000000000000004e-003 | AC129: 无权 | AD129: 无权 | AE129: 无权 | AF129: 100.56 | AG129: 0.28 | AH129: AA+ | AI129: 3.44e-002 | AJ129: =H129+100*O129 -> 131.59999999999999 | AK129: 128.3 | AL129: 11 | AM129: 27.7 | AN129: 8 | AO129: -3.4000000000000002e-002 | AP129: 29 | AQ129: 江银转债!
A130: 124 | B130: 113605 | C130: 大参转债! | D130: 603233 | E130: 大参林 | F130: 医药 | G130: 医药商业 | H130: 112.85 | I130: 8.9999999999999998e-004 | J130: -7.000000000000001e-004 | K130: 39.58 | L130: 1.8e-003 | M130: 114.9 | N130: 69.09 | O130: 0.96999999999999997 | P130: 57.29 | Q130: 已到 | R130: 4.96年 | S130: 2.96年 | T130: 14 | U130: 6.5 | V130: 4.0000000000000001e-003 | W130: 4.4999999999999998e-002 | X130: 2.6000000000000002e-002 | Y130: 313 | Z130: 5.88 | AA130: 3.7000000000000002e-003 | AB130: -1.7000000000000001e-003 | AC130: -2.7799999999999998e-002 | AD130: -2.98e-002 | AE130: 91.34 | AF130: 94.58 | AG130: 0.1 | AH130: AA | AI130: 4.0800000000000003e-002 | AJ130: =H130+100*O130 -> 209.84999999999999 | AK130: 168.4 | AL130: 280 | AM130: 73.8 | AN130: 273 | AO130: -6.4000000000000001e-002 | AP130: 7 | AQ130: 大参转债!
A131: 159 | B131: 123062 | C131: 三超转债 | D131: 300554 | E131: 三超新材 | F131: 机械装备 | G131: 通用设备 | H131: 117.383 | I131: 5.7999999999999996e-003 | J131: -5.4000000000000003e-003 | K131: 15.18 | L131: 7.000000000000001e-004 | M131: 119.2 | N131: 17.13 | O131: 0.32500000000000001 | P131: 88.62 | Q131: 已到 | R131: 4.72年 | S131: 2.72年 | T131: 1.95 | U131: 12 | V131: 5.4000000000000006e-002 | W131: 0.13699999999999998 | X131: 0.121 | Y131: 14 | Z131: 2.71 | AA131: 3.3e-003 | AB131: -3.7000000000000002e-003 | AC131: -4.0999999999999995e-002 | AD131: -4.36e-002 | AE131: 82.94 | AF131: 82.62 | AG131: 0.61 | AH131: A | AI131: 8.2799999999999999e-002 | AJ131: =H131+100*O131 -> 149.88299999999998 | AK131: 146.1 | AL131: 146 | AM131: 63.2 | AN131: 221 | AO131: -4.0000000000000001e-002 | AP131: 27 | AQ131: 三超转债
A132: 200 | B132: 128107 | C132: 交科转债 | D132: 2061 | E132: 浙江交科 | F132: 建筑 | G132: 建筑工程 | H132: 113.58 | I132: -3.3e-003 | J132: -1.6000000000000001e-003 | K132: 5.12 | L132: -9.7000000000000003e-003 | M132: 114.9 | N132: 5.24 | O132: 0.16200000000000001 | P132: 97.71 | Q132: 已到 | R132: 4.46年 | S132: 2.46年 | T132: 25 | U132: 24 | V132: 8.0000000000000002e-003 | W132: 0.35499999999999998 | X132: 0.34700000000000003 | Y132: 70 | Z132: 0.78 | AA132: 2.5999999999999999e-003 | AB132: -3.4000000000000002e-003 | AC132: -3.5400000000000001e-002 | AD132: -3.78e-002 | AE132: 94.37 | AF132: 98.55 | AG132: 0.51 | AH132: AA+ | AI132: 3.5799999999999998e-002 | AJ132: =H132+100*O132 -> 129.78 | AK132: 129.5 | AL132: 14 | AM132: 30.9 | AN132: 12 | AO132: -2.1000000000000001e-002 | AP132: 20 | AQ132: 交科转债
A133: 61 | B133: 123105 | C133: 拓尔转债! | D133: 300229 | E133: 拓尔思 | F133: 计算机及 | G133: 软件开发 | H133: 119.44 | I133: 1.8700000000000001e-002 | J133: -6.5000000000000006e-003 | K133: 9.15 | L133: 2.12e-002 | M133: 121 | N133: 9.96 | O133: 0.29999999999999999 | P133: 91.87 | Q133: 已到 | R133: 5.36年 | S133: 3.36年 | T133: 8 | U133: 36 | V133: 3.7000000000000005e-002 | W133: 0.122 | X133: 0.11199999999999999 | Y133: 65 | Z133: 2.96 | AA133: 2.5000000000000001e-003 | AB133: -4.1999999999999997e-003 | AC133: -3.9e-002 | AD133: -4.0999999999999995e-002 | AE133: 83.84 | AF133: 87.63 | AG133: 0.57 | AH133: AA- | AI133: 6.3399999999999998e-002 | AJ133: =H133+100*O133 -> 149.44 | AK133: 147 | AL133: 156 | AM133: 59.4 | AN133: 197 | AO133: 3.0000000000000001e-003 | AP133: 9 | AQ133: 拓尔转债!
A134: 320 | B134: 110047 | C134: 山鹰转债 | D134: 600567 | E134: 山鹰国际 | F134: 造纸包装 | G134: 包装用纸 | H134: 116.7 | I134: 2.e-003 | J134: 4.7999999999999996e-003 | K134: 3.3 | L134: 1.54e-002 | M134: 117.5 | N134: 3.3 | O134: 0.16699999999999998 | P134: 100 | Q134: 已到 | R134: 3年15天 | S134: 1年15天 | T134: 22.5 | U134: 38 | V134: 1.3999999999999999e-002 | W134: 0.14699999999999999 | X134: 0.14699999999999999 | Y134: 152 | Z134: 0.95 | AA134: 2.3e-003 | AB134: -7.8000000000000005e-003 | AC134: -0.10000000000000001 | AD134: -0.10000000000000001 | AE134: 98.6 | AF134: 105.84 | AG134: 0.44 | AH134: AA+ | AI134: 3.5799999999999998e-002 | AJ134: =H134+100*O134 -> 133.40000000000001 | AK134: 133.4 | AL134: 32 | AM134: 27.6 | AN134: 7 | AO134: -8.0000000000000002e-003 | AP134: 28 | AQ134: 山鹰转债
A135: 81 | B135: 127028 | C135: 英特转债! | D135: 411 | E135: 英特集团 | F135: 医药 | G135: 医药商业 | H135: 112.001 | I135: -3.3e-003 | J135: -3.5999999999999999e-003 | K135: 12.63 | L135: -1.3300000000000001e-002 | M135: 113.1 | N135: 13.4 | O135: 0.188 | P135: 94.25 | Q135: 已到 | R135: 5.16年 | S135: 3.16年 | T135: 6 | U135: 12 | V135: 1.8000000000000002e-002 | W135: 0.191 | X135: 0.17999999999999999 | Y135: 31 | Z135: 1.77 | AA135: 1.9e-003 | AB135: -2.7000000000000001e-003 | AC135: -2.3300000000000001e-002 | AD135: -2.53e-002 | AE135: 91.78 | AF135: 93.93 | AG135: 0.52 | AH135: AA+ | AI135: 3.7400000000000003e-002 | AJ135: =H135+100*O135 -> 130.80100000000002 | AK135: 129.7 | AL135: 16 | AM135: 35.8 | AN135: 29 | AO135: 1.9e-002 | AP135: 29 | AQ135: 英特转债!
A136: 68 | B136: 128144 | C136: 利民转债! | D136: 2734 | E136: 利民股份 | F136: 化工 | G136: 农化 | H136: 113.001 | I136: -1.8e-003 | J136: -1.4000000000000002e-003 | K136: 10.02 | L136: -6.8999999999999999e-003 | M136: 114.1 | N136: 11.5 | O136: 0.29699999999999999 | P136: 87.13 | Q136: 已到 | R136: 5.32年 | S136: 3.32年 | T136: 9.8 | U136: 0.8 | V136: 1.e-003 | W136: 0.26200000000000001 | X136: 0.22899999999999998 | Y136: 37 | Z136: 1.48 | AA136: 1.9e-003 | AB136: -2.8999999999999998e-003 | AC136: -2.69e-002 | AD136: -2.8399999999999998e-002 | AE136: 89.11 | AF136: 91.83 | AG136: 0.46 | AH136: AA | AI136: 4.24e-002 | AJ136: =H136+100*O136 -> 142.70099999999999 | AK136: 138.9 | AL136: 68 | AM136: 47 | AN136: 105 | AO136: -5.5999999999999994e-002 | AP136: 6 | AQ136: 利民转债!
A137: 87 | B137: 123090 | C137: 三诺转债! | D137: 300298 | E137: 三诺生物 | F137: 医药 | G137: 医疗器械 | H137: 116.1 | I137: 8.6999999999999994e-003 | J137: -5.1000000000000004e-003 | K137: 24.45 | L137: 1.4499999999999999e-002 | M137: 117.1 | N137: 35.18 | O137: 0.67099999999999993 | P137: 69.5 | Q137: 已到 | R137: 5年45天 | S137: 3年45天 | T137: 5 | U137: 3.1 | V137: 5.0000000000000001e-003 | W137: 3.6000000000000004e-002 | X137: 2.5000000000000001e-002 | Y137: 138 | Z137: 5.1 | AA137: 1.7000000000000001e-003 | AB137: -4.1999999999999997e-003 | AC137: -3.4300000000000004e-002 | AD137: -3.6299999999999999e-002 | AE137: 90.49 | AF137: 95.06 | AG137: 0.24 | AH137: AA | AI137: 4.24e-002 | AJ137: =H137+100*O137 -> 183.19999999999999 | AK137: 162.7 | AL137: 262 | AM137: 67.6 | AN137: 247 | AO137: -1.2e-002 | AP137: 4 | AQ137: 三诺转债!
A138: 11 | B138: 123123 | C138: 江丰转债! | D138: 300666 | E138: 江丰电子 | F138: 电子 | G138: 电子行业 | H138: 120.39 | I138: 1.1699999999999999e-002 | J138: -1.0200000000000001e-002 | K138: 42.61 | L138: 2.5999999999999999e-003 | M138: 121.5 | N138: 51.93 | O138: 0.46700000000000003 | P138: 82.05 | Q138: 3月14天 | R138: 5.76年 | S138: 3.76年 | T138: 5.17 | U138: 34 | V138: 5.5e-002 | W138: 5.4000000000000006e-002 | X138: 4.4000000000000004e-002 | Y138: 96 | Z138: 7.77 | AA138: 1.6000000000000001e-003 | AB138: -4.6999999999999993e-003 | AC138: -3.5900000000000001e-002 | AD138: -3.7900000000000003e-002 | AE138: 78.99 | AF138: 81.08 | AG138: 0.57 | AH138: A+ | AI138: 7.4400000000000008e-002 | AJ138: =H138+100*O138 -> 167.09 | AK138: 158.7 | AL138: 238 | AM138: 77.6 | AN138: 288 | AO138: -6.0000000000000001e-003 | AP138: 5 | AQ138: 江丰转债!
A139: 366 | B139: 128014 | C139: 永东转债! | D139: 2753 | E139: 永东股份 | F139: 化工 | G139: 化工 | H139: 109.6 | I139: -3.2000000000000002e-003 | J139: 2.3999999999999998e-003 | K139: 7.92 | L139: -1.9799999999999998e-002 | M139: 109.8 | N139: 12.52 | O139: 0.73299999999999998 | P139: 63.26 | Q139: 已到 | R139: 1.44年 | S139: 回售内 | T139: 3.37 | U139: 3.3 | V139: 9.0000000000000011e-003 | W139: 0.113 | X139: 7.2000000000000008e-002 | Y139: 30 | Z139: 1.42 | AA139: 1.2999999999999999e-003 | AB139: -1.1299999999999999e-002 | AC139: 回售内 | AD139: 回售内 | AE139: 100.3 | AF139: 100.98 | AG139: 0.04 | AH139: AA- | AI139: 6.0400000000000002e-002 | AJ139: =H139+100*O139 -> 182.89999999999998 | AK139: 155.9 | AL139: 218 | AM139: 55 | AN139: 160 | AO139: -0.12300000000000001 | AP139: 36 | AQ139: 永东转债!
A140: 7 | B140: 127044 | C140: 蒙娜转债! | D140: 2918 | E140: 蒙娜丽莎 | F140: 建筑 | G140: 其他建材 | H140: 117.01 | I140: -1.1000000000000001e-003 | J140: -1.1999999999999999e-003 | K140: 19.41 | L140: -7.7000000000000002e-003 | M140: 117.1 | N140: 27.07 | O140: 0.63200000000000001 | P140: 71.7 | Q140: 3月17天 | R140: 5.78年 | S140: 3.78年 | T140: 11.7 | U140: 12 | V140: 8.0000000000000002e-003 | W140: 0.14499999999999999 | X140: 0.10400000000000001 | Y140: 80 | Z140: 2.16 | AA140: 1.e-004 | AB140: -5.1000000000000004e-003 | AC140: -3.0600000000000002e-002 | AD140: -3.2300000000000002e-002 | AE140: 88.08 | AF140: 92.52 | AG140: 0.3 | AH140: AA | AI140: 4.24e-002 | AJ140: =H140+100*O140 -> 180.21000000000001 | AK140: 162.3 | AL140: 260 | AM140: 69.8 | AN140: 257 | AO140: -7.0000000000000007e-002 | AP140: 2 | AQ140: 蒙娜转债!
A141: 79 | B141: 113618 | C141: 美诺转债! | D141: 603538 | E141: 美诺华 | F141: 医药 | G141: 原料药 | H141: 115.4 | I141: -8.6e-003 | J141: 3.7000000000000002e-003 | K141: 28.9 | L141: -1.06e-002 | M141: 115.3 | N141: 37.47 | O141: 0.496 | P141: 77.13 | Q141: 已到 | R141: 5.19年 | S141: 3.19年 | T141: 5.2 | U141: 6.7 | V141: 1.1000000000000001e-002 | W141: 0.12 | X141: 9.3000000000000013e-002 | Y141: 43 | Z141: 2.56 | AA141: -2.0000000000000001e-004 | AB141: -5.4000000000000003e-003 | AC141: -3.1400000000000004e-002 | AD141: -3.3399999999999999e-002 | AE141: 84.65 | AF141: 84.41 | AG141: 0.46 | AH141: AA- | AI141: 6.3399999999999998e-002 | AJ141: =H141+100*O141 -> 165. | AK141: 153.7 | AL141: 204 | AM141: 69 | AN141: 253 | AO141: -9.6000000000000002e-002 | AP141: 5 | AQ141: 美诺转债!
A142: 252 | B142: 110062 | C142: 烽火转债! | D142: 600498 | E142: 烽火通信 | F142: 通信互联 | G142: 通信设备 | H142: 110.96 | I142: -6.9999999999999993e-003 | J142: 4.6999999999999993e-003 | K142: 17.57 | L142: -9.0000000000000011e-003 | M142: 110.8 | N142: 22.85 | O142: 0.44299999999999995 | P142: 76.89 | Q142: 已到 | R142: 4年26天 | S142: 2年26天 | T142: 30.9 | U142: 4 | V142: 1.e-003 | W142: 0.155 | X142: 0.11900000000000001 | Y142: 199 | Z142: 1.81 | AA142: -4.0000000000000002e-004 | AB142: -5.3e-003 | AC142: -3.1800000000000002e-002 | AD142: -3.4500000000000003e-002 | AE142: 95.97 | AF142: 97.07 | AG142: 0.25 | AH142: AAA | AI142: 3.3799999999999997e-002 | AJ142: =H142+100*O142 -> 155.25999999999999 | AK142: 145 | AL142: 133 | AM142: 48 | AN142: 113 | AO142: -1.8000000000000002e-002 | AP142: 19 | AQ142: 烽火转债!
A143: 123 | B143: 123073 | C143: 同和转债! | D143: 300636 | E143: 同和药业 | F143: 医药 | G143: 原料药 | H143: 122.388 | I143: -7.4000000000000003e-003 | J143: -4.5000000000000005e-003 | K143: 15.78 | L143: -1.7399999999999999e-002 | M143: 121.9 | N143: 14.82 | O143: 0.14899999999999999 | P143: 106.48 | Q143: 已到 | R143: 4.97年 | S143: 2.97年 | T143: 3.59 | U143: 27 | V143: 6.2e-002 | W143: 0.11 | X143: 0.11800000000000001 | Y143: 32 | Z143: 3.95 | AA143: -8.0000000000000004e-004 | AB143: -8.3000000000000001e-003 | AC143: -5.0799999999999998e-002 | AD143: -5.3099999999999994e-002 | AE143: 83.66 | AF143: 86.63 | AG143: 0.68 | AH143: A+ | AI143: 7.2800000000000004e-002 | AJ143: =H143+100*O143 -> 137.28800000000001 | AK143: 138.3 | AL143: 61 | AM143: 51.7 | AN143: 141 | AO143: -1.7000000000000001e-002 | AP143: 12 | AQ143: 同和转债!
A144: 303 | B144: 110053 | C144: 苏银转债! | D144: 600919 | E144: 江苏银行 | F144: 金融 | G144: 银行行业 | H144: 118.8 | I144: -2.3e-003 | J144: 8.0000000000000004e-004 | K144: 6.32 | L144: -3.2000000000000002e-003 | M144: 118.3 | N144: 6.37 | O144: 0.19699999999999998 | P144: 99.22 | Q144: 已到 | R144: 3.35年 | S144: 无权 | T144: 200 | U144: 110 | V144: 5.0000000000000001e-003 | W144: 0.214 | X144: 0.21299999999999999 | Y144: 933 | Z144: 0.64 | AA144: -1.2999999999999999e-003 | AB144: -1.09e-002 | AC144: 无权 | AD144: 无权 | AE144: 无权 | AF144: 106.22 | AG144: 0.45 | AH144: AAA | AI144: 3.3799999999999997e-002 | AJ144: =H144+100*O144 -> 138.5 | AK144: 138.4 | AL144: 63 | AM144: 32.2 | AN144: 20 | AO144: 1.7000000000000001e-002 | AP144: 35 | AQ144: 苏银转债!
A145: 114 | B145: 127025 | C145: 冀东转债! | D145: 401 | E145: 冀东水泥 | F145: 建筑 | G145: 水泥 | H145: 110.7 | I145: -8.9999999999999998e-004 | J145: -1.5e-003 | K145: 11.4 | L145: -7.8000000000000005e-003 | M145: 110.1 | N145: 15.28 | O145: 0.48399999999999999 | P145: 74.61 | Q145: 已到 | R145: 4.998年 | S145: 2.998年 | T145: 17.8 | U145: 4.5 | V145: 2.e-003 | W145: 0.11 | X145: 8.199999999999999e-002 | Y145: 161 | Z145: 0.99 | AA145: -1.5e-003 | AB145: -5.1000000000000004e-003 | AC145: -2.3700000000000002e-002 | AD145: -2.53e-002 | AE145: 92.01 | AF145: 92.6 | AG145: 0.3 | AH145: AAA | AI145: 3.5400000000000001e-002 | AJ145: =H145+100*O145 -> 159.09999999999999 | AK145: 146.8 | AL145: 153 | AM145: 54.2 | AN145: 159 | AO145: -7.4999999999999997e-002 | AP145: 9 | AQ145: 冀东转债!
A146: 249 | B146: 110063 | C146: 鹰19转债 | D146: 600567 | E146: 山鹰国际 | F146: 造纸包装 | G146: 包装用纸 | H146: 116.87 | I146: 2.0999999999999999e-003 | J146: 5.8999999999999999e-003 | K146: 3.3 | L146: 1.54e-002 | M146: 115.9 | N146: 3.26 | O146: 0.155 | P146: 101.23 | Q146: 已到 | R146: 4年37天 | S146: 2年37天 | T146: 18.4 | U146: 16 | V146: 6.9999999999999993e-003 | W146: 0.121 | X146: 0.12300000000000001 | Y146: 152 | Z146: 0.95 | AA146: -2.0999999999999999e-003 | AB146: -8.8999999999999999e-003 | AC146: -5.3699999999999998e-002 | AD146: -5.6299999999999996e-002 | AE146: 95.4 | AF146: 100.64 | AG146: 0.52 | AH146: AA+ | AI146: 3.5799999999999998e-002 | AJ146: =H146+100*O146 -> 132.37 | AK146: 132.5 | AL146: 27 | AM146: 31.9 | AN146: 18 | AO146: -8.0000000000000002e-003 | AP146: 31 | AQ146: 鹰19转债
A147: 224 | B147: 113570 | C147: 百达转债! | D147: 603331 | E147: 百达精工 | F147: 机械装备 | G147: 机械装备 | H147: 115.95 | I147: 3.0000000000000001e-003 | J147: -7.000000000000001e-004 | K147: 10.64 | L147: 3.8e-003 | M147: 114.9 | N147: 11.34 | O147: 0.23600000000000002 | P147: 93.83 | Q147: 已到 | R147: 4.34年 | S147: 2.34年 | T147: 2.8 | U147: 2.7 | V147: 8.0000000000000002e-003 | W147: 0.14800000000000002 | X147: 0.13900000000000001 | Y147: 19 | Z147: 2.33 | AA147: -2.0999999999999999e-003 | AB147: -8.199999999999999e-003 | AC147: -4.4999999999999998e-002 | AD147: -4.7400000000000005e-002 | AE147: 86.84 | AF147: 85.26 | AG147: 0.61 | AH147: A+ | AI147: 7.2800000000000004e-002 | AJ147: =H147+100*O147 -> 139.55000000000001 | AK147: 138.1 | AL147: 58 | AM147: 51.2 | AN147: 139 | AO147: 2.e-003 | AP147: 32 | AQ147: 百达转债!
A148: 97 | B148: 127027 | C148: 靖远转债! | D148: 552 | E148: 靖远煤电 | F148: 煤炭 | G148: 煤炭开采 | H148: 116.5 | I148: -5.5000000000000005e-003 | J148: -1.26e-002 | K148: 3 | L148: -3.5400000000000001e-002 | M148: 115.3 | N148: 3.13 | O148: 0.215 | P148: 95.85 | Q148: 已到 | R148: 5年34天 | S148: 3年34天 | T148: 24.3 | U148: 78 | V148: 2.7000000000000003e-002 | W148: 0.35399999999999998 | X148: 0.34000000000000002 | Y148: 69 | Z148: 0.85 | AA148: -2.0999999999999999e-003 | AB148: -7.4000000000000003e-003 | AC148: -3.5099999999999999e-002 | AD148: -3.73e-002 | AE148: 92.22 | AF148: 96.03 | AG148: 0.51 | AH148: AA+ | AI148: 3.7400000000000003e-002 | AJ148: =H148+100*O148 -> 138. | AK148: 137.2 | AL148: 51 | AM148: 41.1 | AN148: 58 | AO148: -0.14800000000000002 | AP148: 42 | AQ148: 靖远转债!
A149: 71 | B149: 123099 | C149: 普利转债 | D149: 300630 | E149: 普利制药 | F149: 医药 | G149: 化学制药 | H149: 125 | I149: -1.5700000000000002e-002 | J149: 4.5999999999999999e-003 | K149: 49.65 | L149: -1.6799999999999999e-002 | M149: 123.5 | N149: 46.03 | O149: 0.159 | P149: 107.86 | Q149: 已到 | R149: 5.26年 | S149: 3.26年 | T149: 8.5 | U149: 29 | V149: 2.7000000000000003e-002 | W149: 3.9e-002 | X149: 4.2000000000000003e-002 | Y149: 217 | Z149: 9.12 | AA149: -2.3e-003 | AB149: -9.7999999999999997e-003 | AC149: -5.3200000000000004e-002 | AD149: -5.5099999999999996e-002 | AE149: 84.31 | AF149: 89.98 | AG149: 0.66 | AH149: AA- | AI149: 6.3399999999999998e-002 | AJ149: =H149+100*O149 -> 140.90000000000001 | AK149: 142.1 | AL149: 105 | AM149: 52.2 | AN149: 145 | AO149: 3.7999999999999999e-002 | AP149: 5 | AQ149: 普利转债
A150: 262 | B150: 127014 | C150: 北方转债! | D150: 65 | E150: 北方国际 | F150: 建筑 | G150: 建筑工程 | H150: 115.477 | I150: 2.2000000000000001e-003 | J150: -8.1000000000000013e-003 | K150: 7.47 | L150: -1.7100000000000001e-002 | M150: 114.3 | N150: 8.65 | O150: 0.33700000000000002 | P150: 86.36 | Q150: 已到 | R150: 3.96年 | S150: 1.96年 | T150: 5.35 | U150: 4 | V150: 6.0000000000000001e-003 | W150: 9.1999999999999998e-002 | X150: 8.0000000000000002e-002 | Y150: 58 | Z150: 0.97 | AA150: -2.5999999999999999e-003 | AB150: -9.1000000000000004e-003 | AC150: -5.3399999999999996e-002 | AD150: -5.5800000000000002e-002 | AE150: 95.42 | AF150: 99.67 | AG150: 0.35 | AH150: AA+ | AI150: 3.5799999999999998e-002 | AJ150: =H150+100*O150 -> 149.17700000000002 | AK150: 144.6 | AL150: 129 | AM150: 44.9 | AN150: 87 | AO150: -3.6000000000000004e-002 | AP150: 18 | AQ150: 北方转债!
A151: 195 | B151: 127017 | C151: 万青转债 | D151: 789 | E151: 万年青 | F151: 建筑 | G151: 水泥 | H151: 119.5 | I151: -8.3000000000000001e-003 | J151: 2.e-003 | K151: 11.15 | L151: -2.0199999999999999e-002 | M151: 118 | N151: 13.46 | O151: 0.44299999999999995 | P151: 82.84 | Q151: 已到 | R151: 4.57年 | S151: 2.57年 | T151: 10 | U151: 4.8 | V151: 4.0000000000000001e-003 | W151: 0.11199999999999999 | X151: 9.3000000000000013e-002 | Y151: 89 | Z151: 1.3 | AA151: -2.8000000000000004e-003 | AB151: -9.5999999999999992e-003 | AC151: -5.21e-002 | AD151: -5.4199999999999998e-002 | AE151: 93.92 | AF151: 100.78 | AG151: 0.31 | AH151: AA+ | AI151: 3.5799999999999998e-002 | AJ151: =H151+100*O151 -> 163.80000000000001 | AK151: 156.2 | AL151: 220 | AM151: 55.4 | AN151: 164 | AO151: -8.199999999999999e-002 | AP151: 8 | AQ151: 万青转债
A152: 25 | B152: 123117 | C152: 健帆转债! | D152: 300529 | E152: 健帆生物 | F152: 医药 | G152: 医疗器械 | H152: 116.9 | I152: 5.1000000000000004e-003 | J152: -7.8000000000000005e-003 | K152: 50.94 | L152: -2.06e-002 | M152: 115.1 | N152: 90.57 | O152: 1.0800000000000001 | P152: 56.24 | Q152: 53天 | R152: 5.63年 | S152: 3.63年 | T152: 10 | U152: 6.6 | V152: 6.0000000000000001e-003 | W152: 2.4e-002 | X152: 1.3999999999999999e-002 | Y152: 410 | Z152: 13.45 | AA152: -2.8000000000000004e-003 | AB152: -7.6e-003 | AC152: -3.1600000000000003e-002 | AD152: -3.3300000000000003e-002 | AE152: 88.62 | AF152: 91.51 | AG152: 0.13 | AH152: AA | AI152: 4.24e-002 | AJ152: =H152+100*O152 -> 224.90000000000001 | AK152: 177.6 | AL152: 303 | AM152: 86 | AN152: 300 | AO152: -5.2999999999999999e-002 | AP152: 6 | AQ152: 健帆转债!
A153: 285 | B153: 110058 | C153: 永鼎转债! | D153: 600105 | E153: 永鼎股份 | F153: 通信互联 | G153: 通信设备 | H153: 115.42 | I153: -2.2000000000000001e-003 | J153: 1.0800000000000001e-002 | K153: 4.56 | L153: 1.7899999999999999e-002 | M153: 114.3 | N153: 5.04 | O153: 0.27600000000000002 | P153: 90.48 | Q153: 已到 | R153: 3.44年 | S153: 1.44年 | T153: 2.61 | U153: 76 | V153: 0.251 | W153: 4.0999999999999995e-002 | X153: 3.7999999999999999e-002 | Y153: 63 | Z153: 2.24 | AA153: -2.8999999999999998e-003 | AB153: -1.03e-002 | AC153: -7.0000000000000007e-002 | AD153: -7.3099999999999998e-002 | AE153: 93.43 | AF153: 93.39 | AG153: 0.48 | AH153: AA- | AI153: 6.1799999999999994e-002 | AJ153: =H153+100*O153 -> 143.02000000000001 | AK153: 140.4 | AL153: 83 | AM153: 46.9 | AN153: 103 | AO153: 0.114 | AP153: 46 | AQ153: 永鼎转债!
A154: 20 | B154: 127041 | C154: 弘亚转债! | D154: 2833 | E154: 弘亚数控 | F154: 机械装备 | G154: 专用设备 | H154: 120.4 | I154: -1.6000000000000001e-003 | J154: -2.0999999999999999e-003 | K154: 30.5 | L154: -8.8000000000000005e-003 | M154: 118.75 | N154: 38.09 | O154: 0.504 | P154: 80.07 | Q154: 2月12天 | R154: 4.68年 | S154: 2.68年 | T154: 6 | U154: 3.5 | V154: 5.0000000000000001e-003 | W154: 6.5000000000000002e-002 | X154: 5.2000000000000005e-002 | Y154: 92 | Z154: 4.63 | AA154: -3.0000000000000001e-003 | AB154: -9.8999999999999991e-003 | AC154: -5.5300000000000002e-002 | AD154: -5.6799999999999996e-002 | AE154: 86.52 | AF154: 90.07 | AG154: 0.42 | AH154: AA- | AI154: 6.1799999999999994e-002 | AJ154: =H154+100*O154 -> 170.80000000000001 | AK154: 160.7 | AL154: 251 | AM154: 70.7 | AN154: 263 | AO154: -6.0000000000000001e-003 | AP154: 5 | AQ154: 弘亚转债!
A155: 223 | B155: 110067 | C155: 华安转债! | D155: 600909 | E155: 华安证券 | F155: 金融 | G155: 证券行业 | H155: 111.92 | I155: -2.8000000000000004e-003 | J155: 1.e-004 | K155: 5.01 | L155: -7.9000000000000008e-003 | M155: 110.3 | N155: 6.22 | O155: 0.39000000000000001 | P155: 80.55 | Q155: 已到 | R155: 4.35年 | S155: 无权 | T155: 28 | U155: 68 | V155: 2.2000000000000002e-002 | W155: 0.11900000000000001 | X155: 9.6000000000000002e-002 | Y155: 235 | Z155: 1.26 | AA155: -3.4000000000000002e-003 | AB155: -7.7000000000000002e-003 | AC155: 无权 | AD155: 无权 | AE155: 无权 | AF155: 95.66 | AG155: 0.33 | AH155: AAA | AI155: 3.3799999999999997e-002 | AJ155: =H155+100*O155 -> 150.92000000000002 | AK155: 143.3 | AL155: 110 | AM155: 47.6 | AN155: 111 | AO155: -3.9e-002 | AP155: 27 | AQ155: 华安转债!
A156: 161 | B156: 110073 | C156: 国投转债 | D156: 600061 | E156: 国投资本 | F156: 金融 | G156: 证券行业 | H156: 112.04 | I156: -1.3000000000000001e-002 | J156: 1.44e-002 | K156: 8.14 | L156: 3.7000000000000002e-003 | M156: 110.3 | N156: 9.9 | O156: 0.36299999999999999 | P156: 82.22 | Q156: 已到 | R156: 4.71年 | S156: 无权 | T156: 80 | U156: 124 | V156: 1.3999999999999999e-002 | W156: 0.153 | X156: 0.126 | Y156: 523 | Z156: 1.15 | AA156: -3.4000000000000002e-003 | AB156: -7.4000000000000003e-003 | AC156: 无权 | AD156: 无权 | AE156: 无权 | AF156: 94.5 | AG156: 0.36 | AH156: AAA | AI156: 3.3799999999999997e-002 | AJ156: =H156+100*O156 -> 148.34 | AK156: 141.9 | AL156: 102 | AM156: 47.4 | AN156: 108 | AO156: -5.4000000000000006e-002 | AP156: 25 | AQ156: 国投转债
A157: 67 | B157: 113045 | C157: 环旭转债! | D157: 601231 | E157: 环旭电子 | F157: 电子 | G157: 电子产品 | H157: 114.5 | I157: 5.8999999999999999e-003 | J157: -1.7000000000000001e-003 | K157: 14.6 | L157: 1.5300000000000001e-002 | M157: 112 | N157: 19.75 | O157: 0.54899999999999993 | P157: 73.92 | Q157: 34天 | R157: 5.32年 | S157: 2.32年 | T157: 34.5 | U157: 10 | V157: 3.0000000000000001e-003 | W157: 0.107 | X157: 7.9000000000000001e-002 | Y157: 323 | Z157: 2.71 | AA157: -4.1999999999999997e-003 | AB157: -8.3000000000000001e-003 | AC157: -4.2000000000000003e-002 | AD157: -4.4199999999999996e-002 | AE157: 93.92 | AF157: 92.35 | AG157: 0.27 | AH157: AA+ | AI157: 3.7400000000000003e-002 | AJ157: =H157+100*O157 -> 169.39999999999998 | AK157: 155.1 | AL157: 211 | AM157: 61.2 | AN157: 205 | AO157: 5.0000000000000003e-002 | AP157: 6 | AQ157: 环旭转债!
A158: 297 | B158: 127012 | C158: 招路转债! | D158: 1965 | E158: 招商公路 | F158: 机场高速 | G158: 高速 | H158: 109.45 | I158: -2.3999999999999998e-003 | J158: 4.0000000000000002e-004 | K158: 6.69 | L158: -8.8999999999999999e-003 | M158: 107.9 | N158: 8.63 | O158: 0.41200000000000003 | P158: 77.52 | Q158: 已到 | R158: 3.37年 | S158: 1.37年 | T158: 50 | U158: 19 | V158: 3.0000000000000001e-003 | W158: 0.121 | X158: 9.4e-002 | Y158: 413 | Z158: 0.8 | AA158: -4.3e-003 | AB158: -8.6999999999999994e-003 | AC158: -4.7100000000000003e-002 | AD158: -4.9100000000000005e-002 | AE158: 96.61 | AF158: 96.61 | AG158: 0.22 | AH158: AAA | AI158: 3.3799999999999997e-002 | AJ158: =H158+100*O158 -> 150.65000000000001 | AK158: 141.4 | AL158: 94 | AM158: 44.8 | AN158: 86 | AO158: -6.8000000000000005e-002 | AP158: 28 | AQ158: 招路转债!
A159: 180 | B159: 113591 | C159: 胜达转债! | D159: 603687 | E159: 大胜达 | F159: 造纸包装 | G159: 包装用纸 | H159: 124.18 | I159: 5.9999999999999995e-004 | J159: 1.0500000000000001e-002 | K159: 10.65 | L159: 1.5300000000000001e-002 | M159: 121.7 | N159: 8.76 | O159: 2.1000000000000001e-002 | P159: 121.58 | Q159: 已到 | R159: 4.65年 | S159: 2.65年 | T159: 5.19 | U159: 100 | V159: 0.153 | W159: 0.11900000000000001 | X159: 0.14400000000000002 | Y159: 44 | Z159: 2.52 | AA159: -4.4000000000000003e-003 | AB159: -1.23e-002 | AC159: -6.2800000000000009e-002 | AD159: -6.5000000000000002e-002 | AE159: 87.66 | AF159: 92.64 | AG159: 0.72 | AH159: AA- | AI159: 6.1799999999999994e-002 | AJ159: =H159+100*O159 -> 126.28 | AK159: 126.8 | AL159: 9 | AM159: 34.1 | AN159: 26 | AO159: -3.0000000000000001e-003 | AP159: 33 | AQ159: 胜达转债!
A160: 23 | B160: 127039 | C160: 北港转债 | D160: 582 | E160: 北部湾港 | F160: 机场高速 | G160: 港口 | H160: 116.03 | I160: 7.0999999999999995e-003 | J160: -7.8000000000000005e-003 | K160: 7.54 | L160: -1.2999999999999999e-003 | M160: 113 | N160: 8.35 | O160: 0.28499999999999998 | P160: 90.3 | Q160: 2月0天 | R160: 5.64年 | S160: 3.64年 | T160: 30 | U160: 4.5 | V160: 1.e-003 | W160: 0.24399999999999999 | X160: 0.22 | Y160: 123 | Z160: 1.15 | AA160: -4.7999999999999996e-003 | AB160: -8.8999999999999999e-003 | AC160: -2.9700000000000001e-002 | AD160: -3.1400000000000004e-002 | AE160: 90.74 | AF160: 93.18 | AG160: 0.49 | AH160: AAA | AI160: 3.5400000000000001e-002 | AJ160: =H160+100*O160 -> 144.53 | AK160: 141.8 | AL160: 99 | AM160: 48.6 | AN160: 120 | AO160: -3.7000000000000005e-002 | AP160: 6 | AQ160: 北港转债
A161: 98 | B161: 113043 | C161: 财通转债! | D161: 601108 | E161: 财通证券 | F161: 金融 | G161: 证券行业 | H161: 113.28 | I161: 2.5000000000000001e-003 | J161: -3.4999999999999996e-003 | K161: 10.02 | L161: -3.0000000000000001e-003 | M161: 110.2 | N161: 13.13 | O161: 0.48399999999999999 | P161: 76.31 | Q161: 已到 | R161: 5年34天 | S161: 无权 | T161: 38 | U161: 58 | V161: 1.3000000000000001e-002 | W161: 0.106 | X161: 8.1000000000000003e-002 | Y161: 360 | Z161: 1.54 | AA161: -5.5000000000000005e-003 | AB161: -9.1000000000000004e-003 | AC161: 无权 | AD161: 无权 | AE161: 无权 | AF161: 92.56 | AG161: 0.33 | AH161: AAA | AI161: 3.5400000000000001e-002 | AJ161: =H161+100*O161 -> 161.68000000000001 | AK161: 150.2 | AL161: 180 | AM161: 57.7 | AN161: 182 | AO161: -5.9999999999999998e-002 | AP161: 11 | AQ161: 财通转债!
A162: 89 | B162: 128141 | C162: 旺能转债 | D162: 2034 | E162: 旺能环境 | F162: 城市公用 | G162: 三废处理 | H162: 118.3 | I162: -1.6200000000000003e-002 | J162: 6.4000000000000003e-003 | K162: 15.6 | L162: -1.7600000000000001e-002 | M162: 115.1 | N162: 15.97 | O162: 0.21100000000000002 | P162: 97.68 | Q162: 已到 | R162: 5年41天 | S162: 3年41天 | T162: 12.7 | U162: 15 | V162: 1.e-002 | W162: 0.19 | X162: 0.185 | Y162: 67 | Z162: 1.33 | AA162: -5.5000000000000005e-003 | AB162: -1.0700000000000001e-002 | AC162: -4.0000000000000001e-002 | AD162: -4.2000000000000003e-002 | AE162: 90.54 | AF162: 93.49 | AG162: 0.56 | AH162: AA | AI162: 4.24e-002 | AJ162: =H162+100*O162 -> 139.40000000000001 | AK162: 138.9 | AL162: 69 | AM162: 45.4 | AN162: 92 | AO162: -8.9999999999999997e-002 | AP162: 8 | AQ162: 旺能转债
A163: 168 | B163: 127020 | C163: 中金转债 | D163: 60 | E163: 中金岭南 | F163: 有色金属 | G163: 有色行业 | H163: 116.65 | I163: -7.0999999999999995e-003 | J163: -1.2199999999999999e-002 | K163: 4.64 | L163: -3.5299999999999998e-002 | M163: 113.5 | N163: 4.63 | O163: 0.16399999999999998 | P163: 100.22 | Q163: 已到 | R163: 4.70年 | S163: 2.70年 | T163: 34.3 | U163: 94 | V163: 2.4e-002 | W163: 0.20199999999999999 | X163: 0.20300000000000001 | Y163: 169 | Z163: 1.35 | AA163: -5.8999999999999999e-003 | AB163: -1.1000000000000001e-002 | AC163: -4.5100000000000001e-002 | AD163: -4.6500000000000007e-002 | AE163: 92.49 | AF163: 96.41 | AG163: 0.55 | AH163: AA+ | AI163: 3.5799999999999998e-002 | AJ163: =H163+100*O163 -> 133.05000000000001 | AK163: 133.1 | AL163: 31 | AM163: 36.7 | AN163: 34 | AO163: -0.10800000000000001 | AP163: 20 | AQ163: 中金转债
A164: 54 | B164: 113622 | C164: 杭叉转债! | D164: 603298 | E164: 杭叉集团 | F164: 机械装备 | G164: 通用设备 | H164: 116.1 | I164: 4.7999999999999996e-003 | J164: 5.1000000000000004e-003 | K164: 17.44 | L164: 3.0099999999999998e-002 | M164: 112.5 | N164: 23.08 | O164: 0.53600000000000003 | P164: 75.56 | Q164: 已到 | R164: 5.38年 | S164: 3.38年 | T164: 11.5 | U164: 10 | V164: 8.0000000000000002e-003 | W164: 7.5999999999999998e-002 | X164: 5.7999999999999996e-002 | Y164: 151 | Z164: 2.86 | AA164: -5.8999999999999999e-003 | AB164: -1.01e-002 | AC164: -3.3399999999999999e-002 | AD164: -3.49e-002 | AE164: 90.5 | AF164: 92.62 | AG164: 0.33 | AH164: AA+ | AI164: 3.7400000000000003e-002 | AJ164: =H164+100*O164 -> 169.69999999999999 | AK164: 156.6 | AL164: 224 | AM164: 64 | AN164: 227 | AO164: 5.9999999999999998e-002 | AP164: 5 | AQ164: 杭叉转债!
A165: 19 | B165: 123119 | C165: 康泰转2! | D165: 300601 | E165: 康泰生物 | F165: 医药 | G165: 生物制药 | H165: 121.4 | I165: 8.0000000000000004e-004 | J165: -2.5999999999999999e-003 | K165: 108.85 | L165: -5.3e-003 | M165: 117.1 | N165: 145.33 | O165: 0.621 | P165: 74.9 | Q165: 2月16天 | R165: 5.69年 | S165: 3.69年 | T165: 20 | U165: 21 | V165: 9.0000000000000011e-003 | W165: 2.7000000000000003e-002 | X165: 2.e-002 | Y165: 748 | Z165: 8.79 | AA165: -6.4000000000000003e-003 | AB165: -1.1599999999999999e-002 | AC165: -4.0599999999999997e-002 | AD165: -4.2300000000000004e-002 | AE165: 88.4 | AF165: 92.86 | AG165: 0.33 | AH165: AA | AI165: 4.24e-002 | AJ165: =H165+100*O165 -> 183.5 | AK165: 167.9 | AL165: 277 | AM165: 75 | AN165: 278 | AO165: -1.2e-002 | AP165: 9 | AQ165: 康泰转2!
A166: 128 | B166: 128135 | C166: 洽洽转债! | D166: 2557 | E166: 洽洽食品 | F166: 食品饮料 | G166: 休闲食品 | H166: 124 | I166: -1.2699999999999999e-002 | J166: 6.8999999999999999e-003 | K166: 56.54 | L166: -1.24e-002 | M166: 119.9 | N166: 60.03 | O166: 0.317 | P166: 94.19 | Q166: 已到 | R166: 4.95年 | S166: 2.95年 | T166: 13.4 | U166: 24 | V166: 1.4999999999999999e-002 | W166: 4.7e-002 | X166: 4.4000000000000004e-002 | Y166: 287 | Z166: 6.57 | AA166: -6.8999999999999999e-003 | AB166: -1.37e-002 | AC166: -5.6900000000000006e-002 | AD166: -5.8899999999999994e-002 | AE166: 91.36 | AF166: 98.71 | AG166: 0.46 | AH166: AA | AI166: 4.0800000000000003e-002 | AJ166: =H166+100*O166 -> 155.69999999999999 | AK166: 153.8 | AL166: 207 | AM166: 55.1 | AN166: 162 | AO166: 0.12300000000000001 | AP166: 11 | AQ166: 洽洽转债!
A167: 35 | B167: 127035 | C167: 濮耐转债 | D167: 2225 | E167: 濮耐股份 | F167: 钢铁 | G167: 钢铁行业 | H167: 118.6 | I167: 2.5000000000000001e-003 | J167: -8.3999999999999995e-003 | K167: 4.15 | L167: -1.1899999999999999e-002 | M167: 114.7 | N167: 4.43 | O167: 0.26600000000000001 | P167: 93.68 | Q167: 25天 | R167: 4.55年 | S167: 2.55年 | T167: 6.26 | U167: 14 | V167: 1.9e-002 | W167: 0.14899999999999999 | X167: 0.14000000000000001 | Y167: 42 | Z167: 1.37 | AA167: -7.4999999999999997e-003 | AB167: -1.32e-002 | AC167: -4.9500000000000002e-002 | AD167: -5.1799999999999999e-002 | AE167: 92.84 | AF167: 95.99 | AG167: 0.5 | AH167: AA | AI167: 4.0800000000000003e-002 | AJ167: =H167+100*O167 -> 145.19999999999999 | AK167: 143.5 | AL167: 114 | AM167: 47.5 | AN167: 109 | AO167: -6.5000000000000002e-002 | AP167: 10 | AQ167: 濮耐转债
A168: 242 | B168: 128090 | C168: 汽模转2 | D168: 2510 | E168: 天汽模 | F168: 汽车 | G168: 零部件制 | H168: 118.702 | I168: -9.8999999999999991e-003 | J168: 6.9999999999999993e-003 | K168: 4.24 | L168: -4.6999999999999993e-003 | M168: 114.9 | N168: 4.23 | O168: 0.184 | P168: 100.24 | Q168: 已到 | R168: 4年51天 | S168: 2年51天 | T168: 3.1 | U168: 85 | V168: 0.22800000000000001 | W168: 7.8e-002 | X168: 7.8e-002 | Y168: 40 | Z168: 1.95 | AA168: -8.0000000000000002e-003 | AB168: -1.44e-002 | AC168: -5.8700000000000002e-002 | AD168: -6.13e-002 | AE168: 90.19 | AF168: 90.16 | AG168: 0.61 | AH168: AA- | AI168: 6.1799999999999994e-002 | AJ168: =H168+100*O168 -> 137.102 | AK168: 137.2 | AL168: 52 | AM168: 47 | AN168: 104 | AO168: 2.2000000000000002e-002 | AP168: 29 | AQ168: 汽模转2
A169: 341 | B169: 127006 | C169: 敖东转债! | D169: 623 | E169: 吉林敖东 | F169: 金融 | G169: 证券行业 | H169: 109.449 | I169: -5.7999999999999996e-003 | J169: 4.6999999999999993e-003 | K169: 16.31 | L169: -5.5000000000000005e-003 | M169: 107.4 | N169: 20.22 | O169: 0.35700000000000004 | P169: 80.66 | Q169: 已到 | R169: 2.35年 | S169: 0.35年 | T169: 24.1 | U169: 9.6 | V169: 4.0000000000000001e-003 | W169: 0.127 | X169: 0.10199999999999999 | Y169: 190 | Z169: 0.79 | AA169: -8.1000000000000013e-003 | AB169: -1.3999999999999999e-002 | AC169: -0.158 | AD169: -0.16200000000000001 | AE169: 99.33 | AF169: 99.3 | AG169: 0.2 | AH169: AA+ | AI169: 3.44e-002 | AJ169: =H169+100*O169 -> 145.149 | AK169: 138.2 | AL169: 59 | AM169: 38.9 | AN169: 46 | AO169: -1.e-002 | AP169: 27 | AQ169: 敖东转债!
A170: 47 | B170: 113623 | C170: 凤21转债 | D170: 603225 | E170: 新凤鸣 | F170: 化工 | G170: 化纤 | H170: 122.3 | I170: 2.0999999999999999e-003 | J170: -2.e-002 | K170: 13.53 | L170: -4.5199999999999997e-002 | M170: 117.1 | N170: 16.47 | O170: 0.48899999999999999 | P170: 82.15 | Q170: 已到 | R170: 5.42年 | S170: 3.42年 | T170: 25 | U170: 5.4 | V170: 2.e-003 | W170: 0.121 | X170: 9.9000000000000005e-002 | Y170: 207 | Z170: 1.31 | AA170: -8.1000000000000013e-003 | AB170: -1.3600000000000001e-002 | AC170: -4.5599999999999995e-002 | AD170: -4.7400000000000005e-002 | AE170: 89.39 | AF170: 93.9 | AG170: 0.4 | AH170: AA | AI170: 4.24e-002 | AJ170: =H170+100*O170 -> 171.19999999999999 | AK170: 162.5 | AL170: 261 | AM170: 68.6 | AN170: 250 | AO170: -0.128 | AP170: 3 | AQ170: 凤21转债
A171: 294 | B171: 110057 | C171: 现代转债 | D171: 600420 | E171: 国药现代 | F171: 医药 | G171: 化学制药 | H171: 113.35 | I171: -2.0999999999999999e-003 | J171: -4.7999999999999996e-003 | K171: 9.23 | L171: -1.49e-002 | M171: 110.3 | N171: 9.79 | O171: 0.20199999999999999 | P171: 94.28 | Q171: 已到 | R171: 3.40年 | S171: 1.40年 | T171: 16.2 | U171: 11 | V171: 6.0000000000000001e-003 | W171: 0.17000000000000001 | X171: 0.161 | Y171: 95 | Z171: 1.13 | AA171: -8.199999999999999e-003 | AB171: -1.37e-002 | AC171: -6.0899999999999996e-002 | AD171: -6.4100000000000004e-002 | AE171: 97.63 | AF171: 98.75 | AG171: 0.46 | AH171: AAA | AI171: 3.3799999999999997e-002 | AJ171: =H171+100*O171 -> 133.54999999999998 | AK171: 132.4 | AL171: 24 | AM171: 33.7 | AN171: 24 | AO171: -6.0999999999999999e-002 | AP171: 23 | AQ171: 现代转债
A172: 12 | B172: 127042 | C172: 嘉美转债 | D172: 2969 | E172: 嘉美包装 | F172: 造纸包装 | G172: 包装材料 | H172: 123.189 | I172: -2.e-002 | J172: -1.6399999999999998e-002 | K172: 5.58 | L172: -5.2600000000000001e-002 | M172: 117.1 | N172: 4.87 | O172: 7.4999999999999997e-002 | P172: 114.58 | Q172: 3月10天 | R172: 5.76年 | S172: 3.76年 | T172: 7.5 | U172: 53 | V172: 5.5999999999999994e-002 | W172: 0.14000000000000001 | X172: 0.16 | Y172: 54 | Z172: 2.45 | AA172: -8.8999999999999999e-003 | AB172: -1.3999999999999999e-002 | AC172: -4.3499999999999997e-002 | AD172: -4.5100000000000001e-002 | AE172: 88.15 | AF172: 92.59 | AG172: 0.69 | AH172: AA | AI172: 4.24e-002 | AJ172: =H172+100*O172 -> 130.68899999999999 | AK172: 131.8 | AL172: 21 | AM172: 39.2 | AN172: 47 | AO172: -4.4000000000000004e-002 | AP172: 10 | AQ172: 嘉美转债
A173: 31 | B173: 123116 | C173: 万兴转债 | D173: 300624 | E173: 万兴科技 | F173: 计算机及 | G173: 软件开发 | H173: 127.58 | I173: 2.23e-002 | J173: 3.0000000000000001e-003 | K173: 46.94 | L173: 3.85e-002 | M173: 121.4 | N173: 49.78 | O173: 0.35299999999999998 | P173: 94.29 | Q173: 40天 | R173: 5.59年 | S173: 3.59年 | T173: 3.79 | U173: 656 | V173: 1.3300000000000001 | W173: 6.2e-002 | X173: 5.9000000000000004e-002 | Y173: 61 | Z173: 7.33 | AA173: -9.0000000000000011e-003 | AB173: -1.54e-002 | AC173: -5.2699999999999997e-002 | AD173: -5.4699999999999999e-002 | AE173: 79.91 | AF173: 82.03 | AG173: 0.66 | AH173: A+ | AI173: 7.4400000000000008e-002 | AJ173: =H173+100*O173 -> 162.88 | AK173: 160.9 | AL173: 253 | AM173: 78.8 | AN173: 290 | AO173: 5.5e-002 | AP173: 6 | AQ173: 万兴转债
A174: 18 | B174: 113627 | C174: 太平转债! | D174: 603877 | E174: 太平鸟 | F174: 服装纺织 | G174: 服装行业 | H174: 121.15 | I174: 1.8600000000000002e-002 | J174: 1.1000000000000001e-003 | K174: 37.24 | L174: 6.0100000000000001e-002 | M174: 115.1 | N174: 50.32 | O174: 0.63700000000000001 | P174: 74.01 | Q174: 2月16天 | R174: 5.69年 | S174: 3.69年 | T174: 8 | U174: 28 | V174: 2.8999999999999998e-002 | W174: 4.4999999999999998e-002 | X174: 3.3000000000000002e-002 | Y174: 178 | Z174: 4.36 | AA174: -9.1000000000000004e-003 | AB174: -1.38e-002 | AC174: -4.0099999999999997e-002 | AD174: -4.1799999999999997e-002 | AE174: 88.4 | AF174: 91.28 | AG174: 0.33 | AH174: AA | AI174: 4.24e-002 | AJ174: =H174+100*O174 -> 184.85000000000002 | AK174: 168.3 | AL174: 279 | AM174: 77 | AN174: 284 | AO174: -8.0000000000000002e-003 | AP174: 3 | AQ174: 太平转债!
A175: 338 | B175: 128039 | C175: 三力转债! | D175: 2224 | E175: 三 力 士 | F175: 机械装备 | G175: 专用设备 | H175: 111.4 | I175: 5.9999999999999995e-004 | J175: 2.0999999999999999e-003 | K175: 4.83 | L175: 8.3999999999999995e-003 | M175: 108.8 | N175: 5.79 | O175: 0.33500000000000002 | P175: 83.42 | Q175: 已到 | R175: 2.59年 | S175: 0.59年 | T175: 2.02 | U175: 13 | V175: 5.9999999999999998e-002 | W175: 5.7000000000000002e-002 | X175: 4.8000000000000001e-002 | Y175: 35 | Z175: 1.47 | AA175: -9.1999999999999998e-003 | AB175: -1.55e-002 | AC175: -0.122 | AD175: -0.125 | AE175: 97.17 | AF175: 93.7 | AG175: 0.33 | AH175: AA- | AI175: 6.0400000000000002e-002 | AJ175: =H175+100*O175 -> 144.90000000000001 | AK175: 139.4 | AL175: 76 | AM175: 42.2 | AN175: 68 | AO175: -2.8999999999999998e-002 | AP175: 31 | AQ175: 三力转债!
A176: 80 | B176: 128143 | C176: 锋龙转债! | D176: 2931 | E176: 锋龙股份 | F176: 机械装备 | G176: 专用设备 | H176: 127.569 | I176: 2.5000000000000001e-003 | J176: -1.7000000000000001e-002 | K176: 14.2 | L176: -2.e-002 | M176: 121.7 | N176: 12.73 | O176: 0.14400000000000002 | P176: 111.55 | Q176: 已到 | R176: 5.17年 | S176: 3.17年 | T176: 2.44 | U176: 24 | V176: 7.8e-002 | W176: 8.5999999999999993e-002 | X176: 9.6000000000000002e-002 | Y176: 28 | Z176: 4.45 | AA176: -9.300000000000001e-003 | AB176: -1.6299999999999999e-002 | AC176: -5.8299999999999998e-002 | AD176: -6.0700000000000004e-002 | AE176: 82.6 | AF176: 84.79 | AG176: 0.72 | AH176: A+ | AI176: 7.4400000000000008e-002 | AJ176: =H176+100*O176 -> 141.96899999999999 | AK176: 143.6 | AL176: 116 | AM176: 58.8 | AN176: 192 | AO176: 3.7999999999999999e-002 | AP176: 14 | AQ176: 锋龙转债!
A177: 326 | B177: 113516 | C177: 苏农转债! | D177: 603323 | E177: 苏农银行 | F177: 金融 | G177: 银行行业 | H177: 116.38 | I177: -2.0199999999999999e-002 | J177: -5.6999999999999993e-003 | K177: 4.82 | L177: -7.8399999999999997e-002 | M177: 113.3 | N177: 5.37 | O177: 0.29699999999999999 | P177: 89.76 | Q177: 已到 | R177: 2.74年 | S177: 无权 | T177: 12.9 | U177: 48 | V177: 3.2000000000000001e-002 | W177: 0.14800000000000002 | X177: 0.13300000000000001 | Y177: 87 | Z177: 0.67 | AA177: -9.8999999999999991e-003 | AB177: -1.8500000000000003e-002 | AC177: 无权 | AD177: 无权 | AE177: 无权 | AF177: 103.43 | AG177: 0.33 | AH177: AA+ | AI177: 3.44e-002 | AJ177: =H177+100*O177 -> 146.07999999999998 | AK177: 143 | AL177: 108 | AM177: 39.6 | AN177: 49 | AO177: -0.10000000000000001 | AP177: 25 | AQ177: 苏农转债!
A178: 14 | B178: 123121 | C178: 帝尔转债! | D178: 300776 | E178: 帝尔激光 | F178: 机械装备 | G178: 专用设备 | H178: 128.1 | I178: 1.9699999999999999e-002 | J178: -3.3e-003 | K178: 160.06 | L178: 3.1200000000000002e-002 | M178: 121 | N178: 192.7 | O178: 0.54200000000000004 | P178: 83.06 | Q178: 3月7天 | R178: 5.75年 | S178: 3.75年 | T178: 8.4 | U178: 87 | V178: 8.0000000000000002e-002 | W178: 5.0000000000000003e-002 | X178: 4.0999999999999995e-002 | Y178: 169 | Z178: 8.41 | AA178: -1.01e-002 | AB178: -1.6200000000000003e-002 | AC178: -5.2499999999999998e-002 | AD178: -5.4299999999999994e-002 | AE178: 81.9 | AF178: 85.61 | AG178: 0.52 | AH178: AA- | AI178: 6.3399999999999998e-002 | AJ178: =H178+100*O178 -> 182.30000000000001 | AK178: 173.1 | AL178: 292 | AM178: 87.5 | AN178: 303 | AO178: 0.13 | AP178: 4 | AQ178: 帝尔转债!
A179: 117 | B179: 128136 | C179: 立讯转债! | D179: 2475 | E179: 立讯精密 | F179: 电子 | G179: 元器件制 | H179: 117.696 | I179: 0. | J179: 0. | K179: 41.2 | L179: 0. | M179: 111.9 | N179: 58.18 | O179: 0.66200000000000003 | P179: 70.81 | Q179: 已到 | R179: 4.99年 | S179: 2.99年 | T179: 30 | U179: 26 | V179: 6.9999999999999993e-003 | W179: 1.e-002 | X179: 6.9999999999999993e-003 | Y179: 2904. | Z179: 9.02 | AA179: -1.04e-002 | AB179: -1.46e-002 | AC179: -4.3499999999999997e-002 | AD179: -4.4800000000000006e-002 | AE179: 91.57 | AF179: 93.99 | AG179: 0.24 | AH179: AA+ | AI179: 3.5799999999999998e-002 | AJ179: =H179+100*O179 -> 183.89600000000002 | AK179: 164.6 | AL179: 268 | AM179: 70.6 | AN179: 262 | AO179: 8.8000000000000009e-002 | AP179: 14 | AQ179: 立讯转债!
A180: 52 | B180: 123107 | C180: 温氏转债! | D180: 300498 | E180: 温氏股份 | F180: 农业 | G180: 畜牧业 | H180: 119.5 | I180: -1.24e-002 | J180: -5.1999999999999998e-003 | K180: 16.77 | L180: -3.3399999999999999e-002 | M180: 113 | N180: 17.62 | O180: 0.25600000000000001 | P180: 95.18 | Q180: 已到 | R180: 5.39年 | S180: 3.39年 | T180: 93 | U180: 218 | V180: 1.9e-002 | W180: 8.6999999999999994e-002 | X180: 8.3000000000000004e-002 | Y180: 1065. | Z180: 3.03 | AA180: -1.0500000000000001e-002 | AB180: -1.4800000000000001e-002 | AC180: -3.9900000000000005e-002 | AD180: -4.1599999999999998e-002 | AE180: 91.54 | AF180: 94 | AG180: 0.53 | AH180: AAA | AI180: 3.5400000000000001e-002 | AJ180: =H180+100*O180 -> 145.09999999999999 | AK180: 143.8 | AL180: 118 | AM180: 49.8 | AN180: 126 | AO180: 5.9999999999999998e-002 | AP180: 14 | AQ180: 温氏转债!
A181: 27 | B181: 113050 | C181: 南银转债 | D181: 601009 | E181: 南京银行 | F181: 金融 | G181: 银行行业 | H181: 118 | I181: -2.5000000000000001e-003 | J181: -5.6999999999999993e-003 | K181: 9.44 | L181: -1.5600000000000001e-002 | M181: 111.2 | N181: 10.1 | O181: 0.26200000000000001 | P181: 93.47 | Q181: 45天 | R181: 5.61年 | S181: 无权 | T181: 200 | U181: 60 | V181: 3.0000000000000001e-003 | W181: 0.21199999999999999 | X181: 0.19800000000000001 | Y181: 945 | Z181: 0.89 | AA181: -1.0700000000000001e-002 | AB181: -1.43e-002 | AC181: 无权 | AD181: 无权 | AE181: 无权 | AF181: 91.76 | AG181: 0.53 | AH181: AAA | AI181: 3.5400000000000001e-002 | AJ181: =H181+100*O181 -> 144.19999999999999 | AK181: 142.5 | AL181: 107 | AM181: 50.8 | AN181: 135 | AO181: -3.9e-002 | AP181: 7 | AQ181: 南银转债
A182: 138 | B182: 128131 | C182: 崇达转2! | D182: 2815 | E182: 崇达技术 | F182: 电子 | G182: 元器件制 | H182: 121.2 | I182: 1.49e-002 | J182: -1.5600000000000001e-002 | K182: 16.51 | L182: -1.8e-003 | M182: 114.9 | N182: 19.38 | O182: 0.42299999999999999 | P182: 85.19 | Q182: 已到 | R182: 4.84年 | S182: 2.84年 | T182: 14 | U182: 93 | V182: 5.5e-002 | W182: 9.6999999999999989e-002 | X182: 8.199999999999999e-002 | Y182: 145 | Z182: 3.36 | AA182: -1.1200000000000002e-002 | AB182: -1.66e-002 | AC182: -5.1900000000000002e-002 | AD182: -5.3899999999999997e-002 | AE182: 91.79 | AF182: 95.05 | AG182: 0.4 | AH182: AA | AI182: 4.0800000000000003e-002 | AJ182: =H182+100*O182 -> 163.5 | AK182: 157.2 | AL182: 225 | AM182: 62.2 | AN182: 213 | AO182: 0.28100000000000003 | AP182: 11 | AQ182: 崇达转2!
A183: 248 | B183: 128085 | C183: 鸿达转债!! | D183: 2002 | E183: 鸿达兴业 | F183: 化工 | G183: 化工 | H183: 130.249 | I183: -2.81e-002 | J183: -1.03e-002 | K183: 5.01 | L183: -3.8399999999999997e-002 | M183: 124.4 | N183: 3.91 | O183: 1.7000000000000001e-002 | P183: 128.13 | Q183: 已到 | R183: 4年40天 | S183: 2年40天 | T183: 3.43 | U183: 78 | V183: 0.17199999999999999 | W183: 2.2000000000000002e-002 | X183: 2.7999999999999997e-002 | Y183: 156 | Z183: 1.51 | AA183: -1.1399999999999999e-002 | AB183: -2.1099999999999997e-002 | AC183: -9.5500000000000002e-002 | AD183: -9.8299999999999998e-002 | AE183: 72.63 | AF183: 65.83 | AG183: 1 | AH183: B | AI183: 0.17280000000000001 | AJ183: =H183+100*O183 -> 131.94899999999998 | AK183: 132.4 | AL183: 23 | AM183: 59.7 | AN183: 199 | AO183: -6.8000000000000005e-002 | AP183: 92 | AQ183: 鸿达转债!!
A184: 88 | B184: 128142 | C184: 新乳转债! | D184: 2946 | E184: 新乳业 | F184: 食品饮料 | G184: 乳制品 | H184: 121.9 | I184: -2.5000000000000001e-003 | J184: -2.5999999999999999e-003 | K184: 16.3 | L184: -1.09e-002 | M184: 115.1 | N184: 18.47 | O184: 0.38100000000000001 | P184: 88.25 | Q184: 已到 | R184: 5年42天 | S184: 3年42天 | T184: 7.18 | U184: 9 | V184: 1.e-002 | W184: 5.0999999999999997e-002 | X184: 4.4999999999999998e-002 | Y184: 141 | Z184: 5.56 | AA184: -1.1399999999999999e-002 | AB184: -1.6500000000000001e-002 | AC184: -4.8799999999999996e-002 | AD184: -5.0700000000000002e-002 | AE184: 90.52 | AF184: 93.48 | AG184: 0.46 | AH184: AA | AI184: 4.24e-002 | AJ184: =H184+100*O184 -> 160. | AK184: 155.5 | AL184: 214 | AM184: 62.1 | AN184: 211 | AO184: 2.7999999999999997e-002 | AP184: 5 | AQ184: 新乳转债!
A185: 4 | B185: 123125 | C185: 元力转债 | D185: 300174 | E185: 元力股份 | F185: 化工 | G185: 化工 | H185: 116.782 | I185: -1.1000000000000001e-002 | J185: 1.7100000000000001e-002 | K185: 16.07 | L185: 9.3999999999999986e-003 | M185: 109.3 | N185: 17.61 | O185: 0.28000000000000003 | P185: 91.25 | Q185: 4月4天 | R185: 5.83年 | S185: 3.83年 | T185: 9 | U185: 22 | V185: 2.1000000000000001e-002 | W185: 0.17899999999999999 | X185: 0.16399999999999998 | Y185: 50 | Z185: 2.86 | AA185: -1.1399999999999999e-002 | AB185: -1.43e-002 | AC185: -3.15e-002 | AD185: -3.2799999999999996e-002 | AE185: 80.49 | AF185: 76.76 | AG185: 0.65 | AH185: AA- | AI185: 6.3399999999999998e-002 | AJ185: =H185+100*O185 -> 144.78200000000001 | AK185: 142.3 | AL185: 106 | AM185: 61.8 | AN185: 208 | AO185: 1.7000000000000001e-002 | AP185: 3 | AQ185: 元力转债
A186: 255 | B186: 113549 | C186: 白电转债 | D186: 603861 | E186: 白云电器 | F186: 能源电力 | G186: 电力设备 | H186: 120.17 | I186: -1.43e-002 | J186: -7.0999999999999995e-003 | K186: 8.98 | L186: -3.85e-002 | M186: 114.8 | N186: 8.83 | O186: 0.182 | P186: 101.7 | Q186: 已到 | R186: 4年9天 | S186: 2年9天 | T186: 8.06 | U186: 20 | V186: 2.1000000000000001e-002 | W186: 0.20100000000000001 | X186: 0.20399999999999999 | Y186: 40 | Z186: 1.51 | AA186: -1.15e-002 | AB186: -1.8000000000000002e-002 | AC186: -6.7400000000000002e-002 | AD186: -7.0000000000000007e-002 | AE186: 94.73 | AF186: 98.08 | AG186: 0.56 | AH186: AA | AI186: 4.0800000000000003e-002 | AJ186: =H186+100*O186 -> 138.37 | AK186: 138.6 | AL186: 66 | AM186: 40.6 | AN186: 55 | AO186: -0.122 | AP186: 40 | AQ186: 白电转债
A187: 51 | B187: 123108 | C187: 乐普转2 | D187: 300003 | E187: 乐普医疗 | F187: 医药 | G187: 医疗器械 | H187: 116.82 | I187: -2.9999999999999997e-004 | J187: 2.8999999999999998e-003 | K187: 21.5 | L187: 1.03e-002 | M187: 111.1 | N187: 29.5 | O187: 0.60299999999999998 | P187: 72.88 | Q187: 已到 | R187: 4.39年 | S187: 2.39年 | T187: 16.4 | U187: 4.1 | V187: 2.e-003 | W187: 4.2000000000000003e-002 | X187: 3.1e-002 | Y187: 388 | Z187: 3.37 | AA187: -1.15e-002 | AB187: -1.61e-002 | AC187: -5.16e-002 | AD187: -5.2999999999999999e-002 | AE187: 93.3 | AF187: 95.38 | AG187: 0.25 | AH187: AA+ | AI187: 3.5799999999999998e-002 | AJ187: =H187+100*O187 -> 177.12 | AK187: 160.8 | AL187: 252 | AM187: 65.4 | AN187: 233 | AO187: -0.14000000000000001 | AP187: 12 | AQ187: 乐普转2
A188: 175 | B188: 110071 | C188: 湖盐转债! | D188: 600929 | E188: 雪天盐业 | F188: 食品饮料 | G188: 食品饮料 | H188: 121.77 | I188: -1.78e-002 | J188: 8.199999999999999e-003 | K188: 6.8 | L188: -1.5900000000000001e-002 | M188: 114.9 | N188: 6.52 | O188: 0.16800000000000001 | P188: 104.29 | Q188: 已到 | R188: 4.67年 | S188: 2.67年 | T188: 7.2 | U188: 136 | V188: 0.152 | W188: 0.114 | X188: 0.11800000000000001 | Y188: 63 | Z188: 2.43 | AA188: -1.26e-002 | AB188: -1.8200000000000001e-002 | AC188: -5.6399999999999999e-002 | AD188: -5.8499999999999996e-002 | AE188: 92.39 | AF188: 95.67 | AG188: 0.61 | AH188: AA | AI188: 4.0800000000000003e-002 | AJ188: =H188+100*O188 -> 138.56999999999999 | AK188: 139.2 | AL188: 72 | AM188: 43.6 | AN188: 80 | AO188: 1.3000000000000001e-002 | AP188: 21 | AQ188: 湖盐转债!
A189: 141 | B189: 128130 | C189: 景兴转债 | D189: 2067 | E189: 景兴纸业 | F189: 造纸包装 | G189: 包装用纸 | H189: 122 | I189: 1.24e-002 | J189: 1.1000000000000001e-002 | K189: 3.82 | L189: 3.5200000000000002e-002 | M189: 114.8 | N189: 3.4 | O189: 8.5999999999999993e-002 | P189: 112.35 | Q189: 已到 | R189: 4.82年 | S189: 2.82年 | T189: 9.99 | U189: 74 | V189: 6.0999999999999999e-002 | W189: 0.21899999999999997 | X189: 0.24600000000000002 | Y189: 46 | Z189: 0.87 | AA189: -1.2800000000000001e-002 | AB189: -1.8100000000000002e-002 | AC189: -5.4600000000000003e-002 | AD189: -5.6600000000000004e-002 | AE189: 91.77 | AF189: 95.03 | AG189: 0.67 | AH189: AA | AI189: 4.0800000000000003e-002 | AJ189: =H189+100*O189 -> 130.59999999999999 | AK189: 131.6 | AL189: 20 | AM189: 36.6 | AN189: 33 | AO189: -1.1000000000000001e-002 | AP189: 18 | AQ189: 景兴转债
A190: 264 | B190: 128079 | C190: 英联转债! | D190: 2846 | E190: 英联股份 | F190: 造纸包装 | G190: 包装材料 | H190: 123.005 | I190: 5.0000000000000001e-003 | J190: -3.4999999999999996e-003 | K190: 7.15 | L190: 2.8000000000000004e-003 | M190: 116.9 | N190: 8.29 | O190: 0.42599999999999999 | P190: 86.25 | Q190: 已到 | R190: 3.96年 | S190: 1.96年 | T190: 1.52 | U190: 21 | V190: 0.11199999999999999 | W190: 6.7000000000000004e-002 | X190: 5.7999999999999996e-002 | Y190: 23 | Z190: 2.81 | AA190: -1.3000000000000001e-002 | AB190: -2.0400000000000001e-002 | AC190: -8.0399999999999985e-002 | AD190: -8.2899999999999988e-002 | AE190: 88.87 | AF190: 89.02 | AG190: 0.52 | AH190: A+ | AI190: 7.2800000000000004e-002 | AJ190: =H190+100*O190 -> 165.60499999999999 | AK190: 159.8 | AL190: 245 | AM190: 70.7 | AN190: 264 | AO190: -1.1000000000000001e-002 | AP190: 16 | AQ190: 英联转债!
A191: 238 | B191: 127015 | C191: 希望转债!! | D191: 876 | E191: 新 希 望 | F191: 农业 | G191: 畜牧业 | H191: 116.21 | I191: -4.3e-003 | J191: -3.0000000000000001e-003 | K191: 15.82 | L191: -2.35e-002 | M191: 110 | N191: 19.75 | O191: 0.45100000000000001 | P191: 80.1 | Q191: 已到 | R191: 4年58天 | S191: 2年58天 | T191: 9.5 | U191: 126 | V191: 0.113 | W191: 1.3000000000000001e-002 | X191: 1.1000000000000001e-002 | Y191: 713 | Z191: 2.33 | AA191: -1.3300000000000001e-002 | AB191: -1.77e-002 | AC191: -5.2300000000000006e-002 | AD191: -5.4299999999999994e-002 | AE191: 95.09 | AF191: 96.04 | AG191: 0.31 | AH191: AAA | AI191: 3.3799999999999997e-002 | AJ191: =H191+100*O191 -> 161.31 | AK191: 152.3 | AL191: 199 | AM191: 56.3 | AN191: 168 | AO191: 8.6999999999999994e-002 | AP191: 28 | AQ191: 希望转债!!
A192: 119 | B192: 123075 | C192: 贝斯转债! | D192: 300580 | E192: 贝斯特 | F192: 汽车 | G192: 零部件制 | H192: 123.09 | I192: -1.1200000000000002e-002 | J192: 3.7000000000000002e-003 | K192: 21.42 | L192: -1.29e-002 | M192: 115.1 | N192: 23.74 | O192: 0.36399999999999999 | P192: 90.23 | Q192: 已到 | R192: 4.99年 | S192: 2.99年 | T192: 6 | U192: 11 | V192: 1.4999999999999999e-002 | W192: 0.14000000000000001 | X192: 0.126 | Y192: 43 | Z192: 2.42 | AA192: -1.3600000000000001e-002 | AB192: -1.89e-002 | AC192: -5.4000000000000006e-002 | AD192: -5.5899999999999998e-002 | AE192: 85.73 | AF192: 85.84 | AG192: 0.58 | AH192: AA- | AI192: 6.1799999999999994e-002 | AJ192: =H192+100*O192 -> 159.49000000000001 | AK192: 156 | AL192: 219 | AM192: 70.1 | AN192: 259 | AO192: 7.2000000000000008e-002 | AP192: 8 | AQ192: 贝斯转债!
A193: 13 | B193: 123122 | C193: 富瀚转债 | D193: 300613 | E193: 富瀚微 | F193: 电子 | G193: 芯片制造 | H193: 130 | I193: -8.3999999999999995e-003 | J193: -7.0999999999999995e-003 | K193: 151.4 | L193: -2.53e-002 | M193: 120.3 | N193: 177.04 | O193: 0.52000000000000002 | P193: 85.52 | Q193: 3月8天 | R193: 5.75年 | S193: 3.75年 | T193: 5.81 | U193: 42 | V193: 5.4000000000000006e-002 | W193: 3.2000000000000001e-002 | X193: 2.7000000000000003e-002 | Y193: 182 | Z193: 11.12 | AA193: -1.3600000000000001e-002 | AB193: -1.95e-002 | AC193: -5.6600000000000004e-002 | AD193: -5.8299999999999998e-002 | AE193: 78.44 | AF193: 80.24 | AG193: 0.61 | AH193: A+ | AI193: 7.4400000000000008e-002 | AJ193: =H193+100*O193 -> 182. | AK193: 174.5 | AL193: 297 | AM193: 94.2 | AN193: 313 | AO193: -7.8e-002 | AP193: 4 | AQ193: 富瀚转债
A194: 174 | B194: 128119 | C194: 龙大转债! | D194: 2726 | E194: 龙大肉食 | F194: 食品饮料 | G194: 肉制品 | H194: 128 | I194: -5.4000000000000003e-003 | J194: -1.2500000000000001e-002 | K194: 10.12 | L194: -2.9700000000000001e-002 | M194: 119.9 | N194: 9.29 | O194: 0.17499999999999999 | P194: 108.93 | Q194: 已到 | R194: 4.68年 | S194: 2.68年 | T194: 9.46 | U194: 23 | V194: 1.9e-002 | W194: 8.6999999999999994e-002 | X194: 9.4e-002 | Y194: 109 | Z194: 2.7 | AA194: -1.41e-002 | AB194: -2.1299999999999999e-002 | AC194: -7.2700000000000001e-002 | AD194: -7.4700000000000003e-002 | AE194: 92.36 | AF194: 99.78 | AG194: 0.6 | AH194: AA | AI194: 4.0800000000000003e-002 | AJ194: =H194+100*O194 -> 145.5 | AK194: 147.1 | AL194: 157 | AM194: 47.3 | AN194: 106 | AO194: 2.7000000000000003e-002 | AP194: 9 | AQ194: 龙大转债!
A195: 241 | B195: 128091 | C195: 新天转债 | D195: 2873 | E195: 新天药业 | F195: 医药 | G195: 中药 | H195: 126.8 | I195: -1.01e-002 | J195: -8.0000000000000002e-003 | K195: 18.58 | L195: -2.52e-002 | M195: 119.4 | N195: 16.27 | O195: 0.11 | P195: 114.2 | Q195: 已到 | R195: 4年54天 | S195: 2年54天 | T195: 1.76 | U195: 25 | V195: 0.111 | W195: 8.1000000000000003e-002 | X195: 9.1999999999999998e-002 | Y195: 22 | Z195: 2.5 | AA195: -1.4800000000000001e-002 | AB195: -2.2700000000000001e-002 | AC195: -8.1300000000000011e-002 | AD195: -8.4600000000000009e-002 | AE195: 89.03 | AF195: 89.99 | AG195: 0.72 | AH195: A+ | AI195: 7.2800000000000004e-002 | AJ195: =H195+100*O195 -> 137.80000000000001 | AK195: 139.4 | AL195: 77 | AM195: 49.4 | AN195: 124 | AO195: 4.0000000000000001e-003 | AP195: 20 | AQ195: 新天转债
A196: 298 | B196: 123024 | C196: 岱勒转债! | D196: 300700 | E196: 岱勒新材 | F196: 机械装备 | G196: 专用设备 | H196: 116.512 | I196: 1.8e-003 | J196: -3.4000000000000002e-003 | K196: 12.55 | L196: -4.0000000000000001e-003 | M196: 112.5 | N196: 14.1 | O196: 0.309 | P196: 89.01 | Q196: 已到 | R196: 2.37年 | S196: 0.37年 | T196: 2.1 | U196: 13 | V196: 5.2999999999999999e-002 | W196: 0.156 | X196: 0.13900000000000001 | Y196: 13 | Z196: 2.84 | AA196: -1.49e-002 | AB196: -2.4199999999999999e-002 | AC196: -0.25800000000000001 | AD196: -0.26200000000000001 | AE196: 97.58 | AF196: 95.75 | AG196: 0.4 | AH196: A+ | AI196: 7.1399999999999991e-002 | AJ196: =H196+100*O196 -> 147.41200000000001 | AK196: 144 | AL196: 122 | AM196: 46.4 | AN196: 98 | AO196: -6.9999999999999993e-003 | AP196: 37 | AQ196: 岱勒转债!
A197: 266 | B197: 128076 | C197: 金轮转债! | D197: 2722 | E197: 金轮股份 | F197: 机械装备 | G197: 专用设备 | H197: 121.154 | I197: -1.1000000000000001e-003 | J197: -2.3e-003 | K197: 15.39 | L197: -5.1999999999999998e-003 | M197: 114.3 | N197: 14.66 | O197: 0.154 | P197: 104.98 | Q197: 已到 | R197: 3.94年 | S197: 1.94年 | T197: 2.14 | U197: 15 | V197: 5.7000000000000002e-002 | W197: 7.9000000000000001e-002 | X197: 8.3000000000000004e-002 | Y197: 27 | Z197: 1.38 | AA197: -1.49e-002 | AB197: -2.1299999999999999e-002 | AC197: -7.5600000000000001e-002 | AD197: -7.7899999999999997e-002 | AE197: 90.69 | AF197: 90.66 | AG197: 0.65 | AH197: AA- | AI197: 6.1799999999999994e-002 | AJ197: =H197+100*O197 -> 136.554 | AK197: 137.3 | AL197: 53 | AM197: 46.6 | AN197: 99 | AO197: 4.2000000000000003e-002 | AP197: 38 | AQ197: 金轮转债!
A198: 91 | B198: 123087 | C198: 明电转债! | D198: 300739 | E198: 明阳电路 | F198: 电子 | G198: 元器件制 | H198: 130.61 | I198: 2.0400000000000001e-002 | J198: -6.8000000000000005e-003 | K198: 18.85 | L198: 1.89e-002 | M198: 121.2 | N198: 16.32 | O198: 0.13100000000000001 | P198: 115.5 | Q198: 已到 | R198: 5年39天 | S198: 4年39天 | T198: 4.19 | U198: 357 | V198: 0.65099999999999991 | W198: 7.4999999999999997e-002 | X198: 8.6999999999999994e-002 | Y198: 56 | Z198: 3.35 | AA198: -1.49e-002 | AB198: -2.18e-002 | AC198: -4.7e-002 | AD198: -4.9699999999999994e-002 | AE198: 82.48 | AF198: 89.22 | AG198: 0.72 | AH198: AA- | AI198: 6.3399999999999998e-002 | AJ198: =H198+100*O198 -> 143.71000000000001 | AK198: 145.7 | AL198: 140 | AM198: 56.5 | AN198: 171 | AO198: 0.126 | AP198: 19 | AQ198: 明电转债!
A199: 72 | B199: 123098 | C199: 一品转债! | D199: 300723 | E199: 一品红 | F199: 医药 | G199: 医药行业 | H199: 134 | I199: -7.0999999999999995e-003 | J199: -3.4000000000000002e-003 | K199: 31.45 | L199: -1.41e-002 | M199: 124 | N199: 25.48 | O199: 8.5999999999999993e-002 | P199: 123.43 | Q199: 已到 | R199: 5.23年 | S199: 3.23年 | T199: 4.25 | U199: 11 | V199: 1.8000000000000002e-002 | W199: 4.7e-002 | X199: 5.7999999999999996e-002 | Y199: 91 | Z199: 5.42 | AA199: -1.4999999999999999e-002 | AB199: -2.2499999999999999e-002 | AC199: -7.2800000000000004e-002 | AD199: -7.4800000000000005e-002 | AE199: 84.55 | AF199: 90.55 | AG199: 0.75 | AH199: AA- | AI199: 6.3399999999999998e-002 | AJ199: =H199+100*O199 -> 142.59999999999999 | AK199: 144.6 | AL199: 127 | AM199: 54 | AN199: 156 | AO199: 1.e-002 | AP199: 7 | AQ199: 一品转债!
A200: 269 | B200: 128075 | C200: 远东转债! | D200: 2406 | E200: 远东传动 | F200: 汽车 | G200: 零部件制 | H200: 121.334 | I200: 1.11e-002 | J200: -1.2199999999999999e-002 | K200: 5.71 | L200: -1.7000000000000001e-003 | M200: 114.3 | N200: 5.29 | O200: 0.124 | P200: 107.94 | Q200: 已到 | R200: 3.88年 | S200: 1.88年 | T200: 5.44 | U200: 24 | V200: 3.6000000000000004e-002 | W200: 0.153 | X200: 0.16500000000000001 | Y200: 36 | Z200: 1.09 | AA200: -1.55e-002 | AB200: -2.2000000000000002e-002 | AC200: -7.8299999999999995e-002 | AD200: -8.0700000000000008e-002 | AE200: 94.78 | AF200: 98.15 | AG200: 0.62 | AH200: AA | AI200: 4.0800000000000003e-002 | AJ200: =H200+100*O200 -> 133.73400000000001 | AK200: 134.7 | AL200: 37 | AM200: 36.6 | AN200: 32 | AO200: -1.3999999999999999e-002 | AP200: 17 | AQ200: 远东转债!
A201: 192 | B201: 123052 | C201: 飞鹿转债! | D201: 300665 | E201: 飞鹿股份 | F201: 化工 | G201: 化工 | H201: 136 | I201: 4.4000000000000003e-003 | J201: -1.0200000000000001e-002 | K201: 8.65 | L201: -8.0000000000000002e-003 | M201: 126.8 | N201: 7.05 | O201: 0.10800000000000001 | P201: 122.7 | Q201: 已到 | R201: 4.58年 | S201: 2.58年 | T201: 1.5 | U201: 37 | V201: 0.17899999999999999 | W201: 0.10000000000000001 | X201: 0.12300000000000001 | Y201: 15 | Z201: 2.94 | AA201: -1.5600000000000001e-002 | AB201: -2.4900000000000002e-002 | AC201: -9.1799999999999993e-002 | AD201: -9.4600000000000004e-002 | AE201: 86.57 | AF201: 92.71 | AG201: 0.72 | AH201: A+ | AI201: 7.2800000000000004e-002 | AJ201: =H201+100*O201 -> 146.80000000000001 | AK201: 149.3 | AL201: 175 | AM201: 56.6 | AN201: 173 | AO201: -9.6000000000000002e-002 | AP201: 23 | AQ201: 飞鹿转债!
A202: 358 | B202: 123002 | C202: 国祯转债!! | D202: 300388 | E202: 节能国祯 | F202: 城市公用 | G202: 三废处理 | H202: 112.359 | I202: 1.1999999999999999e-003 | J202: -1.6000000000000001e-003 | K202: 7.14 | L202: -1.4000000000000002e-003 | M202: 108.8 | N202: 8.36 | O202: 0.316 | P202: 85.41 | Q202: 已到 | R202: 2年18天 | S202: 18天 | T202: 2.52 | U202: 4.1 | V202: 1.3999999999999999e-002 | W202: 5.0999999999999997e-002 | X202: 4.2999999999999997e-002 | Y202: 50 | Z202: 1.35 | AA202: -1.5900000000000001e-002 | AB202: -2.3700000000000002e-002 | AC202: -0.48700000000000004 | AD202: -0.5 | AE202: 100.71 | AF202: 100.67 | AG202: 0.26 | AH202: AA | AI202: 3.9399999999999998e-002 | AJ202: =H202+100*O202 -> 143.959 | AK202: 139.3 | AL202: 73 | AM202: 38.6 | AN202: 42 | AO202: -2.4e-002 | AP202: 17 | AQ202: 国祯转债!!
A203: 220 | B203: 123045 | C203: 雷迪转债 | D203: 300652 | E203: 雷迪克 | F203: 汽车 | G203: 零部件制 | H203: 127.376 | I203: -1.18e-002 | J203: 1.9e-003 | K203: 20.66 | L203: -1.4800000000000001e-002 | M203: 118.9 | N203: 19.63 | O203: 0.20999999999999999 | P203: 105.25 | Q203: 已到 | R203: 4.35年 | S203: 2.35年 | T203: 1.66 | U203: 516 | V203: 2.3799999999999999 | W203: 8.5000000000000006e-002 | X203: 8.9999999999999997e-002 | Y203: 19 | Z203: 2.04 | AA203: -1.61e-002 | AB203: -2.35e-002 | AC203: -7.8100000000000003e-002 | AD203: -8.0799999999999997e-002 | AE203: 87.41 | AF203: 88.3 | AG203: 0.67 | AH203: A+ | AI203: 7.2800000000000004e-002 | AJ203: =H203+100*O203 -> 148.376 | AK203: 149.5 | AL203: 177 | AM203: 61.2 | AN203: 207 | AO203: 6.9000000000000006e-002 | AP203: 34 | AQ203: 雷迪转债
A204: 333 | B204: 110045 | C204: 海澜转债! | D204: 600398 | E204: 海澜之家 | F204: 服装纺织 | G204: 服装行业 | H204: 115.4 | I204: 1.18e-002 | J204: -1.3600000000000001e-002 | K204: 6.53 | L204: -4.5999999999999999e-003 | M204: 110.3 | N204: 7.04 | O204: 0.24399999999999999 | P204: 92.76 | Q204: 已到 | R204: 2.68年 | S204: 0.68年 | T204: 29.5 | U204: 33 | V204: 1.e-002 | W204: 0.105 | X204: 9.6999999999999989e-002 | Y204: 282 | Z204: 2 | AA204: -1.6899999999999998e-002 | AB204: -2.3799999999999998e-002 | AC204: -0.14800000000000002 | AD204: -0.14999999999999999 | AE204: 98.36 | AF204: 100.84 | AG204: 0.38 | AH204: AA+ | AI204: 3.44e-002 | AJ204: =H204+100*O204 -> 139.80000000000001 | AK204: 138 | AL204: 57 | AM204: 37.2 | AN204: 35 | AO204: -4.5999999999999999e-002 | AP204: 46 | AQ204: 海澜转债!
A205: 169 | B205: 113593 | C205: 沪工转债! | D205: 603131 | E205: 上海沪工 | F205: 机械装备 | G205: 通用设备 | H205: 131.07 | I205: 1.1899999999999999e-002 | J205: -1.2500000000000001e-002 | K205: 23.63 | L205: -8.0000000000000004e-004 | M205: 121.2 | N205: 21.12 | O205: 0.17100000000000001 | P205: 111.88 | Q205: 已到 | R205: 4.70年 | S205: 2.70年 | T205: 4 | U205: 27 | V205: 5.0000000000000003e-002 | W205: 5.2999999999999999e-002 | X205: 5.9999999999999998e-002 | Y205: 75 | Z205: 5.65 | AA205: -1.6899999999999998e-002 | AB205: -2.4399999999999998e-002 | AC205: -7.7499999999999999e-002 | AD205: -8.0000000000000002e-002 | AE205: 85.35 | AF205: 87.78 | AG205: 0.71 | AH205: A+ | AI205: 7.2800000000000004e-002 | AJ205: =H205+100*O205 -> 148.16999999999999 | AK205: 150.3 | AL205: 181 | AM205: 62.5 | AN205: 216 | AO205: 7.2999999999999995e-002 | AP205: 10 | AQ205: 沪工转债!
A206: 46 | B206: 123112 | C206: 万讯转债 | D206: 300112 | E206: 万讯自控 | F206: 机械装备 | G206: 专用设备 | H206: 136.194 | I206: -4.2199999999999994e-002 | J206: 1.41e-002 | K206: 11.21 | L206: -3.78e-002 | M206: 124.4 | N206: 8.93 | O206: 8.5000000000000006e-002 | P206: 125.53 | Q206: 已到 | R206: 5.42年 | S206: 3.42年 | T206: 2.46 | U206: 78 | V206: 0.22500000000000001 | W206: 7.6999999999999999e-002 | X206: 9.6000000000000002e-002 | Y206: 32 | Z206: 2.95 | AA206: -1.6899999999999998e-002 | AB206: -2.4199999999999999e-002 | AC206: -7.2300000000000003e-002 | AD206: -7.4299999999999991e-002 | AE206: 83.89 | AF206: 89.82 | AG206: 0.75 | AH206: AA- | AI206: 6.3399999999999998e-002 | AJ206: =H206+100*O206 -> 144.69399999999999 | AK206: 146.9 | AL206: 154 | AM206: 57 | AN206: 178 | AO206: 3.3000000000000002e-002 | AP206: 15 | AQ206: 万讯转债
A207: 55 | B207: 127031 | C207: 洋丰转债! | D207: 902 | E207: 新洋丰 | F207: 化工 | G207: 农化 | H207: 128.201 | I207: -1.32e-002 | J207: -1.0800000000000001e-002 | K207: 17.08 | L207: -5.6399999999999999e-002 | M207: 117.1 | N207: 19.94 | O207: 0.49700000000000005 | P207: 85.66 | Q207: 已到 | R207: 5.38年 | S207: 3.38年 | T207: 10 | U207: 37 | V207: 2.7999999999999997e-002 | W207: 4.4999999999999998e-002 | X207: 3.7999999999999999e-002 | Y207: 223 | Z207: 2.96 | AA207: -1.7000000000000001e-002 | AB207: -2.2400000000000003e-002 | AC207: -5.8700000000000002e-002 | AD207: -6.0499999999999998e-002 | AE207: 89.53 | AF207: 94.05 | AG207: 0.43 | AH207: AA | AI207: 4.24e-002 | AJ207: =H207+100*O207 -> 177.90100000000001 | AK207: 170.7 | AL207: 288 | AM207: 76.7 | AN207: 283 | AO207: -3.5000000000000003e-002 | AP207: 4 | AQ207: 洋丰转债!
A208: 231 | B208: 113565 | C208: 宏辉转债 | D208: 603336 | E208: 宏辉果蔬 | F208: 农业 | G208: 农产品加 | H208: 127.21 | I208: -3.2000000000000001e-002 | J208: 7.000000000000001e-004 | K208: 8.63 | L208: -4.4299999999999999e-002 | M208: 117.8 | N208: 7.64 | O208: 0.126 | P208: 112.96 | Q208: 已到 | R208: 4.31年 | S208: 2.31年 | T208: 2.25 | U208: 516 | V208: 1.78 | W208: 5.9999999999999998e-002 | X208: 6.7000000000000004e-002 | Y208: 38 | Z208: 3.64 | AA208: -1.8100000000000002e-002 | AB208: -2.5099999999999997e-002 | AC208: -8.0100000000000005e-002 | AD208: -8.2599999999999993e-002 | AE208: 89.59 | AF208: 91.57 | AG208: 0.71 | AH208: AA- | AI208: 6.1799999999999994e-002 | AJ208: =H208+100*O208 -> 139.81 | AK208: 141.5 | AL208: 95 | AM208: 49.9 | AN208: 127 | AO208: 9.6999999999999989e-002 | AP208: 28 | AQ208: 宏辉转债
A209: 245 | B209: 113030 | C209: 东风转债! | D209: 601515 | E209: 东风股份 | F209: 造纸包装 | G209: 包装材料 | H209: 125.9 | I209: 2.76e-002 | J209: -2.4300000000000002e-002 | K209: 6.45 | L209: 6.1999999999999998e-003 | M209: 116.9 | N209: 6.45 | O209: 0.25900000000000001 | P209: 100 | Q209: 已到 | R209: 4年48天 | S209: 2年48天 | T209: 2.95 | U209: 194 | V209: 0.50800000000000001 | W209: 3.4000000000000002e-002 | X209: 3.4000000000000002e-002 | Y209: 86 | Z209: 1.9 | AA209: -1.8200000000000001e-002 | AB209: -2.52e-002 | AC209: -8.2899999999999988e-002 | AD209: -8.539999999999999e-002 | AE209: 94.42 | AF209: 99.46 | AG209: 0.52 | AH209: AA | AI209: 4.0800000000000003e-002 | AJ209: =H209+100*O209 -> 151.80000000000001 | AK209: 151.8 | AL209: 191 | AM209: 52.3 | AN209: 148 | AO209: -5.9999999999999998e-002 | AP209: 19 | AQ209: 东风转债!
A210: 49 | B210: 123109 | C210: 昌红转债 | D210: 300151 | E210: 昌红科技 | F210: 机械装备 | G210: 专用设备 | H210: 133.33 | I210: -7.0999999999999995e-003 | J210: 2.2000000000000001e-003 | K210: 34.57 | L210: -6.6e-003 | M210: 121 | N210: 28.06 | O210: 8.199999999999999e-002 | P210: 123.2 | Q210: 已到 | R210: 5.40年 | S210: 3.40年 | T210: 4.6 | U210: 33 | V210: 5.2999999999999999e-002 | W210: 2.6000000000000002e-002 | X210: 3.3000000000000002e-002 | Y210: 174 | Z210: 16.81 | AA210: -1.8200000000000001e-002 | AB210: -2.46e-002 | AC210: -6.8099999999999994e-002 | AD210: -6.9900000000000004e-002 | AE210: 83.66 | AF210: 87.44 | AG210: 0.75 | AH210: AA- | AI210: 6.3399999999999998e-002 | AJ210: =H210+100*O210 -> 141.53 | AK210: 143.5 | AL210: 113 | AM210: 56 | AN210: 167 | AO210: 3.7000000000000005e-002 | AP210: 5 | AQ210: 昌红转债
A211: 6 | B211: 123124 | C211: 晶瑞转2! | D211: 300655 | E211: 晶瑞电材 | F211: 电子 | G211: 电子行业 | H211: 123.5 | I211: 5.7999999999999996e-003 | J211: 1.7000000000000001e-003 | K211: 39.21 | L211: 1.32e-002 | M211: 111.2 | N211: 50.31 | O211: 0.58499999999999996 | P211: 77.94 | Q211: 3月16天 | R211: 5.78年 | S211: 3.78年 | T211: 5.23 | U211: 83 | V211: 0.127 | W211: 3.9e-002 | X211: 3.1e-002 | Y211: 134 | Z211: 9.2 | AA211: -1.8200000000000001e-002 | AB211: -2.1700000000000001e-002 | AC211: -4.5899999999999996e-002 | AD211: -4.7100000000000003e-002 | AE211: 77.5 | AF211: 73.9 | AG211: 0.57 | AH211: A+ | AI211: 7.4400000000000008e-002 | AJ211: =H211+100*O211 -> 182. | AK211: 169.1 | AL211: 283 | AM211: 91.6 | AN211: 310 | AO211: 6.0000000000000001e-003 | AP211: 5 | AQ211: 晶瑞转2!
A212: 203 | B212: 113577 | C212: 春秋转债! | D212: 603890 | E212: 春秋电子 | F212: 电子 | G212: 电子产品 | H212: 127.72 | I212: 1.46e-002 | J212: -7.1999999999999998e-003 | K212: 11.37 | L212: 1.1599999999999999e-002 | M212: 117.7 | N212: 10.85 | O212: 0.21899999999999997 | P212: 104.79 | Q212: 已到 | R212: 4.44年 | S212: 2.44年 | T212: 1.78 | U212: 18 | V212: 7.8e-002 | W212: 3.6000000000000004e-002 | X212: 3.7000000000000005e-002 | Y212: 50 | Z212: 2.01 | AA212: -1.8600000000000002e-002 | AB212: -2.5399999999999999e-002 | AC212: -7.7899999999999997e-002 | AD212: -8.0199999999999994e-002 | AE212: 88.79 | AF212: 90.77 | AG212: 0.64 | AH212: AA- | AI212: 6.1799999999999994e-002 | AJ212: =H212+100*O212 -> 149.62 | AK212: 150.6 | AL212: 185 | AM212: 59.9 | AN212: 201 | AO212: 3.0000000000000001e-003 | AP212: 17 | AQ212: 春秋转债!
A213: 207 | B213: 128106 | C213: 华统转债 | D213: 2840 | E213: 华统股份 | F213: 农业 | G213: 农产品加 | H213: 122.799 | I213: -2.1499999999999998e-002 | J213: -1.1999999999999999e-003 | K213: 10.36 | L213: -3.3599999999999998e-002 | M213: 112.9 | N213: 9.37 | O213: 0.111 | P213: 110.57 | Q213: 已到 | R213: 4.42年 | S213: 2.42年 | T213: 5.35 | U213: 37 | V213: 5.5e-002 | W213: 0.115 | X213: 0.128 | Y213: 46 | Z213: 2.75 | AA213: -1.9199999999999998e-002 | AB213: -2.4300000000000002e-002 | AC213: -6.4699999999999994e-002 | AD213: -6.7000000000000004e-002 | AE213: 93.32 | AF213: 94.95 | AG213: 0.68 | AH213: AA | AI213: 4.0800000000000003e-002 | AJ213: =H213+100*O213 -> 133.899 | AK213: 135 | AL213: 38 | AM213: 40.1 | AN213: 51 | AO213: -4.4000000000000004e-002 | AP213: 12 | AQ213: 华统转债
A214: 60 | B214: 127029 | C214: 中钢转债! | D214: 928 | E214: 中钢国际 | F214: 建筑 | G214: 建筑工程 | H214: 130.2 | I214: -1.1599999999999999e-002 | J214: -8.5000000000000006e-003 | K214: 6.5 | L214: -3.1300000000000001e-002 | M214: 117.5 | N214: 5.79 | O214: 0.16 | P214: 112.26 | Q214: 已到 | R214: 5.36年 | S214: 3.36年 | T214: 8.2 | U214: 33 | V214: 3.1e-002 | W214: 9.9000000000000005e-002 | X214: 0.111 | Y214: 83 | Z214: 1.39 | AA214: -1.9199999999999998e-002 | AB214: -2.4700000000000003e-002 | AC214: -6.4500000000000002e-002 | AD214: -6.6000000000000003e-002 | AE214: 90.55 | AF214: 96.78 | AG214: 0.64 | AH214: AA+ | AI214: 3.7400000000000003e-002 | AJ214: =H214+100*O214 -> 146.19999999999999 | AK214: 148.1 | AL214: 165 | AM214: 51.4 | AN214: 140 | AO214: -0.13200000000000001 | AP214: 14 | AQ214: 中钢转债!
A215: 271 | B215: 128073 | C215: 哈尔转债! | D215: 2615 | E215: 哈尔斯 | F215: 其他 | G215: 家居用品 | H215: 120.828 | I215: 1.9699999999999999e-002 | J215: 8.8999999999999999e-003 | K215: 5.57 | L215: 5.8899999999999994e-002 | M215: 114.5 | N215: 5.71 | O215: 0.23899999999999999 | P215: 97.55 | Q215: 已到 | R215: 2.79年 | S215: 0.79年 | T215: 2.99 | U215: 222 | V215: 0.61299999999999999 | W215: 0.13 | X215: 0.127 | Y215: 23 | Z215: 2.68 | AA215: -1.9299999999999998e-002 | AB215: -2.8300000000000002e-002 | AC215: -0.17000000000000001 | AD215: -0.17199999999999999 | AE215: 95.72 | AF215: 97.39 | AG215: 0.49 | AH215: AA- | AI215: 6.0400000000000002e-002 | AJ215: =H215+100*O215 -> 144.72800000000001 | AK215: 144.1 | AL215: 123 | AM215: 46.7 | AN215: 100 | AO215: 1.3000000000000001e-002 | AP215: 38 | AQ215: 哈尔转债!
A216: 37 | B216: 111000 | C216: 起帆转债 | D216: 605222 | E216: 起帆电缆 | F216: 能源电力 | G216: 电力设备 | H216: 134.9 | I216: -3.9699999999999999e-002 | J216: 5.28e-002 | K216: 25.46 | L216: 1.6799999999999999e-002 | M216: 120.5 | N216: 20.1 | O216: 6.5000000000000002e-002 | P216: 126.67 | Q216: 23天 | R216: 5.55年 | S216: 3.55年 | T216: 10 | U216: 467 | V216: 0.33100000000000002 | W216: 9.4e-002 | X216: 0.11900000000000001 | Y216: 106 | Z216: 3.07 | AA216: -2.0499999999999997e-002 | AB216: -2.6600000000000002e-002 | AC216: -6.8699999999999997e-002 | AD216: -7.0400000000000004e-002 | AE216: 82.85 | AF216: 86.29 | AG216: 0.78 | AH216: AA- | AI216: 6.3399999999999998e-002 | AJ216: =H216+100*O216 -> 141.40000000000001 | AK216: 143.1 | AL216: 109 | AM216: 56.8 | AN216: 176 | AO216: 0.183 | AP216: 10 | AQ216: 起帆转债
A217: 53 | B217: 110079 | C217: 杭银转债! | D217: 600926 | E217: 杭州银行 | F217: 金融 | G217: 银行行业 | H217: 125.54 | I217: -4.5999999999999999e-003 | J217: 0. | K217: 14.3 | L217: -6.8999999999999999e-003 | M217: 112.4 | N217: 12.99 | O217: 0.14000000000000001 | P217: 110.08 | Q217: 已到 | R217: 5.39年 | S217: 无权 | T217: 150 | U217: 115 | V217: 6.0000000000000001e-003 | W217: 0.17699999999999999 | X217: 0.19500000000000001 | Y217: 848 | Z217: 1.22 | AA217: -2.06e-002 | AB217: -2.46e-002 | AC217: 无权 | AD217: 无权 | AE217: 无权 | AF217: 93.45 | AG217: 0.66 | AH217: AAA | AI217: 3.5400000000000001e-002 | AJ217: =H217+100*O217 -> 139.54000000000002 | AK217: 141 | AL217: 92 | AM217: 47.5 | AN217: 110 | AO217: -4.2999999999999997e-002 | AP217: 14 | AQ217: 杭银转债!
A218: 129 | B218: 127022 | C218: 恒逸转债 | D218: 703 | E218: 恒逸石化 | F218: 化工 | G218: 化工 | H218: 120.745 | I218: 7.9000000000000008e-003 | J218: -8.3999999999999995e-003 | K218: 10.49 | L218: -1.e-003 | M218: 108.7 | N218: 11.2 | O218: 0.28899999999999998 | P218: 93.66 | Q218: 已到 | R218: 4.94年 | S218: 2.94年 | T218: 20 | U218: 5.8 | V218: 2.e-003 | W218: 5.2000000000000005e-002 | X218: 4.9000000000000002e-002 | Y218: 385 | Z218: 1.49 | AA218: -2.1299999999999999e-002 | AB218: -2.4500000000000001e-002 | AC218: -5.1699999999999996e-002 | AD218: -5.3099999999999994e-002 | AE218: 91.89 | AF218: 91.58 | AG218: 0.54 | AH218: AA+ | AI218: 3.5799999999999998e-002 | AJ218: =H218+100*O218 -> 149.64500000000001 | AK218: 147.8 | AL218: 162 | AM218: 55.9 | AN218: 166 | AO218: -6.2e-002 | AP218: 7 | AQ218: 恒逸转债
A219: 100 | B219: 127026 | C219: 超声转债! | D219: 823 | E219: 超声电子 | F219: 电子 | G219: 元器件制 | H219: 125.95 | I219: 2.8199999999999999e-002 | J219: -8.1000000000000013e-003 | K219: 13.14 | L219: 3.2199999999999999e-002 | M219: 113.1 | N219: 12.72 | O219: 0.21899999999999997 | P219: 103.3 | Q219: 已到 | R219: 5年32天 | S219: 3年32天 | T219: 7 | U219: 86 | V219: 9.8000000000000004e-002 | W219: 9.9000000000000005e-002 | X219: 0.10199999999999999 | Y219: 71 | Z219: 1.77 | AA219: -2.1299999999999999e-002 | AB219: -2.58e-002 | AC219: -5.8700000000000002e-002 | AD219: -6.0700000000000004e-002 | AE219: 90.63 | AF219: 91.96 | AG219: 0.63 | AH219: AA | AI219: 4.24e-002 | AJ219: =H219+100*O219 -> 147.84999999999999 | AK219: 148.6 | AL219: 169 | AM219: 56.6 | AN219: 174 | AO219: 0.187 | AP219: 13 | AQ219: 超声转债!
A220: 150 | B220: 113600 | C220: 新星转债!! | D220: 603978 | E220: 深圳新星 | F220: 有色金属 | G220: 有色行业 | H220: 139.01 | I220: 3.9800000000000002e-002 | J220: 7.4000000000000003e-003 | K220: 32 | L220: 6.1399999999999996e-002 | M220: 125.6 | N220: 23.85 | O220: 3.6000000000000004e-002 | P220: 134.17 | Q220: 已到 | R220: 4.77年 | S220: 2.77年 | T220: 4.54 | U220: 634 | V220: 1.01 | W220: 8.6999999999999994e-002 | X220: 0.11599999999999999 | Y220: 52 | Z220: 3.37 | AA220: -2.1400000000000002e-002 | AB220: -2.9999999999999999e-002 | AC220: -9.6300000000000011e-002 | AD220: -9.820000000000001e-002 | AE220: 86.95 | AF220: 94.9 | AG220: 0.77 | AH220: AA- | AI220: 6.1799999999999994e-002 | AJ220: =H220+100*O220 -> 142.60999999999999 | AK220: 143.8 | AL220: 119 | AM220: 48.9 | AN220: 121 | AO220: -3.1e-002 | AP220: 27 | AQ220: 新星转债!!
A221: 189 | B221: 123054 | C221: 思特转债!! | D221: 300608 | E221: 思特奇 | F221: 通信互联 | G221: 通信设备 | H221: 133.9 | I221: 2.0499999999999997e-002 | J221: -8.3999999999999995e-003 | K221: 11.9 | L221: 2.23e-002 | M221: 121.2 | N221: 12.63 | O221: 0.42100000000000004 | P221: 94.22 | Q221: 已到 | R221: 4.59年 | S221: 2.59年 | T221: 2.08 | U221: 940 | V221: 3.3700000000000001 | W221: 8.3000000000000004e-002 | X221: 7.8e-002 | Y221: 25 | Z221: 3 | AA221: -2.1899999999999999e-002 | AB221: -2.9500000000000002e-002 | AC221: -8.7899999999999992e-002 | AD221: -9.0399999999999994e-002 | AE221: 88.4 | AF221: 92.64 | AG221: 0.54 | AH221: AA- | AI221: 6.1799999999999994e-002 | AJ221: =H221+100*O221 -> 176. | AK221: 173.6 | AL221: 294 | AM221: 80.9 | AN221: 292 | AO221: -4.0000000000000001e-002 | AP221: 19 | AQ221: 思特转债!!
A222: 354 | B222: 128025 | C222: 特一转债! | D222: 2728 | E222: 特一药业 | F222: 医药 | G222: 化学制药 | H222: 113.867 | I222: 1.5e-003 | J222: -5.3e-003 | K222: 12.12 | L222: -1.1399999999999999e-002 | M222: 108.8 | N222: 14.05 | O222: 0.32000000000000001 | P222: 86.26 | Q222: 已到 | R222: 2年30天 | S222: 30天 | T222: 2.98 | U222: 16 | V222: 4.5999999999999999e-002 | W222: 0.121 | X222: 0.10400000000000001 | Y222: 25 | Z222: 2.47 | AA222: -2.2000000000000002e-002 | AB222: -2.9700000000000001e-002 | AC222: -0.47299999999999998 | AD222: -0.48499999999999999 | AE222: 100.09 | AF222: 96.51 | AG222: 0.33 | AH222: AA- | AI222: 6.0400000000000002e-002 | AJ222: =H222+100*O222 -> 145.86700000000002 | AK222: 141.5 | AL222: 96 | AM222: 41.4 | AN222: 61 | AO222: -6.9000000000000006e-002 | AP222: 50 | AQ222: 特一转债!
A223: 179 | B223: 123057 | C223: 美联转债! | D223: 300586 | E223: 美联新材 | F223: 化工 | G223: 橡胶塑料 | H223: 130.39 | I223: -4.82e-002 | J223: 1.26e-002 | K223: 10.67 | L223: -5.0700000000000002e-002 | M223: 117.8 | N223: 9.5 | O223: 0.161 | P223: 112.32 | Q223: 已到 | R223: 4.65年 | S223: 2.65年 | T223: 2.07 | U223: 121 | V223: 0.44 | W223: 3.7000000000000005e-002 | X223: 4.0999999999999995e-002 | Y223: 56 | Z223: 4.68 | AA223: -2.2099999999999998e-002 | AB223: -2.8500000000000001e-002 | AC223: -7.8700000000000006e-002 | AD223: -8.09e-002 | AE223: 87.76 | AF223: 89.71 | AG223: 0.7 | AH223: AA- | AI223: 6.1799999999999994e-002 | AJ223: =H223+100*O223 -> 146.48999999999998 | AK223: 148.5 | AL223: 167 | AM223: 58.8 | AN223: 191 | AO223: 2.8999999999999998e-002 | AP223: 20 | AQ223: 美联转债!
A224: 212 | B224: 113575 | C224: 东时转债!! | D224: 603377 | E224: 东方时尚 | F224: 其他 | G224: 其他 | H224: 124.78 | I224: 6.8999999999999999e-003 | J224: -4.6999999999999993e-003 | K224: 8.09 | L224: 1.2500000000000001e-002 | M224: 113.1 | N224: 12.15 | O224: 0.87400000000000011 | P224: 66.58 | Q224: 已到 | R224: 4.42年 | S224: 2.42年 | T224: 0.98 | U224: 125 | V224: 1.01 | W224: 1.7000000000000001e-002 | X224: 1.1000000000000001e-002 | Y224: 59 | Z224: 2.72 | AA224: -2.2400000000000003e-002 | AB224: -2.76e-002 | AC224: -7.0499999999999993e-002 | AD224: -7.2800000000000004e-002 | AE224: 93.36 | AF224: 95.13 | AG224: 0.17 | AH224: AA | AI224: 4.0800000000000003e-002 | AJ224: =H224+100*O224 -> 212.18000000000001 | AK224: 183 | AL224: 312 | AM224: 87.8 | AN224: 304 | AO224: 1.6e-002 | AP224: 14 | AQ224: 东时转债!!
A225: 357 | B225: 128021 | C225: 兄弟转债!! | D225: 2562 | E225: 兄弟科技 | F225: 医药 | G225: 原料药 | H225: 113.986 | I225: 1.6000000000000001e-003 | J225: -3.8e-003 | K225: 4.25 | L225: -1.1599999999999999e-002 | M225: 108.8 | N225: 5.19 | O225: 0.39200000000000002 | P225: 81.89 | Q225: 已到 | R225: 2年22天 | S225: 22天 | T225: 2.65 | U225: 7.6 | V225: 2.5000000000000001e-002 | W225: 5.9000000000000004e-002 | X225: 4.8000000000000001e-002 | Y225: 45 | Z225: 1.54 | AA225: -2.2700000000000001e-002 | AB225: -3.0499999999999999e-002 | AC225: -0.52500000000000002 | AD225: -0.53700000000000003 | AE225: 100.67 | AF225: 100.62 | AG225: 0.19 | AH225: AA | AI225: 3.9399999999999998e-002 | AJ225: =H225+100*O225 -> 153.18600000000001 | AK225: 146.1 | AL225: 143 | AM225: 45.4 | AN225: 91 | AO225: 4.2000000000000003e-002 | AP225: 18 | AQ225: 兄弟转债!!
A226: 77 | B226: 113619 | C226: 世运转债! | D226: 603920 | E226: 世运电路 | F226: 电子 | G226: 元器件制 | H226: 129.7 | I226: 2.5999999999999999e-003 | J226: 1.1000000000000001e-003 | K226: 21.64 | L226: 5.6000000000000008e-003 | M226: 115.2 | N226: 19.92 | O226: 0.19399999999999998 | P226: 108.63 | Q226: 已到 | R226: 5.21年 | S226: 3.21年 | T226: 10 | U226: 158 | V226: 0.121 | W226: 8.6999999999999994e-002 | X226: 9.4e-002 | Y226: 115 | Z226: 4.41 | AA226: -2.29e-002 | AB226: -2.7900000000000001e-002 | AC226: -6.4699999999999994e-002 | AD226: -6.6600000000000006e-002 | AE226: 90.28 | AF226: 93.22 | AG226: 0.66 | AH226: AA | AI226: 4.24e-002 | AJ226: =H226+100*O226 -> 149.09999999999999 | AK226: 150.8 | AL226: 186 | AM226: 57.5 | AN226: 181 | AO226: 0.312 | AP226: 6 | AQ226: 世运转债!
A227: 321 | B227: 128048 | C227: 张行转债 | D227: 2839 | E227: 张家港行 | F227: 金融 | G227: 银行行业 | H227: 121.384 | I227: -2.35e-002 | J227: 5.3e-003 | K227: 5.71 | L227: -3.5499999999999997e-002 | M227: 113.3 | N227: 5.6 | O227: 0.19 | P227: 101.96 | Q227: 已到 | R227: 3年6.1天 | S227: 无权 | T227: 25 | U227: 27 | V227: 9.0000000000000011e-003 | W227: 0.24199999999999999 | X227: 0.247 | Y227: 103 | Z227: 0.89 | AA227: -2.3099999999999999e-002 | AB227: -3.0800000000000001e-002 | AC227: 无权 | AD227: 无权 | AE227: 无权 | AF227: 102.15 | AG227: 0.51 | AH227: AA+ | AI227: 3.5799999999999998e-002 | AJ227: =H227+100*O227 -> 140.38400000000001 | AK227: 140.8 | AL227: 89 | AM227: 38.7 | AN227: 44 | AO227: -4.5999999999999999e-002 | AP227: 12 | AQ227: 张行转债
A228: 120 | B228: 113607 | C228: 伟20转债! | D228: 603568 | E228: 伟明环保 | F228: 城市公用 | G228: 三废处理 | H228: 129.13 | I228: 4.0000000000000002e-004 | J228: -5.6999999999999993e-003 | K228: 26.86 | L228: -6.9999999999999993e-003 | M228: 114.8 | N228: 21.71 | O228: 4.4000000000000004e-002 | P228: 123.72 | Q228: 已到 | R228: 4.99年 | S228: 2.99年 | T228: 10.8 | U228: 31 | V228: 2.2000000000000002e-002 | W228: 3.2000000000000001e-002 | X228: 4.0000000000000001e-002 | Y228: 338 | Z228: 5.45 | AA228: -2.3700000000000002e-002 | AB228: -2.8799999999999999e-002 | AC228: -6.8699999999999997e-002 | AD228: -7.0499999999999993e-002 | AE228: 91.14 | AF228: 94.37 | AG228: 0.75 | AH228: AA | AI228: 4.0800000000000003e-002 | AJ228: =H228+100*O228 -> 133.53 | AK228: 134.5 | AL228: 36 | AM228: 40.2 | AN228: 54 | AO228: -1.9e-002 | AP228: 10 | AQ228: 伟20转债!
A229: 57 | B229: 128145 | C229: 日丰转债 | D229: 2953 | E229: 日丰股份 | F229: 家电 | G229: 零部件制 | H229: 131 | I229: -1.7600000000000001e-002 | J229: 8.8000000000000005e-003 | K229: 17.48 | L229: -1.0800000000000001e-002 | M229: 115.4 | N229: 13.66 | O229: 2.4e-002 | P229: 127.96 | Q229: 已到 | R229: 5.37年 | S229: 3.37年 | T229: 3.8 | U229: 209 | V229: 0.41899999999999998 | W229: 8.900000000000001e-002 | X229: 0.114 | Y229: 43 | Z229: 3.72 | AA229: -2.3799999999999998e-002 | AB229: -2.87e-002 | AC229: -6.4299999999999996e-002 | AD229: -6.6100000000000006e-002 | AE229: 83.63 | AF229: 83.52 | AG229: 0.82 | AH229: AA- | AI229: 6.3399999999999998e-002 | AJ229: =H229+100*O229 -> 133.40000000000001 | AK229: 134 | AL229: 34 | AM229: 50.4 | AN229: 131 | AO229: 0.10800000000000001 | AP229: 9 | AQ229: 日丰转债
A230: 204 | B230: 123050 | C230: 聚飞转债! | D230: 300303 | E230: 聚飞光电 | F230: 电子 | G230: LED制 | H230: 138.18 | I230: 2.9700000000000001e-002 | J230: -2.5000000000000001e-002 | K230: 6.04 | L230: 6.7000000000000002e-003 | M230: 123.8 | N230: 5.08 | O230: 0.16200000000000001 | P230: 118.9 | Q230: 已到 | R230: 4.44年 | S230: 2.44年 | T230: 3.75 | U230: 370 | V230: 0.71499999999999997 | W230: 4.5999999999999999e-002 | X230: 5.5e-002 | Y230: 81 | Z230: 2.92 | AA230: -2.5000000000000001e-002 | AB230: -3.3599999999999998e-002 | AC230: -0.105 | AD230: -0.107 | AE230: 88.89 | AF230: 95.47 | AG230: 0.69 | AH230: AA- | AI230: 6.1799999999999994e-002 | AJ230: =H230+100*O230 -> 154.38 | AK230: 157.5 | AL230: 228 | AM230: 62 | AN230: 209 | AO230: 2.e-003 | AP230: 13 | AQ230: 聚飞转债!
A231: 290 | B231: 113024 | C231: 核建转债! | D231: 601611 | E231: 中国核建 | F231: 建筑 | G231: 建筑工程 | H231: 119.02 | I231: -2.63e-002 | J231: 7.4000000000000003e-003 | K231: 8.96 | L231: -4.2699999999999995e-002 | M231: 109.3 | N231: 9.7 | O231: 0.28800000000000003 | P231: 92.37 | Q231: 已到 | R231: 3.42年 | S231: 1.42年 | T231: 30 | U231: 78 | V231: 2.2000000000000002e-002 | W231: 0.126 | X231: 0.11699999999999999 | Y231: 237 | Z231: 1.91 | AA231: -2.5099999999999997e-002 | AB231: -2.9999999999999999e-002 | AC231: -8.8900000000000007e-002 | AD231: -9.1899999999999996e-002 | AE231: 97.57 | AF231: 97.8 | AG231: 0.44 | AH231: AAA | AI231: 3.3799999999999997e-002 | AJ231: =H231+100*O231 -> 147.81999999999999 | AK231: 145.7 | AL231: 139 | AM231: 47.9 | AN231: 112 | AO231: 3.7000000000000005e-002 | AP231: 34 | AQ231: 核建转债!
A232: 244 | B232: 123038 | C232: 联得转债! | D232: 300545 | E232: 联得装备 | F232: 机械装备 | G232: 专用设备 | H232: 131.523 | I232: 1.5600000000000001e-002 | J232: 4.5000000000000005e-003 | K232: 24.95 | L232: 3.1e-002 | M232: 118.6 | N232: 24.07 | O232: 0.26899999999999996 | P232: 103.66 | Q232: 已到 | R232: 4年49天 | S232: 2年49天 | T232: 1.47 | U232: 279 | V232: 1.4299999999999999 | W232: 3.3000000000000002e-002 | X232: 3.4000000000000002e-002 | Y232: 44 | Z232: 3.2 | AA232: -2.53e-002 | AB232: -3.2799999999999996e-002 | AC232: -9.8699999999999996e-002 | AD232: -0.10099999999999999 | AE232: 88.54 | AF232: 89.36 | AG232: 0.65 | AH232: A+ | AI232: 7.2800000000000004e-002 | AJ232: =H232+100*O232 -> 158.423 | AK232: 159.4 | AL232: 242 | AM232: 70 | AN232: 258 | AO232: 0.11800000000000001 | AP232: 20 | AQ232: 联得转债!
A233: 133 | B233: 128134 | C233: 鸿路转债! | D233: 2541 | E233: 鸿路钢构 | F233: 建筑 | G233: 其他建材 | H233: 130.28 | I233: -2.0499999999999997e-002 | J233: 5.3e-003 | K233: 44.01 | L233: -2.5899999999999999e-002 | M233: 114.8 | N233: 43.51 | O233: 0.28800000000000003 | P233: 101.15 | Q233: 已到 | R233: 4.92年 | S233: 2.92年 | T233: 15.7 | U233: 30 | V233: 1.3999999999999999e-002 | W233: 6.7000000000000004e-002 | X233: 6.8000000000000005e-002 | Y233: 234 | Z233: 3.51 | AA233: -2.58e-002 | AB233: -3.0899999999999997e-002 | AC233: -7.2800000000000004e-002 | AD233: -7.46e-002 | AE233: 91.38 | AF233: 94.62 | AG233: 0.58 | AH233: AA | AI233: 4.0800000000000003e-002 | AJ233: =H233+100*O233 -> 159.08000000000001 | AK233: 159.4 | AL233: 243 | AM233: 64.8 | AN233: 231 | AO233: -3.3000000000000002e-002 | AP233: 4 | AQ233: 鸿路转债!
A234: 232 | B234: 128097 | C234: 奥佳转债!! | D234: 2614 | E234: 奥佳华 | F234: 机械装备 | G234: 专用设备 | H234: 128.37 | I234: -6.0000000000000001e-003 | J234: 9.0000000000000011e-003 | K234: 11.33 | L234: 4.4000000000000003e-003 | M234: 114.9 | N234: 10.39 | O234: 0.17699999999999999 | P234: 109.05 | Q234: 已到 | R234: 4.30年 | S234: 2.30年 | T234: 4.59 | U234: 35 | V234: 5.9000000000000004e-002 | W234: 6.4000000000000001e-002 | X234: 7.0000000000000007e-002 | Y234: 71 | Z234: 1.52 | AA234: -2.5899999999999999e-002 | AB234: -3.1899999999999998e-002 | AC234: -8.4600000000000009e-002 | AD234: -8.6899999999999991e-002 | AE234: 89.31 | AF234: 89.27 | AG234: 0.69 | AH234: AA- | AI234: 6.1799999999999994e-002 | AJ234: =H234+100*O234 -> 146.06999999999999 | AK234: 147.7 | AL234: 160 | AM234: 58.4 | AN234: 187 | AO234: -7.9000000000000001e-002 | AP234: 18 | AQ234: 奥佳转债!!
A235: 337 | B235: 128040 | C235: 华通转债! | D235: 2758 | E235: 浙农股份 | F235: 医药 | G235: 医药商业 | H235: 119.21 | I235: -6.3e-003 | J235: 3.8e-003 | K235: 10.12 | L235: -4.8999999999999998e-003 | M235: 111.3 | N235: 10.15 | O235: 0.19600000000000001 | P235: 99.7 | Q235: 已到 | R235: 2.60年 | S235: 0.60年 | T235: 2.22 | U235: 3.6 | V235: 1.3999999999999999e-002 | W235: 4.4999999999999998e-002 | X235: 4.4999999999999998e-002 | Y235: 49 | Z235: 1.51 | AA235: -2.6499999999999999e-002 | AB235: -3.4099999999999998e-002 | AC235: -0.19600000000000001 | AD235: -0.19899999999999998 | AE235: 98.83 | AF235: 100.82 | AG235: 0.49 | AH235: AA | AI235: 3.9399999999999998e-002 | AJ235: =H235+100*O235 -> 138.81 | AK235: 138.7 | AL235: 67 | AM235: 37.9 | AN235: 37 | AO235: -6.9999999999999993e-003 | AP235: 32 | AQ235: 华通转债!
A236: 171 | B236: 128121 | C236: 宏川转债! | D236: 2930 | E236: 宏川智慧 | F236: 交通运输 | G236: 物流业 | H236: 128.001 | I236: -1.7600000000000001e-002 | J236: -1.9e-003 | K236: 23 | L236: -2.5399999999999999e-002 | M236: 112.9 | N236: 19.89 | O236: 0.107 | P236: 115.64 | Q236: 已到 | R236: 4.69年 | S236: 2.69年 | T236: 6.7 | U236: 17 | V236: 2.e-002 | W236: 6.5000000000000002e-002 | X236: 7.4999999999999997e-002 | Y236: 103 | Z236: 4.85 | AA236: -2.69e-002 | AB236: -3.1600000000000003e-002 | AC236: -7.2400000000000006e-002 | AD236: -7.4499999999999997e-002 | AE236: 87.24 | AF236: 85.7 | AG236: 0.77 | AH236: AA- | AI236: 6.1799999999999994e-002 | AJ236: =H236+100*O236 -> 138.70099999999999 | AK236: 140.4 | AL236: 84 | AM236: 53.1 | AN236: 151 | AO236: 4.4000000000000004e-002 | AP236: 5 | AQ236: 宏川转债!
A237: 32 | B237: 123115 | C237: 捷捷转债 | D237: 300623 | E237: 捷捷微电 | F237: 电子 | G237: 元器件制 | H237: 137.68 | I237: -1.15e-002 | J237: -8.199999999999999e-003 | K237: 31.21 | L237: -2.7999999999999997e-002 | M237: 118.5 | N237: 29 | O237: 0.27899999999999997 | P237: 107.62 | Q237: 39天 | R237: 5.59年 | S237: 3.59年 | T237: 12 | U237: 83 | V237: 4.9000000000000002e-002 | W237: 5.2000000000000005e-002 | X237: 5.5999999999999994e-002 | Y237: 230 | Z237: 8.09 | AA237: -2.7000000000000003e-002 | AB237: -3.2500000000000001e-002 | AC237: -7.2999999999999995e-002 | AD237: -7.4700000000000003e-002 | AE237: 82.64 | AF237: 84.65 | AG237: 0.7 | AH237: AA- | AI237: 6.3399999999999998e-002 | AJ237: =H237+100*O237 -> 165.58000000000001 | AK237: 167.7 | AL237: 275 | AM237: 83.1 | AN237: 296 | AO237: -1.6e-002 | AP237: 7 | AQ237: 捷捷转债
A238: 110 | B238: 110077 | C238: 洪城转债 | D238: 600461 | E238: 洪城环境 | F238: 城市公用 | G238: 城市公用 | H238: 130.17 | I238: -1.3500000000000002e-002 | J238: -1.41e-002 | K238: 8.08 | L238: -3.6900000000000002e-002 | M238: 113.5 | N238: 6.71 | O238: 8.1000000000000003e-002 | P238: 120.42 | Q238: 已到 | R238: 5年14天 | S238: 3年14天 | T238: 17.7 | U238: 20 | V238: 8.0000000000000002e-003 | W238: 0.23000000000000001 | X238: 0.27699999999999997 | Y238: 77 | Z238: 1.42 | AA238: -2.7200000000000002e-002 | AB238: -3.1800000000000002e-002 | AC238: -7.2900000000000006e-002 | AD238: -7.4099999999999999e-002 | AE238: 90.97 | AF238: 94.57 | AG238: 0.75 | AH238: AA+ | AI238: 3.7400000000000003e-002 | AJ238: =H238+100*O238 -> 138.26999999999998 | AK238: 139.9 | AL238: 79 | AM238: 45.4 | AN238: 89 | AO238: -3.7000000000000005e-002 | AP238: 7 | AQ238: 洪城转债
A239: 116 | B239: 128137 | C239: 洁美转债 | D239: 2859 | E239: 洁美科技 | F239: 电子 | G239: 元器件制 | H239: 133.93 | I239: 5.9999999999999995e-004 | J239: -2.2000000000000001e-003 | K239: 29.85 | L239: -2.3e-003 | M239: 117.3 | N239: 27.63 | O239: 0.23999999999999999 | P239: 108.03 | Q239: 已到 | R239: 4.99年 | S239: 2.99年 | T239: 5.99 | U239: 3.5 | V239: 4.0000000000000001e-003 | W239: 4.9000000000000002e-002 | X239: 5.2999999999999999e-002 | Y239: 122 | Z239: 6.21 | AA239: -2.7300000000000001e-002 | AB239: -3.3000000000000002e-002 | AC239: -7.9100000000000004e-002 | AD239: -8.09e-002 | AE239: 85.67 | AF239: 87.13 | AG239: 0.7 | AH239: AA- | AI239: 6.1799999999999994e-002 | AJ239: =H239+100*O239 -> 157.93000000000001 | AK239: 159.8 | AL239: 246 | AM239: 72.7 | AN239: 268 | AO239: 4.2000000000000003e-002 | AP239: 5 | AQ239: 洁美转债
A240: 143 | B240: 113602 | C240: 景20转债! | D240: 603228 | E240: 景旺电子 | F240: 电子 | G240: 元器件制 | H240: 129.06 | I240: -2.5999999999999999e-003 | J240: 4.8999999999999998e-003 | K240: 29.03 | L240: 3.4999999999999996e-003 | M240: 112.9 | N240: 27.4 | O240: 0.218 | P240: 105.95 | Q240: 已到 | R240: 4.80年 | S240: 2.80年 | T240: 17.8 | U240: 66 | V240: 2.7999999999999997e-002 | W240: 7.2000000000000008e-002 | X240: 7.5999999999999998e-002 | Y240: 247 | Z240: 3.66 | AA240: -2.7999999999999997e-002 | AB240: -3.2599999999999997e-002 | AC240: -7.2599999999999998e-002 | AD240: -7.4499999999999997e-002 | AE240: 91.94 | AF240: 93.55 | AG240: 0.64 | AH240: AA | AI240: 4.0800000000000003e-002 | AJ240: =H240+100*O240 -> 150.86000000000001 | AK240: 152.2 | AL240: 196 | AM240: 58.6 | AN240: 189 | AO240: 0.13300000000000001 | AP240: 9 | AQ240: 景20转债!
A241: 253 | B241: 128081 | C241: 海亮转债! | D241: 2203 | E241: 海亮股份 | F241: 有色金属 | G241: 铜金属 | H241: 128.672 | I241: 3.3700000000000001e-002 | J241: 8.3999999999999995e-003 | K241: 12.22 | L241: 5.5300000000000002e-002 | M241: 114.9 | N241: 9.69 | O241: 2.e-002 | P241: 126.11 | Q241: 已到 | R241: 4年15天 | S241: 2年15天 | T241: 30.1 | U241: 294 | V241: 7.5999999999999998e-002 | W241: 0.125 | X241: 0.158 | Y241: 240 | Z241: 2.41 | AA241: -2.8199999999999999e-002 | AB241: -3.4500000000000003e-002 | AC241: -9.5299999999999996e-002 | AD241: -9.7799999999999998e-002 | AE241: 94.76 | AF241: 98.12 | AG241: 0.76 | AH241: AA | AI241: 4.0800000000000003e-002 | AJ241: =H241+100*O241 -> 130.672 | AK241: 131.2 | AL241: 18 | AM241: 33.1 | AN241: 22 | AO241: 0.109 | AP241: 49 | AQ241: 海亮转债!
A242: 312 | B242: 113527 | C242: 维格转债!! | D242: 603518 | E242: 锦泓集团 | F242: 服装纺织 | G242: 服装行业 | H242: 131.21 | I242: -4.0300000000000002e-002 | J242: 2.7400000000000001e-002 | K242: 11.89 | L242: -1.9e-002 | M242: 119.5 | N242: 9.85 | O242: 8.6999999999999994e-002 | P242: 120.71 | Q242: 已到 | R242: 3.22年 | S242: 1.22年 | T242: 2.87 | U242: 121 | V242: 0.313 | W242: 8.1000000000000003e-002 | X242: 9.8000000000000004e-002 | Y242: 35 | Z242: 1.45 | AA242: -2.92e-002 | AB242: -3.9199999999999999e-002 | AC242: -0.14999999999999999 | AD242: -0.153 | AE242: 96.09 | AF242: 102.24 | AG242: 0.68 | AH242: AA | AI242: 5.0799999999999998e-002 | AJ242: =H242+100*O242 -> 139.91 | AK242: 141.7 | AL242: 98 | AM242: 39.5 | AN242: 48 | AO242: -0.13600000000000001 | AP242: 75 | AQ242: 维格转债!!
A243: 85 | B243: 123091 | C243: 长海转债 | D243: 300196 | E243: 长海股份 | F243: 其他 | G243: 非金属矿 | H243: 135.4 | I243: -3.0999999999999999e-003 | J243: -8.8999999999999999e-003 | K243: 17.35 | L243: -1.8700000000000001e-002 | M243: 116.2 | N243: 16.14 | O243: 0.26000000000000001 | P243: 107.5 | Q243: 已到 | R243: 5年47天 | S243: 3年47天 | T243: 5.5 | U243: 8.8 | V243: 1.2e-002 | W243: 7.8e-002 | X243: 8.3000000000000004e-002 | Y243: 71 | Z243: 2.19 | AA243: -2.9900000000000003e-002 | AB243: -3.5200000000000002e-002 | AC243: -7.8399999999999997e-002 | AD243: -8.0299999999999996e-002 | AE243: 90.57 | AF243: 94.33 | AG243: 0.64 | AH243: AA | AI243: 4.24e-002 | AJ243: =H243+100*O243 -> 161.40000000000001 | AK243: 163.3 | AL243: 264 | AM243: 69 | AN243: 252 | AO243: 1.8000000000000002e-002 | AP243: 4 | AQ243: 长海转债
A244: 131 | B244: 110075 | C244: 南航转债 | D244: 600029 | E244: 南方航空 | F244: 交通运输 | G244: 航空运输 | H244: 127.6 | I244: 2.0999999999999999e-003 | J244: 3.4999999999999996e-003 | K244: 6.44 | L244: 9.3999999999999986e-003 | M244: 109.8 | N244: 6.24 | O244: 0.23600000000000002 | P244: 103.21 | Q244: 已到 | R244: 4.94年 | S244: 2.94年 | T244: 59 | U244: 40 | V244: 5.0000000000000001e-003 | W244: 5.4000000000000006e-002 | X244: 5.5999999999999994e-002 | Y244: 1091. | Z244: 1.48 | AA244: -3.0299999999999997e-002 | AB244: -3.3799999999999997e-002 | AC244: -6.9699999999999998e-002 | AD244: -7.0800000000000002e-002 | AE244: 92.08 | AF244: 93.36 | AG244: 0.6 | AH244: AAA | AI244: 3.3799999999999997e-002 | AJ244: =H244+100*O244 -> 151.19999999999999 | AK244: 152 | AL244: 193 | AM244: 58.6 | AN244: 190 | AO244: 2.e-002 | AP244: 8 | AQ244: 南航转债
A245: 311 | B245: 128053 | C245: 尚荣转债! | D245: 2551 | E245: 尚荣医疗 | F245: 医药 | G245: 医疗器械 | H245: 126.708 | I245: 4.7999999999999996e-003 | J245: -6.9999999999999993e-003 | K245: 4.61 | L245: -4.3e-003 | M245: 114.3 | N245: 4.88 | O245: 0.34100000000000003 | P245: 94.47 | Q245: 已到 | R245: 3.27年 | S245: 1.27年 | T245: 1.91 | U245: 67 | V245: 0.27699999999999997 | W245: 4.9000000000000002e-002 | X245: 4.5999999999999999e-002 | Y245: 39 | Z245: 1.23 | AA245: -3.1600000000000003e-002 | AB245: -3.9100000000000003e-002 | AC245: -0.124 | AD245: -0.127 | AE245: 97.1 | AF245: 100.55 | AG245: 0.52 | AH245: AA | AI245: 4.0800000000000003e-002 | AJ245: =H245+100*O245 -> 160.80799999999999 | AK245: 158.9 | AL245: 239 | AM245: 58.4 | AN245: 188 | AO245: -3.6000000000000004e-002 | AP245: 23 | AQ245: 尚荣转债!
A246: 1 | B246: 127046 | C246: 百润转债 | D246: 2568 | E246: 百润股份 | F246: 食品饮料 | G246: 葡萄酒洋 | H246: 138.67 | I246: -1.3000000000000001e-002 | J246: 1.38e-002 | K246: 68.45 | L246: 1.1999999999999999e-003 | M246: 115.1 | N246: 66.89 | O246: 0.35499999999999998 | P246: 102.33 | Q246: 5月7天 | R246: 5.90年 | S246: 3.90年 | T246: 11.3 | U246: 239 | V246: 0.151 | W246: 2.2000000000000002e-002 | X246: 2.2000000000000002e-002 | Y246: 513 | Z246: 14.61 | AA246: -3.1600000000000003e-002 | AB246: -3.5900000000000001e-002 | AC246: -6.9699999999999998e-002 | AD246: -7.1199999999999999e-002 | AE246: 87.64 | AF246: 90.49 | AG246: 0.63 | AH246: AA | AI246: 4.24e-002 | AJ246: =H246+100*O246 -> 174.16999999999999 | AK246: 175 | AL246: 300 | AM246: 84.5 | AN246: 298 | AO246: 4.9000000000000002e-002 | AP246: 2 | AQ246: 百润转债
A247: 348 | B247: 128033 | C247: 迪龙转债! | D247: 2658 | E247: 雪迪龙 | F247: 城市公用 | G247: 三废处理 | H247: 116.5 | I247: -5.6000000000000008e-003 | J247: -2.0000000000000001e-004 | K247: 7.57 | L247: -1.8200000000000001e-002 | M247: 108.8 | N247: 8.56 | O247: 0.317 | P247: 88.43 | Q247: 已到 | R247: 2年51天 | S247: 51天 | T247: 2.98 | U247: 16 | V247: 4.8000000000000001e-002 | W247: 6.2e-002 | X247: 5.5e-002 | Y247: 48 | Z247: 1.95 | AA247: -3.2000000000000001e-002 | AB247: -3.9300000000000002e-002 | AC247: -0.45299999999999996 | AD247: -0.46200000000000002 | AE247: 100.36 | AF247: 100.31 | AG247: 0.32 | AH247: AA | AI247: 3.9399999999999998e-002 | AJ247: =H247+100*O247 -> 148.19999999999999 | AK247: 144.6 | AL247: 125 | AM247: 44.2 | AN247: 85 | AO247: -0.11800000000000001 | AP247: 35 | AQ247: 迪龙转债!
A248: 70 | B248: 123100 | C248: 朗科转债 | D248: 300543 | E248: 朗科智能 | F248: 电子 | G248: 电子产品 | H248: 139.1 | I248: 3.7000000000000002e-003 | J248: -2.12e-002 | K248: 14.45 | L248: -2.23e-002 | M248: 117.5 | N248: 11.61 | O248: 0.11800000000000001 | P248: 124.46 | Q248: 已到 | R248: 5.26年 | S248: 3.26年 | T248: 3.8 | U248: 76 | V248: 0.14499999999999999 | W248: 9.8000000000000004e-002 | X248: 0.122 | Y248: 39 | Z248: 4.09 | AA248: -3.2199999999999999e-002 | AB248: -3.7699999999999997e-002 | AC248: -8.2500000000000004e-002 | AD248: -8.4399999999999989e-002 | AE248: 84.31 | AF248: 85.64 | AG248: 0.79 | AH248: AA- | AI248: 6.3399999999999998e-002 | AJ248: =H248+100*O248 -> 150.90000000000001 | AK248: 153.7 | AL248: 206 | AM248: 68.1 | AN248: 249 | AO248: 7.9000000000000001e-002 | AP248: 10 | AQ248: 朗科转债
A249: 300 | B249: 110056 | C249: 亨通转债! | D249: 600487 | E249: 亨通光电 | F249: 通信互联 | G249: 通信设备 | H249: 127.79 | I249: -1.09e-002 | J249: -6.7000000000000002e-003 | K249: 15.77 | L249: -3.1300000000000001e-002 | M249: 114.3 | N249: 14.95 | O249: 0.21100000000000002 | P249: 105.48 | Q249: 已到 | R249: 3.36年 | S249: 1.36年 | T249: 17.1 | U249: 89 | V249: 4.0000000000000001e-002 | W249: 4.5999999999999999e-002 | X249: 4.8000000000000001e-002 | Y249: 373 | Z249: 1.81 | AA249: -3.3300000000000003e-002 | AB249: -4.0500000000000001e-002 | AC249: -0.12 | AD249: -0.122 | AE249: 97.46 | AF249: 101.8 | AG249: 0.56 | AH249: AA+ | AI249: 3.5799999999999998e-002 | AJ249: =H249+100*O249 -> 148.89000000000001 | AK249: 150.1 | AL249: 179 | AM249: 48.3 | AN249: 115 | AO249: 6.5000000000000002e-002 | AP249: 26 | AQ249: 亨通转债!
A250: 94 | B250: 123085 | C250: 万顺转2!! | D250: 300057 | E250: 万顺新材 | F250: 有色金属 | G250: 铝金属 | H250: 135.85 | I250: -2.9300000000000003e-002 | J250: -4.7999999999999996e-003 | K250: 7.82 | L250: -4.1700000000000001e-002 | M250: 113.3 | N250: 6.2 | O250: 7.6999999999999999e-002 | P250: 126.13 | Q250: 已到 | R250: 5年35天 | S250: 3年35天 | T250: 8.65 | U250: 21 | V250: 1.7000000000000001e-002 | W250: 0.16200000000000001 | X250: 0.20499999999999999 | Y250: 53 | Z250: 1.48 | AA250: -3.5699999999999996e-002 | AB250: -4.0099999999999997e-002 | AC250: -7.9899999999999999e-002 | AD250: -8.1799999999999998e-002 | AE250: 85.14 | AF250: 83.43 | AG250: 0.82 | AH250: AA- | AI250: 6.3399999999999998e-002 | AJ250: =H250+100*O250 -> 143.54999999999998 | AK250: 145.6 | AL250: 137 | AM250: 60.4 | AN250: 203 | AO250: 5.4000000000000006e-002 | AP250: 22 | AQ250: 万顺转2!!
A251: 359 | B251: 110038 | C251: 济川转债! | D251: 600566 | E251: 济川药业 | F251: 医药 | G251: 中药 | H251: 111.51 | I251: 1.e-004 | J251: -5.0000000000000001e-004 | K251: 18.16 | L251: -1.1399999999999999e-002 | M251: 107.5 | N251: 23.4 | O251: 0.43700000000000006 | P251: 77.61 | Q251: 已到 | R251: 1年7天 | S251: 回售内 | T251: 6.28 | U251: 4.3 | V251: 6.0000000000000001e-003 | W251: 3.9e-002 | X251: 2.9999999999999999e-002 | Y251: 161 | Z251: 1.88 | AA251: -3.5799999999999998e-002 | AB251: -4.9000000000000002e-002 | AC251: 回售内 | AD251: 回售内 | AE251: 100.25 | AF251: 103.4 | AG251: 0.04 | AH251: AA | AI251: 3.9399999999999998e-002 | AJ251: =H251+100*O251 -> 155.21000000000001 | AK251: 145.4 | AL251: 136 | AM251: 42 | AN251: 66 | AO251: 7.2999999999999995e-002 | AP251: 22 | AQ251: 济川转债!
A252: 209 | B252: 113576 | C252: 起步转债!! | D252: 603557 | E252: ST起步 | F252: 服装纺织 | G252: 鞋服行业 | H252: 142.58 | I252: 3.32e-002 | J252: -3.2500000000000001e-002 | K252: 5.27 | L252: 5.6999999999999993e-003 | M252: 121.3 | N252: 10.55 | O252: 1.8500000000000001 | P252: 49.95 | Q252: 已到 | R252: 4.42年 | S252: 2.42年 | T252: 2.66 | U252: 2639. | V252: 6.7699999999999996 | W252: 0.10199999999999999 | X252: 5.0999999999999997e-002 | Y252: 26 | Z252: 1.74 | AA252: -3.6699999999999997e-002 | AB252: -4.4400000000000002e-002 | AC252: -0.114 | AD252: -0.11699999999999999 | AE252: 81.14 | AF252: 79.6 | AG252: 0.11 | AH252: BBB+ | AI252: 0.10279999999999999 | AJ252: =H252+100*O252 -> 327.58000000000004 | AK252: 235.2 | AL252: 342 | AM252: 154.1 | AN252: 345 | AO252: 7.0999999999999994e-002 | AP252: 39 | AQ252: 起步转债!!
A253: 191 | B253: 123053 | C253: 宝通转债! | D253: 300031 | E253: 宝通科技 | F253: 通信互联 | G253: 互联网 | H253: 142.962 | I253: 1.03e-002 | J253: 1.03e-002 | K253: 23.83 | L253: 2.9399999999999999e-002 | M253: 120.8 | N253: 20.5 | O253: 0.23000000000000001 | P253: 116.24 | Q253: 已到 | R253: 4.58年 | S253: 2.58年 | T253: 5 | U253: 7340. | V253: 9.8699999999999992 | W253: 5.2999999999999999e-002 | X253: 6.0999999999999999e-002 | Y253: 95 | Z253: 2.99 | AA253: -3.6900000000000002e-002 | AB253: -4.4199999999999996e-002 | AC253: -0.11 | AD253: -0.11199999999999999 | AE253: 88.14 | AF253: 92.38 | AG253: 0.7 | AH253: AA- | AI253: 6.1799999999999994e-002 | AJ253: =H253+100*O253 -> 165.96199999999999 | AK253: 169.7 | AL253: 287 | AM253: 77.3 | AN253: 286 | AO253: 0.183 | AP253: 12 | AQ253: 宝通转债!
A254: 34 | B254: 127036 | C254: 三花转债 | D254: 2050 | E254: 三花智控 | F254: 机械装备 | G254: 通用设备 | H254: 141.411 | I254: 1.15e-002 | J254: 3.9000000000000003e-003 | K254: 24.63 | L254: 2.2000000000000002e-002 | M254: 114.5 | N254: 21.55 | O254: 0.23699999999999999 | P254: 114.29 | Q254: 31天 | R254: 5.57年 | S254: 3.57年 | T254: 30 | U254: 44 | V254: 1.e-002 | W254: 3.4000000000000002e-002 | X254: 3.9e-002 | Y254: 885 | Z254: 8.56 | AA254: -3.7699999999999997e-002 | AB254: -4.2099999999999999e-002 | AC254: -8.1799999999999998e-002 | AD254: -8.3100000000000007e-002 | AE254: 89.88 | AF254: 93.62 | AG254: 0.7 | AH254: AA+ | AI254: 3.7400000000000003e-002 | AJ254: =H254+100*O254 -> 165.11099999999999 | AK254: 168.5 | AL254: 281 | AM254: 74.9 | AN254: 277 | AO254: 3.2000000000000001e-002 | AP254: 6 | AQ254: 三花转债
A255: 368 | B255: 128013 | C255: 洪涛转债! | D255: 2325 | E255: 洪涛股份 | F255: 建筑 | G255: 装饰工程 | H255: 111.116 | I255: 1.e-003 | J255: -1.e-003 | K255: 2.39 | L255: 0. | M255: 108 | N255: 2.32 | O255: 7.9000000000000001e-002 | P255: 103.02 | Q255: 已到 | R255: 0.73年 | S255: 回售内 | T255: 11.4 | U255: 31 | V255: 2.4e-002 | W255: 0.375 | X255: 0.38700000000000001 | Y255: 30 | Z255: 1.08 | AA255: -3.8399999999999997e-002 | AB255: -5.7999999999999996e-002 | AC255: 回售内 | AD255: 回售内 | AE255: 100.33 | AF255: 101.58 | AG255: 0.47 | AH255: A- | AI255: 8.8000000000000009e-002 | AJ255: =H255+100*O255 -> 119.01600000000001 | AK255: 119.2 | AL255: 2 | AM255: 17.6 | AN255: 1 | AO255: -4.0999999999999995e-002 | AP255: 100 | AQ255: 洪涛转债!
A256: 45 | B256: 113047 | C256: 旗滨转债 | D256: 601636 | E256: 旗滨集团 | F256: 建筑 | G256: 玻璃 | H256: 140.93 | I256: -3.0499999999999999e-002 | J256: -1.52e-002 | K256: 14.54 | L256: -6.6799999999999998e-002 | M256: 114 | N256: 12.8 | O256: 0.24100000000000002 | P256: 113.59 | Q256: 已到 | R256: 5.42年 | S256: 3.42年 | T256: 15 | U256: 96 | V256: 4.4999999999999998e-002 | W256: 3.7999999999999999e-002 | X256: 4.4000000000000004e-002 | Y256: 391 | Z256: 3.18 | AA256: -3.8800000000000001e-002 | AB256: -4.3200000000000002e-002 | AC256: -8.5299999999999987e-002 | AD256: -8.6500000000000007e-002 | AE256: 89.92 | AF256: 93.68 | AG256: 0.69 | AH256: AA+ | AI256: 3.7400000000000003e-002 | AJ256: =H256+100*O256 -> 165.03 | AK256: 168.3 | AL256: 278 | AM256: 74.6 | AN256: 276 | AO256: -0.14400000000000002 | AP256: 7 | AQ256: 旗滨转债
A257: 8 | B257: 127045 | C257: 牧原转债 | D257: 2714 | E257: 牧原股份 | F257: 农业 | G257: 畜牧业 | H257: 139.39 | I257: -5.3e-003 | J257: -5.6999999999999993e-003 | K257: 58.21 | L257: -1.46e-002 | M257: 111.1 | N257: 47.91 | O257: 0.14699999999999999 | P257: 121.5 | Q257: 3月17天 | R257: 5.78年 | S257: 3.78年 | T257: 95.5 | U257: 125 | V257: 9.0000000000000011e-003 | W257: 3.1e-002 | X257: 3.7999999999999999e-002 | Y257: 3064. | Z257: 5.81 | AA257: -3.9e-002 | AB257: -4.2300000000000004e-002 | AC257: -7.46e-002 | AD257: -7.5800000000000006e-002 | AE257: 89.07 | AF257: 90.15 | AG257: 0.76 | AH257: AA+ | AI257: 3.7400000000000003e-002 | AJ257: =H257+100*O257 -> 154.08999999999997 | AK257: 157.3 | AL257: 226 | AM257: 67.1 | AN257: 245 | AO257: 3.3000000000000002e-002 | AP257: 8 | AQ257: 牧原转债
A258: 9 | B258: 118002 | C258: 天合转债 | D258: 688599 | E258: 天合光能 | F258: 能源电力 | G258: 太阳能 | H258: 151.15 | I258: -1.2e-002 | J258: 1.09e-002 | K258: 69.6 | L258: -1.4000000000000002e-003 | M258: 120.1 | N258: 50.51 | O258: 9.6999999999999989e-002 | P258: 137.79 | Q258: 3月17天 | R258: 5.77年 | S258: 3.77年 | T258: 52.5 | U258: 427 | V258: 5.4000000000000006e-002 | W258: 3.6000000000000004e-002 | X258: 5.0000000000000003e-002 | Y258: 1439. | Z258: 8.97 | AA258: -3.9699999999999999e-002 | AB258: -4.53e-002 | AC258: -9.2200000000000004e-002 | AD258: -9.3599999999999989e-002 | AE258: 88.11 | AF258: 94.91 | AG258: 0.8 | AH258: AA | AI258: 4.24e-002 | AJ258: =H258+100*O258 -> 160.84999999999999 | AK258: 164.5 | AL258: 266 | AM258: 69.6 | AN258: 256 | AO258: 8.199999999999999e-002 | AP258: 6 | AQ258: 天合转债
A259: 101 | B259: 128140 | C259: 润建转债! | D259: 2929 | E259: 润建股份 | F259: 通信互联 | G259: 通信设备 | H259: 141.149 | I259: -3.2000000000000002e-003 | J259: -1.5e-003 | K259: 33.2 | L259: -6.0000000000000001e-003 | M259: 115.2 | N259: 26.4 | O259: 0.122 | P259: 125.76 | Q259: 已到 | R259: 5年31天 | S259: 3年31天 | T259: 10.9 | U259: 34 | V259: 2.2000000000000002e-002 | W259: 0.14899999999999999 | X259: 0.187 | Y259: 73 | Z259: 2.16 | AA259: -3.9900000000000005e-002 | AB259: -4.4900000000000002e-002 | AC259: -9.1199999999999989e-002 | AD259: -9.3100000000000002e-002 | AE259: 90.73 | AF259: 93.69 | AG259: 0.77 | AH259: AA | AI259: 4.24e-002 | AJ259: =H259+100*O259 -> 153.34899999999999 | AK259: 156.5 | AL259: 223 | AM259: 62.9 | AN259: 217 | AO259: 3.1e-002 | AP259: 11 | AQ259: 润建转债!
A260: 343 | B260: 113505 | C260: 杭电转债! | D260: 603618 | E260: 杭电股份 | F260: 能源电力 | G260: 电力设备 | H260: 122.48 | I260: -1.89e-002 | J260: 2.4700000000000003e-002 | K260: 7.94 | L260: 8.8999999999999999e-003 | M260: 111.3 | N260: 7.08 | O260: 9.1999999999999998e-002 | P260: 112.15 | Q260: 已到 | R260: 2.33年 | S260: 0.33年 | T260: 7.5 | U260: 167 | V260: 0.18100000000000002 | W260: 0.13699999999999998 | X260: 0.153 | Y260: 55 | Z260: 2.08 | AA260: -4.0999999999999995e-002 | AB260: -4.9400000000000006e-002 | AC260: -0.36099999999999999 | AD260: -0.36700000000000005 | AE260: 99.88 | AF260: 101.9 | AG260: 0.66 | AH260: AA | AI260: 3.9399999999999998e-002 | AJ260: =H260+100*O260 -> 131.68000000000001 | AK260: 132.8 | AL260: 28 | AM260: 30.9 | AN260: 13 | AO260: 9.5000000000000001e-002 | AP260: 45 | AQ260: 杭电转债!
A261: 107 | B261: 123078 | C261: 飞凯转债!! | D261: 300398 | E261: 飞凯材料 | F261: 化工 | G261: 化工 | H261: 142 | I261: 2.29e-002 | J261: -7.3000000000000001e-003 | K261: 19.15 | L261: 2.0799999999999999e-002 | M261: 115.2 | N261: 15.56 | O261: 0.154 | P261: 123.07 | Q261: 已到 | R261: 5年21天 | S261: 3年21天 | T261: 8.15 | U261: 52 | V261: 4.4999999999999998e-002 | W261: 8.199999999999999e-002 | X261: 0.10099999999999999 | Y261: 99 | Z261: 3.42 | AA261: -4.1299999999999996e-002 | AB261: -4.6300000000000001e-002 | AC261: -9.3699999999999992e-002 | AD261: -9.5500000000000002e-002 | AE261: 90.84 | AF261: 93.8 | AG261: 0.75 | AH261: AA | AI261: 4.24e-002 | AJ261: =H261+100*O261 -> 157.40000000000001 | AK261: 160.9 | AL261: 254 | AM261: 67.1 | AN261: 244 | AO261: 0.111 | AP261: 8 | AQ261: 飞凯转债!!
A262: 95 | B262: 123086 | C262: 海兰转债!! | D262: 300065 | E262: 海兰信 | F262: 电子 | G262: 电子产品 | H262: 152.699 | I262: 1.3300000000000001e-002 | J262: 1.4800000000000001e-002 | K262: 10.95 | L262: 3.3000000000000002e-002 | M262: 123.5 | N262: 7.27 | O262: 1.3999999999999999e-002 | P262: 150.62 | Q262: 已到 | R262: 5年35天 | S262: 3年35天 | T262: 6.07 | U262: 659 | V262: 0.69999999999999996 | W262: 9.0999999999999998e-002 | X262: 0.13600000000000001 | Y262: 67 | Z262: 4.1 | AA262: -4.1500000000000002e-002 | AB262: -4.8799999999999996e-002 | AC262: -0.11 | AD262: -0.11199999999999999 | AE262: 85.17 | AF262: 90.9 | AG262: 0.85 | AH262: AA- | AI262: 6.3399999999999998e-002 | AJ262: =H262+100*O262 -> 154.09900000000002 | AK262: 154.8 | AL262: 210 | AM262: 63.9 | AN262: 226 | AO262: 9.6999999999999989e-002 | AP262: 19 | AQ262: 海兰转债!!
A263: 282 | B263: 113536 | C263: 三星转债 | D263: 603578 | E263: 三星新材 | F263: 家电 | G263: 零部件制 | H263: 132.79 | I263: -1.9e-003 | J263: 8.0000000000000002e-003 | K263: 17.1 | L263: 8.3000000000000001e-003 | M263: 114.3 | N263: 13.76 | O263: 6.9000000000000006e-002 | P263: 124.27 | Q263: 已到 | R263: 3.56年 | S263: 1.56年 | T263: 1.49 | U263: 21 | V263: 0.10800000000000001 | W263: 6.8000000000000005e-002 | X263: 8.4000000000000005e-002 | Y263: 22 | Z263: 2.83 | AA263: -4.1900000000000007e-002 | AB263: -4.87e-002 | AC263: -0.11900000000000001 | AD263: -0.121 | AE263: 95.98 | AF263: 99.4 | AG263: 0.74 | AH263: AA | AI263: 4.0800000000000003e-002 | AJ263: =H263+100*O263 -> 139.69 | AK263: 141.3 | AL263: 93 | AM263: 41.9 | AN263: 64 | AO263: 2.7999999999999997e-002 | AP263: 36 | AQ263: 三星转债
A264: 198 | B264: 113579 | C264: 健友转债! | D264: 603707 | E264: 健友股份 | F264: 医药 | G264: 原料药 | H264: 137.34 | I264: 6.1999999999999998e-003 | J264: 7.3000000000000001e-003 | K264: 39.13 | L264: 1.8000000000000002e-002 | M264: 113.9 | N264: 32.2 | O264: 0.13 | P264: 121.52 | Q264: 已到 | R264: 4.46年 | S264: 2.46年 | T264: 5.03 | U264: 23 | V264: 3.3000000000000002e-002 | W264: 1.1000000000000001e-002 | X264: 1.3000000000000001e-002 | Y264: 476 | Z264: 11.09 | AA264: -4.1900000000000007e-002 | AB264: -4.7100000000000003e-002 | AC264: -0.10199999999999999 | AD264: -0.10400000000000001 | AE264: 93.18 | AF264: 95.65 | AG264: 0.75 | AH264: AA | AI264: 4.0800000000000003e-002 | AJ264: =H264+100*O264 -> 150.34 | AK264: 153.2 | AL264: 201 | AM264: 57.5 | AN264: 180 | AO264: 7.6999999999999999e-002 | AP264: 8 | AQ264: 健友转债!
A265: 208 | B265: 123048 | C265: 应急转债! | D265: 300527 | E265: 中船应急 | F265: 机械装备 | G265: 专用设备 | H265: 136 | I265: -2.35e-002 | J265: 1.01e-002 | K265: 10.33 | L265: -1.9e-002 | M265: 112.8 | N265: 8.88 | O265: 0.16899999999999998 | P265: 116.33 | Q265: 已到 | R265: 4.42年 | S265: 2.42年 | T265: 3.79 | U265: 1301. | V265: 2.4700000000000002 | W265: 3.7999999999999999e-002 | X265: 4.4000000000000004e-002 | Y265: 99 | Z265: 3.78 | AA265: -4.2199999999999994e-002 | AB265: -4.7e-002 | AC265: -0.10099999999999999 | AD265: -0.10300000000000001 | AE265: 94.38 | AF265: 96.85 | AG265: 0.7 | AH265: AA+ | AI265: 3.5799999999999998e-002 | AJ265: =H265+100*O265 -> 152.90000000000001 | AK265: 155.7 | AL265: 216 | AM265: 58.8 | AN265: 193 | AO265: 0.16200000000000001 | AP265: 16 | AQ265: 应急转债!
A266: 90 | B266: 113614 | C266: 健20转债! | D266: 603707 | E266: 健友股份 | F266: 医药 | G266: 原料药 | H266: 141.83 | I266: 3.7000000000000002e-003 | J266: 1.1299999999999999e-002 | K266: 39.13 | L266: 1.8000000000000002e-002 | M266: 114.2 | N266: 29.12 | O266: 5.5e-002 | P266: 134.38 | Q266: 已到 | R266: 5年41天 | S266: 3年41天 | T266: 7.8 | U266: 50 | V266: 4.4999999999999998e-002 | W266: 1.6e-002 | X266: 2.2000000000000002e-002 | Y266: 476 | Z266: 11.09 | AA266: -4.2300000000000004e-002 | AB266: -4.6900000000000004e-002 | AC266: -9.1799999999999993e-002 | AD266: -9.3699999999999992e-002 | AE266: 90.63 | AF266: 92.77 | AG266: 0.83 | AH266: AA | AI266: 4.24e-002 | AJ266: =H266+100*O266 -> 147.33000000000001 | AK266: 149.3 | AL266: 174 | AM266: 56.5 | AN266: 172 | AO266: 7.6999999999999999e-002 | AP266: 4 | AQ266: 健20转债!
A267: 33 | B267: 127037 | C267: 银轮转债 | D267: 2126 | E267: 银轮股份 | F267: 汽车 | G267: 零部件制 | H267: 146.666 | I267: 3.2899999999999999e-002 | J267: 1.47e-002 | K267: 12.78 | L267: 6.5000000000000002e-002 | M267: 115.1 | N267: 10.77 | O267: 0.23600000000000002 | P267: 118.66 | Q267: 35天 | R267: 5.58年 | S267: 3.58年 | T267: 7 | U267: 145 | V267: 0.14000000000000001 | W267: 6.9000000000000006e-002 | X267: 8.199999999999999e-002 | Y267: 101 | Z267: 2.4 | AA267: -4.3200000000000002e-002 | AB267: -4.7699999999999992e-002 | AC267: -8.9099999999999999e-002 | AD267: -9.0700000000000003e-002 | AE267: 88.78 | AF267: 91.67 | AG267: 0.73 | AH267: AA | AI267: 4.24e-002 | AJ267: =H267+100*O267 -> 170.26599999999999 | AK267: 174.7 | AL267: 298 | AM267: 83 | AN267: 295 | AO267: 0.183 | AP267: 4 | AQ267: 银轮转债
A268: 339 | B268: 128036 | C268: 金农转债!! | D268: 2548 | E268: 金新农 | F268: 农业 | G268: 畜牧业 | H268: 121 | I268: -5.7999999999999996e-003 | J268: 8.0000000000000004e-004 | K268: 5.79 | L268: -1.8600000000000002e-002 | M268: 109.3 | N268: 6.93 | O268: 0.44799999999999995 | P268: 83.55 | Q268: 已到 | R268: 2.34年 | S268: 0.34年 | T268: 1.46 | U268: 31 | V268: 0.17600000000000002 | W268: 3.6000000000000004e-002 | X268: 2.9999999999999999e-002 | Y268: 40 | Z268: 1.71 | AA268: -4.3299999999999998e-002 | AB268: -5.0300000000000004e-002 | AC268: -0.33399999999999996 | AD268: -0.34000000000000002 | AE268: 98.85 | AF268: 95.56 | AG268: 0.27 | AH268: AA- | AI268: 6.0400000000000002e-002 | AJ268: =H268+100*O268 -> 165.80000000000001 | AK268: 158.5 | AL268: 234 | AM268: 59.6 | AN268: 198 | AO268: 1.2e-002 | AP268: 16 | AQ268: 金农转债!!
A269: 287 | B269: 113026 | C269: 核能转债! | D269: 601985 | E269: 中国核电 | F269: 能源电力 | G269: 核电 | H269: 127.03 | I269: -2.2099999999999998e-002 | J269: -3.0600000000000002e-002 | K269: 6.66 | L269: -7.1099999999999997e-002 | M269: 109.3 | N269: 5.73 | O269: 9.3000000000000013e-002 | P269: 116.23 | Q269: 已到 | R269: 3.44年 | S269: 1.44年 | T269: 76 | U269: 302 | V269: 3.1e-002 | W269: 6.5000000000000002e-002 | X269: 7.5999999999999998e-002 | Y269: 1167. | Z269: 1.81 | AA269: -4.36e-002 | AB269: -4.8300000000000003e-002 | AC269: -0.11 | AD269: -0.113 | AE269: 97.5 | AF269: 97.73 | AG269: 0.74 | AH269: AAA | AI269: 3.3799999999999997e-002 | AJ269: =H269+100*O269 -> 136.33000000000001 | AK269: 137.8 | AL269: 56 | AM269: 40.1 | AN269: 52 | AO269: -1.3999999999999999e-002 | AP269: 41 | AQ269: 核能转债!
A270: 346 | B270: 110043 | C270: 无锡转债! | D270: 600908 | E270: 无锡银行 | F270: 金融 | G270: 银行行业 | H270: 119.85 | I270: -2.e-003 | J270: -6.6e-003 | K270: 5.63 | L270: -1.7500000000000002e-002 | M270: 108.3 | N270: 5.61 | O270: 0.19399999999999998 | P270: 100.36 | Q270: 已到 | R270: 2.23年 | S270: 无权 | T270: 29.2 | U270: 21 | V270: 6.0000000000000001e-003 | W270: 0.27899999999999997 | X270: 0.28000000000000003 | Y270: 105 | Z270: 0.81 | AA270: -4.4900000000000002e-002 | AB270: -5.1500000000000004e-002 | AC270: 无权 | AD270: 无权 | AE270: 无权 | AF270: 100.53 | AG270: 0.5 | AH270: AA+ | AI270: 3.44e-002 | AJ270: =H270+100*O270 -> 139.25 | AK270: 139.3 | AL270: 74 | AM270: 38.8 | AN270: 45 | AO270: -6.4000000000000001e-002 | AP270: 23 | AQ270: 无锡转债!
A271: 227 | B271: 123043 | C271: 正元转债! | D271: 300645 | E271: 正元智慧 | F271: 计算机及 | G271: 软件开发 | H271: 147.199 | I271: 5.5000000000000005e-003 | J271: 1.e-004 | K271: 19.46 | L271: 7.1999999999999998e-003 | M271: 120.9 | N271: 15.38 | O271: 0.16300000000000001 | P271: 126.53 | Q271: 已到 | R271: 4.33年 | S271: 2.33年 | T271: 1.66 | U271: 165 | V271: 0.67500000000000004 | W271: 6.7000000000000004e-002 | X271: 8.4000000000000005e-002 | Y271: 25 | Z271: 3.75 | AA271: -4.5499999999999999e-002 | AB271: -5.3099999999999994e-002 | AC271: -0.13 | AD271: -0.13200000000000001 | AE271: 87.53 | AF271: 89.9 | AG271: 0.77 | AH271: A+ | AI271: 7.2800000000000004e-002 | AJ271: =H271+100*O271 -> 163.49900000000002 | AK271: 167.9 | AL271: 276 | AM271: 78 | AN271: 289 | AO271: -3.3000000000000002e-002 | AP271: 17 | AQ271: 正元转债!
A272: 17 | B272: 118001 | C272: 金博转债 | D272: 688598 | E272: 金博股份 | F272: 能源电力 | G272: 太阳能 | H272: 158.03 | I272: -2.0799999999999999e-002 | J272: -2.12e-002 | K272: 343.73 | L272: -5.2600000000000001e-002 | M272: 121.6 | N272: 271.12 | O272: 0.24600000000000002 | P272: 126.78 | Q272: 2月24天 | R272: 5.71年 | S272: 3.71年 | T272: 6 | U272: 34 | V272: 3.5000000000000003e-002 | W272: 2.2000000000000002e-002 | X272: 2.7999999999999997e-002 | Y272: 276 | Z272: 16.74 | AA272: -4.58e-002 | AB272: -5.1699999999999996e-002 | AC272: -0.10199999999999999 | AD272: -0.10000000000000001 | AE272: 79.47 | AF272: 81.51 | AG272: 0.8 | AH272: A+ | AI272: 7.4400000000000008e-002 | AJ272: =H272+100*O272 -> 182.63 | AK272: 189.3 | AL272: 316 | AM272: 107.8 | AN272: 325 | AO272: -1.9e-002 | AP272: 4 | AQ272: 金博转债
A273: 265 | B273: 128078 | C273: 太极转债! | D273: 2368 | E273: 太极股份 | F273: 计算机及 | G273: 软件开发 | H273: 140 | I273: 7.1999999999999998e-003 | J273: -6.0999999999999995e-003 | K273: 28.13 | L273: 1.1000000000000001e-003 | M273: 116.3 | N273: 22.21 | O273: 0.105 | P273: 126.65 | Q273: 已到 | R273: 3.96年 | S273: 1.96年 | T273: 9.6 | U273: 14 | V273: 1.e-002 | W273: 5.9000000000000004e-002 | X273: 7.4999999999999997e-002 | Y273: 163 | Z273: 4.94 | AA273: -4.6500000000000007e-002 | AB273: -5.33e-002 | AC273: -0.10800000000000001 | AD273: -0.109 | AE273: 94.49 | AF273: 99.56 | AG273: 1 | AH273: AA | AI273: 4.0800000000000003e-002 | AJ273: =H273+100*O273 -> 150.5 | AK273: 153.3 | AL273: 202 | AM273: 53.8 | AN273: 153 | AO273: 1.e-003 | AP273: 10 | AQ273: 太极转债!
A274: 236 | B274: 128094 | C274: 星帅转债! | D274: 2860 | E274: 星帅尔 | F274: 家电 | G274: 零部件制 | H274: 147.1 | I274: -1.9299999999999998e-002 | J274: -3.2000000000000002e-003 | K274: 19.28 | L274: -2.7200000000000002e-002 | M274: 121 | N274: 13.8 | O274: 5.2999999999999999e-002 | P274: 139.71 | Q274: 已到 | R274: 4.19年 | S274: 2.19年 | T274: 2.19 | U274: 113 | V274: 0.34999999999999998 | W274: 5.5999999999999994e-002 | X274: 7.8e-002 | Y274: 39 | Z274: 3.42 | AA274: -4.6500000000000007e-002 | AB274: -5.45e-002 | AC274: -0.10400000000000001 | AD274: -0.105 | AE274: 88.37 | AF274: 90.81 | AG274: 0.83 | AH274: A+ | AI274: 7.2800000000000004e-002 | AJ274: =H274+100*O274 -> 152.40000000000001 | AK274: 154.5 | AL274: 209 | AM274: 63.7 | AN274: 223 | AO274: 6.3e-002 | AP274: 31 | AQ274: 星帅转债!
A275: 342 | B275: 127005 | C275: 长证转债! | D275: 783 | E275: 长江证券 | F275: 金融 | G275: 证券行业 | H275: 120.9 | I275: -8.199999999999999e-003 | J275: 5.4000000000000003e-003 | K275: 7.12 | L275: -5.6000000000000008e-003 | M275: 108.3 | N275: 7.13 | O275: 0.21100000000000002 | P275: 99.86 | Q275: 已到 | R275: 2.35年 | S275: 无权 | T275: 50 | U275: 50 | V275: 8.0000000000000002e-003 | W275: 0.127 | X275: 0.127 | Y275: 394 | Z275: 1.33 | AA275: -4.6699999999999998e-002 | AB275: -5.2900000000000003e-002 | AC275: 无权 | AD275: 无权 | AE275: 无权 | AF275: 100.64 | AG275: 0.5 | AH275: AAA | AI275: 3.2400000000000005e-002 | AJ275: =H275+100*O275 -> 142. | AK275: 141.9 | AL275: 104 | AM275: 41.3 | AN275: 60 | AO275: -3.7000000000000005e-002 | AP275: 13 | AQ275: 长证转债!
A276: 16 | B276: 110081 | C276: 闻泰转债 | D276: 600745 | E276: 闻泰科技 | F276: 电子 | G276: 电子行业 | H276: 147 | I276: 7.8000000000000005e-003 | J276: -9.1000000000000004e-003 | K276: 116.8 | L276: -1.7000000000000001e-003 | M276: 111.9 | N276: 96.67 | O276: 0.217 | P276: 120.82 | Q276: 2月29天 | R276: 5.72年 | S276: 3.72年 | T276: 86 | U276: 278 | V276: 2.2000000000000002e-002 | W276: 5.9000000000000004e-002 | X276: 7.0999999999999994e-002 | Y276: 1454. | Z276: 4.63 | AA276: -4.7e-002 | AB276: -5.0499999999999996e-002 | AC276: -8.8900000000000007e-002 | AD276: -8.9999999999999997e-002 | AE276: 88.81 | AF276: 90.91 | AG276: 0.76 | AH276: AA+ | AI276: 3.7400000000000003e-002 | AJ276: =H276+100*O276 -> 168.69999999999999 | AK276: 173.2 | AL276: 293 | AM276: 82.3 | AN276: 294 | AO276: 0.127 | AP276: 11 | AQ276: 闻泰转债
A277: 345 | B277: 128035 | C277: 大族转债! | D277: 2008 | E277: 大族激光 | F277: 机械装备 | G277: 专用设备 | H277: 119.8 | I277: -1.9e-003 | J277: 1.e-004 | K277: 43.29 | L277: -9.1999999999999998e-003 | M277: 107.4 | N277: 51.9 | O277: 0.436 | P277: 83.41 | Q277: 已到 | R277: 2.25年 | S277: 0.25年 | T277: 23 | U277: 16 | V277: 6.0000000000000001e-003 | W277: 5.0000000000000003e-002 | X277: 4.2000000000000003e-002 | Y277: 462 | Z277: 4.35 | AA277: -4.7899999999999998e-002 | AB277: -5.3699999999999998e-002 | AC277: -0.34100000000000003 | AD277: -0.35600000000000004 | AE277: 102.34 | AF277: 99.63 | AG277: 0.2 | AH277: AA+ | AI277: 3.44e-002 | AJ277: =H277+100*O277 -> 163.40000000000001 | AK277: 156.2 | AL277: 221 | AM277: 53.8 | AN277: 154 | AO277: 6.6000000000000003e-002 | AP277: 18 | AQ277: 大族转债!
A278: 367 | B278: 113011 | C278: 光大转债 | D278: 601818 | E278: 光大银行 | F278: 金融 | G278: 银行行业 | H278: 114.11 | I278: -4.3e-003 | J278: 3.3e-003 | K278: 3.33 | L278: -3.0000000000000001e-003 | M278: 106.8 | N278: 3.55 | O278: 0.21600000000000003 | P278: 93.8 | Q278: 已到 | R278: 1.36年 | S278: 无权 | T278: 242 | U278: 116 | V278: 4.0000000000000001e-003 | W278: 0.13400000000000001 | X278: 0.126 | Y278: 1799. | Z278: 0.49 | AA278: -4.8099999999999997e-002 | AB278: -5.7000000000000002e-002 | AC278: 无权 | AD278: 无权 | AE278: 无权 | AF278: 102.33 | AG278: 0.33 | AH278: AAA | AI278: 3.2400000000000005e-002 | AJ278: =H278+100*O278 -> 135.71000000000001 | AK278: 134.4 | AL278: 35 | AM278: 32.1 | AN278: 19 | AO278: -3.2000000000000001e-002 | AP278: 14 | AQ278: 光大转债
A279: 2 | B279: 113629 | C279: 泉峰转债 | D279: 603982 | E279: 泉峰汽车 | F279: 汽车 | G279: 零部件制 | H279: 160.73 | I279: -2.58e-002 | J279: 1.6299999999999999e-002 | K279: 34.61 | L279: -1.11e-002 | M279: 121 | N279: 23.03 | O279: 7.0000000000000007e-002 | P279: 150.28 | Q279: 4月16天 | R279: 5.86年 | S279: 3.86年 | T279: 6.2 | U279: 668 | V279: 0.65700000000000003 | W279: 8.900000000000001e-002 | X279: 0.13400000000000001 | Y279: 70 | Z279: 4.19 | AA279: -4.8099999999999997e-002 | AB279: -5.3800000000000001e-002 | AC279: -0.10400000000000001 | AD279: -0.10099999999999999 | AE279: 81.35 | AF279: 85.03 | AG279: 0.85 | AH279: AA- | AI279: 6.3399999999999998e-002 | AJ279: =H279+100*O279 -> 167.72999999999999 | AK279: 171.2 | AL279: 289 | AM279: 86.1 | AN279: 301 | AO279: 0.36099999999999999 | AP279: 3 | AQ279: 泉峰转债
A280: 22 | B280: 127040 | C280: 国泰转债 | D280: 2091 | E280: 江苏国泰 | F280: 商业零售 | G280: 商业零售 | H280: 148.5 | I280: -3.2599999999999997e-002 | J280: 1.9e-003 | K280: 12.17 | L280: -3.7200000000000004e-002 | M280: 112.5 | N280: 9.02 | O280: 0.10099999999999999 | P280: 134.92 | Q280: 2月8天 | R280: 5.67年 | S280: 3.67年 | T280: 45.6 | U280: 144 | V280: 2.1000000000000001e-002 | W280: 0.23999999999999999 | X280: 0.32299999999999995 | Y280: 190 | Z280: 1.99 | AA280: -4.8499999999999995e-002 | AB280: -5.21e-002 | AC280: -9.1499999999999998e-002 | AD280: -9.2799999999999994e-002 | AE280: 89.56 | AF280: 91.66 | AG280: 0.83 | AH280: AA+ | AI280: 3.7400000000000003e-002 | AJ280: =H280+100*O280 -> 158.59999999999999 | AK280: 162.1 | AL280: 259 | AM280: 70.4 | AN280: 261 | AO280: -2.6000000000000002e-002 | AP280: 11 | AQ280: 国泰转债
A281: 194 | B281: 128109 | C281: 楚江转债! | D281: 2171 | E281: 楚江新材 | F281: 有色金属 | G281: 铜金属 | H281: 143.8 | I281: -2.6499999999999999e-002 | J281: 6.1999999999999998e-003 | K281: 11.08 | L281: -2.0299999999999999e-002 | M281: 114.9 | N281: 8.63 | O281: 0.12 | P281: 128.39 | Q281: 已到 | R281: 4.58年 | S281: 2.58年 | T281: 18.2 | U281: 157 | V281: 5.9000000000000004e-002 | W281: 0.12300000000000001 | X281: 0.158 | Y281: 148 | Z281: 2.52 | AA281: -4.87e-002 | AB281: -5.4100000000000002e-002 | AC281: -0.113 | AD281: -0.115 | AE281: 92.76 | AF281: 96.05 | AG281: 1 | AH281: AA | AI281: 4.0800000000000003e-002 | AJ281: =H281+100*O281 -> 155.80000000000001 | AK281: 159.2 | AL281: 241 | AM281: 63.2 | AN281: 220 | AO281: 7.2999999999999995e-002 | AP281: 6 | AQ281: 楚江转债!
A282: 162 | B282: 128122 | C282: 兴森转债! | D282: 2436 | E282: 兴森科技 | F282: 电子 | G282: 元器件制 | H282: 135.78 | I282: 1.5900000000000001e-002 | J282: -4.3e-003 | K282: 13.78 | L282: 2.3e-002 | M282: 113 | N282: 14.1 | O282: 0.38900000000000001 | P282: 97.73 | Q282: 已到 | R282: 3.71年 | S282: 2.71年 | T282: 2.69 | U282: 89 | V282: 0.24100000000000002 | W282: 1.3000000000000001e-002 | X282: 1.3000000000000001e-002 | Y282: 205 | Z282: 5.72 | AA282: -4.8799999999999996e-002 | AB282: -5.4699999999999999e-002 | AC282: -9.11e-002 | AD282: -9.3100000000000002e-002 | AE282: 92.19 | AF282: 97.6 | AG282: 0.51 | AH282: AA | AI282: 4.0800000000000003e-002 | AJ282: =H282+100*O282 -> 174.68000000000001 | AK282: 173.8 | AL282: 295 | AM282: 76.2 | AN282: 282 | AO282: 9.8000000000000004e-002 | AP282: 12 | AQ282: 兴森转债!
A283: 40 | B283: 113048 | C283: 晶科转债! | D283: 601778 | E283: 晶科科技 | F283: 能源电力 | G283: 太阳能 | H283: 153.62 | I283: -5.9200000000000003e-002 | J283: -2.6499999999999999e-002 | K283: 8.04 | L283: -9.9700000000000011e-002 | M283: 117.1 | N283: 5.46 | O283: 4.2999999999999997e-002 | P283: 147.25 | Q283: 已到 | R283: 5.46年 | S283: 3.46年 | T283: 23.7 | U283: 802 | V283: 0.21600000000000003 | W283: 0.107 | X283: 0.157 | Y283: 222 | Z283: 1.96 | AA283: -4.9299999999999997e-002 | AB283: -5.4400000000000004e-002 | AC283: -0.10099999999999999 | AD283: -0.10199999999999999 | AE283: 89.24 | AF283: 93.74 | AG283: 0.86 | AH283: AA | AI283: 4.24e-002 | AJ283: =H283+100*O283 -> 157.92000000000002 | AK283: 160 | AL283: 249 | AM283: 66.2 | AN283: 238 | AO283: -6.5000000000000002e-002 | AP283: 15 | AQ283: 晶科转债!
A284: 103 | B284: 123081 | C284: 精研转债! | D284: 300709 | E284: 精研科技 | F284: 电子 | G284: 电子产品 | H284: 157.16 | I284: 5.5e-002 | J284: 2.4900000000000002e-002 | K284: 54.1 | L284: 9.0700000000000003e-002 | M284: 121.3 | N284: 34.15 | O284: -8.0000000000000002e-003 | P284: 158.42 | Q284: 已到 | R284: 5年27天 | S284: 3年27天 | T284: 5.7 | U284: 2098. | V284: 2.2799999999999998 | W284: 7.5999999999999998e-002 | X284: 0.12 | Y284: 75 | Z284: 4.44 | AA284: -5.0799999999999998e-002 | AB284: -5.74e-002 | AC284: -0.11800000000000001 | AD284: -0.12 | AE284: 85.6 | AF284: 89.46 | AG284: 0.88 | AH284: AA- | AI284: 6.3399999999999998e-002 | AJ284: =H284+100*O284 -> 156.35999999999999 | AK284: 155.9 | AL284: 217 | AM284: 66.4 | AN284: 240 | AO284: 0.317 | AP284: 11 | AQ284: 精研转债!
A285: 10 | B285: 127043 | C285: 川恒转债 | D285: 2895 | E285: 川恒股份 | F285: 化工 | G285: 农化 | H285: 163 | I285: -6.8600000000000008e-002 | J285: -7.1999999999999998e-003 | K285: 31.76 | L285: -8.7400000000000005e-002 | M285: 121 | N285: 21.02 | O285: 7.9000000000000001e-002 | P285: 151.09 | Q285: 3月14天 | R285: 5.76年 | S285: 3.76年 | T285: 11.6 | U285: 298 | V285: 0.154 | W285: 7.4999999999999997e-002 | X285: 0.113 | Y285: 155 | Z285: 4.9 | AA285: -5.1200000000000002e-002 | AB285: -5.7000000000000002e-002 | AC285: -0.105 | AD285: -0.106 | AE285: 81.8 | AF285: 85.51 | AG285: 0.87 | AH285: AA- | AI285: 6.3399999999999998e-002 | AJ285: =H285+100*O285 -> 170.90000000000001 | AK285: 174.9 | AL285: 299 | AM285: 89.4 | AN285: 307 | AO285: -0.14400000000000002 | AP285: 5 | AQ285: 川恒转债
A286: 295 | B286: 123025 | C286: 精测转债!! | D286: 300567 | E286: 精测电子 | F286: 电子 | G286: 液晶显示 | H286: 138.81 | I286: 1.1699999999999999e-002 | J286: -3.5999999999999999e-003 | K286: 54.37 | L286: 1.2500000000000001e-002 | M286: 116.5 | N286: 49.37 | O286: 0.26000000000000001 | P286: 110.13 | Q286: 已到 | R286: 3.39年 | S286: 1.39年 | T286: 3.09 | U286: 29 | V286: 6.8000000000000005e-002 | W286: 2.e-002 | X286: 2.2000000000000002e-002 | Y286: 151 | Z286: 4.68 | AA286: -5.1299999999999998e-002 | AB286: -5.9299999999999999e-002 | AC286: -0.156 | AD286: -0.158 | AE286: 93.74 | AF286: 95.48 | AG286: 0.65 | AH286: AA- | AI286: 6.1799999999999994e-002 | AJ286: =H286+100*O286 -> 164.81 | AK286: 167.5 | AL286: 274 | AM286: 72 | AN286: 266 | AO286: 1.4999999999999999e-002 | AP286: 15 | AQ286: 精测转债!!
A287: 84 | B287: 113615 | C287: 金诚转债! | D287: 603979 | E287: 金诚信 | F287: 有色金属 | G287: 有色行业 | H287: 152.99 | I287: -5.5399999999999998e-002 | J287: 1.21e-002 | K287: 18.67 | L287: -4.99e-002 | M287: 117.3 | N287: 12.65 | O287: 3.7000000000000005e-002 | P287: 147.59 | Q287: 已到 | R287: 5年47天 | S287: 3年47天 | T287: 8.66 | U287: 166 | V287: 0.122 | W287: 7.8e-002 | X287: 0.115 | Y287: 111 | Z287: 2.24 | AA287: -5.1399999999999994e-002 | AB287: -5.6799999999999996e-002 | AC287: -0.11 | AD287: -0.111 | AE287: 90.67 | AF287: 95.23 | AG287: 0.87 | AH287: AA | AI287: 4.24e-002 | AJ287: =H287+100*O287 -> 156.69 | AK287: 158.4 | AL287: 233 | AM287: 63.2 | AN287: 219 | AO287: -0.11900000000000001 | AP287: 4 | AQ287: 金诚转债!
A288: 48 | B288: 123111 | C288: 东财转3! | D288: 300059 | E288: 东方财富 | F288: 金融 | G288: 证券行业 | H288: 147.855 | I288: -9.0000000000000011e-003 | J288: 1.32e-002 | K288: 32.73 | L288: 4.8999999999999998e-003 | M288: 110.5 | N288: 23.35 | O288: 5.5e-002 | P288: 140.17 | Q288: 已到 | R288: 5.42年 | S288: 3.42年 | T288: 151 | U288: 647 | V288: 2.8999999999999998e-002 | W288: 4.4999999999999998e-002 | X288: 6.3e-002 | Y288: 3383. | Z288: 8.68 | AA288: -5.2900000000000003e-002 | AB288: -5.62e-002 | AC288: -9.8800000000000013e-002 | AD288: -9.9700000000000011e-002 | AE288: 89.48 | AF288: 90.79 | AG288: 0.85 | AH288: AA+ | AI288: 3.7400000000000003e-002 | AJ288: =H288+100*O288 -> 153.35499999999999 | AK288: 155.5 | AL288: 213 | AM288: 64.8 | AN288: 230 | AO288: -1.4999999999999999e-002 | AP288: 27 | AQ288: 东财转3!
A289: 275 | B289: 113541 | C289: 荣晟转债! | D289: 603165 | E289: 荣晟环保 | F289: 造纸包装 | G289: 包装用纸 | H289: 140.09 | I289: 9.8999999999999991e-003 | J289: 2.5999999999999999e-003 | K289: 14.66 | L289: 1.52e-002 | M289: 114.3 | N289: 10.84 | O289: 3.6000000000000004e-002 | P289: 135.24 | Q289: 已到 | R289: 3.71年 | S289: 1.71年 | T289: 1.63 | U289: 402 | V289: 1.7 | W289: 4.2000000000000003e-002 | X289: 5.7000000000000002e-002 | Y289: 39 | Z289: 2.23 | AA289: -5.4299999999999994e-002 | AB289: -6.0599999999999994e-002 | AC289: -0.127 | AD289: -0.129 | AE289: 91.94 | AF289: 91.9 | AG289: 0.83 | AH289: AA- | AI289: 6.1799999999999994e-002 | AJ289: =H289+100*O289 -> 143.69 | AK289: 144.9 | AL289: 132 | AM289: 53 | AN289: 150 | AO289: 7.5999999999999998e-002 | AP289: 41 | AQ289: 荣晟转债!
A290: 254 | B290: 113550 | C290: 常汽转债! | D290: 603035 | E290: 常熟汽饰 | F290: 汽车 | G290: 零部件制 | H290: 151.87 | I290: 3.0299999999999997e-002 | J290: -2.0999999999999999e-003 | K290: 12.58 | L290: 3.5400000000000001e-002 | M290: 121.3 | N290: 9.33 | O290: 0.126 | P290: 134.83 | Q290: 已到 | R290: 4年12天 | S290: 2年12天 | T290: 2.14 | U290: 289 | V290: 0.879 | W290: 4.7e-002 | X290: 6.4000000000000001e-002 | Y290: 45 | Z290: 1.16 | AA290: -5.5500000000000001e-002 | AB290: -6.3799999999999996e-002 | AC290: -0.12300000000000001 | AD290: -0.125 | AE290: 91.53 | AF290: 95.9 | AG290: 0.8 | AH290: AA- | AI290: 6.1799999999999994e-002 | AJ290: =H290+100*O290 -> 164.47 | AK290: 168.9 | AL290: 282 | AM290: 73 | AN290: 270 | AO290: -8.0000000000000002e-003 | AP290: 16 | AQ290: 常汽转债!
A291: 82 | B291: 113616 | C291: 韦尔转债! | D291: 603501 | E291: 韦尔股份 | F291: 电子 | G291: 元器件制 | H291: 154.58 | I291: -3.9000000000000003e-003 | J291: 1.8600000000000002e-002 | K291: 283.87 | L291: 1.8799999999999997e-002 | M291: 114.5 | N291: 222.52 | O291: 0.21199999999999999 | P291: 127.57 | Q291: 已到 | R291: 5年52天 | S291: 3年52天 | T291: 24.3 | U291: 278 | V291: 7.2999999999999995e-002 | W291: 1.e-002 | X291: 1.3000000000000001e-002 | Y291: 2467. | Z291: 17.02 | AA291: -5.7500000000000002e-002 | AB291: -6.2100000000000002e-002 | AC291: -0.114 | AD291: -0.115 | AE291: 91.29 | AF291: 95.09 | AG291: 0.78 | AH291: AA+ | AI291: 3.7400000000000003e-002 | AJ291: =H291+100*O291 -> 175.78 | AK291: 181.6 | AL291: 310 | AM291: 86.5 | AN291: 302 | AO291: 0.12 | AP291: 9 | AQ291: 韦尔转债!
A292: 15 | B292: 123120 | C292: 隆华转债 | D292: 300263 | E292: 隆华科技 | F292: 机械装备 | G292: 通用设备 | H292: 169.091 | I292: 5.6000000000000008e-003 | J292: -2.5099999999999997e-002 | K292: 10.7 | L292: -2.3700000000000002e-002 | M292: 121.1 | N292: 7.76 | O292: 0.22600000000000001 | P292: 137.89 | Q292: 3月1天 | R292: 5.73年 | S292: 3.73年 | T292: 7.99 | U292: 119 | V292: 8.6999999999999994e-002 | W292: 8.199999999999999e-002 | X292: 0.113 | Y292: 98 | Z292: 3.39 | AA292: -5.7599999999999998e-002 | AB292: -6.3299999999999995e-002 | AC292: -0.113 | AD292: -0.115 | AE292: 82.14 | AF292: 85.79 | AG292: 0.82 | AH292: AA- | AI292: 6.3399999999999998e-002 | AJ292: =H292+100*O292 -> 191.691 | AK292: 200.3 | AL292: 325 | AM292: 114.5 | AN292: 331 | AO292: 5.4000000000000006e-002 | AP292: 3 | AQ292: 隆华转债
A293: 363 | B293: 113013 | C293: 国君转债! | D293: 601211 | E293: 国泰君安 | F293: 金融 | G293: 证券行业 | H293: 118.2 | I293: -2.2000000000000001e-003 | J293: 8.0000000000000004e-004 | K293: 16.92 | L293: -4.0999999999999995e-003 | M293: 106.8 | N293: 18.45 | O293: 0.28899999999999998 | P293: 91.71 | Q293: 已到 | R293: 1.67年 | S293: 无权 | T293: 69.9 | U293: 50 | V293: 6.0000000000000001e-003 | W293: 4.5999999999999999e-002 | X293: 4.2999999999999997e-002 | Y293: 1507. | Z293: 1.14 | AA293: -5.96e-002 | AB293: -6.6799999999999998e-002 | AC293: 无权 | AD293: 无权 | AE293: 无权 | AF293: 101.33 | AG293: 0.33 | AH293: AAA | AI293: 3.2400000000000005e-002 | AJ293: =H293+100*O293 -> 147.09999999999999 | AK293: 144.7 | AL293: 130 | AM293: 43.4 | AN293: 78 | AO293: -4.8000000000000001e-002 | AP293: 12 | AQ293: 国君转债!
A294: 26 | B294: 113051 | C294: 节能转债 | D294: 601016 | E294: 节能风电 | F294: 能源电力 | G294: 风能 | H294: 164.26 | I294: -5.0700000000000002e-002 | J294: -2.1899999999999999e-002 | K294: 6.54 | L294: -8.0199999999999994e-002 | M294: 114.5 | N294: 4.05 | O294: 1.7000000000000001e-002 | P294: 161.48 | Q294: 49天 | R294: 5.62年 | S294: 3.62年 | T294: 30 | U294: 640 | V294: 0.127 | W294: 9.1999999999999998e-002 | X294: 0.14800000000000002 | Y294: 328 | Z294: 3.18 | AA294: -6.3e-002 | AB294: -6.7099999999999993e-002 | AC294: -0.11199999999999999 | AD294: -0.114 | AE294: 89.7 | AF294: 93.43 | AG294: 0.91 | AH294: AA+ | AI294: 3.7400000000000003e-002 | AJ294: =H294+100*O294 -> 165.95999999999998 | AK294: 167 | AL294: 273 | AM294: 73.6 | AN294: 272 | AO294: -6.4000000000000001e-002 | AP294: 9 | AQ294: 节能转债
A295: 64 | B295: 123103 | C295: 震安转债! | D295: 300767 | E295: 震安科技 | F295: 化工 | G295: 橡胶塑料 | H295: 171.082 | I295: -1.1699999999999999e-002 | J295: -5.1000000000000004e-003 | K295: 95 | L295: -1.8600000000000002e-002 | M295: 121.4 | N295: 56.89 | O295: 2.5000000000000001e-002 | P295: 166.99 | Q295: 已到 | R295: 5.35年 | S295: 3.35年 | T295: 2.53 | U295: 60 | V295: 0.13600000000000001 | W295: 1.3000000000000001e-002 | X295: 2.2000000000000002e-002 | Y295: 192 | Z295: 16.38 | AA295: -6.3399999999999998e-002 | AB295: -6.9599999999999995e-002 | AC295: -0.128 | AD295: -0.13 | AE295: 81.55 | AF295: 83.52 | AG295: 0.9 | AH295: A+ | AI295: 7.4400000000000008e-002 | AJ295: =H295+100*O295 -> 173.58199999999999 | AK295: 175.2 | AL295: 301 | AM295: 91.7 | AN295: 311 | AO295: -3.6000000000000004e-002 | AP295: 5 | AQ295: 震安转债!
A296: 125 | B296: 123071 | C296: 天能转债!! | D296: 300569 | E296: 天能重工 | F296: 能源电力 | G296: 风能 | H296: 166.5 | I296: -1.9199999999999998e-002 | J296: -5.4000000000000003e-003 | K296: 12.58 | L296: -2.7799999999999998e-002 | M296: 120.7 | N296: 7.91 | O296: 4.7e-002 | P296: 159.04 | Q296: 已到 | R296: 4.96年 | S296: 2.96年 | T296: 6.95 | U296: 898 | V296: 0.76300000000000001 | W296: 7.0000000000000007e-002 | X296: 0.111 | Y296: 100 | Z296: 2.85 | AA296: -6.3899999999999998e-002 | AB296: -7.0400000000000004e-002 | AC296: -0.13900000000000001 | AD296: -0.14000000000000001 | AE296: 86.05 | AF296: 90.2 | AG296: 0.88 | AH296: AA- | AI296: 6.1799999999999994e-002 | AJ296: =H296+100*O296 -> 171.19999999999999 | AK296: 174 | AL296: 296 | AM296: 83.8 | AN296: 297 | AO296: 0.11699999999999999 | AP296: 13 | AQ296: 天能转债!!
A297: 190 | B297: 113585 | C297: 寿仙转债! | D297: 603896 | E297: 寿仙谷 | F297: 医药 | G297: 中药 | H297: 158.63 | I297: 2.2000000000000002e-002 | J297: -8.8000000000000005e-003 | K297: 44.1 | L297: 1.47e-002 | M297: 117.3 | N297: 28.38 | O297: 2.1000000000000001e-002 | P297: 155.39 | Q297: 已到 | R297: 4.59年 | S297: 2.59年 | T297: 1.01 | U297: 42 | V297: 0.26200000000000001 | W297: 1.4999999999999999e-002 | X297: 2.3e-002 | Y297: 67 | Z297: 4.53 | AA297: -6.4899999999999999e-002 | AB297: -7.0800000000000002e-002 | AC297: -0.14199999999999999 | AD297: -0.10000000000000001 | AE297: 88.01 | AF297: 89.63 | AG297: 0.9 | AH297: AA- | AI297: 6.1799999999999994e-002 | AJ297: =H297+100*O297 -> 160.72999999999999 | AK297: 161.9 | AL297: 258 | AM297: 72.2 | AN297: 267 | AO297: 8.900000000000001e-002 | AP297: 18 | AQ297: 寿仙转债!
A298: 165 | B298: 123060 | C298: 苏试转债! | D298: 300416 | E298: 苏试试验 | F298: 机械装备 | G298: 专用设备 | H298: 159.795 | I298: -4.4000000000000003e-003 | J298: -2.1099999999999997e-002 | K298: 25.66 | L298: -3.0200000000000001e-002 | M298: 117.2 | N298: 18.28 | O298: 0.13800000000000001 | P298: 140.37 | Q298: 已到 | R298: 4.70年 | S298: 2.70年 | T298: 3.1 | U298: 24 | V298: 4.8000000000000001e-002 | W298: 4.5999999999999999e-002 | X298: 6.4000000000000001e-002 | Y298: 68 | Z298: 6.68 | AA298: -6.4899999999999999e-002 | AB298: -7.0699999999999999e-002 | AC298: -0.13900000000000001 | AD298: -0.14099999999999999 | AE298: 87.3 | AF298: 88.92 | AG298: 0.84 | AH298: AA- | AI298: 6.1799999999999994e-002 | AJ298: =H298+100*O298 -> 173.595 | AK298: 179.2 | AL298: 306 | AM298: 90.3 | AN298: 309 | AO298: 5.4000000000000006e-002 | AP298: 8 | AQ298: 苏试转债!
A299: 251 | B299: 128082 | C299: 华锋转债!! | D299: 2806 | E299: 华锋股份 | F299: 电子 | G299: 元器件制 | H299: 158.684 | I299: -1.41e-002 | J299: 9.1999999999999998e-003 | K299: 14.22 | L299: -5.6000000000000008e-003 | M299: 121.4 | N299: 9.13 | O299: 1.9e-002 | P299: 155.75 | Q299: 已到 | R299: 4年28天 | S299: 2年28天 | T299: 2.04 | U299: 208 | V299: 0.63800000000000001 | W299: 7.4999999999999997e-002 | X299: 0.11599999999999999 | Y299: 27 | Z299: 2.39 | AA299: -6.5199999999999994e-002 | AB299: -7.3200000000000001e-002 | AC299: -0.13100000000000001 | AD299: -0.13300000000000001 | AE299: 87.66 | AF299: 88.64 | AG299: 0.87 | AH299: A | AI299: 8.2799999999999999e-002 | AJ299: =H299+100*O299 -> 160.584 | AK299: 161.6 | AL299: 257 | AM299: 73 | AN299: 269 | AO299: -1.7000000000000001e-002 | AP299: 52 | AQ299: 华锋转债!!
A300: 279 | B300: 113027 | C300: 华钰转债!! | D300: 601020 | E300: ST华钰 | F300: 有色金属 | G300: 锌铅镍锡 | H300: 145.76 | I300: -5.7699999999999994e-002 | J300: 1.49e-002 | K300: 13.87 | L300: -5.0000000000000003e-002 | M300: 114.3 | N300: 10.17 | O300: 6.9000000000000006e-002 | P300: 136.38 | Q300: 已到 | R300: 3.60年 | S300: 1.60年 | T300: 3.11 | U300: 577 | V300: 1.25 | W300: 4.0000000000000001e-002 | X300: 5.5e-002 | Y300: 77 | Z300: 2.96 | AA300: -6.6400000000000001e-002 | AB300: -7.2800000000000004e-002 | AC300: -0.152 | AD300: -0.154 | AE300: 89.4 | AF300: 86.32 | AG300: 0.86 | AH300: A | AI300: 8.2799999999999999e-002 | AJ300: =H300+100*O300 -> 152.66 | AK300: 155.1 | AL300: 212 | AM300: 65.7 | AN300: 235 | AO300: -6.5000000000000002e-002 | AP300: 45 | AQ300: 华钰转债!!
A301: 122 | B301: 123074 | C301: 隆利转债!! | D301: 300752 | E301: 隆利科技 | F301: 电子 | G301: 液晶显示 | H301: 175.9 | I301: 7.2800000000000004e-002 | J301: 1.8600000000000002e-002 | K301: 27.87 | L301: 0.109 | M301: 123.6 | N301: 18.34 | O301: 0.158 | P301: 151.96 | Q301: 已到 | R301: 4.98年 | S301: 2.98年 | T301: 1.48 | U301: 5773. | V301: 21.449999999999999 | W301: 2.6000000000000002e-002 | X301: 4.0000000000000001e-002 | Y301: 56 | Z301: 5.88 | AA301: -6.9500000000000006e-002 | AB301: -7.6700000000000004e-002 | AC301: -0.152 | AD301: -0.154 | AE301: 85.86 | AF301: 92.22 | AG301: 0.84 | AH301: AA- | AI301: 6.1799999999999994e-002 | AJ301: =H301+100*O301 -> 191.70000000000002 | AK301: 199.8 | AL301: 324 | AM301: 107.6 | AN301: 324 | AO301: 0.27000000000000002 | AP301: 15 | AQ301: 隆利转债!!
A302: 360 | B302: 113502 | C302: 嘉澳转债! | D302: 603822 | E302: 嘉澳环保 | F302: 化工 | G302: 化工 | H302: 128.65 | I302: 3.2199999999999999e-002 | J302: -6.3e-003 | K302: 43.9 | L302: 5.28e-002 | M302: 111.3 | N302: 44.64 | O302: 0.308 | P302: 98.34 | Q302: 已到 | R302: 2年4.1天 | S302: 4.1天 | T302: 1.84 | U302: 306 | V302: 1.29 | W302: 5.7000000000000002e-002 | X302: 5.5999999999999994e-002 | Y302: 32 | Z302: 3.88 | AA302: -7.0900000000000005e-002 | AB302: -8.0199999999999994e-002 | AC302: <-100% | AD302: <-100% | AE302: 100.76 | AF302: 99.18 | AG302: 0.49 | AH302: AA- | AI302: 6.0400000000000002e-002 | AJ302: =H302+100*O302 -> 159.45000000000002 | AK302: 159 | AL302: 240 | AM302: 58.2 | AN302: 186 | AO302: -4.4000000000000004e-002 | AP302: 35 | AQ302: 嘉澳转债!
A303: 36 | B303: 123114 | C303: 三角转债 | D303: 300775 | E303: 三角防务 | F303: 航空航天 | G303: 航空航天 | H303: 181.01 | I303: -3.2500000000000001e-002 | J303: -5.9999999999999995e-004 | K303: 50.06 | L303: -3.7699999999999997e-002 | M303: 121 | N303: 31.82 | O303: 0.151 | P303: 157.32 | Q303: 24天 | R303: 5.55年 | S303: 3.55年 | T303: 9.04 | U303: 251 | V303: 0.14999999999999999 | W303: 3.6000000000000004e-002 | X303: 5.7000000000000002e-002 | Y303: 248 | Z303: 11.48 | AA303: -7.1199999999999999e-002 | AB303: -7.6999999999999999e-002 | AC303: -0.13400000000000001 | AD303: -0.13600000000000001 | AE303: 82.9 | AF303: 86.65 | AG303: 0.88 | AH303: AA- | AI303: 6.3399999999999998e-002 | AJ303: =H303+100*O303 -> 196.10999999999999 | AK303: 204.7 | AL303: 329 | AM303: 118 | AN303: 334 | AO303: 6.8000000000000005e-002 | AP303: 6 | AQ303: 三角转债
A304: 257 | B304: 110061 | C304: 川投转债! | D304: 600674 | E304: 川投能源 | F304: 能源电力 | G304: 水电 | H304: 148.2 | I304: -6.8000000000000005e-003 | J304: -3.73e-002 | K304: 12.45 | L304: -5.1799999999999999e-002 | M304: 110.8 | N304: 9.2 | O304: 9.5000000000000001e-002 | P304: 135.33 | Q304: 已到 | R304: 4年5.1天 | S304: 2年5.1天 | T304: 39.6 | U304: 56 | V304: 1.e-002 | W304: 7.2000000000000008e-002 | X304: 9.8000000000000004e-002 | Y304: 549 | Z304: 1.79 | AA304: -7.1300000000000002e-002 | AB304: -7.5600000000000001e-002 | AC304: -0.12 | AD304: -0.121 | AE304: 96.16 | AF304: 97.26 | AG304: 0.85 | AH304: AAA | AI304: 3.3799999999999997e-002 | AJ304: =H304+100*O304 -> 157.69999999999999 | AK304: 161.1 | AL304: 256 | AM304: 63.8 | AN304: 225 | AO304: -3.5000000000000003e-002 | AP304: 13 | AQ304: 川投转债!
A305: 256 | B305: 123035 | C305: 利德转债!! | D305: 300296 | E305: 利亚德 | F305: 电子 | G305: LED制 | H305: 154.72 | I305: 3.0000000000000001e-003 | J305: 2.2599999999999999e-002 | K305: 9.74 | L305: 3.0699999999999998e-002 | M305: 115.1 | N305: 6.96 | O305: 0.106 | P305: 139.94 | Q305: 已到 | R305: 4年8天 | S305: 2年8天 | T305: 7.99 | U305: 399 | V305: 0.313 | W305: 3.2000000000000001e-002 | X305: 4.4999999999999998e-002 | Y305: 248 | Z305: 3.23 | AA305: -7.2400000000000006e-002 | AB305: -7.8399999999999997e-002 | AC305: -0.13100000000000001 | AD305: -0.13200000000000001 | AE305: 96.03 | AF305: 100.27 | AG305: 0.83 | AH305: AA+ | AI305: 3.5799999999999998e-002 | AJ305: =H305+100*O305 -> 165.31999999999999 | AK305: 169.5 | AL305: 286 | AM305: 69.2 | AN305: 255 | AO305: 2.3e-002 | AP305: 14 | AQ305: 利德转债!!
A306: 24 | B306: 113626 | C306: 伯特转债 | D306: 603596 | E306: 伯特利 | F306: 汽车 | G306: 零部件制 | H306: 186.43 | I306: 3.7999999999999999e-002 | J306: -1.2999999999999999e-003 | K306: 61.7 | L306: 4.0500000000000001e-002 | M306: 121.1 | N306: 36.01 | O306: 8.8000000000000009e-002 | P306: 171.34 | Q306: 2月0天 | R306: 5.64年 | S306: 3.64年 | T306: 9.02 | U306: 121 | V306: 7.2000000000000008e-002 | W306: 3.6000000000000004e-002 | X306: 6.0999999999999999e-002 | Y306: 252 | Z306: 7.97 | AA306: -7.4700000000000003e-002 | AB306: -8.0299999999999996e-002 | AC306: -0.13699999999999998 | AD306: -0.13900000000000001 | AE306: 88.56 | AF306: 96.19 | AG306: 0.91 | AH306: AA | AI306: 4.24e-002 | AJ306: =H306+100*O306 -> 195.23000000000002 | AK306: 201.5 | AL306: 327 | AM306: 105.3 | AN306: 323 | AO306: 0.125 | AP306: 3 | AQ306: 伯特转债
A307: 267 | B307: 113545 | C307: 金能转债! | D307: 603113 | E307: 金能科技 | F307: 煤炭 | G307: 炼焦 | H307: 154.56 | I307: -3.4700000000000002e-002 | J307: 8.8000000000000005e-003 | K307: 13.62 | L307: -3.27e-002 | M307: 114.3 | N307: 10.43 | O307: 0.184 | P307: 130.58 | Q307: 已到 | R307: 3.94年 | S307: 1.94年 | T307: 9.87 | U307: 37 | V307: 2.4e-002 | W307: 8.5000000000000006e-002 | X307: 0.111 | Y307: 116 | Z307: 1.33 | AA307: -7.4900000000000008e-002 | AB307: -8.0700000000000008e-002 | AC307: -0.13900000000000001 | AD307: -0.14000000000000001 | AE307: 94.56 | AF307: 97.93 | AG307: 0.79 | AH307: AA | AI307: 4.0800000000000003e-002 | AJ307: =H307+100*O307 -> 172.96000000000001 | AK307: 178.5 | AL307: 305 | AM307: 80.6 | AN307: 291 | AO307: -0.13200000000000001 | AP307: 14 | AQ307: 金能转债!
A308: 58 | B308: 127030 | C308: 盛虹转债! | D308: 301 | E308: 东方盛虹 | F308: 化工 | G308: 化纤 | H308: 170.5 | I308: -8.9700000000000002e-002 | J308: 2.2799999999999997e-002 | K308: 21.5 | L308: -7.5300000000000006e-002 | M308: 112.5 | N308: 14.1 | O308: 0.11800000000000001 | P308: 152.48 | Q308: 已到 | R308: 5.37年 | S308: 3.37年 | T308: 50 | U308: 449 | V308: 5.0999999999999997e-002 | W308: 4.8000000000000001e-002 | X308: 7.2999999999999995e-002 | Y308: 1040. | Z308: 9.16 | AA308: -7.5499999999999998e-002 | AB308: -7.9199999999999993e-002 | AC308: -0.129 | AD308: -0.13 | AE308: 90.52 | AF308: 92.65 | AG308: 0.89 | AH308: AA+ | AI308: 3.7400000000000003e-002 | AJ308: =H308+100*O308 -> 182.30000000000001 | AK308: 188.5 | AL308: 315 | AM308: 95.9 | AN308: 317 | AO308: -0.19699999999999998 | AP308: 5 | AQ308: 盛虹转债!
A309: 146 | B309: 128128 | C309: 齐翔转2! | D309: 2408 | E309: 齐翔腾达 | F309: 化工 | G309: 化工 | H309: 167.4 | I309: -5.5800000000000002e-002 | J309: -4.7999999999999996e-003 | K309: 9.41 | L309: -6.6500000000000004e-002 | M309: 115 | N309: 5.69 | O309: 1.2e-002 | P309: 165.38 | Q309: 已到 | R309: 4.79年 | S309: 2.79年 | T309: 6.81 | U309: 260 | V309: 0.22399999999999998 | W309: 2.6000000000000002e-002 | X309: 4.2999999999999997e-002 | Y309: 264 | Z309: 2.15 | AA309: -7.6700000000000004e-002 | AB309: -8.1600000000000006e-002 | AC309: -0.14899999999999999 | AD309: -0.10000000000000001 | AE309: 91.99 | AF309: 95.32 | AG309: 0.91 | AH309: AA | AI309: 4.0800000000000003e-002 | AJ309: =H309+100*O309 -> 168.59999999999999 | AK309: 169.4 | AL309: 285 | AM309: 74.1 | AN309: 274 | AO309: -0.16600000000000001 | AP309: 29 | AQ309: 齐翔转2!
A310: 234 | B310: 128096 | C310: 奥瑞转债!! | D310: 2701 | E310: 奥瑞金 | F310: 造纸包装 | G310: 包装材料 | H310: 161.62 | I310: -4.6399999999999997e-002 | J310: -8.6e-003 | K310: 7.13 | L310: -6.0599999999999994e-002 | M310: 115.5 | N310: 4.5 | O310: 2.e-002 | P310: 158.44 | Q310: 已到 | R310: 4.27年 | S310: 2.27年 | T310: 5.67 | U310: 135 | V310: 0.14599999999999999 | W310: 3.3000000000000002e-002 | X310: 5.2000000000000005e-002 | Y310: 174 | Z310: 2.4 | AA310: -7.7300000000000008e-002 | AB310: -8.3000000000000004e-002 | AC310: -0.12300000000000001 | AD310: -0.124 | AE310: 95.42 | AF310: 99.77 | AG310: 0.91 | AH310: AA+ | AI310: 3.5799999999999998e-002 | AJ310: =H310+100*O310 -> 163.62 | AK310: 164.8 | AL310: 269 | AM310: 65 | AN310: 232 | AO310: 5.7999999999999996e-002 | AP310: 17 | AQ310: 奥瑞转债!!
A311: 144 | B311: 113039 | C311: 嘉泽转债!! | D311: 601619 | E311: 嘉泽新能 | F311: 能源电力 | G311: 风能 | H311: 165.7 | I311: -3.8199999999999998e-002 | J311: -1.5300000000000001e-002 | K311: 5.61 | L311: -5.8700000000000002e-002 | M311: 112.8 | N311: 3.46 | O311: 2.2000000000000002e-002 | P311: 162.14 | Q311: 已到 | R311: 4.80年 | S311: 2.80年 | T311: 2.89 | U311: 408 | V311: 0.84400000000000008 | W311: 2.1000000000000001e-002 | X311: 3.5000000000000003e-002 | Y311: 136 | Z311: 2.86 | AA311: -7.8299999999999995e-002 | AB311: -8.2500000000000004e-002 | AC311: -0.14499999999999999 | AD311: -0.14699999999999999 | AE311: 91.84 | AF311: 93.45 | AG311: 0.91 | AH311: AA | AI311: 4.0800000000000003e-002 | AJ311: =H311+100*O311 -> 167.89999999999998 | AK311: 169.3 | AL311: 284 | AM311: 75.8 | AN311: 280 | AO311: -1.1000000000000001e-002 | AP311: 36 | AQ311: 嘉泽转债!!
A312: 86 | B312: 123089 | C312: 九洲转2!! | D312: 300040 | E312: 九洲集团 | F312: 能源电力 | G312: 电力设备 | H312: 182.411 | I312: -3.49e-002 | J312: -2.1000000000000001e-002 | K312: 9.82 | L312: -6.1200000000000004e-002 | M312: 121 | N312: 5.68 | O312: 5.5e-002 | P312: 172.89 | Q312: 已到 | R312: 5年45天 | S312: 3年45天 | T312: 3.06 | U312: 255 | V312: 0.44700000000000001 | W312: 5.2999999999999999e-002 | X312: 9.1999999999999998e-002 | Y312: 58 | Z312: 2.25 | AA312: -7.8399999999999997e-002 | AB312: -8.4600000000000009e-002 | AC312: -0.154 | AD312: -0.155 | AE312: 85.09 | AF312: 88.94 | AG312: 0.91 | AH312: AA- | AI312: 6.3399999999999998e-002 | AJ312: =H312+100*O312 -> 187.911 | AK312: 191.9 | AL312: 319 | AM312: 103 | AN312: 321 | AO312: -2.5000000000000001e-002 | AP312: 19 | AQ312: 九洲转2!!
A313: 216 | B313: 128103 | C313: 同德转债! | D313: 2360 | E313: 同德化工 | F313: 化工 | G313: 化工 | H313: 172.949 | I313: 3.0999999999999999e-003 | J313: -1.2800000000000001e-002 | K313: 8.14 | L313: -1.09e-002 | M313: 121.3 | N313: 5.08 | O313: 7.9000000000000001e-002 | P313: 160.24 | Q313: 已到 | R313: 4.38年 | S313: 2.38年 | T313: 0.88 | U313: 64 | V313: 0.41999999999999998 | W313: 2.7000000000000003e-002 | X313: 4.4000000000000004e-002 | Y313: 33 | Z313: 2.43 | AA313: -7.9399999999999998e-002 | AB313: -8.6699999999999999e-002 | AC313: -0.128 | AD313: -0.13 | AE313: 87.29 | AF313: 89.85 | AG313: 0.89 | AH313: A+ | AI313: 7.2800000000000004e-002 | AJ313: =H313+100*O313 -> 180.84900000000002 | AK313: 185.7 | AL313: 313 | AM313: 95.8 | AN313: 316 | AO313: -0.106 | AP313: 17 | AQ313: 同德转债!
A314: 69 | B314: 118000 | C314: 嘉元转债! | D314: 688388 | E314: 嘉元科技 | F314: 电子 | G314: 电子产品 | H314: 187.7 | I314: -5.6299999999999996e-002 | J314: -1.8600000000000002e-002 | K314: 140 | L314: -8.2299999999999998e-002 | M314: 121 | N314: 78.74 | O314: 5.5999999999999994e-002 | P314: 177.8 | Q314: 已到 | R314: 5.30年 | S314: 3.30年 | T314: 9.79 | U314: 801 | V314: 0.435 | W314: 2.9999999999999999e-002 | X314: 5.2999999999999999e-002 | Y314: 328 | Z314: 10.94 | AA314: -8.09e-002 | AB314: -8.6899999999999991e-002 | AC314: -0.152 | AD314: -0.154 | AE314: 84.18 | AF314: 87.99 | AG314: 0.91 | AH314: AA- | AI314: 6.3399999999999998e-002 | AJ314: =H314+100*O314 -> 193.29999999999998 | AK314: 197.6 | AL314: 321 | AM314: 109.6 | AN314: 328 | AO314: -0.10400000000000001 | AP314: 6 | AQ314: 嘉元转债!
A315: 29 | B315: 127038 | C315: 国微转债 | D315: 2049 | E315: 紫光国微 | F315: 电子 | G315: 芯片制造 | H315: 183.45 | I315: -2.9500000000000002e-002 | J315: 6.4000000000000003e-003 | K315: 216.66 | L315: -2.58e-002 | M315: 114.5 | N315: 137.78 | O315: 0.16699999999999998 | P315: 157.25 | Q315: 41天 | R315: 5.59年 | S315: 3.59年 | T315: 15 | U315: 217 | V315: 7.6999999999999999e-002 | W315: 1.1000000000000001e-002 | X315: 1.8000000000000002e-002 | Y315: 1315. | Z315: 20.01 | AA315: -8.1799999999999998e-002 | AB315: -8.5900000000000004e-002 | AC315: -0.13699999999999998 | AD315: -0.13800000000000001 | AE315: 89.8 | AF315: 93.54 | AG315: 0.89 | AH315: AA+ | AI315: 3.7400000000000003e-002 | AJ315: =H315+100*O315 -> 200.14999999999998 | AK315: 209.6 | AL315: 332 | AM315: 116.1 | AN315: 332 | AO315: 6.4000000000000001e-002 | AP315: 5 | AQ315: 国微转债
A316: 323 | B316: 128046 | C316: 利尔转债!! | D316: 2258 | E316: 利尔化学 | F316: 化工 | G316: 农化 | H316: 143.5 | I316: 1.38e-002 | J316: -2.1899999999999999e-002 | K316: 23.66 | L316: -1.e-002 | M316: 111.3 | N316: 18.42 | O316: 0.11699999999999999 | P316: 128.45 | Q316: 已到 | R316: 2.95年 | S316: 0.95年 | T316: 8.08 | U316: 85 | V316: 7.2999999999999995e-002 | W316: 6.5000000000000002e-002 | X316: 8.3000000000000004e-002 | Y316: 125 | Z316: 2.88 | AA316: -8.3699999999999997e-002 | AB316: -8.9999999999999997e-002 | AC316: -0.25800000000000001 | AD316: -0.26000000000000001 | AE316: 97.53 | AF316: 99.5 | AG316: 0.81 | AH316: AA | AI316: 3.9399999999999998e-002 | AJ316: =H316+100*O316 -> 155.19999999999999 | AK316: 158.6 | AL316: 236 | AM316: 59.1 | AN316: 194 | AO316: -5.9999999999999998e-002 | AP316: 9 | AQ316: 利尔转债!!
A317: 310 | B317: 110051 | C317: 中天转债! | D317: 600522 | E317: 中天科技 | F317: 通信互联 | G317: 通信设备 | H317: 151.94 | I317: -3.7699999999999997e-002 | J317: 6.7400000000000002e-002 | K317: 15.18 | L317: 3.27e-002 | M317: 113.3 | N317: 9.99 | O317: 0. | P317: 151.95 | Q317: 已到 | R317: 3.31年 | S317: 1.31年 | T317: 39.6 | U317: 3564. | V317: 0.58599999999999997 | W317: 8.5000000000000006e-002 | X317: 0.129 | Y317: 465 | Z317: 2.02 | AA317: -8.6300000000000002e-002 | AB317: -9.2600000000000002e-002 | AC317: -0.20800000000000002 | AD317: -0.20999999999999999 | AE317: 97.64 | AF317: 101.08 | AG317: 0.91 | AH317: AA+ | AI317: 3.5799999999999998e-002 | AJ317: =H317+100*O317 -> 151.94 | AK317: 151.9 | AL317: 192 | AM317: 50.8 | AN317: 136 | AO317: 0.53100000000000003 | AP317: 27 | AQ317: 中天转债!
A318: 210 | B318: 113034 | C318: 滨化转债! | D318: 601678 | E318: 滨化股份 | F318: 化工 | G318: 化工 | H318: 171.3 | I318: -4.6100000000000002e-002 | J318: 1.1699999999999999e-002 | K318: 7.34 | L318: -3.7999999999999999e-002 | M318: 114.8 | N318: 4.58 | O318: 6.9000000000000006e-002 | P318: 160.26 | Q318: 已到 | R318: 4.42年 | S318: 2.42年 | T318: 4.68 | U318: 226 | V318: 0.27399999999999997 | W318: 3.3000000000000002e-002 | X318: 5.2000000000000005e-002 | Y318: 144 | Z318: 1.48 | AA318: -8.7899999999999992e-002 | AB318: -9.3100000000000002e-002 | AC318: -0.125 | AD318: -0.126 | AE318: 93.22 | AF318: 96.53 | AG318: 0.9 | AH318: AA | AI318: 4.0800000000000003e-002 | AJ318: =H318+100*O318 -> 178.20000000000002 | AK318: 182.3 | AL318: 311 | AM318: 85.8 | AN318: 299 | AO318: -0.17100000000000001 | AP318: 22 | AQ318: 滨化转债!
A319: 219 | B319: 128101 | C319: 联创转债!! | D319: 2036 | E319: 联创电子 | F319: 电子 | G319: 液晶显示 | H319: 172 | I319: -3.3700000000000001e-002 | J319: -4.3e-003 | K319: 20.95 | L319: -4.2900000000000001e-002 | M319: 114.8 | N319: 13.72 | O319: 0.126 | P319: 152.7 | Q319: 已到 | R319: 4.36年 | S319: 2.36年 | T319: 3 | U319: 423 | V319: 0.80200000000000005 | W319: 1.3000000000000001e-002 | X319: 2.1000000000000001e-002 | Y319: 223 | Z319: 5.71 | AA319: -9.01e-002 | AB319: -9.5399999999999985e-002 | AC319: -0.13100000000000001 | AD319: -0.13200000000000001 | AE319: 93.47 | AF319: 96.79 | AG319: 0.88 | AH319: AA | AI319: 4.0800000000000003e-002 | AJ319: =H319+100*O319 -> 184.59999999999999 | AK319: 191.3 | AL319: 318 | AM319: 94.5 | AN319: 315 | AO319: 0.13900000000000001 | AP319: 15 | AQ319: 联创转债!!
A320: 371 | B320: 110034 | C320: 九州转债! | D320: 600998 | E320: 九州通 | F320: 医药 | G320: 医药商业 | H320: 110 | I320: 2.9999999999999997e-004 | J320: -2.9999999999999997e-004 | K320: 13.61 | L320: 1.26e-002 | M320: 108 | N320: 17.83 | O320: 0.441 | P320: 76.33 | Q320: 已到 | R320: 0.19年 | S320: 回售内 | T320: 15 | U320: 14 | V320: 9.0000000000000011e-003 | W320: 5.9000000000000004e-002 | X320: 4.4999999999999998e-002 | Y320: 255 | Z320: 1.22 | AA320: -9.11e-002 | AB320: -0.159 | AC320: 回售内 | AD320: 回售内 | AE320: 103 | AF320: 107.37 | AG320: 0 | AH320: AA+ | AI320: 3.1e-002 | AJ320: =H320+100*O320 -> 154.09999999999999 | AK320: 143.7 | AL320: 117 | AM320: 36.3 | AN320: 30 | AO320: -0.105 | AP320: 27 | AQ320: 九州转债!
A321: 75 | B321: 113621 | C321: 彤程转债! | D321: 603650 | E321: 彤程新材 | F321: 化工 | G321: 橡胶塑料 | H321: 190.56 | I321: -2.2700000000000001e-002 | J321: 1.47e-002 | K321: 59.66 | L321: -8.5000000000000006e-003 | M321: 115.1 | N321: 32.62 | O321: 4.2000000000000003e-002 | P321: 182.89 | Q321: 已到 | R321: 5.22年 | S321: 3.22年 | T321: 5.37 | U321: 488 | V321: 0.46399999999999997 | W321: 1.4999999999999999e-002 | X321: 2.7999999999999997e-002 | Y321: 354 | Z321: 13.28 | AA321: -9.35e-002 | AB321: -9.7899999999999987e-002 | AC321: -0.16 | AD321: -0.161 | AE321: 90.12 | AF321: 93.06 | AG321: 0.95 | AH321: AA | AI321: 4.24e-002 | AJ321: =H321+100*O321 -> 194.75999999999999 | AK321: 198.2 | AL321: 323 | AM321: 105.2 | AN321: 322 | AO321: 0.14899999999999999 | AP321: 8 | AQ321: 彤程转债!
A322: 127 | B322: 123070 | C322: 鹏辉转债! | D322: 300438 | E322: 鹏辉能源 | F322: 汽车 | G322: 零部件制 | H322: 186 | I322: -1.7100000000000001e-002 | J322: 1.6799999999999999e-002 | K322: 37.18 | L322: -2.9999999999999997e-004 | M322: 114.8 | N322: 20.08 | O322: 5.0000000000000001e-003 | P322: 185.16 | Q322: 已到 | R322: 4.95年 | S322: 2.95年 | T322: 7.49 | U322: 812 | V322: 0.57600000000000007 | W322: 4.7e-002 | X322: 8.8000000000000009e-002 | Y322: 158 | Z322: 6.17 | AA322: -9.4200000000000006e-002 | AB322: -9.8800000000000013e-002 | AC322: -0.107 | AD322: -0.10800000000000001 | AE322: 91.27 | AF322: 94.51 | AG322: 0.95 | AH322: AA | AI322: 4.0800000000000003e-002 | AJ322: =H322+100*O322 -> 186.5 | AK322: 186.8 | AL322: 314 | AM322: 92.3 | AN322: 312 | AO322: 0.24299999999999999 | AP322: 7 | AQ322: 鹏辉转债!
A323: 187 | B323: 128113 | C323: 比音转债! | D323: 2832 | E323: 比音勒芬 | F323: 服装纺织 | G323: 服装行业 | H323: 184.727 | I323: 1.e-004 | J323: -3.4999999999999996e-003 | K323: 25.03 | L323: -3.5999999999999999e-003 | M323: 116.9 | N323: 14.6 | O323: 7.8e-002 | P323: 171.44 | Q323: 已到 | R323: 4.61年 | S323: 2.61年 | T323: 2.98 | U323: 15 | V323: 2.7000000000000003e-002 | W323: 2.2000000000000002e-002 | X323: 3.7000000000000005e-002 | Y323: 138 | Z323: 4.65 | AA323: -9.6099999999999991e-002 | AB323: -0.10199999999999999 | AC323: -0.127 | AD323: -0.128 | AE323: 92.64 | AF323: 97.59 | AG323: 0.93 | AH323: AA | AI323: 4.0800000000000003e-002 | AJ323: =H323+100*O323 -> 192.52700000000002 | AK323: 198 | AL323: 322 | AM323: 100.4 | AN323: 319 | AO323: -1.7000000000000001e-002 | AP323: 8 | AQ323: 比音转债!
A324: 96 | B324: 123084 | C324: 高澜转债!! | D324: 300499 | E324: 高澜股份 | F324: 能源电力 | G324: 电力设备 | H324: 204 | I324: -8.5199999999999998e-002 | J324: -1.41e-002 | K324: 17.25 | L324: -0.106 | M324: 121.9 | N324: 9.01 | O324: 6.6000000000000003e-002 | P324: 191.45 | Q324: 已到 | R324: 5年34天 | S324: 3年34天 | T324: 2.54 | U324: 1031. | V324: 1.9099999999999999 | W324: 5.2999999999999999e-002 | X324: 0.10099999999999999 | Y324: 48 | Z324: 5.62 | AA324: -9.820000000000001e-002 | AB324: -0.10400000000000001 | AC324: -0.111 | AD324: -0.11199999999999999 | AE324: 83.24 | AF324: 85.43 | AG324: 0.94 | AH324: A+ | AI324: 7.4400000000000008e-002 | AJ324: =H324+100*O324 -> 210.59999999999999 | AK324: 216.5 | AL324: 335 | AM324: 131.1 | AN324: 336 | AO324: 0.10300000000000001 | AP324: 15 | AQ324: 高澜转债!!
A325: 30 | B325: 113049 | C325: 长汽转债 | D325: 601633 | E325: 长城汽车 | F325: 汽车 | G325: 乘用车 | H325: 196.91 | I325: -1.7500000000000002e-002 | J325: 1.4999999999999999e-002 | K325: 62.85 | L325: -2.7000000000000001e-003 | M325: 110.5 | N325: 38 | O325: 0.191 | P325: 165.39 | Q325: 41天 | R325: 5.59年 | S325: 3.59年 | T325: 35 | U325: 112 | V325: 1.6e-002 | W325: 6.0000000000000001e-003 | X325: 1.e-002 | Y325: 5805. | Z325: 9.9 | AA325: -9.9100000000000008e-002 | AB325: -0.10199999999999999 | AC325: -0.153 | AD325: -0.153 | AE325: 89.79 | AF325: 91.19 | AG325: 0.91 | AH325: AAA | AI325: 3.5400000000000001e-002 | AJ325: =H325+100*O325 -> 216.00999999999999 | AK325: 228.4 | AL325: 338 | AM325: 137.2 | AN325: 341 | AO325: 3.0000000000000001e-003 | AP325: 5 | AQ325: 长汽转债
A326: 83 | B326: 123092 | C326: 天壕转债! | D326: 300332 | E326: 天壕环境 | F326: 石油天然 | G326: 天然气 | H326: 212 | I326: -6.1900000000000004e-002 | J326: -1.54e-002 | K326: 10.45 | L326: -8.1699999999999995e-002 | M326: 121.6 | N326: 5.19 | O326: 5.2999999999999999e-002 | P326: 201.35 | Q326: 已到 | R326: 5年48天 | S326: 3年48天 | T326: 4.23 | U326: 1730. | V326: 1.9299999999999999 | W326: 4.5999999999999999e-002 | X326: 9.3000000000000013e-002 | Y326: 92 | Z326: 2.7 | AA326: -0.105 | AB326: -0.111 | AC326: -0.114 | AD326: -0.115 | AE326: 82.84 | AF326: 84.96 | AG326: 0.95 | AH326: A+ | AI326: 7.4400000000000008e-002 | AJ326: =H326+100*O326 -> 217.30000000000001 | AK326: 222.7 | AL326: 336 | AM326: 137.7 | AN326: 342 | AO326: 0.20199999999999999 | AP326: 9 | AQ326: 天壕转债!
A327: 99 | B327: 123083 | C327: 朗新转债! | D327: 300682 | E327: 朗新科技 | F327: 计算机及 | G327: 软件开发 | H327: 201.45 | I327: -6.5599999999999992e-002 | J327: -6.4000000000000003e-003 | K327: 30.84 | L327: -7.5300000000000006e-002 | M327: 115.1 | N327: 15.4 | O327: 6.0000000000000001e-003 | P327: 200.26 | Q327: 已到 | R327: 5年33天 | S327: 3年33天 | T327: 6.27 | U327: 305 | V327: 0.23699999999999999 | W327: 2.e-002 | X327: 3.9e-002 | Y327: 321 | Z327: 5.87 | AA327: -0.106 | AB327: -0.11 | AC327: -0.111 | AD327: -0.11199999999999999 | AE327: 90.62 | AF327: 93.57 | AG327: 0.96 | AH327: AA | AI327: 4.24e-002 | AJ327: =H327+100*O327 -> 202.04999999999998 | AK327: 202.6 | AL327: 328 | AM327: 109.1 | AN327: 327 | AO327: 7.0000000000000007e-002 | AP327: 7 | AQ327: 朗新转债!
A328: 304 | B328: 127011 | C328: 中鼎转2!! | D328: 887 | E328: 中鼎股份 | F328: 汽车 | G328: 零部件制 | H328: 165.922 | I328: -1.43e-002 | J328: 5.3e-003 | K328: 17.81 | L328: -1.e-002 | M328: 114.5 | N328: 11.39 | O328: 6.0999999999999999e-002 | P328: 156.37 | Q328: 已到 | R328: 3.33年 | S328: 1.33年 | T328: 12 | U328: 47 | V328: 2.3e-002 | W328: 5.5e-002 | X328: 8.5999999999999993e-002 | Y328: 217 | Z328: 2.36 | AA328: -0.107 | AB328: -0.114 | AC328: -0.23999999999999999 | AD328: -0.24199999999999999 | AE328: 97.59 | AF328: 102.09 | AG328: 0.91 | AH328: AA+ | AI328: 3.5799999999999998e-002 | AJ328: =H328+100*O328 -> 172.02199999999999 | AK328: 175.5 | AL328: 302 | AM328: 73.4 | AN328: 271 | AO328: 0.113 | AP328: 19 | AQ328: 中鼎转2!!
A329: 327 | B329: 123014 | C329: 凯发转债! | D329: 300407 | E329: 凯发电气 | F329: 能源电力 | G329: 电力设备 | H329: 131.5 | I329: -3.8e-003 | J329: 5.7999999999999996e-003 | K329: 7.89 | L329: 3.8e-003 | M329: 107.5 | N329: 8.05 | O329: 0.34200000000000003 | P329: 98.01 | Q329: 已到 | R329: 1.72年 | S329: 回售内 | T329: 1.16 | U329: 31 | V329: 0.20199999999999999 | W329: 4.8000000000000001e-002 | X329: 4.7e-002 | Y329: 24 | Z329: 1.74 | AA329: -0.111 | AB329: -0.11800000000000001 | AC329: 回售内 | AD329: 回售内 | AE329: 100.25 | AF329: 95.56 | AG329: 0.52 | AH329: A+ | AI329: 7.1399999999999991e-002 | AJ329: =H329+100*O329 -> 165.69999999999999 | AK329: 165 | AL329: 270 | AM329: 64.7 | AN329: 229 | AO329: 2.2000000000000002e-002 | AP329: 16 | AQ329: 凯发转债!
A330: 134 | B330: 113603 | C330: 东缆转债!! | D330: 603606 | E330: 东方电缆 | F330: 能源电力 | G330: 电力设备 | H330: 209.88 | I330: -2.53e-002 | J330: 4.8999999999999998e-003 | K330: 49.96 | L330: -2.0400000000000001e-002 | M330: 114.8 | N330: 23.65 | O330: -6.0000000000000001e-003 | P330: 211.25 | Q330: 已到 | R330: 4.88年 | S330: 2.88年 | T330: 4.38 | U330: 706 | V330: 0.76000000000000001 | W330: 1.3000000000000001e-002 | X330: 2.7999999999999997e-002 | Y330: 327 | Z330: 8.53 | AA330: -0.11800000000000001 | AB330: -0.122 | AC330: -0.128 | AD330: -0.129 | AE330: 91.53 | AF330: 94.78 | AG330: 1 | AH330: AA | AI330: 4.0800000000000003e-002 | AJ330: =H330+100*O330 -> 209.28 | AK330: 208.5 | AL330: 331 | AM330: 113.7 | AN330: 330 | AO330: 0.318 | AP330: 7 | AQ330: 东缆转债!!
A331: 199 | B331: 113580 | C331: 康隆转债!! | D331: 603665 | E331: 康隆达 | F331: 服装纺织 | G331: 服装行业 | H331: 213.46 | I331: 1.1999999999999999e-003 | J331: -2.41e-002 | K331: 26.87 | L331: -2.29e-002 | M331: 120.8 | N331: 15.51 | O331: 0.23199999999999998 | P331: 173.24 | Q331: 已到 | R331: 4.46年 | S331: 2.46年 | T331: 0.41 | U331: 283 | V331: 3.1600000000000001 | W331: 1.e-002 | X331: 1.7000000000000001e-002 | Y331: 43 | Z331: 3.87 | AA331: -0.122 | AB331: -0.129 | AC331: -0.161 | AD331: -0.16200000000000001 | AE331: 88.76 | AF331: 93.03 | AG331: 1 | AH331: AA- | AI331: 6.1799999999999994e-002 | AJ331: =H331+100*O331 -> 236.66 | AK331: 253.7 | AL331: 347 | AM331: 160.6 | AN331: 347 | AO331: 0.10400000000000001 | AP331: 7 | AQ331: 康隆转债!!
A332: 229 | B332: 110066 | C332: 盛屯转债!! | D332: 600711 | E332: 盛屯矿业 | F332: 有色金属 | G332: 有色行业 | H332: 201.51 | I332: 1.1999999999999999e-003 | J332: -3.61e-002 | K332: 9.2 | L332: -3.6600000000000001e-002 | M332: 114.9 | N332: 4.87 | O332: 6.7000000000000004e-002 | P332: 188.91 | Q332: 已到 | R332: 4.32年 | S332: 2.32年 | T332: 3.83 | U332: 511 | V332: 0.64800000000000002 | W332: 1.4999999999999999e-002 | X332: 2.8999999999999998e-002 | Y332: 253 | Z332: 2.04 | AA332: -0.124 | AB332: -0.129 | AC332: -0.16399999999999998 | AD332: -0.16500000000000001 | AE332: 93.72 | AF332: 97.04 | AG332: 0.95 | AH332: AA | AI332: 4.0800000000000003e-002 | AJ332: =H332+100*O332 -> 208.20999999999998 | AK332: 214.1 | AL332: 334 | AM332: 117.1 | AN332: 333 | AO332: -0.13600000000000001 | AP332: 30 | AQ332: 盛屯转债!!
A333: 226 | B333: 113568 | C333: 新春转债!! | D333: 603667 | E333: 五洲新春 | F333: 机械装备 | G333: 通用设备 | H333: 218.09 | I333: -9.1799999999999993e-002 | J333: 0.128 | K333: 18.09 | L333: 3.85e-002 | M333: 124.3 | N333: 8.75 | O333: 5.5e-002 | P333: 206.74 | Q333: 已到 | R333: 4.33年 | S333: 2.33年 | T333: 2.44 | U333: 2810. | V333: 4.9400000000000004 | W333: 4.4999999999999998e-002 | X333: 9.3000000000000013e-002 | Y333: 54 | Z333: 2.9 | AA333: -0.124 | AB333: -0.13200000000000001 | AC333: -0.17499999999999999 | AD333: -0.17699999999999999 | AE333: 89.91 | AF333: 96.53 | AG333: 0.95 | AH333: AA- | AI333: 6.1799999999999994e-002 | AJ333: =H333+100*O333 -> 223.59 | AK333: 229.4 | AL333: 339 | AM333: 132.9 | AN333: 338 | AO333: 0.10800000000000001 | AP333: 41 | AQ333: 新春转债!!
A334: 258 | B334: 123034 | C334: 通光转债! | D334: 300265 | E334: 通光线缆 | F334: 通信互联 | G334: 通信设备 | H334: 200 | I334: -6.6e-003 | J334: -1.8500000000000003e-002 | K334: 9.9 | L334: -3.2300000000000002e-002 | M334: 118 | N334: 7.95 | O334: 0.60599999999999998 | P334: 124.53 | Q334: 已到 | R334: 3.99年 | S334: 1.99年 | T334: 0.78 | U334: 102 | V334: 0.65300000000000002 | W334: 2.2000000000000002e-002 | X334: 2.7000000000000003e-002 | Y334: 36 | Z334: 2.78 | AA334: -0.127 | AB334: -0.13300000000000001 | AC334: -0.19699999999999998 | AD334: -0.19800000000000001 | AE334: 88.4 | AF334: 89.04 | AG334: 0.78 | AH334: A+ | AI334: 7.2800000000000004e-002 | AJ334: =H334+100*O334 -> 260.60000000000002 | AK334: 275.5 | AL334: 350 | AM334: 186.4 | AN334: 351 | AO334: -8.3000000000000004e-002 | AP334: 18 | AQ334: 通光转债!
A335: 302 | B335: 110055 | C335: 伊力转债!! | D335: 600197 | E335: 伊力特 | F335: 食品饮料 | G335: 白酒 | H335: 179.96 | I335: 2.7000000000000001e-003 | J335: 2.1600000000000001e-002 | K335: 24.9 | L335: 2.6800000000000001e-002 | M335: 114.3 | N335: 16.41 | O335: 0.18600000000000003 | P335: 151.74 | Q335: 已到 | R335: 3.35年 | S335: 1.35年 | T335: 2.44 | U335: 512 | V335: 1.1499999999999999 | W335: 2.1000000000000001e-002 | X335: 3.1e-002 | Y335: 118 | Z335: 3.26 | AA335: -0.129 | AB335: -0.13500000000000001 | AC335: -0.26700000000000002 | AD335: -0.26899999999999996 | AE335: 96.79 | AF335: 100.24 | AG335: 0.91 | AH335: AA | AI335: 4.0800000000000003e-002 | AJ335: =H335+100*O335 -> 198.56 | AK335: 208.2 | AL335: 330 | AM335: 107.9 | AN335: 326 | AO335: -3.2000000000000001e-002 | AP335: 21 | AQ335: 伊力转债!!
A336: 330 | B336: 123012 | C336: 万顺转债! | D336: 300057 | E336: 万顺新材 | F336: 有色金属 | G336: 铝金属 | H336: 160.33 | I336: -3.5799999999999998e-002 | J336: -2.0999999999999999e-003 | K336: 7.82 | L336: -4.1700000000000001e-002 | M336: 109.3 | N336: 5.27 | O336: 8.0000000000000002e-002 | P336: 148.39 | Q336: 已到 | R336: 2.70年 | S336: 0.70年 | T336: 1.23 | U336: 100 | V336: 0.501 | W336: 2.3e-002 | X336: 3.4000000000000002e-002 | Y336: 53 | Z336: 1.48 | AA336: -0.13400000000000001 | AB336: -0.13900000000000001 | AC336: -0.42700000000000005 | AD336: -0.42999999999999999 | AE336: 96.76 | AF336: 93.54 | AG336: 0.91 | AH336: AA- | AI336: 6.0400000000000002e-002 | AJ336: =H336+100*O336 -> 168.33000000000001 | AK336: 172.3 | AL336: 290 | AM336: 75.5 | AN336: 279 | AO336: 5.4000000000000006e-002 | AP336: 24 | AQ336: 万顺转债!
A337: 148 | B337: 110074 | C337: 精达转债!! | D337: 600577 | E337: 精达股份 | F337: 电子 | G337: 电子产品 | H337: 247.07 | I337: -3.6799999999999999e-002 | J337: 4.3e-003 | K337: 8.37 | L337: -3.3500000000000002e-002 | M337: 116.9 | N337: 3.73 | O337: 0.10099999999999999 | P337: 224.4 | Q337: 已到 | R337: 4.78年 | S337: 2.78年 | T337: 5.1 | U337: 213 | V337: 0.16500000000000001 | W337: 3.1e-002 | X337: 6.9000000000000006e-002 | Y337: 167 | Z337: 3.86 | AA337: -0.14699999999999999 | AB337: -0.152 | AC337: -0.155 | AD337: -0.156 | AE337: 91.99 | AF337: 96.9 | AG337: 0.97 | AH337: AA | AI337: 4.0800000000000003e-002 | AJ337: =H337+100*O337 -> 257.17000000000002 | AK337: 269.7 | AL337: 349 | AM337: 172.8 | AN337: 348 | AO337: 0.129 | AP337: 11 | AQ337: 精达转债!!
A338: 314 | B338: 123018 | C338: 溢利转债! | D338: 300381 | E338: 溢多利 | F338: 医药 | G338: 原料药 | H338: 187.1 | I338: 2.5899999999999999e-002 | J338: -1.6799999999999999e-002 | K338: 10 | L338: 1.21e-002 | M338: 114.3 | N338: 8.25 | O338: 0.54400000000000004 | P338: 121.21 | Q338: 已到 | R338: 3年44天 | S338: 1年44天 | T338: 0.54 | U338: 133 | V338: 1.3100000000000001 | W338: 1.1000000000000001e-002 | X338: 1.3000000000000001e-002 | Y338: 49 | Z338: 1.65 | AA338: -0.14899999999999999 | AB338: -0.155 | AC338: -0.34100000000000003 | AD338: -0.34299999999999997 | AE338: 95.24 | AF338: 95.21 | AG338: 0.75 | AH338: AA- | AI338: 6.1799999999999994e-002 | AJ338: =H338+100*O338 -> 241.5 | AK338: 253 | AL338: 346 | AM338: 157.7 | AN338: 346 | AO338: -3.6000000000000004e-002 | AP338: 10 | AQ338: 溢利转债!
A339: 308 | B339: 113528 | C339: 长城转债!! | D339: 603897 | E339: 长城科技 | F339: 机械装备 | G339: 专用设备 | H339: 203.53 | I339: -5.91e-002 | J339: 6.0999999999999995e-003 | K339: 44.1 | L339: -5.5099999999999996e-002 | M339: 116.8 | N339: 22.35 | O339: 3.1e-002 | P339: 197.32 | Q339: 已到 | R339: 3.32年 | S339: 1.32年 | T339: 4.63 | U339: 263 | V339: 0.27300000000000002 | W339: 5.5999999999999994e-002 | X339: 0.111 | Y339: 82 | Z339: 3.85 | AA339: -0.157 | AB339: -0.16399999999999998 | AC339: -0.317 | AD339: -0.31900000000000001 | AE339: 94.46 | AF339: 96.2 | AG339: 0.96 | AH339: AA- | AI339: 6.1799999999999994e-002 | AJ339: =H339+100*O339 -> 206.63 | AK339: 209.7 | AL339: 333 | AM339: 113.5 | AN339: 329 | AO339: -0.122 | AP339: 34 | AQ339: 长城转债!!
A340: 281 | B340: 113537 | C340: 文灿转债!! | D340: 603348 | E340: 文灿股份 | F340: 汽车 | G340: 零部件制 | H340: 224.82 | I340: -1.2999999999999999e-003 | J340: 2.2000000000000001e-003 | K340: 41.95 | L340: 1.e-003 | M340: 120.7 | N340: 19.28 | O340: 3.3000000000000002e-002 | P340: 217.58 | Q340: 已到 | R340: 3.59年 | S340: 1.59年 | T340: 1.41 | U340: 526 | V340: 1.6599999999999999 | W340: 1.3000000000000001e-002 | X340: 2.7999999999999997e-002 | Y340: 110 | Z340: 4.19 | AA340: -0.16200000000000001 | AB340: -0.17000000000000001 | AC340: -0.28300000000000003 | AD340: -0.28399999999999997 | AE340: 93.34 | AF340: 97.83 | AG340: 0.97 | AH340: AA- | AI340: 6.1799999999999994e-002 | AJ340: =H340+100*O340 -> 228.12 | AK340: 232.1 | AL340: 341 | AM340: 134.2 | AN340: 339 | AO340: 0.245 | AP340: 23 | AQ340: 文灿转债!!
A341: 301 | B341: 123022 | C341: 长信转债!! | D341: 300088 | E341: 长信科技 | F341: 通信互联 | G341: 通信设备 | H341: 213.666 | I341: -1.6000000000000001e-003 | J341: 4.6900000000000004e-002 | K341: 11.61 | L341: 4.6900000000000004e-002 | M341: 114.3 | N341: 6.05 | O341: 0.113 | P341: 191.9 | Q341: 已到 | R341: 3.36年 | S341: 1.36年 | T341: 2.57 | U341: 4313. | V341: 7.2800000000000002 | W341: 9.0000000000000011e-003 | X341: 1.7000000000000001e-002 | Y341: 285 | Z341: 3.78 | AA341: -0.17199999999999999 | AB341: -0.17800000000000002 | AC341: -0.32200000000000001 | AD341: -0.32299999999999995 | AE341: 96.76 | AF341: 100.21 | AG341: 0.97 | AH341: AA | AI341: 4.0800000000000003e-002 | AJ341: =H341+100*O341 -> 224.96600000000001 | AK341: 235.4 | AL341: 343 | AM341: 135.2 | AN341: 340 | AO341: 0.26400000000000001 | AP341: 11 | AQ341: 长信转债!!
A342: 136 | B342: 123067 | C342: 斯莱转债! | D342: 300382 | E342: 斯莱克 | F342: 机械装备 | G342: 专用设备 | H342: 304.501 | I342: -4.9299999999999997e-002 | J342: 5.1999999999999998e-003 | K342: 28.65 | L342: -4.4999999999999998e-002 | M342: 120.8 | N342: 9.36 | O342: -5.0000000000000001e-003 | P342: 306.09 | Q342: 已到 | R342: 4.86年 | S342: 2.86年 | T342: 2.4 | U342: 180 | V342: 0.23999999999999999 | W342: 1.4999999999999999e-002 | X342: 4.4999999999999998e-002 | Y342: 164 | Z342: 14.4 | AA342: -0.17600000000000002 | AB342: -0.18100000000000002 | AC342: -0.17100000000000001 | AD342: -0.17100000000000001 | AE342: 86.64 | AF342: 90.81 | AG342: 0.98 | AH342: AA- | AI342: 6.1799999999999994e-002 | AJ342: =H342+100*O342 -> 304.00099999999998 | AK342: 302.9 | AL342: 356 | AM342: 212.1 | AN342: 356 | AO342: 5.0999999999999997e-002 | AP342: 12 | AQ342: 斯莱转债!
A343: 239 | B343: 128093 | C343: 百川转债!! | D343: 2455 | E343: 百川股份 | F343: 化工 | G343: 化工 | H343: 284.2 | I343: -1.5900000000000001e-002 | J343: -2.5699999999999997e-002 | K343: 15.71 | L343: -4.3200000000000002e-002 | M343: 129.8 | N343: 5.77 | O343: 4.4000000000000004e-002 | P343: 272.27 | Q343: 已到 | R343: 4年58天 | S343: 2年58天 | T343: 1.62 | U343: 910 | V343: 1.8999999999999999 | W343: 1.8000000000000002e-002 | X343: 5.0000000000000003e-002 | Y343: 89 | Z343: 5.02 | AA343: -0.17699999999999999 | AB343: -0.185 | AC343: -0.23199999999999998 | AD343: -0.23399999999999999 | AE343: 93.25 | AF343: 102.17 | AG343: 0.96 | AH343: AA- | AI343: 6.1799999999999994e-002 | AJ343: =H343+100*O343 -> 288.59999999999997 | AK343: 296.1 | AL343: 353 | AM343: 194 | AN343: 354 | AO343: -4.4000000000000004e-002 | AP343: 43 | AQ343: 百川转债!!
A344: 318 | B344: 110048 | C344: 福能转债!! | D344: 600483 | E344: 福能股份 | F344: 能源电力 | G344: 电力供应 | H344: 218.56 | I344: -5.3899999999999997e-002 | J344: -1.e-002 | K344: 16.71 | L344: -6.54e-002 | M344: 113.3 | N344: 7.85 | O344: 2.7000000000000003e-002 | P344: 212.87 | Q344: 已到 | R344: 3年31天 | S344: 1年31天 | T344: 12.8 | U344: 420 | V344: 0.14800000000000002 | W344: 4.0000000000000001e-002 | X344: 8.5000000000000006e-002 | Y344: 320 | Z344: 4.12 | AA344: -0.19500000000000001 | AB344: -0.20100000000000001 | AC344: -0.41399999999999998 | AD344: -0.41600000000000004 | AE344: 98.42 | AF344: 101.9 | AG344: 0.98 | AH344: AA+ | AI344: 3.5799999999999998e-002 | AJ344: =H344+100*O344 -> 221.25999999999999 | AK344: 224.3 | AL344: 337 | AM344: 122.3 | AN344: 335 | AO344: 5.2000000000000005e-002 | AP344: 10 | AQ344: 福能转债!!
A345: 237 | B345: 123042 | C345: 银河转债!! | D345: 300619 | E345: 金银河 | F345: 机械装备 | G345: 专用设备 | H345: 285 | I345: 4.6600000000000003e-002 | J345: -1.32e-002 | K345: 66.62 | L345: 3.4200000000000001e-002 | M345: 115.4 | N345: 24.38 | O345: 4.2999999999999997e-002 | P345: 273.26 | Q345: 已到 | R345: 4.19年 | S345: 2.19年 | T345: 1.33 | U345: 5187. | V345: 12.84 | W345: 2.7000000000000003e-002 | X345: 7.2999999999999995e-002 | Y345: 50 | Z345: 9.38 | AA345: -0.19699999999999998 | AB345: -0.20199999999999999 | AC345: -0.23199999999999998 | AD345: -0.23300000000000001 | AE345: 88.11 | AF345: 86.63 | AG345: 0.98 | AH345: A+ | AI345: 7.2800000000000004e-002 | AJ345: =H345+100*O345 -> 289.30000000000001 | AK345: 296.7 | AL345: 355 | AM345: 208.6 | AN345: 355 | AO345: 0.125 | AP345: 22 | AQ345: 银河转债!!
A346: 315 | B346: 113525 | C346: 台华转债!! | D346: 603055 | E346: 台华新材 | F346: 服装纺织 | G346: 纺织行业 | H346: 235.25 | I346: -5.1100000000000007e-002 | J346: -1.8700000000000001e-002 | K346: 17.43 | L346: -7.1399999999999991e-002 | M346: 114.3 | N346: 7.78 | O346: 5.0000000000000003e-002 | P346: 224.04 | Q346: 已到 | R346: 3年41天 | S346: 1年41天 | T346: 1.83 | U346: 454 | V346: 1.04 | W346: 1.2e-002 | X346: 2.7000000000000003e-002 | Y346: 151 | Z346: 4.23 | AA346: -0.20999999999999999 | AB346: -0.21600000000000003 | AC346: -0.42899999999999999 | AD346: -0.43099999999999999 | AE346: 97.73 | AF346: 101.21 | AG346: 0.98 | AH346: AA | AI346: 4.0800000000000003e-002 | AJ346: =H346+100*O346 -> 240.25 | AK346: 246.5 | AL346: 344 | AM346: 145.3 | AN346: 343 | AO346: 5.4000000000000006e-002 | AP346: 19 | AQ346: 台华转债!!
A347: 289 | B347: 113534 | C347: 鼎胜转债!! | D347: 603876 | E347: 鼎胜新材 | F347: 有色金属 | G347: 小金属 | H347: 252.51 | I347: 1.41e-002 | J347: 4.5000000000000005e-003 | K347: 35.89 | L347: 1.9e-002 | M347: 114.3 | N347: 15.18 | O347: 6.8000000000000005e-002 | P347: 236.43 | Q347: 已到 | R347: 3.42年 | S347: 1.42年 | T347: 4.06 | U347: 1080. | V347: 1.05 | W347: 2.3e-002 | X347: 5.5e-002 | Y347: 174 | Z347: 3.73 | AA347: -0.20999999999999999 | AB347: -0.215 | AC347: -0.35100000000000003 | AD347: -0.35200000000000004 | AE347: 93.54 | AF347: 93.5 | AG347: 0.98 | AH347: AA- | AI347: 6.1799999999999994e-002 | AJ347: =H347+100*O347 -> 259.31 | AK347: 268.6 | AL347: 348 | AM347: 175.1 | AN347: 349 | AO347: -0.14599999999999999 | AP347: 30 | AQ347: 鼎胜转债!!
A348: 218 | B348: 123046 | C348: 天铁转债! | D348: 300587 | E348: 天铁股份 | F348: 铁路 | G348: 铁路设备 | H348: 327.88 | I348: -2.9900000000000003e-002 | J348: -2.0899999999999998e-002 | K348: 18.3 | L348: -5.1799999999999999e-002 | M348: 117.7 | N348: 5.9 | O348: 5.7000000000000002e-002 | P348: 310.17 | Q348: 已到 | R348: 4.36年 | S348: 2.36年 | T348: 0.62 | U348: 85 | V348: 0.40200000000000002 | W348: 6.0000000000000001e-003 | X348: 1.8000000000000002e-002 | Y348: 106 | Z348: 6.22 | AA348: -0.21199999999999999 | AB348: -0.217 | AC348: -0.22699999999999998 | AD348: -0.22800000000000001 | AE348: 89.17 | AF348: 91.16 | AG348: 0.98 | AH348: AA- | AI348: 6.1799999999999994e-002 | AJ348: =H348+100*O348 -> 333.57999999999998 | AK348: 345.6 | AL348: 359 | AM348: 254.4 | AN348: 359 | AO348: -0.11199999999999999 | AP348: 13 | AQ348: 天铁转债!
A349: 336 | B349: 110044 | C349: 广电转债!! | D349: 600831 | E349: 广电网络 | F349: 传媒娱乐 | G349: 影视娱乐 | H349: 208.93 | I349: 5.1000000000000004e-003 | J349: -2.8000000000000004e-003 | K349: 5.24 | L349: 1.3500000000000002e-002 | M349: 111.3 | N349: 6.87 | O349: 1.74 | P349: 76.27 | Q349: 已到 | R349: 2.64年 | S349: 0.64年 | T349: 0.71 | U349: 129 | V349: 0.86199999999999999 | W349: 1.9e-002 | X349: 1.4999999999999999e-002 | Y349: 37 | Z349: 0.99 | AA349: -0.215 | AB349: -0.221 | AC349: -0.65000000000000002 | AD349: -0.65200000000000002 | AE349: 98.69 | AF349: 100.68 | AG349: 0.18 | AH349: AA | AI349: 3.9399999999999998e-002 | AJ349: =H349+100*O349 -> 382.93000000000001 | AK349: 341.6 | AL349: 358 | AM349: 240.9 | AN349: 358 | AO349: -5.0000000000000001e-003 | AP349: 9 | AQ349: 广电转债!!
A350: 188 | B350: 128111 | C350: 中矿转债! | D350: 2738 | E350: 中矿资源 | F350: 有色金属 | G350: 有色行业 | H350: 370.28 | I350: -2.5499999999999998e-002 | J350: 7.8000000000000005e-003 | K350: 55.58 | L350: -1.8000000000000002e-002 | M350: 124.2 | N350: 15.42 | O350: 2.7000000000000003e-002 | P350: 360.44 | Q350: 已到 | R350: 4.59年 | S350: 2.59年 | T350: 1.46 | U350: 346 | V350: 0.61899999999999999 | W350: 8.0000000000000002e-003 | X350: 2.8999999999999998e-002 | Y350: 179 | Z350: 4.83 | AA350: -0.215 | AB350: -0.221 | AC350: -0.21299999999999999 | AD350: -0.21299999999999999 | AE350: 88.39 | AF350: 94.9 | AG350: 0.98 | AH350: AA- | AI350: 6.1799999999999994e-002 | AJ350: =H350+100*O350 -> 372.97999999999996 | AK350: 380.1 | AL350: 362 | AM350: 285.2 | AN350: 362 | AO350: -4.7e-002 | AP350: 10 | AQ350: 中矿转债!
A351: 197 | B351: 113582 | C351: 火炬转债! | D351: 603678 | E351: 火炬电子 | F351: 电子 | G351: 元器件制 | H351: 344.29 | I351: -2.6200000000000001e-002 | J351: -1.95e-002 | K351: 74.3 | L351: -4.6500000000000007e-002 | M351: 114.9 | N351: 24.99 | O351: 0.158 | P351: 297.32 | Q351: 已到 | R351: 4.55年 | S351: 2.55年 | T351: 4.18 | U351: 210 | V351: 0.14300000000000002 | W351: 1.2e-002 | X351: 3.6000000000000004e-002 | Y351: 342 | Z351: 7.7 | AA351: -0.217 | AB351: -0.221 | AC351: -0.21100000000000002 | AD351: -0.21100000000000002 | AE351: 92.84 | AF351: 96.13 | AG351: 0.98 | AH351: AA | AI351: 4.0800000000000003e-002 | AJ351: =H351+100*O351 -> 360.09000000000003 | AK351: 391.3 | AL351: 364 | AM351: 295.1 | AN351: 364 | AO351: 9.0000000000000011e-003 | AP351: 6 | AQ351: 火炬转债!
A352: 313 | B352: 113526 | C352: 联泰转债! | D352: 603797 | E352: 联泰环保 | F352: 城市公用 | G352: 三废处理 | H352: 251.7 | I352: 7.1999999999999998e-003 | J352: -3.2000000000000002e-003 | K352: 6.68 | L352: 6.0000000000000001e-003 | M352: 110.3 | N352: 5.92 | O352: 1.23 | P352: 112.84 | Q352: 已到 | R352: 3.21年 | S352: 1.21年 | T352: 1.93 | U352: 205 | V352: 0.41700000000000004 | W352: 4.9000000000000002e-002 | X352: 5.5999999999999994e-002 | Y352: 39 | Z352: 1.54 | AA352: -0.23000000000000001 | AB352: -0.23399999999999999 | AC352: -0.41299999999999998 | AD352: -0.41399999999999998 | AE352: 97.98 | AF352: 98.75 | AG352: 0.67 | AH352: AA+ | AI352: 3.5799999999999998e-002 | AJ352: =H352+100*O352 -> 374.69999999999999 | AK352: 390.6 | AL352: 363 | AM352: 291.8 | AN352: 363 | AO352: -6.0000000000000001e-003 | AP352: 8 | AQ352: 联泰转债!
A353: 344 | B353: 113504 | C353: 艾华转债!! | D353: 603989 | E353: 艾华集团 | F353: 电子 | G353: 元器件制 | H353: 199.26 | I353: -3.2000000000000002e-003 | J353: 2.2000000000000001e-003 | K353: 41 | L353: -1.e-003 | M353: 109.3 | N353: 20.81 | O353: 1.1000000000000001e-002 | P353: 197.02 | Q353: 已到 | R353: 2.32年 | S353: 0.32年 | T353: 4.75 | U353: 413 | V353: 0.436 | W353: 2.8999999999999998e-002 | X353: 5.7000000000000002e-002 | Y353: 164 | Z353: 5.77 | AA353: -0.23100000000000001 | AB353: -0.23699999999999999 | AC353: <-100% | AD353: <-100% | AE353: 99.92 | AF353: 100.11 | AG353: 0.98 | AH353: AA | AI353: 3.9399999999999998e-002 | AJ353: =H353+100*O353 -> 200.35999999999999 | AK353: 201.5 | AL353: 326 | AM353: 101.4 | AN353: 320 | AO353: 0.159 | AP353: 11 | AQ353: 艾华转债!!
A354: 288 | B354: 113025 | C354: 明泰转债!! | D354: 601677 | E354: 明泰铝业 | F354: 有色金属 | G354: 铝金属 | H354: 278.4 | I354: -8.900000000000001e-002 | J354: -3.3e-003 | K354: 29.45 | L354: -9.3800000000000008e-002 | M354: 114.5 | N354: 11 | O354: 4.0000000000000001e-002 | P354: 267.73 | Q354: 已到 | R354: 3.42年 | S354: 1.42年 | T354: 11 | U354: 255 | V354: 8.1000000000000003e-002 | W354: 5.5e-002 | X354: 0.14599999999999999 | Y354: 201 | Z354: 2 | AA354: -0.23199999999999998 | AB354: -0.23699999999999999 | AC354: -0.373 | AD354: -0.374 | AE354: 96.55 | AF354: 100.14 | AG354: 0.98 | AH354: AA | AI354: 4.0800000000000003e-002 | AJ354: =H354+100*O354 -> 282.39999999999998 | AK354: 289.1 | AL354: 352 | AM354: 188.9 | AN354: 352 | AO354: -9.8000000000000004e-002 | AP354: 21 | AQ354: 明泰转债!!
A355: 280 | B355: 123027 | C355: 蓝晓转债! | D355: 300487 | E355: 蓝晓科技 | F355: 化工 | G355: 化工 | H355: 304.199 | I355: -3.0999999999999999e-003 | J355: -3.0999999999999999e-003 | K355: 74.69 | L355: -6.3e-003 | M355: 118.8 | N355: 29.02 | O355: 0.182 | P355: 257.37 | Q355: 已到 | R355: 3.59年 | S355: 1.59年 | T355: 1.07 | U355: 157 | V355: 0.47600000000000003 | W355: 6.9999999999999993e-003 | X355: 1.7000000000000001e-002 | Y355: 164 | Z355: 8.3 | AA355: -0.23399999999999999 | AB355: -0.23999999999999999 | AC355: -0.34600000000000003 | AD355: -0.34700000000000003 | AE355: 91.76 | AF355: 92.89 | AG355: 0.98 | AH355: A+ | AI355: 7.2800000000000004e-002 | AJ355: =H355+100*O355 -> 322.399 | AK355: 351 | AL355: 360 | AM355: 258.1 | AN355: 360 | AO355: -2.7999999999999997e-002 | AP355: 18 | AQ355: 蓝晓转债!
A356: 325 | B356: 123015 | C356: 蓝盾转债!! | D356: 300297 | E356: 蓝盾股份 | F356: 计算机及 | G356: 软件开发 | H356: 235 | I356: 4.7899999999999998e-002 | J356: -4.7899999999999998e-002 | K356: 3.57 | L356: 4.6900000000000004e-002 | M356: 111.3 | N356: 5.79 | O356: 2.8100000000000001 | P356: 61.66 | Q356: 已到 | R356: 2.77年 | S356: 0.77年 | T356: 1 | U356: 3439. | V356: 14.029999999999999 | W356: 2.2000000000000002e-002 | X356: 1.3999999999999999e-002 | Y356: 45 | Z356: 2.51 | AA356: -0.23899999999999999 | AB356: -0.24399999999999999 | AC356: -0.61199999999999999 | AD356: -0.61299999999999999 | AE356: 91.49 | AF356: 81.5 | AG356: 0 | AH356: BBB- | AI356: 0.12140000000000001 | AJ356: =H356+100*O356 -> 516. | AK356: 408.3 | AL356: 365 | AM356: 316.8 | AN356: 366 | AO356: 2.6000000000000002e-002 | AP356: 15 | AQ356: 蓝盾转债!!
A357: 317 | B357: 128050 | C357: 钧达转债!! | D357: 2865 | E357: 钧达股份 | F357: 汽车 | G357: 零部件制 | H357: 293.059 | I357: -1.9900000000000001e-002 | J357: -2.8999999999999998e-003 | K357: 42.9 | L357: -2.2799999999999997e-002 | M357: 122.7 | N357: 14.8 | O357: 1.1000000000000001e-002 | P357: 289.86 | Q357: 已到 | R357: 3年34天 | S357: 1年34天 | T357: 0.76 | U357: 897 | V357: 3.9700000000000002 | W357: 1.3000000000000001e-002 | X357: 3.7999999999999999e-002 | Y357: 58 | Z357: 5.63 | AA357: -0.249 | AB357: -0.25800000000000001 | AC357: -0.503 | AD357: -0.504 | AE357: 95.63 | AF357: 102.38 | AG357: 1 | AH357: AA- | AI357: 6.1799999999999994e-002 | AJ357: =H357+100*O357 -> 294.15900000000005 | AK357: 296.3 | AL357: 354 | AM357: 193.9 | AN357: 353 | AO357: 0.26000000000000001 | AP357: 48 | AQ357: 钧达转债!!
A358: 350 | B358: 128030 | C358: 天康转债!! | D358: 2100 | E358: 天康生物 | F358: 农业 | G358: 畜牧业 | H358: 208.555 | I358: -1.1599999999999999e-002 | J358: -2.87e-002 | K358: 9.77 | L358: -4.0300000000000002e-002 | M358: 111.3 | N358: 7.39 | O358: 0.57799999999999996 | P358: 132.21 | Q358: 已到 | R358: 2年46天 | S358: 46天 | T358: 0.88 | U358: 48 | V358: 0.25800000000000001 | W358: 8.0000000000000002e-003 | X358: 1.1000000000000001e-002 | Y358: 105 | Z358: 1.87 | AA358: -0.25900000000000001 | AB358: -0.26600000000000001 | AC358: <-100% | AD358: <-100% | AE358: 100.66 | AF358: 102.7 | AG358: 1 | AH358: AA | AI358: 3.9399999999999998e-002 | AJ358: =H358+100*O358 -> 266.35500000000002 | AK358: 284.9 | AL358: 351 | AM358: 182.2 | AN358: 350 | AO358: 8.5000000000000006e-002 | AP358: 10 | AQ358: 天康转债!!
A359: 278 | B359: 123028 | C359: 清水转债!! | D359: 300437 | E359: 清水源 | F359: 城市公用 | G359: 三废处理 | H359: 368.004 | I359: 0.106 | J359: 9.0299999999999991e-002 | K359: 42.77 | L359: 0.20000000000000001 | M359: 121 | N359: 11.84 | O359: 1.9e-002 | P359: 361.23 | Q359: 已到 | R359: 3.62年 | S359: 1.62年 | T359: 2.85 | U359: 17418. | V359: 16.260000000000002 | W359: 2.8999999999999998e-002 | X359: 0.10300000000000001 | Y359: 100 | Z359: 7.92 | AA359: -0.26899999999999996 | AB359: -0.27500000000000002 | AC359: -0.371 | AD359: -0.37200000000000005 | AE359: 91.81 | AF359: 94.49 | AG359: 0.98 | AH359: A+ | AI359: 7.2800000000000004e-002 | AJ359: =H359+100*O359 -> 369.904 | AK359: 374.8 | AL359: 361 | AM359: 280.3 | AN359: 361 | AO359: 0.67900000000000005 | AP359: 47 | AQ359: 清水转债!!
A360: 259 | B360: 113548 | C360: 石英转债! | D360: 603688 | E360: 石英股份 | F360: 电子 | G360: 电子产品 | H360: 436.53 | I360: 3.6200000000000003e-002 | J360: 1.9099999999999999e-002 | K360: 63.89 | L360: 5.5999999999999994e-002 | M360: 123.7 | N360: 14.93 | O360: 2.e-002 | P360: 427.93 | Q360: 已到 | R360: 3.98年 | S360: 1.98年 | T360: 1.2 | U360: 1188. | V360: 2.25 | W360: 5.0000000000000001e-003 | X360: 2.3e-002 | Y360: 226 | Z360: 10.99 | AA360: -0.27500000000000002 | AB360: -0.28199999999999997 | AC360: -0.315 | AD360: -0.315 | AE360: 91.22 | AF360: 97.97 | AG360: 0.99 | AH360: AA- | AI360: 6.1799999999999994e-002 | AJ360: =H360+100*O360 -> 438.52999999999997 | AK360: 445.1 | AL360: 367 | AM360: 347.2 | AN360: 367 | AO360: 0.315 | AP360: 13 | AQ360: 石英转债!
A361: 233 | B361: 128095 | C361: 恩捷转债!! | D361: 2812 | E361: 恩捷股份 | F361: 电子 | G361: 元器件制 | H361: 466.244 | I361: -6.7400000000000002e-002 | J361: -1.34e-002 | K361: 268.32 | L361: -8.1799999999999998e-002 | M361: 114.9 | N361: 64.92 | O361: 0.128 | P361: 413.31 | Q361: 已到 | R361: 4.27年 | S361: 2.27年 | T361: 4.54 | U361: 250 | V361: 0.115 | W361: 2.e-003 | X361: 8.0000000000000002e-003 | Y361: 2395. | Z361: 18.69 | AA361: -0.28300000000000003 | AB361: -0.28699999999999998 | AC361: -0.27300000000000002 | AD361: -0.27399999999999997 | AE361: 93.92 | AF361: 97.24 | AG361: 0.99 | AH361: AA | AI361: 4.0800000000000003e-002 | AJ361: =H361+100*O361 -> 479.04400000000004 | AK361: 519.2 | AL361: 370 | AM361: 421.9 | AN361: 369 | AO361: -5.2999999999999999e-002 | AP361: 14 | AQ361: 恩捷转债!!
A362: 332 | B362: 128041 | C362: 盛路转债!! | D362: 2446 | E362: 盛路通信 | F362: 通信互联 | G362: 通信设备 | H362: 284.803 | I362: 7.0999999999999995e-003 | J362: -8.5000000000000006e-003 | K362: 5.29 | L362: -9.3999999999999986e-003 | M362: 113.3 | N362: 6.82 | O362: 2.6699999999999999 | P362: 77.57 | Q362: 已到 | R362: 2.69年 | S362: 0.69年 | T362: 0.53 | U362: 179 | V362: 1.1799999999999999 | W362: 1.1000000000000001e-002 | X362: 9.0000000000000011e-003 | Y362: 48 | Z362: 1.57 | AA362: -0.29299999999999998 | AB362: -0.29899999999999999 | AC362: -0.75800000000000001 | AD362: -0.76000000000000001 | AE362: 98.48 | AF362: 100.1 | AG362: 0.15 | AH362: AA | AI362: 3.9399999999999998e-002 | AJ362: =H362+100*O362 -> 551.803 | AK362: 492 | AL362: 368 | AM362: 391.9 | AN362: 368 | AO362: -3.4000000000000002e-002 | AP362: 11 | AQ362: 盛路转债!!
A363: 270 | B363: 123031 | C363: 晶瑞转债! | D363: 300655 | E363: 晶瑞电材 | F363: 电子 | G363: 电子行业 | H363: 452.18 | I363: 1.7299999999999999e-002 | J363: -4.1999999999999997e-003 | K363: 39.21 | L363: 1.32e-002 | M363: 115.3 | N363: 10.13 | O363: 0.16800000000000001 | P363: 387.07 | Q363: 已到 | R363: 3.81年 | S363: 1.81年 | T363: 0.53 | U363: 959 | V363: 3.8999999999999999 | W363: 4.0000000000000001e-003 | X363: 1.4999999999999999e-002 | Y363: 134 | Z363: 9.2 | AA363: -0.30399999999999999 | AB363: -0.309 | AC363: -0.35200000000000004 | AD363: -0.35200000000000004 | AE363: 89.55 | AF363: 88.66 | AG363: 0.99 | AH363: A+ | AI363: 7.2800000000000004e-002 | AJ363: =H363+100*O363 -> 468.98000000000002 | AK363: 517.3 | AL363: 369 | AM363: 427.7 | AN363: 370 | AO363: 6.0000000000000001e-003 | AP363: 16 | AQ363: 晶瑞转债!
A364: 365 | B364: 127004 | C364: 模塑转债!! | D364: 700 | E364: 模塑科技 | F364: 汽车 | G364: 零部件制 | H364: 200.8 | I364: -3.5099999999999999e-002 | J364: 3.5099999999999999e-002 | K364: 5.35 | L364: 0.10099999999999999 | M364: 111.8 | N364: 7.24 | O364: 1.72 | P364: 73.9 | Q364: 已到 | R364: 1.57年 | S364: 回售内 | T364: 1.31 | U364: 5445. | V364: 18.699999999999999 | W364: 2.7000000000000003e-002 | X364: 2.e-002 | Y364: 49 | Z364: 2.16 | AA364: -0.314 | AB364: -0.32200000000000001 | AC364: 回售内 | AD364: 回售内 | AE364: 100.3 | AF364: 99.36 | AG364: 0 | AH364: AA- | AI364: 6.0400000000000002e-002 | AJ364: =H364+100*O364 -> 372.80000000000001 | AK364: 327.7 | AL364: 357 | AM364: 227.4 | AN364: 357 | AO364: 0.126 | AP364: 27 | AQ364: 模塑转债!!
A365: 329 | B365: 123013 | C365: 横河转债! | D365: 300539 | E365: 横河精密 | F365: 机械装备 | G365: 专用设备 | H365: 314.8 | I365: 8.5000000000000006e-003 | J365: -6.4000000000000003e-003 | K365: 6.99 | L365: 7.1999999999999998e-003 | M365: 114 | N365: 9.04 | O365: 3.0699999999999998 | P365: 77.32 | Q365: 已到 | R365: 2.72年 | S365: 0.72年 | T365: 0.38 | U365: 186 | V365: 1.54 | W365: 2.5000000000000001e-002 | X365: 1.9e-002 | Y365: 16 | Z365: 3.15 | AA365: -0.315 | AB365: -0.32100000000000001 | AC365: -0.77300000000000002 | AD365: -0.77500000000000002 | AE365: 96.14 | AF365: 94.86 | AG365: 0.29 | AH365: A+ | AI365: 7.1399999999999991e-002 | AJ365: =H365+100*O365 -> 621.79999999999995 | AK365: 552.3 | AL365: 371 | AM365: 456.1 | AN365: 371 | AO365: -1.2e-002 | AP365: 12 | AQ365: 横河转债!
A366: 362 | B366: 128017 | C366: 金禾转债!! | D366: 2597 | E366: 金禾实业 | F366: 化工 | G366: 化工 | H366: 232 | I366: -1.2800000000000001e-002 | J366: 5.1000000000000004e-003 | K366: 47.73 | L366: -7.7000000000000002e-003 | M366: 107.5 | N366: 21.97 | O366: 6.8000000000000005e-002 | P366: 217.25 | Q366: 已到 | R366: 1.99年 | S366: 回售内 | T366: 5.52 | U366: 291 | V366: 0.221 | W366: 2.1000000000000001e-002 | X366: 4.4999999999999998e-002 | Y366: 268 | Z366: 5.15 | AA366: -0.32299999999999995 | AB366: -0.32700000000000001 | AC366: 回售内 | AD366: 回售内 | AE366: 100.25 | AF366: 99.61 | AG366: 0.99 | AH366: AA | AI366: 3.9399999999999998e-002 | AJ366: =H366+100*O366 -> 238.80000000000001 | AK366: 246.7 | AL366: 345 | AM366: 146.5 | AN366: 344 | AO366: 9.3000000000000013e-002 | AP366: 9 | AQ366: 金禾转债!!
A367: 351 | B367: 128029 | C367: 太阳转债!! | D367: 2078 | E367: 太阳纸业 | F367: 造纸包装 | G367: 造纸行业 | H367: 167 | I367: 3.2400000000000005e-002 | J367: 3.0999999999999999e-003 | K367: 11.95 | L367: 3.5499999999999997e-002 | M367: 107 | N367: 8.45 | O367: 0.18100000000000002 | P367: 141.42 | Q367: 已到 | R367: 1年46天 | S367: 回售内 | T367: 9.09 | U367: 224 | V367: 0.14599999999999999 | W367: 2.7999999999999997e-002 | X367: 4.0000000000000001e-002 | Y367: 321 | Z367: 1.69 | AA367: -0.32799999999999996 | AB367: -0.33600000000000002 | AC367: 回售内 | AD367: 回售内 | AE367: 100.17 | AF367: 103.03 | AG367: 1 | AH367: AA+ | AI367: 3.44e-002 | AJ367: =H367+100*O367 -> 185.09999999999999 | AK367: 192.6 | AL367: 320 | AM367: 89.5 | AN367: 308 | AO367: 4.2999999999999997e-002 | AP367: 7 | AQ367: 太阳转债!!
A368: 361 | B368: 113016 | C368: 小康转债!! | D368: 601127 | E368: 小康股份 | F368: 汽车 | G368: 零部件制 | H368: 405.6 | I368: -8.6e-003 | J368: -5.1999999999999998e-003 | K368: 67.4 | L368: -1.3899999999999999e-002 | M368: 109.3 | N368: 16.96 | O368: 2.1000000000000001e-002 | P368: 397.41 | Q368: 已到 | R368: 2年0.1天 | S368: 0.1天 | T368: 2.07 | U368: 877 | V368: 1.03 | W368: 2.e-003 | X368: 9.0000000000000011e-003 | Y368: 917 | Z368: 12.75 | AA368: -0.46700000000000003 | AB368: -0.46999999999999997 | AC368: <-100% | AD368: <-100% | AE368: 100.82 | AF368: 97.46 | AG368: 0.99 | AH368: AA- | AI368: 6.0400000000000002e-002 | AJ368: =H368+100*O368 -> 407.70000000000005 | AK368: 413.8 | AL368: 366 | AM368: 313 | AN368: 365 | AO368: 2.e-002 | AP368: 37 | AQ368: 小康转债!!
A369: 370 | B369: 113009 | C369: 广汽转债! | D369: 601238 | E369: 广汽集团 | F369: 汽车 | G369: 乘用车 | H369: 130.14 | I369: 6.7000000000000002e-003 | J369: 5.9999999999999995e-004 | K369: 17.73 | L369: 7.4000000000000003e-003 | M369: 106 | N369: 13.92 | O369: 2.2000000000000002e-002 | P369: 127.37 | Q369: 已到 | R369: 0.21年 | S369: 回售内 | T369: 25.3 | U369: 436 | V369: 0.13100000000000001 | W369: 1.3999999999999999e-002 | X369: 1.8000000000000002e-002 | Y369: 1836. | Z369: 2.1 | AA369: -0.94999999999999996 | AB369: -0.997 | AC369: 回售内 | AD369: 回售内 | AE369: 100.27 | AF369: 105.36 | AG369: 0.99 | AH369: AAA | AI369: 2.8999999999999998e-002 | AJ369: =H369+100*O369 -> 132.33999999999997 | AK369: 132.9 | AL369: 30 | AM369: 27.5 | AN369: 6 | AO369: 3.6000000000000004e-002 | AP369: 22 | AQ369: 广汽转债!
A370: 305 | B370: 128057 | C370: 博彦转债!* | D370: 2649 | E370: 博彦科技 | F370: 计算机及 | G370: 软件开发 | H370: 135.933 | I370: -1.8600000000000002e-002 | J370: -5.1000000000000004e-003 | K370: 11.55 | L370: -2.3700000000000002e-002 | M370: 116.3 | N370: 8.5 | O370: 0. | P370: 135.88 | Q370: 已到 | R370: 24天 | S370: 无权 | T370: 2.8 | U370: 131 | V370: 0.33799999999999997 | W370: 4.4999999999999998e-002 | X370: 6.2e-002 | Y370: 62 | Z370: 1.95 | AA370: <-100% | AB370: <-100% | AC370: 无权 | AD370: 无权 | AE370: 无权 | AF370: 100.37 | AG370: 1 | AH370: AA- | AI370: 5.7000000000000002e-002 | AJ370: =H370+100*O370 -> 135.93299999999999 | AK370: 136 | AL370: 43 | AM370: 35.6 | AN370: 28 | AO370: 5.0000000000000001e-003 | AP370: 27 | AQ370: 博彦转债!*
A371: 130 | B371: 123069 | C371: 金诺转债!!* | D371: 300505 | E371: 川金诺 | F371: 化工 | G371: 农化 | H371: 185.554 | I371: -0.10099999999999999 | J371: 1.7100000000000001e-002 | K371: 36.29 | L371: -8.3599999999999994e-002 | M371: 125.6 | N371: 19.09 | O371: -2.4e-002 | P371: 190.1 | Q371: 已到 | R371: 2.1天 | S371: 无权 | T371: 0.49 | U371: 614 | V371: 6.25 | W371: 9.0000000000000011e-003 | X371: 1.8000000000000002e-002 | Y371: 53 | Z371: 4.22 | AA371: <-100% | AB371: <-100% | AC371: 无权 | AD371: 无权 | AE371: 无权 | AF371: 100.01 | AG371: 1 | AH371: AA- | AI371: 5.7000000000000002e-002 | AJ371: =H371+100*O371 -> 183.154 | AK371: 181 | AL371: 308 | AM371: 81 | AN371: 293 | AO371: -8.9999999999999997e-002 | AP371: 16 | AQ371: 金诺转债!!*
A372: 63 | B372: 123102 | C372: 华自转债!* | D372: 300490 | E372: 华自科技 | F372: 机械装备 | G372: 机器人及 | H372: 231 | I372: -6.2699999999999992e-002 | J372: -3.2000000000000002e-003 | K372: 21.29 | L372: -6.5799999999999997e-002 | M372: 126.9 | N372: 9.25 | O372: 4.0000000000000001e-003 | P372: 230.16 | Q372: 已到 | R372: 13天 | S372: 无权 | T372: 1.24 | U372: 486 | V372: 1.6499999999999999 | W372: 1.9e-002 | X372: 4.2999999999999997e-002 | Y372: 66 | Z372: 2.97 | AA372: <-100% | AB372: <-100% | AC372: 无权 | AD372: 无权 | AE372: 无权 | AF372: 100.08 | AG372: 1 | AH372: AA- | AI372: 5.7000000000000002e-002 | AJ372: =H372+100*O372 -> 231.40000000000001 | AK372: 231.8 | AL372: 340 | AM372: 131.8 | AN372: 337 | AO372: -2.8999999999999998e-002 | AP372: 24 | AQ372: 华自转债!*
A374: 声明：本数据不构成任何投资建议，宁稳网不对数据的准确性及完整性做出保证，对使用者参考本数据造成的任何直接或间接损失概不负责。
A376: 来源：宁稳网，http://www.ninwin.cn，版权所有，本数据仅供【十七亩，8703】参考，请勿转发，2021-11-05 21:08:12