A1: 序号 | B1: 转债代码 | C1: 转债名称 | D1: 股票代码 | E1: 股票名称 | F1: 行业 | G1: 子行业 | H1: 转债价格 | I1: 涨跌 | J1: 日内套利 | K1: 股价 | L1: 涨跌 | M1: 剩余本息 | N1: 转股价格 | O1: 转股溢价率 | P1: 转股价值 | Q1: 距离转股日 | R1: 剩余年限 | S1: 回售年限 | T1: 转债余额 | U1: 转债成交额 | V1: 转债换手率 | W1: 余额/市值 | X1: 余额/股本 | Y1: 股票市值 | Z1: P/B | AA1: 税前收益率 | AB1: 税后收益率 | AC1: 税前回售收益 | AD1: 税后回售收益 | AE1: 回售价值 | AF1: 纯债价值 | AG1: 弹性 | AH1: 信用 | AI1: 折现率 | AJ1: 双低 | AK1: 老式双低 | AL1: 老式排名 | AM1: 新式双低 | AN1: 新式排名 | AO1: MA20乖离 | AP1: 热门度 | AQ1: 转债名称
A2: 238 | B2: 128062 | C2: 亚药转债! | D2: 2370 | E2: 亚太药业 | F2: 医药 | G2: 化学制药 | H2: 67.079 | I2: 3.5999999999999999e-003 | J2: -3.5999999999999999e-003 | K2: 3.28 | L2: -6.0999999999999995e-003 | M2: 119.8 | N2: 16.25 | O2: 2.3199999999999998 | P2: 20.18 | Q2: 转股中 | R2: 4.23年 | S2: 2.23年 | T2: 9.64 | U2: 4 | V2: 6.0000000000000001e-003 | W2: 0.54799999999999993 | X2: 0.111 | Y2: 18 | Z2: 5.47 | AA2: 0.151 | AB2: 0.14099999999999999 | AC2: 0.20000000000000001 | AD2: 0.19600000000000001 | AE2: 83.43 | AF2: 82.49 | AG2: 0 | AH2: A- | AI2: 9.4299999999999995e-002 | AJ2: =H2+100*O2 -> 299.07899999999995 | AK2: 114 | AL2: 36 | AM2: 30.5 | AN2: 110 | AO2: -0.14000000000000001 | AP2: 87 | AQ2: 亚药转债!
A3: 257 | B3: 113527 | C3: 维格转债! | D3: 603518 | E3: 锦泓集团 | F3: 服装纺织 | G3: 服装行业 | H3: 81.65 | I3: 1.e-003 | J3: -1.1000000000000001e-003 | K3: 4.91 | L3: -4.0999999999999995e-003 | M3: 120.2 | N3: 9.85 | O3: 0.63800000000000001 | P3: 49.85 | Q3: 转股中 | R3: 4年16天 | S3: 2年16天 | T3: 7.46 | U3: 3.5 | V3: 6.0000000000000001e-003 | W3: 0.60199999999999998 | X3: 0.29999999999999999 | Y3: 12 | Z3: 0.78 | AA3: 0.10300000000000001 | AB3: 9.3000000000000013e-002 | AC3: 0.115 | AD3: 0.111 | AE3: 92.64 | AF3: 98.27 | AG3: 0.03 | AH3: AA | AI3: 5.2300000000000006e-002 | AJ3: =H3+100*O3 -> 145.45000000000002 | AK3: 113.5 | AL3: 33 | AM3: 15.2 | AN3: 8 | AO3: -9.5000000000000001e-002 | AP3: 100 | AQ3: 维格转债!
A4: 101 | B4: 127018 | C4: 本钢转债! | D4: 761 | E4: 本钢板材 | F4: 钢铁 | G4: 炼钢 | H4: 78.4 | I4: -2.5000000000000001e-003 | J4: 1.7000000000000001e-003 | K4: 3.14 | L4: -6.3e-003 | M4: 128.6 | N4: 5.03 | O4: 0.25600000000000001 | P4: 62.43 | Q4: 转股中 | R4: 5.47年 | S4: 3.47年 | T4: 68 | U4: 28 | V4: 5.0000000000000001e-003 | W4: 0.55899999999999994 | X4: 0.34899999999999998 | Y4: 122 | Z4: 0.61 | AA4: 9.8000000000000004e-002 | AB4: 8.8000000000000009e-002 | AC4: 8.9099999999999999e-002 | AD4: 8.5099999999999995e-002 | AE4: 89.58 | AF4: 99.62 | AG4: 0.14 | AH4: AAA | AI4: 4.9299999999999997e-002 | AJ4: =H4+100*O4 -> 104. | AK4: 94.4 | AL4: 3 | AM4: -5.2 | AN4: 2 | AO4: -2.6000000000000002e-002 | AP4: 43 | AQ4: 本钢转债!
A5: 186 | B5: 128085 | C5: 鸿达转债! | D5: 2002 | E5: 鸿达兴业 | F5: 化工 | G5: 化工 | H5: 79.796 | I5: 2.0999999999999999e-003 | J5: 1.4000000000000002e-003 | K5: 2.98 | L5: 1.3600000000000001e-002 | M5: 124.4 | N5: 3.92 | O5: 5.0000000000000003e-002 | P5: 76.02 | Q5: 转股中 | R5: 4.94年 | S5: 2.94年 | T5: 24.2 | U5: 67 | V5: 3.5000000000000003e-002 | W5: 0.313 | X5: 0.23800000000000002 | Y5: 77 | Z5: 1.08 | AA5: 9.6199999999999994e-002 | AB5: 8.6899999999999991e-002 | AC5: 8.9600000000000013e-002 | AD5: 8.6800000000000002e-002 | AE5: 88.82 | AF5: 97.21 | AG5: 0.26 | AH5: AA | AI5: 5.2300000000000006e-002 | AJ5: =H5+100*O5 -> 84.796000000000006 | AK5: 83.6 | AL5: 1 | AM5: -13.6 | AN5: 1 | AO5: -6.3e-002 | AP5: 95 | AQ5: 鸿达转债!
A6: 326 | B6: 128013 | C6: 洪涛转债! | D6: 2325 | E6: 洪涛股份 | F6: 建筑 | G6: 装饰工程 | H6: 99 | I6: 2.e-003 | J6: -1.1999999999999999e-003 | K6: 2.34 | L6: 1.3000000000000001e-002 | M6: 109.8 | N6: 3.1 | O6: 0.312 | P6: 75.48 | Q6: 转股中 | R6: 1.55年 | S6: 回售中 | T6: 12 | U6: 9 | V6: 8.0000000000000002e-003 | W6: 0.40999999999999998 | X6: 0.309 | Y6: 29 | Z6: 0.98 | AA6: 6.9699999999999998e-002 | AB6: 5.7099999999999998e-002 | AC6: 回售中 | AD6: 回售中 | AE6: 100.3 | AF6: 100.15 | AG6: 0.07 | AH6: AA- | AI6: 6.1699999999999998e-002 | AJ6: =H6+100*O6 -> 130.19999999999999 | AK6: 122.5 | AL6: 108 | AM6: 22.2 | AN6: 39 | AO6: -0.13100000000000001 | AP6: 94 | AQ6: 洪涛转债!
A7: 90 | B7: 127019 | C7: 国城转债! | D7: 688 | E7: 国城矿业 | F7: 有色金属 | G7: 锌铅镍锡 | H7: 80.7 | I7: -1.5900000000000001e-002 | J7: 1.6200000000000003e-002 | K7: 8.45 | L7: 1.9299999999999998e-002 | M7: 115.1 | N7: 21.07 | O7: 1.01 | P7: 40.1 | Q7: 13天 | R7: 5.52年 | S7: 3.52年 | T7: 8.5 | U7: 17 | V7: 2.4e-002 | W7: 8.8000000000000009e-002 | X7: 3.5000000000000003e-002 | Y7: 96 | Z7: 4.34 | AA7: 6.7799999999999999e-002 | AB7: 6.2400000000000004e-002 | AC7: 7.0900000000000005e-002 | AD7: 6.8699999999999997e-002 | AE7: 88.44 | AF7: 91.03 | AG7: 0.02 | AH7: AA | AI7: 4.4299999999999999e-002 | AJ7: =H7+100*O7 -> 181.69999999999999 | AK7: 121.3 | AL7: 93 | AM7: 30.3 | AN7: 106 | AO7: -0.154 | AP7: 31 | AQ7: 国城转债!
A8: 273 | B8: 128044 | C8: 岭南转债! | D8: 2717 | E8: 岭南股份 | F8: 城市公用 | G8: 生态环境 | H8: 88.4 | I8: -1.0200000000000001e-002 | J8: 1.2199999999999999e-002 | K8: 3.35 | L8: 4.6900000000000004e-002 | M8: 111.3 | N8: 5.91 | O8: 0.56000000000000005 | P8: 56.68 | Q8: 转股中 | R8: 3.60年 | S8: 1.60年 | T8: 6.59 | U8: 65 | V8: 0.109 | W8: 0.129 | X8: 7.2999999999999995e-002 | Y8: 51 | Z8: 1.04 | AA8: 6.7500000000000004e-002 | AB8: 6.1100000000000002e-002 | AC8: 9.01e-002 | AD8: 8.6500000000000007e-002 | AE8: 95.61 | AF8: 96.17 | AG8: 0.04 | AH8: AA | AI8: 4.2300000000000004e-002 | AJ8: =H8+100*O8 -> 144.40000000000001 | AK8: 120.1 | AL8: 84 | AM8: 23.9 | AN8: 54 | AO8: -0.111 | AP8: 34 | AQ8: 岭南转债!
A9: 64 | B9: 110072 | C9: 广汇转债! | D9: 600297 | E9: 广汇汽车 | F9: 汽车 | G9: 分销、售 | H9: 82.02 | I9: 1.61e-002 | J9: 4.0000000000000002e-004 | K9: 2.83 | L9: 6.3899999999999998e-002 | M9: 114.5 | N9: 4.03 | O9: 0.16800000000000001 | P9: 70.22 | Q9: 47天 | R9: 5.61年 | S9: 3.61年 | T9: 33.7 | U9: 220 | V9: 7.9000000000000001e-002 | W9: 0.14699999999999999 | X9: 0.10300000000000001 | Y9: 230 | Z9: 0.58 | AA9: 6.2300000000000001e-002 | AB9: 5.7200000000000001e-002 | AC9: 6.2600000000000003e-002 | AD9: 6.08e-002 | AE9: 88.17 | AF9: 91.07 | AG9: 0.26 | AH9: AA+ | AI9: 4.2300000000000004e-002 | AJ9: =H9+100*O9 -> 98.819999999999993 | AK9: 93.8 | AL9: 2 | AM9: 2.7 | AN9: 3 | AO9: -5.0000000000000003e-002 | AP9: 26 | AQ9: 广汇转债!
A10: 83 | B10: 113595 | C10: 花王转债 | D10: 603007 | E10: 花王股份 | F10: 城市公用 | G10: 生态环境 | H10: 90.79 | I10: -1.1000000000000001e-003 | J10: 2.3e-003 | K10: 4.88 | L10: 4.0999999999999995e-003 | M10: 125.3 | N10: 6.94 | O10: 0.29100000000000004 | P10: 70.32 | Q10: 19天 | R10: 5.53年 | S10: 3.53年 | T10: 3.3 | U10: 6 | V10: 2.e-002 | W10: 0.20100000000000001 | X10: 0.14199999999999999 | Y10: 16 | Z10: 1.47 | AA10: 6.1399999999999996e-002 | AB10: 5.3099999999999994e-002 | AC10: 3.85e-002 | AD10: 3.61e-002 | AE10: 82.72 | AF10: 88.99 | AG10: 0.29 | AH10: AA- | AI10: 6.5299999999999997e-002 | AJ10: =H10+100*O10 -> 119.89000000000001 | AK10: 111.3 | AL10: 21 | AM10: 22.3 | AN10: 40 | AO10: -0.14699999999999999 | AP10: 33 | AQ10: 花王转债
A11: 321 | B11: 128015 | C11: 久其转债! | D11: 2279 | E11: 久其软件 | F11: 计算机及 | G11: 软件开发 | H11: 96.49 | I11: 3.8e-003 | J11: -3.8e-003 | K11: 4.24 | L11: 1.1899999999999999e-002 | M11: 110.8 | N11: 9.48 | O11: 1.1599999999999999 | P11: 44.73 | Q11: 转股中 | R11: 2.41年 | S11: 0.41年 | T11: 7.8 | U11: 4.2 | V11: 6.0000000000000001e-003 | W11: 0.25900000000000001 | X11: 0.11599999999999999 | Y11: 30 | Z11: 4.27 | AA11: 5.9999999999999998e-002 | AB11: 5.0999999999999997e-002 | AC11: 9.2399999999999996e-002 | AD11: 8.6599999999999996e-002 | AE11: 97.51 | AF11: 93.79 | AG11: 0 | AH11: A+ | AI11: 7.2700000000000001e-002 | AJ11: =H11+100*O11 -> 212.48999999999998 | AK11: 148.3 | AL11: 253 | AM11: 50.7 | AN11: 234 | AO11: -0.10800000000000001 | AP11: 60 | AQ11: 久其转债!
A12: 103 | B12: 113589 | C12: 天创转债! | D12: 603608 | E12: 天创时尚 | F12: 服装纺织 | G12: 鞋服行业 | H12: 84.56 | I12: -9.7000000000000003e-003 | J12: 9.7000000000000003e-003 | K12: 6.17 | L12: 0. | M12: 115.3 | N12: 12.44 | O12: 0.70499999999999996 | P12: 49.6 | Q12: 转股中 | R12: 5.46年 | S12: 3.46年 | T12: 6 | U12: 5 | V12: 1.e-002 | W12: 0.22699999999999998 | X12: 0.11199999999999999 | Y12: 26 | Z12: 1.24 | AA12: 5.9699999999999996e-002 | AB12: 5.4199999999999998e-002 | AC12: 5.8799999999999998e-002 | AD12: 5.6500000000000002e-002 | AE12: 88.85 | AF12: 91.45 | AG12: 0.06 | AH12: AA | AI12: 4.4299999999999999e-002 | AJ12: =H12+100*O12 -> 155.06 | AK12: 119.5 | AL12: 75 | AM12: 28.1 | AN12: 89 | AO12: -8.6999999999999994e-002 | AP12: 16 | AQ12: 天创转债!
A13: 65 | B13: 113600 | C13: 新星转债! | D13: 603978 | E13: 深圳新星 | F13: 有色金属 | G13: 有色行业 | H13: 91.69 | I13: -1.9299999999999998e-002 | J13: 1.41e-002 | K13: 15.93 | L13: -2.1499999999999998e-002 | M13: 126 | N13: 23.85 | O13: 0.373 | P13: 66.79 | Q13: 42天 | R13: 5.59年 | S13: 3.59年 | T13: 5.95 | U13: 11 | V13: 2.e-002 | W13: 0.23300000000000001 | X13: 0.156 | Y13: 25 | Z13: 1.67 | AA13: 5.9699999999999996e-002 | AB13: 5.1399999999999994e-002 | AC13: 3.4200000000000001e-002 | AD13: 3.2000000000000001e-002 | AE13: 82.11 | AF13: 89.06 | AG13: 0.24 | AH13: AA- | AI13: 6.5299999999999997e-002 | AJ13: =H13+100*O13 -> 128.99000000000001 | AK13: 116.6 | AL13: 52 | AM13: 27.5 | AN13: 86 | AO13: -8.9999999999999997e-002 | AP13: 12 | AQ13: 新星转债!
A14: 280 | B14: 123011 | C14: 德尔转债! | D14: 300473 | E14: 德尔股份 | F14: 汽车 | G14: 零部件制 | H14: 95.311 | I14: -2.8000000000000004e-003 | J14: 1.6000000000000001e-003 | K14: 21.68 | L14: -1.1399999999999999e-002 | M14: 116.3 | N14: 34.54 | O14: 0.51800000000000002 | P14: 62.77 | Q14: 转股中 | R14: 3.52年 | S14: 1.52年 | T14: 2.51 | U14: 4 | V14: 1.7000000000000001e-002 | W14: 0.10199999999999999 | X14: 6.4000000000000001e-002 | Y14: 25 | Z14: 1.1 | AA14: 5.9299999999999999e-002 | AB14: 5.04e-002 | AC14: 4.6199999999999998e-002 | AD14: 4.2699999999999995e-002 | AE14: 92.75 | AF14: 94.08 | AG14: 0.1 | AH14: AA- | AI14: 6.3299999999999995e-002 | AJ14: =H14+100*O14 -> 147.11100000000002 | AK14: 127.9 | AL14: 156 | AM14: 33.8 | AN14: 138 | AO14: -8.3000000000000004e-002 | AP14: 41 | AQ14: 德尔转债!
A15: 271 | B15: 113519 | C15: 长久转债! | D15: 603569 | E15: 长久物流 | F15: 交通运输 | G15: 物流业 | H15: 96.25 | I15: -3.3e-003 | J15: 6.0999999999999995e-003 | K15: 7.57 | L15: 2.5699999999999997e-002 | M15: 119.3 | N15: 11.15 | O15: 0.41799999999999998 | P15: 67.89 | Q15: 转股中 | R15: 3.83年 | S15: 1.83年 | T15: 6.97 | U15: 2.2 | V15: 3.0000000000000001e-003 | W15: 0.16399999999999998 | X15: 0.11199999999999999 | Y15: 42 | Z15: 1.99 | AA15: 5.8700000000000002e-002 | AB15: 4.9299999999999997e-002 | AC15: 3.3799999999999997e-002 | AD15: 3.0899999999999997e-002 | AE15: 94.69 | AF15: 102.07 | AG15: 0.11 | AH15: AA | AI15: 4.2300000000000004e-002 | AJ15: =H15+100*O15 -> 138.05000000000001 | AK15: 124.6 | AL15: 128 | AM15: 22.5 | AN15: 43 | AO15: -3.1e-002 | AP15: 18 | AQ15: 长久转债!
A16: 157 | B16: 113569 | C16: 科达转债! | D16: 603660 | E16: 苏州科达 | F16: 通信互联 | G16: 物联网 | H16: 91 | I16: -1.9e-003 | J16: 3.2000000000000002e-003 | K16: 7.23 | L16: 2.12e-002 | M16: 120.7 | N16: 14.84 | O16: 0.86799999999999999 | P16: 48.72 | Q16: 转股中 | R16: 5.16年 | S16: 3.16年 | T16: 5.16 | U16: 2.5 | V16: 5.0000000000000001e-003 | W16: 0.14300000000000002 | X16: 7.0000000000000007e-002 | Y16: 36 | Z16: 2.11 | AA16: 5.7500000000000002e-002 | AB16: 5.0000000000000003e-002 | AC16: 4.1500000000000002e-002 | AD16: 3.9e-002 | AE16: 84.5 | AF16: 87.71 | AG16: 0.06 | AH16: AA- | AI16: 6.5299999999999997e-002 | AJ16: =H16+100*O16 -> 177.80000000000001 | AK16: 133.3 | AL16: 191 | AM16: 45.6 | AN16: 207 | AO16: -2.1000000000000001e-002 | AP16: 24 | AQ16: 科达转债!
A17: 226 | B17: 113535 | C17: 大业转债! | D17: 603278 | E17: 大业股份 | F17: 汽车 | G17: 零部件制 | H17: 94.34 | I17: -7.3000000000000001e-003 | J17: 7.8000000000000005e-003 | K17: 7.66 | L17: 7.9000000000000008e-003 | M17: 113.1 | N17: 12.4 | O17: 0.52700000000000002 | P17: 61.77 | Q17: 转股中 | R17: 3.33年 | S17: 1.33年 | T17: 5 | U17: 2.3 | V17: 5.0000000000000001e-003 | W17: 0.22500000000000001 | X17: 0.13900000000000001 | Y17: 22 | Z17: 1.36 | AA17: 5.6799999999999996e-002 | AB17: 4.9100000000000005e-002 | AC17: 5.28e-002 | AD17: 5.0099999999999999e-002 | AE17: 95.75 | AF17: 98.71 | AG17: 0.07 | AH17: AA | AI17: 4.2300000000000004e-002 | AJ17: =H17+100*O17 -> 147.04000000000002 | AK17: 126.9 | AL17: 148 | AM17: 28.2 | AN17: 93 | AO17: -7.2999999999999995e-002 | AP17: 49 | AQ17: 大业转债!
A18: 221 | B18: 123028 | C18: 清水转债 | D18: 300437 | E18: 清水源 | F18: 城市公用 | G18: 三废处理 | H18: 96.35 | I18: 4.1999999999999997e-003 | J18: 1.54e-002 | K18: 9.66 | L18: 5.1100000000000007e-002 | M18: 121.8 | N18: 11.84 | O18: 0.18100000000000002 | P18: 81.59 | Q18: 转股中 | R18: 4.44年 | S18: 2.44年 | T18: 4.56 | U18: 9.1 | V18: 2.1000000000000001e-002 | W18: 0.21299999999999999 | X18: 0.17399999999999999 | Y18: 21 | Z18: 1.37 | AA18: 5.57e-002 | AB18: 4.6600000000000003e-002 | AC18: 3.2899999999999999e-002 | AD18: 2.92e-002 | AE18: 89.42 | AF18: 93.43 | AG18: 0.38 | AH18: AA- | AI18: 6.3299999999999995e-002 | AJ18: =H18+100*O18 -> 114.44999999999999 | AK18: 111.1 | AL18: 20 | AM18: 17.7 | AN18: 15 | AO18: -4.2999999999999997e-002 | AP18: 54 | AQ18: 清水转债
A19: 315 | B19: 113502 | C19: 嘉澳转债! | D19: 603822 | E19: 嘉澳环保 | F19: 化工 | G19: 化工 | H19: 95.71 | I19: 8.9999999999999998e-004 | J19: -8.9999999999999998e-004 | K19: 16.99 | L19: 2.3999999999999998e-003 | M19: 111.3 | N19: 44.79 | O19: 1.52 | P19: 37.93 | Q19: 转股中 | R19: 2.84年 | S19: 0.84年 | T19: 1.85 | U19: 3.2 | V19: 1.8000000000000002e-002 | W19: 0.14800000000000002 | X19: 5.5999999999999994e-002 | Y19: 12 | Z19: 1.66 | AA19: 5.5500000000000001e-002 | AB19: 4.7599999999999996e-002 | AC19: 6.3500000000000001e-002 | AD19: 5.9699999999999996e-002 | AE19: 95.87 | AF19: 94.16 | AG19: 0 | AH19: AA- | AI19: 6.1699999999999998e-002 | AJ19: =H19+100*O19 -> 247.70999999999998 | AK19: 153.5 | AL19: 270 | AM19: 57.6 | AN19: 257 | AO19: -0.19600000000000001 | AP19: 32 | AQ19: 嘉澳转债!
A20: 241 | B20: 113530 | C20: 大丰转债! | D20: 603081 | E20: 大丰实业 | F20: 建筑 | G20: 装饰工程 | H20: 97.6 | I20: -6.0999999999999995e-003 | J20: 5.5000000000000005e-003 | K20: 10.38 | L20: -9.4999999999999998e-003 | M20: 121.6 | N20: 16.64 | O20: 0.56499999999999995 | P20: 62.38 | Q20: 转股中 | R20: 4.21年 | S20: 2.21年 | T20: 6.3 | U20: 5.5 | V20: 9.0000000000000011e-003 | W20: 0.151 | X20: 9.4e-002 | Y20: 42 | Z20: 2.03 | AA20: 5.4800000000000001e-002 | AB20: 4.5400000000000003e-002 | AC20: 2.53e-002 | AD20: 2.23e-002 | AE20: 93.9 | AF20: 102.51 | AG20: 0.07 | AH20: AA | AI20: 4.2300000000000004e-002 | AJ20: =H20+100*O20 -> 154.09999999999999 | AK20: 132.8 | AL20: 186 | AM20: 30.3 | AN20: 108 | AO20: -9.4e-002 | AP20: 34 | AQ20: 大丰转债!
A21: 12 | B21: 123080 | C21: 海波转债! | D21: 300517 | E21: 海波重科 | F21: 建筑 | G21: 建筑工程 | H21: 93.131 | I21: -5.9999999999999995e-004 | J21: 4.5000000000000005e-003 | K21: 14.61 | L21: 1.11e-002 | M21: 126.5 | N21: 20.91 | O21: 0.33299999999999996 | P21: 69.87 | Q21: 5月1天 | R21: 5.90年 | S21: 3.90年 | T21: 2.45 | U21: 14 | V21: 5.9999999999999998e-002 | W21: 0.157 | X21: 0.11 | Y21: 16 | Z21: 2.04 | AA21: 5.45e-002 | AB21: 4.6500000000000007e-002 | AC21: 2.9500000000000002e-002 | AD21: 2.7099999999999999e-002 | AE21: 77.9 | AF21: 82.77 | AG21: 0.35 | AH21: A+ | AI21: 7.6299999999999993e-002 | AJ21: =H21+100*O21 -> 126.431 | AK21: 116.4 | AL21: 49 | AM21: 33.6 | AN21: 134 | AO21: -0.107 | AP21: 5 | AQ21: 海波转债!
A22: 158 | B22: 113568 | C22: 新春转债 | D22: 603667 | E22: 五洲新春 | F22: 机械装备 | G22: 通用设备 | H22: 96.43 | I22: 4.0000000000000002e-004 | J22: 1.2999999999999999e-003 | K22: 7.14 | L22: 4.1999999999999997e-003 | M22: 124.8 | N22: 8.91 | O22: 0.20300000000000001 | P22: 80.13 | Q22: 转股中 | R22: 5年57天 | S22: 3年57天 | T22: 3.3 | U22: 4 | V22: 1.3000000000000001e-002 | W22: 0.158 | X22: 0.127 | Y22: 21 | Z22: 1.21 | AA22: 5.2699999999999997e-002 | AB22: 4.4000000000000004e-002 | AC22: 2.5499999999999998e-002 | AD22: 2.2599999999999999e-002 | AE22: 85.13 | AF22: 90.83 | AG22: 0.4 | AH22: AA- | AI22: 6.5299999999999997e-002 | AJ22: =H22+100*O22 -> 116.73 | AK22: 112.7 | AL22: 30 | AM22: 21.9 | AN22: 37 | AO22: -8.3000000000000004e-002 | AP22: 50 | AQ22: 新春转债
A23: 291 | B23: 128037 | C23: 岩土转债! | D23: 2542 | E23: 中化岩土 | F23: 建筑 | G23: 建筑工程 | H23: 95.797 | I23: 3.0999999999999999e-003 | J23: -3.0999999999999999e-003 | K23: 3.07 | L23: 1.66e-002 | M23: 112.3 | N23: 7.99 | O23: 1.49 | P23: 38.42 | Q23: 转股中 | R23: 3.18年 | S23: 1.18年 | T23: 5.99 | U23: 5 | V23: 9.0000000000000011e-003 | W23: 0.10800000000000001 | X23: 4.2000000000000003e-002 | Y23: 55 | Z23: 1.36 | AA23: 5.2400000000000002e-002 | AB23: 4.4800000000000006e-002 | AC23: 5.4299999999999994e-002 | AD23: 4.99e-002 | AE23: 97.28 | AF23: 98.72 | AG23: 0 | AH23: AA | AI23: 4.2300000000000004e-002 | AJ23: =H23+100*O23 -> 244.797 | AK23: 153.2 | AL23: 268 | AM23: 54.5 | AN23: 245 | AO23: -6.0000000000000001e-003 | AP23: 48 | AQ23: 岩土转债!
A24: 96 | B24: 128118 | C24: 瀛通转债! | D24: 2861 | E24: 瀛通通讯 | F24: 电子 | G24: 电子产品 | H24: 93.3 | I24: -7.1999999999999998e-003 | J24: 1.e-002 | K24: 18.39 | L24: 1.04e-002 | M24: 122.1 | N24: 27.53 | O24: 0.39700000000000002 | P24: 66.8 | Q24: 转股中 | R24: 5.48年 | S24: 3.48年 | T24: 3 | U24: 10 | V24: 3.6000000000000004e-002 | W24: 0.13400000000000001 | X24: 8.900000000000001e-002 | Y24: 22 | Z24: 2.11 | AA24: 5.16e-002 | AB24: 4.41e-002 | AC24: 3.2199999999999999e-002 | AD24: 2.9600000000000001e-002 | AE24: 83.28 | AF24: 87.05 | AG24: 0.27 | AH24: AA- | AI24: 6.5299999999999997e-002 | AJ24: =H24+100*O24 -> 133. | AK24: 119.8 | AL24: 79 | AM24: 32.7 | AN24: 129 | AO24: -0.121 | AP24: 10 | AQ24: 瀛通转债!
A25: 311 | B25: 128022 | C25: 众信转债! | D25: 2707 | E25: 众信旅游 | F25: 旅游餐饮 | G25: 旅游 | H25: 94.35 | I25: -5.0000000000000001e-004 | J25: 1.e-003 | K25: 4.68 | L25: 1.7399999999999999e-002 | M25: 108.8 | N25: 7.92 | O25: 0.59699999999999998 | P25: 59.09 | Q25: 转股中 | R25: 2.90年 | S25: 0.90年 | T25: 4.56 | U25: 27 | V25: 5.9999999999999998e-002 | W25: 0.10800000000000001 | X25: 6.4000000000000001e-002 | Y25: 42 | Z25: 1.99 | AA25: 5.1100000000000007e-002 | AB25: 4.4999999999999998e-002 | AC25: 7.1800000000000003e-002 | AD25: 6.8699999999999997e-002 | AE25: 97.34 | AF25: 97.08 | AG25: 0.03 | AH25: AA | AI25: 4.07e-002 | AJ25: =H25+100*O25 -> 154.04999999999998 | AK25: 129.6 | AL25: 169 | AM25: 32.3 | AN25: 126 | AO25: -0.14499999999999999 | AP25: 26 | AQ25: 众信转债!
A26: 310 | B26: 128023 | C26: 亚太转债! | D26: 2284 | E26: 亚太股份 | F26: 汽车 | G26: 零部件制 | H26: 96.567 | I26: 2.8999999999999998e-003 | J26: -3.2000000000000002e-003 | K26: 5.87 | L26: -1.18e-002 | M26: 111.3 | N26: 10.34 | O26: 0.70099999999999996 | P26: 56.77 | Q26: 转股中 | R26: 2.90年 | S26: 0.90年 | T26: 9.99 | U26: 5 | V26: 5.0000000000000001e-003 | W26: 0.23100000000000001 | X26: 0.13100000000000001 | Y26: 43 | Z26: 1.78 | AA26: 5.0900000000000001e-002 | AB26: 4.3299999999999998e-002 | AC26: 5.0599999999999999e-002 | AD26: 4.7100000000000003e-002 | AE26: 97.55 | AF26: 99.3 | AG26: 0.02 | AH26: AA | AI26: 4.07e-002 | AJ26: =H26+100*O26 -> 166.66699999999997 | AK26: 136.4 | AL26: 204 | AM26: 37.1 | AN26: 158 | AO26: -7.0999999999999994e-002 | AP26: 67 | AQ26: 亚太转债!
A27: 184 | B27: 113557 | C27: 森特转债 | D27: 603098 | E27: 森特股份 | F27: 建筑 | G27: 建筑工程 | H27: 94.7 | I27: 4.0000000000000002e-004 | J27: 1.3300000000000001e-002 | K27: 8.24 | L27: 3.2599999999999997e-002 | M27: 120.3 | N27: 10.11 | O27: 0.16200000000000001 | P27: 81.5 | Q27: 转股中 | R27: 4.95年 | S27: 2.95年 | T27: 6 | U27: 9.4 | V27: 1.6e-002 | W27: 0.152 | X27: 0.124 | Y27: 40 | Z27: 1.91 | AA27: 5.0599999999999999e-002 | AB27: 4.2999999999999997e-002 | AC27: 2.9700000000000001e-002 | AD27: 2.7300000000000001e-002 | AE27: 85.78 | AF27: 89.34 | AG27: 0.42 | AH27: AA- | AI27: 6.3299999999999995e-002 | AJ27: =H27+100*O27 -> 110.90000000000001 | AK27: 107.9 | AL27: 9 | AM27: 18.6 | AN27: 21 | AO27: -5.2999999999999999e-002 | AP27: 39 | AQ27: 森特转债
A28: 131 | B28: 113573 | C28: 纵横转债! | D28: 603602 | E28: 纵横通信 | F28: 通信互联 | G28: 通信设备 | H28: 96.93 | I28: -5.1999999999999998e-003 | J28: 1.18e-002 | K28: 11.84 | L28: 3.0499999999999999e-002 | M28: 124.7 | N28: 18.81 | O28: 0.54000000000000004 | P28: 62.95 | Q28: 转股中 | R28: 5.27年 | S28: 3.27年 | T28: 2.7 | U28: 59 | V28: 0.221 | W28: 0.11199999999999999 | X28: 7.0000000000000007e-002 | Y28: 24 | Z28: 3.58 | AA28: 5.0199999999999995e-002 | AB28: 4.1799999999999997e-002 | AC28: 2.2700000000000001e-002 | AD28: 2.e-002 | AE28: 81.53 | AF28: 85.45 | AG28: 0.22 | AH28: A+ | AI28: 7.6299999999999993e-002 | AJ28: =H28+100*O28 -> 150.93000000000001 | AK28: 130.9 | AL28: 180 | AM28: 45.5 | AN28: 206 | AO28: -4.2000000000000003e-002 | AP28: 21 | AQ28: 纵横转债!
A29: 18 | B29: 113609 | C29: 永安转债 | D29: 603776 | E29: 永安行 | F29: 城市公用 | G29: 其他 | H29: 91 | I29: -3.7000000000000002e-003 | J29: 6.3e-003 | K29: 16.19 | L29: 5.6000000000000008e-003 | M29: 120.5 | N29: 20.34 | O29: 0.14300000000000002 | P29: 79.6 | Q29: 4月23天 | R29: 5.88年 | S29: 3.88年 | T29: 8.86 | U29: 36 | V29: 4.4000000000000004e-002 | W29: 0.29199999999999998 | X29: 0.23199999999999998 | Y29: 30 | Z29: 1.09 | AA29: 4.99e-002 | AB29: 4.3400000000000001e-002 | AC29: 3.3500000000000002e-002 | AD29: 3.15e-002 | AE29: 80.59 | AF29: 83.67 | AG29: 0.47 | AH29: AA- | AI29: 6.5299999999999997e-002 | AJ29: =H29+100*O29 -> 105.3 | AK29: 102.4 | AL29: 6 | AM29: 18.7 | AN29: 22 | AO29: -7.6999999999999999e-002 | AP29: 4 | AQ29: 永安转债
A30: 3 | B30: 123088 | C30: 威唐转债 | D30: 300707 | E30: 威唐工业 | F30: 汽车 | G30: 零部件制 | H30: 91.75 | I30: -3.4999999999999996e-003 | J30: -1.0200000000000001e-002 | K30: 15.03 | L30: -3.1600000000000003e-002 | M30: 121.6 | N30: 20.75 | O30: 0.26700000000000002 | P30: 72.43 | Q30: 5月14天 | R30: 5.93年 | S30: 3.93年 | T30: 3.01 | U30: 57 | V30: 0.20699999999999999 | W30: 0.128 | X30: 9.1999999999999998e-002 | Y30: 24 | Z30: 3.47 | AA30: 4.9699999999999994e-002 | AB30: 4.2999999999999997e-002 | AC30: 3.2799999999999996e-002 | AD30: 3.0499999999999999e-002 | AE30: 77.64 | AF30: 79.38 | AG30: 0.44 | AH30: A+ | AI30: 7.6299999999999993e-002 | AJ30: =H30+100*O30 -> 118.45 | AK30: 111.1 | AL30: 19 | AM30: 31.7 | AN30: 119 | AO30: -0.153 | AP30: 2 | AQ30: 威唐转债
A31: 262 | B31: 113524 | C31: 奇精转债! | D31: 603677 | E31: 奇精机械 | F31: 家电 | G31: 零部件制 | H31: 97.27 | I31: -2.0000000000000001e-004 | J31: -1.7000000000000001e-003 | K31: 10.77 | L31: -8.3000000000000001e-003 | M31: 117.3 | N31: 14.08 | O31: 0.27200000000000002 | P31: 76.49 | Q31: 转股中 | R31: 3.93年 | S31: 1.93年 | T31: 3.3 | U31: 2.9 | V31: 9.0000000000000011e-003 | W31: 0.159 | X31: 0.122 | Y31: 21 | Z31: 2.16 | AA31: 4.9599999999999998e-002 | AB31: 4.1399999999999999e-002 | AC31: 2.69e-002 | AD31: 2.4199999999999999e-002 | AE31: 94.3 | AF31: 99.94 | AG31: 0.23 | AH31: AA | AI31: 4.2300000000000004e-002 | AJ31: =H31+100*O31 -> 124.47 | AK31: 118 | AL31: 63 | AM31: 18.1 | AN31: 19 | AO31: -2.8999999999999998e-002 | AP31: 49 | AQ31: 奇精转债!
A32: 22 | B32: 128138 | C32: 侨银转债 | D32: 2973 | E32: 侨银股份 | F32: 城市公用 | G32: 城市公用 | H32: 103.6 | I32: 1.8e-003 | J32: -2.7000000000000001e-003 | K32: 20.5 | L32: -2.3999999999999998e-003 | M32: 136.5 | N32: 25.43 | O32: 0.28499999999999998 | P32: 80.61 | Q32: 4月16天 | R32: 5.86年 | S32: 3.86年 | T32: 4.2 | U32: 16 | V32: 3.7999999999999999e-002 | W32: 5.0000000000000003e-002 | X32: 4.0000000000000001e-002 | Y32: 84 | Z32: 6.27 | AA32: 4.9100000000000005e-002 | AB32: 3.9e-002 | AC32: 2.e-003 | AD32: -2.0000000000000001e-004 | AE32: 81.15 | AF32: 94.88 | AG32: 0.35 | AH32: AA- | AI32: 6.5299999999999997e-002 | AJ32: =H32+100*O32 -> 132.09999999999999 | AK32: 126.6 | AL32: 144 | AM32: 31.7 | AN32: 120 | AO32: -0.122 | AP32: 4 | AQ32: 侨银转债
A33: 301 | B33: 113017 | C33: 吉视转债! | D33: 601929 | E33: 吉视传媒 | F33: 传媒娱乐 | G33: 影视娱乐 | H33: 94.79 | I33: -2.0000000000000001e-004 | J33: 8.9999999999999998e-004 | K33: 1.93 | L33: 1.0500000000000001e-002 | M33: 108.8 | N33: 2.95 | O33: 0.44900000000000001 | P33: 65.42 | Q33: 转股中 | R33: 2.97年 | S33: 0.97年 | T33: 15.6 | U33: 4.9 | V33: 3.0000000000000001e-003 | W33: 0.26000000000000001 | X33: 0.17000000000000001 | Y33: 60 | Z33: 0.91 | AA33: 4.82e-002 | AB33: 4.2300000000000004e-002 | AC33: 6.2800000000000009e-002 | AD33: 5.9900000000000002e-002 | AE33: 97.28 | AF33: 97.35 | AG33: 0.07 | AH33: AA+ | AI33: 3.8699999999999998e-002 | AJ33: =H33+100*O33 -> 139.69 | AK33: 124.2 | AL33: 125 | AM33: 26.8 | AN33: 79 | AO33: -3.6000000000000004e-002 | AP33: 57 | AQ33: 吉视转债!
A34: 72 | B34: 113597 | C34: 佳力转债! | D34: 603912 | E34: 佳力图 | F34: 机械装备 | G34: 专用设备 | H34: 96.4 | I34: -4.0000000000000001e-003 | J34: 4.8999999999999998e-003 | K34: 13.72 | L34: 5.8999999999999999e-003 | M34: 124.5 | N34: 23.4 | O34: 0.64400000000000002 | P34: 58.63 | Q34: 28天 | R34: 5.56年 | S34: 3.56年 | T34: 3 | U34: 4.6 | V34: 1.6e-002 | W34: 0.10099999999999999 | X34: 5.9000000000000004e-002 | Y34: 30 | Z34: 3.43 | AA34: 4.82e-002 | AB34: 4.0300000000000002e-002 | AC34: 2.1899999999999999e-002 | AD34: 1.95e-002 | AE34: 82.74 | AF34: 88.3 | AG34: 0.15 | AH34: AA- | AI34: 6.5299999999999997e-002 | AJ34: =H34+100*O34 -> 160.80000000000001 | AK34: 134.2 | AL34: 196 | AM34: 45.9 | AN34: 210 | AO34: -7.400000000000001e-002 | AP34: 10 | AQ34: 佳力转债!
A35: 43 | B35: 123069 | C35: 金诺转债! | D35: 300505 | E35: 川金诺 | F35: 化工 | G35: 农化 | H35: 96.6 | I35: -3.2899999999999999e-002 | J35: 4.7999999999999996e-003 | K35: 15.52 | L35: -6.5099999999999991e-002 | M35: 126 | N35: 19.15 | O35: 0.192 | P35: 81.04 | Q35: 3月14天 | R35: 5.77年 | S35: 3.77年 | T35: 3.68 | U35: 38 | V35: 0.107 | W35: 0.18100000000000002 | X35: 0.14699999999999999 | Y35: 20 | Z35: 2.11 | AA35: 4.8000000000000001e-002 | AB35: 4.0099999999999997e-002 | AC35: 1.89e-002 | AD35: 1.6899999999999998e-002 | AE35: 81.21 | AF35: 88.08 | AG35: 0.43 | AH35: AA- | AI35: 6.5299999999999997e-002 | AJ35: =H35+100*O35 -> 115.8 | AK35: 112.2 | AL35: 25 | AM35: 24.1 | AN35: 56 | AO35: -1.3999999999999999e-002 | AP35: 12 | AQ35: 金诺转债!
A36: 253 | B36: 113528 | C36: 长城转债! | D36: 603897 | E36: 长城科技 | F36: 机械装备 | G36: 专用设备 | H36: 97.42 | I36: -4.0000000000000001e-003 | J36: 4.0999999999999995e-003 | K36: 16.96 | L36: 5.9999999999999995e-004 | M36: 117.6 | N36: 23.45 | O36: 0.34700000000000003 | P36: 72.32 | Q36: 转股中 | R36: 4年52天 | S36: 2年52天 | T36: 6.34 | U36: 5.5 | V36: 9.0000000000000011e-003 | W36: 0.20999999999999999 | X36: 0.152 | Y36: 30 | Z36: 1.65 | AA36: 4.7699999999999992e-002 | AB36: 3.9699999999999999e-002 | AC36: 2.8799999999999999e-002 | AD36: 2.53e-002 | AE36: 90.39 | AF36: 91.8 | AG36: 0.26 | AH36: AA- | AI36: 6.3299999999999995e-002 | AJ36: =H36+100*O36 -> 132.12 | AK36: 122.5 | AL36: 107 | AM36: 30.7 | AN36: 112 | AO36: -4.2000000000000003e-002 | AP36: 45 | AQ36: 长城转债!
A37: 227 | B37: 128066 | C37: 亚泰转债! | D37: 2811 | E37: 郑中设计 | F37: 建筑 | G37: 装饰工程 | H37: 96.845 | I37: 3.4000000000000002e-003 | J37: 4.4000000000000003e-003 | K37: 8.22 | L37: 1.7299999999999999e-002 | M37: 117.5 | N37: 9.67 | O37: 0.13900000000000001 | P37: 85.01 | Q37: 转股中 | R37: 4.27年 | S37: 2.27年 | T37: 4.8 | U37: 3.9 | V37: 8.0000000000000002e-003 | W37: 0.21600000000000003 | X37: 0.184 | Y37: 22 | Z37: 1.51 | AA37: 4.7500000000000001e-002 | AB37: 3.9699999999999999e-002 | AC37: 2.9399999999999999e-002 | AD37: 2.6200000000000001e-002 | AE37: 89.59 | AF37: 90.99 | AG37: 0.45 | AH37: AA- | AI37: 6.3299999999999995e-002 | AJ37: =H37+100*O37 -> 110.745 | AK37: 108.7 | AL37: 14 | AM37: 17.7 | AN37: 16 | AO37: -8.900000000000001e-002 | AP37: 61 | AQ37: 亚泰转债!
A38: 220 | B38: 128069 | C38: 华森转债! | D38: 2907 | E38: 华森制药 | F38: 医药 | G38: 化学制药 | H38: 98.049 | I38: -1.4499999999999999e-002 | J38: 7.9000000000000008e-003 | K38: 13.41 | L38: -2.4e-002 | M38: 120 | N38: 18.04 | O38: 0.31900000000000001 | P38: 74.33 | Q38: 转股中 | R38: 4.46年 | S38: 2.46年 | T38: 3 | U38: 6.5 | V38: 2.2000000000000002e-002 | W38: 5.5999999999999994e-002 | X38: 4.0999999999999995e-002 | Y38: 54 | Z38: 5.01 | AA38: 4.7400000000000005e-002 | AB38: 3.9100000000000003e-002 | AC38: 2.1099999999999997e-002 | AD38: 1.84e-002 | AE38: 88.26 | AF38: 91.8 | AG38: 0.28 | AH38: AA- | AI38: 6.3299999999999995e-002 | AJ38: =H38+100*O38 -> 129.94900000000001 | AK38: 121.8 | AL38: 97 | AM38: 30 | AN38: 101 | AO38: -5.5999999999999994e-002 | AP38: 46 | AQ38: 华森转债!
A39: 52 | B39: 128132 | C39: 交建转债! | D39: 2941 | E39: 新疆交建 | F39: 建筑 | G39: 建筑工程 | H39: 91.009 | I39: -2.2000000000000001e-003 | J39: 2.7000000000000001e-003 | K39: 11.1 | L39: 3.5999999999999999e-003 | M39: 117.3 | N39: 18.57 | O39: 0.52300000000000002 | P39: 59.77 | Q39: 2月13天 | R39: 5.69年 | S39: 3.69年 | T39: 8.5 | U39: 4.3 | V39: 6.0000000000000001e-003 | W39: 0.11900000000000001 | X39: 7.0999999999999994e-002 | Y39: 72 | Z39: 2.96 | AA39: 4.6600000000000003e-002 | AB39: 4.0800000000000003e-002 | AC39: 3.5099999999999999e-002 | AD39: 3.3000000000000002e-002 | AE39: 87.98 | AF39: 92.11 | AG39: 0.13 | AH39: AA | AI39: 4.4299999999999999e-002 | AJ39: =H39+100*O39 -> 143.309 | AK39: 122.2 | AL39: 105 | AM39: 30.1 | AN39: 104 | AO39: -3.7000000000000005e-002 | AP39: 12 | AQ39: 交建转债!
A40: 327 | B40: 127003 | C40: 海印转债! | D40: 861 | E40: 海印股份 | F40: 商业零售 | G40: 商场 | H40: 104.95 | I40: 6.3e-003 | J40: -1.4000000000000002e-003 | K40: 2.81 | L40: 1.8100000000000002e-002 | M40: 111.8 | N40: 3 | O40: 0.12 | P40: 93.67 | Q40: 转股中 | R40: 1.41年 | S40: 回售中 | T40: 6.74 | U40: 7.7 | V40: 1.1000000000000001e-002 | W40: 0.10300000000000001 | X40: 9.6999999999999989e-002 | Y40: 65 | Z40: 1.66 | AA40: 4.6300000000000001e-002 | AB40: 3.04e-002 | AC40: 回售中 | AD40: 回售中 | AE40: 100.3 | AF40: 105.74 | AG40: 0.27 | AH40: AA | AI40: 4.07e-002 | AJ40: =H40+100*O40 -> 116.95 | AK40: 116.2 | AL40: 46 | AM40: 10.5 | AN40: 6 | AO40: -2.1000000000000001e-002 | AP40: 75 | AQ40: 海印转债!
A41: 203 | B41: 113546 | C41: 迪贝转债! | D41: 603320 | E41: 迪贝电气 | F41: 家电 | G41: 零部件制 | H41: 97.6 | I41: -1.38e-002 | J41: 1.0700000000000001e-002 | K41: 10.44 | L41: -8.5000000000000006e-003 | M41: 120.6 | N41: 14.1 | O41: 0.318 | P41: 74.04 | Q41: 转股中 | R41: 4.79年 | S41: 2.79年 | T41: 2.3 | U41: 2.4 | V41: 1.1000000000000001e-002 | W41: 0.16899999999999998 | X41: 0.125 | Y41: 14 | Z41: 2.04 | AA41: 4.6199999999999998e-002 | AB41: 3.8300000000000001e-002 | AC41: 2.1700000000000001e-002 | AD41: 1.9099999999999999e-002 | AE41: 84.3 | AF41: 86.22 | AG41: 0.36 | AH41: A+ | AI41: 7.4299999999999991e-002 | AJ41: =H41+100*O41 -> 129.40000000000001 | AK41: 121.2 | AL41: 90 | AM41: 34.9 | AN41: 146 | AO41: -0.151 | AP41: 45 | AQ41: 迪贝转债!
A42: 261 | B42: 113525 | C42: 台华转债! | D42: 603055 | E42: 台华新材 | F42: 服装纺织 | G42: 纺织行业 | H42: 96.04 | I42: -1.e-003 | J42: 1.6000000000000001e-003 | K42: 5.49 | L42: 3.7000000000000002e-003 | M42: 114.3 | N42: 7.83 | O42: 0.37 | P42: 70.11 | Q42: 转股中 | R42: 3.94年 | S42: 1.94年 | T42: 4.69 | U42: 4 | V42: 9.0000000000000011e-003 | W42: 0.10300000000000001 | X42: 7.2000000000000008e-002 | Y42: 46 | Z42: 1.6 | AA42: 4.5999999999999999e-002 | AB42: 3.9e-002 | AC42: 3.3000000000000002e-002 | AD42: 3.0299999999999997e-002 | AE42: 94.26 | AF42: 97.36 | AG42: 0.17 | AH42: AA | AI42: 4.2300000000000004e-002 | AJ42: =H42+100*O42 -> 133.04000000000002 | AK42: 122 | AL42: 101 | AM42: 24.6 | AN42: 64 | AO42: -0.114 | AP42: 22 | AQ42: 台华转债!
A43: 228 | B43: 110058 | C43: 永鼎转债! | D43: 600105 | E43: 永鼎股份 | F43: 通信互联 | G43: 通信设备 | H43: 95.23 | I43: -2.12e-002 | J43: 2.3399999999999997e-002 | K43: 3.21 | L43: 1.9e-002 | M43: 114.9 | N43: 5.04 | O43: 0.495 | P43: 63.69 | Q43: 转股中 | R43: 4.27年 | S43: 2.27年 | T43: 2.61 | U43: 118 | V43: 0.46500000000000002 | W43: 5.9000000000000004e-002 | X43: 3.7999999999999999e-002 | Y43: 44 | Z43: 1.58 | AA43: 4.5999999999999999e-002 | AB43: 3.9199999999999999e-002 | AC43: 3.4799999999999998e-002 | AD43: 3.1899999999999998e-002 | AE43: 93.58 | AF43: 96.64 | AG43: 0.12 | AH43: AA | AI43: 4.2300000000000004e-002 | AJ43: =H43+100*O43 -> 144.73000000000002 | AK43: 126.8 | AL43: 146 | AM43: 30.1 | AN43: 103 | AO43: -7.4999999999999997e-002 | AP43: 52 | AQ43: 永鼎转债!
A44: 62 | B44: 128127 | C44: 文科转债 | D44: 2775 | E44: 文科园林 | F44: 城市公用 | G44: 生态环境 | H44: 94.8 | I44: 2.0999999999999999e-003 | J44: -7.7000000000000002e-003 | K44: 4.66 | L44: -1.06e-002 | M44: 121.3 | N44: 5.37 | O44: 9.1999999999999998e-002 | P44: 86.78 | Q44: 52天 | R44: 5.61年 | S44: 3.61年 | T44: 9.5 | U44: 12 | V44: 1.3000000000000001e-002 | W44: 0.39799999999999996 | X44: 0.34499999999999997 | Y44: 24 | Z44: 0.9 | AA44: 4.5899999999999996e-002 | AB44: 3.9e-002 | AC44: 2.5699999999999997e-002 | AD44: 2.3399999999999997e-002 | AE44: 82.29 | AF44: 85.72 | AG44: 0.53 | AH44: AA- | AI44: 6.5299999999999997e-002 | AJ44: =H44+100*O44 -> 104. | AK44: 102.8 | AL44: 8 | AM44: 17.1 | AN44: 11 | AO44: -5.0000000000000003e-002 | AP44: 28 | AQ44: 文科转债
A45: 5 | B45: 123084 | C45: N高澜转 | D45: 300499 | E45: 高澜股份 | F45: 能源电力 | G45: 电力设备 | H45: 94.162 | I45: -5.8400000000000001e-002 | J45: 0. | K45: 9.75 | L45: -2.6000000000000002e-002 | M45: 121.9 | N45: 11.36 | O45: 9.6999999999999989e-002 | P45: 85.83 | Q45: 5月9天 | R45: 5.92年 | S45: 3.92年 | T45: 2.8 | U45: 146 | V45: 0.54700000000000004 | W45: 0.10300000000000001 | X45: 8.900000000000001e-002 | Y45: 27 | Z45: 3.48 | AA45: 4.5599999999999995e-002 | AB45: 3.8900000000000004e-002 | AC45: 2.69e-002 | AD45: 2.4500000000000001e-002 | AE45: 77.88 | AF45: 79.68 | AG45: 0.6 | AH45: A+ | AI45: 7.6299999999999993e-002 | AJ45: =H45+100*O45 -> 103.86200000000001 | AK45: 102.5 | AL45: 7 | AM45: 22.8 | AN45: 45 | AO45: -5.0999999999999997e-002 | AP45: 1 | AQ45: N高澜转
A46: 208 | B46: 128074 | C46: 游族转债!! | D46: 2174 | E46: 游族网络 | F46: 通信互联 | G46: 互联网 | H46: 97.67 | I46: 3.04e-002 | J46: -2.0999999999999999e-003 | K46: 14.15 | L46: 6.8699999999999997e-002 | M46: 119.9 | N46: 16.97 | O46: 0.17100000000000001 | P46: 83.38 | Q46: 转股中 | R46: 4.71年 | S46: 2.71年 | T46: 6.83 | U46: 202 | V46: 0.29799999999999999 | W46: 5.2999999999999999e-002 | X46: 4.4000000000000004e-002 | Y46: 130 | Z46: 2.29 | AA46: 4.5400000000000003e-002 | AB46: 3.7599999999999995e-002 | AC46: 2.0199999999999999e-002 | AD46: 1.78e-002 | AE46: 91.9 | AF46: 99.01 | AG46: 0.41 | AH46: AA | AI46: 4.2300000000000004e-002 | AJ46: =H46+100*O46 -> 114.77000000000001 | AK46: 112 | AL46: 23 | AM46: 12.9 | AN46: 7 | AO46: 2.e-003 | AP46: 23 | AQ46: 游族转债!!
A47: 244 | B47: 123023 | C47: 迪森转债! | D47: 300335 | E47: 迪森股份 | F47: 能源电力 | G47: 电力供应 | H47: 95.8 | I47: -1.e-003 | J47: -1.1000000000000001e-003 | K47: 5.08 | L47: -9.7000000000000003e-003 | M47: 114.9 | N47: 7.04 | O47: 0.32799999999999996 | P47: 72.16 | Q47: 转股中 | R47: 4.19年 | S47: 3.19年 | T47: 5.29 | U47: 17 | V47: 3.5000000000000003e-002 | W47: 0.27899999999999997 | X47: 0.20100000000000001 | Y47: 19 | Z47: 1.36 | AA47: 4.53e-002 | AB47: 3.85e-002 | AC47: 2.8799999999999999e-002 | AD47: 2.5600000000000001e-002 | AE47: 91.77 | AF47: 96.94 | AG47: 0.22 | AH47: AA | AI47: 4.2300000000000004e-002 | AJ47: =H47+100*O47 -> 128.59999999999999 | AK47: 119.4 | AL47: 72 | AM47: 22.5 | AN47: 42 | AO47: -0.14300000000000002 | AP47: 59 | AQ47: 迪森转债!
A48: 213 | B48: 128072 | C48: 翔鹭转债! | D48: 2842 | E48: 翔鹭钨业 | F48: 有色金属 | G48: 小金属 | H48: 94.211 | I48: -1.4499999999999999e-002 | J48: 3.4999999999999996e-003 | K48: 9.35 | L48: -6.59e-002 | M48: 115.1 | N48: 15.34 | O48: 0.54600000000000004 | P48: 60.95 | Q48: 转股中 | R48: 4.61年 | S48: 2.61年 | T48: 3.02 | U48: 4.6 | V48: 1.6e-002 | W48: 0.11800000000000001 | X48: 7.2000000000000008e-002 | Y48: 26 | Z48: 2.82 | AA48: 4.53e-002 | AB48: 3.9e-002 | AC48: 3.4500000000000003e-002 | AD48: 3.1899999999999998e-002 | AE48: 87.35 | AF48: 87.22 | AG48: 0.17 | AH48: AA- | AI48: 6.3299999999999995e-002 | AJ48: =H48+100*O48 -> 148.81100000000001 | AK48: 127.5 | AL48: 152 | AM48: 40.1 | AN48: 172 | AO48: -0.13100000000000001 | AP48: 29 | AQ48: 翔鹭转债!
A49: 236 | B49: 128063 | C49: 未来转债 | D49: 2631 | E49: 德尔未来 | F49: 其他 | G49: 家居用品 | H49: 107.005 | I49: -1.09e-002 | J49: -3.8e-003 | K49: 7.79 | L49: -3.4700000000000002e-002 | M49: 128.2 | N49: 8.63 | O49: 0.185 | P49: 90.27 | Q49: 转股中 | R49: 4.23年 | S49: 3.23年 | T49: 6.3 | U49: 3.9 | V49: 6.0000000000000001e-003 | W49: 0.122 | X49: 0.11 | Y49: 52 | Z49: 2.96 | AA49: 4.4999999999999998e-002 | AB49: 3.3399999999999999e-002 | AC49: 5.1999999999999998e-003 | AD49: 2.0000000000000001e-004 | AE49: 88.82 | AF49: 99.66 | AG49: 0.43 | AH49: AA- | AI49: 6.3299999999999995e-002 | AJ49: =H49+100*O49 -> 125.505 | AK49: 123.7 | AL49: 118 | AM49: 24.1 | AN49: 57 | AO49: -5.0000000000000001e-003 | AP49: 35 | AQ49: 未来转债
A50: 230 | B50: 127013 | C50: 创维转债! | D50: 810 | E50: 创维数字 | F50: 电子 | G50: 电子产品 | H50: 98.105 | I50: -8.9999999999999998e-004 | J50: 2.5000000000000001e-003 | K50: 7.8 | L50: 1.1699999999999999e-002 | M50: 117.9 | N50: 11.39 | O50: 0.433 | P50: 68.48 | Q50: 转股中 | R50: 4.27年 | S50: 2.27年 | T50: 9.78 | U50: 6.5 | V50: 6.9999999999999993e-003 | W50: 0.11800000000000001 | X50: 8.1000000000000003e-002 | Y50: 83 | Z50: 2.14 | AA50: 4.4999999999999998e-002 | AB50: 3.7100000000000001e-002 | AC50: 2.2099999999999998e-002 | AD50: 1.9199999999999998e-002 | AE50: 93.59 | AF50: 99.16 | AG50: 0.14 | AH50: AA | AI50: 4.2300000000000004e-002 | AJ50: =H50+100*O50 -> 141.405 | AK50: 127.7 | AL50: 155 | AM50: 28.6 | AN50: 94 | AO50: -4.4000000000000004e-002 | AP50: 25 | AQ50: 创维转债!
A51: 163 | B51: 113566 | C51: 翔港转债! | D51: 603499 | E51: 翔港科技 | F51: 造纸包装 | G51: 包装材料 | H51: 100.09 | I51: -7.0999999999999995e-003 | J51: 4.1999999999999997e-003 | K51: 7.53 | L51: -9.1999999999999998e-003 | M51: 124.5 | N51: 10.77 | O51: 0.43200000000000005 | P51: 69.92 | Q51: 转股中 | R51: 5年51天 | S51: 3年51天 | T51: 1.61 | U51: 3.5 | V51: 2.2000000000000002e-002 | W51: 0.106 | X51: 7.400000000000001e-002 | Y51: 15 | Z51: 2.65 | AA51: 4.4500000000000005e-002 | AB51: 3.6000000000000004e-002 | AC51: 1.38e-002 | AD51: 1.1000000000000001e-002 | AE51: 82.39 | AF51: 86.15 | AG51: 0.32 | AH51: A+ | AI51: 7.6299999999999993e-002 | AJ51: =H51+100*O51 -> 143.29000000000002 | AK51: 130.3 | AL51: 175 | AM51: 44.1 | AN51: 197 | AO51: -0.111 | AP51: 28 | AQ51: 翔港转债!
A52: 152 | B52: 128100 | C52: 搜特转债! | D52: 2503 | E52: 搜于特 | F52: 服装纺织 | G52: 服装行业 | H52: 94.099 | I52: -2.7000000000000001e-003 | J52: -7.1999999999999998e-003 | K52: 2.49 | L52: -2.35e-002 | M52: 117.3 | N52: 2.9 | O52: 9.6000000000000002e-002 | P52: 85.86 | Q52: 转股中 | R52: 5.17年 | S52: 3.17年 | T52: 8 | U52: 974 | V52: 1.27 | W52: 0.10400000000000001 | X52: 8.900000000000001e-002 | Y52: 77 | Z52: 1.4 | AA52: 4.4500000000000005e-002 | AB52: 3.8199999999999998e-002 | AC52: 3.0200000000000001e-002 | AD52: 2.7799999999999998e-002 | AE52: 89.96 | AF52: 94.18 | AG52: 0.42 | AH52: AA | AI52: 4.4299999999999999e-002 | AJ52: =H52+100*O52 -> 103.699 | AK52: 102.3 | AL52: 5 | AM52: 8.2 | AN52: 4 | AO52: 0.105 | AP52: 45 | AQ52: 搜特转债!
A53: 277 | B53: 128042 | C53: 凯中转债! | D53: 2823 | E53: 凯中精密 | F53: 能源电力 | G53: 电力设备 | H53: 100.052 | I53: 0. | J53: 3.3e-003 | K53: 10.36 | L53: 1.37e-002 | M53: 116.3 | N53: 12.96 | O53: 0.252 | P53: 79.94 | Q53: 转股中 | R53: 3.56年 | S53: 1.56年 | T53: 4.16 | U53: 2.7 | V53: 6.9999999999999993e-003 | W53: 0.14000000000000001 | X53: 0.11199999999999999 | Y53: 30 | Z53: 2.2 | AA53: 4.41e-002 | AB53: 3.5499999999999997e-002 | AC53: 1.6e-002 | AD53: 1.2699999999999999e-002 | AE53: 95.77 | AF53: 100.65 | AG53: 0.24 | AH53: AA | AI53: 4.2300000000000004e-002 | AJ53: =H53+100*O53 -> 125.25200000000001 | AK53: 120.2 | AL53: 85 | AM53: 19.5 | AN53: 25 | AO53: -1.9e-002 | AP53: 30 | AQ53: 凯中转债!
A54: 307 | B54: 123004 | C54: 铁汉转债! | D54: 300197 | E54: 铁汉生态 | F54: 城市公用 | G54: 生态环境 | H54: 96.006 | I54: 3.2000000000000002e-003 | J54: 2.5999999999999999e-003 | K54: 2.93 | L54: 4.2699999999999995e-002 | M54: 108.8 | N54: 3.98 | O54: 0.30399999999999999 | P54: 73.62 | Q54: 转股中 | R54: 2.94年 | S54: 0.94年 | T54: 8.03 | U54: 15 | V54: 2.e-002 | W54: 0.11599999999999999 | X54: 8.5999999999999993e-002 | Y54: 69 | Z54: 1.33 | AA54: 4.4000000000000004e-002 | AB54: 3.8100000000000002e-002 | AC54: 5.2000000000000005e-002 | AD54: 4.9100000000000005e-002 | AE54: 97.16 | AF54: 96.9 | AG54: 0.14 | AH54: AA | AI54: 4.07e-002 | AJ54: =H54+100*O54 -> 126.40600000000001 | AK54: 118.4 | AL54: 67 | AM54: 21.2 | AN54: 31 | AO54: -5.9000000000000004e-002 | AP54: 44 | AQ54: 铁汉转债!
A55: 185 | B55: 128087 | C55: 孚日转债! | D55: 2083 | E55: 孚日股份 | F55: 服装纺织 | G55: 家纺 | H55: 91.65 | I55: -1.6000000000000001e-003 | J55: 3.8e-003 | K55: 4.47 | L55: 9.0000000000000011e-003 | M55: 112.9 | N55: 6.3 | O55: 0.29199999999999998 | P55: 70.95 | Q55: 转股中 | R55: 4.94年 | S55: 2.94年 | T55: 6.5 | U55: 5.1 | V55: 9.0000000000000011e-003 | W55: 0.16 | X55: 0.114 | Y55: 41 | Z55: 1.08 | AA55: 4.4000000000000004e-002 | AB55: 3.8800000000000001e-002 | AC55: 4.0000000000000001e-002 | AD55: 3.7699999999999997e-002 | AE55: 91.02 | AF55: 92.36 | AG55: 0.24 | AH55: AA | AI55: 4.2300000000000004e-002 | AJ55: =H55+100*O55 -> 120.85000000000001 | AK55: 112.3 | AL55: 27 | AM55: 20 | AN55: 26 | AO55: -2.3e-002 | AP55: 52 | AQ55: 孚日转债!
A56: 19 | B56: 123077 | C56: 汉得转债 | D56: 300170 | E56: 汉得信息 | F56: 计算机及 | G56: 软件开发 | H56: 98 | I56: -1.8e-003 | J56: 1.11e-002 | K56: 7.43 | L56: 3.3399999999999999e-002 | M56: 125.5 | N56: 9.72 | O56: 0.28199999999999997 | P56: 76.44 | Q56: 4月19天 | R56: 5.87年 | S56: 3.87年 | T56: 9.37 | U56: 13 | V56: 1.3999999999999999e-002 | W56: 0.14300000000000002 | X56: 0.109 | Y56: 66 | Z56: 2.07 | AA56: 4.3799999999999999e-002 | AB56: 3.6200000000000003e-002 | AC56: 1.4499999999999999e-002 | AD56: 1.26e-002 | AE56: 87.29 | AF56: 97.72 | AG56: 0.28 | AH56: AA | AI56: 4.4299999999999999e-002 | AJ56: =H56+100*O56 -> 126.19999999999999 | AK56: 119.6 | AL56: 76 | AM56: 21.8 | AN56: 36 | AO56: -8.900000000000001e-002 | AP56: 6 | AQ56: 汉得转债
A57: 75 | B57: 113596 | C57: 城地转债! | D57: 603887 | E57: 城地香江 | F57: 通信互联 | G57: 通信设备 | H57: 90.03 | I57: -1.0700000000000001e-002 | J57: 8.8999999999999999e-003 | K57: 16.1 | L57: -1.29e-002 | M57: 113.5 | N57: 29.21 | O57: 0.63300000000000001 | P57: 55.12 | Q57: 27天 | R57: 5.55年 | S57: 3.55年 | T57: 12 | U57: 14 | V57: 1.3000000000000001e-002 | W57: 0.19800000000000001 | X57: 0.109 | Y57: 60 | Z57: 1.67 | AA57: 4.3499999999999997e-002 | AB57: 3.8800000000000001e-002 | AC57: 3.95e-002 | AD57: 3.73e-002 | AE57: 82.27 | AF57: 80.49 | AG57: 0.14 | AH57: AA- | AI57: 6.5299999999999997e-002 | AJ57: =H57+100*O57 -> 153.32999999999998 | AK57: 124.9 | AL57: 130 | AM57: 42.7 | AN57: 188 | AO57: -0.10199999999999999 | AP57: 13 | AQ57: 城地转债!
A58: 251 | B58: 110052 | C58: 贵广转债! | D58: 600996 | E58: 贵广网络 | F58: 传媒娱乐 | G58: 影视娱乐 | H58: 100.02 | I58: 1.e-004 | J58: 1.5e-003 | K58: 5.15 | L58: 1.78e-002 | M58: 118.5 | N58: 7.94 | O58: 0.54200000000000004 | P58: 64.86 | Q58: 转股中 | R58: 4年56天 | S58: 2年56天 | T58: 15.3 | U58: 6.9 | V58: 5.0000000000000001e-003 | W58: 0.28199999999999997 | X58: 0.183 | Y58: 54 | Z58: 1.2 | AA58: 4.2699999999999995e-002 | AB58: 3.44e-002 | AC58: 1.6500000000000001e-002 | AD58: 1.32e-002 | AE58: 94.86 | AF58: 100.97 | AG58: 0.09 | AH58: AA+ | AI58: 4.0300000000000002e-002 | AJ58: =H58+100*O58 -> 154.22 | AK58: 135.2 | AL58: 200 | AM58: 34.2 | AN58: 141 | AO58: -6.4000000000000001e-002 | AP58: 20 | AQ58: 贵广转债!
A59: 68 | B59: 113599 | C59: 嘉友转债 | D59: 603871 | E59: 嘉友国际 | F59: 交通运输 | G59: 物流业 | H59: 100.5 | I59: -5.9999999999999995e-004 | J59: 9.3999999999999986e-003 | K59: 20.58 | L59: 1.9799999999999998e-002 | M59: 126 | N59: 24.82 | O59: 0.21199999999999999 | P59: 82.92 | Q59: 41天 | R59: 5.57年 | S59: 3.57年 | T59: 7.2 | U59: 8.1 | V59: 1.1000000000000001e-002 | W59: 0.159 | X59: 0.13200000000000001 | Y59: 45 | Z59: 2.27 | AA59: 4.2199999999999994e-002 | AB59: 3.4099999999999998e-002 | AC59: 9.1000000000000004e-003 | AD59: 6.9999999999999993e-003 | AE59: 82.23 | AF59: 89.18 | AG59: 0.44 | AH59: AA- | AI59: 6.5299999999999997e-002 | AJ59: =H59+100*O59 -> 121.7 | AK59: 118.1 | AL59: 64 | AM59: 28.9 | AN59: 97 | AO59: -4.2999999999999997e-002 | AP59: 16 | AQ59: 嘉友转债
A60: 113 | B60: 123054 | C60: 思特转债 | D60: 300608 | E60: 思特奇 | F60: 通信互联 | G60: 通信设备 | H60: 97.9 | I60: -2.e-003 | J60: 8.3999999999999995e-003 | K60: 12.58 | L60: 1.6200000000000003e-002 | M60: 121.7 | N60: 16.49 | O60: 0.28300000000000003 | P60: 76.29 | Q60: 转股中 | R60: 5.42年 | S60: 3.42年 | T60: 2.71 | U60: 11 | V60: 3.9e-002 | W60: 0.13699999999999998 | X60: 0.10400000000000001 | Y60: 20 | Z60: 2.62 | AA60: 4.2000000000000003e-002 | AB60: 3.4700000000000002e-002 | AC60: 1.89e-002 | AD60: 1.6299999999999999e-002 | AE60: 83.63 | AF60: 87.11 | AG60: 0.39 | AH60: AA- | AI60: 6.5299999999999997e-002 | AJ60: =H60+100*O60 -> 126.20000000000002 | AK60: 119.5 | AL60: 74 | AM60: 32.4 | AN60: 127 | AO60: -0.114 | AP60: 18 | AQ60: 思特转债
A61: 99 | B61: 113591 | C61: 胜达转债! | D61: 603687 | E61: 大胜达 | F61: 造纸包装 | G61: 包装用纸 | H61: 98.05 | I61: -1.6500000000000001e-002 | J61: 1.6500000000000001e-002 | K61: 8.87 | L61: 0. | M61: 122.2 | N61: 10.46 | O61: 0.156 | P61: 84.8 | Q61: 转股中 | R61: 5.48年 | S61: 3.48年 | T61: 5.5 | U61: 7.6 | V61: 1.3999999999999999e-002 | W61: 0.151 | X61: 0.128 | Y61: 36 | Z61: 2.35 | AA61: 4.1900000000000007e-002 | AB61: 3.4599999999999999e-002 | AC61: 1.6799999999999999e-002 | AD61: 1.4499999999999999e-002 | AE61: 82.91 | AF61: 87.09 | AG61: 0.5 | AH61: AA- | AI61: 6.5299999999999997e-002 | AJ61: =H61+100*O61 -> 113.64999999999999 | AK61: 111.3 | AL61: 22 | AM61: 24.2 | AN61: 59 | AO61: -0.10300000000000001 | AP61: 20 | AQ61: 胜达转债!
A62: 173 | B62: 128093 | C62: 百川转债! | D62: 2455 | E62: 百川股份 | F62: 化工 | G62: 化工 | H62: 106.56 | I62: -3.39e-002 | J62: -1.72e-002 | K62: 5.57 | L62: -9.7200000000000009e-002 | M62: 129.8 | N62: 5.87 | O62: 0.12300000000000001 | P62: 94.89 | Q62: 转股中 | R62: 4.99年 | S62: 2.99年 | T62: 5.2 | U62: 22 | V62: 4.0000000000000001e-002 | W62: 0.18100000000000002 | X62: 0.17100000000000001 | Y62: 29 | Z62: 2.23 | AA62: 4.1700000000000001e-002 | AB62: 3.1400000000000004e-002 | AC62: 1.e-003 | AD62: -3.2000000000000002e-003 | AE62: 88.35 | AF62: 96.55 | AG62: 0.53 | AH62: AA- | AI62: 6.3299999999999995e-002 | AJ62: =H62+100*O62 -> 118.86 | AK62: 118.2 | AL62: 66 | AM62: 21.7 | AN62: 34 | AO62: -5.0000000000000003e-002 | AP62: 48 | AQ62: 百川转债!
A63: 309 | B63: 128025 | C63: 特一转债! | D63: 2728 | E63: 特一药业 | F63: 医药 | G63: 化学制药 | H63: 96.867 | I63: -3.4000000000000002e-003 | J63: 2.5000000000000001e-003 | K63: 11.12 | L63: -5.4000000000000003e-003 | M63: 108.8 | N63: 14.7 | O63: 0.28100000000000003 | P63: 75.65 | Q63: 转股中 | R63: 2.91年 | S63: 0.91年 | T63: 2.99 | U63: 4.5 | V63: 1.6e-002 | W63: 0.13200000000000001 | X63: 0.10000000000000001 | Y63: 23 | Z63: 2.24 | AA63: 4.1299999999999996e-002 | AB63: 3.5299999999999998e-002 | AC63: 4.4900000000000002e-002 | AD63: 4.1900000000000007e-002 | AE63: 95.23 | AF63: 91.62 | AG63: 0.17 | AH63: AA- | AI63: 6.1699999999999998e-002 | AJ63: =H63+100*O63 -> 124.96700000000001 | AK63: 118.1 | AL63: 65 | AM63: 22.9 | AN63: 48 | AO63: -9.6999999999999989e-002 | AP63: 50 | AQ63: 特一转债!
A64: 300 | B64: 128033 | C64: 迪龙转债! | D64: 2658 | E64: 雪迪龙 | F64: 城市公用 | G64: 三废处理 | H64: 96.7 | I64: 1.e-003 | J64: -7.000000000000001e-004 | K64: 5.62 | L64: 5.4000000000000003e-003 | M64: 108.8 | N64: 8.83 | O64: 0.51900000000000002 | P64: 63.65 | Q64: 转股中 | R64: 2.97年 | S64: 0.97年 | T64: 5.2 | U64: 1.7 | V64: 3.0000000000000001e-003 | W64: 0.153 | X64: 9.6999999999999989e-002 | Y64: 34 | Z64: 1.68 | AA64: 4.1100000000000005e-002 | AB64: 3.5200000000000002e-002 | AC64: 4.4199999999999996e-002 | AD64: 4.1399999999999999e-002 | AE64: 97.07 | AF64: 96.8 | AG64: 0.06 | AH64: AA | AI64: 4.07e-002 | AJ64: =H64+100*O64 -> 148.59999999999999 | AK64: 129.8 | AL64: 172 | AM64: 32.7 | AN64: 128 | AO64: -7.4999999999999997e-002 | AP64: 37 | AQ64: 迪龙转债!
A65: 266 | B65: 128049 | C65: 华源转债! | D65: 2787 | E65: 华源控股 | F65: 造纸包装 | G65: 包装材料 | H65: 98.488 | I65: -1.41e-002 | J65: 3.3e-003 | K65: 6.05 | L65: -2.7300000000000001e-002 | M65: 114.5 | N65: 7.42 | O65: 0.20800000000000002 | P65: 81.54 | Q65: 转股中 | R65: 3.89年 | S65: 1.89年 | T65: 3.63 | U65: 2.5 | V65: 6.9999999999999993e-003 | W65: 0.19 | X65: 0.155 | Y65: 19 | Z65: 1.27 | AA65: 4.0300000000000002e-002 | AB65: 3.32e-002 | AC65: 2.1400000000000002e-002 | AD65: 1.8600000000000002e-002 | AE65: 90.75 | AF65: 90.61 | AG65: 0.39 | AH65: AA- | AI65: 6.3299999999999995e-002 | AJ65: =H65+100*O65 -> 119.288 | AK65: 115.4 | AL65: 43 | AM65: 24.7 | AN65: 67 | AO65: -5.7000000000000002e-002 | AP65: 52 | AQ65: 华源转债!
A66: 316 | B66: 128018 | C66: 时达转债! | D66: 2527 | E66: 新时达 | F66: 机械装备 | G66: 机器人及 | H66: 97.95 | I66: -1.6500000000000001e-002 | J66: 1.4199999999999999e-002 | K66: 5.55 | L66: -1.4199999999999999e-002 | M66: 109.3 | N66: 7.42 | O66: 0.31 | P66: 74.8 | Q66: 转股中 | R66: 2.83年 | S66: 0.83年 | T66: 8.8 | U66: 8 | V66: 9.0000000000000011e-003 | W66: 0.25600000000000001 | X66: 0.191 | Y66: 34 | Z66: 1.35 | AA66: 4.0199999999999993e-002 | AB66: 3.3700000000000001e-002 | AC66: 3.9599999999999996e-002 | AD66: 3.5900000000000001e-002 | AE66: 97.85 | AF66: 97.82 | AG66: 0.16 | AH66: AA | AI66: 4.07e-002 | AJ66: =H66+100*O66 -> 128.94999999999999 | AK66: 121.1 | AL66: 89 | AM66: 23.3 | AN66: 49 | AO66: -6.4000000000000001e-002 | AP66: 41 | AQ66: 时达转债!
A67: 190 | B67: 128082 | C67: 华锋转债! | D67: 2806 | E67: 华锋股份 | F67: 电子 | G67: 元器件制 | H67: 100.688 | I67: 6.8999999999999999e-003 | J67: 2.8000000000000004e-003 | K67: 10.27 | L67: 1.78e-002 | M67: 121.4 | N67: 11.71 | O67: 0.14800000000000002 | P67: 87.7 | Q67: 转股中 | R67: 4.90年 | S67: 2.90年 | T67: 3.45 | U67: 14 | V67: 3.9e-002 | W67: 0.19 | X67: 0.16699999999999998 | Y67: 18 | Z67: 1.45 | AA67: 3.9800000000000002e-002 | AB67: 3.1899999999999998e-002 | AC67: 1.23e-002 | AD67: 9.3999999999999986e-003 | AE67: 84.07 | AF67: 86.16 | AG67: 0.54 | AH67: A+ | AI67: 7.4299999999999991e-002 | AJ67: =H67+100*O67 -> 115.488 | AK67: 113.7 | AL67: 34 | AM67: 27.5 | AN67: 85 | AO67: -7.2999999999999995e-002 | AP67: 60 | AQ67: 华锋转债!
A68: 16 | B68: 128139 | C68: 祥鑫转债 | D68: 2965 | E68: 祥鑫科技 | F68: 汽车 | G68: 零部件制 | H68: 96.719 | I68: -3.4000000000000002e-003 | J68: 8.6999999999999994e-003 | K68: 29.3 | L68: 1.1699999999999999e-002 | M68: 121 | N68: 37.28 | O68: 0.23100000000000001 | P68: 78.59 | Q68: 5月0天 | R68: 5.90年 | S68: 3.90年 | T68: 6.47 | U68: 14 | V68: 2.2000000000000002e-002 | W68: 0.14699999999999999 | X68: 0.115 | Y68: 44 | Z68: 2.6 | AA68: 3.95e-002 | AB68: 3.3000000000000002e-002 | AC68: 1.8000000000000002e-002 | AD68: 1.6e-002 | AE68: 80.56 | AF68: 83.94 | AG68: 0.45 | AH68: AA- | AI68: 6.5299999999999997e-002 | AJ68: =H68+100*O68 -> 119.81899999999999 | AK68: 114.8 | AL68: 39 | AM68: 30.9 | AN68: 114 | AO68: -0.13100000000000001 | AP68: 5 | AQ68: 祥鑫转债
A69: 1 | B69: 123089 | C69: N九洲转2 | D69: 300040 | E69: 九洲集团 | F69: 能源电力 | G69: 电力设备 | H69: 96.5 | I69: -3.5000000000000003e-002 | J69: 0. | K69: 7.41 | L69: -1.46e-002 | M69: 121 | N69: 8 | O69: 4.2000000000000003e-002 | P69: 92.62 | Q69: 5月18天 | R69: 5.95年 | S69: 3.95年 | T69: 5 | U69: 192 | V69: 0.39500000000000002 | W69: 0.17699999999999999 | X69: 0.16399999999999998 | Y69: 28 | Z69: 1.29 | AA69: 3.95e-002 | AB69: 3.3099999999999997e-002 | AC69: 1.83e-002 | AD69: 1.6399999999999998e-002 | AE69: 80.28 | AF69: 83.64 | AG69: 0.63 | AH69: AA- | AI69: 6.5299999999999997e-002 | AJ69: =H69+100*O69 -> 100.7 | AK69: 100.4 | AL69: 4 | AM69: 16.7 | AN69: 10 | AO69: -4.2000000000000003e-002 | AP69: 1 | AQ69: N九洲转2
A70: 23 | B70: 113608 | C70: 威派转债! | D70: 603956 | E70: 威派格 | F70: 机械装备 | G70: 专用设备 | H70: 97.56 | I70: -1.61e-002 | J70: 8.6e-003 | K70: 13.68 | L70: -1.8700000000000001e-002 | M70: 121.6 | N70: 19.24 | O70: 0.37200000000000005 | P70: 71.1 | Q70: 4月5天 | R70: 5.84年 | S70: 3.84年 | T70: 4.2 | U70: 5.5 | V70: 1.3000000000000001e-002 | W70: 7.2000000000000008e-002 | X70: 5.0999999999999997e-002 | Y70: 58 | Z70: 5.11 | AA70: 3.9300000000000002e-002 | AB70: 3.2599999999999997e-002 | AC70: 1.78e-002 | AD70: 1.55e-002 | AE70: 78.2 | AF70: 79.96 | AG70: 0.4 | AH70: A+ | AI70: 7.6299999999999993e-002 | AJ70: =H70+100*O70 -> 134.75999999999999 | AK70: 124 | AL70: 121 | AM70: 44.1 | AN70: 196 | AO70: -0.12 | AP70: 6 | AQ70: 威派转债!
A71: 2 | B71: 123087 | C71: 明电转债! | D71: 300739 | E71: 明阳电路 | F71: 电子 | G71: 元器件制 | H71: 96.999 | I71: 5.6999999999999993e-003 | J71: -7.9000000000000008e-003 | K71: 17.71 | L71: -5.6000000000000008e-003 | M71: 121.2 | N71: 24.23 | O71: 0.32700000000000001 | P71: 73.09 | Q71: 5月14天 | R71: 5.93年 | S71: 4.93年 | T71: 6.73 | U71: 12 | V71: 1.9e-002 | W71: 0.13600000000000001 | X71: 9.9000000000000005e-002 | Y71: 49 | Z71: 3.6 | AA71: 3.9e-002 | AB71: 3.2599999999999997e-002 | AC71: 1.9199999999999998e-002 | AD71: 1.6500000000000001e-002 | AE71: 77.69 | AF71: 83.91 | AG71: 0.39 | AH71: AA- | AI71: 6.5299999999999997e-002 | AJ71: =H71+100*O71 -> 129.69900000000001 | AK71: 120.9 | AL71: 88 | AM71: 37 | AN71: 157 | AO71: -0.113 | AP71: 2 | AQ71: 明电转债!
A72: 87 | B72: 128120 | C72: 联诚转债 | D72: 2921 | E72: 联诚精密 | F72: 汽车 | G72: 零部件制 | H72: 96.6 | I72: -7.1999999999999998e-003 | J72: 9.1000000000000004e-003 | K72: 18.1 | L72: 3.9000000000000003e-003 | M72: 118.4 | N72: 24.37 | O72: 0.30099999999999999 | P72: 74.27 | Q72: 17天 | R72: 5.52年 | S72: 3.52年 | T72: 2.6 | U72: 4.8 | V72: 1.9e-002 | W72: 0.17600000000000002 | X72: 0.13100000000000001 | Y72: 15 | Z72: 1.97 | AA72: 3.85e-002 | AB72: 3.2300000000000002e-002 | AC72: 2.2000000000000002e-002 | AD72: 1.95e-002 | AE72: 77.36 | AF72: 75.83 | AG72: 0.49 | AH72: A | AI72: 8.6300000000000002e-002 | AJ72: =H72+100*O72 -> 126.69999999999999 | AK72: 118.9 | AL72: 69 | AM72: 41.6 | AN72: 180 | AO72: -0.10199999999999999 | AP72: 18 | AQ72: 联诚转债
A73: 294 | B73: 113505 | C73: 杭电转债! | D73: 603618 | E73: 杭电股份 | F73: 能源电力 | G73: 电力设备 | H73: 99.96 | I73: -3.5999999999999999e-003 | J73: -1.1200000000000002e-002 | K73: 5.9 | L73: -5.1399999999999994e-002 | M73: 112.3 | N73: 7.14 | O73: 0.20999999999999999 | P73: 82.63 | Q73: 转股中 | R73: 3年57天 | S73: 1年57天 | T73: 7.5 | U73: 18 | V73: 2.5000000000000001e-002 | W73: 0.184 | X73: 0.152 | Y73: 41 | Z73: 1.61 | AA73: 3.8399999999999997e-002 | AB73: 3.0899999999999997e-002 | AC73: 2.1600000000000001e-002 | AD73: 1.7299999999999999e-002 | AE73: 97.37 | AF73: 98.82 | AG73: 0.29 | AH73: AA | AI73: 4.2300000000000004e-002 | AJ73: =H73+100*O73 -> 120.95999999999999 | AK73: 117.3 | AL73: 59 | AM73: 18.5 | AN73: 20 | AO73: 1.3000000000000001e-002 | AP73: 39 | AQ73: 杭电转债!
A74: 10 | B74: 123082 | C74: 北陆转债 | D74: 300016 | E74: 北陆药业 | F74: 医药 | G74: 化学制药 | H74: 98 | I74: -2.e-003 | J74: 5.5000000000000005e-003 | K74: 9.08 | L74: 6.7000000000000002e-003 | M74: 121.7 | N74: 11.41 | O74: 0.23100000000000001 | P74: 79.58 | Q74: 5月4天 | R74: 5.91年 | S74: 3.91年 | T74: 5 | U74: 12 | V74: 2.5000000000000001e-002 | W74: 0.111 | X74: 8.900000000000001e-002 | Y74: 45 | Z74: 2.83 | AA74: 3.8100000000000002e-002 | AB74: 3.15e-002 | AC74: 1.6299999999999999e-002 | AD74: 1.41e-002 | AE74: 77.77 | AF74: 79.58 | AG74: 0.53 | AH74: A+ | AI74: 7.6299999999999993e-002 | AJ74: =H74+100*O74 -> 121.09999999999999 | AK74: 116.4 | AL74: 50 | AM74: 36.8 | AN74: 156 | AO74: -7.2000000000000008e-002 | AP74: 4 | AQ74: 北陆转债
A75: 206 | B75: 128076 | C75: 金轮转债! | D75: 2722 | E75: 金轮股份 | F75: 机械装备 | G75: 专用设备 | H75: 96.513 | I75: -5.0000000000000001e-003 | J75: 5.3e-003 | K75: 11.25 | L75: 8.9999999999999998e-004 | M75: 114.9 | N75: 14.76 | O75: 0.26600000000000001 | P75: 76.22 | Q75: 转股中 | R75: 4.76年 | S75: 2.76年 | T75: 2.14 | U75: 7.3 | V75: 3.5000000000000003e-002 | W75: 0.10800000000000001 | X75: 8.3000000000000004e-002 | Y75: 20 | Z75: 1.07 | AA75: 3.7999999999999999e-002 | AB75: 3.2099999999999997e-002 | AC75: 2.4e-002 | AD75: 2.1700000000000001e-002 | AE75: 86.52 | AF75: 86.26 | AG75: 0.38 | AH75: AA- | AI75: 6.3299999999999995e-002 | AJ75: =H75+100*O75 -> 123.113 | AK75: 116.8 | AL75: 56 | AM75: 30.3 | AN75: 107 | AO75: -4.4999999999999998e-002 | AP75: 44 | AQ75: 金轮转债!
A76: 50 | B76: 123067 | C76: 斯莱转债 | D76: 300382 | E76: 斯莱克 | F76: 机械装备 | G76: 专用设备 | H76: 98.602 | I76: -9.300000000000001e-003 | J76: 1.3000000000000001e-002 | K76: 7.52 | L76: 8.0000000000000002e-003 | M76: 121.2 | N76: 9.38 | O76: 0.23000000000000001 | P76: 80.17 | Q76: 2月14天 | R76: 5.69年 | S76: 3.69年 | T76: 3.88 | U76: 4.3 | V76: 1.1000000000000001e-002 | W76: 9.0999999999999998e-002 | X76: 7.2999999999999995e-002 | Y76: 42 | Z76: 4.16 | AA76: 3.7699999999999997e-002 | AB76: 3.1e-002 | AC76: 1.44e-002 | AD76: 1.2199999999999999e-002 | AE76: 81.8 | AF76: 85.21 | AG76: 0.46 | AH76: AA- | AI76: 6.5299999999999997e-002 | AJ76: =H76+100*O76 -> 121.602 | AK76: 117 | AL76: 58 | AM76: 31.8 | AN76: 122 | AO76: -6.5000000000000002e-002 | AP76: 13 | AQ76: 斯莱转债
A77: 323 | B77: 128014 | C77: 永东转债! | D77: 2753 | E77: 永东股份 | F77: 化工 | G77: 化工 | H77: 102.55 | I77: 2.3999999999999998e-003 | J77: -2.3999999999999998e-003 | K77: 8.52 | L77: 2.1600000000000001e-002 | M77: 111.3 | N77: 12.6 | O77: 0.51700000000000002 | P77: 67.62 | Q77: 转股中 | R77: 2.27年 | S77: 0.27年 | T77: 3.37 | U77: 2.3 | V77: 6.9999999999999993e-003 | W77: 0.105 | X77: 7.0999999999999994e-002 | Y77: 32 | Z77: 1.82 | AA77: 3.7499999999999999e-002 | AB77: 2.7799999999999998e-002 | AC77: -1.67e-002 | AD77: -2.4700000000000003e-002 | AE77: 99.18 | AF77: 97.41 | AG77: 0 | AH77: AA- | AI77: 6.1699999999999998e-002 | AJ77: =H77+100*O77 -> 154.25 | AK77: 137.5 | AL77: 211 | AM77: 38.3 | AN77: 166 | AO77: 2.7000000000000003e-002 | AP77: 39 | AQ77: 永东转债!
A78: 34 | B78: 123073 | C78: 同和转债! | D78: 300636 | E78: 同和药业 | F78: 医药 | G78: 原料药 | H78: 99.5 | I78: -4.0000000000000001e-003 | J78: 7.4999999999999997e-003 | K78: 20.3 | L78: 5.8999999999999999e-003 | M78: 122.4 | N78: 23.8 | O78: 0.16699999999999998 | P78: 85.29 | Q78: 3月25天 | R78: 5.80年 | S78: 3.80年 | T78: 3.6 | U78: 6.7 | V78: 1.9e-002 | W78: 0.13800000000000001 | X78: 0.11800000000000001 | Y78: 26 | Z78: 3.45 | AA78: 3.7200000000000004e-002 | AB78: 3.0299999999999997e-002 | AC78: 1.2800000000000001e-002 | AD78: 1.0500000000000001e-002 | AE78: 78.4 | AF78: 80.69 | AG78: 0.59 | AH78: A+ | AI78: 7.6299999999999993e-002 | AJ78: =H78+100*O78 -> 116.2 | AK78: 113.7 | AL78: 35 | AM78: 33 | AN78: 131 | AO78: -0.14599999999999999 | AP78: 7 | AQ78: 同和转债!
A79: 237 | B79: 113532 | C79: 海环转债! | D79: 603817 | E79: 海峡环保 | F79: 城市公用 | G79: 三废处理 | H79: 97.2 | I79: 1.1000000000000001e-003 | J79: -1.1000000000000001e-003 | K79: 5.74 | L79: 0. | M79: 112.9 | N79: 7.69 | O79: 0.30199999999999999 | P79: 74.64 | Q79: 转股中 | R79: 4.23年 | S79: 2.23年 | T79: 4.6 | U79: 11 | V79: 2.4e-002 | W79: 0.17800000000000002 | X79: 0.13300000000000001 | Y79: 26 | Z79: 1.51 | AA79: 3.6799999999999999e-002 | AB79: 3.0899999999999997e-002 | AC79: 2.64e-002 | AD79: 2.35e-002 | AE79: 93.73 | AF79: 95.11 | AG79: 0.25 | AH79: AA | AI79: 4.2300000000000004e-002 | AJ79: =H79+100*O79 -> 127.40000000000001 | AK79: 119.8 | AL79: 78 | AM79: 24.6 | AN79: 65 | AO79: -3.1e-002 | AP79: 27 | AQ79: 海环转债!
A80: 192 | B80: 128081 | C80: 海亮转债! | D80: 2203 | E80: 海亮股份 | F80: 有色金属 | G80: 铜金属 | H80: 96.811 | I80: -1.e-002 | J80: 6.3e-003 | K80: 7.3 | L80: -1.3500000000000002e-002 | M80: 114.9 | N80: 9.76 | O80: 0.29399999999999998 | P80: 74.8 | Q80: 转股中 | R80: 4.87年 | S80: 2.87年 | T80: 31.5 | U80: 11 | V80: 4.0000000000000001e-003 | W80: 0.221 | X80: 0.16500000000000001 | Y80: 143 | Z80: 1.58 | AA80: 3.6499999999999998e-002 | AB80: 3.0699999999999998e-002 | AC80: 2.2099999999999998e-002 | AD80: 1.9900000000000001e-002 | AE80: 91.28 | AF80: 94.27 | AG80: 0.28 | AH80: AA | AI80: 4.2300000000000004e-002 | AJ80: =H80+100*O80 -> 126.21100000000001 | AK80: 118.8 | AL80: 68 | AM80: 24.6 | AN80: 62 | AO80: -5.0999999999999997e-002 | AP80: 50 | AQ80: 海亮转债!
A81: 130 | B81: 113578 | C81: 全筑转债 | D81: 603030 | E81: 全筑股份 | F81: 建筑 | G81: 装饰工程 | H81: 98.29 | I81: 1.1999999999999999e-003 | J81: 4.0999999999999995e-003 | K81: 4.58 | L81: 1.3300000000000001e-002 | M81: 118.3 | N81: 5.43 | O81: 0.16500000000000001 | P81: 84.35 | Q81: 转股中 | R81: 5.28年 | S81: 3.28年 | T81: 3.84 | U81: 5.5 | V81: 1.4999999999999999e-002 | W81: 0.156 | X81: 0.13100000000000001 | Y81: 25 | Z81: 1.11 | AA81: 3.6499999999999998e-002 | AB81: 3.0099999999999998e-002 | AC81: 1.61e-002 | AD81: 1.3899999999999999e-002 | AE81: 89.54 | AF81: 94.54 | AG81: 0.4 | AH81: AA | AI81: 4.4299999999999999e-002 | AJ81: =H81+100*O81 -> 114.79000000000001 | AK81: 112.2 | AL81: 26 | AM81: 17.7 | AN81: 18 | AO81: -8.3000000000000004e-002 | AP81: 14 | AQ81: 全筑转债
A82: 89 | B82: 123059 | C82: 银信转债 | D82: 300231 | E82: 银信科技 | F82: 计算机及 | G82: 软件开发 | H82: 102.398 | I82: -2.8999999999999998e-003 | J82: 9.7999999999999997e-003 | K82: 8.22 | L82: 1.4800000000000001e-002 | M82: 124.1 | N82: 9.91 | O82: 0.23499999999999999 | P82: 82.95 | Q82: 13天 | R82: 5.52年 | S82: 3.52年 | T82: 3.91 | U82: 8.6 | V82: 2.1000000000000001e-002 | W82: 0.10800000000000001 | X82: 8.900000000000001e-002 | Y82: 36 | Z82: 2.76 | AA82: 3.6200000000000003e-002 | AB82: 2.8500000000000001e-002 | AC82: 4.3e-003 | AD82: 2.2000000000000001e-003 | AE82: 82.62 | AF82: 88.19 | AG82: 0.46 | AH82: AA- | AI82: 6.5299999999999997e-002 | AJ82: =H82+100*O82 -> 125.898 | AK82: 121.8 | AL82: 98 | AM82: 33.7 | AN82: 135 | AO82: -7.9000000000000001e-002 | AP82: 13 | AQ82: 银信转债
A83: 284 | B83: 127007 | C83: 湖广转债! | D83: 665 | E83: 湖北广电 | F83: 传媒娱乐 | G83: 影视娱乐 | H83: 99.638 | I83: 3.4000000000000002e-003 | J83: 1.e-003 | K83: 4.34 | L83: 1.8799999999999997e-002 | M83: 112.3 | N83: 5.58 | O83: 0.28100000000000003 | P83: 77.78 | Q83: 转股中 | R83: 3.47年 | S83: 1.47年 | T83: 12.2 | U83: 8.9 | V83: 6.9999999999999993e-003 | W83: 0.28499999999999998 | X83: 0.222 | Y83: 43 | Z83: 0.66 | AA83: 3.5799999999999998e-002 | AB83: 2.8999999999999998e-002 | AC83: 1.95e-002 | AD83: 1.6e-002 | AE83: 96.42 | AF83: 98.19 | AG83: 0.24 | AH83: AA+ | AI83: 4.0300000000000002e-002 | AJ83: =H83+100*O83 -> 127.738 | AK83: 121.5 | AL83: 96 | AM83: 23.3 | AN83: 50 | AO83: -4.2000000000000003e-002 | AP83: 19 | AQ83: 湖广转债!
A84: 160 | B84: 113567 | C84: 君禾转债 | D84: 603617 | E84: 君禾股份 | F84: 机械装备 | G84: 通用设备 | H84: 100 | I84: -4.8999999999999998e-003 | J84: -1.2199999999999999e-002 | K84: 9.78 | L84: -3.0699999999999998e-002 | M84: 119.3 | N84: 11.46 | O84: 0.17199999999999999 | P84: 85.34 | Q84: 转股中 | R84: 5年55天 | S84: 3年55天 | T84: 2.1 | U84: 7.7 | V84: 3.7000000000000005e-002 | W84: 0.10800000000000001 | X84: 9.1999999999999998e-002 | Y84: 20 | Z84: 3.03 | AA84: 3.5799999999999998e-002 | AB84: 2.8900000000000002e-002 | AC84: 1.34e-002 | AD84: 1.0800000000000001e-002 | AE84: 82.15 | AF84: 82.5 | AG84: 0.56 | AH84: A+ | AI84: 7.6299999999999993e-002 | AJ84: =H84+100*O84 -> 117.2 | AK84: 114.7 | AL84: 38 | AM84: 32.2 | AN84: 125 | AO84: -0.16899999999999998 | AP84: 36 | AQ84: 君禾转债
A85: 4 | B85: 123085 | C85: 万顺转2 | D85: 300057 | E85: 万顺新材 | F85: 有色金属 | G85: 铝金属 | H85: 92.389 | I85: 9.7000000000000003e-003 | J85: -2.7000000000000001e-003 | K85: 4.76 | L85: 1.49e-002 | M85: 113.3 | N85: 6.24 | O85: 0.21100000000000002 | P85: 76.28 | Q85: 5月10天 | R85: 5.92年 | S85: 3.92年 | T85: 9 | U85: 17 | V85: 2.e-002 | W85: 0.28000000000000003 | X85: 0.214 | Y85: 32 | Z85: 0.94 | AA85: 3.5699999999999996e-002 | AB85: 3.1400000000000004e-002 | AC85: 2.9100000000000001e-002 | AD85: 2.7200000000000002e-002 | AE85: 80.33 | AF85: 78.47 | AG85: 0.47 | AH85: AA- | AI85: 6.5299999999999997e-002 | AJ85: =H85+100*O85 -> 113.489 | AK85: 108.5 | AL85: 13 | AM85: 28.2 | AN85: 92 | AO85: -8.6999999999999994e-002 | AP85: 4 | AQ85: 万顺转2
A86: 282 | B86: 110045 | C86: 海澜转债! | D86: 600398 | E86: 海澜之家 | F86: 服装纺织 | G86: 服装行业 | H86: 98.54 | I86: -2.0999999999999999e-003 | J86: 2.0999999999999999e-003 | K86: 6.34 | L86: -3.0999999999999999e-003 | M86: 111.1 | N86: 11.75 | O86: 0.82599999999999996 | P86: 53.96 | Q86: 转股中 | R86: 3.51年 | S86: 1.51年 | T86: 29.5 | U86: 11 | V86: 4.0000000000000001e-003 | W86: 0.10800000000000001 | X86: 5.7999999999999996e-002 | Y86: 274 | Z86: 2.16 | AA86: 3.5299999999999998e-002 | AB86: 2.92e-002 | AC86: 2.1000000000000001e-002 | AD86: 1.8600000000000002e-002 | AE86: 95.52 | AF86: 96.91 | AG86: 0.02 | AH86: AA+ | AI86: 4.0300000000000002e-002 | AJ86: =H86+100*O86 -> 181.13999999999999 | AK86: 143.1 | AL86: 232 | AM86: 46.2 | AN86: 211 | AO86: -6.9999999999999993e-003 | AP86: 60 | AQ86: 海澜转债!
A87: 60 | B87: 113601 | C87: 塞力转债 | D87: 603716 | E87: 塞力医疗 | F87: 医药 | G87: 医药商业 | H87: 100.39 | I87: -9.7999999999999997e-003 | J87: 4.0000000000000001e-003 | K87: 15.75 | L87: -9.3999999999999986e-003 | M87: 121.3 | N87: 16.98 | O87: 8.199999999999999e-002 | P87: 92.76 | Q87: 50天 | R87: 5.62年 | S87: 3.62年 | T87: 5.43 | U87: 11 | V87: 2.e-002 | W87: 0.16800000000000001 | X87: 0.156 | Y87: 32 | Z87: 2.12 | AA87: 3.5000000000000003e-002 | AB87: 2.8199999999999999e-002 | AC87: 1.01e-002 | AD87: 7.8000000000000005e-003 | AE87: 82.28 | AF87: 85.71 | AG87: 0.61 | AH87: AA- | AI87: 6.5299999999999997e-002 | AJ87: =H87+100*O87 -> 108.59 | AK87: 108 | AL87: 10 | AM87: 22.3 | AN87: 41 | AO87: -5.5e-002 | AP87: 28 | AQ87: 塞力转债
A88: 254 | B88: 128056 | C88: 今飞转债! | D88: 2863 | E88: 今飞凯达 | F88: 汽车 | G88: 零部件制 | H88: 105.35 | I88: -2.e-003 | J88: 8.1000000000000013e-003 | K88: 5.2 | L88: 1.7600000000000001e-002 | M88: 121 | N88: 6.7 | O88: 0.35700000000000004 | P88: 77.61 | Q88: 转股中 | R88: 4年51天 | S88: 2年51天 | T88: 1.72 | U88: 24 | V88: 0.13300000000000001 | W88: 6.6000000000000003e-002 | X88: 5.0999999999999997e-002 | Y88: 26 | Z88: 1.76 | AA88: 3.49e-002 | AB88: 2.58e-002 | AC88: -5.0000000000000001e-003 | AD88: -8.3999999999999995e-003 | AE88: 88.52 | AF88: 90.66 | AG88: 0.35 | AH88: A+ | AI88: 7.4299999999999991e-002 | AJ88: =H88+100*O88 -> 141.05000000000001 | AK88: 133.1 | AL88: 189 | AM88: 42.4 | AN88: 185 | AO88: -9.8000000000000004e-002 | AP88: 59 | AQ88: 今飞转债!
A89: 182 | B89: 110064 | C89: 建工转债! | D89: 600939 | E89: 重庆建工 | F89: 建筑 | G89: 建筑工程 | H89: 101.51 | I89: 6.4000000000000003e-003 | J89: -8.0000000000000002e-003 | K89: 3.61 | L89: -5.5000000000000005e-003 | M89: 119.8 | N89: 4.57 | O89: 0.28499999999999998 | P89: 78.99 | Q89: 转股中 | R89: 4.95年 | S89: 2.95年 | T89: 16.6 | U89: 9.3 | V89: 6.0000000000000001e-003 | W89: 0.253 | X89: 0.20000000000000001 | Y89: 66 | Z89: 0.95 | AA89: 3.4799999999999998e-002 | AB89: 2.75e-002 | AC89: 8.3000000000000001e-003 | AD89: 5.6999999999999993e-003 | AE89: 92.18 | AF89: 98.95 | AG89: 0.28 | AH89: AA+ | AI89: 4.0300000000000002e-002 | AJ89: =H89+100*O89 -> 130.00999999999999 | AK89: 124 | AL89: 122 | AM89: 25.1 | AN89: 70 | AO89: -2.8999999999999998e-002 | AP89: 48 | AQ89: 建工转债!
A90: 138 | B90: 113576 | C90: 起步转债!! | D90: 603557 | E90: 起步股份 | F90: 服装纺织 | G90: 鞋服行业 | H90: 102.59 | I90: -1.8e-003 | J90: -2.0000000000000001e-004 | K90: 8.41 | L90: -4.6999999999999993e-003 | M90: 121.8 | N90: 10.55 | O90: 0.28699999999999998 | P90: 79.72 | Q90: 转股中 | R90: 5.25年 | S90: 3.25年 | T90: 2.66 | U90: 60 | V90: 0.221 | W90: 6.4000000000000001e-002 | X90: 5.0999999999999997e-002 | Y90: 42 | Z90: 2.48 | AA90: 3.4099999999999998e-002 | AB90: 2.6600000000000002e-002 | AC90: 6.0999999999999995e-003 | AD90: 3.4000000000000002e-003 | AE90: 84.61 | AF90: 88.12 | AG90: 0.42 | AH90: AA- | AI90: 6.5299999999999997e-002 | AJ90: =H90+100*O90 -> 131.28999999999999 | AK90: 125.5 | AL90: 135 | AM90: 37.3 | AN90: 161 | AO90: -5.5e-002 | AP90: 28 | AQ90: 起步转债!!
A91: 135 | B91: 110070 | C91: 凌钢转债! | D91: 600231 | E91: 凌钢股份 | F91: 钢铁 | G91: 炼钢 | H91: 99.12 | I91: -3.0699999999999998e-002 | J91: 1.29e-002 | K91: 2.42 | L91: -3.9699999999999999e-002 | M91: 117.8 | N91: 2.75 | O91: 0.126 | P91: 88 | Q91: 转股中 | R91: 5.26年 | S91: 3.26年 | T91: 4.4 | U91: 25 | V91: 5.5999999999999994e-002 | W91: 6.6000000000000003e-002 | X91: 5.7999999999999996e-002 | Y91: 67 | Z91: 0.83 | AA91: 3.4099999999999998e-002 | AB91: 2.7900000000000001e-002 | AC91: 1.47e-002 | AD91: 1.23e-002 | AE91: 89.92 | AF91: 94.26 | AG91: 0.45 | AH91: AA | AI91: 4.4299999999999999e-002 | AJ91: =H91+100*O91 -> 111.72 | AK91: 110.2 | AL91: 17 | AM91: 16 | AN91: 9 | AO91: -2.7999999999999997e-002 | AP91: 18 | AQ91: 凌钢转债!
A92: 100 | B92: 128116 | C92: 瑞达转债 | D92: 2961 | E92: 瑞达期货 | F92: 金融 | G92: 期货行业 | H92: 96.4 | I92: -6.4000000000000003e-003 | J92: 4.7999999999999996e-003 | K92: 21.68 | L92: -5.5000000000000005e-003 | M92: 115.3 | N92: 29.82 | O92: 0.32600000000000001 | P92: 72.7 | Q92: 转股中 | R92: 5.47年 | S92: 3.47年 | T92: 6.5 | U92: 6.5 | V92: 1.e-002 | W92: 6.7000000000000004e-002 | X92: 4.9000000000000002e-002 | Y92: 96 | Z92: 5.49 | AA92: 3.39e-002 | AB92: 2.87e-002 | AC92: 2.0499999999999997e-002 | AD92: 1.84e-002 | AE92: 88.72 | AF92: 91.38 | AG92: 0.29 | AH92: AA | AI92: 4.4299999999999999e-002 | AJ92: =H92+100*O92 -> 129. | AK92: 120.1 | AL92: 82 | AM92: 28.7 | AN92: 96 | AO92: -0.158 | AP92: 14 | AQ92: 瑞达转债
A93: 97 | B93: 128117 | C93: 道恩转债 | D93: 2838 | E93: 道恩股份 | F93: 化工 | G93: 橡胶塑料 | H93: 103.22 | I93: 4.0000000000000002e-004 | J93: 7.4000000000000003e-003 | K93: 26.07 | L93: 1.44e-002 | M93: 123.5 | N93: 29.03 | O93: 0.14899999999999999 | P93: 89.8 | Q93: 转股中 | R93: 5.48年 | S93: 3.48年 | T93: 3.6 | U93: 132 | V93: 0.35299999999999998 | W93: 3.4000000000000002e-002 | X93: 2.9999999999999999e-002 | Y93: 106 | Z93: 6.17 | AA93: 3.39e-002 | AB93: 2.64e-002 | AC93: 1.6000000000000001e-003 | AD93: -4.0000000000000002e-004 | AE93: 82.65 | AF93: 87.92 | AG93: 0.54 | AH93: AA- | AI93: 6.5299999999999997e-002 | AJ93: =H93+100*O93 -> 118.12 | AK93: 116.6 | AL93: 53 | AM93: 28.7 | AN93: 95 | AO93: 5.2999999999999999e-002 | AP93: 18 | AQ93: 道恩转债
A94: 148 | B94: 123047 | C94: 久吾转债 | D94: 300631 | E94: 久吾高科 | F94: 机械装备 | G94: 专用设备 | H94: 110.38 | I94: 1.55e-002 | J94: -1.78e-002 | K94: 15.73 | L94: -4.4000000000000003e-003 | M94: 130.1 | N94: 17.61 | O94: 0.23600000000000002 | P94: 89.32 | Q94: 转股中 | R94: 5.19年 | S94: 3.19年 | T94: 1.99 | U94: 156 | V94: 0.69200000000000006 | W94: 0.11599999999999999 | X94: 0.10400000000000001 | Y94: 17 | Z94: 2.35 | AA94: 3.3099999999999997e-002 | AB94: 2.3300000000000001e-002 | AC94: -1.1899999999999999e-002 | AD94: -1.5300000000000001e-002 | AE94: 83.17 | AF94: 89.83 | AG94: 0.54 | AH94: A+ | AI94: 7.6299999999999993e-002 | AJ94: =H94+100*O94 -> 133.97999999999999 | AK94: 131.4 | AL94: 182 | AM94: 41.6 | AN94: 182 | AO94: -0.12 | AP94: 22 | AQ94: 久吾转债
A95: 283 | B95: 123010 | C95: 博世转债! | D95: 300422 | E95: 博世科 | F95: 城市公用 | G95: 三废处理 | H95: 100.5 | I95: -2.8000000000000004e-003 | J95: 5.5000000000000005e-003 | K95: 10.19 | L95: 6.8999999999999999e-003 | M95: 112.3 | N95: 12.2 | O95: 0.20300000000000001 | P95: 83.52 | Q95: 转股中 | R95: 3.49年 | S95: 1.49年 | T95: 4.3 | U95: 4.6 | V95: 1.1000000000000001e-002 | W95: 0.10400000000000001 | X95: 8.6999999999999994e-002 | Y95: 41 | Z95: 1.75 | AA95: 3.3000000000000002e-002 | AB95: 2.6200000000000001e-002 | AC95: 1.3899999999999999e-002 | AD95: 1.0500000000000001e-002 | AE95: 92.96 | AF95: 91.06 | AG95: 0.38 | AH95: AA- | AI95: 6.3299999999999995e-002 | AJ95: =H95+100*O95 -> 120.8 | AK95: 117.5 | AL95: 62 | AM95: 24.5 | AN95: 61 | AO95: -0.12 | AP95: 32 | AQ95: 博世转债!
A96: 142 | B96: 127016 | C96: 鲁泰转债! | D96: 726 | E96: 鲁 泰Ａ | F96: 服装纺织 | G96: 纺织行业 | H96: 98.585 | I96: 8.0000000000000002e-003 | J96: -6.1999999999999998e-003 | K96: 6.39 | L96: 7.9000000000000008e-003 | M96: 116.2 | N96: 8.91 | O96: 0.375 | P96: 71.72 | Q96: 转股中 | R96: 5.25年 | S96: 3.25年 | T96: 14 | U96: 16 | V96: 1.2e-002 | W96: 0.255 | X96: 0.183 | Y96: 55 | Z96: 0.71 | AA96: 3.2500000000000001e-002 | AB96: 2.6699999999999998e-002 | AC96: 1.5100000000000001e-002 | AD96: 1.29e-002 | AE96: 90.14 | AF96: 93.89 | AG96: 0.24 | AH96: AA+ | AI96: 4.2300000000000004e-002 | AJ96: =H96+100*O96 -> 136.08499999999998 | AK96: 125.5 | AL96: 134 | AM96: 31.6 | AN96: 118 | AO96: -5.0000000000000003e-002 | AP96: 22 | AQ96: 鲁泰转债!
A97: 21 | B97: 123076 | C97: 强力转债! | D97: 300429 | E97: 强力新材 | F97: 化工 | G97: 化工 | H97: 98.881 | I97: 4.8999999999999998e-003 | J97: 6.7000000000000002e-003 | K97: 13.58 | L97: 3.1099999999999999e-002 | M97: 118.5 | N97: 18.98 | O97: 0.38200000000000001 | P97: 71.55 | Q97: 4月17天 | R97: 5.86年 | S97: 3.86年 | T97: 8.5 | U97: 11 | V97: 1.3000000000000001e-002 | W97: 0.121 | X97: 8.6999999999999994e-002 | Y97: 70 | Z97: 4.05 | AA97: 3.1899999999999998e-002 | AB97: 2.6200000000000001e-002 | AC97: 1.23e-002 | AD97: 1.04e-002 | AE97: 80.66 | AF97: 82.36 | AG97: 0.37 | AH97: AA- | AI97: 6.5299999999999997e-002 | AJ97: =H97+100*O97 -> 137.08100000000002 | AK97: 126.2 | AL97: 141 | AM97: 43.9 | AN97: 195 | AO97: -9.4e-002 | AP97: 9 | AQ97: 强力转债!
A98: 181 | B98: 113559 | C98: 永创转债! | D98: 603901 | E98: 永创智能 | F98: 机械装备 | G98: 专用设备 | H98: 102.01 | I98: -1.3999999999999999e-002 | J98: 8.5000000000000006e-003 | K98: 8.19 | L98: -1.3300000000000001e-002 | M98: 118.3 | N98: 10.32 | O98: 0.28499999999999998 | P98: 79.36 | Q98: 转股中 | R98: 4.96年 | S98: 2.96年 | T98: 5.1 | U98: 34 | V98: 6.5000000000000002e-002 | W98: 0.14199999999999999 | X98: 0.11199999999999999 | Y98: 36 | Z98: 2.6 | AA98: 3.1099999999999999e-002 | AB98: 2.4300000000000002e-002 | AC98: 7.4999999999999997e-003 | AD98: 4.6999999999999993e-003 | AE98: 86.37 | AF98: 87.91 | AG98: 0.42 | AH98: AA- | AI98: 6.3299999999999995e-002 | AJ98: =H98+100*O98 -> 130.50999999999999 | AK98: 124.7 | AL98: 129 | AM98: 36.7 | AN98: 155 | AO98: -7.400000000000001e-002 | AP98: 22 | AQ98: 永创转债!
A99: 71 | B99: 128125 | C99: 华阳转债! | D99: 2949 | E99: 华阳国际 | F99: 建筑 | G99: 建筑工程 | H99: 100.3 | I99: 1.01e-002 | J99: 3.7000000000000002e-003 | K99: 18 | L99: 4.1700000000000001e-002 | M99: 118.5 | N99: 25.79 | O99: 0.43700000000000006 | P99: 69.79 | Q99: 28天 | R99: 5.56年 | S99: 3.56年 | T99: 4.5 | U99: 11 | V99: 2.4e-002 | W99: 0.128 | X99: 8.900000000000001e-002 | Y99: 35 | Z99: 2.9 | AA99: 3.1099999999999999e-002 | AB99: 2.5000000000000001e-002 | AC99: 9.3999999999999986e-003 | AD99: 7.4000000000000003e-003 | AE99: 82.25 | AF99: 83.98 | AG99: 0.33 | AH99: AA- | AI99: 6.5299999999999997e-002 | AJ99: =H99+100*O99 -> 144. | AK99: 130.8 | AL99: 179 | AM99: 46.8 | AN99: 213 | AO99: -6.6000000000000003e-002 | AP99: 5 | AQ99: 华阳转债!
A100: 303 | B100: 128032 | C100: 双环转债! | D100: 2472 | E100: 双环传动 | F100: 机械装备 | G100: 通用设备 | H100: 100.201 | I100: 1.5e-003 | J100: -3.5999999999999999e-003 | K100: 7.45 | L100: -1.1899999999999999e-002 | M100: 109.3 | N100: 9.89 | O100: 0.33000000000000002 | P100: 75.33 | Q100: 转股中 | R100: 2.96年 | S100: 0.96年 | T100: 10 | U100: 2.5 | V100: 2.e-003 | W100: 0.19600000000000001 | X100: 0.14699999999999999 | Y100: 51 | Z100: 1.53 | AA100: 3.0200000000000001e-002 | AB100: 2.41e-002 | AC100: 1.4199999999999999e-002 | AD100: 1.1000000000000001e-002 | AE100: 97.33 | AF100: 97.3 | AG100: 0.18 | AH100: AA | AI100: 4.07e-002 | AJ100: =H100+100*O100 -> 133.20099999999999 | AK100: 125.1 | AL100: 132 | AM100: 27.7 | AN100: 88 | AO100: 3.7999999999999999e-002 | AP100: 47 | AQ100: 双环转债!
A101: 145 | B101: 113574 | C101: 华体转债! | D101: 603679 | E101: 华体科技 | F101: 城市公用 | G101: 城市公用 | H101: 100.09 | I101: -5.9999999999999995e-004 | J101: 4.0000000000000001e-003 | K101: 21.55 | L101: 1.41e-002 | M101: 116.4 | N101: 33.99 | O101: 0.57899999999999996 | P101: 63.4 | Q101: 转股中 | R101: 5.22年 | S101: 3.22年 | T101: 2.09 | U101: 0.6 | V101: 3.0000000000000001e-003 | W101: 6.8000000000000005e-002 | X101: 4.2999999999999997e-002 | Y101: 31 | Z101: 4.21 | AA101: 3.0099999999999998e-002 | AB101: 2.4199999999999999e-002 | AC101: 1.32e-002 | AD101: 1.0500000000000001e-002 | AE101: 81.77 | AF101: 80.08 | AG101: 0.24 | AH101: A+ | AI101: 7.6299999999999993e-002 | AJ101: =H101+100*O101 -> 157.99000000000001 | AK101: 136.8 | AL101: 207 | AM101: 55 | AN101: 247 | AO101: -7.400000000000001e-002 | AP101: 16 | AQ101: 华体转债!
A102: 95 | B102: 113036 | C102: 宁建转债! | D102: 601789 | E102: 宁波建工 | F102: 建筑 | G102: 建筑工程 | H102: 100.01 | I102: 0. | J102: 0. | K102: 3.87 | L102: 0. | M102: 117.3 | N102: 4.86 | O102: 0.25600000000000001 | P102: 79.63 | Q102: 3.1天 | R102: 5.49年 | S102: 3.49年 | T102: 5.4 | U102: 4.8 | V102: 9.0000000000000011e-003 | W102: 0.14300000000000002 | X102: 0.114 | Y102: 38 | Z102: 1.27 | AA102: 3.0099999999999998e-002 | AB102: 2.4300000000000002e-002 | AC102: 1.03e-002 | AD102: 8.3000000000000001e-003 | AE102: 88.73 | AF102: 92.89 | AG102: 0.35 | AH102: AA | AI102: 4.4299999999999999e-002 | AJ102: =H102+100*O102 -> 125.61000000000001 | AK102: 120.4 | AL102: 86 | AM102: 27.5 | AN102: 84 | AO102: -4.0000000000000001e-002 | AP102: 8 | AQ102: 宁建转债!
A103: 201 | B103: 110059 | C103: 浦发转债! | D103: 600000 | E103: 浦发银行 | F103: 金融 | G103: 银行行业 | H103: 102.48 | I103: 3.8e-003 | J103: -3.4999999999999996e-003 | K103: 9.83 | L103: 2.e-003 | M103: 117.6 | N103: 14.45 | O103: 0.50600000000000001 | P103: 68.03 | Q103: 转股中 | R103: 4.80年 | S103: 无权 | T103: 500 | U103: 364 | V103: 6.9999999999999993e-003 | W103: 0.17300000000000001 | X103: 0.11800000000000001 | Y103: 2885. | Z103: 0.57 | AA103: 2.9900000000000003e-002 | AB103: 2.3099999999999999e-002 | AC103: 无权 | AD103: 无权 | AE103: 无权 | AF103: 99.11 | AG103: 0.17 | AH103: AAA | AI103: 3.73e-002 | AJ103: =H103+100*O103 -> 153.08000000000001 | AK103: 136.9 | AL103: 209 | AM103: 37.8 | AN103: 164 | AO103: 1.6e-002 | AP103: 76 | AQ103: 浦发转债!
A104: 250 | B104: 128057 | C104: 博彦转债 | D104: 2649 | E104: 博彦科技 | F104: 计算机及 | G104: 软件开发 | H104: 103.998 | I104: -1.84e-002 | J104: 2.3300000000000001e-002 | K104: 8.37 | L104: 8.3999999999999995e-003 | M104: 117.1 | N104: 8.72 | O104: 8.3000000000000004e-002 | P104: 95.99 | Q104: 转股中 | R104: 4年56天 | S104: 2年56天 | T104: 5.1 | U104: 31 | V104: 5.7999999999999996e-002 | W104: 0.114 | X104: 0.11 | Y104: 45 | Z104: 1.57 | AA104: 2.9700000000000001e-002 | AB104: 2.2099999999999998e-002 | AC104: -1.7000000000000001e-003 | AD104: -4.6999999999999993e-003 | AE104: 90.03 | AF104: 91.3 | AG104: 0.59 | AH104: AA- | AI104: 6.3299999999999995e-002 | AJ104: =H104+100*O104 -> 112.298 | AK104: 112 | AL104: 24 | AM104: 20.7 | AN104: 30 | AO104: -0.13 | AP104: 28 | AQ104: 博彦转债
A105: 177 | B105: 123039 | C105: 开润转债! | D105: 300577 | E105: 开润股份 | F105: 服装纺织 | G105: 纺织行业 | H105: 105.1 | I105: 1.e-003 | J105: 2.8000000000000004e-003 | K105: 25.1 | L105: 9.1999999999999998e-003 | M105: 121 | N105: 32.87 | O105: 0.376 | P105: 76.36 | Q105: 转股中 | R105: 4.96年 | S105: 2.96年 | T105: 2.22 | U105: 2.9 | V105: 1.3000000000000001e-002 | W105: 3.7000000000000005e-002 | X105: 2.7999999999999997e-002 | Y105: 60 | Z105: 6.54 | AA105: 2.9399999999999999e-002 | AB105: 2.1899999999999999e-002 | AC105: -3.0999999999999999e-003 | AD105: -5.6000000000000008e-003 | AE105: 83.36 | AF105: 85.44 | AG105: 0.4 | AH105: A+ | AI105: 7.4299999999999991e-002 | AJ105: =H105+100*O105 -> 142.69999999999999 | AK105: 133.8 | AL105: 194 | AM105: 48.4 | AN105: 220 | AO105: -7.8e-002 | AP105: 26 | AQ105: 开润转债!
A106: 63 | B106: 110074 | C106: 精达转债 | D106: 600577 | E106: 精达股份 | F106: 电子 | G106: 电子产品 | H106: 100 | I106: -7.4000000000000003e-003 | J106: 7.4000000000000003e-003 | K106: 3.14 | L106: 0. | M106: 117.3 | N106: 3.75 | O106: 0.19399999999999998 | P106: 83.73 | Q106: 48天 | R106: 5.61年 | S106: 3.61年 | T106: 7.87 | U106: 4.5 | V106: 6.0000000000000001e-003 | W106: 0.13 | X106: 0.109 | Y106: 60 | Z106: 1.71 | AA106: 2.9399999999999999e-002 | AB106: 2.3700000000000002e-002 | AC106: 1.e-002 | AD106: 8.0000000000000002e-003 | AE106: 88.26 | AF106: 92.41 | AG106: 0.42 | AH106: AA | AI106: 4.4299999999999999e-002 | AJ106: =H106+100*O106 -> 119.40000000000001 | AK106: 116.3 | AL106: 47 | AM106: 23.9 | AN106: 53 | AO106: -1.9e-002 | AP106: 8 | AQ106: 精达转债
A107: 38 | B107: 123071 | C107: 天能转债! | D107: 300569 | E107: 天能重工 | F107: 能源电力 | G107: 风能 | H107: 102.78 | I107: -2.8999999999999998e-003 | J107: -5.3e-003 | K107: 14.83 | L107: -2.1099999999999997e-002 | M107: 121.1 | N107: 20.05 | O107: 0.39000000000000001 | P107: 73.97 | Q107: 3月19天 | R107: 5.78年 | S107: 3.78年 | T107: 7 | U107: 11 | V107: 1.4999999999999999e-002 | W107: 0.12 | X107: 8.900000000000001e-002 | Y107: 58 | Z107: 2.63 | AA107: 2.9300000000000003e-002 | AB107: 2.2799999999999997e-002 | AC107: 3.0999999999999999e-003 | AD107: 1.1000000000000001e-003 | AE107: 81.21 | AF107: 84.61 | AG107: 0.39 | AH107: AA- | AI107: 6.5299999999999997e-002 | AJ107: =H107+100*O107 -> 141.78 | AK107: 131.6 | AL107: 183 | AM107: 47 | AN107: 215 | AO107: -0.111 | AP107: 7 | AQ107: 天能转债!
A108: 189 | B108: 128083 | C108: 新北转债! | D108: 2376 | E108: 新北洋 | F108: 电子 | G108: 电子产品 | H108: 100.193 | I108: 2.5000000000000001e-003 | J108: 6.7000000000000002e-003 | K108: 9.25 | L108: 2.7799999999999998e-002 | M108: 114.9 | N108: 11.7 | O108: 0.26700000000000002 | P108: 79.06 | Q108: 转股中 | R108: 4.93年 | S108: 2.93年 | T108: 8.77 | U108: 12 | V108: 1.3999999999999999e-002 | W108: 0.14199999999999999 | X108: 0.113 | Y108: 62 | Z108: 1.82 | AA108: 2.87e-002 | AB108: 2.3099999999999999e-002 | AC108: 1.03e-002 | AD108: 8.1000000000000013e-003 | AE108: 91.07 | AF108: 94.04 | AG108: 0.33 | AH108: AA | AI108: 4.2300000000000004e-002 | AJ108: =H108+100*O108 -> 126.893 | AK108: 121.3 | AL108: 94 | AM108: 27.3 | AN108: 83 | AO108: 1.2e-002 | AP108: 19 | AQ108: 新北转债!
A109: 252 | B109: 113021 | C109: 中信转债! | D109: 601998 | E109: 中信银行 | F109: 金融 | G109: 银行行业 | H109: 106.36 | I109: 3.4000000000000002e-003 | J109: -3.0000000000000001e-003 | K109: 5.1 | L109: 2.e-003 | M109: 118.8 | N109: 6.98 | O109: 0.45600000000000002 | P109: 73.07 | Q109: 转股中 | R109: 4年55天 | S109: 无权 | T109: 400 | U109: 35 | V109: 1.e-003 | W109: 0.16 | X109: 0.11699999999999999 | Y109: 2496. | Z109: 0.55 | AA109: 2.7900000000000001e-002 | AB109: 1.9599999999999999e-002 | AC109: 无权 | AD109: 无权 | AE109: 无权 | AF109: 102.55 | AG109: 0.18 | AH109: AAA | AI109: 3.73e-002 | AJ109: =H109+100*O109 -> 151.96000000000001 | AK109: 139.7 | AL109: 219 | AM109: 37.1 | AN109: 159 | AO109: 2.e-003 | AP109: 53 | AQ109: 中信转债!
A110: 14 | B110: 113610 | C110: 灵康转债 | D110: 603669 | E110: 灵康药业 | F110: 医药 | G110: 化学制药 | H110: 103.28 | I110: -5.9999999999999995e-004 | J110: -1.0800000000000001e-002 | K110: 8.59 | L110: -1.72e-002 | M110: 121.1 | N110: 8.81 | O110: 5.9000000000000004e-002 | P110: 97.5 | Q110: 5月0天 | R110: 5.90年 | S110: 3.90年 | T110: 5.25 | U110: 14 | V110: 2.7000000000000003e-002 | W110: 8.5999999999999993e-002 | X110: 8.4000000000000005e-002 | Y110: 61 | Z110: 4.49 | AA110: 2.7900000000000001e-002 | AB110: 2.1499999999999998e-002 | AC110: 1.8e-003 | AD110: -2.0000000000000001e-004 | AE110: 80.65 | AF110: 84.02 | AG110: 0.66 | AH110: AA- | AI110: 6.5299999999999997e-002 | AJ110: =H110+100*O110 -> 109.18000000000001 | AK110: 109.1 | AL110: 15 | AM110: 25 | AN110: 69 | AO110: -4.9000000000000002e-002 | AP110: 6 | AQ110: 灵康转债
A111: 156 | B111: 113570 | C111: 百达转债 | D111: 603331 | E111: 百达精工 | F111: 机械装备 | G111: 机械装备 | H111: 100.37 | I111: -3.2000000000000002e-003 | J111: 6.1999999999999998e-003 | K111: 10.08 | L111: 5.0000000000000001e-003 | M111: 115.3 | N111: 11.54 | O111: 0.14899999999999999 | P111: 87.35 | Q111: 转股中 | R111: 5.17年 | S111: 3.17年 | T111: 2.8 | U111: 1.4 | V111: 5.0000000000000001e-003 | W111: 0.155 | X111: 0.13600000000000001 | Y111: 18 | Z111: 2.33 | AA111: 2.7799999999999998e-002 | AB111: 2.2200000000000001e-002 | AC111: 1.0200000000000001e-002 | AD111: 8.0000000000000002e-003 | AE111: 81.45 | AF111: 79.51 | AG111: 0.61 | AH111: A+ | AI111: 7.6299999999999993e-002 | AJ111: =H111+100*O111 -> 115.27000000000001 | AK111: 113.4 | AL111: 32 | AM111: 31.9 | AN111: 124 | AO111: -4.2000000000000003e-002 | AP111: 35 | AQ111: 百达转债
A112: 243 | B112: 123024 | C112: 岱勒转债! | D112: 300700 | E112: 岱勒新材 | F112: 机械装备 | G112: 专用设备 | H112: 103.7 | I112: 4.4000000000000003e-003 | J112: 1.1000000000000001e-003 | K112: 18.57 | L112: 2.3099999999999999e-002 | M112: 113 | N112: 24.9 | O112: 0.39000000000000001 | P112: 74.58 | Q112: 转股中 | R112: 3.20年 | S112: 1.20年 | T112: 2.1 | U112: 60 | V112: 0.27500000000000002 | W112: 0.13699999999999998 | X112: 0.10199999999999999 | Y112: 15 | Z112: 3.1 | AA112: 2.76e-002 | AB112: 2.e-002 | AC112: -1.3899999999999999e-002 | AD112: -1.6399999999999998e-002 | AE112: 92.32 | AF112: 90.15 | AG112: 0.23 | AH112: A+ | AI112: 7.4299999999999991e-002 | AJ112: =H112+100*O112 -> 142.69999999999999 | AK112: 132.8 | AL112: 187 | AM112: 40.5 | AN112: 175 | AO112: -4.4000000000000004e-002 | AP112: 36 | AQ112: 岱勒转债!
A113: 308 | B113: 128026 | C113: 众兴转债! | D113: 2772 | E113: 众兴菌业 | F113: 农业 | G113: 种植业 | H113: 101.114 | I113: -2.1899999999999999e-002 | J113: -7.000000000000001e-004 | K113: 10.22 | L113: -5.1100000000000007e-002 | M113: 109.3 | N113: 11.45 | O113: 0.13300000000000001 | P113: 89.26 | Q113: 转股中 | R113: 2.93年 | S113: 0.93年 | T113: 9.19 | U113: 16 | V113: 1.7000000000000001e-002 | W113: 0.245 | X113: 0.218 | Y113: 38 | Z113: 1.53 | AA113: 2.7400000000000001e-002 | AB113: 2.12e-002 | AC113: 6.1999999999999998e-003 | AD113: 2.8999999999999998e-003 | AE113: 95.35 | AF113: 91.97 | AG113: 0.44 | AH113: AA- | AI113: 6.1699999999999998e-002 | AJ113: =H113+100*O113 -> 114.414 | AK113: 113 | AL113: 31 | AM113: 17.6 | AN113: 13 | AO113: -1.3999999999999999e-002 | AP113: 59 | AQ113: 众兴转债!
A114: 9 | B114: 128140 | C114: 润建转债 | D114: 2929 | E114: 润建股份 | F114: 通信互联 | G114: 通信设备 | H114: 98.5 | I114: 3.0999999999999999e-003 | J114: -1.5e-003 | K114: 23.51 | L114: 3.0000000000000001e-003 | M114: 115.2 | N114: 26.55 | O114: 0.11199999999999999 | P114: 88.55 | Q114: 5月4天 | R114: 5.91年 | S114: 3.91年 | T114: 10.9 | U114: 16 | V114: 1.4999999999999999e-002 | W114: 0.20999999999999999 | X114: 0.18600000000000003 | Y114: 52 | Z114: 1.75 | AA114: 2.7300000000000001e-002 | AB114: 2.2499999999999999e-002 | AC114: 1.2800000000000001e-002 | AD114: 1.1000000000000001e-002 | AE114: 87.02 | AF114: 89.56 | AG114: 0.51 | AH114: AA | AI114: 4.4299999999999999e-002 | AJ114: =H114+100*O114 -> 109.7 | AK114: 108.5 | AL114: 12 | AM114: 18.9 | AN114: 23 | AO114: -2.7999999999999997e-002 | AP114: 4 | AQ114: 润建转债
A115: 134 | B115: 123049 | C115: 维尔转债 | D115: 300190 | E115: 维尔利 | F115: 城市公用 | G115: 三废处理 | H115: 108.9 | I115: 0. | J115: 1.2e-002 | K115: 7.32 | L115: 1.95e-002 | M115: 124.8 | N115: 7.48 | O115: 0.113 | P115: 97.86 | Q115: 转股中 | R115: 5.26年 | S115: 3.26年 | T115: 9.17 | U115: 16 | V115: 1.6e-002 | W115: 0.16 | X115: 0.157 | Y115: 57 | Z115: 1.36 | AA115: 2.69e-002 | AB115: 1.8700000000000001e-002 | AC115: -1.15e-002 | AD115: -1.41e-002 | AE115: 84.57 | AF115: 90.23 | AG115: 0.62 | AH115: AA- | AI115: 6.5299999999999997e-002 | AJ115: =H115+100*O115 -> 120.2 | AK115: 119.9 | AL115: 81 | AM115: 29.7 | AN115: 99 | AO115: -5.2000000000000005e-002 | AP115: 14 | AQ115: 维尔转债
A116: 79 | B116: 128122 | C116: 兴森转债 | D116: 2436 | E116: 兴森科技 | F116: 电子 | G116: 元器件制 | H116: 100.751 | I116: -1.8e-003 | J116: 3.9000000000000003e-003 | K116: 9.22 | L116: 1.43e-002 | M116: 113.3 | N116: 14.18 | O116: 0.55000000000000004 | P116: 65.02 | Q116: 21天 | R116: 4.54年 | S116: 3.54年 | T116: 2.69 | U116: 2.7 | V116: 1.e-002 | W116: 2.e-002 | X116: 1.3000000000000001e-002 | Y116: 137 | Z116: 4.34 | AA116: 2.6499999999999999e-002 | AB116: 2.1099999999999997e-002 | AC116: 7.7000000000000002e-003 | AD116: 5.7999999999999996e-003 | AE116: 89.01 | AF116: 94.1 | AG116: 0.15 | AH116: AA | AI116: 4.2300000000000004e-002 | AJ116: =H116+100*O116 -> 155.751 | AK116: 136.5 | AL116: 206 | AM116: 42.4 | AN116: 184 | AO116: -6.5000000000000002e-002 | AP116: 10 | AQ116: 兴森转债
A117: 8 | B117: 113612 | C117: 永冠转债 | D117: 603681 | E117: 永冠新材 | F117: 化工 | G117: 其他 | H117: 104.14 | I117: -2.12e-002 | J117: 4.2999999999999997e-002 | K117: 20.35 | L117: 3.1899999999999998e-002 | M117: 121.2 | N117: 20.79 | O117: 6.4000000000000001e-002 | P117: 97.88 | Q117: 5月7天 | R117: 5.92年 | S117: 3.92年 | T117: 5.2 | U117: 111 | V117: 0.20100000000000001 | W117: 0.153 | X117: 0.14999999999999999 | Y117: 34 | Z117: 2.29 | AA117: 2.6499999999999999e-002 | AB117: 2.0099999999999996e-002 | AC117: -1.e-004 | AD117: -2.e-003 | AE117: 80.65 | AF117: 84.02 | AG117: 0.68 | AH117: AA- | AI117: 6.5299999999999997e-002 | AJ117: =H117+100*O117 -> 110.54000000000001 | AK117: 110.4 | AL117: 18 | AM117: 26.4 | AN117: 78 | AO117: 3.9e-002 | AP117: 1 | AQ117: 永冠转债
A118: 93 | B118: 110071 | C118: 湖盐转债 | D118: 600929 | E118: 雪天盐业 | F118: 食品饮料 | G118: 食品饮料 | H118: 100.12 | I118: -1.6799999999999999e-002 | J118: 7.0999999999999995e-003 | K118: 5.47 | L118: -2.3199999999999998e-002 | M118: 115.2 | N118: 6.6 | O118: 0.20800000000000002 | P118: 82.88 | Q118: 10天 | R118: 5.50年 | S118: 3.50年 | T118: 7.2 | U118: 3.3 | V118: 5.0000000000000001e-003 | W118: 0.14300000000000002 | X118: 0.11900000000000001 | Y118: 50 | Z118: 1.97 | AA118: 2.63e-002 | AB118: 2.12e-002 | AC118: 9.7000000000000003e-003 | AD118: 7.7000000000000002e-003 | AE118: 88.59 | AF118: 91.17 | AG118: 0.42 | AH118: AA | AI118: 4.4299999999999999e-002 | AJ118: =H118+100*O118 -> 120.92 | AK118: 117.4 | AL118: 61 | AM118: 26.2 | AN118: 76 | AO118: -6.3e-002 | AP118: 14 | AQ118: 湖盐转债
A119: 179 | B119: 113030 | C119: 东风转债 | D119: 601515 | E119: 东风股份 | F119: 造纸包装 | G119: 包装材料 | H119: 103.26 | I119: -1.37e-002 | J119: 8.3999999999999995e-003 | K119: 5.41 | L119: -1.6399999999999998e-002 | M119: 116.9 | N119: 6.75 | O119: 0.28800000000000003 | P119: 80.15 | Q119: 转股中 | R119: 4.96年 | S119: 2.96年 | T119: 2.95 | U119: 2.8 | V119: 9.0000000000000011e-003 | W119: 4.0999999999999995e-002 | X119: 3.3000000000000002e-002 | Y119: 72 | Z119: 1.73 | AA119: 2.58e-002 | AB119: 1.9599999999999999e-002 | AC119: 4.0000000000000002e-004 | AD119: -1.7000000000000001e-003 | AE119: 90.94 | AF119: 95.54 | AG119: 0.32 | AH119: AA | AI119: 4.2300000000000004e-002 | AJ119: =H119+100*O119 -> 132.06 | AK119: 126.4 | AL119: 142 | AM119: 30.8 | AN119: 113 | AO119: -7.5999999999999998e-002 | AP119: 17 | AQ119: 东风转债
A120: 117 | B120: 123053 | C120: 宝通转债 | D120: 300031 | E120: 宝通科技 | F120: 通信互联 | G120: 互联网 | H120: 106.5 | I120: 8.5000000000000006e-003 | J120: 2.7000000000000001e-003 | K120: 17.8 | L120: 2.18e-002 | M120: 121.3 | N120: 20.8 | O120: 0.24399999999999999 | P120: 85.58 | Q120: 转股中 | R120: 5.41年 | S120: 3.41年 | T120: 5 | U120: 20 | V120: 3.7999999999999999e-002 | W120: 7.0999999999999994e-002 | X120: 6.0999999999999999e-002 | Y120: 71 | Z120: 2.46 | AA120: 2.4900000000000002e-002 | AB120: 1.7899999999999999e-002 | AC120: -6.0999999999999995e-003 | AD120: -8.3999999999999995e-003 | AE120: 83.38 | AF120: 86.86 | AG120: 0.52 | AH120: AA- | AI120: 6.5299999999999997e-002 | AJ120: =H120+100*O120 -> 130.90000000000001 | AK120: 127.4 | AL120: 150 | AM120: 40.6 | AN120: 177 | AO120: -1.6e-002 | AP120: 8 | AQ120: 宝通转债
A121: 202 | B121: 127014 | C121: 北方转债 | D121: 65 | E121: 北方国际 | F121: 建筑 | G121: 建筑工程 | H121: 102.7 | I121: -7.1999999999999998e-003 | J121: 6.1999999999999998e-003 | K121: 7.4 | L121: -2.7000000000000001e-003 | M121: 115.1 | N121: 8.75 | O121: 0.214 | P121: 84.57 | Q121: 转股中 | R121: 4.79年 | S121: 2.79年 | T121: 5.78 | U121: 2 | V121: 3.0000000000000001e-003 | W121: 0.10199999999999999 | X121: 8.5999999999999993e-002 | Y121: 57 | Z121: 1.07 | AA121: 2.46e-002 | AB121: 1.8700000000000001e-002 | AC121: 3.0000000000000001e-003 | AD121: 5.9999999999999995e-004 | AE121: 92.29 | AF121: 95.62 | AG121: 0.39 | AH121: AA+ | AI121: 4.0300000000000002e-002 | AJ121: =H121+100*O121 -> 124.09999999999999 | AK121: 120.8 | AL121: 87 | AM121: 25.2 | AN121: 71 | AO121: -2.e-003 | AP121: 17 | AQ121: 北方转债
A122: 194 | B122: 113549 | C122: 白电转债 | D122: 603861 | E122: 白云电器 | F122: 能源电力 | G122: 电力设备 | H122: 102.25 | I122: -1.1399999999999999e-002 | J122: 4.5999999999999999e-003 | K122: 7.88 | L122: -1.4999999999999999e-002 | M122: 114.8 | N122: 8.88 | O122: 0.152 | P122: 88.74 | Q122: 转股中 | R122: 4.85年 | S122: 2.85年 | T122: 8.8 | U122: 2 | V122: 2.e-003 | W122: 0.253 | X122: 0.22399999999999998 | Y122: 35 | Z122: 1.49 | AA122: 2.46e-002 | AB122: 1.89e-002 | AC122: 3.4000000000000002e-003 | AD122: 1.2999999999999999e-003 | AE122: 91.25 | AF122: 94.23 | AG122: 0.45 | AH122: AA | AI122: 4.2300000000000004e-002 | AJ122: =H122+100*O122 -> 117.45 | AK122: 115.8 | AL122: 44 | AM122: 21.5 | AN122: 33 | AO122: -4.2999999999999997e-002 | AP122: 33 | AQ122: 白电转债
A123: 211 | B123: 128073 | C123: 哈尔转债! | D123: 2615 | E123: 哈尔斯 | F123: 其他 | G123: 家居用品 | H123: 105.9 | I123: -7.0999999999999995e-003 | J123: 1.18e-002 | K123: 4.21 | L123: 1.9400000000000001e-002 | M123: 115.3 | N123: 5.7 | O123: 0.434 | P123: 73.86 | Q123: 转股中 | R123: 3.62年 | S123: 1.62年 | T123: 2.99 | U123: 54 | V123: 0.16800000000000001 | W123: 0.17199999999999999 | X123: 0.127 | Y123: 17 | Z123: 2.17 | AA123: 2.41e-002 | AB123: 1.6399999999999998e-002 | AC123: -2.06e-002 | AD123: -2.2799999999999997e-002 | AE123: 91.52 | AF123: 92.63 | AG123: 0.24 | AH123: AA- | AI123: 6.3299999999999995e-002 | AJ123: =H123+100*O123 -> 149.30000000000001 | AK123: 137.9 | AL123: 212 | AM123: 45.3 | AN123: 205 | AO123: -0.111 | AP123: 40 | AQ123: 哈尔转债!
A124: 174 | B124: 113561 | C124: 正裕转债! | D124: 603089 | E124: 正裕工业 | F124: 汽车 | G124: 零部件制 | H124: 105.31 | I124: -1.9e-002 | J124: 8.0000000000000004e-004 | K124: 9.08 | L124: -3.0899999999999997e-002 | M124: 118 | N124: 10.23 | O124: 0.18600000000000003 | P124: 88.76 | Q124: 转股中 | R124: 4.98年 | S124: 2.98年 | T124: 1.5 | U124: 4.5 | V124: 2.8999999999999998e-002 | W124: 7.400000000000001e-002 | X124: 6.6000000000000003e-002 | Y124: 20 | Z124: 2.17 | AA124: 2.3599999999999999e-002 | AB124: 1.7100000000000001e-002 | AC124: -3.4999999999999996e-003 | AD124: -6.0999999999999995e-003 | AE124: 83.36 | AF124: 83.27 | AG124: 0.59 | AH124: A+ | AI124: 7.4299999999999991e-002 | AJ124: =H124+100*O124 -> 123.91 | AK124: 121.9 | AL124: 99 | AM124: 38.5 | AN124: 167 | AO124: -0.16300000000000001 | AP124: 34 | AQ124: 正裕转债!
A125: 84 | B125: 113594 | C125: 淳中转债! | D125: 603516 | E125: 淳中科技 | F125: 电子 | G125: 电子产品 | H125: 107.04 | I125: -2.3999999999999998e-003 | J125: 8.3000000000000001e-003 | K125: 29.8 | L125: 1.29e-002 | M125: 121.4 | N125: 39.37 | O125: 0.41399999999999998 | P125: 75.69 | Q125: 19天 | R125: 5.53年 | S125: 3.53年 | T125: 3 | U125: 2.5 | V125: 8.0000000000000002e-003 | W125: 7.5999999999999998e-002 | X125: 5.7000000000000002e-002 | Y125: 40 | Z125: 4.42 | AA125: 2.35e-002 | AB125: 1.67e-002 | AC125: -6.4000000000000003e-003 | AD125: -8.6999999999999994e-003 | AE125: 79.95 | AF125: 81.62 | AG125: 0.45 | AH125: A+ | AI125: 7.6299999999999993e-002 | AJ125: =H125+100*O125 -> 148.44 | AK125: 138.4 | AL125: 214 | AM125: 56.8 | AN125: 251 | AO125: -5.9000000000000004e-002 | AP125: 7 | AQ125: 淳中转债!
A126: 263 | B126: 128051 | C126: 光华转债! | D126: 2741 | E126: 光华科技 | F126: 电子 | G126: 元器件制 | H126: 105 | I126: -8.0000000000000002e-003 | J126: 4.1999999999999997e-003 | K126: 12.04 | L126: -6.6e-003 | M126: 114.8 | N126: 12.72 | O126: 0.109 | P126: 94.65 | Q126: 转股中 | R126: 3.93年 | S126: 1.93年 | T126: 2.5 | U126: 5.3 | V126: 2.e-002 | W126: 5.5e-002 | X126: 5.2999999999999999e-002 | Y126: 45 | Z126: 3.72 | AA126: 2.3399999999999997e-002 | AB126: 1.6399999999999998e-002 | AC126: -8.6e-003 | AD126: -1.15e-002 | AE126: 90.75 | AF126: 90.61 | AG126: 0.58 | AH126: AA- | AI126: 6.3299999999999995e-002 | AJ126: =H126+100*O126 -> 115.90000000000001 | AK126: 115.3 | AL126: 42 | AM126: 24.6 | AN126: 63 | AO126: -2.7000000000000003e-002 | AP126: 25 | AQ126: 光华转债!
A127: 121 | B127: 123051 | C127: 今天转债 | D127: 300532 | E127: 今天国际 | F127: 计算机及 | G127: 软件开发 | H127: 108.7 | I127: -1.3600000000000001e-002 | J127: 1.1299999999999999e-002 | K127: 9 | L127: -3.3e-003 | M127: 122.8 | N127: 8.8 | O127: 6.3e-002 | P127: 102.27 | Q127: 转股中 | R127: 5.40年 | S127: 3.40年 | T127: 2.8 | U127: 25 | V127: 8.0000000000000002e-002 | W127: 0.114 | X127: 0.11599999999999999 | Y127: 25 | Z127: 3.09 | AA127: 2.3399999999999997e-002 | AB127: 1.6e-002 | AC127: -1.0500000000000001e-002 | AD127: -1.3000000000000001e-002 | AE127: 80.83 | AF127: 83.38 | AG127: 0.71 | AH127: A+ | AI127: 7.6299999999999993e-002 | AJ127: =H127+100*O127 -> 115. | AK127: 115.1 | AL127: 41 | AM127: 31.8 | AN127: 121 | AO127: -9.8000000000000004e-002 | AP127: 13 | AQ127: 今天转债
A128: 233 | B128: 113534 | C128: 鼎胜转债! | D128: 603876 | E128: 鼎胜新材 | F128: 有色金属 | G128: 小金属 | H128: 104.46 | I128: -3.2300000000000002e-002 | J128: 1.2699999999999999e-002 | K128: 14.37 | L128: -3.9399999999999998e-002 | M128: 114.9 | N128: 15.18 | O128: 0.10300000000000001 | P128: 94.66 | Q128: 转股中 | R128: 4.25年 | S128: 2.25年 | T128: 12 | U128: 14 | V128: 1.1000000000000001e-002 | W128: 0.192 | X128: 0.182 | Y128: 62 | Z128: 1.74 | AA128: 2.3199999999999998e-002 | AB128: 1.66e-002 | AC128: -4.3e-003 | AD128: -6.9999999999999993e-003 | AE128: 93.66 | AF128: 96.72 | AG128: 0.5 | AH128: AA | AI128: 4.2300000000000004e-002 | AJ128: =H128+100*O128 -> 114.75999999999999 | AK128: 114.3 | AL128: 37 | AM128: 17.5 | AN128: 12 | AO128: -1.3999999999999999e-002 | AP128: 32 | AQ128: 鼎胜转债!
A129: 44 | B129: 123068 | C129: 弘信转债 | D129: 300657 | E129: 弘信电子 | F129: 电子 | G129: 元器件制 | H129: 106.85 | I129: -2.8000000000000004e-003 | J129: 3.9000000000000003e-003 | K129: 16.66 | L129: 1.8e-003 | M129: 121.2 | N129: 18.45 | O129: 0.183 | P129: 90.3 | Q129: 3月13天 | R129: 5.77年 | S129: 3.77年 | T129: 5.7 | U129: 2.6 | V129: 4.0000000000000001e-003 | W129: 0.10000000000000001 | X129: 8.9999999999999997e-002 | Y129: 57 | Z129: 3.89 | AA129: 2.2499999999999999e-002 | AB129: 1.61e-002 | AC129: -6.6e-003 | AD129: -8.6e-003 | AE129: 81.4 | AF129: 84.8 | AG129: 0.59 | AH129: AA- | AI129: 6.5299999999999997e-002 | AJ129: =H129+100*O129 -> 125.14999999999999 | AK129: 123.4 | AL129: 115 | AM129: 38.6 | AN129: 168 | AO129: 4.0000000000000001e-002 | AP129: 5 | AQ129: 弘信转债
A130: 140 | B130: 128105 | C130: 长集转债 | D130: 2616 | E130: 长青集团 | F130: 城市公用 | G130: 三废处理 | H130: 103.1 | I130: 1.0700000000000001e-002 | J130: 1.1000000000000001e-003 | K130: 7.28 | L130: 2.3900000000000001e-002 | M130: 115.3 | N130: 8.11 | O130: 0.14899999999999999 | P130: 89.77 | Q130: 转股中 | R130: 5.25年 | S130: 3.25年 | T130: 8 | U130: 54 | V130: 6.5000000000000002e-002 | W130: 0.14800000000000002 | X130: 0.13300000000000001 | Y130: 54 | Z130: 2.15 | AA130: 2.2000000000000002e-002 | AB130: 1.66e-002 | AC130: 2.e-003 | AD130: -2.0000000000000001e-004 | AE130: 89.66 | AF130: 92.27 | AG130: 0.49 | AH130: AA | AI130: 4.4299999999999999e-002 | AJ130: =H130+100*O130 -> 118. | AK130: 116.4 | AL130: 51 | AM130: 24.2 | AN130: 58 | AO130: -7.9000000000000001e-002 | AP130: 9 | AQ130: 长集转债
A131: 147 | B131: 110068 | C131: 龙净转债! | D131: 600388 | E131: 龙净环保 | F131: 城市公用 | G131: 三废处理 | H131: 102.98 | I131: -2.7000000000000001e-003 | J131: 5.7999999999999996e-003 | K131: 8.84 | L131: 8.0000000000000002e-003 | M131: 115 | N131: 10.73 | O131: 0.25 | P131: 82.39 | Q131: 转股中 | R131: 5.21年 | S131: 3.21年 | T131: 20 | U131: 6.2 | V131: 3.0000000000000001e-003 | W131: 0.21199999999999999 | X131: 0.17399999999999999 | Y131: 95 | Z131: 1.64 | AA131: 2.18e-002 | AB131: 1.6500000000000001e-002 | AC131: 1.5e-003 | AD131: -5.0000000000000001e-004 | AE131: 90.11 | AF131: 93.06 | AG131: 0.39 | AH131: AA+ | AI131: 4.2300000000000004e-002 | AJ131: =H131+100*O131 -> 127.98 | AK131: 123.6 | AL131: 117 | AM131: 30.5 | AN131: 109 | AO131: -2.1000000000000001e-002 | AP131: 31 | AQ131: 龙净转债!
A132: 30 | B132: 123075 | C132: 贝斯转债 | D132: 300580 | E132: 贝斯特 | F132: 汽车 | G132: 零部件制 | H132: 102.33 | I132: -1.78e-002 | J132: 5.8999999999999999e-003 | K132: 18.42 | L132: -2.5399999999999999e-002 | M132: 115.5 | N132: 23.99 | O132: 0.33299999999999996 | P132: 76.78 | Q132: 3月28天 | R132: 5.82年 | S132: 3.82年 | T132: 6 | U132: 12 | V132: 1.9e-002 | W132: 0.16300000000000001 | X132: 0.125 | Y132: 37 | Z132: 2.29 | AA132: 2.1400000000000002e-002 | AB132: 1.6500000000000001e-002 | AC132: 3.7000000000000002e-003 | AD132: 1.8e-003 | AE132: 80.9 | AF132: 80.53 | AG132: 0.47 | AH132: AA- | AI132: 6.5299999999999997e-002 | AJ132: =H132+100*O132 -> 135.63 | AK132: 127.9 | AL132: 157 | AM132: 47 | AN132: 214 | AO132: -0.124 | AP132: 3 | AQ132: 贝斯转债
A133: 144 | B133: 113033 | C133: 利群转债! | D133: 601366 | E133: 利群股份 | F133: 商业零售 | G133: 商场 | H133: 103.6 | I133: -1.4000000000000002e-003 | J133: 9.1000000000000004e-003 | K133: 6.81 | L133: 1.34e-002 | M133: 115.3 | N133: 7.01 | O133: 6.6000000000000003e-002 | P133: 97.15 | Q133: 转股中 | R133: 5.23年 | S133: 3.23年 | T133: 18 | U133: 16 | V133: 9.0000000000000011e-003 | W133: 0.307 | X133: 0.29799999999999999 | Y133: 59 | Z133: 1.31 | AA133: 2.1099999999999997e-002 | AB133: 1.5700000000000002e-002 | AC133: 5.9999999999999995e-004 | AD133: -1.6000000000000001e-003 | AE133: 89.74 | AF133: 92.36 | AG133: 0.57 | AH133: AA | AI133: 4.4299999999999999e-002 | AJ133: =H133+100*O133 -> 110.19999999999999 | AK133: 110.1 | AL133: 16 | AM133: 17.7 | AN133: 17 | AO133: 0. | AP133: 40 | AQ133: 利群转债!
A134: 314 | B134: 110038 | C134: 济川转债! | D134: 600566 | E134: 济川药业 | F134: 医药 | G134: 中药 | H134: 103.55 | I134: 5.0000000000000001e-004 | J134: 2.2000000000000001e-003 | K134: 20.42 | L134: 1.1899999999999999e-002 | M134: 107.5 | N134: 23.85 | O134: 0.20899999999999999 | P134: 85.62 | Q134: 转股中 | R134: 1.85年 | S134: 回售中 | T134: 6.28 | U134: 15 | V134: 2.3e-002 | W134: 3.5000000000000003e-002 | X134: 2.9999999999999999e-002 | Y134: 181 | Z134: 2.47 | AA134: 2.06e-002 | AB134: 1.2800000000000001e-002 | AC134: 回售中 | AD134: 回售中 | AE134: 100.25 | AF134: 99.92 | AG134: 0.22 | AH134: AA | AI134: 4.07e-002 | AJ134: =H134+100*O134 -> 124.44999999999999 | AK134: 121.5 | AL134: 95 | AM134: 21.2 | AN134: 32 | AO134: -1.6e-002 | AP134: 21 | AQ134: 济川转债!
A135: 77 | B135: 128123 | C135: 国光转债 | D135: 2749 | E135: 国光股份 | F135: 化工 | G135: 农化 | H135: 104 | I135: -4.7999999999999996e-003 | J135: 6.4000000000000003e-003 | K135: 10.26 | L135: 3.9000000000000003e-003 | M135: 116.2 | N135: 13.7 | O135: 0.38900000000000001 | P135: 74.89 | Q135: 24天 | R135: 5.55年 | S135: 3.55年 | T135: 3.2 | U135: 3.2 | V135: 9.0000000000000011e-003 | W135: 7.2000000000000008e-002 | X135: 5.4000000000000006e-002 | Y135: 44 | Z135: 3.6 | AA135: 2.06e-002 | AB135: 1.5300000000000001e-002 | AC135: 2.9999999999999997e-004 | AD135: -1.8e-003 | AE135: 82.54 | AF135: 82.47 | AG135: 0.42 | AH135: AA- | AI135: 6.5299999999999997e-002 | AJ135: =H135+100*O135 -> 142.90000000000001 | AK135: 133.1 | AL135: 190 | AM135: 50.6 | AN135: 232 | AO135: -9.3000000000000013e-002 | AP135: 9 | AQ135: 国光转债
A136: 248 | B136: 110053 | C136: 苏银转债! | D136: 600919 | E136: 江苏银行 | F136: 金融 | G136: 银行行业 | H136: 109.8 | I136: 7.3000000000000001e-003 | J136: -7.3000000000000001e-003 | K136: 5.39 | L136: 0. | M136: 119.1 | N136: 6.69 | O136: 0.36299999999999999 | P136: 80.57 | Q136: 转股中 | R136: 4.18年 | S136: 无权 | T136: 200 | U136: 76 | V136: 3.0000000000000001e-003 | W136: 0.32100000000000001 | X136: 0.25900000000000001 | Y136: 622 | Z136: 0.53 | AA136: 2.0299999999999999e-002 | AB136: 1.2e-002 | AC136: 无权 | AD136: 无权 | AE136: 无权 | AF136: 102.71 | AG136: 0.28 | AH136: AAA | AI136: 3.73e-002 | AJ136: =H136+100*O136 -> 146.09999999999999 | AK136: 139 | AL136: 215 | AM136: 36.3 | AN136: 152 | AO136: -4.4000000000000004e-002 | AP136: 46 | AQ136: 苏银转债!
A137: 119 | B137: 113584 | C137: 家悦转债! | D137: 603708 | E137: 家家悦 | F137: 商业零售 | G137: 超市 | H137: 103.67 | I137: 6.4000000000000003e-003 | J137: -2.0000000000000001e-004 | K137: 21.33 | L137: 6.8099999999999994e-002 | M137: 115.3 | N137: 37.97 | O137: 0.84499999999999997 | P137: 56.18 | Q137: 转股中 | R137: 5.41年 | S137: 3.41年 | T137: 6.45 | U137: 64 | V137: 9.4e-002 | W137: 5.0000000000000003e-002 | X137: 2.7999999999999997e-002 | Y137: 130 | Z137: 4.32 | AA137: 2.0299999999999999e-002 | AB137: 1.4999999999999999e-002 | AC137: 4.0000000000000002e-004 | AD137: -1.7000000000000001e-003 | AE137: 89.05 | AF137: 91.65 | AG137: 0.09 | AH137: AA | AI137: 4.4299999999999999e-002 | AJ137: =H137+100*O137 -> 188.17000000000002 | AK137: 151.2 | AL137: 263 | AM137: 59.5 | AN137: 261 | AO137: -8.5999999999999993e-002 | AP137: 7 | AQ137: 家悦转债!
A138: 74 | B138: 128124 | C138: 科华转债! | D138: 2022 | E138: 科华生物 | F138: 医药 | G138: 生物制药 | H138: 98.84 | I138: -4.5999999999999999e-003 | J138: 1.1399999999999999e-002 | K138: 16.02 | L138: 1.9699999999999999e-002 | M138: 110.3 | N138: 21.51 | O138: 0.32700000000000001 | P138: 74.48 | Q138: 26天 | R138: 5.55年 | S138: 3.55年 | T138: 7.38 | U138: 3.7 | V138: 5.0000000000000001e-003 | W138: 8.9999999999999997e-002 | X138: 6.7000000000000004e-002 | Y138: 82 | Z138: 2.86 | AA138: 2.0299999999999999e-002 | AB138: 1.67e-002 | AC138: 1.1399999999999999e-002 | AD138: 9.7000000000000003e-003 | AE138: 87.83 | AF138: 87.06 | AG138: 0.34 | AH138: AA | AI138: 4.4299999999999999e-002 | AJ138: =H138+100*O138 -> 131.54000000000002 | AK138: 123.2 | AL138: 112 | AM138: 35.4 | AN138: 147 | AO138: -5.0000000000000003e-002 | AP138: 14 | AQ138: 科华转债!
A139: 66 | B139: 127021 | C139: 特发转2! | D139: 70 | E139: 特发信息 | F139: 通信互联 | G139: 通信设备 | H139: 103.499 | I139: -1.6000000000000001e-003 | J139: 3.8e-003 | K139: 8.96 | L139: 9.0000000000000011e-003 | M139: 113.3 | N139: 12.33 | O139: 0.42399999999999999 | P139: 72.67 | Q139: 36天 | R139: 4.58年 | S139: 2.58年 | T139: 5.5 | U139: 3.8 | V139: 6.9999999999999993e-003 | W139: 7.4999999999999997e-002 | X139: 5.5e-002 | Y139: 73 | Z139: 2.58 | AA139: 2.0199999999999999e-002 | AB139: 1.4800000000000001e-002 | AC139: -5.1000000000000004e-003 | AD139: -6.6e-003 | AE139: 91.13 | AF139: 93.94 | AG139: 0.24 | AH139: AA | AI139: 4.2300000000000004e-002 | AJ139: =H139+100*O139 -> 145.899 | AK139: 134.3 | AL139: 197 | AM139: 40.4 | AN139: 173 | AO139: -6.9000000000000006e-002 | AP139: 7 | AQ139: 特发转2!
A140: 53 | B140: 128131 | C140: 崇达转2! | D140: 2815 | E140: 崇达技术 | F140: 电子 | G140: 元器件制 | H140: 103.3 | I140: 0. | J140: 9.300000000000001e-003 | K140: 13.92 | L140: 3.4200000000000001e-002 | M140: 115.2 | N140: 19.54 | O140: 0.45000000000000001 | P140: 71.24 | Q140: 2月2天 | R140: 5.66年 | S140: 3.66年 | T140: 14 | U140: 9.5 | V140: 6.9999999999999993e-003 | W140: 0.114 | X140: 8.1000000000000003e-002 | Y140: 123 | Z140: 3.07 | AA140: 1.9799999999999998e-002 | AB140: 1.49e-002 | AC140: 1.e-003 | AD140: -8.9999999999999998e-004 | AE140: 87.97 | AF140: 90.54 | AG140: 0.27 | AH140: AA | AI140: 4.4299999999999999e-002 | AJ140: =H140+100*O140 -> 148.30000000000001 | AK140: 135.4 | AL140: 201 | AM140: 44.8 | AN140: 200 | AO140: -6.0999999999999999e-002 | AP140: 5 | AQ140: 崇达转2!
A141: 73 | B141: 123063 | C141: 大禹转债 | D141: 300021 | E141: 大禹节水 | F141: 化工 | G141: 橡胶塑料 | H141: 113.8 | I141: -2.3e-003 | J141: 7.6e-003 | K141: 5.04 | L141: 8.0000000000000002e-003 | M141: 126.5 | N141: 4.94 | O141: 0.115 | P141: 102.02 | Q141: 26天 | R141: 5.55年 | S141: 4.55年 | T141: 6.38 | U141: 7 | V141: 1.e-002 | W141: 0.159 | X141: 0.16200000000000001 | Y141: 40 | Z141: 2.78 | AA141: 1.9599999999999999e-002 | AB141: 1.1599999999999999e-002 | AC141: -1.32e-002 | AD141: -1.5900000000000001e-002 | AE141: 79.82 | AF141: 89.72 | AG141: 0.67 | AH141: AA- | AI141: 6.5299999999999997e-002 | AJ141: =H141+100*O141 -> 125.3 | AK141: 125.6 | AL141: 136 | AM141: 35.9 | AN141: 150 | AO141: -6.0999999999999999e-002 | AP141: 15 | AQ141: 大禹转债
A142: 46 | B142: 113604 | C142: 多伦转债! | D142: 603528 | E142: 多伦科技 | F142: 计算机及 | G142: 软件开发 | H142: 105.34 | I142: 6.9999999999999993e-003 | J142: -1.1899999999999999e-002 | K142: 8.72 | L142: -9.1000000000000004e-003 | M142: 117.3 | N142: 10.44 | O142: 0.26100000000000001 | P142: 83.52 | Q142: 3月11天 | R142: 5.76年 | S142: 3.76年 | T142: 6.4 | U142: 29 | V142: 4.2000000000000003e-002 | W142: 0.11699999999999999 | X142: 9.8000000000000004e-002 | Y142: 55 | Z142: 3.38 | AA142: 1.9199999999999998e-002 | AB142: 1.38e-002 | AC142: -3.8e-003 | AD142: -5.6000000000000008e-003 | AE142: 81.16 | AF142: 82.05 | AG142: 0.54 | AH142: AA- | AI142: 6.5299999999999997e-002 | AJ142: =H142+100*O142 -> 131.44 | AK142: 127.2 | AL142: 149 | AM142: 45.1 | AN142: 202 | AO142: -0.10099999999999999 | AP142: 4 | AQ142: 多伦转债!
A143: 32 | B143: 113606 | C143: 荣泰转债 | D143: 603579 | E143: 荣泰健康 | F143: 机械装备 | G143: 专用设备 | H143: 109 | I143: 8.9999999999999998e-004 | J143: -4.1999999999999997e-003 | K143: 30.18 | L143: -5.6000000000000008e-003 | M143: 121.2 | N143: 33.32 | O143: 0.20300000000000001 | P143: 90.58 | Q143: 3月27天 | R143: 5.81年 | S143: 3.81年 | T143: 6 | U143: 5.4 | V143: 8.0000000000000002e-003 | W143: 0.14199999999999999 | X143: 0.129 | Y143: 42 | Z143: 2.67 | AA143: 1.8799999999999997e-002 | AB143: 1.24e-002 | AC143: -1.1599999999999999e-002 | AD143: -1.3500000000000002e-002 | AE143: 81.19 | AF143: 84.59 | AG143: 0.59 | AH143: AA- | AI143: 6.5299999999999997e-002 | AJ143: =H143+100*O143 -> 129.30000000000001 | AK143: 127.4 | AL143: 151 | AM143: 42.8 | AN143: 190 | AO143: -2.6000000000000002e-002 | AP143: 6 | AQ143: 荣泰转债
A144: 267 | B144: 110047 | C144: 山鹰转债 | D144: 600567 | E144: 山鹰国际 | F144: 造纸包装 | G144: 包装用纸 | H144: 109.55 | I144: 3.2000000000000002e-003 | J144: -4.0000000000000002e-004 | K144: 3.2 | L144: 6.3e-003 | M144: 117.5 | N144: 3.34 | O144: 0.14300000000000002 | P144: 95.81 | Q144: 转股中 | R144: 3.87年 | S144: 1.87年 | T144: 23 | U144: 14 | V144: 5.0000000000000001e-003 | W144: 0.156 | X144: 0.14999999999999999 | Y144: 147 | Z144: 1 | AA144: 1.8600000000000002e-002 | AB144: 1.0500000000000001e-002 | AC144: -3.0800000000000001e-002 | AD144: -3.3399999999999999e-002 | AE144: 94.94 | AF144: 101.12 | AG144: 0.45 | AH144: AA+ | AI144: 4.0300000000000002e-002 | AJ144: =H144+100*O144 -> 123.84999999999999 | AK144: 123.3 | AL144: 113 | AM144: 22.2 | AN144: 38 | AO144: 3.7999999999999999e-002 | AP144: 35 | AQ144: 山鹰转债
A145: 11 | B145: 123081 | C145: 精研转债! | D145: 300709 | E145: 精研科技 | F145: 电子 | G145: 电子产品 | H145: 109.16 | I145: 2.3099999999999999e-002 | J145: 4.4000000000000003e-003 | K145: 54.26 | L145: 5.16e-002 | M145: 121.3 | N145: 64.28 | O145: 0.29299999999999998 | P145: 84.41 | Q145: 5月2天 | R145: 5.90年 | S145: 3.90年 | T145: 5.7 | U145: 84 | V145: 0.13400000000000001 | W145: 9.0999999999999998e-002 | X145: 7.6999999999999999e-002 | Y145: 63 | Z145: 4.17 | AA145: 1.84e-002 | AB145: 1.21e-002 | AC145: -1.1399999999999999e-002 | AD145: -1.34e-002 | AE145: 80.77 | AF145: 84.14 | AG145: 0.53 | AH145: AA- | AI145: 6.5299999999999997e-002 | AJ145: =H145+100*O145 -> 138.45999999999998 | AK145: 133.9 | AL145: 195 | AM145: 49.8 | AN145: 228 | AO145: 4.0000000000000001e-002 | AP145: 2 | AQ145: 精研转债!
A146: 98 | B146: 123057 | C146: 美联转债 | D146: 300586 | E146: 美联新材 | F146: 化工 | G146: 橡胶塑料 | H146: 107.32 | I146: -2.1000000000000001e-002 | J146: -2.8000000000000004e-003 | K146: 8.51 | L146: -4.3799999999999999e-002 | M146: 118.2 | N146: 9.91 | O146: 0.25 | P146: 85.87 | Q146: 转股中 | R146: 5.48年 | S146: 3.48年 | T146: 2.07 | U146: 35 | V146: 0.155 | W146: 5.2999999999999999e-002 | X146: 4.5999999999999999e-002 | Y146: 39 | Z146: 5.22 | AA146: 1.8200000000000001e-002 | AB146: 1.2199999999999999e-002 | AC146: -8.3999999999999995e-003 | AD146: -1.0500000000000001e-002 | AE146: 82.91 | AF146: 84.25 | AG146: 0.54 | AH146: AA- | AI146: 6.5299999999999997e-002 | AJ146: =H146+100*O146 -> 132.31999999999999 | AK146: 128.8 | AL146: 165 | AM146: 44.5 | AN146: 198 | AO146: -0.128 | AP146: 12 | AQ146: 美联转债
A147: 164 | B147: 113564 | C147: 天目转债 | D147: 603136 | E147: 天目湖 | F147: 旅游餐饮 | G147: 旅游 | H147: 115.85 | I147: -1.5700000000000002e-002 | J147: 9.1000000000000004e-003 | K147: 23.02 | L147: -1.0700000000000001e-002 | M147: 126.7 | N147: 23.1 | O147: 0.16300000000000001 | P147: 99.65 | Q147: 转股中 | R147: 5年51天 | S147: 3年51天 | T147: 2.87 | U147: 4.5 | V147: 1.3999999999999999e-002 | W147: 0.107 | X147: 0.107 | Y147: 27 | Z147: 2.87 | AA147: 1.8000000000000002e-002 | AB147: 9.300000000000001e-003 | AC147: -3.0800000000000001e-002 | AD147: -3.3300000000000003e-002 | AE147: 85.14 | AF147: 92.27 | AG147: 0.62 | AH147: AA- | AI147: 6.5299999999999997e-002 | AJ147: =H147+100*O147 -> 132.15000000000001 | AK147: 132 | AL147: 185 | AM147: 39.8 | AN147: 171 | AO147: -0.13100000000000001 | AP147: 13 | AQ147: 天目转债
A148: 215 | B148: 128071 | C148: 合兴转债! | D148: 2228 | E148: 合兴包装 | F148: 造纸包装 | G148: 包装材料 | H148: 105.988 | I148: -9.4999999999999998e-003 | J148: -8.8000000000000005e-003 | K148: 3.85 | L148: -3.9900000000000005e-002 | M148: 114.8 | N148: 4.28 | O148: 0.17800000000000002 | P148: 89.95 | Q148: 转股中 | R148: 4.60年 | S148: 2.60年 | T148: 3 | U148: 4.7 | V148: 1.4999999999999999e-002 | W148: 6.3e-002 | X148: 5.7000000000000002e-002 | Y148: 48 | Z148: 1.43 | AA148: 1.78e-002 | AB148: 1.1899999999999999e-002 | AC148: -9.300000000000001e-003 | AD148: -1.1599999999999999e-002 | AE148: 92.2 | AF148: 95.21 | AG148: 0.46 | AH148: AA | AI148: 4.2300000000000004e-002 | AJ148: =H148+100*O148 -> 123.788 | AK148: 122 | AL148: 103 | AM148: 26.8 | AN148: 80 | AO148: -9.3000000000000013e-002 | AP148: 26 | AQ148: 合兴转债!
A149: 245 | B149: 110056 | C149: 亨通转债! | D149: 600487 | E149: 亨通光电 | F149: 通信互联 | G149: 通信设备 | H149: 107.1 | I149: 1.8e-003 | J149: 6.1999999999999998e-003 | K149: 13.82 | L149: 1.77e-002 | M149: 114.8 | N149: 15.01 | O149: 0.16300000000000001 | P149: 92.07 | Q149: 转股中 | R149: 4.19年 | S149: 2.19年 | T149: 17.1 | U149: 17 | V149: 9.0000000000000011e-003 | W149: 5.2000000000000005e-002 | X149: 4.8000000000000001e-002 | Y149: 326 | Z149: 1.79 | AA149: 1.7000000000000001e-002 | AB149: 1.06e-002 | AC149: -1.54e-002 | AD149: -1.8000000000000002e-002 | AE149: 94.2 | AF149: 97.61 | AG149: 0.45 | AH149: AA+ | AI149: 4.0300000000000002e-002 | AJ149: =H149+100*O149 -> 123.39999999999999 | AK149: 122.1 | AL149: 104 | AM149: 24.5 | AN149: 60 | AO149: -1.e-002 | AP149: 31 | AQ149: 亨通转债!
A150: 129 | B150: 128107 | C150: 交科转债 | D150: 2061 | E150: 浙江交科 | F150: 建筑 | G150: 建筑工程 | H150: 105.909 | I150: -3.7000000000000002e-003 | J150: 3.7000000000000002e-003 | K150: 5.09 | L150: 0. | M150: 115.3 | N150: 5.36 | O150: 0.115 | P150: 94.96 | Q150: 转股中 | R150: 5.29年 | S150: 3.29年 | T150: 25 | U150: 11 | V150: 4.0000000000000001e-003 | W150: 0.35700000000000004 | X150: 0.33899999999999997 | Y150: 70 | Z150: 0.88 | AA150: 1.6500000000000001e-002 | AB150: 1.1200000000000002e-002 | AC150: -5.8999999999999999e-003 | AD150: -8.0000000000000002e-003 | AE150: 90.11 | AF150: 93.05 | AG150: 0.54 | AH150: AA+ | AI150: 4.2300000000000004e-002 | AJ150: =H150+100*O150 -> 117.40900000000001 | AK150: 116.9 | AL150: 57 | AM150: 23.8 | AN150: 52 | AO150: -2.9999999999999999e-002 | AP150: 16 | AQ150: 交科转债
A151: 235 | B151: 128064 | C151: 司尔转债! | D151: 2538 | E151: 司尔特 | F151: 化工 | G151: 农化 | H151: 107.433 | I151: -1.2699999999999999e-002 | J151: 7.4000000000000003e-003 | K151: 5.8 | L151: -1.0200000000000001e-002 | M151: 114.9 | N151: 6.07 | O151: 0.124 | P151: 95.55 | Q151: 转股中 | R151: 4.25年 | S151: 2.25年 | T151: 8 | U151: 4.8 | V151: 6.0000000000000001e-003 | W151: 0.192 | X151: 0.184 | Y151: 42 | Z151: 1.09 | AA151: 1.6299999999999999e-002 | AB151: 9.7999999999999997e-003 | AC151: -1.5900000000000001e-002 | AD151: -1.8600000000000002e-002 | AE151: 93.67 | AF151: 96.73 | AG151: 0.51 | AH151: AA | AI151: 4.2300000000000004e-002 | AJ151: =H151+100*O151 -> 119.83300000000001 | AK151: 119.3 | AL151: 71 | AM151: 22.6 | AN151: 44 | AO151: -5.0000000000000003e-002 | AP151: 55 | AQ151: 司尔转债!
A152: 61 | B152: 128128 | C152: 齐翔转2 | D152: 2408 | E152: 齐翔腾达 | F152: 化工 | G152: 化工 | H152: 105.5 | I152: -1.3999999999999999e-002 | J152: -1.46e-002 | K152: 8.43 | L152: -4.4199999999999996e-002 | M152: 115.3 | N152: 8.22 | O152: 2.8999999999999998e-002 | P152: 102.55 | Q152: 49天 | R152: 5.61年 | S152: 3.61年 | T152: 29.9 | U152: 120 | V152: 3.7999999999999999e-002 | W152: 0.20000000000000001 | X152: 0.20499999999999999 | Y152: 150 | Z152: 1.83 | AA152: 1.6200000000000003e-002 | AB152: 1.1299999999999999e-002 | AC152: -4.5000000000000005e-003 | AD152: -6.4000000000000003e-003 | AE152: 88.17 | AF152: 90.81 | AG152: 0.65 | AH152: AA | AI152: 4.4299999999999999e-002 | AJ152: =H152+100*O152 -> 108.40000000000001 | AK152: 108.4 | AL152: 11 | AM152: 17.6 | AN152: 14 | AO152: -1.6e-002 | AP152: 38 | AQ152: 齐翔转2
A153: 234 | B153: 113024 | C153: 核建转债! | D153: 601611 | E153: 中国核建 | F153: 建筑 | G153: 建筑工程 | H153: 103 | I153: -2.7000000000000001e-003 | J153: -1.e-003 | K153: 7.57 | L153: -1.3000000000000001e-002 | M153: 109.7 | N153: 9.76 | O153: 0.32799999999999996 | P153: 77.56 | Q153: 转股中 | R153: 4.25年 | S153: 2.25年 | T153: 30 | U153: 14 | V153: 4.0000000000000001e-003 | W153: 0.14899999999999999 | X153: 0.11599999999999999 | Y153: 201 | Z153: 1.86 | AA153: 1.5300000000000001e-002 | AB153: 1.09e-002 | AC153: 8.0000000000000004e-004 | AD153: -1.8e-003 | AE153: 94.55 | AF153: 94.2 | AG153: 0.29 | AH153: AAA | AI153: 3.73e-002 | AJ153: =H153+100*O153 -> 135.80000000000001 | AK153: 128.4 | AL153: 163 | AM153: 33.9 | AN153: 139 | AO153: 3.9e-002 | AP153: 44 | AQ153: 核建转债!
A154: 17 | B154: 123078 | C154: 飞凯转债 | D154: 300398 | E154: 飞凯材料 | F154: 化工 | G154: 化工 | H154: 105.6 | I154: 8.8000000000000005e-003 | J154: 1.7000000000000001e-002 | K154: 17.69 | L154: 4.7400000000000005e-002 | M154: 115.2 | N154: 19.34 | O154: 0.154 | P154: 91.47 | Q154: 4月26天 | R154: 5.89年 | S154: 3.89年 | T154: 8.25 | U154: 23 | V154: 2.7000000000000003e-002 | W154: 8.9999999999999997e-002 | X154: 8.3000000000000004e-002 | Y154: 91 | Z154: 3.53 | AA154: 1.52e-002 | AB154: 1.04e-002 | AC154: -4.5000000000000005e-003 | AD154: -6.3e-003 | AE154: 87.13 | AF154: 89.67 | AG154: 0.54 | AH154: AA | AI154: 4.4299999999999999e-002 | AJ154: =H154+100*O154 -> 121. | AK154: 119.7 | AL154: 77 | AM154: 30.1 | AN154: 102 | AO154: 5.0000000000000001e-003 | AP154: 5 | AQ154: 飞凯转债
A155: 133 | B155: 123050 | C155: 聚飞转债 | D155: 300303 | E155: 聚飞光电 | F155: 电子 | G155: LED制 | H155: 115 | I155: 1.6000000000000001e-003 | J155: 2.1499999999999998e-002 | K155: 5.17 | L155: 3.61e-002 | M155: 124.2 | N155: 5.18 | O155: 0.152 | P155: 99.81 | Q155: 转股中 | R155: 5.26年 | S155: 3.26年 | T155: 7.05 | U155: 40 | V155: 5.0000000000000003e-002 | W155: 0.107 | X155: 0.106 | Y155: 66 | Z155: 2.85 | AA155: 1.4999999999999999e-002 | AB155: 7.1999999999999998e-003 | AC155: -2.8900000000000002e-002 | AD155: -3.1099999999999999e-002 | AE155: 84.04 | AF155: 89.7 | AG155: 0.64 | AH155: AA- | AI155: 6.5299999999999997e-002 | AJ155: =H155+100*O155 -> 130.19999999999999 | AK155: 130.2 | AL155: 173 | AM155: 40.5 | AN155: 174 | AO155: -5.7000000000000002e-002 | AP155: 12 | AQ155: 聚飞转债
A156: 217 | B156: 113542 | C156: 好客转债 | D156: 603898 | E156: 好莱客 | F156: 其他 | G156: 家居用品 | H156: 107.62 | I156: -1.2199999999999999e-002 | J156: -1.e-004 | K156: 14.58 | L156: -2.7400000000000001e-002 | M156: 114.9 | N156: 16.27 | O156: 0.20100000000000001 | P156: 89.61 | Q156: 转股中 | R156: 4.56年 | S156: 2.56年 | T156: 6.03 | U156: 45 | V156: 6.9000000000000006e-002 | W156: 0.13300000000000001 | X156: 0.11900000000000001 | Y156: 45 | Z156: 1.85 | AA156: 1.47e-002 | AB156: 8.8000000000000005e-003 | AC156: -1.47e-002 | AD156: -1.7100000000000001e-002 | AE156: 92.45 | AF156: 95.47 | AG156: 0.45 | AH156: AA | AI156: 4.2300000000000004e-002 | AJ156: =H156+100*O156 -> 127.72 | AK156: 125.6 | AL156: 137 | AM156: 30.2 | AN156: 105 | AO156: -7.5999999999999998e-002 | AP156: 19 | AQ156: 好客转债
A157: 275 | B157: 113516 | C157: 苏农转债! | D157: 603323 | E157: 苏农银行 | F157: 金融 | G157: 银行行业 | H157: 108.78 | I157: 7.1999999999999998e-003 | J157: -6.5000000000000006e-003 | K157: 4.79 | L157: 2.0999999999999999e-003 | M157: 114.3 | N157: 5.52 | O157: 0.254 | P157: 86.78 | Q157: 转股中 | R157: 3.56年 | S157: 无权 | T157: 12.9 | U157: 27 | V157: 1.9e-002 | W157: 0.14899999999999999 | X157: 0.13 | Y157: 86 | Z157: 0.73 | AA157: 1.43e-002 | AB157: 6.8999999999999999e-003 | AC157: 无权 | AD157: 无权 | AE157: 无权 | AF157: 99.55 | AG157: 0.36 | AH157: AA+ | AI157: 4.0300000000000002e-002 | AJ157: =H157+100*O157 -> 134.18000000000001 | AK157: 130.8 | AL157: 178 | AM157: 31.2 | AN157: 115 | AO157: -1.6e-002 | AP157: 35 | AQ157: 苏农转债!
A158: 59 | B158: 113039 | C158: 嘉泽转债! | D158: 601619 | E158: 嘉泽新能 | F158: 能源电力 | G158: 风能 | H158: 104.54 | I158: 5.1999999999999998e-003 | J158: -1.7100000000000001e-002 | K158: 3.44 | L158: -1.9900000000000001e-002 | M158: 113.1 | N158: 3.57 | O158: 8.5000000000000006e-002 | P158: 96.36 | Q158: 52天 | R158: 5.62年 | S158: 3.62年 | T158: 13 | U158: 45 | V158: 3.3000000000000002e-002 | W158: 0.182 | X158: 0.17600000000000002 | Y158: 71 | Z158: 2.08 | AA158: 1.43e-002 | AB158: 1.e-002 | AC158: -2.3999999999999998e-003 | AD158: -4.1999999999999997e-003 | AE158: 88.02 | AF158: 89.03 | AG158: 0.6 | AH158: AA | AI158: 4.4299999999999999e-002 | AJ158: =H158+100*O158 -> 113.04000000000001 | AK158: 112.7 | AL158: 29 | AM158: 23.7 | AN158: 51 | AO158: 2.5000000000000001e-002 | AP158: 18 | AQ158: 嘉泽转债!
A159: 292 | B159: 127006 | C159: 敖东转债! | D159: 623 | E159: 吉林敖东 | F159: 金融 | G159: 证券行业 | H159: 103.42 | I159: -2.9999999999999997e-004 | J159: 4.4000000000000003e-003 | K159: 16.43 | L159: 1.55e-002 | M159: 108 | N159: 20.42 | O159: 0.28499999999999998 | P159: 80.46 | Q159: 转股中 | R159: 3.18年 | S159: 1.18年 | T159: 24.1 | U159: 56 | V159: 2.3e-002 | W159: 0.126 | X159: 0.10099999999999999 | Y159: 191 | Z159: 0.84 | AA159: 1.3899999999999999e-002 | AB159: 9.1000000000000004e-003 | AC159: -1.2699999999999999e-002 | AD159: -1.5100000000000001e-002 | AE159: 96.45 | AF159: 95.44 | AG159: 0.27 | AH159: AA+ | AI159: 4.0300000000000002e-002 | AJ159: =H159+100*O159 -> 131.91999999999999 | AK159: 126.4 | AL159: 143 | AM159: 29.9 | AN159: 100 | AO159: -6.9999999999999993e-003 | AP159: 27 | AQ159: 敖东转债!
A160: 80 | B160: 113037 | C160: 紫银转债 | D160: 601860 | E160: 紫金银行 | F160: 金融 | G160: 银行行业 | H160: 107.7 | I160: -1.9e-003 | J160: -2.0000000000000001e-004 | K160: 4.07 | L160: -4.8999999999999998e-003 | M160: 115.8 | N160: 4.75 | O160: 0.25700000000000001 | P160: 85.68 | Q160: 21天 | R160: 5.54年 | S160: 无权 | T160: 45 | U160: 8 | V160: 2.e-003 | W160: 0.30199999999999999 | X160: 0.25900000000000001 | Y160: 149 | Z160: 1.05 | AA160: 1.34e-002 | AB160: 8.3000000000000001e-003 | AC160: 无权 | AD160: 无权 | AE160: 无权 | AF160: 92.49 | AG160: 0.44 | AH160: AA+ | AI160: 4.2300000000000004e-002 | AJ160: =H160+100*O160 -> 133.40000000000001 | AK160: 129.7 | AL160: 171 | AM160: 37.2 | AN160: 160 | AO160: -1.7000000000000001e-002 | AP160: 18 | AQ160: 紫银转债
A161: 49 | B161: 128133 | C161: 奇正转债! | D161: 2287 | E161: 奇正藏药 | F161: 医药 | G161: 中药 | H161: 109.001 | I161: 8.9999999999999998e-004 | J161: 1.5600000000000001e-002 | K161: 28.5 | L161: 3.04e-002 | M161: 117.3 | N161: 30.12 | O161: 0.152 | P161: 94.62 | Q161: 2月19天 | R161: 5.70年 | S161: 3.70年 | T161: 8 | U161: 43 | V161: 4.9000000000000002e-002 | W161: 5.2999999999999999e-002 | X161: 5.0000000000000003e-002 | Y161: 151 | Z161: 6.29 | AA161: 1.32e-002 | AB161: 7.8000000000000005e-003 | AC161: -1.2699999999999999e-002 | AD161: -1.4499999999999999e-002 | AE161: 87.91 | AF161: 92.03 | AG161: 0.55 | AH161: AA | AI161: 4.4299999999999999e-002 | AJ161: =H161+100*O161 -> 124.20100000000001 | AK161: 123.4 | AL161: 114 | AM161: 31.3 | AN161: 116 | AO161: 2.4e-002 | AP161: 11 | AQ161: 奇正转债!
A162: 170 | B162: 128094 | C162: 星帅转债 | D162: 2860 | E162: 星帅尔 | F162: 家电 | G162: 零部件制 | H162: 114.4 | I162: 7.9000000000000008e-003 | J162: 7.4999999999999997e-003 | K162: 15.69 | L162: 1.95e-002 | M162: 121.5 | N162: 13.95 | O162: 1.7000000000000001e-002 | P162: 112.47 | Q162: 转股中 | R162: 5年8天 | S162: 3年8天 | T162: 2.8 | U162: 21 | V162: 6.4000000000000001e-002 | W162: 8.9999999999999997e-002 | X162: 0.10099999999999999 | Y162: 31 | Z162: 3.35 | AA162: 1.24e-002 | AB162: 4.8999999999999998e-003 | AC162: -2.81e-002 | AD162: -3.0800000000000001e-002 | AE162: 83.03 | AF162: 84.81 | AG162: 0.79 | AH162: A+ | AI162: 7.6299999999999993e-002 | AJ162: =H162+100*O162 -> 116.10000000000001 | AK162: 116.3 | AL162: 48 | AM162: 31.5 | AN162: 117 | AO162: 7.2000000000000008e-002 | AP162: 34 | AQ162: 星帅转债
A163: 165 | B163: 113565 | C163: 宏辉转债 | D163: 603336 | E163: 宏辉果蔬 | F163: 农业 | G163: 农产品加 | H163: 111.15 | I163: -3.2899999999999999e-002 | J163: 8.9999999999999998e-004 | K163: 10.28 | L163: -4.4600000000000001e-002 | M163: 118.2 | N163: 10 | O163: 8.1000000000000003e-002 | P163: 102.8 | Q163: 转股中 | R163: 5年49天 | S163: 3年49天 | T163: 2.26 | U163: 75 | V163: 0.29799999999999999 | W163: 6.5000000000000002e-002 | X163: 6.7000000000000004e-002 | Y163: 35 | Z163: 3.65 | AA163: 1.23e-002 | AB163: 6.0000000000000001e-003 | AC163: -1.9900000000000001e-002 | AD163: -2.2200000000000001e-002 | AE163: 84.74 | AF163: 86.1 | AG163: 0.72 | AH163: AA- | AI163: 6.5299999999999997e-002 | AJ163: =H163+100*O163 -> 119.25 | AK163: 119.5 | AL163: 73 | AM163: 33.4 | AN163: 132 | AO163: -8.900000000000001e-002 | AP163: 22 | AQ163: 宏辉转债
A164: 188 | B164: 110063 | C164: 鹰19转债 | D164: 600567 | E164: 山鹰国际 | F164: 造纸包装 | G164: 包装用纸 | H164: 109.49 | I164: 4.5999999999999999e-003 | J164: -1.1999999999999999e-003 | K164: 3.2 | L164: 6.3e-003 | M164: 115.9 | N164: 3.3 | O164: 0.129 | P164: 96.97 | Q164: 转股中 | R164: 4.93年 | S164: 2.93年 | T164: 18.6 | U164: 17 | V164: 8.0000000000000002e-003 | W164: 0.126 | X164: 0.12300000000000001 | Y164: 147 | Z164: 1 | AA164: 1.18e-002 | AB164: 6.0000000000000001e-003 | AC164: -1.9e-002 | AD164: -2.0899999999999998e-002 | AE164: 91.44 | AF164: 95.71 | AG164: 0.53 | AH164: AA+ | AI164: 4.0300000000000002e-002 | AJ164: =H164+100*O164 -> 122.39 | AK164: 122 | AL164: 102 | AM164: 26.3 | AN164: 77 | AO164: 3.7999999999999999e-002 | AP164: 41 | AQ164: 鹰19转债
A165: 231 | B165: 113026 | C165: 核能转债! | D165: 601985 | E165: 中国核电 | F165: 能源电力 | G165: 核电 | H165: 104.59 | I165: 3.7000000000000002e-003 | J165: -3.7000000000000002e-003 | K165: 5.02 | L165: 0. | M165: 109.8 | N165: 5.86 | O165: 0.221 | P165: 85.67 | Q165: 转股中 | R165: 4.27年 | S165: 2.27年 | T165: 78 | U165: 22 | V165: 3.0000000000000001e-003 | W165: 8.900000000000001e-002 | X165: 7.5999999999999998e-002 | Y165: 876 | Z165: 1.5 | AA165: 1.1699999999999999e-002 | AB165: 7.3000000000000001e-003 | AC165: -5.1000000000000004e-003 | AD165: -7.8000000000000005e-003 | AE165: 94.58 | AF165: 94.23 | AG165: 0.4 | AH165: AAA | AI165: 3.73e-002 | AJ165: =H165+100*O165 -> 126.69 | AK165: 123.5 | AL165: 116 | AM165: 28.9 | AN165: 98 | AO165: 3.6000000000000004e-002 | AP165: 51 | AQ165: 核能转债!
A166: 70 | B166: 113598 | C166: 法兰转债 | D166: 603966 | E166: 法兰泰克 | F166: 机械装备 | G166: 工程机械 | H166: 113.97 | I166: -9.300000000000001e-003 | J166: 3.0999999999999999e-003 | K166: 13.92 | L166: -9.300000000000001e-003 | M166: 121.2 | N166: 13.88 | O166: 0.13600000000000001 | P166: 100.29 | Q166: 29天 | R166: 5.56年 | S166: 3.56年 | T166: 3.3 | U166: 3.5 | V166: 9.0000000000000011e-003 | W166: 0.11199999999999999 | X166: 0.113 | Y166: 29 | Z166: 2.63 | AA166: 1.1399999999999999e-002 | AB166: 4.6999999999999993e-003 | AC166: -2.4199999999999999e-002 | AD166: -2.63e-002 | AE166: 82.48 | AF166: 85.92 | AG166: 0.68 | AH166: AA- | AI166: 6.5299999999999997e-002 | AJ166: =H166+100*O166 -> 127.56999999999999 | AK166: 127.7 | AL166: 154 | AM166: 41.7 | AN166: 183 | AO166: -3.2000000000000001e-002 | AP166: 7 | AQ166: 法兰转债
A167: 106 | B167: 113588 | C167: 润达转债! | D167: 603108 | E167: 润达医疗 | F167: 医药 | G167: 医疗器械 | H167: 107.62 | I167: 1.6000000000000001e-003 | J167: -7.1999999999999998e-003 | K167: 11.6 | L167: -1.1899999999999999e-002 | M167: 114.2 | N167: 13.36 | O167: 0.23899999999999999 | P167: 86.83 | Q167: 转股中 | R167: 5.44年 | S167: 3.44年 | T167: 5.5 | U167: 13 | V167: 2.3e-002 | W167: 8.199999999999999e-002 | X167: 7.0999999999999994e-002 | Y167: 67 | Z167: 2.24 | AA167: 1.1200000000000002e-002 | AB167: 6.4000000000000003e-003 | AC167: -1.03e-002 | AD167: -1.23e-002 | AE167: 88.83 | AF167: 90.63 | AG167: 0.47 | AH167: AA | AI167: 4.4299999999999999e-002 | AJ167: =H167+100*O167 -> 131.52000000000001 | AK167: 128.4 | AL167: 162 | AM167: 37.8 | AN167: 163 | AO167: 1.7000000000000001e-002 | AP167: 8 | AQ167: 润达转债!
A168: 150 | B168: 128101 | C168: 联创转债! | D168: 2036 | E168: 联创电子 | F168: 电子 | G168: 液晶显示 | H168: 108.8 | I168: -8.9999999999999998e-004 | J168: 1.1999999999999999e-003 | K168: 10.46 | L168: 1.e-003 | M168: 115.1 | N168: 13.86 | O168: 0.442 | P168: 75.47 | Q168: 转股中 | R168: 5.18年 | S168: 3.18年 | T168: 3 | U168: 18 | V168: 5.2000000000000005e-002 | W168: 2.7000000000000003e-002 | X168: 2.1000000000000001e-002 | Y168: 110 | Z168: 3.72 | AA168: 1.11e-002 | AB168: 5.7999999999999996e-003 | AC168: -1.46e-002 | AD168: -1.67e-002 | AE168: 89.72 | AF168: 92.34 | AG168: 0.3 | AH168: AA | AI168: 4.4299999999999999e-002 | AJ168: =H168+100*O168 -> 153. | AK168: 142.1 | AL168: 226 | AM168: 49.8 | AN168: 229 | AO168: -8.0000000000000002e-003 | AP168: 17 | AQ168: 联创转债!
A169: 118 | B169: 123052 | C169: 飞鹿转债 | D169: 300665 | E169: 飞鹿股份 | F169: 化工 | G169: 化工 | H169: 120.101 | I169: -3.2000000000000002e-003 | J169: -6.0999999999999995e-003 | K169: 10.23 | L169: -1.3500000000000002e-002 | M169: 127.3 | N169: 9.9 | O169: 0.16200000000000001 | P169: 103.33 | Q169: 转股中 | R169: 5.41年 | S169: 3.41年 | T169: 1.77 | U169: 76 | V169: 0.35299999999999998 | W169: 0.14199999999999999 | X169: 0.14699999999999999 | Y169: 12 | Z169: 2.64 | AA169: 1.11e-002 | AB169: 2.7000000000000001e-003 | AC169: -3.6799999999999999e-002 | AD169: -3.9399999999999998e-002 | AE169: 81.23 | AF169: 86.45 | AG169: 0.69 | AH169: A+ | AI169: 7.6299999999999993e-002 | AJ169: =H169+100*O169 -> 136.30099999999999 | AK169: 136.9 | AL169: 208 | AM169: 50.4 | AN169: 231 | AO169: -0.10000000000000001 | AP169: 13 | AQ169: 飞鹿转债
A170: 198 | B170: 123033 | C170: 金力转债! | D170: 300748 | E170: 金力永磁 | F170: 电子 | G170: 元器件制 | H170: 115.7 | I170: -5.1999999999999998e-003 | J170: 9.1999999999999998e-003 | K170: 36.73 | L170: 7.7000000000000002e-003 | M170: 121.5 | N170: 40.97 | O170: 0.29100000000000004 | P170: 89.65 | Q170: 转股中 | R170: 4.81年 | S170: 2.81年 | T170: 4.35 | U170: 6.5 | V170: 1.3000000000000001e-002 | W170: 2.7999999999999997e-002 | X170: 2.6000000000000002e-002 | Y170: 153 | Z170: 11.37 | AA170: 1.0500000000000001e-002 | AB170: 2.7000000000000001e-003 | AC170: -3.2500000000000001e-002 | AD170: -3.5499999999999997e-002 | AE170: 87.68 | AF170: 91.17 | AG170: 0.52 | AH170: AA- | AI170: 6.3299999999999995e-002 | AJ170: =H170+100*O170 -> 144.80000000000001 | AK170: 141.7 | AL170: 225 | AM170: 50.6 | AN170: 233 | AO170: -2.7000000000000003e-002 | AP170: 28 | AQ170: 金力转债!
A171: 104 | B171: 123056 | C171: 雪榕转债 | D171: 300511 | E171: 雪榕生物 | F171: 农业 | G171: 种植业 | H171: 114.54 | I171: -6.0000000000000001e-003 | J171: -2.5000000000000001e-003 | K171: 12.02 | L171: -1.23e-002 | M171: 121.1 | N171: 11.89 | O171: 0.13300000000000001 | P171: 101.09 | Q171: 转股中 | R171: 5.46年 | S171: 3.46年 | T171: 5.85 | U171: 13 | V171: 1.9e-002 | W171: 0.11 | X171: 0.111 | Y171: 53 | Z171: 2.77 | AA171: 1.0500000000000001e-002 | AB171: 3.8e-003 | AC171: -2.6499999999999999e-002 | AD171: -2.8500000000000001e-002 | AE171: 82.92 | AF171: 86.39 | AG171: 0.69 | AH171: AA- | AI171: 6.5299999999999997e-002 | AJ171: =H171+100*O171 -> 127.84 | AK171: 128 | AL171: 160 | AM171: 41.6 | AN171: 181 | AO171: -8.5000000000000006e-002 | AP171: 12 | AQ171: 雪榕转债
A172: 218 | B172: 113541 | C172: 荣晟转债! | D172: 603165 | E172: 荣晟环保 | F172: 造纸包装 | G172: 包装用纸 | H172: 109.85 | I172: -1.47e-002 | J172: 7.1999999999999998e-003 | K172: 12.37 | L172: -1.04e-002 | M172: 115 | N172: 11.54 | O172: 2.5000000000000001e-002 | P172: 107.19 | Q172: 转股中 | R172: 4.54年 | S172: 2.54年 | T172: 2.75 | U172: 9.1 | V172: 2.9999999999999999e-002 | W172: 8.8000000000000009e-002 | X172: 9.4e-002 | Y172: 31 | Z172: 2.04 | AA172: 1.04e-002 | AB172: 4.4000000000000003e-003 | AC172: -2.2000000000000002e-002 | AD172: -2.4399999999999998e-002 | AE172: 87.83 | AF172: 87.57 | AG172: 0.72 | AH172: AA- | AI172: 6.3299999999999995e-002 | AJ172: =H172+100*O172 -> 112.34999999999999 | AK172: 112.5 | AL172: 28 | AM172: 24.7 | AN172: 66 | AO172: -5.0000000000000001e-003 | AP172: 49 | AQ172: 荣晟转债!
A173: 200 | B173: 110060 | C173: 天路转债! | D173: 600326 | E173: 西藏天路 | F173: 建筑 | G173: 水泥 | H173: 109.43 | I173: -1.3300000000000001e-002 | J173: 1.24e-002 | K173: 7.09 | L173: -1.4000000000000002e-003 | M173: 114.9 | N173: 7.16 | O173: 0.105 | P173: 99.02 | Q173: 转股中 | R173: 4.80年 | S173: 2.80年 | T173: 7.06 | U173: 2.2 | V173: 3.0000000000000001e-003 | W173: 0.10800000000000001 | X173: 0.107 | Y173: 65 | Z173: 1.75 | AA173: 1.04e-002 | AB173: 4.7999999999999996e-003 | AC173: -1.9099999999999999e-002 | AD173: -2.12e-002 | AE173: 91.53 | AF173: 94.52 | AG173: 0.58 | AH173: AA | AI173: 4.2300000000000004e-002 | AJ173: =H173+100*O173 -> 119.93000000000001 | AK173: 119.8 | AL173: 80 | AM173: 25.3 | AN173: 72 | AO173: -2.1000000000000001e-002 | AP173: 12 | AQ173: 天路转债!
A174: 169 | B174: 113563 | C174: 柳药转债 | D174: 603368 | E174: 柳药股份 | F174: 医药 | G174: 医药商业 | H174: 107.79 | I174: -5.9999999999999995e-004 | J174: 3.5999999999999999e-003 | K174: 20.88 | L174: 6.8000000000000005e-003 | M174: 113.2 | N174: 24.47 | O174: 0.26300000000000001 | P174: 85.33 | Q174: 转股中 | R174: 5年8天 | S174: 3年8天 | T174: 8.02 | U174: 3.8 | V174: 4.0000000000000001e-003 | W174: 0.106 | X174: 8.9999999999999997e-002 | Y174: 76 | Z174: 1.58 | AA174: 1.e-002 | AB174: 5.1999999999999998e-003 | AC174: -1.2199999999999999e-002 | AD174: -1.44e-002 | AE174: 90.46 | AF174: 91.48 | AG174: 0.44 | AH174: AA | AI174: 4.4299999999999999e-002 | AJ174: =H174+100*O174 -> 134.09 | AK174: 130.3 | AL174: 174 | AM174: 38.8 | AN174: 169 | AO174: -5.4000000000000006e-002 | AP174: 17 | AQ174: 柳药转债
A175: 287 | B175: 128039 | C175: 三力转债! | D175: 2224 | E175: 三 力 士 | F175: 机械装备 | G175: 专用设备 | H175: 106.28 | I175: -3.5999999999999999e-003 | J175: 7.9000000000000008e-003 | K175: 5.61 | L175: 7.1999999999999998e-003 | M175: 109.8 | N175: 5.81 | O175: 0.10099999999999999 | P175: 96.56 | Q175: 转股中 | R175: 3.41年 | S175: 1.41年 | T175: 2.03 | U175: 11 | V175: 4.9000000000000002e-002 | W175: 5.0000000000000003e-002 | X175: 4.8000000000000001e-002 | Y175: 41 | Z175: 1.75 | AA175: 9.7999999999999997e-003 | AB175: 4.3e-003 | AC175: -2.2499999999999999e-002 | AD175: -2.5600000000000001e-002 | AE175: 93.15 | AF175: 89.41 | AG175: 0.6 | AH175: AA- | AI175: 6.3299999999999995e-002 | AJ175: =H175+100*O175 -> 116.38 | AK175: 116 | AL175: 45 | AM175: 22.9 | AN175: 47 | AO175: -4.9000000000000002e-002 | AP175: 23 | AQ175: 三力转债!
A176: 225 | B176: 113536 | C176: 三星转债 | D176: 603578 | E176: 三星新材 | F176: 家电 | G176: 零部件制 | H176: 110.26 | I176: -1.2699999999999999e-002 | J176: 1.24e-002 | K176: 20.28 | L176: -5.0000000000000001e-004 | M176: 114.8 | N176: 19.54 | O176: 6.2e-002 | P176: 103.79 | Q176: 转股中 | R176: 4.39年 | S176: 2.39年 | T176: 1.49 | U176: 7.9 | V176: 4.9000000000000002e-002 | W176: 8.0000000000000002e-002 | X176: 8.3000000000000004e-002 | Y176: 19 | Z176: 2.67 | AA176: 9.3999999999999986e-003 | AB176: 3.3e-003 | AC176: -2.5399999999999999e-002 | AD176: -2.7799999999999998e-002 | AE176: 93.01 | AF176: 96.05 | AG176: 0.61 | AH176: AA | AI176: 4.2300000000000004e-002 | AJ176: =H176+100*O176 -> 116.46000000000001 | AK176: 116.7 | AL176: 54 | AM176: 20.7 | AN176: 29 | AO176: -7.2999999999999995e-002 | AP176: 38 | AQ176: 三星转债
A177: 7 | B177: 123083 | C177: 朗新转债 | D177: 300682 | E177: 朗新科技 | F177: 计算机及 | G177: 软件开发 | H177: 109 | I177: 1.9599999999999999e-002 | J177: -1.e-003 | K177: 14.63 | L177: 3.32e-002 | M177: 115.1 | N177: 15.57 | O177: 0.16 | P177: 93.96 | Q177: 5月8天 | R177: 5.92年 | S177: 3.92年 | T177: 8 | U177: 180 | V177: 0.20499999999999999 | W177: 5.4000000000000006e-002 | X177: 5.0000000000000003e-002 | Y177: 149 | Z177: 3.13 | AA177: 9.3999999999999986e-003 | AB177: 4.7999999999999996e-003 | AC177: -1.2500000000000001e-002 | AD177: -1.41e-002 | AE177: 86.91 | AF177: 89.45 | AG177: 0.56 | AH177: AA | AI177: 4.4299999999999999e-002 | AJ177: =H177+100*O177 -> 125. | AK177: 124 | AL177: 123 | AM177: 34.6 | AN177: 142 | AO177: -3.1e-002 | AP177: 2 | AQ177: 朗新转债
A178: 242 | B178: 127012 | C178: 招路转债! | D178: 1965 | E178: 招商公路 | F178: 机场高速 | G178: 高速 | H178: 104.603 | I178: -1.e-003 | J178: 5.8999999999999999e-003 | K178: 7.01 | L178: 1.5900000000000001e-002 | M178: 108.2 | N178: 8.81 | O178: 0.315 | P178: 79.57 | Q178: 转股中 | R178: 4.20年 | S178: 2.20年 | T178: 50 | U178: 6 | V178: 1.e-003 | W178: 0.115 | X178: 9.1999999999999998e-002 | Y178: 433 | Z178: 0.89 | AA178: 8.199999999999999e-003 | AB178: 4.5000000000000005e-003 | AC178: -1.09e-002 | AD178: -1.2500000000000001e-002 | AE178: 93.54 | AF178: 92.97 | AG178: 0.31 | AH178: AAA | AI178: 3.73e-002 | AJ178: =H178+100*O178 -> 136.10300000000001 | AK178: 129.6 | AL178: 170 | AM178: 36.1 | AN178: 151 | AO178: -5.0000000000000001e-003 | AP178: 37 | AQ178: 招路转债!
A179: 298 | B179: 128034 | C179: 江银转债! | D179: 2807 | E179: 江阴银行 | F179: 金融 | G179: 银行行业 | H179: 106.611 | I179: 5.9999999999999995e-004 | J179: -1.6000000000000001e-003 | K179: 4.11 | L179: -2.3999999999999998e-003 | M179: 109.1 | N179: 4.5 | O179: 0.16699999999999998 | P179: 91.33 | Q179: 转股中 | R179: 3年18天 | S179: 无权 | T179: 17.6 | U179: 15 | V179: 8.0000000000000002e-003 | W179: 0.19699999999999998 | X179: 0.17999999999999999 | Y179: 89 | Z179: 0.78 | AA179: 7.7000000000000002e-003 | AB179: 2.0999999999999999e-003 | AC179: 无权 | AD179: 无权 | AE179: 无权 | AF179: 96.93 | AG179: 0.43 | AH179: AA+ | AI179: 4.0300000000000002e-002 | AJ179: =H179+100*O179 -> 123.31100000000001 | AK179: 121.9 | AL179: 100 | AM179: 25 | AN179: 68 | AO179: -1.e-002 | AP179: 27 | AQ179: 江银转债!
A180: 51 | B180: 123066 | C180: 赛意转债 | D180: 300687 | E180: 赛意信息 | F180: 计算机及 | G180: 软件开发 | H180: 117.158 | I180: 1.8799999999999997e-002 | J180: -2.7300000000000001e-002 | K180: 23.9 | L180: -1.1200000000000002e-002 | M180: 121.4 | N180: 22.58 | O180: 0.107 | P180: 105.85 | Q180: 2月13天 | R180: 5.69年 | S180: 3.69年 | T180: 3.2 | U180: 34 | V180: 8.900000000000001e-002 | W180: 6.2e-002 | X180: 6.5000000000000002e-002 | Y180: 52 | Z180: 5.48 | AA180: 6.4000000000000003e-003 | AB180: -1.e-004 | AC180: -2.9999999999999999e-002 | AD180: -3.2000000000000001e-002 | AE180: 78.81 | AF180: 80.64 | AG180: 0.77 | AH180: A+ | AI180: 7.6299999999999993e-002 | AJ180: =H180+100*O180 -> 127.858 | AK180: 128.5 | AL180: 164 | AM180: 47.8 | AN180: 219 | AO180: 4.0000000000000001e-003 | AP180: 5 | AQ180: 赛意转债
A181: 239 | B181: 110057 | C181: 现代转债 | D181: 600420 | E181: 现代制药 | F181: 医药 | G181: 化学制药 | H181: 108.4 | I181: -3.2000000000000002e-003 | J181: 9.3999999999999986e-003 | K181: 9.33 | L181: 1.1899999999999999e-002 | M181: 110.8 | N181: 9.89 | O181: 0.14899999999999999 | P181: 94.34 | Q181: 转股中 | R181: 4.23年 | S181: 2.23年 | T181: 16.2 | U181: 10 | V181: 6.0000000000000001e-003 | W181: 0.16899999999999998 | X181: 0.159 | Y181: 96 | Z181: 1.22 | AA181: 5.3e-003 | AB181: 5.0000000000000001e-004 | AC181: -2.0099999999999996e-002 | AD181: -2.2700000000000001e-002 | AE181: 94.72 | AF181: 95.22 | AG181: 0.52 | AH181: AAA | AI181: 3.73e-002 | AJ181: =H181+100*O181 -> 123.30000000000001 | AK181: 122.5 | AL181: 106 | AM181: 27.2 | AN181: 82 | AO181: -4.0999999999999995e-002 | AP181: 23 | AQ181: 现代转债
A182: 132 | B182: 113577 | C182: 春秋转债 | D182: 603890 | E182: 春秋电子 | F182: 电子 | G182: 电子产品 | H182: 115.07 | I182: 9.7999999999999997e-003 | J182: 7.1999999999999998e-003 | K182: 12.17 | L182: 2.2700000000000001e-002 | M182: 118.2 | N182: 11.06 | O182: 4.5999999999999999e-002 | P182: 110.04 | Q182: 转股中 | R182: 5.26年 | S182: 3.26年 | T182: 2.32 | U182: 31 | V182: 0.115 | W182: 4.9000000000000002e-002 | X182: 5.4000000000000006e-002 | Y182: 47 | Z182: 2.78 | AA182: 5.1999999999999998e-003 | AB182: -8.9999999999999998e-004 | AC182: -2.9100000000000001e-002 | AD182: -3.1300000000000001e-002 | AE182: 84.04 | AF182: 85.4 | AG182: 0.75 | AH182: AA- | AI182: 6.5299999999999997e-002 | AJ182: =H182+100*O182 -> 119.66999999999999 | AK182: 120.1 | AL182: 83 | AM182: 34.7 | AN182: 143 | AO182: 5.9999999999999998e-002 | AP182: 12 | AQ182: 春秋转债
A183: 183 | B183: 113556 | C183: 至纯转债! | D183: 603690 | E183: 至纯科技 | F183: 机械装备 | G183: 专用设备 | H183: 123.55 | I183: -3.5000000000000003e-002 | J183: 4.5999999999999999e-003 | K183: 36.36 | L183: -3.04e-002 | M183: 126.4 | N183: 29.28 | O183: -5.0000000000000001e-003 | P183: 124.18 | Q183: 转股中 | R183: 4.95年 | S183: 2.95年 | T183: 2.8 | U183: 70 | V183: 0.20000000000000001 | W183: 2.5000000000000001e-002 | X183: 3.1e-002 | Y183: 112 | Z183: 6.16 | AA183: 4.6999999999999993e-003 | AB183: -4.0999999999999995e-003 | AC183: -5.3399999999999996e-002 | AD183: -5.5800000000000002e-002 | AE183: 83.65 | AF183: 89.36 | AG183: 1 | AH183: A+ | AI183: 7.4299999999999991e-002 | AJ183: =H183+100*O183 -> 123.05 | AK183: 122.9 | AL183: 111 | AM183: 33.6 | AN183: 133 | AO183: -7.9000000000000001e-002 | AP183: 13 | AQ183: 至纯转债!
A184: 332 | B184: 110031 | C184: 航信转债!! | D184: 600271 | E184: 航天信息 | F184: 计算机及 | G184: 软件开发 | H184: 106.8 | I184: 7.0999999999999995e-003 | J184: -7.0999999999999995e-003 | K184: 13.39 | L184: 3.9599999999999996e-002 | M184: 107 | N184: 21.56 | O184: 0.71999999999999997 | P184: 62.11 | Q184: 转股中 | R184: 0.42年 | S184: 回售中 | T184: 24 | U184: 41 | V184: 1.6e-002 | W184: 9.6999999999999989e-002 | X184: 5.9999999999999998e-002 | Y184: 248 | Z184: 2.16 | AA184: 4.4000000000000003e-003 | AB184: -2.63e-002 | AC184: 回售中 | AD184: 回售中 | AE184: 100.27 | AF184: 105.66 | AG184: 0 | AH184: AAA | AI184: 3.0099999999999998e-002 | AJ184: =H184+100*O184 -> 178.80000000000001 | AK184: 151.5 | AL184: 265 | AM184: 45.8 | AN184: 209 | AO184: 6.8000000000000005e-002 | AP184: 15 | AQ184: 航信转债!!
A185: 57 | B185: 128129 | C185: 青农转债 | D185: 2958 | E185: 青农商行 | F185: 金融 | G185: 银行行业 | H185: 109.699 | I185: -8.9999999999999998e-004 | J185: -6.9999999999999993e-003 | K185: 4.81 | L185: -1.84e-002 | M185: 112.2 | N185: 5.74 | O185: 0.309 | P185: 83.8 | Q185: 52天 | R185: 5.63年 | S185: 无权 | T185: 50 | U185: 17 | V185: 3.0000000000000001e-003 | W185: 0.187 | X185: 0.157 | Y185: 267 | Z185: 1.04 | AA185: 4.0999999999999995e-003 | AB185: 1.e-004 | AC185: 无权 | AD185: 无权 | AE185: 无权 | AF185: 90.61 | AG185: 0.43 | AH185: AAA | AI185: 3.9300000000000002e-002 | AJ185: =H185+100*O185 -> 140.59899999999999 | AK185: 135.6 | AL185: 202 | AM185: 45 | AN185: 201 | AO185: -8.0000000000000002e-002 | AP185: 12 | AQ185: 青农转债
A186: 317 | B186: 113016 | C186: 小康转债! | D186: 601127 | E186: 小康股份 | F186: 汽车 | G186: 零部件制 | H186: 108.2 | I186: 2.8999999999999998e-003 | J186: -1.3500000000000002e-002 | K186: 15.64 | L186: -1.9400000000000001e-002 | M186: 109.3 | N186: 15.7 | O186: 8.5999999999999993e-002 | P186: 99.62 | Q186: 转股中 | R186: 2.83年 | S186: 0.83年 | T186: 6.04 | U186: 508 | V186: 0.76700000000000002 | W186: 2.9999999999999999e-002 | X186: 2.9999999999999999e-002 | Y186: 200 | Z186: 3.41 | AA186: 3.5999999999999999e-003 | AB186: -2.5000000000000001e-003 | AC186: -5.96e-002 | AD186: -6.3e-002 | AE186: 97.85 | AF186: 97.82 | AG186: 0.55 | AH186: AA | AI186: 4.07e-002 | AJ186: =H186+100*O186 -> 116.8 | AK186: 116.8 | AL186: 55 | AM186: 18.9 | AN186: 24 | AO186: -6.2e-002 | AP186: 49 | AQ186: 小康转债!
A187: 109 | B187: 128113 | C187: 比音转债 | D187: 2832 | E187: 比音勒芬 | F187: 服装纺织 | G187: 服装行业 | H187: 115.211 | I187: -1.8200000000000001e-002 | J187: 1.66e-002 | K187: 14.86 | L187: -2.7000000000000001e-003 | M187: 117.3 | N187: 14.9 | O187: 0.155 | P187: 99.73 | Q187: 转股中 | R187: 5.43年 | S187: 3.43年 | T187: 6.89 | U187: 10 | V187: 1.3000000000000001e-002 | W187: 8.8000000000000009e-002 | X187: 8.8000000000000009e-002 | Y187: 78 | Z187: 3.62 | AA187: 3.4000000000000002e-003 | AB187: -2.2000000000000001e-003 | AC187: -2.8799999999999999e-002 | AD187: -3.0800000000000001e-002 | AE187: 88.95 | AF187: 93.12 | AG187: 0.6 | AH187: AA | AI187: 4.4299999999999999e-002 | AJ187: =H187+100*O187 -> 130.71100000000001 | AK187: 130.7 | AL187: 177 | AM187: 37.6 | AN187: 162 | AO187: -7.400000000000001e-002 | AP187: 6 | AQ187: 比音转债
A188: 20 | B188: 110077 | C188: 洪城转债 | D188: 600461 | E188: 洪城水业 | F188: 城市公用 | G188: 城市公用 | H188: 111.44 | I188: 1.e-002 | J188: -1.32e-002 | K188: 6.42 | L188: -6.1999999999999998e-003 | M188: 113.5 | N188: 7.13 | O188: 0.23800000000000002 | P188: 90.04 | Q188: 4月18天 | R188: 5.87年 | S188: 3.87年 | T188: 18 | U188: 23 | V188: 1.2e-002 | W188: 0.29600000000000004 | X188: 0.26600000000000001 | Y188: 61 | Z188: 1.21 | AA188: 3.2000000000000002e-003 | AB188: -1.e-003 | AC188: -2.12e-002 | AD188: -2.23e-002 | AE188: 86.59 | AF188: 89.26 | AG188: 0.52 | AH188: AA+ | AI188: 4.2300000000000004e-002 | AJ188: =H188+100*O188 -> 135.24000000000001 | AK188: 132.8 | AL188: 188 | AM188: 43.6 | AN188: 192 | AO188: -3.7999999999999999e-002 | AP188: 5 | AQ188: 洪城转债
A189: 299 | B189: 123007 | C189: 道氏转债! | D189: 300409 | E189: 道氏技术 | F189: 建筑 | G189: 建筑行业 | H189: 109.3 | I189: -2.41e-002 | J189: -8.0000000000000002e-003 | K189: 13.55 | L189: -6.7400000000000002e-002 | M189: 110.3 | N189: 14.95 | O189: 0.20600000000000002 | P189: 90.64 | Q189: 转股中 | R189: 2.97年 | S189: 0.97年 | T189: 3.04 | U189: 46 | V189: 0.13699999999999998 | W189: 4.9000000000000002e-002 | X189: 4.4000000000000004e-002 | Y189: 62 | Z189: 2.58 | AA189: 3.0999999999999999e-003 | AB189: -3.3e-003 | AC189: -6.08e-002 | AD189: -6.3700000000000007e-002 | AE189: 95.12 | AF189: 92.58 | AG189: 0.48 | AH189: AA- | AI189: 6.1699999999999998e-002 | AJ189: =H189+100*O189 -> 129.90000000000001 | AK189: 128 | AL189: 159 | AM189: 32.8 | AN189: 130 | AO189: -5.0999999999999997e-002 | AP189: 22 | AQ189: 道氏转债!
A190: 265 | B190: 110048 | C190: 福能转债! | D190: 600483 | E190: 福能股份 | F190: 能源电力 | G190: 电力供应 | H190: 111.95 | I190: -1.0700000000000001e-002 | J190: -1.e-003 | K190: 7.69 | L190: -2.41e-002 | M190: 113.3 | N190: 8.12 | O190: 0.182 | P190: 94.7 | Q190: 转股中 | R190: 3.91年 | S190: 1.91年 | T190: 28.3 | U190: 11 | V190: 3.0000000000000001e-003 | W190: 0.20899999999999999 | X190: 0.19800000000000001 | Y190: 135 | Z190: 0.96 | AA190: 3.0999999999999999e-003 | AB190: -3.0000000000000001e-003 | AC190: -4.0399999999999998e-002 | AD190: -4.2900000000000001e-002 | AE190: 94.75 | AF190: 97.34 | AG190: 0.48 | AH190: AA+ | AI190: 4.0300000000000002e-002 | AJ190: =H190+100*O190 -> 130.15000000000001 | AK190: 129.2 | AL190: 166 | AM190: 31.9 | AN190: 123 | AO190: -1.3000000000000001e-002 | AP190: 9 | AQ190: 福能转债!
A191: 56 | B191: 128130 | C191: 景兴转债 | D191: 2067 | E191: 景兴纸业 | F191: 造纸包装 | G191: 包装用纸 | H191: 113.99 | I191: 4.6999999999999993e-003 | J191: 6.5000000000000006e-003 | K191: 3.63 | L191: 1.6799999999999999e-002 | M191: 115.1 | N191: 3.4 | O191: 6.8000000000000005e-002 | P191: 106.76 | Q191: 55天 | R191: 5.64年 | S191: 3.64年 | T191: 12.8 | U191: 21 | V191: 1.3999999999999999e-002 | W191: 0.317 | X191: 0.33899999999999997 | Y191: 40 | Z191: 0.89 | AA191: 1.7000000000000001e-003 | AB191: -3.0000000000000001e-003 | AC191: -2.5000000000000001e-002 | AD191: -2.6699999999999998e-002 | AE191: 87.95 | AF191: 90.52 | AG191: 0.67 | AH191: AA | AI191: 4.4299999999999999e-002 | AJ191: =H191+100*O191 -> 120.78999999999999 | AK191: 121.2 | AL191: 91 | AM191: 30.7 | AN191: 111 | AO191: 3.7000000000000005e-002 | AP191: 11 | AQ191: 景兴转债
A192: 127 | B192: 113579 | C192: 健友转债! | D192: 603707 | E192: 健友股份 | F192: 医药 | G192: 原料药 | H192: 113.5 | I192: 2.2000000000000001e-003 | J192: -1.1999999999999999e-003 | K192: 33.71 | L192: 2.7000000000000001e-003 | M192: 114.2 | N192: 42.05 | O192: 0.41600000000000004 | P192: 80.17 | Q192: 转股中 | R192: 5.29年 | S192: 3.29年 | T192: 5.03 | U192: 2.2 | V192: 4.0000000000000001e-003 | W192: 1.6e-002 | X192: 1.3000000000000001e-002 | Y192: 315 | Z192: 9.19 | AA192: 1.1999999999999999e-003 | AB192: -3.5999999999999999e-003 | AC192: -2.6000000000000002e-002 | AD192: -2.7999999999999997e-002 | AE192: 89.41 | AF192: 91.23 | AG192: 0.38 | AH192: AA | AI192: 4.4299999999999999e-002 | AJ192: =H192+100*O192 -> 155.09999999999999 | AK192: 146.8 | AL192: 248 | AM192: 55.6 | AN192: 248 | AO192: -7.4999999999999997e-002 | AP192: 7 | AQ192: 健友转债!
A193: 26 | B193: 128137 | C193: 洁美转债 | D193: 2859 | E193: 洁美科技 | F193: 电子 | G193: 元器件制 | H193: 116.7 | I193: -9.0000000000000011e-003 | J193: -4.0999999999999995e-003 | K193: 25.47 | L193: -2.0400000000000001e-002 | M193: 117.3 | N193: 27.77 | O193: 0.27200000000000002 | P193: 91.72 | Q193: 4月2天 | R193: 5.82年 | S193: 3.82年 | T193: 6 | U193: 4.1 | V193: 6.0000000000000001e-003 | W193: 5.7000000000000002e-002 | X193: 5.2999999999999999e-002 | Y193: 105 | Z193: 5.99 | AA193: 8.9999999999999998e-004 | AB193: -4.3e-003 | AC193: -2.92e-002 | AD193: -3.0899999999999997e-002 | AE193: 80.85 | AF193: 81.74 | AG193: 0.64 | AH193: AA- | AI193: 6.5299999999999997e-002 | AJ193: =H193+100*O193 -> 143.90000000000001 | AK193: 141.7 | AL193: 224 | AM193: 59.9 | AN193: 262 | AO193: -3.5000000000000003e-002 | AP193: 4 | AQ193: 洁美转债
A194: 153 | B194: 113572 | C194: 三祥转债! | D194: 603663 | E194: 三祥新材 | F194: 其他 | G194: 其他 | H194: 112.84 | I194: -4.1999999999999997e-003 | J194: -6.8000000000000005e-003 | K194: 14.44 | L194: -1.43e-002 | M194: 113.2 | N194: 14.19 | O194: 0.109 | P194: 101.76 | Q194: 转股中 | R194: 5.17年 | S194: 3.17年 | T194: 1.7 | U194: 3 | V194: 1.4999999999999999e-002 | W194: 6.0999999999999999e-002 | X194: 6.2e-002 | Y194: 28 | Z194: 4.66 | AA194: 5.9999999999999995e-004 | AB194: -4.0000000000000001e-003 | AC194: -2.52e-002 | AD194: -2.7300000000000001e-002 | AE194: 81.34 | AF194: 78.03 | AG194: 0.77 | AH194: A+ | AI194: 7.6299999999999993e-002 | AJ194: =H194+100*O194 -> 123.74000000000001 | AK194: 123.9 | AL194: 119 | AM194: 42.6 | AN194: 187 | AO194: -7.8e-002 | AP194: 18 | AQ194: 三祥转债!
A195: 302 | B195: 110041 | C195: 蒙电转债! | D195: 600863 | E195: 内蒙华电 | F195: 能源电力 | G195: 电力供应 | H195: 109.24 | I195: 1.1000000000000001e-003 | J195: 7.000000000000001e-004 | K195: 2.54 | L195: 4.0000000000000001e-003 | M195: 109.3 | N195: 2.69 | O195: 0.157 | P195: 94.42 | Q195: 转股中 | R195: 2.95年 | S195: 0.95年 | T195: 18.7 | U195: 12 | V195: 6.0000000000000001e-003 | W195: 0.127 | X195: 0.12 | Y195: 148 | Z195: 1.25 | AA195: 2.0000000000000001e-004 | AB195: -5.6999999999999993e-003 | AC195: -6.1200000000000004e-002 | AD195: -6.4100000000000004e-002 | AE195: 97.89 | AF195: 98.7 | AG195: 0.45 | AH195: AAA | AI195: 3.5699999999999996e-002 | AJ195: =H195+100*O195 -> 124.94 | AK195: 124.1 | AL195: 124 | AM195: 25.4 | AN195: 73 | AO195: -9.0000000000000011e-003 | AP195: 9 | AQ195: 蒙电转债!
A196: 222 | B196: 113027 | C196: 华钰转债!! | D196: 601020 | E196: 华钰矿业 | F196: 有色金属 | G196: 锌铅镍锡 | H196: 115.18 | I196: -1.1399999999999999e-002 | J196: -2.2799999999999997e-002 | K196: 10.25 | L196: -5.0900000000000001e-002 | M196: 114.9 | N196: 10.17 | O196: 0.14300000000000002 | P196: 100.79 | Q196: 转股中 | R196: 4.43年 | S196: 2.43年 | T196: 3.25 | U196: 28 | V196: 7.400000000000001e-002 | W196: 5.7000000000000002e-002 | X196: 5.7999999999999996e-002 | Y196: 57 | Z196: 2.34 | AA196: -5.9999999999999995e-004 | AB196: -6.6e-003 | AC196: -4.1100000000000005e-002 | AD196: -4.3499999999999997e-002 | AE196: 88.32 | AF196: 88.05 | AG196: 0.67 | AH196: AA- | AI196: 6.3299999999999995e-002 | AJ196: =H196+100*O196 -> 129.48000000000002 | AK196: 129.6 | AL196: 168 | AM196: 41.3 | AN196: 179 | AO196: 1.e-002 | AP196: 46 | AQ196: 华钰转债!!
A197: 35 | B197: 127023 | C197: 华菱转2 | D197: 932 | E197: 华菱钢铁 | F197: 钢铁 | G197: 炼钢 | H197: 110.98 | I197: 2.2799999999999997e-002 | J197: -6.9999999999999993e-003 | K197: 4.94 | L197: 2.7000000000000003e-002 | M197: 110.1 | N197: 5.18 | O197: 0.16399999999999998 | P197: 95.37 | Q197: 3月21天 | R197: 5.79年 | S197: 4.79年 | T197: 40 | U197: 52 | V197: 1.2e-002 | W197: 0.13200000000000001 | X197: 0.126 | Y197: 303 | Z197: 0.96 | AA197: -1.4000000000000002e-003 | AB197: -4.5999999999999999e-003 | AC197: -1.23e-002 | AD197: -1.3999999999999999e-002 | AE197: 86.45 | AF197: 88.36 | AG197: 0.59 | AH197: AAA | AI197: 3.9300000000000002e-002 | AJ197: =H197+100*O197 -> 127.38 | AK197: 126.6 | AL197: 145 | AM197: 38.2 | AN197: 165 | AO197: 1.9e-002 | AP197: 7 | AQ197: 华菱转2
A198: 331 | B198: 110033 | C198: 国贸转债! | D198: 600755 | E198: 厦门国贸 | F198: 交通运输 | G198: 交通运输 | H198: 108.18 | I198: 3.4999999999999996e-003 | J198: -1.1999999999999999e-003 | K198: 6.56 | L198: 1.3899999999999999e-002 | M198: 108 | N198: 7.19 | O198: 0.18600000000000003 | P198: 91.24 | Q198: 转股中 | R198: 0.99年 | S198: 回售中 | T198: 12.1 | U198: 9.1 | V198: 6.9999999999999993e-003 | W198: 9.5000000000000001e-002 | X198: 8.6999999999999994e-002 | Y198: 128 | Z198: 0.85 | AA198: -1.7000000000000001e-003 | AB198: -1.66e-002 | AC198: 回售中 | AD198: 回售中 | AE198: 100.33 | AF198: 104.72 | AG198: 0.17 | AH198: AAA | AI198: 3.1600000000000003e-002 | AJ198: =H198+100*O198 -> 126.78 | AK198: 125.1 | AL198: 133 | AM198: 20.4 | AN198: 27 | AO198: -2.6000000000000002e-002 | AP198: 19 | AQ198: 国贸转债!
A199: 219 | B199: 128070 | C199: 智能转债! | D199: 2877 | E199: 智能自控 | F199: 机械装备 | G199: 通用设备 | H199: 118.493 | I199: 3.3e-003 | J199: 3.4999999999999996e-003 | K199: 7.04 | L199: 1.8799999999999997e-002 | M199: 117.6 | N199: 9.51 | O199: 0.60099999999999998 | P199: 74.03 | Q199: 转股中 | R199: 4.48年 | S199: 无权 | T199: 2.3 | U199: 188 | V199: 0.68900000000000006 | W199: 9.8000000000000004e-002 | X199: 7.2999999999999995e-002 | Y199: 23 | Z199: 3.28 | AA199: -1.7000000000000001e-003 | AB199: -8.6e-003 | AC199: 无权 | AD199: 无权 | AE199: 无权 | AF199: 85.98 | AG199: 0.37 | AH199: A+ | AI199: 7.4299999999999991e-002 | AJ199: =H199+100*O199 -> 178.59299999999999 | AK199: 163 | AL199: 281 | AM199: 77 | AN199: 287 | AO199: -3.7000000000000005e-002 | AP199: 32 | AQ199: 智能转债!
A200: 31 | B200: 113607 | C200: 伟20转债! | D200: 603568 | E200: 伟明环保 | F200: 城市公用 | G200: 三废处理 | H200: 116.21 | I200: 1.03e-002 | J200: 4.6999999999999993e-003 | K200: 18.76 | L200: 3.2500000000000001e-002 | M200: 115.1 | N200: 22.01 | O200: 0.36299999999999999 | P200: 85.23 | Q200: 3月28天 | R200: 5.82年 | S200: 3.82年 | T200: 12 | U200: 1.4 | V200: 1.e-003 | W200: 5.0999999999999997e-002 | X200: 4.2999999999999997e-002 | Y200: 236 | Z200: 4.7 | AA200: -1.7000000000000001e-003 | AB200: -6.3e-003 | AC200: -2.86e-002 | AD200: -3.0299999999999997e-002 | AE200: 87.29 | AF200: 89.84 | AG200: 0.46 | AH200: AA | AI200: 4.4299999999999999e-002 | AJ200: =H200+100*O200 -> 152.50999999999999 | AK200: 147.2 | AL200: 249 | AM200: 57.3 | AN200: 255 | AO200: -5.2000000000000005e-002 | AP200: 4 | AQ200: 伟20转债!
A201: 136 | B201: 128106 | C201: 华统转债 | D201: 2840 | E201: 华统股份 | F201: 农业 | G201: 农产品加 | H201: 114.3 | I201: -3.3399999999999999e-002 | J201: 1.7899999999999999e-002 | K201: 9.79 | L201: -2.3e-002 | M201: 113.2 | N201: 9.39 | O201: 9.6000000000000002e-002 | P201: 104.26 | Q201: 转股中 | R201: 5.25年 | S201: 3.25年 | T201: 5.37 | U201: 10 | V201: 1.6e-002 | W201: 0.122 | X201: 0.128 | Y201: 44 | Z201: 2.61 | AA201: -1.9e-003 | AB201: -6.4000000000000003e-003 | AC201: -2.8300000000000002e-002 | AD201: -3.0299999999999997e-002 | AE201: 89.55 | AF201: 90.57 | AG201: 0.67 | AH201: AA | AI201: 4.4299999999999999e-002 | AJ201: =H201+100*O201 -> 123.89999999999999 | AK201: 124.3 | AL201: 127 | AM201: 33.8 | AN201: 137 | AO201: -8.5000000000000006e-002 | AP201: 8 | AQ201: 华统转债
A202: 195 | B202: 123035 | C202: 利德转债! | D202: 300296 | E202: 利亚德 | F202: 电子 | G202: LED制 | H202: 116.48 | I202: 8.5000000000000006e-003 | J202: 1.3999999999999999e-002 | K202: 6.21 | L202: 5.0799999999999998e-002 | M202: 115.1 | N202: 6.98 | O202: 0.309 | P202: 88.97 | Q202: 转股中 | R202: 4.85年 | S202: 2.85年 | T202: 8 | U202: 11 | V202: 1.2e-002 | W202: 5.0999999999999997e-002 | X202: 4.4999999999999998e-002 | Y202: 158 | Z202: 1.85 | AA202: -2.5000000000000001e-003 | AB202: -8.0000000000000002e-003 | AC202: -3.85e-002 | AD202: -4.0599999999999997e-002 | AE202: 92.08 | AF202: 95.4 | AG202: 0.44 | AH202: AA+ | AI202: 4.0300000000000002e-002 | AJ202: =H202+100*O202 -> 147.38 | AK202: 144 | AL202: 238 | AM202: 48.6 | AN202: 221 | AO202: -5.4000000000000006e-002 | AP202: 16 | AQ202: 利德转债!
A203: 54 | B203: 123065 | C203: 宝莱转债! | D203: 300246 | E203: 宝莱特 | F203: 医药 | G203: 医疗器械 | H203: 123.29 | I203: 4.4000000000000003e-003 | J203: -1.e-004 | K203: 25.98 | L203: 1.6799999999999999e-002 | M203: 121.4 | N203: 40.54 | O203: 0.92400000000000004 | P203: 64.08 | Q203: 2月2天 | R203: 5.65年 | S203: 3.65年 | T203: 2.19 | U203: 310 | V203: 1.1399999999999999 | W203: 5.7999999999999996e-002 | X203: 3.7000000000000005e-002 | Y203: 38 | Z203: 4.56 | AA203: -2.8000000000000004e-003 | AB203: -9.1999999999999998e-003 | AC203: -4.3200000000000002e-002 | AD203: -4.5199999999999997e-002 | AE203: 82.13 | AF203: 85.55 | AG203: 0.26 | AH203: AA- | AI203: 6.5299999999999997e-002 | AJ203: =H203+100*O203 -> 215.69 | AK203: 182.5 | AL203: 296 | AM203: 96.9 | AN203: 299 | AO203: -5.0999999999999997e-002 | AP203: 11 | AQ203: 宝莱转债!
A204: 47 | B204: 128134 | C204: 鸿路转债! | D204: 2541 | E204: 鸿路钢构 | F204: 建筑 | G204: 其他 | H204: 117 | I204: 2.5399999999999999e-002 | J204: 2.8999999999999998e-002 | K204: 40.17 | L204: 9.9900000000000003e-002 | M204: 115.1 | N204: 43.74 | O204: 0.27399999999999997 | P204: 91.84 | Q204: 3月7天 | R204: 5.75年 | S204: 3.75年 | T204: 18.8 | U204: 378 | V204: 0.16800000000000001 | W204: 8.900000000000001e-002 | X204: 8.199999999999999e-002 | Y204: 210 | Z204: 3.93 | AA204: -2.8999999999999998e-003 | AB204: -7.4999999999999997e-003 | AC204: -3.0800000000000001e-002 | AD204: -3.2500000000000001e-002 | AE204: 87.54 | AF204: 90.1 | AG204: 0.54 | AH204: AA | AI204: 4.4299999999999999e-002 | AJ204: =H204+100*O204 -> 144.40000000000001 | AK204: 142.2 | AL204: 228 | AM204: 52.1 | AN204: 241 | AO204: 8.9999999999999997e-002 | AP204: 4 | AQ204: 鸿路转债!
A205: 209 | B205: 128075 | C205: 远东转债! | D205: 2406 | E205: 远东传动 | F205: 汽车 | G205: 零部件制 | H205: 116.7 | I205: -1.77e-002 | J205: 1.21e-002 | K205: 6.14 | L205: -8.1000000000000013e-003 | M205: 114.9 | N205: 5.54 | O205: 5.2999999999999999e-002 | P205: 110.83 | Q205: 转股中 | R205: 4.71年 | S205: 2.71年 | T205: 5.45 | U205: 27 | V205: 4.2999999999999997e-002 | W205: 0.14199999999999999 | X205: 0.158 | Y205: 38 | Z205: 1.22 | AA205: -3.4000000000000002e-003 | AB205: -9.0000000000000011e-003 | AC205: -4.1599999999999998e-002 | AD205: -4.3700000000000003e-002 | AE205: 91.9 | AF205: 94.9 | AG205: 0.69 | AH205: AA | AI205: 4.2300000000000004e-002 | AJ205: =H205+100*O205 -> 122. | AK205: 122.6 | AL205: 109 | AM205: 27.7 | AN205: 87 | AO205: -7.400000000000001e-002 | AP205: 16 | AQ205: 远东转债!
A206: 58 | B206: 113602 | C206: 景20转债 | D206: 603228 | E206: 景旺电子 | F206: 电子 | G206: 元器件制 | H206: 116.42 | I206: 1.e-003 | J206: -2.0999999999999999e-003 | K206: 30.06 | L206: -2.3e-003 | M206: 113.3 | N206: 35.28 | O206: 0.36599999999999999 | P206: 85.2 | Q206: 52天 | R206: 5.62年 | S206: 3.62年 | T206: 17.8 | U206: 13 | V206: 6.0000000000000001e-003 | W206: 6.9000000000000006e-002 | X206: 5.9000000000000004e-002 | Y206: 257 | Z206: 4.28 | AA206: -4.8999999999999998e-003 | AB206: -9.1000000000000004e-003 | AC206: -3.0099999999999998e-002 | AD206: -3.1899999999999998e-002 | AE206: 88.21 | AF206: 89.22 | AG206: 0.47 | AH206: AA | AI206: 4.4299999999999999e-002 | AJ206: =H206+100*O206 -> 153.02000000000001 | AK206: 147.6 | AL206: 252 | AM206: 58.4 | AN206: 260 | AO206: 1.9e-002 | AP206: 7 | AQ206: 景20转债
A207: 168 | B207: 128096 | C207: 奥瑞转债!! | D207: 2701 | E207: 奥瑞金 | F207: 造纸包装 | G207: 包装材料 | H207: 119 | I207: -3.4200000000000001e-002 | J207: 1.3600000000000001e-002 | K207: 5.24 | L207: -2.7799999999999998e-002 | M207: 116 | N207: 4.54 | O207: 3.1e-002 | P207: 115.42 | Q207: 转股中 | R207: 5年34天 | S207: 3年34天 | T207: 7.08 | U207: 35 | V207: 4.0999999999999995e-002 | W207: 5.5999999999999994e-002 | X207: 6.5000000000000002e-002 | Y207: 127 | Z207: 2.12 | AA207: -5.1000000000000004e-003 | AB207: -1.06e-002 | AC207: -4.0099999999999997e-002 | AD207: -4.2500000000000003e-002 | AE207: 91.33 | AF207: 94.43 | AG207: 0.74 | AH207: AA+ | AI207: 4.2300000000000004e-002 | AJ207: =H207+100*O207 -> 122.09999999999999 | AK207: 122.6 | AL207: 110 | AM207: 28.2 | AN207: 91 | AO207: -9.0000000000000011e-003 | AP207: 21 | AQ207: 奥瑞转债!!
A208: 122 | B208: 127017 | C208: 万青转债 | D208: 789 | E208: 万年青 | F208: 建筑 | G208: 水泥 | H208: 122 | I208: 9.8999999999999991e-003 | J208: -6.0000000000000001e-003 | K208: 13.79 | L208: 7.3000000000000001e-003 | M208: 118.4 | N208: 14.16 | O208: 0.253 | P208: 97.39 | Q208: 转股中 | R208: 5.40年 | S208: 3.40年 | T208: 10 | U208: 24 | V208: 2.e-002 | W208: 9.0999999999999998e-002 | X208: 8.900000000000001e-002 | Y208: 110 | Z208: 1.98 | AA208: -5.6000000000000008e-003 | AB208: -1.15e-002 | AC208: -4.4900000000000002e-002 | AD208: -4.6699999999999998e-002 | AE208: 89.62 | AF208: 95.08 | AG208: 0.54 | AH208: AA+ | AI208: 4.2300000000000004e-002 | AJ208: =H208+100*O208 -> 147.30000000000001 | AK208: 146.6 | AL208: 246 | AM208: 51.5 | AN208: 239 | AO208: 1.6e-002 | AP208: 8 | AQ208: 万青转债
A209: 178 | B209: 123038 | C209: 联得转债! | D209: 300545 | E209: 联得装备 | F209: 机械装备 | G209: 专用设备 | H209: 121.99 | I209: 8.0000000000000002e-003 | J209: -2.7000000000000001e-003 | K209: 24.19 | L209: 7.9000000000000008e-003 | M209: 118.6 | N209: 25.29 | O209: 0.27500000000000002 | P209: 95.65 | Q209: 转股中 | R209: 4.96年 | S209: 2.96年 | T209: 1.47 | U209: 24 | V209: 0.13200000000000001 | W209: 4.2000000000000003e-002 | X209: 4.0000000000000001e-002 | Y209: 35 | Z209: 4.61 | AA209: -5.7999999999999996e-003 | AB209: -1.2199999999999999e-002 | AC209: -5.0599999999999999e-002 | AD209: -5.28e-002 | AE209: 83.18 | AF209: 83.73 | AG209: 0.67 | AH209: A+ | AI209: 7.4299999999999991e-002 | AJ209: =H209+100*O209 -> 149.49000000000001 | AK209: 148.3 | AL209: 254 | AM209: 64.6 | AN209: 268 | AO209: -0.14300000000000002 | AP209: 18 | AQ209: 联得转债!
A210: 264 | B210: 128050 | C210: 钧达转债! | D210: 2865 | E210: 钧达股份 | F210: 汽车 | G210: 零部件制 | H210: 125.59 | I210: 2.0400000000000001e-002 | J210: 2.4500000000000001e-002 | K210: 18.74 | L210: 5.7000000000000002e-002 | M210: 122.7 | N210: 14.85 | O210: -5.0000000000000001e-003 | P210: 126.2 | Q210: 转股中 | R210: 3.92年 | S210: 1.92年 | T210: 1.96 | U210: 238 | V210: 0.95299999999999996 | W210: 8.1000000000000003e-002 | X210: 0.10199999999999999 | Y210: 24 | Z210: 2.62 | AA210: -6.0000000000000001e-003 | AB210: -1.5700000000000002e-002 | AC210: -9.11e-002 | AD210: -9.3599999999999989e-002 | AE210: 90.74 | AF210: 96.89 | AG210: 0.79 | AH210: AA- | AI210: 6.3299999999999995e-002 | AJ210: =H210+100*O210 -> 125.09 | AK210: 125 | AL210: 131 | AM210: 28.1 | AN210: 90 | AO210: 1.e-002 | AP210: 61 | AQ210: 钧达转债!
A211: 25 | B211: 127024 | C211: 盈峰转债 | D211: 967 | E211: 盈峰环境 | F211: 机械装备 | G211: 专用设备 | H211: 120.906 | I211: 4.5000000000000005e-003 | J211: -2.3e-003 | K211: 8.16 | L211: 3.7000000000000002e-003 | M211: 116.8 | N211: 8.31 | O211: 0.23100000000000001 | P211: 98.19 | Q211: 4月2天 | R211: 5.82年 | S211: 3.82年 | T211: 14.8 | U211: 7.9 | V211: 4.0000000000000001e-003 | W211: 5.7000000000000002e-002 | X211: 5.5999999999999994e-002 | Y211: 258 | Z211: 1.6 | AA211: -6.0000000000000001e-003 | AB211: -1.1000000000000001e-002 | AC211: -3.8900000000000004e-002 | AD211: -4.0399999999999998e-002 | AE211: 87.66 | AF211: 92.11 | AG211: 0.58 | AH211: AA+ | AI211: 4.2300000000000004e-002 | AJ211: =H211+100*O211 -> 144.006 | AK211: 143.6 | AL211: 237 | AM211: 51.5 | AN211: 238 | AO211: -4.2999999999999997e-002 | AP211: 5 | AQ211: 盈峰转债
A212: 85 | B212: 127020 | C212: 中金转债 | D212: 60 | E212: 中金岭南 | F212: 有色金属 | G212: 有色行业 | H212: 117.9 | I212: -5.1000000000000004e-003 | J212: -6.6e-003 | K212: 4.82 | L212: -1.83e-002 | M212: 113.7 | N212: 4.71 | O212: 0.152 | P212: 102.34 | Q212: 17天 | R212: 5.53年 | S212: 3.53年 | T212: 38 | U212: 31 | V212: 6.9999999999999993e-003 | W212: 0.221 | X212: 0.22600000000000001 | Y212: 172 | Z212: 1.53 | AA212: -6.6e-003 | AB212: -1.1000000000000001e-002 | AC212: -3.7499999999999999e-002 | AD212: -3.8699999999999998e-002 | AE212: 87.98 | AF212: 90.69 | AG212: 0.63 | AH212: AA+ | AI212: 4.2300000000000004e-002 | AJ212: =H212+100*O212 -> 133.09999999999999 | AK212: 133.5 | AL212: 192 | AM212: 42.8 | AN212: 189 | AO212: 1.7000000000000001e-002 | AP212: 14 | AQ212: 中金转债
A213: 120 | B213: 128109 | C213: 楚江转债 | D213: 2171 | E213: 楚江新材 | F213: 有色金属 | G213: 铜金属 | H213: 119.461 | I213: -1.2699999999999999e-002 | J213: -3.4000000000000002e-003 | K213: 8.59 | L213: -2.7200000000000002e-002 | M213: 115.3 | N213: 8.73 | O213: 0.214 | P213: 98.4 | Q213: 转股中 | R213: 5.40年 | S213: 3.40年 | T213: 18.3 | U213: 30 | V213: 1.3999999999999999e-002 | W213: 0.16 | X213: 0.157 | Y213: 115 | Z213: 2.08 | AA213: -6.7000000000000002e-003 | AB213: -1.1699999999999999e-002 | AC213: -3.9e-002 | AD213: -4.0899999999999999e-002 | AE213: 89.06 | AF213: 91.66 | AG213: 0.59 | AH213: AA | AI213: 4.4299999999999999e-002 | AJ213: =H213+100*O213 -> 140.86099999999999 | AK213: 140.5 | AL213: 222 | AM213: 48.9 | AN213: 223 | AO213: -1.4999999999999999e-002 | AP213: 6 | AQ213: 楚江转债
A214: 82 | B214: 123060 | C214: 苏试转债 | D214: 300416 | E214: 苏试试验 | F214: 机械装备 | G214: 专用设备 | H214: 122.001 | I214: 8.1000000000000013e-003 | J214: -2.3900000000000001e-002 | K214: 22.32 | L214: -2.4500000000000001e-002 | M214: 117.6 | N214: 23.86 | O214: 0.30399999999999999 | P214: 93.55 | Q214: 19天 | R214: 5.53年 | S214: 3.53年 | T214: 3.1 | U214: 2.5 | V214: 6.9999999999999993e-003 | W214: 6.8000000000000005e-002 | X214: 6.4000000000000001e-002 | Y214: 45 | Z214: 4.57 | AA214: -6.7000000000000002e-003 | AB214: -1.23e-002 | AC214: -4.2800000000000005e-002 | AD214: -4.4699999999999997e-002 | AE214: 82.46 | AF214: 83.49 | AG214: 0.64 | AH214: AA- | AI214: 6.5299999999999997e-002 | AJ214: =H214+100*O214 -> 152.40100000000001 | AK214: 150.5 | AL214: 260 | AM214: 67 | AN214: 273 | AO214: -2.6000000000000002e-002 | AP214: 8 | AQ214: 苏试转债
A215: 88 | B215: 128121 | C215: 宏川转债 | D215: 2930 | E215: 宏川智慧 | F215: 交通运输 | G215: 物流业 | H215: 117.55 | I215: -4.4299999999999999e-002 | J215: 4.0800000000000003e-002 | K215: 19.35 | L215: -5.1000000000000004e-003 | M215: 113.3 | N215: 20.25 | O215: 0.23000000000000001 | P215: 95.56 | Q215: 17天 | R215: 5.52年 | S215: 3.52年 | T215: 6.7 | U215: 25 | V215: 3.2000000000000001e-002 | W215: 7.8e-002 | X215: 7.4999999999999997e-002 | Y215: 86 | Z215: 4.47 | AA215: -6.8000000000000005e-003 | AB215: -1.11e-002 | AC215: -3.3500000000000002e-002 | AD215: -3.5400000000000001e-002 | AE215: 82.4 | AF215: 80.49 | AG215: 0.69 | AH215: AA- | AI215: 6.5299999999999997e-002 | AJ215: =H215+100*O215 -> 140.55000000000001 | AK215: 139.5 | AL215: 218 | AM215: 57.1 | AN215: 253 | AO215: -3.9e-002 | AP215: 4 | AQ215: 宏川转债
A216: 286 | B216: 128040 | C216: 华通转债! | D216: 2758 | E216: 浙农股份 | F216: 医药 | G216: 医药商业 | H216: 115.211 | I216: -1.95e-002 | J216: -6.8000000000000005e-003 | K216: 11.68 | L216: -3.4700000000000002e-002 | M216: 112.3 | N216: 10.33 | O216: 1.9e-002 | P216: 113.07 | Q216: 转股中 | R216: 3.43年 | S216: 1.43年 | T216: 2.22 | U216: 22 | V216: 8.4000000000000005e-002 | W216: 3.9e-002 | X216: 4.4000000000000004e-002 | Y216: 57 | Z216: 3.86 | AA216: -7.6e-003 | AB216: -1.3999999999999999e-002 | AC216: -6.9500000000000006e-002 | AD216: -7.2499999999999995e-002 | AE216: 93.28 | AF216: 91.38 | AG216: 0.76 | AH216: AA- | AI216: 6.3299999999999995e-002 | AJ216: =H216+100*O216 -> 117.111 | AK216: 117.4 | AL216: 60 | AM216: 24.1 | AN216: 55 | AO216: -1.8000000000000002e-002 | AP216: 31 | AQ216: 华通转债!
A217: 108 | B217: 128114 | C217: 正邦转债 | D217: 2157 | E217: 正邦科技 | F217: 农业 | G217: 畜牧业 | H217: 120.1 | I217: -1.1299999999999999e-002 | J217: -3.6200000000000003e-002 | K217: 18.06 | L217: -6.6699999999999995e-002 | M217: 115.3 | N217: 16.09 | O217: 7.0000000000000007e-002 | P217: 112.24 | Q217: 转股中 | R217: 5.44年 | S217: 3.44年 | T217: 16 | U217: 175 | V217: 9.0999999999999998e-002 | W217: 3.5000000000000003e-002 | X217: 3.9e-002 | Y217: 456 | Z217: 3.03 | AA217: -7.6e-003 | AB217: -1.26e-002 | AC217: -4.0000000000000001e-002 | AD217: -4.1900000000000007e-002 | AE217: 89.54 | AF217: 92.46 | AG217: 0.71 | AH217: AA+ | AI217: 4.2300000000000004e-002 | AJ217: =H217+100*O217 -> 127.09999999999999 | AK217: 128 | AL217: 158 | AM217: 35.5 | AN217: 149 | AO217: 3.4000000000000002e-002 | AP217: 13 | AQ217: 正邦转债
A218: 312 | B218: 128021 | C218: 兄弟转债!! | D218: 2562 | E218: 兄弟科技 | F218: 医药 | G218: 原料药 | H218: 111.3 | I218: -9.7999999999999997e-003 | J218: 9.7999999999999997e-003 | K218: 5.1 | L218: 0. | M218: 108.8 | N218: 5.19 | O218: 0.13300000000000001 | P218: 98.27 | Q218: 转股中 | R218: 2.89年 | S218: 0.89年 | T218: 2.66 | U218: 3.6 | V218: 1.2e-002 | W218: 5.5e-002 | X218: 5.4000000000000006e-002 | Y218: 48 | Z218: 1.98 | AA218: -7.9000000000000008e-003 | AB218: -1.3600000000000001e-002 | AC218: -8.3400000000000002e-002 | AD218: -8.6099999999999996e-002 | AE218: 97.38 | AF218: 97.11 | AG218: 0 | AH218: AA | AI218: 4.07e-002 | AJ218: =H218+100*O218 -> 124.59999999999999 | AK218: 124.3 | AL218: 126 | AM218: 27 | AN218: 81 | AO218: -6.7000000000000004e-002 | AP218: 13 | AQ218: 兄弟转债!!
A219: 24 | B219: 127025 | C219: 冀东转债 | D219: 401 | E219: 冀东水泥 | F219: 建筑 | G219: 水泥 | H219: 115.3 | I219: 2.5999999999999999e-003 | J219: 2.7000000000000001e-003 | K219: 14.39 | L219: 9.7999999999999997e-003 | M219: 110.1 | N219: 15.78 | O219: 0.26400000000000001 | P219: 91.19 | Q219: 4月3天 | R219: 5.82年 | S219: 3.82年 | T219: 28.2 | U219: 12 | V219: 4.0000000000000001e-003 | W219: 0.14499999999999999 | X219: 0.13300000000000001 | Y219: 194 | Z219: 1.43 | AA219: -8.0000000000000002e-003 | AB219: -1.1200000000000002e-002 | AC219: -2.8399999999999998e-002 | AD219: -2.9700000000000001e-002 | AE219: 88.26 | AF219: 88.24 | AG219: 0.54 | AH219: AAA | AI219: 3.9300000000000002e-002 | AJ219: =H219+100*O219 -> 141.69999999999999 | AK219: 139.4 | AL219: 216 | AM219: 51.1 | AN219: 236 | AO219: -1.2e-002 | AP219: 7 | AQ219: 冀东转债
A220: 176 | B220: 128090 | C220: 汽模转2 | D220: 2510 | E220: 天汽模 | F220: 汽车 | G220: 零部件制 | H220: 119.645 | I220: -2.2000000000000002e-002 | J220: -7.3000000000000001e-003 | K220: 4.63 | L220: -4.3400000000000001e-002 | M220: 114.9 | N220: 4.21 | O220: 8.8000000000000009e-002 | P220: 109.98 | Q220: 转股中 | R220: 4.97年 | S220: 2.97年 | T220: 3.11 | U220: 193 | V220: 0.51400000000000001 | W220: 7.0999999999999994e-002 | X220: 7.8e-002 | Y220: 44 | Z220: 1.6 | AA220: -8.3000000000000001e-003 | AB220: -1.3500000000000002e-002 | AC220: -4.5899999999999996e-002 | AD220: -4.7800000000000002e-002 | AE220: 90.91 | AF220: 93.88 | AG220: 0.67 | AH220: AA | AI220: 4.2300000000000004e-002 | AJ220: =H220+100*O220 -> 128.44499999999999 | AK220: 129.3 | AL220: 167 | AM220: 35.4 | AN220: 148 | AO220: -0.10000000000000001 | AP220: 26 | AQ220: 汽模转2
A221: 41 | B221: 128135 | C221: 洽洽转债 | D221: 2557 | E221: 洽洽食品 | F221: 食品饮料 | G221: 休闲食品 | H221: 127.057 | I221: -2.9999999999999997e-004 | J221: 5.6999999999999993e-003 | K221: 62.58 | L221: 8.6999999999999994e-003 | M221: 120.2 | N221: 60.83 | O221: 0.23499999999999999 | P221: 102.88 | Q221: 3月18天 | R221: 5.78年 | S221: 3.78年 | T221: 13.4 | U221: 27 | V221: 1.6e-002 | W221: 4.2000000000000003e-002 | X221: 4.2999999999999997e-002 | Y221: 317 | Z221: 8.28 | AA221: -9.7000000000000003e-003 | AB221: -1.5600000000000001e-002 | AC221: -5.0499999999999996e-002 | AD221: -5.2199999999999996e-002 | AE221: 87.52 | AF221: 93.97 | AG221: 0.62 | AH221: AA | AI221: 4.4299999999999999e-002 | AJ221: =H221+100*O221 -> 150.55700000000002 | AK221: 151.2 | AL221: 264 | AM221: 57.3 | AN221: 254 | AO221: 9.3000000000000013e-002 | AP221: 7 | AQ221: 洽洽转债
A222: 78 | B222: 110073 | C222: 国投转债 | D222: 600061 | E222: 国投资本 | F222: 金融 | G222: 证券行业 | H222: 116.8 | I222: 6.7000000000000002e-003 | J222: -5.6000000000000008e-003 | K222: 13.86 | L222: 2.2000000000000001e-003 | M222: 110.5 | N222: 15.25 | O222: 0.28499999999999998 | P222: 90.89 | Q222: 24天 | R222: 5.54年 | S222: 无权 | T222: 80 | U222: 73 | V222: 8.0000000000000002e-003 | W222: 0.13699999999999998 | X222: 0.124 | Y222: 586 | Z222: 1.4 | AA222: -1.01e-002 | AB222: -1.3500000000000002e-002 | AC222: 无权 | AD222: 无权 | AE222: 无权 | AF222: 89.49 | AG222: 0.52 | AH222: AAA | AI222: 3.9300000000000002e-002 | AJ222: =H222+100*O222 -> 145.29999999999998 | AK222: 142.7 | AL222: 231 | AM222: 53.2 | AN222: 243 | AO222: 8.0000000000000002e-003 | AP222: 22 | AQ222: 国投转债
A223: 191 | B223: 110062 | C223: 烽火转债 | D223: 600498 | E223: 烽火通信 | F223: 通信互联 | G223: 通信设备 | H223: 116.73 | I223: 4.8999999999999998e-003 | J223: 1.38e-002 | K223: 24.45 | L223: 3.3799999999999997e-002 | M223: 110.8 | N223: 25.65 | O223: 0.22500000000000001 | P223: 95.32 | Q223: 转股中 | R223: 4.90年 | S223: 2.90年 | T223: 30.9 | U223: 99 | V223: 2.7000000000000003e-002 | W223: 0.10800000000000001 | X223: 0.10300000000000001 | Y223: 286 | Z223: 2.69 | AA223: -1.0800000000000001e-002 | AB223: -1.4800000000000001e-002 | AC223: -3.9399999999999998e-002 | AD223: -4.1299999999999996e-002 | AE223: 92.42 | AF223: 92.91 | AG223: 0.55 | AH223: AAA | AI223: 3.73e-002 | AJ223: =H223+100*O223 -> 139.23000000000002 | AK223: 138.1 | AL223: 213 | AM223: 45.2 | AN223: 204 | AO223: 4.4999999999999998e-002 | AP223: 20 | AQ223: 烽火转债
A224: 155 | B224: 110067 | C224: 华安转债! | D224: 600909 | E224: 华安证券 | F224: 金融 | G224: 证券行业 | H224: 117.15 | I224: 8.6e-003 | J224: -1.2500000000000001e-002 | K224: 7.99 | L224: -7.4999999999999997e-003 | M224: 110.5 | N224: 8.67 | O224: 0.27100000000000002 | P224: 92.16 | Q224: 转股中 | R224: 5.17年 | S224: 无权 | T224: 28 | U224: 27 | V224: 8.0000000000000002e-003 | W224: 9.6999999999999989e-002 | X224: 8.900000000000001e-002 | Y224: 289 | Z224: 2.09 | AA224: -1.1399999999999999e-002 | AB224: -1.4999999999999999e-002 | AC224: 无权 | AD224: 无权 | AE224: 无权 | AF224: 90.77 | AG224: 0.52 | AH224: AAA | AI224: 3.9300000000000002e-002 | AJ224: =H224+100*O224 -> 144.25 | AK224: 142.1 | AL224: 227 | AM224: 51.4 | AN224: 237 | AO224: 2.2000000000000002e-002 | AP224: 27 | AQ224: 华安转债!
A225: 249 | B225: 127011 | C225: 中鼎转2! | D225: 887 | E225: 中鼎股份 | F225: 汽车 | G225: 零部件制 | H225: 121.172 | I225: -1.9e-002 | J225: -6.9999999999999993e-003 | K225: 11.01 | L225: -5.33e-002 | M225: 115.2 | N225: 11.59 | O225: 0.27600000000000002 | P225: 95 | Q225: 转股中 | R225: 4年59天 | S225: 2年59天 | T225: 12 | U225: 18 | V225: 1.2e-002 | W225: 8.900000000000001e-002 | X225: 8.5000000000000006e-002 | Y225: 134 | Z225: 1.54 | AA225: -1.23e-002 | AB225: -1.8700000000000001e-002 | AC225: -6.6100000000000006e-002 | AD225: -6.8699999999999997e-002 | AE225: 94.54 | AF225: 98.1 | AG225: 0.49 | AH225: AA+ | AI225: 4.0300000000000002e-002 | AJ225: =H225+100*O225 -> 148.77199999999999 | AK225: 147.3 | AL225: 250 | AM225: 49.2 | AN225: 227 | AO225: -9.0999999999999998e-002 | AP225: 26 | AQ225: 中鼎转2!
A226: 139 | B226: 113034 | C226: 滨化转债 | D226: 601678 | E226: 滨化股份 | F226: 化工 | G226: 化工 | H226: 122.71 | I226: 3.2000000000000001e-002 | J226: 3.8e-003 | K226: 5.6 | L226: 4.6699999999999998e-002 | M226: 115.1 | N226: 4.68 | O226: 2.6000000000000002e-002 | P226: 119.66 | Q226: 转股中 | R226: 5.25年 | S226: 3.25年 | T226: 19.3 | U226: 74 | V226: 3.2000000000000001e-002 | W226: 0.20999999999999999 | X226: 0.251 | Y226: 92 | Z226: 1.38 | AA226: -1.23e-002 | AB226: -1.7399999999999999e-002 | AC226: -4.87e-002 | AD226: -5.0599999999999999e-002 | AE226: 89.45 | AF226: 92.07 | AG226: 0.77 | AH226: AA | AI226: 4.4299999999999999e-002 | AJ226: =H226+100*O226 -> 125.30999999999999 | AK226: 125.8 | AL226: 138 | AM226: 33.7 | AN226: 136 | AO226: 7.9000000000000001e-002 | AP226: 29 | AQ226: 滨化转债
A227: 81 | B227: 123061 | C227: 航新转债 | D227: 300424 | E227: 航新科技 | F227: 航空航天 | G227: 航空航天 | H227: 133.451 | I227: 1.1000000000000001e-003 | J227: 2.6600000000000002e-002 | K227: 18.12 | L227: 3.4200000000000001e-002 | M227: 124.8 | N227: 14.86 | O227: 9.4e-002 | P227: 121.94 | Q227: 20天 | R227: 5.53年 | S227: 3.53年 | T227: 2.5 | U227: 775 | V227: 2.25 | W227: 5.7999999999999996e-002 | X227: 7.0000000000000007e-002 | Y227: 43 | Z227: 3.98 | AA227: -1.23e-002 | AB227: -1.9599999999999999e-002 | AC227: -6.4100000000000004e-002 | AD227: -6.6299999999999998e-002 | AE227: 83.11 | AF227: 88.68 | AG227: 0.81 | AH227: AA- | AI227: 6.5299999999999997e-002 | AJ227: =H227+100*O227 -> 142.851 | AK227: 145 | AL227: 240 | AM227: 56.3 | AN227: 250 | AO227: 2.e-003 | AP227: 10 | AQ227: 航新转债
A228: 15 | B228: 123079 | C228: 运达转债 | D228: 300772 | E228: 运达股份 | F228: 能源电力 | G228: 风能 | H228: 124 | I228: 0. | J228: -1.01e-002 | K228: 17.76 | L228: -1.3300000000000001e-002 | M228: 115.1 | N228: 15.31 | O228: 6.9000000000000006e-002 | P228: 116 | Q228: 5月0天 | R228: 5.90年 | S228: 3.90年 | T228: 5.77 | U228: 155 | V228: 0.215 | W228: 0.111 | X228: 0.128 | Y228: 52 | Z228: 3.39 | AA228: -1.2800000000000001e-002 | AB228: -1.72e-002 | AC228: -4.36e-002 | AD228: -4.5199999999999997e-002 | AE228: 86.99 | AF228: 89.54 | AG228: 0.76 | AH228: AA | AI228: 4.4299999999999999e-002 | AJ228: =H228+100*O228 -> 130.90000000000001 | AK228: 132 | AL228: 184 | AM228: 42.5 | AN228: 186 | AO228: 7.6999999999999999e-002 | AP228: 3 | AQ228: 运达转债
A229: 6 | B229: 113043 | C229: 财通转债 | D229: 601108 | E229: 财通证券 | F229: 金融 | G229: 证券行业 | H229: 118.93 | I229: -6.6e-003 | J229: 9.3999999999999986e-003 | K229: 12.5 | L229: 4.7999999999999996e-003 | M229: 110.2 | N229: 13.33 | O229: 0.26800000000000002 | P229: 93.77 | Q229: 5月9天 | R229: 5.92年 | S229: 无权 | T229: 38 | U229: 214 | V229: 4.7e-002 | W229: 8.5000000000000006e-002 | X229: 7.9000000000000001e-002 | Y229: 449 | Z229: 2.06 | AA229: -1.3000000000000001e-002 | AB229: -1.61e-002 | AC229: 无权 | AD229: 无权 | AE229: 无权 | AF229: 87.98 | AG229: 0.57 | AH229: AAA | AI229: 3.9300000000000002e-002 | AJ229: =H229+100*O229 -> 145.73000000000002 | AK229: 144.1 | AL229: 239 | AM229: 56.1 | AN229: 249 | AO229: 6.9999999999999993e-003 | AP229: 5 | AQ229: 财通转债
A230: 313 | B230: 123002 | C230: 国祯转债!! | D230: 300388 | E230: 节能国祯 | F230: 城市公用 | G230: 三废处理 | H230: 113.07 | I230: 9.5999999999999992e-003 | J230: 2.0799999999999999e-002 | K230: 9.07 | L230: 3.4200000000000001e-002 | M230: 108.8 | N230: 8.48 | O230: 5.7000000000000002e-002 | P230: 106.96 | Q230: 转股中 | R230: 2.88年 | S230: 0.88年 | T230: 2.52 | U230: 17 | V230: 5.9000000000000004e-002 | W230: 4.0000000000000001e-002 | X230: 4.2999999999999997e-002 | Y230: 63 | Z230: 1.67 | AA230: -1.3500000000000002e-002 | AB230: -1.9099999999999999e-002 | AC230: -9.8100000000000007e-002 | AD230: -0.10099999999999999 | AE230: 97.42 | AF230: 97.15 | AG230: 0.89 | AH230: AA | AI230: 4.07e-002 | AJ230: =H230+100*O230 -> 118.77 | AK230: 119.2 | AL230: 70 | AM230: 21.8 | AN230: 35 | AO230: 1.e-002 | AP230: 14 | AQ230: 国祯转债!!
A231: 36 | B231: 113605 | C231: 大参转债 | D231: 603233 | E231: 大参林 | F231: 医药 | G231: 医药商业 | H231: 124.5 | I231: -1.e-004 | J231: 7.000000000000001e-004 | K231: 78.34 | L231: 1.1999999999999999e-003 | M231: 115.2 | N231: 83.85 | O231: 0.33299999999999996 | P231: 93.43 | Q231: 3月20天 | R231: 5.79年 | S231: 3.79年 | T231: 14.1 | U231: 24 | V231: 1.3999999999999999e-002 | W231: 2.7000000000000003e-002 | X231: 2.5000000000000001e-002 | Y231: 516 | Z231: 10.3 | AA231: -1.3600000000000001e-002 | AB231: -1.8100000000000002e-002 | AC231: -4.5499999999999999e-002 | AD231: -4.7199999999999999e-002 | AE231: 87.5 | AF231: 90.05 | AG231: 0.56 | AH231: AA | AI231: 4.4299999999999999e-002 | AJ231: =H231+100*O231 -> 157.80000000000001 | AK231: 155.6 | AL231: 271 | AM231: 65.5 | AN231: 270 | AO231: -1.8000000000000002e-002 | AP231: 5 | AQ231: 大参转债
A232: 204 | B232: 128079 | C232: 英联转债! | D232: 2846 | E232: 英联股份 | F232: 造纸包装 | G232: 包装材料 | H232: 125.5 | I232: 1.3100000000000001e-002 | J232: -1.11e-002 | K232: 13.22 | L232: 4.3400000000000001e-002 | M232: 117.5 | N232: 13.41 | O232: 0.27300000000000002 | P232: 98.58 | Q232: 转股中 | R232: 4.78年 | S232: 2.78年 | T232: 1.53 | U232: 122 | V232: 0.629 | W232: 5.7999999999999996e-002 | X232: 5.7000000000000002e-002 | Y232: 26 | Z232: 3.43 | AA232: -1.3899999999999999e-002 | AB232: -2.0199999999999999e-002 | AC232: -6.3299999999999995e-002 | AD232: -6.54e-002 | AE232: 84.08 | AF232: 83.99 | AG232: 0.04 | AH232: A+ | AI232: 7.4299999999999991e-002 | AJ232: =H232+100*O232 -> 152.80000000000001 | AK232: 152.4 | AL232: 267 | AM232: 68.3 | AN232: 275 | AO232: -2.e-002 | AP232: 19 | AQ232: 英联转债!
A233: 86 | B233: 113593 | C233: 沪工转债 | D233: 603131 | E233: 上海沪工 | F233: 机械装备 | G233: 通用设备 | H233: 131.75 | I233: -6.93e-002 | J233: -1.6899999999999998e-002 | K233: 26.43 | L233: -0.10000000000000001 | M233: 121.6 | N233: 21.32 | O233: 6.3e-002 | P233: 123.97 | Q233: 17天 | R233: 5.53年 | S233: 3.53年 | T233: 4 | U233: 83 | V233: 0.154 | W233: 4.8000000000000001e-002 | X233: 5.9000000000000004e-002 | Y233: 84 | Z233: 6.82 | AA233: -1.47e-002 | AB233: -2.12e-002 | AC233: -6.1100000000000002e-002 | AD233: -6.3200000000000006e-002 | AE233: 79.96 | AF233: 81.75 | AG233: 0.86 | AH233: A+ | AI233: 7.6299999999999993e-002 | AJ233: =H233+100*O233 -> 138.05000000000001 | AK233: 139.5 | AL233: 217 | AM233: 57.8 | AN233: 259 | AO233: -5.5999999999999994e-002 | AP233: 9 | AQ233: 沪工转债
A234: 319 | B234: 113014 | C234: 林洋转债! | D234: 601222 | E234: 林洋能源 | F234: 能源电力 | G234: 电力设备 | H234: 113.99 | I234: -4.1799999999999997e-002 | J234: 1.4499999999999999e-002 | K234: 8.88 | L234: -4.41e-002 | M234: 109.3 | N234: 8.54 | O234: 9.6000000000000002e-002 | P234: 103.98 | Q234: 转股中 | R234: 2.80年 | S234: 0.80年 | T234: 30 | U234: 265 | V234: 7.5999999999999998e-002 | W234: 0.193 | X234: 0.20100000000000001 | Y234: 155 | Z234: 1.49 | AA234: -1.5100000000000001e-002 | AB234: -2.12e-002 | AC234: -0.111 | AD234: -0.115 | AE234: 97.96 | AF234: 97.93 | AG234: 0.62 | AH234: AA | AI234: 4.07e-002 | AJ234: =H234+100*O234 -> 123.58999999999999 | AK234: 124 | AL234: 120 | AM234: 26 | AN234: 75 | AO234: 0.14800000000000002 | AP234: 23 | AQ234: 林洋转债!
A235: 151 | B235: 123045 | C235: 雷迪转债 | D235: 300652 | E235: 雷迪克 | F235: 汽车 | G235: 零部件制 | H235: 129.082 | I235: -4.3799999999999999e-002 | J235: 6.4600000000000005e-002 | K235: 18.71 | L235: 3.2000000000000001e-002 | M235: 119.4 | N235: 20.13 | O235: 0.38900000000000001 | P235: 92.95 | Q235: 转股中 | R235: 5.17年 | S235: 3.17年 | T235: 1.66 | U235: 2017. | V235: 8.6899999999999995 | W235: 9.4e-002 | X235: 8.8000000000000009e-002 | Y235: 18 | Z235: 2.06 | AA235: -1.5300000000000001e-002 | AB235: -2.1600000000000001e-002 | AC235: -6.1900000000000004e-002 | AD235: -6.4199999999999993e-002 | AE235: 82.08 | AF235: 82.44 | AG235: 0.65 | AH235: A+ | AI235: 7.6299999999999993e-002 | AJ235: =H235+100*O235 -> 167.982 | AK235: 165.2 | AL235: 285 | AM235: 82.8 | AN235: 289 | AO235: -0.11699999999999999 | AP235: 36 | AQ235: 雷迪转债
A236: 55 | B236: 123064 | C236: 万孚转债! | D236: 300482 | E236: 万孚生物 | F236: 医药 | G236: 医疗器械 | H236: 125.9 | I236: -8.6999999999999994e-003 | J236: 1.4999999999999999e-002 | K236: 94.5 | L236: 1.e-002 | M236: 115.1 | N236: 93.55 | O236: 0.24600000000000002 | P236: 101.02 | Q236: 59天 | R236: 5.65年 | S236: 3.65年 | T236: 6 | U236: 10 | V236: 1.3000000000000001e-002 | W236: 1.9e-002 | X236: 1.9e-002 | Y236: 324 | Z236: 11.96 | AA236: -1.6e-002 | AB236: -2.07e-002 | AC236: -5.0199999999999995e-002 | AD236: -5.1900000000000002e-002 | AE236: 87.94 | AF236: 90.51 | AG236: 0.63 | AH236: AA | AI236: 4.4299999999999999e-002 | AJ236: =H236+100*O236 -> 150.5 | AK236: 150.8 | AL236: 262 | AM236: 60.3 | AN236: 264 | AO236: 0.11800000000000001 | AP236: 9 | AQ236: 万孚转债!
A237: 29 | B237: 110076 | C237: 华海转债 | D237: 600521 | E237: 华海药业 | F237: 医药 | G237: 医药行业 | H237: 126.23 | I237: 6.4000000000000003e-003 | J237: -5.1999999999999998e-003 | K237: 31.55 | L237: 2.2000000000000001e-003 | M237: 115.1 | N237: 34.66 | O237: 0.38700000000000001 | P237: 91.03 | Q237: 3月28天 | R237: 5.82年 | S237: 3.82年 | T237: 18.4 | U237: 14 | V237: 6.0000000000000001e-003 | W237: 4.0000000000000001e-002 | X237: 3.7000000000000005e-002 | Y237: 459 | Z237: 7.42 | AA237: -1.6e-002 | AB237: -2.0499999999999997e-002 | AC237: -4.87e-002 | AD237: -5.0300000000000004e-002 | AE237: 87.29 | AF237: 89.84 | AG237: 0.54 | AH237: AA | AI237: 4.4299999999999999e-002 | AJ237: =H237+100*O237 -> 164.93000000000001 | AK237: 161.4 | AL237: 279 | AM237: 71.6 | AN237: 279 | AO237: -5.2000000000000005e-002 | AP237: 5 | AQ237: 华海转债
A238: 115 | B238: 113585 | C238: 寿仙转债 | D238: 603896 | E238: 寿仙谷 | F238: 医药 | G238: 中药 | H238: 128.91 | I238: -7.6e-003 | J238: -5.4000000000000003e-003 | K238: 36.51 | L238: -1.4800000000000001e-002 | M238: 117.8 | N238: 28.68 | O238: 1.3000000000000001e-002 | P238: 127.3 | Q238: 转股中 | R238: 5.42年 | S238: 3.42年 | T238: 2.31 | U238: 17 | V238: 5.7999999999999996e-002 | W238: 4.2999999999999997e-002 | X238: 5.4000000000000006e-002 | Y238: 54 | Z238: 4.25 | AA238: -1.6799999999999999e-002 | AB238: -2.2400000000000003e-002 | AC238: -5.8499999999999996e-002 | AD238: -6.0400000000000002e-002 | AE238: 83.26 | AF238: 84.29 | AG238: 0.87 | AH238: AA- | AI238: 6.5299999999999997e-002 | AJ238: =H238+100*O238 -> 130.21000000000001 | AK238: 130.5 | AL238: 176 | AM238: 46.2 | AN238: 212 | AO238: -9.6999999999999989e-002 | AP238: 9 | AQ238: 寿仙转债
A239: 330 | B239: 110034 | C239: 九州转债! | D239: 600998 | E239: 九州通 | F239: 医药 | G239: 医药商业 | H239: 111.51 | I239: -9.300000000000001e-003 | J239: 4.3e-003 | K239: 17.76 | L239: -1.66e-002 | M239: 109.6 | N239: 18.32 | O239: 0.14999999999999999 | P239: 96.94 | Q239: 转股中 | R239: 1年7天 | S239: 回售中 | T239: 15 | U239: 18 | V239: 1.1000000000000001e-002 | W239: 4.4999999999999998e-002 | X239: 4.4000000000000004e-002 | Y239: 333 | Z239: 1.77 | AA239: -1.7000000000000001e-002 | AB239: -3.4099999999999998e-002 | AC239: 回售中 | AD239: 回售中 | AE239: 103 | AF239: 105.5 | AG239: 0.3 | AH239: AA+ | AI239: 3.8699999999999998e-002 | AJ239: =H239+100*O239 -> 126.51000000000001 | AK239: 126.1 | AL239: 139 | AM239: 20.6 | AN239: 28 | AO239: 1.2e-002 | AP239: 27 | AQ239: 九州转债!
A240: 297 | B240: 110043 | C240: 无锡转债! | D240: 600908 | E240: 无锡银行 | F240: 金融 | G240: 银行行业 | H240: 114.96 | I240: -4.0000000000000002e-004 | J240: -5.0000000000000001e-004 | K240: 5.73 | L240: -1.7000000000000001e-003 | M240: 109.1 | N240: 5.79 | O240: 0.16200000000000001 | P240: 98.96 | Q240: 转股中 | R240: 3年22天 | S240: 无权 | T240: 30 | U240: 22 | V240: 6.0000000000000001e-003 | W240: 0.28300000000000003 | X240: 0.28000000000000003 | Y240: 106 | Z240: 0.93 | AA240: -1.72e-002 | AB240: -2.2599999999999999e-002 | AC240: 无权 | AD240: 无权 | AE240: 无权 | AF240: 96.88 | AG240: 0.54 | AH240: AA+ | AI240: 4.0300000000000002e-002 | AJ240: =H240+100*O240 -> 131.16 | AK240: 131 | AL240: 181 | AM240: 34.1 | AN240: 140 | AO240: -1.6e-002 | AP240: 30 | AQ240: 无锡转债!
A241: 154 | B241: 123044 | C241: 红相转债! | D241: 300427 | E241: 红相股份 | F241: 能源电力 | G241: 电力设备 | H241: 137.634 | I241: -3.4099999999999998e-002 | J241: 1.15e-002 | K241: 22.24 | L241: -2.92e-002 | M241: 125.5 | N241: 18.8 | O241: 0.16300000000000001 | P241: 118.3 | Q241: 转股中 | R241: 5.17年 | S241: 3.17年 | T241: 5.5 | U241: 41 | V241: 5.2999999999999999e-002 | W241: 6.9000000000000006e-002 | X241: 8.1000000000000003e-002 | Y241: 80 | Z241: 3.51 | AA241: -1.8100000000000002e-002 | AB241: -2.6000000000000002e-002 | AC241: -7.8799999999999995e-002 | AD241: -8.1300000000000011e-002 | AE241: 85.28 | AF241: 91.29 | AG241: 0.77 | AH241: AA- | AI241: 6.5299999999999997e-002 | AJ241: =H241+100*O241 -> 153.934 | AK241: 157 | AL241: 273 | AM241: 65.7 | AN241: 271 | AO241: -7.8e-002 | AP241: 16 | AQ241: 红相转债!
A242: 270 | B242: 128048 | C242: 张行转债 | D242: 2839 | E242: 张家港行 | F242: 金融 | G242: 银行行业 | H242: 121.448 | I242: 1.1999999999999999e-003 | J242: -5.1000000000000004e-003 | K242: 5.87 | L242: -6.8000000000000005e-003 | M242: 113.3 | N242: 5.76 | O242: 0.192 | P242: 101.91 | Q242: 转股中 | R242: 3.84年 | S242: 无权 | T242: 25 | U242: 18 | V242: 6.0000000000000001e-003 | W242: 0.23499999999999999 | X242: 0.23999999999999999 | Y242: 106 | Z242: 1.01 | AA242: -1.8200000000000001e-002 | AB242: -2.4300000000000002e-002 | AC242: 无权 | AD242: 无权 | AE242: 无权 | AF242: 97.6 | AG242: 0.57 | AH242: AA+ | AI242: 4.0300000000000002e-002 | AJ242: =H242+100*O242 -> 140.648 | AK242: 141 | AL242: 223 | AM242: 43.4 | AN242: 191 | AO242: -2.3e-002 | AP242: 14 | AQ242: 张行转债
A243: 255 | B243: 110051 | C243: 中天转债! | D243: 600522 | E243: 中天科技 | F243: 通信互联 | G243: 通信设备 | H243: 122.77 | I243: 1.46e-002 | J243: 2.7099999999999999e-002 | K243: 11.3 | L243: 5.9999999999999998e-002 | M243: 113.9 | N243: 10.09 | O243: 9.6000000000000002e-002 | P243: 111.99 | Q243: 转股中 | R243: 4年51天 | S243: 2年51天 | T243: 39.6 | U243: 101 | V243: 2.1000000000000001e-002 | W243: 0.114 | X243: 0.128 | Y243: 346 | Z243: 1.58 | AA243: -1.83e-002 | AB243: -2.4199999999999999e-002 | AC243: -7.2499999999999995e-002 | AD243: -7.4999999999999997e-002 | AE243: 94.5 | AF243: 97.06 | AG243: 0.69 | AH243: AA+ | AI243: 4.0300000000000002e-002 | AJ243: =H243+100*O243 -> 132.37 | AK243: 133.5 | AL243: 193 | AM243: 36.5 | AN243: 153 | AO243: 5.5999999999999994e-002 | AP243: 27 | AQ243: 中天转债!
A244: 166 | B244: 128097 | C244: 奥佳转债! | D244: 2614 | E244: 奥佳华 | F244: 机械装备 | G244: 专用设备 | H244: 127.399 | I244: -1.77e-002 | J244: -2.0899999999999998e-002 | K244: 12.28 | L244: -5.2499999999999998e-002 | M244: 115.3 | N244: 10.69 | O244: 0.109 | P244: 114.87 | Q244: 转股中 | R244: 5年48天 | S244: 3年48天 | T244: 5.85 | U244: 14 | V244: 1.8000000000000002e-002 | W244: 7.6999999999999999e-002 | X244: 8.8000000000000009e-002 | Y244: 76 | Z244: 1.79 | AA244: -1.9599999999999999e-002 | AB244: -2.4799999999999999e-002 | AC244: -6.0899999999999996e-002 | AD244: -6.2800000000000009e-002 | AE244: 90.13 | AF244: 92.75 | AG244: 0.74 | AH244: AA | AI244: 4.4299999999999999e-002 | AJ244: =H244+100*O244 -> 138.29900000000001 | AK244: 139.9 | AL244: 220 | AM244: 47.2 | AN244: 217 | AO244: -8.3000000000000004e-002 | AP244: 25 | AQ244: 奥佳转债!
A245: 196 | B245: 110061 | C245: 川投转债 | D245: 600674 | E245: 川投能源 | F245: 能源电力 | G245: 水电 | H245: 122.31 | I245: 1.e-002 | J245: -1.06e-002 | K245: 10 | L245: -1.e-003 | M245: 110.8 | N245: 9.58 | O245: 0.17199999999999999 | P245: 104.38 | Q245: 转股中 | R245: 4.84年 | S245: 2.84年 | T245: 40 | U245: 13 | V245: 3.0000000000000001e-003 | W245: 9.0999999999999998e-002 | X245: 9.5000000000000001e-002 | Y245: 440 | Z245: 1.59 | AA245: -2.06e-002 | AB245: -2.4500000000000001e-002 | AC245: -5.5e-002 | AD245: -5.7000000000000002e-002 | AE245: 92.61 | AF245: 93.11 | AG245: 0.65 | AH245: AAA | AI245: 3.73e-002 | AJ245: =H245+100*O245 -> 139.50999999999999 | AK245: 140.2 | AL245: 221 | AM245: 47.1 | AN245: 216 | AO245: -2.e-003 | AP245: 16 | AQ245: 川投转债
A246: 48 | B246: 113603 | C246: 东缆转债 | D246: 603606 | E246: 东方电缆 | F246: 能源电力 | G246: 电力设备 | H246: 129.6 | I246: -4.0000000000000002e-004 | J246: -1.2e-002 | K246: 25.92 | L246: -1.78e-002 | M246: 115.1 | N246: 23.88 | O246: 0.19399999999999998 | P246: 108.54 | Q246: 2月21天 | R246: 5.71年 | S246: 3.71年 | T246: 8 | U246: 16 | V246: 1.4999999999999999e-002 | W246: 4.7e-002 | X246: 5.0999999999999997e-002 | Y246: 170 | Z246: 6.26 | AA246: -2.0899999999999998e-002 | AB246: -2.5399999999999999e-002 | AC246: -5.6500000000000002e-002 | AD246: -5.8200000000000002e-002 | AE246: 87.7 | AF246: 90.26 | AG246: 0.7 | AH246: AA | AI246: 4.4299999999999999e-002 | AJ246: =H246+100*O246 -> 149. | AK246: 150.7 | AL246: 261 | AM246: 60.4 | AN246: 265 | AO246: 8.0000000000000002e-002 | AP246: 6 | AQ246: 东缆转债
A247: 224 | B247: 113537 | C247: 文灿转债!! | D247: 603348 | E247: 文灿股份 | F247: 汽车 | G247: 零部件制 | H247: 133.19 | I247: -3.4000000000000002e-003 | J247: 3.0000000000000001e-003 | K247: 25.62 | L247: -4.0000000000000002e-004 | M247: 121.5 | N247: 19.43 | O247: 1.e-002 | P247: 131.86 | Q247: 转股中 | R247: 4.42年 | S247: 2.42年 | T247: 1.94 | U247: 124 | V247: 0.47700000000000004 | W247: 2.8999999999999998e-002 | X247: 3.9e-002 | Y247: 66 | Z247: 2.63 | AA247: -2.1099999999999997e-002 | AB247: -2.9100000000000001e-002 | AC247: -9.0899999999999995e-002 | AD247: -9.3699999999999992e-002 | AE247: 89.28 | AF247: 93.29 | AG247: 0.85 | AH247: AA- | AI247: 6.3299999999999995e-002 | AJ247: =H247+100*O247 -> 134.19 | AK247: 134.5 | AL247: 199 | AM247: 41.2 | AN247: 178 | AO247: -0.10099999999999999 | AP247: 26 | AQ247: 文灿转债!!
A248: 289 | B248: 113508 | C248: 新凤转债! | D248: 603225 | E248: 新凤鸣 | F248: 服装纺织 | G248: 纺织行业 | H248: 120.45 | I248: 6.3e-003 | J248: 1.9299999999999998e-002 | K248: 15.39 | L248: 4.9100000000000005e-002 | M248: 112.3 | N248: 15.78 | O248: 0.23499999999999999 | P248: 97.53 | Q248: 转股中 | R248: 3.30年 | S248: 1.30年 | T248: 21.5 | U248: 61 | V248: 2.3e-002 | W248: 0.10000000000000001 | X248: 9.8000000000000004e-002 | Y248: 215 | Z248: 1.9 | AA248: -2.1499999999999998e-002 | AB248: -2.7999999999999997e-002 | AC248: -0.10400000000000001 | AD248: -0.107 | AE248: 96.81 | AF248: 98.25 | AG248: 0.52 | AH248: AA | AI248: 4.2300000000000004e-002 | AJ248: =H248+100*O248 -> 143.94999999999999 | AK248: 143.4 | AL248: 234 | AM248: 45.1 | AN248: 203 | AO248: 0.159 | AP248: 26 | AQ248: 新凤转债!
A249: 137 | B249: 123048 | C249: 应急转债! | D249: 300527 | E249: 中船应急 | F249: 机械装备 | G249: 专用设备 | H249: 126.49 | I249: -2.7000000000000003e-002 | J249: 1.15e-002 | K249: 9.75 | L249: -2.2099999999999998e-002 | M249: 113.1 | N249: 8.9 | O249: 0.155 | P249: 109.55 | Q249: 转股中 | R249: 5.25年 | S249: 3.25年 | T249: 3.8 | U249: 126 | V249: 0.253 | W249: 4.0000000000000001e-002 | X249: 4.4000000000000004e-002 | Y249: 94 | Z249: 3.77 | AA249: -2.1499999999999998e-002 | AB249: -2.58e-002 | AC249: -5.7200000000000001e-002 | AD249: -5.9000000000000004e-002 | AE249: 90.04 | AF249: 91.37 | AG249: 0.7 | AH249: AA+ | AI249: 4.2300000000000004e-002 | AJ249: =H249+100*O249 -> 141.99000000000001 | AK249: 143.4 | AL249: 236 | AM249: 52.1 | AN249: 240 | AO249: -4.2999999999999997e-002 | AP249: 16 | AQ249: 应急转债!
A250: 175 | B250: 128091 | C250: 新天转债 | D250: 2873 | E250: 新天药业 | F250: 医药 | G250: 中药 | H250: 133.02 | I250: 3.9000000000000003e-003 | J250: 8.9999999999999998e-004 | K250: 15.9 | L250: 6.9999999999999993e-003 | M250: 119.4 | N250: 16.39 | O250: 0.371 | P250: 97.01 | Q250: 转股中 | R250: 4.98年 | S250: 2.98年 | T250: 1.76 | U250: 156 | V250: 0.66400000000000003 | W250: 9.4e-002 | X250: 9.1999999999999998e-002 | Y250: 19 | Z250: 2.47 | AA250: -2.1899999999999999e-002 | AB250: -2.8399999999999998e-002 | AC250: -7.4700000000000003e-002 | AD250: -7.7100000000000002e-002 | AE250: 83.64 | AF250: 84.32 | AG250: 0.69 | AH250: A+ | AI250: 7.4299999999999991e-002 | AJ250: =H250+100*O250 -> 170.12 | AK250: 169 | AL250: 288 | AM250: 84.7 | AN250: 290 | AO250: -4.4000000000000004e-002 | AP250: 17 | AQ250: 新天转债
A251: 124 | B251: 128108 | C251: 蓝帆转债 | D251: 2382 | E251: 蓝帆医疗 | F251: 医药 | G251: 医疗器械 | H251: 127.5 | I251: 3.3799999999999997e-002 | J251: 2.2099999999999998e-002 | K251: 22.81 | L251: 6.7400000000000002e-002 | M251: 113.3 | N251: 17.79 | O251: -6.0000000000000001e-003 | P251: 128.22 | Q251: 转股中 | R251: 5.38年 | S251: 4.38年 | T251: 28.4 | U251: 1218. | V251: 0.33500000000000002 | W251: 0.127 | X251: 0.16300000000000001 | Y251: 224 | Z251: 2.3 | AA251: -2.2099999999999998e-002 | AB251: -2.64e-002 | AC251: -4.1100000000000005e-002 | AD251: -4.3299999999999998e-002 | AE251: 87.01 | AF251: 90.16 | AG251: 0.83 | AH251: AA | AI251: 4.4299999999999999e-002 | AJ251: =H251+100*O251 -> 126.90000000000001 | AK251: 126.8 | AL251: 147 | AM251: 36.6 | AN251: 154 | AO251: 4.8000000000000001e-002 | AP251: 25 | AQ251: 蓝帆转债
A252: 45 | B252: 110075 | C252: 南航转债 | D252: 600029 | E252: 南方航空 | F252: 交通运输 | G252: 航空运输 | H252: 125.1 | I252: 7.000000000000001e-004 | J252: 5.0000000000000001e-003 | K252: 5.71 | L252: 1.06e-002 | M252: 110 | N252: 6.24 | O252: 0.36700000000000005 | P252: 91.51 | Q252: 3月13天 | R252: 5.77年 | S252: 3.77年 | T252: 160 | U252: 65 | V252: 3.0000000000000001e-003 | W252: 0.183 | X252: 0.16699999999999998 | Y252: 875 | Z252: 1.21 | AA252: -2.23e-002 | AB252: -2.5399999999999999e-002 | AC252: -5.0199999999999995e-002 | AD252: -5.1200000000000002e-002 | AE252: 87.93 | AF252: 88.31 | AG252: 0.54 | AH252: AAA | AI252: 3.9300000000000002e-002 | AJ252: =H252+100*O252 -> 161.80000000000001 | AK252: 158.7 | AL252: 274 | AM252: 70.4 | AN252: 277 | AO252: -3.5000000000000003e-002 | AP252: 8 | AQ252: 南航转债
A253: 40 | B253: 123070 | C253: 鹏辉转债 | D253: 300438 | E253: 鹏辉能源 | F253: 汽车 | G253: 零部件制 | H253: 131.01 | I253: -3.1699999999999999e-002 | J253: -1.6000000000000001e-003 | K253: 23.06 | L253: -4.3899999999999995e-002 | M253: 115.1 | N253: 20.16 | O253: 0.14499999999999999 | P253: 114.38 | Q253: 3月18天 | R253: 5.78年 | S253: 3.78年 | T253: 8.9 | U253: 192 | V253: 0.16500000000000001 | W253: 9.1999999999999998e-002 | X253: 0.105 | Y253: 97 | Z253: 3.92 | AA253: -2.2499999999999999e-002 | AB253: -2.7000000000000003e-002 | AC253: -5.8099999999999999e-002 | AD253: -5.9699999999999996e-002 | AE253: 87.43 | AF253: 89.98 | AG253: 0.76 | AH253: AA | AI253: 4.4299999999999999e-002 | AJ253: =H253+100*O253 -> 145.50999999999999 | AK253: 147.6 | AL253: 251 | AM253: 57.7 | AN253: 258 | AO253: -0.10400000000000001 | AP253: 4 | AQ253: 鹏辉转债
A254: 193 | B254: 113550 | C254: 常汽转债! | D254: 603035 | E254: 常熟汽饰 | F254: 汽车 | G254: 零部件制 | H254: 135.61 | I254: -2.5000000000000001e-002 | J254: -2.0000000000000001e-004 | K254: 13.01 | L254: -2.9100000000000001e-002 | M254: 121.3 | N254: 9.65 | O254: 6.0000000000000001e-003 | P254: 134.82 | Q254: 转股中 | R254: 4.86年 | S254: 2.86年 | T254: 3.82 | U254: 78 | V254: 0.151 | W254: 8.5999999999999993e-002 | X254: 0.115 | Y254: 45 | Z254: 1.3 | AA254: -2.3199999999999998e-002 | AB254: -3.04e-002 | AC254: -8.4100000000000008e-002 | AD254: -8.6400000000000005e-002 | AE254: 86.73 | AF254: 90.64 | AG254: 0.87 | AH254: AA- | AI254: 6.3299999999999995e-002 | AJ254: =H254+100*O254 -> 136.21000000000001 | AK254: 136.4 | AL254: 205 | AM254: 45.8 | AN254: 208 | AO254: -5.5e-002 | AP254: 16 | AQ254: 常汽转债!
A255: 107 | B255: 123055 | C255: 晨光转债 | D255: 300138 | E255: 晨光生物 | F255: 食品饮料 | G255: 食品加工 | H255: 141.499 | I255: -1.04e-002 | J255: 1.3000000000000001e-002 | K255: 17.22 | L255: 2.8999999999999998e-003 | M255: 124.3 | N255: 12.25 | O255: 6.9999999999999993e-003 | P255: 140.57 | Q255: 转股中 | R255: 5.44年 | S255: 3.44年 | T255: 5.09 | U255: 76 | V255: 0.106 | W255: 5.7000000000000002e-002 | X255: 8.0000000000000002e-002 | Y255: 90 | Z255: 4.58 | AA255: -2.4e-002 | AB255: -3.1200000000000002e-002 | AC255: -8.2200000000000009e-002 | AD255: -8.4100000000000008e-002 | AE255: 83.21 | AF255: 88.81 | AG255: 0.89 | AH255: AA- | AI255: 6.5299999999999997e-002 | AJ255: =H255+100*O255 -> 142.19899999999998 | AK255: 142.4 | AL255: 230 | AM255: 53.6 | AN255: 244 | AO255: -4.4999999999999998e-002 | AP255: 9 | AQ255: 晨光转债
A256: 240 | B256: 123025 | C256: 精测转债!! | D256: 300567 | E256: 精测电子 | F256: 电子 | G256: 液晶显示 | H256: 130.221 | I256: -2.8999999999999998e-003 | J256: -2.0199999999999999e-002 | K256: 50.53 | L256: -3.5699999999999996e-002 | M256: 117.3 | N256: 49.95 | O256: 0.28699999999999998 | P256: 101.16 | Q256: 转股中 | R256: 4.22年 | S256: 2.22年 | T256: 3.09 | U256: 14 | V256: 3.4000000000000002e-002 | W256: 2.5000000000000001e-002 | X256: 2.5000000000000001e-002 | Y256: 125 | Z256: 8.03 | AA256: -2.5000000000000001e-002 | AB256: -3.1899999999999998e-002 | AC256: -9.2300000000000007e-002 | AD256: -9.4800000000000009e-002 | AE256: 89.69 | AF256: 91.1 | AG256: 0.65 | AH256: AA- | AI256: 6.3299999999999995e-002 | AJ256: =H256+100*O256 -> 158.92099999999999 | AK256: 159.3 | AL256: 275 | AM256: 68.2 | AN256: 274 | AO256: -2.e-002 | AP256: 18 | AQ256: 精测转债!!
A257: 76 | B257: 123062 | C257: 三超转债 | D257: 300554 | E257: 三超新材 | F257: 机械装备 | G257: 通用设备 | H257: 141 | I257: 2.5499999999999998e-002 | J257: 8.9999999999999998e-004 | K257: 23.8 | L257: 2.8500000000000001e-002 | M257: 119.7 | N257: 17.17 | O257: 1.7000000000000001e-002 | P257: 138.61 | Q257: 24天 | R257: 5.55年 | S257: 3.55年 | T257: 1.95 | U257: 222 | V257: 0.81400000000000006 | W257: 8.8000000000000009e-002 | X257: 0.121 | Y257: 22 | Z257: 4.27 | AA257: -2.9700000000000001e-002 | AB257: -3.5499999999999997e-002 | AC257: -7.8e-002 | AD257: -8.0000000000000002e-002 | AE257: 77.21 | AF257: 76.48 | AG257: 0.92 | AH257: A | AI257: 8.6300000000000002e-002 | AJ257: =H257+100*O257 -> 142.69999999999999 | AK257: 143.4 | AL257: 235 | AM257: 66.2 | AN257: 272 | AO257: 9.3000000000000013e-002 | AP257: 14 | AQ257: 三超转债
A258: 180 | B258: 110065 | C258: 淮矿转债! | D258: 600985 | E258: 淮北矿业 | F258: 煤炭 | G258: 煤炭开采 | H258: 128.39 | I258: 7.000000000000001e-004 | J258: 1.78e-002 | K258: 12.05 | L258: 2.2099999999999998e-002 | M258: 110.8 | N258: 9.33 | O258: -6.0000000000000001e-003 | P258: 129.15 | Q258: 转股中 | R258: 4.96年 | S258: 2.96年 | T258: 27.6 | U258: 174 | V258: 4.9000000000000002e-002 | W258: 0.105 | X258: 0.13600000000000001 | Y258: 262 | Z258: 1.27 | AA258: -2.98e-002 | AB258: -3.3599999999999998e-002 | AC258: -6.7699999999999996e-002 | AD258: -6.9599999999999995e-002 | AE258: 92.22 | AF258: 92.71 | AG258: 0.84 | AH258: AAA | AI258: 3.73e-002 | AJ258: =H258+100*O258 -> 127.78999999999999 | AK258: 127.6 | AL258: 153 | AM258: 34.9 | AN258: 145 | AO258: 6.8000000000000005e-002 | AP258: 21 | AQ258: 淮矿转债!
A259: 27 | B259: 128136 | C259: 立讯转债 | D259: 2475 | E259: 立讯精密 | F259: 电子 | G259: 元器件制 | H259: 133.3 | I259: 1.21e-002 | J259: 4.8999999999999998e-003 | K259: 60.01 | L259: 2.58e-002 | M259: 111.9 | N259: 58.48 | O259: 0.29899999999999999 | P259: 102.62 | Q259: 4月1天 | R259: 5.82年 | S259: 3.82年 | T259: 30 | U259: 204 | V259: 5.0999999999999997e-002 | W259: 6.9999999999999993e-003 | X259: 6.9999999999999993e-003 | Y259: 4211. | Z259: 16.84 | AA259: -2.9900000000000003e-002 | AB259: -3.3500000000000002e-002 | AC259: -6.4199999999999993e-002 | AD259: -6.5199999999999994e-002 | AE259: 86.85 | AF259: 88.16 | AG259: 0.66 | AH259: AA+ | AI259: 4.2300000000000004e-002 | AJ259: =H259+100*O259 -> 163.20000000000002 | AK259: 164 | AL259: 284 | AM259: 75.8 | AN259: 284 | AO259: 0.11199999999999999 | AP259: 8 | AQ259: 立讯转债
A260: 92 | B260: 128119 | C260: 龙大转债 | D260: 2726 | E260: 龙大肉食 | F260: 食品饮料 | G260: 肉制品 | H260: 141.8 | I260: -2.06e-002 | J260: 4.0999999999999995e-003 | K260: 13.15 | L260: -1.9400000000000001e-002 | M260: 120.2 | N260: 9.57 | O260: 3.2000000000000001e-002 | P260: 137.41 | Q260: 9天 | R260: 5.51年 | S260: 3.51年 | T260: 9.5 | U260: 26 | V260: 1.9e-002 | W260: 7.2999999999999995e-002 | X260: 0.10000000000000001 | Y260: 131 | Z260: 4.25 | AA260: -2.9999999999999999e-002 | AB260: -3.6000000000000004e-002 | AC260: -8.2200000000000009e-002 | AD260: -8.3900000000000002e-002 | AE260: 88.56 | AF260: 95.08 | AG260: 0.85 | AH260: AA | AI260: 4.4299999999999999e-002 | AJ260: =H260+100*O260 -> 145. | AK260: 146.2 | AL260: 244 | AM260: 51.1 | AN260: 235 | AO260: -3.0000000000000001e-003 | AP260: 7 | AQ260: 龙大转债
A261: 141 | B261: 113575 | C261: 东时转债! | D261: 603377 | E261: 东方时尚 | F261: 其他 | G261: 其他 | H261: 133.25 | I261: -5.0900000000000001e-002 | J261: 3.2199999999999999e-002 | K261: 19.23 | L261: -2.1899999999999999e-002 | M261: 113.5 | N261: 14.56 | O261: 9.0000000000000011e-003 | P261: 132.07 | Q261: 转股中 | R261: 5.25年 | S261: 3.25年 | T261: 0.99 | U261: 35 | V261: 0.25800000000000001 | W261: 8.0000000000000002e-003 | X261: 1.1000000000000001e-002 | Y261: 117 | Z261: 6.02 | AA261: -3.0699999999999998e-002 | AB261: -3.5099999999999999e-002 | AC261: -7.1099999999999997e-002 | AD261: -7.2999999999999995e-002 | AE261: 89.69 | AF261: 90.85 | AG261: 0.86 | AH261: AA | AI261: 4.4299999999999999e-002 | AJ261: =H261+100*O261 -> 134.15000000000001 | AK261: 134.4 | AL261: 198 | AM261: 43.6 | AN261: 193 | AO261: 1.3999999999999999e-002 | AP261: 16 | AQ261: 东时转债!
A262: 149 | B262: 123046 | C262: 天铁转债! | D262: 300587 | E262: 天铁股份 | F262: 铁路 | G262: 铁路设备 | H262: 139 | I262: 0. | J262: 3.2099999999999997e-002 | K262: 11.7 | L262: 4.0000000000000001e-002 | M262: 118.2 | N262: 10.12 | O262: 0.20199999999999999 | P262: 115.61 | Q262: 转股中 | R262: 5.19年 | S262: 3.19年 | T262: 0.99 | U262: 32 | V262: 0.22699999999999998 | W262: 2.5000000000000001e-002 | X262: 2.8999999999999998e-002 | Y262: 40 | Z262: 2.87 | AA262: -3.1400000000000004e-002 | AB262: -3.7200000000000004e-002 | AC262: -8.3299999999999999e-002 | AD262: -8.5299999999999987e-002 | AE262: 84.42 | AF262: 85.79 | AG262: 0.8 | AH262: AA- | AI262: 6.5299999999999997e-002 | AJ262: =H262+100*O262 -> 159.19999999999999 | AK262: 162.4 | AL262: 280 | AM262: 76.6 | AN262: 286 | AO262: -0.157 | AP262: 11 | AQ262: 天铁转债!
A263: 110 | B263: 113587 | C263: 泛微转债 | D263: 603039 | E263: 泛微网络 | F263: 计算机及 | G263: 软件开发 | H263: 147.51 | I263: -2.69e-002 | J263: 8.0000000000000004e-004 | K263: 94 | L263: -2.8999999999999998e-002 | M263: 124.3 | N263: 64.33 | O263: 1.e-002 | P263: 146.12 | Q263: 转股中 | R263: 5.43年 | S263: 3.43年 | T263: 2.04 | U263: 14 | V263: 4.4999999999999998e-002 | W263: 1.e-002 | X263: 1.4999999999999999e-002 | Y263: 201 | Z263: 20.7 | AA263: -3.1600000000000003e-002 | AB263: -3.8699999999999998e-002 | AC263: -9.3000000000000013e-002 | AD263: -9.4800000000000009e-002 | AE263: 83.24 | AF263: 88.84 | AG263: 0.9 | AH263: AA- | AI263: 6.5299999999999997e-002 | AJ263: =H263+100*O263 -> 148.50999999999999 | AK263: 148.9 | AL263: 256 | AM263: 60.1 | AN263: 263 | AO263: -2.1000000000000001e-002 | AP263: 7 | AQ263: 泛微转债
A264: 123 | B264: 113583 | C264: 益丰转债 | D264: 603939 | E264: 益丰药房 | F264: 医药 | G264: 医药商业 | H264: 137.41 | I264: -8.6999999999999994e-003 | J264: 9.300000000000001e-003 | K264: 90.16 | L264: 8.0000000000000004e-004 | M264: 115.3 | N264: 71.82 | O264: 9.5000000000000001e-002 | P264: 125.54 | Q264: 转股中 | R264: 5.39年 | S264: 3.39年 | T264: 15.5 | U264: 14 | V264: 6.9999999999999993e-003 | W264: 3.2000000000000001e-002 | X264: 4.0999999999999995e-002 | Y264: 479 | Z264: 9.51 | AA264: -3.2599999999999997e-002 | AB264: -3.7400000000000003e-002 | AC264: -7.6399999999999996e-002 | AD264: -7.8200000000000006e-002 | AE264: 89.1 | AF264: 91.7 | AG264: 0.82 | AH264: AA | AI264: 4.4299999999999999e-002 | AJ264: =H264+100*O264 -> 146.91 | AK264: 149.3 | AL264: 257 | AM264: 57.6 | AN264: 256 | AO264: -1.8000000000000002e-002 | AP264: 9 | AQ264: 益丰转债
A265: 33 | B265: 123074 | C265: 隆利转债 | D265: 300752 | E265: 隆利科技 | F265: 电子 | G265: 液晶显示 | H265: 150.219 | I265: -3.8900000000000004e-002 | J265: 8.0199999999999994e-002 | K265: 52.7 | L265: 4.36e-002 | M265: 124 | N265: 29.41 | O265: -0.16200000000000001 | P265: 179.19 | Q265: 3月26天 | R265: 5.81年 | S265: 3.81年 | T265: 3.25 | U265: 2041. | V265: 3.8999999999999999 | W265: 5.0999999999999997e-002 | X265: 9.1999999999999998e-002 | Y265: 64 | Z265: 7.29 | AA265: -3.3000000000000002e-002 | AB265: -3.9599999999999996e-002 | AC265: -8.929999999999999e-002 | AD265: -9.0899999999999995e-002 | AE265: 81.02 | AF265: 86.49 | AG265: 0.95 | AH265: AA- | AI265: 6.5299999999999997e-002 | AJ265: =H265+100*O265 -> 134.01900000000001 | AK265: 121.2 | AL265: 92 | AM265: 34.8 | AN265: 144 | AO265: 0.20800000000000002 | AP265: 10 | AQ265: 隆利转债
A266: 205 | B266: 128078 | C266: 太极转债! | D266: 2368 | E266: 太极股份 | F266: 计算机及 | G266: 软件开发 | H266: 136.99 | I266: 1.32e-002 | J266: -4.5000000000000005e-003 | K266: 28.79 | L266: 8.8000000000000005e-003 | M266: 116.9 | N266: 22.4 | O266: 6.6000000000000003e-002 | P266: 128.53 | Q266: 转股中 | R266: 4.78年 | S266: 2.78年 | T266: 9.6 | U266: 17 | V266: 1.3000000000000001e-002 | W266: 5.7999999999999996e-002 | X266: 7.400000000000001e-002 | Y266: 167 | Z266: 5.43 | AA266: -3.32e-002 | AB266: -3.9100000000000003e-002 | AC266: -9.1700000000000004e-002 | AD266: -9.3599999999999989e-002 | AE266: 91.61 | AF266: 96.24 | AG266: 1 | AH266: AA | AI266: 4.2300000000000004e-002 | AJ266: =H266+100*O266 -> 143.59 | AK266: 145.5 | AL266: 242 | AM266: 49.2 | AN266: 225 | AO266: 4.7e-002 | AP266: 12 | AQ266: 太极转债!
A267: 172 | B267: 127015 | C267: 希望转债! | D267: 876 | E267: 新 希 望 | F267: 农业 | G267: 畜牧业 | H267: 129.99 | I267: -4.9100000000000005e-002 | J267: 3.2000000000000002e-003 | K267: 24.54 | L267: -4.5899999999999996e-002 | M267: 110 | N267: 19.75 | O267: 4.5999999999999999e-002 | P267: 124.25 | Q267: 转股中 | R267: 4.99年 | S267: 2.99年 | T267: 9.5 | U267: 86 | V267: 6.8000000000000005e-002 | W267: 9.0000000000000011e-003 | X267: 1.1000000000000001e-002 | Y267: 1106. | Z267: 3.05 | AA267: -3.3399999999999999e-002 | AB267: -3.6900000000000002e-002 | AC267: -7.2499999999999995e-002 | AD267: -7.400000000000001e-002 | AE267: 91.54 | AF267: 91.89 | AG267: 1 | AH267: AAA | AI267: 3.73e-002 | AJ267: =H267+100*O267 -> 134.59 | AK267: 135.7 | AL267: 203 | AM267: 43.8 | AN267: 194 | AO267: 5.9999999999999998e-002 | AP267: 29 | AQ267: 希望转债!
A268: 296 | B268: 128035 | C268: 大族转债! | D268: 2008 | E268: 大族激光 | F268: 机械装备 | G268: 专用设备 | H268: 119.805 | I268: 1.44e-002 | J268: -1.1000000000000001e-002 | K268: 47.4 | L268: 8.5000000000000006e-003 | M268: 108 | N268: 52.1 | O268: 0.317 | P268: 90.98 | Q268: 转股中 | R268: 3年29天 | S268: 1年29天 | T268: 23 | U268: 84 | V268: 3.1e-002 | W268: 4.4999999999999998e-002 | X268: 4.0999999999999995e-002 | Y268: 506 | Z268: 5.51 | AA268: -3.3599999999999998e-002 | AB268: -3.8199999999999998e-002 | AC268: -0.10000000000000001 | AD268: -0.106 | AE268: 99.42 | AF268: 95.81 | AG268: 0.41 | AH268: AA+ | AI268: 4.0300000000000002e-002 | AJ268: =H268+100*O268 -> 151.505 | AK268: 148.6 | AL268: 255 | AM268: 49.2 | AN268: 226 | AO268: 0.16899999999999998 | AP268: 21 | AQ268: 大族转债!
A269: 143 | B269: 110069 | C269: 瀚蓝转债 | D269: 600323 | E269: 瀚蓝环境 | F269: 城市公用 | G269: 三废处理 | H269: 136.06 | I269: 4.0999999999999995e-003 | J269: -2.5000000000000001e-003 | K269: 24.25 | L269: 2.0999999999999999e-003 | M269: 113.5 | N269: 20.2 | O269: 0.13300000000000001 | P269: 120.05 | Q269: 转股中 | R269: 5.24年 | S269: 3.24年 | T269: 9.83 | U269: 1.3 | V269: 1.e-003 | W269: 5.2999999999999999e-002 | X269: 6.3e-002 | Y269: 186 | Z269: 2.59 | AA269: -3.44e-002 | AB269: -3.8800000000000001e-002 | AC269: -8.0799999999999997e-002 | AD269: -8.1900000000000001e-002 | AE269: 88.85 | AF269: 91.59 | AG269: 0.79 | AH269: AA+ | AI269: 4.2300000000000004e-002 | AJ269: =H269+100*O269 -> 149.36000000000001 | AK269: 152.1 | AL269: 266 | AM269: 60.5 | AN269: 266 | AO269: 2.9999999999999999e-002 | AP269: 8 | AQ269: 瀚蓝转债
A270: 42 | B270: 127022 | C270: 恒逸转债 | D270: 703 | E270: 恒逸石化 | F270: 化工 | G270: 化工 | H270: 136 | I270: 8.8999999999999999e-003 | J270: -1.1299999999999999e-002 | K270: 12.96 | L270: -3.0999999999999999e-003 | M270: 108.9 | N270: 11.5 | O270: 0.20699999999999999 | P270: 112.7 | Q270: 3月14天 | R270: 5.77年 | S270: 3.77年 | T270: 20 | U270: 60 | V270: 2.2000000000000002e-002 | W270: 4.2000000000000003e-002 | X270: 4.7e-002 | Y270: 477 | Z270: 1.9 | AA270: -3.8199999999999998e-002 | AB270: -4.0899999999999999e-002 | AC270: -6.93e-002 | AD270: -7.0499999999999993e-002 | AE270: 87.28 | AF270: 86.02 | AG270: 0.77 | AH270: AA+ | AI270: 4.2300000000000004e-002 | AJ270: =H270+100*O270 -> 156.69999999999999 | AK270: 159.3 | AL270: 276 | AM270: 72 | AN270: 280 | AO270: 4.0999999999999995e-002 | AP270: 5 | AQ270: 恒逸转债
A271: 232 | B271: 113025 | C271: 明泰转债! | D271: 601677 | E271: 明泰铝业 | F271: 有色金属 | G271: 铝金属 | H271: 135.68 | I271: -1.06e-002 | J271: -7.0999999999999995e-003 | K271: 15 | L271: -2.0899999999999998e-002 | M271: 115.1 | N271: 11.2 | O271: 1.3000000000000001e-002 | P271: 133.93 | Q271: 转股中 | R271: 4.25年 | S271: 2.25年 | T271: 13.2 | U271: 111 | V271: 6.2e-002 | W271: 0.13300000000000001 | X271: 0.17899999999999999 | Y271: 99 | Z271: 1.23 | AA271: -3.8699999999999998e-002 | AB271: -4.4600000000000001e-002 | AC271: -0.107 | AD271: -0.109 | AE271: 93.68 | AF271: 96.88 | AG271: 0.85 | AH271: AA | AI271: 4.2300000000000004e-002 | AJ271: =H271+100*O271 -> 136.98000000000002 | AK271: 137.4 | AL271: 210 | AM271: 40.6 | AN271: 176 | AO271: 6.7000000000000004e-002 | AP271: 31 | AQ271: 明泰转债!
A272: 324 | B272: 113012 | C272: 骆驼转债! | D272: 601311 | E272: 骆驼股份 | F272: 汽车 | G272: 零部件制 | H272: 118.01 | I272: 1.44e-002 | J272: 3.7900000000000003e-002 | K272: 11.06 | L272: 7.4800000000000005e-002 | M272: 107.8 | N272: 10.06 | O272: 7.2999999999999995e-002 | P272: 109.94 | Q272: 转股中 | R272: 2.21年 | S272: 0.21年 | T272: 5.1 | U272: 458 | V272: 0.72499999999999998 | W272: 4.0999999999999995e-002 | X272: 4.4999999999999998e-002 | Y272: 124 | Z272: 1.85 | AA272: -4.0899999999999999e-002 | AB272: -4.7100000000000003e-002 | AC272: -0.40299999999999997 | AD272: -0.40999999999999998 | AE272: 100.06 | AF272: 98.88 | AG272: 0.7 | AH272: AA | AI272: 4.07e-002 | AJ272: =H272+100*O272 -> 125.31 | AK272: 126.1 | AL272: 140 | AM272: 26 | AN272: 74 | AO272: 0.182 | AP272: 18 | AQ272: 骆驼转债!
A273: 279 | B273: 123012 | C273: 万顺转债! | D273: 300057 | E273: 万顺新材 | F273: 有色金属 | G273: 铝金属 | H273: 127.9 | I273: -1.9199999999999998e-002 | J273: 2.6600000000000002e-002 | K273: 4.76 | L273: 1.49e-002 | M273: 110.3 | N273: 5.31 | O273: 0.42700000000000005 | P273: 89.64 | Q273: 转股中 | R273: 3.53年 | S273: 1.53年 | T273: 1.29 | U273: 112 | V273: 0.65900000000000003 | W273: 4.0000000000000001e-002 | X273: 3.6000000000000004e-002 | Y273: 32 | Z273: 0.94 | AA273: -4.1799999999999997e-002 | AB273: -4.6900000000000004e-002 | AC273: -0.106 | AD273: -0.10800000000000001 | AE273: 92.72 | AF273: 89.22 | AG273: 0.5 | AH273: AA- | AI273: 6.3299999999999995e-002 | AJ273: =H273+100*O273 -> 170.60000000000002 | AK273: 166.2 | AL273: 286 | AM273: 73.4 | AN273: 281 | AO273: -8.6999999999999994e-002 | AP273: 19 | AQ273: 万顺转债!
A274: 199 | B274: 113548 | C274: 石英转债! | D274: 603688 | E274: 石英股份 | F274: 电子 | G274: 电子产品 | H274: 152.2 | I274: -5.16e-002 | J274: 1.6500000000000001e-002 | K274: 22.29 | L274: -3.9199999999999999e-002 | M274: 124.4 | N274: 15.1 | O274: 3.1e-002 | P274: 147.62 | Q274: 转股中 | R274: 4.80年 | S274: 2.80年 | T274: 1.23 | U274: 30 | V274: 0.158 | W274: 1.6e-002 | X274: 2.3e-002 | Y274: 79 | Z274: 4.17 | AA274: -4.1900000000000007e-002 | AB274: -4.99e-002 | AC274: -0.11900000000000001 | AD274: -0.121 | AE274: 87.11 | AF274: 93.26 | AG274: 0.89 | AH274: AA- | AI274: 6.3299999999999995e-002 | AJ274: =H274+100*O274 -> 155.29999999999998 | AK274: 156.8 | AL274: 272 | AM274: 63.5 | AN274: 267 | AO274: -2.1000000000000001e-002 | AP274: 12 | AQ274: 石英转债!
A275: 159 | B275: 123043 | C275: 正元转债 | D275: 300645 | E275: 正元智慧 | F275: 计算机及 | G275: 软件开发 | H275: 151.2 | I275: -1.6899999999999998e-002 | J275: 6.8999999999999999e-003 | K275: 14.18 | L275: -1.6e-002 | M275: 121.4 | N275: 15.41 | O275: 0.64300000000000002 | P275: 92.02 | Q275: 转股中 | R275: 5年56天 | S275: 3年56天 | T275: 1.66 | U275: 455 | V275: 1.78 | W275: 9.1999999999999998e-002 | X275: 8.5000000000000006e-002 | Y275: 18 | Z275: 2.93 | AA275: -4.2599999999999999e-002 | AB275: -4.9200000000000001e-002 | AC275: -0.10400000000000001 | AD275: -0.106 | AE275: 82.2 | AF275: 83.92 | AG275: 0.63 | AH275: A+ | AI275: 7.6299999999999993e-002 | AJ275: =H275+100*O275 -> 215.5 | AK275: 210.4 | AL275: 306 | AM275: 126.5 | AN275: 310 | AO275: -0.10300000000000001 | AP275: 17 | AQ275: 正元转债
A276: 39 | B276: 123072 | C276: 乐歌转债! | D276: 300729 | E276: 乐歌股份 | F276: 其他 | G276: 家居用品 | H276: 167.605 | I276: -1.41e-002 | J276: 1.49e-002 | K276: 39.6 | L276: 5.6000000000000008e-003 | M276: 129.6 | N276: 73.13 | O276: 2.1000000000000001 | P276: 54.15 | Q276: 3月19天 | R276: 5.78年 | S276: 3.78年 | T276: 1.42 | U276: 721 | V276: 2.98 | W276: 2.6000000000000002e-002 | X276: 1.3999999999999999e-002 | Y276: 55 | Z276: 5.77 | AA276: -4.4600000000000001e-002 | AB276: -5.2300000000000006e-002 | AC276: -0.105 | AD276: -0.10800000000000001 | AE276: 80.12 | AF276: 85.79 | AG276: 0.15 | AH276: A+ | AI276: 7.6299999999999993e-002 | AJ276: =H276+100*O276 -> 377.60500000000002 | AK276: 281.1 | AL276: 315 | AM276: 195.3 | AN276: 316 | AO276: -0.11 | AP276: 5 | AQ276: 乐歌转债!
A277: 320 | B277: 113013 | C277: 国君转债! | D277: 601211 | E277: 国泰君安 | F277: 金融 | G277: 证券行业 | H277: 121.28 | I277: 4.7999999999999996e-003 | J277: -6.4000000000000003e-003 | K277: 17.68 | L277: -3.9000000000000003e-003 | M277: 108.3 | N277: 19.01 | O277: 0.30399999999999999 | P277: 93 | Q277: 转股中 | R277: 2.49年 | S277: 无权 | T277: 69.9 | U277: 131 | V277: 1.4999999999999999e-002 | W277: 4.4000000000000004e-002 | X277: 4.0999999999999995e-002 | Y277: 1575. | Z277: 1.27 | AA277: -4.5100000000000001e-002 | AB277: -5.0999999999999997e-002 | AC277: 无权 | AD277: 无权 | AE277: 无权 | AF277: 99.39 | AG277: 0.41 | AH277: AAA | AI277: 3.5699999999999996e-002 | AJ277: =H277+100*O277 -> 151.68000000000001 | AK277: 149.6 | AL277: 258 | AM277: 50.2 | AN277: 230 | AO277: 6.9999999999999993e-003 | AP277: 14 | AQ277: 国君转债!
A278: 37 | B278: 113040 | C278: 星宇转债 | D278: 601799 | E278: 星宇股份 | F278: 汽车 | G278: 零部件制 | H278: 147 | I278: -2.4900000000000002e-002 | J278: -5.8999999999999999e-003 | K278: 205.55 | L278: -3.6600000000000001e-002 | M278: 111.5 | N278: 158 | O278: 0.13 | P278: 130.09 | Q278: 3月20天 | R278: 5.79年 | S278: 3.79年 | T278: 15 | U278: 147 | V278: 6.6000000000000003e-002 | W278: 2.6000000000000002e-002 | X278: 3.4000000000000002e-002 | Y278: 568 | Z278: 10.68 | AA278: -4.7100000000000003e-002 | AB278: -5.0499999999999996e-002 | AC278: -8.8100000000000012e-002 | AD278: -8.9099999999999999e-002 | AE278: 86.88 | AF278: 87.98 | AG278: 0.84 | AH278: AA+ | AI278: 4.2300000000000004e-002 | AJ278: =H278+100*O278 -> 160. | AK278: 163.9 | AL278: 283 | AM278: 75.9 | AN278: 285 | AO278: 5.9999999999999998e-002 | AP278: 4 | AQ278: 星宇转债
A279: 91 | B279: 123058 | C279: 欣旺转债 | D279: 300207 | E279: 欣旺达 | F279: 电子 | G279: 电子产品 | H279: 152.134 | I279: -2.29e-002 | J279: 2.35e-002 | K279: 30 | L279: 7.000000000000001e-004 | M279: 116.3 | N279: 21.24 | O279: 7.6999999999999999e-002 | P279: 141.24 | Q279: 12天 | R279: 5.51年 | S279: 3.51年 | T279: 11.2 | U279: 34 | V279: 2.e-002 | W279: 2.4e-002 | X279: 3.3000000000000002e-002 | Y279: 472 | Z279: 7.46 | AA279: -4.8399999999999999e-002 | AB279: -5.3200000000000004e-002 | AC279: -9.9499999999999991e-002 | AD279: -0.10099999999999999 | AE279: 88.64 | AF279: 92.02 | AG279: 0.87 | AH279: AA | AI279: 4.4299999999999999e-002 | AJ279: =H279+100*O279 -> 159.83399999999997 | AK279: 163 | AL279: 282 | AM279: 71 | AN279: 278 | AO279: 1.6e-002 | AP279: 6 | AQ279: 欣旺转债
A280: 258 | B280: 113526 | C280: 联泰转债! | D280: 603797 | E280: 联泰环保 | F280: 城市公用 | G280: 三废处理 | H280: 136.1 | I280: 2.6600000000000002e-002 | J280: 2.0000000000000001e-004 | K280: 7.93 | L280: 3.2599999999999997e-002 | M280: 110.8 | N280: 6.11 | O280: 4.9000000000000002e-002 | P280: 129.79 | Q280: 转股中 | R280: 4年15天 | S280: 2年15天 | T280: 1.93 | U280: 34 | V280: 0.127 | W280: 5.4000000000000006e-002 | X280: 7.0000000000000007e-002 | Y280: 36 | Z280: 2.31 | AA280: -5.0599999999999999e-002 | AB280: -5.5099999999999996e-002 | AC280: -0.11800000000000001 | AD280: -0.12 | AE280: 94.76 | AF280: 94.79 | AG280: 0.82 | AH280: AA+ | AI280: 4.0300000000000002e-002 | AJ280: =H280+100*O280 -> 141. | AK280: 142.4 | AL280: 229 | AM280: 47.6 | AN280: 218 | AO280: -5.0000000000000001e-003 | AP280: 9 | AQ280: 联泰转债!
A281: 295 | B281: 113504 | C281: 艾华转债!! | D281: 603989 | E281: 艾华集团 | F281: 电子 | G281: 元器件制 | H281: 130.3 | I281: -9.1999999999999998e-003 | J281: -3.2000000000000002e-003 | K281: 23.33 | L281: -1.77e-002 | M281: 110.3 | N281: 21.13 | O281: 0.17999999999999999 | P281: 110.41 | Q281: 转股中 | R281: 3年53天 | S281: 1年53天 | T281: 5.59 | U281: 9.1 | V281: 1.2e-002 | W281: 5.9999999999999998e-002 | X281: 6.7000000000000004e-002 | Y281: 92 | Z281: 3.83 | AA281: -5.2600000000000001e-002 | AB281: -5.8200000000000002e-002 | AC281: -0.156 | AD281: -0.159 | AE281: 97.42 | AF281: 97.11 | AG281: 0.7 | AH281: AA | AI281: 4.2300000000000004e-002 | AJ281: =H281+100*O281 -> 148.30000000000001 | AK281: 150.2 | AL281: 259 | AM281: 52.8 | AN281: 242 | AO281: -0.125 | AP281: 9 | AQ281: 艾华转债!!
A282: 13 | B282: 113611 | C282: 福20转债 | D282: 603806 | E282: 福斯特 | F282: 能源电力 | G282: 太阳能 | H282: 153.51 | I282: -3.3399999999999999e-002 | J282: -1.7000000000000001e-003 | K282: 92.75 | L282: -4.2800000000000005e-002 | M282: 111.85 | N282: 73.69 | O282: 0.22 | P282: 125.87 | Q282: 5月0天 | R282: 5.90年 | S282: 3.90年 | T282: 17 | U282: 122 | V282: 4.5999999999999999e-002 | W282: 2.4e-002 | X282: 2.9999999999999999e-002 | Y282: 714 | Z282: 8.94 | AA282: -5.2900000000000003e-002 | AB282: -5.62e-002 | AC282: -9.4800000000000009e-002 | AD282: -9.5899999999999999e-002 | AE282: 86.16 | AF282: 86.92 | AG282: 0.82 | AH282: AA | AI282: 4.4299999999999999e-002 | AJ282: =H282+100*O282 -> 175.50999999999999 | AK282: 181.2 | AL282: 295 | AM282: 94.2 | AN282: 296 | AO282: 8.6999999999999994e-002 | AP282: 3 | AQ282: 福20转债
A283: 272 | B283: 128046 | C283: 利尔转债! | D283: 2258 | E283: 利尔化学 | F283: 化工 | G283: 农化 | H283: 137.496 | I283: 6.8000000000000005e-003 | J283: -1.78e-002 | K283: 22.68 | L283: -1.3899999999999999e-002 | M283: 112.3 | N283: 18.62 | O283: 0.129 | P283: 121.8 | Q283: 转股中 | R283: 3.77年 | S283: 1.77年 | T283: 8.52 | U283: 38 | V283: 3.3000000000000002e-002 | W283: 7.2000000000000008e-002 | X283: 8.6999999999999994e-002 | Y283: 119 | Z283: 3.33 | AA283: -5.3099999999999994e-002 | AB283: -5.8600000000000006e-002 | AC283: -0.115 | AD283: -0.11699999999999999 | AE283: 94.92 | AF283: 96.33 | AG283: 0.79 | AH283: AA | AI283: 4.2300000000000004e-002 | AJ283: =H283+100*O283 -> 150.39600000000002 | AK283: 153.2 | AL283: 269 | AM283: 56.9 | AN283: 252 | AO283: 5.7999999999999996e-002 | AP283: 11 | AQ283: 利尔转债!
A284: 162 | B284: 113032 | C284: 桐20转债!! | D284: 601233 | E284: 桐昆股份 | F284: 服装纺织 | G284: 纺织行业 | H284: 149.27 | I284: -4.4199999999999996e-002 | J284: 1.4499999999999999e-002 | K284: 21.82 | L284: -2.98e-002 | M284: 113.1 | N284: 14.35 | O284: -1.8000000000000002e-002 | P284: 152.06 | Q284: 转股中 | R284: 5年53天 | S284: 3年53天 | T284: 9.69 | U284: 851 | V284: 0.58499999999999996 | W284: 2.e-002 | X284: 3.1e-002 | Y284: 479 | Z284: 2.05 | AA284: -5.3399999999999996e-002 | AB284: -5.7599999999999998e-002 | AC284: -0.10300000000000001 | AD284: -0.105 | AE284: 90.44 | AF284: 91.78 | AG284: 1 | AH284: AA+ | AI284: 4.2300000000000004e-002 | AJ284: =H284+100*O284 -> 147.47 | AK284: 146.5 | AL284: 245 | AM284: 54.7 | AN284: 246 | AO284: 0.114 | AP284: 19 | AQ284: 桐20转债!!
A285: 212 | B285: 123030 | C285: 九洲转债! | D285: 300040 | E285: 九洲集团 | F285: 能源电力 | G285: 电力设备 | H285: 154.299 | I285: 8.3999999999999995e-003 | J285: -2.3099999999999999e-002 | K285: 7.41 | L285: -1.46e-002 | M285: 120 | N285: 5.65 | O285: 0.17699999999999999 | P285: 131.15 | Q285: 转股中 | R285: 4.61年 | S285: 2.61年 | T285: 0.97 | U285: 141 | V285: 0.94299999999999995 | W285: 3.4000000000000002e-002 | X285: 4.4999999999999998e-002 | Y285: 28 | Z285: 1.29 | AA285: -5.3899999999999997e-002 | AB285: -6.08e-002 | AC285: -0.13300000000000001 | AD285: -0.13500000000000001 | AE285: 87.42 | AF285: 90.92 | AG285: 1 | AH285: AA- | AI285: 6.3299999999999995e-002 | AJ285: =H285+100*O285 -> 171.999 | AK285: 177.4 | AL285: 293 | AM285: 86.5 | AN285: 291 | AO285: -4.2000000000000003e-002 | AP285: 28 | AQ285: 九洲转债!
A286: 246 | B286: 123022 | C286: 长信转债!! | D286: 300088 | E286: 长信科技 | F286: 通信互联 | G286: 通信设备 | H286: 144.6 | I286: 3.4300000000000004e-002 | J286: -4.0999999999999995e-003 | K286: 8.82 | L286: 3.4000000000000002e-002 | M286: 114.9 | N286: 6.15 | O286: 8.0000000000000002e-003 | P286: 143.41 | Q286: 转股中 | R286: 4.19年 | S286: 2.19年 | T286: 2.57 | U286: 192 | V286: 0.50600000000000001 | W286: 1.2e-002 | X286: 1.7000000000000001e-002 | Y286: 217 | Z286: 3.13 | AA286: -5.4400000000000004e-002 | AB286: -6.0199999999999997e-002 | AC286: -0.10099999999999999 | AD286: -0.10300000000000001 | AE286: 93.89 | AF286: 96.96 | AG286: 0.89 | AH286: AA | AI286: 4.2300000000000004e-002 | AJ286: =H286+100*O286 -> 145.40000000000001 | AK286: 145.8 | AL286: 243 | AM286: 48.8 | AN286: 222 | AO286: -2.6000000000000002e-002 | AP286: 12 | AQ286: 长信转债!!
A287: 207 | B287: 113545 | C287: 金能转债! | D287: 603113 | E287: 金能科技 | F287: 煤炭 | G287: 炼焦 | H287: 150 | I287: 5.0000000000000001e-004 | J287: 5.3e-003 | K287: 15.15 | L287: 6.6e-003 | M287: 114.9 | N287: 10.78 | O287: 6.7000000000000004e-002 | P287: 140.54 | Q287: 转股中 | R287: 4.76年 | S287: 2.76年 | T287: 10.6 | U287: 120 | V287: 7.4999999999999997e-002 | W287: 8.199999999999999e-002 | X287: 0.115 | Y287: 129 | Z287: 1.68 | AA287: -5.5300000000000002e-002 | AB287: -6.0400000000000002e-002 | AC287: -0.11800000000000001 | AD287: -0.12 | AE287: 91.68 | AF287: 94.67 | AG287: 0.87 | AH287: AA | AI287: 4.2300000000000004e-002 | AJ287: =H287+100*O287 -> 156.69999999999999 | AK287: 159.5 | AL287: 277 | AM287: 64.8 | AN287: 269 | AO287: 1.8000000000000002e-002 | AP287: 20 | AQ287: 金能转债!
A288: 146 | B288: 128103 | C288: 同德转债! | D288: 2360 | E288: 同德化工 | F288: 化工 | G288: 化工 | H288: 164.2 | I288: 2.2799999999999997e-002 | J288: 5.9999999999999998e-002 | K288: 7.98 | L288: 8.2799999999999999e-002 | M288: 121.8 | N288: 5.18 | O288: 6.6000000000000003e-002 | P288: 154.05 | Q288: 转股中 | R288: 5.21年 | S288: 3.21年 | T288: 1.44 | U288: 995 | V288: 4.1500000000000004 | W288: 4.5999999999999999e-002 | X288: 7.0999999999999994e-002 | Y288: 31 | Z288: 2.6 | AA288: -5.6900000000000006e-002 | AB288: -6.3399999999999998e-002 | AC288: -0.12300000000000001 | AD288: -0.125 | AE288: 81.96 | AF288: 83.85 | AG288: 1 | AH288: A+ | AI288: 7.6299999999999993e-002 | AJ288: =H288+100*O288 -> 170.79999999999998 | AK288: 174.3 | AL288: 291 | AM288: 90.5 | AN288: 294 | AO288: 6.2e-002 | AP288: 12 | AQ288: 同德转债!
A289: 293 | B289: 127005 | C289: 长证转债! | D289: 783 | E289: 长江证券 | F289: 金融 | G289: 证券行业 | H289: 132.4 | I289: -4.5000000000000005e-003 | J289: -6.6e-003 | K289: 8.6 | L289: -1.49e-002 | M289: 109.3 | N289: 7.28 | O289: 0.121 | P289: 118.13 | Q289: 转股中 | R289: 3.17年 | S289: 无权 | T289: 50 | U289: 76 | V289: 1.1000000000000001e-002 | W289: 0.105 | X289: 0.124 | Y289: 476 | Z289: 1.7 | AA289: -5.9800000000000006e-002 | AB289: -6.4699999999999994e-002 | AC289: 无权 | AD289: 无权 | AE289: 无权 | AF289: 97.57 | AG289: 0.74 | AH289: AAA | AI289: 3.73e-002 | AJ289: =H289+100*O289 -> 144.5 | AK289: 146.7 | AL289: 247 | AM289: 49.1 | AN289: 224 | AO289: 4.7e-002 | AP289: 15 | AQ289: 长证转债!
A290: 187 | B290: 113029 | C290: 明阳转债!! | D290: 601615 | E290: 明阳智能 | F290: 能源电力 | G290: 风能 | H290: 154.77 | I290: -2.1099999999999997e-002 | J290: -3.2300000000000002e-002 | K290: 18.35 | L290: -6.0400000000000002e-002 | M290: 112.9 | N290: 12.8 | O290: 8.0000000000000002e-002 | P290: 143.36 | Q290: 转股中 | R290: 4.94年 | S290: 2.94年 | T290: 9.72 | U290: 88 | V290: 5.7999999999999996e-002 | W290: 2.7999999999999997e-002 | X290: 4.0000000000000001e-002 | Y290: 344 | Z290: 3.4 | AA290: -6.2899999999999998e-002 | AB290: -6.7099999999999993e-002 | AC290: -0.121 | AD290: -0.122 | AE290: 91.03 | AF290: 92.37 | AG290: 0.88 | AH290: AA | AI290: 4.2300000000000004e-002 | AJ290: =H290+100*O290 -> 162.77000000000001 | AK290: 166.2 | AL290: 287 | AM290: 73.8 | AN290: 282 | AO290: -3.4000000000000002e-002 | AP290: 22 | AQ290: 明阳转债!!
A291: 94 | B291: 113592 | C291: 安20转债 | D291: 603345 | E291: 安井食品 | F291: 食品饮料 | G291: 食品饮料 | H291: 160.77 | I291: -4.7999999999999996e-003 | J291: 2.2000000000000001e-003 | K291: 187.48 | L291: -2.8000000000000004e-003 | M291: 113.1 | N291: 115.9 | O291: -6.0000000000000001e-003 | P291: 161.76 | Q291: 6.1天 | R291: 5.50年 | S291: 3.50年 | T291: 9 | U291: 110 | V291: 7.400000000000001e-002 | W291: 2.e-002 | X291: 3.3000000000000002e-002 | Y291: 444 | Z291: 13.82 | AA291: -6.3e-002 | AB291: -6.6799999999999998e-002 | AC291: -0.11 | AD291: -0.11199999999999999 | AE291: 88.51 | AF291: 89.53 | AG291: 0.94 | AH291: AA | AI291: 4.4299999999999999e-002 | AJ291: =H291+100*O291 -> 160.17000000000002 | AK291: 159.8 | AL291: 278 | AM291: 70.3 | AN291: 276 | AO291: -1.3999999999999999e-002 | AP291: 9 | AQ291: 安20转债
A292: 325 | B292: 113011 | C292: 光大转债 | D292: 601818 | E292: 光大银行 | F292: 金融 | G292: 银行行业 | H292: 124.75 | I292: -1.6000000000000001e-003 | J292: -1.4000000000000002e-003 | K292: 3.92 | L292: -5.1000000000000004e-003 | M292: 108.3 | N292: 3.76 | O292: 0.19699999999999998 | P292: 104.26 | Q292: 转股中 | R292: 2.19年 | S292: 无权 | T292: 242 | U292: 253 | V292: 8.0000000000000002e-003 | W292: 0.114 | X292: 0.11900000000000001 | Y292: 2118. | Z292: 0.63 | AA292: -6.3799999999999996e-002 | AB292: -7.0300000000000001e-002 | AC292: 无权 | AD292: 无权 | AE292: 无权 | AF292: 100.47 | AG292: 0.59 | AH292: AAA | AI292: 3.5699999999999996e-002 | AJ292: =H292+100*O292 -> 144.44999999999999 | AK292: 145.2 | AL292: 241 | AM292: 44.8 | AN292: 199 | AO292: -9.0000000000000011e-003 | AP292: 15 | AQ292: 光大转债
A293: 223 | B293: 123027 | C293: 蓝晓转债! | D293: 300487 | E293: 蓝晓科技 | F293: 化工 | G293: 化工 | H293: 163.502 | I293: -1.3300000000000001e-002 | J293: 7.0999999999999995e-003 | K293: 44.64 | L293: -6.7000000000000002e-003 | M293: 119.5 | N293: 29.33 | O293: 7.400000000000001e-002 | P293: 152.2 | Q293: 转股中 | R293: 4.42年 | S293: 2.42年 | T293: 1.08 | U293: 85 | V293: 0.47799999999999998 | W293: 1.1000000000000001e-002 | X293: 1.7000000000000001e-002 | Y293: 96 | Z293: 6.03 | AA293: -6.9900000000000004e-002 | AB293: -7.6700000000000004e-002 | AC293: -0.114 | AD293: -0.115 | AE293: 86.95 | AF293: 87.78 | AG293: 0.93 | AH293: A+ | AI293: 7.4299999999999991e-002 | AJ293: =H293+100*O293 -> 170.90200000000002 | AK293: 174.8 | AL293: 292 | AM293: 87 | AN293: 293 | AO293: 9.0000000000000011e-003 | AP293: 21 | AQ293: 蓝晓转债!
A294: 111 | B294: 128112 | C294: 歌尔转2! | D294: 2241 | E294: 歌尔股份 | F294: 电子 | G294: 电子产品 | H294: 169.1 | I294: 7.7000000000000002e-003 | J294: -1.6000000000000001e-003 | K294: 39.24 | L294: 6.1999999999999998e-003 | M294: 114.5 | N294: 23.27 | O294: 3.0000000000000001e-003 | P294: 168.63 | Q294: 转股中 | R294: 5.42年 | S294: 3.42年 | T294: 32.6 | U294: 521 | V294: 9.5000000000000001e-002 | W294: 2.5000000000000001e-002 | X294: 4.2999999999999997e-002 | Y294: 1285. | Z294: 7.28 | AA294: -7.0199999999999999e-002 | AB294: -7.4499999999999997e-002 | AC294: -0.125 | AD294: -0.127 | AE294: 88.84 | AF294: 91.77 | AG294: 1 | AH294: AA+ | AI294: 4.2300000000000004e-002 | AJ294: =H294+100*O294 -> 169.40000000000001 | AK294: 169.6 | AL294: 289 | AM294: 77.8 | AN294: 288 | AO294: 3.7000000000000005e-002 | AP294: 17 | AQ294: 歌尔转2!
A295: 329 | B295: 113009 | C295: 广汽转债! | D295: 601238 | E295: 广汽集团 | F295: 汽车 | G295: 乘用车 | H295: 116 | I295: 2.0499999999999997e-002 | J295: -1.5700000000000002e-002 | K295: 12.62 | L295: 3.0200000000000001e-002 | M295: 107.5 | N295: 14.23 | O295: 0.308 | P295: 88.69 | Q295: 转股中 | R295: 1年14天 | S295: 回售中 | T295: 25.5 | U295: 37 | V295: 1.3000000000000001e-002 | W295: 1.9e-002 | X295: 1.7000000000000001e-002 | Y295: 1306. | Z295: 1.56 | AA295: -7.1599999999999997e-002 | AB295: -8.4000000000000005e-002 | AC295: 回售中 | AD295: 回售中 | AE295: 100.25 | AF295: 103.71 | AG295: 0.16 | AH295: AAA | AI295: 3.5699999999999996e-002 | AJ295: =H295+100*O295 -> 146.80000000000001 | AK295: 143.3 | AL295: 233 | AM295: 39.6 | AN295: 170 | AO295: -4.9000000000000002e-002 | AP295: 15 | AQ295: 广汽转债!
A296: 256 | B296: 128053 | C296: 尚荣转债! | D296: 2551 | E296: 尚荣医疗 | F296: 医药 | G296: 医疗器械 | H296: 155.809 | I296: 5.1999999999999998e-003 | J296: -1.1599999999999999e-002 | K296: 6.23 | L296: -6.4000000000000003e-003 | M296: 114.9 | N296: 4.89 | O296: 0.223 | P296: 127.4 | Q296: 转股中 | R296: 4年37天 | S296: 2年37天 | T296: 1.91 | U296: 803 | V296: 2.6699999999999999 | W296: 3.7000000000000005e-002 | X296: 4.8000000000000001e-002 | Y296: 51 | Z296: 1.73 | AA296: -7.2900000000000006e-002 | AB296: -7.8700000000000006e-002 | AC296: -0.127 | AD296: -0.128 | AE296: 94.23 | AF296: 97.31 | AG296: 1 | AH296: AA | AI296: 4.2300000000000004e-002 | AJ296: =H296+100*O296 -> 178.10900000000001 | AK296: 184.2 | AL296: 297 | AM296: 86.9 | AN296: 292 | AO296: -3.9e-002 | AP296: 27 | AQ296: 尚荣转债!
A297: 171 | B297: 123042 | C297: 银河转债! | D297: 300619 | E297: 金银河 | F297: 机械装备 | G297: 专用设备 | H297: 170.2 | I297: -2.1299999999999999e-002 | J297: 2.3e-003 | K297: 20.58 | L297: -3.4700000000000002e-002 | M297: 115.9 | N297: 24.4 | O297: 1.02 | P297: 84.34 | Q297: 转股中 | R297: 5年6.1天 | S297: 3年6.1天 | T297: 1.67 | U297: 836 | V297: 2.8599999999999999 | W297: 0.109 | X297: 9.1999999999999998e-002 | Y297: 15 | Z297: 3.15 | AA297: -7.5300000000000006e-002 | AB297: -8.0199999999999994e-002 | AC297: -0.14099999999999999 | AD297: -0.14300000000000002 | AE297: 82.79 | AF297: 80.93 | AG297: 0.55 | AH297: A+ | AI297: 7.6299999999999993e-002 | AJ297: =H297+100*O297 -> 272.19999999999999 | AK297: 256.1 | AL297: 313 | AM297: 173.3 | AN297: 313 | AO297: -0.16300000000000001 | AP297: 25 | AQ297: 银河转债!
A298: 102 | B298: 113590 | C298: 海容转债 | D298: 603187 | E298: 海容冷链 | F298: 机械装备 | G298: 通用设备 | H298: 177.67 | I298: 4.0000000000000001e-003 | J298: 3.9000000000000003e-003 | K298: 64.1 | L298: 8.199999999999999e-003 | M298: 115.6 | N298: 36.39 | O298: 9.0000000000000011e-003 | P298: 176.15 | Q298: 转股中 | R298: 5.47年 | S298: 3.47年 | T298: 4.91 | U298: 348 | V298: 0.39100000000000001 | W298: 4.8000000000000001e-002 | X298: 8.5000000000000006e-002 | Y298: 102 | Z298: 6.25 | AA298: -7.6799999999999993e-002 | AB298: -8.1300000000000011e-002 | AC298: -0.13300000000000001 | AD298: -0.13500000000000001 | AE298: 82.78 | AF298: 82.4 | AG298: 0.96 | AH298: AA- | AI298: 6.5299999999999997e-002 | AJ298: =H298+100*O298 -> 178.56999999999999 | AK298: 179.2 | AL298: 294 | AM298: 96.4 | AN298: 298 | AO298: 9.8000000000000004e-002 | AP298: 7 | AQ298: 海容转债
A299: 112 | B299: 128111 | C299: 中矿转债! | D299: 2738 | E299: 中矿资源 | F299: 有色金属 | G299: 有色行业 | H299: 216 | I299: 3.7000000000000002e-003 | J299: 1.67e-002 | K299: 33.98 | L299: 2.0400000000000001e-002 | M299: 124.7 | N299: 15.48 | O299: -1.6e-002 | P299: 219.51 | Q299: 转股中 | R299: 5.42年 | S299: 3.42年 | T299: 3.65 | U299: 1050. | V299: 1.3700000000000001 | W299: 3.5000000000000003e-002 | X299: 7.6999999999999999e-002 | Y299: 104 | Z299: 3.51 | AA299: -9.8100000000000007e-002 | AB299: -0.105 | AC299: -0.10199999999999999 | AD299: -0.10199999999999999 | AE299: 83.62 | AF299: 89.22 | AG299: 1 | AH299: AA- | AI299: 6.5299999999999997e-002 | AJ299: =H299+100*O299 -> 214.40000000000001 | AK299: 212.5 | AL299: 307 | AM299: 123.3 | AN299: 309 | AO299: 0.29600000000000004 | AP299: 9 | AQ299: 中矿转债!
A300: 216 | B300: 113543 | C300: 欧派转债! | D300: 603833 | E300: 欧派家居 | F300: 其他 | G300: 家居用品 | H300: 185.08 | I300: -3.4000000000000002e-002 | J300: 4.3e-003 | K300: 128 | L300: -3.1e-002 | M300: 114.9 | N300: 71.69 | O300: 3.7000000000000005e-002 | P300: 178.55 | Q300: 转股中 | R300: 4.60年 | S300: 3.60年 | T300: 5.42 | U300: 56 | V300: 5.4000000000000006e-002 | W300: 6.9999999999999993e-003 | X300: 1.3000000000000001e-002 | Y300: 770 | Z300: 7.06 | AA300: -9.9900000000000003e-002 | AB300: -0.105 | AC300: -0.13500000000000001 | AD300: -0.13699999999999998 | AE300: 90.23 | AF300: 95.31 | AG300: 0.95 | AH300: AA | AI300: 4.2300000000000004e-002 | AJ300: =H300+100*O300 -> 188.78 | AK300: 191.6 | AL300: 299 | AM300: 96.3 | AN300: 297 | AO300: 1.e-003 | AP300: 14 | AQ300: 欧派转债!
A301: 161 | B301: 110066 | C301: 盛屯转债!! | D301: 600711 | E301: 盛屯矿业 | F301: 有色金属 | G301: 有色行业 | H301: 196.7 | I301: -3.1400000000000004e-002 | J301: 1.0500000000000001e-002 | K301: 9.46 | L301: -2.1700000000000001e-002 | M301: 115.3 | N301: 4.88 | O301: 1.4999999999999999e-002 | P301: 193.85 | Q301: 转股中 | R301: 5年53天 | S301: 3年53天 | T301: 7.5 | U301: 580 | V301: 0.39600000000000002 | W301: 2.9999999999999999e-002 | X301: 5.7999999999999996e-002 | Y301: 250 | Z301: 2.37 | AA301: -0.10000000000000001 | AB301: -0.105 | AC301: -0.105 | AD301: -0.106 | AE301: 90.06 | AF301: 92.69 | AG301: 0.96 | AH301: AA | AI301: 4.4299999999999999e-002 | AJ301: =H301+100*O301 -> 198.19999999999999 | AK301: 199.5 | AL301: 303 | AM301: 106.9 | AN301: 302 | AO301: 0.14099999999999999 | AP301: 42 | AQ301: 盛屯转债!!
A302: 67 | B302: 128126 | C302: 赣锋转2 | D302: 2460 | E302: 赣锋锂业 | F302: 有色金属 | G302: 小金属 | H302: 200.2 | I302: -2.5699999999999997e-002 | J302: 7.8000000000000005e-003 | K302: 123.67 | L302: -1.8500000000000003e-002 | M302: 111.1 | N302: 60.27 | O302: -2.4e-002 | P302: 205.19 | Q302: 35天 | R302: 5.58年 | S302: 3.58年 | T302: 21.1 | U302: 910 | V302: 0.222 | W302: 1.3000000000000001e-002 | X302: 2.6000000000000002e-002 | Y302: 1657. | Z302: 17.76 | AA302: -0.10099999999999999 | AB302: -0.10400000000000001 | AC302: -0.156 | AD302: -0.157 | AE302: 87.56 | AF302: 87.58 | AG302: 0.97 | AH302: AA | AI302: 4.4299999999999999e-002 | AJ302: =H302+100*O302 -> 197.79999999999998 | AK302: 195.2 | AL302: 300 | AM302: 107.6 | AN302: 303 | AO302: 0.26700000000000002 | AP302: 9 | AQ302: 赣锋转2
A303: 28 | B303: 113041 | C303: 紫金转债 | D303: 601899 | E303: 紫金矿业 | F303: 有色金属 | G303: 贵金属 | H303: 182.03 | I303: 1.9299999999999998e-002 | J303: -5.1000000000000004e-003 | K303: 11.35 | L303: 1.52e-002 | M303: 108 | N303: 7.01 | O303: 0.124 | P303: 161.91 | Q303: 4月2天 | R303: 4.82年 | S303: 2.82年 | T303: 60 | U303: 349 | V303: 3.2000000000000001e-002 | W303: 2.1000000000000001e-002 | X303: 3.4000000000000002e-002 | Y303: 2880. | Z303: 6.01 | AA303: -0.10300000000000001 | AB303: -0.106 | AC303: -0.114 | AD303: -0.115 | AE303: 90.87 | AF303: 90.65 | AG303: 0.93 | AH303: AAA | AI303: 3.73e-002 | AJ303: =H303+100*O303 -> 194.43000000000001 | AK303: 202.1 | AL303: 304 | AM303: 111.3 | AN303: 304 | AO303: 0.23100000000000001 | AP303: 7 | AQ303: 紫金转债
A304: 69 | B304: 113038 | C304: 隆20转债 | D304: 601012 | E304: 隆基股份 | F304: 能源电力 | G304: 太阳能 | H304: 206.67 | I304: -2.9500000000000002e-002 | J304: 2.5999999999999999e-003 | K304: 110.4 | L304: -2.7699999999999999e-002 | M304: 111.8 | N304: 52.59 | O304: -1.6e-002 | P304: 209.93 | Q304: 29天 | R304: 5.56年 | S304: 3.56年 | T304: 50 | U304: 1215. | V304: 0.11599999999999999 | W304: 1.2e-002 | X304: 2.5000000000000001e-002 | Y304: 4164. | Z304: 12.83 | AA304: -0.106 | AB304: -0.109 | AC304: -0.16200000000000001 | AD304: -0.16300000000000001 | AE304: 89.58 | AF304: 90.57 | AG304: 0.97 | AH304: AAA | AI304: 3.9300000000000002e-002 | AJ304: =H304+100*O304 -> 205.06999999999999 | AK304: 203.4 | AL304: 305 | AM304: 112.8 | AN304: 306 | AO304: 0.25 | AP304: 13 | AQ304: 隆20转债
A305: 247 | B305: 110055 | C305: 伊力转债!! | D305: 600197 | E305: 伊力特 | F305: 食品饮料 | G305: 白酒 | H305: 184.75 | I305: -1.67e-002 | J305: 1.4800000000000001e-002 | K305: 29.23 | L305: -2.e-003 | M305: 115 | N305: 16.81 | O305: 6.2e-002 | P305: 173.88 | Q305: 转股中 | R305: 4.18年 | S305: 2.18年 | T305: 2.85 | U305: 864 | V305: 1.5900000000000001 | W305: 2.1000000000000001e-002 | X305: 3.6000000000000004e-002 | Y305: 137 | Z305: 4.75 | AA305: -0.109 | AB305: -0.114 | AC305: -0.16 | AD305: -0.161 | AE305: 94.02 | AF305: 97.09 | AG305: 0.95 | AH305: AA | AI305: 4.2300000000000004e-002 | AJ305: =H305+100*O305 -> 190.94999999999999 | AK305: 195.6 | AL305: 301 | AM305: 98.5 | AN305: 300 | AO305: 2.3e-002 | AP305: 25 | AQ305: 伊力转债!!
A306: 290 | B306: 128036 | C306: 金农转债!! | D306: 2548 | E306: 金新农 | F306: 农业 | G306: 畜牧业 | H306: 164.07 | I306: -0.10300000000000001 | J306: 3.3399999999999999e-002 | K306: 9.7 | L306: -7.0000000000000007e-002 | M306: 110.3 | N306: 6.96 | O306: 0.17699999999999999 | P306: 139.37 | Q306: 转股中 | R306: 3.16年 | S306: 1.16年 | T306: 1.46 | U306: 1096. | V306: 4.5099999999999998 | W306: 2.2000000000000002e-002 | X306: 2.9999999999999999e-002 | Y306: 67 | Z306: 2.56 | AA306: -0.12 | AB306: -0.125 | AC306: -0.27200000000000002 | AD306: -0.27399999999999997 | AE306: 94.82 | AF306: 91.24 | AG306: 1 | AH306: AA- | AI306: 6.3299999999999995e-002 | AJ306: =H306+100*O306 -> 181.76999999999998 | AK306: 188.8 | AL306: 298 | AM306: 94 | AN306: 295 | AO306: 0.11199999999999999 | AP306: 16 | AQ306: 金农转债!!
A307: 276 | B307: 123014 | C307: 凯发转债! | D307: 300407 | E307: 凯发电气 | F307: 能源电力 | G307: 电力设备 | H307: 150.05 | I307: -1.2800000000000001e-002 | J307: 1.38e-002 | K307: 7.03 | L307: 2.8999999999999998e-003 | M307: 108.5 | N307: 8.12 | O307: 0.73299999999999998 | P307: 86.58 | Q307: 转股中 | R307: 2.55年 | S307: 0.55年 | T307: 1.16 | U307: 1010. | V307: 5.6200000000000001 | W307: 5.4000000000000006e-002 | X307: 4.7e-002 | Y307: 21 | Z307: 1.59 | AA307: -0.121 | AB307: -0.126 | AC307: -0.46999999999999997 | AD307: -0.47200000000000003 | AE307: 96.31 | AF307: 90.95 | AG307: 0.36 | AH307: A+ | AI307: 7.2700000000000001e-002 | AJ307: =H307+100*O307 -> 223.35000000000002 | AK307: 213.5 | AL307: 310 | AM307: 117.2 | AN307: 307 | AO307: -9.6000000000000002e-002 | AP307: 16 | AQ307: 凯发转债!
A308: 197 | B308: 123034 | C308: 通光转债! | D308: 300265 | E308: 通光线缆 | F308: 通信互联 | G308: 通信设备 | H308: 224 | I308: 5.16e-002 | J308: -6.3600000000000004e-002 | K308: 9.97 | L308: -1.38e-002 | M308: 118 | N308: 7.97 | O308: 0.79099999999999993 | P308: 125.09 | Q308: 转股中 | R308: 4.82年 | S308: 2.82年 | T308: 0.78 | U308: 1947. | V308: 10.99 | W308: 2.1000000000000001e-002 | X308: 2.7000000000000003e-002 | Y308: 36 | Z308: 2.9 | AA308: -0.126 | AB308: -0.13200000000000001 | AC308: -0.14099999999999999 | AD308: -0.14099999999999999 | AE308: 83.72 | AF308: 84.1 | AG308: 0.87 | AH308: A+ | AI308: 7.4299999999999991e-002 | AJ308: =H308+100*O308 -> 303.10000000000002 | AK308: 322.9 | AL308: 320 | AM308: 238.8 | AN308: 321 | AO308: -0.10000000000000001 | AP308: 24 | AQ308: 通光转债!
A309: 167 | B309: 128095 | C309: 恩捷转债!! | D309: 2812 | E309: 恩捷股份 | F309: 电子 | G309: 元器件制 | H309: 233.1 | I309: -8.0500000000000002e-002 | J309: 6.4000000000000003e-003 | K309: 152 | L309: -7.5999999999999998e-002 | M309: 115.3 | N309: 65.09 | O309: -2.e-003 | P309: 233.52 | Q309: 转股中 | R309: 5年34天 | S309: 3年34天 | T309: 8.33 | U309: 586 | V309: 0.29899999999999999 | W309: 6.0000000000000001e-003 | X309: 1.3999999999999999e-002 | Y309: 1348. | Z309: 13.53 | AA309: -0.13100000000000001 | AB309: -0.13500000000000001 | AC309: -0.128 | AD309: -0.129 | AE309: 90.28 | AF309: 92.9 | AG309: 0.98 | AH309: AA | AI309: 4.4299999999999999e-002 | AJ309: =H309+100*O309 -> 232.90000000000001 | AK309: 232.7 | AL309: 311 | AM309: 139.8 | AN309: 311 | AO309: 0.11800000000000001 | AP309: 17 | AQ309: 恩捷转债!!
A310: 328 | B310: 128010 | C310: 蔚蓝转债! | D310: 2245 | E310: 蔚蓝锂芯 | F310: 交通运输 | G310: 物流业 | H310: 127.1 | I310: -5.3499999999999999e-002 | J310: 8.9999999999999998e-004 | K310: 11.67 | L310: -6.1100000000000002e-002 | M310: 109.6 | N310: 9.25 | O310: 6.9999999999999993e-003 | P310: 126.16 | Q310: 转股中 | R310: 1年14天 | S310: 回售中 | T310: 3.35 | U310: 414 | V310: 0.96499999999999997 | W310: 2.8999999999999998e-002 | X310: 3.6000000000000004e-002 | Y310: 117 | Z310: 5.03 | AA310: -0.13500000000000001 | AB310: -0.14899999999999999 | AC310: 回售中 | AD310: 回售中 | AE310: 100.27 | AF310: 105.22 | AG310: 0.86 | AH310: AA | AI310: 4.07e-002 | AJ310: =H310+100*O310 -> 127.8 | AK310: 128 | AL310: 161 | AM310: 22.8 | AN310: 46 | AO310: 3.0000000000000001e-003 | AP310: 41 | AQ310: 蔚蓝转债!
A311: 105 | B311: 128115 | C311: 巨星转债 | D311: 2444 | E311: 巨星科技 | F311: 机械装备 | G311: 通用设备 | H311: 253.8 | I311: -5.5899999999999998e-002 | J311: 1.0500000000000001e-002 | K311: 31.45 | L311: -4.6399999999999997e-002 | M311: 115.3 | N311: 12.28 | O311: -9.0000000000000011e-003 | P311: 256.11 | Q311: 转股中 | R311: 5.46年 | S311: 3.46年 | T311: 9.19 | U311: 481 | V311: 0.20300000000000001 | W311: 2.7000000000000003e-002 | X311: 7.0000000000000007e-002 | Y311: 338 | Z311: 3.99 | AA311: -0.13699999999999998 | AB311: -0.14000000000000001 | AC311: -0.114 | AD311: -0.115 | AE311: 91.16 | AF311: 91.45 | AG311: 0.98 | AH311: AA | AI311: 4.4299999999999999e-002 | AJ311: =H311+100*O311 -> 252.90000000000001 | AK311: 251.5 | AL311: 312 | AM311: 160 | AN311: 312 | AO311: 0.109 | AP311: 5 | AQ311: 巨星转债
A312: 304 | B312: 128030 | C312: 天康转债!! | D312: 2100 | E312: 天康生物 | F312: 农业 | G312: 畜牧业 | H312: 172.5 | I312: 2.9999999999999997e-004 | J312: -3.9800000000000002e-002 | K312: 11.43 | L312: -3.95e-002 | M312: 111.3 | N312: 7.85 | O312: 0.185 | P312: 145.61 | Q312: 转股中 | R312: 2.95年 | S312: 0.95年 | T312: 0.98 | U312: 276 | V312: 1.6399999999999999 | W312: 8.0000000000000002e-003 | X312: 1.2e-002 | Y312: 123 | Z312: 2.06 | AA312: -0.14000000000000001 | AB312: -0.14499999999999999 | AC312: -0.36200000000000004 | AD312: -0.36299999999999999 | AE312: 97.36 | AF312: 99.11 | AG312: 1 | AH312: AA | AI312: 4.07e-002 | AJ312: =H312+100*O312 -> 191. | AK312: 199.4 | AL312: 302 | AM312: 100.3 | AN312: 301 | AO312: -5.4000000000000006e-002 | AP312: 11 | AQ312: 天康转债!!
A313: 318 | B313: 128017 | C313: 金禾转债!! | D313: 2597 | E313: 金禾实业 | F313: 化工 | G313: 化工 | H313: 171.01 | I313: -4.41e-002 | J313: 2.7300000000000001e-002 | K313: 37.95 | L313: -1.7299999999999999e-002 | M313: 108.8 | N313: 22.42 | O313: 1.e-002 | P313: 169.27 | Q313: 转股中 | R313: 2.81年 | S313: 0.81年 | T313: 5.52 | U313: 125 | V313: 0.127 | W313: 2.6000000000000002e-002 | X313: 4.4000000000000004e-002 | Y313: 213 | Z313: 4.62 | AA313: -0.14999999999999999 | AB313: -0.155 | AC313: -0.41600000000000004 | AD313: -0.41700000000000004 | AE313: 97.66 | AF313: 97.4 | AG313: 0.97 | AH313: AA | AI313: 4.07e-002 | AJ313: =H313+100*O313 -> 172.00999999999999 | AK313: 172.8 | AL313: 290 | AM313: 75.1 | AN313: 283 | AO313: 0.13500000000000001 | AP313: 10 | AQ313: 金禾转债!!
A314: 268 | B314: 123017 | C314: 寒锐转债!! | D314: 300618 | E314: 寒锐钴业 | F314: 有色金属 | G314: 小金属 | H314: 211.1 | I314: -1.8100000000000002e-002 | J314: 7.0699999999999999e-002 | K314: 120 | L314: 5.2499999999999998e-002 | M314: 110.3 | N314: 57.4 | O314: 1.e-002 | P314: 209.06 | Q314: 转股中 | R314: 3.87年 | S314: 1.87年 | T314: 4 | U314: 2228. | V314: 2.6699999999999999 | W314: 1.1000000000000001e-002 | X314: 2.3e-002 | Y314: 364 | Z314: 9.9 | AA314: -0.157 | AB314: -0.16 | AC314: -0.22500000000000001 | AD314: -0.22600000000000001 | AE314: 90.82 | AF314: 87.39 | AG314: 1 | AH314: AA- | AI314: 6.3299999999999995e-002 | AJ314: =H314+100*O314 -> 212.09999999999999 | AK314: 213.1 | AL314: 309 | AM314: 122.3 | AN314: 308 | AO314: 0.41799999999999998 | AP314: 14 | AQ314: 寒锐转债!!
A315: 128 | B315: 113580 | C315: 康隆转债! | D315: 603665 | E315: 康隆达 | F315: 服装纺织 | G315: 服装行业 | H315: 296.88 | I315: -2.5000000000000001e-002 | J315: 2.0299999999999999e-002 | K315: 15.63 | L315: -6.9999999999999993e-003 | M315: 121.2 | N315: 15.51 | O315: 1.95 | P315: 100.77 | Q315: 转股中 | R315: 5.29年 | S315: 3.29年 | T315: 0.41 | U315: 798 | V315: 6.4900000000000002 | W315: 1.7000000000000001e-002 | X315: 1.7000000000000001e-002 | Y315: 25 | Z315: 2.43 | AA315: -0.158 | AB315: -0.16399999999999998 | AC315: -0.13800000000000001 | AD315: -0.13900000000000001 | AE315: 83.91 | AF315: 87.41 | AG315: 0.67 | AH315: AA- | AI315: 6.5299999999999997e-002 | AJ315: =H315+100*O315 -> 491.88 | AK315: 493 | AL315: 328 | AM315: 405.6 | AN315: 328 | AO315: -0.40000000000000002 | AP315: 9 | AQ315: 康隆转债!
A316: 210 | B316: 123031 | C316: 晶瑞转债! | D316: 300655 | E316: 晶瑞股份 | F316: 化工 | G316: 化工 | H316: 260.3 | I316: 2.4799999999999999e-002 | J316: -1.7299999999999999e-002 | K316: 32 | L316: 7.9000000000000008e-003 | M316: 115.8 | N316: 18.43 | O316: 0.499 | P316: 173.63 | Q316: 转股中 | R316: 4.64年 | S316: 2.64年 | T316: 0.63 | U316: 478 | V316: 2.9399999999999999 | W316: 1.e-002 | X316: 1.8000000000000002e-002 | Y316: 60 | Z316: 4.7 | AA316: -0.16200000000000001 | AB316: -0.16699999999999998 | AC316: -0.17399999999999999 | AD316: -0.17399999999999999 | AE316: 84.64 | AF316: 83.59 | AG316: 0.96 | AH316: A+ | AI316: 7.4299999999999991e-002 | AJ316: =H316+100*O316 -> 310.19999999999999 | AK316: 347 | AL316: 324 | AM316: 262.3 | AN316: 324 | AO316: -5.5999999999999994e-002 | AP316: 16 | AQ316: 晶瑞转债!
A317: 126 | B317: 113582 | C317: 火炬转债! | D317: 603678 | E317: 火炬电子 | F317: 电子 | G317: 元器件制 | H317: 302.96 | I317: -4.5499999999999999e-002 | J317: 1.2199999999999999e-002 | K317: 75 | L317: -3.39e-002 | M317: 115.3 | N317: 25.33 | O317: 2.3e-002 | P317: 296.09 | Q317: 转股中 | R317: 5.38年 | S317: 3.38年 | T317: 4.18 | U317: 207 | V317: 0.16200000000000001 | W317: 1.2e-002 | X317: 3.6000000000000004e-002 | Y317: 345 | Z317: 9.78 | AA317: -0.16699999999999998 | AB317: -0.17000000000000001 | AC317: -0.13500000000000001 | AD317: -0.13500000000000001 | AE317: 89.15 | AF317: 91.75 | AG317: 0.98 | AH317: AA | AI317: 4.4299999999999999e-002 | AJ317: =H317+100*O317 -> 305.25999999999999 | AK317: 309.8 | AL317: 317 | AM317: 218.1 | AN317: 317 | AO317: 0.17000000000000001 | AP317: 5 | AQ317: 火炬转债!
A318: 125 | B318: 113035 | C318: 福莱转债! | D318: 601865 | E318: 福莱特 | F318: 能源电力 | G318: 太阳能 | H318: 319.29 | I318: -4.0199999999999993e-002 | J318: -1.4000000000000002e-003 | K318: 43.04 | L318: -4.1599999999999998e-002 | M318: 120.3 | N318: 13.48 | O318: 0. | P318: 319.29 | Q318: 转股中 | R318: 5.38年 | S318: 3.38年 | T318: 1.97 | U318: 368 | V318: 0.57299999999999995 | W318: 2.e-003 | X318: 6.9999999999999993e-003 | Y318: 879 | Z318: 15.81 | AA318: -0.16800000000000001 | AB318: -0.17300000000000001 | AC318: -0.13800000000000001 | AD318: -0.13900000000000001 | AE318: 89.15 | AF318: 95.71 | AG318: 1 | AH318: AA | AI318: 4.4299999999999999e-002 | AJ318: =H318+100*O318 -> 319.29000000000002 | AK318: 319.3 | AL318: 319 | AM318: 223.6 | AN318: 319 | AO318: 0.14899999999999999 | AP318: 8 | AQ318: 福莱转债!
A319: 114 | B319: 128110 | C319: 永兴转债! | D319: 2756 | E319: 永兴材料 | F319: 钢铁 | G319: 炼钢 | H319: 343.39 | I319: -6.5599999999999992e-002 | J319: -5.1000000000000004e-003 | K319: 58.87 | L319: -7.0699999999999999e-002 | M319: 113.2 | N319: 17.06 | O319: -5.0000000000000001e-003 | P319: 345.08 | Q319: 转股中 | R319: 5.42年 | S319: 3.42年 | T319: 1.68 | U319: 1057. | V319: 1.8200000000000001 | W319: 6.9999999999999993e-003 | X319: 2.5000000000000001e-002 | Y319: 232 | Z319: 6.16 | AA319: -0.188 | AB319: -0.191 | AC319: -0.14099999999999999 | AD319: -0.14199999999999999 | AE319: 88.91 | AF319: 89.93 | AG319: 1 | AH319: AA | AI319: 4.4299999999999999e-002 | AJ319: =H319+100*O319 -> 342.88999999999999 | AK319: 341.7 | AL319: 322 | AM319: 251.8 | AN319: 323 | AO319: 0.27200000000000002 | AP319: 5 | AQ319: 永兴转债!
A320: 260 | B320: 123018 | C320: 溢利转债! | D320: 300381 | E320: 溢多利 | F320: 医药 | G320: 原料药 | H320: 259.999 | I320: 4.3e-003 | J320: -1.37e-002 | K320: 11.1 | L320: -1.0700000000000001e-002 | M320: 114.3 | N320: 8.32 | O320: 0.94900000000000007 | P320: 133.41 | Q320: 转股中 | R320: 3.95年 | S320: 1.95年 | T320: 0.54 | U320: 421 | V320: 2.9300000000000002 | W320: 1.e-002 | X320: 1.3000000000000001e-002 | Y320: 54 | Z320: 1.88 | AA320: -0.19 | AB320: -0.19500000000000001 | AC320: -0.253 | AD320: -0.253 | AE320: 90.37 | AF320: 90.09 | AG320: 0.88 | AH320: AA- | AI320: 6.3299999999999995e-002 | AJ320: =H320+100*O320 -> 354.899 | AK320: 386.6 | AL320: 325 | AM320: 296.2 | AN320: 325 | AO320: -2.7999999999999997e-002 | AP320: 12 | AQ320: 溢利转债!
A321: 116 | B321: 113586 | C321: 上机转债! | D321: 603185 | E321: 上机数控 | F321: 机械装备 | G321: 专用设备 | H321: 446.51 | I321: -2.81e-002 | J321: 4.8999999999999998e-003 | K321: 150 | L321: -2.3199999999999998e-002 | M321: 120.8 | N321: 33.3 | O321: -9.0000000000000011e-003 | P321: 450.45 | Q321: 转股中 | R321: 5.42年 | S321: 3.42年 | T321: 2.51 | U321: 532 | V321: 0.47600000000000003 | W321: 6.9999999999999993e-003 | X321: 3.1e-002 | Y321: 366 | Z321: 17.34 | AA321: -0.217 | AB321: -0.222 | AC321: -0.156 | AD321: -0.157 | AE321: 83.26 | AF321: 86.42 | AG321: 1 | AH321: AA- | AI321: 6.5299999999999997e-002 | AJ321: =H321+100*O321 -> 445.61000000000001 | AK321: 442.6 | AL321: 326 | AM321: 356.1 | AN321: 327 | AO321: 0.155 | AP321: 9 | AQ321: 上机转债!
A322: 229 | B322: 128065 | C322: 雅化转债!! | D322: 2497 | E322: 雅化集团 | F322: 化工 | G322: 化工 | H322: 315.8 | I322: -3.7200000000000004e-002 | J322: -1.1000000000000001e-002 | K322: 28.44 | L322: -4.82e-002 | M322: 110.9 | N322: 8.95 | O322: -6.0000000000000001e-003 | P322: 317.77 | Q322: 转股中 | R322: 4.27年 | S322: 2.27年 | T322: 1.93 | U322: 1631. | V322: 2.7400000000000002 | W322: 6.9999999999999993e-003 | X322: 2.1000000000000001e-002 | Y322: 291 | Z322: 9.39 | AA322: -0.22 | AB322: -0.22399999999999998 | AC322: -0.23499999999999999 | AD322: -0.23600000000000002 | AE322: 93.58 | AF322: 93.29 | AG322: 1 | AH322: AA | AI322: 4.2300000000000004e-002 | AJ322: =H322+100*O322 -> 315.19999999999999 | AK322: 313.8 | AL322: 318 | AM322: 220.3 | AN322: 318 | AO322: 0.39399999999999996 | AP322: 21 | AQ322: 雅化转债!!
A323: 285 | B323: 110044 | C323: 广电转债!! | D323: 600831 | E323: 广电网络 | F323: 传媒娱乐 | G323: 影视娱乐 | H323: 272.09 | I323: 2.0199999999999999e-002 | J323: -8.5000000000000006e-003 | K323: 6.64 | L323: 2.3099999999999999e-002 | M323: 112.3 | N323: 6.9 | O323: 1.8300000000000001 | P323: 96.23 | Q323: 转股中 | R323: 3.47年 | S323: 1.47年 | T323: 0.71 | U323: 809 | V323: 4.1399999999999997 | W323: 1.4999999999999999e-002 | X323: 1.3999999999999999e-002 | Y323: 47 | Z323: 1.28 | AA323: -0.22800000000000001 | AB323: -0.23300000000000001 | AC323: -0.35700000000000004 | AD323: -0.35799999999999998 | AE323: 96.13 | AF323: 97.56 | AG323: 0.51 | AH323: AA | AI323: 4.2300000000000004e-002 | AJ323: =H323+100*O323 -> 455.08999999999997 | AK323: 447.9 | AL323: 327 | AM323: 350.4 | AN323: 326 | AO323: -2.4e-002 | AP323: 12 | AQ323: 广电转债!!
A324: 322 | B324: 127004 | C324: 模塑转债!! | D324: 700 | E324: 模塑科技 | F324: 汽车 | G324: 零部件制 | H324: 209.6 | I324: -7.1300000000000002e-002 | J324: 5.04e-002 | K324: 6.38 | L324: -6.7299999999999999e-002 | M324: 113.3 | N324: 7.46 | O324: 1.45 | P324: 85.52 | Q324: 转股中 | R324: 2.40年 | S324: 0.40年 | T324: 1.32 | U324: 1343. | V324: 4.7599999999999998 | W324: 2.3e-002 | X324: 1.9e-002 | Y324: 59 | Z324: 2.25 | AA324: -0.22899999999999998 | AB324: -0.23600000000000002 | AC324: -0.95499999999999996 | AD324: -0.95799999999999996 | AE324: 99.55 | AF324: 102.86 | AG324: 0.31 | AH324: AA | AI324: 4.07e-002 | AJ324: =H324+100*O324 -> 354.60000000000002 | AK324: 333.7 | AL324: 321 | AM324: 230.8 | AN324: 320 | AO324: 8.4000000000000005e-002 | AP324: 37 | AQ324: 模塑转债!!
A325: 288 | B325: 113509 | C325: 新泉转债!! | D325: 603179 | E325: 新泉股份 | F325: 汽车 | G325: 零部件制 | H325: 269.32 | I325: 1.29e-002 | J325: -1.1299999999999999e-002 | K325: 36.68 | L325: 1.6000000000000001e-003 | M325: 110.3 | N325: 14.22 | O325: 4.4000000000000004e-002 | P325: 257.95 | Q325: 转股中 | R325: 3.40年 | S325: 1.40年 | T325: 1.05 | U325: 488 | V325: 1.7 | W325: 8.0000000000000002e-003 | X325: 2.e-002 | Y325: 135 | Z325: 5.5 | AA325: -0.23399999999999999 | AB325: -0.23800000000000002 | AC325: -0.37200000000000005 | AD325: -0.373 | AE325: 96.38 | AF325: 96.08 | AG325: 0.98 | AH325: AA | AI325: 4.2300000000000004e-002 | AJ325: =H325+100*O325 -> 273.71999999999997 | AK325: 280.7 | AL325: 314 | AM325: 184.3 | AN325: 314 | AO325: 0.16500000000000001 | AP325: 10 | AQ325: 新泉转债!!
A326: 259 | B326: 128052 | C326: 凯龙转债! | D326: 2783 | E326: 凯龙股份 | F326: 化工 | G326: 化工 | H326: 339 | I326: 8.3100000000000007e-002 | J326: -9.9700000000000011e-002 | K326: 8.88 | L326: -1.66e-002 | M326: 114.3 | N326: 6.67 | O326: 1.55 | P326: 133.13 | Q326: 转股中 | R326: 3.95年 | S326: 1.95年 | T326: 0.32 | U326: 5620. | V326: 49.909999999999997 | W326: 1.e-002 | X326: 1.3000000000000001e-002 | Y326: 34 | Z326: 1.94 | AA326: -0.24299999999999999 | AB326: -0.248 | AC326: -0.29100000000000004 | AD326: -0.29199999999999998 | AE326: 94.22 | AF326: 97.32 | AG326: 1 | AH326: AA | AI326: 4.2300000000000004e-002 | AJ326: =H326+100*O326 -> 494. | AK326: 544.9 | AL326: 330 | AM326: 447.5 | AN326: 329 | AO326: -0.17699999999999999 | AP326: 13 | AQ326: 凯龙转债!
A327: 274 | B327: 123015 | C327: 蓝盾转债!! | D327: 300297 | E327: 蓝盾股份 | F327: 计算机及 | G327: 软件开发 | H327: 310 | I327: 3.2000000000000002e-003 | J327: 2.5000000000000001e-003 | K327: 4.59 | L327: 2.e-002 | M327: 112.3 | N327: 5.79 | O327: 2.9100000000000001 | P327: 79.27 | Q327: 转股中 | R327: 3.59年 | S327: 1.59年 | T327: 1 | U327: 2727. | V327: 8.5399999999999991 | W327: 1.7000000000000001e-002 | X327: 1.3999999999999999e-002 | Y327: 57 | Z327: 1.49 | AA327: -0.249 | AB327: -0.253 | AC327: -0.34999999999999998 | AD327: -0.35100000000000003 | AE327: 92.35 | AF327: 90.46 | AG327: 0.29 | AH327: AA- | AI327: 6.3299999999999995e-002 | AJ327: =H327+100*O327 -> 601. | AK327: 540.7 | AL327: 329 | AM327: 448.4 | AN327: 330 | AO327: -0.10199999999999999 | AP327: 19 | AQ327: 蓝盾转债!!
A328: 269 | B328: 127008 | C328: 特发转债! | D328: 70 | E328: 特发信息 | F328: 通信互联 | G328: 通信设备 | H328: 252 | I328: -6.7000000000000002e-003 | J328: 1.5700000000000002e-002 | K328: 8.96 | L328: 9.0000000000000011e-003 | M328: 110.5 | N328: 5.54 | O328: 0.55799999999999994 | P328: 161.73 | Q328: 转股中 | R328: 2.85年 | S328: 0.85年 | T328: 0.59 | U328: 601 | V328: 3.9100000000000001 | W328: 8.0000000000000002e-003 | X328: 1.3000000000000001e-002 | Y328: 73 | Z328: 2.58 | AA328: -0.253 | AB328: -0.25700000000000001 | AC328: -0.58499999999999996 | AD328: -0.58599999999999997 | AE328: 97.21 | AF328: 98.73 | AG328: 1 | AH328: AA | AI328: 4.07e-002 | AJ328: =H328+100*O328 -> 307.80000000000001 | AK328: 342.3 | AL328: 323 | AM328: 243.5 | AN328: 322 | AO328: -6.9000000000000006e-002 | AP328: 16 | AQ328: 特发转债!
A329: 305 | B329: 128029 | C329: 太阳转债!! | D329: 2078 | E329: 太阳纸业 | F329: 造纸包装 | G329: 造纸行业 | H329: 204.5 | I329: 1.24e-002 | J329: 1.5e-003 | K329: 16.8 | L329: 1.3899999999999999e-002 | M329: 107 | N329: 8.55 | O329: 4.0999999999999995e-002 | P329: 196.49 | Q329: 转股中 | R329: 1.95年 | S329: 回售中 | T329: 9.09 | U329: 553 | V329: 0.29399999999999998 | W329: 2.1000000000000001e-002 | X329: 4.0000000000000001e-002 | Y329: 441 | Z329: 2.84 | AA329: -0.28300000000000003 | AB329: -0.28800000000000003 | AC329: 回售中 | AD329: 回售中 | AE329: 100.17 | AF329: 99.39 | AG329: 1 | AH329: AA+ | AI329: 3.8699999999999998e-002 | AJ329: =H329+100*O329 -> 208.59999999999999 | AK329: 212.5 | AL329: 308 | AM329: 112.3 | AN329: 305 | AO329: 0.17300000000000001 | AP329: 7 | AQ329: 太阳转债!!
A330: 306 | B330: 128028 | C330: 赣锋转债!! | D330: 2460 | E330: 赣锋锂业 | F330: 有色金属 | G330: 小金属 | H330: 292.3 | I330: -3.3700000000000001e-002 | J330: 1.52e-002 | K330: 123.67 | L330: -1.8500000000000003e-002 | M330: 108.5 | N330: 41.68 | O330: -1.4999999999999999e-002 | P330: 296.71 | Q330: 转股中 | R330: 2.95年 | S330: 0.95年 | T330: 5.77 | U330: 1340. | V330: 0.80599999999999994 | W330: 3.0000000000000001e-003 | X330: 1.e-002 | Y330: 1657. | Z330: 17.76 | AA330: -0.28699999999999998 | AB330: -0.29100000000000004 | AC330: -0.57799999999999996 | AD330: -0.57899999999999996 | AE330: 96.84 | AF330: 96.58 | AG330: 1 | AH330: AA | AI330: 4.07e-002 | AJ330: =H330+100*O330 -> 290.80000000000001 | AK330: 287.9 | AL330: 316 | AM330: 191 | AN330: 315 | AO330: 0.26700000000000002 | AP330: 14 | AQ330: 赣锋转债!!
A331: 281 | B331: 128041 | C331: 盛路转债!! | D331: 2446 | E331: 盛路通信 | F331: 通信互联 | G331: 通信设备 | H331: 375 | I331: 2.7400000000000001e-002 | J331: -2.7400000000000001e-002 | K331: 6.53 | L331: 2.5099999999999997e-002 | M331: 114.3 | N331: 6.82 | O331: 2.9199999999999999 | P331: 95.75 | Q331: 转股中 | R331: 3.52年 | S331: 1.52年 | T331: 0.53 | U331: 5602. | V331: 26.780000000000001 | W331: 9.0000000000000011e-003 | X331: 9.0000000000000011e-003 | Y331: 59 | Z331: 1.97 | AA331: -0.28999999999999998 | AB331: -0.29399999999999998 | AC331: -0.40100000000000002 | AD331: -0.40100000000000002 | AE331: 95.92 | AF331: 99.07 | AG331: 0 | AH331: AA | AI331: 4.2300000000000004e-002 | AJ331: =H331+100*O331 -> 667. | AK331: 654.3 | AL331: 331 | AM331: 555.2 | AN331: 331 | AO331: -2.4e-002 | AP331: 13 | AQ331: 盛路转债!!
A332: 278 | B332: 123013 | C332: 横河转债! | D332: 300539 | E332: 横河模具 | F332: 机械装备 | G332: 专用设备 | H332: 514 | I332: -2.7300000000000001e-002 | J332: 2.3900000000000001e-002 | K332: 6.76 | L332: -1.3100000000000001e-002 | M332: 115.2 | N332: 9.13 | O332: 5.9400000000000004 | P332: 74.04 | Q332: 转股中 | R332: 3.55年 | S332: 1.55年 | T332: 0.38 | U332: 3514. | V332: 17.359999999999999 | W332: 2.5000000000000001e-002 | X332: 1.9e-002 | Y332: 15 | Z332: 3.1 | AA332: -0.34799999999999998 | AB332: -0.35200000000000004 | AC332: -0.434 | AD332: -0.434 | AE332: 91.54 | AF332: 89.9 | AG332: 0.26 | AH332: A+ | AI332: 7.4299999999999991e-002 | AJ332: =H332+100*O332 -> 1108. | AK332: 954 | AL332: 332 | AM332: 862.4 | AN332: 332 | AO332: -0.127 | AP332: 16 | AQ332: 横河转债!
A333: 214 | B333: 123029 | C333: 英科转债! | D333: 300677 | E333: 英科医疗 | F333: 医药 | G333: 医疗器械 | H333: 2276.97 | I333: 3.2199999999999999e-002 | J333: 2.3599999999999999e-002 | K333: 195.38 | L333: 5.6100000000000004e-002 | M333: 138.2 | N333: 11.32 | O333: 0.31900000000000001 | P333: 1725.97 | Q333: 转股中 | R333: 4.60年 | S333: 2.60年 | T333: 1.23 | U333: 1364. | V333: 0.48799999999999999 | W333: 2.e-003 | X333: 3.1e-002 | Y333: 688 | Z333: 7.19 | AA333: -0.40500000000000003 | AB333: -0.40799999999999997 | AC333: -0.28300000000000003 | AD333: -0.28300000000000003 | AE333: 90.8 | AF333: 105.23 | AG333: 0.99 | AH333: AA- | AI333: 6.3299999999999995e-002 | AJ333: =H333+100*O333 -> 2308.8699999999999 | AK333: 2828. | AL333: 333 | AM333: 2722.6999999999998 | AN333: 333 | AO333: 0.20000000000000001 | AP333: 17 | AQ333: 英科转债!
A334: 333 | B334: 113008 | C334: 电气转债! | D334: 601727 | E334: 上海电气 | F334: 能源电力 | G334: 电力设备 | H334: 116.76 | I334: 8.6300000000000002e-002 | J334: 1.1399999999999999e-002 | K334: 6.08 | L334: 9.9499999999999991e-002 | M334: 106.6 | N334: 5.13 | O334: -1.4999999999999999e-002 | P334: 118.52 | Q334: 转股中 | R334: 25天 | S334: 回售中 | T334: 38.6 | U334: 5295. | V334: 1.1699999999999999 | W334: 4.2000000000000003e-002 | X334: 5.0000000000000003e-002 | Y334: 923 | Z334: 1.42 | AA334: -1.393 | AB334: -1.5730000000000002 | AC334: 回售中 | AD334: 回售中 | AE334: 103 | AF334: 106.4 | AG334: 0.98 | AH334: AAA | AI334: 2.7900000000000001e-002 | AJ334: =H334+100*O334 -> 115.26000000000001 | AK334: 115 | AL334: 40 | AM334: 8.6 | AN334: 5 | AO334: 9.6999999999999989e-002 | AP334: 32 | AQ334: 电气转债!