A1: 序号 | B1: 转债代码 | C1: 转债名称 | D1: 股票代码 | E1: 股票名称 | F1: 行业 | G1: 子行业 | H1: 转债价格 | I1: 涨跌 | J1: 日内套利 | K1: 股价 | L1: 涨跌 | M1: 剩余本息 | N1: 转股价格 | O1: 转股溢价率 | P1: 转股价值 | Q1: 距离转股日 | R1: 剩余年限 | S1: 回售年限 | T1: 转债余额 | U1: 转债成交额 | V1: 转债换手率 | W1: 余额/市值 | X1: 余额/股本 | Y1: 股票市值 | Z1: P/B | AA1: 税前收益率 | AB1: 税后收益率 | AC1: 税前回售收益 | AD1: 税后回售收益 | AE1: 回售价值 | AF1: 纯债价值 | AG1: 弹性 | AH1: 信用 | AI1: 折现率 | AJ1: 双低 | AK1: 老式双低 | AL1: 老式排名 | AM1: 新式双低 | AN1: 新式排名 | AO1: MA20乖离 | AP1: 热门度 | AQ1: 转债名称
A2: 279 | B2: 128062 | C2: 亚药转债! | D2: 2370. | E2: 亚太药业 | F2: 医药 | G2: 化学制药 | H2: 78.686 | I2: 2.3999999999999998e-003 | J2: -2.3999999999999998e-003 | K2: 4.26 | L2: 4.6999999999999993e-003 | M2: 119.3 | N2: 16.25 | O2: 2. | P2: 26.22 | Q2: 转股中 | R2: 3.79年 | S2: 1.79年 | T2: 9.63 | U2: 4.4 | V2: 6.0000000000000001e-003 | W2: 0.42100000000000004 | X2: 0.11 | Y2: 23 | Z2: 5.29 | AA2: 0.11900000000000001 | AB2: 0.10800000000000001 | AC2: 0.14800000000000002 | AD2: 0.14400000000000002 | AE2: 81.8 | AF2: 77.05 | AG2: 0 | AH2: BB | AI2: 0.1249 | AJ2: =H2+100*O2 -> 278.68600000000004 | AK2: 131.2 | AL2: 184 | AM2: 49.4 | AN2: 260 | AO2: 1.e-003 | AP2: 85 | AQ2: 亚药转债!
A3: 141 | B3: 113595 | C3: 花王转债! | D3: 603007 | E3: XDST花王 | F3: 城市公用 | G3: 生态环境 | H3: 85.58 | I3: -4.0999999999999995e-003 | J3: 4.0999999999999995e-003 | K3: 3.21 | L3: 0. | M3: 125.3 | N3: 6.92 | O3: 0.84499999999999997 | P3: 46.39 | Q3: 转股中 | R3: 5年32天 | S3: 3年33天 | T3: 3.3 | U3: 5.2 | V3: 1.8000000000000002e-002 | W3: 0.30599999999999999 | X3: 0.14199999999999999 | Y3: 11 | Z3: 0.94 | AA3: 7.980000000000001e-002 | AB3: 7.0599999999999996e-002 | AC3: 6.3299999999999995e-002 | AD3: 6.0400000000000002e-002 | AE3: 85.12 | AF3: 91.61 | AG3: 0.06 | AH3: AA- | AI3: 6.5099999999999991e-002 | AJ3: =H3+100*O3 -> 170.07999999999998 | AK3: 124.8 | AL3: 115 | AM3: 33.2 | AN3: 129 | AO3: 1.4999999999999999e-002 | AP3: 43 | AQ3: 花王转债!
A4: 199 | B4: 128100 | C4: 搜特转债! | D4: 2503. | E4: 搜于特 | F4: 服装纺织 | G4: 服装行业 | H4: 82.795 | I4: 7.1999999999999998e-003 | J4: -3.0999999999999999e-003 | K4: 1.64 | L4: 4.4600000000000001e-002 | M4: 116.9 | N4: 2.9 | O4: 0.46399999999999997 | P4: 56.55 | Q4: 转股中 | R4: 4.73年 | S4: 2.73年 | T4: 7.99 | U4: 11 | V4: 1.6e-002 | W4: 0.158 | X4: 8.900000000000001e-002 | Y4: 51 | Z4: 1.51 | AA4: 7.7300000000000008e-002 | AB4: 7.0199999999999999e-002 | AC4: 8.0399999999999985e-002 | AD4: 7.7800000000000008e-002 | AE4: 91.65 | AF4: 96.2 | AG4: 0.09 | AH4: AA | AI4: 4.2900000000000001e-002 | AJ4: =H4+100*O4 -> 129.19499999999999 | AK4: 109 | AL4: 7 | AM4: 12.8 | AN4: 4 | AO4: -2.9999999999999999e-002 | AP4: 66 | AQ4: 搜特转债!
A5: 186 | B5: 113576 | C5: 起步转债!! | D5: 603557 | E5: ST起步 | F5: 服装纺织 | G5: 鞋服行业 | H5: 90.85 | I5: -7.000000000000001e-004 | J5: 2.0000000000000001e-004 | K5: 4.5 | L5: -6.6e-003 | M5: 121.3 | N5: 10.55 | O5: 1.1299999999999999 | P5: 42.65 | Q5: 转股中 | R5: 4.81年 | S5: 2.81年 | T5: 2.66 | U5: 6.9 | V5: 2.8999999999999998e-002 | W5: 0.11900000000000001 | X5: 5.0999999999999997e-002 | Y5: 22 | Z5: 1.42 | AA5: 6.3500000000000001e-002 | AB5: 5.5199999999999999e-002 | AC5: 4.7699999999999992e-002 | AD5: 4.4699999999999997e-002 | AE5: 81.99 | AF5: 82.75 | AG5: 0.06 | AH5: A | AI5: 8.4900000000000003e-002 | AJ5: =H5+100*O5 -> 203.84999999999997 | AK5: 139 | AL5: 252 | AM5: 56.3 | AN5: 290 | AO5: -6.5000000000000002e-002 | AP5: 33 | AQ5: 起步转债!!
A6: 277 | B6: 128063 | C6: 未来转债! | D6: 2631. | E6: 德尔未来 | F6: 其他 | G6: 家居用品 | H6: 103.811 | I6: 2.e-003 | J6: -7.000000000000001e-004 | K6: 6.16 | L6: 6.5000000000000006e-003 | M6: 127.5 | N6: 8.6 | O6: 0.44900000000000001 | P6: 71.63 | Q6: 转股中 | R6: 3.79年 | S6: 2.79年 | T6: 6.3 | U6: 2.4 | V6: 4.0000000000000001e-003 | W6: 0.154 | X6: 0.11 | Y6: 41 | Z6: 2.43 | AA6: 5.74e-002 | AB6: 4.4600000000000001e-002 | AC6: 1.43e-002 | AD6: 9.0000000000000011e-003 | AE6: 90.42 | AF6: 101.49 | AG6: 0.21 | AH6: AA- | AI6: 6.3899999999999998e-002 | AJ6: =H6+100*O6 -> 148.71100000000001 | AK6: 136 | AL6: 230 | AM6: 34.5 | AN6: 141 | AO6: 1.3000000000000001e-002 | AP6: 32 | AQ6: 未来转债!
A7: 158 | B7: 127018 | C7: 本钢转债! | D7: 761. | E7: 本钢板材 | F7: 钢铁 | G7: 炼钢 | H7: 98.35 | I7: 1.5e-003 | J7: 1.1000000000000001e-003 | K7: 4.19 | L7: 7.1999999999999998e-003 | M7: 128.6 | N7: 5.03 | O7: 0.18100000000000002 | P7: 83.3 | Q7: 转股中 | R7: 5年10天 | S7: 3年11天 | T7: 67.5 | U7: 59 | V7: 9.0000000000000011e-003 | W7: 0.41600000000000004 | X7: 0.34600000000000003 | Y7: 162 | Z7: 0.79 | AA7: 5.67e-002 | AB7: 4.6600000000000003e-002 | AC7: 2.5499999999999998e-002 | AD7: 2.1400000000000002e-002 | AE7: 91.56 | AF7: 101.87 | AG7: 0.36 | AH7: AAA | AI7: 4.9100000000000005e-002 | AJ7: =H7+100*O7 -> 116.44999999999999 | AK7: 113.4 | AL7: 14 | AM7: 11.5 | AN7: 3 | AO7: -2.2000000000000002e-002 | AP7: 62 | AQ7: 本钢转债!
A8: 263 | B8: 123028 | C8: 清水转债! | D8: 300437 | E8: 清水源 | F8: 城市公用 | G8: 三废处理 | H8: 98.58 | I8: 8.0000000000000004e-004 | J8: -4.0000000000000001e-003 | K8: 8.41 | L8: -1.18e-002 | M8: 121.8 | N8: 11.84 | O8: 0.38799999999999996 | P8: 71.03 | Q8: 转股中 | R8: 4年0.2天 | S8: 2年1.2天 | T8: 4.55 | U8: 5.3 | V8: 1.2e-002 | W8: 0.245 | X8: 0.17399999999999999 | Y8: 19 | Z8: 1.67 | AA8: 5.6100000000000004e-002 | AB8: 4.5899999999999996e-002 | AC8: 2.87e-002 | AD8: 2.4300000000000002e-002 | AE8: 91.77 | AF8: 95.8 | AG8: 0.27 | AH8: AA- | AI8: 6.3899999999999998e-002 | AJ8: =H8+100*O8 -> 137.38 | AK8: 126.1 | AL8: 127 | AM8: 30.3 | AN8: 98 | AO8: -4.5999999999999999e-002 | AP8: 52 | AQ8: 清水转债!
A9: 82 | B9: 128138 | C9: 侨银转债! | D9: 2973. | E9: 侨银股份 | F9: 城市公用 | G9: 城市公用 | H9: 102.18 | I9: -2.5000000000000001e-003 | J9: 7.7000000000000002e-003 | K9: 16.6 | L9: 2.3399999999999997e-002 | M9: 136.5 | N9: 25.33 | O9: 0.55899999999999994 | P9: 65.53 | Q9: 转股中 | R9: 5.41年 | S9: 3.42年 | T9: 4.2 | U9: 4.8 | V9: 1.1000000000000001e-002 | W9: 6.2e-002 | X9: 4.0999999999999995e-002 | Y9: 68 | Z9: 4.5 | AA9: 5.6100000000000004e-002 | AB9: 4.4999999999999998e-002 | AC9: 6.0999999999999995e-003 | AD9: 3.7000000000000002e-003 | AE9: 83.51 | AF9: 97.68 | AG9: 0.22 | AH9: AA- | AI9: 6.5099999999999991e-002 | AJ9: =H9+100*O9 -> 158.07999999999998 | AK9: 138.8 | AL9: 250 | AM9: 41.1 | AN9: 205 | AO9: -1.1000000000000001e-002 | AP9: 13 | AQ9: 侨银转债!
A10: 124 | B10: 110072 | C10: 广汇转债! | D10: 600297 | E10: 广汇汽车 | F10: 汽车 | G10: 分销、售 | H10: 88.57 | I10: -2.3e-003 | J10: 3.8e-003 | K10: 2.68 | L10: 7.4999999999999997e-003 | M10: 114.5 | N10: 4.03 | O10: 0.33200000000000002 | P10: 66.5 | Q10: 转股中 | R10: 5.16年 | S10: 3.17年 | T10: 33.7 | U10: 26 | V10: 9.0000000000000011e-003 | W10: 0.155 | X10: 0.10300000000000001 | Y10: 217 | Z10: 0.54 | AA10: 5.1799999999999999e-002 | AB10: 4.6399999999999997e-002 | AC10: 4.6600000000000003e-002 | AD10: 4.4699999999999997e-002 | AE10: 90.14 | AF10: 93.3 | AG10: 0.21 | AH10: AA+ | AI10: 4.1100000000000005e-002 | AJ10: =H10+100*O10 -> 121.77 | AK10: 110.6 | AL10: 10 | AM10: 17.3 | AN10: 10 | AO10: -5.4000000000000006e-002 | AP10: 58 | AQ10: 广汇转债!
A11: 148 | B11: 127019 | C11: 国城转债! | D11: 688. | E11: 国城矿业 | F11: 有色金属 | G11: 锌铅镍锡 | H11: 89.61 | I11: 1.e-004 | J11: -1.e-004 | K11: 9.09 | L11: 0. | M11: 115.1 | N11: 21.07 | O11: 1.0800000000000001 | P11: 43.14 | Q11: 转股中 | R11: 5年26天 | S11: 3年27天 | T11: 8.5 | U11: 7.2 | V11: 9.0000000000000011e-003 | W11: 8.199999999999999e-002 | X11: 3.5000000000000003e-002 | Y11: 103 | Z11: 4.46 | AA11: 5.1699999999999996e-002 | AB11: 4.5899999999999996e-002 | AC11: 4.6300000000000001e-002 | AD11: 4.3899999999999995e-002 | AE11: 90.21 | AF11: 92.88 | AG11: 0.03 | AH11: AA | AI11: 4.41e-002 | AJ11: =H11+100*O11 -> 197.61000000000001 | AK11: 136.1 | AL11: 231 | AM11: 43.2 | AN11: 225 | AO11: -1.1000000000000001e-002 | AP11: 41 | AQ11: 国城转债!
A12: 364 | B12: 127003 | C12: 海印转债! | D12: 861. | E12: 海印股份 | F12: 商业零售 | G12: 商场 | H12: 104.831 | I12: 5.9999999999999995e-004 | J12: -5.0000000000000001e-004 | K12: 2.05 | L12: 4.8999999999999998e-003 | M12: 110 | N12: 3 | O12: 0.53400000000000003 | P12: 68.33 | Q12: 转股中 | R12: 0.97年 | S12: 回售内 | T12: 6.74 | U12: 4.1 | V12: 6.0000000000000001e-003 | W12: 0.14099999999999999 | X12: 9.6999999999999989e-002 | Y12: 48 | Z12: 1.25 | AA12: 5.0700000000000002e-002 | AB12: 3.1099999999999999e-002 | AC12: 回售内 | AD12: 回售内 | AE12: 100.33 | AF12: 106.05 | AG12: 0.01 | AH12: AA | AI12: 3.8300000000000001e-002 | AJ12: =H12+100*O12 -> 158.23099999999999 | AK12: 141.3 | AL12: 266 | AM12: 35.3 | AN12: 152 | AO12: -6.0999999999999999e-002 | AP12: 71 | AQ12: 海印转债!
A13: 282 | B13: 113530 | C13: 大丰转债! | D13: 603081 | E13: 大丰实业 | F13: 建筑 | G13: 装饰工程 | H13: 101.37 | I13: 1.e-003 | J13: 3.0000000000000001e-003 | K13: 11.45 | L13: 3.15e-002 | M13: 121 | N13: 16.49 | O13: 0.46000000000000002 | P13: 69.44 | Q13: 转股中 | R13: 3.77年 | S13: 1.77年 | T13: 6.3 | U13: 1 | V13: 2.e-003 | W13: 0.13699999999999998 | X13: 9.5000000000000001e-002 | Y13: 46 | Z13: 2.07 | AA13: 4.9000000000000002e-002 | AB13: 3.8900000000000004e-002 | AC13: 7.9000000000000008e-003 | AD13: 4.8999999999999998e-003 | AE13: 94.92 | AF13: 103.59 | AG13: 0.13 | AH13: AA | AI13: 4.2900000000000001e-002 | AJ13: =H13+100*O13 -> 147.37 | AK13: 133.3 | AL13: 208 | AM13: 29.7 | AN13: 89 | AO13: -6.9999999999999993e-003 | AP13: 33 | AQ13: 大丰转债!
A14: 125 | B14: 113600 | C14: 新星转债! | D14: 603978 | E14: 深圳新星 | F14: 有色金属 | G14: 有色行业 | H14: 99.03 | I14: 2.e-003 | J14: -7.4000000000000003e-003 | K14: 18.17 | L14: -1.41e-002 | M14: 126 | N14: 23.85 | O14: 0.29999999999999999 | P14: 76.18 | Q14: 转股中 | R14: 5年55天 | S14: 3年56天 | T14: 5.95 | U14: 3.6 | V14: 6.0000000000000001e-003 | W14: 0.20499999999999999 | X14: 0.156 | Y14: 29 | Z14: 1.9 | AA14: 4.8899999999999999e-002 | AB14: 4.0000000000000001e-002 | AC14: 1.4800000000000001e-002 | AD14: 1.24e-002 | AE14: 84.49 | AF14: 91.68 | AG14: 0.38 | AH14: AA- | AI14: 6.5099999999999991e-002 | AJ14: =H14+100*O14 -> 129.03 | AK14: 121.9 | AL14: 78 | AM14: 30.2 | AN14: 94 | AO14: 5.7999999999999996e-002 | AP14: 22 | AQ14: 新星转债!
A15: 204 | B15: 113569 | C15: 科达转债! | D15: 603660 | E15: 苏州科达 | F15: 通信互联 | G15: 物联网 | H15: 96.75 | I15: -1.7000000000000001e-003 | J15: 1.7000000000000001e-003 | K15: 7.12 | L15: 0. | M15: 120.3 | N15: 14.8 | O15: 1.01 | P15: 48.11 | Q15: 转股中 | R15: 4.72年 | S15: 2.72年 | T15: 5.16 | U15: 1.6 | V15: 3.0000000000000001e-003 | W15: 0.14499999999999999 | X15: 7.0000000000000007e-002 | Y15: 36 | Z15: 1.97 | AA15: 4.82e-002 | AB15: 4.0300000000000002e-002 | AC15: 2.4300000000000002e-002 | AD15: 2.18e-002 | AE15: 86.81 | AF15: 90.35 | AG15: 0.07 | AH15: AA- | AI15: 6.3899999999999998e-002 | AJ15: =H15+100*O15 -> 197.75 | AK15: 145.4 | AL15: 285 | AM15: 55 | AN15: 286 | AO15: 1.7000000000000001e-002 | AP15: 27 | AQ15: 科达转债!
A16: 292 | B16: 110052 | C16: 贵广转债! | D16: 600996 | E16: 贵广网络 | F16: 传媒娱乐 | G16: 影视娱乐 | H16: 99.2 | I16: 1.e-003 | J16: -1.2999999999999999e-003 | K16: 4.38 | L16: -9.0000000000000011e-003 | M16: 117.7 | N16: 7.94 | O16: 0.79799999999999993 | P16: 55.16 | Q16: 转股中 | R16: 3.71年 | S16: 1.71年 | T16: 15.3 | U16: 2 | V16: 1.e-003 | W16: 0.33100000000000002 | X16: 0.183 | Y16: 46 | Z16: 1.09 | AA16: 4.8099999999999997e-002 | AB16: 3.9199999999999999e-002 | AC16: 2.0499999999999997e-002 | AD16: 1.7299999999999999e-002 | AE16: 95.78 | AF16: 102.08 | AG16: 0.04 | AH16: AA+ | AI16: 3.9900000000000005e-002 | AJ16: =H16+100*O16 -> 179. | AK16: 143.2 | AL16: 276 | AM16: 41.2 | AN16: 206 | AO16: -4.5999999999999999e-002 | AP16: 18 | AQ16: 贵广转债!
A17: 227 | B17: 110064 | C17: 建工转债! | D17: 600939 | E17: 重庆建工 | F17: 建筑 | G17: 建筑工程 | H17: 97.93 | I17: 2.9999999999999997e-004 | J17: -2.9999999999999997e-004 | K17: 3.54 | L17: 0. | M17: 119.8 | N17: 4.57 | O17: 0.26400000000000001 | P17: 77.46 | Q17: 转股中 | R17: 4.50年 | S17: 2.51年 | T17: 16.6 | U17: 6.3 | V17: 4.0000000000000001e-003 | W17: 0.25800000000000001 | X17: 0.20000000000000001 | Y17: 64 | Z17: 0.91 | AA17: 4.6900000000000004e-002 | AB17: 3.8800000000000001e-002 | AC17: 2.35e-002 | AD17: 2.0400000000000001e-002 | AE17: 93.89 | AF17: 100.87 | AG17: 0.25 | AH17: AA+ | AI17: 3.9900000000000005e-002 | AJ17: =H17+100*O17 -> 124.33000000000001 | AK17: 118.4 | AL17: 43 | AM17: 17.5 | AN17: 11 | AO17: -1.8000000000000002e-002 | AP17: 44 | AQ17: 建工转债!
A18: 179 | B18: 113573 | C18: 纵横转债! | D18: 603602 | E18: 纵横通信 | F18: 通信互联 | G18: 通信设备 | H18: 100.18 | I18: 5.7999999999999996e-003 | J18: -3.4000000000000002e-003 | K18: 11.02 | L18: 1.1899999999999999e-002 | M18: 124.2 | N18: 18.78 | O18: 0.70700000000000007 | P18: 58.68 | Q18: 转股中 | R18: 4.83年 | S18: 2.83年 | T18: 2.7 | U18: 3.6 | V18: 1.3000000000000001e-002 | W18: 0.12 | X18: 7.0000000000000007e-002 | Y18: 22 | Z18: 3.17 | AA18: 4.6600000000000003e-002 | AB18: 3.7599999999999995e-002 | AC18: 1.3100000000000001e-002 | AD18: 1.04e-002 | AE18: 84.04 | AF18: 88.32 | AG18: 0.2 | AH18: A+ | AI18: 7.4900000000000008e-002 | AJ18: =H18+100*O18 -> 170.88 | AK18: 141.7 | AL18: 271 | AM18: 53.4 | AN18: 278 | AO18: 4.2999999999999997e-002 | AP18: 24 | AQ18: 纵横转债!
A19: 133 | B19: 113596 | C19: 城地转债! | D19: 603887 | E19: 城地香江 | F19: 通信互联 | G19: 通信设备 | H19: 90.47 | I19: -4.0000000000000002e-004 | J19: 1.2999999999999999e-003 | K19: 12.7 | L19: 2.3399999999999997e-002 | M19: 113.5 | N19: 29.21 | O19: 1.0800000000000001 | P19: 43.48 | Q19: 转股中 | R19: 5年39天 | S19: 3年40天 | T19: 12 | U19: 7.1 | V19: 6.9999999999999993e-003 | W19: 0.252 | X19: 0.109 | Y19: 48 | Z19: 1.25 | AA19: 4.6500000000000007e-002 | AB19: 4.1299999999999996e-002 | AC19: 4.3499999999999997e-002 | AD19: 4.0999999999999995e-002 | AE19: 84.66 | AF19: 82.86 | AG19: 0.04 | AH19: AA- | AI19: 6.5099999999999991e-002 | AJ19: =H19+100*O19 -> 198.47 | AK19: 137.5 | AL19: 238 | AM19: 52.8 | AN19: 274 | AO19: 4.2000000000000003e-002 | AP19: 25 | AQ19: 城地转债!
A20: 339 | B20: 113017 | C20: 吉视转债! | D20: 601929 | E20: 吉视传媒 | F20: 传媒娱乐 | G20: 影视娱乐 | H20: 97.34 | I20: 7.000000000000001e-004 | J20: -7.000000000000001e-004 | K20: 1.87 | L20: 0. | M20: 108.8 | N20: 2.95 | O20: 0.53600000000000003 | P20: 63.39 | Q20: 转股中 | R20: 2.53年 | S20: 0.53年 | T20: 15.6 | U20: 8.8 | V20: 6.0000000000000001e-003 | W20: 0.26800000000000002 | X20: 0.17000000000000001 | Y20: 58 | Z20: 0.88 | AA20: 4.58e-002 | AB20: 3.8800000000000001e-002 | AC20: 6.3200000000000006e-002 | AD20: 5.8499999999999996e-002 | AE20: 98.94 | AF20: 99.07 | AG20: 0.05 | AH20: AA+ | AI20: 3.8399999999999997e-002 | AJ20: =H20+100*O20 -> 150.94 | AK20: 131.3 | AL20: 186 | AM20: 32.2 | AN20: 115 | AO20: -1.6e-002 | AP20: 65 | AQ20: 吉视转债!
A21: 268 | B21: 113535 | C21: 大业转债! | D21: 603278 | E21: 大业股份 | F21: 汽车 | G21: 零部件制 | H21: 99.01 | I21: -2.e-003 | J21: 2.8000000000000004e-003 | K21: 8.4 | L21: 7.1999999999999998e-003 | M21: 112.5 | N21: 12.4 | O21: 0.46200000000000002 | P21: 67.74 | Q21: 转股中 | R21: 2.89年 | S21: 0.89年 | T21: 5 | U21: 3.4 | V21: 6.9999999999999993e-003 | W21: 0.20499999999999999 | X21: 0.13900000000000001 | Y21: 24 | Z21: 1.42 | AA21: 4.5700000000000005e-002 | AB21: 3.7400000000000003e-002 | AC21: 2.1400000000000002e-002 | AD21: 1.9e-002 | AE21: 97.01 | AF21: 100.18 | AG21: 0.11 | AH21: AA | AI21: 4.1399999999999999e-002 | AJ21: =H21+100*O21 -> 145.21000000000001 | AK21: 130.3 | AL21: 174 | AM21: 30.1 | AN21: 93 | AO21: -8.0000000000000002e-003 | AP21: 48 | AQ21: 大业转债!
A22: 311 | B22: 128044 | C22: 岭南转债! | D22: 2717. | E22: 岭南股份 | F22: 城市公用 | G22: 生态环境 | H22: 97.005 | I22: -1.1000000000000001e-003 | J22: 1.2999999999999999e-003 | K22: 3.11 | L22: 6.5000000000000006e-003 | M22: 111.3 | N22: 5.91 | O22: 0.84299999999999997 | P22: 52.62 | Q22: 转股中 | R22: 3年56天 | S22: 1年57天 | T22: 6.59 | U22: 8.8 | V22: 1.3999999999999999e-002 | W22: 0.13900000000000001 | X22: 7.2999999999999995e-002 | Y22: 48 | Z22: 1.09 | AA22: 4.5599999999999995e-002 | AB22: 3.85e-002 | AC22: 4.53e-002 | AD22: 4.0899999999999999e-002 | AE22: 97.3 | AF22: 97.78 | AG22: 0.03 | AH22: AA | AI22: 4.2900000000000001e-002 | AJ22: =H22+100*O22 -> 181.30500000000001 | AK22: 141.4 | AL22: 268 | AM22: 43.6 | AN22: 232 | AO22: -7.0999999999999994e-002 | AP22: 45 | AQ22: 岭南转债!
A23: 309 | B23: 113519 | C23: 长久转债! | D23: 603569 | E23: 长久物流 | F23: 交通运输 | G23: 物流业 | H23: 103 | I23: -2.9999999999999997e-004 | J23: 5.0000000000000001e-004 | K23: 7.77 | L23: 1.2999999999999999e-003 | M23: 119.3 | N23: 11.04 | O23: 0.46299999999999997 | P23: 70.38 | Q23: 转股中 | R23: 3.39年 | S23: 1.39年 | T23: 6.97 | U23: 2 | V23: 3.0000000000000001e-003 | W23: 0.16 | X23: 0.113 | Y23: 44 | Z23: 1.99 | AA23: 4.5199999999999997e-002 | AB23: 3.4799999999999998e-002 | AC23: -1.2999999999999999e-003 | AD23: -4.7999999999999996e-003 | AE23: 96.35 | AF23: 103.77 | AG23: 0.13 | AH23: AA | AI23: 4.2900000000000001e-002 | AJ23: =H23+100*O23 -> 149.30000000000001 | AK23: 135.6 | AL23: 224 | AM23: 31.9 | AN23: 113 | AO23: 0. | AP23: 20 | AQ23: 长久转债!
A24: 122 | B24: 128127 | C24: 文科转债! | D24: 2775. | E24: 文科园林 | F24: 城市公用 | G24: 生态环境 | H24: 97.749 | I24: 7.000000000000001e-004 | J24: 3.0999999999999999e-003 | K24: 4.37 | L24: 6.8999999999999999e-003 | M24: 121.3 | N24: 4.88 | O24: 9.1999999999999998e-002 | P24: 89.55 | Q24: 转股中 | R24: 5.17年 | S24: 3.17年 | T24: 9.5 | U24: 6.2 | V24: 6.9999999999999993e-003 | W24: 0.42399999999999999 | X24: 0.38 | Y24: 22 | Z24: 0.95 | AA24: 4.3700000000000003e-002 | AB24: 3.6200000000000003e-002 | AC24: 1.9699999999999999e-002 | AD24: 1.7100000000000001e-002 | AE24: 84.68 | AF24: 88.25 | AG24: 0.55 | AH24: AA- | AI24: 6.5099999999999991e-002 | AJ24: =H24+100*O24 -> 106.949 | AK24: 105.9 | AL24: 1 | AM24: 17.7 | AN24: 13 | AO24: -3.0000000000000001e-003 | AP24: 48 | AQ24: 文科转债!
A25: 154 | B25: 128117 | C25: 道恩转债! | D25: 2838. | E25: 道恩股份 | F25: 化工 | G25: 橡胶塑料 | H25: 100.1 | I25: 8.9999999999999998e-004 | J25: 2.0000000000000001e-004 | K25: 17.87 | L25: 5.1000000000000004e-003 | M25: 123.5 | N25: 28.83 | O25: 0.61499999999999999 | P25: 61.98 | Q25: 转股中 | R25: 5年13天 | S25: 3年14天 | T25: 3.6 | U25: 3.1 | V25: 9.0000000000000011e-003 | W25: 4.9000000000000002e-002 | X25: 3.1e-002 | Y25: 73 | Z25: 3.84 | AA25: 4.3499999999999997e-002 | AB25: 3.5200000000000002e-002 | AC25: 1.1599999999999999e-002 | AD25: 9.300000000000001e-003 | AE25: 85.04 | AF25: 90.51 | AG25: 0.22 | AH25: AA- | AI25: 6.5099999999999991e-002 | AJ25: =H25+100*O25 -> 161.59999999999999 | AK25: 138.2 | AL25: 246 | AM25: 47.7 | AN25: 252 | AO25: -3.7999999999999999e-002 | AP25: 22 | AQ25: 道恩转债!
A26: 318 | B26: 123011 | C26: 德尔转债! | D26: 300473 | E26: 德尔股份 | F26: 汽车 | G26: 零部件制 | H26: 102.48 | I26: 8.6999999999999994e-003 | J26: -5.3e-003 | K26: 19.5 | L26: 2.8500000000000001e-002 | M26: 116.3 | N26: 31.38 | O26: 0.64900000000000002 | P26: 62.14 | Q26: 转股中 | R26: 3年29天 | S26: 1年30天 | T26: 2.51 | U26: 4.3 | V26: 1.7000000000000001e-002 | W26: 9.5000000000000001e-002 | X26: 5.9000000000000004e-002 | Y26: 26 | Z26: 1.19 | AA26: 4.2900000000000001e-002 | AB26: 3.3000000000000002e-002 | AC26: 2.5000000000000001e-003 | AD26: -1.9e-003 | AE26: 95.23 | AF26: 96.51 | AG26: 0.12 | AH26: AA- | AI26: 6.3899999999999998e-002 | AJ26: =H26+100*O26 -> 167.38 | AK26: 142.8 | AL26: 274 | AM26: 46.3 | AN26: 247 | AO26: -5.2000000000000005e-002 | AP26: 42 | AQ26: 德尔转债!
A27: 358 | B27: 128015 | C27: 久其转债! | D27: 2279. | E27: 久其软件 | F27: 计算机及 | G27: 软件开发 | H27: 100.88 | I27: -3.4999999999999996e-003 | J27: -1.1000000000000001e-003 | K27: 5.4 | L27: -2.8799999999999999e-002 | M27: 109.5 | N27: 6.97 | O27: 0.30199999999999999 | P27: 77.47 | Q27: 转股中 | R27: 1.97年 | S27: 回售内 | T27: 7.8 | U27: 18 | V27: 2.3e-002 | W27: 0.20300000000000001 | X27: 0.157 | Y27: 38 | Z27: 4.46 | AA27: 4.2800000000000005e-002 | AB27: 3.3399999999999999e-002 | AC27: 回售内 | AD27: 回售内 | AE27: 100.25 | AF27: 95.32 | AG27: 0.16 | AH27: A+ | AI27: 7.3399999999999993e-002 | AJ27: =H27+100*O27 -> 131.07999999999998 | AK27: 124.3 | AL27: 110 | AM27: 24 | AN27: 30 | AO27: 5.2000000000000005e-002 | AP27: 66 | AQ27: 久其转债!
A28: 201 | B28: 123044 | C28: 红相转债!! | D28: 300427 | E28: 红相股份 | F28: 能源电力 | G28: 电力设备 | H28: 103.189 | I28: 6.5000000000000006e-003 | J28: 1.6000000000000001e-003 | K28: 14.1 | L28: 2.3199999999999998e-002 | M28: 125 | N28: 18.67 | O28: 0.36599999999999999 | P28: 75.52 | Q28: 转股中 | R28: 4.73年 | S28: 2.73年 | T28: 5.5 | U28: 11 | V28: 2.e-002 | W28: 0.10800000000000001 | X28: 8.199999999999999e-002 | Y28: 51 | Z28: 2.17 | AA28: 4.24e-002 | AB28: 3.3099999999999997e-002 | AC28: 4.4000000000000003e-003 | AD28: 1.4000000000000002e-003 | AE28: 87.52 | AF28: 93.95 | AG28: 0.35 | AH28: AA- | AI28: 6.3899999999999998e-002 | AJ28: =H28+100*O28 -> 139.78899999999999 | AK28: 130.9 | AL28: 180 | AM28: 36.9 | AN28: 170 | AO28: 7.2999999999999995e-002 | AP28: 21 | AQ28: 红相转债!!
A29: 159 | B29: 113589 | C29: 天创转债! | D29: 603608 | E29: 天创时尚 | F29: 服装纺织 | G29: 鞋服行业 | H29: 94.06 | I29: -5.1999999999999998e-003 | J29: 4.3e-003 | K29: 6.34 | L29: -1.2500000000000001e-002 | M29: 115.3 | N29: 12.29 | O29: 0.82299999999999995 | P29: 51.59 | Q29: 转股中 | R29: 5年5.2天 | S29: 3年6.2天 | T29: 6 | U29: 4.8 | V29: 9.0000000000000011e-003 | W29: 0.221 | X29: 0.114 | Y29: 27 | Z29: 1.67 | AA29: 4.24e-002 | AB29: 3.6499999999999998e-002 | AC29: 3.1800000000000002e-002 | AD29: 2.9300000000000003e-002 | AE29: 90.63 | AF29: 93.31 | AG29: 0.07 | AH29: AA | AI29: 4.41e-002 | AJ29: =H29+100*O29 -> 176.36000000000001 | AK29: 136.5 | AL29: 233 | AM29: 43.2 | AN29: 226 | AO29: -9.4e-002 | AP29: 28 | AQ29: 天创转债!
A30: 264 | B30: 113027 | C30: 华钰转债!! | D30: 601020 | E30: ST华钰 | F30: 有色金属 | G30: 锌铅镍锡 | H30: 97.32 | I30: -1.4000000000000002e-003 | J30: -1.5e-003 | K30: 7.4 | L30: -8.0000000000000002e-003 | M30: 114.3 | N30: 10.17 | O30: 0.33700000000000002 | P30: 72.76 | Q30: 转股中 | R30: 3.99年 | S30: 1.99年 | T30: 3.25 | U30: 10 | V30: 3.2000000000000001e-002 | W30: 7.9000000000000001e-002 | X30: 5.7999999999999996e-002 | Y30: 41 | Z30: 1.65 | AA30: 4.1900000000000007e-002 | AB30: 3.5099999999999999e-002 | AC30: 2.5899999999999999e-002 | AD30: 2.3300000000000001e-002 | AE30: 86.34 | AF30: 83.08 | AG30: 0.36 | AH30: A | AI30: 8.4900000000000003e-002 | AJ30: =H30+100*O30 -> 131.01999999999998 | AK30: 121.9 | AL30: 79 | AM30: 35.5 | AN30: 158 | AO30: 3.4000000000000002e-002 | AP30: 46 | AQ30: 华钰转债!!
A31: 302 | B31: 113524 | C31: 奇精转债! | D31: 603677 | E31: 奇精机械 | F31: 家电 | G31: 零部件制 | H31: 101.98 | I31: 5.4000000000000003e-003 | J31: 3.8e-003 | K31: 11.2 | L31: 2.6600000000000002e-002 | M31: 117.3 | N31: 13.98 | O31: 0.27300000000000002 | P31: 80.11 | Q31: 转股中 | R31: 3.49年 | S31: 1.49年 | T31: 3.3 | U31: 4.4 | V31: 1.3000000000000001e-002 | W31: 0.153 | X31: 0.12300000000000001 | Y31: 22 | Z31: 2.19 | AA31: 4.1799999999999997e-002 | AB31: 3.2599999999999997e-002 | AC31: 4.8999999999999998e-003 | AD31: 1.5e-003 | AE31: 92.85 | AF31: 94.91 | AG31: 0.35 | AH31: AA- | AI31: 6.3899999999999998e-002 | AJ31: =H31+100*O31 -> 129.28 | AK31: 123.8 | AL31: 103 | AM31: 28.9 | AN31: 83 | AO31: 3.3000000000000002e-002 | AP31: 44 | AQ31: 奇精转债!
A32: 229 | B32: 128085 | C32: 鸿达转债! | D32: 2002. | E32: 鸿达兴业 | F32: 化工 | G32: 化工 | H32: 103.967 | I32: -4.3e-003 | J32: 4.3e-003 | K32: 3.99 | L32: 0. | M32: 124.4 | N32: 3.92 | O32: 2.1000000000000001e-002 | P32: 101.79 | Q32: 转股中 | R32: 4.49年 | S32: 2.50年 | T32: 7.78 | U32: 25 | V32: 3.1e-002 | W32: 6.5000000000000002e-002 | X32: 6.6000000000000003e-002 | Y32: 120 | Z32: 1.37 | AA32: 4.1700000000000001e-002 | AB32: 3.2099999999999997e-002 | AC32: -2.0000000000000001e-004 | AD32: -3.0999999999999999e-003 | AE32: 71.11 | AF32: 66.19 | AG32: 0.84 | AH32: B | AI32: 0.15490000000000001 | AJ32: =H32+100*O32 -> 106.06699999999999 | AK32: 106.1 | AL32: 2 | AM32: 35 | AN32: 149 | AO32: -5.0999999999999997e-002 | AP32: 100 | AQ32: 鸿达转债!
A33: 262 | B33: 128069 | C33: 华森转债! | D33: 2907. | E33: 华森制药 | F33: 医药 | G33: 化学制药 | H33: 102.337 | I33: 1.e-003 | J33: -3.4999999999999996e-003 | K33: 12.98 | L33: -9.1999999999999998e-003 | M33: 120 | N33: 18.04 | O33: 0.42200000000000004 | P33: 71.95 | Q33: 转股中 | R33: 4年5.2天 | S33: 2年6.2天 | T33: 3 | U33: 4.2 | V33: 1.3999999999999999e-002 | W33: 5.7000000000000002e-002 | X33: 4.0999999999999995e-002 | Y33: 52 | Z33: 4.59 | AA33: 4.1399999999999999e-002 | AB33: 3.2300000000000002e-002 | AC33: 5.3e-003 | AD33: 2.0999999999999999e-003 | AE33: 90.58 | AF33: 94.13 | AG33: 0.27 | AH33: AA- | AI33: 6.3899999999999998e-002 | AJ33: =H33+100*O33 -> 144.53700000000001 | AK33: 132.7 | AL33: 200 | AM33: 38.6 | AN33: 185 | AO33: 2.e-003 | AP33: 45 | AQ33: 华森转债!
A34: 76 | B34: 128139 | C34: 祥鑫转债! | D34: 2965. | E34: 祥鑫科技 | F34: 汽车 | G34: 零部件制 | H34: 97.6 | I34: 1.1999999999999999e-003 | J34: 3.0000000000000001e-003 | K34: 24.31 | L34: 1.38e-002 | M34: 121 | N34: 36.96 | O34: 0.48399999999999999 | P34: 65.77 | Q34: 转股中 | R34: 5.45年 | S34: 3.46年 | T34: 6.47 | U34: 1.2 | V34: 2.e-003 | W34: 0.17699999999999999 | X34: 0.11599999999999999 | Y34: 37 | Z34: 2.07 | AA34: 4.1100000000000005e-002 | AB34: 3.4099999999999998e-002 | AC34: 1.77e-002 | AD34: 1.55e-002 | AE34: 82.9 | AF34: 86.41 | AG34: 0.3 | AH34: AA- | AI34: 6.5099999999999991e-002 | AJ34: =H34+100*O34 -> 146. | AK34: 129.4 | AL34: 162 | AM34: 43 | AN34: 223 | AO34: 6.9999999999999993e-003 | AP34: 13 | AQ34: 祥鑫转债!
A35: 112 | B35: 128132 | C35: 交建转债! | D35: 2941. | E35: 新疆交建 | F35: 建筑 | G35: 建筑工程 | H35: 95.5 | I35: -3.0999999999999999e-003 | J35: 3.7000000000000002e-003 | K35: 10.61 | L35: 5.6999999999999993e-003 | M35: 117.3 | N35: 18.57 | O35: 0.67099999999999993 | P35: 57.14 | Q35: 转股中 | R35: 5.24年 | S35: 3.24年 | T35: 8.5 | U35: 3.1 | V35: 4.0000000000000001e-003 | W35: 0.124 | X35: 7.0999999999999994e-002 | Y35: 68 | Z35: 2.82 | AA35: 4.0899999999999999e-002 | AB35: 3.4700000000000002e-002 | AC35: 2.5000000000000001e-002 | AD35: 2.2700000000000001e-002 | AE35: 89.74 | AF35: 93.99 | AG35: 0.11 | AH35: AA | AI35: 4.41e-002 | AJ35: =H35+100*O35 -> 162.59999999999999 | AK35: 133.9 | AL35: 213 | AM35: 39.9 | AN35: 194 | AO35: -3.3000000000000002e-002 | AP35: 19 | AQ35: 交建转债!
A36: 306 | B36: 128049 | C36: 华源转债! | D36: 2787. | E36: 华源控股 | F36: 造纸包装 | G36: 包装材料 | H36: 100.091 | I36: 3.0000000000000001e-003 | J36: -4.1999999999999997e-003 | K36: 5.66 | L36: -3.4999999999999996e-003 | M36: 114.5 | N36: 7.37 | O36: 0.30299999999999999 | P36: 76.8 | Q36: 转股中 | R36: 3.44年 | S36: 1.44年 | T36: 3.63 | U36: 0.6 | V36: 2.e-003 | W36: 0.20300000000000001 | X36: 0.156 | Y36: 18 | Z36: 1.2 | AA36: 4.07e-002 | AB36: 3.27e-002 | AC36: 1.7100000000000001e-002 | AD36: 1.3500000000000002e-002 | AE36: 93.15 | AF36: 92.93 | AG36: 0.33 | AH36: AA- | AI36: 6.3899999999999998e-002 | AJ36: =H36+100*O36 -> 130.39099999999999 | AK36: 123.4 | AL36: 94 | AM36: 30.2 | AN36: 95 | AO36: -1.7000000000000001e-002 | AP36: 44 | AQ36: 华源转债!
A37: 103 | B37: 123069 | C37: 金诺转债! | D37: 300505 | E37: 川金诺 | F37: 化工 | G37: 农化 | H37: 102.312 | I37: -3.2500000000000001e-002 | J37: 1.3500000000000002e-002 | K37: 16.56 | L37: -3.8300000000000001e-002 | M37: 126 | N37: 19.15 | O37: 0.183 | P37: 86.48 | Q37: 转股中 | R37: 5.33年 | S37: 3.33年 | T37: 3.68 | U37: 137 | V37: 0.36099999999999999 | W37: 0.17000000000000001 | X37: 0.14699999999999999 | Y37: 22 | Z37: 2.29 | AA37: 4.07e-002 | AB37: 3.2199999999999999e-002 | AC37: 4.5000000000000005e-003 | AD37: 2.3e-003 | AE37: 83.56 | AF37: 90.67 | AG37: 0.5 | AH37: AA- | AI37: 6.5099999999999991e-002 | AJ37: =H37+100*O37 -> 120.61199999999999 | AK37: 118.1 | AL37: 41 | AM37: 27.5 | AN37: 63 | AO37: 0.111 | AP37: 18 | AQ37: 金诺转债!
A38: 285 | B38: 123023 | C38: 迪森转债! | D38: 300335 | E38: 迪森股份 | F38: 能源电力 | G38: 电力供应 | H38: 98.804 | I38: 1.9e-003 | J38: 2.0999999999999999e-003 | K38: 5 | L38: 1.83e-002 | M38: 114.3 | N38: 6.89 | O38: 0.36200000000000004 | P38: 72.57 | Q38: 转股中 | R38: 3.75年 | S38: 2.75年 | T38: 5.29 | U38: 4.5 | V38: 9.0000000000000011e-003 | W38: 0.28399999999999997 | X38: 0.20600000000000002 | Y38: 19 | Z38: 1.34 | AA38: 4.0399999999999998e-002 | AB38: 3.3099999999999997e-002 | AC38: 2.0099999999999996e-002 | AD38: 1.6899999999999998e-002 | AE38: 92.71 | AF38: 97.92 | AG38: 0.22 | AH38: AA | AI38: 4.2900000000000001e-002 | AJ38: =H38+100*O38 -> 135.00400000000002 | AK38: 125 | AL38: 118 | AM38: 27.1 | AN38: 58 | AO38: 1.3000000000000001e-002 | AP38: 50 | AQ38: 迪森转债!
A39: 321 | B39: 123010 | C39: 博世转债! | D39: 300422 | E39: 博世科 | F39: 城市公用 | G39: 三废处理 | H39: 99.93 | I39: 1.8e-003 | J39: -8.0000000000000004e-004 | K39: 8.5 | L39: 5.8999999999999999e-003 | M39: 112.3 | N39: 12.2 | O39: 0.434 | P39: 69.67 | Q39: 转股中 | R39: 3年16天 | S39: 1年17天 | T39: 4.3 | U39: 2.1 | V39: 5.0000000000000001e-003 | W39: 0.125 | X39: 8.6999999999999994e-002 | Y39: 34 | Z39: 1.42 | AA39: 4.0000000000000001e-002 | AB39: 3.2199999999999999e-002 | AC39: 2.3900000000000001e-002 | AD39: 1.9199999999999998e-002 | AE39: 95.44 | AF39: 93.42 | AG39: 0.17 | AH39: AA- | AI39: 6.3899999999999998e-002 | AJ39: =H39+100*O39 -> 143.33000000000001 | AK39: 130.2 | AL39: 173 | AM39: 34.7 | AN39: 143 | AO39: -4.0000000000000001e-003 | AP39: 30 | AQ39: 博世转债!
A40: 255 | B40: 128072 | C40: 翔鹭转债! | D40: 2842. | E40: 翔鹭钨业 | F40: 有色金属 | G40: 小金属 | H40: 98.3 | I40: -3.8e-003 | J40: -4.0000000000000002e-004 | K40: 8.74 | L40: -2.7799999999999998e-002 | M40: 115.1 | N40: 15.34 | O40: 0.72499999999999998 | P40: 56.98 | Q40: 转股中 | R40: 4.17年 | S40: 2.17年 | T40: 3.02 | U40: 5.1 | V40: 1.7000000000000001e-002 | W40: 0.126 | X40: 7.2000000000000008e-002 | Y40: 24 | Z40: 2.56 | AA40: 3.95e-002 | AB40: 3.2599999999999997e-002 | AC40: 2.23e-002 | AD40: 1.9299999999999998e-002 | AE40: 89.63 | AF40: 89.42 | AG40: 0.15 | AH40: AA- | AI40: 6.3899999999999998e-002 | AJ40: =H40+100*O40 -> 170.80000000000001 | AK40: 139.6 | AL40: 257 | AM40: 50 | AN40: 262 | AO40: -5.4000000000000006e-002 | AP40: 29 | AQ40: 翔鹭转债!
A41: 79 | B41: 123077 | C41: 汉得转债! | D41: 300170 | E41: 汉得信息 | F41: 计算机及 | G41: 软件开发 | H41: 102.102 | I41: 9.7999999999999997e-003 | J41: -7.7000000000000002e-003 | K41: 7.82 | L41: 6.4000000000000003e-003 | M41: 125.5 | N41: 9.69 | O41: 0.26500000000000001 | P41: 80.7 | Q41: 转股中 | R41: 5.43年 | S41: 3.43年 | T41: 9.37 | U41: 9.8 | V41: 1.e-002 | W41: 0.13600000000000001 | X41: 0.109 | Y41: 69 | Z41: 2.18 | AA41: 3.95e-002 | AB41: 3.1300000000000001e-002 | AC41: 4.6999999999999993e-003 | AD41: 2.5999999999999999e-003 | AE41: 89.04 | AF41: 99.72 | AG41: 0.33 | AH41: AA | AI41: 4.41e-002 | AJ41: =H41+100*O41 -> 128.602 | AK41: 123.5 | AL41: 100 | AM41: 23.8 | AN41: 27 | AO41: 8.900000000000001e-002 | AP41: 14 | AQ41: 汉得转债!
A42: 269 | B42: 128066 | C42: 亚泰转债! | D42: 2811. | E42: 郑中设计 | F42: 建筑 | G42: 装饰工程 | H42: 100.98 | I42: 2.8000000000000004e-003 | J42: 4.5000000000000005e-003 | K42: 7.92 | L42: 1.67e-002 | M42: 116.7 | N42: 9.27 | O42: 0.182 | P42: 85.44 | Q42: 转股中 | R42: 3.83年 | S42: 1.83年 | T42: 4.8 | U42: 1.3 | V42: 3.0000000000000001e-003 | W42: 0.22399999999999998 | X42: 0.192 | Y42: 21 | Z42: 1.44 | AA42: 3.9300000000000002e-002 | AB42: 3.1200000000000002e-002 | AC42: 1.0200000000000001e-002 | AD42: 7.1999999999999998e-003 | AE42: 91.14 | AF42: 92.5 | AG42: 0.44 | AH42: AA- | AI42: 6.3899999999999998e-002 | AJ42: =H42+100*O42 -> 119.18000000000001 | AK42: 116.5 | AL42: 31 | AM42: 24 | AN42: 29 | AO42: -5.7999999999999996e-002 | AP42: 61 | AQ42: 亚泰转债!
A43: 120 | B43: 113601 | C43: 塞力转债! | D43: 603716 | E43: 塞力医疗 | F43: 医药 | G43: 医药商业 | H43: 99.89 | I43: 4.5999999999999999e-003 | J43: 7.000000000000001e-004 | K43: 14.27 | L43: 1.06e-002 | M43: 121.3 | N43: 16.98 | O43: 0.18899999999999997 | P43: 84.04 | Q43: 转股中 | R43: 5.17年 | S43: 3.18年 | T43: 5.43 | U43: 25 | V43: 4.5999999999999999e-002 | W43: 0.18600000000000003 | X43: 0.156 | Y43: 29 | Z43: 1.87 | AA43: 3.9199999999999999e-002 | AB43: 3.1699999999999999e-002 | AC43: 1.3000000000000001e-002 | AD43: 1.04e-002 | AE43: 84.66 | AF43: 88.23 | AG43: 0.5 | AH43: AA- | AI43: 6.5099999999999991e-002 | AJ43: =H43+100*O43 -> 118.78999999999999 | AK43: 115.7 | AL43: 28 | AM43: 27.5 | AN43: 64 | AO43: 4.5999999999999999e-002 | AP43: 38 | AQ43: 塞力转债!
A44: 345 | B44: 128026 | C44: 众兴转债! | D44: 2772. | E44: 众兴菌业 | F44: 农业 | G44: 种植业 | H44: 99.59 | I44: 1.1999999999999999e-003 | J44: 4.3e-003 | K44: 8.76 | L44: 3.0600000000000002e-002 | M44: 109.3 | N44: 11.36 | O44: 0.29100000000000004 | P44: 77.11 | Q44: 转股中 | R44: 2.49年 | S44: 0.49年 | T44: 9.19 | U44: 13 | V44: 1.3999999999999999e-002 | W44: 0.28499999999999998 | X44: 0.22 | Y44: 32 | Z44: 1.25 | AA44: 3.8800000000000001e-002 | AB44: 3.1400000000000004e-002 | AC44: 3.4200000000000001e-002 | AD44: 2.86e-002 | AE44: 97.86 | AF44: 94.28 | AG44: 0.18 | AH44: AA- | AI44: 6.2400000000000004e-002 | AJ44: =H44+100*O44 -> 128.69 | AK44: 122.1 | AL44: 80 | AM44: 24.2 | AN44: 32 | AO44: 0.10099999999999999 | AP44: 62 | AQ44: 众兴转债!
A45: 245 | B45: 113546 | C45: 迪贝转债! | D45: 603320 | E45: 迪贝电气 | F45: 家电 | G45: 零部件制 | H45: 102.73 | I45: 6.8999999999999999e-003 | J45: -3.5999999999999999e-003 | K45: 11.25 | L45: 7.1999999999999998e-003 | M45: 120.6 | N45: 14 | O45: 0.27800000000000002 | P45: 80.36 | Q45: 转股中 | R45: 4.35年 | S45: 2.35年 | T45: 2.3 | U45: 0.9 | V45: 4.0000000000000001e-003 | W45: 0.157 | X45: 0.126 | Y45: 15 | Z45: 2.11 | AA45: 3.85e-002 | AB45: 2.9900000000000003e-002 | AC45: 4.6999999999999993e-003 | AD45: 1.6000000000000001e-003 | AE45: 86.89 | AF45: 88.8 | AG45: 0.45 | AH45: A+ | AI45: 7.4900000000000008e-002 | AJ45: =H45+100*O45 -> 130.53 | AK45: 125.1 | AL45: 121 | AM45: 36.3 | AN45: 166 | AO45: 4.0000000000000001e-003 | AP45: 40 | AQ45: 迪贝转债!
A46: 322 | B46: 127007 | C46: 湖广转债! | D46: 665. | E46: 湖北广电 | F46: 传媒娱乐 | G46: 影视娱乐 | H46: 100.5 | I46: -2.e-003 | J46: 5.0000000000000001e-004 | K46: 4.01 | L46: -9.8999999999999991e-003 | M46: 112.3 | N46: 5.58 | O46: 0.39799999999999996 | P46: 71.86 | Q46: 转股中 | R46: 3年9天 | S46: 1年10天 | T46: 12.2 | U46: 18 | V46: 1.3999999999999999e-002 | W46: 0.309 | X46: 0.222 | Y46: 39 | Z46: 0.68 | AA46: 3.8300000000000001e-002 | AB46: 3.04e-002 | AC46: 1.9400000000000001e-002 | AD46: 1.46e-002 | AE46: 98.16 | AF46: 100.04 | AG46: 0.15 | AH46: AA+ | AI46: 3.9900000000000005e-002 | AJ46: =H46+100*O46 -> 140.30000000000001 | AK46: 129.1 | AL46: 160 | AM46: 29.1 | AN46: 85 | AO46: -3.1e-002 | AP46: 17 | AQ46: 湖广转债!
A47: 315 | B47: 128042 | C47: 凯中转债! | D47: 2823. | E47: 凯中精密 | F47: 能源电力 | G47: 电力设备 | H47: 103.72 | I47: -2.e-003 | J47: 2.7000000000000001e-003 | K47: 10.11 | L47: 3.0000000000000001e-003 | M47: 116.3 | N47: 12.86 | O47: 0.31900000000000001 | P47: 78.62 | Q47: 转股中 | R47: 3年41天 | S47: 1年42天 | T47: 4.16 | U47: 1.3 | V47: 3.0000000000000001e-003 | W47: 0.14300000000000002 | X47: 0.113 | Y47: 29 | Z47: 2.14 | AA47: 3.8300000000000001e-002 | AB47: 2.8500000000000001e-002 | AC47: -6.9999999999999993e-003 | AD47: -1.1200000000000002e-002 | AE47: 97.47 | AF47: 102.34 | AG47: 0.22 | AH47: AA | AI47: 4.2900000000000001e-002 | AJ47: =H47+100*O47 -> 135.62 | AK47: 128.8 | AL47: 153 | AM47: 26.5 | AN47: 54 | AO47: -4.0000000000000001e-003 | AP47: 26 | AQ47: 凯中转债!
A48: 59 | B48: 123088 | C48: 威唐转债! | D48: 300707 | E48: 威唐工业 | F48: 汽车 | G48: 零部件制 | H48: 99.61 | I48: 6.0000000000000001e-003 | J48: -6.0000000000000001e-003 | K48: 16.35 | L48: 0. | M48: 121.6 | N48: 20.72 | O48: 0.26200000000000001 | P48: 78.91 | Q48: 3.2天 | R48: 5.49年 | S48: 3.49年 | T48: 3.01 | U48: 4.1 | V48: 1.3999999999999999e-002 | W48: 0.11699999999999999 | X48: 9.3000000000000013e-002 | Y48: 26 | Z48: 3.72 | AA48: 3.7900000000000003e-002 | AB48: 3.0800000000000001e-002 | AC48: 1.3600000000000001e-002 | AD48: 1.11e-002 | AE48: 80.26 | AF48: 82.09 | AG48: 0.53 | AH48: A+ | AI48: 7.6100000000000001e-002 | AJ48: =H48+100*O48 -> 125.81 | AK48: 120.3 | AL48: 65 | AM48: 38.2 | AN48: 182 | AO48: 6.7000000000000004e-002 | AP48: 13 | AQ48: 威唐转债!
A49: 178 | B49: 113578 | C49: 全筑转债! | D49: 603030 | E49: 全筑股份 | F49: 建筑 | G49: 装饰工程 | H49: 98.98 | I49: 2.2000000000000001e-003 | J49: -2.2000000000000001e-003 | K49: 4.33 | L49: 0. | M49: 117.9 | N49: 5.43 | O49: 0.24100000000000002 | P49: 79.74 | Q49: 转股中 | R49: 4.84年 | S49: 2.84年 | T49: 3.84 | U49: 2.5 | V49: 6.9999999999999993e-003 | W49: 0.16500000000000001 | X49: 0.13100000000000001 | Y49: 23 | Z49: 1.02 | AA49: 3.7499999999999999e-002 | AB49: 3.0699999999999998e-002 | AC49: 1.4800000000000001e-002 | AD49: 1.2500000000000001e-002 | AE49: 91.24 | AF49: 96.59 | AG49: 0.33 | AH49: AA | AI49: 4.2900000000000001e-002 | AJ49: =H49+100*O49 -> 123.08000000000001 | AK49: 118.2 | AL49: 42 | AM49: 21.6 | AN49: 22 | AO49: -9.0000000000000011e-003 | AP49: 20 | AQ49: 全筑转债!
A50: 147 | B50: 123059 | C50: 银信转债! | D50: 300231 | E50: 银信科技 | F50: 计算机及 | G50: 软件开发 | H50: 104.551 | I50: 5.4000000000000003e-003 | J50: -3.0999999999999999e-003 | K50: 8.33 | L50: 4.7999999999999996e-003 | M50: 124.1 | N50: 9.72 | O50: 0.22 | P50: 85.7 | Q50: 转股中 | R50: 5年26天 | S50: 3年27天 | T50: 3.91 | U50: 6.6 | V50: 1.6e-002 | W50: 0.106 | X50: 9.0999999999999998e-002 | Y50: 37 | Z50: 2.7 | AA50: 3.5200000000000002e-002 | AB50: 2.6800000000000001e-002 | AC50: -1.6000000000000001e-003 | AD50: -4.0000000000000001e-003 | AE50: 85.01 | AF50: 90.78 | AG50: 0.49 | AH50: AA- | AI50: 6.5099999999999991e-002 | AJ50: =H50+100*O50 -> 126.551 | AK50: 123.4 | AL50: 95 | AM50: 32.6 | AN50: 122 | AO50: 5.7999999999999996e-002 | AP50: 16 | AQ50: 银信转债!
A51: 144 | B51: 113593 | C51: 沪工转债! | D51: 603131 | E51: 上海沪工 | F51: 机械装备 | G51: 通用设备 | H51: 102.66 | I51: 5.1000000000000004e-003 | J51: 8.9999999999999998e-004 | K51: 16.37 | L51: 1.24e-002 | M51: 121.6 | N51: 21.12 | O51: 0.32400000000000001 | P51: 77.51 | Q51: 转股中 | R51: 5年31天 | S51: 3年32天 | T51: 4 | U51: 2.5 | V51: 6.0000000000000001e-003 | W51: 7.6999999999999999e-002 | X51: 5.9999999999999998e-002 | Y51: 52 | Z51: 3.96 | AA51: 3.4700000000000002e-002 | AB51: 2.7099999999999999e-002 | AC51: 5.8999999999999999e-003 | AD51: 3.0999999999999999e-003 | AE51: 82.65 | AF51: 84.54 | AG51: 0.49 | AH51: A+ | AI51: 7.6100000000000001e-002 | AJ51: =H51+100*O51 -> 135.06 | AK51: 127.8 | AL51: 143 | AM51: 43.3 | AN51: 227 | AO51: -7.8e-002 | AP51: 11 | AQ51: 沪工转债!
A52: 160 | B52: 123056 | C52: 雪榕转债! | D52: 300511 | E52: 雪榕生物 | F52: 农业 | G52: 种植业 | H52: 102.564 | I52: 6.7000000000000002e-003 | J52: -3.3e-003 | K52: 7.97 | L52: 1.1399999999999999e-002 | M52: 121.1 | N52: 11.77 | O52: 0.51500000000000001 | P52: 67.71 | Q52: 转股中 | R52: 5年5.2天 | S52: 3年6.2天 | T52: 5.84 | U52: 1.4 | V52: 2.e-003 | W52: 0.16600000000000001 | X52: 0.11199999999999999 | Y52: 35 | Z52: 1.7 | AA52: 3.4500000000000003e-002 | AB52: 2.69e-002 | AC52: 4.5000000000000005e-003 | AD52: 2.e-003 | AE52: 85.32 | AF52: 88.93 | AG52: 0.3 | AH52: AA- | AI52: 6.5099999999999991e-002 | AJ52: =H52+100*O52 -> 154.06399999999999 | AK52: 137.4 | AL52: 237 | AM52: 48.5 | AN52: 256 | AO52: -8.6999999999999994e-002 | AP52: 17 | AQ52: 雪榕转债!
A53: 209 | B53: 113566 | C53: 翔港转债! | D53: 603499 | E53: 翔港科技 | F53: 造纸包装 | G53: 包装材料 | H53: 106.16 | I53: 8.0000000000000004e-004 | J53: -1.8e-003 | K53: 7.68 | L53: -2.5999999999999999e-003 | M53: 124 | N53: 10.77 | O53: 0.48899999999999999 | P53: 71.31 | Q53: 转股中 | R53: 4.70年 | S53: 2.70年 | T53: 1.61 | U53: 3 | V53: 1.8000000000000002e-002 | W53: 0.10400000000000001 | X53: 7.400000000000001e-002 | Y53: 15 | Z53: 2.73 | AA53: 3.44e-002 | AB53: 2.5399999999999999e-002 | AC53: -6.7000000000000002e-003 | AD53: -9.4999999999999998e-003 | AE53: 84.91 | AF53: 89.03 | AG53: 0.37 | AH53: A+ | AI53: 7.4900000000000008e-002 | AJ53: =H53+100*O53 -> 155.06 | AK53: 141 | AL53: 264 | AM53: 52 | AN53: 272 | AO53: -3.2000000000000001e-002 | AP53: 29 | AQ53: 翔港转债!
A54: 156 | B54: 113591 | C54: 胜达转债! | D54: 603687 | E54: 大胜达 | F54: 造纸包装 | G54: 包装用纸 | H54: 103.47 | I54: 5.7999999999999996e-003 | J54: -3.0999999999999999e-003 | K54: 7.84 | L54: 5.1000000000000004e-003 | M54: 122.2 | N54: 8.76 | O54: 0.156 | P54: 89.5 | Q54: 转股中 | R54: 5年12天 | S54: 3年13天 | T54: 5.5 | U54: 5.4 | V54: 1.e-002 | W54: 0.17100000000000001 | X54: 0.153 | Y54: 32 | Z54: 1.87 | AA54: 3.44e-002 | AB54: 2.6499999999999999e-002 | AC54: 2.e-003 | AD54: -5.0000000000000001e-004 | AE54: 85.32 | AF54: 89.65 | AG54: 0.53 | AH54: AA- | AI54: 6.5099999999999991e-002 | AJ54: =H54+100*O54 -> 119.06999999999999 | AK54: 117.4 | AL54: 36 | AM54: 27.8 | AN54: 67 | AO54: -5.7000000000000002e-002 | AP54: 27 | AQ54: 胜达转债!
A55: 81 | B55: 123076 | C55: 强力转债! | D55: 300429 | E55: 强力新材 | F55: 化工 | G55: 化工 | H55: 99.181 | I55: 1.8e-003 | J55: 4.6999999999999993e-003 | K55: 12.78 | L55: 1.9099999999999999e-002 | M55: 118.5 | N55: 18.94 | O55: 0.46999999999999997 | P55: 67.48 | Q55: 转股中 | R55: 5.42年 | S55: 3.42年 | T55: 8.5 | U55: 7.8 | V55: 9.0000000000000011e-003 | W55: 0.129 | X55: 8.6999999999999994e-002 | Y55: 66 | Z55: 3.73 | AA55: 3.4099999999999998e-002 | AB55: 2.7799999999999998e-002 | AC55: 1.3000000000000001e-002 | AD55: 1.09e-002 | AE55: 83.01 | AF55: 84.79 | AG55: 0.34 | AH55: AA- | AI55: 6.5099999999999991e-002 | AJ55: =H55+100*O55 -> 146.18099999999998 | AK55: 130.9 | AL55: 181 | AM55: 46.1 | AN55: 246 | AO55: 7.9000000000000001e-002 | AP55: 16 | AQ55: 强力转债!
A56: 222 | B56: 123039 | C56: 开润转债! | D56: 300577 | E56: 开润股份 | F56: 服装纺织 | G56: 纺织行业 | H56: 104.688 | I56: 5.9999999999999995e-004 | J56: 2.5000000000000001e-003 | K56: 20.83 | L56: 9.1999999999999998e-003 | M56: 121 | N56: 29.9 | O56: 0.503 | P56: 69.67 | Q56: 转股中 | R56: 4.52年 | S56: 2.52年 | T56: 2.22 | U56: 2.3 | V56: 1.e-002 | W56: 4.4000000000000004e-002 | X56: 3.1e-002 | Y56: 50 | Z56: 3.26 | AA56: 3.3300000000000003e-002 | AB56: 2.5000000000000001e-002 | AC56: -2.2000000000000001e-003 | AD56: -5.1000000000000004e-003 | AE56: 85.91 | AF56: 87.98 | AG56: 0.33 | AH56: A+ | AI56: 7.4900000000000008e-002 | AJ56: =H56+100*O56 -> 154.988 | AK56: 139.7 | AL56: 258 | AM56: 51.7 | AN56: 267 | AO56: -5.0000000000000003e-002 | AP56: 24 | AQ56: 开润转债!
A57: 32 | B57: 113620 | C57: 傲农转债! | D57: 603363 | E57: 傲农生物 | F57: 农业 | G57: 畜牧业 | H57: 100.7 | I57: 2.0999999999999999e-003 | J57: 1.e-003 | K57: 9.55 | L57: 1.49e-002 | M57: 121.1 | N57: 14.51 | O57: 0.53000000000000003 | P57: 65.82 | Q57: 3月0天 | R57: 5.72年 | S57: 3.73年 | T57: 10 | U57: 1.5 | V57: 2.e-003 | W57: 0.153 | X57: 0.10099999999999999 | Y57: 65 | Z57: 2.22 | AA57: 3.3300000000000003e-002 | AB57: 2.6699999999999998e-002 | AC57: 7.4000000000000003e-003 | AD57: 5.6000000000000008e-003 | AE57: 87.7 | AF57: 94.99 | AG57: 0.21 | AH57: AA | AI57: 4.41e-002 | AJ57: =H57+100*O57 -> 153.69999999999999 | AK57: 135.6 | AL57: 223 | AM57: 40.6 | AN57: 202 | AO57: -8.5999999999999993e-002 | AP57: 5 | AQ57: 傲农转债!
A58: 5 | B58: 113624 | C58: 正川转债 | D58: 603976 | E58: 正川股份 | F58: 医药 | G58: 医药行业 | H58: 100.82 | I58: -2.2000000000000001e-003 | J58: 2.8999999999999998e-003 | K58: 38.85 | L58: 1.2999999999999999e-003 | M58: 121.6 | N58: 46.69 | O58: 0.21199999999999999 | P58: 83.21 | Q58: 4月23天 | R58: 5.86年 | S58: 3.86年 | T58: 4.05 | U58: 17 | V58: 4.0000000000000001e-002 | W58: 6.9000000000000006e-002 | X58: 5.7000000000000002e-002 | Y58: 59 | Z58: 5.57 | AA58: 3.32e-002 | AB58: 2.6600000000000002e-002 | AC58: 9.300000000000001e-003 | AD58: 6.9999999999999993e-003 | AE58: 78.12 | AF58: 79.91 | AG58: 0.6 | AH58: A+ | AI58: 7.6100000000000001e-002 | AJ58: =H58+100*O58 -> 122.02 | AK58: 118.4 | AL58: 44 | AM58: 38.5 | AN58: 184 | AO58: -9.6999999999999989e-002 | AP58: 7 | AQ58: 正川转债
A59: 130 | B59: 113597 | C59: 佳力转债! | D59: 603912 | E59: 佳力图 | F59: 机械装备 | G59: 专用设备 | H59: 105.86 | I59: 1.8e-003 | J59: 6.0999999999999995e-003 | K59: 15.58 | L59: 2.8399999999999998e-002 | M59: 124.5 | N59: 23.4 | O59: 0.58999999999999997 | P59: 66.58 | Q59: 转股中 | R59: 5年41天 | S59: 3年42天 | T59: 3 | U59: 53 | V59: 0.16600000000000001 | W59: 8.900000000000001e-002 | X59: 5.9000000000000004e-002 | Y59: 34 | Z59: 3.64 | AA59: 3.3000000000000002e-002 | AB59: 2.46e-002 | AC59: -4.1999999999999997e-003 | AD59: -6.8000000000000005e-003 | AE59: 85.14 | AF59: 90.89 | AG59: 0.28 | AH59: AA- | AI59: 6.5099999999999991e-002 | AJ59: =H59+100*O59 -> 164.86000000000001 | AK59: 145.1 | AL59: 282 | AM59: 54.2 | AN59: 284 | AO59: -1.2e-002 | AP59: 15 | AQ59: 佳力转债!
A60: 295 | B60: 128056 | C60: 今飞转债! | D60: 2863. | E60: 今飞凯达 | F60: 汽车 | G60: 零部件制 | H60: 106.927 | I60: 3.0999999999999999e-003 | J60: 1.7000000000000001e-003 | K60: 5.1 | L60: 1.3899999999999999e-002 | M60: 120.2 | N60: 6.7 | O60: 0.40500000000000003 | P60: 76.12 | Q60: 转股中 | R60: 3.70年 | S60: 1.70年 | T60: 1.72 | U60: 2.3 | V60: 1.2e-002 | W60: 6.8000000000000005e-002 | X60: 5.2000000000000005e-002 | Y60: 25 | Z60: 1.37 | AA60: 3.2799999999999996e-002 | AB60: 2.3e-002 | AC60: -1.8100000000000002e-002 | AD60: -2.1600000000000001e-002 | AE60: 90.45 | AF60: 92.56 | AG60: 0.34 | AH60: A+ | AI60: 7.4900000000000008e-002 | AJ60: =H60+100*O60 -> 147.42700000000002 | AK60: 137.7 | AL60: 239 | AM60: 45.2 | AN60: 241 | AO60: -5.0000000000000001e-003 | AP60: 54 | AQ60: 今飞转债!
A61: 71 | B61: 123081 | C61: 精研转债! | D61: 300709 | E61: 精研科技 | F61: 电子 | G61: 电子产品 | H61: 102.106 | I61: 3.0000000000000001e-003 | J61: 3.8e-003 | K61: 36.88 | L61: 1.9099999999999999e-002 | M61: 121.3 | N61: 53.4 | O61: 0.47799999999999998 | P61: 69.06 | Q61: 转股中 | R61: 5.46年 | S61: 3.46年 | T61: 5.7 | U61: 5.5 | V61: 9.0000000000000011e-003 | W61: 0.111 | X61: 7.6999999999999999e-002 | Y61: 51 | Z61: 2.68 | AA61: 3.2799999999999996e-002 | AB61: 2.58e-002 | AC61: 5.6999999999999993e-003 | AD61: 3.4000000000000002e-003 | AE61: 83.12 | AF61: 86.62 | AG61: 0.36 | AH61: AA- | AI61: 6.5099999999999991e-002 | AJ61: =H61+100*O61 -> 149.90600000000001 | AK61: 135.1 | AL61: 221 | AM61: 48.5 | AN61: 257 | AO61: 2.e-003 | AP61: 8 | AQ61: 精研转债!
A62: 127 | B62: 113599 | C62: 嘉友转债! | D62: 603871 | E62: 嘉友国际 | F62: 交通运输 | G62: 物流业 | H62: 107.2 | I62: 1.84e-002 | J62: -9.4999999999999998e-003 | K62: 16.9 | L62: 1.6799999999999999e-002 | M62: 126 | N62: 18.32 | O62: 0.16200000000000001 | P62: 92.25 | Q62: 转股中 | R62: 5年47天 | S62: 3年48天 | T62: 7.2 | U62: 14 | V62: 1.9e-002 | W62: 0.14899999999999999 | X62: 0.13800000000000001 | Y62: 48 | Z62: 1.73 | AA62: 3.27e-002 | AB62: 2.4e-002 | AC62: -9.4999999999999998e-003 | AD62: -1.1699999999999999e-002 | AE62: 84.61 | AF62: 91.81 | AG62: 0.53 | AH62: AA- | AI62: 6.5099999999999991e-002 | AJ62: =H62+100*O62 -> 123.40000000000001 | AK62: 122.2 | AL62: 82 | AM62: 30.3 | AN62: 99 | AO62: -0.25900000000000001 | AP62: 20 | AQ62: 嘉友转债!
A63: 40 | B63: 123096 | C63: 思创转债! | D63: 300078 | E63: 思创医惠 | F63: 通信互联 | G63: 物联网 | H63: 103.9 | I63: -5.6999999999999993e-003 | J63: 1.2500000000000001e-002 | K63: 7.14 | L63: 1.2800000000000001e-002 | M63: 124 | N63: 8.27 | O63: 0.20300000000000001 | P63: 86.34 | Q63: 45天 | R63: 5.61年 | S63: 3.61年 | T63: 8.17 | U63: 15 | V63: 1.8000000000000002e-002 | W63: 0.13200000000000001 | X63: 0.114 | Y63: 62 | Z63: 2.08 | AA63: 3.27e-002 | AB63: 2.52e-002 | AC63: 1.e-004 | AD63: -2.e-003 | AE63: 82.1 | AF63: 87.69 | AG63: 0.53 | AH63: AA- | AI63: 6.5099999999999991e-002 | AJ63: =H63+100*O63 -> 124.2 | AK63: 121.5 | AL63: 75 | AM63: 33.8 | AN63: 137 | AO63: 3.5000000000000003e-002 | AP63: 5 | AQ63: 思创转债!
A64: 72 | B64: 123080 | C64: 海波转债! | D64: 300517 | E64: 海波重科 | F64: 建筑 | G64: 建筑工程 | H64: 106.63 | I64: -3.4000000000000002e-003 | J64: 2.3e-003 | K64: 11.3 | L64: -1.8e-003 | M64: 126.5 | N64: 11.58 | O64: 9.3000000000000013e-002 | P64: 97.58 | Q64: 转股中 | R64: 5.46年 | S64: 3.46年 | T64: 2.45 | U64: 2.9 | V64: 1.1000000000000001e-002 | W64: 0.113 | X64: 0.11 | Y64: 22 | Z64: 1.45 | AA64: 3.2599999999999997e-002 | AB64: 2.4199999999999999e-002 | AC64: -5.1999999999999998e-003 | AD64: -7.6e-003 | AE64: 80.53 | AF64: 85.6 | AG64: 0.64 | AH64: A+ | AI64: 7.6100000000000001e-002 | AJ64: =H64+100*O64 -> 115.92999999999999 | AK64: 115.7 | AL64: 27 | AM64: 30.1 | AN64: 91 | AO64: -0.29499999999999998 | AP64: 20 | AQ64: 海波转债!
A65: 169 | B65: 113584 | C65: 家悦转债! | D65: 603708 | E65: 家家悦 | F65: 商业零售 | G65: 超市 | H65: 98.31 | I65: -2.8999999999999998e-003 | J65: 2.5000000000000001e-003 | K65: 17.53 | L65: -1.41e-002 | M65: 114.9 | N65: 37.53 | O65: 1.1000000000000001 | P65: 46.71 | Q65: 转股中 | R65: 4.96年 | S65: 2.96年 | T65: 6.45 | U65: 2.7 | V65: 4.0000000000000001e-003 | W65: 5.9999999999999998e-002 | X65: 2.7999999999999997e-002 | Y65: 107 | Z65: 3.79 | AA65: 3.2500000000000001e-002 | AB65: 2.69e-002 | AC65: 1.6399999999999998e-002 | AD65: 1.4199999999999999e-002 | AE65: 90.75 | AF65: 93.64 | AG65: 0.03 | AH65: AA | AI65: 4.2900000000000001e-002 | AJ65: =H65+100*O65 -> 208.31 | AK65: 149.9 | AL65: 299 | AM65: 56.3 | AN65: 289 | AO65: -7.2000000000000008e-002 | AP65: 13 | AQ65: 家悦转债!
A66: 243 | B66: 110059 | C66: 浦发转债! | D66: 600000 | E66: 浦发银行 | F66: 金融 | G66: 银行行业 | H66: 102.92 | I66: -2.2000000000000001e-003 | J66: 3.3e-003 | K66: 10.1 | L66: 6.0000000000000001e-003 | M66: 117.6 | N66: 14.45 | O66: 0.47200000000000003 | P66: 69.9 | Q66: 转股中 | R66: 4.36年 | S66: 无权 | T66: 500 | U66: 227 | V66: 4.0000000000000001e-003 | W66: 0.16899999999999998 | X66: 0.11800000000000001 | Y66: 2965. | Z66: 0.55 | AA66: 3.2000000000000001e-002 | AB66: 2.4500000000000001e-002 | AC66: 无权 | AD66: 无权 | AE66: 无权 | AF66: 100.49 | AG66: 0.18 | AH66: AAA | AI66: 3.7900000000000003e-002 | AJ66: =H66+100*O66 -> 150.12 | AK66: 135.9 | AL66: 229 | AM66: 35.5 | AN66: 156 | AO66: -1.e-002 | AP66: 63 | AQ66: 浦发转债!
A67: 191 | B67: 113033 | C67: 利群转债! | D67: 601366 | E67: 利群股份 | F67: 商业零售 | G67: 商场 | H67: 99.19 | I67: -1.e-004 | J67: 1.e-004 | K67: 6.2 | L67: 0. | M67: 114.9 | N67: 7.01 | O67: 0.121 | P67: 88.45 | Q67: 转股中 | R67: 4.78年 | S67: 2.79年 | T67: 18 | U67: 4.6 | V67: 3.0000000000000001e-003 | W67: 0.33700000000000002 | X67: 0.29799999999999999 | Y67: 53 | Z67: 1.15 | AA67: 3.1800000000000002e-002 | AB67: 2.6000000000000002e-002 | AC67: 1.43e-002 | AD67: 1.2e-002 | AE67: 91.44 | AF67: 94.34 | AG67: 0.45 | AH67: AA | AI67: 4.2900000000000001e-002 | AJ67: =H67+100*O67 -> 111.28999999999999 | AK67: 109.9 | AL67: 9 | AM67: 15.6 | AN67: 8 | AO67: -2.e-003 | AP67: 58 | AQ67: 利群转债!
A68: 344 | B68: 123004 | C68: 铁汉转债! | D68: 300197 | E68: 节能铁汉 | F68: 城市公用 | G68: 生态环境 | H68: 100.747 | I68: 5.0000000000000001e-004 | J68: -5.0000000000000001e-004 | K68: 3.14 | L68: 0. | M68: 108.8 | N68: 3.82 | O68: 0.22600000000000001 | P68: 82.2 | Q68: 转股中 | R68: 2.50年 | S68: 0.50年 | T68: 8.03 | U68: 3.8 | V68: 5.0000000000000001e-003 | W68: 9.0999999999999998e-002 | X68: 7.400000000000001e-002 | Y68: 89 | Z68: 1.35 | AA68: 3.1699999999999999e-002 | AB68: 2.4799999999999999e-002 | AC68: 1.2e-002 | AD68: 7.4000000000000003e-003 | AE68: 98.84 | AF68: 98.46 | AG68: 0.24 | AH68: AA | AI68: 4.1399999999999999e-002 | AJ68: =H68+100*O68 -> 123.34700000000001 | AK68: 119.3 | AL68: 58 | AM68: 20.5 | AN68: 18 | AO68: 3.7000000000000005e-002 | AP68: 45 | AQ68: 铁汉转债!
A69: 190 | B69: 127016 | C69: 鲁泰转债! | D69: 726. | E69: 鲁 泰Ａ | F69: 服装纺织 | G69: 纺织行业 | H69: 100.15 | I69: 5.0000000000000001e-004 | J69: -5.0000000000000001e-004 | K69: 6.07 | L69: 0. | M69: 115.9 | N69: 8.71 | O69: 0.43700000000000006 | P69: 69.69 | Q69: 转股中 | R69: 4.81年 | S69: 2.81年 | T69: 14 | U69: 2.2 | V69: 2.e-003 | W69: 0.26100000000000001 | X69: 0.182 | Y69: 54 | Z69: 0.68 | AA69: 3.15e-002 | AB69: 2.53e-002 | AC69: 1.09e-002 | AD69: 8.6e-003 | AE69: 92.13 | AF69: 96.37 | AG69: 0.2 | AH69: AA+ | AI69: 3.9900000000000005e-002 | AJ69: =H69+100*O69 -> 143.85000000000002 | AK69: 130.6 | AL69: 179 | AM69: 34.2 | AN69: 139 | AO69: -2.9999999999999999e-002 | AP69: 22 | AQ69: 鲁泰转债!
A70: 182 | B70: 123049 | C70: 维尔转债 | D70: 300190 | E70: 维尔利 | F70: 城市公用 | G70: 三废处理 | H70: 107.4 | I70: 2.3999999999999998e-003 | J70: -3.2000000000000002e-003 | K70: 6.56 | L70: -1.5e-003 | M70: 124.3 | N70: 7.38 | O70: 0.20800000000000002 | P70: 88.89 | Q70: 转股中 | R70: 4.82年 | S70: 2.82年 | T70: 9.17 | U70: 2.8 | V70: 3.0000000000000001e-003 | W70: 0.17899999999999999 | X70: 0.159 | Y70: 51 | Z70: 1.18 | AA70: 3.15e-002 | AB70: 2.2700000000000001e-002 | AC70: -1.01e-002 | AD70: -1.2800000000000001e-002 | AE70: 86.8 | AF70: 92.86 | AG70: 0.49 | AH70: AA- | AI70: 6.3899999999999998e-002 | AJ70: =H70+100*O70 -> 128.20000000000002 | AK70: 125.9 | AL70: 124 | AM70: 33 | AN70: 126 | AO70: -2.5000000000000001e-002 | AP70: 17 | AQ70: 维尔转债
A71: 278 | B71: 113532 | C71: 海环转债! | D71: 603817 | E71: 海峡环保 | F71: 城市公用 | G71: 三废处理 | H71: 100.19 | I71: -7.000000000000001e-004 | J71: 1.1000000000000001e-003 | K71: 5.59 | L71: 1.8e-003 | M71: 112.3 | N71: 7.63 | O71: 0.36799999999999999 | P71: 73.26 | Q71: 转股中 | R71: 3.79年 | S71: 1.79年 | T71: 4.59 | U71: 3.2 | V71: 6.9999999999999993e-003 | W71: 0.182 | X71: 0.13400000000000001 | Y71: 25 | Z71: 1.42 | AA71: 3.1200000000000002e-002 | AB71: 2.5000000000000001e-002 | AC71: 1.3300000000000001e-002 | AD71: 1.0500000000000001e-002 | AE71: 94.75 | AF71: 96.07 | AG71: 0.23 | AH71: AA | AI71: 4.2900000000000001e-002 | AJ71: =H71+100*O71 -> 136.99000000000001 | AK71: 127.1 | AL71: 135 | AM71: 31 | AN71: 106 | AO71: -4.5999999999999999e-002 | AP71: 26 | AQ71: 海环转债!
A72: 129 | B72: 128125 | C72: 华阳转债! | D72: 2949. | E72: 华阳国际 | F72: 建筑 | G72: 建筑工程 | H72: 101.6 | I72: 1.3999999999999999e-002 | J72: -1.72e-002 | K72: 16.6 | L72: -1.0700000000000001e-002 | M72: 118.5 | N72: 25.39 | O72: 0.55399999999999994 | P72: 65.38 | Q72: 转股中 | R72: 5年41天 | S72: 3年42天 | T72: 4.5 | U72: 1.3 | V72: 3.0000000000000001e-003 | W72: 0.13800000000000001 | X72: 8.9999999999999997e-002 | Y72: 33 | Z72: 2.55 | AA72: 3.1200000000000002e-002 | AB72: 2.46e-002 | AC72: 6.7000000000000002e-003 | AD72: 4.4000000000000003e-003 | AE72: 84.63 | AF72: 86.45 | AG72: 0.3 | AH72: AA- | AI72: 6.5099999999999991e-002 | AJ72: =H72+100*O72 -> 157. | AK72: 137.8 | AL72: 241 | AM72: 51.4 | AN72: 265 | AO72: -6.9000000000000006e-002 | AP72: 7 | AQ72: 华阳转债!
A73: 152 | B73: 113036 | C73: 宁建转债! | D73: 601789 | E73: 宁波建工 | F73: 建筑 | G73: 建筑工程 | H73: 100.99 | I73: 7.000000000000001e-004 | J73: -4.1999999999999997e-003 | K73: 3.88 | L73: -1.0200000000000001e-002 | M73: 117.3 | N73: 4.86 | O73: 0.26500000000000001 | P73: 79.84 | Q73: 转股中 | R73: 5年17天 | S73: 3年18天 | T73: 5.4 | U73: 3.4 | V73: 6.0000000000000001e-003 | W73: 0.14300000000000002 | X73: 0.114 | Y73: 38 | Z73: 1.21 | AA73: 3.0800000000000001e-002 | AB73: 2.4399999999999998e-002 | AC73: 8.6999999999999994e-003 | AD73: 6.3e-003 | AE73: 90.5 | AF73: 94.79 | AG73: 0.35 | AH73: AA | AI73: 4.41e-002 | AJ73: =H73+100*O73 -> 127.48999999999999 | AK73: 122.1 | AL73: 81 | AM73: 27.4 | AN73: 61 | AO73: 1.4999999999999999e-002 | AP73: 9 | AQ73: 宁建转债!
A74: 131 | B74: 123063 | C74: 大禹转债 | D74: 300021 | E74: 大禹节水 | F74: 化工 | G74: 橡胶塑料 | H74: 108.72 | I74: -2.7000000000000001e-003 | J74: -1.e-003 | K74: 4.87 | L74: -6.0999999999999995e-003 | M74: 126.5 | N74: 4.83 | O74: 7.8e-002 | P74: 100.83 | Q74: 转股中 | R74: 5年39天 | S74: 4年40天 | T74: 6.38 | U74: 3.6 | V74: 5.0000000000000001e-003 | W74: 0.16399999999999998 | X74: 0.16500000000000001 | Y74: 39 | Z74: 2.56 | AA74: 3.0800000000000001e-002 | AB74: 2.1899999999999999e-002 | AC74: -3.8e-003 | AD74: -6.8999999999999999e-003 | AE74: 82.15 | AF74: 92.36 | AG74: 0.6 | AH74: AA- | AI74: 6.5099999999999991e-002 | AJ74: =H74+100*O74 -> 116.52 | AK74: 116.6 | AL74: 33 | AM74: 24.3 | AN74: 34 | AO74: -2.1000000000000001e-002 | AP74: 17 | AQ74: 大禹转债
A75: 293 | B75: 113021 | C75: 中信转债! | D75: 601998 | E75: 中信银行 | F75: 金融 | G75: 银行行业 | H75: 105.9 | I75: 1.e-004 | J75: -1.1000000000000001e-003 | K75: 5.13 | L75: -5.7999999999999996e-003 | M75: 118 | N75: 6.98 | O75: 0.441 | P75: 73.5 | Q75: 转股中 | R75: 3.71年 | S75: 无权 | T75: 400 | U75: 61 | V75: 1.e-003 | W75: 0.159 | X75: 0.11699999999999999 | Y75: 2510. | Z75: 0.52 | AA75: 3.0499999999999999e-002 | AB75: 2.1499999999999998e-002 | AC75: 无权 | AD75: 无权 | AE75: 无权 | AF75: 103.2 | AG75: 0.18 | AH75: AAA | AI75: 3.7900000000000003e-002 | AJ75: =H75+100*O75 -> 150. | AK75: 138.3 | AL75: 247 | AM75: 35.1 | AN75: 150 | AO75: -2.2000000000000002e-002 | AP75: 44 | AQ75: 中信转债!
A76: 42 | B76: 113042 | C76: 上银转债! | D76: 601229 | E76: 上海银行 | F76: 金融 | G76: 银行行业 | H76: 102.71 | I76: -1.1999999999999999e-003 | J76: -2.3e-003 | K76: 8.27 | L76: -1.1899999999999999e-002 | M76: 120.9 | N76: 11.03 | O76: 0.37 | P76: 74.98 | Q76: 41天 | R76: 5.60年 | S76: 无权 | T76: 200 | U76: 74 | V76: 4.0000000000000001e-003 | W76: 0.17000000000000001 | X76: 0.128 | Y76: 1175. | Z76: 0.67 | AA76: 3.04e-002 | AB76: 2.3599999999999999e-002 | AC76: 无权 | AD76: 无权 | AE76: 无权 | AF76: 98.11 | AG76: 0.29 | AH76: AAA | AI76: 3.9100000000000003e-002 | AJ76: =H76+100*O76 -> 139.70999999999998 | AK76: 130.4 | AL76: 177 | AM76: 32.3 | AN76: 116 | AO76: -1.9e-002 | AP76: 12 | AQ76: 上银转债!
A77: 157 | B77: 128116 | C77: 瑞达转债! | D77: 2961. | E77: 瑞达期货 | F77: 金融 | G77: 期货行业 | H77: 99.56 | I77: -1.e-004 | J77: 2.5999999999999999e-003 | K77: 22.51 | L77: 7.6e-003 | M77: 115.3 | N77: 29.55 | O77: 0.307 | P77: 76.18 | Q77: 转股中 | R77: 5年10天 | S77: 3年11天 | T77: 6.5 | U77: 3.2 | V77: 5.0000000000000001e-003 | W77: 6.5000000000000002e-002 | X77: 4.9000000000000002e-002 | Y77: 100 | Z77: 5.11 | AA77: 3.0299999999999997e-002 | AB77: 2.46e-002 | AC77: 1.3000000000000001e-002 | AD77: 1.0700000000000001e-002 | AE77: 90.49 | AF77: 93.24 | AG77: 0.33 | AH77: AA | AI77: 4.41e-002 | AJ77: =H77+100*O77 -> 130.25999999999999 | AK77: 122.9 | AL77: 87 | AM77: 29.7 | AN77: 88 | AO77: 6.7000000000000004e-002 | AP77: 18 | AQ77: 瑞达转债!
A78: 360 | B78: 128014 | C78: 永东转债! | D78: 2753. | E78: 永东股份 | F78: 化工 | G78: 化工 | H78: 104.05 | I78: 4.0999999999999995e-003 | J78: -1.8e-003 | K78: 8.79 | L78: 4.0199999999999993e-002 | M78: 109.8 | N78: 12.52 | O78: 0.48200000000000004 | P78: 70.21 | Q78: 转股中 | R78: 1.83年 | S78: 回售内 | T78: 3.37 | U78: 2.2 | V78: 6.0000000000000001e-003 | W78: 0.10199999999999999 | X78: 7.2000000000000008e-002 | Y78: 33 | Z78: 1.66 | AA78: 3.0099999999999998e-002 | AB78: 1.9900000000000001e-002 | AC78: 回售内 | AD78: 回售内 | AE78: 100.3 | AF78: 98.39 | AG78: 0.06 | AH78: AA- | AI78: 6.2400000000000004e-002 | AJ78: =H78+100*O78 -> 152.25 | AK78: 137.9 | AL78: 244 | AM78: 37.6 | AN78: 176 | AO78: 1.7000000000000001e-002 | AP78: 38 | AQ78: 永东转债!
A79: 74 | B79: 113610 | C79: 灵康转债 | D79: 603669 | E79: 灵康药业 | F79: 医药 | G79: 化学制药 | H79: 103.37 | I79: -1.4000000000000002e-003 | J79: 3.7000000000000002e-003 | K79: 7.87 | L79: 3.8e-003 | M79: 121.1 | N79: 8.61 | O79: 0.13100000000000001 | P79: 91.41 | Q79: 转股中 | R79: 5.45年 | S79: 3.46年 | T79: 5.25 | U79: 5.3 | V79: 1.e-002 | W79: 9.4e-002 | X79: 8.5000000000000006e-002 | Y79: 56 | Z79: 3.99 | AA79: 3.0099999999999998e-002 | AB79: 2.3199999999999998e-002 | AC79: 1.8e-003 | AD79: -4.0000000000000002e-004 | AE79: 82.99 | AF79: 86.5 | AG79: 0.58 | AH79: AA- | AI79: 6.5099999999999991e-002 | AJ79: =H79+100*O79 -> 116.47 | AK79: 115.3 | AL79: 22 | AM79: 28.8 | AN79: 78 | AO79: -8.4000000000000005e-002 | AP79: 26 | AQ79: 灵康转债
A80: 4 | B80: 127034 | C80: 绿茵转债 | D80: 2887. | E80: 绿茵生态 | F80: 城市公用 | G80: 生态环境 | H80: 100.35 | I80: -2.8999999999999998e-003 | J80: -8.0000000000000004e-004 | K80: 10.58 | L80: -6.6e-003 | M80: 119 | N80: 12.38 | O80: 0.17399999999999999 | P80: 85.46 | Q80: 4月26天 | R80: 5.86年 | S80: 3.87年 | T80: 7.12 | U80: 14 | V80: 1.9e-002 | W80: 0.21600000000000003 | X80: 0.184 | Y80: 33 | Z80: 1.54 | AA80: 3.0099999999999998e-002 | AB80: 2.4199999999999999e-002 | AC80: 8.8000000000000005e-003 | AD80: 6.8999999999999999e-003 | AE80: 80.78 | AF80: 82.82 | AG80: 0.57 | AH80: AA- | AI80: 6.5099999999999991e-002 | AJ80: =H80+100*O80 -> 117.75 | AK80: 115.2 | AL80: 21 | AM80: 32.4 | AN80: 120 | AO80: -7.0999999999999994e-002 | AP80: 11 | AQ80: 绿茵转债
A81: 194 | B81: 110068 | C81: 龙净转债! | D81: 600388 | E81: 龙净环保 | F81: 城市公用 | G81: 三废处理 | H81: 99.96 | I81: -2.0000000000000001e-004 | J81: 1.e-003 | K81: 8.44 | L81: 2.3999999999999998e-003 | M81: 114.8 | N81: 10.73 | O81: 0.27100000000000002 | P81: 78.66 | Q81: 转股中 | R81: 4.76年 | S81: 2.76年 | T81: 20 | U81: 4.2 | V81: 2.e-003 | W81: 0.222 | X81: 0.17399999999999999 | Y81: 90 | Z81: 1.49 | AA81: 2.9999999999999999e-002 | AB81: 2.4199999999999999e-002 | AC81: 1.1399999999999999e-002 | AD81: 9.1000000000000004e-003 | AE81: 92.19 | AF81: 95.61 | AG81: 0.32 | AH81: AA+ | AI81: 3.9900000000000005e-002 | AJ81: =H81+100*O81 -> 127.06 | AK81: 121.3 | AL81: 74 | AM81: 25.7 | AN81: 47 | AO81: -2.2000000000000002e-002 | AP81: 33 | AQ81: 龙净转债!
A82: 63 | B82: 123084 | C82: 高澜转债! | D82: 300499 | E82: 高澜股份 | F82: 能源电力 | G82: 电力设备 | H82: 104.08 | I82: 1.5e-003 | J82: 1.18e-002 | K82: 8.11 | L82: 2.1400000000000002e-002 | M82: 121.9 | N82: 9 | O82: 0.155 | P82: 90.11 | Q82: 转股中 | R82: 5.48年 | S82: 3.48年 | T82: 2.8 | U82: 4.2 | V82: 1.3999999999999999e-002 | W82: 0.124 | X82: 0.11199999999999999 | Y82: 23 | Z82: 2.69 | AA82: 2.9999999999999999e-002 | AB82: 2.29e-002 | AC82: 2.e-003 | AD82: -5.9999999999999995e-004 | AE82: 80.5 | AF82: 82.4 | AG82: 0.62 | AH82: A+ | AI82: 7.6100000000000001e-002 | AJ82: =H82+100*O82 -> 119.58 | AK82: 118 | AL82: 39 | AM82: 35.6 | AN82: 159 | AO82: 2.7000000000000003e-002 | AP82: 13 | AQ82: 高澜转债!
A83: 22 | B83: 123106 | C83: 正丹转债! | D83: 300641 | E83: 正丹股份 | F83: 化工 | G83: 化工 | H83: 106.182 | I83: 8.8000000000000005e-003 | J83: -2.9999999999999997e-004 | K83: 7.21 | L83: 1.41e-002 | M83: 125.5 | N83: 7.52 | O83: 0.107 | P83: 95.88 | Q83: 3月14天 | R83: 5.76年 | S83: 3.76年 | T83: 3.2 | U83: 21 | V83: 6.0999999999999999e-002 | W83: 9.0999999999999998e-002 | X83: 8.6999999999999994e-002 | Y83: 35 | Z83: 2.53 | AA83: 2.9999999999999999e-002 | AB83: 2.2400000000000003e-002 | AC83: -5.6999999999999993e-003 | AD83: -7.6e-003 | AE83: 81.23 | AF83: 87.85 | AG83: 0.6 | AH83: AA- | AI83: 6.5099999999999991e-002 | AJ83: =H83+100*O83 -> 116.88200000000001 | AK83: 116.5 | AL83: 30 | AM83: 28.6 | AN83: 76 | AO83: 3.9e-002 | AP83: 11 | AQ83: 正丹转债!
A84: 363 | B84: 128013 | C84: 洪涛转债! | D84: 2325. | E84: 洪涛股份 | F84: 建筑 | G84: 装饰工程 | H84: 106.36 | I84: -7.7000000000000002e-003 | J84: -5.1000000000000004e-003 | K84: 2.43 | L84: -2.41e-002 | M84: 109.8 | N84: 2.32 | O84: 1.4999999999999999e-002 | P84: 104.74 | Q84: 转股中 | R84: 1年41天 | S84: 回售内 | T84: 11.6 | U84: 41 | V84: 3.3000000000000002e-002 | W84: 0.379 | X84: 0.39700000000000002 | Y84: 31 | Z84: 1.13 | AA84: 2.9500000000000002e-002 | AB84: 1.2699999999999999e-002 | AC84: 回售内 | AD84: 回售内 | AE84: 100.3 | AF84: 102.76 | AG84: 0.53 | AH84: AA- | AI84: 6.2400000000000004e-002 | AJ84: =H84+100*O84 -> 107.86 | AK84: 108 | AL84: 5 | AM84: 5.2 | AN84: 1 | AO84: 3.6000000000000004e-002 | AP84: 91 | AQ84: 洪涛转债!
A85: 192 | B85: 113574 | C85: 华体转债! | D85: 603679 | E85: 华体科技 | F85: 城市公用 | G85: 城市公用 | H85: 101.38 | I85: 5.7999999999999996e-003 | J85: -3.3e-003 | K85: 18.07 | L85: 1.9799999999999998e-002 | M85: 115.9 | N85: 33.91 | O85: 0.90200000000000002 | P85: 53.29 | Q85: 转股中 | R85: 4.78年 | S85: 2.78年 | T85: 2.09 | U85: 2.5 | V85: 1.2e-002 | W85: 8.1000000000000003e-002 | X85: 4.2999999999999997e-002 | Y85: 26 | Z85: 3.32 | AA85: 2.8999999999999998e-002 | AB85: 2.2799999999999997e-002 | AC85: 9.0000000000000011e-003 | AD85: 6.3e-003 | AE85: 84.28 | AF85: 82.73 | AG85: 0.12 | AH85: A+ | AI85: 7.4900000000000008e-002 | AJ85: =H85+100*O85 -> 191.57999999999998 | AK85: 149.5 | AL85: 296 | AM85: 65.2 | AN85: 311 | AO85: -3.7999999999999999e-002 | AP85: 19 | AQ85: 华体转债!
A86: 313 | B86: 113516 | C86: 苏农转债! | D86: 603323 | E86: 苏农银行 | F86: 金融 | G86: 银行行业 | H86: 104.79 | I86: -8.0000000000000004e-004 | J86: 2.0000000000000001e-004 | K86: 4.3 | L86: -2.3e-003 | M86: 114.3 | N86: 5.37 | O86: 0.309 | P86: 80.07 | Q86: 转股中 | R86: 3年44天 | S86: 无权 | T86: 12.9 | U86: 7.7 | V86: 6.0000000000000001e-003 | W86: 0.16600000000000001 | X86: 0.13300000000000001 | Y86: 78 | Z86: 0.63 | AA86: 2.8900000000000002e-002 | AB86: 2.0299999999999999e-002 | AC86: 无权 | AD86: 无权 | AE86: 无权 | AF86: 101.43 | AG86: 0.24 | AH86: AA+ | AI86: 3.9900000000000005e-002 | AJ86: =H86+100*O86 -> 135.69 | AK86: 129.5 | AL86: 163 | AM86: 28.1 | AN86: 70 | AO86: -4.0000000000000001e-002 | AP86: 29 | AQ86: 苏农转债!
A87: 270 | B87: 110058 | C87: 永鼎转债! | D87: 600105 | E87: 永鼎股份 | F87: 通信互联 | G87: 通信设备 | H87: 102.7 | I87: 6.0999999999999995e-003 | J87: 4.1999999999999997e-003 | K87: 4.09 | L87: 2.5099999999999997e-002 | M87: 114.3 | N87: 5.04 | O87: 0.26600000000000001 | P87: 81.15 | Q87: 转股中 | R87: 3.83年 | S87: 1.83年 | T87: 2.61 | U87: 48 | V87: 0.17699999999999999 | W87: 4.5999999999999999e-002 | X87: 3.7999999999999999e-002 | Y87: 56 | Z87: 2.03 | AA87: 2.8900000000000002e-002 | AB87: 2.1899999999999999e-002 | AC87: 5.0000000000000001e-004 | AD87: -2.3e-003 | AE87: 90.94 | AF87: 90.58 | AG87: 0.41 | AH87: AA- | AI87: 6.3899999999999998e-002 | AJ87: =H87+100*O87 -> 129.30000000000001 | AK87: 124.2 | AL87: 109 | AM87: 33.3 | AN87: 131 | AO87: 0.109 | AP87: 48 | AQ87: 永鼎转债!
A88: 329 | B88: 128037 | C88: 岩土转债! | D88: 2542. | E88: 中化岩土 | F88: 建筑 | G88: 建筑工程 | H88: 103.1 | I88: 6.3e-003 | J88: -6.0000000000000001e-003 | K88: 3.2 | L88: 9.9700000000000011e-002 | M88: 111.3 | N88: 7.99 | O88: 1.5700000000000001 | P88: 40.05 | Q88: 转股中 | R88: 2.74年 | S88: 0.74年 | T88: 5.99 | U88: 170 | V88: 0.27200000000000002 | W88: 0.10400000000000001 | X88: 4.2000000000000003e-002 | Y88: 58 | Z88: 1.46 | AA88: 2.8799999999999999e-002 | AB88: 2.0899999999999998e-002 | AC88: -1.3899999999999999e-002 | AD88: -1.78e-002 | AE88: 98.13 | AF88: 99.77 | AG88: 0 | AH88: AA | AI88: 4.1399999999999999e-002 | AJ88: =H88+100*O88 -> 260.10000000000002 | AK88: 166.1 | AL88: 328 | AM88: 66.4 | AN88: 318 | AO88: 8.5999999999999993e-002 | AP88: 49 | AQ88: 岩土转债!
A89: 286 | B89: 110056 | C89: 亨通转债! | D89: 600487 | E89: 亨通光电 | F89: 通信互联 | G89: 通信设备 | H89: 103.02 | I89: 2.0000000000000001e-004 | J89: 4.0000000000000002e-004 | K89: 11.56 | L89: 2.5999999999999999e-003 | M89: 114.3 | N89: 15.01 | O89: 0.33799999999999997 | P89: 77.02 | Q89: 转股中 | R89: 3.75年 | S89: 1.75年 | T89: 17.1 | U89: 2 | V89: 1.e-003 | W89: 6.3e-002 | X89: 4.8000000000000001e-002 | Y89: 273 | Z89: 1.36 | AA89: 2.86e-002 | AB89: 2.1499999999999998e-002 | AC89: -1.1000000000000001e-003 | AD89: -4.0000000000000001e-003 | AE89: 95.42 | AF89: 98.97 | AG89: 0.23 | AH89: AA+ | AI89: 3.9900000000000005e-002 | AJ89: =H89+100*O89 -> 136.81999999999999 | AK89: 129 | AL89: 157 | AM89: 30 | AN89: 90 | AO89: -2.1000000000000001e-002 | AP89: 28 | AQ89: 亨通转债!
A90: 8 | B90: 127033 | C90: 中装转2 | D90: 2822. | E90: 中装建设 | F90: 建筑 | G90: 装饰工程 | H90: 100.045 | I90: -8.0000000000000004e-004 | J90: 2.5999999999999999e-003 | K90: 5.54 | L90: 3.5999999999999999e-003 | M90: 117.1 | N90: 6.28 | O90: 0.13400000000000001 | P90: 88.22 | Q90: 4月6天 | R90: 5.83年 | S90: 3.83年 | T90: 11.6 | U90: 24 | V90: 2.1000000000000001e-002 | W90: 0.28999999999999998 | X90: 0.25600000000000001 | Y90: 40 | Z90: 1.19 | AA90: 2.7900000000000001e-002 | AB90: 2.2499999999999999e-002 | AC90: 8.8999999999999999e-003 | AD90: 7.0999999999999995e-003 | AE90: 87.32 | AF90: 91.47 | AG90: 0.49 | AH90: AA | AI90: 4.41e-002 | AJ90: =H90+100*O90 -> 113.44500000000001 | AK90: 111.9 | AL90: 11 | AM90: 20.4 | AN90: 17 | AO90: -3.6000000000000004e-002 | AP90: 19 | AQ90: 中装转2
A91: 145 | B91: 128120 | C91: 联诚转债! | D91: 2921. | E91: 联诚精密 | F91: 汽车 | G91: 零部件制 | H91: 103.403 | I91: 4.8999999999999998e-003 | J91: 7.000000000000001e-004 | K91: 15.5 | L91: 9.1000000000000004e-003 | M91: 118.4 | N91: 18.44 | O91: 0.23000000000000001 | P91: 84.06 | Q91: 转股中 | R91: 5年28天 | S91: 3年29天 | T91: 2.6 | U91: 1.9 | V91: 6.9999999999999993e-003 | W91: 0.158 | X91: 0.13300000000000001 | Y91: 16 | Z91: 1.6 | AA91: 2.7699999999999999e-002 | AB91: 2.1099999999999997e-002 | AC91: 3.4999999999999996e-003 | AD91: 8.0000000000000004e-004 | AE91: 80.29 | AF91: 78.74 | AG91: 0.62 | AH91: A | AI91: 8.6099999999999996e-002 | AJ91: =H91+100*O91 -> 126.40300000000001 | AK91: 122.7 | AL91: 86 | AM91: 42.5 | AN91: 218 | AO91: -2.e-002 | AP91: 21 | AQ91: 联诚转债!
A92: 236 | B92: 113549 | C92: 白电转债 | D92: 603861 | E92: 白云电器 | F92: 能源电力 | G92: 电力设备 | H92: 102.21 | I92: -1.e-004 | J92: 1.8e-003 | K92: 7.91 | L92: 3.8e-003 | M92: 114.8 | N92: 8.88 | O92: 0.14699999999999999 | P92: 89.08 | Q92: 转股中 | R92: 4.41年 | S92: 2.41年 | T92: 8.8 | U92: 6.8 | V92: 8.0000000000000002e-003 | W92: 0.252 | X92: 0.22399999999999998 | Y92: 35 | Z92: 1.36 | AA92: 2.7200000000000002e-002 | AB92: 2.1000000000000001e-002 | AC92: 4.1999999999999997e-003 | AD92: 1.6000000000000001e-003 | AE92: 92.8 | AF92: 95.74 | AG92: 0.44 | AH92: AA | AI92: 4.2900000000000001e-002 | AJ92: =H92+100*O92 -> 116.91 | AK92: 115.3 | AL92: 23 | AM92: 19.6 | AN92: 14 | AO92: -8.0000000000000002e-003 | AP92: 40 | AQ92: 白电转债
A93: 271 | B93: 127013 | C93: 创维转债! | D93: 810. | E93: 创维数字 | F93: 电子 | G93: 电子产品 | H93: 106.105 | I93: -1.09e-002 | J93: 1.9e-003 | K93: 9.09 | L93: -3.4000000000000002e-002 | M93: 117.3 | N93: 11.29 | O93: 0.318 | P93: 80.51 | Q93: 转股中 | R93: 3.82年 | S93: 1.83年 | T93: 9.78 | U93: 7.4 | V93: 6.9999999999999993e-003 | W93: 0.10099999999999999 | X93: 8.1000000000000003e-002 | Y93: 97 | Z93: 2.29 | AA93: 2.7099999999999999e-002 | AB93: 1.8799999999999997e-002 | AC93: -1.5900000000000001e-002 | AD93: -1.8600000000000002e-002 | AE93: 94.61 | AF93: 100.18 | AG93: 0.27 | AH93: AA | AI93: 4.2900000000000001e-002 | AJ93: =H93+100*O93 -> 137.905 | AK93: 131.7 | AL93: 188 | AM93: 31.5 | AN93: 111 | AO93: 4.0999999999999995e-002 | AP93: 23 | AQ93: 创维转债!
A94: 58 | B94: 123087 | C94: 明电转债! | D94: 300739 | E94: 明阳电路 | F94: 电子 | G94: 元器件制 | H94: 104.99 | I94: 1.84e-002 | J94: 1.9599999999999999e-002 | K94: 15.75 | L94: 6.0599999999999994e-002 | M94: 121.2 | N94: 16.32 | O94: 8.8000000000000009e-002 | P94: 96.51 | Q94: 3.2天 | R94: 5.49年 | S94: 4.49年 | T94: 6.73 | U94: 83 | V94: 0.11699999999999999 | W94: 0.153 | X94: 0.14800000000000002 | Y94: 44 | Z94: 3.11 | AA94: 2.7099999999999999e-002 | AB94: 2.0199999999999999e-002 | AC94: 3.4999999999999996e-003 | AD94: 8.0000000000000004e-004 | AE94: 79.96 | AF94: 86.38 | AG94: 0.63 | AH94: AA- | AI94: 6.5099999999999991e-002 | AJ94: =H94+100*O94 -> 113.78999999999999 | AK94: 113.5 | AL94: 15 | AM94: 27.1 | AN94: 57 | AO94: 8.199999999999999e-002 | AP94: 16 | AQ94: 明电转债!
A95: 104 | B95: 123068 | C95: 弘信转债 | D95: 300657 | E95: 弘信电子 | F95: 电子 | G95: 元器件制 | H95: 105.552 | I95: 1.1000000000000001e-002 | J95: -1.1399999999999999e-002 | K95: 16.21 | L95: -5.9999999999999995e-004 | M95: 121.2 | N95: 18.45 | O95: 0.20100000000000001 | P95: 87.86 | Q95: 转股中 | R95: 5.32年 | S95: 3.33年 | T95: 5.7 | U95: 11 | V95: 1.8000000000000002e-002 | W95: 0.10300000000000001 | X95: 8.9999999999999997e-002 | Y95: 55 | Z95: 3.95 | AA95: 2.69e-002 | AB95: 1.9799999999999998e-002 | AC95: -3.9000000000000003e-003 | AD95: -6.1999999999999998e-003 | AE95: 83.76 | AF95: 87.3 | AG95: 0.54 | AH95: AA- | AI95: 6.5099999999999991e-002 | AJ95: =H95+100*O95 -> 125.65200000000002 | AK95: 123.2 | AL95: 93 | AM95: 35.9 | AN95: 164 | AO95: 1.2e-002 | AP95: 8 | AQ95: 弘信转债
A96: 167 | B96: 123053 | C96: 宝通转债! | D96: 300031 | E96: 宝通科技 | F96: 通信互联 | G96: 互联网 | H96: 106.31 | I96: 3.2000000000000002e-003 | J96: 4.7999999999999996e-003 | K96: 16.67 | L96: 1.83e-002 | M96: 120.8 | N96: 20.8 | O96: 0.32600000000000001 | P96: 80.14 | Q96: 转股中 | R96: 4.96年 | S96: 2.96年 | T96: 5 | U96: 5 | V96: 9.0000000000000011e-003 | W96: 7.5999999999999998e-002 | X96: 6.0999999999999999e-002 | Y96: 66 | Z96: 2.15 | AA96: 2.6600000000000002e-002 | AB96: 1.9199999999999998e-002 | AC96: -7.9000000000000008e-003 | AD96: -1.0200000000000001e-002 | AE96: 85.59 | AF96: 89.4 | AG96: 0.44 | AH96: AA- | AI96: 6.3899999999999998e-002 | AJ96: =H96+100*O96 -> 138.91 | AK96: 132.5 | AL96: 197 | AM96: 43.1 | AN96: 224 | AO96: -4.8000000000000001e-002 | AP96: 10 | AQ96: 宝通转债!
A97: 126 | B97: 127021 | C97: 特发转2! | D97: 70. | E97: 特发信息 | F97: 通信互联 | G97: 通信设备 | H97: 101.857 | I97: -4.0000000000000002e-004 | J97: 3.2000000000000002e-003 | K97: 7.87 | L97: 2.0799999999999999e-002 | M97: 113.3 | N97: 12.33 | O97: 0.59599999999999997 | P97: 63.83 | Q97: 转股中 | R97: 4年49天 | S97: 2年50天 | T97: 5.5 | U97: 3.1 | V97: 6.0000000000000001e-003 | W97: 8.5000000000000006e-002 | X97: 5.4000000000000006e-002 | Y97: 65 | Z97: 2.22 | AA97: 2.64e-002 | AB97: 2.0400000000000001e-002 | AC97: 8.0000000000000004e-004 | AD97: -8.9999999999999998e-004 | AE97: 92.69 | AF97: 95.46 | AG97: 0.14 | AH97: AA | AI97: 4.2900000000000001e-002 | AJ97: =H97+100*O97 -> 161.45699999999999 | AK97: 139.9 | AL97: 259 | AM97: 44.4 | AN97: 238 | AO97: 4.9000000000000002e-002 | AP97: 12 | AQ97: 特发转2!
A98: 138 | B98: 113037 | C98: 紫银转债 | D98: 601860 | E98: 紫金银行 | F98: 金融 | G98: 银行行业 | H98: 101.8 | I98: -1.e-003 | J98: 2.e-003 | K98: 3.7 | L98: 2.7000000000000001e-003 | M98: 115.8 | N98: 4.65 | O98: 0.27899999999999997 | P98: 79.57 | Q98: 转股中 | R98: 5年34天 | S98: 无权 | T98: 45 | U98: 17 | V98: 4.0000000000000001e-003 | W98: 0.33200000000000002 | X98: 0.26400000000000001 | Y98: 135 | Z98: 0.92 | AA98: 2.6200000000000001e-002 | AB98: 2.0400000000000001e-002 | AC98: 无权 | AD98: 无权 | AE98: 无权 | AF98: 94.75 | AG98: 0.36 | AH98: AA+ | AI98: 4.1100000000000005e-002 | AJ98: =H98+100*O98 -> 129.69999999999999 | AK98: 124 | AL98: 105 | AM98: 29.3 | AN98: 86 | AO98: -3.1e-002 | AP98: 20 | AQ98: 紫银转债
A99: 114 | B99: 123065 | C99: 宝莱转债! | D99: 300246 | E99: 宝莱特 | F99: 医药 | G99: 医疗器械 | H99: 106.42 | I99: -5.0000000000000001e-004 | J99: 1.2999999999999999e-003 | K99: 18.53 | L99: 1.04e-002 | M99: 121.4 | N99: 40.54 | O99: 1.3300000000000001 | P99: 45.71 | Q99: 转股中 | R99: 5.21年 | S99: 3.21年 | T99: 2.19 | U99: 9.7 | V99: 4.2000000000000003e-002 | W99: 8.1000000000000003e-002 | X99: 3.7000000000000005e-002 | Y99: 27 | Z99: 3.05 | AA99: 2.6200000000000001e-002 | AB99: 1.89e-002 | AC99: -5.8999999999999999e-003 | AD99: -8.3999999999999995e-003 | AE99: 84.51 | AF99: 88.07 | AG99: 0.08 | AH99: AA- | AI99: 6.5099999999999991e-002 | AJ99: =H99+100*O99 -> 239.42000000000002 | AK99: 167.1 | AL99: 329 | AM99: 79.1 | AN99: 334 | AO99: -2.7000000000000003e-002 | AP99: 18 | AQ99: 宝莱转债!
A100: 153 | B100: 128118 | C100: 瀛通转债! | D100: 2861. | E100: 瀛通通讯 | F100: 电子 | G100: 电子产品 | H100: 107.7 | I100: 7.5899999999999995e-002 | J100: -2.7999999999999997e-002 | K100: 17.55 | L100: 0.10000000000000001 | M100: 122.1 | N100: 21.12 | O100: 0.29600000000000004 | P100: 83.1 | Q100: 转股中 | R100: 5年13天 | S100: 3年14天 | T100: 3 | U100: 598 | V100: 1.8400000000000001 | W100: 0.10800000000000001 | X100: 8.9999999999999997e-002 | Y100: 28 | Z100: 2 | AA100: 2.5899999999999999e-002 | AB100: 1.8100000000000002e-002 | AC100: -9.1999999999999998e-003 | AD100: -1.1899999999999999e-002 | AE100: 85.7 | AF100: 89.62 | AG100: 0.48 | AH100: AA- | AI100: 6.5099999999999991e-002 | AJ100: =H100+100*O100 -> 137.30000000000001 | AK100: 132.3 | AL100: 194 | AM100: 42.7 | AN100: 219 | AO100: 0.16 | AP100: 16 | AQ100: 瀛通转债!
A101: 113 | B101: 128131 | C101: 崇达转2! | D101: 2815. | E101: 崇达技术 | F101: 电子 | G101: 元器件制 | H101: 101.061 | I101: 5.9999999999999995e-004 | J101: -1.2999999999999999e-003 | K101: 12.44 | L101: -4.0000000000000001e-003 | M101: 115.2 | N101: 19.38 | O101: 0.57399999999999995 | P101: 64.19 | Q101: 转股中 | R101: 5.22年 | S101: 3.22年 | T101: 14 | U101: 2.9 | V101: 2.e-003 | W101: 0.129 | X101: 8.199999999999999e-002 | Y101: 109 | Z101: 2.6 | AA101: 2.5899999999999999e-002 | AB101: 2.0499999999999997e-002 | AC101: 7.7000000000000002e-003 | AD101: 5.6000000000000008e-003 | AE101: 89.73 | AF101: 92.39 | AG101: 0.19 | AH101: AA | AI101: 4.41e-002 | AJ101: =H101+100*O101 -> 158.46100000000001 | AK101: 137.9 | AL101: 245 | AM101: 45.5 | AN101: 242 | AO101: 4.8000000000000001e-002 | AP101: 9 | AQ101: 崇达转2!
A102: 228 | B102: 128087 | C102: 孚日转债! | D102: 2083. | E102: 孚日股份 | F102: 服装纺织 | G102: 家纺 | H102: 100.99 | I102: 0. | J102: 3.7000000000000002e-003 | K102: 4.2 | L102: 7.1999999999999998e-003 | M102: 112.9 | N102: 4.5 | O102: 8.199999999999999e-002 | P102: 93.33 | Q102: 转股中 | R102: 4.50年 | S102: 2.50年 | T102: 6.5 | U102: 6.6 | V102: 1.e-002 | W102: 0.17000000000000001 | X102: 0.159 | Y102: 38 | Z102: 1.05 | AA102: 2.5600000000000001e-002 | AB102: 2.0199999999999999e-002 | AC102: 9.0000000000000011e-003 | AD102: 6.4000000000000003e-003 | AE102: 92.55 | AF102: 93.84 | AG102: 0.51 | AH102: AA | AI102: 4.2900000000000001e-002 | AJ102: =H102+100*O102 -> 109.19 | AK102: 108.6 | AL102: 6 | AM102: 14.8 | AN102: 7 | AO102: -2.e-003 | AP102: 64 | AQ102: 孚日转债!
A103: 135 | B103: 128123 | C103: 国光转债! | D103: 2749. | E103: 国光股份 | F103: 化工 | G103: 农化 | H103: 102.6 | I103: 3.4000000000000002e-003 | J103: 6.6e-003 | K103: 9.21 | L103: 2.9100000000000001e-002 | M103: 116.2 | N103: 13.48 | O103: 0.502 | P103: 68.32 | Q103: 转股中 | R103: 5年38天 | S103: 3年39天 | T103: 3.2 | U103: 1.2 | V103: 4.0000000000000001e-003 | W103: 8.0000000000000002e-002 | X103: 5.4000000000000006e-002 | Y103: 40 | Z103: 3.22 | AA103: 2.53e-002 | AB103: 1.9400000000000001e-002 | AC103: 4.5999999999999999e-003 | AD103: 2.0999999999999999e-003 | AE103: 84.93 | AF103: 84.9 | AG103: 0.35 | AH103: AA- | AI103: 6.5099999999999991e-002 | AJ103: =H103+100*O103 -> 152.80000000000001 | AK103: 136.9 | AL103: 234 | AM103: 51.9 | AN103: 271 | AO103: -5.5e-002 | AP103: 12 | AQ103: 国光转债!
A104: 64 | B104: 127027 | C104: 靖远转债! | D104: 552. | E104: 靖远煤电 | F104: 煤炭 | G104: 煤炭开采 | H104: 100.799 | I104: -6.0000000000000001e-003 | J104: -9.1000000000000004e-003 | K104: 3.05 | L104: -2.87e-002 | M104: 115.3 | N104: 3.23 | O104: 6.7000000000000004e-002 | P104: 94.43 | Q104: 转股中 | R104: 5.48年 | S104: 3.48年 | T104: 28 | U104: 58 | V104: 2.1000000000000001e-002 | W104: 0.40100000000000002 | X104: 0.379 | Y104: 70 | Z104: 0.87 | AA104: 2.53e-002 | AB104: 2.0099999999999996e-002 | AC104: 8.199999999999999e-003 | AD104: 6.0999999999999995e-003 | AE104: 89.76 | AF104: 92.88 | AG104: 0.53 | AH104: AA+ | AI104: 4.1100000000000005e-002 | AJ104: =H104+100*O104 -> 107.49900000000001 | AK104: 107.2 | AL104: 3 | AM104: 14.3 | AN104: 5 | AO104: 1.2e-002 | AP104: 39 | AQ104: 靖远转债!
A105: 62 | B105: 123086 | C105: 海兰转债! | D105: 300065 | E105: 海兰信 | F105: 电子 | G105: 电子产品 | H105: 108.026 | I105: 4.8999999999999998e-003 | J105: -5.5000000000000005e-003 | K105: 10.98 | L105: -8.9999999999999998e-004 | M105: 123.5 | N105: 10.88 | O105: 7.0000000000000007e-002 | P105: 100.92 | Q105: 转股中 | R105: 5.48年 | S105: 3.48年 | T105: 7.3 | U105: 18 | V105: 2.3e-002 | W105: 0.16699999999999998 | X105: 0.16800000000000001 | Y105: 44 | Z105: 2.94 | AA105: 2.52e-002 | AB105: 1.78e-002 | AC105: -1.09e-002 | AD105: -1.29e-002 | AE105: 82.69 | AF105: 88.01 | AG105: 0.63 | AH105: AA- | AI105: 6.5099999999999991e-002 | AJ105: =H105+100*O105 -> 115.026 | AK105: 115.1 | AL105: 20 | AM105: 27.1 | AN105: 59 | AO105: 3.3000000000000002e-002 | AP105: 17 | AQ105: 海兰转债!
A106: 61 | B106: 123085 | C106: 万顺转2! | D106: 300057 | E106: 万顺新材 | F106: 有色金属 | G106: 铝金属 | H106: 99.199 | I106: -6.9999999999999993e-003 | J106: 1.0200000000000001e-002 | K106: 5.13 | L106: 5.8999999999999999e-003 | M106: 113.3 | N106: 6.2 | O106: 0.19899999999999998 | P106: 82.74 | Q106: 转股中 | R106: 5.48年 | S106: 3.48年 | T106: 9 | U106: 14 | V106: 1.6e-002 | W106: 0.26000000000000001 | X106: 0.215 | Y106: 35 | Z106: 0.97 | AA106: 2.5099999999999997e-002 | AB106: 2.0499999999999997e-002 | AC106: 1.26e-002 | AD106: 1.06e-002 | AE106: 82.67 | AF106: 80.78 | AG106: 0.55 | AH106: AA- | AI106: 6.5099999999999991e-002 | AJ106: =H106+100*O106 -> 119.09899999999999 | AK106: 115.7 | AL106: 26 | AM106: 33 | AN106: 124 | AO106: 3.7999999999999999e-002 | AP106: 25 | AQ106: 万顺转2!
A107: 3 | B107: 111000 | C107: 起帆转债 | D107: 605222 | E107: 起帆电缆 | F107: 能源电力 | G107: 电力设备 | H107: 104.3 | I107: -1.8e-003 | J107: -6.6e-003 | K107: 19.8 | L107: -1.3000000000000001e-002 | M107: 120.5 | N107: 20.53 | O107: 8.1000000000000003e-002 | P107: 96.44 | Q107: 5月14天 | R107: 5.93年 | S107: 3.93年 | T107: 10 | U107: 135 | V107: 0.129 | W107: 0.126 | X107: 0.122 | Y107: 79 | Z107: 2.72 | AA107: 2.5099999999999997e-002 | AB107: 1.9e-002 | AC107: -1.1000000000000001e-003 | AD107: -2.8999999999999998e-003 | AE107: 80.38 | AF107: 83.49 | AG107: 0.65 | AH107: AA- | AI107: 6.5099999999999991e-002 | AJ107: =H107+100*O107 -> 112.39999999999999 | AK107: 112.2 | AL107: 12 | AM107: 28.7 | AN107: 77 | AO107: -6.9999999999999993e-003 | AP107: 3 | AQ107: 起帆转债
A108: 205 | B108: 113568 | C108: 新春转债! | D108: 603667 | E108: 五洲新春 | F108: 机械装备 | G108: 通用设备 | H108: 111.02 | I108: -3.5999999999999999e-003 | J108: 1.38e-002 | K108: 9.04 | L108: 1.6899999999999998e-002 | M108: 124.3 | N108: 8.75 | O108: 7.4999999999999997e-002 | P108: 103.31 | Q108: 转股中 | R108: 4.71年 | S108: 2.72年 | T108: 3.3 | U108: 5.7 | V108: 1.4999999999999999e-002 | W108: 0.125 | X108: 0.129 | Y108: 26 | Z108: 1.49 | AA108: 2.4799999999999999e-002 | AB108: 1.5900000000000001e-002 | AC108: -2.1899999999999999e-002 | AD108: -2.46e-002 | AE108: 87.36 | AF108: 93.47 | AG108: 0.6 | AH108: AA- | AI108: 6.3899999999999998e-002 | AJ108: =H108+100*O108 -> 118.52 | AK108: 118.7 | AL108: 50 | AM108: 25.3 | AN108: 41 | AO108: 8.0000000000000002e-003 | AP108: 49 | AQ108: 新春转债!
A109: 44 | B109: 113619 | C109: 世运转债! | D109: 603920 | E109: 世运电路 | F109: 电子 | G109: 元器件制 | H109: 100.73 | I109: 1.e-004 | J109: 3.4999999999999996e-003 | K109: 12.68 | L109: 1.6799999999999999e-002 | M109: 115.2 | N109: 19.92 | O109: 0.58200000000000007 | P109: 63.65 | Q109: 38天 | R109: 5.59年 | S109: 3.59年 | T109: 10 | U109: 4.2 | V109: 4.0000000000000001e-003 | W109: 0.14800000000000002 | X109: 9.4e-002 | Y109: 67 | Z109: 1.9 | AA109: 2.4799999999999999e-002 | AB109: 1.9699999999999999e-002 | AC109: 7.8000000000000005e-003 | AD109: 5.8999999999999999e-003 | AE109: 88.31 | AF109: 90.92 | AG109: 0.21 | AH109: AA | AI109: 4.41e-002 | AJ109: =H109+100*O109 -> 158.93000000000001 | AK109: 137.8 | AL109: 240 | AM109: 46.9 | AN109: 249 | AO109: -0.20999999999999999 | AP109: 5 | AQ109: 世运转债!
A110: 207 | B110: 113567 | C110: 君禾转债! | D110: 603617 | E110: 君禾股份 | F110: 机械装备 | G110: 通用设备 | H110: 106.16 | I110: 2.7000000000000001e-003 | J110: -1.e-003 | K110: 9.82 | L110: 3.0999999999999999e-003 | M110: 118.8 | N110: 11.16 | O110: 0.20600000000000002 | P110: 87.99 | Q110: 转股中 | R110: 4.71年 | S110: 2.71年 | T110: 2.1 | U110: 0.5 | V110: 2.e-003 | W110: 0.107 | X110: 9.4e-002 | Y110: 20 | Z110: 2.77 | AA110: 2.4700000000000003e-002 | AB110: 1.7500000000000002e-002 | AC110: -7.3000000000000001e-003 | AD110: -9.8999999999999991e-003 | AE110: 84.66 | AF110: 85.24 | AG110: 0.57 | AH110: A+ | AI110: 7.4900000000000008e-002 | AJ110: =H110+100*O110 -> 126.75999999999999 | AK110: 124.3 | AL110: 111 | AM110: 39.1 | AN110: 188 | AO110: -6.9999999999999993e-003 | AP110: 34 | AQ110: 君禾转债!
A111: 253 | B111: 128073 | C111: 哈尔转债! | D111: 2615. | E111: 哈尔斯 | F111: 其他 | G111: 家居用品 | H111: 106.869 | I111: 4.5000000000000005e-003 | J111: 5.5000000000000005e-003 | K111: 4.72 | L111: 2.8300000000000002e-002 | M111: 115.3 | N111: 5.7 | O111: 0.29100000000000004 | P111: 82.81 | Q111: 转股中 | R111: 3.18年 | S111: 1.18年 | T111: 2.99 | U111: 11 | V111: 3.5000000000000003e-002 | W111: 0.153 | X111: 0.127 | Y111: 19 | Z111: 2.48 | AA111: 2.46e-002 | AB111: 1.5800000000000002e-002 | AC111: -3.4000000000000002e-002 | AD111: -3.6799999999999999e-002 | AE111: 93.96 | AF111: 95.02 | AG111: 0.35 | AH111: AA- | AI111: 6.3899999999999998e-002 | AJ111: =H111+100*O111 -> 135.96899999999999 | AK111: 130.9 | AL111: 182 | AM111: 35.9 | AN111: 163 | AO111: 4.0000000000000001e-003 | AP111: 40 | AQ111: 哈尔转债!
A112: 330 | B112: 127006 | C112: 敖东转债! | D112: 623. | E112: 吉林敖东 | F112: 金融 | G112: 证券行业 | H112: 100.82 | I112: -1.8e-003 | J112: 8.9999999999999998e-004 | K112: 15.32 | L112: -5.1999999999999998e-003 | M112: 107.4 | N112: 20.42 | O112: 0.34399999999999997 | P112: 75.02 | Q112: 转股中 | R112: 2.73年 | S112: 0.73年 | T112: 24.1 | U112: 5 | V112: 2.e-003 | W112: 0.13500000000000001 | X112: 0.10099999999999999 | Y112: 178 | Z112: 0.77 | AA112: 2.3700000000000002e-002 | AB112: 1.84e-002 | AC112: 2.7000000000000001e-003 | AD112: 4.0000000000000002e-004 | AE112: 97.7 | AF112: 97 | AG112: 0.17 | AH112: AA+ | AI112: 3.8399999999999997e-002 | AJ112: =H112+100*O112 -> 135.22 | AK112: 126.6 | AL112: 133 | AM112: 28.9 | AN112: 81 | AO112: -1.8000000000000002e-002 | AP112: 27 | AQ112: 敖东转债!
A113: 294 | B113: 113528 | C113: 长城转债! | D113: 603897 | E113: 长城科技 | F113: 机械装备 | G113: 专用设备 | H113: 107.3 | I113: -1.01e-002 | J113: -4.6999999999999993e-003 | K113: 21.86 | L113: -2.8399999999999998e-002 | M113: 116.8 | N113: 23.35 | O113: 0.14599999999999999 | P113: 93.62 | Q113: 转股中 | R113: 3.70年 | S113: 1.70年 | T113: 6.34 | U113: 48 | V113: 7.0999999999999994e-002 | W113: 0.16300000000000001 | X113: 0.152 | Y113: 39 | Z113: 1.99 | AA113: 2.3700000000000002e-002 | AB113: 1.54e-002 | AC113: -2.12e-002 | AD113: -2.4300000000000002e-002 | AE113: 91.96 | AF113: 93.33 | AG113: 0.52 | AH113: AA- | AI113: 6.3899999999999998e-002 | AJ113: =H113+100*O113 -> 121.89999999999999 | AK113: 121 | AL113: 73 | AM113: 27.6 | AN113: 66 | AO113: 0.107 | AP113: 39 | AQ113: 长城转债!
A114: 248 | B114: 128076 | C114: 金轮转债! | D114: 2722. | E114: 金轮股份 | F114: 机械装备 | G114: 专用设备 | H114: 104.193 | I114: 7.0999999999999995e-003 | J114: 5.4000000000000003e-003 | K114: 12.44 | L114: 2.5600000000000001e-002 | M114: 114.9 | N114: 14.66 | O114: 0.22800000000000001 | P114: 84.86 | Q114: 转股中 | R114: 4.32年 | S114: 2.32年 | T114: 2.14 | U114: 3.1 | V114: 1.3999999999999999e-002 | W114: 9.8000000000000004e-002 | X114: 8.3000000000000004e-002 | Y114: 22 | Z114: 1.15 | AA114: 2.3399999999999997e-002 | AB114: 1.7000000000000001e-002 | AC114: -3.0999999999999999e-003 | AD114: -5.7999999999999996e-003 | AE114: 88.77 | AF114: 88.43 | AG114: 0.49 | AH114: AA- | AI114: 6.3899999999999998e-002 | AJ114: =H114+100*O114 -> 126.99299999999999 | AK114: 123.5 | AL114: 101 | AM114: 34.8 | AN114: 145 | AO114: 3.3000000000000002e-002 | AP114: 41 | AQ114: 金轮转债!
A115: 162 | B115: 128114 | C115: 正邦转债! | D115: 2157. | E115: 正邦科技 | F115: 农业 | G115: 畜牧业 | H115: 102.571 | I115: -6.0999999999999995e-003 | J115: 1.6000000000000001e-003 | K115: 11.62 | L115: -1.3600000000000001e-002 | M115: 114.9 | N115: 14.76 | O115: 0.30299999999999999 | P115: 78.73 | Q115: 转股中 | R115: 4.99年 | S115: 2.998年 | T115: 16 | U115: 87 | V115: 5.2999999999999999e-002 | W115: 4.4000000000000004e-002 | X115: 3.4000000000000002e-002 | Y115: 366 | Z115: 1.56 | AA115: 2.3399999999999997e-002 | AB115: 1.7899999999999999e-002 | AC115: 2.5999999999999999e-003 | AD115: 5.0000000000000001e-004 | AE115: 91.45 | AF115: 94.84 | AG115: 0.33 | AH115: AA+ | AI115: 3.9900000000000005e-002 | AJ115: =H115+100*O115 -> 132.87100000000001 | AK115: 126.4 | AL115: 132 | AM115: 31.6 | AN115: 112 | AO115: -8.5999999999999993e-002 | AP115: 16 | AQ115: 正邦转债!
A116: 203 | B116: 113570 | C116: 百达转债! | D116: 603331 | E116: 百达精工 | F116: 机械装备 | G116: 机械装备 | H116: 103.33 | I116: 3.0000000000000001e-003 | J116: -5.9999999999999995e-004 | K116: 10.14 | L116: 4.0000000000000001e-003 | M116: 114.9 | N116: 11.54 | O116: 0.17600000000000002 | P116: 87.87 | Q116: 转股中 | R116: 4.73年 | S116: 2.73年 | T116: 2.8 | U116: 0.8 | V116: 3.0000000000000001e-003 | W116: 0.155 | X116: 0.13600000000000001 | Y116: 18 | Z116: 2.15 | AA116: 2.3199999999999998e-002 | AB116: 1.7299999999999999e-002 | AC116: 2.9999999999999997e-004 | AD116: -2.e-003 | AE116: 84.04 | AF116: 82.23 | AG116: 0.6 | AH116: A+ | AI116: 7.4900000000000008e-002 | AJ116: =H116+100*O116 -> 120.93000000000001 | AK116: 118.8 | AL116: 52 | AM116: 34.7 | AN116: 144 | AO116: 1.e-002 | AP116: 34 | AQ116: 百达转债!
A117: 25 | B117: 113046 | C117: 金田转债 | D117: 601609 | E117: 金田铜业 | F117: 有色金属 | G117: 铜金属 | H117: 100.93 | I117: -3.2000000000000002e-003 | J117: -8.9999999999999998e-004 | K117: 8.68 | L117: -1.03e-002 | M117: 114.9 | N117: 10.95 | O117: 0.27300000000000002 | P117: 79.27 | Q117: 3月11天 | R117: 5.76年 | S117: 3.76年 | T117: 15 | U117: 6 | V117: 4.0000000000000001e-003 | W117: 0.11699999999999999 | X117: 9.3000000000000013e-002 | Y117: 129 | Z117: 1.85 | AA117: 2.3199999999999998e-002 | AB117: 1.84e-002 | AC117: 6.1999999999999998e-003 | AD117: 4.5000000000000005e-003 | AE117: 88.39 | AF117: 91.48 | AG117: 0.4 | AH117: AA+ | AI117: 4.1100000000000005e-002 | AJ117: =H117+100*O117 -> 128.23000000000002 | AK117: 122.6 | AL117: 84 | AM117: 31.1 | AN117: 107 | AO117: -4.2000000000000003e-002 | AP117: 11 | AQ117: 金田转债
A118: 231 | B118: 128083 | C118: 新北转债! | D118: 2376. | E118: 新北洋 | F118: 电子 | G118: 电子产品 | H118: 104.019 | I118: 5.1999999999999998e-003 | J118: -1.7000000000000001e-003 | K118: 9.36 | L118: 9.7000000000000003e-003 | M118: 114.9 | N118: 11.45 | O118: 0.27200000000000002 | P118: 81.75 | Q118: 转股中 | R118: 4.48年 | S118: 2.49年 | T118: 8.77 | U118: 3.4 | V118: 4.0000000000000001e-003 | W118: 0.14099999999999999 | X118: 0.115 | Y118: 62 | Z118: 1.8 | AA118: 2.29e-002 | AB118: 1.67e-002 | AC118: -2.3e-003 | AD118: -4.7999999999999996e-003 | AE118: 92.61 | AF118: 95.55 | AG118: 0.36 | AH118: AA | AI118: 4.2900000000000001e-002 | AJ118: =H118+100*O118 -> 131.21899999999999 | AK118: 126.3 | AL118: 131 | AM118: 30.7 | AN118: 104 | AO118: 1.9e-002 | AP118: 19 | AQ118: 新北转债!
A119: 301 | B119: 113525 | C119: 台华转债! | D119: 603055 | E119: 台华新材 | F119: 服装纺织 | G119: 纺织行业 | H119: 105.8 | I119: 2.5999999999999999e-003 | J119: 0. | K119: 6.16 | L119: 9.7999999999999997e-003 | M119: 114.3 | N119: 7.78 | O119: 0.33600000000000002 | P119: 79.18 | Q119: 转股中 | R119: 3.50年 | S119: 1.50年 | T119: 4.69 | U119: 1.3 | V119: 3.0000000000000001e-003 | W119: 9.1999999999999998e-002 | X119: 7.2999999999999995e-002 | Y119: 51 | Z119: 1.69 | AA119: 2.2799999999999997e-002 | AB119: 1.52e-002 | AC119: -1.7299999999999999e-002 | AD119: -2.0499999999999997e-002 | AE119: 95.91 | AF119: 98.97 | AG119: 0.26 | AH119: AA | AI119: 4.2900000000000001e-002 | AJ119: =H119+100*O119 -> 139.40000000000001 | AK119: 132.4 | AL119: 196 | AM119: 33.4 | AN119: 134 | AO119: 1.1000000000000001e-002 | AP119: 20 | AQ119: 台华转债!
A120: 12 | B120: 123112 | C120: 万讯转债 | D120: 300112 | E120: 万讯自控 | F120: 机械装备 | G120: 专用设备 | H120: 109.601 | I120: 1.67e-002 | J120: 7.4999999999999997e-003 | K120: 8.83 | L120: 3.8800000000000001e-002 | M120: 124.4 | N120: 8.93 | O120: 0.10800000000000001 | P120: 98.88 | Q120: 3月28天 | R120: 5.80年 | S120: 3.81年 | T120: 2.46 | U120: 19 | V120: 7.0999999999999994e-002 | W120: 9.6999999999999989e-002 | X120: 9.6000000000000002e-002 | Y120: 25 | Z120: 2.36 | AA120: 2.2499999999999999e-002 | AB120: 1.5300000000000001e-002 | AC120: -1.2500000000000001e-002 | AD120: -1.4499999999999999e-002 | AE120: 81.41 | AF120: 86.93 | AG120: 0.62 | AH120: AA- | AI120: 6.5099999999999991e-002 | AJ120: =H120+100*O120 -> 120.401 | AK120: 120.3 | AL120: 66 | AM120: 33.4 | AN120: 133 | AO120: 5.2000000000000005e-002 | AP120: 9 | AQ120: 万讯转债
A121: 210 | B121: 113565 | C121: 宏辉转债 | D121: 603336 | E121: 宏辉果蔬 | F121: 农业 | G121: 农产品加 | H121: 106.39 | I121: -5.3e-003 | J121: 5.3e-003 | K121: 7.15 | L121: 0. | M121: 117.8 | N121: 7.64 | O121: 0.13699999999999998 | P121: 93.59 | Q121: 转股中 | R121: 4.69年 | S121: 2.69年 | T121: 2.25 | U121: 15 | V121: 6.5000000000000002e-002 | W121: 7.2000000000000008e-002 | X121: 6.7000000000000004e-002 | Y121: 31 | Z121: 2.31 | AA121: 2.2400000000000003e-002 | AB121: 1.5600000000000001e-002 | AC121: -9.0000000000000011e-003 | AD121: -1.1399999999999999e-002 | AE121: 87.05 | AF121: 88.67 | AG121: 0.58 | AH121: AA- | AI121: 6.3899999999999998e-002 | AJ121: =H121+100*O121 -> 120.09 | AK121: 119.2 | AL121: 56 | AM121: 30.5 | AN121: 101 | AO121: -4.0999999999999995e-002 | AP121: 25 | AQ121: 宏辉转债
A122: 348 | B122: 128022 | C122: 众信转债! | D122: 2707. | E122: 众信旅游 | F122: 旅游餐饮 | G122: 旅游 | H122: 103.24 | I122: 0. | J122: 0. | K122: 5.8 | L122: 0. | M122: 108.8 | N122: 7.92 | O122: 0.40999999999999998 | P122: 73.23 | Q122: 转股中 | R122: 2.46年 | S122: 0.46年 | T122: 4.56 | U122: 0 | V122: 0. | W122: 8.6999999999999994e-002 | X122: 6.4000000000000001e-002 | Y122: 53 | Z122: 7.87 | AA122: 2.1899999999999999e-002 | AB122: 1.4999999999999999e-002 | AC122: -2.63e-002 | AD122: -3.1099999999999999e-002 | AE122: 97.81 | AF122: 94 | AG122: 0.11 | AH122: AA- | AI122: 6.2400000000000004e-002 | AJ122: =H122+100*O122 -> 144.24000000000001 | AK122: 133.2 | AL122: 207 | AM122: 35.4 | AN122: 155 | AO122: 1.4999999999999999e-002 | AP122: 30 | AQ122: 众信转债!
A123: 128 | B123: 113598 | C123: 法兰转债 | D123: 603966 | E123: 法兰泰克 | F123: 机械装备 | G123: 工程机械 | H123: 109.16 | I123: 5.0000000000000001e-004 | J123: -7.3000000000000001e-003 | K123: 11.84 | L123: -1.3300000000000001e-002 | M123: 121.2 | N123: 13.88 | O123: 0.28000000000000003 | P123: 85.3 | Q123: 转股中 | R123: 5年42天 | S123: 3年43天 | T123: 2.75 | U123: 1.6 | V123: 5.0000000000000001e-003 | W123: 0.10800000000000001 | X123: 9.1999999999999998e-002 | Y123: 25 | Z123: 2.18 | AA123: 2.1099999999999997e-002 | AB123: 1.38e-002 | AC123: -1.4499999999999999e-002 | AD123: -1.6799999999999999e-002 | AE123: 84.87 | AF123: 88.45 | AG123: 0.51 | AH123: AA- | AI123: 6.5099999999999991e-002 | AJ123: =H123+100*O123 -> 137.16 | AK123: 133 | AL123: 204 | AM123: 44.6 | AN123: 239 | AO123: -5.2999999999999999e-002 | AP123: 12 | AQ123: 法兰转债
A124: 219 | B124: 113561 | C124: 正裕转债! | D124: 603089 | E124: 正裕工业 | F124: 汽车 | G124: 零部件制 | H124: 107.81 | I124: 5.0000000000000001e-003 | J124: -9.3999999999999986e-003 | K124: 8.63 | L124: -8.0000000000000002e-003 | M124: 118 | N124: 10.08 | O124: 0.25900000000000001 | P124: 85.62 | Q124: 转股中 | R124: 4.53年 | S124: 2.54年 | T124: 1.5 | U124: 4.8 | V124: 2.9999999999999999e-002 | W124: 7.8e-002 | X124: 6.7000000000000004e-002 | Y124: 19 | Z124: 1.81 | AA124: 2.06e-002 | AB124: 1.34e-002 | AC124: -1.2800000000000001e-002 | AD124: -1.5700000000000002e-002 | AE124: 85.9 | AF124: 85.75 | AG124: 0.54 | AH124: A+ | AI124: 7.4900000000000008e-002 | AJ124: =H124+100*O124 -> 133.71000000000001 | AK124: 130 | AL124: 170 | AM124: 44.1 | AN124: 236 | AO124: -7.5999999999999998e-002 | AP124: 35 | AQ124: 正裕转债!
A125: 83 | B125: 113608 | C125: 威派转债! | D125: 603956 | E125: 威派格 | F125: 机械装备 | G125: 专用设备 | H125: 109.23 | I125: 3.4000000000000002e-003 | J125: 3.9000000000000003e-003 | K125: 18 | L125: 1.1200000000000002e-002 | M125: 121.6 | N125: 19.08 | O125: 0.158 | P125: 94.34 | Q125: 转股中 | R125: 5.39年 | S125: 3.39年 | T125: 4.2 | U125: 5.3 | V125: 1.2e-002 | W125: 5.5e-002 | X125: 5.2000000000000005e-002 | Y125: 77 | Z125: 6.62 | AA125: 2.06e-002 | AB125: 1.3500000000000002e-002 | AC125: -1.2199999999999999e-002 | AD125: -1.47e-002 | AE125: 80.84 | AF125: 82.69 | AG125: 0.65 | AH125: A+ | AI125: 7.6100000000000001e-002 | AJ125: =H125+100*O125 -> 125.03 | AK125: 124.1 | AL125: 108 | AM125: 41.4 | AN125: 209 | AO125: 8.199999999999999e-002 | AP125: 7 | AQ125: 威派转债!
A126: 9 | B126: 110080 | C126: 东湖转债 | D126: 600133 | E126: XD东湖高 | F126: 建筑 | G126: 建筑工程 | H126: 102.49 | I126: -8.6999999999999994e-003 | J126: -2.8999999999999998e-003 | K126: 5.77 | L126: -2.0400000000000001e-002 | M126: 115.1 | N126: 6.05 | O126: 7.4999999999999997e-002 | P126: 95.37 | Q126: 4月0天 | R126: 5.81年 | S126: 3.82年 | T126: 15.5 | U126: 28 | V126: 1.7000000000000001e-002 | W126: 0.33799999999999997 | X126: 0.32200000000000001 | Y126: 46 | Z126: 0.85 | AA126: 2.0499999999999997e-002 | AB126: 1.5700000000000002e-002 | AC126: 2.7000000000000001e-003 | AD126: 1.e-003 | AE126: 87.36 | AF126: 89.95 | AG126: 0.57 | AH126: AA | AI126: 4.41e-002 | AJ126: =H126+100*O126 -> 109.98999999999999 | AK126: 109.6 | AL126: 8 | AM126: 19.7 | AN126: 15 | AO126: -3.7000000000000005e-002 | AP126: 18 | AQ126: 东湖转债
A127: 171 | B127: 123051 | C127: 今天转债 | D127: 300532 | E127: 今天国际 | F127: 计算机及 | G127: 软件开发 | H127: 110.9 | I127: 5.0000000000000001e-003 | J127: 1.e-003 | K127: 8.92 | L127: 9.0000000000000011e-003 | M127: 122.3 | N127: 8.7 | O127: 8.199999999999999e-002 | P127: 102.53 | Q127: 转股中 | R127: 4.96年 | S127: 2.96年 | T127: 2.8 | U127: 7.2 | V127: 2.3e-002 | W127: 0.115 | X127: 0.11800000000000001 | Y127: 24 | Z127: 3.12 | AA127: 2.0400000000000001e-002 | AB127: 1.2500000000000001e-002 | AC127: -1.9799999999999998e-002 | AD127: -2.2400000000000003e-002 | AE127: 83.34 | AF127: 86.18 | AG127: 0.66 | AH127: A+ | AI127: 7.4900000000000008e-002 | AJ127: =H127+100*O127 -> 119.10000000000001 | AK127: 119.3 | AL127: 57 | AM127: 33.1 | AN127: 127 | AO127: 3.0000000000000001e-003 | AP127: 18 | AQ127: 今天转债
A128: 155 | B128: 123057 | C128: 美联转债! | D128: 300586 | E128: 美联新材 | F128: 化工 | G128: 橡胶塑料 | H128: 107.18 | I128: 1.44e-002 | J128: -1.7000000000000001e-003 | K128: 8.58 | L128: 2.3900000000000001e-002 | M128: 118.2 | N128: 9.91 | O128: 0.23800000000000002 | P128: 86.58 | Q128: 转股中 | R128: 5年12天 | S128: 3年13天 | T128: 2.07 | U128: 24 | V128: 0.111 | W128: 5.2999999999999999e-002 | X128: 4.5999999999999999e-002 | Y128: 39 | Z128: 5.27 | AA128: 2.0099999999999996e-002 | AB128: 1.3600000000000001e-002 | AC128: -9.1000000000000004e-003 | AD128: -1.1599999999999999e-002 | AE128: 85.31 | AF128: 86.73 | AG128: 0.53 | AH128: AA- | AI128: 6.5099999999999991e-002 | AJ128: =H128+100*O128 -> 130.98000000000002 | AK128: 127.8 | AL128: 142 | AM128: 41.1 | AN128: 204 | AO128: 4.9000000000000002e-002 | AP128: 20 | AQ128: 美联转债!
A129: 332 | B129: 113505 | C129: 杭电转债! | D129: 603618 | E129: 杭电股份 | F129: 能源电力 | G129: 电力设备 | H129: 105.63 | I129: 2.4300000000000002e-002 | J129: 5.0000000000000001e-003 | K129: 6.84 | L129: 6.3799999999999996e-002 | M129: 111.3 | N129: 7.08 | O129: 9.3000000000000013e-002 | P129: 96.61 | Q129: 转股中 | R129: 2.71年 | S129: 0.72年 | T129: 7.5 | U129: 117 | V129: 0.14699999999999999 | W129: 0.159 | X129: 0.153 | Y129: 47 | Z129: 1.75 | AA129: 1.9799999999999998e-002 | AB129: 1.1899999999999999e-002 | AC129: -4.1100000000000005e-002 | AD129: -4.4999999999999998e-002 | AE129: 98.23 | AF129: 99.87 | AG129: 0.46 | AH129: AA | AI129: 4.1399999999999999e-002 | AJ129: =H129+100*O129 -> 114.92999999999999 | AK129: 114.6 | AL129: 16 | AM129: 14.8 | AN129: 6 | AO129: 8.0000000000000002e-002 | AP129: 43 | AQ129: 杭电转债!
A130: 257 | B130: 128071 | C130: 合兴转债! | D130: 2228. | E130: 合兴包装 | F130: 造纸包装 | G130: 包装材料 | H130: 105.977 | I130: 1.5e-003 | J130: -4.0000000000000002e-004 | K130: 3.76 | L130: 2.7000000000000001e-003 | M130: 114.8 | N130: 4.28 | O130: 0.20600000000000002 | P130: 87.85 | Q130: 转股中 | R130: 4年58天 | S130: 2年59天 | T130: 3 | U130: 5.4 | V130: 1.7000000000000001e-002 | W130: 6.4000000000000001e-002 | X130: 5.7000000000000002e-002 | Y130: 47 | Z130: 1.34 | AA130: 1.9799999999999998e-002 | AB130: 1.3300000000000001e-002 | AC130: -1.1000000000000001e-002 | AD130: -1.38e-002 | AE130: 93.77 | AF130: 96.75 | AG130: 0.42 | AH130: AA | AI130: 4.2900000000000001e-002 | AJ130: =H130+100*O130 -> 126.577 | AK130: 124.1 | AL130: 106 | AM130: 27.4 | AN130: 60 | AO130: -1.2e-002 | AP130: 24 | AQ130: 合兴转债!
A131: 60 | B131: 113044 | C131: 大秦转债! | D131: 601006 | E131: 大秦铁路 | F131: 铁路 | G131: 铁路运输 | H131: 102.95 | I131: -3.9000000000000003e-003 | J131: 1.1999999999999999e-003 | K131: 6.51 | L131: -6.0999999999999995e-003 | M131: 114.1 | N131: 7.66 | O131: 0.21100000000000002 | P131: 84.99 | Q131: 转股中 | R131: 5.49年 | S131: 3.49年 | T131: 320 | U131: 175 | V131: 5.0000000000000001e-003 | W131: 0.33100000000000002 | X131: 0.28100000000000003 | Y131: 968 | Z131: 0.8 | AA131: 1.9299999999999998e-002 | AB131: 1.4499999999999999e-002 | AC131: 2.5999999999999999e-003 | AD131: 5.0000000000000001e-004 | AE131: 90.44 | AF131: 92.83 | AG131: 0.43 | AH131: AAA | AI131: 3.9100000000000003e-002 | AJ131: =H131+100*O131 -> 124.05000000000001 | AK131: 120.9 | AL131: 71 | AM131: 28.1 | AN131: 71 | AO131: -4.2999999999999997e-002 | AP131: 15 | AQ131: 大秦转债!
A132: 244 | B132: 127014 | C132: 北方转债! | D132: 65. | E132: 北方国际 | F132: 建筑 | G132: 建筑工程 | H132: 106.16 | I132: -3.8e-003 | J132: 2.0000000000000001e-004 | K132: 7.56 | L132: -9.1999999999999998e-003 | M132: 115.1 | N132: 8.75 | O132: 0.22899999999999998 | P132: 86.4 | Q132: 转股中 | R132: 4.35年 | S132: 2.35年 | T132: 5.35 | U132: 3.3 | V132: 6.0000000000000001e-003 | W132: 9.1999999999999998e-002 | X132: 7.9000000000000001e-002 | Y132: 58 | Z132: 1.05 | AA132: 1.9199999999999998e-002 | AB132: 1.2800000000000001e-002 | AC132: -9.7999999999999997e-003 | AD132: -1.2500000000000001e-002 | AE132: 94 | AF132: 97.47 | AG132: 0.39 | AH132: AA+ | AI132: 3.9900000000000005e-002 | AJ132: =H132+100*O132 -> 129.06 | AK132: 125.9 | AL132: 125 | AM132: 28.5 | AN132: 73 | AO132: -2.7999999999999997e-002 | AP132: 19 | AQ132: 北方转债!
A133: 261 | B133: 128070 | C133: 智能转债! | D133: 2877. | E133: 智能自控 | F133: 机械装备 | G133: 通用设备 | H133: 109.258 | I133: 2.0000000000000001e-004 | J133: 5.7999999999999996e-003 | K133: 6.62 | L133: 1.8500000000000003e-002 | M133: 117.6 | N133: 9.51 | O133: 0.56999999999999995 | P133: 69.61 | Q133: 转股中 | R133: 4年13天 | S133: 无权 | T133: 2.3 | U133: 58 | V133: 0.23000000000000001 | W133: 0.10400000000000001 | X133: 7.2999999999999995e-002 | Y133: 22 | Z133: 2.98 | AA133: 1.89e-002 | AB133: 1.1000000000000001e-002 | AC133: 无权 | AD133: 无权 | AE133: 无权 | AF133: 88.56 | AG133: 0.33 | AH133: A+ | AI133: 7.4900000000000008e-002 | AJ133: =H133+100*O133 -> 166.25799999999998 | AK133: 148.9 | AL133: 291 | AM133: 60.3 | AN133: 301 | AO133: 1.6e-002 | AP133: 30 | AQ133: 智能转债!
A134: 98 | B134: 123071 | C134: 天能转债! | D134: 300569 | E134: 天能重工 | F134: 能源电力 | G134: 风能 | H134: 109.797 | I134: 7.3000000000000001e-003 | J134: 1.9e-003 | K134: 7.87 | L134: 1.4199999999999999e-002 | M134: 121.1 | N134: 7.73 | O134: 7.8e-002 | P134: 101.81 | Q134: 转股中 | R134: 5.34年 | S134: 3.34年 | T134: 7 | U134: 3.1 | V134: 4.0000000000000001e-003 | W134: 0.13100000000000001 | X134: 0.13300000000000001 | Y134: 54 | Z134: 1.33 | AA134: 1.89e-002 | AB134: 1.2e-002 | AC134: -1.54e-002 | AD134: -1.7600000000000001e-002 | AE134: 83.57 | AF134: 87.11 | AG134: 0.65 | AH134: AA- | AI134: 6.5099999999999991e-002 | AJ134: =H134+100*O134 -> 117.59699999999999 | AK134: 117.8 | AL134: 38 | AM134: 30.7 | AN134: 103 | AO134: -0.39600000000000002 | AP134: 13 | AQ134: 天能转债!
A135: 109 | B135: 128133 | C135: 奇正转债! | D135: 2287. | E135: 奇正藏药 | F135: 医药 | G135: 中药 | H135: 106.6 | I135: 6.8000000000000005e-003 | J135: -4.0000000000000002e-004 | K135: 25.58 | L135: 1.5100000000000001e-002 | M135: 117.3 | N135: 30.12 | O135: 0.255 | P135: 84.93 | Q135: 转股中 | R135: 5.26年 | S135: 3.26年 | T135: 8 | U135: 1.8 | V135: 2.e-003 | W135: 5.9000000000000004e-002 | X135: 5.0000000000000003e-002 | Y135: 136 | Z135: 5.24 | AA135: 1.8700000000000001e-002 | AB135: 1.2800000000000001e-002 | AC135: -7.8000000000000005e-003 | AD135: -9.8999999999999991e-003 | AE135: 89.67 | AF135: 93.91 | AG135: 0.42 | AH135: AA | AI135: 4.41e-002 | AJ135: =H135+100*O135 -> 132.09999999999999 | AK135: 128.3 | AL135: 147 | AM135: 34.4 | AN135: 140 | AO135: -3.1e-002 | AP135: 16 | AQ135: 奇正转债!
A136: 284 | B136: 123024 | C136: 岱勒转债! | D136: 300700 | E136: 岱勒新材 | F136: 机械装备 | G136: 专用设备 | H136: 106.998 | I136: 9.7000000000000003e-003 | J136: 1.1999999999999999e-003 | K136: 13.16 | L136: 2.1700000000000001e-002 | M136: 112.5 | N136: 14.1 | O136: 0.14599999999999999 | P136: 93.33 | Q136: 转股中 | R136: 2.75年 | S136: 0.76年 | T136: 2.1 | U136: 26 | V136: 0.115 | W136: 0.14899999999999999 | X136: 0.13900000000000001 | Y136: 14 | Z136: 2.24 | AA136: 1.8600000000000002e-002 | AB136: 1.0200000000000001e-002 | AC136: -5.8200000000000002e-002 | AD136: -6.0700000000000004e-002 | AE136: 94.85 | AF136: 92.76 | AG136: 0.5 | AH136: A+ | AI136: 7.3399999999999993e-002 | AJ136: =H136+100*O136 -> 121.598 | AK136: 120.7 | AL136: 69 | AM136: 25.8 | AN136: 49 | AO136: -4.9000000000000002e-002 | AP136: 36 | AQ136: 岱勒转债!
A137: 39 | B137: 123097 | C137: 美力转债 | D137: 300611 | E137: 美力科技 | F137: 机械装备 | G137: 通用设备 | H137: 109.985 | I137: 1.1599999999999999e-002 | J137: 4.0999999999999995e-003 | K137: 9.77 | L137: 2.2000000000000002e-002 | M137: 121.6 | N137: 9.34 | O137: 5.0999999999999997e-002 | P137: 104.6 | Q137: 45天 | R137: 5.61年 | S137: 3.61年 | T137: 3 | U137: 4.9 | V137: 1.4999999999999999e-002 | W137: 0.17199999999999999 | X137: 0.17899999999999999 | Y137: 17 | Z137: 2.63 | AA137: 1.8500000000000003e-002 | AB137: 1.1699999999999999e-002 | AC137: -1.3300000000000001e-002 | AD137: -1.5600000000000001e-002 | AE137: 79.57 | AF137: 81.39 | AG137: 0.71 | AH137: A+ | AI137: 7.6100000000000001e-002 | AJ137: =H137+100*O137 -> 115.08499999999999 | AK137: 115.4 | AL137: 24 | AM137: 34 | AN137: 138 | AO137: 3.7999999999999999e-002 | AP137: 16 | AQ137: 美力转债
A138: 232 | B138: 128082 | C138: 华锋转债! | D138: 2806. | E138: 华锋股份 | F138: 电子 | G138: 元器件制 | H138: 112.232 | I138: 9.300000000000001e-003 | J138: 1.9e-003 | K138: 9.78 | L138: 1.66e-002 | M138: 121.4 | N138: 9.13 | O138: 4.8000000000000001e-002 | P138: 107.12 | Q138: 转股中 | R138: 4.46年 | S138: 2.46年 | T138: 3.12 | U138: 12 | V138: 3.4000000000000002e-002 | W138: 0.17800000000000002 | X138: 0.19 | Y138: 18 | Z138: 1.78 | AA138: 1.8200000000000001e-002 | AB138: 9.7999999999999997e-003 | AC138: -2.7200000000000002e-002 | AD138: -3.0299999999999997e-002 | AE138: 86.64 | AF138: 88.73 | AG138: 0.67 | AH138: A+ | AI138: 7.4900000000000008e-002 | AJ138: =H138+100*O138 -> 117.032 | AK138: 117.3 | AL138: 35 | AM138: 28.6 | AN138: 75 | AO138: -7.2000000000000008e-002 | AP138: 55 | AQ138: 华锋转债!
A139: 139 | B139: 123061 | C139: 航新转债! | D139: 300424 | E139: 航新科技 | F139: 航空航天 | G139: 航空航天 | H139: 114.24 | I139: 3.0000000000000001e-003 | J139: 5.0000000000000001e-004 | K139: 15.07 | L139: 5.3e-003 | M139: 124.8 | N139: 14.86 | O139: 0.126 | P139: 101.41 | Q139: 转股中 | R139: 5年33天 | S139: 3年34天 | T139: 2.5 | U139: 213 | V139: 0.74299999999999999 | W139: 6.9000000000000006e-002 | X139: 7.0000000000000007e-002 | Y139: 36 | Z139: 5.42 | AA139: 1.8000000000000002e-002 | AB139: 9.5999999999999992e-003 | AC139: -2.6699999999999998e-002 | AD139: -2.9300000000000003e-002 | AE139: 82.75 | AF139: 86.77 | AG139: 0.65 | AH139: A+ | AI139: 7.6100000000000001e-002 | AJ139: =H139+100*O139 -> 126.83999999999999 | AK139: 127.1 | AL139: 134 | AM139: 40.3 | AN139: 198 | AO139: 3.3000000000000002e-002 | AP139: 16 | AQ139: 航新转债!
A140: 106 | B140: 113604 | C140: 多伦转债! | D140: 603528 | E140: 多伦科技 | F140: 计算机及 | G140: 软件开发 | H140: 107 | I140: 1.38e-002 | J140: -5.1000000000000004e-003 | K140: 8.95 | L140: 1.5900000000000001e-002 | M140: 117.3 | N140: 10.4 | O140: 0.24299999999999999 | P140: 86.06 | Q140: 转股中 | R140: 5.32年 | S140: 3.32年 | T140: 6.4 | U140: 8 | V140: 1.2e-002 | W140: 0.114 | X140: 9.8000000000000004e-002 | Y140: 56 | Z140: 3.37 | AA140: 1.78e-002 | AB140: 1.1899999999999999e-002 | AC140: -8.6999999999999994e-003 | AD140: -1.0800000000000001e-002 | AE140: 83.51 | AF140: 84.47 | AG140: 0.55 | AH140: AA- | AI140: 6.5099999999999991e-002 | AJ140: =H140+100*O140 -> 131.30000000000001 | AK140: 127.9 | AL140: 145 | AM140: 43.5 | AN140: 231 | AO140: -5.7000000000000002e-002 | AP140: 7 | AQ140: 多伦转债!
A141: 137 | B141: 128122 | C141: 兴森转债! | D141: 2436. | E141: 兴森科技 | F141: 电子 | G141: 元器件制 | H141: 105.75 | I141: -1.4000000000000002e-003 | J141: -3.4000000000000002e-003 | K141: 10.38 | L141: -1.9799999999999998e-002 | M141: 113.3 | N141: 14.1 | O141: 0.436 | P141: 73.62 | Q141: 转股中 | R141: 4年34天 | S141: 3年35天 | T141: 2.69 | U141: 20 | V141: 7.0000000000000007e-002 | W141: 1.7000000000000001e-002 | X141: 1.3000000000000001e-002 | Y141: 154 | Z141: 4.81 | AA141: 1.72e-002 | AB141: 1.1200000000000002e-002 | AC141: -6.1999999999999998e-003 | AD141: -8.3999999999999995e-003 | AE141: 90.49 | AF141: 95.62 | AG141: 0.24 | AH141: AA | AI141: 4.2900000000000001e-002 | AJ141: =H141+100*O141 -> 149.34999999999999 | AK141: 137.9 | AL141: 243 | AM141: 42.3 | AN141: 215 | AO141: 6.8000000000000005e-002 | AP141: 13 | AQ141: 兴森转债!
A142: 275 | B142: 113024 | C142: 核建转债! | D142: 601611 | E142: 中国核建 | F142: 建筑 | G142: 建筑工程 | H142: 102.59 | I142: 7.000000000000001e-004 | J142: 3.4000000000000002e-003 | K142: 7.2 | L142: 1.84e-002 | M142: 109.3 | N142: 9.76 | O142: 0.39100000000000001 | P142: 73.77 | Q142: 转股中 | R142: 3.80年 | S142: 1.81年 | T142: 30 | U142: 3.3 | V142: 1.e-003 | W142: 0.157 | X142: 0.11599999999999999 | Y142: 191 | Z142: 1.61 | AA142: 1.7100000000000001e-002 | AB142: 1.24e-002 | AC142: 1.e-003 | AD142: -1.7000000000000001e-003 | AE142: 95.58 | AF142: 95.13 | AG142: 0.22 | AH142: AAA | AI142: 3.7900000000000003e-002 | AJ142: =H142+100*O142 -> 141.69 | AK142: 131.4 | AL142: 187 | AM142: 35.8 | AN142: 161 | AO142: -5.0000000000000001e-003 | AP142: 37 | AQ142: 核建转债!
A143: 188 | B143: 128105 | C143: 长集转债! | D143: 2616. | E143: 长青集团 | F143: 城市公用 | G143: 三废处理 | H143: 106.101 | I143: 3.61e-002 | J143: -2.23e-002 | K143: 6.95 | L143: 3.1200000000000002e-002 | M143: 114.9 | N143: 7.91 | O143: 0.20800000000000002 | P143: 87.86 | Q143: 转股中 | R143: 4.81年 | S143: 2.81年 | T143: 8 | U143: 123 | V143: 0.14599999999999999 | W143: 0.155 | X143: 0.13600000000000001 | Y143: 52 | Z143: 1.94 | AA143: 1.7000000000000001e-002 | AB143: 1.1299999999999999e-002 | AC143: -8.6999999999999994e-003 | AD143: -1.09e-002 | AE143: 91.35 | AF143: 94.26 | AG143: 0.45 | AH143: AA | AI143: 4.2900000000000001e-002 | AJ143: =H143+100*O143 -> 126.901 | AK143: 124.3 | AL143: 112 | AM143: 30.1 | AN143: 92 | AO143: 2.9999999999999999e-002 | AP143: 17 | AQ143: 长集转债!
A144: 347 | B144: 128023 | C144: 亚太转债! | D144: 2284. | E144: 亚太股份 | F144: 汽车 | G144: 零部件制 | H144: 106.9 | I144: 1.23e-002 | J144: 1.24e-002 | K144: 9.06 | L144: 7.9899999999999999e-002 | M144: 111.3 | N144: 10.34 | O144: 0.22 | P144: 87.62 | Q144: 转股中 | R144: 2.46年 | S144: 0.46年 | T144: 9.99 | U144: 270 | V144: 0.251 | W144: 0.14899999999999999 | X144: 0.13100000000000001 | Y144: 67 | Z144: 2.68 | AA144: 1.6799999999999999e-002 | AB144: 8.199999999999999e-003 | AC144: -7.4999999999999997e-002 | AD144: -8.0100000000000005e-002 | AE144: 99.24 | AF144: 100.9 | AG144: 0.31 | AH144: AA | AI144: 4.1399999999999999e-002 | AJ144: =H144+100*O144 -> 128.90000000000001 | AK144: 126.2 | AL144: 130 | AM144: 25.3 | AN144: 42 | AO144: 0.20199999999999999 | AP144: 68 | AQ144: 亚太转债!
A145: 325 | B145: 128039 | C145: 三力转债! | D145: 2224. | E145: 三 力 士 | F145: 机械装备 | G145: 专用设备 | H145: 103.598 | I145: 2.3999999999999998e-003 | J145: -2.0000000000000001e-004 | K145: 4.77 | L145: 6.3e-003 | M145: 108.8 | N145: 5.81 | O145: 0.26200000000000001 | P145: 82.1 | Q145: 转股中 | R145: 2.97年 | S145: 0.97年 | T145: 2.03 | U145: 1.3 | V145: 6.0000000000000001e-003 | W145: 5.7999999999999996e-002 | X145: 4.8000000000000001e-002 | Y145: 35 | Z145: 1.51 | AA145: 1.6799999999999999e-002 | AB145: 1.1200000000000002e-002 | AC145: -1.7399999999999999e-002 | AD145: -2.e-002 | AE145: 94.8 | AF145: 91.1 | AG145: 0.34 | AH145: AA- | AI145: 6.2400000000000004e-002 | AJ145: =H145+100*O145 -> 129.798 | AK145: 125.1 | AL145: 120 | AM145: 30.3 | AN145: 97 | AO145: -4.0000000000000001e-003 | AP145: 29 | AQ145: 三力转债!
A146: 1 | B146: 127035 | C146: N濮耐转 | D146: 2225. | E146: 濮耐股份 | F146: 钢铁 | G146: 钢铁行业 | H146: 105.8 | I146: 5.7999999999999996e-002 | J146: 0. | K146: 4.26 | L146: -6.9999999999999993e-003 | M146: 114.7 | N146: 4.43 | O146: 0.10000000000000001 | P146: 96.16 | Q146: 5月16天 | R146: 4.93年 | S146: 2.94年 | T146: 6.26 | U146: 782 | V146: 1.1899999999999999 | W146: 0.14499999999999999 | X146: 0.14000000000000001 | Y146: 43 | Z146: 1.42 | AA146: 1.6799999999999999e-002 | AB146: 1.1299999999999999e-002 | AC146: -7.4000000000000003e-003 | AD146: -9.4999999999999998e-003 | AE146: 90.85 | AF146: 93.61 | AG146: 0.55 | AH146: AA | AI146: 4.2900000000000001e-002 | AJ146: =H146+100*O146 -> 115.8 | AK146: 115.4 | AL146: 25 | AM146: 21.8 | AN146: 24 | AO146: -2.7000000000000003e-002 | AP146: 2 | AQ146: N濮耐转
A147: 50 | B147: 123092 | C147: 天壕转债 | D147: 300332 | E147: 天壕环境 | F147: 石油天然 | G147: 天然气 | H147: 111.249 | I147: 2.3300000000000001e-002 | J147: 1.6799999999999999e-002 | K147: 5.47 | L147: 5.5999999999999994e-002 | M147: 121.6 | N147: 5.2 | O147: 5.7999999999999996e-002 | P147: 105.19 | Q147: 12天 | R147: 5.52年 | S147: 3.52年 | T147: 4.23 | U147: 20 | V147: 4.4000000000000004e-002 | W147: 8.8000000000000009e-002 | X147: 9.1999999999999998e-002 | Y147: 48 | Z147: 1.43 | AA147: 1.66e-002 | AB147: 9.7999999999999997e-003 | AC147: -1.6799999999999999e-002 | AD147: -1.9099999999999999e-002 | AE147: 80.11 | AF147: 81.94 | AG147: 0.72 | AH147: A+ | AI147: 7.6100000000000001e-002 | AJ147: =H147+100*O147 -> 117.04899999999999 | AK147: 117.3 | AL147: 34 | AM147: 35.4 | AN147: 154 | AO147: 4.4999999999999998e-002 | AP147: 7 | AQ147: 天壕转债
A148: 6 | B148: 113048 | C148: 晶科转债! | D148: 601778 | E148: 晶科科技 | F148: 能源电力 | G148: 太阳能 | H148: 106.54 | I148: -3.0000000000000001e-003 | J148: -1.9e-003 | K148: 5.24 | L148: -1.32e-002 | M148: 117.1 | N148: 6.75 | O148: 0.37200000000000005 | P148: 77.63 | Q148: 4月13天 | R148: 5.84年 | S148: 3.85年 | T148: 30 | U148: 30 | V148: 9.0000000000000011e-003 | W148: 0.20699999999999999 | X148: 0.161 | Y148: 145 | Z148: 1.33 | AA148: 1.66e-002 | AB148: 1.1299999999999999e-002 | AC148: -6.9999999999999993e-003 | AD148: -8.6999999999999994e-003 | AE148: 87.25 | AF148: 91.39 | AG148: 0.37 | AH148: AA | AI148: 4.41e-002 | AJ148: =H148+100*O148 -> 143.74000000000001 | AK148: 135.5 | AL148: 222 | AM148: 44.1 | AN148: 235 | AO148: -4.0000000000000001e-002 | AP148: 5 | AQ148: 晶科转债!
A149: 351 | B149: 110038 | C149: 济川转债! | D149: 600566 | E149: 济川药业 | F149: 医药 | G149: 中药 | H149: 105.16 | I149: -5.0000000000000001e-004 | J149: 0. | K149: 17.68 | L149: -7.9000000000000008e-003 | M149: 107.5 | N149: 23.4 | O149: 0.39200000000000002 | P149: 75.56 | Q149: 转股中 | R149: 1.41年 | S149: 回售内 | T149: 6.28 | U149: 1.1 | V149: 2.e-003 | W149: 4.0000000000000001e-002 | X149: 2.9999999999999999e-002 | Y149: 157 | Z149: 1.94 | AA149: 1.5900000000000001e-002 | AB149: 5.6999999999999993e-003 | AC149: 回售内 | AD149: 回售内 | AE149: 100.25 | AF149: 101.6 | AG149: 0.06 | AH149: AA | AI149: 4.1399999999999999e-002 | AJ149: =H149+100*O149 -> 144.36000000000001 | AK149: 134.8 | AL149: 217 | AM149: 33.2 | AN149: 128 | AO149: -4.2000000000000003e-002 | AP149: 23 | AQ149: 济川转债!
A150: 356 | B150: 113014 | C150: 林洋转债! | D150: 601222 | E150: 林洋能源 | F150: 能源电力 | G150: 电力设备 | H150: 105.48 | I150: 1.26e-002 | J150: -1.e-003 | K150: 7.43 | L150: 3.7699999999999997e-002 | M150: 109.3 | N150: 8.54 | O150: 0.21199999999999999 | P150: 87 | Q150: 转股中 | R150: 2.36年 | S150: 0.36年 | T150: 30 | U150: 26 | V150: 8.0000000000000002e-003 | W150: 0.23100000000000001 | X150: 0.20100000000000001 | Y150: 130 | Z150: 1.25 | AA150: 1.55e-002 | AB150: 8.0000000000000002e-003 | AC150: -6.5599999999999992e-002 | AD150: -7.1900000000000006e-002 | AE150: 99.66 | AF150: 99.51 | AG150: 0.31 | AH150: AA | AI150: 4.1399999999999999e-002 | AJ150: =H150+100*O150 -> 126.68000000000001 | AK150: 124 | AL150: 104 | AM150: 24.3 | AN150: 35 | AO150: 8.5000000000000006e-002 | AP150: 30 | AQ150: 林洋转债!
A151: 151 | B151: 110071 | C151: 湖盐转债! | D151: 600929 | E151: 雪天盐业 | F151: 食品饮料 | G151: 食品饮料 | H151: 106.79 | I151: 7.3000000000000001e-003 | J151: 6.6e-003 | K151: 6.45 | L151: 2.3799999999999998e-002 | M151: 115.2 | N151: 6.52 | O151: 7.9000000000000001e-002 | P151: 98.93 | Q151: 转股中 | R151: 5年21天 | S151: 3年22天 | T151: 7.2 | U151: 9.4 | V151: 1.2e-002 | W151: 0.122 | X151: 0.12 | Y151: 59 | Z151: 2.23 | AA151: 1.54e-002 | AB151: 9.8999999999999991e-003 | AC151: -9.1000000000000004e-003 | AD151: -1.1299999999999999e-002 | AE151: 90.36 | AF151: 93.03 | AG151: 0.58 | AH151: AA | AI151: 4.41e-002 | AJ151: =H151+100*O151 -> 114.69000000000001 | AK151: 114.7 | AL151: 17 | AM151: 21.6 | AN151: 21 | AO151: 1.7000000000000001e-002 | AP151: 20 | AQ151: 湖盐转债!
A152: 27 | B152: 123105 | C152: 拓尔转债! | D152: 300229 | E152: 拓尔思 | F152: 计算机及 | G152: 软件开发 | H152: 111.035 | I152: -4.1999999999999997e-003 | J152: 8.9999999999999998e-004 | K152: 9.26 | L152: -5.4000000000000003e-003 | M152: 121 | N152: 9.93 | O152: 0.191 | P152: 93.25 | Q152: 3月9天 | R152: 5.75年 | S152: 3.75年 | T152: 8 | U152: 8.3 | V152: 9.0000000000000011e-003 | W152: 0.12 | X152: 0.11199999999999999 | Y152: 66 | Z152: 3.05 | AA152: 1.54e-002 | AB152: 9.0000000000000011e-003 | AC152: -1.6899999999999998e-002 | AD152: -1.8799999999999997e-002 | AE152: 81.37 | AF152: 84.81 | AG152: 0.61 | AH152: AA- | AI152: 6.5099999999999991e-002 | AJ152: =H152+100*O152 -> 130.13499999999999 | AK152: 128.8 | AL152: 152 | AM152: 44 | AN152: 233 | AO152: 1.e-003 | AP152: 5 | AQ152: 拓尔转债!
A153: 89 | B153: 110076 | C153: 华海转债! | D153: 600521 | E153: 华海药业 | F153: 医药 | G153: 医药行业 | H153: 106.28 | I153: -5.0000000000000001e-003 | J153: 5.0000000000000001e-003 | K153: 19.2 | L153: 5.0000000000000001e-004 | M153: 115.1 | N153: 34.46 | O153: 0.90799999999999992 | P153: 55.72 | Q153: 转股中 | R153: 5.37年 | S153: 3.38年 | T153: 18.4 | U153: 1.8 | V153: 1.e-003 | W153: 6.6000000000000003e-002 | X153: 3.7000000000000005e-002 | Y153: 279 | Z153: 4.28 | AA153: 1.52e-002 | AB153: 1.01e-002 | AC153: -7.1999999999999998e-003 | AD153: -9.1999999999999998e-003 | AE153: 89.04 | AF153: 91.68 | AG153: 0.12 | AH153: AA | AI153: 4.41e-002 | AJ153: =H153+100*O153 -> 197.07999999999998 | AK153: 156.8 | AL153: 314 | AM153: 65.2 | AN153: 310 | AO153: -7.0999999999999994e-002 | AP153: 7 | AQ153: 华海转债!
A154: 142 | B154: 113594 | C154: 淳中转债! | D154: 603516 | E154: 淳中科技 | F154: 电子 | G154: 电子产品 | H154: 112.68 | I154: 1.24e-002 | J154: -2.1299999999999999e-002 | K154: 21.15 | L154: -1.9e-002 | M154: 121.4 | N154: 27.84 | O154: 0.48299999999999998 | P154: 75.97 | Q154: 转股中 | R154: 5年32天 | S154: 3年33天 | T154: 3 | U154: 1.4 | V154: 4.0000000000000001e-003 | W154: 7.5999999999999998e-002 | X154: 5.7999999999999996e-002 | Y154: 39 | Z154: 2.88 | AA154: 1.5100000000000001e-002 | AB154: 7.8000000000000005e-003 | AC154: -2.3e-002 | AD154: -2.5600000000000001e-002 | AE154: 82.64 | AF154: 84.41 | AG154: 0.47 | AH154: A+ | AI154: 7.6100000000000001e-002 | AJ154: =H154+100*O154 -> 160.98000000000002 | AK154: 149.4 | AL154: 295 | AM154: 65 | AN154: 309 | AO154: -4.2999999999999997e-002 | AP154: 9 | AQ154: 淳中转债!
A155: 161 | B155: 113588 | C155: 润达转债! | D155: 603108 | E155: 润达医疗 | F155: 医药 | G155: 医疗器械 | H155: 105.89 | I155: -1.e-003 | J155: 5.5000000000000005e-003 | K155: 10.93 | L155: 1.11e-002 | M155: 113.9 | N155: 13.36 | O155: 0.29399999999999998 | P155: 81.81 | Q155: 转股中 | R155: 4.99年 | S155: 2.998年 | T155: 5.5 | U155: 1.4 | V155: 2.e-003 | W155: 8.6999999999999994e-002 | X155: 7.0999999999999994e-002 | Y155: 63 | Z155: 1.99 | AA155: 1.4999999999999999e-002 | AB155: 9.7999999999999997e-003 | AC155: -7.4999999999999997e-003 | AD155: -9.5999999999999992e-003 | AE155: 90.63 | AF155: 92.7 | AG155: 0.4 | AH155: AA | AI155: 4.2900000000000001e-002 | AJ155: =H155+100*O155 -> 135.28999999999999 | AK155: 130 | AL155: 167 | AM155: 37.3 | AN155: 173 | AO155: -2.7000000000000003e-002 | AP155: 11 | AQ155: 润达转债!
A156: 67 | B156: 127026 | C156: 超声转债! | D156: 823. | E156: 超声电子 | F156: 电子 | G156: 元器件制 | H156: 104.767 | I156: 1.1000000000000001e-003 | J156: 2.0000000000000001e-004 | K156: 10.95 | L156: 2.7000000000000001e-003 | M156: 113.1 | N156: 12.72 | O156: 0.217 | P156: 86.08 | Q156: 转股中 | R156: 5.47年 | S156: 3.47年 | T156: 7 | U156: 4.6 | V156: 6.0000000000000001e-003 | W156: 0.11900000000000001 | X156: 0.10199999999999999 | Y156: 59 | Z156: 1.53 | AA156: 1.43e-002 | AB156: 9.8999999999999991e-003 | AC156: -3.0999999999999999e-003 | AD156: -5.0000000000000001e-003 | AE156: 88.66 | AF156: 89.71 | AG156: 0.48 | AH156: AA | AI156: 4.41e-002 | AJ156: =H156+100*O156 -> 126.467 | AK156: 123.4 | AL156: 97 | AM156: 33.7 | AN156: 136 | AO156: 2.8999999999999998e-002 | AP156: 12 | AQ156: 超声转债!
A157: 134 | B157: 123062 | C157: 三超转债 | D157: 300554 | E157: 三超新材 | F157: 机械装备 | G157: 通用设备 | H157: 111.598 | I157: 1.09e-002 | J157: 1.2199999999999999e-002 | K157: 17.64 | L157: 3.1600000000000003e-002 | M157: 119.7 | N157: 17.13 | O157: 8.4000000000000005e-002 | P157: 102.98 | Q157: 转股中 | R157: 5年38天 | S157: 3年39天 | T157: 1.95 | U157: 33 | V157: 0.153 | W157: 0.11800000000000001 | X157: 0.121 | Y157: 17 | Z157: 3.15 | AA157: 1.4199999999999999e-002 | AB157: 7.3000000000000001e-003 | AC157: -1.9799999999999998e-002 | AD157: -2.2400000000000003e-002 | AE157: 80.14 | AF157: 79.42 | AG157: 0.73 | AH157: A | AI157: 8.6099999999999996e-002 | AJ157: =H157+100*O157 -> 119.998 | AK157: 120.2 | AL157: 62 | AM157: 40.1 | AN157: 196 | AO157: 2.6000000000000002e-002 | AP157: 20 | AQ157: 三超转债
A158: 93 | B158: 123074 | C158: 隆利转债! | D158: 300752 | E158: 隆利科技 | F158: 电子 | G158: 液晶显示 | H158: 115.2 | I158: -2.1600000000000001e-002 | J158: 1.11e-002 | K158: 18.54 | L158: -1.7000000000000001e-002 | M158: 124 | N158: 18.33 | O158: 0.13900000000000001 | P158: 101.15 | Q158: 转股中 | R158: 5.36年 | S158: 3.36年 | T158: 3.24 | U158: 312 | V158: 0.82099999999999995 | W158: 9.0999999999999998e-002 | X158: 9.1999999999999998e-002 | Y158: 36 | Z158: 2.58 | AA158: 1.41e-002 | AB158: 6.5000000000000006e-003 | AC158: -2.8999999999999998e-002 | AD158: -3.1099999999999999e-002 | AE158: 83.38 | AF158: 89.04 | AG158: 0.62 | AH158: AA- | AI158: 6.5099999999999991e-002 | AJ158: =H158+100*O158 -> 129.09999999999999 | AK158: 129.3 | AL158: 161 | AM158: 40.2 | AN158: 197 | AO158: -0.114 | AP158: 15 | AQ158: 隆利转债!
A159: 349 | B159: 128021 | C159: 兄弟转债!! | D159: 2562. | E159: 兄弟科技 | F159: 医药 | G159: 原料药 | H159: 105.25 | I159: 2.5000000000000001e-003 | J159: -6.0999999999999995e-003 | K159: 4.3 | L159: -1.6e-002 | M159: 108.8 | N159: 5.19 | O159: 0.27000000000000002 | P159: 82.85 | Q159: 转股中 | R159: 2.45年 | S159: 0.45年 | T159: 2.65 | U159: 7.2 | V159: 2.6000000000000002e-002 | W159: 5.7999999999999996e-002 | X159: 4.8000000000000001e-002 | Y159: 46 | Z159: 1.54 | AA159: 1.3899999999999999e-002 | AB159: 6.9999999999999993e-003 | AC159: -5.6900000000000006e-002 | AD159: -6.1500000000000006e-002 | AE159: 99.06 | AF159: 98.68 | AG159: 0.23 | AH159: AA | AI159: 4.1399999999999999e-002 | AJ159: =H159+100*O159 -> 132.25 | AK159: 127.6 | AL159: 141 | AM159: 28.6 | AN159: 74 | AO159: -4.4999999999999998e-002 | AP159: 15 | AQ159: 兄弟转债!!
A160: 132 | B160: 128124 | C160: 科华转债! | D160: 2022. | E160: 科华生物 | F160: 医药 | G160: 生物制药 | H160: 102.898 | I160: 4.4000000000000003e-003 | J160: -2.7000000000000001e-003 | K160: 17.28 | L160: 4.0999999999999995e-003 | M160: 110.3 | N160: 21.51 | O160: 0.28100000000000003 | P160: 80.33 | Q160: 转股中 | R160: 5年39天 | S160: 3年40天 | T160: 7.38 | U160: 3.2 | V160: 4.0000000000000001e-003 | W160: 8.3000000000000004e-002 | X160: 6.7000000000000004e-002 | Y160: 89 | Z160: 2.67 | AA160: 1.3899999999999999e-002 | AB160: 1.01e-002 | AC160: 5.0000000000000001e-004 | AD160: -1.4000000000000002e-003 | AE160: 89.58 | AF160: 88.84 | AG160: 0.42 | AH160: AA | AI160: 4.41e-002 | AJ160: =H160+100*O160 -> 130.99799999999999 | AK160: 125.5 | AL160: 122 | AM160: 35.9 | AN160: 162 | AO160: -4.9000000000000002e-002 | AP160: 20 | AQ160: 科华转债!
A161: 29 | B161: 123102 | C161: 华自转债 | D161: 300490 | E161: 华自科技 | F161: 机械装备 | G161: 机器人及 | H161: 117.64 | I161: 1.15e-002 | J161: -4.3e-003 | K161: 10.85 | L161: 1.0200000000000001e-002 | M161: 126.9 | N161: 9.26 | O161: 4.0000000000000001e-003 | P161: 117.17 | Q161: 3月2天 | R161: 5.73年 | S161: 3.73年 | T161: 6.7 | U161: 51 | V161: 6.6000000000000003e-002 | W161: 0.24100000000000002 | X161: 0.28199999999999997 | Y161: 28 | Z161: 1.59 | AA161: 1.3600000000000001e-002 | AB161: 5.7999999999999996e-003 | AC161: -2.8999999999999998e-002 | AD161: -3.1400000000000004e-002 | AE161: 82.32 | AF161: 89.17 | AG161: 0.71 | AH161: AA- | AI161: 6.5099999999999991e-002 | AJ161: =H161+100*O161 -> 118.04000000000001 | AK161: 118.1 | AL161: 40 | AM161: 28.9 | AN161: 84 | AO161: -5.0999999999999997e-002 | AP161: 18 | AQ161: 华自转债
A162: 242 | B162: 110060 | C162: 天路转债! | D162: 600326 | E162: 西藏天路 | F162: 建筑 | G162: 水泥 | H162: 108.49 | I162: 8.0000000000000004e-004 | J162: 2.2000000000000001e-003 | K162: 6.89 | L162: 5.7999999999999996e-003 | M162: 114.9 | N162: 7.16 | O162: 0.127 | P162: 96.23 | Q162: 转股中 | R162: 4.36年 | S162: 2.36年 | T162: 7.06 | U162: 7.9 | V162: 1.e-002 | W162: 0.11199999999999999 | X162: 0.107 | Y162: 63 | Z162: 1.5 | AA162: 1.3500000000000002e-002 | AB162: 7.3000000000000001e-003 | AC162: -1.9e-002 | AD162: -2.1600000000000001e-002 | AE162: 93.09 | AF162: 96.04 | AG162: 0.52 | AH162: AA | AI162: 4.2900000000000001e-002 | AJ162: =H162+100*O162 -> 121.19 | AK162: 120.8 | AL162: 70 | AM162: 24.7 | AN162: 36 | AO162: -2.e-002 | AP162: 14 | AQ162: 天路转债!
A163: 221 | B163: 128090 | C163: 汽模转2 | D163: 2510. | E163: 天汽模 | F163: 汽车 | G163: 零部件制 | H163: 108.366 | I163: 2.8000000000000004e-003 | J163: -2.0000000000000001e-004 | K163: 4.05 | L163: 5.0000000000000001e-003 | M163: 114.9 | N163: 4.21 | O163: 0.126 | P163: 96.2 | Q163: 转股中 | R163: 4.52年 | S163: 2.53年 | T163: 3.1 | U163: 8.2 | V163: 2.5000000000000001e-002 | W163: 8.1000000000000003e-002 | X163: 7.8e-002 | Y163: 39 | Z163: 1.89 | AA163: 1.3300000000000001e-002 | AB163: 7.3000000000000001e-003 | AC163: -1.7399999999999999e-002 | AD163: -1.9799999999999998e-002 | AE163: 92.45 | AF163: 95.38 | AG163: 0.52 | AH163: AA | AI163: 4.2900000000000001e-002 | AJ163: =H163+100*O163 -> 120.96599999999999 | AK163: 120.5 | AL163: 67 | AM163: 25.2 | AN163: 39 | AO163: -1.e-002 | AP163: 29 | AQ163: 汽模转2
A164: 259 | B164: 113542 | C164: 好客转债 | D164: 603898 | E164: 好莱客 | F164: 其他 | G164: 家居用品 | H164: 108.98 | I164: -4.0000000000000002e-004 | J164: 1.2999999999999999e-003 | K164: 14.48 | L164: 2.0999999999999999e-003 | M164: 114.9 | N164: 16.14 | O164: 0.215 | P164: 89.71 | Q164: 转股中 | R164: 4年43天 | S164: 2年44天 | T164: 6.03 | U164: 0.9 | V164: 1.e-003 | W164: 0.13400000000000001 | X164: 0.12 | Y164: 45 | Z164: 1.75 | AA164: 1.32e-002 | AB164: 6.6e-003 | AC164: -2.3e-002 | AD164: -2.58e-002 | AE164: 94.04 | AF164: 97.02 | AG164: 0.43 | AH164: AA | AI164: 4.2900000000000001e-002 | AJ164: =H164+100*O164 -> 130.48000000000002 | AK164: 128.2 | AL164: 146 | AM164: 31.2 | AN164: 108 | AO164: 6.0000000000000001e-003 | AP164: 18 | AQ164: 好客转债
A165: 340 | B165: 110041 | C165: 蒙电转债! | D165: 600863 | E165: 内蒙华电 | F165: 能源电力 | G165: 电力供应 | H165: 105.87 | I165: 4.1999999999999997e-003 | J165: 2.0999999999999999e-003 | K165: 2.46 | L165: 1.6500000000000001e-002 | M165: 109.3 | N165: 2.69 | O165: 0.158 | P165: 91.45 | Q165: 转股中 | R165: 2.51年 | S165: 0.51年 | T165: 18.7 | U165: 1.8 | V165: 1.e-003 | W165: 0.13100000000000001 | X165: 0.12 | Y165: 143 | Z165: 1.22 | AA165: 1.3000000000000001e-002 | AB165: 6.0000000000000001e-003 | AC165: -5.6299999999999996e-002 | AD165: -6.1200000000000004e-002 | AE165: 99.37 | AF165: 100.07 | AG165: 0.38 | AH165: AAA | AI165: 3.6400000000000002e-002 | AJ165: =H165+100*O165 -> 121.67 | AK165: 120.3 | AL165: 64 | AM165: 20.2 | AN165: 16 | AO165: 1.4999999999999999e-002 | AP165: 11 | AQ165: 蒙电转债!
A166: 324 | B166: 128040 | C166: 华通转债! | D166: 2758. | E166: 浙农股份 | F166: 医药 | G166: 医药商业 | H166: 107.156 | I166: -5.4000000000000003e-003 | J166: 6.5000000000000006e-003 | K166: 9.57 | L166: 2.0999999999999999e-003 | M166: 111.3 | N166: 10.15 | O166: 0.13699999999999998 | P166: 94.29 | Q166: 转股中 | R166: 2.99年 | S166: 0.99年 | T166: 2.22 | U166: 38 | V166: 0.161 | W166: 4.8000000000000001e-002 | X166: 4.4999999999999998e-002 | Y166: 47 | Z166: 1.55 | AA166: 1.3000000000000001e-002 | AB166: 5.8999999999999999e-003 | AC166: -4.3499999999999997e-002 | AD166: -4.6399999999999997e-002 | AE166: 94.94 | AF166: 93.13 | AG166: 0.51 | AH166: AA- | AI166: 6.2400000000000004e-002 | AJ166: =H166+100*O166 -> 120.85600000000001 | AK166: 120 | AL166: 61 | AM166: 25.1 | AN166: 38 | AO166: -2.e-002 | AP166: 31 | AQ166: 华通转债!
A167: 31 | B167: 123101 | C167: 拓斯转债! | D167: 300607 | E167: 拓斯达 | F167: 机械装备 | G167: 机器人及 | H167: 107.006 | I167: 6.5000000000000006e-003 | J167: -3.2000000000000002e-003 | K167: 31.94 | L167: 9.1999999999999998e-003 | M167: 115.1 | N167: 42.25 | O167: 0.41499999999999998 | P167: 75.6 | Q167: 3月0天 | R167: 5.72年 | S167: 3.73年 | T167: 6.7 | U167: 3.4 | V167: 5.0000000000000001e-003 | W167: 7.9000000000000001e-002 | X167: 5.9999999999999998e-002 | Y167: 85 | Z167: 3.78 | AA167: 1.3000000000000001e-002 | AB167: 8.199999999999999e-003 | AC167: -8.3000000000000001e-003 | AD167: -1.01e-002 | AE167: 87.7 | AF167: 90.31 | AG167: 0.36 | AH167: AA | AI167: 4.41e-002 | AJ167: =H167+100*O167 -> 148.506 | AK167: 138.4 | AL167: 248 | AM167: 48.1 | AN167: 254 | AO167: -1.2e-002 | AP167: 4 | AQ167: 拓斯转债!
A168: 234 | B168: 128081 | C168: 海亮转债! | D168: 2203. | E168: 海亮股份 | F168: 有色金属 | G168: 铜金属 | H168: 108.687 | I168: 4.1999999999999997e-003 | J168: 3.0000000000000001e-003 | K168: 10.15 | L168: 1.2e-002 | M168: 114.9 | N168: 9.76 | O168: 4.4999999999999998e-002 | P168: 104 | Q168: 转股中 | R168: 4.43年 | S168: 2.43年 | T168: 30.1 | U168: 6.5 | V168: 2.e-003 | W168: 0.151 | X168: 0.157 | Y168: 200 | Z168: 2.1 | AA168: 1.29e-002 | AB168: 6.8000000000000005e-003 | AC168: -1.9199999999999998e-002 | AD168: -2.1700000000000001e-002 | AE168: 92.83 | AF168: 95.78 | AG168: 0.6 | AH168: AA | AI168: 4.2900000000000001e-002 | AJ168: =H168+100*O168 -> 113.187 | AK168: 113.4 | AL168: 13 | AM168: 17.6 | AN168: 12 | AO168: -6.0000000000000001e-003 | AP168: 52 | AQ168: 海亮转债!
A169: 177 | B169: 128107 | C169: 交科转债 | D169: 2061. | E169: 浙江交科 | F169: 建筑 | G169: 建筑工程 | H169: 108.1 | I169: -3.9000000000000003e-003 | J169: -2.3999999999999998e-003 | K169: 5.37 | L169: -1.1000000000000001e-002 | M169: 114.9 | N169: 5.36 | O169: 7.9000000000000001e-002 | P169: 100.19 | Q169: 转股中 | R169: 4.84年 | S169: 2.84年 | T169: 25 | U169: 4.8 | V169: 2.e-003 | W169: 0.33799999999999997 | X169: 0.33899999999999997 | Y169: 74 | Z169: 0.86 | AA169: 1.29e-002 | AB169: 7.3000000000000001e-003 | AC169: -1.4800000000000001e-002 | AD169: -1.6899999999999998e-002 | AE169: 92 | AF169: 95.41 | AG169: 0.57 | AH169: AA+ | AI169: 3.9900000000000005e-002 | AJ169: =H169+100*O169 -> 116. | AK169: 116 | AL169: 29 | AM169: 20.6 | AN169: 20 | AO169: -3.0000000000000001e-003 | AP169: 17 | AQ169: 交科转债
A170: 69 | B170: 128140 | C170: 润建转债! | D170: 2929. | E170: 润建股份 | F170: 通信互联 | G170: 通信设备 | H170: 107.525 | I170: 2.0000000000000001e-004 | J170: -1.0800000000000001e-002 | K170: 25.25 | L170: -1.9e-002 | M170: 115.2 | N170: 26.4 | O170: 0.124 | P170: 95.64 | Q170: 转股中 | R170: 5.47年 | S170: 3.47年 | T170: 10.9 | U170: 13 | V170: 1.1000000000000001e-002 | W170: 0.19600000000000001 | X170: 0.187 | Y170: 56 | Z170: 1.76 | AA170: 1.29e-002 | AB170: 7.9000000000000008e-003 | AC170: -1.e-002 | AD170: -1.1899999999999999e-002 | AE170: 88.77 | AF170: 91.4 | AG170: 0.56 | AH170: AA | AI170: 4.41e-002 | AJ170: =H170+100*O170 -> 119.92500000000001 | AK170: 119.4 | AL170: 59 | AM170: 28 | AN170: 69 | AO170: 5.2000000000000005e-002 | AP170: 13 | AQ170: 润建转债!
A171: 18 | B171: 123107 | C171: 温氏转债! | D171: 300498 | E171: 温氏股份 | F171: 农业 | G171: 畜牧业 | H171: 105.06 | I171: -2.3e-003 | J171: 3.9000000000000003e-003 | K171: 13.81 | L171: 4.4000000000000003e-003 | M171: 113 | N171: 17.82 | O171: 0.35600000000000004 | P171: 77.5 | Q171: 3月22天 | R171: 5.78年 | S171: 3.78年 | T171: 93 | U171: 33 | V171: 3.0000000000000001e-003 | W171: 0.106 | X171: 8.199999999999999e-002 | Y171: 880 | Z171: 1.91 | AA171: 1.29e-002 | AB171: 8.6999999999999994e-003 | AC171: -3.8e-003 | AD171: -5.5000000000000005e-003 | AE171: 89.07 | AF171: 90.89 | AG171: 0.37 | AH171: AAA | AI171: 3.9100000000000003e-002 | AJ171: =H171+100*O171 -> 140.66 | AK171: 132.6 | AL171: 199 | AM171: 41.7 | AN171: 211 | AO171: -2.3e-002 | AP171: 9 | AQ171: 温氏转债!
A172: 172 | B172: 127017 | C172: 万青转债 | D172: 789. | E172: 万年青 | F172: 建筑 | G172: 水泥 | H172: 110.921 | I172: -9.5999999999999992e-003 | J172: 1.7000000000000001e-003 | K172: 11.6 | L172: -2.0299999999999999e-002 | M172: 118 | N172: 13.46 | O172: 0.28699999999999998 | P172: 86.18 | Q172: 转股中 | R172: 4.96年 | S172: 2.96年 | T172: 10 | U172: 16 | V172: 1.3999999999999999e-002 | W172: 0.10800000000000001 | X172: 9.3000000000000013e-002 | Y172: 92 | Z172: 1.41 | AA172: 1.2800000000000001e-002 | AB172: 6.3e-003 | AC172: -2.2599999999999999e-002 | AD172: -2.46e-002 | AE172: 91.53 | AF172: 97.53 | AG172: 0.39 | AH172: AA+ | AI172: 3.9900000000000005e-002 | AJ172: =H172+100*O172 -> 139.62100000000001 | AK172: 135.7 | AL172: 226 | AM172: 38.1 | AN172: 181 | AO172: -9.8000000000000004e-002 | AP172: 9 | AQ172: 万青转债
A173: 336 | B173: 128034 | C173: 江银转债! | D173: 2807. | E173: 江阴银行 | F173: 金融 | G173: 银行行业 | H173: 104.86 | I173: -1.4000000000000002e-003 | J173: -1.6000000000000001e-003 | K173: 3.93 | L173: -7.6e-003 | M173: 108.3 | N173: 4.32 | O173: 0.153 | P173: 90.97 | Q173: 转股中 | R173: 2.61年 | S173: 无权 | T173: 17.6 | U173: 7.3 | V173: 4.0000000000000001e-003 | W173: 0.20600000000000002 | X173: 0.187 | Y173: 85 | Z173: 0.71 | AA173: 1.26e-002 | AB173: 6.5000000000000006e-003 | AC173: 无权 | AD173: 无权 | AE173: 无权 | AF173: 98.28 | AG173: 0.4 | AH173: AA+ | AI173: 3.8399999999999997e-002 | AJ173: =H173+100*O173 -> 120.16 | AK173: 118.7 | AL173: 51 | AM173: 20.5 | AN173: 19 | AO173: -2.6000000000000002e-002 | AP173: 25 | AQ173: 江银转债!
A174: 198 | B174: 123045 | C174: 雷迪转债 | D174: 300652 | E174: 雷迪克 | F174: 汽车 | G174: 零部件制 | H174: 112.245 | I174: 5.4000000000000003e-003 | J174: 1.43e-002 | K174: 19.53 | L174: 3.1200000000000002e-002 | M174: 118.9 | N174: 20.13 | O174: 0.157 | P174: 97.02 | Q174: 转股中 | R174: 4.73年 | S174: 2.73年 | T174: 1.66 | U174: 10 | V174: 5.4000000000000006e-002 | W174: 9.0999999999999998e-002 | X174: 8.8000000000000009e-002 | Y174: 18 | Z174: 1.94 | AA174: 1.2500000000000001e-002 | AB174: 5.5000000000000005e-003 | AC174: -2.6000000000000002e-002 | AD174: -2.86e-002 | AE174: 84.6 | AF174: 85.17 | AG174: 0.63 | AH174: A+ | AI174: 7.4900000000000008e-002 | AJ174: =H174+100*O174 -> 127.94500000000001 | AK174: 127.5 | AL174: 140 | AM174: 42.3 | AN174: 216 | AO174: 5.2000000000000005e-002 | AP174: 34 | AQ174: 雷迪转债
A175: 34 | B175: 128144 | C175: 利民转债 | D175: 2734. | E175: 利民股份 | F175: 化工 | G175: 农化 | H175: 106.677 | I175: -2.0000000000000001e-004 | J175: -1.2999999999999999e-003 | K175: 11.8 | L175: -3.4000000000000002e-003 | M175: 114.1 | N175: 13.98 | O175: 0.26400000000000001 | P175: 84.41 | Q175: 2月19天 | R175: 5.70年 | S175: 3.70年 | T175: 9.8 | U175: 2.4 | V175: 2.e-003 | W175: 0.223 | X175: 0.188 | Y175: 44 | Z175: 1.6 | AA175: 1.2e-002 | AB175: 7.4999999999999997e-003 | AC175: -9.4999999999999998e-003 | AD175: -1.09e-002 | AE175: 87.15 | AF175: 89.55 | AG175: 0.46 | AH175: AA | AI175: 4.41e-002 | AJ175: =H175+100*O175 -> 133.077 | AK175: 128.9 | AL175: 155 | AM175: 39.4 | AN175: 190 | AO175: -5.0000000000000003e-002 | AP175: 5 | AQ175: 利民转债
A176: 214 | B176: 113563 | C176: 柳药转债! | D176: 603368 | E176: 柳药股份 | F176: 医药 | G176: 医药商业 | H176: 107.3 | I176: -2.3999999999999998e-003 | J176: 1.2999999999999999e-003 | K176: 19.23 | L176: -3.0999999999999999e-003 | M176: 112.9 | N176: 23.87 | O176: 0.33200000000000002 | P176: 80.56 | Q176: 转股中 | R176: 4.58年 | S176: 2.58年 | T176: 8.02 | U176: 2.4 | V176: 3.0000000000000001e-003 | W176: 0.115 | X176: 9.3000000000000013e-002 | Y176: 70 | Z176: 1.35 | AA176: 1.1399999999999999e-002 | AB176: 6.1999999999999998e-003 | AC176: -1.3500000000000002e-002 | AD176: -1.5900000000000001e-002 | AE176: 92.23 | AF176: 93.51 | AG176: 0.36 | AH176: AA | AI176: 4.2900000000000001e-002 | AJ176: =H176+100*O176 -> 140.5 | AK176: 134 | AL176: 215 | AM176: 40.5 | AN176: 201 | AO176: -5.5999999999999994e-002 | AP176: 17 | AQ176: 柳药转债!
A177: 90 | B177: 123075 | C177: 贝斯转债! | D177: 300580 | E177: 贝斯特 | F177: 汽车 | G177: 零部件制 | H177: 108.827 | I177: 2.9100000000000001e-002 | J177: -1.9400000000000001e-002 | K177: 19.66 | L177: 1.8100000000000002e-002 | M177: 115.5 | N177: 23.74 | O177: 0.314 | P177: 82.81 | Q177: 转股中 | R177: 5.37年 | S177: 3.38年 | T177: 6 | U177: 8.2 | V177: 1.3000000000000001e-002 | W177: 0.153 | X177: 0.126 | Y177: 39 | Z177: 2.28 | AA177: 1.1399999999999999e-002 | AB177: 6.0999999999999995e-003 | AC177: -1.3300000000000001e-002 | AD177: -1.5300000000000001e-002 | AE177: 83.25 | AF177: 82.9 | AG177: 0.54 | AH177: AA- | AI177: 6.5099999999999991e-002 | AJ177: =H177+100*O177 -> 140.227 | AK177: 134.8 | AL177: 218 | AM177: 51.6 | AN177: 266 | AO177: 1.3000000000000001e-002 | AP177: 8 | AQ177: 贝斯转债!
A178: 224 | B178: 113030 | C178: 东风转债! | D178: 601515 | E178: 东风股份 | F178: 造纸包装 | G178: 包装材料 | H178: 111.36 | I178: 1.e-004 | J178: -4.1999999999999997e-003 | K178: 6.36 | L178: -7.8000000000000005e-003 | M178: 116.9 | N178: 6.45 | O178: 0.129 | P178: 98.6 | Q178: 转股中 | R178: 4.52年 | S178: 2.52年 | T178: 2.95 | U178: 34 | V178: 0.10099999999999999 | W178: 3.5000000000000003e-002 | X178: 3.4000000000000002e-002 | Y178: 85 | Z178: 1.84 | AA178: 1.1000000000000001e-002 | AB178: 4.3e-003 | AC178: -2.75e-002 | AD178: -2.9900000000000003e-002 | AE178: 92.48 | AF178: 97.07 | AG178: 0.53 | AH178: AA | AI178: 4.2900000000000001e-002 | AJ178: =H178+100*O178 -> 124.26000000000001 | AK178: 124.1 | AL178: 107 | AM178: 27 | AN178: 56 | AO178: -3.2000000000000001e-002 | AP178: 17 | AQ178: 东风转债!
A179: 183 | B179: 110070 | C179: 凌钢转债! | D179: 600231 | E179: 凌钢股份 | F179: 钢铁 | G179: 炼钢 | H179: 111.5 | I179: -4.5999999999999999e-003 | J179: 8.6e-003 | K179: 2.79 | L179: 7.1999999999999998e-003 | M179: 117.4 | N179: 2.75 | O179: 9.9000000000000005e-002 | P179: 101.45 | Q179: 转股中 | R179: 4.82年 | S179: 2.82年 | T179: 2.17 | U179: 13 | V179: 5.2000000000000005e-002 | W179: 2.7999999999999997e-002 | X179: 2.7999999999999997e-002 | Y179: 79 | Z179: 0.92 | AA179: 1.1000000000000001e-002 | AB179: 4.5000000000000005e-003 | AC179: -2.41e-002 | AD179: -2.64e-002 | AE179: 91.62 | AF179: 96.3 | AG179: 0.57 | AH179: AA | AI179: 4.2900000000000001e-002 | AJ179: =H179+100*O179 -> 121.40000000000001 | AK179: 121.5 | AL179: 76 | AM179: 25.2 | AN179: 40 | AO179: -4.9000000000000002e-002 | AP179: 22 | AQ179: 凌钢转债!
A180: 217 | B180: 127015 | C180: 希望转债!! | D180: 876. | E180: 新 希 望 | F180: 农业 | G180: 畜牧业 | H180: 104.803 | I180: -4.0000000000000002e-004 | J180: 3.9000000000000003e-003 | K180: 13.73 | L180: 1.8500000000000003e-002 | M180: 110 | N180: 19.75 | O180: 0.50800000000000001 | P180: 69.52 | Q180: 转股中 | R180: 4.54年 | S180: 2.55年 | T180: 9.5 | U180: 15 | V180: 1.4999999999999999e-002 | W180: 1.4999999999999999e-002 | X180: 1.1000000000000001e-002 | Y180: 619 | Z180: 1.67 | AA180: 1.09e-002 | AB180: 6.7000000000000002e-003 | AC180: -7.6e-003 | AD180: -9.4999999999999998e-003 | AE180: 92.88 | AF180: 93.15 | AG180: 0.18 | AH180: AAA | AI180: 3.7900000000000003e-002 | AJ180: =H180+100*O180 -> 155.60300000000001 | AK180: 140.1 | AL180: 260 | AM180: 46.9 | AN180: 250 | AO180: -7.6999999999999999e-002 | AP180: 27 | AQ180: 希望转债!!
A181: 70 | B181: 123082 | C181: 北陆转债! | D181: 300016 | E181: 北陆药业 | F181: 医药 | G181: 化学制药 | H181: 115 | I181: 8.6e-003 | J181: -4.0999999999999995e-003 | K181: 9.8 | L181: 6.1999999999999998e-003 | M181: 121.7 | N181: 8.8 | O181: 3.3000000000000002e-002 | P181: 111.36 | Q181: 转股中 | R181: 5.47年 | S181: 3.47年 | T181: 5 | U181: 6.9 | V181: 1.2e-002 | W181: 0.10300000000000001 | X181: 0.115 | Y181: 48 | Z181: 2.92 | AA181: 1.06e-002 | AB181: 3.8e-003 | AC181: -2.6000000000000002e-002 | AD181: -2.8300000000000002e-002 | AE181: 80.4 | AF181: 82.3 | AG181: 0.74 | AH181: A+ | AI181: 7.6100000000000001e-002 | AJ181: =H181+100*O181 -> 118.3 | AK181: 118.6 | AL181: 49 | AM181: 36.3 | AN181: 167 | AO181: -1.9e-002 | AP181: 10 | AQ181: 北陆转债!
A182: 233 | B182: 110062 | C182: 烽火转债! | D182: 600498 | E182: 烽火通信 | F182: 通信互联 | G182: 通信设备 | H182: 105.89 | I182: -2.8999999999999998e-003 | J182: 9.8999999999999991e-003 | K182: 18.71 | L182: 1.9599999999999999e-002 | M182: 110.8 | N182: 22.93 | O182: 0.29799999999999999 | P182: 81.6 | Q182: 转股中 | R182: 4.46年 | S182: 2.46年 | T182: 30.9 | U182: 14 | V182: 4.0000000000000001e-003 | W182: 0.14599999999999999 | X182: 0.11900000000000001 | Y182: 212 | Z182: 1.96 | AA182: 1.04e-002 | AB182: 5.8999999999999999e-003 | AC182: -9.4999999999999998e-003 | AD182: -1.1899999999999999e-002 | AE182: 93.78 | AF182: 94.19 | AG182: 0.36 | AH182: AAA | AI182: 3.7900000000000003e-002 | AJ182: =H182+100*O182 -> 135.69 | AK182: 130.2 | AL182: 172 | AM182: 36 | AN182: 165 | AO182: 3.6000000000000004e-002 | AP182: 19 | AQ182: 烽火转债!
A183: 48 | B183: 127028 | C183: 英特转债! | D183: 411. | E183: 英特集团 | F183: 医药 | G183: 医药商业 | H183: 107.191 | I183: 3.8e-003 | J183: 4.0000000000000001e-003 | K183: 13.31 | L183: 1.29e-002 | M183: 113.1 | N183: 13.4 | O183: 7.9000000000000001e-002 | P183: 99.33 | Q183: 23天 | R183: 5.55年 | S183: 3.55年 | T183: 6 | U183: 9.9 | V183: 1.4999999999999999e-002 | W183: 0.18100000000000002 | X183: 0.17999999999999999 | Y183: 33 | Z183: 1.95 | AA183: 9.8999999999999991e-003 | AB183: 5.5000000000000005e-003 | AC183: -9.1999999999999998e-003 | AD183: -1.1000000000000001e-002 | AE183: 89.31 | AF183: 90.83 | AG183: 0.61 | AH183: AA+ | AI183: 4.1100000000000005e-002 | AJ183: =H183+100*O183 -> 115.09100000000001 | AK183: 115.1 | AL183: 19 | AM183: 24.2 | AN183: 33 | AO183: -5.7000000000000002e-002 | AP183: 19 | AQ183: 英特转债!
A184: 92 | B184: 113606 | C184: 荣泰转债 | D184: 603579 | E184: 荣泰健康 | F184: 机械装备 | G184: 专用设备 | H184: 115.21 | I184: 1.7000000000000001e-003 | J184: 1.3000000000000001e-002 | K184: 34.74 | L184: 2.2099999999999998e-002 | M184: 121.2 | N184: 33.32 | O184: 0.105 | P184: 104.26 | Q184: 转股中 | R184: 5.36年 | S184: 3.37年 | T184: 6 | U184: 5.9 | V184: 8.0000000000000002e-003 | W184: 0.12300000000000001 | X184: 0.129 | Y184: 49 | Z184: 2.9 | AA184: 9.7000000000000003e-003 | AB184: 2.8999999999999998e-003 | AC184: -2.8500000000000001e-002 | AD184: -3.0699999999999998e-002 | AE184: 83.55 | AF184: 87.08 | AG184: 0.67 | AH184: AA- | AI184: 6.5099999999999991e-002 | AJ184: =H184+100*O184 -> 125.70999999999999 | AK184: 126.2 | AL184: 129 | AM184: 39.1 | AN184: 187 | AO184: -1.4999999999999999e-002 | AP184: 10 | AQ184: 荣泰转债
A185: 272 | B185: 113026 | C185: 核能转债! | D185: 601985 | E185: 中国核电 | F185: 能源电力 | G185: 核电 | H185: 105.44 | I185: -1.e-003 | J185: 2.9999999999999997e-004 | K185: 4.97 | L185: -2.e-003 | M185: 109.3 | N185: 5.86 | O185: 0.24299999999999999 | P185: 84.81 | Q185: 转股中 | R185: 3.82年 | S185: 1.83年 | T185: 78 | U185: 103 | V185: 1.2e-002 | W185: 8.9999999999999997e-002 | X185: 7.5999999999999998e-002 | Y185: 868 | Z185: 1.4 | AA185: 9.5999999999999992e-003 | AB185: 5.0000000000000001e-003 | AC185: -1.2699999999999999e-002 | AD185: -1.54e-002 | AE185: 95.51 | AF185: 95.07 | AG185: 0.37 | AH185: AAA | AI185: 3.7900000000000003e-002 | AJ185: =H185+100*O185 -> 129.74000000000001 | AK185: 126.1 | AL185: 126 | AM185: 30.6 | AN185: 102 | AO185: -3.7000000000000005e-002 | AP185: 44 | AQ185: 核能转债!
A186: 181 | B186: 123050 | C186: 聚飞转债 | D186: 300303 | E186: 聚飞光电 | F186: 电子 | G186: LED制 | H186: 118.4 | I186: -4.0000000000000002e-004 | J186: -1.0800000000000001e-002 | K186: 5.37 | L186: -1.83e-002 | M186: 123.8 | N186: 5.18 | O186: 0.14199999999999999 | P186: 103.67 | Q186: 转股中 | R186: 4.82年 | S186: 2.82年 | T186: 7.05 | U186: 17 | V186: 2.1000000000000001e-002 | W186: 0.10300000000000001 | X186: 0.106 | Y186: 69 | Z186: 2.79 | AA186: 9.4999999999999998e-003 | AB186: 1.1000000000000001e-003 | AC186: -4.3700000000000003e-002 | AD186: -4.5899999999999996e-002 | AE186: 86.35 | AF186: 92.42 | AG186: 0.61 | AH186: AA- | AI186: 6.3899999999999998e-002 | AJ186: =H186+100*O186 -> 132.59999999999999 | AK186: 133.1 | AL186: 206 | AM186: 40.7 | AN186: 203 | AO186: 8.4000000000000005e-002 | AP186: 11 | AQ186: 聚飞转债
A187: 146 | B187: 128121 | C187: 宏川转债! | D187: 2930. | E187: 宏川智慧 | F187: 交通运输 | G187: 物流业 | H187: 108.33 | I187: 2.9999999999999997e-004 | J187: 1.11e-002 | K187: 16.35 | L187: 2.2499999999999999e-002 | M187: 113.3 | N187: 20.24 | O187: 0.34100000000000003 | P187: 80.78 | Q187: 转股中 | R187: 5年28天 | S187: 3年29天 | T187: 6.7 | U187: 1.4 | V187: 2.e-003 | W187: 9.1999999999999998e-002 | X187: 7.400000000000001e-002 | Y187: 73 | Z187: 3.5 | AA187: 9.1000000000000004e-003 | AB187: 4.1999999999999997e-003 | AC187: -1.32e-002 | AD187: -1.54e-002 | AE187: 84.79 | AF187: 82.86 | AG187: 0.5 | AH187: AA- | AI187: 6.5099999999999991e-002 | AJ187: =H187+100*O187 -> 142.43000000000001 | AK187: 135.9 | AL187: 228 | AM187: 51.1 | AN187: 264 | AO187: 4.8000000000000001e-002 | AP187: 5 | AQ187: 宏川转债!
A188: 117 | B188: 128129 | C188: 青农转债! | D188: 2958. | E188: 青农商行 | F188: 金融 | G188: 银行行业 | H188: 107.15 | I188: -2.2000000000000001e-003 | J188: -4.0000000000000002e-004 | K188: 4.28 | L188: -4.6999999999999993e-003 | M188: 112.2 | N188: 4.47 | O188: 0.11900000000000001 | P188: 95.75 | Q188: 转股中 | R188: 5.18年 | S188: 无权 | T188: 50 | U188: 32 | V188: 6.0000000000000001e-003 | W188: 0.20999999999999999 | X188: 0.20100000000000001 | Y188: 238 | Z188: 0.87 | AA188: 9.1000000000000004e-003 | AB188: 4.6999999999999993e-003 | AC188: 无权 | AD188: 无权 | AE188: 无权 | AF188: 92.26 | AG188: 0.55 | AH188: AAA | AI188: 3.9100000000000003e-002 | AJ188: =H188+100*O188 -> 119.05000000000001 | AK188: 118.6 | AL188: 47 | AM188: 26.3 | AN188: 52 | AO188: -2.7999999999999997e-002 | AP188: 14 | AQ188: 青农转债!
A189: 28 | B189: 123104 | C189: 卫宁转债 | D189: 300253 | E189: 卫宁健康 | F189: 计算机及 | G189: 软件开发 | H189: 118.844 | I189: 2.8999999999999998e-003 | J189: -8.6999999999999994e-003 | K189: 15.04 | L189: -1.5100000000000001e-002 | M189: 125.1 | N189: 17.76 | O189: 0.40299999999999997 | P189: 84.68 | Q189: 3月6天 | R189: 5.74年 | S189: 3.74年 | T189: 9.7 | U189: 4.4 | V189: 4.0000000000000001e-003 | W189: 2.9999999999999999e-002 | X189: 2.6000000000000002e-002 | Y189: 322 | Z189: 7.05 | AA189: 9.1000000000000004e-003 | AB189: 1.8e-003 | AC189: -3.4799999999999998e-002 | AD189: -3.6400000000000002e-002 | AE189: 87.64 | AF189: 98.05 | AG189: 0.38 | AH189: AA | AI189: 4.41e-002 | AJ189: =H189+100*O189 -> 159.14400000000001 | AK189: 153 | AL189: 307 | AM189: 55 | AN189: 285 | AO189: -4.7e-002 | AP189: 4 | AQ189: 卫宁转债
A190: 308 | B190: 128048 | C190: 张行转债 | D190: 2839. | E190: 张家港行 | F190: 金融 | G190: 银行行业 | H190: 109.999 | I190: 6.8999999999999999e-003 | J190: -5.1999999999999998e-003 | K190: 5.47 | L190: 3.7000000000000002e-003 | M190: 113.3 | N190: 5.76 | O190: 0.158 | P190: 94.97 | Q190: 转股中 | R190: 3.40年 | S190: 无权 | T190: 25 | U190: 3.7 | V190: 1.e-003 | W190: 0.253 | X190: 0.23999999999999999 | Y190: 99 | Z190: 0.89 | AA190: 8.8999999999999999e-003 | AB190: 1.7000000000000001e-003 | AC190: 无权 | AD190: 无权 | AE190: 无权 | AF190: 99.46 | AG190: 0.46 | AH190: AA+ | AI190: 3.9900000000000005e-002 | AJ190: =H190+100*O190 -> 125.79899999999999 | AK190: 125 | AL190: 117 | AM190: 25.6 | AN190: 46 | AO190: -2.7000000000000003e-002 | AP190: 12 | AQ190: 张行转债
A191: 94 | B191: 123073 | C191: 同和转债! | D191: 300636 | E191: 同和药业 | F191: 医药 | G191: 原料药 | H191: 116.966 | I191: 1.3600000000000001e-002 | J191: 7.1999999999999998e-003 | K191: 16.8 | L191: 2.8199999999999999e-002 | M191: 122.4 | N191: 14.82 | O191: 3.2000000000000001e-002 | P191: 113.36 | Q191: 转股中 | R191: 5.35年 | S191: 3.36年 | T191: 3.59 | U191: 4.6 | V191: 1.1000000000000001e-002 | W191: 0.10400000000000001 | X191: 0.11800000000000001 | Y191: 35 | Z191: 2.75 | AA191: 8.6999999999999994e-003 | AB191: 1.5e-003 | AC191: -3.1699999999999999e-002 | AD191: -3.4000000000000002e-002 | AE191: 81.04 | AF191: 83.45 | AG191: 0.74 | AH191: A+ | AI191: 7.6100000000000001e-002 | AJ191: =H191+100*O191 -> 120.166 | AK191: 120.6 | AL191: 68 | AM191: 37.1 | AN191: 171 | AO191: -6.0000000000000001e-003 | AP191: 11 | AQ191: 同和转债!
A192: 101 | B192: 128135 | C192: 洽洽转债! | D192: 2557. | E192: 洽洽食品 | F192: 食品饮料 | G192: 休闲食品 | H192: 115.3 | I192: 1.0200000000000001e-002 | J192: -5.0000000000000001e-004 | K192: 46.66 | L192: 3.0699999999999998e-002 | M192: 120.2 | N192: 60.03 | O192: 0.48299999999999998 | P192: 77.73 | Q192: 转股中 | R192: 5.34年 | S192: 3.34年 | T192: 13.4 | U192: 17 | V192: 1.1000000000000001e-002 | W192: 5.7000000000000002e-002 | X192: 4.4000000000000004e-002 | Y192: 237 | Z192: 5.54 | AA192: 8.0000000000000002e-003 | AB192: 1.4000000000000002e-003 | AC192: -2.9999999999999999e-002 | AD192: -3.2000000000000001e-002 | AE192: 89.27 | AF192: 95.89 | AG192: 0.32 | AH192: AA | AI192: 4.41e-002 | AJ192: =H192+100*O192 -> 163.59999999999999 | AK192: 152.9 | AL192: 305 | AM192: 57 | AN192: 293 | AO192: -7.0000000000000007e-002 | AP192: 11 | AQ192: 洽洽转债!
A193: 56 | B193: 128141 | C193: 旺能转债 | D193: 2034. | E193: 旺能环境 | F193: 城市公用 | G193: 三废处理 | H193: 110.434 | I193: -6.1999999999999998e-003 | J193: -2.9999999999999997e-004 | K193: 16.3 | L193: -1.03e-002 | M193: 115.1 | N193: 15.97 | O193: 8.199999999999999e-002 | P193: 102.07 | Q193: 5.2天 | R193: 5.50年 | S193: 3.50年 | T193: 14 | U193: 29 | V193: 1.9e-002 | W193: 0.20399999999999999 | X193: 0.20800000000000002 | Y193: 69 | Z193: 1.45 | AA193: 7.7000000000000002e-003 | AB193: 2.7000000000000001e-003 | AC193: -1.7399999999999999e-002 | AD193: -1.9299999999999998e-002 | AE193: 88.57 | AF193: 91.2 | AG193: 0.62 | AH193: AA | AI193: 4.41e-002 | AJ193: =H193+100*O193 -> 118.634 | AK193: 118.8 | AL193: 53 | AM193: 27.6 | AN193: 65 | AO193: -7.8e-002 | AP193: 6 | AQ193: 旺能转债
A194: 47 | B194: 128143 | C194: 锋龙转债! | D194: 2931. | E194: 锋龙股份 | F194: 机械装备 | G194: 专用设备 | H194: 116.737 | I194: 6.4000000000000003e-003 | J194: 8.3999999999999995e-003 | K194: 14.88 | L194: 1.9199999999999998e-002 | M194: 121.7 | N194: 12.73 | O194: -1.e-003 | P194: 116.89 | Q194: 26天 | R194: 5.56年 | S194: 3.56年 | T194: 2.45 | U194: 23 | V194: 7.9000000000000001e-002 | W194: 8.3000000000000004e-002 | X194: 9.6999999999999989e-002 | Y194: 30 | Z194: 3.37 | AA194: 7.7000000000000002e-003 | AB194: 1.e-003 | AC194: -2.9300000000000003e-002 | AD194: -3.1600000000000003e-002 | AE194: 79.88 | AF194: 81.77 | AG194: 0.77 | AH194: A+ | AI194: 7.6100000000000001e-002 | AJ194: =H194+100*O194 -> 116.637 | AK194: 116.6 | AL194: 32 | AM194: 34.8 | AN194: 147 | AO194: -0.114 | AP194: 11 | AQ194: 锋龙转债!
A195: 65 | B195: 113043 | C195: 财通转债! | D195: 601108 | E195: 财通证券 | F195: 金融 | G195: 证券行业 | H195: 105.86 | I195: -1.e-003 | J195: 2.5999999999999999e-003 | K195: 10.39 | L195: 3.9000000000000003e-003 | M195: 110.2 | N195: 13.13 | O195: 0.33799999999999997 | P195: 79.13 | Q195: 转股中 | R195: 5.48年 | S195: 无权 | T195: 38 | U195: 31 | V195: 8.0000000000000002e-003 | W195: 0.10199999999999999 | X195: 8.1000000000000003e-002 | Y195: 373 | Z195: 1.63 | AA195: 7.4999999999999997e-003 | AB195: 4.0000000000000001e-003 | AC195: 无权 | AD195: 无权 | AE195: 无权 | AF195: 89.59 | AG195: 0.39 | AH195: AAA | AI195: 3.9100000000000003e-002 | AJ195: =H195+100*O195 -> 139.66 | AK195: 132.6 | AL195: 198 | AM195: 43 | AN195: 222 | AO195: -5.0999999999999997e-002 | AP195: 10 | AQ195: 财通转债!
A196: 218 | B196: 128093 | C196: 百川转债! | D196: 2455. | E196: 百川股份 | F196: 化工 | G196: 化工 | H196: 125.69 | I196: 8.6999999999999994e-003 | J196: 8.3000000000000001e-003 | K196: 7.32 | L196: 2.3799999999999998e-002 | M196: 129.8 | N196: 5.77 | O196: -9.0000000000000011e-003 | P196: 126.86 | Q196: 转股中 | R196: 4.54年 | S196: 2.55年 | T196: 3.91 | U196: 171 | V196: 0.34600000000000003 | W196: 0.10199999999999999 | X196: 0.13 | Y196: 38 | Z196: 2.79 | AA196: 7.4000000000000003e-003 | AB196: -3.4000000000000002e-003 | AC196: -5.9000000000000004e-002 | AD196: -6.3399999999999998e-002 | AE196: 90.64 | AF196: 98.97 | AG196: 0.72 | AH196: AA- | AI196: 6.3899999999999998e-002 | AJ196: =H196+100*O196 -> 124.78999999999999 | AK196: 124.5 | AL196: 113 | AM196: 25.5 | AN196: 44 | AO196: 4.0999999999999995e-002 | AP196: 49 | AQ196: 百川转债!
A197: 143 | B197: 127020 | C197: 中金转债 | D197: 60. | E197: 中金岭南 | F197: 有色金属 | G197: 有色行业 | H197: 109.974 | I197: -7.4999999999999997e-003 | J197: 1.24e-002 | K197: 4.48 | L197: 9.0000000000000011e-003 | M197: 113.7 | N197: 4.63 | O197: 0.13699999999999998 | P197: 96.76 | Q197: 转股中 | R197: 5年31天 | S197: 3年32天 | T197: 38 | U197: 28 | V197: 6.9999999999999993e-003 | W197: 0.23800000000000002 | X197: 0.23000000000000001 | Y197: 160 | Z197: 1.34 | AA197: 6.7000000000000002e-003 | AB197: 1.8e-003 | AC197: -2.1700000000000001e-002 | AD197: -2.3099999999999999e-002 | AE197: 89.94 | AF197: 92.91 | AG197: 0.55 | AH197: AA+ | AI197: 4.1100000000000005e-002 | AJ197: =H197+100*O197 -> 123.67400000000001 | AK197: 123.2 | AL197: 92 | AM197: 30.3 | AN197: 96 | AO197: -5.7999999999999996e-002 | AP197: 15 | AQ197: 中金转债
A198: 7 | B198: 123113 | C198: 仙乐转债 | D198: 300791 | E198: 仙乐健康 | F198: 食品饮料 | G198: 食品饮料 | H198: 114.1 | I198: -8.5000000000000006e-003 | J198: -1.2999999999999999e-003 | K198: 44.75 | L198: -1.95e-002 | M198: 118.5 | N198: 56.92 | O198: 0.45100000000000001 | P198: 78.62 | Q198: 4月9天 | R198: 5.83年 | S198: 3.84年 | T198: 10.3 | U198: 4.8 | V198: 4.0000000000000001e-003 | W198: 0.127 | X198: 0.10000000000000001 | Y198: 81 | Z198: 2.39 | AA198: 6.6e-003 | AB198: 1.1000000000000001e-003 | AC198: -2.35e-002 | AD198: -2.53e-002 | AE198: 80.87 | AF198: 82.61 | AG198: 0.51 | AH198: AA- | AI198: 6.5099999999999991e-002 | AJ198: =H198+100*O198 -> 159.19999999999999 | AK198: 149.6 | AL198: 297 | AM198: 67 | AN198: 321 | AO198: -0.34200000000000003 | AP198: 2 | AQ198: 仙乐转债
A199: 53 | B199: 123089 | C199: 九洲转2! | D199: 300040 | E199: 九洲集团 | F199: 能源电力 | G199: 电力设备 | H199: 117.088 | I199: 1.11e-002 | J199: 2.5999999999999999e-003 | K199: 9.25 | L199: 1.8700000000000001e-002 | M199: 121 | N199: 8 | O199: 1.3000000000000001e-002 | P199: 115.62 | Q199: 7天 | R199: 5.51年 | S199: 3.51年 | T199: 5 | U199: 42 | V199: 7.2000000000000008e-002 | W199: 0.14199999999999999 | X199: 0.16399999999999998 | Y199: 35 | Z199: 1.58 | AA199: 6.0999999999999995e-003 | AB199: -5.0000000000000001e-004 | AC199: -3.2199999999999999e-002 | AD199: -3.4200000000000001e-002 | AE199: 82.62 | AF199: 86.11 | AG199: 0.74 | AH199: AA- | AI199: 6.5099999999999991e-002 | AJ199: =H199+100*O199 -> 118.38799999999999 | AK199: 118.6 | AL199: 48 | AM199: 32.4 | AN199: 121 | AO199: -2.e-002 | AP199: 20 | AQ199: 九洲转2!
A200: 168 | B200: 123052 | C200: 飞鹿转债 | D200: 300665 | E200: 飞鹿股份 | F200: 化工 | G200: 化工 | H200: 123.199 | I200: 4.0999999999999995e-003 | J200: -4.0999999999999995e-003 | K200: 8.59 | L200: 0. | M200: 126.8 | N200: 7.05 | O200: 1.1000000000000001e-002 | P200: 121.84 | Q200: 转股中 | R200: 4.96年 | S200: 2.96年 | T200: 1.53 | U200: 7.9 | V200: 4.2000000000000003e-002 | W200: 0.10300000000000001 | X200: 0.125 | Y200: 15 | Z200: 2.24 | AA200: 6.0000000000000001e-003 | AB200: -2.8999999999999998e-003 | AC200: -5.1100000000000007e-002 | AD200: -5.3699999999999998e-002 | AE200: 83.74 | AF200: 89.38 | AG200: 0.73 | AH200: A+ | AI200: 7.4900000000000008e-002 | AJ200: =H200+100*O200 -> 124.29899999999999 | AK200: 124.6 | AL200: 114 | AM200: 35.2 | AN200: 151 | AO200: -0.13400000000000001 | AP200: 17 | AQ200: 飞鹿转债
A201: 240 | B201: 123033 | C201: 金力转债! | D201: 300748 | E201: 金力永磁 | F201: 电子 | G201: 元器件制 | H201: 118.715 | I201: 2.7000000000000001e-003 | J201: 8.6e-003 | K201: 25.2 | L201: 1.9e-002 | M201: 121.5 | N201: 25.3 | O201: 0.192 | P201: 99.6 | Q201: 转股中 | R201: 4.37年 | S201: 2.37年 | T201: 4.34 | U201: 5.4 | V201: 1.e-002 | W201: 2.5000000000000001e-002 | X201: 2.5000000000000001e-002 | Y201: 174 | Z201: 5.18 | AA201: 5.5000000000000005e-003 | AB201: -3.0000000000000001e-003 | AC201: -4.7899999999999998e-002 | AD201: -5.1399999999999994e-002 | AE201: 89.95 | AF201: 93.47 | AG201: 0.59 | AH201: AA- | AI201: 6.3899999999999998e-002 | AJ201: =H201+100*O201 -> 137.91499999999999 | AK201: 137.8 | AL201: 242 | AM201: 44.4 | AN201: 237 | AO201: -2.e-002 | AP201: 27 | AQ201: 金力转债!
A202: 85 | B202: 127024 | C202: 盈峰转债 | D202: 967. | E202: 盈峰环境 | F202: 机械装备 | G202: 专用设备 | H202: 113.5 | I202: -1.47e-002 | J202: -2.7000000000000001e-003 | K202: 7.47 | L202: -3.7400000000000003e-002 | M202: 116.8 | N202: 8.31 | O202: 0.26300000000000001 | P202: 89.89 | Q202: 转股中 | R202: 5.38年 | S202: 3.38年 | T202: 14.8 | U202: 15 | V202: 9.0000000000000011e-003 | W202: 6.2e-002 | X202: 5.5999999999999994e-002 | Y202: 236 | Z202: 1.41 | AA202: 5.4000000000000003e-003 | AB202: -1.e-004 | AC202: -2.64e-002 | AD202: -2.81e-002 | AE202: 89.65 | AF202: 94.39 | AG202: 0.47 | AH202: AA+ | AI202: 4.1100000000000005e-002 | AJ202: =H202+100*O202 -> 139.80000000000001 | AK202: 137.1 | AL202: 236 | AM202: 42.7 | AN202: 220 | AO202: -5.7999999999999996e-002 | AP202: 5 | AQ202: 盈峰转债
A203: 84 | B203: 127025 | C203: 冀东转债 | D203: 401. | E203: 冀东水泥 | F203: 建筑 | G203: 水泥 | H203: 107.12 | I203: -7.4000000000000003e-003 | J203: 1.3000000000000001e-002 | K203: 12.68 | L203: 1.2800000000000001e-002 | M203: 110.1 | N203: 15.28 | O203: 0.29100000000000004 | P203: 82.98 | Q203: 转股中 | R203: 5.38年 | S203: 3.38年 | T203: 17.8 | U203: 27 | V203: 1.3999999999999999e-002 | W203: 9.9000000000000005e-002 | X203: 8.199999999999999e-002 | Y203: 179 | Z203: 1.21 | AA203: 5.1999999999999998e-003 | AB203: 1.7000000000000001e-003 | AC203: -1.15e-002 | AD203: -1.3000000000000001e-002 | AE203: 89.84 | AF203: 89.85 | AG203: 0.44 | AH203: AAA | AI203: 3.9100000000000003e-002 | AJ203: =H203+100*O203 -> 136.22 | AK203: 131.3 | AL203: 185 | AM203: 41.4 | AN203: 208 | AO203: -6.0999999999999999e-002 | AP203: 10 | AQ203: 冀东转债
A204: 184 | B204: 128106 | C204: 华统转债 | D204: 2840. | E204: 华统股份 | F204: 农业 | G204: 农产品加 | H204: 110.32 | I204: -1.e-004 | J204: 7.7000000000000002e-003 | K204: 9.18 | L204: 1.32e-002 | M204: 112.9 | N204: 9.4 | O204: 0.13 | P204: 97.66 | Q204: 转股中 | R204: 4.81年 | S204: 2.81年 | T204: 5.35 | U204: 2.8 | V204: 5.0000000000000001e-003 | W204: 0.13 | X204: 0.127 | Y204: 41 | Z204: 2.33 | AA204: 4.8999999999999998e-003 | AB204: 0. | AC204: -2.1700000000000001e-002 | AD204: -2.3799999999999998e-002 | AE204: 91.34 | AF204: 92.61 | AG204: 0.57 | AH204: AA | AI204: 4.2900000000000001e-002 | AJ204: =H204+100*O204 -> 123.31999999999999 | AK204: 123 | AL204: 88 | AM204: 30.4 | AN204: 100 | AO204: -6.0999999999999999e-002 | AP204: 9 | AQ204: 华统转债
A205: 23 | B205: 128145 | C205: 日丰转债 | D205: 2953. | E205: 日丰股份 | F205: 家电 | G205: 零部件制 | H205: 112.23 | I205: 1.23e-002 | J205: -5.9999999999999995e-004 | K205: 14.38 | L205: 1.6299999999999999e-002 | M205: 115.4 | N205: 13.66 | O205: 6.6000000000000003e-002 | P205: 105.27 | Q205: 3月11天 | R205: 5.76年 | S205: 3.76年 | T205: 3.8 | U205: 2.7 | V205: 6.0000000000000001e-003 | W205: 0.109 | X205: 0.114 | Y205: 35 | Z205: 2.34 | AA205: 4.8999999999999998e-003 | AB205: 1.e-004 | AC205: -2.e-002 | AD205: -2.18e-002 | AE205: 81.17 | AF205: 80.83 | AG205: 0.72 | AH205: AA- | AI205: 6.5099999999999991e-002 | AJ205: =H205+100*O205 -> 118.83 | AK205: 119.2 | AL205: 55 | AM205: 38 | AN205: 179 | AO205: -0.16 | AP205: 6 | AQ205: 日丰转债
A206: 202 | B206: 110067 | C206: 华安转债! | D206: 600909 | E206: 华安证券 | F206: 金融 | G206: 证券行业 | H206: 107.88 | I206: 4.0000000000000001e-003 | J206: -5.0000000000000001e-004 | K206: 5.64 | L206: 7.0999999999999995e-003 | M206: 110.3 | N206: 6.22 | O206: 0.19 | P206: 90.68 | Q206: 转股中 | R206: 4.73年 | S206: 无权 | T206: 28 | U206: 20 | V206: 6.9999999999999993e-003 | W206: 0.106 | X206: 9.6000000000000002e-002 | Y206: 265 | Z206: 1.43 | AA206: 4.7999999999999996e-003 | AB206: 7.000000000000001e-004 | AC206: 无权 | AD206: 无权 | AE206: 无权 | AF206: 92.71 | AG206: 0.49 | AH206: AAA | AI206: 3.7900000000000003e-002 | AJ206: =H206+100*O206 -> 126.88 | AK206: 125.1 | AL206: 119 | AM206: 32.4 | AN206: 118 | AO206: -7.6999999999999999e-002 | AP206: 26 | AQ206: 华安转债!
A207: 119 | B207: 113039 | C207: 嘉泽转债! | D207: 601619 | E207: 嘉泽新能 | F207: 能源电力 | G207: 风能 | H207: 110.39 | I207: -9.0800000000000006e-002 | J207: 5.2600000000000001e-002 | K207: 3.91 | L207: -5.33e-002 | M207: 113.1 | N207: 3.46 | O207: -2.3e-002 | P207: 113.01 | Q207: 转股中 | R207: 5.18年 | S207: 3.18年 | T207: 8.74 | U207: 1581. | V207: 1.5900000000000001 | W207: 0.10300000000000001 | X207: 0.11599999999999999 | Y207: 85 | Z207: 2.27 | AA207: 4.7999999999999996e-003 | AB207: 2.0000000000000001e-004 | AC207: -1.89e-002 | AD207: -2.0899999999999998e-002 | AE207: 89.78 | AF207: 90.85 | AG207: 0.72 | AH207: AA | AI207: 4.41e-002 | AJ207: =H207+100*O207 -> 108.09 | AK207: 107.8 | AL207: 4 | AM207: 16.9 | AN207: 9 | AO207: 0.11699999999999999 | AP207: 35 | AQ207: 嘉泽转债!
A208: 45 | B208: 123093 | C208: 金陵转债 | D208: 300651 | E208: 金陵体育 | F208: 其他 | G208: 文化教育 | H208: 126.087 | I208: 5.1999999999999998e-003 | J208: -9.7999999999999997e-003 | K208: 42.65 | L208: -8.1000000000000013e-003 | M208: 129.3 | N208: 49.19 | O208: 0.45399999999999996 | P208: 86.7 | Q208: 38天 | R208: 5.59年 | S208: 3.59年 | T208: 2.5 | U208: 61 | V208: 0.19600000000000001 | W208: 4.5999999999999999e-002 | X208: 3.9e-002 | Y208: 55 | Z208: 7.96 | AA208: 4.5999999999999999e-003 | AB208: -3.9000000000000003e-003 | AC208: -4.4800000000000006e-002 | AD208: -4.7800000000000002e-002 | AE208: 81.09 | AF208: 86.88 | AG208: 0.57 | AH208: A+ | AI208: 7.6100000000000001e-002 | AJ208: =H208+100*O208 -> 171.48699999999999 | AK208: 165.5 | AL208: 327 | AM208: 78.6 | AN208: 333 | AO208: -1.3000000000000001e-002 | AP208: 6 | AQ208: 金陵转债
A209: 136 | B209: 110073 | C209: 国投转债 | D209: 600061 | E209: DR国投资 | F209: 金融 | G209: 证券行业 | H209: 108.2 | I209: 4.4000000000000003e-003 | J209: 3.4999999999999996e-003 | K209: 8.7 | L209: 1.6399999999999998e-002 | M209: 110.5 | N209: 9.9 | O209: 0.23100000000000001 | P209: 87.88 | Q209: 转股中 | R209: 5年35天 | S209: 无权 | T209: 80 | U209: 28 | V209: 3.0000000000000001e-003 | W209: 0.218 | X209: 0.191 | Y209: 368 | Z209: 0.85 | AA209: 4.1999999999999997e-003 | AB209: 4.0000000000000002e-004 | AC209: 无权 | AD209: 无权 | AE209: 无权 | AF209: 91.12 | AG209: 0.48 | AH209: AAA | AI209: 3.9100000000000003e-002 | AJ209: =H209+100*O209 -> 131.30000000000001 | AK209: 128.5 | AL209: 150 | AM209: 37.4 | AN209: 174 | AO209: -0.35999999999999999 | AP209: 24 | AQ209: 国投转债
A210: 108 | B210: 113603 | C210: 东缆转债! | D210: 603606 | E210: 东方电缆 | F210: 能源电力 | G210: 电力设备 | H210: 112.99 | I210: 2.0999999999999999e-003 | J210: -1.2999999999999999e-003 | K210: 18.96 | L210: 2.0999999999999999e-003 | M210: 115.1 | N210: 23.65 | O210: 0.40899999999999997 | P210: 80.17 | Q210: 转股中 | R210: 5.27年 | S210: 3.27年 | T210: 8 | U210: 11 | V210: 1.2e-002 | W210: 6.4000000000000001e-002 | X210: 5.2000000000000005e-002 | Y210: 124 | Z210: 3.71 | AA210: 3.5999999999999999e-003 | AB210: -1.6000000000000001e-003 | AC210: -2.5099999999999997e-002 | AD210: -2.7099999999999999e-002 | AE210: 89.45 | AF210: 92.11 | AG210: 0.39 | AH210: AA | AI210: 4.41e-002 | AJ210: =H210+100*O210 -> 153.88999999999999 | AK210: 145.8 | AL210: 287 | AM210: 53.7 | AN210: 279 | AO210: -4.5999999999999999e-002 | AP210: 7 | AQ210: 东缆转债!
A211: 215 | B211: 128094 | C211: 星帅转债 | D211: 2860. | E211: 星帅尔 | F211: 家电 | G211: 零部件制 | H211: 119.19 | I211: -3.4000000000000002e-003 | J211: -6.5000000000000006e-003 | K211: 16.3 | L211: -1.3300000000000001e-002 | M211: 121 | N211: 13.8 | O211: 9.0000000000000011e-003 | P211: 118.12 | Q211: 转股中 | R211: 4.58年 | S211: 2.58年 | T211: 2.71 | U211: 4.8 | V211: 1.4999999999999999e-002 | W211: 8.3000000000000004e-002 | X211: 9.8000000000000004e-002 | Y211: 33 | Z211: 3.18 | AA211: 3.4000000000000002e-003 | AB211: -4.5000000000000005e-003 | AC211: -4.8600000000000004e-002 | AD211: -5.1299999999999998e-002 | AE211: 85.55 | AF211: 87.62 | AG211: 0.74 | AH211: A+ | AI211: 7.4900000000000008e-002 | AJ211: =H211+100*O211 -> 120.09 | AK211: 120.3 | AL211: 63 | AM211: 32.6 | AN211: 123 | AO211: -2.9999999999999999e-002 | AP211: 29 | AQ211: 星帅转债
A212: 21 | B212: 127031 | C212: 洋丰转债! | D212: 902. | E212: 新洋丰 | F212: 化工 | G212: 农化 | H212: 115 | I212: -4.3e-003 | J212: 7.7000000000000002e-003 | K212: 14.21 | L212: 1.1399999999999999e-002 | M212: 117.1 | N212: 19.94 | O212: 0.61399999999999999 | P212: 71.26 | Q212: 3月22天 | R212: 5.76年 | S212: 3.77年 | T212: 10 | U212: 5.6 | V212: 5.0000000000000001e-003 | W212: 5.4000000000000006e-002 | X212: 3.7999999999999999e-002 | Y212: 185 | Z212: 2.55 | AA212: 3.2000000000000002e-003 | AB212: -2.e-003 | AC212: -2.64e-002 | AD212: -2.81e-002 | AE212: 87.55 | AF212: 91.7 | AG212: 0.3 | AH212: AA | AI212: 4.41e-002 | AJ212: =H212+100*O212 -> 176.40000000000001 | AK212: 158.7 | AL212: 318 | AM212: 67 | AN212: 322 | AO212: -4.4999999999999998e-002 | AP212: 3 | AQ212: 洋丰转债!
A213: 350 | B213: 123002 | C213: 国祯转债!! | D213: 300388 | E213: 节能国祯 | F213: 城市公用 | G213: 三废处理 | H213: 108 | I213: -1.e-004 | J213: -5.0000000000000001e-004 | K213: 7.91 | L213: -1.2999999999999999e-003 | M213: 108.8 | N213: 8.48 | O213: 0.158 | P213: 93.28 | Q213: 转股中 | R213: 2.44年 | S213: 0.44年 | T213: 2.52 | U213: 2.4 | V213: 9.0000000000000011e-003 | W213: 4.5999999999999999e-002 | X213: 4.2999999999999997e-002 | Y213: 55 | Z213: 1.5 | AA213: 3.0999999999999999e-003 | AB213: -3.7000000000000002e-003 | AC213: -0.105 | AD213: -0.11 | AE213: 99.11 | AF213: 98.72 | AG213: 0.46 | AH213: AA | AI213: 4.1399999999999999e-002 | AJ213: =H213+100*O213 -> 123.8 | AK213: 122.7 | AL213: 85 | AM213: 23.6 | AN213: 26 | AO213: -2.3e-002 | AP213: 15 | AQ213: 国祯转债!!
A214: 78 | B214: 113609 | C214: 永安转债! | D214: 603776 | E214: 永安行 | F214: 城市公用 | G214: 其他 | H214: 118.92 | I214: 1.6500000000000001e-002 | J214: 3.4999999999999996e-003 | K214: 19.67 | L214: 2.6099999999999998e-002 | M214: 120.5 | N214: 16.48 | O214: -4.0000000000000001e-003 | P214: 119.36 | Q214: 转股中 | R214: 5.43年 | S214: 3.44年 | T214: 7.53 | U214: 194 | V214: 0.21600000000000003 | W214: 0.16600000000000001 | X214: 0.19899999999999998 | Y214: 45 | Z214: 1.17 | AA214: 2.5000000000000001e-003 | AB214: -4.0000000000000001e-003 | AC214: -3.73e-002 | AD214: -3.9199999999999999e-002 | AE214: 82.94 | AF214: 86.14 | AG214: 0.77 | AH214: AA- | AI214: 6.5099999999999991e-002 | AJ214: =H214+100*O214 -> 118.52 | AK214: 118.5 | AL214: 46 | AM214: 32.3 | AN214: 117 | AO214: -0.17999999999999999 | AP214: 21 | AQ214: 永安转债!
A215: 99 | B215: 123072 | C215: 乐歌转债! | D215: 300729 | E215: 乐歌股份 | F215: 其他 | G215: 家居用品 | H215: 128.21 | I215: 8.6999999999999994e-003 | J215: -8.3999999999999995e-003 | K215: 24.85 | L215: 4.8999999999999998e-003 | M215: 129.6 | N215: 56.12 | O215: 1.8999999999999999 | P215: 44.28 | Q215: 转股中 | R215: 5.34年 | S215: 3.34年 | T215: 1.42 | U215: 52 | V215: 0.28800000000000003 | W215: 3.2000000000000001e-002 | X215: 1.3999999999999999e-002 | Y215: 45 | Z215: 3.37 | AA215: 2.0999999999999999e-003 | AB215: -6.8999999999999999e-003 | AC215: -5.1699999999999996e-002 | AD215: -5.5e-002 | AE215: 82.83 | AF215: 88.72 | AG215: 0.08 | AH215: A+ | AI215: 7.6100000000000001e-002 | AJ215: =H215+100*O215 -> 318.21000000000004 | AK215: 212.1 | AL215: 349 | AM215: 123.4 | AN215: 349 | AO215: -0.115 | AP215: 8 | AQ215: 乐歌转债!
A216: 15 | B216: 123109 | C216: 昌红转债 | D216: 300151 | E216: 昌红科技 | F216: 机械装备 | G216: 专用设备 | H216: 119.899 | I216: 8.199999999999999e-003 | J216: -1.6500000000000001e-002 | K216: 27.63 | L216: -1.29e-002 | M216: 121 | N216: 28.06 | O216: 0.218 | P216: 98.47 | Q216: 3月22天 | R216: 5.78年 | S216: 3.79年 | T216: 4.6 | U216: 6.3 | V216: 1.2e-002 | W216: 3.3000000000000002e-002 | X216: 3.3000000000000002e-002 | Y216: 139 | Z216: 12.98 | AA216: 1.6000000000000001e-003 | AB216: -4.5999999999999999e-003 | AC216: -3.5799999999999998e-002 | AD216: -3.7599999999999995e-002 | AE216: 81.19 | AF216: 84.62 | AG216: 0.64 | AH216: AA- | AI216: 6.5099999999999991e-002 | AJ216: =H216+100*O216 -> 141.69900000000001 | AK216: 141.3 | AL216: 267 | AM216: 56.7 | AN216: 292 | AO216: -5.5999999999999994e-002 | AP216: 4 | AQ216: 昌红转债
A217: 10 | B217: 127032 | C217: 苏行转债 | D217: 2966. | E217: 苏州银行 | F217: 金融 | G217: 银行行业 | H217: 114.102 | I217: -4.3e-003 | J217: -5.4000000000000003e-003 | K217: 7.79 | L217: -1.77e-002 | M217: 115.1 | N217: 8.1 | O217: 0.18600000000000003 | P217: 96.17 | Q217: 4月2天 | R217: 5.81年 | S217: 无权 | T217: 50 | U217: 24 | V217: 4.0000000000000001e-003 | W217: 0.193 | X217: 0.185 | Y217: 260 | Z217: 0.85 | AA217: 1.5e-003 | AB217: -3.0999999999999999e-003 | AC217: 无权 | AD217: 无权 | AE217: 无权 | AF217: 92.43 | AG217: 0.55 | AH217: AAA | AI217: 3.9100000000000003e-002 | AJ217: =H217+100*O217 -> 132.702 | AK217: 132 | AL217: 193 | AM217: 39.6 | AN217: 192 | AO217: -1.e-003 | AP217: 7 | AQ217: 苏行转债
A218: 54 | B218: 123090 | C218: 三诺转债 | D218: 300298 | E218: 三诺生物 | F218: 医药 | G218: 医疗器械 | H218: 116.237 | I218: 1.9e-003 | J218: 1.26e-002 | K218: 29.25 | L218: 3.4300000000000004e-002 | M218: 117.1 | N218: 35.15 | O218: 0.39700000000000002 | P218: 83.21 | Q218: 7天 | R218: 5.51年 | S218: 3.51年 | T218: 5 | U218: 3.7 | V218: 6.0000000000000001e-003 | W218: 2.9999999999999999e-002 | X218: 2.5000000000000001e-002 | Y218: 165 | Z218: 6.2 | AA218: 1.4000000000000002e-003 | AB218: -4.0999999999999995e-003 | AC218: -3.1099999999999999e-002 | AD218: -3.2899999999999999e-002 | AE218: 88.53 | AF218: 92.73 | AG218: 0.42 | AH218: AA | AI218: 4.41e-002 | AJ218: =H218+100*O218 -> 155.93700000000001 | AK218: 149.3 | AL218: 294 | AM218: 56.5 | AN218: 291 | AO218: -6.2e-002 | AP218: 4 | AQ218: 三诺转债
A219: 307 | B219: 110047 | C219: 山鹰转债 | D219: 600567 | E219: 山鹰国际 | F219: 造纸包装 | G219: 包装用纸 | H219: 117.04 | I219: -2.3999999999999998e-003 | J219: 5.4000000000000003e-003 | K219: 3.46 | L219: 5.7999999999999996e-003 | M219: 117.5 | N219: 3.34 | O219: 0.13 | P219: 103.59 | Q219: 转股中 | R219: 3.43年 | S219: 1.43年 | T219: 22.5 | U219: 17 | V219: 6.9999999999999993e-003 | W219: 0.14099999999999999 | X219: 0.14599999999999999 | Y219: 160 | Z219: 1.03 | AA219: 1.1999999999999999e-003 | AB219: -7.8000000000000005e-003 | AC219: -7.8600000000000003e-002 | AD219: -8.1699999999999995e-002 | AE219: 96.67 | AF219: 103.04 | AG219: 0.52 | AH219: AA+ | AI219: 3.9900000000000005e-002 | AJ219: =H219+100*O219 -> 130.04000000000002 | AK219: 130.5 | AL219: 178 | AM219: 27.4 | AN219: 62 | AO219: -5.9999999999999998e-002 | AP219: 31 | AQ219: 山鹰转债
A220: 250 | B220: 128074 | C220: 游族转债!! | D220: 2174. | E220: 游族网络 | F220: 通信互联 | G220: 互联网 | H220: 119.3 | I220: 5.3499999999999999e-002 | J220: -5.3499999999999999e-002 | K220: 17.81 | L220: 0.10000000000000001 | M220: 119.9 | N220: 16.97 | O220: 0.13699999999999998 | P220: 104.95 | Q220: 转股中 | R220: 4.26年 | S220: 2.27年 | T220: 6.83 | U220: 682 | V220: 0.84499999999999997 | W220: 4.2000000000000003e-002 | X220: 4.4000000000000004e-002 | Y220: 163 | Z220: 3.19 | AA220: 1.1999999999999999e-003 | AB220: -6.8000000000000005e-003 | AC220: -5.7699999999999994e-002 | AD220: -6.0100000000000001e-002 | AE220: 93.46 | AF220: 100.61 | AG220: 0 | AH220: AA | AI220: 4.2900000000000001e-002 | AJ220: =H220+100*O220 -> 133. | AK220: 133.7 | AL220: 211 | AM220: 33 | AN220: 125 | AO220: 4.2999999999999997e-002 | AP220: 26 | AQ220: 游族转债!!
A221: 283 | B221: 127012 | C221: 招路转债! | D221: 1965. | E221: 招商公路 | F221: 机场高速 | G221: 高速 | H221: 107.51 | I221: 1.6000000000000001e-003 | J221: -1.0200000000000001e-002 | K221: 7.48 | L221: -2.35e-002 | M221: 107.9 | N221: 8.81 | O221: 0.26600000000000001 | P221: 84.9 | Q221: 转股中 | R221: 3.76年 | S221: 1.76年 | T221: 50 | U221: 32 | V221: 6.0000000000000001e-003 | W221: 0.10800000000000001 | X221: 9.1999999999999998e-002 | Y221: 462 | Z221: 0.93 | AA221: 1.e-003 | AB221: -3.0000000000000001e-003 | AC221: -2.8799999999999999e-002 | AD221: -3.04e-002 | AE221: 94.65 | AF221: 93.98 | AG221: 0.36 | AH221: AAA | AI221: 3.7900000000000003e-002 | AJ221: =H221+100*O221 -> 134.11000000000001 | AK221: 130.1 | AL221: 171 | AM221: 35.5 | AN221: 157 | AO221: -5.2000000000000005e-002 | AP221: 31 | AQ221: 招路转债!
A222: 223 | B222: 123038 | C222: 联得转债! | D222: 300545 | E222: 联得装备 | F222: 机械装备 | G222: 专用设备 | H222: 118.28 | I222: 3.04e-002 | J222: -6.3e-003 | K222: 23.46 | L222: 3.8100000000000002e-002 | M222: 118.6 | N222: 24.07 | O222: 0.214 | P222: 97.47 | Q222: 转股中 | R222: 4.52年 | S222: 2.52年 | T222: 1.47 | U222: 143 | V222: 0.83200000000000007 | W222: 3.5000000000000003e-002 | X222: 3.4000000000000002e-002 | Y222: 42 | Z222: 4.31 | AA222: 5.9999999999999995e-004 | AB222: -6.5000000000000006e-003 | AC222: -4.7800000000000002e-002 | AD222: -5.0300000000000004e-002 | AE222: 85.72 | AF222: 86.23 | AG222: 0.63 | AH222: A+ | AI222: 7.4900000000000008e-002 | AJ222: =H222+100*O222 -> 139.68000000000001 | AK222: 139.1 | AL222: 253 | AM222: 52.9 | AN222: 275 | AO222: 9.9000000000000005e-002 | AP222: 19 | AQ222: 联得转债!
A223: 33 | B223: 113045 | C223: 环旭转债! | D223: 601231 | E223: 环旭电子 | F223: 电子 | G223: 电子产品 | H223: 111.84 | I223: 4.0000000000000002e-004 | J223: -3.5999999999999999e-003 | K223: 15.45 | L223: -9.0000000000000011e-003 | M223: 112 | N223: 19.75 | O223: 0.42999999999999999 | P223: 78.23 | Q223: 5月25天 | R223: 5.71年 | S223: 2.71年 | T223: 34.5 | U223: 1.4 | V223: 0. | W223: 0.10099999999999999 | X223: 7.9000000000000001e-002 | Y223: 341 | Z223: 2.75 | AA223: 2.9999999999999997e-004 | AB223: -3.5999999999999999e-003 | AC223: -2.86e-002 | AD223: -3.0499999999999999e-002 | AE223: 91.65 | AF223: 89.24 | AG223: 0.36 | AH223: AA+ | AI223: 4.1100000000000005e-002 | AJ223: =H223+100*O223 -> 154.84 | AK223: 145.5 | AL223: 286 | AM223: 53.8 | AN223: 282 | AO223: -2.8999999999999998e-002 | AP223: 4 | AQ223: 环旭转债!
A224: 116 | B224: 128130 | C224: 景兴转债 | D224: 2067. | E224: 景兴纸业 | F224: 造纸包装 | G224: 包装用纸 | H224: 115.057 | I224: 4.0000000000000001e-003 | J224: -4.0000000000000002e-004 | K224: 3.82 | L224: 5.3e-003 | M224: 115.1 | N224: 3.4 | O224: 2.4e-002 | P224: 112.35 | Q224: 转股中 | R224: 5.20年 | S224: 3.20年 | T224: 10.7 | U224: 11 | V224: 9.0000000000000011e-003 | W224: 0.24100000000000002 | X224: 0.27100000000000002 | Y224: 44 | Z224: 0.9 | AA224: 1.e-004 | AB224: -5.1000000000000004e-003 | AC224: -3.0899999999999997e-002 | AD224: -3.2899999999999999e-002 | AE224: 89.71 | AF224: 92.37 | AG224: 0.69 | AH224: AA | AI224: 4.41e-002 | AJ224: =H224+100*O224 -> 117.45700000000001 | AK224: 117.8 | AL224: 37 | AM224: 25.4 | AN224: 43 | AO224: -3.2000000000000001e-002 | AP224: 14 | AQ224: 景兴转债
A225: 220 | B225: 128091 | C225: 新天转债 | D225: 2873. | E225: 新天药业 | F225: 医药 | G225: 中药 | H225: 119.449 | I225: 1.2999999999999999e-003 | J225: -1.2999999999999999e-003 | K225: 18 | L225: 0. | M225: 119.4 | N225: 16.39 | O225: 8.8000000000000009e-002 | P225: 109.82 | Q225: 转股中 | R225: 4.53年 | S225: 2.53年 | T225: 1.76 | U225: 20 | V225: 9.5000000000000001e-002 | W225: 8.3000000000000004e-002 | X225: 9.1999999999999998e-002 | Y225: 21 | Z225: 2.59 | AA225: -1.e-004 | AB225: -7.4999999999999997e-003 | AC225: -4.9000000000000002e-002 | AD225: -5.1900000000000002e-002 | AE225: 86.2 | AF225: 86.83 | AG225: 0.72 | AH225: A+ | AI225: 7.4900000000000008e-002 | AJ225: =H225+100*O225 -> 128.249 | AK225: 129.1 | AL225: 158 | AM225: 42.2 | AN225: 214 | AO225: 6.9999999999999993e-003 | AP225: 18 | AQ225: 新天转债
A226: 38 | B226: 123098 | C226: 一品转债 | D226: 300723 | E226: 一品红 | F226: 医药 | G226: 医药行业 | H226: 124.06 | I226: -2.2000000000000001e-003 | J226: 1.1999999999999999e-003 | K226: 25.2 | L226: -1.6000000000000001e-003 | M226: 124 | N226: 25.45 | O226: 0.253 | P226: 99.02 | Q226: 46天 | R226: 5.61年 | S226: 3.61年 | T226: 4.8 | U226: 2.3 | V226: 4.0000000000000001e-003 | W226: 6.6000000000000003e-002 | X226: 6.5000000000000002e-002 | Y226: 73 | Z226: 2.61 | AA226: -1.e-004 | AB226: -7.1999999999999998e-003 | AC226: -4.6199999999999998e-002 | AD226: -4.8000000000000001e-002 | AE226: 82.08 | AF226: 87.66 | AG226: 0.63 | AH226: AA- | AI226: 6.5099999999999991e-002 | AJ226: =H226+100*O226 -> 149.36000000000001 | AK226: 149.1 | AL226: 292 | AM226: 61.4 | AN226: 304 | AO226: -5.5e-002 | AP226: 3 | AQ226: 一品转债
A227: 96 | B227: 113605 | C227: 大参转债 | D227: 603233 | E227: 大参林 | F227: 医药 | G227: 医药商业 | H227: 115.6 | I227: -6.9999999999999993e-003 | J227: -4.5999999999999999e-003 | K227: 50.48 | L227: -3.8699999999999998e-002 | M227: 115.2 | N227: 69.09 | O227: 0.58200000000000007 | P227: 73.06 | Q227: 转股中 | R227: 5.34年 | S227: 3.35年 | T227: 14.1 | U227: 13 | V227: 8.0000000000000002e-003 | W227: 3.5000000000000003e-002 | X227: 2.6000000000000002e-002 | Y227: 399 | Z227: 6.21 | AA227: -7.000000000000001e-004 | AB227: -5.6999999999999993e-003 | AC227: -3.0699999999999998e-002 | AD227: -3.27e-002 | AE227: 89.25 | AF227: 91.9 | AG227: 0.3 | AH227: AA | AI227: 4.41e-002 | AJ227: =H227+100*O227 -> 173.80000000000001 | AK227: 158.1 | AL227: 316 | AM227: 66.2 | AN227: 316 | AO227: -0.253 | AP227: 7 | AQ227: 大参转债
A228: 118 | B228: 113602 | C228: 景20转债! | D228: 603228 | E228: 景旺电子 | F228: 电子 | G228: 元器件制 | H228: 113.9 | I228: 8.8000000000000005e-003 | J228: -9.5999999999999992e-003 | K228: 25.41 | L228: -1.6000000000000001e-003 | M228: 113.3 | N228: 27.4 | O228: 0.22800000000000001 | P228: 92.74 | Q228: 转股中 | R228: 5.18年 | S228: 3.18年 | T228: 17.8 | U228: 8.3 | V228: 4.0000000000000001e-003 | W228: 8.199999999999999e-002 | X228: 7.5999999999999998e-002 | Y228: 217 | Z228: 3.33 | AA228: -1.e-003 | AB228: -5.6999999999999993e-003 | AC228: -2.76e-002 | AD228: -2.9700000000000001e-002 | AE228: 89.98 | AF228: 91.04 | AG228: 0.54 | AH228: AA | AI228: 4.41e-002 | AJ228: =H228+100*O228 -> 136.70000000000002 | AK228: 135.1 | AL228: 219 | AM228: 44 | AN228: 234 | AO228: 3.0000000000000001e-003 | AP228: 10 | AQ228: 景20转债!
A229: 68 | B229: 113612 | C229: 永冠转债 | D229: 603681 | E229: 永冠新材 | F229: 化工 | G229: 其他 | H229: 121.99 | I229: 2.52e-002 | J229: -1.5e-003 | K229: 24.76 | L229: 3.0800000000000001e-002 | M229: 121.2 | N229: 20.59 | O229: 1.3999999999999999e-002 | P229: 120.25 | Q229: 转股中 | R229: 5.47年 | S229: 3.47年 | T229: 5.2 | U229: 12 | V229: 2.e-002 | W229: 0.126 | X229: 0.152 | Y229: 41 | Z229: 2.62 | AA229: -1.1999999999999999e-003 | AB229: -7.8000000000000005e-003 | AC229: -4.2999999999999997e-002 | AD229: -4.4999999999999998e-002 | AE229: 82.99 | AF229: 86.49 | AG229: 0.77 | AH229: AA- | AI229: 6.5099999999999991e-002 | AJ229: =H229+100*O229 -> 123.39 | AK229: 123.7 | AL229: 102 | AM229: 37.2 | AN229: 172 | AO229: -2.1000000000000001e-002 | AP229: 6 | AQ229: 永冠转债
A230: 247 | B230: 128078 | C230: 太极转债! | D230: 2368. | E230: 太极股份 | F230: 计算机及 | G230: 软件开发 | H230: 117.697 | I230: 6.0000000000000001e-003 | J230: -8.8999999999999999e-003 | K230: 21.22 | L230: -5.1999999999999998e-003 | M230: 116.9 | N230: 22.4 | O230: 0.24199999999999999 | P230: 94.73 | Q230: 转股中 | R230: 4.34年 | S230: 2.34年 | T230: 9.6 | U230: 1.1 | V230: 1.e-003 | W230: 7.8e-002 | X230: 7.400000000000001e-002 | Y230: 123 | Z230: 3.67 | AA230: -1.6000000000000001e-003 | AB230: -8.3999999999999995e-003 | AC230: -5.0799999999999998e-002 | AD230: -5.3200000000000004e-002 | AE230: 93.16 | AF230: 97.79 | AG230: 0.56 | AH230: AA | AI230: 4.2900000000000001e-002 | AJ230: =H230+100*O230 -> 141.89699999999999 | AK230: 140.7 | AL230: 263 | AM230: 42.9 | AN230: 221 | AO230: -5.0000000000000001e-003 | AP230: 10 | AQ230: 太极转债!
A231: 296 | B231: 110051 | C231: 中天转债! | D231: 600522 | E231: 中天科技 | F231: 通信互联 | G231: 通信设备 | H231: 114.02 | I231: -3.4999999999999996e-003 | J231: 6.0999999999999995e-003 | K231: 9.83 | L231: 5.1000000000000004e-003 | M231: 113.3 | N231: 9.99 | O231: 0.159 | P231: 98.4 | Q231: 转股中 | R231: 3.70年 | S231: 1.70年 | T231: 39.6 | U231: 27 | V231: 6.0000000000000001e-003 | W231: 0.13200000000000001 | X231: 0.129 | Y231: 301 | Z231: 1.29 | AA231: -1.7000000000000001e-003 | AB231: -8.199999999999999e-003 | AC231: -5.4400000000000004e-002 | AD231: -5.7099999999999998e-002 | AE231: 95.62 | AF231: 98.3 | AG231: 0.52 | AH231: AA+ | AI231: 3.9900000000000005e-002 | AJ231: =H231+100*O231 -> 129.91999999999999 | AK231: 129.6 | AL231: 165 | AM231: 31.3 | AN231: 110 | AO231: -3.5000000000000003e-002 | AP231: 24 | AQ231: 中天转债!
A232: 280 | B232: 110057 | C232: 现代转债 | D232: 600420 | E232: 国药现代 | F232: 医药 | G232: 化学制药 | H232: 111.04 | I232: -1.7000000000000001e-003 | J232: 1.1000000000000001e-003 | K232: 9.8 | L232: -1.e-003 | M232: 110.3 | N232: 9.89 | O232: 0.121 | P232: 99.09 | Q232: 转股中 | R232: 3.78年 | S232: 1.79年 | T232: 16.2 | U232: 20 | V232: 1.1000000000000001e-002 | W232: 0.161 | X232: 0.159 | Y232: 101 | Z232: 1.24 | AA232: -1.8e-003 | AB232: -6.8000000000000005e-003 | AC232: -3.9e-002 | AD232: -4.1599999999999998e-002 | AE232: 95.65 | AF232: 96.07 | AG232: 0.55 | AH232: AAA | AI232: 3.7900000000000003e-002 | AJ232: =H232+100*O232 -> 123.14 | AK232: 123 | AL232: 89 | AM232: 26.9 | AN232: 55 | AO232: -7.9000000000000001e-002 | AP232: 24 | AQ232: 现代转债
A233: 267 | B233: 113536 | C233: 三星转债 | D233: 603578 | E233: 三星新材 | F233: 家电 | G233: 零部件制 | H233: 115.13 | I233: 8.1000000000000013e-003 | J233: -4.4000000000000003e-003 | K233: 14.49 | L233: 6.3e-003 | M233: 114.3 | N233: 13.76 | O233: 9.3000000000000013e-002 | P233: 105.31 | Q233: 转股中 | R233: 3.95年 | S233: 1.95年 | T233: 1.49 | U233: 2.5 | V233: 1.4999999999999999e-002 | W233: 8.0000000000000002e-002 | X233: 8.4000000000000005e-002 | Y233: 19 | Z233: 1.78 | AA233: -1.9e-003 | AB233: -8.3000000000000001e-003 | AC233: -5.2400000000000002e-002 | AD233: -5.4800000000000001e-002 | AE233: 94.11 | AF233: 97.11 | AG233: 0.59 | AH233: AA | AI233: 4.2900000000000001e-002 | AJ233: =H233+100*O233 -> 124.42999999999999 | AK233: 125 | AL233: 116 | AM233: 27.8 | AN233: 68 | AO233: -0.14899999999999999 | AP233: 35 | AQ233: 三星转债
A234: 91 | B234: 113607 | C234: 伟20转债! | D234: 603568 | E234: 伟明环保 | F234: 城市公用 | G234: 三废处理 | H234: 116.32 | I234: -1.8e-003 | J234: 2.8999999999999998e-003 | K234: 21.94 | L234: 1.8e-003 | M234: 115.1 | N234: 22.01 | O234: 0.16699999999999998 | P234: 99.68 | Q234: 转股中 | R234: 5.37年 | S234: 3.38年 | T234: 12 | U234: 0.7 | V234: 0. | W234: 4.4000000000000004e-002 | X234: 4.2999999999999997e-002 | Y234: 276 | Z234: 4.93 | AA234: -2.e-003 | AB234: -6.9999999999999993e-003 | AC234: -3.2400000000000005e-002 | AD234: -3.4300000000000004e-002 | AE234: 89.04 | AF234: 91.68 | AG234: 0.6 | AH234: AA | AI234: 4.41e-002 | AJ234: =H234+100*O234 -> 133.01999999999998 | AK234: 133 | AL234: 202 | AM234: 41.3 | AN234: 207 | AO234: -4.5999999999999999e-002 | AP234: 5 | AQ234: 伟20转债!
A235: 19 | B235: 110079 | C235: 杭银转债 | D235: 600926 | E235: 杭州银行 | F235: 金融 | G235: 银行行业 | H235: 113.7 | I235: -1.1000000000000001e-003 | J235: -2.3e-003 | K235: 14.55 | L235: -7.4999999999999997e-003 | M235: 112.4 | N235: 17.06 | O235: 0.33299999999999996 | P235: 85.29 | Q235: 3月22天 | R235: 5.78年 | S235: 3.78年 | T235: 150 | U235: 138 | V235: 8.0000000000000002e-003 | W235: 0.17399999999999999 | X235: 0.14800000000000002 | Y235: 863 | Z235: 1.31 | AA235: -2.e-003 | AB235: -5.8999999999999999e-003 | AC235: -2.5099999999999997e-002 | AD235: -2.6499999999999999e-002 | AE235: 88.54 | AF235: 90.36 | AG235: 0.46 | AH235: AAA | AI235: 3.9100000000000003e-002 | AJ235: =H235+100*O235 -> 147. | AK235: 142.1 | AL235: 272 | AM235: 51.8 | AN235: 268 | AO235: -9.6999999999999989e-002 | AP235: 11 | AQ235: 杭银转债
A236: 80 | B236: 110077 | C236: 洪城转债 | D236: 600461 | E236: 洪城环境 | F236: 城市公用 | G236: 城市公用 | H236: 115.24 | I236: 3.0000000000000001e-003 | J236: -3.0000000000000001e-003 | K236: 7.44 | L236: 0. | M236: 113.5 | N236: 7.13 | O236: 0.10400000000000001 | P236: 104.35 | Q236: 转股中 | R236: 5.42年 | S236: 3.43年 | T236: 18 | U236: 3.6 | V236: 2.e-003 | W236: 0.255 | X236: 0.26600000000000001 | Y236: 71 | Z236: 1.31 | AA236: -2.8000000000000004e-003 | AB236: -7.3000000000000001e-003 | AC236: -3.2899999999999999e-002 | AD236: -3.4099999999999998e-002 | AE236: 88.56 | AF236: 91.48 | AG236: 0.64 | AH236: AA+ | AI236: 4.1100000000000005e-002 | AJ236: =H236+100*O236 -> 125.64 | AK236: 126.1 | AL236: 128 | AM236: 34.7 | AN236: 142 | AO236: -6.0000000000000001e-003 | AP236: 6 | AQ236: 洪城转债
A237: 230 | B237: 110063 | C237: 鹰19转债 | D237: 600567 | E237: 山鹰国际 | F237: 造纸包装 | G237: 包装用纸 | H237: 117.42 | I237: -4.1999999999999997e-003 | J237: 7.7000000000000002e-003 | K237: 3.46 | L237: 5.7999999999999996e-003 | M237: 115.9 | N237: 3.3 | O237: 0.12 | P237: 104.85 | Q237: 转股中 | R237: 4.49年 | S237: 2.49年 | T237: 18.5 | U237: 17 | V237: 8.0000000000000002e-003 | W237: 0.11599999999999999 | X237: 0.121 | Y237: 160 | Z237: 1.03 | AA237: -3.0000000000000001e-003 | AB237: -9.1999999999999998e-003 | AC237: -4.7699999999999992e-002 | AD237: -4.99e-002 | AE237: 93.14 | AF237: 97.57 | AG237: 0.59 | AH237: AA+ | AI237: 3.9900000000000005e-002 | AJ237: =H237+100*O237 -> 129.42000000000002 | AK237: 130 | AL237: 169 | AM237: 32.4 | AN237: 119 | AO237: -5.9999999999999998e-002 | AP237: 35 | AQ237: 鹰19转债
A238: 185 | B238: 123048 | C238: 应急转债! | D238: 300527 | E238: 中船应急 | F238: 机械装备 | G238: 专用设备 | H238: 114.53 | I238: 7.4999999999999997e-003 | J238: -6.8999999999999999e-003 | K238: 9.4 | L238: 1.1000000000000001e-003 | M238: 112.8 | N238: 8.9 | O238: 8.4000000000000005e-002 | P238: 105.62 | Q238: 转股中 | R238: 4.81年 | S238: 2.81年 | T238: 3.8 | U238: 23 | V238: 5.2000000000000005e-002 | W238: 4.2000000000000003e-002 | X238: 4.4000000000000004e-002 | Y238: 91 | Z238: 3.4 | AA238: -3.2000000000000002e-003 | AB238: -8.0000000000000002e-003 | AC238: -3.4300000000000004e-002 | AD238: -3.6299999999999999e-002 | AE238: 92.02 | AF238: 93.78 | AG238: 0.63 | AH238: AA+ | AI238: 3.9900000000000005e-002 | AJ238: =H238+100*O238 -> 122.93000000000001 | AK238: 123.4 | AL238: 96 | AM238: 29.7 | AN238: 87 | AO238: 3.6000000000000004e-002 | AP238: 17 | AQ238: 应急转债!
A239: 352 | B239: 113502 | C239: 嘉澳转债! | D239: 603822 | E239: 嘉澳环保 | F239: 化工 | G239: 化工 | H239: 112.22 | I239: 1.29e-002 | J239: -1.29e-002 | K239: 27.11 | L239: 2.5999999999999999e-003 | M239: 111.3 | N239: 44.79 | O239: 0.85400000000000009 | P239: 60.53 | Q239: 转股中 | R239: 2.40年 | S239: 0.40年 | T239: 1.85 | U239: 23 | V239: 0.111 | W239: 9.3000000000000013e-002 | X239: 5.5999999999999994e-002 | Y239: 20 | Z239: 2.48 | AA239: -3.4999999999999996e-003 | AB239: -1.21e-002 | AC239: -0.17399999999999999 | AD239: -0.17999999999999999 | AE239: 98.4 | AF239: 96.53 | AG239: 0.01 | AH239: AA- | AI239: 6.2400000000000004e-002 | AJ239: =H239+100*O239 -> 197.62 | AK239: 163.9 | AL239: 325 | AM239: 65.5 | AN239: 313 | AO239: 7.9000000000000001e-002 | AP239: 37 | AQ239: 嘉澳转债!
A240: 20 | B240: 113622 | C240: 杭叉转债! | D240: 603298 | E240: 杭叉集团 | F240: 机械装备 | G240: 通用设备 | H240: 115.21 | I240: -1.9e-003 | J240: 1.1299999999999999e-002 | K240: 18.42 | L240: 2.2799999999999997e-002 | M240: 112.5 | N240: 23.08 | O240: 0.44400000000000001 | P240: 79.81 | Q240: 3月22天 | R240: 5.76年 | S240: 3.77年 | T240: 11.5 | U240: 1.6 | V240: 1.e-003 | W240: 7.2000000000000008e-002 | X240: 5.7999999999999996e-002 | Y240: 160 | Z240: 3.11 | AA240: -4.1999999999999997e-003 | AB240: -8.1000000000000013e-003 | AC240: -2.8199999999999999e-002 | AD240: -2.9600000000000001e-002 | AE240: 87.99 | AF240: 89.49 | AG240: 0.41 | AH240: AA+ | AI240: 4.1100000000000005e-002 | AJ240: =H240+100*O240 -> 159.60999999999999 | AK240: 150.6 | AL240: 300 | AM240: 61.1 | AN240: 302 | AO240: -4.4000000000000004e-002 | AP240: 4 | AQ240: 杭叉转债!
A241: 251 | B241: 128075 | C241: 远东转债! | D241: 2406. | E241: 远东传动 | F241: 汽车 | G241: 零部件制 | H241: 116.987 | I241: -4.6999999999999993e-003 | J241: 1.4000000000000002e-003 | K241: 6.4 | L241: -4.6999999999999993e-003 | M241: 114.9 | N241: 5.54 | O241: 1.3000000000000001e-002 | P241: 115.52 | Q241: 转股中 | R241: 4.26年 | S241: 2.27年 | T241: 5.44 | U241: 8.1 | V241: 1.3000000000000001e-002 | W241: 0.13600000000000001 | X241: 0.157 | Y241: 40 | Z241: 1.21 | AA241: -4.3e-003 | AB241: -1.0500000000000001e-002 | AC241: -5.0000000000000003e-002 | AD241: -5.2499999999999998e-002 | AE241: 93.46 | AF241: 96.43 | AG241: 0.7 | AH241: AA | AI241: 4.2900000000000001e-002 | AJ241: =H241+100*O241 -> 118.28699999999999 | AK241: 118.5 | AL241: 45 | AM241: 22 | AN241: 25 | AO241: 2.9999999999999999e-002 | AP241: 14 | AQ241: 远东转债!
A242: 52 | B242: 123091 | C242: 长海转债 | D242: 300196 | E242: 长海股份 | F242: 其他 | G242: 非金属矿 | H242: 118.937 | I242: -5.0000000000000001e-004 | J242: 2.0000000000000001e-004 | K242: 16.03 | L242: -5.9999999999999995e-004 | M242: 116.2 | N242: 16.14 | O242: 0.19800000000000001 | P242: 99.32 | Q242: 11天 | R242: 5.51年 | S242: 3.52年 | T242: 5.5 | U242: 3 | V242: 5.0000000000000001e-003 | W242: 8.4000000000000005e-002 | X242: 8.3000000000000004e-002 | Y242: 66 | Z242: 2.21 | AA242: -4.3e-003 | AB242: -9.3999999999999986e-003 | AC242: -3.6799999999999999e-002 | AD242: -3.8699999999999998e-002 | AE242: 88.6 | AF242: 92.01 | AG242: 0.59 | AH242: AA | AI242: 4.41e-002 | AJ242: =H242+100*O242 -> 138.73699999999999 | AK242: 138.6 | AL242: 249 | AM242: 46.5 | AN242: 248 | AO242: -6.7000000000000004e-002 | AP242: 3 | AQ242: 长海转债
A243: 75 | B243: 123079 | C243: 运达转债 | D243: 300772 | E243: 运达股份 | F243: 能源电力 | G243: 风能 | H243: 117.89 | I243: 2.7000000000000001e-003 | J243: -2.12e-002 | K243: 16.15 | L243: -2.8300000000000002e-002 | M243: 115.1 | N243: 15.12 | O243: 0.10400000000000001 | P243: 106.81 | Q243: 转股中 | R243: 5.45年 | S243: 3.46年 | T243: 5.77 | U243: 7.2 | V243: 1.1000000000000001e-002 | W243: 0.11800000000000001 | X243: 0.126 | Y243: 49 | Z243: 2.81 | AA243: -4.5000000000000005e-003 | AB243: -9.3999999999999986e-003 | AC243: -3.5299999999999998e-002 | AD243: -3.7100000000000001e-002 | AE243: 88.74 | AF243: 91.37 | AG243: 0.65 | AH243: AA | AI243: 4.41e-002 | AJ243: =H243+100*O243 -> 128.28999999999999 | AK243: 129 | AL243: 156 | AM243: 37.6 | AN243: 177 | AO243: -1.7000000000000001e-002 | AP243: 4 | AQ243: 运达转债
A244: 276 | B244: 128064 | C244: 司尔转债! | D244: 2538. | E244: 司尔特 | F244: 化工 | G244: 农化 | H244: 116.411 | I244: -1.8e-003 | J244: -2.9999999999999997e-004 | K244: 6.6 | L244: -3.0000000000000001e-003 | M244: 114.3 | N244: 5.82 | O244: 2.7000000000000003e-002 | P244: 113.4 | Q244: 转股中 | R244: 3.80年 | S244: 1.81年 | T244: 7.92 | U244: 19 | V244: 2.e-002 | W244: 0.16699999999999998 | X244: 0.18899999999999997 | Y244: 47 | Z244: 1.18 | AA244: -4.8999999999999998e-003 | AB244: -1.1599999999999999e-002 | AC244: -6.1500000000000006e-002 | AD244: -6.4000000000000001e-002 | AE244: 94.68 | AF244: 97.71 | AG244: 0.68 | AH244: AA | AI244: 4.2900000000000001e-002 | AJ244: =H244+100*O244 -> 119.111 | AK244: 119.4 | AL244: 60 | AM244: 21.7 | AN244: 23 | AO244: 2.4e-002 | AP244: 45 | AQ244: 司尔转债!
A245: 320 | B245: 110045 | C245: 海澜转债! | D245: 600398 | E245: 海澜之家 | F245: 服装纺织 | G245: 服装行业 | H245: 112.84 | I245: 1.9299999999999998e-002 | J245: -8.9999999999999998e-004 | K245: 7.26 | L245: 3.27e-002 | M245: 111.1 | N245: 7.04 | O245: 9.4e-002 | P245: 103.12 | Q245: 转股中 | R245: 3年24天 | S245: 1年25天 | T245: 29.5 | U245: 30 | V245: 9.0000000000000011e-003 | W245: 9.4e-002 | X245: 9.6999999999999989e-002 | Y245: 314 | Z245: 2.24 | AA245: -5.1000000000000004e-003 | AB245: -1.1699999999999999e-002 | AC245: -7.9000000000000001e-002 | AD245: -8.1900000000000001e-002 | AE245: 97.25 | AF245: 98.74 | AG245: 0.56 | AH245: AA+ | AI245: 3.9900000000000005e-002 | AJ245: =H245+100*O245 -> 122.24000000000001 | AK245: 122.6 | AL245: 83 | AM245: 23.8 | AN245: 28 | AO245: 2.e-003 | AP245: 53 | AQ245: 海澜转债!
A246: 353 | B246: 128018 | C246: 时达转债! | D246: 2527. | E246: 新时达 | F246: 机械装备 | G246: 机器人及 | H246: 110.65 | I246: -4.8999999999999998e-003 | J246: 1.2e-002 | K246: 7.1 | L246: 1.5700000000000002e-002 | M246: 109.3 | N246: 7.42 | O246: 0.156 | P246: 95.69 | Q246: 转股中 | R246: 2.39年 | S246: 0.39年 | T246: 4.04 | U246: 5.2 | V246: 1.2e-002 | W246: 9.1999999999999998e-002 | X246: 8.8000000000000009e-002 | Y246: 44 | Z246: 1.68 | AA246: -5.1999999999999998e-003 | AB246: -1.24e-002 | AC246: -0.154 | AD246: -0.16 | AE246: 99.55 | AF246: 99.4 | AG246: 0.45 | AH246: AA | AI246: 4.1399999999999999e-002 | AJ246: =H246+100*O246 -> 126.25 | AK246: 125.6 | AL246: 123 | AM246: 26.1 | AN246: 51 | AO246: -2.3e-002 | AP246: 35 | AQ246: 时达转债!
A247: 170 | B247: 128109 | C247: 楚江转债 | D247: 2171. | E247: 楚江新材 | F247: 有色金属 | G247: 铜金属 | H247: 118.05 | I247: 9.7999999999999997e-003 | J247: 6.8000000000000005e-003 | K247: 8.67 | L247: 2.8500000000000001e-002 | M247: 114.9 | N247: 8.63 | O247: 0.17499999999999999 | P247: 100.46 | Q247: 转股中 | R247: 4.96年 | S247: 2.96年 | T247: 18.3 | U247: 22 | V247: 1.e-002 | W247: 0.158 | X247: 0.159 | Y247: 116 | Z247: 2.04 | AA247: -5.5000000000000005e-003 | AB247: -1.0800000000000001e-002 | AC247: -4.1799999999999997e-002 | AD247: -4.3700000000000003e-002 | AE247: 90.77 | AF247: 93.65 | AG247: 0.58 | AH247: AA | AI247: 4.2900000000000001e-002 | AJ247: =H247+100*O247 -> 135.55000000000001 | AK247: 135.6 | AL247: 225 | AM247: 42 | AN247: 213 | AO247: 7.2000000000000008e-002 | AP247: 6 | AQ247: 楚江转债
A248: 37 | B248: 123099 | C248: 普利转债 | D248: 300630 | E248: 普利制药 | F248: 医药 | G248: 化学制药 | H248: 127.36 | I248: 6.0000000000000001e-003 | J248: -1.0200000000000001e-002 | K248: 50.61 | L248: -6.0999999999999995e-003 | M248: 123.5 | N248: 46.22 | O248: 0.16300000000000001 | P248: 109.5 | Q248: 2月6天 | R248: 5.64年 | S248: 3.65年 | T248: 8.5 | U248: 7 | V248: 6.0000000000000001e-003 | W248: 3.7999999999999999e-002 | X248: 4.2000000000000003e-002 | Y248: 221 | Z248: 10.13 | AA248: -5.5000000000000005e-003 | AB248: -1.24e-002 | AC248: -5.2600000000000001e-002 | AD248: -5.4299999999999994e-002 | AE248: 81.84 | AF248: 87.1 | AG248: 0.7 | AH248: AA- | AI248: 6.5099999999999991e-002 | AJ248: =H248+100*O248 -> 143.66 | AK248: 145.2 | AL248: 284 | AM248: 58.1 | AN248: 296 | AO248: -2.4e-002 | AP248: 4 | AQ248: 普利转债
A249: 150 | B249: 128119 | C249: 龙大转债! | D249: 2726. | E249: 龙大肉食 | F249: 食品饮料 | G249: 肉制品 | H249: 123.627 | I249: -2.9999999999999997e-004 | J249: -1.6000000000000001e-003 | K249: 11.08 | L249: -2.7000000000000001e-003 | M249: 120.2 | N249: 9.38 | O249: 4.7e-002 | P249: 118.12 | Q249: 转股中 | R249: 5年24天 | S249: 3年25天 | T249: 9.46 | U249: 9.4 | V249: 8.0000000000000002e-003 | W249: 8.5000000000000006e-002 | X249: 0.10099999999999999 | Y249: 111 | Z249: 3.18 | AA249: -5.6000000000000008e-003 | AB249: -1.24e-002 | AC249: -5.3399999999999996e-002 | AD249: -5.5399999999999998e-002 | AE249: 90.32 | AF249: 97.02 | AG249: 0.7 | AH249: AA | AI249: 4.41e-002 | AJ249: =H249+100*O249 -> 128.327 | AK249: 129.1 | AL249: 159 | AM249: 32.1 | AN249: 114 | AO249: -4.7e-002 | AP249: 9 | AQ249: 龙大转债!
A250: 303 | B250: 128051 | C250: 光华转债! | D250: 2741. | E250: 光华科技 | F250: 电子 | G250: 元器件制 | H250: 117.358 | I250: 1.4000000000000002e-003 | J250: 5.6000000000000008e-003 | K250: 14.73 | L250: 9.5999999999999992e-003 | M250: 114.8 | N250: 12.72 | O250: 1.3000000000000001e-002 | P250: 115.8 | Q250: 转股中 | R250: 3.49年 | S250: 1.49年 | T250: 2.27 | U250: 11 | V250: 4.2000000000000003e-002 | W250: 4.0999999999999995e-002 | X250: 4.8000000000000001e-002 | Y250: 55 | Z250: 4.46 | AA250: -6.4000000000000003e-003 | AB250: -1.3899999999999999e-002 | AC250: -7.5600000000000001e-002 | AD250: -7.8899999999999998e-002 | AE250: 93.16 | AF250: 92.94 | AG250: 0.73 | AH250: AA- | AI250: 6.3899999999999998e-002 | AJ250: =H250+100*O250 -> 118.658 | AK250: 118.9 | AL250: 54 | AM250: 25.8 | AN250: 48 | AO250: -3.1e-002 | AP250: 27 | AQ250: 光华转债!
A251: 87 | B251: 128136 | C251: 立讯转债! | D251: 2475. | E251: 立讯精密 | F251: 电子 | G251: 元器件制 | H251: 115.78 | I251: 5.5000000000000005e-003 | J251: -2.7000000000000001e-003 | K251: 39.76 | L251: 1.1200000000000002e-002 | M251: 111.9 | N251: 58.36 | O251: 0.69900000000000007 | P251: 68.13 | Q251: 转股中 | R251: 5.38年 | S251: 3.38年 | T251: 30 | U251: 9 | V251: 3.0000000000000001e-003 | W251: 1.1000000000000001e-002 | X251: 6.9999999999999993e-003 | Y251: 2797. | Z251: 9.68 | AA251: -6.4000000000000003e-003 | AB251: -1.04e-002 | AC251: -3.4099999999999998e-002 | AD251: -3.5400000000000001e-002 | AE251: 88.82 | AF251: 90.34 | AG251: 0.25 | AH251: AA+ | AI251: 4.1100000000000005e-002 | AJ251: =H251+100*O251 -> 185.68000000000001 | AK251: 163.4 | AL251: 324 | AM251: 73.1 | AN251: 327 | AO251: 2.5000000000000001e-002 | AP251: 12 | AQ251: 立讯转债!
A252: 16 | B252: 123110 | C252: 九典转债 | D252: 300705 | E252: 九典制药 | F252: 医药 | G252: 化学制药 | H252: 126.1 | I252: 1.72e-002 | J252: 8.0000000000000004e-004 | K252: 32.41 | L252: 2.2700000000000001e-002 | M252: 121.4 | N252: 26.44 | O252: 2.8999999999999998e-002 | P252: 122.58 | Q252: 3月22天 | R252: 5.78年 | S252: 3.79年 | T252: 2.7 | U252: 49 | V252: 0.14499999999999999 | W252: 3.5000000000000003e-002 | X252: 4.4000000000000004e-002 | Y252: 76 | Z252: 8.62 | AA252: -6.7000000000000002e-003 | AB252: -1.29e-002 | AC252: -4.7100000000000003e-002 | AD252: -4.9000000000000002e-002 | AE252: 78.37 | AF252: 80.16 | AG252: 0.79 | AH252: A+ | AI252: 7.6100000000000001e-002 | AJ252: =H252+100*O252 -> 129. | AK252: 129.6 | AL252: 164 | AM252: 49.5 | AN252: 261 | AO252: 5.0999999999999997e-002 | AP252: 5 | AQ252: 九典转债
A253: 200 | B253: 113572 | C253: 三祥转债! | D253: 603663 | E253: 三祥新材 | F253: 其他 | G253: 其他 | H253: 116.49 | I253: 1.37e-002 | J253: 1.9e-003 | K253: 14.89 | L253: 2.1299999999999999e-002 | M253: 112.8 | N253: 14.09 | O253: 0.10199999999999999 | P253: 105.68 | Q253: 转股中 | R253: 4.73年 | S253: 2.73年 | T253: 1.69 | U253: 4.7 | V253: 2.4e-002 | W253: 5.9000000000000004e-002 | X253: 6.2e-002 | Y253: 29 | Z253: 4.48 | AA253: -6.8999999999999999e-003 | AB253: -1.18e-002 | AC253: -4.0899999999999999e-002 | AD253: -4.2999999999999997e-002 | AE253: 83.93 | AF253: 80.7 | AG253: 0.74 | AH253: A+ | AI253: 7.4900000000000008e-002 | AJ253: =H253+100*O253 -> 126.69 | AK253: 127.3 | AL253: 138 | AM253: 43.4 | AN253: 230 | AO253: 1.1000000000000001e-002 | AP253: 19 | AQ253: 三祥转债!
A254: 36 | B254: 123100 | C254: 朗科转债 | D254: 300543 | E254: 朗科智能 | F254: 电子 | G254: 电子产品 | H254: 122.4 | I254: 7.4999999999999997e-003 | J254: 1.06e-002 | K254: 14.38 | L254: 2.2799999999999997e-002 | M254: 117.5 | N254: 11.61 | O254: -1.2e-002 | P254: 123.86 | Q254: 2月5天 | R254: 5.64年 | S254: 3.65年 | T254: 3.8 | U254: 67 | V254: 0.14499999999999999 | W254: 9.9000000000000005e-002 | X254: 0.122 | Y254: 39 | Z254: 3.17 | AA254: -7.3000000000000001e-003 | AB254: -1.2699999999999999e-002 | AC254: -4.2599999999999999e-002 | AD254: -4.4400000000000002e-002 | AE254: 81.84 | AF254: 82.9 | AG254: 0.79 | AH254: AA- | AI254: 6.5099999999999991e-002 | AJ254: =H254+100*O254 -> 121.2 | AK254: 120.9 | AL254: 72 | AM254: 38 | AN254: 180 | AO254: 5.2999999999999999e-002 | AP254: 8 | AQ254: 朗科转债
A255: 289 | B255: 110053 | C255: 苏银转债! | D255: 600919 | E255: XD江苏银 | F255: 金融 | G255: 银行行业 | H255: 121.6 | I255: -1.6000000000000001e-003 | J255: -2.7000000000000001e-003 | K255: 7.22 | L255: -6.8999999999999999e-003 | M255: 118.3 | N255: 6.37 | O255: 7.2999999999999995e-002 | P255: 113.34 | Q255: 转股中 | R255: 3.73年 | S255: 无权 | T255: 200 | U255: 179 | V255: 6.9999999999999993e-003 | W255: 0.188 | X255: 0.21299999999999999 | Y255: 1066. | Z255: 0.76 | AA255: -7.4999999999999997e-003 | AB255: -1.6e-002 | AC255: 无权 | AD255: 无权 | AE255: 无权 | AF255: 103.37 | AG255: 0.63 | AH255: AAA | AI255: 3.7900000000000003e-002 | AJ255: =H255+100*O255 -> 128.90000000000001 | AK255: 129.9 | AL255: 166 | AM255: 26.5 | AN255: 53 | AO255: -5.7000000000000002e-002 | AP255: 39 | AQ255: 苏银转债!
A256: 173 | B256: 128108 | C256: 蓝帆转债! | D256: 2382. | E256: 蓝帆医疗 | F256: 医药 | G256: 医疗器械 | H256: 117.1 | I256: 1.6399999999999998e-002 | J256: 4.8999999999999998e-003 | K256: 19.76 | L256: 3.0800000000000001e-002 | M256: 112.9 | N256: 17.79 | O256: 5.4000000000000006e-002 | P256: 111.07 | Q256: 转股中 | R256: 4.94年 | S256: 3.94年 | T256: 15.3 | U256: 36 | V256: 2.e-002 | W256: 7.400000000000001e-002 | X256: 8.199999999999999e-002 | Y256: 207 | Z256: 1.66 | AA256: -7.4999999999999997e-003 | AB256: -1.2199999999999999e-002 | AC256: -2.6000000000000002e-002 | AD256: -2.8300000000000002e-002 | AE256: 88.77 | AF256: 92.1 | AG256: 0.69 | AH256: AA | AI256: 4.2900000000000001e-002 | AJ256: =H256+100*O256 -> 122.5 | AK256: 123.1 | AL256: 90 | AM256: 31 | AN256: 105 | AO256: -3.5000000000000003e-002 | AP256: 26 | AQ256: 蓝帆转债!
A257: 55 | B257: 128142 | C257: 新乳转债 | D257: 2946. | E257: 新乳业 | F257: 食品饮料 | G257: 乳制品 | H257: 120 | I257: 2.5000000000000001e-003 | J257: -4.0000000000000002e-004 | K257: 16.15 | L257: 4.4000000000000003e-003 | M257: 115.1 | N257: 18.54 | O257: 0.37799999999999995 | P257: 87.11 | Q257: 6.2天 | R257: 5.50年 | S257: 3.50年 | T257: 7.18 | U257: 1 | V257: 1.e-003 | W257: 5.0999999999999997e-002 | X257: 4.4999999999999998e-002 | Y257: 140 | Z257: 5.39 | AA257: -7.7000000000000002e-003 | AB257: -1.2500000000000001e-002 | AC257: -3.9599999999999996e-002 | AD257: -4.1299999999999996e-002 | AE257: 88.56 | AF257: 91.18 | AG257: 0.47 | AH257: AA | AI257: 4.41e-002 | AJ257: =H257+100*O257 -> 157.80000000000001 | AK257: 152.9 | AL257: 306 | AM257: 61.7 | AN257: 305 | AO257: -7.5999999999999998e-002 | AP257: 4 | AQ257: 新乳转债
A258: 13 | B258: 113623 | C258: 凤21转债 | D258: 603225 | E258: 新凤鸣 | F258: 化工 | G258: 化纤 | H258: 122.52 | I258: -1.23e-002 | J258: -3.3e-003 | K258: 19.38 | L258: -2.12e-002 | M258: 117.1 | N258: 16.47 | O258: 4.0999999999999995e-002 | P258: 117.67 | Q258: 3月28天 | R258: 5.80年 | S258: 3.81年 | T258: 25 | U258: 13 | V258: 4.0000000000000001e-003 | W258: 9.1999999999999998e-002 | X258: 0.10800000000000001 | Y258: 272 | Z258: 2.22 | AA258: -7.9000000000000008e-003 | AB258: -1.3000000000000001e-002 | AC258: -4.1599999999999998e-002 | AD258: -4.3299999999999998e-002 | AE258: 87.4 | AF258: 91.55 | AG258: 0.73 | AH258: AA | AI258: 4.41e-002 | AJ258: =H258+100*O258 -> 126.61999999999999 | AK258: 127.4 | AL258: 139 | AM258: 35.8 | AN258: 160 | AO258: -8.0000000000000002e-003 | AP258: 3 | AQ258: 凤21转债
A259: 115 | B259: 123064 | C259: 万孚转债! | D259: 300482 | E259: 万孚生物 | F259: 医药 | G259: 医疗器械 | H259: 120.042 | I259: -2.3999999999999998e-003 | J259: 1.9e-003 | K259: 68.63 | L259: -8.9999999999999998e-004 | M259: 115.1 | N259: 71.64 | O259: 0.253 | P259: 95.8 | Q259: 转股中 | R259: 5.20年 | S259: 3.21年 | T259: 5.99 | U259: 3.3 | V259: 5.0000000000000001e-003 | W259: 2.e-002 | X259: 1.9e-002 | Y259: 305 | Z259: 8.09 | AA259: -8.199999999999999e-003 | AB259: -1.3300000000000001e-002 | AC259: -4.3099999999999999e-002 | AD259: -4.4999999999999998e-002 | AE259: 89.7 | AF259: 92.36 | AG259: 0.55 | AH259: AA | AI259: 4.41e-002 | AJ259: =H259+100*O259 -> 145.34200000000001 | AK259: 144.3 | AL259: 280 | AM259: 51.9 | AN259: 270 | AO259: -8.900000000000001e-002 | AP259: 11 | AQ259: 万孚转债!
A260: 197 | B260: 128101 | C260: 联创转债! | D260: 2036. | E260: 联创电子 | F260: 电子 | G260: 液晶显示 | H260: 119.51 | I260: 2.7400000000000001e-002 | J260: -7.3000000000000001e-003 | K260: 11.94 | L260: 4.6500000000000007e-002 | M260: 114.8 | N260: 13.72 | O260: 0.373 | P260: 87.03 | Q260: 转股中 | R260: 4.74年 | S260: 2.74年 | T260: 3 | U260: 43 | V260: 0.121 | W260: 2.4e-002 | X260: 2.1000000000000001e-002 | Y260: 127 | Z260: 3.44 | AA260: -8.6e-003 | AB260: -1.41e-002 | AC260: -4.9200000000000001e-002 | AD260: -5.1200000000000002e-002 | AE260: 91.51 | AF260: 94.42 | AG260: 0.43 | AH260: AA | AI260: 4.2900000000000001e-002 | AJ260: =H260+100*O260 -> 156.81 | AK260: 152 | AL260: 303 | AM260: 57.6 | AN260: 295 | AO260: -9.0000000000000011e-003 | AP260: 16 | AQ260: 联创转债!
A261: 77 | B261: 123078 | C261: 飞凯转债! | D261: 300398 | E261: 飞凯材料 | F261: 化工 | G261: 化工 | H261: 120.68 | I261: 2.18e-002 | J261: -1.8500000000000003e-002 | K261: 17.66 | L261: 4.5999999999999999e-003 | M261: 115.2 | N261: 15.56 | O261: 6.3e-002 | P261: 113.5 | Q261: 转股中 | R261: 5.44年 | S261: 3.44年 | T261: 8.2 | U261: 73 | V261: 7.400000000000001e-002 | W261: 8.9999999999999997e-002 | X261: 0.10199999999999999 | Y261: 91 | Z261: 3.4 | AA261: -8.6999999999999994e-003 | AB261: -1.3600000000000001e-002 | AC261: -4.1500000000000002e-002 | AD261: -4.3299999999999998e-002 | AE261: 88.87 | AF261: 91.51 | AG261: 0.71 | AH261: AA | AI261: 4.41e-002 | AJ261: =H261+100*O261 -> 126.98 | AK261: 127.9 | AL261: 144 | AM261: 36.4 | AN261: 168 | AO261: 0.10300000000000001 | AP261: 8 | AQ261: 飞凯转债!
A262: 180 | B262: 113577 | C262: 春秋转债! | D262: 603890 | E262: 春秋电子 | F262: 电子 | G262: 电子产品 | H262: 122.96 | I262: 2.4e-002 | J262: -1.34e-002 | K262: 12.77 | L262: 1.43e-002 | M262: 117.7 | N262: 10.86 | O262: 4.5999999999999999e-002 | P262: 117.59 | Q262: 转股中 | R262: 4.82年 | S262: 2.82年 | T262: 1.78 | U262: 4.8 | V262: 2.2000000000000002e-002 | W262: 3.6000000000000004e-002 | X262: 4.2000000000000003e-002 | Y262: 50 | Z262: 2.64 | AA262: -9.1999999999999998e-003 | AB262: -1.55e-002 | AC262: -5.6100000000000004e-002 | AD262: -5.8200000000000002e-002 | AE262: 86.26 | AF262: 87.87 | AG262: 0.74 | AH262: AA- | AI262: 6.3899999999999998e-002 | AJ262: =H262+100*O262 -> 127.55999999999999 | AK262: 128.3 | AL262: 149 | AM262: 40.5 | AN262: 200 | AO262: 2.e-002 | AP262: 14 | AQ262: 春秋转债!
A263: 175 | B263: 113579 | C263: 健友转债! | D263: 603707 | E263: 健友股份 | F263: 医药 | G263: 原料药 | H263: 119.01 | I263: 9.300000000000001e-003 | J263: -9.300000000000001e-003 | K263: 40.78 | L263: 0. | M263: 113.9 | N263: 42.05 | O263: 0.22699999999999998 | P263: 96.98 | Q263: 转股中 | R263: 4.84年 | S263: 2.85年 | T263: 5.03 | U263: 8.3 | V263: 1.3999999999999999e-002 | W263: 1.3000000000000001e-002 | X263: 1.3000000000000001e-002 | Y263: 381 | Z263: 9.9 | AA263: -9.1999999999999998e-003 | AB263: -1.43e-002 | AC263: -4.5899999999999996e-002 | AD263: -4.7899999999999998e-002 | AE263: 91.2 | AF263: 93.29 | AG263: 0.56 | AH263: AA | AI263: 4.2900000000000001e-002 | AJ263: =H263+100*O263 -> 141.71000000000001 | AK263: 141 | AL263: 265 | AM263: 47.8 | AN263: 253 | AO263: -4.2999999999999997e-002 | AP263: 9 | AQ263: 健友转债!
A264: 304 | B264: 128050 | C264: 钧达转债!! | D264: 2865. | E264: 钧达股份 | F264: 汽车 | G264: 零部件制 | H264: 126.85 | I264: 1.e-002 | J264: -1.2999999999999999e-003 | K264: 18.56 | L264: 8.6999999999999994e-003 | M264: 122.7 | N264: 14.8 | O264: 1.2e-002 | P264: 125.41 | Q264: 转股中 | R264: 3.48年 | S264: 1.48年 | T264: 1.41 | U264: 12 | V264: 7.0000000000000007e-002 | W264: 5.7000000000000002e-002 | X264: 7.2000000000000008e-002 | Y264: 25 | Z264: 2.3 | AA264: -9.7000000000000003e-003 | AB264: -2.0499999999999997e-002 | AC264: -0.105 | AD264: -0.10800000000000001 | AE264: 93.14 | AF264: 99.37 | AG264: 1 | AH264: AA- | AI264: 6.3899999999999998e-002 | AJ264: =H264+100*O264 -> 128.04999999999998 | AK264: 128.3 | AL264: 148 | AM264: 28.9 | AN264: 82 | AO264: 1.e-002 | AP264: 51 | AQ264: 钧达转债!!
A265: 334 | B265: 128035 | C265: 大族转债! | D265: 2008. | E265: 大族激光 | F265: 机械装备 | G265: 专用设备 | H265: 110.353 | I265: 6.4000000000000003e-003 | J265: -3.4999999999999996e-003 | K265: 38.6 | L265: 3.3500000000000002e-002 | M265: 107.4 | N265: 51.9 | O265: 0.48399999999999999 | P265: 74.37 | Q265: 转股中 | R265: 2.64年 | S265: 0.64年 | T265: 23 | U265: 14 | V265: 6.0000000000000001e-003 | W265: 5.5999999999999994e-002 | X265: 4.2000000000000003e-002 | Y265: 412 | Z265: 4.28 | AA265: -1.03e-002 | AB265: -1.5600000000000001e-002 | AC265: -7.3300000000000004e-002 | AD265: -8.1699999999999995e-002 | AE265: 100.7 | AF265: 97.35 | AG265: 0.09 | AH265: AA+ | AI265: 3.8399999999999997e-002 | AJ265: =H265+100*O265 -> 158.75299999999999 | AK265: 146.3 | AL265: 289 | AM265: 45.6 | AN265: 243 | AO265: 3.7999999999999999e-002 | AP265: 19 | AQ265: 大族转债!
A266: 35 | B266: 118000 | C266: 嘉元转债 | D266: 688388 | E266: 嘉元科技 | F266: 电子 | G266: 电子产品 | H266: 128.39 | I266: 3.2300000000000002e-002 | J266: 2.6800000000000001e-002 | K266: 88 | L266: 8.3199999999999996e-002 | M266: 121 | N266: 78.74 | O266: 0.14899999999999999 | P266: 111.76 | Q266: 2月15天 | R266: 5.68年 | S266: 3.69年 | T266: 12.4 | U266: 40 | V266: 2.5000000000000001e-002 | W266: 6.0999999999999999e-002 | X266: 6.8000000000000005e-002 | Y266: 203 | Z266: 7.47 | AA266: -1.06e-002 | AB266: -1.6799999999999999e-002 | AC266: -5.3899999999999997e-002 | AD266: -5.5599999999999997e-002 | AE266: 81.71 | AF266: 85.17 | AG266: 0.71 | AH266: AA- | AI266: 6.5099999999999991e-002 | AJ266: =H266+100*O266 -> 143.28999999999999 | AK266: 145 | AL266: 281 | AM266: 59.9 | AN266: 300 | AO266: 8.5000000000000006e-002 | AP266: 4 | AQ266: 嘉元转债
A267: 66 | B267: 123083 | C267: 朗新转债 | D267: 300682 | E267: 朗新科技 | F267: 计算机及 | G267: 软件开发 | H267: 122 | I267: -6.7000000000000002e-003 | J267: -8.6999999999999994e-003 | K267: 17.56 | L267: -2.1700000000000001e-002 | M267: 115.1 | N267: 15.45 | O267: 7.2999999999999995e-002 | P267: 113.66 | Q267: 转股中 | R267: 5.47年 | S267: 3.48年 | T267: 8 | U267: 13 | V267: 1.3000000000000001e-002 | W267: 4.4999999999999998e-002 | X267: 5.0999999999999997e-002 | Y267: 179 | Z267: 3.41 | AA267: -1.0800000000000001e-002 | AB267: -1.5600000000000001e-002 | AC267: -4.4199999999999996e-002 | AD267: -4.5999999999999999e-002 | AE267: 88.65 | AF267: 91.28 | AG267: 0.71 | AH267: AA | AI267: 4.41e-002 | AJ267: =H267+100*O267 -> 129.30000000000001 | AK267: 130.3 | AL267: 176 | AM267: 39.1 | AN267: 186 | AO267: 5.0000000000000001e-003 | AP267: 5 | AQ267: 朗新转债
A268: 291 | B268: 128057 | C268: 博彦转债 | D268: 2649. | E268: 博彦科技 | F268: 计算机及 | G268: 软件开发 | H268: 121.38 | I268: 6.5000000000000006e-003 | J268: -2.e-003 | K268: 10.29 | L268: 5.8999999999999999e-003 | M268: 116.3 | N268: 8.5 | O268: 3.0000000000000001e-003 | P268: 121.06 | Q268: 转股中 | R268: 3.71年 | S268: 1.71年 | T268: 5.07 | U268: 10 | V268: 1.6e-002 | W268: 9.3000000000000013e-002 | X268: 0.11199999999999999 | Y268: 55 | Z268: 1.81 | AA268: -1.1699999999999999e-002 | AB268: -1.9299999999999998e-002 | AC268: -8.5199999999999998e-002 | AD268: -8.7799999999999989e-002 | AE268: 91.59 | AF268: 92.82 | AG268: 0.76 | AH268: AA- | AI268: 6.3899999999999998e-002 | AJ268: =H268+100*O268 -> 121.67999999999999 | AK268: 121.7 | AL268: 77 | AM268: 28.9 | AN268: 79 | AO268: 4.9000000000000002e-002 | AP268: 25 | AQ268: 博彦转债
A269: 290 | B269: 127011 | C269: 中鼎转2! | D269: 887. | E269: 中鼎股份 | F269: 汽车 | G269: 零部件制 | H269: 119.7 | I269: 2.18e-002 | J269: 3.0999999999999999e-003 | K269: 11.81 | L269: 4.4199999999999996e-002 | M269: 114.5 | N269: 11.39 | O269: 0.154 | P269: 103.69 | Q269: 转股中 | R269: 3.72年 | S269: 1.72年 | T269: 12 | U269: 16 | V269: 1.1000000000000001e-002 | W269: 8.3000000000000004e-002 | X269: 8.5999999999999993e-002 | Y269: 144 | Z269: 1.62 | AA269: -1.21e-002 | AB269: -1.89e-002 | AC269: -7.7800000000000008e-002 | AD269: -8.0500000000000002e-002 | AE269: 95.57 | AF269: 99.27 | AG269: 0.56 | AH269: AA+ | AI269: 3.9900000000000005e-002 | AJ269: =H269+100*O269 -> 135.09999999999999 | AK269: 135.7 | AL269: 227 | AM269: 36.4 | AN269: 169 | AO269: 3.2000000000000001e-002 | AP269: 21 | AQ269: 中鼎转2!
A270: 213 | B270: 128096 | C270: 奥瑞转债!! | D270: 2701. | E270: 奥瑞金 | F270: 造纸包装 | G270: 包装材料 | H270: 122.32 | I270: 1.5900000000000001e-002 | J270: 9.1999999999999998e-003 | K270: 5.16 | L270: 3.61e-002 | M270: 115.5 | N270: 4.5 | O270: 6.7000000000000004e-002 | P270: 114.67 | Q270: 转股中 | R270: 4.65年 | S270: 2.65年 | T270: 6.79 | U270: 8.6 | V270: 1.e-002 | W270: 5.4000000000000006e-002 | X270: 6.2e-002 | Y270: 125 | Z270: 1.86 | AA270: -1.2500000000000001e-002 | AB270: -1.83e-002 | AC270: -5.7000000000000002e-002 | AD270: -5.9400000000000001e-002 | AE270: 93.11 | AF270: 96.68 | AG270: 0.7 | AH270: AA+ | AI270: 3.9900000000000005e-002 | AJ270: =H270+100*O270 -> 129.01999999999998 | AK270: 130 | AL270: 168 | AM270: 33.3 | AN270: 130 | AO270: -1.4999999999999999e-002 | AP270: 18 | AQ270: 奥瑞转债!!
A271: 110 | B271: 123067 | C271: 斯莱转债 | D271: 300382 | E271: 斯莱克 | F271: 机械装备 | G271: 专用设备 | H271: 129.27 | I271: 2.7200000000000002e-002 | J271: -1.3100000000000001e-002 | K271: 11.74 | L271: 1.8200000000000001e-002 | M271: 121.2 | N271: 9.38 | O271: 3.3000000000000002e-002 | P271: 125.16 | Q271: 转股中 | R271: 5.25年 | S271: 3.25年 | T271: 3.88 | U271: 66 | V271: 0.13300000000000001 | W271: 5.9000000000000004e-002 | X271: 7.2999999999999995e-002 | Y271: 66 | Z271: 6.38 | AA271: -1.2500000000000001e-002 | AB271: -1.9199999999999998e-002 | AC271: -6.2e-002 | AD271: -6.4100000000000004e-002 | AE271: 84.17 | AF271: 87.72 | AG271: 0.77 | AH271: AA- | AI271: 6.5099999999999991e-002 | AJ271: =H271+100*O271 -> 132.57000000000002 | AK271: 133.4 | AL271: 209 | AM271: 45.7 | AN271: 244 | AO271: 6.3e-002 | AP271: 13 | AQ271: 斯莱转债
A272: 100 | B272: 123070 | C272: 鹏辉转债 | D272: 300438 | E272: 鹏辉能源 | F272: 汽车 | G272: 零部件制 | H272: 123 | I272: 2.5899999999999999e-002 | J272: -1.2999999999999999e-003 | K272: 22.24 | L272: 3.5400000000000001e-002 | M272: 115.1 | N272: 20.06 | O272: 0.109 | P272: 110.87 | Q272: 转股中 | R272: 5.34年 | S272: 3.34年 | T272: 8.9 | U272: 41 | V272: 3.7000000000000005e-002 | W272: 9.5000000000000001e-002 | X272: 0.106 | Y272: 93 | Z272: 3.95 | AA272: -1.26e-002 | AB272: -1.7500000000000002e-002 | AC272: -4.82e-002 | AD272: -5.0000000000000003e-002 | AE272: 89.18 | AF272: 91.82 | AG272: 0.69 | AH272: AA | AI272: 4.41e-002 | AJ272: =H272+100*O272 -> 133.90000000000001 | AK272: 135.1 | AL272: 220 | AM272: 43.3 | AN272: 229 | AO272: 5.2000000000000005e-002 | AP272: 5 | AQ272: 鹏辉转债
A273: 366 | B273: 110034 | C273: 九州转债! | D273: 600998 | E273: 九州通 | F273: 医药 | G273: 医药商业 | H273: 108.89 | I273: -3.0999999999999999e-003 | J273: 2.5000000000000001e-003 | K273: 15.32 | L273: -1.67e-002 | M273: 108 | N273: 17.83 | O273: 0.26700000000000002 | P273: 85.92 | Q273: 转股中 | R273: 0.58年 | S273: 回售内 | T273: 15 | U273: 5.4 | V273: 3.0000000000000001e-003 | W273: 5.2000000000000005e-002 | X273: 4.4999999999999998e-002 | Y273: 287 | Z273: 1.42 | AA273: -1.41e-002 | AB273: -3.9199999999999999e-002 | AC273: 回售内 | AD273: 回售内 | AE273: 103 | AF273: 105.86 | AG273: 0.04 | AH273: AA+ | AI273: 3.5299999999999998e-002 | AJ273: =H273+100*O273 -> 135.59 | AK273: 131.9 | AL273: 190 | AM273: 26 | AN273: 50 | AO273: -8.8000000000000009e-002 | AP273: 24 | AQ273: 九州转债!
A274: 86 | B274: 128137 | C274: 洁美转债 | D274: 2859. | E274: 洁美科技 | F274: 电子 | G274: 元器件制 | H274: 127.29 | I274: 7.4000000000000003e-003 | J274: 4.7999999999999996e-003 | K274: 31.2 | L274: 1.6299999999999999e-002 | M274: 117.3 | N274: 27.63 | O274: 0.127 | P274: 112.92 | Q274: 转股中 | R274: 5.38年 | S274: 3.38年 | T274: 6 | U274: 9.4 | V274: 1.2e-002 | W274: 4.7e-002 | X274: 5.2999999999999999e-002 | Y274: 128 | Z274: 6.95 | AA274: -1.54e-002 | AB274: -2.0899999999999998e-002 | AC274: -5.6399999999999999e-002 | AD274: -5.8200000000000002e-002 | AE274: 83.2 | AF274: 84.15 | AG274: 0.75 | AH274: AA- | AI274: 6.5099999999999991e-002 | AJ274: =H274+100*O274 -> 139.99000000000001 | AK274: 141.7 | AL274: 270 | AM274: 57.5 | AN274: 294 | AO274: 9.5000000000000001e-002 | AP274: 4 | AQ274: 洁美转债
A275: 166 | B275: 113585 | C275: 寿仙转债! | D275: 603896 | E275: 寿仙谷 | F275: 医药 | G275: 中药 | H275: 126.71 | I275: -7.4000000000000003e-003 | J275: -1.9e-003 | K275: 36.21 | L275: -1.15e-002 | M275: 117.3 | N275: 28.68 | O275: 4.0000000000000001e-003 | P275: 126.26 | Q275: 转股中 | R275: 4.97年 | S275: 2.98年 | T275: 1.48 | U275: 11 | V275: 5.7999999999999996e-002 | W275: 2.7000000000000003e-002 | X275: 3.4000000000000002e-002 | Y275: 54 | Z275: 3.92 | AA275: -1.5700000000000002e-002 | AB275: -2.1600000000000001e-002 | AC275: -6.25e-002 | AD275: -6.4500000000000002e-002 | AE275: 85.46 | AF275: 86.74 | AG275: 0.8 | AH275: AA- | AI275: 6.3899999999999998e-002 | AJ275: =H275+100*O275 -> 127.11 | AK275: 127.2 | AL275: 137 | AM275: 40.4 | AN275: 199 | AO275: -3.6000000000000004e-002 | AP275: 11 | AQ275: 寿仙转债!
A276: 260 | B276: 113541 | C276: 荣晟转债! | D276: 603165 | E276: 荣晟环保 | F276: 造纸包装 | G276: 包装用纸 | H276: 122.75 | I276: -5.1999999999999998e-003 | J276: 4.0000000000000001e-003 | K276: 13.23 | L276: -1.5e-003 | M276: 115 | N276: 10.84 | O276: 6.0000000000000001e-003 | P276: 122.05 | Q276: 转股中 | R276: 4年34天 | S276: 2年35天 | T276: 1.63 | U276: 9.9 | V276: 5.0000000000000003e-002 | W276: 4.7e-002 | X276: 5.7000000000000002e-002 | Y276: 35 | Z276: 1.98 | AA276: -1.61e-002 | AB276: -2.2499999999999999e-002 | AC276: -7.3499999999999996e-002 | AD276: -7.6100000000000001e-002 | AE276: 90.13 | AF276: 89.78 | AG276: 0.76 | AH276: AA- | AI276: 6.3899999999999998e-002 | AJ276: =H276+100*O276 -> 123.34999999999999 | AK276: 123.5 | AL276: 98 | AM276: 33.3 | AN276: 132 | AO276: -6.3e-002 | AP276: 43 | AQ276: 荣晟转债!
A277: 335 | B277: 110043 | C277: 无锡转债! | D277: 600908 | E277: 无锡银行 | F277: 金融 | G277: 银行行业 | H277: 113.23 | I277: 3.7000000000000002e-003 | J277: -4.5999999999999999e-003 | K277: 5.75 | L277: -1.7000000000000001e-003 | M277: 108.3 | N277: 5.79 | O277: 0.14000000000000001 | P277: 99.31 | Q277: 转股中 | R277: 2.62年 | S277: 无权 | T277: 29.2 | U277: 38 | V277: 1.1000000000000001e-002 | W277: 0.27300000000000002 | X277: 0.27100000000000002 | Y277: 107 | Z277: 0.87 | AA277: -1.7000000000000001e-002 | AB277: -2.2799999999999997e-002 | AC277: 无权 | AD277: 无权 | AE277: 无权 | AF277: 98.24 | AG277: 0.51 | AH277: AA+ | AI277: 3.8399999999999997e-002 | AJ277: =H277+100*O277 -> 127.23 | AK277: 127.2 | AL277: 136 | AM277: 28.9 | AN277: 80 | AO277: -4.4000000000000004e-002 | AP277: 24 | AQ277: 无锡转债!
A278: 57 | B278: 113614 | C278: 健20转债! | D278: 603707 | E278: 健友股份 | F278: 医药 | G278: 原料药 | H278: 125.37 | I278: 6.9999999999999993e-003 | J278: -6.9999999999999993e-003 | K278: 40.78 | L278: 0. | M278: 114.2 | N278: 38.04 | O278: 0.16899999999999998 | P278: 107.2 | Q278: 5.2天 | R278: 5.50年 | S278: 3.50年 | T278: 7.8 | U278: 2.5 | V278: 3.0000000000000001e-003 | W278: 2.e-002 | X278: 2.2000000000000002e-002 | Y278: 381 | Z278: 9.9 | AA278: -1.7100000000000001e-002 | AB278: -2.1600000000000001e-002 | AC278: -5.0900000000000001e-002 | AD278: -5.2600000000000001e-002 | AE278: 88.66 | AF278: 90.5 | AG278: 0.68 | AH278: AA | AI278: 4.41e-002 | AJ278: =H278+100*O278 -> 142.27000000000001 | AK278: 143.5 | AL278: 277 | AM278: 53 | AN278: 276 | AO278: -4.2999999999999997e-002 | AP278: 4 | AQ278: 健20转债!
A279: 337 | B279: 123007 | C279: 道氏转债! | D279: 300409 | E279: 道氏技术 | F279: 建筑 | G279: 建筑行业 | H279: 115.17 | I279: 2.1000000000000001e-002 | J279: 1.8e-003 | K279: 15.54 | L279: 3.4599999999999999e-002 | M279: 110.3 | N279: 14.5 | O279: 7.4999999999999997e-002 | P279: 107.17 | Q279: 转股中 | R279: 2.53年 | S279: 0.53年 | T279: 3.04 | U279: 24 | V279: 7.0999999999999994e-002 | W279: 3.5000000000000003e-002 | X279: 3.7999999999999999e-002 | Y279: 86 | Z279: 2.35 | AA279: -1.72e-002 | AB279: -2.46e-002 | AC279: -0.17399999999999999 | AD279: -0.17800000000000002 | AE279: 97.62 | AF279: 94.91 | AG279: 0.66 | AH279: AA- | AI279: 6.2400000000000004e-002 | AJ279: =H279+100*O279 -> 122.67 | AK279: 123.2 | AL279: 91 | AM279: 25.5 | AN279: 45 | AO279: 8.8000000000000009e-002 | AP279: 23 | AQ279: 道氏转债!
A280: 102 | B280: 127022 | C280: 恒逸转债 | D280: 703. | E280: 恒逸石化 | F280: 化工 | G280: 化工 | H280: 119.341 | I280: -1.1299999999999999e-002 | J280: 1.8e-003 | K280: 12.02 | L280: -1.3899999999999999e-002 | M280: 108.9 | N280: 11.5 | O280: 0.14199999999999999 | P280: 104.52 | Q280: 转股中 | R280: 5.33年 | S280: 3.33年 | T280: 20 | U280: 75 | V280: 3.2000000000000001e-002 | W280: 4.4999999999999998e-002 | X280: 4.7e-002 | Y280: 443 | Z280: 1.78 | AA280: -1.7299999999999999e-002 | AB280: -2.0299999999999999e-002 | AC280: -4.24e-002 | AD280: -4.3799999999999999e-002 | AE280: 89.25 | AF280: 88.15 | AG280: 0.68 | AH280: AA+ | AI280: 4.1100000000000005e-002 | AJ280: =H280+100*O280 -> 133.541 | AK280: 134.2 | AL280: 216 | AM280: 44.9 | AN280: 240 | AO280: -5.4000000000000006e-002 | AP280: 6 | AQ280: 恒逸转债
A281: 46 | B281: 113618 | C281: 美诺转债! | D281: 603538 | E281: 美诺华 | F281: 医药 | G281: 原料药 | H281: 126.94 | I281: 3.0800000000000001e-002 | J281: 2.9900000000000003e-002 | K281: 45.38 | L281: 7.6399999999999996e-002 | M281: 115.3 | N281: 37.47 | O281: 4.8000000000000001e-002 | P281: 121.11 | Q281: 32天 | R281: 5.57年 | S281: 3.58年 | T281: 5.2 | U281: 332 | V281: 0.503 | W281: 7.6999999999999999e-002 | X281: 9.3000000000000013e-002 | Y281: 68 | Z281: 4.28 | AA281: -1.7399999999999999e-002 | AB281: -2.2200000000000001e-002 | AC281: -5.28e-002 | AD281: -5.4600000000000003e-002 | AE281: 82.18 | AF281: 81.71 | AG281: 0.79 | AH281: AA- | AI281: 6.5099999999999991e-002 | AJ281: =H281+100*O281 -> 131.74000000000001 | AK281: 132.8 | AL281: 201 | AM281: 50.6 | AN281: 263 | AO281: 0.106 | AP281: 5 | AQ281: 美诺转债!
A282: 195 | B282: 123047 | C282: 久吾转债 | D282: 300631 | E282: 久吾高科 | F282: 机械装备 | G282: 专用设备 | H282: 141.398 | I282: 4.0000000000000001e-003 | J282: 1.72e-002 | K282: 21.63 | L282: 2.9500000000000002e-002 | M282: 129.6 | N282: 17.43 | O282: 0.13900000000000001 | P282: 124.1 | Q282: 转股中 | R282: 4.75年 | S282: 2.75年 | T282: 1.99 | U282: 465 | V282: 1.6599999999999999 | W282: 8.5000000000000006e-002 | X282: 0.105 | Y282: 23 | Z282: 2.84 | AA282: -1.8600000000000002e-002 | AB282: -2.8399999999999998e-002 | AC282: -9.6000000000000002e-002 | AD282: -9.9199999999999997e-002 | AE282: 85.74 | AF282: 92.86 | AG282: 0.72 | AH282: A+ | AI282: 7.4900000000000008e-002 | AJ282: =H282+100*O282 -> 155.298 | AK282: 158.7 | AL282: 317 | AM282: 65.8 | AN282: 315 | AO282: -4.0000000000000001e-002 | AP282: 22 | AQ282: 久吾转债
A283: 140 | B283: 123060 | C283: 苏试转债 | D283: 300416 | E283: 苏试试验 | F283: 机械装备 | G283: 专用设备 | H283: 129.288 | I283: 1.e-003 | J283: -1.41e-002 | K283: 21.82 | L283: -1.7100000000000001e-002 | M283: 117.6 | N283: 18.28 | O283: 8.3000000000000004e-002 | P283: 119.37 | Q283: 转股中 | R283: 5年32天 | S283: 3年33天 | T283: 3.1 | U283: 22 | V283: 5.5999999999999994e-002 | W283: 5.4000000000000006e-002 | X283: 6.4000000000000001e-002 | Y283: 58 | Z283: 4.75 | AA283: -1.8799999999999997e-002 | AB283: -2.4700000000000003e-002 | AC283: -6.5500000000000003e-002 | AD283: -6.7500000000000004e-002 | AE283: 84.85 | AF283: 85.95 | AG283: 0.76 | AH283: AA- | AI283: 6.5099999999999991e-002 | AJ283: =H283+100*O283 -> 137.58800000000002 | AK283: 139.2 | AL283: 254 | AM283: 53.3 | AN283: 277 | AO283: 0.115 | AP283: 8 | AQ283: 苏试转债
A284: 107 | B284: 128134 | C284: 鸿路转债! | D284: 2541. | E284: 鸿路钢构 | F284: 建筑 | G284: 其他 | H284: 127.721 | I284: -7.1999999999999998e-003 | J284: 2.0000000000000001e-004 | K284: 53.78 | L284: -9.0000000000000011e-003 | M284: 115.1 | N284: 43.51 | O284: 3.3000000000000002e-002 | P284: 123.6 | Q284: 转股中 | R284: 5.31年 | S284: 3.31年 | T284: 18.8 | U284: 15 | V284: 6.0000000000000001e-003 | W284: 6.7000000000000004e-002 | X284: 8.199999999999999e-002 | Y284: 282 | Z284: 4.84 | AA284: -1.9799999999999998e-002 | AB284: -2.4700000000000003e-002 | AC284: -5.8899999999999994e-002 | AD284: -6.0700000000000004e-002 | AE284: 89.3 | AF284: 91.94 | AG284: 0.78 | AH284: AA | AI284: 4.41e-002 | AJ284: =H284+100*O284 -> 131.02100000000002 | AK284: 131.8 | AL284: 189 | AM284: 39.9 | AN284: 195 | AO284: 2.e-003 | AP284: 4 | AQ284: 鸿路转债!
A285: 2 | B285: 123114 | C285: 三角转债 | D285: 300775 | E285: 三角防务 | F285: 航空航天 | G285: 航空航天 | H285: 136.5 | I285: 1.8700000000000001e-002 | J285: -1.9099999999999999e-002 | K285: 36.8 | L285: -5.0000000000000001e-004 | M285: 121 | N285: 31.82 | O285: 0.17999999999999999 | P285: 115.65 | Q285: 5月15天 | R285: 5.93年 | S285: 3.93年 | T285: 9.04 | U285: 160 | V285: 0.129 | W285: 5.0000000000000003e-002 | X285: 5.7000000000000002e-002 | Y285: 182 | Z285: 9.11 | AA285: -2.0499999999999997e-002 | AB285: -2.63e-002 | AC285: -6.480000000000001e-002 | AD285: -6.6500000000000004e-002 | AE285: 80.43 | AF285: 83.84 | AG285: 0.75 | AH285: AA- | AI285: 6.5099999999999991e-002 | AJ285: =H285+100*O285 -> 154.5 | AK285: 157.3 | AL285: 315 | AM285: 73.5 | AN285: 328 | AO285: 2.8999999999999998e-002 | AP285: 2 | AQ285: 三角转债
A286: 237 | B286: 123035 | C286: 利德转债! | D286: 300296 | E286: 利亚德 | F286: 电子 | G286: LED制 | H286: 126 | I286: -1.6000000000000001e-003 | J286: 7.000000000000001e-004 | K286: 8.01 | L286: -1.1999999999999999e-003 | M286: 115.1 | N286: 6.96 | O286: 9.5000000000000001e-002 | P286: 115.09 | Q286: 转股中 | R286: 4.41年 | S286: 2.41年 | T286: 8 | U286: 90 | V286: 8.8000000000000009e-002 | W286: 3.9e-002 | X286: 4.4999999999999998e-002 | Y286: 204 | Z286: 2.79 | AA286: -2.07e-002 | AB286: -2.6699999999999998e-002 | AC286: -7.400000000000001e-002 | AD286: -7.6399999999999996e-002 | AE286: 93.79 | AF286: 97.25 | AG286: 0.69 | AH286: AA+ | AI286: 3.9900000000000005e-002 | AJ286: =H286+100*O286 -> 135.5 | AK286: 136.9 | AL286: 235 | AM286: 39.7 | AN286: 193 | AO286: 0.106 | AP286: 14 | AQ286: 利德转债!
A287: 105 | B287: 110075 | C287: 南航转债 | D287: 600029 | E287: 南方航空 | F287: 交通运输 | G287: 航空运输 | H287: 124.78 | I287: 1.5e-003 | J287: 1.2500000000000001e-002 | K287: 6.26 | L287: 2.29e-002 | M287: 110 | N287: 6.24 | O287: 0.24399999999999999 | P287: 100.32 | Q287: 转股中 | R287: 5.32年 | S287: 3.33年 | T287: 160 | U287: 31 | V287: 2.e-003 | W287: 0.16699999999999998 | X287: 0.16699999999999998 | Y287: 960 | Z287: 1.47 | AA287: -2.3700000000000002e-002 | AB287: -2.7000000000000003e-002 | AC287: -5.57e-002 | AD287: -5.6799999999999996e-002 | AE287: 89.51 | AF287: 89.92 | AG287: 0.61 | AH287: AAA | AI287: 3.9100000000000003e-002 | AJ287: =H287+100*O287 -> 149.18000000000001 | AK287: 149.2 | AL287: 293 | AM287: 59.3 | AN287: 297 | AO287: -2.9999999999999999e-002 | AP287: 7 | AQ287: 南航转债
A288: 121 | B288: 128128 | C288: 齐翔转2! | D288: 2408. | E288: 齐翔腾达 | F288: 化工 | G288: 化工 | H288: 130.78 | I288: -2.2200000000000001e-002 | J288: 4.0000000000000001e-003 | K288: 10.72 | L288: -2.2799999999999997e-002 | M288: 115.3 | N288: 8.22 | O288: 3.0000000000000001e-003 | P288: 130.41 | Q288: 转股中 | R288: 5.17年 | S288: 3.17年 | T288: 10.1 | U288: 36 | V288: 2.7000000000000003e-002 | W288: 4.9000000000000002e-002 | X288: 6.4000000000000001e-002 | Y288: 207 | Z288: 1.96 | AA288: -2.4500000000000001e-002 | AB288: -2.9600000000000001e-002 | AC288: -6.7699999999999996e-002 | AD288: -6.9599999999999995e-002 | AE288: 89.93 | AF288: 92.67 | AG288: 0.8 | AH288: AA | AI288: 4.41e-002 | AJ288: =H288+100*O288 -> 131.08000000000001 | AK288: 131.1 | AL288: 183 | AM288: 38.5 | AN288: 183 | AO288: -3.9e-002 | AP288: 35 | AQ288: 齐翔转2!
A289: 365 | B289: 113009 | C289: 广汽转债! | D289: 601238 | E289: 广汽集团 | F289: 汽车 | G289: 乘用车 | H289: 107.6 | I289: 5.7999999999999996e-003 | J289: -3.4999999999999996e-003 | K289: 12.05 | L289: 4.24e-002 | M289: 106 | N289: 13.97 | O289: 0.247 | P289: 86.26 | Q289: 转股中 | R289: 0.60年 | S289: 回售内 | T289: 25.5 | U289: 23 | V289: 8.0000000000000002e-003 | W289: 2.e-002 | X289: 1.8000000000000002e-002 | Y289: 1247. | Z289: 1.44 | AA289: -2.4799999999999999e-002 | AB289: -4.3200000000000002e-002 | AC289: 回售内 | AD289: 回售内 | AE289: 100.27 | AF289: 103.95 | AG289: 0.05 | AH289: AAA | AI289: 3.3300000000000003e-002 | AJ289: =H289+100*O289 -> 132.29999999999998 | AK289: 128.9 | AL289: 154 | AM289: 25 | AN289: 37 | AO289: 2.5000000000000001e-002 | AP289: 15 | AQ289: 广汽转债!
A290: 17 | B290: 123108 | C290: 乐普转2 | D290: 300003 | E290: 乐普医疗 | F290: 医药 | G290: 医疗器械 | H290: 125.425 | I290: 1.8e-003 | J290: 2.2000000000000001e-003 | K290: 31.14 | L290: 6.5000000000000006e-003 | M290: 111.1 | N290: 29.73 | O290: 0.19699999999999998 | P290: 104.74 | Q290: 3月22天 | R290: 4.78年 | S290: 2.78年 | T290: 16.4 | U290: 4.4 | V290: 2.e-003 | W290: 2.8999999999999998e-002 | X290: 3.1e-002 | Y290: 562 | Z290: 5.29 | AA290: -2.53e-002 | AB290: -2.9399999999999999e-002 | AC290: -6.7799999999999999e-002 | AD290: -6.9000000000000006e-002 | AE290: 90.98 | AF290: 92.36 | AG290: 0.63 | AH290: AA+ | AI290: 3.9900000000000005e-002 | AJ290: =H290+100*O290 -> 145.125 | AK290: 146.1 | AL290: 288 | AM290: 53.7 | AN290: 281 | AO290: -2.8999999999999998e-002 | AP290: 8 | AQ290: 乐普转2
A291: 357 | B291: 113013 | C291: 国君转债! | D291: 601211 | E291: 国泰君安 | F291: 金融 | G291: 证券行业 | H291: 114.3 | I291: 1.8e-003 | J291: -1.e-003 | K291: 16.82 | L291: 2.3999999999999998e-003 | M291: 108.3 | N291: 19.01 | O291: 0.29199999999999998 | P291: 88.48 | Q291: 转股中 | R291: 2年19天 | S291: 无权 | T291: 69.9 | U291: 14 | V291: 2.e-003 | W291: 4.7e-002 | X291: 4.0999999999999995e-002 | Y291: 1498. | Z291: 1.15 | AA291: -2.6499999999999999e-002 | AB291: -3.3799999999999997e-002 | AC291: 无权 | AD291: 无权 | AE291: 无权 | AF291: 100.8 | AG291: 0.32 | AH291: AAA | AI291: 3.6400000000000002e-002 | AJ291: =H291+100*O291 -> 143.5 | AK291: 140.1 | AL291: 261 | AM291: 39.3 | AN291: 189 | AO291: -2.5000000000000001e-002 | AP291: 13 | AQ291: 国君转债!
A292: 30 | B292: 123103 | C292: 震安转债 | D292: 300767 | E292: 震安科技 | F292: 化工 | G292: 橡胶塑料 | H292: 141.139 | I292: -1.8799999999999997e-002 | J292: 2.e-003 | K292: 69.16 | L292: -2.12e-002 | M292: 121.4 | N292: 56.89 | O292: 0.161 | P292: 121.57 | Q292: 3月4天 | R292: 5.73年 | S292: 3.73年 | T292: 2.85 | U292: 83 | V292: 0.20499999999999999 | W292: 2.e-002 | X292: 2.5000000000000001e-002 | Y292: 139 | Z292: 8.74 | AA292: -2.6499999999999999e-002 | AB292: -3.2599999999999997e-002 | AC292: -7.4800000000000005e-002 | AD292: -7.6700000000000004e-002 | AE292: 78.84 | AF292: 80.53 | AG292: 0.79 | AH292: A+ | AI292: 7.6100000000000001e-002 | AJ292: =H292+100*O292 -> 157.239 | AK292: 160.7 | AL292: 320 | AM292: 80.2 | AN292: 336 | AO292: -0.30299999999999999 | AP292: 3 | AQ292: 震安转债
A293: 331 | B293: 127005 | C293: 长证转债! | D293: 783. | E293: 长江证券 | F293: 金融 | G293: 证券行业 | H293: 116.707 | I293: 3.0999999999999999e-003 | J293: -2.0000000000000001e-004 | K293: 7.28 | L293: 5.5000000000000005e-003 | M293: 108.3 | N293: 7.28 | O293: 0.16699999999999998 | P293: 100 | Q293: 转股中 | R293: 2.73年 | S293: 无权 | T293: 50 | U293: 12 | V293: 2.e-003 | W293: 0.124 | X293: 0.124 | Y293: 403 | Z293: 1.4 | AA293: -2.7400000000000001e-002 | AB293: -3.2899999999999999e-002 | AC293: 无权 | AD293: 无权 | AE293: 无权 | AF293: 98.38 | AG293: 0.53 | AH293: AAA | AI293: 3.6400000000000002e-002 | AJ293: =H293+100*O293 -> 133.40699999999998 | AK293: 133.4 | AL293: 210 | AM293: 35 | AN293: 148 | AO293: -3.5000000000000003e-002 | AP293: 14 | AQ293: 长证转债!
A294: 246 | B294: 128079 | C294: 英联转债! | D294: 2846. | E294: 英联股份 | F294: 造纸包装 | G294: 包装材料 | H294: 132.6 | I294: 4.6999999999999993e-003 | J294: -1.4000000000000002e-003 | K294: 7.84 | L294: 5.1000000000000004e-003 | M294: 117.5 | N294: 8.29 | O294: 0.40200000000000002 | P294: 94.57 | Q294: 转股中 | R294: 4.34年 | S294: 2.34年 | T294: 1.52 | U294: 54 | V294: 0.26700000000000002 | W294: 6.0999999999999999e-002 | X294: 5.7999999999999996e-002 | Y294: 25 | Z294: 3.24 | AA294: -2.7999999999999997e-002 | AB294: -3.4799999999999998e-002 | AC294: -9.4299999999999995e-002 | AD294: -9.6699999999999994e-002 | AE294: 86.66 | AF294: 86.5 | AG294: 0.64 | AH294: A+ | AI294: 7.4900000000000008e-002 | AJ294: =H294+100*O294 -> 172.80000000000001 | AK294: 170.6 | AL294: 333 | AM294: 84 | AN294: 337 | AO294: -4.8000000000000001e-002 | AP294: 18 | AQ294: 英联转债!
A295: 111 | B295: 123066 | C295: 赛意转债! | D295: 300687 | E295: 赛意信息 | F295: 计算机及 | G295: 软件开发 | H295: 141 | I295: -2.29e-002 | J295: 3.56e-002 | K295: 20.05 | L295: 1.52e-002 | M295: 121.4 | N295: 14.01 | O295: -1.4999999999999999e-002 | P295: 143.11 | Q295: 转股中 | R295: 5.24年 | S295: 3.25年 | T295: 2.61 | U295: 317 | V295: 0.83499999999999996 | W295: 3.7000000000000005e-002 | X295: 5.2999999999999999e-002 | Y295: 70 | Z295: 4.43 | AA295: -2.87e-002 | AB295: -3.5299999999999998e-002 | AC295: -8.5299999999999987e-002 | AD295: -8.7400000000000005e-002 | AE295: 81.47 | AF295: 83.4 | AG295: 0.84 | AH295: A+ | AI295: 7.6100000000000001e-002 | AJ295: =H295+100*O295 -> 139.5 | AK295: 138.9 | AL295: 251 | AM295: 55.5 | AN295: 287 | AO295: -0.111 | AP295: 8 | AQ295: 赛意转债!
A296: 317 | B296: 123012 | C296: 万顺转债! | D296: 300057 | E296: 万顺新材 | F296: 有色金属 | G296: 铝金属 | H296: 120.5 | I296: -2.5000000000000001e-003 | J296: 5.8999999999999999e-003 | K296: 5.13 | L296: 5.8999999999999999e-003 | M296: 110.3 | N296: 5.27 | O296: 0.23800000000000002 | P296: 97.34 | Q296: 转股中 | R296: 3年31天 | S296: 1年32天 | T296: 1.29 | U296: 21 | V296: 0.13900000000000001 | W296: 3.7000000000000005e-002 | X296: 3.6000000000000004e-002 | Y296: 35 | Z296: 0.97 | AA296: -2.8900000000000002e-002 | AB296: -3.4799999999999998e-002 | AC296: -0.114 | AD296: -0.11800000000000001 | AE296: 95.2 | AF296: 91.53 | AG296: 0.57 | AH296: AA- | AI296: 6.3899999999999998e-002 | AJ296: =H296+100*O296 -> 144.30000000000001 | AK296: 143.7 | AL296: 278 | AM296: 48.5 | AN296: 255 | AO296: 3.7999999999999999e-002 | AP296: 20 | AQ296: 万顺转债!
A297: 346 | B297: 128025 | C297: 特一转债! | D297: 2728. | E297: 特一药业 | F297: 医药 | G297: 化学制药 | H297: 117 | I297: 1.3000000000000001e-002 | J297: 1.8e-003 | K297: 14.18 | L297: 2.53e-002 | M297: 108.8 | N297: 14.05 | O297: 0.159 | P297: 100.93 | Q297: 转股中 | R297: 2.47年 | S297: 0.47年 | T297: 2.98 | U297: 253 | V297: 0.72699999999999998 | W297: 0.10300000000000001 | X297: 0.10400000000000001 | Y297: 29 | Z297: 2.7 | AA297: -2.9399999999999999e-002 | AB297: -3.5799999999999998e-002 | AC297: -0.218 | AD297: -0.222 | AE297: 97.73 | AF297: 93.92 | AG297: 0.58 | AH297: AA- | AI297: 6.2400000000000004e-002 | AJ297: =H297+100*O297 -> 132.90000000000001 | AK297: 133.1 | AL297: 205 | AM297: 35.3 | AN297: 153 | AO297: -0.113 | AP297: 50 | AQ297: 特一转债!
A298: 328 | B298: 128036 | C298: 金农转债!! | D298: 2548. | E298: 金新农 | F298: 农业 | G298: 畜牧业 | H298: 118.5 | I298: 1.52e-002 | J298: -8.0000000000000002e-003 | K298: 5.62 | L298: 2.5499999999999998e-002 | M298: 109.3 | N298: 6.96 | O298: 0.46799999999999997 | P298: 80.75 | Q298: 转股中 | R298: 2.72年 | S298: 0.72年 | T298: 1.46 | U298: 31 | V298: 0.182 | W298: 3.7999999999999999e-002 | X298: 2.9999999999999999e-002 | Y298: 39 | Z298: 1.49 | AA298: -2.9700000000000001e-002 | AB298: -3.5799999999999998e-002 | AC298: -0.161 | AD298: -0.16399999999999998 | AE298: 96.48 | AF298: 92.95 | AG298: 0.28 | AH298: AA- | AI298: 6.2400000000000004e-002 | AJ298: =H298+100*O298 -> 165.30000000000001 | AK298: 156.3 | AL298: 313 | AM298: 59.8 | AN298: 299 | AO298: -5.0000000000000003e-002 | AP298: 16 | AQ298: 金农转债!!
A299: 24 | B299: 127030 | C299: 盛虹转债 | D299: 301. | E299: 东方盛虹 | F299: 化工 | G299: 化纤 | H299: 133.5 | I299: 2.4700000000000003e-002 | J299: -3.5000000000000003e-002 | K299: 15.67 | L299: -1.4499999999999999e-002 | M299: 112.5 | N299: 14.1 | O299: 0.20100000000000001 | P299: 111.13 | Q299: 3月11天 | R299: 5.76年 | S299: 3.76年 | T299: 50 | U299: 83 | V299: 1.3000000000000001e-002 | W299: 6.6000000000000003e-002 | X299: 7.2999999999999995e-002 | Y299: 758 | Z299: 4.18 | AA299: -2.9700000000000001e-002 | AB299: -3.3399999999999999e-002 | AC299: -6.4199999999999993e-002 | AD299: -6.5599999999999992e-002 | AE299: 88.02 | AF299: 89.52 | AG299: 0.71 | AH299: AA+ | AI299: 4.1100000000000005e-002 | AJ299: =H299+100*O299 -> 153.59999999999999 | AK299: 155.9 | AL299: 311 | AM299: 66.3 | AN299: 317 | AO299: -9.0999999999999998e-002 | AP299: 4 | AQ299: 盛虹转债
A300: 189 | B300: 113575 | C300: 东时转债!! | D300: 603377 | E300: 东方时尚 | F300: 其他 | G300: 其他 | H300: 131.15 | I300: 1.e-003 | J300: -4.0000000000000001e-003 | K300: 9.66 | L300: -8.199999999999999e-003 | M300: 113.1 | N300: 12.15 | O300: 0.65000000000000002 | P300: 79.51 | Q300: 转股中 | R300: 4.81年 | S300: 2.81年 | T300: 0.98 | U300: 18 | V300: 0.14199999999999999 | W300: 1.3999999999999999e-002 | X300: 1.1000000000000001e-002 | Y300: 70 | Z300: 2.82 | AA300: -3.0899999999999997e-002 | AB300: -3.56e-002 | AC300: -7.7199999999999991e-002 | AD300: -7.9199999999999993e-002 | AE300: 91.38 | AF300: 92.79 | AG300: 0.36 | AH300: AA | AI300: 4.2900000000000001e-002 | AJ300: =H300+100*O300 -> 196.15000000000001 | AK300: 182.8 | AL300: 338 | AM300: 90 | AN300: 339 | AO300: -9.6999999999999989e-002 | AP300: 15 | AQ300: 东时转债!!
A301: 238 | B301: 110061 | C301: 川投转债 | D301: 600674 | E301: 川投能源 | F301: 能源电力 | G301: 水电 | H301: 127.02 | I301: -6.0000000000000001e-003 | J301: 2.e-003 | K301: 11.7 | L301: -5.1000000000000004e-003 | M301: 110.8 | N301: 9.58 | O301: 4.0000000000000001e-002 | P301: 122.13 | Q301: 转股中 | R301: 4.40年 | S301: 2.40年 | T301: 39.6 | U301: 11 | V301: 2.e-003 | W301: 7.6999999999999999e-002 | X301: 9.4e-002 | Y301: 515 | Z301: 1.79 | AA301: -3.1200000000000002e-002 | AB301: -3.5400000000000001e-002 | AC301: -7.8e-002 | AD301: -8.0199999999999994e-002 | AE301: 93.98 | AF301: 94.4 | AG301: 0.78 | AH301: AAA | AI301: 3.7900000000000003e-002 | AJ301: =H301+100*O301 -> 131.01999999999998 | AK301: 131.9 | AL301: 191 | AM301: 37.5 | AN301: 175 | AO301: -1.e-002 | AP301: 15 | AQ301: 川投转债
A302: 51 | B302: 113615 | C302: 金诚转债 | D302: 603979 | E302: 金诚信 | F302: 有色金属 | G302: 有色行业 | H302: 139.24 | I302: -1.67e-002 | J302: -1.1999999999999999e-003 | K302: 17.25 | L302: -2.1600000000000001e-002 | M302: 117.3 | N302: 12.65 | O302: 2.1000000000000001e-002 | P302: 136.36 | Q302: 11天 | R302: 5.51年 | S302: 3.52年 | T302: 10 | U302: 41 | V302: 2.8999999999999998e-002 | W302: 9.9000000000000005e-002 | X302: 0.13500000000000001 | Y302: 101 | Z302: 2.17 | AA302: -3.1200000000000002e-002 | AB302: -3.6400000000000002e-002 | AC302: -7.7300000000000008e-002 | AD302: -7.9000000000000001e-002 | AE302: 88.7 | AF302: 92.9 | AG302: 0.83 | AH302: AA | AI302: 4.41e-002 | AJ302: =H302+100*O302 -> 141.34 | AK302: 142.1 | AL302: 273 | AM302: 49.2 | AN302: 259 | AO302: 2.4e-002 | AP302: 3 | AQ302: 金诚转债
A303: 297 | B303: 128053 | C303: 尚荣转债! | D303: 2551. | E303: 尚荣医疗 | F303: 医药 | G303: 医疗器械 | H303: 128.455 | I303: 8.6999999999999994e-003 | J303: 3.8e-003 | K303: 5.64 | L303: 1.26e-002 | M303: 114.3 | N303: 4.89 | O303: 0.114 | P303: 115.34 | Q303: 转股中 | R303: 3.66年 | S303: 1.66年 | T303: 1.91 | U303: 41 | V303: 0.16800000000000001 | W303: 4.0999999999999995e-002 | X303: 4.8000000000000001e-002 | Y303: 46 | Z303: 1.51 | AA303: -3.1899999999999998e-002 | AB303: -3.8599999999999995e-002 | AC303: -0.115 | AD303: -0.11800000000000001 | AE303: 95.26 | AF303: 98.29 | AG303: 1 | AH303: AA | AI303: 4.2900000000000001e-002 | AJ303: =H303+100*O303 -> 139.85500000000002 | AK303: 141.6 | AL303: 269 | AM303: 43.3 | AN303: 228 | AO303: -2.e-002 | AP303: 25 | AQ303: 尚荣转债!
A304: 41 | B304: 113621 | C304: 彤程转债 | D304: 603650 | E304: 彤程新材 | F304: 化工 | G304: 橡胶塑料 | H304: 138.75 | I304: 1.24e-002 | J304: 2.7799999999999998e-002 | K304: 46 | L304: 4.6600000000000003e-002 | M304: 115.1 | N304: 32.62 | O304: -1.6e-002 | P304: 141.02 | Q304: 45天 | R304: 5.61年 | S304: 3.61年 | T304: 8 | U304: 630 | V304: 0.56399999999999995 | W304: 2.9999999999999999e-002 | X304: 4.2000000000000003e-002 | Y304: 270 | Z304: 10.46 | AA304: -3.3300000000000003e-002 | AB304: -3.7900000000000003e-002 | AC304: -7.4999999999999997e-002 | AD304: -7.6600000000000001e-002 | AE304: 88.15 | AF304: 90.77 | AG304: 0.86 | AH304: AA | AI304: 4.41e-002 | AJ304: =H304+100*O304 -> 137.15000000000001 | AK304: 136.5 | AL304: 232 | AM304: 45.7 | AN304: 245 | AO304: 0.17899999999999999 | AP304: 5 | AQ304: 彤程转债
A305: 95 | B305: 127023 | C305: 华菱转2!* | D305: 932. | E305: 华菱钢铁 | F305: 钢铁 | G305: 炼钢 | H305: 132.35 | I305: -4.8999999999999998e-003 | J305: -1.1999999999999999e-003 | K305: 6.58 | L305: -6.0000000000000001e-003 | M305: 110.1 | N305: 4.97 | O305: 0. | P305: 132.39 | Q305: 转股中 | R305: 5.35年 | S305: 4.35年 | T305: 19.2 | U305: 146 | V305: 5.7999999999999996e-002 | W305: 4.8000000000000001e-002 | X305: 6.3e-002 | Y305: 403 | Z305: 1.15 | AA305: -3.4300000000000004e-002 | AB305: -3.7599999999999995e-002 | AC305: -5.16e-002 | AD305: -5.33e-002 | AE305: 88.01 | AF305: 89.98 | AG305: 1 | AH305: AAA | AI305: 3.9100000000000003e-002 | AJ305: =H305+100*O305 -> 132.34999999999999 | AK305: 132.3 | AL305: 195 | AM305: 42.3 | AN305: 217 | AO305: -3.6000000000000004e-002 | AP305: 12 | AQ305: 华菱转2!*
A306: 327 | B306: 113508 | C306: 新凤转债! | D306: 603225 | E306: 新凤鸣 | F306: 服装纺织 | G306: 纺织行业 | H306: 123.65 | I306: -1.8700000000000001e-002 | J306: 1.9e-003 | K306: 19.38 | L306: -2.12e-002 | M306: 111.3 | N306: 15.65 | O306: -1.e-003 | P306: 123.83 | Q306: 转股中 | R306: 2.85年 | S306: 0.86年 | T306: 20.6 | U306: 70 | V306: 2.7000000000000003e-002 | W306: 7.5999999999999998e-002 | X306: 9.4e-002 | Y306: 272 | Z306: 2.22 | AA306: -3.6699999999999997e-002 | AB306: -4.36e-002 | AC306: -0.17300000000000001 | AD306: -0.17600000000000002 | AE306: 97.68 | AF306: 99.31 | AG306: 0.79 | AH306: AA | AI306: 4.1399999999999999e-002 | AJ306: =H306+100*O306 -> 123.55000000000001 | AK306: 123.5 | AL306: 99 | AM306: 24.2 | AN306: 31 | AO306: -8.0000000000000002e-003 | AP306: 22 | AQ306: 新凤转债!
A307: 26 | B307: 127029 | C307: 中钢转债 | D307: 928. | E307: 中钢国际 | F307: 建筑 | G307: 建筑工程 | H307: 146.2 | I307: 5.6000000000000008e-003 | J307: 1.55e-002 | K307: 9.39 | L307: 2.4e-002 | M307: 117.5 | N307: 5.89 | O307: -8.3000000000000004e-002 | P307: 159.42 | Q307: 3月11天 | R307: 5.75年 | S307: 3.75年 | T307: 9.6 | U307: 314 | V307: 0.22399999999999998 | W307: 8.1000000000000003e-002 | X307: 0.13 | Y307: 118 | Z307: 2.05 | AA307: -3.78e-002 | AB307: -4.2800000000000005e-002 | AC307: -8.5900000000000004e-002 | AD307: -8.72e-002 | AE307: 88.05 | AF307: 93.52 | AG307: 0.88 | AH307: AA+ | AI307: 4.1100000000000005e-002 | AJ307: =H307+100*O307 -> 137.89999999999998 | AK307: 133 | AL307: 203 | AM307: 39.5 | AN307: 191 | AO307: -0.109 | AP307: 8 | AQ307: 中钢转债
A308: 43 | B308: 123094 | C308: 星源转2! | D308: 300568 | E308: 星源材质 | F308: 电子 | G308: 电子行业 | H308: 145 | I308: 6.7799999999999999e-002 | J308: 1.52e-002 | K308: 45.65 | L308: 9.74e-002 | M308: 117.3 | N308: 31.53 | O308: 2.e-003 | P308: 144.78 | Q308: 38天 | R308: 5.59年 | S308: 3.59年 | T308: 10 | U308: 570 | V308: 0.40000000000000002 | W308: 4.9000000000000002e-002 | X308: 7.0999999999999994e-002 | Y308: 205 | Z308: 6.77 | AA308: -3.7900000000000003e-002 | AB308: -4.2900000000000001e-002 | AC308: -8.5800000000000001e-002 | AD308: -8.7400000000000005e-002 | AE308: 88.41 | AF308: 92.59 | AG308: 0.85 | AH308: AA | AI308: 4.41e-002 | AJ308: =H308+100*O308 -> 145.19999999999999 | AK308: 145.2 | AL308: 283 | AM308: 52.6 | AN308: 273 | AO308: 8.199999999999999e-002 | AP308: 4 | AQ308: 星源转2!
A309: 11 | B309: 113047 | C309: 旗滨转债 | D309: 601636 | E309: XD旗滨集 | F309: 建筑 | G309: 玻璃 | H309: 142.6 | I309: 2.7000000000000001e-003 | J309: -1.0800000000000001e-002 | K309: 16.51 | L309: -1.0200000000000001e-002 | M309: 114 | N309: 12.8 | O309: 0.106 | P309: 128.98 | Q309: 3月29天 | R309: 5.81年 | S309: 3.81年 | T309: 15 | U309: 51 | V309: 2.4e-002 | W309: 3.4000000000000002e-002 | X309: 4.4000000000000004e-002 | Y309: 443 | Z309: 4.27 | AA309: -3.8199999999999998e-002 | AB309: -4.2300000000000004e-002 | AC309: -8.0100000000000005e-002 | AD309: -8.1099999999999992e-002 | AE309: 87.42 | AF309: 90.5 | AG309: 0.79 | AH309: AA+ | AI309: 4.1100000000000005e-002 | AJ309: =H309+100*O309 -> 153.19999999999999 | AK309: 156.2 | AL309: 312 | AM309: 65.7 | AN309: 314 | AO309: -2.2000000000000002e-002 | AP309: 5 | AQ309: 旗滨转债
A310: 281 | B310: 123025 | C310: 精测转债!! | D310: 300567 | E310: 精测电子 | F310: 电子 | G310: 液晶显示 | H310: 134.66 | I310: 2.4e-002 | J310: -2.29e-002 | K310: 57.73 | L310: 1.4000000000000002e-003 | M310: 116.5 | N310: 49.37 | O310: 0.152 | P310: 116.93 | Q310: 转股中 | R310: 3.78年 | S310: 1.78年 | T310: 3.09 | U310: 75 | V310: 0.184 | W310: 1.9e-002 | X310: 2.3e-002 | Y310: 161 | Z310: 8.09 | AA310: -3.8300000000000001e-002 | AB310: -4.5499999999999999e-002 | AC310: -0.107 | AD310: -0.109 | AE310: 91.24 | AF310: 92.61 | AG310: 0.72 | AH310: AA- | AI310: 6.3899999999999998e-002 | AJ310: =H310+100*O310 -> 149.85999999999999 | AK310: 152.4 | AL310: 304 | AM310: 59.8 | AN310: 298 | AO310: 7.0000000000000007e-002 | AP310: 16 | AQ310: 精测转债!!
A311: 225 | B311: 110065 | C311: 淮矿转债!!* | D311: 600985 | E311: 淮北矿业 | F311: 煤炭 | G311: 煤炭开采 | H311: 132.18 | I311: -2.6099999999999998e-002 | J311: 1.5e-003 | K311: 11.49 | L311: -2.46e-002 | M311: 110.8 | N311: 8.68 | O311: -1.e-003 | P311: 132.37 | Q311: 转股中 | R311: 4.51年 | S311: 2.52年 | T311: 7.86 | U311: 146 | V311: 0.13900000000000001 | W311: 2.9999999999999999e-002 | X311: 4.0000000000000001e-002 | Y311: 263 | Z311: 1.12 | AA311: -3.9e-002 | AB311: -4.3099999999999999e-002 | AC311: -8.8499999999999995e-002 | AD311: -9.06e-002 | AE311: 93.58 | AF311: 93.99 | AG311: 1 | AH311: AAA | AI311: 3.7900000000000003e-002 | AJ311: =H311+100*O311 -> 132.08000000000001 | AK311: 132 | AL311: 192 | AM311: 38 | AN311: 178 | AO311: -1.4999999999999999e-002 | AP311: 19 | AQ311: 淮矿转债!!*
A312: 149 | B312: 123058 | C312: 欣旺转债!* | D312: 300207 | E312: 欣旺达 | F312: 电子 | G312: 电子产品 | H312: 143.48 | I312: 3.5000000000000003e-002 | J312: -1.18e-002 | K312: 30.47 | L312: 2.3199999999999998e-002 | M312: 116.3 | N312: 21.17 | O312: -3.0000000000000001e-003 | P312: 143.93 | Q312: 转股中 | R312: 5年25天 | S312: 3年26天 | T312: 6.92 | U312: 667 | V312: 0.67400000000000004 | W312: 1.3999999999999999e-002 | X312: 2.1000000000000001e-002 | Y312: 480 | Z312: 6.86 | AA312: -4.1399999999999999e-002 | AB312: -4.6699999999999998e-002 | AC312: -9.6000000000000002e-002 | AD312: -9.7899999999999987e-002 | AE312: 90.41 | AF312: 93.89 | AG312: 1 | AH312: AA | AI312: 4.41e-002 | AJ312: =H312+100*O312 -> 143.17999999999998 | AK312: 143 | AL312: 275 | AM312: 49.1 | AN312: 258 | AO312: 5.0000000000000001e-003 | AP312: 7 | AQ312: 欣旺转债!*
A313: 362 | B313: 113011 | C313: 光大转债 | D313: 601818 | E313: 光大银行 | F313: 金融 | G313: 银行行业 | H313: 115.03 | I313: 2.9999999999999997e-004 | J313: 1.1000000000000001e-003 | K313: 3.81 | L313: 2.5999999999999999e-003 | M313: 106.8 | N313: 3.76 | O313: 0.13500000000000001 | P313: 101.33 | Q313: 转股中 | R313: 1.75年 | S313: 无权 | T313: 242 | U313: 108 | V313: 4.0000000000000001e-003 | W313: 0.11800000000000001 | X313: 0.11900000000000001 | Y313: 2059. | Z313: 0.58 | AA313: -4.2000000000000003e-002 | AB313: -4.9000000000000002e-002 | AC313: 无权 | AD313: 无权 | AE313: 无权 | AF313: 100.4 | AG313: 0.52 | AH313: AAA | AI313: 3.6400000000000002e-002 | AJ313: =H313+100*O313 -> 128.53 | AK313: 128.7 | AL313: 151 | AM313: 28.3 | AN313: 72 | AO313: -5.0000000000000001e-003 | AP313: 13 | AQ313: 光大转债
A314: 14 | B314: 123111 | C314: 东财转3 | D314: 300059 | E314: 东方财富 | F314: 金融 | G314: 证券行业 | H314: 141.8 | I314: 1.3000000000000001e-002 | J314: 2.5999999999999999e-003 | K314: 30.24 | L314: 1.9199999999999998e-002 | M314: 110.5 | N314: 23.35 | O314: 9.5000000000000001e-002 | P314: 129.51 | Q314: 3月27天 | R314: 5.80年 | S314: 3.80年 | T314: 158 | U314: 706 | V314: 3.1e-002 | W314: 5.0999999999999997e-002 | X314: 6.5000000000000002e-002 | Y314: 3126. | Z314: 7.42 | AA314: -4.2500000000000003e-002 | AB314: -4.5599999999999995e-002 | AC314: -7.9899999999999999e-002 | AD314: -8.0799999999999997e-002 | AE314: 86.99 | AF314: 87.7 | AG314: 0.81 | AH314: AA+ | AI314: 4.1100000000000005e-002 | AJ314: =H314+100*O314 -> 151.30000000000001 | AK314: 154.1 | AL314: 310 | AM314: 66.4 | AN314: 319 | AO314: -6.0999999999999999e-002 | AP314: 16 | AQ314: 东财转3
A315: 49 | B315: 113616 | C315: 韦尔转债 | D315: 603501 | E315: 韦尔股份 | F315: 电子 | G315: 元器件制 | H315: 145.16 | I315: -3.5200000000000002e-002 | J315: -2.4399999999999998e-002 | K315: 273.15 | L315: -7.8299999999999995e-002 | M315: 114.5 | N315: 222.83 | O315: 0.184 | P315: 122.58 | Q315: 17天 | R315: 5.53年 | S315: 3.53年 | T315: 24.4 | U315: 185 | V315: 5.0999999999999997e-002 | W315: 1.e-002 | X315: 1.3000000000000001e-002 | Y315: 2371. | Z315: 19.06 | AA315: -4.2599999999999999e-002 | AB315: -4.7e-002 | AC315: -8.9099999999999999e-002 | AD315: -9.0399999999999994e-002 | AE315: 88.84 | AF315: 91.96 | AG315: 0.76 | AH315: AA+ | AI315: 4.1100000000000005e-002 | AJ315: =H315+100*O315 -> 163.56 | AK315: 167.7 | AL315: 331 | AM315: 75.8 | AN315: 331 | AO315: -5.5e-002 | AP315: 8 | AQ315: 韦尔转债
A316: 97 | B316: 113040 | C316: 星宇转债 | D316: 601799 | E316: 星宇股份 | F316: 汽车 | G316: 零部件制 | H316: 140.42 | I316: 3.1699999999999999e-002 | J316: 2.0299999999999999e-002 | K316: 214.57 | L316: 6.1399999999999996e-002 | M316: 111.5 | N316: 156.7 | O316: 2.5000000000000001e-002 | P316: 136.93 | Q316: 转股中 | R316: 5.34年 | S316: 3.35年 | T316: 15 | U316: 71 | V316: 3.4000000000000002e-002 | W316: 2.5000000000000001e-002 | X316: 3.5000000000000003e-002 | Y316: 593 | Z316: 9.8 | AA316: -4.2699999999999995e-002 | AB316: -4.6399999999999997e-002 | AC316: -8.6800000000000002e-002 | AD316: -8.7799999999999989e-002 | AE316: 88.84 | AF316: 90.16 | AG316: 0.85 | AH316: AA+ | AI316: 4.1100000000000005e-002 | AJ316: =H316+100*O316 -> 142.91999999999999 | AK316: 143.9 | AL316: 279 | AM316: 53.7 | AN316: 280 | AO316: 8.199999999999999e-002 | AP316: 5 | AQ316: 星宇转债
A317: 206 | B317: 123043 | C317: 正元转债 | D317: 300645 | E317: 正元智慧 | F317: 计算机及 | G317: 软件开发 | H317: 148.8 | I317: 1.23e-002 | J317: 1.e-004 | K317: 16.45 | L317: 1.7899999999999999e-002 | M317: 120.9 | N317: 15.38 | O317: 0.39100000000000001 | P317: 106.96 | Q317: 转股中 | R317: 4.71年 | S317: 2.71年 | T317: 1.66 | U317: 688 | V317: 2.77 | W317: 7.9000000000000001e-002 | X317: 8.5000000000000006e-002 | Y317: 21 | Z317: 3.26 | AA317: -4.4000000000000004e-002 | AB317: -5.1100000000000007e-002 | AC317: -0.11599999999999999 | AD317: -0.11800000000000001 | AE317: 84.72 | AF317: 86.71 | AG317: 0.69 | AH317: A+ | AI317: 7.4900000000000008e-002 | AJ317: =H317+100*O317 -> 187.90000000000001 | AK317: 190.6 | AL317: 341 | AM317: 103.9 | AN317: 344 | AO317: -5.0000000000000001e-003 | AP317: 18 | AQ317: 正元转债
A318: 165 | B318: 123054 | C318: 思特转债! | D318: 300608 | E318: 思特奇 | F318: 通信互联 | G318: 通信设备 | H318: 153 | I318: -3.7699999999999997e-002 | J318: -2.0400000000000001e-002 | K318: 19.19 | L318: -6.7099999999999993e-002 | M318: 121.2 | N318: 12.63 | O318: 6.9999999999999993e-003 | P318: 151.94 | Q318: 转股中 | R318: 4.98年 | S318: 2.98年 | T318: 2.6 | U318: 4696. | V318: 11.220000000000001 | W318: 6.6000000000000003e-002 | X318: 0.10099999999999999 | Y318: 39 | Z318: 3.95 | AA318: -4.6600000000000003e-002 | AB318: -5.3399999999999996e-002 | AC318: -0.114 | AD318: -0.11599999999999999 | AE318: 85.85 | AF318: 89.66 | AG318: 0.87 | AH318: AA- | AI318: 6.3899999999999998e-002 | AJ318: =H318+100*O318 -> 153.69999999999999 | AK318: 154.1 | AL318: 309 | AM318: 64.4 | AN318: 308 | AO318: 0.503 | AP318: 21 | AQ318: 思特转债!
A319: 310 | B319: 128046 | C319: 利尔转债!! | D319: 2258. | E319: 利尔化学 | F319: 化工 | G319: 农化 | H319: 131.7 | I319: -1.6399999999999998e-002 | J319: -1.9599999999999999e-002 | K319: 22.81 | L319: -3.5900000000000001e-002 | M319: 112.3 | N319: 18.42 | O319: 6.4000000000000001e-002 | P319: 123.83 | Q319: 转股中 | R319: 3.33年 | S319: 1.33年 | T319: 8.47 | U319: 17 | V319: 1.4999999999999999e-002 | W319: 7.0999999999999994e-002 | X319: 8.8000000000000009e-002 | Y319: 120 | Z319: 3.07 | AA319: -4.7599999999999996e-002 | AB319: -5.3899999999999997e-002 | AC319: -0.13800000000000001 | AD319: -0.14099999999999999 | AE319: 96.59 | AF319: 97.93 | AG319: 1 | AH319: AA | AI319: 4.2900000000000001e-002 | AJ319: =H319+100*O319 -> 138.09999999999999 | AK319: 139.6 | AL319: 256 | AM319: 41.6 | AN319: 210 | AO319: -4.8000000000000001e-002 | AP319: 9 | AQ319: 利尔转债!!
A320: 305 | B320: 110048 | C320: 福能转债! | D320: 600483 | E320: 福能股份 | F320: 能源电力 | G320: 电力供应 | H320: 134.04 | I320: -3.8e-003 | J320: -6.0999999999999995e-003 | K320: 10.89 | L320: -1.18e-002 | M320: 113.3 | N320: 8.12 | O320: -1.e-003 | P320: 134.11 | Q320: 转股中 | R320: 3.47年 | S320: 1.47年 | T320: 19.9 | U320: 38 | V320: 1.3999999999999999e-002 | W320: 0.10300000000000001 | X320: 0.13699999999999998 | Y320: 194 | Z320: 1.23 | AA320: -4.82e-002 | AB320: -5.4600000000000003e-002 | AC320: -0.13200000000000001 | AD320: -0.13400000000000001 | AE320: 96.47 | AF320: 99.19 | AG320: 0.84 | AH320: AA+ | AI320: 3.9900000000000005e-002 | AJ320: =H320+100*O320 -> 133.94 | AK320: 134 | AL320: 214 | AM320: 34.8 | AN320: 146 | AO320: 4.7e-002 | AP320: 9 | AQ320: 福能转债!
A321: 187 | B321: 113034 | C321: 滨化转债! | D321: 601678 | E321: 滨化股份 | F321: 化工 | G321: 化工 | H321: 148.4 | I321: -5.0000000000000001e-003 | J321: 3.7000000000000002e-003 | K321: 6.81 | L321: -1.5e-003 | M321: 114.8 | N321: 4.58 | O321: -2.e-003 | P321: 148.69 | Q321: 转股中 | R321: 4.81年 | S321: 2.81年 | T321: 5.99 | U321: 40 | V321: 4.4999999999999998e-002 | W321: 4.5999999999999999e-002 | X321: 6.8000000000000005e-002 | Y321: 131 | Z321: 1.49 | AA321: -5.28e-002 | AB321: -5.79e-002 | AC321: -0.114 | AD321: -0.115 | AE321: 91.24 | AF321: 94.15 | AG321: 0.87 | AH321: AA | AI321: 4.2900000000000001e-002 | AJ321: =H321+100*O321 -> 148.20000000000002 | AK321: 148.1 | AL321: 290 | AM321: 54 | AN321: 283 | AO321: -9.0000000000000011e-003 | AP321: 24 | AQ321: 滨化转债!
A322: 216 | B322: 123042 | C322: 银河转债! | D322: 300619 | E322: 金银河 | F322: 机械装备 | G322: 专用设备 | H322: 147.38 | I322: 0.10300000000000001 | J322: 3.7000000000000005e-002 | K322: 25.36 | L322: 0.20000000000000001 | M322: 115.4 | N322: 24.4 | O322: 0.41799999999999998 | P322: 103.93 | Q322: 转股中 | R322: 4.57年 | S322: 2.58年 | T322: 1.67 | U322: 2543. | V322: 10.31 | W322: 8.8000000000000009e-002 | X322: 9.1999999999999998e-002 | Y322: 19 | Z322: 3.88 | AA322: -5.3099999999999994e-002 | AB322: -5.8600000000000006e-002 | AC322: -0.12 | AD322: -0.122 | AE322: 85.3 | AF322: 83.58 | AG322: 0.7 | AH322: A+ | AI322: 7.4900000000000008e-002 | AJ322: =H322+100*O322 -> 189.18000000000001 | AK322: 190.8 | AL322: 342 | AM322: 105.5 | AN322: 345 | AO322: 0.23399999999999999 | AP322: 22 | AQ322: 银河转债!
A323: 73 | B323: 113611 | C323: 福20转债 | D323: 603806 | E323: 福斯特 | F323: 能源电力 | G323: 太阳能 | H323: 153 | I323: 3.7400000000000003e-002 | J323: -1.5e-003 | K323: 94.06 | L323: 4.0300000000000002e-002 | M323: 111.85 | N323: 61.03 | O323: -6.9999999999999993e-003 | P323: 154.12 | Q323: 转股中 | R323: 5.45年 | S323: 3.46年 | T323: 16.4 | U323: 430 | V323: 0.17199999999999999 | W323: 1.9e-002 | X323: 2.8999999999999998e-002 | Y323: 869 | Z323: 7.91 | AA323: -5.6500000000000002e-002 | AB323: -6.0100000000000001e-002 | AC323: -0.10199999999999999 | AD323: -0.10300000000000001 | AE323: 87.89 | AF323: 88.7 | AG323: 0.89 | AH323: AA | AI323: 4.41e-002 | AJ323: =H323+100*O323 -> 152.30000000000001 | AK323: 151.9 | AL323: 302 | AM323: 63.2 | AN323: 307 | AO323: 0.16 | AP323: 5 | AQ323: 福20转债
A324: 226 | B324: 113559 | C324: 永创转债!!* | D324: 603901 | E324: 永创智能 | F324: 机械装备 | G324: 专用设备 | H324: 153.23 | I324: 8.8000000000000005e-003 | J324: 5.1999999999999998e-003 | K324: 16.01 | L324: 1.3899999999999999e-002 | M324: 118.3 | N324: 10.32 | O324: -1.2e-002 | P324: 155.14 | Q324: 转股中 | R324: 4.51年 | S324: 2.52年 | T324: 1.42 | U324: 140 | V324: 0.64800000000000002 | W324: 2.e-002 | X324: 3.1e-002 | Y324: 70 | Z324: 4.82 | AA324: -5.7000000000000002e-002 | AB324: -6.3399999999999998e-002 | AC324: -0.13300000000000001 | AD324: -0.13600000000000001 | AE324: 88.61 | AF324: 90.12 | AG324: 1 | AH324: AA- | AI324: 6.3899999999999998e-002 | AJ324: =H324+100*O324 -> 152.03 | AK324: 151.3 | AL324: 301 | AM324: 61.2 | AN324: 303 | AO324: 8.0000000000000002e-003 | AP324: 17 | AQ324: 永创转债!!*
A325: 88 | B325: 113041 | C325: 紫金转债!* | D325: 601899 | E325: 紫金矿业 | F325: 有色金属 | G325: 贵金属 | H325: 139.5 | I325: -9.0000000000000011e-003 | J325: -1.1000000000000001e-003 | K325: 9.77 | L325: -1.01e-002 | M325: 108 | N325: 7 | O325: -1.e-003 | P325: 139.57 | Q325: 转股中 | R325: 4.38年 | S325: 2.38年 | T325: 30 | U325: 746 | V325: 0.18100000000000002 | W325: 1.2e-002 | X325: 1.7000000000000001e-002 | Y325: 2497. | Z325: 4.63 | AA325: -5.7200000000000001e-002 | AB325: -6.0400000000000002e-002 | AC325: -0.11800000000000001 | AD325: -0.11800000000000001 | AE325: 92.22 | AF325: 91.9 | AG325: 1 | AH325: AAA | AI325: 3.7900000000000003e-002 | AJ325: =H325+100*O325 -> 139.40000000000001 | AK325: 139.4 | AL325: 255 | AM325: 47.2 | AN325: 251 | AO325: -0.10400000000000001 | AP325: 8 | AQ325: 紫金转债!*
A326: 287 | B326: 123022 | C326: 长信转债!! | D326: 300088 | E326: 长信科技 | F326: 通信互联 | G326: 通信设备 | H326: 142.752 | I326: 8.6999999999999994e-003 | J326: 1.44e-002 | K326: 8.21 | L326: 2.75e-002 | M326: 114.3 | N326: 6.05 | O326: 5.2000000000000005e-002 | P326: 135.7 | Q326: 转股中 | R326: 3.75年 | S326: 1.75年 | T326: 2.57 | U326: 70 | V326: 0.19 | W326: 1.3000000000000001e-002 | X326: 1.7000000000000001e-002 | Y326: 202 | Z326: 2.79 | AA326: -5.8600000000000006e-002 | AB326: -6.480000000000001e-002 | AC326: -0.13 | AD326: -0.13200000000000001 | AE326: 94.91 | AF326: 97.94 | AG326: 0.84 | AH326: AA | AI326: 4.2900000000000001e-002 | AJ326: =H326+100*O326 -> 147.952 | AK326: 149.8 | AL326: 298 | AM326: 51.9 | AN326: 269 | AO326: 1.2e-002 | AP326: 12 | AQ326: 长信转债!!
A327: 241 | B327: 113548 | C327: 石英转债! | D327: 603688 | E327: 石英股份 | F327: 电子 | G327: 电子产品 | H327: 161.21 | I327: 1.38e-002 | J327: -7.8000000000000005e-003 | K327: 23.18 | L327: 6.9999999999999993e-003 | M327: 124.4 | N327: 14.93 | O327: 3.7999999999999999e-002 | P327: 155.26 | Q327: 转股中 | R327: 4.36年 | S327: 2.36年 | T327: 1.23 | U327: 160 | V327: 0.82200000000000006 | W327: 1.4999999999999999e-002 | X327: 2.3e-002 | Y327: 82 | Z327: 4.15 | AA327: -5.9000000000000004e-002 | AB327: -6.7500000000000004e-002 | AC327: -0.115 | AD327: -0.11599999999999999 | AE327: 89.38 | AF327: 95.61 | AG327: 0.86 | AH327: AA- | AI327: 6.3899999999999998e-002 | AJ327: =H327+100*O327 -> 165.01000000000002 | AK327: 167.2 | AL327: 330 | AM327: 71.6 | AN327: 325 | AO327: 0.16 | AP327: 13 | AQ327: 石英转债!
A328: 208 | B328: 110066 | C328: 盛屯转债!! | D328: 600711 | E328: 盛屯矿业 | F328: 有色金属 | G328: 有色行业 | H328: 152.26 | I328: 2.5899999999999999e-002 | J328: -1.7299999999999999e-002 | K328: 7.05 | L328: 1.e-002 | M328: 114.9 | N328: 4.88 | O328: 5.4000000000000006e-002 | P328: 144.47 | Q328: 转股中 | R328: 4.70年 | S328: 2.70年 | T328: 5.22 | U328: 168 | V328: 0.21600000000000003 | W328: 2.7999999999999997e-002 | X328: 4.0000000000000001e-002 | Y328: 189 | Z328: 1.68 | AA328: -5.91e-002 | AB328: -6.4199999999999993e-002 | AC328: -0.125 | AD328: -0.127 | AE328: 91.75 | AF328: 94.67 | AG328: 0.86 | AH328: AA | AI328: 4.2900000000000001e-002 | AJ328: =H328+100*O328 -> 157.66 | AK328: 160.1 | AL328: 319 | AM328: 65.4 | AN328: 312 | AO328: -8.9999999999999997e-002 | AP328: 33 | AQ328: 盛屯转债!!
A329: 123 | B329: 110074 | C329: 精达转债!! | D329: 600577 | E329: 精达股份 | F329: 电子 | G329: 电子产品 | H329: 161.5 | I329: 0.10400000000000001 | J329: -1.3100000000000001e-002 | K329: 6 | L329: 0.10099999999999999 | M329: 117.3 | N329: 3.73 | O329: 4.0000000000000001e-003 | P329: 160.86 | Q329: 转股中 | R329: 5.17年 | S329: 3.17年 | T329: 7.33 | U329: 1113. | V329: 0.96099999999999997 | W329: 6.4000000000000001e-002 | X329: 0.10199999999999999 | Y329: 115 | Z329: 3.04 | AA329: -6.1100000000000002e-002 | AB329: -6.6400000000000001e-002 | AC329: -0.122 | AD329: -0.124 | AE329: 90.03 | AF329: 94.29 | AG329: 0.9 | AH329: AA | AI329: 4.41e-002 | AJ329: =H329+100*O329 -> 161.90000000000001 | AK329: 162.1 | AL329: 323 | AM329: 67.8 | AN329: 323 | AO329: 0.127 | AP329: 12 | AQ329: 精达转债!!
A330: 163 | B330: 128113 | C330: 比音转债! | D330: 2832. | E330: 比音勒芬 | F330: 服装纺织 | G330: 服装行业 | H330: 163 | I330: 6.1100000000000002e-002 | J330: -3.8e-003 | K330: 24.47 | L330: 6.25e-002 | M330: 116.9 | N330: 14.9 | O330: -6.9999999999999993e-003 | P330: 164.23 | Q330: 转股中 | R330: 4.99年 | S330: 2.99年 | T330: 3.54 | U330: 362 | V330: 0.63200000000000001 | W330: 2.7000000000000003e-002 | X330: 4.4000000000000004e-002 | Y330: 134 | Z330: 5.06 | AA330: -6.54e-002 | AB330: -7.0800000000000002e-002 | AC330: -0.13200000000000001 | AD330: -0.13400000000000001 | AE330: 90.65 | AF330: 95.15 | AG330: 0.92 | AH330: AA | AI330: 4.2900000000000001e-002 | AJ330: =H330+100*O330 -> 162.30000000000001 | AK330: 161.8 | AL330: 322 | AM330: 66.6 | AN330: 320 | AO330: 8.0000000000000002e-002 | AP330: 8 | AQ330: 比音转债!
A331: 193 | B331: 128103 | C331: 同德转债! | D331: 2360. | E331: 同德化工 | F331: 化工 | G331: 化工 | H331: 168.3 | I331: -3.9399999999999998e-002 | J331: 6.0899999999999996e-002 | K331: 7.6 | L331: 2.1499999999999998e-002 | M331: 121.3 | N331: 5.08 | O331: 0.125 | P331: 149.61 | Q331: 转股中 | R331: 4.77年 | S331: 2.77年 | T331: 1.09 | U331: 379 | V331: 2.0099999999999998 | W331: 3.6000000000000004e-002 | X331: 5.4000000000000006e-002 | Y331: 30 | Z331: 2.36 | AA331: -6.7699999999999996e-002 | AB331: -7.4499999999999997e-002 | AC331: -0.14899999999999999 | AD331: -0.10099999999999999 | AE331: 84.48 | AF331: 86.65 | AG331: 1 | AH331: A+ | AI331: 7.4900000000000008e-002 | AJ331: =H331+100*O331 -> 180.80000000000001 | AK331: 187 | AL331: 340 | AM331: 100.3 | AN331: 343 | AO331: 1.8000000000000002e-002 | AP331: 13 | AQ331: 同德转债!
A332: 235 | B332: 113550 | C332: 常汽转债! | D332: 603035 | E332: 常熟汽饰 | F332: 汽车 | G332: 零部件制 | H332: 164.39 | I332: 1.61e-002 | J332: 1.43e-002 | K332: 15.3 | L332: 3.3799999999999997e-002 | M332: 121.3 | N332: 9.33 | O332: 2.e-003 | P332: 163.99 | Q332: 转股中 | R332: 4.42年 | S332: 2.42年 | T332: 2.3 | U332: 1003. | V332: 2.6400000000000001 | W332: 4.2999999999999997e-002 | X332: 7.0000000000000007e-002 | Y332: 54 | Z332: 1.43 | AA332: -6.7900000000000002e-002 | AB332: -7.5300000000000006e-002 | AC332: -0.115 | AD332: -0.11699999999999999 | AE332: 88.98 | AF332: 92.91 | AG332: 0.9 | AH332: AA- | AI332: 6.3899999999999998e-002 | AJ332: =H332+100*O332 -> 164.58999999999997 | AK332: 164.8 | AL332: 326 | AM332: 71.9 | AN332: 326 | AO332: 5.0000000000000001e-003 | AP332: 17 | AQ332: 常汽转债!
A333: 341 | B333: 128032 | C333: 双环转债! | D333: 2472. | E333: 双环传动 | F333: 机械装备 | G333: 通用设备 | H333: 131.534 | I333: -8.3000000000000001e-003 | J333: 6.3e-003 | K333: 13.1 | L333: -2.3e-003 | M333: 109.3 | N333: 9.87 | O333: -9.0000000000000011e-003 | P333: 132.73 | Q333: 转股中 | R333: 2.52年 | S333: 0.52年 | T333: 7.82 | U333: 70 | V333: 6.8000000000000005e-002 | W333: 8.5999999999999993e-002 | X333: 0.115 | Y333: 91 | Z333: 2.57 | AA333: -7.2000000000000008e-002 | AB333: -7.8100000000000003e-002 | AC333: -0.34100000000000003 | AD333: -0.34499999999999997 | AE333: 99.01 | AF333: 98.86 | AG333: 0.87 | AH333: AA | AI333: 4.1399999999999999e-002 | AJ333: =H333+100*O333 -> 130.63399999999999 | AK333: 130.3 | AL333: 175 | AM333: 31.3 | AN333: 109 | AO333: 3.1e-002 | AP333: 38 | AQ333: 双环转债!
A334: 361 | B334: 113012 | C334: 骆驼转债! | D334: 601311 | E334: 骆驼股份 | F334: 汽车 | G334: 零部件制 | H334: 121.64 | I334: 1.5100000000000001e-002 | J334: 1.8e-003 | K334: 11.01 | L334: 2.5099999999999997e-002 | M334: 106.5 | N334: 10.06 | O334: 0.111 | P334: 109.44 | Q334: 转股中 | R334: 1.76年 | S334: 回售内 | T334: 5.09 | U334: 8.9 | V334: 1.3999999999999999e-002 | W334: 4.0999999999999995e-002 | X334: 4.4999999999999998e-002 | Y334: 124 | Z334: 1.63 | AA334: -7.3099999999999998e-002 | AB334: -7.9500000000000001e-002 | AC334: 回售内 | AD334: 回售内 | AE334: 100.25 | AF334: 99.2 | AG334: 0.67 | AH334: AA | AI334: 4.1399999999999999e-002 | AJ334: =H334+100*O334 -> 132.74000000000001 | AK334: 133.8 | AL334: 212 | AM334: 33.6 | AN334: 135 | AO334: -5.9000000000000004e-002 | AP334: 16 | AQ334: 骆驼转债!
A335: 274 | B335: 113534 | C335: 鼎胜转债! | D335: 603876 | E335: 鼎胜新材 | F335: 有色金属 | G335: 小金属 | H335: 152.16 | I335: -1.7899999999999999e-002 | J335: -9.1999999999999998e-003 | K335: 22.92 | L335: -2.9999999999999999e-002 | M335: 114.3 | N335: 15.18 | O335: 8.0000000000000002e-003 | P335: 150.99 | Q335: 转股中 | R335: 3.81年 | S335: 1.81年 | T335: 8.93 | U335: 553 | V335: 0.40000000000000002 | W335: 8.9999999999999997e-002 | X335: 0.13600000000000001 | Y335: 99 | Z335: 2.74 | AA335: -7.3499999999999996e-002 | AB335: -7.9600000000000004e-002 | AC335: -0.14599999999999999 | AD335: -0.14699999999999999 | AE335: 94.67 | AF335: 97.7 | AG335: 0.9 | AH335: AA | AI335: 4.2900000000000001e-002 | AJ335: =H335+100*O335 -> 152.96000000000001 | AK335: 153.3 | AL335: 308 | AM335: 55.6 | AN335: 288 | AO335: 0.32299999999999995 | AP335: 36 | AQ335: 鼎胜转债!
A336: 367 | B336: 110033 | C336: 国贸转债! | D336: 600755 | E336: 厦门国贸 | F336: 交通运输 | G336: 交通运输 | H336: 112.72 | I336: -4.0000000000000002e-004 | J336: 2.8000000000000004e-003 | K336: 7.93 | L336: 3.8e-003 | M336: 108 | N336: 7.18 | O336: 2.1000000000000001e-002 | P336: 110.45 | Q336: 转股中 | R336: 0.55年 | S336: 回售内 | T336: 11.7 | U336: 64 | V336: 4.9000000000000002e-002 | W336: 7.5999999999999998e-002 | X336: 8.4000000000000005e-002 | Y336: 154 | Z336: 0.96 | AA336: -7.4700000000000003e-002 | AB336: -9.9499999999999991e-002 | AC336: 回售内 | AD336: 回售内 | AE336: 100.33 | AF336: 106.07 | AG336: 0.62 | AH336: AAA | AI336: 3.3300000000000003e-002 | AJ336: =H336+100*O336 -> 114.81999999999999 | AK336: 115 | AL336: 18 | AM336: 8.9 | AN336: 2 | AO336: 5.2000000000000005e-002 | AP336: 19 | AQ336: 国贸转债!
A337: 266 | B337: 113537 | C337: 文灿转债!! | D337: 603348 | E337: XD文灿股 | F337: 汽车 | G337: 零部件制 | H337: 167.02 | I337: 4.0399999999999998e-002 | J337: -9.5999999999999992e-003 | K337: 31.16 | L337: 3.4200000000000001e-002 | M337: 120.7 | N337: 19.28 | O337: 3.3000000000000002e-002 | P337: 161.62 | Q337: 转股中 | R337: 3.98年 | S337: 1.98年 | T337: 1.44 | U337: 423 | V337: 1.78 | W337: 1.8000000000000002e-002 | X337: 2.7999999999999997e-002 | Y337: 81 | Z337: 3.14 | AA337: -7.9899999999999999e-002 | AB337: -8.7799999999999989e-002 | AC337: -0.154 | AD337: -0.156 | AE337: 90.82 | AF337: 94.86 | AG337: 0.9 | AH337: AA- | AI337: 6.3899999999999998e-002 | AJ337: =H337+100*O337 -> 170.32000000000002 | AK337: 172.4 | AL337: 334 | AM337: 77.6 | AN337: 332 | AO337: 7.4999999999999997e-002 | AP337: 25 | AQ337: 文灿转债!!
A338: 239 | B338: 123034 | C338: 通光转债! | D338: 300265 | E338: 通光线缆 | F338: 通信互联 | G338: 通信设备 | H338: 173.01 | I338: -2.2000000000000001e-003 | J338: -9.7000000000000003e-003 | K338: 9.19 | L338: -1.61e-002 | M338: 118 | N338: 7.97 | O338: 0.5 | P338: 115.31 | Q338: 转股中 | R338: 4.38年 | S338: 2.38年 | T338: 0.78 | U338: 45 | V338: 0.33399999999999996 | W338: 2.3e-002 | X338: 2.7000000000000003e-002 | Y338: 34 | Z338: 2.58 | AA338: -8.5099999999999995e-002 | AB338: -9.1400000000000009e-002 | AC338: -0.13 | AD338: -0.13100000000000001 | AE338: 86.29 | AF338: 86.61 | AG338: 0.74 | AH338: A+ | AI338: 7.4900000000000008e-002 | AJ338: =H338+100*O338 -> 223.00999999999999 | AK338: 230.7 | AL338: 351 | AM338: 144.1 | AN338: 351 | AO338: 3.2000000000000001e-002 | AP338: 21 | AQ338: 通光转债!
A339: 333 | B339: 113504 | C339: 艾华转债!! | D339: 603989 | E339: 艾华集团 | F339: 电子 | G339: 元器件制 | H339: 139.5 | I339: -5.7999999999999996e-003 | J339: -1.4000000000000002e-003 | K339: 29.33 | L339: -8.1000000000000013e-003 | M339: 109.3 | N339: 21.13 | O339: 5.0000000000000001e-003 | P339: 138.81 | Q339: 转股中 | R339: 2.70年 | S339: 0.70年 | T339: 4.94 | U339: 20 | V339: 2.8999999999999998e-002 | W339: 4.2000000000000003e-002 | X339: 5.9000000000000004e-002 | Y339: 117 | Z339: 4.35 | AA339: -8.7499999999999994e-002 | AB339: -9.3100000000000002e-002 | AC339: -0.315 | AD339: -0.318 | AE339: 98.28 | AF339: 98.12 | AG339: 0.9 | AH339: AA | AI339: 4.1399999999999999e-002 | AJ339: =H339+100*O339 -> 140. | AK339: 140.2 | AL339: 262 | AM339: 41.9 | AN339: 212 | AO339: -9.0000000000000011e-003 | AP339: 9 | AQ339: 艾华转债!!
A340: 338 | B340: 128033 | C340: 迪龙转债! | D340: 2658. | E340: 雪迪龙 | F340: 城市公用 | G340: 三废处理 | H340: 137.688 | I340: -1.3600000000000001e-002 | J340: 2.3099999999999999e-002 | K340: 9.29 | L340: 1.5300000000000001e-002 | M340: 108.8 | N340: 8.71 | O340: 0.29100000000000004 | P340: 106.66 | Q340: 转股中 | R340: 2.53年 | S340: 0.53年 | T340: 2.98 | U340: 292 | V340: 0.70999999999999996 | W340: 5.0999999999999997e-002 | X340: 5.4000000000000006e-002 | Y340: 59 | Z340: 2.45 | AA340: -9.0200000000000002e-002 | AB340: -9.5899999999999999e-002 | AC340: -0.39200000000000002 | AD340: -0.39600000000000002 | AE340: 98.74 | AF340: 98.36 | AG340: 0.62 | AH340: AA | AI340: 4.1399999999999999e-002 | AJ340: =H340+100*O340 -> 166.78799999999998 | AK340: 168.7 | AL340: 332 | AM340: 70 | AN340: 324 | AO340: -0.114 | AP340: 35 | AQ340: 迪龙转债!
A341: 249 | B341: 113545 | C341: 金能转债! | D341: 603113 | E341: 金能科技 | F341: 煤炭 | G341: 炼焦 | H341: 175.08 | I341: 8.8000000000000005e-003 | J341: -4.5999999999999999e-003 | K341: 18.16 | L341: 4.4000000000000003e-003 | M341: 114.9 | N341: 10.43 | O341: 6.0000000000000001e-003 | P341: 174.11 | Q341: 转股中 | R341: 4.32年 | S341: 2.32年 | T341: 10.2 | U341: 80 | V341: 4.4999999999999998e-002 | W341: 6.6000000000000003e-002 | X341: 0.115 | Y341: 155 | Z341: 1.86 | AA341: -9.4499999999999987e-002 | AB341: -9.9700000000000011e-002 | AC341: -0.13699999999999998 | AD341: -0.13800000000000001 | AE341: 93.24 | AF341: 96.2 | AG341: 0.94 | AH341: AA | AI341: 4.2900000000000001e-002 | AJ341: =H341+100*O341 -> 175.68000000000001 | AK341: 176 | AL341: 337 | AM341: 79.9 | AN341: 335 | AO341: -4.2999999999999997e-002 | AP341: 17 | AQ341: 金能转债!
A342: 254 | B342: 123030 | C342: 九洲转债! | D342: 300040 | E342: 九洲集团 | F342: 能源电力 | G342: 电力设备 | H342: 183.625 | I342: 3.5999999999999999e-003 | J342: 1.32e-002 | K342: 9.25 | L342: 1.8700000000000001e-002 | M342: 120 | N342: 5.65 | O342: 0.122 | P342: 163.72 | Q342: 转股中 | R342: 4.17年 | S342: 2.17年 | T342: 0.97 | U342: 174 | V342: 0.97900000000000009 | W342: 2.7000000000000003e-002 | X342: 4.4999999999999998e-002 | Y342: 35 | Z342: 1.58 | AA342: -9.8699999999999996e-002 | AB342: -0.106 | AC342: -0.159 | AD342: -0.16 | AE342: 89.7 | AF342: 93.22 | AG342: 0.9 | AH342: AA- | AI342: 6.3899999999999998e-002 | AJ342: =H342+100*O342 -> 195.82499999999999 | AK342: 203.5 | AL342: 346 | AM342: 110.3 | AN342: 346 | AO342: -2.e-002 | AP342: 25 | AQ342: 九洲转债!
A343: 273 | B343: 113025 | C343: 明泰转债!! | D343: 601677 | E343: 明泰铝业 | F343: 有色金属 | G343: 铝金属 | H343: 170.22 | I343: -1.46e-002 | J343: -9.7000000000000003e-003 | K343: 18.39 | L343: -2.6000000000000002e-002 | M343: 114.5 | N343: 11 | O343: 1.8000000000000002e-002 | P343: 167.18 | Q343: 转股中 | R343: 3.81年 | S343: 1.81年 | T343: 11 | U343: 38 | V343: 2.e-002 | W343: 8.6999999999999994e-002 | X343: 0.14599999999999999 | Y343: 125 | Z343: 1.39 | AA343: -0.10000000000000001 | AB343: -0.106 | AC343: -0.17899999999999999 | AD343: -0.17999999999999999 | AE343: 94.69 | AF343: 97.86 | AG343: 0.94 | AH343: AA | AI343: 4.2900000000000001e-002 | AJ343: =H343+100*O343 -> 172.02000000000001 | AK343: 173.3 | AL343: 335 | AM343: 75.4 | AN343: 330 | AO343: -2.6000000000000002e-002 | AP343: 24 | AQ343: 明泰转债!!
A344: 211 | B344: 128097 | C344: 奥佳转债! | D344: 2614. | E344: 奥佳华 | F344: 机械装备 | G344: 专用设备 | H344: 193 | I344: 7.0999999999999994e-002 | J344: -5.0000000000000001e-004 | K344: 20.05 | L344: 7.3899999999999993e-002 | M344: 114.9 | N344: 10.39 | O344: 0. | P344: 192.97 | Q344: 转股中 | R344: 4.69年 | S344: 2.69年 | T344: 4.71 | U344: 689 | V344: 0.755 | W344: 3.7999999999999999e-002 | X344: 7.2999999999999995e-002 | Y344: 125 | Z344: 2.73 | AA344: -0.106 | AB344: -0.111 | AC344: -0.128 | AD344: -0.129 | AE344: 91.81 | AF344: 94.72 | AG344: 0.95 | AH344: AA | AI344: 4.2900000000000001e-002 | AJ344: =H344+100*O344 -> 193. | AK344: 193 | AL344: 343 | AM344: 98.3 | AN344: 342 | AO344: 0.127 | AP344: 21 | AQ344: 奥佳转债!
A345: 314 | B345: 123014 | C345: 凯发转债! | D345: 300407 | E345: 凯发电气 | F345: 能源电力 | G345: 电力设备 | H345: 138.001 | I345: -5.4299999999999994e-002 | J345: 3.8699999999999998e-002 | K345: 7.24 | L345: -3.6000000000000004e-002 | M345: 108.5 | N345: 8.05 | O345: 0.53400000000000003 | P345: 89.94 | Q345: 转股中 | R345: 2年39天 | S345: 39天 | T345: 1.16 | U345: 297 | V345: 1.8300000000000001 | W345: 5.2999999999999999e-002 | X345: 4.7e-002 | Y345: 22 | Z345: 1.62 | AA345: -0.109 | AB345: -0.11599999999999999 | AC345: -1.052 | AD345: -1.0580000000000001 | AE345: 99.32 | AF345: 93.68 | AG345: 0.43 | AH345: A+ | AI345: 7.3399999999999993e-002 | AJ345: =H345+100*O345 -> 191.40100000000001 | AK345: 186.1 | AL345: 339 | AM345: 86.7 | AN345: 338 | AO345: 6.5000000000000002e-002 | AP345: 16 | AQ345: 凯发转债!
A346: 196 | B346: 123046 | C346: 天铁转债! | D346: 300587 | E346: 天铁股份 | F346: 铁路 | G346: 铁路设备 | H346: 219.2 | I346: 2.0199999999999999e-002 | J346: -1.1000000000000001e-003 | K346: 22.22 | L346: 1.9699999999999999e-002 | M346: 117.7 | N346: 10.12 | O346: -2.e-003 | P346: 219.57 | Q346: 转股中 | R346: 4.75年 | S346: 2.75年 | T346: 0.65 | U346: 173 | V346: 1.22 | W346: 9.0000000000000011e-003 | X346: 1.9e-002 | Y346: 76 | Z346: 4.67 | AA346: -0.125 | AB346: -0.13 | AC346: -0.14199999999999999 | AD346: -0.14300000000000002 | AE346: 86.64 | AF346: 88.26 | AG346: 0.97 | AH346: AA- | AI346: 6.3899999999999998e-002 | AJ346: =H346+100*O346 -> 219. | AK346: 218.8 | AL346: 350 | AM346: 130.6 | AN346: 350 | AO346: 0.16500000000000001 | AP346: 13 | AQ346: 天铁转债!
A347: 355 | B347: 128017 | C347: 金禾转债!! | D347: 2597. | E347: 金禾实业 | F347: 化工 | G347: 化工 | H347: 150.299 | I347: -4.5999999999999999e-003 | J347: -1.8799999999999997e-002 | K347: 30.59 | L347: -2.6099999999999998e-002 | M347: 108.8 | N347: 21.97 | O347: 7.9000000000000001e-002 | P347: 139.24 | Q347: 转股中 | R347: 2.37年 | S347: 0.37年 | T347: 5.52 | U347: 45 | V347: 5.4000000000000006e-002 | W347: 3.2000000000000001e-002 | X347: 4.4999999999999998e-002 | Y347: 172 | Z347: 3.42 | AA347: -0.129 | AB347: -0.13500000000000001 | AC347: -0.63200000000000001 | AD347: -0.63600000000000001 | AE347: 99.36 | AF347: 98.97 | AG347: 0.9 | AH347: AA | AI347: 4.1399999999999999e-002 | AJ347: =H347+100*O347 -> 158.19900000000001 | AK347: 161.4 | AL347: 321 | AM347: 62 | AN347: 306 | AO347: -0.11199999999999999 | AP347: 10 | AQ347: 金禾转债!!
A348: 288 | B348: 110055 | C348: 伊力转债!! | D348: 600197 | E348: 伊力特 | F348: 食品饮料 | G348: 白酒 | H348: 194.93 | I348: 4.0000000000000001e-003 | J348: 2.4199999999999999e-002 | K348: 32.81 | L348: 2.92e-002 | M348: 114.3 | N348: 16.81 | O348: -1.e-003 | P348: 195.18 | Q348: 转股中 | R348: 3.74年 | S348: 1.74年 | T348: 2.46 | U348: 2003. | V348: 4.1399999999999997 | W348: 1.6e-002 | X348: 3.1e-002 | Y348: 154 | Z348: 4.31 | AA348: -0.13500000000000001 | AB348: -0.14099999999999999 | AC348: -0.22399999999999998 | AD348: -0.22500000000000001 | AE348: 94.94 | AF348: 97.98 | AG348: 0.97 | AH348: AA | AI348: 4.2900000000000001e-002 | AJ348: =H348+100*O348 -> 194.83000000000001 | AK348: 194.7 | AL348: 344 | AM348: 96.7 | AN348: 340 | AO348: 6.3e-002 | AP348: 23 | AQ348: 伊力转债!!
A349: 298 | B349: 113527 | C349: 维格转债!! | D349: 603518 | E349: 锦泓集团 | F349: 服装纺织 | G349: 服装行业 | H349: 201.22 | I349: 4.6900000000000004e-002 | J349: 1.0700000000000001e-002 | K349: 20.16 | L349: 5.9900000000000002e-002 | M349: 119.5 | N349: 9.85 | O349: -1.7000000000000001e-002 | P349: 204.67 | Q349: 转股中 | R349: 3.60年 | S349: 1.60年 | T349: 4.61 | U349: 2802. | V349: 3.02 | W349: 8.1000000000000003e-002 | X349: 0.16600000000000001 | Y349: 57 | Z349: 2.66 | AA349: -0.13699999999999998 | AB349: -0.14400000000000002 | AC349: -0.254 | AD349: -0.25600000000000001 | AE349: 93.94 | AF349: 99.59 | AG349: 0.96 | AH349: AA | AI349: 5.2900000000000003e-002 | AJ349: =H349+100*O349 -> 199.52000000000001 | AK349: 197.8 | AL349: 345 | AM349: 98.2 | AN349: 341 | AO349: -1.2e-002 | AP349: 87 | AQ349: 维格转债!!
A350: 258 | B350: 113543 | C350: 欧派转债! | D350: 603833 | E350: 欧派家居 | F350: 其他 | G350: 家居用品 | H350: 210.04 | I350: -2.0899999999999998e-002 | J350: -4.6999999999999993e-003 | K350: 147.4 | L350: -2.64e-002 | M350: 114.9 | N350: 70.49 | O350: 4.0000000000000001e-003 | P350: 209.11 | Q350: 转股中 | R350: 4年58天 | S350: 3年59天 | T350: 3.19 | U350: 45 | V350: 6.6000000000000003e-002 | W350: 4.0000000000000001e-003 | X350: 8.0000000000000002e-003 | Y350: 891 | Z350: 7.33 | AA350: -0.13699999999999998 | AB350: -0.14199999999999999 | AC350: -0.111 | AD350: -0.11199999999999999 | AE350: 91.73 | AF350: 96.85 | AG350: 0.97 | AH350: AA | AI350: 4.2900000000000001e-002 | AJ350: =H350+100*O350 -> 210.44 | AK350: 211 | AL350: 348 | AM350: 114.1 | AN350: 348 | AO350: -3.5000000000000003e-002 | AP350: 13 | AQ350: 欧派转债!
A351: 164 | B351: 128111 | C351: 中矿转债! | D351: 2738. | E351: 中矿资源 | F351: 有色金属 | G351: 有色行业 | H351: 265 | I351: 2.7000000000000003e-002 | J351: 8.1000000000000013e-003 | K351: 41.21 | L351: 3.5900000000000001e-002 | M351: 124.2 | N351: 15.47 | O351: -5.0000000000000001e-003 | P351: 266.39 | Q351: 转股中 | R351: 4.98年 | S351: 2.98年 | T351: 1.62 | U351: 770 | V351: 1.8 | W351: 1.2e-002 | X351: 3.3000000000000002e-002 | Y351: 133 | Z351: 3.89 | AA351: -0.14300000000000002 | AB351: -0.14999999999999999 | AC351: -0.14800000000000002 | AD351: -0.14899999999999999 | AE351: 85.84 | AF351: 91.85 | AG351: 0.98 | AH351: AA- | AI351: 6.3899999999999998e-002 | AJ351: =H351+100*O351 -> 264.5 | AK351: 263.6 | AL351: 354 | AM351: 171.8 | AN351: 354 | AO351: 2.7000000000000003e-002 | AP351: 8 | AQ351: 中矿转债!
A352: 176 | B352: 113580 | C352: 康隆转债! | D352: 603665 | E352: 康隆达 | F352: 服装纺织 | G352: 服装行业 | H352: 257.06 | I352: 2.8000000000000004e-003 | J352: -2.0999999999999999e-003 | K352: 14.42 | L352: 1.4000000000000002e-003 | M352: 120.8 | N352: 15.51 | O352: 1.76 | P352: 92.97 | Q352: 转股中 | R352: 4.84年 | S352: 2.85年 | T352: 0.41 | U352: 51 | V352: 0.48100000000000004 | W352: 1.8000000000000002e-002 | X352: 1.7000000000000001e-002 | Y352: 23 | Z352: 2.1 | AA352: -0.14699999999999999 | AB352: -0.152 | AC352: -0.155 | AD352: -0.156 | AE352: 86.22 | AF352: 90.06 | AG352: 0.56 | AH352: AA- | AI352: 6.3899999999999998e-002 | AJ352: =H352+100*O352 -> 433.06 | AK352: 421.1 | AL352: 363 | AM352: 331.1 | AN352: 363 | AO352: -3.4000000000000002e-002 | AP352: 9 | AQ352: 康隆转债!
A353: 174 | B353: 113582 | C353: 火炬转债! | D353: 603678 | E353: 火炬电子 | F353: 电子 | G353: 元器件制 | H353: 256.04 | I353: 2.63e-002 | J353: 1.3899999999999999e-002 | K353: 61.69 | L353: 4.1200000000000001e-002 | M353: 114.9 | N353: 25.33 | O353: 5.0999999999999997e-002 | P353: 243.55 | Q353: 转股中 | R353: 4.94年 | S353: 2.94年 | T353: 4.18 | U353: 154 | V353: 0.14400000000000002 | W353: 1.4999999999999999e-002 | X353: 3.6000000000000004e-002 | Y353: 284 | Z353: 6.98 | AA353: -0.152 | AB353: -0.156 | AC353: -0.14800000000000002 | AD353: -0.14899999999999999 | AE353: 90.85 | AF353: 93.74 | AG353: 0.98 | AH353: AA | AI353: 4.2900000000000001e-002 | AJ353: =H353+100*O353 -> 261.14000000000004 | AK353: 268.5 | AL353: 355 | AM353: 174.8 | AN353: 355 | AO353: 1.3000000000000001e-002 | AP353: 6 | AQ353: 火炬转债!
A354: 300 | B354: 123018 | C354: 溢利转债! | D354: 300381 | E354: 溢多利 | F354: 医药 | G354: 原料药 | H354: 216.412 | I354: -3.0000000000000001e-003 | J354: 9.7999999999999997e-003 | K354: 9.19 | L354: 9.8999999999999991e-003 | M354: 114.3 | N354: 8.32 | O354: 0.95900000000000007 | P354: 110.46 | Q354: 转股中 | R354: 3.50年 | S354: 1.51年 | T354: 0.54 | U354: 54 | V354: 0.45299999999999996 | W354: 1.2e-002 | X354: 1.3000000000000001e-002 | Y354: 45 | Z354: 1.5 | AA354: -0.16899999999999998 | AB354: -0.17499999999999999 | AC354: -0.29199999999999998 | AD354: -0.29299999999999998 | AE354: 92.76 | AF354: 92.4 | AG354: 0.69 | AH354: AA- | AI354: 6.3899999999999998e-002 | AJ354: =H354+100*O354 -> 312.31200000000001 | AK354: 322.4 | AL354: 358 | AM354: 229.6 | AN354: 357 | AO354: -1.e-002 | AP354: 12 | AQ354: 溢利转债!
A355: 342 | B355: 128030 | C355: 天康转债!! | D355: 2100. | E355: 天康生物 | F355: 农业 | G355: 畜牧业 | H355: 182.9 | I355: -3.5799999999999998e-002 | J355: 3.3500000000000002e-002 | K355: 8.5 | L355: -2.3e-003 | M355: 111.3 | N355: 7.39 | O355: 0.58999999999999997 | P355: 115.02 | Q355: 转股中 | R355: 2.51年 | S355: 0.51年 | T355: 0.91 | U355: 15 | V355: 8.900000000000001e-002 | W355: 1.e-002 | X355: 1.1000000000000001e-002 | Y355: 91 | Z355: 1.4 | AA355: -0.182 | AB355: -0.188 | AC355: -0.67599999999999993 | AD355: -0.67900000000000005 | AE355: 99.04 | AF355: 100.7 | AG355: 0.99 | AH355: AA | AI355: 4.1399999999999999e-002 | AJ355: =H355+100*O355 -> 241.90000000000001 | AK355: 250.8 | AL355: 352 | AM355: 150.1 | AN355: 352 | AO355: -0.10300000000000001 | AP355: 11 | AQ355: 天康转债!!
A356: 212 | B356: 128095 | C356: 恩捷转债!! | D356: 2812. | E356: 恩捷股份 | F356: 电子 | G356: 元器件制 | H356: 294.5 | I356: 0. | J356: 0. | K356: 190.48 | L356: 0. | M356: 114.9 | N356: 64.92 | O356: 4.0000000000000001e-003 | P356: 293.41 | Q356: 转股中 | R356: 4.65年 | S356: 2.65年 | T356: 5.54 | U356: 0 | V356: 0. | W356: 3.0000000000000001e-003 | X356: 1.e-002 | Y356: 1692. | Z356: 14.67 | AA356: -0.18600000000000003 | AB356: -0.19 | AC356: -0.18600000000000003 | AD356: -0.187 | AE356: 91.96 | AF356: 94.88 | AG356: 0.98 | AH356: AA | AI356: 4.2900000000000001e-002 | AJ356: =H356+100*O356 -> 294.89999999999998 | AK356: 295.6 | AL356: 356 | AM356: 200.7 | AN356: 356 | AO356: 0.14199999999999999 | AP356: 15 | AQ356: 恩捷转债!!
A357: 359 | B357: 127004 | C357: 模塑转债!! | D357: 700. | E357: 模塑科技 | F357: 汽车 | G357: 零部件制 | H357: 167.981 | I357: 1.8100000000000002e-002 | J357: -1.77e-002 | K357: 5.62 | L357: 4.2699999999999995e-002 | M357: 111.8 | N357: 7.46 | O357: 1.23 | P357: 75.34 | Q357: 转股中 | R357: 1.96年 | S357: 回售内 | T357: 1.32 | U357: 135 | V357: 0.61099999999999999 | W357: 2.6000000000000002e-002 | X357: 1.9e-002 | Y357: 52 | Z357: 1.85 | AA357: -0.18899999999999997 | AB357: -0.19800000000000001 | AC357: 回售内 | AD357: 回售内 | AE357: 100.3 | AF357: 99.22 | AG357: 0.01 | AH357: AA | AI357: 4.1399999999999999e-002 | AJ357: =H357+100*O357 -> 290.98099999999999 | AK357: 260.6 | AL357: 353 | AM357: 160.3 | AN357: 353 | AO357: -4.0000000000000001e-003 | AP357: 31 | AQ357: 模塑转债!!
A358: 326 | B358: 113509 | C358: 新泉转债!! | D358: 603179 | E358: 新泉股份 | F358: 汽车 | G358: 零部件制 | H358: 209.36 | I358: 1.21e-002 | J358: -1.9e-003 | K358: 31.87 | L358: 1.0500000000000001e-002 | M358: 109.3 | N358: 15.25 | O358: 2.e-003 | P358: 208.98 | Q358: 转股中 | R358: 2.96年 | S358: 0.96年 | T358: 0.8 | U358: 118 | V358: 0.69900000000000007 | W358: 6.9999999999999993e-003 | X358: 1.3999999999999999e-002 | Y358: 118 | Z358: 3.32 | AA358: -0.19899999999999998 | AB358: -0.20399999999999999 | AC358: -0.45000000000000001 | AD358: -0.45100000000000001 | AE358: 97.26 | AF358: 97.11 | AG358: 0.98 | AH358: AA | AI358: 4.1399999999999999e-002 | AJ358: =H358+100*O358 -> 209.56 | AK358: 209.7 | AL358: 347 | AM358: 112.5 | AN358: 347 | AO358: 3.7999999999999999e-002 | AP358: 12 | AQ358: 新泉转债!!
A359: 252 | B359: 123031 | C359: 晶瑞转债! | D359: 300655 | E359: 晶瑞股份 | F359: 化工 | G359: 化工 | H359: 293.93 | I359: -2.3199999999999998e-002 | J359: 2.2799999999999997e-002 | K359: 27.08 | L359: -4.0000000000000002e-004 | M359: 115.8 | N359: 10.13 | O359: 0.10000000000000001 | P359: 267.32 | Q359: 转股中 | R359: 4.19年 | S359: 2.20年 | T359: 0.63 | U359: 1112. | V359: 5.9299999999999997 | W359: 6.9999999999999993e-003 | X359: 1.8000000000000002e-002 | Y359: 92 | Z359: 3.85 | AA359: -0.20199999999999999 | AB359: -0.20699999999999999 | AC359: -0.23600000000000002 | AD359: -0.23600000000000002 | AE359: 87.25 | AF359: 86.09 | AG359: 0.98 | AH359: A+ | AI359: 7.4900000000000008e-002 | AJ359: =H359+100*O359 -> 303.93000000000001 | AK359: 320.5 | AL359: 357 | AM359: 233.3 | AN359: 358 | AO359: 9.0999999999999998e-002 | AP359: 16 | AQ359: 晶瑞转债!
A360: 265 | B360: 123027 | C360: 蓝晓转债! | D360: 300487 | E360: 蓝晓科技 | F360: 化工 | G360: 化工 | H360: 297.24 | I360: 2.8000000000000004e-003 | J360: 2.64e-002 | K360: 66.35 | L360: 3.0099999999999998e-002 | M360: 118.8 | N360: 29.22 | O360: 0.309 | P360: 227.07 | Q360: 转股中 | R360: 3.98年 | S360: 1.98年 | T360: 1.07 | U360: 327 | V360: 1.03 | W360: 6.9999999999999993e-003 | X360: 1.7000000000000001e-002 | Y360: 146 | Z360: 7.9 | AA360: -0.20899999999999999 | AB360: -0.215 | AC360: -0.26700000000000002 | AD360: -0.26800000000000002 | AE360: 88.93 | AF360: 89.72 | AG360: 0.97 | AH360: A+ | AI360: 7.4900000000000008e-002 | AJ360: =H360+100*O360 -> 328.13999999999999 | AK360: 367.4 | AL360: 359 | AM360: 277.7 | AN360: 359 | AO360: -1.6e-002 | AP360: 19 | AQ360: 蓝晓转债!
A361: 312 | B361: 123015 | C361: 蓝盾转债!! | D361: 300297 | E361: 蓝盾股份 | F361: 计算机及 | G361: 软件开发 | H361: 233.66 | I361: 9.7999999999999997e-003 | J361: -8.8999999999999999e-003 | K361: 4.85 | L361: 2.0999999999999999e-003 | M361: 112.3 | N361: 5.79 | O361: 1.79 | P361: 83.77 | Q361: 转股中 | R361: 3年55天 | S361: 1年56天 | T361: 1 | U361: 1418. | V361: 5.8300000000000001 | W361: 1.7000000000000001e-002 | X361: 1.3999999999999999e-002 | Y361: 61 | Z361: 2.32 | AA361: -0.21100000000000002 | AB361: -0.21600000000000003 | AC361: -0.41200000000000003 | AD361: -0.41299999999999998 | AE361: 94.81 | AF361: 92.8 | AG361: 0.4 | AH361: AA- | AI361: 6.3899999999999998e-002 | AJ361: =H361+100*O361 -> 412.65999999999997 | AK361: 383.6 | AL361: 360 | AM361: 288.7 | AN361: 360 | AO361: 0.25700000000000001 | AP361: 17 | AQ361: 蓝盾转债!!
A362: 299 | B362: 113526 | C362: 联泰转债! | D362: 603797 | E362: 联泰环保 | F362: 城市公用 | G362: 三废处理 | H362: 263.76 | I362: -8.0000000000000004e-004 | J362: 6.0000000000000001e-003 | K362: 7.71 | L362: 6.5000000000000006e-003 | M362: 110.3 | N362: 6.11 | O362: 1.0900000000000001 | P362: 126.19 | Q362: 转股中 | R362: 3.60年 | S362: 1.60年 | T362: 1.93 | U362: 111 | V362: 0.217 | W362: 5.5999999999999994e-002 | X362: 7.0000000000000007e-002 | Y362: 35 | Z362: 2.03 | AA362: -0.218 | AB362: -0.221 | AC362: -0.318 | AD362: -0.31900000000000001 | AE362: 95.99 | AF362: 96.08 | AG362: 0.79 | AH362: AA+ | AI362: 3.9900000000000005e-002 | AJ362: =H362+100*O362 -> 372.75999999999999 | AK362: 401.3 | AL362: 361 | AM362: 305.3 | AN362: 361 | AO362: 1.e-003 | AP362: 9 | AQ362: 联泰转债!
A363: 323 | B363: 110044 | C363: 广电转债!! | D363: 600831 | E363: 广电网络 | F363: 传媒娱乐 | G363: 影视娱乐 | H363: 247.12 | I363: -4.5999999999999999e-003 | J363: 4.0999999999999995e-003 | K363: 5.8 | L363: -1.7000000000000001e-003 | M363: 112.3 | N363: 6.9 | O363: 1.9399999999999999 | P363: 84.06 | Q363: 转股中 | R363: 3年8天 | S363: 1年9天 | T363: 0.71 | U363: 45 | V363: 0.25700000000000001 | W363: 1.7000000000000001e-002 | X363: 1.3999999999999999e-002 | Y363: 41 | Z363: 1.1 | AA363: -0.23300000000000001 | AB363: -0.23800000000000002 | AC363: -0.48299999999999998 | AD363: -0.48399999999999999 | AE363: 97.84 | AF363: 99.2 | AG363: 0.31 | AH363: AA | AI363: 4.2900000000000001e-002 | AJ363: =H363+100*O363 -> 441.12 | AK363: 410.2 | AL363: 362 | AM363: 311 | AN363: 362 | AO363: -6.7000000000000004e-002 | AP363: 11 | AQ363: 广电转债!!
A364: 343 | B364: 128029 | C364: 太阳转债!! | D364: 2078. | E364: 太阳纸业 | F364: 造纸包装 | G364: 造纸行业 | H364: 166.811 | I364: -1.41e-002 | J364: 6.0000000000000001e-003 | K364: 13.48 | L364: -8.1000000000000013e-003 | M364: 107 | N364: 8.55 | O364: 5.7999999999999996e-002 | P364: 157.66 | Q364: 转股中 | R364: 1.51年 | S364: 回售内 | T364: 9.09 | U364: 18 | V364: 1.2e-002 | W364: 2.6000000000000002e-002 | X364: 4.0000000000000001e-002 | Y364: 354 | Z364: 2.07 | AA364: -0.25600000000000001 | AB364: -0.26200000000000001 | AC364: 回售内 | AD364: 回售内 | AE364: 100.17 | AF364: 101.11 | AG364: 1 | AH364: AA+ | AI364: 3.8399999999999997e-002 | AJ364: =H364+100*O364 -> 172.61100000000002 | AK364: 176 | AL364: 336 | AM364: 74.9 | AN364: 329 | AO364: -5.7000000000000002e-002 | AP364: 7 | AQ364: 太阳转债!!
A365: 319 | B365: 128041 | C365: 盛路转债!! | D365: 2446. | E365: 盛路通信 | F365: 通信互联 | G365: 通信设备 | H365: 290.503 | I365: 5.4800000000000001e-002 | J365: -5.4800000000000001e-002 | K365: 6.89 | L365: 0.10099999999999999 | M365: 114.3 | N365: 6.82 | O365: 1.8799999999999999 | P365: 101.03 | Q365: 转股中 | R365: 3年28天 | S365: 1年29天 | T365: 0.53 | U365: 989 | V365: 6.46 | W365: 8.0000000000000002e-003 | X365: 9.0000000000000011e-003 | Y365: 63 | Z365: 2.03 | AA365: -0.26500000000000001 | AB365: -0.27000000000000002 | AC365: -0.50700000000000001 | AD365: -0.50800000000000001 | AE365: 97.62 | AF365: 100.73 | AG365: 0 | AH365: AA | AI365: 4.2900000000000001e-002 | AJ365: =H365+100*O365 -> 478.50299999999999 | AK365: 480 | AL365: 364 | AM365: 379.2 | AN365: 364 | AO365: 0.14699999999999999 | AP365: 12 | AQ365: 盛路转债!!
A366: 316 | B366: 123013 | C366: 横河转债! | D366: 300539 | E366: 横河精密 | F366: 机械装备 | G366: 专用设备 | H366: 351.2 | I366: 1.7299999999999999e-002 | J366: 5.5000000000000005e-003 | K366: 8.29 | L366: 4.5400000000000003e-002 | M366: 115.2 | N366: 9.12 | O366: 2.8599999999999999 | P366: 90.9 | Q366: 转股中 | R366: 3年37天 | S366: 1年38天 | T366: 0.38 | U366: 203 | V366: 1.51 | W366: 2.1000000000000001e-002 | X366: 1.9e-002 | Y366: 18 | Z366: 3.71 | AA366: -0.30599999999999999 | AB366: -0.312 | AC366: -0.54200000000000004 | AD366: -0.54299999999999993 | AE366: 94.42 | AF366: 92.65 | AG366: 0.5 | AH366: A+ | AI366: 7.4900000000000008e-002 | AJ366: =H366+100*O366 -> 637.20000000000005 | AK366: 611.5 | AL366: 366 | AM366: 517.1 | AN366: 366 | AO366: 9.0999999999999998e-002 | AP366: 14 | AQ366: 横河转债!
A367: 256 | B367: 123029 | C367: 英科转债! | D367: 300677 | E367: 英科医疗 | F367: 医药 | G367: 医疗器械 | H367: 1185.63 | I367: 9.0000000000000011e-003 | J367: -5.9999999999999995e-004 | K367: 98.93 | L367: 8.6e-003 | M367: 138.2 | N367: 8.32 | O367: -3.0000000000000001e-003 | P367: 1189.06 | Q367: 转股中 | R367: 4年58天 | S367: 2年59天 | T367: 0.32 | U367: 165 | V367: 0.42999999999999999 | W367: 1.e-003 | X367: 1.1000000000000001e-002 | Y367: 359 | Z367: 2.66 | AA367: -0.40899999999999997 | AB367: -0.41600000000000004 | AC367: -0.33899999999999997 | AD367: -0.33899999999999997 | AE367: 97.5 | AF367: 116.82 | AG367: 0.99 | AH367: AA | AI367: 4.2900000000000001e-002 | AJ367: =H367+100*O367 -> 1185.3300000000002 | AK367: 1182.2 | AL367: 367 | AM367: 1065.4000000000001 | AN367: 367 | AO367: -0.17499999999999999 | AP367: 16 | AQ367: 英科转债!
A368: 354 | B368: 113016 | C368: 小康转债!! | D368: 601127 | E368: 小康股份 | F368: 汽车 | G368: 零部件制 | H368: 483.89 | I368: 0.16 | J368: -6.0999999999999999e-002 | K368: 72.38 | L368: 0.10000000000000001 | M368: 109.3 | N368: 15.7 | O368: 5.0000000000000003e-002 | P368: 461.02 | Q368: 转股中 | R368: 2.39年 | S368: 0.39年 | T368: 2.74 | U368: 9820. | V368: 7.7599999999999998 | W368: 3.0000000000000001e-003 | X368: 1.3000000000000001e-002 | Y368: 939 | Z368: 19.94 | AA368: -0.435 | AB368: -0.43700000000000006 | AC368: -1.494 | AD368: -1.4950000000000001 | AE368: 99.55 | AF368: 99.4 | AG368: 0.99 | AH368: AA | AI368: 4.1399999999999999e-002 | AJ368: =H368+100*O368 -> 488.88999999999999 | AK368: 506.8 | AL368: 365 | AM368: 407.2 | AN368: 365 | AO368: 0.21100000000000002 | AP368: 41 | AQ368: 小康转债!!