A1: 序号 | B1: 转债代码 | C1: 转债名称 | D1: 股票代码 | E1: 股票名称 | F1: 行业 | G1: 子行业 | H1: 转债价格 | I1: 涨跌 | J1: 日内套利 | K1: 股价 | L1: 涨跌 | M1: 剩余本息 | N1: 转股价格 | O1: 转股溢价率 | P1: 转股价值 | Q1: 距离转股日 | R1: 剩余年限 | S1: 回售年限 | T1: 转债余额 | U1: 转债成交额 | V1: 转债换手率 | W1: 余额/市值 | X1: 余额/股本 | Y1: 股票市值 | Z1: P/B | AA1: 税前收益率 | AB1: 税后收益率 | AC1: 税前回售收益 | AD1: 税后回售收益 | AE1: 回售价值 | AF1: 纯债价值 | AG1: 弹性 | AH1: 信用 | AI1: 折现率 | AJ1: 双低 | AK1: 老式双低 | AL1: 老式排名 | AM1: 新式双低 | AN1: 新式排名 | AO1: MA20乖离 | AP1: 热门度 | AQ1: 转债名称
A2: 272 | B2: 128062 | C2: 亚药转债! | D2: 2370 | E2: 亚太药业 | F2: 医药 | G2: 化学制药 | H2: 79.065 | I2: -2.0000000000000001e-004 | J2: 2.0000000000000001e-004 | K2: 3.99 | L2: 1.01e-002 | M2: 119.3 | N2: 16.25 | O2: 2.2200000000000002 | P2: 24.55 | Q2: 转股中 | R2: 3.86年 | S2: 1.87年 | T2: 9.63 | U2: 14 | V2: 1.8000000000000002e-002 | W2: 0.45000000000000001 | X2: 0.11 | Y2: 21 | Z2: 4.95 | AA2: 0.115 | AB2: 0.105 | AC2: 0.13900000000000001 | AD2: 0.13600000000000001 | AE2: 84.19 | AF2: 81.97 | AG2: 0 | AH2: BBB | AI2: 0.10400000000000001 | AJ2: =H2+100*O2 -> 301.06500000000005 | AK2: 133.6 | AL2: 200 | AM2: 49.4 | AN2: 247 | AO2: -2.3e-002 | AP2: 85 | AQ2: 亚药转债!
A3: 134 | B3: 113595 | C3: 花王转债! | D3: 603007 | E3: ST花王 | F3: 城市公用 | G3: 生态环境 | H3: 87.35 | I3: 1.06e-002 | J3: -1.1000000000000001e-002 | K3: 2.9 | L3: -1.0200000000000001e-002 | M3: 125.3 | N3: 6.93 | O3: 1.0900000000000001 | P3: 41.85 | Q3: 转股中 | R3: 5.16年 | S3: 3.17年 | T3: 3.3 | U3: 11 | V3: 3.9e-002 | W3: 0.33899999999999997 | X3: 0.14199999999999999 | Y3: 10 | Z3: 0.85 | AA3: 7.4200000000000002e-002 | AB3: 6.5099999999999991e-002 | AC3: 5.5199999999999999e-002 | AD3: 5.2400000000000002e-002 | AE3: 84.89 | AF3: 91.47 | AG3: 0.04 | AH3: AA- | AI3: 6.4399999999999999e-002 | AJ3: =H3+100*O3 -> 196.35000000000002 | AK3: 132.9 | AL3: 189 | AM3: 41.4 | AN3: 196 | AO3: -0.26899999999999996 | AP3: 42 | AQ3: 花王转债!
A4: 179 | B4: 113576 | C4: 起步转债!! | D4: 603557 | E4: ST起步 | F4: 服装纺织 | G4: 鞋服行业 | H4: 90.88 | I4: 1.5900000000000001e-002 | J4: -1.9099999999999999e-002 | K4: 4.49 | L4: -5.0700000000000002e-002 | M4: 121.3 | N4: 10.55 | O4: 1.1399999999999999 | P4: 42.56 | Q4: 转股中 | R4: 4.89年 | S4: 2.89年 | T4: 2.66 | U4: 35 | V4: 0.14400000000000002 | W4: 0.11900000000000001 | X4: 5.0999999999999997e-002 | Y4: 22 | Z4: 1.42 | AA4: 6.2400000000000004e-002 | AB4: 5.4199999999999998e-002 | AC4: 4.6399999999999997e-002 | AD4: 4.3499999999999997e-002 | AE4: 81.68 | AF4: 82.56 | AG4: 0.06 | AH4: A | AI4: 8.4000000000000005e-002 | AJ4: =H4+100*O4 -> 204.88 | AK4: 139.2 | AL4: 240 | AM4: 56.6 | AN4: 289 | AO4: -0.38600000000000001 | AP4: 31 | AQ4: 起步转债!!
A5: 270 | B5: 128063 | C5: 未来转债! | D5: 2631 | E5: 德尔未来 | F5: 其他 | G5: 家居用品 | H5: 101.8 | I5: 6.3e-003 | J5: -6.8999999999999999e-003 | K5: 5.95 | L5: -3.4000000000000002e-003 | M5: 127.5 | N5: 8.63 | O5: 0.47700000000000004 | P5: 68.95 | Q5: 转股中 | R5: 3.87年 | S5: 2.87年 | T5: 6.3 | U5: 16 | V5: 2.5000000000000001e-002 | W5: 0.159 | X5: 0.11 | Y5: 40 | Z5: 2.35 | AA5: 6.1699999999999998e-002 | AB5: 4.9100000000000005e-002 | AC5: 2.06e-002 | AD5: 1.54e-002 | AE5: 90.21 | AF5: 101.33 | AG5: 0.19 | AH5: AA- | AI5: 6.3e-002 | AJ5: =H5+100*O5 -> 149.5 | AK5: 134.7 | AL5: 212 | AM5: 33.3 | AN5: 118 | AO5: -3.0000000000000001e-003 | AP5: 32 | AQ5: 未来转债!
A6: 118 | B6: 113600 | C6: 新星转债! | D6: 603978 | E6: 深圳新星 | F6: 有色金属 | G6: 有色行业 | H6: 94.68 | I6: 2.8000000000000004e-003 | J6: -3.9000000000000003e-003 | K6: 15.77 | L6: -4.4000000000000003e-003 | M6: 126 | N6: 23.85 | O6: 0.43200000000000005 | P6: 66.12 | Q6: 转股中 | R6: 5.23年 | S6: 3.23年 | T6: 5.95 | U6: 9.3 | V6: 1.6e-002 | W6: 0.23600000000000002 | X6: 0.156 | Y6: 25 | Z6: 1.65 | AA6: 5.74e-002 | AB6: 4.8600000000000004e-002 | AC6: 2.81e-002 | AD6: 2.5699999999999997e-002 | AE6: 84.27 | AF6: 91.55 | AG6: 0.27 | AH6: AA- | AI6: 6.4399999999999999e-002 | AJ6: =H6+100*O6 -> 137.88 | AK6: 123.2 | AL6: 79 | AM6: 31.7 | AN6: 101 | AO6: -0.14800000000000002 | AP6: 20 | AQ6: 新星转债!
A7: 192 | B7: 128100 | C7: 搜特转债! | D7: 2503 | E7: 搜于特 | F7: 服装纺织 | G7: 服装行业 | H7: 90.05 | I7: 2.8000000000000004e-003 | J7: -2.2000000000000001e-003 | K7: 1.68 | L7: 6.0000000000000001e-003 | M7: 116.9 | N7: 2.9 | O7: 0.55399999999999994 | P7: 57.93 | Q7: 转股中 | R7: 4.81年 | S7: 2.81年 | T7: 7.99 | U7: 13 | V7: 1.8000000000000002e-002 | W7: 0.154 | X7: 8.900000000000001e-002 | Y7: 52 | Z7: 1.55 | AA7: 5.6900000000000006e-002 | AB7: 5.0199999999999995e-002 | AC7: 4.8000000000000001e-002 | AD7: 4.5599999999999995e-002 | AE7: 91.58 | AF7: 96.28 | AG7: 0.1 | AH7: AA | AI7: 4.2000000000000003e-002 | AJ7: =H7+100*O7 -> 145.44999999999999 | AK7: 122.2 | AL7: 72 | AM7: 25.9 | AN7: 44 | AO7: -2.7000000000000003e-002 | AP7: 61 | AQ7: 搜特转债!
A8: 75 | B8: 128138 | C8: 侨银转债! | D8: 2973 | E8: 侨银股份 | F8: 城市公用 | G8: 城市公用 | H8: 101.628 | I8: -2.e-003 | J8: -1.1000000000000001e-003 | K8: 16.41 | L8: -1.44e-002 | M8: 136.5 | N8: 25.43 | O8: 0.57499999999999996 | P8: 64.53 | Q8: 3.1天 | R8: 5.49年 | S8: 3.49年 | T8: 4.2 | U8: 7.3 | V8: 1.7000000000000001e-002 | W8: 6.3e-002 | X8: 4.0000000000000001e-002 | Y8: 67 | Z8: 4.45 | AA8: 5.6299999999999996e-002 | AB8: 4.5400000000000003e-002 | AC8: 7.4999999999999997e-003 | AD8: 5.1000000000000004e-003 | AE8: 83.3 | AF8: 97.56 | AG8: 0.22 | AH8: AA- | AI8: 6.4399999999999999e-002 | AJ8: =H8+100*O8 -> 159.12799999999999 | AK8: 138.7 | AL8: 236 | AM8: 41.2 | AN8: 192 | AO8: -5.0000000000000003e-002 | AP8: 10 | AQ8: 侨银转债!
A9: 304 | B9: 128044 | C9: 岭南转债! | D9: 2717 | E9: 岭南股份 | F9: 城市公用 | G9: 生态环境 | H9: 94.059 | I9: 6.8999999999999999e-003 | J9: -5.7999999999999996e-003 | K9: 3.05 | L9: 4.4500000000000005e-002 | M9: 111.3 | N9: 5.91 | O9: 0.82299999999999995 | P9: 51.61 | Q9: 转股中 | R9: 3.23年 | S9: 1.23年 | T9: 6.59 | U9: 8.6 | V9: 1.3999999999999999e-002 | W9: 0.14099999999999999 | X9: 7.2999999999999995e-002 | Y9: 47 | Z9: 1.07 | AA9: 5.4699999999999999e-002 | AB9: 4.7699999999999992e-002 | AC9: 6.6199999999999995e-002 | AD9: 6.1900000000000004e-002 | AE9: 97.1 | AF9: 97.73 | AG9: 0.02 | AH9: AA | AI9: 4.2000000000000003e-002 | AJ9: =H9+100*O9 -> 176.35899999999998 | AK9: 136.5 | AL9: 226 | AM9: 38.8 | AN9: 175 | AO9: 4.2999999999999997e-002 | AP9: 44 | AQ9: 岭南转债!
A10: 256 | B10: 123028 | C10: 清水转债! | D10: 300437 | E10: 清水源 | F10: 城市公用 | G10: 三废处理 | H10: 98.75 | I10: 5.9999999999999995e-004 | J10: -4.6999999999999993e-003 | K10: 8.36 | L10: -1.5300000000000001e-002 | M10: 121.8 | N10: 11.84 | O10: 0.39899999999999997 | P10: 70.61 | Q10: 转股中 | R10: 4年28天 | S10: 2年29天 | T10: 4.55 | U10: 11 | V10: 2.4e-002 | W10: 0.24600000000000002 | X10: 0.17399999999999999 | Y10: 18 | Z10: 1.66 | AA10: 5.45e-002 | AB10: 4.4500000000000005e-002 | AC10: 2.69e-002 | AD10: 2.2599999999999999e-002 | AE10: 91.5 | AF10: 95.66 | AG10: 0.27 | AH10: AA- | AI10: 6.3e-002 | AJ10: =H10+100*O10 -> 138.65000000000001 | AK10: 126.9 | AL10: 114 | AM10: 31.2 | AN10: 97 | AO10: -1.4999999999999999e-002 | AP10: 51 | AQ10: 清水转债!
A11: 151 | B11: 127018 | C11: 本钢转债! | D11: 761 | E11: 本钢板材 | F11: 钢铁 | G11: 炼钢 | H11: 99.651 | I11: 9.1000000000000004e-003 | J11: 7.1999999999999998e-003 | K11: 4.4 | L11: 4.0199999999999993e-002 | M11: 128.6 | N11: 5.03 | O11: 0.13900000000000001 | P11: 87.48 | Q11: 转股中 | R11: 5年38天 | S11: 3年39天 | T11: 67.5 | U11: 107 | V11: 1.6e-002 | W11: 0.39600000000000002 | X11: 0.34600000000000003 | Y11: 171 | Z11: 0.83 | AA11: 5.2999999999999999e-002 | AB11: 4.3099999999999999e-002 | AC11: 2.07e-002 | AD11: 1.6799999999999999e-002 | AE11: 91.42 | AF11: 101.83 | AG11: 0.41 | AH11: AAA | AI11: 4.8399999999999999e-002 | AJ11: =H11+100*O11 -> 113.551 | AK11: 111.8 | AL11: 9 | AM11: 10 | AN11: 2 | AO11: -5.0000000000000001e-003 | AP11: 62 | AQ11: 本钢转债!
A12: 357 | B12: 127003 | C12: 海印转债! | D12: 861 | E12: 海印股份 | F12: 商业零售 | G12: 商场 | H12: 106.19 | I12: -1.e-004 | J12: 0. | K12: 2.2 | L12: -4.5000000000000005e-003 | M12: 111.8 | N12: 3 | O12: 0.44799999999999995 | P12: 73.33 | Q12: 转股中 | R12: 1年18天 | S12: 回售内 | T12: 6.74 | U12: 6.3 | V12: 9.0000000000000011e-003 | W12: 0.13200000000000001 | X12: 9.6999999999999989e-002 | Y12: 51 | Z12: 1.34 | AA12: 5.1100000000000007e-002 | AB12: 2.9500000000000002e-002 | AC12: 回售内 | AD12: 回售内 | AE12: 100.3 | AF12: 107.33 | AG12: 0.02 | AH12: AA | AI12: 4.0300000000000002e-002 | AJ12: =H12+100*O12 -> 150.99000000000001 | AK12: 139 | AL12: 238 | AM12: 31.7 | AN12: 102 | AO12: -2.7000000000000003e-002 | AP12: 73 | AQ12: 海印转债!
A13: 197 | B13: 113569 | C13: 科达转债! | D13: 603660 | E13: XD苏州科 | F13: 通信互联 | G13: 物联网 | H13: 95.18 | I13: 2.5000000000000001e-003 | J13: -1.4000000000000002e-003 | K13: 6.9 | L13: 1.77e-002 | M13: 120.3 | N13: 14.8 | O13: 1.04 | P13: 46.62 | Q13: 转股中 | R13: 4.80年 | S13: 2.80年 | T13: 5.16 | U13: 2.5 | V13: 5.0000000000000001e-003 | W13: 0.14999999999999999 | X13: 7.0000000000000007e-002 | Y13: 34 | Z13: 1.91 | AA13: 5.1100000000000007e-002 | AB13: 4.3299999999999998e-002 | AC13: 2.9399999999999999e-002 | AD13: 2.69e-002 | AE13: 86.61 | AF13: 90.28 | AG13: 0.06 | AH13: AA- | AI13: 6.3e-002 | AJ13: =H13+100*O13 -> 199.18000000000001 | AK13: 143.7 | AL13: 272 | AM13: 53.5 | AN13: 275 | AO13: -2.6000000000000002e-002 | AP13: 27 | AQ13: 科达转债!
A14: 126 | B14: 113596 | C14: 城地转债! | D14: 603887 | E14: 城地香江 | F14: 通信互联 | G14: 通信设备 | H14: 88.88 | I14: 3.3e-003 | J14: -3.3e-003 | K14: 11.3 | L14: -2.5999999999999999e-003 | M14: 113.5 | N14: 29.21 | O14: 1.3 | P14: 38.69 | Q14: 转股中 | R14: 5.18年 | S14: 3.19年 | T14: 12 | U14: 14 | V14: 1.3000000000000001e-002 | W14: 0.28300000000000003 | X14: 0.109 | Y14: 42 | Z14: 1.11 | AA14: 4.9400000000000006e-002 | AB14: 4.4299999999999999e-002 | AC14: 4.8000000000000001e-002 | AD14: 4.5599999999999995e-002 | AE14: 84.43 | AF14: 82.73 | AG14: 0.02 | AH14: AA- | AI14: 6.4399999999999999e-002 | AJ14: =H14+100*O14 -> 218.88 | AK14: 139.1 | AL14: 239 | AM14: 54.6 | AN14: 280 | AO14: -0.11900000000000001 | AP14: 21 | AQ14: 城地转债!
A15: 302 | B15: 113519 | C15: 长久转债! | D15: 603569 | E15: 长久物流 | F15: 交通运输 | G15: 物流业 | H15: 101.63 | I15: 2.7000000000000001e-003 | J15: -1.2999999999999999e-003 | K15: 7.83 | L15: 1.03e-002 | M15: 119.3 | N15: 11.15 | O15: 0.44700000000000001 | P15: 70.22 | Q15: 转股中 | R15: 3.46年 | S15: 1.47年 | T15: 6.97 | U15: 5.7 | V15: 8.0000000000000002e-003 | W15: 0.159 | X15: 0.11199999999999999 | Y15: 44 | Z15: 2 | AA15: 4.8300000000000003e-002 | AB15: 3.8100000000000002e-002 | AC15: 7.0999999999999995e-003 | AD15: 3.7000000000000002e-003 | AE15: 96.18 | AF15: 103.74 | AG15: 0.13 | AH15: AA | AI15: 4.2000000000000003e-002 | AJ15: =H15+100*O15 -> 146.32999999999998 | AK15: 133 | AL15: 192 | AM15: 29.3 | AN15: 73 | AO15: 4.0999999999999995e-002 | AP15: 21 | AQ15: 长久转债!
A16: 222 | B16: 128085 | C16: 鸿达转债! | D16: 2002 | E16: 鸿达兴业 | F16: 化工 | G16: 化工 | H16: 100.74 | I16: 4.0000000000000002e-004 | J16: -4.0000000000000002e-004 | K16: 3.88 | L16: 0. | M16: 124.4 | N16: 3.92 | O16: 1.8000000000000002e-002 | P16: 98.98 | Q16: 转股中 | R16: 4.57年 | S16: 2.57年 | T16: 11.1 | U16: 49 | V16: 4.4000000000000004e-002 | W16: 9.8000000000000004e-002 | X16: 9.6999999999999989e-002 | Y16: 113 | Z16: 1.33 | AA16: 4.8300000000000003e-002 | AB16: 3.8800000000000001e-002 | AC16: 1.15e-002 | AD16: 8.6e-003 | AE16: 75.69 | AF16: 73.84 | AG16: 0.77 | AH16: BB | AI16: 0.124 | AJ16: =H16+100*O16 -> 102.53999999999999 | AK16: 102.5 | AL16: 1 | AM16: 26.8 | AN16: 49 | AO16: 3.0000000000000001e-003 | AP16: 100 | AQ16: 鸿达转债!
A17: 72 | B17: 123077 | C17: 汉得转债! | D17: 300170 | E17: 汉得信息 | F17: 计算机及 | G17: 软件开发 | H17: 98.05 | I17: 9.5999999999999992e-003 | J17: -9.0000000000000011e-003 | K17: 6.68 | L17: 3.0000000000000001e-003 | M17: 125.5 | N17: 9.72 | O17: 0.42700000000000005 | P17: 68.72 | Q17: 6.1天 | R17: 5.51年 | S17: 3.51年 | T17: 9.37 | U17: 7.1 | V17: 8.0000000000000002e-003 | W17: 0.159 | X17: 0.109 | Y17: 59 | Z17: 1.86 | AA17: 4.6699999999999998e-002 | AB17: 3.8599999999999995e-002 | AC17: 1.5900000000000001e-002 | AD17: 1.38e-002 | AE17: 88.97 | AF17: 99.75 | AG17: 0.2 | AH17: AA | AI17: 4.3400000000000001e-002 | AJ17: =H17+100*O17 -> 140.75 | AK17: 127.4 | AL17: 120 | AM17: 27.6 | AN17: 55 | AO17: -5.0000000000000001e-003 | AP17: 13 | AQ17: 汉得转债!
A18: 172 | B18: 113573 | C18: 纵横转债! | D18: 603602 | E18: 纵横通信 | F18: 通信互联 | G18: 通信设备 | H18: 100.21 | I18: -2.e-003 | J18: 3.5999999999999999e-003 | K18: 10.13 | L18: 1.1000000000000001e-002 | M18: 124.2 | N18: 18.78 | O18: 0.85799999999999998 | P18: 53.94 | Q18: 转股中 | R18: 4.90年 | S18: 2.91年 | T18: 2.7 | U18: 4.7 | V18: 1.7000000000000001e-002 | W18: 0.13100000000000001 | X18: 7.0999999999999994e-002 | Y18: 21 | Z18: 2.91 | AA18: 4.5700000000000005e-002 | AB18: 3.7000000000000005e-002 | AC18: 1.2699999999999999e-002 | AD18: 1.e-002 | AE18: 83.79 | AF18: 88.19 | AG18: 0.14 | AH18: A+ | AI18: 7.400000000000001e-002 | AJ18: =H18+100*O18 -> 186.00999999999999 | AK18: 146.5 | AL18: 283 | AM18: 58.3 | AN18: 296 | AO18: -2.4e-002 | AP18: 23 | AQ18: 纵横转债!
A19: 351 | B19: 128015 | C19: 久其转债! | D19: 2279 | E19: 久其软件 | F19: 计算机及 | G19: 软件开发 | H19: 101.291 | I19: 1.9e-003 | J19: -1.9e-003 | K19: 4.54 | L19: 4.4000000000000003e-003 | M19: 110.8 | N19: 6.97 | O19: 0.55500000000000005 | P19: 65.14 | Q19: 转股中 | R19: 2年18天 | S19: 18天 | T19: 7.8 | U19: 7.5 | V19: 9.0000000000000011e-003 | W19: 0.24199999999999999 | X19: 0.157 | Y19: 32 | Z19: 3.75 | AA19: 4.5599999999999995e-002 | AB19: 3.5299999999999998e-002 | AC19: 1.2e-002 | AD19: -2.3e-003 | AE19: 100.05 | AF19: 96.29 | AG19: 0 | AH19: A+ | AI19: 7.2300000000000003e-002 | AJ19: =H19+100*O19 -> 156.791 | AK19: 137.4 | AL19: 231 | AM19: 37.4 | AN19: 157 | AO19: -1.6e-002 | AP19: 66 | AQ19: 久其转债!
A20: 96 | B20: 123069 | C20: 金诺转债! | D20: 300505 | E20: 川金诺 | F20: 化工 | G20: 农化 | H20: 99.63 | I20: 8.9999999999999998e-004 | J20: -1.1000000000000001e-003 | K20: 13.56 | L20: -7.000000000000001e-004 | M20: 126 | N20: 19.15 | O20: 0.40700000000000003 | P20: 70.81 | Q20: 转股中 | R20: 5.40年 | S20: 3.41年 | T20: 3.68 | U20: 3.4 | V20: 9.0000000000000011e-003 | W20: 0.20800000000000002 | X20: 0.14699999999999999 | Y20: 18 | Z20: 1.87 | AA20: 4.53e-002 | AB20: 3.6900000000000002e-002 | AC20: 1.2e-002 | AD20: 9.7999999999999997e-003 | AE20: 83.35 | AF20: 90.55 | AG20: 0.34 | AH20: AA- | AI20: 6.4399999999999999e-002 | AJ20: =H20+100*O20 -> 140.32999999999998 | AK20: 128.5 | AL20: 134 | AM20: 37.9 | AN20: 162 | AO20: -7.0000000000000007e-002 | AP20: 18 | AQ20: 金诺转债!
A21: 332 | B21: 113017 | C21: 吉视转债! | D21: 601929 | E21: 吉视传媒 | F21: 传媒娱乐 | G21: 影视娱乐 | H21: 97.2 | I21: 1.e-004 | J21: 2.3999999999999998e-003 | K21: 1.96 | L21: 3.1600000000000003e-002 | M21: 108.8 | N21: 2.95 | O21: 0.46299999999999997 | P21: 66.44 | Q21: 转股中 | R21: 2.60年 | S21: 0.60年 | T21: 15.6 | U21: 15 | V21: 1.e-002 | W21: 0.25600000000000001 | X21: 0.17000000000000001 | Y21: 61 | Z21: 0.92 | AA21: 4.4999999999999998e-002 | AB21: 3.8199999999999998e-002 | AC21: 5.8700000000000002e-002 | AD21: 5.45e-002 | AE21: 98.66 | AF21: 98.8 | AG21: 0.08 | AH21: AA+ | AI21: 3.8300000000000001e-002 | AJ21: =H21+100*O21 -> 143.5 | AK21: 128 | AL21: 127 | AM21: 29.2 | AN21: 70 | AO21: 5.0000000000000003e-002 | AP21: 65 | AQ21: 吉视转债!
A22: 275 | B22: 113530 | C22: 大丰转债! | D22: 603081 | E22: 大丰实业 | F22: 建筑 | G22: 装饰工程 | H22: 102.8 | I22: 7.4999999999999997e-003 | J22: -8.6999999999999994e-003 | K22: 11.82 | L22: -8.3999999999999995e-003 | M22: 121 | N22: 16.64 | O22: 0.44700000000000001 | P22: 71.03 | Q22: 转股中 | R22: 3.85年 | S22: 1.85年 | T22: 6.3 | U22: 2.4 | V22: 4.0000000000000001e-003 | W22: 0.13300000000000001 | X22: 9.4e-002 | Y22: 47 | Z22: 2.14 | AA22: 4.41e-002 | AB22: 3.4300000000000004e-002 | AC22: 5.9999999999999995e-004 | AD22: -2.3e-003 | AE22: 94.78 | AF22: 103.59 | AG22: 0.14 | AH22: AA | AI22: 4.2000000000000003e-002 | AJ22: =H22+100*O22 -> 147.5 | AK22: 134.6 | AL22: 210 | AM22: 31 | AN22: 92 | AO22: 1.8000000000000002e-002 | AP22: 34 | AQ22: 大丰转债!
A23: 69 | B23: 128139 | C23: 祥鑫转债! | D23: 2965 | E23: 祥鑫科技 | F23: 汽车 | G23: 零部件制 | H23: 95.827 | I23: 2.0999999999999999e-003 | J23: -2.2000000000000001e-003 | K23: 23.73 | L23: -4.0000000000000002e-004 | M23: 121 | N23: 36.96 | O23: 0.49299999999999999 | P23: 64.2 | Q23: 17天 | R23: 5.53年 | S23: 3.53年 | T23: 6.47 | U23: 5.9 | V23: 1.e-002 | W23: 0.18100000000000002 | X23: 0.11599999999999999 | Y23: 36 | Z23: 2.02 | AA23: 4.4000000000000004e-002 | AB23: 3.7100000000000001e-002 | AC23: 2.2400000000000003e-002 | AD23: 2.0199999999999999e-002 | AE23: 82.7 | AF23: 86.3 | AG23: 0.28 | AH23: AA- | AI23: 6.4399999999999999e-002 | AJ23: =H23+100*O23 -> 145.12700000000001 | AK23: 127.4 | AL23: 121 | AM23: 41.1 | AN23: 191 | AO23: -0.191 | AP23: 12 | AQ23: 祥鑫转债!
A24: 220 | B24: 110064 | C24: 建工转债! | D24: 600939 | E24: 重庆建工 | F24: 建筑 | G24: 建筑工程 | H24: 98.98 | I24: 1.e-004 | J24: -1.6000000000000001e-003 | K24: 3.54 | L24: -5.6000000000000008e-003 | M24: 119.8 | N24: 4.57 | O24: 0.27800000000000002 | P24: 77.46 | Q24: 转股中 | R24: 4.58年 | S24: 2.58年 | T24: 16.6 | U24: 4 | V24: 2.e-003 | W24: 0.25800000000000001 | X24: 0.20000000000000001 | Y24: 64 | Z24: 0.91 | AA24: 4.36e-002 | AB24: 3.56e-002 | AC24: 1.8799999999999997e-002 | AD24: 1.5800000000000002e-002 | AE24: 93.59 | AF24: 100.52 | AG24: 0.26 | AH24: AA+ | AI24: 4.0000000000000001e-002 | AJ24: =H24+100*O24 -> 126.78 | AK24: 120.5 | AL24: 51 | AM24: 20 | AN24: 15 | AO24: -5.0000000000000001e-003 | AP24: 45 | AQ24: 建工转债!
A25: 285 | B25: 110052 | C25: 贵广转债! | D25: 600996 | E25: 贵广网络 | F25: 传媒娱乐 | G25: 影视娱乐 | H25: 100.49 | I25: 8.9999999999999998e-004 | J25: -1.4000000000000002e-003 | K25: 4.6 | L25: -1.0800000000000001e-002 | M25: 117.7 | N25: 7.94 | O25: 0.73499999999999999 | P25: 57.93 | Q25: 转股中 | R25: 3.79年 | S25: 1.79年 | T25: 15.3 | U25: 1.5 | V25: 1.e-003 | W25: 0.316 | X25: 0.183 | Y25: 48 | Z25: 1.15 | AA25: 4.3499999999999997e-002 | AB25: 3.4799999999999998e-002 | AC25: 1.3000000000000001e-002 | AD25: 9.8999999999999991e-003 | AE25: 95.48 | AF25: 101.74 | AG25: 0.05 | AH25: AA+ | AI25: 4.0000000000000001e-002 | AJ25: =H25+100*O25 -> 173.99000000000001 | AK25: 143 | AL25: 268 | AM25: 41.3 | AN25: 194 | AO25: -1.7000000000000001e-002 | AP25: 18 | AQ25: 贵广转债!
A26: 322 | B26: 128037 | C26: 岩土转债! | D26: 2542 | E26: 中化岩土 | F26: 建筑 | G26: 建筑工程 | H26: 98.941 | I26: 8.9999999999999998e-004 | J26: -8.9999999999999998e-004 | K26: 2.88 | L26: 1.0500000000000001e-002 | M26: 111.3 | N26: 7.99 | O26: 1.74 | P26: 36.05 | Q26: 转股中 | R26: 2.81年 | S26: 0.82年 | T26: 5.99 | U26: 5 | V26: 8.0000000000000002e-003 | W26: 0.115 | X26: 4.2000000000000003e-002 | Y26: 52 | Z26: 1.31 | AA26: 4.3400000000000001e-002 | AB26: 3.56e-002 | AC26: 2.9500000000000002e-002 | AD26: 2.5699999999999997e-002 | AE26: 97.93 | AF26: 99.75 | AG26: 0 | AH26: AA | AI26: 4.0300000000000002e-002 | AJ26: =H26+100*O26 -> 272.94100000000003 | AK26: 161.8 | AL26: 318 | AM26: 62.1 | AN26: 302 | AO26: -2.8999999999999998e-002 | AP26: 51 | AQ26: 岩土转债!
A27: 52 | B27: 123088 | C27: 威唐转债! | D27: 300707 | E27: 威唐工业 | F27: 汽车 | G27: 零部件制 | H27: 96.552 | I27: 7.4000000000000003e-003 | J27: 3.0999999999999999e-003 | K27: 14.38 | L27: 2.4900000000000002e-002 | M27: 121.6 | N27: 20.75 | O27: 0.39299999999999996 | P27: 69.3 | Q27: 31天 | R27: 5.57年 | S27: 3.57年 | T27: 3.01 | U27: 3.3 | V27: 1.2e-002 | W27: 0.13300000000000001 | X27: 9.1999999999999998e-002 | Y27: 23 | Z27: 3.27 | AA27: 4.3299999999999998e-002 | AB27: 3.6200000000000003e-002 | AC27: 2.1899999999999999e-002 | AD27: 1.9400000000000001e-002 | AE27: 80 | AF27: 81.92 | AG27: 0.42 | AH27: A+ | AI27: 7.5399999999999995e-002 | AJ27: =H27+100*O27 -> 135.852 | AK27: 123.8 | AL27: 86 | AM27: 41.9 | AN27: 198 | AO27: -6.9999999999999993e-003 | AP27: 11 | AQ27: 威唐转债!
A28: 194 | B28: 123044 | C28: 红相转债!! | D28: 300427 | E28: 红相股份 | F28: 能源电力 | G28: 电力设备 | H28: 102.497 | I28: -4.5000000000000005e-003 | J28: -4.5999999999999999e-003 | K28: 12.27 | L28: -3.8399999999999997e-002 | M28: 125 | N28: 18.8 | O28: 0.56999999999999995 | P28: 65.27 | Q28: 转股中 | R28: 4.81年 | S28: 2.81年 | T28: 5.5 | U28: 10 | V28: 1.8000000000000002e-002 | W28: 0.124 | X28: 8.1000000000000003e-002 | Y28: 44 | Z28: 1.89 | AA28: 4.3200000000000002e-002 | AB28: 3.4000000000000002e-002 | AC28: 6.6e-003 | AD28: 3.7000000000000002e-003 | AE28: 87.32 | AF28: 93.87 | AG28: 0.24 | AH28: AA- | AI28: 6.3e-002 | AJ28: =H28+100*O28 -> 159.49699999999999 | AK28: 139.7 | AL28: 242 | AM28: 45.9 | AN28: 229 | AO28: -2.e-003 | AP28: 20 | AQ28: 红相转债!!
A29: 146 | B29: 128118 | C29: 瀛通转债! | D29: 2861 | E29: 瀛通通讯 | F29: 电子 | G29: 电子产品 | H29: 99.188 | I29: 1.9e-003 | J29: 2.8999999999999998e-003 | K29: 18.16 | L29: 1.6799999999999999e-002 | M29: 122.1 | N29: 27.53 | O29: 0.504 | P29: 65.96 | Q29: 转股中 | R29: 5年41天 | S29: 3年42天 | T29: 3 | U29: 2.7 | V29: 9.0000000000000011e-003 | W29: 0.13600000000000001 | X29: 8.900000000000001e-002 | Y29: 22 | Z29: 2.07 | AA29: 4.2599999999999999e-002 | AB29: 3.4700000000000002e-002 | AC29: 1.66e-002 | AD29: 1.37e-002 | AE29: 85.46 | AF29: 89.47 | AG29: 0.29 | AH29: AA- | AI29: 6.4399999999999999e-002 | AJ29: =H29+100*O29 -> 149.58799999999999 | AK29: 132.4 | AL29: 180 | AM29: 42.9 | AN29: 213 | AO29: 1.9e-002 | AP29: 14 | AQ29: 瀛通转债!
A30: 115 | B30: 128127 | C30: 文科转债! | D30: 2775 | E30: 文科园林 | F30: 城市公用 | G30: 生态环境 | H30: 97.93 | I30: 5.1999999999999998e-003 | J30: -1.e-004 | K30: 4.33 | L30: 9.300000000000001e-003 | M30: 121.3 | N30: 4.88 | O30: 0.10400000000000001 | P30: 88.73 | Q30: 转股中 | R30: 5.25年 | S30: 3.25年 | T30: 9.5 | U30: 8.9 | V30: 1.e-002 | W30: 0.42799999999999999 | X30: 0.38 | Y30: 22 | Z30: 0.94 | AA30: 4.2599999999999999e-002 | AB30: 3.5200000000000002e-002 | AC30: 1.8600000000000002e-002 | AD30: 1.61e-002 | AE30: 84.45 | AF30: 88.12 | AG30: 0.54 | AH30: AA- | AI30: 6.4399999999999999e-002 | AJ30: =H30+100*O30 -> 108.33000000000001 | AK30: 107.1 | AL30: 2 | AM30: 19 | AN30: 11 | AO30: -0.113 | AP30: 42 | AQ30: 文科转债!
A31: 141 | B31: 127019 | C31: 国城转债! | D31: 688 | E31: 国城矿业 | F31: 有色金属 | G31: 锌铅镍锡 | H31: 93.333 | I31: 7.3000000000000001e-003 | J31: -6.9999999999999993e-003 | K31: 9.27 | L31: 8.6999999999999994e-003 | M31: 115.1 | N31: 21.07 | O31: 1.1200000000000001 | P31: 44 | Q31: 转股中 | R31: 5年54天 | S31: 3年55天 | T31: 8.5 | U31: 8.5 | V31: 1.1000000000000001e-002 | W31: 8.1000000000000003e-002 | X31: 3.5000000000000003e-002 | Y31: 105 | Z31: 4.55 | AA31: 4.24e-002 | AB31: 3.6799999999999999e-002 | AC31: 3.2300000000000002e-002 | AD31: 2.9999999999999999e-002 | AE31: 90.11 | AF31: 92.89 | AG31: 0.03 | AH31: AA | AI31: 4.3400000000000001e-002 | AJ31: =H31+100*O31 -> 205.33300000000003 | AK31: 142.7 | AL31: 265 | AM31: 49.8 | AN31: 250 | AO31: -2.6000000000000002e-002 | AP31: 40 | AQ31: 国城转债!
A32: 295 | B32: 113524 | C32: 奇精转债! | D32: 603677 | E32: 奇精机械 | F32: 家电 | G32: 零部件制 | H32: 101.49 | I32: 1.6000000000000001e-003 | J32: -1.e-004 | K32: 10.64 | L32: 4.6999999999999993e-003 | M32: 117.3 | N32: 13.98 | O32: 0.33299999999999996 | P32: 76.11 | Q32: 转股中 | R32: 3.56年 | S32: 1.57年 | T32: 3.3 | U32: 3.7 | V32: 1.1000000000000001e-002 | W32: 0.161 | X32: 0.12300000000000001 | Y32: 20 | Z32: 2.08 | AA32: 4.2300000000000004e-002 | AB32: 3.3300000000000003e-002 | AC32: 7.4999999999999997e-003 | AD32: 4.3e-003 | AE32: 92.55 | AF32: 94.74 | AG32: 0.31 | AH32: AA- | AI32: 6.3e-002 | AJ32: =H32+100*O32 -> 134.78999999999999 | AK32: 126.9 | AL32: 113 | AM32: 32.1 | AN32: 108 | AO32: -2.3e-002 | AP32: 45 | AQ32: 奇精转债!
A33: 147 | B33: 128117 | C33: 道恩转债! | D33: 2838 | E33: 道恩股份 | F33: 化工 | G33: 橡胶塑料 | H33: 100.743 | I33: 4.5000000000000005e-003 | J33: -7.4999999999999997e-003 | K33: 17.72 | L33: -1.3899999999999999e-002 | M33: 123.5 | N33: 29.03 | O33: 0.65000000000000002 | P33: 61.04 | Q33: 转股中 | R33: 5年41天 | S33: 3年42天 | T33: 3.6 | U33: 5.3 | V33: 1.4999999999999999e-002 | W33: 5.0000000000000003e-002 | X33: 2.9999999999999999e-002 | Y33: 72 | Z33: 3.81 | AA33: 4.1500000000000002e-002 | AB33: 3.3300000000000003e-002 | AC33: 9.3999999999999986e-003 | AD33: 6.9999999999999993e-003 | AE33: 84.81 | AF33: 90.37 | AG33: 0.21 | AH33: AA- | AI33: 6.4399999999999999e-002 | AJ33: =H33+100*O33 -> 165.74299999999999 | AK33: 140.4 | AL33: 251 | AM33: 50.1 | AN33: 254 | AO33: -5.5999999999999994e-002 | AP33: 21 | AQ33: 道恩转债!
A34: 117 | B34: 110072 | C34: 广汇转债! | D34: 600297 | E34: 广汇汽车 | F34: 汽车 | G34: 分销、售 | H34: 93 | I34: 4.1999999999999997e-003 | J34: -1.0800000000000001e-002 | K34: 2.9 | L34: -2.3599999999999999e-002 | M34: 114.5 | N34: 4.03 | O34: 0.29199999999999998 | P34: 71.96 | Q34: 转股中 | R34: 5.24年 | S34: 3.24年 | T34: 33.7 | U34: 57 | V34: 1.8000000000000002e-002 | W34: 0.14300000000000002 | X34: 0.10300000000000001 | Y34: 235 | Z34: 0.58 | AA34: 4.1100000000000005e-002 | AB34: 3.5900000000000001e-002 | AC34: 3.0600000000000002e-002 | AD34: 2.8799999999999999e-002 | AE34: 89.78 | AF34: 92.88 | AG34: 0.28 | AH34: AA+ | AI34: 4.1399999999999999e-002 | AJ34: =H34+100*O34 -> 122.2 | AK34: 114 | AL34: 14 | AM34: 21.2 | AN34: 18 | AO34: -3.7000000000000005e-002 | AP34: 54 | AQ34: 广汇转债!
A35: 338 | B35: 128026 | C35: 众兴转债! | D35: 2772 | E35: 众兴菌业 | F35: 农业 | G35: 种植业 | H35: 98.789 | I35: 3.4999999999999996e-003 | J35: -2.5999999999999999e-003 | K35: 7.85 | L35: 1.29e-002 | M35: 109.3 | N35: 11.36 | O35: 0.42999999999999999 | P35: 69.1 | Q35: 转股中 | R35: 2.56年 | S35: 0.56年 | T35: 9.19 | U35: 5.8 | V35: 6.0000000000000001e-003 | W35: 0.318 | X35: 0.22 | Y35: 29 | Z35: 1.12 | AA35: 4.0999999999999995e-002 | AB35: 3.3799999999999997e-002 | AC35: 4.2099999999999999e-002 | AD35: 3.7000000000000005e-002 | AE35: 97.48 | AF35: 94.09 | AG35: 0.08 | AH35: AA- | AI35: 6.13e-002 | AJ35: =H35+100*O35 -> 141.78899999999999 | AK35: 128.5 | AL35: 135 | AM35: 31 | AN35: 93 | AO35: -2.2000000000000002e-002 | AP35: 64 | AQ35: 众兴转债!
A36: 261 | B36: 113535 | C36: 大业转债! | D36: 603278 | E36: 大业股份 | F36: 汽车 | G36: 零部件制 | H36: 100 | I36: 2.0999999999999999e-003 | J36: -1.1999999999999999e-003 | K36: 8.5 | L36: 7.0999999999999995e-003 | M36: 112.5 | N36: 12.4 | O36: 0.45899999999999996 | P36: 68.55 | Q36: 转股中 | R36: 2.96年 | S36: 0.97年 | T36: 5 | U36: 2.3 | V36: 5.0000000000000001e-003 | W36: 0.20300000000000001 | X36: 0.13900000000000001 | Y36: 25 | Z36: 1.44 | AA36: 4.0899999999999999e-002 | AB36: 3.2899999999999999e-002 | AC36: 1.1000000000000001e-002 | AD36: 8.8000000000000005e-003 | AE36: 96.82 | AF36: 100.18 | AG36: 0.12 | AH36: AA | AI36: 4.0300000000000002e-002 | AJ36: =H36+100*O36 -> 145.90000000000001 | AK36: 131.5 | AL36: 169 | AM36: 31.3 | AN36: 98 | AO36: -4.0999999999999995e-002 | AP36: 49 | AQ36: 大业转债!
A37: 113 | B37: 113601 | C37: 塞力转债! | D37: 603716 | E37: 塞力医疗 | F37: 医药 | G37: 医药商业 | H37: 98.74 | I37: 1.8e-003 | J37: -3.8e-003 | K37: 13.61 | L37: -4.4000000000000003e-003 | M37: 121.3 | N37: 16.98 | O37: 0.23199999999999998 | P37: 80.15 | Q37: 转股中 | R37: 5.25年 | S37: 3.25年 | T37: 5.43 | U37: 9.1 | V37: 1.7000000000000001e-002 | W37: 0.19500000000000001 | X37: 0.156 | Y37: 28 | Z37: 1.78 | AA37: 4.0899999999999999e-002 | AB37: 3.3599999999999998e-002 | AC37: 1.61e-002 | AD37: 1.37e-002 | AE37: 84.44 | AF37: 88.1 | AG37: 0.46 | AH37: AA- | AI37: 6.4399999999999999e-002 | AJ37: =H37+100*O37 -> 121.94 | AK37: 117.3 | AL37: 28 | AM37: 29.2 | AN37: 72 | AO37: -2.8999999999999998e-002 | AP37: 38 | AQ37: 塞力转债!
A38: 105 | B38: 128132 | C38: 交建转债! | D38: 2941 | E38: 新疆交建 | F38: 建筑 | G38: 建筑工程 | H38: 95.361 | I38: 5.1000000000000004e-003 | J38: -2.3999999999999998e-003 | K38: 11.01 | L38: 2.0400000000000001e-002 | M38: 117.3 | N38: 18.57 | O38: 0.60799999999999998 | P38: 59.29 | Q38: 转股中 | R38: 5.32年 | S38: 3.32年 | T38: 8.5 | U38: 5.3 | V38: 6.9999999999999993e-003 | W38: 0.12 | X38: 7.0999999999999994e-002 | Y38: 71 | Z38: 2.92 | AA38: 4.0500000000000001e-002 | AB38: 3.44e-002 | AC38: 2.4900000000000002e-002 | AD38: 2.2700000000000001e-002 | AE38: 89.65 | AF38: 94.01 | AG38: 0.13 | AH38: AA | AI38: 4.3400000000000001e-002 | AJ38: =H38+100*O38 -> 156.161 | AK38: 131.4 | AL38: 167 | AM38: 37.4 | AN38: 158 | AO38: -5.0000000000000001e-003 | AP38: 18 | AQ38: 交建转债!
A39: 262 | B39: 128066 | C39: 亚泰转债! | D39: 2811 | E39: 郑中设计 | F39: 建筑 | G39: 装饰工程 | H39: 100.297 | I39: 5.4000000000000003e-003 | J39: -6.9999999999999993e-003 | K39: 8.18 | L39: -3.7000000000000002e-003 | M39: 116.7 | N39: 9.67 | O39: 0.18600000000000003 | P39: 84.59 | Q39: 转股中 | R39: 3.90年 | S39: 1.91年 | T39: 4.8 | U39: 3.2 | V39: 6.9999999999999993e-003 | W39: 0.217 | X39: 0.184 | Y39: 22 | Z39: 1.49 | AA39: 4.0300000000000002e-002 | AB39: 3.2400000000000005e-002 | AC39: 1.32e-002 | AD39: 1.0200000000000001e-002 | AE39: 90.87 | AF39: 92.36 | AG39: 0.43 | AH39: AA- | AI39: 6.3e-002 | AJ39: =H39+100*O39 -> 118.89699999999999 | AK39: 116 | AL39: 23 | AM39: 23.6 | AN39: 30 | AO39: 6.0000000000000001e-003 | AP39: 62 | AQ39: 亚泰转债!
A40: 74 | B40: 123076 | C40: 强力转债! | D40: 300429 | E40: 强力新材 | F40: 化工 | G40: 化工 | H40: 95.822 | I40: 3.4999999999999996e-003 | J40: -3.0000000000000001e-003 | K40: 10.82 | L40: 2.8000000000000004e-003 | M40: 118.5 | N40: 18.98 | O40: 0.68099999999999994 | P40: 57.01 | Q40: 4.1天 | R40: 5.50年 | S40: 3.50年 | T40: 8.5 | U40: 5.4 | V40: 6.9999999999999993e-003 | W40: 0.152 | X40: 8.6999999999999994e-002 | Y40: 56 | Z40: 3.16 | AA40: 4.0199999999999993e-002 | AB40: 3.4000000000000002e-002 | AC40: 2.2400000000000003e-002 | AD40: 2.0299999999999999e-002 | AE40: 82.8 | AF40: 84.68 | AG40: 0.2 | AH40: AA- | AI40: 6.4399999999999999e-002 | AJ40: =H40+100*O40 -> 163.922 | AK40: 134.6 | AL40: 211 | AM40: 50 | AN40: 252 | AO40: 1.e-002 | AP40: 14 | AQ40: 强力转债!
A41: 278 | B41: 123023 | C41: 迪森转债! | D41: 300335 | E41: 迪森股份 | F41: 能源电力 | G41: 电力供应 | H41: 98.606 | I41: 4.6999999999999993e-003 | J41: 4.0000000000000002e-004 | K41: 4.92 | L41: 2.7099999999999999e-002 | M41: 114.3 | N41: 7.04 | O41: 0.41100000000000003 | P41: 69.89 | Q41: 转股中 | R41: 3.83年 | S41: 2.83年 | T41: 5.29 | U41: 5 | V41: 1.e-002 | W41: 0.28800000000000003 | X41: 0.20100000000000001 | Y41: 18 | Z41: 1.32 | AA41: 4.0099999999999997e-002 | AB41: 3.3000000000000002e-002 | AC41: 2.0299999999999999e-002 | AD41: 1.72e-002 | AE41: 92.65 | AF41: 97.92 | AG41: 0.19 | AH41: AA | AI41: 4.2000000000000003e-002 | AJ41: =H41+100*O41 -> 139.70599999999999 | AK41: 127.3 | AL41: 119 | AM41: 29.4 | AN41: 75 | AO41: 4.0999999999999995e-002 | AP41: 51 | AQ41: 迪森转债!
A42: 152 | B42: 113589 | C42: 天创转债! | D42: 603608 | E42: 天创时尚 | F42: 服装纺织 | G42: 鞋服行业 | H42: 94.8 | I42: 5.7999999999999996e-003 | J42: -2.3e-003 | K42: 7.26 | L42: 2.69e-002 | M42: 115.3 | N42: 12.44 | O42: 0.624 | P42: 58.36 | Q42: 转股中 | R42: 5年33天 | S42: 3年34天 | T42: 6 | U42: 115 | V42: 0.20100000000000001 | W42: 0.193 | X42: 0.11199999999999999 | Y42: 31 | Z42: 1.91 | AA42: 4.0099999999999997e-002 | AB42: 3.4300000000000004e-002 | AC42: 2.86e-002 | AD42: 2.6099999999999998e-002 | AE42: 90.52 | AF42: 93.31 | AG42: 0.13 | AH42: AA | AI42: 4.3400000000000001e-002 | AJ42: =H42+100*O42 -> 157.19999999999999 | AK42: 131.2 | AL42: 163 | AM42: 37.9 | AN42: 163 | AO42: 0.17199999999999999 | AP42: 26 | AQ42: 天创转债!
A43: 299 | B43: 128049 | C43: 华源转债! | D43: 2787 | E43: 华源控股 | F43: 造纸包装 | G43: 包装材料 | H43: 100.007 | I43: 2.e-003 | J43: 2.0999999999999999e-003 | K43: 5.68 | L43: 1.2500000000000001e-002 | M43: 114.5 | N43: 7.42 | O43: 0.30599999999999999 | P43: 76.55 | Q43: 转股中 | R43: 3.52年 | S43: 1.52年 | T43: 3.63 | U43: 1.8 | V43: 5.0000000000000001e-003 | W43: 0.20199999999999999 | X43: 0.155 | Y43: 18 | Z43: 1.2 | AA43: 4.0000000000000001e-002 | AB43: 3.2199999999999999e-002 | AC43: 1.6799999999999999e-002 | AD43: 1.34e-002 | AE43: 92.84 | AF43: 92.76 | AG43: 0.33 | AH43: AA- | AI43: 6.3e-002 | AJ43: =H43+100*O43 -> 130.607 | AK43: 123.5 | AL43: 82 | AM43: 30.6 | AN43: 88 | AO43: -4.0000000000000001e-002 | AP43: 46 | AQ43: 华源转债!
A44: 314 | B44: 123010 | C44: 博世转债! | D44: 300422 | E44: 博世科 | F44: 城市公用 | G44: 三废处理 | H44: 99.88 | I44: 2.e-003 | J44: -2.e-003 | K44: 8.35 | L44: 0. | M44: 112.3 | N44: 12.2 | O44: 0.45899999999999996 | P44: 68.44 | Q44: 转股中 | R44: 3年44天 | S44: 1年45天 | T44: 4.3 | U44: 1.4 | V44: 3.0000000000000001e-003 | W44: 0.127 | X44: 8.6999999999999994e-002 | Y44: 34 | Z44: 1.39 | AA44: 3.9199999999999999e-002 | AB44: 3.15e-002 | AC44: 2.2799999999999997e-002 | AD44: 1.84e-002 | AE44: 95.09 | AF44: 93.21 | AG44: 0.16 | AH44: AA- | AI44: 6.3e-002 | AJ44: =H44+100*O44 -> 145.78 | AK44: 131.3 | AL44: 165 | AM44: 36.2 | AN44: 145 | AO44: -1.3000000000000001e-002 | AP44: 31 | AQ44: 博世转债!
A45: 255 | B45: 128069 | C45: 华森转债! | D45: 2907 | E45: 华森制药 | F45: 医药 | G45: 化学制药 | H45: 103.19 | I45: -4.0999999999999995e-003 | J45: -1.9e-003 | K45: 12.83 | L45: -2.2799999999999997e-002 | M45: 120 | N45: 18.04 | O45: 0.45100000000000001 | P45: 71.12 | Q45: 转股中 | R45: 4年33天 | S45: 2年34天 | T45: 3 | U45: 60 | V45: 0.192 | W45: 5.7999999999999996e-002 | X45: 4.0999999999999995e-002 | Y45: 52 | Z45: 4.53 | AA45: 3.8399999999999997e-002 | AB45: 2.9600000000000001e-002 | AC45: 1.2999999999999999e-003 | AD45: -1.7000000000000001e-003 | AE45: 90.32 | AF45: 94 | AG45: 0.26 | AH45: AA- | AI45: 6.3e-002 | AJ45: =H45+100*O45 -> 148.28999999999999 | AK45: 135.3 | AL45: 218 | AM45: 41.3 | AN45: 193 | AO45: 4.2000000000000003e-002 | AP45: 45 | AQ45: 华森转债!
A46: 311 | B46: 123011 | C46: 德尔转债! | D46: 300473 | E46: 德尔股份 | F46: 汽车 | G46: 零部件制 | H46: 103.599 | I46: -4.8999999999999998e-003 | J46: 2.0000000000000001e-004 | K46: 21.44 | L46: -2.5899999999999999e-002 | M46: 116.3 | N46: 31.38 | O46: 0.51600000000000001 | P46: 68.32 | Q46: 转股中 | R46: 3年57天 | S46: 1年58天 | T46: 2.51 | U46: 119 | V46: 0.45299999999999996 | W46: 8.6999999999999994e-002 | X46: 5.9000000000000004e-002 | Y46: 29 | Z46: 1.31 | AA46: 3.8100000000000002e-002 | AB46: 2.8500000000000001e-002 | AC46: -5.8999999999999999e-003 | AD46: -1.e-002 | AE46: 94.89 | AF46: 96.31 | AG46: 0.18 | AH46: AA- | AI46: 6.3e-002 | AJ46: =H46+100*O46 -> 155.19900000000001 | AK46: 138.9 | AL46: 237 | AM46: 42.6 | AN46: 206 | AO46: 6.9000000000000006e-002 | AP46: 42 | AQ46: 德尔转债!
A47: 140 | B47: 123059 | C47: 银信转债! | D47: 300231 | E47: 银信科技 | F47: 计算机及 | G47: 软件开发 | H47: 103.355 | I47: 6.4000000000000003e-003 | J47: -5.3e-003 | K47: 7.19 | L47: 2.8000000000000004e-003 | M47: 124.1 | N47: 9.72 | O47: 0.39700000000000002 | P47: 73.97 | Q47: 转股中 | R47: 5年54天 | S47: 3年55天 | T47: 3.91 | U47: 1.6 | V47: 4.0000000000000001e-003 | W47: 0.12300000000000001 | X47: 9.0999999999999998e-002 | Y47: 32 | Z47: 2.33 | AA47: 3.7000000000000005e-002 | AB47: 2.87e-002 | AC47: 2.e-003 | AD47: -4.0000000000000002e-004 | AE47: 84.78 | AF47: 90.64 | AG47: 0.38 | AH47: AA- | AI47: 6.4399999999999999e-002 | AJ47: =H47+100*O47 -> 143.05500000000001 | AK47: 132.7 | AL47: 186 | AM47: 42.1 | AN47: 202 | AO47: -3.7000000000000005e-002 | AP47: 15 | AQ47: 银信转债!
A48: 15 | B48: 123106 | C48: 正丹转债! | D48: 300641 | E48: 正丹股份 | F48: 化工 | G48: 化工 | H48: 102.3 | I48: 3.7000000000000002e-003 | J48: -1.26e-002 | K48: 6.45 | L48: -1.6799999999999999e-002 | M48: 125.5 | N48: 7.52 | O48: 0.193 | P48: 85.77 | Q48: 4月12天 | R48: 5.84年 | S48: 3.84年 | T48: 3.2 | U48: 16 | V48: 4.9000000000000002e-002 | W48: 0.10099999999999999 | X48: 8.6999999999999994e-002 | Y48: 32 | Z48: 2.27 | AA48: 3.6299999999999999e-002 | AB48: 2.87e-002 | AC48: 3.8e-003 | AD48: 1.9e-003 | AE48: 81.05 | AF48: 87.75 | AG48: 0.53 | AH48: AA- | AI48: 6.4399999999999999e-002 | AJ48: =H48+100*O48 -> 121.59999999999999 | AK48: 118.8 | AL48: 41 | AM48: 31.1 | AN48: 94 | AO48: -2.3e-002 | AP48: 7 | AQ48: 正丹转债!
A49: 64 | B49: 123081 | C49: 精研转债! | D49: 300709 | E49: 精研科技 | F49: 电子 | G49: 电子产品 | H49: 100.15 | I49: 6.9999999999999993e-003 | J49: 1.8e-003 | K49: 36.59 | L49: 4.3899999999999995e-002 | M49: 121.3 | N49: 64.28 | O49: 0.75900000000000001 | P49: 56.92 | Q49: 19天 | R49: 5.53年 | S49: 3.54年 | T49: 5.7 | U49: 84 | V49: 0.14400000000000002 | W49: 0.13500000000000001 | X49: 7.6999999999999999e-002 | Y49: 42 | Z49: 2.66 | AA49: 3.6000000000000004e-002 | AB49: 2.9100000000000001e-002 | AC49: 1.09e-002 | AD49: 8.6999999999999994e-003 | AE49: 82.91 | AF49: 86.51 | AG49: 0.2 | AH49: AA- | AI49: 6.4399999999999999e-002 | AJ49: =H49+100*O49 -> 176.05000000000001 | AK49: 143.4 | AL49: 269 | AM49: 56.9 | AN49: 291 | AO49: -3.4000000000000002e-002 | AP49: 6 | AQ49: 精研转债!
A50: 264 | B50: 127013 | C50: 创维转债! | D50: 810 | E50: 创维数字 | F50: 电子 | G50: 电子产品 | H50: 102.501 | I50: 5.8999999999999999e-003 | J50: -8.5000000000000006e-003 | K50: 8.56 | L50: -1.2699999999999999e-002 | M50: 117.3 | N50: 11.39 | O50: 0.36399999999999999 | P50: 75.15 | Q50: 转股中 | R50: 3.90年 | S50: 1.90年 | T50: 9.78 | U50: 15 | V50: 1.4999999999999999e-002 | W50: 0.107 | X50: 8.1000000000000003e-002 | Y50: 91 | Z50: 2.16 | AA50: 3.5799999999999998e-002 | AB50: 2.7699999999999999e-002 | AC50: 1.4000000000000002e-003 | AD50: -1.1999999999999999e-003 | AE50: 94.47 | AF50: 100.19 | AG50: 0.2 | AH50: AA | AI50: 4.2000000000000003e-002 | AJ50: =H50+100*O50 -> 138.90100000000001 | AK50: 129.8 | AL50: 150 | AM50: 29.7 | AN50: 79 | AO50: 3.7000000000000005e-002 | AP50: 23 | AQ50: 创维转债!
A51: 153 | B51: 123056 | C51: 雪榕转债! | D51: 300511 | E51: 雪榕生物 | F51: 农业 | G51: 种植业 | H51: 101.77 | I51: 3.4000000000000002e-003 | J51: 7.9000000000000008e-003 | K51: 8.85 | L51: 2.9100000000000001e-002 | M51: 121.1 | N51: 11.77 | O51: 0.35299999999999998 | P51: 75.19 | Q51: 转股中 | R51: 5年33天 | S51: 3年34天 | T51: 5.84 | U51: 27 | V51: 4.4999999999999998e-002 | W51: 0.14899999999999999 | X51: 0.11199999999999999 | Y51: 39 | Z51: 1.89 | AA51: 3.56e-002 | AB51: 2.81e-002 | AC51: 6.8000000000000005e-003 | AD51: 4.4000000000000003e-003 | AE51: 85.09 | AF51: 88.79 | AG51: 0.39 | AH51: AA- | AI51: 6.4399999999999999e-002 | AJ51: =H51+100*O51 -> 137.06999999999999 | AK51: 128.3 | AL51: 131 | AM51: 39.6 | AN51: 180 | AO51: -2.6000000000000002e-002 | AP51: 16 | AQ51: 雪榕转债!
A52: 158 | B52: 123054 | C52: 思特转债! | D52: 300608 | E52: 思特奇 | F52: 通信互联 | G52: 通信设备 | H52: 102.652 | I52: 2.9999999999999997e-004 | J52: 1.9e-003 | K52: 12.13 | L52: 5.7999999999999996e-003 | M52: 121.7 | N52: 16.49 | O52: 0.39500000000000002 | P52: 73.56 | Q52: 转股中 | R52: 5年19天 | S52: 3年20天 | T52: 2.71 | U52: 15 | V52: 5.4000000000000006e-002 | W52: 0.14199999999999999 | X52: 0.10400000000000001 | Y52: 19 | Z52: 2.49 | AA52: 3.5200000000000002e-002 | AB52: 2.7400000000000001e-002 | AC52: 6.0000000000000001e-003 | AD52: 3.2000000000000002e-003 | AE52: 85.82 | AF52: 89.52 | AG52: 0.37 | AH52: AA- | AI52: 6.4399999999999999e-002 | AJ52: =H52+100*O52 -> 142.15199999999999 | AK52: 131.7 | AL52: 174 | AM52: 42.2 | AN52: 203 | AO52: -3.1e-002 | AP52: 21 | AQ52: 思特转债!
A53: 356 | B53: 128013 | C53: 洪涛转债! | D53: 2325 | E53: 洪涛股份 | F53: 建筑 | G53: 装饰工程 | H53: 105.484 | I53: 2.8999999999999998e-003 | J53: -1.1000000000000001e-003 | K53: 2.29 | L53: 4.4000000000000003e-003 | M53: 109.8 | N53: 2.32 | O53: 6.9000000000000006e-002 | P53: 98.71 | Q53: 转股中 | R53: 1.19年 | S53: 回售内 | T53: 11.6 | U53: 13 | V53: 1.1000000000000001e-002 | W53: 0.40200000000000002 | X53: 0.39700000000000002 | Y53: 29 | Z53: 1.06 | AA53: 3.4799999999999998e-002 | AB53: 1.9e-002 | AC53: 回售内 | AD53: 回售内 | AE53: 100.3 | AF53: 102.4 | AG53: 0.41 | AH53: AA- | AI53: 6.13e-002 | AJ53: =H53+100*O53 -> 112.384 | AK53: 112.3 | AL53: 10 | AM53: 9.9 | AN53: 1 | AO53: -2.4e-002 | AP53: 92 | AQ53: 洪涛转债!
A54: 315 | B54: 127007 | C54: 湖广转债! | D54: 665 | E54: 湖北广电 | F54: 传媒娱乐 | G54: 影视娱乐 | H54: 101.266 | I54: 2.3999999999999998e-003 | J54: -8.5000000000000006e-003 | K54: 4.15 | L54: -3.2599999999999997e-002 | M54: 112.3 | N54: 5.58 | O54: 0.36200000000000004 | P54: 74.37 | Q54: 转股中 | R54: 3年37天 | S54: 1年38天 | T54: 12.2 | U54: 30 | V54: 2.4e-002 | W54: 0.29799999999999999 | X54: 0.222 | Y54: 41 | Z54: 0.7 | AA54: 3.4700000000000002e-002 | AB54: 2.7000000000000003e-002 | AC54: 1.2e-002 | AD54: 7.6e-003 | AE54: 97.86 | AF54: 99.71 | AG54: 0.19 | AH54: AA+ | AI54: 4.0000000000000001e-002 | AJ54: =H54+100*O54 -> 137.46600000000001 | AK54: 128.2 | AL54: 130 | AM54: 28.4 | AN54: 61 | AO54: 5.5999999999999994e-002 | AP54: 17 | AQ54: 湖广转债!
A55: 287 | B55: 113528 | C55: 长城转债! | D55: 603897 | E55: 长城科技 | F55: 机械装备 | G55: 专用设备 | H55: 103 | I55: -1.9e-003 | J55: -2.5000000000000001e-003 | K55: 18.62 | L55: -1.2199999999999999e-002 | M55: 116.8 | N55: 23.45 | O55: 0.29699999999999999 | P55: 79.4 | Q55: 转股中 | R55: 3.78年 | S55: 1.78年 | T55: 6.34 | U55: 7.9 | V55: 1.2e-002 | W55: 0.191 | X55: 0.152 | Y55: 33 | Z55: 1.7 | AA55: 3.4599999999999999e-002 | AB55: 2.63e-002 | AC55: 7.000000000000001e-004 | AD55: -2.5000000000000001e-003 | AE55: 91.67 | AF55: 93.18 | AG55: 0.36 | AH55: AA- | AI55: 6.3e-002 | AJ55: =H55+100*O55 -> 132.69999999999999 | AK55: 126.6 | AL55: 108 | AM55: 33.4 | AN55: 121 | AO55: 4.9000000000000002e-002 | AP55: 41 | AQ55: 长城转债!
A56: 33 | B56: 123096 | C56: 思创转债 | D56: 300078 | E56: 思创医惠 | F56: 通信互联 | G56: 物联网 | H56: 102.66 | I56: 1.9799999999999998e-002 | J56: -1.09e-002 | K56: 6.88 | L56: 1.78e-002 | M56: 124 | N56: 8.27 | O56: 0.23399999999999999 | P56: 83.19 | Q56: 2月13天 | R56: 5.68年 | S56: 3.69年 | T56: 8.17 | U56: 16 | V56: 1.9e-002 | W56: 0.13699999999999998 | X56: 0.114 | Y56: 60 | Z56: 2.01 | AA56: 3.4500000000000003e-002 | AB56: 2.7099999999999999e-002 | AC56: 3.2000000000000002e-003 | AD56: 1.1999999999999999e-003 | AE56: 81.91 | AF56: 87.58 | AG56: 0.5 | AH56: AA- | AI56: 6.4399999999999999e-002 | AJ56: =H56+100*O56 -> 126.06 | AK56: 122.1 | AL56: 71 | AM56: 34.5 | AN56: 130 | AO56: -4.7e-002 | AP56: 4 | AQ56: 思创转债
A57: 238 | B57: 113546 | C57: 迪贝转债! | D57: 603320 | E57: 迪贝电气 | F57: 家电 | G57: 零部件制 | H57: 104.22 | I57: 3.4000000000000002e-003 | J57: 1.06e-002 | K57: 11.17 | L57: 3.1400000000000004e-002 | M57: 120.6 | N57: 14.1 | O57: 0.316 | P57: 79.22 | Q57: 转股中 | R57: 4.42年 | S57: 2.42年 | T57: 2.3 | U57: 10 | V57: 4.2999999999999997e-002 | W57: 0.158 | X57: 0.125 | Y57: 15 | Z57: 2.09 | AA57: 3.44e-002 | AB57: 2.6000000000000002e-002 | AC57: -1.1000000000000001e-003 | AD57: -4.0000000000000001e-003 | AE57: 86.59 | AF57: 88.62 | AG57: 0.45 | AH57: A+ | AI57: 7.400000000000001e-002 | AJ57: =H57+100*O57 -> 135.81999999999999 | AK57: 129.2 | AL57: 142 | AM57: 40.6 | AN57: 187 | AO57: 8.0000000000000002e-003 | AP57: 40 | AQ57: 迪贝转债!
A58: 263 | B58: 110058 | C58: 永鼎转债! | D58: 600105 | E58: 永鼎股份 | F58: 通信互联 | G58: 通信设备 | H58: 100.56 | I58: -3.0999999999999999e-003 | J58: 1.6000000000000001e-003 | K58: 3.45 | L58: -8.6e-003 | M58: 114.3 | N58: 5.04 | O58: 0.46899999999999997 | P58: 68.45 | Q58: 转股中 | R58: 3.90年 | S58: 1.90年 | T58: 2.61 | U58: 7.5 | V58: 2.8999999999999998e-002 | W58: 5.5e-002 | X58: 3.7999999999999999e-002 | Y58: 48 | Z58: 1.71 | AA58: 3.4000000000000002e-002 | AB58: 2.7099999999999999e-002 | AC58: 1.0800000000000001e-002 | AD58: 8.1000000000000013e-003 | AE58: 94.46 | AF58: 97.63 | AG58: 0.17 | AH58: AA | AI58: 4.2000000000000003e-002 | AJ58: =H58+100*O58 -> 147.46000000000001 | AK58: 132.7 | AL58: 185 | AM58: 35 | AN58: 136 | AO58: 3.0000000000000001e-003 | AP58: 49 | AQ58: 永鼎转债!
A59: 54 | B59: 123085 | C59: 万顺转2! | D59: 300057 | E59: 万顺新材 | F59: 有色金属 | G59: 铝金属 | H59: 94.5 | I59: 6.8999999999999999e-003 | J59: -5.8999999999999999e-003 | K59: 4.59 | L59: 2.2000000000000001e-003 | M59: 113.3 | N59: 6.2 | O59: 0.27600000000000002 | P59: 74.03 | Q59: 27天 | R59: 5.56年 | S59: 3.56年 | T59: 9 | U59: 10 | V59: 1.2e-002 | W59: 0.29100000000000004 | X59: 0.215 | Y59: 31 | Z59: 0.87 | AA59: 3.39e-002 | AB59: 2.9300000000000003e-002 | AC59: 2.58e-002 | AD59: 2.3700000000000002e-002 | AE59: 82.47 | AF59: 80.68 | AG59: 0.45 | AH59: AA- | AI59: 6.4399999999999999e-002 | AJ59: =H59+100*O59 -> 122.09999999999999 | AK59: 115 | AL59: 16 | AM59: 32.5 | AN59: 110 | AO59: -1.2e-002 | AP59: 20 | AQ59: 万顺转2!
A60: 171 | B60: 113578 | C60: 全筑转债! | D60: 603030 | E60: 全筑股份 | F60: 建筑 | G60: 装饰工程 | H60: 100.42 | I60: 1.7000000000000001e-003 | J60: 5.9999999999999995e-004 | K60: 4.36 | L60: 6.8999999999999999e-003 | M60: 117.9 | N60: 5.43 | O60: 0.251 | P60: 80.29 | Q60: 转股中 | R60: 4.91年 | S60: 2.92年 | T60: 3.84 | U60: 3.8 | V60: 1.e-002 | W60: 0.16399999999999998 | X60: 0.13100000000000001 | Y60: 23 | Z60: 1.03 | AA60: 3.3799999999999997e-002 | AB60: 2.7099999999999999e-002 | AC60: 9.5999999999999992e-003 | AD60: 7.4000000000000003e-003 | AE60: 91.18 | AF60: 96.68 | AG60: 0.34 | AH60: AA | AI60: 4.2000000000000003e-002 | AJ60: =H60+100*O60 -> 125.52000000000001 | AK60: 120.5 | AL60: 52 | AM60: 23.9 | AN60: 34 | AO60: -1.7000000000000001e-002 | AP60: 20 | AQ60: 全筑转债!
A61: 308 | B61: 128042 | C61: 凯中转债! | D61: 2823 | E61: 凯中精密 | F61: 能源电力 | G61: 电力设备 | H61: 104.9 | I61: 1.5700000000000002e-002 | J61: -1.3899999999999999e-002 | K61: 9.93 | L61: 9.1000000000000004e-003 | M61: 116.3 | N61: 12.96 | O61: 0.36899999999999999 | P61: 76.62 | Q61: 转股中 | R61: 3.19年 | S61: 1.19年 | T61: 4.16 | U61: 15 | V61: 3.5000000000000003e-002 | W61: 0.14599999999999999 | X61: 0.11199999999999999 | Y61: 29 | Z61: 2.1 | AA61: 3.3599999999999998e-002 | AB61: 2.41e-002 | AC61: -1.49e-002 | AD61: -1.89e-002 | AE61: 97.27 | AF61: 102.28 | AG61: 0.2 | AH61: AA | AI61: 4.2000000000000003e-002 | AJ61: =H61+100*O61 -> 141.80000000000001 | AK61: 133.2 | AL61: 193 | AM61: 30.9 | AN61: 91 | AO61: -1.9e-002 | AP61: 28 | AQ61: 凯中转债!
A62: 337 | B62: 123004 | C62: 铁汉转债! | D62: 300197 | E62: 节能铁汉 | F62: 城市公用 | G62: 生态环境 | H62: 100.069 | I62: 1.1000000000000001e-003 | J62: -4.0000000000000002e-004 | K62: 2.99 | L62: 3.4000000000000002e-003 | M62: 108.8 | N62: 3.82 | O62: 0.27800000000000002 | P62: 78.27 | Q62: 转股中 | R62: 2.58年 | S62: 0.58年 | T62: 8.03 | U62: 7.3 | V62: 9.0000000000000011e-003 | W62: 9.5000000000000001e-002 | X62: 7.400000000000001e-002 | Y62: 84 | Z62: 1.29 | AA62: 3.3500000000000002e-002 | AB62: 2.6800000000000001e-002 | AC62: 2.e-002 | AD62: 1.5800000000000002e-002 | AE62: 98.61 | AF62: 98.41 | AG62: 0.19 | AH62: AA | AI62: 4.0300000000000002e-002 | AJ62: =H62+100*O62 -> 127.869 | AK62: 121.9 | AL62: 68 | AM62: 23.3 | AN62: 25 | AO62: -2.6000000000000002e-002 | AP62: 47 | AQ62: 铁汉转债!
A63: 248 | B63: 128072 | C63: 翔鹭转债! | D63: 2842 | E63: 翔鹭钨业 | F63: 有色金属 | G63: 小金属 | H63: 100.399 | I63: 6.5000000000000006e-003 | J63: -5.8999999999999999e-003 | K63: 9.31 | L63: 3.2000000000000002e-003 | M63: 115.1 | N63: 15.34 | O63: 0.65400000000000003 | P63: 60.69 | Q63: 转股中 | R63: 4.25年 | S63: 2.25年 | T63: 3.02 | U63: 102 | V63: 0.33200000000000002 | W63: 0.11900000000000001 | X63: 7.2000000000000008e-002 | Y63: 25 | Z63: 2.73 | AA63: 3.3399999999999999e-002 | AB63: 2.6699999999999998e-002 | AC63: 1.2500000000000001e-002 | AD63: 9.7000000000000003e-003 | AE63: 89.39 | AF63: 89.31 | AG63: 0.2 | AH63: AA- | AI63: 6.3e-002 | AJ63: =H63+100*O63 -> 165.79900000000001 | AK63: 140.1 | AL63: 250 | AM63: 50.7 | AN63: 256 | AO63: -8.3000000000000004e-002 | AP63: 29 | AQ63: 翔鹭转债!
A64: 51 | B64: 123087 | C64: 明电转债! | D64: 300739 | E64: 明阳电路 | F64: 电子 | G64: 元器件制 | H64: 101.389 | I64: 4.7999999999999996e-003 | J64: -9.3999999999999986e-003 | K64: 14.15 | L64: -8.3999999999999995e-003 | M64: 121.2 | N64: 16.62 | O64: 0.191 | P64: 85.14 | Q64: 31天 | R64: 5.57年 | S64: 4.57年 | T64: 6.73 | U64: 5.5 | V64: 8.0000000000000002e-003 | W64: 0.17000000000000001 | X64: 0.14499999999999999 | Y64: 40 | Z64: 2.79 | AA64: 3.3300000000000003e-002 | AB64: 2.64e-002 | AC64: 1.1000000000000001e-002 | AD64: 8.3000000000000001e-003 | AE64: 79.82 | AF64: 86.28 | AG64: 0.54 | AH64: AA- | AI64: 6.4399999999999999e-002 | AJ64: =H64+100*O64 -> 120.489 | AK64: 117.6 | AL64: 33 | AM64: 31.4 | AN64: 99 | AO64: -1.3999999999999999e-002 | AP64: 11 | AQ64: 明电转债!
A65: 175 | B65: 123049 | C65: 维尔转债 | D65: 300190 | E65: 维尔利 | F65: 城市公用 | G65: 三废处理 | H65: 106.31 | I65: 1.e-004 | J65: -3.0999999999999999e-003 | K65: 6.76 | L65: -5.8999999999999999e-003 | M65: 124.3 | N65: 7.38 | O65: 0.161 | P65: 91.6 | Q65: 转股中 | R65: 4.89年 | S65: 2.90年 | T65: 9.17 | U65: 11 | V65: 1.2e-002 | W65: 0.17399999999999999 | X65: 0.159 | Y65: 53 | Z65: 1.22 | AA65: 3.32e-002 | AB65: 2.4500000000000001e-002 | AC65: -6.5000000000000006e-003 | AD65: -9.1999999999999998e-003 | AE65: 86.61 | AF65: 92.8 | AG65: 0.52 | AH65: AA- | AI65: 6.3e-002 | AJ65: =H65+100*O65 -> 122.41 | AK65: 121 | AL65: 61 | AM65: 28.2 | AN65: 59 | AO65: -1.1000000000000001e-002 | AP65: 16 | AQ65: 维尔转债
A66: 149 | B66: 113591 | C66: 胜达转债! | D66: 603687 | E66: 大胜达 | F66: 造纸包装 | G66: 包装用纸 | H66: 103.88 | I66: 7.1999999999999998e-003 | J66: -5.1000000000000004e-003 | K66: 8.14 | L66: 3.7000000000000002e-003 | M66: 122.2 | N66: 8.83 | O66: 0.127 | P66: 92.19 | Q66: 转股中 | R66: 5年40天 | S66: 3年41天 | T66: 5.5 | U66: 12 | V66: 2.e-002 | W66: 0.16399999999999998 | X66: 0.152 | Y66: 33 | Z66: 1.94 | AA66: 3.3099999999999997e-002 | AB66: 2.53e-002 | AC66: 7.000000000000001e-004 | AD66: -1.7000000000000001e-003 | AE66: 85.09 | AF66: 89.51 | AG66: 0.56 | AH66: AA- | AI66: 6.4399999999999999e-002 | AJ66: =H66+100*O66 -> 116.58 | AK66: 115.6 | AL66: 21 | AM66: 26.1 | AN66: 45 | AO66: -5.5e-002 | AP66: 26 | AQ66: 胜达转债!
A67: 353 | B67: 128014 | C67: 永东转债! | D67: 2753 | E67: 永东股份 | F67: 化工 | G67: 化工 | H67: 103.4 | I67: 2.7000000000000001e-003 | J67: -2.7000000000000001e-003 | K67: 8.29 | L67: -2.3999999999999998e-003 | M67: 109.8 | N67: 12.6 | O67: 0.57200000000000006 | P67: 65.79 | Q67: 转股中 | R67: 1.91年 | S67: 回售内 | T67: 3.37 | U67: 1.8 | V67: 5.0000000000000001e-003 | W67: 0.10800000000000001 | X67: 7.0999999999999994e-002 | Y67: 31 | Z67: 1.57 | AA67: 3.2300000000000002e-002 | AB67: 2.2499999999999999e-002 | AC67: 回售内 | AD67: 回售内 | AE67: 100.3 | AF67: 98.12 | AG67: 0 | AH67: AA- | AI67: 6.13e-002 | AJ67: =H67+100*O67 -> 160.60000000000002 | AK67: 141 | AL67: 253 | AM67: 40.7 | AN67: 189 | AO67: -2.6000000000000002e-002 | AP67: 39 | AQ67: 永东转债!
A68: 20 | B68: 123105 | C68: 拓尔转债! | D68: 300229 | E68: 拓尔思 | F68: 计算机及 | G68: 软件开发 | H68: 100.888 | I68: 4.1999999999999997e-003 | J68: 8.9999999999999998e-004 | K68: 8.09 | L68: 1.e-002 | M68: 121 | N68: 9.98 | O68: 0.245 | P68: 81.06 | Q68: 4月7天 | R68: 5.82年 | S68: 3.83年 | T68: 8 | U68: 9.4 | V68: 1.2e-002 | W68: 0.13800000000000001 | X68: 0.11199999999999999 | Y68: 58 | Z68: 2.66 | AA68: 3.2300000000000002e-002 | AB68: 2.5899999999999999e-002 | AC68: 7.4999999999999997e-003 | AD68: 5.6000000000000008e-003 | AE68: 81.19 | AF68: 84.72 | AG68: 0.51 | AH68: AA- | AI68: 6.4399999999999999e-002 | AJ68: =H68+100*O68 -> 125.38800000000001 | AK68: 120.7 | AL68: 56 | AM68: 36 | AN68: 144 | AO68: -2.2000000000000002e-002 | AP68: 4 | AQ68: 拓尔转债!
A69: 150 | B69: 128116 | C69: 瑞达转债! | D69: 2961 | E69: 瑞达期货 | F69: 金融 | G69: 期货行业 | H69: 98.464 | I69: -4.0000000000000002e-004 | J69: -3.7000000000000002e-003 | K69: 19.8 | L69: -1.7899999999999999e-002 | M69: 115.3 | N69: 29.55 | O69: 0.46999999999999997 | P69: 67.01 | Q69: 转股中 | R69: 5年38天 | S69: 3年39天 | T69: 6.5 | U69: 2.9 | V69: 4.0000000000000001e-003 | W69: 7.400000000000001e-002 | X69: 4.9000000000000002e-002 | Y69: 88 | Z69: 4.49 | AA69: 3.2099999999999997e-002 | AB69: 2.64e-002 | AC69: 1.6200000000000003e-002 | AD69: 1.3899999999999999e-002 | AE69: 90.39 | AF69: 93.25 | AG69: 0.23 | AH69: AA | AI69: 4.3400000000000001e-002 | AJ69: =H69+100*O69 -> 145.464 | AK69: 129.9 | AL69: 153 | AM69: 36.7 | AN69: 151 | AO69: -4.9000000000000002e-002 | AP69: 18 | AQ69: 瑞达转债!
A70: 120 | B70: 113599 | C70: 嘉友转债! | D70: 603871 | E70: 嘉友国际 | F70: 交通运输 | G70: 物流业 | H70: 107.36 | I70: -3.7000000000000002e-003 | J70: 8.5000000000000006e-003 | K70: 23.6 | L70: 8.5000000000000006e-003 | M70: 126 | N70: 24.82 | O70: 0.129 | P70: 95.08 | Q70: 转股中 | R70: 5.21年 | S70: 3.21年 | T70: 7.2 | U70: 15 | V70: 1.9e-002 | W70: 0.13900000000000001 | X70: 0.13200000000000001 | Y70: 52 | Z70: 2.41 | AA70: 3.1899999999999998e-002 | AB70: 2.3300000000000001e-002 | AC70: -9.7000000000000003e-003 | AD70: -1.1899999999999999e-002 | AE70: 84.39 | AF70: 91.67 | AG70: 0.56 | AH70: AA- | AI70: 6.4399999999999999e-002 | AJ70: =H70+100*O70 -> 120.26000000000001 | AK70: 119.6 | AL70: 48 | AM70: 28 | AN70: 57 | AO70: 4.2000000000000003e-002 | AP70: 20 | AQ70: 嘉友转债!
A71: 236 | B71: 110059 | C71: 浦发转债! | D71: 600000 | E71: 浦发银行 | F71: 金融 | G71: 银行行业 | H71: 102.88 | I71: 5.0000000000000001e-004 | J71: -1.7000000000000001e-003 | K71: 10.09 | L71: -6.8999999999999999e-003 | M71: 117.6 | N71: 14.45 | O71: 0.47299999999999998 | P71: 69.83 | Q71: 转股中 | R71: 4.44年 | S71: 无权 | T71: 500 | U71: 240 | V71: 5.0000000000000001e-003 | W71: 0.16899999999999998 | X71: 0.11800000000000001 | Y71: 2962. | Z71: 0.55 | AA71: 3.15e-002 | AB71: 2.4199999999999999e-002 | AC71: 无权 | AD71: 无权 | AE71: 无权 | AF71: 100.58 | AG71: 0.18 | AH71: AAA | AI71: 3.7000000000000005e-002 | AJ71: =H71+100*O71 -> 150.18000000000001 | AK71: 135.9 | AL71: 222 | AM71: 35.4 | AN71: 140 | AO71: -1.3999999999999999e-002 | AP71: 66 | AQ71: 浦发转债!
A72: 162 | B72: 113584 | C72: 家悦转债! | D72: 603708 | E72: 家家悦 | F72: 商业零售 | G72: 超市 | H72: 99.01 | I72: 6.1999999999999998e-003 | J72: -6.0000000000000001e-003 | K72: 18.01 | L72: 4.5000000000000005e-003 | M72: 115.3 | N72: 37.97 | O72: 1.0900000000000001 | P72: 47.43 | Q72: 转股中 | R72: 5年14天 | S72: 3年15天 | T72: 6.45 | U72: 6.2 | V72: 1.e-002 | W72: 5.9000000000000004e-002 | X72: 2.7999999999999997e-002 | Y72: 110 | Z72: 3.89 | AA72: 3.1400000000000004e-002 | AB72: 2.5699999999999997e-002 | AC72: 1.4999999999999999e-002 | AD72: 1.26e-002 | AE72: 90.72 | AF72: 93.52 | AG72: 0.04 | AH72: AA | AI72: 4.3400000000000001e-002 | AJ72: =H72+100*O72 -> 208.01000000000002 | AK72: 150.6 | AL72: 298 | AM72: 57.1 | AN72: 292 | AO72: -9.0000000000000011e-003 | AP72: 12 | AQ72: 家悦转债!
A73: 325 | B73: 113505 | C73: 杭电转债! | D73: 603618 | E73: 杭电股份 | F73: 能源电力 | G73: 电力设备 | H73: 102.26 | I73: 5.4000000000000003e-003 | J73: -4.4000000000000003e-003 | K73: 6.09 | L73: 3.3e-003 | M73: 111.3 | N73: 7.14 | O73: 0.19899999999999998 | P73: 85.29 | Q73: 转股中 | R73: 2.79年 | S73: 0.79年 | T73: 7.5 | U73: 10 | V73: 1.3000000000000001e-002 | W73: 0.17800000000000002 | X73: 0.152 | Y73: 42 | Z73: 1.56 | AA73: 3.1300000000000001e-002 | AB73: 2.3599999999999999e-002 | AC73: -4.6999999999999993e-003 | AD73: -8.3999999999999995e-003 | AE73: 98.03 | AF73: 99.85 | AG73: 0.3 | AH73: AA | AI73: 4.0300000000000002e-002 | AJ73: =H73+100*O73 -> 122.16 | AK73: 119.2 | AL73: 43 | AM73: 19.4 | AN73: 12 | AO73: -1.7000000000000001e-002 | AP73: 42 | AQ73: 杭电转债!
A74: 183 | B74: 127016 | C74: 鲁泰转债! | D74: 726 | E74: 鲁 泰Ａ | F74: 服装纺织 | G74: 纺织行业 | H74: 99.999 | I74: 2.5000000000000001e-003 | J74: 1.1999999999999999e-003 | K74: 6.23 | L74: 1.8000000000000002e-002 | M74: 115.9 | N74: 8.91 | O74: 0.42999999999999999 | P74: 69.92 | Q74: 转股中 | R74: 4.88年 | S74: 2.89年 | T74: 14 | U74: 0.5 | V74: 0. | W74: 0.26200000000000001 | X74: 0.183 | Y74: 53 | Z74: 0.69 | AA74: 3.1300000000000001e-002 | AB74: 2.52e-002 | AC74: 1.11e-002 | AD74: 8.8999999999999999e-003 | AE74: 91.83 | AF74: 96.04 | AG74: 0.21 | AH74: AA+ | AI74: 4.0000000000000001e-002 | AJ74: =H74+100*O74 -> 142.999 | AK74: 130.1 | AL74: 154 | AM74: 34 | AN74: 125 | AO74: 1.e-002 | AP74: 22 | AQ74: 鲁泰转债!
A75: 224 | B75: 128083 | C75: 新北转债! | D75: 2376 | E75: 新北洋 | F75: 电子 | G75: 电子产品 | H75: 100.25 | I75: -1.5e-003 | J75: 1.5e-003 | K75: 8.98 | L75: 0. | M75: 114.9 | N75: 11.7 | O75: 0.30599999999999999 | P75: 76.75 | Q75: 转股中 | R75: 4.56年 | S75: 2.56年 | T75: 8.77 | U75: 1.9 | V75: 2.e-003 | W75: 0.14699999999999999 | X75: 0.113 | Y75: 60 | Z75: 1.73 | AA75: 3.1e-002 | AB75: 2.4799999999999999e-002 | AC75: 1.15e-002 | AD75: 9.0000000000000011e-003 | AE75: 92.52 | AF75: 95.61 | AG75: 0.3 | AH75: AA | AI75: 4.2000000000000003e-002 | AJ75: =H75+100*O75 -> 130.84999999999999 | AK75: 123.7 | AL75: 85 | AM75: 28.1 | AN75: 58 | AO75: -1.9e-002 | AP75: 19 | AQ75: 新北转债!
A76: 184 | B76: 113033 | C76: 利群转债! | D76: 601366 | E76: 利群股份 | F76: 商业零售 | G76: 商场 | H76: 99.4 | I76: -5.9999999999999995e-004 | J76: 1.2999999999999999e-003 | K76: 6.22 | L76: 1.6000000000000001e-003 | M76: 114.9 | N76: 7.01 | O76: 0.12 | P76: 88.73 | Q76: 转股中 | R76: 4.86年 | S76: 2.86年 | T76: 18 | U76: 13 | V76: 6.9999999999999993e-003 | W76: 0.33600000000000002 | X76: 0.29799999999999999 | Y76: 54 | Z76: 1.15 | AA76: 3.0800000000000001e-002 | AB76: 2.5099999999999997e-002 | AC76: 1.32e-002 | AD76: 1.1000000000000001e-002 | AE76: 91.38 | AF76: 94.43 | AG76: 0.45 | AH76: AA | AI76: 4.2000000000000003e-002 | AJ76: =H76+100*O76 -> 111.40000000000001 | AK76: 110.1 | AL76: 5 | AM76: 15.6 | AN76: 5 | AO76: -2.2000000000000002e-002 | AP76: 51 | AQ76: 利群转债!
A77: 25 | B77: 113620 | C77: 傲农转债 | D77: 603363 | E77: 傲农生物 | F77: 农业 | G77: 畜牧业 | H77: 101.86 | I77: -4.0000000000000002e-004 | J77: -4.0000000000000002e-004 | K77: 10.88 | L77: -2.7000000000000001e-003 | M77: 121.1 | N77: 14.8 | O77: 0.38600000000000001 | P77: 73.51 | Q77: 3月28天 | R77: 5.80年 | S77: 3.80年 | T77: 10 | U77: 10 | V77: 1.e-002 | W77: 0.13600000000000001 | X77: 0.10000000000000001 | Y77: 73 | Z77: 2.53 | AA77: 3.0800000000000001e-002 | AB77: 2.4300000000000002e-002 | AC77: 4.3e-003 | AD77: 2.5000000000000001e-003 | AE77: 87.65 | AF77: 95.04 | AG77: 0.29 | AH77: AA | AI77: 4.3400000000000001e-002 | AJ77: =H77+100*O77 -> 140.46000000000001 | AK77: 130.2 | AL77: 155 | AM77: 35.2 | AN77: 137 | AO77: -0.114 | AP77: 5 | AQ77: 傲农转债
A78: 288 | B78: 128056 | C78: 今飞转债! | D78: 2863 | E78: 今飞凯达 | F78: 汽车 | G78: 零部件制 | H78: 107.489 | I78: -2.8000000000000004e-003 | J78: 4.7999999999999996e-003 | K78: 5.02 | L78: 6.0000000000000001e-003 | M78: 120.2 | N78: 6.7 | O78: 0.435 | P78: 74.93 | Q78: 转股中 | R78: 3.78年 | S78: 1.78年 | T78: 1.72 | U78: 8 | V78: 4.2999999999999997e-002 | W78: 6.9000000000000006e-002 | X78: 5.0999999999999997e-002 | Y78: 25 | Z78: 1.35 | AA78: 3.0699999999999998e-002 | AB78: 2.1099999999999997e-002 | AC78: -2.0099999999999996e-002 | AD78: -2.3399999999999997e-002 | AE78: 90.09 | AF78: 92.34 | AG78: 0.33 | AH78: A+ | AI78: 7.400000000000001e-002 | AJ78: =H78+100*O78 -> 150.989 | AK78: 140.1 | AL78: 249 | AM78: 47.7 | AN78: 238 | AO78: -2.3e-002 | AP78: 55 | AQ78: 今飞转债!
A79: 35 | B79: 113042 | C79: 上银转债! | D79: 601229 | E79: 上海银行 | F79: 金融 | G79: 银行行业 | H79: 102.31 | I79: -1.1000000000000001e-003 | J79: -3.4000000000000002e-003 | K79: 8.24 | L79: -1.55e-002 | M79: 120.9 | N79: 11.03 | O79: 0.37 | P79: 74.71 | Q79: 2月9天 | R79: 5.68年 | S79: 无权 | T79: 200 | U79: 217 | V79: 1.1000000000000001e-002 | W79: 0.17100000000000001 | X79: 0.128 | Y79: 1171. | Z79: 0.67 | AA79: 3.0699999999999998e-002 | AB79: 2.4e-002 | AC79: 无权 | AD79: 无权 | AE79: 无权 | AF79: 98.18 | AG79: 0.29 | AH79: AAA | AI79: 3.8399999999999997e-002 | AJ79: =H79+100*O79 -> 139.31 | AK79: 129.9 | AL79: 152 | AM79: 31.7 | AN79: 104 | AO79: -6.9999999999999993e-003 | AP79: 12 | AQ79: 上银转债!
A80: 97 | B80: 123068 | C80: 弘信转债 | D80: 300657 | E80: 弘信电子 | F80: 电子 | G80: 元器件制 | H80: 103.455 | I80: -3.3e-003 | J80: 3.7000000000000002e-003 | K80: 15.65 | L80: 5.9999999999999995e-004 | M80: 121.2 | N80: 18.45 | O80: 0.22 | P80: 84.82 | Q80: 转股中 | R80: 5.40年 | S80: 3.40年 | T80: 5.7 | U80: 3.8 | V80: 6.0000000000000001e-003 | W80: 0.107 | X80: 8.9999999999999997e-002 | Y80: 53 | Z80: 3.81 | AA80: 3.04e-002 | AB80: 2.3399999999999997e-002 | AC80: 1.8e-003 | AD80: -4.0000000000000002e-004 | AE80: 83.55 | AF80: 87.18 | AG80: 0.52 | AH80: AA- | AI80: 6.4399999999999999e-002 | AJ80: =H80+100*O80 -> 125.455 | AK80: 122.1 | AL80: 70 | AM80: 34.9 | AN80: 135 | AO80: -3.3000000000000002e-002 | AP80: 7 | AQ80: 弘信转债
A81: 187 | B81: 110068 | C81: 龙净转债! | D81: 600388 | E81: 龙净环保 | F81: 城市公用 | G81: 三废处理 | H81: 99.63 | I81: -7.000000000000001e-004 | J81: 2.7000000000000001e-003 | K81: 8.6 | L81: 5.7999999999999996e-003 | M81: 114.8 | N81: 10.73 | O81: 0.24299999999999999 | P81: 80.15 | Q81: 转股中 | R81: 4.84年 | S81: 2.84年 | T81: 20 | U81: 4.3 | V81: 2.e-003 | W81: 0.218 | X81: 0.17399999999999999 | Y81: 92 | Z81: 1.51 | AA81: 3.0299999999999997e-002 | AB81: 2.4500000000000001e-002 | AC81: 1.2199999999999999e-002 | AD81: 1.e-002 | AE81: 91.89 | AF81: 95.28 | AG81: 0.34 | AH81: AA+ | AI81: 4.0000000000000001e-002 | AJ81: =H81+100*O81 -> 123.92999999999999 | AK81: 119.1 | AL81: 42 | AM81: 23.8 | AN81: 33 | AO81: -2.e-003 | AP81: 32 | AQ81: 龙净转债!
A82: 286 | B82: 113021 | C82: 中信转债! | D82: 601998 | E82: 中信银行 | F82: 金融 | G82: 银行行业 | H82: 105.81 | I82: 8.9999999999999998e-004 | J82: -8.9999999999999998e-004 | K82: 5.26 | L82: 0. | M82: 118 | N82: 6.98 | O82: 0.40399999999999997 | P82: 75.36 | Q82: 转股中 | R82: 3.78年 | S82: 无权 | T82: 400 | U82: 37 | V82: 1.e-003 | W82: 0.155 | X82: 0.11699999999999999 | Y82: 2574. | Z82: 0.53 | AA82: 3.0099999999999998e-002 | AB82: 2.1299999999999999e-002 | AC82: 无权 | AD82: 无权 | AE82: 无权 | AF82: 103.24 | AG82: 0.2 | AH82: AAA | AI82: 3.7000000000000005e-002 | AJ82: =H82+100*O82 -> 146.21000000000001 | AK82: 136.3 | AL82: 223 | AM82: 33 | AN82: 113 | AO82: -6.0000000000000001e-003 | AP82: 47 | AQ82: 中信转债!
A83: 86 | B83: 123074 | C83: 隆利转债! | D83: 300752 | E83: 隆利科技 | F83: 电子 | G83: 液晶显示 | H83: 105.87 | I83: -1.1999999999999999e-003 | J83: -1.2e-002 | K83: 23.75 | L83: -2.86e-002 | M83: 124 | N83: 29.41 | O83: 0.311 | P83: 80.75 | Q83: 转股中 | R83: 5.44年 | S83: 3.44年 | T83: 3.25 | U83: 42 | V83: 0.12 | W83: 0.114 | X83: 9.1999999999999998e-002 | Y83: 29 | Z83: 3.3 | AA83: 3.0099999999999998e-002 | AB83: 2.2400000000000003e-002 | AC83: -5.1999999999999998e-003 | AD83: -7.3000000000000001e-003 | AE83: 83.17 | AF83: 88.92 | AG83: 0.46 | AH83: AA- | AI83: 6.4399999999999999e-002 | AJ83: =H83+100*O83 -> 136.97 | AK83: 131 | AL83: 160 | AM83: 42.1 | AN83: 199 | AO83: -3.4000000000000002e-002 | AP83: 14 | AQ83: 隆利转债!
A84: 202 | B84: 113566 | C84: 翔港转债! | D84: 603499 | E84: 翔港科技 | F84: 造纸包装 | G84: 包装材料 | H84: 107.99 | I84: -1.4000000000000002e-003 | J84: 2.3999999999999998e-003 | K84: 7.87 | L84: 2.5000000000000001e-003 | M84: 124 | N84: 10.77 | O84: 0.47799999999999998 | P84: 73.07 | Q84: 转股中 | R84: 4.77年 | S84: 2.78年 | T84: 1.61 | U84: 5.4 | V84: 3.1e-002 | W84: 0.10199999999999999 | X84: 7.400000000000001e-002 | Y84: 16 | Z84: 2.79 | AA84: 2.9999999999999999e-002 | AB84: 2.1299999999999999e-002 | AC84: -1.23e-002 | AD84: -1.4999999999999999e-002 | AE84: 84.64 | AF84: 88.88 | AG84: 0.39 | AH84: A+ | AI84: 7.400000000000001e-002 | AJ84: =H84+100*O84 -> 155.78999999999999 | AK84: 142.9 | AL84: 267 | AM84: 54 | AN84: 277 | AO84: -2.6000000000000002e-002 | AP84: 29 | AQ84: 翔港转债!
A85: 361 | B85: 110031 | C85: 航信转债!! | D85: 600271 | E85: 航天信息 | F85: 计算机及 | G85: 软件开发 | H85: 106.81 | I85: 2.9999999999999997e-004 | J85: -2.9999999999999997e-004 | K85: 12.45 | L85: -1.66e-002 | M85: 107 | N85: 21.56 | O85: 0.84999999999999998 | P85: 57.75 | Q85: 转股中 | R85: 22天 | S85: 回售内 | T85: 24 | U85: 29 | V85: 1.1000000000000001e-002 | W85: 0.10400000000000001 | X85: 5.9999999999999998e-002 | Y85: 231 | Z85: 1.85 | AA85: 2.9900000000000003e-002 | AB85: -0.17199999999999999 | AC85: 回售内 | AD85: 回售内 | AE85: 100.27 | AF85: 106.83 | AG85: 0 | AH85: AAA | AI85: 2.6499999999999999e-002 | AJ85: =H85+100*O85 -> 191.81 | AK85: 155.9 | AL85: 309 | AM85: 49 | AN85: 244 | AO85: -6.0000000000000001e-003 | AP85: 15 | AQ85: 航信转债!!
A86: 145 | B86: 113036 | C86: 宁建转债! | D86: 601789 | E86: 宁波建工 | F86: 建筑 | G86: 建筑工程 | H86: 101.19 | I86: 5.0000000000000001e-004 | J86: 4.0000000000000002e-004 | K86: 3.77 | L86: 2.7000000000000001e-003 | M86: 117.3 | N86: 4.86 | O86: 0.30399999999999999 | P86: 77.57 | Q86: 转股中 | R86: 5年45天 | S86: 3年46天 | T86: 5.4 | U86: 2 | V86: 4.0000000000000001e-003 | W86: 0.14699999999999999 | X86: 0.114 | Y86: 37 | Z86: 1.17 | AA86: 2.9900000000000003e-002 | AB86: 2.3700000000000002e-002 | AC86: 7.9000000000000008e-003 | AD86: 5.6000000000000008e-003 | AE86: 90.4 | AF86: 94.79 | AG86: 0.32 | AH86: AA | AI86: 4.3400000000000001e-002 | AJ86: =H86+100*O86 -> 131.59 | AK86: 124.8 | AL86: 93 | AM86: 30 | AN86: 84 | AO86: -8.0000000000000002e-003 | AP86: 9 | AQ86: 宁建转债!
A87: 341 | B87: 128022 | C87: 众信转债! | D87: 2707 | E87: 众信旅游 | F87: 旅游餐饮 | G87: 旅游 | H87: 101.15 | I87: -1.5e-003 | J87: 2.5000000000000001e-003 | K87: 5.37 | L87: 2.0899999999999998e-002 | M87: 108.8 | N87: 7.92 | O87: 0.49200000000000005 | P87: 67.8 | Q87: 转股中 | R87: 2.53年 | S87: 0.53年 | T87: 4.56 | U87: 5.5 | V87: 1.2e-002 | W87: 9.4e-002 | X87: 6.4000000000000001e-002 | Y87: 49 | Z87: 7.29 | AA87: 2.9700000000000001e-002 | AB87: 2.29e-002 | AC87: 5.6999999999999993e-003 | AD87: 1.2999999999999999e-003 | AE87: 97.43 | AF87: 93.81 | AG87: 0.05 | AH87: AA- | AI87: 6.13e-002 | AJ87: =H87+100*O87 -> 150.35000000000002 | AK87: 134.5 | AL87: 207 | AM87: 37.1 | AN87: 155 | AO87: -6.5000000000000002e-002 | AP87: 31 | AQ87: 众信转债!
A88: 55 | B88: 123086 | C88: 海兰转债! | D88: 300065 | E88: 海兰信 | F88: 电子 | G88: 电子产品 | H88: 105.293 | I88: -4.0000000000000001e-003 | J88: -4.5000000000000005e-003 | K88: 10.25 | L88: -1.44e-002 | M88: 123.5 | N88: 10.88 | O88: 0.11800000000000001 | P88: 94.21 | Q88: 27天 | R88: 5.56年 | S88: 3.56年 | T88: 7.3 | U88: 13 | V88: 1.7000000000000001e-002 | W88: 0.17899999999999999 | X88: 0.16899999999999998 | Y88: 41 | Z88: 2.75 | AA88: 2.9700000000000001e-002 | AB88: 2.23e-002 | AC88: -3.8e-003 | AD88: -5.7999999999999996e-003 | AE88: 82.49 | AF88: 87.9 | AG88: 0.59 | AH88: AA- | AI88: 6.4399999999999999e-002 | AJ88: =H88+100*O88 -> 117.093 | AK88: 116.4 | AL88: 25 | AM88: 28.5 | AN88: 62 | AO88: -4.2000000000000003e-002 | AP88: 15 | AQ88: 海兰转债!
A89: 56 | B89: 123084 | C89: 高澜转债! | D89: 300499 | E89: 高澜股份 | F89: 能源电力 | G89: 电力设备 | H89: 104.099 | I89: 1.66e-002 | J89: -1.3500000000000002e-002 | K89: 7.58 | L89: 8.0000000000000002e-003 | M89: 121.9 | N89: 11.36 | O89: 0.56000000000000005 | P89: 66.73 | Q89: 26天 | R89: 5.55年 | S89: 3.56年 | T89: 2.8 | U89: 36 | V89: 0.122 | W89: 0.13300000000000001 | X89: 8.900000000000001e-002 | Y89: 21 | Z89: 2.52 | AA89: 2.9500000000000002e-002 | AB89: 2.2499999999999999e-002 | AC89: 1.9e-003 | AD89: -5.9999999999999995e-004 | AE89: 80.24 | AF89: 82.23 | AG89: 0.39 | AH89: A+ | AI89: 7.5399999999999995e-002 | AJ89: =H89+100*O89 -> 160.09900000000002 | AK89: 141.5 | AL89: 258 | AM89: 59.2 | AN89: 298 | AO89: -7.0999999999999994e-002 | AP89: 11 | AQ89: 高澜转债!
A90: 267 | B90: 113534 | C90: 鼎胜转债! | D90: 603876 | E90: 鼎胜新材 | F90: 有色金属 | G90: 小金属 | H90: 102.35 | I90: 1.49e-002 | J90: 2.3999999999999998e-003 | K90: 13.53 | L90: 4.24e-002 | M90: 114.3 | N90: 15.18 | O90: 0.14800000000000002 | P90: 89.13 | Q90: 转股中 | R90: 3.88年 | S90: 1.89年 | T90: 12 | U90: 31 | V90: 2.5000000000000001e-002 | W90: 0.20399999999999999 | X90: 0.182 | Y90: 59 | Z90: 1.62 | AA90: 2.9399999999999999e-002 | AB90: 2.2499999999999999e-002 | AC90: 2.2000000000000001e-003 | AD90: -5.0000000000000001e-004 | AE90: 94.53 | AF90: 97.7 | AG90: 0.41 | AH90: AA | AI90: 4.2000000000000003e-002 | AJ90: =H90+100*O90 -> 117.14999999999999 | AK90: 115.6 | AL90: 20 | AM90: 17.9 | AN90: 8 | AO90: 5.2999999999999999e-002 | AP90: 37 | AQ90: 鼎胜转债!
A91: 57 | B91: 127027 | C91: 靖远转债! | D91: 552 | E91: 靖远煤电 | F91: 煤炭 | G91: 煤炭开采 | H91: 98.562 | I91: 5.6999999999999993e-003 | J91: -2.3999999999999998e-003 | K91: 2.99 | L91: 6.7000000000000002e-003 | M91: 115.3 | N91: 3.33 | O91: 9.8000000000000004e-002 | P91: 89.79 | Q91: 26天 | R91: 5.55年 | S91: 3.56年 | T91: 28 | U91: 51 | V91: 1.9e-002 | W91: 0.40899999999999997 | X91: 0.36799999999999999 | Y91: 68 | Z91: 0.86 | AA91: 2.92e-002 | AB91: 2.41e-002 | AC91: 1.4199999999999999e-002 | AD91: 1.21e-002 | AE91: 89.39 | AF91: 92.45 | AG91: 0.5 | AH91: AA+ | AI91: 4.1399999999999999e-002 | AJ91: =H91+100*O91 -> 108.36199999999999 | AK91: 107.3 | AL91: 3 | AM91: 14.9 | AN91: 3 | AO91: -2.5000000000000001e-002 | AP91: 33 | AQ91: 靖远转债!
A92: 279 | B92: 110056 | C92: 亨通转债! | D92: 600487 | E92: 亨通光电 | F92: 通信互联 | G92: 通信设备 | H92: 102.64 | I92: 8.9999999999999998e-004 | J92: -5.3e-003 | K92: 11.51 | L92: -1.8799999999999997e-002 | M92: 114.3 | N92: 15.01 | O92: 0.33899999999999997 | P92: 76.68 | Q92: 转股中 | R92: 3.82年 | S92: 1.83年 | T92: 17.1 | U92: 16 | V92: 9.0000000000000011e-003 | W92: 6.3e-002 | X92: 4.8000000000000001e-002 | Y92: 272 | Z92: 1.35 | AA92: 2.9100000000000001e-002 | AB92: 2.2099999999999998e-002 | AC92: 8.0000000000000004e-004 | AD92: -2.e-003 | AE92: 95.12 | AF92: 98.64 | AG92: 0.23 | AH92: AA+ | AI92: 4.0000000000000001e-002 | AJ92: =H92+100*O92 -> 136.53999999999999 | AK92: 128.6 | AL92: 137 | AM92: 30 | AN92: 82 | AO92: -2.1000000000000001e-002 | AP92: 29 | AQ92: 亨通转债!
A93: 349 | B93: 113014 | C93: 林洋转债! | D93: 601222 | E93: 林洋能源 | F93: 能源电力 | G93: 电力设备 | H93: 102.07 | I93: 4.0999999999999995e-003 | J93: -1.7000000000000001e-003 | K93: 6.75 | L93: 1.2e-002 | M93: 109.3 | N93: 8.54 | O93: 0.29100000000000004 | P93: 79.04 | Q93: 转股中 | R93: 2.44年 | S93: 0.44年 | T93: 30 | U93: 15 | V93: 5.0000000000000001e-003 | W93: 0.254 | X93: 0.20100000000000001 | Y93: 118 | Z93: 1.13 | AA93: 2.8999999999999998e-002 | AB93: 2.1600000000000001e-002 | AC93: -4.4000000000000003e-003 | AD93: -1.03e-002 | AE93: 99.42 | AF93: 99.45 | AG93: 0.2 | AH93: AA | AI93: 4.0300000000000002e-002 | AJ93: =H93+100*O93 -> 131.16999999999999 | AK93: 125.1 | AL93: 95 | AM93: 25.6 | AN93: 41 | AO93: 2.e-003 | AP93: 31 | AQ93: 林洋转债!
A94: 271 | B94: 113532 | C94: 海环转债! | D94: 603817 | E94: 海峡环保 | F94: 城市公用 | G94: 三废处理 | H94: 100.75 | I94: 5.1999999999999998e-003 | J94: -4.3e-003 | K94: 5.9 | L94: 3.4000000000000002e-003 | M94: 112.3 | N94: 7.69 | O94: 0.313 | P94: 76.72 | Q94: 转股中 | R94: 3.86年 | S94: 1.87年 | T94: 4.59 | U94: 1.8 | V94: 4.0000000000000001e-003 | W94: 0.17300000000000001 | X94: 0.13300000000000001 | Y94: 27 | Z94: 1.5 | AA94: 2.8999999999999998e-002 | AB94: 2.29e-002 | AC94: 1.e-002 | AD94: 7.3000000000000001e-003 | AE94: 94.61 | AF94: 96.07 | AG94: 0.27 | AH94: AA | AI94: 4.2000000000000003e-002 | AJ94: =H94+100*O94 -> 132.05000000000001 | AK94: 124.8 | AL94: 91 | AM94: 28.7 | AN94: 65 | AO94: -1.4999999999999999e-002 | AP94: 27 | AQ94: 海环转债!
A95: 137 | B95: 113593 | C95: 沪工转债 | D95: 603131 | E95: 上海沪工 | F95: 机械装备 | G95: 通用设备 | H95: 105.32 | I95: -1.4000000000000002e-003 | J95: 1.1000000000000001e-003 | K95: 17.91 | L95: -5.9999999999999995e-004 | M95: 121.6 | N95: 21.32 | O95: 0.254 | P95: 84.01 | Q95: 转股中 | R95: 5年59天 | S95: 3.16年 | T95: 4 | U95: 3.5 | V95: 8.0000000000000002e-003 | W95: 7.0000000000000007e-002 | X95: 5.9000000000000004e-002 | Y95: 57 | Z95: 4.33 | AA95: 2.8900000000000002e-002 | AB95: 2.1499999999999998e-002 | AC95: -2.0999999999999999e-003 | AD95: -4.6999999999999993e-003 | AE95: 82.36 | AF95: 84.34 | AG95: 0.55 | AH95: A+ | AI95: 7.5399999999999995e-002 | AJ95: =H95+100*O95 -> 130.72 | AK95: 126.6 | AL95: 109 | AM95: 42.3 | AN95: 204 | AO95: -6.3e-002 | AP95: 10 | AQ95: 沪工转债
A96: 198 | B96: 113568 | C96: 新春转债! | D96: 603667 | E96: 五洲新春 | F96: 机械装备 | G96: 通用设备 | H96: 108.8 | I96: 8.3999999999999995e-003 | J96: 4.1999999999999997e-003 | K96: 9.02 | L96: 2.1499999999999998e-002 | M96: 124.3 | N96: 8.91 | O96: 7.4999999999999997e-002 | P96: 101.23 | Q96: 转股中 | R96: 4.79年 | S96: 2.79年 | T96: 3.3 | U96: 10 | V96: 2.8999999999999998e-002 | W96: 0.125 | X96: 0.127 | Y96: 26 | Z96: 1.49 | AA96: 2.8799999999999999e-002 | AB96: 2.e-002 | AC96: -1.46e-002 | AD96: -1.7299999999999999e-002 | AE96: 87.16 | AF96: 93.39 | AG96: 0.59 | AH96: AA- | AI96: 6.3e-002 | AJ96: =H96+100*O96 -> 116.3 | AK96: 116.4 | AL96: 24 | AM96: 23 | AN96: 24 | AO96: 6.2e-002 | AP96: 50 | AQ96: 新春转债!
A97: 40 | B97: 128143 | C97: 锋龙转债! | D97: 2931 | E97: 锋龙股份 | F97: 机械装备 | G97: 专用设备 | H97: 104.23 | I97: 5.1999999999999998e-003 | J97: 1.9e-003 | K97: 15.37 | L97: 1.18e-002 | M97: 121.7 | N97: 17.97 | O97: 0.21899999999999997 | P97: 85.53 | Q97: 54天 | R97: 5.63年 | S97: 3.64年 | T97: 2.45 | U97: 1.8 | V97: 6.9999999999999993e-003 | W97: 0.11199999999999999 | X97: 9.6000000000000002e-002 | Y97: 22 | Z97: 3.49 | AA97: 2.8500000000000001e-002 | AB97: 2.1700000000000001e-002 | AC97: 1.e-003 | AD97: -1.4000000000000002e-003 | AE97: 79.63 | AF97: 81.6 | AG97: 0.6 | AH97: A+ | AI97: 7.5399999999999995e-002 | AJ97: =H97+100*O97 -> 126.13 | AK97: 122.9 | AL97: 78 | AM97: 41.3 | AN97: 195 | AO97: -3.9e-002 | AP97: 9 | AQ97: 锋龙转债!
A98: 294 | B98: 113525 | C98: 台华转债! | D98: 603055 | E98: 台华新材 | F98: 服装纺织 | G98: 纺织行业 | H98: 103.82 | I98: -2.9999999999999997e-004 | J98: 1.6000000000000001e-003 | K98: 6.16 | L98: 4.8999999999999998e-003 | M98: 114.3 | N98: 7.83 | O98: 0.32000000000000001 | P98: 78.67 | Q98: 转股中 | R98: 3.57年 | S98: 1.58年 | T98: 4.69 | U98: 1.5 | V98: 3.0000000000000001e-003 | W98: 9.1999999999999998e-002 | X98: 7.2000000000000008e-002 | Y98: 51 | Z98: 1.69 | AA98: 2.7799999999999998e-002 | AB98: 2.0299999999999999e-002 | AC98: -5.6999999999999993e-003 | AD98: -8.8000000000000005e-003 | AE98: 95.75 | AF98: 98.95 | AG98: 0.26 | AH98: AA | AI98: 4.2000000000000003e-002 | AJ98: =H98+100*O98 -> 135.81999999999999 | AK98: 129 | AL98: 140 | AM98: 30 | AN98: 83 | AO98: 5.0000000000000001e-003 | AP98: 21 | AQ98: 台华转债!
A99: 181 | B99: 128105 | C99: 长集转债! | D99: 2616 | E99: 长青集团 | F99: 城市公用 | G99: 三废处理 | H99: 100.8 | I99: -3.4999999999999996e-003 | J99: 2.9999999999999997e-004 | K99: 6.13 | L99: -9.7000000000000003e-003 | M99: 114.9 | N99: 7.91 | O99: 0.30099999999999999 | P99: 77.5 | Q99: 转股中 | R99: 4.88年 | S99: 2.89年 | T99: 8 | U99: 2.9 | V99: 4.0000000000000001e-003 | W99: 0.17600000000000002 | X99: 0.13600000000000001 | Y99: 45 | Z99: 1.71 | AA99: 2.7699999999999999e-002 | AB99: 2.2000000000000002e-002 | AC99: 8.5000000000000006e-003 | AD99: 6.3e-003 | AE99: 91.3 | AF99: 94.34 | AG99: 0.33 | AH99: AA | AI99: 4.2000000000000003e-002 | AJ99: =H99+100*O99 -> 130.90000000000001 | AK99: 124.1 | AL99: 87 | AM99: 29.8 | AN99: 81 | AO99: -7.400000000000001e-002 | AP99: 14 | AQ99: 长集转债!
A100: 106 | B100: 128131 | C100: 崇达转2! | D100: 2815 | E100: 崇达技术 | F100: 电子 | G100: 元器件制 | H100: 99.948 | I100: -2.5000000000000001e-003 | J100: 2.8000000000000004e-003 | K100: 11.22 | L100: 2.7000000000000001e-003 | M100: 115.2 | N100: 19.29 | O100: 0.71799999999999997 | P100: 58.16 | Q100: 转股中 | R100: 5.30年 | S100: 3.30年 | T100: 14 | U100: 9.6 | V100: 6.9999999999999993e-003 | W100: 0.14099999999999999 | X100: 8.199999999999999e-002 | Y100: 99 | Z100: 2.35 | AA100: 2.7699999999999999e-002 | AB100: 2.2400000000000003e-002 | AC100: 1.0800000000000001e-002 | AD100: 8.6999999999999994e-003 | AE100: 89.64 | AF100: 92.4 | AG100: 0.13 | AH100: AA | AI100: 4.3400000000000001e-002 | AJ100: =H100+100*O100 -> 171.74799999999999 | AK100: 141.7 | AL100: 259 | AM100: 49.3 | AN100: 246 | AO100: -4.0000000000000001e-002 | AP100: 8 | AQ100: 崇达转2!
A101: 124 | B101: 123063 | C101: 大禹转债 | D101: 300021 | E101: 大禹节水 | F101: 化工 | G101: 橡胶塑料 | H101: 110.34 | I101: 1.26e-002 | J101: -2.9999999999999997e-004 | K101: 5.04 | L101: 2.0199999999999999e-002 | M101: 126.5 | N101: 4.94 | O101: 8.199999999999999e-002 | P101: 102.02 | Q101: 转股中 | R101: 5.18年 | S101: 4.19年 | T101: 6.38 | U101: 78 | V101: 0.109 | W101: 0.159 | X101: 0.16200000000000001 | Y101: 40 | Z101: 2.65 | AA101: 2.7300000000000001e-002 | AB101: 1.8600000000000002e-002 | AC101: -7.0999999999999995e-003 | AD101: -1.0200000000000001e-002 | AE101: 81.98 | AF101: 92.22 | AG101: 0.61 | AH101: AA- | AI101: 6.4399999999999999e-002 | AJ101: =H101+100*O101 -> 118.54000000000001 | AK101: 118.7 | AL101: 37 | AM101: 26.4 | AN101: 48 | AO101: 6.0000000000000001e-003 | AP101: 17 | AQ101: 大禹转债
A102: 122 | B102: 128125 | C102: 华阳转债! | D102: 2949 | E102: 华阳国际 | F102: 建筑 | G102: 建筑工程 | H102: 103.357 | I102: 4.4000000000000003e-003 | J102: -3.5999999999999999e-003 | K102: 18.76 | L102: 2.0999999999999999e-003 | M102: 118.5 | N102: 25.79 | O102: 0.42100000000000004 | P102: 72.74 | Q102: 转股中 | R102: 5.19年 | S102: 3.19年 | T102: 4.5 | U102: 1.2 | V102: 3.0000000000000001e-003 | W102: 0.122 | X102: 8.900000000000001e-002 | Y102: 37 | Z102: 2.88 | AA102: 2.7300000000000001e-002 | AB102: 2.0799999999999999e-002 | AC102: 1.4000000000000002e-003 | AD102: -8.0000000000000004e-004 | AE102: 84.4 | AF102: 86.32 | AG102: 0.39 | AH102: AA- | AI102: 6.4399999999999999e-002 | AJ102: =H102+100*O102 -> 145.45699999999999 | AK102: 134 | AL102: 203 | AM102: 47.7 | AN102: 237 | AO102: -8.0000000000000002e-003 | AP102: 6 | AQ102: 华阳转债!
A103: 215 | B103: 123039 | C103: 开润转债! | D103: 300577 | E103: 开润股份 | F103: 服装纺织 | G103: 纺织行业 | H103: 107.232 | I103: 8.9999999999999998e-004 | J103: -6.1999999999999998e-003 | K103: 21.3 | L103: -1.4800000000000001e-002 | M103: 121 | N103: 30 | O103: 0.51000000000000001 | P103: 71 | Q103: 转股中 | R103: 4.60年 | S103: 2.60年 | T103: 2.22 | U103: 1.9 | V103: 8.0000000000000002e-003 | W103: 4.2999999999999997e-002 | X103: 3.1e-002 | Y103: 51 | Z103: 3.34 | AA103: 2.7200000000000002e-002 | AB103: 1.9099999999999999e-002 | AC103: -1.0800000000000001e-002 | AD103: -1.3600000000000001e-002 | AE103: 85.63 | AF103: 87.82 | AG103: 0.35 | AH103: A+ | AI103: 7.400000000000001e-002 | AJ103: =H103+100*O103 -> 158.232 | AK103: 143.5 | AL103: 270 | AM103: 55.6 | AN103: 284 | AO103: -8.5000000000000006e-002 | AP103: 24 | AQ103: 开润转债!
A104: 65 | B104: 123080 | C104: 海波转债! | D104: 300517 | E104: 海波重科 | F104: 建筑 | G104: 建筑工程 | H104: 109.499 | I104: 4.0999999999999995e-003 | J104: -2.2000000000000001e-003 | K104: 21.75 | L104: 2.8000000000000004e-003 | M104: 126.5 | N104: 20.91 | O104: 5.2999999999999999e-002 | P104: 104.02 | Q104: 18天 | R104: 5.53年 | S104: 3.53年 | T104: 2.45 | U104: 7 | V104: 2.6000000000000002e-002 | W104: 0.106 | X104: 0.11 | Y104: 23 | Z104: 2.8 | AA104: 2.7000000000000003e-002 | AB104: 1.89e-002 | AC104: -1.23e-002 | AD104: -1.46e-002 | AE104: 80.27 | AF104: 85.42 | AG104: 0.68 | AH104: A+ | AI104: 7.5399999999999995e-002 | AJ104: =H104+100*O104 -> 114.79899999999999 | AK104: 115 | AL104: 17 | AM104: 29.6 | AN104: 77 | AO104: -5.9000000000000004e-002 | AP104: 17 | AQ104: 海波转债!
A105: 5 | B105: 123112 | C105: 万讯转债 | D105: 300112 | E105: 万讯自控 | F105: 机械装备 | G105: 专用设备 | H105: 106.71 | I105: 1.1699999999999999e-002 | J105: -5.4000000000000003e-003 | K105: 8.32 | L105: 1.09e-002 | M105: 124.4 | N105: 9.13 | O105: 0.17100000000000001 | P105: 91.13 | Q105: 4月26天 | R105: 5.88年 | S105: 3.88年 | T105: 2.46 | U105: 11 | V105: 4.0000000000000001e-002 | W105: 0.10300000000000001 | X105: 9.4e-002 | Y105: 24 | Z105: 2.22 | AA105: 2.7000000000000003e-002 | AB105: 1.9799999999999998e-002 | AC105: -5.6000000000000008e-003 | AD105: -7.7000000000000002e-003 | AE105: 81.24 | AF105: 86.83 | AG105: 0.58 | AH105: AA- | AI105: 6.4399999999999999e-002 | AJ105: =H105+100*O105 -> 123.81 | AK105: 122.3 | AL105: 73 | AM105: 35.5 | AN105: 142 | AO105: 3.0000000000000001e-003 | AP105: 7 | AQ105: 万讯转债
A106: 138 | B106: 128120 | C106: 联诚转债! | D106: 2921 | E106: 联诚精密 | F106: 汽车 | G106: 零部件制 | H106: 103.66 | I106: -1.7000000000000001e-003 | J106: -1.e-003 | K106: 15.63 | L106: -4.5000000000000005e-003 | M106: 118.4 | N106: 18.44 | O106: 0.223 | P106: 84.76 | Q106: 转股中 | R106: 5年56天 | S106: 3年57天 | T106: 2.6 | U106: 4.1 | V106: 1.4999999999999999e-002 | W106: 0.157 | X106: 0.13300000000000001 | Y106: 17 | Z106: 1.61 | AA106: 2.6800000000000001e-002 | AB106: 2.0299999999999999e-002 | AC106: 2.7000000000000001e-003 | AD106: 0. | AE106: 79.95 | AF106: 78.49 | AG106: 0.62 | AH106: A | AI106: 8.539999999999999e-002 | AJ106: =H106+100*O106 -> 125.95999999999999 | AK106: 122.6 | AL106: 76 | AM106: 42.6 | AN106: 207 | AO106: -0.19 | AP106: 20 | AQ106: 联诚转债!
A107: 107 | B107: 123065 | C107: 宝莱转债! | D107: 300246 | E107: 宝莱特 | F107: 医药 | G107: 医疗器械 | H107: 106 | I107: -3.5999999999999999e-003 | J107: 2.7000000000000001e-003 | K107: 18.28 | L107: -1.1399999999999999e-002 | M107: 121.4 | N107: 40.54 | O107: 1.3500000000000001 | P107: 45.09 | Q107: 转股中 | R107: 5.29年 | S107: 3.29年 | T107: 2.19 | U107: 80 | V107: 0.34100000000000003 | W107: 8.199999999999999e-002 | X107: 3.7000000000000005e-002 | Y107: 27 | Z107: 3.01 | AA107: 2.6600000000000002e-002 | AB107: 1.9400000000000001e-002 | AC107: -4.6999999999999993e-003 | AD107: -7.0999999999999995e-003 | AE107: 84.29 | AF107: 87.95 | AG107: 0.08 | AH107: AA- | AI107: 6.4399999999999999e-002 | AJ107: =H107+100*O107 -> 241. | AK107: 166.9 | AL107: 321 | AM107: 79 | AN107: 329 | AO107: -7.4999999999999997e-002 | AP107: 16 | AQ107: 宝莱转债!
A108: 340 | B108: 128023 | C108: 亚太转债! | D108: 2284 | E108: 亚太股份 | F108: 汽车 | G108: 零部件制 | H108: 104.32 | I108: 2.8999999999999998e-003 | J108: -1.e-004 | K108: 6.98 | L108: 3.1e-002 | M108: 111.3 | N108: 10.34 | O108: 0.54500000000000004 | P108: 67.5 | Q108: 转股中 | R108: 2.54年 | S108: 0.54年 | T108: 9.99 | U108: 73 | V108: 7.0000000000000007e-002 | W108: 0.19399999999999998 | X108: 0.13100000000000001 | Y108: 51 | Z108: 2.07 | AA108: 2.63e-002 | AB108: 1.78e-002 | AC108: -3.4099999999999998e-002 | AD108: -3.9e-002 | AE108: 99.01 | AF108: 100.85 | AG108: 0.09 | AH108: AA | AI108: 4.0300000000000002e-002 | AJ108: =H108+100*O108 -> 158.81999999999999 | AK108: 141.1 | AL108: 254 | AM108: 40.3 | AN108: 183 | AO108: -1.3999999999999999e-002 | AP108: 69 | AQ108: 亚太转债!
A109: 131 | B109: 113037 | C109: 紫银转债 | D109: 601860 | E109: 紫金银行 | F109: 金融 | G109: 银行行业 | H109: 101.87 | I109: 1.1999999999999999e-003 | J109: -2.2000000000000001e-003 | K109: 3.81 | L109: -2.5999999999999999e-003 | M109: 115.8 | N109: 4.75 | O109: 0.27000000000000002 | P109: 80.21 | Q109: 转股中 | R109: 5.17年 | S109: 无权 | T109: 45 | U109: 24 | V109: 5.0000000000000001e-003 | W109: 0.32299999999999995 | X109: 0.25900000000000001 | Y109: 139 | Z109: 0.95 | AA109: 2.5699999999999997e-002 | AB109: 2.e-002 | AC109: 无权 | AD109: 无权 | AE109: 无权 | AF109: 94.32 | AG109: 0.38 | AH109: AA+ | AI109: 4.1399999999999999e-002 | AJ109: =H109+100*O109 -> 128.87 | AK109: 123.5 | AL109: 83 | AM109: 29.2 | AN109: 71 | AO109: -1.2e-002 | AP109: 19 | AQ109: 紫银转债
A110: 37 | B110: 113619 | C110: 世运转债! | D110: 603920 | E110: 世运电路 | F110: 电子 | G110: 元器件制 | H110: 100.05 | I110: 2.0000000000000001e-004 | J110: -1.e-003 | K110: 15.29 | L110: -5.1999999999999998e-003 | M110: 115.2 | N110: 26.5 | O110: 0.7340000000000001 | P110: 57.7 | Q110: 2月6天 | R110: 5.67年 | S110: 3.67年 | T110: 10 | U110: 1.8 | V110: 2.e-003 | W110: 0.16 | X110: 9.1999999999999998e-002 | Y110: 63 | Z110: 2.29 | AA110: 2.5699999999999997e-002 | AB110: 2.07e-002 | AC110: 9.4999999999999998e-003 | AD110: 7.6e-003 | AE110: 88.24 | AF110: 90.96 | AG110: 0.15 | AH110: AA | AI110: 4.3400000000000001e-002 | AJ110: =H110+100*O110 -> 173.44999999999999 | AK110: 142.4 | AL110: 263 | AM110: 51.4 | AN110: 263 | AO110: -7.400000000000001e-002 | AP110: 4 | AQ110: 世运转债!
A111: 306 | B111: 113516 | C111: 苏农转债! | D111: 603323 | E111: 苏农银行 | F111: 金融 | G111: 银行行业 | H111: 105.64 | I111: 2.8000000000000004e-003 | J111: -4.0000000000000001e-003 | K111: 4.5 | L111: -4.4000000000000003e-003 | M111: 114.3 | N111: 5.52 | O111: 0.29600000000000004 | P111: 81.52 | Q111: 转股中 | R111: 3.20年 | S111: 无权 | T111: 12.9 | U111: 2.2 | V111: 2.e-003 | W111: 0.159 | X111: 0.13 | Y111: 81 | Z111: 0.66 | AA111: 2.5499999999999998e-002 | AB111: 1.72e-002 | AC111: 无权 | AD111: 无权 | AE111: 无权 | AF111: 101.1 | AG111: 0.27 | AH111: AA+ | AI111: 4.0000000000000001e-002 | AJ111: =H111+100*O111 -> 135.24000000000001 | AK111: 129.8 | AL111: 146 | AM111: 28.7 | AN111: 64 | AO111: -1.3000000000000001e-002 | AP111: 30 | AQ111: 苏农转债!
A112: 174 | B112: 123050 | C112: 聚飞转债 | D112: 300303 | E112: 聚飞光电 | F112: 电子 | G112: LED制 | H112: 109.84 | I112: -3.3e-003 | J112: 0. | K112: 4.75 | L112: -6.3e-003 | M112: 123.8 | N112: 5.18 | O112: 0.19800000000000001 | P112: 91.7 | Q112: 转股中 | R112: 4.90年 | S112: 2.90年 | T112: 7.05 | U112: 0.8 | V112: 1.e-003 | W112: 0.11599999999999999 | X112: 0.106 | Y112: 61 | Z112: 2.47 | AA112: 2.52e-002 | AB112: 1.6799999999999999e-002 | AC112: -1.8700000000000001e-002 | AD112: -2.1000000000000001e-002 | AE112: 86.16 | AF112: 92.35 | AG112: 0.52 | AH112: AA- | AI112: 6.3e-002 | AJ112: =H112+100*O112 -> 129.64000000000001 | AK112: 128 | AL112: 128 | AM112: 35.6 | AN112: 143 | AO112: -2.1000000000000001e-002 | AP112: 12 | AQ112: 聚飞转债
A113: 43 | B113: 123092 | C113: 天壕转债 | D113: 300332 | E113: 天壕环境 | F113: 石油天然 | G113: 天然气 | H113: 106.153 | I113: -6.0999999999999995e-003 | J113: -1.9e-003 | K113: 4.83 | L113: -1.23e-002 | M113: 121.6 | N113: 5.2 | O113: 0.14300000000000002 | P113: 92.88 | Q113: 40天 | R113: 5.59年 | S113: 3.59年 | T113: 4.23 | U113: 1.4 | V113: 3.0000000000000001e-003 | W113: 9.9000000000000005e-002 | X113: 9.1999999999999998e-002 | Y113: 43 | Z113: 1.26 | AA113: 2.52e-002 | AB113: 1.83e-002 | AC113: -3.9000000000000003e-003 | AD113: -6.3e-003 | AE113: 79.85 | AF113: 81.77 | AG113: 0.65 | AH113: A+ | AI113: 7.5399999999999995e-002 | AJ113: =H113+100*O113 -> 120.453 | AK113: 119.4 | AL113: 46 | AM113: 37.6 | AN113: 161 | AO113: 2.2000000000000002e-002 | AP113: 7 | AQ113: 天壕转债
A114: 119 | B114: 127021 | C114: 特发转2! | D114: 70 | E114: 特发信息 | F114: 通信互联 | G114: 通信设备 | H114: 102.2 | I114: -1.7000000000000001e-003 | J114: -5.9999999999999995e-004 | K114: 7.45 | L114: -2.1000000000000001e-002 | M114: 113.3 | N114: 12.33 | O114: 0.69099999999999995 | P114: 60.42 | Q114: 转股中 | R114: 4.21年 | S114: 2.21年 | T114: 5.5 | U114: 6.4 | V114: 1.1000000000000001e-002 | W114: 8.900000000000001e-002 | X114: 5.4000000000000006e-002 | Y114: 62 | Z114: 2.1 | AA114: 2.5099999999999997e-002 | AB114: 1.9199999999999998e-002 | AC114: -5.9999999999999995e-004 | AD114: -2.3e-003 | AE114: 92.58 | AF114: 95.49 | AG114: 0.11 | AH114: AA | AI114: 4.2000000000000003e-002 | AJ114: =H114+100*O114 -> 171.30000000000001 | AK114: 144 | AL114: 273 | AM114: 48.5 | AN114: 242 | AO114: 2.4e-002 | AP114: 11 | AQ114: 特发转2!
A115: 221 | B115: 128087 | C115: 孚日转债! | D115: 2083 | E115: 孚日股份 | F115: 服装纺织 | G115: 家纺 | H115: 101.1 | I115: 2.3e-003 | J115: -1.1000000000000001e-003 | K115: 4.13 | L115: 2.3999999999999998e-003 | M115: 112.9 | N115: 4.5 | O115: 0.10199999999999999 | P115: 91.78 | Q115: 转股中 | R115: 4.57年 | S115: 2.58年 | T115: 6.5 | U115: 10 | V115: 1.4999999999999999e-002 | W115: 0.17300000000000001 | X115: 0.159 | Y115: 38 | Z115: 1.03 | AA115: 2.4900000000000002e-002 | AB115: 1.9599999999999999e-002 | AC115: 8.3000000000000001e-003 | AD115: 5.8999999999999999e-003 | AE115: 92.47 | AF115: 93.9 | AG115: 0.49 | AH115: AA | AI115: 4.2000000000000003e-002 | AJ115: =H115+100*O115 -> 111.3 | AK115: 110.4 | AL115: 7 | AM115: 16.5 | AN115: 6 | AO115: -1.3999999999999999e-002 | AP115: 59 | AQ115: 孚日转债!
A116: 229 | B116: 113549 | C116: 白电转债 | D116: 603861 | E116: 白云电器 | F116: 能源电力 | G116: 电力设备 | H116: 103.35 | I116: 4.8999999999999998e-003 | J116: -4.8999999999999998e-003 | K116: 8.1 | L116: 0. | M116: 114.8 | N116: 8.88 | O116: 0.13300000000000001 | P116: 91.22 | Q116: 转股中 | R116: 4.49年 | S116: 2.49年 | T116: 8.8 | U116: 7 | V116: 8.0000000000000002e-003 | W116: 0.24600000000000002 | X116: 0.22399999999999998 | Y116: 36 | Z116: 1.39 | AA116: 2.4199999999999999e-002 | AB116: 1.8000000000000002e-002 | AC116: -2.0000000000000001e-004 | AD116: -2.5999999999999999e-003 | AE116: 92.71 | AF116: 95.8 | AG116: 0.46 | AH116: AA | AI116: 4.2000000000000003e-002 | AJ116: =H116+100*O116 -> 116.64999999999999 | AK116: 115.5 | AL116: 19 | AM116: 19.7 | AN116: 14 | AO116: 2.e-002 | AP116: 39 | AQ116: 白电转债
A117: 241 | B117: 128076 | C117: 金轮转债! | D117: 2722 | E117: 金轮股份 | F117: 机械装备 | G117: 专用设备 | H117: 103.71 | I117: -1.9e-003 | J117: 4.0000000000000002e-004 | K117: 11.79 | L117: -3.4000000000000002e-003 | M117: 114.9 | N117: 14.76 | O117: 0.29799999999999999 | P117: 79.88 | Q117: 转股中 | R117: 4.40年 | S117: 2.40年 | T117: 2.14 | U117: 5.9 | V117: 2.6000000000000002e-002 | W117: 0.10300000000000001 | X117: 8.3000000000000004e-002 | Y117: 21 | Z117: 1.09 | AA117: 2.41e-002 | AB117: 1.78e-002 | AC117: -1.1999999999999999e-003 | AD117: -3.8e-003 | AE117: 88.54 | AF117: 88.33 | AG117: 0.44 | AH117: AA- | AI117: 6.3e-002 | AJ117: =H117+100*O117 -> 133.50999999999999 | AK117: 127.5 | AL117: 122 | AM117: 39 | AN117: 177 | AO117: 1.2e-002 | AP117: 42 | AQ117: 金轮转债!
A118: 32 | B118: 123097 | C118: 美力转债 | D118: 300611 | E118: 美力科技 | F118: 机械装备 | G118: 通用设备 | H118: 106.63 | I118: 8.6999999999999994e-003 | J118: 1.7000000000000001e-003 | K118: 9.1 | L118: 1.5600000000000001e-002 | M118: 121.6 | N118: 9.34 | O118: 9.4e-002 | P118: 97.43 | Q118: 2月13天 | R118: 5.69年 | S118: 3.69年 | T118: 3 | U118: 18 | V118: 5.7000000000000002e-002 | W118: 0.184 | X118: 0.17899999999999999 | Y118: 16 | Z118: 2.45 | AA118: 2.3900000000000001e-002 | AB118: 1.72e-002 | AC118: -5.0000000000000001e-003 | AD118: -7.3000000000000001e-003 | AE118: 79.32 | AF118: 81.22 | AG118: 0.67 | AH118: A+ | AI118: 7.5399999999999995e-002 | AJ118: =H118+100*O118 -> 116.03 | AK118: 115.8 | AL118: 22 | AM118: 34.6 | AN118: 131 | AO118: 1.6e-002 | AP118: 13 | AQ118: 美力转债
A119: 148 | B119: 123057 | C119: 美联转债! | D119: 300586 | E119: 美联新材 | F119: 化工 | G119: 橡胶塑料 | H119: 105.214 | I119: -2.7000000000000001e-003 | J119: 6.1999999999999998e-003 | K119: 7.73 | L119: 7.8000000000000005e-003 | M119: 118.2 | N119: 9.91 | O119: 0.34899999999999998 | P119: 78 | Q119: 转股中 | R119: 5年40天 | S119: 3年41天 | T119: 2.07 | U119: 18 | V119: 8.1000000000000003e-002 | W119: 5.9000000000000004e-002 | X119: 4.5999999999999999e-002 | Y119: 35 | Z119: 4.75 | AA119: 2.3599999999999999e-002 | AB119: 1.7100000000000001e-002 | AC119: -3.2000000000000002e-003 | AD119: -5.6000000000000008e-003 | AE119: 85.08 | AF119: 86.59 | AG119: 0.45 | AH119: AA- | AI119: 6.4399999999999999e-002 | AJ119: =H119+100*O119 -> 140.114 | AK119: 132.4 | AL119: 181 | AM119: 45.8 | AN119: 228 | AO119: -8.0000000000000002e-003 | AP119: 17 | AQ119: 美联转债!
A120: 67 | B120: 113610 | C120: 灵康转债 | D120: 603669 | E120: 灵康药业 | F120: 医药 | G120: 化学制药 | H120: 106.74 | I120: -1.5e-003 | J120: 8.0000000000000004e-004 | K120: 9.1 | L120: -1.1000000000000001e-003 | M120: 121.1 | N120: 8.81 | O120: 3.3000000000000002e-002 | P120: 103.29 | Q120: 17天 | R120: 5.53年 | S120: 3.53年 | T120: 5.25 | U120: 12 | V120: 2.1000000000000001e-002 | W120: 8.1000000000000003e-002 | X120: 8.4000000000000005e-002 | Y120: 65 | Z120: 4.61 | AA120: 2.3599999999999999e-002 | AB120: 1.6799999999999999e-002 | AC120: -6.9999999999999993e-003 | AD120: -9.1000000000000004e-003 | AE120: 82.79 | AF120: 86.39 | AG120: 0.67 | AH120: AA- | AI120: 6.4399999999999999e-002 | AJ120: =H120+100*O120 -> 110.03999999999999 | AK120: 110.2 | AL120: 6 | AM120: 23.8 | AN120: 32 | AO120: -1.e-002 | AP120: 22 | AQ120: 灵康转债
A121: 160 | B121: 123053 | C121: 宝通转债! | D121: 300031 | E121: 宝通科技 | F121: 通信互联 | G121: 互联网 | H121: 108.21 | I121: 4.8999999999999998e-003 | J121: -8.3999999999999995e-003 | K121: 17.4 | L121: -7.4000000000000003e-003 | M121: 121.3 | N121: 20.8 | O121: 0.29399999999999998 | P121: 83.65 | Q121: 转股中 | R121: 5年14天 | S121: 3年15天 | T121: 5 | U121: 32 | V121: 5.7999999999999996e-002 | W121: 7.2000000000000008e-002 | X121: 6.0999999999999999e-002 | Y121: 69 | Z121: 2.25 | AA121: 2.35e-002 | AB121: 1.6e-002 | AC121: -1.18e-002 | AD121: -1.43e-002 | AE121: 85.56 | AF121: 89.27 | AG121: 0.48 | AH121: AA- | AI121: 6.4399999999999999e-002 | AJ121: =H121+100*O121 -> 137.60999999999999 | AK121: 132.8 | AL121: 187 | AM121: 43.5 | AN121: 219 | AO121: 6.2e-002 | AP121: 10 | AQ121: 宝通转债!
A122: 123 | B122: 113597 | C122: 佳力转债! | D122: 603912 | E122: 佳力图 | F122: 机械装备 | G122: 专用设备 | H122: 110.68 | I122: 1.1999999999999999e-003 | J122: 6.6e-003 | K122: 15.01 | L122: 3.0200000000000001e-002 | M122: 124.5 | N122: 23.4 | O122: 0.72499999999999998 | P122: 64.15 | Q122: 转股中 | R122: 5.19年 | S122: 3.19年 | T122: 3 | U122: 1053. | V122: 3.1200000000000001 | W122: 9.1999999999999998e-002 | X122: 5.9000000000000004e-002 | Y122: 33 | Z122: 3.5 | AA122: 2.35e-002 | AB122: 1.5300000000000001e-002 | AC122: -1.7399999999999999e-002 | AD122: -1.9900000000000001e-002 | AE122: 84.91 | AF122: 90.76 | AG122: 0.26 | AH122: AA- | AI122: 6.4399999999999999e-002 | AJ122: =H122+100*O122 -> 183.18000000000001 | AK122: 157.2 | AL122: 312 | AM122: 66.5 | AN122: 313 | AO122: 0.11699999999999999 | AP122: 13 | AQ122: 佳力转债!
A123: 62 | B123: 128140 | C123: 润建转债! | D123: 2929 | E123: 润建股份 | F123: 通信互联 | G123: 通信设备 | H123: 101.8 | I123: 1.8e-003 | J123: -3.0000000000000001e-003 | K123: 22.85 | L123: -2.5999999999999999e-003 | M123: 115.2 | N123: 26.55 | O123: 0.183 | P123: 86.06 | Q123: 21天 | R123: 5.55年 | S123: 3.55年 | T123: 10.9 | U123: 3.2 | V123: 3.0000000000000001e-003 | W123: 0.21600000000000003 | X123: 0.18600000000000003 | Y123: 50 | Z123: 1.6 | AA123: 2.3e-002 | AB123: 1.7899999999999999e-002 | AC123: 5.0000000000000001e-003 | AD123: 3.0999999999999999e-003 | AE123: 88.69 | AF123: 91.43 | AG123: 0.46 | AH123: AA | AI123: 4.3400000000000001e-002 | AJ123: =H123+100*O123 -> 120.09999999999999 | AK123: 117.5 | AL123: 32 | AM123: 26.1 | AN123: 46 | AO123: -3.2000000000000001e-002 | AP123: 14 | AQ123: 润建转债!
A124: 200 | B124: 113567 | C124: 君禾转债! | D124: 603617 | E124: 君禾股份 | F124: 机械装备 | G124: 通用设备 | H124: 106.9 | I124: 5.3e-003 | J124: -8.0000000000000002e-003 | K124: 9.85 | L124: -5.1000000000000004e-003 | M124: 118.8 | N124: 11.46 | O124: 0.24399999999999999 | P124: 85.95 | Q124: 转股中 | R124: 4.78年 | S124: 2.79年 | T124: 2.1 | U124: 1 | V124: 5.0000000000000001e-003 | W124: 0.107 | X124: 9.1999999999999998e-002 | Y124: 20 | Z124: 2.78 | AA124: 2.2799999999999997e-002 | AB124: 1.5700000000000002e-002 | AC124: -9.4999999999999998e-003 | AD124: -1.2e-002 | AE124: 84.4 | AF124: 85.1 | AG124: 0.55 | AH124: A+ | AI124: 7.400000000000001e-002 | AJ124: =H124+100*O124 -> 131.30000000000001 | AK124: 127.8 | AL124: 126 | AM124: 42.8 | AN124: 210 | AO124: -0.106 | AP124: 35 | AQ124: 君禾转债!
A125: 196 | B125: 113570 | C125: 百达转债! | D125: 603331 | E125: 百达精工 | F125: 机械装备 | G125: 机械装备 | H125: 103.44 | I125: 4.5999999999999999e-003 | J125: -3.4000000000000002e-003 | K125: 9.76 | L125: 2.0999999999999999e-003 | M125: 114.9 | N125: 11.54 | O125: 0.223 | P125: 84.58 | Q125: 转股中 | R125: 4.80年 | S125: 2.81年 | T125: 2.8 | U125: 1.7 | V125: 6.0000000000000001e-003 | W125: 0.16 | X125: 0.13600000000000001 | Y125: 17 | Z125: 2.07 | AA125: 2.2499999999999999e-002 | AB125: 1.6799999999999999e-002 | AC125: -1.e-004 | AD125: -2.3e-003 | AE125: 83.79 | AF125: 82.1 | AG125: 0.57 | AH125: A+ | AI125: 7.400000000000001e-002 | AJ125: =H125+100*O125 -> 125.73999999999999 | AK125: 122.3 | AL125: 74 | AM125: 38.5 | AN125: 172 | AO125: -2.7000000000000003e-002 | AP125: 35 | AQ125: 百达转债!
A126: 323 | B126: 127006 | C126: 敖东转债! | D126: 623 | E126: 吉林敖东 | F126: 金融 | G126: 证券行业 | H126: 101.06 | I126: -3.4999999999999996e-003 | J126: 1.8e-003 | K126: 15.32 | L126: -9.7000000000000003e-003 | M126: 107.4 | N126: 20.42 | O126: 0.34700000000000003 | P126: 75.02 | Q126: 转股中 | R126: 2.81年 | S126: 0.81年 | T126: 24.1 | U126: 16 | V126: 6.0000000000000001e-003 | W126: 0.13500000000000001 | X126: 0.10099999999999999 | Y126: 178 | Z126: 0.77 | AA126: 2.2099999999999998e-002 | AB126: 1.7000000000000001e-002 | AC126: 1.e-004 | AD126: -2.0999999999999999e-003 | AE126: 97.43 | AF126: 96.74 | AG126: 0.18 | AH126: AA+ | AI126: 3.8300000000000001e-002 | AJ126: =H126+100*O126 -> 135.75999999999999 | AK126: 127.1 | AL126: 116 | AM126: 29.7 | AN126: 80 | AO126: 1.e-003 | AP126: 27 | AQ126: 敖东转债!
A127: 76 | B127: 113608 | C127: 威派转债! | D127: 603956 | E127: 威派格 | F127: 机械装备 | G127: 专用设备 | H127: 108.27 | I127: 2.0999999999999999e-003 | J127: 8.3999999999999995e-003 | K127: 16.71 | L127: 1.77e-002 | M127: 121.6 | N127: 19.24 | O127: 0.247 | P127: 86.85 | Q127: 转股中 | R127: 5.47年 | S127: 3.47年 | T127: 4.2 | U127: 0.7 | V127: 2.e-003 | W127: 5.9000000000000004e-002 | X127: 5.0999999999999997e-002 | Y127: 71 | Z127: 6.15 | AA127: 2.2000000000000002e-002 | AB127: 1.4999999999999999e-002 | AC127: -9.4999999999999998e-003 | AD127: -1.1899999999999999e-002 | AE127: 80.57 | AF127: 82.51 | AG127: 0.6 | AH127: A+ | AI127: 7.5399999999999995e-002 | AJ127: =H127+100*O127 -> 132.97 | AK127: 129.7 | AL127: 145 | AM127: 47.2 | AN127: 234 | AO127: -2.9999999999999999e-002 | AP127: 7 | AQ127: 威派转债!
A128: 60 | B128: 127026 | C128: 超声转债! | D128: 823 | E128: 超声电子 | F128: 电子 | G128: 元器件制 | H128: 100.612 | I128: 1.9e-003 | J128: -3.9000000000000003e-003 | K128: 10.33 | L128: -4.7999999999999996e-003 | M128: 113.1 | N128: 12.85 | O128: 0.252 | P128: 80.39 | Q128: 24天 | R128: 5.55年 | S128: 3.55年 | T128: 7 | U128: 3.5 | V128: 5.0000000000000001e-003 | W128: 0.126 | X128: 0.10099999999999999 | Y128: 55 | Z128: 1.45 | AA128: 2.1700000000000001e-002 | AB128: 1.7299999999999999e-002 | AC128: 8.0000000000000002e-003 | AD128: 6.0999999999999995e-003 | AE128: 88.59 | AF128: 89.74 | AG128: 0.42 | AH128: AA | AI128: 4.3400000000000001e-002 | AJ128: =H128+100*O128 -> 125.812 | AK128: 120.8 | AL128: 59 | AM128: 31.1 | AN128: 95 | AO128: -1.7000000000000001e-002 | AP128: 10 | AQ128: 超声转债!
A129: 18 | B129: 113046 | C129: 金田转债 | D129: 601609 | E129: 金田铜业 | F129: 有色金属 | G129: 铜金属 | H129: 101.6 | I129: 0. | J129: 1.4000000000000002e-003 | K129: 9.12 | L129: 3.3e-003 | M129: 114.9 | N129: 10.95 | O129: 0.22 | P129: 83.29 | Q129: 4月9天 | R129: 5.83年 | S129: 3.84年 | T129: 15 | U129: 18 | V129: 1.2e-002 | W129: 0.113 | X129: 9.4e-002 | Y129: 133 | Z129: 1.95 | AA129: 2.1700000000000001e-002 | AB129: 1.6899999999999998e-002 | AC129: 4.4000000000000003e-003 | AD129: 2.8000000000000004e-003 | AE129: 88.01 | AF129: 91.04 | AG129: 0.43 | AH129: AA+ | AI129: 4.1399999999999999e-002 | AJ129: =H129+100*O129 -> 123.59999999999999 | AK129: 119.9 | AL129: 50 | AM129: 28.9 | AN129: 68 | AO129: -4.4000000000000004e-002 | AP129: 8 | AQ129: 金田转债
A130: 2 | B130: 110080 | C130: 东湖转债 | D130: 600133 | E130: 东湖高新 | F130: 建筑 | G130: 建筑工程 | H130: 101.65 | I130: 5.9999999999999995e-004 | J130: -1.1899999999999999e-002 | K130: 5.87 | L130: -2.e-002 | M130: 115.1 | N130: 6.16 | O130: 6.7000000000000004e-002 | P130: 95.29 | Q130: 4月28天 | R130: 5.89年 | S130: 3.89年 | T130: 15.5 | U130: 123 | V130: 7.8e-002 | W130: 0.33200000000000002 | X130: 0.316 | Y130: 47 | Z130: 0.86 | AA130: 2.1700000000000001e-002 | AB130: 1.7000000000000001e-002 | AC130: 4.6999999999999993e-003 | AD130: 3.0000000000000001e-003 | AE130: 87.31 | AF130: 90 | AG130: 0.57 | AH130: AA | AI130: 4.3400000000000001e-002 | AJ130: =H130+100*O130 -> 108.35000000000001 | AK130: 108 | AL130: 4 | AM130: 18 | AN130: 9 | AO130: 2.4e-002 | AP130: 8 | AQ130: 东湖转债
A131: 257 | B131: 113027 | C131: 华钰转债!! | D131: 601020 | E131: ST华钰 | F131: 有色金属 | G131: 锌铅镍锡 | H131: 105.53 | I131: 9.8599999999999993e-002 | J131: -8.43e-002 | K131: 7.09 | L131: 5.04e-002 | M131: 114.9 | N131: 10.17 | O131: 0.51400000000000001 | P131: 69.71 | Q131: 转股中 | R131: 4年23天 | S131: 2年24天 | T131: 3.25 | U131: 2316. | V131: 6.7699999999999996 | W131: 8.3000000000000004e-002 | X131: 5.7999999999999996e-002 | Y131: 39 | Z131: 1.58 | AA131: 2.1600000000000001e-002 | AB131: 1.4800000000000001e-002 | AC131: -9.1999999999999998e-003 | AD131: -1.21e-002 | AE131: 90.37 | AF131: 90.15 | AG131: 0.28 | AH131: AA- | AI131: 6.3e-002 | AJ131: =H131+100*O131 -> 156.93000000000001 | AK131: 141.3 | AL131: 257 | AM131: 51 | AN131: 258 | AO131: -6.9000000000000006e-002 | AP131: 46 | AQ131: 华钰转债!!
A132: 185 | B132: 113574 | C132: 华体转债! | D132: 603679 | E132: 华体科技 | F132: 城市公用 | G132: 城市公用 | H132: 104.72 | I132: -9.7999999999999997e-003 | J132: 6.3e-003 | K132: 18.43 | L132: -2.5899999999999999e-002 | M132: 115.9 | N132: 33.99 | O132: 0.93099999999999994 | P132: 54.22 | Q132: 转股中 | R132: 4.86年 | S132: 2.86年 | T132: 2.09 | U132: 18 | V132: 8.3000000000000004e-002 | W132: 7.9000000000000001e-002 | X132: 4.2999999999999997e-002 | Y132: 26 | Z132: 3.39 | AA132: 2.1600000000000001e-002 | AB132: 1.55e-002 | AC132: -2.0999999999999999e-003 | AD132: -4.6999999999999993e-003 | AE132: 84.03 | AF132: 82.6 | AG132: 0.14 | AH132: A+ | AI132: 7.400000000000001e-002 | AJ132: =H132+100*O132 -> 197.81999999999999 | AK132: 155.2 | AL132: 308 | AM132: 71.2 | AN132: 321 | AO132: -3.6000000000000004e-002 | AP132: 18 | AQ132: 华体转债!
A133: 130 | B133: 128122 | C133: 兴森转债! | D133: 2436 | E133: 兴森科技 | F133: 电子 | G133: 元器件制 | H133: 103.85 | I133: 3.0000000000000001e-003 | J133: -3.7000000000000002e-003 | K133: 8.61 | L133: -5.7999999999999996e-003 | M133: 113.3 | N133: 14.18 | O133: 0.70999999999999996 | P133: 60.72 | Q133: 转股中 | R133: 4.17年 | S133: 3.17年 | T133: 2.69 | U133: 0.6 | V133: 2.e-003 | W133: 2.1000000000000001e-002 | X133: 1.3000000000000001e-002 | Y133: 128 | Z133: 3.99 | AA133: 2.1400000000000002e-002 | AB133: 1.55e-002 | AC133: -5.9999999999999995e-004 | AD133: -2.7000000000000001e-003 | AE133: 90.45 | AF133: 95.65 | AG133: 0.11 | AH133: AA | AI133: 4.2000000000000003e-002 | AJ133: =H133+100*O133 -> 174.84999999999999 | AK133: 147 | AL133: 285 | AM133: 51.3 | AN133: 260 | AO133: -5.4000000000000006e-002 | AP133: 12 | AQ133: 兴森转债!
A134: 277 | B134: 123024 | C134: 岱勒转债! | D134: 300700 | E134: 岱勒新材 | F134: 机械装备 | G134: 专用设备 | H134: 106.1 | I134: 2.8000000000000004e-003 | J134: 4.6999999999999993e-003 | K134: 15.23 | L134: 1.9400000000000001e-002 | M134: 112.5 | N134: 18.33 | O134: 0.27699999999999997 | P134: 83.09 | Q134: 转股中 | R134: 2.83年 | S134: 0.83年 | T134: 2.1 | U134: 35 | V134: 0.154 | W134: 0.16699999999999998 | X134: 0.13900000000000001 | Y134: 13 | Z134: 2.59 | AA134: 2.1099999999999997e-002 | AB134: 1.29e-002 | AC134: -4.58e-002 | AD134: -4.82e-002 | AE134: 94.44 | AF134: 92.53 | AG134: 0.39 | AH134: A+ | AI134: 7.2300000000000003e-002 | AJ134: =H134+100*O134 -> 133.79999999999998 | AK134: 129.1 | AL134: 141 | AM134: 34.7 | AN134: 134 | AO134: 2.e-003 | AP134: 35 | AQ134: 岱勒转债!
A135: 128 | B135: 128123 | C135: 国光转债! | D135: 2749 | E135: 国光股份 | F135: 化工 | G135: 农化 | H135: 104.562 | I135: 2.5999999999999999e-003 | J135: -8.1000000000000013e-003 | K135: 9.83 | L135: -1.3999999999999999e-002 | M135: 116.2 | N135: 13.7 | O135: 0.45700000000000002 | P135: 71.75 | Q135: 转股中 | R135: 5.18年 | S135: 3.18年 | T135: 3.2 | U135: 0.8 | V135: 2.e-003 | W135: 7.4999999999999997e-002 | X135: 5.4000000000000006e-002 | Y135: 43 | Z135: 3.44 | AA135: 2.1099999999999997e-002 | AB135: 1.5300000000000001e-002 | AC135: -1.2999999999999999e-003 | AD135: -3.7000000000000002e-003 | AE135: 84.71 | AF135: 84.77 | AG135: 0.39 | AH135: AA- | AI135: 6.4399999999999999e-002 | AJ135: =H135+100*O135 -> 150.262 | AK135: 137.4 | AL135: 230 | AM135: 52.6 | AN135: 268 | AO135: -4.2999999999999997e-002 | AP135: 11 | AQ135: 国光转债!
A136: 246 | B136: 128073 | C136: 哈尔转债! | D136: 2615 | E136: 哈尔斯 | F136: 其他 | G136: 家居用品 | H136: 107.88 | I136: -6.7599999999999993e-002 | J136: 4.3899999999999995e-002 | K136: 4.8 | L136: -6.25e-002 | M136: 115.3 | N136: 5.7 | O136: 0.28100000000000003 | P136: 84.21 | Q136: 转股中 | R136: 3.25年 | S136: 1.26年 | T136: 2.99 | U136: 433 | V136: 1.3400000000000001 | W136: 0.151 | X136: 0.127 | Y136: 20 | Z136: 2.52 | AA136: 2.1000000000000001e-002 | AB136: 1.24e-002 | AC136: -3.8599999999999995e-002 | AD136: -4.1299999999999996e-002 | AE136: 93.63 | AF136: 94.82 | AG136: 0.38 | AH136: AA- | AI136: 6.3e-002 | AJ136: =H136+100*O136 -> 135.97999999999999 | AK136: 131.5 | AL136: 170 | AM136: 36.7 | AN136: 152 | AO136: 7.400000000000001e-002 | AP136: 40 | AQ136: 哈尔转债!
A137: 135 | B137: 113594 | C137: 淳中转债! | D137: 603516 | E137: 淳中科技 | F137: 电子 | G137: 电子产品 | H137: 109.6 | I137: -8.0000000000000004e-004 | J137: -1.5900000000000001e-002 | K137: 22.08 | L137: -3.3300000000000003e-002 | M137: 121.4 | N137: 27.84 | O137: 0.38200000000000001 | P137: 79.31 | Q137: 转股中 | R137: 5.16年 | S137: 3.17年 | T137: 3 | U137: 0.9 | V137: 3.0000000000000001e-003 | W137: 7.2999999999999995e-002 | X137: 5.7999999999999996e-002 | Y137: 41 | Z137: 3.01 | AA137: 2.0499999999999997e-002 | AB137: 1.32e-002 | AC137: -1.4199999999999999e-002 | AD137: -1.67e-002 | AE137: 82.35 | AF137: 84.21 | AG137: 0.5 | AH137: A+ | AI137: 7.5399999999999995e-002 | AJ137: =H137+100*O137 -> 147.80000000000001 | AK137: 139.9 | AL137: 244 | AM137: 55.7 | AN137: 286 | AO137: -5.7000000000000002e-002 | AP137: 9 | AQ137: 淳中转债!
A138: 22 | B138: 123102 | C138: 华自转债 | D138: 300490 | E138: 华自科技 | F138: 机械装备 | G138: 机器人及 | H138: 113.489 | I138: -1.55e-002 | J138: 1.3500000000000002e-002 | K138: 10.43 | L138: -2.8999999999999998e-003 | M138: 126.9 | N138: 9.28 | O138: 1.e-002 | P138: 112.39 | Q138: 4月0天 | R138: 5.81年 | S138: 3.81年 | T138: 6.7 | U138: 375 | V138: 0.48999999999999999 | W138: 0.251 | X138: 0.28199999999999997 | Y138: 27 | Z138: 1.53 | AA138: 1.9900000000000001e-002 | AB138: 1.21e-002 | AC138: -1.9599999999999999e-002 | AD138: -2.1899999999999999e-002 | AE138: 82.14 | AF138: 89.07 | AG138: 0.69 | AH138: AA- | AI138: 6.4399999999999999e-002 | AJ138: =H138+100*O138 -> 114.489 | AK138: 114.6 | AL138: 15 | AM138: 25.5 | AN138: 40 | AO138: 0.13200000000000001 | AP138: 16 | AQ138: 华自转债
A139: 121 | B139: 113598 | C139: 法兰转债 | D139: 603966 | E139: 法兰泰克 | F139: 机械装备 | G139: 工程机械 | H139: 110.01 | I139: 2.e-003 | J139: -4.6999999999999993e-003 | K139: 12.72 | L139: -4.6999999999999993e-003 | M139: 121.2 | N139: 13.88 | O139: 0.20000000000000001 | P139: 91.64 | Q139: 转股中 | R139: 5.19年 | S139: 3.19年 | T139: 2.75 | U139: 20 | V139: 6.7000000000000004e-002 | W139: 0.10099999999999999 | X139: 9.1999999999999998e-002 | Y139: 27 | Z139: 2.34 | AA139: 1.9299999999999998e-002 | AB139: 1.21e-002 | AC139: -1.6399999999999998e-002 | AD139: -1.8700000000000001e-002 | AE139: 84.64 | AF139: 88.32 | AG139: 0.56 | AH139: AA- | AI139: 6.4399999999999999e-002 | AJ139: =H139+100*O139 -> 130.00999999999999 | AK139: 128.4 | AL139: 133 | AM139: 40.1 | AN139: 182 | AO139: -0.23000000000000001 | AP139: 10 | AQ139: 法兰转债
A140: 91 | B140: 123071 | C140: 天能转债! | D140: 300569 | E140: 天能重工 | F140: 能源电力 | G140: 风能 | H140: 109.43 | I140: 1.1399999999999999e-002 | J140: -9.3999999999999986e-003 | K140: 13.61 | L140: 2.8999999999999998e-003 | M140: 121.1 | N140: 13.4 | O140: 7.6999999999999999e-002 | P140: 101.57 | Q140: 转股中 | R140: 5.42年 | S140: 3.42年 | T140: 7 | U140: 87 | V140: 0.113 | W140: 0.129 | X140: 0.13100000000000001 | Y140: 54 | Z140: 2.29 | AA140: 1.9299999999999998e-002 | AB140: 1.24e-002 | AC140: -1.4199999999999999e-002 | AD140: -1.6299999999999999e-002 | AE140: 83.36 | AF140: 86.99 | AG140: 0.65 | AH140: AA- | AI140: 6.4399999999999999e-002 | AJ140: =H140+100*O140 -> 117.13000000000001 | AK140: 117.3 | AL140: 27 | AM140: 30.3 | AN140: 86 | AO140: 1.9e-002 | AP140: 12 | AQ140: 天能转债!
A141: 144 | B141: 110071 | C141: 湖盐转债! | D141: 600929 | E141: 雪天盐业 | F141: 食品饮料 | G141: 食品饮料 | H141: 104.66 | I141: 1.01e-002 | J141: 4.8999999999999998e-003 | K141: 6.22 | L141: 2.81e-002 | M141: 115.2 | N141: 6.6 | O141: 0.111 | P141: 94.24 | Q141: 转股中 | R141: 5年49天 | S141: 3年50天 | T141: 7.2 | U141: 23 | V141: 2.9999999999999999e-002 | W141: 0.126 | X141: 0.11900000000000001 | Y141: 57 | Z141: 2.15 | AA141: 1.9199999999999998e-002 | AB141: 1.38e-002 | AC141: -2.8000000000000004e-003 | AD141: -5.0000000000000001e-003 | AE141: 90.26 | AF141: 93.04 | AG141: 0.53 | AH141: AA | AI141: 4.3400000000000001e-002 | AJ141: =H141+100*O141 -> 115.75999999999999 | AK141: 115.1 | AL141: 18 | AM141: 22 | AN141: 21 | AO141: 2.1000000000000001e-002 | AP141: 19 | AQ141: 湖盐转债!
A142: 254 | B142: 128070 | C142: 智能转债! | D142: 2877 | E142: 智能自控 | F142: 机械装备 | G142: 通用设备 | H142: 109 | I142: -5.6999999999999993e-003 | J142: 9.1000000000000004e-003 | K142: 6.46 | L142: 1.1000000000000001e-002 | M142: 117.6 | N142: 9.51 | O142: 0.60499999999999998 | P142: 67.93 | Q142: 转股中 | R142: 4年41天 | S142: 无权 | T142: 2.3 | U142: 137 | V142: 0.53799999999999992 | W142: 0.107 | X142: 7.2999999999999995e-002 | Y142: 21 | Z142: 2.91 | AA142: 1.9099999999999999e-002 | AB142: 1.1399999999999999e-002 | AC142: 无权 | AD142: 无权 | AE142: 无权 | AF142: 88.37 | AG142: 0.31 | AH142: A+ | AI142: 7.400000000000001e-002 | AJ142: =H142+100*O142 -> 169.5 | AK142: 150.1 | AL142: 295 | AM142: 61.7 | AN142: 301 | AO142: -2.7999999999999997e-002 | AP142: 30 | AQ142: 智能转债!
A143: 99 | B143: 113604 | C143: 多伦转债! | D143: 603528 | E143: 多伦科技 | F143: 计算机及 | G143: 软件开发 | H143: 106.51 | I143: 4.1999999999999997e-003 | J143: -1.8e-003 | K143: 9.01 | L143: 4.5000000000000005e-003 | M143: 117.3 | N143: 10.44 | O143: 0.23399999999999999 | P143: 86.3 | Q143: 转股中 | R143: 5.39年 | S143: 3.40年 | T143: 6.4 | U143: 13 | V143: 1.9e-002 | W143: 0.113 | X143: 9.8000000000000004e-002 | Y143: 56 | Z143: 3.39 | AA143: 1.84e-002 | AB143: 1.26e-002 | AC143: -7.3000000000000001e-003 | AD143: -9.300000000000001e-003 | AE143: 83.3 | AF143: 84.35 | AG143: 0.55 | AH143: AA- | AI143: 6.4399999999999999e-002 | AJ143: =H143+100*O143 -> 129.91 | AK143: 126.7 | AL143: 110 | AM143: 42.4 | AN143: 205 | AO143: 5.2999999999999999e-002 | AP143: 7 | AQ143: 多伦转债!
A144: 102 | B144: 128133 | C144: 奇正转债! | D144: 2287 | E144: 奇正藏药 | F144: 医药 | G144: 中药 | H144: 106.657 | I144: -3.2000000000000002e-003 | J144: -3.4000000000000002e-003 | K144: 26.12 | L144: -1.5100000000000001e-002 | M144: 117.3 | N144: 30.12 | O144: 0.23000000000000001 | P144: 86.72 | Q144: 转股中 | R144: 5.34年 | S144: 3.34年 | T144: 8 | U144: 11 | V144: 1.3000000000000001e-002 | W144: 5.7999999999999996e-002 | X144: 5.0000000000000003e-002 | Y144: 139 | Z144: 5.35 | AA144: 1.83e-002 | AB144: 1.2500000000000001e-002 | AC144: -7.8000000000000005e-003 | AD144: -9.8999999999999991e-003 | AE144: 89.58 | AF144: 93.93 | AG144: 0.44 | AH144: AA | AI144: 4.3400000000000001e-002 | AJ144: =H144+100*O144 -> 129.65699999999998 | AK144: 126.6 | AL144: 107 | AM144: 32.7 | AN144: 111 | AO144: 1.4999999999999999e-002 | AP144: 15 | AQ144: 奇正转债!
A145: 83 | B145: 123075 | C145: 贝斯转债! | D145: 300580 | E145: 贝斯特 | F145: 汽车 | G145: 零部件制 | H145: 105.346 | I145: -4.7999999999999996e-003 | J145: -1.3999999999999999e-002 | K145: 19.05 | L145: -3.6400000000000002e-002 | M145: 115.5 | N145: 23.99 | O145: 0.32700000000000001 | P145: 79.41 | Q145: 转股中 | R145: 5.45年 | S145: 3.45年 | T145: 6 | U145: 2.9 | V145: 5.0000000000000001e-003 | W145: 0.157 | X145: 0.125 | Y145: 38 | Z145: 2.21 | AA145: 1.7399999999999999e-002 | AB145: 1.2199999999999999e-002 | AC145: -4.0000000000000001e-003 | AD145: -6.0999999999999995e-003 | AE145: 83.04 | AF145: 82.79 | AG145: 0.52 | AH145: AA- | AI145: 6.4399999999999999e-002 | AJ145: =H145+100*O145 -> 138.04599999999999 | AK145: 131.3 | AL145: 164 | AM145: 48.2 | AN145: 240 | AO145: 4.4999999999999998e-002 | AP145: 8 | AQ145: 贝斯转债!
A146: 53 | B146: 113044 | C146: 大秦转债! | D146: 601006 | E146: 大秦铁路 | F146: 铁路 | G146: 铁路运输 | H146: 103.9 | I146: -1.6000000000000001e-003 | J146: 2.0000000000000001e-004 | K146: 6.93 | L146: -2.8999999999999998e-003 | M146: 114.1 | N146: 7.66 | O146: 0.14800000000000002 | P146: 90.47 | Q146: 28天 | R146: 5.56年 | S146: 3.57年 | T146: 320 | U146: 220 | V146: 6.9999999999999993e-003 | W146: 0.311 | X146: 0.28100000000000003 | Y146: 1030. | Z146: 0.85 | AA146: 1.7299999999999999e-002 | AB146: 1.26e-002 | AC146: 1.e-004 | AD146: -1.9e-003 | AE146: 90.4 | AF146: 92.9 | AG146: 0.5 | AH146: AAA | AI146: 3.8399999999999997e-002 | AJ146: =H146+100*O146 -> 118.7 | AK146: 117.3 | AL146: 29 | AM146: 24.4 | AN146: 36 | AO146: 4.0000000000000001e-003 | AP146: 14 | AQ146: 大秦转债!
A147: 237 | B147: 127014 | C147: 北方转债! | D147: 65 | E147: 北方国际 | F147: 建筑 | G147: 建筑工程 | H147: 106.894 | I147: 1.37e-002 | J147: -1.21e-002 | K147: 7.63 | L147: 3.9000000000000003e-003 | M147: 115.1 | N147: 8.75 | O147: 0.22600000000000001 | P147: 87.2 | Q147: 转股中 | R147: 4.42年 | S147: 2.43年 | T147: 5.35 | U147: 29 | V147: 5.0999999999999997e-002 | W147: 9.0999999999999998e-002 | X147: 7.9000000000000001e-002 | Y147: 59 | Z147: 1.06 | AA147: 1.72e-002 | AB147: 1.1000000000000001e-002 | AC147: -1.21e-002 | AD147: -1.4800000000000001e-002 | AE147: 93.69 | AF147: 97.14 | AG147: 0.4 | AH147: AA+ | AI147: 4.0000000000000001e-002 | AJ147: =H147+100*O147 -> 129.494 | AK147: 126.6 | AL147: 106 | AM147: 29.5 | AN147: 76 | AO147: -3.5000000000000003e-002 | AP147: 19 | AQ147: 北方转债!
A148: 132 | B148: 123061 | C148: 航新转债! | D148: 300424 | E148: 航新科技 | F148: 航空航天 | G148: 航空航天 | H148: 114.888 | I148: -3.7000000000000005e-002 | J148: 2.e-002 | K148: 14.48 | L148: -2.69e-002 | M148: 124.8 | N148: 14.86 | O148: 0.17899999999999999 | P148: 97.44 | Q148: 转股中 | R148: 5.17年 | S148: 3.17年 | T148: 2.5 | U148: 476 | V148: 1.6299999999999999 | W148: 7.2000000000000008e-002 | X148: 7.0000000000000007e-002 | Y148: 35 | Z148: 5.21 | AA148: 1.6500000000000001e-002 | AB148: 8.3999999999999995e-003 | AC148: -2.7699999999999999e-002 | AD148: -3.0299999999999997e-002 | AE148: 82.46 | AF148: 86.56 | AG148: 0.63 | AH148: A+ | AI148: 7.5399999999999995e-002 | AJ148: =H148+100*O148 -> 132.78800000000001 | AK148: 132.3 | AL148: 178 | AM148: 45.8 | AN148: 226 | AO148: 0.129 | AP148: 15 | AQ148: 航新转债!
A149: 24 | B149: 123101 | C149: 拓斯转债! | D149: 300607 | E149: 拓斯达 | F149: 机械装备 | G149: 机器人及 | H149: 104.88 | I149: -8.0000000000000004e-004 | J149: -4.7999999999999996e-003 | K149: 30.61 | L149: -1.7299999999999999e-002 | M149: 115.1 | N149: 42.25 | O149: 0.44799999999999995 | P149: 72.45 | Q149: 3月28天 | R149: 5.80年 | S149: 3.80年 | T149: 6.7 | U149: 2.3 | V149: 3.0000000000000001e-003 | W149: 8.199999999999999e-002 | X149: 5.9999999999999998e-002 | Y149: 81 | Z149: 3.63 | AA149: 1.6399999999999998e-002 | AB149: 1.1699999999999999e-002 | AC149: -3.0999999999999999e-003 | AD149: -4.8999999999999998e-003 | AE149: 87.65 | AF149: 90.35 | AG149: 0.33 | AH149: AA | AI149: 4.3400000000000001e-002 | AJ149: =H149+100*O149 -> 149.68000000000001 | AK149: 137.3 | AL149: 229 | AM149: 47 | AN149: 233 | AO149: -7.400000000000001e-002 | AP149: 4 | AQ149: 拓斯转债!
A150: 243 | B150: 128074 | C150: 游族转债!! | D150: 2174 | E150: 游族网络 | F150: 通信互联 | G150: 互联网 | H150: 111.92 | I150: -1.0500000000000001e-002 | J150: 1.0500000000000001e-002 | K150: 16.91 | L150: -2.87e-002 | M150: 119.9 | N150: 16.97 | O150: 0.12300000000000001 | P150: 99.65 | Q150: 转股中 | R150: 4.34年 | S150: 2.34年 | T150: 6.83 | U150: 335 | V150: 0.436 | W150: 4.4000000000000004e-002 | X150: 4.4000000000000004e-002 | Y150: 155 | Z150: 3.03 | AA150: 1.6299999999999999e-002 | AB150: 8.3000000000000001e-003 | AC150: -3.1400000000000004e-002 | AD150: -3.39e-002 | AE150: 93.36 | AF150: 100.65 | AG150: 0 | AH150: AA | AI150: 4.2000000000000003e-002 | AJ150: =H150+100*O150 -> 124.22 | AK150: 124.2 | AL150: 88 | AM150: 23.5 | AN150: 29 | AO150: 0.122 | AP150: 26 | AQ150: 游族转债!!
A151: 212 | B151: 113561 | C151: 正裕转债! | D151: 603089 | E151: 正裕工业 | F151: 汽车 | G151: 零部件制 | H151: 109.79 | I151: -1.4499999999999999e-002 | J151: -8.0000000000000004e-004 | K151: 9 | L151: -2.7000000000000003e-002 | M151: 118 | N151: 10.23 | O151: 0.248 | P151: 87.98 | Q151: 转股中 | R151: 4.61年 | S151: 2.61年 | T151: 1.5 | U151: 83 | V151: 0.50800000000000001 | W151: 7.4999999999999997e-002 | X151: 6.6000000000000003e-002 | Y151: 20 | Z151: 1.88 | AA151: 1.61e-002 | AB151: 9.1000000000000004e-003 | AC151: -1.9e-002 | AD151: -2.18e-002 | AE151: 85.63 | AF151: 85.6 | AG151: 0.56 | AH151: A+ | AI151: 7.400000000000001e-002 | AJ151: =H151+100*O151 -> 134.59 | AK151: 131.6 | AL151: 171 | AM151: 46 | AN151: 230 | AO151: 8.0000000000000002e-003 | AP151: 34 | AQ151: 正裕转债!
A152: 268 | B152: 113024 | C152: 核建转债! | D152: 601611 | E152: 中国核建 | F152: 建筑 | G152: 建筑工程 | H152: 102.98 | I152: -4.0000000000000002e-004 | J152: -2.3999999999999998e-003 | K152: 7.23 | L152: -1.23e-002 | M152: 109.3 | N152: 9.76 | O152: 0.39000000000000001 | P152: 74.08 | Q152: 转股中 | R152: 3.88年 | S152: 1.88年 | T152: 30 | U152: 6.9 | V152: 2.e-003 | W152: 0.156 | X152: 0.11599999999999999 | Y152: 192 | Z152: 1.62 | AA152: 1.5800000000000002e-002 | AB152: 1.1200000000000002e-002 | AC152: -8.9999999999999998e-004 | AD152: -3.4999999999999996e-003 | AE152: 95.47 | AF152: 95.18 | AG152: 0.23 | AH152: AAA | AI152: 3.7000000000000005e-002 | AJ152: =H152+100*O152 -> 141.98000000000002 | AK152: 131.9 | AL152: 175 | AM152: 36.4 | AN152: 147 | AO152: -6.3e-002 | AP152: 39 | AQ152: 核建转债!
A153: 318 | B153: 128039 | C153: 三力转债! | D153: 2224 | E153: 三 力 士 | F153: 机械装备 | G153: 专用设备 | H153: 104.89 | I153: -1.1999999999999999e-003 | J153: 1.1999999999999999e-003 | K153: 4.72 | L153: 0. | M153: 109.8 | N153: 5.81 | O153: 0.29100000000000004 | P153: 81.24 | Q153: 转股中 | R153: 3年17天 | S153: 1年18天 | T153: 2.03 | U153: 8.8 | V153: 4.0999999999999995e-002 | W153: 5.9000000000000004e-002 | X153: 4.8000000000000001e-002 | Y153: 34 | Z153: 1.5 | AA153: 1.55e-002 | AB153: 9.300000000000001e-003 | AC153: -1.8600000000000002e-002 | AD153: -2.2599999999999999e-002 | AE153: 95.29 | AF153: 91.52 | AG153: 0.34 | AH153: AA- | AI153: 6.3e-002 | AJ153: =H153+100*O153 -> 133.99000000000001 | AK153: 128.5 | AL153: 136 | AM153: 33.3 | AN153: 116 | AO153: -8.5999999999999993e-002 | AP153: 28 | AQ153: 三力转债!
A154: 164 | B154: 123051 | C154: 今天转债 | D154: 300532 | E154: 今天国际 | F154: 计算机及 | G154: 软件开发 | H154: 114 | I154: 2.7000000000000003e-002 | J154: 1.38e-002 | K154: 9.46 | L154: 5.8200000000000002e-002 | M154: 122.8 | N154: 8.7 | O154: 4.8000000000000001e-002 | P154: 108.74 | Q154: 转股中 | R154: 5年13天 | S154: 3年14天 | T154: 2.79 | U154: 1817. | V154: 5.4900000000000002 | W154: 0.10800000000000001 | X154: 0.11699999999999999 | Y154: 26 | Z154: 3.31 | AA154: 1.5300000000000001e-002 | AB154: 7.4000000000000003e-003 | AC154: -2.6499999999999999e-002 | AD154: -2.92e-002 | AE154: 83.25 | AF154: 86.01 | AG154: 0.7 | AH154: A+ | AI154: 7.5399999999999995e-002 | AJ154: =H154+100*O154 -> 118.8 | AK154: 119.3 | AL154: 45 | AM154: 33.3 | AN154: 117 | AO154: 0.17399999999999999 | AP154: 16 | AQ154: 今天转债
A155: 191 | B155: 123045 | C155: 雷迪转债 | D155: 300652 | E155: 雷迪克 | F155: 汽车 | G155: 零部件制 | H155: 110.948 | I155: 5.9999999999999995e-004 | J155: 4.8999999999999998e-003 | K155: 17.48 | L155: 9.7999999999999997e-003 | M155: 118.9 | N155: 20.13 | O155: 0.27800000000000002 | P155: 86.84 | Q155: 转股中 | R155: 4.81年 | S155: 2.81年 | T155: 1.66 | U155: 26 | V155: 0.14099999999999999 | W155: 0.10099999999999999 | X155: 8.8000000000000009e-002 | Y155: 16 | Z155: 1.73 | AA155: 1.4800000000000001e-002 | AB155: 7.8000000000000005e-003 | AC155: -2.1499999999999998e-002 | AD155: -2.4e-002 | AE155: 84.34 | AF155: 85.03 | AG155: 0.56 | AH155: A+ | AI155: 7.400000000000001e-002 | AJ155: =H155+100*O155 -> 138.74799999999999 | AK155: 135.1 | AL155: 217 | AM155: 50 | AN155: 253 | AO155: -2.8999999999999998e-002 | AP155: 35 | AQ155: 雷迪转债
A156: 112 | B156: 113039 | C156: 嘉泽转债! | D156: 601619 | E156: 嘉泽新能 | F156: 能源电力 | G156: 风能 | H156: 105.22 | I156: 5.1000000000000004e-003 | J156: 7.1999999999999998e-003 | K156: 3.57 | L156: 2.e-002 | M156: 113.1 | N156: 3.57 | O156: 5.2000000000000005e-002 | P156: 100 | Q156: 转股中 | R156: 5.26年 | S156: 3.26年 | T156: 11.8 | U156: 53 | V156: 4.2000000000000003e-002 | W156: 0.159 | X156: 0.159 | Y156: 75 | Z156: 2.08 | AA156: 1.41e-002 | AB156: 9.4999999999999998e-003 | AC156: -4.5000000000000005e-003 | AD156: -6.6e-003 | AE156: 89.69 | AF156: 90.86 | AG156: 0.61 | AH156: AA | AI156: 4.3400000000000001e-002 | AJ156: =H156+100*O156 -> 110.42 | AK156: 110.4 | AL156: 8 | AM156: 19.6 | AN156: 13 | AO156: 3.2000000000000001e-002 | AP156: 31 | AQ156: 嘉泽转债!
A157: 38 | B157: 123093 | C157: 金陵转债 | D157: 300651 | E157: 金陵体育 | F157: 其他 | G157: 文化教育 | H157: 119.7 | I157: -0.12300000000000001 | J157: 0.11 | K157: 42.75 | L157: -2.35e-002 | M157: 129.3 | N157: 49.29 | O157: 0.38 | P157: 86.73 | Q157: 2月6天 | R157: 5.66年 | S157: 3.67年 | T157: 2.5 | U157: 661 | V157: 2.1299999999999999 | W157: 4.4999999999999998e-002 | X157: 3.9e-002 | Y157: 55 | Z157: 7.98 | AA157: 1.41e-002 | AB157: 5.6000000000000008e-003 | AC157: -3.0699999999999998e-002 | AD157: -3.3700000000000001e-002 | AE157: 80.84 | AF157: 86.7 | AG157: 0.57 | AH157: A+ | AI157: 7.5399999999999995e-002 | AJ157: =H157+100*O157 -> 157.69999999999999 | AK157: 152.7 | AL157: 302 | AM157: 66 | AN157: 310 | AO157: -3.5000000000000003e-002 | AP157: 6 | AQ157: 金陵转债
A158: 11 | B158: 123107 | C158: 温氏转债! | D158: 300498 | E158: 温氏股份 | F158: 农业 | G158: 畜牧业 | H158: 104.39 | I158: -5.7999999999999996e-003 | J158: -2.5000000000000001e-003 | K158: 13.78 | L158: -2.2700000000000001e-002 | M158: 113 | N158: 17.82 | O158: 0.34999999999999998 | P158: 77.33 | Q158: 4月20天 | R158: 5.85年 | S158: 3.86年 | T158: 93 | U158: 26 | V158: 3.0000000000000001e-003 | W158: 0.106 | X158: 8.199999999999999e-002 | Y158: 878 | Z158: 1.91 | AA158: 1.3899999999999999e-002 | AB158: 9.7000000000000003e-003 | AC158: -2.0999999999999999e-003 | AD158: -3.8e-003 | AE158: 89.05 | AF158: 90.97 | AG158: 0.37 | AH158: AAA | AI158: 3.8399999999999997e-002 | AJ158: =H158+100*O158 -> 139.38999999999999 | AK158: 131.5 | AL158: 168 | AM158: 40.5 | AN158: 184 | AO158: -4.0000000000000001e-002 | AP158: 9 | AQ158: 温氏转债!
A159: 317 | B159: 128040 | C159: 华通转债! | D159: 2758 | E159: 浙农股份 | F159: 医药 | G159: 医药商业 | H159: 107.779 | I159: 1.7000000000000001e-003 | J159: -2.7000000000000001e-003 | K159: 9.79 | L159: -2.e-003 | M159: 112.3 | N159: 10.33 | O159: 0.13699999999999998 | P159: 94.77 | Q159: 转股中 | R159: 3年23天 | S159: 1年24天 | T159: 2.22 | U159: 4.1 | V159: 1.7000000000000001e-002 | W159: 4.5999999999999999e-002 | X159: 4.4000000000000004e-002 | Y159: 48 | Z159: 1.59 | AA159: 1.38e-002 | AB159: 6.3e-003 | AC159: -3.8100000000000002e-002 | AD159: -4.2300000000000004e-002 | AE159: 95.43 | AF159: 93.54 | AG159: 0.53 | AH159: AA- | AI159: 6.3e-002 | AJ159: =H159+100*O159 -> 121.479 | AK159: 120.8 | AL159: 58 | AM159: 25.4 | AN159: 39 | AO159: -5.2999999999999999e-002 | AP159: 31 | AQ159: 华通转债!
A160: 8 | B160: 123109 | C160: 昌红转债 | D160: 300151 | E160: 昌红科技 | F160: 机械装备 | G160: 专用设备 | H160: 111.89 | I160: 1.6299999999999999e-002 | J160: -2.9500000000000002e-002 | K160: 27.31 | L160: -2.1099999999999997e-002 | M160: 121 | N160: 28.26 | O160: 0.158 | P160: 96.64 | Q160: 4月20天 | R160: 5.86年 | S160: 3.86年 | T160: 4.6 | U160: 13 | V160: 2.6000000000000002e-002 | W160: 3.4000000000000002e-002 | X160: 3.2000000000000001e-002 | Y160: 137 | Z160: 12.83 | AA160: 1.37e-002 | AB160: 7.4999999999999997e-003 | AC160: -1.83e-002 | AD160: -2.0099999999999996e-002 | AE160: 81.01 | AF160: 84.53 | AG160: 0.63 | AH160: AA- | AI160: 6.4399999999999999e-002 | AJ160: =H160+100*O160 -> 127.69 | AK160: 127.1 | AL160: 117 | AM160: 42.6 | AN160: 208 | AO160: -6.9000000000000006e-002 | AP160: 3 | AQ160: 昌红转债
A161: 155 | B161: 128114 | C161: 正邦转债 | D161: 2157 | E161: 正邦科技 | F161: 农业 | G161: 畜牧业 | H161: 107.8 | I161: 0. | J161: -1.e-003 | K161: 13.56 | L161: -2.2000000000000001e-003 | M161: 115.3 | N161: 15.45 | O161: 0.22800000000000001 | P161: 87.77 | Q161: 转股中 | R161: 5年26天 | S161: 3年27天 | T161: 16 | U161: 6.4 | V161: 4.0000000000000001e-003 | W161: 3.7000000000000005e-002 | X161: 3.3000000000000002e-002 | Y161: 427 | Z161: 1.82 | AA161: 1.3600000000000001e-002 | AB161: 8.1000000000000013e-003 | AC161: -1.1699999999999999e-002 | AD161: -1.3899999999999999e-002 | AE161: 91.16 | AF161: 94.28 | AG161: 0.45 | AH161: AA+ | AI161: 4.1399999999999999e-002 | AJ161: =H161+100*O161 -> 130.59999999999999 | AK161: 127.8 | AL161: 125 | AM161: 33.6 | AN161: 122 | AO161: -3.1e-002 | AP161: 16 | AQ161: 正邦转债
A162: 344 | B162: 110038 | C162: 济川转债! | D162: 600566 | E162: 济川药业 | F162: 医药 | G162: 中药 | H162: 105.41 | I162: -5.6999999999999993e-003 | J162: 2.3999999999999998e-003 | K162: 19.31 | L162: -2.7200000000000002e-002 | M162: 107.5 | N162: 23.85 | O162: 0.30199999999999999 | P162: 80.96 | Q162: 转股中 | R162: 1.48年 | S162: 回售内 | T162: 6.28 | U162: 12 | V162: 1.8000000000000002e-002 | W162: 3.7000000000000005e-002 | X162: 2.9999999999999999e-002 | Y162: 172 | Z162: 2.12 | AA162: 1.3500000000000002e-002 | AB162: 3.8e-003 | AC162: 回售内 | AD162: 回售内 | AE162: 100.25 | AF162: 101.44 | AG162: 0.12 | AH162: AA | AI162: 4.0300000000000002e-002 | AJ162: =H162+100*O162 -> 135.60999999999999 | AK162: 129.9 | AL162: 151 | AM162: 28.4 | AN162: 60 | AO162: 1.3000000000000001e-002 | AP162: 23 | AQ162: 济川转债!
A163: 3 | B163: 127032 | C163: 苏行转债 | D163: 2966 | E163: 苏州银行 | F163: 金融 | G163: 银行行业 | H163: 106.61 | I163: 8.0000000000000004e-004 | J163: -2.0999999999999999e-003 | K163: 7.49 | L163: -2.7000000000000001e-003 | M163: 115.1 | N163: 8.34 | O163: 0.187 | P163: 89.81 | Q163: 5月0天 | R163: 5.89年 | S163: 无权 | T163: 50 | U163: 108 | V163: 2.e-002 | W163: 0.20000000000000001 | X163: 0.17999999999999999 | Y163: 250 | Z163: 0.81 | AA163: 1.3300000000000001e-002 | AB163: 8.6e-003 | AC163: 无权 | AD163: 无权 | AE163: 无权 | AF163: 92.52 | AG163: 0.5 | AH163: AAA | AI163: 3.8399999999999997e-002 | AJ163: =H163+100*O163 -> 125.31 | AK163: 123.4 | AL163: 81 | AM163: 30.9 | AN163: 90 | AO163: 1.6e-002 | AP163: 6 | AQ163: 苏行转债
A164: 330 | B164: 123007 | C164: 道氏转债! | D164: 300409 | E164: 道氏技术 | F164: 建筑 | G164: 建筑行业 | H164: 106.735 | I164: -1.4000000000000002e-003 | J164: 8.1000000000000013e-003 | K164: 13.49 | L164: 1.43e-002 | M164: 110.3 | N164: 14.55 | O164: 0.151 | P164: 92.71 | Q164: 转股中 | R164: 2.61年 | S164: 0.61年 | T164: 3.04 | U164: 20 | V164: 5.9999999999999998e-002 | W164: 4.0999999999999995e-002 | X164: 3.7999999999999999e-002 | Y164: 75 | Z164: 2.04 | AA164: 1.29e-002 | AB164: 5.5000000000000005e-003 | AC164: -5.96e-002 | AD164: -6.3899999999999998e-002 | AE164: 97.24 | AF164: 94.72 | AG164: 0.47 | AH164: AA- | AI164: 6.13e-002 | AJ164: =H164+100*O164 -> 121.83499999999999 | AK164: 120.8 | AL164: 57 | AM164: 23.5 | AN164: 28 | AO164: 4.5999999999999999e-002 | AP164: 22 | AQ164: 道氏转债!
A165: 250 | B165: 128071 | C165: 合兴转债! | D165: 2228 | E165: 合兴包装 | F165: 造纸包装 | G165: 包装材料 | H165: 109.2 | I165: 1.1000000000000001e-002 | J165: -6.4000000000000003e-003 | K165: 3.84 | L165: 1.0500000000000001e-002 | M165: 114.8 | N165: 4.28 | O165: 0.217 | P165: 89.72 | Q165: 转股中 | R165: 4.24年 | S165: 2.24年 | T165: 3 | U165: 1.4 | V165: 4.0000000000000001e-003 | W165: 6.3e-002 | X165: 5.7000000000000002e-002 | Y165: 48 | Z165: 1.37 | AA165: 1.21e-002 | AB165: 5.6999999999999993e-003 | AC165: -2.3099999999999999e-002 | AD165: -2.5600000000000001e-002 | AE165: 93.66 | AF165: 96.79 | AG165: 0.44 | AH165: AA | AI165: 4.2000000000000003e-002 | AJ165: =H165+100*O165 -> 130.90000000000001 | AK165: 128.7 | AL165: 138 | AM165: 31.9 | AN165: 105 | AO165: 1.7000000000000001e-002 | AP165: 25 | AQ165: 合兴转债!
A166: 46 | B166: 123089 | C166: 九洲转2! | D166: 300040 | E166: 九洲集团 | F166: 能源电力 | G166: 电力设备 | H166: 113.3 | I166: 2.07e-002 | J166: 9.1999999999999998e-003 | K166: 9.02 | L166: 4.1599999999999998e-002 | M166: 121 | N166: 8 | O166: 5.0000000000000001e-003 | P166: 112.75 | Q166: 35天 | R166: 5.58年 | S166: 3.59年 | T166: 5 | U166: 153 | V166: 0.26800000000000002 | W166: 0.14599999999999999 | X166: 0.16399999999999998 | Y166: 34 | Z166: 1.54 | AA166: 1.21e-002 | AB166: 5.5000000000000005e-003 | AC166: -2.3e-002 | AD166: -2.4900000000000002e-002 | AE166: 82.42 | AF166: 86.01 | AG166: 0.72 | AH166: AA- | AI166: 6.4399999999999999e-002 | AJ166: =H166+100*O166 -> 113.8 | AK166: 113.9 | AL166: 13 | AM166: 27.8 | AN166: 56 | AO166: 9.6000000000000002e-002 | AP166: 19 | AQ166: 九洲转2!
A167: 226 | B167: 110062 | C167: 烽火转债! | D167: 600498 | E167: 烽火通信 | F167: 通信互联 | G167: 通信设备 | H167: 105.11 | I167: 1.8e-003 | J167: -2.8000000000000004e-003 | K167: 17.26 | L167: -3.4999999999999996e-003 | M167: 110.8 | N167: 22.93 | O167: 0.39600000000000002 | P167: 75.27 | Q167: 转股中 | R167: 4.53年 | S167: 2.53年 | T167: 30.9 | U167: 17 | V167: 5.0000000000000001e-003 | W167: 0.158 | X167: 0.11900000000000001 | Y167: 195 | Z167: 1.81 | AA167: 1.1899999999999999e-002 | AB167: 7.4000000000000003e-003 | AC167: -6.5000000000000006e-003 | AD167: -8.8000000000000005e-003 | AE167: 93.73 | AF167: 94.29 | AG167: 0.27 | AH167: AAA | AI167: 3.7000000000000005e-002 | AJ167: =H167+100*O167 -> 144.71000000000001 | AK167: 134.9 | AL167: 215 | AM167: 40.7 | AN167: 188 | AO167: -3.6000000000000004e-002 | AP167: 20 | AQ167: 烽火转债!
A168: 216 | B168: 123038 | C168: 联得转债! | D168: 300545 | E168: 联得装备 | F168: 机械装备 | G168: 专用设备 | H168: 112.665 | I168: 1.6000000000000001e-003 | J168: -1.4000000000000002e-003 | K168: 20.63 | L168: 5.0000000000000001e-004 | M168: 118.6 | N168: 24.17 | O168: 0.32000000000000001 | P168: 85.35 | Q168: 转股中 | R168: 4.59年 | S168: 2.60年 | T168: 1.47 | U168: 47 | V168: 0.28399999999999997 | W168: 4.0000000000000001e-002 | X168: 3.4000000000000002e-002 | Y168: 37 | Z168: 3.79 | AA168: 1.15e-002 | AB168: 4.3e-003 | AC168: -2.9399999999999999e-002 | AD168: -3.1899999999999998e-002 | AE168: 85.44 | AF168: 86.07 | AG168: 0.54 | AH168: A+ | AI168: 7.400000000000001e-002 | AJ168: =H168+100*O168 -> 144.66500000000002 | AK168: 140 | AL168: 245 | AM168: 53.9 | AN168: 276 | AO168: -5.2999999999999999e-002 | AP168: 19 | AQ168: 联得转债!
A169: 214 | B169: 128090 | C169: 汽模转2 | D169: 2510 | E169: 天汽模 | F169: 汽车 | G169: 零部件制 | H169: 109.12 | I169: 4.5999999999999999e-003 | J169: 5.9999999999999995e-004 | K169: 4.08 | L169: 9.8999999999999991e-003 | M169: 114.9 | N169: 4.21 | O169: 0.126 | P169: 96.91 | Q169: 转股中 | R169: 4.60年 | S169: 2.60年 | T169: 3.1 | U169: 25 | V169: 7.400000000000001e-002 | W169: 8.0000000000000002e-002 | X169: 7.6999999999999999e-002 | Y169: 39 | Z169: 1.91 | AA169: 1.15e-002 | AB169: 5.6000000000000008e-003 | AC169: -1.9400000000000001e-002 | AD169: -2.1700000000000001e-002 | AE169: 92.37 | AF169: 95.44 | AG169: 0.53 | AH169: AA | AI169: 4.2000000000000003e-002 | AJ169: =H169+100*O169 -> 121.72 | AK169: 121.3 | AL169: 64 | AM169: 25.9 | AN169: 43 | AO169: -1.e-002 | AP169: 29 | AQ169: 汽模转2
A170: 154 | B170: 113588 | C170: 润达转债! | D170: 603108 | E170: 润达医疗 | F170: 医药 | G170: 医疗器械 | H170: 107.97 | I170: -5.0000000000000001e-004 | J170: -1.37e-002 | K170: 11.17 | L170: -3.3700000000000001e-002 | M170: 114.2 | N170: 13.36 | O170: 0.29100000000000004 | P170: 83.61 | Q170: 转股中 | R170: 5年26天 | S170: 3年27天 | T170: 5.5 | U170: 2.6 | V170: 4.0000000000000001e-003 | W170: 8.5000000000000006e-002 | X170: 7.0999999999999994e-002 | Y170: 65 | Z170: 2.03 | AA170: 1.1399999999999999e-002 | AB170: 6.1999999999999998e-003 | AC170: -1.2500000000000001e-002 | AD170: -1.47e-002 | AE170: 90.5 | AF170: 92.48 | AG170: 0.42 | AH170: AA | AI170: 4.3400000000000001e-002 | AJ170: =H170+100*O170 -> 137.06999999999999 | AK170: 132.3 | AL170: 176 | AM170: 39.9 | AN170: 181 | AO170: -5.0000000000000003e-002 | AP170: 10 | AQ170: 润达转债!
A171: 227 | B171: 128081 | C171: 海亮转债! | D171: 2203. | E171: 海亮股份 | F171: 有色金属 | G171: 铜金属 | H171: 109.37 | I171: 7.8000000000000005e-003 | J171: -2.3999999999999998e-003 | K171: 10.35 | L171: 8.8000000000000005e-003 | M171: 114.9 | N171: 9.76 | O171: 3.1e-002 | P171: 106.05 | Q171: 转股中 | R171: 4.50年 | S171: 2.50年 | T171: 30.1 | U171: 15 | V171: 5.0000000000000001e-003 | W171: 0.14800000000000002 | X171: 0.157 | Y171: 202 | Z171: 2.14 | AA171: 1.1200000000000002e-002 | AB171: 5.1999999999999998e-003 | AC171: -2.1000000000000001e-002 | AD171: -2.3399999999999997e-002 | AE171: 92.74 | AF171: 95.83 | AG171: 0.62 | AH171: AA | AI171: 4.2000000000000003e-002 | AJ171: =H171+100*O171 -> 112.47 | AK171: 112.7 | AL171: 12 | AM171: 16.9 | AN171: 7 | AO171: -1.4999999999999999e-002 | AP171: 52 | AQ171: 海亮转债!
A172: 170 | B172: 128107 | C172: 交科转债 | D172: 2061 | E172: 浙江交科 | F172: 建筑 | G172: 建筑工程 | H172: 108.9 | I172: -2.3e-003 | J172: 4.4000000000000003e-003 | K172: 5.31 | L172: 3.8e-003 | M172: 114.9 | N172: 5.36 | O172: 9.9000000000000005e-002 | P172: 99.07 | Q172: 转股中 | R172: 4.92年 | S172: 2.92年 | T172: 25 | U172: 6.2 | V172: 2.e-003 | W172: 0.34200000000000003 | X172: 0.33899999999999997 | Y172: 73 | Z172: 0.85 | AA172: 1.1200000000000002e-002 | AB172: 5.6999999999999993e-003 | AC172: -1.6799999999999999e-002 | AD172: -1.8799999999999997e-002 | AE172: 91.7 | AF172: 95.08 | AG172: 0.56 | AH172: AA+ | AI172: 4.0000000000000001e-002 | AJ172: =H172+100*O172 -> 118.80000000000001 | AK172: 118.7 | AL172: 39 | AM172: 23.7 | AN172: 31 | AO172: -2.9999999999999999e-002 | AP172: 17 | AQ172: 交科转债
A173: 252 | B173: 113542 | C173: 好客转债 | D173: 603898 | E173: 好莱客 | F173: 其他 | G173: 家居用品 | H173: 109.86 | I173: -3.9000000000000003e-003 | J173: -1.4000000000000002e-003 | K173: 14.2 | L173: -1.32e-002 | M173: 114.9 | N173: 16.27 | O173: 0.25900000000000001 | P173: 87.28 | Q173: 转股中 | R173: 4.19年 | S173: 2.20年 | T173: 6.03 | U173: 40 | V173: 5.9999999999999998e-002 | W173: 0.13600000000000001 | X173: 0.11900000000000001 | Y173: 44 | Z173: 1.72 | AA173: 1.1000000000000001e-002 | AB173: 4.5000000000000005e-003 | AC173: -2.5600000000000001e-002 | AD173: -2.8300000000000002e-002 | AE173: 93.92 | AF173: 97.05 | AG173: 0.4 | AH173: AA | AI173: 4.2000000000000003e-002 | AJ173: =H173+100*O173 -> 135.75999999999999 | AK173: 132.4 | AL173: 182 | AM173: 35.4 | AN173: 141 | AO173: -0.17100000000000001 | AP173: 18 | AQ173: 好客转债
A174: 329 | B174: 128034 | C174: 江银转债! | D174: 2807 | E174: 江阴银行 | F174: 金融 | G174: 银行行业 | H174: 105.231 | I174: -8.0000000000000004e-004 | J174: 8.0000000000000004e-004 | K174: 4.04 | L174: 0. | M174: 108.3 | N174: 4.32 | O174: 0.125 | P174: 93.52 | Q174: 转股中 | R174: 2.69年 | S174: 无权 | T174: 17.6 | U174: 16 | V174: 9.0000000000000011e-003 | W174: 0.20000000000000001 | X174: 0.187 | Y174: 88 | Z174: 0.73 | AA174: 1.09e-002 | AB174: 5.0000000000000001e-003 | AC174: 无权 | AD174: 无权 | AE174: 无权 | AF174: 98.02 | AG174: 0.44 | AH174: AA+ | AI174: 3.8300000000000001e-002 | AJ174: =H174+100*O174 -> 117.73099999999999 | AK174: 116.9 | AL174: 26 | AM174: 18.9 | AN174: 10 | AO174: -2.3e-002 | AP174: 26 | AQ174: 江银转债!
A175: 127 | B175: 123062 | C175: 三超转债 | D175: 300554 | E175: 三超新材 | F175: 机械装备 | G175: 通用设备 | H175: 113.29 | I175: 1.15e-002 | J175: 4.0000000000000002e-004 | K175: 16.78 | L175: 1.7000000000000001e-002 | M175: 119.7 | N175: 17.17 | O175: 0.159 | P175: 97.73 | Q175: 转股中 | R175: 5.18年 | S175: 3.18年 | T175: 1.95 | U175: 424 | V175: 1.8999999999999999 | W175: 0.124 | X175: 0.121 | Y175: 16 | Z175: 3 | AA175: 1.09e-002 | AB175: 4.3e-003 | AC175: -2.3799999999999998e-002 | AD175: -2.63e-002 | AE175: 79.8 | AF175: 79.17 | AG175: 0.7 | AH175: A | AI175: 8.539999999999999e-002 | AJ175: =H175+100*O175 -> 129.19 | AK175: 128.9 | AL175: 139 | AM175: 49.1 | AN175: 245 | AO175: 8.5999999999999993e-002 | AP175: 19 | AQ175: 三超转债
A176: 161 | B176: 123052 | C176: 飞鹿转债 | D176: 300665 | E176: 飞鹿股份 | F176: 化工 | G176: 化工 | H176: 120.88 | I176: 9.7000000000000003e-003 | J176: -1.3999999999999999e-002 | K176: 10.82 | L176: -6.4000000000000003e-003 | M176: 127.3 | N176: 9.9 | O176: 0.106 | P176: 109.29 | Q176: 转股中 | R176: 5年14天 | S176: 3年15天 | T176: 1.53 | U176: 56 | V176: 0.30299999999999999 | W176: 0.11599999999999999 | X176: 0.127 | Y176: 13 | Z176: 2.82 | AA176: 1.06e-002 | AB176: 1.6000000000000001e-003 | AC176: -4.2900000000000001e-002 | AD176: -4.58e-002 | AE176: 83.66 | AF176: 89.18 | AG176: 0.67 | AH176: A+ | AI176: 7.5399999999999995e-002 | AJ176: =H176+100*O176 -> 131.47999999999999 | AK176: 132.5 | AL176: 183 | AM176: 43.3 | AN176: 217 | AO176: -6.3e-002 | AP176: 16 | AQ176: 飞鹿转债
A177: 82 | B177: 110076 | C177: 华海转债! | D177: 600521 | E177: 华海药业 | F177: 医药 | G177: 医药行业 | H177: 108.78 | I177: -2.0000000000000001e-004 | J177: -1.6000000000000001e-003 | K177: 20.03 | L177: -1.23e-002 | M177: 115.1 | N177: 34.66 | O177: 0.88200000000000001 | P177: 57.79 | Q177: 转股中 | R177: 5.45年 | S177: 3.45年 | T177: 18.4 | U177: 19 | V177: 9.0000000000000011e-003 | W177: 6.3e-002 | X177: 3.7000000000000005e-002 | Y177: 291 | Z177: 4.47 | AA177: 1.06e-002 | AB177: 5.6000000000000008e-003 | AC177: -1.3500000000000002e-002 | AD177: -1.54e-002 | AE177: 88.96 | AF177: 91.71 | AG177: 0.14 | AH177: AA | AI177: 4.3400000000000001e-002 | AJ177: =H177+100*O177 -> 196.98000000000002 | AK177: 159.8 | AL177: 316 | AM177: 68.1 | AN177: 315 | AO177: -1.4999999999999999e-002 | AP177: 7 | AQ177: 华海转债!
A178: 87 | B178: 123073 | C178: 同和转债! | D178: 300636 | E178: 同和药业 | F178: 医药 | G178: 原料药 | H178: 115.8 | I178: -1.61e-002 | J178: -1.6899999999999998e-002 | K178: 16.34 | L178: -4.5599999999999995e-002 | M178: 122.4 | N178: 14.82 | O178: 5.0000000000000003e-002 | P178: 110.26 | Q178: 转股中 | R178: 5.43年 | S178: 3.43年 | T178: 3.59 | U178: 16 | V178: 3.7000000000000005e-002 | W178: 0.107 | X178: 0.11800000000000001 | Y178: 34 | Z178: 2.68 | AA178: 1.0500000000000001e-002 | AB178: 3.4000000000000002e-003 | AC178: -2.8300000000000002e-002 | AD178: -3.0600000000000002e-002 | AE178: 80.77 | AF178: 83.27 | AG178: 0.72 | AH178: A+ | AI178: 7.5399999999999995e-002 | AJ178: =H178+100*O178 -> 120.8 | AK178: 121.3 | AL178: 65 | AM178: 38.1 | AN178: 168 | AO178: -0.38299999999999995 | AP178: 11 | AQ178: 同和转债!
A179: 27 | B179: 128144 | C179: 利民转债 | D179: 2734 | E179: 利民股份 | F179: 化工 | G179: 农化 | H179: 107.72 | I179: -1.1999999999999999e-003 | J179: -3.9000000000000003e-003 | K179: 12.48 | L179: -1.03e-002 | M179: 114.1 | N179: 14.23 | O179: 0.22800000000000001 | P179: 87.7 | Q179: 3月17天 | R179: 5.78年 | S179: 3.78年 | T179: 9.8 | U179: 1.7 | V179: 2.e-003 | W179: 0.21100000000000002 | X179: 0.185 | Y179: 46 | Z179: 1.69 | AA179: 1.0200000000000001e-002 | AB179: 5.6999999999999993e-003 | AC179: -1.1699999999999999e-002 | AD179: -1.3100000000000001e-002 | AE179: 87.09 | AF179: 89.6 | AG179: 0.5 | AH179: AA | AI179: 4.3400000000000001e-002 | AJ179: =H179+100*O179 -> 130.52000000000001 | AK179: 127.7 | AL179: 124 | AM179: 38.1 | AN179: 170 | AO179: -1.3999999999999999e-002 | AP179: 4 | AQ179: 利民转债
A180: 70 | B180: 123078 | C180: 飞凯转债! | D180: 300398 | E180: 飞凯材料 | F180: 化工 | G180: 化工 | H180: 109.141 | I180: 4.0000000000000002e-004 | J180: 7.000000000000001e-004 | K180: 14.29 | L180: 2.0999999999999999e-003 | M180: 115.2 | N180: 15.62 | O180: 0.193 | P180: 91.49 | Q180: 13天 | R180: 5.52年 | S180: 3.52年 | T180: 8.2 | U180: 2.7 | V180: 3.0000000000000001e-003 | W180: 0.111 | X180: 0.10199999999999999 | Y180: 74 | Z180: 2.75 | AA180: 1.e-002 | AB180: 5.0000000000000001e-003 | AC180: -1.3899999999999999e-002 | AD180: -1.5800000000000002e-002 | AE180: 88.8 | AF180: 91.53 | AG180: 0.52 | AH180: AA | AI180: 4.3400000000000001e-002 | AJ180: =H180+100*O180 -> 128.441 | AK180: 126.8 | AL180: 111 | AM180: 35.3 | AN180: 139 | AO180: -3.2000000000000001e-002 | AP180: 7 | AQ180: 飞凯转债!
A181: 240 | B181: 128078 | C181: 太极转债! | D181: 2368 | E181: 太极股份 | F181: 计算机及 | G181: 软件开发 | H181: 112.211 | I181: 1.e-002 | J181: -9.7999999999999997e-003 | K181: 20.06 | L181: 5.0000000000000001e-004 | M181: 116.9 | N181: 22.4 | O181: 0.253 | P181: 89.55 | Q181: 转股中 | R181: 4.42年 | S181: 2.42年 | T181: 9.6 | U181: 2.3 | V181: 2.e-003 | W181: 8.3000000000000004e-002 | X181: 7.400000000000001e-002 | Y181: 116 | Z181: 3.47 | AA181: 9.4999999999999998e-003 | AB181: 2.7000000000000001e-003 | AC181: -3.1400000000000004e-002 | AD181: -3.39e-002 | AE181: 93.07 | AF181: 97.84 | AG181: 0.5 | AH181: AA | AI181: 4.2000000000000003e-002 | AJ181: =H181+100*O181 -> 137.511 | AK181: 134.9 | AL181: 214 | AM181: 37 | AN181: 154 | AO181: -1.4999999999999999e-002 | AP181: 11 | AQ181: 太极转债!
A182: 21 | B182: 123104 | C182: 卫宁转债 | D182: 300253 | E182: 卫宁健康 | F182: 计算机及 | G182: 软件开发 | H182: 118.5 | I182: -4.1999999999999997e-003 | J182: 5.9999999999999995e-004 | K182: 15.19 | L182: -9.1000000000000004e-003 | M182: 125.1 | N182: 17.76 | O182: 0.38500000000000001 | P182: 85.53 | Q182: 4月4天 | R182: 5.82年 | S182: 3.82年 | T182: 9.7 | U182: 26 | V182: 2.2000000000000002e-002 | W182: 2.9999999999999999e-002 | X182: 2.6000000000000002e-002 | Y182: 325 | Z182: 7.12 | AA182: 9.4999999999999998e-003 | AB182: 2.3e-003 | AC182: -3.3399999999999999e-002 | AD182: -3.5000000000000003e-002 | AE182: 87.58 | AF182: 98.1 | AG182: 0.39 | AH182: AA | AI182: 4.3400000000000001e-002 | AJ182: =H182+100*O182 -> 157. | AK182: 151.5 | AL182: 300 | AM182: 53.4 | AN182: 273 | AO182: -4.5999999999999999e-002 | AP182: 4 | AQ182: 卫宁转债
A183: 333 | B183: 110041 | C183: 蒙电转债! | D183: 600863 | E183: 内蒙华电 | F183: 能源电力 | G183: 电力供应 | H183: 106.74 | I183: 3.0999999999999999e-003 | J183: 3.2000000000000002e-003 | K183: 2.46 | L183: 1.6500000000000001e-002 | M183: 109.3 | N183: 2.69 | O183: 0.16699999999999998 | P183: 91.45 | Q183: 转股中 | R183: 2.59年 | S183: 0.59年 | T183: 18.7 | U183: 15 | V183: 8.0000000000000002e-003 | W183: 0.13100000000000001 | X183: 0.12 | Y183: 143 | Z183: 1.22 | AA183: 9.3999999999999986e-003 | AB183: 2.5999999999999999e-003 | AC183: -6.0999999999999999e-002 | AD183: -6.5299999999999997e-002 | AE183: 99.17 | AF183: 100.07 | AG183: 0.38 | AH183: AAA | AI183: 3.5299999999999998e-002 | AJ183: =H183+100*O183 -> 123.44 | AK183: 122 | AL183: 69 | AM183: 22 | AN183: 20 | AO183: 1.6e-002 | AP183: 11 | AQ183: 蒙电转债!
A184: 85 | B184: 113606 | C184: 荣泰转债 | D184: 603579 | E184: 荣泰健康 | F184: 机械装备 | G184: 专用设备 | H184: 115.33 | I184: 2.8999999999999998e-003 | J184: -8.3999999999999995e-003 | K184: 35.2 | L184: -8.199999999999999e-003 | M184: 121.2 | N184: 33.32 | O184: 9.1999999999999998e-002 | P184: 105.64 | Q184: 转股中 | R184: 5.44年 | S184: 3.44年 | T184: 6 | U184: 8.3 | V184: 1.2e-002 | W184: 0.122 | X184: 0.129 | Y184: 49 | Z184: 2.94 | AA184: 9.3999999999999986e-003 | AB184: 2.5999999999999999e-003 | AC184: -2.8199999999999999e-002 | AD184: -3.0299999999999997e-002 | AE184: 83.34 | AF184: 86.96 | AG184: 0.68 | AH184: AA- | AI184: 6.4399999999999999e-002 | AJ184: =H184+100*O184 -> 124.53 | AK184: 125 | AL184: 94 | AM184: 38.1 | AN184: 166 | AO184: 2.3e-002 | AP184: 10 | AQ184: 荣泰转债
A185: 139 | B185: 128121 | C185: 宏川转债! | D185: 2930 | E185: 宏川智慧 | F185: 交通运输 | G185: 物流业 | H185: 108.358 | I185: 5.1999999999999998e-003 | J185: 0. | K185: 15.36 | L185: 1.1899999999999999e-002 | M185: 113.3 | N185: 20.25 | O185: 0.42899999999999999 | P185: 75.85 | Q185: 转股中 | R185: 5年56天 | S185: 3年57天 | T185: 6.7 | U185: 0.6 | V185: 1.e-003 | W185: 9.8000000000000004e-002 | X185: 7.4999999999999997e-002 | Y185: 68 | Z185: 3.29 | AA185: 8.8999999999999999e-003 | AB185: 4.0999999999999995e-003 | AC185: -1.3000000000000001e-002 | AD185: -1.5100000000000001e-002 | AE185: 84.56 | AF185: 82.73 | AG185: 0.44 | AH185: AA- | AI185: 6.4399999999999999e-002 | AJ185: =H185+100*O185 -> 151.25800000000001 | AK185: 140.9 | AL185: 252 | AM185: 56.3 | AN185: 288 | AO185: -7.2000000000000008e-002 | AP185: 5 | AQ185: 宏川转债!
A186: 103 | B186: 123067 | C186: 斯莱转债 | D186: 300382 | E186: 斯莱克 | F186: 机械装备 | G186: 专用设备 | H186: 115.799 | I186: -6.0000000000000001e-003 | J186: -8.3999999999999995e-003 | K186: 9.21 | L186: -2.3300000000000001e-002 | M186: 121.2 | N186: 9.38 | O186: 0.17899999999999999 | P186: 98.19 | Q186: 转股中 | R186: 5.32年 | S186: 3.33年 | T186: 3.88 | U186: 4.9 | V186: 1.1000000000000001e-002 | W186: 7.4999999999999997e-002 | X186: 7.2999999999999995e-002 | Y186: 52 | Z186: 5.01 | AA186: 8.8000000000000005e-003 | AB186: 1.9e-003 | AC186: -3.0299999999999997e-002 | AD186: -3.2500000000000001e-002 | AE186: 83.95 | AF186: 87.6 | AG186: 0.62 | AH186: AA- | AI186: 6.4399999999999999e-002 | AJ186: =H186+100*O186 -> 133.69900000000001 | AK186: 133.4 | AL186: 197 | AM186: 45.8 | AN186: 227 | AO186: -4.5999999999999999e-002 | AP186: 13 | AQ186: 斯莱转债
A187: 63 | B187: 123082 | C187: 北陆转债! | D187: 300016 | E187: 北陆药业 | F187: 医药 | G187: 化学制药 | H187: 116.04 | I187: 9.5999999999999992e-003 | J187: -1.1999999999999999e-003 | K187: 9.99 | L187: 1.11e-002 | M187: 121.7 | N187: 8.8 | O187: 2.2000000000000002e-002 | P187: 113.52 | Q187: 21天 | R187: 5.55年 | S187: 3.55年 | T187: 5 | U187: 12 | V187: 2.1000000000000001e-002 | W187: 0.10099999999999999 | X187: 0.115 | Y187: 49 | Z187: 2.97 | AA187: 8.8000000000000005e-003 | AB187: 2.0999999999999999e-003 | AC187: -2.7799999999999998e-002 | AD187: -3.0099999999999998e-002 | AE187: 80.14 | AF187: 82.12 | AG187: 0.75 | AH187: A+ | AI187: 7.5399999999999995e-002 | AJ187: =H187+100*O187 -> 118.24000000000001 | AK187: 118.6 | AL187: 36 | AM187: 36.4 | AN187: 148 | AO187: 6.3e-002 | AP187: 9 | AQ187: 北陆转债!
A188: 207 | B188: 113563 | C188: 柳药转债 | D188: 603368 | E188: 柳药股份 | F188: 医药 | G188: 医药商业 | H188: 108.54 | I188: -6.0000000000000001e-003 | J188: 1.1999999999999999e-003 | K188: 20.2 | L188: -1.2199999999999999e-002 | M188: 112.9 | N188: 24.47 | O188: 0.315 | P188: 82.55 | Q188: 转股中 | R188: 4.66年 | S188: 2.66年 | T188: 8.02 | U188: 9.4 | V188: 1.1000000000000001e-002 | W188: 0.11 | X188: 8.9999999999999997e-002 | Y188: 73 | Z188: 1.42 | AA188: 8.6999999999999994e-003 | AB188: 3.5999999999999999e-003 | AC188: -1.72e-002 | AD188: -1.95e-002 | AE188: 92.16 | AF188: 93.58 | AG188: 0.39 | AH188: AA | AI188: 4.2000000000000003e-002 | AJ188: =H188+100*O188 -> 140.04000000000002 | AK188: 134.5 | AL188: 208 | AM188: 41 | AN188: 190 | AO188: -7.8e-002 | AP188: 18 | AQ188: 柳药转债
A189: 16 | B189: 128145 | C189: 日丰转债 | D189: 2953 | E189: 日丰股份 | F189: 家电 | G189: 零部件制 | H189: 109.88 | I189: 0. | J189: -1.1000000000000001e-003 | K189: 19.67 | L189: -1.5e-003 | M189: 115.4 | N189: 19.24 | O189: 7.4999999999999997e-002 | P189: 102.23 | Q189: 4月9天 | R189: 5.83年 | S189: 3.84年 | T189: 3.8 | U189: 4.4 | V189: 1.e-002 | W189: 0.111 | X189: 0.114 | Y189: 34 | Z189: 3.2 | AA189: 8.6e-003 | AB189: 3.8e-003 | AC189: -1.44e-002 | AD189: -1.61e-002 | AE189: 80.99 | AF189: 80.74 | AG189: 0.71 | AH189: AA- | AI189: 6.4399999999999999e-002 | AJ189: =H189+100*O189 -> 117.38 | AK189: 117.5 | AL189: 31 | AM189: 36.5 | AN189: 149 | AO189: -9.0000000000000011e-003 | AP189: 4 | AQ189: 日丰转债
A190: 125 | B190: 128124 | C190: 科华转债! | D190: 2022 | E190: 科华生物 | F190: 医药 | G190: 生物制药 | H190: 105.664 | I190: 5.6999999999999993e-003 | J190: -7.3000000000000001e-003 | K190: 18.32 | L190: -3.3e-003 | M190: 110.3 | N190: 21.51 | O190: 0.24100000000000002 | P190: 85.17 | Q190: 转股中 | R190: 5.18年 | S190: 3.19年 | T190: 7.38 | U190: 22 | V190: 2.7999999999999997e-002 | W190: 7.8e-002 | X190: 6.7000000000000004e-002 | Y190: 94 | Z190: 2.83 | AA190: 8.5000000000000006e-003 | AB190: 4.6999999999999993e-003 | AC190: -7.4999999999999997e-003 | AD190: -9.1999999999999998e-003 | AE190: 89.48 | AF190: 88.84 | AG190: 0.47 | AH190: AA | AI190: 4.3400000000000001e-002 | AJ190: =H190+100*O190 -> 129.76400000000001 | AK190: 126.2 | AL190: 100 | AM190: 36.7 | AN190: 150 | AO190: 3.1e-002 | AP190: 19 | AQ190: 科华转债!
A191: 269 | B191: 128064 | C191: 司尔转债! | D191: 2538 | E191: 司尔特 | F191: 化工 | G191: 农化 | H191: 110.7 | I191: 1.1999999999999999e-003 | J191: 5.1000000000000004e-003 | K191: 6.09 | L191: 1.1599999999999999e-002 | M191: 114.3 | N191: 6.07 | O191: 0.10300000000000001 | P191: 100.33 | Q191: 转股中 | R191: 3.88年 | S191: 1.88年 | T191: 8 | U191: 2.8 | V191: 3.0000000000000001e-003 | W191: 0.183 | X191: 0.184 | Y191: 44 | Z191: 1.09 | AA191: 8.3999999999999995e-003 | AB191: 1.7000000000000001e-003 | AC191: -3.5699999999999996e-002 | AD191: -3.8300000000000001e-002 | AE191: 94.54 | AF191: 97.71 | AG191: 0.54 | AH191: AA | AI191: 4.2000000000000003e-002 | AJ191: =H191+100*O191 -> 121. | AK191: 121.1 | AL191: 62 | AM191: 23.4 | AN191: 26 | AO191: -3.7999999999999999e-002 | AP191: 48 | AQ191: 司尔转债!
A192: 28 | B192: 118000 | C192: 嘉元转债 | D192: 688388 | E192: 嘉元科技 | F192: 电子 | G192: 电子产品 | H192: 115.41 | I192: -3.9000000000000003e-003 | J192: -1.5900000000000001e-002 | K192: 65.6 | L192: -3.6900000000000002e-002 | M192: 121 | N192: 78.74 | O192: 0.38500000000000001 | P192: 83.31 | Q192: 3月13天 | R192: 5.76年 | S192: 3.76年 | T192: 12.4 | U192: 17 | V192: 1.1000000000000001e-002 | W192: 8.199999999999999e-002 | X192: 6.8000000000000005e-002 | Y192: 151 | Z192: 5.57 | AA192: 8.3999999999999995e-003 | AB192: 2.0999999999999999e-003 | AC192: -2.6600000000000002e-002 | AD192: -2.8399999999999998e-002 | AE192: 81.52 | AF192: 85.07 | AG192: 0.54 | AH192: AA- | AI192: 6.4399999999999999e-002 | AJ192: =H192+100*O192 -> 153.91 | AK192: 147.5 | AL192: 287 | AM192: 62.4 | AN192: 305 | AO192: -0.11800000000000001 | AP192: 3 | AQ192: 嘉元转债
A193: 313 | B193: 110045 | C193: 海澜转债! | D193: 600398 | E193: 海澜之家 | F193: 服装纺织 | G193: 服装行业 | H193: 108.44 | I193: -8.1000000000000013e-003 | J193: 2.5000000000000001e-003 | K193: 7.16 | L193: -1.1000000000000001e-002 | M193: 111.1 | N193: 7.3 | O193: 0.106 | P193: 98.08 | Q193: 转股中 | R193: 3年52天 | S193: 1年53天 | T193: 29.5 | U193: 85 | V193: 2.7000000000000003e-002 | W193: 9.5000000000000001e-002 | X193: 9.4e-002 | Y193: 309 | Z193: 2.21 | AA193: 7.9000000000000008e-003 | AB193: 1.2999999999999999e-003 | AC193: -4.58e-002 | AD193: -4.87e-002 | AE193: 96.94 | AF193: 98.41 | AG193: 0.51 | AH193: AA+ | AI193: 4.0000000000000001e-002 | AJ193: =H193+100*O193 -> 119.03999999999999 | AK193: 118.8 | AL193: 40 | AM193: 20.4 | AN193: 16 | AO193: 1.3999999999999999e-002 | AP193: 55 | AQ193: 海澜转债!
A194: 342 | B194: 128021 | C194: 兄弟转债!! | D194: 2562 | E194: 兄弟科技 | F194: 医药 | G194: 原料药 | H194: 106.802 | I194: 0. | J194: -1.5e-003 | K194: 4.55 | L194: -4.4000000000000003e-003 | M194: 108.8 | N194: 5.19 | O194: 0.218 | P194: 87.67 | Q194: 转股中 | R194: 2.52年 | S194: 0.52年 | T194: 2.65 | U194: 2.7 | V194: 1.e-002 | W194: 5.5e-002 | X194: 4.8000000000000001e-002 | Y194: 48 | Z194: 1.63 | AA194: 7.4999999999999997e-003 | AB194: 8.9999999999999998e-004 | AC194: -7.0699999999999999e-002 | AD194: -7.4800000000000005e-002 | AE194: 98.83 | AF194: 98.63 | AG194: 0.34 | AH194: AA | AI194: 4.0300000000000002e-002 | AJ194: =H194+100*O194 -> 128.602 | AK194: 125.9 | AL194: 98 | AM194: 27.1 | AN194: 51 | AO194: -4.5999999999999999e-002 | AP194: 14 | AQ194: 兄弟转债!!
A195: 217 | B195: 113030 | C195: 东风转债! | D195: 601515 | E195: 东风股份 | F195: 造纸包装 | G195: 包装材料 | H195: 113.27 | I195: -1.95e-002 | J195: -3.0999999999999999e-003 | K195: 6.79 | L195: -4.0999999999999995e-002 | M195: 116.9 | N195: 6.75 | O195: 0.126 | P195: 100.59 | Q195: 转股中 | R195: 4.59年 | S195: 2.59年 | T195: 2.95 | U195: 29 | V195: 8.5999999999999993e-002 | W195: 3.3000000000000002e-002 | X195: 3.3000000000000002e-002 | Y195: 91 | Z195: 1.97 | AA195: 6.9999999999999993e-003 | AB195: 5.0000000000000001e-004 | AC195: -3.2799999999999996e-002 | AD195: -3.5000000000000003e-002 | AE195: 92.4 | AF195: 97.13 | AG195: 0.55 | AH195: AA | AI195: 4.2000000000000003e-002 | AJ195: =H195+100*O195 -> 125.86999999999999 | AK195: 125.9 | AL195: 99 | AM195: 28.8 | AN195: 67 | AO195: 2.8999999999999998e-002 | AP195: 17 | AQ195: 东风转债!
A196: 301 | B196: 128048 | C196: 张行转债 | D196: 2839 | E196: 张家港行 | F196: 金融 | G196: 银行行业 | H196: 110.846 | I196: 2.7000000000000001e-003 | J196: -6.0999999999999995e-003 | K196: 5.55 | L196: -7.1999999999999998e-003 | M196: 113.3 | N196: 5.76 | O196: 0.14999999999999999 | P196: 96.35 | Q196: 转股中 | R196: 3.48年 | S196: 无权 | T196: 25 | U196: 8.5 | V196: 3.0000000000000001e-003 | W196: 0.249 | X196: 0.23999999999999999 | Y196: 100 | Z196: 0.9 | AA196: 6.4000000000000003e-003 | AB196: -5.0000000000000001e-004 | AC196: 无权 | AD196: 无权 | AE196: 无权 | AF196: 99.13 | AG196: 0.48 | AH196: AA+ | AI196: 4.0000000000000001e-002 | AJ196: =H196+100*O196 -> 125.846 | AK196: 125.3 | AL196: 96 | AM196: 26.2 | AN196: 47 | AO196: 4.0000000000000001e-003 | AP196: 13 | AQ196: 张行转债
A197: 110 | B197: 128129 | C197: 青农转债! | D197: 2958 | E197: 青农商行 | F197: 金融 | G197: 银行行业 | H197: 108.605 | I197: -3.5999999999999999e-003 | J197: -2.8000000000000004e-003 | K197: 4.35 | L197: -1.1399999999999999e-002 | M197: 112.2 | N197: 4.47 | O197: 0.11599999999999999 | P197: 97.32 | Q197: 转股中 | R197: 5.26年 | S197: 无权 | T197: 50 | U197: 6.4 | V197: 1.e-003 | W197: 0.20699999999999999 | X197: 0.20100000000000001 | Y197: 242 | Z197: 0.88 | AA197: 6.3e-003 | AB197: 2.e-003 | AC197: 无权 | AD197: 无权 | AE197: 无权 | AF197: 92.31 | AG197: 0.56 | AH197: AAA | AI197: 3.8399999999999997e-002 | AJ197: =H197+100*O197 -> 120.205 | AK197: 119.9 | AL197: 49 | AM197: 27.6 | AN197: 54 | AO197: -1.e-003 | AP197: 14 | AQ197: 青农转债!
A198: 29 | B198: 123100 | C198: 朗科转债 | D198: 300543 | E198: 朗科智能 | F198: 电子 | G198: 电子产品 | H198: 113.499 | I198: -3.9000000000000003e-003 | J198: -1.1200000000000002e-002 | K198: 16.15 | L198: -2.12e-002 | M198: 117.5 | N198: 15.34 | O198: 7.8e-002 | P198: 105.28 | Q198: 3月3天 | R198: 5.72年 | S198: 3.72年 | T198: 3.8 | U198: 24 | V198: 5.5e-002 | W198: 0.114 | X198: 0.12 | Y198: 33 | Z198: 3.55 | AA198: 6.1999999999999998e-003 | AB198: 8.0000000000000004e-004 | AC198: -2.2799999999999997e-002 | AD198: -2.46e-002 | AE198: 81.65 | AF198: 82.8 | AG198: 0.71 | AH198: AA- | AI198: 6.4399999999999999e-002 | AJ198: =H198+100*O198 -> 121.29899999999999 | AK198: 121.7 | AL198: 67 | AM198: 38.9 | AN198: 176 | AO198: -6.9999999999999993e-003 | AP198: 9 | AQ198: 朗科转债
A199: 233 | B199: 123033 | C199: 金力转债! | D199: 300748 | E199: 金力永磁 | F199: 电子 | G199: 元器件制 | H199: 118.38 | I199: 2.3e-003 | J199: 5.0000000000000001e-004 | K199: 24.17 | L199: 5.0000000000000001e-003 | M199: 121.5 | N199: 25.3 | O199: 0.23899999999999999 | P199: 95.53 | Q199: 转股中 | R199: 4.45年 | S199: 2.45年 | T199: 4.34 | U199: 15 | V199: 2.7999999999999997e-002 | W199: 2.6000000000000002e-002 | X199: 2.5000000000000001e-002 | Y199: 167 | Z199: 4.97 | AA199: 6.0000000000000001e-003 | AB199: -2.3e-003 | AC199: -4.5499999999999999e-002 | AD199: -4.8899999999999999e-002 | AE199: 89.72 | AF199: 93.36 | AG199: 0.55 | AH199: AA- | AI199: 6.3e-002 | AJ199: =H199+100*O199 -> 142.28 | AK199: 141.2 | AL199: 255 | AM199: 47.9 | AN199: 239 | AO199: -0.28399999999999997 | AP199: 27 | AQ199: 金力转债!
A200: 195 | B200: 110067 | C200: 华安转债! | D200: 600909 | E200: 华安证券 | F200: 金融 | G200: 证券行业 | H200: 107.31 | I200: -2.e-003 | J200: -6.8000000000000005e-003 | K200: 6.17 | L200: -1.9099999999999999e-002 | M200: 110.3 | N200: 6.98 | O200: 0.214 | P200: 88.4 | Q200: 转股中 | R200: 4.81年 | S200: 无权 | T200: 28 | U200: 11 | V200: 4.0000000000000001e-003 | W200: 0.125 | X200: 0.111 | Y200: 223 | Z200: 1.56 | AA200: 5.7999999999999996e-003 | AB200: 1.8e-003 | AC200: 无权 | AD200: 无权 | AE200: 无权 | AF200: 92.83 | AG200: 0.46 | AH200: AAA | AI200: 3.7000000000000005e-002 | AJ200: =H200+100*O200 -> 128.71000000000001 | AK200: 126.2 | AL200: 101 | AM200: 33.4 | AN200: 119 | AO200: 6.0000000000000001e-003 | AP200: 27 | AQ200: 华安转债!
A201: 14 | B201: 127031 | C201: 洋丰转债! | D201: 902 | E201: 新洋丰 | F201: 化工 | G201: 农化 | H201: 113.3 | I201: -1.e-003 | J201: -1.6000000000000001e-003 | K201: 13.98 | L201: -9.1999999999999998e-003 | M201: 117.1 | N201: 19.94 | O201: 0.61599999999999999 | P201: 70.11 | Q201: 4月20天 | R201: 5.84年 | S201: 3.84年 | T201: 10 | U201: 12 | V201: 1.1000000000000001e-002 | W201: 5.5e-002 | X201: 3.7999999999999999e-002 | Y201: 182 | Z201: 2.51 | AA201: 5.7999999999999996e-003 | AB201: 5.9999999999999995e-004 | AC201: -2.2200000000000001e-002 | AD201: -2.3900000000000001e-002 | AE201: 87.49 | AF201: 91.75 | AG201: 0.28 | AH201: AA | AI201: 4.3400000000000001e-002 | AJ201: =H201+100*O201 -> 174.90000000000001 | AK201: 156.5 | AL201: 311 | AM201: 64.7 | AN201: 308 | AO201: -0.105 | AP201: 2 | AQ201: 洋丰转债!
A202: 345 | B202: 113502 | C202: 嘉澳转债! | D202: 603822 | E202: 嘉澳环保 | F202: 化工 | G202: 化工 | H202: 109.92 | I202: 4.0000000000000001e-003 | J202: -4.0000000000000001e-003 | K202: 22.02 | L202: -7.1999999999999998e-003 | M202: 111.3 | N202: 44.79 | O202: 1.24 | P202: 49.16 | Q202: 转股中 | R202: 2.47年 | S202: 0.47年 | T202: 1.85 | U202: 173 | V202: 0.83700000000000008 | W202: 0.115 | X202: 5.5999999999999994e-002 | Y202: 16 | Z202: 2.02 | AA202: 5.1000000000000004e-003 | AB202: -3.3e-003 | AC202: -0.121 | AD202: -0.127 | AE202: 98.01 | AF202: 96.33 | AG202: 0 | AH202: AA- | AI202: 6.13e-002 | AJ202: =H202+100*O202 -> 233.92000000000002 | AK202: 170.7 | AL202: 326 | AM202: 72.7 | AN202: 324 | AO202: 6.7000000000000004e-002 | AP202: 37 | AQ202: 嘉澳转债!
A203: 203 | B203: 113565 | C203: 宏辉转债 | D203: 603336 | E203: 宏辉果蔬 | F203: 农业 | G203: 农产品加 | H203: 115.1 | I203: 3.6600000000000001e-002 | J203: -2.5600000000000001e-002 | K203: 7.83 | L203: 1.6899999999999998e-002 | M203: 117.8 | N203: 7.64 | O203: 0.12300000000000001 | P203: 102.49 | Q203: 转股中 | R203: 4.77年 | S203: 2.77年 | T203: 2.25 | U203: 558 | V203: 2.1499999999999999 | W203: 6.6000000000000003e-002 | X203: 6.7000000000000004e-002 | Y203: 34 | Z203: 2.53 | AA203: 5.0000000000000001e-003 | AB203: -1.6000000000000001e-003 | AC203: -3.5200000000000002e-002 | AD203: -3.7499999999999999e-002 | AE203: 86.85 | AF203: 88.6 | AG203: 0.65 | AH203: AA- | AI203: 6.3e-002 | AJ203: =H203+100*O203 -> 127.39999999999999 | AK203: 127.7 | AL203: 123 | AM203: 39.1 | AN203: 178 | AO203: -0.14099999999999999 | AP203: 24 | AQ203: 宏辉转债
A204: 41 | B204: 127028 | C204: 英特转债! | D204: 411 | E204: 英特集团 | F204: 医药 | G204: 医药商业 | H204: 110.029 | I204: 4.3e-003 | J204: 2.8000000000000004e-003 | K204: 14.47 | L204: 1.0500000000000001e-002 | M204: 113.1 | N204: 13.46 | O204: 2.3e-002 | P204: 107.5 | Q204: 51天 | R204: 5.62年 | S204: 3.63年 | T204: 6 | U204: 30 | V204: 4.5999999999999999e-002 | W204: 0.16699999999999998 | X204: 0.17899999999999999 | Y204: 36 | Z204: 2.12 | AA204: 5.0000000000000001e-003 | AB204: 7.000000000000001e-004 | AC204: -1.5900000000000001e-002 | AD204: -1.77e-002 | AE204: 88.94 | AF204: 90.4 | AG204: 0.68 | AH204: AA+ | AI204: 4.1399999999999999e-002 | AJ204: =H204+100*O204 -> 112.32899999999999 | AK204: 112.6 | AL204: 11 | AM204: 22.2 | AN204: 22 | AO204: -2.1000000000000001e-002 | AP204: 15 | AQ204: 英特转债!
A205: 58 | B205: 113043 | C205: 财通转债! | D205: 601108 | E205: 财通证券 | F205: 金融 | G205: 证券行业 | H205: 107.4 | I205: 0. | J205: 4.7999999999999996e-003 | K205: 10.93 | L205: 1.11e-002 | M205: 110.2 | N205: 13.33 | O205: 0.31 | P205: 82 | Q205: 26天 | R205: 5.55年 | S205: 无权 | T205: 38 | U205: 59 | V205: 1.3999999999999999e-002 | W205: 9.6999999999999989e-002 | X205: 7.9000000000000001e-002 | Y205: 392 | Z205: 1.71 | AA205: 4.6999999999999993e-003 | AB205: 1.2999999999999999e-003 | AC205: 无权 | AD205: 无权 | AE205: 无权 | AF205: 89.65 | AG205: 0.43 | AH205: AAA | AI205: 3.8399999999999997e-002 | AJ205: =H205+100*O205 -> 138.40000000000001 | AK205: 132.8 | AL205: 188 | AM205: 43.2 | AN205: 215 | AO205: 4.0000000000000001e-002 | AP205: 10 | AQ205: 财通转债!
A206: 265 | B206: 113026 | C206: 核能转债! | D206: 601985 | E206: 中国核电 | F206: 能源电力 | G206: 核电 | H206: 107.54 | I206: 5.1000000000000004e-003 | J206: -1.4199999999999999e-002 | K206: 5.25 | L206: -2.0499999999999997e-002 | M206: 109.3 | N206: 5.86 | O206: 0.20000000000000001 | P206: 89.59 | Q206: 转股中 | R206: 3.90年 | S206: 1.90年 | T206: 78 | U206: 29 | V206: 3.0000000000000001e-003 | W206: 8.5000000000000006e-002 | X206: 7.5999999999999998e-002 | Y206: 916 | Z206: 1.48 | AA206: 4.1999999999999997e-003 | AB206: -2.0000000000000001e-004 | AC206: -2.1700000000000001e-002 | AD206: -2.4300000000000002e-002 | AE206: 95.41 | AF206: 95.11 | AG206: 0.44 | AH206: AAA | AI206: 3.7000000000000005e-002 | AJ206: =H206+100*O206 -> 127.54000000000001 | AK206: 125.5 | AL206: 97 | AM206: 30.1 | AN206: 85 | AO206: -5.0000000000000001e-003 | AP206: 47 | AQ206: 核能转债!
A207: 129 | B207: 110073 | C207: 国投转债 | D207: 600061 | E207: 国投资本 | F207: 金融 | G207: 证券行业 | H207: 108.21 | I207: -7.0999999999999995e-003 | J207: -1.e-004 | K207: 13.09 | L207: -1.5800000000000002e-002 | M207: 110.5 | N207: 15.25 | O207: 0.26100000000000001 | P207: 85.84 | Q207: 转股中 | R207: 5.17年 | S207: 无权 | T207: 80 | U207: 145 | V207: 1.7000000000000001e-002 | W207: 0.14499999999999999 | X207: 0.124 | Y207: 553 | Z207: 1.27 | AA207: 4.0999999999999995e-003 | AB207: 2.9999999999999997e-004 | AC207: 无权 | AD207: 无权 | AE207: 无权 | AF207: 91.17 | AG207: 0.45 | AH207: AAA | AI207: 3.8399999999999997e-002 | AJ207: =H207+100*O207 -> 134.31 | AK207: 130.6 | AL207: 156 | AM207: 39.4 | AN207: 179 | AO207: 1.1000000000000001e-002 | AP207: 23 | AQ207: 国投转债
A208: 163 | B208: 128109 | C208: 楚江转债 | D208: 2171 | E208: 楚江新材 | F208: 有色金属 | G208: 铜金属 | H208: 113.099 | I208: -1.2199999999999999e-002 | J208: 1.1599999999999999e-002 | K208: 7.76 | L208: -1.2999999999999999e-003 | M208: 115.3 | N208: 8.73 | O208: 0.27200000000000002 | P208: 88.89 | Q208: 转股中 | R208: 5年13天 | S208: 3年14天 | T208: 18.3 | U208: 33 | V208: 1.6e-002 | W208: 0.17699999999999999 | X208: 0.157 | Y208: 103 | Z208: 1.82 | AA208: 3.9000000000000003e-003 | AB208: -1.5e-003 | AC208: -2.6699999999999998e-002 | AD208: -2.8900000000000002e-002 | AE208: 90.73 | AF208: 93.53 | AG208: 0.47 | AH208: AA | AI208: 4.3400000000000001e-002 | AJ208: =H208+100*O208 -> 140.29900000000001 | AK208: 137.3 | AL208: 228 | AM208: 43.8 | AN208: 220 | AO208: -2.9999999999999999e-002 | AP208: 6 | AQ208: 楚江转债
A209: 92 | B209: 123072 | C209: 乐歌转债! | D209: 300729 | E209: 乐歌股份 | F209: 其他 | G209: 家居用品 | H209: 127.02 | I209: 3.3e-003 | J209: -2.8999999999999998e-003 | K209: 30.5 | L209: 6.8999999999999999e-003 | M209: 129.6 | N209: 73.13 | O209: 2.0499999999999998 | P209: 41.71 | Q209: 转股中 | R209: 5.42年 | S209: 3.42年 | T209: 1.42 | U209: 278 | V209: 1.51 | W209: 3.4000000000000002e-002 | X209: 1.3999999999999999e-002 | Y209: 42 | Z209: 4.14 | AA209: 3.8e-003 | AB209: -5.0000000000000001e-003 | AC209: -4.8099999999999997e-002 | AD209: -5.1399999999999994e-002 | AE209: 82.55 | AF209: 88.52 | AG209: 0.06 | AH209: A+ | AI209: 7.5399999999999995e-002 | AJ209: =H209+100*O209 -> 332.01999999999998 | AK209: 212.3 | AL209: 340 | AM209: 123.8 | AN209: 341 | AO209: -8.5999999999999993e-002 | AP209: 8 | AQ209: 乐歌转债!
A210: 235 | B210: 110060 | C210: 天路转债! | D210: 600326 | E210: 西藏天路 | F210: 建筑 | G210: 水泥 | H210: 113.1 | I210: -2.9999999999999997e-004 | J210: -5.1999999999999998e-003 | K210: 7.26 | L210: -9.4999999999999998e-003 | M210: 114.9 | N210: 7.16 | O210: 0.115 | P210: 101.4 | Q210: 转股中 | R210: 4.44年 | S210: 2.44年 | T210: 7.06 | U210: 22 | V210: 2.7000000000000003e-002 | W210: 0.106 | X210: 0.107 | Y210: 67 | Z210: 1.58 | AA210: 3.5999999999999999e-003 | AB210: -2.3999999999999998e-003 | AC210: -3.4200000000000001e-002 | AD210: -3.6600000000000001e-002 | AE210: 92.99 | AF210: 96.09 | AG210: 0.57 | AH210: AA | AI210: 4.2000000000000003e-002 | AJ210: =H210+100*O210 -> 124.59999999999999 | AK210: 124.8 | AL210: 92 | AM210: 28.7 | AN210: 66 | AO210: -1.e-002 | AP210: 13 | AQ210: 天路转债!
A211: 61 | B211: 113612 | C211: 永冠转债 | D211: 603681 | E211: 永冠新材 | F211: 化工 | G211: 其他 | H211: 119.06 | I211: 4.8999999999999998e-003 | J211: 1.0800000000000001e-002 | K211: 24.9 | L211: 2.0499999999999997e-002 | M211: 121.2 | N211: 20.79 | O211: -6.0000000000000001e-003 | P211: 119.77 | Q211: 24天 | R211: 5.55年 | S211: 3.55年 | T211: 5.2 | U211: 55 | V211: 8.900000000000001e-002 | W211: 0.125 | X211: 0.14999999999999999 | Y211: 41 | Z211: 2.64 | AA211: 3.3e-003 | AB211: -3.3e-003 | AC211: -3.5799999999999998e-002 | AD211: -3.78e-002 | AE211: 82.79 | AF211: 86.38 | AG211: 0.77 | AH211: AA- | AI211: 6.4399999999999999e-002 | AJ211: =H211+100*O211 -> 118.46000000000001 | AK211: 118.4 | AL211: 35 | AM211: 32 | AN211: 106 | AO211: 5.7999999999999996e-002 | AP211: 6 | AQ211: 永冠转债
A212: 93 | B212: 123070 | C212: 鹏辉转债 | D212: 300438 | E212: 鹏辉能源 | F212: 汽车 | G212: 零部件制 | H212: 113.259 | I212: -9.4999999999999998e-003 | J212: 7.9000000000000008e-003 | K212: 18.18 | L212: -3.3e-003 | M212: 115.1 | N212: 20.16 | O212: 0.25600000000000001 | P212: 90.18 | Q212: 转股中 | R212: 5.41年 | S212: 3.42年 | T212: 8.9 | U212: 5.1 | V212: 5.0000000000000001e-003 | W212: 0.11699999999999999 | X212: 0.105 | Y212: 76 | Z212: 3.23 | AA212: 3.0000000000000001e-003 | AB212: -2.e-003 | AC212: -2.4799999999999999e-002 | AD212: -2.6600000000000002e-002 | AE212: 89.1 | AF212: 91.85 | AG212: 0.5 | AH212: AA | AI212: 4.3400000000000001e-002 | AJ212: =H212+100*O212 -> 138.85900000000001 | AK212: 136.3 | AL212: 224 | AM212: 44.5 | AN212: 223 | AO212: 2.8999999999999998e-002 | AP212: 4 | AQ212: 鹏辉转债
A213: 210 | B213: 127015 | C213: 希望转债! | D213: 876 | E213: 新 希 望 | F213: 农业 | G213: 畜牧业 | H213: 108.675 | I213: -1.2e-002 | J213: -1.1999999999999999e-003 | K213: 15.7 | L213: -3.9199999999999999e-002 | M213: 110 | N213: 19.75 | O213: 0.36700000000000005 | P213: 79.49 | Q213: 转股中 | R213: 4.62年 | S213: 2.62年 | T213: 9.5 | U213: 18 | V213: 1.8000000000000002e-002 | W213: 1.3000000000000001e-002 | X213: 1.1000000000000001e-002 | Y213: 707 | Z213: 1.91 | AA213: 2.7000000000000001e-003 | AB213: -1.4000000000000002e-003 | AC213: -2.0299999999999999e-002 | AD213: -2.2099999999999998e-002 | AE213: 92.84 | AF213: 93.25 | AG213: 0.34 | AH213: AAA | AI213: 3.7000000000000005e-002 | AJ213: =H213+100*O213 -> 145.375 | AK213: 137.9 | AL213: 233 | AM213: 44.6 | AN213: 224 | AO213: -4.5999999999999999e-002 | AP213: 28 | AQ213: 希望转债!
A214: 111 | B214: 113602 | C214: 景20转债! | D214: 603228 | E214: 景旺电子 | F214: 电子 | G214: 元器件制 | H214: 111.75 | I214: -9.0000000000000011e-003 | J214: -1.21e-002 | K214: 24.24 | L214: -4.2699999999999995e-002 | M214: 113.3 | N214: 27.4 | O214: 0.26300000000000001 | P214: 88.47 | Q214: 转股中 | R214: 5.26年 | S214: 3.26年 | T214: 17.8 | U214: 33 | V214: 1.7000000000000001e-002 | W214: 8.5999999999999993e-002 | X214: 7.5999999999999998e-002 | Y214: 207 | Z214: 3.18 | AA214: 2.7000000000000001e-003 | AB214: -1.9e-003 | AC214: -2.1499999999999998e-002 | AD214: -2.3599999999999999e-002 | AE214: 89.88 | AF214: 91.05 | AG214: 0.49 | AH214: AA | AI214: 4.3400000000000001e-002 | AJ214: =H214+100*O214 -> 138.05000000000001 | AK214: 135 | AL214: 216 | AM214: 44 | AN214: 221 | AO214: -9.0999999999999998e-002 | AP214: 9 | AQ214: 景20转债!
A215: 94 | B215: 128135 | C215: 洽洽转债! | D215: 2557 | E215: 洽洽食品 | F215: 食品饮料 | G215: 休闲食品 | H215: 118.494 | I215: 4.7999999999999996e-003 | J215: -1.03e-002 | K215: 51.31 | L215: -1.4199999999999999e-002 | M215: 120.2 | N215: 60.83 | O215: 0.40500000000000003 | P215: 84.35 | Q215: 转股中 | R215: 5.41年 | S215: 3.42年 | T215: 13.4 | U215: 8.6 | V215: 5.0000000000000001e-003 | W215: 5.2000000000000005e-002 | X215: 4.2999999999999997e-002 | Y215: 260 | Z215: 6.09 | AA215: 2.7000000000000001e-003 | AB215: -3.7000000000000002e-003 | AC215: -3.6799999999999999e-002 | AD215: -3.8699999999999998e-002 | AE215: 89.19 | AF215: 95.91 | AG215: 0.39 | AH215: AA | AI215: 4.3400000000000001e-002 | AJ215: =H215+100*O215 -> 158.994 | AK215: 152.6 | AL215: 301 | AM215: 56.7 | AN215: 290 | AO215: -3.5000000000000003e-002 | AP215: 11 | AQ215: 洽洽转债!
A216: 225 | B216: 128082 | C216: 华锋转债! | D216: 2806 | E216: 华锋股份 | F216: 电子 | G216: 元器件制 | H216: 119.99 | I216: -1.5700000000000002e-002 | J216: 4.3e-003 | K216: 10.89 | L216: -1.54e-002 | M216: 121.4 | N216: 9.13 | O216: 6.0000000000000001e-003 | P216: 119.28 | Q216: 转股中 | R216: 4.54年 | S216: 2.54年 | T216: 3.14 | U216: 162 | V216: 0.42599999999999999 | W216: 0.161 | X216: 0.191 | Y216: 20 | Z216: 1.98 | AA216: 2.5999999999999999e-003 | AB216: -5.4000000000000003e-003 | AC216: -5.0499999999999996e-002 | AD216: -5.3399999999999996e-002 | AE216: 86.36 | AF216: 88.56 | AG216: 0.74 | AH216: A+ | AI216: 7.400000000000001e-002 | AJ216: =H216+100*O216 -> 120.58999999999999 | AK216: 120.7 | AL216: 55 | AM216: 32.1 | AN216: 109 | AO216: -4.0000000000000001e-003 | AP216: 55 | AQ216: 华锋转债!
A217: 101 | B217: 113603 | C217: 东缆转债 | D217: 603606 | E217: 东方电缆 | F217: 能源电力 | G217: 电力设备 | H217: 113.64 | I217: 1.2699999999999999e-002 | J217: -1.23e-002 | K217: 19.68 | L217: 1.e-003 | M217: 115.1 | N217: 23.88 | O217: 0.379 | P217: 82.41 | Q217: 转股中 | R217: 5.34年 | S217: 3.35年 | T217: 8 | U217: 12 | V217: 1.3000000000000001e-002 | W217: 6.2e-002 | X217: 5.0999999999999997e-002 | Y217: 129 | Z217: 3.85 | AA217: 2.3999999999999998e-003 | AB217: -2.5999999999999999e-003 | AC217: -2.6200000000000001e-002 | AD217: -2.81e-002 | AE217: 89.37 | AF217: 92.12 | AG217: 0.42 | AH217: AA | AI217: 4.3400000000000001e-002 | AJ217: =H217+100*O217 -> 151.53999999999999 | AK217: 144.9 | AL217: 275 | AM217: 52.7 | AN217: 269 | AO217: -7.2999999999999995e-002 | AP217: 7 | AQ217: 东缆转债
A218: 165 | B218: 127017 | C218: 万青转债 | D218: 789 | E218: 万年青 | F218: 建筑 | G218: 水泥 | H218: 117.15 | I218: 8.8999999999999999e-003 | J218: -1.6000000000000001e-003 | K218: 13.97 | L218: 1.38e-002 | M218: 118.4 | N218: 14.16 | O218: 0.187 | P218: 98.66 | Q218: 转股中 | R218: 5年12天 | S218: 3年13天 | T218: 10 | U218: 5.8 | V218: 5.0000000000000001e-003 | W218: 8.9999999999999997e-002 | X218: 8.900000000000001e-002 | Y218: 111 | Z218: 1.7 | AA218: 2.2000000000000001e-003 | AB218: -4.1999999999999997e-003 | AC218: -3.7599999999999995e-002 | AD218: -3.9699999999999999e-002 | AE218: 91.24 | AF218: 96.95 | AG218: 0.53 | AH218: AA+ | AI218: 4.1399999999999999e-002 | AJ218: =H218+100*O218 -> 135.84999999999999 | AK218: 135.6 | AL218: 220 | AM218: 38.7 | AN218: 173 | AO218: 1.e-002 | AP218: 9 | AQ218: 万青转债
A219: 176 | B219: 110070 | C219: 凌钢转债! | D219: 600231 | E219: 凌钢股份 | F219: 钢铁 | G219: 炼钢 | H219: 116.53 | I219: 1.26e-002 | J219: 2.9999999999999997e-004 | K219: 3.09 | L219: 1.9799999999999998e-002 | M219: 117.4 | N219: 2.75 | O219: 3.7000000000000005e-002 | P219: 112.36 | Q219: 转股中 | R219: 4.89年 | S219: 2.90年 | T219: 2.17 | U219: 237 | V219: 0.93000000000000005 | W219: 2.5000000000000001e-002 | X219: 2.7999999999999997e-002 | Y219: 87 | Z219: 1.02 | AA219: 1.6000000000000001e-003 | AB219: -4.6999999999999993e-003 | AC219: -3.7599999999999995e-002 | AD219: -3.9800000000000002e-002 | AE219: 91.56 | AF219: 96.38 | AG219: 0.65 | AH219: AA | AI219: 4.2000000000000003e-002 | AJ219: =H219+100*O219 -> 120.23 | AK219: 120.7 | AL219: 54 | AM219: 24.3 | AN219: 35 | AO219: -2.6000000000000002e-002 | AP219: 21 | AQ219: 凌钢转债!
A220: 26 | B220: 113045 | C220: 环旭转债 | D220: 601231 | E220: 环旭电子 | F220: 电子 | G220: 电子产品 | H220: 111.21 | I220: -7.6e-003 | J220: -1.5e-003 | K220: 15.4 | L220: -2.6499999999999999e-002 | M220: 112 | N220: 20.25 | O220: 0.46200000000000002 | P220: 76.05 | Q220: 6月23天 | R220: 5.78年 | S220: 2.79年 | T220: 34.5 | U220: 2.9 | V220: 1.e-003 | W220: 0.10099999999999999 | X220: 7.6999999999999999e-002 | Y220: 340 | Z220: 2.74 | AA220: 1.1999999999999999e-003 | AB220: -2.5000000000000001e-003 | AC220: -2.6000000000000002e-002 | AD220: -2.7799999999999998e-002 | AE220: 91.29 | AF220: 88.82 | AG220: 0.34 | AH220: AA+ | AI220: 4.1399999999999999e-002 | AJ220: =H220+100*O220 -> 157.41 | AK220: 146.4 | AL220: 282 | AM220: 55.1 | AN220: 281 | AO220: -8.1000000000000003e-002 | AP220: 4 | AQ220: 环旭转债
A221: 47 | B221: 123090 | C221: 三诺转债 | D221: 300298 | E221: 三诺生物 | F221: 医药 | G221: 医疗器械 | H221: 116.5 | I221: 7.4000000000000003e-003 | J221: -2.1099999999999997e-002 | K221: 31.61 | L221: -2.7999999999999997e-002 | M221: 117.1 | N221: 35.35 | O221: 0.30299999999999999 | P221: 89.42 | Q221: 35天 | R221: 5.58年 | S221: 3.59年 | T221: 5 | U221: 159 | V221: 0.26899999999999996 | W221: 2.7999999999999997e-002 | X221: 2.5000000000000001e-002 | Y221: 179 | Z221: 6.7 | AA221: 8.9999999999999998e-004 | AB221: -4.4000000000000003e-003 | AC221: -3.1e-002 | AD221: -3.2799999999999996e-002 | AE221: 88.46 | AF221: 92.76 | AG221: 0.49 | AH221: AA | AI221: 4.3400000000000001e-002 | AJ221: =H221+100*O221 -> 146.80000000000001 | AK221: 143.6 | AL221: 271 | AM221: 50.8 | AN221: 257 | AO221: -8.9999999999999997e-002 | AP221: 3 | AQ221: 三诺转债
A222: 78 | B222: 127024 | C222: 盈峰转债 | D222: 967 | E222: 盈峰环境 | F222: 机械装备 | G222: 专用设备 | H222: 116.4 | I222: 1.6000000000000001e-003 | J222: -2.9999999999999997e-004 | K222: 7.97 | L222: 2.5000000000000001e-003 | M222: 116.8 | N222: 8.31 | O222: 0.214 | P222: 95.91 | Q222: 转股中 | R222: 5.46年 | S222: 3.46年 | T222: 14.8 | U222: 11 | V222: 6.0000000000000001e-003 | W222: 5.9000000000000004e-002 | X222: 5.5999999999999994e-002 | Y222: 252 | Z222: 1.5 | AA222: 5.9999999999999995e-004 | AB222: -4.7999999999999996e-003 | AC222: -3.2599999999999997e-002 | AD222: -3.4300000000000004e-002 | AE222: 89.28 | AF222: 93.95 | AG222: 0.53 | AH222: AA+ | AI222: 4.1399999999999999e-002 | AJ222: =H222+100*O222 -> 137.80000000000001 | AK222: 136.9 | AL222: 227 | AM222: 42.9 | AN222: 212 | AO222: -1.e-003 | AP222: 5 | AQ222: 盈峰转债
A223: 73 | B223: 110077 | C223: 洪城转债 | D223: 600461 | E223: 洪城环境 | F223: 城市公用 | G223: 城市公用 | H223: 113.18 | I223: 5.1999999999999998e-003 | J223: -6.8999999999999999e-003 | K223: 7.47 | L223: -2.7000000000000001e-003 | M223: 113.5 | N223: 7.13 | O223: 8.0000000000000002e-002 | P223: 104.77 | Q223: 5.1天 | R223: 5.50年 | S223: 3.50年 | T223: 18 | U223: 14 | V223: 6.9999999999999993e-003 | W223: 0.254 | X223: 0.26600000000000001 | Y223: 71 | Z223: 1.32 | AA223: 5.0000000000000001e-004 | AB223: -3.9000000000000003e-003 | AC223: -2.7400000000000001e-002 | AD223: -2.86e-002 | AE223: 88.19 | AF223: 91.06 | AG223: 0.64 | AH223: AA+ | AI223: 4.1399999999999999e-002 | AJ223: =H223+100*O223 -> 121.18000000000001 | AK223: 121.6 | AL223: 66 | AM223: 30.5 | AN223: 87 | AO223: 2.9999999999999999e-002 | AP223: 7 | AQ223: 洪城转债
A224: 346 | B224: 128018 | C224: 时达转债! | D224: 2527 | E224: 新时达 | F224: 机械装备 | G224: 机器人及 | H224: 109.2 | I224: 1.8e-003 | J224: -4.4000000000000003e-003 | K224: 7.1 | L224: -5.6000000000000008e-003 | M224: 109.3 | N224: 7.42 | O224: 0.14099999999999999 | P224: 95.69 | Q224: 转股中 | R224: 2.46年 | S224: 0.46年 | T224: 4.04 | U224: 24 | V224: 5.5e-002 | W224: 9.1999999999999998e-002 | X224: 8.8000000000000009e-002 | Y224: 44 | Z224: 1.68 | AA224: 4.0000000000000002e-004 | AB224: -6.7000000000000002e-003 | AC224: -0.114 | AD224: -0.11900000000000001 | AE224: 99.31 | AF224: 99.34 | AG224: 0.46 | AH224: AA | AI224: 4.0300000000000002e-002 | AJ224: =H224+100*O224 -> 123.3 | AK224: 122.7 | AL224: 77 | AM224: 23.4 | AN224: 27 | AO224: 9.9000000000000005e-002 | AP224: 37 | AQ224: 时达转债!
A225: 30 | B225: 123099 | C225: 普利转债 | D225: 300630 | E225: 普利制药 | F225: 医药 | G225: 化学制药 | H225: 123.22 | I225: 5.8999999999999999e-003 | J225: 1.41e-002 | K225: 49.93 | L225: 2.9100000000000001e-002 | M225: 123.5 | N225: 46.22 | O225: 0.14099999999999999 | P225: 108.03 | Q225: 3月4天 | R225: 5.72年 | S225: 3.72年 | T225: 8.5 | U225: 30 | V225: 2.7999999999999997e-002 | W225: 3.9e-002 | X225: 4.2000000000000003e-002 | Y225: 218 | Z225: 9.99 | AA225: 4.0000000000000002e-004 | AB225: -6.5000000000000006e-003 | AC225: -4.3400000000000001e-002 | AD225: -4.5199999999999997e-002 | AE225: 81.65 | AF225: 87 | AG225: 0.69 | AH225: AA- | AI225: 6.4399999999999999e-002 | AJ225: =H225+100*O225 -> 137.31999999999999 | AK225: 138.4 | AL225: 235 | AM225: 51.4 | AN225: 262 | AO225: 3.7000000000000005e-002 | AP225: 4 | AQ225: 普利转债
A226: 208 | B226: 128094 | C226: 星帅转债 | D226: 2860 | E226: 星帅尔 | F226: 家电 | G226: 零部件制 | H226: 120.881 | I226: -8.3999999999999995e-003 | J226: 2.5999999999999999e-003 | K226: 16.9 | L226: -7.6e-003 | M226: 121 | N226: 13.95 | O226: -2.e-003 | P226: 121.15 | Q226: 转股中 | R226: 4.66年 | S226: 2.66年 | T226: 2.71 | U226: 17 | V226: 5.0999999999999997e-002 | W226: 8.0000000000000002e-002 | X226: 9.6999999999999989e-002 | Y226: 34 | Z226: 3.3 | AA226: 2.0000000000000001e-004 | AB226: -7.4999999999999997e-003 | AC226: -5.21e-002 | AD226: -5.4699999999999999e-002 | AE226: 85.28 | AF226: 87.46 | AG226: 0.76 | AH226: A+ | AI226: 7.400000000000001e-002 | AJ226: =H226+100*O226 -> 120.681 | AK226: 120.6 | AL226: 53 | AM226: 33.2 | AN226: 114 | AO226: 3.7000000000000005e-002 | AP226: 30 | AQ226: 星帅转债
A227: 283 | B227: 127011 | C227: 中鼎转2! | D227: 887 | E227: 中鼎股份 | F227: 汽车 | G227: 零部件制 | H227: 114.5 | I227: -9.0000000000000011e-003 | J227: 9.4999999999999998e-003 | K227: 11.06 | L227: 8.9999999999999998e-004 | M227: 114.5 | N227: 11.59 | O227: 0.20000000000000001 | P227: 95.43 | Q227: 转股中 | R227: 3.79年 | S227: 1.80年 | T227: 12 | U227: 3.5 | V227: 3.0000000000000001e-003 | W227: 8.900000000000001e-002 | X227: 8.5000000000000006e-002 | Y227: 135 | Z227: 1.51 | AA227: 0. | AB227: -6.8000000000000005e-003 | AC227: -5.3600000000000002e-002 | AD227: -5.62e-002 | AE227: 95.26 | AF227: 98.94 | AG227: 0.47 | AH227: AA+ | AI227: 4.0000000000000001e-002 | AJ227: =H227+100*O227 -> 134.5 | AK227: 133.6 | AL227: 199 | AM227: 34.6 | AN227: 133 | AO227: 3.0000000000000001e-003 | AP227: 23 | AQ227: 中鼎转2!
A228: 77 | B228: 127025 | C228: 冀东转债 | D228: 401 | E228: 冀东水泥 | F228: 建筑 | G228: 水泥 | H228: 110.2 | I228: -3.9000000000000003e-003 | J228: 1.4000000000000002e-003 | K228: 14.05 | L228: -5.0000000000000001e-003 | M228: 110.1 | N228: 15.78 | O228: 0.23800000000000002 | P228: 89.04 | Q228: 转股中 | R228: 5.46年 | S228: 3.46年 | T228: 17.8 | U228: 39 | V228: 2.e-002 | W228: 8.900000000000001e-002 | X228: 8.0000000000000002e-002 | Y228: 199 | Z228: 1.34 | AA228: -2.0000000000000001e-004 | AB228: -3.5999999999999999e-003 | AC228: -1.9e-002 | AD228: -2.0400000000000001e-002 | AE228: 89.8 | AF228: 89.91 | AG228: 0.5 | AH228: AAA | AI228: 3.8399999999999997e-002 | AJ228: =H228+100*O228 -> 134. | AK228: 131.4 | AL228: 166 | AM228: 41.4 | AN228: 197 | AO228: -1.7000000000000001e-002 | AP228: 10 | AQ228: 冀东转债
A229: 284 | B229: 128057 | C229: 博彦转债 | D229: 2649 | E229: 博彦科技 | F229: 计算机及 | G229: 软件开发 | H229: 116.438 | I229: 1.8700000000000001e-002 | J229: -8.3000000000000001e-003 | K229: 9.49 | L229: 1.4999999999999999e-002 | M229: 116.3 | N229: 8.5 | O229: 4.2999999999999997e-002 | P229: 111.65 | Q229: 转股中 | R229: 3.79年 | S229: 1.79年 | T229: 5.07 | U229: 24 | V229: 4.0999999999999995e-002 | W229: 0.10000000000000001 | X229: 0.11199999999999999 | Y229: 51 | Z229: 1.66 | AA229: -2.9999999999999997e-004 | AB229: -7.9000000000000008e-003 | AC229: -6.2100000000000002e-002 | AD229: -6.4699999999999994e-002 | AE229: 91.3 | AF229: 92.67 | AG229: 0.69 | AH229: AA- | AI229: 6.3e-002 | AJ229: =H229+100*O229 -> 120.738 | AK229: 121.2 | AL229: 63 | AM229: 28.6 | AN229: 63 | AO229: -1.9e-002 | AP229: 26 | AQ229: 博彦转债
A230: 109 | B230: 128130 | C230: 景兴转债 | D230: 2067 | E230: 景兴纸业 | F230: 造纸包装 | G230: 包装用纸 | H230: 115.372 | I230: 1.83e-002 | J230: 1.1699999999999999e-002 | K230: 3.85 | L230: 4.3400000000000001e-002 | M230: 115.1 | N230: 3.4 | O230: 1.9e-002 | P230: 113.24 | Q230: 转股中 | R230: 5.28年 | S230: 3.28年 | T230: 10.8 | U230: 47 | V230: 3.7999999999999999e-002 | W230: 0.24199999999999999 | X230: 0.27399999999999997 | Y230: 45 | Z230: 0.91 | AA230: -5.0000000000000001e-004 | AB230: -5.6000000000000008e-003 | AC230: -3.1e-002 | AD230: -3.2899999999999999e-002 | AE230: 89.62 | AF230: 92.38 | AG230: 0.69 | AH230: AA | AI230: 4.3400000000000001e-002 | AJ230: =H230+100*O230 -> 117.27200000000001 | AK230: 117.5 | AL230: 30 | AM230: 25.1 | AN230: 38 | AO230: 1.6e-002 | AP230: 13 | AQ230: 景兴转债
A231: 177 | B231: 128106 | C231: 华统转债 | D231: 2840 | E231: 华统股份 | F231: 农业 | G231: 农产品加 | H231: 113.261 | I231: 8.6e-003 | J231: -2.5999999999999999e-003 | K231: 10.05 | L231: 9.0000000000000011e-003 | M231: 112.9 | N231: 9.4 | O231: 5.9000000000000004e-002 | P231: 106.91 | Q231: 转股中 | R231: 4.89年 | S231: 2.89年 | T231: 5.35 | U231: 10 | V231: 1.7000000000000001e-002 | W231: 0.11900000000000001 | X231: 0.127 | Y231: 45 | Z231: 2.56 | AA231: -7.000000000000001e-004 | AB231: -5.5000000000000005e-003 | AC231: -2.9600000000000001e-002 | AD231: -3.1600000000000003e-002 | AE231: 91.29 | AF231: 92.7 | AG231: 0.66 | AH231: AA | AI231: 4.2000000000000003e-002 | AJ231: =H231+100*O231 -> 119.161 | AK231: 119.6 | AL231: 47 | AM231: 26.9 | AN231: 50 | AO231: -5.0000000000000003e-002 | AP231: 8 | AQ231: 华统转债
A232: 136 | B232: 127020 | C232: 中金转债 | D232: 60 | E232: 中金岭南 | F232: 有色金属 | G232: 有色行业 | H232: 114.2 | I232: 6.4000000000000003e-003 | J232: -6.4000000000000003e-003 | K232: 4.81 | L232: 0. | M232: 113.7 | N232: 4.71 | O232: 0.11800000000000001 | P232: 102.12 | Q232: 转股中 | R232: 5年59天 | S232: 3.16年 | T232: 38 | U232: 22 | V232: 5.0000000000000001e-003 | W232: 0.221 | X232: 0.22600000000000001 | Y232: 172 | Z232: 1.44 | AA232: -8.9999999999999998e-004 | AB232: -5.6000000000000008e-003 | AC232: -3.2199999999999999e-002 | AD232: -3.3599999999999998e-002 | AE232: 89.58 | AF232: 92.49 | AG232: 0.61 | AH232: AA+ | AI232: 4.1399999999999999e-002 | AJ232: =H232+100*O232 -> 126. | AK232: 126.3 | AL232: 103 | AM232: 33.8 | AN232: 123 | AO232: -1.2e-002 | AP232: 15 | AQ232: 中金转债
A233: 34 | B233: 113621 | C233: 彤程转债 | D233: 603650 | E233: 彤程新材 | F233: 化工 | G233: 橡胶塑料 | H233: 115.65 | I233: -1.5e-003 | J233: -1.09e-002 | K233: 30.26 | L233: -2.3199999999999998e-002 | M233: 115.1 | N233: 32.96 | O233: 0.26000000000000001 | P233: 91.81 | Q233: 2月13天 | R233: 5.68年 | S233: 3.69年 | T233: 8 | U233: 1 | V233: 1.e-003 | W233: 4.4999999999999998e-002 | X233: 4.0999999999999995e-002 | Y233: 177 | Z233: 6.88 | AA233: -8.9999999999999998e-004 | AB233: -5.6000000000000008e-003 | AC233: -2.8399999999999998e-002 | AD233: -3.0099999999999998e-002 | AE233: 88.09 | AF233: 90.8 | AG233: 0.53 | AH233: AA | AI233: 4.3400000000000001e-002 | AJ233: =H233+100*O233 -> 141.65000000000001 | AK233: 139.5 | AL233: 241 | AM233: 48.7 | AN233: 243 | AO233: -6.3e-002 | AP233: 4 | AQ233: 彤程转债
A234: 193 | B234: 113572 | C234: 三祥转债! | D234: 603663 | E234: 三祥新材 | F234: 其他 | G234: 其他 | H234: 113.37 | I234: -4.5999999999999999e-003 | J234: -2.8000000000000004e-003 | K234: 14.01 | L234: -1.06e-002 | M234: 112.8 | N234: 14.19 | O234: 0.14800000000000002 | P234: 98.73 | Q234: 转股中 | R234: 4.81年 | S234: 2.81年 | T234: 1.69 | U234: 3.8 | V234: 2.e-002 | W234: 6.3e-002 | X234: 6.2e-002 | Y234: 27 | Z234: 4.21 | AA234: -1.1000000000000001e-003 | AB234: -5.8999999999999999e-003 | AC234: -3.1e-002 | AD234: -3.3000000000000002e-002 | AE234: 83.67 | AF234: 80.57 | AG234: 0.7 | AH234: A+ | AI234: 7.400000000000001e-002 | AJ234: =H234+100*O234 -> 128.17000000000002 | AK234: 128 | AL234: 129 | AM234: 44.3 | AN234: 222 | AO234: -2.4e-002 | AP234: 19 | AQ234: 三祥转债!
A235: 1 | B235: 123113 | C235: 仙乐转债 | D235: 300791 | E235: 仙乐健康 | F235: 食品饮料 | G235: 食品饮料 | H235: 119.36 | I235: -4.0999999999999995e-003 | J235: -1.1200000000000002e-002 | K235: 77.8 | L235: -2.4799999999999999e-002 | M235: 118.5 | N235: 85.98 | O235: 0.31900000000000001 | P235: 90.49 | Q235: 5月7天 | R235: 5.91年 | S235: 3.91年 | T235: 10.3 | U235: 18 | V235: 1.3999999999999999e-002 | W235: 0.11 | X235: 9.9000000000000005e-002 | Y235: 93 | Z235: 4.16 | AA235: -1.1999999999999999e-003 | AB235: -6.7000000000000002e-003 | AC235: -3.39e-002 | AD235: -3.56e-002 | AE235: 80.69 | AF235: 82.52 | AG235: 0.61 | AH235: AA- | AI235: 6.4399999999999999e-002 | AJ235: =H235+100*O235 -> 151.25999999999999 | AK235: 148.2 | AL235: 290 | AM235: 65.7 | AN235: 309 | AO235: -2.9999999999999999e-002 | AP235: 2 | AQ235: 仙乐转债
A236: 80 | B236: 128136 | C236: 立讯转债! | D236: 2475 | E236: 立讯精密 | F236: 电子 | G236: 元器件制 | H236: 112.71 | I236: 1.e-003 | J236: -6.6e-003 | K236: 34.65 | L236: -3.5900000000000001e-002 | M236: 111.9 | N236: 58.36 | O236: 0.89800000000000002 | P236: 59.37 | Q236: 转股中 | R236: 5.45年 | S236: 3.46年 | T236: 30 | U236: 50 | V236: 1.4999999999999999e-002 | W236: 1.2e-002 | X236: 6.9999999999999993e-003 | Y236: 2438. | Z236: 8.43 | AA236: -1.2999999999999999e-003 | AB236: -5.3e-003 | AC236: -2.6200000000000001e-002 | AD236: -2.75e-002 | AE236: 88.45 | AF236: 89.93 | AG236: 0.16 | AH236: AA+ | AI236: 4.1399999999999999e-002 | AJ236: =H236+100*O236 -> 202.50999999999999 | AK236: 166 | AL236: 320 | AM236: 76.1 | AN236: 326 | AO236: -2.7999999999999997e-002 | AP236: 13 | AQ236: 立讯转债!
A237: 190 | B237: 128101 | C237: 联创转债! | D237: 2036 | E237: 联创电子 | F237: 电子 | G237: 液晶显示 | H237: 115.59 | I237: 3.1099999999999999e-002 | J237: -2.9399999999999999e-002 | K237: 11.44 | L237: 4.4000000000000003e-003 | M237: 114.8 | N237: 13.74 | O237: 0.38799999999999996 | P237: 83.26 | Q237: 转股中 | R237: 4.82年 | S237: 2.82年 | T237: 3 | U237: 592 | V237: 1.72 | W237: 2.5000000000000001e-002 | X237: 2.1000000000000001e-002 | Y237: 122 | Z237: 3.3 | AA237: -1.4000000000000002e-003 | AB237: -6.8999999999999999e-003 | AC237: -3.7200000000000004e-002 | AD237: -3.9199999999999999e-002 | AE237: 91.45 | AF237: 94.5 | AG237: 0.39 | AH237: AA | AI237: 4.2000000000000003e-002 | AJ237: =H237+100*O237 -> 154.38999999999999 | AK237: 147.9 | AL237: 288 | AM237: 53.4 | AN237: 274 | AO237: 6.3e-002 | AP237: 16 | AQ237: 联创转债!
A238: 68 | B238: 123079 | C238: 运达转债 | D238: 300772 | E238: 运达股份 | F238: 能源电力 | G238: 风能 | H238: 116.008 | I238: 1.6000000000000001e-003 | J238: 8.199999999999999e-003 | K238: 14.95 | L238: 1.7000000000000001e-002 | M238: 115.1 | N238: 15.31 | O238: 0.188 | P238: 97.65 | Q238: 17天 | R238: 5.53年 | S238: 3.53年 | T238: 5.77 | U238: 6 | V238: 9.0000000000000011e-003 | W238: 0.13100000000000001 | X238: 0.128 | Y238: 44 | Z238: 2.6 | AA238: -1.4000000000000002e-003 | AB238: -6.3e-003 | AC238: -3.04e-002 | AD238: -3.2099999999999997e-002 | AE238: 88.66 | AF238: 91.4 | AG238: 0.58 | AH238: AA | AI238: 4.3400000000000001e-002 | AJ238: =H238+100*O238 -> 134.80799999999999 | AK238: 134.4 | AL238: 206 | AM238: 43 | AN238: 214 | AO238: -5.0000000000000003e-002 | AP238: 4 | AQ238: 运达转债
A239: 133 | B239: 123060 | C239: 苏试转债 | D239: 300416 | E239: 苏试试验 | F239: 机械装备 | G239: 专用设备 | H239: 118.6 | I239: 2.9999999999999997e-004 | J239: -6.6e-003 | K239: 17.77 | L239: -1.e-002 | M239: 117.6 | N239: 18.28 | O239: 0.22 | P239: 97.21 | Q239: 转股中 | R239: 5.16年 | S239: 3.17年 | T239: 3.1 | U239: 2 | V239: 6.0000000000000001e-003 | W239: 6.6000000000000003e-002 | X239: 6.4000000000000001e-002 | Y239: 47 | Z239: 3.87 | AA239: -1.7000000000000001e-003 | AB239: -7.6e-003 | AC239: -3.9199999999999999e-002 | AD239: -4.1299999999999996e-002 | AE239: 84.63 | AF239: 85.82 | AG239: 0.63 | AH239: AA- | AI239: 6.4399999999999999e-002 | AJ239: =H239+100*O239 -> 140.59999999999999 | AK239: 140 | AL239: 247 | AM239: 54.2 | AN239: 278 | AO239: -5.0999999999999997e-002 | AP239: 9 | AQ239: 苏试转债
A240: 6 | B240: 113623 | C240: 凤21转债 | D240: 603225 | E240: 新凤鸣 | F240: 化工 | G240: 化纤 | H240: 118.52 | I240: -8.0000000000000004e-004 | J240: 4.5000000000000005e-003 | K240: 17.8 | L240: 5.6000000000000008e-003 | M240: 117.1 | N240: 16.6 | O240: 0.105 | P240: 107.23 | Q240: 4月26天 | R240: 5.88年 | S240: 3.88年 | T240: 25 | U240: 14 | V240: 5.0000000000000001e-003 | W240: 0.10000000000000001 | X240: 0.107 | Y240: 249 | Z240: 2.04 | AA240: -2.0999999999999999e-003 | AB240: -7.1999999999999998e-003 | AC240: -3.2899999999999999e-002 | AD240: -3.4500000000000003e-002 | AE240: 87.35 | AF240: 91.6 | AG240: 0.65 | AH240: AA | AI240: 4.3400000000000001e-002 | AJ240: =H240+100*O240 -> 129.01999999999998 | AK240: 129.8 | AL240: 149 | AM240: 38.2 | AN240: 171 | AO240: -2.e-003 | AP240: 2 | AQ240: 凤21转债
A241: 39 | B241: 113618 | C241: 美诺转债! | D241: 603538 | E241: 美诺华 | F241: 医药 | G241: 原料药 | H241: 116.83 | I241: -1.24e-002 | J241: -9.7000000000000003e-003 | K241: 37.44 | L241: -3.2099999999999997e-002 | M241: 115.3 | N241: 37.47 | O241: 0.16899999999999998 | P241: 99.92 | Q241: 2月0天 | R241: 5.65年 | S241: 3.65年 | T241: 5.2 | U241: 163 | V241: 0.26600000000000001 | W241: 9.3000000000000013e-002 | X241: 9.3000000000000013e-002 | Y241: 56 | Z241: 3.53 | AA241: -2.3999999999999998e-003 | AB241: -7.1999999999999998e-003 | AC241: -3.0800000000000001e-002 | AD241: -3.2599999999999997e-002 | AE241: 81.99 | AF241: 81.62 | AG241: 0.69 | AH241: AA- | AI241: 6.4399999999999999e-002 | AJ241: =H241+100*O241 -> 133.72999999999999 | AK241: 133.7 | AL241: 202 | AM241: 51.8 | AN241: 264 | AO241: 6.0000000000000001e-003 | AP241: 4 | AQ241: 美诺转债!
A242: 9 | B242: 123110 | C242: 九典转债 | D242: 300705 | E242: 九典制药 | F242: 医药 | G242: 化学制药 | H242: 123.18 | I242: -1.52e-002 | J242: -7.0999999999999995e-003 | K242: 29.89 | L242: -2.9500000000000002e-002 | M242: 121.4 | N242: 26.44 | O242: 8.9999999999999997e-002 | P242: 113.05 | Q242: 4月20天 | R242: 5.86年 | S242: 3.86年 | T242: 2.7 | U242: 103 | V242: 0.30599999999999999 | W242: 3.7999999999999999e-002 | X242: 4.4000000000000004e-002 | Y242: 70 | Z242: 7.95 | AA242: -2.5000000000000001e-003 | AB242: -8.6999999999999994e-003 | AC242: -4.0599999999999997e-002 | AD242: -4.2500000000000003e-002 | AE242: 78.13 | AF242: 80.01 | AG242: 0.76 | AH242: A+ | AI242: 7.5399999999999995e-002 | AJ242: =H242+100*O242 -> 132.18000000000001 | AK242: 133.3 | AL242: 196 | AM242: 53.3 | AN242: 272 | AO242: 2.e-003 | AP242: 4 | AQ242: 九典转债
A243: 276 | B243: 127012 | C243: 招路转债! | D243: 1965 | E243: 招商公路 | F243: 机场高速 | G243: 高速 | H243: 109.047 | I243: -1.1999999999999999e-003 | J243: -4.0000000000000001e-003 | K243: 8.09 | L243: -1.1000000000000001e-002 | M243: 107.9 | N243: 8.81 | O243: 0.188 | P243: 91.83 | Q243: 转股中 | R243: 3.83年 | S243: 1.84年 | T243: 50 | U243: 47 | V243: 9.0000000000000011e-003 | W243: 0.10000000000000001 | X243: 9.1999999999999998e-002 | Y243: 500 | Z243: 1 | AA243: -2.8000000000000004e-003 | AB243: -6.6e-003 | AC243: -3.4599999999999999e-002 | AD243: -3.6200000000000003e-002 | AE243: 94.55 | AF243: 94.03 | AG243: 0.47 | AH243: AAA | AI243: 3.7000000000000005e-002 | AJ243: =H243+100*O243 -> 127.84699999999999 | AK243: 126.3 | AL243: 102 | AM243: 31.7 | AN243: 103 | AO243: 1.7000000000000001e-002 | AP243: 32 | AQ243: 招路转债!
A244: 230 | B244: 123035 | C244: 利德转债! | D244: 300296 | E244: 利亚德 | F244: 电子 | G244: LED制 | H244: 116.51 | I244: -5.5000000000000005e-003 | J244: -6.0000000000000001e-003 | K244: 6.93 | L244: -2.12e-002 | M244: 115.1 | N244: 6.98 | O244: 0.17399999999999999 | P244: 99.28 | Q244: 转股中 | R244: 4.48年 | S244: 2.49年 | T244: 8 | U244: 5.2 | V244: 6.0000000000000001e-003 | W244: 4.4999999999999998e-002 | X244: 4.4999999999999998e-002 | Y244: 176 | Z244: 2.42 | AA244: -2.8000000000000004e-003 | AB244: -8.8000000000000005e-003 | AC244: -4.3799999999999999e-002 | AD244: -4.6199999999999998e-002 | AE244: 93.48 | AF244: 96.92 | AG244: 0.54 | AH244: AA+ | AI244: 4.0000000000000001e-002 | AJ244: =H244+100*O244 -> 133.91 | AK244: 133.7 | AL244: 201 | AM244: 36.8 | AN244: 153 | AO244: -3.7999999999999999e-002 | AP244: 15 | AQ244: 利德转债!
A245: 300 | B245: 110047 | C245: 山鹰转债 | D245: 600567 | E245: 山鹰国际 | F245: 造纸包装 | G245: 包装用纸 | H245: 118.9 | I245: 5.7999999999999996e-003 | J245: 9.4999999999999998e-003 | K245: 3.79 | L245: 2.4300000000000002e-002 | M245: 117.5 | N245: 3.34 | O245: 4.8000000000000001e-002 | P245: 113.47 | Q245: 转股中 | R245: 3.50年 | S245: 1.50年 | T245: 22.5 | U245: 49 | V245: 1.8000000000000002e-002 | W245: 0.128 | X245: 0.14599999999999999 | Y245: 175 | Z245: 1.12 | AA245: -3.4000000000000002e-003 | AB245: -1.21e-002 | AC245: -8.3900000000000002e-002 | AD245: -8.6800000000000002e-002 | AE245: 96.36 | AF245: 102.7 | AG245: 0.63 | AH245: AA+ | AI245: 4.0000000000000001e-002 | AJ245: =H245+100*O245 -> 123.7 | AK245: 124.3 | AL245: 89 | AM245: 21.6 | AN245: 19 | AO245: 4.2000000000000003e-002 | AP245: 33 | AQ245: 山鹰转债
A246: 178 | B246: 123048 | C246: 应急转债! | D246: 300527 | E246: 中船应急 | F246: 机械装备 | G246: 专用设备 | H246: 114.91 | I246: -1.1200000000000002e-002 | J246: 2.2000000000000001e-003 | K246: 8.81 | L246: -1.5600000000000001e-002 | M246: 112.8 | N246: 8.9 | O246: 0.161 | P246: 98.99 | Q246: 转股中 | R246: 4.89年 | S246: 2.89年 | T246: 3.8 | U246: 36 | V246: 8.1000000000000003e-002 | W246: 4.4999999999999998e-002 | X246: 4.4000000000000004e-002 | Y246: 85 | Z246: 3.19 | AA246: -3.9000000000000003e-003 | AB246: -8.6e-003 | AC246: -3.4500000000000003e-002 | AD246: -3.6499999999999998e-002 | AE246: 91.72 | AF246: 93.46 | AG246: 0.57 | AH246: AA+ | AI246: 4.0000000000000001e-002 | AJ246: =H246+100*O246 -> 131.00999999999999 | AK246: 130.8 | AL246: 159 | AM246: 37.4 | AN246: 156 | AO246: 1.1000000000000001e-002 | AP246: 17 | AQ246: 应急转债!
A247: 49 | B247: 128141 | C247: 旺能转债 | D247: 2034 | E247: 旺能环境 | F247: 城市公用 | G247: 三废处理 | H247: 117.75 | I247: -2.8000000000000004e-003 | J247: 2.0000000000000001e-004 | K247: 18.64 | L247: -3.7000000000000002e-003 | M247: 115.1 | N247: 16.47 | O247: 4.0000000000000001e-002 | P247: 113.18 | Q247: 33天 | R247: 5.57年 | S247: 3.58年 | T247: 14 | U247: 16 | V247: 1.e-002 | W247: 0.17800000000000002 | X247: 0.20199999999999999 | Y247: 79 | Z247: 1.66 | AA247: -4.0999999999999995e-003 | AB247: -8.8999999999999999e-003 | AC247: -3.39e-002 | AD247: -3.56e-002 | AE247: 88.5 | AF247: 91.23 | AG247: 0.7 | AH247: AA | AI247: 4.3400000000000001e-002 | AJ247: =H247+100*O247 -> 121.75 | AK247: 122.3 | AL247: 75 | AM247: 31.1 | AN247: 96 | AO247: 1.3999999999999999e-002 | AP247: 5 | AQ247: 旺能转债
A248: 173 | B248: 113577 | C248: 春秋转债! | D248: 603890 | E248: 春秋电子 | F248: 电子 | G248: 电子产品 | H248: 120.37 | I248: 1.5800000000000002e-002 | J248: -8.3000000000000001e-003 | K248: 12.43 | L248: 1.06e-002 | M248: 117.7 | N248: 11.06 | O248: 7.0999999999999994e-002 | P248: 112.39 | Q248: 转股中 | R248: 4.90年 | S248: 2.90年 | T248: 1.78 | U248: 10 | V248: 4.7e-002 | W248: 3.7000000000000005e-002 | X248: 4.0999999999999995e-002 | Y248: 48 | Z248: 2.57 | AA248: -4.6999999999999993e-003 | AB248: -1.09e-002 | AC248: -4.8099999999999997e-002 | AD248: -5.0199999999999995e-002 | AE248: 86.07 | AF248: 87.81 | AG248: 0.71 | AH248: AA- | AI248: 6.3e-002 | AJ248: =H248+100*O248 -> 127.47 | AK248: 128.4 | AL248: 132 | AM248: 40.5 | AN248: 185 | AO248: -5.9999999999999998e-002 | AP248: 14 | AQ248: 春秋转债!
A249: 296 | B249: 128051 | C249: 光华转债! | D249: 2741 | E249: 光华科技 | F249: 电子 | G249: 元器件制 | H249: 116.8 | I249: -9.7999999999999997e-003 | J249: 2.8999999999999998e-003 | K249: 14.72 | L249: -9.3999999999999986e-003 | M249: 114.8 | N249: 12.72 | O249: 9.0000000000000011e-003 | P249: 115.72 | Q249: 转股中 | R249: 3.56年 | S249: 1.57年 | T249: 2.47 | U249: 19 | V249: 6.6000000000000003e-002 | W249: 4.4999999999999998e-002 | X249: 5.2000000000000005e-002 | Y249: 55 | Z249: 4.45 | AA249: -4.8999999999999998e-003 | AB249: -1.23e-002 | AC249: -6.9800000000000001e-002 | AD249: -7.2999999999999995e-002 | AE249: 92.85 | AF249: 92.77 | AG249: 0.73 | AH249: AA- | AI249: 6.3e-002 | AJ249: =H249+100*O249 -> 117.7 | AK249: 117.9 | AL249: 34 | AM249: 25 | AN249: 37 | AO249: 4.0000000000000001e-002 | AP249: 26 | AQ249: 光华转债!
A250: 244 | B250: 128075 | C250: 远东转债! | D250: 2406 | E250: 远东传动 | F250: 汽车 | G250: 零部件制 | H250: 117.368 | I250: 4.8999999999999998e-003 | J250: 5.0000000000000001e-004 | K250: 6.15 | L250: 8.199999999999999e-003 | M250: 114.9 | N250: 5.54 | O250: 5.7000000000000002e-002 | P250: 111.01 | Q250: 转股中 | R250: 4.34年 | S250: 2.34年 | T250: 5.44 | U250: 1.2 | V250: 2.e-003 | W250: 0.14199999999999999 | X250: 0.157 | Y250: 38 | Z250: 1.16 | AA250: -5.0000000000000001e-003 | AB250: -1.11e-002 | AC250: -4.9699999999999994e-002 | AD250: -5.2199999999999996e-002 | AE250: 93.36 | AF250: 96.47 | AG250: 0.66 | AH250: AA | AI250: 4.2000000000000003e-002 | AJ250: =H250+100*O250 -> 123.068 | AK250: 123.7 | AL250: 84 | AM250: 27.3 | AN250: 52 | AO250: -2.7999999999999997e-002 | AP250: 15 | AQ250: 远东转债!
A251: 327 | B251: 128035 | C251: 大族转债! | D251: 2008 | E251: 大族激光 | F251: 机械装备 | G251: 专用设备 | H251: 109.02 | I251: -6.0000000000000001e-003 | J251: 5.8999999999999999e-003 | K251: 35.26 | L251: -1.6500000000000001e-002 | M251: 107.4 | N251: 51.9 | O251: 0.60499999999999998 | P251: 67.94 | Q251: 转股中 | R251: 2.72年 | S251: 0.72年 | T251: 23 | U251: 12 | V251: 5.0000000000000001e-003 | W251: 6.0999999999999999e-002 | X251: 4.2000000000000003e-002 | Y251: 376 | Z251: 3.91 | AA251: -5.6000000000000008e-003 | AB251: -1.0700000000000001e-002 | AC251: -5.4199999999999998e-002 | AD251: -6.2e-002 | AE251: 100.42 | AF251: 97.09 | AG251: 0.01 | AH251: AA+ | AI251: 3.8300000000000001e-002 | AJ251: =H251+100*O251 -> 169.51999999999998 | AK251: 150.1 | AL251: 296 | AM251: 49.7 | AN251: 249 | AO251: -7.8e-002 | AP251: 20 | AQ251: 大族转债!
A252: 71 | B252: 113609 | C252: 永安转债! | D252: 603776 | E252: 永安行 | F252: 城市公用 | G252: 其他 | H252: 124.23 | I252: 1.72e-002 | J252: -2.9999999999999997e-004 | K252: 26.28 | L252: 2.1000000000000001e-002 | M252: 120.5 | N252: 20.34 | O252: -3.7999999999999999e-002 | P252: 129.2 | Q252: 10天 | R252: 5.51年 | S252: 3.51年 | T252: 8.86 | U252: 284 | V252: 0.25800000000000001 | W252: 0.17999999999999999 | X252: 0.23199999999999998 | Y252: 49 | Z252: 1.57 | AA252: -5.6000000000000008e-003 | AB252: -1.1899999999999999e-002 | AC252: -4.8000000000000001e-002 | AD252: -4.9800000000000004e-002 | AE252: 82.73 | AF252: 86.03 | AG252: 0.81 | AH252: AA- | AI252: 6.4399999999999999e-002 | AJ252: =H252+100*O252 -> 120.43000000000001 | AK252: 119.3 | AL252: 44 | AM252: 33.2 | AN252: 115 | AO252: -1.7000000000000001e-002 | AP252: 19 | AQ252: 永安转债!
A253: 84 | B253: 113607 | C253: 伟20转债! | D253: 603568 | E253: 伟明环保 | F253: 城市公用 | G253: 三废处理 | H253: 118.81 | I253: -2.e-003 | J253: -4.5999999999999999e-003 | K253: 23.84 | L253: -1.e-002 | M253: 115.1 | N253: 22.01 | O253: 9.6999999999999989e-002 | P253: 108.31 | Q253: 转股中 | R253: 5.45年 | S253: 3.45年 | T253: 12 | U253: 6.5 | V253: 5.0000000000000001e-003 | W253: 4.0000000000000001e-002 | X253: 4.2999999999999997e-002 | Y253: 300 | Z253: 5.36 | AA253: -5.8999999999999999e-003 | AB253: -1.0800000000000001e-002 | AC253: -3.7400000000000003e-002 | AD253: -3.9199999999999999e-002 | AE253: 88.96 | AF253: 91.71 | AG253: 0.66 | AH253: AA | AI253: 4.3400000000000001e-002 | AJ253: =H253+100*O253 -> 128.50999999999999 | AK253: 129.3 | AL253: 143 | AM253: 37.6 | AN253: 160 | AO253: 3.3000000000000002e-002 | AP253: 6 | AQ253: 伟20转债!
A254: 79 | B254: 128137 | C254: 洁美转债 | D254: 2859 | E254: 洁美科技 | F254: 电子 | G254: 元器件制 | H254: 121.201 | I254: -2.5000000000000001e-003 | J254: -2.5000000000000001e-003 | K254: 27.63 | L254: -7.4999999999999997e-003 | M254: 117.3 | N254: 27.77 | O254: 0.218 | P254: 99.5 | Q254: 转股中 | R254: 5.46年 | S254: 3.46年 | T254: 6 | U254: 2.2 | V254: 3.0000000000000001e-003 | W254: 5.2999999999999999e-002 | X254: 5.2999999999999999e-002 | Y254: 114 | Z254: 6.16 | AA254: -6.0999999999999995e-003 | AB254: -1.1599999999999999e-002 | AC254: -4.2199999999999994e-002 | AD254: -4.41e-002 | AE254: 82.99 | AF254: 84.04 | AG254: 0.67 | AH254: AA- | AI254: 6.4399999999999999e-002 | AJ254: =H254+100*O254 -> 143.001 | AK254: 142.9 | AL254: 266 | AM254: 58.9 | AN254: 297 | AO254: -6.7000000000000004e-002 | AP254: 4 | AQ254: 洁美转债
A255: 282 | B255: 110053 | C255: 苏银转债! | D255: 600919 | E255: 江苏银行 | F255: 金融 | G255: 银行行业 | H255: 121.41 | I255: -4.0000000000000002e-004 | J255: -5.1999999999999998e-003 | K255: 7.38 | L255: -9.3999999999999986e-003 | M255: 118.3 | N255: 6.69 | O255: 0.10099999999999999 | P255: 110.31 | Q255: 转股中 | R255: 3.81年 | S255: 无权 | T255: 200 | U255: 380 | V255: 1.6e-002 | W255: 0.183 | X255: 0.20199999999999999 | Y255: 1090. | Z255: 0.78 | AA255: -6.9999999999999993e-003 | AB255: -1.5300000000000001e-002 | AC255: 无权 | AD255: 无权 | AE255: 无权 | AF255: 103.41 | AG255: 0.6 | AH255: AAA | AI255: 3.7000000000000005e-002 | AJ255: =H255+100*O255 -> 131.50999999999999 | AK255: 132.5 | AL255: 184 | AM255: 29.1 | AN255: 69 | AO255: 6.8000000000000005e-002 | AP255: 40 | AQ255: 苏银转债!
A256: 343 | B256: 123002 | C256: 国祯转债!! | D256: 300388 | E256: 节能国祯 | F256: 城市公用 | G256: 三废处理 | H256: 110.764 | I256: -4.1999999999999997e-003 | J256: 4.1999999999999997e-003 | K256: 8.22 | L256: -7.1999999999999998e-003 | M256: 108.8 | N256: 8.48 | O256: 0.14300000000000002 | P256: 96.93 | Q256: 转股中 | R256: 2.51年 | S256: 0.51年 | T256: 2.52 | U256: 1.1 | V256: 4.0000000000000001e-003 | W256: 4.4000000000000004e-002 | X256: 4.2999999999999997e-002 | Y256: 57 | Z256: 1.56 | AA256: -7.1999999999999998e-003 | AB256: -1.37e-002 | AC256: -0.128 | AD256: -0.13200000000000001 | AE256: 98.87 | AF256: 98.67 | AG256: 0 | AH256: AA | AI256: 4.0300000000000002e-002 | AJ256: =H256+100*O256 -> 125.06399999999999 | AK256: 124.6 | AL256: 90 | AM256: 25.7 | AN256: 42 | AO256: 3.9e-002 | AP256: 15 | AQ256: 国祯转债!!
A257: 12 | B257: 110079 | C257: 杭银转债 | D257: 600926 | E257: 杭州银行 | F257: 金融 | G257: 银行行业 | H257: 117.26 | I257: -1.1699999999999999e-002 | J257: -1.54e-002 | K257: 16.46 | L257: -4.7500000000000001e-002 | M257: 112.4 | N257: 17.06 | O257: 0.215 | P257: 96.48 | Q257: 4月20天 | R257: 5.85年 | S257: 3.86年 | T257: 150 | U257: 232 | V257: 1.3000000000000001e-002 | W257: 0.154 | X257: 0.14800000000000002 | Y257: 976 | Z257: 1.48 | AA257: -7.3000000000000001e-003 | AB257: -1.11e-002 | AC257: -3.2099999999999997e-002 | AD257: -3.3500000000000002e-002 | AE257: 88.51 | AF257: 90.44 | AG257: 0.57 | AH257: AAA | AI257: 3.8399999999999997e-002 | AJ257: =H257+100*O257 -> 138.75999999999999 | AK257: 138 | AL257: 234 | AM257: 47.6 | AN257: 236 | AO257: -1.e-002 | AP257: 11 | AQ257: 杭银转债
A258: 289 | B258: 110051 | C258: 中天转债! | D258: 600522 | E258: 中天科技 | F258: 通信互联 | G258: 通信设备 | H258: 116.5 | I258: -3.8e-003 | J258: 2.7000000000000001e-003 | K258: 9.97 | L258: -2.e-003 | M258: 113.3 | N258: 9.99 | O258: 0.16699999999999998 | P258: 99.8 | Q258: 转股中 | R258: 3.78年 | S258: 1.78年 | T258: 39.6 | U258: 19 | V258: 4.0000000000000001e-003 | W258: 0.13 | X258: 0.129 | Y258: 306 | Z258: 1.31 | AA258: -7.4999999999999997e-003 | AB258: -1.38e-002 | AC258: -6.2800000000000009e-002 | AD258: -6.54e-002 | AE258: 95.31 | AF258: 97.97 | AG258: 0.54 | AH258: AA+ | AI258: 4.0000000000000001e-002 | AJ258: =H258+100*O258 -> 133.19999999999999 | AK258: 133.2 | AL258: 195 | AM258: 35.2 | AN258: 138 | AO258: -2.7000000000000003e-002 | AP258: 24 | AQ258: 中天转债!
A259: 89 | B259: 113605 | C259: 大参转债 | D259: 603233 | E259: 大参林 | F259: 医药 | G259: 医药商业 | H259: 119.92 | I259: 3.4000000000000002e-003 | J259: -7.3000000000000001e-003 | K259: 71.01 | L259: -8.8999999999999999e-003 | M259: 115.2 | N259: 83.71 | O259: 0.41399999999999998 | P259: 84.83 | Q259: 转股中 | R259: 5.42年 | S259: 3.42年 | T259: 14.1 | U259: 11 | V259: 6.9999999999999993e-003 | W259: 2.9999999999999999e-002 | X259: 2.5000000000000001e-002 | Y259: 468 | Z259: 8.74 | AA259: -7.4999999999999997e-003 | AB259: -1.24e-002 | AC259: -4.0000000000000001e-002 | AD259: -4.1900000000000007e-002 | AE259: 89.17 | AF259: 91.92 | AG259: 0.44 | AH259: AA | AI259: 4.3400000000000001e-002 | AJ259: =H259+100*O259 -> 161.31999999999999 | AK259: 155 | AL259: 306 | AM259: 63.1 | AN259: 306 | AO259: -4.8000000000000001e-002 | AP259: 7 | AQ259: 大参转债
A260: 13 | B260: 113622 | C260: 杭叉转债 | D260: 603298 | E260: 杭叉集团 | F260: 机械装备 | G260: 通用设备 | H260: 117.52 | I260: 4.4000000000000003e-003 | J260: -1.2800000000000001e-002 | K260: 19.3 | L260: -1.83e-002 | M260: 112.5 | N260: 23.08 | O260: 0.40500000000000003 | P260: 83.62 | Q260: 4月20天 | R260: 5.84年 | S260: 3.84年 | T260: 11.5 | U260: 4.4 | V260: 3.0000000000000001e-003 | W260: 6.9000000000000006e-002 | X260: 5.7999999999999996e-002 | Y260: 167 | Z260: 3.26 | AA260: -7.4999999999999997e-003 | AB260: -1.1399999999999999e-002 | AC260: -3.2500000000000001e-002 | AD260: -3.39e-002 | AE260: 87.62 | AF260: 89.07 | AG260: 0.46 | AH260: AA+ | AI260: 4.1399999999999999e-002 | AJ260: =H260+100*O260 -> 158.01999999999998 | AK260: 151.4 | AL260: 299 | AM260: 62.4 | AN260: 304 | AO260: -6.4000000000000001e-002 | AP260: 3 | AQ260: 杭叉转债
A261: 108 | B261: 123064 | C261: 万孚转债! | D261: 300482 | E261: 万孚生物 | F261: 医药 | G261: 医疗器械 | H261: 120.243 | I261: -5.0000000000000001e-004 | J261: -1.8000000000000002e-002 | K261: 89.15 | L261: -3.39e-002 | M261: 115.1 | N261: 93.57 | O261: 0.26200000000000001 | P261: 95.28 | Q261: 转股中 | R261: 5.28年 | S261: 3.28年 | T261: 5.99 | U261: 4.1 | V261: 6.0000000000000001e-003 | W261: 2.e-002 | X261: 1.9e-002 | Y261: 305 | Z261: 10.51 | AA261: -8.3999999999999995e-003 | AB261: -1.34e-002 | AC261: -4.2599999999999999e-002 | AD261: -4.4500000000000005e-002 | AE261: 89.61 | AF261: 92.37 | AG261: 0.54 | AH261: AA | AI261: 4.3400000000000001e-002 | AJ261: =H261+100*O261 -> 146.44299999999998 | AK261: 145.2 | AL261: 276 | AM261: 52.8 | AN261: 270 | AO261: -6.3e-002 | AP261: 11 | AQ261: 万孚转债!
A262: 59 | B262: 123083 | C262: 朗新转债 | D262: 300682 | E262: 朗新科技 | F262: 计算机及 | G262: 软件开发 | H262: 120.54 | I262: 2.86e-002 | J262: -4.0999999999999995e-003 | K262: 17.25 | L262: 3.5400000000000001e-002 | M262: 115.1 | N262: 15.45 | O262: 8.0000000000000002e-002 | P262: 111.65 | Q262: 25天 | R262: 5.55年 | S262: 3.55年 | T262: 8 | U262: 116 | V262: 0.12 | W262: 4.4999999999999998e-002 | X262: 5.0999999999999997e-002 | Y262: 176 | Z262: 3.35 | AA262: -8.3999999999999995e-003 | AB262: -1.32e-002 | AC262: -4.0199999999999993e-002 | AD262: -4.1900000000000007e-002 | AE262: 88.58 | AF262: 91.31 | AG262: 0.69 | AH262: AA | AI262: 4.3400000000000001e-002 | AJ262: =H262+100*O262 -> 128.54000000000002 | AK262: 129.4 | AL262: 144 | AM262: 38.1 | AN262: 169 | AO262: 4.4000000000000004e-002 | AP262: 5 | AQ262: 朗新转债
A263: 143 | B263: 128119 | C263: 龙大转债! | D263: 2726 | E263: 龙大肉食 | F263: 食品饮料 | G263: 肉制品 | H263: 125.556 | I263: -5.6999999999999993e-003 | J263: -5.0000000000000001e-003 | K263: 11.38 | L263: -1.47e-002 | M263: 120.2 | N263: 9.38 | O263: 3.5000000000000003e-002 | P263: 121.32 | Q263: 转股中 | R263: 5年52天 | S263: 3年53天 | T263: 9.46 | U263: 13 | V263: 1.1000000000000001e-002 | W263: 8.3000000000000004e-002 | X263: 0.10099999999999999 | Y263: 114 | Z263: 3.27 | AA263: -8.6e-003 | AB263: -1.52e-002 | AC263: -5.6600000000000004e-002 | AD263: -5.8600000000000006e-002 | AE263: 90.22 | AF263: 97.02 | AG263: 0.72 | AH263: AA | AI263: 4.3400000000000001e-002 | AJ263: =H263+100*O263 -> 129.05600000000001 | AK263: 129.8 | AL263: 148 | AM263: 32.8 | AN263: 112 | AO263: -2.7000000000000003e-002 | AP263: 9 | AQ263: 龙大转债!
A264: 260 | B264: 113536 | C264: 三星转债 | D264: 603578 | E264: 三星新材 | F264: 家电 | G264: 零部件制 | H264: 119 | I264: -9.1000000000000004e-003 | J264: 5.9999999999999995e-004 | K264: 21.69 | L264: -1.32e-002 | M264: 114.8 | N264: 19.54 | O264: 7.2000000000000008e-002 | P264: 111 | Q264: 转股中 | R264: 4年9天 | S264: 2年10天 | T264: 1.49 | U264: 13 | V264: 7.4999999999999997e-002 | W264: 7.4999999999999997e-002 | X264: 8.3000000000000004e-002 | Y264: 20 | Z264: 2.67 | AA264: -9.1000000000000004e-003 | AB264: -1.5600000000000001e-002 | AC264: -6.3099999999999989e-002 | AD264: -6.5700000000000008e-002 | AE264: 94.48 | AF264: 97.63 | AG264: 0.64 | AH264: AA | AI264: 4.2000000000000003e-002 | AJ264: =H264+100*O264 -> 126.2 | AK264: 127 | AL264: 115 | AM264: 29.4 | AN264: 74 | AO264: 4.0999999999999995e-002 | AP264: 36 | AQ264: 三星转债
A265: 223 | B265: 110063 | C265: 鹰19转债 | D265: 600567 | E265: 山鹰国际 | F265: 造纸包装 | G265: 包装用纸 | H265: 120.85 | I265: 1.9699999999999999e-002 | J265: -3.2000000000000002e-003 | K265: 3.79 | L265: 2.4300000000000002e-002 | M265: 115.9 | N265: 3.3 | O265: 5.2000000000000005e-002 | P265: 114.85 | Q265: 转股中 | R265: 4.56年 | S265: 2.56年 | T265: 18.5 | U265: 50 | V265: 2.2000000000000002e-002 | W265: 0.105 | X265: 0.121 | Y265: 175 | Z265: 1.12 | AA265: -9.300000000000001e-003 | AB265: -1.54e-002 | AC265: -5.6500000000000002e-002 | AD265: -5.8600000000000006e-002 | AE265: 92.83 | AF265: 97.24 | AG265: 0.68 | AH265: AA+ | AI265: 4.0000000000000001e-002 | AJ265: =H265+100*O265 -> 126.05 | AK265: 126.9 | AL265: 112 | AM265: 29.6 | AN265: 78 | AO265: 4.2000000000000003e-002 | AP265: 37 | AQ265: 鹰19转债
A266: 104 | B266: 123066 | C266: 赛意转债 | D266: 300687 | E266: 赛意信息 | F266: 计算机及 | G266: 软件开发 | H266: 127.56 | I266: -1.1000000000000001e-003 | J266: -5.7999999999999996e-003 | K266: 27.88 | L266: -8.8999999999999999e-003 | M266: 121.4 | N266: 22.58 | O266: 3.3000000000000002e-002 | P266: 123.47 | Q266: 转股中 | R266: 5.32年 | S266: 3.32年 | T266: 2.93 | U266: 4.7 | V266: 1.3000000000000001e-002 | W266: 4.8000000000000001e-002 | X266: 5.9999999999999998e-002 | Y266: 61 | Z266: 6.16 | AA266: -9.4999999999999998e-003 | AB266: -1.6200000000000003e-002 | AC266: -5.6600000000000004e-002 | AD266: -5.8700000000000002e-002 | AE266: 81.19 | AF266: 83.21 | AG266: 0.77 | AH266: A+ | AI266: 7.5399999999999995e-002 | AJ266: =H266+100*O266 -> 130.86000000000001 | AK266: 131.6 | AL266: 173 | AM266: 48.4 | AN266: 241 | AO266: -1.3000000000000001e-002 | AP266: 7 | AQ266: 赛意转债
A267: 213 | B267: 128091 | C267: 新天转债 | D267: 2873 | E267: 新天药业 | F267: 医药 | G267: 中药 | H267: 124.99 | I267: -1.2e-002 | J267: 8.8000000000000005e-003 | K267: 17.67 | L267: -4.5000000000000005e-003 | M267: 119.4 | N267: 16.39 | O267: 0.159 | P267: 107.81 | Q267: 转股中 | R267: 4.61年 | S267: 2.61年 | T267: 1.76 | U267: 113 | V267: 0.51100000000000001 | W267: 8.5000000000000006e-002 | X267: 9.1999999999999998e-002 | Y267: 21 | Z267: 2.54 | AA267: -1.01e-002 | AB267: -1.7299999999999999e-002 | AC267: -6.3200000000000006e-002 | AD267: -6.6000000000000003e-002 | AE267: 85.92 | AF267: 86.67 | AG267: 0.71 | AH267: A+ | AI267: 7.400000000000001e-002 | AJ267: =H267+100*O267 -> 140.88999999999999 | AK267: 142.2 | AL267: 260 | AM267: 55.5 | AN267: 282 | AO267: -1.e-003 | AP267: 18 | AQ267: 新天转债
A268: 31 | B268: 123098 | C268: 一品转债 | D268: 300723 | E268: 一品红 | F268: 医药 | G268: 医药行业 | H268: 131.48 | I268: -1.7000000000000001e-003 | J268: -2.7000000000000001e-003 | K268: 27.9 | L268: -6.4000000000000003e-003 | M268: 124 | N268: 25.52 | O268: 0.20300000000000001 | P268: 109.33 | Q268: 2月14天 | R268: 5.69年 | S268: 3.69年 | T268: 4.8 | U268: 4.5 | V268: 6.9999999999999993e-003 | W268: 5.9999999999999998e-002 | X268: 6.6000000000000003e-002 | Y268: 80 | Z268: 2.89 | AA268: -1.04e-002 | AB268: -1.7299999999999999e-002 | AC268: -5.9699999999999996e-002 | AD268: -6.1399999999999996e-002 | AE268: 81.88 | AF268: 87.55 | AG268: 0.69 | AH268: AA- | AI268: 6.4399999999999999e-002 | AJ268: =H268+100*O268 -> 151.78 | AK268: 153.6 | AL268: 303 | AM268: 66.1 | AN268: 312 | AO268: -0.218 | AP268: 3 | AQ268: 一品转债
A269: 273 | B269: 110057 | C269: 现代转债 | D269: 600420 | E269: 国药现代 | F269: 医药 | G269: 化学制药 | H269: 114.82 | I269: -3.0000000000000001e-003 | J269: 2.3e-003 | K269: 10.97 | L269: -8.9999999999999998e-004 | M269: 110.3 | N269: 9.89 | O269: 3.5000000000000003e-002 | P269: 110.92 | Q269: 转股中 | R269: 3.86年 | S269: 1.86年 | T269: 16.2 | U269: 25 | V269: 1.3999999999999999e-002 | W269: 0.14300000000000002 | X269: 0.159 | Y269: 113 | Z269: 1.39 | AA269: -1.0500000000000001e-002 | AB269: -1.54e-002 | AC269: -5.3399999999999996e-002 | AD269: -5.5899999999999998e-002 | AE269: 95.54 | AF269: 96.11 | AG269: 0.69 | AH269: AAA | AI269: 3.7000000000000005e-002 | AJ269: =H269+100*O269 -> 118.31999999999999 | AK269: 118.7 | AL269: 38 | AM269: 22.6 | AN269: 23 | AO269: 4.2999999999999997e-002 | AP269: 24 | AQ269: 现代转债
A270: 234 | B270: 113548 | C270: 石英转债! | D270: 603688 | E270: 石英股份 | F270: 电子 | G270: 电子产品 | H270: 130.89 | I270: -4.5999999999999999e-003 | J270: -6.4000000000000003e-003 | K270: 16.88 | L270: -1.6899999999999998e-002 | M270: 124.4 | N270: 15.1 | O270: 0.17100000000000001 | P270: 111.79 | Q270: 转股中 | R270: 4.44年 | S270: 2.44年 | T270: 1.23 | U270: 11 | V270: 6.6000000000000003e-002 | W270: 2.1000000000000001e-002 | X270: 2.3e-002 | Y270: 60 | Z270: 3.02 | AA270: -1.1699999999999999e-002 | AB270: -2.07e-002 | AC270: -8.43e-002 | AD270: -8.7100000000000011e-002 | AE270: 89.15 | AF270: 95.5 | AG270: 0.65 | AH270: AA- | AI270: 6.3e-002 | AJ270: =H270+100*O270 -> 147.98999999999998 | AK270: 150 | AL270: 294 | AM270: 54.5 | AN270: 279 | AO270: -5.7000000000000002e-002 | AP270: 13 | AQ270: 石英转债!
A271: 168 | B271: 113579 | C271: 健友转债! | D271: 603707 | E271: 健友股份 | F271: 医药 | G271: 原料药 | H271: 121.28 | I271: -1.38e-002 | J271: 2.63e-002 | K271: 43.22 | L271: 2.0299999999999999e-002 | M271: 113.9 | N271: 42.05 | O271: 0.17999999999999999 | P271: 102.78 | Q271: 转股中 | R271: 4.92年 | S271: 2.92年 | T271: 5.03 | U271: 17 | V271: 2.8999999999999998e-002 | W271: 1.2e-002 | X271: 1.3000000000000001e-002 | Y271: 404 | Z271: 10.5 | AA271: -1.29e-002 | AB271: -1.7899999999999999e-002 | AC271: -5.0700000000000002e-002 | AD271: -5.2600000000000001e-002 | AE271: 91.15 | AF271: 93.38 | AG271: 0.61 | AH271: AA | AI271: 4.2000000000000003e-002 | AJ271: =H271+100*O271 -> 139.28 | AK271: 139.8 | AL271: 243 | AM271: 46.4 | AN271: 231 | AO271: 1.7000000000000001e-002 | AP271: 9 | AQ271: 健友转债!
A272: 48 | B272: 128142 | C272: 新乳转债 | D272: 2946 | E272: 新乳业 | F272: 食品饮料 | G272: 乳制品 | H272: 123.946 | I272: 1.47e-002 | J272: -9.4999999999999998e-003 | K272: 18.31 | L272: 8.8000000000000005e-003 | M272: 115.1 | N272: 18.54 | O272: 0.255 | P272: 98.76 | Q272: 34天 | R272: 5.58年 | S272: 3.58年 | T272: 7.18 | U272: 19 | V272: 2.1000000000000001e-002 | W272: 4.4999999999999998e-002 | X272: 4.4999999999999998e-002 | Y272: 159 | Z272: 6.11 | AA272: -1.34e-002 | AB272: -1.8100000000000002e-002 | AC272: -4.7100000000000003e-002 | AD272: -4.8799999999999996e-002 | AE272: 88.49 | AF272: 91.22 | AG272: 0.59 | AH272: AA | AI272: 4.3400000000000001e-002 | AJ272: =H272+100*O272 -> 149.446 | AK272: 149.1 | AL272: 291 | AM272: 57.9 | AN272: 295 | AO272: 4.2000000000000003e-002 | AP272: 4 | AQ272: 新乳转债
A273: 36 | B273: 123094 | C273: 星源转2! | D273: 300568 | E273: 星源材质 | F273: 电子 | G273: 电子行业 | H273: 126.9 | I273: 4.7999999999999996e-003 | J273: 6.3e-003 | K273: 37.35 | L273: 1.52e-002 | M273: 117.3 | N273: 31.53 | O273: 7.0999999999999994e-002 | P273: 118.46 | Q273: 2月6天 | R273: 5.67年 | S273: 3.67年 | T273: 10 | U273: 133 | V273: 0.10400000000000001 | W273: 5.9999999999999998e-002 | X273: 7.0999999999999994e-002 | Y273: 168 | Z273: 5.54 | AA273: -1.3999999999999999e-002 | AB273: -1.9299999999999998e-002 | AC273: -5.1500000000000004e-002 | AD273: -5.3200000000000004e-002 | AE273: 88.34 | AF273: 92.63 | AG273: 0.73 | AH273: AA | AI273: 4.3400000000000001e-002 | AJ273: =H273+100*O273 -> 134. | AK273: 135.3 | AL273: 219 | AM273: 42.7 | AN273: 209 | AO273: 0.222 | AP273: 3 | AQ273: 星源转2!
A274: 259 | B274: 113537 | C274: 文灿转债!! | D274: 603348 | E274: 文灿股份 | F274: 汽车 | G274: 零部件制 | H274: 128.76 | I274: 3.7000000000000002e-003 | J274: 8.199999999999999e-003 | K274: 23.3 | L274: 1.66e-002 | M274: 121.5 | N274: 19.43 | O274: 7.400000000000001e-002 | P274: 119.92 | Q274: 转股中 | R274: 4年19天 | S274: 2年20天 | T274: 1.44 | U274: 34 | V274: 0.184 | W274: 2.4e-002 | X274: 2.8999999999999998e-002 | Y274: 60 | Z274: 2.35 | AA274: -1.46e-002 | AB274: -2.3399999999999997e-002 | AC274: -9.1199999999999989e-002 | AD274: -9.4499999999999987e-002 | AE274: 91.36 | AF274: 95.53 | AG274: 0.71 | AH274: AA- | AI274: 6.3e-002 | AJ274: =H274+100*O274 -> 136.16 | AK274: 137.6 | AL274: 232 | AM274: 42.1 | AN274: 200 | AO274: -9.1999999999999998e-002 | AP274: 24 | AQ274: 文灿转债!!
A275: 297 | B275: 128050 | C275: 钧达转债!! | D275: 2865 | E275: 钧达股份 | F275: 汽车 | G275: 零部件制 | H275: 129.306 | I275: 4.6999999999999993e-003 | J275: 2.7000000000000001e-003 | K275: 18.92 | L275: 7.4999999999999997e-003 | M275: 122.7 | N275: 14.85 | O275: 1.4999999999999999e-002 | P275: 127.41 | Q275: 转股中 | R275: 3.55年 | S275: 1.56年 | T275: 1.41 | U275: 12 | V275: 6.8000000000000005e-002 | W275: 5.5999999999999994e-002 | X275: 7.2000000000000008e-002 | Y275: 25 | Z275: 2.34 | AA275: -1.49e-002 | AB275: -2.5399999999999999e-002 | AC275: -0.10800000000000001 | AD275: -0.11 | AE275: 92.83 | AF275: 99.19 | AG275: 1 | AH275: AA- | AI275: 6.3e-002 | AJ275: =H275+100*O275 -> 130.80600000000001 | AK275: 131.2 | AL275: 161 | AM275: 32 | AN275: 107 | AO275: -9.0000000000000011e-003 | AP275: 52 | AQ275: 钧达转债!!
A276: 45 | B276: 123091 | C276: 长海转债 | D276: 300196 | E276: 长海股份 | F276: 其他 | G276: 非金属矿 | H276: 126.218 | I276: -8.6e-003 | J276: -5.3e-003 | K276: 17.77 | L276: -2.0400000000000001e-002 | M276: 116.2 | N276: 16.14 | O276: 0.14599999999999999 | P276: 110.1 | Q276: 39天 | R276: 5.59年 | S276: 3.59年 | T276: 5.5 | U276: 8.6 | V276: 1.2e-002 | W276: 7.5999999999999998e-002 | X276: 8.3000000000000004e-002 | Y276: 73 | Z276: 2.45 | AA276: -1.49e-002 | AB276: -1.9900000000000001e-002 | AC276: -5.1299999999999998e-002 | AD276: -5.3099999999999994e-002 | AE276: 88.53 | AF276: 92.05 | AG276: 0.68 | AH276: AA | AI276: 4.3400000000000001e-002 | AJ276: =H276+100*O276 -> 140.81800000000001 | AK276: 142.3 | AL276: 261 | AM276: 50.3 | AN276: 255 | AO276: 3.6000000000000004e-002 | AP276: 3 | AQ276: 长海转债
A277: 166 | B277: 128108 | C277: 蓝帆转债! | D277: 2382 | E277: 蓝帆医疗 | F277: 医药 | G277: 医疗器械 | H277: 122.198 | I277: -7.7000000000000002e-003 | J277: -9.7999999999999997e-003 | K277: 21 | L277: -2.3700000000000002e-002 | M277: 113.3 | N277: 17.79 | O277: 3.5000000000000003e-002 | P277: 118.04 | Q277: 转股中 | R277: 5年6.1天 | S277: 4年7天 | T277: 15.3 | U277: 56 | V277: 2.9999999999999999e-002 | W277: 7.0000000000000007e-002 | X277: 8.199999999999999e-002 | Y277: 220 | Z277: 1.77 | AA277: -1.5300000000000001e-002 | AB277: -1.9900000000000001e-002 | AC277: -3.4700000000000002e-002 | AD277: -3.7100000000000001e-002 | AE277: 88.71 | AF277: 91.99 | AG277: 0.74 | AH277: AA | AI277: 4.3400000000000001e-002 | AJ277: =H277+100*O277 -> 125.69799999999999 | AK277: 126.4 | AL277: 104 | AM277: 34.4 | AN277: 128 | AO277: -5.0000000000000003e-002 | AP277: 26 | AQ277: 蓝帆转债!
A278: 206 | B278: 128096 | C278: 奥瑞转债!! | D278: 2701 | E278: 奥瑞金 | F278: 造纸包装 | G278: 包装材料 | H278: 124.302 | I278: -1.43e-002 | J278: -5.5000000000000005e-003 | K278: 5.51 | L278: -2.6499999999999999e-002 | M278: 115.5 | N278: 4.54 | O278: 2.4e-002 | P278: 121.37 | Q278: 转股中 | R278: 4.73年 | S278: 2.73年 | T278: 6.79 | U278: 210 | V278: 0.25 | W278: 5.0999999999999997e-002 | X278: 6.2e-002 | Y278: 133 | Z278: 1.98 | AA278: -1.5700000000000002e-002 | AB278: -2.1400000000000002e-002 | AC278: -6.08e-002 | AD278: -6.3099999999999989e-002 | AE278: 92.8 | AF278: 96.35 | AG278: 0.75 | AH278: AA+ | AI278: 4.0000000000000001e-002 | AJ278: =H278+100*O278 -> 126.70200000000001 | AK278: 127.2 | AL278: 118 | AM278: 30.9 | AN278: 89 | AO278: -9.0000000000000011e-003 | AP278: 19 | AQ278: 奥瑞转债!!
A279: 360 | B279: 110033 | C279: 国贸转债! | D279: 600755 | E279: 厦门国贸 | F279: 交通运输 | G279: 交通运输 | H279: 109.16 | I279: -5.0000000000000001e-004 | J279: 1.5e-003 | K279: 6.99 | L279: 4.3e-003 | M279: 108 | N279: 7.18 | O279: 0.121 | P279: 97.35 | Q279: 转股中 | R279: 0.63年 | S279: 回售内 | T279: 12.1 | U279: 5.6 | V279: 4.0000000000000001e-003 | W279: 8.900000000000001e-002 | X279: 8.6999999999999994e-002 | Y279: 136 | Z279: 0.84 | AA279: -1.6899999999999998e-002 | AB279: -4.0000000000000001e-002 | AC279: 回售内 | AD279: 回售内 | AE279: 100.33 | AF279: 105.92 | AG279: 0.23 | AH279: AAA | AI279: 3.15e-002 | AJ279: =H279+100*O279 -> 121.25999999999999 | AK279: 121 | AL279: 60 | AM279: 15 | AN279: 4 | AO279: 4.0000000000000001e-003 | AP279: 18 | AQ279: 国贸转债!
A280: 253 | B280: 113541 | C280: 荣晟转债! | D280: 603165 | E280: 荣晟环保 | F280: 造纸包装 | G280: 包装用纸 | H280: 123.31 | I280: 1.5600000000000001e-002 | J280: -6.1999999999999998e-003 | K280: 13.37 | L280: 1.21e-002 | M280: 115 | N280: 10.84 | O280: 0. | P280: 123.34 | Q280: 转股中 | R280: 4.17年 | S280: 2.17年 | T280: 2.37 | U280: 163 | V280: 0.54799999999999993 | W280: 6.9000000000000006e-002 | X280: 8.5000000000000006e-002 | Y280: 34 | Z280: 2 | AA280: -1.6899999999999998e-002 | AB280: -2.3199999999999998e-002 | AC280: -7.2900000000000006e-002 | AD280: -7.5499999999999998e-002 | AE280: 89.88 | AF280: 89.67 | AG280: 0.77 | AH280: AA- | AI280: 6.3e-002 | AJ280: =H280+100*O280 -> 123.31 | AK280: 123.3 | AL280: 80 | AM280: 33.4 | AN280: 120 | AO280: -5.0000000000000001e-003 | AP280: 43 | AQ280: 荣晟转债!
A281: 310 | B281: 123012 | C281: 万顺转债! | D281: 300057 | E281: 万顺新材 | F281: 有色金属 | G281: 铝金属 | H281: 116.502 | I281: -2.8999999999999998e-003 | J281: 3.9000000000000003e-003 | K281: 4.59 | L281: 2.2000000000000001e-003 | M281: 110.3 | N281: 5.27 | O281: 0.33799999999999997 | P281: 87.1 | Q281: 转股中 | R281: 3年59天 | S281: 1.16年 | T281: 1.29 | U281: 18 | V281: 0.11900000000000001 | W281: 4.2000000000000003e-002 | X281: 3.6000000000000004e-002 | Y281: 31 | Z281: 0.87 | AA281: -1.7500000000000002e-002 | AB281: -2.3399999999999997e-002 | AC281: -9.06e-002 | AD281: -9.4200000000000006e-002 | AE281: 94.85 | AF281: 91.33 | AG281: 0.44 | AH281: AA- | AI281: 6.3e-002 | AJ281: =H281+100*O281 -> 150.30199999999999 | AK281: 145.9 | AL281: 279 | AM281: 51.1 | AN281: 259 | AO281: -1.2e-002 | AP281: 19 | AQ281: 万顺转债!
A282: 359 | B282: 110034 | C282: 九州转债! | D282: 600998 | E282: 九州通 | F282: 医药 | G282: 医药商业 | H282: 109.29 | I282: 0. | J282: -1.1999999999999999e-003 | K282: 16.87 | L282: -1.e-002 | M282: 108 | N282: 18.32 | O282: 0.187 | P282: 92.09 | Q282: 转股中 | R282: 0.66年 | S282: 回售内 | T282: 15 | U282: 10 | V282: 6.0000000000000001e-003 | W282: 4.7e-002 | X282: 4.4000000000000004e-002 | Y282: 316 | Z282: 1.57 | AA282: -1.8000000000000002e-002 | AB282: -4.0099999999999997e-002 | AC282: 回售内 | AD282: 回售内 | AE282: 103 | AF282: 105.63 | AG282: 0.12 | AH282: AA+ | AI282: 3.4500000000000003e-002 | AJ282: =H282+100*O282 -> 127.99000000000001 | AK282: 126.5 | AL282: 105 | AM282: 20.9 | AN282: 17 | AO282: -8.0000000000000002e-003 | AP282: 25 | AQ282: 九州转债!
A283: 211 | B283: 128093 | C283: 百川转债! | D283: 2455 | E283: 百川股份 | F283: 化工 | G283: 化工 | H283: 141 | I283: 0.14800000000000002 | J283: -7.1599999999999997e-002 | K283: 8 | L283: 0.10000000000000001 | M283: 129.8 | N283: 5.87 | O283: 3.5000000000000003e-002 | P283: 136.29 | Q283: 转股中 | R283: 4.62年 | S283: 2.62年 | T283: 4 | U283: 4806. | V283: 8.7699999999999996 | W283: 9.6000000000000002e-002 | X283: 0.13100000000000001 | Y283: 42 | Z283: 3.05 | AA283: -1.83e-002 | AB283: -2.8500000000000001e-002 | AC283: -9.6000000000000002e-002 | AD283: -0.10000000000000001 | AE283: 90.42 | AF283: 98.87 | AG283: 0.76 | AH283: AA- | AI283: 6.3e-002 | AJ283: =H283+100*O283 -> 144.5 | AK283: 145.7 | AL283: 277 | AM283: 46.8 | AN283: 232 | AO283: 0.155 | AP283: 50 | AQ283: 百川转债!
A284: 159 | B284: 113585 | C284: 寿仙转债! | D284: 603896 | E284: 寿仙谷 | F284: 医药 | G284: 中药 | H284: 129.05 | I284: -8.1000000000000013e-003 | J284: 1.7000000000000001e-003 | K284: 36.8 | L284: -7.8000000000000005e-003 | M284: 117.8 | N284: 28.68 | O284: 6.0000000000000001e-003 | P284: 128.31 | Q284: 转股中 | R284: 5年18天 | S284: 3年19天 | T284: 1.64 | U284: 27 | V284: 0.124 | W284: 2.9999999999999999e-002 | X284: 3.7999999999999999e-002 | Y284: 55 | Z284: 3.99 | AA284: -1.83e-002 | AB284: -2.4300000000000002e-002 | AC284: -6.5199999999999994e-002 | AD284: -6.7400000000000002e-002 | AE284: 85.43 | AF284: 86.63 | AG284: 0.81 | AH284: AA- | AI284: 6.4399999999999999e-002 | AJ284: =H284+100*O284 -> 129.65000000000001 | AK284: 129.8 | AL284: 147 | AM284: 43.2 | AN284: 216 | AO284: -1.8000000000000002e-002 | AP284: 9 | AQ284: 寿仙转债!
A285: 50 | B285: 113614 | C285: 健20转债! | D285: 603707 | E285: 健友股份 | F285: 医药 | G285: 原料药 | H285: 126.83 | I285: 1.9e-003 | J285: 1.2800000000000001e-002 | K285: 43.22 | L285: 2.0299999999999999e-002 | M285: 114.2 | N285: 38.04 | O285: 0.11599999999999999 | P285: 113.62 | Q285: 33天 | R285: 5.57年 | S285: 3.58年 | T285: 7.8 | U285: 8 | V285: 8.0000000000000002e-003 | W285: 1.9e-002 | X285: 2.2000000000000002e-002 | Y285: 404 | Z285: 10.5 | AA285: -1.9e-002 | AB285: -2.3399999999999997e-002 | AC285: -5.28e-002 | AD285: -5.45e-002 | AE285: 88.59 | AF285: 90.53 | AG285: 0.73 | AH285: AA | AI285: 4.3400000000000001e-002 | AJ285: =H285+100*O285 -> 138.43000000000001 | AK285: 140 | AL285: 248 | AM285: 49.5 | AN285: 248 | AO285: 1.7000000000000001e-002 | AP285: 3 | AQ285: 健20转债!
A286: 274 | B286: 123025 | C286: 精测转债!! | D286: 300567 | E286: 精测电子 | F286: 电子 | G286: 液晶显示 | H286: 125.484 | I286: 8.0000000000000004e-004 | J286: -1.21e-002 | K286: 51.07 | L286: -1.8500000000000003e-002 | M286: 116.5 | N286: 49.67 | O286: 0.22 | P286: 102.82 | Q286: 转股中 | R286: 3.85年 | S286: 1.86年 | T286: 3.09 | U286: 2.2 | V286: 6.0000000000000001e-003 | W286: 2.2000000000000002e-002 | X286: 2.2000000000000002e-002 | Y286: 142 | Z286: 7.15 | AA286: -1.9400000000000001e-002 | AB286: -2.6699999999999998e-002 | AC286: -9.4399999999999998e-002 | AD286: -9.6699999999999994e-002 | AE286: 90.97 | AF286: 92.47 | AG286: 0.61 | AH286: AA- | AI286: 6.3e-002 | AJ286: =H286+100*O286 -> 147.48399999999998 | AK286: 148.1 | AL286: 289 | AM286: 55.7 | AN286: 285 | AO286: -8.3000000000000004e-002 | AP286: 17 | AQ286: 精测转债!!
A287: 100 | B287: 128134 | C287: 鸿路转债! | D287: 2541 | E287: 鸿路钢构 | F287: 建筑 | G287: 其他 | H287: 127.9 | I287: 1.18e-002 | J287: 7.4000000000000003e-003 | K287: 53.25 | L287: 2.5000000000000001e-002 | M287: 115.1 | N287: 43.74 | O287: 5.0999999999999997e-002 | P287: 121.74 | Q287: 转股中 | R287: 5.38年 | S287: 3.39年 | T287: 18.8 | U287: 48 | V287: 2.e-002 | W287: 6.7000000000000004e-002 | X287: 8.199999999999999e-002 | Y287: 279 | Z287: 4.8 | AA287: -1.9699999999999999e-002 | AB287: -2.46e-002 | AC287: -5.7999999999999996e-002 | AD287: -5.9800000000000006e-002 | AE287: 89.21 | AF287: 91.96 | AG287: 0.77 | AH287: AA | AI287: 4.3400000000000001e-002 | AJ287: =H287+100*O287 -> 133. | AK287: 134.1 | AL287: 204 | AM287: 42.1 | AN287: 201 | AO287: 2.1000000000000001e-002 | AP287: 4 | AQ287: 鸿路转债!
A288: 188 | B288: 123047 | C288: 久吾转债 | D288: 300631 | E288: 久吾高科 | F288: 机械装备 | G288: 专用设备 | H288: 142.88 | I288: -4.5400000000000003e-002 | J288: 3.8199999999999998e-002 | K288: 21.48 | L288: -1.01e-002 | M288: 129.6 | N288: 17.61 | O288: 0.17100000000000001 | P288: 121.98 | Q288: 转股中 | R288: 4.83年 | S288: 2.83年 | T288: 1.99 | U288: 2149. | V288: 7.3200000000000003 | W288: 8.5000000000000006e-002 | X288: 0.10400000000000001 | Y288: 23 | Z288: 2.82 | AA288: -2.0499999999999997e-002 | AB288: -3.0099999999999998e-002 | AC288: -9.6799999999999997e-002 | AD288: -9.9900000000000003e-002 | AE288: 85.47 | AF288: 92.71 | AG288: 0.71 | AH288: A+ | AI288: 7.400000000000001e-002 | AJ288: =H288+100*O288 -> 159.97999999999999 | AK288: 163.8 | AL288: 319 | AM288: 71.1 | AN288: 320 | AO288: 0.154 | AP288: 23 | AQ288: 久吾转债
A289: 44 | B289: 113615 | C289: 金诚转债 | D289: 603979 | E289: 金诚信 | F289: 有色金属 | G289: 有色行业 | H289: 132.53 | I289: 5.4000000000000003e-003 | J289: 1.5e-003 | K289: 16.38 | L289: 8.6e-003 | M289: 117.3 | N289: 12.73 | O289: 2.9999999999999999e-002 | P289: 128.67 | Q289: 39天 | R289: 5.59年 | S289: 3.59年 | T289: 10 | U289: 17 | V289: 1.3000000000000001e-002 | W289: 0.105 | X289: 0.13500000000000001 | Y289: 96 | Z289: 2.06 | AA289: -2.2000000000000002e-002 | AB289: -2.7200000000000002e-002 | AC289: -6.3500000000000001e-002 | AD289: -6.5199999999999994e-002 | AE289: 88.63 | AF289: 92.93 | AG289: 0.79 | AH289: AA | AI289: 4.3400000000000001e-002 | AJ289: =H289+100*O289 -> 135.53 | AK289: 136.4 | AL289: 225 | AM289: 43.5 | AN289: 218 | AO289: 4.4000000000000004e-002 | AP289: 3 | AQ289: 金诚转债
A290: 116 | B290: 110074 | C290: 精达转债! | D290: 600577 | E290: 精达股份 | F290: 电子 | G290: 电子产品 | H290: 131.6 | I290: 3.1699999999999999e-002 | J290: 5.6999999999999993e-003 | K290: 4.88 | L290: 4.7199999999999999e-002 | M290: 117.3 | N290: 3.73 | O290: 6.0000000000000001e-003 | P290: 130.83 | Q290: 转股中 | R290: 5.24年 | S290: 3.25年 | T290: 7.87 | U290: 539 | V290: 0.51800000000000002 | W290: 8.4000000000000005e-002 | X290: 0.11 | Y290: 94 | Z290: 2.47 | AA290: -2.2099999999999998e-002 | AB290: -2.7699999999999999e-002 | AC290: -6.7799999999999999e-002 | AD290: -6.9699999999999998e-002 | AE290: 89.94 | AF290: 94.31 | AG290: 0.79 | AH290: AA | AI290: 4.3400000000000001e-002 | AJ290: =H290+100*O290 -> 132.19999999999999 | AK290: 132.4 | AL290: 179 | AM290: 38.1 | AN290: 167 | AO290: 0.22800000000000001 | AP290: 12 | AQ290: 精达转债!
A291: 114 | B291: 128128 | C291: 齐翔转2 | D291: 2408 | E291: 齐翔腾达 | F291: 化工 | G291: 化工 | H291: 130.95 | I291: 2.0099999999999996e-002 | J291: -2.9999999999999997e-004 | K291: 10.79 | L291: 2.4700000000000003e-002 | M291: 115.3 | N291: 8.22 | O291: -2.e-003 | P291: 131.27 | Q291: 转股中 | R291: 5.25年 | S291: 3.25年 | T291: 11.5 | U291: 141 | V291: 9.3000000000000013e-002 | W291: 5.5e-002 | X291: 7.2999999999999995e-002 | Y291: 208 | Z291: 1.98 | AA291: -2.4399999999999998e-002 | AB291: -2.9399999999999999e-002 | AC291: -6.6500000000000004e-002 | AD291: -6.8400000000000002e-002 | AE291: 89.84 | AF291: 92.68 | AG291: 0.8 | AH291: AA | AI291: 4.3400000000000001e-002 | AJ291: =H291+100*O291 -> 130.75 | AK291: 130.6 | AL291: 157 | AM291: 38 | AN291: 165 | AO291: 6.4000000000000001e-002 | AP291: 38 | AQ291: 齐翔转2
A292: 219 | B292: 113559 | C292: 永创转债! | D292: 603901 | E292: 永创智能 | F292: 机械装备 | G292: 专用设备 | H292: 132.34 | I292: 1.29e-002 | J292: 1.5e-003 | K292: 13.6 | L292: 1.8000000000000002e-002 | M292: 118.3 | N292: 10.32 | O292: 4.0000000000000001e-003 | P292: 131.78 | Q292: 转股中 | R292: 4.59年 | S292: 2.59年 | T292: 4.19 | U292: 46 | V292: 8.3000000000000004e-002 | W292: 7.0000000000000007e-002 | X292: 9.1999999999999998e-002 | Y292: 60 | Z292: 4.1 | AA292: -2.4700000000000003e-002 | AB292: -3.1400000000000004e-002 | AC292: -8.3400000000000002e-002 | AD292: -8.5999999999999993e-002 | AE292: 88.39 | AF292: 90.03 | AG292: 0.81 | AH292: AA- | AI292: 6.3e-002 | AJ292: =H292+100*O292 -> 132.74000000000001 | AK292: 132.9 | AL292: 190 | AM292: 42.9 | AN292: 211 | AO292: 2.7999999999999997e-002 | AP292: 19 | AQ292: 永创转债!
A293: 10 | B293: 123108 | C293: 乐普转2 | D293: 300003 | E293: 乐普医疗 | F293: 医药 | G293: 医疗器械 | H293: 125.6 | I293: 0. | J293: -9.1999999999999998e-003 | K293: 31.73 | L293: -1.43e-002 | M293: 111.1 | N293: 29.73 | O293: 0.17699999999999999 | P293: 106.73 | Q293: 4月20天 | R293: 4.86年 | S293: 2.86年 | T293: 16.4 | U293: 36 | V293: 1.8000000000000002e-002 | W293: 2.8999999999999998e-002 | X293: 3.1e-002 | Y293: 573 | Z293: 5.39 | AA293: -2.52e-002 | AB293: -2.92e-002 | AC293: -6.6600000000000006e-002 | AD293: -6.7799999999999999e-002 | AE293: 90.68 | AF293: 92.04 | AG293: 0.64 | AH293: AA+ | AI293: 4.0000000000000001e-002 | AJ293: =H293+100*O293 -> 143.29999999999998 | AK293: 144.5 | AL293: 274 | AM293: 52.4 | AN293: 267 | AO293: 3.4000000000000002e-002 | AP293: 7 | AQ293: 乐普转2
A294: 98 | B294: 110075 | C294: 南航转债 | D294: 600029 | E294: 南方航空 | F294: 交通运输 | G294: 航空运输 | H294: 126.44 | I294: -8.5000000000000006e-003 | J294: 4.5000000000000005e-003 | K294: 6.66 | L294: -6.0000000000000001e-003 | M294: 110 | N294: 6.24 | O294: 0.185 | P294: 106.73 | Q294: 转股中 | R294: 5.40年 | S294: 3.40年 | T294: 160 | U294: 50 | V294: 2.e-003 | W294: 0.157 | X294: 0.16699999999999998 | Y294: 1021. | Z294: 1.56 | AA294: -2.58e-002 | AB294: -2.8999999999999998e-002 | AC294: -5.7999999999999996e-002 | AD294: -5.91e-002 | AE294: 89.46 | AF294: 89.98 | AG294: 0.66 | AH294: AAA | AI294: 3.8399999999999997e-002 | AJ294: =H294+100*O294 -> 144.94 | AK294: 146.1 | AL294: 281 | AM294: 56.2 | AN294: 287 | AO294: 3.2000000000000001e-002 | AP294: 7 | AQ294: 南航转债
A295: 142 | B295: 123058 | C295: 欣旺转债 | D295: 300207 | E295: 欣旺达 | F295: 电子 | G295: 电子产品 | H295: 133.5 | I295: 2.2099999999999998e-002 | J295: 5.9500000000000004e-002 | K295: 25.76 | L295: 0.11 | M295: 116.3 | N295: 21.24 | O295: 0.10099999999999999 | P295: 121.28 | Q295: 转股中 | R295: 5年53天 | S295: 3年54天 | T295: 11.2 | U295: 472 | V295: 0.314 | W295: 2.7999999999999997e-002 | X295: 3.3000000000000002e-002 | Y295: 406 | Z295: 5.8 | AA295: -2.7000000000000003e-002 | AB295: -3.2300000000000002e-002 | AC295: -7.3800000000000004e-002 | AD295: -7.5700000000000003e-002 | AE295: 90.31 | AF295: 93.9 | AG295: 0.74 | AH295: AA | AI295: 4.3400000000000001e-002 | AJ295: =H295+100*O295 -> 143.59999999999999 | AK295: 145.7 | AL295: 278 | AM295: 51.8 | AN295: 265 | AO295: 0.17999999999999999 | AP295: 6 | AQ295: 欣旺转债
A296: 95 | B296: 127022 | C296: 恒逸转债 | D296: 703 | E296: 恒逸石化 | F296: 化工 | G296: 化工 | H296: 126.385 | I296: 1.03e-002 | J296: -1.4800000000000001e-002 | K296: 12.2 | L296: -6.5000000000000006e-003 | M296: 108.9 | N296: 11.5 | O296: 0.191 | P296: 106.09 | Q296: 转股中 | R296: 5.40年 | S296: 3.41年 | T296: 20 | U296: 35 | V296: 1.3999999999999999e-002 | W296: 4.4999999999999998e-002 | X296: 4.7e-002 | Y296: 449 | Z296: 1.81 | AA296: -2.75e-002 | AB296: -3.0499999999999999e-002 | AC296: -5.6900000000000006e-002 | AD296: -5.8200000000000002e-002 | AE296: 88.88 | AF296: 87.74 | AG296: 0.7 | AH296: AA+ | AI296: 4.1399999999999999e-002 | AJ296: =H296+100*O296 -> 145.48500000000001 | AK296: 146.7 | AL296: 284 | AM296: 57.8 | AN296: 294 | AO296: -6.9000000000000006e-002 | AP296: 6 | AQ296: 恒逸转债
A297: 350 | B297: 113013 | C297: 国君转债! | D297: 601211 | E297: 国泰君安 | F297: 金融 | G297: 证券行业 | H297: 114.9 | I297: 3.0999999999999999e-003 | J297: -4.6999999999999993e-003 | K297: 16.82 | L297: -4.6999999999999993e-003 | M297: 108.3 | N297: 19.01 | O297: 0.29899999999999999 | P297: 88.48 | Q297: 转股中 | R297: 2年47天 | S297: 无权 | T297: 69.9 | U297: 53 | V297: 6.9999999999999993e-003 | W297: 4.7e-002 | X297: 4.0999999999999995e-002 | Y297: 1498. | Z297: 1.15 | AA297: -2.7999999999999997e-002 | AB297: -3.5000000000000003e-002 | AC297: 无权 | AD297: 无权 | AE297: 无权 | AF297: 100.75 | AG297: 0.32 | AH297: AAA | AI297: 3.5299999999999998e-002 | AJ297: =H297+100*O297 -> 144.80000000000001 | AK297: 141.3 | AL297: 256 | AM297: 40.6 | AN297: 186 | AO297: 2.1000000000000001e-002 | AP297: 14 | AQ297: 国君转债!
A298: 324 | B298: 127005 | C298: 长证转债! | D298: 783 | E298: 长江证券 | F298: 金融 | G298: 证券行业 | H298: 117.874 | I298: -4.0000000000000002e-004 | J298: -4.0000000000000001e-003 | K298: 7.35 | L298: -8.1000000000000013e-003 | M298: 108.3 | N298: 7.28 | O298: 0.16800000000000001 | P298: 100.96 | Q298: 转股中 | R298: 2.81年 | S298: 无权 | T298: 50 | U298: 24 | V298: 4.0000000000000001e-003 | W298: 0.12300000000000001 | X298: 0.124 | Y298: 406 | Z298: 1.41 | AA298: -3.0200000000000001e-002 | AB298: -3.5499999999999997e-002 | AC298: 无权 | AD298: 无权 | AE298: 无权 | AF298: 98.4 | AG298: 0.55 | AH298: AAA | AI298: 3.5299999999999998e-002 | AJ298: =H298+100*O298 -> 134.67400000000001 | AK298: 134.8 | AL298: 213 | AM298: 36.4 | AN298: 146 | AO298: 1.1000000000000001e-002 | AP298: 14 | AQ298: 长证转债!
A299: 320 | B299: 113508 | C299: 新凤转债! | D299: 603225 | E299: 新凤鸣 | F299: 服装纺织 | G299: 纺织行业 | H299: 121.79 | I299: 4.8999999999999998e-003 | J299: -1.e-003 | K299: 17.8 | L299: 5.6000000000000008e-003 | M299: 111.3 | N299: 15.78 | O299: 8.0000000000000002e-002 | P299: 112.8 | Q299: 转股中 | R299: 2.93年 | S299: 0.93年 | T299: 20.6 | U299: 9.6 | V299: 4.0000000000000001e-003 | W299: 8.3000000000000004e-002 | X299: 9.3000000000000013e-002 | Y299: 249 | Z299: 2.04 | AA299: -3.0699999999999998e-002 | AB299: -3.7400000000000003e-002 | AC299: -0.14800000000000002 | AD299: -0.14999999999999999 | AE299: 97.49 | AF299: 99.3 | AG299: 0.68 | AH299: AA | AI299: 4.0300000000000002e-002 | AJ299: =H299+100*O299 -> 129.79000000000002 | AK299: 130.8 | AL299: 158 | AM299: 31.5 | AN299: 100 | AO299: -2.e-003 | AP299: 23 | AQ299: 新凤转债!
A300: 4 | B300: 113047 | C300: 旗滨转债 | D300: 601636 | E300: 旗滨集团 | F300: 建筑 | G300: 玻璃 | H300: 137.33 | I300: 3.0000000000000001e-003 | J300: 6.0999999999999995e-003 | K300: 15.14 | L300: 1.2699999999999999e-002 | M300: 114 | N300: 13.15 | O300: 0.193 | P300: 115.13 | Q300: 4月27天 | R300: 5.88年 | S300: 3.89年 | T300: 15 | U300: 57 | V300: 2.7000000000000003e-002 | W300: 3.7000000000000005e-002 | X300: 4.2000000000000003e-002 | Y300: 407 | Z300: 3.91 | AA300: -3.15e-002 | AB300: -3.56e-002 | AC300: -7.0000000000000007e-002 | AD300: -7.0999999999999994e-002 | AE300: 87.04 | AF300: 90.07 | AG300: 0.72 | AH300: AA+ | AI300: 4.1399999999999999e-002 | AJ300: =H300+100*O300 -> 156.63000000000002 | AK300: 159.5 | AL300: 315 | AM300: 69.5 | AN300: 317 | AO300: 5.0000000000000001e-003 | AP300: 5 | AQ300: 旗滨转债
A301: 239 | B301: 128079 | C301: 英联转债! | D301: 2846 | E301: 英联股份 | F301: 造纸包装 | G301: 包装材料 | H301: 135.888 | I301: -6.4000000000000003e-003 | J301: 6.4000000000000003e-003 | K301: 8.27 | L301: -1.66e-002 | M301: 117.5 | N301: 8.29 | O301: 0.36200000000000004 | P301: 99.76 | Q301: 转股中 | R301: 4.42年 | S301: 2.42年 | T301: 1.52 | U301: 177 | V301: 0.85299999999999998 | W301: 5.7999999999999996e-002 | X301: 5.7999999999999996e-002 | Y301: 26 | Z301: 3.42 | AA301: -3.3000000000000002e-002 | AB301: -3.9599999999999996e-002 | AC301: -0.10000000000000001 | AD301: -0.10199999999999999 | AE301: 86.36 | AF301: 86.34 | AG301: 0 | AH301: A+ | AI301: 7.400000000000001e-002 | AJ301: =H301+100*O301 -> 172.08800000000002 | AK301: 172 | AL301: 329 | AM301: 85.7 | AN301: 331 | AO301: -3.5000000000000003e-002 | AP301: 19 | AQ301: 英联转债!
A302: 231 | B302: 110061 | C302: 川投转债 | D302: 600674 | E302: 川投能源 | F302: 能源电力 | G302: 水电 | H302: 128.7 | I302: -2.2000000000000001e-003 | J302: 3.4999999999999996e-003 | K302: 11.9 | L302: 1.7000000000000001e-003 | M302: 110.8 | N302: 9.58 | O302: 3.6000000000000004e-002 | P302: 124.22 | Q302: 转股中 | R302: 4.47年 | S302: 2.48年 | T302: 39.6 | U302: 5.6 | V302: 1.e-003 | W302: 7.5999999999999998e-002 | X302: 9.4e-002 | Y302: 524 | Z302: 1.82 | AA302: -3.3500000000000002e-002 | AB302: -3.7699999999999997e-002 | AC302: -8.0500000000000002e-002 | AD302: -8.2599999999999993e-002 | AE302: 93.93 | AF302: 94.48 | AG302: 0.79 | AH302: AAA | AI302: 3.7000000000000005e-002 | AJ302: =H302+100*O302 -> 132.29999999999998 | AK302: 133.2 | AL302: 194 | AM302: 38.7 | AN302: 174 | AO302: 2.3e-002 | AP302: 15 | AQ302: 川投转债
A303: 90 | B303: 113040 | C303: 星宇转债 | D303: 601799 | E303: 星宇股份 | F303: 汽车 | G303: 零部件制 | H303: 134 | I303: -7.4999999999999997e-003 | J303: -6.0999999999999995e-003 | K303: 190.72 | L303: -1.77e-002 | M303: 111.5 | N303: 158 | O303: 0.11 | P303: 120.71 | Q303: 转股中 | R303: 5.42年 | S303: 3.42年 | T303: 15 | U303: 12 | V303: 6.0000000000000001e-003 | W303: 2.7999999999999997e-002 | X303: 3.4000000000000002e-002 | Y303: 527 | Z303: 8.71 | AA303: -3.3700000000000001e-002 | AB303: -3.7400000000000003e-002 | AC303: -7.2900000000000006e-002 | AD303: -7.400000000000001e-002 | AE303: 88.48 | AF303: 89.74 | AG303: 0.77 | AH303: AA+ | AI303: 4.1399999999999999e-002 | AJ303: =H303+100*O303 -> 145. | AK303: 147.3 | AL303: 286 | AM303: 57.5 | AN303: 293 | AO303: -5.0000000000000001e-003 | AP303: 5 | AQ303: 星宇转债
A304: 298 | B304: 110048 | C304: 福能转债! | D304: 600483 | E304: 福能股份 | F304: 能源电力 | G304: 电力供应 | H304: 128.01 | I304: -4.5999999999999999e-003 | J304: -1.9699999999999999e-002 | K304: 9.95 | L304: -3.2099999999999997e-002 | M304: 113.3 | N304: 8.12 | O304: 4.4999999999999998e-002 | P304: 122.54 | Q304: 转股中 | R304: 3.55年 | S304: 1.55年 | T304: 20.4 | U304: 40 | V304: 1.4999999999999999e-002 | W304: 0.115 | X304: 0.14000000000000001 | Y304: 178 | Z304: 1.13 | AA304: -3.4500000000000003e-002 | AB304: -4.0899999999999999e-002 | AC304: -0.105 | AD304: -0.107 | AE304: 96.17 | AF304: 98.86 | AG304: 0.76 | AH304: AA+ | AI304: 4.0000000000000001e-002 | AJ304: =H304+100*O304 -> 132.50999999999999 | AK304: 133.5 | AL304: 198 | AM304: 34.6 | AN304: 132 | AO304: -2.1000000000000001e-002 | AP304: 9 | AQ304: 福能转债!
A305: 218 | B305: 110065 | C305: 淮矿转债! | D305: 600985 | E305: XD淮北矿 | F305: 煤炭 | G305: 煤炭开采 | H305: 130.62 | I305: 2.7000000000000001e-003 | J305: 1.2199999999999999e-002 | K305: 11.25 | L305: 1.8100000000000002e-002 | M305: 110.8 | N305: 8.68 | O305: 8.0000000000000002e-003 | P305: 129.61 | Q305: 转股中 | R305: 4.59年 | S305: 2.59年 | T305: 17 | U305: 155 | V305: 7.0000000000000007e-002 | W305: 6.6000000000000003e-002 | X305: 8.5000000000000006e-002 | Y305: 257 | Z305: 1.1 | AA305: -3.5900000000000001e-002 | AB305: -3.9900000000000005e-002 | AC305: -8.2200000000000009e-002 | AD305: -8.4199999999999997e-002 | AE305: 93.53 | AF305: 94.09 | AG305: 0.82 | AH305: AAA | AI305: 3.7000000000000005e-002 | AJ305: =H305+100*O305 -> 131.42000000000002 | AK305: 131.6 | AL305: 172 | AM305: 37.5 | AN305: 159 | AO305: -7.4999999999999997e-002 | AP305: 21 | AQ305: 淮矿转债!
A306: 182 | B306: 113575 | C306: 东时转债! | D306: 603377 | E306: 东方时尚 | F306: 其他 | G306: 其他 | H306: 135.61 | I306: 4.8999999999999998e-003 | J306: 7.1999999999999998e-003 | K306: 10.51 | L306: 4.4699999999999997e-002 | M306: 113.1 | N306: 14.56 | O306: 0.879 | P306: 72.18 | Q306: 转股中 | R306: 4.88年 | S306: 2.89年 | T306: 0.98 | U306: 278 | V306: 2.0600000000000001 | W306: 1.4999999999999999e-002 | X306: 1.1000000000000001e-002 | Y306: 64 | Z306: 3.06 | AA306: -3.7100000000000001e-002 | AB306: -4.1700000000000001e-002 | AC306: -8.5500000000000007e-002 | AD306: -8.7400000000000005e-002 | AE306: 91.33 | AF306: 92.88 | AG306: 0.27 | AH306: AA | AI306: 4.2000000000000003e-002 | AJ306: =H306+100*O306 -> 223.51000000000002 | AK306: 199 | AL306: 334 | AM306: 106.2 | AN306: 334 | AO306: -0.255 | AP306: 15 | AQ306: 东时转债!
A307: 328 | B307: 110043 | C307: 无锡转债! | D307: 600908 | E307: 无锡银行 | F307: 金融 | G307: 银行行业 | H307: 119.86 | I307: -1.8e-003 | J307: -6.7000000000000002e-003 | K307: 6.01 | L307: -1.4800000000000001e-002 | M307: 108.3 | N307: 5.79 | O307: 0.155 | P307: 103.8 | Q307: 转股中 | R307: 2.70年 | S307: 无权 | T307: 29.2 | U307: 9.9 | V307: 3.0000000000000001e-003 | W307: 0.26100000000000001 | X307: 0.27100000000000002 | Y307: 112 | Z307: 0.9 | AA307: -3.73e-002 | AB307: -4.2800000000000005e-002 | AC307: 无权 | AD307: 无权 | AE307: 无权 | AF307: 97.98 | AG307: 0.58 | AH307: AA+ | AI307: 3.8300000000000001e-002 | AJ307: =H307+100*O307 -> 135.36000000000001 | AK307: 135.9 | AL307: 221 | AM307: 37.9 | AN307: 164 | AO307: 1.e-003 | AP307: 26 | AQ307: 无锡转债!
A308: 17 | B308: 127030 | C308: 盛虹转债 | D308: 301 | E308: 东方盛虹 | F308: 化工 | G308: 化纤 | H308: 140 | I308: 1.8200000000000001e-002 | J308: 1.43e-002 | K308: 17.74 | L308: 4.1100000000000005e-002 | M308: 112.5 | N308: 14.2 | O308: 0.121 | P308: 124.93 | Q308: 4月9天 | R308: 5.83年 | S308: 3.84年 | T308: 50 | U308: 82 | V308: 1.2e-002 | W308: 5.7999999999999996e-002 | X308: 7.2999999999999995e-002 | Y308: 858 | Z308: 4.73 | AA308: -3.73e-002 | AB308: -4.0899999999999999e-002 | AC308: -7.4200000000000002e-002 | AD308: -7.5399999999999995e-002 | AE308: 87.65 | AF308: 89.1 | AG308: 0.79 | AH308: AA+ | AI308: 4.1399999999999999e-002 | AJ308: =H308+100*O308 -> 152.09999999999999 | AK308: 155.1 | AL308: 307 | AM308: 66 | AN308: 311 | AO308: 0.14000000000000001 | AP308: 4 | AQ308: 盛虹转债
A309: 303 | B309: 128046 | C309: 利尔转债!! | D309: 2258 | E309: 利尔化学 | F309: 化工 | G309: 农化 | H309: 127.594 | I309: -1.4000000000000002e-003 | J309: -1.2999999999999999e-003 | K309: 22.63 | L309: -2.5999999999999999e-003 | M309: 112.3 | N309: 18.42 | O309: 3.9e-002 | P309: 122.86 | Q309: 转股中 | R309: 3.41年 | S309: 1.41年 | T309: 8.47 | U309: 6.5 | V309: 6.0000000000000001e-003 | W309: 7.0999999999999994e-002 | X309: 8.8000000000000009e-002 | Y309: 119 | Z309: 3.05 | AA309: -3.7499999999999999e-002 | AB309: -4.3700000000000003e-002 | AC309: -0.115 | AD309: -0.11699999999999999 | AE309: 96.41 | AF309: 97.9 | AG309: 1 | AH309: AA | AI309: 4.2000000000000003e-002 | AJ309: =H309+100*O309 -> 131.494 | AK309: 132.3 | AL309: 177 | AM309: 34.4 | AN309: 129 | AO309: -2.4e-002 | AP309: 10 | AQ309: 利尔转债!!
A310: 321 | B310: 128036 | C310: 金农转债!! | D310: 2548 | E310: 金新农 | F310: 农业 | G310: 畜牧业 | H310: 121.479 | I310: 1.03e-002 | J310: -3.3e-003 | K310: 6.06 | L310: 1.6799999999999999e-002 | M310: 109.3 | N310: 6.96 | O310: 0.39500000000000002 | P310: 87.07 | Q310: 转股中 | R310: 2.80年 | S310: 0.80年 | T310: 1.46 | U310: 111 | V310: 0.61599999999999999 | W310: 3.5000000000000003e-002 | X310: 2.9999999999999999e-002 | Y310: 42 | Z310: 1.61 | AA310: -3.7599999999999995e-002 | AB310: -4.3400000000000001e-002 | AC310: -0.16899999999999998 | AD310: -0.17199999999999999 | AE310: 96.12 | AF310: 92.78 | AG310: 0.41 | AH310: AA- | AI310: 6.13e-002 | AJ310: =H310+100*O310 -> 160.97899999999998 | AK310: 155.9 | AL310: 310 | AM310: 59.8 | AN310: 299 | AO310: -5.5999999999999994e-002 | AP310: 16 | AQ310: 金农转债!!
A311: 7 | B311: 123111 | C311: 东财转3 | D311: 300059 | E311: 东方财富 | F311: 金融 | G311: 证券行业 | H311: 138.5 | I311: -4.5000000000000005e-003 | J311: -2.23e-002 | K311: 34.49 | L311: -3.44e-002 | M311: 110.5 | N311: 28.08 | O311: 0.128 | P311: 122.83 | Q311: 4月25天 | R311: 5.88年 | S311: 3.88年 | T311: 158 | U311: 681 | V311: 3.1e-002 | W311: 5.2999999999999999e-002 | X311: 6.5000000000000002e-002 | Y311: 2971. | Z311: 8.47 | AA311: -3.8100000000000002e-002 | AB311: -4.1100000000000005e-002 | AC311: -7.3099999999999998e-002 | AD311: -7.3899999999999993e-002 | AE311: 86.62 | AF311: 87.28 | AG311: 0.78 | AH311: AA+ | AI311: 4.1399999999999999e-002 | AJ311: =H311+100*O311 -> 151.30000000000001 | AK311: 154.2 | AL311: 304 | AM311: 66.9 | AN311: 314 | AO311: 8.4000000000000005e-002 | AP311: 13 | AQ311: 东财转3
A312: 209 | B312: 123042 | C312: 银河转债! | D312: 300619 | E312: 金银河 | F312: 机械装备 | G312: 专用设备 | H312: 138 | I312: 6.0999999999999995e-003 | J312: 1.1000000000000001e-003 | K312: 18.77 | L312: 1.5100000000000001e-002 | M312: 115.4 | N312: 24.4 | O312: 0.79400000000000004 | P312: 76.93 | Q312: 转股中 | R312: 4.65年 | S312: 2.65年 | T312: 1.67 | U312: 595 | V312: 2.5499999999999998 | W312: 0.11900000000000001 | X312: 9.1999999999999998e-002 | Y312: 14 | Z312: 2.87 | AA312: -3.85e-002 | AB312: -4.4000000000000004e-002 | AC312: -9.7299999999999998e-002 | AD312: -9.9399999999999988e-002 | AE312: 85.03 | AF312: 83.44 | AG312: 0.47 | AH312: A+ | AI312: 7.400000000000001e-002 | AJ312: =H312+100*O312 -> 217.40000000000001 | AK312: 199.1 | AL312: 335 | AM312: 114 | AN312: 337 | AO312: 2.e-002 | AP312: 23 | AQ312: 银河转债!
A313: 156 | B313: 128113 | C313: 比音转债! | D313: 2832 | E313: 比音勒芬 | F313: 服装纺织 | G313: 服装行业 | H313: 142.7 | I313: 2.4700000000000003e-002 | J313: -4.0999999999999995e-003 | K313: 21.31 | L313: 2.4e-002 | M313: 117.3 | N313: 14.9 | O313: -2.e-003 | P313: 143.02 | Q313: 转股中 | R313: 5年24天 | S313: 3年25天 | T313: 3.71 | U313: 217 | V313: 0.40799999999999997 | W313: 3.2000000000000001e-002 | X313: 4.5999999999999999e-002 | Y313: 116 | Z313: 4.4 | AA313: -3.8699999999999998e-002 | AB313: -4.4299999999999999e-002 | AC313: -9.4600000000000004e-002 | AD313: -9.6500000000000002e-002 | AE313: 90.62 | AF313: 95.02 | AG313: 0.86 | AH313: AA | AI313: 4.3400000000000001e-002 | AJ313: =H313+100*O313 -> 142.5 | AK313: 142.4 | AL313: 262 | AM313: 47.4 | AN313: 235 | AO313: 2.9999999999999999e-002 | AP313: 8 | AQ313: 比音转债!
A314: 88 | B314: 127023 | C314: 华菱转2! | D314: 932 | E314: 华菱钢铁 | F314: 钢铁 | G314: 炼钢 | H314: 137.499 | I314: 9.4999999999999998e-003 | J314: -2.e-003 | K314: 6.71 | L314: 7.4999999999999997e-003 | M314: 110.1 | N314: 4.97 | O314: 1.8000000000000002e-002 | P314: 135.01 | Q314: 转股中 | R314: 5.42年 | S314: 4.42年 | T314: 20.7 | U314: 274 | V314: 9.6000000000000002e-002 | W314: 5.0000000000000003e-002 | X314: 6.8000000000000005e-002 | Y314: 411 | Z314: 1.17 | AA314: -4.07e-002 | AB314: -4.3899999999999995e-002 | AC314: -5.8700000000000002e-002 | AD314: -6.0400000000000002e-002 | AE314: 88.02 | AF314: 90.03 | AG314: 1 | AH314: AAA | AI314: 3.8399999999999997e-002 | AJ314: =H314+100*O314 -> 139.29900000000001 | AK314: 140 | AL314: 246 | AM314: 50 | AN314: 251 | AO314: -0.16300000000000001 | AP314: 12 | AQ314: 华菱转2!
A315: 358 | B315: 113009 | C315: 广汽转债! | D315: 601238 | E315: 广汽集团 | F315: 汽车 | G315: 乘用车 | H315: 109.06 | I315: -6.1999999999999998e-003 | J315: 4.0000000000000001e-003 | K315: 12.27 | L315: -2.9999999999999999e-002 | M315: 106 | N315: 14.12 | O315: 0.255 | P315: 86.9 | Q315: 转股中 | R315: 0.67年 | S315: 回售内 | T315: 25.5 | U315: 44 | V315: 1.6e-002 | W315: 2.e-002 | X315: 1.7000000000000001e-002 | Y315: 1270. | Z315: 1.47 | AA315: -4.1299999999999996e-002 | AB315: -5.74e-002 | AC315: 回售内 | AD315: 回售内 | AE315: 100.27 | AF315: 103.81 | AG315: 0.07 | AH315: AAA | AI315: 3.15e-002 | AJ315: =H315+100*O315 -> 134.56 | AK315: 131.2 | AL315: 162 | AM315: 27.4 | AN315: 53 | AO315: 7.0000000000000007e-002 | AP315: 16 | AQ315: 广汽转债!
A316: 66 | B316: 113611 | C316: 福20转债 | D316: 603806 | E316: 福斯特 | F316: 能源电力 | G316: 太阳能 | H316: 143.43 | I316: 2.6000000000000002e-002 | J316: 1.6299999999999999e-002 | K316: 94.3 | L316: 5.2699999999999997e-002 | M316: 111.85 | N316: 73.69 | O316: 0.121 | P316: 127.97 | Q316: 17天 | R316: 5.53年 | S316: 3.53年 | T316: 17 | U316: 165 | V316: 6.8000000000000005e-002 | W316: 2.3e-002 | X316: 2.9999999999999999e-002 | Y316: 726 | Z316: 7.93 | AA316: -4.4500000000000005e-002 | AB316: -4.82e-002 | AC316: -8.6999999999999994e-002 | AD316: -8.8200000000000001e-002 | AE316: 87.82 | AF316: 88.73 | AG316: 0.8 | AH316: AA | AI316: 4.3400000000000001e-002 | AJ316: =H316+100*O316 -> 155.53 | AK316: 158.9 | AL316: 314 | AM316: 70.2 | AN316: 319 | AO316: 8.1000000000000003e-002 | AP316: 6 | AQ316: 福20转债
A317: 42 | B317: 113616 | C317: 韦尔转债 | D317: 603501 | E317: 韦尔股份 | F317: 电子 | G317: 元器件制 | H317: 149.45 | I317: 2.9999999999999997e-004 | J317: -2.8000000000000004e-003 | K317: 284.07 | L317: -3.3e-003 | M317: 114.5 | N317: 222.83 | O317: 0.17199999999999999 | P317: 127.48 | Q317: 45天 | R317: 5.60年 | S317: 3.61年 | T317: 24.4 | U317: 48 | V317: 1.3000000000000001e-002 | W317: 1.e-002 | X317: 1.3000000000000001e-002 | Y317: 2466. | Z317: 19.82 | AA317: -4.7e-002 | AB317: -5.1299999999999998e-002 | AC317: -9.4399999999999998e-002 | AD317: -9.5700000000000007e-002 | AE317: 88.47 | AF317: 91.53 | AG317: 0.79 | AH317: AA+ | AI317: 4.1399999999999999e-002 | AJ317: =H317+100*O317 -> 166.64999999999998 | AK317: 171.4 | AL317: 328 | AM317: 79.9 | AN317: 330 | AO317: 1.e-003 | AP317: 8 | AQ317: 韦尔转债
A318: 280 | B318: 123022 | C318: 长信转债!! | D318: 300088 | E318: 长信科技 | F318: 通信互联 | G318: 通信设备 | H318: 138.9 | I318: -2.e-003 | J318: -1.e-004 | K318: 7.84 | L318: -2.5000000000000001e-003 | M318: 114.3 | N318: 6.15 | O318: 8.9999999999999997e-002 | P318: 127.48 | Q318: 转股中 | R318: 3.82年 | S318: 1.82年 | T318: 2.57 | U318: 13 | V318: 3.5000000000000003e-002 | W318: 1.3000000000000001e-002 | X318: 1.7000000000000001e-002 | Y318: 192 | Z318: 2.67 | AA318: -5.0499999999999996e-002 | AB318: -5.67e-002 | AC318: -0.115 | AD318: -0.11699999999999999 | AE318: 94.77 | AF318: 97.94 | AG318: 0.79 | AH318: AA | AI318: 4.2000000000000003e-002 | AJ318: =H318+100*O318 -> 147.90000000000001 | AK318: 150.3 | AL318: 297 | AM318: 52.4 | AN318: 266 | AO318: 2.2000000000000002e-002 | AP318: 12 | AQ318: 长信转债!!
A319: 180 | B319: 113034 | C319: 滨化转债! | D319: 601678 | E319: 滨化股份 | F319: 化工 | G319: 化工 | H319: 147.96 | I319: 1.3300000000000001e-002 | J319: -1.83e-002 | K319: 6.84 | L319: -5.7999999999999996e-003 | M319: 114.8 | N319: 4.68 | O319: 1.2e-002 | P319: 146.15 | Q319: 转股中 | R319: 4.89年 | S319: 2.89年 | T319: 6 | U319: 51 | V319: 5.7999999999999996e-002 | W319: 4.5999999999999999e-002 | X319: 6.8000000000000005e-002 | Y319: 130 | Z319: 1.49 | AA319: -5.1399999999999994e-002 | AB319: -5.6399999999999999e-002 | AC319: -0.11 | AD319: -0.11199999999999999 | AE319: 91.19 | AF319: 94.24 | AG319: 0.86 | AH319: AA | AI319: 4.2000000000000003e-002 | AJ319: =H319+100*O319 -> 149.16 | AK319: 149.8 | AL319: 293 | AM319: 55.5 | AN319: 283 | AO319: 2.6000000000000002e-002 | AP319: 25 | AQ319: 滨化转债!
A320: 228 | B320: 113550 | C320: 常汽转债! | D320: 603035 | E320: 常熟汽饰 | F320: 汽车 | G320: 零部件制 | H320: 153.71 | I320: -2.75e-002 | J320: 1.3000000000000001e-002 | K320: 14.78 | L320: -1.66e-002 | M320: 121.3 | N320: 9.65 | O320: 4.0000000000000001e-003 | P320: 153.16 | Q320: 转股中 | R320: 4.49年 | S320: 2.50年 | T320: 3.06 | U320: 528 | V320: 1.1200000000000001 | W320: 5.9000000000000004e-002 | X320: 8.9999999999999997e-002 | Y320: 52 | Z320: 1.38 | AA320: -5.2400000000000002e-002 | AB320: -5.9900000000000002e-002 | AC320: -0.13600000000000001 | AD320: -0.13800000000000001 | AE320: 88.76 | AF320: 92.81 | AG320: 0.87 | AH320: AA- | AI320: 6.3e-002 | AJ320: =H320+100*O320 -> 154.11000000000001 | AK320: 154.3 | AL320: 305 | AM320: 61.4 | AN320: 300 | AO320: -5.2999999999999999e-002 | AP320: 16 | AQ320: 常汽转债!
A321: 334 | B321: 128032 | C321: 双环转债! | D321: 2472 | E321: 双环传动 | F321: 机械装备 | G321: 通用设备 | H321: 125.481 | I321: -3.3e-003 | J321: 8.0000000000000004e-004 | K321: 11.67 | L321: -3.4000000000000002e-003 | M321: 109.3 | N321: 9.89 | O321: 6.3e-002 | P321: 118 | Q321: 转股中 | R321: 2.60年 | S321: 0.60年 | T321: 9.92 | U321: 32 | V321: 2.5000000000000001e-002 | W321: 0.124 | X321: 0.14599999999999999 | Y321: 80 | Z321: 2.29 | AA321: -5.2600000000000001e-002 | AB321: -5.8799999999999998e-002 | AC321: -0.254 | AD321: -0.25800000000000001 | AE321: 98.78 | AF321: 98.82 | AG321: 0.75 | AH321: AA | AI321: 4.0300000000000002e-002 | AJ321: =H321+100*O321 -> 131.78100000000001 | AK321: 133 | AL321: 191 | AM321: 34.1 | AN321: 126 | AO321: 2.e-003 | AP321: 40 | AQ321: 双环转债!
A322: 355 | B322: 113011 | C322: 光大转债 | D322: 601818 | E322: 光大银行 | F322: 金融 | G322: 银行行业 | H322: 117.91 | I322: 1.e-004 | J322: -5.5000000000000005e-003 | K322: 3.82 | L322: -1.04e-002 | M322: 106.8 | N322: 3.76 | O322: 0.161 | P322: 101.6 | Q322: 转股中 | R322: 1.82年 | S322: 无权 | T322: 242 | U322: 275 | V322: 1.e-002 | W322: 0.11699999999999999 | X322: 0.11900000000000001 | Y322: 2064. | Z322: 0.58 | AA322: -5.33e-002 | AB322: -5.9900000000000002e-002 | AC322: 无权 | AD322: 无权 | AE322: 无权 | AF322: 100.32 | AG322: 0.52 | AH322: AAA | AI322: 3.5299999999999998e-002 | AJ322: =H322+100*O322 -> 134.00999999999999 | AK322: 134.2 | AL322: 205 | AM322: 33.9 | AN322: 124 | AO322: -5.0000000000000001e-003 | AP322: 14 | AQ322: 光大转债
A323: 199 | B323: 123043 | C323: 正元转债 | D323: 300645 | E323: 正元智慧 | F323: 计算机及 | G323: 软件开发 | H323: 158.62 | I323: 3.4799999999999998e-002 | J323: -2.5399999999999999e-002 | K323: 16.5 | L323: 1.3500000000000002e-002 | M323: 120.9 | N323: 15.41 | O323: 0.48100000000000004 | P323: 107.07 | Q323: 转股中 | R323: 4.79年 | S323: 2.79年 | T323: 1.66 | U323: 3117. | V323: 11.43 | W323: 7.9000000000000001e-002 | X323: 8.5000000000000006e-002 | Y323: 21 | Z323: 3.27 | AA323: -5.62e-002 | AB323: -6.3e-002 | AC323: -0.13200000000000001 | AD323: -0.13400000000000001 | AE323: 84.46 | AF323: 86.57 | AG323: 0.69 | AH323: A+ | AI323: 7.400000000000001e-002 | AJ323: =H323+100*O323 -> 206.72 | AK323: 210.2 | AL323: 338 | AM323: 123.6 | AN323: 340 | AO323: 3.2000000000000001e-002 | AP323: 18 | AQ323: 正元转债
A324: 290 | B324: 128053 | C324: 尚荣转债! | D324: 2551 | E324: 尚荣医疗 | F324: 医药 | G324: 医疗器械 | H324: 143.784 | I324: 4.0000000000000001e-003 | J324: 1.1999999999999999e-003 | K324: 5.85 | L324: 5.1999999999999998e-003 | M324: 114.3 | N324: 4.89 | O324: 0.20199999999999999 | P324: 119.63 | Q324: 转股中 | R324: 3.74年 | S324: 1.74年 | T324: 1.91 | U324: 266 | V324: 0.96999999999999997 | W324: 4.0000000000000001e-002 | X324: 4.8000000000000001e-002 | Y324: 48 | Z324: 1.57 | AA324: -6.0499999999999998e-002 | AB324: -6.6799999999999998e-002 | AC324: -0.13400000000000001 | AD324: -0.13600000000000001 | AE324: 95.11 | AF324: 98.29 | AG324: 1 | AH324: AA | AI324: 4.2000000000000003e-002 | AJ324: =H324+100*O324 -> 163.98399999999998 | AK324: 167.9 | AL324: 325 | AM324: 69.6 | AN324: 318 | AO324: -3.4000000000000002e-002 | AP324: 26 | AQ324: 尚荣转债!
A325: 204 | B325: 128097 | C325: 奥佳转债! | D325: 2614 | E325: 奥佳华 | F325: 机械装备 | G325: 专用设备 | H325: 154.5 | I325: 1.78e-002 | J325: -1.89e-002 | K325: 15.63 | L325: -1.2999999999999999e-003 | M325: 114.9 | N325: 10.39 | O325: 2.7000000000000003e-002 | P325: 150.43 | Q325: 转股中 | R325: 4.76年 | S325: 2.77年 | T325: 5.07 | U325: 51 | V325: 6.5000000000000002e-002 | W325: 5.2000000000000005e-002 | X325: 7.8e-002 | Y325: 98 | Z325: 2.13 | AA325: -6.13e-002 | AB325: -6.6299999999999998e-002 | AC325: -0.127 | AD325: -0.129 | AE325: 91.75 | AF325: 94.8 | AG325: 0.88 | AH325: AA | AI325: 4.2000000000000003e-002 | AJ325: =H325+100*O325 -> 157.19999999999999 | AK325: 158.6 | AL325: 313 | AM325: 63.8 | AN325: 307 | AO325: -5.0999999999999997e-002 | AP325: 22 | AQ325: 奥佳转债!
A326: 23 | B326: 123103 | C326: 震安转债 | D326: 300767 | E326: 震安科技 | F326: 化工 | G326: 橡胶塑料 | H326: 177.138 | I326: -9.300000000000001e-003 | J326: -2.2700000000000001e-002 | K326: 111.58 | L326: -3.8100000000000002e-002 | M326: 121.4 | N326: 79.87 | O326: 0.26800000000000002 | P326: 139.7 | Q326: 4月2天 | R326: 5.81年 | S326: 3.81年 | T326: 2.85 | U326: 751 | V326: 1.5 | W326: 1.8000000000000002e-002 | X326: 2.5000000000000001e-002 | Y326: 161 | Z326: 14.11 | AA326: -6.4199999999999993e-002 | AB326: -6.9800000000000001e-002 | AC326: -0.12 | AD326: -0.121 | AE326: 78.6 | AF326: 80.37 | AG326: 0.84 | AH326: A+ | AI326: 7.5399999999999995e-002 | AJ326: =H326+100*O326 -> 203.93800000000002 | AK326: 214.6 | AL326: 341 | AM326: 134.2 | AN326: 343 | AO326: 0.13 | AP326: 3 | AQ326: 震安转债
A327: 339 | B327: 128025 | C327: 特一转债! | D327: 2728 | E327: 特一药业 | F327: 医药 | G327: 化学制药 | H327: 129.4 | I327: -3.4300000000000004e-002 | J327: 3.5999999999999999e-003 | K327: 17.09 | L327: -4.0999999999999995e-002 | M327: 108.8 | N327: 14.7 | O327: 0.113 | P327: 116.26 | Q327: 转股中 | R327: 2.55年 | S327: 0.55年 | T327: 2.99 | U327: 2595. | V327: 6.5300000000000002 | W327: 8.5999999999999993e-002 | X327: 0.10000000000000001 | Y327: 35 | Z327: 3.26 | AA327: -6.6799999999999998e-002 | AB327: -7.2599999999999998e-002 | AC327: -0.313 | AD327: -0.316 | AE327: 97.35 | AF327: 93.73 | AG327: 0.75 | AH327: AA- | AI327: 6.13e-002 | AJ327: =H327+100*O327 -> 140.70000000000002 | AK327: 142.5 | AL327: 264 | AM327: 45.2 | AN327: 225 | AO327: 0.26700000000000002 | AP327: 52 | AQ327: 特一转债!
A328: 307 | B328: 123014 | C328: 凯发转债! | D328: 300407 | E328: 凯发电气 | F328: 能源电力 | G328: 电力设备 | H328: 126.002 | I328: 1.e-004 | J328: 2.8999999999999998e-003 | K328: 6.59 | L328: 1.23e-002 | M328: 108.5 | N328: 8.12 | O328: 0.55299999999999994 | P328: 81.16 | Q328: 转股中 | R328: 2.18年 | S328: 0.18年 | T328: 1.16 | U328: 44 | V328: 0.29999999999999999 | W328: 5.7999999999999996e-002 | X328: 4.7e-002 | Y328: 20 | Z328: 1.47 | AA328: -6.7099999999999993e-002 | AB328: -7.3700000000000002e-002 | AC328: -0.60199999999999998 | AD328: -0.60799999999999998 | AE328: 98.82 | AF328: 93.38 | AG328: 0.24 | AH328: A+ | AI328: 7.2300000000000003e-002 | AJ328: =H328+100*O328 -> 181.30199999999999 | AK328: 170.8 | AL328: 327 | AM328: 72 | AN328: 322 | AO328: -2.3e-002 | AP328: 17 | AQ328: 凯发转债!
A329: 19 | B329: 127029 | C329: 中钢转债 | D329: 928 | E329: 中钢国际 | F329: 建筑 | G329: 建筑工程 | H329: 178.5 | I329: 2.23e-002 | J329: 1.8600000000000002e-002 | K329: 12.43 | L329: 4.2800000000000005e-002 | M329: 117.5 | N329: 5.89 | O329: -0.154 | P329: 211.04 | Q329: 4月9天 | R329: 5.82年 | S329: 3.83年 | T329: 9.6 | U329: 6086. | V329: 3.4500000000000002 | W329: 6.0999999999999999e-002 | X329: 0.13 | Y329: 156 | Z329: 2.71 | AA329: -7.0099999999999996e-002 | AB329: -7.4800000000000005e-002 | AC329: -0.12300000000000001 | AD329: -0.124 | AE329: 87.68 | AF329: 93.07 | AG329: 0.96 | AH329: AA+ | AI329: 4.1399999999999999e-002 | AJ329: =H329+100*O329 -> 163.09999999999999 | AK329: 146 | AL329: 280 | AM329: 52.9 | AN329: 271 | AO329: 0.17999999999999999 | AP329: 6 | AQ329: 中钢转债
A330: 201 | B330: 110066 | C330: 盛屯转债!! | D330: 600711 | E330: 盛屯矿业 | F330: 有色金属 | G330: 有色行业 | H330: 164.94 | I330: 5.1699999999999996e-002 | J330: 2.53e-002 | K330: 7.94 | L330: 8.4700000000000011e-002 | M330: 114.9 | N330: 4.88 | O330: 1.3999999999999999e-002 | P330: 162.7 | Q330: 转股中 | R330: 4.78年 | S330: 2.78年 | T330: 5.22 | U330: 2529. | V330: 2.8199999999999998 | W330: 2.5000000000000001e-002 | X330: 4.0000000000000001e-002 | Y330: 212 | Z330: 1.9 | AA330: -7.400000000000001e-002 | AB330: -7.9000000000000001e-002 | AC330: -0.14499999999999999 | AD330: -0.14599999999999999 | AE330: 91.69 | AF330: 94.75 | AG330: 0.91 | AH330: AA | AI330: 4.2000000000000003e-002 | AJ330: =H330+100*O330 -> 166.34 | AK330: 167.2 | AL330: 323 | AM330: 72.4 | AN330: 323 | AO330: 7.0000000000000007e-002 | AP330: 35 | AQ330: 盛屯转债!!
A331: 81 | B331: 113041 | C331: 紫金转债 | D331: 601899 | E331: 紫金矿业 | F331: 有色金属 | G331: 贵金属 | H331: 160.82 | I331: -1.1000000000000001e-003 | J331: -8.1000000000000013e-003 | K331: 10.82 | L331: -1.01e-002 | M331: 108 | N331: 7 | O331: 4.0000000000000001e-002 | P331: 154.57 | Q331: 转股中 | R331: 4.45年 | S331: 2.46年 | T331: 57 | U331: 615 | V331: 6.7000000000000004e-002 | W331: 2.1000000000000001e-002 | X331: 3.2000000000000001e-002 | Y331: 2756. | Z331: 5.13 | AA331: -8.6099999999999996e-002 | AB331: -8.9099999999999999e-002 | AC331: -0.114 | AD331: -0.114 | AE331: 92.16 | AF331: 91.99 | AG331: 0.91 | AH331: AAA | AI331: 3.7000000000000005e-002 | AJ331: =H331+100*O331 -> 164.81999999999999 | AK331: 167.1 | AL331: 322 | AM331: 74.9 | AN331: 325 | AO331: -4.0000000000000001e-002 | AP331: 9 | AQ331: 紫金转债
A332: 186 | B332: 128103 | C332: 同德转债! | D332: 2360 | E332: 同德化工 | F332: 化工 | G332: 化工 | H332: 188.555 | I332: 2.2000000000000002e-002 | J332: -2.46e-002 | K332: 7.52 | L332: -2.7000000000000001e-003 | M332: 121.3 | N332: 5.18 | O332: 0.29899999999999999 | P332: 145.17 | Q332: 转股中 | R332: 4.84年 | S332: 2.85年 | T332: 1.09 | U332: 239 | V332: 1.1799999999999999 | W332: 3.6000000000000004e-002 | X332: 5.2999999999999999e-002 | Y332: 30 | Z332: 2.34 | AA332: -8.8599999999999998e-002 | AB332: -9.5100000000000004e-002 | AC332: -0.114 | AD332: -0.115 | AE332: 84.22 | AF332: 86.51 | AG332: 1 | AH332: A+ | AI332: 7.400000000000001e-002 | AJ332: =H332+100*O332 -> 218.45500000000001 | AK332: 231.9 | AL332: 344 | AM332: 145.4 | AN332: 344 | AO332: -5.0999999999999997e-002 | AP332: 13 | AQ332: 同德转债!
A333: 326 | B333: 113504 | C333: 艾华转债!! | D333: 603989 | E333: 艾华集团 | F333: 电子 | G333: 元器件制 | H333: 141.89 | I333: 2.0799999999999999e-002 | J333: -1.49e-002 | K333: 28.37 | L333: 6.7000000000000002e-003 | M333: 109.3 | N333: 21.13 | O333: 5.7000000000000002e-002 | P333: 134.26 | Q333: 转股中 | R333: 2.78年 | S333: 0.78年 | T333: 4.95 | U333: 12 | V333: 1.8000000000000002e-002 | W333: 4.4000000000000004e-002 | X333: 5.9000000000000004e-002 | Y333: 113 | Z333: 4.21 | AA333: -9.0800000000000006e-002 | AB333: -9.6300000000000011e-002 | AC333: -0.29999999999999999 | AD333: -0.30299999999999999 | AE333: 98.07 | AF333: 98.1 | AG333: 0.87 | AH333: AA | AI333: 4.0300000000000002e-002 | AJ333: =H333+100*O333 -> 147.58999999999997 | AK333: 149.5 | AL333: 292 | AM333: 51.4 | AN333: 261 | AO333: -3.7999999999999999e-002 | AP333: 9 | AQ333: 艾华转债!!
A334: 242 | B334: 113545 | C334: 金能转债! | D334: 603113 | E334: 金能科技 | F334: 煤炭 | G334: 炼焦 | H334: 173.5 | I334: -2.87e-002 | J334: -7.000000000000001e-004 | K334: 18.76 | L334: -3.15e-002 | M334: 114.9 | N334: 10.78 | O334: -3.0000000000000001e-003 | P334: 174.03 | Q334: 转股中 | R334: 4.40年 | S334: 2.40年 | T334: 10.2 | U334: 90 | V334: 4.9000000000000002e-002 | W334: 6.4000000000000001e-002 | X334: 0.11199999999999999 | Y334: 160 | Z334: 1.92 | AA334: -9.0999999999999998e-002 | AB334: -9.6199999999999994e-002 | AC334: -0.129 | AD334: -0.13 | AE334: 93.14 | AF334: 96.24 | AG334: 0.93 | AH334: AA | AI334: 4.2000000000000003e-002 | AJ334: =H334+100*O334 -> 173.19999999999999 | AK334: 173 | AL334: 330 | AM334: 76.7 | AN334: 328 | AO334: 2.e-002 | AP334: 17 | AQ334: 金能转债!
A335: 189 | B335: 123046 | C335: 天铁转债! | D335: 300587 | E335: 天铁股份 | F335: 铁路 | G335: 铁路设备 | H335: 186 | I335: -3.3e-003 | J335: 1.3600000000000001e-002 | K335: 16.94 | L335: 1.1299999999999999e-002 | M335: 117.7 | N335: 10.12 | O335: 0.111 | P335: 167.39 | Q335: 转股中 | R335: 4.82年 | S335: 2.83年 | T335: 0.77 | U335: 185 | V335: 1.28 | W335: 1.3000000000000001e-002 | X335: 2.2000000000000002e-002 | Y335: 58 | Z335: 3.56 | AA335: -9.1999999999999998e-002 | AB335: -9.7500000000000003e-002 | AC335: -0.114 | AD335: -0.115 | AE335: 86.44 | AF335: 88.19 | AG335: 0.91 | AH335: AA- | AI335: 6.3e-002 | AJ335: =H335+100*O335 -> 197.09999999999999 | AK335: 204.6 | AL335: 336 | AM335: 116.4 | AN335: 338 | AO335: 2.7000000000000003e-002 | AP335: 12 | AQ335: 天铁转债!
A336: 232 | B336: 123034 | C336: 通光转债! | D336: 300265 | E336: 通光线缆 | F336: 通信互联 | G336: 通信设备 | H336: 181.978 | I336: -1.1000000000000001e-002 | J336: 1.34e-002 | K336: 8.7 | L336: 3.4999999999999996e-003 | M336: 118 | N336: 7.97 | O336: 0.66700000000000004 | P336: 109.16 | Q336: 转股中 | R336: 4.46年 | S336: 2.46年 | T336: 0.78 | U336: 110 | V336: 0.7659999999999999 | W336: 2.5000000000000001e-002 | X336: 2.7000000000000003e-002 | Y336: 32 | Z336: 2.44 | AA336: -9.4200000000000006e-002 | AB336: -0.10000000000000001 | AC336: -0.13400000000000001 | AD336: -0.13500000000000001 | AE336: 86 | AF336: 86.44 | AG336: 0.71 | AH336: A+ | AI336: 7.400000000000001e-002 | AJ336: =H336+100*O336 -> 248.678 | AK336: 254.8 | AL336: 346 | AM336: 168.4 | AN336: 347 | AO336: 1.3999999999999999e-002 | AP336: 22 | AQ336: 通光转债!
A337: 354 | B337: 113012 | C337: 骆驼转债! | D337: 601311 | E337: 骆驼股份 | F337: 汽车 | G337: 零部件制 | H337: 127.67 | I337: 5.0000000000000001e-003 | J337: 7.0999999999999995e-003 | K337: 12.15 | L337: 1.4999999999999999e-002 | M337: 106.5 | N337: 10.06 | O337: 5.7000000000000002e-002 | P337: 120.78 | Q337: 转股中 | R337: 1.84年 | S337: 回售内 | T337: 5.09 | U337: 12 | V337: 1.8000000000000002e-002 | W337: 3.7000000000000005e-002 | X337: 4.4999999999999998e-002 | Y337: 136 | Z337: 1.8 | AA337: -9.4399999999999998e-002 | AB337: -0.10000000000000001 | AC337: 回售内 | AD337: 回售内 | AE337: 100.25 | AF337: 99.08 | AG337: 0.81 | AH337: AA | AI337: 4.0300000000000002e-002 | AJ337: =H337+100*O337 -> 133.37 | AK337: 134.6 | AL337: 209 | AM337: 34.3 | AN337: 127 | AO337: 3.0000000000000001e-003 | AP337: 16 | AQ337: 骆驼转债!
A338: 266 | B338: 113025 | C338: 明泰转债!! | D338: 601677 | E338: 明泰铝业 | F338: 有色金属 | G338: 铝金属 | H338: 167.28 | I338: 3.5099999999999999e-002 | J338: 1.4199999999999999e-002 | K338: 18.4 | L338: 5.2600000000000001e-002 | M338: 114.5 | N338: 11 | O338: 0. | P338: 167.27 | Q338: 转股中 | R338: 3.89年 | S338: 1.89年 | T338: 11 | U338: 356 | V338: 0.191 | W338: 8.8000000000000009e-002 | X338: 0.14699999999999999 | Y338: 126 | Z338: 1.39 | AA338: -9.4399999999999998e-002 | AB338: -0.10000000000000001 | AC338: -0.16500000000000001 | AD338: -0.16699999999999998 | AE338: 94.55 | AF338: 97.87 | AG338: 0.94 | AH338: AA | AI338: 4.2000000000000003e-002 | AJ338: =H338+100*O338 -> 167.28 | AK338: 167.3 | AL338: 324 | AM338: 69.4 | AN338: 316 | AO338: -1.2e-002 | AP338: 26 | AQ338: 明泰转债!!
A339: 281 | B339: 110055 | C339: 伊力转债!! | D339: 600197 | E339: 伊力特 | F339: 食品饮料 | G339: 白酒 | H339: 169.11 | I339: -1.3300000000000001e-002 | J339: 1.7000000000000001e-002 | K339: 27.56 | L339: 4.0000000000000001e-003 | M339: 114.3 | N339: 16.81 | O339: 3.1e-002 | P339: 163.95 | Q339: 转股中 | R339: 3.81年 | S339: 1.82年 | T339: 2.54 | U339: 2628. | V339: 5.8200000000000003 | W339: 2.e-002 | X339: 3.2000000000000001e-002 | Y339: 129 | Z339: 3.62 | AA339: -9.9100000000000008e-002 | AB339: -0.105 | AC339: -0.17600000000000002 | AD339: -0.17800000000000002 | AE339: 94.8 | AF339: 97.98 | AG339: 0.93 | AH339: AA | AI339: 4.2000000000000003e-002 | AJ339: =H339+100*O339 -> 172.21000000000001 | AK339: 174.3 | AL339: 331 | AM339: 76.3 | AN339: 327 | AO339: 6.3e-002 | AP339: 23 | AQ339: 伊力转债!!
A340: 247 | B340: 123030 | C340: 九洲转债! | D340: 300040 | E340: 九洲集团 | F340: 能源电力 | G340: 电力设备 | H340: 203.856 | I340: 5.3499999999999999e-002 | J340: -1.6799999999999999e-002 | K340: 9.02 | L340: 4.1599999999999998e-002 | M340: 120 | N340: 5.65 | O340: 0.27699999999999997 | P340: 159.65 | Q340: 转股中 | R340: 4.25年 | S340: 2.25年 | T340: 0.97 | U340: 2312. | V340: 11.41 | W340: 2.7999999999999997e-002 | X340: 4.4999999999999998e-002 | Y340: 34 | Z340: 1.54 | AA340: -0.11900000000000001 | AB340: -0.126 | AC340: -0.17300000000000001 | AD340: -0.17399999999999999 | AE340: 89.46 | AF340: 93.1 | AG340: 0.88 | AH340: AA- | AI340: 6.3e-002 | AJ340: =H340+100*O340 -> 231.55599999999998 | AK340: 248.1 | AL340: 345 | AM340: 155 | AN340: 345 | AO340: 9.6000000000000002e-002 | AP340: 26 | AQ340: 九洲转债!
A341: 291 | B341: 113527 | C341: 维格转债! | D341: 603518 | E341: 锦泓集团 | F341: 服装纺织 | G341: 服装行业 | H341: 199.79 | I341: 1.21e-002 | J341: -8.9999999999999998e-004 | K341: 19.93 | L341: 1.1699999999999999e-002 | M341: 119.5 | N341: 9.85 | O341: -1.3000000000000001e-002 | P341: 202.34 | Q341: 转股中 | R341: 3.68年 | S341: 1.68年 | T341: 5.08 | U341: 3051. | V341: 3. | W341: 0.10099999999999999 | X341: 0.20399999999999999 | Y341: 50 | Z341: 2.63 | AA341: -0.13200000000000001 | AB341: -0.14000000000000001 | AC341: -0.23899999999999999 | AD341: -0.24100000000000002 | AE341: 93.71 | AF341: 99.51 | AG341: 0.96 | AH341: AA | AI341: 5.2000000000000005e-002 | AJ341: =H341+100*O341 -> 198.48999999999998 | AK341: 197.2 | AL341: 333 | AM341: 97.7 | AN341: 333 | AO341: 0.59899999999999998 | AP341: 93 | AQ341: 维格转债!
A342: 205 | B342: 128095 | C342: 恩捷转债!! | D342: 2812 | E342: 恩捷股份 | F342: 电子 | G342: 元器件制 | H342: 226 | I342: 4.4000000000000003e-003 | J342: -6.6e-003 | K342: 146 | L342: -2.2000000000000001e-003 | M342: 114.9 | N342: 64.92 | O342: 5.0000000000000001e-003 | P342: 224.89 | Q342: 转股中 | R342: 4.73年 | S342: 2.73年 | T342: 6.56 | U342: 177 | V342: 0.12 | W342: 5.0000000000000001e-003 | X342: 1.1000000000000001e-002 | Y342: 1297. | Z342: 11.25 | AA342: -0.13500000000000001 | AB342: -0.14000000000000001 | AC342: -0.14899999999999999 | AD342: -0.14899999999999999 | AE342: 91.89 | AF342: 94.95 | AG342: 0.97 | AH342: AA | AI342: 4.2000000000000003e-002 | AJ342: =H342+100*O342 -> 226.5 | AK342: 227.1 | AL342: 343 | AM342: 132.2 | AN342: 342 | AO342: 0.111 | AP342: 15 | AQ342: 恩捷转债!!
A343: 348 | B343: 128017 | C343: 金禾转债!! | D343: 2597 | E343: 金禾实业 | F343: 化工 | G343: 化工 | H343: 155 | I343: -1.32e-002 | J343: 8.5000000000000006e-003 | K343: 32.66 | L343: -5.1999999999999998e-003 | M343: 108.8 | N343: 21.97 | O343: 4.2999999999999997e-002 | P343: 148.66 | Q343: 转股中 | R343: 2.45年 | S343: 0.45年 | T343: 5.52 | U343: 34 | V343: 3.9e-002 | W343: 2.9999999999999999e-002 | X343: 4.4999999999999998e-002 | Y343: 183 | Z343: 3.65 | AA343: -0.13600000000000001 | AB343: -0.14199999999999999 | AC343: -0.58399999999999996 | AD343: -0.58700000000000008 | AE343: 99.12 | AF343: 98.92 | AG343: 0.92 | AH343: AA | AI343: 4.0300000000000002e-002 | AJ343: =H343+100*O343 -> 159.30000000000001 | AK343: 161.3 | AL343: 317 | AM343: 62.2 | AN343: 303 | AO343: -1.2e-002 | AP343: 10 | AQ343: 金禾转债!!
A344: 251 | B344: 113543 | C344: 欧派转债! | D344: 603833 | E344: 欧派家居 | F344: 其他 | G344: 家居用品 | H344: 214.34 | I344: -1.01e-002 | J344: -2.7000000000000001e-003 | K344: 153 | L344: -1.32e-002 | M344: 114.9 | N344: 71.69 | O344: 4.0000000000000001e-003 | P344: 213.42 | Q344: 转股中 | R344: 4.24年 | S344: 3.24年 | T344: 3.46 | U344: 124 | V344: 0.16800000000000001 | W344: 4.0000000000000001e-003 | X344: 8.0000000000000002e-003 | Y344: 922 | Z344: 7.61 | AA344: -0.13900000000000001 | AB344: -0.14400000000000002 | AC344: -0.109 | AD344: -0.11 | AE344: 91.7 | AF344: 96.89 | AG344: 0.97 | AH344: AA | AI344: 4.2000000000000003e-002 | AJ344: =H344+100*O344 -> 214.74000000000001 | AK344: 215.3 | AL344: 342 | AM344: 118.4 | AN344: 339 | AO344: -2.5000000000000001e-002 | AP344: 14 | AQ344: 欧派转债!
A345: 157 | B345: 128111 | C345: 中矿转债! | D345: 2738 | E345: 中矿资源 | F345: 有色金属 | G345: 有色行业 | H345: 261.936 | I345: 0.217 | J345: -0.121 | K345: 36.11 | L345: 9.9900000000000003e-002 | M345: 124.7 | N345: 15.47 | O345: 0.122 | P345: 233.42 | Q345: 转股中 | R345: 5年20天 | S345: 3年21天 | T345: 1.72 | U345: 3510. | V345: 8.0199999999999996 | W345: 1.4999999999999999e-002 | X345: 3.5000000000000003e-002 | Y345: 116 | Z345: 3.4 | AA345: -0.13900000000000001 | AB345: -0.14599999999999999 | AC345: -0.14199999999999999 | AD345: -0.14199999999999999 | AE345: 85.8 | AF345: 91.7 | AG345: 0.97 | AH345: AA- | AI345: 6.4399999999999999e-002 | AJ345: =H345+100*O345 -> 274.13599999999997 | AK345: 290.5 | AL345: 349 | AM345: 198.8 | AN345: 349 | AO345: 0.13699999999999998 | AP345: 8 | AQ345: 中矿转债!
A346: 331 | B346: 128033 | C346: 迪龙转债! | D346: 2658 | E346: 雪迪龙 | F346: 城市公用 | G346: 三废处理 | H346: 160.54 | I346: -8.9999999999999998e-004 | J346: -2.0999999999999999e-003 | K346: 10.91 | L346: -3.7000000000000002e-003 | M346: 108.8 | N346: 8.71 | O346: 0.28199999999999997 | P346: 125.26 | Q346: 转股中 | R346: 2.60年 | S346: 0.60年 | T346: 2.98 | U346: 4273. | V346: 8.7799999999999994 | W346: 4.2999999999999997e-002 | X346: 5.4000000000000006e-002 | Y346: 69 | Z346: 2.88 | AA346: -0.14099999999999999 | AB346: -0.14599999999999999 | AC346: -0.48999999999999999 | AD346: -0.49200000000000005 | AE346: 98.52 | AF346: 98.32 | AG346: 0.8 | AH346: AA | AI346: 4.0300000000000002e-002 | AJ346: =H346+100*O346 -> 188.73999999999998 | AK346: 195.8 | AL346: 332 | AM346: 97.3 | AN346: 332 | AO346: 0.11599999999999999 | AP346: 37 | AQ346: 迪龙转债!
A347: 167 | B347: 113582 | C347: 火炬转债! | D347: 603678 | E347: 火炬电子 | F347: 电子 | G347: 元器件制 | H347: 246.44 | I347: -1.3300000000000001e-002 | J347: -6.5000000000000006e-003 | K347: 59.3 | L347: -2.0299999999999999e-002 | M347: 115.3 | N347: 25.33 | O347: 5.2999999999999999e-002 | P347: 234.11 | Q347: 转股中 | R347: 5年5.1天 | S347: 3年6.1天 | T347: 4.18 | U347: 68 | V347: 6.6000000000000003e-002 | W347: 1.4999999999999999e-002 | X347: 3.6000000000000004e-002 | Y347: 273 | Z347: 6.71 | AA347: -0.14300000000000002 | AB347: -0.14699999999999999 | AC347: -0.13900000000000001 | AD347: -0.13900000000000001 | AE347: 90.82 | AF347: 93.62 | AG347: 0.97 | AH347: AA | AI347: 4.3400000000000001e-002 | AJ347: =H347+100*O347 -> 251.74000000000001 | AK347: 258.8 | AL347: 347 | AM347: 165.2 | AN347: 346 | AO347: 4.2000000000000003e-002 | AP347: 6 | AQ347: 火炬转债!
A348: 169 | B348: 113580 | C348: 康隆转债! | D348: 603665 | E348: 康隆达 | F348: 服装纺织 | G348: 服装行业 | H348: 274.69 | I348: 8.3999999999999995e-003 | J348: -1.9900000000000001e-002 | K348: 14.67 | L348: -2.e-002 | M348: 120.8 | N348: 15.51 | O348: 1.8999999999999999 | P348: 94.58 | Q348: 转股中 | R348: 4.92年 | S348: 2.92年 | T348: 0.41 | U348: 224 | V348: 1.97 | W348: 1.8000000000000002e-002 | X348: 1.7000000000000001e-002 | Y348: 23 | Z348: 2.13 | AA348: -0.156 | AB348: -0.16200000000000001 | AC348: -0.156 | AD348: -0.157 | AE348: 86.03 | AF348: 89.99 | AG348: 0.57 | AH348: AA- | AI348: 6.3e-002 | AJ348: =H348+100*O348 -> 464.69 | AK348: 454.8 | AL348: 357 | AM348: 364.8 | AN348: 357 | AO348: -5.7999999999999996e-002 | AP348: 9 | AQ348: 康隆转债!
A349: 245 | B349: 123031 | C349: 晶瑞转债! | D349: 300655 | E349: 晶瑞股份 | F349: 化工 | G349: 化工 | H349: 253.461 | I349: 5.3e-003 | J349: -2.4500000000000001e-002 | K349: 20.49 | L349: -2.0099999999999996e-002 | M349: 115.8 | N349: 10.13 | O349: 0.253 | P349: 202.27 | Q349: 转股中 | R349: 4.27年 | S349: 2.27年 | T349: 0.63 | U349: 339 | V349: 2.1200000000000001 | W349: 9.0000000000000011e-003 | X349: 1.8000000000000002e-002 | Y349: 70 | Z349: 2.91 | AA349: -0.17000000000000001 | AB349: -0.17499999999999999 | AC349: -0.20600000000000002 | AD349: -0.20699999999999999 | AE349: 86.94 | AF349: 85.91 | AG349: 0.96 | AH349: A+ | AI349: 7.400000000000001e-002 | AJ349: =H349+100*O349 -> 278.76100000000002 | AK349: 304.7 | AL349: 350 | AM349: 217.7 | AN349: 350 | AO349: -0.26800000000000002 | AP349: 16 | AQ349: 晶瑞转债!
A350: 319 | B350: 113509 | C350: 新泉转债!! | D350: 603179 | E350: 新泉股份 | F350: 汽车 | G350: 零部件制 | H350: 196.32 | I350: -8.199999999999999e-003 | J350: 6.0999999999999995e-003 | K350: 28.14 | L350: -2.0999999999999999e-003 | M350: 110.3 | N350: 15.25 | O350: 6.4000000000000001e-002 | P350: 184.52 | Q350: 转股中 | R350: 3年13天 | S350: 1年14天 | T350: 0.84 | U350: 66 | V350: 0.39700000000000002 | W350: 8.0000000000000002e-003 | X350: 1.4999999999999999e-002 | Y350: 104 | Z350: 2.93 | AA350: -0.17600000000000002 | AB350: -0.17999999999999999 | AC350: -0.38900000000000001 | AD350: -0.39100000000000001 | AE350: 97.88 | AF350: 97.64 | AG350: 0.97 | AH350: AA | AI350: 4.2000000000000003e-002 | AJ350: =H350+100*O350 -> 202.72 | AK350: 208.1 | AL350: 337 | AM350: 110.2 | AN350: 336 | AO350: -2.3e-002 | AP350: 11 | AQ350: 新泉转债!!
A351: 293 | B351: 123018 | C351: 溢利转债! | D351: 300381 | E351: 溢多利 | F351: 医药 | G351: 原料药 | H351: 233.4 | I351: 1.7000000000000001e-003 | J351: -1.06e-002 | K351: 9.14 | L351: -1.3000000000000001e-002 | M351: 114.3 | N351: 8.32 | O351: 1.1200000000000001 | P351: 109.86 | Q351: 转股中 | R351: 3.58年 | S351: 1.58年 | T351: 0.54 | U351: 145 | V351: 1.1599999999999999 | W351: 1.2e-002 | X351: 1.3000000000000001e-002 | Y351: 45 | Z351: 1.49 | AA351: -0.183 | AB351: -0.18899999999999997 | AC351: -0.29499999999999998 | AD351: -0.29600000000000004 | AE351: 92.46 | AF351: 92.23 | AG351: 0.68 | AH351: AA- | AI351: 6.3e-002 | AJ351: =H351+100*O351 -> 345.40000000000003 | AK351: 356.9 | AL351: 351 | AM351: 264.5 | AN351: 351 | AO351: -2.6000000000000002e-002 | AP351: 12 | AQ351: 溢利转债!
A352: 352 | B352: 127004 | C352: 模塑转债!! | D352: 700 | E352: 模塑科技 | F352: 汽车 | G352: 零部件制 | H352: 173.04 | I352: 1.1899999999999999e-002 | J352: -1.1399999999999999e-002 | K352: 5.6 | L352: 1.4499999999999999e-002 | M352: 113.3 | N352: 7.46 | O352: 1.3100000000000001 | P352: 75.07 | Q352: 转股中 | R352: 2年12天 | S352: 12天 | T352: 1.32 | U352: 475 | V352: 2.0600000000000001 | W352: 2.6000000000000002e-002 | X352: 1.9e-002 | Y352: 51 | Z352: 1.84 | AA352: -0.191 | AB352: -0.20000000000000001 | AC352: -2.2469999999999999 | AD352: -2.2549999999999999 | AE352: 101.01 | AF352: 101 | AG352: 0.04 | AH352: AA | AI352: 4.0300000000000002e-002 | AJ352: =H352+100*O352 -> 304.03999999999996 | AK352: 271 | AL352: 348 | AM352: 170 | AN352: 348 | AO352: 5.7000000000000002e-002 | AP352: 33 | AQ352: 模塑转债!!
A353: 305 | B353: 123015 | C353: 蓝盾转债!! | D353: 300297 | E353: 蓝盾股份 | F353: 计算机及 | G353: 软件开发 | H353: 228.56 | I353: 6.8999999999999999e-003 | J353: -6.8999999999999999e-003 | K353: 3.34 | L353: 9.1000000000000004e-003 | M353: 112.3 | N353: 5.79 | O353: 2.96 | P353: 57.69 | Q353: 转股中 | R353: 3.23年 | S353: 1.23年 | T353: 1 | U353: 893 | V353: 3.7999999999999998 | W353: 2.4e-002 | X353: 1.3999999999999999e-002 | Y353: 42 | Z353: 1.6 | AA353: -0.20100000000000001 | AB353: -0.20600000000000002 | AC353: -0.379 | AD353: -0.38 | AE353: 94.47 | AF353: 92.61 | AG353: 0 | AH353: AA- | AI353: 6.3e-002 | AJ353: =H353+100*O353 -> 524.55999999999995 | AK353: 399.4 | AL353: 354 | AM353: 305 | AN353: 354 | AO353: -6.2e-002 | AP353: 17 | AQ353: 蓝盾转债!!
A354: 292 | B354: 113526 | C354: 联泰转债! | D354: 603797 | E354: 联泰环保 | F354: 城市公用 | G354: 三废处理 | H354: 272.67 | I354: -1.1000000000000001e-002 | J354: 1.6200000000000003e-002 | K354: 7.6 | L354: 6.6e-003 | M354: 110.3 | N354: 6.11 | O354: 1.1899999999999999 | P354: 124.39 | Q354: 转股中 | R354: 3.68年 | S354: 1.68年 | T354: 1.93 | U354: 55 | V354: 0.10400000000000001 | W354: 5.5999999999999994e-002 | X354: 7.0000000000000007e-002 | Y354: 34 | Z354: 2 | AA354: -0.221 | AB354: -0.22399999999999998 | AC354: -0.309 | AD354: -0.31 | AE354: 95.68 | AF354: 95.75 | AG354: 0.78 | AH354: AA+ | AI354: 4.0000000000000001e-002 | AJ354: =H354+100*O354 -> 391.67000000000002 | AK354: 421 | AL354: 355 | AM354: 325.2 | AN354: 355 | AO354: 3.0000000000000001e-003 | AP354: 9 | AQ354: 联泰转债!
A355: 316 | B355: 110044 | C355: 广电转债!! | D355: 600831 | E355: 广电网络 | F355: 传媒娱乐 | G355: 影视娱乐 | H355: 258.64 | I355: 1.e-004 | J355: -2.0999999999999999e-003 | K355: 6.35 | L355: -4.6999999999999993e-003 | M355: 112.3 | N355: 6.9 | O355: 1.8100000000000001 | P355: 92.03 | Q355: 转股中 | R355: 3年36天 | S355: 1年37天 | T355: 0.71 | U355: 228 | V355: 1.24 | W355: 1.6e-002 | X355: 1.3999999999999999e-002 | Y355: 45 | Z355: 1.21 | AA355: -0.23899999999999999 | AB355: -0.24399999999999999 | AC355: -0.46399999999999997 | AD355: -0.46500000000000002 | AE355: 97.63 | AF355: 99.14 | AG355: 0.42 | AH355: AA | AI355: 4.2000000000000003e-002 | AJ355: =H355+100*O355 -> 439.63999999999999 | AK355: 425.3 | AL355: 356 | AM355: 326.1 | AN355: 356 | AO355: 7.2000000000000008e-002 | AP355: 11 | AQ355: 广电转债!!
A356: 258 | B356: 123027 | C356: 蓝晓转债! | D356: 300487 | E356: 蓝晓科技 | F356: 化工 | G356: 化工 | H356: 362.511 | I356: -1.9e-002 | J356: -1.77e-002 | K356: 70.2 | L356: -3.78e-002 | M356: 119.5 | N356: 29.22 | O356: 0.50900000000000001 | P356: 240.25 | Q356: 转股中 | R356: 4年20天 | S356: 2年21天 | T356: 1.07 | U356: 2319. | V356: 5.8799999999999999 | W356: 6.9999999999999993e-003 | X356: 1.7000000000000001e-002 | Y356: 154 | Z356: 8.36 | AA356: -0.24399999999999999 | AB356: -0.249 | AC356: -0.28000000000000003 | AD356: -0.28100000000000003 | AE356: 89.3 | AF356: 90.22 | AG356: 0.97 | AH356: A+ | AI356: 7.400000000000001e-002 | AJ356: =H356+100*O356 -> 413.411 | AK356: 484.8 | AL356: 358 | AM356: 394.6 | AN356: 358 | AO356: 0.439 | AP356: 20 | AQ356: 蓝晓转债!
A357: 312 | B357: 128041 | C357: 盛路转债!! | D357: 2446 | E357: 盛路通信 | F357: 通信互联 | G357: 通信设备 | H357: 291.818 | I357: -1.e-003 | J357: 4.0000000000000001e-003 | K357: 5.9 | L357: 8.5000000000000006e-003 | M357: 114.3 | N357: 6.82 | O357: 2.3700000000000001 | P357: 86.51 | Q357: 转股中 | R357: 3年56天 | S357: 1年57天 | T357: 0.53 | U357: 49 | V357: 0.317 | W357: 1.e-002 | X357: 9.0000000000000011e-003 | Y357: 54 | Z357: 1.74 | AA357: -0.26100000000000001 | AB357: -0.26600000000000001 | AC357: -0.47499999999999998 | AD357: -0.47600000000000003 | AE357: 97.41 | AF357: 100.68 | AG357: 0.36 | AH357: AA | AI357: 4.2000000000000003e-002 | AJ357: =H357+100*O357 -> 528.81799999999998 | AK357: 497.1 | AL357: 359 | AM357: 396.4 | AN357: 359 | AO357: -3.0000000000000001e-003 | AP357: 13 | AQ357: 盛路转债!!
A358: 335 | B358: 128030 | C358: 天康转债!! | D358: 2100 | E358: 天康生物 | F358: 农业 | G358: 畜牧业 | H358: 245.89 | I358: 0. | J358: -4.1999999999999997e-003 | K358: 9.58 | L358: -4.1999999999999997e-003 | M358: 111.3 | N358: 7.85 | O358: 1.01 | P358: 122.04 | Q358: 转股中 | R358: 2.59年 | S358: 0.59年 | T358: 0.94 | U358: 6.6 | V358: 2.8999999999999998e-002 | W358: 9.0000000000000011e-003 | X358: 1.1000000000000001e-002 | Y358: 103 | Z358: 1.57 | AA358: -0.26700000000000002 | AB358: -0.27200000000000002 | AC358: -0.79599999999999993 | AD358: -0.79799999999999993 | AE358: 98.82 | AF358: 100.65 | AG358: 1 | AH358: AA | AI358: 4.0300000000000002e-002 | AJ358: =H358+100*O358 -> 346.88999999999999 | AK358: 369.7 | AL358: 352 | AM358: 269.1 | AN358: 352 | AO358: -4.4000000000000004e-002 | AP358: 11 | AQ358: 天康转债!!
A359: 336 | B359: 128029 | C359: 太阳转债!! | D359: 2078 | E359: 太阳纸业 | F359: 造纸包装 | G359: 造纸行业 | H359: 192.821 | I359: -3.3e-003 | J359: 8.6e-003 | K359: 14.98 | L359: 5.4000000000000003e-003 | M359: 107 | N359: 8.55 | O359: 0.10099999999999999 | P359: 175.2 | Q359: 转股中 | R359: 1.59年 | S359: 回售内 | T359: 9.09 | U359: 107 | V359: 5.9999999999999998e-002 | W359: 2.3e-002 | X359: 4.0999999999999995e-002 | Y359: 393 | Z359: 2.3 | AA359: -0.311 | AB359: -0.316 | AC359: 回售内 | AD359: 回售内 | AE359: 100.17 | AF359: 100.83 | AG359: 1 | AH359: AA+ | AI359: 3.8300000000000001e-002 | AJ359: =H359+100*O359 -> 202.92099999999999 | AK359: 210.4 | AL359: 339 | AM359: 109.6 | AN359: 335 | AO359: -4.2000000000000003e-002 | AP359: 7 | AQ359: 太阳转债!!
A360: 309 | B360: 123013 | C360: 横河转债! | D360: 300539 | E360: 横河精密 | F360: 机械装备 | G360: 专用设备 | H360: 372.68 | I360: -7.4999999999999997e-003 | J360: 3.3e-003 | K360: 7.46 | L360: -1.06e-002 | M360: 115.2 | N360: 9.13 | O360: 3.5600000000000001 | P360: 81.71 | Q360: 转股中 | R360: 3.18年 | S360: 1.18年 | T360: 0.38 | U360: 82 | V360: 0.57700000000000007 | W360: 2.3e-002 | X360: 1.9e-002 | Y360: 17 | Z360: 3.34 | AA360: -0.313 | AB360: -0.318 | AC360: -0.51900000000000002 | AD360: -0.52000000000000002 | AE360: 94 | AF360: 92.38 | AG360: 0.4 | AH360: A+ | AI360: 7.400000000000001e-002 | AJ360: =H360+100*O360 -> 728.68000000000006 | AK360: 663.7 | AL360: 360 | AM360: 569.7 | AN360: 360 | AO360: 5.0000000000000003e-002 | AP360: 15 | AQ360: 横河转债!
A361: 347 | B361: 113016 | C361: 小康转债!! | D361: 601127 | E361: 小康股份 | F361: 汽车 | G361: 零部件制 | H361: 372.43 | I361: 2.3300000000000001e-002 | J361: -2.2599999999999999e-002 | K361: 57.67 | L361: 7.000000000000001e-004 | M361: 109.3 | N361: 15.7 | O361: 1.3999999999999999e-002 | P361: 367.32 | Q361: 转股中 | R361: 2.46年 | S361: 0.46年 | T361: 3.13 | U361: 5338. | V361: 4.5499999999999998 | W361: 4.0000000000000001e-003 | X361: 1.4999999999999999e-002 | Y361: 745 | Z361: 15.89 | AA361: -0.39600000000000002 | AB361: -0.39899999999999997 | AC361: -1.198 | AD361: -1.2 | AE361: 99.31 | AF361: 99.34 | AG361: 0.99 | AH361: AA | AI361: 4.0300000000000002e-002 | AJ361: =H361+100*O361 -> 373.82999999999998 | AK361: 377.5 | AL361: 353 | AM361: 278.2 | AN361: 353 | AO361: 0.126 | AP361: 44 | AQ361: 小康转债!!
A362: 249 | B362: 123029 | C362: 英科转债! | D362: 300677 | E362: 英科医疗 | F362: 医药 | G362: 医疗器械 | H362: 1689.54 | I362: -2.5099999999999997e-002 | J362: 3.4999999999999996e-003 | K362: 140.7 | L362: -2.1700000000000001e-002 | M362: 138.2 | N362: 8.32 | O362: -1.e-003 | P362: 1691.11 | Q362: 转股中 | R362: 4.24年 | S362: 2.24年 | T362: 0.4 | U362: 342 | V362: 0.501 | W362: 1.e-003 | X362: 1.3999999999999999e-002 | Y362: 497 | Z362: 3.78 | AA362: -0.41499999999999998 | AB362: -0.41899999999999998 | AC362: -0.33500000000000002 | AD362: -0.33500000000000002 | AE362: 97.38 | AF362: 116.85 | AG362: 0.99 | AH362: AA | AI362: 4.2000000000000003e-002 | AJ362: =H362+100*O362 -> 1689.4400000000001 | AK362: 1688. | AL362: 361 | AM362: 1571.0999999999999 | AN362: 361 | AO362: -8.5999999999999993e-002 | AP362: 16 | AQ362: 英科转债!