A1: 序号 | B1: 转债代码 | C1: 转债名称 | D1: 股票代码 | E1: 股票名称 | F1: 行业 | G1: 子行业 | H1: 转债价格 | I1: 涨跌 | J1: 日内套利 | K1: 股价 | L1: 涨跌 | M1: 剩余本息 | N1: 转股价格 | O1: 转股溢价率 | P1: 转股价值 | Q1: 距离转股日 | R1: 剩余年限 | S1: 回售年限 | T1: 转债余额 | U1: 转债成交额 | V1: 转债换手率 | W1: 余额/市值 | X1: 余额/股本 | Y1: 股票市值 | Z1: P/B | AA1: 税前收益率 | AB1: 税后收益率 | AC1: 税前回售收益 | AD1: 税后回售收益 | AE1: 回售价值 | AF1: 纯债价值 | AG1: 弹性 | AH1: 信用 | AI1: 折现率 | AJ1: 双低 | AK1: 老式双低 | AL1: 老式排名 | AM1: 新式双低 | AN1: 新式排名 | AO1: MA20乖离 | AP1: 热门度 | AQ1: 转债名称
A2: 1 | B2: 113632 | C2: 鹤21转债 | D2: 603733 | E2: 仙鹤股份 | F2: 造纸包装 | G2: 造纸行业 | H2: 134.26 | I2: 2.52e-002 | J2: -2.9999999999999999e-002 | K2: 36.8 | L2: -8.8999999999999999e-003 | M2: 117.1 | N2: 39.09 | O2: 0.42599999999999999 | P2: 94.14 | Q2: 5月13天 | R2: 5.93年 | S2: 3.93年 | T2: 20.5 | U2: 423 | V2: 0.157 | W2: 7.9000000000000001e-002 | X2: 7.400000000000001e-002 | Y2: 260 | Z2: 4.3 | AA2: -2.3099999999999999e-002 | AB2: -2.7999999999999997e-002 | AC2: -6.1699999999999998e-002 | AD2: -6.3200000000000006e-002 | AE2: 87.7 | AF2: 92.22 | AG2: 0.54 | AH2: AA | AI2: 4.1799999999999997e-002 | AJ2: =H2+100*O2 -> 176.85999999999999 | AK2: 174.4 | AL2: 275 | AM2: 82.2 | AN2: 273 | AO2: -4.2999999999999997e-002 | AP2: 0 | AQ2: 鹤21转债
A3: 2 | B3: 127050 | C3: 麒麟转债 | D3: 2984 | E3: 森麒麟 | F3: 汽车 | G3: 零部件制 | H3: 145.01 | I3: 4.8999999999999998e-003 | J3: -1.e-002 | K3: 36.76 | L3: -8.1000000000000013e-003 | M3: 115.1 | N3: 34.85 | O3: 0.375 | P3: 105.48 | Q3: 5月7天 | R3: 5.92年 | S3: 3.92年 | T3: 22 | U3: 78 | V3: 2.5000000000000001e-002 | W3: 9.1999999999999998e-002 | X3: 9.6999999999999989e-002 | Y3: 239 | Z3: 3.91 | AA3: -3.8900000000000004e-002 | AB3: -4.3099999999999999e-002 | AC3: -7.9500000000000001e-002 | AD3: -8.1000000000000003e-002 | AE3: 87.76 | AF3: 90.71 | AG3: 0.64 | AH3: AA | AI3: 4.1799999999999997e-002 | AJ3: =H3+100*O3 -> 182.50999999999999 | AK3: 184.5 | AL3: 296 | AM3: 93.8 | AN3: 300 | AO3: 2.9999999999999999e-002 | AP3: 2 | AQ3: 麒麟转债
A4: 3 | B4: 110083 | C4: N苏租转 | D4: 600901 | E4: 江苏租赁 | F4: 金融 | G4: 其他 | H4: 116.97 | I4: 0.17000000000000001 | J4: 0. | K4: 5.13 | L4: -5.7999999999999996e-003 | M4: 110.5 | N4: 5.42 | O4: 0.23600000000000002 | P4: 94.65 | Q4: 5月7天 | R4: 5.92年 | S4: 无权 | T4: 50 | U4: 2572. | V4: 0.439 | W4: 0.32600000000000001 | X4: 0.309 | Y4: 153 | Z4: 1.12 | AA4: -9.7000000000000003e-003 | AB4: -1.29e-002 | AC4: 无权 | AD4: 无权 | AE4: 无权 | AF4: 90.47 | AG4: 0.55 | AH4: AAA | AI4: 3.4799999999999998e-002 | AJ4: =H4+100*O4 -> 140.56999999999999 | AK4: 139.3 | AL4: 34 | AM4: 48.8 | AN4: 81 | AO4: 5.0000000000000001e-003 | AP4: 2 | AQ4: N苏租转
A5: 4 | B5: 123130 | C5: 设研转债 | D5: 300732 | E5: 设研院 | F5: 建筑 | G5: 建筑工程 | H5: 128.999 | I5: 3.4999999999999996e-003 | J5: -4.0999999999999995e-003 | K5: 12 | L5: -8.0000000000000004e-004 | M5: 117.1 | N5: 11.24 | O5: 0.20800000000000002 | P5: 106.76 | Q5: 5月7天 | R5: 5.92年 | S5: 3.92年 | T5: 3.76 | U5: 29 | V5: 5.9000000000000004e-002 | W5: 0.114 | X5: 0.122 | Y5: 33 | Z5: 1.3 | AA5: -1.6500000000000001e-002 | AB5: -2.1400000000000002e-002 | AC5: -5.2600000000000001e-002 | AD5: -5.4199999999999998e-002 | AE5: 87.76 | AF5: 92.28 | AG5: 0.64 | AH5: AA | AI5: 4.1799999999999997e-002 | AJ5: =H5+100*O5 -> 149.79900000000001 | AK5: 151.2 | AL5: 138 | AM5: 59 | AN5: 148 | AO5: 1.1000000000000001e-002 | AP5: 2 | AQ5: 设研转债
A6: 5 | B6: 111001 | C6: 山玻转债 | D6: 605006 | E6: 山东玻纤 | F6: 其他 | G6: 非金属矿 | H6: 128.41 | I6: -4.4000000000000003e-003 | J6: 2.0999999999999999e-003 | K6: 14.02 | L6: -3.5999999999999999e-003 | M6: 120.1 | N6: 13.91 | O6: 0.27399999999999997 | P6: 100.79 | Q6: 5月2天 | R6: 5.91年 | S6: 3.91年 | T6: 6 | U6: 28 | V6: 3.7000000000000005e-002 | W6: 8.5999999999999993e-002 | X6: 8.5999999999999993e-002 | Y6: 70 | Z6: 3.25 | AA6: -1.1399999999999999e-002 | AB6: -1.72e-002 | AC6: -5.16e-002 | AD6: -5.3200000000000004e-002 | AE6: 80.99 | AF6: 84.32 | AG6: 0.66 | AH6: AA- | AI6: 6.2800000000000009e-002 | AJ6: =H6+100*O6 -> 155.81 | AK6: 156 | AL6: 178 | AM6: 71.7 | AN6: 231 | AO6: -4.9000000000000002e-002 | AP6: 1 | AQ6: 山玻转债
A7: 6 | B7: 113631 | C7: N皖天转 | D7: 603689 | E7: 皖天然气 | F7: 石油天然 | G7: 天然气 | H7: 118.9 | I7: 0.18899999999999997 | J7: 0. | K7: 10.35 | L7: -1.43e-002 | M7: 114.5 | N7: 11.12 | O7: 0.27699999999999997 | P7: 93.08 | Q7: 5月2天 | R7: 5.91年 | S7: 3.91年 | T7: 9.3 | U7: 504 | V7: 0.45399999999999996 | W7: 0.26700000000000002 | X7: 0.249 | Y7: 35 | Z7: 1.41 | AA7: -6.4000000000000003e-003 | AB7: -1.0800000000000001e-002 | AC7: -3.4799999999999998e-002 | AD7: -3.61e-002 | AE7: 88.97 | AF7: 92.76 | AG7: 0.51 | AH7: AA+ | AI7: 3.6799999999999999e-002 | AJ7: =H7+100*O7 -> 146.59999999999999 | AK7: 144.7 | AL7: 75 | AM7: 52 | AN7: 106 | AO7: 5.0000000000000001e-003 | AP7: 1 | AQ7: N皖天转
A8: 7 | B8: 123129 | C8: 锦鸡转债 | D8: 300798 | E8: 锦鸡股份 | F8: 化工 | G8: 其他 | H8: 121.01 | I8: 8.6e-003 | J8: 5.7999999999999996e-003 | K8: 9.6 | L8: 2.1299999999999999e-002 | M8: 117.8 | N8: 9.53 | O8: 0.20100000000000001 | P8: 100.73 | Q8: 5月0天 | R8: 5.90年 | S8: 3.90年 | T8: 6 | U8: 26 | V8: 3.6000000000000004e-002 | W8: 0.14999999999999999 | X8: 0.151 | Y8: 40 | Z8: 3.21 | AA8: -4.5999999999999999e-003 | AB8: -9.8999999999999991e-003 | AC8: -3.7100000000000001e-002 | AD8: -3.8900000000000004e-002 | AE8: 81.29 | AF8: 82.84 | AG8: 0.68 | AH8: AA- | AI8: 6.2800000000000009e-002 | AJ8: =H8+100*O8 -> 141.11000000000001 | AK8: 141.3 | AL8: 43 | AM8: 58.4 | AN8: 143 | AO8: -1.e-003 | AP8: 2 | AQ8: 锦鸡转债
A9: 8 | B9: 127049 | C9: 希望转2 | D9: 876 | E9: 新 希 望 | F9: 农业 | G9: 畜牧业 | H9: 128.73 | I9: -5.0000000000000001e-004 | J9: -1.5e-003 | K9: 14.7 | L9: -3.4000000000000002e-003 | M9: 111.2 | N9: 14.45 | O9: 0.26500000000000001 | P9: 101.73 | Q9: 4月28天 | R9: 5.89年 | S9: 3.89年 | T9: 81.5 | U9: 71 | V9: 6.9999999999999993e-003 | W9: 0.12300000000000001 | X9: 0.125 | Y9: 662 | Z9: 2.17 | AA9: -2.4900000000000002e-002 | AB9: -2.8199999999999999e-002 | AC9: -5.4000000000000006e-002 | AD9: -5.5300000000000002e-002 | AE9: 89.6 | AF9: 91.16 | AG9: 0.6 | AH9: AAA | AI9: 3.4799999999999998e-002 | AJ9: =H9+100*O9 -> 155.22999999999999 | AK9: 155.7 | AL9: 172 | AM9: 64.6 | AN9: 185 | AO9: -2.e-002 | AP9: 6 | AQ9: 希望转2
A10: 9 | B10: 123128 | C10: 首华转债! | D10: 300483 | E10: 首华燃气 | F10: 石油天然 | G10: 天然气 | H10: 110.8 | I10: 2.7000000000000001e-003 | J10: -1.e-003 | K10: 17.47 | L10: 5.7999999999999996e-003 | M10: 115.1 | N10: 25.02 | O10: 0.58700000000000008 | P10: 69.82 | Q10: 4月25天 | R10: 5.89年 | S10: 3.89年 | T10: 13.8 | U10: 29 | V10: 1.9e-002 | W10: 0.29399999999999998 | X10: 0.20499999999999999 | Y10: 47 | Z10: 1.67 | AA10: 6.6e-003 | AB10: 2.e-003 | AC10: -1.6500000000000001e-002 | AD10: -1.8200000000000001e-002 | AE10: 87.86 | AF10: 90.82 | AG10: 0.3 | AH10: AA | AI10: 4.1799999999999997e-002 | AJ10: =H10+100*O10 -> 169.5 | AK10: 151.8 | AL10: 142 | AM10: 61 | AN10: 159 | AO10: -7.0999999999999994e-002 | AP10: 5 | AQ10: 首华转债!
A11: 10 | B11: 123127 | C11: 耐普转债 | D11: 300818 | E11: 耐普矿机 | F11: 机械装备 | G11: 专用设备 | H11: 121.23 | I11: 6.7000000000000002e-003 | J11: 1.9e-003 | K11: 35.34 | L11: 1.23e-002 | M11: 116.2 | N11: 37 | O11: 0.26899999999999996 | P11: 95.51 | Q11: 4月24天 | R11: 5.88年 | S11: 3.88年 | T11: 4 | U11: 11 | V11: 2.3e-002 | W11: 0.16200000000000001 | X11: 0.154 | Y11: 25 | Z11: 2.63 | AA11: -7.3000000000000001e-003 | AB11: -1.21e-002 | AC11: -3.6799999999999999e-002 | AD11: -3.8699999999999998e-002 | AE11: 78.39 | AF11: 77.14 | AG11: 0.7 | AH11: A+ | AI11: 7.3800000000000004e-002 | AJ11: =H11+100*O11 -> 148.13 | AK11: 146.9 | AL11: 91 | AM11: 68.6 | AN11: 210 | AO11: -2.9999999999999999e-002 | AP11: 3 | AQ11: 耐普转债
A12: 11 | B12: 110082 | C12: 宏发转债 | D12: 600885 | E12: 宏发股份 | F12: 能源电力 | G12: 电力设备 | H12: 139.45 | I12: 6.0999999999999995e-003 | J12: -3.0000000000000001e-003 | K12: 74.67 | L12: 5.1000000000000004e-003 | M12: 117.1 | N12: 72.28 | O12: 0.34999999999999998 | P12: 103.31 | Q12: 4月23天 | R12: 5.88年 | S12: 3.88年 | T12: 20 | U12: 54 | V12: 2.e-002 | W12: 3.6000000000000004e-002 | X12: 3.7000000000000005e-002 | Y12: 556 | Z12: 9.15 | AA12: -2.9700000000000001e-002 | AB12: -3.4599999999999999e-002 | AC12: -7.1300000000000002e-002 | AD12: -7.2800000000000004e-002 | AE12: 87.9 | AF12: 92.43 | AG12: 0.62 | AH12: AA | AI12: 4.1799999999999997e-002 | AJ12: =H12+100*O12 -> 174.44999999999999 | AK12: 175.6 | AL12: 278 | AM12: 83.2 | AN12: 275 | AO12: 6.0000000000000001e-003 | AP12: 3 | AQ12: 宏发转债
A13: 12 | B13: 113630 | C13: 赛伍转债 | D13: 603212 | E13: 赛伍技术 | F13: 能源电力 | G13: 太阳能 | H13: 143.89 | I13: 2.0499999999999997e-002 | J13: -2.5999999999999999e-003 | K13: 33.04 | L13: 2.7400000000000001e-002 | M13: 120.5 | N13: 32.9 | O13: 0.433 | P13: 100.43 | Q13: 4月22天 | R13: 5.88年 | S13: 3.88年 | T13: 7 | U13: 126 | V13: 0.126 | W13: 5.2999999999999999e-002 | X13: 5.2999999999999999e-002 | Y13: 132 | Z13: 6.63 | AA13: -3.0200000000000001e-002 | AB13: -3.5900000000000001e-002 | AC13: -7.8100000000000003e-002 | AD13: -7.9699999999999993e-002 | AE13: 81.36 | AF13: 84.82 | AG13: 0.65 | AH13: AA- | AI13: 6.2800000000000009e-002 | AJ13: =H13+100*O13 -> 187.19 | AK13: 187.4 | AL13: 301 | AM13: 102.5 | AN13: 316 | AO13: -7.2000000000000008e-002 | AP13: 3 | AQ13: 赛伍转债
A14: 13 | B14: 127048 | C14: 中大转债 | D14: 2896 | E14: 中大力德 | F14: 机械装备 | G14: 通用设备 | H14: 145.06 | I14: 4.0000000000000002e-004 | J14: 6.8000000000000005e-003 | K14: 25.02 | L14: 9.7000000000000003e-003 | M14: 121.7 | N14: 22.1 | O14: 0.28100000000000003 | P14: 113.21 | Q14: 4月21天 | R14: 5.87年 | S14: 3.87年 | T14: 2.7 | U14: 20 | V14: 5.0000000000000003e-002 | W14: 0.10400000000000001 | X14: 0.11699999999999999 | Y14: 26 | Z14: 3.56 | AA14: -2.9999999999999999e-002 | AB14: -3.6000000000000004e-002 | AC14: -7.8399999999999997e-002 | AD14: -8.0299999999999996e-002 | AE14: 78.72 | AF14: 80.88 | AG14: 0.74 | AH14: A+ | AI14: 7.3800000000000004e-002 | AJ14: =H14+100*O14 -> 173.16 | AK14: 176.9 | AL14: 282 | AM14: 96 | AN14: 305 | AO14: 5.2000000000000005e-002 | AP14: 2 | AQ14: 中大转债
A15: 14 | B15: 127047 | C15: 帝欧转债 | D15: 2798 | E15: 帝欧家居 | F15: 其他 | G15: 家居用品 | H15: 136 | I15: -1.5900000000000001e-002 | J15: -1.01e-002 | K15: 14.97 | L15: -3.6699999999999997e-002 | M15: 120.4 | N15: 13.53 | O15: 0.22899999999999998 | P15: 110.64 | Q15: 4月19天 | R15: 5.87年 | S15: 3.87年 | T15: 15 | U15: 76 | V15: 3.7000000000000005e-002 | W15: 0.25900000000000001 | X15: 0.28699999999999998 | Y15: 58 | Z15: 1.27 | AA15: -2.0899999999999998e-002 | AB15: -2.6600000000000002e-002 | AC15: -6.5299999999999997e-002 | AD15: -6.6900000000000001e-002 | AE15: 81.28 | AF15: 84.74 | AG15: 0.71 | AH15: AA- | AI15: 6.2800000000000009e-002 | AJ15: =H15+100*O15 -> 158.90000000000001 | AK15: 161.4 | AL15: 209 | AM15: 76.6 | AN15: 252 | AO15: 5.2000000000000005e-002 | AP15: 4 | AQ15: 帝欧转债
A16: 15 | B16: 127046 | C16: 百润转债 | D16: 2568 | E16: 百润股份 | F16: 食品饮料 | G16: 葡萄酒洋 | H16: 140.5 | I16: -7.4000000000000003e-003 | J16: 1.0500000000000001e-002 | K16: 68.56 | L16: 5.0000000000000001e-003 | M16: 115.1 | N16: 66.89 | O16: 0.371 | P16: 102.5 | Q16: 4月2天 | R16: 5.80年 | S16: 3.80年 | T16: 11.3 | U16: 199 | V16: 0.126 | W16: 2.2000000000000002e-002 | X16: 2.2000000000000002e-002 | Y16: 514 | Z16: 14.64 | AA16: -3.4300000000000004e-002 | AB16: -3.8699999999999998e-002 | AC16: -7.4400000000000008e-002 | AD16: -7.5999999999999998e-002 | AE16: 88.19 | AF16: 91.15 | AG16: 0.63 | AH16: AA | AI16: 4.1799999999999997e-002 | AJ16: =H16+100*O16 -> 177.59999999999999 | AK16: 178.5 | AL16: 286 | AM16: 87.4 | AN16: 283 | AO16: 0.126 | AP16: 3 | AQ16: 百润转债
A17: 16 | B17: 113629 | C17: 泉峰转债 | D17: 603982 | E17: 泉峰汽车 | F17: 汽车 | G17: 零部件制 | H17: 191.41 | I17: 3.8e-003 | J17: 1.6000000000000001e-003 | K17: 42.14 | L17: 6.0000000000000001e-003 | M17: 121 | N17: 23.03 | O17: 4.5999999999999999e-002 | P17: 182.98 | Q17: 3月11天 | R17: 5.76年 | S17: 3.76年 | T17: 6.2 | U17: 207 | V17: 0.17399999999999999 | W17: 7.2999999999999995e-002 | X17: 0.13400000000000001 | Y17: 85 | Z17: 5.11 | AA17: -7.7800000000000008e-002 | AB17: -8.3299999999999999e-002 | AC17: -0.13800000000000001 | AD17: -0.13900000000000001 | AE17: 82.01 | AF17: 85.81 | AG17: 0.91 | AH17: AA- | AI17: 6.2800000000000009e-002 | AJ17: =H17+100*O17 -> 196.00999999999999 | AK17: 199.8 | AL17: 320 | AM17: 114 | AN17: 325 | AO17: 5.0000000000000003e-002 | AP17: 4 | AQ17: 泉峰转债
A18: 17 | B18: 123126 | C18: 瑞丰转债! | D18: 300243 | E18: 瑞丰高材 | F18: 化工 | G18: 橡胶塑料 | H18: 116.736 | I18: -9.3999999999999986e-003 | J18: -9.7000000000000003e-003 | K18: 14.18 | L18: -3.73e-002 | M18: 129.6 | N18: 17.8 | O18: 0.46500000000000002 | P18: 79.66 | Q18: 3月5天 | R18: 5.75年 | S18: 3.75年 | T18: 3.4 | U18: 3.7 | V18: 9.0000000000000011e-003 | W18: 0.10300000000000001 | X18: 8.199999999999999e-002 | Y18: 33 | Z18: 4.06 | AA18: 1.89e-002 | AB18: 1.03e-002 | AC18: -2.3e-002 | AD18: -2.6099999999999998e-002 | AE18: 81.06 | AF18: 87.15 | AG18: 0.51 | AH18: A+ | AI18: 7.3800000000000004e-002 | AJ18: =H18+100*O18 -> 163.23599999999999 | AK18: 153.8 | AL18: 158 | AM18: 66.7 | AN18: 193 | AO18: -1.3999999999999999e-002 | AP18: 6 | AQ18: 瑞丰转债!
A19: 18 | B19: 123125 | C19: 元力转债 | D19: 300174 | E19: 元力股份 | F19: 化工 | G19: 化工 | H19: 125.3 | I19: 1.6200000000000003e-002 | J19: -1.1299999999999999e-002 | K19: 17.3 | L19: 6.9999999999999993e-003 | M19: 109.3 | N19: 17.61 | O19: 0.27500000000000002 | P19: 98.24 | Q19: 2月29天 | R19: 5.74年 | S19: 3.74年 | T19: 9 | U19: 49 | V19: 4.2999999999999997e-002 | W19: 0.16699999999999998 | X19: 0.16399999999999998 | Y19: 54 | Z19: 3.08 | AA19: -2.3799999999999998e-002 | AB19: -2.6699999999999998e-002 | AC19: -4.9599999999999998e-002 | AD19: -5.0900000000000001e-002 | AE19: 81.14 | AF19: 77.46 | AG19: 0.71 | AH19: AA- | AI19: 6.2800000000000009e-002 | AJ19: =H19+100*O19 -> 152.80000000000001 | AK19: 152.4 | AL19: 148 | AM19: 71.2 | AN19: 227 | AO19: -1.3000000000000001e-002 | AP19: 4 | AQ19: 元力转债
A20: 19 | B20: 113628 | C20: 晨丰转债 | D20: 603685 | E20: 晨丰科技 | F20: 能源电力 | G20: 电力设备 | H20: 117.5 | I20: 1.1999999999999999e-003 | J20: -4.5999999999999999e-003 | K20: 11.94 | L20: -5.0000000000000001e-003 | M20: 121.7 | N20: 13.06 | O20: 0.28499999999999998 | P20: 91.42 | Q20: 2月18天 | R20: 5.70年 | S20: 3.70年 | T20: 4.15 | U20: 1.9 | V20: 4.0000000000000001e-003 | W20: 0.20600000000000002 | X20: 0.188 | Y20: 20 | Z20: 1.79 | AA20: 6.3e-003 | AB20: -2.0000000000000001e-004 | AC20: -2.9900000000000003e-002 | AD20: -3.2099999999999997e-002 | AE20: 76.93 | AF20: 77.78 | AG20: 0.68 | AH20: A | AI20: 8.3800000000000013e-002 | AJ20: =H20+100*O20 -> 146. | AK20: 143.6 | AL20: 62 | AM20: 65.8 | AN20: 190 | AO20: -1.7000000000000001e-002 | AP20: 9 | AQ20: 晨丰转债
A21: 20 | B21: 123124 | C21: 晶瑞转2! | D21: 300655 | E21: 晶瑞电材 | F21: 电子 | G21: 电子行业 | H21: 132.24 | I21: 8.0000000000000002e-003 | J21: -6.0000000000000001e-003 | K21: 48 | L21: 2.8999999999999998e-003 | M21: 111.2 | N21: 50.31 | O21: 0.38600000000000001 | P21: 95.41 | Q21: 2月11天 | R21: 5.68年 | S21: 3.68年 | T21: 5.23 | U21: 30 | V21: 4.4000000000000004e-002 | W21: 3.2000000000000001e-002 | X21: 3.1e-002 | Y21: 164 | Z21: 11.27 | AA21: -3.04e-002 | AB21: -3.39e-002 | AC21: -6.3799999999999996e-002 | AD21: -6.5099999999999991e-002 | AE21: 78.2 | AF21: 74.64 | AG21: 0.71 | AH21: A+ | AI21: 7.3800000000000004e-002 | AJ21: =H21+100*O21 -> 170.84 | AK21: 169.1 | AL21: 249 | AM21: 90.9 | AN21: 293 | AO21: 5.0000000000000003e-002 | AP21: 6 | AQ21: 晶瑞转2!
A22: 21 | B22: 127044 | C22: 蒙娜转债! | D22: 2918 | E22: 蒙娜丽莎 | F22: 建筑 | G22: 其他建材 | H22: 133.237 | I22: -8.0000000000000004e-004 | J22: -1.6299999999999999e-002 | K22: 26 | L22: -3.1699999999999999e-002 | M22: 117.1 | N22: 27.07 | O22: 0.38700000000000001 | P22: 96.05 | Q22: 2月12天 | R22: 5.68年 | S22: 3.68年 | T22: 11.7 | U22: 68 | V22: 4.4000000000000004e-002 | W22: 0.109 | X22: 0.10400000000000001 | Y22: 108 | Z22: 2.9 | AA22: -2.2799999999999997e-002 | AB22: -2.7900000000000001e-002 | AC22: -6.3799999999999996e-002 | AD22: -6.54e-002 | AE22: 88.62 | AF22: 93.19 | AG22: 0.54 | AH22: AA | AI22: 4.1799999999999997e-002 | AJ22: =H22+100*O22 -> 171.93700000000001 | AK22: 170.4 | AL22: 259 | AM22: 77.2 | AN22: 255 | AO22: 0.105 | AP22: 2 | AQ22: 蒙娜转债!
A23: 22 | B23: 127045 | C23: 牧原转债 | D23: 2714 | E23: 牧原股份 | F23: 农业 | G23: 畜牧业 | H23: 133.37 | I23: -3.9000000000000003e-003 | J23: 5.0000000000000001e-004 | K23: 50.95 | L23: -5.3e-003 | M23: 111.1 | N23: 47.91 | O23: 0.254 | P23: 106.35 | Q23: 2月12天 | R23: 5.68年 | S23: 3.68年 | T23: 95.5 | U23: 61 | V23: 5.0000000000000001e-003 | W23: 3.6000000000000004e-002 | X23: 3.7999999999999999e-002 | Y23: 2681. | Z23: 5.09 | AA23: -3.2099999999999997e-002 | AB23: -3.5499999999999997e-002 | AC23: -6.5700000000000008e-002 | AD23: -6.6900000000000001e-002 | AE23: 89.58 | AF23: 90.76 | AG23: 0.65 | AH23: AA+ | AI23: 3.6799999999999999e-002 | AJ23: =H23+100*O23 -> 158.77000000000001 | AK23: 160.4 | AL23: 197 | AM23: 69.6 | AN23: 218 | AO23: -7.2000000000000008e-002 | AP23: 9 | AQ23: 牧原转债
A24: 23 | B24: 118002 | C24: 天合转债 | D24: 688599 | E24: 天合光能 | F24: 能源电力 | G24: 太阳能 | H24: 173.97 | I24: 3.7599999999999995e-002 | J24: 2.1499999999999998e-002 | K24: 81.11 | L24: 6.7199999999999996e-002 | M24: 120.1 | N24: 50.51 | O24: 8.3000000000000004e-002 | P24: 160.58 | Q24: 2月12天 | R24: 5.67年 | S24: 3.67年 | T24: 52.5 | U24: 1373. | V24: 0.151 | W24: 3.1e-002 | X24: 5.0000000000000003e-002 | Y24: 1677. | Z24: 10.45 | AA24: -6.4199999999999993e-002 | AB24: -6.9699999999999998e-002 | AC24: -0.122 | AD24: -0.12300000000000001 | AE24: 88.65 | AF24: 95.6 | AG24: 0.88 | AH24: AA | AI24: 4.1799999999999997e-002 | AJ24: =H24+100*O24 -> 182.27000000000001 | AK24: 187.4 | AL24: 302 | AM24: 91.8 | AN24: 294 | AO24: 0.107 | AP24: 7 | AQ24: 天合转债
A25: 24 | B25: 127043 | C25: 川恒转债 | D25: 2895 | E25: 川恒股份 | F25: 化工 | G25: 农化 | H25: 169.996 | I25: 5.3699999999999998e-002 | J25: -4.7999999999999996e-003 | K25: 30.53 | L25: 5.79e-002 | M25: 121 | N25: 21.02 | O25: 0.17000000000000001 | P25: 145.24 | Q25: 2月9天 | R25: 5.67年 | S25: 3.67年 | T25: 11.6 | U25: 433 | V25: 0.22399999999999998 | W25: 7.8e-002 | X25: 0.113 | Y25: 149 | Z25: 4.71 | AA25: -5.9200000000000003e-002 | AB25: -6.5000000000000002e-002 | AC25: -0.11699999999999999 | AD25: -0.11800000000000001 | AE25: 82.46 | AF25: 86.28 | AG25: 0.85 | AH25: AA- | AI25: 6.2800000000000009e-002 | AJ25: =H25+100*O25 -> 186.99600000000001 | AK25: 194.7 | AL25: 315 | AM25: 108.5 | AN25: 319 | AO25: 4.0000000000000001e-003 | AP25: 6 | AQ25: 川恒转债
A26: 25 | B26: 123123 | C26: 江丰转债! | D26: 300666 | E26: 江丰电子 | F26: 电子 | G26: 电子行业 | H26: 126 | I26: 0. | J26: -1.23e-002 | K26: 45.01 | L26: -2.0499999999999997e-002 | M26: 121.5 | N26: 51.93 | O26: 0.45399999999999996 | P26: 86.67 | Q26: 2月9天 | R26: 5.67年 | S26: 3.67年 | T26: 5.17 | U26: 20 | V26: 3.1e-002 | W26: 5.0999999999999997e-002 | X26: 4.4000000000000004e-002 | Y26: 102 | Z26: 8.2 | AA26: -6.5000000000000006e-003 | AB26: -1.29e-002 | AC26: -4.82e-002 | AD26: -5.0300000000000004e-002 | AE26: 79.7 | AF26: 81.89 | AG26: 0.6 | AH26: A+ | AI26: 7.3800000000000004e-002 | AJ26: =H26+100*O26 -> 171.40000000000001 | AK26: 165.3 | AL26: 233 | AM26: 83.4 | AN26: 277 | AO26: -1.1000000000000001e-002 | AP26: 6 | AQ26: 江丰转债!
A27: 26 | B27: 127042 | C27: 嘉美转债 | D27: 2969 | E27: 嘉美包装 | F27: 造纸包装 | G27: 包装材料 | H27: 123.055 | I27: 1.8e-003 | J27: 3.0999999999999999e-003 | K27: 5.4 | L27: 7.4999999999999997e-003 | M27: 117.1 | N27: 4.87 | O27: 0.11 | P27: 110.88 | Q27: 2月5天 | R27: 5.66年 | S27: 3.66年 | T27: 7.5 | U27: 9.1 | V27: 1.e-002 | W27: 0.14400000000000002 | X27: 0.16 | Y27: 52 | Z27: 2.37 | AA27: -8.8999999999999999e-003 | AB27: -1.41e-002 | AC27: -4.4299999999999999e-002 | AD27: -4.5999999999999999e-002 | AE27: 88.69 | AF27: 93.26 | AG27: 0.66 | AH27: AA | AI27: 4.1799999999999997e-002 | AJ27: =H27+100*O27 -> 134.05500000000001 | AK27: 135.2 | AL27: 22 | AM27: 42 | AN27: 42 | AO27: -1.7000000000000001e-002 | AP27: 11 | AQ27: 嘉美转债
A28: 27 | B28: 123122 | C28: 富瀚转债 | D28: 300613 | E28: 富瀚微 | F28: 电子 | G28: 芯片制造 | H28: 131.7 | I28: 4.0000000000000001e-003 | J28: -1.8e-003 | K28: 153.96 | L28: 3.4999999999999996e-003 | M28: 120.3 | N28: 177.04 | O28: 0.51400000000000001 | P28: 86.96 | Q28: 2月3天 | R28: 5.65年 | S28: 3.65年 | T28: 5.81 | U28: 41 | V28: 5.4000000000000006e-002 | W28: 3.1e-002 | X28: 2.7000000000000003e-002 | Y28: 185 | Z28: 11.3 | AA28: -1.6200000000000003e-002 | AB28: -2.2099999999999998e-002 | AC28: -6.13e-002 | AD28: -6.2899999999999998e-002 | AE28: 79.15 | AF28: 81.05 | AG28: 0.6 | AH28: A+ | AI28: 7.3800000000000004e-002 | AJ28: =H28+100*O28 -> 183.09999999999999 | AK28: 176.4 | AL28: 279 | AM28: 95.4 | AN28: 302 | AO28: -3.3000000000000002e-002 | AP28: 5 | AQ28: 富瀚转债
A29: 28 | B29: 123121 | C29: 帝尔转债! | D29: 300776 | E29: 帝尔激光 | F29: 机械装备 | G29: 专用设备 | H29: 144.1 | I29: -5.0000000000000001e-004 | J29: -6.0000000000000001e-003 | K29: 219 | L29: -9.0000000000000011e-003 | M29: 121 | N29: 192.24 | O29: 0.26500000000000001 | P29: 113.92 | Q29: 2月2天 | R29: 5.65年 | S29: 3.65年 | T29: 8.4 | U29: 163 | V29: 0.13400000000000001 | W29: 3.6000000000000004e-002 | X29: 4.0999999999999995e-002 | Y29: 233 | Z29: 11.5 | AA29: -3.1e-002 | AB29: -3.7000000000000005e-002 | AC29: -8.2799999999999999e-002 | AD29: -8.4399999999999989e-002 | AE29: 82.56 | AF29: 86.38 | AG29: 0.72 | AH29: AA- | AI29: 6.2800000000000009e-002 | AJ29: =H29+100*O29 -> 170.59999999999999 | AK29: 174.3 | AL29: 274 | AM29: 87.9 | AN29: 285 | AO29: 0.10199999999999999 | AP29: 5 | AQ29: 帝尔转债!
A30: 29 | B30: 123120 | C30: 隆华转债 | D30: 300263 | E30: 隆华科技 | F30: 机械装备 | G30: 通用设备 | H30: 172.397 | I30: 3.6699999999999997e-002 | J30: -2.8199999999999999e-002 | K30: 10.88 | L30: 1.0200000000000001e-002 | M30: 121.1 | N30: 7.76 | O30: 0.23000000000000001 | P30: 140.21 | Q30: 56天 | R30: 5.63年 | S30: 3.63年 | T30: 7.99 | U30: 84 | V30: 6.2e-002 | W30: 8.0000000000000002e-002 | X30: 0.113 | Y30: 99 | Z30: 3.45 | AA30: -6.1900000000000004e-002 | AB30: -6.7599999999999993e-002 | AC30: -0.121 | AD30: -0.122 | AE30: 82.8 | AF30: 86.56 | AG30: 0.83 | AH30: AA- | AI30: 6.2800000000000009e-002 | AJ30: =H30+100*O30 -> 195.39699999999999 | AK30: 204.6 | AL30: 325 | AM30: 118 | AN30: 327 | AO30: -7.5999999999999998e-002 | AP30: 3 | AQ30: 隆华转债
A31: 30 | B31: 110081 | C31: 闻泰转债 | D31: 600745 | E31: 闻泰科技 | F31: 电子 | G31: 电子行业 | H31: 160.32 | I31: 6.3e-003 | J31: -1.0200000000000001e-002 | K31: 134.78 | L31: -4.5000000000000005e-003 | M31: 111.9 | N31: 96.67 | O31: 0.14999999999999999 | P31: 139.42 | Q31: 54天 | R31: 5.63年 | S31: 3.63年 | T31: 86 | U31: 242 | V31: 1.8000000000000002e-002 | W31: 5.0999999999999997e-002 | X31: 7.0999999999999994e-002 | Y31: 1678. | Z31: 5.35 | AA31: -6.25e-002 | AB31: -6.6000000000000003e-002 | AC31: -0.10800000000000001 | AD31: -0.109 | AE31: 89.32 | AF31: 91.52 | AG31: 0.85 | AH31: AA+ | AI31: 3.6799999999999999e-002 | AJ31: =H31+100*O31 -> 175.31999999999999 | AK31: 181.2 | AL31: 289 | AM31: 89.7 | AN31: 287 | AO31: 9.4e-002 | AP31: 10 | AQ31: 闻泰转债
A32: 31 | B32: 118001 | C32: 金博转债 | D32: 688598 | E32: 金博股份 | F32: 能源电力 | G32: 太阳能 | H32: 172.33 | I32: 7.2999999999999995e-002 | J32: 1.78e-002 | K32: 389.77 | L32: 0.107 | M32: 121.6 | N32: 271.12 | O32: 0.19899999999999998 | P32: 143.76 | Q32: 49天 | R32: 5.61年 | S32: 3.61年 | T32: 6 | U32: 545 | V32: 0.53000000000000003 | W32: 1.9e-002 | X32: 2.7999999999999997e-002 | Y32: 313 | Z32: 18.98 | AA32: -6.1399999999999996e-002 | AB32: -6.7299999999999999e-002 | AC32: -0.12 | AD32: -0.122 | AE32: 80.18 | AF32: 82.33 | AG32: 0.85 | AH32: A+ | AI32: 7.3800000000000004e-002 | AJ32: =H32+100*O32 -> 192.23000000000002 | AK32: 200.9 | AL32: 323 | AM32: 118.6 | AN32: 328 | AO32: 0.122 | AP32: 4 | AQ32: 金博转债
A33: 32 | B33: 113627 | C33: 太平转债! | D33: 603877 | E33: 太平鸟 | F33: 服装纺织 | G33: 服装行业 | H33: 119.75 | I33: -6.8999999999999999e-003 | J33: 7.6e-003 | K33: 33.3 | L33: 3.0000000000000001e-003 | M33: 115.1 | N33: 50.32 | O33: 0.81000000000000005 | P33: 66.18 | Q33: 41天 | R33: 5.59年 | S33: 3.59年 | T33: 8 | U33: 5 | V33: 5.0000000000000001e-003 | W33: 5.0000000000000003e-002 | X33: 3.3000000000000002e-002 | Y33: 159 | Z33: 3.9 | AA33: -7.1999999999999998e-003 | AB33: -1.1899999999999999e-002 | AC33: -3.8100000000000002e-002 | AD33: -3.9800000000000002e-002 | AE33: 88.94 | AF33: 91.93 | AG33: 0.23 | AH33: AA | AI33: 4.1799999999999997e-002 | AJ33: =H33+100*O33 -> 200.75 | AK33: 173.3 | AL33: 272 | AM33: 81.4 | AN33: 269 | AO33: -3.2000000000000001e-002 | AP33: 3 | AQ33: 太平转债!
A34: 33 | B34: 123119 | C34: 康泰转2! | D34: 300601 | E34: 康泰生物 | F34: 医药 | G34: 生物制药 | H34: 126.27 | I34: 2.0999999999999999e-003 | J34: -3.4000000000000002e-003 | K34: 112.69 | L34: -3.5999999999999999e-003 | M34: 117.1 | N34: 145.33 | O34: 0.628 | P34: 77.54 | Q34: 41天 | R34: 5.59年 | S34: 3.59年 | T34: 20 | U34: 45 | V34: 1.8000000000000002e-002 | W34: 2.6000000000000002e-002 | X34: 2.e-002 | Y34: 774 | Z34: 9.1 | AA34: -1.3600000000000001e-002 | AB34: -1.89e-002 | AC34: -5.1699999999999996e-002 | AD34: -5.33e-002 | AE34: 88.94 | AF34: 93.52 | AG34: 0.35 | AH34: AA | AI34: 4.1799999999999997e-002 | AJ34: =H34+100*O34 -> 189.06999999999999 | AK34: 175 | AL34: 277 | AM34: 81.5 | AN34: 270 | AO34: 5.0000000000000001e-003 | AP34: 9 | AQ34: 康泰转2!
A35: 34 | B35: 127041 | C35: 弘亚转债! | D35: 2833 | E35: 弘亚数控 | F35: 机械装备 | G35: 专用设备 | H35: 126.88 | I35: 2.4900000000000002e-002 | J35: -1.37e-002 | K35: 34.43 | L35: 2.2000000000000002e-002 | M35: 118.75 | N35: 38.09 | O35: 0.40399999999999997 | P35: 90.39 | Q35: 37天 | R35: 4.58年 | S35: 2.58年 | T35: 6 | U35: 87 | V35: 0.113 | W35: 5.7999999999999996e-002 | X35: 5.2000000000000005e-002 | Y35: 104 | Z35: 5.23 | AA35: -1.4499999999999999e-002 | AB35: -2.1499999999999998e-002 | AC35: -7.51e-002 | AD35: -7.6600000000000001e-002 | AE35: 87.13 | AF35: 90.79 | AG35: 0.51 | AH35: AA- | AI35: 6.13e-002 | AJ35: =H35+100*O35 -> 167.28 | AK35: 163.4 | AL35: 224 | AM35: 72.6 | AN35: 234 | AO35: 7.4999999999999997e-002 | AP35: 5 | AQ35: 弘亚转债!
A36: 35 | B36: 123118 | C36: 惠城转债 | D36: 300779 | E36: 惠城环保 | F36: 化工 | G36: 其他 | H36: 121.82 | I36: 5.6999999999999993e-003 | J36: -4.5000000000000005e-003 | K36: 16.9 | L36: 1.8e-003 | M36: 121.7 | N36: 17.11 | O36: 0.23300000000000001 | P36: 98.77 | Q36: 33天 | R36: 5.57年 | S36: 3.57年 | T36: 3.2 | U36: 24 | V36: 6.0999999999999999e-002 | W36: 0.18899999999999997 | X36: 0.187 | Y36: 17 | Z36: 2.54 | AA36: -2.0000000000000001e-004 | AB36: -6.8000000000000005e-003 | AC36: -4.0300000000000002e-002 | AD36: -4.2500000000000003e-002 | AE36: 80.45 | AF36: 82.65 | AG36: 0.66 | AH36: A+ | AI36: 7.3800000000000004e-002 | AJ36: =H36+100*O36 -> 145.12 | AK36: 144.9 | AL36: 76 | AM36: 62.2 | AN36: 170 | AO36: -2.1000000000000001e-002 | AP36: 9 | AQ36: 惠城转债
A37: 36 | B37: 127040 | C37: 国泰转债 | D37: 2091 | E37: 江苏国泰 | F37: 商业零售 | G37: 商业零售 | H37: 150.7 | I37: 9.4999999999999998e-003 | J37: -5.4000000000000003e-003 | K37: 12.06 | L37: 5.0000000000000001e-003 | M37: 112.5 | N37: 9.02 | O37: 0.127 | P37: 133.7 | Q37: 33天 | R37: 5.57年 | S37: 3.57年 | T37: 45.6 | U37: 69 | V37: 1.e-002 | W37: 0.24199999999999999 | X37: 0.32299999999999995 | Y37: 189 | Z37: 1.97 | AA37: -5.1799999999999999e-002 | AB37: -5.5599999999999997e-002 | AC37: -9.7299999999999998e-002 | AD37: -9.8599999999999993e-002 | AE37: 90.06 | AF37: 92.27 | AG37: 0.82 | AH37: AA+ | AI37: 3.6799999999999999e-002 | AJ37: =H37+100*O37 -> 163.39999999999998 | AK37: 167.7 | AL37: 244 | AM37: 75.4 | AN37: 245 | AO37: -1.9e-002 | AP37: 11 | AQ37: 国泰转债
A38: 37 | B38: 127039 | C38: 北港转债 | D38: 582 | E38: 北部湾港 | F38: 机场高速 | G38: 港口 | H38: 121.7 | I38: 8.0000000000000004e-004 | J38: -3.4999999999999996e-003 | K38: 7.86 | L38: -5.1000000000000004e-003 | M38: 113 | N38: 8.35 | O38: 0.29299999999999998 | P38: 94.13 | Q38: 25天 | R38: 5.55年 | S38: 3.55年 | T38: 30 | U38: 13 | V38: 4.0000000000000001e-003 | W38: 0.23399999999999999 | X38: 0.22 | Y38: 128 | Z38: 1.2 | AA38: -1.3500000000000002e-002 | AB38: -1.77e-002 | AC38: -4.2999999999999997e-002 | AD38: -4.4600000000000001e-002 | AE38: 91.24 | AF38: 93.79 | AG38: 0.52 | AH38: AAA | AI38: 3.4799999999999998e-002 | AJ38: =H38+100*O38 -> 151. | AK38: 149.3 | AL38: 117 | AM38: 55.5 | AN38: 129 | AO38: 8.0000000000000002e-003 | AP38: 6 | AQ38: 北港转债
A39: 38 | B39: 113626 | C39: 伯特转债 | D39: 603596 | E39: 伯特利 | F39: 汽车 | G39: 零部件制 | H39: 209.17 | I39: 7.4999999999999997e-003 | J39: -7.4000000000000003e-003 | K39: 70.1 | L39: 1.e-004 | M39: 121.1 | N39: 36.01 | O39: 7.400000000000001e-002 | P39: 194.67 | Q39: 25天 | R39: 5.55年 | S39: 3.55年 | T39: 9.02 | U39: 134 | V39: 7.0999999999999994e-002 | W39: 3.2000000000000001e-002 | X39: 6.0999999999999999e-002 | Y39: 286 | Z39: 9.05 | AA39: -9.5100000000000004e-002 | AB39: -0.10099999999999999 | AC39: -0.16399999999999998 | AD39: -0.16500000000000001 | AE39: 89.1 | AF39: 96.88 | AG39: 0.94 | AH39: AA | AI39: 4.1799999999999997e-002 | AJ39: =H39+100*O39 -> 216.56999999999999 | AK39: 223.7 | AL39: 333 | AM39: 126.8 | AN39: 332 | AO39: 3.7999999999999999e-002 | AP39: 3 | AQ39: 伯特转债
A40: 39 | B40: 123117 | C40: 健帆转债! | D40: 300529 | E40: 健帆生物 | F40: 医药 | G40: 医疗器械 | H40: 117.484 | I40: 4.0999999999999995e-003 | J40: -5.6000000000000008e-003 | K40: 51.71 | L40: -1.09e-002 | M40: 115.1 | N40: 90.57 | O40: 1.0600000000000001 | P40: 57.09 | Q40: 18天 | R40: 5.53年 | S40: 3.53年 | T40: 10 | U40: 3.6 | V40: 3.0000000000000001e-003 | W40: 2.4e-002 | X40: 1.3999999999999999e-002 | Y40: 417 | Z40: 13.65 | AA40: -3.8e-003 | AB40: -8.6e-003 | AC40: -3.3700000000000001e-002 | AD40: -3.5499999999999997e-002 | AE40: 89.16 | AF40: 92.16 | AG40: 0.14 | AH40: AA | AI40: 4.1799999999999997e-002 | AJ40: =H40+100*O40 -> 223.48399999999998 | AK40: 177.9 | AL40: 284 | AM40: 85.7 | AN40: 279 | AO40: -2.2000000000000002e-002 | AP40: 6 | AQ40: 健帆转债!
A41: 40 | B41: 113051 | C41: 节能转债 | D41: 601016 | E41: 节能风电 | F41: 能源电力 | G41: 风能 | H41: 178.69 | I41: -1.e-003 | J41: -1.3999999999999999e-002 | K41: 6.58 | L41: -1.6399999999999998e-002 | M41: 114.5 | N41: 4.05 | O41: 0.10000000000000001 | P41: 162.47 | Q41: 14天 | R41: 5.53年 | S41: 3.53年 | T41: 30 | U41: 187 | V41: 3.5000000000000003e-002 | W41: 9.0999999999999998e-002 | X41: 0.14800000000000002 | Y41: 330 | Z41: 3.2 | AA41: -7.8399999999999997e-002 | AB41: -8.2500000000000004e-002 | AC41: -0.13400000000000001 | AD41: -0.13500000000000001 | AE41: 90.21 | AF41: 94.06 | AG41: 0.91 | AH41: AA+ | AI41: 3.6799999999999999e-002 | AJ41: =H41+100*O41 -> 188.69 | AK41: 194.9 | AL41: 316 | AM41: 100.9 | AN41: 313 | AO41: 6.9999999999999993e-003 | AP41: 9 | AQ41: 节能转债
A42: 41 | B42: 113050 | C42: 南银转债 | D42: 601009 | E42: 南京银行 | F42: 金融 | G42: 银行行业 | H42: 119.56 | I42: -3.7000000000000002e-003 | J42: 1.e-003 | K42: 9.3 | L42: -5.3e-003 | M42: 111.2 | N42: 10.1 | O42: 0.29799999999999999 | P42: 92.08 | Q42: 10天 | R42: 5.51年 | S42: 无权 | T42: 200 | U42: 37 | V42: 2.e-003 | W42: 0.215 | X42: 0.19800000000000001 | Y42: 931 | Z42: 0.88 | AA42: -1.3300000000000001e-002 | AB42: -1.6899999999999998e-002 | AC42: 无权 | AD42: 无权 | AE42: 无权 | AF42: 92.36 | AG42: 0.5 | AH42: AAA | AI42: 3.4799999999999998e-002 | AJ42: =H42+100*O42 -> 149.36000000000001 | AK42: 147 | AL42: 92 | AM42: 54.7 | AN42: 122 | AO42: 2.e-003 | AP42: 7 | AQ42: 南银转债
A43: 42 | B43: 113625 | C43: 江山转债! | D43: 603208 | E43: 江山欧派 | F43: 其他 | G43: 家居用品 | H43: 114.61 | I43: 7.000000000000001e-004 | J43: -7.0999999999999995e-003 | K43: 62.94 | L43: -2.2400000000000003e-002 | M43: 124 | N43: 96.33 | O43: 0.754 | P43: 65.34 | Q43: 7天 | R43: 5.50年 | S43: 3.50年 | T43: 5.83 | U43: 36 | V43: 5.4000000000000006e-002 | W43: 8.8000000000000009e-002 | X43: 5.7999999999999996e-002 | Y43: 66 | Z43: 3.6 | AA43: 1.47e-002 | AB43: 7.3000000000000001e-003 | AC43: -2.6600000000000002e-002 | AD43: -2.86e-002 | AE43: 83.32 | AF43: 89.32 | AG43: 0.28 | AH43: AA- | AI43: 6.2800000000000009e-002 | AJ43: =H43+100*O43 -> 190.00999999999999 | AK43: 163.9 | AL43: 226 | AM43: 74.6 | AN43: 238 | AO43: 8.9999999999999997e-002 | AP43: 6 | AQ43: 江山转债!
A44: 43 | B44: 127038 | C44: 国微转债 | D44: 2049 | E44: 紫光国微 | F44: 电子 | G44: 芯片制造 | H44: 192 | I44: 1.8200000000000001e-002 | J44: -1.6399999999999998e-002 | K44: 220.44 | L44: 2.e-003 | M44: 114.5 | N44: 137.78 | O44: 0.20000000000000001 | P44: 159.99 | Q44: 6.5天 | R44: 5.50年 | S44: 3.50年 | T44: 15 | U44: 144 | V44: 5.0000000000000003e-002 | W44: 1.1000000000000001e-002 | X44: 1.8000000000000002e-002 | Y44: 1338. | Z44: 20.35 | AA44: -9.0899999999999995e-002 | AB44: -9.5000000000000001e-002 | AC44: -0.14999999999999999 | AD44: -0.151 | AE44: 90.31 | AF44: 94.16 | AG44: 0.9 | AH44: AA+ | AI44: 3.6799999999999999e-002 | AJ44: =H44+100*O44 -> 212. | AK44: 224 | AL44: 334 | AM44: 129.8 | AN44: 335 | AO44: 1.6e-002 | AP44: 5 | AQ44: 国微转债
A45: 44 | B45: 113049 | C45: 长汽转债 | D45: 601633 | E45: 长城汽车 | F45: 汽车 | G45: 乘用车 | H45: 190.46 | I45: 3.4000000000000002e-003 | J45: -1.1999999999999999e-003 | K45: 56.75 | L45: 2.5000000000000001e-003 | M45: 110.5 | N45: 38.01 | O45: 0.27600000000000002 | P45: 149.3 | Q45: 6.5天 | R45: 5.50年 | S45: 3.50年 | T45: 35 | U45: 130 | V45: 2.e-002 | W45: 6.9999999999999993e-003 | X45: 1.e-002 | Y45: 5241. | Z45: 8.94 | AA45: -9.5299999999999996e-002 | AB45: -9.8299999999999998e-002 | AC45: -0.14999999999999999 | AD45: -0.151 | AE45: 90.28 | AF45: 91.78 | AG45: 0.87 | AH45: AAA | AI45: 3.4799999999999998e-002 | AJ45: =H45+100*O45 -> 218.06 | AK45: 231.6 | AL45: 340 | AM45: 139.8 | AN45: 340 | AO45: -3.7999999999999999e-002 | AP45: 5 | AQ45: 长汽转债
A46: 45 | B46: 123116 | C46: 万兴转债 | D46: 300624 | E46: 万兴科技 | F46: 计算机及 | G46: 软件开发 | H46: 122.8 | I46: 1.6000000000000001e-003 | J46: -8.0000000000000002e-003 | K46: 43.19 | L46: -1.0800000000000001e-002 | M46: 121.4 | N46: 49.78 | O46: 0.41499999999999998 | P46: 86.76 | Q46: 5.5天 | R46: 5.49年 | S46: 3.49年 | T46: 3.79 | U46: 32 | V46: 6.9000000000000006e-002 | W46: 6.8000000000000005e-002 | X46: 5.9000000000000004e-002 | Y46: 56 | Z46: 6.75 | AA46: -2.0999999999999999e-003 | AB46: -8.6999999999999994e-003 | AC46: -4.4000000000000004e-002 | AD46: -4.6100000000000002e-002 | AE46: 80.63 | AF46: 82.84 | AG46: 0.59 | AH46: A+ | AI46: 7.3800000000000004e-002 | AJ46: =H46+100*O46 -> 164.30000000000001 | AK46: 158.8 | AL46: 189 | AM46: 76 | AN46: 251 | AO46: -5.5999999999999994e-002 | AP46: 7 | AQ46: 万兴转债
A47: 46 | B47: 123115 | C47: 捷捷转债 | D47: 300623 | E47: 捷捷微电 | F47: 电子 | G47: 元器件制 | H47: 150.198 | I47: 2.7000000000000001e-003 | J47: 3.4999999999999996e-003 | K47: 35.28 | L47: 8.0000000000000002e-003 | M47: 118.5 | N47: 29 | O47: 0.23499999999999999 | P47: 121.66 | Q47: 4.5天 | R47: 5.49年 | S47: 3.49年 | T47: 12 | U47: 111 | V47: 6.2e-002 | W47: 4.5999999999999999e-002 | X47: 5.5999999999999994e-002 | Y47: 260 | Z47: 9.14 | AA47: -4.2999999999999997e-002 | AB47: -4.8499999999999995e-002 | AC47: -9.6799999999999997e-002 | AD47: -9.849999999999999e-002 | AE47: 83.3 | AF47: 85.41 | AG47: 0.77 | AH47: AA- | AI47: 6.2800000000000009e-002 | AJ47: =H47+100*O47 -> 173.69800000000001 | AK47: 178.7 | AL47: 287 | AM47: 93.3 | AN47: 299 | AO47: 3.9e-002 | AP47: 7 | AQ47: 捷捷转债
A48: 47 | B48: 127037 | C48: 银轮转债 | D48: 2126 | E48: 银轮股份 | F48: 汽车 | G48: 零部件制 | H48: 153 | I48: 1.8000000000000002e-002 | J48: -1.8000000000000002e-002 | K48: 13.25 | L48: 0. | M48: 115.1 | N48: 10.77 | O48: 0.24399999999999999 | P48: 123.03 | Q48: 0.5天 | R48: 5.49年 | S48: 3.49年 | T48: 7 | U48: 83 | V48: 7.8e-002 | W48: 6.7000000000000004e-002 | X48: 8.199999999999999e-002 | Y48: 105 | Z48: 2.49 | AA48: -5.1399999999999994e-002 | AB48: -5.5899999999999998e-002 | AC48: -0.10199999999999999 | AD48: -0.10099999999999999 | AE48: 89.32 | AF48: 92.33 | AG48: 0.76 | AH48: AA | AI48: 4.1799999999999997e-002 | AJ48: =H48+100*O48 -> 177.40000000000001 | AK48: 183 | AL48: 292 | AM48: 90.6 | AN48: 292 | AO48: -1.2e-002 | AP48: 4 | AQ48: 银轮转债
A49: 48 | B49: 127036 | C49: 三花转债 | D49: 2050 | E49: 三花智控 | F49: 机械装备 | G49: 通用设备 | H49: 140 | I49: 3.0299999999999997e-002 | J49: -1.44e-002 | K49: 23.89 | L49: 2.4e-002 | M49: 114.5 | N49: 21.55 | O49: 0.26300000000000001 | P49: 110.86 | Q49: 已到 | R49: 5.47年 | S49: 3.47年 | T49: 30 | U49: 51 | V49: 1.2e-002 | W49: 3.5000000000000003e-002 | X49: 3.9e-002 | Y49: 858 | Z49: 8.31 | AA49: -3.6600000000000001e-002 | AB49: -4.0999999999999995e-002 | AC49: -8.1300000000000011e-002 | AD49: -8.2699999999999996e-002 | AE49: 90.39 | AF49: 94.24 | AG49: 0.66 | AH49: AA+ | AI49: 3.6799999999999999e-002 | AJ49: =H49+100*O49 -> 166.30000000000001 | AK49: 169.1 | AL49: 250 | AM49: 74.9 | AN49: 242 | AO49: 1.e-002 | AP49: 6 | AQ49: 三花转债
A50: 49 | B50: 127035 | C50: 濮耐转债 | D50: 2225 | E50: 濮耐股份 | F50: 钢铁 | G50: 钢铁行业 | H50: 126.298 | I50: 8.3999999999999995e-003 | J50: -7.000000000000001e-004 | K50: 4.46 | L50: 1.3600000000000001e-002 | M50: 114.7 | N50: 4.43 | O50: 0.254 | P50: 100.68 | Q50: 已到 | R50: 4.46年 | S50: 2.46年 | T50: 6.26 | U50: 7.8 | V50: 1.e-002 | W50: 0.13900000000000001 | X50: 0.14000000000000001 | Y50: 45 | Z50: 1.47 | AA50: -2.18e-002 | AB50: -2.75e-002 | AC50: -7.400000000000001e-002 | AD50: -7.6200000000000004e-002 | AE50: 93.31 | AF50: 96.56 | AG50: 0.56 | AH50: AA | AI50: 4.0300000000000002e-002 | AJ50: =H50+100*O50 -> 151.69800000000001 | AK50: 151.9 | AL50: 146 | AM50: 55.4 | AN50: 128 | AO50: -1.3000000000000001e-002 | AP50: 10 | AQ50: 濮耐转债
A51: 50 | B51: 123114 | C51: 三角转债 | D51: 300775 | E51: 三角防务 | F51: 航空航天 | G51: 航空航天 | H51: 171.656 | I51: 2.8000000000000004e-003 | J51: -4.5999999999999999e-003 | K51: 47.43 | L51: -2.0999999999999999e-003 | M51: 121 | N51: 31.82 | O51: 0.152 | P51: 149.06 | Q51: 已到 | R51: 5.45年 | S51: 3.45年 | T51: 9.04 | U51: 139 | V51: 8.9999999999999997e-002 | W51: 3.7999999999999999e-002 | X51: 5.7000000000000002e-002 | Y51: 235 | Z51: 10.88 | AA51: -6.3200000000000006e-002 | AB51: -6.9199999999999998e-002 | AC51: -0.126 | AD51: -0.128 | AE51: 83.56 | AF51: 87.42 | AG51: 0.86 | AH51: AA- | AI51: 6.2800000000000009e-002 | AJ51: =H51+100*O51 -> 186.85599999999999 | AK51: 194.3 | AL51: 314 | AM51: 106.8 | AN51: 317 | AO51: -4.9000000000000002e-002 | AP51: 6 | AQ51: 三角转债
A52: 51 | B52: 111000 | C52: 起帆转债 | D52: 605222 | E52: 起帆电缆 | F52: 能源电力 | G52: 电力设备 | H52: 144.85 | I52: 3.0699999999999998e-002 | J52: -2.52e-002 | K52: 25.46 | L52: 7.0999999999999995e-003 | M52: 120.5 | N52: 20.1 | O52: 0.14400000000000002 | P52: 126.67 | Q52: 已到 | R52: 5.45年 | S52: 3.45年 | T52: 10 | U52: 74 | V52: 5.2000000000000005e-002 | W52: 9.4e-002 | X52: 0.11900000000000001 | Y52: 106 | Z52: 3.07 | AA52: -3.3799999999999997e-002 | AB52: -3.9900000000000005e-002 | AC52: -8.8699999999999987e-002 | AD52: -9.0399999999999994e-002 | AE52: 83.51 | AF52: 87.06 | AG52: 0.78 | AH52: AA- | AI52: 6.2800000000000009e-002 | AJ52: =H52+100*O52 -> 159.25 | AK52: 163 | AL52: 221 | AM52: 76 | AN52: 250 | AO52: -6.6000000000000003e-002 | AP52: 10 | AQ52: 起帆转债
A53: 52 | B53: 127034 | C53: 绿茵转债! | D53: 2887 | E53: 绿茵生态 | F53: 城市公用 | G53: 生态环境 | H53: 104.956 | I53: -8.9999999999999998e-004 | J53: -5.0000000000000001e-004 | K53: 9.47 | L53: -3.2000000000000002e-003 | M53: 119 | N53: 12.38 | O53: 0.37200000000000005 | P53: 76.49 | Q53: 已到 | R53: 5.38年 | S53: 3.38年 | T53: 7.12 | U53: 10 | V53: 1.3999999999999999e-002 | W53: 0.24100000000000002 | X53: 0.184 | Y53: 30 | Z53: 1.45 | AA53: 2.41e-002 | AB53: 1.78e-002 | AC53: -2.8000000000000004e-003 | AD53: -4.8999999999999998e-003 | AE53: 83.91 | AF53: 86.35 | AG53: 0.44 | AH53: AA- | AI53: 6.2800000000000009e-002 | AJ53: =H53+100*O53 -> 142.15600000000001 | AK53: 133.4 | AL53: 18 | AM53: 47.1 | AN53: 72 | AO53: -1.2e-002 | AP53: 36 | AQ53: 绿茵转债!
A54: 53 | B54: 113624 | C54: 正川转债! | D54: 603976 | E54: 正川股份 | F54: 医药 | G54: 医药行业 | H54: 112.28 | I54: 2.5999999999999999e-003 | J54: 5.0000000000000001e-004 | K54: 34.25 | L54: 6.8000000000000005e-003 | M54: 121.6 | N54: 46.69 | O54: 0.53100000000000003 | P54: 73.36 | Q54: 已到 | R54: 5.38年 | S54: 3.38年 | T54: 4.05 | U54: 11 | V54: 2.5000000000000001e-002 | W54: 7.8e-002 | X54: 5.7000000000000002e-002 | Y54: 52 | Z54: 4.69 | AA54: 1.5300000000000001e-002 | AB54: 8.3000000000000001e-003 | AC54: -2.e-002 | AD54: -2.2400000000000003e-002 | AE54: 81.54 | AF54: 83.72 | AG54: 0.45 | AH54: A+ | AI54: 7.3800000000000004e-002 | AJ54: =H54+100*O54 -> 165.38 | AK54: 151.2 | AL54: 137 | AM54: 67.5 | AN54: 200 | AO54: -2.e-003 | AP54: 21 | AQ54: 正川转债!
A55: 54 | B55: 113048 | C55: 晶科转债!! | D55: 601778 | E55: 晶科科技 | F55: 能源电力 | G55: 太阳能 | H55: 189.33 | I55: 1.2199999999999999e-002 | J55: 4.3e-003 | K55: 9.65 | L55: 1.7899999999999999e-002 | M55: 117.1 | N55: 5.46 | O55: 7.0999999999999994e-002 | P55: 176.74 | Q55: 已到 | R55: 5.36年 | S55: 3.36年 | T55: 23 | U55: 761 | V55: 0.17399999999999999 | W55: 8.199999999999999e-002 | X55: 0.14499999999999999 | Y55: 279 | Z55: 2.36 | AA55: -8.6999999999999994e-002 | AB55: -9.1799999999999993e-002 | AC55: -0.152 | AD55: -0.153 | AE55: 89.77 | AF55: 94.4 | AG55: 0.92 | AH55: AA | AI55: 4.1799999999999997e-002 | AJ55: =H55+100*O55 -> 196.43000000000001 | AK55: 201.9 | AL55: 324 | AM55: 107.5 | AN55: 318 | AO55: 6.9000000000000006e-002 | AP55: 15 | AQ55: 晶科转债!!
A56: 55 | B56: 123113 | C56: 仙乐转债! | D56: 300791 | E56: 仙乐健康 | F56: 食品饮料 | G56: 食品饮料 | H56: 117.5 | I56: -1.e-004 | J56: -4.3e-003 | K56: 42.05 | L56: -1.06e-002 | M56: 118.5 | N56: 56.88 | O56: 0.58899999999999997 | P56: 73.93 | Q56: 已到 | R56: 5.35年 | S56: 3.35年 | T56: 10.2 | U56: 14 | V56: 1.2e-002 | W56: 0.13500000000000001 | X56: 0.10000000000000001 | Y56: 76 | Z56: 3.27 | AA56: 1.6000000000000001e-003 | AB56: -4.4000000000000003e-003 | AC56: -3.4799999999999998e-002 | AD56: -3.6799999999999999e-002 | AE56: 83.99 | AF56: 86.12 | AG56: 0.41 | AH56: AA- | AI56: 6.2800000000000009e-002 | AJ56: =H56+100*O56 -> 176.40000000000001 | AK56: 161.1 | AL56: 203 | AM56: 74.9 | AN56: 243 | AO56: -4.9000000000000002e-002 | AP56: 4 | AQ56: 仙乐转债!
A57: 56 | B57: 127033 | C57: 中装转2! | D57: 2822 | E57: 中装建设 | F57: 建筑 | G57: 装饰工程 | H57: 119.358 | I57: -3.5999999999999999e-003 | J57: -7.7000000000000002e-003 | K57: 5.62 | L57: -2.4300000000000002e-002 | M57: 117.1 | N57: 6.28 | O57: 0.33399999999999996 | P57: 89.49 | Q57: 已到 | R57: 5.35年 | S57: 3.35年 | T57: 11.6 | U57: 17 | V57: 1.2e-002 | W57: 0.28600000000000003 | X57: 0.25600000000000001 | Y57: 40 | Z57: 1.16 | AA57: -3.5999999999999999e-003 | AB57: -9.1999999999999998e-003 | AC57: -3.9800000000000002e-002 | AD57: -4.1700000000000001e-002 | AE57: 89.84 | AF57: 94.47 | AG57: 0.47 | AH57: AA | AI57: 4.1799999999999997e-002 | AJ57: =H57+100*O57 -> 152.75800000000001 | AK57: 149.2 | AL57: 115 | AM57: 54.8 | AN57: 123 | AO57: 5.0999999999999997e-002 | AP57: 27 | AQ57: 中装转2!
A58: 57 | B58: 110080 | C58: 东湖转债 | D58: 600133 | E58: 东湖高新 | F58: 建筑 | G58: 建筑工程 | H58: 108.5 | I58: -1.9e-003 | J58: -3.2000000000000002e-003 | K58: 5.23 | L58: -1.1299999999999999e-002 | M58: 115.1 | N58: 6.05 | O58: 0.255 | P58: 86.45 | Q58: 已到 | R58: 5.33年 | S58: 3.33年 | T58: 15.5 | U58: 12 | V58: 6.9999999999999993e-003 | W58: 0.37200000000000005 | X58: 0.32200000000000001 | Y58: 42 | Z58: 0.74 | AA58: 1.1299999999999999e-002 | AB58: 6.1999999999999998e-003 | AC58: -1.32e-002 | AD58: -1.52e-002 | AE58: 89.88 | AF58: 92.91 | AG58: 0.45 | AH58: AA | AI58: 4.1799999999999997e-002 | AJ58: =H58+100*O58 -> 134. | AK58: 130.6 | AL58: 12 | AM58: 37.6 | AN58: 22 | AO58: -2.e-003 | AP58: 30 | AQ58: 东湖转债
A59: 58 | B59: 127032 | C59: 苏行转债 | D59: 2966 | E59: 苏州银行 | F59: 金融 | G59: 银行行业 | H59: 113.1 | I59: 8.0000000000000004e-004 | J59: -3.0000000000000001e-003 | K59: 6.75 | L59: -5.8999999999999999e-003 | M59: 115.1 | N59: 8.1 | O59: 0.35700000000000004 | P59: 83.33 | Q59: 已到 | R59: 5.33年 | S59: 无权 | T59: 50 | U59: 49 | V59: 9.0000000000000011e-003 | W59: 0.222 | X59: 0.185 | Y59: 225 | Z59: 0.71 | AA59: 3.3e-003 | AB59: -1.7000000000000001e-003 | AC59: 无权 | AD59: 无权 | AE59: 无权 | AF59: 96.22 | AG59: 0.37 | AH59: AAA | AI59: 3.4799999999999998e-002 | AJ59: =H59+100*O59 -> 148.80000000000001 | AK59: 142.9 | AL59: 56 | AM59: 46.6 | AN59: 70 | AO59: -2.e-003 | AP59: 9 | AQ59: 苏行转债
A60: 59 | B60: 113047 | C60: 旗滨转债 | D60: 601636 | E60: 旗滨集团 | F60: 建筑 | G60: 玻璃 | H60: 175.45 | I60: -8.6e-003 | J60: -8.0000000000000002e-003 | K60: 18.6 | L60: -1.95e-002 | M60: 114 | N60: 12.8 | O60: 0.20699999999999999 | P60: 145.31 | Q60: 已到 | R60: 5.33年 | S60: 3.33年 | T60: 15 | U60: 217 | V60: 8.3000000000000004e-002 | W60: 2.9999999999999999e-002 | X60: 4.4000000000000004e-002 | Y60: 500 | Z60: 4.07 | AA60: -7.8700000000000006e-002 | AB60: -8.2799999999999999e-002 | AC60: -0.13900000000000001 | AD60: -0.13900000000000001 | AE60: 90.42 | AF60: 94.3 | AG60: 0.85 | AH60: AA+ | AI60: 3.6799999999999999e-002 | AJ60: =H60+100*O60 -> 196.14999999999998 | AK60: 205.6 | AL60: 326 | AM60: 111.3 | AN60: 324 | AO60: 0.11699999999999999 | AP60: 7 | AQ60: 旗滨转债
A61: 60 | B61: 123112 | C61: 万讯转债! | D61: 300112 | E61: 万讯自控 | F61: 机械装备 | G61: 专用设备 | H61: 154 | I61: 0.109 | J61: 5.7599999999999998e-002 | K61: 13.38 | L61: 0.20000000000000001 | M61: 124.4 | N61: 8.93 | O61: 2.7999999999999997e-002 | P61: 149.83 | Q61: 已到 | R61: 5.32年 | S61: 3.32年 | T61: 2.46 | U61: 2655. | V61: 7.0700000000000003 | W61: 6.4000000000000001e-002 | X61: 9.6000000000000002e-002 | Y61: 38 | Z61: 3.52 | AA61: -4.0099999999999997e-002 | AB61: -4.7300000000000002e-002 | AC61: -0.10400000000000001 | AD61: -0.106 | AE61: 84.55 | AF61: 90.62 | AG61: 0.83 | AH61: AA- | AI61: 6.2800000000000009e-002 | AJ61: =H61+100*O61 -> 156.80000000000001 | AK61: 158.2 | AL61: 185 | AM61: 67.5 | AN61: 203 | AO61: 0.11800000000000001 | AP61: 14 | AQ61: 万讯转债!
A62: 61 | B62: 113623 | C62: 凤21转债 | D62: 603225 | E62: 新凤鸣 | F62: 化工 | G62: 化纤 | H62: 125.59 | I62: 1.7000000000000001e-003 | J62: 8.9999999999999998e-004 | K62: 14.83 | L62: 5.4000000000000003e-003 | M62: 117.1 | N62: 16.47 | O62: 0.39500000000000002 | P62: 90.04 | Q62: 已到 | R62: 5.32年 | S62: 3.32年 | T62: 25 | U62: 49 | V62: 1.6e-002 | W62: 0.11 | X62: 9.9000000000000005e-002 | Y62: 227 | Z62: 1.43 | AA62: -1.3300000000000001e-002 | AB62: -1.8799999999999997e-002 | AC62: -5.4100000000000002e-002 | AD62: -5.5899999999999998e-002 | AE62: 89.92 | AF62: 94.56 | AG62: 0.47 | AH62: AA | AI62: 4.1799999999999997e-002 | AJ62: =H62+100*O62 -> 165.09 | AK62: 161.1 | AL62: 206 | AM62: 66.6 | AN62: 192 | AO62: 4.2999999999999997e-002 | AP62: 3 | AQ62: 凤21转债
A63: 62 | B63: 123111 | C63: 东财转3! | D63: 300059 | E63: 东方财富 | F63: 金融 | G63: 证券行业 | H63: 165.5 | I63: 8.0000000000000004e-004 | J63: -8.8000000000000005e-003 | K63: 36.9 | L63: -8.8999999999999999e-003 | M63: 110.5 | N63: 23.35 | O63: 4.7e-002 | P63: 158.03 | Q63: 已到 | R63: 5.32年 | S63: 3.32年 | T63: 151 | U63: 670 | V63: 2.7000000000000003e-002 | W63: 4.0000000000000001e-002 | X63: 6.3e-002 | Y63: 3814. | Z63: 9.79 | AA63: -7.3899999999999993e-002 | AB63: -7.7100000000000002e-002 | AC63: -0.126 | AD63: -0.127 | AE63: 89.98 | AF63: 91.38 | AG63: 0.9 | AH63: AA+ | AI63: 3.6799999999999999e-002 | AJ63: =H63+100*O63 -> 170.19999999999999 | AK63: 173 | AL63: 271 | AM63: 81.6 | AN63: 271 | AO63: 4.5999999999999999e-002 | AP63: 26 | AQ63: 东财转3!
A64: 63 | B64: 123109 | C64: 昌红转债! | D64: 300151 | E64: 昌红科技 | F64: 机械装备 | G64: 专用设备 | H64: 162.158 | I64: 2.2400000000000003e-002 | J64: -8.0000000000000004e-004 | K64: 43.35 | L64: 2.5099999999999997e-002 | M64: 121 | N64: 28.06 | O64: 5.0000000000000003e-002 | P64: 154.49 | Q64: 已到 | R64: 5.30年 | S64: 3.30年 | T64: 4.6 | U64: 80 | V64: 0.109 | W64: 2.1000000000000001e-002 | X64: 3.3000000000000002e-002 | Y64: 218 | Z64: 21.08 | AA64: -5.4699999999999999e-002 | AB64: -6.0899999999999996e-002 | AC64: -0.11800000000000001 | AD64: -0.12 | AE64: 84.32 | AF64: 88.22 | AG64: 0.86 | AH64: AA- | AI64: 6.2800000000000009e-002 | AJ64: =H64+100*O64 -> 167.15799999999999 | AK64: 169.8 | AL64: 256 | AM64: 81.6 | AN64: 272 | AO64: 9.9000000000000005e-002 | AP64: 6 | AQ64: 昌红转债!
A65: 64 | B65: 123110 | C65: 九典转债 | D65: 300705 | E65: 九典制药 | F65: 医药 | G65: 化学制药 | H65: 128.86 | I65: 2.6800000000000001e-002 | J65: 1.5800000000000002e-002 | K65: 28.15 | L65: 6.0299999999999999e-002 | M65: 121.4 | N65: 26.44 | O65: 0.20999999999999999 | P65: 106.47 | Q65: 已到 | R65: 5.30年 | S65: 3.30年 | T65: 2.7 | U65: 374 | V65: 1.0600000000000001 | W65: 4.0999999999999995e-002 | X65: 4.2999999999999997e-002 | Y65: 66 | Z65: 6.64 | AA65: -1.1399999999999999e-002 | AB65: -1.8200000000000001e-002 | AC65: -5.9400000000000001e-002 | AD65: -6.1600000000000002e-002 | AE65: 81.78 | AF65: 83.97 | AG65: 0.71 | AH65: A+ | AI65: 7.3800000000000004e-002 | AJ65: =H65+100*O65 -> 149.86000000000001 | AK65: 151.3 | AL65: 139 | AM65: 67.3 | AN65: 198 | AO65: 6.7000000000000004e-002 | AP65: 11 | AQ65: 九典转债
A66: 65 | B66: 123108 | C66: 乐普转2! | D66: 300003 | E66: 乐普医疗 | F66: 医药 | G66: 医疗器械 | H66: 118.59 | I66: 6.6e-003 | J66: -1.1000000000000001e-002 | K66: 22 | L66: -1.7000000000000001e-002 | M66: 111.1 | N66: 29.5 | O66: 0.58999999999999997 | P66: 74.58 | Q66: 已到 | R66: 4.30年 | S66: 2.30年 | T66: 16.4 | U66: 9.1 | V66: 5.0000000000000001e-003 | W66: 4.0999999999999995e-002 | X66: 3.1e-002 | Y66: 397 | Z66: 3.45 | AA66: -1.5300000000000001e-002 | AB66: -1.9900000000000001e-002 | AC66: -5.9299999999999999e-002 | AD66: -6.08e-002 | AE66: 93.72 | AF66: 95.9 | AG66: 0.26 | AH66: AA+ | AI66: 3.5299999999999998e-002 | AJ66: =H66+100*O66 -> 177.59 | AK66: 162.6 | AL66: 219 | AM66: 66.7 | AN66: 194 | AO66: -6.0000000000000001e-003 | AP66: 12 | AQ66: 乐普转2!
A67: 66 | B67: 123107 | C67: 温氏转债! | D67: 300498 | E67: 温氏股份 | F67: 农业 | G67: 畜牧业 | H67: 126.502 | I67: 2.8999999999999998e-003 | J67: -8.6e-003 | K67: 17.27 | L67: -1.03e-002 | M67: 113 | N67: 17.62 | O67: 0.29100000000000004 | P67: 98.01 | Q67: 已到 | R67: 5.30年 | S67: 3.30年 | T67: 93 | U67: 155 | V67: 1.3000000000000001e-002 | W67: 8.5000000000000006e-002 | X67: 8.3000000000000004e-002 | Y67: 1097. | Z67: 3.12 | AA67: -2.1499999999999998e-002 | AB67: -2.5699999999999997e-002 | AC67: -5.67e-002 | AD67: -5.8499999999999996e-002 | AE67: 92.03 | AF67: 94.6 | AG67: 0.55 | AH67: AAA | AI67: 3.4799999999999998e-002 | AJ67: =H67+100*O67 -> 155.602 | AK67: 155 | AL67: 168 | AM67: 60.4 | AN67: 155 | AO67: 2.e-002 | AP67: 13 | AQ67: 温氏转债!
A68: 67 | B68: 110079 | C68: 杭银转债! | D68: 600926 | E68: 杭州银行 | F68: 金融 | G68: 银行行业 | H68: 127.2 | I68: -5.1999999999999998e-003 | J68: -1.6000000000000001e-003 | K68: 14.15 | L68: -1.0500000000000001e-002 | M68: 112.4 | N68: 12.99 | O68: 0.16800000000000001 | P68: 108.93 | Q68: 已到 | R68: 5.30年 | S68: 无权 | T68: 150 | U68: 108 | V68: 6.0000000000000001e-003 | W68: 0.17899999999999999 | X68: 0.19500000000000001 | Y68: 839 | Z68: 1.21 | AA68: -2.3399999999999997e-002 | AB68: -2.75e-002 | AC68: 无权 | AD68: 无权 | AE68: 无权 | AF68: 94.05 | AG68: 0.65 | AH68: AAA | AI68: 3.4799999999999998e-002 | AJ68: =H68+100*O68 -> 144. | AK68: 145.5 | AL68: 79 | AM68: 51.4 | AN68: 100 | AO68: -1.e-003 | AP68: 13 | AQ68: 杭银转债!
A69: 68 | B69: 113622 | C69: 杭叉转债! | D69: 603298 | E69: 杭叉集团 | F69: 机械装备 | G69: 通用设备 | H69: 116.22 | I69: -8.6999999999999994e-003 | J69: 1.24e-002 | K69: 16.61 | L69: 1.34e-002 | M69: 112.5 | N69: 23.08 | O69: 0.61499999999999999 | P69: 71.97 | Q69: 已到 | R69: 5.29年 | S69: 3.29年 | T69: 11.5 | U69: 26 | V69: 1.9e-002 | W69: 8.0000000000000002e-002 | X69: 5.7999999999999996e-002 | Y69: 144 | Z69: 2.73 | AA69: -6.1999999999999998e-003 | AB69: -1.0500000000000001e-002 | AC69: -3.4599999999999999e-002 | AD69: -3.6200000000000003e-002 | AE69: 91 | AF69: 93.23 | AG69: 0.28 | AH69: AA+ | AI69: 3.6799999999999999e-002 | AJ69: =H69+100*O69 -> 177.72 | AK69: 160.5 | AL69: 198 | AM69: 67.2 | AN69: 197 | AO69: -1.4999999999999999e-002 | AP69: 5 | AQ69: 杭叉转债!
A70: 69 | B70: 127031 | C70: 洋丰转债! | D70: 902 | E70: 新洋丰 | F70: 化工 | G70: 农化 | H70: 131.079 | I70: -1.1899999999999999e-002 | J70: 8.3000000000000001e-003 | K70: 17.89 | L70: -7.8000000000000005e-003 | M70: 117.1 | N70: 19.94 | O70: 0.46100000000000002 | P70: 89.72 | Q70: 已到 | R70: 5.29年 | S70: 3.29年 | T70: 10 | U70: 37 | V70: 2.7999999999999997e-002 | W70: 4.2999999999999997e-002 | X70: 3.7999999999999999e-002 | Y70: 233 | Z70: 3.1 | AA70: -2.1499999999999998e-002 | AB70: -2.7000000000000003e-002 | AC70: -6.6400000000000001e-002 | AD70: -6.8199999999999997e-002 | AE70: 90.07 | AF70: 94.71 | AG70: 0.47 | AH70: AA | AI70: 4.1799999999999997e-002 | AJ70: =H70+100*O70 -> 177.179 | AK70: 172.4 | AL70: 267 | AM70: 77.7 | AN70: 257 | AO70: 6.0999999999999999e-002 | AP70: 5 | AQ70: 洋丰转债!
A71: 70 | B71: 123106 | C71: 正丹转债! | D71: 300641 | E71: 正丹股份 | F71: 化工 | G71: 化工 | H71: 118.65 | I71: 1.5700000000000002e-002 | J71: -6.4000000000000003e-003 | K71: 6.87 | L71: 1.78e-002 | M71: 125.5 | N71: 7.5 | O71: 0.29499999999999998 | P71: 91.6 | Q71: 已到 | R71: 5.28年 | S71: 3.28年 | T71: 3.2 | U71: 13 | V71: 3.5000000000000003e-002 | W71: 9.5000000000000001e-002 | X71: 8.6999999999999994e-002 | Y71: 34 | Z71: 2.35 | AA71: 1.09e-002 | AB71: 2.8000000000000004e-003 | AC71: -3.8300000000000001e-002 | AD71: -4.0300000000000002e-002 | AE71: 84.36 | AF71: 91.57 | AG71: 0.53 | AH71: AA- | AI71: 6.2800000000000009e-002 | AJ71: =H71+100*O71 -> 148.15000000000001 | AK71: 145.7 | AL71: 82 | AM71: 54.1 | AN71: 117 | AO71: 5.0000000000000001e-003 | AP71: 18 | AQ71: 正丹转债!
A72: 71 | B72: 128145 | C72: 日丰转债! | D72: 2953 | E72: 日丰股份 | F72: 家电 | G72: 零部件制 | H72: 144.8 | I72: 1.9900000000000001e-002 | J72: -8.8000000000000005e-003 | K72: 18.27 | L72: 1.3300000000000001e-002 | M72: 115.4 | N72: 13.66 | O72: 8.3000000000000004e-002 | P72: 133.75 | Q72: 已到 | R72: 5.28年 | S72: 3.28年 | T72: 3.8 | U72: 179 | V72: 0.32500000000000001 | W72: 8.5000000000000006e-002 | X72: 0.114 | Y72: 44 | Z72: 3.89 | AA72: -4.2900000000000001e-002 | AB72: -4.7699999999999992e-002 | AC72: -9.3100000000000002e-002 | AD72: -9.4800000000000009e-002 | AE72: 84.29 | AF72: 84.25 | AG72: 0.83 | AH72: AA- | AI72: 6.2800000000000009e-002 | AJ72: =H72+100*O72 -> 153.10000000000002 | AK72: 155.9 | AL72: 174 | AM72: 71.6 | AN72: 230 | AO72: -6.0000000000000001e-003 | AP72: 11 | AQ72: 日丰转债!
A73: 72 | B73: 127030 | C73: 盛虹转债! | D73: 301 | E73: 东方盛虹 | F73: 化工 | G73: 化纤 | H73: 197 | I73: 1.9199999999999998e-002 | J73: 6.0000000000000001e-003 | K73: 24.27 | L73: 2.7099999999999999e-002 | M73: 112.5 | N73: 14.1 | O73: 0.14400000000000002 | P73: 172.13 | Q73: 已到 | R73: 5.28年 | S73: 3.28年 | T73: 50 | U73: 255 | V73: 2.6000000000000002e-002 | W73: 4.2999999999999997e-002 | X73: 7.2999999999999995e-002 | Y73: 1173. | Z73: 10.35 | AA73: -0.10199999999999999 | AB73: -0.106 | AC73: -0.16500000000000001 | AD73: -0.16699999999999998 | AE73: 91.02 | AF73: 93.26 | AG73: 0.93 | AH73: AA+ | AI73: 3.6799999999999999e-002 | AJ73: =H73+100*O73 -> 211.40000000000001 | AK73: 221.9 | AL73: 332 | AM73: 128.6 | AN73: 334 | AO73: 4.2999999999999997e-002 | AP73: 5 | AQ73: 盛虹转债!
A74: 73 | B74: 113046 | C74: 金田转债! | D74: 601609 | E74: 金田铜业 | F74: 有色金属 | G74: 铜金属 | H74: 120.15 | I74: -1.2999999999999999e-003 | J74: 2.5999999999999999e-003 | K74: 9.06 | L74: 3.3e-003 | M74: 114.9 | N74: 10.75 | O74: 0.42599999999999999 | P74: 84.28 | Q74: 已到 | R74: 5.28年 | S74: 3.28年 | T74: 15 | U74: 52 | V74: 2.8999999999999998e-002 | W74: 0.11199999999999999 | X74: 9.4e-002 | Y74: 134 | Z74: 1.91 | AA74: -8.6e-003 | AB74: -1.3500000000000002e-002 | AC74: -4.2999999999999997e-002 | AD74: -4.4800000000000006e-002 | AE74: 91.4 | AF74: 95.29 | AG74: 0.39 | AH74: AA+ | AI74: 3.6799999999999999e-002 | AJ74: =H74+100*O74 -> 162.75 | AK74: 156 | AL74: 177 | AM74: 60.7 | AN74: 156 | AO74: -2.2000000000000002e-002 | AP74: 13 | AQ74: 金田转债!
A75: 74 | B75: 127029 | C75: 中钢转债! | D75: 928 | E75: 中钢国际 | F75: 建筑 | G75: 建筑工程 | H75: 164.46 | I75: -1.7100000000000001e-002 | J75: 8.6e-003 | K75: 9.05 | L75: -9.7999999999999997e-003 | M75: 117.5 | N75: 5.79 | O75: 5.2000000000000005e-002 | P75: 156.3 | Q75: 已到 | R75: 5.27年 | S75: 3.27年 | T75: 8.2 | U75: 237 | V75: 0.17699999999999999 | W75: 7.0999999999999994e-002 | X75: 0.111 | Y75: 116 | Z75: 1.94 | AA75: -6.2699999999999992e-002 | AB75: -6.7900000000000002e-002 | AC75: -0.124 | AD75: -0.126 | AE75: 91.05 | AF75: 97.42 | AG75: 0.87 | AH75: AA+ | AI75: 3.6799999999999999e-002 | AJ75: =H75+100*O75 -> 169.66 | AK75: 172.6 | AL75: 269 | AM75: 75.2 | AN75: 244 | AO75: 0.109 | AP75: 12 | AQ75: 中钢转债!
A76: 75 | B76: 123105 | C76: 拓尔转债! | D76: 300229 | E76: 拓尔思 | F76: 计算机及 | G76: 软件开发 | H76: 123.2 | I76: -4.0000000000000002e-004 | J76: -9.4999999999999998e-003 | K76: 9.64 | L76: -1.6299999999999999e-002 | M76: 121 | N76: 9.96 | O76: 0.27300000000000002 | P76: 96.79 | Q76: 已到 | R76: 5.27年 | S76: 3.27年 | T76: 8 | U76: 15 | V76: 1.6e-002 | W76: 0.11599999999999999 | X76: 0.11199999999999999 | Y76: 69 | Z76: 3.12 | AA76: -3.4999999999999996e-003 | AB76: -1.0200000000000001e-002 | AC76: -4.8799999999999996e-002 | AD76: -5.0799999999999998e-002 | AE76: 84.5 | AF76: 88.41 | AG76: 0.61 | AH76: AA- | AI76: 6.2800000000000009e-002 | AJ76: =H76+100*O76 -> 150.5 | AK76: 149.6 | AL76: 121 | AM76: 61.2 | AN76: 162 | AO76: 4.0000000000000001e-003 | AP76: 9 | AQ76: 拓尔转债!
A77: 76 | B77: 123104 | C77: 卫宁转债! | D77: 300253 | E77: 卫宁健康 | F77: 计算机及 | G77: 软件开发 | H77: 126.1 | I77: -7.0999999999999995e-003 | J77: -3.0000000000000001e-003 | K77: 14.36 | L77: -3.2300000000000002e-002 | M77: 125.1 | N77: 17.74 | O77: 0.55799999999999994 | P77: 80.95 | Q77: 已到 | R77: 5.26年 | S77: 3.26年 | T77: 9.7 | U77: 4.8 | V77: 4.0000000000000001e-003 | W77: 3.2000000000000001e-002 | X77: 2.6000000000000002e-002 | Y77: 308 | Z77: 6.43 | AA77: -1.5e-003 | AB77: -9.3999999999999986e-003 | AC77: -5.62e-002 | AD77: -5.7999999999999996e-002 | AE77: 90.16 | AF77: 101.25 | AG77: 0.31 | AH77: AA | AI77: 4.1799999999999997e-002 | AJ77: =H77+100*O77 -> 181.89999999999998 | AK77: 171.3 | AL77: 264 | AM77: 70 | AN77: 221 | AO77: -3.6000000000000004e-002 | AP77: 5 | AQ77: 卫宁转债!
A78: 77 | B78: 123103 | C78: 震安转债! | D78: 300767 | E78: 震安科技 | F78: 化工 | G78: 橡胶塑料 | H78: 180.407 | I78: -4.4000000000000003e-003 | J78: 1.6e-002 | K78: 94.98 | L78: 1.29e-002 | M78: 121.4 | N78: 56.89 | O78: 8.1000000000000003e-002 | P78: 166.95 | Q78: 已到 | R78: 5.25年 | S78: 3.25年 | T78: 2.53 | U78: 71 | V78: 0.156 | W78: 1.3000000000000001e-002 | X78: 2.2000000000000002e-002 | Y78: 192 | Z78: 16.37 | AA78: -7.4200000000000002e-002 | AB78: -8.0299999999999996e-002 | AC78: -0.14400000000000002 | AD78: -0.14599999999999999 | AE78: 82.27 | AF78: 84.34 | AG78: 0.9 | AH78: A+ | AI78: 7.3800000000000004e-002 | AJ78: =H78+100*O78 -> 188.50700000000001 | AK78: 193.9 | AL78: 313 | AM78: 109.5 | AN78: 320 | AO78: 4.8000000000000001e-002 | AP78: 5 | AQ78: 震安转债!
A79: 78 | B79: 123101 | C79: 拓斯转债! | D79: 300607 | E79: 拓斯达 | F79: 机械装备 | G79: 机器人及 | H79: 113 | I79: 2.2000000000000001e-003 | J79: -1.7000000000000001e-003 | K79: 15.85 | L79: 3.8e-003 | M79: 115.1 | N79: 26.18 | O79: 0.86599999999999999 | P79: 60.54 | Q79: 已到 | R79: 5.24年 | S79: 3.24年 | T79: 6.7 | U79: 3.2 | V79: 4.0000000000000001e-003 | W79: 9.9000000000000005e-002 | X79: 5.9999999999999998e-002 | Y79: 68 | Z79: 3.06 | AA79: 3.5999999999999999e-003 | AB79: -1.6000000000000001e-003 | AC79: -2.53e-002 | AD79: -2.7300000000000001e-002 | AE79: 90.22 | AF79: 93.25 | AG79: 0.15 | AH79: AA | AI79: 4.1799999999999997e-002 | AJ79: =H79+100*O79 -> 199.59999999999999 | AK79: 165.5 | AL79: 235 | AM79: 72.2 | AN79: 232 | AO79: -1.6e-002 | AP79: 9 | AQ79: 拓斯转债!
A80: 79 | B80: 113620 | C80: 傲农转债! | D80: 603363 | E80: 傲农生物 | F80: 农业 | G80: 畜牧业 | H80: 116.01 | I80: -8.9999999999999998e-004 | J80: -1.32e-002 | K80: 10.97 | L80: -5.0199999999999995e-002 | M80: 121.1 | N80: 14.51 | O80: 0.53400000000000003 | P80: 75.6 | Q80: 已到 | R80: 5.24年 | S80: 3.24年 | T80: 10 | U80: 26 | V80: 2.2000000000000002e-002 | W80: 0.13300000000000001 | X80: 0.10099999999999999 | Y80: 75 | Z80: 3.45 | AA80: 8.3999999999999995e-003 | AB80: 1.4000000000000002e-003 | AC80: -3.2899999999999999e-002 | AD80: -3.4799999999999998e-002 | AE80: 90.22 | AF80: 98.09 | AG80: 0.28 | AH80: AA | AI80: 4.1799999999999997e-002 | AJ80: =H80+100*O80 -> 169.41000000000003 | AK80: 156.4 | AL80: 180 | AM80: 58.3 | AN80: 141 | AO80: -8.0000000000000002e-003 | AP80: 10 | AQ80: 傲农转债!
A81: 80 | B81: 113045 | C81: 环旭转债! | D81: 601231 | E81: 环旭电子 | F81: 电子 | G81: 电子产品 | H81: 122.9 | I81: -1.5e-003 | J81: -8.3000000000000001e-003 | K81: 15.94 | L81: -2.69e-002 | M81: 112 | N81: 19.75 | O81: 0.52300000000000002 | P81: 80.71 | Q81: 已到 | R81: 5.23年 | S81: 2.23年 | T81: 34.5 | U81: 12 | V81: 3.0000000000000001e-003 | W81: 9.8000000000000004e-002 | X81: 7.9000000000000001e-002 | Y81: 352 | Z81: 2.95 | AA81: -1.78e-002 | AB81: -2.1899999999999999e-002 | AC81: -7.1599999999999997e-002 | AD81: -7.3700000000000002e-002 | AE81: 94.38 | AF81: 92.95 | AG81: 0.36 | AH81: AA+ | AI81: 3.6799999999999999e-002 | AJ81: =H81+100*O81 -> 175.20000000000002 | AK81: 165.1 | AL81: 231 | AM81: 70.7 | AN81: 224 | AO81: 2.9999999999999999e-002 | AP81: 6 | AQ81: 环旭转债!
A82: 81 | B82: 128144 | C82: 利民转债! | D82: 2734 | E82: 利民股份 | F82: 化工 | G82: 农化 | H82: 140.2 | I82: 6.5000000000000006e-003 | J82: -3.8e-003 | K82: 12.67 | L82: 4.0000000000000001e-003 | M82: 114.1 | N82: 11.5 | O82: 0.27300000000000002 | P82: 110.17 | Q82: 已到 | R82: 5.22年 | S82: 3.22年 | T82: 9.79 | U82: 14 | V82: 1.e-002 | W82: 0.20800000000000002 | X82: 0.22899999999999998 | Y82: 47 | Z82: 1.88 | AA82: -3.9300000000000002e-002 | AB82: -4.3799999999999999e-002 | AC82: -8.8000000000000009e-002 | AD82: -8.9399999999999993e-002 | AE82: 89.64 | AF82: 92.47 | AG82: 0.67 | AH82: AA | AI82: 4.1799999999999997e-002 | AJ82: =H82+100*O82 -> 167.5 | AK82: 170.2 | AL82: 257 | AM82: 77.8 | AN82: 258 | AO82: 1.e-002 | AP82: 5 | AQ82: 利民转债!
A83: 82 | B83: 118000 | C83: 嘉元转债! | D83: 688388 | E83: 嘉元科技 | F83: 电子 | G83: 电子产品 | H83: 213.68 | I83: -1.0700000000000001e-002 | J83: 4.0000000000000002e-004 | K83: 157.55 | L83: -1.1000000000000001e-002 | M83: 121 | N83: 78.74 | O83: 6.8000000000000005e-002 | P83: 200.09 | Q83: 已到 | R83: 5.20年 | S83: 3.20年 | T83: 9.79 | U83: 565 | V83: 0.26899999999999996 | W83: 2.7000000000000003e-002 | X83: 5.2999999999999999e-002 | Y83: 369 | Z83: 12.31 | AA83: -0.105 | AB83: -0.111 | AC83: -0.11199999999999999 | AD83: -0.11199999999999999 | AE83: 84.84 | AF83: 88.76 | AG83: 0.94 | AH83: AA- | AI83: 6.2800000000000009e-002 | AJ83: =H83+100*O83 -> 220.48000000000002 | AK83: 227.3 | AL83: 336 | AM83: 138.5 | AN83: 339 | AO83: 4.2999999999999997e-002 | AP83: 6 | AQ83: 嘉元转债!
A84: 83 | B84: 123100 | C84: 朗科转债 | D84: 300543 | E84: 朗科智能 | F84: 电子 | G84: 电子产品 | H84: 145.3 | I84: 6.6799999999999998e-002 | J84: 2.92e-002 | K84: 15.8 | L84: 0.11599999999999999 | M84: 117.5 | N84: 11.61 | O84: 6.8000000000000005e-002 | P84: 136.09 | Q84: 已到 | R84: 5.16年 | S84: 3.16年 | T84: 3.8 | U84: 759 | V84: 1.3700000000000001 | W84: 8.9999999999999997e-002 | X84: 0.122 | Y84: 42 | Z84: 4.48 | AA84: -4.1100000000000005e-002 | AB84: -4.6600000000000003e-002 | AC84: -9.6799999999999997e-002 | AD84: -9.8599999999999993e-002 | AE84: 84.97 | AF84: 86.39 | AG84: 0.83 | AH84: AA- | AI84: 6.2800000000000009e-002 | AJ84: =H84+100*O84 -> 152.10000000000002 | AK84: 154.5 | AL84: 165 | AM84: 68.1 | AN84: 208 | AO84: 6.6000000000000003e-002 | AP84: 9 | AQ84: 朗科转债
A85: 84 | B85: 123099 | C85: 普利转债 | D85: 300630 | E85: 普利制药 | F85: 医药 | G85: 化学制药 | H85: 138.539 | I85: -6.8999999999999999e-003 | J85: -6.8999999999999999e-003 | K85: 53.23 | L85: -1.9699999999999999e-002 | M85: 123.5 | N85: 46.03 | O85: 0.19800000000000001 | P85: 115.64 | Q85: 已到 | R85: 5.16年 | S85: 3.16年 | T85: 8.5 | U85: 22 | V85: 1.9e-002 | W85: 3.7000000000000005e-002 | X85: 4.2000000000000003e-002 | Y85: 233 | Z85: 9.78 | AA85: -2.2400000000000003e-002 | AB85: -2.98e-002 | AC85: -8.3699999999999997e-002 | AD85: -8.5600000000000009e-002 | AE85: 84.97 | AF85: 90.77 | AG85: 0.7 | AH85: AA- | AI85: 6.2800000000000009e-002 | AJ85: =H85+100*O85 -> 158.339 | AK85: 161.4 | AL85: 210 | AM85: 70.7 | AN85: 223 | AO85: 1.6e-002 | AP85: 5 | AQ85: 普利转债
A86: 85 | B86: 123098 | C86: 一品转债! | D86: 300723 | E86: 一品红 | F86: 医药 | G86: 医药行业 | H86: 148.8 | I86: 2.4799999999999999e-002 | J86: 3.8e-003 | K86: 33.51 | L86: 3.6799999999999999e-002 | M86: 124 | N86: 25.48 | O86: 0.13100000000000001 | P86: 131.51 | Q86: 已到 | R86: 5年48天 | S86: 3年48天 | T86: 4.25 | U86: 36 | V86: 5.7000000000000002e-002 | W86: 4.4000000000000004e-002 | X86: 5.7999999999999996e-002 | Y86: 97 | Z86: 5.77 | AA86: -3.56e-002 | AB86: -4.2999999999999997e-002 | AC86: -0.10199999999999999 | AD86: -0.10400000000000001 | AE86: 85.21 | AF86: 91.34 | AG86: 0.78 | AH86: AA- | AI86: 6.2800000000000009e-002 | AJ86: =H86+100*O86 -> 161.90000000000001 | AK86: 166.1 | AL86: 239 | AM86: 74.7 | AN86: 240 | AO86: 1.1000000000000001e-002 | AP86: 7 | AQ86: 一品转债!
A87: 86 | B87: 123097 | C87: 美力转债 | D87: 300611 | E87: 美力科技 | F87: 机械装备 | G87: 通用设备 | H87: 140.3 | I87: 5.0900000000000001e-002 | J87: -5.4000000000000003e-003 | K87: 12.16 | L87: 5.74e-002 | M87: 121.6 | N87: 9.28 | O87: 7.0999999999999994e-002 | P87: 131.03 | Q87: 已到 | R87: 5年47天 | S87: 3年47天 | T87: 3 | U87: 637 | V87: 1.54 | W87: 0.13800000000000001 | X87: 0.18100000000000002 | Y87: 22 | Z87: 3.09 | AA87: -2.81e-002 | AB87: -3.5000000000000003e-002 | AC87: -8.6199999999999999e-002 | AD87: -8.8499999999999995e-002 | AE87: 83 | AF87: 85.22 | AG87: 0.79 | AH87: A+ | AI87: 7.3800000000000004e-002 | AJ87: =H87+100*O87 -> 147.40000000000001 | AK87: 149.6 | AL87: 120 | AM87: 64.3 | AN87: 184 | AO87: 6.8000000000000005e-002 | AP87: 22 | AQ87: 美力转债
A88: 87 | B88: 123096 | C88: 思创转债! | D88: 300078 | E88: 思创医惠 | F88: 通信互联 | G88: 物联网 | H88: 113 | I88: -3.0999999999999999e-003 | J88: -6.9999999999999993e-003 | K88: 6.73 | L88: -2.3199999999999998e-002 | M88: 124 | N88: 8.27 | O88: 0.38900000000000001 | P88: 81.38 | Q88: 已到 | R88: 5年46天 | S88: 3年46天 | T88: 8.17 | U88: 5.7 | V88: 6.0000000000000001e-003 | W88: 0.14000000000000001 | X88: 0.114 | Y88: 58 | Z88: 2.13 | AA88: 1.8700000000000001e-002 | AB88: 1.0700000000000001e-002 | AC88: -2.5399999999999999e-002 | AD88: -2.76e-002 | AE88: 85.23 | AF88: 91.37 | AG88: 0.44 | AH88: AA- | AI88: 6.2800000000000009e-002 | AJ88: =H88+100*O88 -> 151.90000000000001 | AK88: 144.6 | AL88: 73 | AM88: 53.2 | AN88: 115 | AO88: 1.e-003 | AP88: 14 | AQ88: 思创转债!
A89: 88 | B89: 113621 | C89: 彤程转债! | D89: 603650 | E89: 彤程新材 | F89: 化工 | G89: 橡胶塑料 | H89: 178.05 | I89: -1.3999999999999999e-002 | J89: 1.5900000000000001e-002 | K89: 52.47 | L89: 2.0999999999999999e-003 | M89: 115.1 | N89: 32.62 | O89: 0.107 | P89: 160.85 | Q89: 已到 | R89: 5年46天 | S89: 3年46天 | T89: 5.37 | U89: 182 | V89: 0.19 | W89: 1.7000000000000001e-002 | X89: 2.7999999999999997e-002 | Y89: 313 | Z89: 11.68 | AA89: -8.2899999999999988e-002 | AB89: -8.7499999999999994e-002 | AC89: -0.14800000000000002 | AD89: -0.14999999999999999 | AE89: 90.65 | AF89: 93.7 | AG89: 0.91 | AH89: AA | AI89: 4.1799999999999997e-002 | AJ89: =H89+100*O89 -> 188.75 | AK89: 195.2 | AL89: 317 | AM89: 101.5 | AN89: 315 | AO89: -4.9000000000000002e-002 | AP89: 8 | AQ89: 彤程转债!
A90: 89 | B90: 113042 | C90: 上银转债! | D90: 601229 | E90: 上海银行 | F90: 金融 | G90: 银行行业 | H90: 105.18 | I90: 1.1000000000000001e-003 | J90: -1.4000000000000002e-003 | K90: 7.21 | L90: -1.4000000000000002e-003 | M90: 120.9 | N90: 10.63 | O90: 0.55100000000000005 | P90: 67.83 | Q90: 已到 | R90: 5年45天 | S90: 无权 | T90: 200 | U90: 67 | V90: 3.0000000000000001e-003 | W90: 0.19500000000000001 | X90: 0.13200000000000001 | Y90: 1024. | Z90: 0.57 | AA90: 2.8399999999999998e-002 | AB90: 2.1099999999999997e-002 | AC90: 无权 | AD90: 无权 | AE90: 无权 | AF90: 102.01 | AG90: 0.18 | AH90: AAA | AI90: 3.4799999999999998e-002 | AJ90: =H90+100*O90 -> 160.28 | AK90: 142.5 | AL90: 54 | AM90: 40.5 | AN90: 32 | AO90: -1.e-003 | AP90: 14 | AQ90: 上银转债!
A91: 90 | B91: 113619 | C91: 世运转债! | D91: 603920 | E91: 世运电路 | F91: 电子 | G91: 元器件制 | H91: 134.97 | I91: -4.4000000000000003e-003 | J91: -8.1000000000000013e-003 | K91: 21.25 | L91: -1.9799999999999998e-002 | M91: 115.2 | N91: 19.92 | O91: 0.26500000000000001 | P91: 106.68 | Q91: 已到 | R91: 5年40天 | S91: 3年40天 | T91: 10 | U91: 21 | V91: 1.4999999999999999e-002 | W91: 8.8000000000000009e-002 | X91: 9.4e-002 | Y91: 113 | Z91: 4.33 | AA91: -3.1099999999999999e-002 | AB91: -3.61e-002 | AC91: -7.8e-002 | AD91: -7.980000000000001e-002 | AE91: 90.81 | AF91: 93.86 | AG91: 0.63 | AH91: AA | AI91: 4.1799999999999997e-002 | AJ91: =H91+100*O91 -> 161.47 | AK91: 163.3 | AL91: 223 | AM91: 69.4 | AN91: 216 | AO91: -1.7000000000000001e-002 | AP91: 6 | AQ91: 世运转债!
A92: 91 | B92: 123093 | C92: 金陵转债! | D92: 300651 | E92: 金陵体育 | F92: 其他 | G92: 文化教育 | H92: 118.2 | I92: 3.9000000000000003e-003 | J92: -3.8e-003 | K92: 27.05 | L92: 1.1000000000000001e-003 | M92: 129.3 | N92: 49.19 | O92: 1.1499999999999999 | P92: 54.99 | Q92: 已到 | R92: 5年39天 | S92: 3年39天 | T92: 2.5 | U92: 7.5 | V92: 2.6000000000000002e-002 | W92: 7.2000000000000008e-002 | X92: 3.9e-002 | Y92: 35 | Z92: 5 | AA92: 1.83e-002 | AB92: 8.8000000000000005e-003 | AC92: -3.2099999999999997e-002 | AD92: -3.56e-002 | AE92: 84.59 | AF92: 90.96 | AG92: 0.17 | AH92: A+ | AI92: 7.3800000000000004e-002 | AJ92: =H92+100*O92 -> 233.19999999999999 | AK92: 181.4 | AL92: 290 | AM92: 90.4 | AN92: 290 | AO92: -4.2000000000000003e-002 | AP92: 10 | AQ92: 金陵转债!
A93: 92 | B93: 113618 | C93: 美诺转债! | D93: 603538 | E93: 美诺华 | F93: 医药 | G93: 原料药 | H93: 126.73 | I93: 3.2000000000000002e-003 | J93: -2.0999999999999999e-003 | K93: 33.56 | L93: 1.8e-003 | M93: 115.3 | N93: 37.47 | O93: 0.41499999999999998 | P93: 89.56 | Q93: 已到 | R93: 5年34天 | S93: 3年34天 | T93: 5.2 | U93: 8.3 | V93: 1.3000000000000001e-002 | W93: 0.10400000000000001 | X93: 9.3000000000000013e-002 | Y93: 50 | Z93: 2.97 | AA93: -1.8799999999999997e-002 | AB93: -2.3900000000000001e-002 | AC93: -5.9999999999999998e-002 | AD93: -6.2e-002 | AE93: 85.31 | AF93: 85.15 | AG93: 0.58 | AH93: AA- | AI93: 6.2800000000000009e-002 | AJ93: =H93+100*O93 -> 168.23000000000002 | AK93: 163.9 | AL93: 227 | AM93: 78.6 | AN93: 260 | AO93: -1.2e-002 | AP93: 5 | AQ93: 美诺转债!
A94: 93 | B94: 128143 | C94: 锋龙转债! | D94: 2931 | E94: 锋龙股份 | F94: 机械装备 | G94: 专用设备 | H94: 131.2 | I94: 1.7100000000000001e-002 | J94: -2.3e-003 | K94: 15.02 | L94: 1.9699999999999999e-002 | M94: 121.7 | N94: 12.73 | O94: 0.11199999999999999 | P94: 117.99 | Q94: 已到 | R94: 5年28天 | S94: 3年28天 | T94: 2.44 | U94: 20 | V94: 6.2e-002 | W94: 8.199999999999999e-002 | X94: 9.6000000000000002e-002 | Y94: 30 | Z94: 4.71 | AA94: -1.5100000000000001e-002 | AB94: -2.2099999999999998e-002 | AC94: -6.8199999999999997e-002 | AD94: -7.0599999999999996e-002 | AE94: 83.32 | AF94: 85.61 | AG94: 0.75 | AH94: A+ | AI94: 7.3800000000000004e-002 | AJ94: =H94+100*O94 -> 142.39999999999998 | AK94: 144.4 | AL94: 72 | AM94: 58.8 | AN94: 146 | AO94: -3.2000000000000001e-002 | AP94: 16 | AQ94: 锋龙转债!
A95: 94 | B95: 127028 | C95: 英特转债! | D95: 411 | E95: 英特集团 | F95: 医药 | G95: 医药商业 | H95: 114.859 | I95: 2.7000000000000001e-003 | J95: -2.7000000000000001e-003 | K95: 12.68 | L95: 0. | M95: 113.1 | N95: 13.4 | O95: 0.214 | P95: 94.63 | Q95: 已到 | R95: 5年25天 | S95: 3年25天 | T95: 6 | U95: 4.9 | V95: 6.9999999999999993e-003 | W95: 0.19 | X95: 0.17999999999999999 | Y95: 32 | Z95: 1.78 | AA95: -3.0999999999999999e-003 | AB95: -7.8000000000000005e-003 | AC95: -3.1699999999999999e-002 | AD95: -3.3700000000000001e-002 | AE95: 92.28 | AF95: 94.53 | AG95: 0.52 | AH95: AA+ | AI95: 3.6799999999999999e-002 | AJ95: =H95+100*O95 -> 136.25899999999999 | AK95: 135.1 | AL95: 21 | AM95: 40.6 | AN95: 33 | AO95: -1.9e-002 | AP95: 30 | AQ95: 英特转债!
A96: 95 | B96: 113616 | C96: 韦尔转债! | D96: 603501 | E96: 韦尔股份 | F96: 电子 | G96: 元器件制 | H96: 165.2 | I96: -1.18e-002 | J96: 3.2000000000000002e-003 | K96: 305.98 | L96: -1.04e-002 | M96: 114.5 | N96: 222.52 | O96: 0.20100000000000001 | P96: 137.51 | Q96: 已到 | R96: 5年17天 | S96: 3年17天 | T96: 24.3 | U96: 220 | V96: 5.5e-002 | W96: 9.0000000000000011e-003 | X96: 1.3000000000000001e-002 | Y96: 2659. | Z96: 18.35 | AA96: -7.1099999999999997e-002 | AB96: -7.5600000000000001e-002 | AC96: -0.13400000000000001 | AD96: -0.13600000000000001 | AE96: 91.78 | AF96: 95.7 | AG96: 0.83 | AH96: AA+ | AI96: 3.6799999999999999e-002 | AJ96: =H96+100*O96 -> 185.29999999999998 | AK96: 192.9 | AL96: 311 | AM96: 97.2 | AN96: 308 | AO96: 8.6999999999999994e-002 | AP96: 9 | AQ96: 韦尔转债!
A97: 96 | B97: 123092 | C97: 天壕转债! | D97: 300332 | E97: 天壕环境 | F97: 石油天然 | G97: 天然气 | H97: 229.26 | I97: 1.2999999999999999e-003 | J97: -3.8e-003 | K97: 11.57 | L97: -2.5999999999999999e-003 | M97: 121.6 | N97: 5.19 | O97: 2.7999999999999997e-002 | P97: 222.93 | Q97: 已到 | R97: 5年13天 | S97: 3年13天 | T97: 4.17 | U97: 214 | V97: 0.22399999999999998 | W97: 4.0999999999999995e-002 | X97: 9.0999999999999998e-002 | Y97: 102 | Z97: 2.99 | AA97: -0.121 | AB97: -0.127 | AC97: -0.129 | AD97: -0.129 | AE97: 83.55 | AF97: 85.78 | AG97: 0.96 | AH97: A+ | AI97: 7.3800000000000004e-002 | AJ97: =H97+100*O97 -> 232.06 | AK97: 235.6 | AL97: 342 | AM97: 149.8 | AN97: 341 | AO97: -5.5e-002 | AP97: 9 | AQ97: 天壕转债!
A98: 97 | B98: 113615 | C98: 金诚转债! | D98: 603979 | E98: 金诚信 | F98: 有色金属 | G98: 有色行业 | H98: 176.69 | I98: -1.6799999999999999e-002 | J98: 1.2999999999999999e-003 | K98: 19.9 | L98: -1.7299999999999999e-002 | M98: 117.3 | N98: 12.65 | O98: 0.12300000000000001 | P98: 157.31 | Q98: 已到 | R98: 5年12天 | S98: 3年12天 | T98: 8.66 | U98: 80 | V98: 5.2999999999999999e-002 | W98: 7.2999999999999995e-002 | X98: 0.115 | Y98: 118 | Z98: 2.39 | AA98: -7.9600000000000004e-002 | AB98: -8.4900000000000003e-002 | AC98: -0.14999999999999999 | AD98: -0.152 | AE98: 91.2 | AF98: 95.88 | AG98: 0.9 | AH98: AA | AI98: 4.1799999999999997e-002 | AJ98: =H98+100*O98 -> 188.99000000000001 | AK98: 196.1 | AL98: 318 | AM98: 100.2 | AN98: 311 | AO98: -1.9e-002 | AP98: 3 | AQ98: 金诚转债!
A99: 98 | B99: 123091 | C99: 长海转债 | D99: 300196 | E99: 长海股份 | F99: 其他 | G99: 非金属矿 | H99: 135.5 | I99: -4.5999999999999999e-003 | J99: -5.6000000000000008e-003 | K99: 17.51 | L99: -1.5700000000000002e-002 | M99: 116.2 | N99: 16.14 | O99: 0.249 | P99: 108.49 | Q99: 已到 | R99: 5年12天 | S99: 3年12天 | T99: 5.5 | U99: 13 | V99: 1.8000000000000002e-002 | W99: 7.6999999999999999e-002 | X99: 8.3000000000000004e-002 | Y99: 72 | Z99: 2.21 | AA99: -3.0600000000000002e-002 | AB99: -3.61e-002 | AC99: -8.09e-002 | AD99: -8.2799999999999999e-002 | AE99: 91.1 | AF99: 94.97 | AG99: 0.65 | AH99: AA | AI99: 4.1799999999999997e-002 | AJ99: =H99+100*O99 -> 160.40000000000001 | AK99: 162.5 | AL99: 218 | AM99: 67.5 | AN99: 202 | AO99: -3.1e-002 | AP99: 4 | AQ99: 长海转债
A100: 99 | B100: 123089 | C100: 九洲转2!! | D100: 300040 | E100: 九洲集团 | F100: 能源电力 | G100: 电力设备 | H100: 193 | I100: 6.3e-003 | J100: -8.9999999999999998e-004 | K100: 10.55 | L100: 5.6999999999999993e-003 | M100: 121 | N100: 5.68 | O100: 3.9e-002 | P100: 185.74 | Q100: 已到 | R100: 5年10天 | S100: 3年10天 | T100: 3.06 | U100: 209 | V100: 0.35399999999999998 | W100: 4.9000000000000002e-002 | X100: 9.1999999999999998e-002 | Y100: 62 | Z100: 2.42 | AA100: -9.0299999999999991e-002 | AB100: -9.6500000000000002e-002 | AC100: -0.10800000000000001 | AD100: -0.109 | AE100: 85.75 | AF100: 89.72 | AG100: 0.93 | AH100: AA- | AI100: 6.2800000000000009e-002 | AJ100: =H100+100*O100 -> 196.90000000000001 | AK100: 200.3 | AL100: 322 | AM100: 110.5 | AN100: 322 | AO100: -2.1000000000000001e-002 | AP100: 18 | AQ100: 九洲转2!!
A101: 100 | B101: 123090 | C101: 三诺转债! | D101: 300298 | E101: 三诺生物 | F101: 医药 | G101: 医疗器械 | H101: 119.899 | I101: 3.4000000000000002e-003 | J101: -4.4000000000000003e-003 | K101: 27.78 | L101: -2.8999999999999998e-003 | M101: 117.1 | N101: 35.18 | O101: 0.51800000000000002 | P101: 78.97 | Q101: 已到 | R101: 5年10天 | S101: 3年10天 | T101: 5 | U101: 2.3 | V101: 4.0000000000000001e-003 | W101: 3.2000000000000001e-002 | X101: 2.5000000000000001e-002 | Y101: 157 | Z101: 5.8 | AA101: -4.7999999999999996e-003 | AB101: -1.0700000000000001e-002 | AC101: -4.5100000000000001e-002 | AD101: -4.7100000000000003e-002 | AE101: 91.02 | AF101: 95.71 | AG101: 0.34 | AH101: AA | AI101: 4.1799999999999997e-002 | AJ101: =H101+100*O101 -> 171.69900000000001 | AK101: 160.8 | AL101: 200 | AM101: 65.1 | AN101: 187 | AO101: -2.7000000000000003e-002 | AP101: 5 | AQ101: 三诺转债!
A102: 101 | B102: 128142 | C102: 新乳转债! | D102: 2946 | E102: 新乳业 | F102: 食品饮料 | G102: 乳制品 | H102: 123.01 | I102: 8.9999999999999998e-004 | J102: 1.2699999999999999e-002 | K102: 15.7 | L102: 3.2899999999999999e-002 | M102: 115.1 | N102: 18.47 | O102: 0.44700000000000001 | P102: 85 | Q102: 已到 | R102: 5年7天 | S102: 3年7天 | T102: 7.18 | U102: 72 | V102: 8.1000000000000003e-002 | W102: 5.2999999999999999e-002 | X102: 4.4999999999999998e-002 | Y102: 136 | Z102: 5.35 | AA102: -1.34e-002 | AB102: -1.8700000000000001e-002 | AC102: -5.2900000000000003e-002 | AD102: -5.4900000000000004e-002 | AE102: 91.05 | AF102: 94.11 | AG102: 0.41 | AH102: AA | AI102: 4.1799999999999997e-002 | AJ102: =H102+100*O102 -> 167.71000000000001 | AK102: 161 | AL102: 202 | AM102: 66.9 | AN102: 196 | AO102: 4.7e-002 | AP102: 5 | AQ102: 新乳转债!
A103: 102 | B103: 128141 | C103: 旺能转债 | D103: 2034 | E103: 旺能环境 | F103: 城市公用 | G103: 三废处理 | H103: 124.274 | I103: 1.1999999999999999e-003 | J103: -8.8000000000000005e-003 | K103: 16.74 | L103: -1.24e-002 | M103: 115.1 | N103: 15.97 | O103: 0.18600000000000003 | P103: 104.82 | Q103: 已到 | R103: 5年6.1天 | S103: 3年6.1天 | T103: 12.7 | U103: 18 | V103: 1.2e-002 | W103: 0.17699999999999999 | X103: 0.185 | Y103: 72 | Z103: 1.43 | AA103: -1.55e-002 | AB103: -2.07e-002 | AC103: -5.5999999999999994e-002 | AD103: -5.7999999999999996e-002 | AE103: 91.06 | AF103: 94.12 | AG103: 0.61 | AH103: AA | AI103: 4.1799999999999997e-002 | AJ103: =H103+100*O103 -> 142.874 | AK103: 143.7 | AL103: 64 | AM103: 49.6 | AN103: 87 | AO103: 2.e-003 | AP103: 8 | AQ103: 旺能转债
A104: 103 | B104: 113614 | C104: 健20转债!!* | D104: 603707 | E104: 健友股份 | F104: 医药 | G104: 原料药 | H104: 141.11 | I104: -3.2199999999999999e-002 | J104: 5.0000000000000001e-004 | K104: 41.17 | L104: -3.1699999999999999e-002 | M104: 114.2 | N104: 29.12 | O104: -2.e-003 | P104: 141.38 | Q104: 已到 | R104: 4.1天 | S104: 无权 | T104: 1.36 | U104: 89 | V104: 0.45899999999999996 | W104: 3.0000000000000001e-003 | X104: 4.0000000000000001e-003 | Y104: 501 | Z104: 11.67 | AA104: <-100% | AB104: <-100% | AC104: 无权 | AD104: 无权 | AE104: 无权 | AF104: 100.26 | AG104: 1 | AH104: AA | AI104: 3.6200000000000003e-002 | AJ104: =H104+100*O104 -> 140.91000000000003 | AK104: 140.8 | AL104: 40 | AM104: 40.6 | AN104: 35 | AO104: -2.e-002 | AP104: 4 | AQ104: 健20转债!!*
A105: 104 | B105: 123087 | C105: 明电转债! | D105: 300739 | E105: 明阳电路 | F105: 电子 | G105: 元器件制 | H105: 130.13 | I105: 3.4999999999999996e-003 | J105: -7.6e-003 | K105: 18.45 | L105: -5.8999999999999999e-003 | M105: 121.2 | N105: 16.32 | O105: 0.151 | P105: 113.05 | Q105: 已到 | R105: 5年4.1天 | S105: 4年4.1天 | T105: 4.19 | U105: 38 | V105: 7.0000000000000007e-002 | W105: 7.6999999999999999e-002 | X105: 8.6999999999999994e-002 | Y105: 54 | Z105: 3.28 | AA105: -1.44e-002 | AB105: -2.1499999999999998e-002 | AC105: -4.7199999999999999e-002 | AD105: -4.99e-002 | AE105: 83.16 | AF105: 89.99 | AG105: 0.7 | AH105: AA- | AI105: 6.2800000000000009e-002 | AJ105: =H105+100*O105 -> 145.22999999999999 | AK105: 147.2 | AL105: 94 | AM105: 57.2 | AN105: 134 | AO105: -6.3e-002 | AP105: 19 | AQ105: 明电转债!
A106: 105 | B106: 123088 | C106: 威唐转债! | D106: 300707 | E106: 威唐工业 | F106: 汽车 | G106: 零部件制 | H106: 136.333 | I106: 0.11 | J106: 2.87e-002 | K106: 22.12 | L106: 0.20000000000000001 | M106: 121.6 | N106: 20.72 | O106: 0.27699999999999997 | P106: 106.76 | Q106: 已到 | R106: 5年4.1天 | S106: 3年4.1天 | T106: 3.01 | U106: 2586. | V106: 6.3300000000000001 | W106: 8.6999999999999994e-002 | X106: 9.3000000000000013e-002 | Y106: 35 | Z106: 4.94 | AA106: -2.3099999999999999e-002 | AB106: -3.0200000000000001e-002 | AC106: -8.09e-002 | AD106: -8.3299999999999999e-002 | AE106: 83.7 | AF106: 85.94 | AG106: 0.69 | AH106: A+ | AI106: 7.3800000000000004e-002 | AJ106: =H106+100*O106 -> 164.03299999999999 | AK106: 165.9 | AL106: 237 | AM106: 80 | AN106: 263 | AO106: 9.9000000000000005e-002 | AP106: 18 | AQ106: 威唐转债!
A107: 106 | B107: 113044 | C107: 大秦转债! | D107: 601006 | E107: 大秦铁路 | F107: 铁路 | G107: 铁路运输 | H107: 107.2 | I107: -8.0000000000000004e-004 | J107: -8.1000000000000013e-003 | K107: 6.21 | L107: -2.2000000000000002e-002 | M107: 114.1 | N107: 7.18 | O107: 0.23899999999999999 | P107: 86.49 | Q107: 已到 | R107: 5年3.1天 | S107: 3年3.1天 | T107: 320 | U107: 137 | V107: 4.0000000000000001e-003 | W107: 0.34700000000000003 | X107: 0.29999999999999999 | Y107: 923 | Z107: 0.77 | AA107: 1.2800000000000001e-002 | AB107: 7.6e-003 | AC107: -9.7999999999999997e-003 | AD107: -1.21e-002 | AE107: 93.33 | AF107: 96.5 | AG107: 0.4 | AH107: AAA | AI107: 3.4799999999999998e-002 | AJ107: =H107+100*O107 -> 131.09999999999999 | AK107: 127.9 | AL107: 6 | AM107: 31.4 | AN107: 9 | AO107: 2.e-003 | AP107: 31 | AQ107: 大秦转债!
A108: 107 | B108: 123085 | C108: 万顺转2!! | D108: 300057 | E108: 万顺新材 | F108: 有色金属 | G108: 铝金属 | H108: 161.5 | I108: 4.4199999999999996e-002 | J108: 1.34e-002 | K108: 9.71 | L108: 6.3500000000000001e-002 | M108: 113.3 | N108: 6.2 | O108: 3.1e-002 | P108: 156.61 | Q108: 已到 | R108: 5年0.1天 | S108: 3年0.1天 | T108: 8.65 | U108: 133 | V108: 9.6000000000000002e-002 | W108: 0.13100000000000001 | X108: 0.20499999999999999 | Y108: 66 | Z108: 1.84 | AA108: -6.9699999999999998e-002 | AB108: -7.400000000000001e-002 | AC108: -0.129 | AD108: -0.13 | AE108: 85.79 | AF108: 84.15 | AG108: 0.91 | AH108: AA- | AI108: 6.2800000000000009e-002 | AJ108: =H108+100*O108 -> 164.59999999999999 | AK108: 166.4 | AL108: 240 | AM108: 80.6 | AN108: 264 | AO108: 3.7999999999999999e-002 | AP108: 20 | AQ108: 万顺转2!!
A109: 108 | B109: 123086 | C109: 海兰转债!! | D109: 300065 | E109: 海兰信 | F109: 电子 | G109: 电子产品 | H109: 236.798 | I109: -9.1999999999999998e-003 | J109: -1.3000000000000001e-002 | K109: 16.49 | L109: -2.3099999999999999e-002 | M109: 123.5 | N109: 7.27 | O109: 4.4000000000000004e-002 | P109: 226.82 | Q109: 已到 | R109: 5年0.1天 | S109: 3年0.1天 | T109: 4.82 | U109: 684 | V109: 0.59799999999999998 | W109: 4.7e-002 | X109: 0.107 | Y109: 103 | Z109: 6.17 | AA109: -0.124 | AB109: -0.13100000000000001 | AC109: -0.13500000000000001 | AD109: -0.13600000000000001 | AE109: 85.82 | AF109: 91.69 | AG109: 0.96 | AH109: AA- | AI109: 6.2800000000000009e-002 | AJ109: =H109+100*O109 -> 241.19800000000001 | AK109: 246.8 | AL109: 345 | AM109: 155.1 | AN109: 346 | AO109: -6.7000000000000004e-002 | AP109: 19 | AQ109: 海兰转债!!
A110: 109 | B110: 123084 | C110: 高澜转债!! | D110: 300499 | E110: 高澜股份 | F110: 能源电力 | G110: 电力设备 | H110: 218 | I110: 3.0699999999999998e-002 | J110: 3.4999999999999996e-003 | K110: 17.68 | L110: 3.6299999999999999e-002 | M110: 121.9 | N110: 9.01 | O110: 0.111 | P110: 196.23 | Q110: 已到 | R110: 4.998年 | S110: 2.998年 | T110: 2.54 | U110: 491 | V110: 0.89700000000000002 | W110: 5.0999999999999997e-002 | X110: 0.10099999999999999 | Y110: 50 | Z110: 5.76 | AA110: -0.11199999999999999 | AB110: -0.11900000000000001 | AC110: -0.125 | AD110: -0.126 | AE110: 83.46 | AF110: 85.76 | AG110: 0.94 | AH110: A+ | AI110: 7.3800000000000004e-002 | AJ110: =H110+100*O110 -> 229.09999999999999 | AK110: 239.8 | AL110: 343 | AM110: 154 | AN110: 345 | AO110: -8.900000000000001e-002 | AP110: 14 | AQ110: 高澜转债!!
A111: 110 | B111: 127027 | C111: 靖远转债! | D111: 552 | E111: 靖远煤电 | F111: 煤炭 | G111: 煤炭开采 | H111: 116.491 | I111: -8.6e-003 | J111: 5.1999999999999998e-003 | K111: 3.01 | L111: -6.6e-003 | M111: 115.3 | N111: 3.13 | O111: 0.21100000000000002 | P111: 96.17 | Q111: 已到 | R111: 4.998年 | S111: 2.998年 | T111: 24.3 | U111: 27 | V111: 9.0000000000000011e-003 | W111: 0.34399999999999997 | X111: 0.33000000000000002 | Y111: 71 | Z111: 0.85 | AA111: -2.8000000000000004e-003 | AB111: -8.1000000000000013e-003 | AC111: -3.7200000000000004e-002 | AD111: -3.9199999999999999e-002 | AE111: 92.31 | AF111: 96.24 | AG111: 0.51 | AH111: AA+ | AI111: 3.6799999999999999e-002 | AJ111: =H111+100*O111 -> 137.59100000000001 | AK111: 136.8 | AL111: 26 | AM111: 40.6 | AN111: 34 | AO111: 1.8000000000000002e-002 | AP111: 40 | AQ111: 靖远转债!
A112: 111 | B112: 113043 | C112: XD财通转! | D112: 601108 | E112: 财通证券 | F112: 金融 | G112: 证券行业 | H112: 118.26 | I112: -3.0000000000000001e-003 | J112: -1.1000000000000001e-003 | K112: 11.11 | L112: -9.7999999999999997e-003 | M112: 110.2 | N112: 13.13 | O112: 0.39799999999999996 | P112: 84.62 | Q112: 已到 | R112: 4.998年 | S112: 无权 | T112: 38 | U112: 43 | V112: 1.e-002 | W112: 9.5000000000000001e-002 | X112: 8.1000000000000003e-002 | Y112: 399 | Z112: 1.71 | AA112: -1.46e-002 | AB112: -1.8200000000000001e-002 | AC112: 无权 | AD112: 无权 | AE112: 无权 | AF112: 92.94 | AG112: 0.42 | AH112: AAA | AI112: 3.4799999999999998e-002 | AJ112: =H112+100*O112 -> 158.06 | AK112: 151.9 | AL112: 145 | AM112: 59 | AN112: 149 | AO112: 5.9000000000000004e-002 | AP112: 11 | AQ112: XD财通转!
A113: 112 | B113: 123083 | C113: 朗新转债! | D113: 300682 | E113: 朗新科技 | F113: 计算机及 | G113: 软件开发 | H113: 243.798 | I113: 1.84e-002 | J113: -9.1000000000000004e-003 | K113: 37.35 | L113: 9.4999999999999998e-003 | M113: 115.1 | N113: 15.4 | O113: 5.0000000000000001e-003 | P113: 242.53 | Q113: 已到 | R113: 4.99年 | S113: 2.99年 | T113: 6.26 | U113: 587 | V113: 0.38200000000000001 | W113: 1.6e-002 | X113: 3.9e-002 | Y113: 390 | Z113: 7.1 | AA113: -0.14199999999999999 | AB113: -0.14599999999999999 | AC113: -0.13900000000000001 | AD113: -0.14000000000000001 | AE113: 91.25 | AF113: 94.57 | AG113: 0.98 | AH113: AA | AI113: 4.0300000000000002e-002 | AJ113: =H113+100*O113 -> 244.298 | AK113: 245.1 | AL113: 344 | AM113: 150.5 | AN113: 343 | AO113: -6.0000000000000001e-003 | AP113: 6 | AQ113: 朗新转债!
A114: 113 | B114: 127026 | C114: 超声转债! | D114: 823 | E114: 超声电子 | F114: 电子 | G114: 元器件制 | H114: 127.23 | I114: 1.e-004 | J114: -8.8000000000000005e-003 | K114: 12.75 | L114: -1.47e-002 | M114: 112.8 | N114: 12.72 | O114: 0.26899999999999996 | P114: 100.24 | Q114: 已到 | R114: 4.99年 | S114: 2.99年 | T114: 7 | U114: 6.1 | V114: 6.9999999999999993e-003 | W114: 0.10199999999999999 | X114: 0.10199999999999999 | Y114: 68 | Z114: 1.72 | AA114: -2.4199999999999999e-002 | AB114: -2.87e-002 | AC114: -6.4199999999999993e-002 | AD114: -6.6000000000000003e-002 | AE114: 91.26 | AF114: 92.94 | AG114: 0.59 | AH114: AA | AI114: 4.0300000000000002e-002 | AJ114: =H114+100*O114 -> 154.13 | AK114: 154.2 | AL114: 162 | AM114: 61.3 | AN114: 163 | AO114: -6.5000000000000002e-002 | AP114: 13 | AQ114: 超声转债!
A115: 114 | B115: 128140 | C115: 润建转债!! | D115: 2929 | E115: 润建股份 | F115: 通信互联 | G115: 通信设备 | H115: 150.472 | I115: 7.1999999999999998e-003 | J115: -2.8999999999999998e-003 | K115: 34.4 | L115: 5.6000000000000008e-003 | M115: 114.9 | N115: 26.4 | O115: 0.155 | P115: 130.3 | Q115: 已到 | R115: 4.99年 | S115: 2.99年 | T115: 10.9 | U115: 23 | V115: 1.3999999999999999e-002 | W115: 0.14000000000000001 | X115: 0.183 | Y115: 78 | Z115: 2.24 | AA115: -5.3499999999999999e-002 | AB115: -5.8400000000000001e-002 | AC115: -0.111 | AD115: -0.11199999999999999 | AE115: 91.37 | AF115: 94.69 | AG115: 0.79 | AH115: AA | AI115: 4.0300000000000002e-002 | AJ115: =H115+100*O115 -> 165.97200000000001 | AK115: 170.6 | AL115: 262 | AM115: 75.9 | AN115: 249 | AO115: -5.4000000000000006e-002 | AP115: 10 | AQ115: 润建转债!!
A116: 115 | B116: 123082 | C116: 北陆转债! | D116: 300016 | E116: 北陆药业 | F116: 医药 | G116: 化学制药 | H116: 116.456 | I116: -2.0999999999999999e-003 | J116: -3.5999999999999999e-003 | K116: 7.8 | L116: -1.0200000000000001e-002 | M116: 121.2 | N116: 8.81 | O116: 0.315 | P116: 88.54 | Q116: 已到 | R116: 4.99年 | S116: 2.99年 | T116: 4.99 | U116: 2.6 | V116: 5.0000000000000001e-003 | W116: 0.13 | X116: 0.115 | Y116: 38 | Z116: 2.24 | AA116: 8.199999999999999e-003 | AB116: 8.9999999999999998e-004 | AC116: -3.5099999999999999e-002 | AD116: -3.7499999999999999e-002 | AE116: 83.71 | AF116: 86.23 | AG116: 0.56 | AH116: A+ | AI116: 7.2300000000000003e-002 | AJ116: =H116+100*O116 -> 147.95600000000002 | AK116: 144.4 | AL116: 70 | AM116: 58.1 | AN116: 140 | AO116: -1.e-002 | AP116: 17 | AQ116: 北陆转债!
A117: 116 | B117: 123081 | C117: 精研转债!!* | D117: 300709 | E117: 精研科技 | F117: 电子 | G117: 电子产品 | H117: 152.9 | I117: -2.1099999999999997e-002 | J117: -7.0999999999999995e-003 | K117: 51.8 | L117: -2.81e-002 | M117: 120.9 | N117: 34.15 | O117: 8.0000000000000002e-003 | P117: 151.68 | Q117: 已到 | R117: 9天 | S117: 无权 | T117: 1.22 | U117: 98 | V117: 0.51700000000000002 | W117: 1.6e-002 | X117: 2.4e-002 | Y117: 77 | Z117: 4.25 | AA117: <-100% | AB117: <-100% | AC117: 无权 | AD117: 无权 | AE117: 无权 | AF117: 99.89 | AG117: 1 | AH117: AA- | AI117: 5.7200000000000001e-002 | AJ117: =H117+100*O117 -> 153.70000000000002 | AK117: 154.1 | AL117: 161 | AM117: 54.2 | AN117: 118 | AO117: -4.5999999999999999e-002 | AP117: 10 | AQ117: 精研转债!!*
A118: 117 | B118: 123080 | C118: 海波转债! | D118: 300517 | E118: 海波重科 | F118: 建筑 | G118: 建筑工程 | H118: 130.22 | I118: 9.5999999999999992e-003 | J118: -4.3e-003 | K118: 13.73 | L118: 7.3000000000000001e-003 | M118: 126 | N118: 11.58 | O118: 9.8000000000000004e-002 | P118: 118.57 | Q118: 已到 | R118: 4.98年 | S118: 2.98年 | T118: 2.44 | U118: 18 | V118: 5.7000000000000002e-002 | W118: 9.1999999999999998e-002 | X118: 0.11 | Y118: 26 | Z118: 3.07 | AA118: -6.7000000000000002e-003 | AB118: -1.52e-002 | AC118: -6.9199999999999998e-002 | AD118: -7.1399999999999991e-002 | AE118: 83.84 | AF118: 89.71 | AG118: 0.72 | AH118: A+ | AI118: 7.2300000000000003e-002 | AJ118: =H118+100*O118 -> 140.02000000000001 | AK118: 141.9 | AL118: 47 | AM118: 52.2 | AN118: 110 | AO118: -6.0000000000000001e-003 | AP118: 24 | AQ118: 海波转债!
A119: 118 | B119: 113610 | C119: 灵康转债 | D119: 603669 | E119: 灵康药业 | F119: 医药 | G119: 化学制药 | H119: 126.73 | I119: -6.8999999999999999e-003 | J119: 1.1200000000000002e-002 | K119: 10.07 | L119: 6.0000000000000001e-003 | M119: 120.7 | N119: 8.61 | O119: 8.4000000000000005e-002 | P119: 116.96 | Q119: 已到 | R119: 4.97年 | S119: 2.97年 | T119: 4.58 | U119: 132 | V119: 0.22500000000000001 | W119: 6.3e-002 | X119: 7.400000000000001e-002 | Y119: 73 | Z119: 5.27 | AA119: -9.8999999999999991e-003 | AB119: -1.6899999999999998e-002 | AC119: -6.2600000000000003e-002 | AD119: -6.4600000000000005e-002 | AE119: 86.11 | AF119: 90.33 | AG119: 0.72 | AH119: AA- | AI119: 6.13e-002 | AJ119: =H119+100*O119 -> 135.13 | AK119: 136.5 | AL119: 25 | AM119: 46.2 | AN119: 64 | AO119: 0.161 | AP119: 29 | AQ119: 灵康转债
A120: 119 | B120: 128139 | C120: 祥鑫转债! | D120: 2965 | E120: 祥鑫科技 | F120: 汽车 | G120: 零部件制 | H120: 116 | I120: 1.8200000000000001e-002 | J120: -1.49e-002 | K120: 25.85 | L120: 1.0200000000000001e-002 | M120: 120.6 | N120: 36.52 | O120: 0.63900000000000001 | P120: 70.78 | Q120: 已到 | R120: 4.97年 | S120: 2.97年 | T120: 6.47 | U120: 7.9 | V120: 1.1000000000000001e-002 | W120: 0.16300000000000001 | X120: 0.115 | Y120: 40 | Z120: 2.23 | AA120: 8.0000000000000002e-003 | AB120: 8.0000000000000004e-004 | AC120: -3.5900000000000001e-002 | AD120: -3.7900000000000003e-002 | AE120: 86.01 | AF120: 90.23 | AG120: 0.32 | AH120: AA- | AI120: 6.13e-002 | AJ120: =H120+100*O120 -> 179.90000000000001 | AK120: 161.2 | AL120: 207 | AM120: 71 | AN120: 225 | AO120: -9.1999999999999998e-002 | AP120: 14 | AQ120: 祥鑫转债!
A121: 120 | B121: 123078 | C121: 飞凯转债!! | D121: 300398 | E121: 飞凯材料 | F121: 化工 | G121: 化工 | H121: 160 | I121: 2.0400000000000001e-002 | J121: -1.34e-002 | K121: 21.4 | L121: 8.5000000000000006e-003 | M121: 114.9 | N121: 15.56 | O121: 0.16300000000000001 | P121: 137.53 | Q121: 已到 | R121: 4.96年 | S121: 2.96年 | T121: 8.15 | U121: 102 | V121: 7.9000000000000001e-002 | W121: 7.400000000000001e-002 | X121: 0.10099999999999999 | Y121: 110 | Z121: 3.82 | AA121: -6.5599999999999992e-002 | AB121: -7.0400000000000004e-002 | AC121: -0.128 | AD121: -0.13 | AE121: 91.47 | AF121: 94.79 | AG121: 0.82 | AH121: AA | AI121: 4.0300000000000002e-002 | AJ121: =H121+100*O121 -> 176.30000000000001 | AK121: 182.5 | AL121: 291 | AM121: 87.7 | AN121: 284 | AO121: 6.0999999999999999e-002 | AP121: 8 | AQ121: 飞凯转债!!
A122: 121 | B122: 113609 | C122: 永安转债! | D122: 603776 | E122: 永安行 | F122: 城市公用 | G122: 其他 | H122: 127.97 | I122: 1.23e-002 | J122: -4.1999999999999997e-003 | K122: 19.27 | L122: 1.1000000000000001e-002 | M122: 120.1 | N122: 16.48 | O122: 9.4e-002 | P122: 116.93 | Q122: 已到 | R122: 4.95年 | S122: 2.95年 | T122: 7.34 | U122: 76 | V122: 8.199999999999999e-002 | W122: 0.16300000000000001 | X122: 0.191 | Y122: 45 | Z122: 1.38 | AA122: -1.3000000000000001e-002 | AB122: -1.9799999999999998e-002 | AC122: -6.6400000000000001e-002 | AD122: -6.83e-002 | AE122: 86.04 | AF122: 89.94 | AG122: 0.73 | AH122: AA- | AI122: 6.13e-002 | AJ122: =H122+100*O122 -> 137.37 | AK122: 139 | AL122: 33 | AM122: 49.1 | AN122: 83 | AO122: 6.6000000000000003e-002 | AP122: 26 | AQ122: 永安转债!
A123: 122 | B123: 123077 | C123: 汉得转债! | D123: 300170 | E123: 汉得信息 | F123: 计算机及 | G123: 软件开发 | H123: 116.558 | I123: 4.7999999999999996e-003 | J123: -2.e-003 | K123: 8.3 | L123: 8.5000000000000006e-003 | M123: 125.1 | N123: 9.69 | O123: 0.36099999999999999 | P123: 85.66 | Q123: 已到 | R123: 4.95年 | S123: 2.95年 | T123: 9.37 | U123: 132 | V123: 0.121 | W123: 0.128 | X123: 0.109 | Y123: 73 | Z123: 2.34 | AA123: 1.46e-002 | AB123: 6.0999999999999995e-003 | AC123: -3.78e-002 | AD123: -3.9900000000000005e-002 | AE123: 91.54 | AF123: 103.23 | AG123: 0.33 | AH123: AA | AI123: 4.0300000000000002e-002 | AJ123: =H123+100*O123 -> 152.65800000000002 | AK123: 147.5 | AL123: 99 | AM123: 44.2 | AN123: 55 | AO123: 3.2000000000000001e-002 | AP123: 17 | AQ123: 汉得转债!
A124: 123 | B124: 110077 | C124: 洪城转债 | D124: 600461 | E124: 洪城环境 | F124: 城市公用 | G124: 城市公用 | H124: 135.36 | I124: -1.7000000000000001e-003 | J124: -9.1000000000000004e-003 | K124: 8 | L124: -1.4800000000000001e-002 | M124: 113.3 | N124: 6.71 | O124: 0.13500000000000001 | P124: 119.23 | Q124: 已到 | R124: 4.94年 | S124: 2.94年 | T124: 17.7 | U124: 12 | V124: 5.0000000000000001e-003 | W124: 0.23199999999999998 | X124: 0.27699999999999997 | Y124: 76 | Z124: 1.41 | AA124: -3.5699999999999996e-002 | AB124: -4.0300000000000002e-002 | AC124: -8.72e-002 | AD124: -8.8300000000000003e-002 | AE124: 91.66 | AF124: 95.65 | AG124: 0.73 | AH124: AA+ | AI124: 3.5299999999999998e-002 | AJ124: =H124+100*O124 -> 148.86000000000001 | AK124: 151.5 | AL124: 141 | AM124: 55.8 | AN124: 131 | AO124: -1.7000000000000001e-002 | AP124: 7 | AQ124: 洪城转债
A125: 124 | B125: 123076 | C125: 强力转债! | D125: 300429 | E125: 强力新材 | F125: 化工 | G125: 化工 | H125: 107.863 | I125: -3.0000000000000001e-003 | J125: -2.e-003 | K125: 12.23 | L125: -2.e-002 | M125: 118.1 | N125: 18.94 | O125: 0.67000000000000004 | P125: 64.57 | Q125: 已到 | R125: 4.94年 | S125: 2.94年 | T125: 8.5 | U125: 4.8 | V125: 5.0000000000000001e-003 | W125: 0.13500000000000001 | X125: 8.6999999999999994e-002 | Y125: 63 | Z125: 3.49 | AA125: 1.89e-002 | AB125: 1.23e-002 | AC125: -1.3500000000000002e-002 | AD125: -1.5600000000000001e-002 | AE125: 86.11 | AF125: 88.52 | AG125: 0.25 | AH125: AA- | AI125: 6.13e-002 | AJ125: =H125+100*O125 -> 174.863 | AK125: 151.2 | AL125: 135 | AM125: 62.6 | AN125: 174 | AO125: -2.7000000000000003e-002 | AP125: 20 | AQ125: 强力转债!
A126: 125 | B126: 128138 | C126: 侨银转债! | D126: 2973 | E126: 侨银股份 | F126: 城市公用 | G126: 城市公用 | H126: 111.49 | I126: -5.0000000000000001e-004 | J126: 1.e-004 | K126: 14.6 | L126: -4.0999999999999995e-003 | M126: 136.1 | N126: 25.33 | O126: 0.93400000000000005 | P126: 57.64 | Q126: 已到 | R126: 4.93年 | S126: 2.93年 | T126: 4.2 | U126: 6.2 | V126: 1.3000000000000001e-002 | W126: 7.0000000000000007e-002 | X126: 4.0999999999999995e-002 | Y126: 60 | Z126: 3.72 | AA126: 4.2000000000000003e-002 | AB126: 3.0299999999999997e-002 | AC126: -2.23e-002 | AD126: -2.4700000000000003e-002 | AE126: 86.63 | AF126: 102.04 | AG126: 0.12 | AH126: AA- | AI126: 6.13e-002 | AJ126: =H126+100*O126 -> 204.88999999999999 | AK126: 165.3 | AL126: 234 | AM126: 63.3 | AN126: 178 | AO126: -5.0000000000000001e-003 | AP126: 22 | AQ126: 侨银转债!
A127: 126 | B127: 113608 | C127: 威派转债! | D127: 603956 | E127: 威派格 | F127: 机械装备 | G127: 专用设备 | H127: 119.78 | I127: 1.29e-002 | J127: 8.6999999999999994e-003 | K127: 17.51 | L127: 3.6699999999999997e-002 | M127: 121.1 | N127: 19.08 | O127: 0.30499999999999999 | P127: 91.77 | Q127: 已到 | R127: 4.91年 | S127: 2.91年 | T127: 4.2 | U127: 25 | V127: 5.0000000000000003e-002 | W127: 5.5999999999999994e-002 | X127: 5.2000000000000005e-002 | Y127: 75 | Z127: 6.3 | AA127: 2.3e-003 | AB127: -5.1000000000000004e-003 | AC127: -4.4900000000000002e-002 | AD127: -4.7300000000000002e-002 | AE127: 84.15 | AF127: 86.62 | AG127: 0.59 | AH127: A+ | AI127: 7.2300000000000003e-002 | AJ127: =H127+100*O127 -> 150.28 | AK127: 147.8 | AL127: 102 | AM127: 61.2 | AN127: 161 | AO127: 4.0999999999999995e-002 | AP127: 8 | AQ127: 威派转债!
A128: 127 | B128: 127025 | C128: 冀东转债! | D128: 401 | E128: 冀东水泥 | F128: 建筑 | G128: 水泥 | H128: 114.28 | I128: 0. | J128: 0. | K128: 11.84 | L128: 0. | M128: 109.9 | N128: 15.28 | O128: 0.47499999999999998 | P128: 77.49 | Q128: 已到 | R128: 4.90年 | S128: 2.90年 | T128: 17.8 | U128: 0 | V128: 0. | W128: 0.106 | X128: 8.199999999999999e-002 | Y128: 167 | Z128: 1.03 | AA128: -8.1000000000000013e-003 | AB128: -1.18e-002 | AC128: -3.4500000000000003e-002 | AD128: -3.61e-002 | AE128: 92.89 | AF128: 93.83 | AG128: 0.33 | AH128: AAA | AI128: 3.3300000000000003e-002 | AJ128: =H128+100*O128 -> 161.78 | AK128: 151.1 | AL128: 133 | AM128: 57.2 | AN128: 135 | AO128: 1.4999999999999999e-002 | AP128: 9 | AQ128: 冀东转债!
A129: 128 | B129: 127024 | C129: 盈峰转债! | D129: 967 | E129: 盈峰环境 | F129: 机械装备 | G129: 专用设备 | H129: 126.5 | I129: 1.44e-002 | J129: -1.83e-002 | K129: 8.29 | L129: -7.1999999999999998e-003 | M129: 116.6 | N129: 8.19 | O129: 0.25 | P129: 101.22 | Q129: 已到 | R129: 4.90年 | S129: 2.90年 | T129: 14.8 | U129: 26 | V129: 1.3999999999999999e-002 | W129: 5.5999999999999994e-002 | X129: 5.7000000000000002e-002 | Y129: 262 | Z129: 1.6 | AA129: -1.6799999999999999e-002 | AB129: -2.2599999999999999e-002 | AC129: -6.4899999999999999e-002 | AD129: -6.6699999999999995e-002 | AE129: 92.77 | AF129: 98.66 | AG129: 0.54 | AH129: AA+ | AI129: 3.5299999999999998e-002 | AJ129: =H129+100*O129 -> 151.5 | AK129: 151.8 | AL129: 143 | AM129: 53.1 | AN129: 114 | AO129: 7.2000000000000008e-002 | AP129: 6 | AQ129: 盈峰转债!
A130: 129 | B130: 128137 | C130: 洁美转债 | D130: 2859 | E130: 洁美科技 | F130: 电子 | G130: 元器件制 | H130: 157.498 | I130: 1.6299999999999999e-002 | J130: -1.7399999999999999e-002 | K130: 36.25 | L130: -1.4000000000000002e-003 | M130: 116.9 | N130: 27.63 | O130: 0.20000000000000001 | P130: 131.2 | Q130: 已到 | R130: 4.90年 | S130: 2.90年 | T130: 5.99 | U130: 60 | V130: 6.5000000000000002e-002 | W130: 4.0000000000000001e-002 | X130: 5.2999999999999999e-002 | Y130: 149 | Z130: 7.55 | AA130: -5.9999999999999998e-002 | AB130: -6.5500000000000003e-002 | AC130: -0.127 | AD130: -0.128 | AE130: 86.29 | AF130: 87.83 | AG130: 0.82 | AH130: AA- | AI130: 6.13e-002 | AJ130: =H130+100*O130 -> 177.49799999999999 | AK130: 183.8 | AL130: 295 | AM130: 96 | AN130: 304 | AO130: 8.8000000000000009e-002 | AP130: 5 | AQ130: 洁美转债
A131: 130 | B131: 128136 | C131: 立讯转债! | D131: 2475 | E131: 立讯精密 | F131: 电子 | G131: 元器件制 | H131: 124.138 | I131: 5.1999999999999998e-003 | J131: -7.1999999999999998e-003 | K131: 45.32 | L131: -6.4000000000000003e-003 | M131: 111.8 | N131: 58.16 | O131: 0.59299999999999997 | P131: 77.92 | Q131: 已到 | R131: 4.90年 | S131: 2.90年 | T131: 30 | U131: 45 | V131: 1.2e-002 | W131: 9.0000000000000011e-003 | X131: 6.9999999999999993e-003 | Y131: 3195. | Z131: 9.92 | AA131: -2.1400000000000002e-002 | AB131: -2.5600000000000001e-002 | AC131: -6.13e-002 | AD131: -6.2699999999999992e-002 | AE131: 92.02 | AF131: 94.53 | AG131: 0.32 | AH131: AA+ | AI131: 3.5299999999999998e-002 | AJ131: =H131+100*O131 -> 183.43799999999999 | AK131: 170.4 | AL131: 258 | AM131: 75.8 | AN131: 248 | AO131: 9.5000000000000001e-002 | AP131: 14 | AQ131: 立讯转债!
A132: 131 | B132: 110076 | C132: 华海转债! | D132: 600521 | E132: 华海药业 | F132: 医药 | G132: 医药行业 | H132: 115.72 | I132: -4.6999999999999993e-003 | J132: 1.7000000000000001e-003 | K132: 20.64 | L132: -2.1299999999999999e-002 | M132: 114.8 | N132: 33.85 | O132: 0.89800000000000002 | P132: 60.97 | Q132: 已到 | R132: 4.89年 | S132: 2.89年 | T132: 18.4 | U132: 6.8 | V132: 3.0000000000000001e-003 | W132: 5.9999999999999998e-002 | X132: 3.6000000000000004e-002 | Y132: 308 | Z132: 4.7 | AA132: -1.7000000000000001e-003 | AB132: -6.9999999999999993e-003 | AC132: -3.6699999999999997e-002 | AD132: -3.8599999999999995e-002 | AE132: 91.62 | AF132: 94.95 | AG132: 0.14 | AH132: AA | AI132: 4.0300000000000002e-002 | AJ132: =H132+100*O132 -> 205.51999999999998 | AK132: 170.5 | AL132: 260 | AM132: 75.5 | AN132: 246 | AO132: -1.7000000000000001e-002 | AP132: 8 | AQ132: 华海转债!
A133: 132 | B133: 123075 | C133: 贝斯转债! | D133: 300580 | E133: 贝斯特 | F133: 汽车 | G133: 零部件制 | H133: 137.11 | I133: -2.0000000000000001e-004 | J133: -2.2400000000000003e-002 | K133: 25.26 | L133: -3.3300000000000003e-002 | M133: 115.1 | N133: 23.74 | O133: 0.28899999999999998 | P133: 106.4 | Q133: 已到 | R133: 4.89年 | S133: 2.89年 | T133: 6 | U133: 166 | V133: 0.20300000000000001 | W133: 0.11900000000000001 | X133: 0.126 | Y133: 51 | Z133: 2.85 | AA133: -3.5699999999999996e-002 | AB133: -4.0899999999999999e-002 | AC133: -8.8599999999999998e-002 | AD133: -9.0399999999999994e-002 | AE133: 86.35 | AF133: 86.53 | AG133: 0.68 | AH133: AA- | AI133: 6.13e-002 | AJ133: =H133+100*O133 -> 166.01000000000002 | AK133: 167.8 | AL133: 245 | AM133: 81.3 | AN133: 268 | AO133: 4.4000000000000004e-002 | AP133: 8 | AQ133: 贝斯转债!
A134: 133 | B134: 113607 | C134: 伟20转债!! | D134: 603568 | E134: 伟明环保 | F134: 城市公用 | G134: 三废处理 | H134: 152.37 | I134: 2.8900000000000002e-002 | J134: -4.4000000000000003e-003 | K134: 33.04 | L134: 2.4500000000000001e-002 | M134: 114.8 | N134: 21.71 | O134: 1.e-003 | P134: 152.19 | Q134: 已到 | R134: 4.89年 | S134: 2.89年 | T134: 4.15 | U134: 322 | V134: 0.50900000000000001 | W134: 1.e-002 | X134: 1.4999999999999999e-002 | Y134: 415 | Z134: 6.7 | AA134: -5.7099999999999998e-002 | AB134: -6.2e-002 | AC134: -0.11800000000000001 | AD134: -0.12 | AE134: 91.62 | AF134: 94.95 | AG134: 1 | AH134: AA | AI134: 4.0300000000000002e-002 | AJ134: =H134+100*O134 -> 152.47 | AK134: 152.6 | AL134: 149 | AM134: 57.6 | AN134: 138 | AO134: 2.7000000000000003e-002 | AP134: 10 | AQ134: 伟20转债!!
A135: 134 | B135: 113606 | C135: 荣泰转债 | D135: 603579 | E135: 荣泰健康 | F135: 机械装备 | G135: 专用设备 | H135: 121.81 | I135: -2.0000000000000001e-004 | J135: 2.0999999999999999e-003 | K135: 29.86 | L135: 3.7000000000000002e-003 | M135: 120.7 | N135: 32.83 | O135: 0.33899999999999997 | P135: 90.95 | Q135: 已到 | R135: 4.89年 | S135: 2.89年 | T135: 6 | U135: 0.9 | V135: 1.e-003 | W135: 0.14300000000000002 | X135: 0.13100000000000001 | Y135: 42 | Z135: 2.5 | AA135: -1.9e-003 | AB135: -9.1000000000000004e-003 | AC135: -5.2000000000000005e-002 | AD135: -5.4100000000000002e-002 | AE135: 86.56 | AF135: 90.8 | AG135: 0.53 | AH135: AA- | AI135: 6.13e-002 | AJ135: =H135+100*O135 -> 155.71000000000001 | AK135: 152.7 | AL135: 150 | AM135: 61.9 | AN135: 168 | AO135: -6.9999999999999993e-003 | AP135: 11 | AQ135: 荣泰转债
A136: 135 | B136: 123074 | C136: 隆利转债!!* | D136: 300752 | E136: 隆利科技 | F136: 电子 | G136: 液晶显示 | H136: 160.4 | I136: -4.5199999999999997e-002 | J136: -1.6000000000000001e-003 | K136: 29.54 | L136: -4.6799999999999994e-002 | M136: 123.6 | N136: 18.34 | O136: -4.0000000000000001e-003 | P136: 161.07 | Q136: 已到 | R136: 5.1天 | S136: 无权 | T136: 1.22 | U136: 728 | V136: 3.6200000000000001 | W136: 2.e-002 | X136: 3.3000000000000002e-002 | Y136: 60 | Z136: 6.24 | AA136: <-100% | AB136: <-100% | AC136: 无权 | AD136: 无权 | AE136: 无权 | AF136: 100 | AG136: 1 | AH136: AA- | AI136: 5.7200000000000001e-002 | AJ136: =H136+100*O136 -> 160. | AK136: 159.7 | AL136: 194 | AM136: 59.7 | AN136: 154 | AO136: 6.8000000000000005e-002 | AP136: 15 | AQ136: 隆利转债!!*
A137: 136 | B137: 123073 | C137: 同和转债! | D137: 300636 | E137: 同和药业 | F137: 医药 | G137: 原料药 | H137: 136.8 | I137: -7.000000000000001e-004 | J137: -1.e-004 | K137: 18.28 | L137: -1.1000000000000001e-003 | M137: 121.9 | N137: 14.82 | O137: 0.109 | P137: 123.35 | Q137: 已到 | R137: 4.87年 | S137: 2.87年 | T137: 3.59 | U137: 25 | V137: 5.2000000000000005e-002 | W137: 9.5000000000000001e-002 | X137: 0.11800000000000001 | Y137: 38 | Z137: 4.58 | AA137: -2.3900000000000001e-002 | AB137: -3.1200000000000002e-002 | AC137: -8.6699999999999999e-002 | AD137: -8.8900000000000007e-002 | AE137: 84.34 | AF137: 87.41 | AG137: 0.76 | AH137: A+ | AI137: 7.2300000000000003e-002 | AJ137: =H137+100*O137 -> 147.70000000000002 | AK137: 150.3 | AL137: 129 | AM137: 62.8 | AN137: 175 | AO137: 4.2000000000000003e-002 | AP137: 13 | AQ137: 同和转债!
A138: 137 | B138: 113605 | C138: 大参转债! | D138: 603233 | E138: 大参林 | F138: 医药 | G138: 医药商业 | H138: 114 | I138: -8.9999999999999998e-004 | J138: 1.2999999999999999e-003 | K138: 38.25 | L138: 5.7999999999999996e-003 | M138: 114.9 | N138: 69.05 | O138: 1.0600000000000001 | P138: 55.39 | Q138: 已到 | R138: 4.86年 | S138: 2.86年 | T138: 14 | U138: 4.7 | V138: 3.0000000000000001e-003 | W138: 4.5999999999999999e-002 | X138: 2.6000000000000002e-002 | Y138: 303 | Z138: 5.69 | AA138: 1.6000000000000001e-003 | AB138: -3.8e-003 | AC138: -3.1899999999999998e-002 | AD138: -3.4000000000000002e-002 | AE138: 91.83 | AF138: 95.16 | AG138: 0.08 | AH138: AA | AI138: 4.0300000000000002e-002 | AJ138: =H138+100*O138 -> 220. | AK138: 172.6 | AL138: 268 | AM138: 77.4 | AN138: 256 | AO138: 5.9000000000000004e-002 | AP138: 7 | AQ138: 大参转债!
A139: 138 | B139: 123071 | C139: 天能转债!! | D139: 300569 | E139: 天能重工 | F139: 能源电力 | G139: 风能 | H139: 213.49 | I139: 2.0000000000000001e-004 | J139: -2.e-003 | K139: 15.63 | L139: -1.9e-003 | M139: 120.7 | N139: 7.91 | O139: 8.0000000000000002e-002 | P139: 197.6 | Q139: 已到 | R139: 4.86年 | S139: 2.86年 | T139: 6.94 | U139: 557 | V139: 0.375 | W139: 5.5999999999999994e-002 | X139: 0.111 | Y139: 124 | Z139: 3.54 | AA139: -0.11199999999999999 | AB139: -0.11900000000000001 | AC139: -0.13200000000000001 | AD139: -0.13200000000000001 | AE139: 86.67 | AF139: 90.92 | AG139: 0.95 | AH139: AA- | AI139: 6.13e-002 | AJ139: =H139+100*O139 -> 221.49000000000001 | AK139: 229.4 | AL139: 337 | AM139: 138.5 | AN139: 338 | AO139: 5.7000000000000002e-002 | AP139: 13 | AQ139: 天能转债!!
A140: 139 | B140: 123072 | C140: 乐歌转债! | D140: 300729 | E140: 乐歌股份 | F140: 其他 | G140: 家居用品 | H140: 123.33 | I140: -3.4999999999999996e-003 | J140: 3.2000000000000002e-003 | K140: 31.1 | L140: -1.2999999999999999e-003 | M140: 129.1 | N140: 49.24 | O140: 0.95299999999999996 | P140: 63.16 | Q140: 已到 | R140: 4.86年 | S140: 2.86年 | T140: 1.42 | U140: 17 | V140: 9.5000000000000001e-002 | W140: 2.1000000000000001e-002 | X140: 1.3000000000000001e-002 | Y140: 69 | Z140: 3.79 | AA140: 9.7000000000000003e-003 | AB140: -1.e-004 | AC140: -4.8799999999999996e-002 | AD140: -5.2400000000000002e-002 | AE140: 86.21 | AF140: 92.94 | AG140: 0.26 | AH140: A+ | AI140: 7.2300000000000003e-002 | AJ140: =H140+100*O140 -> 218.63 | AK140: 183.5 | AL140: 294 | AM140: 90.6 | AN140: 291 | AO140: -3.7000000000000005e-002 | AP140: 10 | AQ140: 乐歌转债!
A141: 140 | B141: 123070 | C141: 鹏辉转债! | D141: 300438 | E141: 鹏辉能源 | F141: 汽车 | G141: 零部件制 | H141: 299.2 | I141: -2.9999999999999997e-004 | J141: 7.3000000000000001e-003 | K141: 56.2 | L141: 7.1999999999999998e-003 | M141: 114.8 | N141: 20.08 | O141: 6.9000000000000006e-002 | P141: 279.88 | Q141: 已到 | R141: 4.86年 | S141: 2.86年 | T141: 5.99 | U141: 1191. | V141: 0.66200000000000003 | W141: 2.5000000000000001e-002 | X141: 7.0000000000000007e-002 | Y141: 239 | Z141: 9.33 | AA141: -0.18100000000000002 | AB141: -0.185 | AC141: -0.17000000000000001 | AD141: -0.17000000000000001 | AE141: 91.75 | AF141: 95.09 | AG141: 0.98 | AH141: AA | AI141: 4.0300000000000002e-002 | AJ141: =H141+100*O141 -> 306.09999999999997 | AK141: 318.5 | AL141: 363 | AM141: 223.4 | AN141: 363 | AO141: 4.2000000000000003e-002 | AP141: 8 | AQ141: 鹏辉转债!
A142: 141 | B142: 128135 | C142: 洽洽转债! | D142: 2557 | E142: 洽洽食品 | F142: 食品饮料 | G142: 休闲食品 | H142: 128.498 | I142: 4.8999999999999998e-003 | J142: -4.0999999999999995e-003 | K142: 57.82 | L142: 1.7000000000000001e-003 | M142: 119.9 | N142: 60.03 | O142: 0.33399999999999996 | P142: 96.32 | Q142: 已到 | R142: 4.86年 | S142: 2.86年 | T142: 13.4 | U142: 36 | V142: 2.1000000000000001e-002 | W142: 4.5999999999999999e-002 | X142: 4.4000000000000004e-002 | Y142: 293 | Z142: 6.72 | AA142: -1.44e-002 | AB142: -2.1299999999999999e-002 | AC142: -6.9800000000000001e-002 | AD142: -7.17e-002 | AE142: 91.85 | AF142: 99.31 | AG142: 0.48 | AH142: AA | AI142: 4.0300000000000002e-002 | AJ142: =H142+100*O142 -> 161.898 | AK142: 160.7 | AL142: 199 | AM142: 61.4 | AN142: 164 | AO142: 5.5999999999999994e-002 | AP142: 11 | AQ142: 洽洽转债!
A143: 142 | B143: 127022 | C143: 恒逸转债 | D143: 703 | E143: 恒逸石化 | F143: 化工 | G143: 化工 | H143: 124.218 | I143: -3.0999999999999999e-003 | J143: 3.5999999999999999e-003 | K143: 10.47 | L143: 1.e-003 | M143: 108.7 | N143: 11.2 | O143: 0.32899999999999996 | P143: 93.48 | Q143: 已到 | R143: 4.85年 | S143: 2.85年 | T143: 20 | U143: 5 | V143: 2.e-003 | W143: 5.2000000000000005e-002 | X143: 4.9000000000000002e-002 | Y143: 384 | Z143: 1.48 | AA143: -2.75e-002 | AB143: -3.0699999999999998e-002 | AC143: -6.2199999999999998e-002 | AD143: -6.3600000000000004e-002 | AE143: 92.33 | AF143: 92.1 | AG143: 0.53 | AH143: AA+ | AI143: 3.5299999999999998e-002 | AJ143: =H143+100*O143 -> 157.11799999999999 | AK143: 155 | AL143: 167 | AM143: 62.6 | AN143: 173 | AO143: -2.e-003 | AP143: 6 | AQ143: 恒逸转债
A144: 143 | B144: 110075 | C144: 南航转债 | D144: 600029 | E144: 南方航空 | F144: 交通运输 | G144: 航空运输 | H144: 131.15 | I144: -1.1899999999999999e-002 | J144: 1.1899999999999999e-002 | K144: 6.5 | L144: 0. | M144: 109.8 | N144: 6.24 | O144: 0.25900000000000001 | P144: 104.17 | Q144: 已到 | R144: 4.84年 | S144: 2.84年 | T144: 59 | U144: 73 | V144: 9.0000000000000011e-003 | W144: 5.4000000000000006e-002 | X144: 5.5999999999999994e-002 | Y144: 1102. | Z144: 1.5 | AA144: -3.6400000000000002e-002 | AB144: -4.0000000000000001e-002 | AC144: -8.0299999999999996e-002 | AD144: -8.14e-002 | AE144: 92.51 | AF144: 93.88 | AG144: 0.61 | AH144: AAA | AI144: 3.3300000000000003e-002 | AJ144: =H144+100*O144 -> 157.05000000000001 | AK144: 158.1 | AL144: 184 | AM144: 64.3 | AN144: 183 | AO144: 2.e-003 | AP144: 8 | AQ144: 南航转债
A145: 144 | B145: 113604 | C145: 多伦转债! | D145: 603528 | E145: 多伦科技 | F145: 计算机及 | G145: 软件开发 | H145: 106.67 | I145: 1.8e-003 | J145: -2.8999999999999998e-003 | K145: 6.67 | L145: -4.5000000000000005e-003 | M145: 116.9 | N145: 10.4 | O145: 0.66299999999999992 | P145: 64.13 | Q145: 已到 | R145: 4.84年 | S145: 2.84年 | T145: 6.4 | U145: 2.1 | V145: 3.0000000000000001e-003 | W145: 0.153 | X145: 9.8000000000000004e-002 | Y145: 42 | Z145: 2.55 | AA145: 1.95e-002 | AB145: 1.3100000000000001e-002 | AC145: -1.04e-002 | AD145: -1.2500000000000001e-002 | AE145: 86.6 | AF145: 88.15 | AG145: 0.26 | AH145: AA- | AI145: 6.13e-002 | AJ145: =H145+100*O145 -> 172.97 | AK145: 149.2 | AL145: 114 | AM145: 61.1 | AN145: 160 | AO145: 2.e-003 | AP145: 11 | AQ145: 多伦转债!
A146: 145 | B146: 128134 | C146: 鸿路转债! | D146: 2541 | E146: 鸿路钢构 | F146: 建筑 | G146: 其他建材 | H146: 144.798 | I146: 2.9999999999999997e-004 | J146: 1.41e-002 | K146: 54.18 | L146: 1.8799999999999997e-002 | M146: 114.8 | N146: 43.51 | O146: 0.16300000000000001 | P146: 124.52 | Q146: 已到 | R146: 4.83年 | S146: 2.83年 | T146: 15.7 | U146: 135 | V146: 5.9999999999999998e-002 | W146: 5.5e-002 | X146: 6.8000000000000005e-002 | Y146: 288 | Z146: 4.33 | AA146: -4.7699999999999992e-002 | AB146: -5.28e-002 | AC146: -0.106 | AD146: -0.10800000000000001 | AE146: 91.86 | AF146: 95.2 | AG146: 0.77 | AH146: AA | AI146: 4.0300000000000002e-002 | AJ146: =H146+100*O146 -> 161.09800000000001 | AK146: 165.1 | AL146: 230 | AM146: 69.9 | AN146: 219 | AO146: 8.9999999999999997e-002 | AP146: 4 | AQ146: 鸿路转债!
A147: 146 | B147: 128133 | C147: 奇正转债! | D147: 2287 | E147: 奇正藏药 | F147: 医药 | G147: 中药 | H147: 117.5 | I147: 6.8999999999999999e-003 | J147: -8.6999999999999994e-003 | K147: 27.01 | L147: -4.0999999999999995e-003 | M147: 116.9 | N147: 29.78 | O147: 0.29600000000000004 | P147: 90.7 | Q147: 已到 | R147: 4.78年 | S147: 2.78年 | T147: 8 | U147: 17 | V147: 1.8000000000000002e-002 | W147: 5.5999999999999994e-002 | X147: 5.0999999999999997e-002 | Y147: 143 | Z147: 4.84 | AA147: -1.1000000000000001e-003 | AB147: -7.3000000000000001e-003 | AC147: -4.2699999999999995e-002 | AD147: -4.4800000000000006e-002 | AE147: 92.13 | AF147: 97.13 | AG147: 0.45 | AH147: AA | AI147: 4.0300000000000002e-002 | AJ147: =H147+100*O147 -> 147.09999999999999 | AK147: 144.3 | AL147: 69 | AM147: 47.2 | AN147: 73 | AO147: -2.e-003 | AP147: 19 | AQ147: 奇正转债!
A148: 147 | B148: 123067 | C148: 斯莱转债! | D148: 300382 | E148: 斯莱克 | F148: 机械装备 | G148: 专用设备 | H148: 268.5 | I148: 2.0899999999999998e-002 | J148: -7.8000000000000005e-003 | K148: 24.02 | L148: 1.3500000000000002e-002 | M148: 120.8 | N148: 9.36 | O148: 4.5999999999999999e-002 | P148: 256.62 | Q148: 已到 | R148: 4.77年 | S148: 2.77年 | T148: 2.4 | U148: 162 | V148: 0.254 | W148: 1.7000000000000001e-002 | X148: 4.4999999999999998e-002 | Y148: 138 | Z148: 12.07 | AA148: -0.157 | AB148: -0.16200000000000001 | AC148: -0.16600000000000001 | AD148: -0.16600000000000001 | AE148: 87.26 | AF148: 91.53 | AG148: 0.97 | AH148: AA- | AI148: 6.13e-002 | AJ148: =H148+100*O148 -> 273.10000000000002 | AK148: 280.4 | AL148: 356 | AM148: 188.8 | AN148: 358 | AO148: -8.5000000000000006e-002 | AP148: 11 | AQ148: 斯莱转债!
A149: 148 | B149: 128132 | C149: 交建转债! | D149: 2941 | E149: 新疆交建 | F149: 建筑 | G149: 建筑工程 | H149: 105.803 | I149: 3.2000000000000002e-003 | J149: -4.5999999999999999e-003 | K149: 11.67 | L149: -1.1000000000000001e-002 | M149: 116.9 | N149: 18.53 | O149: 0.68000000000000005 | P149: 62.98 | Q149: 已到 | R149: 4.76年 | S149: 2.76年 | T149: 8.49 | U149: 6.2 | V149: 6.9999999999999993e-003 | W149: 0.113 | X149: 7.0999999999999994e-002 | Y149: 75 | Z149: 2.91 | AA149: 2.1600000000000001e-002 | AB149: 1.5100000000000001e-002 | AC149: -7.9000000000000008e-003 | AD149: -1.01e-002 | AE149: 92.2 | AF149: 97.2 | AG149: 0.13 | AH149: AA | AI149: 4.0300000000000002e-002 | AJ149: =H149+100*O149 -> 173.803 | AK149: 148.6 | AL149: 109 | AM149: 51.4 | AN149: 101 | AO149: 1.3000000000000001e-002 | AP149: 27 | AQ149: 交建转债!
A150: 149 | B150: 128131 | C150: 崇达转2! | D150: 2815 | E150: 崇达技术 | F150: 电子 | G150: 元器件制 | H150: 121.3 | I150: -8.199999999999999e-003 | J150: -8.0000000000000004e-004 | K150: 15.53 | L150: -2.69e-002 | M150: 114.9 | N150: 19.38 | O150: 0.51400000000000001 | P150: 80.13 | Q150: 已到 | R150: 4.74年 | S150: 2.74年 | T150: 14 | U150: 11 | V150: 6.0000000000000001e-003 | W150: 0.10300000000000001 | X150: 8.199999999999999e-002 | Y150: 136 | Z150: 3.16 | AA150: -1.1599999999999999e-002 | AB150: -1.7100000000000001e-002 | AC150: -5.3800000000000001e-002 | AD150: -5.5899999999999998e-002 | AE150: 92.28 | AF150: 95.63 | AG150: 0.33 | AH150: AA | AI150: 4.0300000000000002e-002 | AJ150: =H150+100*O150 -> 172.69999999999999 | AK150: 162.5 | AL150: 217 | AM150: 66.8 | AN150: 195 | AO150: -5.0999999999999997e-002 | AP150: 11 | AQ150: 崇达转2!
A151: 150 | B151: 123065 | C151: 宝莱转债! | D151: 300246 | E151: 宝莱特 | F151: 医药 | G151: 医疗器械 | H151: 114.9 | I151: 8.5000000000000006e-003 | J151: -8.3000000000000001e-003 | K151: 18.08 | L151: 3.3e-003 | M151: 121 | N151: 40.14 | O151: 1.55 | P151: 45.04 | Q151: 已到 | R151: 4.73年 | S151: 2.73年 | T151: 2.19 | U151: 23 | V151: 8.9999999999999997e-002 | W151: 8.3000000000000004e-002 | X151: 3.7000000000000005e-002 | Y151: 26 | Z151: 3.03 | AA151: 1.1200000000000002e-002 | AB151: 3.4999999999999996e-003 | AC151: -3.4300000000000004e-002 | AD151: -3.6799999999999999e-002 | AE151: 87.61 | AF151: 91.89 | AG151: 0.05 | AH151: AA- | AI151: 6.13e-002 | AJ151: =H151+100*O151 -> 269.89999999999998 | AK151: 184.8 | AL151: 297 | AM151: 92.9 | AN151: 298 | AO151: 1.1000000000000001e-002 | AP151: 21 | AQ151: 宝莱转债!
A152: 151 | B152: 123064 | C152: 万孚转债! | D152: 300482 | E152: 万孚生物 | F152: 医药 | G152: 医疗器械 | H152: 113 | I152: -3.5999999999999999e-003 | J152: 3.9000000000000003e-003 | K152: 37.07 | L152: 4.8999999999999998e-003 | M152: 114.8 | N152: 71.65 | O152: 1.1799999999999999 | P152: 51.74 | Q152: 已到 | R152: 4.72年 | S152: 2.72年 | T152: 5.99 | U152: 10 | V152: 1.4999999999999999e-002 | W152: 3.6000000000000004e-002 | X152: 1.9e-002 | Y152: 165 | Z152: 5.15 | AA152: 3.4000000000000002e-003 | AB152: -2.2000000000000001e-003 | AC152: -3.0800000000000001e-002 | AD152: -3.2899999999999999e-002 | AE152: 92.24 | AF152: 95.59 | AG152: 0.06 | AH152: AA | AI152: 4.0300000000000002e-002 | AJ152: =H152+100*O152 -> 231. | AK152: 174.3 | AL152: 273 | AM152: 78.7 | AN152: 261 | AO152: 1.1000000000000001e-002 | AP152: 12 | AQ152: 万孚转债!
A153: 152 | B153: 128130 | C153: 景兴转债 | D153: 2067 | E153: 景兴纸业 | F153: 造纸包装 | G153: 包装用纸 | H153: 126.397 | I153: -5.5000000000000005e-003 | J153: -3.0999999999999999e-003 | K153: 3.96 | L153: -1.2500000000000001e-002 | M153: 114.8 | N153: 3.4 | O153: 8.5000000000000006e-002 | P153: 116.47 | Q153: 已到 | R153: 4.72年 | S153: 2.72年 | T153: 9.99 | U153: 27 | V153: 2.2000000000000002e-002 | W153: 0.21100000000000002 | X153: 0.24600000000000002 | Y153: 47 | Z153: 0.9 | AA153: -2.0499999999999997e-002 | AB153: -2.6000000000000002e-002 | AC153: -6.7900000000000002e-002 | AD153: -6.9900000000000004e-002 | AE153: 92.25 | AF153: 95.6 | AG153: 0.69 | AH153: AA | AI153: 4.0300000000000002e-002 | AJ153: =H153+100*O153 -> 134.89699999999999 | AK153: 136.3 | AL153: 24 | AM153: 40.7 | AN153: 36 | AO153: 1.3999999999999999e-002 | AP153: 18 | AQ153: 景兴转债
A154: 153 | B154: 128129 | C154: 青农转债! | D154: 2958 | E154: 青农商行 | F154: 金融 | G154: 银行行业 | H154: 109.963 | I154: -8.0000000000000004e-004 | J154: -2.5999999999999999e-003 | K154: 3.87 | L154: -7.7000000000000002e-003 | M154: 112 | N154: 4.32 | O154: 0.22699999999999998 | P154: 89.58 | Q154: 已到 | R154: 4.70年 | S154: 无权 | T154: 50 | U154: 11 | V154: 2.e-003 | W154: 0.23300000000000001 | X154: 0.20800000000000002 | Y154: 215 | Z154: 0.76 | AA154: 4.0000000000000001e-003 | AB154: -7.000000000000001e-004 | AC154: 无权 | AD154: 无权 | AE154: 无权 | AF154: 96.24 | AG154: 0.44 | AH154: AAA | AI154: 3.3300000000000003e-002 | AJ154: =H154+100*O154 -> 132.66299999999998 | AK154: 130.3 | AL154: 10 | AM154: 34.1 | AN154: 16 | AO154: 6.9999999999999993e-003 | AP154: 26 | AQ154: 青农转债!
A155: 154 | B155: 113602 | C155: 景20转债! | D155: 603228 | E155: 景旺电子 | F155: 电子 | G155: 元器件制 | H155: 130.11 | I155: -6.3e-003 | J155: -7.3000000000000001e-003 | K155: 28.59 | L155: -2.1899999999999999e-002 | M155: 112.9 | N155: 27.4 | O155: 0.247 | P155: 104.34 | Q155: 已到 | R155: 4.70年 | S155: 2.70年 | T155: 17.8 | U155: 9.8 | V155: 4.0000000000000001e-003 | W155: 7.2999999999999995e-002 | X155: 7.5999999999999998e-002 | Y155: 244 | Z155: 3.61 | AA155: -3.0299999999999997e-002 | AB155: -3.5000000000000003e-002 | AC155: -7.7499999999999999e-002 | AD155: -7.9500000000000001e-002 | AE155: 92.42 | AF155: 94.11 | AG155: 0.62 | AH155: AA | AI155: 4.0300000000000002e-002 | AJ155: =H155+100*O155 -> 154.81 | AK155: 155.9 | AL155: 175 | AM155: 61.8 | AN155: 166 | AO155: -1.7000000000000001e-002 | AP155: 9 | AQ155: 景20转债!
A156: 155 | B156: 113039 | C156: 嘉泽转债!! | D156: 601619 | E156: 嘉泽新能 | F156: 能源电力 | G156: 风能 | H156: 167.52 | I156: 1.21e-002 | J156: -8.8000000000000005e-003 | K156: 5.48 | L156: 3.7000000000000002e-003 | M156: 112.8 | N156: 3.46 | O156: 5.7999999999999996e-002 | P156: 158.38 | Q156: 已到 | R156: 4.70年 | S156: 2.70年 | T156: 2.89 | U156: 148 | V156: 0.307 | W156: 2.2000000000000002e-002 | X156: 3.5000000000000003e-002 | Y156: 133 | Z156: 2.8 | AA156: -8.199999999999999e-002 | AB156: -8.6300000000000002e-002 | AC156: -0.10400000000000001 | AD156: -0.105 | AE156: 92.32 | AF156: 94.02 | AG156: 0.9 | AH156: AA | AI156: 4.0300000000000002e-002 | AJ156: =H156+100*O156 -> 173.32000000000002 | AK156: 176.7 | AL156: 280 | AM156: 82.6 | AN156: 274 | AO156: 3.9e-002 | AP156: 34 | AQ156: 嘉泽转债!!
A157: 156 | B157: 113601 | C157: 塞力转债! | D157: 603716 | E157: 塞力医疗 | F157: 医药 | G157: 医药商业 | H157: 109.86 | I157: -1.0200000000000001e-002 | J157: 8.9999999999999998e-004 | K157: 14.27 | L157: -2.06e-002 | M157: 120.8 | N157: 16.98 | O157: 0.307 | P157: 84.04 | Q157: 已到 | R157: 4.69年 | S157: 2.69年 | T157: 5.43 | U157: 12 | V157: 2.e-002 | W157: 0.18600000000000003 | X157: 0.156 | Y157: 29 | Z157: 1.92 | AA157: 2.0899999999999998e-002 | AB157: 1.3100000000000001e-002 | AC157: -2.0099999999999996e-002 | AD157: -2.2499999999999999e-002 | AE157: 87.65 | AF157: 91.94 | AG157: 0.45 | AH157: AA- | AI157: 6.13e-002 | AJ157: =H157+100*O157 -> 140.56 | AK157: 135.7 | AL157: 23 | AM157: 43.7 | AN157: 52 | AO157: -2.e-002 | AP157: 37 | AQ157: 塞力转债!
A158: 157 | B158: 128128 | C158: 齐翔转2! | D158: 2408 | E158: 齐翔腾达 | F158: 化工 | G158: 化工 | H158: 186.248 | I158: 4.0500000000000001e-002 | J158: 4.0000000000000002e-004 | K158: 10.29 | L158: 4.36e-002 | M158: 115 | N158: 5.69 | O158: 2.9999999999999999e-002 | P158: 180.84 | Q158: 已到 | R158: 4.69年 | S158: 2.69年 | T158: 6.81 | U158: 209 | V158: 0.16600000000000001 | W158: 2.3e-002 | X158: 4.2000000000000003e-002 | Y158: 293 | Z158: 2.35 | AA158: -9.9299999999999999e-002 | AB158: -0.10400000000000001 | AC158: -0.12300000000000001 | AD158: -0.124 | AE158: 92.47 | AF158: 95.9 | AG158: 0.94 | AH158: AA | AI158: 4.0300000000000002e-002 | AJ158: =H158+100*O158 -> 189.24799999999999 | AK158: 191.7 | AL158: 308 | AM158: 95.8 | AN158: 303 | AO158: 6.2e-002 | AP158: 27 | AQ158: 齐翔转2!
A159: 158 | B159: 128127 | C159: 文科转债! | D159: 2775 | E159: 文科园林 | F159: 城市公用 | G159: 生态环境 | H159: 100.021 | I159: 5.1000000000000004e-003 | J159: 1.1000000000000001e-003 | K159: 3.71 | L159: 1.6399999999999998e-002 | M159: 120.8 | N159: 4.88 | O159: 0.316 | P159: 76.02 | Q159: 已到 | R159: 4.69年 | S159: 2.69年 | T159: 9.5 | U159: 15 | V159: 1.6e-002 | W159: 0.499 | X159: 0.38 | Y159: 19 | Z159: 0.89 | AA159: 4.2000000000000003e-002 | AB159: 3.39e-002 | AC159: 1.29e-002 | AD159: 1.03e-002 | AE159: 87.66 | AF159: 91.95 | AG159: 0.38 | AH159: AA- | AI159: 6.13e-002 | AJ159: =H159+100*O159 -> 131.62100000000001 | AK159: 124 | AL159: 3 | AM159: 32.1 | AN159: 10 | AO159: 2.7999999999999997e-002 | AP159: 74 | AQ159: 文科转债!
A160: 159 | B160: 110074 | C160: 精达转债!! | D160: 600577 | E160: 精达股份 | F160: 电子 | G160: 电子产品 | H160: 247.52 | I160: 6.3e-003 | J160: -3.0800000000000001e-002 | K160: 8.07 | L160: -2.5399999999999999e-002 | M160: 116.9 | N160: 3.73 | O160: 0.14400000000000002 | P160: 216.35 | Q160: 已到 | R160: 4.69年 | S160: 2.69年 | T160: 5.1 | U160: 158 | V160: 0.128 | W160: 3.2000000000000001e-002 | X160: 6.9000000000000006e-002 | Y160: 161 | Z160: 3.73 | AA160: -0.14999999999999999 | AB160: -0.155 | AC160: -0.16300000000000001 | AD160: -0.16399999999999998 | AE160: 92.47 | AF160: 97.49 | AG160: 0.97 | AH160: AA | AI160: 4.0300000000000002e-002 | AJ160: =H160+100*O160 -> 261.92000000000002 | AK160: 278.7 | AL160: 354 | AM160: 181.2 | AN160: 355 | AO160: -0.105 | AP160: 10 | AQ160: 精达转债!!
A161: 160 | B161: 110072 | C161: 广汇转债! | D161: 600297 | E161: 广汇汽车 | F161: 汽车 | G161: 分销、售 | H161: 98.95 | I161: 5.0000000000000001e-004 | J161: -5.0000000000000001e-004 | K161: 2.61 | L161: 0. | M161: 114.3 | N161: 4.03 | O161: 0.52800000000000002 | P161: 64.76 | Q161: 已到 | R161: 4.69年 | S161: 2.69年 | T161: 33.7 | U161: 23 | V161: 6.9999999999999993e-003 | W161: 0.159 | X161: 0.10300000000000001 | Y161: 212 | Z161: 0.52 | AA161: 3.1800000000000002e-002 | AB161: 2.6000000000000002e-002 | AC161: 1.3600000000000001e-002 | AD161: 1.1599999999999999e-002 | AE161: 93.17 | AF161: 97.41 | AG161: 0.15 | AH161: AA+ | AI161: 3.5299999999999998e-002 | AJ161: =H161+100*O161 -> 151.75 | AK161: 133.1 | AL161: 17 | AM161: 35.7 | AN161: 20 | AO161: 1.8000000000000002e-002 | AP161: 82 | AQ161: 广汇转债!
A162: 161 | B162: 113600 | C162: 新星转债!! | D162: 603978 | E162: 深圳新星 | F162: 有色金属 | G162: 有色行业 | H162: 157.32 | I162: 6.9099999999999995e-002 | J162: 2.5000000000000001e-003 | K162: 34.38 | L162: 8.8300000000000003e-002 | M162: 125.6 | N162: 23.85 | O162: 9.0999999999999998e-002 | P162: 144.15 | Q162: 已到 | R162: 4.67年 | S162: 2.67年 | T162: 4.53 | U162: 1545. | V162: 2.2000000000000002 | W162: 8.1000000000000003e-002 | X162: 0.11599999999999999 | Y162: 56 | Z162: 3.62 | AA162: -4.7899999999999998e-002 | AB162: -5.6299999999999996e-002 | AC162: -0.13600000000000001 | AD162: -0.13800000000000001 | AE162: 87.57 | AF162: 95.65 | AG162: 0.81 | AH162: AA- | AI162: 6.13e-002 | AJ162: =H162+100*O162 -> 166.41999999999999 | AK162: 170.5 | AL162: 261 | AM162: 74.8 | AN162: 241 | AO162: 0.17399999999999999 | AP162: 25 | AQ162: 新星转债!!
A163: 162 | B163: 127021 | C163: 特发转2! | D163: 70 | E163: 特发信息 | F163: 通信互联 | G163: 通信设备 | H163: 123.887 | I163: 1.2199999999999999e-002 | J163: -1.e-002 | K163: 7.32 | L163: 2.9500000000000002e-002 | M163: 113 | N163: 12.33 | O163: 1.0900000000000001 | P163: 59.37 | Q163: 已到 | R163: 3.66年 | S163: 1.66年 | T163: 5.5 | U163: 49 | V163: 7.0999999999999994e-002 | W163: 9.0999999999999998e-002 | X163: 5.4000000000000006e-002 | Y163: 60 | Z163: 2.09 | AA163: -2.5099999999999997e-002 | AB163: -3.1300000000000001e-002 | AC163: -0.10300000000000001 | AD163: -0.10400000000000001 | AE163: 94.71 | AF163: 97.98 | AG163: 0.07 | AH163: AA | AI163: 4.0300000000000002e-002 | AJ163: =H163+100*O163 -> 232.887 | AK163: 188.4 | AL163: 305 | AM163: 90.4 | AN163: 289 | AO163: 0.109 | AP163: 16 | AQ163: 特发转2!
A164: 163 | B164: 113599 | C164: 嘉友转债! | D164: 603871 | E164: 嘉友国际 | F164: 交通运输 | G164: 物流业 | H164: 129.93 | I164: 2.6499999999999999e-002 | J164: -1.2500000000000001e-002 | K164: 20.85 | L164: 2.1600000000000001e-002 | M164: 125.6 | N164: 18.32 | O164: 0.14199999999999999 | P164: 113.81 | Q164: 已到 | R164: 4.65年 | S164: 2.65年 | T164: 7.2 | U164: 25 | V164: 2.7000000000000003e-002 | W164: 0.121 | X164: 0.13800000000000001 | Y164: 60 | Z164: 2.85 | AA164: -7.4000000000000003e-003 | AB164: -1.6399999999999998e-002 | AC164: -7.8100000000000003e-002 | AD164: -8.0199999999999994e-002 | AE164: 87.68 | AF164: 95.78 | AG164: 0.65 | AH164: AA- | AI164: 6.13e-002 | AJ164: =H164+100*O164 -> 144.13 | AK164: 146 | AL164: 86 | AM164: 50.3 | AN164: 94 | AO164: 1.2e-002 | AP164: 18 | AQ164: 嘉友转债!
A165: 164 | B165: 113598 | C165: 法兰转债 | D165: 603966 | E165: 法兰泰克 | F165: 机械装备 | G165: 工程机械 | H165: 119.34 | I165: 7.4999999999999997e-003 | J165: -4.0000000000000002e-004 | K165: 8.86 | L165: 1.37e-002 | M165: 120.8 | N165: 9.7 | O165: 0.307 | P165: 91.34 | Q165: 已到 | R165: 4.64年 | S165: 2.64年 | T165: 2.75 | U165: 4.1 | V165: 1.3000000000000001e-002 | W165: 0.10300000000000001 | X165: 9.5000000000000001e-002 | Y165: 27 | Z165: 2.13 | AA165: 2.7000000000000001e-003 | AB165: -5.0000000000000001e-003 | AC165: -4.9299999999999997e-002 | AD165: -5.16e-002 | AE165: 87.95 | AF165: 92.25 | AG165: 0.52 | AH165: AA- | AI165: 6.13e-002 | AJ165: =H165+100*O165 -> 150.03999999999999 | AK165: 147.3 | AL165: 97 | AM165: 55.1 | AN165: 127 | AO165: -1.7000000000000001e-002 | AP165: 13 | AQ165: 法兰转债
A166: 165 | B166: 128125 | C166: 华阳转债! | D166: 2949 | E166: 华阳国际 | F166: 建筑 | G166: 建筑工程 | H166: 107.999 | I166: 4.5999999999999999e-003 | J166: -2.5999999999999999e-003 | K166: 15.08 | L166: 1.1399999999999999e-002 | M166: 118.1 | N166: 25.39 | O166: 0.81799999999999995 | P166: 59.39 | Q166: 已到 | R166: 4.63年 | S166: 2.63年 | T166: 4.5 | U166: 15 | V166: 2.9999999999999999e-002 | W166: 0.152 | X166: 8.9999999999999997e-002 | Y166: 30 | Z166: 2.19 | AA166: 1.9900000000000001e-002 | AB166: 1.29e-002 | AC166: -1.54e-002 | AD166: -1.77e-002 | AE166: 87.7 | AF166: 90.15 | AG166: 0.18 | AH166: AA- | AI166: 6.13e-002 | AJ166: =H166+100*O166 -> 189.79899999999998 | AK166: 156.6 | AL166: 181 | AM166: 66.4 | AN166: 191 | AO166: 3.3000000000000002e-002 | AP166: 12 | AQ166: 华阳转债!
A167: 166 | B167: 113597 | C167: 佳力转债! | D167: 603912 | E167: 佳力图 | F167: 机械装备 | G167: 专用设备 | H167: 114.09 | I167: -1.5e-003 | J167: 4.0000000000000002e-004 | K167: 15.22 | L167: -4.5999999999999999e-003 | M167: 124 | N167: 23.15 | O167: 0.73499999999999999 | P167: 65.75 | Q167: 已到 | R167: 4.63年 | S167: 2.63年 | T167: 3 | U167: 11 | V167: 3.2000000000000001e-002 | W167: 9.0999999999999998e-002 | X167: 5.9999999999999998e-002 | Y167: 33 | Z167: 3.44 | AA167: 1.8500000000000003e-002 | AB167: 9.7000000000000003e-003 | AC167: -3.3099999999999997e-002 | AD167: -3.56e-002 | AE167: 88.12 | AF167: 94.71 | AG167: 0.23 | AH167: AA- | AI167: 6.13e-002 | AJ167: =H167+100*O167 -> 187.59 | AK167: 162.4 | AL167: 216 | AM167: 67.7 | AN167: 204 | AO167: 5.2999999999999999e-002 | AP167: 20 | AQ167: 佳力转债!
A168: 167 | B168: 123063 | C168: 大禹转债 | D168: 300021 | E168: 大禹节水 | F168: 化工 | G168: 橡胶塑料 | H168: 127.285 | I168: 5.6000000000000008e-003 | J168: -3.2000000000000002e-003 | K168: 5.48 | L168: 3.7000000000000002e-003 | M168: 126.1 | N168: 4.83 | O168: 0.122 | P168: 113.46 | Q168: 已到 | R168: 4.63年 | S168: 3.63年 | T168: 6.35 | U168: 29 | V168: 3.6000000000000004e-002 | W168: 0.14499999999999999 | X168: 0.16399999999999998 | Y168: 44 | Z168: 2.95 | AA168: -2.0999999999999999e-003 | AB168: -1.1299999999999999e-002 | AC168: -4.6399999999999997e-002 | AD168: -4.9400000000000006e-002 | AE168: 85.41 | AF168: 96.34 | AG168: 0.65 | AH168: AA- | AI168: 6.13e-002 | AJ168: =H168+100*O168 -> 139.48499999999999 | AK168: 141.1 | AL168: 41 | AM168: 44.8 | AN168: 59 | AO168: 2.1000000000000001e-002 | AP168: 20 | AQ168: 大禹转债
A169: 168 | B169: 128124 | C169: 科华转债! | D169: 2022 | E169: 科华生物 | F169: 医药 | G169: 生物制药 | H169: 107.988 | I169: 0. | J169: -2.0999999999999999e-003 | K169: 14.4 | L169: -9.5999999999999992e-003 | M169: 110 | N169: 21.3 | O169: 0.59699999999999998 | P169: 67.61 | Q169: 已到 | R169: 4.63年 | S169: 2.63年 | T169: 7.38 | U169: 2.7 | V169: 3.0000000000000001e-003 | W169: 0.10000000000000001 | X169: 6.7000000000000004e-002 | Y169: 74 | Z169: 2.05 | AA169: 4.0999999999999995e-003 | AB169: 0. | AC169: -1.77e-002 | AD169: -1.9599999999999999e-002 | AE169: 92.08 | AF169: 91.91 | AG169: 0.22 | AH169: AA | AI169: 4.0300000000000002e-002 | AJ169: =H169+100*O169 -> 167.68799999999999 | AK169: 148.4 | AL169: 107 | AM169: 56.3 | AN169: 133 | AO169: -3.0000000000000001e-003 | AP169: 25 | AQ169: 科华转债!
A170: 169 | B170: 113596 | C170: 城地转债! | D170: 603887 | E170: 城地香江 | F170: 通信互联 | G170: 通信设备 | H170: 95.46 | I170: 1.e-004 | J170: -1.e-004 | K170: 7.73 | L170: -5.1000000000000004e-003 | M170: 113.1 | N170: 24.26 | O170: 2. | P170: 31.86 | Q170: 已到 | R170: 4.63年 | S170: 2.63年 | T170: 12 | U170: 12 | V170: 1.1000000000000001e-002 | W170: 0.34399999999999997 | X170: 0.11 | Y170: 35 | Z170: 0.93 | AA170: 3.8100000000000002e-002 | AB170: 3.2599999999999997e-002 | AC170: 2.9399999999999999e-002 | AD170: 2.69e-002 | AE170: 87.72 | AF170: 86.39 | AG170: 0 | AH170: AA- | AI170: 6.13e-002 | AJ170: =H170+100*O170 -> 295.45999999999998 | AK170: 159.1 | AL170: 190 | AM170: 71.3 | AN170: 228 | AO170: 1.4999999999999999e-002 | AP170: 40 | AQ170: 城地转债!
A171: 170 | B171: 123062 | C171: 三超转债 | D171: 300554 | E171: 三超新材 | F171: 机械装备 | G171: 通用设备 | H171: 121.3 | I171: 1.6e-002 | J171: -3.4000000000000002e-003 | K171: 16.15 | L171: 1.9599999999999999e-002 | M171: 119.2 | N171: 17.13 | O171: 0.28699999999999998 | P171: 94.28 | Q171: 已到 | R171: 4.62年 | S171: 2.62年 | T171: 1.95 | U171: 34 | V171: 0.14599999999999999 | W171: 0.129 | X171: 0.121 | Y171: 15 | Z171: 2.88 | AA171: -3.9000000000000003e-003 | AB171: -1.1000000000000001e-002 | AC171: -5.3699999999999998e-002 | AD171: -5.6299999999999996e-002 | AE171: 83.68 | AF171: 83.43 | AG171: 0.64 | AH171: A | AI171: 8.2299999999999998e-002 | AJ171: =H171+100*O171 -> 150. | AK171: 148.3 | AL171: 105 | AM171: 64.6 | AN171: 186 | AO171: -4.0000000000000001e-003 | AP171: 27 | AQ171: 三超转债
A172: 171 | B172: 128123 | C172: 国光转债! | D172: 2749 | E172: 国光股份 | F172: 化工 | G172: 农化 | H172: 108.471 | I172: -3.2000000000000002e-003 | J172: 1.4000000000000002e-003 | K172: 8.93 | L172: -6.7000000000000002e-003 | M172: 115.7 | N172: 13.49 | O172: 0.63900000000000001 | P172: 66.2 | Q172: 已到 | R172: 4.62年 | S172: 2.62年 | T172: 3.2 | U172: 5.9 | V172: 1.7000000000000001e-002 | W172: 8.199999999999999e-002 | X172: 5.4000000000000006e-002 | Y172: 39 | Z172: 2.96 | AA172: 1.44e-002 | AB172: 8.199999999999999e-003 | AC172: -1.6399999999999998e-002 | AD172: -1.8799999999999997e-002 | AE172: 87.91 | AF172: 88.42 | AG172: 0.27 | AH172: AA- | AI172: 6.13e-002 | AJ172: =H172+100*O172 -> 172.37100000000001 | AK172: 150.7 | AL172: 131 | AM172: 62.3 | AN172: 171 | AO172: 4.0000000000000001e-003 | AP172: 14 | AQ172: 国光转债!
A173: 172 | B173: 110073 | C173: 国投转债 | D173: 600061 | E173: 国投资本 | F173: 金融 | G173: 证券行业 | H173: 117.01 | I173: -2.5999999999999999e-003 | J173: -2.0000000000000001e-004 | K173: 8.37 | L173: -7.0999999999999995e-003 | M173: 110.3 | N173: 9.9 | O173: 0.38400000000000001 | P173: 84.55 | Q173: 已到 | R173: 4.62年 | S173: 无权 | T173: 80 | U173: 23 | V173: 2.e-003 | W173: 0.14899999999999999 | X173: 0.126 | Y173: 538 | Z173: 1.19 | AA173: -1.29e-002 | AB173: -1.6899999999999998e-002 | AC173: 无权 | AD173: 无权 | AE173: 无权 | AF173: 95.01 | AG173: 0.39 | AH173: AAA | AI173: 3.3300000000000003e-002 | AJ173: =H173+100*O173 -> 155.41 | AK173: 149.5 | AL173: 119 | AM173: 54.5 | AN173: 120 | AO173: 1.8000000000000002e-002 | AP173: 23 | AQ173: 国投转债
A174: 173 | B174: 128122 | C174: 兴森转债! | D174: 2436 | E174: 兴森科技 | F174: 电子 | G174: 元器件制 | H174: 134.95 | I174: -1.3500000000000002e-002 | J174: 2.8000000000000004e-003 | K174: 13.82 | L174: -2.12e-002 | M174: 113 | N174: 14.1 | O174: 0.377 | P174: 98.01 | Q174: 已到 | R174: 3.61年 | S174: 2.61年 | T174: 2.69 | U174: 50 | V174: 0.13900000000000001 | W174: 1.3000000000000001e-002 | X174: 1.3000000000000001e-002 | Y174: 206 | Z174: 5.74 | AA174: -4.8499999999999995e-002 | AB174: -5.45e-002 | AC174: -9.2100000000000015e-002 | AD174: -9.4100000000000003e-002 | AE174: 92.67 | AF174: 98.14 | AG174: 0.5 | AH174: AA | AI174: 4.0300000000000002e-002 | AJ174: =H174+100*O174 -> 172.64999999999998 | AK174: 171.9 | AL174: 266 | AM174: 73.7 | AN174: 237 | AO174: -4.0999999999999995e-002 | AP174: 11 | AQ174: 兴森转债!
A175: 174 | B175: 113037 | C175: 紫银转债! | D175: 601860 | E175: 紫金银行 | F175: 金融 | G175: 银行行业 | H175: 105.99 | I175: -1.e-003 | J175: -1.8e-003 | K175: 3.2 | L175: -9.300000000000001e-003 | M175: 115.6 | N175: 4.05 | O175: 0.34100000000000003 | P175: 79.01 | Q175: 已到 | R175: 4.61年 | S175: 无权 | T175: 45 | U175: 33 | V175: 6.9999999999999993e-003 | W175: 0.38400000000000001 | X175: 0.30299999999999999 | Y175: 117 | Z175: 0.76 | AA175: 1.9400000000000001e-002 | AB175: 1.32e-002 | AC175: 无权 | AD175: 无权 | AE175: 无权 | AF175: 98.86 | AG175: 0.3 | AH175: AA+ | AI175: 3.5299999999999998e-002 | AJ175: =H175+100*O175 -> 140.09 | AK175: 133 | AL175: 16 | AM175: 34.1 | AN175: 17 | AO175: 5.0000000000000001e-003 | AP175: 28 | AQ175: 紫银转债!
A176: 175 | B176: 123061 | C176: 航新转债! | D176: 300424 | E176: 航新科技 | F176: 航空航天 | G176: 航空航天 | H176: 128.002 | I176: -9.0000000000000011e-003 | J176: -8.1000000000000013e-003 | K176: 15.75 | L176: -2.6600000000000002e-002 | M176: 124.3 | N176: 14.85 | O176: 0.20699999999999999 | P176: 106.06 | Q176: 已到 | R176: 4.61年 | S176: 2.61年 | T176: 2.5 | U176: 65 | V176: 0.20399999999999999 | W176: 6.6000000000000003e-002 | X176: 7.0000000000000007e-002 | Y176: 38 | Z176: 5.59 | AA176: -6.5000000000000006e-003 | AB176: -1.52e-002 | AC176: -7.2000000000000008e-002 | AD176: -7.46e-002 | AE176: 86.04 | AF176: 90.81 | AG176: 0.64 | AH176: A+ | AI176: 7.2300000000000003e-002 | AJ176: =H176+100*O176 -> 148.702 | AK176: 149.9 | AL176: 125 | AM176: 59.1 | AN176: 151 | AO176: 3.3000000000000002e-002 | AP176: 19 | AQ176: 航新转债!
A177: 176 | B177: 123060 | C177: 苏试转债! | D177: 300416 | E177: 苏试试验 | F177: 机械装备 | G177: 专用设备 | H177: 180.3 | I177: 1.7399999999999999e-002 | J177: -6.1999999999999998e-003 | K177: 29.36 | L177: 1.24e-002 | M177: 117.2 | N177: 18.28 | O177: 0.12300000000000001 | P177: 160.61 | Q177: 已到 | R177: 4.61年 | S177: 2.61年 | T177: 3.1 | U177: 60 | V177: 0.109 | W177: 4.0000000000000001e-002 | X177: 6.4000000000000001e-002 | Y177: 77 | Z177: 7.64 | AA177: -9.0800000000000006e-002 | AB177: -9.64e-002 | AC177: -0.122 | AD177: -0.12300000000000001 | AE177: 87.92 | AF177: 89.62 | AG177: 0.9 | AH177: AA- | AI177: 6.13e-002 | AJ177: =H177+100*O177 -> 192.60000000000002 | AK177: 200 | AL177: 321 | AM177: 110.4 | AN177: 321 | AO177: 4.2000000000000003e-002 | AP177: 8 | AQ177: 苏试转债!
A178: 177 | B178: 113595 | C178: 花王转债! | D178: 603007 | E178: ST花王 | F178: 城市公用 | G178: 生态环境 | H178: 111.62 | I178: -2.3999999999999998e-003 | J178: 5.4000000000000003e-003 | K178: 3.49 | L178: 1.7500000000000002e-002 | M178: 124.8 | N178: 6.92 | O178: 1.21 | P178: 50.43 | Q178: 已到 | R178: 4.61年 | S178: 2.61年 | T178: 3.3 | U178: 254 | V178: 0.68799999999999994 | W178: 0.28199999999999997 | X178: 0.14199999999999999 | Y178: 12 | Z178: 1.09 | AA178: 2.5000000000000001e-002 | AB178: 1.5800000000000002e-002 | AC178: -2.63e-002 | AD178: -2.8799999999999999e-002 | AE178: 79.39 | AF178: 80.5 | AG178: 0.17 | AH178: BBB+ | AI178: 0.1023 | AJ178: =H178+100*O178 -> 232.62 | AK178: 172.8 | AL178: 270 | AM178: 92.3 | AN178: 295 | AO178: 4.7e-002 | AP178: 49 | AQ178: 花王转债!
A179: 178 | B179: 113594 | C179: 淳中转债! | D179: 603516 | E179: 淳中科技 | F179: 电子 | G179: 电子产品 | H179: 154.06 | I179: 6.7599999999999993e-002 | J179: 8.1000000000000013e-003 | K179: 22.36 | L179: 9.9900000000000003e-002 | M179: 120.9 | N179: 18.23 | O179: 0.25600000000000001 | P179: 122.65 | Q179: 已到 | R179: 4.61年 | S179: 2.61年 | T179: 3 | U179: 1086. | V179: 2.3199999999999998 | W179: 7.2000000000000008e-002 | X179: 8.8000000000000009e-002 | Y179: 42 | Z179: 4.3 | AA179: -5.2300000000000006e-002 | AB179: -5.9400000000000001e-002 | AC179: -0.13100000000000001 | AD179: -0.13300000000000001 | AE179: 85.92 | AF179: 88.32 | AG179: 0.76 | AH179: A+ | AI179: 7.2300000000000003e-002 | AJ179: =H179+100*O179 -> 179.66 | AK179: 185.5 | AL179: 298 | AM179: 97.1 | AN179: 307 | AO179: 0.23699999999999999 | AP179: 9 | AQ179: 淳中转债!
A180: 179 | B180: 127020 | C180: 中金转债 | D180: 60 | E180: 中金岭南 | F180: 有色金属 | G180: 有色行业 | H180: 124.769 | I180: 5.9999999999999995e-004 | J180: -4.1999999999999997e-003 | K180: 5.05 | L180: -5.8999999999999999e-003 | M180: 113.5 | N180: 4.63 | O180: 0.14400000000000002 | P180: 109.07 | Q180: 已到 | R180: 4.61年 | S180: 2.61年 | T180: 34.3 | U180: 27 | V180: 6.0000000000000001e-003 | W180: 0.18600000000000003 | X180: 0.20300000000000001 | Y180: 184 | Z180: 1.47 | AA180: -2.06e-002 | AB180: -2.5699999999999997e-002 | AC180: -6.9599999999999995e-002 | AD180: -7.0999999999999994e-002 | AE180: 92.92 | AF180: 96.95 | AG180: 0.62 | AH180: AA+ | AI180: 3.5299999999999998e-002 | AJ180: =H180+100*O180 -> 139.16900000000001 | AK180: 140.5 | AL180: 37 | AM180: 43.5 | AN180: 49 | AO180: 2.9999999999999999e-002 | AP180: 20 | AQ180: 中金转债
A181: 180 | B181: 113593 | C181: 沪工转债! | D181: 603131 | E181: 上海沪工 | F181: 机械装备 | G181: 通用设备 | H181: 146.86 | I181: 1.6000000000000001e-003 | J181: -1.6799999999999999e-002 | K181: 26.17 | L181: -1.9900000000000001e-002 | M181: 121.2 | N181: 21.12 | O181: 0.185 | P181: 123.91 | Q181: 已到 | R181: 4.61年 | S181: 2.61年 | T181: 4 | U181: 302 | V181: 0.52100000000000002 | W181: 4.8000000000000001e-002 | X181: 5.9999999999999998e-002 | Y181: 83 | Z181: 6.26 | AA181: -4.1700000000000001e-002 | AB181: -4.9100000000000005e-002 | AC181: -0.11599999999999999 | AD181: -0.11800000000000001 | AE181: 86.04 | AF181: 88.56 | AG181: 0.76 | AH181: A+ | AI181: 7.2300000000000003e-002 | AJ181: =H181+100*O181 -> 165.36000000000001 | AK181: 169.8 | AL181: 255 | AM181: 81.2 | AN181: 267 | AO181: 3.7000000000000005e-002 | AP181: 10 | AQ181: 沪工转债!
A182: 181 | B182: 128120 | C182: 联诚转债! | D182: 2921 | E182: 联诚精密 | F182: 汽车 | G182: 零部件制 | H182: 119.4 | I182: 2.81e-002 | J182: 5.1999999999999998e-003 | K182: 16.89 | L182: 5.2999999999999999e-002 | M182: 117.9 | N182: 18.44 | O182: 0.30399999999999999 | P182: 91.59 | Q182: 已到 | R182: 4.60年 | S182: 2.60年 | T182: 2.6 | U182: 37 | V182: 0.12 | W182: 0.14499999999999999 | X182: 0.13300000000000001 | Y182: 18 | Z182: 2.25 | AA182: -2.8000000000000004e-003 | AB182: -9.5999999999999992e-003 | AC182: -4.9000000000000002e-002 | AD182: -5.16e-002 | AE182: 83.84 | AF182: 82.7 | AG182: 0.63 | AH182: A | AI182: 8.2299999999999998e-002 | AJ182: =H182+100*O182 -> 149.80000000000001 | AK182: 147.2 | AL182: 93 | AM182: 63.4 | AN182: 181 | AO182: 6.4000000000000001e-002 | AP182: 22 | AQ182: 联诚转债!
A183: 182 | B183: 128121 | C183: 宏川转债! | D183: 2930 | E183: 宏川智慧 | F183: 交通运输 | G183: 物流业 | H183: 137.807 | I183: 4.0000000000000002e-004 | J183: -1.1000000000000001e-003 | K183: 25.62 | L183: -8.0000000000000004e-004 | M183: 112.9 | N183: 19.89 | O183: 7.0000000000000007e-002 | P183: 128.81 | Q183: 已到 | R183: 4.60年 | S183: 2.60年 | T183: 6.7 | U183: 32 | V183: 3.5000000000000003e-002 | W183: 5.9000000000000004e-002 | X183: 7.4999999999999997e-002 | Y183: 114 | Z183: 5.4 | AA183: -4.3200000000000002e-002 | AB183: -4.7899999999999998e-002 | AC183: -9.9399999999999988e-002 | AD183: -0.10099999999999999 | AE183: 87.85 | AF183: 86.38 | AG183: 0.83 | AH183: AA- | AI183: 6.13e-002 | AJ183: =H183+100*O183 -> 144.80699999999999 | AK183: 146.8 | AL183: 89 | AM183: 59 | AN183: 147 | AO183: 9.8000000000000004e-002 | AP183: 6 | AQ183: 宏川转债!
A184: 183 | B184: 123059 | C184: 银信转债! | D184: 300231 | E184: 银信科技 | F184: 计算机及 | G184: 软件开发 | H184: 118.345 | I184: 5.9999999999999995e-004 | J184: -4.7999999999999996e-003 | K184: 8.35 | L184: -9.4999999999999998e-003 | M184: 123.7 | N184: 9.72 | O184: 0.37799999999999995 | P184: 85.91 | Q184: 已到 | R184: 4.59年 | S184: 2.59年 | T184: 3.91 | U184: 4.8 | V184: 1.e-002 | W184: 0.106 | X184: 9.0999999999999998e-002 | Y184: 37 | Z184: 2.64 | AA184: 9.8999999999999991e-003 | AB184: 1.1000000000000001e-003 | AC184: -4.7400000000000005e-002 | AD184: -4.9800000000000004e-002 | AE184: 88.08 | AF184: 94.68 | AG184: 0.45 | AH184: AA- | AI184: 6.13e-002 | AJ184: =H184+100*O184 -> 156.14499999999998 | AK184: 150.8 | AL184: 132 | AM184: 56.1 | AN184: 132 | AO184: -2.e-003 | AP184: 19 | AQ184: 银信转债!
A185: 184 | B185: 127019 | C185: 国城转债! | D185: 688 | E185: 国城矿业 | F185: 有色金属 | G185: 锌铅镍锡 | H185: 104 | I185: 8.199999999999999e-003 | J185: -7.3000000000000001e-003 | K185: 13.18 | L185: 6.8999999999999999e-003 | M185: 114.8 | N185: 21.06 | O185: 0.66200000000000003 | P185: 62.58 | Q185: 已到 | R185: 4.59年 | S185: 2.59年 | T185: 8.5 | U185: 20 | V185: 2.3e-002 | W185: 5.7000000000000002e-002 | X185: 3.5000000000000003e-002 | Y185: 150 | Z185: 6.2 | AA185: 2.2200000000000001e-002 | AB185: 1.6200000000000003e-002 | AC185: -2.3999999999999998e-003 | AD185: -4.7999999999999996e-003 | AE185: 92.72 | AF185: 96.09 | AG185: 0.14 | AH185: AA | AI185: 4.0300000000000002e-002 | AJ185: =H185+100*O185 -> 170.19999999999999 | AK185: 145.4 | AL185: 78 | AM185: 49.3 | AN185: 84 | AO185: -2.1000000000000001e-002 | AP185: 50 | AQ185: 国城转债!
A186: 185 | B186: 128119 | C186: 龙大转债! | D186: 2726 | E186: 龙大肉食 | F186: 食品饮料 | G186: 肉制品 | H186: 130.5 | I186: 7.7000000000000002e-003 | J186: -1.1299999999999999e-002 | K186: 10.29 | L186: -5.7999999999999996e-003 | M186: 119.9 | N186: 9.29 | O186: 0.17800000000000002 | P186: 110.76 | Q186: 已到 | R186: 4.59年 | S186: 2.59年 | T186: 9.46 | U186: 12 | V186: 1.e-002 | W186: 8.5000000000000006e-002 | X186: 9.4e-002 | Y186: 111 | Z186: 2.75 | AA186: -1.8600000000000002e-002 | AB186: -2.5899999999999999e-002 | AC186: -8.1699999999999995e-002 | AD186: -8.3800000000000013e-002 | AE186: 92.84 | AF186: 100.38 | AG186: 0.62 | AH186: AA | AI186: 4.0300000000000002e-002 | AJ186: =H186+100*O186 -> 148.30000000000001 | AK186: 150.2 | AL186: 128 | AM186: 49.9 | AN186: 90 | AO186: -3.7999999999999999e-002 | AP186: 9 | AQ186: 龙大转债!
A187: 186 | B187: 110071 | C187: 湖盐转债! | D187: 600929 | E187: 雪天盐业 | F187: 食品饮料 | G187: 食品饮料 | H187: 125.05 | I187: -1.4000000000000002e-003 | J187: -5.6999999999999993e-003 | K187: 7.03 | L187: -1.1299999999999999e-002 | M187: 114.9 | N187: 6.52 | O187: 0.16 | P187: 107.82 | Q187: 已到 | R187: 4.58年 | S187: 2.58年 | T187: 7.2 | U187: 12 | V187: 1.3000000000000001e-002 | W187: 0.11 | X187: 0.11800000000000001 | Y187: 66 | Z187: 2.51 | AA187: -1.8700000000000001e-002 | AB187: -2.4300000000000002e-002 | AC187: -6.7400000000000002e-002 | AD187: -6.9599999999999995e-002 | AE187: 92.87 | AF187: 96.24 | AG187: 0.63 | AH187: AA | AI187: 4.0300000000000002e-002 | AJ187: =H187+100*O187 -> 141.05000000000001 | AK187: 142.3 | AL187: 52 | AM187: 46 | AN187: 62 | AO187: -4.0999999999999995e-002 | AP187: 20 | AQ187: 湖盐转债!
A188: 187 | B188: 113036 | C188: 宁建转债! | D188: 601789 | E188: 宁波建工 | F188: 建筑 | G188: 建筑工程 | H188: 109.15 | I188: -1.6000000000000001e-003 | J188: 1.6000000000000001e-003 | K188: 3.63 | L188: 0. | M188: 116.9 | N188: 4.76 | O188: 0.43099999999999999 | P188: 76.26 | Q188: 已到 | R188: 4.57年 | S188: 2.57年 | T188: 5.4 | U188: 2.1 | V188: 4.0000000000000001e-003 | W188: 0.152 | X188: 0.11599999999999999 | Y188: 35 | Z188: 1.09 | AA188: 1.54e-002 | AB188: 8.8000000000000005e-003 | AC188: -1.9699999999999999e-002 | AD188: -2.2099999999999998e-002 | AE188: 92.91 | AF188: 97.95 | AG188: 0.26 | AH188: AA | AI188: 4.0300000000000002e-002 | AJ188: =H188+100*O188 -> 152.25 | AK188: 142 | AL188: 50 | AM188: 44.1 | AN188: 54 | AO188: 1.3999999999999999e-002 | AP188: 14 | AQ188: 宁建转债!
A189: 188 | B189: 128118 | C189: 瀛通转债! | D189: 2861 | E189: 瀛通通讯 | F189: 电子 | G189: 电子产品 | H189: 109.001 | I189: 3.0000000000000001e-003 | J189: -3.4000000000000002e-003 | K189: 11.88 | L189: -3.4000000000000002e-003 | M189: 121.7 | N189: 21.24 | O189: 0.94900000000000007 | P189: 55.93 | Q189: 已到 | R189: 4.56年 | S189: 2.56年 | T189: 3 | U189: 2.4 | V189: 6.9999999999999993e-003 | W189: 0.161 | X189: 8.9999999999999997e-002 | Y189: 19 | Z189: 1.78 | AA189: 2.5099999999999997e-002 | AB189: 1.67e-002 | AC189: -1.6500000000000001e-002 | AD189: -1.95e-002 | AE189: 88.78 | AF189: 93.44 | AG189: 0.13 | AH189: AA- | AI189: 6.13e-002 | AJ189: =H189+100*O189 -> 203.90100000000001 | AK189: 162.1 | AL189: 212 | AM189: 68.6 | AN189: 212 | AO189: -2.6000000000000002e-002 | AP189: 24 | AQ189: 瀛通转债!
A190: 189 | B190: 128117 | C190: 道恩转债! | D190: 2838 | E190: 道恩股份 | F190: 化工 | G190: 橡胶塑料 | H190: 110.01 | I190: 1.1999999999999999e-003 | J190: -7.9000000000000008e-003 | K190: 17.77 | L190: -3.7900000000000003e-002 | M190: 123.1 | N190: 28.83 | O190: 0.78500000000000003 | P190: 61.64 | Q190: 已到 | R190: 4.56年 | S190: 2.56年 | T190: 3.6 | U190: 8.1 | V190: 2.e-002 | W190: 5.0000000000000003e-002 | X190: 3.1e-002 | Y190: 73 | Z190: 3.81 | AA190: 2.5499999999999998e-002 | AB190: 1.67e-002 | AC190: -2.2599999999999999e-002 | AD190: -2.4900000000000002e-002 | AE190: 88.1 | AF190: 94.38 | AG190: 0.18 | AH190: AA- | AI190: 6.13e-002 | AJ190: =H190+100*O190 -> 188.50999999999999 | AK190: 158.4 | AL190: 187 | AM190: 64 | AN190: 182 | AO190: 7.8e-002 | AP190: 25 | AQ190: 道恩转债!
A191: 190 | B191: 123057 | C191: 美联转债!! | D191: 300586 | E191: 美联新材 | F191: 化工 | G191: 橡胶塑料 | H191: 157 | I191: -1.3600000000000001e-002 | J191: 1.11e-002 | K191: 13.25 | L191: -3.0000000000000001e-003 | M191: 117.8 | N191: 9.5 | O191: 0.126 | P191: 139.47 | Q191: 已到 | R191: 4.55年 | S191: 2.55年 | T191: 2.07 | U191: 250 | V191: 0.76400000000000001 | W191: 2.9999999999999999e-002 | X191: 4.0999999999999995e-002 | Y191: 69 | Z191: 5.81 | AA191: -6.2400000000000004e-002 | AB191: -6.8499999999999991e-002 | AC191: -0.14099999999999999 | AD191: -0.10000000000000001 | AE191: 88.38 | AF191: 90.42 | AG191: 0.83 | AH191: AA- | AI191: 6.13e-002 | AJ191: =H191+100*O191 -> 169.59999999999999 | AK191: 174.5 | AL191: 276 | AM191: 84.1 | AN191: 278 | AO191: 4.4999999999999998e-002 | AP191: 20 | AQ191: 美联转债!!
A192: 191 | B192: 113591 | C192: 胜达转债! | D192: 603687 | E192: 大胜达 | F192: 造纸包装 | G192: 包装用纸 | H192: 124.82 | I192: 2.4799999999999999e-002 | J192: -1.24e-002 | K192: 10.45 | L192: 1.7500000000000002e-002 | M192: 121.7 | N192: 8.76 | O192: 4.5999999999999999e-002 | P192: 119.29 | Q192: 已到 | R192: 4.55年 | S192: 2.55年 | T192: 5.19 | U192: 78 | V192: 0.121 | W192: 0.121 | X192: 0.14400000000000002 | Y192: 43 | Z192: 2.47 | AA192: -5.6999999999999993e-003 | AB192: -1.37e-002 | AC192: -6.6699999999999995e-002 | AD192: -6.9000000000000006e-002 | AE192: 88.28 | AF192: 93.37 | AG192: 0.71 | AH192: AA- | AI192: 6.13e-002 | AJ192: =H192+100*O192 -> 129.41999999999999 | AK192: 130.3 | AL192: 11 | AM192: 37 | AN192: 21 | AO192: -4.9000000000000002e-002 | AP192: 34 | AQ192: 胜达转债!
A193: 192 | B193: 128116 | C193: 瑞达转债! | D193: 2961 | E193: 瑞达期货 | F193: 金融 | G193: 期货行业 | H193: 118.1 | I193: -8.0000000000000004e-004 | J193: -1.7299999999999999e-002 | K193: 23.36 | L193: -5.5399999999999998e-002 | M193: 114.9 | N193: 29.55 | O193: 0.49399999999999999 | P193: 79.05 | Q193: 已到 | R193: 4.55年 | S193: 2.55年 | T193: 6.49 | U193: 8.3 | V193: 1.1000000000000001e-002 | W193: 6.2e-002 | X193: 4.9000000000000002e-002 | Y193: 104 | Z193: 4.9 | AA193: -6.0999999999999995e-003 | AB193: -1.1899999999999999e-002 | AC193: -4.8399999999999999e-002 | AD193: -5.0599999999999999e-002 | AE193: 92.89 | AF193: 96.35 | AG193: 0.33 | AH193: AA | AI193: 4.0300000000000002e-002 | AJ193: =H193+100*O193 -> 167.5 | AK193: 157.1 | AL193: 182 | AM193: 60.8 | AN193: 158 | AO193: -2.7000000000000003e-002 | AP193: 17 | AQ193: 瑞达转债!
A194: 193 | B194: 127018 | C194: 本钢转债! | D194: 761 | E194: 本钢板材 | F194: 钢铁 | G194: 炼钢 | H194: 118.8 | I194: -9.1999999999999998e-003 | J194: 3.4000000000000002e-003 | K194: 4.25 | L194: -1.6200000000000003e-002 | M194: 128 | N194: 4.55 | O194: 0.27200000000000002 | P194: 93.41 | Q194: 已到 | R194: 4.55年 | S194: 2.55年 | T194: 56.3 | U194: 27 | V194: 4.0000000000000001e-003 | W194: 0.32299999999999995 | X194: 0.30099999999999999 | Y194: 175 | Z194: 0.76 | AA194: 1.7100000000000001e-002 | AB194: 6.8000000000000005e-003 | AC194: -4.2199999999999994e-002 | AD194: -4.5999999999999999e-002 | AE194: 96.95 | AF194: 110.79 | AG194: 0.36 | AH194: AAA | AI194: 3.3300000000000003e-002 | AJ194: =H194+100*O194 -> 146. | AK194: 144.2 | AL194: 68 | AM194: 33.4 | AN194: 14 | AO194: 2.7999999999999997e-002 | AP194: 61 | AQ194: 本钢转债!
A195: 194 | B195: 113589 | C195: 天创转债! | D195: 603608 | E195: 天创时尚 | F195: 服装纺织 | G195: 鞋服行业 | H195: 102.71 | I195: 1.8700000000000001e-002 | J195: -1.5700000000000002e-002 | K195: 6.13 | L195: 6.6100000000000006e-002 | M195: 114.9 | N195: 12.29 | O195: 1.0600000000000001 | P195: 49.88 | Q195: 已到 | R195: 4.53年 | S195: 2.53年 | T195: 6 | U195: 80 | V195: 0.13 | W195: 0.22800000000000001 | X195: 0.114 | Y195: 26 | Z195: 1.67 | AA195: 2.5600000000000001e-002 | AB195: 1.9400000000000001e-002 | AC195: 2.5000000000000001e-003 | AD195: 1.e-004 | AE195: 93.03 | AF195: 96.41 | AG195: 0.05 | AH195: AA | AI195: 4.0300000000000002e-002 | AJ195: =H195+100*O195 -> 208.70999999999998 | AK195: 155.5 | AL195: 171 | AM195: 59.1 | AN195: 150 | AO195: 0.10000000000000001 | AP195: 40 | AQ195: 天创转债!
A196: 195 | B196: 123056 | C196: 雪榕转债! | D196: 300511 | E196: 雪榕生物 | F196: 农业 | G196: 种植业 | H196: 108.7 | I196: 6.5000000000000006e-003 | J196: -3.4999999999999996e-003 | K196: 7.43 | L196: 1.4999999999999999e-002 | M196: 120.7 | N196: 11.77 | O196: 0.72199999999999998 | P196: 63.13 | Q196: 已到 | R196: 4.53年 | S196: 2.53年 | T196: 5.84 | U196: 5.7 | V196: 9.0000000000000011e-003 | W196: 0.17800000000000002 | X196: 0.11199999999999999 | Y196: 33 | Z196: 1.84 | AA196: 2.3900000000000001e-002 | AB196: 1.5800000000000002e-002 | AC196: -1.77e-002 | AD196: -2.0199999999999999e-002 | AE196: 88.38 | AF196: 92.71 | AG196: 0.2 | AH196: AA- | AI196: 6.13e-002 | AJ196: =H196+100*O196 -> 180.90000000000001 | AK196: 154.3 | AL196: 163 | AM196: 61.6 | AN196: 165 | AO196: 9.0000000000000011e-003 | AP196: 19 | AQ196: 雪榕转债!
A197: 196 | B197: 113588 | C197: 润达转债! | D197: 603108 | E197: 润达医疗 | F197: 医药 | G197: 医疗器械 | H197: 120.7 | I197: -2.7000000000000001e-003 | J197: -5.0000000000000001e-004 | K197: 12.66 | L197: -6.3e-003 | M197: 113.9 | N197: 13.25 | O197: 0.26300000000000001 | P197: 95.55 | Q197: 已到 | R197: 4.52年 | S197: 2.52年 | T197: 5.5 | U197: 17 | V197: 2.5000000000000001e-002 | W197: 7.4999999999999997e-002 | X197: 7.2000000000000008e-002 | Y197: 73 | Z197: 2.23 | AA197: -1.3000000000000001e-002 | AB197: -1.84e-002 | AC197: -5.6500000000000002e-002 | AD197: -5.8700000000000002e-002 | AE197: 93.1 | AF197: 95.64 | AG197: 0.51 | AH197: AA | AI197: 4.0300000000000002e-002 | AJ197: =H197+100*O197 -> 147. | AK197: 145.9 | AL197: 85 | AM197: 50.2 | AN197: 93 | AO197: 2.2000000000000002e-002 | AP197: 12 | AQ197: 润达转债!
A198: 197 | B198: 128114 | C198: 正邦转债! | D198: 2157 | E198: 正邦科技 | F198: 农业 | G198: 畜牧业 | H198: 106.93 | I198: 1.2999999999999999e-003 | J198: -3.2000000000000002e-003 | K198: 9.68 | L198: -1.1200000000000002e-002 | M198: 114.9 | N198: 14.77 | O198: 0.63200000000000001 | P198: 65.54 | Q198: 已到 | R198: 4.52年 | S198: 2.52年 | T198: 16 | U198: 20 | V198: 1.2e-002 | W198: 5.2000000000000005e-002 | X198: 3.4000000000000002e-002 | Y198: 305 | Z198: 2.35 | AA198: 1.6399999999999998e-002 | AB198: 1.03e-002 | AC198: -1.2500000000000001e-002 | AD198: -1.4999999999999999e-002 | AE198: 93.1 | AF198: 96.48 | AG198: 0.17 | AH198: AA | AI198: 4.0300000000000002e-002 | AJ198: =H198+100*O198 -> 170.13 | AK198: 148.3 | AL198: 106 | AM198: 51.8 | AN198: 103 | AO198: -4.4999999999999998e-002 | AP198: 24 | AQ198: 正邦转债!
A199: 198 | B199: 128113 | C199: 比音转债! | D199: 2832 | E199: 比音勒芬 | F199: 服装纺织 | G199: 服装行业 | H199: 184 | I199: 4.99e-002 | J199: -6.5000000000000006e-003 | K199: 24.82 | L199: 4.6799999999999994e-002 | M199: 116.9 | N199: 14.6 | O199: 8.199999999999999e-002 | P199: 170 | Q199: 已到 | R199: 4.51年 | S199: 2.51年 | T199: 2.98 | U199: 196 | V199: 0.36399999999999999 | W199: 2.2000000000000002e-002 | X199: 3.7000000000000005e-002 | Y199: 137 | Z199: 4.61 | AA199: -9.7299999999999998e-002 | AB199: -0.10300000000000001 | AC199: -0.13200000000000001 | AD199: -0.13400000000000001 | AE199: 93.12 | AF199: 98.18 | AG199: 0.93 | AH199: AA | AI199: 4.0300000000000002e-002 | AJ199: =H199+100*O199 -> 192.19999999999999 | AK199: 198 | AL199: 319 | AM199: 99.8 | AN199: 310 | AO199: 2.1000000000000001e-002 | AP199: 8 | AQ199: 比音转债!
A200: 199 | B200: 128111 | C200: 中矿转债! | D200: 2738 | E200: 中矿资源 | F200: 有色金属 | G200: 有色行业 | H200: 499.402 | I200: 5.8299999999999998e-002 | J200: -3.0000000000000001e-003 | K200: 75.77 | L200: 5.5999999999999994e-002 | M200: 124.2 | N200: 15.42 | O200: 1.6e-002 | P200: 491.37 | Q200: 已到 | R200: 4.50年 | S200: 2.50年 | T200: 1.46 | U200: 1411. | V200: 1.99 | W200: 6.0000000000000001e-003 | X200: 2.8999999999999998e-002 | Y200: 245 | Z200: 6.59 | AA200: -0.27000000000000002 | AB200: -0.27600000000000002 | AC200: -0.24600000000000002 | AD200: -0.247 | AE200: 89.01 | AF200: 95.65 | AG200: 0.99 | AH200: AA- | AI200: 6.13e-002 | AJ200: =H200+100*O200 -> 501.00200000000001 | AK200: 507.4 | AL200: 375 | AM200: 411.8 | AN200: 375 | AO200: 0.187 | AP200: 10 | AQ200: 中矿转债!
A201: 200 | B201: 123054 | C201: 思特转债!! | D201: 300608 | E201: 思特奇 | F201: 通信互联 | G201: 通信设备 | H201: 146.56 | I201: -1.7000000000000001e-003 | J201: 1.2800000000000001e-002 | K201: 13.91 | L201: 1.6799999999999999e-002 | M201: 121.2 | N201: 12.63 | O201: 0.33100000000000002 | P201: 110.13 | Q201: 已到 | R201: 4.50年 | S201: 2.50年 | T201: 2.07 | U201: 318 | V201: 1.04 | W201: 7.0999999999999994e-002 | X201: 7.8e-002 | Y201: 29 | Z201: 3.51 | AA201: -4.2300000000000004e-002 | AB201: -4.9800000000000004e-002 | AC201: -0.12 | AD201: -0.12300000000000001 | AE201: 89.02 | AF201: 93.37 | AG201: 0.66 | AH201: AA- | AI201: 6.13e-002 | AJ201: =H201+100*O201 -> 179.66 | AK201: 183 | AL201: 293 | AM201: 89.6 | AN201: 286 | AO201: -1.6e-002 | AP201: 18 | AQ201: 思特转债!!
A202: 201 | B202: 113585 | C202: 寿仙转债! | D202: 603896 | E202: 寿仙谷 | F202: 医药 | G202: 中药 | H202: 194.24 | I202: 3.5000000000000003e-002 | J202: -1.83e-002 | K202: 50.36 | L202: 1.78e-002 | M202: 117.3 | N202: 28.38 | O202: 9.5000000000000001e-002 | P202: 177.45 | Q202: 已到 | R202: 4.49年 | S202: 2.49年 | T202: 1.01 | U202: 826 | V202: 4.2800000000000002 | W202: 1.3000000000000001e-002 | X202: 2.3e-002 | Y202: 77 | Z202: 5.17 | AA202: -0.10800000000000001 | AB202: -0.114 | AC202: -0.14300000000000002 | AD202: -0.14400000000000002 | AE202: 88.62 | AF202: 90.34 | AG202: 0.94 | AH202: AA- | AI202: 6.13e-002 | AJ202: =H202+100*O202 -> 203.74000000000001 | AK202: 211 | AL202: 328 | AM202: 120.7 | AN202: 330 | AO202: 0.14199999999999999 | AP202: 18 | AQ202: 寿仙转债!
A203: 202 | B203: 123053 | C203: 宝通转债!! | D203: 300031 | E203: 宝通科技 | F203: 通信互联 | G203: 互联网 | H203: 150.049 | I203: 2.52e-002 | J203: 2.2599999999999999e-002 | K203: 27.64 | L203: 6.0199999999999997e-002 | M203: 120.8 | N203: 20.73 | O203: 0.125 | P203: 133.33 | Q203: 已到 | R203: 4.48年 | S203: 2.48年 | T203: 4.99 | U203: 3131. | V203: 4.1699999999999999 | W203: 4.7e-002 | X203: 6.2e-002 | Y203: 107 | Z203: 3.47 | AA203: -4.82e-002 | AB203: -5.5500000000000001e-002 | AC203: -0.13 | AD203: -0.13200000000000001 | AE203: 88.75 | AF203: 93.1 | AG203: 0.79 | AH203: AA- | AI203: 6.13e-002 | AJ203: =H203+100*O203 -> 162.54900000000001 | AK203: 166.8 | AL203: 241 | AM203: 73.7 | AN203: 236 | AO203: 1.2e-002 | AP203: 13 | AQ203: 宝通转债!!
A204: 203 | B204: 123052 | C204: 飞鹿转债! | D204: 300665 | E204: 飞鹿股份 | F204: 化工 | G204: 化工 | H204: 151 | I204: 3.1099999999999999e-002 | J204: -4.6999999999999993e-003 | K204: 9.85 | L204: 3.3599999999999998e-002 | M204: 126.8 | N204: 7.05 | O204: 8.1000000000000003e-002 | P204: 139.72 | Q204: 已到 | R204: 4.48年 | S204: 2.48年 | T204: 1.5 | U204: 101 | V204: 0.45100000000000001 | W204: 8.8000000000000009e-002 | X204: 0.12300000000000001 | Y204: 17 | Z204: 3.34 | AA204: -3.9100000000000003e-002 | AB204: -4.8399999999999999e-002 | AC204: -0.129 | AD204: -0.13200000000000001 | AE204: 87.26 | AF204: 93.53 | AG204: 0.79 | AH204: A+ | AI204: 7.2300000000000003e-002 | AJ204: =H204+100*O204 -> 159.09999999999999 | AK204: 162.3 | AL204: 213 | AM204: 68.8 | AN204: 213 | AO204: 1.9e-002 | AP204: 23 | AQ204: 飞鹿转债!
A205: 204 | B205: 113584 | C205: 家悦转债! | D205: 603708 | E205: 家家悦 | F205: 商业零售 | G205: 超市 | H205: 103.84 | I205: 4.6999999999999993e-003 | J205: -4.6999999999999993e-003 | K205: 14.85 | L205: 1.2999999999999999e-003 | M205: 114.9 | N205: 37.53 | O205: 1.6200000000000001 | P205: 39.57 | Q205: 已到 | R205: 4.48年 | S205: 2.48年 | T205: 6.45 | U205: 3.8 | V205: 6.0000000000000001e-003 | W205: 7.0999999999999994e-002 | X205: 2.7999999999999997e-002 | Y205: 90 | Z205: 3.52 | AA205: 2.3300000000000001e-002 | AB205: 1.7100000000000001e-002 | AC205: -1.6000000000000001e-003 | AD205: -4.0999999999999995e-003 | AE205: 93.22 | AF205: 96.61 | AG205: 0.01 | AH205: AA | AI205: 4.0300000000000002e-002 | AJ205: =H205+100*O205 -> 265.84000000000003 | AK205: 168.1 | AL205: 246 | AM205: 71.5 | AN205: 229 | AO205: 2.e-003 | AP205: 18 | AQ205: 家悦转债!
A206: 205 | B206: 128109 | C206: 楚江转债! | D206: 2171 | E206: 楚江新材 | F206: 有色金属 | G206: 铜金属 | H206: 158.8 | I206: 1.7899999999999999e-002 | J206: 1.2199999999999999e-002 | K206: 12.1 | L206: 3.6000000000000004e-002 | M206: 114.9 | N206: 8.63 | O206: 0.13300000000000001 | P206: 140.21 | Q206: 已到 | R206: 4.48年 | S206: 2.48年 | T206: 18.2 | U206: 55 | V206: 1.9e-002 | W206: 0.113 | X206: 0.158 | Y206: 161 | Z206: 2.76 | AA206: -7.0900000000000005e-002 | AB206: -7.6200000000000004e-002 | AC206: -0.106 | AD206: -0.107 | AE206: 93.23 | AF206: 96.62 | AG206: 0.84 | AH206: AA | AI206: 4.0300000000000002e-002 | AJ206: =H206+100*O206 -> 172.10000000000002 | AK206: 177.4 | AL206: 283 | AM206: 80.8 | AN206: 266 | AO206: 1.4999999999999999e-002 | AP206: 6 | AQ206: 楚江转债!
A207: 206 | B207: 127017 | C207: 万青转债 | D207: 789 | E207: 万年青 | F207: 建筑 | G207: 水泥 | H207: 124.555 | I207: -3.5999999999999999e-003 | J207: -1.4000000000000002e-003 | K207: 12.03 | L207: -1.3100000000000001e-002 | M207: 118 | N207: 13.46 | O207: 0.39399999999999996 | P207: 89.38 | Q207: 已到 | R207: 4.48年 | S207: 2.48年 | T207: 10 | U207: 13 | V207: 1.e-002 | W207: 0.10400000000000001 | X207: 9.3000000000000013e-002 | Y207: 96 | Z207: 1.4 | AA207: -1.2199999999999999e-002 | AB207: -1.9099999999999999e-002 | AC207: -6.8699999999999997e-002 | AD207: -7.0900000000000005e-002 | AE207: 94.36 | AF207: 101.34 | AG207: 0.38 | AH207: AA+ | AI207: 3.5299999999999998e-002 | AJ207: =H207+100*O207 -> 163.95500000000001 | AK207: 159.7 | AL207: 195 | AM207: 58.4 | AN207: 142 | AO207: 3.2000000000000001e-002 | AP207: 7 | AQ207: 万青转债
A208: 207 | B208: 128108 | C208: 蓝帆转债!! | D208: 2382 | E208: 蓝帆医疗 | F208: 医药 | G208: 医疗器械 | H208: 114.899 | I208: 3.2000000000000002e-003 | J208: -6.4000000000000003e-003 | K208: 15.83 | L208: -7.4999999999999997e-003 | M208: 112.9 | N208: 18.24 | O208: 0.32400000000000001 | P208: 86.79 | Q208: 已到 | R208: 4.46年 | S208: 3.46年 | T208: 15.2 | U208: 18 | V208: 1.e-002 | W208: 9.5000000000000001e-002 | X208: 8.3000000000000004e-002 | Y208: 159 | Z208: 1.25 | AA208: -4.0000000000000001e-003 | AB208: -9.1999999999999998e-003 | AC208: -2.4300000000000002e-002 | AD208: -2.69e-002 | AE208: 91.4 | AF208: 95.01 | AG208: 0.42 | AH208: AA | AI208: 4.0300000000000002e-002 | AJ208: =H208+100*O208 -> 147.29900000000001 | AK208: 143 | AL208: 57 | AM208: 48 | AN208: 77 | AO208: 1.3999999999999999e-002 | AP208: 29 | AQ208: 蓝帆转债!!
A209: 208 | B209: 113582 | C209: 火炬转债! | D209: 603678 | E209: 火炬电子 | F209: 电子 | G209: 元器件制 | H209: 378.12 | I209: 1.1299999999999999e-002 | J209: -2.2599999999999999e-002 | K209: 77.6 | L209: -1.15e-002 | M209: 114.9 | N209: 24.99 | O209: 0.218 | P209: 310.52 | Q209: 已到 | R209: 4.46年 | S209: 2.46年 | T209: 4.18 | U209: 106 | V209: 6.7000000000000004e-002 | W209: 1.2e-002 | X209: 3.6000000000000004e-002 | Y209: 357 | Z209: 8.04 | AA209: -0.23800000000000002 | AB209: -0.24100000000000002 | AC209: -0.23000000000000001 | AD209: -0.23100000000000001 | AE209: 93.31 | AF209: 96.7 | AG209: 0.98 | AH209: AA | AI209: 4.0300000000000002e-002 | AJ209: =H209+100*O209 -> 399.92000000000002 | AK209: 445.7 | AL209: 372 | AM209: 349 | AN209: 372 | AO209: -1.3000000000000001e-002 | AP209: 5 | AQ209: 火炬转债!
A210: 209 | B210: 113579 | C210: 健友转债! | D210: 603707 | E210: 健友股份 | F210: 医药 | G210: 原料药 | H210: 139.51 | I210: -1.3899999999999999e-002 | J210: -1.1399999999999999e-002 | K210: 41.17 | L210: -3.1699999999999999e-002 | M210: 113.9 | N210: 32.2 | O210: 9.0999999999999998e-002 | P210: 127.86 | Q210: 已到 | R210: 4.36年 | S210: 2.36年 | T210: 5.03 | U210: 44 | V210: 6.2e-002 | W210: 1.e-002 | X210: 1.3000000000000001e-002 | Y210: 501 | Z210: 11.67 | AA210: -4.6300000000000001e-002 | AB210: -5.16e-002 | AC210: -0.11199999999999999 | AD210: -0.114 | AE210: 93.65 | AF210: 96.22 | AG210: 0.79 | AH210: AA | AI210: 4.0300000000000002e-002 | AJ210: =H210+100*O210 -> 148.60999999999999 | AK210: 151.2 | AL210: 136 | AM210: 54.9 | AN210: 125 | AO210: -2.e-002 | AP210: 10 | AQ210: 健友转债!
A211: 210 | B211: 128107 | C211: 交科转债 | D211: 2061 | E211: 浙江交科 | F211: 建筑 | G211: 建筑工程 | H211: 117.94 | I211: -3.7000000000000002e-003 | J211: -1.2999999999999999e-003 | K211: 5.35 | L211: -9.300000000000001e-003 | M211: 114.9 | N211: 5.24 | O211: 0.155 | P211: 102.1 | Q211: 已到 | R211: 4.36年 | S211: 2.36年 | T211: 25 | U211: 14 | V211: 5.0000000000000001e-003 | W211: 0.34000000000000002 | X211: 0.34700000000000003 | Y211: 74 | Z211: 0.82 | AA211: -6.0999999999999995e-003 | AB211: -1.21e-002 | AC211: -5.1100000000000007e-002 | AD211: -5.3499999999999999e-002 | AE211: 94.8 | AF211: 99.08 | AG211: 0.55 | AH211: AA+ | AI211: 3.5299999999999998e-002 | AJ211: =H211+100*O211 -> 133.44 | AK211: 133.8 | AL211: 20 | AM211: 34.7 | AN211: 18 | AO211: 1.1000000000000001e-002 | AP211: 21 | AQ211: 交科转债
A212: 211 | B212: 113578 | C212: 全筑转债! | D212: 603030 | E212: 全筑股份 | F212: 建筑 | G212: 装饰工程 | H212: 104.86 | I212: -8.0000000000000004e-004 | J212: 8.0000000000000004e-004 | K212: 3.49 | L212: 0. | M212: 117.9 | N212: 5.25 | O212: 0.57700000000000007 | P212: 66.48 | Q212: 已到 | R212: 4.36年 | S212: 2.36年 | T212: 3.84 | U212: 4.1 | V212: 1.e-002 | W212: 0.19 | X212: 0.126 | Y212: 20 | Z212: 0.92 | AA212: 2.7900000000000001e-002 | AB212: 2.0400000000000001e-002 | AC212: -5.6000000000000008e-003 | AD212: -8.199999999999999e-003 | AE212: 93.68 | AF212: 99.61 | AG212: 0.15 | AH212: AA | AI212: 4.0300000000000002e-002 | AJ212: =H212+100*O212 -> 162.56 | AK212: 143.2 | AL212: 59 | AM212: 43.6 | AN212: 51 | AO212: 1.2e-002 | AP212: 31 | AQ212: 全筑转债!
A213: 212 | B213: 113573 | C213: 纵横转债! | D213: 603602 | E213: 纵横通信 | F213: 通信互联 | G213: 通信设备 | H213: 111.79 | I213: 3.0999999999999999e-003 | J213: -3.7000000000000002e-003 | K213: 10.2 | L213: -4.8999999999999998e-003 | M213: 124.2 | N213: 18.78 | O213: 1.0600000000000001 | P213: 54.31 | Q213: 已到 | R213: 4.35年 | S213: 2.35年 | T213: 2.7 | U213: 3 | V213: 1.e-002 | W213: 0.13 | X213: 7.0000000000000007e-002 | Y213: 21 | Z213: 2.92 | AA213: 2.5099999999999997e-002 | AB213: 1.55e-002 | AC213: -2.8199999999999999e-002 | AD213: -3.1200000000000002e-002 | AE213: 87.54 | AF213: 92.39 | AG213: 0.12 | AH213: A+ | AI213: 7.2300000000000003e-002 | AJ213: =H213+100*O213 -> 217.79000000000002 | AK213: 169.3 | AL213: 251 | AM213: 76.9 | AN213: 253 | AO213: 5.0000000000000001e-003 | AP213: 28 | AQ213: 纵横转债!
A214: 213 | B214: 113577 | C214: 春秋转债! | D214: 603890 | E214: 春秋电子 | F214: 电子 | G214: 电子产品 | H214: 145 | I214: 2.9999999999999999e-002 | J214: -2.5499999999999998e-002 | K214: 13.18 | L214: 6.0999999999999995e-003 | M214: 117.7 | N214: 10.85 | O214: 0.19399999999999998 | P214: 121.47 | Q214: 已到 | R214: 4.34年 | S214: 2.34年 | T214: 1.78 | U214: 118 | V214: 0.46500000000000002 | W214: 3.1e-002 | X214: 3.7000000000000005e-002 | Y214: 58 | Z214: 2.33 | AA214: -4.7899999999999998e-002 | AB214: -5.45e-002 | AC214: -0.126 | AD214: -0.128 | AE214: 89.41 | AF214: 91.48 | AG214: 0.74 | AH214: AA- | AI214: 6.13e-002 | AJ214: =H214+100*O214 -> 164.40000000000001 | AK214: 168.5 | AL214: 247 | AM214: 77 | AN214: 254 | AO214: -8.0000000000000002e-003 | AP214: 15 | AQ214: 春秋转债!
A215: 214 | B215: 123050 | C215: 聚飞转债! | D215: 300303 | E215: 聚飞光电 | F215: 电子 | G215: LED制 | H215: 142.731 | I215: -4.5999999999999999e-003 | J215: -6.6e-003 | K215: 6.19 | L215: -1.5900000000000001e-002 | M215: 123.8 | N215: 5.08 | O215: 0.17100000000000001 | P215: 121.85 | Q215: 已到 | R215: 4.34年 | S215: 2.34年 | T215: 3.75 | U215: 110 | V215: 0.20800000000000002 | W215: 4.4999999999999998e-002 | X215: 5.5e-002 | Y215: 83 | Z215: 2.99 | AA215: -3.2899999999999999e-002 | AB215: -4.1700000000000001e-002 | AC215: -0.12 | AD215: -0.122 | AE215: 89.51 | AF215: 96.21 | AG215: 0.71 | AH215: AA- | AI215: 6.13e-002 | AJ215: =H215+100*O215 -> 159.83099999999999 | AK215: 163.6 | AL215: 225 | AM215: 67.4 | AN215: 199 | AO215: -2.5000000000000001e-002 | AP215: 12 | AQ215: 聚飞转债!
A216: 215 | B216: 123049 | C216: 维尔转债! | D216: 300190 | E216: 维尔利 | F216: 城市公用 | G216: 三废处理 | H216: 113.745 | I216: 0. | J216: -5.9999999999999995e-004 | K216: 5.82 | L216: -1.7000000000000001e-003 | M216: 124.3 | N216: 7.38 | O216: 0.442 | P216: 78.86 | Q216: 已到 | R216: 4.34年 | S216: 2.34年 | T216: 9.17 | U216: 2.4 | V216: 2.e-003 | W216: 0.20199999999999999 | X216: 0.159 | Y216: 45 | Z216: 1.04 | AA216: 2.12e-002 | AB216: 1.1599999999999999e-002 | AC216: -3.4700000000000002e-002 | AD216: -3.78e-002 | AE216: 89.97 | AF216: 96.67 | AG216: 0.35 | AH216: AA- | AI216: 6.13e-002 | AJ216: =H216+100*O216 -> 157.94499999999999 | AK216: 148.6 | AL216: 110 | AM216: 52 | AN216: 105 | AO216: -1.4999999999999999e-002 | AP216: 19 | AQ216: 维尔转债!
A217: 216 | B217: 110070 | C217: 凌钢转债! | D217: 600231 | E217: 凌钢股份 | F217: 钢铁 | G217: 炼钢 | H217: 121.74 | I217: -1.4000000000000002e-003 | J217: -2.3999999999999998e-003 | K217: 2.63 | L217: -7.4999999999999997e-003 | M217: 117.4 | N217: 2.69 | O217: 0.245 | P217: 97.77 | Q217: 已到 | R217: 4.34年 | S217: 2.34年 | T217: 2.17 | U217: 14 | V217: 5.4000000000000006e-002 | W217: 2.8999999999999998e-002 | X217: 2.7999999999999997e-002 | Y217: 75 | Z217: 0.8 | AA217: -8.5000000000000006e-003 | AB217: -1.55e-002 | AC217: -6.25e-002 | AD217: -6.5099999999999991e-002 | AE217: 94.07 | AF217: 99.31 | AG217: 0.5 | AH217: AA | AI217: 4.0300000000000002e-002 | AJ217: =H217+100*O217 -> 146.24000000000001 | AK217: 145.7 | AL217: 84 | AM217: 46.4 | AN217: 67 | AO217: 2.7000000000000003e-002 | AP217: 23 | AQ217: 凌钢转债!
A218: 217 | B218: 128106 | C218: 华统转债 | D218: 2840 | E218: 华统股份 | F218: 农业 | G218: 农产品加 | H218: 145 | I218: 1.7500000000000002e-002 | J218: 1.26e-002 | K218: 13.54 | L218: 3.44e-002 | M218: 112.9 | N218: 9.37 | O218: 3.0000000000000001e-003 | P218: 144.5 | Q218: 已到 | R218: 4.33年 | S218: 2.33年 | T218: 5.35 | U218: 378 | V218: 0.48499999999999999 | W218: 8.8000000000000009e-002 | X218: 0.128 | Y218: 61 | Z218: 3.59 | AA218: -5.7200000000000001e-002 | AB218: -6.2100000000000002e-002 | AC218: -0.127 | AD218: -0.129 | AE218: 93.79 | AF218: 95.51 | AG218: 0.88 | AH218: AA | AI218: 4.0300000000000002e-002 | AJ218: =H218+100*O218 -> 145.30000000000001 | AK218: 145.5 | AL218: 80 | AM218: 50 | AN218: 92 | AO218: 0.187 | AP218: 12 | AQ218: 华统转债
A219: 218 | B219: 123048 | C219: 应急转债! | D219: 300527 | E219: 中船应急 | F219: 机械装备 | G219: 专用设备 | H219: 142.72 | I219: -7.0999999999999995e-003 | J219: -7.4000000000000003e-003 | K219: 10.19 | L219: -2.1099999999999997e-002 | M219: 112.8 | N219: 8.88 | O219: 0.24399999999999999 | P219: 114.75 | Q219: 已到 | R219: 4.33年 | S219: 2.33年 | T219: 3.79 | U219: 155 | V219: 0.28600000000000003 | W219: 3.9e-002 | X219: 4.4000000000000004e-002 | Y219: 98 | Z219: 3.73 | AA219: -5.3899999999999997e-002 | AB219: -5.8799999999999998e-002 | AC219: -0.121 | AD219: -0.124 | AE219: 94.81 | AF219: 97.38 | AG219: 0.69 | AH219: AA+ | AI219: 3.5299999999999998e-002 | AJ219: =H219+100*O219 -> 167.12 | AK219: 170.7 | AL219: 263 | AM219: 73.3 | AN219: 235 | AO219: 2.7000000000000003e-002 | AP219: 16 | AQ219: 应急转债!
A220: 219 | B220: 113576 | C220: 起步转债!! | D220: 603557 | E220: ST起步 | F220: 服装纺织 | G220: 鞋服行业 | H220: 146.01 | I220: 7.4999999999999997e-003 | J220: 2.0999999999999999e-003 | K220: 6.2 | L220: 4.0300000000000002e-002 | M220: 121.3 | N220: 10.55 | O220: 1.48 | P220: 58.77 | Q220: 已到 | R220: 4.33年 | S220: 2.33年 | T220: 2.66 | U220: 443 | V220: 1.1399999999999999 | W220: 8.6999999999999994e-002 | X220: 5.0999999999999997e-002 | Y220: 31 | Z220: 2.04 | AA220: -4.2900000000000001e-002 | AB220: -5.0700000000000002e-002 | AC220: -0.127 | AD220: -0.129 | AE220: 82 | AF220: 80.51 | AG220: 0.24 | AH220: BBB+ | AI220: 0.1023 | AJ220: =H220+100*O220 -> 294.00999999999999 | AK220: 233.3 | AL220: 341 | AM220: 151.3 | AN220: 344 | AO220: 6.7000000000000004e-002 | AP220: 35 | AQ220: 起步转债!!
A221: 220 | B221: 113034 | C221: 滨化转债! | D221: 601678 | E221: 滨化股份 | F221: 化工 | G221: 化工 | H221: 202.36 | I221: 6.7000000000000002e-003 | J221: 3.4000000000000002e-003 | K221: 8.55 | L221: 1.06e-002 | M221: 114.8 | N221: 4.58 | O221: 8.4000000000000005e-002 | P221: 186.68 | Q221: 已到 | R221: 4.33年 | S221: 2.33年 | T221: 4.68 | U221: 189 | V221: 0.19899999999999998 | W221: 2.7999999999999997e-002 | X221: 5.2000000000000005e-002 | Y221: 167 | Z221: 1.72 | AA221: -0.125 | AB221: -0.13 | AC221: -0.16399999999999998 | AD221: -0.16500000000000001 | AE221: 93.69 | AF221: 97.1 | AG221: 0.95 | AH221: AA | AI221: 4.0300000000000002e-002 | AJ221: =H221+100*O221 -> 210.76000000000002 | AK221: 218 | AL221: 330 | AM221: 120.9 | AN221: 331 | AO221: 2.7000000000000003e-002 | AP221: 20 | AQ221: 滨化转债!
A222: 221 | B222: 128105 | C222: 长集转债! | D222: 2616 | E222: 长青集团 | F222: 城市公用 | G222: 三废处理 | H222: 107.489 | I222: 8.3000000000000001e-003 | J222: -4.8999999999999998e-003 | K222: 5.88 | L222: 1.38e-002 | M222: 114.9 | N222: 7.91 | O222: 0.44600000000000001 | P222: 74.34 | Q222: 已到 | R222: 4.33年 | S222: 2.33年 | T222: 8 | U222: 10 | V222: 1.2e-002 | W222: 0.183 | X222: 0.13600000000000001 | Y222: 44 | Z222: 1.74 | AA222: 1.5900000000000001e-002 | AB222: 9.4999999999999998e-003 | AC222: -1.5600000000000001e-002 | AD222: -1.8200000000000001e-002 | AE222: 93.8 | AF222: 97.2 | AG222: 0.25 | AH222: AA | AI222: 4.0300000000000002e-002 | AJ222: =H222+100*O222 -> 152.089 | AK222: 140.6 | AL222: 38 | AM222: 43.4 | AN222: 47 | AO222: 2.3e-002 | AP222: 19 | AQ222: 长集转债!
A223: 222 | B223: 113575 | C223: 东时转债!! | D223: 603377 | E223: 东方时尚 | F223: 其他 | G223: 其他 | H223: 128.23 | I223: 6.3e-003 | J223: -8.0000000000000002e-003 | K223: 8.27 | L223: -9.5999999999999992e-003 | M223: 113.1 | N223: 12.15 | O223: 0.88400000000000001 | P223: 68.07 | Q223: 已到 | R223: 4.33年 | S223: 2.33年 | T223: 0.98 | U223: 24 | V223: 0.19399999999999998 | W223: 1.6e-002 | X223: 1.1000000000000001e-002 | Y223: 60 | Z223: 2.78 | AA223: -2.92e-002 | AB223: -3.44e-002 | AC223: -8.3299999999999999e-002 | AD223: -8.5600000000000009e-002 | AE223: 93.83 | AF223: 95.69 | AG223: 0.18 | AH223: AA | AI223: 4.0300000000000002e-002 | AJ223: =H223+100*O223 -> 216.63 | AK223: 188.4 | AL223: 304 | AM223: 92.7 | AN223: 297 | AO223: -3.1e-002 | AP223: 14 | AQ223: 东时转债!!
A224: 223 | B224: 127016 | C224: 鲁泰转债! | D224: 726 | E224: 鲁 泰Ａ | F224: 服装纺织 | G224: 纺织行业 | H224: 107.215 | I224: 6.0999999999999995e-003 | J224: -5.8999999999999999e-003 | K224: 6.03 | L224: 1.7000000000000001e-003 | M224: 115.9 | N224: 8.71 | O224: 0.54899999999999993 | P224: 69.23 | Q224: 已到 | R224: 4.33年 | S224: 2.33年 | T224: 14 | U224: 8.2 | V224: 5.0000000000000001e-003 | W224: 0.26300000000000001 | X224: 0.182 | Y224: 53 | Z224: 0.67 | AA224: 1.8600000000000002e-002 | AB224: 1.18e-002 | AC224: -1.4499999999999999e-002 | AD224: -1.7100000000000001e-002 | AE224: 94.92 | AF224: 100.07 | AG224: 0.15 | AH224: AA+ | AI224: 3.5299999999999998e-002 | AJ224: =H224+100*O224 -> 162.11500000000001 | AK224: 145.2 | AL224: 77 | AM224: 45.1 | AN224: 60 | AO224: -2.1000000000000001e-002 | AP224: 22 | AQ224: 鲁泰转债!
A225: 224 | B225: 113033 | C225: 利群转债! | D225: 601366 | E225: 利群股份 | F225: 商业零售 | G225: 商场 | H225: 107.7 | I225: -2.0000000000000001e-004 | J225: 8.0000000000000004e-004 | K225: 6.02 | L225: 1.7000000000000001e-003 | M225: 114.9 | N225: 7.01 | O225: 0.254 | P225: 85.88 | Q225: 已到 | R225: 4.30年 | S225: 2.30年 | T225: 18 | U225: 18 | V225: 9.0000000000000011e-003 | W225: 0.34700000000000003 | X225: 0.29799999999999999 | Y225: 52 | Z225: 1.18 | AA225: 1.55e-002 | AB225: 9.1000000000000004e-003 | AC225: -1.6500000000000001e-002 | AD225: -1.9099999999999999e-002 | AE225: 93.88 | AF225: 97.29 | AG225: 0.38 | AH225: AA | AI225: 4.0300000000000002e-002 | AJ225: =H225+100*O225 -> 133.09999999999999 | AK225: 129.5 | AL225: 7 | AM225: 32.2 | AN225: 11 | AO225: 6.0000000000000001e-003 | AP225: 71 | AQ225: 利群转债!
A226: 225 | B226: 113574 | C226: 华体转债! | D226: 603679 | E226: 华体科技 | F226: 城市公用 | G226: 城市公用 | H226: 114.37 | I226: 1.8e-003 | J226: -1.8e-003 | K226: 13.74 | L226: -6.5000000000000006e-003 | M226: 115.9 | N226: 33.91 | O226: 1.8200000000000001 | P226: 40.52 | Q226: 已到 | R226: 4.30年 | S226: 2.30年 | T226: 2.09 | U226: 4 | V226: 1.7000000000000001e-002 | W226: 0.107 | X226: 4.2999999999999997e-002 | Y226: 20 | Z226: 2.6 | AA226: 3.2000000000000002e-003 | AB226: -3.4000000000000002e-003 | AC226: -3.7900000000000003e-002 | AD226: -4.0899999999999999e-002 | AE226: 87.78 | AF226: 86.53 | AG226: 0.01 | AH226: A+ | AI226: 7.2300000000000003e-002 | AJ226: =H226+100*O226 -> 296.37 | AK226: 188.2 | AL226: 303 | AM226: 100.4 | AN226: 312 | AO226: -2.2000000000000002e-002 | AP226: 21 | AQ226: 华体转债!
A227: 226 | B227: 128103 | C227: 同德转债! | D227: 2360 | E227: 同德化工 | F227: 化工 | G227: 化工 | H227: 183.98 | I227: 9.8999999999999991e-003 | J227: -5.7999999999999996e-003 | K227: 8.94 | L227: 4.5000000000000005e-003 | M227: 121.3 | N227: 5.08 | O227: 4.4999999999999998e-002 | P227: 175.98 | Q227: 已到 | R227: 4.29年 | S227: 2.29年 | T227: 0.88 | U227: 116 | V227: 0.70999999999999996 | W227: 2.5000000000000001e-002 | X227: 4.4000000000000004e-002 | Y227: 36 | Z227: 2.67 | AA227: -9.4499999999999987e-002 | AB227: -0.10199999999999999 | AC227: -0.14800000000000002 | AD227: -0.14899999999999999 | AE227: 87.98 | AF227: 90.63 | AG227: 0.92 | AH227: A+ | AI227: 7.2300000000000003e-002 | AJ227: =H227+100*O227 -> 188.47999999999999 | AK227: 192 | AL227: 309 | AM227: 101.3 | AN227: 314 | AO227: 1.1000000000000001e-002 | AP227: 17 | AQ227: 同德转债!
A228: 227 | B228: 110068 | C228: 龙净转债! | D228: 600388 | E228: 龙净环保 | F228: 城市公用 | G228: 三废处理 | H228: 107.47 | I228: 1.4000000000000002e-003 | J228: -6.3e-003 | K228: 8.14 | L228: -1.9299999999999998e-002 | M228: 114.8 | N228: 10.55 | O228: 0.39299999999999996 | P228: 77.16 | Q228: 已到 | R228: 4.28年 | S228: 2.28年 | T228: 20 | U228: 11 | V228: 5.0000000000000001e-003 | W228: 0.23000000000000001 | X228: 0.17699999999999999 | Y228: 87 | Z228: 1.35 | AA228: 1.5900000000000001e-002 | AB228: 9.4999999999999998e-003 | AC228: -1.61e-002 | AD228: -1.8700000000000001e-002 | AE228: 94.96 | AF228: 99.26 | AG228: 0.25 | AH228: AA+ | AI228: 3.5299999999999998e-002 | AJ228: =H228+100*O228 -> 146.76999999999998 | AK228: 137.8 | AL228: 29 | AM228: 38.5 | AN228: 24 | AO228: -2.7000000000000003e-002 | AP228: 40 | AQ228: 龙净转债!
A229: 228 | B229: 123046 | C229: 天铁转债! | D229: 300587 | E229: 天铁股份 | F229: 铁路 | G229: 铁路设备 | H229: 338.598 | I229: 1.11e-002 | J229: -1.11e-002 | K229: 20.14 | L229: 0. | M229: 117.7 | N229: 6.73 | O229: 0.13100000000000001 | P229: 299.26 | Q229: 已到 | R229: 4.27年 | S229: 2.27年 | T229: 0.62 | U229: 119 | V229: 0.57399999999999995 | W229: 5.0000000000000001e-003 | X229: 1.4999999999999999e-002 | Y229: 126 | Z229: 6.85 | AA229: -0.223 | AB229: -0.22800000000000001 | AC229: -0.24299999999999999 | AD229: -0.24299999999999999 | AE229: 89.79 | AF229: 91.86 | AG229: 0.98 | AH229: AA- | AI229: 6.13e-002 | AJ229: =H229+100*O229 -> 351.69800000000004 | AK229: 377.9 | AL229: 366 | AM229: 286.1 | AN229: 366 | AO229: -2.8999999999999998e-002 | AP229: 13 | AQ229: 天铁转债!
A230: 229 | B230: 128101 | C230: 联创转债!! | D230: 2036 | E230: 联创电子 | F230: 电子 | G230: 液晶显示 | H230: 180.975 | I230: 8.199999999999999e-003 | J230: -1.7000000000000001e-002 | K230: 21.12 | L230: -9.7999999999999997e-003 | M230: 114.8 | N230: 13.72 | O230: 0.17600000000000002 | P230: 153.94 | Q230: 已到 | R230: 4.26年 | S230: 2.26年 | T230: 3 | U230: 167 | V230: 0.311 | W230: 1.3000000000000001e-002 | X230: 2.1000000000000001e-002 | Y230: 224 | Z230: 5.75 | AA230: -0.10300000000000001 | AB230: -0.10800000000000001 | AC230: -0.14800000000000002 | AD230: -0.14999999999999999 | AE230: 93.94 | AF230: 97.36 | AG230: 0.89 | AH230: AA | AI230: 4.0300000000000002e-002 | AJ230: =H230+100*O230 -> 198.57499999999999 | AK230: 208 | AL230: 327 | AM230: 110.7 | AN230: 323 | AO230: -4.0000000000000001e-002 | AP230: 13 | AQ230: 联创转债!!
A231: 230 | B231: 123045 | C231: 雷迪转债 | D231: 300652 | E231: 雷迪克 | F231: 汽车 | G231: 零部件制 | H231: 140.41 | I231: 1.5300000000000001e-002 | J231: 8.0000000000000002e-003 | K231: 23.8 | L231: 3.1200000000000002e-002 | M231: 118.9 | N231: 19.63 | O231: 0.158 | P231: 121.24 | Q231: 已到 | R231: 4.25年 | S231: 2.25年 | T231: 1.66 | U231: 373 | V231: 1.6100000000000001 | W231: 7.400000000000001e-002 | X231: 8.9999999999999997e-002 | Y231: 22 | Z231: 2.35 | AA231: -3.9300000000000002e-002 | AB231: -4.6500000000000007e-002 | AC231: -0.11699999999999999 | AD231: -0.12 | AE231: 88.1 | AF231: 89.07 | AG231: 0.75 | AH231: A+ | AI231: 7.2300000000000003e-002 | AJ231: =H231+100*O231 -> 156.21000000000001 | AK231: 159.6 | AL231: 193 | AM231: 70.5 | AN231: 222 | AO231: 1.8000000000000002e-002 | AP231: 34 | AQ231: 雷迪转债
A232: 231 | B232: 128100 | C232: 搜特转债! | D232: 2503 | E232: 搜于特 | F232: 服装纺织 | G232: 服装行业 | H232: 107.56 | I232: 1.09e-002 | J232: -1.4999999999999999e-002 | K232: 1.56 | L232: -6.4000000000000003e-003 | M232: 116.9 | N232: 1.62 | O232: 0.11699999999999999 | P232: 96.3 | Q232: 已到 | R232: 4.25年 | S232: 2.25年 | T232: 7.99 | U232: 68 | V232: 8.0000000000000002e-002 | W232: 0.16600000000000001 | X232: 0.16 | Y232: 48 | Z232: 3.2 | AA232: 2.0199999999999999e-002 | AB232: 1.3000000000000001e-002 | AC232: -1.6299999999999999e-002 | AD232: -1.9e-002 | AE232: 85.59 | AF232: 84.17 | AG232: 0.64 | AH232: A | AI232: 8.2299999999999998e-002 | AJ232: =H232+100*O232 -> 119.26000000000001 | AK232: 118.8 | AL232: 1 | AM232: 33.2 | AN232: 13 | AO232: 9.0000000000000011e-003 | AP232: 87 | AQ232: 搜特转债!
A233: 232 | B233: 123044 | C233: 红相转债!! | D233: 300427 | E233: 红相股份 | F233: 能源电力 | G233: 电力设备 | H233: 116.51 | I233: 4.4000000000000003e-003 | J233: -5.6000000000000008e-003 | K233: 13.43 | L233: -4.4000000000000003e-003 | M233: 125 | N233: 18.67 | O233: 0.62 | P233: 71.93 | Q233: 已到 | R233: 4.25年 | S233: 2.25年 | T233: 5.5 | U233: 5.5 | V233: 9.0000000000000011e-003 | W233: 0.114 | X233: 8.199999999999999e-002 | Y233: 48 | Z233: 2.05 | AA233: 1.72e-002 | AB233: 7.0999999999999995e-003 | AC233: -4.4600000000000001e-002 | AD233: -4.7899999999999998e-002 | AE233: 90.7 | AF233: 97.77 | AG233: 0.27 | AH233: AA- | AI233: 6.13e-002 | AJ233: =H233+100*O233 -> 178.50999999999999 | AK233: 161.1 | AL233: 205 | AM233: 63.3 | AN233: 179 | AO233: -2.8999999999999998e-002 | AP233: 22 | AQ233: 红相转债!!
A234: 233 | B234: 110067 | C234: 华安转债! | D234: 600909 | E234: 华安证券 | F234: 金融 | G234: 证券行业 | H234: 116.91 | I234: -5.0000000000000001e-004 | J234: -7.0999999999999995e-003 | K234: 5.26 | L234: -2.0499999999999997e-002 | M234: 110.3 | N234: 6.22 | O234: 0.38200000000000001 | P234: 84.57 | Q234: 已到 | R234: 4.25年 | S234: 无权 | T234: 28 | U234: 14 | V234: 4.0000000000000001e-003 | W234: 0.113 | X234: 9.6000000000000002e-002 | Y234: 247 | Z234: 1.33 | AA234: -1.38e-002 | AB234: -1.8200000000000001e-002 | AC234: 无权 | AD234: 无权 | AE234: 无权 | AF234: 96.16 | AG234: 0.37 | AH234: AAA | AI234: 3.3300000000000003e-002 | AJ234: =H234+100*O234 -> 155.11000000000001 | AK234: 149.3 | AL234: 116 | AM234: 53.1 | AN234: 111 | AO234: 1.7000000000000001e-002 | AP234: 26 | AQ234: 华安转债!
A235: 234 | B235: 113570 | C235: 百达转债! | D235: 603331 | E235: 百达精工 | F235: 机械装备 | G235: 机械装备 | H235: 134.95 | I235: 2.98e-002 | J235: 5.4000000000000003e-003 | K235: 13.59 | L235: 4.5400000000000003e-002 | M235: 114.9 | N235: 11.34 | O235: 0.126 | P235: 119.84 | Q235: 已到 | R235: 4.25年 | S235: 2.25年 | T235: 2.8 | U235: 123 | V235: 0.32799999999999996 | W235: 0.11599999999999999 | X235: 0.13900000000000001 | Y235: 24 | Z235: 2.98 | AA235: -3.7900000000000003e-002 | AB235: -4.3799999999999999e-002 | AC235: -0.105 | AD235: -0.107 | AE235: 87.52 | AF235: 86 | AG235: 0.78 | AH235: A+ | AI235: 7.2300000000000003e-002 | AJ235: =H235+100*O235 -> 147.54999999999998 | AK235: 150.1 | AL235: 126 | AM235: 62.5 | AN235: 172 | AO235: 3.7000000000000005e-002 | AP235: 31 | AQ235: 百达转债!
A236: 235 | B236: 113569 | C236: 科达转债! | D236: 603660 | E236: 苏州科达 | F236: 通信互联 | G236: 物联网 | H236: 103.12 | I236: 1.e-004 | J236: 2.9999999999999997e-004 | K236: 6.41 | L236: 1.26e-002 | M236: 120.3 | N236: 14.8 | O236: 1.3799999999999999 | P236: 43.31 | Q236: 已到 | R236: 4.24年 | S236: 2.24年 | T236: 5.16 | U236: 6.3 | V236: 1.2e-002 | W236: 0.16300000000000001 | X236: 7.0999999999999994e-002 | Y236: 32 | Z236: 1.87 | AA236: 3.7900000000000003e-002 | AB236: 2.92e-002 | AC236: 2.0999999999999999e-003 | AD236: -8.0000000000000004e-004 | AE236: 89.96 | AF236: 94.03 | AG236: 0.03 | AH236: AA- | AI236: 6.13e-002 | AJ236: =H236+100*O236 -> 241.12 | AK236: 162.9 | AL236: 220 | AM236: 68.9 | AN236: 214 | AO236: 2.2000000000000002e-002 | AP236: 36 | AQ236: 科达转债!
A237: 236 | B237: 113568 | C237: 新春转债!! | D237: 603667 | E237: 五洲新春 | F237: 机械装备 | G237: 通用设备 | H237: 215.43 | I237: 3.6200000000000003e-002 | J237: 2.1400000000000002e-002 | K237: 17.58 | L237: 6.0999999999999999e-002 | M237: 124.3 | N237: 8.75 | O237: 7.2000000000000008e-002 | P237: 200.91 | Q237: 已到 | R237: 4.23年 | S237: 2.23年 | T237: 2.44 | U237: 420 | V237: 0.80000000000000004 | W237: 4.5999999999999999e-002 | X237: 9.1999999999999998e-002 | Y237: 53 | Z237: 2.81 | AA237: -0.124 | AB237: -0.13200000000000001 | AC237: -0.183 | AD237: -0.184 | AE237: 90.53 | AF237: 97.27 | AG237: 0.95 | AH237: AA- | AI237: 6.13e-002 | AJ237: =H237+100*O237 -> 222.63 | AK237: 229.9 | AL237: 338 | AM237: 132.7 | AN237: 337 | AO237: 9.0000000000000011e-003 | AP237: 38 | AQ237: 新春转债!!
A238: 237 | B238: 123043 | C238: 正元转债! | D238: 300645 | E238: 正元智慧 | F238: 计算机及 | G238: 软件开发 | H238: 211.165 | I238: -2.69e-002 | J238: -2.3300000000000001e-002 | K238: 24.27 | L238: -5.67e-002 | M238: 120.9 | N238: 15.38 | O238: 0.33799999999999997 | P238: 157.8 | Q238: 已到 | R238: 4.23年 | S238: 2.23年 | T238: 1.66 | U238: 1685. | V238: 4.71 | W238: 5.2999999999999999e-002 | X238: 8.4000000000000005e-002 | Y238: 31 | Z238: 4.68 | AA238: -0.126 | AB238: -0.13300000000000001 | AC238: -0.17999999999999999 | AD238: -0.18100000000000002 | AE238: 88.22 | AF238: 90.68 | AG238: 0.88 | AH238: A+ | AI238: 7.2300000000000003e-002 | AJ238: =H238+100*O238 -> 244.96499999999997 | AK238: 264.5 | AL238: 349 | AM238: 173.8 | AN238: 352 | AO238: 4.0000000000000001e-002 | AP238: 17 | AQ238: 正元转债!
A239: 238 | B239: 113567 | C239: 君禾转债! | D239: 603617 | E239: 君禾股份 | F239: 机械装备 | G239: 通用设备 | H239: 135.63 | I239: 1.7899999999999999e-002 | J239: 8.199999999999999e-003 | K239: 13.75 | L239: 3.3099999999999997e-002 | M239: 118.8 | N239: 10.58 | O239: 4.4000000000000004e-002 | P239: 129.96 | Q239: 已到 | R239: 4.23年 | S239: 2.23年 | T239: 2.1 | U239: 75 | V239: 0.26300000000000001 | W239: 5.9000000000000004e-002 | X239: 7.6999999999999999e-002 | Y239: 36 | Z239: 3.91 | AA239: -3.1600000000000003e-002 | AB239: -3.8900000000000004e-002 | AC239: -0.106 | AD239: -0.10800000000000001 | AE239: 88.17 | AF239: 89.14 | AG239: 0.79 | AH239: A+ | AI239: 7.2300000000000003e-002 | AJ239: =H239+100*O239 -> 140.03 | AK239: 141.3 | AL239: 44 | AM239: 52.2 | AN239: 109 | AO239: 7.0000000000000007e-002 | AP239: 33 | AQ239: 君禾转债!
A240: 239 | B240: 110066 | C240: 盛屯转债!! | D240: 600711 | E240: 盛屯矿业 | F240: 有色金属 | G240: 有色行业 | H240: 267.53 | I240: 2.2599999999999999e-002 | J240: 1.7899999999999999e-002 | K240: 12.08 | L240: 4.1399999999999999e-002 | M240: 114.9 | N240: 4.87 | O240: 7.9000000000000001e-002 | P240: 248.05 | Q240: 已到 | R240: 4.22年 | S240: 2.22年 | T240: 3.83 | U240: 557 | V240: 0.54600000000000004 | W240: 1.2e-002 | X240: 2.8999999999999998e-002 | Y240: 332 | Z240: 2.68 | AA240: -0.184 | AB240: -0.18899999999999997 | AC240: -0.21899999999999997 | AD240: -0.22 | AE240: 94.18 | AF240: 97.61 | AG240: 0.98 | AH240: AA | AI240: 4.0300000000000002e-002 | AJ240: =H240+100*O240 -> 275.42999999999995 | AK240: 287 | AL240: 359 | AM240: 189.4 | AN240: 359 | AO240: 0.11800000000000001 | AP240: 28 | AQ240: 盛屯转债!!
A241: 240 | B241: 113566 | C241: 翔港转债! | D241: 603499 | E241: 翔港科技 | F241: 造纸包装 | G241: 包装材料 | H241: 117.7 | I241: 3.5999999999999999e-003 | J241: -5.8999999999999999e-003 | K241: 8.54 | L241: -5.7999999999999996e-003 | M241: 124 | N241: 10.77 | O241: 0.48399999999999999 | P241: 79.29 | Q241: 已到 | R241: 4.22年 | S241: 2.22年 | T241: 1.61 | U241: 26 | V241: 0.13500000000000001 | W241: 9.4e-002 | X241: 7.400000000000001e-002 | Y241: 17 | Z241: 3.03 | AA241: 1.2800000000000001e-002 | AB241: 3.0999999999999999e-003 | AC241: -5.0599999999999999e-002 | AD241: -5.3699999999999998e-002 | AE241: 88.42 | AF241: 93.1 | AG241: 0.4 | AH241: A+ | AI241: 7.2300000000000003e-002 | AJ241: =H241+100*O241 -> 166.09999999999999 | AK241: 156.1 | AL241: 179 | AM241: 63 | AN241: 176 | AO241: 4.4999999999999998e-002 | AP241: 27 | AQ241: 翔港转债!
A242: 241 | B242: 113565 | C242: 宏辉转债 | D242: 603336 | E242: 宏辉果蔬 | F242: 农业 | G242: 农产品加 | H242: 124.79 | I242: 2.0099999999999996e-002 | J242: -2.0999999999999999e-003 | K242: 8.06 | L242: 2.81e-002 | M242: 117.8 | N242: 7.64 | O242: 0.183 | P242: 105.5 | Q242: 已到 | R242: 4.21年 | S242: 2.21年 | T242: 2.25 | U242: 72 | V242: 0.25700000000000001 | W242: 6.4000000000000001e-002 | X242: 6.7000000000000004e-002 | Y242: 35 | Z242: 3.4 | AA242: -1.3899999999999999e-002 | AB242: -2.12e-002 | AC242: -7.5700000000000003e-002 | AD242: -7.8399999999999997e-002 | AE242: 90.2 | AF242: 92.28 | AG242: 0.64 | AH242: AA- | AI242: 6.13e-002 | AJ242: =H242+100*O242 -> 143.09 | AK242: 144.1 | AL242: 67 | AM242: 51.8 | AN242: 102 | AO242: 2.3e-002 | AP242: 27 | AQ242: 宏辉转债
A243: 242 | B243: 128097 | C243: 奥佳转债!! | D243: 2614 | E243: 奥佳华 | F243: 机械装备 | G243: 专用设备 | H243: 144.355 | I243: -2.7000000000000001e-003 | J243: 1.e-002 | K243: 12.41 | L243: 9.7999999999999997e-003 | M243: 114.9 | N243: 10.39 | O243: 0.20899999999999999 | P243: 119.44 | Q243: 已到 | R243: 4.21年 | S243: 2.21年 | T243: 4.59 | U243: 20 | V243: 3.1e-002 | W243: 5.9000000000000004e-002 | X243: 7.0000000000000007e-002 | Y243: 78 | Z243: 1.66 | AA243: -5.3800000000000001e-002 | AB243: -5.96e-002 | AC243: -0.13100000000000001 | AD243: -0.10099999999999999 | AE243: 89.92 | AF243: 89.96 | AG243: 0.75 | AH243: AA- | AI243: 6.13e-002 | AJ243: =H243+100*O243 -> 165.255 | AK243: 169.3 | AL243: 252 | AM243: 79.3 | AN243: 262 | AO243: 2.2000000000000002e-002 | AP243: 17 | AQ243: 奥佳转债!!
A244: 243 | B244: 128095 | C244: 恩捷转债!! | D244: 2812 | E244: 恩捷股份 | F244: 电子 | G244: 元器件制 | H244: 474.5 | I244: -8.3999999999999995e-003 | J244: 4.0999999999999995e-003 | K244: 265 | L244: -4.4000000000000003e-003 | M244: 114.9 | N244: 64.92 | O244: 0.16200000000000001 | P244: 408.19 | Q244: 已到 | R244: 4.17年 | S244: 2.17年 | T244: 4.54 | U244: 193 | V244: 8.9999999999999997e-002 | W244: 2.e-003 | X244: 8.0000000000000002e-003 | Y244: 2365. | Z244: 18.45 | AA244: -0.29199999999999998 | AB244: -0.29600000000000004 | AC244: -0.28899999999999998 | AD244: -0.28999999999999998 | AE244: 94.38 | AF244: 97.81 | AG244: 0.99 | AH244: AA | AI244: 4.0300000000000002e-002 | AJ244: =H244+100*O244 -> 490.69999999999999 | AK244: 540.8 | AL244: 378 | AM244: 443 | AN244: 377 | AO244: 2.2000000000000002e-002 | AP244: 13 | AQ244: 恩捷转债!!
A245: 244 | B245: 128096 | C245: 奥瑞转债!! | D245: 2701 | E245: 奥瑞金 | F245: 造纸包装 | G245: 包装材料 | H245: 158.21 | I245: 1.09e-002 | J245: -5.6000000000000008e-003 | K245: 6.61 | L245: 6.0999999999999995e-003 | M245: 115.5 | N245: 4.5 | O245: 7.6999999999999999e-002 | P245: 146.89 | Q245: 已到 | R245: 4.17年 | S245: 2.17年 | T245: 5.66 | U245: 38 | V245: 4.2000000000000003e-002 | W245: 3.5000000000000003e-002 | X245: 5.2000000000000005e-002 | Y245: 161 | Z245: 2.23 | AA245: -7.4200000000000002e-002 | AB245: -8.0100000000000005e-002 | AC245: -0.124 | AD245: -0.126 | AE245: 95.85 | AF245: 100.31 | AG245: 0.87 | AH245: AA+ | AI245: 3.5299999999999998e-002 | AJ245: =H245+100*O245 -> 165.91 | AK245: 169.5 | AL245: 254 | AM245: 69.2 | AN245: 215 | AO245: -7.4999999999999997e-002 | AP245: 17 | AQ245: 奥瑞转债!!
A246: 245 | B246: 113563 | C246: 柳药转债! | D246: 603368 | E246: 柳药股份 | F246: 医药 | G246: 医药商业 | H246: 106.73 | I246: -4.6999999999999993e-003 | J246: 3.0999999999999999e-003 | K246: 15.89 | L246: -1.e-002 | M246: 112.9 | N246: 23.87 | O246: 0.60299999999999998 | P246: 66.57 | Q246: 已到 | R246: 4年36天 | S246: 2年36天 | T246: 8.02 | U246: 9.6 | V246: 1.1000000000000001e-002 | W246: 0.13900000000000001 | X246: 9.3000000000000013e-002 | Y246: 58 | Z246: 1.1 | AA246: 1.41e-002 | AB246: 8.3000000000000001e-003 | AC246: -1.41e-002 | AD246: -1.6899999999999998e-002 | AE246: 94.65 | AF246: 96.38 | AG246: 0.16 | AH246: AA | AI246: 4.0300000000000002e-002 | AJ246: =H246+100*O246 -> 167.03 | AK246: 146.9 | AL246: 90 | AM246: 50.5 | AN246: 96 | AO246: -1.e-003 | AP246: 17 | AQ246: 柳药转债!
A247: 246 | B247: 128094 | C247: 星帅转债! | D247: 2860 | E247: 星帅尔 | F247: 家电 | G247: 零部件制 | H247: 188.51 | I247: 2.4900000000000002e-002 | J247: 2.5000000000000001e-003 | K247: 25.8 | L247: 2.9100000000000001e-002 | M247: 121 | N247: 13.8 | O247: 8.0000000000000002e-003 | P247: 186.96 | Q247: 已到 | R247: 4年36天 | S247: 2年36天 | T247: 2.09 | U247: 291 | V247: 0.747 | W247: 4.0000000000000001e-002 | X247: 7.400000000000001e-002 | Y247: 53 | Z247: 4.57 | AA247: -0.105 | AB247: -0.11199999999999999 | AC247: -0.17100000000000001 | AD247: -0.17199999999999999 | AE247: 89.06 | AF247: 91.6 | AG247: 0.94 | AH247: A+ | AI247: 7.2300000000000003e-002 | AJ247: =H247+100*O247 -> 189.31 | AK247: 190.1 | AL247: 306 | AM247: 98.5 | AN247: 309 | AO247: 2.1000000000000001e-002 | AP247: 29 | AQ247: 星帅转债!
A248: 247 | B248: 123042 | C248: 银河转债!! | D248: 300619 | E248: 金银河 | F248: 机械装备 | G248: 专用设备 | H248: 450.7 | I248: -5.1000000000000004e-003 | J248: -2.35e-002 | K248: 89.33 | L248: -2.8999999999999998e-002 | M248: 115.4 | N248: 23.59 | O248: 0.19 | P248: 378.68 | Q248: 已到 | R248: 4年34天 | S248: 2年34天 | T248: 0.98 | U248: 2067. | V248: 4.6500000000000004 | W248: 1.3000000000000001e-002 | X248: 4.9000000000000002e-002 | Y248: 76 | Z248: 12.58 | AA248: -0.28699999999999998 | AB248: -0.29100000000000004 | AC248: -0.29699999999999999 | AD248: -0.29799999999999999 | AE248: 88.8 | AF248: 87.38 | AG248: 0.99 | AH248: A+ | AI248: 7.2300000000000003e-002 | AJ248: =H248+100*O248 -> 469.69999999999999 | AK248: 522.7 | AL248: 376 | AM248: 433.9 | AN248: 376 | AO248: -7.6999999999999999e-002 | AP248: 21 | AQ248: 银河转债!!
A249: 248 | B249: 127015 | C249: 希望转债!! | D249: 876 | E249: 新 希 望 | F249: 农业 | G249: 畜牧业 | H249: 115.2 | I249: -8.9999999999999998e-004 | J249: 1.e-004 | K249: 14.7 | L249: -3.4000000000000002e-003 | M249: 110 | N249: 19.75 | O249: 0.54799999999999993 | P249: 74.43 | Q249: 已到 | R249: 4年23天 | S249: 2年23天 | T249: 9.5 | U249: 15 | V249: 1.3999999999999999e-002 | W249: 1.3999999999999999e-002 | X249: 1.1000000000000001e-002 | Y249: 662 | Z249: 2.17 | AA249: -1.15e-002 | AB249: -1.6e-002 | AC249: -5.0799999999999998e-002 | AD249: -5.2900000000000003e-002 | AE249: 95.5 | AF249: 96.53 | AG249: 0.22 | AH249: AAA | AI249: 3.3300000000000003e-002 | AJ249: =H249+100*O249 -> 170. | AK249: 156 | AL249: 176 | AM249: 59.4 | AN249: 153 | AO249: -2.e-002 | AP249: 27 | AQ249: 希望转债!!
A250: 249 | B250: 128093 | C250: 百川转债!! | D250: 2455 | E250: 百川股份 | F250: 化工 | G250: 化工 | H250: 290.585 | I250: 3.0999999999999999e-003 | J250: 0. | K250: 15.71 | L250: 3.2000000000000002e-003 | M250: 129.8 | N250: 5.77 | O250: 6.7000000000000004e-002 | P250: 272.27 | Q250: 已到 | R250: 4年23天 | S250: 2年23天 | T250: 1.62 | U250: 126 | V250: 0.26800000000000002 | W250: 1.8000000000000002e-002 | X250: 4.9000000000000002e-002 | Y250: 89 | Z250: 5.02 | AA250: -0.185 | AB250: -0.19399999999999998 | AC250: -0.248 | AD250: -0.25 | AE250: 93.88 | AF250: 102.94 | AG250: 0.96 | AH250: AA- | AI250: 6.13e-002 | AJ250: =H250+100*O250 -> 297.28499999999997 | AK250: 308.9 | AL250: 361 | AM250: 206 | AN250: 361 | AO250: -2.7000000000000003e-002 | AP250: 39 | AQ250: 百川转债!!
A251: 250 | B251: 113561 | C251: 正裕转债! | D251: 603089 | E251: 正裕工业 | F251: 汽车 | G251: 零部件制 | H251: 124.8 | I251: 6.0400000000000002e-002 | J251: -8.9999999999999998e-004 | K251: 9.74 | L251: 0.10099999999999999 | M251: 118 | N251: 10.08 | O251: 0.29199999999999998 | P251: 96.63 | Q251: 已到 | R251: 4年20天 | S251: 2年20天 | T251: 1.5 | U251: 326 | V251: 1.76 | W251: 6.9000000000000006e-002 | X251: 6.7000000000000004e-002 | Y251: 22 | Z251: 2.09 | AA251: -1.41e-002 | AB251: -2.1700000000000001e-002 | AC251: -7.9199999999999993e-002 | AD251: -8.2299999999999998e-002 | AE251: 89.42 | AF251: 89.64 | AG251: 0.59 | AH251: A+ | AI251: 7.2300000000000003e-002 | AJ251: =H251+100*O251 -> 154. | AK251: 153 | AL251: 154 | AM251: 63.3 | AN251: 180 | AO251: 9.6999999999999989e-002 | AP251: 35 | AQ251: 正裕转债!
A252: 251 | B252: 128091 | C252: 新天转债 | D252: 2873 | E252: 新天药业 | F252: 医药 | G252: 中药 | H252: 141.35 | I252: 1.3300000000000001e-002 | J252: -2.3999999999999998e-003 | K252: 14.46 | L252: 1.3999999999999999e-002 | M252: 119.4 | N252: 11.62 | O252: 0.13600000000000001 | P252: 124.44 | Q252: 已到 | R252: 4年19天 | S252: 2年19天 | T252: 1.76 | U252: 184 | V252: 0.74199999999999999 | W252: 7.400000000000001e-002 | X252: 9.1999999999999998e-002 | Y252: 24 | Z252: 1.95 | AA252: -4.1900000000000007e-002 | AB252: -4.9599999999999998e-002 | AC252: -0.10000000000000001 | AD252: -0.10300000000000001 | AE252: 89.72 | AF252: 90.76 | AG252: 0.78 | AH252: A+ | AI252: 7.2300000000000003e-002 | AJ252: =H252+100*O252 -> 154.94999999999999 | AK252: 158.3 | AL252: 186 | AM252: 67.5 | AN252: 201 | AO252: 2.6000000000000002e-002 | AP252: 21 | AQ252: 新天转债
A253: 252 | B253: 128090 | C253: 汽模转2 | D253: 2510 | E253: 天汽模 | F253: 汽车 | G253: 零部件制 | H253: 130.75 | I253: 8.3999999999999995e-003 | J253: -2.5000000000000001e-003 | K253: 4.55 | L253: 8.8999999999999999e-003 | M253: 114.9 | N253: 4.23 | O253: 0.21600000000000003 | P253: 107.57 | Q253: 已到 | R253: 4年16天 | S253: 2年16天 | T253: 3.1 | U253: 59 | V253: 0.14499999999999999 | W253: 7.2000000000000008e-002 | X253: 7.8e-002 | Y253: 43 | Z253: 2.1 | AA253: -3.2099999999999997e-002 | AB253: -3.8399999999999997e-002 | AC253: -0.10099999999999999 | AD253: -0.10400000000000001 | AE253: 90.8 | AF253: 90.84 | AG253: 0.66 | AH253: AA- | AI253: 6.13e-002 | AJ253: =H253+100*O253 -> 152.34999999999999 | AK253: 153.9 | AL253: 159 | AM253: 63.1 | AN253: 177 | AO253: -2.8999999999999998e-002 | AP253: 29 | AQ253: 汽模转2
A254: 253 | B254: 123039 | C254: 开润转债! | D254: 300577 | E254: 开润股份 | F254: 服装纺织 | G254: 纺织行业 | H254: 116.8 | I254: 8.6e-003 | J254: -1.38e-002 | K254: 21.45 | L254: -1.7000000000000001e-002 | M254: 121 | N254: 29.92 | O254: 0.629 | P254: 71.69 | Q254: 已到 | R254: 4年15天 | S254: 2年15天 | T254: 2.22 | U254: 4.5 | V254: 1.7000000000000001e-002 | W254: 4.2999999999999997e-002 | X254: 3.1e-002 | Y254: 51 | Z254: 3.19 | AA254: 9.0000000000000011e-003 | AB254: 0. | AC254: -5.1500000000000004e-002 | AD254: -5.4800000000000001e-002 | AE254: 89.42 | AF254: 91.97 | AG254: 0.31 | AH254: A+ | AI254: 7.2300000000000003e-002 | AJ254: =H254+100*O254 -> 179.69999999999999 | AK254: 161.9 | AL254: 211 | AM254: 69.9 | AN254: 220 | AO254: -5.7999999999999996e-002 | AP254: 22 | AQ254: 开润转债!
A255: 254 | B255: 123038 | C255: 联得转债! | D255: 300545 | E255: 联得装备 | F255: 机械装备 | G255: 专用设备 | H255: 141.708 | I255: -2.07e-002 | J255: 4.5999999999999999e-003 | K255: 25.66 | L255: -2.4300000000000002e-002 | M255: 118.6 | N255: 24.07 | O255: 0.32899999999999996 | P255: 106.61 | Q255: 已到 | R255: 4年14天 | S255: 2年14天 | T255: 1.47 | U255: 308 | V255: 1.47 | W255: 3.2000000000000001e-002 | X255: 3.4000000000000002e-002 | Y255: 46 | Z255: 3.29 | AA255: -4.41e-002 | AB255: -5.16e-002 | AC255: -0.10400000000000001 | AD255: -0.106 | AE255: 89.23 | AF255: 90.13 | AG255: 0.66 | AH255: A+ | AI255: 7.2300000000000003e-002 | AJ255: =H255+100*O255 -> 174.608 | AK255: 176.8 | AL255: 281 | AM255: 86.7 | AN255: 281 | AO255: 4.9000000000000002e-002 | AP255: 19 | AQ255: 联得转债!
A256: 255 | B256: 113030 | C256: 东风转债! | D256: 601515 | E256: 东风股份 | F256: 造纸包装 | G256: 包装材料 | H256: 148.59 | I256: -2.1600000000000001e-002 | J256: -5.1000000000000004e-003 | K256: 7.6 | L256: -3.7999999999999999e-002 | M256: 116.9 | N256: 6.4 | O256: 0.251 | P256: 118.75 | Q256: 已到 | R256: 4年13天 | S256: 2年13天 | T256: 2.95 | U256: 210 | V256: 0.47799999999999998 | W256: 2.5000000000000001e-002 | X256: 2.9999999999999999e-002 | Y256: 117 | Z256: 2.24 | AA256: -5.8799999999999998e-002 | AB256: -6.5599999999999992e-002 | AC256: -0.11900000000000001 | AD256: -0.12 | AE256: 94.88 | AF256: 100.03 | AG256: 0.7 | AH256: AA | AI256: 4.0300000000000002e-002 | AJ256: =H256+100*O256 -> 173.69 | AK256: 178.4 | AL256: 285 | AM256: 78.4 | AN256: 259 | AO256: -3.7000000000000005e-002 | AP256: 18 | AQ256: 东风转债!
A257: 256 | B257: 110064 | C257: 建工转债! | D257: 600939 | E257: 重庆建工 | F257: 建筑 | G257: 建筑工程 | H257: 108 | I257: -2.9999999999999997e-004 | J257: -3.4000000000000002e-003 | K257: 3.58 | L257: -1.6500000000000001e-002 | M257: 119.8 | N257: 4.53 | O257: 0.36700000000000005 | P257: 79.03 | Q257: 已到 | R257: 4年9天 | S257: 2年9天 | T257: 16.6 | U257: 12 | V257: 6.9999999999999993e-003 | W257: 0.25600000000000001 | X257: 0.20199999999999999 | Y257: 65 | Z257: 0.89 | AA257: 2.6800000000000001e-002 | AB257: 1.8000000000000002e-002 | AC257: -1.67e-002 | AD257: -2.0299999999999999e-002 | AE257: 96.6 | AF257: 104.58 | AG257: 0.22 | AH257: AA+ | AI257: 3.5299999999999998e-002 | AJ257: =H257+100*O257 -> 144.69999999999999 | AK257: 137 | AL257: 27 | AM257: 32.4 | AN257: 12 | AO257: 2.9999999999999999e-002 | AP257: 46 | AQ257: 建工转债!
A258: 257 | B258: 128087 | C258: 孚日转债! | D258: 2083 | E258: 孚日股份 | F258: 服装纺织 | G258: 家纺 | H258: 111.78 | I258: 1.1000000000000001e-003 | J258: -1.1000000000000001e-003 | K258: 4.2 | L258: 0. | M258: 112.9 | N258: 4.5 | O258: 0.19800000000000001 | P258: 93.33 | Q258: 已到 | R258: 4年6.1天 | S258: 2年6.1天 | T258: 6.5 | U258: 10 | V258: 1.3999999999999999e-002 | W258: 0.17000000000000001 | X258: 0.159 | Y258: 38 | Z258: 1.01 | AA258: 2.5000000000000001e-003 | AB258: -3.3e-003 | AC258: -3.5499999999999997e-002 | AD258: -3.8300000000000001e-002 | AE258: 90.95 | AF258: 89.42 | AG258: 0.56 | AH258: AA- | AI258: 6.13e-002 | AJ258: =H258+100*O258 -> 131.58000000000001 | AK258: 130.2 | AL258: 9 | AM258: 39.3 | AN258: 26 | AO258: -2.e-003 | AP258: 75 | AQ258: 孚日转债!
A259: 258 | B259: 128085 | C259: 鸿达转债!! | D259: 2002 | E259: 鸿达兴业 | F259: 化工 | G259: 化工 | H259: 152.272 | I259: -1.5e-003 | J259: -1.9e-003 | K259: 5.87 | L259: -3.4000000000000002e-003 | M259: 124.4 | N259: 3.91 | O259: 1.3999999999999999e-002 | P259: 150.13 | Q259: 已到 | R259: 4年5.1天 | S259: 2年5.1天 | T259: 3.43 | U259: 107 | V259: 0.20499999999999999 | W259: 1.9e-002 | X259: 2.7999999999999997e-002 | Y259: 183 | Z259: 1.76 | AA259: -5.0199999999999995e-002 | AB259: -5.96e-002 | AC259: -0.126 | AD259: -0.128 | AE259: 73.81 | AF259: 66.95 | AG259: 1 | AH259: B | AI259: 0.17230000000000001 | AJ259: =H259+100*O259 -> 153.672 | AK259: 154.4 | AL259: 164 | AM259: 80.6 | AN259: 265 | AO259: 1.8000000000000002e-002 | AP259: 87 | AQ259: 鸿达转债!!
A260: 259 | B260: 110063 | C260: 鹰19转债 | D260: 600567 | E260: 山鹰国际 | F260: 造纸包装 | G260: 包装用纸 | H260: 120.17 | I260: 1.e-004 | J260: -4.6999999999999993e-003 | K260: 3.25 | L260: -9.1000000000000004e-003 | M260: 115.9 | N260: 3.26 | O260: 0.20499999999999999 | P260: 99.69 | Q260: 已到 | R260: 4年2.1天 | S260: 2年2.1天 | T260: 18.4 | U260: 12 | V260: 5.0000000000000001e-003 | W260: 0.12300000000000001 | X260: 0.12300000000000001 | Y260: 150 | Z260: 0.93 | AA260: -9.1999999999999998e-003 | AB260: -1.61e-002 | AC260: -6.8199999999999997e-002 | AD260: -7.0800000000000002e-002 | AE260: 95.82 | AF260: 101.17 | AG260: 0.5 | AH260: AA+ | AI260: 3.5299999999999998e-002 | AJ260: =H260+100*O260 -> 140.67000000000002 | AK260: 140.6 | AL260: 39 | AM260: 39.5 | AN260: 28 | AO260: 4.0000000000000001e-003 | AP260: 29 | AQ260: 鹰19转债
A261: 260 | B261: 128083 | C261: 新北转债! | D261: 2376 | E261: 新北洋 | F261: 电子 | G261: 电子产品 | H261: 109.171 | I261: -2.0999999999999999e-003 | J261: -3.5999999999999999e-003 | K261: 8.44 | L261: -2.5399999999999999e-002 | M261: 114.9 | N261: 11.45 | O261: 0.48100000000000004 | P261: 73.71 | Q261: 已到 | R261: 4年1.1天 | S261: 2年1.1天 | T261: 8.77 | U261: 2.8 | V261: 3.0000000000000001e-003 | W261: 0.156 | X261: 0.115 | Y261: 56 | Z261: 1.67 | AA261: 1.32e-002 | AB261: 6.3e-003 | AC261: -2.5000000000000001e-002 | AD261: -2.7900000000000001e-002 | AE261: 95.01 | AF261: 98.45 | AG261: 0.23 | AH261: AA | AI261: 4.0300000000000002e-002 | AJ261: =H261+100*O261 -> 157.27100000000002 | AK261: 144.6 | AL261: 74 | AM261: 46.2 | AN261: 65 | AO261: -4.4000000000000004e-002 | AP261: 21 | AQ261: 新北转债!
A262: 261 | B262: 128082 | C262: 华锋转债!! | D262: 2806 | E262: 华锋股份 | F262: 电子 | G262: 元器件制 | H262: 171.941 | I262: 4.5899999999999996e-002 | J262: -2.07e-002 | K262: 15.07 | L262: 2.7999999999999997e-002 | M262: 120.6 | N262: 9.13 | O262: 4.2000000000000003e-002 | P262: 165.06 | Q262: 已到 | R262: 3.98年 | S262: 1.98年 | T262: 2.04 | U262: 518 | V262: 1.48 | W262: 7.0999999999999994e-002 | X262: 0.11599999999999999 | Y262: 29 | Z262: 2.53 | AA262: -8.6899999999999991e-002 | AB262: -9.4600000000000004e-002 | AC262: -0.161 | AD262: -0.16300000000000001 | AE262: 87.62 | AF262: 88.67 | AG262: 0.9 | AH262: A | AI262: 8.2299999999999998e-002 | AJ262: =H262+100*O262 -> 176.14099999999999 | AK262: 178.8 | AL262: 288 | AM262: 90.1 | AN262: 288 | AO262: -4.5999999999999999e-002 | AP262: 48 | AQ262: 华锋转债!!
A263: 262 | B263: 110062 | C263: 烽火转债! | D263: 600498 | E263: 烽火通信 | F263: 通信互联 | G263: 通信设备 | H263: 114.68 | I263: 3.0000000000000001e-003 | J263: -4.4000000000000003e-003 | K263: 17.71 | L263: -5.6000000000000008e-003 | M263: 110.3 | N263: 22.85 | O263: 0.47999999999999998 | P263: 77.51 | Q263: 已到 | R263: 3.98年 | S263: 1.98年 | T263: 30.9 | U263: 5.6 | V263: 2.e-003 | W263: 0.154 | X263: 0.11900000000000001 | Y263: 200 | Z263: 1.83 | AA263: -9.8999999999999991e-003 | AB263: -1.46e-002 | AC263: -5.0099999999999999e-002 | AD263: -5.2400000000000002e-002 | AE263: 95.88 | AF263: 97.06 | AG263: 0.26 | AH263: AAA | AI263: 3.3300000000000003e-002 | AJ263: =H263+100*O263 -> 162.68000000000001 | AK263: 151.9 | AL263: 144 | AM263: 54.8 | AN263: 124 | AO263: -1.1000000000000001e-002 | AP263: 18 | AQ263: 烽火转债!
A264: 263 | B264: 128081 | C264: 海亮转债! | D264: 2203 | E264: 海亮股份 | F264: 有色金属 | G264: 铜金属 | H264: 132.964 | I264: 1.e-004 | J264: 1.1000000000000001e-003 | K264: 12.38 | L264: 1.6000000000000001e-003 | M264: 114.3 | N264: 9.69 | O264: 4.0999999999999995e-002 | P264: 127.76 | Q264: 已到 | R264: 3.95年 | S264: 1.95年 | T264: 30.1 | U264: 34 | V264: 8.0000000000000002e-003 | W264: 0.12300000000000001 | X264: 0.158 | Y264: 243 | Z264: 2.44 | AA264: -3.8199999999999998e-002 | AB264: -4.4400000000000002e-002 | AC264: -0.115 | AD264: -0.11699999999999999 | AE264: 94.62 | AF264: 98.08 | AG264: 0.78 | AH264: AA | AI264: 4.0300000000000002e-002 | AJ264: =H264+100*O264 -> 137.06399999999999 | AK264: 138.2 | AL264: 31 | AM264: 40.1 | AN264: 30 | AO264: -1.e-002 | AP264: 45 | AQ264: 海亮转债!
A265: 264 | B265: 113550 | C265: 常汽转债! | D265: 603035 | E265: 常熟汽饰 | F265: 汽车 | G265: 零部件制 | H265: 197.11 | I265: -1.09e-002 | J265: 6.3e-003 | K265: 15.63 | L265: -5.1000000000000004e-003 | M265: 120.5 | N265: 9.33 | O265: 0.17699999999999999 | P265: 167.52 | Q265: 已到 | R265: 3.94年 | S265: 1.94年 | T265: 2.14 | U265: 305 | V265: 0.71799999999999997 | W265: 3.7999999999999999e-002 | X265: 6.4000000000000001e-002 | Y265: 56 | Z265: 1.44 | AA265: -0.12 | AB265: -0.127 | AC265: -0.19899999999999998 | AD265: -0.20000000000000001 | AE265: 91.34 | AF265: 95.82 | AG265: 0.91 | AH265: AA- | AI265: 6.13e-002 | AJ265: =H265+100*O265 -> 214.81 | AK265: 226.7 | AL265: 335 | AM265: 130.9 | AN265: 336 | AO265: 2.8999999999999998e-002 | AP265: 15 | AQ265: 常汽转债!
A266: 265 | B266: 113549 | C266: 白电转债 | D266: 603861 | E266: 白云电器 | F266: 能源电力 | G266: 电力设备 | H266: 127.88 | I266: 2.0999999999999999e-003 | J266: 2.5000000000000001e-003 | K266: 10.31 | L266: 6.8000000000000005e-003 | M266: 114.3 | N266: 9.06 | O266: 0.124 | P266: 113.8 | Q266: 已到 | R266: 3.93年 | S266: 1.93年 | T266: 8.06 | U266: 29 | V266: 2.7999999999999997e-002 | W266: 0.17899999999999999 | X266: 0.20399999999999999 | Y266: 45 | Z266: 1.74 | AA266: -2.86e-002 | AB266: -3.49e-002 | AC266: -9.9499999999999991e-002 | AD266: -0.10199999999999999 | AE266: 94.68 | AF266: 98.14 | AG266: 0.68 | AH266: AA | AI266: 4.0300000000000002e-002 | AJ266: =H266+100*O266 -> 140.28 | AK266: 142 | AL266: 48 | AM266: 43.8 | AN266: 53 | AO266: 2.e-003 | AP266: 37 | AQ266: 白电转债
A267: 266 | B267: 123035 | C267: 利德转债!! | D267: 300296 | E267: 利亚德 | F267: 电子 | G267: LED制 | H267: 166.298 | I267: -4.7999999999999996e-003 | J267: 7.4000000000000003e-003 | K267: 10.21 | L267: 2.8999999999999998e-003 | M267: 114.3 | N267: 6.96 | O267: 0.13400000000000001 | P267: 146.7 | Q267: 已到 | R267: 3.93年 | S267: 1.93年 | T267: 7.99 | U267: 99 | V267: 7.400000000000001e-002 | W267: 3.1e-002 | X267: 4.4999999999999998e-002 | Y267: 260 | Z267: 3.38 | AA267: -9.2499999999999999e-002 | AB267: -9.8100000000000007e-002 | AC267: -0.16 | AD267: -0.161 | AE267: 95.65 | AF267: 99.99 | AG267: 0.87 | AH267: AA+ | AI267: 3.5299999999999998e-002 | AJ267: =H267+100*O267 -> 179.69800000000001 | AK267: 185.9 | AL267: 299 | AM267: 85.9 | AN267: 280 | AO267: -1.4999999999999999e-002 | AP267: 13 | AQ267: 利德转债!!
A268: 267 | B268: 110061 | C268: 川投转债! | D268: 600674 | E268: 川投能源 | F268: 能源电力 | G268: 水电 | H268: 147.52 | I268: 3.0999999999999999e-003 | J268: -8.5000000000000006e-003 | K268: 11.95 | L268: -6.7000000000000002e-003 | M268: 110.3 | N268: 9.2 | O268: 0.13600000000000001 | P268: 129.89 | Q268: 已到 | R268: 3.92年 | S268: 1.92年 | T268: 39.6 | U268: 45 | V268: 8.0000000000000002e-003 | W268: 7.4999999999999997e-002 | X268: 9.8000000000000004e-002 | Y268: 527 | Z268: 1.72 | AA268: -7.2700000000000001e-002 | AB268: -7.6999999999999999e-002 | AC268: -0.127 | AD268: -0.128 | AE268: 96.06 | AF268: 97.25 | AG268: 0.82 | AH268: AAA | AI268: 3.3300000000000003e-002 | AJ268: =H268+100*O268 -> 161.12 | AK268: 165.1 | AL268: 232 | AM268: 67.9 | AN268: 207 | AO268: 2.6000000000000002e-002 | AP268: 12 | AQ268: 川投转债!
A269: 268 | B269: 123034 | C269: 通光转债! | D269: 300265 | E269: 通光线缆 | F269: 通信互联 | G269: 通信设备 | H269: 214.14 | I269: 7.000000000000001e-004 | J269: 1.e-004 | K269: 10.58 | L269: 8.9999999999999998e-004 | M269: 117.3 | N269: 7.95 | O269: 0.60899999999999999 | P269: 133.08 | Q269: 已到 | R269: 3.90年 | S269: 1.90年 | T269: 0.78 | U269: 56 | V269: 0.33399999999999996 | W269: 2.e-002 | X269: 2.7000000000000003e-002 | Y269: 39 | Z269: 2.97 | AA269: -0.14499999999999999 | AB269: -0.151 | AC269: -0.223 | AD269: -0.22399999999999998 | AE269: 89.08 | AF269: 89.8 | AG269: 0.82 | AH269: A+ | AI269: 7.2300000000000003e-002 | AJ269: =H269+100*O269 -> 275.03999999999996 | AK269: 295.2 | AL269: 360 | AM269: 205.4 | AN269: 360 | AO269: -5.7000000000000002e-002 | AP269: 17 | AQ269: 通光转债!
A270: 269 | B270: 113548 | C270: 石英转债! | D270: 603688 | E270: 石英股份 | F270: 电子 | G270: 电子产品 | H270: 451.96 | I270: 3.1600000000000003e-002 | J270: 1.2e-002 | K270: 63.82 | L270: 4.4199999999999996e-002 | M270: 123.7 | N270: 14.93 | O270: 5.7000000000000002e-002 | P270: 427.46 | Q270: 已到 | R270: 3.88年 | S270: 1.88年 | T270: 1.2 | U270: 480 | V270: 0.89700000000000002 | W270: 5.0000000000000001e-003 | X270: 2.3e-002 | Y270: 225 | Z270: 10.98 | AA270: -0.28800000000000003 | AB270: -0.29399999999999998 | AC270: -0.33700000000000002 | AD270: -0.33700000000000002 | AE270: 91.83 | AF270: 98.71 | AG270: 0.99 | AH270: AA- | AI270: 6.13e-002 | AJ270: =H270+100*O270 -> 457.65999999999997 | AK270: 476.5 | AL270: 374 | AM270: 377.7 | AN270: 374 | AO270: 6.2e-002 | AP270: 12 | AQ270: 石英转债!
A271: 270 | B271: 110060 | C271: 天路转债! | D271: 600326 | E271: 西藏天路 | F271: 建筑 | G271: 水泥 | H271: 118.92 | I271: -8.8000000000000005e-003 | J271: 1.1000000000000001e-003 | K271: 6.41 | L271: -1.84e-002 | M271: 114.3 | N271: 7.08 | O271: 0.314 | P271: 90.54 | Q271: 已到 | R271: 3.88年 | S271: 1.88年 | T271: 7.06 | U271: 19 | V271: 2.3e-002 | W271: 0.12 | X271: 0.109 | Y271: 59 | Z271: 1.38 | AA271: -1.03e-002 | AB271: -1.6799999999999999e-002 | AC271: -6.9099999999999995e-002 | AD271: -7.1500000000000008e-002 | AE271: 94.87 | AF271: 98.33 | AG271: 0.42 | AH271: AA | AI271: 4.0300000000000002e-002 | AJ271: =H271+100*O271 -> 150.31999999999999 | AK271: 147.3 | AL271: 96 | AM271: 49 | AN271: 82 | AO271: 1.3000000000000001e-002 | AP271: 12 | AQ271: 天路转债!
A272: 271 | B272: 110059 | C272: 浦发转债! | D272: 600000 | E272: 浦发银行 | F272: 金融 | G272: 银行行业 | H272: 104.74 | I272: -5.9999999999999995e-004 | J272: 8.0000000000000004e-004 | K272: 8.77 | L272: 2.3e-003 | M272: 116.8 | N272: 13.97 | O272: 0.66799999999999993 | P272: 62.78 | Q272: 已到 | R272: 3.88年 | S272: 无权 | T272: 500 | U272: 204 | V272: 4.0000000000000001e-003 | W272: 0.19399999999999998 | X272: 0.122 | Y272: 2574. | Z272: 0.47 | AA272: 2.9300000000000003e-002 | AB272: 2.1299999999999999e-002 | AC272: 无权 | AD272: 无权 | AE272: 无权 | AF272: 103.22 | AG272: 0.09 | AH272: AAA | AI272: 3.3300000000000003e-002 | AJ272: =H272+100*O272 -> 171.53999999999999 | AK272: 146.7 | AL272: 87 | AM272: 43.5 | AN272: 48 | AO272: 1.6e-002 | AP272: 54 | AQ272: 浦发转债!
A273: 272 | B273: 127014 | C273: 北方转债! | D273: 65 | E273: 北方国际 | F273: 建筑 | G273: 建筑工程 | H273: 120.78 | I273: -8.8000000000000005e-003 | J273: -3.3e-003 | K273: 8.16 | L273: -2.7400000000000001e-002 | M273: 114.3 | N273: 8.65 | O273: 0.28000000000000003 | P273: 94.34 | Q273: 已到 | R273: 3.87年 | S273: 1.87年 | T273: 5.35 | U273: 7.1 | V273: 1.1000000000000001e-002 | W273: 8.5000000000000006e-002 | X273: 8.0000000000000002e-002 | Y273: 63 | Z273: 1.06 | AA273: -1.44e-002 | AB273: -2.0899999999999998e-002 | AC273: -7.6600000000000001e-002 | AD273: -7.9000000000000001e-002 | AE273: 95.84 | AF273: 100.19 | AG273: 0.44 | AH273: AA+ | AI273: 3.5299999999999998e-002 | AJ273: =H273+100*O273 -> 148.78 | AK273: 147.2 | AL273: 95 | AM273: 47 | AN273: 71 | AO273: 2.7000000000000003e-002 | AP273: 17 | AQ273: 北方转债!
A274: 273 | B274: 113546 | C274: 迪贝转债! | D274: 603320 | E274: 迪贝电气 | F274: 家电 | G274: 零部件制 | H274: 121.54 | I274: 1.21e-002 | J274: -7.0999999999999995e-003 | K274: 13.12 | L274: 9.1999999999999998e-003 | M274: 119.8 | N274: 14 | O274: 0.29699999999999999 | P274: 93.71 | Q274: 已到 | R274: 3.87年 | S274: 1.87年 | T274: 2.3 | U274: 5.9 | V274: 2.1000000000000001e-002 | W274: 0.13500000000000001 | X274: 0.126 | Y274: 17 | Z274: 2.35 | AA274: -3.8e-003 | AB274: -1.2500000000000001e-002 | AC274: -7.8200000000000006e-002 | AD274: -8.0799999999999997e-002 | AE274: 89.59 | AF274: 91.97 | AG274: 0.54 | AH274: A+ | AI274: 7.2300000000000003e-002 | AJ274: =H274+100*O274 -> 151.24000000000001 | AK274: 149.4 | AL274: 118 | AM274: 57.4 | AN274: 137 | AO274: -2.e-002 | AP274: 38 | AQ274: 迪贝转债!
A275: 274 | B275: 128079 | C275: 英联转债! | D275: 2846 | E275: 英联股份 | F275: 造纸包装 | G275: 包装材料 | H275: 126.75 | I275: -7.4000000000000003e-003 | J275: 1.9099999999999999e-002 | K275: 7.56 | L275: 2.0199999999999999e-002 | M275: 116.9 | N275: 8.29 | O275: 0.39000000000000001 | P275: 91.19 | Q275: 已到 | R275: 3.86年 | S275: 1.86年 | T275: 1.52 | U275: 96 | V275: 0.495 | W275: 6.3e-002 | X275: 5.7999999999999996e-002 | Y275: 24 | Z275: 2.98 | AA275: -2.1099999999999997e-002 | AB275: -2.86e-002 | AC275: -9.7599999999999992e-002 | AD275: -0.10000000000000001 | AE275: 89.56 | AF275: 89.78 | AG275: 0.58 | AH275: A+ | AI275: 7.2300000000000003e-002 | AJ275: =H275+100*O275 -> 165.75 | AK275: 162.3 | AL275: 214 | AM275: 72.5 | AN275: 233 | AO275: 2.1000000000000001e-002 | AP275: 15 | AQ275: 英联转债!
A276: 275 | B276: 128078 | C276: 太极转债! | D276: 2368 | E276: 太极股份 | F276: 计算机及 | G276: 软件开发 | H276: 144.6 | I276: -8.8000000000000005e-003 | J276: -4.0000000000000001e-003 | K276: 27.43 | L276: -1.72e-002 | M276: 116.3 | N276: 22.21 | O276: 0.17100000000000001 | P276: 123.5 | Q276: 已到 | R276: 3.86年 | S276: 1.86年 | T276: 9.6 | U276: 14 | V276: 1.e-002 | W276: 5.9999999999999998e-002 | X276: 7.4999999999999997e-002 | Y276: 159 | Z276: 4.81 | AA276: -5.57e-002 | AB276: -6.2600000000000003e-002 | AC276: -0.125 | AD276: -0.127 | AE276: 94.94 | AF276: 100.12 | AG276: 0.74 | AH276: AA | AI276: 4.0300000000000002e-002 | AJ276: =H276+100*O276 -> 161.69999999999999 | AK276: 165.7 | AL276: 236 | AM276: 65.6 | AN276: 188 | AO276: -5.5999999999999994e-002 | AP276: 9 | AQ276: 太极转债!
A277: 276 | B277: 128076 | C277: 金轮转债! | D277: 2722 | E277: 金轮股份 | F277: 机械装备 | G277: 专用设备 | H277: 131.24 | I277: 6.3500000000000001e-002 | J277: 6.8000000000000005e-003 | K277: 16.5 | L277: 0.10000000000000001 | M277: 114.3 | N277: 14.66 | O277: 0.16600000000000001 | P277: 112.55 | Q277: 已到 | R277: 3.84年 | S277: 1.84年 | T277: 2.14 | U277: 779 | V277: 2.6899999999999999 | W277: 7.400000000000001e-002 | X277: 8.3000000000000004e-002 | Y277: 29 | Z277: 1.48 | AA277: -3.5900000000000001e-002 | AB277: -4.2300000000000004e-002 | AC277: -0.115 | AD277: -0.11699999999999999 | AE277: 91.3 | AF277: 91.34 | AG277: 0.7 | AH277: AA- | AI277: 6.13e-002 | AJ277: =H277+100*O277 -> 147.84 | AK277: 149.9 | AL277: 124 | AM277: 58.6 | AN277: 145 | AO277: 5.4000000000000006e-002 | AP277: 37 | AQ277: 金轮转债!
A278: 277 | B278: 113545 | C278: 金能转债! | D278: 603113 | E278: 金能科技 | F278: 煤炭 | G278: 炼焦 | H278: 184.91 | I278: -2.0000000000000001e-004 | J278: -2.5099999999999997e-002 | K278: 16.31 | L278: -2.7999999999999997e-002 | M278: 114.3 | N278: 10.43 | O278: 0.182 | P278: 156.38 | Q278: 已到 | R278: 3.84年 | S278: 1.84年 | T278: 9.87 | U278: 83 | V278: 4.4999999999999998e-002 | W278: 7.0999999999999994e-002 | X278: 0.111 | Y278: 139 | Z278: 1.6 | AA278: -0.11900000000000001 | AB278: -0.125 | AC278: -0.19699999999999998 | AD278: -0.19800000000000001 | AE278: 95.01 | AF278: 98.48 | AG278: 0.9 | AH278: AA | AI278: 4.0300000000000002e-002 | AJ278: =H278+100*O278 -> 203.10999999999999 | AK278: 213.4 | AL278: 329 | AM278: 115 | AN278: 326 | AO278: 4.7e-002 | AP278: 13 | AQ278: 金能转债!
A279: 278 | B279: 128074 | C279: 游族转债!! | D279: 2174 | E279: 游族网络 | F279: 通信互联 | G279: 互联网 | H279: 119.69 | I279: 1.49e-002 | J279: -1.24e-002 | K279: 14.71 | L279: 6.1999999999999998e-003 | M279: 119.3 | N279: 16.97 | O279: 0.38100000000000001 | P279: 86.68 | Q279: 已到 | R279: 3.78年 | S279: 1.78年 | T279: 6.83 | U279: 31 | V279: 3.7999999999999999e-002 | W279: 5.0999999999999997e-002 | X279: 4.4000000000000004e-002 | Y279: 135 | Z279: 2.57 | AA279: -8.9999999999999998e-004 | AB279: -9.5999999999999992e-003 | AC279: -7.5499999999999998e-002 | AD279: -7.8e-002 | AE279: 95.23 | AF279: 103.01 | AG279: 0.41 | AH279: AA | AI279: 4.0300000000000002e-002 | AJ279: =H279+100*O279 -> 157.78999999999999 | AK279: 152.7 | AL279: 151 | AM279: 49.7 | AN279: 89 | AO279: -5.0000000000000003e-002 | AP279: 30 | AQ279: 游族转债!!
A280: 279 | B280: 128075 | C280: 远东转债! | D280: 2406 | E280: 远东传动 | F280: 汽车 | G280: 零部件制 | H280: 128.103 | I280: 1.4999999999999999e-002 | J280: -4.6999999999999993e-003 | K280: 6.16 | L280: 1.4800000000000001e-002 | M280: 114.3 | N280: 5.29 | O280: 0.10000000000000001 | P280: 116.45 | Q280: 已到 | R280: 3.78年 | S280: 1.78年 | T280: 5.44 | U280: 21 | V280: 2.9999999999999999e-002 | W280: 0.14099999999999999 | X280: 0.16500000000000001 | Y280: 38 | Z280: 1.18 | AA280: -3.0200000000000001e-002 | AB280: -3.6699999999999997e-002 | AC280: -0.107 | AD280: -0.11 | AE280: 95.23 | AF280: 98.71 | AG280: 0.69 | AH280: AA | AI280: 4.0300000000000002e-002 | AJ280: =H280+100*O280 -> 138.10300000000001 | AK280: 139.8 | AL280: 35 | AM280: 41.1 | AN280: 38 | AO280: 2.8999999999999998e-002 | AP280: 16 | AQ280: 远东转债!
A281: 280 | B281: 123031 | C281: 晶瑞转债! | D281: 300655 | E281: 晶瑞电材 | F281: 电子 | G281: 电子行业 | H281: 507.231 | I281: -2.7000000000000001e-003 | J281: 5.6000000000000008e-003 | K281: 48 | L281: 2.8999999999999998e-003 | M281: 115.3 | N281: 10.13 | O281: 7.0000000000000007e-002 | P281: 473.84 | Q281: 已到 | R281: 3.72年 | S281: 1.72年 | T281: 0.53 | U281: 233 | V281: 0.86199999999999999 | W281: 3.0000000000000001e-003 | X281: 1.4999999999999999e-002 | Y281: 164 | Z281: 11.27 | AA281: -0.33200000000000002 | AB281: -0.33600000000000002 | AC281: -0.38600000000000001 | AD281: -0.38600000000000001 | AE281: 90.23 | AF281: 89.41 | AG281: 0.99 | AH281: A+ | AI281: 7.2300000000000003e-002 | AJ281: =H281+100*O281 -> 514.23099999999999 | AK281: 540.6 | AL281: 377 | AM281: 450.4 | AN281: 378 | AO281: 5.0000000000000003e-002 | AP281: 16 | AQ281: 晶瑞转债!
A282: 281 | B282: 128073 | C282: 哈尔转债! | D282: 2615 | E282: 哈尔斯 | F282: 其他 | G282: 家居用品 | H282: 122.29 | I282: 1.6200000000000003e-002 | J282: -3.0999999999999999e-003 | K282: 5.72 | L282: 2.5099999999999997e-002 | M282: 114.5 | N282: 5.71 | O282: 0.221 | P282: 100.18 | Q282: 已到 | R282: 2.70年 | S282: 0.70年 | T282: 2.99 | U282: 14 | V282: 3.7999999999999999e-002 | W282: 0.127 | X282: 0.127 | Y282: 24 | Z282: 2.75 | AA282: -2.4399999999999998e-002 | AB282: -3.3700000000000001e-002 | AC282: -0.20300000000000001 | AD282: -0.20499999999999999 | AE282: 96.29 | AF282: 98.01 | AG282: 0.52 | AH282: AA- | AI282: 6.0100000000000001e-002 | AJ282: =H282+100*O282 -> 144.39000000000001 | AK282: 144.4 | AL282: 71 | AM282: 46.4 | AN282: 66 | AO282: -5.7000000000000002e-002 | AP282: 37 | AQ282: 哈尔转债!
A283: 282 | B283: 128072 | C283: 翔鹭转债! | D283: 2842 | E283: 翔鹭钨业 | F283: 有色金属 | G283: 小金属 | H283: 112.15 | I283: 4.3e-003 | J283: -3.0999999999999999e-003 | K283: 9.63 | L283: 6.3e-003 | M283: 114.5 | N283: 15.19 | O283: 0.76900000000000002 | P283: 63.4 | Q283: 已到 | R283: 3.69年 | S283: 1.69年 | T283: 3.02 | U283: 1.4 | V283: 4.0000000000000001e-003 | W283: 0.113 | X283: 7.2000000000000008e-002 | Y283: 27 | Z283: 2.75 | AA283: 5.6999999999999993e-003 | AB283: -1.4000000000000002e-003 | AC283: -4.5899999999999996e-002 | AD283: -4.87e-002 | AE283: 92.15 | AF283: 92.33 | AG283: 0.19 | AH283: AA- | AI283: 6.13e-002 | AJ283: =H283+100*O283 -> 189.05000000000001 | AK283: 160.9 | AL283: 201 | AM283: 68.6 | AN283: 211 | AO283: 0. | AP283: 27 | AQ283: 翔鹭转债!
A284: 283 | B284: 128071 | C284: 合兴转债! | D284: 2228 | E284: 合兴包装 | F284: 造纸包装 | G284: 包装材料 | H284: 114.07 | I284: 4.0999999999999995e-003 | J284: -4.0999999999999995e-003 | K284: 3.53 | L284: 0. | M284: 114.3 | N284: 4.18 | O284: 0.35100000000000003 | P284: 84.45 | Q284: 已到 | R284: 3.68年 | S284: 1.68年 | T284: 3 | U284: 1.5 | V284: 4.0000000000000001e-003 | W284: 6.9000000000000006e-002 | X284: 5.7999999999999996e-002 | Y284: 44 | Z284: 1.3 | AA284: 5.9999999999999995e-004 | AB284: -6.4000000000000003e-003 | AC284: -5.5199999999999999e-002 | AD284: -5.79e-002 | AE284: 95.62 | AF284: 99.11 | AG284: 0.34 | AH284: AA | AI284: 4.0300000000000002e-002 | AJ284: =H284+100*O284 -> 149.16999999999999 | AK284: 143.7 | AL284: 63 | AM284: 44.6 | AN284: 56 | AO284: 9.0000000000000011e-003 | AP284: 24 | AQ284: 合兴转债!
A285: 284 | B285: 113542 | C285: 好客转债! | D285: 603898 | E285: 好莱客 | F285: 其他 | G285: 家居用品 | H285: 112.8 | I285: 5.9999999999999995e-004 | J285: -1.e-003 | K285: 12.38 | L285: -1.6000000000000001e-003 | M285: 114.3 | N285: 16.14 | O285: 0.47100000000000003 | P285: 76.7 | Q285: 已到 | R285: 3.64年 | S285: 1.64年 | T285: 6.03 | U285: 69 | V285: 0.10199999999999999 | W285: 0.156 | X285: 0.12 | Y285: 39 | Z285: 1.42 | AA285: 3.7000000000000002e-003 | AB285: -3.4000000000000002e-003 | AC285: -5.0499999999999996e-002 | AD285: -5.33e-002 | AE285: 95.78 | AF285: 99.27 | AG285: 0.24 | AH285: AA | AI285: 4.0300000000000002e-002 | AJ285: =H285+100*O285 -> 159.90000000000001 | AK285: 148.9 | AL285: 111 | AM285: 49.6 | AN285: 88 | AO285: 0.105 | AP285: 16 | AQ285: 好客转债!
A286: 285 | B286: 113541 | C286: 荣晟转债!! | D286: 603165 | E286: 荣晟环保 | F286: 造纸包装 | G286: 包装用纸 | H286: 185.6 | I286: 3.0600000000000002e-002 | J286: 1.2999999999999999e-003 | K286: 19.98 | L286: 3.3599999999999998e-002 | M286: 114.3 | N286: 10.84 | O286: 6.9999999999999993e-003 | P286: 184.32 | Q286: 已到 | R286: 3.61年 | S286: 1.61年 | T286: 1.63 | U286: 374 | V286: 1.26 | W286: 3.1e-002 | X286: 5.7000000000000002e-002 | Y286: 53 | Z286: 3.04 | AA286: -0.127 | AB286: -0.13300000000000001 | AC286: -0.23000000000000001 | AD286: -0.23100000000000001 | AE286: 92.54 | AF286: 92.59 | AG286: 0.95 | AH286: AA- | AI286: 6.13e-002 | AJ286: =H286+100*O286 -> 186.29999999999998 | AK286: 186.9 | AL286: 300 | AM286: 94.3 | AN286: 301 | AO286: 5.9000000000000004e-002 | AP286: 40 | AQ286: 荣晟转债!!
A287: 286 | B287: 128070 | C287: 智能转债! | D287: 2877 | E287: 智能自控 | F287: 机械装备 | G287: 通用设备 | H287: 114.861 | I287: 5.3e-003 | J287: -2.8000000000000004e-003 | K287: 6.5 | L287: 9.300000000000001e-003 | M287: 116.8 | N287: 9.47 | O287: 0.67299999999999993 | P287: 68.64 | Q287: 已到 | R287: 3.56年 | S287: 无权 | T287: 2.3 | U287: 8.7 | V287: 3.3000000000000002e-002 | W287: 0.106 | X287: 7.2999999999999995e-002 | Y287: 22 | Z287: 2.85 | AA287: 4.7999999999999996e-003 | AB287: -3.5999999999999999e-003 | AC287: 无权 | AD287: 无权 | AE287: 无权 | AF287: 91.64 | AG287: 0.27 | AH287: A+ | AI287: 7.2300000000000003e-002 | AJ287: =H287+100*O287 -> 182.161 | AK287: 161.1 | AL287: 204 | AM287: 69.4 | AN287: 217 | AO287: -9.0000000000000011e-003 | AP287: 28 | AQ287: 智能转债!
A288: 287 | B288: 128069 | C288: 华森转债! | D288: 2907 | E288: 华森制药 | F288: 医药 | G288: 化学制药 | H288: 111.3 | I288: 2.7000000000000001e-003 | J288: -5.4000000000000003e-003 | K288: 12.81 | L288: -1.3100000000000001e-002 | M288: 119.3 | N288: 18.01 | O288: 0.56499999999999995 | P288: 71.13 | Q288: 已到 | R288: 3.53年 | S288: 1.53年 | T288: 3 | U288: 7.8 | V288: 2.4e-002 | W288: 5.7999999999999996e-002 | X288: 4.0999999999999995e-002 | Y288: 51 | Z288: 4.34 | AA288: 2.0199999999999999e-002 | AB288: 1.06e-002 | AC288: -4.5999999999999999e-002 | AD288: -4.9000000000000002e-002 | AE288: 92.98 | AF288: 97.08 | AG288: 0.21 | AH288: AA- | AI288: 6.13e-002 | AJ288: =H288+100*O288 -> 167.79999999999998 | AK288: 151.5 | AL288: 140 | AM288: 54.4 | AN288: 119 | AO288: 3.7000000000000005e-002 | AP288: 42 | AQ288: 华森转债!
A289: 288 | B289: 113027 | C289: 华钰转债!! | D289: 601020 | E289: ST华钰 | F289: 有色金属 | G289: 锌铅镍锡 | H289: 146.74 | I289: 1.9e-002 | J289: 1.6500000000000001e-002 | K289: 13.08 | L289: 4.3099999999999999e-002 | M289: 114.3 | N289: 10.17 | O289: 0.14099999999999999 | P289: 128.61 | Q289: 已到 | R289: 3.51年 | S289: 1.51年 | T289: 3.1 | U289: 572 | V289: 1.25 | W289: 4.2999999999999997e-002 | X289: 5.5e-002 | Y289: 73 | Z289: 2.8 | AA289: -7.0000000000000007e-002 | AB289: -7.6499999999999999e-002 | AC289: -0.16600000000000001 | AD289: -0.16800000000000001 | AE289: 90.16 | AF289: 87.12 | AG289: 0.83 | AH289: A | AI289: 8.2299999999999998e-002 | AJ289: =H289+100*O289 -> 160.84 | AK289: 164.9 | AL289: 229 | AM289: 74.7 | AN289: 239 | AO289: 1.1000000000000001e-002 | AP289: 41 | AQ289: 华钰转债!!
A290: 289 | B290: 123027 | C290: 蓝晓转债! | D290: 300487 | E290: 蓝晓科技 | F290: 化工 | G290: 化工 | H290: 363 | I290: 7.9399999999999998e-002 | J290: -2.1400000000000002e-002 | K290: 89.9 | L290: 5.91e-002 | M290: 118.8 | N290: 29.02 | O290: 0.17199999999999999 | P290: 309.79 | Q290: 已到 | R290: 3.50年 | S290: 1.50年 | T290: 1.07 | U290: 1947. | V290: 5.1100000000000003 | W290: 5.0000000000000001e-003 | X290: 1.7000000000000001e-002 | Y290: 198 | Z290: 9.99 | AA290: -0.27800000000000002 | AB290: -0.28399999999999997 | AC290: -0.40100000000000002 | AD290: -0.40100000000000002 | AE290: 92.45 | AF290: 93.67 | AG290: 0.98 | AH290: A+ | AI290: 7.2300000000000003e-002 | AJ290: =H290+100*O290 -> 380.19999999999999 | AK290: 416.2 | AL290: 369 | AM290: 322.5 | AN290: 369 | AO290: 1.4999999999999999e-002 | AP290: 17 | AQ290: 蓝晓转债!
A291: 290 | B291: 113537 | C291: 文灿转债!! | D291: 603348 | E291: 文灿股份 | F291: 汽车 | G291: 零部件制 | H291: 295.14 | I291: -2.52e-002 | J291: 1.6399999999999998e-002 | K291: 52.82 | L291: -9.0000000000000011e-003 | M291: 120.7 | N291: 19.28 | O291: 7.6999999999999999e-002 | P291: 273.96 | Q291: 已到 | R291: 3.50年 | S291: 1.50年 | T291: 1.41 | U291: 242 | V291: 0.57899999999999996 | W291: 1.e-002 | X291: 2.7999999999999997e-002 | Y291: 138 | Z291: 5.28 | AA291: -0.22899999999999998 | AB291: -0.23699999999999999 | AC291: -0.36499999999999999 | AD291: -0.36599999999999999 | AE291: 93.95 | AF291: 98.55 | AG291: 0.98 | AH291: AA- | AI291: 6.13e-002 | AJ291: =H291+100*O291 -> 302.83999999999997 | AK291: 316.3 | AL291: 362 | AM291: 217.8 | AN291: 362 | AO291: 8.5999999999999993e-002 | AP291: 22 | AQ291: 文灿转债!!
A292: 291 | B292: 113536 | C292: 三星转债! | D292: 603578 | E292: 三星新材 | F292: 家电 | G292: 零部件制 | H292: 146.96 | I292: -1.8100000000000002e-002 | J292: 9.8999999999999991e-003 | K292: 18.64 | L292: -1.01e-002 | M292: 114.3 | N292: 13.76 | O292: 8.5000000000000006e-002 | P292: 135.47 | Q292: 已到 | R292: 3.47年 | S292: 1.47年 | T292: 1.49 | U292: 62 | V292: 0.28100000000000003 | W292: 6.2e-002 | X292: 8.4000000000000005e-002 | Y292: 24 | Z292: 3.08 | AA292: -7.1099999999999997e-002 | AB292: -7.7800000000000008e-002 | AC292: -0.17100000000000001 | AD292: -0.17300000000000001 | AE292: 96.42 | AF292: 99.94 | AG292: 0.81 | AH292: AA | AI292: 4.0300000000000002e-002 | AJ292: =H292+100*O292 -> 155.46000000000001 | AK292: 158.5 | AL292: 188 | AM292: 58.5 | AN292: 144 | AO292: 4.0000000000000001e-002 | AP292: 34 | AQ292: 三星转债!
A293: 292 | B293: 113535 | C293: 大业转债! | D293: 603278 | E293: 大业股份 | F293: 汽车 | G293: 零部件制 | H293: 117.01 | I293: 1.8000000000000002e-002 | J293: -1.1899999999999999e-002 | K293: 11.13 | L293: 1.83e-002 | M293: 112.5 | N293: 12.29 | O293: 0.29199999999999998 | P293: 90.56 | Q293: 已到 | R293: 2.41年 | S293: 0.41年 | T293: 5 | U293: 40 | V293: 6.9000000000000006e-002 | W293: 0.155 | X293: 0.14000000000000001 | Y293: 32 | Z293: 1.81 | AA293: -1.6399999999999998e-002 | AB293: -2.5600000000000001e-002 | AC293: -0.24600000000000002 | AD293: -0.25 | AE293: 99.05 | AF293: 102.7 | AG293: 0.33 | AH293: AA | AI293: 3.9100000000000003e-002 | AJ293: =H293+100*O293 -> 146.21000000000001 | AK293: 143.5 | AL293: 61 | AM293: 40.8 | AN293: 37 | AO293: 5.5e-002 | AP293: 46 | AQ293: 大业转债!
A294: 293 | B294: 128066 | C294: 亚泰转债! | D294: 2811 | E294: 郑中设计 | F294: 建筑 | G294: 装饰工程 | H294: 114.1 | I294: 4.8999999999999998e-003 | J294: -1.9e-003 | K294: 9.13 | L294: 5.5000000000000005e-003 | M294: 116.7 | N294: 9.27 | O294: 0.158 | P294: 98.49 | Q294: 已到 | R294: 3.35年 | S294: 1.35年 | T294: 4.8 | U294: 17 | V294: 3.2000000000000001e-002 | W294: 0.19500000000000001 | X294: 0.192 | Y294: 25 | Z294: 1.77 | AA294: 6.8999999999999999e-003 | AB294: -2.e-003 | AC294: -6.5799999999999997e-002 | AD294: -6.93e-002 | AE294: 94.25 | AF294: 96.07 | AG294: 0.53 | AH294: AA- | AI294: 6.13e-002 | AJ294: =H294+100*O294 -> 129.90000000000001 | AK294: 129.7 | AL294: 8 | AM294: 33.6 | AN294: 15 | AO294: 6.0999999999999999e-002 | AP294: 67 | AQ294: 亚泰转债!
A295: 294 | B295: 110058 | C295: 永鼎转债! | D295: 600105 | E295: 永鼎股份 | F295: 通信互联 | G295: 通信设备 | H295: 126.76 | I295: 7.6e-003 | J295: -1.8700000000000001e-002 | K295: 5.05 | L295: -1.9400000000000001e-002 | M295: 114.3 | N295: 5.04 | O295: 0.26500000000000001 | P295: 100.2 | Q295: 已到 | R295: 3.35年 | S295: 1.35年 | T295: 2.61 | U295: 55 | V295: 0.16600000000000001 | W295: 3.7000000000000005e-002 | X295: 3.7999999999999999e-002 | Y295: 70 | Z295: 2.49 | AA295: -3.1099999999999999e-002 | AB295: -3.8399999999999997e-002 | AC295: -0.11800000000000001 | AD295: -0.12 | AE295: 94.03 | AF295: 94.08 | AG295: 0.58 | AH295: AA- | AI295: 6.13e-002 | AJ295: =H295+100*O295 -> 153.25999999999999 | AK295: 153.3 | AL295: 157 | AM295: 59.2 | AN295: 152 | AO295: -0.11 | AP295: 46 | AQ295: 永鼎转债!
A296: 295 | B296: 127013 | C296: 创维转债! | D296: 810 | E296: 创维数字 | F296: 电子 | G296: 电子产品 | H296: 116.9 | I296: -4.1999999999999997e-003 | J296: 3.4999999999999996e-003 | K296: 9 | L296: -3.3e-003 | M296: 117.3 | N296: 11.29 | O296: 0.46600000000000003 | P296: 79.72 | Q296: 已到 | R296: 3.34年 | S296: 1.34年 | T296: 9.78 | U296: 31 | V296: 2.7000000000000003e-002 | W296: 0.10199999999999999 | X296: 8.1000000000000003e-002 | Y296: 96 | Z296: 2.26 | AA296: 1.e-003 | AB296: -8.0000000000000002e-003 | AC296: -8.2299999999999998e-002 | AD296: -8.5500000000000007e-002 | AE296: 96.9 | AF296: 103.07 | AG296: 0.22 | AH296: AA | AI296: 4.0300000000000002e-002 | AJ296: =H296+100*O296 -> 163.5 | AK296: 154.1 | AL296: 160 | AM296: 51 | AN296: 99 | AO296: 2.7000000000000003e-002 | AP296: 25 | AQ296: 创维转债!
A297: 296 | B297: 113026 | C297: 核能转债! | D297: 601985 | E297: 中国核电 | F297: 能源电力 | G297: 核电 | H297: 135.3 | I297: -3.0000000000000001e-003 | J297: -1.6899999999999998e-002 | K297: 6.9 | L297: -2.5399999999999999e-002 | M297: 109.3 | N297: 5.73 | O297: 0.124 | P297: 120.42 | Q297: 已到 | R297: 3.34年 | S297: 1.34年 | T297: 76 | U297: 85 | V297: 8.0000000000000002e-003 | W297: 6.3e-002 | X297: 7.5999999999999998e-002 | Y297: 1209. | Z297: 1.87 | AA297: -6.3099999999999989e-002 | AB297: -6.7699999999999996e-002 | AC297: -0.14999999999999999 | AD297: -0.153 | AE297: 97.89 | AF297: 98.2 | AG297: 0.78 | AH297: AAA | AI297: 3.3300000000000003e-002 | AJ297: =H297+100*O297 -> 147.70000000000002 | AK297: 150.2 | AL297: 127 | AM297: 52 | AN297: 107 | AO297: 2.2000000000000002e-002 | AP297: 38 | AQ297: 核能转债!
A298: 297 | B298: 113025 | C298: 明泰转债!! | D298: 601677 | E298: 明泰铝业 | F298: 有色金属 | G298: 铝金属 | H298: 382.03 | I298: 3.0899999999999997e-002 | J298: -6.1999999999999998e-003 | K298: 38.87 | L298: 2.5099999999999997e-002 | M298: 114.5 | N298: 11 | O298: 8.1000000000000003e-002 | P298: 353.36 | Q298: 已到 | R298: 3.33年 | S298: 1.33年 | T298: 11 | U298: 302 | V298: 7.2999999999999995e-002 | W298: 4.0999999999999995e-002 | X298: 0.14599999999999999 | Y298: 265 | Z298: 2.64 | AA298: -0.307 | AB298: -0.312 | AC298: -0.46500000000000002 | AD298: -0.46600000000000003 | AE298: 96.99 | AF298: 100.68 | AG298: 0.99 | AH298: AA | AI298: 4.0300000000000002e-002 | AJ298: =H298+100*O298 -> 390.13 | AK298: 410.7 | AL298: 367 | AM298: 310 | AN298: 367 | AO298: 9.1999999999999998e-002 | AP298: 19 | AQ298: 明泰转债!!
A299: 298 | B299: 113534 | C299: 鼎胜转债!! | D299: 603876 | E299: 鼎胜新材 | F299: 有色金属 | G299: 小金属 | H299: 270.89 | I299: 2.7900000000000001e-002 | J299: 1.72e-002 | K299: 40.44 | L299: 4.58e-002 | M299: 114.3 | N299: 15.18 | O299: 1.7000000000000001e-002 | P299: 266.4 | Q299: 已到 | R299: 3.33年 | S299: 1.33年 | T299: 4.04 | U299: 621 | V299: 0.57600000000000007 | W299: 2.1000000000000001e-002 | X299: 5.5e-002 | Y299: 196 | Z299: 4.2 | AA299: -0.23199999999999998 | AB299: -0.23699999999999999 | AC299: -0.39600000000000002 | AD299: -0.39700000000000002 | AE299: 94.14 | AF299: 94.18 | AG299: 0.98 | AH299: AA- | AI299: 6.13e-002 | AJ299: =H299+100*O299 -> 272.58999999999997 | AK299: 275.4 | AL299: 353 | AM299: 181.2 | AN299: 354 | AO299: -5.5e-002 | AP299: 28 | AQ299: 鼎胜转债!!
A300: 299 | B300: 113024 | C300: 核建转债! | D300: 601611 | E300: 中国核建 | F300: 建筑 | G300: 建筑工程 | H300: 125.75 | I300: 1.15e-002 | J300: -1.6399999999999998e-002 | K300: 9.58 | L300: -9.300000000000001e-003 | M300: 109.3 | N300: 9.7 | O300: 0.27300000000000002 | P300: 98.76 | Q300: 已到 | R300: 3.32年 | S300: 1.32年 | T300: 30 | U300: 37 | V300: 1.e-002 | W300: 0.11800000000000001 | X300: 0.11699999999999999 | Y300: 254 | Z300: 2.04 | AA300: -4.2199999999999994e-002 | AB300: -4.7e-002 | AC300: -0.115 | AD300: -0.11800000000000001 | AE300: 97.95 | AF300: 98.26 | AG300: 0.52 | AH300: AAA | AI300: 3.3300000000000003e-002 | AJ300: =H300+100*O300 -> 153.05000000000001 | AK300: 152.7 | AL300: 153 | AM300: 54.5 | AN300: 121 | AO300: 1.4999999999999999e-002 | AP300: 32 | AQ300: 核建转债!
A301: 300 | B301: 128063 | C301: 未来转债! | D301: 2631 | E301: 德尔未来 | F301: 其他 | G301: 家居用品 | H301: 120.1 | I301: 8.1000000000000013e-003 | J301: -1.06e-002 | K301: 7.56 | L301: -7.9000000000000008e-003 | M301: 127.5 | N301: 8.64 | O301: 0.373 | P301: 87.5 | Q301: 已到 | R301: 3.31年 | S301: 2.31年 | T301: 6.29 | U301: 19 | V301: 2.5000000000000001e-002 | W301: 0.126 | X301: 0.111 | Y301: 50 | Z301: 2.91 | AA301: 1.8799999999999997e-002 | AB301: 4.8999999999999998e-003 | AC301: -4.2300000000000004e-002 | AD301: -4.8099999999999997e-002 | AE301: 93.71 | AF301: 105.39 | AG301: 0.32 | AH301: AA- | AI301: 6.13e-002 | AJ301: =H301+100*O301 -> 157.39999999999998 | AK301: 152.7 | AL301: 152 | AM301: 47.3 | AN301: 74 | AO301: 1.2e-002 | AP301: 34 | AQ301: 未来转债!
A302: 301 | B302: 113532 | C302: 海环转债! | D302: 603817 | E302: 海峡环保 | F302: 城市公用 | G302: 三废处理 | H302: 107.26 | I302: -1.5e-003 | J302: 2.9999999999999997e-004 | K302: 5.83 | L302: -5.1000000000000004e-003 | M302: 112.3 | N302: 7.63 | O302: 0.40399999999999997 | P302: 76.41 | Q302: 已到 | R302: 3.31年 | S302: 1.31年 | T302: 4.59 | U302: 3.3 | V302: 6.9999999999999993e-003 | W302: 0.17499999999999999 | X302: 0.13400000000000001 | Y302: 26 | Z302: 1.44 | AA302: 1.43e-002 | AB302: 7.3000000000000001e-003 | AC302: -2.87e-002 | AD302: -3.2199999999999999e-002 | AE302: 97.04 | AF302: 98.83 | AG302: 0.23 | AH302: AA | AI302: 4.0300000000000002e-002 | AJ302: =H302+100*O302 -> 147.66 | AK302: 138.1 | AL302: 30 | AM302: 39.3 | AN302: 27 | AO302: -1.e-003 | AP302: 31 | AQ302: 海环转债!
A303: 302 | B303: 128062 | C303: 亚药转债! | D303: 2370 | E303: 亚太药业 | F303: 医药 | G303: 化学制药 | H303: 95.003 | I303: 8.0000000000000004e-004 | J303: -8.0000000000000004e-004 | K303: 4.11 | L303: -2.3999999999999998e-003 | M303: 119.3 | N303: 16.25 | O303: 2.7599999999999998 | P303: 25.29 | Q303: 已到 | R303: 3.31年 | S303: 1.31年 | T303: 9.63 | U303: 11 | V303: 1.2e-002 | W303: 0.43700000000000006 | X303: 0.11 | Y303: 22 | Z303: 6.1 | AA303: 7.2900000000000006e-002 | AB303: 6.1799999999999994e-002 | AC303: 5.5500000000000001e-002 | AD303: 5.1500000000000004e-002 | AE303: 81.52 | AF303: 71.4 | AG303: 0 | AH303: B | AI303: 0.17230000000000001 | AJ303: =H303+100*O303 -> 371.00299999999999 | AK303: 164.7 | AL303: 228 | AM303: 83.2 | AN303: 276 | AO303: -3.1e-002 | AP303: 91 | AQ303: 亚药转债!
A304: 303 | B304: 110057 | C304: 现代转债 | D304: 600420 | E304: 国药现代 | F304: 医药 | G304: 化学制药 | H304: 116.95 | I304: 5.9999999999999995e-004 | J304: -7.1999999999999998e-003 | K304: 9.43 | L304: -1.3600000000000001e-002 | M304: 110.3 | N304: 9.79 | O304: 0.214 | P304: 96.32 | Q304: 已到 | R304: 3.30年 | S304: 1.30年 | T304: 16.2 | U304: 6.6 | V304: 4.0000000000000001e-003 | W304: 0.16699999999999998 | X304: 0.161 | Y304: 97 | Z304: 1.15 | AA304: -1.7899999999999999e-002 | AB304: -2.35e-002 | AC304: -8.4700000000000011e-002 | AD304: -8.7899999999999992e-002 | AE304: 98.01 | AF304: 99.22 | AG304: 0.48 | AH304: AAA | AI304: 3.3300000000000003e-002 | AJ304: =H304+100*O304 -> 138.34999999999999 | AK304: 137.6 | AL304: 28 | AM304: 38.4 | AN304: 23 | AO304: -1.2e-002 | AP304: 23 | AQ304: 现代转债
A305: 304 | B305: 123025 | C305: 精测转债!! | D305: 300567 | E305: 精测电子 | F305: 电子 | G305: 液晶显示 | H305: 147.91 | I305: 2.5899999999999999e-002 | J305: 5.0000000000000001e-004 | K305: 61.2 | L305: 3.5000000000000003e-002 | M305: 116.5 | N305: 49.37 | O305: 0.193 | P305: 123.96 | Q305: 已到 | R305: 3.30年 | S305: 1.30年 | T305: 3.09 | U305: 79 | V305: 0.17300000000000001 | W305: 1.8000000000000002e-002 | X305: 2.2000000000000002e-002 | Y305: 170 | Z305: 5.27 | AA305: -7.1199999999999999e-002 | AB305: -7.9100000000000004e-002 | AC305: -0.19800000000000001 | AD305: -0.20100000000000001 | AE305: 94.34 | AF305: 96.17 | AG305: 0.75 | AH305: AA- | AI305: 6.13e-002 | AJ305: =H305+100*O305 -> 167.21000000000001 | AK305: 171.9 | AL305: 265 | AM305: 75.7 | AN305: 247 | AO305: 4.9000000000000002e-002 | AP305: 14 | AQ305: 精测转债!!
A306: 305 | B306: 113530 | C306: 大丰转债! | D306: 603081 | E306: 大丰实业 | F306: 建筑 | G306: 装饰工程 | H306: 114.55 | I306: 1.55e-002 | J306: -1.15e-002 | K306: 12.07 | L306: 2.9900000000000003e-002 | M306: 121 | N306: 16.3 | O306: 0.54700000000000004 | P306: 74.05 | Q306: 已到 | R306: 3.29年 | S306: 1.29年 | T306: 6.3 | U306: 7.9 | V306: 1.1000000000000001e-002 | W306: 0.128 | X306: 9.4e-002 | Y306: 49 | Z306: 2.07 | AA306: 1.72e-002 | AB306: 6.0000000000000001e-003 | AC306: -7.1500000000000008e-002 | AD306: -7.4999999999999997e-002 | AE306: 97.21 | AF306: 106.56 | AG306: 0.13 | AH306: AA | AI306: 4.0300000000000002e-002 | AJ306: =H306+100*O306 -> 169.25 | AK306: 155.1 | AL306: 169 | AM306: 48.5 | AN306: 79 | AO306: 2.8999999999999998e-002 | AP306: 29 | AQ306: 大丰转债!
A307: 306 | B307: 127012 | C307: 招路转债! | D307: 1965 | E307: 招商公路 | F307: 机场高速 | G307: 高速 | H307: 116.1 | I307: -7.4999999999999997e-003 | J307: -1.04e-002 | K307: 7.31 | L307: -5.6799999999999996e-002 | M307: 107.9 | N307: 8.63 | O307: 0.371 | P307: 84.7 | Q307: 已到 | R307: 3.28年 | S307: 1.28年 | T307: 50 | U307: 22 | V307: 4.0000000000000001e-003 | W307: 0.111 | X307: 9.4e-002 | Y307: 452 | Z307: 0.88 | AA307: -2.2400000000000003e-002 | AB307: -2.6800000000000001e-002 | AC307: -8.8399999999999992e-002 | AD307: -9.0399999999999994e-002 | AE307: 96.98 | AF307: 97.07 | AG307: 0.32 | AH307: AAA | AI307: 3.3300000000000003e-002 | AJ307: =H307+100*O307 -> 153.19999999999999 | AK307: 147.5 | AL307: 100 | AM307: 50.4 | AN307: 95 | AO307: -2.e-003 | AP307: 26 | AQ307: 招路转债!
A308: 307 | B308: 123024 | C308: 岱勒转债! | D308: 300700 | E308: 岱勒新材 | F308: 机械装备 | G308: 专用设备 | H308: 123.109 | I308: 1.34e-002 | J308: -6.5000000000000006e-003 | K308: 13.71 | L308: 1.41e-002 | M308: 112.5 | N308: 14.1 | O308: 0.26600000000000001 | P308: 97.23 | Q308: 已到 | R308: 2.27年 | S308: 0.27年 | T308: 2.1 | U308: 11 | V308: 4.4000000000000004e-002 | W308: 0.14300000000000002 | X308: 0.13900000000000001 | Y308: 15 | Z308: 3.1 | AA308: -3.9399999999999998e-002 | AB308: -4.8799999999999996e-002 | AC308: -0.42899999999999999 | AD308: -0.433 | AE308: 98.24 | AF308: 96.45 | AG308: 0.49 | AH308: A+ | AI308: 7.1099999999999997e-002 | AJ308: =H308+100*O308 -> 149.709 | AK308: 149 | AL308: 112 | AM308: 50.7 | AN308: 97 | AO308: -8.0000000000000002e-003 | AP308: 37 | AQ308: 岱勒转债!
A309: 308 | B309: 123023 | C309: 迪森转债! | D309: 300335 | E309: 迪森股份 | F309: 能源电力 | G309: 电力供应 | H309: 112.2 | I309: 5.7999999999999996e-003 | J309: -1.1000000000000001e-002 | K309: 5.66 | L309: -1.3899999999999999e-002 | M309: 114.3 | N309: 6.89 | O309: 0.36599999999999999 | P309: 82.15 | Q309: 已到 | R309: 3.27年 | S309: 2.27年 | T309: 5.29 | U309: 18 | V309: 3.1e-002 | W309: 0.251 | X309: 0.20600000000000002 | Y309: 21 | Z309: 1.55 | AA309: 5.7999999999999996e-003 | AB309: -2.0999999999999999e-003 | AC309: -2.86e-002 | AD309: -3.2099999999999997e-002 | AE309: 90.72 | AF309: 94.49 | AG309: 0.37 | AH309: AA- | AI309: 6.13e-002 | AJ309: =H309+100*O309 -> 148.80000000000001 | AK309: 142.3 | AL309: 51 | AM309: 47.8 | AN309: 76 | AO309: -1.8000000000000002e-002 | AP309: 50 | AQ309: 迪森转债!
A310: 309 | B310: 110056 | C310: 亨通转债! | D310: 600487 | E310: 亨通光电 | F310: 通信互联 | G310: 通信设备 | H310: 132.14 | I310: 9.8999999999999991e-003 | J310: -1.03e-002 | K310: 15.13 | L310: -7.000000000000001e-004 | M310: 114.3 | N310: 14.95 | O310: 0.30599999999999999 | P310: 101.2 | Q310: 已到 | R310: 3.27年 | S310: 1.27年 | T310: 17.1 | U310: 32 | V310: 1.3999999999999999e-002 | W310: 4.8000000000000001e-002 | X310: 4.8000000000000001e-002 | Y310: 357 | Z310: 1.73 | AA310: -4.4299999999999999e-002 | AB310: -5.16e-002 | AC310: -0.14699999999999999 | AD310: -0.14999999999999999 | AE310: 97.85 | AF310: 102.3 | AG310: 0.5 | AH310: AA+ | AI310: 3.5299999999999998e-002 | AJ310: =H310+100*O310 -> 162.73999999999998 | AK310: 163.1 | AL310: 222 | AM310: 60.8 | AN310: 157 | AO310: -6.6000000000000003e-002 | AP310: 24 | AQ310: 亨通转债!
A311: 310 | B311: 123022 | C311: 长信转债!! | D311: 300088 | E311: 长信科技 | F311: 通信互联 | G311: 通信设备 | H311: 233 | I311: 2.5499999999999998e-002 | J311: 6.5000000000000006e-003 | K311: 12.22 | L311: 3.3000000000000002e-002 | M311: 114.3 | N311: 6.05 | O311: 0.154 | P311: 201.98 | Q311: 已到 | R311: 3.27年 | S311: 1.27年 | T311: 2.57 | U311: 733 | V311: 1.23 | W311: 9.0000000000000011e-003 | X311: 1.7000000000000001e-002 | Y311: 300 | Z311: 3.98 | AA311: -0.19899999999999998 | AB311: -0.20499999999999999 | AC311: -0.374 | AD311: -0.375 | AE311: 97.2 | AF311: 100.75 | AG311: 0.97 | AH311: AA | AI311: 4.0300000000000002e-002 | AJ311: =H311+100*O311 -> 248.40000000000001 | AK311: 264 | AL311: 348 | AM311: 163.3 | AN311: 348 | AO311: 2.2000000000000002e-002 | AP311: 11 | AQ311: 长信转债!!
A312: 311 | B312: 110055 | C312: 伊力转债!! | D312: 600197 | E312: 伊力特 | F312: 食品饮料 | G312: 白酒 | H312: 216.53 | I312: 5.8999999999999999e-003 | J312: 6.0999999999999995e-003 | K312: 29.03 | L312: 1.26e-002 | M312: 114.3 | N312: 16.41 | O312: 0.22399999999999998 | P312: 176.9 | Q312: 已到 | R312: 3.26年 | S312: 1.26年 | T312: 2.44 | U312: 769 | V312: 1.46 | W312: 1.8000000000000002e-002 | X312: 3.1e-002 | Y312: 137 | Z312: 3.8 | AA312: -0.18100000000000002 | AB312: -0.187 | AC312: -0.35399999999999998 | AD312: -0.35499999999999998 | AE312: 97.23 | AF312: 100.78 | AG312: 0.96 | AH312: AA | AI312: 4.0300000000000002e-002 | AJ312: =H312+100*O312 -> 238.93000000000001 | AK312: 256.2 | AL312: 347 | AM312: 155.4 | AN312: 347 | AO312: 0.12 | AP312: 21 | AQ312: 伊力转债!!
A313: 312 | B313: 110053 | C313: 苏银转债! | D313: 600919 | E313: 江苏银行 | F313: 金融 | G313: 银行行业 | H313: 121.24 | I313: -5.4000000000000003e-003 | J313: 1.6000000000000001e-003 | K313: 6.03 | L313: -9.8999999999999991e-003 | M313: 118.3 | N313: 6.37 | O313: 0.28100000000000003 | P313: 94.66 | Q313: 已到 | R313: 3.26年 | S313: 无权 | T313: 200 | U313: 102 | V313: 4.0000000000000001e-003 | W313: 0.22500000000000001 | X313: 0.21299999999999999 | Y313: 891 | Z313: 0.61 | AA313: -7.8000000000000005e-003 | AB313: -1.7500000000000002e-002 | AC313: 无权 | AD313: 无权 | AE313: 无权 | AF313: 106.72 | AG313: 0.39 | AH313: AAA | AI313: 3.3300000000000003e-002 | AJ313: =H313+100*O313 -> 149.34 | AK313: 147.8 | AL313: 103 | AM313: 41.1 | AN313: 39 | AO313: -6.9999999999999993e-003 | AP313: 33 | AQ313: 苏银转债!
A314: 313 | B314: 127011 | C314: 中鼎转2!! | D314: 887 | E314: 中鼎股份 | F314: 汽车 | G314: 零部件制 | H314: 208 | I314: 3.5900000000000001e-002 | J314: -2.5399999999999999e-002 | K314: 21.11 | L314: 1.1000000000000001e-002 | M314: 114.5 | N314: 11.39 | O314: 0.122 | P314: 185.34 | Q314: 已到 | R314: 3.24年 | S314: 1.24年 | T314: 12 | U314: 131 | V314: 5.2999999999999999e-002 | W314: 4.7e-002 | X314: 8.5999999999999993e-002 | Y314: 258 | Z314: 2.8 | AA314: -0.17100000000000001 | AB314: -0.17699999999999999 | AC314: -0.34600000000000003 | AD314: -0.34700000000000003 | AE314: 97.99 | AF314: 102.59 | AG314: 0.96 | AH314: AA+ | AI314: 3.5299999999999998e-002 | AJ314: =H314+100*O314 -> 220.19999999999999 | AK314: 230.7 | AL314: 339 | AM314: 128.1 | AN314: 333 | AO314: 3.7000000000000005e-002 | AP314: 18 | AQ314: 中鼎转2!!
A315: 314 | B315: 110052 | C315: 贵广转债! | D315: 600996 | E315: 贵广网络 | F315: 传媒娱乐 | G315: 影视娱乐 | H315: 104.95 | I315: 1.2999999999999999e-003 | J315: -1.2999999999999999e-003 | K315: 4.52 | L315: 0. | M315: 117.7 | N315: 7.94 | O315: 0.84400000000000008 | P315: 56.93 | Q315: 已到 | R315: 3.23年 | S315: 1.23年 | T315: 15.3 | U315: 5.4 | V315: 3.0000000000000001e-003 | W315: 0.32100000000000001 | X315: 0.183 | Y315: 48 | Z315: 1.24 | AA315: 3.7000000000000005e-002 | AB315: 2.69e-002 | AC315: -1.32e-002 | AD315: -1.7399999999999999e-002 | AE315: 98.21 | AF315: 105.49 | AG315: 0.03 | AH315: AA+ | AI315: 3.5299999999999998e-002 | AJ315: =H315+100*O315 -> 189.35000000000002 | AK315: 153 | AL315: 155 | AM315: 47.5 | AN315: 75 | AO315: -2.e-002 | AP315: 26 | AQ315: 贵广转债!
A316: 315 | B316: 113021 | C316: 中信转债! | D316: 601998 | E316: 中信银行 | F316: 金融 | G316: 银行行业 | H316: 108.69 | I316: 0. | J316: -4.0000000000000002e-004 | K316: 4.56 | L316: -4.4000000000000003e-003 | M316: 118 | N316: 6.73 | O316: 0.60399999999999998 | P316: 67.76 | Q316: 已到 | R316: 3.23年 | S316: 无权 | T316: 400 | U316: 71 | V316: 2.e-003 | W316: 0.17899999999999999 | X316: 0.121 | Y316: 2231. | Z316: 0.45 | AA316: 2.6699999999999998e-002 | AB316: 1.6399999999999998e-002 | AC316: 无权 | AD316: 无权 | AE316: 无权 | AF316: 106.54 | AG316: 0.09 | AH316: AAA | AI316: 3.3300000000000003e-002 | AJ316: =H316+100*O316 -> 169.09 | AK316: 149.6 | AL316: 122 | AM316: 43.1 | AN316: 45 | AO316: 8.0000000000000002e-003 | AP316: 36 | AQ316: 中信转债!
A317: 316 | B317: 113528 | C317: 长城转债!! | D317: 603897 | E317: 长城科技 | F317: 机械装备 | G317: 专用设备 | H317: 266.18 | I317: -5.4000000000000003e-003 | J317: 3.9000000000000003e-003 | K317: 59.48 | L317: -1.5e-003 | M317: 116.8 | N317: 22.35 | O317: 0. | P317: 266.13 | Q317: 已到 | R317: 3.22年 | S317: 1.22年 | T317: 4.49 | U317: 240 | V317: 0.20100000000000001 | W317: 4.0999999999999995e-002 | X317: 0.10800000000000001 | Y317: 111 | Z317: 0 | AA317: -0.22899999999999998 | AB317: -0.23600000000000002 | AC317: -0.42599999999999999 | AD317: -0.42700000000000005 | AE317: 95.06 | AF317: 96.9 | AG317: 0.98 | AH317: AA- | AI317: 6.13e-002 | AJ317: =H317+100*O317 -> 266.18000000000001 | AK317: 266.2 | AL317: 350 | AM317: 169.3 | AN317: 350 | AO317: 3.2000000000000001e-002 | AP317: 31 | AQ317: 长城转债!!
A318: 317 | B318: 128056 | C318: 今飞转债! | D318: 2863 | E318: 今飞凯达 | F318: 汽车 | G318: 零部件制 | H318: 129.991 | I318: 8.0700000000000008e-002 | J318: -3.4599999999999999e-002 | K318: 6.18 | L318: 9.9600000000000008e-002 | M318: 120.2 | N318: 6.69 | O318: 0.40700000000000003 | P318: 92.38 | Q318: 已到 | R318: 3.22年 | S318: 1.22年 | T318: 1.72 | U318: 568 | V318: 2.52 | W318: 5.5999999999999994e-002 | X318: 5.2000000000000005e-002 | Y318: 31 | Z318: 1.63 | AA318: -2.46e-002 | AB318: -3.5000000000000003e-002 | AC318: -0.14199999999999999 | AD318: -0.14599999999999999 | AE318: 93.96 | AF318: 96.57 | AG318: 0.46 | AH318: A+ | AI318: 7.2300000000000003e-002 | AJ318: =H318+100*O318 -> 170.69100000000003 | AK318: 167.6 | AL318: 243 | AM318: 71 | AN318: 226 | AO318: 6.5000000000000002e-002 | AP318: 47 | AQ318: 今飞转债!
A319: 318 | B319: 110051 | C319: 中天转债!!* | D319: 600522 | E319: 中天科技 | F319: 通信互联 | G319: 通信设备 | H319: 170.02 | I319: 2.3700000000000002e-002 | J319: 2.2000000000000001e-003 | K319: 17.06 | L319: 2.5899999999999999e-002 | M319: 113.3 | N319: 9.99 | O319: -4.0000000000000001e-003 | P319: 170.77 | Q319: 已到 | R319: 6.1天 | S319: 无权 | T319: 11.3 | U319: 1705. | V319: 0.877 | W319: 2.2000000000000002e-002 | X319: 3.7000000000000005e-002 | Y319: 523 | Z319: 2.27 | AA319: <-100% | AB319: <-100% | AC319: 无权 | AD319: 无权 | AE319: 无权 | AF319: 100.75 | AG319: 1 | AH319: AA+ | AI319: 3.1200000000000002e-002 | AJ319: =H319+100*O319 -> 169.62 | AK319: 169.3 | AL319: 253 | AM319: 68.5 | AN319: 209 | AO319: -2.8999999999999998e-002 | AP319: 24 | AQ319: 中天转债!!*
A320: 319 | B320: 128053 | C320: 尚荣转债! | D320: 2551 | E320: 尚荣医疗 | F320: 医药 | G320: 医疗器械 | H320: 135.8 | I320: -3.4999999999999996e-003 | J320: 3.4999999999999996e-003 | K320: 5.01 | L320: -4.0000000000000001e-003 | M320: 114.3 | N320: 4.88 | O320: 0.32299999999999995 | P320: 102.66 | Q320: 已到 | R320: 3.18年 | S320: 1.18年 | T320: 1.9 | U320: 122 | V320: 0.46999999999999997 | W320: 4.4999999999999998e-002 | X320: 4.5999999999999999e-002 | Y320: 42 | Z320: 1.34 | AA320: -5.3800000000000001e-002 | AB320: -6.1200000000000004e-002 | AC320: -0.17499999999999999 | AD320: -0.17699999999999999 | AE320: 97.53 | AF320: 101.08 | AG320: 0 | AH320: AA | AI320: 4.0300000000000002e-002 | AJ320: =H320+100*O320 -> 168.10000000000002 | AK320: 168.9 | AL320: 248 | AM320: 67.9 | AN320: 206 | AO320: 1.2e-002 | AP320: 21 | AQ320: 尚荣转债!
A321: 320 | B321: 113527 | C321: 维格转债!! | D321: 603518 | E321: 锦泓集团 | F321: 服装纺织 | G321: 服装行业 | H321: 147.58 | I321: 1.1899999999999999e-002 | J321: 9.300000000000001e-003 | K321: 13.29 | L321: 2.7000000000000003e-002 | M321: 119.5 | N321: 9.85 | O321: 9.4e-002 | P321: 134.92 | Q321: 已到 | R321: 3年44天 | S321: 1年44天 | T321: 2.86 | U321: 532 | V321: 1.26 | W321: 7.2999999999999995e-002 | X321: 9.8000000000000004e-002 | Y321: 39 | Z321: 1.62 | AA321: -6.6600000000000006e-002 | AB321: -7.6399999999999996e-002 | AC321: -0.22899999999999998 | AD321: -0.23199999999999998 | AE321: 96.6 | AF321: 102.87 | AG321: 0.78 | AH321: AA | AI321: 5.0300000000000004e-002 | AJ321: =H321+100*O321 -> 156.98000000000002 | AK321: 160.2 | AL321: 196 | AM321: 57.4 | AN321: 136 | AO321: 4.2999999999999997e-002 | AP321: 68 | AQ321: 维格转债!!
A322: 321 | B322: 113526 | C322: 联泰转债! | D322: 603797 | E322: 联泰环保 | F322: 城市公用 | G322: 三废处理 | H322: 246.08 | I322: 4.1999999999999997e-003 | J322: -1.1200000000000002e-002 | K322: 6.81 | L322: -1.0200000000000001e-002 | M322: 110.3 | N322: 5.92 | O322: 1.1399999999999999 | P322: 115.03 | Q322: 已到 | R322: 3年43天 | S322: 1年43天 | T322: 1.93 | U322: 16 | V322: 3.4000000000000002e-002 | W322: 4.9000000000000002e-002 | X322: 5.5999999999999994e-002 | Y322: 40 | Z322: 1.57 | AA322: -0.23000000000000001 | AB322: -0.23399999999999999 | AC322: -0.442 | AD322: -0.44299999999999995 | AE322: 98.37 | AF322: 99.23 | AG322: 0.69 | AH322: AA+ | AI322: 3.5299999999999998e-002 | AJ322: =H322+100*O322 -> 360.07999999999998 | AK322: 377.1 | AL322: 365 | AM322: 277.9 | AN322: 365 | AO322: 0. | AP322: 7 | AQ322: 联泰转债!
A323: 322 | B323: 123018 | C323: 溢利转债! | D323: 300381 | E323: 溢多利 | F323: 医药 | G323: 原料药 | H323: 205.3 | I323: -4.5599999999999995e-002 | J323: 4.41e-002 | K323: 10.66 | L323: -1.9e-003 | M323: 114.3 | N323: 8.25 | O323: 0.58899999999999997 | P323: 129.21 | Q323: 已到 | R323: 3年9天 | S323: 1年9天 | T323: 0.54 | U323: 368 | V323: 3.2200000000000002 | W323: 1.e-002 | X323: 1.3000000000000001e-002 | Y323: 52 | Z323: 1.76 | AA323: -0.17899999999999999 | AB323: -0.185 | AC323: -0.41299999999999998 | AD323: -0.41499999999999998 | AE323: 95.84 | AF323: 95.89 | AG323: 0.81 | AH323: AA- | AI323: 6.13e-002 | AJ323: =H323+100*O323 -> 264.19999999999999 | AK323: 281.4 | AL323: 357 | AM323: 185.5 | AN323: 357 | AO323: 6.0000000000000001e-003 | AP323: 10 | AQ323: 溢利转债!
A324: 323 | B324: 113525 | C324: 台华转债!! | D324: 603055 | E324: 台华新材 | F324: 服装纺织 | G324: 纺织行业 | H324: 238.24 | I324: -2.0400000000000001e-002 | J324: 2.3199999999999998e-002 | K324: 17.45 | L324: 2.8999999999999998e-003 | M324: 114.3 | N324: 7.78 | O324: 6.2e-002 | P324: 224.29 | Q324: 已到 | R324: 3年6.1天 | S324: 1年6.1天 | T324: 1.83 | U324: 97 | V324: 0.22 | W324: 1.2e-002 | X324: 2.7000000000000003e-002 | Y324: 152 | Z324: 4.24 | AA324: -0.22 | AB324: -0.22600000000000001 | AC324: -0.47399999999999998 | AD324: -0.47499999999999998 | AE324: 98.16 | AF324: 101.74 | AG324: 0.98 | AH324: AA | AI324: 4.0300000000000002e-002 | AJ324: =H324+100*O324 -> 244.44 | AK324: 252.2 | AL324: 346 | AM324: 150.4 | AN324: 342 | AO324: -4.4999999999999998e-002 | AP324: 18 | AQ324: 台华转债!!
A325: 324 | B325: 113524 | C325: 奇精转债! | D325: 603677 | E325: 奇精机械 | F325: 家电 | G325: 零部件制 | H325: 119.15 | I325: 1.7100000000000001e-002 | J325: -1.1000000000000001e-002 | K325: 12.29 | L325: 1.5700000000000002e-002 | M325: 117.3 | N325: 13.98 | O325: 0.35499999999999998 | P325: 87.91 | Q325: 已到 | R325: 3年3.1天 | S325: 1年3.1天 | T325: 3.3 | U325: 6.1 | V325: 1.6e-002 | W325: 0.14000000000000001 | X325: 0.12300000000000001 | Y325: 24 | Z325: 2.32 | AA325: -5.3e-003 | AB325: -1.5300000000000001e-002 | AC325: -0.115 | AD325: -0.11900000000000001 | AE325: 95.94 | AF325: 98.49 | AG325: 0.38 | AH325: AA- | AI325: 6.13e-002 | AJ325: =H325+100*O325 -> 154.65000000000001 | AK325: 150.4 | AL325: 130 | AM325: 51.9 | AN325: 104 | AO325: 3.6000000000000004e-002 | AP325: 40 | AQ325: 奇精转债!
A326: 325 | B326: 128050 | C326: 钧达转债!! | D326: 2865 | E326: 钧达股份 | F326: 汽车 | G326: 零部件制 | H326: 434.73 | I326: -1.3300000000000001e-002 | J326: 1.7600000000000001e-002 | K326: 63.27 | L326: 4.3e-003 | M326: 122.7 | N326: 14.81 | O326: 1.8000000000000002e-002 | P326: 427.21 | Q326: 已到 | R326: 2.998年 | S326: 0.998年 | T326: 0.64 | U326: 788 | V326: 2.8300000000000001 | W326: 6.9999999999999993e-003 | X326: 3.1e-002 | Y326: 87 | Z326: 8.3 | AA326: -0.34899999999999998 | AB326: -0.35700000000000004 | AC326: -0.64700000000000002 | AD326: -0.64800000000000002 | AE326: 95.03 | AF326: 101.92 | AG326: 1 | AH326: AA- | AI326: 6.13e-002 | AJ326: =H326+100*O326 -> 436.53000000000003 | AK326: 442.2 | AL326: 370 | AM326: 340.3 | AN326: 370 | AO326: 5.9999999999999998e-002 | AP326: 45 | AQ326: 钧达转债!!
A327: 326 | B327: 110048 | C327: 福能转债!! | D327: 600483 | E327: 福能股份 | F327: 能源电力 | G327: 电力供应 | H327: 242.72 | I327: -1.34e-002 | J327: -2.92e-002 | K327: 16.52 | L327: -4.3400000000000001e-002 | M327: 112.3 | N327: 7.85 | O327: 0.153 | P327: 210.45 | Q327: 已到 | R327: 2.99年 | S327: 0.99年 | T327: 12.8 | U327: 266 | V327: 8.5999999999999993e-002 | W327: 4.0000000000000001e-002 | X327: 8.5000000000000006e-002 | Y327: 317 | Z327: 4.07 | AA327: -0.23000000000000001 | AB327: -0.23499999999999999 | AC327: -0.49399999999999999 | AD327: -0.496 | AE327: 97.94 | AF327: 101.74 | AG327: 0.98 | AH327: AA+ | AI327: 3.4099999999999998e-002 | AJ327: =H327+100*O327 -> 258.01999999999998 | AK327: 275 | AL327: 352 | AM327: 173.3 | AN327: 351 | AO327: 7.8e-002 | AP327: 9 | AQ327: 福能转债!!
A328: 327 | B328: 128049 | C328: 华源转债! | D328: 2787 | E328: 华源控股 | F328: 造纸包装 | G328: 包装材料 | H328: 109.92 | I328: 2.8999999999999998e-003 | J328: 7.000000000000001e-004 | K328: 5.75 | L328: 1.23e-002 | M328: 113.5 | N328: 7.37 | O328: 0.40899999999999997 | P328: 78.02 | Q328: 已到 | R328: 2.96年 | S328: 0.96年 | T328: 3.63 | U328: 4 | V328: 1.e-002 | W328: 0.20000000000000001 | X328: 0.156 | Y328: 18 | Z328: 1.18 | AA328: 1.1000000000000001e-002 | AB328: 2.7000000000000001e-003 | AC328: -6.5599999999999992e-002 | AD328: -6.8600000000000008e-002 | AE328: 95.36 | AF328: 95.74 | AG328: 0.29 | AH328: AA- | AI328: 6.0100000000000001e-002 | AJ328: =H328+100*O328 -> 150.81999999999999 | AK328: 141.8 | AL328: 46 | AM328: 46.1 | AN328: 63 | AO328: -1.e-003 | AP328: 41 | AQ328: 华源转债!
A329: 328 | B329: 110047 | C329: 山鹰转债 | D329: 600567 | E329: 山鹰国际 | F329: 造纸包装 | G329: 包装用纸 | H329: 119.8 | I329: -2.3e-003 | J329: -1.4000000000000002e-003 | K329: 3.25 | L329: -9.1000000000000004e-003 | M329: 116.5 | N329: 3.3 | O329: 0.21600000000000003 | P329: 98.48 | Q329: 已到 | R329: 2.95年 | S329: 0.95年 | T329: 22.5 | U329: 23 | V329: 9.0000000000000011e-003 | W329: 0.14999999999999999 | X329: 0.14699999999999999 | Y329: 150 | Z329: 0.93 | AA329: -9.5999999999999992e-003 | AB329: -1.9299999999999998e-002 | AC329: -0.13300000000000001 | AD329: -0.13600000000000001 | AE329: 98.11 | AF329: 105.7 | AG329: 0.41 | AH329: AA+ | AI329: 3.4099999999999998e-002 | AJ329: =H329+100*O329 -> 141.40000000000001 | AK329: 141.1 | AL329: 42 | AM329: 35.4 | AN329: 19 | AO329: 4.0000000000000001e-003 | AP329: 27 | AQ329: 山鹰转债
A330: 329 | B330: 128048 | C330: 张行转债 | D330: 2839 | E330: 张家港行 | F330: 金融 | G330: 银行行业 | H330: 124.3 | I330: -4.1999999999999997e-003 | J330: -2.e-003 | K330: 5.77 | L330: -1.2e-002 | M330: 112.3 | N330: 5.6 | O330: 0.20600000000000002 | P330: 103.04 | Q330: 已到 | R330: 2.92年 | S330: 无权 | T330: 25 | U330: 20 | V330: 6.9999999999999993e-003 | W330: 0.23899999999999999 | X330: 0.247 | Y330: 104 | Z330: 0.9 | AA330: -3.4599999999999999e-002 | AB330: -4.1900000000000007e-002 | AC330: 无权 | AD330: 无权 | AE330: 无权 | AF330: 101.97 | AG330: 0.52 | AH330: AA+ | AI330: 3.4099999999999998e-002 | AJ330: =H330+100*O330 -> 144.90000000000001 | AK330: 145.6 | AL330: 81 | AM330: 43.6 | AN330: 50 | AO330: 5.0000000000000001e-003 | AP330: 11 | AQ330: 张行转债
A331: 330 | B331: 113519 | C331: 长久转债! | D331: 603569 | E331: 长久物流 | F331: 交通运输 | G331: 物流业 | H331: 109.94 | I331: 5.0000000000000001e-004 | J331: 2.9999999999999997e-004 | K331: 6.71 | L331: 1.67e-002 | M331: 118.3 | N331: 11.04 | O331: 0.80900000000000005 | P331: 60.78 | Q331: 已到 | R331: 2.91年 | S331: 0.91年 | T331: 6.97 | U331: 6.8 | V331: 9.0000000000000011e-003 | W331: 0.185 | X331: 0.113 | Y331: 38 | Z331: 1.77 | AA331: 2.5899999999999999e-002 | AB331: 1.47e-002 | AC331: -6.93e-002 | AD331: -7.2300000000000003e-002 | AE331: 97.7 | AF331: 105.99 | AG331: 0.04 | AH331: AA | AI331: 3.9100000000000003e-002 | AJ331: =H331+100*O331 -> 190.84 | AK331: 159.1 | AL331: 191 | AM331: 53.1 | AN331: 113 | AO331: 3.4000000000000002e-002 | AP331: 24 | AQ331: 长久转债!
A332: 331 | B332: 128046 | C332: 利尔转债!! | D332: 2258 | E332: 利尔化学 | F332: 化工 | G332: 农化 | H332: 178.5 | I332: 2.53e-002 | J332: -7.0999999999999995e-003 | K332: 30.32 | L332: 1.9199999999999998e-002 | M332: 111.3 | N332: 18.42 | O332: 8.4000000000000005e-002 | P332: 164.6 | Q332: 已到 | R332: 2.85年 | S332: 0.85年 | T332: 8.08 | U332: 225 | V332: 0.156 | W332: 5.0999999999999997e-002 | X332: 8.3000000000000004e-002 | Y332: 160 | Z332: 3.69 | AA332: -0.155 | AB332: -0.16 | AC332: -0.42299999999999999 | AD332: -0.42399999999999999 | AE332: 97.92 | AF332: 99.95 | AG332: 0.95 | AH332: AA | AI332: 3.9100000000000003e-002 | AJ332: =H332+100*O332 -> 186.90000000000001 | AK332: 192.4 | AL332: 310 | AM332: 92.4 | AN332: 296 | AO332: 3.7999999999999999e-002 | AP332: 8 | AQ332: 利尔转债!!
A333: 332 | B333: 128044 | C333: 岭南转债! | D333: 2717 | E333: 岭南股份 | F333: 城市公用 | G333: 生态环境 | H333: 117.299 | I333: 1.77e-002 | J333: -3.9000000000000003e-003 | K333: 3.19 | L333: 2.8999999999999998e-002 | M333: 110.3 | N333: 3.43 | O333: 0.26100000000000001 | P333: 93 | Q333: 已到 | R333: 2.67年 | S333: 0.67年 | T333: 6.59 | U333: 60 | V333: 7.8e-002 | W333: 0.12300000000000001 | X333: 0.114 | Y333: 54 | Z333: 1.14 | AA333: -2.3099999999999999e-002 | AB333: -2.9999999999999999e-002 | AC333: -0.161 | AD333: -0.16399999999999998 | AE333: 96.94 | AF333: 94.61 | AG333: 0.48 | AH333: AA- | AI333: 6.0100000000000001e-002 | AJ333: =H333+100*O333 -> 143.399 | AK333: 141.6 | AL333: 45 | AM333: 44.7 | AN333: 57 | AO333: -3.2000000000000001e-002 | AP333: 55 | AQ333: 岭南转债!
A334: 333 | B334: 123015 | C334: 蓝盾转债!! | D334: 300297 | E334: 蓝盾股份 | F334: 计算机及 | G334: 软件开发 | H334: 236.659 | I334: -7.7000000000000002e-003 | J334: 7.7000000000000002e-003 | K334: 3.5 | L334: -1.6899999999999998e-002 | M334: 111.3 | N334: 5.79 | O334: 2.9199999999999999 | P334: 60.45 | Q334: 已到 | R334: 2.67年 | S334: 0.67年 | T334: 1 | U334: 96 | V334: 0.40500000000000003 | W334: 2.3e-002 | X334: 1.3999999999999999e-002 | Y334: 44 | Z334: 2.46 | AA334: -0.249 | AB334: -0.254 | AC334: -0.69200000000000006 | AD334: -0.69400000000000006 | AE334: 92.52 | AF334: 82.45 | AG334: 0 | AH334: BBB- | AI334: 0.1211 | AJ334: =H334+100*O334 -> 528.65899999999999 | AK334: 412.9 | AL334: 368 | AM334: 320.3 | AN334: 368 | AO334: -2.7000000000000003e-002 | AP334: 14 | AQ334: 蓝盾转债!!
A335: 334 | B335: 113516 | C335: 苏农转债! | D335: 603323 | E335: 苏农银行 | F335: 金融 | G335: 银行行业 | H335: 117.65 | I335: -1.2999999999999999e-003 | J335: -3.5999999999999999e-003 | K335: 4.9 | L335: -1.41e-002 | M335: 113.3 | N335: 5.37 | O335: 0.28899999999999998 | P335: 91.25 | Q335: 已到 | R335: 2.64年 | S335: 无权 | T335: 12.9 | U335: 6.4 | V335: 4.0000000000000001e-003 | W335: 0.14599999999999999 | X335: 0.13300000000000001 | Y335: 88 | Z335: 0.69 | AA335: -1.44e-002 | AB335: -2.3300000000000001e-002 | AC335: 无权 | AD335: 无权 | AE335: 无权 | AF335: 103.85 | AG335: 0.34 | AH335: AA+ | AI335: 3.4099999999999998e-002 | AJ335: =H335+100*O335 -> 146.55000000000001 | AK335: 144.1 | AL335: 66 | AM335: 40.2 | AN335: 31 | AO335: 8.0000000000000002e-003 | AP335: 24 | AQ335: 苏农转债!
A336: 335 | B336: 123014 | C336: 凯发转债! | D336: 300407 | E336: 凯发电气 | F336: 能源电力 | G336: 电力设备 | H336: 136.9 | I336: 2.3199999999999998e-002 | J336: 9.4999999999999998e-003 | K336: 8.68 | L336: 5.0799999999999998e-002 | M336: 107.5 | N336: 8.05 | O336: 0.27000000000000002 | P336: 107.83 | Q336: 已到 | R336: 1.62年 | S336: 回售内 | T336: 1.16 | U336: 181 | V336: 1.1299999999999999 | W336: 4.4000000000000004e-002 | X336: 4.7e-002 | Y336: 26 | Z336: 1.91 | AA336: -0.13900000000000001 | AB336: -0.14699999999999999 | AC336: 回售内 | AD336: 回售内 | AE336: 100.25 | AF336: 96.24 | AG336: 0.64 | AH336: A+ | AI336: 7.1099999999999997e-002 | AJ336: =H336+100*O336 -> 163.90000000000001 | AK336: 166 | AL336: 238 | AM336: 65.7 | AN336: 189 | AO336: 3.2000000000000001e-002 | AP336: 15 | AQ336: 凯发转债!
A337: 336 | B337: 128042 | C337: 凯中转债! | D337: 2823 | E337: 凯中精密 | F337: 能源电力 | G337: 电力设备 | H337: 117.58 | I337: 1.72e-002 | J337: -1.2199999999999999e-002 | K337: 11.07 | L337: 1.9299999999999998e-002 | M337: 115.3 | N337: 12.86 | O337: 0.36599999999999999 | P337: 86.08 | Q337: 已到 | R337: 2.63年 | S337: 0.63年 | T337: 4.16 | U337: 9.2 | V337: 1.9e-002 | W337: 0.13100000000000001 | X337: 0.113 | Y337: 32 | Z337: 2.42 | AA337: -7.4999999999999997e-003 | AB337: -1.77e-002 | AC337: -0.17199999999999999 | AD337: -0.17600000000000002 | AE337: 98.73 | AF337: 104.39 | AG337: 0.26 | AH337: AA | AI337: 3.9100000000000003e-002 | AJ337: =H337+100*O337 -> 154.18000000000001 | AK337: 149.1 | AL337: 113 | AM337: 44.7 | AN337: 58 | AO337: -2.1000000000000001e-002 | AP337: 24 | AQ337: 凯中转债!
A338: 337 | B338: 123013 | C338: 横河转债! | D338: 300539 | E338: 横河精密 | F338: 机械装备 | G338: 专用设备 | H338: 319 | I338: 2.12e-002 | J338: -1.7100000000000001e-002 | K338: 7.83 | L338: 1.03e-002 | M338: 114 | N338: 9.04 | O338: 2.6800000000000002 | P338: 86.62 | Q338: 已到 | R338: 2.62年 | S338: 0.62年 | T338: 0.38 | U338: 76 | V338: 0.63100000000000001 | W338: 2.2000000000000002e-002 | X338: 1.9e-002 | Y338: 17 | Z338: 3.53 | AA338: -0.32799999999999996 | AB338: -0.33399999999999996 | AC338: -0.88099999999999989 | AD338: -0.88300000000000001 | AE338: 96.8 | AF338: 95.56 | AG338: 0.39 | AH338: A+ | AI338: 7.1099999999999997e-002 | AJ338: =H338+100*O338 -> 587. | AK338: 551.4 | AL338: 379 | AM338: 454.6 | AN338: 379 | AO338: 6.9999999999999993e-003 | AP338: 12 | AQ338: 横河转债!
A339: 338 | B339: 123012 | C339: 万顺转债! | D339: 300057 | E339: 万顺新材 | F339: 有色金属 | G339: 铝金属 | H339: 189 | I339: 3.8699999999999998e-002 | J339: 2.29e-002 | K339: 9.71 | L339: 6.3500000000000001e-002 | M339: 109.3 | N339: 5.27 | O339: 2.6000000000000002e-002 | P339: 184.25 | Q339: 已到 | R339: 2.61年 | S339: 0.61年 | T339: 1.23 | U339: 303 | V339: 1.3100000000000001 | W339: 1.9e-002 | X339: 3.4000000000000002e-002 | Y339: 66 | Z339: 1.84 | AA339: -0.192 | AB339: -0.19699999999999998 | AC339: -0.61199999999999999 | AD339: -0.61499999999999999 | AE339: 97.33 | AF339: 94.13 | AG339: 0.97 | AH339: AA- | AI339: 6.0100000000000001e-002 | AJ339: =H339+100*O339 -> 191.59999999999999 | AK339: 193.7 | AL339: 312 | AM339: 96.4 | AN339: 306 | AO339: 3.7999999999999999e-002 | AP339: 23 | AQ339: 万顺转债!
A340: 339 | B340: 123011 | C340: 德尔转债! | D340: 300473 | E340: 德尔股份 | F340: 汽车 | G340: 零部件制 | H340: 121.957 | I340: 2.4799999999999999e-002 | J340: -2.2799999999999997e-002 | K340: 24.09 | L340: 9.5999999999999992e-003 | M340: 115.3 | N340: 31.38 | O340: 0.58899999999999997 | P340: 76.77 | Q340: 已到 | R340: 2.60年 | S340: 0.60年 | T340: 2.51 | U340: 52 | V340: 0.17100000000000001 | W340: 7.6999999999999999e-002 | X340: 5.9000000000000004e-002 | Y340: 33 | Z340: 1.53 | AA340: -2.1700000000000001e-002 | AB340: -3.1800000000000002e-002 | AC340: -0.222 | AD340: -0.22600000000000001 | AE340: 97.36 | AF340: 99.32 | AG340: 0.21 | AH340: AA- | AI340: 6.0100000000000001e-002 | AJ340: =H340+100*O340 -> 180.857 | AK340: 167.1 | AL340: 242 | AM340: 67.8 | AN340: 205 | AO340: -2.4e-002 | AP340: 38 | AQ340: 德尔转债!
A341: 340 | B341: 128041 | C341: 盛路转债!! | D341: 2446 | E341: 盛路通信 | F341: 通信互联 | G341: 通信设备 | H341: 279.6 | I341: -4.0000000000000002e-004 | J341: 4.0000000000000002e-004 | K341: 6.77 | L341: 7.4000000000000003e-003 | M341: 113.3 | N341: 6.82 | O341: 1.8200000000000001 | P341: 99.27 | Q341: 已到 | R341: 2.60年 | S341: 0.60年 | T341: 0.53 | U341: 49 | V341: 0.32899999999999996 | W341: 9.0000000000000011e-003 | X341: 9.0000000000000011e-003 | Y341: 62 | Z341: 2.01 | AA341: -0.29699999999999999 | AB341: -0.30299999999999999 | AC341: -0.85299999999999998 | AD341: -0.85499999999999998 | AE341: 98.87 | AF341: 102.73 | AG341: 0 | AH341: AA | AI341: 3.9100000000000003e-002 | AJ341: =H341+100*O341 -> 461.60000000000002 | AK341: 459.9 | AL341: 373 | AM341: 357.2 | AN341: 373 | AO341: 2.9999999999999999e-002 | AP341: 11 | AQ341: 盛路转债!!
A342: 341 | B342: 110045 | C342: 海澜转债! | D342: 600398 | E342: 海澜之家 | F342: 服装纺织 | G342: 服装行业 | H342: 116.47 | I342: -2.0000000000000001e-004 | J342: 4.1999999999999997e-003 | K342: 6.53 | L342: 1.0800000000000001e-002 | M342: 110.3 | N342: 7.04 | O342: 0.25600000000000001 | P342: 92.76 | Q342: 已到 | R342: 2.59年 | S342: 0.59年 | T342: 29.5 | U342: 17 | V342: 5.0000000000000001e-003 | W342: 0.105 | X342: 9.6999999999999989e-002 | Y342: 282 | Z342: 2 | AA342: -2.1099999999999997e-002 | AB342: -2.8199999999999999e-002 | AC342: -0.17899999999999999 | AD342: -0.182 | AE342: 98.7 | AF342: 101.24 | AG342: 0.37 | AH342: AA+ | AI342: 3.4099999999999998e-002 | AJ342: =H342+100*O342 -> 142.06999999999999 | AK342: 140.2 | AL342: 36 | AM342: 38.9 | AN342: 25 | AO342: 2.1000000000000001e-002 | AP342: 43 | AQ342: 海澜转债!
A343: 342 | B343: 123010 | C343: 博世转债! | D343: 300422 | E343: 博世科 | F343: 城市公用 | G343: 三废处理 | H343: 110.168 | I343: 4.6999999999999993e-003 | J343: -6.4000000000000003e-003 | K343: 8.59 | L343: -6.8999999999999999e-003 | M343: 111.3 | N343: 11.26 | O343: 0.44400000000000001 | P343: 76.29 | Q343: 已到 | R343: 2.56年 | S343: 0.56年 | T343: 4.3 | U343: 1.9 | V343: 4.0000000000000001e-003 | W343: 9.9000000000000005e-002 | X343: 7.5999999999999998e-002 | Y343: 43 | Z343: 1.34 | AA343: 4.0999999999999995e-003 | AB343: -4.0999999999999995e-003 | AC343: -0.10800000000000001 | AD343: -0.113 | AE343: 97.56 | AF343: 96.08 | AG343: 0.23 | AH343: AA- | AI343: 6.0100000000000001e-002 | AJ343: =H343+100*O343 -> 154.56800000000001 | AK343: 144 | AL343: 65 | AM343: 46.5 | AN343: 68 | AO343: -1.e-002 | AP343: 32 | AQ343: 博世转债!
A344: 343 | B344: 127007 | C344: 湖广转债! | D344: 665 | E344: 湖北广电 | F344: 传媒娱乐 | G344: 影视娱乐 | H344: 105.111 | I344: 3.4000000000000002e-003 | J344: -1.7000000000000001e-003 | K344: 3.6 | L344: 3.15e-002 | M344: 111.3 | N344: 5.58 | O344: 0.629 | P344: 64.52 | Q344: 已到 | R344: 2.55年 | S344: 0.55年 | T344: 12.2 | U344: 17 | V344: 1.3999999999999999e-002 | W344: 0.34399999999999997 | X344: 0.222 | Y344: 35 | Z344: 0.62 | AA344: 2.3099999999999999e-002 | AB344: 1.47e-002 | AC344: -4.41e-002 | AD344: -4.8799999999999996e-002 | AE344: 99.41 | AF344: 102.35 | AG344: 0.05 | AH344: AA+ | AI344: 3.4099999999999998e-002 | AJ344: =H344+100*O344 -> 168.011 | AK344: 145.7 | AL344: 83 | AM344: 43.4 | AN344: 46 | AO344: 2.e-003 | AP344: 27 | AQ344: 湖广转债!
A345: 344 | B345: 110044 | C345: 广电转债!! | D345: 600831 | E345: 广电网络 | F345: 传媒娱乐 | G345: 影视娱乐 | H345: 206.94 | I345: 1.1999999999999999e-003 | J345: 7.000000000000001e-004 | K345: 5.38 | L345: 9.3999999999999986e-003 | M345: 111.3 | N345: 6.87 | O345: 1.6399999999999999 | P345: 78.31 | Q345: 已到 | R345: 2.54年 | S345: 0.54年 | T345: 0.71 | U345: 15 | V345: 0.105 | W345: 1.9e-002 | X345: 1.4999999999999999e-002 | Y345: 38 | Z345: 1.02 | AA345: -0.21899999999999997 | AB345: -0.22500000000000001 | AC345: -0.7390000000000001 | AD345: -0.74099999999999999 | AE345: 99.08 | AF345: 101.13 | AG345: 0.19 | AH345: AA | AI345: 3.9100000000000003e-002 | AJ345: =H345+100*O345 -> 370.94 | AK345: 335.6 | AL345: 364 | AM345: 234.4 | AN345: 364 | AO345: 3.0000000000000001e-003 | AP345: 9 | AQ345: 广电转债!!
A346: 345 | B346: 128040 | C346: 华通转债! | D346: 2758 | E346: 浙农股份 | F346: 医药 | G346: 医药商业 | H346: 122.958 | I346: 1.3300000000000001e-002 | J346: -2.0999999999999999e-003 | K346: 10.44 | L346: 2.1499999999999998e-002 | M346: 111.3 | N346: 10.15 | O346: 0.19500000000000001 | P346: 102.86 | Q346: 已到 | R346: 2.51年 | S346: 0.51年 | T346: 2.22 | U346: 8.9 | V346: 3.3000000000000002e-002 | W346: 4.4000000000000004e-002 | X346: 4.4999999999999998e-002 | Y346: 51 | Z346: 1.56 | AA346: -3.9599999999999996e-002 | AB346: -4.7400000000000005e-002 | AC346: -0.26600000000000001 | AD346: -0.27000000000000002 | AE346: 99.21 | AF346: 101.27 | AG346: 0.52 | AH346: AA | AI346: 3.9100000000000003e-002 | AJ346: =H346+100*O346 -> 142.458 | AK346: 143.1 | AL346: 58 | AM346: 41.8 | AN346: 41 | AO346: 1.8000000000000002e-002 | AP346: 31 | AQ346: 华通转债!
A347: 346 | B347: 128039 | C347: 三力转债! | D347: 2224 | E347: 三 力 士 | F347: 机械装备 | G347: 专用设备 | H347: 117 | I347: 8.6e-003 | J347: -8.6e-003 | K347: 5 | L347: 0. | M347: 108.8 | N347: 5.79 | O347: 0.35499999999999998 | P347: 86.36 | Q347: 已到 | R347: 2.49年 | S347: 0.49年 | T347: 2.02 | U347: 6.6 | V347: 2.7999999999999997e-002 | W347: 5.5e-002 | X347: 4.8000000000000001e-002 | Y347: 36 | Z347: 1.53 | AA347: -2.92e-002 | AB347: -3.5499999999999997e-002 | AC347: -0.20999999999999999 | AD347: -0.214 | AE347: 97.74 | AF347: 94.3 | AG347: 0.36 | AH347: AA- | AI347: 6.0100000000000001e-002 | AJ347: =H347+100*O347 -> 152.5 | AK347: 147.6 | AL347: 101 | AM347: 49.9 | AN347: 91 | AO347: -9.0000000000000011e-003 | AP347: 29 | AQ347: 三力转债!
A348: 347 | B348: 128036 | C348: 金农转债!! | D348: 2548 | E348: 金新农 | F348: 农业 | G348: 畜牧业 | H348: 121.6 | I348: 2.3e-003 | J348: -8.0000000000000004e-004 | K348: 5.68 | L348: 7.0999999999999995e-003 | M348: 109.3 | N348: 6.93 | O348: 0.48399999999999999 | P348: 81.96 | Q348: 已到 | R348: 2.24年 | S348: 0.24年 | T348: 1.46 | U348: 6.2 | V348: 3.5000000000000003e-002 | W348: 3.7000000000000005e-002 | X348: 2.9999999999999999e-002 | Y348: 39 | Z348: 1.68 | AA348: -4.7300000000000002e-002 | AB348: -5.45e-002 | AC348: -0.42700000000000005 | AD348: -0.434 | AE348: 99.42 | AF348: 96.16 | AG348: 0.21 | AH348: AA- | AI348: 6.0100000000000001e-002 | AJ348: =H348+100*O348 -> 170. | AK348: 161.2 | AL348: 208 | AM348: 61.8 | AN348: 167 | AO348: -1.e-002 | AP348: 16 | AQ348: 金农转债!!
A349: 348 | B349: 128037 | C349: 岩土转债! | D349: 2542 | E349: 中化岩土 | F349: 建筑 | G349: 建筑工程 | H349: 110.98 | I349: 5.0000000000000001e-003 | J349: -2.9999999999999997e-004 | K349: 2.81 | L349: 1.44e-002 | M349: 111.3 | N349: 3.1 | O349: 0.22399999999999998 | P349: 90.65 | Q349: 已到 | R349: 2.26年 | S349: 0.26年 | T349: 5.99 | U349: 16 | V349: 2.4e-002 | W349: 0.11800000000000001 | X349: 0.107 | Y349: 51 | Z349: 1.28 | AA349: 1.2999999999999999e-003 | AB349: -7.9000000000000008e-003 | AC349: -0.20999999999999999 | AD349: -0.218 | AE349: 100.17 | AF349: 102.24 | AG349: 0.32 | AH349: AA | AI349: 3.9100000000000003e-002 | AJ349: =H349+100*O349 -> 133.38 | AK349: 131.3 | AL349: 13 | AM349: 29.1 | AN349: 5 | AO349: 2.2000000000000002e-002 | AP349: 54 | AQ349: 岩土转债!
A350: 349 | B350: 127006 | C350: 敖东转债! | D350: 623 | E350: 吉林敖东 | F350: 金融 | G350: 证券行业 | H350: 116.98 | I350: -2.7000000000000001e-003 | J350: -7.000000000000001e-004 | K350: 17.28 | L350: -1.26e-002 | M350: 107.4 | N350: 20.22 | O350: 0.36899999999999999 | P350: 85.46 | Q350: 已到 | R350: 2.25年 | S350: 0.25年 | T350: 24.1 | U350: 9.7 | V350: 3.0000000000000001e-003 | W350: 0.12 | X350: 0.10199999999999999 | Y350: 201 | Z350: 0.83 | AA350: -3.7699999999999997e-002 | AB350: -4.36e-002 | AC350: -0.34700000000000003 | AD350: -0.35100000000000003 | AE350: 99.66 | AF350: 99.69 | AG350: 0.27 | AH350: AA+ | AI350: 3.4099999999999998e-002 | AJ350: =H350+100*O350 -> 153.88 | AK350: 148.5 | AL350: 108 | AM350: 48.8 | AN350: 80 | AO350: 3.1e-002 | AP350: 26 | AQ350: 敖东转债!
A351: 350 | B351: 127005 | C351: 长证转债! | D351: 783 | E351: 长江证券 | F351: 金融 | G351: 证券行业 | H351: 128.9 | I351: -5.9999999999999995e-004 | J351: -4.0000000000000001e-003 | K351: 7.47 | L351: -8.0000000000000002e-003 | M351: 108.3 | N351: 7.13 | O351: 0.23000000000000001 | P351: 104.77 | Q351: 已到 | R351: 2.25年 | S351: 无权 | T351: 50 | U351: 35 | V351: 5.0000000000000001e-003 | W351: 0.121 | X351: 0.127 | Y351: 413 | Z351: 1.4 | AA351: -7.5800000000000006e-002 | AB351: -8.199999999999999e-002 | AC351: 无权 | AD351: 无权 | AE351: 无权 | AF351: 101.01 | AG351: 0.57 | AH351: AAA | AI351: 3.2099999999999997e-002 | AJ351: =H351+100*O351 -> 151.90000000000001 | AK351: 153 | AL351: 156 | AM351: 52 | AN351: 108 | AO351: 2.3e-002 | AP351: 12 | AQ351: 长证转债!
A352: 351 | B352: 113505 | C352: 杭电转债! | D352: 603618 | E352: 杭电股份 | F352: 能源电力 | G352: 电力设备 | H352: 121.11 | I352: 1.0800000000000001e-002 | J352: -7.4000000000000003e-003 | K352: 7.07 | L352: 7.0999999999999995e-003 | M352: 111.3 | N352: 7.08 | O352: 0.21299999999999999 | P352: 99.86 | Q352: 已到 | R352: 2.23年 | S352: 0.23年 | T352: 7.5 | U352: 16 | V352: 1.8000000000000002e-002 | W352: 0.153 | X352: 0.153 | Y352: 49 | Z352: 1.85 | AA352: -3.78e-002 | AB352: -4.6600000000000003e-002 | AC352: -0.42700000000000005 | AD352: -0.435 | AE352: 100.26 | AF352: 102.34 | AG352: 0.48 | AH352: AA | AI352: 3.9100000000000003e-002 | AJ352: =H352+100*O352 -> 142.41 | AK352: 142.4 | AL352: 53 | AM352: 40 | AN352: 29 | AO352: -0.10800000000000001 | AP352: 45 | AQ352: 杭电转债!
A353: 352 | B353: 113504 | C353: 艾华转债!! | D353: 603989 | E353: 艾华集团 | F353: 电子 | G353: 元器件制 | H353: 205.02 | I353: -6.8000000000000005e-003 | J353: 8.9999999999999998e-004 | K353: 39.62 | L353: -6.0000000000000001e-003 | M353: 109.3 | N353: 20.81 | O353: 7.6999999999999999e-002 | P353: 190.39 | Q353: 已到 | R353: 2.22年 | S353: 0.22年 | T353: 4.63 | U353: 53 | V353: 5.5999999999999994e-002 | W353: 2.8999999999999998e-002 | X353: 5.5999999999999994e-002 | Y353: 159 | Z353: 5.57 | AA353: -0.25 | AB353: -0.255 | AC353: <-100% | AD353: <-100% | AE353: 100.3 | AF353: 100.54 | AG353: 0.98 | AH353: AA | AI353: 3.9100000000000003e-002 | AJ353: =H353+100*O353 -> 212.72 | AK353: 219.7 | AL353: 331 | AM353: 119.1 | AN353: 329 | AO353: -6.3e-002 | AP353: 10 | AQ353: 艾华转债!!
A354: 353 | B354: 128035 | C354: 大族转债! | D354: 2008 | E354: 大族激光 | F354: 机械装备 | G354: 专用设备 | H354: 126.79 | I354: -2.0000000000000001e-004 | J354: 2.3999999999999998e-003 | K354: 49.75 | L354: 5.1000000000000004e-003 | M354: 107.4 | N354: 51.9 | O354: 0.32299999999999995 | P354: 95.86 | Q354: 已到 | R354: 2年57天 | S354: 57天 | T354: 23 | U354: 72 | V354: 2.5000000000000001e-002 | W354: 4.2999999999999997e-002 | X354: 4.2000000000000003e-002 | Y354: 531 | Z354: 5 | AA354: -7.4999999999999997e-002 | AB354: -8.0799999999999997e-002 | AC354: -0.60399999999999998 | AD354: -0.623 | AE354: 102.69 | AF354: 100.01 | AG354: 0.43 | AH354: AA+ | AI354: 3.4099999999999998e-002 | AJ354: =H354+100*O354 -> 159.09 | AK354: 157.7 | AL354: 183 | AM354: 55 | AN354: 126 | AO354: 0.10199999999999999 | AP354: 17 | AQ354: 大族转债!
A355: 354 | B355: 110043 | C355: 无锡转债! | D355: 600908 | E355: 无锡银行 | F355: 金融 | G355: 银行行业 | H355: 122.05 | I355: -1.7000000000000001e-003 | J355: -4.3e-003 | K355: 5.65 | L355: -1.2199999999999999e-002 | M355: 108.3 | N355: 5.61 | O355: 0.21199999999999999 | P355: 100.71 | Q355: 已到 | R355: 2年50天 | S355: 无权 | T355: 29.2 | U355: 11 | V355: 3.0000000000000001e-003 | W355: 0.27800000000000002 | X355: 0.28000000000000003 | Y355: 105 | Z355: 0.82 | AA355: -5.5099999999999996e-002 | AB355: -6.1900000000000004e-002 | AC355: 无权 | AD355: 无权 | AE355: 无权 | AF355: 100.92 | AG355: 0.49 | AH355: AA+ | AI355: 3.4099999999999998e-002 | AJ355: =H355+100*O355 -> 143.25 | AK355: 143.4 | AL355: 60 | AM355: 42.5 | AN355: 43 | AO355: -2.e-003 | AP355: 22 | AQ355: 无锡转债!
A356: 355 | B356: 128034 | C356: 江银转债! | D356: 2807 | E356: 江阴银行 | F356: 金融 | G356: 银行行业 | H356: 109.992 | I356: -5.0000000000000001e-004 | J356: -2.9999999999999997e-004 | K356: 3.8 | L356: -2.5999999999999999e-003 | M356: 108.3 | N356: 4.32 | O356: 0.25 | P356: 87.96 | Q356: 已到 | R356: 2年46天 | S356: 无权 | T356: 17.6 | U356: 22 | V356: 1.1000000000000001e-002 | W356: 0.21299999999999999 | X356: 0.187 | Y356: 83 | Z356: 0.68 | AA356: -7.4000000000000003e-003 | AB356: -1.46e-002 | AC356: 无权 | AD356: 无权 | AE356: 无权 | AF356: 100.95 | AG356: 0.3 | AH356: AA+ | AI356: 3.4099999999999998e-002 | AJ356: =H356+100*O356 -> 134.99200000000002 | AK356: 132 | AL356: 15 | AM356: 31.1 | AN356: 8 | AO356: 8.0000000000000002e-003 | AP356: 29 | AQ356: 江银转债!
A357: 356 | B357: 128033 | C357: 迪龙转债! | D357: 2658 | E357: 雪迪龙 | F357: 城市公用 | G357: 三废处理 | H357: 123.112 | I357: 1.2999999999999999e-003 | J357: -9.5999999999999992e-003 | K357: 8.46 | L357: -1.7399999999999999e-002 | M357: 108.8 | N357: 8.56 | O357: 0.24600000000000002 | P357: 98.83 | Q357: 已到 | R357: 2年16天 | S357: 16天 | T357: 2.98 | U357: 25 | V357: 6.9000000000000006e-002 | W357: 5.5999999999999994e-002 | X357: 5.5e-002 | Y357: 53 | Z357: 2.18 | AA357: -5.9699999999999996e-002 | AB357: -6.7099999999999993e-002 | AC357: -0.90700000000000003 | AD357: -0.91799999999999993 | AE357: 100.74 | AF357: 100.75 | AG357: 0.48 | AH357: AA | AI357: 3.9100000000000003e-002 | AJ357: =H357+100*O357 -> 147.71199999999999 | AK357: 147.4 | AL357: 98 | AM357: 46.6 | AN357: 69 | AO357: -1.4999999999999999e-002 | AP357: 33 | AQ357: 迪龙转债!
A358: 357 | B358: 113017 | C358: 吉视转债! | D358: 601929 | E358: 吉视传媒 | F358: 传媒娱乐 | G358: 影视娱乐 | H358: 107.75 | I358: 7.8000000000000005e-003 | J358: -2.e-003 | K358: 1.97 | L358: 2.07e-002 | M358: 108.8 | N358: 2.23 | O358: 0.22 | P358: 88.34 | Q358: 已到 | R358: 2年16天 | S358: 16天 | T358: 15.6 | U358: 29 | V358: 1.7000000000000001e-002 | W358: 0.254 | X358: 0.22500000000000001 | Y358: 61 | Z358: 0.92 | AA358: 4.7999999999999996e-003 | AB358: -3.3e-003 | AC358: -0.30099999999999999 | AD358: -0.315 | AE358: 100.84 | AF358: 101.72 | AG358: 0.28 | AH358: AA+ | AI358: 3.4099999999999998e-002 | AJ358: =H358+100*O358 -> 129.75 | AK358: 127.2 | AL358: 5 | AM358: 25.4 | AN358: 4 | AO358: 1.9e-002 | AP358: 68 | AQ358: 吉视转债!
A359: 358 | B359: 128030 | C359: 天康转债!! | D359: 2100 | E359: 天康生物 | F359: 农业 | G359: 畜牧业 | H359: 202.4 | I359: 0. | J359: -8.6e-003 | K359: 9.21 | L359: -8.6e-003 | M359: 111.3 | N359: 7.39 | O359: 0.624 | P359: 124.63 | Q359: 已到 | R359: 2年11天 | S359: 11天 | T359: 0.88 | U359: 8.5 | V359: 4.7e-002 | W359: 9.0000000000000011e-003 | X359: 1.1000000000000001e-002 | Y359: 99 | Z359: 1.76 | AA359: -0.25900000000000001 | AB359: -0.26600000000000001 | AC359: <-100% | AD359: <-100% | AE359: 101.04 | AF359: 103.14 | AG359: 1 | AH359: AA | AI359: 3.9100000000000003e-002 | AJ359: =H359+100*O359 -> 264.80000000000001 | AK359: 280.2 | AL359: 355 | AM359: 177 | AN359: 353 | AO359: -1.e-003 | AP359: 9 | AQ359: 天康转债!!
A360: 359 | B360: 128029 | C360: 太阳转债!! | D360: 2078 | E360: 太阳纸业 | F360: 造纸包装 | G360: 造纸行业 | H360: 163.399 | I360: -1.06e-002 | J360: -3.9000000000000003e-003 | K360: 11.55 | L360: -1.4499999999999999e-002 | M360: 107 | N360: 8.45 | O360: 0.19500000000000001 | P360: 136.69 | Q360: 已到 | R360: 1年11天 | S360: 回售内 | T360: 9.09 | U360: 12 | V360: 8.0000000000000002e-003 | W360: 2.8999999999999998e-002 | X360: 4.0000000000000001e-002 | Y360: 310 | Z360: 1.64 | AA360: -0.33899999999999997 | AB360: -0.34700000000000003 | AC360: 回售内 | AD360: 回售内 | AE360: 100.17 | AF360: 103.4 | AG360: 1 | AH360: AA+ | AI360: 3.4099999999999998e-002 | AJ360: =H360+100*O360 -> 182.899 | AK360: 190.1 | AL360: 307 | AM360: 86.7 | AN360: 282 | AO360: -1.6e-002 | AP360: 7 | AQ360: 太阳转债!!
A361: 360 | B361: 123004 | C361: 铁汉转债! | D361: 300197 | E361: 节能铁汉 | F361: 城市公用 | G361: 生态环境 | H361: 107.502 | I361: 4.6999999999999993e-003 | J361: -4.6999999999999993e-003 | K361: 2.79 | L361: 0. | M361: 108.8 | N361: 3.82 | O361: 0.47200000000000003 | P361: 73.04 | Q361: 已到 | R361: 2年7天 | S361: 7天 | T361: 8.03 | U361: 3.9 | V361: 5.0000000000000001e-003 | W361: 0.10199999999999999 | X361: 7.400000000000001e-002 | Y361: 79 | Z361: 1.23 | AA361: 6.0999999999999995e-003 | AB361: -2.2000000000000001e-003 | AC361: -0.32899999999999996 | AD361: -0.34499999999999997 | AE361: 100.84 | AF361: 100.84 | AG361: 0.09 | AH361: AA | AI361: 3.9100000000000003e-002 | AJ361: =H361+100*O361 -> 154.702 | AK361: 142 | AL361: 49 | AM361: 41.1 | AN361: 40 | AO361: -1.2e-002 | AP361: 49 | AQ361: 铁汉转债!
A362: 361 | B362: 128026 | C362: 众兴转债! | D362: 2772 | E362: 众兴菌业 | F362: 农业 | G362: 种植业 | H362: 113.44 | I362: 2.2099999999999998e-002 | J362: -2.0999999999999999e-003 | K362: 9.1 | L362: 0.10000000000000001 | M362: 109.3 | N362: 11.36 | O362: 0.41600000000000004 | P362: 80.11 | Q362: 已到 | R362: 2年2.1天 | S362: 2.1天 | T362: 4.09 | U362: 318 | V362: 0.68000000000000005 | W362: 0.109 | X362: 8.6999999999999994e-002 | Y362: 38 | Z362: 1.23 | AA362: -1.8799999999999997e-002 | AB362: -2.7200000000000002e-002 | AC362: -0.65599999999999992 | AD362: -0.67400000000000004 | AE362: 100.8 | AF362: 97.49 | AG362: 0.2 | AH362: AA- | AI362: 6.0100000000000001e-002 | AJ362: =H362+100*O362 -> 155.03999999999999 | AK362: 146.8 | AL362: 88 | AM362: 46 | AN362: 61 | AO362: 0.14499999999999999 | AP362: 57 | AQ362: 众兴转债!
A363: 362 | B363: 128025 | C363: 特一转债! | D363: 2728 | E363: 特一药业 | F363: 医药 | G363: 化学制药 | H363: 126 | I363: -1.06e-002 | J363: -1.2199999999999999e-002 | K363: 14.31 | L363: -3.7699999999999997e-002 | M363: 107.5 | N363: 13.8 | O363: 0.215 | P363: 103.7 | Q363: 已到 | R363: 1.99年 | S363: 回售内 | T363: 2.98 | U363: 218 | V363: 0.57999999999999996 | W363: 9.4e-002 | X363: 9.6999999999999989e-002 | Y363: 32 | Z363: 2.92 | AA363: -7.7300000000000008e-002 | AB363: -8.3800000000000013e-002 | AC363: 回售内 | AD363: 回售内 | AE363: 100.25 | AF363: 95.81 | AG363: 0.61 | AH363: AA- | AI363: 6.0100000000000001e-002 | AJ363: =H363+100*O363 -> 147.5 | AK363: 148.3 | AL363: 104 | AM363: 48.1 | AN363: 78 | AO363: -8.0000000000000002e-003 | AP363: 47 | AQ363: 特一转债!
A364: 363 | B364: 128023 | C364: 亚太转债! | D364: 2284 | E364: 亚太股份 | F364: 汽车 | G364: 零部件制 | H364: 128.35 | I364: 5.2900000000000003e-002 | J364: -2.41e-002 | K364: 10.05 | L364: 6.9099999999999995e-002 | M364: 109.8 | N364: 10.34 | O364: 0.32100000000000001 | P364: 97.2 | Q364: 已到 | R364: 1.98年 | S364: 回售内 | T364: 9.99 | U364: 442 | V364: 0.34399999999999997 | W364: 0.13500000000000001 | X364: 0.13100000000000001 | Y364: 74 | Z364: 2.96 | AA364: -7.6399999999999996e-002 | AB364: -8.4700000000000011e-002 | AC364: 回售内 | AD364: 回售内 | AE364: 100.3 | AF364: 101.83 | AG364: 0.42 | AH364: AA | AI364: 3.9100000000000003e-002 | AJ364: =H364+100*O364 -> 160.44999999999999 | AK364: 159.5 | AL364: 192 | AM364: 57.7 | AN364: 139 | AO364: 8.900000000000001e-002 | AP364: 56 | AQ364: 亚太转债!
A365: 364 | B365: 128022 | C365: 众信转债! | D365: 2707 | E365: 众信旅游 | F365: 旅游餐饮 | G365: 旅游 | H365: 111.116 | I365: -3.2899999999999999e-002 | J365: 3.2899999999999999e-002 | K365: 5.26 | L365: -2.0499999999999997e-002 | M365: 107.5 | N365: 7.92 | O365: 0.67299999999999993 | P365: 66.41 | Q365: 已到 | R365: 1.97年 | S365: 回售内 | T365: 4.56 | U365: 434 | V365: 0.85599999999999998 | W365: 9.6000000000000002e-002 | X365: 6.3e-002 | Y365: 48 | Z365: 9.23 | AA365: -1.67e-002 | AB365: -2.3700000000000002e-002 | AC365: 回售内 | AD365: 回售内 | AE365: 100.25 | AF365: 92.27 | AG365: 0 | AH365: A | AI365: 8.1099999999999992e-002 | AJ365: =H365+100*O365 -> 178.416 | AK365: 155.8 | AL365: 173 | AM365: 55.6 | AN365: 130 | AO365: -4.4999999999999998e-002 | AP365: 37 | AQ365: 众信转债!
A366: 365 | B366: 128021 | C366: 兄弟转债!! | D366: 2562 | E366: 兄弟科技 | F366: 医药 | G366: 原料药 | H366: 117.17 | I366: 1.5e-003 | J366: -3.5999999999999999e-003 | K366: 4.32 | L366: -1.1399999999999999e-002 | M366: 107.5 | N366: 5.19 | O366: 0.40799999999999997 | P366: 83.24 | Q366: 已到 | R366: 1.96年 | S366: 回售内 | T366: 2.65 | U366: 3.6 | V366: 1.1000000000000001e-002 | W366: 5.7999999999999996e-002 | X366: 4.8000000000000001e-002 | Y366: 46 | Z366: 1.56 | AA366: -4.3200000000000002e-002 | AB366: -5.0000000000000003e-002 | AC366: 回售内 | AD366: 回售内 | AE366: 100.25 | AF366: 99.75 | AG366: 0.19 | AH366: AA | AI366: 3.9100000000000003e-002 | AJ366: =H366+100*O366 -> 157.97 | AK366: 151.1 | AL366: 134 | AM366: 50.9 | AN366: 98 | AO366: -7.0000000000000007e-002 | AP366: 19 | AQ366: 兄弟转债!!
A367: 366 | B367: 123002 | C367: 国祯转债!! | D367: 300388 | E367: 节能国祯 | F367: 城市公用 | G367: 三废处理 | H367: 115.884 | I367: 4.7999999999999996e-003 | J367: -6.5000000000000006e-003 | K367: 7.44 | L367: -5.3e-003 | M367: 107.5 | N367: 8.36 | O367: 0.30199999999999999 | P367: 89 | Q367: 已到 | R367: 1.95年 | S367: 回售内 | T367: 2.52 | U367: 2.3 | V367: 8.0000000000000002e-003 | W367: 4.8000000000000001e-002 | X367: 4.2999999999999997e-002 | Y367: 52 | Z367: 1.41 | AA367: -3.7999999999999999e-002 | AB367: -4.4900000000000002e-002 | AC367: 回售内 | AD367: 回售内 | AE367: 100.25 | AF367: 99.79 | AG367: 0.32 | AH367: AA | AI367: 3.9100000000000003e-002 | AJ367: =H367+100*O367 -> 146.084 | AK367: 142.8 | AL367: 55 | AM367: 42.5 | AN367: 44 | AO367: -2.e-003 | AP367: 18 | AQ367: 国祯转债!!
A368: 367 | B368: 110038 | C368: 济川转债! | D368: 600566 | E368: 济川药业 | F368: 医药 | G368: 中药 | H368: 116.81 | I368: 9.1000000000000004e-003 | J368: -7.6e-003 | K368: 19.07 | L368: 2.58e-002 | M368: 106 | N368: 23.4 | O368: 0.433 | P368: 81.5 | Q368: 已到 | R368: 0.92年 | S368: 回售内 | T368: 6.27 | U368: 61 | V368: 8.4000000000000005e-002 | W368: 3.7000000000000005e-002 | X368: 2.9999999999999999e-002 | Y368: 169 | Z368: 1.98 | AA368: -9.98e-002 | AB368: -0.111 | AC368: 回售内 | AD368: 回售内 | AE368: 101 | AF368: 102.61 | AG368: 0.06 | AH368: AA | AI368: 3.5799999999999998e-002 | AJ368: =H368+100*O368 -> 160.11000000000001 | AK368: 152.1 | AL368: 147 | AM368: 49.5 | AN368: 85 | AO368: 1.3999999999999999e-002 | AP368: 23 | AQ368: 济川转债!
A369: 368 | B369: 113502 | C369: 嘉澳转债! | D369: 603822 | E369: 嘉澳环保 | F369: 化工 | G369: 化工 | H369: 128.53 | I369: 6.7000000000000002e-003 | J369: -4.1999999999999997e-003 | K369: 42.29 | L369: 5.6999999999999993e-003 | M369: 109.8 | N369: 44.64 | O369: 0.35700000000000004 | P369: 94.74 | Q369: 已到 | R369: 1.92年 | S369: 回售内 | T369: 1.84 | U369: 16 | V369: 6.7000000000000004e-002 | W369: 5.9000000000000004e-002 | X369: 5.5999999999999994e-002 | Y369: 31 | Z369: 3.74 | AA369: -7.9600000000000004e-002 | AB369: -8.8100000000000012e-002 | AC369: 回售内 | AD369: 回售内 | AE369: 100.3 | AF369: 98.28 | AG369: 0.43 | AH369: AA- | AI369: 6.0100000000000001e-002 | AJ369: =H369+100*O369 -> 164.23000000000002 | AK369: 162.3 | AL369: 215 | AM369: 62 | AN369: 169 | AO369: -8.199999999999999e-002 | AP369: 34 | AQ369: 嘉澳转债!
A370: 369 | B370: 113016 | C370: 小康转债!! | D370: 601127 | E370: 小康股份 | F370: 汽车 | G370: 零部件制 | H370: 426.09 | I370: -2.2400000000000003e-002 | J370: -1.1299999999999999e-002 | K370: 69.08 | L370: -3.3799999999999997e-002 | M370: 107.8 | N370: 16.96 | O370: 4.5999999999999999e-002 | P370: 407.31 | Q370: 已到 | R370: 1.90年 | S370: 回售内 | T370: 2.07 | U370: 460 | V370: 0.52100000000000002 | W370: 2.e-003 | X370: 9.0000000000000011e-003 | Y370: 939 | Z370: 13.07 | AA370: -0.498 | AB370: -0.501 | AC370: 回售内 | AD370: 回售内 | AE370: 100.3 | AF370: 96.56 | AG370: 1 | AH370: AA- | AI370: 6.0100000000000001e-002 | AJ370: =H370+100*O370 -> 430.69 | AK370: 444.9 | AL370: 371 | AM370: 344.6 | AN370: 371 | AO370: 3.5000000000000003e-002 | AP370: 34 | AQ370: 小康转债!!
A371: 370 | B371: 128017 | C371: 金禾转债!! | D371: 2597 | E371: 金禾实业 | F371: 化工 | G371: 化工 | H371: 255.1 | I371: -2.9999999999999997e-004 | J371: -1.18e-002 | K371: 49.37 | L371: -1.2199999999999999e-002 | M371: 107.5 | N371: 21.97 | O371: 0.13500000000000001 | P371: 224.72 | Q371: 已到 | R371: 1.89年 | S371: 回售内 | T371: 5.52 | U371: 21 | V371: 1.4999999999999999e-002 | W371: 2.e-002 | X371: 4.4999999999999998e-002 | Y371: 277 | Z371: 5.33 | AA371: -0.36899999999999999 | AB371: -0.373 | AC371: 回售内 | AD371: 回售内 | AE371: 100.25 | AF371: 100.03 | AG371: 0.99 | AH371: AA | AI371: 3.9100000000000003e-002 | AJ371: =H371+100*O371 -> 268.60000000000002 | AK371: 285.5 | AL371: 358 | AM371: 185.2 | AN371: 356 | AO371: 4.0000000000000001e-003 | AP371: 9 | AQ371: 金禾转债!!
A372: 371 | B372: 113013 | C372: 国君转债! | D372: 601211 | E372: 国泰君安 | F372: 金融 | G372: 证券行业 | H372: 125.04 | I372: -4.0000000000000001e-003 | J372: 5.9999999999999995e-004 | K372: 17.46 | L372: -9.1000000000000004e-003 | M372: 106.8 | N372: 18.45 | O372: 0.32100000000000001 | P372: 94.63 | Q372: 已到 | R372: 1.57年 | S372: 无权 | T372: 69.9 | U372: 31 | V372: 4.0000000000000001e-003 | W372: 4.4999999999999998e-002 | X372: 4.2999999999999997e-002 | Y372: 1555. | Z372: 1.17 | AA372: -9.6500000000000002e-002 | AB372: -0.10400000000000001 | AC372: 无权 | AD372: 无权 | AE372: 无权 | AF372: 101.69 | AG372: 0.37 | AH372: AAA | AI372: 3.2099999999999997e-002 | AJ372: =H372+100*O372 -> 157.14000000000001 | AK372: 155.4 | AL372: 170 | AM372: 53.8 | AN372: 116 | AO372: 1.8000000000000002e-002 | AP372: 11 | AQ372: 国君转债!
A373: 372 | B373: 128015 | C373: 久其转债!! | D373: 2279 | E373: 久其软件 | F373: 计算机及 | G373: 软件开发 | H373: 106.661 | I373: 0. | J373: 0. | K373: 4.43 | L373: -8.8999999999999999e-003 | M373: 109.5 | N373: 6.97 | O373: 0.67799999999999994 | P373: 63.56 | Q373: 已到 | R373: 1.49年 | S373: 回售内 | T373: 7.79 | U373: 7.5 | V373: 9.0000000000000011e-003 | W373: 0.248 | X373: 0.157 | Y373: 31 | Z373: 3.93 | AA373: 1.7899999999999999e-002 | AB373: 5.8999999999999999e-003 | AC373: 回售内 | AD373: 回售内 | AE373: 100.25 | AF373: 98.94 | AG373: 0 | AH373: A+ | AI373: 7.1099999999999997e-002 | AJ373: =H373+100*O373 -> 174.46100000000001 | AK373: 149.8 | AL373: 123 | AM373: 49.5 | AN373: 86 | AO373: -1.1000000000000001e-002 | AP373: 69 | AQ373: 久其转债!!
A374: 373 | B374: 127004 | C374: 模塑转债!! | D374: 700 | E374: 模塑科技 | F374: 汽车 | G374: 零部件制 | H374: 167.5 | I374: 1.5e-003 | J374: -1.5e-003 | K374: 4.89 | L374: 4.0999999999999995e-003 | M374: 111.8 | N374: 7.24 | O374: 1.48 | P374: 67.54 | Q374: 已到 | R374: 1.47年 | S374: 回售内 | T374: 1.31 | U374: 33 | V374: 0.151 | W374: 2.8999999999999998e-002 | X374: 2.e-002 | Y374: 45 | Z374: 1.97 | AA374: -0.24199999999999999 | AB374: -0.252 | AC374: 回售内 | AD374: 回售内 | AE374: 100.3 | AF374: 100.95 | AG374: 0 | AH374: AA- | AI374: 6.0100000000000001e-002 | AJ374: =H374+100*O374 -> 315.5 | AK374: 267.5 | AL374: 351 | AM374: 166.5 | AN374: 349 | AO374: -2.7999999999999997e-002 | AP374: 25 | AQ374: 模塑转债!!
A375: 374 | B375: 128014 | C375: 永东转债! | D375: 2753 | E375: 永东股份 | F375: 化工 | G375: 化工 | H375: 115.287 | I375: 1.9e-003 | J375: -1.7000000000000001e-003 | K375: 9.5 | L375: 2.0999999999999999e-003 | M375: 109.8 | N375: 12.52 | O375: 0.51900000000000002 | P375: 75.88 | Q375: 已到 | R375: 1.35年 | S375: 回售内 | T375: 3.37 | U375: 6.3 | V375: 1.6e-002 | W375: 9.4e-002 | X375: 7.2000000000000008e-002 | Y375: 36 | Z375: 1.71 | AA375: -3.5900000000000001e-002 | AB375: -4.8799999999999996e-002 | AC375: 回售内 | AD375: 回售内 | AE375: 100.3 | AF375: 101.59 | AG375: 0.1 | AH375: AA- | AI375: 6.0100000000000001e-002 | AJ375: =H375+100*O375 -> 167.18700000000001 | AK375: 154.7 | AL375: 166 | AM375: 53.1 | AN375: 112 | AO375: 4.2999999999999997e-002 | AP375: 37 | AQ375: 永东转债!
A376: 375 | B376: 113011 | C376: 光大转债 | D376: 601818 | E376: 光大银行 | F376: 金融 | G376: 银行行业 | H376: 114.48 | I376: -2.3e-003 | J376: 2.0000000000000001e-004 | K376: 3.39 | L376: -5.8999999999999999e-003 | M376: 106.8 | N376: 3.55 | O376: 0.19899999999999998 | P376: 95.49 | Q376: 已到 | R376: 1.26年 | S376: 无权 | T376: 242 | U376: 233 | V376: 8.0000000000000002e-003 | W376: 0.13200000000000001 | X376: 0.126 | Y376: 1832. | Z376: 0.5 | AA376: -5.4199999999999998e-002 | AB376: -6.3700000000000007e-002 | AC376: 无权 | AD376: 无权 | AE376: 无权 | AF376: 102.68 | AG376: 0.35 | AH376: AAA | AI376: 3.2099999999999997e-002 | AJ376: =H376+100*O376 -> 134.38 | AK376: 133.5 | AL376: 19 | AM376: 30.8 | AN376: 7 | AO376: 6.9999999999999993e-003 | AP376: 16 | AQ376: 光大转债
A377: 376 | B377: 128013 | C377: 洪涛转债! | D377: 2325 | E377: 洪涛股份 | F377: 建筑 | G377: 装饰工程 | H377: 118.659 | I377: 6.9999999999999993e-003 | J377: 4.5999999999999999e-003 | K377: 2.68 | L377: 1.52e-002 | M377: 108 | N377: 2.32 | O377: 2.7000000000000003e-002 | P377: 115.52 | Q377: 已到 | R377: 0.63年 | S377: 回售内 | T377: 11.4 | U377: 34 | V377: 2.5000000000000001e-002 | W377: 0.33500000000000002 | X377: 0.38700000000000001 | Y377: 34 | Z377: 1.21 | AA377: -0.13900000000000001 | AB377: -0.159 | AC377: 回售内 | AD377: 回售内 | AE377: 100.33 | AF377: 102.42 | AG377: 0.76 | AH377: A- | AI377: 8.7799999999999989e-002 | AJ377: =H377+100*O377 -> 121.35900000000001 | AK377: 121.8 | AL377: 2 | AM377: 19.4 | AN377: 1 | AO377: 1.1000000000000001e-002 | AP377: 100 | AQ377: 洪涛转债!
A378: 377 | B378: 127003 | C378: 海印转债! | D378: 861 | E378: 海印股份 | F378: 商业零售 | G378: 商场 | H378: 121.978 | I378: 2.0099999999999996e-002 | J378: 2.2000000000000001e-003 | K378: 3.35 | L378: 3.7200000000000004e-002 | M378: 110 | N378: 2.99 | O378: 8.900000000000001e-002 | P378: 112.04 | Q378: 已到 | R378: 0.49年 | S378: 回售内 | T378: 6.74 | U378: 112 | V378: 0.13699999999999998 | W378: 8.5999999999999993e-002 | X378: 9.6999999999999989e-002 | Y378: 78 | Z378: 2.12 | AA378: -0.19 | AB378: -0.22 | AC378: 回售内 | AD378: 回售内 | AE378: 100.33 | AF378: 108.08 | AG378: 0.6 | AH378: AA | AI378: 3.6499999999999998e-002 | AJ378: =H378+100*O378 -> 130.87799999999999 | AK378: 131.9 | AL378: 14 | AM378: 23.8 | AN378: 3 | AO378: 0.221 | AP378: 73 | AQ378: 海印转债!
A379: 378 | B379: 113009 | C379: 广汽转债! | D379: 601238 | E379: 广汽集团 | F379: 汽车 | G379: 乘用车 | H379: 124.7 | I379: -1.e-003 | J379: -3.0000000000000001e-003 | K379: 17.12 | L379: -4.0999999999999995e-003 | M379: 106 | N379: 13.92 | O379: 1.3999999999999999e-002 | P379: 122.99 | Q379: 已到 | R379: 42天 | S379: 回售内 | T379: 25.3 | U379: 269 | V379: 8.5000000000000006e-002 | W379: 1.3999999999999999e-002 | X379: 1.8000000000000002e-002 | Y379: 1773. | Z379: 2.03 | AA379: <-100% | AB379: <-100% | AC379: 回售内 | AD379: 回售内 | AE379: 100.27 | AF379: 105.65 | AG379: 1 | AH379: AAA | AI379: 2.92e-002 | AJ379: =H379+100*O379 -> 126.10000000000001 | AK379: 126.4 | AL379: 4 | AM379: 20.8 | AN379: 2 | AO379: 4.0000000000000001e-002 | AP379: 23 | AQ379: 广汽转债!
A380: 379 | B380: 110034 | C380: 九州转债! | D380: 600998 | E380: 九州通 | F380: 医药 | G380: 医药商业 | H380: 107.83 | I380: -2.0000000000000001e-004 | J380: 2.0000000000000001e-004 | K380: 13.79 | L380: -7.9000000000000008e-003 | M380: 108 | N380: 17.83 | O380: 0.39399999999999996 | P380: 77.34 | Q380: 已到 | R380: 35天 | S380: 回售内 | T380: 15 | U380: 31 | V380: 1.9e-002 | W380: 5.7999999999999996e-002 | X380: 4.4999999999999998e-002 | Y380: 258 | Z380: 1.23 | AA380: 1.6500000000000001e-002 | AB380: -0.13 | AC380: 回售内 | AD380: 回售内 | AE380: 103 | AF380: 107.68 | AG380: 0 | AH380: AA+ | AI380: 3.1200000000000002e-002 | AJ380: =H380+100*O380 -> 147.22999999999999 | AK380: 138.3 | AL380: 32 | AM380: 30.6 | AN380: 6 | AO380: 2.e-003 | AP380: 30 | AQ380: 九州转债!